Bluetooth monitor ver 5.72
= Note: Linux version 7.0.0-31-generic (x86_64)                        0.986968
= Note: Bluetooth subsystem version 2.22                               0.986971
= New Index: 00:00:00:00:00:00 (Primary,UART,hci1)              [hci1] 0.986972
= New Index: 48:5F:99:8E:E0:64 (Primary,USB,hci0)               [hci0] 0.986972
= Open Index: 00:00:00:00:00:00                                 [hci1] 1.120602
= Index Info: 00:00:00:00:00:00 (Nordic Semiconductor ASA)      [hci1] 1.120606
@ USER Open: main (privileged) version 2.22            {0x0001} [hci1] 1.120608
< HCI Command: Reset (0x03|0x0003) plen 0                    #1 [hci1] 1.120987
> HCI Event: Command Complete (0x0e) plen 4                  #2 [hci1] 1.121496
      Reset (0x03|0x0003) ncmd 1
        Status: Success (0x00)
< HCI Command: Read Local Supported... (0x04|0x0003) plen 0  #3 [hci1] 1.140620
> HCI Event: Command Complete (0x0e) plen 12                 #4 [hci1] 1.141083
      Read Local Supported Features (0x04|0x0003) ncmd 1
        Status: Success (0x00)
        Features: 0x00 0x00 0x00 0x00 0x60 0x00 0x00 0x00
          BR/EDR Not Supported
          LE Supported (Controller)
< HCI Command: Read Local Version In.. (0x04|0x0001) plen 0  #5 [hci1] 1.160607
> HCI Event: Command Complete (0x0e) plen 12                 #6 [hci1] 1.161172
      Read Local Version Information (0x04|0x0001) ncmd 1
        Status: Success (0x00)
        HCI version: Reserved (0x11) - Revision 12345 (0x3039)
        LMP version: Reserved (0x11) - Subversion 12345 (0x3039)
        Manufacturer: Nordic Semiconductor ASA (89)
< HCI Command: Read Local Supported... (0x04|0x0002) plen 0  #7 [hci1] 1.180608
> HCI Event: Command Complete (0x0e) plen 68                 #8 [hci1] 1.181657
      Read Local Supported Commands (0x04|0x0002) ncmd 1
        Status: Success (0x00)
        Commands: 115 entries
          Disconnect (Octet 0 - Bit 5)
          Read Remote Version Information (Octet 2 - Bit 7)
          Set Event Mask (Octet 5 - Bit 6)
          Reset (Octet 5 - Bit 7)
          Read Connection Accept Timeout (Octet 7 - Bit 2)
          Write Connection Accept Timeout (Octet 7 - Bit 3)
          Read Transmit Power Level (Octet 10 - Bit 2)
          Set Controller To Host Flow Control (Octet 10 - Bit 5)
          Host Buffer Size (Octet 10 - Bit 6)
          Host Number of Completed Packets (Octet 10 - Bit 7)
          Read Local Version Information (Octet 14 - Bit 3)
          Read Local Supported Features (Octet 14 - Bit 5)
          Read BD ADDR (Octet 15 - Bit 1)
          Read RSSI (Octet 15 - Bit 5)
          Set Event Mask Page 2 (Octet 22 - Bit 2)
          LE Set Event Mask (Octet 25 - Bit 0)
          LE Read Buffer Size (Octet 25 - Bit 1)
          LE Read Local Supported Features (Octet 25 - Bit 2)
          LE Set Random Address (Octet 25 - Bit 4)
          LE Set Advertising Parameters (Octet 25 - Bit 5)
          LE Read Advertising Channel TX Power (Octet 25 - Bit 6)
          LE Set Advertising Data (Octet 25 - Bit 7)
          LE Set Scan Response Data (Octet 26 - Bit 0)
          LE Set Advertise Enable (Octet 26 - Bit 1)
          LE Set Scan Parameters (Octet 26 - Bit 2)
          LE Set Scan Enable (Octet 26 - Bit 3)
          LE Create Connection (Octet 26 - Bit 4)
          LE Create Connection Cancel (Octet 26 - Bit 5)
          LE Read Accept List Size (Octet 26 - Bit 6)
          LE Clear Accept List (Octet 26 - Bit 7)
          LE Add Device To Accept List (Octet 27 - Bit 0)
          LE Remove Device From Accept List (Octet 27 - Bit 1)
          LE Connection Update (Octet 27 - Bit 2)
          LE Set Host Channel Classification (Octet 27 - Bit 3)
          LE Read Channel Map (Octet 27 - Bit 4)
          LE Read Remote Used Features (Octet 27 - Bit 5)
          LE Encrypt (Octet 27 - Bit 6)
          LE Rand (Octet 27 - Bit 7)
          LE Start Encryption (Octet 28 - Bit 0)
          LE Long Term Key Request Reply (Octet 28 - Bit 1)
          LE Long Term Key Request Neg Reply (Octet 28 - Bit 2)
          LE Read Supported States (Octet 28 - Bit 3)
          Read Authenticated Payload Timeout (Octet 32 - Bit 4)
          Write Authenticated Payload Timeout (Octet 32 - Bit 5)
          LE Set Data Length (Octet 33 - Bit 6)
          LE Read Suggested Default Data Length (Octet 33 - Bit 7)
          LE Write Suggested Default Data Length (Octet 34 - Bit 0)
          LE Add Device To Resolving List (Octet 34 - Bit 3)
          LE Remove Device From Resolving List (Octet 34 - Bit 4)
          LE Clear Resolving List (Octet 34 - Bit 5)
          LE Read Resolving List Size (Octet 34 - Bit 6)
          LE Set Address Resolution Enable (Octet 35 - Bit 1)
          LE Set Resolvable Private Address Timeout (Octet 35 - Bit 2)
          LE Read Maximum Data Length (Octet 35 - Bit 3)
          LE Read PHY (Octet 35 - Bit 4)
          LE Set Default PHY (Octet 35 - Bit 5)
          LE Set PHY (Octet 35 - Bit 6)
          LE Set Advertising Set Random Address (Octet 36 - Bit 1)
          LE Set Extended Advertising Parameters (Octet 36 - Bit 2)
          LE Set Extended Advertising Data (Octet 36 - Bit 3)
          LE Set Extended Scan Response Data (Octet 36 - Bit 4)
          LE Set Extended Advertising Enable (Octet 36 - Bit 5)
          LE Read Maximum Advertising Data Length (Octet 36 - Bit 6)
          LE Read Number of Supported Advertising Sets (Octet 36 - Bit 7)
          LE Remove Advertising Set (Octet 37 - Bit 0)
          LE Clear Advertising Sets (Octet 37 - Bit 1)
          LE Set Periodic Advertising Parameters (Octet 37 - Bit 2)
          LE Set Periodic Advertising Data (Octet 37 - Bit 3)
          LE Set Periodic Advertising Enable (Octet 37 - Bit 4)
          LE Set Extended Scan Parameters (Octet 37 - Bit 5)
          LE Set Extended Scan Enable (Octet 37 - Bit 6)
          LE Extended Create Connection (Octet 37 - Bit 7)
          LE Periodic Advertising Create Sync (Octet 38 - Bit 0)
          LE Periodic Advertising Create Sync Cancel (Octet 38 - Bit 1)
          LE Periodic Advertising Terminate Sync (Octet 38 - Bit 2)
          LE Add Device To Periodic Advertiser List (Octet 38 - Bit 3)
          LE Remove Device From Periodic Advertiser List (Octet 38 - Bit 4)
          LE Clear Periodic Advertiser List (Octet 38 - Bit 5)
          LE Read Periodic Advertiser List Size (Octet 38 - Bit 6)
          LE Read Transmit Power (Octet 38 - Bit 7)
          LE Read RF Path Compensation (Octet 39 - Bit 0)
          LE Write RF Path Compensation (Octet 39 - Bit 1)
          LE Set Privacy Mode (Octet 39 - Bit 2)
          LE Periodic Advertising Receive Enable (Octet 40 - Bit 5)
          LE Periodic Advertising Sync Transfer (Octet 40 - Bit 6)
          LE Periodic Advertising Set Info Transfer (Octet 40 - Bit 7)
          LE Periodic Advertising Sync Transfer Parameters (Octet 41 - Bit 0)
          LE Set Default Periodic Advertisng Sync Transfer Parameters (Octet 41 - Bit 1)
          LE Read Buffer v2 (Octet 41 - Bit 5)
          LE Read ISO TX Sync (Octet 41 - Bit 6)
          LE Set Connected Isochronous Group Parameters (Octet 41 - Bit 7)
          LE Set Connected Isochronous Group Parameters Test (Octet 42 - Bit 0)
          LE Create Connected Isochronous Stream (Octet 42 - Bit 1)
          LE Remove Connected Isochronous Group (Octet 42 - Bit 2)
          LE Accept Connected Isochronous Stream Request (Octet 42 - Bit 3)
          LE Reject Connected Isochronous Stream Request (Octet 42 - Bit 4)
          LE Create Broadcast Isochronous Group (Octet 42 - Bit 5)
          LE Create Broadcast Isochronous Group Test (Octet 42 - Bit 6)
          LE Terminate Broadcast Isochronous Group (Octet 42 - Bit 7)
          LE Broadcast Isochronous Group Create Sync (Octet 43 - Bit 0)
          LE Broadcast Isochronous Group Terminate Sync (Octet 43 - Bit 1)
          LE Request Peer SCA (Octet 43 - Bit 2)
          LE Setup Isochronous Data Path (Octet 43 - Bit 3)
          LE Remove Isochronous Data Path (Octet 43 - Bit 4)
          LE Isochronous Transmit Test (Octet 43 - Bit 5)
          LE Isochronous Receive Test (Octet 43 - Bit 6)
          LE Isochronous Read Test Counters (Octet 43 - Bit 7)
          LE Isochronous Read Test Counters (Octet 44 - Bit 0)
          LE Set Host Feature (Octet 44 - Bit 1)
          Octet 44 - Bit 2 
          Octet 45 - Bit 6 
          Octet 46 - Bit 0 
          Octet 46 - Bit 1 
          Octet 46 - Bit 2 
          Octet 47 - Bit 4 
< HCI Command: Host Buffer Size (0x03|0x0033) plen 7         #9 [hci1] 1.200608
        ACL MTU: 255  ACL max packet: 16
        SCO MTU: 0    SCO max packet: 0
> HCI Event: Command Complete (0x0e) plen 4                 #10 [hci1] 1.201105
      Host Buffer Size (0x03|0x0033) ncmd 1
        Status: Success (0x00)
< HCI Command: Set Controller To Ho.. (0x03|0x0031) plen 1  #11 [hci1] 1.220719
        Flow control: ACL Data Packets (0x01)
> HCI Event: Command Complete (0x0e) plen 4                 #12 [hci1] 1.221221
      Set Controller To Host Flow Control (0x03|0x0031) ncmd 1
        Status: Success (0x00)
< HCI Command: LE Read Local Suppor.. (0x08|0x0003) plen 0  #13 [hci1] 1.240610
> HCI Event: Command Complete (0x0e) plen 12                #14 [hci1] 1.241078
      LE Read Local Supported Features (0x08|0x0003) ncmd 1
        Status: Success (0x00)
        Features: 0xfd 0x79 0x00 0xf7 0x30 0x01 0x00 0x00
          LE Encryption
          Extended Reject Indication
          Peripheral-initiated Features Exchange
          LE Ping
          LE Data Packet Length Extension
          LL Privacy
          Extended Scanner Filter Policies
          LE 2M PHY
          LE Coded PHY
          LE Extended Advertising
          LE Periodic Advertising
          Channel Selection Algorithm #2
          Periodic Advertising Sync Transfer - Sender
          Periodic Advertising Sync Transfer - Recipient
          Sleep Clock Accuracy Updates
          Connected Isochronous Stream - Central
          Connected Isochronous Stream - Peripheral
          Isochronous Broadcaster
          Synchronized Receiver
          Periodic Advertising ADI support
          Connection Subrating
          Unknown features (0x0000010000000000)
< HCI Command: LE Set Host Feature (0x08|0x0074) plen 2     #15 [hci1] 1.260599
        Bit Number: 32
          Connected Isochronous Stream (Host Support)
        Bit Value: 1
> HCI Event: Command Complete (0x0e) plen 4                 #16 [hci1] 1.260997
      LE Set Host Feature (0x08|0x0074) ncmd 1
        Status: Success (0x00)
< HCI Command: LE Read Buffer v2 (0x08|0x0060) plen 0       #17 [hci1] 1.280599
> HCI Event: Command Complete (0x0e) plen 10                #18 [hci1] 1.281047
      LE Read Buffer v2 (0x08|0x0060) ncmd 1
        Status: Success (0x00)
        ACL MTU: 27
        ACL max packet: 3
        ISO MTU: 318
        ISO max packet: 3
< HCI Command: LE Read Maximum Adve.. (0x08|0x003a) plen 0  #19 [hci1] 1.300652
> HCI Event: Command Complete (0x0e) plen 6                 #20 [hci1] 1.301188
      LE Read Maximum Advertising Data Length (0x08|0x003a) ncmd 1
        Status: Success (0x00)
        Max length: 1650
< HCI Command: LE Read Supported St.. (0x08|0x001c) plen 0  #21 [hci1] 1.320550
> HCI Event: Command Complete (0x0e) plen 12                #22 [hci1] 1.321083
      LE Read Supported States (0x08|0x001c) ncmd 1
        Status: Success (0x00)
        States: 0x000003ff3e0306ff
          Non-connectable Advertising State
          Scannable Advertising State
          Connectable Advertising State
          High Duty Cycle Directed Advertising State
          Passive Scanning State
          Active Scanning State
          Initiating State
            and Connection State (Central Role)
          Connection State (Peripheral Role)
          Scannable Advertising State
            and Passive Scanning State
          Connectable Advertising State
            and Passive Scanning State
          Non-connectable Advertising State
            and Initiating State
          Scannable Advertising State
            and Initiating State
          Active Scanning State
            and Connection State (Central Role)
          Passive Scanning State
            and Connection State (Peripheral Role)
          Active Scanning State
            and Connection State (Peripheral Role)
          Initiating State
            and Connection State (Central Role)
            and Central Role & Central Role
          Low Duty Cycle Directed Advertising State
          Connectable Advertising State
            and Initiating State
            and Central Role & Peripheral Role
          High Duty Cycle Directed Advertising State
            and Initiating State
            and Central Role & Peripheral Role
          Low Duty Cycle Directed Advertising State
            and Initiating State
            and Central Role & Peripheral Role
          Connectable Advertising State
            and Connection State (Central Role)
            and Central Role & Peripheral Role
          High Duty Cycle Directed Advertising State
            and Connection State (Central Role)
            and Central Role & Peripheral Role
          Low Duty Cycle Directed Advertising State
            and Connection State (Central Role)
            and Central Role & Peripheral Role
          Connectable Advertising State
            and Connection State (Peripheral Role)
            and Central Role & Peripheral Role
          High Duty Cycle Directed Advertising State
            and Connection State (Peripheral Role)
            and Peripheral Role & Peripheral Role
          Low Duty Cycle Directed Advertising State
            and Connection State (Peripheral Role)
            and Peripheral Role & Peripheral Role
          Initiating State
            and Connection State (Peripheral Role)
            and Central Role & Peripheral Role
< HCI Command: LE Read Maximum Data.. (0x08|0x002f) plen 0  #23 [hci1] 1.340614
> HCI Event: Command Complete (0x0e) plen 12                #24 [hci1] 1.341051
      LE Read Maximum Data Length (0x08|0x002f) ncmd 1
        Status: Success (0x00)
        Max TX octets: 251
        Max TX time: 2704
        Max RX octets: 251
        Max RX time: 2704
< HCI Command: LE Write Suggested D.. (0x08|0x0024) plen 4  #25 [hci1] 1.360603
        TX octets: 251
        TX time: 2704
> HCI Event: Command Complete (0x0e) plen 4                 #26 [hci1] 1.361038
      LE Write Suggested Default Data Length (0x08|0x0024) ncmd 1
        Status: Success (0x00)
< HCI Command: LE Read Resolving Li.. (0x08|0x002a) plen 0  #27 [hci1] 1.380612
> HCI Event: Command Complete (0x0e) plen 5                 #28 [hci1] 1.381062
      LE Read Resolving List Size (0x08|0x002a) ncmd 1
        Status: Success (0x00)
        Size: 8
< HCI Command: LE Set Host Feature (0x08|0x0074) plen 2     #29 [hci1] 1.400605
        Bit Number: 38
          Connection Subrating (Host Support)
        Bit Value: 1
> HCI Event: Command Complete (0x0e) plen 4                 #30 [hci1] 1.401024
      LE Set Host Feature (0x08|0x0074) ncmd 1
        Status: Success (0x00)
< HCI Command: LE Set Event Mask (0x08|0x0001) plen 8       #31 [hci1] 1.420626
        Mask: 0x000002063f87fa5e
          LE Advertising Report
          LE Connection Update Complete
          LE Read Remote Used Features Complete
          LE Long Term Key Request
          LE Data Length Change
          LE Enhanced Connection Complete
          LE PHY Update Complete
          LE Extended Advertising Report
          LE Periodic Advertising Sync Established
          LE Periodic Advertising Report
          LE Periodic Advertising Sync Lost
          LE Extended Scan Timeout
          LE Extended Advertising Set Terminated
          LE Scan Request Received
          LE Periodic Advertising Sync Transfer Rvc
          LE CIS Established
          LE CIS Request
          LE Create BIG Complete
          LE Terminate BIG Complete
          LE BIG Sync Estabilished Complete
          LE BIG Sync Lost
          LE BIG Info Advertising Report
          LE Subrate Change
          Unknown mask (0x0000020000000000)
> HCI Event: Command Complete (0x0e) plen 4                 #32 [hci1] 1.421174
      LE Set Event Mask (0x08|0x0001) ncmd 1
        Status: Success (0x00)
< HCI Command: Set Event Mask (0x03|0x0001) plen 8          #33 [hci1] 1.440617
        Mask: 0x2000800002008890
          Disconnection Complete
          Encryption Change
          Read Remote Version Information Complete
          Hardware Error
          Data Buffer Overflow
          Encryption Key Refresh Complete
          LE Meta
> HCI Event: Command Complete (0x0e) plen 4                 #34 [hci1] 1.441082
      Set Event Mask (0x03|0x0001) ncmd 1
        Status: Success (0x00)
< HCI Command: Read BD ADDR (0x04|0x0009) plen 0            #35 [hci1] 1.460616
> HCI Event: Command Complete (0x0e) plen 10                #36 [hci1] 1.461026
      Read BD ADDR (0x04|0x0009) ncmd 1
        Status: Success (0x00)
        Address: 00:00:00:00:00:00 (OUI 00-00-00)
< HCI Command: LE Set Random Address (0x08|0x0005) plen 6   #37 [hci1] 1.480619
        Address: D5:B6:CC:31:DB:3B (Static)
> HCI Event: Command Complete (0x0e) plen 4                 #38 [hci1] 1.481115
      LE Set Random Address (0x08|0x0005) ncmd 1
        Status: Success (0x00)
< HCI Command: LE Set Extended Adv.. (0x08|0x0036) plen 25  #39 [hci1] 4.771044
        Handle: 0x00
        Properties: 0x0013
          Connectable
          Scannable
          Use legacy advertising PDUs: ADV_IND
        Min advertising interval: 100.000 msec (0x00a0)
        Max advertising interval: 150.000 msec (0x00f0)
        Channel map: 37, 38, 39 (0x07)
        Own address type: Random (0x01)
        Peer address type: Public (0x00)
        Peer address: 00:00:00:00:00:00 (OUI 00-00-00)
        Filter policy: Allow Scan Request from Any, Allow Connect Request from Any (0x00)
        TX power: Host has no preference (0x7f)
        Primary PHY: LE 1M (0x01)
        Secondary max skip: 0x00
        Secondary PHY: LE 1M (0x01)
        SID: 0x00
        Scan request notifications: Disabled (0x00)
> HCI Event: Command Complete (0x0e) plen 5                 #40 [hci1] 4.771944
      LE Set Extended Advertising Parameters (0x08|0x0036) ncmd 1
        Status: Success (0x00)
        TX power (selected): 0 dbm (0x00)
< HCI Command: LE Set Advertising S.. (0x08|0x0035) plen 7  #41 [hci1] 4.780656
        Advertising handle: 0x00
        Advertising random address: D5:B6:CC:31:DB:3B (Static)
> HCI Event: Command Complete (0x0e) plen 4                 #42 [hci1] 4.781184
      LE Set Advertising Set Random Address (0x08|0x0035) ncmd 1
        Status: Success (0x00)
< HCI Command: LE Set Extended Adv.. (0x08|0x0037) plen 22  #43 [hci1] 4.800643
        Handle: 0x00
        Operation: Complete extended advertising data (0x03)
        Fragment preference: Minimize fragmentation (0x01)
        Data length: 0x12
        Flags: 0x06
          LE General Discoverable Mode
          BR/EDR Not Supported
        Name (complete): Tester_F6B11A
> HCI Event: Command Complete (0x0e) plen 4                 #44 [hci1] 4.801384
      LE Set Extended Advertising Data (0x08|0x0037) ncmd 1
        Status: Success (0x00)
< HCI Command: LE Set Extended Scan.. (0x08|0x0038) plen 4  #45 [hci1] 4.820651
        Handle: 0x00
        Operation: Complete scan response data (0x03)
        Fragment preference: Minimize fragmentation (0x01)
        Data length: 0x00
> HCI Event: Command Complete (0x0e) plen 4                 #46 [hci1] 4.821100
      LE Set Extended Scan Response Data (0x08|0x0038) ncmd 1
        Status: Success (0x00)
< HCI Command: LE Set Extended Adve.. (0x08|0x0039) plen 6  #47 [hci1] 4.840596
        Extended advertising: Enabled (0x01)
        Number of sets: 1 (0x01)
        Entry 0
          Handle: 0x00
          Duration: 0 ms (0x00)
          Max ext adv events: 0
> HCI Event: Command Complete (0x0e) plen 4                 #48 [hci1] 4.841109
      LE Set Extended Advertising Enable (0x08|0x0039) ncmd 1
        Status: Success (0x00)
> HCI Event: LE Meta Event (0x3e) plen 31                   #49 [hci1] 4.964379
      LE Enhanced Connection Complete (0x0a)
        Status: Success (0x00)
        Handle: 417
        Role: Peripheral (0x01)
        Peer address type: Public (0x00)
        Peer address: DF:A9:FF:F6:B1:1A (OUI DF-A9-FF)
        Local resolvable private address: 00:00:00:00:00:00 (Non-Resolvable)
        Peer resolvable private address: 00:00:00:00:00:00 (Non-Resolvable)
        Connection interval: 87.50 msec (0x0046)
        Connection latency: 0 (0x0000)
        Supervision timeout: 25120 msec (0x09d0)
        Central clock accuracy: 0x01
> HCI Event: LE Meta Event (0x3e) plen 6                    #50 [hci1] 4.964552
      LE Advertising Set Terminated (0x12)
        Status: Success (0x00)
        Handle: 0
        Connection handle: 417
        Number of completed extended advertising events: 0
< HCI Command: LE Read Remote Used... (0x08|0x0016) plen 2  #51 [hci1] 4.981408
        Handle: 417 Address: DF:A9:FF:F6:B1:1A (OUI DF-A9-FF)
< ACL Data TX: Handle 417 flags 0x00 dlen 7                 #52 [hci1] 4.981431
      ATT: Exchange MTU Request (0x02) len 2
        Client RX MTU: 251
> HCI Event: Command Status (0x0f) plen 4                   #53 [hci1] 4.981918
      LE Read Remote Used Features (0x08|0x0016) ncmd 1
        Status: Success (0x00)
> HCI Event: Number of Completed Packets (0x13) plen 5      #54 [hci1] 5.140425
        Num handles: 1
        Handle: 417 Address: DF:A9:FF:F6:B1:1A (OUI DF-A9-FF)
        Count: 1
        #52: len 7 (0 Kb/s)
        Latency: 158 msec (158-158 msec ~158 msec)
> HCI Event: LE Meta Event (0x3e) plen 12                   #55 [hci1] 5.228291
      LE Read Remote Used Features (0x04)
        Status: Success (0x00)
        Handle: 417 Address: DF:A9:FF:F6:B1:1A (OUI DF-A9-FF)
        Features: 0x2d 0x49 0x00 0xf7 0x67 0xd9 0x00 0x80
          LE Encryption
          Extended Reject Indication
          Peripheral-initiated Features Exchange
          LE Data Packet Length Extension
          LE 2M PHY
          LE Coded PHY
          Channel Selection Algorithm #2
          Periodic Advertising Sync Transfer - Sender
          Periodic Advertising Sync Transfer - Recipient
          Sleep Clock Accuracy Updates
          Connected Isochronous Stream - Central
          Connected Isochronous Stream - Peripheral
          Isochronous Broadcaster
          Synchronized Receiver
          Connected Isochronous Stream (Host Support)
          LE Power Control Request
          LE Power Control Request
          Connection Subrating
          Connection Subrating (Host Support)
          Unknown features (0x8000d90000000000)
> ACL Data RX: Handle 417 flags 0x02 dlen 11                #56 [hci1] 7.678012
      SMP: Pairing Request (0x01) len 6
        IO capability: KeyboardDisplay (0x04)
        OOB data: Authentication data not present (0x00)
        Authentication requirement: Bonding, No MITM, SC, No Keypresses (0x09)
        Max encryption key size: 16
        Initiator key distribution: EncKey IdKey (0x03)
        Responder key distribution: EncKey IdKey Sign (0x07)
> ACL Data RX: Handle 417 flags 0x02 dlen 7                 #57 [hci1] 7.678575
      ATT: Exchange MTU Response (0x03) len 2
        Server RX MTU: 23
< HCI Command: Host Number of Compl.. (0x03|0x0035) plen 5  #58 [hci1] 7.681088
        Num handles: 1
        Handle: 417 Address: DF:A9:FF:F6:B1:1A (OUI DF-A9-FF)
        Count: 1
< ACL Data TX: Handle 417 flags 0x00 dlen 11                #59 [hci1] 7.681218
      SMP: Pairing Response (0x02) len 6
        IO capability: DisplayOnly (0x00)
        OOB data: Authentication data not present (0x00)
        Authentication requirement: Bonding, No MITM, SC, No Keypresses (0x09)
        Max encryption key size: 16
        Initiator key distribution: IdKey (0x02)
        Responder key distribution: <none> (0x00)
< HCI Command: Host Number of Compl.. (0x03|0x0035) plen 5  #60 [hci1] 7.681563
        Num handles: 1
        Handle: 417 Address: DF:A9:FF:F6:B1:1A (OUI DF-A9-FF)
        Count: 1
> HCI Event: Number of Completed Packets (0x13) plen 5      #61 [hci1] 7.853228
        Num handles: 1
        Handle: 417 Address: DF:A9:FF:F6:B1:1A (OUI DF-A9-FF)
        Count: 1
        #59: len 11 (0 Kb/s)
        Latency: 172 msec (158-172 msec ~165 msec)
> ACL Data RX: Handle 417 flags 0x02 dlen 27                #62 [hci1] 7.853493
> ACL Data RX: Handle 417 flags 0x01 dlen 27                #63 [hci1] 7.853926
> ACL Data RX: Handle 417 flags 0x01 dlen 15                #64 [hci1] 7.854402
      SMP: Pairing Public Key (0x0c) len 64
        X: a27ffe91deea57b92f5d99aa8ae287cf85c075f91dc7c8dc47911cc31d271def
        Y: bae3a30a41b74d868409282b73bb9c743095cf8ce1e3432c1e5765109c2d4cf6
< HCI Command: Host Number of Compl.. (0x03|0x0035) plen 5  #65 [hci1] 7.861396
        Num handles: 1
        Handle: 417 Address: DF:A9:FF:F6:B1:1A (OUI DF-A9-FF)
        Count: 1
< HCI Command: Host Number of Compl.. (0x03|0x0035) plen 5  #66 [hci1] 7.861666
        Num handles: 1
        Handle: 417 Address: DF:A9:FF:F6:B1:1A (OUI DF-A9-FF)
        Count: 1
< HCI Command: Host Number of Compl.. (0x03|0x0035) plen 5  #67 [hci1] 7.861964
        Num handles: 1
        Handle: 417 Address: DF:A9:FF:F6:B1:1A (OUI DF-A9-FF)
        Count: 1
< ACL Data TX: Handle 417 flags 0x00 dlen 27                #68 [hci1] 7.862036
< ACL Data TX: Handle 417 flags 0x01 dlen 27                #69 [hci1] 7.862060
< ACL Data TX: Handle 417 flags 0x01 dlen 15                #70 [hci1] 7.862118
      SMP: Pairing Public Key (0x0c) len 64
        X: 98308440221e2d910f0e54b71e7ec652857aa9b5a0dc65028824cc19db1226e9
        Y: 67a4816bcb62efb21701e31fdb27561a6217575fb007a8bbdabe7e28b6f68482
> HCI Event: Number of Completed Packets (0x13) plen 5      #71 [hci1] 7.941002
        Num handles: 1
        Handle: 417 Address: DF:A9:FF:F6:B1:1A (OUI DF-A9-FF)
        Count: 1
        #68: len 27 (2 Kb/s)
        Latency: 78 msec (78-172 msec ~122 msec)
> HCI Event: Number of Completed Packets (0x13) plen 5      #72 [hci1] 7.941703
        Num handles: 1
        Handle: 417 Address: DF:A9:FF:F6:B1:1A (OUI DF-A9-FF)
        Count: 1
        #69: len 27 (2 Kb/s)
        Latency: 79 msec (78-172 msec ~100 msec)
< ACL Data TX: Handle 417 flags 0x00 dlen 21                #73 [hci1] 7.960707
      SMP: Pairing Confirm (0x03) len 16
        Confim value: 5ab76cc2bd2613dabf60d16382c7641d
> HCI Event: Number of Completed Packets (0x13) plen 5      #74 [hci1] 8.027937
        Num handles: 1
        Handle: 417 Address: DF:A9:FF:F6:B1:1A (OUI DF-A9-FF)
        Count: 1
        #70: len 15 (0 Kb/s)
        Latency: 165 msec (78-172 msec ~133 msec)
> HCI Event: Number of Completed Packets (0x13) plen 5      #75 [hci1] 8.115666
        Num handles: 1
        Handle: 417 Address: DF:A9:FF:F6:B1:1A (OUI DF-A9-FF)
        Count: 1
        #73: len 21 (1 Kb/s)
        Latency: 154 msec (78-172 msec ~144 msec)
> ACL Data RX: Handle 417 flags 0x02 dlen 21                #76 [hci1] 8.115909
      SMP: Pairing Random (0x04) len 16
        Random value: 43ab62d1353347670000000000000000
< HCI Command: Host Number of Compl.. (0x03|0x0035) plen 5  #77 [hci1] 8.121061
        Num handles: 1
        Handle: 417 Address: DF:A9:FF:F6:B1:1A (OUI DF-A9-FF)
        Count: 1
< ACL Data TX: Handle 417 flags 0x00 dlen 21                #78 [hci1] 8.121114
      SMP: Pairing Random (0x04) len 16
        Random value: 8e6108f966a694cbe26df70bb96773e6
> HCI Event: Number of Completed Packets (0x13) plen 5      #79 [hci1] 8.290459
        Num handles: 1
        Handle: 417 Address: DF:A9:FF:F6:B1:1A (OUI DF-A9-FF)
        Count: 1
        #78: len 21 (0 Kb/s)
        Latency: 169 msec (78-172 msec ~156 msec)
> ACL Data RX: Handle 417 flags 0x02 dlen 21                #80 [hci1] 8.465682
      SMP: Pairing DHKey Check (0x0d) len 16
        E: 4190a6407968c16019fa1597288adbc3
< HCI Command: Host Number of Compl.. (0x03|0x0035) plen 5  #81 [hci1] 8.481274
        Num handles: 1
        Handle: 417 Address: DF:A9:FF:F6:B1:1A (OUI DF-A9-FF)
        Count: 1
< ACL Data TX: Handle 417 flags 0x00 dlen 21                #82 [hci1] 8.481463
      SMP: Pairing DHKey Check (0x0d) len 16
        E: 7f530c822f0117f9a2a00832d06dab76
> HCI Event: Number of Completed Packets (0x13) plen 5      #83 [hci1] 8.640253
        Num handles: 1
        Handle: 417 Address: DF:A9:FF:F6:B1:1A (OUI DF-A9-FF)
        Count: 1
        #82: len 21 (1 Kb/s)
        Latency: 158 msec (78-172 msec ~157 msec)
> HCI Event: LE Meta Event (0x3e) plen 13                   #84 [hci1] 8.728423
      LE Long Term Key Request (0x05)
        Handle: 417 Address: DF:A9:FF:F6:B1:1A (OUI DF-A9-FF)
        Random number: 0x0000000000000000
        Encrypted diversifier: 0x0000
< HCI Command: LE Long Term Key Re.. (0x08|0x001a) plen 18  #85 [hci1] 8.740711
        Handle: 417 Address: DF:A9:FF:F6:B1:1A (OUI DF-A9-FF)
        Long term key: 7ebdec45eafd3419bb026cae36774bc2
> HCI Event: Command Complete (0x0e) plen 6                 #86 [hci1] 8.741416
      LE Long Term Key Request Reply (0x08|0x001a) ncmd 1
        Status: Success (0x00)
        Handle: 417 Address: DF:A9:FF:F6:B1:1A (OUI DF-A9-FF)
> HCI Event: Encryption Change (0x08) plen 4                #87 [hci1] 9.165643
        Status: Success (0x00)
        Handle: 417 Address: DF:A9:FF:F6:B1:1A (OUI DF-A9-FF)
        Encryption: Enabled with AES-CCM (0x01)
> ACL Data RX: Handle 417 flags 0x02 dlen 21                #88 [hci1] 9.253247
      SMP: Identity Information (0x08) len 16
        Identity resolving key: d773e5702242abbe8e3a526317775280
< ACL Data TX: Handle 417 flags 0x00 dlen 11                #89 [hci1] 9.291381
      ATT: Read By Type Request (0x08) len 6
        Handle range: 0x0001-0xffff
        Attribute type: Central Address Resolution (0x2aa6)
< HCI Command: Host Number of Compl.. (0x03|0x0035) plen 5  #90 [hci1] 9.291771
        Num handles: 1
        Handle: 417 Address: DF:A9:FF:F6:B1:1A (OUI DF-A9-FF)
        Count: 1
> HCI Event: Number of Completed Packets (0x13) plen 5      #91 [hci1] 9.428073
        Num handles: 1
        Handle: 417 Address: DF:A9:FF:F6:B1:1A (OUI DF-A9-FF)
        Count: 1
        #89: len 11 (0 Kb/s)
        Latency: 136 msec (78-172 msec ~147 msec)
> ACL Data RX: Handle 417 flags 0x02 dlen 12                #92 [hci1] 9.428167
      SMP: Identity Address Information (0x09) len 7
        Address: DF:A9:FF:F6:B1:1A (OUI DF-A9-FF)
< HCI Command: LE Add Device To Re.. (0x08|0x0027) plen 39  #93 [hci1] 9.441117
        Address type: Public (0x00)
        Address: DF:A9:FF:F6:B1:1A (OUI DF-A9-FF)
        Peer identity resolving key: d773e5702242abbe8e3a526317775280
        Local identity resolving key: 00000000000000000000000000000000
> HCI Event: Command Complete (0x0e) plen 4                 #94 [hci1] 9.442035
      LE Add Device To Resolving List (0x08|0x0027) ncmd 1
        Status: Success (0x00)
< HCI Command: LE Set Privacy Mode (0x08|0x004e) plen 8     #95 [hci1] 9.460933
        Peer Identity address type: Public (0x00)
        Peer Identity address: DF:A9:FF:F6:B1:1A (OUI DF-A9-FF)
        Privacy Mode: Use Device Privacy (0x01)
> HCI Event: Command Complete (0x0e) plen 4                 #96 [hci1] 9.461599
      LE Set Privacy Mode (0x08|0x004e) ncmd 1
        Status: Success (0x00)
< HCI Command: LE Set Address Resol.. (0x08|0x002d) plen 1  #97 [hci1] 9.481048
        Address resolution: Enabled (0x01)
> HCI Event: Command Complete (0x0e) plen 4                 #98 [hci1] 9.481469
      LE Set Address Resolution Enable (0x08|0x002d) ncmd 1
        Status: Success (0x00)
< HCI Command: Host Number of Compl.. (0x03|0x0035) plen 5  #99 [hci1] 9.500991
        Num handles: 1
        Handle: 417 Address: DF:A9:FF:F6:B1:1A (OUI DF-A9-FF)
        Count: 1
> ACL Data RX: Handle 417 flags 0x02 dlen 13               #100 [hci1] 9.515653
      ATT: Find By Type Value Request (0x06) len 8
        Handle range: 0x0001-0xffff
        Attribute type: Primary Service (0x2800)
          UUID: Generic Media Control (0x1849)
< HCI Command: Host Number of Comp.. (0x03|0x0035) plen 5  #101 [hci1] 9.521371
        Num handles: 1
        Handle: 417 Address: DF:A9:FF:F6:B1:1A (OUI DF-A9-FF)
        Count: 1
< ACL Data TX: Handle 417 flags 0x00 dlen 9                #102 [hci1] 9.521532
      ATT: Find By Type Value Response (0x07) len 4
        Handle range: 0x003d-0x007b
> ACL Data RX: Handle 417 flags 0x02 dlen 9                #103 [hci1] 9.603030
      ATT: Read By Type Response (0x09) len 4
        Attribute data length: 3
        Attribute data list: 1 entry
        Handle: 0x000f
        Value: 01
< HCI Command: Host Number of Comp.. (0x03|0x0035) plen 5  #104 [hci1] 9.621271
        Num handles: 1
        Handle: 417 Address: DF:A9:FF:F6:B1:1A (OUI DF-A9-FF)
        Count: 1
> HCI Event: Number of Completed Packets (0x13) plen 5     #105 [hci1] 9.690565
        Num handles: 1
        Handle: 417 Address: DF:A9:FF:F6:B1:1A (OUI DF-A9-FF)
        Count: 1
        #102: len 9 (0 Kb/s)
        Latency: 169 msec (78-172 msec ~158 msec)
> ACL Data RX: Handle 417 flags 0x02 dlen 13               #106 [hci1] 9.690755
      ATT: Find By Type Value Request (0x06) len 8
        Handle range: 0x007c-0xffff
        Attribute type: Primary Service (0x2800)
          UUID: Generic Media Control (0x1849)
< HCI Command: Host Number of Comp.. (0x03|0x0035) plen 5  #107 [hci1] 9.700857
        Num handles: 1
        Handle: 417 Address: DF:A9:FF:F6:B1:1A (OUI DF-A9-FF)
        Count: 1
< ACL Data TX: Handle 417 flags 0x00 dlen 9                #108 [hci1] 9.700902
      ATT: Error Response (0x01) len 4
        Find By Type Value Request (0x06)
        Handle: 0x007c
        Error: Attribute Not Found (0x0a)
> HCI Event: Number of Completed Packets (0x13) plen 5     #109 [hci1] 9.865502
        Num handles: 1
        Handle: 417 Address: DF:A9:FF:F6:B1:1A (OUI DF-A9-FF)
        Count: 1
        #108: len 9 (0 Kb/s)
        Latency: 164 msec (78-172 msec ~161 msec)
> ACL Data RX: Handle 417 flags 0x02 dlen 11               #110 [hci1] 9.865732
      ATT: Read By Type Request (0x08) len 6
        Handle range: 0x003d-0x007b
        Attribute type: Characteristic (0x2803)
< HCI Command: Host Number of Comp.. (0x03|0x0035) plen 5  #111 [hci1] 9.880846
        Num handles: 1
        Handle: 417 Address: DF:A9:FF:F6:B1:1A (OUI DF-A9-FF)
        Count: 1
< ACL Data TX: Handle 417 flags 0x00 dlen 20               #112 [hci1] 9.880875
      ATT: Read By Type Response (0x09) len 15
        Attribute data length: 7
        Attribute data list: 2 entries
        Handle: 0x003f
        Value: 124000932b
            Properties: 0x12
              Read (0x02)
              Notify (0x10)
            Value Handle: 0x0040
            Value UUID: Media Player Name (0x2b93)
        Handle: 0x0042
        Value: 024300942b
            Properties: 0x02
              Read (0x02)
            Value Handle: 0x0043
            Value UUID: Media Player Icon Object ID (0x2b94)
> HCI Event: Number of Completed Packets (0x13) plen 5    #113 [hci1] 10.040486
        Num handles: 1
        Handle: 417 Address: DF:A9:FF:F6:B1:1A (OUI DF-A9-FF)
        Count: 1
        #112: len 20 (1 Kb/s)
        Latency: 159 msec (78-172 msec ~160 msec)
> ACL Data RX: Handle 417 flags 0x02 dlen 11              #114 [hci1] 10.040816
      ATT: Read By Type Request (0x08) len 6
        Handle range: 0x0043-0x007b
        Attribute type: Characteristic (0x2803)
< HCI Command: Host Number of Com.. (0x03|0x0035) plen 5  #115 [hci1] 10.060859
        Num handles: 1
        Handle: 417 Address: DF:A9:FF:F6:B1:1A (OUI DF-A9-FF)
        Count: 1
< ACL Data TX: Handle 417 flags 0x00 dlen 20              #116 [hci1] 10.060929
      ATT: Read By Type Response (0x09) len 15
        Attribute data length: 7
        Attribute data list: 2 entries
        Handle: 0x0044
        Value: 024500952b
            Properties: 0x02
              Read (0x02)
            Value Handle: 0x0045
            Value UUID: Media Player Icon URL (0x2b95)
        Handle: 0x0046
        Value: 104700962b
            Properties: 0x10
              Notify (0x10)
            Value Handle: 0x0047
            Value UUID: Track Changed (0x2b96)
> HCI Event: Number of Completed Packets (0x13) plen 5    #117 [hci1] 10.215485
        Num handles: 1
        Handle: 417 Address: DF:A9:FF:F6:B1:1A (OUI DF-A9-FF)
        Count: 1
        #116: len 20 (1 Kb/s)
        Latency: 154 msec (78-172 msec ~157 msec)
> ACL Data RX: Handle 417 flags 0x02 dlen 11              #118 [hci1] 10.215688
      ATT: Read By Type Request (0x08) len 6
        Handle range: 0x0047-0x007b
        Attribute type: Characteristic (0x2803)
< HCI Command: Host Number of Com.. (0x03|0x0035) plen 5  #119 [hci1] 10.220948
        Num handles: 1
        Handle: 417 Address: DF:A9:FF:F6:B1:1A (OUI DF-A9-FF)
        Count: 1
< ACL Data TX: Handle 417 flags 0x00 dlen 20              #120 [hci1] 10.220986
      ATT: Read By Type Response (0x09) len 15
        Attribute data length: 7
        Attribute data list: 2 entries
        Handle: 0x0049
        Value: 124a00972b
            Properties: 0x12
              Read (0x02)
              Notify (0x10)
            Value Handle: 0x004a
            Value UUID: Track Title (0x2b97)
        Handle: 0x004c
        Value: 124d00982b
            Properties: 0x12
              Read (0x02)
              Notify (0x10)
            Value Handle: 0x004d
            Value UUID: Track Duration (0x2b98)
> HCI Event: Number of Completed Packets (0x13) plen 5    #121 [hci1] 10.390566
        Num handles: 1
        Handle: 417 Address: DF:A9:FF:F6:B1:1A (OUI DF-A9-FF)
        Count: 1
        #120: len 20 (0 Kb/s)
        Latency: 169 msec (78-172 msec ~163 msec)
> ACL Data RX: Handle 417 flags 0x02 dlen 11              #122 [hci1] 10.390757
      ATT: Read By Type Request (0x08) len 6
        Handle range: 0x004d-0x007b
        Attribute type: Characteristic (0x2803)
< HCI Command: Host Number of Com.. (0x03|0x0035) plen 5  #123 [hci1] 10.401000
        Num handles: 1
        Handle: 417 Address: DF:A9:FF:F6:B1:1A (OUI DF-A9-FF)
        Count: 1
< ACL Data TX: Handle 417 flags 0x00 dlen 20              #124 [hci1] 10.401028
      ATT: Read By Type Response (0x09) len 15
        Attribute data length: 7
        Attribute data list: 2 entries
        Handle: 0x004f
        Value: 1e5000992b
            Properties: 0x1e
              Read (0x02)
              Write Without Response (0x04)
              Write (0x08)
              Notify (0x10)
            Value Handle: 0x0050
            Value UUID: Track Position (0x2b99)
        Handle: 0x0052
        Value: 1e53009a2b
            Properties: 0x1e
              Read (0x02)
              Write Without Response (0x04)
              Write (0x08)
              Notify (0x10)
            Value Handle: 0x0053
            Value UUID: Playback Speed (0x2b9a)
> HCI Event: Number of Completed Packets (0x13) plen 5    #125 [hci1] 10.565457
        Num handles: 1
        Handle: 417 Address: DF:A9:FF:F6:B1:1A (OUI DF-A9-FF)
        Count: 1
        #124: len 20 (0 Kb/s)
        Latency: 164 msec (78-172 msec ~163 msec)
> ACL Data RX: Handle 417 flags 0x02 dlen 11              #126 [hci1] 10.565760
      ATT: Read By Type Request (0x08) len 6
        Handle range: 0x0053-0x007b
        Attribute type: Characteristic (0x2803)
< HCI Command: Host Number of Com.. (0x03|0x0035) plen 5  #127 [hci1] 10.581224
        Num handles: 1
        Handle: 417 Address: DF:A9:FF:F6:B1:1A (OUI DF-A9-FF)
        Count: 1
< ACL Data TX: Handle 417 flags 0x00 dlen 20              #128 [hci1] 10.581397
      ATT: Read By Type Response (0x09) len 15
        Attribute data length: 7
        Attribute data list: 2 entries
        Handle: 0x0055
        Value: 1256009b2b
            Properties: 0x12
              Read (0x02)
              Notify (0x10)
            Value Handle: 0x0056
            Value UUID: Seeking Speed (0x2b9b)
        Handle: 0x0058
        Value: 0259009c2b
            Properties: 0x02
              Read (0x02)
            Value Handle: 0x0059
            Value UUID: Current Track Segments Object ID (0x2b9c)
> HCI Event: Number of Completed Packets (0x13) plen 5    #129 [hci1] 10.740492
        Num handles: 1
        Handle: 417 Address: DF:A9:FF:F6:B1:1A (OUI DF-A9-FF)
        Count: 1
        #128: len 20 (1 Kb/s)
        Latency: 159 msec (78-172 msec ~161 msec)
> ACL Data RX: Handle 417 flags 0x02 dlen 11              #130 [hci1] 10.740791
      ATT: Read By Type Request (0x08) len 6
        Handle range: 0x0059-0x007b
        Attribute type: Characteristic (0x2803)
< HCI Command: Host Number of Com.. (0x03|0x0035) plen 5  #131 [hci1] 10.760795
        Num handles: 1
        Handle: 417 Address: DF:A9:FF:F6:B1:1A (OUI DF-A9-FF)
        Count: 1
< ACL Data TX: Handle 417 flags 0x00 dlen 20              #132 [hci1] 10.760854
      ATT: Read By Type Response (0x09) len 15
        Attribute data length: 7
        Attribute data list: 2 entries
        Handle: 0x005a
        Value: 1e5b009d2b
            Properties: 0x1e
              Read (0x02)
              Write Without Response (0x04)
              Write (0x08)
              Notify (0x10)
            Value Handle: 0x005b
            Value UUID: Current Track Object ID (0x2b9d)
        Handle: 0x005d
        Value: 1e5e009e2b
            Properties: 0x1e
              Read (0x02)
              Write Without Response (0x04)
              Write (0x08)
              Notify (0x10)
            Value Handle: 0x005e
            Value UUID: Next Track Object ID (0x2b9e)
> HCI Event: Number of Completed Packets (0x13) plen 5    #133 [hci1] 10.915502
        Num handles: 1
        Handle: 417 Address: DF:A9:FF:F6:B1:1A (OUI DF-A9-FF)
        Count: 1
        #132: len 20 (1 Kb/s)
        Latency: 154 msec (78-172 msec ~158 msec)
> ACL Data RX: Handle 417 flags 0x02 dlen 11              #134 [hci1] 10.915762
      ATT: Read By Type Request (0x08) len 6
        Handle range: 0x005e-0x007b
        Attribute type: Characteristic (0x2803)
< HCI Command: Host Number of Com.. (0x03|0x0035) plen 5  #135 [hci1] 10.920847
        Num handles: 1
        Handle: 417 Address: DF:A9:FF:F6:B1:1A (OUI DF-A9-FF)
        Count: 1
< ACL Data TX: Handle 417 flags 0x00 dlen 20              #136 [hci1] 10.920910
      ATT: Read By Type Response (0x09) len 15
        Attribute data length: 7
        Attribute data list: 2 entries
        Handle: 0x0060
        Value: 1261009f2b
            Properties: 0x12
              Read (0x02)
              Notify (0x10)
            Value Handle: 0x0061
            Value UUID: Parent Group Object ID (0x2b9f)
        Handle: 0x0063
        Value: 1e6400a02b
            Properties: 0x1e
              Read (0x02)
              Write Without Response (0x04)
              Write (0x08)
              Notify (0x10)
            Value Handle: 0x0064
            Value UUID: Current Group Object ID (0x2ba0)
> HCI Event: Number of Completed Packets (0x13) plen 5    #137 [hci1] 11.090447
        Num handles: 1
        Handle: 417 Address: DF:A9:FF:F6:B1:1A (OUI DF-A9-FF)
        Count: 1
        #136: len 20 (0 Kb/s)
        Latency: 169 msec (78-172 msec ~163 msec)
> ACL Data RX: Handle 417 flags 0x02 dlen 11              #138 [hci1] 11.090647
      ATT: Read By Type Request (0x08) len 6
        Handle range: 0x0064-0x007b
        Attribute type: Characteristic (0x2803)
< HCI Command: Host Number of Com.. (0x03|0x0035) plen 5  #139 [hci1] 11.101382
        Num handles: 1
        Handle: 417 Address: DF:A9:FF:F6:B1:1A (OUI DF-A9-FF)
        Count: 1
< ACL Data TX: Handle 417 flags 0x00 dlen 20              #140 [hci1] 11.101480
      ATT: Read By Type Response (0x09) len 15
        Attribute data length: 7
        Attribute data list: 2 entries
        Handle: 0x0066
        Value: 1e6700a12b
            Properties: 0x1e
              Read (0x02)
              Write Without Response (0x04)
              Write (0x08)
              Notify (0x10)
            Value Handle: 0x0067
            Value UUID: Playing Order (0x2ba1)
        Handle: 0x0069
        Value: 026a00a22b
            Properties: 0x02
              Read (0x02)
            Value Handle: 0x006a
            Value UUID: Playing Orders Supported (0x2ba2)
> HCI Event: Number of Completed Packets (0x13) plen 5    #141 [hci1] 11.265464
        Num handles: 1
        Handle: 417 Address: DF:A9:FF:F6:B1:1A (OUI DF-A9-FF)
        Count: 1
        #140: len 20 (0 Kb/s)
        Latency: 163 msec (78-172 msec ~163 msec)
> ACL Data RX: Handle 417 flags 0x02 dlen 11              #142 [hci1] 11.265684
      ATT: Read By Type Request (0x08) len 6
        Handle range: 0x006a-0x007b
        Attribute type: Characteristic (0x2803)
< HCI Command: Host Number of Com.. (0x03|0x0035) plen 5  #143 [hci1] 11.280995
        Num handles: 1
        Handle: 417 Address: DF:A9:FF:F6:B1:1A (OUI DF-A9-FF)
        Count: 1
< ACL Data TX: Handle 417 flags 0x00 dlen 20              #144 [hci1] 11.281038
      ATT: Read By Type Response (0x09) len 15
        Attribute data length: 7
        Attribute data list: 2 entries
        Handle: 0x006b
        Value: 126c00a32b
            Properties: 0x12
              Read (0x02)
              Notify (0x10)
            Value Handle: 0x006c
            Value UUID: Media State (0x2ba3)
        Handle: 0x006e
        Value: 1c6f00a42b
            Properties: 0x1c
              Write Without Response (0x04)
              Write (0x08)
              Notify (0x10)
            Value Handle: 0x006f
            Value UUID: Media Control Point (0x2ba4)
> HCI Event: Number of Completed Packets (0x13) plen 5    #145 [hci1] 11.440477
        Num handles: 1
        Handle: 417 Address: DF:A9:FF:F6:B1:1A (OUI DF-A9-FF)
        Count: 1
        #144: len 20 (1 Kb/s)
        Latency: 159 msec (78-172 msec ~161 msec)
> ACL Data RX: Handle 417 flags 0x02 dlen 11              #146 [hci1] 11.440728
      ATT: Read By Type Request (0x08) len 6
        Handle range: 0x006f-0x007b
        Attribute type: Characteristic (0x2803)
< HCI Command: Host Number of Com.. (0x03|0x0035) plen 5  #147 [hci1] 11.460827
        Num handles: 1
        Handle: 417 Address: DF:A9:FF:F6:B1:1A (OUI DF-A9-FF)
        Count: 1
< ACL Data TX: Handle 417 flags 0x00 dlen 20              #148 [hci1] 11.460854
      ATT: Read By Type Response (0x09) len 15
        Attribute data length: 7
        Attribute data list: 2 entries
        Handle: 0x0071
        Value: 127200a52b
            Properties: 0x12
              Read (0x02)
              Notify (0x10)
            Value Handle: 0x0072
            Value UUID: Media Control Point Opcodes Supported (0x2ba5)
        Handle: 0x0074
        Value: 1c7500a72b
            Properties: 0x1c
              Write Without Response (0x04)
              Write (0x08)
              Notify (0x10)
            Value Handle: 0x0075
            Value UUID: Search Control Point (0x2ba7)
> HCI Event: Number of Completed Packets (0x13) plen 5    #149 [hci1] 11.615442
        Num handles: 1
        Handle: 417 Address: DF:A9:FF:F6:B1:1A (OUI DF-A9-FF)
        Count: 1
        #148: len 20 (1 Kb/s)
        Latency: 154 msec (78-172 msec ~158 msec)
> ACL Data RX: Handle 417 flags 0x02 dlen 11              #150 [hci1] 11.615653
      ATT: Read By Type Request (0x08) len 6
        Handle range: 0x0075-0x007b
        Attribute type: Characteristic (0x2803)
< HCI Command: Host Number of Com.. (0x03|0x0035) plen 5  #151 [hci1] 11.621345
        Num handles: 1
        Handle: 417 Address: DF:A9:FF:F6:B1:1A (OUI DF-A9-FF)
        Count: 1
< ACL Data TX: Handle 417 flags 0x00 dlen 20              #152 [hci1] 11.621426
      ATT: Read By Type Response (0x09) len 15
        Attribute data length: 7
        Attribute data list: 2 entries
        Handle: 0x0077
        Value: 127800a62b
            Properties: 0x12
              Read (0x02)
              Notify (0x10)
            Value Handle: 0x0078
            Value UUID: Search Results Object ID (0x2ba6)
        Handle: 0x007a
        Value: 027b00ba2b
            Properties: 0x02
              Read (0x02)
            Value Handle: 0x007b
            Value UUID: Content Control ID (0x2bba)
> HCI Event: Number of Completed Packets (0x13) plen 5    #153 [hci1] 11.790464
        Num handles: 1
        Handle: 417 Address: DF:A9:FF:F6:B1:1A (OUI DF-A9-FF)
        Count: 1
        #152: len 20 (0 Kb/s)
        Latency: 169 msec (78-172 msec ~163 msec)
> ACL Data RX: Handle 417 flags 0x02 dlen 11              #154 [hci1] 11.790707
      ATT: Read By Type Request (0x08) len 6
        Handle range: 0x007b-0x007b
        Attribute type: Characteristic (0x2803)
< HCI Command: Host Number of Com.. (0x03|0x0035) plen 5  #155 [hci1] 11.800994
        Num handles: 1
        Handle: 417 Address: DF:A9:FF:F6:B1:1A (OUI DF-A9-FF)
        Count: 1
< ACL Data TX: Handle 417 flags 0x00 dlen 9               #156 [hci1] 11.801081
      ATT: Error Response (0x01) len 4
        Read By Type Request (0x08)
        Handle: 0x007b
        Error: Attribute Not Found (0x0a)
> HCI Event: Number of Completed Packets (0x13) plen 5    #157 [hci1] 11.965451
        Num handles: 1
        Handle: 417 Address: DF:A9:FF:F6:B1:1A (OUI DF-A9-FF)
        Count: 1
        #156: len 9 (0 Kb/s)
        Latency: 164 msec (78-172 msec ~163 msec)
> ACL Data RX: Handle 417 flags 0x02 dlen 9               #158 [hci1] 11.965621
      ATT: Find Information Request (0x04) len 4
        Handle range: 0x0041-0x0041
< HCI Command: Host Number of Com.. (0x03|0x0035) plen 5  #159 [hci1] 11.981004
        Num handles: 1
        Handle: 417 Address: DF:A9:FF:F6:B1:1A (OUI DF-A9-FF)
        Count: 1
< ACL Data TX: Handle 417 flags 0x00 dlen 10              #160 [hci1] 11.981042
      ATT: Find Information Response (0x05) len 5
        Format: UUID-16 (0x01)
        Handle: 0x0041
        UUID: Client Characteristic Configuration (0x2902)
> HCI Event: Number of Completed Packets (0x13) plen 5    #161 [hci1] 12.140484
        Num handles: 1
        Handle: 417 Address: DF:A9:FF:F6:B1:1A (OUI DF-A9-FF)
        Count: 1
        #160: len 10 (0 Kb/s)
        Latency: 159 msec (78-172 msec ~161 msec)
> ACL Data RX: Handle 417 flags 0x02 dlen 9               #162 [hci1] 12.140666
      ATT: Find Information Request (0x04) len 4
        Handle range: 0x0048-0x0048
< HCI Command: Host Number of Com.. (0x03|0x0035) plen 5  #163 [hci1] 12.141173
        Num handles: 1
        Handle: 417 Address: DF:A9:FF:F6:B1:1A (OUI DF-A9-FF)
        Count: 1
< ACL Data TX: Handle 417 flags 0x00 dlen 10              #164 [hci1] 12.141223
      ATT: Find Information Response (0x05) len 5
        Format: UUID-16 (0x01)
        Handle: 0x0048
        UUID: Client Characteristic Configuration (0x2902)
> HCI Event: Number of Completed Packets (0x13) plen 5    #165 [hci1] 12.315446
        Num handles: 1
        Handle: 417 Address: DF:A9:FF:F6:B1:1A (OUI DF-A9-FF)
        Count: 1
        #164: len 10 (0 Kb/s)
        Latency: 174 msec (78-174 msec ~167 msec)
> ACL Data RX: Handle 417 flags 0x02 dlen 9               #166 [hci1] 12.315600
      ATT: Find Information Request (0x04) len 4
        Handle range: 0x004b-0x004b
< HCI Command: Host Number of Com.. (0x03|0x0035) plen 5  #167 [hci1] 12.320904
        Num handles: 1
        Handle: 417 Address: DF:A9:FF:F6:B1:1A (OUI DF-A9-FF)
        Count: 1
< ACL Data TX: Handle 417 flags 0x00 dlen 10              #168 [hci1] 12.320939
      ATT: Find Information Response (0x05) len 5
        Format: UUID-16 (0x01)
        Handle: 0x004b
        UUID: Client Characteristic Configuration (0x2902)
> HCI Event: Number of Completed Packets (0x13) plen 5    #169 [hci1] 12.490476
        Num handles: 1
        Handle: 417 Address: DF:A9:FF:F6:B1:1A (OUI DF-A9-FF)
        Count: 1
        #168: len 10 (0 Kb/s)
        Latency: 169 msec (78-174 msec ~168 msec)
> ACL Data RX: Handle 417 flags 0x02 dlen 9               #170 [hci1] 12.490617
      ATT: Find Information Request (0x04) len 4
        Handle range: 0x004e-0x004e
< HCI Command: Host Number of Com.. (0x03|0x0035) plen 5  #171 [hci1] 12.501042
        Num handles: 1
        Handle: 417 Address: DF:A9:FF:F6:B1:1A (OUI DF-A9-FF)
        Count: 1
< ACL Data TX: Handle 417 flags 0x00 dlen 10              #172 [hci1] 12.501147
      ATT: Find Information Response (0x05) len 5
        Format: UUID-16 (0x01)
        Handle: 0x004e
        UUID: Client Characteristic Configuration (0x2902)
> HCI Event: Number of Completed Packets (0x13) plen 5    #173 [hci1] 12.665405
        Num handles: 1
        Handle: 417 Address: DF:A9:FF:F6:B1:1A (OUI DF-A9-FF)
        Count: 1
        #172: len 10 (0 Kb/s)
        Latency: 164 msec (78-174 msec ~166 msec)
> ACL Data RX: Handle 417 flags 0x02 dlen 9               #174 [hci1] 12.665664
      ATT: Find Information Request (0x04) len 4
        Handle range: 0x0051-0x0051
< HCI Command: Host Number of Com.. (0x03|0x0035) plen 5  #175 [hci1] 12.681226
        Num handles: 1
        Handle: 417 Address: DF:A9:FF:F6:B1:1A (OUI DF-A9-FF)
        Count: 1
< ACL Data TX: Handle 417 flags 0x00 dlen 10              #176 [hci1] 12.681313
      ATT: Find Information Response (0x05) len 5
        Format: UUID-16 (0x01)
        Handle: 0x0051
        UUID: Client Characteristic Configuration (0x2902)
> HCI Event: Number of Completed Packets (0x13) plen 5    #177 [hci1] 12.840408
        Num handles: 1
        Handle: 417 Address: DF:A9:FF:F6:B1:1A (OUI DF-A9-FF)
        Count: 1
        #176: len 10 (0 Kb/s)
        Latency: 159 msec (78-174 msec ~162 msec)
> ACL Data RX: Handle 417 flags 0x02 dlen 9               #178 [hci1] 12.840595
      ATT: Find Information Request (0x04) len 4
        Handle range: 0x0054-0x0054
< HCI Command: Host Number of Com.. (0x03|0x0035) plen 5  #179 [hci1] 12.840915
        Num handles: 1
        Handle: 417 Address: DF:A9:FF:F6:B1:1A (OUI DF-A9-FF)
        Count: 1
< ACL Data TX: Handle 417 flags 0x00 dlen 10              #180 [hci1] 12.840950
      ATT: Find Information Response (0x05) len 5
        Format: UUID-16 (0x01)
        Handle: 0x0054
        UUID: Client Characteristic Configuration (0x2902)
> HCI Event: Number of Completed Packets (0x13) plen 5    #181 [hci1] 13.015349
        Num handles: 1
        Handle: 417 Address: DF:A9:FF:F6:B1:1A (OUI DF-A9-FF)
        Count: 1
        #180: len 10 (0 Kb/s)
        Latency: 174 msec (78-174 msec ~168 msec)
> ACL Data RX: Handle 417 flags 0x02 dlen 9               #182 [hci1] 13.015730
      ATT: Find Information Request (0x04) len 4
        Handle range: 0x0057-0x0057
< HCI Command: Host Number of Com.. (0x03|0x0035) plen 5  #183 [hci1] 13.020981
        Num handles: 1
        Handle: 417 Address: DF:A9:FF:F6:B1:1A (OUI DF-A9-FF)
        Count: 1
< ACL Data TX: Handle 417 flags 0x00 dlen 10              #184 [hci1] 13.021043
      ATT: Find Information Response (0x05) len 5
        Format: UUID-16 (0x01)
        Handle: 0x0057
        UUID: Client Characteristic Configuration (0x2902)
> HCI Event: Number of Completed Packets (0x13) plen 5    #185 [hci1] 13.190467
        Num handles: 1
        Handle: 417 Address: DF:A9:FF:F6:B1:1A (OUI DF-A9-FF)
        Count: 1
        #184: len 10 (0 Kb/s)
        Latency: 169 msec (78-174 msec ~169 msec)
> ACL Data RX: Handle 417 flags 0x02 dlen 9               #186 [hci1] 13.190614
      ATT: Find Information Request (0x04) len 4
        Handle range: 0x005c-0x005c
< HCI Command: Host Number of Com.. (0x03|0x0035) plen 5  #187 [hci1] 13.201414
        Num handles: 1
        Handle: 417 Address: DF:A9:FF:F6:B1:1A (OUI DF-A9-FF)
        Count: 1
< ACL Data TX: Handle 417 flags 0x00 dlen 10              #188 [hci1] 13.201482
      ATT: Find Information Response (0x05) len 5
        Format: UUID-16 (0x01)
        Handle: 0x005c
        UUID: Client Characteristic Configuration (0x2902)
> HCI Event: Number of Completed Packets (0x13) plen 5    #189 [hci1] 13.365372
        Num handles: 1
        Handle: 417 Address: DF:A9:FF:F6:B1:1A (OUI DF-A9-FF)
        Count: 1
        #188: len 10 (0 Kb/s)
        Latency: 163 msec (78-174 msec ~166 msec)
> ACL Data RX: Handle 417 flags 0x02 dlen 9               #190 [hci1] 13.365630
      ATT: Find Information Request (0x04) len 4
        Handle range: 0x005f-0x005f
< HCI Command: Host Number of Com.. (0x03|0x0035) plen 5  #191 [hci1] 13.380900
        Num handles: 1
        Handle: 417 Address: DF:A9:FF:F6:B1:1A (OUI DF-A9-FF)
        Count: 1
< ACL Data TX: Handle 417 flags 0x00 dlen 10              #192 [hci1] 13.380925
      ATT: Find Information Response (0x05) len 5
        Format: UUID-16 (0x01)
        Handle: 0x005f
        UUID: Client Characteristic Configuration (0x2902)
> HCI Event: Number of Completed Packets (0x13) plen 5    #193 [hci1] 13.540434
        Num handles: 1
        Handle: 417 Address: DF:A9:FF:F6:B1:1A (OUI DF-A9-FF)
        Count: 1
        #192: len 10 (0 Kb/s)
        Latency: 159 msec (78-174 msec ~162 msec)
> ACL Data RX: Handle 417 flags 0x02 dlen 9               #194 [hci1] 13.540681
      ATT: Find Information Request (0x04) len 4
        Handle range: 0x0062-0x0062
< HCI Command: Host Number of Com.. (0x03|0x0035) plen 5  #195 [hci1] 13.541244
        Num handles: 1
        Handle: 417 Address: DF:A9:FF:F6:B1:1A (OUI DF-A9-FF)
        Count: 1
< ACL Data TX: Handle 417 flags 0x00 dlen 10              #196 [hci1] 13.541380
      ATT: Find Information Response (0x05) len 5
        Format: UUID-16 (0x01)
        Handle: 0x0062
        UUID: Client Characteristic Configuration (0x2902)
> HCI Event: Number of Completed Packets (0x13) plen 5    #197 [hci1] 13.715439
        Num handles: 1
        Handle: 417 Address: DF:A9:FF:F6:B1:1A (OUI DF-A9-FF)
        Count: 1
        #196: len 10 (0 Kb/s)
        Latency: 174 msec (78-174 msec ~168 msec)
> ACL Data RX: Handle 417 flags 0x02 dlen 9               #198 [hci1] 13.715625
      ATT: Find Information Request (0x04) len 4
        Handle range: 0x0065-0x0065
< HCI Command: Host Number of Com.. (0x03|0x0035) plen 5  #199 [hci1] 13.721291
        Num handles: 1
        Handle: 417 Address: DF:A9:FF:F6:B1:1A (OUI DF-A9-FF)
        Count: 1
< ACL Data TX: Handle 417 flags 0x00 dlen 10              #200 [hci1] 13.721355
      ATT: Find Information Response (0x05) len 5
        Format: UUID-16 (0x01)
        Handle: 0x0065
        UUID: Client Characteristic Configuration (0x2902)
> HCI Event: Number of Completed Packets (0x13) plen 5    #201 [hci1] 13.890414
        Num handles: 1
        Handle: 417 Address: DF:A9:FF:F6:B1:1A (OUI DF-A9-FF)
        Count: 1
        #200: len 10 (0 Kb/s)
        Latency: 169 msec (78-174 msec ~168 msec)
> ACL Data RX: Handle 417 flags 0x02 dlen 9               #202 [hci1] 13.890622
      ATT: Find Information Request (0x04) len 4
        Handle range: 0x0068-0x0068
< HCI Command: Host Number of Com.. (0x03|0x0035) plen 5  #203 [hci1] 13.901020
        Num handles: 1
        Handle: 417 Address: DF:A9:FF:F6:B1:1A (OUI DF-A9-FF)
        Count: 1
< ACL Data TX: Handle 417 flags 0x00 dlen 10              #204 [hci1] 13.901028
      ATT: Find Information Response (0x05) len 5
        Format: UUID-16 (0x01)
        Handle: 0x0068
        UUID: Client Characteristic Configuration (0x2902)
> HCI Event: Number of Completed Packets (0x13) plen 5    #205 [hci1] 14.065377
        Num handles: 1
        Handle: 417 Address: DF:A9:FF:F6:B1:1A (OUI DF-A9-FF)
        Count: 1
        #204: len 10 (0 Kb/s)
        Latency: 164 msec (78-174 msec ~166 msec)
> ACL Data RX: Handle 417 flags 0x02 dlen 9               #206 [hci1] 14.065618
      ATT: Find Information Request (0x04) len 4
        Handle range: 0x006d-0x006d
< HCI Command: Host Number of Com.. (0x03|0x0035) plen 5  #207 [hci1] 14.081305
        Num handles: 1
        Handle: 417 Address: DF:A9:FF:F6:B1:1A (OUI DF-A9-FF)
        Count: 1
< ACL Data TX: Handle 417 flags 0x00 dlen 10              #208 [hci1] 14.081393
      ATT: Find Information Response (0x05) len 5
        Format: UUID-16 (0x01)
        Handle: 0x006d
        UUID: Client Characteristic Configuration (0x2902)
> HCI Event: Number of Completed Packets (0x13) plen 5    #209 [hci1] 14.240391
        Num handles: 1
        Handle: 417 Address: DF:A9:FF:F6:B1:1A (OUI DF-A9-FF)
        Count: 1
        #208: len 10 (0 Kb/s)
        Latency: 158 msec (78-174 msec ~162 msec)
> ACL Data RX: Handle 417 flags 0x02 dlen 9               #210 [hci1] 14.240599
      ATT: Find Information Request (0x04) len 4
        Handle range: 0x0070-0x0070
< HCI Command: Host Number of Com.. (0x03|0x0035) plen 5  #211 [hci1] 14.241218
        Num handles: 1
        Handle: 417 Address: DF:A9:FF:F6:B1:1A (OUI DF-A9-FF)
        Count: 1
< ACL Data TX: Handle 417 flags 0x00 dlen 10              #212 [hci1] 14.241269
      ATT: Find Information Response (0x05) len 5
        Format: UUID-16 (0x01)
        Handle: 0x0070
        UUID: Client Characteristic Configuration (0x2902)
> HCI Event: Number of Completed Packets (0x13) plen 5    #213 [hci1] 14.415512
        Num handles: 1
        Handle: 417 Address: DF:A9:FF:F6:B1:1A (OUI DF-A9-FF)
        Count: 1
        #212: len 10 (0 Kb/s)
        Latency: 174 msec (78-174 msec ~168 msec)
> ACL Data RX: Handle 417 flags 0x02 dlen 9               #214 [hci1] 14.415615
      ATT: Find Information Request (0x04) len 4
        Handle range: 0x0073-0x0073
< HCI Command: Host Number of Com.. (0x03|0x0035) plen 5  #215 [hci1] 14.420925
        Num handles: 1
        Handle: 417 Address: DF:A9:FF:F6:B1:1A (OUI DF-A9-FF)
        Count: 1
< ACL Data TX: Handle 417 flags 0x00 dlen 10              #216 [hci1] 14.420949
      ATT: Find Information Response (0x05) len 5
        Format: UUID-16 (0x01)
        Handle: 0x0073
        UUID: Client Characteristic Configuration (0x2902)
> HCI Event: Number of Completed Packets (0x13) plen 5    #217 [hci1] 14.590395
        Num handles: 1
        Handle: 417 Address: DF:A9:FF:F6:B1:1A (OUI DF-A9-FF)
        Count: 1
        #216: len 10 (0 Kb/s)
        Latency: 169 msec (78-174 msec ~168 msec)
> ACL Data RX: Handle 417 flags 0x02 dlen 9               #218 [hci1] 14.590663
      ATT: Find Information Request (0x04) len 4
        Handle range: 0x0076-0x0076
< HCI Command: Host Number of Com.. (0x03|0x0035) plen 5  #219 [hci1] 14.601163
        Num handles: 1
        Handle: 417 Address: DF:A9:FF:F6:B1:1A (OUI DF-A9-FF)
        Count: 1
< ACL Data TX: Handle 417 flags 0x00 dlen 10              #220 [hci1] 14.601300
      ATT: Find Information Response (0x05) len 5
        Format: UUID-16 (0x01)
        Handle: 0x0076
        UUID: Client Characteristic Configuration (0x2902)
> HCI Event: Number of Completed Packets (0x13) plen 5    #221 [hci1] 14.765401
        Num handles: 1
        Handle: 417 Address: DF:A9:FF:F6:B1:1A (OUI DF-A9-FF)
        Count: 1
        #220: len 10 (0 Kb/s)
        Latency: 164 msec (78-174 msec ~166 msec)
> ACL Data RX: Handle 417 flags 0x02 dlen 9               #222 [hci1] 14.765661
      ATT: Find Information Request (0x04) len 4
        Handle range: 0x0079-0x0079
< HCI Command: Host Number of Com.. (0x03|0x0035) plen 5  #223 [hci1] 14.781429
        Num handles: 1
        Handle: 417 Address: DF:A9:FF:F6:B1:1A (OUI DF-A9-FF)
        Count: 1
< ACL Data TX: Handle 417 flags 0x00 dlen 10              #224 [hci1] 14.781543
      ATT: Find Information Response (0x05) len 5
        Format: UUID-16 (0x01)
        Handle: 0x0079
        UUID: Client Characteristic Configuration (0x2902)
> HCI Event: Number of Completed Packets (0x13) plen 5    #225 [hci1] 14.940401
        Num handles: 1
        Handle: 417 Address: DF:A9:FF:F6:B1:1A (OUI DF-A9-FF)
        Count: 1
        #224: len 10 (0 Kb/s)
        Latency: 158 msec (78-174 msec ~162 msec)
> ACL Data RX: Handle 417 flags 0x02 dlen 9               #226 [hci1] 14.940628
      ATT: Write Request (0x12) len 4
        Handle: 0x006d
          Data: 0000
< HCI Command: Host Number of Com.. (0x03|0x0035) plen 5  #227 [hci1] 14.940962
        Num handles: 1
        Handle: 417 Address: DF:A9:FF:F6:B1:1A (OUI DF-A9-FF)
        Count: 1
< ACL Data TX: Handle 417 flags 0x00 dlen 5               #228 [hci1] 14.940988
      ATT: Write Response (0x13) len 0
> HCI Event: Number of Completed Packets (0x13) plen 5    #229 [hci1] 15.115420
        Num handles: 1
        Handle: 417 Address: DF:A9:FF:F6:B1:1A (OUI DF-A9-FF)
        Count: 1
        #228: len 5 (0 Kb/s)
        Latency: 174 msec (78-174 msec ~168 msec)
> ACL Data RX: Handle 417 flags 0x02 dlen 9               #230 [hci1] 15.115641
      ATT: Write Request (0x12) len 4
        Handle: 0x006d
          Data: 0100
< HCI Command: Host Number of Com.. (0x03|0x0035) plen 5  #231 [hci1] 15.121484
        Num handles: 1
        Handle: 417 Address: DF:A9:FF:F6:B1:1A (OUI DF-A9-FF)
        Count: 1
< ACL Data TX: Handle 417 flags 0x00 dlen 5               #232 [hci1] 15.121569
      ATT: Write Response (0x13) len 0
> HCI Event: Number of Completed Packets (0x13) plen 5    #233 [hci1] 15.290336
        Num handles: 1
        Handle: 417 Address: DF:A9:FF:F6:B1:1A (OUI DF-A9-FF)
        Count: 1
        #232: len 5 (0 Kb/s)
        Latency: 168 msec (78-174 msec ~168 msec)
> ACL Data RX: Handle 417 flags 0x02 dlen 9               #234 [hci1] 15.290531
      ATT: Write Request (0x12) len 4
        Handle: 0x0070
          Data: 0000
< HCI Command: Host Number of Com.. (0x03|0x0035) plen 5  #235 [hci1] 15.301083
        Num handles: 1
        Handle: 417 Address: DF:A9:FF:F6:B1:1A (OUI DF-A9-FF)
        Count: 1
< ACL Data TX: Handle 417 flags 0x00 dlen 5               #236 [hci1] 15.301094
      ATT: Write Response (0x13) len 0
> HCI Event: Number of Completed Packets (0x13) plen 5    #237 [hci1] 15.465400
        Num handles: 1
        Handle: 417 Address: DF:A9:FF:F6:B1:1A (OUI DF-A9-FF)
        Count: 1
        #236: len 5 (0 Kb/s)
        Latency: 164 msec (78-174 msec ~166 msec)
> ACL Data RX: Handle 417 flags 0x02 dlen 9               #238 [hci1] 15.465632
      ATT: Write Request (0x12) len 4
        Handle: 0x0070
          Data: 0100
< HCI Command: Host Number of Com.. (0x03|0x0035) plen 5  #239 [hci1] 15.480913
        Num handles: 1
        Handle: 417 Address: DF:A9:FF:F6:B1:1A (OUI DF-A9-FF)
        Count: 1
< ACL Data TX: Handle 417 flags 0x00 dlen 5               #240 [hci1] 15.480978
      ATT: Write Response (0x13) len 0
> HCI Event: Number of Completed Packets (0x13) plen 5    #241 [hci1] 15.640370
        Num handles: 1
        Handle: 417 Address: DF:A9:FF:F6:B1:1A (OUI DF-A9-FF)
        Count: 1
        #240: len 5 (0 Kb/s)
        Latency: 159 msec (78-174 msec ~162 msec)
> ACL Data RX: Handle 417 flags 0x02 dlen 9               #242 [hci1] 15.640698
      ATT: Write Request (0x12) len 4
        Handle: 0x0048
          Data: 0000
< HCI Command: Host Number of Com.. (0x03|0x0035) plen 5  #243 [hci1] 15.641370
        Num handles: 1
        Handle: 417 Address: DF:A9:FF:F6:B1:1A (OUI DF-A9-FF)
        Count: 1
< ACL Data TX: Handle 417 flags 0x00 dlen 5               #244 [hci1] 15.641494
      ATT: Write Response (0x13) len 0
> HCI Event: Number of Completed Packets (0x13) plen 5    #245 [hci1] 15.815309
        Num handles: 1
        Handle: 417 Address: DF:A9:FF:F6:B1:1A (OUI DF-A9-FF)
        Count: 1
        #244: len 5 (0 Kb/s)
        Latency: 173 msec (78-174 msec ~168 msec)
> ACL Data RX: Handle 417 flags 0x02 dlen 9               #246 [hci1] 15.815679
      ATT: Write Request (0x12) len 4
        Handle: 0x0048
          Data: 0100
< HCI Command: Host Number of Com.. (0x03|0x0035) plen 5  #247 [hci1] 15.820994
        Num handles: 1
        Handle: 417 Address: DF:A9:FF:F6:B1:1A (OUI DF-A9-FF)
        Count: 1
< ACL Data TX: Handle 417 flags 0x00 dlen 5               #248 [hci1] 15.821032
      ATT: Write Response (0x13) len 0
> HCI Event: Number of Completed Packets (0x13) plen 5    #249 [hci1] 15.990391
        Num handles: 1
        Handle: 417 Address: DF:A9:FF:F6:B1:1A (OUI DF-A9-FF)
        Count: 1
        #248: len 5 (0 Kb/s)
        Latency: 169 msec (78-174 msec ~168 msec)
> ACL Data RX: Handle 417 flags 0x02 dlen 9               #250 [hci1] 15.990649
      ATT: Write Request (0x12) len 4
        Handle: 0x0051
          Data: 0000
< HCI Command: Host Number of Com.. (0x03|0x0035) plen 5  #251 [hci1] 16.000959
        Num handles: 1
        Handle: 417 Address: DF:A9:FF:F6:B1:1A (OUI DF-A9-FF)
        Count: 1
< ACL Data TX: Handle 417 flags 0x00 dlen 5               #252 [hci1] 16.001012
      ATT: Write Response (0x13) len 0
> HCI Event: Number of Completed Packets (0x13) plen 5    #253 [hci1] 16.165361
        Num handles: 1
        Handle: 417 Address: DF:A9:FF:F6:B1:1A (OUI DF-A9-FF)
        Count: 1
        #252: len 5 (0 Kb/s)
        Latency: 164 msec (78-174 msec ~166 msec)
> ACL Data RX: Handle 417 flags 0x02 dlen 9               #254 [hci1] 16.165666
      ATT: Write Request (0x12) len 4
        Handle: 0x0051
          Data: 0100
< HCI Command: Host Number of Com.. (0x03|0x0035) plen 5  #255 [hci1] 16.181276
        Num handles: 1
        Handle: 417 Address: DF:A9:FF:F6:B1:1A (OUI DF-A9-FF)
        Count: 1
< ACL Data TX: Handle 417 flags 0x00 dlen 5               #256 [hci1] 16.181358
      ATT: Write Response (0x13) len 0
> HCI Event: Number of Completed Packets (0x13) plen 5    #257 [hci1] 16.340462
        Num handles: 1
        Handle: 417 Address: DF:A9:FF:F6:B1:1A (OUI DF-A9-FF)
        Count: 1
        #256: len 5 (0 Kb/s)
        Latency: 159 msec (78-174 msec ~162 msec)
> ACL Data RX: Handle 417 flags 0x02 dlen 9               #258 [hci1] 16.340646
      ATT: Write Request (0x12) len 4
        Handle: 0x004e
          Data: 0000
< HCI Command: Host Number of Com.. (0x03|0x0035) plen 5  #259 [hci1] 16.341004
        Num handles: 1
        Handle: 417 Address: DF:A9:FF:F6:B1:1A (OUI DF-A9-FF)
        Count: 1
< ACL Data TX: Handle 417 flags 0x00 dlen 5               #260 [hci1] 16.341044
      ATT: Write Response (0x13) len 0
> HCI Event: Number of Completed Packets (0x13) plen 5    #261 [hci1] 16.515368
        Num handles: 1
        Handle: 417 Address: DF:A9:FF:F6:B1:1A (OUI DF-A9-FF)
        Count: 1
        #260: len 5 (0 Kb/s)
        Latency: 174 msec (78-174 msec ~168 msec)
> ACL Data RX: Handle 417 flags 0x02 dlen 9               #262 [hci1] 16.515675
      ATT: Write Request (0x12) len 4
        Handle: 0x004e
          Data: 0100
< HCI Command: Host Number of Com.. (0x03|0x0035) plen 5  #263 [hci1] 16.520986
        Num handles: 1
        Handle: 417 Address: DF:A9:FF:F6:B1:1A (OUI DF-A9-FF)
        Count: 1
< ACL Data TX: Handle 417 flags 0x00 dlen 5               #264 [hci1] 16.521003
      ATT: Write Response (0x13) len 0
> HCI Event: Number of Completed Packets (0x13) plen 5    #265 [hci1] 16.690367
        Num handles: 1
        Handle: 417 Address: DF:A9:FF:F6:B1:1A (OUI DF-A9-FF)
        Count: 1
        #264: len 5 (0 Kb/s)
        Latency: 169 msec (78-174 msec ~168 msec)
> ACL Data RX: Handle 417 flags 0x02 dlen 9               #266 [hci1] 16.690534
      ATT: Write Request (0x12) len 4
        Handle: 0x004b
          Data: 0000
< HCI Command: Host Number of Com.. (0x03|0x0035) plen 5  #267 [hci1] 16.701380
        Num handles: 1
        Handle: 417 Address: DF:A9:FF:F6:B1:1A (OUI DF-A9-FF)
        Count: 1
< ACL Data TX: Handle 417 flags 0x00 dlen 5               #268 [hci1] 16.701528
      ATT: Write Response (0x13) len 0
> HCI Event: Number of Completed Packets (0x13) plen 5    #269 [hci1] 16.865359
        Num handles: 1
        Handle: 417 Address: DF:A9:FF:F6:B1:1A (OUI DF-A9-FF)
        Count: 1
        #268: len 5 (0 Kb/s)
        Latency: 163 msec (78-174 msec ~166 msec)
> ACL Data RX: Handle 417 flags 0x02 dlen 9               #270 [hci1] 16.865632
      ATT: Write Request (0x12) len 4
        Handle: 0x004b
          Data: 0100
< HCI Command: Host Number of Com.. (0x03|0x0035) plen 5  #271 [hci1] 16.881035
        Num handles: 1
        Handle: 417 Address: DF:A9:FF:F6:B1:1A (OUI DF-A9-FF)
        Count: 1
< ACL Data TX: Handle 417 flags 0x00 dlen 5               #272 [hci1] 16.881082
      ATT: Write Response (0x13) len 0
> HCI Event: Number of Completed Packets (0x13) plen 5    #273 [hci1] 17.040351
        Num handles: 1
        Handle: 417 Address: DF:A9:FF:F6:B1:1A (OUI DF-A9-FF)
        Count: 1
        #272: len 5 (0 Kb/s)
        Latency: 159 msec (78-174 msec ~162 msec)
> ACL Data RX: Handle 417 flags 0x02 dlen 9               #274 [hci1] 17.040555
      ATT: Write Request (0x12) len 4
        Handle: 0x005c
          Data: 0000
< HCI Command: Host Number of Com.. (0x03|0x0035) plen 5  #275 [hci1] 17.041044
        Num handles: 1
        Handle: 417 Address: DF:A9:FF:F6:B1:1A (OUI DF-A9-FF)
        Count: 1
< ACL Data TX: Handle 417 flags 0x00 dlen 5               #276 [hci1] 17.041162
      ATT: Write Response (0x13) len 0
> HCI Event: Number of Completed Packets (0x13) plen 5    #277 [hci1] 17.215361
        Num handles: 1
        Handle: 417 Address: DF:A9:FF:F6:B1:1A (OUI DF-A9-FF)
        Count: 1
        #276: len 5 (0 Kb/s)
        Latency: 174 msec (78-174 msec ~168 msec)
> ACL Data RX: Handle 417 flags 0x02 dlen 9               #278 [hci1] 17.215628
      ATT: Write Request (0x12) len 4
        Handle: 0x005c
          Data: 0100
< HCI Command: Host Number of Com.. (0x03|0x0035) plen 5  #279 [hci1] 17.221514
        Num handles: 1
        Handle: 417 Address: DF:A9:FF:F6:B1:1A (OUI DF-A9-FF)
        Count: 1
< ACL Data TX: Handle 417 flags 0x00 dlen 5               #280 [hci1] 17.221582
      ATT: Write Response (0x13) len 0
> HCI Event: Number of Completed Packets (0x13) plen 5    #281 [hci1] 17.390377
        Num handles: 1
        Handle: 417 Address: DF:A9:FF:F6:B1:1A (OUI DF-A9-FF)
        Count: 1
        #280: len 5 (0 Kb/s)
        Latency: 168 msec (78-174 msec ~168 msec)
> ACL Data RX: Handle 417 flags 0x02 dlen 9               #282 [hci1] 17.390628
      ATT: Write Request (0x12) len 4
        Handle: 0x005f
          Data: 0000
< HCI Command: Host Number of Com.. (0x03|0x0035) plen 5  #283 [hci1] 17.400924
        Num handles: 1
        Handle: 417 Address: DF:A9:FF:F6:B1:1A (OUI DF-A9-FF)
        Count: 1
< ACL Data TX: Handle 417 flags 0x00 dlen 5               #284 [hci1] 17.400945
      ATT: Write Response (0x13) len 0
> HCI Event: Number of Completed Packets (0x13) plen 5    #285 [hci1] 17.565410
        Num handles: 1
        Handle: 417 Address: DF:A9:FF:F6:B1:1A (OUI DF-A9-FF)
        Count: 1
        #284: len 5 (0 Kb/s)
        Latency: 164 msec (78-174 msec ~166 msec)
> ACL Data RX: Handle 417 flags 0x02 dlen 9               #286 [hci1] 17.565592
      ATT: Write Request (0x12) len 4
        Handle: 0x005f
          Data: 0100
< HCI Command: Host Number of Com.. (0x03|0x0035) plen 5  #287 [hci1] 17.581092
        Num handles: 1
        Handle: 417 Address: DF:A9:FF:F6:B1:1A (OUI DF-A9-FF)
        Count: 1
< ACL Data TX: Handle 417 flags 0x00 dlen 5               #288 [hci1] 17.581107
      ATT: Write Response (0x13) len 0
> HCI Event: Number of Completed Packets (0x13) plen 5    #289 [hci1] 17.740378
        Num handles: 1
        Handle: 417 Address: DF:A9:FF:F6:B1:1A (OUI DF-A9-FF)
        Count: 1
        #288: len 5 (0 Kb/s)
        Latency: 159 msec (78-174 msec ~162 msec)
> ACL Data RX: Handle 417 flags 0x02 dlen 9               #290 [hci1] 17.740522
      ATT: Write Request (0x12) len 4
        Handle: 0x0065
          Data: 0000
< HCI Command: Host Number of Com.. (0x03|0x0035) plen 5  #291 [hci1] 17.741349
        Num handles: 1
        Handle: 417 Address: DF:A9:FF:F6:B1:1A (OUI DF-A9-FF)
        Count: 1
< ACL Data TX: Handle 417 flags 0x00 dlen 5               #292 [hci1] 17.741457
      ATT: Write Response (0x13) len 0
> HCI Event: Number of Completed Packets (0x13) plen 5    #293 [hci1] 17.915271
        Num handles: 1
        Handle: 417 Address: DF:A9:FF:F6:B1:1A (OUI DF-A9-FF)
        Count: 1
        #292: len 5 (0 Kb/s)
        Latency: 173 msec (78-174 msec ~168 msec)
> ACL Data RX: Handle 417 flags 0x02 dlen 9               #294 [hci1] 17.915647
      ATT: Write Request (0x12) len 4
        Handle: 0x0065
          Data: 0100
< HCI Command: Host Number of Com.. (0x03|0x0035) plen 5  #295 [hci1] 17.921015
        Num handles: 1
        Handle: 417 Address: DF:A9:FF:F6:B1:1A (OUI DF-A9-FF)
        Count: 1
< ACL Data TX: Handle 417 flags 0x00 dlen 5               #296 [hci1] 17.921075
      ATT: Write Response (0x13) len 0
> HCI Event: Number of Completed Packets (0x13) plen 5    #297 [hci1] 18.090307
        Num handles: 1
        Handle: 417 Address: DF:A9:FF:F6:B1:1A (OUI DF-A9-FF)
        Count: 1
        #296: len 5 (0 Kb/s)
        Latency: 169 msec (78-174 msec ~168 msec)
> ACL Data RX: Handle 417 flags 0x02 dlen 11              #298 [hci1] 18.090577
      ATT: Read By Type Request (0x08) len 6
        Handle range: 0x0001-0xffff
        Attribute type: Include (0x2802)
< HCI Command: Host Number of Com.. (0x03|0x0035) plen 5  #299 [hci1] 18.101045
        Num handles: 1
        Handle: 417 Address: DF:A9:FF:F6:B1:1A (OUI DF-A9-FF)
        Count: 1
< ACL Data TX: Handle 417 flags 0x00 dlen 14              #300 [hci1] 18.101076
      ATT: Read By Type Response (0x09) len 9
        Attribute data length: 8
        Attribute data list: 1 entry
        Handle: 0x003e
        Value: 2a003c002518
> HCI Event: Number of Completed Packets (0x13) plen 5    #301 [hci1] 18.265393
        Num handles: 1
        Handle: 417 Address: DF:A9:FF:F6:B1:1A (OUI DF-A9-FF)
        Count: 1
        #300: len 14 (0 Kb/s)
        Latency: 164 msec (78-174 msec ~166 msec)
> ACL Data RX: Handle 417 flags 0x02 dlen 11              #302 [hci1] 18.265612
      ATT: Read By Type Request (0x08) len 6
        Handle range: 0x003f-0xffff
        Attribute type: Include (0x2802)
< HCI Command: Host Number of Com.. (0x03|0x0035) plen 5  #303 [hci1] 18.281560
        Num handles: 1
        Handle: 417 Address: DF:A9:FF:F6:B1:1A (OUI DF-A9-FF)
        Count: 1
< ACL Data TX: Handle 417 flags 0x00 dlen 9               #304 [hci1] 18.281759
      ATT: Error Response (0x01) len 4
        Read By Type Request (0x08)
        Handle: 0x003f
        Error: Attribute Not Found (0x0a)
> HCI Event: Number of Completed Packets (0x13) plen 5    #305 [hci1] 18.440319
        Num handles: 1
        Handle: 417 Address: DF:A9:FF:F6:B1:1A (OUI DF-A9-FF)
        Count: 1
        #304: len 9 (0 Kb/s)
        Latency: 158 msec (78-174 msec ~162 msec)
> ACL Data RX: Handle 417 flags 0x02 dlen 11              #306 [hci1] 18.440566
      ATT: Read By Type Request (0x08) len 6
        Handle range: 0x002a-0x003c
        Attribute type: Characteristic (0x2803)
< HCI Command: Host Number of Com.. (0x03|0x0035) plen 5  #307 [hci1] 18.440955
        Num handles: 1
        Handle: 417 Address: DF:A9:FF:F6:B1:1A (OUI DF-A9-FF)
        Count: 1
< ACL Data TX: Handle 417 flags 0x00 dlen 20              #308 [hci1] 18.440983
      ATT: Read By Type Response (0x09) len 15
        Attribute data length: 7
        Attribute data list: 2 entries
        Handle: 0x002b
        Value: 022c00bd2a
            Properties: 0x02
              Read (0x02)
            Value Handle: 0x002c
            Value UUID: OTS Feature (0x2abd)
        Handle: 0x002d
        Value: 0a2e00be2a
            Properties: 0x0a
              Read (0x02)
              Write (0x08)
            Value Handle: 0x002e
            Value UUID: Object Name (0x2abe)
> HCI Event: Number of Completed Packets (0x13) plen 5    #309 [hci1] 18.615366
        Num handles: 1
        Handle: 417 Address: DF:A9:FF:F6:B1:1A (OUI DF-A9-FF)
        Count: 1
        #308: len 20 (0 Kb/s)
        Latency: 174 msec (78-174 msec ~168 msec)
> ACL Data RX: Handle 417 flags 0x02 dlen 11              #310 [hci1] 18.615589
      ATT: Read By Type Request (0x08) len 6
        Handle range: 0x002e-0x003c
        Attribute type: Characteristic (0x2803)
< HCI Command: Host Number of Com.. (0x03|0x0035) plen 5  #311 [hci1] 18.621508
        Num handles: 1
        Handle: 417 Address: DF:A9:FF:F6:B1:1A (OUI DF-A9-FF)
        Count: 1
< ACL Data TX: Handle 417 flags 0x00 dlen 20              #312 [hci1] 18.621659
      ATT: Read By Type Response (0x09) len 15
        Attribute data length: 7
        Attribute data list: 2 entries
        Handle: 0x002f
        Value: 023000bf2a
            Properties: 0x02
              Read (0x02)
            Value Handle: 0x0030
            Value UUID: Object Type (0x2abf)
        Handle: 0x0031
        Value: 023200c02a
            Properties: 0x02
              Read (0x02)
            Value Handle: 0x0032
            Value UUID: Object Size (0x2ac0)
> HCI Event: Number of Completed Packets (0x13) plen 5    #313 [hci1] 18.790331
        Num handles: 1
        Handle: 417 Address: DF:A9:FF:F6:B1:1A (OUI DF-A9-FF)
        Count: 1
        #312: len 20 (0 Kb/s)
        Latency: 168 msec (78-174 msec ~168 msec)
> ACL Data RX: Handle 417 flags 0x02 dlen 11              #314 [hci1] 18.790578
      ATT: Read By Type Request (0x08) len 6
        Handle range: 0x0032-0x003c
        Attribute type: Characteristic (0x2803)
< HCI Command: Host Number of Com.. (0x03|0x0035) plen 5  #315 [hci1] 18.801509
        Num handles: 1
        Handle: 417 Address: DF:A9:FF:F6:B1:1A (OUI DF-A9-FF)
        Count: 1
< ACL Data TX: Handle 417 flags 0x00 dlen 20              #316 [hci1] 18.801606
      ATT: Read By Type Response (0x09) len 15
        Attribute data length: 7
        Attribute data list: 2 entries
        Handle: 0x0033
        Value: 023400c32a
            Properties: 0x02
              Read (0x02)
            Value Handle: 0x0034
            Value UUID: Object ID (0x2ac3)
        Handle: 0x0035
        Value: 023600c42a
            Properties: 0x02
              Read (0x02)
            Value Handle: 0x0036
            Value UUID: Object Properties (0x2ac4)
> HCI Event: Number of Completed Packets (0x13) plen 5    #317 [hci1] 18.965389
        Num handles: 1
        Handle: 417 Address: DF:A9:FF:F6:B1:1A (OUI DF-A9-FF)
        Count: 1
        #316: len 20 (0 Kb/s)
        Latency: 163 msec (78-174 msec ~166 msec)
> ACL Data RX: Handle 417 flags 0x02 dlen 11              #318 [hci1] 18.965651
      ATT: Read By Type Request (0x08) len 6
        Handle range: 0x0036-0x003c
        Attribute type: Characteristic (0x2803)
< HCI Command: Host Number of Com.. (0x03|0x0035) plen 5  #319 [hci1] 18.981092
        Num handles: 1
        Handle: 417 Address: DF:A9:FF:F6:B1:1A (OUI DF-A9-FF)
        Count: 1
< ACL Data TX: Handle 417 flags 0x00 dlen 20              #320 [hci1] 18.981107
      ATT: Read By Type Response (0x09) len 15
        Attribute data length: 7
        Attribute data list: 2 entries
        Handle: 0x0037
        Value: 283800c52a
            Properties: 0x28
              Write (0x08)
              Indicate (0x20)
            Value Handle: 0x0038
            Value UUID: Object Action Control Point (0x2ac5)
        Handle: 0x003a
        Value: 283b00c62a
            Properties: 0x28
              Write (0x08)
              Indicate (0x20)
            Value Handle: 0x003b
            Value UUID: Object List Control Point (0x2ac6)
> HCI Event: Number of Completed Packets (0x13) plen 5    #321 [hci1] 19.140348
        Num handles: 1
        Handle: 417 Address: DF:A9:FF:F6:B1:1A (OUI DF-A9-FF)
        Count: 1
        #320: len 20 (1 Kb/s)
        Latency: 159 msec (78-174 msec ~162 msec)
> ACL Data RX: Handle 417 flags 0x02 dlen 11              #322 [hci1] 19.140665
      ATT: Read By Type Request (0x08) len 6
        Handle range: 0x003b-0x003c
        Attribute type: Characteristic (0x2803)
< HCI Command: Host Number of Com.. (0x03|0x0035) plen 5  #323 [hci1] 19.140995
        Num handles: 1
        Handle: 417 Address: DF:A9:FF:F6:B1:1A (OUI DF-A9-FF)
        Count: 1
< ACL Data TX: Handle 417 flags 0x00 dlen 9               #324 [hci1] 19.141072
      ATT: Error Response (0x01) len 4
        Read By Type Request (0x08)
        Handle: 0x003b
        Error: Attribute Not Found (0x0a)
> HCI Event: Number of Completed Packets (0x13) plen 5    #325 [hci1] 19.315365
        Num handles: 1
        Handle: 417 Address: DF:A9:FF:F6:B1:1A (OUI DF-A9-FF)
        Count: 1
        #324: len 9 (0 Kb/s)
        Latency: 174 msec (78-174 msec ~168 msec)
> ACL Data RX: Handle 417 flags 0x02 dlen 9               #326 [hci1] 19.315573
      ATT: Find Information Request (0x04) len 4
        Handle range: 0x0039-0x0039
< HCI Command: Host Number of Com.. (0x03|0x0035) plen 5  #327 [hci1] 19.321156
        Num handles: 1
        Handle: 417 Address: DF:A9:FF:F6:B1:1A (OUI DF-A9-FF)
        Count: 1
< ACL Data TX: Handle 417 flags 0x00 dlen 10              #328 [hci1] 19.321234
      ATT: Find Information Response (0x05) len 5
        Format: UUID-16 (0x01)
        Handle: 0x0039
        UUID: Client Characteristic Configuration (0x2902)
> HCI Event: Number of Completed Packets (0x13) plen 5    #329 [hci1] 19.490336
        Num handles: 1
        Handle: 417 Address: DF:A9:FF:F6:B1:1A (OUI DF-A9-FF)
        Count: 1
        #328: len 10 (0 Kb/s)
        Latency: 169 msec (78-174 msec ~168 msec)
> ACL Data RX: Handle 417 flags 0x02 dlen 9               #330 [hci1] 19.490590
      ATT: Find Information Request (0x04) len 4
        Handle range: 0x003c-0x003c
< HCI Command: Host Number of Com.. (0x03|0x0035) plen 5  #331 [hci1] 19.501073
        Num handles: 1
        Handle: 417 Address: DF:A9:FF:F6:B1:1A (OUI DF-A9-FF)
        Count: 1
< ACL Data TX: Handle 417 flags 0x00 dlen 10              #332 [hci1] 19.501081
      ATT: Find Information Response (0x05) len 5
        Format: UUID-16 (0x01)
        Handle: 0x003c
        UUID: Client Characteristic Configuration (0x2902)
> HCI Event: Number of Completed Packets (0x13) plen 5    #333 [hci1] 19.665257
        Num handles: 1
        Handle: 417 Address: DF:A9:FF:F6:B1:1A (OUI DF-A9-FF)
        Count: 1
        #332: len 10 (0 Kb/s)
        Latency: 164 msec (78-174 msec ~166 msec)
> ACL Data RX: Handle 417 flags 0x02 dlen 7               #334 [hci1] 19.665489
      ATT: Read Request (0x0a) len 2
        Handle: 0x002c
< HCI Command: Host Number of Com.. (0x03|0x0035) plen 5  #335 [hci1] 19.681168
        Num handles: 1
        Handle: 417 Address: DF:A9:FF:F6:B1:1A (OUI DF-A9-FF)
        Count: 1
< ACL Data TX: Handle 417 flags 0x00 dlen 13              #336 [hci1] 19.681307
      ATT: Read Response (0x0b) len 8
> HCI Event: Number of Completed Packets (0x13) plen 5    #337 [hci1] 19.840342
        Num handles: 1
        Handle: 417 Address: DF:A9:FF:F6:B1:1A (OUI DF-A9-FF)
        Count: 1
        #336: len 13 (0 Kb/s)
        Latency: 159 msec (78-174 msec ~162 msec)
> ACL Data RX: Handle 417 flags 0x02 dlen 9               #338 [hci1] 19.840606
      ATT: Write Request (0x12) len 4
        Handle: 0x0039
          Data: 0000
< HCI Command: Host Number of Com.. (0x03|0x0035) plen 5  #339 [hci1] 19.841173
        Num handles: 1
        Handle: 417 Address: DF:A9:FF:F6:B1:1A (OUI DF-A9-FF)
        Count: 1
< ACL Data TX: Handle 417 flags 0x00 dlen 5               #340 [hci1] 19.841281
      ATT: Write Response (0x13) len 0
> HCI Event: Number of Completed Packets (0x13) plen 5    #341 [hci1] 20.015226
        Num handles: 1
        Handle: 417 Address: DF:A9:FF:F6:B1:1A (OUI DF-A9-FF)
        Count: 1
        #340: len 5 (0 Kb/s)
        Latency: 173 msec (78-174 msec ~168 msec)
> ACL Data RX: Handle 417 flags 0x02 dlen 9               #342 [hci1] 20.015559
      ATT: Write Request (0x12) len 4
        Handle: 0x0039
          Data: 0200
< HCI Command: Host Number of Com.. (0x03|0x0035) plen 5  #343 [hci1] 20.021017
        Num handles: 1
        Handle: 417 Address: DF:A9:FF:F6:B1:1A (OUI DF-A9-FF)
        Count: 1
< ACL Data TX: Handle 417 flags 0x00 dlen 5               #344 [hci1] 20.021039
      ATT: Write Response (0x13) len 0
> HCI Event: Number of Completed Packets (0x13) plen 5    #345 [hci1] 20.190250
        Num handles: 1
        Handle: 417 Address: DF:A9:FF:F6:B1:1A (OUI DF-A9-FF)
        Count: 1
        #344: len 5 (0 Kb/s)
        Latency: 169 msec (78-174 msec ~168 msec)
> ACL Data RX: Handle 417 flags 0x02 dlen 9               #346 [hci1] 20.190469
      ATT: Write Request (0x12) len 4
        Handle: 0x003c
          Data: 0000
< HCI Command: Host Number of Com.. (0x03|0x0035) plen 5  #347 [hci1] 20.201175
        Num handles: 1
        Handle: 417 Address: DF:A9:FF:F6:B1:1A (OUI DF-A9-FF)
        Count: 1
< ACL Data TX: Handle 417 flags 0x00 dlen 5               #348 [hci1] 20.201268
      ATT: Write Response (0x13) len 0
> HCI Event: Number of Completed Packets (0x13) plen 5    #349 [hci1] 20.365288
        Num handles: 1
        Handle: 417 Address: DF:A9:FF:F6:B1:1A (OUI DF-A9-FF)
        Count: 1
        #348: len 5 (0 Kb/s)
        Latency: 164 msec (78-174 msec ~166 msec)
> ACL Data RX: Handle 417 flags 0x02 dlen 9               #350 [hci1] 20.365487
      ATT: Write Request (0x12) len 4
        Handle: 0x003c
          Data: 0200
< HCI Command: Host Number of Com.. (0x03|0x0035) plen 5  #351 [hci1] 20.381564
        Num handles: 1
        Handle: 417 Address: DF:A9:FF:F6:B1:1A (OUI DF-A9-FF)
        Count: 1
< ACL Data TX: Handle 417 flags 0x00 dlen 5               #352 [hci1] 20.381693
      ATT: Write Response (0x13) len 0
> HCI Event: Number of Completed Packets (0x13) plen 5    #353 [hci1] 20.540251
        Num handles: 1
        Handle: 417 Address: DF:A9:FF:F6:B1:1A (OUI DF-A9-FF)
        Count: 1
        #352: len 5 (0 Kb/s)
        Latency: 158 msec (78-174 msec ~162 msec)
> ACL Data RX: Handle 417 flags 0x02 dlen 7               #354 [hci1] 20.540420
      ATT: Read Request (0x0a) len 2
        Handle: 0x0072
< HCI Command: Host Number of Com.. (0x03|0x0035) plen 5  #355 [hci1] 20.540958
        Num handles: 1
        Handle: 417 Address: DF:A9:FF:F6:B1:1A (OUI DF-A9-FF)
        Count: 1
< ACL Data TX: Handle 417 flags 0x00 dlen 9               #356 [hci1] 20.540987
      ATT: Read Response (0x0b) len 4
> HCI Event: Number of Completed Packets (0x13) plen 5    #357 [hci1] 20.715239
        Num handles: 1
        Handle: 417 Address: DF:A9:FF:F6:B1:1A (OUI DF-A9-FF)
        Count: 1
        #356: len 9 (0 Kb/s)
        Latency: 174 msec (78-174 msec ~168 msec)
> ACL Data RX: Handle 417 flags 0x02 dlen 7               #358 [hci1] 20.715435
      ATT: Read Request (0x0a) len 2
        Handle: 0x006c
< HCI Command: Host Number of Com.. (0x03|0x0035) plen 5  #359 [hci1] 20.721516
        Num handles: 1
        Handle: 417 Address: DF:A9:FF:F6:B1:1A (OUI DF-A9-FF)
        Count: 1
< ACL Data TX: Handle 417 flags 0x00 dlen 6               #360 [hci1] 20.721655
      ATT: Read Response (0x0b) len 1
> HCI Event: Number of Completed Packets (0x13) plen 5    #361 [hci1] 20.890267
        Num handles: 1
        Handle: 417 Address: DF:A9:FF:F6:B1:1A (OUI DF-A9-FF)
        Count: 1
        #360: len 6 (0 Kb/s)
        Latency: 168 msec (78-174 msec ~168 msec)
> ACL Data RX: Handle 417 flags 0x02 dlen 8               #362 [hci1] 20.890466
      ATT: Write Command (0x52) len 3
        Handle: 0x006f
          Data: 01
< HCI Command: Host Number of Com.. (0x03|0x0035) plen 5  #363 [hci1] 20.901857
        Num handles: 1
        Handle: 417 Address: DF:A9:FF:F6:B1:1A (OUI DF-A9-FF)
        Count: 1
< ACL Data TX: Handle 417 flags 0x00 dlen 8               #364 [hci1] 20.902294
      ATT: Handle Value Notification (0x1b) len 3
        Handle: 0x006c
          Data: 01
< ACL Data TX: Handle 417 flags 0x00 dlen 9               #365 [hci1] 20.902503
      ATT: Handle Value Notification (0x1b) len 4
        Handle: 0x006f
          Data: 0101
> HCI Event: Number of Completed Packets (0x13) plen 5    #366 [hci1] 20.978181
        Num handles: 1
        Handle: 417 Address: DF:A9:FF:F6:B1:1A (OUI DF-A9-FF)
        Count: 1
        #364: len 8 (0 Kb/s)
        Latency: 75 msec (75-174 msec ~122 msec)
> HCI Event: Number of Completed Packets (0x13) plen 5    #367 [hci1] 21.065257
        Num handles: 1
        Handle: 417 Address: DF:A9:FF:F6:B1:1A (OUI DF-A9-FF)
        Count: 1
        #365: len 9 (0 Kb/s)
        Latency: 162 msec (75-174 msec ~142 msec)
> ACL Data RX: Handle 417 flags 0x02 dlen 7               #368 [hci1] 21.065552
      ATT: Read Request (0x0a) len 2
        Handle: 0x0064
< HCI Command: Host Number of Com.. (0x03|0x0035) plen 5  #369 [hci1] 21.081049
        Num handles: 1
        Handle: 417 Address: DF:A9:FF:F6:B1:1A (OUI DF-A9-FF)
        Count: 1
< ACL Data TX: Handle 417 flags 0x00 dlen 11              #370 [hci1] 21.081172
      ATT: Read Response (0x0b) len 6
> HCI Event: Number of Completed Packets (0x13) plen 5    #371 [hci1] 21.240216
        Num handles: 1
        Handle: 417 Address: DF:A9:FF:F6:B1:1A (OUI DF-A9-FF)
        Count: 1
        #370: len 11 (0 Kb/s)
        Latency: 159 msec (75-174 msec ~150 msec)
> ACL Data RX: Handle 417 flags 0x02 dlen 7               #372 [hci1] 21.240408
      ATT: Read Request (0x0a) len 2
        Handle: 0x005b
< HCI Command: Host Number of Com.. (0x03|0x0035) plen 5  #373 [hci1] 21.241216
        Num handles: 1
        Handle: 417 Address: DF:A9:FF:F6:B1:1A (OUI DF-A9-FF)
        Count: 1
< ACL Data TX: Handle 417 flags 0x00 dlen 11              #374 [hci1] 21.241272
      ATT: Read Response (0x0b) len 6
> HCI Event: Number of Completed Packets (0x13) plen 5    #375 [hci1] 21.415262
        Num handles: 1
        Handle: 417 Address: DF:A9:FF:F6:B1:1A (OUI DF-A9-FF)
        Count: 1
        #374: len 11 (0 Kb/s)
        Latency: 173 msec (75-174 msec ~162 msec)
> ACL Data RX: Handle 417 flags 0x02 dlen 7               #376 [hci1] 21.415511
      ATT: Read Request (0x0a) len 2
        Handle: 0x005e
< HCI Command: Host Number of Com.. (0x03|0x0035) plen 5  #377 [hci1] 21.421167
        Num handles: 1
        Handle: 417 Address: DF:A9:FF:F6:B1:1A (OUI DF-A9-FF)
        Count: 1
< ACL Data TX: Handle 417 flags 0x00 dlen 11              #378 [hci1] 21.421175
      ATT: Read Response (0x0b) len 6
> HCI Event: Number of Completed Packets (0x13) plen 5    #379 [hci1] 21.590285
        Num handles: 1
        Handle: 417 Address: DF:A9:FF:F6:B1:1A (OUI DF-A9-FF)
        Count: 1
        #378: len 11 (0 Kb/s)
        Latency: 169 msec (75-174 msec ~165 msec)
> ACL Data RX: Handle 417 flags 0x02 dlen 8               #380 [hci1] 21.590564
      ATT: Write Command (0x52) len 3
        Handle: 0x006f
          Data: 30
< HCI Command: Host Number of Com.. (0x03|0x0035) plen 5  #381 [hci1] 21.601214
        Num handles: 1
        Handle: 417 Address: DF:A9:FF:F6:B1:1A (OUI DF-A9-FF)
        Count: 1
< ACL Data TX: Handle 417 flags 0x00 dlen 16              #382 [hci1] 21.601374
      ATT: Handle Value Notification (0x1b) len 11
        Handle: 0x004a
          Data: 547261636b20312e31
< ACL Data TX: Handle 417 flags 0x00 dlen 11              #383 [hci1] 21.601455
      ATT: Handle Value Notification (0x1b) len 6
        Handle: 0x004d
          Data: 30750000
< ACL Data TX: Handle 417 flags 0x00 dlen 11              #384 [hci1] 21.601511
      ATT: Handle Value Notification (0x1b) len 6
        Handle: 0x0050
          Data: 00000000
> HCI Event: Number of Completed Packets (0x13) plen 5    #385 [hci1] 21.678285
        Num handles: 1
        Handle: 417 Address: DF:A9:FF:F6:B1:1A (OUI DF-A9-FF)
        Count: 1
        #382: len 16 (1 Kb/s)
        Latency: 76 msec (75-174 msec ~121 msec)
> HCI Event: Number of Completed Packets (0x13) plen 5    #386 [hci1] 21.678848
        Num handles: 1
        Handle: 417 Address: DF:A9:FF:F6:B1:1A (OUI DF-A9-FF)
        Count: 1
        #383: len 11 (1 Kb/s)
        Latency: 77 msec (75-174 msec ~99 msec)
< ACL Data TX: Handle 417 flags 0x00 dlen 13              #387 [hci1] 21.681191
      ATT: Handle Value Notification (0x1b) len 8
        Handle: 0x005b
          Data: 010100000000
< ACL Data TX: Handle 417 flags 0x00 dlen 13              #388 [hci1] 21.681476
      ATT: Handle Value Notification (0x1b) len 8
        Handle: 0x005e
          Data: 020100000000
> HCI Event: Number of Completed Packets (0x13) plen 5    #389 [hci1] 21.765113
        Num handles: 1
        Handle: 417 Address: DF:A9:FF:F6:B1:1A (OUI DF-A9-FF)
        Count: 1
        #384: len 11 (0 Kb/s)
        Latency: 163 msec (75-174 msec ~131 msec)
> HCI Event: Number of Completed Packets (0x13) plen 5    #390 [hci1] 21.765702
        Num handles: 1
        Handle: 417 Address: DF:A9:FF:F6:B1:1A (OUI DF-A9-FF)
        Count: 1
        #387: len 13 (1 Kb/s)
        Latency: 84 msec (75-174 msec ~107 msec)
< ACL Data TX: Handle 417 flags 0x00 dlen 7               #391 [hci1] 21.780954
      ATT: Handle Value Notification (0x1b) len 2
        Handle: 0x0047
          Data: 
< ACL Data TX: Handle 417 flags 0x00 dlen 9               #392 [hci1] 21.781005
      ATT: Handle Value Notification (0x1b) len 4
        Handle: 0x006f
          Data: 3001
> HCI Event: Number of Completed Packets (0x13) plen 5    #393 [hci1] 21.852721
        Num handles: 1
        Handle: 417 Address: DF:A9:FF:F6:B1:1A (OUI DF-A9-FF)
        Count: 1
        #388: len 13 (0 Kb/s)
        Latency: 171 msec (75-174 msec ~139 msec)
> HCI Event: Number of Completed Packets (0x13) plen 5    #394 [hci1] 21.853226
        Num handles: 1
        Handle: 417 Address: DF:A9:FF:F6:B1:1A (OUI DF-A9-FF)
        Count: 1
        #391: len 7 (0 Kb/s)
        Latency: 72 msec (72-174 msec ~105 msec)
> HCI Event: Number of Completed Packets (0x13) plen 5    #395 [hci1] 21.940169
        Num handles: 1
        Handle: 417 Address: DF:A9:FF:F6:B1:1A (OUI DF-A9-FF)
        Count: 1
        #392: len 9 (0 Kb/s)
        Latency: 159 msec (72-174 msec ~132 msec)
> ACL Data RX: Handle 417 flags 0x02 dlen 7               #396 [hci1] 22.027809
      ATT: Read Request (0x0a) len 2
        Handle: 0x0050
< HCI Command: Host Number of Com.. (0x03|0x0035) plen 5  #397 [hci1] 22.040879
        Num handles: 1
        Handle: 417 Address: DF:A9:FF:F6:B1:1A (OUI DF-A9-FF)
        Count: 1
< ACL Data TX: Handle 417 flags 0x00 dlen 9               #398 [hci1] 22.040937
      ATT: Read Response (0x0b) len 4
> HCI Event: Number of Completed Packets (0x13) plen 5    #399 [hci1] 22.202751
        Num handles: 1
        Handle: 417 Address: DF:A9:FF:F6:B1:1A (OUI DF-A9-FF)
        Count: 1
        #398: len 9 (0 Kb/s)
        Latency: 161 msec (72-174 msec ~147 msec)
> HCI Event: Disconnect Complete (0x05) plen 4            #400 [hci1] 23.602917
        Status: Success (0x00)
        Handle: 417 Address: DF:A9:FF:F6:B1:1A (OUI DF-A9-FF)
        Reason: Remote User Terminated Connection (0x13)
< HCI Command: Reset (0x03|0x0003) plen 0                 #401 [hci1] 30.601259
> HCI Event: Command Complete (0x0e) plen 4               #402 [hci1] 30.601867
      Reset (0x03|0x0003) ncmd 1
        Status: Success (0x00)
@ USER Close: main                                    {0x0001} [hci1] 30.620899
= Close Index: 00:00:00:00:00:00                               [hci1] 30.624145
