Bluetooth monitor ver 5.72
= Note: Linux version 6.14.0-36-generic (x86_64)                       0.168880
= Note: Bluetooth subsystem version 2.22                               0.168882
= New Index: 00:00:00:00:00:00 (Primary,UART,hci1)              [hci1] 0.168883
= New Index: 48:5F:99:8E:E0:64 (Primary,USB,hci0)               [hci0] 0.168884
= Open Index: 00:00:00:00:00:00                                 [hci1] 0.683015
= Index Info: 00:00:00:00:00:00 (Nordic Semiconductor ASA)      [hci1] 0.683031
@ USER Open: main (privileged) version 2.22            {0x0001} [hci1] 0.683036
< HCI Command: Reset (0x03|0x0003) plen 0                    #1 [hci1] 0.683905
> HCI Event: Command Complete (0x0e) plen 4                  #2 [hci1] 0.684396
      Reset (0x03|0x0003) ncmd 1
        Status: Success (0x00)
< HCI Command: Read Local Supported... (0x04|0x0003) plen 0  #3 [hci1] 0.703007
> HCI Event: Command Complete (0x0e) plen 12                 #4 [hci1] 0.703521
      Read Local Supported Features (0x04|0x0003) ncmd 1
        Status: Success (0x00)
        Features: 0x00 0x00 0x00 0x00 0x60 0x00 0x00 0x00
          BR/EDR Not Supported
          LE Supported (Controller)
< HCI Command: Read Local Version In.. (0x04|0x0001) plen 0  #5 [hci1] 0.722754
> HCI Event: Command Complete (0x0e) plen 12                 #6 [hci1] 0.723289
      Read Local Version Information (0x04|0x0001) ncmd 1
        Status: Success (0x00)
        HCI version: Reserved (0x0f) - Revision 12393 (0x3069)
        LMP version: Reserved (0x0f) - Subversion 12393 (0x3069)
        Manufacturer: Nordic Semiconductor ASA (89)
< HCI Command: Read Local Supported... (0x04|0x0002) plen 0  #7 [hci1] 0.742705
> HCI Event: Command Complete (0x0e) plen 68                 #8 [hci1] 0.743765
      Read Local Supported Commands (0x04|0x0002) ncmd 1
        Status: Success (0x00)
        Commands: 119 entries
          Disconnect (Octet 0 - Bit 5)
          Read Remote Version Information (Octet 2 - Bit 7)
          Set Event Mask (Octet 5 - Bit 6)
          Reset (Octet 5 - Bit 7)
          Read Connection Accept Timeout (Octet 7 - Bit 2)
          Write Connection Accept Timeout (Octet 7 - Bit 3)
          Read Transmit Power Level (Octet 10 - Bit 2)
          Set Controller To Host Flow Control (Octet 10 - Bit 5)
          Host Buffer Size (Octet 10 - Bit 6)
          Host Number of Completed Packets (Octet 10 - Bit 7)
          Read Local Version Information (Octet 14 - Bit 3)
          Read Local Supported Features (Octet 14 - Bit 5)
          Read BD ADDR (Octet 15 - Bit 1)
          Read RSSI (Octet 15 - Bit 5)
          Set Event Mask Page 2 (Octet 22 - Bit 2)
          LE Set Event Mask (Octet 25 - Bit 0)
          LE Read Buffer Size (Octet 25 - Bit 1)
          LE Read Local Supported Features (Octet 25 - Bit 2)
          LE Set Random Address (Octet 25 - Bit 4)
          LE Set Advertising Parameters (Octet 25 - Bit 5)
          LE Read Advertising Channel TX Power (Octet 25 - Bit 6)
          LE Set Advertising Data (Octet 25 - Bit 7)
          LE Set Scan Response Data (Octet 26 - Bit 0)
          LE Set Advertise Enable (Octet 26 - Bit 1)
          LE Set Scan Parameters (Octet 26 - Bit 2)
          LE Set Scan Enable (Octet 26 - Bit 3)
          LE Create Connection (Octet 26 - Bit 4)
          LE Create Connection Cancel (Octet 26 - Bit 5)
          LE Read Accept List Size (Octet 26 - Bit 6)
          LE Clear Accept List (Octet 26 - Bit 7)
          LE Add Device To Accept List (Octet 27 - Bit 0)
          LE Remove Device From Accept List (Octet 27 - Bit 1)
          LE Connection Update (Octet 27 - Bit 2)
          LE Set Host Channel Classification (Octet 27 - Bit 3)
          LE Read Channel Map (Octet 27 - Bit 4)
          LE Read Remote Used Features (Octet 27 - Bit 5)
          LE Encrypt (Octet 27 - Bit 6)
          LE Rand (Octet 27 - Bit 7)
          LE Start Encryption (Octet 28 - Bit 0)
          LE Long Term Key Request Reply (Octet 28 - Bit 1)
          LE Long Term Key Request Neg Reply (Octet 28 - Bit 2)
          LE Read Supported States (Octet 28 - Bit 3)
          LE Receiver Test (Octet 28 - Bit 4)
          LE Transmitter Test (Octet 28 - Bit 5)
          LE Test End (Octet 28 - Bit 6)
          Read Authenticated Payload Timeout (Octet 32 - Bit 4)
          Write Authenticated Payload Timeout (Octet 32 - Bit 5)
          LE Set Data Length (Octet 33 - Bit 6)
          LE Read Suggested Default Data Length (Octet 33 - Bit 7)
          LE Write Suggested Default Data Length (Octet 34 - Bit 0)
          LE Add Device To Resolving List (Octet 34 - Bit 3)
          LE Remove Device From Resolving List (Octet 34 - Bit 4)
          LE Clear Resolving List (Octet 34 - Bit 5)
          LE Read Resolving List Size (Octet 34 - Bit 6)
          LE Set Address Resolution Enable (Octet 35 - Bit 1)
          LE Set Resolvable Private Address Timeout (Octet 35 - Bit 2)
          LE Read Maximum Data Length (Octet 35 - Bit 3)
          LE Read PHY (Octet 35 - Bit 4)
          LE Set Default PHY (Octet 35 - Bit 5)
          LE Set PHY (Octet 35 - Bit 6)
          LE Enhanced Receiver Test (Octet 35 - Bit 7)
          LE Enhanced Transmitter Test (Octet 36 - Bit 0)
          LE Set Advertising Set Random Address (Octet 36 - Bit 1)
          LE Set Extended Advertising Parameters (Octet 36 - Bit 2)
          LE Set Extended Advertising Data (Octet 36 - Bit 3)
          LE Set Extended Scan Response Data (Octet 36 - Bit 4)
          LE Set Extended Advertising Enable (Octet 36 - Bit 5)
          LE Read Maximum Advertising Data Length (Octet 36 - Bit 6)
          LE Read Number of Supported Advertising Sets (Octet 36 - Bit 7)
          LE Remove Advertising Set (Octet 37 - Bit 0)
          LE Clear Advertising Sets (Octet 37 - Bit 1)
          LE Set Periodic Advertising Parameters (Octet 37 - Bit 2)
          LE Set Periodic Advertising Data (Octet 37 - Bit 3)
          LE Set Periodic Advertising Enable (Octet 37 - Bit 4)
          LE Set Extended Scan Parameters (Octet 37 - Bit 5)
          LE Set Extended Scan Enable (Octet 37 - Bit 6)
          LE Extended Create Connection (Octet 37 - Bit 7)
          LE Periodic Advertising Create Sync (Octet 38 - Bit 0)
          LE Periodic Advertising Create Sync Cancel (Octet 38 - Bit 1)
          LE Periodic Advertising Terminate Sync (Octet 38 - Bit 2)
          LE Add Device To Periodic Advertiser List (Octet 38 - Bit 3)
          LE Remove Device From Periodic Advertiser List (Octet 38 - Bit 4)
          LE Clear Periodic Advertiser List (Octet 38 - Bit 5)
          LE Read Periodic Advertiser List Size (Octet 38 - Bit 6)
          LE Read Transmit Power (Octet 38 - Bit 7)
          LE Read RF Path Compensation (Octet 39 - Bit 0)
          LE Write RF Path Compensation (Octet 39 - Bit 1)
          LE Set Privacy Mode (Octet 39 - Bit 2)
          LE Periodic Advertising Receive Enable (Octet 40 - Bit 5)
          LE Periodic Advertising Sync Transfer (Octet 40 - Bit 6)
          LE Periodic Advertising Set Info Transfer (Octet 40 - Bit 7)
          LE Periodic Advertising Sync Transfer Parameters (Octet 41 - Bit 0)
          LE Set Default Periodic Advertisng Sync Transfer Parameters (Octet 41 - Bit 1)
          LE Read Buffer v2 (Octet 41 - Bit 5)
          LE Read ISO TX Sync (Octet 41 - Bit 6)
          LE Set Connected Isochronous Group Parameters (Octet 41 - Bit 7)
          LE Set Connected Isochronous Group Parameters Test (Octet 42 - Bit 0)
          LE Create Connected Isochronous Stream (Octet 42 - Bit 1)
          LE Remove Connected Isochronous Group (Octet 42 - Bit 2)
          LE Accept Connected Isochronous Stream Request (Octet 42 - Bit 3)
          LE Reject Connected Isochronous Stream Request (Octet 42 - Bit 4)
          LE Create Broadcast Isochronous Group (Octet 42 - Bit 5)
          LE Create Broadcast Isochronous Group Test (Octet 42 - Bit 6)
          LE Terminate Broadcast Isochronous Group (Octet 42 - Bit 7)
          LE Broadcast Isochronous Group Create Sync (Octet 43 - Bit 0)
          LE Broadcast Isochronous Group Terminate Sync (Octet 43 - Bit 1)
          LE Request Peer SCA (Octet 43 - Bit 2)
          LE Setup Isochronous Data Path (Octet 43 - Bit 3)
          LE Remove Isochronous Data Path (Octet 43 - Bit 4)
          LE Isochronous Transmit Test (Octet 43 - Bit 5)
          LE Isochronous Receive Test (Octet 43 - Bit 6)
          LE Isochronous Read Test Counters (Octet 43 - Bit 7)
          LE Isochronous Read Test Counters (Octet 44 - Bit 0)
          LE Set Host Feature (Octet 44 - Bit 1)
          Octet 44 - Bit 2 
          Octet 45 - Bit 6 
          Octet 46 - Bit 0 
          Octet 46 - Bit 1 
          Octet 46 - Bit 2 
< HCI Command: Host Buffer Size (0x03|0x0033) plen 7         #9 [hci1] 0.762713
        ACL MTU: 255  ACL max packet: 16
        SCO MTU: 0    SCO max packet: 0
> HCI Event: Command Complete (0x0e) plen 4                 #10 [hci1] 0.763263
      Host Buffer Size (0x03|0x0033) ncmd 1
        Status: Success (0x00)
< HCI Command: Set Controller To Ho.. (0x03|0x0031) plen 1  #11 [hci1] 0.782747
        Flow control: ACL Data Packets (0x01)
> HCI Event: Command Complete (0x0e) plen 4                 #12 [hci1] 0.783256
      Set Controller To Host Flow Control (0x03|0x0031) ncmd 1
        Status: Success (0x00)
< HCI Command: LE Read Local Suppor.. (0x08|0x0003) plen 0  #13 [hci1] 0.802744
> HCI Event: Command Complete (0x0e) plen 12                #14 [hci1] 0.803230
      LE Read Local Supported Features (0x08|0x0003) ncmd 1
        Status: Success (0x00)
        Features: 0xfd 0x79 0x00 0xf7 0x30 0x01 0x00 0x00
          LE Encryption
          Extended Reject Indication
          Peripheral-initiated Features Exchange
          LE Ping
          LE Data Packet Length Extension
          LL Privacy
          Extended Scanner Filter Policies
          LE 2M PHY
          LE Coded PHY
          LE Extended Advertising
          LE Periodic Advertising
          Channel Selection Algorithm #2
          Periodic Advertising Sync Transfer - Sender
          Periodic Advertising Sync Transfer - Recipient
          Sleep Clock Accuracy Updates
          Connected Isochronous Stream - Central
          Connected Isochronous Stream - Peripheral
          Isochronous Broadcaster
          Synchronized Receiver
          Periodic Advertising ADI support
          Connection Subrating
          Unknown features (0x0000010000000000)
< HCI Command: LE Set Host Feature (0x08|0x0074) plen 2     #15 [hci1] 0.822705
        Bit Number: 32
          Connected Isochronous Stream (Host Support)
        Bit Value: 1
> HCI Event: Command Complete (0x0e) plen 4                 #16 [hci1] 0.823130
      LE Set Host Feature (0x08|0x0074) ncmd 1
        Status: Success (0x00)
< HCI Command: LE Read Buffer v2 (0x08|0x0060) plen 0       #17 [hci1] 0.842709
> HCI Event: Command Complete (0x0e) plen 10                #18 [hci1] 0.843208
      LE Read Buffer v2 (0x08|0x0060) ncmd 1
        Status: Success (0x00)
        ACL MTU: 27
        ACL max packet: 3
        ISO MTU: 318
        ISO max packet: 3
< HCI Command: LE Read Maximum Adve.. (0x08|0x003a) plen 0  #19 [hci1] 0.862769
> HCI Event: Command Complete (0x0e) plen 6                 #20 [hci1] 0.863277
      LE Read Maximum Advertising Data Length (0x08|0x003a) ncmd 1
        Status: Success (0x00)
        Max length: 1650
< HCI Command: LE Read Supported St.. (0x08|0x001c) plen 0  #21 [hci1] 0.882717
> HCI Event: Command Complete (0x0e) plen 12                #22 [hci1] 0.883210
      LE Read Supported States (0x08|0x001c) ncmd 1
        Status: Success (0x00)
        States: 0x000003ff3e0306ff
          Non-connectable Advertising State
          Scannable Advertising State
          Connectable Advertising State
          High Duty Cycle Directed Advertising State
          Passive Scanning State
          Active Scanning State
          Initiating State
            and Connection State (Central Role)
          Connection State (Peripheral Role)
          Scannable Advertising State
            and Passive Scanning State
          Connectable Advertising State
            and Passive Scanning State
          Non-connectable Advertising State
            and Initiating State
          Scannable Advertising State
            and Initiating State
          Active Scanning State
            and Connection State (Central Role)
          Passive Scanning State
            and Connection State (Peripheral Role)
          Active Scanning State
            and Connection State (Peripheral Role)
          Initiating State
            and Connection State (Central Role)
            and Central Role & Central Role
          Low Duty Cycle Directed Advertising State
          Connectable Advertising State
            and Initiating State
            and Central Role & Peripheral Role
          High Duty Cycle Directed Advertising State
            and Initiating State
            and Central Role & Peripheral Role
          Low Duty Cycle Directed Advertising State
            and Initiating State
            and Central Role & Peripheral Role
          Connectable Advertising State
            and Connection State (Central Role)
            and Central Role & Peripheral Role
          High Duty Cycle Directed Advertising State
            and Connection State (Central Role)
            and Central Role & Peripheral Role
          Low Duty Cycle Directed Advertising State
            and Connection State (Central Role)
            and Central Role & Peripheral Role
          Connectable Advertising State
            and Connection State (Peripheral Role)
            and Central Role & Peripheral Role
          High Duty Cycle Directed Advertising State
            and Connection State (Peripheral Role)
            and Peripheral Role & Peripheral Role
          Low Duty Cycle Directed Advertising State
            and Connection State (Peripheral Role)
            and Peripheral Role & Peripheral Role
          Initiating State
            and Connection State (Peripheral Role)
            and Central Role & Peripheral Role
< HCI Command: LE Read Maximum Data.. (0x08|0x002f) plen 0  #23 [hci1] 0.902686
> HCI Event: Command Complete (0x0e) plen 12                #24 [hci1] 0.903149
      LE Read Maximum Data Length (0x08|0x002f) ncmd 1
        Status: Success (0x00)
        Max TX octets: 251
        Max TX time: 2704
        Max RX octets: 251
        Max RX time: 2704
< HCI Command: LE Write Suggested D.. (0x08|0x0024) plen 4  #25 [hci1] 0.922680
        TX octets: 251
        TX time: 2704
> HCI Event: Command Complete (0x0e) plen 4                 #26 [hci1] 0.923216
      LE Write Suggested Default Data Length (0x08|0x0024) ncmd 1
        Status: Success (0x00)
< HCI Command: LE Read Resolving Li.. (0x08|0x002a) plen 0  #27 [hci1] 0.942747
> HCI Event: Command Complete (0x0e) plen 5                 #28 [hci1] 0.943140
      LE Read Resolving List Size (0x08|0x002a) ncmd 1
        Status: Success (0x00)
        Size: 8
< HCI Command: LE Set Event Mask (0x08|0x0001) plen 8       #29 [hci1] 0.962683
        Mask: 0x000002023f87fa5e
          LE Advertising Report
          LE Connection Update Complete
          LE Read Remote Used Features Complete
          LE Long Term Key Request
          LE Data Length Change
          LE Enhanced Connection Complete
          LE PHY Update Complete
          LE Extended Advertising Report
          LE Periodic Advertising Sync Established
          LE Periodic Advertising Report
          LE Periodic Advertising Sync Lost
          LE Extended Scan Timeout
          LE Extended Advertising Set Terminated
          LE Scan Request Received
          LE Periodic Advertising Sync Transfer Rvc
          LE CIS Established
          LE CIS Request
          LE Create BIG Complete
          LE Terminate BIG Complete
          LE BIG Sync Estabilished Complete
          LE BIG Sync Lost
          LE BIG Info Advertising Report
          Unknown mask (0x0000020000000000)
> HCI Event: Command Complete (0x0e) plen 4                 #30 [hci1] 0.963206
      LE Set Event Mask (0x08|0x0001) ncmd 1
        Status: Success (0x00)
< HCI Command: Set Event Mask (0x03|0x0001) plen 8          #31 [hci1] 0.982692
        Mask: 0x2000800002008890
          Disconnection Complete
          Encryption Change
          Read Remote Version Information Complete
          Hardware Error
          Data Buffer Overflow
          Encryption Key Refresh Complete
          LE Meta
> HCI Event: Command Complete (0x0e) plen 4                 #32 [hci1] 0.983272
      Set Event Mask (0x03|0x0001) ncmd 1
        Status: Success (0x00)
< HCI Command: Read BD ADDR (0x04|0x0009) plen 0            #33 [hci1] 1.002682
> HCI Event: Command Complete (0x0e) plen 10                #34 [hci1] 1.003177
      Read BD ADDR (0x04|0x0009) ncmd 1
        Status: Success (0x00)
        Address: 00:00:00:00:00:00 (OUI 00-00-00)
< HCI Command: LE Set Random Address (0x08|0x0005) plen 6   #35 [hci1] 1.022741
        Address: D5:B6:CC:31:DB:3B (Static)
> HCI Event: Command Complete (0x0e) plen 4                 #36 [hci1] 1.023276
      LE Set Random Address (0x08|0x0005) ncmd 1
        Status: Success (0x00)
< HCI Command: LE Set Extended Adv.. (0x08|0x0036) plen 25  #37 [hci1] 3.222854
        Handle: 0x00
        Properties: 0x0013
          Connectable
          Scannable
          Use legacy advertising PDUs: ADV_IND
        Min advertising interval: 100.000 msec (0x00a0)
        Max advertising interval: 150.000 msec (0x00f0)
        Channel map: 37, 38, 39 (0x07)
        Own address type: Random (0x01)
        Peer address type: Public (0x00)
        Peer address: 00:00:00:00:00:00 (OUI 00-00-00)
        Filter policy: Allow Scan Request from Any, Allow Connect Request from Any (0x00)
        TX power: Host has no preference (0x7f)
        Primary PHY: LE 1M (0x01)
        Secondary max skip: 0x00
        Secondary PHY: LE 1M (0x01)
        SID: 0x00
        Scan request notifications: Disabled (0x00)
> HCI Event: Command Complete (0x0e) plen 5                 #38 [hci1] 3.223643
      LE Set Extended Advertising Parameters (0x08|0x0036) ncmd 1
        Status: Success (0x00)
        TX power (selected): 0 dbm (0x00)
< HCI Command: LE Set Advertising S.. (0x08|0x0035) plen 7  #39 [hci1] 3.242761
        Advertising handle: 0x00
        Advertising random address: D5:B6:CC:31:DB:3B (Static)
> HCI Event: Command Complete (0x0e) plen 4                 #40 [hci1] 3.243218
      LE Set Advertising Set Random Address (0x08|0x0035) ncmd 1
        Status: Success (0x00)
< HCI Command: LE Set Extended Adv.. (0x08|0x0037) plen 22  #41 [hci1] 3.262724
        Handle: 0x00
        Operation: Complete extended advertising data (0x03)
        Fragment preference: Minimize fragmentation (0x01)
        Data length: 0x12
        Flags: 0x06
          LE General Discoverable Mode
          BR/EDR Not Supported
        Name (complete): Tester_F6B11A
> HCI Event: Command Complete (0x0e) plen 4                 #42 [hci1] 3.263545
      LE Set Extended Advertising Data (0x08|0x0037) ncmd 1
        Status: Success (0x00)
< HCI Command: LE Set Extended Scan.. (0x08|0x0038) plen 4  #43 [hci1] 3.282773
        Handle: 0x00
        Operation: Complete scan response data (0x03)
        Fragment preference: Minimize fragmentation (0x01)
        Data length: 0x00
> HCI Event: Command Complete (0x0e) plen 4                 #44 [hci1] 3.283261
      LE Set Extended Scan Response Data (0x08|0x0038) ncmd 1
        Status: Success (0x00)
< HCI Command: LE Set Extended Adve.. (0x08|0x0039) plen 6  #45 [hci1] 3.302779
        Extended advertising: Enabled (0x01)
        Number of sets: 1 (0x01)
        Entry 0
          Handle: 0x00
          Duration: 0 ms (0x00)
          Max ext adv events: 0
> HCI Event: Command Complete (0x0e) plen 4                 #46 [hci1] 3.303348
      LE Set Extended Advertising Enable (0x08|0x0039) ncmd 1
        Status: Success (0x00)
> HCI Event: LE Meta Event (0x3e) plen 31                   #47 [hci1] 3.409357
      LE Enhanced Connection Complete (0x0a)
        Status: Success (0x00)
        Handle: 489
        Role: Peripheral (0x01)
        Peer address type: Public (0x00)
        Peer address: DF:A9:FF:F6:B1:1A (OUI DF-A9-FF)
        Local resolvable private address: 00:00:00:00:00:00 (Non-Resolvable)
        Peer resolvable private address: 00:00:00:00:00:00 (Non-Resolvable)
        Connection interval: 87.50 msec (0x0046)
        Connection latency: 0 (0x0000)
        Supervision timeout: 20000 msec (0x07d0)
        Central clock accuracy: 0x01
> HCI Event: LE Meta Event (0x3e) plen 6                    #48 [hci1] 3.409491
      LE Advertising Set Terminated (0x12)
        Status: Success (0x00)
        Handle: 0
        Connection handle: 489
        Number of completed extended advertising events: 0
< HCI Command: LE Read Remote Used... (0x08|0x0016) plen 2  #49 [hci1] 3.423776
        Handle: 489 Address: DF:A9:FF:F6:B1:1A (OUI DF-A9-FF)
> HCI Event: Command Status (0x0f) plen 4                   #50 [hci1] 3.424253
      LE Read Remote Used Features (0x08|0x0016) ncmd 1
        Status: Success (0x00)
> HCI Event: LE Meta Event (0x3e) plen 12                   #51 [hci1] 3.673294
      LE Read Remote Used Features (0x04)
        Status: Success (0x00)
        Handle: 489 Address: DF:A9:FF:F6:B1:1A (OUI DF-A9-FF)
        Features: 0x2d 0x49 0x00 0xf7 0x67 0xd8 0x00 0x00
          LE Encryption
          Extended Reject Indication
          Peripheral-initiated Features Exchange
          LE Data Packet Length Extension
          LE 2M PHY
          LE Coded PHY
          Channel Selection Algorithm #2
          Periodic Advertising Sync Transfer - Sender
          Periodic Advertising Sync Transfer - Recipient
          Sleep Clock Accuracy Updates
          Connected Isochronous Stream - Central
          Connected Isochronous Stream - Peripheral
          Isochronous Broadcaster
          Synchronized Receiver
          Connected Isochronous Stream (Host Support)
          LE Power Control Request
          LE Power Control Request
          Connection Subrating
          Connection Subrating (Host Support)
          Unknown features (0x0000d80000000000)
> ACL Data RX: Handle 489 flags 0x02 dlen 11                #52 [hci1] 4.110465
      SMP: Pairing Request (0x01) len 6
        IO capability: KeyboardOnly (0x02)
        OOB data: Authentication data not present (0x00)
        Authentication requirement: No bonding, MITM, SC, No Keypresses (0xcc)
        Max encryption key size: 16
        Initiator key distribution: <none> (0x00)
        Responder key distribution: <none> (0x00)
< HCI Command: Host Number of Compl.. (0x03|0x0035) plen 5  #53 [hci1] 4.123256
        Num handles: 1
        Handle: 489 Address: DF:A9:FF:F6:B1:1A (OUI DF-A9-FF)
        Count: 1
< ACL Data TX: Handle 489 flags 0x00 dlen 11                #54 [hci1] 4.123369
      SMP: Pairing Response (0x02) len 6
        IO capability: DisplayOnly (0x00)
        OOB data: Authentication data not present (0x00)
        Authentication requirement: Bonding, No MITM, SC, No Keypresses (0x09)
        Max encryption key size: 16
        Initiator key distribution: <none> (0x00)
        Responder key distribution: <none> (0x00)
> HCI Event: Number of Completed Packets (0x13) plen 5      #55 [hci1] 4.285597
        Num handles: 1
        Handle: 489 Address: DF:A9:FF:F6:B1:1A (OUI DF-A9-FF)
        Count: 1
        #54: len 11 (0 Kb/s)
        Latency: 162 msec (162-162 msec ~162 msec)
> ACL Data RX: Handle 489 flags 0x02 dlen 27                #56 [hci1] 4.286010
> ACL Data RX: Handle 489 flags 0x01 dlen 27                #57 [hci1] 4.286506
> ACL Data RX: Handle 489 flags 0x01 dlen 15                #58 [hci1] 4.286915
      SMP: Pairing Public Key (0x0c) len 64
        X: 1da9926109019e7f2b4fc0210ae31a98db4ec918709eb48b68b8ec5d2ff31426
        Y: 43fec54640cbc32277aedc071613dd2562b1a0e708229aa03dcd2f7f9b63873a
< HCI Command: Host Number of Compl.. (0x03|0x0035) plen 5  #59 [hci1] 4.303798
        Num handles: 1
        Handle: 489 Address: DF:A9:FF:F6:B1:1A (OUI DF-A9-FF)
        Count: 1
< HCI Command: Host Number of Compl.. (0x03|0x0035) plen 5  #60 [hci1] 4.304033
        Num handles: 1
        Handle: 489 Address: DF:A9:FF:F6:B1:1A (OUI DF-A9-FF)
        Count: 1
< HCI Command: Host Number of Compl.. (0x03|0x0035) plen 5  #61 [hci1] 4.304357
        Num handles: 1
        Handle: 489 Address: DF:A9:FF:F6:B1:1A (OUI DF-A9-FF)
        Count: 1
< ACL Data TX: Handle 489 flags 0x00 dlen 27                #62 [hci1] 4.304483
< ACL Data TX: Handle 489 flags 0x01 dlen 27                #63 [hci1] 4.304503
< ACL Data TX: Handle 489 flags 0x01 dlen 15                #64 [hci1] 4.304537
      SMP: Pairing Public Key (0x0c) len 64
        X: 98308440221e2d910f0e54b71e7ec652857aa9b5a0dc65028824cc19db1226e9
        Y: 67a4816bcb62efb21701e31fdb27561a6217575fb007a8bbdabe7e28b6f68482
> HCI Event: Number of Completed Packets (0x13) plen 5      #65 [hci1] 4.373413
        Num handles: 1
        Handle: 489 Address: DF:A9:FF:F6:B1:1A (OUI DF-A9-FF)
        Count: 1
        #62: len 27 (3 Kb/s)
        Latency: 68 msec (68-162 msec ~115 msec)
> HCI Event: Number of Completed Packets (0x13) plen 5      #66 [hci1] 4.374083
        Num handles: 1
        Handle: 489 Address: DF:A9:FF:F6:B1:1A (OUI DF-A9-FF)
        Count: 1
        #63: len 27 (3 Kb/s)
        Latency: 69 msec (68-162 msec ~92 msec)
> HCI Event: Number of Completed Packets (0x13) plen 5      #67 [hci1] 4.460402
        Num handles: 1
        Handle: 489 Address: DF:A9:FF:F6:B1:1A (OUI DF-A9-FF)
        Count: 1
        #64: len 15 (0 Kb/s)
        Latency: 155 msec (68-162 msec ~124 msec)
> ACL Data RX: Handle 489 flags 0x02 dlen 21                #68 [hci1] 5.423172
      SMP: Pairing Confirm (0x03) len 16
        Confim value: 61dad2ef2ce2bf4da64a5ff746545715
< HCI Command: Host Number of Compl.. (0x03|0x0035) plen 5  #69 [hci1] 5.442954
        Num handles: 1
        Handle: 489 Address: DF:A9:FF:F6:B1:1A (OUI DF-A9-FF)
        Count: 1
< ACL Data TX: Handle 489 flags 0x00 dlen 21                #70 [hci1] 5.443059
      SMP: Pairing Confirm (0x03) len 16
        Confim value: 62dc15abbd44afe1a116e85f5e0a40fc
> HCI Event: Number of Completed Packets (0x13) plen 5      #71 [hci1] 5.597977
        Num handles: 1
        Handle: 489 Address: DF:A9:FF:F6:B1:1A (OUI DF-A9-FF)
        Count: 1
        #70: len 21 (1 Kb/s)
        Latency: 154 msec (68-162 msec ~139 msec)
> ACL Data RX: Handle 489 flags 0x02 dlen 21                #72 [hci1] 5.598269
      SMP: Pairing Random (0x04) len 16
        Random value: e48fd1b7262f74a3c588e8d4ad6f9f1d
< HCI Command: Host Number of Compl.. (0x03|0x0035) plen 5  #73 [hci1] 5.603676
        Num handles: 1
        Handle: 489 Address: DF:A9:FF:F6:B1:1A (OUI DF-A9-FF)
        Count: 1
< ACL Data TX: Handle 489 flags 0x00 dlen 21                #74 [hci1] 5.603797
      SMP: Pairing Random (0x04) len 16
        Random value: 8e6108f966a694cbe26df70bb96773e6
> HCI Event: Number of Completed Packets (0x13) plen 5      #75 [hci1] 5.773053
        Num handles: 1
        Handle: 489 Address: DF:A9:FF:F6:B1:1A (OUI DF-A9-FF)
        Count: 1
        #74: len 21 (0 Kb/s)
        Latency: 169 msec (68-169 msec ~154 msec)
> ACL Data RX: Handle 489 flags 0x02 dlen 21                #76 [hci1] 5.773334
      SMP: Pairing Confirm (0x03) len 16
        Confim value: 37620a1a8a188c78f8a238abe18bc4c5
< HCI Command: Host Number of Compl.. (0x03|0x0035) plen 5  #77 [hci1] 5.782935
        Num handles: 1
        Handle: 489 Address: DF:A9:FF:F6:B1:1A (OUI DF-A9-FF)
        Count: 1
< ACL Data TX: Handle 489 flags 0x00 dlen 21                #78 [hci1] 5.782995
      SMP: Pairing Confirm (0x03) len 16
        Confim value: 0d6ee858971b3cd4946ef0b8de183040
> HCI Event: Number of Completed Packets (0x13) plen 5      #79 [hci1] 5.948104
        Num handles: 1
        Handle: 489 Address: DF:A9:FF:F6:B1:1A (OUI DF-A9-FF)
        Count: 1
        #78: len 21 (1 Kb/s)
        Latency: 165 msec (68-169 msec ~159 msec)
> ACL Data RX: Handle 489 flags 0x02 dlen 21                #80 [hci1] 5.948329
      SMP: Pairing Random (0x04) len 16
        Random value: 19caf9411c994b41d218db210929c329
< HCI Command: Host Number of Compl.. (0x03|0x0035) plen 5  #81 [hci1] 5.963516
        Num handles: 1
        Handle: 489 Address: DF:A9:FF:F6:B1:1A (OUI DF-A9-FF)
        Count: 1
< ACL Data TX: Handle 489 flags 0x00 dlen 21                #82 [hci1] 5.963600
      SMP: Pairing Random (0x04) len 16
        Random value: 4d02679f89a05211af56d8b3da64d21e
> HCI Event: Number of Completed Packets (0x13) plen 5      #83 [hci1] 6.123080
        Num handles: 1
        Handle: 489 Address: DF:A9:FF:F6:B1:1A (OUI DF-A9-FF)
        Count: 1
        #82: len 21 (1 Kb/s)
        Latency: 159 msec (68-169 msec ~159 msec)
> ACL Data RX: Handle 489 flags 0x02 dlen 21                #84 [hci1] 6.123239
      SMP: Pairing Confirm (0x03) len 16
        Confim value: 208f9dfa5cdf8920f874b90e45accfc3
< HCI Command: Host Number of Compl.. (0x03|0x0035) plen 5  #85 [hci1] 6.143064
        Num handles: 1
        Handle: 489 Address: DF:A9:FF:F6:B1:1A (OUI DF-A9-FF)
        Count: 1
< ACL Data TX: Handle 489 flags 0x00 dlen 21                #86 [hci1] 6.143138
      SMP: Pairing Confirm (0x03) len 16
        Confim value: b597c5e04b6d688f39aadd3a9c645353
> HCI Event: Number of Completed Packets (0x13) plen 5      #87 [hci1] 6.298007
        Num handles: 1
        Handle: 489 Address: DF:A9:FF:F6:B1:1A (OUI DF-A9-FF)
        Count: 1
        #86: len 21 (1 Kb/s)
        Latency: 154 msec (68-169 msec ~157 msec)
> ACL Data RX: Handle 489 flags 0x02 dlen 21                #88 [hci1] 6.298292
      SMP: Pairing Random (0x04) len 16
        Random value: 40cf0ec11a1aa0a5a38261d947b2d2d6
< HCI Command: Host Number of Compl.. (0x03|0x0035) plen 5  #89 [hci1] 6.303502
        Num handles: 1
        Handle: 489 Address: DF:A9:FF:F6:B1:1A (OUI DF-A9-FF)
        Count: 1
< ACL Data TX: Handle 489 flags 0x00 dlen 21                #90 [hci1] 6.303710
      SMP: Pairing Random (0x04) len 16
        Random value: 5e8286bc235a02440d0c3424a2acf8fd
> HCI Event: Number of Completed Packets (0x13) plen 5      #91 [hci1] 6.472967
        Num handles: 1
        Handle: 489 Address: DF:A9:FF:F6:B1:1A (OUI DF-A9-FF)
        Count: 1
        #90: len 21 (0 Kb/s)
        Latency: 169 msec (68-169 msec ~163 msec)
> ACL Data RX: Handle 489 flags 0x02 dlen 21                #92 [hci1] 6.473268
      SMP: Pairing Confirm (0x03) len 16
        Confim value: 808d6deb34afe41ab201486a4176dcf6
< HCI Command: Host Number of Compl.. (0x03|0x0035) plen 5  #93 [hci1] 6.483518
        Num handles: 1
        Handle: 489 Address: DF:A9:FF:F6:B1:1A (OUI DF-A9-FF)
        Count: 1
< ACL Data TX: Handle 489 flags 0x00 dlen 21                #94 [hci1] 6.483632
      SMP: Pairing Confirm (0x03) len 16
        Confim value: 32a7d33556e0b64902a4803c216a1b5a
> HCI Event: Number of Completed Packets (0x13) plen 5      #95 [hci1] 6.647981
        Num handles: 1
        Handle: 489 Address: DF:A9:FF:F6:B1:1A (OUI DF-A9-FF)
        Count: 1
        #94: len 21 (1 Kb/s)
        Latency: 164 msec (68-169 msec ~163 msec)
> ACL Data RX: Handle 489 flags 0x02 dlen 21                #96 [hci1] 6.648310
      SMP: Pairing Random (0x04) len 16
        Random value: 66eff4401db5c70824763e63446c01bf
< HCI Command: Host Number of Compl.. (0x03|0x0035) plen 5  #97 [hci1] 6.663546
        Num handles: 1
        Handle: 489 Address: DF:A9:FF:F6:B1:1A (OUI DF-A9-FF)
        Count: 1
< ACL Data TX: Handle 489 flags 0x00 dlen 21                #98 [hci1] 6.663678
      SMP: Pairing Random (0x04) len 16
        Random value: 5c4a1bcadd27bd58e945097b00bad7ac
> HCI Event: Number of Completed Packets (0x13) plen 5      #99 [hci1] 6.822948
        Num handles: 1
        Handle: 489 Address: DF:A9:FF:F6:B1:1A (OUI DF-A9-FF)
        Count: 1
        #98: len 21 (1 Kb/s)
        Latency: 159 msec (68-169 msec ~161 msec)
> ACL Data RX: Handle 489 flags 0x02 dlen 21               #100 [hci1] 6.823444
      SMP: Pairing Confirm (0x03) len 16
        Confim value: 623d5efbd25856e647ec1962ecc47b2f
< HCI Command: Host Number of Comp.. (0x03|0x0035) plen 5  #101 [hci1] 6.843314
        Num handles: 1
        Handle: 489 Address: DF:A9:FF:F6:B1:1A (OUI DF-A9-FF)
        Count: 1
< ACL Data TX: Handle 489 flags 0x00 dlen 21               #102 [hci1] 6.843503
      SMP: Pairing Confirm (0x03) len 16
        Confim value: 49582ee97a8df04a6b6e789f5d0b17fa
> HCI Event: Number of Completed Packets (0x13) plen 5     #103 [hci1] 6.998148
        Num handles: 1
        Handle: 489 Address: DF:A9:FF:F6:B1:1A (OUI DF-A9-FF)
        Count: 1
        #102: len 21 (1 Kb/s)
        Latency: 154 msec (68-169 msec ~158 msec)
> ACL Data RX: Handle 489 flags 0x02 dlen 21               #104 [hci1] 6.998304
      SMP: Pairing Random (0x04) len 16
        Random value: d7bcd10863a955e382e7776a1df7c5bb
< HCI Command: Host Number of Comp.. (0x03|0x0035) plen 5  #105 [hci1] 7.003595
        Num handles: 1
        Handle: 489 Address: DF:A9:FF:F6:B1:1A (OUI DF-A9-FF)
        Count: 1
< ACL Data TX: Handle 489 flags 0x00 dlen 21               #106 [hci1] 7.003763
      SMP: Pairing Random (0x04) len 16
        Random value: 32527e6e64e79f33b2e374394db8ab2d
> HCI Event: Number of Completed Packets (0x13) plen 5     #107 [hci1] 7.173011
        Num handles: 1
        Handle: 489 Address: DF:A9:FF:F6:B1:1A (OUI DF-A9-FF)
        Count: 1
        #106: len 21 (0 Kb/s)
        Latency: 169 msec (68-169 msec ~163 msec)
> ACL Data RX: Handle 489 flags 0x02 dlen 21               #108 [hci1] 7.173300
      SMP: Pairing Confirm (0x03) len 16
        Confim value: 5b5a7d6f1f072b1fc1135e87b837159e
< HCI Command: Host Number of Comp.. (0x03|0x0035) plen 5  #109 [hci1] 7.183536
        Num handles: 1
        Handle: 489 Address: DF:A9:FF:F6:B1:1A (OUI DF-A9-FF)
        Count: 1
< ACL Data TX: Handle 489 flags 0x00 dlen 21               #110 [hci1] 7.183594
      SMP: Pairing Confirm (0x03) len 16
        Confim value: 485f309fef5b7bf3e3d32ed1e0ef868e
> HCI Event: Number of Completed Packets (0x13) plen 5     #111 [hci1] 7.348003
        Num handles: 1
        Handle: 489 Address: DF:A9:FF:F6:B1:1A (OUI DF-A9-FF)
        Count: 1
        #110: len 21 (1 Kb/s)
        Latency: 164 msec (68-169 msec ~164 msec)
> ACL Data RX: Handle 489 flags 0x02 dlen 21               #112 [hci1] 7.348292
      SMP: Pairing Random (0x04) len 16
        Random value: 21050aa1687820f02a0351d52f34d3e3
< HCI Command: Host Number of Comp.. (0x03|0x0035) plen 5  #113 [hci1] 7.363158
        Num handles: 1
        Handle: 489 Address: DF:A9:FF:F6:B1:1A (OUI DF-A9-FF)
        Count: 1
< ACL Data TX: Handle 489 flags 0x00 dlen 21               #114 [hci1] 7.363211
      SMP: Pairing Random (0x04) len 16
        Random value: dddbdfe2838e9a8cc6964353c850fef7
> HCI Event: Number of Completed Packets (0x13) plen 5     #115 [hci1] 7.523065
        Num handles: 1
        Handle: 489 Address: DF:A9:FF:F6:B1:1A (OUI DF-A9-FF)
        Count: 1
        #114: len 21 (1 Kb/s)
        Latency: 159 msec (68-169 msec ~161 msec)
> ACL Data RX: Handle 489 flags 0x02 dlen 21               #116 [hci1] 7.523225
      SMP: Pairing Confirm (0x03) len 16
        Confim value: 1a77c28291a6acc3641aa00940db5a9d
< HCI Command: Host Number of Comp.. (0x03|0x0035) plen 5  #117 [hci1] 7.543614
        Num handles: 1
        Handle: 489 Address: DF:A9:FF:F6:B1:1A (OUI DF-A9-FF)
        Count: 1
< ACL Data TX: Handle 489 flags 0x00 dlen 21               #118 [hci1] 7.543738
      SMP: Pairing Confirm (0x03) len 16
        Confim value: 1d81445f046104d0ac2c1a9a8df83d98
> HCI Event: Number of Completed Packets (0x13) plen 5     #119 [hci1] 7.697885
        Num handles: 1
        Handle: 489 Address: DF:A9:FF:F6:B1:1A (OUI DF-A9-FF)
        Count: 1
        #118: len 21 (1 Kb/s)
        Latency: 154 msec (68-169 msec ~158 msec)
> ACL Data RX: Handle 489 flags 0x02 dlen 21               #120 [hci1] 7.698302
      SMP: Pairing Random (0x04) len 16
        Random value: 11dc43d5eae33c27c93d51ce17452092
< HCI Command: Host Number of Comp.. (0x03|0x0035) plen 5  #121 [hci1] 7.703656
        Num handles: 1
        Handle: 489 Address: DF:A9:FF:F6:B1:1A (OUI DF-A9-FF)
        Count: 1
< ACL Data TX: Handle 489 flags 0x00 dlen 21               #122 [hci1] 7.703777
      SMP: Pairing Random (0x04) len 16
        Random value: eb9f1915536596b6fc3db1c86b2b1970
> HCI Event: Number of Completed Packets (0x13) plen 5     #123 [hci1] 7.873002
        Num handles: 1
        Handle: 489 Address: DF:A9:FF:F6:B1:1A (OUI DF-A9-FF)
        Count: 1
        #122: len 21 (0 Kb/s)
        Latency: 169 msec (68-169 msec ~163 msec)
> ACL Data RX: Handle 489 flags 0x02 dlen 21               #124 [hci1] 7.873253
      SMP: Pairing Confirm (0x03) len 16
        Confim value: 89fae3f0805cc873110edb761fda2eef
< HCI Command: Host Number of Comp.. (0x03|0x0035) plen 5  #125 [hci1] 7.883150
        Num handles: 1
        Handle: 489 Address: DF:A9:FF:F6:B1:1A (OUI DF-A9-FF)
        Count: 1
< ACL Data TX: Handle 489 flags 0x00 dlen 21               #126 [hci1] 7.883224
      SMP: Pairing Confirm (0x03) len 16
        Confim value: 718fe73e25e6189ee521b976cf49c250
> HCI Event: Number of Completed Packets (0x13) plen 5     #127 [hci1] 8.047963
        Num handles: 1
        Handle: 489 Address: DF:A9:FF:F6:B1:1A (OUI DF-A9-FF)
        Count: 1
        #126: len 21 (1 Kb/s)
        Latency: 164 msec (68-169 msec ~164 msec)
> ACL Data RX: Handle 489 flags 0x02 dlen 21               #128 [hci1] 8.048229
      SMP: Pairing Random (0x04) len 16
        Random value: b49362ace5eaffc14d463dbfb28ae15f
< HCI Command: Host Number of Comp.. (0x03|0x0035) plen 5  #129 [hci1] 8.063557
        Num handles: 1
        Handle: 489 Address: DF:A9:FF:F6:B1:1A (OUI DF-A9-FF)
        Count: 1
< ACL Data TX: Handle 489 flags 0x00 dlen 21               #130 [hci1] 8.063642
      SMP: Pairing Random (0x04) len 16
        Random value: 5c794dc9ad9f2c3f295ebd5ad5e1c3cf
> HCI Event: Number of Completed Packets (0x13) plen 5     #131 [hci1] 8.222950
        Num handles: 1
        Handle: 489 Address: DF:A9:FF:F6:B1:1A (OUI DF-A9-FF)
        Count: 1
        #130: len 21 (1 Kb/s)
        Latency: 159 msec (68-169 msec ~161 msec)
> ACL Data RX: Handle 489 flags 0x02 dlen 21               #132 [hci1] 8.223586
      SMP: Pairing Confirm (0x03) len 16
        Confim value: be6118ba1043f8fb2d97d944530bffae
< HCI Command: Host Number of Comp.. (0x03|0x0035) plen 5  #133 [hci1] 8.243527
        Num handles: 1
        Handle: 489 Address: DF:A9:FF:F6:B1:1A (OUI DF-A9-FF)
        Count: 1
< ACL Data TX: Handle 489 flags 0x00 dlen 21               #134 [hci1] 8.243684
      SMP: Pairing Confirm (0x03) len 16
        Confim value: 21e30be7254a4e9d928161a68c1d9533
> HCI Event: Number of Completed Packets (0x13) plen 5     #135 [hci1] 8.397890
        Num handles: 1
        Handle: 489 Address: DF:A9:FF:F6:B1:1A (OUI DF-A9-FF)
        Count: 1
        #134: len 21 (1 Kb/s)
        Latency: 154 msec (68-169 msec ~157 msec)
> ACL Data RX: Handle 489 flags 0x02 dlen 21               #136 [hci1] 8.398185
      SMP: Pairing Random (0x04) len 16
        Random value: 57ba8b6f97d0fd37e20f194f1da58a24
< HCI Command: Host Number of Comp.. (0x03|0x0035) plen 5  #137 [hci1] 8.403242
        Num handles: 1
        Handle: 489 Address: DF:A9:FF:F6:B1:1A (OUI DF-A9-FF)
        Count: 1
< ACL Data TX: Handle 489 flags 0x00 dlen 21               #138 [hci1] 8.403268
      SMP: Pairing Random (0x04) len 16
        Random value: 5c2fff312cdf99c9491988e877355a9a
< ACL Data TX: Handle 489 flags 0x00 dlen 16               #139 [hci1] 8.432811
      LE L2CAP: Connection Parameter Update Request (0x12) ident 1 len 8
        Min interval: 24
        Max interval: 40
        Peripheral latency: 0
        Timeout multiplier: 42
> HCI Event: Number of Completed Packets (0x13) plen 5     #140 [hci1] 8.485923
        Num handles: 1
        Handle: 489 Address: DF:A9:FF:F6:B1:1A (OUI DF-A9-FF)
        Count: 1
        #138: len 21 (2 Kb/s)
        Latency: 82 msec (68-169 msec ~120 msec)
> HCI Event: Number of Completed Packets (0x13) plen 5     #141 [hci1] 8.572866
        Num handles: 1
        Handle: 489 Address: DF:A9:FF:F6:B1:1A (OUI DF-A9-FF)
        Count: 1
        #139: len 16 (0 Kb/s)
        Latency: 140 msec (68-169 msec ~130 msec)
> ACL Data RX: Handle 489 flags 0x02 dlen 21               #142 [hci1] 8.573271
      SMP: Pairing Confirm (0x03) len 16
        Confim value: 6639eb4f3e0058828f8792015f3d9723
< HCI Command: Host Number of Comp.. (0x03|0x0035) plen 5  #143 [hci1] 8.583569
        Num handles: 1
        Handle: 489 Address: DF:A9:FF:F6:B1:1A (OUI DF-A9-FF)
        Count: 1
< ACL Data TX: Handle 489 flags 0x00 dlen 21               #144 [hci1] 8.583715
      SMP: Pairing Confirm (0x03) len 16
        Confim value: d7c8b004a897a2b5e7f1d4200c1ded05
> ACL Data RX: Handle 489 flags 0x02 dlen 10               #145 [hci1] 8.660359
      LE L2CAP: Connection Parameter Update Response (0x13) ident 1 len 2
        Result: Connection Parameters accepted (0x0000)
< HCI Command: Host Number of Comp.. (0x03|0x0035) plen 5  #146 [hci1] 8.663159
        Num handles: 1
        Handle: 489 Address: DF:A9:FF:F6:B1:1A (OUI DF-A9-FF)
        Count: 1
> HCI Event: Number of Completed Packets (0x13) plen 5     #147 [hci1] 8.747950
        Num handles: 1
        Handle: 489 Address: DF:A9:FF:F6:B1:1A (OUI DF-A9-FF)
        Count: 1
        #144: len 21 (1 Kb/s)
        Latency: 164 msec (68-169 msec ~147 msec)
> ACL Data RX: Handle 489 flags 0x02 dlen 21               #148 [hci1] 8.748303
      SMP: Pairing Random (0x04) len 16
        Random value: 862125a87d140b42f5c82968b575d2fa
< HCI Command: Host Number of Comp.. (0x03|0x0035) plen 5  #149 [hci1] 8.763586
        Num handles: 1
        Handle: 489 Address: DF:A9:FF:F6:B1:1A (OUI DF-A9-FF)
        Count: 1
< ACL Data TX: Handle 489 flags 0x00 dlen 21               #150 [hci1] 8.763754
      SMP: Pairing Random (0x04) len 16
        Random value: c629a3a987d808e808655d558dfc1155
> HCI Event: Number of Completed Packets (0x13) plen 5     #151 [hci1] 8.922893
        Num handles: 1
        Handle: 489 Address: DF:A9:FF:F6:B1:1A (OUI DF-A9-FF)
        Count: 1
        #150: len 21 (1 Kb/s)
        Latency: 159 msec (68-169 msec ~153 msec)
> ACL Data RX: Handle 489 flags 0x02 dlen 21               #152 [hci1] 8.923377
      SMP: Pairing Confirm (0x03) len 16
        Confim value: 12f5dba79f363334c90380c9bb6b3d1d
< HCI Command: Host Number of Comp.. (0x03|0x0035) plen 5  #153 [hci1] 8.943651
        Num handles: 1
        Handle: 489 Address: DF:A9:FF:F6:B1:1A (OUI DF-A9-FF)
        Count: 1
< ACL Data TX: Handle 489 flags 0x00 dlen 21               #154 [hci1] 8.943785
      SMP: Pairing Confirm (0x03) len 16
        Confim value: eb5b336bb0a5b43d4ffa7a6598193031
> HCI Event: Number of Completed Packets (0x13) plen 5     #155 [hci1] 9.097871
        Num handles: 1
        Handle: 489 Address: DF:A9:FF:F6:B1:1A (OUI DF-A9-FF)
        Count: 1
        #154: len 21 (1 Kb/s)
        Latency: 154 msec (68-169 msec ~153 msec)
> ACL Data RX: Handle 489 flags 0x02 dlen 21               #156 [hci1] 9.098175
      SMP: Pairing Random (0x04) len 16
        Random value: 0fdbd32053783fdb34e2f433171dac39
< HCI Command: Host Number of Comp.. (0x03|0x0035) plen 5  #157 [hci1] 9.103101
        Num handles: 1
        Handle: 489 Address: DF:A9:FF:F6:B1:1A (OUI DF-A9-FF)
        Count: 1
< ACL Data TX: Handle 489 flags 0x00 dlen 21               #158 [hci1] 9.103184
      SMP: Pairing Random (0x04) len 16
        Random value: 92f20f6ad8f13724432c7fd6001c45ff
> HCI Event: Number of Completed Packets (0x13) plen 5     #159 [hci1] 9.272916
        Num handles: 1
        Handle: 489 Address: DF:A9:FF:F6:B1:1A (OUI DF-A9-FF)
        Count: 1
        #158: len 21 (0 Kb/s)
        Latency: 169 msec (68-169 msec ~161 msec)
> ACL Data RX: Handle 489 flags 0x02 dlen 21               #160 [hci1] 9.273232
      SMP: Pairing Confirm (0x03) len 16
        Confim value: fa4198c1e0e7a64bcf23fa9adb41cd4b
< HCI Command: Host Number of Comp.. (0x03|0x0035) plen 5  #161 [hci1] 9.283636
        Num handles: 1
        Handle: 489 Address: DF:A9:FF:F6:B1:1A (OUI DF-A9-FF)
        Count: 1
< ACL Data TX: Handle 489 flags 0x00 dlen 21               #162 [hci1] 9.283763
      SMP: Pairing Confirm (0x03) len 16
        Confim value: 85e5b2e3bd545508f2ae8d01de50b27a
> HCI Event: Number of Completed Packets (0x13) plen 5     #163 [hci1] 9.447878
        Num handles: 1
        Handle: 489 Address: DF:A9:FF:F6:B1:1A (OUI DF-A9-FF)
        Count: 1
        #162: len 21 (1 Kb/s)
        Latency: 164 msec (68-169 msec ~162 msec)
> ACL Data RX: Handle 489 flags 0x02 dlen 21               #164 [hci1] 9.448150
      SMP: Pairing Random (0x04) len 16
        Random value: ff387adf16fded3c8b0f3e1920fe4f7b
< HCI Command: Host Number of Comp.. (0x03|0x0035) plen 5  #165 [hci1] 9.463200
        Num handles: 1
        Handle: 489 Address: DF:A9:FF:F6:B1:1A (OUI DF-A9-FF)
        Count: 1
< ACL Data TX: Handle 489 flags 0x00 dlen 21               #166 [hci1] 9.463249
      SMP: Pairing Random (0x04) len 16
        Random value: 23ac32ebbb5e14c8a6b9622f296d277f
> HCI Event: Number of Completed Packets (0x13) plen 5     #167 [hci1] 9.622901
        Num handles: 1
        Handle: 489 Address: DF:A9:FF:F6:B1:1A (OUI DF-A9-FF)
        Count: 1
        #166: len 21 (1 Kb/s)
        Latency: 159 msec (68-169 msec ~161 msec)
> ACL Data RX: Handle 489 flags 0x02 dlen 21               #168 [hci1] 9.623150
      SMP: Pairing Confirm (0x03) len 16
        Confim value: 9ea6bce2c3f0f11b9575aadd38818475
< HCI Command: Host Number of Comp.. (0x03|0x0035) plen 5  #169 [hci1] 9.643611
        Num handles: 1
        Handle: 489 Address: DF:A9:FF:F6:B1:1A (OUI DF-A9-FF)
        Count: 1
< ACL Data TX: Handle 489 flags 0x00 dlen 21               #170 [hci1] 9.643724
      SMP: Pairing Confirm (0x03) len 16
        Confim value: 64b0d07946b3d87d34bd0d2dad270831
> HCI Event: Number of Completed Packets (0x13) plen 5     #171 [hci1] 9.797908
        Num handles: 1
        Handle: 489 Address: DF:A9:FF:F6:B1:1A (OUI DF-A9-FF)
        Count: 1
        #170: len 21 (1 Kb/s)
        Latency: 154 msec (68-169 msec ~157 msec)
> ACL Data RX: Handle 489 flags 0x02 dlen 21               #172 [hci1] 9.798289
      SMP: Pairing Random (0x04) len 16
        Random value: a3c9402e04e4aadd27400cc3edb82e99
< HCI Command: Host Number of Comp.. (0x03|0x0035) plen 5  #173 [hci1] 9.803565
        Num handles: 1
        Handle: 489 Address: DF:A9:FF:F6:B1:1A (OUI DF-A9-FF)
        Count: 1
< ACL Data TX: Handle 489 flags 0x00 dlen 21               #174 [hci1] 9.803651
      SMP: Pairing Random (0x04) len 16
        Random value: 297efe85e67448a15f56bd27e3a3cf1d
> HCI Event: Number of Completed Packets (0x13) plen 5     #175 [hci1] 9.972854
        Num handles: 1
        Handle: 489 Address: DF:A9:FF:F6:B1:1A (OUI DF-A9-FF)
        Count: 1
        #174: len 21 (0 Kb/s)
        Latency: 169 msec (68-169 msec ~163 msec)
> ACL Data RX: Handle 489 flags 0x02 dlen 21               #176 [hci1] 9.973353
      SMP: Pairing Confirm (0x03) len 16
        Confim value: a2f5467a361a8a1eb9bdc2c1b06c66d5
< HCI Command: Host Number of Comp.. (0x03|0x0035) plen 5  #177 [hci1] 9.983594
        Num handles: 1
        Handle: 489 Address: DF:A9:FF:F6:B1:1A (OUI DF-A9-FF)
        Count: 1
< ACL Data TX: Handle 489 flags 0x00 dlen 21               #178 [hci1] 9.983705
      SMP: Pairing Confirm (0x03) len 16
        Confim value: 57cb59a0b3f716fd6d8117cb9f4a1a54
> HCI Event: Number of Completed Packets (0x13) plen 5    #179 [hci1] 10.147841
        Num handles: 1
        Handle: 489 Address: DF:A9:FF:F6:B1:1A (OUI DF-A9-FF)
        Count: 1
        #178: len 21 (1 Kb/s)
        Latency: 164 msec (68-169 msec ~163 msec)
> ACL Data RX: Handle 489 flags 0x02 dlen 21              #180 [hci1] 10.148188
      SMP: Pairing Random (0x04) len 16
        Random value: 875f8a9799ad4c7775a5a41adb2cffab
< HCI Command: Host Number of Com.. (0x03|0x0035) plen 5  #181 [hci1] 10.163595
        Num handles: 1
        Handle: 489 Address: DF:A9:FF:F6:B1:1A (OUI DF-A9-FF)
        Count: 1
< ACL Data TX: Handle 489 flags 0x00 dlen 21              #182 [hci1] 10.163702
      SMP: Pairing Random (0x04) len 16
        Random value: 25a9493fd3ce4faf02be7293595bb7c6
> HCI Event: Number of Completed Packets (0x13) plen 5    #183 [hci1] 10.322810
        Num handles: 1
        Handle: 489 Address: DF:A9:FF:F6:B1:1A (OUI DF-A9-FF)
        Count: 1
        #182: len 21 (1 Kb/s)
        Latency: 159 msec (68-169 msec ~161 msec)
> ACL Data RX: Handle 489 flags 0x02 dlen 21              #184 [hci1] 10.323152
      SMP: Pairing Confirm (0x03) len 16
        Confim value: 239cd2ec35fc91fc11fd4bfdd1a826fe
< HCI Command: Host Number of Com.. (0x03|0x0035) plen 5  #185 [hci1] 10.343444
        Num handles: 1
        Handle: 489 Address: DF:A9:FF:F6:B1:1A (OUI DF-A9-FF)
        Count: 1
< ACL Data TX: Handle 489 flags 0x00 dlen 21              #186 [hci1] 10.343640
      SMP: Pairing Confirm (0x03) len 16
        Confim value: 78f633150a3f695aadb5227844e751ff
> HCI Event: Number of Completed Packets (0x13) plen 5    #187 [hci1] 10.497805
        Num handles: 1
        Handle: 489 Address: DF:A9:FF:F6:B1:1A (OUI DF-A9-FF)
        Count: 1
        #186: len 21 (1 Kb/s)
        Latency: 154 msec (68-169 msec ~157 msec)
> ACL Data RX: Handle 489 flags 0x02 dlen 21              #188 [hci1] 10.498188
      SMP: Pairing Random (0x04) len 16
        Random value: 790bfce2931be70423b08947887bb70b
< HCI Command: Host Number of Com.. (0x03|0x0035) plen 5  #189 [hci1] 10.503585
        Num handles: 1
        Handle: 489 Address: DF:A9:FF:F6:B1:1A (OUI DF-A9-FF)
        Count: 1
< ACL Data TX: Handle 489 flags 0x00 dlen 21              #190 [hci1] 10.503703
      SMP: Pairing Random (0x04) len 16
        Random value: 58f6b41f855a6f6c3560debd84e2affc
> HCI Event: Number of Completed Packets (0x13) plen 5    #191 [hci1] 10.672838
        Num handles: 1
        Handle: 489 Address: DF:A9:FF:F6:B1:1A (OUI DF-A9-FF)
        Count: 1
        #190: len 21 (0 Kb/s)
        Latency: 169 msec (68-169 msec ~163 msec)
> ACL Data RX: Handle 489 flags 0x02 dlen 21              #192 [hci1] 10.673259
      SMP: Pairing Confirm (0x03) len 16
        Confim value: b17ae8aaa1fd0898e16bad4138617187
< HCI Command: Host Number of Com.. (0x03|0x0035) plen 5  #193 [hci1] 10.683625
        Num handles: 1
        Handle: 489 Address: DF:A9:FF:F6:B1:1A (OUI DF-A9-FF)
        Count: 1
< ACL Data TX: Handle 489 flags 0x00 dlen 21              #194 [hci1] 10.683649
      SMP: Pairing Confirm (0x03) len 16
        Confim value: 9832f071280b53c5f46eb1d19f552658
> HCI Event: Number of Completed Packets (0x13) plen 5    #195 [hci1] 10.847800
        Num handles: 1
        Handle: 489 Address: DF:A9:FF:F6:B1:1A (OUI DF-A9-FF)
        Count: 1
        #194: len 21 (1 Kb/s)
        Latency: 164 msec (68-169 msec ~163 msec)
> ACL Data RX: Handle 489 flags 0x02 dlen 21              #196 [hci1] 10.848243
      SMP: Pairing Random (0x04) len 16
        Random value: 861e7c19ef2dd1bb1d1282b3cf078b52
< HCI Command: Host Number of Com.. (0x03|0x0035) plen 5  #197 [hci1] 10.863614
        Num handles: 1
        Handle: 489 Address: DF:A9:FF:F6:B1:1A (OUI DF-A9-FF)
        Count: 1
< ACL Data TX: Handle 489 flags 0x00 dlen 21              #198 [hci1] 10.863741
      SMP: Pairing Random (0x04) len 16
        Random value: b67e7216d5bf664139eda2b542549666
> HCI Event: Number of Completed Packets (0x13) plen 5    #199 [hci1] 11.022880
        Num handles: 1
        Handle: 489 Address: DF:A9:FF:F6:B1:1A (OUI DF-A9-FF)
        Count: 1
        #198: len 21 (1 Kb/s)
        Latency: 159 msec (68-169 msec ~161 msec)
> ACL Data RX: Handle 489 flags 0x02 dlen 21              #200 [hci1] 11.023195
      SMP: Pairing Confirm (0x03) len 16
        Confim value: 70abad6da631d2064d2f7d0907f360c3
< HCI Command: Host Number of Com.. (0x03|0x0035) plen 5  #201 [hci1] 11.043457
        Num handles: 1
        Handle: 489 Address: DF:A9:FF:F6:B1:1A (OUI DF-A9-FF)
        Count: 1
< ACL Data TX: Handle 489 flags 0x00 dlen 21              #202 [hci1] 11.043502
      SMP: Pairing Confirm (0x03) len 16
        Confim value: a3f14265e68c775b594fc6780d843c3f
> HCI Event: Number of Completed Packets (0x13) plen 5    #203 [hci1] 11.197836
        Num handles: 1
        Handle: 489 Address: DF:A9:FF:F6:B1:1A (OUI DF-A9-FF)
        Count: 1
        #202: len 21 (1 Kb/s)
        Latency: 154 msec (68-169 msec ~157 msec)
> ACL Data RX: Handle 489 flags 0x02 dlen 21              #204 [hci1] 11.198128
      SMP: Pairing Random (0x04) len 16
        Random value: fb292f84e9259e1790bb9307ce70ef58
< HCI Command: Host Number of Com.. (0x03|0x0035) plen 5  #205 [hci1] 11.203646
        Num handles: 1
        Handle: 489 Address: DF:A9:FF:F6:B1:1A (OUI DF-A9-FF)
        Count: 1
< ACL Data TX: Handle 489 flags 0x00 dlen 21              #206 [hci1] 11.203739
      SMP: Pairing Random (0x04) len 16
        Random value: ed17f76500c95219dd01e09d1e63f87b
> HCI Event: Number of Completed Packets (0x13) plen 5    #207 [hci1] 11.372852
        Num handles: 1
        Handle: 489 Address: DF:A9:FF:F6:B1:1A (OUI DF-A9-FF)
        Count: 1
        #206: len 21 (0 Kb/s)
        Latency: 169 msec (68-169 msec ~163 msec)
> ACL Data RX: Handle 489 flags 0x02 dlen 21              #208 [hci1] 11.373192
      SMP: Pairing Confirm (0x03) len 16
        Confim value: fc1131dec4d52b5a64639b76b481661b
< HCI Command: Host Number of Com.. (0x03|0x0035) plen 5  #209 [hci1] 11.383583
        Num handles: 1
        Handle: 489 Address: DF:A9:FF:F6:B1:1A (OUI DF-A9-FF)
        Count: 1
< ACL Data TX: Handle 489 flags 0x00 dlen 21              #210 [hci1] 11.383639
      SMP: Pairing Confirm (0x03) len 16
        Confim value: 99a4195a1ce9a772807a1402c76e1153
> HCI Event: Number of Completed Packets (0x13) plen 5    #211 [hci1] 11.547960
        Num handles: 1
        Handle: 489 Address: DF:A9:FF:F6:B1:1A (OUI DF-A9-FF)
        Count: 1
        #210: len 21 (1 Kb/s)
        Latency: 164 msec (68-169 msec ~163 msec)
> ACL Data RX: Handle 489 flags 0x02 dlen 21              #212 [hci1] 11.548091
      SMP: Pairing Random (0x04) len 16
        Random value: 64fd79adfe8424d0e9dc002ce2979a38
< HCI Command: Host Number of Com.. (0x03|0x0035) plen 5  #213 [hci1] 11.563493
        Num handles: 1
        Handle: 489 Address: DF:A9:FF:F6:B1:1A (OUI DF-A9-FF)
        Count: 1
< ACL Data TX: Handle 489 flags 0x00 dlen 21              #214 [hci1] 11.563543
      SMP: Pairing Random (0x04) len 16
        Random value: 81d35d47e1f6006d79c974bd9d9e1ee3
> HCI Event: Number of Completed Packets (0x13) plen 5    #215 [hci1] 11.722754
        Num handles: 1
        Handle: 489 Address: DF:A9:FF:F6:B1:1A (OUI DF-A9-FF)
        Count: 1
        #214: len 21 (1 Kb/s)
        Latency: 159 msec (68-169 msec ~161 msec)
> ACL Data RX: Handle 489 flags 0x02 dlen 21              #216 [hci1] 11.723118
      SMP: Pairing Confirm (0x03) len 16
        Confim value: efee6b9fc16c829f8c2bcf727df2b06a
< HCI Command: Host Number of Com.. (0x03|0x0035) plen 5  #217 [hci1] 11.743463
        Num handles: 1
        Handle: 489 Address: DF:A9:FF:F6:B1:1A (OUI DF-A9-FF)
        Count: 1
< ACL Data TX: Handle 489 flags 0x00 dlen 21              #218 [hci1] 11.743676
      SMP: Pairing Confirm (0x03) len 16
        Confim value: 6a511a943999ba270e59cb59ebf45a88
> HCI Event: Number of Completed Packets (0x13) plen 5    #219 [hci1] 11.897805
        Num handles: 1
        Handle: 489 Address: DF:A9:FF:F6:B1:1A (OUI DF-A9-FF)
        Count: 1
        #218: len 21 (1 Kb/s)
        Latency: 154 msec (68-169 msec ~157 msec)
> ACL Data RX: Handle 489 flags 0x02 dlen 21              #220 [hci1] 11.898182
      SMP: Pairing Random (0x04) len 16
        Random value: 8fab005cec0b76dfd6e7504aa89e8048
< HCI Command: Host Number of Com.. (0x03|0x0035) plen 5  #221 [hci1] 11.902947
        Num handles: 1
        Handle: 489 Address: DF:A9:FF:F6:B1:1A (OUI DF-A9-FF)
        Count: 1
< ACL Data TX: Handle 489 flags 0x00 dlen 21              #222 [hci1] 11.902986
      SMP: Pairing Random (0x04) len 16
        Random value: e7f7e0c2476823e41736a7e381bafb7c
> HCI Event: Number of Completed Packets (0x13) plen 5    #223 [hci1] 12.072776
        Num handles: 1
        Handle: 489 Address: DF:A9:FF:F6:B1:1A (OUI DF-A9-FF)
        Count: 1
        #222: len 21 (0 Kb/s)
        Latency: 169 msec (68-169 msec ~163 msec)
> ACL Data RX: Handle 489 flags 0x02 dlen 21              #224 [hci1] 12.073167
      SMP: Pairing Confirm (0x03) len 16
        Confim value: 88a206fa08c2fa56a15bc2323fd40d9b
< HCI Command: Host Number of Com.. (0x03|0x0035) plen 5  #225 [hci1] 12.083035
        Num handles: 1
        Handle: 489 Address: DF:A9:FF:F6:B1:1A (OUI DF-A9-FF)
        Count: 1
< ACL Data TX: Handle 489 flags 0x00 dlen 21              #226 [hci1] 12.083109
      SMP: Pairing Confirm (0x03) len 16
        Confim value: b5a8969d8db12037320ddf8aa6144131
> HCI Event: Number of Completed Packets (0x13) plen 5    #227 [hci1] 12.247821
        Num handles: 1
        Handle: 489 Address: DF:A9:FF:F6:B1:1A (OUI DF-A9-FF)
        Count: 1
        #226: len 21 (1 Kb/s)
        Latency: 164 msec (68-169 msec ~164 msec)
> ACL Data RX: Handle 489 flags 0x02 dlen 21              #228 [hci1] 12.248103
      SMP: Pairing Random (0x04) len 16
        Random value: 8985a99ab0baec7d438d48ccfde5d524
