Bluetooth monitor ver 5.72
= Note: Linux version 6.14.0-36-generic (x86_64)                       0.829593
= Note: Bluetooth subsystem version 2.22                               0.829595
= New Index: 00:00:00:00:00:00 (Primary,UART,hci2)              [hci2] 0.829596
= New Index: 00:00:00:00:00:00 (Primary,UART,hci1)              [hci1] 0.829596
= New Index: 48:5F:99:8E:E0:64 (Primary,USB,hci0)               [hci0] 0.829597
= Open Index: 00:00:00:00:00:00                                 [hci1] 0.852674
= Index Info: 00:00:00:00:00:00 (Nordic Semiconductor ASA)      [hci1] 0.852678
@ USER Open: main (privileged) version 2.22            {0x0001} [hci1] 0.852681
< HCI Command: Reset (0x03|0x0003) plen 0                    #1 [hci1] 0.853044
> HCI Event: Command Complete (0x0e) plen 4                  #2 [hci1] 0.853570
      Reset (0x03|0x0003) ncmd 1
        Status: Success (0x00)
< HCI Command: Read Local Supported... (0x04|0x0003) plen 0  #3 [hci1] 0.872677
> HCI Event: Command Complete (0x0e) plen 12                 #4 [hci1] 0.873336
      Read Local Supported Features (0x04|0x0003) ncmd 1
        Status: Success (0x00)
        Features: 0x00 0x00 0x00 0x00 0x60 0x00 0x00 0x00
          BR/EDR Not Supported
          LE Supported (Controller)
< HCI Command: Read Local Version In.. (0x04|0x0001) plen 0  #5 [hci1] 0.892632
> HCI Event: Command Complete (0x0e) plen 12                 #6 [hci1] 0.893233
      Read Local Version Information (0x04|0x0001) ncmd 1
        Status: Success (0x00)
        HCI version: Reserved (0x0f) - Revision 12393 (0x3069)
        LMP version: Reserved (0x0f) - Subversion 12393 (0x3069)
        Manufacturer: Nordic Semiconductor ASA (89)
< HCI Command: Read Local Supported... (0x04|0x0002) plen 0  #7 [hci1] 0.912643
> HCI Event: Command Complete (0x0e) plen 68                 #8 [hci1] 0.913740
      Read Local Supported Commands (0x04|0x0002) ncmd 1
        Status: Success (0x00)
        Commands: 119 entries
          Disconnect (Octet 0 - Bit 5)
          Read Remote Version Information (Octet 2 - Bit 7)
          Set Event Mask (Octet 5 - Bit 6)
          Reset (Octet 5 - Bit 7)
          Read Connection Accept Timeout (Octet 7 - Bit 2)
          Write Connection Accept Timeout (Octet 7 - Bit 3)
          Read Transmit Power Level (Octet 10 - Bit 2)
          Set Controller To Host Flow Control (Octet 10 - Bit 5)
          Host Buffer Size (Octet 10 - Bit 6)
          Host Number of Completed Packets (Octet 10 - Bit 7)
          Read Local Version Information (Octet 14 - Bit 3)
          Read Local Supported Features (Octet 14 - Bit 5)
          Read BD ADDR (Octet 15 - Bit 1)
          Read RSSI (Octet 15 - Bit 5)
          Set Event Mask Page 2 (Octet 22 - Bit 2)
          LE Set Event Mask (Octet 25 - Bit 0)
          LE Read Buffer Size (Octet 25 - Bit 1)
          LE Read Local Supported Features (Octet 25 - Bit 2)
          LE Set Random Address (Octet 25 - Bit 4)
          LE Set Advertising Parameters (Octet 25 - Bit 5)
          LE Read Advertising Channel TX Power (Octet 25 - Bit 6)
          LE Set Advertising Data (Octet 25 - Bit 7)
          LE Set Scan Response Data (Octet 26 - Bit 0)
          LE Set Advertise Enable (Octet 26 - Bit 1)
          LE Set Scan Parameters (Octet 26 - Bit 2)
          LE Set Scan Enable (Octet 26 - Bit 3)
          LE Create Connection (Octet 26 - Bit 4)
          LE Create Connection Cancel (Octet 26 - Bit 5)
          LE Read Accept List Size (Octet 26 - Bit 6)
          LE Clear Accept List (Octet 26 - Bit 7)
          LE Add Device To Accept List (Octet 27 - Bit 0)
          LE Remove Device From Accept List (Octet 27 - Bit 1)
          LE Connection Update (Octet 27 - Bit 2)
          LE Set Host Channel Classification (Octet 27 - Bit 3)
          LE Read Channel Map (Octet 27 - Bit 4)
          LE Read Remote Used Features (Octet 27 - Bit 5)
          LE Encrypt (Octet 27 - Bit 6)
          LE Rand (Octet 27 - Bit 7)
          LE Start Encryption (Octet 28 - Bit 0)
          LE Long Term Key Request Reply (Octet 28 - Bit 1)
          LE Long Term Key Request Neg Reply (Octet 28 - Bit 2)
          LE Read Supported States (Octet 28 - Bit 3)
          LE Receiver Test (Octet 28 - Bit 4)
          LE Transmitter Test (Octet 28 - Bit 5)
          LE Test End (Octet 28 - Bit 6)
          Read Authenticated Payload Timeout (Octet 32 - Bit 4)
          Write Authenticated Payload Timeout (Octet 32 - Bit 5)
          LE Set Data Length (Octet 33 - Bit 6)
          LE Read Suggested Default Data Length (Octet 33 - Bit 7)
          LE Write Suggested Default Data Length (Octet 34 - Bit 0)
          LE Add Device To Resolving List (Octet 34 - Bit 3)
          LE Remove Device From Resolving List (Octet 34 - Bit 4)
          LE Clear Resolving List (Octet 34 - Bit 5)
          LE Read Resolving List Size (Octet 34 - Bit 6)
          LE Set Address Resolution Enable (Octet 35 - Bit 1)
          LE Set Resolvable Private Address Timeout (Octet 35 - Bit 2)
          LE Read Maximum Data Length (Octet 35 - Bit 3)
          LE Read PHY (Octet 35 - Bit 4)
          LE Set Default PHY (Octet 35 - Bit 5)
          LE Set PHY (Octet 35 - Bit 6)
          LE Enhanced Receiver Test (Octet 35 - Bit 7)
          LE Enhanced Transmitter Test (Octet 36 - Bit 0)
          LE Set Advertising Set Random Address (Octet 36 - Bit 1)
          LE Set Extended Advertising Parameters (Octet 36 - Bit 2)
          LE Set Extended Advertising Data (Octet 36 - Bit 3)
          LE Set Extended Scan Response Data (Octet 36 - Bit 4)
          LE Set Extended Advertising Enable (Octet 36 - Bit 5)
          LE Read Maximum Advertising Data Length (Octet 36 - Bit 6)
          LE Read Number of Supported Advertising Sets (Octet 36 - Bit 7)
          LE Remove Advertising Set (Octet 37 - Bit 0)
          LE Clear Advertising Sets (Octet 37 - Bit 1)
          LE Set Periodic Advertising Parameters (Octet 37 - Bit 2)
          LE Set Periodic Advertising Data (Octet 37 - Bit 3)
          LE Set Periodic Advertising Enable (Octet 37 - Bit 4)
          LE Set Extended Scan Parameters (Octet 37 - Bit 5)
          LE Set Extended Scan Enable (Octet 37 - Bit 6)
          LE Extended Create Connection (Octet 37 - Bit 7)
          LE Periodic Advertising Create Sync (Octet 38 - Bit 0)
          LE Periodic Advertising Create Sync Cancel (Octet 38 - Bit 1)
          LE Periodic Advertising Terminate Sync (Octet 38 - Bit 2)
          LE Add Device To Periodic Advertiser List (Octet 38 - Bit 3)
          LE Remove Device From Periodic Advertiser List (Octet 38 - Bit 4)
          LE Clear Periodic Advertiser List (Octet 38 - Bit 5)
          LE Read Periodic Advertiser List Size (Octet 38 - Bit 6)
          LE Read Transmit Power (Octet 38 - Bit 7)
          LE Read RF Path Compensation (Octet 39 - Bit 0)
          LE Write RF Path Compensation (Octet 39 - Bit 1)
          LE Set Privacy Mode (Octet 39 - Bit 2)
          LE Periodic Advertising Receive Enable (Octet 40 - Bit 5)
          LE Periodic Advertising Sync Transfer (Octet 40 - Bit 6)
          LE Periodic Advertising Set Info Transfer (Octet 40 - Bit 7)
          LE Periodic Advertising Sync Transfer Parameters (Octet 41 - Bit 0)
          LE Set Default Periodic Advertisng Sync Transfer Parameters (Octet 41 - Bit 1)
          LE Read Buffer v2 (Octet 41 - Bit 5)
          LE Read ISO TX Sync (Octet 41 - Bit 6)
          LE Set Connected Isochronous Group Parameters (Octet 41 - Bit 7)
          LE Set Connected Isochronous Group Parameters Test (Octet 42 - Bit 0)
          LE Create Connected Isochronous Stream (Octet 42 - Bit 1)
          LE Remove Connected Isochronous Group (Octet 42 - Bit 2)
          LE Accept Connected Isochronous Stream Request (Octet 42 - Bit 3)
          LE Reject Connected Isochronous Stream Request (Octet 42 - Bit 4)
          LE Create Broadcast Isochronous Group (Octet 42 - Bit 5)
          LE Create Broadcast Isochronous Group Test (Octet 42 - Bit 6)
          LE Terminate Broadcast Isochronous Group (Octet 42 - Bit 7)
          LE Broadcast Isochronous Group Create Sync (Octet 43 - Bit 0)
          LE Broadcast Isochronous Group Terminate Sync (Octet 43 - Bit 1)
          LE Request Peer SCA (Octet 43 - Bit 2)
          LE Setup Isochronous Data Path (Octet 43 - Bit 3)
          LE Remove Isochronous Data Path (Octet 43 - Bit 4)
          LE Isochronous Transmit Test (Octet 43 - Bit 5)
          LE Isochronous Receive Test (Octet 43 - Bit 6)
          LE Isochronous Read Test Counters (Octet 43 - Bit 7)
          LE Isochronous Read Test Counters (Octet 44 - Bit 0)
          LE Set Host Feature (Octet 44 - Bit 1)
          Octet 44 - Bit 2 
          Octet 45 - Bit 6 
          Octet 46 - Bit 0 
          Octet 46 - Bit 1 
          Octet 46 - Bit 2 
< HCI Command: Host Buffer Size (0x03|0x0033) plen 7         #9 [hci1] 0.932653
        ACL MTU: 255  ACL max packet: 16
        SCO MTU: 0    SCO max packet: 0
> HCI Event: Command Complete (0x0e) plen 4                 #10 [hci1] 0.933244
      Host Buffer Size (0x03|0x0033) ncmd 1
        Status: Success (0x00)
< HCI Command: Set Controller To Ho.. (0x03|0x0031) plen 1  #11 [hci1] 0.952629
        Flow control: ACL Data Packets (0x01)
> HCI Event: Command Complete (0x0e) plen 4                 #12 [hci1] 0.953214
      Set Controller To Host Flow Control (0x03|0x0031) ncmd 1
        Status: Success (0x00)
< HCI Command: LE Read Local Suppor.. (0x08|0x0003) plen 0  #13 [hci1] 0.972641
> HCI Event: Command Complete (0x0e) plen 12                #14 [hci1] 0.973150
      LE Read Local Supported Features (0x08|0x0003) ncmd 1
        Status: Success (0x00)
        Features: 0xfd 0x79 0x00 0xf7 0x30 0x01 0x00 0x00
          LE Encryption
          Extended Reject Indication
          Peripheral-initiated Features Exchange
          LE Ping
          LE Data Packet Length Extension
          LL Privacy
          Extended Scanner Filter Policies
          LE 2M PHY
          LE Coded PHY
          LE Extended Advertising
          LE Periodic Advertising
          Channel Selection Algorithm #2
          Periodic Advertising Sync Transfer - Sender
          Periodic Advertising Sync Transfer - Recipient
          Sleep Clock Accuracy Updates
          Connected Isochronous Stream - Central
          Connected Isochronous Stream - Peripheral
          Isochronous Broadcaster
          Synchronized Receiver
          Periodic Advertising ADI support
          Connection Subrating
          Unknown features (0x0000010000000000)
< HCI Command: LE Set Host Feature (0x08|0x0074) plen 2     #15 [hci1] 0.992628
        Bit Number: 32
          Connected Isochronous Stream (Host Support)
        Bit Value: 1
> HCI Event: Command Complete (0x0e) plen 4                 #16 [hci1] 0.993189
      LE Set Host Feature (0x08|0x0074) ncmd 1
        Status: Success (0x00)
< HCI Command: LE Read Buffer v2 (0x08|0x0060) plen 0       #17 [hci1] 1.012658
> HCI Event: Command Complete (0x0e) plen 10                #18 [hci1] 1.013131
      LE Read Buffer v2 (0x08|0x0060) ncmd 1
        Status: Success (0x00)
        ACL MTU: 27
        ACL max packet: 3
        ISO MTU: 318
        ISO max packet: 3
< HCI Command: LE Read Maximum Adve.. (0x08|0x003a) plen 0  #19 [hci1] 1.032652
> HCI Event: Command Complete (0x0e) plen 6                 #20 [hci1] 1.033110
      LE Read Maximum Advertising Data Length (0x08|0x003a) ncmd 1
        Status: Success (0x00)
        Max length: 1650
< HCI Command: LE Read Supported St.. (0x08|0x001c) plen 0  #21 [hci1] 1.052639
> HCI Event: Command Complete (0x0e) plen 12                #22 [hci1] 1.053177
      LE Read Supported States (0x08|0x001c) ncmd 1
        Status: Success (0x00)
        States: 0x000003ff3e0306ff
          Non-connectable Advertising State
          Scannable Advertising State
          Connectable Advertising State
          High Duty Cycle Directed Advertising State
          Passive Scanning State
          Active Scanning State
          Initiating State
            and Connection State (Central Role)
          Connection State (Peripheral Role)
          Scannable Advertising State
            and Passive Scanning State
          Connectable Advertising State
            and Passive Scanning State
          Non-connectable Advertising State
            and Initiating State
          Scannable Advertising State
            and Initiating State
          Active Scanning State
            and Connection State (Central Role)
          Passive Scanning State
            and Connection State (Peripheral Role)
          Active Scanning State
            and Connection State (Peripheral Role)
          Initiating State
            and Connection State (Central Role)
            and Central Role & Central Role
          Low Duty Cycle Directed Advertising State
          Connectable Advertising State
            and Initiating State
            and Central Role & Peripheral Role
          High Duty Cycle Directed Advertising State
            and Initiating State
            and Central Role & Peripheral Role
          Low Duty Cycle Directed Advertising State
            and Initiating State
            and Central Role & Peripheral Role
          Connectable Advertising State
            and Connection State (Central Role)
            and Central Role & Peripheral Role
          High Duty Cycle Directed Advertising State
            and Connection State (Central Role)
            and Central Role & Peripheral Role
          Low Duty Cycle Directed Advertising State
            and Connection State (Central Role)
            and Central Role & Peripheral Role
          Connectable Advertising State
            and Connection State (Peripheral Role)
            and Central Role & Peripheral Role
          High Duty Cycle Directed Advertising State
            and Connection State (Peripheral Role)
            and Peripheral Role & Peripheral Role
          Low Duty Cycle Directed Advertising State
            and Connection State (Peripheral Role)
            and Peripheral Role & Peripheral Role
          Initiating State
            and Connection State (Peripheral Role)
            and Central Role & Peripheral Role
< HCI Command: LE Read Maximum Data.. (0x08|0x002f) plen 0  #23 [hci1] 1.072705
> HCI Event: Command Complete (0x0e) plen 12                #24 [hci1] 1.073295
      LE Read Maximum Data Length (0x08|0x002f) ncmd 1
        Status: Success (0x00)
        Max TX octets: 251
        Max TX time: 2704
        Max RX octets: 251
        Max RX time: 2704
< HCI Command: LE Write Suggested D.. (0x08|0x0024) plen 4  #25 [hci1] 1.092606
        TX octets: 251
        TX time: 2704
> HCI Event: Command Complete (0x0e) plen 4                 #26 [hci1] 1.093037
      LE Write Suggested Default Data Length (0x08|0x0024) ncmd 1
        Status: Success (0x00)
< HCI Command: LE Read Resolving Li.. (0x08|0x002a) plen 0  #27 [hci1] 1.112647
> HCI Event: Command Complete (0x0e) plen 5                 #28 [hci1] 1.113109
      LE Read Resolving List Size (0x08|0x002a) ncmd 1
        Status: Success (0x00)
        Size: 8
< HCI Command: LE Set Event Mask (0x08|0x0001) plen 8       #29 [hci1] 1.132629
        Mask: 0x000002023f87fa5e
          LE Advertising Report
          LE Connection Update Complete
          LE Read Remote Used Features Complete
          LE Long Term Key Request
          LE Data Length Change
          LE Enhanced Connection Complete
          LE PHY Update Complete
          LE Extended Advertising Report
          LE Periodic Advertising Sync Established
          LE Periodic Advertising Report
          LE Periodic Advertising Sync Lost
          LE Extended Scan Timeout
          LE Extended Advertising Set Terminated
          LE Scan Request Received
          LE Periodic Advertising Sync Transfer Rvc
          LE CIS Established
          LE CIS Request
          LE Create BIG Complete
          LE Terminate BIG Complete
          LE BIG Sync Estabilished Complete
          LE BIG Sync Lost
          LE BIG Info Advertising Report
          Unknown mask (0x0000020000000000)
> HCI Event: Command Complete (0x0e) plen 4                 #30 [hci1] 1.133179
      LE Set Event Mask (0x08|0x0001) ncmd 1
        Status: Success (0x00)
< HCI Command: Set Event Mask (0x03|0x0001) plen 8          #31 [hci1] 1.152658
        Mask: 0x2000800002008890
          Disconnection Complete
          Encryption Change
          Read Remote Version Information Complete
          Hardware Error
          Data Buffer Overflow
          Encryption Key Refresh Complete
          LE Meta
> HCI Event: Command Complete (0x0e) plen 4                 #32 [hci1] 1.153266
      Set Event Mask (0x03|0x0001) ncmd 1
        Status: Success (0x00)
< HCI Command: Read BD ADDR (0x04|0x0009) plen 0            #33 [hci1] 1.172631
> HCI Event: Command Complete (0x0e) plen 10                #34 [hci1] 1.173187
      Read BD ADDR (0x04|0x0009) ncmd 1
        Status: Success (0x00)
        Address: 00:00:00:00:00:00 (OUI 00-00-00)
< HCI Command: LE Set Random Address (0x08|0x0005) plen 6   #35 [hci1] 1.192705
        Address: D5:B6:CC:31:DB:3B (Static)
> HCI Event: Command Complete (0x0e) plen 4                 #36 [hci1] 1.193460
      LE Set Random Address (0x08|0x0005) ncmd 1
        Status: Success (0x00)
< HCI Command: LE Extended Create... (0x08|0x0043) plen 26  #37 [hci1] 3.442661
        Filter policy: Accept list is not used (0x00)
        Own address type: Random (0x01)
        Peer address type: Public (0x00)
        Peer address: DF:A9:FF:F6:B1:1A (OUI DF-A9-FF)
        Initiating PHYs: 0x01
        Entry 0: LE 1M
          Scan interval: 60.000 msec (0x0060)
          Scan window: 60.000 msec (0x0060)
          Min connection interval: 30.00 msec (0x0018)
          Max connection interval: 50.00 msec (0x0028)
          Connection latency: 0 (0x0000)
          Supervision timeout: 4000 msec (0x0190)
          Min connection length: 0.000 msec (0x0000)
          Max connection length: 0.000 msec (0x0000)
> HCI Event: Command Status (0x0f) plen 4                   #38 [hci1] 3.443656
      LE Extended Create Connection (0x08|0x0043) ncmd 1
        Status: Success (0x00)
> HCI Event: LE Meta Event (0x3e) plen 31                   #39 [hci1] 3.492661
      LE Enhanced Connection Complete (0x0a)
        Status: Success (0x00)
        Handle: 2160
        Role: Central (0x00)
        Peer address type: Public (0x00)
        Peer address: DF:A9:FF:F6:B1:1A (OUI DF-A9-FF)
        Local resolvable private address: 00:00:00:00:00:00 (Non-Resolvable)
        Peer resolvable private address: 00:00:00:00:00:00 (Non-Resolvable)
        Connection interval: 50.00 msec (0x0028)
        Connection latency: 0 (0x0000)
        Supervision timeout: 4000 msec (0x0190)
        Central clock accuracy: 0x00
< HCI Command: LE Read Remote Used... (0x08|0x0016) plen 2  #40 [hci1] 3.512822
        Handle: 2160 Address: DF:A9:FF:F6:B1:1A (OUI DF-A9-FF)
> HCI Event: Command Status (0x0f) plen 4                   #41 [hci1] 3.513302
      LE Read Remote Used Features (0x08|0x0016) ncmd 1
        Status: Success (0x00)
< HCI Command: LE Set PHY (0x08|0x0032) plen 7              #42 [hci1] 3.532722
        Handle: 2160 Address: DF:A9:FF:F6:B1:1A (OUI DF-A9-FF)
        All PHYs preference: 0x00
        TX PHYs preference: 0x02
          LE 2M
        RX PHYs preference: 0x02
          LE 2M
        PHY options preference: Reserved (0x0000)
> HCI Event: Command Status (0x0f) plen 4                   #43 [hci1] 3.533236
      LE Set PHY (0x08|0x0032) ncmd 1
        Status: Success (0x00)
> HCI Event: LE Meta Event (0x3e) plen 12                   #44 [hci1] 3.644104
      LE Read Remote Used Features (0x04)
        Status: Success (0x00)
        Handle: 2160 Address: DF:A9:FF:F6:B1:1A (OUI DF-A9-FF)
        Features: 0x2d 0x49 0x00 0xf7 0x67 0xd9 0x00 0x80
          LE Encryption
          Extended Reject Indication
          Peripheral-initiated Features Exchange
          LE Data Packet Length Extension
          LE 2M PHY
          LE Coded PHY
          Channel Selection Algorithm #2
          Periodic Advertising Sync Transfer - Sender
          Periodic Advertising Sync Transfer - Recipient
          Sleep Clock Accuracy Updates
          Connected Isochronous Stream - Central
          Connected Isochronous Stream - Peripheral
          Isochronous Broadcaster
          Synchronized Receiver
          Connected Isochronous Stream (Host Support)
          LE Power Control Request
          LE Power Control Request
          Connection Subrating
          Connection Subrating (Host Support)
          Unknown features (0x8000d90000000000)
> HCI Event: LE Meta Event (0x3e) plen 6                    #45 [hci1] 4.143699
      LE PHY Update Complete (0x0c)
        Status: Success (0x00)
        Handle: 2160 Address: DF:A9:FF:F6:B1:1A (OUI DF-A9-FF)
        TX PHY: LE 2M (0x02)
        RX PHY: LE 2M (0x02)
< ACL Data TX: Handle 2160 flags 0x00 dlen 11               #46 [hci1] 4.573297
      SMP: Pairing Request (0x01) len 6
        IO capability: KeyboardOnly (0x02)
        OOB data: Authentication data not present (0x00)
        Authentication requirement: No bonding, No MITM, SC, No Keypresses (0x08)
        Max encryption key size: 16
        Initiator key distribution: <none> (0x00)
        Responder key distribution: <none> (0x00)
> HCI Event: Number of Completed Packets (0x13) plen 5      #47 [hci1] 4.593854
        Num handles: 1
        Handle: 2160 Address: DF:A9:FF:F6:B1:1A (OUI DF-A9-FF)
        Count: 1
        #46: len 11 (4 Kb/s)
        Latency: 20 msec (20-20 msec ~20 msec)
> ACL Data RX: Handle 2160 flags 0x02 dlen 11               #48 [hci1] 4.644089
      SMP: Pairing Response (0x02) len 6
        IO capability: KeyboardOnly (0x02)
        OOB data: Authentication data not present (0x00)
        Authentication requirement: No bonding, MITM, SC, No Keypresses (0x0c)
        Max encryption key size: 16
        Initiator key distribution: <none> (0x00)
        Responder key distribution: <none> (0x00)
< HCI Command: Host Number of Compl.. (0x03|0x0035) plen 5  #49 [hci1] 4.652968
        Num handles: 1
        Handle: 2160 Address: DF:A9:FF:F6:B1:1A (OUI DF-A9-FF)
        Count: 1
< ACL Data TX: Handle 2160 flags 0x00 dlen 27               #50 [hci1] 4.653017
< ACL Data TX: Handle 2160 flags 0x01 dlen 27               #51 [hci1] 4.653033
< ACL Data TX: Handle 2160 flags 0x01 dlen 15               #52 [hci1] 4.653037
      SMP: Pairing Public Key (0x0c) len 64
        X: 98308440221e2d910f0e54b71e7ec652857aa9b5a0dc65028824cc19db1226e9
        Y: 67a4816bcb62efb21701e31fdb27561a6217575fb007a8bbdabe7e28b6f68482
> HCI Event: Number of Completed Packets (0x13) plen 5      #53 [hci1] 4.693976
        Num handles: 1
        Handle: 2160 Address: DF:A9:FF:F6:B1:1A (OUI DF-A9-FF)
        Count: 1
        #50: len 27 (5 Kb/s)
        Latency: 40 msec (20-40 msec ~30 msec)
> HCI Event: Number of Completed Packets (0x13) plen 5      #54 [hci1] 4.694414
        Num handles: 1
        Handle: 2160 Address: DF:A9:FF:F6:B1:1A (OUI DF-A9-FF)
        Count: 1
        #51: len 27 (5 Kb/s)
        Latency: 41 msec (20-41 msec ~36 msec)
> HCI Event: Number of Completed Packets (0x13) plen 5      #55 [hci1] 4.695020
        Num handles: 1
        Handle: 2160 Address: DF:A9:FF:F6:B1:1A (OUI DF-A9-FF)
        Count: 1
        #52: len 15 (2 Kb/s)
        Latency: 41 msec (20-41 msec ~39 msec)
> ACL Data RX: Handle 2160 flags 0x02 dlen 27               #56 [hci1] 4.744241
> ACL Data RX: Handle 2160 flags 0x01 dlen 27               #57 [hci1] 4.744657
> ACL Data RX: Handle 2160 flags 0x01 dlen 15               #58 [hci1] 4.745099
      SMP: Pairing Public Key (0x0c) len 64
        X: 63d3e62d5cc451224a2210d47ca075a76552f6ea5f75c3d69eb4da51fc9bcb94
        Y: 683221e8338b086328f3a0e91c9d43f943c8101d079668bbba4f52ff8c913951
< HCI Command: Host Number of Compl.. (0x03|0x0035) plen 5  #59 [hci1] 4.752862
        Num handles: 1
        Handle: 2160 Address: DF:A9:FF:F6:B1:1A (OUI DF-A9-FF)
        Count: 1
< HCI Command: Host Number of Compl.. (0x03|0x0035) plen 5  #60 [hci1] 4.753004
        Num handles: 1
        Handle: 2160 Address: DF:A9:FF:F6:B1:1A (OUI DF-A9-FF)
        Count: 1
< HCI Command: Host Number of Compl.. (0x03|0x0035) plen 5  #61 [hci1] 4.753151
        Num handles: 1
        Handle: 2160 Address: DF:A9:FF:F6:B1:1A (OUI DF-A9-FF)
        Count: 1
< ACL Data TX: Handle 2160 flags 0x00 dlen 21               #62 [hci1] 5.593191
      SMP: Pairing Confirm (0x03) len 16
        Confim value: c7e8eabebaa035a23c6a52e653a1c904
> HCI Event: Number of Completed Packets (0x13) plen 5      #63 [hci1] 5.644036
        Num handles: 1
        Handle: 2160 Address: DF:A9:FF:F6:B1:1A (OUI DF-A9-FF)
        Count: 1
        #62: len 21 (3 Kb/s)
        Latency: 50 msec (20-50 msec ~44 msec)
> ACL Data RX: Handle 2160 flags 0x02 dlen 21               #64 [hci1] 5.694275
      SMP: Pairing Confirm (0x03) len 16
        Confim value: 83618b98d3bdba4b4df718c9c3b764f9
< HCI Command: Host Number of Compl.. (0x03|0x0035) plen 5  #65 [hci1] 5.713162
        Num handles: 1
        Handle: 2160 Address: DF:A9:FF:F6:B1:1A (OUI DF-A9-FF)
        Count: 1
< ACL Data TX: Handle 2160 flags 0x00 dlen 21               #66 [hci1] 5.713255
      SMP: Pairing Random (0x04) len 16
        Random value: 8e6108f966a694cbe26df70bb96773e6
> HCI Event: Number of Completed Packets (0x13) plen 5      #67 [hci1] 5.744067
        Num handles: 1
        Handle: 2160 Address: DF:A9:FF:F6:B1:1A (OUI DF-A9-FF)
        Count: 1
        #66: len 21 (5 Kb/s)
        Latency: 30 msec (20-50 msec ~37 msec)
> ACL Data RX: Handle 2160 flags 0x02 dlen 21               #68 [hci1] 5.994155
      SMP: Pairing Random (0x04) len 16
        Random value: 3020f194ee13f933436d74ec966f9ce7
< HCI Command: Host Number of Compl.. (0x03|0x0035) plen 5  #69 [hci1] 6.013044
        Num handles: 1
        Handle: 2160 Address: DF:A9:FF:F6:B1:1A (OUI DF-A9-FF)
        Count: 1
< ACL Data TX: Handle 2160 flags 0x00 dlen 21               #70 [hci1] 6.013082
      SMP: Pairing Confirm (0x03) len 16
        Confim value: 1a4bda3f51bafec654573ff83429651c
> HCI Event: Number of Completed Packets (0x13) plen 5      #71 [hci1] 6.043985
        Num handles: 1
        Handle: 2160 Address: DF:A9:FF:F6:B1:1A (OUI DF-A9-FF)
        Count: 1
        #70: len 21 (5 Kb/s)
        Latency: 30 msec (20-50 msec ~34 msec)
> ACL Data RX: Handle 2160 flags 0x02 dlen 21               #72 [hci1] 6.094261
      SMP: Pairing Confirm (0x03) len 16
        Confim value: 7a6bd53b263175c321a52fc4684822a6
< HCI Command: Host Number of Compl.. (0x03|0x0035) plen 5  #73 [hci1] 6.113092
        Num handles: 1
        Handle: 2160 Address: DF:A9:FF:F6:B1:1A (OUI DF-A9-FF)
        Count: 1
< ACL Data TX: Handle 2160 flags 0x00 dlen 21               #74 [hci1] 6.113234
      SMP: Pairing Random (0x04) len 16
        Random value: 5da095555cc64d02679f89a05211af56
> HCI Event: Number of Completed Packets (0x13) plen 5      #75 [hci1] 6.144031
        Num handles: 1
        Handle: 2160 Address: DF:A9:FF:F6:B1:1A (OUI DF-A9-FF)
        Count: 1
        #74: len 21 (5 Kb/s)
        Latency: 30 msec (20-50 msec ~32 msec)
> ACL Data RX: Handle 2160 flags 0x02 dlen 21               #76 [hci1] 6.394196
      SMP: Pairing Random (0x04) len 16
        Random value: 5ba63ee05e6b7ab7f956fd2280b156d6
< HCI Command: Host Number of Compl.. (0x03|0x0035) plen 5  #77 [hci1] 6.413407
        Num handles: 1
        Handle: 2160 Address: DF:A9:FF:F6:B1:1A (OUI DF-A9-FF)
        Count: 1
< ACL Data TX: Handle 2160 flags 0x00 dlen 21               #78 [hci1] 6.413563
      SMP: Pairing Confirm (0x03) len 16
        Confim value: 9d6b2c6af18dc821033d3532ac98f265
> HCI Event: Number of Completed Packets (0x13) plen 5      #79 [hci1] 6.444012
        Num handles: 1
        Handle: 2160 Address: DF:A9:FF:F6:B1:1A (OUI DF-A9-FF)
        Count: 1
        #78: len 21 (5 Kb/s)
        Latency: 30 msec (20-50 msec ~31 msec)
> ACL Data RX: Handle 2160 flags 0x02 dlen 21               #80 [hci1] 6.494144
      SMP: Pairing Confirm (0x03) len 16
        Confim value: 382ced97042ac80c856789e23fc5e419
< HCI Command: Host Number of Compl.. (0x03|0x0035) plen 5  #81 [hci1] 6.513287
        Num handles: 1
        Handle: 2160 Address: DF:A9:FF:F6:B1:1A (OUI DF-A9-FF)
        Count: 1
< ACL Data TX: Handle 2160 flags 0x00 dlen 21               #82 [hci1] 6.513394
      SMP: Pairing Random (0x04) len 16
        Random value: da64d21ec8845e8286bc235a02440d0c
> HCI Event: Number of Completed Packets (0x13) plen 5      #83 [hci1] 6.543924
        Num handles: 1
        Handle: 2160 Address: DF:A9:FF:F6:B1:1A (OUI DF-A9-FF)
        Count: 1
        #82: len 21 (5 Kb/s)
        Latency: 30 msec (20-50 msec ~31 msec)
> ACL Data RX: Handle 2160 flags 0x02 dlen 21               #84 [hci1] 6.794188
      SMP: Pairing Random (0x04) len 16
        Random value: dc3ec9c709dfe04ac56969bc0dec0223
< HCI Command: Host Number of Compl.. (0x03|0x0035) plen 5  #85 [hci1] 6.813199
        Num handles: 1
        Handle: 2160 Address: DF:A9:FF:F6:B1:1A (OUI DF-A9-FF)
        Count: 1
< ACL Data TX: Handle 2160 flags 0x00 dlen 21               #86 [hci1] 6.813270
      SMP: Pairing Confirm (0x03) len 16
        Confim value: 63b6da89248a687903c57b7b5685743c
> HCI Event: Number of Completed Packets (0x13) plen 5      #87 [hci1] 6.844005
        Num handles: 1
        Handle: 2160 Address: DF:A9:FF:F6:B1:1A (OUI DF-A9-FF)
        Count: 1
        #86: len 21 (5 Kb/s)
        Latency: 30 msec (20-50 msec ~30 msec)
> ACL Data RX: Handle 2160 flags 0x02 dlen 21               #88 [hci1] 6.894159
      SMP: Pairing Confirm (0x03) len 16
        Confim value: 4970ab3f36f4858b50552071df7559ff
< HCI Command: Host Number of Compl.. (0x03|0x0035) plen 5  #89 [hci1] 6.912968
        Num handles: 1
        Handle: 2160 Address: DF:A9:FF:F6:B1:1A (OUI DF-A9-FF)
        Count: 1
< ACL Data TX: Handle 2160 flags 0x00 dlen 21               #90 [hci1] 6.913035
      SMP: Pairing Random (0x04) len 16
        Random value: a2acf8fd71a45c4a1bcadd27bd58e945
> HCI Event: Number of Completed Packets (0x13) plen 5      #91 [hci1] 6.943967
        Num handles: 1
        Handle: 2160 Address: DF:A9:FF:F6:B1:1A (OUI DF-A9-FF)
        Count: 1
        #90: len 21 (5 Kb/s)
        Latency: 30 msec (20-50 msec ~30 msec)
> ACL Data RX: Handle 2160 flags 0x02 dlen 21               #92 [hci1] 7.194143
      SMP: Pairing Random (0x04) len 16
        Random value: a5ef3d6692e407f6f889bfb74076dabd
< HCI Command: Host Number of Compl.. (0x03|0x0035) plen 5  #93 [hci1] 7.212828
        Num handles: 1
        Handle: 2160 Address: DF:A9:FF:F6:B1:1A (OUI DF-A9-FF)
        Count: 1
< ACL Data TX: Handle 2160 flags 0x00 dlen 21               #94 [hci1] 7.212855
      SMP: Pairing Confirm (0x03) len 16
        Confim value: abb257621493e7ef94397e65f7e81787
> HCI Event: Number of Completed Packets (0x13) plen 5      #95 [hci1] 7.243862
        Num handles: 1
        Handle: 2160 Address: DF:A9:FF:F6:B1:1A (OUI DF-A9-FF)
        Count: 1
        #94: len 21 (5 Kb/s)
        Latency: 31 msec (20-50 msec ~30 msec)
> ACL Data RX: Handle 2160 flags 0x02 dlen 21               #96 [hci1] 7.294171
      SMP: Pairing Confirm (0x03) len 16
        Confim value: fc4a6ed9f52ce35908464653e5cf8a2e
< HCI Command: Host Number of Compl.. (0x03|0x0035) plen 5  #97 [hci1] 7.313172
        Num handles: 1
        Handle: 2160 Address: DF:A9:FF:F6:B1:1A (OUI DF-A9-FF)
        Count: 1
< ACL Data TX: Handle 2160 flags 0x00 dlen 21               #98 [hci1] 7.313244
      SMP: Pairing Random (0x04) len 16
        Random value: 00bad7aca1ba32527e6e64e79f33b2e3
> HCI Event: Number of Completed Packets (0x13) plen 5      #99 [hci1] 7.343992
        Num handles: 1
        Handle: 2160 Address: DF:A9:FF:F6:B1:1A (OUI DF-A9-FF)
        Count: 1
        #98: len 21 (5 Kb/s)
        Latency: 30 msec (20-50 msec ~30 msec)
> ACL Data RX: Handle 2160 flags 0x02 dlen 21              #100 [hci1] 7.594111
      SMP: Pairing Random (0x04) len 16
        Random value: e7fd821ada2f060b23dc4b5158e355d1
< HCI Command: Host Number of Comp.. (0x03|0x0035) plen 5  #101 [hci1] 7.613434
        Num handles: 1
        Handle: 2160 Address: DF:A9:FF:F6:B1:1A (OUI DF-A9-FF)
        Count: 1
< ACL Data TX: Handle 2160 flags 0x00 dlen 21              #102 [hci1] 7.613463
      SMP: Pairing Confirm (0x03) len 16
        Confim value: ae11b4962859f1d483138cecccb5e12f
> HCI Event: Number of Completed Packets (0x13) plen 5     #103 [hci1] 7.644098
        Num handles: 1
        Handle: 2160 Address: DF:A9:FF:F6:B1:1A (OUI DF-A9-FF)
        Count: 1
        #102: len 21 (5 Kb/s)
        Latency: 30 msec (20-50 msec ~30 msec)
> ACL Data RX: Handle 2160 flags 0x02 dlen 21              #104 [hci1] 7.694181
      SMP: Pairing Confirm (0x03) len 16
        Confim value: 53f50baf58092d0742b3704a508e43bd
< HCI Command: Host Number of Comp.. (0x03|0x0035) plen 5  #105 [hci1] 7.713234
        Num handles: 1
        Handle: 2160 Address: DF:A9:FF:F6:B1:1A (OUI DF-A9-FF)
        Count: 1
< ACL Data TX: Handle 2160 flags 0x00 dlen 21              #106 [hci1] 7.713358
      SMP: Pairing Random (0x04) len 16
        Random value: 4db8ab2d95badddbdfe2838e9a8cc696
> HCI Event: Number of Completed Packets (0x13) plen 5     #107 [hci1] 7.743918
        Num handles: 1
        Handle: 2160 Address: DF:A9:FF:F6:B1:1A (OUI DF-A9-FF)
        Count: 1
        #106: len 21 (5 Kb/s)
        Latency: 30 msec (20-50 msec ~30 msec)
> ACL Data RX: Handle 2160 flags 0x02 dlen 21              #108 [hci1] 7.994155
      SMP: Pairing Random (0x04) len 16
        Random value: 12edc18100b4371518c69307d6082eca
< HCI Command: Host Number of Comp.. (0x03|0x0035) plen 5  #109 [hci1] 8.013066
        Num handles: 1
        Handle: 2160 Address: DF:A9:FF:F6:B1:1A (OUI DF-A9-FF)
        Count: 1
< ACL Data TX: Handle 2160 flags 0x00 dlen 21              #110 [hci1] 8.013172
      SMP: Pairing Confirm (0x03) len 16
        Confim value: addfd2b47b0935e6bafe109ec72a68bd
> HCI Event: Number of Completed Packets (0x13) plen 5     #111 [hci1] 8.043959
        Num handles: 1
        Handle: 2160 Address: DF:A9:FF:F6:B1:1A (OUI DF-A9-FF)
        Count: 1
        #110: len 21 (5 Kb/s)
        Latency: 30 msec (20-50 msec ~30 msec)
> ACL Data RX: Handle 2160 flags 0x02 dlen 21              #112 [hci1] 8.094060
      SMP: Pairing Confirm (0x03) len 16
        Confim value: 0ef6217d3da11166855bd08d7ba1eab2
< HCI Command: Host Number of Comp.. (0x03|0x0035) plen 5  #113 [hci1] 8.113276
        Num handles: 1
        Handle: 2160 Address: DF:A9:FF:F6:B1:1A (OUI DF-A9-FF)
        Count: 1
< ACL Data TX: Handle 2160 flags 0x00 dlen 21              #114 [hci1] 8.113391
      SMP: Pairing Random (0x04) len 16
        Random value: c850fef72c5ceb9f1915536596b6fc3d
> HCI Event: Number of Completed Packets (0x13) plen 5     #115 [hci1] 8.143918
        Num handles: 1
        Handle: 2160 Address: DF:A9:FF:F6:B1:1A (OUI DF-A9-FF)
        Count: 1
        #114: len 21 (5 Kb/s)
        Latency: 30 msec (20-50 msec ~30 msec)
> ACL Data RX: Handle 2160 flags 0x02 dlen 21              #116 [hci1] 8.394154
      SMP: Pairing Random (0x04) len 16
        Random value: d884637667a933e0e6ed62957dfb5d57
< HCI Command: Host Number of Comp.. (0x03|0x0035) plen 5  #117 [hci1] 8.413423
        Num handles: 1
        Handle: 2160 Address: DF:A9:FF:F6:B1:1A (OUI DF-A9-FF)
        Count: 1
< ACL Data TX: Handle 2160 flags 0x00 dlen 21              #118 [hci1] 8.413511
      SMP: Pairing Confirm (0x03) len 16
        Confim value: 01939868ba0e58a1a16ed7c51508f8bc
> HCI Event: Number of Completed Packets (0x13) plen 5     #119 [hci1] 8.443927
        Num handles: 1
        Handle: 2160 Address: DF:A9:FF:F6:B1:1A (OUI DF-A9-FF)
        Count: 1
        #118: len 21 (5 Kb/s)
        Latency: 30 msec (20-50 msec ~30 msec)
> ACL Data RX: Handle 2160 flags 0x02 dlen 21              #120 [hci1] 8.494081
      SMP: Pairing Confirm (0x03) len 16
        Confim value: 7d4815bc83646971fa6caf91ee28fbbd
< HCI Command: Host Number of Comp.. (0x03|0x0035) plen 5  #121 [hci1] 8.513270
        Num handles: 1
        Handle: 2160 Address: DF:A9:FF:F6:B1:1A (OUI DF-A9-FF)
        Count: 1
< ACL Data TX: Handle 2160 flags 0x00 dlen 21              #122 [hci1] 8.513444
      SMP: Pairing Random (0x04) len 16
        Random value: 6b2b19701bcf5c794dc9ad9f2c3f295e
> HCI Event: Number of Completed Packets (0x13) plen 5     #123 [hci1] 8.544025
        Num handles: 1
        Handle: 2160 Address: DF:A9:FF:F6:B1:1A (OUI DF-A9-FF)
        Count: 1
        #122: len 21 (5 Kb/s)
        Latency: 30 msec (20-50 msec ~30 msec)
> ACL Data RX: Handle 2160 flags 0x02 dlen 21              #124 [hci1] 8.794093
      SMP: Pairing Random (0x04) len 16
        Random value: 29c71017b084d27adf35c1f94d101c64
< HCI Command: Host Number of Comp.. (0x03|0x0035) plen 5  #125 [hci1] 8.813177
        Num handles: 1
        Handle: 2160 Address: DF:A9:FF:F6:B1:1A (OUI DF-A9-FF)
        Count: 1
< ACL Data TX: Handle 2160 flags 0x00 dlen 21              #126 [hci1] 8.813280
      SMP: Pairing Confirm (0x03) len 16
        Confim value: e14fa35794d029e2173a76cc4928d1f7
> HCI Event: Number of Completed Packets (0x13) plen 5     #127 [hci1] 8.843825
        Num handles: 1
        Handle: 2160 Address: DF:A9:FF:F6:B1:1A (OUI DF-A9-FF)
        Count: 1
        #126: len 21 (5 Kb/s)
        Latency: 30 msec (20-50 msec ~30 msec)
> ACL Data RX: Handle 2160 flags 0x02 dlen 21              #128 [hci1] 8.894135
      SMP: Pairing Confirm (0x03) len 16
        Confim value: 3107beabef2fef08017e6623fedc777e
< HCI Command: Host Number of Comp.. (0x03|0x0035) plen 5  #129 [hci1] 8.913138
        Num handles: 1
        Handle: 2160 Address: DF:A9:FF:F6:B1:1A (OUI DF-A9-FF)
        Count: 1
< ACL Data TX: Handle 2160 flags 0x00 dlen 21              #130 [hci1] 8.913254
      SMP: Pairing Random (0x04) len 16
        Random value: d5e1c3cfeb215c2fff312cdf99c94919
> HCI Event: Number of Completed Packets (0x13) plen 5     #131 [hci1] 8.943864
        Num handles: 1
        Handle: 2160 Address: DF:A9:FF:F6:B1:1A (OUI DF-A9-FF)
        Count: 1
        #130: len 21 (5 Kb/s)
        Latency: 30 msec (20-50 msec ~30 msec)
> ACL Data RX: Handle 2160 flags 0x02 dlen 21              #132 [hci1] 9.194100
      SMP: Pairing Random (0x04) len 16
        Random value: 37fcb3c1baf82e3095c5f86f86dde21e
< HCI Command: Host Number of Comp.. (0x03|0x0035) plen 5  #133 [hci1] 9.213396
        Num handles: 1
        Handle: 2160 Address: DF:A9:FF:F6:B1:1A (OUI DF-A9-FF)
        Count: 1
< ACL Data TX: Handle 2160 flags 0x00 dlen 21              #134 [hci1] 9.213509
      SMP: Pairing Confirm (0x03) len 16
        Confim value: 8b249d79e7a28af127821b74d796133f
> HCI Event: Number of Completed Packets (0x13) plen 5     #135 [hci1] 9.243952
        Num handles: 1
        Handle: 2160 Address: DF:A9:FF:F6:B1:1A (OUI DF-A9-FF)
        Count: 1
        #134: len 21 (5 Kb/s)
        Latency: 30 msec (20-50 msec ~30 msec)
> ACL Data RX: Handle 2160 flags 0x02 dlen 21              #136 [hci1] 9.294062
      SMP: Pairing Confirm (0x03) len 16
        Confim value: ea4ad1fef5a9bc241d67b8e5839a8078
< HCI Command: Host Number of Comp.. (0x03|0x0035) plen 5  #137 [hci1] 9.313298
        Num handles: 1
        Handle: 2160 Address: DF:A9:FF:F6:B1:1A (OUI DF-A9-FF)
        Count: 1
< ACL Data TX: Handle 2160 flags 0x00 dlen 21              #138 [hci1] 9.313393
      SMP: Pairing Random (0x04) len 16
        Random value: 77355a9a8321c629a3a987d808e80865
> HCI Event: Number of Completed Packets (0x13) plen 5     #139 [hci1] 9.343924
        Num handles: 1
        Handle: 2160 Address: DF:A9:FF:F6:B1:1A (OUI DF-A9-FF)
        Count: 1
        #138: len 21 (5 Kb/s)
        Latency: 30 msec (20-50 msec ~30 msec)
> ACL Data RX: Handle 2160 flags 0x02 dlen 21              #140 [hci1] 9.594079
      SMP: Pairing Random (0x04) len 16
        Random value: 72a67311a8fba08ed7009074aa366af2
< HCI Command: Host Number of Comp.. (0x03|0x0035) plen 5  #141 [hci1] 9.613456
        Num handles: 1
        Handle: 2160 Address: DF:A9:FF:F6:B1:1A (OUI DF-A9-FF)
        Count: 1
< ACL Data TX: Handle 2160 flags 0x00 dlen 21              #142 [hci1] 9.613586
      SMP: Pairing Confirm (0x03) len 16
        Confim value: 7c8563836af582012906e4b38886b93f
> HCI Event: Number of Completed Packets (0x13) plen 5     #143 [hci1] 9.643869
        Num handles: 1
        Handle: 2160 Address: DF:A9:FF:F6:B1:1A (OUI DF-A9-FF)
        Count: 1
        #142: len 21 (5 Kb/s)
        Latency: 30 msec (20-50 msec ~30 msec)
> ACL Data RX: Handle 2160 flags 0x02 dlen 21              #144 [hci1] 9.694043
      SMP: Pairing Confirm (0x03) len 16
        Confim value: d0c541bc605f0f94a1a6543808c83432
< HCI Command: Host Number of Comp.. (0x03|0x0035) plen 5  #145 [hci1] 9.713298
        Num handles: 1
        Handle: 2160 Address: DF:A9:FF:F6:B1:1A (OUI DF-A9-FF)
        Count: 1
< ACL Data TX: Handle 2160 flags 0x00 dlen 21              #146 [hci1] 9.713418
      SMP: Pairing Random (0x04) len 16
        Random value: 8dfc1155a0b492f20f6ad8f13724432c
> HCI Event: Number of Completed Packets (0x13) plen 5     #147 [hci1] 9.743880
        Num handles: 1
        Handle: 2160 Address: DF:A9:FF:F6:B1:1A (OUI DF-A9-FF)
        Count: 1
        #146: len 21 (5 Kb/s)
        Latency: 30 msec (20-50 msec ~30 msec)
> ACL Data RX: Handle 2160 flags 0x02 dlen 21              #148 [hci1] 9.994140
      SMP: Pairing Random (0x04) len 16
        Random value: 8d8cbbe5dbc2c062b88b53c67a30ac8e
< HCI Command: Host Number of Com.. (0x03|0x0035) plen 5  #149 [hci1] 10.013280
        Num handles: 1
        Handle: 2160 Address: DF:A9:FF:F6:B1:1A (OUI DF-A9-FF)
        Count: 1
< ACL Data TX: Handle 2160 flags 0x00 dlen 21             #150 [hci1] 10.013352
      SMP: Pairing Confirm (0x03) len 16
        Confim value: 0c7859793c53883c9b58579f80ba0e3a
> HCI Event: Number of Completed Packets (0x13) plen 5    #151 [hci1] 10.043954
        Num handles: 1
        Handle: 2160 Address: DF:A9:FF:F6:B1:1A (OUI DF-A9-FF)
        Count: 1
        #150: len 21 (5 Kb/s)
        Latency: 30 msec (20-50 msec ~30 msec)
> ACL Data RX: Handle 2160 flags 0x02 dlen 21             #152 [hci1] 10.093984
      SMP: Pairing Confirm (0x03) len 16
        Confim value: 5874fa1a3b0c965652128a819882cbad
< HCI Command: Host Number of Com.. (0x03|0x0035) plen 5  #153 [hci1] 10.113297
        Num handles: 1
        Handle: 2160 Address: DF:A9:FF:F6:B1:1A (OUI DF-A9-FF)
        Count: 1
< ACL Data TX: Handle 2160 flags 0x00 dlen 21             #154 [hci1] 10.113480
      SMP: Pairing Random (0x04) len 16
        Random value: 001c45ff744123ac32ebbb5e14c8a6b9
> HCI Event: Number of Completed Packets (0x13) plen 5    #155 [hci1] 10.143794
        Num handles: 1
        Handle: 2160 Address: DF:A9:FF:F6:B1:1A (OUI DF-A9-FF)
        Count: 1
        #154: len 21 (5 Kb/s)
        Latency: 30 msec (20-50 msec ~30 msec)
> ACL Data RX: Handle 2160 flags 0x02 dlen 21             #156 [hci1] 10.394138
      SMP: Pairing Random (0x04) len 16
        Random value: 76b23258f2c268b9884c4a62f721e1de
< HCI Command: Host Number of Com.. (0x03|0x0035) plen 5  #157 [hci1] 10.413414
        Num handles: 1
        Handle: 2160 Address: DF:A9:FF:F6:B1:1A (OUI DF-A9-FF)
        Count: 1
< ACL Data TX: Handle 2160 flags 0x00 dlen 21             #158 [hci1] 10.413540
      SMP: Pairing Confirm (0x03) len 16
        Confim value: 2f2e1d24ef8717692bdc36e7b5f4f4b8
> HCI Event: Number of Completed Packets (0x13) plen 5    #159 [hci1] 10.443864
        Num handles: 1
        Handle: 2160 Address: DF:A9:FF:F6:B1:1A (OUI DF-A9-FF)
        Count: 1
        #158: len 21 (5 Kb/s)
        Latency: 30 msec (20-50 msec ~30 msec)
> ACL Data RX: Handle 2160 flags 0x02 dlen 21             #160 [hci1] 10.493960
      SMP: Pairing Confirm (0x03) len 16
        Confim value: ae29c6db18042e9f5596def1821e6ace
< HCI Command: Host Number of Com.. (0x03|0x0035) plen 5  #161 [hci1] 10.512965
        Num handles: 1
        Handle: 2160 Address: DF:A9:FF:F6:B1:1A (OUI DF-A9-FF)
        Count: 1
< ACL Data TX: Handle 2160 flags 0x00 dlen 21             #162 [hci1] 10.513011
      SMP: Pairing Random (0x04) len 16
        Random value: 296d277ff3bf297efe85e67448a15f56
> HCI Event: Number of Completed Packets (0x13) plen 5    #163 [hci1] 10.543930
        Num handles: 1
        Handle: 2160 Address: DF:A9:FF:F6:B1:1A (OUI DF-A9-FF)
        Count: 1
        #162: len 21 (5 Kb/s)
        Latency: 30 msec (20-50 msec ~30 msec)
> ACL Data RX: Handle 2160 flags 0x02 dlen 21             #164 [hci1] 10.794026
      SMP: Pairing Random (0x04) len 16
        Random value: 605dc3c8d0b0b1e0d868bc84629d820f
< HCI Command: Host Number of Com.. (0x03|0x0035) plen 5  #165 [hci1] 10.813460
        Num handles: 1
        Handle: 2160 Address: DF:A9:FF:F6:B1:1A (OUI DF-A9-FF)
        Count: 1
< ACL Data TX: Handle 2160 flags 0x00 dlen 21             #166 [hci1] 10.813573
      SMP: Pairing Confirm (0x03) len 16
        Confim value: b69b3f10fac03e36cabbe6e7b0b86385
> HCI Event: Number of Completed Packets (0x13) plen 5    #167 [hci1] 10.843784
        Num handles: 1
        Handle: 2160 Address: DF:A9:FF:F6:B1:1A (OUI DF-A9-FF)
        Count: 1
        #166: len 21 (5 Kb/s)
        Latency: 30 msec (20-50 msec ~30 msec)
> ACL Data RX: Handle 2160 flags 0x02 dlen 21             #168 [hci1] 10.894082
      SMP: Pairing Confirm (0x03) len 16
        Confim value: 80a3d12b695656699adaa35f45a8267d
< HCI Command: Host Number of Com.. (0x03|0x0035) plen 5  #169 [hci1] 10.912909
        Num handles: 1
        Handle: 2160 Address: DF:A9:FF:F6:B1:1A (OUI DF-A9-FF)
        Count: 1
< ACL Data TX: Handle 2160 flags 0x00 dlen 21             #170 [hci1] 10.912956
      SMP: Pairing Random (0x04) len 16
        Random value: e3a3cf1d832325a9493fd3ce4faf02be
> HCI Event: Number of Completed Packets (0x13) plen 5    #171 [hci1] 10.943820
        Num handles: 1
        Handle: 2160 Address: DF:A9:FF:F6:B1:1A (OUI DF-A9-FF)
        Count: 1
        #170: len 21 (5 Kb/s)
        Latency: 30 msec (20-50 msec ~30 msec)
> ACL Data RX: Handle 2160 flags 0x02 dlen 21             #172 [hci1] 11.194143
      SMP: Pairing Random (0x04) len 16
        Random value: bc1295d39680f464794435aa3c7a498f
< HCI Command: Host Number of Com.. (0x03|0x0035) plen 5  #173 [hci1] 11.213471
        Num handles: 1
        Handle: 2160 Address: DF:A9:FF:F6:B1:1A (OUI DF-A9-FF)
        Count: 1
< ACL Data TX: Handle 2160 flags 0x00 dlen 21             #174 [hci1] 11.213687
      SMP: Pairing Confirm (0x03) len 16
        Confim value: 41c55be431d95f421d38a736d2315038
> HCI Event: Number of Completed Packets (0x13) plen 5    #175 [hci1] 11.243851
        Num handles: 1
        Handle: 2160 Address: DF:A9:FF:F6:B1:1A (OUI DF-A9-FF)
        Count: 1
        #174: len 21 (5 Kb/s)
        Latency: 30 msec (20-50 msec ~30 msec)
> ACL Data RX: Handle 2160 flags 0x02 dlen 21             #176 [hci1] 11.293996
      SMP: Pairing Confirm (0x03) len 16
        Confim value: 3d203f999d830978ba4c9dc93a9f9061
< HCI Command: Host Number of Com.. (0x03|0x0035) plen 5  #177 [hci1] 11.312836
        Num handles: 1
        Handle: 2160 Address: DF:A9:FF:F6:B1:1A (OUI DF-A9-FF)
        Count: 1
< ACL Data TX: Handle 2160 flags 0x00 dlen 21             #178 [hci1] 11.312906
      SMP: Pairing Random (0x04) len 16
        Random value: 595bb7c6e45c58f6b41f855a6f6c3560
> HCI Event: Number of Completed Packets (0x13) plen 5    #179 [hci1] 11.343761
        Num handles: 1
        Handle: 2160 Address: DF:A9:FF:F6:B1:1A (OUI DF-A9-FF)
        Count: 1
        #178: len 21 (5 Kb/s)
        Latency: 30 msec (20-50 msec ~30 msec)
> ACL Data RX: Handle 2160 flags 0x02 dlen 21             #180 [hci1] 11.594189
      SMP: Pairing Random (0x04) len 16
        Random value: 3b971254a369c9117c847b9045cc2e0a
< HCI Command: Host Number of Com.. (0x03|0x0035) plen 5  #181 [hci1] 11.612951
        Num handles: 1
        Handle: 2160 Address: DF:A9:FF:F6:B1:1A (OUI DF-A9-FF)
        Count: 1
< ACL Data TX: Handle 2160 flags 0x00 dlen 21             #182 [hci1] 11.612980
      SMP: Pairing Confirm (0x03) len 16
        Confim value: a5312d3ed509e0cfa720544a0571ef07
> HCI Event: Number of Completed Packets (0x13) plen 5    #183 [hci1] 11.643953
        Num handles: 1
        Handle: 2160 Address: DF:A9:FF:F6:B1:1A (OUI DF-A9-FF)
        Count: 1
        #182: len 21 (5 Kb/s)
        Latency: 30 msec (20-50 msec ~30 msec)
> ACL Data RX: Handle 2160 flags 0x02 dlen 21             #184 [hci1] 11.693975
      SMP: Pairing Confirm (0x03) len 16
        Confim value: 16e3e75e7bfcb231ac5871de2a2d03c1
< HCI Command: Host Number of Com.. (0x03|0x0035) plen 5  #185 [hci1] 11.713432
        Num handles: 1
        Handle: 2160 Address: DF:A9:FF:F6:B1:1A (OUI DF-A9-FF)
        Count: 1
< ACL Data TX: Handle 2160 flags 0x00 dlen 21             #186 [hci1] 11.713514
      SMP: Pairing Random (0x04) len 16
        Random value: 84e2affc6847b67e7216d5bf664139ed
> HCI Event: Number of Completed Packets (0x13) plen 5    #187 [hci1] 11.743980
        Num handles: 1
        Handle: 2160 Address: DF:A9:FF:F6:B1:1A (OUI DF-A9-FF)
        Count: 1
        #186: len 21 (5 Kb/s)
        Latency: 30 msec (20-50 msec ~30 msec)
> ACL Data RX: Handle 2160 flags 0x02 dlen 21             #188 [hci1] 11.994123
      SMP: Pairing Random (0x04) len 16
        Random value: cdefe4699ade0af5320d99347fe86a6d
< HCI Command: Host Number of Com.. (0x03|0x0035) plen 5  #189 [hci1] 12.013406
        Num handles: 1
        Handle: 2160 Address: DF:A9:FF:F6:B1:1A (OUI DF-A9-FF)
        Count: 1
< ACL Data TX: Handle 2160 flags 0x00 dlen 21             #190 [hci1] 12.013476
      SMP: Pairing Confirm (0x03) len 16
        Confim value: ea864e2daa8795d65b27c524e7a3a5ff
> HCI Event: Number of Completed Packets (0x13) plen 5    #191 [hci1] 12.043925
        Num handles: 1
        Handle: 2160 Address: DF:A9:FF:F6:B1:1A (OUI DF-A9-FF)
        Count: 1
        #190: len 21 (5 Kb/s)
        Latency: 30 msec (20-50 msec ~30 msec)
> ACL Data RX: Handle 2160 flags 0x02 dlen 21             #192 [hci1] 12.094019
      SMP: Pairing Confirm (0x03) len 16
        Confim value: d6291ffc08ae4ad499a547edbe6030ff
< HCI Command: Host Number of Com.. (0x03|0x0035) plen 5  #193 [hci1] 12.113244
        Num handles: 1
        Handle: 2160 Address: DF:A9:FF:F6:B1:1A (OUI DF-A9-FF)
        Count: 1
< ACL Data TX: Handle 2160 flags 0x00 dlen 21             #194 [hci1] 12.113350
      SMP: Pairing Random (0x04) len 16
        Random value: 425496665d7eed17f76500c95219dd01
> HCI Event: Number of Completed Packets (0x13) plen 5    #195 [hci1] 12.143874
        Num handles: 1
        Handle: 2160 Address: DF:A9:FF:F6:B1:1A (OUI DF-A9-FF)
        Count: 1
        #194: len 21 (5 Kb/s)
        Latency: 30 msec (20-50 msec ~30 msec)
> ACL Data RX: Handle 2160 flags 0x02 dlen 21             #196 [hci1] 12.394033
      SMP: Pairing Random (0x04) len 16
        Random value: a361f26f5c96cf5d2c06d8d22b6476e5
< HCI Command: Host Number of Com.. (0x03|0x0035) plen 5  #197 [hci1] 12.413211
        Num handles: 1
        Handle: 2160 Address: DF:A9:FF:F6:B1:1A (OUI DF-A9-FF)
        Count: 1
< ACL Data TX: Handle 2160 flags 0x00 dlen 21             #198 [hci1] 12.413281
      SMP: Pairing Confirm (0x03) len 16
        Confim value: 0287639ef376ea5a19b6fc127d7ac29f
> HCI Event: Number of Completed Packets (0x13) plen 5    #199 [hci1] 12.443848
        Num handles: 1
        Handle: 2160 Address: DF:A9:FF:F6:B1:1A (OUI DF-A9-FF)
        Count: 1
        #198: len 21 (5 Kb/s)
        Latency: 30 msec (20-50 msec ~30 msec)
> ACL Data RX: Handle 2160 flags 0x02 dlen 21             #200 [hci1] 12.494005
      SMP: Pairing Confirm (0x03) len 16
        Confim value: de8dfc5d3f39ca8866018c8182700937
< HCI Command: Host Number of Com.. (0x03|0x0035) plen 5  #201 [hci1] 12.513307
        Num handles: 1
        Handle: 2160 Address: DF:A9:FF:F6:B1:1A (OUI DF-A9-FF)
        Count: 1
< ACL Data TX: Handle 2160 flags 0x00 dlen 21             #202 [hci1] 12.513497
      SMP: Pairing Random (0x04) len 16
        Random value: 1e63f87b860481d35d47e1f6006d79c9
> HCI Event: Number of Completed Packets (0x13) plen 5    #203 [hci1] 12.543821
        Num handles: 1
        Handle: 2160 Address: DF:A9:FF:F6:B1:1A (OUI DF-A9-FF)
        Count: 1
        #202: len 21 (5 Kb/s)
        Latency: 30 msec (20-50 msec ~30 msec)
> ACL Data RX: Handle 2160 flags 0x02 dlen 21             #204 [hci1] 12.794063
      SMP: Pairing Random (0x04) len 16
        Random value: 2f706604088473d63bd2c0e8ca140be0
< HCI Command: Host Number of Com.. (0x03|0x0035) plen 5  #205 [hci1] 12.813450
        Num handles: 1
        Handle: 2160 Address: DF:A9:FF:F6:B1:1A (OUI DF-A9-FF)
        Count: 1
< ACL Data TX: Handle 2160 flags 0x00 dlen 21             #206 [hci1] 12.813628
      SMP: Pairing Confirm (0x03) len 16
        Confim value: 47c45209433c832d0fc40ccaa0b62ac1
> HCI Event: Number of Completed Packets (0x13) plen 5    #207 [hci1] 12.843779
        Num handles: 1
        Handle: 2160 Address: DF:A9:FF:F6:B1:1A (OUI DF-A9-FF)
        Count: 1
        #206: len 21 (5 Kb/s)
        Latency: 30 msec (20-50 msec ~30 msec)
> ACL Data RX: Handle 2160 flags 0x02 dlen 21             #208 [hci1] 12.894040
      SMP: Pairing Confirm (0x03) len 16
        Confim value: b3d3b77cbf4ad4b6f7ffb47cb61b421f
< HCI Command: Host Number of Com.. (0x03|0x0035) plen 5  #209 [hci1] 12.913335
        Num handles: 1
        Handle: 2160 Address: DF:A9:FF:F6:B1:1A (OUI DF-A9-FF)
        Count: 1
< ACL Data TX: Handle 2160 flags 0x00 dlen 21             #210 [hci1] 12.913462
      SMP: Pairing Random (0x04) len 16
        Random value: 9d9e1ee31049e7f7e0c2476823e41736
> HCI Event: Number of Completed Packets (0x13) plen 5    #211 [hci1] 12.943806
        Num handles: 1
        Handle: 2160 Address: DF:A9:FF:F6:B1:1A (OUI DF-A9-FF)
        Count: 1
        #210: len 21 (5 Kb/s)
        Latency: 30 msec (20-50 msec ~30 msec)
> ACL Data RX: Handle 2160 flags 0x02 dlen 21             #212 [hci1] 13.194171
      SMP: Pairing Random (0x04) len 16
        Random value: 22e3a90301de8d2c70161b321d0e230a
< HCI Command: Host Number of Com.. (0x03|0x0035) plen 5  #213 [hci1] 13.213461
        Num handles: 1
        Handle: 2160 Address: DF:A9:FF:F6:B1:1A (OUI DF-A9-FF)
        Count: 1
< ACL Data TX: Handle 2160 flags 0x00 dlen 21             #214 [hci1] 13.213587
      SMP: Pairing Confirm (0x03) len 16
        Confim value: 619caf23ef678368faf214c2376f9c26
> HCI Event: Number of Completed Packets (0x13) plen 5    #215 [hci1] 13.243784
        Num handles: 1
        Handle: 2160 Address: DF:A9:FF:F6:B1:1A (OUI DF-A9-FF)
        Count: 1
        #214: len 21 (5 Kb/s)
        Latency: 30 msec (20-50 msec ~30 msec)
> ACL Data RX: Handle 2160 flags 0x02 dlen 21             #216 [hci1] 13.293976
      SMP: Pairing Confirm (0x03) len 16
        Confim value: d5d8b264fa21b8bd07de45f4cdb8c507
< HCI Command: Host Number of Com.. (0x03|0x0035) plen 5  #217 [hci1] 13.313121
        Num handles: 1
        Handle: 2160 Address: DF:A9:FF:F6:B1:1A (OUI DF-A9-FF)
        Count: 1
< ACL Data TX: Handle 2160 flags 0x00 dlen 21             #218 [hci1] 13.313162
      SMP: Pairing Random (0x04) len 16
        Random value: 81bafb7c3fcffc8b40d9b0b09bc4296b
> HCI Event: Number of Completed Packets (0x13) plen 5    #219 [hci1] 13.343859
        Num handles: 1
        Handle: 2160 Address: DF:A9:FF:F6:B1:1A (OUI DF-A9-FF)
        Count: 1
        #218: len 21 (5 Kb/s)
        Latency: 30 msec (20-50 msec ~30 msec)
> ACL Data RX: Handle 2160 flags 0x02 dlen 21             #220 [hci1] 13.594070
      SMP: Pairing Random (0x04) len 16
        Random value: 6cbe648be719f76d1db9f1ae24a5f650
< HCI Command: Host Number of Com.. (0x03|0x0035) plen 5  #221 [hci1] 13.613599
        Num handles: 1
        Handle: 2160 Address: DF:A9:FF:F6:B1:1A (OUI DF-A9-FF)
        Count: 1
< ACL Data TX: Handle 2160 flags 0x00 dlen 21             #222 [hci1] 13.613736
      SMP: Pairing DHKey Check (0x0d) len 16
        E: cd55ed40820e581581fc2216c866ce68
> HCI Event: Number of Completed Packets (0x13) plen 5    #223 [hci1] 13.643860
        Num handles: 1
        Handle: 2160 Address: DF:A9:FF:F6:B1:1A (OUI DF-A9-FF)
        Count: 1
        #222: len 21 (5 Kb/s)
        Latency: 30 msec (20-50 msec ~30 msec)
> ACL Data RX: Handle 2160 flags 0x02 dlen 21             #224 [hci1] 13.694053
      SMP: Pairing DHKey Check (0x0d) len 16
        E: be18b9edcb9d13cdfc81487dd01cbc6f
< HCI Command: LE Start Encryption (0x08|0x0019) plen 28  #225 [hci1] 13.712864
        Handle: 2160 Address: DF:A9:FF:F6:B1:1A (OUI DF-A9-FF)
        Random number: 0x0000000000000000
        Encrypted diversifier: 0x0000
        Long term key: c92a77d2aadd12ce4cc31e67d63d077c
> HCI Event: Command Status (0x0f) plen 4                 #226 [hci1] 13.713847
      LE Start Encryption (0x08|0x0019) ncmd 1
        Status: Success (0x00)
< HCI Command: Host Number of Com.. (0x03|0x0035) plen 5  #227 [hci1] 13.732896
        Num handles: 1
        Handle: 2160 Address: DF:A9:FF:F6:B1:1A (OUI DF-A9-FF)
        Count: 1
> HCI Event: Encryption Change (0x08) plen 4              #228 [hci1] 14.043725
        Status: Success (0x00)
        Handle: 2160 Address: DF:A9:FF:F6:B1:1A (OUI DF-A9-FF)
        Encryption: Enabled with AES-CCM (0x01)
< HCI Command: Disconnect (0x01|0x0006) plen 3            #229 [hci1] 14.613001
        Handle: 2160 Address: DF:A9:FF:F6:B1:1A (OUI DF-A9-FF)
        Reason: Remote User Terminated Connection (0x13)
> HCI Event: Command Status (0x0f) plen 4                 #230 [hci1] 14.613565
      Disconnect (0x01|0x0006) ncmd 1
        Status: Success (0x00)
> HCI Event: Disconnect Complete (0x05) plen 4            #231 [hci1] 14.693700
        Status: Success (0x00)
        Handle: 2160 Address: DF:A9:FF:F6:B1:1A (OUI DF-A9-FF)
        Reason: Connection Terminated By Local Host (0x16)
< HCI Command: Reset (0x03|0x0003) plen 0                 #232 [hci1] 21.783228
> HCI Event: Command Complete (0x0e) plen 4               #233 [hci1] 21.783903
      Reset (0x03|0x0003) ncmd 1
        Status: Success (0x00)
@ USER Close: main                                    {0x0001} [hci1] 21.792864
= Close Index: 00:00:00:00:00:00                               [hci1] 21.792873
