Bluetooth monitor ver 5.72
= Note: Linux version 6.14.0-36-generic (x86_64)                       0.003391
= Note: Bluetooth subsystem version 2.22                               0.003393
= New Index: 00:00:00:00:00:00 (Primary,UART,hci1)              [hci1] 0.003394
= New Index: 48:5F:99:8E:E0:64 (Primary,USB,hci0)               [hci0] 0.003394
= Open Index: 00:00:00:00:00:00                                 [hci1] 0.517786
= Index Info: 00:00:00:00:00:00 (Nordic Semiconductor ASA)      [hci1] 0.517798
@ USER Open: main (privileged) version 2.22            {0x0001} [hci1] 0.517805
< HCI Command: Reset (0x03|0x0003) plen 0                    #1 [hci1] 0.518955
> HCI Event: Command Complete (0x0e) plen 4                  #2 [hci1] 0.519522
      Reset (0x03|0x0003) ncmd 1
        Status: Success (0x00)
< HCI Command: Read Local Supported... (0x04|0x0003) plen 0  #3 [hci1] 0.537452
> HCI Event: Command Complete (0x0e) plen 12                 #4 [hci1] 0.538192
      Read Local Supported Features (0x04|0x0003) ncmd 1
        Status: Success (0x00)
        Features: 0x00 0x00 0x00 0x00 0x60 0x00 0x00 0x00
          BR/EDR Not Supported
          LE Supported (Controller)
< HCI Command: Read Local Version In.. (0x04|0x0001) plen 0  #5 [hci1] 0.557292
> HCI Event: Command Complete (0x0e) plen 12                 #6 [hci1] 0.557772
      Read Local Version Information (0x04|0x0001) ncmd 1
        Status: Success (0x00)
        HCI version: Reserved (0x0f) - Revision 12393 (0x3069)
        LMP version: Reserved (0x0f) - Subversion 12393 (0x3069)
        Manufacturer: Nordic Semiconductor ASA (89)
< HCI Command: Read Local Supported... (0x04|0x0002) plen 0  #7 [hci1] 0.577209
> HCI Event: Command Complete (0x0e) plen 68                 #8 [hci1] 0.578266
      Read Local Supported Commands (0x04|0x0002) ncmd 1
        Status: Success (0x00)
        Commands: 119 entries
          Disconnect (Octet 0 - Bit 5)
          Read Remote Version Information (Octet 2 - Bit 7)
          Set Event Mask (Octet 5 - Bit 6)
          Reset (Octet 5 - Bit 7)
          Read Connection Accept Timeout (Octet 7 - Bit 2)
          Write Connection Accept Timeout (Octet 7 - Bit 3)
          Read Transmit Power Level (Octet 10 - Bit 2)
          Set Controller To Host Flow Control (Octet 10 - Bit 5)
          Host Buffer Size (Octet 10 - Bit 6)
          Host Number of Completed Packets (Octet 10 - Bit 7)
          Read Local Version Information (Octet 14 - Bit 3)
          Read Local Supported Features (Octet 14 - Bit 5)
          Read BD ADDR (Octet 15 - Bit 1)
          Read RSSI (Octet 15 - Bit 5)
          Set Event Mask Page 2 (Octet 22 - Bit 2)
          LE Set Event Mask (Octet 25 - Bit 0)
          LE Read Buffer Size (Octet 25 - Bit 1)
          LE Read Local Supported Features (Octet 25 - Bit 2)
          LE Set Random Address (Octet 25 - Bit 4)
          LE Set Advertising Parameters (Octet 25 - Bit 5)
          LE Read Advertising Channel TX Power (Octet 25 - Bit 6)
          LE Set Advertising Data (Octet 25 - Bit 7)
          LE Set Scan Response Data (Octet 26 - Bit 0)
          LE Set Advertise Enable (Octet 26 - Bit 1)
          LE Set Scan Parameters (Octet 26 - Bit 2)
          LE Set Scan Enable (Octet 26 - Bit 3)
          LE Create Connection (Octet 26 - Bit 4)
          LE Create Connection Cancel (Octet 26 - Bit 5)
          LE Read Accept List Size (Octet 26 - Bit 6)
          LE Clear Accept List (Octet 26 - Bit 7)
          LE Add Device To Accept List (Octet 27 - Bit 0)
          LE Remove Device From Accept List (Octet 27 - Bit 1)
          LE Connection Update (Octet 27 - Bit 2)
          LE Set Host Channel Classification (Octet 27 - Bit 3)
          LE Read Channel Map (Octet 27 - Bit 4)
          LE Read Remote Used Features (Octet 27 - Bit 5)
          LE Encrypt (Octet 27 - Bit 6)
          LE Rand (Octet 27 - Bit 7)
          LE Start Encryption (Octet 28 - Bit 0)
          LE Long Term Key Request Reply (Octet 28 - Bit 1)
          LE Long Term Key Request Neg Reply (Octet 28 - Bit 2)
          LE Read Supported States (Octet 28 - Bit 3)
          LE Receiver Test (Octet 28 - Bit 4)
          LE Transmitter Test (Octet 28 - Bit 5)
          LE Test End (Octet 28 - Bit 6)
          Read Authenticated Payload Timeout (Octet 32 - Bit 4)
          Write Authenticated Payload Timeout (Octet 32 - Bit 5)
          LE Set Data Length (Octet 33 - Bit 6)
          LE Read Suggested Default Data Length (Octet 33 - Bit 7)
          LE Write Suggested Default Data Length (Octet 34 - Bit 0)
          LE Add Device To Resolving List (Octet 34 - Bit 3)
          LE Remove Device From Resolving List (Octet 34 - Bit 4)
          LE Clear Resolving List (Octet 34 - Bit 5)
          LE Read Resolving List Size (Octet 34 - Bit 6)
          LE Set Address Resolution Enable (Octet 35 - Bit 1)
          LE Set Resolvable Private Address Timeout (Octet 35 - Bit 2)
          LE Read Maximum Data Length (Octet 35 - Bit 3)
          LE Read PHY (Octet 35 - Bit 4)
          LE Set Default PHY (Octet 35 - Bit 5)
          LE Set PHY (Octet 35 - Bit 6)
          LE Enhanced Receiver Test (Octet 35 - Bit 7)
          LE Enhanced Transmitter Test (Octet 36 - Bit 0)
          LE Set Advertising Set Random Address (Octet 36 - Bit 1)
          LE Set Extended Advertising Parameters (Octet 36 - Bit 2)
          LE Set Extended Advertising Data (Octet 36 - Bit 3)
          LE Set Extended Scan Response Data (Octet 36 - Bit 4)
          LE Set Extended Advertising Enable (Octet 36 - Bit 5)
          LE Read Maximum Advertising Data Length (Octet 36 - Bit 6)
          LE Read Number of Supported Advertising Sets (Octet 36 - Bit 7)
          LE Remove Advertising Set (Octet 37 - Bit 0)
          LE Clear Advertising Sets (Octet 37 - Bit 1)
          LE Set Periodic Advertising Parameters (Octet 37 - Bit 2)
          LE Set Periodic Advertising Data (Octet 37 - Bit 3)
          LE Set Periodic Advertising Enable (Octet 37 - Bit 4)
          LE Set Extended Scan Parameters (Octet 37 - Bit 5)
          LE Set Extended Scan Enable (Octet 37 - Bit 6)
          LE Extended Create Connection (Octet 37 - Bit 7)
          LE Periodic Advertising Create Sync (Octet 38 - Bit 0)
          LE Periodic Advertising Create Sync Cancel (Octet 38 - Bit 1)
          LE Periodic Advertising Terminate Sync (Octet 38 - Bit 2)
          LE Add Device To Periodic Advertiser List (Octet 38 - Bit 3)
          LE Remove Device From Periodic Advertiser List (Octet 38 - Bit 4)
          LE Clear Periodic Advertiser List (Octet 38 - Bit 5)
          LE Read Periodic Advertiser List Size (Octet 38 - Bit 6)
          LE Read Transmit Power (Octet 38 - Bit 7)
          LE Read RF Path Compensation (Octet 39 - Bit 0)
          LE Write RF Path Compensation (Octet 39 - Bit 1)
          LE Set Privacy Mode (Octet 39 - Bit 2)
          LE Periodic Advertising Receive Enable (Octet 40 - Bit 5)
          LE Periodic Advertising Sync Transfer (Octet 40 - Bit 6)
          LE Periodic Advertising Set Info Transfer (Octet 40 - Bit 7)
          LE Periodic Advertising Sync Transfer Parameters (Octet 41 - Bit 0)
          LE Set Default Periodic Advertisng Sync Transfer Parameters (Octet 41 - Bit 1)
          LE Read Buffer v2 (Octet 41 - Bit 5)
          LE Read ISO TX Sync (Octet 41 - Bit 6)
          LE Set Connected Isochronous Group Parameters (Octet 41 - Bit 7)
          LE Set Connected Isochronous Group Parameters Test (Octet 42 - Bit 0)
          LE Create Connected Isochronous Stream (Octet 42 - Bit 1)
          LE Remove Connected Isochronous Group (Octet 42 - Bit 2)
          LE Accept Connected Isochronous Stream Request (Octet 42 - Bit 3)
          LE Reject Connected Isochronous Stream Request (Octet 42 - Bit 4)
          LE Create Broadcast Isochronous Group (Octet 42 - Bit 5)
          LE Create Broadcast Isochronous Group Test (Octet 42 - Bit 6)
          LE Terminate Broadcast Isochronous Group (Octet 42 - Bit 7)
          LE Broadcast Isochronous Group Create Sync (Octet 43 - Bit 0)
          LE Broadcast Isochronous Group Terminate Sync (Octet 43 - Bit 1)
          LE Request Peer SCA (Octet 43 - Bit 2)
          LE Setup Isochronous Data Path (Octet 43 - Bit 3)
          LE Remove Isochronous Data Path (Octet 43 - Bit 4)
          LE Isochronous Transmit Test (Octet 43 - Bit 5)
          LE Isochronous Receive Test (Octet 43 - Bit 6)
          LE Isochronous Read Test Counters (Octet 43 - Bit 7)
          LE Isochronous Read Test Counters (Octet 44 - Bit 0)
          LE Set Host Feature (Octet 44 - Bit 1)
          Octet 44 - Bit 2 
          Octet 45 - Bit 6 
          Octet 46 - Bit 0 
          Octet 46 - Bit 1 
          Octet 46 - Bit 2 
< HCI Command: Host Buffer Size (0x03|0x0033) plen 7         #9 [hci1] 0.597223
        ACL MTU: 255  ACL max packet: 16
        SCO MTU: 0    SCO max packet: 0
> HCI Event: Command Complete (0x0e) plen 4                 #10 [hci1] 0.597686
      Host Buffer Size (0x03|0x0033) ncmd 1
        Status: Success (0x00)
< HCI Command: Set Controller To Ho.. (0x03|0x0031) plen 1  #11 [hci1] 0.617216
        Flow control: ACL Data Packets (0x01)
> HCI Event: Command Complete (0x0e) plen 4                 #12 [hci1] 0.617717
      Set Controller To Host Flow Control (0x03|0x0031) ncmd 1
        Status: Success (0x00)
< HCI Command: LE Read Local Suppor.. (0x08|0x0003) plen 0  #13 [hci1] 0.637178
> HCI Event: Command Complete (0x0e) plen 12                #14 [hci1] 0.637723
      LE Read Local Supported Features (0x08|0x0003) ncmd 1
        Status: Success (0x00)
        Features: 0xfd 0x79 0x00 0xf7 0x30 0x01 0x00 0x00
          LE Encryption
          Extended Reject Indication
          Peripheral-initiated Features Exchange
          LE Ping
          LE Data Packet Length Extension
          LL Privacy
          Extended Scanner Filter Policies
          LE 2M PHY
          LE Coded PHY
          LE Extended Advertising
          LE Periodic Advertising
          Channel Selection Algorithm #2
          Periodic Advertising Sync Transfer - Sender
          Periodic Advertising Sync Transfer - Recipient
          Sleep Clock Accuracy Updates
          Connected Isochronous Stream - Central
          Connected Isochronous Stream - Peripheral
          Isochronous Broadcaster
          Synchronized Receiver
          Periodic Advertising ADI support
          Connection Subrating
          Unknown features (0x0000010000000000)
< HCI Command: LE Set Host Feature (0x08|0x0074) plen 2     #15 [hci1] 0.657226
        Bit Number: 32
          Connected Isochronous Stream (Host Support)
        Bit Value: 1
> HCI Event: Command Complete (0x0e) plen 4                 #16 [hci1] 0.657690
      LE Set Host Feature (0x08|0x0074) ncmd 1
        Status: Success (0x00)
< HCI Command: LE Read Buffer v2 (0x08|0x0060) plen 0       #17 [hci1] 0.677239
> HCI Event: Command Complete (0x0e) plen 10                #18 [hci1] 0.677786
      LE Read Buffer v2 (0x08|0x0060) ncmd 1
        Status: Success (0x00)
        ACL MTU: 27
        ACL max packet: 3
        ISO MTU: 318
        ISO max packet: 3
< HCI Command: LE Read Maximum Adve.. (0x08|0x003a) plen 0  #19 [hci1] 0.697276
> HCI Event: Command Complete (0x0e) plen 6                 #20 [hci1] 0.697816
      LE Read Maximum Advertising Data Length (0x08|0x003a) ncmd 1
        Status: Success (0x00)
        Max length: 1650
< HCI Command: LE Read Supported St.. (0x08|0x001c) plen 0  #21 [hci1] 0.717253
> HCI Event: Command Complete (0x0e) plen 12                #22 [hci1] 0.717761
      LE Read Supported States (0x08|0x001c) ncmd 1
        Status: Success (0x00)
        States: 0x000003ff3e0306ff
          Non-connectable Advertising State
          Scannable Advertising State
          Connectable Advertising State
          High Duty Cycle Directed Advertising State
          Passive Scanning State
          Active Scanning State
          Initiating State
            and Connection State (Central Role)
          Connection State (Peripheral Role)
          Scannable Advertising State
            and Passive Scanning State
          Connectable Advertising State
            and Passive Scanning State
          Non-connectable Advertising State
            and Initiating State
          Scannable Advertising State
            and Initiating State
          Active Scanning State
            and Connection State (Central Role)
          Passive Scanning State
            and Connection State (Peripheral Role)
          Active Scanning State
            and Connection State (Peripheral Role)
          Initiating State
            and Connection State (Central Role)
            and Central Role & Central Role
          Low Duty Cycle Directed Advertising State
          Connectable Advertising State
            and Initiating State
            and Central Role & Peripheral Role
          High Duty Cycle Directed Advertising State
            and Initiating State
            and Central Role & Peripheral Role
          Low Duty Cycle Directed Advertising State
            and Initiating State
            and Central Role & Peripheral Role
          Connectable Advertising State
            and Connection State (Central Role)
            and Central Role & Peripheral Role
          High Duty Cycle Directed Advertising State
            and Connection State (Central Role)
            and Central Role & Peripheral Role
          Low Duty Cycle Directed Advertising State
            and Connection State (Central Role)
            and Central Role & Peripheral Role
          Connectable Advertising State
            and Connection State (Peripheral Role)
            and Central Role & Peripheral Role
          High Duty Cycle Directed Advertising State
            and Connection State (Peripheral Role)
            and Peripheral Role & Peripheral Role
          Low Duty Cycle Directed Advertising State
            and Connection State (Peripheral Role)
            and Peripheral Role & Peripheral Role
          Initiating State
            and Connection State (Peripheral Role)
            and Central Role & Peripheral Role
< HCI Command: LE Read Maximum Data.. (0x08|0x002f) plen 0  #23 [hci1] 0.737241
> HCI Event: Command Complete (0x0e) plen 12                #24 [hci1] 0.737713
      LE Read Maximum Data Length (0x08|0x002f) ncmd 1
        Status: Success (0x00)
        Max TX octets: 251
        Max TX time: 2704
        Max RX octets: 251
        Max RX time: 2704
< HCI Command: LE Write Suggested D.. (0x08|0x0024) plen 4  #25 [hci1] 0.757208
        TX octets: 251
        TX time: 2704
> HCI Event: Command Complete (0x0e) plen 4                 #26 [hci1] 0.757786
      LE Write Suggested Default Data Length (0x08|0x0024) ncmd 1
        Status: Success (0x00)
< HCI Command: LE Read Resolving Li.. (0x08|0x002a) plen 0  #27 [hci1] 0.777238
> HCI Event: Command Complete (0x0e) plen 5                 #28 [hci1] 0.777740
      LE Read Resolving List Size (0x08|0x002a) ncmd 1
        Status: Success (0x00)
        Size: 8
< HCI Command: LE Set Event Mask (0x08|0x0001) plen 8       #29 [hci1] 0.797241
        Mask: 0x000002023f87fa5e
          LE Advertising Report
          LE Connection Update Complete
          LE Read Remote Used Features Complete
          LE Long Term Key Request
          LE Data Length Change
          LE Enhanced Connection Complete
          LE PHY Update Complete
          LE Extended Advertising Report
          LE Periodic Advertising Sync Established
          LE Periodic Advertising Report
          LE Periodic Advertising Sync Lost
          LE Extended Scan Timeout
          LE Extended Advertising Set Terminated
          LE Scan Request Received
          LE Periodic Advertising Sync Transfer Rvc
          LE CIS Established
          LE CIS Request
          LE Create BIG Complete
          LE Terminate BIG Complete
          LE BIG Sync Estabilished Complete
          LE BIG Sync Lost
          LE BIG Info Advertising Report
          Unknown mask (0x0000020000000000)
> HCI Event: Command Complete (0x0e) plen 4                 #30 [hci1] 0.797760
      LE Set Event Mask (0x08|0x0001) ncmd 1
        Status: Success (0x00)
< HCI Command: Set Event Mask (0x03|0x0001) plen 8          #31 [hci1] 0.817240
        Mask: 0x2000800002008890
          Disconnection Complete
          Encryption Change
          Read Remote Version Information Complete
          Hardware Error
          Data Buffer Overflow
          Encryption Key Refresh Complete
          LE Meta
> HCI Event: Command Complete (0x0e) plen 4                 #32 [hci1] 0.817736
      Set Event Mask (0x03|0x0001) ncmd 1
        Status: Success (0x00)
< HCI Command: Read BD ADDR (0x04|0x0009) plen 0            #33 [hci1] 0.837251
> HCI Event: Command Complete (0x0e) plen 10                #34 [hci1] 0.837757
      Read BD ADDR (0x04|0x0009) ncmd 1
        Status: Success (0x00)
        Address: 00:00:00:00:00:00 (OUI 00-00-00)
< HCI Command: LE Set Random Address (0x08|0x0005) plen 6   #35 [hci1] 0.857257
        Address: D5:B6:CC:31:DB:3B (Static)
> HCI Event: Command Complete (0x0e) plen 4                 #36 [hci1] 0.857752
      LE Set Random Address (0x08|0x0005) ncmd 1
        Status: Success (0x00)
< HCI Command: LE Set Extended Adv.. (0x08|0x0036) plen 25  #37 [hci1] 3.387309
        Handle: 0x00
        Properties: 0x0013
          Connectable
          Scannable
          Use legacy advertising PDUs: ADV_IND
        Min advertising interval: 100.000 msec (0x00a0)
        Max advertising interval: 150.000 msec (0x00f0)
        Channel map: 37, 38, 39 (0x07)
        Own address type: Random (0x01)
        Peer address type: Public (0x00)
        Peer address: 00:00:00:00:00:00 (OUI 00-00-00)
        Filter policy: Allow Scan Request from Any, Allow Connect Request from Any (0x00)
        TX power: Host has no preference (0x7f)
        Primary PHY: LE 1M (0x01)
        Secondary max skip: 0x00
        Secondary PHY: LE 1M (0x01)
        SID: 0x00
        Scan request notifications: Disabled (0x00)
> HCI Event: Command Complete (0x0e) plen 5                 #38 [hci1] 3.388107
      LE Set Extended Advertising Parameters (0x08|0x0036) ncmd 1
        Status: Success (0x00)
        TX power (selected): 0 dbm (0x00)
< HCI Command: LE Set Advertising S.. (0x08|0x0035) plen 7  #39 [hci1] 3.397265
        Advertising handle: 0x00
        Advertising random address: D5:B6:CC:31:DB:3B (Static)
> HCI Event: Command Complete (0x0e) plen 4                 #40 [hci1] 3.397925
      LE Set Advertising Set Random Address (0x08|0x0035) ncmd 1
        Status: Success (0x00)
< HCI Command: LE Set Extended Adv.. (0x08|0x0037) plen 22  #41 [hci1] 3.417290
        Handle: 0x00
        Operation: Complete extended advertising data (0x03)
        Fragment preference: Minimize fragmentation (0x01)
        Data length: 0x12
        Flags: 0x06
          LE General Discoverable Mode
          BR/EDR Not Supported
        Name (complete): Tester_F6B11A
> HCI Event: Command Complete (0x0e) plen 4                 #42 [hci1] 3.417970
      LE Set Extended Advertising Data (0x08|0x0037) ncmd 1
        Status: Success (0x00)
< HCI Command: LE Set Extended Scan.. (0x08|0x0038) plen 4  #43 [hci1] 3.437277
        Handle: 0x00
        Operation: Complete scan response data (0x03)
        Fragment preference: Minimize fragmentation (0x01)
        Data length: 0x00
> HCI Event: Command Complete (0x0e) plen 4                 #44 [hci1] 3.437763
      LE Set Extended Scan Response Data (0x08|0x0038) ncmd 1
        Status: Success (0x00)
< HCI Command: LE Set Extended Adve.. (0x08|0x0039) plen 6  #45 [hci1] 3.457283
        Extended advertising: Enabled (0x01)
        Number of sets: 1 (0x01)
        Entry 0
          Handle: 0x00
          Duration: 0 ms (0x00)
          Max ext adv events: 0
> HCI Event: Command Complete (0x0e) plen 4                 #46 [hci1] 3.457817
      LE Set Extended Advertising Enable (0x08|0x0039) ncmd 1
        Status: Success (0x00)
> HCI Event: LE Meta Event (0x3e) plen 31                   #47 [hci1] 3.573542
      LE Enhanced Connection Complete (0x0a)
        Status: Success (0x00)
        Handle: 2001
        Role: Peripheral (0x01)
        Peer address type: Public (0x00)
        Peer address: DF:A9:FF:F6:B1:1A (OUI DF-A9-FF)
        Local resolvable private address: 00:00:00:00:00:00 (Non-Resolvable)
        Peer resolvable private address: 00:00:00:00:00:00 (Non-Resolvable)
        Connection interval: 87.50 msec (0x0046)
        Connection latency: 0 (0x0000)
        Supervision timeout: 25120 msec (0x09d0)
        Central clock accuracy: 0x01
> HCI Event: LE Meta Event (0x3e) plen 6                    #48 [hci1] 3.573770
      LE Advertising Set Terminated (0x12)
        Status: Success (0x00)
        Handle: 0
        Connection handle: 2001
        Number of completed extended advertising events: 0
< HCI Command: LE Read Remote Used... (0x08|0x0016) plen 2  #49 [hci1] 3.577889
        Handle: 2001 Address: DF:A9:FF:F6:B1:1A (OUI DF-A9-FF)
< ACL Data TX: Handle 2001 flags 0x00 dlen 7                #50 [hci1] 3.577903
      ATT: Exchange MTU Request (0x02) len 2
        Client RX MTU: 251
> HCI Event: Command Status (0x0f) plen 4                   #51 [hci1] 3.578532
      LE Read Remote Used Features (0x08|0x0016) ncmd 1
        Status: Success (0x00)
> HCI Event: Number of Completed Packets (0x13) plen 5      #52 [hci1] 3.749555
        Num handles: 1
        Handle: 2001 Address: DF:A9:FF:F6:B1:1A (OUI DF-A9-FF)
        Count: 1
        #50: len 7 (0 Kb/s)
        Latency: 171 msec (171-171 msec ~171 msec)
> HCI Event: LE Meta Event (0x3e) plen 12                   #53 [hci1] 3.837522
      LE Read Remote Used Features (0x04)
        Status: Success (0x00)
        Handle: 2001 Address: DF:A9:FF:F6:B1:1A (OUI DF-A9-FF)
        Features: 0x2d 0x49 0x00 0xf7 0x67 0xd8 0x00 0x00
          LE Encryption
          Extended Reject Indication
          Peripheral-initiated Features Exchange
          LE Data Packet Length Extension
          LE 2M PHY
          LE Coded PHY
          Channel Selection Algorithm #2
          Periodic Advertising Sync Transfer - Sender
          Periodic Advertising Sync Transfer - Recipient
          Sleep Clock Accuracy Updates
          Connected Isochronous Stream - Central
          Connected Isochronous Stream - Peripheral
          Isochronous Broadcaster
          Synchronized Receiver
          Connected Isochronous Stream (Host Support)
          LE Power Control Request
          LE Power Control Request
          Connection Subrating
          Connection Subrating (Host Support)
          Unknown features (0x0000d80000000000)
> ACL Data RX: Handle 2001 flags 0x02 dlen 11               #54 [hci1] 6.287204
      SMP: Pairing Request (0x01) len 6
        IO capability: KeyboardDisplay (0x04)
        OOB data: Authentication data not present (0x00)
        Authentication requirement: Bonding, MITM, SC, No Keypresses (0x0d)
        Max encryption key size: 16
        Initiator key distribution: EncKey IdKey (0x03)
        Responder key distribution: EncKey IdKey Sign (0x07)
> ACL Data RX: Handle 2001 flags 0x02 dlen 7                #55 [hci1] 6.287548
      ATT: Exchange MTU Response (0x03) len 2
        Server RX MTU: 23
< HCI Command: Host Number of Compl.. (0x03|0x0035) plen 5  #56 [hci1] 6.297687
        Num handles: 1
        Handle: 2001 Address: DF:A9:FF:F6:B1:1A (OUI DF-A9-FF)
        Count: 1
< ACL Data TX: Handle 2001 flags 0x00 dlen 11               #57 [hci1] 6.297904
      SMP: Pairing Response (0x02) len 6
        IO capability: DisplayOnly (0x00)
        OOB data: Authentication data not present (0x00)
        Authentication requirement: Bonding, No MITM, SC, No Keypresses (0x09)
        Max encryption key size: 16
        Initiator key distribution: IdKey (0x02)
        Responder key distribution: <none> (0x00)
< HCI Command: Host Number of Compl.. (0x03|0x0035) plen 5  #58 [hci1] 6.298087
        Num handles: 1
        Handle: 2001 Address: DF:A9:FF:F6:B1:1A (OUI DF-A9-FF)
        Count: 1
> HCI Event: Number of Completed Packets (0x13) plen 5      #59 [hci1] 6.462283
        Num handles: 1
        Handle: 2001 Address: DF:A9:FF:F6:B1:1A (OUI DF-A9-FF)
        Count: 1
        #57: len 11 (0 Kb/s)
        Latency: 164 msec (164-171 msec ~168 msec)
> ACL Data RX: Handle 2001 flags 0x02 dlen 27               #60 [hci1] 6.462551
> ACL Data RX: Handle 2001 flags 0x01 dlen 27               #61 [hci1] 6.463036
> ACL Data RX: Handle 2001 flags 0x01 dlen 15               #62 [hci1] 6.463542
      SMP: Pairing Public Key (0x0c) len 64
        X: 99479c0ba17ed8dbd2ff9aa2ed25f0782a4c0eed60d87fbb944c888da476bbbc
        Y: ff2536c269330f2d405f0662102f20cfae4e67cbd554e7f8434dfeb605f17387
< HCI Command: Host Number of Compl.. (0x03|0x0035) plen 5  #63 [hci1] 6.478363
        Num handles: 1
        Handle: 2001 Address: DF:A9:FF:F6:B1:1A (OUI DF-A9-FF)
        Count: 1
< HCI Command: Host Number of Compl.. (0x03|0x0035) plen 5  #64 [hci1] 6.478548
        Num handles: 1
        Handle: 2001 Address: DF:A9:FF:F6:B1:1A (OUI DF-A9-FF)
        Count: 1
< HCI Command: Host Number of Compl.. (0x03|0x0035) plen 5  #65 [hci1] 6.478937
        Num handles: 1
        Handle: 2001 Address: DF:A9:FF:F6:B1:1A (OUI DF-A9-FF)
        Count: 1
< ACL Data TX: Handle 2001 flags 0x00 dlen 27               #66 [hci1] 6.479176
< ACL Data TX: Handle 2001 flags 0x01 dlen 27               #67 [hci1] 6.479193
< ACL Data TX: Handle 2001 flags 0x01 dlen 15               #68 [hci1] 6.479225
      SMP: Pairing Public Key (0x0c) len 64
        X: 98308440221e2d910f0e54b71e7ec652857aa9b5a0dc65028824cc19db1226e9
        Y: 67a4816bcb62efb21701e31fdb27561a6217575fb007a8bbdabe7e28b6f68482
> HCI Event: Number of Completed Packets (0x13) plen 5      #69 [hci1] 6.550168
        Num handles: 1
        Handle: 2001 Address: DF:A9:FF:F6:B1:1A (OUI DF-A9-FF)
        Count: 1
        #66: len 27 (3 Kb/s)
        Latency: 70 msec (70-171 msec ~119 msec)
> HCI Event: Number of Completed Packets (0x13) plen 5      #70 [hci1] 6.550757
        Num handles: 1
        Handle: 2001 Address: DF:A9:FF:F6:B1:1A (OUI DF-A9-FF)
        Count: 1
        #67: len 27 (3 Kb/s)
        Latency: 71 msec (70-171 msec ~95 msec)
> HCI Event: Number of Completed Packets (0x13) plen 5      #71 [hci1] 6.636941
        Num handles: 1
        Handle: 2001 Address: DF:A9:FF:F6:B1:1A (OUI DF-A9-FF)
        Count: 1
        #68: len 15 (0 Kb/s)
        Latency: 157 msec (70-171 msec ~126 msec)
> ACL Data RX: Handle 2001 flags 0x02 dlen 21               #72 [hci1] 7.599822
      SMP: Pairing Confirm (0x03) len 16
        Confim value: 9903d4afec907bfc9f4a311de8ac81d7
< HCI Command: Host Number of Compl.. (0x03|0x0035) plen 5  #73 [hci1] 7.617529
        Num handles: 1
        Handle: 2001 Address: DF:A9:FF:F6:B1:1A (OUI DF-A9-FF)
        Count: 1
< ACL Data TX: Handle 2001 flags 0x00 dlen 21               #74 [hci1] 7.617624
      SMP: Pairing Confirm (0x03) len 16
        Confim value: 0c83864991bf09db81b85029c59d441d
> HCI Event: Number of Completed Packets (0x13) plen 5      #75 [hci1] 7.774593
        Num handles: 1
        Handle: 2001 Address: DF:A9:FF:F6:B1:1A (OUI DF-A9-FF)
        Count: 1
        #74: len 21 (1 Kb/s)
        Latency: 156 msec (70-171 msec ~141 msec)
> ACL Data RX: Handle 2001 flags 0x02 dlen 21               #76 [hci1] 7.774893
      SMP: Pairing Random (0x04) len 16
        Random value: 98fec3823c6bbe620000000000000000
< HCI Command: Host Number of Compl.. (0x03|0x0035) plen 5  #77 [hci1] 7.777996
        Num handles: 1
        Handle: 2001 Address: DF:A9:FF:F6:B1:1A (OUI DF-A9-FF)
        Count: 1
< ACL Data TX: Handle 2001 flags 0x00 dlen 21               #78 [hci1] 7.778078
      SMP: Pairing Random (0x04) len 16
        Random value: 8e6108f966a694cbe26df70bb96773e6
> HCI Event: Number of Completed Packets (0x13) plen 5      #79 [hci1] 7.949384
        Num handles: 1
        Handle: 2001 Address: DF:A9:FF:F6:B1:1A (OUI DF-A9-FF)
        Count: 1
        #78: len 21 (0 Kb/s)
        Latency: 171 msec (70-171 msec ~156 msec)
> ACL Data RX: Handle 2001 flags 0x02 dlen 21               #80 [hci1] 8.037239
      SMP: Pairing Confirm (0x03) len 16
        Confim value: 0278746be55685b44c385ec5c316a26b
< HCI Command: Host Number of Compl.. (0x03|0x0035) plen 5  #81 [hci1] 8.057556
        Num handles: 1
        Handle: 2001 Address: DF:A9:FF:F6:B1:1A (OUI DF-A9-FF)
        Count: 1
< ACL Data TX: Handle 2001 flags 0x00 dlen 21               #82 [hci1] 8.057693
      SMP: Pairing Confirm (0x03) len 16
        Confim value: 32ebd1b42ba811677fdaea2222a88e8c
> HCI Event: Number of Completed Packets (0x13) plen 5      #83 [hci1] 8.212078
        Num handles: 1
        Handle: 2001 Address: DF:A9:FF:F6:B1:1A (OUI DF-A9-FF)
        Count: 1
        #82: len 21 (1 Kb/s)
        Latency: 154 msec (70-171 msec ~155 msec)
> ACL Data RX: Handle 2001 flags 0x02 dlen 21               #84 [hci1] 8.212423
      SMP: Pairing Random (0x04) len 16
        Random value: 3aab2ed5902c37370000000000000000
< HCI Command: Host Number of Compl.. (0x03|0x0035) plen 5  #85 [hci1] 8.217815
        Num handles: 1
        Handle: 2001 Address: DF:A9:FF:F6:B1:1A (OUI DF-A9-FF)
        Count: 1
< ACL Data TX: Handle 2001 flags 0x00 dlen 21               #86 [hci1] 8.217901
      SMP: Pairing Random (0x04) len 16
        Random value: 4d02679f89a05211af56d8b3da64d21e
> HCI Event: Number of Completed Packets (0x13) plen 5      #87 [hci1] 8.386820
        Num handles: 1
        Handle: 2001 Address: DF:A9:FF:F6:B1:1A (OUI DF-A9-FF)
        Count: 1
        #86: len 21 (1 Kb/s)
        Latency: 168 msec (70-171 msec ~162 msec)
> ACL Data RX: Handle 2001 flags 0x02 dlen 21               #88 [hci1] 8.474778
      SMP: Pairing Confirm (0x03) len 16
        Confim value: a8ccb3d9a8eafa9ff13312b15392ed27
< HCI Command: Host Number of Compl.. (0x03|0x0035) plen 5  #89 [hci1] 8.477439
        Num handles: 1
        Handle: 2001 Address: DF:A9:FF:F6:B1:1A (OUI DF-A9-FF)
        Count: 1
< ACL Data TX: Handle 2001 flags 0x00 dlen 21               #90 [hci1] 8.477572
      SMP: Pairing Confirm (0x03) len 16
        Confim value: 5174164c2562b3adb8bbb3c7980e931f
> HCI Event: Number of Completed Packets (0x13) plen 5      #91 [hci1] 8.649586
        Num handles: 1
        Handle: 2001 Address: DF:A9:FF:F6:B1:1A (OUI DF-A9-FF)
        Count: 1
        #90: len 21 (0 Kb/s)
        Latency: 172 msec (70-172 msec ~167 msec)
> ACL Data RX: Handle 2001 flags 0x02 dlen 21               #92 [hci1] 8.649854
      SMP: Pairing Random (0x04) len 16
        Random value: b5c004811e47f5070000000000000000
< HCI Command: Host Number of Compl.. (0x03|0x0035) plen 5  #93 [hci1] 8.657759
        Num handles: 1
        Handle: 2001 Address: DF:A9:FF:F6:B1:1A (OUI DF-A9-FF)
        Count: 1
< ACL Data TX: Handle 2001 flags 0x00 dlen 21               #94 [hci1] 8.657855
      SMP: Pairing Random (0x04) len 16
        Random value: 5e8286bc235a02440d0c3424a2acf8fd
> HCI Event: Number of Completed Packets (0x13) plen 5      #95 [hci1] 8.824367
        Num handles: 1
        Handle: 2001 Address: DF:A9:FF:F6:B1:1A (OUI DF-A9-FF)
        Count: 1
        #94: len 21 (1 Kb/s)
        Latency: 166 msec (70-172 msec ~166 msec)
> ACL Data RX: Handle 2001 flags 0x02 dlen 21               #96 [hci1] 8.912218
      SMP: Pairing Confirm (0x03) len 16
        Confim value: e8a7859df5f75ddb2a3d76698e4e3fa4
< HCI Command: Host Number of Compl.. (0x03|0x0035) plen 5  #97 [hci1] 8.917532
        Num handles: 1
        Handle: 2001 Address: DF:A9:FF:F6:B1:1A (OUI DF-A9-FF)
        Count: 1
< ACL Data TX: Handle 2001 flags 0x00 dlen 21               #98 [hci1] 8.917667
      SMP: Pairing Confirm (0x03) len 16
        Confim value: ae55f8344dd47dd79e9120f99206c36c
> HCI Event: Number of Completed Packets (0x13) plen 5      #99 [hci1] 9.087071
        Num handles: 1
        Handle: 2001 Address: DF:A9:FF:F6:B1:1A (OUI DF-A9-FF)
        Count: 1
        #98: len 21 (0 Kb/s)
        Latency: 169 msec (70-172 msec ~168 msec)
> ACL Data RX: Handle 2001 flags 0x02 dlen 21              #100 [hci1] 9.087406
      SMP: Pairing Random (0x04) len 16
        Random value: a38bd1475aa68e030000000000000000
< HCI Command: Host Number of Comp.. (0x03|0x0035) plen 5  #101 [hci1] 9.097683
        Num handles: 1
        Handle: 2001 Address: DF:A9:FF:F6:B1:1A (OUI DF-A9-FF)
        Count: 1
< ACL Data TX: Handle 2001 flags 0x00 dlen 21              #102 [hci1] 9.097695
      SMP: Pairing Random (0x04) len 16
        Random value: 5c4a1bcadd27bd58e945097b00bad7ac
> HCI Event: Number of Completed Packets (0x13) plen 5     #103 [hci1] 9.261895
        Num handles: 1
        Handle: 2001 Address: DF:A9:FF:F6:B1:1A (OUI DF-A9-FF)
        Count: 1
        #102: len 21 (1 Kb/s)
        Latency: 164 msec (70-172 msec ~166 msec)
> ACL Data RX: Handle 2001 flags 0x02 dlen 21              #104 [hci1] 9.349621
      SMP: Pairing Confirm (0x03) len 16
        Confim value: 0a5a0e18dd8500e35db6aafcdae238cd
< HCI Command: Host Number of Comp.. (0x03|0x0035) plen 5  #105 [hci1] 9.357933
        Num handles: 1
        Handle: 2001 Address: DF:A9:FF:F6:B1:1A (OUI DF-A9-FF)
        Count: 1
< ACL Data TX: Handle 2001 flags 0x00 dlen 21              #106 [hci1] 9.358167
      SMP: Pairing Confirm (0x03) len 16
        Confim value: c052a007255fbaf24c3a11a3c067b150
> HCI Event: Number of Completed Packets (0x13) plen 5     #107 [hci1] 9.524636
        Num handles: 1
        Handle: 2001 Address: DF:A9:FF:F6:B1:1A (OUI DF-A9-FF)
        Count: 1
        #106: len 21 (1 Kb/s)
        Latency: 166 msec (70-172 msec ~166 msec)
> ACL Data RX: Handle 2001 flags 0x02 dlen 21              #108 [hci1] 9.524934
      SMP: Pairing Random (0x04) len 16
        Random value: 0b21fe2c697a256f0000000000000000
< HCI Command: Host Number of Comp.. (0x03|0x0035) plen 5  #109 [hci1] 9.537909
        Num handles: 1
        Handle: 2001 Address: DF:A9:FF:F6:B1:1A (OUI DF-A9-FF)
        Count: 1
< ACL Data TX: Handle 2001 flags 0x00 dlen 21              #110 [hci1] 9.537965
      SMP: Pairing Random (0x04) len 16
        Random value: 32527e6e64e79f33b2e374394db8ab2d
> HCI Event: Number of Completed Packets (0x13) plen 5     #111 [hci1] 9.699406
        Num handles: 1
        Handle: 2001 Address: DF:A9:FF:F6:B1:1A (OUI DF-A9-FF)
        Count: 1
        #110: len 21 (1 Kb/s)
        Latency: 161 msec (70-172 msec ~163 msec)
> ACL Data RX: Handle 2001 flags 0x02 dlen 21              #112 [hci1] 9.787281
      SMP: Pairing Confirm (0x03) len 16
        Confim value: 5b53ea041f2eca8cb6169b6ba16a0ccc
< HCI Command: Host Number of Comp.. (0x03|0x0035) plen 5  #113 [hci1] 9.797791
        Num handles: 1
        Handle: 2001 Address: DF:A9:FF:F6:B1:1A (OUI DF-A9-FF)
        Count: 1
< ACL Data TX: Handle 2001 flags 0x00 dlen 21              #114 [hci1] 9.797984
      SMP: Pairing Confirm (0x03) len 16
        Confim value: 72a6566267858182677dc2e0368c38c3
> HCI Event: Number of Completed Packets (0x13) plen 5     #115 [hci1] 9.962091
        Num handles: 1
        Handle: 2001 Address: DF:A9:FF:F6:B1:1A (OUI DF-A9-FF)
        Count: 1
        #114: len 21 (1 Kb/s)
        Latency: 164 msec (70-172 msec ~163 msec)
> ACL Data RX: Handle 2001 flags 0x02 dlen 21              #116 [hci1] 9.962338
      SMP: Pairing Random (0x04) len 16
        Random value: b120d2ac389ae5280000000000000000
< HCI Command: Host Number of Comp.. (0x03|0x0035) plen 5  #117 [hci1] 9.978047
        Num handles: 1
        Handle: 2001 Address: DF:A9:FF:F6:B1:1A (OUI DF-A9-FF)
        Count: 1
< ACL Data TX: Handle 2001 flags 0x00 dlen 21              #118 [hci1] 9.978123
      SMP: Pairing Random (0x04) len 16
        Random value: dddbdfe2838e9a8cc6964353c850fef7
> HCI Event: Number of Completed Packets (0x13) plen 5    #119 [hci1] 10.136821
        Num handles: 1
        Handle: 2001 Address: DF:A9:FF:F6:B1:1A (OUI DF-A9-FF)
        Count: 1
        #118: len 21 (1 Kb/s)
        Latency: 158 msec (70-172 msec ~161 msec)
> ACL Data RX: Handle 2001 flags 0x02 dlen 21             #120 [hci1] 10.224693
      SMP: Pairing Confirm (0x03) len 16
        Confim value: d0321ec1a9b8c0afec27bcabe2f30a6a
< HCI Command: Host Number of Com.. (0x03|0x0035) plen 5  #121 [hci1] 10.238000
        Num handles: 1
        Handle: 2001 Address: DF:A9:FF:F6:B1:1A (OUI DF-A9-FF)
        Count: 1
< ACL Data TX: Handle 2001 flags 0x00 dlen 21             #122 [hci1] 10.238247
      SMP: Pairing Confirm (0x03) len 16
        Confim value: 787798f90e908ffd38d85fff2ea2371e
> HCI Event: Number of Completed Packets (0x13) plen 5    #123 [hci1] 10.399557
        Num handles: 1
        Handle: 2001 Address: DF:A9:FF:F6:B1:1A (OUI DF-A9-FF)
        Count: 1
        #122: len 21 (1 Kb/s)
        Latency: 161 msec (70-172 msec ~161 msec)
> ACL Data RX: Handle 2001 flags 0x02 dlen 21             #124 [hci1] 10.399871
      SMP: Pairing Random (0x04) len 16
        Random value: 935b24a8f5c3eb920000000000000000
< HCI Command: Host Number of Com.. (0x03|0x0035) plen 5  #125 [hci1] 10.418006
        Num handles: 1
        Handle: 2001 Address: DF:A9:FF:F6:B1:1A (OUI DF-A9-FF)
        Count: 1
< ACL Data TX: Handle 2001 flags 0x00 dlen 21             #126 [hci1] 10.418114
      SMP: Pairing Random (0x04) len 16
        Random value: eb9f1915536596b6fc3db1c86b2b1970
> HCI Event: Number of Completed Packets (0x13) plen 5    #127 [hci1] 10.574248
        Num handles: 1
        Handle: 2001 Address: DF:A9:FF:F6:B1:1A (OUI DF-A9-FF)
        Count: 1
        #126: len 21 (1 Kb/s)
        Latency: 156 msec (70-172 msec ~158 msec)
> ACL Data RX: Handle 2001 flags 0x02 dlen 21             #128 [hci1] 10.662190
      SMP: Pairing Confirm (0x03) len 16
        Confim value: 0805b300c83a4127ee59f0f72e09e048
< HCI Command: Host Number of Com.. (0x03|0x0035) plen 5  #129 [hci1] 10.677569
        Num handles: 1
        Handle: 2001 Address: DF:A9:FF:F6:B1:1A (OUI DF-A9-FF)
        Count: 1
< ACL Data TX: Handle 2001 flags 0x00 dlen 21             #130 [hci1] 10.677694
      SMP: Pairing Confirm (0x03) len 16
        Confim value: 0d22dbf312b312d6318ab68fbc321d5b
> HCI Event: Number of Completed Packets (0x13) plen 5    #131 [hci1] 10.837008
        Num handles: 1
        Handle: 2001 Address: DF:A9:FF:F6:B1:1A (OUI DF-A9-FF)
        Count: 1
        #130: len 21 (1 Kb/s)
        Latency: 159 msec (70-172 msec ~159 msec)
> ACL Data RX: Handle 2001 flags 0x02 dlen 21             #132 [hci1] 10.837279
      SMP: Pairing Random (0x04) len 16
        Random value: 62a516f68373f8de0000000000000000
< HCI Command: Host Number of Com.. (0x03|0x0035) plen 5  #133 [hci1] 10.837901
        Num handles: 1
        Handle: 2001 Address: DF:A9:FF:F6:B1:1A (OUI DF-A9-FF)
        Count: 1
< ACL Data TX: Handle 2001 flags 0x00 dlen 21             #134 [hci1] 10.837988
      SMP: Pairing Random (0x04) len 16
        Random value: 5c794dc9ad9f2c3f295ebd5ad5e1c3cf
> HCI Event: Number of Completed Packets (0x13) plen 5    #135 [hci1] 11.011793
        Num handles: 1
        Handle: 2001 Address: DF:A9:FF:F6:B1:1A (OUI DF-A9-FF)
        Count: 1
        #134: len 21 (0 Kb/s)
        Latency: 173 msec (70-173 msec ~166 msec)
> ACL Data RX: Handle 2001 flags 0x02 dlen 21             #136 [hci1] 11.099595
      SMP: Pairing Confirm (0x03) len 16
        Confim value: 613cd91839b40f47bbeb58b163210799
< HCI Command: Host Number of Com.. (0x03|0x0035) plen 5  #137 [hci1] 11.117460
        Num handles: 1
        Handle: 2001 Address: DF:A9:FF:F6:B1:1A (OUI DF-A9-FF)
        Count: 1
< ACL Data TX: Handle 2001 flags 0x00 dlen 21             #138 [hci1] 11.117548
      SMP: Pairing Confirm (0x03) len 16
        Confim value: 64461763db8186ac8aba0bd5bf08c0eb
> HCI Event: Number of Completed Packets (0x13) plen 5    #139 [hci1] 11.274511
        Num handles: 1
        Handle: 2001 Address: DF:A9:FF:F6:B1:1A (OUI DF-A9-FF)
        Count: 1
        #138: len 21 (1 Kb/s)
        Latency: 156 msec (70-173 msec ~161 msec)
> ACL Data RX: Handle 2001 flags 0x02 dlen 21             #140 [hci1] 11.274767
      SMP: Pairing Random (0x04) len 16
        Random value: 8069dca45e8a414e0000000000000000
< HCI Command: Host Number of Com.. (0x03|0x0035) plen 5  #141 [hci1] 11.278023
        Num handles: 1
        Handle: 2001 Address: DF:A9:FF:F6:B1:1A (OUI DF-A9-FF)
        Count: 1
< ACL Data TX: Handle 2001 flags 0x00 dlen 21             #142 [hci1] 11.278122
      SMP: Pairing Random (0x04) len 16
        Random value: 5c2fff312cdf99c9491988e877355a9a
> HCI Event: Number of Completed Packets (0x13) plen 5    #143 [hci1] 11.449264
        Num handles: 1
        Handle: 2001 Address: DF:A9:FF:F6:B1:1A (OUI DF-A9-FF)
        Count: 1
        #142: len 21 (0 Kb/s)
        Latency: 171 msec (70-173 msec ~166 msec)
> ACL Data RX: Handle 2001 flags 0x02 dlen 21             #144 [hci1] 11.537262
      SMP: Pairing Confirm (0x03) len 16
        Confim value: 65178172f7bc11a4d5c9d589aa97dba9
< HCI Command: Host Number of Com.. (0x03|0x0035) plen 5  #145 [hci1] 11.537668
        Num handles: 1
        Handle: 2001 Address: DF:A9:FF:F6:B1:1A (OUI DF-A9-FF)
        Count: 1
< ACL Data TX: Handle 2001 flags 0x00 dlen 21             #146 [hci1] 11.537802
      SMP: Pairing Confirm (0x03) len 16
        Confim value: 9e33af5f343b5fa2f79f1ddfe9e2b1c6
> HCI Event: Number of Completed Packets (0x13) plen 5    #147 [hci1] 11.711965
        Num handles: 1
        Handle: 2001 Address: DF:A9:FF:F6:B1:1A (OUI DF-A9-FF)
        Count: 1
        #146: len 21 (0 Kb/s)
        Latency: 174 msec (70-174 msec ~170 msec)
> ACL Data RX: Handle 2001 flags 0x02 dlen 21             #148 [hci1] 11.712240
      SMP: Pairing Random (0x04) len 16
        Random value: 487c19f552e08e210000000000000000
< HCI Command: Host Number of Com.. (0x03|0x0035) plen 5  #149 [hci1] 11.717664
        Num handles: 1
        Handle: 2001 Address: DF:A9:FF:F6:B1:1A (OUI DF-A9-FF)
        Count: 1
< ACL Data TX: Handle 2001 flags 0x00 dlen 21             #150 [hci1] 11.717693
      SMP: Pairing Random (0x04) len 16
        Random value: c629a3a987d808e808655d558dfc1155
> HCI Event: Number of Completed Packets (0x13) plen 5    #151 [hci1] 11.886798
        Num handles: 1
        Handle: 2001 Address: DF:A9:FF:F6:B1:1A (OUI DF-A9-FF)
        Count: 1
        #150: len 21 (0 Kb/s)
        Latency: 169 msec (70-174 msec ~169 msec)
> ACL Data RX: Handle 2001 flags 0x02 dlen 21             #152 [hci1] 11.974559
      SMP: Pairing Confirm (0x03) len 16
        Confim value: dfb28df1d0b98e3ebe7445240a5464cb
< HCI Command: Host Number of Com.. (0x03|0x0035) plen 5  #153 [hci1] 11.977481
        Num handles: 1
        Handle: 2001 Address: DF:A9:FF:F6:B1:1A (OUI DF-A9-FF)
        Count: 1
< ACL Data TX: Handle 2001 flags 0x00 dlen 21             #154 [hci1] 11.977549
      SMP: Pairing Confirm (0x03) len 16
        Confim value: d9b3a07332c078ec23ad1ef6df9eee41
> HCI Event: Number of Completed Packets (0x13) plen 5    #155 [hci1] 12.149501
        Num handles: 1
        Handle: 2001 Address: DF:A9:FF:F6:B1:1A (OUI DF-A9-FF)
        Count: 1
        #154: len 21 (0 Kb/s)
        Latency: 171 msec (70-174 msec ~170 msec)
> ACL Data RX: Handle 2001 flags 0x02 dlen 21             #156 [hci1] 12.149770
      SMP: Pairing Random (0x04) len 16
        Random value: 57fd373dd78a92400000000000000000
< HCI Command: Host Number of Com.. (0x03|0x0035) plen 5  #157 [hci1] 12.157579
        Num handles: 1
        Handle: 2001 Address: DF:A9:FF:F6:B1:1A (OUI DF-A9-FF)
        Count: 1
< ACL Data TX: Handle 2001 flags 0x00 dlen 21             #158 [hci1] 12.157588
      SMP: Pairing Random (0x04) len 16
        Random value: 92f20f6ad8f13724432c7fd6001c45ff
> HCI Event: Number of Completed Packets (0x13) plen 5    #159 [hci1] 12.324254
        Num handles: 1
        Handle: 2001 Address: DF:A9:FF:F6:B1:1A (OUI DF-A9-FF)
        Count: 1
        #158: len 21 (1 Kb/s)
        Latency: 166 msec (70-174 msec ~168 msec)
> ACL Data RX: Handle 2001 flags 0x02 dlen 21             #160 [hci1] 12.412059
      SMP: Pairing Confirm (0x03) len 16
        Confim value: a6c756f239847330e95f74fbf0d478ae
< HCI Command: Host Number of Com.. (0x03|0x0035) plen 5  #161 [hci1] 12.417906
        Num handles: 1
        Handle: 2001 Address: DF:A9:FF:F6:B1:1A (OUI DF-A9-FF)
        Count: 1
< ACL Data TX: Handle 2001 flags 0x00 dlen 21             #162 [hci1] 12.418129
      SMP: Pairing Confirm (0x03) len 16
        Confim value: 22b9e8eb1e2fa4a6eb9b77be619bba61
> HCI Event: Number of Completed Packets (0x13) plen 5    #163 [hci1] 12.586940
        Num handles: 1
        Handle: 2001 Address: DF:A9:FF:F6:B1:1A (OUI DF-A9-FF)
        Count: 1
        #162: len 21 (1 Kb/s)
        Latency: 168 msec (70-174 msec ~168 msec)
> ACL Data RX: Handle 2001 flags 0x02 dlen 21             #164 [hci1] 12.587310
      SMP: Pairing Random (0x04) len 16
        Random value: bc47ce79215eea540000000000000000
< HCI Command: Host Number of Com.. (0x03|0x0035) plen 5  #165 [hci1] 12.597722
        Num handles: 1
        Handle: 2001 Address: DF:A9:FF:F6:B1:1A (OUI DF-A9-FF)
        Count: 1
< ACL Data TX: Handle 2001 flags 0x00 dlen 21             #166 [hci1] 12.597811
      SMP: Pairing Random (0x04) len 16
        Random value: 23ac32ebbb5e14c8a6b9622f296d277f
> HCI Event: Number of Completed Packets (0x13) plen 5    #167 [hci1] 12.761771
        Num handles: 1
        Handle: 2001 Address: DF:A9:FF:F6:B1:1A (OUI DF-A9-FF)
        Count: 1
        #166: len 21 (1 Kb/s)
        Latency: 163 msec (70-174 msec ~166 msec)
> ACL Data RX: Handle 2001 flags 0x02 dlen 21             #168 [hci1] 12.849600
      SMP: Pairing Confirm (0x03) len 16
        Confim value: 335577c109a67c47f44ebd5763796f73
< HCI Command: Host Number of Com.. (0x03|0x0035) plen 5  #169 [hci1] 12.857890
        Num handles: 1
        Handle: 2001 Address: DF:A9:FF:F6:B1:1A (OUI DF-A9-FF)
        Count: 1
< ACL Data TX: Handle 2001 flags 0x00 dlen 21             #170 [hci1] 12.858102
      SMP: Pairing Confirm (0x03) len 16
        Confim value: e0c8621b6088f9e62f77a15134ff6ce0
> HCI Event: Number of Completed Packets (0x13) plen 5    #171 [hci1] 13.024524
        Num handles: 1
        Handle: 2001 Address: DF:A9:FF:F6:B1:1A (OUI DF-A9-FF)
        Count: 1
        #170: len 21 (1 Kb/s)
        Latency: 166 msec (70-174 msec ~166 msec)
> ACL Data RX: Handle 2001 flags 0x02 dlen 21             #172 [hci1] 13.024727
      SMP: Pairing Random (0x04) len 16
        Random value: 9fe77fba6eb9d0a20000000000000000
< HCI Command: Host Number of Com.. (0x03|0x0035) plen 5  #173 [hci1] 13.038070
        Num handles: 1
        Handle: 2001 Address: DF:A9:FF:F6:B1:1A (OUI DF-A9-FF)
        Count: 1
< ACL Data TX: Handle 2001 flags 0x00 dlen 21             #174 [hci1] 13.038159
      SMP: Pairing Random (0x04) len 16
        Random value: 297efe85e67448a15f56bd27e3a3cf1d
> HCI Event: Number of Completed Packets (0x13) plen 5    #175 [hci1] 13.199244
        Num handles: 1
        Handle: 2001 Address: DF:A9:FF:F6:B1:1A (OUI DF-A9-FF)
        Count: 1
        #174: len 21 (1 Kb/s)
        Latency: 161 msec (70-174 msec ~163 msec)
> ACL Data RX: Handle 2001 flags 0x02 dlen 21             #176 [hci1] 13.287031
      SMP: Pairing Confirm (0x03) len 16
        Confim value: e8b92dbb42d9b23b3f858697aea91361
< HCI Command: Host Number of Com.. (0x03|0x0035) plen 5  #177 [hci1] 13.297602
        Num handles: 1
        Handle: 2001 Address: DF:A9:FF:F6:B1:1A (OUI DF-A9-FF)
        Count: 1
< ACL Data TX: Handle 2001 flags 0x00 dlen 21             #178 [hci1] 13.297725
      SMP: Pairing Confirm (0x03) len 16
        Confim value: 96029aa7d8544207353735febd313c02
> HCI Event: Number of Completed Packets (0x13) plen 5    #179 [hci1] 13.461876
        Num handles: 1
        Handle: 2001 Address: DF:A9:FF:F6:B1:1A (OUI DF-A9-FF)
        Count: 1
        #178: len 21 (1 Kb/s)
        Latency: 164 msec (70-174 msec ~163 msec)
> ACL Data RX: Handle 2001 flags 0x02 dlen 21             #180 [hci1] 13.462299
      SMP: Pairing Random (0x04) len 16
        Random value: e72c38bd7693e3fb0000000000000000
< HCI Command: Host Number of Com.. (0x03|0x0035) plen 5  #181 [hci1] 13.477998
        Num handles: 1
        Handle: 2001 Address: DF:A9:FF:F6:B1:1A (OUI DF-A9-FF)
        Count: 1
< ACL Data TX: Handle 2001 flags 0x00 dlen 21             #182 [hci1] 13.478086
      SMP: Pairing Random (0x04) len 16
        Random value: 25a9493fd3ce4faf02be7293595bb7c6
> HCI Event: Number of Completed Packets (0x13) plen 5    #183 [hci1] 13.636634
        Num handles: 1
        Handle: 2001 Address: DF:A9:FF:F6:B1:1A (OUI DF-A9-FF)
        Count: 1
        #182: len 21 (1 Kb/s)
        Latency: 158 msec (70-174 msec ~161 msec)
> ACL Data RX: Handle 2001 flags 0x02 dlen 21             #184 [hci1] 13.724544
      SMP: Pairing Confirm (0x03) len 16
        Confim value: 97ed7f5e17dd1e8748ace9335064ae44
< HCI Command: Host Number of Com.. (0x03|0x0035) plen 5  #185 [hci1] 13.737592
        Num handles: 1
        Handle: 2001 Address: DF:A9:FF:F6:B1:1A (OUI DF-A9-FF)
        Count: 1
< ACL Data TX: Handle 2001 flags 0x00 dlen 21             #186 [hci1] 13.737717
      SMP: Pairing Confirm (0x03) len 16
        Confim value: f62f0f4cfee4de6720a10550c76d8ba5
> HCI Event: Number of Completed Packets (0x13) plen 5    #187 [hci1] 13.899413
        Num handles: 1
        Handle: 2001 Address: DF:A9:FF:F6:B1:1A (OUI DF-A9-FF)
        Count: 1
        #186: len 21 (1 Kb/s)
        Latency: 161 msec (70-174 msec ~161 msec)
> ACL Data RX: Handle 2001 flags 0x02 dlen 21             #188 [hci1] 13.899708
      SMP: Pairing Random (0x04) len 16
        Random value: a9f11c6f97d0c7a60000000000000000
< HCI Command: Host Number of Com.. (0x03|0x0035) plen 5  #189 [hci1] 13.918065
        Num handles: 1
        Handle: 2001 Address: DF:A9:FF:F6:B1:1A (OUI DF-A9-FF)
        Count: 1
< ACL Data TX: Handle 2001 flags 0x00 dlen 21             #190 [hci1] 13.918140
      SMP: Pairing Random (0x04) len 16
        Random value: 58f6b41f855a6f6c3560debd84e2affc
> HCI Event: Number of Completed Packets (0x13) plen 5    #191 [hci1] 14.074290
        Num handles: 1
        Handle: 2001 Address: DF:A9:FF:F6:B1:1A (OUI DF-A9-FF)
        Count: 1
        #190: len 21 (1 Kb/s)
        Latency: 156 msec (70-174 msec ~158 msec)
> ACL Data RX: Handle 2001 flags 0x02 dlen 21             #192 [hci1] 14.161972
      SMP: Pairing Confirm (0x03) len 16
        Confim value: 9513cf3cc9967c8b7f9df5492f9553b4
< HCI Command: Host Number of Com.. (0x03|0x0035) plen 5  #193 [hci1] 14.177698
        Num handles: 1
        Handle: 2001 Address: DF:A9:FF:F6:B1:1A (OUI DF-A9-FF)
        Count: 1
< ACL Data TX: Handle 2001 flags 0x00 dlen 21             #194 [hci1] 14.177844
      SMP: Pairing Confirm (0x03) len 16
        Confim value: 4243337cd20b45533871f5b7b9eb66d8
> HCI Event: Number of Completed Packets (0x13) plen 5    #195 [hci1] 14.336943
        Num handles: 1
        Handle: 2001 Address: DF:A9:FF:F6:B1:1A (OUI DF-A9-FF)
        Count: 1
        #194: len 21 (1 Kb/s)
        Latency: 159 msec (70-174 msec ~158 msec)
> ACL Data RX: Handle 2001 flags 0x02 dlen 21             #196 [hci1] 14.337289
      SMP: Pairing Random (0x04) len 16
        Random value: cb2875eea94f621f0000000000000000
< HCI Command: Host Number of Com.. (0x03|0x0035) plen 5  #197 [hci1] 14.337861
        Num handles: 1
        Handle: 2001 Address: DF:A9:FF:F6:B1:1A (OUI DF-A9-FF)
        Count: 1
< ACL Data TX: Handle 2001 flags 0x00 dlen 21             #198 [hci1] 14.337976
      SMP: Pairing Random (0x04) len 16
        Random value: b67e7216d5bf664139eda2b542549666
> HCI Event: Number of Completed Packets (0x13) plen 5    #199 [hci1] 14.511677
        Num handles: 1
        Handle: 2001 Address: DF:A9:FF:F6:B1:1A (OUI DF-A9-FF)
        Count: 1
        #198: len 21 (0 Kb/s)
        Latency: 173 msec (70-174 msec ~166 msec)
> ACL Data RX: Handle 2001 flags 0x02 dlen 21             #200 [hci1] 14.599529
      SMP: Pairing Confirm (0x03) len 16
        Confim value: feed494305158a4763b96bba07fcc883
< HCI Command: Host Number of Com.. (0x03|0x0035) plen 5  #201 [hci1] 14.617738
        Num handles: 1
        Handle: 2001 Address: DF:A9:FF:F6:B1:1A (OUI DF-A9-FF)
        Count: 1
< ACL Data TX: Handle 2001 flags 0x00 dlen 21             #202 [hci1] 14.617776
      SMP: Pairing Confirm (0x03) len 16
        Confim value: 2a1e2d31d34a6ce5fc3e51e41b4cfef4
> HCI Event: Number of Completed Packets (0x13) plen 5    #203 [hci1] 14.774399
        Num handles: 1
        Handle: 2001 Address: DF:A9:FF:F6:B1:1A (OUI DF-A9-FF)
        Count: 1
        #202: len 21 (1 Kb/s)
        Latency: 156 msec (70-174 msec ~161 msec)
> ACL Data RX: Handle 2001 flags 0x02 dlen 21             #204 [hci1] 14.774659
      SMP: Pairing Random (0x04) len 16
        Random value: 5d0b2190087b6b640000000000000000
< HCI Command: Host Number of Com.. (0x03|0x0035) plen 5  #205 [hci1] 14.777609
        Num handles: 1
        Handle: 2001 Address: DF:A9:FF:F6:B1:1A (OUI DF-A9-FF)
        Count: 1
< ACL Data TX: Handle 2001 flags 0x00 dlen 21             #206 [hci1] 14.777618
      SMP: Pairing Random (0x04) len 16
        Random value: ed17f76500c95219dd01e09d1e63f87b
> HCI Event: Number of Completed Packets (0x13) plen 5    #207 [hci1] 14.949139
        Num handles: 1
        Handle: 2001 Address: DF:A9:FF:F6:B1:1A (OUI DF-A9-FF)
        Count: 1
        #206: len 21 (0 Kb/s)
        Latency: 171 msec (70-174 msec ~166 msec)
> ACL Data RX: Handle 2001 flags 0x02 dlen 21             #208 [hci1] 15.037020
      SMP: Pairing Confirm (0x03) len 16
        Confim value: 0d5b608a535da8929ca3fbe2d146c811
< HCI Command: Host Number of Com.. (0x03|0x0035) plen 5  #209 [hci1] 15.037489
        Num handles: 1
        Handle: 2001 Address: DF:A9:FF:F6:B1:1A (OUI DF-A9-FF)
        Count: 1
< ACL Data TX: Handle 2001 flags 0x00 dlen 21             #210 [hci1] 15.037595
      SMP: Pairing Confirm (0x03) len 16
        Confim value: cf66078b8a0586beb21fb8a4249ad264
> HCI Event: Number of Completed Packets (0x13) plen 5    #211 [hci1] 15.211907
        Num handles: 1
        Handle: 2001 Address: DF:A9:FF:F6:B1:1A (OUI DF-A9-FF)
        Count: 1
        #210: len 21 (0 Kb/s)
        Latency: 174 msec (70-174 msec ~170 msec)
> ACL Data RX: Handle 2001 flags 0x02 dlen 21             #212 [hci1] 15.212225
      SMP: Pairing Random (0x04) len 16
        Random value: d854e11d48bf55260000000000000000
< HCI Command: Host Number of Com.. (0x03|0x0035) plen 5  #213 [hci1] 15.217714
        Num handles: 1
        Handle: 2001 Address: DF:A9:FF:F6:B1:1A (OUI DF-A9-FF)
        Count: 1
< ACL Data TX: Handle 2001 flags 0x00 dlen 21             #214 [hci1] 15.217805
      SMP: Pairing Random (0x04) len 16
        Random value: 81d35d47e1f6006d79c974bd9d9e1ee3
> HCI Event: Number of Completed Packets (0x13) plen 5    #215 [hci1] 15.386598
        Num handles: 1
        Handle: 2001 Address: DF:A9:FF:F6:B1:1A (OUI DF-A9-FF)
        Count: 1
        #214: len 21 (1 Kb/s)
        Latency: 168 msec (70-174 msec ~169 msec)
> ACL Data RX: Handle 2001 flags 0x02 dlen 21             #216 [hci1] 15.474550
      SMP: Pairing Confirm (0x03) len 16
        Confim value: 055d8cd03276669ceb292b4967414171
< HCI Command: Host Number of Com.. (0x03|0x0035) plen 5  #217 [hci1] 15.477582
        Num handles: 1
        Handle: 2001 Address: DF:A9:FF:F6:B1:1A (OUI DF-A9-FF)
        Count: 1
< ACL Data TX: Handle 2001 flags 0x00 dlen 21             #218 [hci1] 15.477670
      SMP: Pairing Confirm (0x03) len 16
        Confim value: 8625198e4bacf16fa1777cfbd4f3e94f
> HCI Event: Number of Completed Packets (0x13) plen 5    #219 [hci1] 15.649353
        Num handles: 1
        Handle: 2001 Address: DF:A9:FF:F6:B1:1A (OUI DF-A9-FF)
        Count: 1
        #218: len 21 (0 Kb/s)
        Latency: 171 msec (70-174 msec ~170 msec)
> ACL Data RX: Handle 2001 flags 0x02 dlen 21             #220 [hci1] 15.649737
      SMP: Pairing Random (0x04) len 16
        Random value: a1176b4982957e8d0000000000000000
< HCI Command: Host Number of Com.. (0x03|0x0035) plen 5  #221 [hci1] 15.657767
        Num handles: 1
        Handle: 2001 Address: DF:A9:FF:F6:B1:1A (OUI DF-A9-FF)
        Count: 1
< ACL Data TX: Handle 2001 flags 0x00 dlen 21             #222 [hci1] 15.657800
      SMP: Pairing Random (0x04) len 16
        Random value: e7f7e0c2476823e41736a7e381bafb7c
> HCI Event: Number of Completed Packets (0x13) plen 5    #223 [hci1] 15.824147
        Num handles: 1
        Handle: 2001 Address: DF:A9:FF:F6:B1:1A (OUI DF-A9-FF)
        Count: 1
        #222: len 21 (1 Kb/s)
        Latency: 166 msec (70-174 msec ~168 msec)
> ACL Data RX: Handle 2001 flags 0x02 dlen 21             #224 [hci1] 15.911979
      SMP: Pairing Confirm (0x03) len 16
        Confim value: e15329d30c81d37110cbfaceb536de62
< HCI Command: Host Number of Com.. (0x03|0x0035) plen 5  #225 [hci1] 15.918009
        Num handles: 1
        Handle: 2001 Address: DF:A9:FF:F6:B1:1A (OUI DF-A9-FF)
        Count: 1
< ACL Data TX: Handle 2001 flags 0x00 dlen 21             #226 [hci1] 15.918191
      SMP: Pairing Confirm (0x03) len 16
        Confim value: 04f675d0f4b065bd9ee294e81dd5d987
> HCI Event: Number of Completed Packets (0x13) plen 5    #227 [hci1] 16.086834
        Num handles: 1
        Handle: 2001 Address: DF:A9:FF:F6:B1:1A (OUI DF-A9-FF)
        Count: 1
        #226: len 21 (1 Kb/s)
        Latency: 168 msec (70-174 msec ~168 msec)
> ACL Data RX: Handle 2001 flags 0x02 dlen 21             #228 [hci1] 16.087206
      SMP: Pairing Random (0x04) len 16
        Random value: 8c619e88baaff69d0000000000000000
