Bluetooth monitor ver 5.84
btmon[401293]: = Note: Linux version 6.8.0-83-generic (x86_64)                                                           0.686674
btmon[401293]: = Note: Bluetooth subsystem version 2.22                                                                  0.686677
= New Index: 00:00:00:00:00:00 (Primary,UART,hci0)                                                                       0.686678
= Open Index: 00:00:00:00:00:00                                                                                          0.694416
= Index Info: 00:00:00:00:00:00 (Nordic Semiconductor ASA)                                                               0.694420
zephyr.exe[401295]: @ USER Open: main (privileged) version 2.22                                                 {0x0001} 0.694422
zephyr.exe[401295]: < HCI Command: Reset (0x03|0x0003) plen 0                                                         #1 0.694676
> HCI Event: Command Complete (0x0e) plen 4                                                                           #2 0.695686
      Reset (0x03|0x0003) ncmd 1
        Status: Success (0x00)
zephyr.exe[401295]: < HCI Command: Read Local Supported Features (0x04|0x0003) plen 0                                 #3 0.714337
> HCI Event: Command Complete (0x0e) plen 12                                                                          #4 0.715081
      Read Local Supported Features (0x04|0x0003) ncmd 1
        Status: Success (0x00)
        Features: 0x00 0x00 0x00 0x00 0x60 0x00 0x00 0x00
          BR/EDR Not Supported
          LE Supported (Controller)
zephyr.exe[401295]: < HCI Command: Read Local Version Information (0x04|0x0001) plen 0                                #5 0.734304
> HCI Event: Command Complete (0x0e) plen 12                                                                          #6 0.734957
      Read Local Version Information (0x04|0x0001) ncmd 1
        Status: Success (0x00)
        HCI version: Reserved (0x0e) - Revision 12520 (0x30e8)
        LMP version: Reserved (0x0e) - Subversion 12520 (0x30e8)
        Manufacturer: Nordic Semiconductor ASA (89)
zephyr.exe[401295]: < HCI Command: Read Local Supported Commands (0x04|0x0002) plen 0                                 #7 0.754392
> HCI Event: Command Complete (0x0e) plen 68                                                                          #8 0.755662
      Read Local Supported Commands (0x04|0x0002) ncmd 1
        Status: Success (0x00)
        Commands: 119 entries
          Disconnect (Octet 0 - Bit 5)
          Read Remote Version Information (Octet 2 - Bit 7)
          Set Event Mask (Octet 5 - Bit 6)
          Reset (Octet 5 - Bit 7)
          Read Connection Accept Timeout (Octet 7 - Bit 2)
          Write Connection Accept Timeout (Octet 7 - Bit 3)
          Read Transmit Power Level (Octet 10 - Bit 2)
          Set Controller To Host Flow Control (Octet 10 - Bit 5)
          Host Buffer Size (Octet 10 - Bit 6)
          Host Number of Completed Packets (Octet 10 - Bit 7)
          Read Local Version Information (Octet 14 - Bit 3)
          Read Local Supported Features (Octet 14 - Bit 5)
          Read BD ADDR (Octet 15 - Bit 1)
          Read RSSI (Octet 15 - Bit 5)
          Set Event Mask Page 2 (Octet 22 - Bit 2)
          LE Set Event Mask (Octet 25 - Bit 0)
          LE Read Buffer Size (Octet 25 - Bit 1)
          LE Read Local Supported Features (Octet 25 - Bit 2)
          LE Set Random Address (Octet 25 - Bit 4)
          LE Set Advertising Parameters (Octet 25 - Bit 5)
          LE Read Advertising Channel TX Power (Octet 25 - Bit 6)
          LE Set Advertising Data (Octet 25 - Bit 7)
          LE Set Scan Response Data (Octet 26 - Bit 0)
          LE Set Advertise Enable (Octet 26 - Bit 1)
          LE Set Scan Parameters (Octet 26 - Bit 2)
          LE Set Scan Enable (Octet 26 - Bit 3)
          LE Create Connection (Octet 26 - Bit 4)
          LE Create Connection Cancel (Octet 26 - Bit 5)
          LE Read Accept List Size (Octet 26 - Bit 6)
          LE Clear Accept List (Octet 26 - Bit 7)
          LE Add Device To Accept List (Octet 27 - Bit 0)
          LE Remove Device From Accept List (Octet 27 - Bit 1)
          LE Connection Update (Octet 27 - Bit 2)
          LE Set Host Channel Classification (Octet 27 - Bit 3)
          LE Read Channel Map (Octet 27 - Bit 4)
          LE Read Remote Used Features (Octet 27 - Bit 5)
          LE Encrypt (Octet 27 - Bit 6)
          LE Rand (Octet 27 - Bit 7)
          LE Start Encryption (Octet 28 - Bit 0)
          LE Long Term Key Request Reply (Octet 28 - Bit 1)
          LE Long Term Key Request Neg Reply (Octet 28 - Bit 2)
          LE Read Supported States (Octet 28 - Bit 3)
          LE Receiver Test (Octet 28 - Bit 4)
          LE Transmitter Test (Octet 28 - Bit 5)
          LE Test End (Octet 28 - Bit 6)
          Read Authenticated Payload Timeout (Octet 32 - Bit 4)
          Write Authenticated Payload Timeout (Octet 32 - Bit 5)
          LE Set Data Length (Octet 33 - Bit 6)
          LE Read Suggested Default Data Length (Octet 33 - Bit 7)
          LE Write Suggested Default Data Length (Octet 34 - Bit 0)
          LE Add Device To Resolving List (Octet 34 - Bit 3)
          LE Remove Device From Resolving List (Octet 34 - Bit 4)
          LE Clear Resolving List (Octet 34 - Bit 5)
          LE Read Resolving List Size (Octet 34 - Bit 6)
          LE Set Address Resolution Enable (Octet 35 - Bit 1)
          LE Set Resolvable Private Address Timeout (Octet 35 - Bit 2)
          LE Read Maximum Data Length (Octet 35 - Bit 3)
          LE Read PHY (Octet 35 - Bit 4)
          LE Set Default PHY (Octet 35 - Bit 5)
          LE Set PHY (Octet 35 - Bit 6)
          LE Enhanced Receiver Test (Octet 35 - Bit 7)
          LE Enhanced Transmitter Test (Octet 36 - Bit 0)
          LE Set Advertising Set Random Address (Octet 36 - Bit 1)
          LE Set Extended Advertising Parameters (Octet 36 - Bit 2)
          LE Set Extended Advertising Data (Octet 36 - Bit 3)
          LE Set Extended Scan Response Data (Octet 36 - Bit 4)
          LE Set Extended Advertising Enable (Octet 36 - Bit 5)
          LE Read Maximum Advertising Data Length (Octet 36 - Bit 6)
          LE Read Number of Supported Advertising Sets (Octet 36 - Bit 7)
          LE Remove Advertising Set (Octet 37 - Bit 0)
          LE Clear Advertising Sets (Octet 37 - Bit 1)
          LE Set Periodic Advertising Parameters (Octet 37 - Bit 2)
          LE Set Periodic Advertising Data (Octet 37 - Bit 3)
          LE Set Periodic Advertising Enable (Octet 37 - Bit 4)
          LE Set Extended Scan Parameters (Octet 37 - Bit 5)
          LE Set Extended Scan Enable (Octet 37 - Bit 6)
          LE Extended Create Connection (Octet 37 - Bit 7)
          LE Periodic Advertising Create Sync (Octet 38 - Bit 0)
          LE Periodic Advertising Create Sync Cancel (Octet 38 - Bit 1)
          LE Periodic Advertising Terminate Sync (Octet 38 - Bit 2)
          LE Add Device To Periodic Advertiser List (Octet 38 - Bit 3)
          LE Remove Device From Periodic Advertiser List (Octet 38 - Bit 4)
          LE Clear Periodic Advertiser List (Octet 38 - Bit 5)
          LE Read Periodic Advertiser List Size (Octet 38 - Bit 6)
          LE Read Transmit Power (Octet 38 - Bit 7)
          LE Read RF Path Compensation (Octet 39 - Bit 0)
          LE Write RF Path Compensation (Octet 39 - Bit 1)
          LE Set Privacy Mode (Octet 39 - Bit 2)
          LE Periodic Advertising Receive Enable (Octet 40 - Bit 5)
          LE Periodic Advertising Sync Transfer (Octet 40 - Bit 6)
          LE Periodic Advertising Set Info Transfer (Octet 40 - Bit 7)
          LE Periodic Advertising Sync Transfer Parameters (Octet 41 - Bit 0)
          LE Set Default Periodic Advertisng Sync Transfer Parameters (Octet 41 - Bit 1)
          LE Read Buffer v2 (Octet 41 - Bit 5)
          LE Read ISO TX Sync (Octet 41 - Bit 6)
          LE Set Connected Isochronous Group Parameters (Octet 41 - Bit 7)
          LE Set Connected Isochronous Group Parameters Test (Octet 42 - Bit 0)
          LE Create Connected Isochronous Stream (Octet 42 - Bit 1)
          LE Remove Connected Isochronous Group (Octet 42 - Bit 2)
          LE Accept Connected Isochronous Stream Request (Octet 42 - Bit 3)
          LE Reject Connected Isochronous Stream Request (Octet 42 - Bit 4)
          LE Create Broadcast Isochronous Group (Octet 42 - Bit 5)
          LE Create Broadcast Isochronous Group Test (Octet 42 - Bit 6)
          LE Terminate Broadcast Isochronous Group (Octet 42 - Bit 7)
          LE Broadcast Isochronous Group Create Sync (Octet 43 - Bit 0)
          LE Broadcast Isochronous Group Terminate Sync (Octet 43 - Bit 1)
          LE Request Peer SCA (Octet 43 - Bit 2)
          LE Setup Isochronous Data Path (Octet 43 - Bit 3)
          LE Remove Isochronous Data Path (Octet 43 - Bit 4)
          LE Isochronous Transmit Test (Octet 43 - Bit 5)
          LE Isochronous Receive Test (Octet 43 - Bit 6)
          LE Isochronous Read Test Counters (Octet 43 - Bit 7)
          LE Isochronous Read Test Counters (Octet 44 - Bit 0)
          LE Set Host Feature (Octet 44 - Bit 1)
          LE Read ISO link quality (Octet 44 - Bit 2)
          Octet 45 - Bit 6 
          Octet 46 - Bit 0 
          Octet 46 - Bit 1 
          Octet 46 - Bit 2 
zephyr.exe[401295]: < HCI Command: Host Buffer Size (0x03|0x0033) plen 7                                              #9 0.774360
        ACL MTU: 255  ACL max packet: 16
        SCO MTU: 0    SCO max packet: 0
> HCI Event: Command Complete (0x0e) plen 4                                                                          #10 0.774939
      Host Buffer Size (0x03|0x0033) ncmd 1
        Status: Success (0x00)
zephyr.exe[401295]: < HCI Command: Set Controller To Host Flow Control (0x03|0x0031) plen 1                          #11 0.794316
        Flow control: ACL Data Packets (0x01)
> HCI Event: Command Complete (0x0e) plen 4                                                                          #12 0.794908
      Set Controller To Host Flow Control (0x03|0x0031) ncmd 1
        Status: Success (0x00)
zephyr.exe[401295]: < HCI Command: LE Read Local Supported Features (0x08|0x0003) plen 0                             #13 0.814292
> HCI Event: Command Complete (0x0e) plen 12                                                                         #14 0.814902
      LE Read Local Supported Features (0x08|0x0003) ncmd 1
        Status: Success (0x00)
        Features: 0xfd 0x79 0x00 0xf7 0x30 0x01 0x00 0x00
          LE Encryption
          Extended Reject Indication
          Peripheral-initiated Features Exchange
          LE Ping
          LE Data Packet Length Extension
          LL Privacy
          Extended Scanner Filter Policies
          LE 2M PHY
          LE Coded PHY
          LE Extended Advertising
          LE Periodic Advertising
          Channel Selection Algorithm #2
          Periodic Advertising Sync Transfer - Sender
          Periodic Advertising Sync Transfer - Recipient
          Sleep Clock Accuracy Updates
          Connected Isochronous Stream - Central
          Connected Isochronous Stream - Peripheral
          Isochronous Broadcaster
          Synchronized Receiver
          Periodic Advertising ADI support
          Connection Subrating
          Unknown features (0x0000010000000000)
zephyr.exe[401295]: < HCI Command: LE Set Host Feature (0x08|0x0074) plen 2                                          #15 0.834358
        Bit Number: 32
          Connected Isochronous Stream (Host Support)
        Bit Value: 1
> HCI Event: Command Complete (0x0e) plen 4                                                                          #16 0.835319
      LE Set Host Feature (0x08|0x0074) ncmd 1
        Status: Success (0x00)
zephyr.exe[401295]: < HCI Command: LE Read Buffer v2 (0x08|0x0060) plen 0                                            #17 0.854314
> HCI Event: Command Complete (0x0e) plen 10                                                                         #18 0.854879
      LE Read Buffer v2 (0x08|0x0060) ncmd 1
        Status: Success (0x00)
        ACL MTU: 27
        ACL max packet: 3
        ISO MTU: 318
        ISO max packet: 3
zephyr.exe[401295]: < HCI Command: LE Read Maximum Advertising Data Length (0x08|0x003a) plen 0                      #19 0.874343
> HCI Event: Command Complete (0x0e) plen 6                                                                          #20 0.875003
      LE Read Maximum Advertising Data Length (0x08|0x003a) ncmd 1
        Status: Success (0x00)
        Max length: 1650
zephyr.exe[401295]: < HCI Command: LE Read Supported States (0x08|0x001c) plen 0                                     #21 0.894325
> HCI Event: Command Complete (0x0e) plen 12                                                                         #22 0.894984
      LE Read Supported States (0x08|0x001c) ncmd 1
        Status: Success (0x00)
        States: 0x000003ff3e0306ff
          Non-connectable Advertising State
          Scannable Advertising State
          Connectable Advertising State
          High Duty Cycle Directed Advertising State
          Passive Scanning State
          Active Scanning State
          Initiating State
            and Connection State (Central Role)
          Connection State (Peripheral Role)
          Scannable Advertising State
            and Passive Scanning State
          Connectable Advertising State
            and Passive Scanning State
          Non-connectable Advertising State
            and Initiating State
          Scannable Advertising State
            and Initiating State
          Active Scanning State
            and Connection State (Central Role)
          Passive Scanning State
            and Connection State (Peripheral Role)
          Active Scanning State
            and Connection State (Peripheral Role)
          Initiating State
            and Connection State (Central Role)
            and Central Role & Central Role
          Low Duty Cycle Directed Advertising State
          Connectable Advertising State
            and Initiating State
            and Central Role & Peripheral Role
          High Duty Cycle Directed Advertising State
            and Initiating State
            and Central Role & Peripheral Role
          Low Duty Cycle Directed Advertising State
            and Initiating State
            and Central Role & Peripheral Role
          Connectable Advertising State
            and Connection State (Central Role)
            and Central Role & Peripheral Role
          High Duty Cycle Directed Advertising State
            and Connection State (Central Role)
            and Central Role & Peripheral Role
          Low Duty Cycle Directed Advertising State
            and Connection State (Central Role)
            and Central Role & Peripheral Role
          Connectable Advertising State
            and Connection State (Peripheral Role)
            and Central Role & Peripheral Role
          High Duty Cycle Directed Advertising State
            and Connection State (Peripheral Role)
            and Peripheral Role & Peripheral Role
          Low Duty Cycle Directed Advertising State
            and Connection State (Peripheral Role)
            and Peripheral Role & Peripheral Role
          Initiating State
            and Connection State (Peripheral Role)
            and Central Role & Peripheral Role
zephyr.exe[401295]: < HCI Command: LE Read Maximum Data Length (0x08|0x002f) plen 0                                  #23 0.914358
> HCI Event: Command Complete (0x0e) plen 12                                                                         #24 0.914908
      LE Read Maximum Data Length (0x08|0x002f) ncmd 1
        Status: Success (0x00)
        Max TX octets: 251
        Max TX time: 2704
        Max RX octets: 251
        Max RX time: 2704
zephyr.exe[401295]: < HCI Command: LE Write Suggested Default Data Length (0x08|0x0024) plen 4                       #25 0.934361
        TX octets: 251
        TX time: 2704
> HCI Event: Command Complete (0x0e) plen 4                                                                          #26 0.935498
      LE Write Suggested Default Data Length (0x08|0x0024) ncmd 1
        Status: Success (0x00)
zephyr.exe[401295]: < HCI Command: LE Read Resolving List Size (0x08|0x002a) plen 0                                  #27 0.954363
> HCI Event: Command Complete (0x0e) plen 5                                                                          #28 0.954988
      LE Read Resolving List Size (0x08|0x002a) ncmd 1
        Status: Success (0x00)
        Size: 8
zephyr.exe[401295]: < HCI Command: LE Set Event Mask (0x08|0x0001) plen 8                                            #29 0.974362
        Mask: 0x000002023f87fa5e
          LE Advertising Report
          LE Connection Update Complete
          LE Read Remote Used Features Complete
          LE Long Term Key Request
          LE Data Length Change
          LE Enhanced Connection Complete
          LE PHY Update Complete
          LE Extended Advertising Report
          LE Periodic Advertising Sync Established
          LE Periodic Advertising Report
          LE Periodic Advertising Sync Lost
          LE Extended Scan Timeout
          LE Extended Advertising Set Terminated
          LE Scan Request Received
          LE Periodic Advertising Sync Transfer Rvc
          LE CIS Established
          LE CIS Request
          LE Create BIG Complete
          LE Terminate BIG Complete
          LE BIG Sync Established Complete
          LE BIG Sync Lost
          LE BIG Info Advertising Report
          Unknown mask (0x0000020000000000)
> HCI Event: Command Complete (0x0e) plen 4                                                                          #30 0.975119
      LE Set Event Mask (0x08|0x0001) ncmd 1
        Status: Success (0x00)
zephyr.exe[401295]: < HCI Command: Set Event Mask (0x03|0x0001) plen 8                                               #31 0.994362
        Mask: 0x2000800002008890
          Disconnection Complete
          Encryption Change
          Read Remote Version Information Complete
          Hardware Error
          Data Buffer Overflow
          Encryption Key Refresh Complete
          LE Meta
> HCI Event: Command Complete (0x0e) plen 4                                                                          #32 0.995066
      Set Event Mask (0x03|0x0001) ncmd 1
        Status: Success (0x00)
zephyr.exe[401295]: < HCI Command: Read BD ADDR (0x04|0x0009) plen 0                                                 #33 1.014365
> HCI Event: Command Complete (0x0e) plen 10                                                                         #34 1.015062
      Read BD ADDR (0x04|0x0009) ncmd 1
        Status: Success (0x00)
        Address: 00:00:00:00:00:00 (OUI 00-00-00)
zephyr.exe[401295]: < HCI Command: LE Set Random Address (0x08|0x0005) plen 6                                        #35 1.034357
        Address: D5:B6:CC:31:DB:3B (Static)
> HCI Event: Command Complete (0x0e) plen 4                                                                          #36 1.035588
      LE Set Random Address (0x08|0x0005) ncmd 1
        Status: Success (0x00)
zephyr.exe[401295]: < HCI Command: LE Set Extended Advertising Parameters (0x08|0x0036) plen 25                      #37 1.684376
        Handle: 0x00
        Properties: 0x0001
          Connectable
        Min advertising interval: 100.000 msec (0x00a0)
        Max advertising interval: 150.000 msec (0x00f0)
        Channel map: 37, 38, 39 (0x07)
        Own address type: Random (0x01)
        Peer address type: Public (0x00)
        Peer address: 00:00:00:00:00:00 (OUI 00-00-00)
        Filter policy: Allow Scan Request from Any, Allow Connect Request from Any (0x00)
        TX power: Host has no preference (0x7f)
        Primary PHY: LE 1M (0x01)
        Secondary max skip: 0x00
        Secondary PHY: LE 2M (0x02)
        SID: 0x00
        Scan request notifications: Disabled (0x00)
> HCI Event: Command Complete (0x0e) plen 5                                                                          #38 1.685387
      LE Set Extended Advertising Parameters (0x08|0x0036) ncmd 1
        Status: Success (0x00)
        TX power (selected): 0 dbm (0x00)
zephyr.exe[401295]: < HCI Command: LE Set Advertising Set Random Address (0x08|0x0035) plen 7                        #39 1.694375
        Advertising handle: 0x00
        Advertising random address: D5:B6:CC:31:DB:3B (Static)
> HCI Event: Command Complete (0x0e) plen 4                                                                          #40 1.695007
      LE Set Advertising Set Random Address (0x08|0x0035) ncmd 1
        Status: Success (0x00)
zephyr.exe[401295]: < HCI Command: LE Set Extended Advertising Data (0x08|0x0037) plen 39                            #41 1.714379
        Handle: 0x00
        Operation: Complete extended advertising data (0x03)
        Fragment preference: Minimize fragmentation (0x01)
        Data length: 0x23
        Flags: 0x06
          LE General Discoverable Mode
          BR/EDR Not Supported
        Name (complete): Tester_F6B11A
        Flags: 0x06
          LE General Discoverable Mode
          BR/EDR Not Supported
        16-bit Service UUIDs (complete): 1 entry
          Audio Stream Control (0x184e)
        Service Data: Audio Stream Control (0x184e)
          Data[6]: 01ff0fff0f00
> HCI Event: Command Complete (0x0e) plen 4                                                                          #42 1.715627
      LE Set Extended Advertising Data (0x08|0x0037) ncmd 1
        Status: Success (0x00)
zephyr.exe[401295]: < HCI Command: LE Set Extended Advertising Enable (0x08|0x0039) plen 6                           #43 1.734376
        Extended advertising: Enabled (0x01)
        Number of sets: 1 (0x01)
        Entry 0
          Handle: 0x00
          Duration: 0 ms (0x00)
          Max ext adv events: 0
> HCI Event: Command Complete (0x0e) plen 4                                                                          #44 1.735226
      LE Set Extended Advertising Enable (0x08|0x0039) ncmd 1
        Status: Success (0x00)
> HCI Event: LE Meta Event (0x3e) plen 31                                                                            #45 3.312757
      LE Enhanced Connection Complete (0x0a)
        Status: Success (0x00)
        Handle: 147
        Role: Peripheral (0x01)
        Peer address type: Random (0x01)
        Peer address: C7:1B:DC:08:AA:BB (Static)
        Local resolvable private address: 00:00:00:00:00:00 (Non-Resolvable)
        Peer resolvable private address: 00:00:00:00:00:00 (Non-Resolvable)
        Connection interval: 60.00 msec (0x0030)
        Connection latency: 0 (0x0000)
        Supervision timeout: 25120 msec (0x09d0)
        Central clock accuracy: 0x01
> HCI Event: LE Meta Event (0x3e) plen 6                                                                             #46 3.312848
      LE Advertising Set Terminated (0x12)
        Status: Success (0x00)
        Handle: 0
        Connection handle: 147
        Number of completed extended advertising events: 0
zephyr.exe[401295]: < HCI Command: LE Read Remote Used Features (0x08|0x0016) plen 2                                 #47 3.314507
        Handle: 147 Address: C7:1B:DC:08:AA:BB (Static)
> HCI Event: Command Status (0x0f) plen 4                                                                            #48 3.315010
      LE Read Remote Used Features (0x08|0x0016) ncmd 1
        Status: Success (0x00)
zephyr.exe[401295]: < ACL Data TX: Handle 147 [1/3] flags 0x00 dlen 7                                                #49 3.334392
      ATT: Exchange MTU Request (0x02) len 2
        Client RX MTU: 251
> HCI Event: Number of Completed Packets (0x13) plen 5                                                               #50 3.434875
        Num handles: 1
        Handle: 147 Address: C7:1B:DC:08:AA:BB (Static)
        Count: 1
        Buffers: 0/3
        #49: len 7 (0 Kb/s)
        Latency: 100 msec (100-100 msec ~100 msec)
> HCI Event: LE Meta Event (0x3e) plen 12                                                                            #51 3.495200
      LE Read Remote Used Features (0x04)
        Status: Success (0x00)
        Handle: 147 Address: C7:1B:DC:08:AA:BB (Static)
        Features: 0x2d 0x49 0x00 0xf7 0x67 0xd8 0x00 0x00
          LE Encryption
          Extended Reject Indication
          Peripheral-initiated Features Exchange
          LE Data Packet Length Extension
          LE 2M PHY
          LE Coded PHY
          Channel Selection Algorithm #2
          Periodic Advertising Sync Transfer - Sender
          Periodic Advertising Sync Transfer - Recipient
          Sleep Clock Accuracy Updates
          Connected Isochronous Stream - Central
          Connected Isochronous Stream - Peripheral
          Isochronous Broadcaster
          Synchronized Receiver
          Connected Isochronous Stream (Host Support)
          LE Power Control Request
          LE Power Control Request
          Connection Subrating
          Connection Subrating (Host Support)
          Unknown features (0x0000d80000000000)
> ACL Data RX: Handle 147 flags 0x02 dlen 7                                                                          #52 3.794754
      ATT: Exchange MTU Request (0x02) len 2
        Client RX MTU: 64
> ACL Data RX: Handle 147 flags 0x02 dlen 7                                                                          #53 3.795260
      ATT: Exchange MTU Response (0x03) len 2
        Server RX MTU: 64
zephyr.exe[401295]: < HCI Command: Host Number of Completed Packets (0x03|0x0035) plen 5                             #54 3.814473
        Num handles: 1
        Handle: 147 Address: C7:1B:DC:08:AA:BB (Static)
        Count: 1
zephyr.exe[401295]: < ACL Data TX: Handle 147 [1/3] flags 0x00 dlen 7                                                #55 3.814500
      ATT: Exchange MTU Response (0x03) len 2
        Server RX MTU: 251
zephyr.exe[401295]: < HCI Command: Host Number of Completed Packets (0x03|0x0035) plen 5                             #56 3.814580
        Num handles: 1
        Handle: 147 Address: C7:1B:DC:08:AA:BB (Static)
        Count: 1
zephyr.exe[401295]: < HCI Command: LE Remove Advertising Set (0x08|0x003c) plen 1                                    #57 3.864410
        Handle: 0
> HCI Event: Command Complete (0x0e) plen 4                                                                          #58 3.865085
      LE Remove Advertising Set (0x08|0x003c) ncmd 1
        Status: Success (0x00)
zephyr.exe[401295]: < HCI Command: LE Set Extended Advertising Parameters (0x08|0x0036) plen 25                      #59 3.874414
        Handle: 0x00
        Properties: 0x0001
          Connectable
        Min advertising interval: 100.000 msec (0x00a0)
        Max advertising interval: 150.000 msec (0x00f0)
        Channel map: 37, 38, 39 (0x07)
        Own address type: Random (0x01)
        Peer address type: Public (0x00)
        Peer address: 00:00:00:00:00:00 (OUI 00-00-00)
        Filter policy: Allow Scan Request from Any, Allow Connect Request from Any (0x00)
        TX power: Host has no preference (0x7f)
        Primary PHY: LE 1M (0x01)
        Secondary max skip: 0x00
        Secondary PHY: LE 2M (0x02)
        SID: 0x01
        Scan request notifications: Disabled (0x00)
> HCI Event: Command Complete (0x0e) plen 5                                                                          #60 3.875792
      LE Set Extended Advertising Parameters (0x08|0x0036) ncmd 1
        Status: Success (0x00)
        TX power (selected): 0 dbm (0x00)
zephyr.exe[401295]: < HCI Command: LE Set Advertising Set Random Address (0x08|0x0035) plen 7                        #61 3.894381
        Advertising handle: 0x00
        Advertising random address: D5:B6:CC:31:DB:3B (Static)
> HCI Event: Command Complete (0x0e) plen 4                                                                          #62 3.895327
      LE Set Advertising Set Random Address (0x08|0x0035) ncmd 1
        Status: Success (0x00)
zephyr.exe[401295]: < HCI Command: LE Set Extended Advertising Data (0x08|0x0037) plen 39                            #63 3.914419
        Handle: 0x00
        Operation: Complete extended advertising data (0x03)
        Fragment preference: Minimize fragmentation (0x01)
        Data length: 0x23
        Flags: 0x06
          LE General Discoverable Mode
          BR/EDR Not Supported
        Name (complete): Tester_F6B11A
        Flags: 0x06
          LE General Discoverable Mode
          BR/EDR Not Supported
        16-bit Service UUIDs (complete): 1 entry
          Audio Stream Control (0x184e)
        Service Data: Audio Stream Control (0x184e)
          Data[6]: 01ff0fff0f00
> HCI Event: Number of Completed Packets (0x13) plen 5                                                               #64 3.914653
        Num handles: 1
        Handle: 147 Address: C7:1B:DC:08:AA:BB (Static)
        Count: 1
        Buffers: 0/3
        #55: len 7 (0 Kb/s)
        Latency: 100 msec (100-100 msec ~100 msec)
> HCI Event: Command Complete (0x0e) plen 4                                                                          #65 3.915729
      LE Set Extended Advertising Data (0x08|0x0037) ncmd 1
        Status: Success (0x00)
zephyr.exe[401295]: < HCI Command: LE Set Extended Advertising Enable (0x08|0x0039) plen 6                           #66 3.934431
        Extended advertising: Enabled (0x01)
        Number of sets: 1 (0x01)
        Entry 0
          Handle: 0x00
          Duration: 0 ms (0x00)
          Max ext adv events: 0
> HCI Event: Command Complete (0x0e) plen 4                                                                          #67 3.935366
      LE Set Extended Advertising Enable (0x08|0x0039) ncmd 1
        Status: Success (0x00)
> ACL Data RX: Handle 147 flags 0x02 dlen 11                                                                         #68 5.894710
      SMP: Pairing Request (0x01) len 6
        IO capability: KeyboardDisplay (0x04)
        OOB data: Authentication data not present (0x00)
        Authentication requirement: Bonding, No MITM, SC, No Keypresses (0x09)
        Max encryption key size: 16
        Initiator key distribution: EncKey IdKey (0x03)
        Responder key distribution: EncKey IdKey Sign (0x07)
zephyr.exe[401295]: < HCI Command: Host Number of Completed Packets (0x03|0x0035) plen 5                             #69 5.914488
        Num handles: 1
        Handle: 147 Address: C7:1B:DC:08:AA:BB (Static)
        Count: 1
zephyr.exe[401295]: < ACL Data TX: Handle 147 [1/3] flags 0x00 dlen 11                                               #70 5.914515
      SMP: Pairing Response (0x02) len 6
        IO capability: NoInputNoOutput (0x03)
        OOB data: Authentication data not present (0x00)
        Authentication requirement: Bonding, No MITM, SC, No Keypresses (0x09)
        Max encryption key size: 16
        Initiator key distribution: IdKey (0x02)
        Responder key distribution: Sign (0x04)
> HCI Event: Number of Completed Packets (0x13) plen 5                                                               #71 6.015104
        Num handles: 1
        Handle: 147 Address: C7:1B:DC:08:AA:BB (Static)
        Count: 1
        Buffers: 0/3
        #70: len 11 (0 Kb/s)
        Latency: 100 msec (100-100 msec ~100 msec)
> ACL Data RX: Handle 147 flags 0x02 dlen 27                                                                         #72 6.015106
> ACL Data RX: Handle 147 flags 0x01 dlen 27                                                                         #73 6.015642
> ACL Data RX: Handle 147 flags 0x01 dlen 15                                                                         #74 6.015712
      SMP: Pairing Public Key (0x0c) len 64
        X[32]: 4a07d046a61b938bed0232d77f7c26409323e0196d41ee79cc77d128e84798fd
        Y[32]: d39fb8c9eb3e3130e6b9f53a2fed1f7981e9877362b667a4dab7ca8e8382de27
zephyr.exe[401295]: < HCI Command: Host Number of Completed Packets (0x03|0x0035) plen 5                             #75 6.034600
        Num handles: 1
        Handle: 147 Address: C7:1B:DC:08:AA:BB (Static)
        Count: 1
zephyr.exe[401295]: < HCI Command: Host Number of Completed Packets (0x03|0x0035) plen 5                             #76 6.034702
        Num handles: 1
        Handle: 147 Address: C7:1B:DC:08:AA:BB (Static)
        Count: 1
zephyr.exe[401295]: < HCI Command: Host Number of Completed Packets (0x03|0x0035) plen 5                             #77 6.034752
        Num handles: 1
        Handle: 147 Address: C7:1B:DC:08:AA:BB (Static)
        Count: 1
zephyr.exe[401295]: < ACL Data TX: Handle 147 [1/3] flags 0x00 dlen 27                                               #78 6.034756
zephyr.exe[401295]: < ACL Data TX: Handle 147 flags 0x01 dlen 27                                                     #79 6.034757
zephyr.exe[401295]: < ACL Data TX: Handle 147 flags 0x01 dlen 15                                                     #80 6.034758
      SMP: Pairing Public Key (0x0c) len 64
        X[32]: 98308440221e2d910f0e54b71e7ec652857aa9b5a0dc65028824cc19db1226e9
        Y[32]: 67a4816bcb62efb21701e31fdb27561a6217575fb007a8bbdabe7e28b6f68482
> HCI Event: Number of Completed Packets (0x13) plen 5                                                               #81 6.075174
        Num handles: 1
        Handle: 147 Address: C7:1B:DC:08:AA:BB (Static)
        Count: 1
        Buffers: 0/3
        #78: len 27 (5 Kb/s)
        Latency: 40 msec (40-100 msec ~70 msec)
> HCI Event: Number of Completed Packets (0x13) plen 5                                                               #82 6.075462
        Num handles: 1
        Handle: 147 Address: C7:1B:DC:08:AA:BB (Static)
        Count: 1
        Buffers: underflow/3
        #79: len 27 (5 Kb/s)
        Latency: 40 msec (40-100 msec ~55 msec)
zephyr.exe[401295]: < ACL Data TX: Handle 147 [1/3] flags 0x00 dlen 21                                               #83 6.094437
      SMP: Pairing Confirm (0x03) len 16
        Confirm value[16]: aea70450407c3dc53faa8106b01c4cc9
> HCI Event: Number of Completed Packets (0x13) plen 5                                                               #84 6.134507
        Num handles: 1
        Handle: 147 Address: C7:1B:DC:08:AA:BB (Static)
        Count: 1
        Buffers: 0/3
        #80: len 15 (1 Kb/s)
        Latency: 99 msec (40-100 msec ~77 msec)
> HCI Event: Number of Completed Packets (0x13) plen 5                                                               #85 6.194704
        Num handles: 1
        Handle: 147 Address: C7:1B:DC:08:AA:BB (Static)
        Count: 1
        Buffers: underflow/3
        #83: len 21 (1 Kb/s)
        Latency: 100 msec (40-100 msec ~88 msec)
> ACL Data RX: Handle 147 flags 0x02 dlen 21                                                                         #86 6.195115
      SMP: Pairing Random (0x04) len 16
        Random value[16]: cefdc81e40c412fc0000000000000000
zephyr.exe[401295]: < HCI Command: Host Number of Completed Packets (0x03|0x0035) plen 5                             #87 6.214515
        Num handles: 1
        Handle: 147 Address: C7:1B:DC:08:AA:BB (Static)
        Count: 1
zephyr.exe[401295]: < ACL Data TX: Handle 147 [1/3] flags 0x00 dlen 21                                               #88 6.214539
      SMP: Pairing Random (0x04) len 16
        Random value[16]: 8e6108f966a694cbe26df70bb96773e6
> HCI Event: Number of Completed Packets (0x13) plen 5                                                               #89 6.314630
        Num handles: 1
        Handle: 147 Address: C7:1B:DC:08:AA:BB (Static)
        Count: 1
        Buffers: 0/3
        #88: len 21 (1 Kb/s)
        Latency: 100 msec (40-100 msec ~94 msec)
> ACL Data RX: Handle 147 flags 0x02 dlen 21                                                                         #90 6.494860
      SMP: Pairing DHKey Check (0x0d) len 16
        E[16]: 59469b677025e7d69da511e308d1a955
zephyr.exe[401295]: < HCI Command: Host Number of Completed Packets (0x03|0x0035) plen 5                             #91 6.514601
        Num handles: 1
        Handle: 147 Address: C7:1B:DC:08:AA:BB (Static)
        Count: 1
zephyr.exe[401295]: < ACL Data TX: Handle 147 [1/3] flags 0x00 dlen 21                                               #92 6.514628
      SMP: Pairing DHKey Check (0x0d) len 16
        E[16]: 34b4b9f314bd97a439b46c009ec58263
> HCI Event: Number of Completed Packets (0x13) plen 5                                                               #93 6.614636
        Num handles: 1
        Handle: 147 Address: C7:1B:DC:08:AA:BB (Static)
        Count: 1
        Buffers: 0/3
        #92: len 21 (1 Kb/s)
        Latency: 100 msec (40-100 msec ~97 msec)
> HCI Event: LE Meta Event (0x3e) plen 13                                                                            #94 6.675075
      LE Long Term Key Request (0x05)
        Handle: 147 Address: C7:1B:DC:08:AA:BB (Static)
        Random number: 0x0000000000000000
        Encrypted diversifier: 0x0000
zephyr.exe[401295]: < HCI Command: LE Long Term Key Request Reply (0x08|0x001a) plen 18                              #95 6.694483
        Handle: 147 Address: C7:1B:DC:08:AA:BB (Static)
        Long term key[16]: 5f5792699a390c13774ddd6b7d22c546
> HCI Event: Command Complete (0x0e) plen 6                                                                          #96 6.695575
      LE Long Term Key Request Reply (0x08|0x001a) ncmd 1
        Status: Success (0x00)
        Handle: 147 Address: C7:1B:DC:08:AA:BB (Static)
> HCI Event: Encryption Change (0x08) plen 4                                                                         #97 6.974801
        Status: Success (0x00)
        Handle: 147 Address: C7:1B:DC:08:AA:BB (Static)
        Encryption: Enabled with AES-CCM (0x01)
zephyr.exe[401295]: < ACL Data TX: Handle 147 [1/3] flags 0x00 dlen 21                                               #98 7.104549
      SMP: Signing Information (0x0a) len 16
        Signature key[16]: 5da095555cc64d02679f89a05211af56
> HCI Event: Number of Completed Packets (0x13) plen 5                                                               #99 7.214848
        Num handles: 1
        Handle: 147 Address: C7:1B:DC:08:AA:BB (Static)
        Count: 1
        Buffers: 0/3
        #98: len 21 (1 Kb/s)
        Latency: 110 msec (40-110 msec ~103 msec)
> ACL Data RX: Handle 147 flags 0x02 dlen 21                                                                        #100 7.215080
      SMP: Identity Information (0x08) len 16
        Identity resolving key[16]: a4e83f43cc61413454fb1fddd92f7a23
> ACL Data RX: Handle 147 flags 0x02 dlen 12                                                                        #101 7.215336
      SMP: Identity Address Information (0x09) len 7
        Address: C7:1B:DC:08:AA:BB (Static)
zephyr.exe[401295]: < HCI Command: Host Number of Completed Packets (0x03|0x0035) plen 5                            #102 7.234550
        Num handles: 1
        Handle: 147 Address: C7:1B:DC:08:AA:BB (Static)
        Count: 1
zephyr.exe[401295]: < HCI Command: LE Set Extended Advertising Enable (0x08|0x0039) plen 6                          #103 7.234705
        Extended advertising: Disabled (0x00)
        Number of sets: 1 (0x01)
        Entry 0
          Handle: 0x00
          Duration: 0 ms (0x00)
          Max ext adv events: 0
> HCI Event: Command Complete (0x0e) plen 4                                                                         #104 7.235944
      LE Set Extended Advertising Enable (0x08|0x0039) ncmd 1
        Status: Success (0x00)
zephyr.exe[401295]: < HCI Command: LE Add Device To Resolving List (0x08|0x0027) plen 39                            #105 7.254487
        Address type: Random (0x01)
        Address: C7:1B:DC:08:AA:BB (Static)
        Peer identity resolving key[16]: a4e83f43cc61413454fb1fddd92f7a23
        Local identity resolving key[16]: 00000000000000000000000000000000
> HCI Event: Command Complete (0x0e) plen 4                                                                         #106 7.255694
      LE Add Device To Resolving List (0x08|0x0027) ncmd 1
        Status: Success (0x00)
zephyr.exe[401295]: < HCI Command: LE Set Privacy Mode (0x08|0x004e) plen 8                                         #107 7.274561
        Peer Identity address type: Random (0x01)
        Peer Identity address: C7:1B:DC:08:AA:BB (Static)
        Privacy Mode: Use Device Privacy (0x01)
> HCI Event: Command Complete (0x0e) plen 4                                                                         #108 7.275208
      LE Set Privacy Mode (0x08|0x004e) ncmd 1
        Status: Success (0x00)
zephyr.exe[401295]: < HCI Command: LE Set Address Resolution Enable (0x08|0x002d) plen 1                            #109 7.294518
        Address resolution: Enabled (0x01)
> HCI Event: Command Complete (0x0e) plen 4                                                                         #110 7.295192
      LE Set Address Resolution Enable (0x08|0x002d) ncmd 1
        Status: Success (0x00)
zephyr.exe[401295]: < HCI Command: LE Set Extended Advertising Enable (0x08|0x0039) plen 6                          #111 7.314510
        Extended advertising: Enabled (0x01)
        Number of sets: 1 (0x01)
        Entry 0
          Handle: 0x00
          Duration: 0 ms (0x00)
          Max ext adv events: 0
> HCI Event: Command Complete (0x0e) plen 4                                                                         #112 7.315213
      LE Set Extended Advertising Enable (0x08|0x0039) ncmd 1
        Status: Success (0x00)
zephyr.exe[401295]: < HCI Command: Host Number of Completed Packets (0x03|0x0035) plen 5                            #113 7.334554
        Num handles: 1
        Handle: 147 Address: C7:1B:DC:08:AA:BB (Static)
        Count: 1
> ACL Data RX: Handle 147 flags 0x02 dlen 13                                                                        #114 7.394946
      ATT: Find By Type Value Request (0x06) len 8
        Handle range: 0x0001-0xffff
        Attribute type: Primary Service (0x2800)
          UUID: Broadcast Audio Scan (0x184f)
zephyr.exe[401295]: < HCI Command: Host Number of Completed Packets (0x03|0x0035) plen 5                            #115 7.414542
        Num handles: 1
        Handle: 147 Address: C7:1B:DC:08:AA:BB (Static)
        Count: 1
zephyr.exe[401295]: < ACL Data TX: Handle 147 [1/3] flags 0x00 dlen 9                                               #116 7.414546
      ATT: Find By Type Value Response (0x07) len 4
        Handle range: 0x0047-0x004c
> HCI Event: Number of Completed Packets (0x13) plen 5                                                              #117 7.514823
        Num handles: 1
        Handle: 147 Address: C7:1B:DC:08:AA:BB (Static)
        Count: 1
        Buffers: 0/3
        #116: len 9 (0 Kb/s)
        Latency: 100 msec (40-110 msec ~102 msec)
> ACL Data RX: Handle 147 flags 0x02 dlen 13                                                                        #118 7.514825
      ATT: Find By Type Value Request (0x06) len 8
        Handle range: 0x004d-0xffff
        Attribute type: Primary Service (0x2800)
          UUID: Broadcast Audio Scan (0x184f)
zephyr.exe[401295]: < HCI Command: Host Number of Completed Packets (0x03|0x0035) plen 5                            #119 7.534524
        Num handles: 1
        Handle: 147 Address: C7:1B:DC:08:AA:BB (Static)
        Count: 1
zephyr.exe[401295]: < ACL Data TX: Handle 147 [1/3] flags 0x00 dlen 9                                               #120 7.534590
      ATT: Error Response (0x01) len 4
        Find By Type Value Request (0x06)
        Handle: 0x004d
        Error: Attribute Not Found (0x0a)
> HCI Event: Number of Completed Packets (0x13) plen 5                                                              #121 7.634715
        Num handles: 1
        Handle: 147 Address: C7:1B:DC:08:AA:BB (Static)
        Count: 1
        Buffers: 0/3
        #120: len 9 (0 Kb/s)
        Latency: 100 msec (40-110 msec ~101 msec)
> ACL Data RX: Handle 147 flags 0x02 dlen 11                                                                        #122 7.634753
      ATT: Read By Type Request (0x08) len 6
        Handle range: 0x0047-0x004c
        Attribute type: Characteristic (0x2803)
zephyr.exe[401295]: < HCI Command: Host Number of Completed Packets (0x03|0x0035) plen 5                            #123 7.654556
        Num handles: 1
        Handle: 147 Address: C7:1B:DC:08:AA:BB (Static)
        Count: 1
zephyr.exe[401295]: < ACL Data TX: Handle 147 [1/3] flags 0x00 dlen 20                                              #124 7.654620
      ATT: Read By Type Response (0x09) len 15
        Attribute data length: 7
        Attribute data list: 2 entries
        Handle: 0x0048
        Value[5]: 0c4900c72b
            Properties: 0x0c
              Write Without Response (0x04)
              Write (0x08)
            Value Handle: 0x0049
            Value UUID: Broadcast Audio Scan Control Point (0x2bc7)
        Handle: 0x004a
        Value[5]: 124b00c82b
            Properties: 0x12
              Read (0x02)
              Notify (0x10)
            Value Handle: 0x004b
            Value UUID: Broadcast Receive State (0x2bc8)
> HCI Event: Number of Completed Packets (0x13) plen 5                                                              #125 7.754850
        Num handles: 1
        Handle: 147 Address: C7:1B:DC:08:AA:BB (Static)
        Count: 1
        Buffers: 0/3
        #124: len 20 (1 Kb/s)
        Latency: 100 msec (40-110 msec ~100 msec)
> ACL Data RX: Handle 147 flags 0x02 dlen 11                                                                        #126 7.755126
      ATT: Read By Type Request (0x08) len 6
        Handle range: 0x004b-0x004c
        Attribute type: Characteristic (0x2803)
zephyr.exe[401295]: < HCI Command: Host Number of Completed Packets (0x03|0x0035) plen 5                            #127 7.774521
        Num handles: 1
        Handle: 147 Address: C7:1B:DC:08:AA:BB (Static)
        Count: 1
zephyr.exe[401295]: < ACL Data TX: Handle 147 [1/3] flags 0x00 dlen 9                                               #128 7.774583
      ATT: Error Response (0x01) len 4
        Read By Type Request (0x08)
        Handle: 0x004b
        Error: Attribute Not Found (0x0a)
> HCI Event: Number of Completed Packets (0x13) plen 5                                                              #129 7.874741
        Num handles: 1
        Handle: 147 Address: C7:1B:DC:08:AA:BB (Static)
        Count: 1
        Buffers: 0/3
        #128: len 9 (0 Kb/s)
        Latency: 100 msec (40-110 msec ~100 msec)
> ACL Data RX: Handle 147 flags 0x02 dlen 9                                                                         #130 7.874743
      ATT: Find Information Request (0x04) len 4
        Handle range: 0x004c-0x004c
zephyr.exe[401295]: < HCI Command: Host Number of Completed Packets (0x03|0x0035) plen 5                            #131 7.894546
        Num handles: 1
        Handle: 147 Address: C7:1B:DC:08:AA:BB (Static)
        Count: 1
zephyr.exe[401295]: < ACL Data TX: Handle 147 [1/3] flags 0x00 dlen 10                                              #132 7.894573
      ATT: Find Information Response (0x05) len 5
        Format: UUID-16 (0x01)
        Handle: 0x004c
        UUID: Client Characteristic Configuration (0x2902)
> HCI Event: Number of Completed Packets (0x13) plen 5                                                              #133 7.994837
        Num handles: 1
        Handle: 147 Address: C7:1B:DC:08:AA:BB (Static)
        Count: 1
        Buffers: 0/3
        #132: len 10 (0 Kb/s)
        Latency: 100 msec (40-110 msec ~100 msec)
> ACL Data RX: Handle 147 flags 0x02 dlen 9                                                                         #134 7.994847
      ATT: Write Request (0x12) len 4
        Handle: 0x004c
          Data[2]: 0000
zephyr.exe[401295]: < HCI Command: Host Number of Completed Packets (0x03|0x0035) plen 5                            #135 8.014552
        Num handles: 1
        Handle: 147 Address: C7:1B:DC:08:AA:BB (Static)
        Count: 1
zephyr.exe[401295]: < ACL Data TX: Handle 147 [1/3] flags 0x00 dlen 5                                               #136 8.014618
      ATT: Write Response (0x13) len 0
> HCI Event: Number of Completed Packets (0x13) plen 5                                                              #137 8.114762
        Num handles: 1
        Handle: 147 Address: C7:1B:DC:08:AA:BB (Static)
        Count: 1
        Buffers: 0/3
        #136: len 5 (0 Kb/s)
        Latency: 100 msec (40-110 msec ~100 msec)
> ACL Data RX: Handle 147 flags 0x02 dlen 9                                                                         #138 8.114930
      ATT: Write Request (0x12) len 4
        Handle: 0x004c
          Data[2]: 0100
zephyr.exe[401295]: < HCI Command: Host Number of Completed Packets (0x03|0x0035) plen 5                            #139 8.134577
        Num handles: 1
        Handle: 147 Address: C7:1B:DC:08:AA:BB (Static)
        Count: 1
zephyr.exe[401295]: < ACL Data TX: Handle 147 [1/3] flags 0x00 dlen 5                                               #140 8.134604
      ATT: Write Response (0x13) len 0
> HCI Event: Number of Completed Packets (0x13) plen 5                                                              #141 8.234633
        Num handles: 1
        Handle: 147 Address: C7:1B:DC:08:AA:BB (Static)
        Count: 1
        Buffers: 0/3
        #140: len 5 (0 Kb/s)
        Latency: 100 msec (40-110 msec ~100 msec)
> ACL Data RX: Handle 147 flags 0x02 dlen 7                                                                         #142 8.234707
      ATT: Read Request (0x0a) len 2
        Handle: 0x004b
zephyr.exe[401295]: < HCI Command: Host Number of Completed Packets (0x03|0x0035) plen 5                            #143 8.254511
        Num handles: 1
        Handle: 147 Address: C7:1B:DC:08:AA:BB (Static)
        Count: 1
zephyr.exe[401295]: < ACL Data TX: Handle 147 [1/3] flags 0x00 dlen 5                                               #144 8.254516
      ATT: Read Response (0x0b) len 0
        Value[0]: 
> HCI Event: Number of Completed Packets (0x13) plen 5                                                              #145 8.354584
        Num handles: 1
        Handle: 147 Address: C7:1B:DC:08:AA:BB (Static)
        Count: 1
        Buffers: 0/3
        #144: len 5 (0 Kb/s)
        Latency: 100 msec (40-110 msec ~100 msec)
> ACL Data RX: Handle 147 flags 0x02 dlen 27                                                                        #146 8.534959
> ACL Data RX: Handle 147 flags 0x01 dlen 1                                                                         #147 8.535205
      ATT: Write Command (0x52) len 23
        Handle: 0x0049
          Data[21]: 0201bbaa08dc1bc7003899db02401f010000000000
zephyr.exe[401295]: < HCI Command: Host Number of Completed Packets (0x03|0x0035) plen 5                            #148 8.554562
        Num handles: 1
        Handle: 147 Address: C7:1B:DC:08:AA:BB (Static)
        Count: 1
zephyr.exe[401295]: < HCI Command: Host Number of Completed Packets (0x03|0x0035) plen 5                            #149 8.554686
        Num handles: 1
        Handle: 147 Address: C7:1B:DC:08:AA:BB (Static)
        Count: 1
zephyr.exe[401295]: < ACL Data TX: Handle 147 [1/3] flags 0x00 dlen 27                                              #150 8.554719
      ATT: Handle Value Notification (0x1b) len 22
        Handle: 0x004b
          Data[20]: 0001bbaa08dc1bc7003899db0000010000000000
> HCI Event: Number of Completed Packets (0x13) plen 5                                                              #151 8.655082
        Num handles: 1
        Handle: 147 Address: C7:1B:DC:08:AA:BB (Static)
        Count: 1
        Buffers: 0/3
        #150: len 27 (2 Kb/s)
        Latency: 100 msec (40-110 msec ~100 msec)
zephyr.exe[401295]: < HCI Command: LE Periodic Advertising Create Sync (0x08|0x0044) plen 14                        #152 8.964513
        Options: 0x0000
        Use advertising SID, Advertiser Address Type and address
        Reporting initially enabled
        SID: 0x00
        Adv address type: Random (0x01)
        Adv address: C7:1B:DC:08:AA:BB (Static)
        Skip: 0x0005
        Sync timeout: 10000 msec (0x03e8)
        Sync CTE type: 0x0000
> HCI Event: Command Status (0x0f) plen 4                                                                           #153 8.965379
      LE Periodic Advertising Create Sync (0x08|0x0044) ncmd 1
        Status: Success (0x00)
zephyr.exe[401295]: < HCI Command: LE Set Random Address (0x08|0x0005) plen 6                                       #154 8.974518
        Address: 04:C8:1E:D2:64:DA (Non-Resolvable)
> HCI Event: Command Complete (0x0e) plen 4                                                                         #155 8.975996
      LE Set Random Address (0x08|0x0005) ncmd 1
        Status: Success (0x00)
zephyr.exe[401295]: < HCI Command: LE Set Extended Scan Parameters (0x08|0x0041) plen 13                            #156 8.994463
        Own address type: Random (0x01)
        Filter policy: Accept all advertisement (0x00)
        PHYs: 0x05
        Entry 0: LE 1M
          Type: Passive (0x00)
          Interval: 60.000 msec (0x0060)
          Window: 30.000 msec (0x0030)
        Entry 1: LE Coded
          Type: Passive (0x00)
          Interval: 60.000 msec (0x0060)
          Window: 30.000 msec (0x0030)
> HCI Event: Command Complete (0x0e) plen 4                                                                         #157 8.995742
      LE Set Extended Scan Parameters (0x08|0x0041) ncmd 1
        Status: Success (0x00)
zephyr.exe[401295]: < HCI Command: LE Set Extended Scan Enable (0x08|0x0042) plen 6                                 #158 9.014548
        Extended scan: Enabled (0x01)
        Filter duplicates: Enabled (0x01)
        Duration: 0 msec (0x0000)
        Period: 0.00 sec (0x0000)
> HCI Event: Command Complete (0x0e) plen 4                                                                         #159 9.015368
      LE Set Extended Scan Enable (0x08|0x0042) ncmd 1
        Status: Success (0x00)
> HCI Event: LE Meta Event (0x3e) plen 51                                                                           #160 9.023814
      LE Extended Advertising Report (0x0d)
        Num reports: 1
        Entry 0
          Event type: 0x0013
            Props: 0x0013
              Connectable
              Scannable
              Use legacy advertising PDUs
            Data status: [0;32mComplete[0m
          Legacy PDU Type: ADV_IND (0x0013)
          Address type: Public (0x00)
          Address: F0:18:98:96:04:94 (Apple, Inc.)
          Primary PHY: LE 1M
          Secondary PHY: No packets
          SID: no ADI field (0xff)
          TX power: 127 dBm
          RSSI: -80 dBm (0xb0)
          Periodic advertising interval: 0.00 msec (0x0000)
          Direct address type: Reserved (0xff)
          Direct address: 00-00-00-00-00-00
          Data length: 0x19
        02 01 06 11 07 00 00 00 00 00 00 00 00 00 00 00  ................
        00 00 01 31 5a 03 09 7a 6d                       ...1Z..zm       
        Flags: 0x06
          LE General Discoverable Mode
          BR/EDR Not Supported
        128-bit Service UUIDs (complete): 1 entry
          Vendor specific
        Name (complete): zm
> HCI Event: LE Meta Event (0x3e) plen 55                                                                           #161 9.091197
      LE Extended Advertising Report (0x0d)
        Num reports: 1
        Entry 0
          Event type: 0x0010
            Props: 0x0010
              Use legacy advertising PDUs
            Data status: [0;32mComplete[0m
          Legacy PDU Type: ADV_NONCONN_IND (0x0010)
          Address type: Random (0x01)
          Address: 3E:10:15:AF:40:02 (Non-Resolvable)
          Primary PHY: LE 1M
          Secondary PHY: No packets
          SID: no ADI field (0xff)
          TX power: 127 dBm
          RSSI: -94 dBm (0xa2)
          Periodic advertising interval: 0.00 msec (0x0000)
          Direct address type: Reserved (0xff)
          Direct address: 00-00-00-00-00-00
          Data length: 0x1d
        1c ff 06 00 01 09 21 0a 4d e0 8a 52 d2 d4 4c 41  ......!.M..R..LA
        50 54 4f 50 2d 45 35 32 45 4f 44 32 49           PTOP-E52EOD2I   
        Company: Microsoft (6)
          Data[25]: 0109210a4de08a52d2d44c4150544f502d453532454f443249
> HCI Event: LE Meta Event (0x3e) plen 43                                                                           #162 9.107979
      LE Extended Advertising Report (0x0d)
        Num reports: 1
        Entry 0
          Event type: 0x0013
            Props: 0x0013
              Connectable
              Scannable
              Use legacy advertising PDUs
            Data status: [0;32mComplete[0m
          Legacy PDU Type: ADV_IND (0x0013)
          Address type: Random (0x01)
          Address: 4E:C7:00:6D:5D:C1 (Resolvable)
          Primary PHY: LE 1M
          Secondary PHY: No packets
          SID: no ADI field (0xff)
          TX power: 127 dBm
          RSSI: -82 dBm (0xae)
          Periodic advertising interval: 0.00 msec (0x0000)
          Direct address type: Reserved (0xff)
          Direct address: 00-00-00-00-00-00
          Data length: 0x11
        02 01 1a 02 0a 01 0a ff 4c 00 10 05 0b 18 b9 91  ........L.......
        cc                                               .               
        Flags: 0x1a
          LE General Discoverable Mode
          Simultaneous LE and BR/EDR (Controller)
          Simultaneous LE and BR/EDR (Host)
        TX power: 1 dBm
        Company: Apple, Inc. (76)
          Type: Unknown (16)
          Data[5]: 0b18b991cc
> HCI Event: LE Meta Event (0x3e) plen 43                                                                           #163 9.111501
      LE Extended Advertising Report (0x0d)
        Num reports: 1
        Entry 0
          Event type: 0x0013
            Props: 0x0013
              Connectable
              Scannable
              Use legacy advertising PDUs
            Data status: [0;32mComplete[0m
          Legacy PDU Type: ADV_IND (0x0013)
          Address type: Random (0x01)
          Address: 43:D6:19:A3:9A:E4 (Resolvable)
          Primary PHY: LE 1M
          Secondary PHY: No packets
          SID: no ADI field (0xff)
          TX power: 127 dBm
          RSSI: -82 dBm (0xae)
          Periodic advertising interval: 0.00 msec (0x0000)
          Direct address type: Reserved (0xff)
          Direct address: 00-00-00-00-00-00
          Data length: 0x11
        02 01 1a 02 0a 01 0a ff 4c 00 10 05 0b 18 b9 91  ........L.......
        cc                                               .               
        Flags: 0x1a
          LE General Discoverable Mode
          Simultaneous LE and BR/EDR (Controller)
          Simultaneous LE and BR/EDR (Host)
        TX power: 1 dBm
        Company: Apple, Inc. (76)
          Type: Unknown (16)
          Data[5]: 0b18b991cc
> HCI Event: LE Meta Event (0x3e) plen 41                                                                           #164 9.115645
      LE Extended Advertising Report (0x0d)
        Num reports: 1
        Entry 0
          Event type: 0x0010
            Props: 0x0010
              Use legacy advertising PDUs
            Data status: [0;32mComplete[0m
          Legacy PDU Type: ADV_NONCONN_IND (0x0010)
          Address type: Random (0x01)
          Address: 0C:44:05:10:C5:E1 (Non-Resolvable)
          Primary PHY: LE 1M
          Secondary PHY: No packets
          SID: no ADI field (0xff)
          TX power: 127 dBm
          RSSI: -82 dBm (0xae)
          Periodic advertising interval: 0.00 msec (0x0000)
          Direct address type: Reserved (0xff)
          Direct address: 00-00-00-00-00-00
          Data length: 0x0f
        02 01 1a 0b ff 4c 00 09 06 03 08 0a 03 0a 49     .....L........I 
        Flags: 0x1a
          LE General Discoverable Mode
          Simultaneous LE and BR/EDR (Controller)
          Simultaneous LE and BR/EDR (Host)
        Company: Apple, Inc. (76)
          Type: Apple TV (9)
          Data[6]: 03080a030a49
> HCI Event: LE Meta Event (0x3e) plen 50                                                                           #165 9.408938
      LE Extended Advertising Report (0x0d)
        Num reports: 1
        Entry 0
          Event type: 0x0013
            Props: 0x0013
              Connectable
              Scannable
              Use legacy advertising PDUs
            Data status: [0;32mComplete[0m
          Legacy PDU Type: ADV_IND (0x0013)
          Address type: Public (0x00)
          Address: 7C:49:EB:2C:13:D2 (XIAOMI Electronics,CO.,LTD)
          Primary PHY: LE 1M
          Secondary PHY: No packets
          SID: no ADI field (0xff)
          TX power: 127 dBm
          RSSI: -94 dBm (0xa2)
          Periodic advertising interval: 0.00 msec (0x0000)
          Direct address type: Reserved (0xff)
          Direct address: 00-00-00-00-00-00
          Data length: 0x18
        02 01 06 14 16 95 fe 71 20 13 01 8d d2 13 2c eb  .......q .....,.
        49 7c 09 05 10 02 00 16                          I|......        
        Flags: 0x06
          LE General Discoverable Mode
          BR/EDR Not Supported
        Service Data: Xiaomi Inc. (0xfe95)
          Data[17]: 712013018dd2132ceb497c090510020016
> HCI Event: LE Meta Event (0x3e) plen 57                                                                           #166 9.430506
      LE Extended Advertising Report (0x0d)
        Num reports: 1
        Entry 0
          Event type: 0x0010
            Props: 0x0010
              Use legacy advertising PDUs
            Data status: [0;32mComplete[0m
          Legacy PDU Type: ADV_NONCONN_IND (0x0010)
          Address type: Random (0x01)
          Address: 1E:39:A4:65:B9:C2 (Non-Resolvable)
          Primary PHY: LE 1M
          Secondary PHY: No packets
          SID: no ADI field (0xff)
          TX power: 127 dBm
          RSSI: -89 dBm (0xa7)
          Periodic advertising interval: 0.00 msec (0x0000)
          Direct address type: Reserved (0xff)
          Direct address: 00-00-00-00-00-00
          Data length: 0x1f
        1e ff 06 00 01 09 20 22 92 29 83 1f 2c 9d 17 f0  ...... ".)..,...
        1b 3e 42 9c d7 82 97 9f 37 d9 54 47 5a 8b c7     .>B.....7.TGZ.. 
        Company: Microsoft (6)
          Data[27]: 010920229229831f2c9d17f01b3e429cd782979f37d954475a8bc7
> HCI Event: LE Meta Event (0x3e) plen 57                                                                           #167 9.530473
      LE Extended Advertising Report (0x0d)
        Num reports: 1
        Entry 0
          Event type: 0x0010
            Props: 0x0010
              Use legacy advertising PDUs
            Data status: [0;32mComplete[0m
          Legacy PDU Type: ADV_NONCONN_IND (0x0010)
          Address type: Random (0x01)
          Address: 1E:39:A4:65:B9:C2 (Non-Resolvable)
          Primary PHY: LE 1M
          Secondary PHY: No packets
          SID: no ADI field (0xff)
          TX power: 127 dBm
          RSSI: -87 dBm (0xa9)
          Periodic advertising interval: 0.00 msec (0x0000)
          Direct address type: Reserved (0xff)
          Direct address: 00-00-00-00-00-00
          Data length: 0x1f
        1e ff 06 00 01 09 20 22 92 29 83 1f 2c 9d 17 f0  ...... ".)..,...
        1b 3e 42 9c d7 82 97 9f 37 d9 54 47 5a 8b c7     .>B.....7.TGZ.. 
        Company: Microsoft (6)
          Data[27]: 010920229229831f2c9d17f01b3e429cd782979f37d954475a8bc7
> HCI Event: LE Meta Event (0x3e) plen 57                                                                           #168 9.846989
      LE Extended Advertising Report (0x0d)
        Num reports: 1
        Entry 0
          Event type: 0x0010
            Props: 0x0010
              Use legacy advertising PDUs
            Data status: [0;32mComplete[0m
          Legacy PDU Type: ADV_NONCONN_IND (0x0010)
          Address type: Random (0x01)
          Address: 1E:39:A4:65:B9:C2 (Non-Resolvable)
          Primary PHY: LE 1M
          Secondary PHY: No packets
          SID: no ADI field (0xff)
          TX power: 127 dBm
          RSSI: -90 dBm (0xa6)
          Periodic advertising interval: 0.00 msec (0x0000)
          Direct address type: Reserved (0xff)
          Direct address: 00-00-00-00-00-00
          Data length: 0x1f
        1e ff 06 00 01 09 20 22 92 29 83 1f 2c 9d 17 f0  ...... ".)..,...
        1b 3e 42 9c d7 82 97 9f 37 d9 54 47 5a 8b c7     .>B.....7.TGZ.. 
        Company: Microsoft (6)
          Data[27]: 010920229229831f2c9d17f01b3e429cd782979f37d954475a8bc7
> HCI Event: LE Meta Event (0x3e) plen 51                                                                           #169 9.938874
      LE Extended Advertising Report (0x0d)
        Num reports: 1
        Entry 0
          Event type: 0x0013
            Props: 0x0013
              Connectable
              Scannable
              Use legacy advertising PDUs
            Data status: [0;32mComplete[0m
          Legacy PDU Type: ADV_IND (0x0013)
          Address type: Public (0x00)
          Address: F0:18:98:96:04:94 (Apple, Inc.)
          Primary PHY: LE 1M
          Secondary PHY: No packets
          SID: no ADI field (0xff)
          TX power: 127 dBm
          RSSI: -80 dBm (0xb0)
          Periodic advertising interval: 0.00 msec (0x0000)
          Direct address type: Reserved (0xff)
          Direct address: 00-00-00-00-00-00
          Data length: 0x19
        02 01 06 11 07 00 00 00 00 00 00 00 00 00 00 00  ................
        00 00 01 31 5a 03 09 7a 6d                       ...1Z..zm       
        Flags: 0x06
          LE General Discoverable Mode
          BR/EDR Not Supported
        128-bit Service UUIDs (complete): 1 entry
          Vendor specific
        Name (complete): zm
> HCI Event: LE Meta Event (0x3e) plen 56                                                                           #170 9.946784
      LE Extended Advertising Report (0x0d)
        Num reports: 1
        Entry 0
          Event type: 0x0013
            Props: 0x0013
              Connectable
              Scannable
              Use legacy advertising PDUs
            Data status: [0;32mComplete[0m
          Legacy PDU Type: ADV_IND (0x0013)
          Address type: Random (0x01)
          Address: 6A:D4:6F:E1:C1:6A (Resolvable)
          Primary PHY: LE 1M
          Secondary PHY: No packets
          SID: no ADI field (0xff)
          TX power: 127 dBm
          RSSI: -88 dBm (0xa8)
          Periodic advertising interval: 0.00 msec (0x0000)
          Direct address type: Reserved (0xff)
          Direct address: 00-00-00-00-00-00
          Data length: 0x1e
        02 01 02 1a ff 4c 00 02 15 18 a5 47 93 5c 75 49  .....L.....G.\uI
        ae af 6d 3e dd a8 4d ff c3 49 40 c1 43 c5        ..m>..M..I@.C.  
        Flags: 0x02
          LE General Discoverable Mode
        Company: Apple, Inc. (76)
          Type: iBeacon (2)
          UUID: c3ff4da8-dd3e-6daf-ae49-755c9347a518
          Version: 16457.17345
          TX power: -59 dB
> HCI Event: LE Meta Event (0x3e) plen 57                                                                           #171 9.951979
      LE Extended Advertising Report (0x0d)
        Num reports: 1
        Entry 0
          Event type: 0x0010
            Props: 0x0010
              Use legacy advertising PDUs
            Data status: [0;32mComplete[0m
          Legacy PDU Type: ADV_NONCONN_IND (0x0010)
          Address type: Random (0x01)
          Address: 1E:39:A4:65:B9:C2 (Non-Resolvable)
          Primary PHY: LE 1M
          Secondary PHY: No packets
          SID: no ADI field (0xff)
          TX power: 127 dBm
          RSSI: -89 dBm (0xa7)
          Periodic advertising interval: 0.00 msec (0x0000)
          Direct address type: Reserved (0xff)
          Direct address: 00-00-00-00-00-00
          Data length: 0x1f
        1e ff 06 00 01 09 20 22 92 29 83 1f 2c 9d 17 f0  ...... ".)..,...
        1b 3e 42 9c d7 82 97 9f 37 d9 54 47 5a 8b c7     .>B.....7.TGZ.. 
        Company: Microsoft (6)
          Data[27]: 010920229229831f2c9d17f01b3e429cd782979f37d954475a8bc7
> HCI Event: LE Meta Event (0x3e) plen 57                                                                          #172 10.376501
      LE Extended Advertising Report (0x0d)
        Num reports: 1
        Entry 0
          Event type: 0x0010
            Props: 0x0010
              Use legacy advertising PDUs
            Data status: [0;32mComplete[0m
          Legacy PDU Type: ADV_NONCONN_IND (0x0010)
          Address type: Random (0x01)
          Address: 1E:39:A4:65:B9:C2 (Non-Resolvable)
          Primary PHY: LE 1M
          Secondary PHY: No packets
          SID: no ADI field (0xff)
          TX power: 127 dBm
          RSSI: -89 dBm (0xa7)
          Periodic advertising interval: 0.00 msec (0x0000)
          Direct address type: Reserved (0xff)
          Direct address: 00-00-00-00-00-00
          Data length: 0x1f
        1e ff 06 00 01 09 20 22 92 29 83 1f 2c 9d 17 f0  ...... ".)..,...
        1b 3e 42 9c d7 82 97 9f 37 d9 54 47 5a 8b c7     .>B.....7.TGZ.. 
        Company: Microsoft (6)
          Data[27]: 010920229229831f2c9d17f01b3e429cd782979f37d954475a8bc7
> HCI Event: LE Meta Event (0x3e) plen 50                                                                          #173 10.468851
      LE Extended Advertising Report (0x0d)
        Num reports: 1
        Entry 0
          Event type: 0x0013
            Props: 0x0013
              Connectable
              Scannable
              Use legacy advertising PDUs
            Data status: [0;32mComplete[0m
          Legacy PDU Type: ADV_IND (0x0013)
          Address type: Public (0x00)
          Address: 7C:49:EB:2C:13:D2 (XIAOMI Electronics,CO.,LTD)
          Primary PHY: LE 1M
          Secondary PHY: No packets
          SID: no ADI field (0xff)
          TX power: 127 dBm
          RSSI: -93 dBm (0xa3)
          Periodic advertising interval: 0.00 msec (0x0000)
          Direct address type: Reserved (0xff)
          Direct address: 00-00-00-00-00-00
          Data length: 0x18
        02 01 06 14 16 95 fe 71 20 13 01 8d d2 13 2c eb  .......q .....,.
        49 7c 09 05 10 02 00 16                          I|......        
        Flags: 0x06
          LE General Discoverable Mode
          BR/EDR Not Supported
        Service Data: Xiaomi Inc. (0xfe95)
          Data[17]: 712013018dd2132ceb497c090510020016
> HCI Event: LE Meta Event (0x3e) plen 43                                                                          #174 10.475278
      LE Extended Advertising Report (0x0d)
        Num reports: 1
        Entry 0
          Event type: 0x0013
            Props: 0x0013
              Connectable
              Scannable
              Use legacy advertising PDUs
            Data status: [0;32mComplete[0m
          Legacy PDU Type: ADV_IND (0x0013)
          Address type: Random (0x01)
          Address: 43:D6:19:A3:9A:E4 (Resolvable)
          Primary PHY: LE 1M
          Secondary PHY: No packets
          SID: no ADI field (0xff)
          TX power: 127 dBm
          RSSI: -80 dBm (0xb0)
          Periodic advertising interval: 0.00 msec (0x0000)
          Direct address type: Reserved (0xff)
          Direct address: 00-00-00-00-00-00
          Data length: 0x11
        02 01 1a 02 0a 01 0a ff 4c 00 10 05 0b 18 b9 91  ........L.......
        cc                                               .               
        Flags: 0x1a
          LE General Discoverable Mode
          Simultaneous LE and BR/EDR (Controller)
          Simultaneous LE and BR/EDR (Host)
        TX power: 1 dBm
        Company: Apple, Inc. (76)
          Type: Unknown (16)
          Data[5]: 0b18b991cc
> HCI Event: LE Meta Event (0x3e) plen 57                                                                          #175 10.476918
      LE Extended Advertising Report (0x0d)
        Num reports: 1
        Entry 0
          Event type: 0x0010
            Props: 0x0010
              Use legacy advertising PDUs
            Data status: [0;32mComplete[0m
          Legacy PDU Type: ADV_NONCONN_IND (0x0010)
          Address type: Random (0x01)
          Address: 1E:39:A4:65:B9:C2 (Non-Resolvable)
          Primary PHY: LE 1M
          Secondary PHY: No packets
          SID: no ADI field (0xff)
          TX power: 127 dBm
          RSSI: -90 dBm (0xa6)
          Periodic advertising interval: 0.00 msec (0x0000)
          Direct address type: Reserved (0xff)
          Direct address: 00-00-00-00-00-00
          Data length: 0x1f
        1e ff 06 00 01 09 20 22 92 29 83 1f 2c 9d 17 f0  ...... ".)..,...
        1b 3e 42 9c d7 82 97 9f 37 d9 54 47 5a 8b c7     .>B.....7.TGZ.. 
        Company: Microsoft (6)
          Data[27]: 010920229229831f2c9d17f01b3e429cd782979f37d954475a8bc7
> HCI Event: LE Meta Event (0x3e) plen 43                                                                          #176 10.484153
      LE Extended Advertising Report (0x0d)
        Num reports: 1
        Entry 0
          Event type: 0x0013
            Props: 0x0013
              Connectable
              Scannable
              Use legacy advertising PDUs
            Data status: [0;32mComplete[0m
          Legacy PDU Type: ADV_IND (0x0013)
          Address type: Random (0x01)
          Address: 4E:C7:00:6D:5D:C1 (Resolvable)
          Primary PHY: LE 1M
          Secondary PHY: No packets
          SID: no ADI field (0xff)
          TX power: 127 dBm
          RSSI: -80 dBm (0xb0)
          Periodic advertising interval: 0.00 msec (0x0000)
          Direct address type: Reserved (0xff)
          Direct address: 00-00-00-00-00-00
          Data length: 0x11
        02 01 1a 02 0a 01 0a ff 4c 00 10 05 0b 18 b9 91  ........L.......
        cc                                               .               
        Flags: 0x1a
          LE General Discoverable Mode
          Simultaneous LE and BR/EDR (Controller)
          Simultaneous LE and BR/EDR (Host)
        TX power: 1 dBm
        Company: Apple, Inc. (76)
          Type: Unknown (16)
          Data[5]: 0b18b991cc
> HCI Event: LE Meta Event (0x3e) plen 48                                                                          #177 10.485914
      LE Extended Advertising Report (0x0d)
        Num reports: 1
        Entry 0
          Event type: 0x0000
            Props: 0x0000
            Data status: [0;32mComplete[0m
          Address type: Random (0x01)
          Address: C7:1B:DC:08:AA:BB (Static)
          Primary PHY: LE 1M
          Secondary PHY: LE 1M
          SID: 0x00
          TX power: 127 dBm
          RSSI: -17 dBm (0xef)
          Periodic advertising interval: 120.00 msec (0x0060)
          Direct address type: Reserved (0xff)
          Direct address: 00-00-00-00-00-00
          Data length: 0x16
        06 16 52 18 38 99 db 0e 09 50 54 53 2d 42 41 53  ..R.8....PTS-BAS
        53 2d 42 31 31 41                                S-B11A          
        Service Data: Broadcast Audio Announcement (0x1852)
        Broadcast ID: 14391608 (0xdb9938)
        Name (complete): PTS-BASS-B11A
> HCI Event: LE Meta Event (0x3e) plen 16                                                                          #178 10.545770
      LE Periodic Advertising Sync Established (0x0e)
        Status: Success (0x00)
        Sync handle: 40
        Advertising SID: 0x00
        Advertiser address type: Resolved Random (0x03)
        Advertiser address: C7:1B:DC:08:AA:BB (Static)
        Advertiser PHY: LE 1M (0x01)
        Periodic advertising interval: 120.00 msec (0x0060)
        Advertiser clock accuracy: 0x01
> HCI Event: LE Meta Event (0x3e) plen 48                                                                          #179 10.546507
      LE Periodic Advertising Report (0x0f)
        Sync handle: 40
        TX power: 127 dbm (0x7f)
        RSSI: -16 dBm (0xf0)
        CTE Type: No Constant Tone Extension (0xff)
        Data status: [0;32mComplete[0m
        Data length: 0x28
        Service Data: Basic Audio Announcement (0x1851)
          Presentation Delay: 40000
          Number of Subgroups: 1
            Subgroup #0:
            Number of BIS(s): 1
            Codec: LC3 (0x06)
            Codec Specific Configuration: #0: len 0x02 type 0x01
            Codec Specific Configuration: Sampling Frequency: 16 Khz (0x03)
            Codec Specific Configuration: #1: len 0x02 type 0x02
            Codec Specific Configuration: Frame Duration: 10 ms (0x01)
            Codec Specific Configuration: #2: len 0x03 type 0x04
            Codec Specific Configuration: Frame Length: 40 (0x0028)
            Metadata: #0: len 0x03 type 0x02
            Metadata: Context: 0x0004
            Metadata: Context	Media (0x0004)
            Metadata: #1: len 0x01 type 0x09
              BIS #0:
              Index: 1
              Codec Specific Configuration: #0: len 0x05 type 0x03
              Codec Specific Configuration: Location: 0x00000001
              Codec Specific Configuration: Location: Front Left (0x00000001)
> HCI Event: LE Meta Event (0x3e) plen 20                                                                          #180 10.546876
      LE Broadcast Isochronous Group Info Advertis