Bluetooth monitor ver 5.72
= Note: Linux version 7.0.0-31-generic (x86_64)                        0.917632
= Note: Bluetooth subsystem version 2.22                               0.917634
= New Index: 00:00:00:00:00:00 (Primary,UART,hci2)              [hci2] 0.917635
= New Index: 00:00:00:00:00:00 (Primary,UART,hci1)              [hci1] 0.917635
= New Index: 48:5F:99:8E:E0:64 (Primary,USB,hci0)               [hci0] 0.917636
= Open Index: 00:00:00:00:00:00                                 [hci1] 1.060830
= Index Info: 00:00:00:00:00:00 (Nordic Semiconductor ASA)      [hci1] 1.060836
@ USER Open: main (privileged) version 2.22            {0x0001} [hci1] 1.060841
< HCI Command: Reset (0x03|0x0003) plen 0                    #1 [hci1] 1.061225
> HCI Event: Command Complete (0x0e) plen 4                  #2 [hci1] 1.061777
      Reset (0x03|0x0003) ncmd 1
        Status: Success (0x00)
< HCI Command: Read Local Supported... (0x04|0x0003) plen 0  #3 [hci1] 1.080799
> HCI Event: Command Complete (0x0e) plen 12                 #4 [hci1] 1.081251
      Read Local Supported Features (0x04|0x0003) ncmd 1
        Status: Success (0x00)
        Features: 0x00 0x00 0x00 0x00 0x60 0x00 0x00 0x00
          BR/EDR Not Supported
          LE Supported (Controller)
< HCI Command: Read Local Version In.. (0x04|0x0001) plen 0  #5 [hci1] 1.100801
> HCI Event: Command Complete (0x0e) plen 12                 #6 [hci1] 1.101466
      Read Local Version Information (0x04|0x0001) ncmd 1
        Status: Success (0x00)
        HCI version: Reserved (0x11) - Revision 12345 (0x3039)
        LMP version: Reserved (0x11) - Subversion 12345 (0x3039)
        Manufacturer: Nordic Semiconductor ASA (89)
< HCI Command: Read Local Supported... (0x04|0x0002) plen 0  #7 [hci1] 1.120800
> HCI Event: Command Complete (0x0e) plen 68                 #8 [hci1] 1.121889
      Read Local Supported Commands (0x04|0x0002) ncmd 1
        Status: Success (0x00)
        Commands: 115 entries
          Disconnect (Octet 0 - Bit 5)
          Read Remote Version Information (Octet 2 - Bit 7)
          Set Event Mask (Octet 5 - Bit 6)
          Reset (Octet 5 - Bit 7)
          Read Connection Accept Timeout (Octet 7 - Bit 2)
          Write Connection Accept Timeout (Octet 7 - Bit 3)
          Read Transmit Power Level (Octet 10 - Bit 2)
          Set Controller To Host Flow Control (Octet 10 - Bit 5)
          Host Buffer Size (Octet 10 - Bit 6)
          Host Number of Completed Packets (Octet 10 - Bit 7)
          Read Local Version Information (Octet 14 - Bit 3)
          Read Local Supported Features (Octet 14 - Bit 5)
          Read BD ADDR (Octet 15 - Bit 1)
          Read RSSI (Octet 15 - Bit 5)
          Set Event Mask Page 2 (Octet 22 - Bit 2)
          LE Set Event Mask (Octet 25 - Bit 0)
          LE Read Buffer Size (Octet 25 - Bit 1)
          LE Read Local Supported Features (Octet 25 - Bit 2)
          LE Set Random Address (Octet 25 - Bit 4)
          LE Set Advertising Parameters (Octet 25 - Bit 5)
          LE Read Advertising Channel TX Power (Octet 25 - Bit 6)
          LE Set Advertising Data (Octet 25 - Bit 7)
          LE Set Scan Response Data (Octet 26 - Bit 0)
          LE Set Advertise Enable (Octet 26 - Bit 1)
          LE Set Scan Parameters (Octet 26 - Bit 2)
          LE Set Scan Enable (Octet 26 - Bit 3)
          LE Create Connection (Octet 26 - Bit 4)
          LE Create Connection Cancel (Octet 26 - Bit 5)
          LE Read Accept List Size (Octet 26 - Bit 6)
          LE Clear Accept List (Octet 26 - Bit 7)
          LE Add Device To Accept List (Octet 27 - Bit 0)
          LE Remove Device From Accept List (Octet 27 - Bit 1)
          LE Connection Update (Octet 27 - Bit 2)
          LE Set Host Channel Classification (Octet 27 - Bit 3)
          LE Read Channel Map (Octet 27 - Bit 4)
          LE Read Remote Used Features (Octet 27 - Bit 5)
          LE Encrypt (Octet 27 - Bit 6)
          LE Rand (Octet 27 - Bit 7)
          LE Start Encryption (Octet 28 - Bit 0)
          LE Long Term Key Request Reply (Octet 28 - Bit 1)
          LE Long Term Key Request Neg Reply (Octet 28 - Bit 2)
          LE Read Supported States (Octet 28 - Bit 3)
          Read Authenticated Payload Timeout (Octet 32 - Bit 4)
          Write Authenticated Payload Timeout (Octet 32 - Bit 5)
          LE Set Data Length (Octet 33 - Bit 6)
          LE Read Suggested Default Data Length (Octet 33 - Bit 7)
          LE Write Suggested Default Data Length (Octet 34 - Bit 0)
          LE Add Device To Resolving List (Octet 34 - Bit 3)
          LE Remove Device From Resolving List (Octet 34 - Bit 4)
          LE Clear Resolving List (Octet 34 - Bit 5)
          LE Read Resolving List Size (Octet 34 - Bit 6)
          LE Set Address Resolution Enable (Octet 35 - Bit 1)
          LE Set Resolvable Private Address Timeout (Octet 35 - Bit 2)
          LE Read Maximum Data Length (Octet 35 - Bit 3)
          LE Read PHY (Octet 35 - Bit 4)
          LE Set Default PHY (Octet 35 - Bit 5)
          LE Set PHY (Octet 35 - Bit 6)
          LE Set Advertising Set Random Address (Octet 36 - Bit 1)
          LE Set Extended Advertising Parameters (Octet 36 - Bit 2)
          LE Set Extended Advertising Data (Octet 36 - Bit 3)
          LE Set Extended Scan Response Data (Octet 36 - Bit 4)
          LE Set Extended Advertising Enable (Octet 36 - Bit 5)
          LE Read Maximum Advertising Data Length (Octet 36 - Bit 6)
          LE Read Number of Supported Advertising Sets (Octet 36 - Bit 7)
          LE Remove Advertising Set (Octet 37 - Bit 0)
          LE Clear Advertising Sets (Octet 37 - Bit 1)
          LE Set Periodic Advertising Parameters (Octet 37 - Bit 2)
          LE Set Periodic Advertising Data (Octet 37 - Bit 3)
          LE Set Periodic Advertising Enable (Octet 37 - Bit 4)
          LE Set Extended Scan Parameters (Octet 37 - Bit 5)
          LE Set Extended Scan Enable (Octet 37 - Bit 6)
          LE Extended Create Connection (Octet 37 - Bit 7)
          LE Periodic Advertising Create Sync (Octet 38 - Bit 0)
          LE Periodic Advertising Create Sync Cancel (Octet 38 - Bit 1)
          LE Periodic Advertising Terminate Sync (Octet 38 - Bit 2)
          LE Add Device To Periodic Advertiser List (Octet 38 - Bit 3)
          LE Remove Device From Periodic Advertiser List (Octet 38 - Bit 4)
          LE Clear Periodic Advertiser List (Octet 38 - Bit 5)
          LE Read Periodic Advertiser List Size (Octet 38 - Bit 6)
          LE Read Transmit Power (Octet 38 - Bit 7)
          LE Read RF Path Compensation (Octet 39 - Bit 0)
          LE Write RF Path Compensation (Octet 39 - Bit 1)
          LE Set Privacy Mode (Octet 39 - Bit 2)
          LE Periodic Advertising Receive Enable (Octet 40 - Bit 5)
          LE Periodic Advertising Sync Transfer (Octet 40 - Bit 6)
          LE Periodic Advertising Set Info Transfer (Octet 40 - Bit 7)
          LE Periodic Advertising Sync Transfer Parameters (Octet 41 - Bit 0)
          LE Set Default Periodic Advertisng Sync Transfer Parameters (Octet 41 - Bit 1)
          LE Read Buffer v2 (Octet 41 - Bit 5)
          LE Read ISO TX Sync (Octet 41 - Bit 6)
          LE Set Connected Isochronous Group Parameters (Octet 41 - Bit 7)
          LE Set Connected Isochronous Group Parameters Test (Octet 42 - Bit 0)
          LE Create Connected Isochronous Stream (Octet 42 - Bit 1)
          LE Remove Connected Isochronous Group (Octet 42 - Bit 2)
          LE Accept Connected Isochronous Stream Request (Octet 42 - Bit 3)
          LE Reject Connected Isochronous Stream Request (Octet 42 - Bit 4)
          LE Create Broadcast Isochronous Group (Octet 42 - Bit 5)
          LE Create Broadcast Isochronous Group Test (Octet 42 - Bit 6)
          LE Terminate Broadcast Isochronous Group (Octet 42 - Bit 7)
          LE Broadcast Isochronous Group Create Sync (Octet 43 - Bit 0)
          LE Broadcast Isochronous Group Terminate Sync (Octet 43 - Bit 1)
          LE Request Peer SCA (Octet 43 - Bit 2)
          LE Setup Isochronous Data Path (Octet 43 - Bit 3)
          LE Remove Isochronous Data Path (Octet 43 - Bit 4)
          LE Isochronous Transmit Test (Octet 43 - Bit 5)
          LE Isochronous Receive Test (Octet 43 - Bit 6)
          LE Isochronous Read Test Counters (Octet 43 - Bit 7)
          LE Isochronous Read Test Counters (Octet 44 - Bit 0)
          LE Set Host Feature (Octet 44 - Bit 1)
          Octet 44 - Bit 2 
          Octet 45 - Bit 6 
          Octet 46 - Bit 0 
          Octet 46 - Bit 1 
          Octet 46 - Bit 2 
          Octet 47 - Bit 4 
< HCI Command: Host Buffer Size (0x03|0x0033) plen 7         #9 [hci1] 1.140799
        ACL MTU: 255  ACL max packet: 16
        SCO MTU: 0    SCO max packet: 0
> HCI Event: Command Complete (0x0e) plen 4                 #10 [hci1] 1.141272
      Host Buffer Size (0x03|0x0033) ncmd 1
        Status: Success (0x00)
< HCI Command: Set Controller To Ho.. (0x03|0x0031) plen 1  #11 [hci1] 1.160779
        Flow control: ACL Data Packets (0x01)
> HCI Event: Command Complete (0x0e) plen 4                 #12 [hci1] 1.161256
      Set Controller To Host Flow Control (0x03|0x0031) ncmd 1
        Status: Success (0x00)
< HCI Command: LE Read Local Suppor.. (0x08|0x0003) plen 0  #13 [hci1] 1.180787
> HCI Event: Command Complete (0x0e) plen 12                #14 [hci1] 1.181269
      LE Read Local Supported Features (0x08|0x0003) ncmd 1
        Status: Success (0x00)
        Features: 0xfd 0x79 0x00 0xf7 0x30 0x01 0x00 0x00
          LE Encryption
          Extended Reject Indication
          Peripheral-initiated Features Exchange
          LE Ping
          LE Data Packet Length Extension
          LL Privacy
          Extended Scanner Filter Policies
          LE 2M PHY
          LE Coded PHY
          LE Extended Advertising
          LE Periodic Advertising
          Channel Selection Algorithm #2
          Periodic Advertising Sync Transfer - Sender
          Periodic Advertising Sync Transfer - Recipient
          Sleep Clock Accuracy Updates
          Connected Isochronous Stream - Central
          Connected Isochronous Stream - Peripheral
          Isochronous Broadcaster
          Synchronized Receiver
          Periodic Advertising ADI support
          Connection Subrating
          Unknown features (0x0000010000000000)
< HCI Command: LE Set Host Feature (0x08|0x0074) plen 2     #15 [hci1] 1.200822
        Bit Number: 32
          Connected Isochronous Stream (Host Support)
        Bit Value: 1
> HCI Event: Command Complete (0x0e) plen 4                 #16 [hci1] 1.201315
      LE Set Host Feature (0x08|0x0074) ncmd 1
        Status: Success (0x00)
< HCI Command: LE Read Buffer v2 (0x08|0x0060) plen 0       #17 [hci1] 1.220821
> HCI Event: Command Complete (0x0e) plen 10                #18 [hci1] 1.221324
      LE Read Buffer v2 (0x08|0x0060) ncmd 1
        Status: Success (0x00)
        ACL MTU: 27
        ACL max packet: 3
        ISO MTU: 318
        ISO max packet: 3
< HCI Command: LE Read Maximum Adve.. (0x08|0x003a) plen 0  #19 [hci1] 1.240857
> HCI Event: Command Complete (0x0e) plen 6                 #20 [hci1] 1.241322
      LE Read Maximum Advertising Data Length (0x08|0x003a) ncmd 1
        Status: Success (0x00)
        Max length: 1650
< HCI Command: LE Read Supported St.. (0x08|0x001c) plen 0  #21 [hci1] 1.260794
> HCI Event: Command Complete (0x0e) plen 12                #22 [hci1] 1.261252
      LE Read Supported States (0x08|0x001c) ncmd 1
        Status: Success (0x00)
        States: 0x000003ff3e0306ff
          Non-connectable Advertising State
          Scannable Advertising State
          Connectable Advertising State
          High Duty Cycle Directed Advertising State
          Passive Scanning State
          Active Scanning State
          Initiating State
            and Connection State (Central Role)
          Connection State (Peripheral Role)
          Scannable Advertising State
            and Passive Scanning State
          Connectable Advertising State
            and Passive Scanning State
          Non-connectable Advertising State
            and Initiating State
          Scannable Advertising State
            and Initiating State
          Active Scanning State
            and Connection State (Central Role)
          Passive Scanning State
            and Connection State (Peripheral Role)
          Active Scanning State
            and Connection State (Peripheral Role)
          Initiating State
            and Connection State (Central Role)
            and Central Role & Central Role
          Low Duty Cycle Directed Advertising State
          Connectable Advertising State
            and Initiating State
            and Central Role & Peripheral Role
          High Duty Cycle Directed Advertising State
            and Initiating State
            and Central Role & Peripheral Role
          Low Duty Cycle Directed Advertising State
            and Initiating State
            and Central Role & Peripheral Role
          Connectable Advertising State
            and Connection State (Central Role)
            and Central Role & Peripheral Role
          High Duty Cycle Directed Advertising State
            and Connection State (Central Role)
            and Central Role & Peripheral Role
          Low Duty Cycle Directed Advertising State
            and Connection State (Central Role)
            and Central Role & Peripheral Role
          Connectable Advertising State
            and Connection State (Peripheral Role)
            and Central Role & Peripheral Role
          High Duty Cycle Directed Advertising State
            and Connection State (Peripheral Role)
            and Peripheral Role & Peripheral Role
          Low Duty Cycle Directed Advertising State
            and Connection State (Peripheral Role)
            and Peripheral Role & Peripheral Role
          Initiating State
            and Connection State (Peripheral Role)
            and Central Role & Peripheral Role
< HCI Command: LE Read Maximum Data.. (0x08|0x002f) plen 0  #23 [hci1] 1.280797
> HCI Event: Command Complete (0x0e) plen 12                #24 [hci1] 1.281292
      LE Read Maximum Data Length (0x08|0x002f) ncmd 1
        Status: Success (0x00)
        Max TX octets: 251
        Max TX time: 2704
        Max RX octets: 251
        Max RX time: 2704
< HCI Command: LE Write Suggested D.. (0x08|0x0024) plen 4  #25 [hci1] 1.300823
        TX octets: 251
        TX time: 2704
> HCI Event: Command Complete (0x0e) plen 4                 #26 [hci1] 1.301327
      LE Write Suggested Default Data Length (0x08|0x0024) ncmd 1
        Status: Success (0x00)
< HCI Command: LE Read Resolving Li.. (0x08|0x002a) plen 0  #27 [hci1] 1.320817
> HCI Event: Command Complete (0x0e) plen 5                 #28 [hci1] 1.321370
      LE Read Resolving List Size (0x08|0x002a) ncmd 1
        Status: Success (0x00)
        Size: 8
< HCI Command: LE Set Host Feature (0x08|0x0074) plen 2     #29 [hci1] 1.340836
        Bit Number: 38
          Connection Subrating (Host Support)
        Bit Value: 1
> HCI Event: Command Complete (0x0e) plen 4                 #30 [hci1] 1.341324
      LE Set Host Feature (0x08|0x0074) ncmd 1
        Status: Success (0x00)
< HCI Command: LE Set Event Mask (0x08|0x0001) plen 8       #31 [hci1] 1.360797
        Mask: 0x000002063f87fa5e
          LE Advertising Report
          LE Connection Update Complete
          LE Read Remote Used Features Complete
          LE Long Term Key Request
          LE Data Length Change
          LE Enhanced Connection Complete
          LE PHY Update Complete
          LE Extended Advertising Report
          LE Periodic Advertising Sync Established
          LE Periodic Advertising Report
          LE Periodic Advertising Sync Lost
          LE Extended Scan Timeout
          LE Extended Advertising Set Terminated
          LE Scan Request Received
          LE Periodic Advertising Sync Transfer Rvc
          LE CIS Established
          LE CIS Request
          LE Create BIG Complete
          LE Terminate BIG Complete
          LE BIG Sync Estabilished Complete
          LE BIG Sync Lost
          LE BIG Info Advertising Report
          LE Subrate Change
          Unknown mask (0x0000020000000000)
> HCI Event: Command Complete (0x0e) plen 4                 #32 [hci1] 1.361357
      LE Set Event Mask (0x08|0x0001) ncmd 1
        Status: Success (0x00)
< HCI Command: Set Event Mask (0x03|0x0001) plen 8          #33 [hci1] 1.380819
        Mask: 0x2000800002008890
          Disconnection Complete
          Encryption Change
          Read Remote Version Information Complete
          Hardware Error
          Data Buffer Overflow
          Encryption Key Refresh Complete
          LE Meta
> HCI Event: Command Complete (0x0e) plen 4                 #34 [hci1] 1.381372
      Set Event Mask (0x03|0x0001) ncmd 1
        Status: Success (0x00)
< HCI Command: Read BD ADDR (0x04|0x0009) plen 0            #35 [hci1] 1.400828
> HCI Event: Command Complete (0x0e) plen 10                #36 [hci1] 1.401324
      Read BD ADDR (0x04|0x0009) ncmd 1
        Status: Success (0x00)
        Address: 00:00:00:00:00:00 (OUI 00-00-00)
< HCI Command: LE Set Random Address (0x08|0x0005) plen 6   #37 [hci1] 1.420810
        Address: D5:B6:CC:31:DB:3B (Static)
> HCI Event: Command Complete (0x0e) plen 4                 #38 [hci1] 1.421382
      LE Set Random Address (0x08|0x0005) ncmd 1
        Status: Success (0x00)
< HCI Command: LE Set Extended Adv.. (0x08|0x0036) plen 25  #39 [hci1] 7.130946
        Handle: 0x00
        Properties: 0x0013
          Connectable
          Scannable
          Use legacy advertising PDUs: ADV_IND
        Min advertising interval: 100.000 msec (0x00a0)
        Max advertising interval: 150.000 msec (0x00f0)
        Channel map: 37, 38, 39 (0x07)
        Own address type: Random (0x01)
        Peer address type: Public (0x00)
        Peer address: 00:00:00:00:00:00 (OUI 00-00-00)
        Filter policy: Allow Scan Request from Any, Allow Connect Request from Any (0x00)
        TX power: Host has no preference (0x7f)
        Primary PHY: LE 1M (0x01)
        Secondary max skip: 0x00
        Secondary PHY: LE 1M (0x01)
        SID: 0x00
        Scan request notifications: Disabled (0x00)
> HCI Event: Command Complete (0x0e) plen 5                 #40 [hci1] 7.131824
      LE Set Extended Advertising Parameters (0x08|0x0036) ncmd 1
        Status: Success (0x00)
        TX power (selected): 0 dbm (0x00)
< HCI Command: LE Set Advertising S.. (0x08|0x0035) plen 7  #41 [hci1] 7.140923
        Advertising handle: 0x00
        Advertising random address: D5:B6:CC:31:DB:3B (Static)
> HCI Event: Command Complete (0x0e) plen 4                 #42 [hci1] 7.141425
      LE Set Advertising Set Random Address (0x08|0x0035) ncmd 1
        Status: Success (0x00)
< HCI Command: LE Set Extended Adv.. (0x08|0x0037) plen 22  #43 [hci1] 7.160905
        Handle: 0x00
        Operation: Complete extended advertising data (0x03)
        Fragment preference: Minimize fragmentation (0x01)
        Data length: 0x12
        Flags: 0x06
          LE General Discoverable Mode
          BR/EDR Not Supported
        Name (complete): Tester_F6B11A
> HCI Event: Command Complete (0x0e) plen 4                 #44 [hci1] 7.161591
      LE Set Extended Advertising Data (0x08|0x0037) ncmd 1
        Status: Success (0x00)
< HCI Command: LE Set Extended Scan.. (0x08|0x0038) plen 4  #45 [hci1] 7.180872
        Handle: 0x00
        Operation: Complete scan response data (0x03)
        Fragment preference: Minimize fragmentation (0x01)
        Data length: 0x00
> HCI Event: Command Complete (0x0e) plen 4                 #46 [hci1] 7.181336
      LE Set Extended Scan Response Data (0x08|0x0038) ncmd 1
        Status: Success (0x00)
< HCI Command: LE Set Extended Adve.. (0x08|0x0039) plen 6  #47 [hci1] 7.200946
        Extended advertising: Enabled (0x01)
        Number of sets: 1 (0x01)
        Entry 0
          Handle: 0x00
          Duration: 0 ms (0x00)
          Max ext adv events: 0
> HCI Event: Command Complete (0x0e) plen 4                 #48 [hci1] 7.201593
      LE Set Extended Advertising Enable (0x08|0x0039) ncmd 1
        Status: Success (0x00)
> HCI Event: LE Meta Event (0x3e) plen 31                   #49 [hci1] 7.636922
      LE Enhanced Connection Complete (0x0a)
        Status: Success (0x00)
        Handle: 1605
        Role: Peripheral (0x01)
        Peer address type: Public (0x00)
        Peer address: DF:A9:FF:F6:B1:1A (OUI DF-A9-FF)
        Local resolvable private address: 00:00:00:00:00:00 (Non-Resolvable)
        Peer resolvable private address: 00:00:00:00:00:00 (Non-Resolvable)
        Connection interval: 87.50 msec (0x0046)
        Connection latency: 0 (0x0000)
        Supervision timeout: 20000 msec (0x07d0)
        Central clock accuracy: 0x01
> HCI Event: LE Meta Event (0x3e) plen 6                    #50 [hci1] 7.636968
      LE Advertising Set Terminated (0x12)
        Status: Success (0x00)
        Handle: 0
        Connection handle: 1605
        Number of completed extended advertising events: 0
< HCI Command: LE Read Remote Used... (0x08|0x0016) plen 2  #51 [hci1] 7.641263
        Handle: 1605 Address: DF:A9:FF:F6:B1:1A (OUI DF-A9-FF)
> HCI Event: Command Status (0x0f) plen 4                   #52 [hci1] 7.641750
      LE Read Remote Used Features (0x08|0x0016) ncmd 1
        Status: Success (0x00)
> HCI Event: LE Meta Event (0x3e) plen 12                   #53 [hci1] 7.900761
      LE Read Remote Used Features (0x04)
        Status: Success (0x00)
        Handle: 1605 Address: DF:A9:FF:F6:B1:1A (OUI DF-A9-FF)
        Features: 0x2d 0x49 0x00 0xf7 0x67 0xd9 0x00 0x80
          LE Encryption
          Extended Reject Indication
          Peripheral-initiated Features Exchange
          LE Data Packet Length Extension
          LE 2M PHY
          LE Coded PHY
          Channel Selection Algorithm #2
          Periodic Advertising Sync Transfer - Sender
          Periodic Advertising Sync Transfer - Recipient
          Sleep Clock Accuracy Updates
          Connected Isochronous Stream - Central
          Connected Isochronous Stream - Peripheral
          Isochronous Broadcaster
          Synchronized Receiver
          Connected Isochronous Stream (Host Support)
          LE Power Control Request
          LE Power Control Request
          Connection Subrating
          Connection Subrating (Host Support)
          Unknown features (0x8000d90000000000)
> ACL Data RX: Handle 1605 flags 0x02 dlen 11               #54 [hci1] 8.863188
      ATT: Read By Type Request (0x08) len 6
        Handle range: 0x0001-0xffff
        Attribute type: Characteristic (0x2803)
< HCI Command: Host Number of Compl.. (0x03|0x0035) plen 5  #55 [hci1] 8.881146
        Num handles: 1
        Handle: 1605 Address: DF:A9:FF:F6:B1:1A (OUI DF-A9-FF)
        Count: 1
< ACL Data TX: Handle 1605 flags 0x00 dlen 20               #56 [hci1] 8.881253
      ATT: Read By Type Response (0x09) len 15
        Attribute data length: 7
        Attribute data list: 2 entries
        Handle: 0x0002
        Value: 200300052a
            Properties: 0x20
              Indicate (0x20)
            Value Handle: 0x0003
            Value UUID: Service Changed (0x2a05)
        Handle: 0x0005
        Value: 0a0600292b
            Properties: 0x0a
              Read (0x02)
              Write (0x08)
            Value Handle: 0x0006
            Value UUID: Client Supported Features (0x2b29)
> HCI Event: Number of Completed Packets (0x13) plen 5      #57 [hci1] 9.037968
        Num handles: 1
        Handle: 1605 Address: DF:A9:FF:F6:B1:1A (OUI DF-A9-FF)
        Count: 1
        #56: len 20 (1 Kb/s)
        Latency: 156 msec (156-156 msec ~156 msec)
> ACL Data RX: Handle 1605 flags 0x02 dlen 11               #58 [hci1] 9.038438
      ATT: Read By Type Request (0x08) len 6
        Handle range: 0x0006-0xffff
        Attribute type: Characteristic (0x2803)
< HCI Command: Host Number of Compl.. (0x03|0x0035) plen 5  #59 [hci1] 9.041045
        Num handles: 1
        Handle: 1605 Address: DF:A9:FF:F6:B1:1A (OUI DF-A9-FF)
        Count: 1
< ACL Data TX: Handle 1605 flags 0x00 dlen 20               #60 [hci1] 9.041074
      ATT: Read By Type Response (0x09) len 15
        Attribute data length: 7
        Attribute data list: 2 entries
        Handle: 0x0007
        Value: 0208002a2b
            Properties: 0x02
              Read (0x02)
            Value Handle: 0x0008
            Value UUID: Database Hash (0x2b2a)
        Handle: 0x0009
        Value: 020a003a2b
            Properties: 0x02
              Read (0x02)
            Value Handle: 0x000a
            Value UUID: Server Supported Features (0x2b3a)
> HCI Event: Number of Completed Packets (0x13) plen 5      #61 [hci1] 9.213023
        Num handles: 1
        Handle: 1605 Address: DF:A9:FF:F6:B1:1A (OUI DF-A9-FF)
        Count: 1
        #60: len 20 (0 Kb/s)
        Latency: 171 msec (156-171 msec ~164 msec)
> ACL Data RX: Handle 1605 flags 0x02 dlen 11               #62 [hci1] 9.213273
      ATT: Read By Type Request (0x08) len 6
        Handle range: 0x000a-0xffff
        Attribute type: Characteristic (0x2803)
< HCI Command: Host Number of Compl.. (0x03|0x0035) plen 5  #63 [hci1] 9.221512
        Num handles: 1
        Handle: 1605 Address: DF:A9:FF:F6:B1:1A (OUI DF-A9-FF)
        Count: 1
< ACL Data TX: Handle 1605 flags 0x00 dlen 20               #64 [hci1] 9.221592
      ATT: Read By Type Response (0x09) len 15
        Attribute data length: 7
        Attribute data list: 2 entries
        Handle: 0x000c
        Value: 0a0d00002a
            Properties: 0x0a
              Read (0x02)
              Write (0x08)
            Value Handle: 0x000d
            Value UUID: Device Name (0x2a00)
        Handle: 0x000e
        Value: 0a0f00012a
            Properties: 0x0a
              Read (0x02)
              Write (0x08)
            Value Handle: 0x000f
            Value UUID: Appearance (0x2a01)
> HCI Event: Number of Completed Packets (0x13) plen 5      #65 [hci1] 9.387995
        Num handles: 1
        Handle: 1605 Address: DF:A9:FF:F6:B1:1A (OUI DF-A9-FF)
        Count: 1
        #64: len 20 (0 Kb/s)
        Latency: 166 msec (156-171 msec ~165 msec)
> ACL Data RX: Handle 1605 flags 0x02 dlen 11               #66 [hci1] 9.388297
      ATT: Read By Type Request (0x08) len 6
        Handle range: 0x000f-0xffff
        Attribute type: Characteristic (0x2803)
< HCI Command: Host Number of Compl.. (0x03|0x0035) plen 5  #67 [hci1] 9.401520
        Num handles: 1
        Handle: 1605 Address: DF:A9:FF:F6:B1:1A (OUI DF-A9-FF)
        Count: 1
< ACL Data TX: Handle 1605 flags 0x00 dlen 20               #68 [hci1] 9.401577
      ATT: Read By Type Response (0x09) len 15
        Attribute data length: 7
        Attribute data list: 2 entries
        Handle: 0x0010
        Value: 021100042a
            Properties: 0x02
              Read (0x02)
            Value Handle: 0x0011
            Value UUID: Peripheral Preferred Connection Parameters (0x2a04)
        Handle: 0x0013
        Value: 021400242a
            Properties: 0x02
              Read (0x02)
            Value Handle: 0x0014
            Value UUID: Model Number String (0x2a24)
> HCI Event: Number of Completed Packets (0x13) plen 5      #69 [hci1] 9.563034
        Num handles: 1
        Handle: 1605 Address: DF:A9:FF:F6:B1:1A (OUI DF-A9-FF)
        Count: 1
        #68: len 20 (0 Kb/s)
        Latency: 161 msec (156-171 msec ~163 msec)
> ACL Data RX: Handle 1605 flags 0x02 dlen 11               #70 [hci1] 9.563247
      ATT: Read By Type Request (0x08) len 6
        Handle range: 0x0014-0xffff
        Attribute type: Characteristic (0x2803)
< HCI Command: Host Number of Compl.. (0x03|0x0035) plen 5  #71 [hci1] 9.581065
        Num handles: 1
        Handle: 1605 Address: DF:A9:FF:F6:B1:1A (OUI DF-A9-FF)
        Count: 1
< ACL Data TX: Handle 1605 flags 0x00 dlen 20               #72 [hci1] 9.581106
      ATT: Read By Type Response (0x09) len 15
        Attribute data length: 7
        Attribute data list: 2 entries
        Handle: 0x0015
        Value: 021600292a
            Properties: 0x02
              Read (0x02)
            Value Handle: 0x0016
            Value UUID: Manufacturer Name String (0x2a29)
        Handle: 0x0017
        Value: 021800502a
            Properties: 0x02
              Read (0x02)
            Value Handle: 0x0018
            Value UUID: PnP ID (0x2a50)
> HCI Event: Number of Completed Packets (0x13) plen 5      #73 [hci1] 9.738020
        Num handles: 1
        Handle: 1605 Address: DF:A9:FF:F6:B1:1A (OUI DF-A9-FF)
        Count: 1
        #72: len 20 (1 Kb/s)
        Latency: 156 msec (156-171 msec ~160 msec)
> ACL Data RX: Handle 1605 flags 0x02 dlen 11               #74 [hci1] 9.738260
      ATT: Read By Type Request (0x08) len 6
        Handle range: 0x0018-0xffff
        Attribute type: Characteristic (0x2803)
< HCI Command: Host Number of Compl.. (0x03|0x0035) plen 5  #75 [hci1] 9.741185
        Num handles: 1
        Handle: 1605 Address: DF:A9:FF:F6:B1:1A (OUI DF-A9-FF)
        Count: 1
< ACL Data TX: Handle 1605 flags 0x00 dlen 20               #76 [hci1] 9.741233
      ATT: Read By Type Response (0x09) len 15
        Attribute data length: 7
        Attribute data list: 2 entries
        Handle: 0x0019
        Value: 021a00252a
            Properties: 0x02
              Read (0x02)
            Value Handle: 0x001a
            Value UUID: Serial Number String (0x2a25)
        Handle: 0x001b
        Value: 021c00262a
            Properties: 0x02
              Read (0x02)
            Value Handle: 0x001c
            Value UUID: Firmware Revision String (0x2a26)
> HCI Event: Number of Completed Packets (0x13) plen 5      #77 [hci1] 9.913063
        Num handles: 1
        Handle: 1605 Address: DF:A9:FF:F6:B1:1A (OUI DF-A9-FF)
        Count: 1
        #76: len 20 (0 Kb/s)
        Latency: 171 msec (156-171 msec ~165 msec)
> ACL Data RX: Handle 1605 flags 0x02 dlen 11               #78 [hci1] 9.913185
      ATT: Read By Type Request (0x08) len 6
        Handle range: 0x001c-0xffff
        Attribute type: Characteristic (0x2803)
< HCI Command: Host Number of Compl.. (0x03|0x0035) plen 5  #79 [hci1] 9.921061
        Num handles: 1
        Handle: 1605 Address: DF:A9:FF:F6:B1:1A (OUI DF-A9-FF)
        Count: 1
< ACL Data TX: Handle 1605 flags 0x00 dlen 20               #80 [hci1] 9.921120
      ATT: Read By Type Response (0x09) len 15
        Attribute data length: 7
        Attribute data list: 2 entries
        Handle: 0x001d
        Value: 021e00272a
            Properties: 0x02
              Read (0x02)
            Value Handle: 0x001e
            Value UUID: Hardware Revision String (0x2a27)
        Handle: 0x001f
        Value: 022000282a
            Properties: 0x02
              Read (0x02)
            Value Handle: 0x0020
            Value UUID: Software Revision String (0x2a28)
> HCI Event: Number of Completed Packets (0x13) plen 5     #81 [hci1] 10.087961
        Num handles: 1
        Handle: 1605 Address: DF:A9:FF:F6:B1:1A (OUI DF-A9-FF)
        Count: 1
        #80: len 20 (0 Kb/s)
        Latency: 166 msec (156-171 msec ~166 msec)
> ACL Data RX: Handle 1605 flags 0x02 dlen 11              #82 [hci1] 10.088244
      ATT: Read By Type Request (0x08) len 6
        Handle range: 0x0020-0xffff
        Attribute type: Characteristic (0x2803)
< HCI Command: Host Number of Comp.. (0x03|0x0035) plen 5  #83 [hci1] 10.101504
        Num handles: 1
        Handle: 1605 Address: DF:A9:FF:F6:B1:1A (OUI DF-A9-FF)
        Count: 1
< ACL Data TX: Handle 1605 flags 0x00 dlen 20              #84 [hci1] 10.101659
      ATT: Read By Type Response (0x09) len 15
        Attribute data length: 7
        Attribute data list: 2 entries
        Handle: 0x0021
        Value: 022200ff2b
            Properties: 0x02
              Read (0x02)
            Value Handle: 0x0022
            Value UUID: Unknown (0x2bff)
        Handle: 0x0023
        Value: 022400232a
            Properties: 0x02
              Read (0x02)
            Value Handle: 0x0024
            Value UUID: System ID (0x2a23)
> HCI Event: Number of Completed Packets (0x13) plen 5     #85 [hci1] 10.262992
        Num handles: 1
        Handle: 1605 Address: DF:A9:FF:F6:B1:1A (OUI DF-A9-FF)
        Count: 1
        #84: len 20 (0 Kb/s)
        Latency: 161 msec (156-171 msec ~163 msec)
> ACL Data RX: Handle 1605 flags 0x02 dlen 11              #86 [hci1] 10.263220
      ATT: Read By Type Request (0x08) len 6
        Handle range: 0x0024-0xffff
        Attribute type: Characteristic (0x2803)
< HCI Command: Host Number of Comp.. (0x03|0x0035) plen 5  #87 [hci1] 10.281148
        Num handles: 1
        Handle: 1605 Address: DF:A9:FF:F6:B1:1A (OUI DF-A9-FF)
        Count: 1
< ACL Data TX: Handle 1605 flags 0x00 dlen 20              #88 [hci1] 10.281176
      ATT: Read By Type Response (0x09) len 15
        Attribute data length: 7
        Attribute data list: 2 entries
        Handle: 0x0025
        Value: 0226002a2a
            Properties: 0x02
              Read (0x02)
            Value Handle: 0x0026
            Value UUID: IEEE 11073-20601 Regulatory Cert. Data List (0x2a2a)
        Handle: 0x0028
        Value: 0a290050aa
            Properties: 0x0a
              Read (0x02)
              Write (0x08)
            Value Handle: 0x0029
            Value UUID: Unknown (0xaa50)
> HCI Event: Number of Completed Packets (0x13) plen 5     #89 [hci1] 10.438050
        Num handles: 1
        Handle: 1605 Address: DF:A9:FF:F6:B1:1A (OUI DF-A9-FF)
        Count: 1
        #88: len 20 (1 Kb/s)
        Latency: 156 msec (156-171 msec ~160 msec)
> ACL Data RX: Handle 1605 flags 0x02 dlen 11              #90 [hci1] 10.438204
      ATT: Read By Type Request (0x08) len 6
        Handle range: 0x0029-0xffff
        Attribute type: Characteristic (0x2803)
< HCI Command: Host Number of Comp.. (0x03|0x0035) plen 5  #91 [hci1] 10.441447
        Num handles: 1
        Handle: 1605 Address: DF:A9:FF:F6:B1:1A (OUI DF-A9-FF)
        Count: 1
< ACL Data TX: Handle 1605 flags 0x00 dlen 20              #92 [hci1] 10.441606
      ATT: Read By Type Response (0x09) len 15
        Attribute data length: 7
        Attribute data list: 2 entries
        Handle: 0x002a
        Value: 0a2b0051aa
            Properties: 0x0a
              Read (0x02)
              Write (0x08)
            Value Handle: 0x002b
            Value UUID: Unknown (0xaa51)
        Handle: 0x002c
        Value: 0a2d0052aa
            Properties: 0x0a
              Read (0x02)
              Write (0x08)
            Value Handle: 0x002d
            Value UUID: Unknown (0xaa52)
> HCI Event: Number of Completed Packets (0x13) plen 5     #93 [hci1] 10.613072
        Num handles: 1
        Handle: 1605 Address: DF:A9:FF:F6:B1:1A (OUI DF-A9-FF)
        Count: 1
        #92: len 20 (0 Kb/s)
        Latency: 171 msec (156-171 msec ~165 msec)
> ACL Data RX: Handle 1605 flags 0x02 dlen 11              #94 [hci1] 10.613255
      ATT: Read By Type Request (0x08) len 6
        Handle range: 0x002d-0xffff
        Attribute type: Characteristic (0x2803)
< HCI Command: Host Number of Comp.. (0x03|0x0035) plen 5  #95 [hci1] 10.621213
        Num handles: 1
        Handle: 1605 Address: DF:A9:FF:F6:B1:1A (OUI DF-A9-FF)
        Count: 1
< ACL Data TX: Handle 1605 flags 0x00 dlen 20              #96 [hci1] 10.621250
      ATT: Read By Type Response (0x09) len 15
        Attribute data length: 7
        Attribute data list: 2 entries
        Handle: 0x002e
        Value: 0a2f0053aa
            Properties: 0x0a
              Read (0x02)
              Write (0x08)
            Value Handle: 0x002f
            Value UUID: Unknown (0xaa53)
        Handle: 0x0030
        Value: 3a310054aa
            Properties: 0x3a
              Read (0x02)
              Write (0x08)
              Notify (0x10)
              Indicate (0x20)
            Value Handle: 0x0031
            Value UUID: Unknown (0xaa54)
> HCI Event: Number of Completed Packets (0x13) plen 5     #97 [hci1] 10.788015
        Num handles: 1
        Handle: 1605 Address: DF:A9:FF:F6:B1:1A (OUI DF-A9-FF)
        Count: 1
        #96: len 20 (0 Kb/s)
        Latency: 166 msec (156-171 msec ~166 msec)
> ACL Data RX: Handle 1605 flags 0x02 dlen 11              #98 [hci1] 10.788147
      ATT: Read By Type Request (0x08) len 6
        Handle range: 0x0031-0xffff
        Attribute type: Characteristic (0x2803)
< HCI Command: Host Number of Comp.. (0x03|0x0035) plen 5  #99 [hci1] 10.801235
        Num handles: 1
        Handle: 1605 Address: DF:A9:FF:F6:B1:1A (OUI DF-A9-FF)
        Count: 1
< ACL Data TX: Handle 1605 flags 0x00 dlen 20             #100 [hci1] 10.801276
      ATT: Read By Type Response (0x09) len 15
        Attribute data length: 7
        Attribute data list: 2 entries
        Handle: 0x0033
        Value: 3a340055aa
            Properties: 0x3a
              Read (0x02)
              Write (0x08)
              Notify (0x10)
              Indicate (0x20)
            Value Handle: 0x0034
            Value UUID: Unknown (0xaa55)
        Handle: 0x0036
        Value: 06370056aa
            Properties: 0x06
              Read (0x02)
              Write Without Response (0x04)
            Value Handle: 0x0037
            Value UUID: Unknown (0xaa56)
> HCI Event: Number of Completed Packets (0x13) plen 5    #101 [hci1] 10.963033
        Num handles: 1
        Handle: 1605 Address: DF:A9:FF:F6:B1:1A (OUI DF-A9-FF)
        Count: 1
        #100: len 20 (0 Kb/s)
        Latency: 161 msec (156-171 msec ~164 msec)
> ACL Data RX: Handle 1605 flags 0x02 dlen 11             #102 [hci1] 10.963303
      ATT: Read By Type Request (0x08) len 6
        Handle range: 0x0037-0xffff
        Attribute type: Characteristic (0x2803)
< HCI Command: Host Number of Com.. (0x03|0x0035) plen 5  #103 [hci1] 10.981543
        Num handles: 1
        Handle: 1605 Address: DF:A9:FF:F6:B1:1A (OUI DF-A9-FF)
        Count: 1
< ACL Data TX: Handle 1605 flags 0x00 dlen 20             #104 [hci1] 10.981612
      ATT: Read By Type Response (0x09) len 15
        Attribute data length: 7
        Attribute data list: 2 entries
        Handle: 0x0038
        Value: 06390057aa
            Properties: 0x06
              Read (0x02)
              Write Without Response (0x04)
            Value Handle: 0x0039
            Value UUID: Unknown (0xaa57)
        Handle: 0x003a
        Value: 8a3b0058aa
            Properties: 0x8a
              Read (0x02)
              Write (0x08)
            Unknown fields (0x80)
            Value Handle: 0x003b
            Value UUID: Unknown (0xaa58)
> HCI Event: Number of Completed Packets (0x13) plen 5    #105 [hci1] 11.137939
        Num handles: 1
        Handle: 1605 Address: DF:A9:FF:F6:B1:1A (OUI DF-A9-FF)
        Count: 1
        #104: len 20 (1 Kb/s)
        Latency: 156 msec (156-171 msec ~160 msec)
> ACL Data RX: Handle 1605 flags 0x02 dlen 11             #106 [hci1] 11.138278
      ATT: Read By Type Request (0x08) len 6
        Handle range: 0x003b-0xffff
        Attribute type: Characteristic (0x2803)
< HCI Command: Host Number of Com.. (0x03|0x0035) plen 5  #107 [hci1] 11.141176
        Num handles: 1
        Handle: 1605 Address: DF:A9:FF:F6:B1:1A (OUI DF-A9-FF)
        Count: 1
< ACL Data TX: Handle 1605 flags 0x00 dlen 20             #108 [hci1] 11.141218
      ATT: Read By Type Response (0x09) len 15
        Attribute data length: 7
        Attribute data list: 2 entries
        Handle: 0x003d
        Value: 0a3e0059aa
            Properties: 0x0a
              Read (0x02)
              Write (0x08)
            Value Handle: 0x003e
            Value UUID: Unknown (0xaa59)
        Handle: 0x003f
        Value: 0a40005aaa
            Properties: 0x0a
              Read (0x02)
              Write (0x08)
            Value Handle: 0x0040
            Value UUID: Unknown (0xaa5a)
> HCI Event: Number of Completed Packets (0x13) plen 5    #109 [hci1] 11.313056
        Num handles: 1
        Handle: 1605 Address: DF:A9:FF:F6:B1:1A (OUI DF-A9-FF)
        Count: 1
        #108: len 20 (0 Kb/s)
        Latency: 171 msec (156-171 msec ~166 msec)
> ACL Data RX: Handle 1605 flags 0x02 dlen 11             #110 [hci1] 11.313236
      ATT: Read By Type Request (0x08) len 6
        Handle range: 0x0040-0xffff
        Attribute type: Characteristic (0x2803)
< HCI Command: Host Number of Com.. (0x03|0x0035) plen 5  #111 [hci1] 11.321238
        Num handles: 1
        Handle: 1605 Address: DF:A9:FF:F6:B1:1A (OUI DF-A9-FF)
        Count: 1
< ACL Data TX: Handle 1605 flags 0x00 dlen 27             #112 [hci1] 11.321288
      ATT: Read By Type Response (0x09) len 22
        Attribute data length: 21
        Attribute data list: 1 entry
        Handle: 0x0041
        Value: 0a4200efcdab89674523b10040510450bb00f0
            Properties: 0x0a
              Read (0x02)
              Write (0x08)
            Value Handle: 0x0042
            Value UUID: Vendor specific (f000bb50-0451-4000-b123-456789abcdef)
> HCI Event: Number of Completed Packets (0x13) plen 5    #113 [hci1] 11.487963
        Num handles: 1
        Handle: 1605 Address: DF:A9:FF:F6:B1:1A (OUI DF-A9-FF)
        Count: 1
        #112: len 27 (1 Kb/s)
        Latency: 166 msec (156-171 msec ~166 msec)
> ACL Data RX: Handle 1605 flags 0x02 dlen 11             #114 [hci1] 11.488224
      ATT: Read By Type Request (0x08) len 6
        Handle range: 0x0042-0xffff
        Attribute type: Characteristic (0x2803)
< HCI Command: Host Number of Com.. (0x03|0x0035) plen 5  #115 [hci1] 11.501536
        Num handles: 1
        Handle: 1605 Address: DF:A9:FF:F6:B1:1A (OUI DF-A9-FF)
        Count: 1
< ACL Data TX: Handle 1605 flags 0x00 dlen 20             #116 [hci1] 11.501605
      ATT: Read By Type Response (0x09) len 15
        Attribute data length: 7
        Attribute data list: 2 entries
        Handle: 0x0045
        Value: 0a460050aa
            Properties: 0x0a
              Read (0x02)
              Write (0x08)
            Value Handle: 0x0046
            Value UUID: Unknown (0xaa50)
        Handle: 0x0047
        Value: 0a480051aa
            Properties: 0x0a
              Read (0x02)
              Write (0x08)
            Value Handle: 0x0048
            Value UUID: Unknown (0xaa51)
> HCI Event: Number of Completed Packets (0x13) plen 5    #117 [hci1] 11.663001
        Num handles: 1
        Handle: 1605 Address: DF:A9:FF:F6:B1:1A (OUI DF-A9-FF)
        Count: 1
        #116: len 20 (0 Kb/s)
        Latency: 161 msec (156-171 msec ~163 msec)
> ACL Data RX: Handle 1605 flags 0x02 dlen 11             #118 [hci1] 11.663159
      ATT: Read By Type Request (0x08) len 6
        Handle range: 0x0048-0xffff
        Attribute type: Characteristic (0x2803)
< HCI Command: Host Number of Com.. (0x03|0x0035) plen 5  #119 [hci1] 11.681109
        Num handles: 1
        Handle: 1605 Address: DF:A9:FF:F6:B1:1A (OUI DF-A9-FF)
        Count: 1
< ACL Data TX: Handle 1605 flags 0x00 dlen 20             #120 [hci1] 11.681156
      ATT: Read By Type Response (0x09) len 15
        Attribute data length: 7
        Attribute data list: 2 entries
        Handle: 0x0049
        Value: 0a4a0052aa
            Properties: 0x0a
              Read (0x02)
              Write (0x08)
            Value Handle: 0x004a
            Value UUID: Unknown (0xaa52)
        Handle: 0x004b
        Value: 024c0053aa
            Properties: 0x02
              Read (0x02)
            Value Handle: 0x004c
            Value UUID: Unknown (0xaa53)
> HCI Event: Number of Completed Packets (0x13) plen 5    #121 [hci1] 11.838074
        Num handles: 1
        Handle: 1605 Address: DF:A9:FF:F6:B1:1A (OUI DF-A9-FF)
        Count: 1
        #120: len 20 (1 Kb/s)
        Latency: 156 msec (156-171 msec ~160 msec)
> ACL Data RX: Handle 1605 flags 0x02 dlen 11             #122 [hci1] 11.838250
      ATT: Read By Type Request (0x08) len 6
        Handle range: 0x004c-0xffff
        Attribute type: Characteristic (0x2803)
< HCI Command: Host Number of Com.. (0x03|0x0035) plen 5  #123 [hci1] 11.841326
        Num handles: 1
        Handle: 1605 Address: DF:A9:FF:F6:B1:1A (OUI DF-A9-FF)
        Count: 1
< ACL Data TX: Handle 1605 flags 0x00 dlen 20             #124 [hci1] 11.841441
      ATT: Read By Type Response (0x09) len 15
        Attribute data length: 7
        Attribute data list: 2 entries
        Handle: 0x004e
        Value: 0a4f0055aa
            Properties: 0x0a
              Read (0x02)
              Write (0x08)
            Value Handle: 0x004f
            Value UUID: Unknown (0xaa55)
        Handle: 0x0050
        Value: 0a510056aa
            Properties: 0x0a
              Read (0x02)
              Write (0x08)
            Value Handle: 0x0051
            Value UUID: Unknown (0xaa56)
> HCI Event: Number of Completed Packets (0x13) plen 5    #125 [hci1] 12.012956
        Num handles: 1
        Handle: 1605 Address: DF:A9:FF:F6:B1:1A (OUI DF-A9-FF)
        Count: 1
        #124: len 20 (0 Kb/s)
        Latency: 171 msec (156-171 msec ~165 msec)
> ACL Data RX: Handle 1605 flags 0x02 dlen 11             #126 [hci1] 12.013140
      ATT: Read By Type Request (0x08) len 6
        Handle range: 0x0051-0xffff
        Attribute type: Characteristic (0x2803)
< HCI Command: Host Number of Com.. (0x03|0x0035) plen 5  #127 [hci1] 12.021168
        Num handles: 1
        Handle: 1605 Address: DF:A9:FF:F6:B1:1A (OUI DF-A9-FF)
        Count: 1
< ACL Data TX: Handle 1605 flags 0x00 dlen 9              #128 [hci1] 12.021265
      ATT: Error Response (0x01) len 4
        Read By Type Request (0x08)
        Handle: 0x0051
        Error: Attribute Not Found (0x0a)
> HCI Event: Number of Completed Packets (0x13) plen 5    #129 [hci1] 12.188029
        Num handles: 1
        Handle: 1605 Address: DF:A9:FF:F6:B1:1A (OUI DF-A9-FF)
        Count: 1
        #128: len 9 (0 Kb/s)
        Latency: 166 msec (156-171 msec ~166 msec)
> ACL Data RX: Handle 1605 flags 0x02 dlen 7              #130 [hci1] 12.188070
      ATT: Read Request (0x0a) len 2
        Handle: 0x000a
< HCI Command: Host Number of Com.. (0x03|0x0035) plen 5  #131 [hci1] 12.201236
        Num handles: 1
        Handle: 1605 Address: DF:A9:FF:F6:B1:1A (OUI DF-A9-FF)
        Count: 1
< ACL Data TX: Handle 1605 flags 0x00 dlen 6              #132 [hci1] 12.201277
      ATT: Read Response (0x0b) len 1
> HCI Event: Number of Completed Packets (0x13) plen 5    #133 [hci1] 12.362903
        Num handles: 1
        Handle: 1605 Address: DF:A9:FF:F6:B1:1A (OUI DF-A9-FF)
        Count: 1
        #132: len 6 (0 Kb/s)
        Latency: 161 msec (156-171 msec ~163 msec)
> ACL Data RX: Handle 1605 flags 0x02 dlen 11             #134 [hci1] 12.363189
      ATT: Read By Type Request (0x08) len 6
        Handle range: 0x0001-0xffff
        Attribute type: Characteristic (0x2803)
< HCI Command: Host Number of Com.. (0x03|0x0035) plen 5  #135 [hci1] 12.381438
        Num handles: 1
        Handle: 1605 Address: DF:A9:FF:F6:B1:1A (OUI DF-A9-FF)
        Count: 1
< ACL Data TX: Handle 1605 flags 0x00 dlen 20             #136 [hci1] 12.381606
      ATT: Read By Type Response (0x09) len 15
        Attribute data length: 7
        Attribute data list: 2 entries
        Handle: 0x0002
        Value: 200300052a
            Properties: 0x20
              Indicate (0x20)
            Value Handle: 0x0003
            Value UUID: Service Changed (0x2a05)
        Handle: 0x0005
        Value: 0a0600292b
            Properties: 0x0a
              Read (0x02)
              Write (0x08)
            Value Handle: 0x0006
            Value UUID: Client Supported Features (0x2b29)
> HCI Event: Number of Completed Packets (0x13) plen 5    #137 [hci1] 12.538017
        Num handles: 1
        Handle: 1605 Address: DF:A9:FF:F6:B1:1A (OUI DF-A9-FF)
        Count: 1
        #136: len 20 (1 Kb/s)
        Latency: 156 msec (156-171 msec ~160 msec)
> ACL Data RX: Handle 1605 flags 0x02 dlen 11             #138 [hci1] 12.538200
      ATT: Read By Type Request (0x08) len 6
        Handle range: 0x0006-0xffff
        Attribute type: Characteristic (0x2803)
< HCI Command: Host Number of Com.. (0x03|0x0035) plen 5  #139 [hci1] 12.541414
        Num handles: 1
        Handle: 1605 Address: DF:A9:FF:F6:B1:1A (OUI DF-A9-FF)
        Count: 1
< ACL Data TX: Handle 1605 flags 0x00 dlen 20             #140 [hci1] 12.541499
      ATT: Read By Type Response (0x09) len 15
        Attribute data length: 7
        Attribute data list: 2 entries
        Handle: 0x0007
        Value: 0208002a2b
            Properties: 0x02
              Read (0x02)
            Value Handle: 0x0008
            Value UUID: Database Hash (0x2b2a)
        Handle: 0x0009
        Value: 020a003a2b
            Properties: 0x02
              Read (0x02)
            Value Handle: 0x000a
            Value UUID: Server Supported Features (0x2b3a)
< ACL Data TX: Handle 1605 flags 0x00 dlen 16             #141 [hci1] 12.651023
      LE L2CAP: Connection Parameter Update Request (0x12) ident 1 len 8
        Min interval: 24
        Max interval: 40
        Peripheral latency: 0
        Timeout multiplier: 42
> HCI Event: Number of Completed Packets (0x13) plen 5    #142 [hci1] 12.713016
        Num handles: 1
        Handle: 1605 Address: DF:A9:FF:F6:B1:1A (OUI DF-A9-FF)
        Count: 1
        #140: len 20 (0 Kb/s)
        Latency: 171 msec (156-171 msec ~165 msec)
> ACL Data RX: Handle 1605 flags 0x02 dlen 11             #143 [hci1] 12.713132
      ATT: Read By Type Request (0x08) len 6
        Handle range: 0x000a-0xffff
        Attribute type: Characteristic (0x2803)
< HCI Command: Host Number of Com.. (0x03|0x0035) plen 5  #144 [hci1] 12.721111
        Num handles: 1
        Handle: 1605 Address: DF:A9:FF:F6:B1:1A (OUI DF-A9-FF)
        Count: 1
< ACL Data TX: Handle 1605 flags 0x00 dlen 20             #145 [hci1] 12.721138
      ATT: Read By Type Response (0x09) len 15
        Attribute data length: 7
        Attribute data list: 2 entries
        Handle: 0x000c
        Value: 0a0d00002a
            Properties: 0x0a
              Read (0x02)
              Write (0x08)
            Value Handle: 0x000d
            Value UUID: Device Name (0x2a00)
        Handle: 0x000e
        Value: 0a0f00012a
            Properties: 0x0a
              Read (0x02)
              Write (0x08)
            Value Handle: 0x000f
            Value UUID: Appearance (0x2a01)
> HCI Event: Number of Completed Packets (0x13) plen 5    #146 [hci1] 12.800429
        Num handles: 1
        Handle: 1605 Address: DF:A9:FF:F6:B1:1A (OUI DF-A9-FF)
        Count: 1
        #141: len 16 (0 Kb/s)
        Latency: 149 msec (149-171 msec ~157 msec)
> ACL Data RX: Handle 1605 flags 0x02 dlen 10             #147 [hci1] 12.800513
      LE L2CAP: Connection Parameter Update Response (0x13) ident 1 len 2
        Result: Connection Parameters accepted (0x0000)
< HCI Command: Host Number of Com.. (0x03|0x0035) plen 5  #148 [hci1] 12.801165
        Num handles: 1
        Handle: 1605 Address: DF:A9:FF:F6:B1:1A (OUI DF-A9-FF)
        Count: 1
> HCI Event: Number of Completed Packets (0x13) plen 5    #149 [hci1] 12.888047
        Num handles: 1
        Handle: 1605 Address: DF:A9:FF:F6:B1:1A (OUI DF-A9-FF)
        Count: 1
        #145: len 20 (0 Kb/s)
        Latency: 166 msec (149-171 msec ~162 msec)
> ACL Data RX: Handle 1605 flags 0x02 dlen 11             #150 [hci1] 12.888207
      ATT: Read By Type Request (0x08) len 6
        Handle range: 0x000f-0xffff
        Attribute type: Characteristic (0x2803)
< HCI Command: Host Number of Com.. (0x03|0x0035) plen 5  #151 [hci1] 12.901554
        Num handles: 1
        Handle: 1605 Address: DF:A9:FF:F6:B1:1A (OUI DF-A9-FF)
        Count: 1
< ACL Data TX: Handle 1605 flags 0x00 dlen 20             #152 [hci1] 12.901604
      ATT: Read By Type Response (0x09) len 15
        Attribute data length: 7
        Attribute data list: 2 entries
        Handle: 0x0010
        Value: 021100042a
            Properties: 0x02
              Read (0x02)
            Value Handle: 0x0011
            Value UUID: Peripheral Preferred Connection Parameters (0x2a04)
        Handle: 0x0013
        Value: 021400242a
            Properties: 0x02
              Read (0x02)
            Value Handle: 0x0014
            Value UUID: Model Number String (0x2a24)
> HCI Event: Number of Completed Packets (0x13) plen 5    #153 [hci1] 13.062916
        Num handles: 1
        Handle: 1605 Address: DF:A9:FF:F6:B1:1A (OUI DF-A9-FF)
        Count: 1
        #152: len 20 (0 Kb/s)
        Latency: 161 msec (149-171 msec ~161 msec)
> ACL Data RX: Handle 1605 flags 0x02 dlen 11             #154 [hci1] 13.063132
      ATT: Read By Type Request (0x08) len 6
        Handle range: 0x0014-0xffff
        Attribute type: Characteristic (0x2803)
< HCI Command: Host Number of Com.. (0x03|0x0035) plen 5  #155 [hci1] 13.081114
        Num handles: 1
        Handle: 1605 Address: DF:A9:FF:F6:B1:1A (OUI DF-A9-FF)
        Count: 1
< ACL Data TX: Handle 1605 flags 0x00 dlen 20             #156 [hci1] 13.081133
      ATT: Read By Type Response (0x09) len 15
        Attribute data length: 7
        Attribute data list: 2 entries
        Handle: 0x0015
        Value: 021600292a
            Properties: 0x02
              Read (0x02)
            Value Handle: 0x0016
            Value UUID: Manufacturer Name String (0x2a29)
        Handle: 0x0017
        Value: 021800502a
            Properties: 0x02
              Read (0x02)
            Value Handle: 0x0018
            Value UUID: PnP ID (0x2a50)
> HCI Event: Number of Completed Packets (0x13) plen 5    #157 [hci1] 13.237986
        Num handles: 1
        Handle: 1605 Address: DF:A9:FF:F6:B1:1A (OUI DF-A9-FF)
        Count: 1
        #156: len 20 (1 Kb/s)
        Latency: 156 msec (149-171 msec ~159 msec)
> ACL Data RX: Handle 1605 flags 0x02 dlen 11             #158 [hci1] 13.238157
      ATT: Read By Type Request (0x08) len 6
        Handle range: 0x0018-0xffff
        Attribute type: Characteristic (0x2803)
< HCI Command: Host Number of Com.. (0x03|0x0035) plen 5  #159 [hci1] 13.241107
        Num handles: 1
        Handle: 1605 Address: DF:A9:FF:F6:B1:1A (OUI DF-A9-FF)
        Count: 1
< ACL Data TX: Handle 1605 flags 0x00 dlen 20             #160 [hci1] 13.241113
      ATT: Read By Type Response (0x09) len 15
        Attribute data length: 7
        Attribute data list: 2 entries
        Handle: 0x0019
        Value: 021a00252a
            Properties: 0x02
              Read (0x02)
            Value Handle: 0x001a
            Value UUID: Serial Number String (0x2a25)
        Handle: 0x001b
        Value: 021c00262a
            Properties: 0x02
              Read (0x02)
            Value Handle: 0x001c
            Value UUID: Firmware Revision String (0x2a26)
> HCI Event: Number of Completed Packets (0x13) plen 5    #161 [hci1] 13.412888
        Num handles: 1
        Handle: 1605 Address: DF:A9:FF:F6:B1:1A (OUI DF-A9-FF)
        Count: 1
        #160: len 20 (0 Kb/s)
        Latency: 171 msec (149-171 msec ~165 msec)
> ACL Data RX: Handle 1605 flags 0x02 dlen 11             #162 [hci1] 13.413251
      ATT: Read By Type Request (0x08) len 6
        Handle range: 0x001c-0xffff
        Attribute type: Characteristic (0x2803)
< HCI Command: Host Number of Com.. (0x03|0x0035) plen 5  #163 [hci1] 13.421544
        Num handles: 1
        Handle: 1605 Address: DF:A9:FF:F6:B1:1A (OUI DF-A9-FF)
        Count: 1
< ACL Data TX: Handle 1605 flags 0x00 dlen 20             #164 [hci1] 13.421679
      ATT: Read By Type Response (0x09) len 15
        Attribute data length: 7
        Attribute data list: 2 entries
        Handle: 0x001d
        Value: 021e00272a
            Properties: 0x02
              Read (0x02)
            Value Handle: 0x001e
            Value UUID: Hardware Revision String (0x2a27)
        Handle: 0x001f
        Value: 022000282a
            Properties: 0x02
              Read (0x02)
            Value Handle: 0x0020
            Value UUID: Software Revision String (0x2a28)
> HCI Event: Number of Completed Packets (0x13) plen 5    #165 [hci1] 13.587903
        Num handles: 1
        Handle: 1605 Address: DF:A9:FF:F6:B1:1A (OUI DF-A9-FF)
        Count: 1
        #164: len 20 (0 Kb/s)
        Latency: 166 msec (149-171 msec ~165 msec)
> ACL Data RX: Handle 1605 flags 0x02 dlen 11             #166 [hci1] 13.588156
      ATT: Read By Type Request (0x08) len 6
        Handle range: 0x0020-0xffff
        Attribute type: Characteristic (0x2803)
< HCI Command: Host Number of Com.. (0x03|0x0035) plen 5  #167 [hci1] 13.601467
        Num handles: 1
        Handle: 1605 Address: DF:A9:FF:F6:B1:1A (OUI DF-A9-FF)
        Count: 1
< ACL Data TX: Handle 1605 flags 0x00 dlen 20             #168 [hci1] 13.601569
      ATT: Read By Type Response (0x09) len 15
        Attribute data length: 7
        Attribute data list: 2 entries
        Handle: 0x0021
        Value: 022200ff2b
            Properties: 0x02
              Read (0x02)
            Value Handle: 0x0022
            Value UUID: Unknown (0x2bff)
        Handle: 0x0023
        Value: 022400232a
            Properties: 0x02
              Read (0x02)
            Value Handle: 0x0024
            Value UUID: System ID (0x2a23)
> HCI Event: Number of Completed Packets (0x13) plen 5    #169 [hci1] 13.762994
        Num handles: 1
        Handle: 1605 Address: DF:A9:FF:F6:B1:1A (OUI DF-A9-FF)
        Count: 1
        #168: len 20 (0 Kb/s)
        Latency: 161 msec (149-171 msec ~163 msec)
> ACL Data RX: Handle 1605 flags 0x02 dlen 11             #170 [hci1] 13.763244
      ATT: Read By Type Request (0x08) len 6
        Handle range: 0x0024-0xffff
        Attribute type: Characteristic (0x2803)
< HCI Command: Host Number of Com.. (0x03|0x0035) plen 5  #171 [hci1] 13.781040
        Num handles: 1
        Handle: 1605 Address: DF:A9:FF:F6:B1:1A (OUI DF-A9-FF)
        Count: 1
< ACL Data TX: Handle 1605 flags 0x00 dlen 20             #172 [hci1] 13.781084
      ATT: Read By Type Response (0x09) len 15
        Attribute data length: 7
        Attribute data list: 2 entries
        Handle: 0x0025
        Value: 0226002a2a
            Properties: 0x02
              Read (0x02)
            Value Handle: 0x0026
            Value UUID: IEEE 11073-20601 Regulatory Cert. Data List (0x2a2a)
        Handle: 0x0028
        Value: 0a290050aa
            Properties: 0x0a
              Read (0x02)
              Write (0x08)
            Value Handle: 0x0029
            Value UUID: Unknown (0xaa50)
> HCI Event: Number of Completed Packets (0x13) plen 5    #173 [hci1] 13.938050
        Num handles: 1
        Handle: 1605 Address: DF:A9:FF:F6:B1:1A (OUI DF-A9-FF)
        Count: 1
        #172: len 20 (1 Kb/s)
        Latency: 156 msec (149-171 msec ~160 msec)
> ACL Data RX: Handle 1605 flags 0x02 dlen 11             #174 [hci1] 13.938260
      ATT: Read By Type Request (0x08) len 6
        Handle range: 0x0029-0xffff
        Attribute type: Characteristic (0x2803)
< HCI Command: Host Number of Com.. (0x03|0x0035) plen 5  #175 [hci1] 13.941521
        Num handles: 1
        Handle: 1605 Address: DF:A9:FF:F6:B1:1A (OUI DF-A9-FF)
        Count: 1
< ACL Data TX: Handle 1605 flags 0x00 dlen 20             #176 [hci1] 13.941637
      ATT: Read By Type Response (0x09) len 15
        Attribute data length: 7
        Attribute data list: 2 entries
        Handle: 0x002a
        Value: 0a2b0051aa
            Properties: 0x0a
              Read (0x02)
              Write (0x08)
            Value Handle: 0x002b
            Value UUID: Unknown (0xaa51)
        Handle: 0x002c
        Value: 0a2d0052aa
            Properties: 0x0a
              Read (0x02)
              Write (0x08)
            Value Handle: 0x002d
            Value UUID: Unknown (0xaa52)
> HCI Event: Number of Completed Packets (0x13) plen 5    #177 [hci1] 14.112835
        Num handles: 1
        Handle: 1605 Address: DF:A9:FF:F6:B1:1A (OUI DF-A9-FF)
        Count: 1
        #176: len 20 (0 Kb/s)
        Latency: 171 msec (149-171 msec ~165 msec)
> ACL Data RX: Handle 1605 flags 0x02 dlen 11             #178 [hci1] 14.113173
      ATT: Read By Type Request (0x08) len 6
        Handle range: 0x002d-0xffff
        Attribute type: Characteristic (0x2803)
< HCI Command: Host Number of Com.. (0x03|0x0035) plen 5  #179 [hci1] 14.121092
        Num handles: 1
        Handle: 1605 Address: DF:A9:FF:F6:B1:1A (OUI DF-A9-FF)
        Count: 1
< ACL Data TX: Handle 1605 flags 0x00 dlen 20             #180 [hci1] 14.121115
      ATT: Read By Type Response (0x09) len 15
        Attribute data length: 7
        Attribute data list: 2 entries
        Handle: 0x002e
        Value: 0a2f0053aa
            Properties: 0x0a
              Read (0x02)
              Write (0x08)
            Value Handle: 0x002f
            Value UUID: Unknown (0xaa53)
        Handle: 0x0030
        Value: 3a310054aa
            Properties: 0x3a
              Read (0x02)
              Write (0x08)
              Notify (0x10)
              Indicate (0x20)
            Value Handle: 0x0031
            Value UUID: Unknown (0xaa54)
> HCI Event: Number of Completed Packets (0x13) plen 5    #181 [hci1] 14.287932
        Num handles: 1
        Handle: 1605 Address: DF:A9:FF:F6:B1:1A (OUI DF-A9-FF)
        Count: 1
        #180: len 20 (0 Kb/s)
        Latency: 166 msec (149-171 msec ~166 msec)
> ACL Data RX: Handle 1605 flags 0x02 dlen 11             #182 [hci1] 14.288095
      ATT: Read By Type Request (0x08) len 6
        Handle range: 0x0031-0xffff
        Attribute type: Characteristic (0x2803)
< HCI Command: Host Number of Com.. (0x03|0x0035) plen 5  #183 [hci1] 14.301222
        Num handles: 1
        Handle: 1605 Address: DF:A9:FF:F6:B1:1A (OUI DF-A9-FF)
        Count: 1
< ACL Data TX: Handle 1605 flags 0x00 dlen 20             #184 [hci1] 14.301246
      ATT: Read By Type Response (0x09) len 15
        Attribute data length: 7
        Attribute data list: 2 entries
        Handle: 0x0033
        Value: 3a340055aa
            Properties: 0x3a
              Read (0x02)
              Write (0x08)
              Notify (0x10)
              Indicate (0x20)
            Value Handle: 0x0034
            Value UUID: Unknown (0xaa55)
        Handle: 0x0036
        Value: 06370056aa
            Properties: 0x06
              Read (0x02)
              Write Without Response (0x04)
            Value Handle: 0x0037
            Value UUID: Unknown (0xaa56)
> HCI Event: Number of Completed Packets (0x13) plen 5    #185 [hci1] 14.462916
        Num handles: 1
        Handle: 1605 Address: DF:A9:FF:F6:B1:1A (OUI DF-A9-FF)
        Count: 1
        #184: len 20 (0 Kb/s)
        Latency: 161 msec (149-171 msec ~163 msec)
> ACL Data RX: Handle 1605 flags 0x02 dlen 11             #186 [hci1] 14.463190
      ATT: Read By Type Request (0x08) len 6
        Handle range: 0x0037-0xffff
        Attribute type: Characteristic (0x2803)
< HCI Command: Host Number of Com.. (0x03|0x0035) plen 5  #187 [hci1] 14.481719
        Num handles: 1
        Handle: 1605 Address: DF:A9:FF:F6:B1:1A (OUI DF-A9-FF)
        Count: 1
< ACL Data TX: Handle 1605 flags 0x00 dlen 20             #188 [hci1] 14.481743
      ATT: Read By Type Response (0x09) len 15
        Attribute data length: 7
        Attribute data list: 2 entries
        Handle: 0x0038
        Value: 06390057aa
            Properties: 0x06
              Read (0x02)
              Write Without Response (0x04)
            Value Handle: 0x0039
            Value UUID: Unknown (0xaa57)
        Handle: 0x003a
        Value: 8a3b0058aa
            Properties: 0x8a
              Read (0x02)
              Write (0x08)
            Unknown fields (0x80)
            Value Handle: 0x003b
            Value UUID: Unknown (0xaa58)
> HCI Event: Number of Completed Packets (0x13) plen 5    #189 [hci1] 14.638069
        Num handles: 1
        Handle: 1605 Address: DF:A9:FF:F6:B1:1A (OUI DF-A9-FF)
        Count: 1
        #188: len 20 (1 Kb/s)
        Latency: 156 msec (149-171 msec ~160 msec)
> ACL Data RX: Handle 1605 flags 0x02 dlen 11             #190 [hci1] 14.638172
      ATT: Read By Type Request (0x08) len 6
        Handle range: 0x003b-0xffff
        Attribute type: Characteristic (0x2803)
< HCI Command: Host Number of Com.. (0x03|0x0035) plen 5  #191 [hci1] 14.641430
        Num handles: 1
        Handle: 1605 Address: DF:A9:FF:F6:B1:1A (OUI DF-A9-FF)
        Count: 1
< ACL Data TX: Handle 1605 flags 0x00 dlen 20             #192 [hci1] 14.641586
      ATT: Read By Type Response (0x09) len 15
        Attribute data length: 7
        Attribute data list: 2 entries
        Handle: 0x003d
        Value: 0a3e0059aa
            Properties: 0x0a
              Read (0x02)
              Write (0x08)
            Value Handle: 0x003e
            Value UUID: Unknown (0xaa59)
        Handle: 0x003f
        Value: 0a40005aaa
            Properties: 0x0a
              Read (0x02)
              Write (0x08)
            Value Handle: 0x0040
            Value UUID: Unknown (0xaa5a)
> HCI Event: Number of Completed Packets (0x13) plen 5    #193 [hci1] 14.813001
        Num handles: 1
        Handle: 1605 Address: DF:A9:FF:F6:B1:1A (OUI DF-A9-FF)
        Count: 1
        #192: len 20 (0 Kb/s)
        Latency: 171 msec (149-171 msec ~165 msec)
> ACL Data RX: Handle 1605 flags 0x02 dlen 11             #194 [hci1] 14.813105
      ATT: Read By Type Request (0x08) len 6
        Handle range: 0x0040-0xffff
        Attribute type: Characteristic (0x2803)
< HCI Command: Host Number of Com.. (0x03|0x0035) plen 5  #195 [hci1] 14.821123
        Num handles: 1
        Handle: 1605 Address: DF:A9:FF:F6:B1:1A (OUI DF-A9-FF)
        Count: 1
< ACL Data TX: Handle 1605 flags 0x00 dlen 27             #196 [hci1] 14.821194
      ATT: Read By Type Response (0x09) len 22
        Attribute data length: 21
        Attribute data list: 1 entry
        Handle: 0x0041
        Value: 0a4200efcdab89674523b10040510450bb00f0
            Properties: 0x0a
              Read (0x02)
              Write (0x08)
            Value Handle: 0x0042
            Value UUID: Vendor specific (f000bb50-0451-4000-b123-456789abcdef)
> HCI Event: Number of Completed Packets (0x13) plen 5    #197 [hci1] 14.987909
        Num handles: 1
        Handle: 1605 Address: DF:A9:FF:F6:B1:1A (OUI DF-A9-FF)
        Count: 1
        #196: len 27 (1 Kb/s)
        Latency: 166 msec (149-171 msec ~166 msec)
> ACL Data RX: Handle 1605 flags 0x02 dlen 11             #198 [hci1] 14.988097
      ATT: Read By Type Request (0x08) len 6
        Handle range: 0x0042-0xffff
        Attribute type: Characteristic (0x2803)
< HCI Command: Host Number of Com.. (0x03|0x0035) plen 5  #199 [hci1] 15.001499
        Num handles: 1
        Handle: 1605 Address: DF:A9:FF:F6:B1:1A (OUI DF-A9-FF)
        Count: 1
< ACL Data TX: Handle 1605 flags 0x00 dlen 20             #200 [hci1] 15.001526
      ATT: Read By Type Response (0x09) len 15
        Attribute data length: 7
        Attribute data list: 2 entries
        Handle: 0x0045
        Value: 0a460050aa
            Properties: 0x0a
              Read (0x02)
              Write (0x08)
            Value Handle: 0x0046
            Value UUID: Unknown (0xaa50)
        Handle: 0x0047
        Value: 0a480051aa
            Properties: 0x0a
              Read (0x02)
              Write (0x08)
            Value Handle: 0x0048
            Value UUID: Unknown (0xaa51)
> HCI Event: Number of Completed Packets (0x13) plen 5    #201 [hci1] 15.163047
        Num handles: 1
        Handle: 1605 Address: DF:A9:FF:F6:B1:1A (OUI DF-A9-FF)
        Count: 1
        #200: len 20 (0 Kb/s)
        Latency: 161 msec (149-171 msec ~163 msec)
> ACL Data RX: Handle 1605 flags 0x02 dlen 11             #202 [hci1] 15.163123
      ATT: Read By Type Request (0x08) len 6
        Handle range: 0x0048-0xffff
        Attribute type: Characteristic (0x2803)
< HCI Command: Host Number of Com.. (0x03|0x0035) plen 5  #203 [hci1] 15.181149
        Num handles: 1
        Handle: 1605 Address: DF:A9:FF:F6:B1:1A (OUI DF-A9-FF)
        Count: 1
< ACL Data TX: Handle 1605 flags 0x00 dlen 20             #204 [hci1] 15.181180
      ATT: Read By Type Response (0x09) len 15
        Attribute data length: 7
        Attribute data list: 2 entries
        Handle: 0x0049
        Value: 0a4a0052aa
            Properties: 0x0a
              Read (0x02)
              Write (0x08)
            Value Handle: 0x004a
            Value UUID: Unknown (0xaa52)
        Handle: 0x004b
        Value: 024c0053aa
            Properties: 0x02
              Read (0x02)
            Value Handle: 0x004c
            Value UUID: Unknown (0xaa53)
> HCI Event: Number of Completed Packets (0x13) plen 5    #205 [hci1] 15.337858
        Num handles: 1
        Handle: 1605 Address: DF:A9:FF:F6:B1:1A (OUI DF-A9-FF)
        Count: 1
        #204: len 20 (1 Kb/s)
        Latency: 156 msec (149-171 msec ~160 msec)
> ACL Data RX: Handle 1605 flags 0x02 dlen 11             #206 [hci1] 15.338155
      ATT: Read By Type Request (0x08) len 6
        Handle range: 0x004c-0xffff
        Attribute type: Characteristic (0x2803)
< HCI Command: Host Number of Com.. (0x03|0x0035) plen 5  #207 [hci1] 15.341242
        Num handles: 1
        Handle: 1605 Address: DF:A9:FF:F6:B1:1A (OUI DF-A9-FF)
        Count: 1
< ACL Data TX: Handle 1605 flags 0x00 dlen 20             #208 [hci1] 15.341316
      ATT: Read By Type Response (0x09) len 15
        Attribute data length: 7
        Attribute data list: 2 entries
        Handle: 0x004e
        Value: 0a4f0055aa
            Properties: 0x0a
              Read (0x02)
              Write (0x08)
            Value Handle: 0x004f
            Value UUID: Unknown (0xaa55)
        Handle: 0x0050
        Value: 0a510056aa
            Properties: 0x0a
              Read (0x02)
              Write (0x08)
            Value Handle: 0x0051
            Value UUID: Unknown (0xaa56)
> HCI Event: Number of Completed Packets (0x13) plen 5    #209 [hci1] 15.512964
        Num handles: 1
        Handle: 1605 Address: DF:A9:FF:F6:B1:1A (OUI DF-A9-FF)
        Count: 1
        #208: len 20 (0 Kb/s)
        Latency: 171 msec (149-171 msec ~165 msec)
> ACL Data RX: Handle 1605 flags 0x02 dlen 11             #210 [hci1] 15.513101
      ATT: Read By Type Request (0x08) len 6
        Handle range: 0x0051-0xffff
        Attribute type: Characteristic (0x2803)
< HCI Command: Host Number of Com.. (0x03|0x0035) plen 5  #211 [hci1] 15.521402
        Num handles: 1
        Handle: 1605 Address: DF:A9:FF:F6:B1:1A (OUI DF-A9-FF)
        Count: 1
< ACL Data TX: Handle 1605 flags 0x00 dlen 9              #212 [hci1] 15.521456
      ATT: Error Response (0x01) len 4
        Read By Type Request (0x08)
        Handle: 0x0051
        Error: Attribute Not Found (0x0a)
> HCI Event: Number of Completed Packets (0x13) plen 5    #213 [hci1] 15.687828
        Num handles: 1
        Handle: 1605 Address: DF:A9:FF:F6:B1:1A (OUI DF-A9-FF)
        Count: 1
        #212: len 9 (0 Kb/s)
        Latency: 166 msec (149-171 msec ~166 msec)
> ACL Data RX: Handle 1605 flags 0x02 dlen 7              #214 [hci1] 15.687996
      ATT: Read Request (0x0a) len 2
        Handle: 0x0006
< HCI Command: Host Number of Com.. (0x03|0x0035) plen 5  #215 [hci1] 15.701277
        Num handles: 1
        Handle: 1605 Address: DF:A9:FF:F6:B1:1A (OUI DF-A9-FF)
        Count: 1
< ACL Data TX: Handle 1605 flags 0x00 dlen 6              #216 [hci1] 15.701369
      ATT: Read Response (0x0b) len 1
> HCI Event: Number of Completed Packets (0x13) plen 5    #217 [hci1] 15.862935
        Num handles: 1
        Handle: 1605 Address: DF:A9:FF:F6:B1:1A (OUI DF-A9-FF)
        Count: 1
        #216: len 6 (0 Kb/s)
        Latency: 161 msec (149-171 msec ~163 msec)
> ACL Data RX: Handle 1605 flags 0x02 dlen 8              #218 [hci1] 15.863090
      ATT: Write Request (0x12) len 3
        Handle: 0x0006
          Data: 02
< HCI Command: Host Number of Com.. (0x03|0x0035) plen 5  #219 [hci1] 15.881064
        Num handles: 1
        Handle: 1605 Address: DF:A9:FF:F6:B1:1A (OUI DF-A9-FF)
        Count: 1
< ACL Data TX: Handle 1605 flags 0x00 dlen 5              #220 [hci1] 15.881114
      ATT: Write Response (0x13) len 0
> HCI Event: Number of Completed Packets (0x13) plen 5    #221 [hci1] 16.037768
        Num handles: 1
        Handle: 1605 Address: DF:A9:FF:F6:B1:1A (OUI DF-A9-FF)
        Count: 1
        #220: len 5 (0 Kb/s)
        Latency: 156 msec (149-171 msec ~160 msec)
> ACL Data RX: Handle 1605 flags 0x02 dlen 11             #222 [hci1] 18.575497
      SMP: Pairing Request (0x01) len 6
        IO capability: KeyboardDisplay (0x04)
        OOB data: Authentication data not present (0x00)
        Authentication requirement: Bonding, No MITM, SC, No Keypresses (0x09)
        Max encryption key size: 16
        Initiator key distribution: EncKey IdKey Sign (0x07)
        Responder key distribution: EncKey IdKey Sign (0x07)
< HCI Command: Host Number of Com.. (0x03|0x0035) plen 5  #223 [hci1] 18.581432
        Num handles: 1
        Handle: 1605 Address: DF:A9:FF:F6:B1:1A (OUI DF-A9-FF)
        Count: 1
< ACL Data TX: Handle 1605 flags 0x00 dlen 11             #224 [hci1] 18.581501
      SMP: Pairing Response (0x02) len 6
        IO capability: DisplayOnly (0x00)
        OOB data: Authentication data not present (0x00)
        Authentication requirement: Bonding, No MITM, SC, No Keypresses (0x09)
        Max encryption key size: 16
        Initiator key distribution: IdKey (0x02)
        Responder key distribution: <none> (0x00)
> HCI Event: Number of Completed Packets (0x13) plen 5    #225 [hci1] 18.750420
        Num handles: 1
        Handle: 1605 Address: DF:A9:FF:F6:B1:1A (OUI DF-A9-FF)
        Count: 1
        #224: len 11 (0 Kb/s)
        Latency: 168 msec (149-171 msec ~164 msec)
> ACL Data RX: Handle 1605 flags 0x02 dlen 27             #226 [hci1] 18.750829
> ACL Data RX: Handle 1605 flags 0x01 dlen 27             #227 [hci1] 18.751293
> ACL Data RX: Handle 1605 flags 0x01 dlen 15             #228 [hci1] 18.751896
      SMP: Pairing Public Key (0x0c) len 64
        X: ac4eecef76b52a34aef63aa45c4e69576df5baf00113b2d8966ef84c3c0f39bc
        Y: 58614388cfa5d3665dd797e5038178ce4b162e020a85ab19be03c9b5224c4a01
< HCI Command: Host Number of Com.. (0x03|0x0035) plen 5  #229 [hci1] 18.761225
        Num handles: 1
        Handle: 1605 Address: DF:A9:FF:F6:B1:1A (OUI DF-A9-FF)
        Count: 1
< HCI Command: Host Number of Com.. (0x03|0x0035) plen 5  #230 [hci1] 18.761274
        Num handles: 1
        Handle: 1605 Address: DF:A9:FF:F6:B1:1A (OUI DF-A9-FF)
        Count: 1
< HCI Command: Host Number of Com.. (0x03|0x0035) plen 5  #231 [hci1] 18.761491
        Num handles: 1
        Handle: 1605 Address: DF:A9:FF:F6:B1:1A (OUI DF-A9-FF)
        Count: 1
< ACL Data TX: Handle 1605 flags 0x00 dlen 27             #232 [hci1] 18.761495
< ACL Data TX: Handle 1605 flags 0x01 dlen 27             #233 [hci1] 18.761496
< ACL Data TX: Handle 1605 flags 0x01 dlen 15             #234 [hci1] 18.761497
      SMP: Pairing Public Key (0x0c) len 64
        X: 98308440221e2d910f0e54b71e7ec652857aa9b5a0dc65028824cc19db1226e9
        Y: 67a4816bcb62efb21701e31fdb27561a6217575fb007a8bbdabe7e28b6f68482
> HCI Event: Number of Completed Packets (0x13) plen 5    #235 [hci1] 18.838431
        Num handles: 1
        Handle: 1605 Address: DF:A9:FF:F6:B1:1A (OUI DF-A9-FF)
        Count: 1
        #232: len 27 (2 Kb/s)
        Latency: 76 msec (76-171 msec ~120 msec)
> HCI Event: Number of Completed Packets (0x13) plen 5    #236 [hci1] 18.838939
        Num handles: 1
        Handle: 1605 Address: DF:A9:FF:F6:B1:1A (OUI DF-A9-FF)
        Count: 1
        #233: len 27 (2 Kb/s)
        Latency: 77 msec (76-171 msec ~99 msec)
< ACL Data TX: Handle 1605 flags 0x00 dlen 21             #237 [hci1] 18.841044
      SMP: Pairing Confirm (0x03) len 16
        Confim value: c299325c9471baa2e1fb1c08ddd6fbeb
> HCI Event: Number of Completed Packets (0x13) plen 5    #238 [hci1] 18.925240
        Num handles: 1
        Handle: 1605 Address: DF:A9:FF:F6:B1:1A (OUI DF-A9-FF)
        Count: 1
        #234: len 15 (0 Kb/s)
        Latency: 163 msec (76-171 msec ~131 msec)
> HCI Event: Number of Completed Packets (0x13) plen 5    #239 [hci1] 19.012887
        Num handles: 1
        Handle: 1605 Address: DF:A9:FF:F6:B1:1A (OUI DF-A9-FF)
        Count: 1
        #237: len 21 (0 Kb/s)
        Latency: 171 msec (76-171 msec ~151 msec)
> ACL Data RX: Handle 1605 flags 0x02 dlen 21             #240 [hci1] 19.013331
      SMP: Pairing Random (0x04) len 16
        Random value: 419de2259f269f7d0000000000000000
< HCI Command: Host Number of Com.. (0x03|0x0035) plen 5  #241 [hci1] 19.021691
        Num handles: 1
        Handle: 1605 Address: DF:A9:FF:F6:B1:1A (OUI DF-A9-FF)
        Count: 1
< ACL Data TX: Handle 1605 flags 0x00 dlen 21             #242 [hci1] 19.021780
      SMP: Pairing Random (0x04) len 16
        Random value: 8e6108f966a694cbe26df70bb96773e6
> HCI Event: Number of Completed Packets (0x13) plen 5    #243 [hci1] 19.187899
        Num handles: 1
        Handle: 1605 Address: DF:A9:FF:F6:B1:1A (OUI DF-A9-FF)
        Count: 1
        #242: len 21 (1 Kb/s)
        Latency: 166 msec (76-171 msec ~158 msec)
> ACL Data RX: Handle 1605 flags 0x02 dlen 21             #244 [hci1] 19.363171
      SMP: Pairing DHKey Check (0x0d) len 16
        E: 8554e74d9f4ecba8559aede9a7560ea2
< HCI Command: Host Number of Com.. (0x03|0x0035) plen 5  #245 [hci1] 19.381288
        Num handles: 1
        Handle: 1605 Address: DF:A9:FF:F6:B1:1A (OUI DF-A9-FF)
        Count: 1
< ACL Data TX: Handle 1605 flags 0x00 dlen 21             #246 [hci1] 19.381393
      SMP: Pairing DHKey Check (0x0d) len 16
        E: 4e325e1f89dfb6812969ae8094587d55
> HCI Event: Number of Completed Packets (0x13) plen 5    #247 [hci1] 19.537859
        Num handles: 1
        Handle: 1605 Address: DF:A9:FF:F6:B1:1A (OUI DF-A9-FF)
        Count: 1
        #246: len 21 (1 Kb/s)
        Latency: 156 msec (76-171 msec ~157 msec)
> HCI Event: LE Meta Event (0x3e) plen 13                 #248 [hci1] 19.625736
      LE Long Term Key Request (0x05)
        Handle: 1605 Address: DF:A9:FF:F6:B1:1A (OUI DF-A9-FF)
        Random number: 0x0000000000000000
        Encrypted diversifier: 0x0000
< HCI Command: LE Long Term Key... (0x08|0x001a) plen 18  #249 [hci1] 19.641266
        Handle: 1605 Address: DF:A9:FF:F6:B1:1A (OUI DF-A9-FF)
        Long term key: 59e18f53e635f54ecabb43edc26af4f1
> HCI Event: Command Complete (0x0e) plen 6               #250 [hci1] 19.641992
      LE Long Term Key Request Reply (0x08|0x001a) ncmd 1
        Status: Success (0x00)
        Handle: 1605 Address: DF:A9:FF:F6:B1:1A (OUI DF-A9-FF)
> HCI Event: Encryption Change (0x08) plen 4              #251 [hci1] 20.062974
        Status: Success (0x00)
        Handle: 1605 Address: DF:A9:FF:F6:B1:1A (OUI DF-A9-FF)
        Encryption: Enabled with AES-CCM (0x01)
> ACL Data RX: Handle 1605 flags 0x02 dlen 21             #252 [hci1] 20.150577
      SMP: Identity Information (0x08) len 16
        Identity resolving key: 0067cc3eb7cd37673c7cb59018263da6
< ACL Data TX: Handle 1605 flags 0x00 dlen 11             #253 [hci1] 20.191652
      ATT: Read By Type Request (0x08) len 6
        Handle range: 0x0001-0xffff
        Attribute type: Central Address Resolution (0x2aa6)
< HCI Command: Host Number of Com.. (0x03|0x0035) plen 5  #254 [hci1] 20.191968
        Num handles: 1
        Handle: 1605 Address: DF:A9:FF:F6:B1:1A (OUI DF-A9-FF)
        Count: 1
> ACL Data RX: Handle 1605 flags 0x02 dlen 12             #255 [hci1] 20.238079
      SMP: Identity Address Information (0x09) len 7
        Address: DF:A9:FF:F6:B1:1A (OUI DF-A9-FF)
> HCI Event: Number of Completed Packets (0x13) plen 5    #256 [hci1] 20.238704
        Num handles: 1
        Handle: 1605 Address: DF:A9:FF:F6:B1:1A (OUI DF-A9-FF)
        Count: 1
        #253: len 11 (1 Kb/s)
        Latency: 47 msec (47-171 msec ~102 msec)
> ACL Data RX: Handle 1605 flags 0x02 dlen 26             #257 [hci1] 20.238946
      LE L2CAP: Enhanced Credit Connection Request (0x17) ident 1 len 18
        PSM: 39 (0x0027)
        MTU: 64
        MPS: 64
        Credits: 5
        Source CID: 84
        Source CID: 83
        Source CID: 82
        Source CID: 81
        Source CID: 80
< HCI Command: LE Add Device To... (0x08|0x0027) plen 39  #258 [hci1] 20.241211
        Address type: Public (0x00)
        Address: DF:A9:FF:F6:B1:1A (OUI DF-A9-FF)
        Peer identity resolving key: 0067cc3eb7cd37673c7cb59018263da6
        Local identity resolving key: 00000000000000000000000000000000
> HCI Event: Command Complete (0x0e) plen 4               #259 [hci1] 20.242240
      LE Add Device To Resolving List (0x08|0x0027) ncmd 1
        Status: Success (0x00)
< HCI Command: LE Set Privacy Mode (0x08|0x004e) plen 8   #260 [hci1] 20.261142
        Peer Identity address type: Public (0x00)
        Peer Identity address: DF:A9:FF:F6:B1:1A (OUI DF-A9-FF)
        Privacy Mode: Use Device Privacy (0x01)
> HCI Event: Command Complete (0x0e) plen 4               #261 [hci1] 20.261697
      LE Set Privacy Mode (0x08|0x004e) ncmd 1
        Status: Success (0x00)
< HCI Command: LE Set Address Res.. (0x08|0x002d) plen 1  #262 [hci1] 20.281008
        Address resolution: Enabled (0x01)
> HCI Event: Command Complete (0x0e) plen 4               #263 [hci1] 20.281504
      LE Set Address Resolution Enable (0x08|0x002d) ncmd 1
        Status: Success (0x00)
< HCI Command: Host Number of Com.. (0x03|0x0035) plen 5  #264 [hci1] 20.300999
        Num handles: 1
        Handle: 1605 Address: DF:A9:FF:F6:B1:1A (OUI DF-A9-FF)
        Count: 1
< HCI Command: Host Number of Com.. (0x03|0x0035) plen 5  #265 [hci1] 20.301151
        Num handles: 1
        Handle: 1605 Address: DF:A9:FF:F6:B1:1A (OUI DF-A9-FF)
        Count: 1
< ACL Data TX: Handle 1605 flags 0x00 dlen 26             #266 [hci1] 20.301211
      LE L2CAP: Enhanced Credit Connection Response (0x18) ident 1 len 18
        MTU: 249
        MPS: 251
        Credits: 1
        Result: Connection successful (0x0000)
        Destination CID: 64
        Destination CID: 65
        Destination CID: 66
        Destination CID: 67
        Destination CID: 68
> ACL Data RX: Handle 1605 flags 0x02 dlen 9              #267 [hci1] 20.325363
      ATT: Error Response (0x01) len 4
        Read By Type Request (0x08)
        Handle: 0x0001
        Error: Attribute Not Found (0x0a)
< HCI Command: Host Number of Com.. (0x03|0x0035) plen 5  #268 [hci1] 20.341121
        Num handles: 1
        Handle: 1605 Address: DF:A9:FF:F6:B1:1A (OUI DF-A9-FF)
        Count: 1
> HCI Event: Number of Completed Packets (0x13) plen 5    #269 [hci1] 20.412701
        Num handles: 1
        Handle: 1605 Address: DF:A9:FF:F6:B1:1A (OUI DF-A9-FF)
        Count: 1
        #266: len 26 (1 Kb/s)
        Latency: 111 msec (47-171 msec ~106 msec)
> ACL Data RX: Handle 1605 flags 0x02 dlen 13             #270 [hci1] 22.425415
      Channel: 68 len 9 sdu 7 [PSM 39 mode Enhanced Credit (0x81)] {chan 4}
      ATT: Read By Group Type Request (0x10) len 6
        Handle range: 0x0001-0xffff
        Attribute group type: Primary Service (0x2800)
< HCI Command: Host Number of Com.. (0x03|0x0035) plen 5  #271 [hci1] 22.441678
        Num handles: 1
        Handle: 1605 Address: DF:A9:FF:F6:B1:1A (OUI DF-A9-FF)
        Count: 1
< ACL Data TX: Handle 1605 flags 0x00 dlen 27             #272 [hci1] 22.441782
< ACL Data TX: Handle 1605 flags 0x01 dlen 5              #273 [hci1] 22.441825
      Channel: 80 len 28 sdu 26 [PSM 39 mode Enhanced Credit (0x81)] {chan 4}
      ATT: Read By Group Type Response (0x11) len 25
        Attribute data length: 6
        Attribute group list: 4 entries
        Handle range: 0x0001-0x000a
        UUID: Generic Attribute Profile (0x1801)
        Handle range: 0x000b-0x0011
        UUID: Generic Access Profile (0x1800)
        Handle range: 0x0012-0x0026
        UUID: Device Information (0x180a)
        Handle range: 0x0043-0x0051
        UUID: Unknown (0xaa41)
< ACL Data TX: Handle 1605 flags 0x00 dlen 12             #274 [hci1] 22.442186
      LE L2CAP: LE Flow Control Credit (0x16) ident 2 len 4
        Source CID: 68
        Credits: 1
> HCI Event: Number of Completed Packets (0x13) plen 5    #275 [hci1] 22.513505
        Num handles: 1
        Handle: 1605 Address: DF:A9:FF:F6:B1:1A (OUI DF-A9-FF)
        Count: 1
        #272: len 27 (3 Kb/s)
        Latency: 71 msec (47-171 msec ~89 msec)
        Channel: 80 [PSM 39 mode Enhanced Credit (0x81)] {chan 4}
        Channel Latency: 71 msec (71-71 msec ~71 msec)
> HCI Event: Number of Completed Packets (0x13) plen 5    #276 [hci1] 22.513952
        Num handles: 1
        Handle: 1605 Address: DF:A9:FF:F6:B1:1A (OUI DF-A9-FF)
        Count: 1
        #273: len 5 (0 Kb/s)
        Latency: 72 msec (47-171 msec ~80 msec)
        Channel: 80 [PSM 39 mode Enhanced Credit (0x81)] {chan 4}
        Channel Latency: 72 msec (71-72 msec ~71 msec)
> HCI Event: Number of Completed Packets (0x13) plen 5    #277 [hci1] 22.600519
        Num handles: 1
        Handle: 1605 Address: DF:A9:FF:F6:B1:1A (OUI DF-A9-FF)
        Count: 1
        #274: len 12 (0 Kb/s)
        Latency: 158 msec (47-171 msec ~119 msec)
> ACL Data RX: Handle 1605 flags 0x02 dlen 13             #278 [hci1] 22.600525
      Channel: 68 len 9 sdu 7 [PSM 39 mode Enhanced Credit (0x81)] {chan 4}
      ATT: Read By Group Type Request (0x10) len 6
        Handle range: 0x0052-0xffff
        Attribute group type: Primary Service (0x2800)
< HCI Command: Host Number of Com.. (0x03|0x0035) plen 5  #279 [hci1] 22.601354
        Num handles: 1
        Handle: 1605 Address: DF:A9:FF:F6:B1:1A (OUI DF-A9-FF)
        Count: 1
< ACL Data TX: Handle 1605 flags 0x00 dlen 11             #280 [hci1] 22.601552
      Channel: 80 len 7 sdu 5 [PSM 39 mode Enhanced Credit (0x81)] {chan 4}
      ATT: Error Response (0x01) len 4
        Read By Group Type Request (0x10)
        Handle: 0x0052
        Error: Attribute Not Found (0x0a)
< ACL Data TX: Handle 1605 flags 0x00 dlen 12             #281 [hci1] 22.601597
      LE L2CAP: LE Flow Control Credit (0x16) ident 3 len 4
        Source CID: 68
        Credits: 1
> HCI Event: Number of Completed Packets (0x13) plen 5    #282 [hci1] 22.688212
        Num handles: 1
        Handle: 1605 Address: DF:A9:FF:F6:B1:1A (OUI DF-A9-FF)
        Count: 1
        #280: len 11 (1 Kb/s)
        Latency: 86 msec (47-171 msec ~103 msec)
        Channel: 80 [PSM 39 mode Enhanced Credit (0x81)] {chan 4}
        Channel Latency: 86 msec (71-86 msec ~79 msec)
> HCI Event: Number of Completed Packets (0x13) plen 5    #283 [hci1] 22.775312
        Num handles: 1
        Handle: 1605 Address: DF:A9:FF:F6:B1:1A (OUI DF-A9-FF)
        Count: 1
        #281: len 12 (0 Kb/s)
        Latency: 173 msec (47-173 msec ~138 msec)
        Channel: 80 [PSM 39 mode Enhanced Credit (0x81)] {chan 4}
        Channel Latency: 173 msec (71-173 msec ~126 msec)
> ACL Data RX: Handle 1605 flags 0x02 dlen 15             #284 [hci1] 22.775553
      Channel: 68 len 11 sdu 9 [PSM 39 mode Enhanced Credit (0x81)] {chan 4}
      ATT: Find By Type Value Request (0x06) len 8
        Handle range: 0x0001-0xffff
        Attribute type: Primary Service (0x2800)
          UUID: Generic Attribute Profile (0x1801)
< HCI Command: Host Number of Com.. (0x03|0x0035) plen 5  #285 [hci1] 22.781841
        Num handles: 1
        Handle: 1605 Address: DF:A9:FF:F6:B1:1A (OUI DF-A9-FF)
        Count: 1
< ACL Data TX: Handle 1605 flags 0x00 dlen 11             #286 [hci1] 22.781909
      Channel: 80 len 7 sdu 5 [PSM 39 mode Enhanced Credit (0x81)] {chan 4}
      ATT: Find By Type Value Response (0x07) len 4
        Handle range: 0x0001-0x000a
< ACL Data TX: Handle 1605 flags 0x00 dlen 12             #287 [hci1] 22.782121
      LE L2CAP: LE Flow Control Credit (0x16) ident 4 len 4
        Source CID: 68
        Credits: 1
> HCI Event: Number of Completed Packets (0x13) plen 5    #288 [hci1] 22.863317
        Num handles: 1
        Handle: 1605 Address: DF:A9:FF:F6:B1:1A (OUI DF-A9-FF)
        Count: 1
        #286: len 11 (1 Kb/s)
        Latency: 81 msec (47-173 msec ~109 msec)
> HCI Event: Number of Completed Packets (0x13) plen 5    #289 [hci1] 22.950354
        Num handles: 1
        Handle: 1605 Address: DF:A9:FF:F6:B1:1A (OUI DF-A9-FF)
        Count: 1
        #287: len 12 (0 Kb/s)
        Latency: 168 msec (47-173 msec ~139 msec)
        Channel: 80 [PSM 39 mode Enhanced Credit (0x81)] {chan 4}
        Channel Latency: 168 msec (71-173 msec ~147 msec)
> ACL Data RX: Handle 1605 flags 0x02 dlen 15             #290 [hci1] 22.950622
      Channel: 68 len 11 sdu 9 [PSM 39 mode Enhanced Credit (0x81)] {chan 4}
      ATT: Find By Type Value Request (0x06) len 8
        Handle range: 0x000b-0xffff
        Attribute type: Primary Service (0x2800)
          UUID: Generic Attribute Profile (0x1801)
< HCI Command: Host Number of Com.. (0x03|0x0035) plen 5  #291 [hci1] 22.961351
        Num handles: 1
        Handle: 1605 Address: DF:A9:FF:F6:B1:1A (OUI DF-A9-FF)
        Count: 1
< ACL Data TX: Handle 1605 flags 0x00 dlen 11             #292 [hci1] 22.961358
      Channel: 80 len 7 sdu 5 [PSM 39 mode Enhanced Credit (0x81)] {chan 4}
      ATT: Error Response (0x01) len 4
        Find By Type Value Request (0x06)
        Handle: 0x000b
        Error: Attribute Not Found (0x0a)
< ACL Data TX: Handle 1605 flags 0x00 dlen 12             #293 [hci1] 22.961359
      LE L2CAP: LE Flow Control Credit (0x16) ident 5 len 4
        Source CID: 68
        Credits: 1
> HCI Event: Number of Completed Packets (0x13) plen 5    #294 [hci1] 23.038171
        Num handles: 1
        Handle: 1605 Address: DF:A9:FF:F6:B1:1A (OUI DF-A9-FF)
        Count: 1
        #292: len 11 (1 Kb/s)
        Latency: 76 msec (47-173 msec ~107 msec)
        Channel: 80 [PSM 39 mode Enhanced Credit (0x81)] {chan 4}
        Channel Latency: 76 msec (71-173 msec ~112 msec)
> HCI Event: Number of Completed Packets (0x13) plen 5    #295 [hci1] 23.125386
        Num handles: 1
        Handle: 1605 Address: DF:A9:FF:F6:B1:1A (OUI DF-A9-FF)
        Count: 1
        #293: len 12 (0 Kb/s)
        Latency: 164 msec (47-173 msec ~135 msec)
> ACL Data RX: Handle 1605 flags 0x02 dlen 12             #296 [hci1] 23.125478
      LE L2CAP: LE Flow Control Credit (0x16) ident 2 len 4
        Source CID: 80
        Credits: 10
> ACL Data RX: Handle 1605 flags 0x02 dlen 13             #297 [hci1] 23.125999
      Channel: 68 len 9 sdu 7 [PSM 39 mode Enhanced Credit (0x81)] {chan 4}
      ATT: Read By Type Request (0x08) len 6
        Handle range: 0x0001-0x000a
        Attribute type: Characteristic (0x2803)
< HCI Command: Host Number of Com.. (0x03|0x0035) plen 5  #298 [hci1] 23.141174
        Num handles: 1
        Handle: 1605 Address: DF:A9:FF:F6:B1:1A (OUI DF-A9-FF)
        Count: 1
< HCI Command: Host Number of Com.. (0x03|0x0035) plen 5  #299 [hci1] 23.141194
        Num handles: 1
        Handle: 1605 Address: DF:A9:FF:F6:B1:1A (OUI DF-A9-FF)
        Count: 1
< ACL Data TX: Handle 1605 flags 0x00 dlen 27             #300 [hci1] 23.141278
< ACL Data TX: Handle 1605 flags 0x01 dlen 9              #301 [hci1] 23.141281
      Channel: 80 len 32 sdu 30 [PSM 39 mode Enhanced Credit (0x81)] {chan 4}
      ATT: Read By Type Response (0x09) len 29
        Attribute data length: 7
        Attribute data list: 4 entries
        Handle: 0x0002
        Value: 200300052a
            Properties: 0x20
              Indicate (0x20)
            Value Handle: 0x0003
            Value UUID: Service Changed (0x2a05)
        Handle: 0x0005
        Value: 0a0600292b
            Properties: 0x0a
              Read (0x02)
              Write (0x08)
            Value Handle: 0x0006
            Value UUID: Client Supported Features (0x2b29)
        Handle: 0x0007
        Value: 0208002a2b
            Properties: 0x02
              Read (0x02)
            Value Handle: 0x0008
            Value UUID: Database Hash (0x2b2a)
        Handle: 0x0009
        Value: 020a003a2b
            Properties: 0x02
              Read (0x02)
            Value Handle: 0x000a
            Value UUID: Server Supported Features (0x2b3a)
< ACL Data TX: Handle 1605 flags 0x00 dlen 12             #302 [hci1] 23.141303
      LE L2CAP: LE Flow Control Credit (0x16) ident 6 len 4
        Source CID: 68
        Credits: 1
> HCI Event: Number of Completed Packets (0x13) plen 5    #303 [hci1] 23.213341
        Num handles: 1
        Handle: 1605 Address: DF:A9:FF:F6:B1:1A (OUI DF-A9-FF)
        Count: 1
        #300: len 27 (3 Kb/s)
        Latency: 72 msec (47-173 msec ~104 msec)
        Channel: 80 [PSM 39 mode Enhanced Credit (0x81)] {chan 4}
        Channel Latency: 72 msec (71-173 msec ~92 msec)
> HCI Event: Number of Completed Packets (0x13) plen 5    #304 [hci1] 23.213860
        Num handles: 1
        Handle: 1605 Address: DF:A9:FF:F6:B1:1A (OUI DF-A9-FF)
        Count: 1
        #301: len 9 (1 Kb/s)
        Latency: 72 msec (47-173 msec ~88 msec)
        Channel: 80 [PSM 39 mode Enhanced Credit (0x81)] {chan 4}
        Channel Latency: 72 msec (71-173 msec ~82 msec)
> HCI Event: Number of Completed Packets (0x13) plen 5    #305 [hci1] 23.300460
        Num handles: 1
        Handle: 1605 Address: DF:A9:FF:F6:B1:1A (OUI DF-A9-FF)
        Count: 1
        #302: len 12 (0 Kb/s)
        Latency: 159 msec (47-173 msec ~123 msec)
> ACL Data RX: Handle 1605 flags 0x02 dlen 13             #306 [hci1] 23.300648
      Channel: 68 len 9 sdu 7 [PSM 39 mode Enhanced Credit (0x81)] {chan 4}
      ATT: Read By Type Request (0x08) len 6
        Handle range: 0x000a-0x000a
        Attribute type: Characteristic (0x2803)
< HCI Command: Host Number of Com.. (0x03|0x0035) plen 5  #307 [hci1] 23.301596
        Num handles: 1
        Handle: 1605 Address: DF:A9:FF:F6:B1:1A (OUI DF-A9-FF)
        Count: 1
< ACL Data TX: Handle 1605 flags 0x00 dlen 11             #308 [hci1] 23.301809
      Channel: 80 len 7 sdu 5 [PSM 39 mode Enhanced Credit (0x81)] {chan 4}
      ATT: Error Response (0x01) len 4
        Read By Type Request (0x08)
        Handle: 0x000a
        Error: Attribute Not Found (0x0a)
< ACL Data TX: Handle 1605 flags 0x00 dlen 12             #309 [hci1] 23.301983
      LE L2CAP: LE Flow Control Credit (0x16) ident 7 len 4
        Source CID: 68
        Credits: 1
> HCI Event: Number of Completed Packets (0x13) plen 5    #310 [hci1] 23.388216
        Num handles: 1
        Handle: 1605 Address: DF:A9:FF:F6:B1:1A (OUI DF-A9-FF)
        Count: 1
        #308: len 11 (1 Kb/s)
        Latency: 86 msec (47-173 msec ~105 msec)
        Channel: 80 [PSM 39 mode Enhanced Credit (0x81)] {chan 4}
        Channel Latency: 86 msec (71-173 msec ~84 msec)
> HCI Event: Number of Completed Packets (0x13) plen 5    #311 [hci1] 23.475216
        Num handles: 1
        Handle: 1605 Address: DF:A9:FF:F6:B1:1A (OUI DF-A9-FF)
        Count: 1
        #309: len 12 (0 Kb/s)
        Latency: 173 msec (47-173 msec ~139 msec)
        Channel: 80 [PSM 39 mode Enhanced Credit (0x81)] {chan 4}
        Channel Latency: 173 msec (71-173 msec ~128 msec)
> HCI Event: Disconnect Complete (0x05) plen 4            #312 [hci1] 24.875348
        Status: Success (0x00)
        Handle: 1605 Address: DF:A9:FF:F6:B1:1A (OUI DF-A9-FF)
        Reason: Remote User Terminated Connection (0x13)
< HCI Command: Reset (0x03|0x0003) plen 0                 #313 [hci1] 33.221201
> HCI Event: Command Complete (0x0e) plen 4               #314 [hci1] 33.221763
      Reset (0x03|0x0003) ncmd 1
        Status: Success (0x00)
@ USER Close: main                                    {0x0001} [hci1] 33.241099
= Close Index: 00:00:00:00:00:00                               [hci1] 33.244478
