Bluetooth monitor ver 5.72
= Note: Linux version 6.14.0-36-generic (x86_64)                       0.415027
= Note: Bluetooth subsystem version 2.22                               0.415028
= New Index: 00:00:00:00:00:00 (Primary,UART,hci1)              [hci1] 0.415029
= New Index: 48:5F:99:8E:E0:64 (Primary,USB,hci0)               [hci0] 0.415029
= Open Index: 00:00:00:00:00:00                                 [hci1] 0.578342
= Index Info: 00:00:00:00:00:00 (Nordic Semiconductor ASA)      [hci1] 0.578349
@ USER Open: main (privileged) version 2.22            {0x0001} [hci1] 0.578351
< HCI Command: Reset (0x03|0x0003) plen 0                    #1 [hci1] 0.578746
> HCI Event: Command Complete (0x0e) plen 4                  #2 [hci1] 0.579157
      Reset (0x03|0x0003) ncmd 1
        Status: Success (0x00)
< HCI Command: Read Local Supported... (0x04|0x0003) plen 0  #3 [hci1] 0.598326
> HCI Event: Command Complete (0x0e) plen 12                 #4 [hci1] 0.598854
      Read Local Supported Features (0x04|0x0003) ncmd 1
        Status: Success (0x00)
        Features: 0x00 0x00 0x00 0x00 0x60 0x00 0x00 0x00
          BR/EDR Not Supported
          LE Supported (Controller)
< HCI Command: Read Local Version In.. (0x04|0x0001) plen 0  #5 [hci1] 0.618272
> HCI Event: Command Complete (0x0e) plen 12                 #6 [hci1] 0.618755
      Read Local Version Information (0x04|0x0001) ncmd 1
        Status: Success (0x00)
        HCI version: Reserved (0x0f) - Revision 12393 (0x3069)
        LMP version: Reserved (0x0f) - Subversion 12393 (0x3069)
        Manufacturer: Nordic Semiconductor ASA (89)
< HCI Command: Read Local Supported... (0x04|0x0002) plen 0  #7 [hci1] 0.638314
> HCI Event: Command Complete (0x0e) plen 68                 #8 [hci1] 0.639375
      Read Local Supported Commands (0x04|0x0002) ncmd 1
        Status: Success (0x00)
        Commands: 119 entries
          Disconnect (Octet 0 - Bit 5)
          Read Remote Version Information (Octet 2 - Bit 7)
          Set Event Mask (Octet 5 - Bit 6)
          Reset (Octet 5 - Bit 7)
          Read Connection Accept Timeout (Octet 7 - Bit 2)
          Write Connection Accept Timeout (Octet 7 - Bit 3)
          Read Transmit Power Level (Octet 10 - Bit 2)
          Set Controller To Host Flow Control (Octet 10 - Bit 5)
          Host Buffer Size (Octet 10 - Bit 6)
          Host Number of Completed Packets (Octet 10 - Bit 7)
          Read Local Version Information (Octet 14 - Bit 3)
          Read Local Supported Features (Octet 14 - Bit 5)
          Read BD ADDR (Octet 15 - Bit 1)
          Read RSSI (Octet 15 - Bit 5)
          Set Event Mask Page 2 (Octet 22 - Bit 2)
          LE Set Event Mask (Octet 25 - Bit 0)
          LE Read Buffer Size (Octet 25 - Bit 1)
          LE Read Local Supported Features (Octet 25 - Bit 2)
          LE Set Random Address (Octet 25 - Bit 4)
          LE Set Advertising Parameters (Octet 25 - Bit 5)
          LE Read Advertising Channel TX Power (Octet 25 - Bit 6)
          LE Set Advertising Data (Octet 25 - Bit 7)
          LE Set Scan Response Data (Octet 26 - Bit 0)
          LE Set Advertise Enable (Octet 26 - Bit 1)
          LE Set Scan Parameters (Octet 26 - Bit 2)
          LE Set Scan Enable (Octet 26 - Bit 3)
          LE Create Connection (Octet 26 - Bit 4)
          LE Create Connection Cancel (Octet 26 - Bit 5)
          LE Read Accept List Size (Octet 26 - Bit 6)
          LE Clear Accept List (Octet 26 - Bit 7)
          LE Add Device To Accept List (Octet 27 - Bit 0)
          LE Remove Device From Accept List (Octet 27 - Bit 1)
          LE Connection Update (Octet 27 - Bit 2)
          LE Set Host Channel Classification (Octet 27 - Bit 3)
          LE Read Channel Map (Octet 27 - Bit 4)
          LE Read Remote Used Features (Octet 27 - Bit 5)
          LE Encrypt (Octet 27 - Bit 6)
          LE Rand (Octet 27 - Bit 7)
          LE Start Encryption (Octet 28 - Bit 0)
          LE Long Term Key Request Reply (Octet 28 - Bit 1)
          LE Long Term Key Request Neg Reply (Octet 28 - Bit 2)
          LE Read Supported States (Octet 28 - Bit 3)
          LE Receiver Test (Octet 28 - Bit 4)
          LE Transmitter Test (Octet 28 - Bit 5)
          LE Test End (Octet 28 - Bit 6)
          Read Authenticated Payload Timeout (Octet 32 - Bit 4)
          Write Authenticated Payload Timeout (Octet 32 - Bit 5)
          LE Set Data Length (Octet 33 - Bit 6)
          LE Read Suggested Default Data Length (Octet 33 - Bit 7)
          LE Write Suggested Default Data Length (Octet 34 - Bit 0)
          LE Add Device To Resolving List (Octet 34 - Bit 3)
          LE Remove Device From Resolving List (Octet 34 - Bit 4)
          LE Clear Resolving List (Octet 34 - Bit 5)
          LE Read Resolving List Size (Octet 34 - Bit 6)
          LE Set Address Resolution Enable (Octet 35 - Bit 1)
          LE Set Resolvable Private Address Timeout (Octet 35 - Bit 2)
          LE Read Maximum Data Length (Octet 35 - Bit 3)
          LE Read PHY (Octet 35 - Bit 4)
          LE Set Default PHY (Octet 35 - Bit 5)
          LE Set PHY (Octet 35 - Bit 6)
          LE Enhanced Receiver Test (Octet 35 - Bit 7)
          LE Enhanced Transmitter Test (Octet 36 - Bit 0)
          LE Set Advertising Set Random Address (Octet 36 - Bit 1)
          LE Set Extended Advertising Parameters (Octet 36 - Bit 2)
          LE Set Extended Advertising Data (Octet 36 - Bit 3)
          LE Set Extended Scan Response Data (Octet 36 - Bit 4)
          LE Set Extended Advertising Enable (Octet 36 - Bit 5)
          LE Read Maximum Advertising Data Length (Octet 36 - Bit 6)
          LE Read Number of Supported Advertising Sets (Octet 36 - Bit 7)
          LE Remove Advertising Set (Octet 37 - Bit 0)
          LE Clear Advertising Sets (Octet 37 - Bit 1)
          LE Set Periodic Advertising Parameters (Octet 37 - Bit 2)
          LE Set Periodic Advertising Data (Octet 37 - Bit 3)
          LE Set Periodic Advertising Enable (Octet 37 - Bit 4)
          LE Set Extended Scan Parameters (Octet 37 - Bit 5)
          LE Set Extended Scan Enable (Octet 37 - Bit 6)
          LE Extended Create Connection (Octet 37 - Bit 7)
          LE Periodic Advertising Create Sync (Octet 38 - Bit 0)
          LE Periodic Advertising Create Sync Cancel (Octet 38 - Bit 1)
          LE Periodic Advertising Terminate Sync (Octet 38 - Bit 2)
          LE Add Device To Periodic Advertiser List (Octet 38 - Bit 3)
          LE Remove Device From Periodic Advertiser List (Octet 38 - Bit 4)
          LE Clear Periodic Advertiser List (Octet 38 - Bit 5)
          LE Read Periodic Advertiser List Size (Octet 38 - Bit 6)
          LE Read Transmit Power (Octet 38 - Bit 7)
          LE Read RF Path Compensation (Octet 39 - Bit 0)
          LE Write RF Path Compensation (Octet 39 - Bit 1)
          LE Set Privacy Mode (Octet 39 - Bit 2)
          LE Periodic Advertising Receive Enable (Octet 40 - Bit 5)
          LE Periodic Advertising Sync Transfer (Octet 40 - Bit 6)
          LE Periodic Advertising Set Info Transfer (Octet 40 - Bit 7)
          LE Periodic Advertising Sync Transfer Parameters (Octet 41 - Bit 0)
          LE Set Default Periodic Advertisng Sync Transfer Parameters (Octet 41 - Bit 1)
          LE Read Buffer v2 (Octet 41 - Bit 5)
          LE Read ISO TX Sync (Octet 41 - Bit 6)
          LE Set Connected Isochronous Group Parameters (Octet 41 - Bit 7)
          LE Set Connected Isochronous Group Parameters Test (Octet 42 - Bit 0)
          LE Create Connected Isochronous Stream (Octet 42 - Bit 1)
          LE Remove Connected Isochronous Group (Octet 42 - Bit 2)
          LE Accept Connected Isochronous Stream Request (Octet 42 - Bit 3)
          LE Reject Connected Isochronous Stream Request (Octet 42 - Bit 4)
          LE Create Broadcast Isochronous Group (Octet 42 - Bit 5)
          LE Create Broadcast Isochronous Group Test (Octet 42 - Bit 6)
          LE Terminate Broadcast Isochronous Group (Octet 42 - Bit 7)
          LE Broadcast Isochronous Group Create Sync (Octet 43 - Bit 0)
          LE Broadcast Isochronous Group Terminate Sync (Octet 43 - Bit 1)
          LE Request Peer SCA (Octet 43 - Bit 2)
          LE Setup Isochronous Data Path (Octet 43 - Bit 3)
          LE Remove Isochronous Data Path (Octet 43 - Bit 4)
          LE Isochronous Transmit Test (Octet 43 - Bit 5)
          LE Isochronous Receive Test (Octet 43 - Bit 6)
          LE Isochronous Read Test Counters (Octet 43 - Bit 7)
          LE Isochronous Read Test Counters (Octet 44 - Bit 0)
          LE Set Host Feature (Octet 44 - Bit 1)
          Octet 44 - Bit 2 
          Octet 45 - Bit 6 
          Octet 46 - Bit 0 
          Octet 46 - Bit 1 
          Octet 46 - Bit 2 
< HCI Command: Host Buffer Size (0x03|0x0033) plen 7         #9 [hci1] 0.658318
        ACL MTU: 255  ACL max packet: 16
        SCO MTU: 0    SCO max packet: 0
> HCI Event: Command Complete (0x0e) plen 4                 #10 [hci1] 0.658785
      Host Buffer Size (0x03|0x0033) ncmd 1
        Status: Success (0x00)
< HCI Command: Set Controller To Ho.. (0x03|0x0031) plen 1  #11 [hci1] 0.678286
        Flow control: ACL Data Packets (0x01)
> HCI Event: Command Complete (0x0e) plen 4                 #12 [hci1] 0.678699
      Set Controller To Host Flow Control (0x03|0x0031) ncmd 1
        Status: Success (0x00)
< HCI Command: LE Read Local Suppor.. (0x08|0x0003) plen 0  #13 [hci1] 0.698302
> HCI Event: Command Complete (0x0e) plen 12                #14 [hci1] 0.698990
      LE Read Local Supported Features (0x08|0x0003) ncmd 1
        Status: Success (0x00)
        Features: 0xfd 0x79 0x00 0xf7 0x30 0x01 0x00 0x00
          LE Encryption
          Extended Reject Indication
          Peripheral-initiated Features Exchange
          LE Ping
          LE Data Packet Length Extension
          LL Privacy
          Extended Scanner Filter Policies
          LE 2M PHY
          LE Coded PHY
          LE Extended Advertising
          LE Periodic Advertising
          Channel Selection Algorithm #2
          Periodic Advertising Sync Transfer - Sender
          Periodic Advertising Sync Transfer - Recipient
          Sleep Clock Accuracy Updates
          Connected Isochronous Stream - Central
          Connected Isochronous Stream - Peripheral
          Isochronous Broadcaster
          Synchronized Receiver
          Periodic Advertising ADI support
          Connection Subrating
          Unknown features (0x0000010000000000)
< HCI Command: LE Set Host Feature (0x08|0x0074) plen 2     #15 [hci1] 0.718353
        Bit Number: 32
          Connected Isochronous Stream (Host Support)
        Bit Value: 1
> HCI Event: Command Complete (0x0e) plen 4                 #16 [hci1] 0.718761
      LE Set Host Feature (0x08|0x0074) ncmd 1
        Status: Success (0x00)
< HCI Command: LE Read Buffer v2 (0x08|0x0060) plen 0       #17 [hci1] 0.738345
> HCI Event: Command Complete (0x0e) plen 10                #18 [hci1] 0.739026
      LE Read Buffer v2 (0x08|0x0060) ncmd 1
        Status: Success (0x00)
        ACL MTU: 27
        ACL max packet: 3
        ISO MTU: 318
        ISO max packet: 3
< HCI Command: LE Read Maximum Adve.. (0x08|0x003a) plen 0  #19 [hci1] 0.758370
> HCI Event: Command Complete (0x0e) plen 6                 #20 [hci1] 0.758793
      LE Read Maximum Advertising Data Length (0x08|0x003a) ncmd 1
        Status: Success (0x00)
        Max length: 1650
< HCI Command: LE Read Supported St.. (0x08|0x001c) plen 0  #21 [hci1] 0.778347
> HCI Event: Command Complete (0x0e) plen 12                #22 [hci1] 0.778834
      LE Read Supported States (0x08|0x001c) ncmd 1
        Status: Success (0x00)
        States: 0x000003ff3e0306ff
          Non-connectable Advertising State
          Scannable Advertising State
          Connectable Advertising State
          High Duty Cycle Directed Advertising State
          Passive Scanning State
          Active Scanning State
          Initiating State
            and Connection State (Central Role)
          Connection State (Peripheral Role)
          Scannable Advertising State
            and Passive Scanning State
          Connectable Advertising State
            and Passive Scanning State
          Non-connectable Advertising State
            and Initiating State
          Scannable Advertising State
            and Initiating State
          Active Scanning State
            and Connection State (Central Role)
          Passive Scanning State
            and Connection State (Peripheral Role)
          Active Scanning State
            and Connection State (Peripheral Role)
          Initiating State
            and Connection State (Central Role)
            and Central Role & Central Role
          Low Duty Cycle Directed Advertising State
          Connectable Advertising State
            and Initiating State
            and Central Role & Peripheral Role
          High Duty Cycle Directed Advertising State
            and Initiating State
            and Central Role & Peripheral Role
          Low Duty Cycle Directed Advertising State
            and Initiating State
            and Central Role & Peripheral Role
          Connectable Advertising State
            and Connection State (Central Role)
            and Central Role & Peripheral Role
          High Duty Cycle Directed Advertising State
            and Connection State (Central Role)
            and Central Role & Peripheral Role
          Low Duty Cycle Directed Advertising State
            and Connection State (Central Role)
            and Central Role & Peripheral Role
          Connectable Advertising State
            and Connection State (Peripheral Role)
            and Central Role & Peripheral Role
          High Duty Cycle Directed Advertising State
            and Connection State (Peripheral Role)
            and Peripheral Role & Peripheral Role
          Low Duty Cycle Directed Advertising State
            and Connection State (Peripheral Role)
            and Peripheral Role & Peripheral Role
          Initiating State
            and Connection State (Peripheral Role)
            and Central Role & Peripheral Role
< HCI Command: LE Read Maximum Data.. (0x08|0x002f) plen 0  #23 [hci1] 0.798350
> HCI Event: Command Complete (0x0e) plen 12                #24 [hci1] 0.798835
      LE Read Maximum Data Length (0x08|0x002f) ncmd 1
        Status: Success (0x00)
        Max TX octets: 251
        Max TX time: 2704
        Max RX octets: 251
        Max RX time: 2704
< HCI Command: LE Write Suggested D.. (0x08|0x0024) plen 4  #25 [hci1] 0.818331
        TX octets: 251
        TX time: 2704
> HCI Event: Command Complete (0x0e) plen 4                 #26 [hci1] 0.818826
      LE Write Suggested Default Data Length (0x08|0x0024) ncmd 1
        Status: Success (0x00)
< HCI Command: LE Read Resolving Li.. (0x08|0x002a) plen 0  #27 [hci1] 0.838346
> HCI Event: Command Complete (0x0e) plen 5                 #28 [hci1] 0.838769
      LE Read Resolving List Size (0x08|0x002a) ncmd 1
        Status: Success (0x00)
        Size: 8
< HCI Command: LE Set Host Feature (0x08|0x0074) plen 2     #29 [hci1] 0.858372
        Bit Number: 38
          Connection Subrating (Host Support)
        Bit Value: 1
> HCI Event: Command Complete (0x0e) plen 4                 #30 [hci1] 0.858786
      LE Set Host Feature (0x08|0x0074) ncmd 1
        Status: Success (0x00)
< HCI Command: LE Set Event Mask (0x08|0x0001) plen 8       #31 [hci1] 0.878333
        Mask: 0x000002063f87fa5e
          LE Advertising Report
          LE Connection Update Complete
          LE Read Remote Used Features Complete
          LE Long Term Key Request
          LE Data Length Change
          LE Enhanced Connection Complete
          LE PHY Update Complete
          LE Extended Advertising Report
          LE Periodic Advertising Sync Established
          LE Periodic Advertising Report
          LE Periodic Advertising Sync Lost
          LE Extended Scan Timeout
          LE Extended Advertising Set Terminated
          LE Scan Request Received
          LE Periodic Advertising Sync Transfer Rvc
          LE CIS Established
          LE CIS Request
          LE Create BIG Complete
          LE Terminate BIG Complete
          LE BIG Sync Estabilished Complete
          LE BIG Sync Lost
          LE BIG Info Advertising Report
          LE Subrate Change
          Unknown mask (0x0000020000000000)
> HCI Event: Command Complete (0x0e) plen 4                 #32 [hci1] 0.878809
      LE Set Event Mask (0x08|0x0001) ncmd 1
        Status: Success (0x00)
< HCI Command: Set Event Mask (0x03|0x0001) plen 8          #33 [hci1] 0.898364
        Mask: 0x2000800002008890
          Disconnection Complete
          Encryption Change
          Read Remote Version Information Complete
          Hardware Error
          Data Buffer Overflow
          Encryption Key Refresh Complete
          LE Meta
> HCI Event: Command Complete (0x0e) plen 4                 #34 [hci1] 0.898955
      Set Event Mask (0x03|0x0001) ncmd 1
        Status: Success (0x00)
< HCI Command: Read BD ADDR (0x04|0x0009) plen 0            #35 [hci1] 0.918356
> HCI Event: Command Complete (0x0e) plen 10                #36 [hci1] 0.918826
      Read BD ADDR (0x04|0x0009) ncmd 1
        Status: Success (0x00)
        Address: 00:00:00:00:00:00 (OUI 00-00-00)
< HCI Command: LE Set Random Address (0x08|0x0005) plen 6   #37 [hci1] 0.938270
        Address: D5:B6:CC:31:DB:3B (Static)
> HCI Event: Command Complete (0x0e) plen 4                 #38 [hci1] 0.938770
      LE Set Random Address (0x08|0x0005) ncmd 1
        Status: Success (0x00)
< HCI Command: LE Set Extended Adv.. (0x08|0x0036) plen 25  #39 [hci1] 3.598414
        Handle: 0x00
        Properties: 0x0013
          Connectable
          Scannable
          Use legacy advertising PDUs: ADV_IND
        Min advertising interval: 100.000 msec (0x00a0)
        Max advertising interval: 150.000 msec (0x00f0)
        Channel map: 37, 38, 39 (0x07)
        Own address type: Random (0x01)
        Peer address type: Public (0x00)
        Peer address: 00:00:00:00:00:00 (OUI 00-00-00)
        Filter policy: Allow Scan Request from Any, Allow Connect Request from Any (0x00)
        TX power: Host has no preference (0x7f)
        Primary PHY: LE 1M (0x01)
        Secondary max skip: 0x00
        Secondary PHY: LE 1M (0x01)
        SID: 0x00
        Scan request notifications: Disabled (0x00)
> HCI Event: Command Complete (0x0e) plen 5                 #40 [hci1] 3.599147
      LE Set Extended Advertising Parameters (0x08|0x0036) ncmd 1
        Status: Success (0x00)
        TX power (selected): 0 dbm (0x00)
< HCI Command: LE Set Advertising S.. (0x08|0x0035) plen 7  #41 [hci1] 3.618347
        Advertising handle: 0x00
        Advertising random address: D5:B6:CC:31:DB:3B (Static)
> HCI Event: Command Complete (0x0e) plen 4                 #42 [hci1] 3.618879
      LE Set Advertising Set Random Address (0x08|0x0035) ncmd 1
        Status: Success (0x00)
< HCI Command: LE Set Extended Adv.. (0x08|0x0037) plen 22  #43 [hci1] 3.638386
        Handle: 0x00
        Operation: Complete extended advertising data (0x03)
        Fragment preference: Minimize fragmentation (0x01)
        Data length: 0x12
        Flags: 0x06
          LE General Discoverable Mode
          BR/EDR Not Supported
        Name (complete): Tester_F6B11A
> HCI Event: Command Complete (0x0e) plen 4                 #44 [hci1] 3.639051
      LE Set Extended Advertising Data (0x08|0x0037) ncmd 1
        Status: Success (0x00)
< HCI Command: LE Set Extended Scan.. (0x08|0x0038) plen 4  #45 [hci1] 3.658388
        Handle: 0x00
        Operation: Complete scan response data (0x03)
        Fragment preference: Minimize fragmentation (0x01)
        Data length: 0x00
> HCI Event: Command Complete (0x0e) plen 4                 #46 [hci1] 3.658843
      LE Set Extended Scan Response Data (0x08|0x0038) ncmd 1
        Status: Success (0x00)
< HCI Command: LE Set Extended Adve.. (0x08|0x0039) plen 6  #47 [hci1] 3.678232
        Extended advertising: Enabled (0x01)
        Number of sets: 1 (0x01)
        Entry 0
          Handle: 0x00
          Duration: 0 ms (0x00)
          Max ext adv events: 0
> HCI Event: Command Complete (0x0e) plen 4                 #48 [hci1] 3.678813
      LE Set Extended Advertising Enable (0x08|0x0039) ncmd 1
        Status: Success (0x00)
> HCI Event: LE Meta Event (0x3e) plen 31                   #49 [hci1] 3.787101
      LE Enhanced Connection Complete (0x0a)
        Status: Success (0x00)
        Handle: 2919
        Role: Peripheral (0x01)
        Peer address type: Public (0x00)
        Peer address: DF:A9:FF:F6:B1:1A (OUI DF-A9-FF)
        Local resolvable private address: 00:00:00:00:00:00 (Non-Resolvable)
        Peer resolvable private address: 00:00:00:00:00:00 (Non-Resolvable)
        Connection interval: 87.50 msec (0x0046)
        Connection latency: 0 (0x0000)
        Supervision timeout: 25120 msec (0x09d0)
        Central clock accuracy: 0x01
> HCI Event: LE Meta Event (0x3e) plen 6                    #50 [hci1] 3.787234
      LE Advertising Set Terminated (0x12)
        Status: Success (0x00)
        Handle: 0
        Connection handle: 2919
        Number of completed extended advertising events: 0
< HCI Command: LE Read Remote Used... (0x08|0x0016) plen 2  #51 [hci1] 3.799229
        Handle: 2919 Address: DF:A9:FF:F6:B1:1A (OUI DF-A9-FF)
< ACL Data TX: Handle 2919 flags 0x00 dlen 7                #52 [hci1] 3.799277
      ATT: Exchange MTU Request (0x02) len 2
        Client RX MTU: 251
> HCI Event: Command Status (0x0f) plen 4                   #53 [hci1] 3.799765
      LE Read Remote Used Features (0x08|0x0016) ncmd 1
        Status: Success (0x00)
> HCI Event: Number of Completed Packets (0x13) plen 5      #54 [hci1] 3.963040
        Num handles: 1
        Handle: 2919 Address: DF:A9:FF:F6:B1:1A (OUI DF-A9-FF)
        Count: 1
        #52: len 7 (0 Kb/s)
        Latency: 163 msec (163-163 msec ~163 msec)
> HCI Event: LE Meta Event (0x3e) plen 12                   #55 [hci1] 4.051030
      LE Read Remote Used Features (0x04)
        Status: Success (0x00)
        Handle: 2919 Address: DF:A9:FF:F6:B1:1A (OUI DF-A9-FF)
        Features: 0x2d 0x49 0x00 0xf7 0x67 0xd9 0x00 0x80
          LE Encryption
          Extended Reject Indication
          Peripheral-initiated Features Exchange
          LE Data Packet Length Extension
          LE 2M PHY
          LE Coded PHY
          Channel Selection Algorithm #2
          Periodic Advertising Sync Transfer - Sender
          Periodic Advertising Sync Transfer - Recipient
          Sleep Clock Accuracy Updates
          Connected Isochronous Stream - Central
          Connected Isochronous Stream - Peripheral
          Isochronous Broadcaster
          Synchronized Receiver
          Connected Isochronous Stream (Host Support)
          LE Power Control Request
          LE Power Control Request
          Connection Subrating
          Connection Subrating (Host Support)
          Unknown features (0x8000d90000000000)
> ACL Data RX: Handle 2919 flags 0x02 dlen 11               #56 [hci1] 6.500673
      SMP: Pairing Request (0x01) len 6
        IO capability: KeyboardDisplay (0x04)
        OOB data: Authentication data not present (0x00)
        Authentication requirement: Bonding, No MITM, SC, No Keypresses (0x09)
        Max encryption key size: 16
        Initiator key distribution: EncKey IdKey (0x03)
        Responder key distribution: EncKey IdKey Sign (0x07)
> ACL Data RX: Handle 2919 flags 0x02 dlen 7                #57 [hci1] 6.501157
      ATT: Exchange MTU Response (0x03) len 2
        Server RX MTU: 23
< HCI Command: Host Number of Compl.. (0x03|0x0035) plen 5  #58 [hci1] 6.519126
        Num handles: 1
        Handle: 2919 Address: DF:A9:FF:F6:B1:1A (OUI DF-A9-FF)
        Count: 1
< ACL Data TX: Handle 2919 flags 0x00 dlen 11               #59 [hci1] 6.519279
      SMP: Pairing Response (0x02) len 6
        IO capability: DisplayOnly (0x00)
        OOB data: Authentication data not present (0x00)
        Authentication requirement: Bonding, No MITM, SC, No Keypresses (0x09)
        Max encryption key size: 16
        Initiator key distribution: IdKey (0x02)
        Responder key distribution: <none> (0x00)
< HCI Command: Host Number of Compl.. (0x03|0x0035) plen 5  #60 [hci1] 6.519549
        Num handles: 1
        Handle: 2919 Address: DF:A9:FF:F6:B1:1A (OUI DF-A9-FF)
        Count: 1
> HCI Event: Number of Completed Packets (0x13) plen 5      #61 [hci1] 6.675798
        Num handles: 1
        Handle: 2919 Address: DF:A9:FF:F6:B1:1A (OUI DF-A9-FF)
        Count: 1
        #59: len 11 (0 Kb/s)
        Latency: 156 msec (156-163 msec ~160 msec)
> ACL Data RX: Handle 2919 flags 0x02 dlen 27               #62 [hci1] 6.676115
> ACL Data RX: Handle 2919 flags 0x01 dlen 27               #63 [hci1] 6.676667
> ACL Data RX: Handle 2919 flags 0x01 dlen 15               #64 [hci1] 6.677049
      SMP: Pairing Public Key (0x0c) len 64
        X: 46e371209debaa77d5290658d0f0a691cdd251cd514e9caf12c0b43579caa904
        Y: f8e53c9a2853bba3930928a37a4c41ddc2b797647ae652ff218ceb19a4f055a7
< HCI Command: Host Number of Compl.. (0x03|0x0035) plen 5  #65 [hci1] 6.679117
        Num handles: 1
        Handle: 2919 Address: DF:A9:FF:F6:B1:1A (OUI DF-A9-FF)
        Count: 1
< HCI Command: Host Number of Compl.. (0x03|0x0035) plen 5  #66 [hci1] 6.679321
        Num handles: 1
        Handle: 2919 Address: DF:A9:FF:F6:B1:1A (OUI DF-A9-FF)
        Count: 1
< HCI Command: Host Number of Compl.. (0x03|0x0035) plen 5  #67 [hci1] 6.679563
        Num handles: 1
        Handle: 2919 Address: DF:A9:FF:F6:B1:1A (OUI DF-A9-FF)
        Count: 1
< ACL Data TX: Handle 2919 flags 0x00 dlen 27               #68 [hci1] 6.679643
< ACL Data TX: Handle 2919 flags 0x01 dlen 27               #69 [hci1] 6.679653
< ACL Data TX: Handle 2919 flags 0x01 dlen 15               #70 [hci1] 6.679657
      SMP: Pairing Public Key (0x0c) len 64
        X: 98308440221e2d910f0e54b71e7ec652857aa9b5a0dc65028824cc19db1226e9
        Y: 67a4816bcb62efb21701e31fdb27561a6217575fb007a8bbdabe7e28b6f68482
> HCI Event: Number of Completed Packets (0x13) plen 5      #71 [hci1] 6.763652
        Num handles: 1
        Handle: 2919 Address: DF:A9:FF:F6:B1:1A (OUI DF-A9-FF)
        Count: 1
        #68: len 27 (2 Kb/s)
        Latency: 84 msec (84-163 msec ~122 msec)
> HCI Event: Number of Completed Packets (0x13) plen 5      #72 [hci1] 6.764311
        Num handles: 1
        Handle: 2919 Address: DF:A9:FF:F6:B1:1A (OUI DF-A9-FF)
        Count: 1
        #69: len 27 (2 Kb/s)
        Latency: 84 msec (84-163 msec ~103 msec)
< ACL Data TX: Handle 2919 flags 0x00 dlen 21               #73 [hci1] 6.778788
      SMP: Pairing Confirm (0x03) len 16
        Confim value: cc3af0e2f599a7fc41c701edd4c5871a
> HCI Event: Number of Completed Packets (0x13) plen 5      #74 [hci1] 6.850646
        Num handles: 1
        Handle: 2919 Address: DF:A9:FF:F6:B1:1A (OUI DF-A9-FF)
        Count: 1
        #70: len 15 (0 Kb/s)
        Latency: 170 msec (84-170 msec ~137 msec)
> HCI Event: Number of Completed Packets (0x13) plen 5      #75 [hci1] 6.938216
        Num handles: 1
        Handle: 2919 Address: DF:A9:FF:F6:B1:1A (OUI DF-A9-FF)
        Count: 1
        #73: len 21 (1 Kb/s)
        Latency: 159 msec (84-170 msec ~148 msec)
> ACL Data RX: Handle 2919 flags 0x02 dlen 21               #76 [hci1] 6.938591
      SMP: Pairing Random (0x04) len 16
        Random value: 995d8ce933f479d30000000000000000
< HCI Command: Host Number of Compl.. (0x03|0x0035) plen 5  #77 [hci1] 6.958811
        Num handles: 1
        Handle: 2919 Address: DF:A9:FF:F6:B1:1A (OUI DF-A9-FF)
        Count: 1
< ACL Data TX: Handle 2919 flags 0x00 dlen 21               #78 [hci1] 6.958890
      SMP: Pairing Random (0x04) len 16
        Random value: 8e6108f966a694cbe26df70bb96773e6
> HCI Event: Number of Completed Packets (0x13) plen 5      #79 [hci1] 7.113091
        Num handles: 1
        Handle: 2919 Address: DF:A9:FF:F6:B1:1A (OUI DF-A9-FF)
        Count: 1
        #78: len 21 (1 Kb/s)
        Latency: 154 msec (84-170 msec ~151 msec)
> ACL Data RX: Handle 2919 flags 0x02 dlen 21               #80 [hci1] 7.288341
      SMP: Pairing DHKey Check (0x0d) len 16
        E: 6669a50c193492f858d75dec0ed55276
< HCI Command: Host Number of Compl.. (0x03|0x0035) plen 5  #81 [hci1] 7.298683
        Num handles: 1
        Handle: 2919 Address: DF:A9:FF:F6:B1:1A (OUI DF-A9-FF)
        Count: 1
< ACL Data TX: Handle 2919 flags 0x00 dlen 21               #82 [hci1] 7.298757
      SMP: Pairing DHKey Check (0x0d) len 16
        E: 0739a394baf1c2f770a40dc97168c7ea
> HCI Event: Number of Completed Packets (0x13) plen 5      #83 [hci1] 7.463085
        Num handles: 1
        Handle: 2919 Address: DF:A9:FF:F6:B1:1A (OUI DF-A9-FF)
        Count: 1
        #82: len 21 (1 Kb/s)
        Latency: 164 msec (84-170 msec ~157 msec)
> HCI Event: LE Meta Event (0x3e) plen 13                   #84 [hci1] 7.551131
      LE Long Term Key Request (0x05)
        Handle: 2919 Address: DF:A9:FF:F6:B1:1A (OUI DF-A9-FF)
        Random number: 0x0000000000000000
        Encrypted diversifier: 0x0000
< HCI Command: LE Long Term Key Re.. (0x08|0x001a) plen 18  #85 [hci1] 7.558467
        Handle: 2919 Address: DF:A9:FF:F6:B1:1A (OUI DF-A9-FF)
        Long term key: f18c706a31046f5e75c45bb37dc190ae
> HCI Event: Command Complete (0x0e) plen 6                 #86 [hci1] 7.559130
      LE Long Term Key Request Reply (0x08|0x001a) ncmd 1
        Status: Success (0x00)
        Handle: 2919 Address: DF:A9:FF:F6:B1:1A (OUI DF-A9-FF)
> HCI Event: Encryption Change (0x08) plen 4                #87 [hci1] 7.988343
        Status: Success (0x00)
        Handle: 2919 Address: DF:A9:FF:F6:B1:1A (OUI DF-A9-FF)
        Encryption: Enabled with AES-CCM (0x01)
> ACL Data RX: Handle 2919 flags 0x02 dlen 21               #88 [hci1] 8.075919
      SMP: Identity Information (0x08) len 16
        Identity resolving key: 5ed465878d668db65364ebd48a48df56
< HCI Command: Host Number of Compl.. (0x03|0x0035) plen 5  #89 [hci1] 8.109222
        Num handles: 1
        Handle: 2919 Address: DF:A9:FF:F6:B1:1A (OUI DF-A9-FF)
        Count: 1
> ACL Data RX: Handle 2919 flags 0x02 dlen 12               #90 [hci1] 8.250727
      SMP: Identity Address Information (0x09) len 7
        Address: DF:A9:FF:F6:B1:1A (OUI DF-A9-FF)
< HCI Command: LE Add Device To Re.. (0x08|0x0027) plen 39  #91 [hci1] 8.258661
        Address type: Public (0x00)
        Address: DF:A9:FF:F6:B1:1A (OUI DF-A9-FF)
        Peer identity resolving key: 5ed465878d668db65364ebd48a48df56
        Local identity resolving key: 00000000000000000000000000000000
> HCI Event: Command Complete (0x0e) plen 4                 #92 [hci1] 8.259618
      LE Add Device To Resolving List (0x08|0x0027) ncmd 1
        Status: Success (0x00)
< HCI Command: LE Set Privacy Mode (0x08|0x004e) plen 8     #93 [hci1] 8.278566
        Peer Identity address type: Public (0x00)
        Peer Identity address: DF:A9:FF:F6:B1:1A (OUI DF-A9-FF)
        Privacy Mode: Use Device Privacy (0x01)
> HCI Event: Command Complete (0x0e) plen 4                 #94 [hci1] 8.279116
      LE Set Privacy Mode (0x08|0x004e) ncmd 1
        Status: Success (0x00)
< HCI Command: LE Set Address Resol.. (0x08|0x002d) plen 1  #95 [hci1] 8.298582
        Address resolution: Enabled (0x01)
> HCI Event: Command Complete (0x0e) plen 4                 #96 [hci1] 8.299046
      LE Set Address Resolution Enable (0x08|0x002d) ncmd 1
        Status: Success (0x00)
< HCI Command: Host Number of Compl.. (0x03|0x0035) plen 5  #97 [hci1] 8.318698
        Num handles: 1
        Handle: 2919 Address: DF:A9:FF:F6:B1:1A (OUI DF-A9-FF)
        Count: 1
> ACL Data RX: Handle 2919 flags 0x02 dlen 11               #98 [hci1] 8.425678
      ATT: Read By Group Type Request (0x10) len 6
        Handle range: 0x0001-0xffff
        Attribute group type: Primary Service (0x2800)
< HCI Command: Host Number of Compl.. (0x03|0x0035) plen 5  #99 [hci1] 8.438965
        Num handles: 1
        Handle: 2919 Address: DF:A9:FF:F6:B1:1A (OUI DF-A9-FF)
        Count: 1
< ACL Data TX: Handle 2919 flags 0x00 dlen 24              #100 [hci1] 8.439038
      ATT: Read By Group Type Response (0x11) len 19
        Attribute data length: 6
        Attribute group list: 3 entries
        Handle range: 0x0001-0x000a
        UUID: Generic Attribute Profile (0x1801)
        Handle range: 0x000b-0x0011
        UUID: Generic Access Profile (0x1800)
        Handle range: 0x0012-0x0026
        UUID: Device Information (0x180a)
> HCI Event: Number of Completed Packets (0x13) plen 5     #101 [hci1] 8.600649
        Num handles: 1
        Handle: 2919 Address: DF:A9:FF:F6:B1:1A (OUI DF-A9-FF)
        Count: 1
        #100: len 24 (1 Kb/s)
        Latency: 161 msec (84-170 msec ~159 msec)
> ACL Data RX: Handle 2919 flags 0x02 dlen 11              #102 [hci1] 8.600884
      ATT: Read By Group Type Request (0x10) len 6
        Handle range: 0x0027-0xffff
        Attribute group type: Primary Service (0x2800)
< HCI Command: Host Number of Comp.. (0x03|0x0035) plen 5  #103 [hci1] 8.619280
        Num handles: 1
        Handle: 2919 Address: DF:A9:FF:F6:B1:1A (OUI DF-A9-FF)
        Count: 1
< ACL Data TX: Handle 2919 flags 0x00 dlen 24              #104 [hci1] 8.619389
      ATT: Read By Group Type Response (0x11) len 19
        Attribute data length: 6
        Attribute group list: 3 entries
        Handle range: 0x0027-0x0029
        UUID: Immediate Alert (0x1802)
        Handle range: 0x002a-0x0056
        UUID: Generic Telephony Bearer (0x184c)
        Handle range: 0x0057-0x0083
        UUID: Telephony Bearer (0x184b)
> HCI Event: Number of Completed Packets (0x13) plen 5     #105 [hci1] 8.775725
        Num handles: 1
        Handle: 2919 Address: DF:A9:FF:F6:B1:1A (OUI DF-A9-FF)
        Count: 1
        #104: len 24 (1 Kb/s)
        Latency: 156 msec (84-170 msec ~158 msec)
> ACL Data RX: Handle 2919 flags 0x02 dlen 11              #106 [hci1] 8.775990
      ATT: Read By Group Type Request (0x10) len 6
        Handle range: 0x0084-0xffff
        Attribute group type: Primary Service (0x2800)
< HCI Command: Host Number of Comp.. (0x03|0x0035) plen 5  #107 [hci1] 8.778606
        Num handles: 1
        Handle: 2919 Address: DF:A9:FF:F6:B1:1A (OUI DF-A9-FF)
        Count: 1
< ACL Data TX: Handle 2919 flags 0x00 dlen 9               #108 [hci1] 8.778631
      ATT: Error Response (0x01) len 4
        Read By Group Type Request (0x10)
        Handle: 0x0084
        Error: Attribute Not Found (0x0a)
> HCI Event: Number of Completed Packets (0x13) plen 5     #109 [hci1] 8.950660
        Num handles: 1
        Handle: 2919 Address: DF:A9:FF:F6:B1:1A (OUI DF-A9-FF)
        Count: 1
        #108: len 9 (0 Kb/s)
        Latency: 172 msec (84-172 msec ~165 msec)
> ACL Data RX: Handle 2919 flags 0x02 dlen 13              #110 [hci1] 8.950934
      ATT: Find By Type Value Request (0x06) len 8
        Handle range: 0x0001-0xffff
        Attribute type: Primary Service (0x2800)
          UUID: Generic Telephony Bearer (0x184c)
< HCI Command: Host Number of Comp.. (0x03|0x0035) plen 5  #111 [hci1] 8.959342
        Num handles: 1
        Handle: 2919 Address: DF:A9:FF:F6:B1:1A (OUI DF-A9-FF)
        Count: 1
< ACL Data TX: Handle 2919 flags 0x00 dlen 9               #112 [hci1] 8.959445
      ATT: Find By Type Value Response (0x07) len 4
        Handle range: 0x002a-0x0056
> HCI Event: Number of Completed Packets (0x13) plen 5     #113 [hci1] 9.125665
        Num handles: 1
        Handle: 2919 Address: DF:A9:FF:F6:B1:1A (OUI DF-A9-FF)
        Count: 1
        #112: len 9 (0 Kb/s)
        Latency: 166 msec (84-172 msec ~165 msec)
> ACL Data RX: Handle 2919 flags 0x02 dlen 13              #114 [hci1] 9.125981
      ATT: Find By Type Value Request (0x06) len 8
        Handle range: 0x0057-0xffff
        Attribute type: Primary Service (0x2800)
          UUID: Generic Telephony Bearer (0x184c)
< HCI Command: Host Number of Comp.. (0x03|0x0035) plen 5  #115 [hci1] 9.139197
        Num handles: 1
        Handle: 2919 Address: DF:A9:FF:F6:B1:1A (OUI DF-A9-FF)
        Count: 1
< ACL Data TX: Handle 2919 flags 0x00 dlen 9               #116 [hci1] 9.139449
      ATT: Error Response (0x01) len 4
        Find By Type Value Request (0x06)
        Handle: 0x0057
        Error: Attribute Not Found (0x0a)
> HCI Event: Number of Completed Packets (0x13) plen 5     #117 [hci1] 9.300690
        Num handles: 1
        Handle: 2919 Address: DF:A9:FF:F6:B1:1A (OUI DF-A9-FF)
        Count: 1
        #116: len 9 (0 Kb/s)
        Latency: 161 msec (84-172 msec ~163 msec)
> ACL Data RX: Handle 2919 flags 0x02 dlen 11              #118 [hci1] 9.300907
      ATT: Read By Type Request (0x08) len 6
        Handle range: 0x002a-0x0056
        Attribute type: Characteristic (0x2803)
< HCI Command: Host Number of Comp.. (0x03|0x0035) plen 5  #119 [hci1] 9.319050
        Num handles: 1
        Handle: 2919 Address: DF:A9:FF:F6:B1:1A (OUI DF-A9-FF)
        Count: 1
< ACL Data TX: Handle 2919 flags 0x00 dlen 20              #120 [hci1] 9.319129
      ATT: Read By Type Response (0x09) len 15
        Attribute data length: 7
        Attribute data list: 2 entries
        Handle: 0x002b
        Value: 122c00b32b
            Properties: 0x12
              Read (0x02)
              Notify (0x10)
            Value Handle: 0x002c
            Value UUID: Bearer Provider Name (0x2bb3)
        Handle: 0x002e
        Value: 022f00b42b
            Properties: 0x02
              Read (0x02)
            Value Handle: 0x002f
            Value UUID: Bearer UCI (0x2bb4)
> HCI Event: Number of Completed Packets (0x13) plen 5     #121 [hci1] 9.475697
        Num handles: 1
        Handle: 2919 Address: DF:A9:FF:F6:B1:1A (OUI DF-A9-FF)
        Count: 1
        #120: len 20 (1 Kb/s)
        Latency: 156 msec (84-172 msec ~159 msec)
> ACL Data RX: Handle 2919 flags 0x02 dlen 11              #122 [hci1] 9.475856
      ATT: Read By Type Request (0x08) len 6
        Handle range: 0x002f-0x0056
        Attribute type: Characteristic (0x2803)
< HCI Command: Host Number of Comp.. (0x03|0x0035) plen 5  #123 [hci1] 9.479152
        Num handles: 1
        Handle: 2919 Address: DF:A9:FF:F6:B1:1A (OUI DF-A9-FF)
        Count: 1
< ACL Data TX: Handle 2919 flags 0x00 dlen 20              #124 [hci1] 9.479265
      ATT: Read By Type Response (0x09) len 15
        Attribute data length: 7
        Attribute data list: 2 entries
        Handle: 0x0030
        Value: 123100b52b
            Properties: 0x12
              Read (0x02)
              Notify (0x10)
            Value Handle: 0x0031
            Value UUID: Bearer Technology (0x2bb5)
        Handle: 0x0033
        Value: 123400b62b
            Properties: 0x12
              Read (0x02)
              Notify (0x10)
            Value Handle: 0x0034
            Value UUID: Bearer URI Schemes Supported List (0x2bb6)
> HCI Event: Number of Completed Packets (0x13) plen 5     #125 [hci1] 9.650623
        Num handles: 1
        Handle: 2919 Address: DF:A9:FF:F6:B1:1A (OUI DF-A9-FF)
        Count: 1
        #124: len 20 (0 Kb/s)
        Latency: 171 msec (84-172 msec ~165 msec)
> ACL Data RX: Handle 2919 flags 0x02 dlen 11              #126 [hci1] 9.650913
      ATT: Read By Type Request (0x08) len 6
        Handle range: 0x0034-0x0056
        Attribute type: Characteristic (0x2803)
< HCI Command: Host Number of Comp.. (0x03|0x0035) plen 5  #127 [hci1] 9.659134
        Num handles: 1
        Handle: 2919 Address: DF:A9:FF:F6:B1:1A (OUI DF-A9-FF)
        Count: 1
< ACL Data TX: Handle 2919 flags 0x00 dlen 20              #128 [hci1] 9.659209
      ATT: Read By Type Response (0x09) len 15
        Attribute data length: 7
        Attribute data list: 2 entries
        Handle: 0x0036
        Value: 123700b72b
            Properties: 0x12
              Read (0x02)
              Notify (0x10)
            Value Handle: 0x0037
            Value UUID: Bearer Signal Strength (0x2bb7)
        Handle: 0x0039
        Value: 0e3a00b82b
            Properties: 0x0e
              Read (0x02)
              Write Without Response (0x04)
              Write (0x08)
            Value Handle: 0x003a
            Value UUID: Bearer Signal Strength Reporting Interval (0x2bb8)
> HCI Event: Number of Completed Packets (0x13) plen 5     #129 [hci1] 9.825674
        Num handles: 1
        Handle: 2919 Address: DF:A9:FF:F6:B1:1A (OUI DF-A9-FF)
        Count: 1
        #128: len 20 (0 Kb/s)
        Latency: 166 msec (84-172 msec ~166 msec)
> ACL Data RX: Handle 2919 flags 0x02 dlen 11              #130 [hci1] 9.825855
      ATT: Read By Type Request (0x08) len 6
        Handle range: 0x003a-0x0056
        Attribute type: Characteristic (0x2803)
< HCI Command: Host Number of Comp.. (0x03|0x0035) plen 5  #131 [hci1] 9.838967
        Num handles: 1
        Handle: 2919 Address: DF:A9:FF:F6:B1:1A (OUI DF-A9-FF)
        Count: 1
< ACL Data TX: Handle 2919 flags 0x00 dlen 20              #132 [hci1] 9.839031
      ATT: Read By Type Response (0x09) len 15
        Attribute data length: 7
        Attribute data list: 2 entries
        Handle: 0x003b
        Value: 123c00b92b
            Properties: 0x12
              Read (0x02)
              Notify (0x10)
            Value Handle: 0x003c
            Value UUID: Bearer List Current Calls (0x2bb9)
        Handle: 0x003e
        Value: 023f00ba2b
            Properties: 0x02
              Read (0x02)
            Value Handle: 0x003f
            Value UUID: Content Control ID (0x2bba)
> HCI Event: Number of Completed Packets (0x13) plen 5    #133 [hci1] 10.000674
        Num handles: 1
        Handle: 2919 Address: DF:A9:FF:F6:B1:1A (OUI DF-A9-FF)
        Count: 1
        #132: len 20 (0 Kb/s)
        Latency: 161 msec (84-172 msec ~163 msec)
> ACL Data RX: Handle 2919 flags 0x02 dlen 11             #134 [hci1] 10.000890
      ATT: Read By Type Request (0x08) len 6
        Handle range: 0x003f-0x0056
        Attribute type: Characteristic (0x2803)
< HCI Command: Host Number of Com.. (0x03|0x0035) plen 5  #135 [hci1] 10.019099
        Num handles: 1
        Handle: 2919 Address: DF:A9:FF:F6:B1:1A (OUI DF-A9-FF)
        Count: 1
< ACL Data TX: Handle 2919 flags 0x00 dlen 20             #136 [hci1] 10.019183
      ATT: Read By Type Response (0x09) len 15
        Attribute data length: 7
        Attribute data list: 2 entries
        Handle: 0x0040
        Value: 124100bb2b
            Properties: 0x12
              Read (0x02)
              Notify (0x10)
            Value Handle: 0x0041
            Value UUID: Status Flags (0x2bbb)
        Handle: 0x0043
        Value: 124400bc2b
            Properties: 0x12
              Read (0x02)
              Notify (0x10)
            Value Handle: 0x0044
            Value UUID: Incoming Call Target Bearer URI (0x2bbc)
> HCI Event: Number of Completed Packets (0x13) plen 5    #137 [hci1] 10.175616
        Num handles: 1
        Handle: 2919 Address: DF:A9:FF:F6:B1:1A (OUI DF-A9-FF)
        Count: 1
        #136: len 20 (1 Kb/s)
        Latency: 156 msec (84-172 msec ~160 msec)
> ACL Data RX: Handle 2919 flags 0x02 dlen 11             #138 [hci1] 10.175837
      ATT: Read By Type Request (0x08) len 6
        Handle range: 0x0044-0x0056
        Attribute type: Characteristic (0x2803)
< HCI Command: Host Number of Com.. (0x03|0x0035) plen 5  #139 [hci1] 10.179104
        Num handles: 1
        Handle: 2919 Address: DF:A9:FF:F6:B1:1A (OUI DF-A9-FF)
        Count: 1
< ACL Data TX: Handle 2919 flags 0x00 dlen 20             #140 [hci1] 10.179193
      ATT: Read By Type Response (0x09) len 15
        Attribute data length: 7
        Attribute data list: 2 entries
        Handle: 0x0046
        Value: 124700bd2b
            Properties: 0x12
              Read (0x02)
              Notify (0x10)
            Value Handle: 0x0047
            Value UUID: Call State (0x2bbd)
        Handle: 0x0049
        Value: 1c4a00be2b
            Properties: 0x1c
              Write Without Response (0x04)
              Write (0x08)
              Notify (0x10)
            Value Handle: 0x004a
            Value UUID: Call Control Point (0x2bbe)
> HCI Event: Number of Completed Packets (0x13) plen 5    #141 [hci1] 10.350583
        Num handles: 1
        Handle: 2919 Address: DF:A9:FF:F6:B1:1A (OUI DF-A9-FF)
        Count: 1
        #140: len 20 (0 Kb/s)
        Latency: 171 msec (84-172 msec ~165 msec)
> ACL Data RX: Handle 2919 flags 0x02 dlen 11             #142 [hci1] 10.350908
      ATT: Read By Type Request (0x08) len 6
        Handle range: 0x004a-0x0056
        Attribute type: Characteristic (0x2803)
< HCI Command: Host Number of Com.. (0x03|0x0035) plen 5  #143 [hci1] 10.358998
        Num handles: 1
        Handle: 2919 Address: DF:A9:FF:F6:B1:1A (OUI DF-A9-FF)
        Count: 1
< ACL Data TX: Handle 2919 flags 0x00 dlen 20             #144 [hci1] 10.359127
      ATT: Read By Type Response (0x09) len 15
        Attribute data length: 7
        Attribute data list: 2 entries
        Handle: 0x004c
        Value: 024d00bf2b
            Properties: 0x02
              Read (0x02)
            Value Handle: 0x004d
            Value UUID: Call Control Point Optional Opcodes (0x2bbf)
        Handle: 0x004e
        Value: 104f00c02b
            Properties: 0x10
              Notify (0x10)
            Value Handle: 0x004f
            Value UUID: Termination Reason (0x2bc0)
> HCI Event: Number of Completed Packets (0x13) plen 5    #145 [hci1] 10.525586
        Num handles: 1
        Handle: 2919 Address: DF:A9:FF:F6:B1:1A (OUI DF-A9-FF)
        Count: 1
        #144: len 20 (0 Kb/s)
        Latency: 166 msec (84-172 msec ~166 msec)
> ACL Data RX: Handle 2919 flags 0x02 dlen 11             #146 [hci1] 10.525959
      ATT: Read By Type Request (0x08) len 6
        Handle range: 0x004f-0x0056
        Attribute type: Characteristic (0x2803)
< HCI Command: Host Number of Com.. (0x03|0x0035) plen 5  #147 [hci1] 10.539149
        Num handles: 1
        Handle: 2919 Address: DF:A9:FF:F6:B1:1A (OUI DF-A9-FF)
        Count: 1
< ACL Data TX: Handle 2919 flags 0x00 dlen 20             #148 [hci1] 10.539225
      ATT: Read By Type Response (0x09) len 15
        Attribute data length: 7
        Attribute data list: 2 entries
        Handle: 0x0051
        Value: 125200c12b
            Properties: 0x12
              Read (0x02)
              Notify (0x10)
            Value Handle: 0x0052
            Value UUID: Incoming Call (0x2bc1)
        Handle: 0x0054
        Value: 125500c22b
            Properties: 0x12
              Read (0x02)
              Notify (0x10)
            Value Handle: 0x0055
            Value UUID: Call Friendly Name (0x2bc2)
> HCI Event: Number of Completed Packets (0x13) plen 5    #149 [hci1] 10.700674
        Num handles: 1
        Handle: 2919 Address: DF:A9:FF:F6:B1:1A (OUI DF-A9-FF)
        Count: 1
        #148: len 20 (0 Kb/s)
        Latency: 161 msec (84-172 msec ~163 msec)
> ACL Data RX: Handle 2919 flags 0x02 dlen 11             #150 [hci1] 10.700868
      ATT: Read By Type Request (0x08) len 6
        Handle range: 0x0055-0x0056
        Attribute type: Characteristic (0x2803)
< HCI Command: Host Number of Com.. (0x03|0x0035) plen 5  #151 [hci1] 10.719070
        Num handles: 1
        Handle: 2919 Address: DF:A9:FF:F6:B1:1A (OUI DF-A9-FF)
        Count: 1
< ACL Data TX: Handle 2919 flags 0x00 dlen 9              #152 [hci1] 10.719409
      ATT: Error Response (0x01) len 4
        Read By Type Request (0x08)
        Handle: 0x0055
        Error: Attribute Not Found (0x0a)
> HCI Event: Number of Completed Packets (0x13) plen 5    #153 [hci1] 10.875614
        Num handles: 1
        Handle: 2919 Address: DF:A9:FF:F6:B1:1A (OUI DF-A9-FF)
        Count: 1
        #152: len 9 (0 Kb/s)
        Latency: 156 msec (84-172 msec ~159 msec)
> ACL Data RX: Handle 2919 flags 0x02 dlen 13             #154 [hci1] 10.875939
      ATT: Find By Type Value Request (0x06) len 8
        Handle range: 0x0001-0xffff
        Attribute type: Primary Service (0x2800)
          UUID: Generic Telephony Bearer (0x184c)
< HCI Command: Host Number of Com.. (0x03|0x0035) plen 5  #155 [hci1] 10.879316
        Num handles: 1
        Handle: 2919 Address: DF:A9:FF:F6:B1:1A (OUI DF-A9-FF)
        Count: 1
< ACL Data TX: Handle 2919 flags 0x00 dlen 9              #156 [hci1] 10.879404
      ATT: Find By Type Value Response (0x07) len 4
        Handle range: 0x002a-0x0056
> HCI Event: Number of Completed Packets (0x13) plen 5    #157 [hci1] 11.050614
        Num handles: 1
        Handle: 2919 Address: DF:A9:FF:F6:B1:1A (OUI DF-A9-FF)
        Count: 1
        #156: len 9 (0 Kb/s)
        Latency: 171 msec (84-172 msec ~165 msec)
> ACL Data RX: Handle 2919 flags 0x02 dlen 13             #158 [hci1] 11.050870
      ATT: Find By Type Value Request (0x06) len 8
        Handle range: 0x0057-0xffff
        Attribute type: Primary Service (0x2800)
          UUID: Generic Telephony Bearer (0x184c)
< HCI Command: Host Number of Com.. (0x03|0x0035) plen 5  #159 [hci1] 11.059188
        Num handles: 1
        Handle: 2919 Address: DF:A9:FF:F6:B1:1A (OUI DF-A9-FF)
        Count: 1
< ACL Data TX: Handle 2919 flags 0x00 dlen 9              #160 [hci1] 11.059389
      ATT: Error Response (0x01) len 4
        Find By Type Value Request (0x06)
        Handle: 0x0057
        Error: Attribute Not Found (0x0a)
> HCI Event: Number of Completed Packets (0x13) plen 5    #161 [hci1] 11.225591
        Num handles: 1
        Handle: 2919 Address: DF:A9:FF:F6:B1:1A (OUI DF-A9-FF)
        Count: 1
        #160: len 9 (0 Kb/s)
        Latency: 166 msec (84-172 msec ~165 msec)
> ACL Data RX: Handle 2919 flags 0x02 dlen 11             #162 [hci1] 11.225898
      ATT: Read By Type Request (0x08) len 6
        Handle range: 0x002a-0x0056
        Attribute type: Characteristic (0x2803)
< HCI Command: Host Number of Com.. (0x03|0x0035) plen 5  #163 [hci1] 11.239143
        Num handles: 1
        Handle: 2919 Address: DF:A9:FF:F6:B1:1A (OUI DF-A9-FF)
        Count: 1
< ACL Data TX: Handle 2919 flags 0x00 dlen 20             #164 [hci1] 11.239271
      ATT: Read By Type Response (0x09) len 15
        Attribute data length: 7
        Attribute data list: 2 entries
        Handle: 0x002b
        Value: 122c00b32b
            Properties: 0x12
              Read (0x02)
              Notify (0x10)
            Value Handle: 0x002c
            Value UUID: Bearer Provider Name (0x2bb3)
        Handle: 0x002e
        Value: 022f00b42b
            Properties: 0x02
              Read (0x02)
            Value Handle: 0x002f
            Value UUID: Bearer UCI (0x2bb4)
> HCI Event: Number of Completed Packets (0x13) plen 5    #165 [hci1] 11.400644
        Num handles: 1
        Handle: 2919 Address: DF:A9:FF:F6:B1:1A (OUI DF-A9-FF)
        Count: 1
        #164: len 20 (0 Kb/s)
        Latency: 161 msec (84-172 msec ~163 msec)
> ACL Data RX: Handle 2919 flags 0x02 dlen 11             #166 [hci1] 11.400915
      ATT: Read By Type Request (0x08) len 6
        Handle range: 0x002f-0x0056
        Attribute type: Characteristic (0x2803)
< HCI Command: Host Number of Com.. (0x03|0x0035) plen 5  #167 [hci1] 11.418841
        Num handles: 1
        Handle: 2919 Address: DF:A9:FF:F6:B1:1A (OUI DF-A9-FF)
        Count: 1
< ACL Data TX: Handle 2919 flags 0x00 dlen 20             #168 [hci1] 11.418921
      ATT: Read By Type Response (0x09) len 15
        Attribute data length: 7
        Attribute data list: 2 entries
        Handle: 0x0030
        Value: 123100b52b
            Properties: 0x12
              Read (0x02)
              Notify (0x10)
            Value Handle: 0x0031
            Value UUID: Bearer Technology (0x2bb5)
        Handle: 0x0033
        Value: 123400b62b
            Properties: 0x12
              Read (0x02)
              Notify (0x10)
            Value Handle: 0x0034
            Value UUID: Bearer URI Schemes Supported List (0x2bb6)
> HCI Event: Number of Completed Packets (0x13) plen 5    #169 [hci1] 11.575621
        Num handles: 1
        Handle: 2919 Address: DF:A9:FF:F6:B1:1A (OUI DF-A9-FF)
        Count: 1
        #168: len 20 (1 Kb/s)
        Latency: 156 msec (84-172 msec ~160 msec)
> ACL Data RX: Handle 2919 flags 0x02 dlen 11             #170 [hci1] 11.575851
      ATT: Read By Type Request (0x08) len 6
        Handle range: 0x0034-0x0056
        Attribute type: Characteristic (0x2803)
< HCI Command: Host Number of Com.. (0x03|0x0035) plen 5  #171 [hci1] 11.579111
        Num handles: 1
        Handle: 2919 Address: DF:A9:FF:F6:B1:1A (OUI DF-A9-FF)
        Count: 1
< ACL Data TX: Handle 2919 flags 0x00 dlen 20             #172 [hci1] 11.579207
      ATT: Read By Type Response (0x09) len 15
        Attribute data length: 7
        Attribute data list: 2 entries
        Handle: 0x0036
        Value: 123700b72b
            Properties: 0x12
              Read (0x02)
              Notify (0x10)
            Value Handle: 0x0037
            Value UUID: Bearer Signal Strength (0x2bb7)
        Handle: 0x0039
        Value: 0e3a00b82b
            Properties: 0x0e
              Read (0x02)
              Write Without Response (0x04)
              Write (0x08)
            Value Handle: 0x003a
            Value UUID: Bearer Signal Strength Reporting Interval (0x2bb8)
> HCI Event: Number of Completed Packets (0x13) plen 5    #173 [hci1] 11.750638
        Num handles: 1
        Handle: 2919 Address: DF:A9:FF:F6:B1:1A (OUI DF-A9-FF)
        Count: 1
        #172: len 20 (0 Kb/s)
        Latency: 171 msec (84-172 msec ~165 msec)
> ACL Data RX: Handle 2919 flags 0x02 dlen 11             #174 [hci1] 11.750843
      ATT: Read By Type Request (0x08) len 6
        Handle range: 0x003a-0x0056
        Attribute type: Characteristic (0x2803)
< HCI Command: Host Number of Com.. (0x03|0x0035) plen 5  #175 [hci1] 11.758781
        Num handles: 1
        Handle: 2919 Address: DF:A9:FF:F6:B1:1A (OUI DF-A9-FF)
        Count: 1
< ACL Data TX: Handle 2919 flags 0x00 dlen 20             #176 [hci1] 11.758878
      ATT: Read By Type Response (0x09) len 15
        Attribute data length: 7
        Attribute data list: 2 entries
        Handle: 0x003b
        Value: 123c00b92b
            Properties: 0x12
              Read (0x02)
              Notify (0x10)
            Value Handle: 0x003c
            Value UUID: Bearer List Current Calls (0x2bb9)
        Handle: 0x003e
        Value: 023f00ba2b
            Properties: 0x02
              Read (0x02)
            Value Handle: 0x003f
            Value UUID: Content Control ID (0x2bba)
> HCI Event: Number of Completed Packets (0x13) plen 5    #177 [hci1] 11.925566
        Num handles: 1
        Handle: 2919 Address: DF:A9:FF:F6:B1:1A (OUI DF-A9-FF)
        Count: 1
        #176: len 20 (0 Kb/s)
        Latency: 166 msec (84-172 msec ~166 msec)
> ACL Data RX: Handle 2919 flags 0x02 dlen 11             #178 [hci1] 11.925881
      ATT: Read By Type Request (0x08) len 6
        Handle range: 0x003f-0x0056
        Attribute type: Characteristic (0x2803)
< HCI Command: Host Number of Com.. (0x03|0x0035) plen 5  #179 [hci1] 11.939009
        Num handles: 1
        Handle: 2919 Address: DF:A9:FF:F6:B1:1A (OUI DF-A9-FF)
        Count: 1
< ACL Data TX: Handle 2919 flags 0x00 dlen 20             #180 [hci1] 11.939101
      ATT: Read By Type Response (0x09) len 15
        Attribute data length: 7
        Attribute data list: 2 entries
        Handle: 0x0040
        Value: 124100bb2b
            Properties: 0x12
              Read (0x02)
              Notify (0x10)
            Value Handle: 0x0041
            Value UUID: Status Flags (0x2bbb)
        Handle: 0x0043
        Value: 124400bc2b
            Properties: 0x12
              Read (0x02)
              Notify (0x10)
            Value Handle: 0x0044
            Value UUID: Incoming Call Target Bearer URI (0x2bbc)
> HCI Event: Number of Completed Packets (0x13) plen 5    #181 [hci1] 12.100628
        Num handles: 1
        Handle: 2919 Address: DF:A9:FF:F6:B1:1A (OUI DF-A9-FF)
        Count: 1
        #180: len 20 (0 Kb/s)
        Latency: 161 msec (84-172 msec ~163 msec)
> ACL Data RX: Handle 2919 flags 0x02 dlen 11             #182 [hci1] 12.100842
      ATT: Read By Type Request (0x08) len 6
        Handle range: 0x0044-0x0056
        Attribute type: Characteristic (0x2803)
< HCI Command: Host Number of Com.. (0x03|0x0035) plen 5  #183 [hci1] 12.119077
        Num handles: 1
        Handle: 2919 Address: DF:A9:FF:F6:B1:1A (OUI DF-A9-FF)
        Count: 1
< ACL Data TX: Handle 2919 flags 0x00 dlen 20             #184 [hci1] 12.119240
      ATT: Read By Type Response (0x09) len 15
        Attribute data length: 7
        Attribute data list: 2 entries
        Handle: 0x0046
        Value: 124700bd2b
            Properties: 0x12
              Read (0x02)
              Notify (0x10)
            Value Handle: 0x0047
            Value UUID: Call State (0x2bbd)
        Handle: 0x0049
        Value: 1c4a00be2b
            Properties: 0x1c
              Write Without Response (0x04)
              Write (0x08)
              Notify (0x10)
            Value Handle: 0x004a
            Value UUID: Call Control Point (0x2bbe)
> HCI Event: Number of Completed Packets (0x13) plen 5    #185 [hci1] 12.275611
        Num handles: 1
        Handle: 2919 Address: DF:A9:FF:F6:B1:1A (OUI DF-A9-FF)
        Count: 1
        #184: len 20 (1 Kb/s)
        Latency: 156 msec (84-172 msec ~160 msec)
> ACL Data RX: Handle 2919 flags 0x02 dlen 11             #186 [hci1] 12.275859
      ATT: Read By Type Request (0x08) len 6
        Handle range: 0x004a-0x0056
        Attribute type: Characteristic (0x2803)
< HCI Command: Host Number of Com.. (0x03|0x0035) plen 5  #187 [hci1] 12.278611
        Num handles: 1
        Handle: 2919 Address: DF:A9:FF:F6:B1:1A (OUI DF-A9-FF)
        Count: 1
< ACL Data TX: Handle 2919 flags 0x00 dlen 20             #188 [hci1] 12.278682
      ATT: Read By Type Response (0x09) len 15
        Attribute data length: 7
        Attribute data list: 2 entries
        Handle: 0x004c
        Value: 024d00bf2b
            Properties: 0x02
              Read (0x02)
            Value Handle: 0x004d
            Value UUID: Call Control Point Optional Opcodes (0x2bbf)
        Handle: 0x004e
        Value: 104f00c02b
            Properties: 0x10
              Notify (0x10)
            Value Handle: 0x004f
            Value UUID: Termination Reason (0x2bc0)
> HCI Event: Number of Completed Packets (0x13) plen 5    #189 [hci1] 12.450699
        Num handles: 1
        Handle: 2919 Address: DF:A9:FF:F6:B1:1A (OUI DF-A9-FF)
        Count: 1
        #188: len 20 (0 Kb/s)
        Latency: 172 msec (84-172 msec ~166 msec)
> ACL Data RX: Handle 2919 flags 0x02 dlen 11             #190 [hci1] 12.450789
      ATT: Read By Type Request (0x08) len 6
        Handle range: 0x004f-0x0056
        Attribute type: Characteristic (0x2803)
< HCI Command: Host Number of Com.. (0x03|0x0035) plen 5  #191 [hci1] 12.459185
        Num handles: 1
        Handle: 2919 Address: DF:A9:FF:F6:B1:1A (OUI DF-A9-FF)
        Count: 1
< ACL Data TX: Handle 2919 flags 0x00 dlen 20             #192 [hci1] 12.459352
      ATT: Read By Type Response (0x09) len 15
        Attribute data length: 7
        Attribute data list: 2 entries
        Handle: 0x0051
        Value: 125200c12b
            Properties: 0x12
              Read (0x02)
              Notify (0x10)
            Value Handle: 0x0052
            Value UUID: Incoming Call (0x2bc1)
        Handle: 0x0054
        Value: 125500c22b
            Properties: 0x12
              Read (0x02)
              Notify (0x10)
            Value Handle: 0x0055
            Value UUID: Call Friendly Name (0x2bc2)
> HCI Event: Number of Completed Packets (0x13) plen 5    #193 [hci1] 12.625571
        Num handles: 1
        Handle: 2919 Address: DF:A9:FF:F6:B1:1A (OUI DF-A9-FF)
        Count: 1
        #192: len 20 (0 Kb/s)
        Latency: 166 msec (84-172 msec ~166 msec)
> ACL Data RX: Handle 2919 flags 0x02 dlen 11             #194 [hci1] 12.625929
      ATT: Read By Type Request (0x08) len 6
        Handle range: 0x0055-0x0056
        Attribute type: Characteristic (0x2803)
< HCI Command: Host Number of Com.. (0x03|0x0035) plen 5  #195 [hci1] 12.639115
        Num handles: 1
        Handle: 2919 Address: DF:A9:FF:F6:B1:1A (OUI DF-A9-FF)
        Count: 1
< ACL Data TX: Handle 2919 flags 0x00 dlen 9              #196 [hci1] 12.639238
      ATT: Error Response (0x01) len 4
        Read By Type Request (0x08)
        Handle: 0x0055
        Error: Attribute Not Found (0x0a)
> HCI Event: Number of Completed Packets (0x13) plen 5    #197 [hci1] 12.800555
        Num handles: 1
        Handle: 2919 Address: DF:A9:FF:F6:B1:1A (OUI DF-A9-FF)
        Count: 1
        #196: len 9 (0 Kb/s)
        Latency: 161 msec (84-172 msec ~163 msec)
> ACL Data RX: Handle 2919 flags 0x02 dlen 9              #198 [hci1] 12.800759
      ATT: Find Information Request (0x04) len 4
        Handle range: 0x002d-0x002d
< HCI Command: Host Number of Com.. (0x03|0x0035) plen 5  #199 [hci1] 12.818686
        Num handles: 1
        Handle: 2919 Address: DF:A9:FF:F6:B1:1A (OUI DF-A9-FF)
        Count: 1
< ACL Data TX: Handle 2919 flags 0x00 dlen 10             #200 [hci1] 12.818763
      ATT: Find Information Response (0x05) len 5
        Format: UUID-16 (0x01)
        Handle: 0x002d
        UUID: Client Characteristic Configuration (0x2902)
> HCI Event: Number of Completed Packets (0x13) plen 5    #201 [hci1] 12.975634
        Num handles: 1
        Handle: 2919 Address: DF:A9:FF:F6:B1:1A (OUI DF-A9-FF)
        Count: 1
        #200: len 10 (0 Kb/s)
        Latency: 156 msec (84-172 msec ~160 msec)
> ACL Data RX: Handle 2919 flags 0x02 dlen 9              #202 [hci1] 12.975789
      ATT: Find Information Request (0x04) len 4
        Handle range: 0x0032-0x0032
< HCI Command: Host Number of Com.. (0x03|0x0035) plen 5  #203 [hci1] 12.978680
        Num handles: 1
        Handle: 2919 Address: DF:A9:FF:F6:B1:1A (OUI DF-A9-FF)
        Count: 1
< ACL Data TX: Handle 2919 flags 0x00 dlen 10             #204 [hci1] 12.978731
      ATT: Find Information Response (0x05) len 5
        Format: UUID-16 (0x01)
        Handle: 0x0032
        UUID: Client Characteristic Configuration (0x2902)
> HCI Event: Number of Completed Packets (0x13) plen 5    #205 [hci1] 13.150532
        Num handles: 1
        Handle: 2919 Address: DF:A9:FF:F6:B1:1A (OUI DF-A9-FF)
        Count: 1
        #204: len 10 (0 Kb/s)
        Latency: 171 msec (84-172 msec ~166 msec)
> ACL Data RX: Handle 2919 flags 0x02 dlen 9              #206 [hci1] 13.150760
      ATT: Find Information Request (0x04) len 4
        Handle range: 0x0035-0x0035
< HCI Command: Host Number of Com.. (0x03|0x0035) plen 5  #207 [hci1] 13.159127
        Num handles: 1
        Handle: 2919 Address: DF:A9:FF:F6:B1:1A (OUI DF-A9-FF)
        Count: 1
< ACL Data TX: Handle 2919 flags 0x00 dlen 10             #208 [hci1] 13.159202
      ATT: Find Information Response (0x05) len 5
        Format: UUID-16 (0x01)
        Handle: 0x0035
        UUID: Client Characteristic Configuration (0x2902)
> HCI Event: Number of Completed Packets (0x13) plen 5    #209 [hci1] 13.325566
        Num handles: 1
        Handle: 2919 Address: DF:A9:FF:F6:B1:1A (OUI DF-A9-FF)
        Count: 1
        #208: len 10 (0 Kb/s)
        Latency: 166 msec (84-172 msec ~166 msec)
> ACL Data RX: Handle 2919 flags 0x02 dlen 9              #210 [hci1] 13.325809
      ATT: Find Information Request (0x04) len 4
        Handle range: 0x0038-0x0038
< HCI Command: Host Number of Com.. (0x03|0x0035) plen 5  #211 [hci1] 13.339068
        Num handles: 1
        Handle: 2919 Address: DF:A9:FF:F6:B1:1A (OUI DF-A9-FF)
        Count: 1
< ACL Data TX: Handle 2919 flags 0x00 dlen 10             #212 [hci1] 13.339152
      ATT: Find Information Response (0x05) len 5
        Format: UUID-16 (0x01)
        Handle: 0x0038
        UUID: Client Characteristic Configuration (0x2902)
> HCI Event: Number of Completed Packets (0x13) plen 5    #213 [hci1] 13.500560
        Num handles: 1
        Handle: 2919 Address: DF:A9:FF:F6:B1:1A (OUI DF-A9-FF)
        Count: 1
        #212: len 10 (0 Kb/s)
        Latency: 161 msec (84-172 msec ~163 msec)
> ACL Data RX: Handle 2919 flags 0x02 dlen 9              #214 [hci1] 13.500851
      ATT: Find Information Request (0x04) len 4
        Handle range: 0x003d-0x003d
< HCI Command: Host Number of Com.. (0x03|0x0035) plen 5  #215 [hci1] 13.519070
        Num handles: 1
        Handle: 2919 Address: DF:A9:FF:F6:B1:1A (OUI DF-A9-FF)
        Count: 1
< ACL Data TX: Handle 2919 flags 0x00 dlen 10             #216 [hci1] 13.519142
      ATT: Find Information Response (0x05) len 5
        Format: UUID-16 (0x01)
        Handle: 0x003d
        UUID: Client Characteristic Configuration (0x2902)
> HCI Event: Number of Completed Packets (0x13) plen 5    #217 [hci1] 13.675594
        Num handles: 1
        Handle: 2919 Address: DF:A9:FF:F6:B1:1A (OUI DF-A9-FF)
        Count: 1
        #216: len 10 (0 Kb/s)
        Latency: 156 msec (84-172 msec ~160 msec)
> ACL Data RX: Handle 2919 flags 0x02 dlen 9              #218 [hci1] 13.675866
      ATT: Find Information Request (0x04) len 4
        Handle range: 0x0042-0x0042
< HCI Command: Host Number of Com.. (0x03|0x0035) plen 5  #219 [hci1] 13.679106
        Num handles: 1
        Handle: 2919 Address: DF:A9:FF:F6:B1:1A (OUI DF-A9-FF)
        Count: 1
< ACL Data TX: Handle 2919 flags 0x00 dlen 10             #220 [hci1] 13.679204
      ATT: Find Information Response (0x05) len 5
        Format: UUID-16 (0x01)
        Handle: 0x0042
        UUID: Client Characteristic Configuration (0x2902)
> HCI Event: Number of Completed Packets (0x13) plen 5    #221 [hci1] 13.850571
        Num handles: 1
        Handle: 2919 Address: DF:A9:FF:F6:B1:1A (OUI DF-A9-FF)
        Count: 1
        #220: len 10 (0 Kb/s)
        Latency: 171 msec (84-172 msec ~165 msec)
> ACL Data RX: Handle 2919 flags 0x02 dlen 9              #222 [hci1] 13.850816
      ATT: Find Information Request (0x04) len 4
        Handle range: 0x0045-0x0045
< HCI Command: Host Number of Com.. (0x03|0x0035) plen 5  #223 [hci1] 13.858937
        Num handles: 1
        Handle: 2919 Address: DF:A9:FF:F6:B1:1A (OUI DF-A9-FF)
        Count: 1
< ACL Data TX: Handle 2919 flags 0x00 dlen 10             #224 [hci1] 13.858995
      ATT: Find Information Response (0x05) len 5
        Format: UUID-16 (0x01)
        Handle: 0x0045
        UUID: Client Characteristic Configuration (0x2902)
> HCI Event: Number of Completed Packets (0x13) plen 5    #225 [hci1] 14.025572
        Num handles: 1
        Handle: 2919 Address: DF:A9:FF:F6:B1:1A (OUI DF-A9-FF)
        Count: 1
        #224: len 10 (0 Kb/s)
        Latency: 166 msec (84-172 msec ~166 msec)
> ACL Data RX: Handle 2919 flags 0x02 dlen 9              #226 [hci1] 14.025782
      ATT: Find Information Request (0x04) len 4
        Handle range: 0x0048-0x0048
< HCI Command: Host Number of Com.. (0x03|0x0035) plen 5  #227 [hci1] 14.039184
        Num handles: 1
        Handle: 2919 Address: DF:A9:FF:F6:B1:1A (OUI DF-A9-FF)
        Count: 1
< ACL Data TX: Handle 2919 flags 0x00 dlen 10             #228 [hci1] 14.039277
      ATT: Find Information Response (0x05) len 5
        Format: UUID-16 (0x01)
        Handle: 0x0048
        UUID: Client Characteristic Configuration (0x2902)
> HCI Event: Number of Completed Packets (0x13) plen 5    #229 [hci1] 14.200509
        Num handles: 1
        Handle: 2919 Address: DF:A9:FF:F6:B1:1A (OUI DF-A9-FF)
        Count: 1
        #228: len 10 (0 Kb/s)
        Latency: 161 msec (84-172 msec ~163 msec)
> ACL Data RX: Handle 2919 flags 0x02 dlen 9              #230 [hci1] 14.200781
      ATT: Find Information Request (0x04) len 4
        Handle range: 0x004b-0x004b
< HCI Command: Host Number of Com.. (0x03|0x0035) plen 5  #231 [hci1] 14.219169
        Num handles: 1
        Handle: 2919 Address: DF:A9:FF:F6:B1:1A (OUI DF-A9-FF)
        Count: 1
< ACL Data TX: Handle 2919 flags 0x00 dlen 10             #232 [hci1] 14.219268
      ATT: Find Information Response (0x05) len 5
        Format: UUID-16 (0x01)
        Handle: 0x004b
        UUID: Client Characteristic Configuration (0x2902)
> HCI Event: Number of Completed Packets (0x13) plen 5    #233 [hci1] 14.375651
        Num handles: 1
        Handle: 2919 Address: DF:A9:FF:F6:B1:1A (OUI DF-A9-FF)
        Count: 1
        #232: len 10 (0 Kb/s)
        Latency: 156 msec (84-172 msec ~160 msec)
> ACL Data RX: Handle 2919 flags 0x02 dlen 9              #234 [hci1] 14.375821
      ATT: Find Information Request (0x04) len 4
        Handle range: 0x0050-0x0050
< HCI Command: Host Number of Com.. (0x03|0x0035) plen 5  #235 [hci1] 14.379115
        Num handles: 1
        Handle: 2919 Address: DF:A9:FF:F6:B1:1A (OUI DF-A9-FF)
        Count: 1
< ACL Data TX: Handle 2919 flags 0x00 dlen 10             #236 [hci1] 14.379198
      ATT: Find Information Response (0x05) len 5
        Format: UUID-16 (0x01)
        Handle: 0x0050
        UUID: Client Characteristic Configuration (0x2902)
> HCI Event: Number of Completed Packets (0x13) plen 5    #237 [hci1] 14.550616
        Num handles: 1
        Handle: 2919 Address: DF:A9:FF:F6:B1:1A (OUI DF-A9-FF)
        Count: 1
        #236: len 10 (0 Kb/s)
        Latency: 171 msec (84-172 msec ~165 msec)
> ACL Data RX: Handle 2919 flags 0x02 dlen 9              #238 [hci1] 14.550865
      ATT: Find Information Request (0x04) len 4
        Handle range: 0x0053-0x0053
< HCI Command: Host Number of Com.. (0x03|0x0035) plen 5  #239 [hci1] 14.559206
        Num handles: 1
        Handle: 2919 Address: DF:A9:FF:F6:B1:1A (OUI DF-A9-FF)
        Count: 1
< ACL Data TX: Handle 2919 flags 0x00 dlen 10             #240 [hci1] 14.559356
      ATT: Find Information Response (0x05) len 5
        Format: UUID-16 (0x01)
        Handle: 0x0053
        UUID: Client Characteristic Configuration (0x2902)
> HCI Event: Number of Completed Packets (0x13) plen 5    #241 [hci1] 14.725519
        Num handles: 1
        Handle: 2919 Address: DF:A9:FF:F6:B1:1A (OUI DF-A9-FF)
        Count: 1
        #240: len 10 (0 Kb/s)
        Latency: 166 msec (84-172 msec ~165 msec)
> ACL Data RX: Handle 2919 flags 0x02 dlen 9              #242 [hci1] 14.725793
      ATT: Find Information Request (0x04) len 4
        Handle range: 0x0056-0x0056
< HCI Command: Host Number of Com.. (0x03|0x0035) plen 5  #243 [hci1] 14.739201
        Num handles: 1
        Handle: 2919 Address: DF:A9:FF:F6:B1:1A (OUI DF-A9-FF)
        Count: 1
< ACL Data TX: Handle 2919 flags 0x00 dlen 10             #244 [hci1] 14.739299
      ATT: Find Information Response (0x05) len 5
        Format: UUID-16 (0x01)
        Handle: 0x0056
        UUID: Client Characteristic Configuration (0x2902)
> HCI Event: Number of Completed Packets (0x13) plen 5    #245 [hci1] 14.900627
        Num handles: 1
        Handle: 2919 Address: DF:A9:FF:F6:B1:1A (OUI DF-A9-FF)
        Count: 1
        #244: len 10 (0 Kb/s)
        Latency: 161 msec (84-172 msec ~163 msec)
> ACL Data RX: Handle 2919 flags 0x02 dlen 7              #246 [hci1] 14.900730
      ATT: Read Request (0x0a) len 2
        Handle: 0x002d
< HCI Command: Host Number of Com.. (0x03|0x0035) plen 5  #247 [hci1] 14.919181
        Num handles: 1
        Handle: 2919 Address: DF:A9:FF:F6:B1:1A (OUI DF-A9-FF)
        Count: 1
< ACL Data TX: Handle 2919 flags 0x00 dlen 7              #248 [hci1] 14.919292
      ATT: Read Response (0x0b) len 2
> HCI Event: Number of Completed Packets (0x13) plen 5    #249 [hci1] 15.075645
        Num handles: 1
        Handle: 2919 Address: DF:A9:FF:F6:B1:1A (OUI DF-A9-FF)
        Count: 1
        #248: len 7 (0 Kb/s)
        Latency: 156 msec (84-172 msec ~159 msec)
> ACL Data RX: Handle 2919 flags 0x02 dlen 7              #250 [hci1] 15.075756
      ATT: Read Request (0x0a) len 2
        Handle: 0x0032
< HCI Command: Host Number of Com.. (0x03|0x0035) plen 5  #251 [hci1] 15.079160
        Num handles: 1
        Handle: 2919 Address: DF:A9:FF:F6:B1:1A (OUI DF-A9-FF)
        Count: 1
< ACL Data TX: Handle 2919 flags 0x00 dlen 7              #252 [hci1] 15.079239
      ATT: Read Response (0x0b) len 2
> HCI Event: Number of Completed Packets (0x13) plen 5    #253 [hci1] 15.250609
        Num handles: 1
        Handle: 2919 Address: DF:A9:FF:F6:B1:1A (OUI DF-A9-FF)
        Count: 1
        #252: len 7 (0 Kb/s)
        Latency: 171 msec (84-172 msec ~165 msec)
> ACL Data RX: Handle 2919 flags 0x02 dlen 7              #254 [hci1] 15.250724
      ATT: Read Request (0x0a) len 2
        Handle: 0x0035
< HCI Command: Host Number of Com.. (0x03|0x0035) plen 5  #255 [hci1] 15.259232
        Num handles: 1
        Handle: 2919 Address: DF:A9:FF:F6:B1:1A (OUI DF-A9-FF)
        Count: 1
< ACL Data TX: Handle 2919 flags 0x00 dlen 7              #256 [hci1] 15.259340
      ATT: Read Response (0x0b) len 2
> HCI Event: Number of Completed Packets (0x13) plen 5    #257 [hci1] 15.425521
        Num handles: 1
        Handle: 2919 Address: DF:A9:FF:F6:B1:1A (OUI DF-A9-FF)
        Count: 1
        #256: len 7 (0 Kb/s)
        Latency: 166 msec (84-172 msec ~165 msec)
> ACL Data RX: Handle 2919 flags 0x02 dlen 7              #258 [hci1] 15.425725
      ATT: Read Request (0x0a) len 2
        Handle: 0x0038
< HCI Command: Host Number of Com.. (0x03|0x0035) plen 5  #259 [hci1] 15.438771
        Num handles: 1
        Handle: 2919 Address: DF:A9:FF:F6:B1:1A (OUI DF-A9-FF)
        Count: 1
< ACL Data TX: Handle 2919 flags 0x00 dlen 7              #260 [hci1] 15.438821
      ATT: Read Response (0x0b) len 2
> HCI Event: Number of Completed Packets (0x13) plen 5    #261 [hci1] 15.600558
        Num handles: 1
        Handle: 2919 Address: DF:A9:FF:F6:B1:1A (OUI DF-A9-FF)
        Count: 1
        #260: len 7 (0 Kb/s)
        Latency: 161 msec (84-172 msec ~163 msec)
> ACL Data RX: Handle 2919 flags 0x02 dlen 7              #262 [hci1] 15.600734
      ATT: Read Request (0x0a) len 2
        Handle: 0x0037 Type: Bearer Signal Strength (0x2bb7)
< HCI Command: Host Number of Com.. (0x03|0x0035) plen 5  #263 [hci1] 15.619216
        Num handles: 1
        Handle: 2919 Address: DF:A9:FF:F6:B1:1A (OUI DF-A9-FF)
        Count: 1
< ACL Data TX: Handle 2919 flags 0x00 dlen 6              #264 [hci1] 15.619330
      ATT: Read Response (0x0b) len 1
> HCI Event: Number of Completed Packets (0x13) plen 5    #265 [hci1] 15.775564
        Num handles: 1
        Handle: 2919 Address: DF:A9:FF:F6:B1:1A (OUI DF-A9-FF)
        Count: 1
        #264: len 6 (0 Kb/s)
        Latency: 156 msec (84-172 msec ~160 msec)
> ACL Data RX: Handle 2919 flags 0x02 dlen 7              #266 [hci1] 15.775734
      ATT: Read Request (0x0a) len 2
        Handle: 0x003a Type: Bearer Signal Strength Reporting Interval (0x2bb8)
< HCI Command: Host Number of Com.. (0x03|0x0035) plen 5  #267 [hci1] 15.778717
        Num handles: 1
        Handle: 2919 Address: DF:A9:FF:F6:B1:1A (OUI DF-A9-FF)
        Count: 1
< ACL Data TX: Handle 2919 flags 0x00 dlen 6              #268 [hci1] 15.778797
      ATT: Read Response (0x0b) len 1
> HCI Event: Number of Completed Packets (0x13) plen 5    #269 [hci1] 15.950509
        Num handles: 1
        Handle: 2919 Address: DF:A9:FF:F6:B1:1A (OUI DF-A9-FF)
        Count: 1
        #268: len 6 (0 Kb/s)
        Latency: 171 msec (84-172 msec ~165 msec)
> ACL Data RX: Handle 2919 flags 0x02 dlen 8              #270 [hci1] 15.950626
      ATT: Write Command (0x52) len 3
        Handle: 0x003a Type: Bearer Signal Strength Reporting Interval (0x2bb8)
          Data: 00
> ACL Data RX: Handle 2919 flags 0x02 dlen 8              #271 [hci1] 15.951155
      ATT: Write Request (0x12) len 3
        Handle: 0x003a Type: Bearer Signal Strength Reporting Interval (0x2bb8)
          Data: 00
< HCI Command: Host Number of Com.. (0x03|0x0035) plen 5  #272 [hci1] 15.959117
        Num handles: 1
        Handle: 2919 Address: DF:A9:FF:F6:B1:1A (OUI DF-A9-FF)
        Count: 1
< HCI Command: Host Number of Com.. (0x03|0x0035) plen 5  #273 [hci1] 15.959312
        Num handles: 1
        Handle: 2919 Address: DF:A9:FF:F6:B1:1A (OUI DF-A9-FF)
        Count: 1
< ACL Data TX: Handle 2919 flags 0x00 dlen 5              #274 [hci1] 15.959454
      ATT: Write Response (0x13) len 0
> HCI Event: Number of Completed Packets (0x13) plen 5    #275 [hci1] 16.125487
        Num handles: 1
        Handle: 2919 Address: DF:A9:FF:F6:B1:1A (OUI DF-A9-FF)
        Count: 1
        #274: len 5 (0 Kb/s)
        Latency: 166 msec (84-172 msec ~165 msec)
> ACL Data RX: Handle 2919 flags 0x02 dlen 7              #276 [hci1] 16.125690
      ATT: Read Request (0x0a) len 2
        Handle: 0x003d
< HCI Command: Host Number of Com.. (0x03|0x0035) plen 5  #277 [hci1] 16.139215
        Num handles: 1
        Handle: 2919 Address: DF:A9:FF:F6:B1:1A (OUI DF-A9-FF)
        Count: 1
< ACL Data TX: Handle 2919 flags 0x00 dlen 7              #278 [hci1] 16.139323
      ATT: Read Response (0x0b) len 2
> HCI Event: Number of Completed Packets (0x13) plen 5    #279 [hci1] 16.300524
        Num handles: 1
        Handle: 2919 Address: DF:A9:FF:F6:B1:1A (OUI DF-A9-FF)
        Count: 1
        #278: len 7 (0 Kb/s)
        Latency: 161 msec (84-172 msec ~163 msec)
> ACL Data RX: Handle 2919 flags 0x02 dlen 7              #280 [hci1] 16.300681
      ATT: Read Request (0x0a) len 2
        Handle: 0x003f Type: Content Control ID (0x2bba)
< HCI Command: Host Number of Com.. (0x03|0x0035) plen 5  #281 [hci1] 16.318996
        Num handles: 1
        Handle: 2919 Address: DF:A9:FF:F6:B1:1A (OUI DF-A9-FF)
        Count: 1
< ACL Data TX: Handle 2919 flags 0x00 dlen 6              #282 [hci1] 16.319037
      ATT: Read Response (0x0b) len 1
        Handle: 0x003f Type: Content Control ID (0x2bba)
        Value: 00
          Content Control ID: 0x00
> HCI Event: Number of Completed Packets (0x13) plen 5    #283 [hci1] 16.475484
        Num handles: 1
        Handle: 2919 Address: DF:A9:FF:F6:B1:1A (OUI DF-A9-FF)
        Count: 1
        #282: len 6 (0 Kb/s)
        Latency: 156 msec (84-172 msec ~160 msec)
> ACL Data RX: Handle 2919 flags 0x02 dlen 7              #284 [hci1] 16.475681
      ATT: Read Request (0x0a) len 2
        Handle: 0x0042
< HCI Command: Host Number of Com.. (0x03|0x0035) plen 5  #285 [hci1] 16.479023
        Num handles: 1
        Handle: 2919 Address: DF:A9:FF:F6:B1:1A (OUI DF-A9-FF)
        Count: 1
< ACL Data TX: Handle 2919 flags 0x00 dlen 7              #286 [hci1] 16.479067
      ATT: Read Response (0x0b) len 2
> HCI Event: Number of Completed Packets (0x13) plen 5    #287 [hci1] 16.650527
        Num handles: 1
        Handle: 2919 Address: DF:A9:FF:F6:B1:1A (OUI DF-A9-FF)
        Count: 1
        #286: len 7 (0 Kb/s)
        Latency: 171 msec (84-172 msec ~165 msec)
> ACL Data RX: Handle 2919 flags 0x02 dlen 7              #288 [hci1] 16.650667
      ATT: Read Request (0x0a) len 2
        Handle: 0x0041 Type: Status Flags (0x2bbb)
< HCI Command: Host Number of Com.. (0x03|0x0035) plen 5  #289 [hci1] 16.659027
        Num handles: 1
        Handle: 2919 Address: DF:A9:FF:F6:B1:1A (OUI DF-A9-FF)
        Count: 1
< ACL Data TX: Handle 2919 flags 0x00 dlen 7              #290 [hci1] 16.659118
      ATT: Read Response (0x0b) len 2
> HCI Event: Number of Completed Packets (0x13) plen 5    #291 [hci1] 16.825502
        Num handles: 1
        Handle: 2919 Address: DF:A9:FF:F6:B1:1A (OUI DF-A9-FF)
        Count: 1
        #290: len 7 (0 Kb/s)
        Latency: 166 msec (84-172 msec ~166 msec)
> ACL Data RX: Handle 2919 flags 0x02 dlen 7              #292 [hci1] 16.825760
      ATT: Read Request (0x0a) len 2
        Handle: 0x0045
< HCI Command: Host Number of Com.. (0x03|0x0035) plen 5  #293 [hci1] 16.839150
        Num handles: 1
        Handle: 2919 Address: DF:A9:FF:F6:B1:1A (OUI DF-A9-FF)
        Count: 1
< ACL Data TX: Handle 2919 flags 0x00 dlen 7              #294 [hci1] 16.839228
      ATT: Read Response (0x0b) len 2
> HCI Event: Number of Completed Packets (0x13) plen 5    #295 [hci1] 17.000474
        Num handles: 1
        Handle: 2919 Address: DF:A9:FF:F6:B1:1A (OUI DF-A9-FF)
        Count: 1
        #294: len 7 (0 Kb/s)
        Latency: 161 msec (84-172 msec ~163 msec)
> ACL Data RX: Handle 2919 flags 0x02 dlen 7              #296 [hci1] 17.000690
      ATT: Read Request (0x0a) len 2
        Handle: 0x0048
< HCI Command: Host Number of Com.. (0x03|0x0035) plen 5  #297 [hci1] 17.018704
        Num handles: 1
        Handle: 2919 Address: DF:A9:FF:F6:B1:1A (OUI DF-A9-FF)
        Count: 1
< ACL Data TX: Handle 2919 flags 0x00 dlen 7              #298 [hci1] 17.018718
      ATT: Read Response (0x0b) len 2
> HCI Event: Number of Completed Packets (0x13) plen 5    #299 [hci1] 17.175547
        Num handles: 1
        Handle: 2919 Address: DF:A9:FF:F6:B1:1A (OUI DF-A9-FF)
        Count: 1
        #298: len 7 (0 Kb/s)
        Latency: 156 msec (84-172 msec ~160 msec)
> ACL Data RX: Handle 2919 flags 0x02 dlen 7              #300 [hci1] 17.175719
      ATT: Read Request (0x0a) len 2
        Handle: 0x004b
< HCI Command: Host Number of Com.. (0x03|0x0035) plen 5  #301 [hci1] 17.179229
        Num handles: 1
        Handle: 2919 Address: DF:A9:FF:F6:B1:1A (OUI DF-A9-FF)
        Count: 1
< ACL Data TX: Handle 2919 flags 0x00 dlen 7              #302 [hci1] 17.179375
      ATT: Read Response (0x0b) len 2
> HCI Event: Number of Completed Packets (0x13) plen 5    #303 [hci1] 17.350489
        Num handles: 1
        Handle: 2919 Address: DF:A9:FF:F6:B1:1A (OUI DF-A9-FF)
        Count: 1
        #302: len 7 (0 Kb/s)
        Latency: 171 msec (84-172 msec ~165 msec)
> ACL Data RX: Handle 2919 flags 0x02 dlen 7              #304 [hci1] 17.350683
      ATT: Read Request (0x0a) len 2
        Handle: 0x004d Type: Call Control Point Optional Opcodes (0x2bbf)
< HCI Command: Host Number of Com.. (0x03|0x0035) plen 5  #305 [hci1] 17.358834
        Num handles: 1
        Handle: 2919 Address: DF:A9:FF:F6:B1:1A (OUI DF-A9-FF)
        Count: 1
< ACL Data TX: Handle 2919 flags 0x00 dlen 7              #306 [hci1] 17.358887
      ATT: Read Response (0x0b) len 2
> HCI Event: Number of Completed Packets (0x13) plen 5    #307 [hci1] 17.525551
        Num handles: 1
        Handle: 2919 Address: DF:A9:FF:F6:B1:1A (OUI DF-A9-FF)
        Count: 1
        #306: len 7 (0 Kb/s)
        Latency: 166 msec (84-172 msec ~166 msec)
> ACL Data RX: Handle 2919 flags 0x02 dlen 7              #308 [hci1] 17.525718
      ATT: Read Request (0x0a) len 2
        Handle: 0x0050
< HCI Command: Host Number of Com.. (0x03|0x0035) plen 5  #309 [hci1] 17.539022
        Num handles: 1
        Handle: 2919 Address: DF:A9:FF:F6:B1:1A (OUI DF-A9-FF)
        Count: 1
< ACL Data TX: Handle 2919 flags 0x00 dlen 7              #310 [hci1] 17.539098
      ATT: Read Response (0x0b) len 2
> HCI Event: Number of Completed Packets (0x13) plen 5    #311 [hci1] 17.700475
        Num handles: 1
        Handle: 2919 Address: DF:A9:FF:F6:B1:1A (OUI DF-A9-FF)
        Count: 1
        #310: len 7 (0 Kb/s)
        Latency: 161 msec (84-172 msec ~163 msec)
> ACL Data RX: Handle 2919 flags 0x02 dlen 7              #312 [hci1] 17.700780
      ATT: Read Request (0x0a) len 2
        Handle: 0x0053
< HCI Command: Host Number of Com.. (0x03|0x0035) plen 5  #313 [hci1] 17.719101
        Num handles: 1
        Handle: 2919 Address: DF:A9:FF:F6:B1:1A (OUI DF-A9-FF)
        Count: 1
< ACL Data TX: Handle 2919 flags 0x00 dlen 7              #314 [hci1] 17.719123
      ATT: Read Response (0x0b) len 2
> HCI Event: Number of Completed Packets (0x13) plen 5    #315 [hci1] 17.875486
        Num handles: 1
        Handle: 2919 Address: DF:A9:FF:F6:B1:1A (OUI DF-A9-FF)
        Count: 1
        #314: len 7 (0 Kb/s)
        Latency: 156 msec (84-172 msec ~160 msec)
> ACL Data RX: Handle 2919 flags 0x02 dlen 7              #316 [hci1] 17.875687
      ATT: Read Request (0x0a) len 2
        Handle: 0x0056
< HCI Command: Host Number of Com.. (0x03|0x0035) plen 5  #317 [hci1] 17.878881
        Num handles: 1
        Handle: 2919 Address: DF:A9:FF:F6:B1:1A (OUI DF-A9-FF)
        Count: 1
< ACL Data TX: Handle 2919 flags 0x00 dlen 7              #318 [hci1] 17.878898
      ATT: Read Response (0x0b) len 2
> HCI Event: Number of Completed Packets (0x13) plen 5    #319 [hci1] 18.050396
        Num handles: 1
        Handle: 2919 Address: DF:A9:FF:F6:B1:1A (OUI DF-A9-FF)
        Count: 1
        #318: len 7 (0 Kb/s)
        Latency: 171 msec (84-172 msec ~165 msec)
> HCI Event: Disconnect Complete (0x05) plen 4            #320 [hci1] 19.450679
        Status: Success (0x00)
        Handle: 2919 Address: DF:A9:FF:F6:B1:1A (OUI DF-A9-FF)
        Reason: Remote User Terminated Connection (0x13)
< HCI Command: Reset (0x03|0x0003) plen 0                 #321 [hci1] 26.198687
> HCI Event: Command Complete (0x0e) plen 4               #322 [hci1] 26.199218
      Reset (0x03|0x0003) ncmd 1
        Status: Success (0x00)
@ USER Close: main                                    {0x0001} [hci1] 26.218586
= Close Index: 00:00:00:00:00:00                               [hci1] 26.218594
