Bluetooth monitor ver 5.72
= Note: Linux version 6.14.0-36-generic (x86_64)                       0.321045
= Note: Bluetooth subsystem version 2.22                               0.321046
= New Index: 00:00:00:00:00:00 (Primary,UART,hci1)              [hci1] 0.321047
= New Index: 48:5F:99:8E:E0:64 (Primary,USB,hci0)               [hci0] 0.321048
= Open Index: 00:00:00:00:00:00                                 [hci1] 0.434221
= Index Info: 00:00:00:00:00:00 (Nordic Semiconductor ASA)      [hci1] 0.434231
@ USER Open: main (privileged) version 2.22            {0x0001} [hci1] 0.434233
< HCI Command: Reset (0x03|0x0003) plen 0                    #1 [hci1] 0.434618
> HCI Event: Command Complete (0x0e) plen 4                  #2 [hci1] 0.435192
      Reset (0x03|0x0003) ncmd 1
        Status: Success (0x00)
< HCI Command: Read Local Supported... (0x04|0x0003) plen 0  #3 [hci1] 0.454250
> HCI Event: Command Complete (0x0e) plen 12                 #4 [hci1] 0.454801
      Read Local Supported Features (0x04|0x0003) ncmd 1
        Status: Success (0x00)
        Features: 0x00 0x00 0x00 0x00 0x60 0x00 0x00 0x00
          BR/EDR Not Supported
          LE Supported (Controller)
< HCI Command: Read Local Version In.. (0x04|0x0001) plen 0  #5 [hci1] 0.474216
> HCI Event: Command Complete (0x0e) plen 12                 #6 [hci1] 0.474731
      Read Local Version Information (0x04|0x0001) ncmd 1
        Status: Success (0x00)
        HCI version: Reserved (0x0f) - Revision 12393 (0x3069)
        LMP version: Reserved (0x0f) - Subversion 12393 (0x3069)
        Manufacturer: Nordic Semiconductor ASA (89)
< HCI Command: Read Local Supported... (0x04|0x0002) plen 0  #7 [hci1] 0.494238
> HCI Event: Command Complete (0x0e) plen 68                 #8 [hci1] 0.495339
      Read Local Supported Commands (0x04|0x0002) ncmd 1
        Status: Success (0x00)
        Commands: 119 entries
          Disconnect (Octet 0 - Bit 5)
          Read Remote Version Information (Octet 2 - Bit 7)
          Set Event Mask (Octet 5 - Bit 6)
          Reset (Octet 5 - Bit 7)
          Read Connection Accept Timeout (Octet 7 - Bit 2)
          Write Connection Accept Timeout (Octet 7 - Bit 3)
          Read Transmit Power Level (Octet 10 - Bit 2)
          Set Controller To Host Flow Control (Octet 10 - Bit 5)
          Host Buffer Size (Octet 10 - Bit 6)
          Host Number of Completed Packets (Octet 10 - Bit 7)
          Read Local Version Information (Octet 14 - Bit 3)
          Read Local Supported Features (Octet 14 - Bit 5)
          Read BD ADDR (Octet 15 - Bit 1)
          Read RSSI (Octet 15 - Bit 5)
          Set Event Mask Page 2 (Octet 22 - Bit 2)
          LE Set Event Mask (Octet 25 - Bit 0)
          LE Read Buffer Size (Octet 25 - Bit 1)
          LE Read Local Supported Features (Octet 25 - Bit 2)
          LE Set Random Address (Octet 25 - Bit 4)
          LE Set Advertising Parameters (Octet 25 - Bit 5)
          LE Read Advertising Channel TX Power (Octet 25 - Bit 6)
          LE Set Advertising Data (Octet 25 - Bit 7)
          LE Set Scan Response Data (Octet 26 - Bit 0)
          LE Set Advertise Enable (Octet 26 - Bit 1)
          LE Set Scan Parameters (Octet 26 - Bit 2)
          LE Set Scan Enable (Octet 26 - Bit 3)
          LE Create Connection (Octet 26 - Bit 4)
          LE Create Connection Cancel (Octet 26 - Bit 5)
          LE Read Accept List Size (Octet 26 - Bit 6)
          LE Clear Accept List (Octet 26 - Bit 7)
          LE Add Device To Accept List (Octet 27 - Bit 0)
          LE Remove Device From Accept List (Octet 27 - Bit 1)
          LE Connection Update (Octet 27 - Bit 2)
          LE Set Host Channel Classification (Octet 27 - Bit 3)
          LE Read Channel Map (Octet 27 - Bit 4)
          LE Read Remote Used Features (Octet 27 - Bit 5)
          LE Encrypt (Octet 27 - Bit 6)
          LE Rand (Octet 27 - Bit 7)
          LE Start Encryption (Octet 28 - Bit 0)
          LE Long Term Key Request Reply (Octet 28 - Bit 1)
          LE Long Term Key Request Neg Reply (Octet 28 - Bit 2)
          LE Read Supported States (Octet 28 - Bit 3)
          LE Receiver Test (Octet 28 - Bit 4)
          LE Transmitter Test (Octet 28 - Bit 5)
          LE Test End (Octet 28 - Bit 6)
          Read Authenticated Payload Timeout (Octet 32 - Bit 4)
          Write Authenticated Payload Timeout (Octet 32 - Bit 5)
          LE Set Data Length (Octet 33 - Bit 6)
          LE Read Suggested Default Data Length (Octet 33 - Bit 7)
          LE Write Suggested Default Data Length (Octet 34 - Bit 0)
          LE Add Device To Resolving List (Octet 34 - Bit 3)
          LE Remove Device From Resolving List (Octet 34 - Bit 4)
          LE Clear Resolving List (Octet 34 - Bit 5)
          LE Read Resolving List Size (Octet 34 - Bit 6)
          LE Set Address Resolution Enable (Octet 35 - Bit 1)
          LE Set Resolvable Private Address Timeout (Octet 35 - Bit 2)
          LE Read Maximum Data Length (Octet 35 - Bit 3)
          LE Read PHY (Octet 35 - Bit 4)
          LE Set Default PHY (Octet 35 - Bit 5)
          LE Set PHY (Octet 35 - Bit 6)
          LE Enhanced Receiver Test (Octet 35 - Bit 7)
          LE Enhanced Transmitter Test (Octet 36 - Bit 0)
          LE Set Advertising Set Random Address (Octet 36 - Bit 1)
          LE Set Extended Advertising Parameters (Octet 36 - Bit 2)
          LE Set Extended Advertising Data (Octet 36 - Bit 3)
          LE Set Extended Scan Response Data (Octet 36 - Bit 4)
          LE Set Extended Advertising Enable (Octet 36 - Bit 5)
          LE Read Maximum Advertising Data Length (Octet 36 - Bit 6)
          LE Read Number of Supported Advertising Sets (Octet 36 - Bit 7)
          LE Remove Advertising Set (Octet 37 - Bit 0)
          LE Clear Advertising Sets (Octet 37 - Bit 1)
          LE Set Periodic Advertising Parameters (Octet 37 - Bit 2)
          LE Set Periodic Advertising Data (Octet 37 - Bit 3)
          LE Set Periodic Advertising Enable (Octet 37 - Bit 4)
          LE Set Extended Scan Parameters (Octet 37 - Bit 5)
          LE Set Extended Scan Enable (Octet 37 - Bit 6)
          LE Extended Create Connection (Octet 37 - Bit 7)
          LE Periodic Advertising Create Sync (Octet 38 - Bit 0)
          LE Periodic Advertising Create Sync Cancel (Octet 38 - Bit 1)
          LE Periodic Advertising Terminate Sync (Octet 38 - Bit 2)
          LE Add Device To Periodic Advertiser List (Octet 38 - Bit 3)
          LE Remove Device From Periodic Advertiser List (Octet 38 - Bit 4)
          LE Clear Periodic Advertiser List (Octet 38 - Bit 5)
          LE Read Periodic Advertiser List Size (Octet 38 - Bit 6)
          LE Read Transmit Power (Octet 38 - Bit 7)
          LE Read RF Path Compensation (Octet 39 - Bit 0)
          LE Write RF Path Compensation (Octet 39 - Bit 1)
          LE Set Privacy Mode (Octet 39 - Bit 2)
          LE Periodic Advertising Receive Enable (Octet 40 - Bit 5)
          LE Periodic Advertising Sync Transfer (Octet 40 - Bit 6)
          LE Periodic Advertising Set Info Transfer (Octet 40 - Bit 7)
          LE Periodic Advertising Sync Transfer Parameters (Octet 41 - Bit 0)
          LE Set Default Periodic Advertisng Sync Transfer Parameters (Octet 41 - Bit 1)
          LE Read Buffer v2 (Octet 41 - Bit 5)
          LE Read ISO TX Sync (Octet 41 - Bit 6)
          LE Set Connected Isochronous Group Parameters (Octet 41 - Bit 7)
          LE Set Connected Isochronous Group Parameters Test (Octet 42 - Bit 0)
          LE Create Connected Isochronous Stream (Octet 42 - Bit 1)
          LE Remove Connected Isochronous Group (Octet 42 - Bit 2)
          LE Accept Connected Isochronous Stream Request (Octet 42 - Bit 3)
          LE Reject Connected Isochronous Stream Request (Octet 42 - Bit 4)
          LE Create Broadcast Isochronous Group (Octet 42 - Bit 5)
          LE Create Broadcast Isochronous Group Test (Octet 42 - Bit 6)
          LE Terminate Broadcast Isochronous Group (Octet 42 - Bit 7)
          LE Broadcast Isochronous Group Create Sync (Octet 43 - Bit 0)
          LE Broadcast Isochronous Group Terminate Sync (Octet 43 - Bit 1)
          LE Request Peer SCA (Octet 43 - Bit 2)
          LE Setup Isochronous Data Path (Octet 43 - Bit 3)
          LE Remove Isochronous Data Path (Octet 43 - Bit 4)
          LE Isochronous Transmit Test (Octet 43 - Bit 5)
          LE Isochronous Receive Test (Octet 43 - Bit 6)
          LE Isochronous Read Test Counters (Octet 43 - Bit 7)
          LE Isochronous Read Test Counters (Octet 44 - Bit 0)
          LE Set Host Feature (Octet 44 - Bit 1)
          Octet 44 - Bit 2 
          Octet 45 - Bit 6 
          Octet 46 - Bit 0 
          Octet 46 - Bit 1 
          Octet 46 - Bit 2 
< HCI Command: Host Buffer Size (0x03|0x0033) plen 7         #9 [hci1] 0.514238
        ACL MTU: 255  ACL max packet: 16
        SCO MTU: 0    SCO max packet: 0
> HCI Event: Command Complete (0x0e) plen 4                 #10 [hci1] 0.514729
      Host Buffer Size (0x03|0x0033) ncmd 1
        Status: Success (0x00)
< HCI Command: Set Controller To Ho.. (0x03|0x0031) plen 1  #11 [hci1] 0.534217
        Flow control: ACL Data Packets (0x01)
> HCI Event: Command Complete (0x0e) plen 4                 #12 [hci1] 0.534655
      Set Controller To Host Flow Control (0x03|0x0031) ncmd 1
        Status: Success (0x00)
< HCI Command: LE Read Local Suppor.. (0x08|0x0003) plen 0  #13 [hci1] 0.554195
> HCI Event: Command Complete (0x0e) plen 12                #14 [hci1] 0.554683
      LE Read Local Supported Features (0x08|0x0003) ncmd 1
        Status: Success (0x00)
        Features: 0xfd 0x79 0x00 0xf7 0x30 0x01 0x00 0x00
          LE Encryption
          Extended Reject Indication
          Peripheral-initiated Features Exchange
          LE Ping
          LE Data Packet Length Extension
          LL Privacy
          Extended Scanner Filter Policies
          LE 2M PHY
          LE Coded PHY
          LE Extended Advertising
          LE Periodic Advertising
          Channel Selection Algorithm #2
          Periodic Advertising Sync Transfer - Sender
          Periodic Advertising Sync Transfer - Recipient
          Sleep Clock Accuracy Updates
          Connected Isochronous Stream - Central
          Connected Isochronous Stream - Peripheral
          Isochronous Broadcaster
          Synchronized Receiver
          Periodic Advertising ADI support
          Connection Subrating
          Unknown features (0x0000010000000000)
< HCI Command: LE Set Host Feature (0x08|0x0074) plen 2     #15 [hci1] 0.574200
        Bit Number: 32
          Connected Isochronous Stream (Host Support)
        Bit Value: 1
> HCI Event: Command Complete (0x0e) plen 4                 #16 [hci1] 0.574652
      LE Set Host Feature (0x08|0x0074) ncmd 1
        Status: Success (0x00)
< HCI Command: LE Read Buffer v2 (0x08|0x0060) plen 0       #17 [hci1] 0.594182
> HCI Event: Command Complete (0x0e) plen 10                #18 [hci1] 0.594628
      LE Read Buffer v2 (0x08|0x0060) ncmd 1
        Status: Success (0x00)
        ACL MTU: 27
        ACL max packet: 3
        ISO MTU: 318
        ISO max packet: 3
< HCI Command: LE Read Maximum Adve.. (0x08|0x003a) plen 0  #19 [hci1] 0.614215
> HCI Event: Command Complete (0x0e) plen 6                 #20 [hci1] 0.614694
      LE Read Maximum Advertising Data Length (0x08|0x003a) ncmd 1
        Status: Success (0x00)
        Max length: 1650
< HCI Command: LE Read Supported St.. (0x08|0x001c) plen 0  #21 [hci1] 0.634187
> HCI Event: Command Complete (0x0e) plen 12                #22 [hci1] 0.634701
      LE Read Supported States (0x08|0x001c) ncmd 1
        Status: Success (0x00)
        States: 0x000003ff3e0306ff
          Non-connectable Advertising State
          Scannable Advertising State
          Connectable Advertising State
          High Duty Cycle Directed Advertising State
          Passive Scanning State
          Active Scanning State
          Initiating State
            and Connection State (Central Role)
          Connection State (Peripheral Role)
          Scannable Advertising State
            and Passive Scanning State
          Connectable Advertising State
            and Passive Scanning State
          Non-connectable Advertising State
            and Initiating State
          Scannable Advertising State
            and Initiating State
          Active Scanning State
            and Connection State (Central Role)
          Passive Scanning State
            and Connection State (Peripheral Role)
          Active Scanning State
            and Connection State (Peripheral Role)
          Initiating State
            and Connection State (Central Role)
            and Central Role & Central Role
          Low Duty Cycle Directed Advertising State
          Connectable Advertising State
            and Initiating State
            and Central Role & Peripheral Role
          High Duty Cycle Directed Advertising State
            and Initiating State
            and Central Role & Peripheral Role
          Low Duty Cycle Directed Advertising State
            and Initiating State
            and Central Role & Peripheral Role
          Connectable Advertising State
            and Connection State (Central Role)
            and Central Role & Peripheral Role
          High Duty Cycle Directed Advertising State
            and Connection State (Central Role)
            and Central Role & Peripheral Role
          Low Duty Cycle Directed Advertising State
            and Connection State (Central Role)
            and Central Role & Peripheral Role
          Connectable Advertising State
            and Connection State (Peripheral Role)
            and Central Role & Peripheral Role
          High Duty Cycle Directed Advertising State
            and Connection State (Peripheral Role)
            and Peripheral Role & Peripheral Role
          Low Duty Cycle Directed Advertising State
            and Connection State (Peripheral Role)
            and Peripheral Role & Peripheral Role
          Initiating State
            and Connection State (Peripheral Role)
            and Central Role & Peripheral Role
< HCI Command: LE Read Maximum Data.. (0x08|0x002f) plen 0  #23 [hci1] 0.654188
> HCI Event: Command Complete (0x0e) plen 12                #24 [hci1] 0.654694
      LE Read Maximum Data Length (0x08|0x002f) ncmd 1
        Status: Success (0x00)
        Max TX octets: 251
        Max TX time: 2704
        Max RX octets: 251
        Max RX time: 2704
< HCI Command: LE Write Suggested D.. (0x08|0x0024) plen 4  #25 [hci1] 0.674184
        TX octets: 251
        TX time: 2704
> HCI Event: Command Complete (0x0e) plen 4                 #26 [hci1] 0.674651
      LE Write Suggested Default Data Length (0x08|0x0024) ncmd 1
        Status: Success (0x00)
< HCI Command: LE Read Resolving Li.. (0x08|0x002a) plen 0  #27 [hci1] 0.694199
> HCI Event: Command Complete (0x0e) plen 5                 #28 [hci1] 0.694613
      LE Read Resolving List Size (0x08|0x002a) ncmd 1
        Status: Success (0x00)
        Size: 8
< HCI Command: LE Set Event Mask (0x08|0x0001) plen 8       #29 [hci1] 0.714194
        Mask: 0x000002023f87fa5e
          LE Advertising Report
          LE Connection Update Complete
          LE Read Remote Used Features Complete
          LE Long Term Key Request
          LE Data Length Change
          LE Enhanced Connection Complete
          LE PHY Update Complete
          LE Extended Advertising Report
          LE Periodic Advertising Sync Established
          LE Periodic Advertising Report
          LE Periodic Advertising Sync Lost
          LE Extended Scan Timeout
          LE Extended Advertising Set Terminated
          LE Scan Request Received
          LE Periodic Advertising Sync Transfer Rvc
          LE CIS Established
          LE CIS Request
          LE Create BIG Complete
          LE Terminate BIG Complete
          LE BIG Sync Estabilished Complete
          LE BIG Sync Lost
          LE BIG Info Advertising Report
          Unknown mask (0x0000020000000000)
> HCI Event: Command Complete (0x0e) plen 4                 #30 [hci1] 0.714745
      LE Set Event Mask (0x08|0x0001) ncmd 1
        Status: Success (0x00)
< HCI Command: Set Event Mask (0x03|0x0001) plen 8          #31 [hci1] 0.734189
        Mask: 0x2000800002008890
          Disconnection Complete
          Encryption Change
          Read Remote Version Information Complete
          Hardware Error
          Data Buffer Overflow
          Encryption Key Refresh Complete
          LE Meta
> HCI Event: Command Complete (0x0e) plen 4                 #32 [hci1] 0.734660
      Set Event Mask (0x03|0x0001) ncmd 1
        Status: Success (0x00)
< HCI Command: Read BD ADDR (0x04|0x0009) plen 0            #33 [hci1] 0.754187
> HCI Event: Command Complete (0x0e) plen 10                #34 [hci1] 0.754648
      Read BD ADDR (0x04|0x0009) ncmd 1
        Status: Success (0x00)
        Address: 00:00:00:00:00:00 (OUI 00-00-00)
< HCI Command: LE Set Random Address (0x08|0x0005) plen 6   #35 [hci1] 0.774188
        Address: D5:B6:CC:31:DB:3B (Static)
> HCI Event: Command Complete (0x0e) plen 4                 #36 [hci1] 0.774694
      LE Set Random Address (0x08|0x0005) ncmd 1
        Status: Success (0x00)
< HCI Command: LE Set Extended Adv.. (0x08|0x0036) plen 25  #37 [hci1] 2.984237
        Handle: 0x00
        Properties: 0x0013
          Connectable
          Scannable
          Use legacy advertising PDUs: ADV_IND
        Min advertising interval: 100.000 msec (0x00a0)
        Max advertising interval: 150.000 msec (0x00f0)
        Channel map: 37, 38, 39 (0x07)
        Own address type: Random (0x01)
        Peer address type: Public (0x00)
        Peer address: 00:00:00:00:00:00 (OUI 00-00-00)
        Filter policy: Allow Scan Request from Any, Allow Connect Request from Any (0x00)
        TX power: Host has no preference (0x7f)
        Primary PHY: LE 1M (0x01)
        Secondary max skip: 0x00
        Secondary PHY: LE 1M (0x01)
        SID: 0x00
        Scan request notifications: Disabled (0x00)
> HCI Event: Command Complete (0x0e) plen 5                 #38 [hci1] 2.985028
      LE Set Extended Advertising Parameters (0x08|0x0036) ncmd 1
        Status: Success (0x00)
        TX power (selected): 0 dbm (0x00)
< HCI Command: LE Set Advertising S.. (0x08|0x0035) plen 7  #39 [hci1] 2.994279
        Advertising handle: 0x00
        Advertising random address: D5:B6:CC:31:DB:3B (Static)
> HCI Event: Command Complete (0x0e) plen 4                 #40 [hci1] 2.994756
      LE Set Advertising Set Random Address (0x08|0x0035) ncmd 1
        Status: Success (0x00)
< HCI Command: LE Set Extended Adv.. (0x08|0x0037) plen 22  #41 [hci1] 3.014260
        Handle: 0x00
        Operation: Complete extended advertising data (0x03)
        Fragment preference: Minimize fragmentation (0x01)
        Data length: 0x12
        Flags: 0x06
          LE General Discoverable Mode
          BR/EDR Not Supported
        Name (complete): Tester_F6B11A
> HCI Event: Command Complete (0x0e) plen 4                 #42 [hci1] 3.014989
      LE Set Extended Advertising Data (0x08|0x0037) ncmd 1
        Status: Success (0x00)
< HCI Command: LE Set Extended Scan.. (0x08|0x0038) plen 4  #43 [hci1] 3.034279
        Handle: 0x00
        Operation: Complete scan response data (0x03)
        Fragment preference: Minimize fragmentation (0x01)
        Data length: 0x00
> HCI Event: Command Complete (0x0e) plen 4                 #44 [hci1] 3.034731
      LE Set Extended Scan Response Data (0x08|0x0038) ncmd 1
        Status: Success (0x00)
< HCI Command: LE Set Extended Adve.. (0x08|0x0039) plen 6  #45 [hci1] 3.054227
        Extended advertising: Enabled (0x01)
        Number of sets: 1 (0x01)
        Entry 0
          Handle: 0x00
          Duration: 0 ms (0x00)
          Max ext adv events: 0
> HCI Event: Command Complete (0x0e) plen 4                 #46 [hci1] 3.054829
      LE Set Extended Advertising Enable (0x08|0x0039) ncmd 1
        Status: Success (0x00)
> HCI Event: LE Meta Event (0x3e) plen 31                   #47 [hci1] 3.601221
      LE Enhanced Connection Complete (0x0a)
        Status: Success (0x00)
        Handle: 3783
        Role: Peripheral (0x01)
        Peer address type: Public (0x00)
        Peer address: DF:A9:FF:F6:B1:1A (OUI DF-A9-FF)
        Local resolvable private address: 00:00:00:00:00:00 (Non-Resolvable)
        Peer resolvable private address: 00:00:00:00:00:00 (Non-Resolvable)
        Connection interval: 87.50 msec (0x0046)
        Connection latency: 0 (0x0000)
        Supervision timeout: 20000 msec (0x07d0)
        Central clock accuracy: 0x01
> HCI Event: LE Meta Event (0x3e) plen 6                    #48 [hci1] 3.601278
      LE Advertising Set Terminated (0x12)
        Status: Success (0x00)
        Handle: 0
        Connection handle: 3783
        Number of completed extended advertising events: 0
< HCI Command: LE Read Remote Used... (0x08|0x0016) plen 2  #49 [hci1] 3.614644
        Handle: 3783 Address: DF:A9:FF:F6:B1:1A (OUI DF-A9-FF)
> HCI Event: Command Status (0x0f) plen 4                   #50 [hci1] 3.615078
      LE Read Remote Used Features (0x08|0x0016) ncmd 1
        Status: Success (0x00)
> HCI Event: LE Meta Event (0x3e) plen 12                   #51 [hci1] 3.865123
      LE Read Remote Used Features (0x04)
        Status: Success (0x00)
        Handle: 3783 Address: DF:A9:FF:F6:B1:1A (OUI DF-A9-FF)
        Features: 0x2d 0x49 0x00 0xf7 0x67 0xd9 0x00 0x80
          LE Encryption
          Extended Reject Indication
          Peripheral-initiated Features Exchange
          LE Data Packet Length Extension
          LE 2M PHY
          LE Coded PHY
          Channel Selection Algorithm #2
          Periodic Advertising Sync Transfer - Sender
          Periodic Advertising Sync Transfer - Recipient
          Sleep Clock Accuracy Updates
          Connected Isochronous Stream - Central
          Connected Isochronous Stream - Peripheral
          Isochronous Broadcaster
          Synchronized Receiver
          Connected Isochronous Stream (Host Support)
          LE Power Control Request
          LE Power Control Request
          Connection Subrating
          Connection Subrating (Host Support)
          Unknown features (0x8000d90000000000)
> ACL Data RX: Handle 3783 flags 0x02 dlen 11               #52 [hci1] 4.302314
      SMP: Pairing Request (0x01) len 6
        IO capability: DisplayYesNo (0x01)
        OOB data: Authentication data not present (0x00)
        Authentication requirement: No bonding, No MITM, SC, No Keypresses (0x08)
        Max encryption key size: 16
        Initiator key distribution: <none> (0x00)
        Responder key distribution: <none> (0x00)
< HCI Command: Host Number of Compl.. (0x03|0x0035) plen 5  #53 [hci1] 4.314235
        Num handles: 1
        Handle: 3783 Address: DF:A9:FF:F6:B1:1A (OUI DF-A9-FF)
        Count: 1
< ACL Data TX: Handle 3783 flags 0x00 dlen 11               #54 [hci1] 4.314261
      SMP: Pairing Response (0x02) len 6
        IO capability: NoInputNoOutput (0x03)
        OOB data: Authentication data not present (0x00)
        Authentication requirement: No bonding, No MITM, SC, No Keypresses (0x08)
        Max encryption key size: 16
        Initiator key distribution: <none> (0x00)
        Responder key distribution: <none> (0x00)
> HCI Event: Number of Completed Packets (0x13) plen 5      #55 [hci1] 4.477468
        Num handles: 1
        Handle: 3783 Address: DF:A9:FF:F6:B1:1A (OUI DF-A9-FF)
        Count: 1
        #54: len 11 (0 Kb/s)
        Latency: 163 msec (163-163 msec ~163 msec)
> ACL Data RX: Handle 3783 flags 0x02 dlen 27               #56 [hci1] 4.477712
> ACL Data RX: Handle 3783 flags 0x01 dlen 27               #57 [hci1] 4.478283
> ACL Data RX: Handle 3783 flags 0x01 dlen 15               #58 [hci1] 4.478700
      SMP: Pairing Public Key (0x0c) len 64
        X: a996e9eaaee2486ef6c404c37c323ecf477e1cbaf584b5bc8283c49bb35d48d0
        Y: 10fe5b4e069a2318b5d79989a1570ab093f685052b9dc6c44b56e02ec79a4c81
< HCI Command: Host Number of Compl.. (0x03|0x0035) plen 5  #59 [hci1] 4.494367
        Num handles: 1
        Handle: 3783 Address: DF:A9:FF:F6:B1:1A (OUI DF-A9-FF)
        Count: 1
< HCI Command: Host Number of Compl.. (0x03|0x0035) plen 5  #60 [hci1] 4.494454
        Num handles: 1
        Handle: 3783 Address: DF:A9:FF:F6:B1:1A (OUI DF-A9-FF)
        Count: 1
< HCI Command: Host Number of Compl.. (0x03|0x0035) plen 5  #61 [hci1] 4.494556
        Num handles: 1
        Handle: 3783 Address: DF:A9:FF:F6:B1:1A (OUI DF-A9-FF)
        Count: 1
< ACL Data TX: Handle 3783 flags 0x00 dlen 27               #62 [hci1] 4.494620
< ACL Data TX: Handle 3783 flags 0x01 dlen 27               #63 [hci1] 4.494624
< ACL Data TX: Handle 3783 flags 0x01 dlen 15               #64 [hci1] 4.494632
      SMP: Pairing Public Key (0x0c) len 64
        X: 98308440221e2d910f0e54b71e7ec652857aa9b5a0dc65028824cc19db1226e9
        Y: 67a4816bcb62efb21701e31fdb27561a6217575fb007a8bbdabe7e28b6f68482
> HCI Event: Number of Completed Packets (0x13) plen 5      #65 [hci1] 4.565306
        Num handles: 1
        Handle: 3783 Address: DF:A9:FF:F6:B1:1A (OUI DF-A9-FF)
        Count: 1
        #62: len 27 (3 Kb/s)
        Latency: 70 msec (70-163 msec ~116 msec)
> HCI Event: Number of Completed Packets (0x13) plen 5      #66 [hci1] 4.566041
        Num handles: 1
        Handle: 3783 Address: DF:A9:FF:F6:B1:1A (OUI DF-A9-FF)
        Count: 1
        #63: len 27 (3 Kb/s)
        Latency: 71 msec (70-163 msec ~94 msec)
< ACL Data TX: Handle 3783 flags 0x00 dlen 21               #67 [hci1] 4.574252
      SMP: Pairing Confirm (0x03) len 16
        Confim value: 6f9f9408162c4b61a3e9629e0382f720
> HCI Event: Number of Completed Packets (0x13) plen 5      #68 [hci1] 4.652189
        Num handles: 1
        Handle: 3783 Address: DF:A9:FF:F6:B1:1A (OUI DF-A9-FF)
        Count: 1
        #64: len 15 (0 Kb/s)
        Latency: 157 msec (70-163 msec ~125 msec)
> HCI Event: Number of Completed Packets (0x13) plen 5      #69 [hci1] 4.739840
        Num handles: 1
        Handle: 3783 Address: DF:A9:FF:F6:B1:1A (OUI DF-A9-FF)
        Count: 1
        #67: len 21 (1 Kb/s)
        Latency: 165 msec (70-165 msec ~145 msec)
> ACL Data RX: Handle 3783 flags 0x02 dlen 21               #70 [hci1] 4.740329
      SMP: Pairing Random (0x04) len 16
        Random value: 8234f1214330105bd9bf440577c9cf84
< HCI Command: Host Number of Compl.. (0x03|0x0035) plen 5  #71 [hci1] 4.754316
        Num handles: 1
        Handle: 3783 Address: DF:A9:FF:F6:B1:1A (OUI DF-A9-FF)
        Count: 1
< ACL Data TX: Handle 3783 flags 0x00 dlen 21               #72 [hci1] 4.754324
      SMP: Pairing Random (0x04) len 16
        Random value: 8e6108f966a694cbe26df70bb96773e6
> HCI Event: Number of Completed Packets (0x13) plen 5      #73 [hci1] 4.914929
        Num handles: 1
        Handle: 3783 Address: DF:A9:FF:F6:B1:1A (OUI DF-A9-FF)
        Count: 1
        #72: len 21 (1 Kb/s)
        Latency: 160 msec (70-165 msec ~153 msec)
> ACL Data RX: Handle 3783 flags 0x02 dlen 21               #74 [hci1] 4.915177
      SMP: Pairing DHKey Check (0x0d) len 16
        E: 171c81bd624cd05ae8d3bace37dd036e
< HCI Command: Host Number of Compl.. (0x03|0x0035) plen 5  #75 [hci1] 4.934421
        Num handles: 1
        Handle: 3783 Address: DF:A9:FF:F6:B1:1A (OUI DF-A9-FF)
        Count: 1
< ACL Data TX: Handle 3783 flags 0x00 dlen 21               #76 [hci1] 4.934443
      SMP: Pairing DHKey Check (0x0d) len 16
        E: 4f3d45b4977c665e1e3c72a3146ff23e
> HCI Event: Number of Completed Packets (0x13) plen 5      #77 [hci1] 5.089678
        Num handles: 1
        Handle: 3783 Address: DF:A9:FF:F6:B1:1A (OUI DF-A9-FF)
        Count: 1
        #76: len 21 (1 Kb/s)
        Latency: 155 msec (70-165 msec ~154 msec)
> HCI Event: LE Meta Event (0x3e) plen 13                   #78 [hci1] 5.177823
      LE Long Term Key Request (0x05)
        Handle: 3783 Address: DF:A9:FF:F6:B1:1A (OUI DF-A9-FF)
        Random number: 0x0000000000000000
        Encrypted diversifier: 0x0000
< HCI Command: LE Long Term Key Re.. (0x08|0x001a) plen 18  #79 [hci1] 5.194228
        Handle: 3783 Address: DF:A9:FF:F6:B1:1A (OUI DF-A9-FF)
        Long term key: ebab5c1d162581f99aedae250903cb90
> HCI Event: Command Complete (0x0e) plen 6                 #80 [hci1] 5.194842
      LE Long Term Key Request Reply (0x08|0x001a) ncmd 1
        Status: Success (0x00)
        Handle: 3783 Address: DF:A9:FF:F6:B1:1A (OUI DF-A9-FF)
> HCI Event: Encryption Change (0x08) plen 4                #81 [hci1] 5.614961
        Status: Success (0x00)
        Handle: 3783 Address: DF:A9:FF:F6:B1:1A (OUI DF-A9-FF)
        Encryption: Enabled with AES-CCM (0x01)
< ACL Data TX: Handle 3783 flags 0x00 dlen 16               #82 [hci1] 8.624348
      LE L2CAP: Connection Parameter Update Request (0x12) ident 1 len 8
        Min interval: 24
        Max interval: 40
        Peripheral latency: 0
        Timeout multiplier: 42
> HCI Event: Number of Completed Packets (0x13) plen 5      #83 [hci1] 8.764702
        Num handles: 1
        Handle: 3783 Address: DF:A9:FF:F6:B1:1A (OUI DF-A9-FF)
        Count: 1
        #82: len 16 (0 Kb/s)
        Latency: 140 msec (70-165 msec ~147 msec)
> HCI Event: Disconnect Complete (0x05) plen 4              #84 [hci1] 8.764834
        Status: Success (0x00)
        Handle: 3783 Address: DF:A9:FF:F6:B1:1A (OUI DF-A9-FF)
        Reason: Remote User Terminated Connection (0x13)
< HCI Command: LE Set Extended Adv.. (0x08|0x0036) plen 25  #85 [hci1] 9.154312
        Handle: 0x00
        Properties: 0x0013
          Connectable
          Scannable
          Use legacy advertising PDUs: ADV_IND
        Min advertising interval: 100.000 msec (0x00a0)
        Max advertising interval: 150.000 msec (0x00f0)
        Channel map: 37, 38, 39 (0x07)
        Own address type: Random (0x01)
        Peer address type: Public (0x00)
        Peer address: 00:00:00:00:00:00 (OUI 00-00-00)
        Filter policy: Allow Scan Request from Any, Allow Connect Request from Any (0x00)
        TX power: Host has no preference (0x7f)
        Primary PHY: LE 1M (0x01)
        Secondary max skip: 0x00
        Secondary PHY: LE 1M (0x01)
        SID: 0x00
        Scan request notifications: Disabled (0x00)
> HCI Event: Command Complete (0x0e) plen 5                 #86 [hci1] 9.155041
      LE Set Extended Advertising Parameters (0x08|0x0036) ncmd 1
        Status: Success (0x00)
        TX power (selected): 0 dbm (0x00)
< HCI Command: LE Set Advertising S.. (0x08|0x0035) plen 7  #87 [hci1] 9.174262
        Advertising handle: 0x00
        Advertising random address: D5:B6:CC:31:DB:3B (Static)
> HCI Event: Command Complete (0x0e) plen 4                 #88 [hci1] 9.174753
      LE Set Advertising Set Random Address (0x08|0x0035) ncmd 1
        Status: Success (0x00)
< HCI Command: LE Set Extended Adv.. (0x08|0x0037) plen 22  #89 [hci1] 9.194296
        Handle: 0x00
        Operation: Complete extended advertising data (0x03)
        Fragment preference: Minimize fragmentation (0x01)
        Data length: 0x12
        Flags: 0x06
          LE General Discoverable Mode
          BR/EDR Not Supported
        Name (complete): Tester_F6B11A
> HCI Event: Command Complete (0x0e) plen 4                 #90 [hci1] 9.195061
      LE Set Extended Advertising Data (0x08|0x0037) ncmd 1
        Status: Success (0x00)
< HCI Command: LE Set Extended Scan.. (0x08|0x0038) plen 4  #91 [hci1] 9.214300
        Handle: 0x00
        Operation: Complete scan response data (0x03)
        Fragment preference: Minimize fragmentation (0x01)
        Data length: 0x00
> HCI Event: Command Complete (0x0e) plen 4                 #92 [hci1] 9.214846
      LE Set Extended Scan Response Data (0x08|0x0038) ncmd 1
        Status: Success (0x00)
< HCI Command: LE Set Extended Adve.. (0x08|0x0039) plen 6  #93 [hci1] 9.234265
        Extended advertising: Enabled (0x01)
        Number of sets: 1 (0x01)
        Entry 0
          Handle: 0x00
          Duration: 0 ms (0x00)
          Max ext adv events: 0
> HCI Event: Command Complete (0x0e) plen 4                 #94 [hci1] 9.234798
      LE Set Extended Advertising Enable (0x08|0x0039) ncmd 1
        Status: Success (0x00)
> HCI Event: LE Meta Event (0x3e) plen 31                   #95 [hci1] 9.674869
      LE Enhanced Connection Complete (0x0a)
        Status: Success (0x00)
        Handle: 3801
        Role: Peripheral (0x01)
        Peer address type: Public (0x00)
        Peer address: DF:A9:FF:F6:B1:1A (OUI DF-A9-FF)
        Local resolvable private address: 00:00:00:00:00:00 (Non-Resolvable)
        Peer resolvable private address: 00:00:00:00:00:00 (Non-Resolvable)
        Connection interval: 87.50 msec (0x0046)
        Connection latency: 0 (0x0000)
        Supervision timeout: 20000 msec (0x07d0)
        Central clock accuracy: 0x01
> HCI Event: LE Meta Event (0x3e) plen 6                    #96 [hci1] 9.675000
      LE Advertising Set Terminated (0x12)
        Status: Success (0x00)
        Handle: 0
        Connection handle: 3801
        Number of completed extended advertising events: 0
< HCI Command: LE Read Remote Used... (0x08|0x0016) plen 2  #97 [hci1] 9.694395
        Handle: 3801 Address: DF:A9:FF:F6:B1:1A (OUI DF-A9-FF)
> HCI Event: Command Status (0x0f) plen 4                   #98 [hci1] 9.694790
      LE Read Remote Used Features (0x08|0x0016) ncmd 1
        Status: Success (0x00)
> HCI Event: LE Meta Event (0x3e) plen 12                   #99 [hci1] 9.938869
      LE Read Remote Used Features (0x04)
        Status: Success (0x00)
        Handle: 3801 Address: DF:A9:FF:F6:B1:1A (OUI DF-A9-FF)
        Features: 0x2d 0x49 0x00 0xf7 0x67 0xd9 0x00 0x80
          LE Encryption
          Extended Reject Indication
          Peripheral-initiated Features Exchange
          LE Data Packet Length Extension
          LE 2M PHY
          LE Coded PHY
          Channel Selection Algorithm #2
          Periodic Advertising Sync Transfer - Sender
          Periodic Advertising Sync Transfer - Recipient
          Sleep Clock Accuracy Updates
          Connected Isochronous Stream - Central
          Connected Isochronous Stream - Peripheral
          Isochronous Broadcaster
          Synchronized Receiver
          Connected Isochronous Stream (Host Support)
          LE Power Control Request
          LE Power Control Request
          Connection Subrating
          Connection Subrating (Host Support)
          Unknown features (0x8000d90000000000)
> ACL Data RX: Handle 3801 flags 0x02 dlen 11             #100 [hci1] 10.376045
      SMP: Pairing Request (0x01) len 6
        IO capability: DisplayYesNo (0x01)
        OOB data: Authentication data not present (0x00)
        Authentication requirement: No bonding, No MITM, SC, No Keypresses (0x08)
        Max encryption key size: 16
        Initiator key distribution: <none> (0x00)
        Responder key distribution: <none> (0x00)
< HCI Command: Host Number of Com.. (0x03|0x0035) plen 5  #101 [hci1] 10.394367
        Num handles: 1
        Handle: 3801 Address: DF:A9:FF:F6:B1:1A (OUI DF-A9-FF)
        Count: 1
< ACL Data TX: Handle 3801 flags 0x00 dlen 11             #102 [hci1] 10.394426
      SMP: Pairing Response (0x02) len 6
        IO capability: NoInputNoOutput (0x03)
        OOB data: Authentication data not present (0x00)
        Authentication requirement: No bonding, No MITM, SC, No Keypresses (0x08)
        Max encryption key size: 16
        Initiator key distribution: <none> (0x00)
        Responder key distribution: <none> (0x00)
> HCI Event: Number of Completed Packets (0x13) plen 5    #103 [hci1] 10.551156
        Num handles: 1
        Handle: 3801 Address: DF:A9:FF:F6:B1:1A (OUI DF-A9-FF)
        Count: 1
        #102: len 11 (0 Kb/s)
        Latency: 156 msec (156-156 msec ~156 msec)
> ACL Data RX: Handle 3801 flags 0x02 dlen 27             #104 [hci1] 10.551441
> ACL Data RX: Handle 3801 flags 0x01 dlen 27             #105 [hci1] 10.551972
> ACL Data RX: Handle 3801 flags 0x01 dlen 15             #106 [hci1] 10.552438
      SMP: Pairing Public Key (0x0c) len 64
        X: 6eac1d8007ce793a4c9f6678a1b5caa56006cf19dad77c7de81c51e9d8d3b169
        Y: a77f2f67cd0a24f65c0ef5a137589979dd813958b09b796a8252f689fa6b5019
< HCI Command: Host Number of Com.. (0x03|0x0035) plen 5  #107 [hci1] 10.554328
        Num handles: 1
        Handle: 3801 Address: DF:A9:FF:F6:B1:1A (OUI DF-A9-FF)
        Count: 1
< HCI Command: Host Number of Com.. (0x03|0x0035) plen 5  #108 [hci1] 10.554335
        Num handles: 1
        Handle: 3801 Address: DF:A9:FF:F6:B1:1A (OUI DF-A9-FF)
        Count: 1
< HCI Command: Host Number of Com.. (0x03|0x0035) plen 5  #109 [hci1] 10.554367
        Num handles: 1
        Handle: 3801 Address: DF:A9:FF:F6:B1:1A (OUI DF-A9-FF)
        Count: 1
< ACL Data TX: Handle 3801 flags 0x00 dlen 27             #110 [hci1] 10.554388
< ACL Data TX: Handle 3801 flags 0x01 dlen 27             #111 [hci1] 10.554390
< ACL Data TX: Handle 3801 flags 0x01 dlen 15             #112 [hci1] 10.554391
      SMP: Pairing Public Key (0x0c) len 64
        X: 98308440221e2d910f0e54b71e7ec652857aa9b5a0dc65028824cc19db1226e9
        Y: 67a4816bcb62efb21701e31fdb27561a6217575fb007a8bbdabe7e28b6f68482
> HCI Event: Number of Completed Packets (0x13) plen 5    #113 [hci1] 10.639004
        Num handles: 1
        Handle: 3801 Address: DF:A9:FF:F6:B1:1A (OUI DF-A9-FF)
        Count: 1
        #110: len 27 (2 Kb/s)
        Latency: 84 msec (84-156 msec ~120 msec)
> HCI Event: Number of Completed Packets (0x13) plen 5    #114 [hci1] 10.639705
        Num handles: 1
        Handle: 3801 Address: DF:A9:FF:F6:B1:1A (OUI DF-A9-FF)
        Count: 1
        #111: len 27 (2 Kb/s)
        Latency: 85 msec (84-156 msec ~102 msec)
< ACL Data TX: Handle 3801 flags 0x00 dlen 21             #115 [hci1] 10.654275
      SMP: Pairing Confirm (0x03) len 16
        Confim value: 2d4f2d6bb78ce4630dae69981e6ae5ee
> HCI Event: Number of Completed Packets (0x13) plen 5    #116 [hci1] 10.725832
        Num handles: 1
        Handle: 3801 Address: DF:A9:FF:F6:B1:1A (OUI DF-A9-FF)
        Count: 1
        #112: len 15 (0 Kb/s)
        Latency: 171 msec (84-171 msec ~137 msec)
> HCI Event: Number of Completed Packets (0x13) plen 5    #117 [hci1] 10.813525
        Num handles: 1
        Handle: 3801 Address: DF:A9:FF:F6:B1:1A (OUI DF-A9-FF)
        Count: 1
        #115: len 21 (1 Kb/s)
        Latency: 159 msec (84-171 msec ~148 msec)
> ACL Data RX: Handle 3801 flags 0x02 dlen 21             #118 [hci1] 10.813875
      SMP: Pairing Random (0x04) len 16
        Random value: 71dede5b5f3b9be890768423b9a1783c
< HCI Command: Host Number of Com.. (0x03|0x0035) plen 5  #119 [hci1] 10.814333
        Num handles: 1
        Handle: 3801 Address: DF:A9:FF:F6:B1:1A (OUI DF-A9-FF)
        Count: 1
< ACL Data TX: Handle 3801 flags 0x00 dlen 21             #120 [hci1] 10.814349
      SMP: Pairing Random (0x04) len 16
        Random value: 5da095555cc64d02679f89a05211af56
> HCI Event: Number of Completed Packets (0x13) plen 5    #121 [hci1] 10.988515
        Num handles: 1
        Handle: 3801 Address: DF:A9:FF:F6:B1:1A (OUI DF-A9-FF)
        Count: 1
        #120: len 21 (0 Kb/s)
        Latency: 174 msec (84-174 msec ~161 msec)
> ACL Data RX: Handle 3801 flags 0x02 dlen 21             #122 [hci1] 10.988881
      SMP: Pairing DHKey Check (0x0d) len 16
        E: 3427244badbcac9cbb3d507c9ccb5b93
< HCI Command: Host Number of Com.. (0x03|0x0035) plen 5  #123 [hci1] 10.994397
        Num handles: 1
        Handle: 3801 Address: DF:A9:FF:F6:B1:1A (OUI DF-A9-FF)
        Count: 1
< ACL Data TX: Handle 3801 flags 0x00 dlen 21             #124 [hci1] 10.994448
      SMP: Pairing DHKey Check (0x0d) len 16
        E: 1f775ad3bb936a7937d7cf9ca8b4ab58
> HCI Event: Number of Completed Packets (0x13) plen 5    #125 [hci1] 11.163335
        Num handles: 1
        Handle: 3801 Address: DF:A9:FF:F6:B1:1A (OUI DF-A9-FF)
        Count: 1
        #124: len 21 (1 Kb/s)
        Latency: 168 msec (84-174 msec ~165 msec)
> HCI Event: LE Meta Event (0x3e) plen 13                 #126 [hci1] 11.251388
      LE Long Term Key Request (0x05)
        Handle: 3801 Address: DF:A9:FF:F6:B1:1A (OUI DF-A9-FF)
        Random number: 0x0000000000000000
        Encrypted diversifier: 0x0000
< HCI Command: LE Long Term Key... (0x08|0x001a) plen 18  #127 [hci1] 11.254328
        Handle: 3801 Address: DF:A9:FF:F6:B1:1A (OUI DF-A9-FF)
        Long term key: 4c5b09a81d37874bb4a3d9b2624a8950
> HCI Event: Command Complete (0x0e) plen 6               #128 [hci1] 11.254987
      LE Long Term Key Request Reply (0x08|0x001a) ncmd 1
        Status: Success (0x00)
        Handle: 3801 Address: DF:A9:FF:F6:B1:1A (OUI DF-A9-FF)
> HCI Event: Encryption Change (0x08) plen 4              #129 [hci1] 11.688654
        Status: Success (0x00)
        Handle: 3801 Address: DF:A9:FF:F6:B1:1A (OUI DF-A9-FF)
        Encryption: Enabled with AES-CCM (0x01)
< ACL Data TX: Handle 3801 flags 0x00 dlen 16             #130 [hci1] 14.704287
      LE L2CAP: Connection Parameter Update Request (0x12) ident 2 len 8
        Min interval: 24
        Max interval: 40
        Peripheral latency: 0
        Timeout multiplier: 42
> HCI Event: Number of Completed Packets (0x13) plen 5    #131 [hci1] 14.838304
        Num handles: 1
        Handle: 3801 Address: DF:A9:FF:F6:B1:1A (OUI DF-A9-FF)
        Count: 1
        #130: len 16 (0 Kb/s)
        Latency: 134 msec (84-174 msec ~149 msec)
> HCI Event: Disconnect Complete (0x05) plen 4            #132 [hci1] 14.838616
        Status: Success (0x00)
        Handle: 3801 Address: DF:A9:FF:F6:B1:1A (OUI DF-A9-FF)
        Reason: Remote User Terminated Connection (0x13)
< HCI Command: LE Set Extended A.. (0x08|0x0036) plen 25  #133 [hci1] 15.334346
        Handle: 0x00
        Properties: 0x0013
          Connectable
          Scannable
          Use legacy advertising PDUs: ADV_IND
        Min advertising interval: 100.000 msec (0x00a0)
        Max advertising interval: 150.000 msec (0x00f0)
        Channel map: 37, 38, 39 (0x07)
        Own address type: Random (0x01)
        Peer address type: Public (0x00)
        Peer address: 00:00:00:00:00:00 (OUI 00-00-00)
        Filter policy: Allow Scan Request from Any, Allow Connect Request from Any (0x00)
        TX power: Host has no preference (0x7f)
        Primary PHY: LE 1M (0x01)
        Secondary max skip: 0x00
        Secondary PHY: LE 1M (0x01)
        SID: 0x00
        Scan request notifications: Disabled (0x00)
> HCI Event: Command Complete (0x0e) plen 5               #134 [hci1] 15.335108
      LE Set Extended Advertising Parameters (0x08|0x0036) ncmd 1
        Status: Success (0x00)
        TX power (selected): 0 dbm (0x00)
< HCI Command: LE Set Advertising.. (0x08|0x0035) plen 7  #135 [hci1] 15.354325
        Advertising handle: 0x00
        Advertising random address: D5:B6:CC:31:DB:3B (Static)
> HCI Event: Command Complete (0x0e) plen 4               #136 [hci1] 15.354800
      LE Set Advertising Set Random Address (0x08|0x0035) ncmd 1
        Status: Success (0x00)
< HCI Command: LE Set Extended A.. (0x08|0x0037) plen 22  #137 [hci1] 15.374356
        Handle: 0x00
        Operation: Complete extended advertising data (0x03)
        Fragment preference: Minimize fragmentation (0x01)
        Data length: 0x12
        Flags: 0x06
          LE General Discoverable Mode
          BR/EDR Not Supported
        Name (complete): Tester_F6B11A
> HCI Event: Command Complete (0x0e) plen 4               #138 [hci1] 15.375076
      LE Set Extended Advertising Data (0x08|0x0037) ncmd 1
        Status: Success (0x00)
< HCI Command: LE Set Extended Sc.. (0x08|0x0038) plen 4  #139 [hci1] 15.394297
        Handle: 0x00
        Operation: Complete scan response data (0x03)
        Fragment preference: Minimize fragmentation (0x01)
        Data length: 0x00
> HCI Event: Command Complete (0x0e) plen 4               #140 [hci1] 15.394785
      LE Set Extended Scan Response Data (0x08|0x0038) ncmd 1
        Status: Success (0x00)
< HCI Command: LE Set Extended Ad.. (0x08|0x0039) plen 6  #141 [hci1] 15.414335
        Extended advertising: Enabled (0x01)
        Number of sets: 1 (0x01)
        Entry 0
          Handle: 0x00
          Duration: 0 ms (0x00)
          Max ext adv events: 0
> HCI Event: Command Complete (0x0e) plen 4               #142 [hci1] 15.414874
      LE Set Extended Advertising Enable (0x08|0x0039) ncmd 1
        Status: Success (0x00)
> HCI Event: LE Meta Event (0x3e) plen 31                 #143 [hci1] 15.733551
      LE Enhanced Connection Complete (0x0a)
        Status: Success (0x00)
        Handle: 3819
        Role: Peripheral (0x01)
        Peer address type: Public (0x00)
        Peer address: DF:A9:FF:F6:B1:1A (OUI DF-A9-FF)
        Local resolvable private address: 00:00:00:00:00:00 (Non-Resolvable)
        Peer resolvable private address: 00:00:00:00:00:00 (Non-Resolvable)
        Connection interval: 87.50 msec (0x0046)
        Connection latency: 0 (0x0000)
        Supervision timeout: 20000 msec (0x07d0)
        Central clock accuracy: 0x01
> HCI Event: LE Meta Event (0x3e) plen 6                  #144 [hci1] 15.733649
      LE Advertising Set Terminated (0x12)
        Status: Success (0x00)
        Handle: 0
        Connection handle: 3819
        Number of completed extended advertising events: 0
< HCI Command: LE Read Remote Use.. (0x08|0x0016) plen 2  #145 [hci1] 15.734487
        Handle: 3819 Address: DF:A9:FF:F6:B1:1A (OUI DF-A9-FF)
> HCI Event: Command Status (0x0f) plen 4                 #146 [hci1] 15.734909
      LE Read Remote Used Features (0x08|0x0016) ncmd 1
        Status: Success (0x00)
> HCI Event: LE Meta Event (0x3e) plen 12                 #147 [hci1] 15.997418
      LE Read Remote Used Features (0x04)
        Status: Success (0x00)
        Handle: 3819 Address: DF:A9:FF:F6:B1:1A (OUI DF-A9-FF)
        Features: 0x2d 0x49 0x00 0xf7 0x67 0xd9 0x00 0x80
          LE Encryption
          Extended Reject Indication
          Peripheral-initiated Features Exchange
          LE Data Packet Length Extension
          LE 2M PHY
          LE Coded PHY
          Channel Selection Algorithm #2
          Periodic Advertising Sync Transfer - Sender
          Periodic Advertising Sync Transfer - Recipient
          Sleep Clock Accuracy Updates
          Connected Isochronous Stream - Central
          Connected Isochronous Stream - Peripheral
          Isochronous Broadcaster
          Synchronized Receiver
          Connected Isochronous Stream (Host Support)
          LE Power Control Request
          LE Power Control Request
          Connection Subrating
          Connection Subrating (Host Support)
          Unknown features (0x8000d90000000000)
> ACL Data RX: Handle 3819 flags 0x02 dlen 11             #148 [hci1] 16.434670
      SMP: Pairing Request (0x01) len 6
        IO capability: DisplayYesNo (0x01)
        OOB data: Authentication data not present (0x00)
        Authentication requirement: No bonding, No MITM, SC, No Keypresses (0x08)
        Max encryption key size: 16
        Initiator key distribution: <none> (0x00)
        Responder key distribution: <none> (0x00)
< HCI Command: Host Number of Com.. (0x03|0x0035) plen 5  #149 [hci1] 16.454406
        Num handles: 1
        Handle: 3819 Address: DF:A9:FF:F6:B1:1A (OUI DF-A9-FF)
        Count: 1
< ACL Data TX: Handle 3819 flags 0x00 dlen 11             #150 [hci1] 16.454415
      SMP: Pairing Response (0x02) len 6
        IO capability: NoInputNoOutput (0x03)
        OOB data: Authentication data not present (0x00)
        Authentication requirement: No bonding, No MITM, SC, No Keypresses (0x08)
        Max encryption key size: 16
        Initiator key distribution: <none> (0x00)
        Responder key distribution: <none> (0x00)
> HCI Event: Number of Completed Packets (0x13) plen 5    #151 [hci1] 16.609708
        Num handles: 1
        Handle: 3819 Address: DF:A9:FF:F6:B1:1A (OUI DF-A9-FF)
        Count: 1
        #150: len 11 (0 Kb/s)
        Latency: 155 msec (155-155 msec ~155 msec)
> ACL Data RX: Handle 3819 flags 0x02 dlen 27             #152 [hci1] 16.610107
> ACL Data RX: Handle 3819 flags 0x01 dlen 27             #153 [hci1] 16.610558
> ACL Data RX: Handle 3819 flags 0x01 dlen 15             #154 [hci1] 16.611007
      SMP: Pairing Public Key (0x0c) len 64
        X: d7b6fd250ef5b3f94060cd5ab7bbffea39f6a38160e8ef87e103f14df93cb5f4
        Y: cee1dbfda19bb4dbd0b2c16b11eaad12eb7dfb2ae54aab827d79935409d5c705
< HCI Command: Host Number of Com.. (0x03|0x0035) plen 5  #155 [hci1] 16.614353
        Num handles: 1
        Handle: 3819 Address: DF:A9:FF:F6:B1:1A (OUI DF-A9-FF)
        Count: 1
< HCI Command: Host Number of Com.. (0x03|0x0035) plen 5  #156 [hci1] 16.614373
        Num handles: 1
        Handle: 3819 Address: DF:A9:FF:F6:B1:1A (OUI DF-A9-FF)
        Count: 1
< HCI Command: Host Number of Com.. (0x03|0x0035) plen 5  #157 [hci1] 16.614458
        Num handles: 1
        Handle: 3819 Address: DF:A9:FF:F6:B1:1A (OUI DF-A9-FF)
        Count: 1
< ACL Data TX: Handle 3819 flags 0x00 dlen 27             #158 [hci1] 16.614539
< ACL Data TX: Handle 3819 flags 0x01 dlen 27             #159 [hci1] 16.614542
< ACL Data TX: Handle 3819 flags 0x01 dlen 15             #160 [hci1] 16.614543
      SMP: Pairing Public Key (0x0c) len 64
        X: 98308440221e2d910f0e54b71e7ec652857aa9b5a0dc65028824cc19db1226e9
        Y: 67a4816bcb62efb21701e31fdb27561a6217575fb007a8bbdabe7e28b6f68482
> HCI Event: Number of Completed Packets (0x13) plen 5    #161 [hci1] 16.697663
        Num handles: 1
        Handle: 3819 Address: DF:A9:FF:F6:B1:1A (OUI DF-A9-FF)
        Count: 1
        #158: len 27 (2 Kb/s)
        Latency: 83 msec (83-155 msec ~119 msec)
> HCI Event: Number of Completed Packets (0x13) plen 5    #162 [hci1] 16.698275
        Num handles: 1
        Handle: 3819 Address: DF:A9:FF:F6:B1:1A (OUI DF-A9-FF)
        Count: 1
        #159: len 27 (2 Kb/s)
        Latency: 83 msec (83-155 msec ~101 msec)
< ACL Data TX: Handle 3819 flags 0x00 dlen 21             #163 [hci1] 16.714306
      SMP: Pairing Confirm (0x03) len 16
        Confim value: 6cdcd401b3d4bd03992f1f63d191c070
> HCI Event: Number of Completed Packets (0x13) plen 5    #164 [hci1] 16.784456
        Num handles: 1
        Handle: 3819 Address: DF:A9:FF:F6:B1:1A (OUI DF-A9-FF)
        Count: 1
        #160: len 15 (0 Kb/s)
        Latency: 169 msec (83-169 msec ~135 msec)
> HCI Event: Number of Completed Packets (0x13) plen 5    #165 [hci1] 16.872203
        Num handles: 1
        Handle: 3819 Address: DF:A9:FF:F6:B1:1A (OUI DF-A9-FF)
        Count: 1
        #163: len 21 (1 Kb/s)
        Latency: 157 msec (83-169 msec ~146 msec)
> ACL Data RX: Handle 3819 flags 0x02 dlen 21             #166 [hci1] 16.872542
      SMP: Pairing Random (0x04) len 16
        Random value: eb11b6b0dcac82100decbd4c82c94e3d
< HCI Command: Host Number of Com.. (0x03|0x0035) plen 5  #167 [hci1] 16.874369
        Num handles: 1
        Handle: 3819 Address: DF:A9:FF:F6:B1:1A (OUI DF-A9-FF)
        Count: 1
< ACL Data TX: Handle 3819 flags 0x00 dlen 21             #168 [hci1] 16.874452
      SMP: Pairing Random (0x04) len 16
        Random value: da64d21ec8845e8286bc235a02440d0c
> HCI Event: Number of Completed Packets (0x13) plen 5    #169 [hci1] 17.047302
        Num handles: 1
        Handle: 3819 Address: DF:A9:FF:F6:B1:1A (OUI DF-A9-FF)
        Count: 1
        #168: len 21 (0 Kb/s)
        Latency: 172 msec (83-172 msec ~159 msec)
> ACL Data RX: Handle 3819 flags 0x02 dlen 21             #170 [hci1] 17.047500
      SMP: Pairing DHKey Check (0x0d) len 16
        E: 0a56cac565b6206e07ca141af0144ebf
< HCI Command: Host Number of Com.. (0x03|0x0035) plen 5  #171 [hci1] 17.054456
        Num handles: 1
        Handle: 3819 Address: DF:A9:FF:F6:B1:1A (OUI DF-A9-FF)
        Count: 1
< ACL Data TX: Handle 3819 flags 0x00 dlen 21             #172 [hci1] 17.054485
      SMP: Pairing DHKey Check (0x0d) len 16
        E: 007265a7658647ef498c94af1a86db42
> HCI Event: Number of Completed Packets (0x13) plen 5    #173 [hci1] 17.221979
        Num handles: 1
        Handle: 3819 Address: DF:A9:FF:F6:B1:1A (OUI DF-A9-FF)
        Count: 1
        #172: len 21 (1 Kb/s)
        Latency: 167 msec (83-172 msec ~163 msec)
> HCI Event: LE Meta Event (0x3e) plen 13                 #174 [hci1] 17.310092
      LE Long Term Key Request (0x05)
        Handle: 3819 Address: DF:A9:FF:F6:B1:1A (OUI DF-A9-FF)
        Random number: 0x0000000000000000
        Encrypted diversifier: 0x0000
< HCI Command: LE Long Term Key... (0x08|0x001a) plen 18  #175 [hci1] 17.314328
        Handle: 3819 Address: DF:A9:FF:F6:B1:1A (OUI DF-A9-FF)
        Long term key: 7e8f59b659e77c0b2b68cfd400491674
> HCI Event: Command Complete (0x0e) plen 6               #176 [hci1] 17.315021
      LE Long Term Key Request Reply (0x08|0x001a) ncmd 1
        Status: Success (0x00)
        Handle: 3819 Address: DF:A9:FF:F6:B1:1A (OUI DF-A9-FF)
> HCI Event: Encryption Change (0x08) plen 4              #177 [hci1] 17.747379
        Status: Success (0x00)
        Handle: 3819 Address: DF:A9:FF:F6:B1:1A (OUI DF-A9-FF)
        Encryption: Enabled with AES-CCM (0x01)
< ACL Data TX: Handle 3819 flags 0x00 dlen 16             #178 [hci1] 20.744360
      LE L2CAP: Connection Parameter Update Request (0x12) ident 3 len 8
        Min interval: 24
        Max interval: 40
        Peripheral latency: 0
        Timeout multiplier: 42
> HCI Event: Number of Completed Packets (0x13) plen 5    #179 [hci1] 20.896988
        Num handles: 1
        Handle: 3819 Address: DF:A9:FF:F6:B1:1A (OUI DF-A9-FF)
        Count: 1
        #178: len 16 (0 Kb/s)
        Latency: 152 msec (83-172 msec ~158 msec)
> HCI Event: Disconnect Complete (0x05) plen 4            #180 [hci1] 20.897183
        Status: Success (0x00)
        Handle: 3819 Address: DF:A9:FF:F6:B1:1A (OUI DF-A9-FF)
        Reason: Remote User Terminated Connection (0x13)
< HCI Command: Reset (0x03|0x0003) plen 0                 #181 [hci1] 27.824507
> HCI Event: Command Complete (0x0e) plen 4               #182 [hci1] 27.825057
      Reset (0x03|0x0003) ncmd 1
        Status: Success (0x00)
@ USER Close: main                                    {0x0001} [hci1] 27.834384
= Close Index: 00:00:00:00:00:00                               [hci1] 27.834409
