Bluetooth monitor ver 5.72
= Note: Linux version 6.14.0-36-generic (x86_64)                       0.426855
= Note: Bluetooth subsystem version 2.22                               0.426857
= New Index: 00:00:00:00:00:00 (Primary,UART,hci1)              [hci1] 0.426858
= New Index: 48:5F:99:8E:E0:64 (Primary,USB,hci0)               [hci0] 0.426859
= Open Index: 00:00:00:00:00:00                                 [hci1] 0.540683
= Index Info: 00:00:00:00:00:00 (Nordic Semiconductor ASA)      [hci1] 0.540698
@ USER Open: main (privileged) version 2.22            {0x0001} [hci1] 0.540707
< HCI Command: Reset (0x03|0x0003) plen 0                    #1 [hci1] 0.542069
> HCI Event: Command Complete (0x0e) plen 4                  #2 [hci1] 0.542535
      Reset (0x03|0x0003) ncmd 1
        Status: Success (0x00)
< HCI Command: Read Local Supported... (0x04|0x0003) plen 0  #3 [hci1] 0.560394
> HCI Event: Command Complete (0x0e) plen 12                 #4 [hci1] 0.561074
      Read Local Supported Features (0x04|0x0003) ncmd 1
        Status: Success (0x00)
        Features: 0x00 0x00 0x00 0x00 0x60 0x00 0x00 0x00
          BR/EDR Not Supported
          LE Supported (Controller)
< HCI Command: Read Local Version In.. (0x04|0x0001) plen 0  #5 [hci1] 0.580089
> HCI Event: Command Complete (0x0e) plen 12                 #6 [hci1] 0.580635
      Read Local Version Information (0x04|0x0001) ncmd 1
        Status: Success (0x00)
        HCI version: Reserved (0x0f) - Revision 12393 (0x3069)
        LMP version: Reserved (0x0f) - Subversion 12393 (0x3069)
        Manufacturer: Nordic Semiconductor ASA (89)
< HCI Command: Read Local Supported... (0x04|0x0002) plen 0  #7 [hci1] 0.600023
> HCI Event: Command Complete (0x0e) plen 68                 #8 [hci1] 0.601095
      Read Local Supported Commands (0x04|0x0002) ncmd 1
        Status: Success (0x00)
        Commands: 119 entries
          Disconnect (Octet 0 - Bit 5)
          Read Remote Version Information (Octet 2 - Bit 7)
          Set Event Mask (Octet 5 - Bit 6)
          Reset (Octet 5 - Bit 7)
          Read Connection Accept Timeout (Octet 7 - Bit 2)
          Write Connection Accept Timeout (Octet 7 - Bit 3)
          Read Transmit Power Level (Octet 10 - Bit 2)
          Set Controller To Host Flow Control (Octet 10 - Bit 5)
          Host Buffer Size (Octet 10 - Bit 6)
          Host Number of Completed Packets (Octet 10 - Bit 7)
          Read Local Version Information (Octet 14 - Bit 3)
          Read Local Supported Features (Octet 14 - Bit 5)
          Read BD ADDR (Octet 15 - Bit 1)
          Read RSSI (Octet 15 - Bit 5)
          Set Event Mask Page 2 (Octet 22 - Bit 2)
          LE Set Event Mask (Octet 25 - Bit 0)
          LE Read Buffer Size (Octet 25 - Bit 1)
          LE Read Local Supported Features (Octet 25 - Bit 2)
          LE Set Random Address (Octet 25 - Bit 4)
          LE Set Advertising Parameters (Octet 25 - Bit 5)
          LE Read Advertising Channel TX Power (Octet 25 - Bit 6)
          LE Set Advertising Data (Octet 25 - Bit 7)
          LE Set Scan Response Data (Octet 26 - Bit 0)
          LE Set Advertise Enable (Octet 26 - Bit 1)
          LE Set Scan Parameters (Octet 26 - Bit 2)
          LE Set Scan Enable (Octet 26 - Bit 3)
          LE Create Connection (Octet 26 - Bit 4)
          LE Create Connection Cancel (Octet 26 - Bit 5)
          LE Read Accept List Size (Octet 26 - Bit 6)
          LE Clear Accept List (Octet 26 - Bit 7)
          LE Add Device To Accept List (Octet 27 - Bit 0)
          LE Remove Device From Accept List (Octet 27 - Bit 1)
          LE Connection Update (Octet 27 - Bit 2)
          LE Set Host Channel Classification (Octet 27 - Bit 3)
          LE Read Channel Map (Octet 27 - Bit 4)
          LE Read Remote Used Features (Octet 27 - Bit 5)
          LE Encrypt (Octet 27 - Bit 6)
          LE Rand (Octet 27 - Bit 7)
          LE Start Encryption (Octet 28 - Bit 0)
          LE Long Term Key Request Reply (Octet 28 - Bit 1)
          LE Long Term Key Request Neg Reply (Octet 28 - Bit 2)
          LE Read Supported States (Octet 28 - Bit 3)
          LE Receiver Test (Octet 28 - Bit 4)
          LE Transmitter Test (Octet 28 - Bit 5)
          LE Test End (Octet 28 - Bit 6)
          Read Authenticated Payload Timeout (Octet 32 - Bit 4)
          Write Authenticated Payload Timeout (Octet 32 - Bit 5)
          LE Set Data Length (Octet 33 - Bit 6)
          LE Read Suggested Default Data Length (Octet 33 - Bit 7)
          LE Write Suggested Default Data Length (Octet 34 - Bit 0)
          LE Add Device To Resolving List (Octet 34 - Bit 3)
          LE Remove Device From Resolving List (Octet 34 - Bit 4)
          LE Clear Resolving List (Octet 34 - Bit 5)
          LE Read Resolving List Size (Octet 34 - Bit 6)
          LE Set Address Resolution Enable (Octet 35 - Bit 1)
          LE Set Resolvable Private Address Timeout (Octet 35 - Bit 2)
          LE Read Maximum Data Length (Octet 35 - Bit 3)
          LE Read PHY (Octet 35 - Bit 4)
          LE Set Default PHY (Octet 35 - Bit 5)
          LE Set PHY (Octet 35 - Bit 6)
          LE Enhanced Receiver Test (Octet 35 - Bit 7)
          LE Enhanced Transmitter Test (Octet 36 - Bit 0)
          LE Set Advertising Set Random Address (Octet 36 - Bit 1)
          LE Set Extended Advertising Parameters (Octet 36 - Bit 2)
          LE Set Extended Advertising Data (Octet 36 - Bit 3)
          LE Set Extended Scan Response Data (Octet 36 - Bit 4)
          LE Set Extended Advertising Enable (Octet 36 - Bit 5)
          LE Read Maximum Advertising Data Length (Octet 36 - Bit 6)
          LE Read Number of Supported Advertising Sets (Octet 36 - Bit 7)
          LE Remove Advertising Set (Octet 37 - Bit 0)
          LE Clear Advertising Sets (Octet 37 - Bit 1)
          LE Set Periodic Advertising Parameters (Octet 37 - Bit 2)
          LE Set Periodic Advertising Data (Octet 37 - Bit 3)
          LE Set Periodic Advertising Enable (Octet 37 - Bit 4)
          LE Set Extended Scan Parameters (Octet 37 - Bit 5)
          LE Set Extended Scan Enable (Octet 37 - Bit 6)
          LE Extended Create Connection (Octet 37 - Bit 7)
          LE Periodic Advertising Create Sync (Octet 38 - Bit 0)
          LE Periodic Advertising Create Sync Cancel (Octet 38 - Bit 1)
          LE Periodic Advertising Terminate Sync (Octet 38 - Bit 2)
          LE Add Device To Periodic Advertiser List (Octet 38 - Bit 3)
          LE Remove Device From Periodic Advertiser List (Octet 38 - Bit 4)
          LE Clear Periodic Advertiser List (Octet 38 - Bit 5)
          LE Read Periodic Advertiser List Size (Octet 38 - Bit 6)
          LE Read Transmit Power (Octet 38 - Bit 7)
          LE Read RF Path Compensation (Octet 39 - Bit 0)
          LE Write RF Path Compensation (Octet 39 - Bit 1)
          LE Set Privacy Mode (Octet 39 - Bit 2)
          LE Periodic Advertising Receive Enable (Octet 40 - Bit 5)
          LE Periodic Advertising Sync Transfer (Octet 40 - Bit 6)
          LE Periodic Advertising Set Info Transfer (Octet 40 - Bit 7)
          LE Periodic Advertising Sync Transfer Parameters (Octet 41 - Bit 0)
          LE Set Default Periodic Advertisng Sync Transfer Parameters (Octet 41 - Bit 1)
          LE Read Buffer v2 (Octet 41 - Bit 5)
          LE Read ISO TX Sync (Octet 41 - Bit 6)
          LE Set Connected Isochronous Group Parameters (Octet 41 - Bit 7)
          LE Set Connected Isochronous Group Parameters Test (Octet 42 - Bit 0)
          LE Create Connected Isochronous Stream (Octet 42 - Bit 1)
          LE Remove Connected Isochronous Group (Octet 42 - Bit 2)
          LE Accept Connected Isochronous Stream Request (Octet 42 - Bit 3)
          LE Reject Connected Isochronous Stream Request (Octet 42 - Bit 4)
          LE Create Broadcast Isochronous Group (Octet 42 - Bit 5)
          LE Create Broadcast Isochronous Group Test (Octet 42 - Bit 6)
          LE Terminate Broadcast Isochronous Group (Octet 42 - Bit 7)
          LE Broadcast Isochronous Group Create Sync (Octet 43 - Bit 0)
          LE Broadcast Isochronous Group Terminate Sync (Octet 43 - Bit 1)
          LE Request Peer SCA (Octet 43 - Bit 2)
          LE Setup Isochronous Data Path (Octet 43 - Bit 3)
          LE Remove Isochronous Data Path (Octet 43 - Bit 4)
          LE Isochronous Transmit Test (Octet 43 - Bit 5)
          LE Isochronous Receive Test (Octet 43 - Bit 6)
          LE Isochronous Read Test Counters (Octet 43 - Bit 7)
          LE Isochronous Read Test Counters (Octet 44 - Bit 0)
          LE Set Host Feature (Octet 44 - Bit 1)
          Octet 44 - Bit 2 
          Octet 45 - Bit 6 
          Octet 46 - Bit 0 
          Octet 46 - Bit 1 
          Octet 46 - Bit 2 
< HCI Command: Host Buffer Size (0x03|0x0033) plen 7         #9 [hci1] 0.620019
        ACL MTU: 255  ACL max packet: 16
        SCO MTU: 0    SCO max packet: 0
> HCI Event: Command Complete (0x0e) plen 4                 #10 [hci1] 0.620553
      Host Buffer Size (0x03|0x0033) ncmd 1
        Status: Success (0x00)
< HCI Command: Set Controller To Ho.. (0x03|0x0031) plen 1  #11 [hci1] 0.640020
        Flow control: ACL Data Packets (0x01)
> HCI Event: Command Complete (0x0e) plen 4                 #12 [hci1] 0.640478
      Set Controller To Host Flow Control (0x03|0x0031) ncmd 1
        Status: Success (0x00)
< HCI Command: LE Read Local Suppor.. (0x08|0x0003) plen 0  #13 [hci1] 0.660032
> HCI Event: Command Complete (0x0e) plen 12                #14 [hci1] 0.660500
      LE Read Local Supported Features (0x08|0x0003) ncmd 1
        Status: Success (0x00)
        Features: 0xfd 0x79 0x00 0xf7 0x30 0x01 0x00 0x00
          LE Encryption
          Extended Reject Indication
          Peripheral-initiated Features Exchange
          LE Ping
          LE Data Packet Length Extension
          LL Privacy
          Extended Scanner Filter Policies
          LE 2M PHY
          LE Coded PHY
          LE Extended Advertising
          LE Periodic Advertising
          Channel Selection Algorithm #2
          Periodic Advertising Sync Transfer - Sender
          Periodic Advertising Sync Transfer - Recipient
          Sleep Clock Accuracy Updates
          Connected Isochronous Stream - Central
          Connected Isochronous Stream - Peripheral
          Isochronous Broadcaster
          Synchronized Receiver
          Periodic Advertising ADI support
          Connection Subrating
          Unknown features (0x0000010000000000)
< HCI Command: LE Set Host Feature (0x08|0x0074) plen 2     #15 [hci1] 0.680026
        Bit Number: 32
          Connected Isochronous Stream (Host Support)
        Bit Value: 1
> HCI Event: Command Complete (0x0e) plen 4                 #16 [hci1] 0.680474
      LE Set Host Feature (0x08|0x0074) ncmd 1
        Status: Success (0x00)
< HCI Command: LE Read Buffer v2 (0x08|0x0060) plen 0       #17 [hci1] 0.700020
> HCI Event: Command Complete (0x0e) plen 10                #18 [hci1] 0.700534
      LE Read Buffer v2 (0x08|0x0060) ncmd 1
        Status: Success (0x00)
        ACL MTU: 27
        ACL max packet: 3
        ISO MTU: 318
        ISO max packet: 3
< HCI Command: LE Read Maximum Adve.. (0x08|0x003a) plen 0  #19 [hci1] 0.720054
> HCI Event: Command Complete (0x0e) plen 6                 #20 [hci1] 0.720503
      LE Read Maximum Advertising Data Length (0x08|0x003a) ncmd 1
        Status: Success (0x00)
        Max length: 1650
< HCI Command: LE Read Supported St.. (0x08|0x001c) plen 0  #21 [hci1] 0.740017
> HCI Event: Command Complete (0x0e) plen 12                #22 [hci1] 0.740569
      LE Read Supported States (0x08|0x001c) ncmd 1
        Status: Success (0x00)
        States: 0x000003ff3e0306ff
          Non-connectable Advertising State
          Scannable Advertising State
          Connectable Advertising State
          High Duty Cycle Directed Advertising State
          Passive Scanning State
          Active Scanning State
          Initiating State
            and Connection State (Central Role)
          Connection State (Peripheral Role)
          Scannable Advertising State
            and Passive Scanning State
          Connectable Advertising State
            and Passive Scanning State
          Non-connectable Advertising State
            and Initiating State
          Scannable Advertising State
            and Initiating State
          Active Scanning State
            and Connection State (Central Role)
          Passive Scanning State
            and Connection State (Peripheral Role)
          Active Scanning State
            and Connection State (Peripheral Role)
          Initiating State
            and Connection State (Central Role)
            and Central Role & Central Role
          Low Duty Cycle Directed Advertising State
          Connectable Advertising State
            and Initiating State
            and Central Role & Peripheral Role
          High Duty Cycle Directed Advertising State
            and Initiating State
            and Central Role & Peripheral Role
          Low Duty Cycle Directed Advertising State
            and Initiating State
            and Central Role & Peripheral Role
          Connectable Advertising State
            and Connection State (Central Role)
            and Central Role & Peripheral Role
          High Duty Cycle Directed Advertising State
            and Connection State (Central Role)
            and Central Role & Peripheral Role
          Low Duty Cycle Directed Advertising State
            and Connection State (Central Role)
            and Central Role & Peripheral Role
          Connectable Advertising State
            and Connection State (Peripheral Role)
            and Central Role & Peripheral Role
          High Duty Cycle Directed Advertising State
            and Connection State (Peripheral Role)
            and Peripheral Role & Peripheral Role
          Low Duty Cycle Directed Advertising State
            and Connection State (Peripheral Role)
            and Peripheral Role & Peripheral Role
          Initiating State
            and Connection State (Peripheral Role)
            and Central Role & Peripheral Role
< HCI Command: LE Read Maximum Data.. (0x08|0x002f) plen 0  #23 [hci1] 0.760022
> HCI Event: Command Complete (0x0e) plen 12                #24 [hci1] 0.760542
      LE Read Maximum Data Length (0x08|0x002f) ncmd 1
        Status: Success (0x00)
        Max TX octets: 251
        Max TX time: 2704
        Max RX octets: 251
        Max RX time: 2704
< HCI Command: LE Write Suggested D.. (0x08|0x0024) plen 4  #25 [hci1] 0.780078
        TX octets: 251
        TX time: 2704
> HCI Event: Command Complete (0x0e) plen 4                 #26 [hci1] 0.780496
      LE Write Suggested Default Data Length (0x08|0x0024) ncmd 1
        Status: Success (0x00)
< HCI Command: LE Read Resolving Li.. (0x08|0x002a) plen 0  #27 [hci1] 0.799970
> HCI Event: Command Complete (0x0e) plen 5                 #28 [hci1] 0.800466
      LE Read Resolving List Size (0x08|0x002a) ncmd 1
        Status: Success (0x00)
        Size: 8
< HCI Command: LE Set Event Mask (0x08|0x0001) plen 8       #29 [hci1] 0.820164
        Mask: 0x000002023f87fa5e
          LE Advertising Report
          LE Connection Update Complete
          LE Read Remote Used Features Complete
          LE Long Term Key Request
          LE Data Length Change
          LE Enhanced Connection Complete
          LE PHY Update Complete
          LE Extended Advertising Report
          LE Periodic Advertising Sync Established
          LE Periodic Advertising Report
          LE Periodic Advertising Sync Lost
          LE Extended Scan Timeout
          LE Extended Advertising Set Terminated
          LE Scan Request Received
          LE Periodic Advertising Sync Transfer Rvc
          LE CIS Established
          LE CIS Request
          LE Create BIG Complete
          LE Terminate BIG Complete
          LE BIG Sync Estabilished Complete
          LE BIG Sync Lost
          LE BIG Info Advertising Report
          Unknown mask (0x0000020000000000)
> HCI Event: Command Complete (0x0e) plen 4                 #30 [hci1] 0.820704
      LE Set Event Mask (0x08|0x0001) ncmd 1
        Status: Success (0x00)
< HCI Command: Set Event Mask (0x03|0x0001) plen 8          #31 [hci1] 0.840020
        Mask: 0x2000800002008890
          Disconnection Complete
          Encryption Change
          Read Remote Version Information Complete
          Hardware Error
          Data Buffer Overflow
          Encryption Key Refresh Complete
          LE Meta
> HCI Event: Command Complete (0x0e) plen 4                 #32 [hci1] 0.840554
      Set Event Mask (0x03|0x0001) ncmd 1
        Status: Success (0x00)
< HCI Command: Read BD ADDR (0x04|0x0009) plen 0            #33 [hci1] 0.860029
> HCI Event: Command Complete (0x0e) plen 10                #34 [hci1] 0.860478
      Read BD ADDR (0x04|0x0009) ncmd 1
        Status: Success (0x00)
        Address: 00:00:00:00:00:00 (OUI 00-00-00)
< HCI Command: LE Set Random Address (0x08|0x0005) plen 6   #35 [hci1] 0.880027
        Address: D5:B6:CC:31:DB:3B (Static)
> HCI Event: Command Complete (0x0e) plen 4                 #36 [hci1] 0.880510
      LE Set Random Address (0x08|0x0005) ncmd 1
        Status: Success (0x00)
< HCI Command: LE Set Extended Adv.. (0x08|0x0036) plen 25  #37 [hci1] 3.310139
        Handle: 0x00
        Properties: 0x0013
          Connectable
          Scannable
          Use legacy advertising PDUs: ADV_IND
        Min advertising interval: 100.000 msec (0x00a0)
        Max advertising interval: 150.000 msec (0x00f0)
        Channel map: 37, 38, 39 (0x07)
        Own address type: Random (0x01)
        Peer address type: Public (0x00)
        Peer address: 00:00:00:00:00:00 (OUI 00-00-00)
        Filter policy: Allow Scan Request from Any, Allow Connect Request from Any (0x00)
        TX power: Host has no preference (0x7f)
        Primary PHY: LE 1M (0x01)
        Secondary max skip: 0x00
        Secondary PHY: LE 1M (0x01)
        SID: 0x00
        Scan request notifications: Disabled (0x00)
> HCI Event: Command Complete (0x0e) plen 5                 #38 [hci1] 3.311035
      LE Set Extended Advertising Parameters (0x08|0x0036) ncmd 1
        Status: Success (0x00)
        TX power (selected): 0 dbm (0x00)
< HCI Command: LE Set Advertising S.. (0x08|0x0035) plen 7  #39 [hci1] 3.320066
        Advertising handle: 0x00
        Advertising random address: D5:B6:CC:31:DB:3B (Static)
> HCI Event: Command Complete (0x0e) plen 4                 #40 [hci1] 3.320558
      LE Set Advertising Set Random Address (0x08|0x0035) ncmd 1
        Status: Success (0x00)
< HCI Command: LE Set Extended Adv.. (0x08|0x0037) plen 22  #41 [hci1] 3.340052
        Handle: 0x00
        Operation: Complete extended advertising data (0x03)
        Fragment preference: Minimize fragmentation (0x01)
        Data length: 0x12
        Flags: 0x06
          LE General Discoverable Mode
          BR/EDR Not Supported
        Name (complete): Tester_F6B11A
> HCI Event: Command Complete (0x0e) plen 4                 #42 [hci1] 3.340777
      LE Set Extended Advertising Data (0x08|0x0037) ncmd 1
        Status: Success (0x00)
< HCI Command: LE Set Extended Scan.. (0x08|0x0038) plen 4  #43 [hci1] 3.360061
        Handle: 0x00
        Operation: Complete scan response data (0x03)
        Fragment preference: Minimize fragmentation (0x01)
        Data length: 0x00
> HCI Event: Command Complete (0x0e) plen 4                 #44 [hci1] 3.360513
      LE Set Extended Scan Response Data (0x08|0x0038) ncmd 1
        Status: Success (0x00)
< HCI Command: LE Set Extended Adve.. (0x08|0x0039) plen 6  #45 [hci1] 3.380054
        Extended advertising: Enabled (0x01)
        Number of sets: 1 (0x01)
        Entry 0
          Handle: 0x00
          Duration: 0 ms (0x00)
          Max ext adv events: 0
> HCI Event: Command Complete (0x0e) plen 4                 #46 [hci1] 3.380589
      LE Set Extended Advertising Enable (0x08|0x0039) ncmd 1
        Status: Success (0x00)
> HCI Event: LE Meta Event (0x3e) plen 31                   #47 [hci1] 3.502181
      LE Enhanced Connection Complete (0x0a)
        Status: Success (0x00)
        Handle: 3351
        Role: Peripheral (0x01)
        Peer address type: Public (0x00)
        Peer address: DF:A9:FF:F6:B1:1A (OUI DF-A9-FF)
        Local resolvable private address: 00:00:00:00:00:00 (Non-Resolvable)
        Peer resolvable private address: 00:00:00:00:00:00 (Non-Resolvable)
        Connection interval: 87.50 msec (0x0046)
        Connection latency: 0 (0x0000)
        Supervision timeout: 25120 msec (0x09d0)
        Central clock accuracy: 0x01
> HCI Event: LE Meta Event (0x3e) plen 6                    #48 [hci1] 3.502300
      LE Advertising Set Terminated (0x12)
        Status: Success (0x00)
        Handle: 0
        Connection handle: 3351
        Number of completed extended advertising events: 0
< HCI Command: LE Read Remote Used... (0x08|0x0016) plen 2  #49 [hci1] 3.521054
        Handle: 3351 Address: DF:A9:FF:F6:B1:1A (OUI DF-A9-FF)
< ACL Data TX: Handle 3351 flags 0x00 dlen 7                #50 [hci1] 3.521077
      ATT: Exchange MTU Request (0x02) len 2
        Client RX MTU: 251
> HCI Event: Command Status (0x0f) plen 4                   #51 [hci1] 3.521665
      LE Read Remote Used Features (0x08|0x0016) ncmd 1
        Status: Success (0x00)
> HCI Event: Number of Completed Packets (0x13) plen 5      #52 [hci1] 3.678160
        Num handles: 1
        Handle: 3351 Address: DF:A9:FF:F6:B1:1A (OUI DF-A9-FF)
        Count: 1
        #50: len 7 (0 Kb/s)
        Latency: 157 msec (157-157 msec ~157 msec)
> HCI Event: LE Meta Event (0x3e) plen 12                   #53 [hci1] 3.766100
      LE Read Remote Used Features (0x04)
        Status: Success (0x00)
        Handle: 3351 Address: DF:A9:FF:F6:B1:1A (OUI DF-A9-FF)
        Features: 0x2d 0x49 0x00 0xf7 0x67 0xd9 0x00 0x80
          LE Encryption
          Extended Reject Indication
          Peripheral-initiated Features Exchange
          LE Data Packet Length Extension
          LE 2M PHY
          LE Coded PHY
          Channel Selection Algorithm #2
          Periodic Advertising Sync Transfer - Sender
          Periodic Advertising Sync Transfer - Recipient
          Sleep Clock Accuracy Updates
          Connected Isochronous Stream - Central
          Connected Isochronous Stream - Peripheral
          Isochronous Broadcaster
          Synchronized Receiver
          Connected Isochronous Stream (Host Support)
          LE Power Control Request
          LE Power Control Request
          Connection Subrating
          Connection Subrating (Host Support)
          Unknown features (0x8000d90000000000)
> ACL Data RX: Handle 3351 flags 0x02 dlen 11               #54 [hci1] 6.215763
      SMP: Pairing Request (0x01) len 6
        IO capability: KeyboardDisplay (0x04)
        OOB data: Authentication data not present (0x00)
        Authentication requirement: Bonding, No MITM, SC, No Keypresses (0x09)
        Max encryption key size: 16
        Initiator key distribution: EncKey IdKey (0x03)
        Responder key distribution: EncKey IdKey Sign (0x07)
> ACL Data RX: Handle 3351 flags 0x02 dlen 7                #55 [hci1] 6.216215
      ATT: Exchange MTU Response (0x03) len 2
        Server RX MTU: 23
< HCI Command: Host Number of Compl.. (0x03|0x0035) plen 5  #56 [hci1] 6.220512
        Num handles: 1
        Handle: 3351 Address: DF:A9:FF:F6:B1:1A (OUI DF-A9-FF)
        Count: 1
< ACL Data TX: Handle 3351 flags 0x00 dlen 11               #57 [hci1] 6.220684
      SMP: Pairing Response (0x02) len 6
        IO capability: NoInputNoOutput (0x03)
        OOB data: Authentication data not present (0x00)
        Authentication requirement: Bonding, No MITM, SC, No Keypresses (0x09)
        Max encryption key size: 16
        Initiator key distribution: IdKey (0x02)
        Responder key distribution: <none> (0x00)
< HCI Command: Host Number of Compl.. (0x03|0x0035) plen 5  #58 [hci1] 6.220969
        Num handles: 1
        Handle: 3351 Address: DF:A9:FF:F6:B1:1A (OUI DF-A9-FF)
        Count: 1
> HCI Event: Number of Completed Packets (0x13) plen 5      #59 [hci1] 6.390871
        Num handles: 1
        Handle: 3351 Address: DF:A9:FF:F6:B1:1A (OUI DF-A9-FF)
        Count: 1
        #57: len 11 (0 Kb/s)
        Latency: 170 msec (157-170 msec ~163 msec)
> ACL Data RX: Handle 3351 flags 0x02 dlen 27               #60 [hci1] 6.391105
> ACL Data RX: Handle 3351 flags 0x01 dlen 27               #61 [hci1] 6.391736
> ACL Data RX: Handle 3351 flags 0x01 dlen 15               #62 [hci1] 6.392220
      SMP: Pairing Public Key (0x0c) len 64
        X: 836724f55a384eea7048e89517d5a061be703c5e125afc2d890363de60720f48
        Y: 14f7fcf41d67328b9dd5e2276094d761f9f8750d510ce2cda442e946bb6acf73
< HCI Command: Host Number of Compl.. (0x03|0x0035) plen 5  #63 [hci1] 6.400841
        Num handles: 1
        Handle: 3351 Address: DF:A9:FF:F6:B1:1A (OUI DF-A9-FF)
        Count: 1
< HCI Command: Host Number of Compl.. (0x03|0x0035) plen 5  #64 [hci1] 6.401075
        Num handles: 1
        Handle: 3351 Address: DF:A9:FF:F6:B1:1A (OUI DF-A9-FF)
        Count: 1
< HCI Command: Host Number of Compl.. (0x03|0x0035) plen 5  #65 [hci1] 6.401337
        Num handles: 1
        Handle: 3351 Address: DF:A9:FF:F6:B1:1A (OUI DF-A9-FF)
        Count: 1
< ACL Data TX: Handle 3351 flags 0x00 dlen 27               #66 [hci1] 6.401390
< ACL Data TX: Handle 3351 flags 0x01 dlen 27               #67 [hci1] 6.401423
< ACL Data TX: Handle 3351 flags 0x01 dlen 15               #68 [hci1] 6.401430
      SMP: Pairing Public Key (0x0c) len 64
        X: 98308440221e2d910f0e54b71e7ec652857aa9b5a0dc65028824cc19db1226e9
        Y: 67a4816bcb62efb21701e31fdb27561a6217575fb007a8bbdabe7e28b6f68482
> HCI Event: Number of Completed Packets (0x13) plen 5      #69 [hci1] 6.478683
        Num handles: 1
        Handle: 3351 Address: DF:A9:FF:F6:B1:1A (OUI DF-A9-FF)
        Count: 1
        #66: len 27 (2 Kb/s)
        Latency: 77 msec (77-170 msec ~120 msec)
> HCI Event: Number of Completed Packets (0x13) plen 5      #70 [hci1] 6.479460
        Num handles: 1
        Handle: 3351 Address: DF:A9:FF:F6:B1:1A (OUI DF-A9-FF)
        Count: 1
        #67: len 27 (2 Kb/s)
        Latency: 78 msec (77-170 msec ~99 msec)
< ACL Data TX: Handle 3351 flags 0x00 dlen 21               #71 [hci1] 6.480432
      SMP: Pairing Confirm (0x03) len 16
        Confim value: 48428a3ec97b26696591622f7030e89a
> HCI Event: Number of Completed Packets (0x13) plen 5      #72 [hci1] 6.565589
        Num handles: 1
        Handle: 3351 Address: DF:A9:FF:F6:B1:1A (OUI DF-A9-FF)
        Count: 1
        #68: len 15 (0 Kb/s)
        Latency: 164 msec (77-170 msec ~131 msec)
> HCI Event: Number of Completed Packets (0x13) plen 5      #73 [hci1] 6.653214
        Num handles: 1
        Handle: 3351 Address: DF:A9:FF:F6:B1:1A (OUI DF-A9-FF)
        Count: 1
        #71: len 21 (0 Kb/s)
        Latency: 172 msec (77-172 msec ~152 msec)
> ACL Data RX: Handle 3351 flags 0x02 dlen 21               #74 [hci1] 6.653600
      SMP: Pairing Random (0x04) len 16
        Random value: 6c948cae6fdc44040000000000000000
< HCI Command: Host Number of Compl.. (0x03|0x0035) plen 5  #75 [hci1] 6.660701
        Num handles: 1
        Handle: 3351 Address: DF:A9:FF:F6:B1:1A (OUI DF-A9-FF)
        Count: 1
< ACL Data TX: Handle 3351 flags 0x00 dlen 21               #76 [hci1] 6.660787
      SMP: Pairing Random (0x04) len 16
        Random value: 8e6108f966a694cbe26df70bb96773e6
> HCI Event: Number of Completed Packets (0x13) plen 5      #77 [hci1] 6.828206
        Num handles: 1
        Handle: 3351 Address: DF:A9:FF:F6:B1:1A (OUI DF-A9-FF)
        Count: 1
        #76: len 21 (1 Kb/s)
        Latency: 167 msec (77-172 msec ~159 msec)
> ACL Data RX: Handle 3351 flags 0x02 dlen 21               #78 [hci1] 7.003492
      SMP: Pairing DHKey Check (0x0d) len 16
        E: 8d5f7e5c0c9f9a2e2842a1f08e0fd91d
< HCI Command: Host Number of Compl.. (0x03|0x0035) plen 5  #79 [hci1] 7.021073
        Num handles: 1
        Handle: 3351 Address: DF:A9:FF:F6:B1:1A (OUI DF-A9-FF)
        Count: 1
< ACL Data TX: Handle 3351 flags 0x00 dlen 21               #80 [hci1] 7.021284
      SMP: Pairing DHKey Check (0x0d) len 16
        E: 6d4eda52001c2c52d82f23b82b62ca4c
> HCI Event: Number of Completed Packets (0x13) plen 5      #81 [hci1] 7.178120
        Num handles: 1
        Handle: 3351 Address: DF:A9:FF:F6:B1:1A (OUI DF-A9-FF)
        Count: 1
        #80: len 21 (1 Kb/s)
        Latency: 156 msec (77-172 msec ~158 msec)
> HCI Event: LE Meta Event (0x3e) plen 13                   #82 [hci1] 7.266224
      LE Long Term Key Request (0x05)
        Handle: 3351 Address: DF:A9:FF:F6:B1:1A (OUI DF-A9-FF)
        Random number: 0x0000000000000000
        Encrypted diversifier: 0x0000
< HCI Command: LE Long Term Key Re.. (0x08|0x001a) plen 18  #83 [hci1] 7.280441
        Handle: 3351 Address: DF:A9:FF:F6:B1:1A (OUI DF-A9-FF)
        Long term key: 63cd9aec4e95581ba0319af264bde4fe
> HCI Event: Command Complete (0x0e) plen 6                 #84 [hci1] 7.281130
      LE Long Term Key Request Reply (0x08|0x001a) ncmd 1
        Status: Success (0x00)
        Handle: 3351 Address: DF:A9:FF:F6:B1:1A (OUI DF-A9-FF)
> HCI Event: Encryption Change (0x08) plen 4                #85 [hci1] 7.703356
        Status: Success (0x00)
        Handle: 3351 Address: DF:A9:FF:F6:B1:1A (OUI DF-A9-FF)
        Encryption: Enabled with AES-CCM (0x01)
> ACL Data RX: Handle 3351 flags 0x02 dlen 21               #86 [hci1] 7.790960
      SMP: Identity Information (0x08) len 16
        Identity resolving key: 50270d4b343ebe938af5b3ac9414ddd4
< HCI Command: Host Number of Compl.. (0x03|0x0035) plen 5  #87 [hci1] 7.830845
        Num handles: 1
        Handle: 3351 Address: DF:A9:FF:F6:B1:1A (OUI DF-A9-FF)
        Count: 1
> ACL Data RX: Handle 3351 flags 0x02 dlen 12               #88 [hci1] 7.878263
      SMP: Identity Address Information (0x09) len 7
        Address: DF:A9:FF:F6:B1:1A (OUI DF-A9-FF)
> ACL Data RX: Handle 3351 flags 0x02 dlen 11               #89 [hci1] 7.878851
      ATT: Read By Group Type Request (0x10) len 6
        Handle range: 0x0001-0xffff
        Attribute group type: Primary Service (0x2800)
< HCI Command: LE Add Device To Re.. (0x08|0x0027) plen 39  #90 [hci1] 7.880514
        Address type: Public (0x00)
        Address: DF:A9:FF:F6:B1:1A (OUI DF-A9-FF)
        Peer identity resolving key: 50270d4b343ebe938af5b3ac9414ddd4
        Local identity resolving key: 00000000000000000000000000000000
> HCI Event: Command Complete (0x0e) plen 4                 #91 [hci1] 7.881576
      LE Add Device To Resolving List (0x08|0x0027) ncmd 1
        Status: Success (0x00)
< HCI Command: LE Set Privacy Mode (0x08|0x004e) plen 8     #92 [hci1] 7.900453
        Peer Identity address type: Public (0x00)
        Peer Identity address: DF:A9:FF:F6:B1:1A (OUI DF-A9-FF)
        Privacy Mode: Use Device Privacy (0x01)
> HCI Event: Command Complete (0x0e) plen 4                 #93 [hci1] 7.901046
      LE Set Privacy Mode (0x08|0x004e) ncmd 1
        Status: Success (0x00)
< HCI Command: LE Set Address Resol.. (0x08|0x002d) plen 1  #94 [hci1] 7.920389
        Address resolution: Enabled (0x01)
> HCI Event: Command Complete (0x0e) plen 4                 #95 [hci1] 7.920831
      LE Set Address Resolution Enable (0x08|0x002d) ncmd 1
        Status: Success (0x00)
< HCI Command: Host Number of Compl.. (0x03|0x0035) plen 5  #96 [hci1] 7.940393
        Num handles: 1
        Handle: 3351 Address: DF:A9:FF:F6:B1:1A (OUI DF-A9-FF)
        Count: 1
< HCI Command: Host Number of Compl.. (0x03|0x0035) plen 5  #97 [hci1] 7.940760
        Num handles: 1
        Handle: 3351 Address: DF:A9:FF:F6:B1:1A (OUI DF-A9-FF)
        Count: 1
< ACL Data TX: Handle 3351 flags 0x00 dlen 24               #98 [hci1] 7.940802
      ATT: Read By Group Type Response (0x11) len 19
        Attribute data length: 6
        Attribute group list: 3 entries
        Handle range: 0x0001-0x000a
        UUID: Generic Attribute Profile (0x1801)
        Handle range: 0x000b-0x0011
        UUID: Generic Access Profile (0x1800)
        Handle range: 0x0012-0x0020
        UUID: Device Information (0x180a)
> HCI Event: Number of Completed Packets (0x13) plen 5      #99 [hci1] 8.053197
        Num handles: 1
        Handle: 3351 Address: DF:A9:FF:F6:B1:1A (OUI DF-A9-FF)
        Count: 1
        #98: len 24 (1 Kb/s)
        Latency: 112 msec (77-172 msec ~135 msec)
> ACL Data RX: Handle 3351 flags 0x02 dlen 11              #100 [hci1] 8.053459
      ATT: Read By Group Type Request (0x10) len 6
        Handle range: 0x0021-0xffff
        Attribute group type: Primary Service (0x2800)
< HCI Command: Host Number of Comp.. (0x03|0x0035) plen 5  #101 [hci1] 8.060905
        Num handles: 1
        Handle: 3351 Address: DF:A9:FF:F6:B1:1A (OUI DF-A9-FF)
        Count: 1
< ACL Data TX: Handle 3351 flags 0x00 dlen 18              #102 [hci1] 8.060983
      ATT: Read By Group Type Response (0x11) len 13
        Attribute data length: 6
        Attribute group list: 2 entries
        Handle range: 0x0021-0x0023
        UUID: Immediate Alert (0x1802)
        Handle range: 0x0024-0x002f
        UUID: Coordinated Set Identification (0x1846)
> HCI Event: Number of Completed Packets (0x13) plen 5     #103 [hci1] 8.228188
        Num handles: 1
        Handle: 3351 Address: DF:A9:FF:F6:B1:1A (OUI DF-A9-FF)
        Count: 1
        #102: len 18 (0 Kb/s)
        Latency: 167 msec (77-172 msec ~151 msec)
> ACL Data RX: Handle 3351 flags 0x02 dlen 11              #104 [hci1] 8.228508
      ATT: Read By Group Type Request (0x10) len 6
        Handle range: 0x0030-0xffff
        Attribute group type: Primary Service (0x2800)
< HCI Command: Host Number of Comp.. (0x03|0x0035) plen 5  #105 [hci1] 8.240687
        Num handles: 1
        Handle: 3351 Address: DF:A9:FF:F6:B1:1A (OUI DF-A9-FF)
        Count: 1
< ACL Data TX: Handle 3351 flags 0x00 dlen 9               #106 [hci1] 8.240994
      ATT: Error Response (0x01) len 4
        Read By Group Type Request (0x10)
        Handle: 0x0030
        Error: Attribute Not Found (0x0a)
> HCI Event: Number of Completed Packets (0x13) plen 5     #107 [hci1] 8.403206
        Num handles: 1
        Handle: 3351 Address: DF:A9:FF:F6:B1:1A (OUI DF-A9-FF)
        Count: 1
        #106: len 9 (0 Kb/s)
        Latency: 162 msec (77-172 msec ~156 msec)
> ACL Data RX: Handle 3351 flags 0x02 dlen 11              #108 [hci1] 8.403500
      ATT: Read By Type Request (0x08) len 6
        Handle range: 0x0001-0x000a
        Attribute type: Characteristic (0x2803)
< HCI Command: Host Number of Comp.. (0x03|0x0035) plen 5  #109 [hci1] 8.420767
        Num handles: 1
        Handle: 3351 Address: DF:A9:FF:F6:B1:1A (OUI DF-A9-FF)
        Count: 1
< ACL Data TX: Handle 3351 flags 0x00 dlen 20              #110 [hci1] 8.420865
      ATT: Read By Type Response (0x09) len 15
        Attribute data length: 7
        Attribute data list: 2 entries
        Handle: 0x0002
        Value: 200300052a
            Properties: 0x20
              Indicate (0x20)
            Value Handle: 0x0003
            Value UUID: Service Changed (0x2a05)
        Handle: 0x0005
        Value: 0a0600292b
            Properties: 0x0a
              Read (0x02)
              Write (0x08)
            Value Handle: 0x0006
            Value UUID: Client Supported Features (0x2b29)
> HCI Event: Number of Completed Packets (0x13) plen 5     #111 [hci1] 8.578208
        Num handles: 1
        Handle: 3351 Address: DF:A9:FF:F6:B1:1A (OUI DF-A9-FF)
        Count: 1
        #110: len 20 (1 Kb/s)
        Latency: 157 msec (77-172 msec ~157 msec)
> ACL Data RX: Handle 3351 flags 0x02 dlen 11              #112 [hci1] 8.578442
      ATT: Read By Type Request (0x08) len 6
        Handle range: 0x0006-0x000a
        Attribute type: Characteristic (0x2803)
< HCI Command: Host Number of Comp.. (0x03|0x0035) plen 5  #113 [hci1] 8.580772
        Num handles: 1
        Handle: 3351 Address: DF:A9:FF:F6:B1:1A (OUI DF-A9-FF)
        Count: 1
< ACL Data TX: Handle 3351 flags 0x00 dlen 20              #114 [hci1] 8.580881
      ATT: Read By Type Response (0x09) len 15
        Attribute data length: 7
        Attribute data list: 2 entries
        Handle: 0x0007
        Value: 0208002a2b
            Properties: 0x02
              Read (0x02)
            Value Handle: 0x0008
            Value UUID: Database Hash (0x2b2a)
        Handle: 0x0009
        Value: 020a003a2b
            Properties: 0x02
              Read (0x02)
            Value Handle: 0x000a
            Value UUID: Server Supported Features (0x2b3a)
> HCI Event: Number of Completed Packets (0x13) plen 5     #115 [hci1] 8.753206
        Num handles: 1
        Handle: 3351 Address: DF:A9:FF:F6:B1:1A (OUI DF-A9-FF)
        Count: 1
        #114: len 20 (0 Kb/s)
        Latency: 172 msec (77-172 msec ~164 msec)
> ACL Data RX: Handle 3351 flags 0x02 dlen 11              #116 [hci1] 8.753383
      ATT: Read By Type Request (0x08) len 6
        Handle range: 0x000a-0x000a
        Attribute type: Characteristic (0x2803)
< HCI Command: Host Number of Comp.. (0x03|0x0035) plen 5  #117 [hci1] 8.760748
        Num handles: 1
        Handle: 3351 Address: DF:A9:FF:F6:B1:1A (OUI DF-A9-FF)
        Count: 1
< ACL Data TX: Handle 3351 flags 0x00 dlen 9               #118 [hci1] 8.760932
      ATT: Error Response (0x01) len 4
        Read By Type Request (0x08)
        Handle: 0x000a
        Error: Attribute Not Found (0x0a)
> HCI Event: Number of Completed Packets (0x13) plen 5     #119 [hci1] 8.928178
        Num handles: 1
        Handle: 3351 Address: DF:A9:FF:F6:B1:1A (OUI DF-A9-FF)
        Count: 1
        #118: len 9 (0 Kb/s)
        Latency: 167 msec (77-172 msec ~165 msec)
> ACL Data RX: Handle 3351 flags 0x02 dlen 9               #120 [hci1] 8.928468
      ATT: Find Information Request (0x04) len 4
        Handle range: 0x0004-0x0004
< HCI Command: Host Number of Comp.. (0x03|0x0035) plen 5  #121 [hci1] 8.940736
        Num handles: 1
        Handle: 3351 Address: DF:A9:FF:F6:B1:1A (OUI DF-A9-FF)
        Count: 1
< ACL Data TX: Handle 3351 flags 0x00 dlen 10              #122 [hci1] 8.940847
      ATT: Find Information Response (0x05) len 5
        Format: UUID-16 (0x01)
        Handle: 0x0004
        UUID: Client Characteristic Configuration (0x2902)
> HCI Event: Number of Completed Packets (0x13) plen 5     #123 [hci1] 9.103264
        Num handles: 1
        Handle: 3351 Address: DF:A9:FF:F6:B1:1A (OUI DF-A9-FF)
        Count: 1
        #122: len 10 (0 Kb/s)
        Latency: 162 msec (77-172 msec ~164 msec)
> ACL Data RX: Handle 3351 flags 0x02 dlen 11              #124 [hci1] 9.103534
      ATT: Read By Type Request (0x08) len 6
        Handle range: 0x000b-0x0011
        Attribute type: Characteristic (0x2803)
< HCI Command: Host Number of Comp.. (0x03|0x0035) plen 5  #125 [hci1] 9.120380
        Num handles: 1
        Handle: 3351 Address: DF:A9:FF:F6:B1:1A (OUI DF-A9-FF)
        Count: 1
< ACL Data TX: Handle 3351 flags 0x00 dlen 20              #126 [hci1] 9.120420
      ATT: Read By Type Response (0x09) len 15
        Attribute data length: 7
        Attribute data list: 2 entries
        Handle: 0x000c
        Value: 0a0d00002a
            Properties: 0x0a
              Read (0x02)
              Write (0x08)
            Value Handle: 0x000d
            Value UUID: Device Name (0x2a00)
        Handle: 0x000e
        Value: 0a0f00012a
            Properties: 0x0a
              Read (0x02)
              Write (0x08)
            Value Handle: 0x000f
            Value UUID: Appearance (0x2a01)
> HCI Event: Number of Completed Packets (0x13) plen 5     #127 [hci1] 9.278249
        Num handles: 1
        Handle: 3351 Address: DF:A9:FF:F6:B1:1A (OUI DF-A9-FF)
        Count: 1
        #126: len 20 (1 Kb/s)
        Latency: 157 msec (77-172 msec ~161 msec)
> ACL Data RX: Handle 3351 flags 0x02 dlen 11              #128 [hci1] 9.278384
      ATT: Read By Type Request (0x08) len 6
        Handle range: 0x000f-0x0011
        Attribute type: Characteristic (0x2803)
< HCI Command: Host Number of Comp.. (0x03|0x0035) plen 5  #129 [hci1] 9.280827
        Num handles: 1
        Handle: 3351 Address: DF:A9:FF:F6:B1:1A (OUI DF-A9-FF)
        Count: 1
< ACL Data TX: Handle 3351 flags 0x00 dlen 13              #130 [hci1] 9.280943
      ATT: Read By Type Response (0x09) len 8
        Attribute data length: 7
        Attribute data list: 1 entry
        Handle: 0x0010
        Value: 021100042a
            Properties: 0x02
              Read (0x02)
            Value Handle: 0x0011
            Value UUID: Peripheral Preferred Connection Parameters (0x2a04)
> HCI Event: Number of Completed Packets (0x13) plen 5     #131 [hci1] 9.453194
        Num handles: 1
        Handle: 3351 Address: DF:A9:FF:F6:B1:1A (OUI DF-A9-FF)
        Count: 1
        #130: len 13 (0 Kb/s)
        Latency: 172 msec (77-172 msec ~166 msec)
> ACL Data RX: Handle 3351 flags 0x02 dlen 11              #132 [hci1] 9.453477
      ATT: Read By Type Request (0x08) len 6
        Handle range: 0x0011-0x0011
        Attribute type: Characteristic (0x2803)
< HCI Command: Host Number of Comp.. (0x03|0x0035) plen 5  #133 [hci1] 9.460675
        Num handles: 1
        Handle: 3351 Address: DF:A9:FF:F6:B1:1A (OUI DF-A9-FF)
        Count: 1
< ACL Data TX: Handle 3351 flags 0x00 dlen 9               #134 [hci1] 9.460863
      ATT: Error Response (0x01) len 4
        Read By Type Request (0x08)
        Handle: 0x0011
        Error: Attribute Not Found (0x0a)
> HCI Event: Number of Completed Packets (0x13) plen 5     #135 [hci1] 9.628204
        Num handles: 1
        Handle: 3351 Address: DF:A9:FF:F6:B1:1A (OUI DF-A9-FF)
        Count: 1
        #134: len 9 (0 Kb/s)
        Latency: 167 msec (77-172 msec ~166 msec)
> ACL Data RX: Handle 3351 flags 0x02 dlen 11              #136 [hci1] 9.628532
      ATT: Read By Type Request (0x08) len 6
        Handle range: 0x0012-0x0020
        Attribute type: Characteristic (0x2803)
< HCI Command: Host Number of Comp.. (0x03|0x0035) plen 5  #137 [hci1] 9.640550
        Num handles: 1
        Handle: 3351 Address: DF:A9:FF:F6:B1:1A (OUI DF-A9-FF)
        Count: 1
< ACL Data TX: Handle 3351 flags 0x00 dlen 20              #138 [hci1] 9.640640
      ATT: Read By Type Response (0x09) len 15
        Attribute data length: 7
        Attribute data list: 2 entries
        Handle: 0x0013
        Value: 021400242a
            Properties: 0x02
              Read (0x02)
            Value Handle: 0x0014
            Value UUID: Model Number String (0x2a24)
        Handle: 0x0015
        Value: 021600292a
            Properties: 0x02
              Read (0x02)
            Value Handle: 0x0016
            Value UUID: Manufacturer Name String (0x2a29)
> HCI Event: Number of Completed Packets (0x13) plen 5     #139 [hci1] 9.803235
        Num handles: 1
        Handle: 3351 Address: DF:A9:FF:F6:B1:1A (OUI DF-A9-FF)
        Count: 1
        #138: len 20 (0 Kb/s)
        Latency: 162 msec (77-172 msec ~164 msec)
> ACL Data RX: Handle 3351 flags 0x02 dlen 11              #140 [hci1] 9.803440
      ATT: Read By Type Request (0x08) len 6
        Handle range: 0x0016-0x0020
        Attribute type: Characteristic (0x2803)
< HCI Command: Host Number of Comp.. (0x03|0x0035) plen 5  #141 [hci1] 9.820682
        Num handles: 1
        Handle: 3351 Address: DF:A9:FF:F6:B1:1A (OUI DF-A9-FF)
        Count: 1
< ACL Data TX: Handle 3351 flags 0x00 dlen 20              #142 [hci1] 9.820721
      ATT: Read By Type Response (0x09) len 15
        Attribute data length: 7
        Attribute data list: 2 entries
        Handle: 0x0017
        Value: 021800502a
            Properties: 0x02
              Read (0x02)
            Value Handle: 0x0018
            Value UUID: PnP ID (0x2a50)
        Handle: 0x0019
        Value: 021a00252a
            Properties: 0x02
              Read (0x02)
            Value Handle: 0x001a
            Value UUID: Serial Number String (0x2a25)
> HCI Event: Number of Completed Packets (0x13) plen 5     #143 [hci1] 9.978174
        Num handles: 1
        Handle: 3351 Address: DF:A9:FF:F6:B1:1A (OUI DF-A9-FF)
        Count: 1
        #142: len 20 (1 Kb/s)
        Latency: 157 msec (77-172 msec ~161 msec)
> ACL Data RX: Handle 3351 flags 0x02 dlen 11              #144 [hci1] 9.978416
      ATT: Read By Type Request (0x08) len 6
        Handle range: 0x001a-0x0020
        Attribute type: Characteristic (0x2803)
< HCI Command: Host Number of Comp.. (0x03|0x0035) plen 5  #145 [hci1] 9.980706
        Num handles: 1
        Handle: 3351 Address: DF:A9:FF:F6:B1:1A (OUI DF-A9-FF)
        Count: 1
< ACL Data TX: Handle 3351 flags 0x00 dlen 20              #146 [hci1] 9.980808
      ATT: Read By Type Response (0x09) len 15
        Attribute data length: 7
        Attribute data list: 2 entries
        Handle: 0x001b
        Value: 021c00262a
            Properties: 0x02
              Read (0x02)
            Value Handle: 0x001c
            Value UUID: Firmware Revision String (0x2a26)
        Handle: 0x001d
        Value: 021e00272a
            Properties: 0x02
              Read (0x02)
            Value Handle: 0x001e
            Value UUID: Hardware Revision String (0x2a27)
> HCI Event: Number of Completed Packets (0x13) plen 5    #147 [hci1] 10.153232
        Num handles: 1
        Handle: 3351 Address: DF:A9:FF:F6:B1:1A (OUI DF-A9-FF)
        Count: 1
        #146: len 20 (0 Kb/s)
        Latency: 172 msec (77-172 msec ~166 msec)
> ACL Data RX: Handle 3351 flags 0x02 dlen 11             #148 [hci1] 10.153442
      ATT: Read By Type Request (0x08) len 6
        Handle range: 0x001e-0x0020
        Attribute type: Characteristic (0x2803)
< HCI Command: Host Number of Com.. (0x03|0x0035) plen 5  #149 [hci1] 10.160832
        Num handles: 1
        Handle: 3351 Address: DF:A9:FF:F6:B1:1A (OUI DF-A9-FF)
        Count: 1
< ACL Data TX: Handle 3351 flags 0x00 dlen 13             #150 [hci1] 10.160924
      ATT: Read By Type Response (0x09) len 8
        Attribute data length: 7
        Attribute data list: 1 entry
        Handle: 0x001f
        Value: 022000282a
            Properties: 0x02
              Read (0x02)
            Value Handle: 0x0020
            Value UUID: Software Revision String (0x2a28)
> HCI Event: Number of Completed Packets (0x13) plen 5    #151 [hci1] 10.328201
        Num handles: 1
        Handle: 3351 Address: DF:A9:FF:F6:B1:1A (OUI DF-A9-FF)
        Count: 1
        #150: len 13 (0 Kb/s)
        Latency: 167 msec (77-172 msec ~167 msec)
> ACL Data RX: Handle 3351 flags 0x02 dlen 11             #152 [hci1] 10.328411
      ATT: Read By Type Request (0x08) len 6
        Handle range: 0x0020-0x0020
        Attribute type: Characteristic (0x2803)
< HCI Command: Host Number of Com.. (0x03|0x0035) plen 5  #153 [hci1] 10.340841
        Num handles: 1
        Handle: 3351 Address: DF:A9:FF:F6:B1:1A (OUI DF-A9-FF)
        Count: 1
< ACL Data TX: Handle 3351 flags 0x00 dlen 9              #154 [hci1] 10.341068
      ATT: Error Response (0x01) len 4
        Read By Type Request (0x08)
        Handle: 0x0020
        Error: Attribute Not Found (0x0a)
> HCI Event: Number of Completed Packets (0x13) plen 5    #155 [hci1] 10.503244
        Num handles: 1
        Handle: 3351 Address: DF:A9:FF:F6:B1:1A (OUI DF-A9-FF)
        Count: 1
        #154: len 9 (0 Kb/s)
        Latency: 162 msec (77-172 msec ~164 msec)
> ACL Data RX: Handle 3351 flags 0x02 dlen 11             #156 [hci1] 10.503391
      ATT: Read By Type Request (0x08) len 6
        Handle range: 0x0021-0x0023
        Attribute type: Characteristic (0x2803)
< HCI Command: Host Number of Com.. (0x03|0x0035) plen 5  #157 [hci1] 10.520844
        Num handles: 1
        Handle: 3351 Address: DF:A9:FF:F6:B1:1A (OUI DF-A9-FF)
        Count: 1
< ACL Data TX: Handle 3351 flags 0x00 dlen 13             #158 [hci1] 10.520942
      ATT: Read By Type Response (0x09) len 8
        Attribute data length: 7
        Attribute data list: 1 entry
        Handle: 0x0022
        Value: 042300062a
            Properties: 0x04
              Write Without Response (0x04)
            Value Handle: 0x0023
            Value UUID: Alert Level (0x2a06)
> HCI Event: Number of Completed Packets (0x13) plen 5    #159 [hci1] 10.678219
        Num handles: 1
        Handle: 3351 Address: DF:A9:FF:F6:B1:1A (OUI DF-A9-FF)
        Count: 1
        #158: len 13 (0 Kb/s)
        Latency: 157 msec (77-172 msec ~160 msec)
> ACL Data RX: Handle 3351 flags 0x02 dlen 11             #160 [hci1] 10.678438
      ATT: Read By Type Request (0x08) len 6
        Handle range: 0x0023-0x0023
        Attribute type: Characteristic (0x2803)
< HCI Command: Host Number of Com.. (0x03|0x0035) plen 5  #161 [hci1] 10.680800
        Num handles: 1
        Handle: 3351 Address: DF:A9:FF:F6:B1:1A (OUI DF-A9-FF)
        Count: 1
< ACL Data TX: Handle 3351 flags 0x00 dlen 9              #162 [hci1] 10.681035
      ATT: Error Response (0x01) len 4
        Read By Type Request (0x08)
        Handle: 0x0023
        Error: Attribute Not Found (0x0a)
> HCI Event: Number of Completed Packets (0x13) plen 5    #163 [hci1] 10.853214
        Num handles: 1
        Handle: 3351 Address: DF:A9:FF:F6:B1:1A (OUI DF-A9-FF)
        Count: 1
        #162: len 9 (0 Kb/s)
        Latency: 172 msec (77-172 msec ~166 msec)
> ACL Data RX: Handle 3351 flags 0x02 dlen 11             #164 [hci1] 10.853384
      ATT: Read By Type Request (0x08) len 6
        Handle range: 0x0024-0x002f
        Attribute type: Characteristic (0x2803)
< HCI Command: Host Number of Com.. (0x03|0x0035) plen 5  #165 [hci1] 10.860457
        Num handles: 1
        Handle: 3351 Address: DF:A9:FF:F6:B1:1A (OUI DF-A9-FF)
        Count: 1
< ACL Data TX: Handle 3351 flags 0x00 dlen 20             #166 [hci1] 10.860469
      ATT: Read By Type Response (0x09) len 15
        Attribute data length: 7
        Attribute data list: 2 entries
        Handle: 0x0025
        Value: 122600842b
            Properties: 0x12
              Read (0x02)
              Notify (0x10)
            Value Handle: 0x0026
            Value UUID: Set Identity Resolving Key (0x2b84)
        Handle: 0x0028
        Value: 122900852b
            Properties: 0x12
              Read (0x02)
              Notify (0x10)
            Value Handle: 0x0029
            Value UUID: Coordinated Set Size (0x2b85)
> HCI Event: Number of Completed Packets (0x13) plen 5    #167 [hci1] 11.028141
        Num handles: 1
        Handle: 3351 Address: DF:A9:FF:F6:B1:1A (OUI DF-A9-FF)
        Count: 1
        #166: len 20 (0 Kb/s)
        Latency: 167 msec (77-172 msec ~167 msec)
> ACL Data RX: Handle 3351 flags 0x02 dlen 11             #168 [hci1] 11.028398
      ATT: Read By Type Request (0x08) len 6
        Handle range: 0x0029-0x002f
        Attribute type: Characteristic (0x2803)
< HCI Command: Host Number of Com.. (0x03|0x0035) plen 5  #169 [hci1] 11.040804
        Num handles: 1
        Handle: 3351 Address: DF:A9:FF:F6:B1:1A (OUI DF-A9-FF)
        Count: 1
< ACL Data TX: Handle 3351 flags 0x00 dlen 20             #170 [hci1] 11.041003
      ATT: Read By Type Response (0x09) len 15
        Attribute data length: 7
        Attribute data list: 2 entries
        Handle: 0x002b
        Value: 1a2c00862b
            Properties: 0x1a
              Read (0x02)
              Write (0x08)
              Notify (0x10)
            Value Handle: 0x002c
            Value UUID: Set Member Lock (0x2b86)
        Handle: 0x002e
        Value: 022f00872b
            Properties: 0x02
              Read (0x02)
            Value Handle: 0x002f
            Value UUID: Set Member Rank (0x2b87)
> HCI Event: Number of Completed Packets (0x13) plen 5    #171 [hci1] 11.203205
        Num handles: 1
        Handle: 3351 Address: DF:A9:FF:F6:B1:1A (OUI DF-A9-FF)
        Count: 1
        #170: len 20 (0 Kb/s)
        Latency: 162 msec (77-172 msec ~164 msec)
> ACL Data RX: Handle 3351 flags 0x02 dlen 11             #172 [hci1] 11.203424
      ATT: Read By Type Request (0x08) len 6
        Handle range: 0x002f-0x002f
        Attribute type: Characteristic (0x2803)
< HCI Command: Host Number of Com.. (0x03|0x0035) plen 5  #173 [hci1] 11.220823
        Num handles: 1
        Handle: 3351 Address: DF:A9:FF:F6:B1:1A (OUI DF-A9-FF)
        Count: 1
< ACL Data TX: Handle 3351 flags 0x00 dlen 9              #174 [hci1] 11.221030
      ATT: Error Response (0x01) len 4
        Read By Type Request (0x08)
        Handle: 0x002f
        Error: Attribute Not Found (0x0a)
> HCI Event: Number of Completed Packets (0x13) plen 5    #175 [hci1] 11.378165
        Num handles: 1
        Handle: 3351 Address: DF:A9:FF:F6:B1:1A (OUI DF-A9-FF)
        Count: 1
        #174: len 9 (0 Kb/s)
        Latency: 157 msec (77-172 msec ~160 msec)
> ACL Data RX: Handle 3351 flags 0x02 dlen 9              #176 [hci1] 11.378368
      ATT: Find Information Request (0x04) len 4
        Handle range: 0x0027-0x0027
< HCI Command: Host Number of Com.. (0x03|0x0035) plen 5  #177 [hci1] 11.380743
        Num handles: 1
        Handle: 3351 Address: DF:A9:FF:F6:B1:1A (OUI DF-A9-FF)
        Count: 1
< ACL Data TX: Handle 3351 flags 0x00 dlen 10             #178 [hci1] 11.380853
      ATT: Find Information Response (0x05) len 5
        Format: UUID-16 (0x01)
        Handle: 0x0027
        UUID: Client Characteristic Configuration (0x2902)
> HCI Event: Number of Completed Packets (0x13) plen 5    #179 [hci1] 11.553212
        Num handles: 1
        Handle: 3351 Address: DF:A9:FF:F6:B1:1A (OUI DF-A9-FF)
        Count: 1
        #178: len 10 (0 Kb/s)
        Latency: 172 msec (77-172 msec ~166 msec)
> ACL Data RX: Handle 3351 flags 0x02 dlen 9              #180 [hci1] 11.553341
      ATT: Find Information Request (0x04) len 4
        Handle range: 0x002a-0x002a
< HCI Command: Host Number of Com.. (0x03|0x0035) plen 5  #181 [hci1] 11.560946
        Num handles: 1
        Handle: 3351 Address: DF:A9:FF:F6:B1:1A (OUI DF-A9-FF)
        Count: 1
< ACL Data TX: Handle 3351 flags 0x00 dlen 10             #182 [hci1] 11.561057
      ATT: Find Information Response (0x05) len 5
        Format: UUID-16 (0x01)
        Handle: 0x002a
        UUID: Client Characteristic Configuration (0x2902)
> HCI Event: Number of Completed Packets (0x13) plen 5    #183 [hci1] 11.728203
        Num handles: 1
        Handle: 3351 Address: DF:A9:FF:F6:B1:1A (OUI DF-A9-FF)
        Count: 1
        #182: len 10 (0 Kb/s)
        Latency: 167 msec (77-172 msec ~166 msec)
> ACL Data RX: Handle 3351 flags 0x02 dlen 9              #184 [hci1] 11.728325
      ATT: Find Information Request (0x04) len 4
        Handle range: 0x002d-0x002d
< HCI Command: Host Number of Com.. (0x03|0x0035) plen 5  #185 [hci1] 11.740872
        Num handles: 1
        Handle: 3351 Address: DF:A9:FF:F6:B1:1A (OUI DF-A9-FF)
        Count: 1
< ACL Data TX: Handle 3351 flags 0x00 dlen 10             #186 [hci1] 11.740996
      ATT: Find Information Response (0x05) len 5
        Format: UUID-16 (0x01)
        Handle: 0x002d
        UUID: Client Characteristic Configuration (0x2902)
> HCI Event: Number of Completed Packets (0x13) plen 5    #187 [hci1] 11.903173
        Num handles: 1
        Handle: 3351 Address: DF:A9:FF:F6:B1:1A (OUI DF-A9-FF)
        Count: 1
        #186: len 10 (0 Kb/s)
        Latency: 162 msec (77-172 msec ~164 msec)
> ACL Data RX: Handle 3351 flags 0x02 dlen 11             #188 [hci1] 11.903444
      ATT: Read By Type Request (0x08) len 6
        Handle range: 0x0001-0xffff
        Attribute type: Include (0x2802)
< HCI Command: Host Number of Com.. (0x03|0x0035) plen 5  #189 [hci1] 11.920916
        Num handles: 1
        Handle: 3351 Address: DF:A9:FF:F6:B1:1A (OUI DF-A9-FF)
        Count: 1
< ACL Data TX: Handle 3351 flags 0x00 dlen 9              #190 [hci1] 11.921087
      ATT: Error Response (0x01) len 4
        Read By Type Request (0x08)
        Handle: 0x0001
        Error: Attribute Not Found (0x0a)
> HCI Event: Number of Completed Packets (0x13) plen 5    #191 [hci1] 12.078379
        Num handles: 1
        Handle: 3351 Address: DF:A9:FF:F6:B1:1A (OUI DF-A9-FF)
        Count: 1
        #190: len 9 (0 Kb/s)
        Latency: 157 msec (77-172 msec ~160 msec)
> ACL Data RX: Handle 3351 flags 0x02 dlen 9              #192 [hci1] 12.078383
      ATT: Write Request (0x12) len 4
        Handle: 0x002d Type: Client Characteristic Configuration (0x2902)
        Value Handle: 0x002f Type: Set Member Rank (0x2b87)
          Data: 0000
< HCI Command: Host Number of Com.. (0x03|0x0035) plen 5  #193 [hci1] 12.081443
        Num handles: 1
        Handle: 3351 Address: DF:A9:FF:F6:B1:1A (OUI DF-A9-FF)
        Count: 1
< ACL Data TX: Handle 3351 flags 0x00 dlen 5              #194 [hci1] 12.081597
      ATT: Write Response (0x13) len 0
> HCI Event: Number of Completed Packets (0x13) plen 5    #195 [hci1] 12.253259
        Num handles: 1
        Handle: 3351 Address: DF:A9:FF:F6:B1:1A (OUI DF-A9-FF)
        Count: 1
        #194: len 5 (0 Kb/s)
        Latency: 171 msec (77-172 msec ~166 msec)
> ACL Data RX: Handle 3351 flags 0x02 dlen 9              #196 [hci1] 12.253349
      ATT: Write Request (0x12) len 4
        Handle: 0x002d Type: Client Characteristic Configuration (0x2902)
        Value Handle: 0x002f Type: Set Member Rank (0x2b87)
          Data: 0100
            Notification (0x01)
< HCI Command: Host Number of Com.. (0x03|0x0035) plen 5  #197 [hci1] 12.260416
        Num handles: 1
        Handle: 3351 Address: DF:A9:FF:F6:B1:1A (OUI DF-A9-FF)
        Count: 1
< ACL Data TX: Handle 3351 flags 0x00 dlen 5              #198 [hci1] 12.260445
      ATT: Write Response (0x13) len 0
> HCI Event: Number of Completed Packets (0x13) plen 5    #199 [hci1] 12.428404
        Num handles: 1
        Handle: 3351 Address: DF:A9:FF:F6:B1:1A (OUI DF-A9-FF)
        Count: 1
        #198: len 5 (0 Kb/s)
        Latency: 167 msec (77-172 msec ~167 msec)
> ACL Data RX: Handle 3351 flags 0x02 dlen 7              #200 [hci1] 12.428418
      ATT: Read Request (0x0a) len 2
        Handle: 0x002c Type: Set Member Lock (0x2b86)
< HCI Command: Host Number of Com.. (0x03|0x0035) plen 5  #201 [hci1] 12.441855
        Num handles: 1
        Handle: 3351 Address: DF:A9:FF:F6:B1:1A (OUI DF-A9-FF)
        Count: 1
< ACL Data TX: Handle 3351 flags 0x00 dlen 6              #202 [hci1] 12.441925
      ATT: Read Response (0x0b) len 1
        Handle: 0x002c Type: Set Member Lock (0x2b86)
        Value: 01
            Unlocked (0x01)
> HCI Event: Number of Completed Packets (0x13) plen 5    #203 [hci1] 12.603102
        Num handles: 1
        Handle: 3351 Address: DF:A9:FF:F6:B1:1A (OUI DF-A9-FF)
        Count: 1
        #202: len 6 (0 Kb/s)
        Latency: 161 msec (77-172 msec ~164 msec)
> ACL Data RX: Handle 3351 flags 0x02 dlen 8              #204 [hci1] 12.603324
      ATT: Write Request (0x12) len 3
        Handle: 0x002c Type: Set Member Lock (0x2b86)
          Data: 02
< HCI Command: Host Number of Com.. (0x03|0x0035) plen 5  #205 [hci1] 12.620116
        Num handles: 1
        Handle: 3351 Address: DF:A9:FF:F6:B1:1A (OUI DF-A9-FF)
        Count: 1
< ACL Data TX: Handle 3351 flags 0x00 dlen 5              #206 [hci1] 12.620129
      ATT: Write Response (0x13) len 0
> HCI Event: Number of Completed Packets (0x13) plen 5    #207 [hci1] 12.778035
        Num handles: 1
        Handle: 3351 Address: DF:A9:FF:F6:B1:1A (OUI DF-A9-FF)
        Count: 1
        #206: len 5 (0 Kb/s)
        Latency: 157 msec (77-172 msec ~161 msec)
> HCI Event: Disconnect Complete (0x05) plen 4            #208 [hci1] 12.865743
        Status: Success (0x00)
        Handle: 3351 Address: DF:A9:FF:F6:B1:1A (OUI DF-A9-FF)
        Reason: Remote User Terminated Connection (0x13)
< HCI Command: LE Set Extended A.. (0x08|0x0036) plen 25  #209 [hci1] 14.480766
        Handle: 0x00
        Properties: 0x0013
          Connectable
          Scannable
          Use legacy advertising PDUs: ADV_IND
        Min advertising interval: 100.000 msec (0x00a0)
        Max advertising interval: 150.000 msec (0x00f0)
        Channel map: 37, 38, 39 (0x07)
        Own address type: Random (0x01)
        Peer address type: Public (0x00)
        Peer address: 00:00:00:00:00:00 (OUI 00-00-00)
        Filter policy: Allow Scan Request from Any, Allow Connect Request from Any (0x00)
        TX power: Host has no preference (0x7f)
        Primary PHY: LE 1M (0x01)
        Secondary max skip: 0x00
        Secondary PHY: LE 1M (0x01)
        SID: 0x00
        Scan request notifications: Disabled (0x00)
> HCI Event: Command Complete (0x0e) plen 5               #210 [hci1] 14.481631
      LE Set Extended Advertising Parameters (0x08|0x0036) ncmd 1
        Status: Success (0x00)
        TX power (selected): 0 dbm (0x00)
< HCI Command: LE Set Advertising.. (0x08|0x0035) plen 7  #211 [hci1] 14.500205
        Advertising handle: 0x00
        Advertising random address: D5:B6:CC:31:DB:3B (Static)
> HCI Event: Command Complete (0x0e) plen 4               #212 [hci1] 14.500680
      LE Set Advertising Set Random Address (0x08|0x0035) ncmd 1
        Status: Success (0x00)
< HCI Command: LE Set Extended A.. (0x08|0x0037) plen 22  #213 [hci1] 14.520192
        Handle: 0x00
        Operation: Complete extended advertising data (0x03)
        Fragment preference: Minimize fragmentation (0x01)
        Data length: 0x12
        Flags: 0x06
          LE General Discoverable Mode
          BR/EDR Not Supported
        Name (complete): Tester_F6B11A
> HCI Event: Command Complete (0x0e) plen 4               #214 [hci1] 14.520909
      LE Set Extended Advertising Data (0x08|0x0037) ncmd 1
        Status: Success (0x00)
< HCI Command: LE Set Extended Sc.. (0x08|0x0038) plen 4  #215 [hci1] 14.540193
        Handle: 0x00
        Operation: Complete scan response data (0x03)
        Fragment preference: Minimize fragmentation (0x01)
        Data length: 0x00
> HCI Event: Command Complete (0x0e) plen 4               #216 [hci1] 14.540674
      LE Set Extended Scan Response Data (0x08|0x0038) ncmd 1
        Status: Success (0x00)
< HCI Command: LE Set Extended Ad.. (0x08|0x0039) plen 6  #217 [hci1] 14.560192
        Extended advertising: Enabled (0x01)
        Number of sets: 1 (0x01)
        Entry 0
          Handle: 0x00
          Duration: 0 ms (0x00)
          Max ext adv events: 0
> HCI Event: Command Complete (0x0e) plen 4               #218 [hci1] 14.560768
      LE Set Extended Advertising Enable (0x08|0x0039) ncmd 1
        Status: Success (0x00)
> HCI Event: LE Meta Event (0x3e) plen 31                 #219 [hci1] 14.673357
      LE Enhanced Connection Complete (0x0a)
        Status: Success (0x00)
        Handle: 3369
        Role: Peripheral (0x01)
        Peer address type: Public (0x00)
        Peer address: DF:A9:FF:F6:B1:1A (OUI DF-A9-FF)
        Local resolvable private address: 00:00:00:00:00:00 (Non-Resolvable)
        Peer resolvable private address: 00:00:00:00:00:00 (Non-Resolvable)
        Connection interval: 87.50 msec (0x0046)
        Connection latency: 0 (0x0000)
        Supervision timeout: 25120 msec (0x09d0)
        Central clock accuracy: 0x01
> HCI Event: LE Meta Event (0x3e) plen 6                  #220 [hci1] 14.673532
      LE Advertising Set Terminated (0x12)
        Status: Success (0x00)
        Handle: 0
        Connection handle: 3369
        Number of completed extended advertising events: 0
< HCI Command: LE Read Remote Use.. (0x08|0x0016) plen 2  #221 [hci1] 14.681156
        Handle: 3369 Address: DF:A9:FF:F6:B1:1A (OUI DF-A9-FF)
< ACL Data TX: Handle 3369 flags 0x00 dlen 6              #222 [hci1] 14.681178
      SMP: Security Request (0x0b) len 1
        Authentication requirement: Bonding, No MITM, SC, No Keypresses (0x09)
< ACL Data TX: Handle 3369 flags 0x00 dlen 7              #223 [hci1] 14.681274
      ATT: Exchange MTU Request (0x02) len 2
        Client RX MTU: 251
> HCI Event: Command Status (0x0f) plen 4                 #224 [hci1] 14.681641
      LE Read Remote Used Features (0x08|0x0016) ncmd 1
        Status: Success (0x00)
> HCI Event: Number of Completed Packets (0x13) plen 5    #225 [hci1] 14.762410
        Num handles: 1
        Handle: 3369 Address: DF:A9:FF:F6:B1:1A (OUI DF-A9-FF)
        Count: 1
        #222: len 6 (0 Kb/s)
        Latency: 81 msec (81-81 msec ~81 msec)
> HCI Event: Number of Completed Packets (0x13) plen 5    #226 [hci1] 14.849354
        Num handles: 1
        Handle: 3369 Address: DF:A9:FF:F6:B1:1A (OUI DF-A9-FF)
        Count: 1
        #223: len 7 (0 Kb/s)
        Latency: 168 msec (81-168 msec ~124 msec)
> HCI Event: LE Meta Event (0x3e) plen 12                 #227 [hci1] 14.937231
      LE Read Remote Used Features (0x04)
        Status: Success (0x00)
        Handle: 3369 Address: DF:A9:FF:F6:B1:1A (OUI DF-A9-FF)
        Features: 0x2d 0x49 0x00 0xf7 0x67 0xd9 0x00 0x80
          LE Encryption
          Extended Reject Indication
          Peripheral-initiated Features Exchange
          LE Data Packet Length Extension
          LE 2M PHY
          LE Coded PHY
          Channel Selection Algorithm #2
          Periodic Advertising Sync Transfer - Sender
          Periodic Advertising Sync Transfer - Recipient
          Sleep Clock Accuracy Updates
          Connected Isochronous Stream - Central
          Connected Isochronous Stream - Peripheral
          Isochronous Broadcaster
          Synchronized Receiver
          Connected Isochronous Stream (Host Support)
          LE Power Control Request
          LE Power Control Request
          Connection Subrating
          Connection Subrating (Host Support)
          Unknown features (0x8000d90000000000)
> ACL Data RX: Handle 3369 flags 0x02 dlen 7              #228 [hci1] 15.374405
      ATT: Exchange MTU Response (0x03) len 2
        Server RX MTU: 23
< HCI Command: Host Number of Com.. (0x03|0x0035) plen 5  #229 [hci1] 15.380675
        Num handles: 1
        Handle: 3369 Address: DF:A9:FF:F6:B1:1A (OUI DF-A9-FF)
        Count: 1
> HCI Event: LE Meta Event (0x3e) plen 13                 #230 [hci1] 15.462394
      LE Long Term Key Request (0x05)
        Handle: 3369 Address: DF:A9:FF:F6:B1:1A (OUI DF-A9-FF)
        Random number: 0x0000000000000000
        Encrypted diversifier: 0x0000
< HCI Command: LE Long Term Key... (0x08|0x001a) plen 18  #231 [hci1] 15.480636
        Handle: 3369 Address: DF:A9:FF:F6:B1:1A (OUI DF-A9-FF)
        Long term key: 63cd9aec4e95581ba0319af264bde4fe
> HCI Event: Command Complete (0x0e) plen 6               #232 [hci1] 15.481343
      LE Long Term Key Request Reply (0x08|0x001a) ncmd 1
        Status: Success (0x00)
        Handle: 3369 Address: DF:A9:FF:F6:B1:1A (OUI DF-A9-FF)
> HCI Event: Encryption Change (0x08) plen 4              #233 [hci1] 15.899557
        Status: Success (0x00)
        Handle: 3369 Address: DF:A9:FF:F6:B1:1A (OUI DF-A9-FF)
        Encryption: Enabled with AES-CCM (0x01)
> ACL Data RX: Handle 3369 flags 0x02 dlen 7              #234 [hci1] 15.986898
      ATT: Read Request (0x0a) len 2
        Handle: 0x002c
< HCI Command: Host Number of Com.. (0x03|0x0035) plen 5  #235 [hci1] 16.000645
        Num handles: 1
        Handle: 3369 Address: DF:A9:FF:F6:B1:1A (OUI DF-A9-FF)
        Count: 1
< ACL Data TX: Handle 3369 flags 0x00 dlen 6              #236 [hci1] 16.000720
      ATT: Read Response (0x0b) len 1
> HCI Event: Number of Completed Packets (0x13) plen 5    #237 [hci1] 16.161859
        Num handles: 1
        Handle: 3369 Address: DF:A9:FF:F6:B1:1A (OUI DF-A9-FF)
        Count: 1
        #236: len 6 (0 Kb/s)
        Latency: 161 msec (81-168 msec ~142 msec)
> ACL Data RX: Handle 3369 flags 0x02 dlen 8              #238 [hci1] 46.173986
      ATT: Write Request (0x12) len 3
        Handle: 0x002c
          Data: 02
< HCI Command: Host Number of Com.. (0x03|0x0035) plen 5  #239 [hci1] 46.181011
        Num handles: 1
        Handle: 3369 Address: DF:A9:FF:F6:B1:1A (OUI DF-A9-FF)
        Count: 1
< ACL Data TX: Handle 3369 flags 0x00 dlen 9              #240 [hci1] 46.181261
      ATT: Error Response (0x01) len 4
        Write Request (0x12)
        Handle: 0x002c
        Error: Reserved (0x84)
> HCI Event: Number of Completed Packets (0x13) plen 5    #241 [hci1] 46.348891
        Num handles: 1
        Handle: 3369 Address: DF:A9:FF:F6:B1:1A (OUI DF-A9-FF)
        Count: 1
        #240: len 9 (0 Kb/s)
        Latency: 167 msec (81-168 msec ~155 msec)
> HCI Event: Disconnect Complete (0x05) plen 4            #242 [hci1] 46.436684
        Status: Success (0x00)
        Handle: 3369 Address: DF:A9:FF:F6:B1:1A (OUI DF-A9-FF)
        Reason: Remote User Terminated Connection (0x13)
< HCI Command: LE Set Extended A.. (0x08|0x0036) plen 25  #243 [hci1] 77.641025
        Handle: 0x00
        Properties: 0x0013
          Connectable
          Scannable
          Use legacy advertising PDUs: ADV_IND
        Min advertising interval: 100.000 msec (0x00a0)
        Max advertising interval: 150.000 msec (0x00f0)
        Channel map: 37, 38, 39 (0x07)
        Own address type: Random (0x01)
        Peer address type: Public (0x00)
        Peer address: 00:00:00:00:00:00 (OUI 00-00-00)
        Filter policy: Allow Scan Request from Any, Allow Connect Request from Any (0x00)
        TX power: Host has no preference (0x7f)
        Primary PHY: LE 1M (0x01)
        Secondary max skip: 0x00
        Secondary PHY: LE 1M (0x01)
        SID: 0x00
        Scan request notifications: Disabled (0x00)
> HCI Event: Command Complete (0x0e) plen 5               #244 [hci1] 77.641853
      LE Set Extended Advertising Parameters (0x08|0x0036) ncmd 1
        Status: Success (0x00)
        TX power (selected): 0 dbm (0x00)
< HCI Command: LE Set Advertising.. (0x08|0x0035) plen 7  #245 [hci1] 77.660955
        Advertising handle: 0x00
        Advertising random address: D5:B6:CC:31:DB:3B (Static)
> HCI Event: Command Complete (0x0e) plen 4               #246 [hci1] 77.661386
      LE Set Advertising Set Random Address (0x08|0x0035) ncmd 1
        Status: Success (0x00)
< HCI Command: LE Set Extended A.. (0x08|0x0037) plen 22  #247 [hci1] 77.680986
        Handle: 0x00
        Operation: Complete extended advertising data (0x03)
        Fragment preference: Minimize fragmentation (0x01)
        Data length: 0x12
        Flags: 0x06
          LE General Discoverable Mode
          BR/EDR Not Supported
        Name (complete): Tester_F6B11A
> HCI Event: Command Complete (0x0e) plen 4               #248 [hci1] 77.681639
      LE Set Extended Advertising Data (0x08|0x0037) ncmd 1
        Status: Success (0x00)
< HCI Command: LE Set Extended Sc.. (0x08|0x0038) plen 4  #249 [hci1] 77.700970
        Handle: 0x00
        Operation: Complete scan response data (0x03)
        Fragment preference: Minimize fragmentation (0x01)
        Data length: 0x00
> HCI Event: Command Complete (0x0e) plen 4               #250 [hci1] 77.701448
      LE Set Extended Scan Response Data (0x08|0x0038) ncmd 1
        Status: Success (0x00)
< HCI Command: LE Set Extended Ad.. (0x08|0x0039) plen 6  #251 [hci1] 77.720967
        Extended advertising: Enabled (0x01)
        Number of sets: 1 (0x01)
        Entry 0
          Handle: 0x00
          Duration: 0 ms (0x00)
          Max ext adv events: 0
> HCI Event: Command Complete (0x0e) plen 4               #252 [hci1] 77.721569
      LE Set Extended Advertising Enable (0x08|0x0039) ncmd 1
        Status: Success (0x00)
> HCI Event: LE Meta Event (0x3e) plen 31                 #253 [hci1] 77.827344
      LE Enhanced Connection Complete (0x0a)
        Status: Success (0x00)
        Handle: 3387
        Role: Peripheral (0x01)
        Peer address type: Public (0x00)
        Peer address: DF:A9:FF:F6:B1:1A (OUI DF-A9-FF)
        Local resolvable private address: 00:00:00:00:00:00 (Non-Resolvable)
        Peer resolvable private address: 00:00:00:00:00:00 (Non-Resolvable)
        Connection interval: 87.50 msec (0x0046)
        Connection latency: 0 (0x0000)
        Supervision timeout: 25120 msec (0x09d0)
        Central clock accuracy: 0x01
> HCI Event: LE Meta Event (0x3e) plen 6                  #254 [hci1] 77.827564
      LE Advertising Set Terminated (0x12)
        Status: Success (0x00)
        Handle: 0
        Connection handle: 3387
        Number of completed extended advertising events: 0
< HCI Command: LE Read Remote Use.. (0x08|0x0016) plen 2  #255 [hci1] 77.841187
        Handle: 3387 Address: DF:A9:FF:F6:B1:1A (OUI DF-A9-FF)
< ACL Data TX: Handle 3387 flags 0x00 dlen 6              #256 [hci1] 77.841194
      SMP: Security Request (0x0b) len 1
        Authentication requirement: Bonding, No MITM, SC, No Keypresses (0x09)
< ACL Data TX: Handle 3387 flags 0x00 dlen 7              #257 [hci1] 77.841206
      ATT: Exchange MTU Request (0x02) len 2
        Client RX MTU: 251
> HCI Event: Command Status (0x0f) plen 4                 #258 [hci1] 77.841720
      LE Read Remote Used Features (0x08|0x0016) ncmd 1
        Status: Success (0x00)
> HCI Event: Number of Completed Packets (0x13) plen 5    #259 [hci1] 77.916296
        Num handles: 1
        Handle: 3387 Address: DF:A9:FF:F6:B1:1A (OUI DF-A9-FF)
        Count: 1
        #256: len 6 (0 Kb/s)
        Latency: 75 msec (75-75 msec ~75 msec)
> HCI Event: Number of Completed Packets (0x13) plen 5    #260 [hci1] 78.003385
        Num handles: 1
        Handle: 3387 Address: DF:A9:FF:F6:B1:1A (OUI DF-A9-FF)
        Count: 1
        #257: len 7 (0 Kb/s)
        Latency: 162 msec (75-162 msec ~118 msec)
> HCI Event: LE Meta Event (0x3e) plen 12                 #261 [hci1] 78.091221
      LE Read Remote Used Features (0x04)
        Status: Success (0x00)
        Handle: 3387 Address: DF:A9:FF:F6:B1:1A (OUI DF-A9-FF)
        Features: 0x2d 0x49 0x00 0xf7 0x67 0xd9 0x00 0x80
          LE Encryption
          Extended Reject Indication
          Peripheral-initiated Features Exchange
          LE Data Packet Length Extension
          LE 2M PHY
          LE Coded PHY
          Channel Selection Algorithm #2
          Periodic Advertising Sync Transfer - Sender
          Periodic Advertising Sync Transfer - Recipient
          Sleep Clock Accuracy Updates
          Connected Isochronous Stream - Central
          Connected Isochronous Stream - Peripheral
          Isochronous Broadcaster
          Synchronized Receiver
          Connected Isochronous Stream (Host Support)
          LE Power Control Request
          LE Power Control Request
          Connection Subrating
          Connection Subrating (Host Support)
          Unknown features (0x8000d90000000000)
> ACL Data RX: Handle 3387 flags 0x02 dlen 7              #262 [hci1] 78.528386
      ATT: Exchange MTU Response (0x03) len 2
        Server RX MTU: 23
< HCI Command: Host Number of Com.. (0x03|0x0035) plen 5  #263 [hci1] 78.541490
        Num handles: 1
        Handle: 3387 Address: DF:A9:FF:F6:B1:1A (OUI DF-A9-FF)
        Count: 1
> HCI Event: LE Meta Event (0x3e) plen 13                 #264 [hci1] 78.616394
      LE Long Term Key Request (0x05)
        Handle: 3387 Address: DF:A9:FF:F6:B1:1A (OUI DF-A9-FF)
        Random number: 0x0000000000000000
        Encrypted diversifier: 0x0000
< HCI Command: LE Long Term Key... (0x08|0x001a) plen 18  #265 [hci1] 78.621163
        Handle: 3387 Address: DF:A9:FF:F6:B1:1A (OUI DF-A9-FF)
        Long term key: 63cd9aec4e95581ba0319af264bde4fe
> HCI Event: Command Complete (0x0e) plen 6               #266 [hci1] 78.621883
      LE Long Term Key Request Reply (0x08|0x001a) ncmd 1
        Status: Success (0x00)
        Handle: 3387 Address: DF:A9:FF:F6:B1:1A (OUI DF-A9-FF)
> HCI Event: Encryption Change (0x08) plen 4              #267 [hci1] 79.053657
        Status: Success (0x00)
        Handle: 3387 Address: DF:A9:FF:F6:B1:1A (OUI DF-A9-FF)
        Encryption: Enabled with AES-CCM (0x01)
< ACL Data TX: Handle 3387 flags 0x00 dlen 8              #268 [hci1] 79.061952
      ATT: Handle Value Notification (0x1b) len 3
        Handle: 0x002c
          Data: 01
> HCI Event: Number of Completed Packets (0x13) plen 5    #269 [hci1] 79.228400
        Num handles: 1
        Handle: 3387 Address: DF:A9:FF:F6:B1:1A (OUI DF-A9-FF)
        Count: 1
        #268: len 8 (0 Kb/s)
        Latency: 166 msec (75-166 msec ~142 msec)
> ACL Data RX: Handle 3387 flags 0x02 dlen 7              #270 [hci1] 79.228589
      ATT: Read Request (0x0a) len 2
        Handle: 0x002c
< HCI Command: Host Number of Com.. (0x03|0x0035) plen 5  #271 [hci1] 79.241599
        Num handles: 1
        Handle: 3387 Address: DF:A9:FF:F6:B1:1A (OUI DF-A9-FF)
        Count: 1
< ACL Data TX: Handle 3387 flags 0x00 dlen 6              #272 [hci1] 79.241752
      ATT: Read Response (0x0b) len 1
> HCI Event: Number of Completed Packets (0x13) plen 5    #273 [hci1] 79.403405
        Num handles: 1
        Handle: 3387 Address: DF:A9:FF:F6:B1:1A (OUI DF-A9-FF)
        Count: 1
        #272: len 6 (0 Kb/s)
        Latency: 161 msec (75-166 msec ~152 msec)
> HCI Event: Disconnect Complete (0x05) plen 4            #274 [hci1] 80.803562
        Status: Success (0x00)
        Handle: 3387 Address: DF:A9:FF:F6:B1:1A (OUI DF-A9-FF)
        Reason: Remote User Terminated Connection (0x13)
< HCI Command: Reset (0x03|0x0003) plen 0                 #275 [hci1] 85.001116
> HCI Event: Command Complete (0x0e) plen 4               #276 [hci1] 85.001619
      Reset (0x03|0x0003) ncmd 1
        Status: Success (0x00)
@ USER Close: main                                    {0x0001} [hci1] 85.020991
= Close Index: 00:00:00:00:00:00                               [hci1] 85.020999
