Bluetooth monitor ver 5.72
= Note: Linux version 6.14.0-36-generic (x86_64)                       0.614006
= Note: Bluetooth subsystem version 2.22                               0.614008
= New Index: 00:00:00:00:00:00 (Primary,UART,hci1)              [hci1] 0.614009
= New Index: 48:5F:99:8E:E0:64 (Primary,USB,hci0)               [hci0] 0.614010
= Open Index: 00:00:00:00:00:00                                 [hci1] 0.727843
= Index Info: 00:00:00:00:00:00 (Nordic Semiconductor ASA)      [hci1] 0.727858
@ USER Open: main (privileged) version 2.22            {0x0001} [hci1] 0.727868
< HCI Command: Reset (0x03|0x0003) plen 0                    #1 [hci1] 0.729199
> HCI Event: Command Complete (0x0e) plen 4                  #2 [hci1] 0.729786
      Reset (0x03|0x0003) ncmd 1
        Status: Success (0x00)
< HCI Command: Read Local Supported... (0x04|0x0003) plen 0  #3 [hci1] 0.747617
> HCI Event: Command Complete (0x0e) plen 12                 #4 [hci1] 0.748149
      Read Local Supported Features (0x04|0x0003) ncmd 1
        Status: Success (0x00)
        Features: 0x00 0x00 0x00 0x00 0x60 0x00 0x00 0x00
          BR/EDR Not Supported
          LE Supported (Controller)
< HCI Command: Read Local Version In.. (0x04|0x0001) plen 0  #5 [hci1] 0.767265
> HCI Event: Command Complete (0x0e) plen 12                 #6 [hci1] 0.767805
      Read Local Version Information (0x04|0x0001) ncmd 1
        Status: Success (0x00)
        HCI version: Reserved (0x0f) - Revision 12393 (0x3069)
        LMP version: Reserved (0x0f) - Subversion 12393 (0x3069)
        Manufacturer: Nordic Semiconductor ASA (89)
< HCI Command: Read Local Supported... (0x04|0x0002) plen 0  #7 [hci1] 0.787169
> HCI Event: Command Complete (0x0e) plen 68                 #8 [hci1] 0.788234
      Read Local Supported Commands (0x04|0x0002) ncmd 1
        Status: Success (0x00)
        Commands: 119 entries
          Disconnect (Octet 0 - Bit 5)
          Read Remote Version Information (Octet 2 - Bit 7)
          Set Event Mask (Octet 5 - Bit 6)
          Reset (Octet 5 - Bit 7)
          Read Connection Accept Timeout (Octet 7 - Bit 2)
          Write Connection Accept Timeout (Octet 7 - Bit 3)
          Read Transmit Power Level (Octet 10 - Bit 2)
          Set Controller To Host Flow Control (Octet 10 - Bit 5)
          Host Buffer Size (Octet 10 - Bit 6)
          Host Number of Completed Packets (Octet 10 - Bit 7)
          Read Local Version Information (Octet 14 - Bit 3)
          Read Local Supported Features (Octet 14 - Bit 5)
          Read BD ADDR (Octet 15 - Bit 1)
          Read RSSI (Octet 15 - Bit 5)
          Set Event Mask Page 2 (Octet 22 - Bit 2)
          LE Set Event Mask (Octet 25 - Bit 0)
          LE Read Buffer Size (Octet 25 - Bit 1)
          LE Read Local Supported Features (Octet 25 - Bit 2)
          LE Set Random Address (Octet 25 - Bit 4)
          LE Set Advertising Parameters (Octet 25 - Bit 5)
          LE Read Advertising Channel TX Power (Octet 25 - Bit 6)
          LE Set Advertising Data (Octet 25 - Bit 7)
          LE Set Scan Response Data (Octet 26 - Bit 0)
          LE Set Advertise Enable (Octet 26 - Bit 1)
          LE Set Scan Parameters (Octet 26 - Bit 2)
          LE Set Scan Enable (Octet 26 - Bit 3)
          LE Create Connection (Octet 26 - Bit 4)
          LE Create Connection Cancel (Octet 26 - Bit 5)
          LE Read Accept List Size (Octet 26 - Bit 6)
          LE Clear Accept List (Octet 26 - Bit 7)
          LE Add Device To Accept List (Octet 27 - Bit 0)
          LE Remove Device From Accept List (Octet 27 - Bit 1)
          LE Connection Update (Octet 27 - Bit 2)
          LE Set Host Channel Classification (Octet 27 - Bit 3)
          LE Read Channel Map (Octet 27 - Bit 4)
          LE Read Remote Used Features (Octet 27 - Bit 5)
          LE Encrypt (Octet 27 - Bit 6)
          LE Rand (Octet 27 - Bit 7)
          LE Start Encryption (Octet 28 - Bit 0)
          LE Long Term Key Request Reply (Octet 28 - Bit 1)
          LE Long Term Key Request Neg Reply (Octet 28 - Bit 2)
          LE Read Supported States (Octet 28 - Bit 3)
          LE Receiver Test (Octet 28 - Bit 4)
          LE Transmitter Test (Octet 28 - Bit 5)
          LE Test End (Octet 28 - Bit 6)
          Read Authenticated Payload Timeout (Octet 32 - Bit 4)
          Write Authenticated Payload Timeout (Octet 32 - Bit 5)
          LE Set Data Length (Octet 33 - Bit 6)
          LE Read Suggested Default Data Length (Octet 33 - Bit 7)
          LE Write Suggested Default Data Length (Octet 34 - Bit 0)
          LE Add Device To Resolving List (Octet 34 - Bit 3)
          LE Remove Device From Resolving List (Octet 34 - Bit 4)
          LE Clear Resolving List (Octet 34 - Bit 5)
          LE Read Resolving List Size (Octet 34 - Bit 6)
          LE Set Address Resolution Enable (Octet 35 - Bit 1)
          LE Set Resolvable Private Address Timeout (Octet 35 - Bit 2)
          LE Read Maximum Data Length (Octet 35 - Bit 3)
          LE Read PHY (Octet 35 - Bit 4)
          LE Set Default PHY (Octet 35 - Bit 5)
          LE Set PHY (Octet 35 - Bit 6)
          LE Enhanced Receiver Test (Octet 35 - Bit 7)
          LE Enhanced Transmitter Test (Octet 36 - Bit 0)
          LE Set Advertising Set Random Address (Octet 36 - Bit 1)
          LE Set Extended Advertising Parameters (Octet 36 - Bit 2)
          LE Set Extended Advertising Data (Octet 36 - Bit 3)
          LE Set Extended Scan Response Data (Octet 36 - Bit 4)
          LE Set Extended Advertising Enable (Octet 36 - Bit 5)
          LE Read Maximum Advertising Data Length (Octet 36 - Bit 6)
          LE Read Number of Supported Advertising Sets (Octet 36 - Bit 7)
          LE Remove Advertising Set (Octet 37 - Bit 0)
          LE Clear Advertising Sets (Octet 37 - Bit 1)
          LE Set Periodic Advertising Parameters (Octet 37 - Bit 2)
          LE Set Periodic Advertising Data (Octet 37 - Bit 3)
          LE Set Periodic Advertising Enable (Octet 37 - Bit 4)
          LE Set Extended Scan Parameters (Octet 37 - Bit 5)
          LE Set Extended Scan Enable (Octet 37 - Bit 6)
          LE Extended Create Connection (Octet 37 - Bit 7)
          LE Periodic Advertising Create Sync (Octet 38 - Bit 0)
          LE Periodic Advertising Create Sync Cancel (Octet 38 - Bit 1)
          LE Periodic Advertising Terminate Sync (Octet 38 - Bit 2)
          LE Add Device To Periodic Advertiser List (Octet 38 - Bit 3)
          LE Remove Device From Periodic Advertiser List (Octet 38 - Bit 4)
          LE Clear Periodic Advertiser List (Octet 38 - Bit 5)
          LE Read Periodic Advertiser List Size (Octet 38 - Bit 6)
          LE Read Transmit Power (Octet 38 - Bit 7)
          LE Read RF Path Compensation (Octet 39 - Bit 0)
          LE Write RF Path Compensation (Octet 39 - Bit 1)
          LE Set Privacy Mode (Octet 39 - Bit 2)
          LE Periodic Advertising Receive Enable (Octet 40 - Bit 5)
          LE Periodic Advertising Sync Transfer (Octet 40 - Bit 6)
          LE Periodic Advertising Set Info Transfer (Octet 40 - Bit 7)
          LE Periodic Advertising Sync Transfer Parameters (Octet 41 - Bit 0)
          LE Set Default Periodic Advertisng Sync Transfer Parameters (Octet 41 - Bit 1)
          LE Read Buffer v2 (Octet 41 - Bit 5)
          LE Read ISO TX Sync (Octet 41 - Bit 6)
          LE Set Connected Isochronous Group Parameters (Octet 41 - Bit 7)
          LE Set Connected Isochronous Group Parameters Test (Octet 42 - Bit 0)
          LE Create Connected Isochronous Stream (Octet 42 - Bit 1)
          LE Remove Connected Isochronous Group (Octet 42 - Bit 2)
          LE Accept Connected Isochronous Stream Request (Octet 42 - Bit 3)
          LE Reject Connected Isochronous Stream Request (Octet 42 - Bit 4)
          LE Create Broadcast Isochronous Group (Octet 42 - Bit 5)
          LE Create Broadcast Isochronous Group Test (Octet 42 - Bit 6)
          LE Terminate Broadcast Isochronous Group (Octet 42 - Bit 7)
          LE Broadcast Isochronous Group Create Sync (Octet 43 - Bit 0)
          LE Broadcast Isochronous Group Terminate Sync (Octet 43 - Bit 1)
          LE Request Peer SCA (Octet 43 - Bit 2)
          LE Setup Isochronous Data Path (Octet 43 - Bit 3)
          LE Remove Isochronous Data Path (Octet 43 - Bit 4)
          LE Isochronous Transmit Test (Octet 43 - Bit 5)
          LE Isochronous Receive Test (Octet 43 - Bit 6)
          LE Isochronous Read Test Counters (Octet 43 - Bit 7)
          LE Isochronous Read Test Counters (Octet 44 - Bit 0)
          LE Set Host Feature (Octet 44 - Bit 1)
          Octet 44 - Bit 2 
          Octet 45 - Bit 6 
          Octet 46 - Bit 0 
          Octet 46 - Bit 1 
          Octet 46 - Bit 2 
< HCI Command: Host Buffer Size (0x03|0x0033) plen 7         #9 [hci1] 0.807205
        ACL MTU: 255  ACL max packet: 16
        SCO MTU: 0    SCO max packet: 0
> HCI Event: Command Complete (0x0e) plen 4                 #10 [hci1] 0.807748
      Host Buffer Size (0x03|0x0033) ncmd 1
        Status: Success (0x00)
< HCI Command: Set Controller To Ho.. (0x03|0x0031) plen 1  #11 [hci1] 0.827192
        Flow control: ACL Data Packets (0x01)
> HCI Event: Command Complete (0x0e) plen 4                 #12 [hci1] 0.827639
      Set Controller To Host Flow Control (0x03|0x0031) ncmd 1
        Status: Success (0x00)
< HCI Command: LE Read Local Suppor.. (0x08|0x0003) plen 0  #13 [hci1] 0.847198
> HCI Event: Command Complete (0x0e) plen 12                #14 [hci1] 0.847746
      LE Read Local Supported Features (0x08|0x0003) ncmd 1
        Status: Success (0x00)
        Features: 0xfd 0x79 0x00 0xf7 0x30 0x01 0x00 0x00
          LE Encryption
          Extended Reject Indication
          Peripheral-initiated Features Exchange
          LE Ping
          LE Data Packet Length Extension
          LL Privacy
          Extended Scanner Filter Policies
          LE 2M PHY
          LE Coded PHY
          LE Extended Advertising
          LE Periodic Advertising
          Channel Selection Algorithm #2
          Periodic Advertising Sync Transfer - Sender
          Periodic Advertising Sync Transfer - Recipient
          Sleep Clock Accuracy Updates
          Connected Isochronous Stream - Central
          Connected Isochronous Stream - Peripheral
          Isochronous Broadcaster
          Synchronized Receiver
          Periodic Advertising ADI support
          Connection Subrating
          Unknown features (0x0000010000000000)
< HCI Command: LE Set Host Feature (0x08|0x0074) plen 2     #15 [hci1] 0.867196
        Bit Number: 32
          Connected Isochronous Stream (Host Support)
        Bit Value: 1
> HCI Event: Command Complete (0x0e) plen 4                 #16 [hci1] 0.867718
      LE Set Host Feature (0x08|0x0074) ncmd 1
        Status: Success (0x00)
< HCI Command: LE Read Buffer v2 (0x08|0x0060) plen 0       #17 [hci1] 0.887193
> HCI Event: Command Complete (0x0e) plen 10                #18 [hci1] 0.887747
      LE Read Buffer v2 (0x08|0x0060) ncmd 1
        Status: Success (0x00)
        ACL MTU: 27
        ACL max packet: 3
        ISO MTU: 318
        ISO max packet: 3
< HCI Command: LE Read Maximum Adve.. (0x08|0x003a) plen 0  #19 [hci1] 0.907228
> HCI Event: Command Complete (0x0e) plen 6                 #20 [hci1] 0.907751
      LE Read Maximum Advertising Data Length (0x08|0x003a) ncmd 1
        Status: Success (0x00)
        Max length: 1650
< HCI Command: LE Read Supported St.. (0x08|0x001c) plen 0  #21 [hci1] 0.927195
> HCI Event: Command Complete (0x0e) plen 12                #22 [hci1] 0.927708
      LE Read Supported States (0x08|0x001c) ncmd 1
        Status: Success (0x00)
        States: 0x000003ff3e0306ff
          Non-connectable Advertising State
          Scannable Advertising State
          Connectable Advertising State
          High Duty Cycle Directed Advertising State
          Passive Scanning State
          Active Scanning State
          Initiating State
            and Connection State (Central Role)
          Connection State (Peripheral Role)
          Scannable Advertising State
            and Passive Scanning State
          Connectable Advertising State
            and Passive Scanning State
          Non-connectable Advertising State
            and Initiating State
          Scannable Advertising State
            and Initiating State
          Active Scanning State
            and Connection State (Central Role)
          Passive Scanning State
            and Connection State (Peripheral Role)
          Active Scanning State
            and Connection State (Peripheral Role)
          Initiating State
            and Connection State (Central Role)
            and Central Role & Central Role
          Low Duty Cycle Directed Advertising State
          Connectable Advertising State
            and Initiating State
            and Central Role & Peripheral Role
          High Duty Cycle Directed Advertising State
            and Initiating State
            and Central Role & Peripheral Role
          Low Duty Cycle Directed Advertising State
            and Initiating State
            and Central Role & Peripheral Role
          Connectable Advertising State
            and Connection State (Central Role)
            and Central Role & Peripheral Role
          High Duty Cycle Directed Advertising State
            and Connection State (Central Role)
            and Central Role & Peripheral Role
          Low Duty Cycle Directed Advertising State
            and Connection State (Central Role)
            and Central Role & Peripheral Role
          Connectable Advertising State
            and Connection State (Peripheral Role)
            and Central Role & Peripheral Role
          High Duty Cycle Directed Advertising State
            and Connection State (Peripheral Role)
            and Peripheral Role & Peripheral Role
          Low Duty Cycle Directed Advertising State
            and Connection State (Peripheral Role)
            and Peripheral Role & Peripheral Role
          Initiating State
            and Connection State (Peripheral Role)
            and Central Role & Peripheral Role
< HCI Command: LE Read Maximum Data.. (0x08|0x002f) plen 0  #23 [hci1] 0.947194
> HCI Event: Command Complete (0x0e) plen 12                #24 [hci1] 0.947691
      LE Read Maximum Data Length (0x08|0x002f) ncmd 1
        Status: Success (0x00)
        Max TX octets: 251
        Max TX time: 2704
        Max RX octets: 251
        Max RX time: 2704
< HCI Command: LE Write Suggested D.. (0x08|0x0024) plen 4  #25 [hci1] 0.967200
        TX octets: 251
        TX time: 2704
> HCI Event: Command Complete (0x0e) plen 4                 #26 [hci1] 0.967636
      LE Write Suggested Default Data Length (0x08|0x0024) ncmd 1
        Status: Success (0x00)
< HCI Command: LE Read Resolving Li.. (0x08|0x002a) plen 0  #27 [hci1] 0.987215
> HCI Event: Command Complete (0x0e) plen 5                 #28 [hci1] 0.987592
      LE Read Resolving List Size (0x08|0x002a) ncmd 1
        Status: Success (0x00)
        Size: 8
< HCI Command: LE Set Event Mask (0x08|0x0001) plen 8       #29 [hci1] 1.007210
        Mask: 0x000002023f87fa5e
          LE Advertising Report
          LE Connection Update Complete
          LE Read Remote Used Features Complete
          LE Long Term Key Request
          LE Data Length Change
          LE Enhanced Connection Complete
          LE PHY Update Complete
          LE Extended Advertising Report
          LE Periodic Advertising Sync Established
          LE Periodic Advertising Report
          LE Periodic Advertising Sync Lost
          LE Extended Scan Timeout
          LE Extended Advertising Set Terminated
          LE Scan Request Received
          LE Periodic Advertising Sync Transfer Rvc
          LE CIS Established
          LE CIS Request
          LE Create BIG Complete
          LE Terminate BIG Complete
          LE BIG Sync Estabilished Complete
          LE BIG Sync Lost
          LE BIG Info Advertising Report
          Unknown mask (0x0000020000000000)
> HCI Event: Command Complete (0x0e) plen 4                 #30 [hci1] 1.007756
      LE Set Event Mask (0x08|0x0001) ncmd 1
        Status: Success (0x00)
< HCI Command: Set Event Mask (0x03|0x0001) plen 8          #31 [hci1] 1.027218
        Mask: 0x2000800002008890
          Disconnection Complete
          Encryption Change
          Read Remote Version Information Complete
          Hardware Error
          Data Buffer Overflow
          Encryption Key Refresh Complete
          LE Meta
> HCI Event: Command Complete (0x0e) plen 4                 #32 [hci1] 1.027742
      Set Event Mask (0x03|0x0001) ncmd 1
        Status: Success (0x00)
< HCI Command: Read BD ADDR (0x04|0x0009) plen 0            #33 [hci1] 1.047192
> HCI Event: Command Complete (0x0e) plen 10                #34 [hci1] 1.047716
      Read BD ADDR (0x04|0x0009) ncmd 1
        Status: Success (0x00)
        Address: 00:00:00:00:00:00 (OUI 00-00-00)
< HCI Command: LE Set Random Address (0x08|0x0005) plen 6   #35 [hci1] 1.067199
        Address: D5:B6:CC:31:DB:3B (Static)
> HCI Event: Command Complete (0x0e) plen 4                 #36 [hci1] 1.067686
      LE Set Random Address (0x08|0x0005) ncmd 1
        Status: Success (0x00)
< HCI Command: LE Set Random Address (0x08|0x0005) plen 6   #37 [hci1] 4.737242
        Address: 26:66:F9:08:61:8E (Non-Resolvable)
> HCI Event: Command Complete (0x0e) plen 4                 #38 [hci1] 4.737780
      LE Set Random Address (0x08|0x0005) ncmd 1
        Status: Success (0x00)
< HCI Command: LE Set Extended Scan.. (0x08|0x0041) plen 8  #39 [hci1] 4.747282
        Own address type: Random (0x01)
        Filter policy: Accept all advertisement (0x00)
        PHYs: 0x01
        Entry 0: LE 1M
          Type: Active (0x01)
          Interval: 60.000 msec (0x0060)
          Window: 30.000 msec (0x0030)
> HCI Event: Command Complete (0x0e) plen 4                 #40 [hci1] 4.747823
      LE Set Extended Scan Parameters (0x08|0x0041) ncmd 1
        Status: Success (0x00)
< HCI Command: LE Set Extended Scan.. (0x08|0x0042) plen 6  #41 [hci1] 4.767261
        Extended scan: Enabled (0x01)
        Filter duplicates: Enabled (0x01)
        Duration: 0 msec (0x0000)
        Period: 0.00 sec (0x0000)
> HCI Event: Command Complete (0x0e) plen 4                 #42 [hci1] 4.767801
      LE Set Extended Scan Enable (0x08|0x0042) ncmd 1
        Status: Success (0x00)
> HCI Event: LE Meta Event (0x3e) plen 47                   #43 [hci1] 4.904173
      LE Extended Advertising Report (0x0d)
        Num reports: 1
        Entry 0
          Event type: 0x0000
            Props: 0x0000
            Data status: [0;32mComplete[0m
          Address type: Public (0x00)
          Address: DF:A9:FF:F6:B1:1A (OUI DF-A9-FF)
          Primary PHY: LE 1M
          Secondary PHY: LE 1M
          SID: 0x00
          TX power: 127 dBm
          RSSI: -33 dBm (0xdf)
          Periodic advertising interval: 750.00 msec (0x0258)
          Direct address type: Reserved (0xff)
          Direct address: 00-00-00-00-00-00
          Data length: 0x15
        06 16 52 18 58 5b 93 0d 09 50 54 53 2d 42 41 50  ..R.X[...PTS-BAP
        2d 42 31 31 41                                   -B11A           
        Service Data: Broadcast Audio Announcement (0x1852)
        Broadcast ID: 9657176 (0x935b58)
        Name (complete): PTS-BAP-B11A
< HCI Command: LE Set Extended Scan.. (0x08|0x0042) plen 6  #44 [hci1] 4.937384
        Extended scan: Disabled (0x00)
        Filter duplicates: Disabled (0x00)
        Duration: 0 msec (0x0000)
        Period: 0.00 sec (0x0000)
> HCI Event: Command Complete (0x0e) plen 4                 #45 [hci1] 4.937868
      LE Set Extended Scan Enable (0x08|0x0042) ncmd 1
        Status: Success (0x00)
< HCI Command: LE Periodic Adverti.. (0x08|0x0044) plen 14  #46 [hci1] 4.977333
        Options: 0x0000
        Use advertising SID, Advertiser Address Type and address
        Reporting initially enabled
        SID: 0x00
        Adv address type: Public (0x00)
        Adv address: DF:A9:FF:F6:B1:1A (OUI DF-A9-FF)
        Skip: 0x0005
        Sync timeout: 1000 msec (0x0064)
        Sync CTE type: 0x0000
> HCI Event: Command Status (0x0f) plen 4                   #47 [hci1] 4.977970
      LE Periodic Advertising Create Sync (0x08|0x0044) ncmd 1
        Status: Success (0x00)
< HCI Command: LE Set Random Address (0x08|0x0005) plen 6   #48 [hci1] 4.987245
        Address: 0B:F7:6D:E2:CB:94 (Non-Resolvable)
> HCI Event: Command Complete (0x0e) plen 4                 #49 [hci1] 4.987714
      LE Set Random Address (0x08|0x0005) ncmd 1
        Status: Success (0x00)
< HCI Command: LE Set Extended Sca.. (0x08|0x0041) plen 13  #50 [hci1] 5.007265
        Own address type: Random (0x01)
        Filter policy: Accept all advertisement (0x00)
        PHYs: 0x05
        Entry 0: LE 1M
          Type: Passive (0x00)
          Interval: 60.000 msec (0x0060)
          Window: 30.000 msec (0x0030)
        Entry 1: LE Coded
          Type: Passive (0x00)
          Interval: 60.000 msec (0x0060)
          Window: 30.000 msec (0x0030)
> HCI Event: Command Complete (0x0e) plen 4                 #51 [hci1] 5.007862
      LE Set Extended Scan Parameters (0x08|0x0041) ncmd 1
        Status: Success (0x00)
< HCI Command: LE Set Extended Scan.. (0x08|0x0042) plen 6  #52 [hci1] 5.027243
        Extended scan: Enabled (0x01)
        Filter duplicates: Enabled (0x01)
        Duration: 0 msec (0x0000)
        Period: 0.00 sec (0x0000)
> HCI Event: Command Complete (0x0e) plen 4                 #53 [hci1] 5.027711
      LE Set Extended Scan Enable (0x08|0x0042) ncmd 1
        Status: Success (0x00)
> HCI Event: LE Meta Event (0x3e) plen 47                   #54 [hci1] 5.655886
      LE Extended Advertising Report (0x0d)
        Num reports: 1
        Entry 0
          Event type: 0x0000
            Props: 0x0000
            Data status: [0;32mComplete[0m
          Address type: Public (0x00)
          Address: DF:A9:FF:F6:B1:1A (OUI DF-A9-FF)
          Primary PHY: LE 1M
          Secondary PHY: LE 1M
          SID: 0x00
          TX power: 127 dBm
          RSSI: -25 dBm (0xe7)
          Periodic advertising interval: 750.00 msec (0x0258)
          Direct address type: Reserved (0xff)
          Direct address: 00-00-00-00-00-00
          Data length: 0x15
        06 16 52 18 58 5b 93 0d 09 50 54 53 2d 42 41 50  ..R.X[...PTS-BAP
        2d 42 31 31 41                                   -B11A           
        Service Data: Broadcast Audio Announcement (0x1852)
        Broadcast ID: 9657176 (0x935b58)
        Name (complete): PTS-BAP-B11A
> HCI Event: LE Meta Event (0x3e) plen 16                   #55 [hci1] 6.389565
      LE Periodic Advertising Sync Established (0x0e)
        Status: Success (0x00)
        Sync handle: 1730
        Advertising SID: 0x00
        Advertiser address type: Public (0x00)
        Advertiser address: DF:A9:FF:F6:B1:1A (OUI DF-A9-FF)
        Advertiser PHY: LE 1M (0x01)
        Periodic advertising interval: 750.00 msec (0x0258)
        Advertiser clock accuracy: 0x01
> HCI Event: LE Meta Event (0x3e) plen 56                   #56 [hci1] 6.390141
      LE Periodic Advertising Report (0x0f)
        Sync handle: 1730
        TX power: 127 dbm (0x7f)
        RSSI: -32 dBm (0xe0)
        CTE Type: No Constant Tone Extension (0xff)
        Data status: [0;32mComplete[0m
        Data length: 0x30
        2f 16 51 18 40 9c 00 01 02 06 00 00 00 00 0a 02  /.Q.@...........
        01 07 02 02 00 03 04 61 00 06 03 02 04 00 01 09  .......a........
        01 06 05 03 01 00 00 00 02 06 05 03 02 00 00 00  ................
> HCI Event: LE Meta Event (0x3e) plen 20                   #57 [hci1] 6.390329
      LE Broadcast Isochronous Group Info Advertising Report (0x22)
        Sync Handle: 0x06c2
        Number BIS: 2
        NSE: 3
        ISO Interval: 7.50 msec (0x0006)
        BN: 1
        PTO: 1
        IRC: 2
        Maximum PDU: 97
        SDU Interval: 8163 us (0x001fe3)
        Maximum SDU: 97
        PHY: LE 2M (0x02)
        Framing: Framed (0x01)
        Encryption: 0x00
< HCI Command: LE Set Extended Scan.. (0x08|0x0042) plen 6  #58 [hci1] 6.407803
        Extended scan: Disabled (0x00)
        Filter duplicates: Disabled (0x00)
        Duration: 0 msec (0x0000)
        Period: 0.00 sec (0x0000)
> HCI Event: Command Complete (0x0e) plen 4                 #59 [hci1] 6.409788
      LE Set Extended Scan Enable (0x08|0x0042) ncmd 1
        Status: Success (0x00)
< HCI Command: LE Broadcast Isochr.. (0x08|0x006b) plen 25  #60 [hci1] 6.467340
        BIG Handle: 0x00
        BIG Sync Handle: 0x06c2
        Encryption: Unencrypted (0x00)
        Broadcast Code: 00000000000000000000000000000000
        Maximum Number Subevents: 0x00
        Timeout: 100 ms (0x000a)
        Number of BIS: 1
        BIS ID: 0x01
> HCI Event: Command Status (0x0f) plen 4                   #61 [hci1] 6.468110
      LE Broadcast Isochronous Group Create Sync (0x08|0x006b) ncmd 1
        Status: Success (0x00)
> HCI Event: LE Meta Event (0x3e) plen 56                   #62 [hci1] 7.139939
      LE Periodic Advertising Report (0x0f)
        Sync handle: 1730
        TX power: 127 dbm (0x7f)
        RSSI: -23 dBm (0xe9)
        CTE Type: No Constant Tone Extension (0xff)
        Data status: [0;32mComplete[0m
        Data length: 0x30
        2f 16 51 18 40 9c 00 01 02 06 00 00 00 00 0a 02  /.Q.@...........
        01 07 02 02 00 03 04 61 00 06 03 02 04 00 01 09  .......a........
        01 06 05 03 01 00 00 00 02 06 05 03 02 00 00 00  ................
> HCI Event: LE Meta Event (0x3e) plen 20                   #63 [hci1] 7.140162
      LE Broadcast Isochronous Group Info Advertising Report (0x22)
        Sync Handle: 0x06c2
        Number BIS: 2
        NSE: 3
        ISO Interval: 7.50 msec (0x0006)
        BN: 1
        PTO: 1
        IRC: 2
        Maximum PDU: 97
        SDU Interval: 8163 us (0x001fe3)
        Maximum SDU: 97
        PHY: LE 2M (0x02)
        Framing: Framed (0x01)
        Encryption: 0x00
> HCI Event: LE Meta Event (0x3e) plen 17                   #64 [hci1] 7.141628
      LE Broadcast Isochronous Group Sync Estabilished (0x1d)
        Status: Success (0x00)
        BIG Handle: 0x00
        Transport Latency: 49005 us (0x00bf6d)
        NSE: 3
        BN: 1
        PTO: 1
        IRC: 2
        Maximum PDU: 97
        ISO Interval: 7.50 msec (0x0006)
        Connection Handle #0: 1634
< HCI Command: LE Setup Isochronou.. (0x08|0x006e) plen 13  #65 [hci1] 7.149674
        Handle: 1634
        Data Path Direction: Output (Controller to Host) (0x01)
        Data Path: HCI (0x00)
        Coding Format: Transparent (0x03)
        Company Codec ID: Ericsson Technology Licensing (0)
        Vendor Codec ID: 0
        Controller Delay: 0 us (0x000000)
        Codec Configuration Length: 0
        Codec Configuration: 
> HCI Event: Command Complete (0x0e) plen 6                 #66 [hci1] 7.150390
      LE Setup Isochronous Data Path (0x08|0x006e) ncmd 1
        Status: Success (0x00)
        Handle: 1634
> HCI Event: LE Meta Event (0x3e) plen 56                   #67 [hci1] 7.889846
      LE Periodic Advertising Report (0x0f)
        Sync handle: 1730
        TX power: 127 dbm (0x7f)
        RSSI: -32 dBm (0xe0)
        CTE Type: No Constant Tone Extension (0xff)
        Data status: [0;32mComplete[0m
        Data length: 0x30
        2f 16 51 18 40 9c 00 01 02 06 00 00 00 00 0a 02  /.Q.@...........
        01 07 02 02 00 03 04 61 00 06 03 02 04 00 01 09  .......a........
        01 06 05 03 01 00 00 00 02 06 05 03 02 00 00 00  ................
> HCI Event: LE Meta Event (0x3e) plen 20                   #68 [hci1] 7.890066
      LE Broadcast Isochronous Group Info Advertising Report (0x22)
        Sync Handle: 0x06c2
        Number BIS: 2
        NSE: 3
        ISO Interval: 7.50 msec (0x0006)
        BN: 1
        PTO: 1
        IRC: 2
        Maximum PDU: 97
        SDU Interval: 8163 us (0x001fe3)
        Maximum SDU: 97
        PHY: LE 2M (0x02)
        Framing: Framed (0x01)
        Encryption: 0x00
> HCI Event: LE Meta Event (0x3e) plen 56                   #69 [hci1] 8.639843
      LE Periodic Advertising Report (0x0f)
        Sync handle: 1730
        TX power: 127 dbm (0x7f)
        RSSI: -23 dBm (0xe9)
        CTE Type: No Constant Tone Extension (0xff)
        Data status: [0;32mComplete[0m
        Data length: 0x30
        2f 16 51 18 40 9c 00 01 02 06 00 00 00 00 0a 02  /.Q.@...........
        01 07 02 02 00 03 04 61 00 06 03 02 04 00 01 09  .......a........
        01 06 05 03 01 00 00 00 02 06 05 03 02 00 00 00  ................
> HCI Event: LE Meta Event (0x3e) plen 20                   #70 [hci1] 8.640064
      LE Broadcast Isochronous Group Info Advertising Report (0x22)
        Sync Handle: 0x06c2
        Number BIS: 2
        NSE: 3
        ISO Interval: 7.50 msec (0x0006)
        BN: 1
        PTO: 1
        IRC: 2
        Maximum PDU: 97
        SDU Interval: 8163 us (0x001fe3)
        Maximum SDU: 97
        PHY: LE 2M (0x02)
        Framing: Framed (0x01)
        Encryption: 0x00
> HCI Event: LE Meta Event (0x3e) plen 56                   #71 [hci1] 9.389788
      LE Periodic Advertising Report (0x0f)
        Sync handle: 1730
        TX power: 127 dbm (0x7f)
        RSSI: -23 dBm (0xe9)
        CTE Type: No Constant Tone Extension (0xff)
        Data status: [0;32mComplete[0m
        Data length: 0x30
        2f 16 51 18 40 9c 00 01 02 06 00 00 00 00 0a 02  /.Q.@...........
        01 07 02 02 00 03 04 61 00 06 03 02 04 00 01 09  .......a........
        01 06 05 03 01 00 00 00 02 06 05 03 02 00 00 00  ................
> HCI Event: LE Meta Event (0x3e) plen 20                   #72 [hci1] 9.390030
      LE Broadcast Isochronous Group Info Advertising Report (0x22)
        Sync Handle: 0x06c2
        Number BIS: 2
        NSE: 3
        ISO Interval: 7.50 msec (0x0006)
        BN: 1
        PTO: 1
        IRC: 2
        Maximum PDU: 97
        SDU Interval: 8163 us (0x001fe3)
        Maximum SDU: 97
        PHY: LE 2M (0x02)
        Framing: Framed (0x01)
        Encryption: 0x00
> HCI Event: LE Meta Event (0x3e) plen 56                  #73 [hci1] 10.139813
      LE Periodic Advertising Report (0x0f)
        Sync handle: 1730
        TX power: 127 dbm (0x7f)
        RSSI: -23 dBm (0xe9)
        CTE Type: No Constant Tone Extension (0xff)
        Data status: [0;32mComplete[0m
        Data length: 0x30
        2f 16 51 18 40 9c 00 01 02 06 00 00 00 00 0a 02  /.Q.@...........
        01 07 02 02 00 03 04 61 00 06 03 02 04 00 01 09  .......a........
        01 06 05 03 01 00 00 00 02 06 05 03 02 00 00 00  ................
> HCI Event: LE Meta Event (0x3e) plen 20                  #74 [hci1] 10.140035
      LE Broadcast Isochronous Group Info Advertising Report (0x22)
        Sync Handle: 0x06c2
        Number BIS: 2
        NSE: 3
        ISO Interval: 7.50 msec (0x0006)
        BN: 1
        PTO: 1
        IRC: 2
        Maximum PDU: 97
        SDU Interval: 8163 us (0x001fe3)
        Maximum SDU: 97
        PHY: LE 2M (0x02)
        Framing: Framed (0x01)
        Encryption: 0x00
> HCI Event: LE Meta Event (0x3e) plen 56                  #75 [hci1] 10.889767
      LE Periodic Advertising Report (0x0f)
        Sync handle: 1730
        TX power: 127 dbm (0x7f)
        RSSI: -30 dBm (0xe2)
        CTE Type: No Constant Tone Extension (0xff)
        Data status: [0;32mComplete[0m
        Data length: 0x30
        2f 16 51 18 40 9c 00 01 02 06 00 00 00 00 0a 02  /.Q.@...........
        01 07 02 02 00 03 04 61 00 06 03 02 04 00 01 09  .......a........
        01 06 05 03 01 00 00 00 02 06 05 03 02 00 00 00  ................
> HCI Event: LE Meta Event (0x3e) plen 20                  #76 [hci1] 10.890049
      LE Broadcast Isochronous Group Info Advertising Report (0x22)
        Sync Handle: 0x06c2
        Number BIS: 2
        NSE: 3
        ISO Interval: 7.50 msec (0x0006)
        BN: 1
        PTO: 1
        IRC: 2
        Maximum PDU: 97
        SDU Interval: 8163 us (0x001fe3)
        Maximum SDU: 97
        PHY: LE 2M (0x02)
        Framing: Framed (0x01)
        Encryption: 0x00
> HCI Event: LE Meta Event (0x3e) plen 56                  #77 [hci1] 11.639805
      LE Periodic Advertising Report (0x0f)
        Sync handle: 1730
        TX power: 127 dbm (0x7f)
        RSSI: -33 dBm (0xdf)
        CTE Type: No Constant Tone Extension (0xff)
        Data status: [0;32mComplete[0m
        Data length: 0x30
        2f 16 51 18 40 9c 00 01 02 06 00 00 00 00 0a 02  /.Q.@...........
        01 07 02 02 00 03 04 61 00 06 03 02 04 00 01 09  .......a........
        01 06 05 03 01 00 00 00 02 06 05 03 02 00 00 00  ................
> HCI Event: LE Meta Event (0x3e) plen 20                  #78 [hci1] 11.640005
      LE Broadcast Isochronous Group Info Advertising Report (0x22)
        Sync Handle: 0x06c2
        Number BIS: 2
        NSE: 3
        ISO Interval: 7.50 msec (0x0006)
        BN: 1
        PTO: 1
        IRC: 2
        Maximum PDU: 97
        SDU Interval: 8163 us (0x001fe3)
        Maximum SDU: 97
        PHY: LE 2M (0x02)
        Framing: Framed (0x01)
        Encryption: 0x00
> HCI Event: LE Meta Event (0x3e) plen 56                  #79 [hci1] 12.389793
      LE Periodic Advertising Report (0x0f)
        Sync handle: 1730
        TX power: 127 dbm (0x7f)
        RSSI: -33 dBm (0xdf)
        CTE Type: No Constant Tone Extension (0xff)
        Data status: [0;32mComplete[0m
        Data length: 0x30
        2f 16 51 18 40 9c 00 01 02 06 00 00 00 00 0a 02  /.Q.@...........
        01 07 02 02 00 03 04 61 00 06 03 02 04 00 01 09  .......a........
        01 06 05 03 01 00 00 00 02 06 05 03 02 00 00 00  ................
> HCI Event: LE Meta Event (0x3e) plen 20                  #80 [hci1] 12.390027
      LE Broadcast Isochronous Group Info Advertising Report (0x22)
        Sync Handle: 0x06c2
        Number BIS: 2
        NSE: 3
        ISO Interval: 7.50 msec (0x0006)
        BN: 1
        PTO: 1
        IRC: 2
        Maximum PDU: 97
        SDU Interval: 8163 us (0x001fe3)
        Maximum SDU: 97
        PHY: LE 2M (0x02)
        Framing: Framed (0x01)
        Encryption: 0x00
> HCI Event: LE Meta Event (0x3e) plen 56                  #81 [hci1] 13.139846
      LE Periodic Advertising Report (0x0f)
        Sync handle: 1730
        TX power: 127 dbm (0x7f)
        RSSI: -28 dBm (0xe4)
        CTE Type: No Constant Tone Extension (0xff)
        Data status: [0;32mComplete[0m
        Data length: 0x30
        2f 16 51 18 40 9c 00 01 02 06 00 00 00 00 0a 02  /.Q.@...........
        01 07 02 02 00 03 04 61 00 06 03 02 04 00 01 09  .......a........
        01 06 05 03 01 00 00 00 02 06 05 03 02 00 00 00  ................
> HCI Event: LE Meta Event (0x3e) plen 20                  #82 [hci1] 13.140007
      LE Broadcast Isochronous Group Info Advertising Report (0x22)
        Sync Handle: 0x06c2
        Number BIS: 2
        NSE: 3
        ISO Interval: 7.50 msec (0x0006)
        BN: 1
        PTO: 1
        IRC: 2
        Maximum PDU: 97
        SDU Interval: 8163 us (0x001fe3)
        Maximum SDU: 97
        PHY: LE 2M (0x02)
        Framing: Framed (0x01)
        Encryption: 0x00
> HCI Event: LE Meta Event (0x3e) plen 56                  #83 [hci1] 13.889748
      LE Periodic Advertising Report (0x0f)
        Sync handle: 1730
        TX power: 127 dbm (0x7f)
        RSSI: -23 dBm (0xe9)
        CTE Type: No Constant Tone Extension (0xff)
        Data status: [0;32mComplete[0m
        Data length: 0x30
        2f 16 51 18 40 9c 00 01 02 06 00 00 00 00 0a 02  /.Q.@...........
        01 07 02 02 00 03 04 61 00 06 03 02 04 00 01 09  .......a........
        01 06 05 03 01 00 00 00 02 06 05 03 02 00 00 00  ................
> HCI Event: LE Meta Event (0x3e) plen 20                  #84 [hci1] 13.890089
      LE Broadcast Isochronous Group Info Advertising Report (0x22)
        Sync Handle: 0x06c2
        Number BIS: 2
        NSE: 3
        ISO Interval: 7.50 msec (0x0006)
        BN: 1
        PTO: 1
        IRC: 2
        Maximum PDU: 97
        SDU Interval: 8163 us (0x001fe3)
        Maximum SDU: 97
        PHY: LE 2M (0x02)
        Framing: Framed (0x01)
        Encryption: 0x00
> HCI Event: LE Meta Event (0x3e) plen 56                  #85 [hci1] 14.639678
      LE Periodic Advertising Report (0x0f)
        Sync handle: 1730
        TX power: 127 dbm (0x7f)
        RSSI: -28 dBm (0xe4)
        CTE Type: No Constant Tone Extension (0xff)
        Data status: [0;32mComplete[0m
        Data length: 0x30
        2f 16 51 18 40 9c 00 01 02 06 00 00 00 00 0a 02  /.Q.@...........
        01 07 02 02 00 03 04 61 00 06 03 02 04 00 01 09  .......a........
        01 06 05 03 01 00 00 00 02 06 05 03 02 00 00 00  ................
> HCI Event: LE Meta Event (0x3e) plen 20                  #86 [hci1] 14.639931
      LE Broadcast Isochronous Group Info Advertising Report (0x22)
        Sync Handle: 0x06c2
        Number BIS: 2
        NSE: 3
        ISO Interval: 7.50 msec (0x0006)
        BN: 1
        PTO: 1
        IRC: 2
        Maximum PDU: 97
        SDU Interval: 8163 us (0x001fe3)
        Maximum SDU: 97
        PHY: LE 2M (0x02)
        Framing: Framed (0x01)
        Encryption: 0x00
> HCI Event: LE Meta Event (0x3e) plen 56                  #87 [hci1] 15.389678
      LE Periodic Advertising Report (0x0f)
        Sync handle: 1730
        TX power: 127 dbm (0x7f)
        RSSI: -23 dBm (0xe9)
        CTE Type: No Constant Tone Extension (0xff)
        Data status: [0;32mComplete[0m
        Data length: 0x30
        2f 16 51 18 40 9c 00 01 02 06 00 00 00 00 0a 02  /.Q.@...........
        01 07 02 02 00 03 04 61 00 06 03 02 04 00 01 09  .......a........
        01 06 05 03 01 00 00 00 02 06 05 03 02 00 00 00  ................
> HCI Event: LE Meta Event (0x3e) plen 20                  #88 [hci1] 15.389992
      LE Broadcast Isochronous Group Info Advertising Report (0x22)
        Sync Handle: 0x06c2
        Number BIS: 2
        NSE: 3
        ISO Interval: 7.50 msec (0x0006)
        BN: 1
        PTO: 1
        IRC: 2
        Maximum PDU: 97
        SDU Interval: 8163 us (0x001fe3)
        Maximum SDU: 97
        PHY: LE 2M (0x02)
        Framing: Framed (0x01)
        Encryption: 0x00
> HCI Event: LE Meta Event (0x3e) plen 56                  #89 [hci1] 16.139770
      LE Periodic Advertising Report (0x0f)
        Sync handle: 1730
        TX power: 127 dbm (0x7f)
        RSSI: -23 dBm (0xe9)
        CTE Type: No Constant Tone Extension (0xff)
        Data status: [0;32mComplete[0m
        Data length: 0x30
        2f 16 51 18 40 9c 00 01 02 06 00 00 00 00 0a 02  /.Q.@...........
        01 07 02 02 00 03 04 61 00 06 03 02 04 00 01 09  .......a........
        01 06 05 03 01 00 00 00 02 06 05 03 02 00 00 00  ................
> HCI Event: LE Meta Event (0x3e) plen 20                  #90 [hci1] 16.140007
      LE Broadcast Isochronous Group Info Advertising Report (0x22)
        Sync Handle: 0x06c2
        Number BIS: 2
        NSE: 3
        ISO Interval: 7.50 msec (0x0006)
        BN: 1
        PTO: 1
        IRC: 2
        Maximum PDU: 97
        SDU Interval: 8163 us (0x001fe3)
        Maximum SDU: 97
        PHY: LE 2M (0x02)
        Framing: Framed (0x01)
        Encryption: 0x00
> HCI Event: LE Meta Event (0x3e) plen 56                  #91 [hci1] 16.889665
      LE Periodic Advertising Report (0x0f)
        Sync handle: 1730
        TX power: 127 dbm (0x7f)
        RSSI: -25 dBm (0xe7)
        CTE Type: No Constant Tone Extension (0xff)
        Data status: [0;32mComplete[0m
        Data length: 0x30
        2f 16 51 18 40 9c 00 01 02 06 00 00 00 00 0a 02  /.Q.@...........
        01 07 02 02 00 03 04 61 00 06 03 02 04 00 01 09  .......a........
        01 06 05 03 01 00 00 00 02 06 05 03 02 00 00 00  ................
> HCI Event: LE Meta Event (0x3e) plen 20                  #92 [hci1] 16.889967
      LE Broadcast Isochronous Group Info Advertising Report (0x22)
        Sync Handle: 0x06c2
        Number BIS: 2
        NSE: 3
        ISO Interval: 7.50 msec (0x0006)
        BN: 1
        PTO: 1
        IRC: 2
        Maximum PDU: 97
        SDU Interval: 8163 us (0x001fe3)
        Maximum SDU: 97
        PHY: LE 2M (0x02)
        Framing: Framed (0x01)
        Encryption: 0x00
> HCI Event: LE Meta Event (0x3e) plen 56                  #93 [hci1] 17.639690
      LE Periodic Advertising Report (0x0f)
        Sync handle: 1730
        TX power: 127 dbm (0x7f)
        RSSI: -24 dBm (0xe8)
        CTE Type: No Constant Tone Extension (0xff)
        Data status: [0;32mComplete[0m
        Data length: 0x30
        2f 16 51 18 40 9c 00 01 02 06 00 00 00 00 0a 02  /.Q.@...........
        01 07 02 02 00 03 04 61 00 06 03 02 04 00 01 09  .......a........
        01 06 05 03 01 00 00 00 02 06 05 03 02 00 00 00  ................
> HCI Event: LE Meta Event (0x3e) plen 20                  #94 [hci1] 17.640014
      LE Broadcast Isochronous Group Info Advertising Report (0x22)
        Sync Handle: 0x06c2
        Number BIS: 2
        NSE: 3
        ISO Interval: 7.50 msec (0x0006)
        BN: 1
        PTO: 1
        IRC: 2
        Maximum PDU: 97
        SDU Interval: 8163 us (0x001fe3)
        Maximum SDU: 97
        PHY: LE 2M (0x02)
        Framing: Framed (0x01)
        Encryption: 0x00
> HCI Event: LE Meta Event (0x3e) plen 56                  #95 [hci1] 18.389667
      LE Periodic Advertising Report (0x0f)
        Sync handle: 1730
        TX power: 127 dbm (0x7f)
        RSSI: -27 dBm (0xe5)
        CTE Type: No Constant Tone Extension (0xff)
        Data status: [0;32mComplete[0m
        Data length: 0x30
        2f 16 51 18 40 9c 00 01 02 06 00 00 00 00 0a 02  /.Q.@...........
        01 07 02 02 00 03 04 61 00 06 03 02 04 00 01 09  .......a........
        01 06 05 03 01 00 00 00 02 06 05 03 02 00 00 00  ................
> HCI Event: LE Meta Event (0x3e) plen 20                  #96 [hci1] 18.389920
      LE Broadcast Isochronous Group Info Advertising Report (0x22)
        Sync Handle: 0x06c2
        Number BIS: 2
        NSE: 3
        ISO Interval: 7.50 msec (0x0006)
        BN: 1
        PTO: 1
        IRC: 2
        Maximum PDU: 97
        SDU Interval: 8163 us (0x001fe3)
        Maximum SDU: 97
        PHY: LE 2M (0x02)
        Framing: Framed (0x01)
        Encryption: 0x00
> HCI Event: LE Meta Event (0x3e) plen 56                  #97 [hci1] 19.139602
      LE Periodic Advertising Report (0x0f)
        Sync handle: 1730
        TX power: 127 dbm (0x7f)
        RSSI: -25 dBm (0xe7)
        CTE Type: No Constant Tone Extension (0xff)
        Data status: [0;32mComplete[0m
        Data length: 0x30
        2f 16 51 18 40 9c 00 01 02 06 00 00 00 00 0a 02  /.Q.@...........
        01 07 02 02 00 03 04 61 00 06 03 02 04 00 01 09  .......a........
        01 06 05 03 01 00 00 00 02 06 05 03 02 00 00 00  ................
> HCI Event: LE Meta Event (0x3e) plen 20                  #98 [hci1] 19.139904
      LE Broadcast Isochronous Group Info Advertising Report (0x22)
        Sync Handle: 0x06c2
        Number BIS: 2
        NSE: 3
        ISO Interval: 7.50 msec (0x0006)
        BN: 1
        PTO: 1
        IRC: 2
        Maximum PDU: 97
        SDU Interval: 8163 us (0x001fe3)
        Maximum SDU: 97
        PHY: LE 2M (0x02)
        Framing: Framed (0x01)
        Encryption: 0x00
> HCI Event: LE Meta Event (0x3e) plen 56                  #99 [hci1] 19.889653
      LE Periodic Advertising Report (0x0f)
        Sync handle: 1730
        TX power: 127 dbm (0x7f)
        RSSI: -25 dBm (0xe7)
        CTE Type: No Constant Tone Extension (0xff)
        Data status: [0;32mComplete[0m
        Data length: 0x30
        2f 16 51 18 40 9c 00 01 02 06 00 00 00 00 0a 02  /.Q.@...........
        01 07 02 02 00 03 04 61 00 06 03 02 04 00 01 09  .......a........
        01 06 05 03 01 00 00 00 02 06 05 03 02 00 00 00  ................
> HCI Event: LE Meta Event (0x3e) plen 20                 #100 [hci1] 19.889921
      LE Broadcast Isochronous Group Info Advertising Report (0x22)
        Sync Handle: 0x06c2
        Number BIS: 2
        NSE: 3
        ISO Interval: 7.50 msec (0x0006)
        BN: 1
        PTO: 1
        IRC: 2
        Maximum PDU: 97
        SDU Interval: 8163 us (0x001fe3)
        Maximum SDU: 97
        PHY: LE 2M (0x02)
        Framing: Framed (0x01)
        Encryption: 0x00
> HCI Event: LE Meta Event (0x3e) plen 56                 #101 [hci1] 20.639644
      LE Periodic Advertising Report (0x0f)
        Sync handle: 1730
        TX power: 127 dbm (0x7f)
        RSSI: -28 dBm (0xe4)
        CTE Type: No Constant Tone Extension (0xff)
        Data status: [0;32mComplete[0m
        Data length: 0x30
        2f 16 51 18 40 9c 00 01 02 06 00 00 00 00 0a 02  /.Q.@...........
        01 07 02 02 00 03 04 61 00 06 03 02 04 00 01 09  .......a........
        01 06 05 03 01 00 00 00 02 06 05 03 02 00 00 00  ................
> HCI Event: LE Meta Event (0x3e) plen 20                 #102 [hci1] 20.639922
      LE Broadcast Isochronous Group Info Advertising Report (0x22)
        Sync Handle: 0x06c2
        Number BIS: 2
        NSE: 3
        ISO Interval: 7.50 msec (0x0006)
        BN: 1
        PTO: 1
        IRC: 2
        Maximum PDU: 97
        SDU Interval: 8163 us (0x001fe3)
        Maximum SDU: 97
        PHY: LE 2M (0x02)
        Framing: Framed (0x01)
        Encryption: 0x00
> HCI Event: LE Meta Event (0x3e) plen 56                 #103 [hci1] 21.389710
      LE Periodic Advertising Report (0x0f)
        Sync handle: 1730
        TX power: 127 dbm (0x7f)
        RSSI: -27 dBm (0xe5)
        CTE Type: No Constant Tone Extension (0xff)
        Data status: [0;32mComplete[0m
        Data length: 0x30
        2f 16 51 18 40 9c 00 01 02 06 00 00 00 00 0a 02  /.Q.@...........
        01 07 02 02 00 03 04 61 00 06 03 02 04 00 01 09  .......a........
        01 06 05 03 01 00 00 00 02 06 05 03 02 00 00 00  ................
> HCI Event: LE Meta Event (0x3e) plen 20                 #104 [hci1] 21.389881
      LE Broadcast Isochronous Group Info Advertising Report (0x22)
        Sync Handle: 0x06c2
        Number BIS: 2
        NSE: 3
        ISO Interval: 7.50 msec (0x0006)
        BN: 1
        PTO: 1
        IRC: 2
        Maximum PDU: 97
        SDU Interval: 8163 us (0x001fe3)
        Maximum SDU: 97
        PHY: LE 2M (0x02)
        Framing: Framed (0x01)
        Encryption: 0x00
> HCI Event: LE Meta Event (0x3e) plen 56                 #105 [hci1] 22.139708
      LE Periodic Advertising Report (0x0f)
        Sync handle: 1730
        TX power: 127 dbm (0x7f)
        RSSI: -33 dBm (0xdf)
        CTE Type: No Constant Tone Extension (0xff)
        Data status: [0;32mComplete[0m
        Data length: 0x30
        2f 16 51 18 40 9c 00 01 02 06 00 00 00 00 0a 02  /.Q.@...........
        01 07 02 02 00 03 04 61 00 06 03 02 04 00 01 09  .......a........
        01 06 05 03 01 00 00 00 02 06 05 03 02 00 00 00  ................
> HCI Event: LE Meta Event (0x3e) plen 20                 #106 [hci1] 22.140012
      LE Broadcast Isochronous Group Info Advertising Report (0x22)
        Sync Handle: 0x06c2
        Number BIS: 2
        NSE: 3
        ISO Interval: 7.50 msec (0x0006)
        BN: 1
        PTO: 1
        IRC: 2
        Maximum PDU: 97
        SDU Interval: 8163 us (0x001fe3)
        Maximum SDU: 97
        PHY: LE 2M (0x02)
        Framing: Framed (0x01)
        Encryption: 0x00
> HCI Event: LE Meta Event (0x3e) plen 56                 #107 [hci1] 22.889704
      LE Periodic Advertising Report (0x0f)
        Sync handle: 1730
        TX power: 127 dbm (0x7f)
        RSSI: -32 dBm (0xe0)
        CTE Type: No Constant Tone Extension (0xff)
        Data status: [0;32mComplete[0m
        Data length: 0x30
        2f 16 51 18 40 9c 00 01 02 06 00 00 00 00 0a 02  /.Q.@...........
        01 07 02 02 00 03 04 61 00 06 03 02 04 00 01 09  .......a........
        01 06 05 03 01 00 00 00 02 06 05 03 02 00 00 00  ................
> HCI Event: LE Meta Event (0x3e) plen 20                 #108 [hci1] 22.889992
      LE Broadcast Isochronous Group Info Advertising Report (0x22)
        Sync Handle: 0x06c2
        Number BIS: 2
        NSE: 3
        ISO Interval: 7.50 msec (0x0006)
        BN: 1
        PTO: 1
        IRC: 2
        Maximum PDU: 97
        SDU Interval: 8163 us (0x001fe3)
        Maximum SDU: 97
        PHY: LE 2M (0x02)
        Framing: Framed (0x01)
        Encryption: 0x00
> HCI Event: LE Meta Event (0x3e) plen 56                 #109 [hci1] 23.639556
      LE Periodic Advertising Report (0x0f)
        Sync handle: 1730
        TX power: 127 dbm (0x7f)
        RSSI: -30 dBm (0xe2)
        CTE Type: No Constant Tone Extension (0xff)
        Data status: [0;32mComplete[0m
        Data length: 0x30
        2f 16 51 18 40 9c 00 01 02 06 00 00 00 00 0a 02  /.Q.@...........
        01 07 02 02 00 03 04 61 00 06 03 02 04 00 01 09  .......a........
        01 06 05 03 01 00 00 00 02 06 05 03 02 00 00 00  ................
> HCI Event: LE Meta Event (0x3e) plen 20                 #110 [hci1] 23.639849
      LE Broadcast Isochronous Group Info Advertising Report (0x22)
        Sync Handle: 0x06c2
        Number BIS: 2
        NSE: 3
        ISO Interval: 7.50 msec (0x0006)
        BN: 1
        PTO: 1
        IRC: 2
        Maximum PDU: 97
        SDU Interval: 8163 us (0x001fe3)
        Maximum SDU: 97
        PHY: LE 2M (0x02)
        Framing: Framed (0x01)
        Encryption: 0x00
> HCI Event: LE Meta Event (0x3e) plen 56                 #111 [hci1] 24.389568
      LE Periodic Advertising Report (0x0f)
        Sync handle: 1730
        TX power: 127 dbm (0x7f)
        RSSI: -24 dBm (0xe8)
        CTE Type: No Constant Tone Extension (0xff)
        Data status: [0;32mComplete[0m
        Data length: 0x30
        2f 16 51 18 40 9c 00 01 02 06 00 00 00 00 0a 02  /.Q.@...........
        01 07 02 02 00 03 04 61 00 06 03 02 04 00 01 09  .......a........
        01 06 05 03 01 00 00 00 02 06 05 03 02 00 00 00  ................
> HCI Event: LE Meta Event (0x3e) plen 20                 #112 [hci1] 24.389839
      LE Broadcast Isochronous Group Info Advertising Report (0x22)
        Sync Handle: 0x06c2
        Number BIS: 2
        NSE: 3
        ISO Interval: 7.50 msec (0x0006)
        BN: 1
        PTO: 1
        IRC: 2
        Maximum PDU: 97
        SDU Interval: 8163 us (0x001fe3)
        Maximum SDU: 97
        PHY: LE 2M (0x02)
        Framing: Framed (0x01)
        Encryption: 0x00
> HCI Event: LE Meta Event (0x3e) plen 56                 #113 [hci1] 25.139650
      LE Periodic Advertising Report (0x0f)
        Sync handle: 1730
        TX power: 127 dbm (0x7f)
        RSSI: -22 dBm (0xea)
        CTE Type: No Constant Tone Extension (0xff)
        Data status: [0;32mComplete[0m
        Data length: 0x30
        2f 16 51 18 40 9c 00 01 02 06 00 00 00 00 0a 02  /.Q.@...........
        01 07 02 02 00 03 04 61 00 06 03 02 04 00 01 09  .......a........
        01 06 05 03 01 00 00 00 02 06 05 03 02 00 00 00  ................
> HCI Event: LE Meta Event (0x3e) plen 20                 #114 [hci1] 25.139836
      LE Broadcast Isochronous Group Info Advertising Report (0x22)
        Sync Handle: 0x06c2
        Number BIS: 2
        NSE: 3
        ISO Interval: 7.50 msec (0x0006)
        BN: 1
        PTO: 1
        IRC: 2
        Maximum PDU: 97
        SDU Interval: 8163 us (0x001fe3)
        Maximum SDU: 97
        PHY: LE 2M (0x02)
        Framing: Framed (0x01)
        Encryption: 0x00
> HCI Event: LE Meta Event (0x3e) plen 56                 #115 [hci1] 25.889649
      LE Periodic Advertising Report (0x0f)
        Sync handle: 1730
        TX power: 127 dbm (0x7f)
        RSSI: -32 dBm (0xe0)
        CTE Type: No Constant Tone Extension (0xff)
        Data status: [0;32mComplete[0m
        Data length: 0x30
        2f 16 51 18 40 9c 00 01 02 06 00 00 00 00 0a 02  /.Q.@...........
        01 07 02 02 00 03 04 61 00 06 03 02 04 00 01 09  .......a........
        01 06 05 03 01 00 00 00 02 06 05 03 02 00 00 00  ................
> HCI Event: LE Meta Event (0x3e) plen 20                 #116 [hci1] 25.889798
      LE Broadcast Isochronous Group Info Advertising Report (0x22)
        Sync Handle: 0x06c2
        Number BIS: 2
        NSE: 3
        ISO Interval: 7.50 msec (0x0006)
        BN: 1
        PTO: 1
        IRC: 2
        Maximum PDU: 97
        SDU Interval: 8163 us (0x001fe3)
        Maximum SDU: 97
        PHY: LE 2M (0x02)
        Framing: Framed (0x01)
        Encryption: 0x00
> HCI Event: LE Meta Event (0x3e) plen 56                 #117 [hci1] 26.639592
      LE Periodic Advertising Report (0x0f)
        Sync handle: 1730
        TX power: 127 dbm (0x7f)
        RSSI: -25 dBm (0xe7)
        CTE Type: No Constant Tone Extension (0xff)
        Data status: [0;32mComplete[0m
        Data length: 0x30
        2f 16 51 18 40 9c 00 01 02 06 00 00 00 00 0a 02  /.Q.@...........
        01 07 02 02 00 03 04 61 00 06 03 02 04 00 01 09  .......a........
        01 06 05 03 01 00 00 00 02 06 05 03 02 00 00 00  ................
> HCI Event: LE Meta Event (0x3e) plen 20                 #118 [hci1] 26.639831
      LE Broadcast Isochronous Group Info Advertising Report (0x22)
        Sync Handle: 0x06c2
        Number BIS: 2
        NSE: 3
        ISO Interval: 7.50 msec (0x0006)
        BN: 1
        PTO: 1
        IRC: 2
        Maximum PDU: 97
        SDU Interval: 8163 us (0x001fe3)
        Maximum SDU: 97
        PHY: LE 2M (0x02)
        Framing: Framed (0x01)
        Encryption: 0x00
> HCI Event: LE Meta Event (0x3e) plen 56                 #119 [hci1] 27.389630
      LE Periodic Advertising Report (0x0f)
        Sync handle: 1730
        TX power: 127 dbm (0x7f)
        RSSI: -24 dBm (0xe8)
        CTE Type: No Constant Tone Extension (0xff)
        Data status: [0;32mComplete[0m
        Data length: 0x30
        2f 16 51 18 40 9c 00 01 02 06 00 00 00 00 0a 02  /.Q.@...........
        01 07 02 02 00 03 04 61 00 06 03 02 04 00 01 09  .......a........
        01 06 05 03 01 00 00 00 02 06 05 03 02 00 00 00  ................
> HCI Event: LE Meta Event (0x3e) plen 20                 #120 [hci1] 27.389749
      LE Broadcast Isochronous Group Info Advertising Report (0x22)
        Sync Handle: 0x06c2
        Number BIS: 2
        NSE: 3
        ISO Interval: 7.50 msec (0x0006)
        BN: 1
        PTO: 1
        IRC: 2
        Maximum PDU: 97
        SDU Interval: 8163 us (0x001fe3)
        Maximum SDU: 97
        PHY: LE 2M (0x02)
        Framing: Framed (0x01)
        Encryption: 0x00
> HCI Event: LE Meta Event (0x3e) plen 56                 #121 [hci1] 28.139590
      LE Periodic Advertising Report (0x0f)
        Sync handle: 1730
        TX power: 127 dbm (0x7f)
        RSSI: -30 dBm (0xe2)
        CTE Type: No Constant Tone Extension (0xff)
        Data status: [0;32mComplete[0m
        Data length: 0x30
        2f 16 51 18 40 9c 00 01 02 06 00 00 00 00 0a 02  /.Q.@...........
        01 07 02 02 00 03 04 61 00 06 03 02 04 00 01 09  .......a........
        01 06 05 03 01 00 00 00 02 06 05 03 02 00 00 00  ................
> HCI Event: LE Meta Event (0x3e) plen 20                 #122 [hci1] 28.139803
      LE Broadcast Isochronous Group Info Advertising Report (0x22)
        Sync Handle: 0x06c2
        Number BIS: 2
        NSE: 3
        ISO Interval: 7.50 msec (0x0006)
        BN: 1
        PTO: 1
        IRC: 2
        Maximum PDU: 97
        SDU Interval: 8163 us (0x001fe3)
        Maximum SDU: 97
        PHY: LE 2M (0x02)
        Framing: Framed (0x01)
        Encryption: 0x00
> HCI Event: LE Meta Event (0x3e) plen 56                 #123 [hci1] 28.889539
      LE Periodic Advertising Report (0x0f)
        Sync handle: 1730
        TX power: 127 dbm (0x7f)
        RSSI: -29 dBm (0xe3)
        CTE Type: No Constant Tone Extension (0xff)
        Data status: [0;32mComplete[0m
        Data length: 0x30
        2f 16 51 18 40 9c 00 01 02 06 00 00 00 00 0a 02  /.Q.@...........
        01 07 02 02 00 03 04 61 00 06 03 02 04 00 01 09  .......a........
        01 06 05 03 01 00 00 00 02 06 05 03 02 00 00 00  ................
> HCI Event: LE Meta Event (0x3e) plen 20                 #124 [hci1] 28.889766
      LE Broadcast Isochronous Group Info Advertising Report (0x22)
        Sync Handle: 0x06c2
        Number BIS: 2
        NSE: 3
        ISO Interval: 7.50 msec (0x0006)
        BN: 1
        PTO: 1
        IRC: 2
        Maximum PDU: 97
        SDU Interval: 8163 us (0x001fe3)
        Maximum SDU: 97
        PHY: LE 2M (0x02)
        Framing: Framed (0x01)
        Encryption: 0x00
> HCI Event: LE Meta Event (0x3e) plen 3                  #125 [hci1] 29.372451
      LE Broadcast Isochronous Group Sync Lost (0x1e)
        BIG Handle: 0x00
        Reason: Connection Timeout (0x08)
> HCI Event: LE Meta Event (0x3e) plen 3                  #126 [hci1] 29.638451
      LE Periodic Advertising Sync Lost (0x10)
        Sync handle: 1730
< HCI Command: Reset (0x03|0x0003) plen 0                 #127 [hci1] 32.507646
> HCI Event: Command Complete (0x0e) plen 4               #128 [hci1] 32.508163
      Reset (0x03|0x0003) ncmd 1
        Status: Success (0x00)
@ USER Close: main                                    {0x0001} [hci1] 32.527500
= Close Index: 00:00:00:00:00:00                               [hci1] 32.527508
