Bluetooth monitor ver 5.72
= Note: Linux version 6.14.0-36-generic (x86_64)                       0.741485
= Note: Bluetooth subsystem version 2.22                               0.741487
= New Index: 00:00:00:00:00:00 (Primary,UART,hci1)              [hci1] 0.741488
= New Index: 48:5F:99:8E:E0:64 (Primary,USB,hci0)               [hci0] 0.741488
= Open Index: 00:00:00:00:00:00                                 [hci1] 0.854833
= Index Info: 00:00:00:00:00:00 (Nordic Semiconductor ASA)      [hci1] 0.854838
@ USER Open: main (privileged) version 2.22            {0x0001} [hci1] 0.854841
< HCI Command: Reset (0x03|0x0003) plen 0                    #1 [hci1] 0.855201
> HCI Event: Command Complete (0x0e) plen 4                  #2 [hci1] 0.855740
      Reset (0x03|0x0003) ncmd 1
        Status: Success (0x00)
< HCI Command: Read Local Supported... (0x04|0x0003) plen 0  #3 [hci1] 0.874770
> HCI Event: Command Complete (0x0e) plen 12                 #4 [hci1] 0.875205
      Read Local Supported Features (0x04|0x0003) ncmd 1
        Status: Success (0x00)
        Features: 0x00 0x00 0x00 0x00 0x60 0x00 0x00 0x00
          BR/EDR Not Supported
          LE Supported (Controller)
< HCI Command: Read Local Version In.. (0x04|0x0001) plen 0  #5 [hci1] 0.894786
> HCI Event: Command Complete (0x0e) plen 12                 #6 [hci1] 0.895258
      Read Local Version Information (0x04|0x0001) ncmd 1
        Status: Success (0x00)
        HCI version: Reserved (0x0f) - Revision 12393 (0x3069)
        LMP version: Reserved (0x0f) - Subversion 12393 (0x3069)
        Manufacturer: Nordic Semiconductor ASA (89)
< HCI Command: Read Local Supported... (0x04|0x0002) plen 0  #7 [hci1] 0.914773
> HCI Event: Command Complete (0x0e) plen 68                 #8 [hci1] 0.915838
      Read Local Supported Commands (0x04|0x0002) ncmd 1
        Status: Success (0x00)
        Commands: 119 entries
          Disconnect (Octet 0 - Bit 5)
          Read Remote Version Information (Octet 2 - Bit 7)
          Set Event Mask (Octet 5 - Bit 6)
          Reset (Octet 5 - Bit 7)
          Read Connection Accept Timeout (Octet 7 - Bit 2)
          Write Connection Accept Timeout (Octet 7 - Bit 3)
          Read Transmit Power Level (Octet 10 - Bit 2)
          Set Controller To Host Flow Control (Octet 10 - Bit 5)
          Host Buffer Size (Octet 10 - Bit 6)
          Host Number of Completed Packets (Octet 10 - Bit 7)
          Read Local Version Information (Octet 14 - Bit 3)
          Read Local Supported Features (Octet 14 - Bit 5)
          Read BD ADDR (Octet 15 - Bit 1)
          Read RSSI (Octet 15 - Bit 5)
          Set Event Mask Page 2 (Octet 22 - Bit 2)
          LE Set Event Mask (Octet 25 - Bit 0)
          LE Read Buffer Size (Octet 25 - Bit 1)
          LE Read Local Supported Features (Octet 25 - Bit 2)
          LE Set Random Address (Octet 25 - Bit 4)
          LE Set Advertising Parameters (Octet 25 - Bit 5)
          LE Read Advertising Channel TX Power (Octet 25 - Bit 6)
          LE Set Advertising Data (Octet 25 - Bit 7)
          LE Set Scan Response Data (Octet 26 - Bit 0)
          LE Set Advertise Enable (Octet 26 - Bit 1)
          LE Set Scan Parameters (Octet 26 - Bit 2)
          LE Set Scan Enable (Octet 26 - Bit 3)
          LE Create Connection (Octet 26 - Bit 4)
          LE Create Connection Cancel (Octet 26 - Bit 5)
          LE Read Accept List Size (Octet 26 - Bit 6)
          LE Clear Accept List (Octet 26 - Bit 7)
          LE Add Device To Accept List (Octet 27 - Bit 0)
          LE Remove Device From Accept List (Octet 27 - Bit 1)
          LE Connection Update (Octet 27 - Bit 2)
          LE Set Host Channel Classification (Octet 27 - Bit 3)
          LE Read Channel Map (Octet 27 - Bit 4)
          LE Read Remote Used Features (Octet 27 - Bit 5)
          LE Encrypt (Octet 27 - Bit 6)
          LE Rand (Octet 27 - Bit 7)
          LE Start Encryption (Octet 28 - Bit 0)
          LE Long Term Key Request Reply (Octet 28 - Bit 1)
          LE Long Term Key Request Neg Reply (Octet 28 - Bit 2)
          LE Read Supported States (Octet 28 - Bit 3)
          LE Receiver Test (Octet 28 - Bit 4)
          LE Transmitter Test (Octet 28 - Bit 5)
          LE Test End (Octet 28 - Bit 6)
          Read Authenticated Payload Timeout (Octet 32 - Bit 4)
          Write Authenticated Payload Timeout (Octet 32 - Bit 5)
          LE Set Data Length (Octet 33 - Bit 6)
          LE Read Suggested Default Data Length (Octet 33 - Bit 7)
          LE Write Suggested Default Data Length (Octet 34 - Bit 0)
          LE Add Device To Resolving List (Octet 34 - Bit 3)
          LE Remove Device From Resolving List (Octet 34 - Bit 4)
          LE Clear Resolving List (Octet 34 - Bit 5)
          LE Read Resolving List Size (Octet 34 - Bit 6)
          LE Set Address Resolution Enable (Octet 35 - Bit 1)
          LE Set Resolvable Private Address Timeout (Octet 35 - Bit 2)
          LE Read Maximum Data Length (Octet 35 - Bit 3)
          LE Read PHY (Octet 35 - Bit 4)
          LE Set Default PHY (Octet 35 - Bit 5)
          LE Set PHY (Octet 35 - Bit 6)
          LE Enhanced Receiver Test (Octet 35 - Bit 7)
          LE Enhanced Transmitter Test (Octet 36 - Bit 0)
          LE Set Advertising Set Random Address (Octet 36 - Bit 1)
          LE Set Extended Advertising Parameters (Octet 36 - Bit 2)
          LE Set Extended Advertising Data (Octet 36 - Bit 3)
          LE Set Extended Scan Response Data (Octet 36 - Bit 4)
          LE Set Extended Advertising Enable (Octet 36 - Bit 5)
          LE Read Maximum Advertising Data Length (Octet 36 - Bit 6)
          LE Read Number of Supported Advertising Sets (Octet 36 - Bit 7)
          LE Remove Advertising Set (Octet 37 - Bit 0)
          LE Clear Advertising Sets (Octet 37 - Bit 1)
          LE Set Periodic Advertising Parameters (Octet 37 - Bit 2)
          LE Set Periodic Advertising Data (Octet 37 - Bit 3)
          LE Set Periodic Advertising Enable (Octet 37 - Bit 4)
          LE Set Extended Scan Parameters (Octet 37 - Bit 5)
          LE Set Extended Scan Enable (Octet 37 - Bit 6)
          LE Extended Create Connection (Octet 37 - Bit 7)
          LE Periodic Advertising Create Sync (Octet 38 - Bit 0)
          LE Periodic Advertising Create Sync Cancel (Octet 38 - Bit 1)
          LE Periodic Advertising Terminate Sync (Octet 38 - Bit 2)
          LE Add Device To Periodic Advertiser List (Octet 38 - Bit 3)
          LE Remove Device From Periodic Advertiser List (Octet 38 - Bit 4)
          LE Clear Periodic Advertiser List (Octet 38 - Bit 5)
          LE Read Periodic Advertiser List Size (Octet 38 - Bit 6)
          LE Read Transmit Power (Octet 38 - Bit 7)
          LE Read RF Path Compensation (Octet 39 - Bit 0)
          LE Write RF Path Compensation (Octet 39 - Bit 1)
          LE Set Privacy Mode (Octet 39 - Bit 2)
          LE Periodic Advertising Receive Enable (Octet 40 - Bit 5)
          LE Periodic Advertising Sync Transfer (Octet 40 - Bit 6)
          LE Periodic Advertising Set Info Transfer (Octet 40 - Bit 7)
          LE Periodic Advertising Sync Transfer Parameters (Octet 41 - Bit 0)
          LE Set Default Periodic Advertisng Sync Transfer Parameters (Octet 41 - Bit 1)
          LE Read Buffer v2 (Octet 41 - Bit 5)
          LE Read ISO TX Sync (Octet 41 - Bit 6)
          LE Set Connected Isochronous Group Parameters (Octet 41 - Bit 7)
          LE Set Connected Isochronous Group Parameters Test (Octet 42 - Bit 0)
          LE Create Connected Isochronous Stream (Octet 42 - Bit 1)
          LE Remove Connected Isochronous Group (Octet 42 - Bit 2)
          LE Accept Connected Isochronous Stream Request (Octet 42 - Bit 3)
          LE Reject Connected Isochronous Stream Request (Octet 42 - Bit 4)
          LE Create Broadcast Isochronous Group (Octet 42 - Bit 5)
          LE Create Broadcast Isochronous Group Test (Octet 42 - Bit 6)
          LE Terminate Broadcast Isochronous Group (Octet 42 - Bit 7)
          LE Broadcast Isochronous Group Create Sync (Octet 43 - Bit 0)
          LE Broadcast Isochronous Group Terminate Sync (Octet 43 - Bit 1)
          LE Request Peer SCA (Octet 43 - Bit 2)
          LE Setup Isochronous Data Path (Octet 43 - Bit 3)
          LE Remove Isochronous Data Path (Octet 43 - Bit 4)
          LE Isochronous Transmit Test (Octet 43 - Bit 5)
          LE Isochronous Receive Test (Octet 43 - Bit 6)
          LE Isochronous Read Test Counters (Octet 43 - Bit 7)
          LE Isochronous Read Test Counters (Octet 44 - Bit 0)
          LE Set Host Feature (Octet 44 - Bit 1)
          Octet 44 - Bit 2 
          Octet 45 - Bit 6 
          Octet 46 - Bit 0 
          Octet 46 - Bit 1 
          Octet 46 - Bit 2 
< HCI Command: Host Buffer Size (0x03|0x0033) plen 7         #9 [hci1] 0.934751
        ACL MTU: 255  ACL max packet: 16
        SCO MTU: 0    SCO max packet: 0
> HCI Event: Command Complete (0x0e) plen 4                 #10 [hci1] 0.935239
      Host Buffer Size (0x03|0x0033) ncmd 1
        Status: Success (0x00)
< HCI Command: Set Controller To Ho.. (0x03|0x0031) plen 1  #11 [hci1] 0.954770
        Flow control: ACL Data Packets (0x01)
> HCI Event: Command Complete (0x0e) plen 4                 #12 [hci1] 0.955148
      Set Controller To Host Flow Control (0x03|0x0031) ncmd 1
        Status: Success (0x00)
< HCI Command: LE Read Local Suppor.. (0x08|0x0003) plen 0  #13 [hci1] 0.974775
> HCI Event: Command Complete (0x0e) plen 12                #14 [hci1] 0.975247
      LE Read Local Supported Features (0x08|0x0003) ncmd 1
        Status: Success (0x00)
        Features: 0xfd 0x79 0x00 0xf7 0x30 0x01 0x00 0x00
          LE Encryption
          Extended Reject Indication
          Peripheral-initiated Features Exchange
          LE Ping
          LE Data Packet Length Extension
          LL Privacy
          Extended Scanner Filter Policies
          LE 2M PHY
          LE Coded PHY
          LE Extended Advertising
          LE Periodic Advertising
          Channel Selection Algorithm #2
          Periodic Advertising Sync Transfer - Sender
          Periodic Advertising Sync Transfer - Recipient
          Sleep Clock Accuracy Updates
          Connected Isochronous Stream - Central
          Connected Isochronous Stream - Peripheral
          Isochronous Broadcaster
          Synchronized Receiver
          Periodic Advertising ADI support
          Connection Subrating
          Unknown features (0x0000010000000000)
< HCI Command: LE Set Host Feature (0x08|0x0074) plen 2     #15 [hci1] 0.994772
        Bit Number: 32
          Connected Isochronous Stream (Host Support)
        Bit Value: 1
> HCI Event: Command Complete (0x0e) plen 4                 #16 [hci1] 0.995167
      LE Set Host Feature (0x08|0x0074) ncmd 1
        Status: Success (0x00)
< HCI Command: LE Read Buffer v2 (0x08|0x0060) plen 0       #17 [hci1] 1.014781
> HCI Event: Command Complete (0x0e) plen 10                #18 [hci1] 1.015213
      LE Read Buffer v2 (0x08|0x0060) ncmd 1
        Status: Success (0x00)
        ACL MTU: 27
        ACL max packet: 3
        ISO MTU: 318
        ISO max packet: 3
< HCI Command: LE Read Maximum Adve.. (0x08|0x003a) plen 0  #19 [hci1] 1.034835
> HCI Event: Command Complete (0x0e) plen 6                 #20 [hci1] 1.035298
      LE Read Maximum Advertising Data Length (0x08|0x003a) ncmd 1
        Status: Success (0x00)
        Max length: 1650
< HCI Command: LE Read Supported St.. (0x08|0x001c) plen 0  #21 [hci1] 1.054776
> HCI Event: Command Complete (0x0e) plen 12                #22 [hci1] 1.055245
      LE Read Supported States (0x08|0x001c) ncmd 1
        Status: Success (0x00)
        States: 0x000003ff3e0306ff
          Non-connectable Advertising State
          Scannable Advertising State
          Connectable Advertising State
          High Duty Cycle Directed Advertising State
          Passive Scanning State
          Active Scanning State
          Initiating State
            and Connection State (Central Role)
          Connection State (Peripheral Role)
          Scannable Advertising State
            and Passive Scanning State
          Connectable Advertising State
            and Passive Scanning State
          Non-connectable Advertising State
            and Initiating State
          Scannable Advertising State
            and Initiating State
          Active Scanning State
            and Connection State (Central Role)
          Passive Scanning State
            and Connection State (Peripheral Role)
          Active Scanning State
            and Connection State (Peripheral Role)
          Initiating State
            and Connection State (Central Role)
            and Central Role & Central Role
          Low Duty Cycle Directed Advertising State
          Connectable Advertising State
            and Initiating State
            and Central Role & Peripheral Role
          High Duty Cycle Directed Advertising State
            and Initiating State
            and Central Role & Peripheral Role
          Low Duty Cycle Directed Advertising State
            and Initiating State
            and Central Role & Peripheral Role
          Connectable Advertising State
            and Connection State (Central Role)
            and Central Role & Peripheral Role
          High Duty Cycle Directed Advertising State
            and Connection State (Central Role)
            and Central Role & Peripheral Role
          Low Duty Cycle Directed Advertising State
            and Connection State (Central Role)
            and Central Role & Peripheral Role
          Connectable Advertising State
            and Connection State (Peripheral Role)
            and Central Role & Peripheral Role
          High Duty Cycle Directed Advertising State
            and Connection State (Peripheral Role)
            and Peripheral Role & Peripheral Role
          Low Duty Cycle Directed Advertising State
            and Connection State (Peripheral Role)
            and Peripheral Role & Peripheral Role
          Initiating State
            and Connection State (Peripheral Role)
            and Central Role & Peripheral Role
< HCI Command: LE Read Maximum Data.. (0x08|0x002f) plen 0  #23 [hci1] 1.074808
> HCI Event: Command Complete (0x0e) plen 12                #24 [hci1] 1.075355
      LE Read Maximum Data Length (0x08|0x002f) ncmd 1
        Status: Success (0x00)
        Max TX octets: 251
        Max TX time: 2704
        Max RX octets: 251
        Max RX time: 2704
< HCI Command: LE Write Suggested D.. (0x08|0x0024) plen 4  #25 [hci1] 1.094782
        TX octets: 251
        TX time: 2704
> HCI Event: Command Complete (0x0e) plen 4                 #26 [hci1] 1.095213
      LE Write Suggested Default Data Length (0x08|0x0024) ncmd 1
        Status: Success (0x00)
< HCI Command: LE Read Resolving Li.. (0x08|0x002a) plen 0  #27 [hci1] 1.114814
> HCI Event: Command Complete (0x0e) plen 5                 #28 [hci1] 1.115221
      LE Read Resolving List Size (0x08|0x002a) ncmd 1
        Status: Success (0x00)
        Size: 8
< HCI Command: LE Set Event Mask (0x08|0x0001) plen 8       #29 [hci1] 1.134797
        Mask: 0x000002023f87fa5e
          LE Advertising Report
          LE Connection Update Complete
          LE Read Remote Used Features Complete
          LE Long Term Key Request
          LE Data Length Change
          LE Enhanced Connection Complete
          LE PHY Update Complete
          LE Extended Advertising Report
          LE Periodic Advertising Sync Established
          LE Periodic Advertising Report
          LE Periodic Advertising Sync Lost
          LE Extended Scan Timeout
          LE Extended Advertising Set Terminated
          LE Scan Request Received
          LE Periodic Advertising Sync Transfer Rvc
          LE CIS Established
          LE CIS Request
          LE Create BIG Complete
          LE Terminate BIG Complete
          LE BIG Sync Estabilished Complete
          LE BIG Sync Lost
          LE BIG Info Advertising Report
          Unknown mask (0x0000020000000000)
> HCI Event: Command Complete (0x0e) plen 4                 #30 [hci1] 1.135334
      LE Set Event Mask (0x08|0x0001) ncmd 1
        Status: Success (0x00)
< HCI Command: Set Event Mask (0x03|0x0001) plen 8          #31 [hci1] 1.154777
        Mask: 0x2000800002008890
          Disconnection Complete
          Encryption Change
          Read Remote Version Information Complete
          Hardware Error
          Data Buffer Overflow
          Encryption Key Refresh Complete
          LE Meta
> HCI Event: Command Complete (0x0e) plen 4                 #32 [hci1] 1.155238
      Set Event Mask (0x03|0x0001) ncmd 1
        Status: Success (0x00)
< HCI Command: Read BD ADDR (0x04|0x0009) plen 0            #33 [hci1] 1.174810
> HCI Event: Command Complete (0x0e) plen 10                #34 [hci1] 1.175231
      Read BD ADDR (0x04|0x0009) ncmd 1
        Status: Success (0x00)
        Address: 00:00:00:00:00:00 (OUI 00-00-00)
< HCI Command: LE Set Random Address (0x08|0x0005) plen 6   #35 [hci1] 1.194823
        Address: D5:B6:CC:31:DB:3B (Static)
> HCI Event: Command Complete (0x0e) plen 4                 #36 [hci1] 1.195429
      LE Set Random Address (0x08|0x0005) ncmd 1
        Status: Success (0x00)
< HCI Command: LE Set Extended Adv.. (0x08|0x0036) plen 25  #37 [hci1] 3.734899
        Handle: 0x00
        Properties: 0x0013
          Connectable
          Scannable
          Use legacy advertising PDUs: ADV_IND
        Min advertising interval: 100.000 msec (0x00a0)
        Max advertising interval: 150.000 msec (0x00f0)
        Channel map: 37, 38, 39 (0x07)
        Own address type: Random (0x01)
        Peer address type: Public (0x00)
        Peer address: 00:00:00:00:00:00 (OUI 00-00-00)
        Filter policy: Allow Scan Request from Any, Allow Connect Request from Any (0x00)
        TX power: Host has no preference (0x7f)
        Primary PHY: LE 1M (0x01)
        Secondary max skip: 0x00
        Secondary PHY: LE 1M (0x01)
        SID: 0x00
        Scan request notifications: Disabled (0x00)
> HCI Event: Command Complete (0x0e) plen 5                 #38 [hci1] 3.735670
      LE Set Extended Advertising Parameters (0x08|0x0036) ncmd 1
        Status: Success (0x00)
        TX power (selected): 0 dbm (0x00)
< HCI Command: LE Set Advertising S.. (0x08|0x0035) plen 7  #39 [hci1] 3.754844
        Advertising handle: 0x00
        Advertising random address: D5:B6:CC:31:DB:3B (Static)
> HCI Event: Command Complete (0x0e) plen 4                 #40 [hci1] 3.755435
      LE Set Advertising Set Random Address (0x08|0x0035) ncmd 1
        Status: Success (0x00)
< HCI Command: LE Set Extended Adv.. (0x08|0x0037) plen 22  #41 [hci1] 3.775021
        Handle: 0x00
        Operation: Complete extended advertising data (0x03)
        Fragment preference: Minimize fragmentation (0x01)
        Data length: 0x12
        Flags: 0x06
          LE General Discoverable Mode
          BR/EDR Not Supported
        Name (complete): Tester_F6B11A
> HCI Event: Command Complete (0x0e) plen 4                 #42 [hci1] 3.776188
      LE Set Extended Advertising Data (0x08|0x0037) ncmd 1
        Status: Success (0x00)
< HCI Command: LE Set Extended Scan.. (0x08|0x0038) plen 4  #43 [hci1] 3.794832
        Handle: 0x00
        Operation: Complete scan response data (0x03)
        Fragment preference: Minimize fragmentation (0x01)
        Data length: 0x00
> HCI Event: Command Complete (0x0e) plen 4                 #44 [hci1] 3.795287
      LE Set Extended Scan Response Data (0x08|0x0038) ncmd 1
        Status: Success (0x00)
< HCI Command: LE Set Extended Adve.. (0x08|0x0039) plen 6  #45 [hci1] 3.814852
        Extended advertising: Enabled (0x01)
        Number of sets: 1 (0x01)
        Entry 0
          Handle: 0x00
          Duration: 0 ms (0x00)
          Max ext adv events: 0
> HCI Event: Command Complete (0x0e) plen 4                 #46 [hci1] 3.815380
      LE Set Extended Advertising Enable (0x08|0x0039) ncmd 1
        Status: Success (0x00)
> HCI Event: LE Meta Event (0x3e) plen 31                   #47 [hci1] 3.923469
      LE Enhanced Connection Complete (0x0a)
        Status: Success (0x00)
        Handle: 831
        Role: Peripheral (0x01)
        Peer address type: Public (0x00)
        Peer address: DF:A9:FF:F6:B1:1A (OUI DF-A9-FF)
        Local resolvable private address: 00:00:00:00:00:00 (Non-Resolvable)
        Peer resolvable private address: 00:00:00:00:00:00 (Non-Resolvable)
        Connection interval: 87.50 msec (0x0046)
        Connection latency: 0 (0x0000)
        Supervision timeout: 25120 msec (0x09d0)
        Central clock accuracy: 0x01
> HCI Event: LE Meta Event (0x3e) plen 6                    #48 [hci1] 3.923621
      LE Advertising Set Terminated (0x12)
        Status: Success (0x00)
        Handle: 0
        Connection handle: 831
        Number of completed extended advertising events: 0
< HCI Command: LE Read Remote Used... (0x08|0x0016) plen 2  #49 [hci1] 3.935940
        Handle: 831 Address: DF:A9:FF:F6:B1:1A (OUI DF-A9-FF)
< ACL Data TX: Handle 831 flags 0x00 dlen 7                 #50 [hci1] 3.935966
      ATT: Exchange MTU Request (0x02) len 2
        Client RX MTU: 251
> HCI Event: Command Status (0x0f) plen 4                   #51 [hci1] 3.936554
      LE Read Remote Used Features (0x08|0x0016) ncmd 1
        Status: Success (0x00)
> HCI Event: Number of Completed Packets (0x13) plen 5      #52 [hci1] 4.099398
        Num handles: 1
        Handle: 831 Address: DF:A9:FF:F6:B1:1A (OUI DF-A9-FF)
        Count: 1
        #50: len 7 (0 Kb/s)
        Latency: 163 msec (163-163 msec ~163 msec)
> HCI Event: LE Meta Event (0x3e) plen 12                   #53 [hci1] 4.187354
      LE Read Remote Used Features (0x04)
        Status: Success (0x00)
        Handle: 831 Address: DF:A9:FF:F6:B1:1A (OUI DF-A9-FF)
        Features: 0x2d 0x49 0x00 0xf7 0x67 0xd9 0x00 0x80
          LE Encryption
          Extended Reject Indication
          Peripheral-initiated Features Exchange
          LE Data Packet Length Extension
          LE 2M PHY
          LE Coded PHY
          Channel Selection Algorithm #2
          Periodic Advertising Sync Transfer - Sender
          Periodic Advertising Sync Transfer - Recipient
          Sleep Clock Accuracy Updates
          Connected Isochronous Stream - Central
          Connected Isochronous Stream - Peripheral
          Isochronous Broadcaster
          Synchronized Receiver
          Connected Isochronous Stream (Host Support)
          LE Power Control Request
          LE Power Control Request
          Connection Subrating
          Connection Subrating (Host Support)
          Unknown features (0x8000d90000000000)
> ACL Data RX: Handle 831 flags 0x02 dlen 11                #54 [hci1] 6.637150
      SMP: Pairing Request (0x01) len 6
        IO capability: KeyboardDisplay (0x04)
        OOB data: Authentication data not present (0x00)
        Authentication requirement: Bonding, MITM, SC, No Keypresses (0x0d)
        Max encryption key size: 16
        Initiator key distribution: EncKey IdKey (0x03)
        Responder key distribution: EncKey IdKey Sign (0x07)
< HCI Command: Host Number of Compl.. (0x03|0x0035) plen 5  #55 [hci1] 6.655351
        Num handles: 1
        Handle: 831 Address: DF:A9:FF:F6:B1:1A (OUI DF-A9-FF)
        Count: 1
< ACL Data TX: Handle 831 flags 0x00 dlen 11                #56 [hci1] 6.655479
      SMP: Pairing Response (0x02) len 6
        IO capability: DisplayOnly (0x00)
        OOB data: Authentication data not present (0x00)
        Authentication requirement: Bonding, No MITM, SC, No Keypresses (0x09)
        Max encryption key size: 16
        Initiator key distribution: IdKey (0x02)
        Responder key distribution: <none> (0x00)
> ACL Data RX: Handle 831 flags 0x02 dlen 7                 #57 [hci1] 6.724438
      ATT: Exchange MTU Response (0x03) len 2
        Server RX MTU: 23
< HCI Command: Host Number of Compl.. (0x03|0x0035) plen 5  #58 [hci1] 6.735292
        Num handles: 1
        Handle: 831 Address: DF:A9:FF:F6:B1:1A (OUI DF-A9-FF)
        Count: 1
> HCI Event: Number of Completed Packets (0x13) plen 5      #59 [hci1] 6.812135
        Num handles: 1
        Handle: 831 Address: DF:A9:FF:F6:B1:1A (OUI DF-A9-FF)
        Count: 1
        #56: len 11 (0 Kb/s)
        Latency: 156 msec (156-163 msec ~160 msec)
> ACL Data RX: Handle 831 flags 0x02 dlen 27                #60 [hci1] 6.812569
> ACL Data RX: Handle 831 flags 0x01 dlen 27                #61 [hci1] 6.813046
> ACL Data RX: Handle 831 flags 0x01 dlen 15                #62 [hci1] 6.813525
      SMP: Pairing Public Key (0x0c) len 64
        X: 6d0769247b3b97f47aea20c9484b4e1778c567f7d6481cf83758c1e5db1da2f8
        Y: 2f75f66be072cab3fe338ec879164cb4534fe0094077cad82b403407f3f7ccb4
< HCI Command: Host Number of Compl.. (0x03|0x0035) plen 5  #63 [hci1] 6.815685
        Num handles: 1
        Handle: 831 Address: DF:A9:FF:F6:B1:1A (OUI DF-A9-FF)
        Count: 1
< HCI Command: Host Number of Compl.. (0x03|0x0035) plen 5  #64 [hci1] 6.815984
        Num handles: 1
        Handle: 831 Address: DF:A9:FF:F6:B1:1A (OUI DF-A9-FF)
        Count: 1
< HCI Command: Host Number of Compl.. (0x03|0x0035) plen 5  #65 [hci1] 6.816366
        Num handles: 1
        Handle: 831 Address: DF:A9:FF:F6:B1:1A (OUI DF-A9-FF)
        Count: 1
< ACL Data TX: Handle 831 flags 0x00 dlen 27                #66 [hci1] 6.816533
< ACL Data TX: Handle 831 flags 0x01 dlen 27                #67 [hci1] 6.816542
< ACL Data TX: Handle 831 flags 0x01 dlen 15                #68 [hci1] 6.816570
      SMP: Pairing Public Key (0x0c) len 64
        X: 98308440221e2d910f0e54b71e7ec652857aa9b5a0dc65028824cc19db1226e9
        Y: 67a4816bcb62efb21701e31fdb27561a6217575fb007a8bbdabe7e28b6f68482
> HCI Event: Number of Completed Packets (0x13) plen 5      #69 [hci1] 6.900055
        Num handles: 1
        Handle: 831 Address: DF:A9:FF:F6:B1:1A (OUI DF-A9-FF)
        Count: 1
        #66: len 27 (2 Kb/s)
        Latency: 83 msec (83-163 msec ~121 msec)
> HCI Event: Number of Completed Packets (0x13) plen 5      #70 [hci1] 6.900721
        Num handles: 1
        Handle: 831 Address: DF:A9:FF:F6:B1:1A (OUI DF-A9-FF)
        Count: 1
        #67: len 27 (2 Kb/s)
        Latency: 84 msec (83-163 msec ~102 msec)
> HCI Event: Number of Completed Packets (0x13) plen 5      #71 [hci1] 6.986884
        Num handles: 1
        Handle: 831 Address: DF:A9:FF:F6:B1:1A (OUI DF-A9-FF)
        Count: 1
        #68: len 15 (0 Kb/s)
        Latency: 170 msec (83-170 msec ~136 msec)
> ACL Data RX: Handle 831 flags 0x02 dlen 21                #72 [hci1] 7.949817
      SMP: Pairing Confirm (0x03) len 16
        Confim value: b8a7a736587957f396ef5a1359ee332e
< HCI Command: Host Number of Compl.. (0x03|0x0035) plen 5  #73 [hci1] 7.955551
        Num handles: 1
        Handle: 831 Address: DF:A9:FF:F6:B1:1A (OUI DF-A9-FF)
        Count: 1
< ACL Data TX: Handle 831 flags 0x00 dlen 21                #74 [hci1] 7.955661
      SMP: Pairing Confirm (0x03) len 16
        Confim value: ec2610fe4891bad6f15e8fc09c5cb875
> HCI Event: Number of Completed Packets (0x13) plen 5      #75 [hci1] 8.124605
        Num handles: 1
        Handle: 831 Address: DF:A9:FF:F6:B1:1A (OUI DF-A9-FF)
        Count: 1
        #74: len 21 (1 Kb/s)
        Latency: 168 msec (83-170 msec ~152 msec)
> ACL Data RX: Handle 831 flags 0x02 dlen 21                #76 [hci1] 8.124904
      SMP: Pairing Random (0x04) len 16
        Random value: c47ffadd40f2fa9b0000000000000000
< HCI Command: Host Number of Compl.. (0x03|0x0035) plen 5  #77 [hci1] 8.135803
        Num handles: 1
        Handle: 831 Address: DF:A9:FF:F6:B1:1A (OUI DF-A9-FF)
        Count: 1
< ACL Data TX: Handle 831 flags 0x00 dlen 21                #78 [hci1] 8.135928
      SMP: Pairing Random (0x04) len 16
        Random value: 8e6108f966a694cbe26df70bb96773e6
> HCI Event: Number of Completed Packets (0x13) plen 5      #79 [hci1] 8.299433
        Num handles: 1
        Handle: 831 Address: DF:A9:FF:F6:B1:1A (OUI DF-A9-FF)
        Count: 1
        #78: len 21 (1 Kb/s)
        Latency: 163 msec (83-170 msec ~158 msec)
> ACL Data RX: Handle 831 flags 0x02 dlen 21                #80 [hci1] 8.387291
      SMP: Pairing Confirm (0x03) len 16
        Confim value: f9ce34b2939a73f1f88a620e6658bd1d
< HCI Command: Host Number of Compl.. (0x03|0x0035) plen 5  #81 [hci1] 8.395275
        Num handles: 1
        Handle: 831 Address: DF:A9:FF:F6:B1:1A (OUI DF-A9-FF)
        Count: 1
< ACL Data TX: Handle 831 flags 0x00 dlen 21                #82 [hci1] 8.395351
      SMP: Pairing Confirm (0x03) len 16
        Confim value: 9ca55e8ba4c05508f41f5596a2c78a39
> HCI Event: Number of Completed Packets (0x13) plen 5      #83 [hci1] 8.562077
        Num handles: 1
        Handle: 831 Address: DF:A9:FF:F6:B1:1A (OUI DF-A9-FF)
        Count: 1
        #82: len 21 (1 Kb/s)
        Latency: 166 msec (83-170 msec ~162 msec)
> ACL Data RX: Handle 831 flags 0x02 dlen 21                #84 [hci1] 8.562426
      SMP: Pairing Random (0x04) len 16
        Random value: ca3dc1d9540d59e30000000000000000
< HCI Command: Host Number of Compl.. (0x03|0x0035) plen 5  #85 [hci1] 8.575661
        Num handles: 1
        Handle: 831 Address: DF:A9:FF:F6:B1:1A (OUI DF-A9-FF)
        Count: 1
< ACL Data TX: Handle 831 flags 0x00 dlen 21                #86 [hci1] 8.575809
      SMP: Pairing Random (0x04) len 16
        Random value: 4d02679f89a05211af56d8b3da64d21e
> HCI Event: Number of Completed Packets (0x13) plen 5      #87 [hci1] 8.736845
        Num handles: 1
        Handle: 831 Address: DF:A9:FF:F6:B1:1A (OUI DF-A9-FF)
        Count: 1
        #86: len 21 (1 Kb/s)
        Latency: 161 msec (83-170 msec ~161 msec)
> ACL Data RX: Handle 831 flags 0x02 dlen 21                #88 [hci1] 8.824730
      SMP: Pairing Confirm (0x03) len 16
        Confim value: 8377bc1355a09384d952e57a761d7079
< HCI Command: Host Number of Compl.. (0x03|0x0035) plen 5  #89 [hci1] 8.835542
        Num handles: 1
        Handle: 831 Address: DF:A9:FF:F6:B1:1A (OUI DF-A9-FF)
        Count: 1
< ACL Data TX: Handle 831 flags 0x00 dlen 21                #90 [hci1] 8.835706
      SMP: Pairing Confirm (0x03) len 16
        Confim value: 063fb4153d9db75edf37aff0432088f0
> HCI Event: Number of Completed Packets (0x13) plen 5      #91 [hci1] 8.999616
        Num handles: 1
        Handle: 831 Address: DF:A9:FF:F6:B1:1A (OUI DF-A9-FF)
        Count: 1
        #90: len 21 (1 Kb/s)
        Latency: 163 msec (83-170 msec ~162 msec)
> ACL Data RX: Handle 831 flags 0x02 dlen 21                #92 [hci1] 8.999968
      SMP: Pairing Random (0x04) len 16
        Random value: 3f64ff7ad507a8000000000000000000
< HCI Command: Host Number of Compl.. (0x03|0x0035) plen 5  #93 [hci1] 9.015782
        Num handles: 1
        Handle: 831 Address: DF:A9:FF:F6:B1:1A (OUI DF-A9-FF)
        Count: 1
< ACL Data TX: Handle 831 flags 0x00 dlen 21                #94 [hci1] 9.015938
      SMP: Pairing Random (0x04) len 16
        Random value: 5e8286bc235a02440d0c3424a2acf8fd
> HCI Event: Number of Completed Packets (0x13) plen 5      #95 [hci1] 9.174380
        Num handles: 1
        Handle: 831 Address: DF:A9:FF:F6:B1:1A (OUI DF-A9-FF)
        Count: 1
        #94: len 21 (1 Kb/s)
        Latency: 158 msec (83-170 msec ~160 msec)
> ACL Data RX: Handle 831 flags 0x02 dlen 21                #96 [hci1] 9.262232
      SMP: Pairing Confirm (0x03) len 16
        Confim value: 2a9243639ab89a74475a583402043b4c
< HCI Command: Host Number of Compl.. (0x03|0x0035) plen 5  #97 [hci1] 9.275455
        Num handles: 1
        Handle: 831 Address: DF:A9:FF:F6:B1:1A (OUI DF-A9-FF)
        Count: 1
< ACL Data TX: Handle 831 flags 0x00 dlen 21                #98 [hci1] 9.275531
      SMP: Pairing Confirm (0x03) len 16
        Confim value: adac8dc645d14bf6685f15c39cd5b302
> HCI Event: Number of Completed Packets (0x13) plen 5      #99 [hci1] 9.437086
        Num handles: 1
        Handle: 831 Address: DF:A9:FF:F6:B1:1A (OUI DF-A9-FF)
        Count: 1
        #98: len 21 (1 Kb/s)
        Latency: 161 msec (83-170 msec ~161 msec)
> ACL Data RX: Handle 831 flags 0x02 dlen 21               #100 [hci1] 9.437420
      SMP: Pairing Random (0x04) len 16
        Random value: 4bb0b0e7dfb528df0000000000000000
< HCI Command: Host Number of Comp.. (0x03|0x0035) plen 5  #101 [hci1] 9.455724
        Num handles: 1
        Handle: 831 Address: DF:A9:FF:F6:B1:1A (OUI DF-A9-FF)
        Count: 1
< ACL Data TX: Handle 831 flags 0x00 dlen 21               #102 [hci1] 9.455876
      SMP: Pairing Random (0x04) len 16
        Random value: 5c4a1bcadd27bd58e945097b00bad7ac
> HCI Event: Number of Completed Packets (0x13) plen 5     #103 [hci1] 9.611879
        Num handles: 1
        Handle: 831 Address: DF:A9:FF:F6:B1:1A (OUI DF-A9-FF)
        Count: 1
        #102: len 21 (1 Kb/s)
        Latency: 156 msec (83-170 msec ~158 msec)
> ACL Data RX: Handle 831 flags 0x02 dlen 21               #104 [hci1] 9.699790
      SMP: Pairing Confirm (0x03) len 16
        Confim value: 12dddb6745859591adb3d1d64229da50
< HCI Command: Host Number of Comp.. (0x03|0x0035) plen 5  #105 [hci1] 9.715392
        Num handles: 1
        Handle: 831 Address: DF:A9:FF:F6:B1:1A (OUI DF-A9-FF)
        Count: 1
< ACL Data TX: Handle 831 flags 0x00 dlen 21               #106 [hci1] 9.715569
      SMP: Pairing Confirm (0x03) len 16
        Confim value: 6e088af93293f38d85920db9022b3b1f
> HCI Event: Number of Completed Packets (0x13) plen 5     #107 [hci1] 9.874534
        Num handles: 1
        Handle: 831 Address: DF:A9:FF:F6:B1:1A (OUI DF-A9-FF)
        Count: 1
        #106: len 21 (1 Kb/s)
        Latency: 158 msec (83-170 msec ~158 msec)
> ACL Data RX: Handle 831 flags 0x02 dlen 21               #108 [hci1] 9.874881
      SMP: Pairing Random (0x04) len 16
        Random value: 49a0680166d3ff170000000000000000
< HCI Command: Host Number of Comp.. (0x03|0x0035) plen 5  #109 [hci1] 9.875662
        Num handles: 1
        Handle: 831 Address: DF:A9:FF:F6:B1:1A (OUI DF-A9-FF)
        Count: 1
< ACL Data TX: Handle 831 flags 0x00 dlen 21               #110 [hci1] 9.875715
      SMP: Pairing Random (0x04) len 16
        Random value: 32527e6e64e79f33b2e374394db8ab2d
> HCI Event: Number of Completed Packets (0x13) plen 5    #111 [hci1] 10.049334
        Num handles: 1
        Handle: 831 Address: DF:A9:FF:F6:B1:1A (OUI DF-A9-FF)
        Count: 1
        #110: len 21 (0 Kb/s)
        Latency: 173 msec (83-173 msec ~166 msec)
> ACL Data RX: Handle 831 flags 0x02 dlen 21              #112 [hci1] 10.137178
      SMP: Pairing Confirm (0x03) len 16
        Confim value: dedbe7eedf6e78e3e21d1f2b28222864
< HCI Command: Host Number of Com.. (0x03|0x0035) plen 5  #113 [hci1] 10.155317
        Num handles: 1
        Handle: 831 Address: DF:A9:FF:F6:B1:1A (OUI DF-A9-FF)
        Count: 1
< ACL Data TX: Handle 831 flags 0x00 dlen 21              #114 [hci1] 10.155454
      SMP: Pairing Confirm (0x03) len 16
        Confim value: 4fc8aad182ce41d226a8c1df3386484f
> HCI Event: Number of Completed Packets (0x13) plen 5    #115 [hci1] 10.312113
        Num handles: 1
        Handle: 831 Address: DF:A9:FF:F6:B1:1A (OUI DF-A9-FF)
        Count: 1
        #114: len 21 (1 Kb/s)
        Latency: 156 msec (83-173 msec ~161 msec)
> ACL Data RX: Handle 831 flags 0x02 dlen 21              #116 [hci1] 10.312398
      SMP: Pairing Random (0x04) len 16
        Random value: 9c04468e0346dece0000000000000000
< HCI Command: Host Number of Com.. (0x03|0x0035) plen 5  #117 [hci1] 10.315692
        Num handles: 1
        Handle: 831 Address: DF:A9:FF:F6:B1:1A (OUI DF-A9-FF)
        Count: 1
< ACL Data TX: Handle 831 flags 0x00 dlen 21              #118 [hci1] 10.315863
      SMP: Pairing Random (0x04) len 16
        Random value: dddbdfe2838e9a8cc6964353c850fef7
> HCI Event: Number of Completed Packets (0x13) plen 5    #119 [hci1] 10.486830
        Num handles: 1
        Handle: 831 Address: DF:A9:FF:F6:B1:1A (OUI DF-A9-FF)
        Count: 1
        #118: len 21 (0 Kb/s)
        Latency: 170 msec (83-173 msec ~166 msec)
> ACL Data RX: Handle 831 flags 0x02 dlen 21              #120 [hci1] 10.574711
      SMP: Pairing Confirm (0x03) len 16
        Confim value: b77a7acce7f2096c73b49ee33821a4d2
< HCI Command: Host Number of Com.. (0x03|0x0035) plen 5  #121 [hci1] 10.575331
        Num handles: 1
        Handle: 831 Address: DF:A9:FF:F6:B1:1A (OUI DF-A9-FF)
        Count: 1
< ACL Data TX: Handle 831 flags 0x00 dlen 21              #122 [hci1] 10.575505
      SMP: Pairing Confirm (0x03) len 16
        Confim value: 179245f4b7c5798031cdef2064fa751e
> HCI Event: Number of Completed Packets (0x13) plen 5    #123 [hci1] 10.749537
        Num handles: 1
        Handle: 831 Address: DF:A9:FF:F6:B1:1A (OUI DF-A9-FF)
        Count: 1
        #122: len 21 (0 Kb/s)
        Latency: 174 msec (83-174 msec ~170 msec)
> ACL Data RX: Handle 831 flags 0x02 dlen 21              #124 [hci1] 10.749838
      SMP: Pairing Random (0x04) len 16
        Random value: a0b94cf1d14183520000000000000000
< HCI Command: Host Number of Com.. (0x03|0x0035) plen 5  #125 [hci1] 10.755700
        Num handles: 1
        Handle: 831 Address: DF:A9:FF:F6:B1:1A (OUI DF-A9-FF)
        Count: 1
< ACL Data TX: Handle 831 flags 0x00 dlen 21              #126 [hci1] 10.755880
      SMP: Pairing Random (0x04) len 16
        Random value: eb9f1915536596b6fc3db1c86b2b1970
> HCI Event: Number of Completed Packets (0x13) plen 5    #127 [hci1] 10.924302
        Num handles: 1
        Handle: 831 Address: DF:A9:FF:F6:B1:1A (OUI DF-A9-FF)
        Count: 1
        #126: len 21 (1 Kb/s)
        Latency: 168 msec (83-174 msec ~169 msec)
> ACL Data RX: Handle 831 flags 0x02 dlen 21              #128 [hci1] 11.012213
      SMP: Pairing Confirm (0x03) len 16
        Confim value: 4a73722f1069cafb199900d526a7a4c8
< HCI Command: Host Number of Com.. (0x03|0x0035) plen 5  #129 [hci1] 11.015626
        Num handles: 1
        Handle: 831 Address: DF:A9:FF:F6:B1:1A (OUI DF-A9-FF)
        Count: 1
< ACL Data TX: Handle 831 flags 0x00 dlen 21              #130 [hci1] 11.015764
      SMP: Pairing Confirm (0x03) len 16
        Confim value: ca37b756e0ad123ee5c9fdf49f9e6325
> HCI Event: Number of Completed Packets (0x13) plen 5    #131 [hci1] 11.187003
        Num handles: 1
        Handle: 831 Address: DF:A9:FF:F6:B1:1A (OUI DF-A9-FF)
        Count: 1
        #130: len 21 (0 Kb/s)
        Latency: 171 msec (83-174 msec ~170 msec)
> ACL Data RX: Handle 831 flags 0x02 dlen 21              #132 [hci1] 11.187485
      SMP: Pairing Random (0x04) len 16
        Random value: dbde66d317129bfc0000000000000000
< HCI Command: Host Number of Com.. (0x03|0x0035) plen 5  #133 [hci1] 11.195804
        Num handles: 1
        Handle: 831 Address: DF:A9:FF:F6:B1:1A (OUI DF-A9-FF)
        Count: 1
< ACL Data TX: Handle 831 flags 0x00 dlen 21              #134 [hci1] 11.195990
      SMP: Pairing Random (0x04) len 16
        Random value: 5c794dc9ad9f2c3f295ebd5ad5e1c3cf
> HCI Event: Number of Completed Packets (0x13) plen 5    #135 [hci1] 11.361850
        Num handles: 1
        Handle: 831 Address: DF:A9:FF:F6:B1:1A (OUI DF-A9-FF)
        Count: 1
        #134: len 21 (1 Kb/s)
        Latency: 165 msec (83-174 msec ~168 msec)
> ACL Data RX: Handle 831 flags 0x02 dlen 21              #136 [hci1] 11.449659
      SMP: Pairing Confirm (0x03) len 16
        Confim value: 0a1e1b6cf4ae699a0f55e5731fcd0ab4
< HCI Command: Host Number of Com.. (0x03|0x0035) plen 5  #137 [hci1] 11.455552
        Num handles: 1
        Handle: 831 Address: DF:A9:FF:F6:B1:1A (OUI DF-A9-FF)
        Count: 1
< ACL Data TX: Handle 831 flags 0x00 dlen 21              #138 [hci1] 11.455706
      SMP: Pairing Confirm (0x03) len 16
        Confim value: 8efdd991ea3b3d17a853dbe5f0d06719
> HCI Event: Number of Completed Packets (0x13) plen 5    #139 [hci1] 11.624571
        Num handles: 1
        Handle: 831 Address: DF:A9:FF:F6:B1:1A (OUI DF-A9-FF)
        Count: 1
        #138: len 21 (1 Kb/s)
        Latency: 168 msec (83-174 msec ~168 msec)
> ACL Data RX: Handle 831 flags 0x02 dlen 21              #140 [hci1] 11.624862
      SMP: Pairing Random (0x04) len 16
        Random value: a09651b47f4310300000000000000000
< HCI Command: Host Number of Com.. (0x03|0x0035) plen 5  #141 [hci1] 11.635693
        Num handles: 1
        Handle: 831 Address: DF:A9:FF:F6:B1:1A (OUI DF-A9-FF)
        Count: 1
< ACL Data TX: Handle 831 flags 0x00 dlen 21              #142 [hci1] 11.635865
      SMP: Pairing Random (0x04) len 16
        Random value: 5c2fff312cdf99c9491988e877355a9a
> HCI Event: Number of Completed Packets (0x13) plen 5    #143 [hci1] 11.799317
        Num handles: 1
        Handle: 831 Address: DF:A9:FF:F6:B1:1A (OUI DF-A9-FF)
        Count: 1
        #142: len 21 (1 Kb/s)
        Latency: 163 msec (83-174 msec ~165 msec)
> ACL Data RX: Handle 831 flags 0x02 dlen 21              #144 [hci1] 11.887216
      SMP: Pairing Confirm (0x03) len 16
        Confim value: 0f8a32d9a538abaf200567f9d916b1da
< HCI Command: Host Number of Com.. (0x03|0x0035) plen 5  #145 [hci1] 11.895529
        Num handles: 1
        Handle: 831 Address: DF:A9:FF:F6:B1:1A (OUI DF-A9-FF)
        Count: 1
< ACL Data TX: Handle 831 flags 0x00 dlen 21              #146 [hci1] 11.895672
      SMP: Pairing Confirm (0x03) len 16
        Confim value: dc57ae1ddd6428c407b11efafd95ddb8
> HCI Event: Number of Completed Packets (0x13) plen 5    #147 [hci1] 12.062054
        Num handles: 1
        Handle: 831 Address: DF:A9:FF:F6:B1:1A (OUI DF-A9-FF)
        Count: 1
        #146: len 21 (1 Kb/s)
        Latency: 166 msec (83-174 msec ~166 msec)
> ACL Data RX: Handle 831 flags 0x02 dlen 21              #148 [hci1] 12.062343
      SMP: Pairing Random (0x04) len 16
        Random value: 33829236788f52870000000000000000
< HCI Command: Host Number of Com.. (0x03|0x0035) plen 5  #149 [hci1] 12.075721
        Num handles: 1
        Handle: 831 Address: DF:A9:FF:F6:B1:1A (OUI DF-A9-FF)
        Count: 1
< ACL Data TX: Handle 831 flags 0x00 dlen 21              #150 [hci1] 12.075884
      SMP: Pairing Random (0x04) len 16
        Random value: c629a3a987d808e808655d558dfc1155
> HCI Event: Number of Completed Packets (0x13) plen 5    #151 [hci1] 12.236801
        Num handles: 1
        Handle: 831 Address: DF:A9:FF:F6:B1:1A (OUI DF-A9-FF)
        Count: 1
        #150: len 21 (1 Kb/s)
        Latency: 160 msec (83-174 msec ~163 msec)
> ACL Data RX: Handle 831 flags 0x02 dlen 21              #152 [hci1] 12.324644
      SMP: Pairing Confirm (0x03) len 16
        Confim value: 87dd187d609717680dc4a2a05591f3ad
< HCI Command: Host Number of Com.. (0x03|0x0035) plen 5  #153 [hci1] 12.335608
        Num handles: 1
        Handle: 831 Address: DF:A9:FF:F6:B1:1A (OUI DF-A9-FF)
        Count: 1
< ACL Data TX: Handle 831 flags 0x00 dlen 21              #154 [hci1] 12.335775
      SMP: Pairing Confirm (0x03) len 16
        Confim value: fe4ed993df8d7dc5ff51e08375eaf9f1
> HCI Event: Number of Completed Packets (0x13) plen 5    #155 [hci1] 12.499520
        Num handles: 1
        Handle: 831 Address: DF:A9:FF:F6:B1:1A (OUI DF-A9-FF)
        Count: 1
        #154: len 21 (1 Kb/s)
        Latency: 163 msec (83-174 msec ~163 msec)
> ACL Data RX: Handle 831 flags 0x02 dlen 21              #156 [hci1] 12.499912
      SMP: Pairing Random (0x04) len 16
        Random value: 75d37485350a748a0000000000000000
< HCI Command: Host Number of Com.. (0x03|0x0035) plen 5  #157 [hci1] 12.515859
        Num handles: 1
        Handle: 831 Address: DF:A9:FF:F6:B1:1A (OUI DF-A9-FF)
        Count: 1
< ACL Data TX: Handle 831 flags 0x00 dlen 21              #158 [hci1] 12.516024
      SMP: Pairing Random (0x04) len 16
        Random value: 92f20f6ad8f13724432c7fd6001c45ff
> HCI Event: Number of Completed Packets (0x13) plen 5    #159 [hci1] 12.674243
        Num handles: 1
        Handle: 831 Address: DF:A9:FF:F6:B1:1A (OUI DF-A9-FF)
        Count: 1
        #158: len 21 (1 Kb/s)
        Latency: 158 msec (83-174 msec ~160 msec)
> ACL Data RX: Handle 831 flags 0x02 dlen 21              #160 [hci1] 12.762567
      SMP: Pairing Confirm (0x03) len 16
        Confim value: e9a9d7a49d811434a6b21b0417ed9383
< HCI Command: Host Number of Com.. (0x03|0x0035) plen 5  #161 [hci1] 12.775622
        Num handles: 1
        Handle: 831 Address: DF:A9:FF:F6:B1:1A (OUI DF-A9-FF)
        Count: 1
< ACL Data TX: Handle 831 flags 0x00 dlen 21              #162 [hci1] 12.775781
      SMP: Pairing Confirm (0x03) len 16
        Confim value: 9332b2898b22bce2f05e75d5cc7c796e
> HCI Event: Number of Completed Packets (0x13) plen 5    #163 [hci1] 12.936969
        Num handles: 1
        Handle: 831 Address: DF:A9:FF:F6:B1:1A (OUI DF-A9-FF)
        Count: 1
        #162: len 21 (1 Kb/s)
        Latency: 161 msec (83-174 msec ~161 msec)
> ACL Data RX: Handle 831 flags 0x02 dlen 21              #164 [hci1] 12.937285
      SMP: Pairing Random (0x04) len 16
        Random value: 5d77fd42ba3f86fe0000000000000000
< HCI Command: Host Number of Com.. (0x03|0x0035) plen 5  #165 [hci1] 12.955779
        Num handles: 1
        Handle: 831 Address: DF:A9:FF:F6:B1:1A (OUI DF-A9-FF)
        Count: 1
< ACL Data TX: Handle 831 flags 0x00 dlen 21              #166 [hci1] 12.955900
      SMP: Pairing Random (0x04) len 16
        Random value: 23ac32ebbb5e14c8a6b9622f296d277f
> HCI Event: Number of Completed Packets (0x13) plen 5    #167 [hci1] 13.111783
        Num handles: 1
        Handle: 831 Address: DF:A9:FF:F6:B1:1A (OUI DF-A9-FF)
        Count: 1
        #166: len 21 (1 Kb/s)
        Latency: 155 msec (83-174 msec ~158 msec)
> ACL Data RX: Handle 831 flags 0x02 dlen 21              #168 [hci1] 13.199648
      SMP: Pairing Confirm (0x03) len 16
        Confim value: ae9287d5d2284f9f4d532e33565af3e2
< HCI Command: Host Number of Com.. (0x03|0x0035) plen 5  #169 [hci1] 13.215576
        Num handles: 1
        Handle: 831 Address: DF:A9:FF:F6:B1:1A (OUI DF-A9-FF)
        Count: 1
< ACL Data TX: Handle 831 flags 0x00 dlen 21              #170 [hci1] 13.215748
      SMP: Pairing Confirm (0x03) len 16
        Confim value: fe4e90c466c69e7e34c867e73a99a197
> HCI Event: Number of Completed Packets (0x13) plen 5    #171 [hci1] 13.374582
        Num handles: 1
        Handle: 831 Address: DF:A9:FF:F6:B1:1A (OUI DF-A9-FF)
        Count: 1
        #170: len 21 (1 Kb/s)
        Latency: 158 msec (83-174 msec ~158 msec)
> ACL Data RX: Handle 831 flags 0x02 dlen 21              #172 [hci1] 13.374809
      SMP: Pairing Random (0x04) len 16
        Random value: 7750965960ced2ab0000000000000000
< HCI Command: Host Number of Com.. (0x03|0x0035) plen 5  #173 [hci1] 13.375615
        Num handles: 1
        Handle: 831 Address: DF:A9:FF:F6:B1:1A (OUI DF-A9-FF)
        Count: 1
< ACL Data TX: Handle 831 flags 0x00 dlen 21              #174 [hci1] 13.375668
      SMP: Pairing Random (0x04) len 16
        Random value: 297efe85e67448a15f56bd27e3a3cf1d
> HCI Event: Number of Completed Packets (0x13) plen 5    #175 [hci1] 13.549291
        Num handles: 1
        Handle: 831 Address: DF:A9:FF:F6:B1:1A (OUI DF-A9-FF)
        Count: 1
        #174: len 21 (0 Kb/s)
        Latency: 173 msec (83-174 msec ~166 msec)
> ACL Data RX: Handle 831 flags 0x02 dlen 21              #176 [hci1] 13.637188
      SMP: Pairing Confirm (0x03) len 16
        Confim value: d22de9fc61f1765256caa015e0c9120d
< HCI Command: Host Number of Com.. (0x03|0x0035) plen 5  #177 [hci1] 13.655559
        Num handles: 1
        Handle: 831 Address: DF:A9:FF:F6:B1:1A (OUI DF-A9-FF)
        Count: 1
< ACL Data TX: Handle 831 flags 0x00 dlen 21              #178 [hci1] 13.655724
      SMP: Pairing Confirm (0x03) len 16
        Confim value: 6527c1235b60733b83c6dedf28b3f27f
> HCI Event: Number of Completed Packets (0x13) plen 5    #179 [hci1] 13.811956
        Num handles: 1
        Handle: 831 Address: DF:A9:FF:F6:B1:1A (OUI DF-A9-FF)
        Count: 1
        #178: len 21 (1 Kb/s)
        Latency: 156 msec (83-174 msec ~161 msec)
> ACL Data RX: Handle 831 flags 0x02 dlen 21              #180 [hci1] 13.812354
      SMP: Pairing Random (0x04) len 16
        Random value: e66fff924ba9f8430000000000000000
< HCI Command: Host Number of Com.. (0x03|0x0035) plen 5  #181 [hci1] 13.815611
        Num handles: 1
        Handle: 831 Address: DF:A9:FF:F6:B1:1A (OUI DF-A9-FF)
        Count: 1
< ACL Data TX: Handle 831 flags 0x00 dlen 21              #182 [hci1] 13.815777
      SMP: Pairing Random (0x04) len 16
        Random value: 25a9493fd3ce4faf02be7293595bb7c6
> HCI Event: Number of Completed Packets (0x13) plen 5    #183 [hci1] 13.986784
        Num handles: 1
        Handle: 831 Address: DF:A9:FF:F6:B1:1A (OUI DF-A9-FF)
        Count: 1
        #182: len 21 (0 Kb/s)
        Latency: 171 msec (83-174 msec ~166 msec)
> ACL Data RX: Handle 831 flags 0x02 dlen 21              #184 [hci1] 14.074712
      SMP: Pairing Confirm (0x03) len 16
        Confim value: 2985907fd6cb121f9f20ffb2b17a0476
< HCI Command: Host Number of Com.. (0x03|0x0035) plen 5  #185 [hci1] 14.075523
        Num handles: 1
        Handle: 831 Address: DF:A9:FF:F6:B1:1A (OUI DF-A9-FF)
        Count: 1
< ACL Data TX: Handle 831 flags 0x00 dlen 21              #186 [hci1] 14.075626
      SMP: Pairing Confirm (0x03) len 16
        Confim value: aa4b16dda87cd91e5960fb95744fa00d
> HCI Event: Number of Completed Packets (0x13) plen 5    #187 [hci1] 14.249539
        Num handles: 1
        Handle: 831 Address: DF:A9:FF:F6:B1:1A (OUI DF-A9-FF)
        Count: 1
        #186: len 21 (0 Kb/s)
        Latency: 173 msec (83-174 msec ~170 msec)
> ACL Data RX: Handle 831 flags 0x02 dlen 21              #188 [hci1] 14.249876
      SMP: Pairing Random (0x04) len 16
        Random value: d10d523217d6ed100000000000000000
< HCI Command: Host Number of Com.. (0x03|0x0035) plen 5  #189 [hci1] 14.255822
        Num handles: 1
        Handle: 831 Address: DF:A9:FF:F6:B1:1A (OUI DF-A9-FF)
        Count: 1
< ACL Data TX: Handle 831 flags 0x00 dlen 21              #190 [hci1] 14.256006
      SMP: Pairing Random (0x04) len 16
        Random value: 58f6b41f855a6f6c3560debd84e2affc
> HCI Event: Number of Completed Packets (0x13) plen 5    #191 [hci1] 14.424293
        Num handles: 1
        Handle: 831 Address: DF:A9:FF:F6:B1:1A (OUI DF-A9-FF)
        Count: 1
        #190: len 21 (1 Kb/s)
        Latency: 168 msec (83-174 msec ~169 msec)
> ACL Data RX: Handle 831 flags 0x02 dlen 21              #192 [hci1] 14.512152
      SMP: Pairing Confirm (0x03) len 16
        Confim value: 21203993002c594d82a125fd3be8afb7
< HCI Command: Host Number of Com.. (0x03|0x0035) plen 5  #193 [hci1] 14.515188
        Num handles: 1
        Handle: 831 Address: DF:A9:FF:F6:B1:1A (OUI DF-A9-FF)
        Count: 1
< ACL Data TX: Handle 831 flags 0x00 dlen 21              #194 [hci1] 14.515242
      SMP: Pairing Confirm (0x03) len 16
        Confim value: 3f84f7a25769e671e0ca6787666d1b15
> HCI Event: Number of Completed Packets (0x13) plen 5    #195 [hci1] 14.686947
        Num handles: 1
        Handle: 831 Address: DF:A9:FF:F6:B1:1A (OUI DF-A9-FF)
        Count: 1
        #194: len 21 (0 Kb/s)
        Latency: 171 msec (83-174 msec ~170 msec)
> ACL Data RX: Handle 831 flags 0x02 dlen 21              #196 [hci1] 14.687337
      SMP: Pairing Random (0x04) len 16
        Random value: b2281d1b20a487db0000000000000000
< HCI Command: Host Number of Com.. (0x03|0x0035) plen 5  #197 [hci1] 14.695714
        Num handles: 1
        Handle: 831 Address: DF:A9:FF:F6:B1:1A (OUI DF-A9-FF)
        Count: 1
< ACL Data TX: Handle 831 flags 0x00 dlen 21              #198 [hci1] 14.695812
      SMP: Pairing Random (0x04) len 16
        Random value: b67e7216d5bf664139eda2b542549666
> HCI Event: Number of Completed Packets (0x13) plen 5    #199 [hci1] 14.861822
        Num handles: 1
        Handle: 831 Address: DF:A9:FF:F6:B1:1A (OUI DF-A9-FF)
        Count: 1
        #198: len 21 (1 Kb/s)
        Latency: 166 msec (83-174 msec ~168 msec)
> ACL Data RX: Handle 831 flags 0x02 dlen 21              #200 [hci1] 14.949698
      SMP: Pairing Confirm (0x03) len 16
        Confim value: 4e53725e265f1d7102024a55075bfd0d
< HCI Command: Host Number of Com.. (0x03|0x0035) plen 5  #201 [hci1] 14.955214
        Num handles: 1
        Handle: 831 Address: DF:A9:FF:F6:B1:1A (OUI DF-A9-FF)
        Count: 1
< ACL Data TX: Handle 831 flags 0x00 dlen 21              #202 [hci1] 14.955277
      SMP: Pairing Confirm (0x03) len 16
        Confim value: 48b142b3bde0fe70f9b2eb5aecdaf3e6
> HCI Event: Number of Completed Packets (0x13) plen 5    #203 [hci1] 15.124546
        Num handles: 1
        Handle: 831 Address: DF:A9:FF:F6:B1:1A (OUI DF-A9-FF)
        Count: 1
        #202: len 21 (0 Kb/s)
        Latency: 169 msec (83-174 msec ~168 msec)
> ACL Data RX: Handle 831 flags 0x02 dlen 21              #204 [hci1] 15.124810
      SMP: Pairing Random (0x04) len 16
        Random value: 22de6fa9afd60fb40000000000000000
< HCI Command: Host Number of Com.. (0x03|0x0035) plen 5  #205 [hci1] 15.135839
        Num handles: 1
        Handle: 831 Address: DF:A9:FF:F6:B1:1A (OUI DF-A9-FF)
        Count: 1
< ACL Data TX: Handle 831 flags 0x00 dlen 21              #206 [hci1] 15.135974
      SMP: Pairing Random (0x04) len 16
        Random value: ed17f76500c95219dd01e09d1e63f87b
> HCI Event: Number of Completed Packets (0x13) plen 5    #207 [hci1] 15.299269
        Num handles: 1
        Handle: 831 Address: DF:A9:FF:F6:B1:1A (OUI DF-A9-FF)
        Count: 1
        #206: len 21 (1 Kb/s)
        Latency: 163 msec (83-174 msec ~166 msec)
> ACL Data RX: Handle 831 flags 0x02 dlen 21              #208 [hci1] 15.387215
      SMP: Pairing Confirm (0x03) len 16
        Confim value: 0a20253bc53c366fb721f452f55d0958
< HCI Command: Host Number of Com.. (0x03|0x0035) plen 5  #209 [hci1] 15.395350
        Num handles: 1
        Handle: 831 Address: DF:A9:FF:F6:B1:1A (OUI DF-A9-FF)
        Count: 1
< ACL Data TX: Handle 831 flags 0x00 dlen 21              #210 [hci1] 15.395468
      SMP: Pairing Confirm (0x03) len 16
        Confim value: ef9d6bbf1750a6002992e28494b19969
> HCI Event: Number of Completed Packets (0x13) plen 5    #211 [hci1] 15.562021
        Num handles: 1
        Handle: 831 Address: DF:A9:FF:F6:B1:1A (OUI DF-A9-FF)
        Count: 1
        #210: len 21 (1 Kb/s)
        Latency: 166 msec (83-174 msec ~166 msec)
> ACL Data RX: Handle 831 flags 0x02 dlen 21              #212 [hci1] 15.562277
      SMP: Pairing Random (0x04) len 16
        Random value: a477a6a383828bc40000000000000000
< HCI Command: Host Number of Com.. (0x03|0x0035) plen 5  #213 [hci1] 15.575857
        Num handles: 1
        Handle: 831 Address: DF:A9:FF:F6:B1:1A (OUI DF-A9-FF)
        Count: 1
< ACL Data TX: Handle 831 flags 0x00 dlen 21              #214 [hci1] 15.576027
      SMP: Pairing Random (0x04) len 16
        Random value: 81d35d47e1f6006d79c974bd9d9e1ee3
> HCI Event: Number of Completed Packets (0x13) plen 5    #215 [hci1] 15.736703
        Num handles: 1
        Handle: 831 Address: DF:A9:FF:F6:B1:1A (OUI DF-A9-FF)
        Count: 1
        #214: len 21 (1 Kb/s)
        Latency: 160 msec (83-174 msec ~163 msec)
> ACL Data RX: Handle 831 flags 0x02 dlen 21              #216 [hci1] 15.824648
      SMP: Pairing Confirm (0x03) len 16
        Confim value: d87607117889680210ccb25d9c4bdef5
< HCI Command: Host Number of Com.. (0x03|0x0035) plen 5  #217 [hci1] 15.835176
        Num handles: 1
        Handle: 831 Address: DF:A9:FF:F6:B1:1A (OUI DF-A9-FF)
        Count: 1
< ACL Data TX: Handle 831 flags 0x00 dlen 21              #218 [hci1] 15.835276
      SMP: Pairing Confirm (0x03) len 16
        Confim value: e09f549d23c8ecbdf36d1f60323aee1e
> HCI Event: Number of Completed Packets (0x13) plen 5    #219 [hci1] 15.999424
        Num handles: 1
        Handle: 831 Address: DF:A9:FF:F6:B1:1A (OUI DF-A9-FF)
        Count: 1
        #218: len 21 (1 Kb/s)
        Latency: 164 msec (83-174 msec ~163 msec)
> ACL Data RX: Handle 831 flags 0x02 dlen 21              #220 [hci1] 15.999811
      SMP: Pairing Random (0x04) len 16
        Random value: 031f67f6c8c502120000000000000000
< HCI Command: Host Number of Com.. (0x03|0x0035) plen 5  #221 [hci1] 16.015857
        Num handles: 1
        Handle: 831 Address: DF:A9:FF:F6:B1:1A (OUI DF-A9-FF)
        Count: 1
< ACL Data TX: Handle 831 flags 0x00 dlen 21              #222 [hci1] 16.016031
      SMP: Pairing Random (0x04) len 16
        Random value: e7f7e0c2476823e41736a7e381bafb7c
> HCI Event: Number of Completed Packets (0x13) plen 5    #223 [hci1] 16.174190
        Num handles: 1
        Handle: 831 Address: DF:A9:FF:F6:B1:1A (OUI DF-A9-FF)
        Count: 1
        #222: len 21 (1 Kb/s)
        Latency: 158 msec (83-174 msec ~160 msec)
> ACL Data RX: Handle 831 flags 0x02 dlen 21              #224 [hci1] 16.262077
      SMP: Pairing Confirm (0x03) len 16
        Confim value: fa5890ffb9dbea7b330edd4c2b051866
< HCI Command: Host Number of Com.. (0x03|0x0035) plen 5  #225 [hci1] 16.275745
        Num handles: 1
        Handle: 831 Address: DF:A9:FF:F6:B1:1A (OUI DF-A9-FF)
        Count: 1
< ACL Data TX: Handle 831 flags 0x00 dlen 21              #226 [hci1] 16.275845
      SMP: Pairing Confirm (0x03) len 16
        Confim value: 481a3fc597e3bc5e96cdf086f08c410e
> HCI Event: Number of Completed Packets (0x13) plen 5    #227 [hci1] 16.436959
        Num handles: 1
        Handle: 831 Address: DF:A9:FF:F6:B1:1A (OUI DF-A9-FF)
        Count: 1
        #226: len 21 (1 Kb/s)
        Latency: 161 msec (83-174 msec ~161 msec)
> ACL Data RX: Handle 831 flags 0x02 dlen 21              #228 [hci1] 16.437254
      SMP: Pairing Random (0x04) len 16
        Random value: 19e5bf1abba827740000000000000000
< HCI Command: Host Number of Com.. (0x03|0x0035) plen 5  #229 [hci1] 16.455823
        Num handles: 1
        Handle: 831 Address: DF:A9:FF:F6:B1:1A (OUI DF-A9-FF)
        Count: 1
