Bluetooth monitor ver 5.72
btmon[1882708]: = Note: Linux version 6.14.0-36-generic (x86_64)                                                         0.613306
btmon[1882708]: = Note: Bluetooth subsystem version 2.22                                                                 0.613307
= New Index: 00:00:00:00:00:00 (Primary,UART,hci1)                                                                       0.613308
= New Index: 48:5F:99:8E:E0:64 (Primary,USB,hci0)                                                                        0.613309
= Open Index: 00:00:00:00:00:00                                                                                          1.126827
= Index Info: 00:00:00:00:00:00 (Nordic Semiconductor ASA)                                                               1.126841
zephyr.exe[1882710]: @ USER Open: main (privileged) version 2.22                                                {0x0001} 1.126850
zephyr.exe[1882710]: < HCI Command: Reset (0x03|0x0003) plen 0                                                        #1 1.127999
> HCI Event: Command Complete (0x0e) plen 4                                                                           #2 1.128670
      Reset (0x03|0x0003) ncmd 1
        Status: Success (0x00)
zephyr.exe[1882710]: < HCI Command: Read Local Supported Features (0x04|0x0003) plen 0                                #3 1.146737
> HCI Event: Command Complete (0x0e) plen 12                                                                          #4 1.147280
      Read Local Supported Features (0x04|0x0003) ncmd 1
        Status: Success (0x00)
        Features: 0x00 0x00 0x00 0x00 0x60 0x00 0x00 0x00
          BR/EDR Not Supported
          LE Supported (Controller)
zephyr.exe[1882710]: < HCI Command: Read Local Version Information (0x04|0x0001) plen 0                               #5 1.166489
> HCI Event: Command Complete (0x0e) plen 12                                                                          #6 1.167026
      Read Local Version Information (0x04|0x0001) ncmd 1
        Status: Success (0x00)
        HCI version: Reserved (0x0f) - Revision 12393 (0x3069)
        LMP version: Reserved (0x0f) - Subversion 12393 (0x3069)
        Manufacturer: Nordic Semiconductor ASA (89)
zephyr.exe[1882710]: < HCI Command: Read Local Supported Commands (0x04|0x0002) plen 0                                #7 1.186374
> HCI Event: Command Complete (0x0e) plen 68                                                                          #8 1.187404
      Read Local Supported Commands (0x04|0x0002) ncmd 1
        Status: Success (0x00)
        Commands: 119 entries
          Disconnect (Octet 0 - Bit 5)
          Read Remote Version Information (Octet 2 - Bit 7)
          Set Event Mask (Octet 5 - Bit 6)
          Reset (Octet 5 - Bit 7)
          Read Connection Accept Timeout (Octet 7 - Bit 2)
          Write Connection Accept Timeout (Octet 7 - Bit 3)
          Read Transmit Power Level (Octet 10 - Bit 2)
          Set Controller To Host Flow Control (Octet 10 - Bit 5)
          Host Buffer Size (Octet 10 - Bit 6)
          Host Number of Completed Packets (Octet 10 - Bit 7)
          Read Local Version Information (Octet 14 - Bit 3)
          Read Local Supported Features (Octet 14 - Bit 5)
          Read BD ADDR (Octet 15 - Bit 1)
          Read RSSI (Octet 15 - Bit 5)
          Set Event Mask Page 2 (Octet 22 - Bit 2)
          LE Set Event Mask (Octet 25 - Bit 0)
          LE Read Buffer Size (Octet 25 - Bit 1)
          LE Read Local Supported Features (Octet 25 - Bit 2)
          LE Set Random Address (Octet 25 - Bit 4)
          LE Set Advertising Parameters (Octet 25 - Bit 5)
          LE Read Advertising Channel TX Power (Octet 25 - Bit 6)
          LE Set Advertising Data (Octet 25 - Bit 7)
          LE Set Scan Response Data (Octet 26 - Bit 0)
          LE Set Advertise Enable (Octet 26 - Bit 1)
          LE Set Scan Parameters (Octet 26 - Bit 2)
          LE Set Scan Enable (Octet 26 - Bit 3)
          LE Create Connection (Octet 26 - Bit 4)
          LE Create Connection Cancel (Octet 26 - Bit 5)
          LE Read Accept List Size (Octet 26 - Bit 6)
          LE Clear Accept List (Octet 26 - Bit 7)
          LE Add Device To Accept List (Octet 27 - Bit 0)
          LE Remove Device From Accept List (Octet 27 - Bit 1)
          LE Connection Update (Octet 27 - Bit 2)
          LE Set Host Channel Classification (Octet 27 - Bit 3)
          LE Read Channel Map (Octet 27 - Bit 4)
          LE Read Remote Used Features (Octet 27 - Bit 5)
          LE Encrypt (Octet 27 - Bit 6)
          LE Rand (Octet 27 - Bit 7)
          LE Start Encryption (Octet 28 - Bit 0)
          LE Long Term Key Request Reply (Octet 28 - Bit 1)
          LE Long Term Key Request Neg Reply (Octet 28 - Bit 2)
          LE Read Supported States (Octet 28 - Bit 3)
          LE Receiver Test (Octet 28 - Bit 4)
          LE Transmitter Test (Octet 28 - Bit 5)
          LE Test End (Octet 28 - Bit 6)
          Read Authenticated Payload Timeout (Octet 32 - Bit 4)
          Write Authenticated Payload Timeout (Octet 32 - Bit 5)
          LE Set Data Length (Octet 33 - Bit 6)
          LE Read Suggested Default Data Length (Octet 33 - Bit 7)
          LE Write Suggested Default Data Length (Octet 34 - Bit 0)
          LE Add Device To Resolving List (Octet 34 - Bit 3)
          LE Remove Device From Resolving List (Octet 34 - Bit 4)
          LE Clear Resolving List (Octet 34 - Bit 5)
          LE Read Resolving List Size (Octet 34 - Bit 6)
          LE Set Address Resolution Enable (Octet 35 - Bit 1)
          LE Set Resolvable Private Address Timeout (Octet 35 - Bit 2)
          LE Read Maximum Data Length (Octet 35 - Bit 3)
          LE Read PHY (Octet 35 - Bit 4)
          LE Set Default PHY (Octet 35 - Bit 5)
          LE Set PHY (Octet 35 - Bit 6)
          LE Enhanced Receiver Test (Octet 35 - Bit 7)
          LE Enhanced Transmitter Test (Octet 36 - Bit 0)
          LE Set Advertising Set Random Address (Octet 36 - Bit 1)
          LE Set Extended Advertising Parameters (Octet 36 - Bit 2)
          LE Set Extended Advertising Data (Octet 36 - Bit 3)
          LE Set Extended Scan Response Data (Octet 36 - Bit 4)
          LE Set Extended Advertising Enable (Octet 36 - Bit 5)
          LE Read Maximum Advertising Data Length (Octet 36 - Bit 6)
          LE Read Number of Supported Advertising Sets (Octet 36 - Bit 7)
          LE Remove Advertising Set (Octet 37 - Bit 0)
          LE Clear Advertising Sets (Octet 37 - Bit 1)
          LE Set Periodic Advertising Parameters (Octet 37 - Bit 2)
          LE Set Periodic Advertising Data (Octet 37 - Bit 3)
          LE Set Periodic Advertising Enable (Octet 37 - Bit 4)
          LE Set Extended Scan Parameters (Octet 37 - Bit 5)
          LE Set Extended Scan Enable (Octet 37 - Bit 6)
          LE Extended Create Connection (Octet 37 - Bit 7)
          LE Periodic Advertising Create Sync (Octet 38 - Bit 0)
          LE Periodic Advertising Create Sync Cancel (Octet 38 - Bit 1)
          LE Periodic Advertising Terminate Sync (Octet 38 - Bit 2)
          LE Add Device To Periodic Advertiser List (Octet 38 - Bit 3)
          LE Remove Device From Periodic Advertiser List (Octet 38 - Bit 4)
          LE Clear Periodic Advertiser List (Octet 38 - Bit 5)
          LE Read Periodic Advertiser List Size (Octet 38 - Bit 6)
          LE Read Transmit Power (Octet 38 - Bit 7)
          LE Read RF Path Compensation (Octet 39 - Bit 0)
          LE Write RF Path Compensation (Octet 39 - Bit 1)
          LE Set Privacy Mode (Octet 39 - Bit 2)
          LE Periodic Advertising Receive Enable (Octet 40 - Bit 5)
          LE Periodic Advertising Sync Transfer (Octet 40 - Bit 6)
          LE Periodic Advertising Set Info Transfer (Octet 40 - Bit 7)
          LE Periodic Advertising Sync Transfer Parameters (Octet 41 - Bit 0)
          LE Set Default Periodic Advertisng Sync Transfer Parameters (Octet 41 - Bit 1)
          LE Read Buffer v2 (Octet 41 - Bit 5)
          LE Read ISO TX Sync (Octet 41 - Bit 6)
          LE Set Connected Isochronous Group Parameters (Octet 41 - Bit 7)
          LE Set Connected Isochronous Group Parameters Test (Octet 42 - Bit 0)
          LE Create Connected Isochronous Stream (Octet 42 - Bit 1)
          LE Remove Connected Isochronous Group (Octet 42 - Bit 2)
          LE Accept Connected Isochronous Stream Request (Octet 42 - Bit 3)
          LE Reject Connected Isochronous Stream Request (Octet 42 - Bit 4)
          LE Create Broadcast Isochronous Group (Octet 42 - Bit 5)
          LE Create Broadcast Isochronous Group Test (Octet 42 - Bit 6)
          LE Terminate Broadcast Isochronous Group (Octet 42 - Bit 7)
          LE Broadcast Isochronous Group Create Sync (Octet 43 - Bit 0)
          LE Broadcast Isochronous Group Terminate Sync (Octet 43 - Bit 1)
          LE Request Peer SCA (Octet 43 - Bit 2)
          LE Setup Isochronous Data Path (Octet 43 - Bit 3)
          LE Remove Isochronous Data Path (Octet 43 - Bit 4)
          LE Isochronous Transmit Test (Octet 43 - Bit 5)
          LE Isochronous Receive Test (Octet 43 - Bit 6)
          LE Isochronous Read Test Counters (Octet 43 - Bit 7)
          LE Isochronous Read Test Counters (Octet 44 - Bit 0)
          LE Set Host Feature (Octet 44 - Bit 1)
          Octet 44 - Bit 2 
          Octet 45 - Bit 6 
          Octet 46 - Bit 0 
          Octet 46 - Bit 1 
          Octet 46 - Bit 2 
zephyr.exe[1882710]: < HCI Command: Host Buffer Size (0x03|0x0033) plen 7                                             #9 1.206366
        ACL MTU: 255  ACL max packet: 16
        SCO MTU: 0    SCO max packet: 0
> HCI Event: Command Complete (0x0e) plen 4                                                                          #10 1.206933
      Host Buffer Size (0x03|0x0033) ncmd 1
        Status: Success (0x00)
zephyr.exe[1882710]: < HCI Command: Set Controller To Host Flow Control (0x03|0x0031) plen 1                         #11 1.226368
        Flow control: ACL Data Packets (0x01)
> HCI Event: Command Complete (0x0e) plen 4                                                                          #12 1.226849
      Set Controller To Host Flow Control (0x03|0x0031) ncmd 1
        Status: Success (0x00)
zephyr.exe[1882710]: < HCI Command: LE Read Local Supported Features (0x08|0x0003) plen 0                            #13 1.246384
> HCI Event: Command Complete (0x0e) plen 12                                                                         #14 1.246849
      LE Read Local Supported Features (0x08|0x0003) ncmd 1
        Status: Success (0x00)
        Features: 0xfd 0x79 0x00 0xf7 0x30 0x01 0x00 0x00
          LE Encryption
          Extended Reject Indication
          Peripheral-initiated Features Exchange
          LE Ping
          LE Data Packet Length Extension
          LL Privacy
          Extended Scanner Filter Policies
          LE 2M PHY
          LE Coded PHY
          LE Extended Advertising
          LE Periodic Advertising
          Channel Selection Algorithm #2
          Periodic Advertising Sync Transfer - Sender
          Periodic Advertising Sync Transfer - Recipient
          Sleep Clock Accuracy Updates
          Connected Isochronous Stream - Central
          Connected Isochronous Stream - Peripheral
          Isochronous Broadcaster
          Synchronized Receiver
          Periodic Advertising ADI support
          Connection Subrating
          Unknown features (0x0000010000000000)
zephyr.exe[1882710]: < HCI Command: LE Set Host Feature (0x08|0x0074) plen 2                                         #15 1.266379
        Bit Number: 32
          Connected Isochronous Stream (Host Support)
        Bit Value: 1
> HCI Event: Command Complete (0x0e) plen 4                                                                          #16 1.266833
      LE Set Host Feature (0x08|0x0074) ncmd 1
        Status: Success (0x00)
zephyr.exe[1882710]: < HCI Command: LE Read Buffer v2 (0x08|0x0060) plen 0                                           #17 1.286353
> HCI Event: Command Complete (0x0e) plen 10                                                                         #18 1.286875
      LE Read Buffer v2 (0x08|0x0060) ncmd 1
        Status: Success (0x00)
        ACL MTU: 27
        ACL max packet: 3
        ISO MTU: 318
        ISO max packet: 3
zephyr.exe[1882710]: < HCI Command: LE Read Maximum Advertising Data Length (0x08|0x003a) plen 0                     #19 1.306401
> HCI Event: Command Complete (0x0e) plen 6                                                                          #20 1.306842
      LE Read Maximum Advertising Data Length (0x08|0x003a) ncmd 1
        Status: Success (0x00)
        Max length: 1650
zephyr.exe[1882710]: < HCI Command: LE Read Supported States (0x08|0x001c) plen 0                                    #21 1.326379
> HCI Event: Command Complete (0x0e) plen 12                                                                         #22 1.326873
      LE Read Supported States (0x08|0x001c) ncmd 1
        Status: Success (0x00)
        States: 0x000003ff3e0306ff
          Non-connectable Advertising State
          Scannable Advertising State
          Connectable Advertising State
          High Duty Cycle Directed Advertising State
          Passive Scanning State
          Active Scanning State
          Initiating State
            and Connection State (Central Role)
          Connection State (Peripheral Role)
          Scannable Advertising State
            and Passive Scanning State
          Connectable Advertising State
            and Passive Scanning State
          Non-connectable Advertising State
            and Initiating State
          Scannable Advertising State
            and Initiating State
          Active Scanning State
            and Connection State (Central Role)
          Passive Scanning State
            and Connection State (Peripheral Role)
          Active Scanning State
            and Connection State (Peripheral Role)
          Initiating State
            and Connection State (Central Role)
            and Central Role & Central Role
          Low Duty Cycle Directed Advertising State
          Connectable Advertising State
            and Initiating State
            and Central Role & Peripheral Role
          High Duty Cycle Directed Advertising State
            and Initiating State
            and Central Role & Peripheral Role
          Low Duty Cycle Directed Advertising State
            and Initiating State
            and Central Role & Peripheral Role
          Connectable Advertising State
            and Connection State (Central Role)
            and Central Role & Peripheral Role
          High Duty Cycle Directed Advertising State
            and Connection State (Central Role)
            and Central Role & Peripheral Role
          Low Duty Cycle Directed Advertising State
            and Connection State (Central Role)
            and Central Role & Peripheral Role
          Connectable Advertising State
            and Connection State (Peripheral Role)
            and Central Role & Peripheral Role
          High Duty Cycle Directed Advertising State
            and Connection State (Peripheral Role)
            and Peripheral Role & Peripheral Role
          Low Duty Cycle Directed Advertising State
            and Connection State (Peripheral Role)
            and Peripheral Role & Peripheral Role
          Initiating State
            and Connection State (Peripheral Role)
            and Central Role & Peripheral Role
zephyr.exe[1882710]: < HCI Command: LE Read Maximum Data Length (0x08|0x002f) plen 0                                 #23 1.346391
> HCI Event: Command Complete (0x0e) plen 12                                                                         #24 1.346993
      LE Read Maximum Data Length (0x08|0x002f) ncmd 1
        Status: Success (0x00)
        Max TX octets: 251
        Max TX time: 2704
        Max RX octets: 251
        Max RX time: 2704
zephyr.exe[1882710]: < HCI Command: LE Write Suggested Default Data Length (0x08|0x0024) plen 4                      #25 1.366368
        TX octets: 251
        TX time: 2704
> HCI Event: Command Complete (0x0e) plen 4                                                                          #26 1.366869
      LE Write Suggested Default Data Length (0x08|0x0024) ncmd 1
        Status: Success (0x00)
zephyr.exe[1882710]: < HCI Command: LE Read Resolving List Size (0x08|0x002a) plen 0                                 #27 1.386375
> HCI Event: Command Complete (0x0e) plen 5                                                                          #28 1.386797
      LE Read Resolving List Size (0x08|0x002a) ncmd 1
        Status: Success (0x00)
        Size: 8
zephyr.exe[1882710]: < HCI Command: LE Set Event Mask (0x08|0x0001) plen 8                                           #29 1.406384
        Mask: 0x000002023f87fa5e
          LE Advertising Report
          LE Connection Update Complete
          LE Read Remote Used Features Complete
          LE Long Term Key Request
          LE Data Length Change
          LE Enhanced Connection Complete
          LE PHY Update Complete
          LE Extended Advertising Report
          LE Periodic Advertising Sync Established
          LE Periodic Advertising Report
          LE Periodic Advertising Sync Lost
          LE Extended Scan Timeout
          LE Extended Advertising Set Terminated
          LE Scan Request Received
          LE Periodic Advertising Sync Transfer Rvc
          LE CIS Established
          LE CIS Request
          LE Create BIG Complete
          LE Terminate BIG Complete
          LE BIG Sync Estabilished Complete
          LE BIG Sync Lost
          LE BIG Info Advertising Report
          Unknown mask (0x0000020000000000)
> HCI Event: Command Complete (0x0e) plen 4                                                                          #30 1.406908
      LE Set Event Mask (0x08|0x0001) ncmd 1
        Status: Success (0x00)
zephyr.exe[1882710]: < HCI Command: Set Event Mask (0x03|0x0001) plen 8                                              #31 1.426397
        Mask: 0x2000800002008890
          Disconnection Complete
          Encryption Change
          Read Remote Version Information Complete
          Hardware Error
          Data Buffer Overflow
          Encryption Key Refresh Complete
          LE Meta
> HCI Event: Command Complete (0x0e) plen 4                                                                          #32 1.426902
      Set Event Mask (0x03|0x0001) ncmd 1
        Status: Success (0x00)
zephyr.exe[1882710]: < HCI Command: Read BD ADDR (0x04|0x0009) plen 0                                                #33 1.446286
> HCI Event: Command Complete (0x0e) plen 10                                                                         #34 1.446786
      Read BD ADDR (0x04|0x0009) ncmd 1
        Status: Success (0x00)
        Address: 00:00:00:00:00:00 (OUI 00-00-00)
zephyr.exe[1882710]: < HCI Command: LE Set Random Address (0x08|0x0005) plen 6                                       #35 1.466419
        Address: D5:B6:CC:31:DB:3B (Static)
> HCI Event: Command Complete (0x0e) plen 4                                                                          #36 1.466936
      LE Set Random Address (0x08|0x0005) ncmd 1
        Status: Success (0x00)
zephyr.exe[1882710]: < HCI Command: LE Set Extended Advertising Parameters (0x08|0x0036) plen 25                     #37 2.736389
        Handle: 0x00
        Properties: 0x0001
          Connectable
        Min advertising interval: 100.000 msec (0x00a0)
        Max advertising interval: 150.000 msec (0x00f0)
        Channel map: 37, 38, 39 (0x07)
        Own address type: Random (0x01)
        Peer address type: Public (0x00)
        Peer address: 00:00:00:00:00:00 (OUI 00-00-00)
        Filter policy: Allow Scan Request from Any, Allow Connect Request from Any (0x00)
        TX power: Host has no preference (0x7f)
        Primary PHY: LE 1M (0x01)
        Secondary max skip: 0x00
        Secondary PHY: LE 2M (0x02)
        SID: 0x00
        Scan request notifications: Disabled (0x00)
> HCI Event: Command Complete (0x0e) plen 5                                                                          #38 2.737193
      LE Set Extended Advertising Parameters (0x08|0x0036) ncmd 1
        Status: Success (0x00)
        TX power (selected): 0 dbm (0x00)
zephyr.exe[1882710]: < HCI Command: LE Set Advertising Set Random Address (0x08|0x0035) plen 7                       #39 2.746395
        Advertising handle: 0x00
        Advertising random address: D5:B6:CC:31:DB:3B (Static)
> HCI Event: Command Complete (0x0e) plen 4                                                                          #40 2.747036
      LE Set Advertising Set Random Address (0x08|0x0035) ncmd 1
        Status: Success (0x00)
zephyr.exe[1882710]: < HCI Command: LE Set Extended Advertising Data (0x08|0x0037) plen 30                           #41 2.766380
        Handle: 0x00
        Operation: Complete extended advertising data (0x03)
        Fragment preference: Minimize fragmentation (0x01)
        Data length: 0x1a
        Flags: 0x06
          LE General Discoverable Mode
          BR/EDR Not Supported
        Service Data: Common Audio (0x1853)
          Data: 01
        Service Data: Audio Stream Control (0x184e)
          Data: 014400400000
        Resolvable Set Identifier: 48-61-8E-0C-80-97
          Hash: 0x c8097
          Random: 0x48618e
> HCI Event: Command Complete (0x0e) plen 4                                                                          #42 2.767286
      LE Set Extended Advertising Data (0x08|0x0037) ncmd 1
        Status: Success (0x00)
zephyr.exe[1882710]: < HCI Command: LE Set Extended Advertising Enable (0x08|0x0039) plen 6                          #43 2.786436
        Extended advertising: Enabled (0x01)
        Number of sets: 1 (0x01)
        Entry 0
          Handle: 0x00
          Duration: 0 ms (0x00)
          Max ext adv events: 0
> HCI Event: Command Complete (0x0e) plen 4                                                                          #44 2.787153
      LE Set Extended Advertising Enable (0x08|0x0039) ncmd 1
        Status: Success (0x00)
> HCI Event: LE Meta Event (0x3e) plen 31                                                                            #45 5.012092
      LE Enhanced Connection Complete (0x0a)
        Status: Success (0x00)
        Handle: 1551
        Role: Peripheral (0x01)
        Peer address type: Public (0x00)
        Peer address: DF:A9:FF:F6:B1:1A (OUI DF-A9-FF)
        Local resolvable private address: 00:00:00:00:00:00 (Non-Resolvable)
        Peer resolvable private address: 00:00:00:00:00:00 (Non-Resolvable)
        Connection interval: 150.00 msec (0x0078)
        Connection latency: 0 (0x0000)
        Supervision timeout: 25120 msec (0x09d0)
        Central clock accuracy: 0x01
> HCI Event: LE Meta Event (0x3e) plen 6                                                                             #46 5.012232
      LE Advertising Set Terminated (0x12)
        Status: Success (0x00)
        Handle: 0
        Connection handle: 1551
        Number of completed extended advertising events: 0
zephyr.exe[1882710]: < HCI Command: LE Read Remote Used Features (0x08|0x0016) plen 2                                #47 5.027075
        Handle: 1551 Address: DF:A9:FF:F6:B1:1A (OUI DF-A9-FF)
zephyr.exe[1882710]: < ACL Data TX: Handle 1551 flags 0x00 dlen 7                                                    #48 5.027091
      ATT: Exchange MTU Request (0x02) len 2
        Client RX MTU: 251
> HCI Event: Command Status (0x0f) plen 4                                                                            #49 5.027612
      LE Read Remote Used Features (0x08|0x0016) ncmd 1
        Status: Success (0x00)
> HCI Event: Number of Completed Packets (0x13) plen 5                                                               #50 5.314081
        Num handles: 1
        Handle: 1551 Address: DF:A9:FF:F6:B1:1A (OUI DF-A9-FF)
        Count: 1
        #48: len 7 (0 Kb/s)
        Latency: 286 msec (286-286 msec ~286 msec)
> HCI Event: LE Meta Event (0x3e) plen 12                                                                            #51 5.464489
      LE Read Remote Used Features (0x04)
        Status: Success (0x00)
        Handle: 1551 Address: DF:A9:FF:F6:B1:1A (OUI DF-A9-FF)
        Features: 0x2d 0x49 0x00 0xf7 0x67 0xd8 0x00 0x00
          LE Encryption
          Extended Reject Indication
          Peripheral-initiated Features Exchange
          LE Data Packet Length Extension
          LE 2M PHY
          LE Coded PHY
          Channel Selection Algorithm #2
          Periodic Advertising Sync Transfer - Sender
          Periodic Advertising Sync Transfer - Recipient
          Sleep Clock Accuracy Updates
          Connected Isochronous Stream - Central
          Connected Isochronous Stream - Peripheral
          Isochronous Broadcaster
          Synchronized Receiver
          Connected Isochronous Stream (Host Support)
          LE Power Control Request
          LE Power Control Request
          Connection Subrating
          Connection Subrating (Host Support)
          Unknown features (0x0000d80000000000)
> ACL Data RX: Handle 1551 flags 0x02 dlen 7                                                                         #52 6.214202
      ATT: Exchange MTU Request (0x02) len 2
        Client RX MTU: 64
> ACL Data RX: Handle 1551 flags 0x02 dlen 7                                                                         #53 6.214520
      ATT: Exchange MTU Response (0x03) len 2
        Server RX MTU: 64
zephyr.exe[1882710]: < HCI Command: Host Number of Completed Packets (0x03|0x0035) plen 5                            #54 6.227012
        Num handles: 1
        Handle: 1551 Address: DF:A9:FF:F6:B1:1A (OUI DF-A9-FF)
        Count: 1
zephyr.exe[1882710]: < ACL Data TX: Handle 1551 flags 0x00 dlen 7                                                    #55 6.227223
      ATT: Exchange MTU Response (0x03) len 2
        Server RX MTU: 251
zephyr.exe[1882710]: < HCI Command: Host Number of Completed Packets (0x03|0x0035) plen 5                            #56 6.227434
        Num handles: 1
        Handle: 1551 Address: DF:A9:FF:F6:B1:1A (OUI DF-A9-FF)
        Count: 1
> HCI Event: Number of Completed Packets (0x13) plen 5                                                               #57 6.514118
        Num handles: 1
        Handle: 1551 Address: DF:A9:FF:F6:B1:1A (OUI DF-A9-FF)
        Count: 1
        #55: len 7 (0 Kb/s)
        Latency: 286 msec (286-286 msec ~286 msec)
> ACL Data RX: Handle 1551 flags 0x02 dlen 11                                                                        #58 8.464160
      SMP: Pairing Request (0x01) len 6
        IO capability: KeyboardDisplay (0x04)
        OOB data: Authentication data not present (0x00)
        Authentication requirement: Bonding, No MITM, SC, No Keypresses (0x09)
        Max encryption key size: 16
        Initiator key distribution: EncKey IdKey Sign (0x07)
        Responder key distribution: EncKey IdKey Sign (0x07)
zephyr.exe[1882710]: < HCI Command: Host Number of Completed Packets (0x03|0x0035) plen 5                            #59 8.466940
        Num handles: 1
        Handle: 1551 Address: DF:A9:FF:F6:B1:1A (OUI DF-A9-FF)
        Count: 1
zephyr.exe[1882710]: < ACL Data TX: Handle 1551 flags 0x00 dlen 11                                                   #60 8.467087
      SMP: Pairing Response (0x02) len 6
        IO capability: NoInputNoOutput (0x03)
        OOB data: Authentication data not present (0x00)
        Authentication requirement: Bonding, No MITM, SC, No Keypresses (0x09)
        Max encryption key size: 16
        Initiator key distribution: IdKey (0x02)
        Responder key distribution: <none> (0x00)
> HCI Event: Number of Completed Packets (0x13) plen 5                                                               #61 8.764054
        Num handles: 1
        Handle: 1551 Address: DF:A9:FF:F6:B1:1A (OUI DF-A9-FF)
        Count: 1
        #60: len 11 (0 Kb/s)
        Latency: 296 msec (286-296 msec ~291 msec)
> ACL Data RX: Handle 1551 flags 0x02 dlen 27                                                                        #62 8.764390
> ACL Data RX: Handle 1551 flags 0x01 dlen 27                                                                        #63 8.764885
> ACL Data RX: Handle 1551 flags 0x01 dlen 15                                                                        #64 8.765096
      SMP: Pairing Public Key (0x0c) len 64
        X: 40f77897b13231353c54e4f5f5d8a59060f12e58e965936b5ce45bb421be3172
        Y: 7194177b29a28e541f54015f55d8d759d7aaac94b68cb538ac868f8c2992f1bb
zephyr.exe[1882710]: < HCI Command: Host Number of Completed Packets (0x03|0x0035) plen 5                            #65 8.767124
        Num handles: 1
        Handle: 1551 Address: DF:A9:FF:F6:B1:1A (OUI DF-A9-FF)
        Count: 1
zephyr.exe[1882710]: < HCI Command: Host Number of Completed Packets (0x03|0x0035) plen 5                            #66 8.767232
        Num handles: 1
        Handle: 1551 Address: DF:A9:FF:F6:B1:1A (OUI DF-A9-FF)
        Count: 1
zephyr.exe[1882710]: < HCI Command: Host Number of Completed Packets (0x03|0x0035) plen 5                            #67 8.767523
        Num handles: 1
        Handle: 1551 Address: DF:A9:FF:F6:B1:1A (OUI DF-A9-FF)
        Count: 1
zephyr.exe[1882710]: < ACL Data TX: Handle 1551 flags 0x00 dlen 27                                                   #68 8.767654
zephyr.exe[1882710]: < ACL Data TX: Handle 1551 flags 0x01 dlen 27                                                   #69 8.767671
zephyr.exe[1882710]: < ACL Data TX: Handle 1551 flags 0x01 dlen 15                                                   #70 8.767674
      SMP: Pairing Public Key (0x0c) len 64
        X: 98308440221e2d910f0e54b71e7ec652857aa9b5a0dc65028824cc19db1226e9
        Y: 67a4816bcb62efb21701e31fdb27561a6217575fb007a8bbdabe7e28b6f68482
> HCI Event: Number of Completed Packets (0x13) plen 5                                                               #71 8.914472
        Num handles: 1
        Handle: 1551 Address: DF:A9:FF:F6:B1:1A (OUI DF-A9-FF)
        Count: 1
        #68: len 27 (1 Kb/s)
        Latency: 146 msec (146-296 msec ~219 msec)
> HCI Event: Number of Completed Packets (0x13) plen 5                                                               #72 8.914989
        Num handles: 1
        Handle: 1551 Address: DF:A9:FF:F6:B1:1A (OUI DF-A9-FF)
        Count: 1
        #69: len 27 (1 Kb/s)
        Latency: 147 msec (146-296 msec ~183 msec)
zephyr.exe[1882710]: < ACL Data TX: Handle 1551 flags 0x00 dlen 21                                                   #73 8.926779
      SMP: Pairing Confirm (0x03) len 16
        Confim value: 65205157c0535ce9b2c3e5fcdc7ce349
> HCI Event: Number of Completed Packets (0x13) plen 5                                                               #74 9.063975
        Num handles: 1
        Handle: 1551 Address: DF:A9:FF:F6:B1:1A (OUI DF-A9-FF)
        Count: 1
        #70: len 15 (0 Kb/s)
        Latency: 296 msec (146-296 msec ~239 msec)
> HCI Event: Number of Completed Packets (0x13) plen 5                                                               #75 9.214027
        Num handles: 1
        Handle: 1551 Address: DF:A9:FF:F6:B1:1A (OUI DF-A9-FF)
        Count: 1
        #73: len 21 (0 Kb/s)
        Latency: 287 msec (146-296 msec ~263 msec)
> ACL Data RX: Handle 1551 flags 0x02 dlen 21                                                                        #76 9.214372
      SMP: Pairing Random (0x04) len 16
        Random value: 323a0f90458b21f00000000000000000
zephyr.exe[1882710]: < HCI Command: Host Number of Completed Packets (0x03|0x0035) plen 5                            #77 9.226737
        Num handles: 1
        Handle: 1551 Address: DF:A9:FF:F6:B1:1A (OUI DF-A9-FF)
        Count: 1
zephyr.exe[1882710]: < ACL Data TX: Handle 1551 flags 0x00 dlen 21                                                   #78 9.226785
      SMP: Pairing Random (0x04) len 16
        Random value: f966a694cbe26df70bb96773e6cc6f5d
> HCI Event: Number of Completed Packets (0x13) plen 5                                                               #79 9.513920
        Num handles: 1
        Handle: 1551 Address: DF:A9:FF:F6:B1:1A (OUI DF-A9-FF)
        Count: 1
        #78: len 21 (0 Kb/s)
        Latency: 287 msec (146-296 msec ~275 msec)
> ACL Data RX: Handle 1551 flags 0x02 dlen 21                                                                        #80 9.664113
      SMP: Pairing DHKey Check (0x0d) len 16
        E: 9b6549306edbf87c0b6a02aba3ac3fef
zephyr.exe[1882710]: < HCI Command: Host Number of Completed Packets (0x03|0x0035) plen 5                            #81 9.666583
        Num handles: 1
        Handle: 1551 Address: DF:A9:FF:F6:B1:1A (OUI DF-A9-FF)
        Count: 1
zephyr.exe[1882710]: < ACL Data TX: Handle 1551 flags 0x00 dlen 21                                                   #82 9.666679
      SMP: Pairing DHKey Check (0x0d) len 16
        E: fb8647db538c53becc31c1bf7182f1eb
> HCI Event: Number of Completed Packets (0x13) plen 5                                                               #83 9.963891
        Num handles: 1
        Handle: 1551 Address: DF:A9:FF:F6:B1:1A (OUI DF-A9-FF)
        Count: 1
        #82: len 21 (0 Kb/s)
        Latency: 297 msec (146-297 msec ~286 msec)
> HCI Event: LE Meta Event (0x3e) plen 13                                                                           #84 10.114393
      LE Long Term Key Request (0x05)
        Handle: 1551 Address: DF:A9:FF:F6:B1:1A (OUI DF-A9-FF)
        Random number: 0x0000000000000000
        Encrypted diversifier: 0x0000
zephyr.exe[1882710]: < HCI Command: LE Long Term Key Request Reply (0x08|0x001a) plen 18                            #85 10.126811
        Handle: 1551 Address: DF:A9:FF:F6:B1:1A (OUI DF-A9-FF)
        Long term key: 35cfdeca92d1f5705f765c774b382a1e
> HCI Event: Command Complete (0x0e) plen 6                                                                         #86 10.127514
      LE Long Term Key Request Reply (0x08|0x001a) ncmd 1
        Status: Success (0x00)
        Handle: 1551 Address: DF:A9:FF:F6:B1:1A (OUI DF-A9-FF)
> HCI Event: Encryption Change (0x08) plen 4                                                                        #87 10.864154
        Status: Success (0x00)
        Handle: 1551 Address: DF:A9:FF:F6:B1:1A (OUI DF-A9-FF)
        Encryption: Enabled with AES-CCM (0x01)
> ACL Data RX: Handle 1551 flags 0x02 dlen 21                                                                       #88 11.014248
      SMP: Identity Information (0x08) len 16
        Identity resolving key: 57a2eac7820c2cc57c7df843a27328bf
zephyr.exe[1882710]: < HCI Command: Host Number of Completed Packets (0x03|0x0035) plen 5                           #89 11.026877
        Num handles: 1
        Handle: 1551 Address: DF:A9:FF:F6:B1:1A (OUI DF-A9-FF)
        Count: 1
> ACL Data RX: Handle 1551 flags 0x02 dlen 12                                                                       #90 11.314012
      SMP: Identity Address Information (0x09) len 7
        Address: DF:A9:FF:F6:B1:1A (OUI DF-A9-FF)
zephyr.exe[1882710]: < HCI Command: LE Add Device To Resolving List (0x08|0x0027) plen 39                           #91 11.327030
        Address type: Public (0x00)
        Address: DF:A9:FF:F6:B1:1A (OUI DF-A9-FF)
        Peer identity resolving key: 57a2eac7820c2cc57c7df843a27328bf
        Local identity resolving key: 00000000000000000000000000000000
> HCI Event: Command Complete (0x0e) plen 4                                                                         #92 11.328057
      LE Add Device To Resolving List (0x08|0x0027) ncmd 1
        Status: Success (0x00)
zephyr.exe[1882710]: < HCI Command: LE Set Privacy Mode (0x08|0x004e) plen 8                                        #93 11.346833
        Peer Identity address type: Public (0x00)
        Peer Identity address: DF:A9:FF:F6:B1:1A (OUI DF-A9-FF)
        Privacy Mode: Use Device Privacy (0x01)
> HCI Event: Command Complete (0x0e) plen 4                                                                         #94 11.347394
      LE Set Privacy Mode (0x08|0x004e) ncmd 1
        Status: Success (0x00)
zephyr.exe[1882710]: < HCI Command: LE Set Address Resolution Enable (0x08|0x002d) plen 1                           #95 11.366800
        Address resolution: Enabled (0x01)
> HCI Event: Command Complete (0x0e) plen 4                                                                         #96 11.367276
      LE Set Address Resolution Enable (0x08|0x002d) ncmd 1
        Status: Success (0x00)
zephyr.exe[1882710]: < HCI Command: Host Number of Completed Packets (0x03|0x0035) plen 5                           #97 11.386763
        Num handles: 1
        Handle: 1551 Address: DF:A9:FF:F6:B1:1A (OUI DF-A9-FF)
        Count: 1
> ACL Data RX: Handle 1551 flags 0x02 dlen 13                                                                       #98 11.464046
      ATT: Find By Type Value Request (0x06) len 8
        Handle range: 0x0001-0xffff
        Attribute type: Primary Service (0x2800)
          UUID: Hearing Aid (0x1854)
zephyr.exe[1882710]: < HCI Command: Host Number of Completed Packets (0x03|0x0035) plen 5                           #99 11.467225
        Num handles: 1
        Handle: 1551 Address: DF:A9:FF:F6:B1:1A (OUI DF-A9-FF)
        Count: 1
zephyr.exe[1882710]: < ACL Data TX: Handle 1551 flags 0x00 dlen 9                                                  #100 11.467482
      ATT: Find By Type Value Response (0x07) len 4
        Handle range: 0x00af-0x00b7
> HCI Event: Number of Completed Packets (0x13) plen 5                                                             #101 11.763956
        Num handles: 1
        Handle: 1551 Address: DF:A9:FF:F6:B1:1A (OUI DF-A9-FF)
        Count: 1
        #100: len 9 (0 Kb/s)
        Latency: 296 msec (146-297 msec ~291 msec)
> ACL Data RX: Handle 1551 flags 0x02 dlen 13                                                                      #102 11.764199
      ATT: Find By Type Value Request (0x06) len 8
        Handle range: 0x00b8-0xffff
        Attribute type: Primary Service (0x2800)
          UUID: Hearing Aid (0x1854)
zephyr.exe[1882710]: < HCI Command: Host Number of Completed Packets (0x03|0x0035) plen 5                          #103 11.767099
        Num handles: 1
        Handle: 1551 Address: DF:A9:FF:F6:B1:1A (OUI DF-A9-FF)
        Count: 1
zephyr.exe[1882710]: < ACL Data TX: Handle 1551 flags 0x00 dlen 9                                                  #104 11.767174
      ATT: Error Response (0x01) len 4
        Find By Type Value Request (0x06)
        Handle: 0x00b8
        Error: Attribute Not Found (0x0a)
> HCI Event: Number of Completed Packets (0x13) plen 5                                                             #105 12.063936
        Num handles: 1
        Handle: 1551 Address: DF:A9:FF:F6:B1:1A (OUI DF-A9-FF)
        Count: 1
        #104: len 9 (0 Kb/s)
        Latency: 296 msec (146-297 msec ~294 msec)
> ACL Data RX: Handle 1551 flags 0x02 dlen 11                                                                      #106 12.064103
      ATT: Read By Type Request (0x08) len 6
        Handle range: 0x00af-0x00b7
        Attribute type: Characteristic (0x2803)
zephyr.exe[1882710]: < HCI Command: Host Number of Completed Packets (0x03|0x0035) plen 5                          #107 12.066743
        Num handles: 1
        Handle: 1551 Address: DF:A9:FF:F6:B1:1A (OUI DF-A9-FF)
        Count: 1
zephyr.exe[1882710]: < ACL Data TX: Handle 1551 flags 0x00 dlen 27                                                 #108 12.066785
      ATT: Read By Type Response (0x09) len 22
        Attribute data length: 7
        Attribute data list: 3 entries
        Handle: 0x00b0
        Value: 02b100da2b
            Properties: 0x02
              Read (0x02)
            Value Handle: 0x00b1
            Value UUID: Hearing Aid Features (0x2bda)
        Handle: 0x00b2
        Value: 28b300db2b
            Properties: 0x28
              Write (0x08)
              Indicate (0x20)
            Value Handle: 0x00b3
            Value UUID: Hearing Aid Preset Control Point (0x2bdb)
        Handle: 0x00b5
        Value: 12b600dc2b
            Properties: 0x12
              Read (0x02)
              Notify (0x10)
            Value Handle: 0x00b6
            Value UUID: Active Preset Index (0x2bdc)
> HCI Event: Number of Completed Packets (0x13) plen 5                                                             #109 12.363997
        Num handles: 1
        Handle: 1551 Address: DF:A9:FF:F6:B1:1A (OUI DF-A9-FF)
        Count: 1
        #108: len 27 (0 Kb/s)
        Latency: 297 msec (146-297 msec ~295 msec)
> ACL Data RX: Handle 1551 flags 0x02 dlen 11                                                                      #110 12.364156
      ATT: Read By Type Request (0x08) len 6
        Handle range: 0x00b6-0x00b7
        Attribute type: Characteristic (0x2803)
zephyr.exe[1882710]: < HCI Command: Host Number of Completed Packets (0x03|0x0035) plen 5                          #111 12.367156
        Num handles: 1
        Handle: 1551 Address: DF:A9:FF:F6:B1:1A (OUI DF-A9-FF)
        Count: 1
zephyr.exe[1882710]: < ACL Data TX: Handle 1551 flags 0x00 dlen 9                                                  #112 12.367278
      ATT: Error Response (0x01) len 4
        Read By Type Request (0x08)
        Handle: 0x00b6
        Error: Attribute Not Found (0x0a)
> HCI Event: Number of Completed Packets (0x13) plen 5                                                             #113 12.663987
        Num handles: 1
        Handle: 1551 Address: DF:A9:FF:F6:B1:1A (OUI DF-A9-FF)
        Count: 1
        #112: len 9 (0 Kb/s)
        Latency: 296 msec (146-297 msec ~296 msec)
> ACL Data RX: Handle 1551 flags 0x02 dlen 9                                                                       #114 12.664112
      ATT: Find Information Request (0x04) len 4
        Handle range: 0x00b4-0x00b4
zephyr.exe[1882710]: < HCI Command: Host Number of Completed Packets (0x03|0x0035) plen 5                          #115 12.667100
        Num handles: 1
        Handle: 1551 Address: DF:A9:FF:F6:B1:1A (OUI DF-A9-FF)
        Count: 1
zephyr.exe[1882710]: < ACL Data TX: Handle 1551 flags 0x00 dlen 10                                                 #116 12.667205
      ATT: Find Information Response (0x05) len 5
        Format: UUID-16 (0x01)
        Handle: 0x00b4
        UUID: Client Characteristic Configuration (0x2902)
> HCI Event: Number of Completed Packets (0x13) plen 5                                                             #117 12.963968
        Num handles: 1
        Handle: 1551 Address: DF:A9:FF:F6:B1:1A (OUI DF-A9-FF)
        Count: 1
        #116: len 10 (0 Kb/s)
        Latency: 296 msec (146-297 msec ~296 msec)
> ACL Data RX: Handle 1551 flags 0x02 dlen 9                                                                       #118 12.964045
      ATT: Find Information Request (0x04) len 4
        Handle range: 0x00b7-0x00b7
zephyr.exe[1882710]: < HCI Command: Host Number of Completed Packets (0x03|0x0035) plen 5                          #119 12.967139
        Num handles: 1
        Handle: 1551 Address: DF:A9:FF:F6:B1:1A (OUI DF-A9-FF)
        Count: 1
zephyr.exe[1882710]: < ACL Data TX: Handle 1551 flags 0x00 dlen 10                                                 #120 12.967245
      ATT: Find Information Response (0x05) len 5
        Format: UUID-16 (0x01)
        Handle: 0x00b7
        UUID: Client Characteristic Configuration (0x2902)
> HCI Event: Number of Completed Packets (0x13) plen 5                                                             #121 13.263928
        Num handles: 1
        Handle: 1551 Address: DF:A9:FF:F6:B1:1A (OUI DF-A9-FF)
        Count: 1
        #120: len 10 (0 Kb/s)
        Latency: 296 msec (146-297 msec ~296 msec)
> ACL Data RX: Handle 1551 flags 0x02 dlen 13                                                                      #122 13.264152
      ATT: Find By Type Value Request (0x06) len 8
        Handle range: 0x0001-0xffff
        Attribute type: Primary Service (0x2800)
          UUID: Published Audio Capabilities (0x1850)
zephyr.exe[1882710]: < HCI Command: Host Number of Completed Packets (0x03|0x0035) plen 5                          #123 13.267168
        Num handles: 1
        Handle: 1551 Address: DF:A9:FF:F6:B1:1A (OUI DF-A9-FF)
        Count: 1
zephyr.exe[1882710]: < ACL Data TX: Handle 1551 flags 0x00 dlen 9                                                  #124 13.267258
      ATT: Find By Type Value Response (0x07) len 4
        Handle range: 0x0039-0x004b
> HCI Event: Number of Completed Packets (0x13) plen 5                                                             #125 13.563940
        Num handles: 1
        Handle: 1551 Address: DF:A9:FF:F6:B1:1A (OUI DF-A9-FF)
        Count: 1
        #124: len 9 (0 Kb/s)
        Latency: 296 msec (146-297 msec ~296 msec)
> ACL Data RX: Handle 1551 flags 0x02 dlen 13                                                                      #126 13.564106
      ATT: Find By Type Value Request (0x06) len 8
        Handle range: 0x004c-0xffff
        Attribute type: Primary Service (0x2800)
          UUID: Published Audio Capabilities (0x1850)
zephyr.exe[1882710]: < HCI Command: Host Number of Completed Packets (0x03|0x0035) plen 5                          #127 13.567362
        Num handles: 1
        Handle: 1551 Address: DF:A9:FF:F6:B1:1A (OUI DF-A9-FF)
        Count: 1
zephyr.exe[1882710]: < ACL Data TX: Handle 1551 flags 0x00 dlen 9                                                  #128 13.567506
      ATT: Error Response (0x01) len 4
        Find By Type Value Request (0x06)
        Handle: 0x004c
        Error: Attribute Not Found (0x0a)
> HCI Event: Number of Completed Packets (0x13) plen 5                                                             #129 13.863890
        Num handles: 1
        Handle: 1551 Address: DF:A9:FF:F6:B1:1A (OUI DF-A9-FF)
        Count: 1
        #128: len 9 (0 Kb/s)
        Latency: 296 msec (146-297 msec ~296 msec)
> ACL Data RX: Handle 1551 flags 0x02 dlen 11                                                                      #130 13.864145
      ATT: Read By Type Request (0x08) len 6
        Handle range: 0x0039-0x004b
        Attribute type: Characteristic (0x2803)
zephyr.exe[1882710]: < HCI Command: Host Number of Completed Packets (0x03|0x0035) plen 5                          #131 13.867158
        Num handles: 1
        Handle: 1551 Address: DF:A9:FF:F6:B1:1A (OUI DF-A9-FF)
        Count: 1
zephyr.exe[1882710]: < ACL Data TX: Handle 1551 flags 0x00 dlen 27                                                 #132 13.867345
zephyr.exe[1882710]: < ACL Data TX: Handle 1551 flags 0x01 dlen 21                                                 #133 13.867610
      ATT: Read By Type Response (0x09) len 43
        Attribute data length: 7
        Attribute data list: 6 entries
        Handle: 0x003a
        Value: 123b00c92b
            Properties: 0x12
              Read (0x02)
              Notify (0x10)
            Value Handle: 0x003b
            Value UUID: Sink PAC (0x2bc9)
        Handle: 0x003d
        Value: 1a3e00ca2b
            Properties: 0x1a
              Read (0x02)
              Write (0x08)
              Notify (0x10)
            Value Handle: 0x003e
            Value UUID: Sink Audio Locations (0x2bca)
        Handle: 0x0040
        Value: 124100cb2b
            Properties: 0x12
              Read (0x02)
              Notify (0x10)
            Value Handle: 0x0041
            Value UUID: Source PAC (0x2bcb)
        Handle: 0x0043
        Value: 1a4400cc2b
            Properties: 0x1a
              Read (0x02)
              Write (0x08)
              Notify (0x10)
            Value Handle: 0x0044
            Value UUID: Source Audio Locations (0x2bcc)
        Handle: 0x0046
        Value: 124700cd2b
            Properties: 0x12
              Read (0x02)
              Notify (0x10)
            Value Handle: 0x0047
            Value UUID: Available Audio Contexts (0x2bcd)
        Handle: 0x0049
        Value: 124a00ce2b
            Properties: 0x12
              Read (0x02)
              Notify (0x10)
            Value Handle: 0x004a
            Value UUID: Supported Audio Contexts (0x2bce)
> HCI Event: Number of Completed Packets (0x13) plen 5                                                             #134 14.014322
        Num handles: 1
        Handle: 1551 Address: DF:A9:FF:F6:B1:1A (OUI DF-A9-FF)
        Count: 1
        #132: len 27 (1 Kb/s)
        Latency: 146 msec (146-297 msec ~221 msec)
> HCI Event: Number of Completed Packets (0x13) plen 5                                                             #135 14.163894
        Num handles: 1
        Handle: 1551 Address: DF:A9:FF:F6:B1:1A (OUI DF-A9-FF)
        Count: 1
        #133: len 21 (0 Kb/s)
        Latency: 296 msec (146-297 msec ~259 msec)
> ACL Data RX: Handle 1551 flags 0x02 dlen 11                                                                      #136 14.164092
      ATT: Read By Type Request (0x08) len 6
        Handle range: 0x004a-0x004b
        Attribute type: Characteristic (0x2803)
zephyr.exe[1882710]: < HCI Command: Host Number of Completed Packets (0x03|0x0035) plen 5                          #137 14.166623
        Num handles: 1
        Handle: 1551 Address: DF:A9:FF:F6:B1:1A (OUI DF-A9-FF)
        Count: 1
zephyr.exe[1882710]: < ACL Data TX: Handle 1551 flags 0x00 dlen 9                                                  #138 14.166662
      ATT: Error Response (0x01) len 4
        Read By Type Request (0x08)
        Handle: 0x004a
        Error: Attribute Not Found (0x0a)
> HCI Event: Number of Completed Packets (0x13) plen 5                                                             #139 14.463998
        Num handles: 1
        Handle: 1551 Address: DF:A9:FF:F6:B1:1A (OUI DF-A9-FF)
        Count: 1
        #138: len 9 (0 Kb/s)
        Latency: 297 msec (146-297 msec ~278 msec)
> ACL Data RX: Handle 1551 flags 0x02 dlen 9                                                                       #140 14.464007
      ATT: Find Information Request (0x04) len 4
        Handle range: 0x003c-0x003c
zephyr.exe[1882710]: < HCI Command: Host Number of Completed Packets (0x03|0x0035) plen 5                          #141 14.466985
        Num handles: 1
        Handle: 1551 Address: DF:A9:FF:F6:B1:1A (OUI DF-A9-FF)
        Count: 1
zephyr.exe[1882710]: < ACL Data TX: Handle 1551 flags 0x00 dlen 10                                                 #142 14.467079
      ATT: Find Information Response (0x05) len 5
        Format: UUID-16 (0x01)
        Handle: 0x003c
        UUID: Client Characteristic Configuration (0x2902)
> HCI Event: Number of Completed Packets (0x13) plen 5                                                             #143 14.763906
        Num handles: 1
        Handle: 1551 Address: DF:A9:FF:F6:B1:1A (OUI DF-A9-FF)
        Count: 1
        #142: len 10 (0 Kb/s)
        Latency: 296 msec (146-297 msec ~287 msec)
> ACL Data RX: Handle 1551 flags 0x02 dlen 9                                                                       #144 14.764070
      ATT: Find Information Request (0x04) len 4
        Handle range: 0x003f-0x003f
zephyr.exe[1882710]: < HCI Command: Host Number of Completed Packets (0x03|0x0035) plen 5                          #145 14.766840
        Num handles: 1
        Handle: 1551 Address: DF:A9:FF:F6:B1:1A (OUI DF-A9-FF)
        Count: 1
zephyr.exe[1882710]: < ACL Data TX: Handle 1551 flags 0x00 dlen 10                                                 #146 14.766895
      ATT: Find Information Response (0x05) len 5
        Format: UUID-16 (0x01)
        Handle: 0x003f
        UUID: Client Characteristic Configuration (0x2902)
> HCI Event: Number of Completed Packets (0x13) plen 5                                                             #147 15.063911
        Num handles: 1
        Handle: 1551 Address: DF:A9:FF:F6:B1:1A (OUI DF-A9-FF)
        Count: 1
        #146: len 10 (0 Kb/s)
        Latency: 297 msec (146-297 msec ~292 msec)
> ACL Data RX: Handle 1551 flags 0x02 dlen 9                                                                       #148 15.064009
      ATT: Find Information Request (0x04) len 4
        Handle range: 0x0042-0x0042
zephyr.exe[1882710]: < HCI Command: Host Number of Completed Packets (0x03|0x0035) plen 5                          #149 15.066998
        Num handles: 1
        Handle: 1551 Address: DF:A9:FF:F6:B1:1A (OUI DF-A9-FF)
        Count: 1
zephyr.exe[1882710]: < ACL Data TX: Handle 1551 flags 0x00 dlen 10                                                 #150 15.067070
      ATT: Find Information Response (0x05) len 5
        Format: UUID-16 (0x01)
        Handle: 0x0042
        UUID: Client Characteristic Configuration (0x2902)
> HCI Event: Number of Completed Packets (0x13) plen 5                                                             #151 15.363986
        Num handles: 1
        Handle: 1551 Address: DF:A9:FF:F6:B1:1A (OUI DF-A9-FF)
        Count: 1
        #150: len 10 (0 Kb/s)
        Latency: 296 msec (146-297 msec ~294 msec)
> ACL Data RX: Handle 1551 flags 0x02 dlen 9                                                                       #152 15.364096
      ATT: Find Information Request (0x04) len 4
        Handle range: 0x0045-0x0045
zephyr.exe[1882710]: < HCI Command: Host Number of Completed Packets (0x03|0x0035) plen 5                          #153 15.367135
        Num handles: 1
        Handle: 1551 Address: DF:A9:FF:F6:B1:1A (OUI DF-A9-FF)
        Count: 1
zephyr.exe[1882710]: < ACL Data TX: Handle 1551 flags 0x00 dlen 10                                                 #154 15.367303
      ATT: Find Information Response (0x05) len 5
        Format: UUID-16 (0x01)
        Handle: 0x0045
        UUID: Client Characteristic Configuration (0x2902)
> HCI Event: Number of Completed Packets (0x13) plen 5                                                             #155 15.663893
        Num handles: 1
        Handle: 1551 Address: DF:A9:FF:F6:B1:1A (OUI DF-A9-FF)
        Count: 1
        #154: len 10 (0 Kb/s)
        Latency: 296 msec (146-297 msec ~295 msec)
> ACL Data RX: Handle 1551 flags 0x02 dlen 9                                                                       #156 15.664018
      ATT: Find Information Request (0x04) len 4
        Handle range: 0x0048-0x0048
zephyr.exe[1882710]: < HCI Command: Host Number of Completed Packets (0x03|0x0035) plen 5                          #157 15.666894
        Num handles: 1
        Handle: 1551 Address: DF:A9:FF:F6:B1:1A (OUI DF-A9-FF)
        Count: 1
zephyr.exe[1882710]: < ACL Data TX: Handle 1551 flags 0x00 dlen 10                                                 #158 15.666960
      ATT: Find Information Response (0x05) len 5
        Format: UUID-16 (0x01)
        Handle: 0x0048
        UUID: Client Characteristic Configuration (0x2902)
> HCI Event: Number of Completed Packets (0x13) plen 5                                                             #159 15.963937
        Num handles: 1
        Handle: 1551 Address: DF:A9:FF:F6:B1:1A (OUI DF-A9-FF)
        Count: 1
        #158: len 10 (0 Kb/s)
        Latency: 296 msec (146-297 msec ~296 msec)
> ACL Data RX: Handle 1551 flags 0x02 dlen 9                                                                       #160 15.964061
      ATT: Find Information Request (0x04) len 4
        Handle range: 0x004b-0x004b
zephyr.exe[1882710]: < HCI Command: Host Number of Completed Packets (0x03|0x0035) plen 5                          #161 15.967149
        Num handles: 1
        Handle: 1551 Address: DF:A9:FF:F6:B1:1A (OUI DF-A9-FF)
        Count: 1
zephyr.exe[1882710]: < ACL Data TX: Handle 1551 flags 0x00 dlen 10                                                 #162 15.967217
      ATT: Find Information Response (0x05) len 5
        Format: UUID-16 (0x01)
        Handle: 0x004b
        UUID: Client Characteristic Configuration (0x2902)
> HCI Event: Number of Completed Packets (0x13) plen 5                                                             #163 16.263912
        Num handles: 1
        Handle: 1551 Address: DF:A9:FF:F6:B1:1A (OUI DF-A9-FF)
        Count: 1
        #162: len 10 (0 Kb/s)
        Latency: 296 msec (146-297 msec ~296 msec)
> ACL Data RX: Handle 1551 flags 0x02 dlen 13                                                                      #164 16.264069
      ATT: Find By Type Value Request (0x06) len 8
        Handle range: 0x0001-0xffff
        Attribute type: Primary Service (0x2800)
          UUID: Audio Stream Control (0x184e)
zephyr.exe[1882710]: < HCI Command: Host Number of Completed Packets (0x03|0x0035) plen 5                          #165 16.266952
        Num handles: 1
        Handle: 1551 Address: DF:A9:FF:F6:B1:1A (OUI DF-A9-FF)
        Count: 1
zephyr.exe[1882710]: < ACL Data TX: Handle 1551 flags 0x00 dlen 9                                                  #166 16.266992
      ATT: Find By Type Value Response (0x07) len 4
        Handle range: 0x004c-0x005b
> HCI Event: Number of Completed Packets (0x13) plen 5                                                             #167 16.563894
        Num handles: 1
        Handle: 1551 Address: DF:A9:FF:F6:B1:1A (OUI DF-A9-FF)
        Count: 1
        #166: len 9 (0 Kb/s)
        Latency: 296 msec (146-297 msec ~296 msec)
> ACL Data RX: Handle 1551 flags 0x02 dlen 13                                                                      #168 16.564032
      ATT: Find By Type Value Request (0x06) len 8
        Handle range: 0x005c-0xffff
        Attribute type: Primary Service (0x2800)
          UUID: Audio Stream Control (0x184e)
zephyr.exe[1882710]: < HCI Command: Host Number of Completed Packets (0x03|0x0035) plen 5                          #169 16.567327
        Num handles: 1
        Handle: 1551 Address: DF:A9:FF:F6:B1:1A (OUI DF-A9-FF)
        Count: 1
zephyr.exe[1882710]: < ACL Data TX: Handle 1551 flags 0x00 dlen 9                                                  #170 16.567421
      ATT: Error Response (0x01) len 4
        Find By Type Value Request (0x06)
        Handle: 0x005c
        Error: Attribute Not Found (0x0a)
> HCI Event: Number of Completed Packets (0x13) plen 5                                                             #171 16.863819
        Num handles: 1
        Handle: 1551 Address: DF:A9:FF:F6:B1:1A (OUI DF-A9-FF)
        Count: 1
        #170: len 9 (0 Kb/s)
        Latency: 296 msec (146-297 msec ~296 msec)
> ACL Data RX: Handle 1551 flags 0x02 dlen 11                                                                      #172 16.864028
      ATT: Read By Type Request (0x08) len 6
        Handle range: 0x004c-0x005b
        Attribute type: Characteristic (0x2803)
zephyr.exe[1882710]: < HCI Command: Host Number of Completed Packets (0x03|0x0035) plen 5                          #173 16.867178
        Num handles: 1
        Handle: 1551 Address: DF:A9:FF:F6:B1:1A (OUI DF-A9-FF)
        Count: 1
zephyr.exe[1882710]: < ACL Data TX: Handle 1551 flags 0x00 dlen 27                                                 #174 16.867294
zephyr.exe[1882710]: < ACL Data TX: Handle 1551 flags 0x01 dlen 14                                                 #175 16.867555
      ATT: Read By Type Response (0x09) len 36
        Attribute data length: 7
        Attribute data list: 5 entries
        Handle: 0x004d
        Value: 1c4e00c62b
            Properties: 0x1c
              Write Without Response (0x04)
              Write (0x08)
              Notify (0x10)
            Value Handle: 0x004e
            Value UUID: ASE Control Point (0x2bc6)
        Handle: 0x0050
        Value: 125100c42b
            Properties: 0x12
              Read (0x02)
              Notify (0x10)
            Value Handle: 0x0051
            Value UUID: Sink ASE (0x2bc4)
        Handle: 0x0053
        Value: 125400c42b
            Properties: 0x12
              Read (0x02)
              Notify (0x10)
            Value Handle: 0x0054
            Value UUID: Sink ASE (0x2bc4)
        Handle: 0x0056
        Value: 125700c52b
            Properties: 0x12
              Read (0x02)
              Notify (0x10)
            Value Handle: 0x0057
            Value UUID: Source ASE (0x2bc5)
        Handle: 0x0059
        Value: 125a00c52b
            Properties: 0x12
              Read (0x02)
              Notify (0x10)
            Value Handle: 0x005a
            Value UUID: Source ASE (0x2bc5)
> HCI Event: Number of Completed Packets (0x13) plen 5                                                             #176 17.014287
        Num handles: 1
        Handle: 1551 Address: DF:A9:FF:F6:B1:1A (OUI DF-A9-FF)
        Count: 1
        #174: len 27 (1 Kb/s)
        Latency: 146 msec (146-297 msec ~221 msec)
> HCI Event: Number of Completed Packets (0x13) plen 5                                                             #177 17.163902
        Num handles: 1
        Handle: 1551 Address: DF:A9:FF:F6:B1:1A (OUI DF-A9-FF)
        Count: 1
        #175: len 14 (0 Kb/s)
        Latency: 296 msec (146-297 msec ~259 msec)
> ACL Data RX: Handle 1551 flags 0x02 dlen 11                                                                      #178 17.164080
      ATT: Read By Type Request (0x08) len 6
        Handle range: 0x005a-0x005b
        Attribute type: Characteristic (0x2803)
zephyr.exe[1882710]: < HCI Command: Host Number of Completed Packets (0x03|0x0035) plen 5                          #179 17.167154
        Num handles: 1
        Handle: 1551 Address: DF:A9:FF:F6:B1:1A (OUI DF-A9-FF)
        Count: 1
zephyr.exe[1882710]: < ACL Data TX: Handle 1551 flags 0x00 dlen 9                                                  #180 17.167297
      ATT: Error Response (0x01) len 4
        Read By Type Request (0x08)
        Handle: 0x005a
        Error: Attribute Not Found (0x0a)
> HCI Event: Number of Completed Packets (0x13) plen 5                                                             #181 17.463823
        Num handles: 1
        Handle: 1551 Address: DF:A9:FF:F6:B1:1A (OUI DF-A9-FF)
        Count: 1
        #180: len 9 (0 Kb/s)
        Latency: 296 msec (146-297 msec ~277 msec)
> ACL Data RX: Handle 1551 flags 0x02 dlen 9                                                                       #182 17.463967
      ATT: Find Information Request (0x04) len 4
        Handle range: 0x004f-0x004f
zephyr.exe[1882710]: < HCI Command: Host Number of Completed Packets (0x03|0x0035) plen 5                          #183 17.467149
        Num handles: 1
        Handle: 1551 Address: DF:A9:FF:F6:B1:1A (OUI DF-A9-FF)
        Count: 1
zephyr.exe[1882710]: < ACL Data TX: Handle 1551 flags 0x00 dlen 10                                                 #184 17.467262
      ATT: Find Information Response (0x05) len 5
        Format: UUID-16 (0x01)
        Handle: 0x004f
        UUID: Client Characteristic Configuration (0x2902)
> HCI Event: Number of Completed Packets (0x13) plen 5                                                             #185 17.763808
        Num handles: 1
        Handle: 1551 Address: DF:A9:FF:F6:B1:1A (OUI DF-A9-FF)
        Count: 1
        #184: len 10 (0 Kb/s)
        Latency: 296 msec (146-297 msec ~287 msec)
> ACL Data RX: Handle 1551 flags 0x02 dlen 9                                                                       #186 17.763920
      ATT: Find Information Request (0x04) len 4
        Handle range: 0x0052-0x0052
zephyr.exe[1882710]: < HCI Command: Host Number of Completed Packets (0x03|0x0035) plen 5                          #187 17.766729
        Num handles: 1
        Handle: 1551 Address: DF:A9:FF:F6:B1:1A (OUI DF-A9-FF)
        Count: 1
zephyr.exe[1882710]: < ACL Data TX: Handle 1551 flags 0x00 dlen 10                                                 #188 17.766796
      ATT: Find Information Response (0x05) len 5
        Format: UUID-16 (0x01)
        Handle: 0x0052
        UUID: Client Characteristic Configuration (0x2902)
> HCI Event: Number of Completed Packets (0x13) plen 5                                                             #189 18.063833
        Num handles: 1
        Handle: 1551 Address: DF:A9:FF:F6:B1:1A (OUI DF-A9-FF)
        Count: 1
        #188: len 10 (0 Kb/s)
        Latency: 297 msec (146-297 msec ~292 msec)
> ACL Data RX: Handle 1551 flags 0x02 dlen 9                                                                       #190 18.064003
      ATT: Find Information Request (0x04) len 4
        Handle range: 0x0055-0x0055
zephyr.exe[1882710]: < HCI Command: Host Number of Completed Packets (0x03|0x0035) plen 5                          #191 18.067247
        Num handles: 1
        Handle: 1551 Address: DF:A9:FF:F6:B1:1A (OUI DF-A9-FF)
        Count: 1
zephyr.exe[1882710]: < ACL Data TX: Handle 1551 flags 0x00 dlen 10                                                 #192 18.067408
      ATT: Find Information Response (0x05) len 5
        Format: UUID-16 (0x01)
        Handle: 0x0055
        UUID: Client Characteristic Configuration (0x2902)
> HCI Event: Number of Completed Packets (0x13) plen 5                                                             #193 18.363760
        Num handles: 1
        Handle: 1551 Address: DF:A9:FF:F6:B1:1A (OUI DF-A9-FF)
        Count: 1
        #192: len 10 (0 Kb/s)
        Latency: 296 msec (146-297 msec ~294 msec)
> ACL Data RX: Handle 1551 flags 0x02 dlen 9                                                                       #194 18.363906
      ATT: Find Information Request (0x04) len 4
        Handle range: 0x0058-0x0058
zephyr.exe[1882710]: < HCI Command: Host Number of Completed Packets (0x03|0x0035) plen 5                          #195 18.366777
        Num handles: 1
        Handle: 1551 Address: DF:A9:FF:F6:B1:1A (OUI DF-A9-FF)
        Count: 1
zephyr.exe[1882710]: < ACL Data TX: Handle 1551 flags 0x00 dlen 10                                                 #196 18.366823
      ATT: Find Information Response (0x05) len 5
        Format: UUID-16 (0x01)
        Handle: 0x0058
        UUID: Client Characteristic Configuration (0x2902)
> HCI Event: Number of Completed Packets (0x13) plen 5                                                             #197 18.663683
        Num handles: 1
        Handle: 1551 Address: DF:A9:FF:F6:B1:1A (OUI DF-A9-FF)
        Count: 1
        #196: len 10 (0 Kb/s)
        Latency: 296 msec (146-297 msec ~295 msec)
> ACL Data RX: Handle 1551 flags 0x02 dlen 9                                                                       #198 18.664066
      ATT: Find Information Request (0x04) len 4
        Handle range: 0x005b-0x005b
zephyr.exe[1882710]: < HCI Command: Host Number of Completed Packets (0x03|0x0035) plen 5                          #199 18.667211
        Num handles: 1
        Handle: 1551 Address: DF:A9:FF:F6:B1:1A (OUI DF-A9-FF)
        Count: 1
zephyr.exe[1882710]: < ACL Data TX: Handle 1551 flags 0x00 dlen 10                                                 #200 18.667260
      ATT: Find Information Response (0x05) len 5
        Format: UUID-16 (0x01)
        Handle: 0x005b
        UUID: Client Characteristic Configuration (0x2902)
> HCI Event: Number of Completed Packets (0x13) plen 5                                                             #201 18.963794
        Num handles: 1
        Handle: 1551 Address: DF:A9:FF:F6:B1:1A (OUI DF-A9-FF)
        Count: 1
        #200: len 10 (0 Kb/s)
        Latency: 296 msec (146-297 msec ~296 msec)
> ACL Data RX: Handle 1551 flags 0x02 dlen 13                                                                      #202 18.963934
      ATT: Find By Type Value Request (0x06) len 8
        Handle range: 0x0001-0xffff
        Attribute type: Primary Service (0x2800)
          UUID: Common Audio (0x1853)
zephyr.exe[1882710]: < HCI Command: Host Number of Completed Packets (0x03|0x0035) plen 5                          #203 18.967408
        Num handles: 1
        Handle: 1551 Address: DF:A9:FF:F6:B1:1A (OUI DF-A9-FF)
        Count: 1
zephyr.exe[1882710]: < ACL Data TX: Handle 1551 flags 0x00 dlen 9                                                  #204 18.967566
      ATT: Find By Type Value Response (0x07) len 4
        Handle range: 0x00ad-0x00ae
> HCI Event: Number of Completed Packets (0x13) plen 5                                                             #205 19.263722
        Num handles: 1
        Handle: 1551 Address: DF:A9:FF:F6:B1:1A (OUI DF-A9-FF)
        Count: 1
        #204: len 9 (0 Kb/s)
        Latency: 296 msec (146-297 msec ~296 msec)
> ACL Data RX: Handle 1551 flags 0x02 dlen 13                                                                      #206 19.263950
      ATT: Find By Type Value Request (0x06) len 8
        Handle range: 0x00af-0xffff
        Attribute type: Primary Service (0x2800)
          UUID: Common Audio (0x1853)
zephyr.exe[1882710]: < HCI Command: Host Number of Completed Packets (0x03|0x0035) plen 5                          #207 19.266856
        Num handles: 1
        Handle: 1551 Address: DF:A9:FF:F6:B1:1A (OUI DF-A9-FF)
        Count: 1
zephyr.exe[1882710]: < ACL Data TX: Handle 1551 flags 0x00 dlen 9                                                  #208 19.266883
      ATT: Error Response (0x01) len 4
        Find By Type Value Request (0x06)
        Handle: 0x00af
        Error: Attribute Not Found (0x0a)
> HCI Event: Number of Completed Packets (0x13) plen 5                                                             #209 19.563679
        Num handles: 1
        Handle: 1551 Address: DF:A9:FF:F6:B1:1A (OUI DF-A9-FF)
        Count: 1
        #208: len 9 (0 Kb/s)
        Latency: 296 msec (146-297 msec ~296 msec)
> ACL Data RX: Handle 1551 flags 0x02 dlen 11                                                                      #210 19.563951
      ATT: Read By Type Request (0x08) len 6
        Handle range: 0x00ad-0x00ae
        Attribute type: Include (0x2802)
zephyr.exe[1882710]: < HCI Command: Host Number of Completed Packets (0x03|0x0035) plen 5                          #211 19.567207
        Num handles: 1
        Handle: 1551 Address: DF:A9:FF:F6:B1:1A (OUI DF-A9-FF)
        Count: 1
zephyr.exe[1882710]: < ACL Data TX: Handle 1551 flags 0x00 dlen 14                                                 #212 19.567356
      ATT: Read By Type Response (0x09) len 9
        Attribute data length: 8
        Attribute data list: 1 entry
        Handle: 0x00ae
        Value: a100ac004618
> HCI Event: Number of Completed Packets (0x13) plen 5                                                             #213 19.863675
        Num handles: 1
        Handle: 1551 Address: DF:A9:FF:F6:B1:1A (OUI DF-A9-FF)
        Count: 1
        #212: len 14 (0 Kb/s)
        Latency: 296 msec (146-297 msec ~296 msec)
> ACL Data RX: Handle 1551 flags 0x02 dlen 11                                                                      #214 19.863934
      ATT: Read By Type Request (0x08) len 6
        Handle range: 0x00a1-0x00ac
        Attribute type: Characteristic (0x2803)
zephyr.exe[1882710]: < HCI Command: Host Number of Completed Packets (0x03|0x0035) plen 5                          #215 19.866783
        Num handles: 1
        Handle: 1551 Address: DF:A9:FF:F6:B1:1A (OUI DF-A9-FF)
        Count: 1
zephyr.exe[1882710]: < ACL Data TX: Handle 1551 flags 0x00 dlen 27                                                 #216 19.866827
zephyr.exe[1882710]: < ACL Data TX: Handle 1551 flags 0x01 dlen 7                                                  #217 19.866984
      ATT: Read By Type Response (0x09) len 29
        Attribute data length: 7
        Attribute data list: 4 entries
        Handle: 0x00a2
        Value: 12a300842b
            Properties: 0x12
              Read (0x02)
              Notify (0x10)
            Value Handle: 0x00a3
            Value UUID: Set Identity Resolving Key (0x2b84)
        Handle: 0x00a5
        Value: 12a600852b
            Properties: 0x12
              Read (0x02)
              Notify (0x10)
            Value Handle: 0x00a6
            Value UUID: Coordinated Set Size (0x2b85)
        Handle: 0x00a8
        Value: 1aa900862b
            Properties: 0x1a
              Read (0x02)
              Write (0x08)
              Notify (0x10)
            Value Handle: 0x00a9
            Value UUID: Set Member Lock (0x2b86)
        Handle: 0x00ab
        Value: 02ac00872b
            Properties: 0x02
              Read (0x02)
            Value Handle: 0x00ac
            Value UUID: Set Member Rank (0x2b87)
> HCI Event: Number of Completed Packets (0x13) plen 5                                                             #218 20.014050
        Num handles: 1
        Handle: 1551 Address: DF:A9:FF:F6:B1:1A (OUI DF-A9-FF)
        Count: 1
        #216: len 27 (1 Kb/s)
        Latency: 147 msec (146-297 msec ~221 msec)
> HCI Event: Number of Completed Packets (0x13) plen 5                                                             #219 20.163690
        Num handles: 1
        Handle: 1551 Address: DF:A9:FF:F6:B1:1A (OUI DF-A9-FF)
        Count: 1
        #217: len 7 (0 Kb/s)
        Latency: 296 msec (146-297 msec ~259 msec)
> ACL Data RX: Handle 1551 flags 0x02 dlen 11                                                                      #220 20.164035
      ATT: Read By Type Request (0x08) len 6
        Handle range: 0x00ac-0x00ac
        Attribute type: Characteristic (0x2803)
zephyr.exe[1882710]: < HCI Command: Host Number of Completed Packets (0x03|0x0035) plen 5                          #221 20.166848
        Num handles: 1
        Handle: 1551 Address: DF:A9:FF:F6:B1:1A (OUI DF-A9-FF)
        Count: 1
zephyr.exe[1882710]: < ACL Data TX: Handle 1551 flags 0x00 dlen 9                                                  #222 20.166886
      ATT: Error Response (0x01) len 4
        Read By Type Request (0x08)
        Handle: 0x00ac
        Error: Attribute Not Found (0x0a)
> HCI Event: Number of Completed Packets (0x13) plen 5                                                             #223 20.463735
        Num handles: 1
        Handle: 1551 Address: DF:A9:FF:F6:B1:1A (OUI DF-A9-FF)
        Count: 1
        #222: len 9 (0 Kb/s)
        Latency: 296 msec (146-297 msec ~278 msec)
> ACL Data RX: Handle 1551 flags 0x02 dlen 9                                                                       #224 20.463911
      ATT: Find Information Request (0x04) len 4
        Handle range: 0x00a4-0x00a4
zephyr.exe[1882710]: < HCI Command: Host Number of Completed Packets (0x03|0x0035) plen 5                          #225 20.467179
        Num handles: 1
        Handle: 1551 Address: DF:A9:FF:F6:B1:1A (OUI DF-A9-FF)
        Count: 1
zephyr.exe[1882710]: < ACL Data TX: Handle 1551 flags 0x00 dlen 10                                                 #226 20.467349
      ATT: Find Information Response (0x05) len 5
        Format: UUID-16 (0x01)
        Handle: 0x00a4
        UUID: Client Characteristic Configuration (0x2902)
> HCI Event: Number of Completed Packets (0x13) plen 5                                                             #227 20.763595
        Num handles: 1
        Handle: 1551 Address: DF:A9:FF:F6:B1:1A (OUI DF-A9-FF)
        Count: 1
        #226: len 10 (0 Kb/s)
        Latency: 296 msec (146-297 msec ~287 msec)
> ACL Data RX: Handle 1551 flags 0x02 dlen 9                                                                       #228 20.763831
      ATT: Find Information Request (0x04) len 4
        Handle range: 0x00a7-0x00a7
zephyr.exe[1882710]: < HCI Command: Host Number of Completed Packets (0x03|0x0035) plen 5                          #229 20.767213
        Num handles: 1
        Handle: 1551 Address: DF:A9:FF:F6:B1:1A (OUI DF-A9-FF)
        Count: 1
zephyr.exe[1882710]: < ACL Data TX: Handle 1551 flags 0x00 dlen 10                                                 #230 20.767273
      ATT: Find Information Response (0x05) len 5
        Format: UUID-16 (0x01)
        Handle: 0x00a7
        UUID: Client Characteristic Configuration (0x2902)
> HCI Event: Number of Completed Packets (0x13) plen 5                                                             #231 21.063634
        Num handles: 1
        Handle: 1551 Address: DF:A9:FF:F6:B1:1A (OUI DF-A9-FF)
        Count: 1
        #230: len 10 (0 Kb/s)
        Latency: 296 msec (146-297 msec ~291 msec)
> ACL Data RX: Handle 1551 flags 0x02 dlen 9                                                                       #232 21.063882
      ATT: Find Information Request (0x04) len 4
        Handle range: 0x00aa-0x00aa
zephyr.exe[1882710]: < HCI Command: Host Number of Completed Packets (0x03|0x0035) plen 5                          #233 21.067170
        Num handles: 1
        Handle: 1551 Address: DF:A9:FF:F6:B1:1A (OUI DF-A9-FF)
        Count: 1
zephyr.exe[1882710]: < ACL Data TX: Handle 1551 flags 0x00 dlen 10                                                 #234 21.067257
      ATT: Find Information Response (0x05) len 5
        Format: UUID-16 (0x01)
        Handle: 0x00aa
        UUID: Client Characteristic Configuration (0x2902)
> HCI Event: Number of Completed Packets (0x13) plen 5                                                             #235 21.363591
        Num handles: 1
        Handle: 1551 Address: DF:A9:FF:F6:B1:1A (OUI DF-A9-FF)
        Count: 1
        #234: len 10 (0 Kb/s)
        Latency: 296 msec (146-297 msec ~294 msec)
> ACL Data RX: Handle 1551 flags 0x02 dlen 9                                                                       #236 21.363958
      ATT: Write Request (0x12) len 4
        Handle: 0x0048
          Data: 0000
zephyr.exe[1882710]: < HCI Command: Host Number of Completed Packets (0x03|0x0035) plen 5                          #237 21.366943
        Num handles: 1
        Handle: 1551 Address: DF:A9:FF:F6:B1:1A (OUI DF-A9-FF)
        Count: 1
zephyr.exe[1882710]: < ACL Data TX: Handle 1551 flags 0x00 dlen 5                                                  #238 21.367032
      ATT: Write Response (0x13) len 0
> HCI Event: Number of Completed Packets (0x13) plen 5                                                             #239 21.663585
        Num handles: 1
        Handle: 1551 Address: DF:A9:FF:F6:B1:1A (OUI DF-A9-FF)
        Count: 1
        #238: len 5 (0 Kb/s)
        Latency: 296 msec (146-297 msec ~295 msec)
> ACL Data RX: Handle 1551 flags 0x02 dlen 9                                                                       #240 21.663808
      ATT: Write Request (0x12) len 4
        Handle: 0x0048
          Data: 0100
zephyr.exe[1882710]: < HCI Command: Host Number of Completed Packets (0x03|0x0035) plen 5                          #241 21.667145
        Num handles: 1
        Handle: 1551 Address: DF:A9:FF:F6:B1:1A (OUI DF-A9-FF)
        Count: 1
zephyr.exe[1882710]: < ACL Data TX: Handle 1551 flags 0x00 dlen 5                                                  #242 21.667327
      ATT: Write Response (0x13) len 0
> HCI Event: Number of Completed Packets (0x13) plen 5                                                             #243 21.963629
        Num handles: 1
        Handle: 1551 Address: DF:A9:FF:F6:B1:1A (OUI DF-A9-FF)
        Count: 1
        #242: len 5 (0 Kb/s)
        Latency: 296 msec (146-297 msec ~295 msec)
> ACL Data RX: Handle 1551 flags 0x02 dlen 9                                                                       #244 21.963889
      ATT: Write Request (0x12) len 4
        Handle: 0x004f
          Data: 0000
zephyr.exe[1882710]: < HCI Command: Host Number of Completed Packets (0x03|0x0035) plen 5                          #245 21.967027
        Num handles: 1
        Handle: 1551 Address: DF:A9:FF:F6:B1:1A (OUI DF-A9-FF)
        Count: 1
zephyr.exe[1882710]: < ACL Data TX: Handle 1551 flags 0x00 dlen 5                                                  #246 21.967150
      ATT: Write Response (0x13) len 0
> HCI Event: Number of Completed Packets (0x13) plen 5                                                             #247 22.263685
        Num handles: 1
        Handle: 1551 Address: DF:A9:FF:F6:B1:1A (OUI DF-A9-FF)
        Count: 1
        #246: len 5 (0 Kb/s)
        Latency: 296 msec (146-297 msec ~296 msec)
> ACL Data RX: Handle 1551 flags 0x02 dlen 9                                                                       #248 22.263816
      ATT: Write Request (0x12) len 4
        Handle: 0x004f
          Data: 0100
zephyr.exe[1882710]: < HCI Command: Host Number of Completed Packets (0x03|0x0035) plen 5                          #249 22.266957
        Num handles: 1
        Handle: 1551 Address: DF:A9:FF:F6:B1:1A (OUI DF-A9-FF)
        Count: 1
zephyr.exe[1882710]: < ACL Data TX: Handle 1551 flags 0x00 dlen 5                                                  #250 22.267008
      ATT: Write Response (0x13) len 0
> HCI Event: Number of Completed Packets (0x13) plen 5                                                             #251 22.563596
        Num handles: 1
        Handle: 1551 Address: DF:A9:FF:F6:B1:1A (OUI DF-A9-FF)
        Count: 1
        #250: len 5 (0 Kb/s)
        Latency: 296 msec (146-297 msec ~296 msec)
> ACL Data RX: Handle 1551 flags 0x02 dlen 9                                                                       #252 22.563825
      ATT: Write Request (0x12) len 4
        Handle: 0x0052
          Data: 0000
zephyr.exe[1882710]: < HCI Command: Host Number of Completed Packets (0x03|0x0035) plen 5                          #253 22.567218
        Num handles: 1
        Handle: 1551 Address: DF:A9:FF:F6:B1:1A (OUI DF-A9-FF)
        Count: 1
zephyr.exe[1882710]: < ACL Data TX: Handle 1551 flags 0x00 dlen 5                                                  #254 22.567268
      ATT: Write Response (0x13) len 0
> HCI Event: Number of Completed Packets (0x13) plen 5                                                             #255 22.863547
        Num handles: 1
        Handle: 1551 Address: DF:A9:FF:F6:B1:1A (OUI DF-A9-FF)
        Count: 1
        #254: len 5 (0 Kb/s)
        Latency: 296 msec (146-297 msec ~296 msec)
> ACL Data RX: Handle 1551 flags 0x02 dlen 9                                                                       #256 22.863763
      ATT: Write Request (0x12) len 4
        Handle: 0x0052
          Data: 0100
zephyr.exe[1882710]: < HCI Command: Host Number of Completed Packets (0x03|0x0035) plen 5                          #257 22.866696
        Num handles: 1
        Handle: 1551 Address: DF:A9:FF:F6:B1:1A (OUI DF-A9-FF)
        Count: 1
zephyr.exe[1882710]: < ACL Data TX: Handle 1551 flags 0x00 dlen 5                                                  #258 22.866728
      ATT: Write Response (0x13) len 0
> HCI Event: Number of Completed Packets (0x13) plen 5                                                             #259 23.163619
        Num handles: 1
        Handle: 1551 Address: DF:A9:FF:F6:B1:1A (OUI DF-A9-FF)
        Count: 1
        #258: len 5 (0 Kb/s)
        Latency: 296 msec (146-297 msec ~296 msec)
> ACL Data RX: Handle 1551 flags 0x02 dlen 9                                                                       #260 23.163830
      ATT: Write Request (0x12) len 4
        Handle: 0x0055
          Data: 0000
zephyr.exe[1882710]: < HCI Command: Host Number of Completed Packets (0x03|0x0035) plen 5                          #261 23.166831
        Num handles: 1
        Handle: 1551 Address: DF:A9:FF:F6:B1:1A (OUI DF-A9-FF)
        Count: 1
zephyr.exe[1882710]: < ACL Data TX: Handle 1551 flags 0x00 dlen 5                                                  #262 23.166903
      ATT: Write Response (0x13) len 0
> HCI Event: Number of Completed Packets (0x13) plen 5                                                             #263 23.463516
        Num handles: 1
        Handle: 1551 Address: DF:A9:FF:F6:B1:1A (OUI DF-A9-FF)
        Count: 1
        #262: len 5 (0 Kb/s)
        Latency: 296 msec (146-297 msec ~296 msec)
> ACL Data RX: Handle 1551 flags 0x02 dlen 9                                                                       #264 23.463800
      ATT: Write Request (0x12) len 4
        Handle: 0x0055
          Data: 0100
zephyr.exe[1882710]: < HCI Command: Host Number of Completed Packets (0x03|0x0035) plen 5                          #265 23.466977
        Num handles: 1
        Handle: 1551 Address: DF:A9:FF:F6:B1:1A (OUI DF-A9-FF)
        Count: 1
zephyr.exe[1882710]: < ACL Data TX: Handle 1551 flags 0x00 dlen 5                                                  #266 23.467079
      ATT: Write Response (0x13) len 0
> HCI Event: Number of Completed Packets (0x13) plen 5                                                             #267 23.763515
        Num handles: 1
        Handle: 1551 Address: DF:A9:FF:F6:B1:1A (OUI DF-A9-FF)
        Count: 1
        #266: len 5 (0 Kb/s)
        Latency: 296 msec (146-297 msec ~296 msec)
> ACL Data RX: Handle 1551 flags 0x02 dlen 9                                                                       #268 23.763708
      ATT: Write Request (0x12) len 4
        Handle: 0x0058
          Data: 0000
zephyr.exe[1882710]: < HCI Command: Host Number of Completed Packets (0x03|0x0035) plen 5                          #269 23.767523
        Num handles: 1
        Handle: 1551 Address: DF:A9:FF:F6:B1:1A (OUI DF-A9-FF)
        Count: 1
zephyr.exe[1882710]: < ACL Data TX: Handle 1551 flags 0x00 dlen 5                                                  #270 23.767605
      ATT: Write Response (0x13) len 0
> HCI Event: Number of Completed Packets (0x13) plen 5                                                             #271 24.063533
        Num handles: 1
        Handle: 1551 Address: DF:A9:FF:F6:B1:1A (OUI DF-A9-FF)
        Count: 1
        #270: len 5 (0 Kb/s)
        Latency: 295 msec (146-297 msec ~296 msec)
> ACL Data RX: Handle 1551 flags 0x02 dlen 9                                                                       #272 24.063726
      ATT: Write Request (0x12) len 4
        Handle: 0x0058
          Data: 0100
zephyr.exe[1882710]: < HCI Command: Host Number of Completed Packets (0x03|0x0035) plen 5                          #273 24.067340
        Num handles: 1
        Handle: 1551 Address: DF:A9:FF:F6:B1:1A (OUI DF-A9-FF)
        Count: 1
zephyr.exe[1882710]: < ACL Data TX: Handle 1551 flags 0x00 dlen 5                                                  #274 24.067874
      ATT: Write Response (0x13) len 0
> HCI Event: Number of Completed Packets (0x13) plen 5                                                             #275 24.363553
        Num handles: 1
        Handle: 1551 Address: DF:A9:FF:F6:B1:1A (OUI DF-A9-FF)
        Count: 1
        #274: len 5 (0 Kb/s)
        Latency: 295 msec (146-297 msec ~295 msec)
> ACL Data RX: Handle 1551 flags 0x02 dlen 9                                                                       #276 24.363684
      ATT: Write Request (0x12) len 4
        Handle: 0x005b
          Data: 0000
zephyr.exe[1882710]: < HCI Command: Host Number of Completed Packets (0x03|0x0035) plen 5                          #277 24.366869
        Num handles: 1
        Handle: 1551 Address: DF:A9:FF:F6:B1:1A (OUI DF-A9-FF)
        Count: 1
zephyr.exe[1882710]: < ACL Data TX: Handle 1551 flags 0x00 dlen 5                                                  #278 24.366920
      ATT: Write Response (0x13) len 0
> HCI Event: Number of Completed Packets (0x13) plen 5                                                             #279 24.663487
        Num handles: 1
        Handle: 1551 Address: DF:A9:FF:F6:B1:1A (OUI DF-A9-FF)
        Count: 1
        #278: len 5 (0 Kb/s)
        Latency: 296 msec (146-297 msec ~296 msec)
> ACL Data RX: Handle 1551 flags 0x02 dlen 9                                                                       #280 24.663749
      ATT: Write Request (0x12) len 4
        Handle: 0x005b
          Data: 0100
zephyr.exe[1882710]: < HCI Command: Host Number of Completed Packets (0x03|0x0035) plen 5                          #281 24.667151
        Num handles: 1
        Handle: 1551 Address: DF:A9:FF:F6:B1:1A (OUI DF-A9-FF)
        Count: 1
zephyr.exe[1882710]: < ACL Data TX: Handle 1551 flags 0x00 dlen 5                                                  #282 24.667336
      ATT: Write Response (0x13) len 0
> HCI Event: Number of Completed Packets (0x13) plen 5                                                             #283 24.963535
        Num handles: 1
        Handle: 1551 Address: DF:A9:FF:F6:B1:1A (OUI DF-A9-FF)
        Count: 1
        #282: len 5 (0 Kb/s)
        Latency: 296 msec (146-297 msec ~296 msec)
> ACL Data RX: Handle 1551 flags 0x02 dlen 7                                                                       #284 24.963640
      ATT: Read Request (0x0a) len 2
        Handle: 0x0051
zephyr.exe[1882710]: < HCI Command: Host Number of Completed Packets (0x03|0x0035) plen 5                          #285 24.967120
        Num handles: 1
        Handle: 1551 Address: DF:A9:FF:F6:B1:1A (OUI DF-A9-FF)
        Count: 1
zephyr.exe[1882710]: < ACL Data TX: Handle 1551 flags 0x00 dlen 7                                                  #286 24.967213
      ATT: Read Response (0x0b) len 2
> HCI Event: Number of Completed Packets (0x13) plen 5                                                             #287 25.263508
        Num handles: 1
        Handle: 1551 Address: DF:A9:FF:F6:B1:1A (OUI DF-A9-FF)
        Count: 1
        #286: len 7 (0 Kb/s)
        Latency: 296 msec (146-297 msec ~296 msec)
> ACL Data RX: Handle 1551 flags 0x02 dlen 7                                                                       #288 25.263693
      ATT: Read Request (0x0a) len 2
        Handle: 0x0054
zephyr.exe[1882710]: < HCI Command: Host Number of Completed Packets (0x03|0x0035) plen 5                          #289 25.267111
        Num handles: 1
        Handle: 1551 Address: DF:A9:FF:F6:B1:1A (OUI DF-A9-FF)
        Count: 1
zephyr.exe[1882710]: < ACL Data TX: Handle 1551 flags 0x00 dlen 7                                                  #290 25.267302
      ATT: Read Response (0x0b) len 2
> HCI Event: Number of Completed Packets (0x13) plen 5                                                             #291 25.563449
        Num handles: 1
        Handle: 1551 Address: DF:A9:FF:F6:B1:1A (OUI DF-A9-FF)
        Count: 1
        #290: len 7 (0 Kb/s)
        Latency: 296 msec (146-297 msec ~296 msec)
> ACL Data RX: Handle 1551 flags 0x02 dlen 7                                                                       #292 25.563765
      ATT: Read Request (0x0a) len 2
        Handle: 0x0057
zephyr.exe[1882710]: < HCI Command: Host Number of Completed Packets (0x03|0x0035) plen 5                          #293 25.567194
        Num handles: 1
        Handle: 1551 Address: DF:A9:FF:F6:B1:1A (OUI DF-A9-FF)
        Count: 1
zephyr.exe[1882710]: < ACL Data TX: Handle 1551 flags 0x00 dlen 7                                                  #294 25.567368
      ATT: Read Response (0x0b) len 2
> HCI Event: Number of Completed Packets (0x13) plen 5                                                             #295 25.863472
        Num handles: 1
        Handle: 1551 Address: DF:A9:FF:F6:B1:1A (OUI DF-A9-FF)
        Count: 1
        #294: len 7 (0 Kb/s)
        Latency: 296 msec (146-297 msec ~296 msec)
> ACL Data RX: Handle 1551 flags 0x02 dlen 7                                                                       #296 25.863591
      ATT: Read Request (0x0a) len 2
        Handle: 0x005a
zephyr.exe[1882710]: < HCI Command: Host Number of Completed Packets (0x03|0x0035) plen 5                          #297 25.867293
        Num handles: 1
        Handle: 1551 Address: DF:A9:FF:F6:B1:1A (OUI DF-A9-FF)
        Count: 1
zephyr.exe[1882710]: < ACL Data TX: Handle 1551 flags 0x00 dlen 7                                                  #298 25.867423
      ATT: Read Response (0x0b) len 2
> HCI Event: Number of Completed Packets (0x13) plen 5                                                             #299 26.163420
        Num handles: 1
        Handle: 1551 Address: DF:A9:FF:F6:B1:1A (OUI DF-A9-FF)
        Count: 1
        #298: len 7 (0 Kb/s)
        Latency: 295 msec (146-297 msec ~296 msec)
> ACL Data RX: Handle 1551 flags 0x02 dlen 9                                                                       #300 26.163757
      ATT: Write Request (0x12) len 4
        Handle: 0x00aa
          Data: 0000
zephyr.exe[1882710]: < HCI Command: Host Number of Completed Packets (0x03|0x0035) plen 5                          #301 26.167233
        Num handles: 1
        Handle: 1551 Address: DF:A9:FF:F6:B1:1A (OUI DF-A9-FF)
        Count: 1
zephyr.exe[1882710]: < ACL Data TX: Handle 1551 flags 0x00 dlen 5                                                  #302 26.167381
      ATT: Write Response (0x13) len 0
> HCI Event: Number of Completed Packets (0x13) plen 5                                                             #303 26.463480
        Num handles: 1
        Handle: 1551 Address: DF:A9:FF:F6:B1:1A (OUI DF-A9-FF)
        Count: 1
        #302: len 5 (0 Kb/s)
        Latency: 296 msec (146-297 msec ~296 msec)
> ACL Data RX: Handle 1551 flags 0x02 dlen 9                                                                       #304 26.463661
      ATT: Write Request (0x12) len 4
        Handle: 0x00aa
          Data: 0100
zephyr.exe[1882710]: < HCI Command: Host Number of Completed Packets (0x03|0x0035) plen 5                          #305 26.466852
        Num handles: 1
        Handle: 1551 Address: DF:A9:FF:F6:B1:1A (OUI DF-A9-FF)
        Count: 1
zephyr.exe[1882710]: < ACL Data TX: Handle 1551 flags 0x00 dlen 5                                                  #306 26.466899
      ATT: Write Response (0x13) len 0
> HCI Event: Number of Completed Packets (0x13) plen 5                                                             #307 26.763456
        Num handles: 1
        Handle: 1551 Address: DF:A9:FF:F6:B1:1A (OUI DF-A9-FF)
        Count: 1
        #306: len 5 (0 Kb/s)
        Latency: 296 msec (146-297 msec ~296 msec)
> ACL Data RX: Handle 1551 flags 0x02 dlen 7                                                                       #308 26.763657
      ATT: Read Request (0x0a) len 2
        Handle: 0x003e
zephyr.exe[1882710]: < HCI Command: Host Number of Completed Packets (0x03|0x0035) plen 5                          #309 26.767332
        Num handles: 1
        Handle: 1551 Address: DF:A9:FF:F6:B1:1A (OUI DF-A9-FF)
        Count: 1
zephyr.exe[1882710]: < ACL Data TX: Handle 1551 flags 0x00 dlen 9                                                  #310 26.767450
      ATT: Read Response (0x0b) len 4
> HCI Event: Number of Completed Packets (0x13) plen 5                                                             #311 27.063418
        Num handles: 1
        Handle: 1551 Address: DF:A9:FF:F6:B1:1A (OUI DF-A9-FF)
        Count: 1
        #310: len 9 (0 Kb/s)
        Latency: 295 msec (146-297 msec ~296 msec)
> ACL Data RX: Handle 1551 flags 0x02 dlen 7                                                                       #312 27.063563
      ATT: Read Request (0x0a) len 2
        Handle: 0x003b
zephyr.exe[1882710]: < HCI Command: Host Number of Completed Packets (0x03|0x0035) plen 5                          #313 27.067213
        Num handles: 1
        Handle: 1551 Address: DF:A9:FF:F6:B1:1A (OUI DF-A9-FF)
        Count: 1
zephyr.exe[1882710]: < ACL Data TX: Handle 1551 flags 0x00 dlen 27                                                 #314 27.067286
zephyr.exe[1882710]: < ACL Data TX: Handle 1551 flags 0x01 dlen 27                                                 #315 27.067500
zephyr.exe[1882710]: < ACL Data TX: Handle 1551 flags 0x01 dlen 12                                                 #316 27.067516
      ATT: Read Response (0x0b) len 61
> HCI Event: Number of Completed Packets (0x13) plen 5                                                             #317 27.213828
        Num handles: 1
        Handle: 1551 Address: DF:A9:FF:F6:B1:1A (OUI DF-A9-FF)
        Count: 1
        #314: len 27 (1 Kb/s)
        Latency: 146 msec (146-297 msec ~221 msec)
> HCI Event: Number of Completed Packets (0x13) plen 5                                                             #318 27.214360
        Num handles: 1
        Handle: 1551 Address: DF:A9:FF:F6:B1:1A (OUI DF-A9-FF)
        Count: 1
        #315: len 27 (1 Kb/s)
        Latency: 146 msec (146-297 msec ~184 msec)
> HCI Event: Number of Completed Packets (0x13) plen 5                                                             #319 27.363462
        Num handles: 1
        Handle: 1551 Address: DF:A9:FF:F6:B1:1A (OUI DF-A9-FF)
        Count: 1
        #316: len 12 (0 Kb/s)
        Latency: 295 msec (146-297 msec ~240 msec)
> ACL Data RX: Handle 1551 flags 0x02 dlen 7                                                                       #320 27.363676
      ATT: Read Request (0x0a) len 2
        Handle: 0x0047
zephyr.exe[1882710]: < HCI Command: Host Number of Completed Packets (0x03|0x0035) plen 5                          #321 27.367001
        Num handles: 1
        Handle: 1551 Address: DF:A9:FF:F6:B1:1A (OUI DF-A9-FF)
        Count: 1
zephyr.exe[1882710]: < ACL Data TX: Handle 1551 flags 0x00 dlen 9                                                  #322 27.367064
      ATT: Read Response (0x0b) len 4
> HCI Event: Number of Completed Packets (0x13) plen 5                                                             #323 27.663410
        Num handles: 1
        Handle: 1551 Address: DF:A9:FF:F6:B1:1A (OUI DF-A9-FF)
        Count: 1
        #322: len 9 (0 Kb/s)
        Latency: 296 msec (146-297 msec ~268 msec)
> ACL Data RX: Handle 1551 flags 0x02 dlen 7                                                                       #324 27.663582
      ATT: Read Request (0x0a) len 2
        Handle: 0x004a
zephyr.exe[1882710]: < HCI Command: Host Number of Completed Packets (0x03|0x0035) plen 5   