Bluetooth monitor ver 5.72
= Note: Linux version 6.14.0-36-generic (x86_64)                       0.659302
= Note: Bluetooth subsystem version 2.22                               0.659304
= New Index: 00:00:00:00:00:00 (Primary,UART,hci1)              [hci1] 0.659305
= New Index: 48:5F:99:8E:E0:64 (Primary,USB,hci0)               [hci0] 0.659305
= Open Index: 00:00:00:00:00:00                                 [hci1] 0.773193
= Index Info: 00:00:00:00:00:00 (Nordic Semiconductor ASA)      [hci1] 0.773207
@ USER Open: main (privileged) version 2.22            {0x0001} [hci1] 0.773216
< HCI Command: Reset (0x03|0x0003) plen 0                    #1 [hci1] 0.774588
> HCI Event: Command Complete (0x0e) plen 4                  #2 [hci1] 0.775154
      Reset (0x03|0x0003) ncmd 1
        Status: Success (0x00)
< HCI Command: Read Local Supported... (0x04|0x0003) plen 0  #3 [hci1] 0.793031
> HCI Event: Command Complete (0x0e) plen 12                 #4 [hci1] 0.793616
      Read Local Supported Features (0x04|0x0003) ncmd 1
        Status: Success (0x00)
        Features: 0x00 0x00 0x00 0x00 0x60 0x00 0x00 0x00
          BR/EDR Not Supported
          LE Supported (Controller)
< HCI Command: Read Local Version In.. (0x04|0x0001) plen 0  #5 [hci1] 0.812670
> HCI Event: Command Complete (0x0e) plen 12                 #6 [hci1] 0.813234
      Read Local Version Information (0x04|0x0001) ncmd 1
        Status: Success (0x00)
        HCI version: Reserved (0x0f) - Revision 12393 (0x3069)
        LMP version: Reserved (0x0f) - Subversion 12393 (0x3069)
        Manufacturer: Nordic Semiconductor ASA (89)
< HCI Command: Read Local Supported... (0x04|0x0002) plen 0  #7 [hci1] 0.832558
> HCI Event: Command Complete (0x0e) plen 68                 #8 [hci1] 0.833657
      Read Local Supported Commands (0x04|0x0002) ncmd 1
        Status: Success (0x00)
        Commands: 119 entries
          Disconnect (Octet 0 - Bit 5)
          Read Remote Version Information (Octet 2 - Bit 7)
          Set Event Mask (Octet 5 - Bit 6)
          Reset (Octet 5 - Bit 7)
          Read Connection Accept Timeout (Octet 7 - Bit 2)
          Write Connection Accept Timeout (Octet 7 - Bit 3)
          Read Transmit Power Level (Octet 10 - Bit 2)
          Set Controller To Host Flow Control (Octet 10 - Bit 5)
          Host Buffer Size (Octet 10 - Bit 6)
          Host Number of Completed Packets (Octet 10 - Bit 7)
          Read Local Version Information (Octet 14 - Bit 3)
          Read Local Supported Features (Octet 14 - Bit 5)
          Read BD ADDR (Octet 15 - Bit 1)
          Read RSSI (Octet 15 - Bit 5)
          Set Event Mask Page 2 (Octet 22 - Bit 2)
          LE Set Event Mask (Octet 25 - Bit 0)
          LE Read Buffer Size (Octet 25 - Bit 1)
          LE Read Local Supported Features (Octet 25 - Bit 2)
          LE Set Random Address (Octet 25 - Bit 4)
          LE Set Advertising Parameters (Octet 25 - Bit 5)
          LE Read Advertising Channel TX Power (Octet 25 - Bit 6)
          LE Set Advertising Data (Octet 25 - Bit 7)
          LE Set Scan Response Data (Octet 26 - Bit 0)
          LE Set Advertise Enable (Octet 26 - Bit 1)
          LE Set Scan Parameters (Octet 26 - Bit 2)
          LE Set Scan Enable (Octet 26 - Bit 3)
          LE Create Connection (Octet 26 - Bit 4)
          LE Create Connection Cancel (Octet 26 - Bit 5)
          LE Read Accept List Size (Octet 26 - Bit 6)
          LE Clear Accept List (Octet 26 - Bit 7)
          LE Add Device To Accept List (Octet 27 - Bit 0)
          LE Remove Device From Accept List (Octet 27 - Bit 1)
          LE Connection Update (Octet 27 - Bit 2)
          LE Set Host Channel Classification (Octet 27 - Bit 3)
          LE Read Channel Map (Octet 27 - Bit 4)
          LE Read Remote Used Features (Octet 27 - Bit 5)
          LE Encrypt (Octet 27 - Bit 6)
          LE Rand (Octet 27 - Bit 7)
          LE Start Encryption (Octet 28 - Bit 0)
          LE Long Term Key Request Reply (Octet 28 - Bit 1)
          LE Long Term Key Request Neg Reply (Octet 28 - Bit 2)
          LE Read Supported States (Octet 28 - Bit 3)
          LE Receiver Test (Octet 28 - Bit 4)
          LE Transmitter Test (Octet 28 - Bit 5)
          LE Test End (Octet 28 - Bit 6)
          Read Authenticated Payload Timeout (Octet 32 - Bit 4)
          Write Authenticated Payload Timeout (Octet 32 - Bit 5)
          LE Set Data Length (Octet 33 - Bit 6)
          LE Read Suggested Default Data Length (Octet 33 - Bit 7)
          LE Write Suggested Default Data Length (Octet 34 - Bit 0)
          LE Add Device To Resolving List (Octet 34 - Bit 3)
          LE Remove Device From Resolving List (Octet 34 - Bit 4)
          LE Clear Resolving List (Octet 34 - Bit 5)
          LE Read Resolving List Size (Octet 34 - Bit 6)
          LE Set Address Resolution Enable (Octet 35 - Bit 1)
          LE Set Resolvable Private Address Timeout (Octet 35 - Bit 2)
          LE Read Maximum Data Length (Octet 35 - Bit 3)
          LE Read PHY (Octet 35 - Bit 4)
          LE Set Default PHY (Octet 35 - Bit 5)
          LE Set PHY (Octet 35 - Bit 6)
          LE Enhanced Receiver Test (Octet 35 - Bit 7)
          LE Enhanced Transmitter Test (Octet 36 - Bit 0)
          LE Set Advertising Set Random Address (Octet 36 - Bit 1)
          LE Set Extended Advertising Parameters (Octet 36 - Bit 2)
          LE Set Extended Advertising Data (Octet 36 - Bit 3)
          LE Set Extended Scan Response Data (Octet 36 - Bit 4)
          LE Set Extended Advertising Enable (Octet 36 - Bit 5)
          LE Read Maximum Advertising Data Length (Octet 36 - Bit 6)
          LE Read Number of Supported Advertising Sets (Octet 36 - Bit 7)
          LE Remove Advertising Set (Octet 37 - Bit 0)
          LE Clear Advertising Sets (Octet 37 - Bit 1)
          LE Set Periodic Advertising Parameters (Octet 37 - Bit 2)
          LE Set Periodic Advertising Data (Octet 37 - Bit 3)
          LE Set Periodic Advertising Enable (Octet 37 - Bit 4)
          LE Set Extended Scan Parameters (Octet 37 - Bit 5)
          LE Set Extended Scan Enable (Octet 37 - Bit 6)
          LE Extended Create Connection (Octet 37 - Bit 7)
          LE Periodic Advertising Create Sync (Octet 38 - Bit 0)
          LE Periodic Advertising Create Sync Cancel (Octet 38 - Bit 1)
          LE Periodic Advertising Terminate Sync (Octet 38 - Bit 2)
          LE Add Device To Periodic Advertiser List (Octet 38 - Bit 3)
          LE Remove Device From Periodic Advertiser List (Octet 38 - Bit 4)
          LE Clear Periodic Advertiser List (Octet 38 - Bit 5)
          LE Read Periodic Advertiser List Size (Octet 38 - Bit 6)
          LE Read Transmit Power (Octet 38 - Bit 7)
          LE Read RF Path Compensation (Octet 39 - Bit 0)
          LE Write RF Path Compensation (Octet 39 - Bit 1)
          LE Set Privacy Mode (Octet 39 - Bit 2)
          LE Periodic Advertising Receive Enable (Octet 40 - Bit 5)
          LE Periodic Advertising Sync Transfer (Octet 40 - Bit 6)
          LE Periodic Advertising Set Info Transfer (Octet 40 - Bit 7)
          LE Periodic Advertising Sync Transfer Parameters (Octet 41 - Bit 0)
          LE Set Default Periodic Advertisng Sync Transfer Parameters (Octet 41 - Bit 1)
          LE Read Buffer v2 (Octet 41 - Bit 5)
          LE Read ISO TX Sync (Octet 41 - Bit 6)
          LE Set Connected Isochronous Group Parameters (Octet 41 - Bit 7)
          LE Set Connected Isochronous Group Parameters Test (Octet 42 - Bit 0)
          LE Create Connected Isochronous Stream (Octet 42 - Bit 1)
          LE Remove Connected Isochronous Group (Octet 42 - Bit 2)
          LE Accept Connected Isochronous Stream Request (Octet 42 - Bit 3)
          LE Reject Connected Isochronous Stream Request (Octet 42 - Bit 4)
          LE Create Broadcast Isochronous Group (Octet 42 - Bit 5)
          LE Create Broadcast Isochronous Group Test (Octet 42 - Bit 6)
          LE Terminate Broadcast Isochronous Group (Octet 42 - Bit 7)
          LE Broadcast Isochronous Group Create Sync (Octet 43 - Bit 0)
          LE Broadcast Isochronous Group Terminate Sync (Octet 43 - Bit 1)
          LE Request Peer SCA (Octet 43 - Bit 2)
          LE Setup Isochronous Data Path (Octet 43 - Bit 3)
          LE Remove Isochronous Data Path (Octet 43 - Bit 4)
          LE Isochronous Transmit Test (Octet 43 - Bit 5)
          LE Isochronous Receive Test (Octet 43 - Bit 6)
          LE Isochronous Read Test Counters (Octet 43 - Bit 7)
          LE Isochronous Read Test Counters (Octet 44 - Bit 0)
          LE Set Host Feature (Octet 44 - Bit 1)
          Octet 44 - Bit 2 
          Octet 45 - Bit 6 
          Octet 46 - Bit 0 
          Octet 46 - Bit 1 
          Octet 46 - Bit 2 
< HCI Command: Host Buffer Size (0x03|0x0033) plen 7         #9 [hci1] 0.852609
        ACL MTU: 255  ACL max packet: 16
        SCO MTU: 0    SCO max packet: 0
> HCI Event: Command Complete (0x0e) plen 4                 #10 [hci1] 0.853166
      Host Buffer Size (0x03|0x0033) ncmd 1
        Status: Success (0x00)
< HCI Command: Set Controller To Ho.. (0x03|0x0031) plen 1  #11 [hci1] 0.872562
        Flow control: ACL Data Packets (0x01)
> HCI Event: Command Complete (0x0e) plen 4                 #12 [hci1] 0.873032
      Set Controller To Host Flow Control (0x03|0x0031) ncmd 1
        Status: Success (0x00)
< HCI Command: LE Read Local Suppor.. (0x08|0x0003) plen 0  #13 [hci1] 0.892575
> HCI Event: Command Complete (0x0e) plen 12                #14 [hci1] 0.893092
      LE Read Local Supported Features (0x08|0x0003) ncmd 1
        Status: Success (0x00)
        Features: 0xfd 0x79 0x00 0xf7 0x30 0x01 0x00 0x00
          LE Encryption
          Extended Reject Indication
          Peripheral-initiated Features Exchange
          LE Ping
          LE Data Packet Length Extension
          LL Privacy
          Extended Scanner Filter Policies
          LE 2M PHY
          LE Coded PHY
          LE Extended Advertising
          LE Periodic Advertising
          Channel Selection Algorithm #2
          Periodic Advertising Sync Transfer - Sender
          Periodic Advertising Sync Transfer - Recipient
          Sleep Clock Accuracy Updates
          Connected Isochronous Stream - Central
          Connected Isochronous Stream - Peripheral
          Isochronous Broadcaster
          Synchronized Receiver
          Periodic Advertising ADI support
          Connection Subrating
          Unknown features (0x0000010000000000)
< HCI Command: LE Set Host Feature (0x08|0x0074) plen 2     #15 [hci1] 0.912618
        Bit Number: 32
          Connected Isochronous Stream (Host Support)
        Bit Value: 1
> HCI Event: Command Complete (0x0e) plen 4                 #16 [hci1] 0.913069
      LE Set Host Feature (0x08|0x0074) ncmd 1
        Status: Success (0x00)
< HCI Command: LE Read Buffer v2 (0x08|0x0060) plen 0       #17 [hci1] 0.932626
> HCI Event: Command Complete (0x0e) plen 10                #18 [hci1] 0.933139
      LE Read Buffer v2 (0x08|0x0060) ncmd 1
        Status: Success (0x00)
        ACL MTU: 27
        ACL max packet: 3
        ISO MTU: 318
        ISO max packet: 3
< HCI Command: LE Read Maximum Adve.. (0x08|0x003a) plen 0  #19 [hci1] 0.952628
> HCI Event: Command Complete (0x0e) plen 6                 #20 [hci1] 0.953101
      LE Read Maximum Advertising Data Length (0x08|0x003a) ncmd 1
        Status: Success (0x00)
        Max length: 1650
< HCI Command: LE Read Supported St.. (0x08|0x001c) plen 0  #21 [hci1] 0.972607
> HCI Event: Command Complete (0x0e) plen 12                #22 [hci1] 0.973086
      LE Read Supported States (0x08|0x001c) ncmd 1
        Status: Success (0x00)
        States: 0x000003ff3e0306ff
          Non-connectable Advertising State
          Scannable Advertising State
          Connectable Advertising State
          High Duty Cycle Directed Advertising State
          Passive Scanning State
          Active Scanning State
          Initiating State
            and Connection State (Central Role)
          Connection State (Peripheral Role)
          Scannable Advertising State
            and Passive Scanning State
          Connectable Advertising State
            and Passive Scanning State
          Non-connectable Advertising State
            and Initiating State
          Scannable Advertising State
            and Initiating State
          Active Scanning State
            and Connection State (Central Role)
          Passive Scanning State
            and Connection State (Peripheral Role)
          Active Scanning State
            and Connection State (Peripheral Role)
          Initiating State
            and Connection State (Central Role)
            and Central Role & Central Role
          Low Duty Cycle Directed Advertising State
          Connectable Advertising State
            and Initiating State
            and Central Role & Peripheral Role
          High Duty Cycle Directed Advertising State
            and Initiating State
            and Central Role & Peripheral Role
          Low Duty Cycle Directed Advertising State
            and Initiating State
            and Central Role & Peripheral Role
          Connectable Advertising State
            and Connection State (Central Role)
            and Central Role & Peripheral Role
          High Duty Cycle Directed Advertising State
            and Connection State (Central Role)
            and Central Role & Peripheral Role
          Low Duty Cycle Directed Advertising State
            and Connection State (Central Role)
            and Central Role & Peripheral Role
          Connectable Advertising State
            and Connection State (Peripheral Role)
            and Central Role & Peripheral Role
          High Duty Cycle Directed Advertising State
            and Connection State (Peripheral Role)
            and Peripheral Role & Peripheral Role
          Low Duty Cycle Directed Advertising State
            and Connection State (Peripheral Role)
            and Peripheral Role & Peripheral Role
          Initiating State
            and Connection State (Peripheral Role)
            and Central Role & Peripheral Role
< HCI Command: LE Read Maximum Data.. (0x08|0x002f) plen 0  #23 [hci1] 0.992607
> HCI Event: Command Complete (0x0e) plen 12                #24 [hci1] 0.993114
      LE Read Maximum Data Length (0x08|0x002f) ncmd 1
        Status: Success (0x00)
        Max TX octets: 251
        Max TX time: 2704
        Max RX octets: 251
        Max RX time: 2704
< HCI Command: LE Write Suggested D.. (0x08|0x0024) plen 4  #25 [hci1] 1.012599
        TX octets: 251
        TX time: 2704
> HCI Event: Command Complete (0x0e) plen 4                 #26 [hci1] 1.013121
      LE Write Suggested Default Data Length (0x08|0x0024) ncmd 1
        Status: Success (0x00)
< HCI Command: LE Read Resolving Li.. (0x08|0x002a) plen 0  #27 [hci1] 1.032568
> HCI Event: Command Complete (0x0e) plen 5                 #28 [hci1] 1.032987
      LE Read Resolving List Size (0x08|0x002a) ncmd 1
        Status: Success (0x00)
        Size: 8
< HCI Command: LE Set Event Mask (0x08|0x0001) plen 8       #29 [hci1] 1.052574
        Mask: 0x000002023f87fa5e
          LE Advertising Report
          LE Connection Update Complete
          LE Read Remote Used Features Complete
          LE Long Term Key Request
          LE Data Length Change
          LE Enhanced Connection Complete
          LE PHY Update Complete
          LE Extended Advertising Report
          LE Periodic Advertising Sync Established
          LE Periodic Advertising Report
          LE Periodic Advertising Sync Lost
          LE Extended Scan Timeout
          LE Extended Advertising Set Terminated
          LE Scan Request Received
          LE Periodic Advertising Sync Transfer Rvc
          LE CIS Established
          LE CIS Request
          LE Create BIG Complete
          LE Terminate BIG Complete
          LE BIG Sync Estabilished Complete
          LE BIG Sync Lost
          LE BIG Info Advertising Report
          Unknown mask (0x0000020000000000)
> HCI Event: Command Complete (0x0e) plen 4                 #30 [hci1] 1.053107
      LE Set Event Mask (0x08|0x0001) ncmd 1
        Status: Success (0x00)
< HCI Command: Set Event Mask (0x03|0x0001) plen 8          #31 [hci1] 1.072607
        Mask: 0x2000800002008890
          Disconnection Complete
          Encryption Change
          Read Remote Version Information Complete
          Hardware Error
          Data Buffer Overflow
          Encryption Key Refresh Complete
          LE Meta
> HCI Event: Command Complete (0x0e) plen 4                 #32 [hci1] 1.073163
      Set Event Mask (0x03|0x0001) ncmd 1
        Status: Success (0x00)
< HCI Command: Read BD ADDR (0x04|0x0009) plen 0            #33 [hci1] 1.092596
> HCI Event: Command Complete (0x0e) plen 10                #34 [hci1] 1.093034
      Read BD ADDR (0x04|0x0009) ncmd 1
        Status: Success (0x00)
        Address: 00:00:00:00:00:00 (OUI 00-00-00)
< HCI Command: LE Set Random Address (0x08|0x0005) plen 6   #35 [hci1] 1.112594
        Address: D5:B6:CC:31:DB:3B (Static)
> HCI Event: Command Complete (0x0e) plen 4                 #36 [hci1] 1.113103
      LE Set Random Address (0x08|0x0005) ncmd 1
        Status: Success (0x00)
< HCI Command: LE Set Extended Adv.. (0x08|0x0036) plen 25  #37 [hci1] 3.733192
        Handle: 0x00
        Properties: 0x0013
          Connectable
          Scannable
          Use legacy advertising PDUs: ADV_IND
        Min advertising interval: 100.000 msec (0x00a0)
        Max advertising interval: 150.000 msec (0x00f0)
        Channel map: 37, 38, 39 (0x07)
        Own address type: Random (0x01)
        Peer address type: Public (0x00)
        Peer address: 00:00:00:00:00:00 (OUI 00-00-00)
        Filter policy: Allow Scan Request from Any, Allow Connect Request from Any (0x00)
        TX power: Host has no preference (0x7f)
        Primary PHY: LE 1M (0x01)
        Secondary max skip: 0x00
        Secondary PHY: LE 1M (0x01)
        SID: 0x00
        Scan request notifications: Disabled (0x00)
> HCI Event: Command Complete (0x0e) plen 5                 #38 [hci1] 3.734066
      LE Set Extended Advertising Parameters (0x08|0x0036) ncmd 1
        Status: Success (0x00)
        TX power (selected): 0 dbm (0x00)
< HCI Command: LE Set Advertising S.. (0x08|0x0035) plen 7  #39 [hci1] 3.752869
        Advertising handle: 0x00
        Advertising random address: D5:B6:CC:31:DB:3B (Static)
> HCI Event: Command Complete (0x0e) plen 4                 #40 [hci1] 3.753362
      LE Set Advertising Set Random Address (0x08|0x0035) ncmd 1
        Status: Success (0x00)
< HCI Command: LE Set Extended Adv.. (0x08|0x0037) plen 22  #41 [hci1] 3.772664
        Handle: 0x00
        Operation: Complete extended advertising data (0x03)
        Fragment preference: Minimize fragmentation (0x01)
        Data length: 0x12
        Flags: 0x06
          LE General Discoverable Mode
          BR/EDR Not Supported
        Name (complete): Tester_F6B11A
> HCI Event: Command Complete (0x0e) plen 4                 #42 [hci1] 3.773352
      LE Set Extended Advertising Data (0x08|0x0037) ncmd 1
        Status: Success (0x00)
< HCI Command: LE Set Extended Scan.. (0x08|0x0038) plen 4  #43 [hci1] 3.792619
        Handle: 0x00
        Operation: Complete scan response data (0x03)
        Fragment preference: Minimize fragmentation (0x01)
        Data length: 0x00
> HCI Event: Command Complete (0x0e) plen 4                 #44 [hci1] 3.793086
      LE Set Extended Scan Response Data (0x08|0x0038) ncmd 1
        Status: Success (0x00)
< HCI Command: LE Set Extended Adve.. (0x08|0x0039) plen 6  #45 [hci1] 3.812654
        Extended advertising: Enabled (0x01)
        Number of sets: 1 (0x01)
        Entry 0
          Handle: 0x00
          Duration: 0 ms (0x00)
          Max ext adv events: 0
> HCI Event: Command Complete (0x0e) plen 4                 #46 [hci1] 3.813227
      LE Set Extended Advertising Enable (0x08|0x0039) ncmd 1
        Status: Success (0x00)
> HCI Event: LE Meta Event (0x3e) plen 31                   #47 [hci1] 3.922766
      LE Enhanced Connection Complete (0x0a)
        Status: Success (0x00)
        Handle: 1119
        Role: Peripheral (0x01)
        Peer address type: Public (0x00)
        Peer address: DF:A9:FF:F6:B1:1A (OUI DF-A9-FF)
        Local resolvable private address: 00:00:00:00:00:00 (Non-Resolvable)
        Peer resolvable private address: 00:00:00:00:00:00 (Non-Resolvable)
        Connection interval: 87.50 msec (0x0046)
        Connection latency: 0 (0x0000)
        Supervision timeout: 25120 msec (0x09d0)
        Central clock accuracy: 0x01
> HCI Event: LE Meta Event (0x3e) plen 6                    #48 [hci1] 3.922862
      LE Advertising Set Terminated (0x12)
        Status: Success (0x00)
        Handle: 0
        Connection handle: 1119
        Number of completed extended advertising events: 0
< HCI Command: LE Read Remote Used... (0x08|0x0016) plen 2  #49 [hci1] 3.933035
        Handle: 1119 Address: DF:A9:FF:F6:B1:1A (OUI DF-A9-FF)
< ACL Data TX: Handle 1119 flags 0x00 dlen 7                #50 [hci1] 3.933042
      ATT: Exchange MTU Request (0x02) len 2
        Client RX MTU: 251
> HCI Event: Command Status (0x0f) plen 4                   #51 [hci1] 3.933610
      LE Read Remote Used Features (0x08|0x0016) ncmd 1
        Status: Success (0x00)
> HCI Event: Number of Completed Packets (0x13) plen 5      #52 [hci1] 4.098798
        Num handles: 1
        Handle: 1119 Address: DF:A9:FF:F6:B1:1A (OUI DF-A9-FF)
        Count: 1
        #50: len 7 (0 Kb/s)
        Latency: 165 msec (165-165 msec ~165 msec)
> HCI Event: LE Meta Event (0x3e) plen 12                   #53 [hci1] 4.186721
      LE Read Remote Used Features (0x04)
        Status: Success (0x00)
        Handle: 1119 Address: DF:A9:FF:F6:B1:1A (OUI DF-A9-FF)
        Features: 0x2d 0x49 0x00 0xf7 0x67 0xd9 0x00 0x80
          LE Encryption
          Extended Reject Indication
          Peripheral-initiated Features Exchange
          LE Data Packet Length Extension
          LE 2M PHY
          LE Coded PHY
          Channel Selection Algorithm #2
          Periodic Advertising Sync Transfer - Sender
          Periodic Advertising Sync Transfer - Recipient
          Sleep Clock Accuracy Updates
          Connected Isochronous Stream - Central
          Connected Isochronous Stream - Peripheral
          Isochronous Broadcaster
          Synchronized Receiver
          Connected Isochronous Stream (Host Support)
          LE Power Control Request
          LE Power Control Request
          Connection Subrating
          Connection Subrating (Host Support)
          Unknown features (0x8000d90000000000)
> ACL Data RX: Handle 1119 flags 0x02 dlen 11               #54 [hci1] 6.636514
      SMP: Pairing Request (0x01) len 6
        IO capability: KeyboardDisplay (0x04)
        OOB data: Authentication data not present (0x00)
        Authentication requirement: Bonding, MITM, SC, No Keypresses (0x0d)
        Max encryption key size: 16
        Initiator key distribution: EncKey IdKey (0x03)
        Responder key distribution: EncKey IdKey Sign (0x07)
> ACL Data RX: Handle 1119 flags 0x02 dlen 7                #55 [hci1] 6.636936
      ATT: Exchange MTU Response (0x03) len 2
        Server RX MTU: 23
< HCI Command: Host Number of Compl.. (0x03|0x0035) plen 5  #56 [hci1] 6.653228
        Num handles: 1
        Handle: 1119 Address: DF:A9:FF:F6:B1:1A (OUI DF-A9-FF)
        Count: 1
< ACL Data TX: Handle 1119 flags 0x00 dlen 11               #57 [hci1] 6.653354
      SMP: Pairing Response (0x02) len 6
        IO capability: DisplayOnly (0x00)
        OOB data: Authentication data not present (0x00)
        Authentication requirement: Bonding, No MITM, SC, No Keypresses (0x09)
        Max encryption key size: 16
        Initiator key distribution: IdKey (0x02)
        Responder key distribution: <none> (0x00)
< HCI Command: Host Number of Compl.. (0x03|0x0035) plen 5  #58 [hci1] 6.653841
        Num handles: 1
        Handle: 1119 Address: DF:A9:FF:F6:B1:1A (OUI DF-A9-FF)
        Count: 1
> HCI Event: Number of Completed Packets (0x13) plen 5      #59 [hci1] 6.811583
        Num handles: 1
        Handle: 1119 Address: DF:A9:FF:F6:B1:1A (OUI DF-A9-FF)
        Count: 1
        #57: len 11 (0 Kb/s)
        Latency: 158 msec (158-165 msec ~161 msec)
> ACL Data RX: Handle 1119 flags 0x02 dlen 27               #60 [hci1] 6.811833
> ACL Data RX: Handle 1119 flags 0x01 dlen 27               #61 [hci1] 6.812322
> ACL Data RX: Handle 1119 flags 0x01 dlen 15               #62 [hci1] 6.812781
      SMP: Pairing Public Key (0x0c) len 64
        X: 4d845e7e6a4b04f2004a6cf645ce37e807a83a2d90902413f6c6d66e539be85d
        Y: c74fe2717ff61edd77f91391c4e22a6385a7df9e164d0dbc33f164c0119465d4
< HCI Command: Host Number of Compl.. (0x03|0x0035) plen 5  #63 [hci1] 6.813253
        Num handles: 1
        Handle: 1119 Address: DF:A9:FF:F6:B1:1A (OUI DF-A9-FF)
        Count: 1
< HCI Command: Host Number of Compl.. (0x03|0x0035) plen 5  #64 [hci1] 6.832715
        Num handles: 1
        Handle: 1119 Address: DF:A9:FF:F6:B1:1A (OUI DF-A9-FF)
        Count: 1
< HCI Command: Host Number of Compl.. (0x03|0x0035) plen 5  #65 [hci1] 6.832827
        Num handles: 1
        Handle: 1119 Address: DF:A9:FF:F6:B1:1A (OUI DF-A9-FF)
        Count: 1
< ACL Data TX: Handle 1119 flags 0x00 dlen 27               #66 [hci1] 6.832903
< ACL Data TX: Handle 1119 flags 0x01 dlen 27               #67 [hci1] 6.832907
< ACL Data TX: Handle 1119 flags 0x01 dlen 15               #68 [hci1] 6.832908
      SMP: Pairing Public Key (0x0c) len 64
        X: 98308440221e2d910f0e54b71e7ec652857aa9b5a0dc65028824cc19db1226e9
        Y: 67a4816bcb62efb21701e31fdb27561a6217575fb007a8bbdabe7e28b6f68482
> HCI Event: Number of Completed Packets (0x13) plen 5      #69 [hci1] 6.899456
        Num handles: 1
        Handle: 1119 Address: DF:A9:FF:F6:B1:1A (OUI DF-A9-FF)
        Count: 1
        #66: len 27 (3 Kb/s)
        Latency: 66 msec (66-165 msec ~114 msec)
> HCI Event: Number of Completed Packets (0x13) plen 5      #70 [hci1] 6.900039
        Num handles: 1
        Handle: 1119 Address: DF:A9:FF:F6:B1:1A (OUI DF-A9-FF)
        Count: 1
        #67: len 27 (3 Kb/s)
        Latency: 67 msec (66-165 msec ~90 msec)
> HCI Event: Number of Completed Packets (0x13) plen 5      #71 [hci1] 6.986188
        Num handles: 1
        Handle: 1119 Address: DF:A9:FF:F6:B1:1A (OUI DF-A9-FF)
        Count: 1
        #68: len 15 (0 Kb/s)
        Latency: 153 msec (66-165 msec ~121 msec)
> ACL Data RX: Handle 1119 flags 0x02 dlen 21               #72 [hci1] 7.949110
      SMP: Pairing Confirm (0x03) len 16
        Confim value: e4facc714d007db3bafba6f82763a831
< HCI Command: Host Number of Compl.. (0x03|0x0035) plen 5  #73 [hci1] 7.953129
        Num handles: 1
        Handle: 1119 Address: DF:A9:FF:F6:B1:1A (OUI DF-A9-FF)
        Count: 1
< ACL Data TX: Handle 1119 flags 0x00 dlen 21               #74 [hci1] 7.953192
      SMP: Pairing Confirm (0x03) len 16
        Confim value: afd429f5e83f6b95f33883aa9ef5842b
> HCI Event: Number of Completed Packets (0x13) plen 5      #75 [hci1] 8.123993
        Num handles: 1
        Handle: 1119 Address: DF:A9:FF:F6:B1:1A (OUI DF-A9-FF)
        Count: 1
        #74: len 21 (0 Kb/s)
        Latency: 170 msec (66-170 msec ~146 msec)
> ACL Data RX: Handle 1119 flags 0x02 dlen 21               #76 [hci1] 8.124202
      SMP: Pairing Random (0x04) len 16
        Random value: 796535f462458d120000000000000000
< HCI Command: Host Number of Compl.. (0x03|0x0035) plen 5  #77 [hci1] 8.133656
        Num handles: 1
        Handle: 1119 Address: DF:A9:FF:F6:B1:1A (OUI DF-A9-FF)
        Count: 1
< ACL Data TX: Handle 1119 flags 0x00 dlen 21               #78 [hci1] 8.133757
      SMP: Pairing Random (0x04) len 16
        Random value: 8e6108f966a694cbe26df70bb96773e6
> HCI Event: Number of Completed Packets (0x13) plen 5      #79 [hci1] 8.298699
        Num handles: 1
        Handle: 1119 Address: DF:A9:FF:F6:B1:1A (OUI DF-A9-FF)
        Count: 1
        #78: len 21 (1 Kb/s)
        Latency: 164 msec (66-170 msec ~155 msec)
> ACL Data RX: Handle 1119 flags 0x02 dlen 21               #80 [hci1] 8.386697
      SMP: Pairing Confirm (0x03) len 16
        Confim value: d02e2309fc62dc887730843d8b185f53
< HCI Command: Host Number of Compl.. (0x03|0x0035) plen 5  #81 [hci1] 8.393225
        Num handles: 1
        Handle: 1119 Address: DF:A9:FF:F6:B1:1A (OUI DF-A9-FF)
        Count: 1
< ACL Data TX: Handle 1119 flags 0x00 dlen 21               #82 [hci1] 8.393394
      SMP: Pairing Confirm (0x03) len 16
        Confim value: 1552d7b42ab31f6dcf6e3b188ba0e828
> HCI Event: Number of Completed Packets (0x13) plen 5      #83 [hci1] 8.561505
        Num handles: 1
        Handle: 1119 Address: DF:A9:FF:F6:B1:1A (OUI DF-A9-FF)
        Count: 1
        #82: len 21 (1 Kb/s)
        Latency: 168 msec (66-170 msec ~161 msec)
> ACL Data RX: Handle 1119 flags 0x02 dlen 21               #84 [hci1] 8.561813
      SMP: Pairing Random (0x04) len 16
        Random value: 7f264d6001daf5c30000000000000000
< HCI Command: Host Number of Compl.. (0x03|0x0035) plen 5  #85 [hci1] 8.573514
        Num handles: 1
        Handle: 1119 Address: DF:A9:FF:F6:B1:1A (OUI DF-A9-FF)
        Count: 1
< ACL Data TX: Handle 1119 flags 0x00 dlen 21               #86 [hci1] 8.573624
      SMP: Pairing Random (0x04) len 16
        Random value: 4d02679f89a05211af56d8b3da64d21e
> HCI Event: Number of Completed Packets (0x13) plen 5      #87 [hci1] 8.736154
        Num handles: 1
        Handle: 1119 Address: DF:A9:FF:F6:B1:1A (OUI DF-A9-FF)
        Count: 1
        #86: len 21 (1 Kb/s)
        Latency: 162 msec (66-170 msec ~162 msec)
> ACL Data RX: Handle 1119 flags 0x02 dlen 21               #88 [hci1] 8.824035
      SMP: Pairing Confirm (0x03) len 16
        Confim value: 14348da8868f346e4d02b5ce3d0fc107
< HCI Command: Host Number of Compl.. (0x03|0x0035) plen 5  #89 [hci1] 8.832991
        Num handles: 1
        Handle: 1119 Address: DF:A9:FF:F6:B1:1A (OUI DF-A9-FF)
        Count: 1
< ACL Data TX: Handle 1119 flags 0x00 dlen 21               #90 [hci1] 8.833086
      SMP: Pairing Confirm (0x03) len 16
        Confim value: 5a709aa4497f9f17993013ecd1369e0e
> HCI Event: Number of Completed Packets (0x13) plen 5      #91 [hci1] 8.999013
        Num handles: 1
        Handle: 1119 Address: DF:A9:FF:F6:B1:1A (OUI DF-A9-FF)
        Count: 1
        #90: len 21 (1 Kb/s)
        Latency: 165 msec (66-170 msec ~164 msec)
> ACL Data RX: Handle 1119 flags 0x02 dlen 21               #92 [hci1] 8.999237
      SMP: Pairing Random (0x04) len 16
        Random value: c64f62c2c2a2fede0000000000000000
< HCI Command: Host Number of Compl.. (0x03|0x0035) plen 5  #93 [hci1] 9.013671
        Num handles: 1
        Handle: 1119 Address: DF:A9:FF:F6:B1:1A (OUI DF-A9-FF)
        Count: 1
< ACL Data TX: Handle 1119 flags 0x00 dlen 21               #94 [hci1] 9.013728
      SMP: Pairing Random (0x04) len 16
        Random value: 5e8286bc235a02440d0c3424a2acf8fd
> HCI Event: Number of Completed Packets (0x13) plen 5      #95 [hci1] 9.173689
        Num handles: 1
        Handle: 1119 Address: DF:A9:FF:F6:B1:1A (OUI DF-A9-FF)
        Count: 1
        #94: len 21 (1 Kb/s)
        Latency: 159 msec (66-170 msec ~162 msec)
> ACL Data RX: Handle 1119 flags 0x02 dlen 21               #96 [hci1] 9.261648
      SMP: Pairing Confirm (0x03) len 16
        Confim value: a6618643d21f43038bf68e208434be9c
< HCI Command: Host Number of Compl.. (0x03|0x0035) plen 5  #97 [hci1] 9.273230
        Num handles: 1
        Handle: 1119 Address: DF:A9:FF:F6:B1:1A (OUI DF-A9-FF)
        Count: 1
< ACL Data TX: Handle 1119 flags 0x00 dlen 21               #98 [hci1] 9.273322
      SMP: Pairing Confirm (0x03) len 16
        Confim value: 242cdade214474141582141cff8776a4
> HCI Event: Number of Completed Packets (0x13) plen 5      #99 [hci1] 9.436390
        Num handles: 1
        Handle: 1119 Address: DF:A9:FF:F6:B1:1A (OUI DF-A9-FF)
        Count: 1
        #98: len 21 (1 Kb/s)
        Latency: 163 msec (66-170 msec ~162 msec)
> ACL Data RX: Handle 1119 flags 0x02 dlen 21              #100 [hci1] 9.436711
      SMP: Pairing Random (0x04) len 16
        Random value: 97b06f37199dac460000000000000000
< HCI Command: Host Number of Comp.. (0x03|0x0035) plen 5  #101 [hci1] 9.452872
        Num handles: 1
        Handle: 1119 Address: DF:A9:FF:F6:B1:1A (OUI DF-A9-FF)
        Count: 1
< ACL Data TX: Handle 1119 flags 0x00 dlen 21              #102 [hci1] 9.452955
      SMP: Pairing Random (0x04) len 16
        Random value: 5c4a1bcadd27bd58e945097b00bad7ac
> HCI Event: Number of Completed Packets (0x13) plen 5     #103 [hci1] 9.611222
        Num handles: 1
        Handle: 1119 Address: DF:A9:FF:F6:B1:1A (OUI DF-A9-FF)
        Count: 1
        #102: len 21 (1 Kb/s)
        Latency: 158 msec (66-170 msec ~160 msec)
> ACL Data RX: Handle 1119 flags 0x02 dlen 21              #104 [hci1] 9.699086
      SMP: Pairing Confirm (0x03) len 16
        Confim value: 673b65d4fdcb2734635a53caeaf917c5
< HCI Command: Host Number of Comp.. (0x03|0x0035) plen 5  #105 [hci1] 9.713210
        Num handles: 1
        Handle: 1119 Address: DF:A9:FF:F6:B1:1A (OUI DF-A9-FF)
        Count: 1
< ACL Data TX: Handle 1119 flags 0x00 dlen 21              #106 [hci1] 9.713291
      SMP: Pairing Confirm (0x03) len 16
        Confim value: 14d516543be7e28495de1bd52a3dfbee
> HCI Event: Number of Completed Packets (0x13) plen 5     #107 [hci1] 9.873881
        Num handles: 1
        Handle: 1119 Address: DF:A9:FF:F6:B1:1A (OUI DF-A9-FF)
        Count: 1
        #106: len 21 (1 Kb/s)
        Latency: 160 msec (66-170 msec ~160 msec)
> ACL Data RX: Handle 1119 flags 0x02 dlen 21              #108 [hci1] 9.874214
      SMP: Pairing Random (0x04) len 16
        Random value: 9bfbb0d50c3802390000000000000000
< HCI Command: Host Number of Comp.. (0x03|0x0035) plen 5  #109 [hci1] 9.893633
        Num handles: 1
        Handle: 1119 Address: DF:A9:FF:F6:B1:1A (OUI DF-A9-FF)
        Count: 1
< ACL Data TX: Handle 1119 flags 0x00 dlen 21              #110 [hci1] 9.893803
      SMP: Pairing Random (0x04) len 16
        Random value: 32527e6e64e79f33b2e374394db8ab2d
> HCI Event: Number of Completed Packets (0x13) plen 5    #111 [hci1] 10.048657
        Num handles: 1
        Handle: 1119 Address: DF:A9:FF:F6:B1:1A (OUI DF-A9-FF)
        Count: 1
        #110: len 21 (1 Kb/s)
        Latency: 154 msec (66-170 msec ~157 msec)
> ACL Data RX: Handle 1119 flags 0x02 dlen 21             #112 [hci1] 10.136469
      SMP: Pairing Confirm (0x03) len 16
        Confim value: f0e51add133a9acfc7ffc295ca6f1b9b
< HCI Command: Host Number of Com.. (0x03|0x0035) plen 5  #113 [hci1] 10.153356
        Num handles: 1
        Handle: 1119 Address: DF:A9:FF:F6:B1:1A (OUI DF-A9-FF)
        Count: 1
< ACL Data TX: Handle 1119 flags 0x00 dlen 21             #114 [hci1] 10.153547
      SMP: Pairing Confirm (0x03) len 16
        Confim value: 439011d4e430cc33bf32803896ff2dca
> HCI Event: Number of Completed Packets (0x13) plen 5    #115 [hci1] 10.311479
        Num handles: 1
        Handle: 1119 Address: DF:A9:FF:F6:B1:1A (OUI DF-A9-FF)
        Count: 1
        #114: len 21 (1 Kb/s)
        Latency: 157 msec (66-170 msec ~157 msec)
> ACL Data RX: Handle 1119 flags 0x02 dlen 21             #116 [hci1] 10.311805
      SMP: Pairing Random (0x04) len 16
        Random value: ff5a1dee7a0dd5550000000000000000
< HCI Command: Host Number of Com.. (0x03|0x0035) plen 5  #117 [hci1] 10.313658
        Num handles: 1
        Handle: 1119 Address: DF:A9:FF:F6:B1:1A (OUI DF-A9-FF)
        Count: 1
< ACL Data TX: Handle 1119 flags 0x00 dlen 21             #118 [hci1] 10.313834
      SMP: Pairing Random (0x04) len 16
        Random value: dddbdfe2838e9a8cc6964353c850fef7
> HCI Event: Number of Completed Packets (0x13) plen 5    #119 [hci1] 10.486192
        Num handles: 1
        Handle: 1119 Address: DF:A9:FF:F6:B1:1A (OUI DF-A9-FF)
        Count: 1
        #118: len 21 (0 Kb/s)
        Latency: 172 msec (66-172 msec ~165 msec)
> ACL Data RX: Handle 1119 flags 0x02 dlen 21             #120 [hci1] 10.574034
      SMP: Pairing Confirm (0x03) len 16
        Confim value: aea800e0df532d5d194181ed213353c4
< HCI Command: Host Number of Com.. (0x03|0x0035) plen 5  #121 [hci1] 10.593197
        Num handles: 1
        Handle: 1119 Address: DF:A9:FF:F6:B1:1A (OUI DF-A9-FF)
        Count: 1
< ACL Data TX: Handle 1119 flags 0x00 dlen 21             #122 [hci1] 10.593344
      SMP: Pairing Confirm (0x03) len 16
        Confim value: 704f71bcd7a1f9586690b121864172ee
> HCI Event: Number of Completed Packets (0x13) plen 5    #123 [hci1] 10.748912
        Num handles: 1
        Handle: 1119 Address: DF:A9:FF:F6:B1:1A (OUI DF-A9-FF)
        Count: 1
        #122: len 21 (1 Kb/s)
        Latency: 155 msec (66-172 msec ~160 msec)
> ACL Data RX: Handle 1119 flags 0x02 dlen 21             #124 [hci1] 10.749256
      SMP: Pairing Random (0x04) len 16
        Random value: 16eb35446a473a180000000000000000
< HCI Command: Host Number of Com.. (0x03|0x0035) plen 5  #125 [hci1] 10.753605
        Num handles: 1
        Handle: 1119 Address: DF:A9:FF:F6:B1:1A (OUI DF-A9-FF)
        Count: 1
< ACL Data TX: Handle 1119 flags 0x00 dlen 21             #126 [hci1] 10.753776
      SMP: Pairing Random (0x04) len 16
        Random value: eb9f1915536596b6fc3db1c86b2b1970
> HCI Event: Number of Completed Packets (0x13) plen 5    #127 [hci1] 10.923617
        Num handles: 1
        Handle: 1119 Address: DF:A9:FF:F6:B1:1A (OUI DF-A9-FF)
        Count: 1
        #126: len 21 (0 Kb/s)
        Latency: 169 msec (66-172 msec ~165 msec)
> ACL Data RX: Handle 1119 flags 0x02 dlen 21             #128 [hci1] 11.011580
      SMP: Pairing Confirm (0x03) len 16
        Confim value: c4f3036502c9835410b2188ab1ba8c94
< HCI Command: Host Number of Com.. (0x03|0x0035) plen 5  #129 [hci1] 11.013198
        Num handles: 1
        Handle: 1119 Address: DF:A9:FF:F6:B1:1A (OUI DF-A9-FF)
        Count: 1
< ACL Data TX: Handle 1119 flags 0x00 dlen 21             #130 [hci1] 11.013315
      SMP: Pairing Confirm (0x03) len 16
        Confim value: ea39c89a7eeb46039270b9d897e0f7eb
> HCI Event: Number of Completed Packets (0x13) plen 5    #131 [hci1] 11.186365
        Num handles: 1
        Handle: 1119 Address: DF:A9:FF:F6:B1:1A (OUI DF-A9-FF)
        Count: 1
        #130: len 21 (0 Kb/s)
        Latency: 173 msec (66-173 msec ~169 msec)
> ACL Data RX: Handle 1119 flags 0x02 dlen 21             #132 [hci1] 11.186699
      SMP: Pairing Random (0x04) len 16
        Random value: 9a674dd712e4ac820000000000000000
< HCI Command: Host Number of Com.. (0x03|0x0035) plen 5  #133 [hci1] 11.193683
        Num handles: 1
        Handle: 1119 Address: DF:A9:FF:F6:B1:1A (OUI DF-A9-FF)
        Count: 1
< ACL Data TX: Handle 1119 flags 0x00 dlen 21             #134 [hci1] 11.193815
      SMP: Pairing Random (0x04) len 16
        Random value: 5c794dc9ad9f2c3f295ebd5ad5e1c3cf
> HCI Event: Number of Completed Packets (0x13) plen 5    #135 [hci1] 11.361118
        Num handles: 1
        Handle: 1119 Address: DF:A9:FF:F6:B1:1A (OUI DF-A9-FF)
        Count: 1
        #134: len 21 (1 Kb/s)
        Latency: 167 msec (66-173 msec ~168 msec)
> ACL Data RX: Handle 1119 flags 0x02 dlen 21             #136 [hci1] 11.449027
      SMP: Pairing Confirm (0x03) len 16
        Confim value: 44b03518e29b8c71edd99db1f9c6d73f
< HCI Command: Host Number of Com.. (0x03|0x0035) plen 5  #137 [hci1] 11.453309
        Num handles: 1
        Handle: 1119 Address: DF:A9:FF:F6:B1:1A (OUI DF-A9-FF)
        Count: 1
< ACL Data TX: Handle 1119 flags 0x00 dlen 21             #138 [hci1] 11.453494
      SMP: Pairing Confirm (0x03) len 16
        Confim value: 14ff91d8549ff979dbd1008decb380b7
> HCI Event: Number of Completed Packets (0x13) plen 5    #139 [hci1] 11.623947
        Num handles: 1
        Handle: 1119 Address: DF:A9:FF:F6:B1:1A (OUI DF-A9-FF)
        Count: 1
        #138: len 21 (0 Kb/s)
        Latency: 170 msec (66-173 msec ~169 msec)
> ACL Data RX: Handle 1119 flags 0x02 dlen 21             #140 [hci1] 11.624183
      SMP: Pairing Random (0x04) len 16
        Random value: 4ef4c2aa0b6b172a0000000000000000
< HCI Command: Host Number of Com.. (0x03|0x0035) plen 5  #141 [hci1] 11.633523
        Num handles: 1
        Handle: 1119 Address: DF:A9:FF:F6:B1:1A (OUI DF-A9-FF)
        Count: 1
< ACL Data TX: Handle 1119 flags 0x00 dlen 21             #142 [hci1] 11.633697
      SMP: Pairing Random (0x04) len 16
        Random value: 5c2fff312cdf99c9491988e877355a9a
> HCI Event: Number of Completed Packets (0x13) plen 5    #143 [hci1] 11.798632
        Num handles: 1
        Handle: 1119 Address: DF:A9:FF:F6:B1:1A (OUI DF-A9-FF)
        Count: 1
        #142: len 21 (1 Kb/s)
        Latency: 164 msec (66-173 msec ~167 msec)
> ACL Data RX: Handle 1119 flags 0x02 dlen 21             #144 [hci1] 11.886525
      SMP: Pairing Confirm (0x03) len 16
        Confim value: ac990a3efda40ce52e42a415ab255169
< HCI Command: Host Number of Com.. (0x03|0x0035) plen 5  #145 [hci1] 11.893242
        Num handles: 1
        Handle: 1119 Address: DF:A9:FF:F6:B1:1A (OUI DF-A9-FF)
        Count: 1
< ACL Data TX: Handle 1119 flags 0x00 dlen 21             #146 [hci1] 11.893395
      SMP: Pairing Confirm (0x03) len 16
        Confim value: 27db185315c7ab77f2e1f6a9128d164f
> HCI Event: Number of Completed Packets (0x13) plen 5    #147 [hci1] 12.061313
        Num handles: 1
        Handle: 1119 Address: DF:A9:FF:F6:B1:1A (OUI DF-A9-FF)
        Count: 1
        #146: len 21 (1 Kb/s)
        Latency: 167 msec (66-173 msec ~167 msec)
> ACL Data RX: Handle 1119 flags 0x02 dlen 21             #148 [hci1] 12.061710
      SMP: Pairing Random (0x04) len 16
        Random value: 09a48a3cfe41da890000000000000000
< HCI Command: Host Number of Com.. (0x03|0x0035) plen 5  #149 [hci1] 12.073618
        Num handles: 1
        Handle: 1119 Address: DF:A9:FF:F6:B1:1A (OUI DF-A9-FF)
        Count: 1
< ACL Data TX: Handle 1119 flags 0x00 dlen 21             #150 [hci1] 12.073788
      SMP: Pairing Random (0x04) len 16
        Random value: c629a3a987d808e808655d558dfc1155
> HCI Event: Number of Completed Packets (0x13) plen 5    #151 [hci1] 12.236147
        Num handles: 1
        Handle: 1119 Address: DF:A9:FF:F6:B1:1A (OUI DF-A9-FF)
        Count: 1
        #150: len 21 (1 Kb/s)
        Latency: 162 msec (66-173 msec ~164 msec)
> ACL Data RX: Handle 1119 flags 0x02 dlen 21             #152 [hci1] 12.324049
      SMP: Pairing Confirm (0x03) len 16
        Confim value: 26501ef184c7d37059a6ef5c48a1c7a9
< HCI Command: Host Number of Com.. (0x03|0x0035) plen 5  #153 [hci1] 12.333014
        Num handles: 1
        Handle: 1119 Address: DF:A9:FF:F6:B1:1A (OUI DF-A9-FF)
        Count: 1
< ACL Data TX: Handle 1119 flags 0x00 dlen 21             #154 [hci1] 12.333116
      SMP: Pairing Confirm (0x03) len 16
        Confim value: 8f141545f8743e46442ee4031e84f450
> HCI Event: Number of Completed Packets (0x13) plen 5    #155 [hci1] 12.498830
        Num handles: 1
        Handle: 1119 Address: DF:A9:FF:F6:B1:1A (OUI DF-A9-FF)
        Count: 1
        #154: len 21 (1 Kb/s)
        Latency: 165 msec (66-173 msec ~165 msec)
> ACL Data RX: Handle 1119 flags 0x02 dlen 21             #156 [hci1] 12.499124
      SMP: Pairing Random (0x04) len 16
        Random value: 6a5543f6b9da1ce00000000000000000
< HCI Command: Host Number of Com.. (0x03|0x0035) plen 5  #157 [hci1] 12.513585
        Num handles: 1
        Handle: 1119 Address: DF:A9:FF:F6:B1:1A (OUI DF-A9-FF)
        Count: 1
< ACL Data TX: Handle 1119 flags 0x00 dlen 21             #158 [hci1] 12.513626
      SMP: Pairing Random (0x04) len 16
        Random value: 92f20f6ad8f13724432c7fd6001c45ff
> HCI Event: Number of Completed Packets (0x13) plen 5    #159 [hci1] 12.673729
        Num handles: 1
        Handle: 1119 Address: DF:A9:FF:F6:B1:1A (OUI DF-A9-FF)
        Count: 1
        #158: len 21 (1 Kb/s)
        Latency: 160 msec (66-173 msec ~162 msec)
> ACL Data RX: Handle 1119 flags 0x02 dlen 21             #160 [hci1] 12.761493
      SMP: Pairing Confirm (0x03) len 16
        Confim value: ef1b0613313638bcf69da49553c31af9
< HCI Command: Host Number of Com.. (0x03|0x0035) plen 5  #161 [hci1] 12.773412
        Num handles: 1
        Handle: 1119 Address: DF:A9:FF:F6:B1:1A (OUI DF-A9-FF)
        Count: 1
< ACL Data TX: Handle 1119 flags 0x00 dlen 21             #162 [hci1] 12.773587
      SMP: Pairing Confirm (0x03) len 16
        Confim value: 92fbea4f97153eeb7fd3c2a799f1bc0e
> HCI Event: Number of Completed Packets (0x13) plen 5    #163 [hci1] 12.936332
        Num handles: 1
        Handle: 1119 Address: DF:A9:FF:F6:B1:1A (OUI DF-A9-FF)
        Count: 1
        #162: len 21 (1 Kb/s)
        Latency: 162 msec (66-173 msec ~162 msec)
> ACL Data RX: Handle 1119 flags 0x02 dlen 21             #164 [hci1] 12.936664
      SMP: Pairing Random (0x04) len 16
        Random value: 94af401da58b04ca0000000000000000
< HCI Command: Host Number of Com.. (0x03|0x0035) plen 5  #165 [hci1] 12.952917
        Num handles: 1
        Handle: 1119 Address: DF:A9:FF:F6:B1:1A (OUI DF-A9-FF)
        Count: 1
< ACL Data TX: Handle 1119 flags 0x00 dlen 21             #166 [hci1] 12.952993
      SMP: Pairing Random (0x04) len 16
        Random value: 23ac32ebbb5e14c8a6b9622f296d277f
> HCI Event: Number of Completed Packets (0x13) plen 5    #167 [hci1] 13.111112
        Num handles: 1
        Handle: 1119 Address: DF:A9:FF:F6:B1:1A (OUI DF-A9-FF)
        Count: 1
        #166: len 21 (1 Kb/s)
        Latency: 158 msec (66-173 msec ~160 msec)
> ACL Data RX: Handle 1119 flags 0x02 dlen 21             #168 [hci1] 13.198981
      SMP: Pairing Confirm (0x03) len 16
        Confim value: 5209901f389e8013e99127d819e348ba
< HCI Command: Host Number of Com.. (0x03|0x0035) plen 5  #169 [hci1] 13.213393
        Num handles: 1
        Handle: 1119 Address: DF:A9:FF:F6:B1:1A (OUI DF-A9-FF)
        Count: 1
< ACL Data TX: Handle 1119 flags 0x00 dlen 21             #170 [hci1] 13.213551
      SMP: Pairing Confirm (0x03) len 16
        Confim value: eed33899fb022d5180e24c56c5b0fba9
> HCI Event: Number of Completed Packets (0x13) plen 5    #171 [hci1] 13.373835
        Num handles: 1
        Handle: 1119 Address: DF:A9:FF:F6:B1:1A (OUI DF-A9-FF)
        Count: 1
        #170: len 21 (1 Kb/s)
        Latency: 160 msec (66-173 msec ~160 msec)
> ACL Data RX: Handle 1119 flags 0x02 dlen 21             #172 [hci1] 13.374175
      SMP: Pairing Random (0x04) len 16
        Random value: 3762ca0ac107285c0000000000000000
< HCI Command: Host Number of Com.. (0x03|0x0035) plen 5  #173 [hci1] 13.393580
        Num handles: 1
        Handle: 1119 Address: DF:A9:FF:F6:B1:1A (OUI DF-A9-FF)
        Count: 1
< ACL Data TX: Handle 1119 flags 0x00 dlen 21             #174 [hci1] 13.393721
      SMP: Pairing Random (0x04) len 16
        Random value: 297efe85e67448a15f56bd27e3a3cf1d
> HCI Event: Number of Completed Packets (0x13) plen 5    #175 [hci1] 13.548728
        Num handles: 1
        Handle: 1119 Address: DF:A9:FF:F6:B1:1A (OUI DF-A9-FF)
        Count: 1
        #174: len 21 (1 Kb/s)
        Latency: 155 msec (66-173 msec ~157 msec)
> ACL Data RX: Handle 1119 flags 0x02 dlen 21             #176 [hci1] 13.636404
      SMP: Pairing Confirm (0x03) len 16
        Confim value: d25d4eb7359af6b16ddde4aab6889df0
< HCI Command: Host Number of Com.. (0x03|0x0035) plen 5  #177 [hci1] 13.653279
        Num handles: 1
        Handle: 1119 Address: DF:A9:FF:F6:B1:1A (OUI DF-A9-FF)
        Count: 1
< ACL Data TX: Handle 1119 flags 0x00 dlen 21             #178 [hci1] 13.653497
      SMP: Pairing Confirm (0x03) len 16
        Confim value: 2c5c5791ce2840ee382e56ec420a93cc
> HCI Event: Number of Completed Packets (0x13) plen 5    #179 [hci1] 13.811483
        Num handles: 1
        Handle: 1119 Address: DF:A9:FF:F6:B1:1A (OUI DF-A9-FF)
        Count: 1
        #178: len 21 (1 Kb/s)
        Latency: 157 msec (66-173 msec ~157 msec)
> ACL Data RX: Handle 1119 flags 0x02 dlen 21             #180 [hci1] 13.811694
      SMP: Pairing Random (0x04) len 16
        Random value: 4fa52e547e11a4b70000000000000000
< HCI Command: Host Number of Com.. (0x03|0x0035) plen 5  #181 [hci1] 13.813484
        Num handles: 1
        Handle: 1119 Address: DF:A9:FF:F6:B1:1A (OUI DF-A9-FF)
        Count: 1
< ACL Data TX: Handle 1119 flags 0x00 dlen 21             #182 [hci1] 13.813598
      SMP: Pairing Random (0x04) len 16
        Random value: 25a9493fd3ce4faf02be7293595bb7c6
> HCI Event: Number of Completed Packets (0x13) plen 5    #183 [hci1] 13.986107
        Num handles: 1
        Handle: 1119 Address: DF:A9:FF:F6:B1:1A (OUI DF-A9-FF)
        Count: 1
        #182: len 21 (0 Kb/s)
        Latency: 172 msec (66-173 msec ~165 msec)
> ACL Data RX: Handle 1119 flags 0x02 dlen 21             #184 [hci1] 14.074013
      SMP: Pairing Confirm (0x03) len 16
        Confim value: afa8e08c6dbd66b5eeb8dd38a385ffc4
< HCI Command: Host Number of Com.. (0x03|0x0035) plen 5  #185 [hci1] 14.093322
        Num handles: 1
        Handle: 1119 Address: DF:A9:FF:F6:B1:1A (OUI DF-A9-FF)
        Count: 1
< ACL Data TX: Handle 1119 flags 0x00 dlen 21             #186 [hci1] 14.093522
      SMP: Pairing Confirm (0x03) len 16
        Confim value: 7acdc104eb707c78b4bd79b6ffe8735e
> HCI Event: Number of Completed Packets (0x13) plen 5    #187 [hci1] 14.248777
        Num handles: 1
        Handle: 1119 Address: DF:A9:FF:F6:B1:1A (OUI DF-A9-FF)
        Count: 1
        #186: len 21 (1 Kb/s)
        Latency: 155 msec (66-173 msec ~160 msec)
> ACL Data RX: Handle 1119 flags 0x02 dlen 21             #188 [hci1] 14.249134
      SMP: Pairing Random (0x04) len 16
        Random value: 347e58f75110e67e0000000000000000
< HCI Command: Host Number of Com.. (0x03|0x0035) plen 5  #189 [hci1] 14.253472
        Num handles: 1
        Handle: 1119 Address: DF:A9:FF:F6:B1:1A (OUI DF-A9-FF)
        Count: 1
< ACL Data TX: Handle 1119 flags 0x00 dlen 21             #190 [hci1] 14.253623
      SMP: Pairing Random (0x04) len 16
        Random value: 58f6b41f855a6f6c3560debd84e2affc
> HCI Event: Number of Completed Packets (0x13) plen 5    #191 [hci1] 14.423556
        Num handles: 1
        Handle: 1119 Address: DF:A9:FF:F6:B1:1A (OUI DF-A9-FF)
        Count: 1
        #190: len 21 (0 Kb/s)
        Latency: 169 msec (66-173 msec ~165 msec)
> ACL Data RX: Handle 1119 flags 0x02 dlen 21             #192 [hci1] 14.511457
      SMP: Pairing Confirm (0x03) len 16
        Confim value: 4bf6c1569ddf33e788622933fe5897ac
< HCI Command: Host Number of Com.. (0x03|0x0035) plen 5  #193 [hci1] 14.513137
        Num handles: 1
        Handle: 1119 Address: DF:A9:FF:F6:B1:1A (OUI DF-A9-FF)
        Count: 1
< ACL Data TX: Handle 1119 flags 0x00 dlen 21             #194 [hci1] 14.513243
      SMP: Pairing Confirm (0x03) len 16
        Confim value: 2daa7718a43c42c1b5f33792097d2300
> HCI Event: Number of Completed Packets (0x13) plen 5    #195 [hci1] 14.686249
        Num handles: 1
        Handle: 1119 Address: DF:A9:FF:F6:B1:1A (OUI DF-A9-FF)
        Count: 1
        #194: len 21 (0 Kb/s)
        Latency: 173 msec (66-173 msec ~169 msec)
> ACL Data RX: Handle 1119 flags 0x02 dlen 21             #196 [hci1] 14.686662
      SMP: Pairing Random (0x04) len 16
        Random value: e94ba64505248e2e0000000000000000
< HCI Command: Host Number of Com.. (0x03|0x0035) plen 5  #197 [hci1] 14.693570
        Num handles: 1
        Handle: 1119 Address: DF:A9:FF:F6:B1:1A (OUI DF-A9-FF)
        Count: 1
< ACL Data TX: Handle 1119 flags 0x00 dlen 21             #198 [hci1] 14.693738
      SMP: Pairing Random (0x04) len 16
        Random value: b67e7216d5bf664139eda2b542549666
> HCI Event: Number of Completed Packets (0x13) plen 5    #199 [hci1] 14.861145
        Num handles: 1
        Handle: 1119 Address: DF:A9:FF:F6:B1:1A (OUI DF-A9-FF)
        Count: 1
        #198: len 21 (1 Kb/s)
        Latency: 167 msec (66-173 msec ~168 msec)
> ACL Data RX: Handle 1119 flags 0x02 dlen 21             #200 [hci1] 14.948966
      SMP: Pairing Confirm (0x03) len 16
        Confim value: 0d7a2240e2a8d27480ba1434a41c5b75
< HCI Command: Host Number of Com.. (0x03|0x0035) plen 5  #201 [hci1] 14.953091
        Num handles: 1
        Handle: 1119 Address: DF:A9:FF:F6:B1:1A (OUI DF-A9-FF)
        Count: 1
< ACL Data TX: Handle 1119 flags 0x00 dlen 21             #202 [hci1] 14.953214
      SMP: Pairing Confirm (0x03) len 16
        Confim value: 91588cfc4620a66bbca8c25f60264eea
> HCI Event: Number of Completed Packets (0x13) plen 5    #203 [hci1] 15.123873
        Num handles: 1
        Handle: 1119 Address: DF:A9:FF:F6:B1:1A (OUI DF-A9-FF)
        Count: 1
        #202: len 21 (0 Kb/s)
        Latency: 170 msec (66-173 msec ~169 msec)
> ACL Data RX: Handle 1119 flags 0x02 dlen 21             #204 [hci1] 15.124144
      SMP: Pairing Random (0x04) len 16
        Random value: 10989015b764bb430000000000000000
< HCI Command: Host Number of Com.. (0x03|0x0035) plen 5  #205 [hci1] 15.133535
        Num handles: 1
        Handle: 1119 Address: DF:A9:FF:F6:B1:1A (OUI DF-A9-FF)
        Count: 1
< ACL Data TX: Handle 1119 flags 0x00 dlen 21             #206 [hci1] 15.133667
      SMP: Pairing Random (0x04) len 16
        Random value: ed17f76500c95219dd01e09d1e63f87b
> HCI Event: Number of Completed Packets (0x13) plen 5    #207 [hci1] 15.298574
        Num handles: 1
        Handle: 1119 Address: DF:A9:FF:F6:B1:1A (OUI DF-A9-FF)
        Count: 1
        #206: len 21 (1 Kb/s)
        Latency: 164 msec (66-173 msec ~167 msec)
> ACL Data RX: Handle 1119 flags 0x02 dlen 21             #208 [hci1] 15.386509
      SMP: Pairing Confirm (0x03) len 16
        Confim value: c6800392f5ddc7b356af4d83061a40ce
< HCI Command: Host Number of Com.. (0x03|0x0035) plen 5  #209 [hci1] 15.393280
        Num handles: 1
        Handle: 1119 Address: DF:A9:FF:F6:B1:1A (OUI DF-A9-FF)
        Count: 1
< ACL Data TX: Handle 1119 flags 0x00 dlen 21             #210 [hci1] 15.393393
      SMP: Pairing Confirm (0x03) len 16
        Confim value: 3cf71153e8d27fc58b129359208d7321
> HCI Event: Number of Completed Packets (0x13) plen 5    #211 [hci1] 15.561291
        Num handles: 1
        Handle: 1119 Address: DF:A9:FF:F6:B1:1A (OUI DF-A9-FF)
        Count: 1
        #210: len 21 (1 Kb/s)
        Latency: 167 msec (66-173 msec ~167 msec)
> ACL Data RX: Handle 1119 flags 0x02 dlen 21             #212 [hci1] 15.561729
      SMP: Pairing Random (0x04) len 16
        Random value: 8246748bd361689a0000000000000000
< HCI Command: Host Number of Com.. (0x03|0x0035) plen 5  #213 [hci1] 15.573653
        Num handles: 1
        Handle: 1119 Address: DF:A9:FF:F6:B1:1A (OUI DF-A9-FF)
        Count: 1
< ACL Data TX: Handle 1119 flags 0x00 dlen 21             #214 [hci1] 15.573825
      SMP: Pairing Random (0x04) len 16
        Random value: 81d35d47e1f6006d79c974bd9d9e1ee3
> HCI Event: Number of Completed Packets (0x13) plen 5    #215 [hci1] 15.736102
        Num handles: 1
        Handle: 1119 Address: DF:A9:FF:F6:B1:1A (OUI DF-A9-FF)
        Count: 1
        #214: len 21 (1 Kb/s)
        Latency: 162 msec (66-173 msec ~164 msec)
> ACL Data RX: Handle 1119 flags 0x02 dlen 21             #216 [hci1] 15.823935
      SMP: Pairing Confirm (0x03) len 16
        Confim value: 81a0c85e9592a730ec570d4c290d6599
< HCI Command: Host Number of Com.. (0x03|0x0035) plen 5  #217 [hci1] 15.833000
        Num handles: 1
        Handle: 1119 Address: DF:A9:FF:F6:B1:1A (OUI DF-A9-FF)
        Count: 1
< ACL Data TX: Handle 1119 flags 0x00 dlen 21             #218 [hci1] 15.833102
      SMP: Pairing Confirm (0x03) len 16
        Confim value: 2f6c92623b2a70998bcc73be489be10c
> HCI Event: Number of Completed Packets (0x13) plen 5    #219 [hci1] 15.998792
        Num handles: 1
        Handle: 1119 Address: DF:A9:FF:F6:B1:1A (OUI DF-A9-FF)
        Count: 1
        #218: len 21 (1 Kb/s)
        Latency: 165 msec (66-173 msec ~165 msec)
> ACL Data RX: Handle 1119 flags 0x02 dlen 21             #220 [hci1] 15.999141
      SMP: Pairing Random (0x04) len 16
        Random value: 3016b0e4ba8bc6400000000000000000
< HCI Command: Host Number of Com.. (0x03|0x0035) plen 5  #221 [hci1] 16.013581
        Num handles: 1
        Handle: 1119 Address: DF:A9:FF:F6:B1:1A (OUI DF-A9-FF)
        Count: 1
< ACL Data TX: Handle 1119 flags 0x00 dlen 21             #222 [hci1] 16.013767
      SMP: Pairing Random (0x04) len 16
        Random value: e7f7e0c2476823e41736a7e381bafb7c
> HCI Event: Number of Completed Packets (0x13) plen 5    #223 [hci1] 16.173716
        Num handles: 1
        Handle: 1119 Address: DF:A9:FF:F6:B1:1A (OUI DF-A9-FF)
        Count: 1
        #222: len 21 (1 Kb/s)
        Latency: 159 msec (66-173 msec ~162 msec)
> ACL Data RX: Handle 1119 flags 0x02 dlen 21             #224 [hci1] 16.261400
      SMP: Pairing Confirm (0x03) len 16
        Confim value: 2f5c70da00566e7bb5902521ce7d4087
< HCI Command: Host Number of Com.. (0x03|0x0035) plen 5  #225 [hci1] 16.273287
        Num handles: 1
        Handle: 1119 Address: DF:A9:FF:F6:B1:1A (OUI DF-A9-FF)
        Count: 1
< ACL Data TX: Handle 1119 flags 0x00 dlen 21             #226 [hci1] 16.273498
      SMP: Pairing Confirm (0x03) len 16
        Confim value: cfc2b97390a0513c62526a1c004bafd6
> HCI Event: Number of Completed Packets (0x13) plen 5    #227 [hci1] 16.436261
        Num handles: 1
        Handle: 1119 Address: DF:A9:FF:F6:B1:1A (OUI DF-A9-FF)
        Count: 1
        #226: len 21 (1 Kb/s)
        Latency: 162 msec (66-173 msec ~162 msec)
> ACL Data RX: Handle 1119 flags 0x02 dlen 21             #228 [hci1] 16.436850
      SMP: Pairing Random (0x04) len 16
        Random value: 2d8a02623659a1b10000000000000000
