Bluetooth monitor ver 5.72
= Note: Linux version 7.0.0-31-generic (x86_64)                        0.861088
= Note: Bluetooth subsystem version 2.22                               0.861090
= New Index: 00:00:00:00:00:00 (Primary,UART,hci2)              [hci2] 0.861091
= New Index: 00:00:00:00:00:00 (Primary,UART,hci1)              [hci1] 0.861091
= New Index: 48:5F:99:8E:E0:64 (Primary,USB,hci0)               [hci0] 0.861092
= Open Index: 00:00:00:00:00:00                                 [hci1] 1.004281
= Index Info: 00:00:00:00:00:00 (Nordic Semiconductor ASA)      [hci1] 1.004287
@ USER Open: main (privileged) version 2.22            {0x0001} [hci1] 1.004290
< HCI Command: Reset (0x03|0x0003) plen 0                    #1 [hci1] 1.004674
> HCI Event: Command Complete (0x0e) plen 4                  #2 [hci1] 1.005128
      Reset (0x03|0x0003) ncmd 1
        Status: Success (0x00)
< HCI Command: Read Local Supported... (0x04|0x0003) plen 0  #3 [hci1] 1.024256
> HCI Event: Command Complete (0x0e) plen 12                 #4 [hci1] 1.024819
      Read Local Supported Features (0x04|0x0003) ncmd 1
        Status: Success (0x00)
        Features: 0x00 0x00 0x00 0x00 0x60 0x00 0x00 0x00
          BR/EDR Not Supported
          LE Supported (Controller)
< HCI Command: Read Local Version In.. (0x04|0x0001) plen 0  #5 [hci1] 1.044269
> HCI Event: Command Complete (0x0e) plen 12                 #6 [hci1] 1.044964
      Read Local Version Information (0x04|0x0001) ncmd 1
        Status: Success (0x00)
        HCI version: Reserved (0x11) - Revision 12345 (0x3039)
        LMP version: Reserved (0x11) - Subversion 12345 (0x3039)
        Manufacturer: Nordic Semiconductor ASA (89)
< HCI Command: Read Local Supported... (0x04|0x0002) plen 0  #7 [hci1] 1.064236
> HCI Event: Command Complete (0x0e) plen 68                 #8 [hci1] 1.065344
      Read Local Supported Commands (0x04|0x0002) ncmd 1
        Status: Success (0x00)
        Commands: 115 entries
          Disconnect (Octet 0 - Bit 5)
          Read Remote Version Information (Octet 2 - Bit 7)
          Set Event Mask (Octet 5 - Bit 6)
          Reset (Octet 5 - Bit 7)
          Read Connection Accept Timeout (Octet 7 - Bit 2)
          Write Connection Accept Timeout (Octet 7 - Bit 3)
          Read Transmit Power Level (Octet 10 - Bit 2)
          Set Controller To Host Flow Control (Octet 10 - Bit 5)
          Host Buffer Size (Octet 10 - Bit 6)
          Host Number of Completed Packets (Octet 10 - Bit 7)
          Read Local Version Information (Octet 14 - Bit 3)
          Read Local Supported Features (Octet 14 - Bit 5)
          Read BD ADDR (Octet 15 - Bit 1)
          Read RSSI (Octet 15 - Bit 5)
          Set Event Mask Page 2 (Octet 22 - Bit 2)
          LE Set Event Mask (Octet 25 - Bit 0)
          LE Read Buffer Size (Octet 25 - Bit 1)
          LE Read Local Supported Features (Octet 25 - Bit 2)
          LE Set Random Address (Octet 25 - Bit 4)
          LE Set Advertising Parameters (Octet 25 - Bit 5)
          LE Read Advertising Channel TX Power (Octet 25 - Bit 6)
          LE Set Advertising Data (Octet 25 - Bit 7)
          LE Set Scan Response Data (Octet 26 - Bit 0)
          LE Set Advertise Enable (Octet 26 - Bit 1)
          LE Set Scan Parameters (Octet 26 - Bit 2)
          LE Set Scan Enable (Octet 26 - Bit 3)
          LE Create Connection (Octet 26 - Bit 4)
          LE Create Connection Cancel (Octet 26 - Bit 5)
          LE Read Accept List Size (Octet 26 - Bit 6)
          LE Clear Accept List (Octet 26 - Bit 7)
          LE Add Device To Accept List (Octet 27 - Bit 0)
          LE Remove Device From Accept List (Octet 27 - Bit 1)
          LE Connection Update (Octet 27 - Bit 2)
          LE Set Host Channel Classification (Octet 27 - Bit 3)
          LE Read Channel Map (Octet 27 - Bit 4)
          LE Read Remote Used Features (Octet 27 - Bit 5)
          LE Encrypt (Octet 27 - Bit 6)
          LE Rand (Octet 27 - Bit 7)
          LE Start Encryption (Octet 28 - Bit 0)
          LE Long Term Key Request Reply (Octet 28 - Bit 1)
          LE Long Term Key Request Neg Reply (Octet 28 - Bit 2)
          LE Read Supported States (Octet 28 - Bit 3)
          Read Authenticated Payload Timeout (Octet 32 - Bit 4)
          Write Authenticated Payload Timeout (Octet 32 - Bit 5)
          LE Set Data Length (Octet 33 - Bit 6)
          LE Read Suggested Default Data Length (Octet 33 - Bit 7)
          LE Write Suggested Default Data Length (Octet 34 - Bit 0)
          LE Add Device To Resolving List (Octet 34 - Bit 3)
          LE Remove Device From Resolving List (Octet 34 - Bit 4)
          LE Clear Resolving List (Octet 34 - Bit 5)
          LE Read Resolving List Size (Octet 34 - Bit 6)
          LE Set Address Resolution Enable (Octet 35 - Bit 1)
          LE Set Resolvable Private Address Timeout (Octet 35 - Bit 2)
          LE Read Maximum Data Length (Octet 35 - Bit 3)
          LE Read PHY (Octet 35 - Bit 4)
          LE Set Default PHY (Octet 35 - Bit 5)
          LE Set PHY (Octet 35 - Bit 6)
          LE Set Advertising Set Random Address (Octet 36 - Bit 1)
          LE Set Extended Advertising Parameters (Octet 36 - Bit 2)
          LE Set Extended Advertising Data (Octet 36 - Bit 3)
          LE Set Extended Scan Response Data (Octet 36 - Bit 4)
          LE Set Extended Advertising Enable (Octet 36 - Bit 5)
          LE Read Maximum Advertising Data Length (Octet 36 - Bit 6)
          LE Read Number of Supported Advertising Sets (Octet 36 - Bit 7)
          LE Remove Advertising Set (Octet 37 - Bit 0)
          LE Clear Advertising Sets (Octet 37 - Bit 1)
          LE Set Periodic Advertising Parameters (Octet 37 - Bit 2)
          LE Set Periodic Advertising Data (Octet 37 - Bit 3)
          LE Set Periodic Advertising Enable (Octet 37 - Bit 4)
          LE Set Extended Scan Parameters (Octet 37 - Bit 5)
          LE Set Extended Scan Enable (Octet 37 - Bit 6)
          LE Extended Create Connection (Octet 37 - Bit 7)
          LE Periodic Advertising Create Sync (Octet 38 - Bit 0)
          LE Periodic Advertising Create Sync Cancel (Octet 38 - Bit 1)
          LE Periodic Advertising Terminate Sync (Octet 38 - Bit 2)
          LE Add Device To Periodic Advertiser List (Octet 38 - Bit 3)
          LE Remove Device From Periodic Advertiser List (Octet 38 - Bit 4)
          LE Clear Periodic Advertiser List (Octet 38 - Bit 5)
          LE Read Periodic Advertiser List Size (Octet 38 - Bit 6)
          LE Read Transmit Power (Octet 38 - Bit 7)
          LE Read RF Path Compensation (Octet 39 - Bit 0)
          LE Write RF Path Compensation (Octet 39 - Bit 1)
          LE Set Privacy Mode (Octet 39 - Bit 2)
          LE Periodic Advertising Receive Enable (Octet 40 - Bit 5)
          LE Periodic Advertising Sync Transfer (Octet 40 - Bit 6)
          LE Periodic Advertising Set Info Transfer (Octet 40 - Bit 7)
          LE Periodic Advertising Sync Transfer Parameters (Octet 41 - Bit 0)
          LE Set Default Periodic Advertisng Sync Transfer Parameters (Octet 41 - Bit 1)
          LE Read Buffer v2 (Octet 41 - Bit 5)
          LE Read ISO TX Sync (Octet 41 - Bit 6)
          LE Set Connected Isochronous Group Parameters (Octet 41 - Bit 7)
          LE Set Connected Isochronous Group Parameters Test (Octet 42 - Bit 0)
          LE Create Connected Isochronous Stream (Octet 42 - Bit 1)
          LE Remove Connected Isochronous Group (Octet 42 - Bit 2)
          LE Accept Connected Isochronous Stream Request (Octet 42 - Bit 3)
          LE Reject Connected Isochronous Stream Request (Octet 42 - Bit 4)
          LE Create Broadcast Isochronous Group (Octet 42 - Bit 5)
          LE Create Broadcast Isochronous Group Test (Octet 42 - Bit 6)
          LE Terminate Broadcast Isochronous Group (Octet 42 - Bit 7)
          LE Broadcast Isochronous Group Create Sync (Octet 43 - Bit 0)
          LE Broadcast Isochronous Group Terminate Sync (Octet 43 - Bit 1)
          LE Request Peer SCA (Octet 43 - Bit 2)
          LE Setup Isochronous Data Path (Octet 43 - Bit 3)
          LE Remove Isochronous Data Path (Octet 43 - Bit 4)
          LE Isochronous Transmit Test (Octet 43 - Bit 5)
          LE Isochronous Receive Test (Octet 43 - Bit 6)
          LE Isochronous Read Test Counters (Octet 43 - Bit 7)
          LE Isochronous Read Test Counters (Octet 44 - Bit 0)
          LE Set Host Feature (Octet 44 - Bit 1)
          Octet 44 - Bit 2 
          Octet 45 - Bit 6 
          Octet 46 - Bit 0 
          Octet 46 - Bit 1 
          Octet 46 - Bit 2 
          Octet 47 - Bit 4 
< HCI Command: Host Buffer Size (0x03|0x0033) plen 7         #9 [hci1] 1.084244
        ACL MTU: 255  ACL max packet: 16
        SCO MTU: 0    SCO max packet: 0
> HCI Event: Command Complete (0x0e) plen 4                 #10 [hci1] 1.084903
      Host Buffer Size (0x03|0x0033) ncmd 1
        Status: Success (0x00)
< HCI Command: Set Controller To Ho.. (0x03|0x0031) plen 1  #11 [hci1] 1.104247
        Flow control: ACL Data Packets (0x01)
> HCI Event: Command Complete (0x0e) plen 4                 #12 [hci1] 1.104653
      Set Controller To Host Flow Control (0x03|0x0031) ncmd 1
        Status: Success (0x00)
< HCI Command: LE Read Local Suppor.. (0x08|0x0003) plen 0  #13 [hci1] 1.124248
> HCI Event: Command Complete (0x0e) plen 12                #14 [hci1] 1.124837
      LE Read Local Supported Features (0x08|0x0003) ncmd 1
        Status: Success (0x00)
        Features: 0xfd 0x79 0x00 0xf7 0x30 0x01 0x00 0x00
          LE Encryption
          Extended Reject Indication
          Peripheral-initiated Features Exchange
          LE Ping
          LE Data Packet Length Extension
          LL Privacy
          Extended Scanner Filter Policies
          LE 2M PHY
          LE Coded PHY
          LE Extended Advertising
          LE Periodic Advertising
          Channel Selection Algorithm #2
          Periodic Advertising Sync Transfer - Sender
          Periodic Advertising Sync Transfer - Recipient
          Sleep Clock Accuracy Updates
          Connected Isochronous Stream - Central
          Connected Isochronous Stream - Peripheral
          Isochronous Broadcaster
          Synchronized Receiver
          Periodic Advertising ADI support
          Connection Subrating
          Unknown features (0x0000010000000000)
< HCI Command: LE Set Host Feature (0x08|0x0074) plen 2     #15 [hci1] 1.144237
        Bit Number: 32
          Connected Isochronous Stream (Host Support)
        Bit Value: 1
> HCI Event: Command Complete (0x0e) plen 4                 #16 [hci1] 1.144775
      LE Set Host Feature (0x08|0x0074) ncmd 1
        Status: Success (0x00)
< HCI Command: LE Read Buffer v2 (0x08|0x0060) plen 0       #17 [hci1] 1.164239
> HCI Event: Command Complete (0x0e) plen 10                #18 [hci1] 1.164893
      LE Read Buffer v2 (0x08|0x0060) ncmd 1
        Status: Success (0x00)
        ACL MTU: 27
        ACL max packet: 3
        ISO MTU: 318
        ISO max packet: 3
< HCI Command: LE Read Maximum Adve.. (0x08|0x003a) plen 0  #19 [hci1] 1.184274
> HCI Event: Command Complete (0x0e) plen 6                 #20 [hci1] 1.184739
      LE Read Maximum Advertising Data Length (0x08|0x003a) ncmd 1
        Status: Success (0x00)
        Max length: 1650
< HCI Command: LE Read Supported St.. (0x08|0x001c) plen 0  #21 [hci1] 1.204314
> HCI Event: Command Complete (0x0e) plen 12                #22 [hci1] 1.204896
      LE Read Supported States (0x08|0x001c) ncmd 1
        Status: Success (0x00)
        States: 0x000003ff3e0306ff
          Non-connectable Advertising State
          Scannable Advertising State
          Connectable Advertising State
          High Duty Cycle Directed Advertising State
          Passive Scanning State
          Active Scanning State
          Initiating State
            and Connection State (Central Role)
          Connection State (Peripheral Role)
          Scannable Advertising State
            and Passive Scanning State
          Connectable Advertising State
            and Passive Scanning State
          Non-connectable Advertising State
            and Initiating State
          Scannable Advertising State
            and Initiating State
          Active Scanning State
            and Connection State (Central Role)
          Passive Scanning State
            and Connection State (Peripheral Role)
          Active Scanning State
            and Connection State (Peripheral Role)
          Initiating State
            and Connection State (Central Role)
            and Central Role & Central Role
          Low Duty Cycle Directed Advertising State
          Connectable Advertising State
            and Initiating State
            and Central Role & Peripheral Role
          High Duty Cycle Directed Advertising State
            and Initiating State
            and Central Role & Peripheral Role
          Low Duty Cycle Directed Advertising State
            and Initiating State
            and Central Role & Peripheral Role
          Connectable Advertising State
            and Connection State (Central Role)
            and Central Role & Peripheral Role
          High Duty Cycle Directed Advertising State
            and Connection State (Central Role)
            and Central Role & Peripheral Role
          Low Duty Cycle Directed Advertising State
            and Connection State (Central Role)
            and Central Role & Peripheral Role
          Connectable Advertising State
            and Connection State (Peripheral Role)
            and Central Role & Peripheral Role
          High Duty Cycle Directed Advertising State
            and Connection State (Peripheral Role)
            and Peripheral Role & Peripheral Role
          Low Duty Cycle Directed Advertising State
            and Connection State (Peripheral Role)
            and Peripheral Role & Peripheral Role
          Initiating State
            and Connection State (Peripheral Role)
            and Central Role & Peripheral Role
< HCI Command: LE Read Maximum Data.. (0x08|0x002f) plen 0  #23 [hci1] 1.224243
> HCI Event: Command Complete (0x0e) plen 12                #24 [hci1] 1.224789
      LE Read Maximum Data Length (0x08|0x002f) ncmd 1
        Status: Success (0x00)
        Max TX octets: 251
        Max TX time: 2704
        Max RX octets: 251
        Max RX time: 2704
< HCI Command: LE Write Suggested D.. (0x08|0x0024) plen 4  #25 [hci1] 1.244241
        TX octets: 251
        TX time: 2704
> HCI Event: Command Complete (0x0e) plen 4                 #26 [hci1] 1.244855
      LE Write Suggested Default Data Length (0x08|0x0024) ncmd 1
        Status: Success (0x00)
< HCI Command: LE Read Resolving Li.. (0x08|0x002a) plen 0  #27 [hci1] 1.264252
> HCI Event: Command Complete (0x0e) plen 5                 #28 [hci1] 1.264711
      LE Read Resolving List Size (0x08|0x002a) ncmd 1
        Status: Success (0x00)
        Size: 8
< HCI Command: LE Set Host Feature (0x08|0x0074) plen 2     #29 [hci1] 1.284250
        Bit Number: 38
          Connection Subrating (Host Support)
        Bit Value: 1
> HCI Event: Command Complete (0x0e) plen 4                 #30 [hci1] 1.284723
      LE Set Host Feature (0x08|0x0074) ncmd 1
        Status: Success (0x00)
< HCI Command: LE Set Event Mask (0x08|0x0001) plen 8       #31 [hci1] 1.304241
        Mask: 0x000002063f87fa5e
          LE Advertising Report
          LE Connection Update Complete
          LE Read Remote Used Features Complete
          LE Long Term Key Request
          LE Data Length Change
          LE Enhanced Connection Complete
          LE PHY Update Complete
          LE Extended Advertising Report
          LE Periodic Advertising Sync Established
          LE Periodic Advertising Report
          LE Periodic Advertising Sync Lost
          LE Extended Scan Timeout
          LE Extended Advertising Set Terminated
          LE Scan Request Received
          LE Periodic Advertising Sync Transfer Rvc
          LE CIS Established
          LE CIS Request
          LE Create BIG Complete
          LE Terminate BIG Complete
          LE BIG Sync Estabilished Complete
          LE BIG Sync Lost
          LE BIG Info Advertising Report
          LE Subrate Change
          Unknown mask (0x0000020000000000)
> HCI Event: Command Complete (0x0e) plen 4                 #32 [hci1] 1.304761
      LE Set Event Mask (0x08|0x0001) ncmd 1
        Status: Success (0x00)
< HCI Command: Set Event Mask (0x03|0x0001) plen 8          #33 [hci1] 1.324206
        Mask: 0x2000800002008890
          Disconnection Complete
          Encryption Change
          Read Remote Version Information Complete
          Hardware Error
          Data Buffer Overflow
          Encryption Key Refresh Complete
          LE Meta
> HCI Event: Command Complete (0x0e) plen 4                 #34 [hci1] 1.324884
      Set Event Mask (0x03|0x0001) ncmd 1
        Status: Success (0x00)
< HCI Command: Read BD ADDR (0x04|0x0009) plen 0            #35 [hci1] 1.344251
> HCI Event: Command Complete (0x0e) plen 10                #36 [hci1] 1.344800
      Read BD ADDR (0x04|0x0009) ncmd 1
        Status: Success (0x00)
        Address: 00:00:00:00:00:00 (OUI 00-00-00)
< HCI Command: LE Set Random Address (0x08|0x0005) plen 6   #37 [hci1] 1.364251
        Address: D5:B6:CC:31:DB:3B (Static)
> HCI Event: Command Complete (0x0e) plen 4                 #38 [hci1] 1.364793
      LE Set Random Address (0x08|0x0005) ncmd 1
        Status: Success (0x00)
< HCI Command: LE Extended Create... (0x08|0x0043) plen 26  #39 [hci1] 3.534276
        Filter policy: Accept list is not used (0x00)
        Own address type: Random (0x01)
        Peer address type: Public (0x00)
        Peer address: DF:A9:FF:F6:B1:1A (OUI DF-A9-FF)
        Initiating PHYs: 0x01
        Entry 0: LE 1M
          Scan interval: 60.000 msec (0x0060)
          Scan window: 60.000 msec (0x0060)
          Min connection interval: 30.00 msec (0x0018)
          Max connection interval: 50.00 msec (0x0028)
          Connection latency: 0 (0x0000)
          Supervision timeout: 4000 msec (0x0190)
          Min connection length: 0.000 msec (0x0000)
          Max connection length: 0.000 msec (0x0000)
> HCI Event: Command Status (0x0f) plen 4                   #40 [hci1] 3.535192
      LE Extended Create Connection (0x08|0x0043) ncmd 1
        Status: Success (0x00)
> HCI Event: LE Meta Event (0x3e) plen 31                   #41 [hci1] 3.555315
      LE Enhanced Connection Complete (0x0a)
        Status: Success (0x00)
        Handle: 1314
        Role: Central (0x00)
        Peer address type: Public (0x00)
        Peer address: DF:A9:FF:F6:B1:1A (OUI DF-A9-FF)
        Local resolvable private address: 00:00:00:00:00:00 (Non-Resolvable)
        Peer resolvable private address: 00:00:00:00:00:00 (Non-Resolvable)
        Connection interval: 50.00 msec (0x0028)
        Connection latency: 0 (0x0000)
        Supervision timeout: 4000 msec (0x0190)
        Central clock accuracy: 0x00
< HCI Command: LE Read Remote Used... (0x08|0x0016) plen 2  #42 [hci1] 3.564549
        Handle: 1314 Address: DF:A9:FF:F6:B1:1A (OUI DF-A9-FF)
> HCI Event: Command Status (0x0f) plen 4                   #43 [hci1] 3.565055
      LE Read Remote Used Features (0x08|0x0016) ncmd 1
        Status: Success (0x00)
< HCI Command: LE Set PHY (0x08|0x0032) plen 7              #44 [hci1] 3.584239
        Handle: 1314 Address: DF:A9:FF:F6:B1:1A (OUI DF-A9-FF)
        All PHYs preference: 0x00
        TX PHYs preference: 0x02
          LE 2M
        RX PHYs preference: 0x02
          LE 2M
        PHY options preference: Reserved (0x0000)
> HCI Event: Command Status (0x0f) plen 4                   #45 [hci1] 3.584865
      LE Set PHY (0x08|0x0032) ncmd 1
        Status: Success (0x00)
> HCI Event: LE Meta Event (0x3e) plen 12                   #46 [hci1] 3.706881
      LE Read Remote Used Features (0x04)
        Status: Success (0x00)
        Handle: 1314 Address: DF:A9:FF:F6:B1:1A (OUI DF-A9-FF)
        Features: 0x2d 0x49 0x00 0xf7 0x67 0xd9 0x00 0x80
          LE Encryption
          Extended Reject Indication
          Peripheral-initiated Features Exchange
          LE Data Packet Length Extension
          LE 2M PHY
          LE Coded PHY
          Channel Selection Algorithm #2
          Periodic Advertising Sync Transfer - Sender
          Periodic Advertising Sync Transfer - Recipient
          Sleep Clock Accuracy Updates
          Connected Isochronous Stream - Central
          Connected Isochronous Stream - Peripheral
          Isochronous Broadcaster
          Synchronized Receiver
          Connected Isochronous Stream (Host Support)
          LE Power Control Request
          LE Power Control Request
          Connection Subrating
          Connection Subrating (Host Support)
          Unknown features (0x8000d90000000000)
> HCI Event: LE Meta Event (0x3e) plen 6                    #47 [hci1] 4.206226
      LE PHY Update Complete (0x0c)
        Status: Success (0x00)
        Handle: 1314 Address: DF:A9:FF:F6:B1:1A (OUI DF-A9-FF)
        TX PHY: LE 2M (0x02)
        RX PHY: LE 2M (0x02)
< ACL Data TX: Handle 1314 flags 0x00 dlen 11               #48 [hci1] 4.664494
      SMP: Pairing Request (0x01) len 6
        IO capability: KeyboardOnly (0x02)
        OOB data: Authentication data not present (0x00)
        Authentication requirement: No bonding, No MITM, SC, No Keypresses (0x08)
        Max encryption key size: 16
        Initiator key distribution: <none> (0x00)
        Responder key distribution: <none> (0x00)
> HCI Event: Number of Completed Packets (0x13) plen 5      #49 [hci1] 4.706598
        Num handles: 1
        Handle: 1314 Address: DF:A9:FF:F6:B1:1A (OUI DF-A9-FF)
        Count: 1
        #48: len 11 (2 Kb/s)
        Latency: 42 msec (42-42 msec ~42 msec)
> ACL Data RX: Handle 1314 flags 0x02 dlen 11               #50 [hci1] 4.756625
      SMP: Pairing Response (0x02) len 6
        IO capability: KeyboardOnly (0x02)
        OOB data: Authentication data not present (0x00)
        Authentication requirement: No bonding, MITM, SC, No Keypresses (0x0c)
        Max encryption key size: 16
        Initiator key distribution: <none> (0x00)
        Responder key distribution: <none> (0x00)
< HCI Command: Host Number of Compl.. (0x03|0x0035) plen 5  #51 [hci1] 4.764720
        Num handles: 1
        Handle: 1314 Address: DF:A9:FF:F6:B1:1A (OUI DF-A9-FF)
        Count: 1
< ACL Data TX: Handle 1314 flags 0x00 dlen 27               #52 [hci1] 4.764821
< ACL Data TX: Handle 1314 flags 0x01 dlen 27               #53 [hci1] 4.764850
< ACL Data TX: Handle 1314 flags 0x01 dlen 15               #54 [hci1] 4.764856
      SMP: Pairing Public Key (0x0c) len 64
        X: 98308440221e2d910f0e54b71e7ec652857aa9b5a0dc65028824cc19db1226e9
        Y: 67a4816bcb62efb21701e31fdb27561a6217575fb007a8bbdabe7e28b6f68482
> HCI Event: Number of Completed Packets (0x13) plen 5      #55 [hci1] 4.806577
        Num handles: 1
        Handle: 1314 Address: DF:A9:FF:F6:B1:1A (OUI DF-A9-FF)
        Count: 1
        #52: len 27 (5 Kb/s)
        Latency: 41 msec (41-42 msec ~41 msec)
> HCI Event: Number of Completed Packets (0x13) plen 5      #56 [hci1] 4.807078
        Num handles: 1
        Handle: 1314 Address: DF:A9:FF:F6:B1:1A (OUI DF-A9-FF)
        Count: 1
        #53: len 27 (5 Kb/s)
        Latency: 42 msec (41-42 msec ~42 msec)
> HCI Event: Number of Completed Packets (0x13) plen 5      #57 [hci1] 4.807683
        Num handles: 1
        Handle: 1314 Address: DF:A9:FF:F6:B1:1A (OUI DF-A9-FF)
        Count: 1
        #54: len 15 (2 Kb/s)
        Latency: 42 msec (41-42 msec ~42 msec)
> ACL Data RX: Handle 1314 flags 0x02 dlen 27               #58 [hci1] 4.856983
> ACL Data RX: Handle 1314 flags 0x01 dlen 27               #59 [hci1] 4.857418
> ACL Data RX: Handle 1314 flags 0x01 dlen 15               #60 [hci1] 4.857707
      SMP: Pairing Public Key (0x0c) len 64
        X: 973a45da8f0e5df8dc9993f7a6974358603802cb06dbffc7e4568ead20a9819d
        Y: 48efa5df83bfd3d62306557e505294cf04d88b624183ad3c92c51f1b1302f864
< HCI Command: Host Number of Compl.. (0x03|0x0035) plen 5  #61 [hci1] 4.864877
        Num handles: 1
        Handle: 1314 Address: DF:A9:FF:F6:B1:1A (OUI DF-A9-FF)
        Count: 1
< HCI Command: Host Number of Compl.. (0x03|0x0035) plen 5  #62 [hci1] 4.865149
        Num handles: 1
        Handle: 1314 Address: DF:A9:FF:F6:B1:1A (OUI DF-A9-FF)
        Count: 1
< HCI Command: Host Number of Compl.. (0x03|0x0035) plen 5  #63 [hci1] 4.865483
        Num handles: 1
        Handle: 1314 Address: DF:A9:FF:F6:B1:1A (OUI DF-A9-FF)
        Count: 1
< ACL Data TX: Handle 1314 flags 0x00 dlen 21               #64 [hci1] 5.674890
      SMP: Pairing Confirm (0x03) len 16
        Confim value: c200829aadfbe5ca721d57a90a670272
> HCI Event: Number of Completed Packets (0x13) plen 5      #65 [hci1] 5.706628
        Num handles: 1
        Handle: 1314 Address: DF:A9:FF:F6:B1:1A (OUI DF-A9-FF)
        Count: 1
        #64: len 21 (5 Kb/s)
        Latency: 31 msec (31-42 msec ~37 msec)
> ACL Data RX: Handle 1314 flags 0x02 dlen 21               #66 [hci1] 5.756771
      SMP: Pairing Confirm (0x03) len 16
        Confim value: 0d36daf425ede925ab9d54c701dc1a2f
< HCI Command: Host Number of Compl.. (0x03|0x0035) plen 5  #67 [hci1] 5.764506
        Num handles: 1
        Handle: 1314 Address: DF:A9:FF:F6:B1:1A (OUI DF-A9-FF)
        Count: 1
< ACL Data TX: Handle 1314 flags 0x00 dlen 21               #68 [hci1] 5.764547
      SMP: Pairing Random (0x04) len 16
        Random value: 8e6108f966a694cbe26df70bb96773e6
> HCI Event: Number of Completed Packets (0x13) plen 5      #69 [hci1] 5.806603
        Num handles: 1
        Handle: 1314 Address: DF:A9:FF:F6:B1:1A (OUI DF-A9-FF)
        Count: 1
        #68: len 21 (4 Kb/s)
        Latency: 42 msec (31-42 msec ~39 msec)
> ACL Data RX: Handle 1314 flags 0x02 dlen 21               #70 [hci1] 6.056890
      SMP: Pairing Random (0x04) len 16
        Random value: afb33a7b57b865e37f161a2fafbbbf1a
< HCI Command: Host Number of Compl.. (0x03|0x0035) plen 5  #71 [hci1] 6.065016
        Num handles: 1
        Handle: 1314 Address: DF:A9:FF:F6:B1:1A (OUI DF-A9-FF)
        Count: 1
< ACL Data TX: Handle 1314 flags 0x00 dlen 21               #72 [hci1] 6.065104
      SMP: Pairing Confirm (0x03) len 16
        Confim value: 93dc98155bcb8c0520143e339403ad46
> HCI Event: Number of Completed Packets (0x13) plen 5      #73 [hci1] 6.106564
        Num handles: 1
        Handle: 1314 Address: DF:A9:FF:F6:B1:1A (OUI DF-A9-FF)
        Count: 1
        #72: len 21 (4 Kb/s)
        Latency: 41 msec (31-42 msec ~40 msec)
> ACL Data RX: Handle 1314 flags 0x02 dlen 21               #74 [hci1] 6.157034
      SMP: Pairing Confirm (0x03) len 16
        Confim value: 21ccc22d466f1d66a26a08c6cb636473
< HCI Command: Host Number of Compl.. (0x03|0x0035) plen 5  #75 [hci1] 6.164396
        Num handles: 1
        Handle: 1314 Address: DF:A9:FF:F6:B1:1A (OUI DF-A9-FF)
        Count: 1
< ACL Data TX: Handle 1314 flags 0x00 dlen 21               #76 [hci1] 6.164431
      SMP: Pairing Random (0x04) len 16
        Random value: 5da095555cc64d02679f89a05211af56
> HCI Event: Number of Completed Packets (0x13) plen 5      #77 [hci1] 6.206578
        Num handles: 1
        Handle: 1314 Address: DF:A9:FF:F6:B1:1A (OUI DF-A9-FF)
        Count: 1
        #76: len 21 (4 Kb/s)
        Latency: 42 msec (31-42 msec ~41 msec)
> ACL Data RX: Handle 1314 flags 0x02 dlen 21               #78 [hci1] 6.456696
      SMP: Pairing Random (0x04) len 16
        Random value: af6b4540c653d1603e8aa38b84faa941
< HCI Command: Host Number of Compl.. (0x03|0x0035) plen 5  #79 [hci1] 6.464846
        Num handles: 1
        Handle: 1314 Address: DF:A9:FF:F6:B1:1A (OUI DF-A9-FF)
        Count: 1
< ACL Data TX: Handle 1314 flags 0x00 dlen 21               #80 [hci1] 6.464982
      SMP: Pairing Confirm (0x03) len 16
        Confim value: 92e7cd3b02ba8e93e25258ab7aafb518
> HCI Event: Number of Completed Packets (0x13) plen 5      #81 [hci1] 6.506620
        Num handles: 1
        Handle: 1314 Address: DF:A9:FF:F6:B1:1A (OUI DF-A9-FF)
        Count: 1
        #80: len 21 (4 Kb/s)
        Latency: 41 msec (31-42 msec ~41 msec)
> ACL Data RX: Handle 1314 flags 0x02 dlen 21               #82 [hci1] 6.556938
      SMP: Pairing Confirm (0x03) len 16
        Confim value: b2a8f00830a01418d23d684bae06a5fd
< HCI Command: Host Number of Compl.. (0x03|0x0035) plen 5  #83 [hci1] 6.564559
        Num handles: 1
        Handle: 1314 Address: DF:A9:FF:F6:B1:1A (OUI DF-A9-FF)
        Count: 1
< ACL Data TX: Handle 1314 flags 0x00 dlen 21               #84 [hci1] 6.564574
      SMP: Pairing Random (0x04) len 16
        Random value: da64d21ec8845e8286bc235a02440d0c
> HCI Event: Number of Completed Packets (0x13) plen 5      #85 [hci1] 6.606603
        Num handles: 1
        Handle: 1314 Address: DF:A9:FF:F6:B1:1A (OUI DF-A9-FF)
        Count: 1
        #84: len 21 (4 Kb/s)
        Latency: 42 msec (31-42 msec ~41 msec)
> ACL Data RX: Handle 1314 flags 0x02 dlen 21               #86 [hci1] 6.856813
      SMP: Pairing Random (0x04) len 16
        Random value: 0a650cb7df55682df6ec30a62a615ea8
< HCI Command: Host Number of Compl.. (0x03|0x0035) plen 5  #87 [hci1] 6.864800
        Num handles: 1
        Handle: 1314 Address: DF:A9:FF:F6:B1:1A (OUI DF-A9-FF)
        Count: 1
< ACL Data TX: Handle 1314 flags 0x00 dlen 21               #88 [hci1] 6.864884
      SMP: Pairing Confirm (0x03) len 16
        Confim value: bc3a97923d8d95ef4fcd4292a0d495e7
> HCI Event: Number of Completed Packets (0x13) plen 5      #89 [hci1] 6.906547
        Num handles: 1
        Handle: 1314 Address: DF:A9:FF:F6:B1:1A (OUI DF-A9-FF)
        Count: 1
        #88: len 21 (4 Kb/s)
        Latency: 41 msec (31-42 msec ~41 msec)
> ACL Data RX: Handle 1314 flags 0x02 dlen 21               #90 [hci1] 6.956794
      SMP: Pairing Confirm (0x03) len 16
        Confim value: 39c5ed57989f8ee796383ad21a67e6eb
< HCI Command: Host Number of Compl.. (0x03|0x0035) plen 5  #91 [hci1] 6.964714
        Num handles: 1
        Handle: 1314 Address: DF:A9:FF:F6:B1:1A (OUI DF-A9-FF)
        Count: 1
< ACL Data TX: Handle 1314 flags 0x00 dlen 21               #92 [hci1] 6.964806
      SMP: Pairing Random (0x04) len 16
        Random value: a2acf8fd71a45c4a1bcadd27bd58e945
> HCI Event: Number of Completed Packets (0x13) plen 5      #93 [hci1] 7.006506
        Num handles: 1
        Handle: 1314 Address: DF:A9:FF:F6:B1:1A (OUI DF-A9-FF)
        Count: 1
        #92: len 21 (4 Kb/s)
        Latency: 41 msec (31-42 msec ~41 msec)
> ACL Data RX: Handle 1314 flags 0x02 dlen 21               #94 [hci1] 7.206772
      SMP: Pairing Random (0x04) len 16
        Random value: 4d308fcb7c03a326c2964ce209e74231
< HCI Command: Host Number of Compl.. (0x03|0x0035) plen 5  #95 [hci1] 7.224393
        Num handles: 1
        Handle: 1314 Address: DF:A9:FF:F6:B1:1A (OUI DF-A9-FF)
        Count: 1
< ACL Data TX: Handle 1314 flags 0x00 dlen 21               #96 [hci1] 7.224464
      SMP: Pairing Confirm (0x03) len 16
        Confim value: e2cda2284b1062642907326bbc3abfd1
> HCI Event: Number of Completed Packets (0x13) plen 5      #97 [hci1] 7.256642
        Num handles: 1
        Handle: 1314 Address: DF:A9:FF:F6:B1:1A (OUI DF-A9-FF)
        Count: 1
        #96: len 21 (5 Kb/s)
        Latency: 32 msec (31-42 msec ~36 msec)
> ACL Data RX: Handle 1314 flags 0x02 dlen 21               #98 [hci1] 7.306747
      SMP: Pairing Confirm (0x03) len 16
        Confim value: 4e13e3e751f2bf87397e317ea12fa628
< HCI Command: Host Number of Compl.. (0x03|0x0035) plen 5  #99 [hci1] 7.324542
        Num handles: 1
        Handle: 1314 Address: DF:A9:FF:F6:B1:1A (OUI DF-A9-FF)
        Count: 1
< ACL Data TX: Handle 1314 flags 0x00 dlen 21              #100 [hci1] 7.324588
      SMP: Pairing Random (0x04) len 16
        Random value: 00bad7aca1ba32527e6e64e79f33b2e3
> HCI Event: Number of Completed Packets (0x13) plen 5     #101 [hci1] 7.356629
        Num handles: 1
        Handle: 1314 Address: DF:A9:FF:F6:B1:1A (OUI DF-A9-FF)
        Count: 1
        #100: len 21 (5 Kb/s)
        Latency: 32 msec (31-42 msec ~34 msec)
> ACL Data RX: Handle 1314 flags 0x02 dlen 21              #102 [hci1] 7.606827
      SMP: Pairing Random (0x04) len 16
        Random value: 19da9e3240c3cc8c73651fa40e73d7e7
< HCI Command: Host Number of Comp.. (0x03|0x0035) plen 5  #103 [hci1] 7.624915
        Num handles: 1
        Handle: 1314 Address: DF:A9:FF:F6:B1:1A (OUI DF-A9-FF)
        Count: 1
< ACL Data TX: Handle 1314 flags 0x00 dlen 21              #104 [hci1] 7.625068
      SMP: Pairing Confirm (0x03) len 16
        Confim value: efa0f463976b046c25677438fed8611f
> HCI Event: Number of Completed Packets (0x13) plen 5     #105 [hci1] 7.656684
        Num handles: 1
        Handle: 1314 Address: DF:A9:FF:F6:B1:1A (OUI DF-A9-FF)
        Count: 1
        #104: len 21 (5 Kb/s)
        Latency: 31 msec (31-42 msec ~33 msec)
> ACL Data RX: Handle 1314 flags 0x02 dlen 21              #106 [hci1] 7.706907
      SMP: Pairing Confirm (0x03) len 16
        Confim value: 9a4bd3b647b0d1661d07628b8c8d2ae8
< HCI Command: Host Number of Comp.. (0x03|0x0035) plen 5  #107 [hci1] 7.724426
        Num handles: 1
        Handle: 1314 Address: DF:A9:FF:F6:B1:1A (OUI DF-A9-FF)
        Count: 1
< ACL Data TX: Handle 1314 flags 0x00 dlen 21              #108 [hci1] 7.724502
      SMP: Pairing Random (0x04) len 16
        Random value: 4db8ab2d95badddbdfe2838e9a8cc696
> HCI Event: Number of Completed Packets (0x13) plen 5     #109 [hci1] 7.756639
        Num handles: 1
        Handle: 1314 Address: DF:A9:FF:F6:B1:1A (OUI DF-A9-FF)
        Count: 1
        #108: len 21 (5 Kb/s)
        Latency: 32 msec (31-42 msec ~32 msec)
> ACL Data RX: Handle 1314 flags 0x02 dlen 21              #110 [hci1] 7.956795
      SMP: Pairing Random (0x04) len 16
        Random value: 302b5f3fb01eb8cf84a4c5acb977f5e7
< HCI Command: Host Number of Comp.. (0x03|0x0035) plen 5  #111 [hci1] 7.964513
        Num handles: 1
        Handle: 1314 Address: DF:A9:FF:F6:B1:1A (OUI DF-A9-FF)
        Count: 1
< ACL Data TX: Handle 1314 flags 0x00 dlen 21              #112 [hci1] 7.964536
      SMP: Pairing Confirm (0x03) len 16
        Confim value: 7efb3fda6a25081906820bb44d0b9c2e
> HCI Event: Number of Completed Packets (0x13) plen 5     #113 [hci1] 8.006583
        Num handles: 1
        Handle: 1314 Address: DF:A9:FF:F6:B1:1A (OUI DF-A9-FF)
        Count: 1
        #112: len 21 (4 Kb/s)
        Latency: 42 msec (31-42 msec ~37 msec)
> ACL Data RX: Handle 1314 flags 0x02 dlen 21              #114 [hci1] 8.056734
      SMP: Pairing Confirm (0x03) len 16
        Confim value: b4268b45afe2d928ef2525ef3b723087
< HCI Command: Host Number of Comp.. (0x03|0x0035) plen 5  #115 [hci1] 8.064662
        Num handles: 1
        Handle: 1314 Address: DF:A9:FF:F6:B1:1A (OUI DF-A9-FF)
        Count: 1
< ACL Data TX: Handle 1314 flags 0x00 dlen 21              #116 [hci1] 8.064749
      SMP: Pairing Random (0x04) len 16
        Random value: c850fef72c5ceb9f1915536596b6fc3d
> HCI Event: Number of Completed Packets (0x13) plen 5     #117 [hci1] 8.106565
        Num handles: 1
        Handle: 1314 Address: DF:A9:FF:F6:B1:1A (OUI DF-A9-FF)
        Count: 1
        #116: len 21 (4 Kb/s)
        Latency: 41 msec (31-42 msec ~39 msec)
> ACL Data RX: Handle 1314 flags 0x02 dlen 21              #118 [hci1] 8.356770
      SMP: Pairing Random (0x04) len 16
        Random value: 4108807d2d918a853415c56f8a8114c5
< HCI Command: Host Number of Comp.. (0x03|0x0035) plen 5  #119 [hci1] 8.364396
        Num handles: 1
        Handle: 1314 Address: DF:A9:FF:F6:B1:1A (OUI DF-A9-FF)
        Count: 1
< ACL Data TX: Handle 1314 flags 0x00 dlen 21              #120 [hci1] 8.364466
      SMP: Pairing Confirm (0x03) len 16
        Confim value: d18ee7eda9753673371a843fa5ef61f6
> HCI Event: Number of Completed Packets (0x13) plen 5     #121 [hci1] 8.406547
        Num handles: 1
        Handle: 1314 Address: DF:A9:FF:F6:B1:1A (OUI DF-A9-FF)
        Count: 1
        #120: len 21 (4 Kb/s)
        Latency: 42 msec (31-42 msec ~40 msec)
> ACL Data RX: Handle 1314 flags 0x02 dlen 21              #122 [hci1] 8.456728
      SMP: Pairing Confirm (0x03) len 16
        Confim value: 4b635e27c6444fa8aa3b37d0e0645b4c
< HCI Command: Host Number of Comp.. (0x03|0x0035) plen 5  #123 [hci1] 8.464810
        Num handles: 1
        Handle: 1314 Address: DF:A9:FF:F6:B1:1A (OUI DF-A9-FF)
        Count: 1
< ACL Data TX: Handle 1314 flags 0x00 dlen 21              #124 [hci1] 8.464900
      SMP: Pairing Random (0x04) len 16
        Random value: 6b2b19701bcf5c794dc9ad9f2c3f295e
> HCI Event: Number of Completed Packets (0x13) plen 5     #125 [hci1] 8.506631
        Num handles: 1
        Handle: 1314 Address: DF:A9:FF:F6:B1:1A (OUI DF-A9-FF)
        Count: 1
        #124: len 21 (4 Kb/s)
        Latency: 41 msec (31-42 msec ~41 msec)
> ACL Data RX: Handle 1314 flags 0x02 dlen 21              #126 [hci1] 8.756763
      SMP: Pairing Random (0x04) len 16
        Random value: 24069afbbff85c49167da69edf9524ec
< HCI Command: Host Number of Comp.. (0x03|0x0035) plen 5  #127 [hci1] 8.764877
        Num handles: 1
        Handle: 1314 Address: DF:A9:FF:F6:B1:1A (OUI DF-A9-FF)
        Count: 1
< ACL Data TX: Handle 1314 flags 0x00 dlen 21              #128 [hci1] 8.764994
      SMP: Pairing Confirm (0x03) len 16
        Confim value: 205411e9ebc7e056e12eae7a89c3ce63
> HCI Event: Number of Completed Packets (0x13) plen 5     #129 [hci1] 8.806556
        Num handles: 1
        Handle: 1314 Address: DF:A9:FF:F6:B1:1A (OUI DF-A9-FF)
        Count: 1
        #128: len 21 (4 Kb/s)
        Latency: 41 msec (31-42 msec ~41 msec)
> ACL Data RX: Handle 1314 flags 0x02 dlen 21              #130 [hci1] 8.856801
      SMP: Pairing Confirm (0x03) len 16
        Confim value: e8c593a70d0e295c77a0b565b0f470f7
< HCI Command: Host Number of Comp.. (0x03|0x0035) plen 5  #131 [hci1] 8.864813
        Num handles: 1
        Handle: 1314 Address: DF:A9:FF:F6:B1:1A (OUI DF-A9-FF)
        Count: 1
< ACL Data TX: Handle 1314 flags 0x00 dlen 21              #132 [hci1] 8.864870
      SMP: Pairing Random (0x04) len 16
        Random value: d5e1c3cfeb215c2fff312cdf99c94919
> HCI Event: Number of Completed Packets (0x13) plen 5     #133 [hci1] 8.906554
        Num handles: 1
        Handle: 1314 Address: DF:A9:FF:F6:B1:1A (OUI DF-A9-FF)
        Count: 1
        #132: len 21 (4 Kb/s)
        Latency: 41 msec (31-42 msec ~41 msec)
> ACL Data RX: Handle 1314 flags 0x02 dlen 21              #134 [hci1] 9.156750
      SMP: Pairing Random (0x04) len 16
        Random value: 346bd0849f9612575fa7b6f29271c053
< HCI Command: Host Number of Comp.. (0x03|0x0035) plen 5  #135 [hci1] 9.164346
        Num handles: 1
        Handle: 1314 Address: DF:A9:FF:F6:B1:1A (OUI DF-A9-FF)
        Count: 1
< ACL Data TX: Handle 1314 flags 0x00 dlen 21              #136 [hci1] 9.164459
      SMP: Pairing Confirm (0x03) len 16
        Confim value: 65636030328252a16fc8eaa5856f6da6
> HCI Event: Number of Completed Packets (0x13) plen 5     #137 [hci1] 9.206531
        Num handles: 1
        Handle: 1314 Address: DF:A9:FF:F6:B1:1A (OUI DF-A9-FF)
        Count: 1
        #136: len 21 (4 Kb/s)
        Latency: 42 msec (31-42 msec ~41 msec)
> ACL Data RX: Handle 1314 flags 0x02 dlen 21              #138 [hci1] 9.256836
      SMP: Pairing Confirm (0x03) len 16
        Confim value: f00297d66df03250c25195abe5232d31
< HCI Command: Host Number of Comp.. (0x03|0x0035) plen 5  #139 [hci1] 9.264761
        Num handles: 1
        Handle: 1314 Address: DF:A9:FF:F6:B1:1A (OUI DF-A9-FF)
        Count: 1
< ACL Data TX: Handle 1314 flags 0x00 dlen 21              #140 [hci1] 9.264864
      SMP: Pairing Random (0x04) len 16
        Random value: 77355a9a8321c629a3a987d808e80865
> HCI Event: Number of Completed Packets (0x13) plen 5     #141 [hci1] 9.306483
        Num handles: 1
        Handle: 1314 Address: DF:A9:FF:F6:B1:1A (OUI DF-A9-FF)
        Count: 1
        #140: len 21 (4 Kb/s)
        Latency: 41 msec (31-42 msec ~41 msec)
> ACL Data RX: Handle 1314 flags 0x02 dlen 21              #142 [hci1] 9.556653
      SMP: Pairing Random (0x04) len 16
        Random value: b5259905354a2e9ec11a0726dc3cce1b
< HCI Command: Host Number of Comp.. (0x03|0x0035) plen 5  #143 [hci1] 9.564468
        Num handles: 1
        Handle: 1314 Address: DF:A9:FF:F6:B1:1A (OUI DF-A9-FF)
        Count: 1
< ACL Data TX: Handle 1314 flags 0x00 dlen 21              #144 [hci1] 9.564499
      SMP: Pairing Confirm (0x03) len 16
        Confim value: 87474554fe87560a1be142575dfb2849
> HCI Event: Number of Completed Packets (0x13) plen 5     #145 [hci1] 9.606476
        Num handles: 1
        Handle: 1314 Address: DF:A9:FF:F6:B1:1A (OUI DF-A9-FF)
        Count: 1
        #144: len 21 (4 Kb/s)
        Latency: 41 msec (31-42 msec ~41 msec)
> ACL Data RX: Handle 1314 flags 0x02 dlen 21              #146 [hci1] 9.656771
      SMP: Pairing Confirm (0x03) len 16
        Confim value: be2e0ad9a97b952315539bf5e5d9ae0c
< HCI Command: Host Number of Comp.. (0x03|0x0035) plen 5  #147 [hci1] 9.664409
        Num handles: 1
        Handle: 1314 Address: DF:A9:FF:F6:B1:1A (OUI DF-A9-FF)
        Count: 1
< ACL Data TX: Handle 1314 flags 0x00 dlen 21              #148 [hci1] 9.664473
      SMP: Pairing Random (0x04) len 16
        Random value: 8dfc1155a0b492f20f6ad8f13724432c
> HCI Event: Number of Completed Packets (0x13) plen 5     #149 [hci1] 9.706465
        Num handles: 1
        Handle: 1314 Address: DF:A9:FF:F6:B1:1A (OUI DF-A9-FF)
        Count: 1
        #148: len 21 (4 Kb/s)
        Latency: 41 msec (31-42 msec ~41 msec)
> ACL Data RX: Handle 1314 flags 0x02 dlen 21              #150 [hci1] 9.956744
      SMP: Pairing Random (0x04) len 16
        Random value: 4bcfd5e54f8842e93ad26d984dd3f662
< HCI Command: Host Number of Comp.. (0x03|0x0035) plen 5  #151 [hci1] 9.964451
        Num handles: 1
        Handle: 1314 Address: DF:A9:FF:F6:B1:1A (OUI DF-A9-FF)
        Count: 1
< ACL Data TX: Handle 1314 flags 0x00 dlen 21              #152 [hci1] 9.964459
      SMP: Pairing Confirm (0x03) len 16
        Confim value: 24ecda5b7a73b684b073f05f5769e508
> HCI Event: Number of Completed Packets (0x13) plen 5    #153 [hci1] 10.006541
        Num handles: 1
        Handle: 1314 Address: DF:A9:FF:F6:B1:1A (OUI DF-A9-FF)
        Count: 1
        #152: len 21 (4 Kb/s)
        Latency: 42 msec (31-42 msec ~42 msec)
> ACL Data RX: Handle 1314 flags 0x02 dlen 21             #154 [hci1] 10.056753
      SMP: Pairing Confirm (0x03) len 16
        Confim value: 3aacb7442016b4d56a2a6f3ee0a8ff7d
< HCI Command: Host Number of Com.. (0x03|0x0035) plen 5  #155 [hci1] 10.064806
        Num handles: 1
        Handle: 1314 Address: DF:A9:FF:F6:B1:1A (OUI DF-A9-FF)
        Count: 1
< ACL Data TX: Handle 1314 flags 0x00 dlen 21             #156 [hci1] 10.064898
      SMP: Pairing Random (0x04) len 16
        Random value: 001c45ff744123ac32ebbb5e14c8a6b9
> HCI Event: Number of Completed Packets (0x13) plen 5    #157 [hci1] 10.106674
        Num handles: 1
        Handle: 1314 Address: DF:A9:FF:F6:B1:1A (OUI DF-A9-FF)
        Count: 1
        #156: len 21 (4 Kb/s)
        Latency: 41 msec (31-42 msec ~41 msec)
> ACL Data RX: Handle 1314 flags 0x02 dlen 21             #158 [hci1] 10.356754
      SMP: Pairing Random (0x04) len 16
        Random value: 363c9a965b34f8a6ef41bf316b943600
< HCI Command: Host Number of Com.. (0x03|0x0035) plen 5  #159 [hci1] 10.364636
        Num handles: 1
        Handle: 1314 Address: DF:A9:FF:F6:B1:1A (OUI DF-A9-FF)
        Count: 1
< ACL Data TX: Handle 1314 flags 0x00 dlen 21             #160 [hci1] 10.364706
      SMP: Pairing Confirm (0x03) len 16
        Confim value: 256e26f312492fbc465fa8d5623b3695
> HCI Event: Number of Completed Packets (0x13) plen 5    #161 [hci1] 10.406443
        Num handles: 1
        Handle: 1314 Address: DF:A9:FF:F6:B1:1A (OUI DF-A9-FF)
        Count: 1
        #160: len 21 (4 Kb/s)
        Latency: 41 msec (31-42 msec ~41 msec)
> ACL Data RX: Handle 1314 flags 0x02 dlen 21             #162 [hci1] 10.456701
      SMP: Pairing Confirm (0x03) len 16
        Confim value: 75c6cd7a77d77a5758a853c4eb0175d1
< HCI Command: Host Number of Com.. (0x03|0x0035) plen 5  #163 [hci1] 10.464752
        Num handles: 1
        Handle: 1314 Address: DF:A9:FF:F6:B1:1A (OUI DF-A9-FF)
        Count: 1
< ACL Data TX: Handle 1314 flags 0x00 dlen 21             #164 [hci1] 10.464857
      SMP: Pairing Random (0x04) len 16
        Random value: 296d277ff3bf297efe85e67448a15f56
> HCI Event: Number of Completed Packets (0x13) plen 5    #165 [hci1] 10.506618
        Num handles: 1
        Handle: 1314 Address: DF:A9:FF:F6:B1:1A (OUI DF-A9-FF)
        Count: 1
        #164: len 21 (4 Kb/s)
        Latency: 41 msec (31-42 msec ~41 msec)
> ACL Data RX: Handle 1314 flags 0x02 dlen 21             #166 [hci1] 10.756678
      SMP: Pairing Random (0x04) len 16
        Random value: 2b818fadf2ec994736015ed14d51a2cb
< HCI Command: Host Number of Com.. (0x03|0x0035) plen 5  #167 [hci1] 10.764464
        Num handles: 1
        Handle: 1314 Address: DF:A9:FF:F6:B1:1A (OUI DF-A9-FF)
        Count: 1
< ACL Data TX: Handle 1314 flags 0x00 dlen 21             #168 [hci1] 10.764539
      SMP: Pairing Confirm (0x03) len 16
        Confim value: 674d378db4af7079563c9b077be26370
> HCI Event: Number of Completed Packets (0x13) plen 5    #169 [hci1] 10.806493
        Num handles: 1
        Handle: 1314 Address: DF:A9:FF:F6:B1:1A (OUI DF-A9-FF)
        Count: 1
        #168: len 21 (4 Kb/s)
        Latency: 41 msec (31-42 msec ~41 msec)
> ACL Data RX: Handle 1314 flags 0x02 dlen 21             #170 [hci1] 10.856743
      SMP: Pairing Confirm (0x03) len 16
        Confim value: a623f1391563e36e70d633f1b9210d0e
< HCI Command: Host Number of Com.. (0x03|0x0035) plen 5  #171 [hci1] 10.864504
        Num handles: 1
        Handle: 1314 Address: DF:A9:FF:F6:B1:1A (OUI DF-A9-FF)
        Count: 1
< ACL Data TX: Handle 1314 flags 0x00 dlen 21             #172 [hci1] 10.864585
      SMP: Pairing Random (0x04) len 16
        Random value: e3a3cf1d832325a9493fd3ce4faf02be
> HCI Event: Number of Completed Packets (0x13) plen 5    #173 [hci1] 10.906600
        Num handles: 1
        Handle: 1314 Address: DF:A9:FF:F6:B1:1A (OUI DF-A9-FF)
        Count: 1
        #172: len 21 (4 Kb/s)
        Latency: 42 msec (31-42 msec ~41 msec)
> ACL Data RX: Handle 1314 flags 0x02 dlen 21             #174 [hci1] 11.156755
      SMP: Pairing Random (0x04) len 16
        Random value: 8d4ee03e4b4a7cdd2f6fcc70769bb8af
< HCI Command: Host Number of Com.. (0x03|0x0035) plen 5  #175 [hci1] 11.164513
        Num handles: 1
        Handle: 1314 Address: DF:A9:FF:F6:B1:1A (OUI DF-A9-FF)
        Count: 1
< ACL Data TX: Handle 1314 flags 0x00 dlen 21             #176 [hci1] 11.164576
      SMP: Pairing Confirm (0x03) len 16
        Confim value: a3d39c1f010cc5a985a0847fb8333c33
> HCI Event: Number of Completed Packets (0x13) plen 5    #177 [hci1] 11.206533
        Num handles: 1
        Handle: 1314 Address: DF:A9:FF:F6:B1:1A (OUI DF-A9-FF)
        Count: 1
        #176: len 21 (4 Kb/s)
        Latency: 41 msec (31-42 msec ~41 msec)
> ACL Data RX: Handle 1314 flags 0x02 dlen 21             #178 [hci1] 11.256661
      SMP: Pairing Confirm (0x03) len 16
        Confim value: c98ec160ff324ef76cfb3fe85e85a044
< HCI Command: Host Number of Com.. (0x03|0x0035) plen 5  #179 [hci1] 11.264697
        Num handles: 1
        Handle: 1314 Address: DF:A9:FF:F6:B1:1A (OUI DF-A9-FF)
        Count: 1
< ACL Data TX: Handle 1314 flags 0x00 dlen 21             #180 [hci1] 11.264792
      SMP: Pairing Random (0x04) len 16
        Random value: 595bb7c6e45c58f6b41f855a6f6c3560
> HCI Event: Number of Completed Packets (0x13) plen 5    #181 [hci1] 11.306440
        Num handles: 1
        Handle: 1314 Address: DF:A9:FF:F6:B1:1A (OUI DF-A9-FF)
        Count: 1
        #180: len 21 (4 Kb/s)
        Latency: 41 msec (31-42 msec ~41 msec)
> ACL Data RX: Handle 1314 flags 0x02 dlen 21             #182 [hci1] 11.556675
      SMP: Pairing Random (0x04) len 16
        Random value: 5e08c5a3b5ab89dedc5efa801034a328
< HCI Command: Host Number of Com.. (0x03|0x0035) plen 5  #183 [hci1] 11.564978
        Num handles: 1
        Handle: 1314 Address: DF:A9:FF:F6:B1:1A (OUI DF-A9-FF)
        Count: 1
< ACL Data TX: Handle 1314 flags 0x00 dlen 21             #184 [hci1] 11.565130
      SMP: Pairing Confirm (0x03) len 16
        Confim value: b57938bf3ea1f0bba08cf5b81225bcb1
> HCI Event: Number of Completed Packets (0x13) plen 5    #185 [hci1] 11.606449
        Num handles: 1
        Handle: 1314 Address: DF:A9:FF:F6:B1:1A (OUI DF-A9-FF)
        Count: 1
        #184: len 21 (4 Kb/s)
        Latency: 41 msec (31-42 msec ~41 msec)
> ACL Data RX: Handle 1314 flags 0x02 dlen 21             #186 [hci1] 11.656707
      SMP: Pairing Confirm (0x03) len 16
        Confim value: a8d26742d695aa633a1c8348bc3295ed
< HCI Command: Host Number of Com.. (0x03|0x0035) plen 5  #187 [hci1] 11.664447
        Num handles: 1
        Handle: 1314 Address: DF:A9:FF:F6:B1:1A (OUI DF-A9-FF)
        Count: 1
< ACL Data TX: Handle 1314 flags 0x00 dlen 21             #188 [hci1] 11.664509
      SMP: Pairing Random (0x04) len 16
        Random value: 84e2affc6847b67e7216d5bf664139ed
> HCI Event: Number of Completed Packets (0x13) plen 5    #189 [hci1] 11.706542
        Num handles: 1
        Handle: 1314 Address: DF:A9:FF:F6:B1:1A (OUI DF-A9-FF)
        Count: 1
        #188: len 21 (4 Kb/s)
        Latency: 42 msec (31-42 msec ~41 msec)
> ACL Data RX: Handle 1314 flags 0x02 dlen 21             #190 [hci1] 11.956695
      SMP: Pairing Random (0x04) len 16
        Random value: 034c100d78b96d2e4eb3d278f29edc09
< HCI Command: Host Number of Com.. (0x03|0x0035) plen 5  #191 [hci1] 11.964844
        Num handles: 1
        Handle: 1314 Address: DF:A9:FF:F6:B1:1A (OUI DF-A9-FF)
        Count: 1
< ACL Data TX: Handle 1314 flags 0x00 dlen 21             #192 [hci1] 11.964949
      SMP: Pairing Confirm (0x03) len 16
        Confim value: 72d6c57f1caffd8d89b3ac2e4a86135b
> HCI Event: Number of Completed Packets (0x13) plen 5    #193 [hci1] 12.006474
        Num handles: 1
        Handle: 1314 Address: DF:A9:FF:F6:B1:1A (OUI DF-A9-FF)
        Count: 1
        #192: len 21 (4 Kb/s)
        Latency: 41 msec (31-42 msec ~41 msec)
> ACL Data RX: Handle 1314 flags 0x02 dlen 21             #194 [hci1] 12.056577
      SMP: Pairing Confirm (0x03) len 16
        Confim value: 126ef1d187e7f6682f7e11a18197a770
< HCI Command: Host Number of Com.. (0x03|0x0035) plen 5  #195 [hci1] 12.064824
        Num handles: 1
        Handle: 1314 Address: DF:A9:FF:F6:B1:1A (OUI DF-A9-FF)
        Count: 1
< ACL Data TX: Handle 1314 flags 0x00 dlen 21             #196 [hci1] 12.064981
      SMP: Pairing Random (0x04) len 16
        Random value: 425496665d7eed17f76500c95219dd01
> HCI Event: Number of Completed Packets (0x13) plen 5    #197 [hci1] 12.106464
        Num handles: 1
        Handle: 1314 Address: DF:A9:FF:F6:B1:1A (OUI DF-A9-FF)
        Count: 1
        #196: len 21 (4 Kb/s)
        Latency: 41 msec (31-42 msec ~41 msec)
> ACL Data RX: Handle 1314 flags 0x02 dlen 21             #198 [hci1] 12.356619
      SMP: Pairing Random (0x04) len 16
        Random value: 541eb425a2f7abf35e1a8a0e7b537111
< HCI Command: Host Number of Com.. (0x03|0x0035) plen 5  #199 [hci1] 12.364600
        Num handles: 1
        Handle: 1314 Address: DF:A9:FF:F6:B1:1A (OUI DF-A9-FF)
        Count: 1
< ACL Data TX: Handle 1314 flags 0x00 dlen 21             #200 [hci1] 12.364636
      SMP: Pairing Confirm (0x03) len 16
        Confim value: a4f17e9034172c70f1f0f1c16c47ac89
> HCI Event: Number of Completed Packets (0x13) plen 5    #201 [hci1] 12.406535
        Num handles: 1
        Handle: 1314 Address: DF:A9:FF:F6:B1:1A (OUI DF-A9-FF)
        Count: 1
        #200: len 21 (4 Kb/s)
        Latency: 41 msec (31-42 msec ~41 msec)
> ACL Data RX: Handle 1314 flags 0x02 dlen 21             #202 [hci1] 12.456613
      SMP: Pairing Confirm (0x03) len 16
        Confim value: 9ba9b9c63af806902d33dc295ef86b9b
< HCI Command: Host Number of Com.. (0x03|0x0035) plen 5  #203 [hci1] 12.464756
        Num handles: 1
        Handle: 1314 Address: DF:A9:FF:F6:B1:1A (OUI DF-A9-FF)
        Count: 1
< ACL Data TX: Handle 1314 flags 0x00 dlen 21             #204 [hci1] 12.464835
      SMP: Pairing Random (0x04) len 16
        Random value: 1e63f87b860481d35d47e1f6006d79c9
> HCI Event: Number of Completed Packets (0x13) plen 5    #205 [hci1] 12.506542
        Num handles: 1
        Handle: 1314 Address: DF:A9:FF:F6:B1:1A (OUI DF-A9-FF)
        Count: 1
        #204: len 21 (4 Kb/s)
        Latency: 41 msec (31-42 msec ~41 msec)
> ACL Data RX: Handle 1314 flags 0x02 dlen 21             #206 [hci1] 12.756667
      SMP: Pairing Random (0x04) len 16
        Random value: 7eb00636ae8e8aa7c8794bd456a1a5ec
< HCI Command: Host Number of Com.. (0x03|0x0035) plen 5  #207 [hci1] 12.764651
        Num handles: 1
        Handle: 1314 Address: DF:A9:FF:F6:B1:1A (OUI DF-A9-FF)
        Count: 1
< ACL Data TX: Handle 1314 flags 0x00 dlen 21             #208 [hci1] 12.764702
      SMP: Pairing Confirm (0x03) len 16
        Confim value: 2e3ff1ebeef1864b2460907f02e7945a
> HCI Event: Number of Completed Packets (0x13) plen 5    #209 [hci1] 12.806474
        Num handles: 1
        Handle: 1314 Address: DF:A9:FF:F6:B1:1A (OUI DF-A9-FF)
        Count: 1
        #208: len 21 (4 Kb/s)
        Latency: 41 msec (31-42 msec ~41 msec)
> ACL Data RX: Handle 1314 flags 0x02 dlen 21             #210 [hci1] 12.856589
      SMP: Pairing Confirm (0x03) len 16
        Confim value: 88789b7adeff3d4246173fe40eba4c25
< HCI Command: Host Number of Com.. (0x03|0x0035) plen 5  #211 [hci1] 12.864634
        Num handles: 1
        Handle: 1314 Address: DF:A9:FF:F6:B1:1A (OUI DF-A9-FF)
        Count: 1
< ACL Data TX: Handle 1314 flags 0x00 dlen 21             #212 [hci1] 12.864648
      SMP: Pairing Random (0x04) len 16
        Random value: 9d9e1ee31049e7f7e0c2476823e41736
> HCI Event: Number of Completed Packets (0x13) plen 5    #213 [hci1] 12.906604
        Num handles: 1
        Handle: 1314 Address: DF:A9:FF:F6:B1:1A (OUI DF-A9-FF)
        Count: 1
        #212: len 21 (4 Kb/s)
        Latency: 41 msec (31-42 msec ~41 msec)
> ACL Data RX: Handle 1314 flags 0x02 dlen 21             #214 [hci1] 13.156676
      SMP: Pairing Random (0x04) len 16
        Random value: f8ef961f29ee2378c04bff57ccca5ae2
< HCI Command: Host Number of Com.. (0x03|0x0035) plen 5  #215 [hci1] 13.164669
        Num handles: 1
        Handle: 1314 Address: DF:A9:FF:F6:B1:1A (OUI DF-A9-FF)
        Count: 1
< ACL Data TX: Handle 1314 flags 0x00 dlen 21             #216 [hci1] 13.164730
      SMP: Pairing Confirm (0x03) len 16
        Confim value: 25d4f9dc8444b6a19d55cb360418dbd0
> HCI Event: Number of Completed Packets (0x13) plen 5    #217 [hci1] 13.206391
        Num handles: 1
        Handle: 1314 Address: DF:A9:FF:F6:B1:1A (OUI DF-A9-FF)
        Count: 1
        #216: len 21 (4 Kb/s)
        Latency: 41 msec (31-42 msec ~41 msec)
> ACL Data RX: Handle 1314 flags 0x02 dlen 21             #218 [hci1] 13.256594
      SMP: Pairing Confirm (0x03) len 16
        Confim value: 1f9a7a922010ed0be6037625c74639c2
< HCI Command: Host Number of Com.. (0x03|0x0035) plen 5  #219 [hci1] 13.264385
        Num handles: 1
        Handle: 1314 Address: DF:A9:FF:F6:B1:1A (OUI DF-A9-FF)
        Count: 1
< ACL Data TX: Handle 1314 flags 0x00 dlen 21             #220 [hci1] 13.264404
      SMP: Pairing Random (0x04) len 16
        Random value: 81bafb7c3fcffc8b40d9b0b09bc4296b
> HCI Event: Number of Completed Packets (0x13) plen 5    #221 [hci1] 13.306563
        Num handles: 1
        Handle: 1314 Address: DF:A9:FF:F6:B1:1A (OUI DF-A9-FF)
        Count: 1
        #220: len 21 (4 Kb/s)
        Latency: 42 msec (31-42 msec ~41 msec)
> ACL Data RX: Handle 1314 flags 0x02 dlen 21             #222 [hci1] 13.556612
      SMP: Pairing Random (0x04) len 16
        Random value: 7b8a07c54a1e7106b5626a4459c4d832
< HCI Command: Host Number of Com.. (0x03|0x0035) plen 5  #223 [hci1] 13.565405
        Num handles: 1
        Handle: 1314 Address: DF:A9:FF:F6:B1:1A (OUI DF-A9-FF)
        Count: 1
< ACL Data TX: Handle 1314 flags 0x00 dlen 21             #224 [hci1] 13.565513
      SMP: Pairing DHKey Check (0x0d) len 16
        E: dd8f2ba19c91d43dbb032d4c969a106d
> HCI Event: Number of Completed Packets (0x13) plen 5    #225 [hci1] 13.606540
        Num handles: 1
        Handle: 1314 Address: DF:A9:FF:F6:B1:1A (OUI DF-A9-FF)
        Count: 1
        #224: len 21 (4 Kb/s)
        Latency: 41 msec (31-42 msec ~41 msec)
> ACL Data RX: Handle 1314 flags 0x02 dlen 21             #226 [hci1] 13.656705
      SMP: Pairing DHKey Check (0x0d) len 16
        E: 714fbe93d4e0d71d16f3dfc0033e545d
< HCI Command: LE Start Encryption (0x08|0x0019) plen 28  #227 [hci1] 13.665112
        Handle: 1314 Address: DF:A9:FF:F6:B1:1A (OUI DF-A9-FF)
        Random number: 0x0000000000000000
        Encrypted diversifier: 0x0000
        Long term key: 4b22bbbc457ce8d9d3ec5b3256e9b271
> HCI Event: Command Status (0x0f) plen 4                 #228 [hci1] 13.666053
      LE Start Encryption (0x08|0x0019) ncmd 1
        Status: Success (0x00)
< HCI Command: Host Number of Com.. (0x03|0x0035) plen 5  #229 [hci1] 13.684619
        Num handles: 1
        Handle: 1314 Address: DF:A9:FF:F6:B1:1A (OUI DF-A9-FF)
        Count: 1
> HCI Event: Encryption Change (0x08) plen 4              #230 [hci1] 14.008858
        Status: Success (0x00)
        Handle: 1314 Address: DF:A9:FF:F6:B1:1A (OUI DF-A9-FF)
        Encryption: Enabled with AES-CCM (0x01)
< HCI Command: Disconnect (0x01|0x0006) plen 3            #231 [hci1] 14.694803
        Handle: 1314 Address: DF:A9:FF:F6:B1:1A (OUI DF-A9-FF)
        Reason: Remote User Terminated Connection (0x13)
> HCI Event: Command Status (0x0f) plen 4                 #232 [hci1] 14.695559
      Disconnect (0x01|0x0006) ncmd 1
        Status: Success (0x00)
> HCI Event: Disconnect Complete (0x05) plen 4            #233 [hci1] 14.756344
        Status: Success (0x00)
        Handle: 1314 Address: DF:A9:FF:F6:B1:1A (OUI DF-A9-FF)
        Reason: Connection Terminated By Local Host (0x16)
< HCI Command: Reset (0x03|0x0003) plen 0                 #234 [hci1] 20.434502
> HCI Event: Command Complete (0x0e) plen 4               #235 [hci1] 20.435118
      Reset (0x03|0x0003) ncmd 1
        Status: Success (0x00)
@ USER Close: main                                    {0x0001} [hci1] 20.444426
= Close Index: 00:00:00:00:00:00                               [hci1] 20.448416
