Bluetooth monitor ver 5.72
btmon[2087078]: = Note: Linux version 6.14.0-36-generic (x86_64)                                                         0.479612
btmon[2087078]: = Note: Bluetooth subsystem version 2.22                                                                 0.479614
= New Index: 00:00:00:00:00:00 (Primary,UART,hci1)                                                                       0.479615
= New Index: 48:5F:99:8E:E0:64 (Primary,USB,hci0)                                                                        0.479615
= Open Index: 00:00:00:00:00:00                                                                                          0.993667
= Index Info: 00:00:00:00:00:00 (Nordic Semiconductor ASA)                                                               0.993682
zephyr.exe[2087080]: @ USER Open: main (privileged) version 2.22                                                {0x0001} 0.993693
zephyr.exe[2087080]: < HCI Command: Reset (0x03|0x0003) plen 0                                                        #1 0.994895
> HCI Event: Command Complete (0x0e) plen 4                                                                           #2 0.995557
      Reset (0x03|0x0003) ncmd 1
        Status: Success (0x00)
zephyr.exe[2087080]: < HCI Command: Read Local Supported Features (0x04|0x0003) plen 0                                #3 1.013289
> HCI Event: Command Complete (0x0e) plen 12                                                                          #4 1.013891
      Read Local Supported Features (0x04|0x0003) ncmd 1
        Status: Success (0x00)
        Features: 0x00 0x00 0x00 0x00 0x60 0x00 0x00 0x00
          BR/EDR Not Supported
          LE Supported (Controller)
zephyr.exe[2087080]: < HCI Command: Read Local Version Information (0x04|0x0001) plen 0                               #5 1.033100
> HCI Event: Command Complete (0x0e) plen 12                                                                          #6 1.033581
      Read Local Version Information (0x04|0x0001) ncmd 1
        Status: Success (0x00)
        HCI version: Reserved (0x0f) - Revision 12393 (0x3069)
        LMP version: Reserved (0x0f) - Subversion 12393 (0x3069)
        Manufacturer: Nordic Semiconductor ASA (89)
zephyr.exe[2087080]: < HCI Command: Read Local Supported Commands (0x04|0x0002) plen 0                                #7 1.053067
> HCI Event: Command Complete (0x0e) plen 68                                                                          #8 1.054101
      Read Local Supported Commands (0x04|0x0002) ncmd 1
        Status: Success (0x00)
        Commands: 119 entries
          Disconnect (Octet 0 - Bit 5)
          Read Remote Version Information (Octet 2 - Bit 7)
          Set Event Mask (Octet 5 - Bit 6)
          Reset (Octet 5 - Bit 7)
          Read Connection Accept Timeout (Octet 7 - Bit 2)
          Write Connection Accept Timeout (Octet 7 - Bit 3)
          Read Transmit Power Level (Octet 10 - Bit 2)
          Set Controller To Host Flow Control (Octet 10 - Bit 5)
          Host Buffer Size (Octet 10 - Bit 6)
          Host Number of Completed Packets (Octet 10 - Bit 7)
          Read Local Version Information (Octet 14 - Bit 3)
          Read Local Supported Features (Octet 14 - Bit 5)
          Read BD ADDR (Octet 15 - Bit 1)
          Read RSSI (Octet 15 - Bit 5)
          Set Event Mask Page 2 (Octet 22 - Bit 2)
          LE Set Event Mask (Octet 25 - Bit 0)
          LE Read Buffer Size (Octet 25 - Bit 1)
          LE Read Local Supported Features (Octet 25 - Bit 2)
          LE Set Random Address (Octet 25 - Bit 4)
          LE Set Advertising Parameters (Octet 25 - Bit 5)
          LE Read Advertising Channel TX Power (Octet 25 - Bit 6)
          LE Set Advertising Data (Octet 25 - Bit 7)
          LE Set Scan Response Data (Octet 26 - Bit 0)
          LE Set Advertise Enable (Octet 26 - Bit 1)
          LE Set Scan Parameters (Octet 26 - Bit 2)
          LE Set Scan Enable (Octet 26 - Bit 3)
          LE Create Connection (Octet 26 - Bit 4)
          LE Create Connection Cancel (Octet 26 - Bit 5)
          LE Read Accept List Size (Octet 26 - Bit 6)
          LE Clear Accept List (Octet 26 - Bit 7)
          LE Add Device To Accept List (Octet 27 - Bit 0)
          LE Remove Device From Accept List (Octet 27 - Bit 1)
          LE Connection Update (Octet 27 - Bit 2)
          LE Set Host Channel Classification (Octet 27 - Bit 3)
          LE Read Channel Map (Octet 27 - Bit 4)
          LE Read Remote Used Features (Octet 27 - Bit 5)
          LE Encrypt (Octet 27 - Bit 6)
          LE Rand (Octet 27 - Bit 7)
          LE Start Encryption (Octet 28 - Bit 0)
          LE Long Term Key Request Reply (Octet 28 - Bit 1)
          LE Long Term Key Request Neg Reply (Octet 28 - Bit 2)
          LE Read Supported States (Octet 28 - Bit 3)
          LE Receiver Test (Octet 28 - Bit 4)
          LE Transmitter Test (Octet 28 - Bit 5)
          LE Test End (Octet 28 - Bit 6)
          Read Authenticated Payload Timeout (Octet 32 - Bit 4)
          Write Authenticated Payload Timeout (Octet 32 - Bit 5)
          LE Set Data Length (Octet 33 - Bit 6)
          LE Read Suggested Default Data Length (Octet 33 - Bit 7)
          LE Write Suggested Default Data Length (Octet 34 - Bit 0)
          LE Add Device To Resolving List (Octet 34 - Bit 3)
          LE Remove Device From Resolving List (Octet 34 - Bit 4)
          LE Clear Resolving List (Octet 34 - Bit 5)
          LE Read Resolving List Size (Octet 34 - Bit 6)
          LE Set Address Resolution Enable (Octet 35 - Bit 1)
          LE Set Resolvable Private Address Timeout (Octet 35 - Bit 2)
          LE Read Maximum Data Length (Octet 35 - Bit 3)
          LE Read PHY (Octet 35 - Bit 4)
          LE Set Default PHY (Octet 35 - Bit 5)
          LE Set PHY (Octet 35 - Bit 6)
          LE Enhanced Receiver Test (Octet 35 - Bit 7)
          LE Enhanced Transmitter Test (Octet 36 - Bit 0)
          LE Set Advertising Set Random Address (Octet 36 - Bit 1)
          LE Set Extended Advertising Parameters (Octet 36 - Bit 2)
          LE Set Extended Advertising Data (Octet 36 - Bit 3)
          LE Set Extended Scan Response Data (Octet 36 - Bit 4)
          LE Set Extended Advertising Enable (Octet 36 - Bit 5)
          LE Read Maximum Advertising Data Length (Octet 36 - Bit 6)
          LE Read Number of Supported Advertising Sets (Octet 36 - Bit 7)
          LE Remove Advertising Set (Octet 37 - Bit 0)
          LE Clear Advertising Sets (Octet 37 - Bit 1)
          LE Set Periodic Advertising Parameters (Octet 37 - Bit 2)
          LE Set Periodic Advertising Data (Octet 37 - Bit 3)
          LE Set Periodic Advertising Enable (Octet 37 - Bit 4)
          LE Set Extended Scan Parameters (Octet 37 - Bit 5)
          LE Set Extended Scan Enable (Octet 37 - Bit 6)
          LE Extended Create Connection (Octet 37 - Bit 7)
          LE Periodic Advertising Create Sync (Octet 38 - Bit 0)
          LE Periodic Advertising Create Sync Cancel (Octet 38 - Bit 1)
          LE Periodic Advertising Terminate Sync (Octet 38 - Bit 2)
          LE Add Device To Periodic Advertiser List (Octet 38 - Bit 3)
          LE Remove Device From Periodic Advertiser List (Octet 38 - Bit 4)
          LE Clear Periodic Advertiser List (Octet 38 - Bit 5)
          LE Read Periodic Advertiser List Size (Octet 38 - Bit 6)
          LE Read Transmit Power (Octet 38 - Bit 7)
          LE Read RF Path Compensation (Octet 39 - Bit 0)
          LE Write RF Path Compensation (Octet 39 - Bit 1)
          LE Set Privacy Mode (Octet 39 - Bit 2)
          LE Periodic Advertising Receive Enable (Octet 40 - Bit 5)
          LE Periodic Advertising Sync Transfer (Octet 40 - Bit 6)
          LE Periodic Advertising Set Info Transfer (Octet 40 - Bit 7)
          LE Periodic Advertising Sync Transfer Parameters (Octet 41 - Bit 0)
          LE Set Default Periodic Advertisng Sync Transfer Parameters (Octet 41 - Bit 1)
          LE Read Buffer v2 (Octet 41 - Bit 5)
          LE Read ISO TX Sync (Octet 41 - Bit 6)
          LE Set Connected Isochronous Group Parameters (Octet 41 - Bit 7)
          LE Set Connected Isochronous Group Parameters Test (Octet 42 - Bit 0)
          LE Create Connected Isochronous Stream (Octet 42 - Bit 1)
          LE Remove Connected Isochronous Group (Octet 42 - Bit 2)
          LE Accept Connected Isochronous Stream Request (Octet 42 - Bit 3)
          LE Reject Connected Isochronous Stream Request (Octet 42 - Bit 4)
          LE Create Broadcast Isochronous Group (Octet 42 - Bit 5)
          LE Create Broadcast Isochronous Group Test (Octet 42 - Bit 6)
          LE Terminate Broadcast Isochronous Group (Octet 42 - Bit 7)
          LE Broadcast Isochronous Group Create Sync (Octet 43 - Bit 0)
          LE Broadcast Isochronous Group Terminate Sync (Octet 43 - Bit 1)
          LE Request Peer SCA (Octet 43 - Bit 2)
          LE Setup Isochronous Data Path (Octet 43 - Bit 3)
          LE Remove Isochronous Data Path (Octet 43 - Bit 4)
          LE Isochronous Transmit Test (Octet 43 - Bit 5)
          LE Isochronous Receive Test (Octet 43 - Bit 6)
          LE Isochronous Read Test Counters (Octet 43 - Bit 7)
          LE Isochronous Read Test Counters (Octet 44 - Bit 0)
          LE Set Host Feature (Octet 44 - Bit 1)
          Octet 44 - Bit 2 
          Octet 45 - Bit 6 
          Octet 46 - Bit 0 
          Octet 46 - Bit 1 
          Octet 46 - Bit 2 
zephyr.exe[2087080]: < HCI Command: Host Buffer Size (0x03|0x0033) plen 7                                             #9 1.073080
        ACL MTU: 255  ACL max packet: 16
        SCO MTU: 0    SCO max packet: 0
> HCI Event: Command Complete (0x0e) plen 4                                                                          #10 1.073581
      Host Buffer Size (0x03|0x0033) ncmd 1
        Status: Success (0x00)
zephyr.exe[2087080]: < HCI Command: Set Controller To Host Flow Control (0x03|0x0031) plen 1                         #11 1.093078
        Flow control: ACL Data Packets (0x01)
> HCI Event: Command Complete (0x0e) plen 4                                                                          #12 1.093561
      Set Controller To Host Flow Control (0x03|0x0031) ncmd 1
        Status: Success (0x00)
zephyr.exe[2087080]: < HCI Command: LE Read Local Supported Features (0x08|0x0003) plen 0                            #13 1.113057
> HCI Event: Command Complete (0x0e) plen 12                                                                         #14 1.113641
      LE Read Local Supported Features (0x08|0x0003) ncmd 1
        Status: Success (0x00)
        Features: 0xfd 0x79 0x00 0xf7 0x30 0x01 0x00 0x00
          LE Encryption
          Extended Reject Indication
          Peripheral-initiated Features Exchange
          LE Ping
          LE Data Packet Length Extension
          LL Privacy
          Extended Scanner Filter Policies
          LE 2M PHY
          LE Coded PHY
          LE Extended Advertising
          LE Periodic Advertising
          Channel Selection Algorithm #2
          Periodic Advertising Sync Transfer - Sender
          Periodic Advertising Sync Transfer - Recipient
          Sleep Clock Accuracy Updates
          Connected Isochronous Stream - Central
          Connected Isochronous Stream - Peripheral
          Isochronous Broadcaster
          Synchronized Receiver
          Periodic Advertising ADI support
          Connection Subrating
          Unknown features (0x0000010000000000)
zephyr.exe[2087080]: < HCI Command: LE Set Host Feature (0x08|0x0074) plen 2                                         #15 1.133079
        Bit Number: 32
          Connected Isochronous Stream (Host Support)
        Bit Value: 1
> HCI Event: Command Complete (0x0e) plen 4                                                                          #16 1.133520
      LE Set Host Feature (0x08|0x0074) ncmd 1
        Status: Success (0x00)
zephyr.exe[2087080]: < HCI Command: LE Read Buffer v2 (0x08|0x0060) plen 0                                           #17 1.153067
> HCI Event: Command Complete (0x0e) plen 10                                                                         #18 1.153621
      LE Read Buffer v2 (0x08|0x0060) ncmd 1
        Status: Success (0x00)
        ACL MTU: 27
        ACL max packet: 3
        ISO MTU: 318
        ISO max packet: 3
zephyr.exe[2087080]: < HCI Command: LE Read Maximum Advertising Data Length (0x08|0x003a) plen 0                     #19 1.173051
> HCI Event: Command Complete (0x0e) plen 6                                                                          #20 1.173556
      LE Read Maximum Advertising Data Length (0x08|0x003a) ncmd 1
        Status: Success (0x00)
        Max length: 1650
zephyr.exe[2087080]: < HCI Command: LE Read Supported States (0x08|0x001c) plen 0                                    #21 1.193071
> HCI Event: Command Complete (0x0e) plen 12                                                                         #22 1.193603
      LE Read Supported States (0x08|0x001c) ncmd 1
        Status: Success (0x00)
        States: 0x000003ff3e0306ff
          Non-connectable Advertising State
          Scannable Advertising State
          Connectable Advertising State
          High Duty Cycle Directed Advertising State
          Passive Scanning State
          Active Scanning State
          Initiating State
            and Connection State (Central Role)
          Connection State (Peripheral Role)
          Scannable Advertising State
            and Passive Scanning State
          Connectable Advertising State
            and Passive Scanning State
          Non-connectable Advertising State
            and Initiating State
          Scannable Advertising State
            and Initiating State
          Active Scanning State
            and Connection State (Central Role)
          Passive Scanning State
            and Connection State (Peripheral Role)
          Active Scanning State
            and Connection State (Peripheral Role)
          Initiating State
            and Connection State (Central Role)
            and Central Role & Central Role
          Low Duty Cycle Directed Advertising State
          Connectable Advertising State
            and Initiating State
            and Central Role & Peripheral Role
          High Duty Cycle Directed Advertising State
            and Initiating State
            and Central Role & Peripheral Role
          Low Duty Cycle Directed Advertising State
            and Initiating State
            and Central Role & Peripheral Role
          Connectable Advertising State
            and Connection State (Central Role)
            and Central Role & Peripheral Role
          High Duty Cycle Directed Advertising State
            and Connection State (Central Role)
            and Central Role & Peripheral Role
          Low Duty Cycle Directed Advertising State
            and Connection State (Central Role)
            and Central Role & Peripheral Role
          Connectable Advertising State
            and Connection State (Peripheral Role)
            and Central Role & Peripheral Role
          High Duty Cycle Directed Advertising State
            and Connection State (Peripheral Role)
            and Peripheral Role & Peripheral Role
          Low Duty Cycle Directed Advertising State
            and Connection State (Peripheral Role)
            and Peripheral Role & Peripheral Role
          Initiating State
            and Connection State (Peripheral Role)
            and Central Role & Peripheral Role
zephyr.exe[2087080]: < HCI Command: LE Read Maximum Data Length (0x08|0x002f) plen 0                                 #23 1.213072
> HCI Event: Command Complete (0x0e) plen 12                                                                         #24 1.213587
      LE Read Maximum Data Length (0x08|0x002f) ncmd 1
        Status: Success (0x00)
        Max TX octets: 251
        Max TX time: 2704
        Max RX octets: 251
        Max RX time: 2704
zephyr.exe[2087080]: < HCI Command: LE Write Suggested Default Data Length (0x08|0x0024) plen 4                      #25 1.233069
        TX octets: 251
        TX time: 2704
> HCI Event: Command Complete (0x0e) plen 4                                                                          #26 1.233585
      LE Write Suggested Default Data Length (0x08|0x0024) ncmd 1
        Status: Success (0x00)
zephyr.exe[2087080]: < HCI Command: LE Read Resolving List Size (0x08|0x002a) plen 0                                 #27 1.253097
> HCI Event: Command Complete (0x0e) plen 5                                                                          #28 1.253578
      LE Read Resolving List Size (0x08|0x002a) ncmd 1
        Status: Success (0x00)
        Size: 8
zephyr.exe[2087080]: < HCI Command: LE Set Event Mask (0x08|0x0001) plen 8                                           #29 1.273070
        Mask: 0x000002023f87fa5e
          LE Advertising Report
          LE Connection Update Complete
          LE Read Remote Used Features Complete
          LE Long Term Key Request
          LE Data Length Change
          LE Enhanced Connection Complete
          LE PHY Update Complete
          LE Extended Advertising Report
          LE Periodic Advertising Sync Established
          LE Periodic Advertising Report
          LE Periodic Advertising Sync Lost
          LE Extended Scan Timeout
          LE Extended Advertising Set Terminated
          LE Scan Request Received
          LE Periodic Advertising Sync Transfer Rvc
          LE CIS Established
          LE CIS Request
          LE Create BIG Complete
          LE Terminate BIG Complete
          LE BIG Sync Estabilished Complete
          LE BIG Sync Lost
          LE BIG Info Advertising Report
          Unknown mask (0x0000020000000000)
> HCI Event: Command Complete (0x0e) plen 4                                                                          #30 1.273578
      LE Set Event Mask (0x08|0x0001) ncmd 1
        Status: Success (0x00)
zephyr.exe[2087080]: < HCI Command: Set Event Mask (0x03|0x0001) plen 8                                              #31 1.292988
        Mask: 0x2000800002008890
          Disconnection Complete
          Encryption Change
          Read Remote Version Information Complete
          Hardware Error
          Data Buffer Overflow
          Encryption Key Refresh Complete
          LE Meta
> HCI Event: Command Complete (0x0e) plen 4                                                                          #32 1.293578
      Set Event Mask (0x03|0x0001) ncmd 1
        Status: Success (0x00)
zephyr.exe[2087080]: < HCI Command: Read BD ADDR (0x04|0x0009) plen 0                                                #33 1.313071
> HCI Event: Command Complete (0x0e) plen 10                                                                         #34 1.313566
      Read BD ADDR (0x04|0x0009) ncmd 1
        Status: Success (0x00)
        Address: 00:00:00:00:00:00 (OUI 00-00-00)
zephyr.exe[2087080]: < HCI Command: LE Set Random Address (0x08|0x0005) plen 6                                       #35 1.333083
        Address: D5:B6:CC:31:DB:3B (Static)
> HCI Event: Command Complete (0x0e) plen 4                                                                          #36 1.333626
      LE Set Random Address (0x08|0x0005) ncmd 1
        Status: Success (0x00)
zephyr.exe[2087080]: < HCI Command: LE Set Extended Advertising Parameters (0x08|0x0036) plen 25                     #37 3.773582
        Handle: 0x00
        Properties: 0x0013
          Connectable
          Scannable
          Use legacy advertising PDUs: ADV_IND
        Min advertising interval: 100.000 msec (0x00a0)
        Max advertising interval: 150.000 msec (0x00f0)
        Channel map: 37, 38, 39 (0x07)
        Own address type: Random (0x01)
        Peer address type: Public (0x00)
        Peer address: 00:00:00:00:00:00 (OUI 00-00-00)
        Filter policy: Allow Scan Request from Any, Allow Connect Request from Any (0x00)
        TX power: Host has no preference (0x7f)
        Primary PHY: LE 1M (0x01)
        Secondary max skip: 0x00
        Secondary PHY: LE 1M (0x01)
        SID: 0x00
        Scan request notifications: Disabled (0x00)
> HCI Event: Command Complete (0x0e) plen 5                                                                          #38 3.774435
      LE Set Extended Advertising Parameters (0x08|0x0036) ncmd 1
        Status: Success (0x00)
        TX power (selected): 0 dbm (0x00)
zephyr.exe[2087080]: < HCI Command: LE Set Advertising Set Random Address (0x08|0x0035) plen 7                       #39 3.793106
        Advertising handle: 0x00
        Advertising random address: D5:B6:CC:31:DB:3B (Static)
> HCI Event: Command Complete (0x0e) plen 4                                                                          #40 3.793665
      LE Set Advertising Set Random Address (0x08|0x0035) ncmd 1
        Status: Success (0x00)
zephyr.exe[2087080]: < HCI Command: LE Set Extended Advertising Data (0x08|0x0037) plen 22                           #41 3.813092
        Handle: 0x00
        Operation: Complete extended advertising data (0x03)
        Fragment preference: Minimize fragmentation (0x01)
        Data length: 0x12
        Flags: 0x06
          LE General Discoverable Mode
          BR/EDR Not Supported
        Name (complete): Tester_F6B11A
> HCI Event: Command Complete (0x0e) plen 4                                                                          #42 3.813850
      LE Set Extended Advertising Data (0x08|0x0037) ncmd 1
        Status: Success (0x00)
zephyr.exe[2087080]: < HCI Command: LE Set Extended Scan Response Data (0x08|0x0038) plen 4                          #43 3.833079
        Handle: 0x00
        Operation: Complete scan response data (0x03)
        Fragment preference: Minimize fragmentation (0x01)
        Data length: 0x00
> HCI Event: Command Complete (0x0e) plen 4                                                                          #44 3.833596
      LE Set Extended Scan Response Data (0x08|0x0038) ncmd 1
        Status: Success (0x00)
zephyr.exe[2087080]: < HCI Command: LE Set Extended Advertising Enable (0x08|0x0039) plen 6                          #45 3.853054
        Extended advertising: Enabled (0x01)
        Number of sets: 1 (0x01)
        Entry 0
          Handle: 0x00
          Duration: 0 ms (0x00)
          Max ext adv events: 0
> HCI Event: Command Complete (0x0e) plen 4                                                                          #46 3.853590
      LE Set Extended Advertising Enable (0x08|0x0039) ncmd 1
        Status: Success (0x00)
> HCI Event: LE Meta Event (0x3e) plen 31                                                                            #47 3.969439
      LE Enhanced Connection Complete (0x0a)
        Status: Success (0x00)
        Handle: 1245
        Role: Peripheral (0x01)
        Peer address type: Public (0x00)
        Peer address: DF:A9:FF:F6:B1:1A (OUI DF-A9-FF)
        Local resolvable private address: 00:00:00:00:00:00 (Non-Resolvable)
        Peer resolvable private address: 00:00:00:00:00:00 (Non-Resolvable)
        Connection interval: 87.50 msec (0x0046)
        Connection latency: 0 (0x0000)
        Supervision timeout: 25120 msec (0x09d0)
        Central clock accuracy: 0x01
> HCI Event: LE Meta Event (0x3e) plen 6                                                                             #48 3.969623
      LE Advertising Set Terminated (0x12)
        Status: Success (0x00)
        Handle: 0
        Connection handle: 1245
        Number of completed extended advertising events: 0
zephyr.exe[2087080]: < HCI Command: LE Read Remote Used Features (0x08|0x0016) plen 2                                #49 3.974204
        Handle: 1245 Address: DF:A9:FF:F6:B1:1A (OUI DF-A9-FF)
zephyr.exe[2087080]: < ACL Data TX: Handle 1245 flags 0x00 dlen 7                                                    #50 3.974231
      ATT: Exchange MTU Request (0x02) len 2
        Client RX MTU: 251
> HCI Event: Command Status (0x0f) plen 4                                                                            #51 3.974800
      LE Read Remote Used Features (0x08|0x0016) ncmd 1
        Status: Success (0x00)
> HCI Event: Number of Completed Packets (0x13) plen 5                                                               #52 4.145359
        Num handles: 1
        Handle: 1245 Address: DF:A9:FF:F6:B1:1A (OUI DF-A9-FF)
        Count: 1
        #50: len 7 (0 Kb/s)
        Latency: 171 msec (171-171 msec ~171 msec)
> HCI Event: LE Meta Event (0x3e) plen 12                                                                            #53 4.233281
      LE Read Remote Used Features (0x04)
        Status: Success (0x00)
        Handle: 1245 Address: DF:A9:FF:F6:B1:1A (OUI DF-A9-FF)
        Features: 0x2d 0x49 0x00 0xf7 0x67 0xd8 0x00 0x00
          LE Encryption
          Extended Reject Indication
          Peripheral-initiated Features Exchange
          LE Data Packet Length Extension
          LE 2M PHY
          LE Coded PHY
          Channel Selection Algorithm #2
          Periodic Advertising Sync Transfer - Sender
          Periodic Advertising Sync Transfer - Recipient
          Sleep Clock Accuracy Updates
          Connected Isochronous Stream - Central
          Connected Isochronous Stream - Peripheral
          Isochronous Broadcaster
          Synchronized Receiver
          Connected Isochronous Stream (Host Support)
          LE Power Control Request
          LE Power Control Request
          Connection Subrating
          Connection Subrating (Host Support)
          Unknown features (0x0000d80000000000)
> ACL Data RX: Handle 1245 flags 0x02 dlen 11                                                                        #54 6.683080
      SMP: Pairing Request (0x01) len 6
        IO capability: KeyboardDisplay (0x04)
        OOB data: Authentication data not present (0x00)
        Authentication requirement: Bonding, No MITM, SC, No Keypresses (0x09)
        Max encryption key size: 16
        Initiator key distribution: EncKey IdKey (0x03)
        Responder key distribution: EncKey IdKey Sign (0x07)
> ACL Data RX: Handle 1245 flags 0x02 dlen 7                                                                         #55 6.683521
      ATT: Exchange MTU Response (0x03) len 2
        Server RX MTU: 23
zephyr.exe[2087080]: < HCI Command: Host Number of Completed Packets (0x03|0x0035) plen 5                            #56 6.693137
        Num handles: 1
        Handle: 1245 Address: DF:A9:FF:F6:B1:1A (OUI DF-A9-FF)
        Count: 1
zephyr.exe[2087080]: < ACL Data TX: Handle 1245 flags 0x00 dlen 11                                                   #57 6.693180
      SMP: Pairing Response (0x02) len 6
        IO capability: DisplayOnly (0x00)
        OOB data: Authentication data not present (0x00)
        Authentication requirement: Bonding, No MITM, SC, No Keypresses (0x09)
        Max encryption key size: 16
        Initiator key distribution: IdKey (0x02)
        Responder key distribution: <none> (0x00)
zephyr.exe[2087080]: < HCI Command: Host Number of Completed Packets (0x03|0x0035) plen 5                            #58 6.693297
        Num handles: 1
        Handle: 1245 Address: DF:A9:FF:F6:B1:1A (OUI DF-A9-FF)
        Count: 1
> HCI Event: Number of Completed Packets (0x13) plen 5                                                               #59 6.858055
        Num handles: 1
        Handle: 1245 Address: DF:A9:FF:F6:B1:1A (OUI DF-A9-FF)
        Count: 1
        #57: len 11 (0 Kb/s)
        Latency: 164 msec (164-171 msec ~168 msec)
> ACL Data RX: Handle 1245 flags 0x02 dlen 27                                                                        #60 6.858465
> ACL Data RX: Handle 1245 flags 0x01 dlen 27                                                                        #61 6.858870
> ACL Data RX: Handle 1245 flags 0x01 dlen 15                                                                        #62 6.859395
      SMP: Pairing Public Key (0x0c) len 64
        X: 83cabd4bcaf27436df88a2542f6588a8421a9db47aab59043aaee669afc0e66f
        Y: ab659df00c9c2ceaba0df7ad4156bb6b3f1b1632e28ffb1535cf784bc3ca4ca6
zephyr.exe[2087080]: < HCI Command: Host Number of Completed Packets (0x03|0x0035) plen 5                            #63 6.873882
        Num handles: 1
        Handle: 1245 Address: DF:A9:FF:F6:B1:1A (OUI DF-A9-FF)
        Count: 1
zephyr.exe[2087080]: < HCI Command: Host Number of Completed Packets (0x03|0x0035) plen 5                            #64 6.874061
        Num handles: 1
        Handle: 1245 Address: DF:A9:FF:F6:B1:1A (OUI DF-A9-FF)
        Count: 1
zephyr.exe[2087080]: < HCI Command: Host Number of Completed Packets (0x03|0x0035) plen 5                            #65 6.874410
        Num handles: 1
        Handle: 1245 Address: DF:A9:FF:F6:B1:1A (OUI DF-A9-FF)
        Count: 1
zephyr.exe[2087080]: < ACL Data TX: Handle 1245 flags 0x00 dlen 27                                                   #66 6.874498
zephyr.exe[2087080]: < ACL Data TX: Handle 1245 flags 0x01 dlen 27                                                   #67 6.874508
zephyr.exe[2087080]: < ACL Data TX: Handle 1245 flags 0x01 dlen 15                                                   #68 6.874528
      SMP: Pairing Public Key (0x0c) len 64
        X: 98308440221e2d910f0e54b71e7ec652857aa9b5a0dc65028824cc19db1226e9
        Y: 67a4816bcb62efb21701e31fdb27561a6217575fb007a8bbdabe7e28b6f68482
> HCI Event: Number of Completed Packets (0x13) plen 5                                                               #69 6.945954
        Num handles: 1
        Handle: 1245 Address: DF:A9:FF:F6:B1:1A (OUI DF-A9-FF)
        Count: 1
        #66: len 27 (3 Kb/s)
        Latency: 71 msec (71-171 msec ~119 msec)
> HCI Event: Number of Completed Packets (0x13) plen 5                                                               #70 6.946610
        Num handles: 1
        Handle: 1245 Address: DF:A9:FF:F6:B1:1A (OUI DF-A9-FF)
        Count: 1
        #67: len 27 (3 Kb/s)
        Latency: 72 msec (71-171 msec ~95 msec)
zephyr.exe[2087080]: < ACL Data TX: Handle 1245 flags 0x00 dlen 21                                                   #71 6.953467
      SMP: Pairing Confirm (0x03) len 16
        Confim value: fe5825464c825d6ec66360b864c85dd9
> HCI Event: Number of Completed Packets (0x13) plen 5                                                               #72 7.032750
        Num handles: 1
        Handle: 1245 Address: DF:A9:FF:F6:B1:1A (OUI DF-A9-FF)
        Count: 1
        #68: len 15 (0 Kb/s)
        Latency: 158 msec (71-171 msec ~127 msec)
> HCI Event: Number of Completed Packets (0x13) plen 5                                                               #73 7.120544
        Num handles: 1
        Handle: 1245 Address: DF:A9:FF:F6:B1:1A (OUI DF-A9-FF)
        Count: 1
        #71: len 21 (1 Kb/s)
        Latency: 167 msec (71-171 msec ~147 msec)
> ACL Data RX: Handle 1245 flags 0x02 dlen 21                                                                        #74 7.120894
      SMP: Pairing Random (0x04) len 16
        Random value: 2a220fbba56ec1870000000000000000
zephyr.exe[2087080]: < HCI Command: Host Number of Completed Packets (0x03|0x0035) plen 5                            #75 7.133757
        Num handles: 1
        Handle: 1245 Address: DF:A9:FF:F6:B1:1A (OUI DF-A9-FF)
        Count: 1
zephyr.exe[2087080]: < ACL Data TX: Handle 1245 flags 0x00 dlen 21                                                   #76 7.133908
      SMP: Pairing Random (0x04) len 16
        Random value: 8e6108f966a694cbe26df70bb96773e6
> HCI Event: Number of Completed Packets (0x13) plen 5                                                               #77 7.295293
        Num handles: 1
        Handle: 1245 Address: DF:A9:FF:F6:B1:1A (OUI DF-A9-FF)
        Count: 1
        #76: len 21 (1 Kb/s)
        Latency: 161 msec (71-171 msec ~154 msec)
> ACL Data RX: Handle 1245 flags 0x02 dlen 21                                                                        #78 7.470650
      SMP: Pairing DHKey Check (0x0d) len 16
        E: 9c1e76961181fc54b50477518c915f3d
zephyr.exe[2087080]: < HCI Command: Host Number of Completed Packets (0x03|0x0035) plen 5                            #79 7.473883
        Num handles: 1
        Handle: 1245 Address: DF:A9:FF:F6:B1:1A (OUI DF-A9-FF)
        Count: 1
zephyr.exe[2087080]: < ACL Data TX: Handle 1245 flags 0x00 dlen 21                                                   #80 7.474051
      SMP: Pairing DHKey Check (0x0d) len 16
        E: c33d24e904c1d49f5727b986e0b6664e
> HCI Event: Number of Completed Packets (0x13) plen 5                                                               #81 7.645291
        Num handles: 1
        Handle: 1245 Address: DF:A9:FF:F6:B1:1A (OUI DF-A9-FF)
        Count: 1
        #80: len 21 (0 Kb/s)
        Latency: 171 msec (71-171 msec ~162 msec)
> HCI Event: LE Meta Event (0x3e) plen 13                                                                            #82 7.733403
      LE Long Term Key Request (0x05)
        Handle: 1245 Address: DF:A9:FF:F6:B1:1A (OUI DF-A9-FF)
        Random number: 0x0000000000000000
        Encrypted diversifier: 0x0000
zephyr.exe[2087080]: < HCI Command: LE Long Term Key Request Reply (0x08|0x001a) plen 18                             #83 7.753498
        Handle: 1245 Address: DF:A9:FF:F6:B1:1A (OUI DF-A9-FF)
        Long term key: 99449b88cba0bfc52ec0fa0615b7946c
> HCI Event: Command Complete (0x0e) plen 6                                                                          #84 7.754234
      LE Long Term Key Request Reply (0x08|0x001a) ncmd 1
        Status: Success (0x00)
        Handle: 1245 Address: DF:A9:FF:F6:B1:1A (OUI DF-A9-FF)
> HCI Event: Encryption Change (0x08) plen 4                                                                         #85 8.170551
        Status: Success (0x00)
        Handle: 1245 Address: DF:A9:FF:F6:B1:1A (OUI DF-A9-FF)
        Encryption: Enabled with AES-CCM (0x01)
> ACL Data RX: Handle 1245 flags 0x02 dlen 21                                                                        #86 8.258148
      SMP: Identity Information (0x08) len 16
        Identity resolving key: 5266429655983d2e2d6fdc28f821ca93
zephyr.exe[2087080]: < HCI Command: Host Number of Completed Packets (0x03|0x0035) plen 5                            #87 8.283966
        Num handles: 1
        Handle: 1245 Address: DF:A9:FF:F6:B1:1A (OUI DF-A9-FF)
        Count: 1
> ACL Data RX: Handle 1245 flags 0x02 dlen 12                                                                        #88 8.433045
      SMP: Identity Address Information (0x09) len 7
        Address: DF:A9:FF:F6:B1:1A (OUI DF-A9-FF)
zephyr.exe[2087080]: < HCI Command: LE Add Device To Resolving List (0x08|0x0027) plen 39                            #89 8.433834
        Address type: Public (0x00)
        Address: DF:A9:FF:F6:B1:1A (OUI DF-A9-FF)
        Peer identity resolving key: 5266429655983d2e2d6fdc28f821ca93
        Local identity resolving key: 00000000000000000000000000000000
> HCI Event: Command Complete (0x0e) plen 4                                                                          #90 8.434808
      LE Add Device To Resolving List (0x08|0x0027) ncmd 1
        Status: Success (0x00)
zephyr.exe[2087080]: < HCI Command: LE Set Privacy Mode (0x08|0x004e) plen 8                                         #91 8.453503
        Peer Identity address type: Public (0x00)
        Peer Identity address: DF:A9:FF:F6:B1:1A (OUI DF-A9-FF)
        Privacy Mode: Use Device Privacy (0x01)
> HCI Event: Command Complete (0x0e) plen 4                                                                          #92 8.454093
      LE Set Privacy Mode (0x08|0x004e) ncmd 1
        Status: Success (0x00)
zephyr.exe[2087080]: < HCI Command: LE Set Address Resolution Enable (0x08|0x002d) plen 1                            #93 8.473523
        Address resolution: Enabled (0x01)
> HCI Event: Command Complete (0x0e) plen 4                                                                          #94 8.474167
      LE Set Address Resolution Enable (0x08|0x002d) ncmd 1
        Status: Success (0x00)
zephyr.exe[2087080]: < HCI Command: Host Number of Completed Packets (0x03|0x0035) plen 5                            #95 8.493459
        Num handles: 1
        Handle: 1245 Address: DF:A9:FF:F6:B1:1A (OUI DF-A9-FF)
        Count: 1
> ACL Data RX: Handle 1245 flags 0x02 dlen 13                                                                        #96 8.520540
      ATT: Find By Type Value Request (0x06) len 8
        Handle range: 0x0001-0xffff
        Attribute type: Primary Service (0x2800)
          UUID: Generic Media Control (0x1849)
zephyr.exe[2087080]: < HCI Command: Host Number of Completed Packets (0x03|0x0035) plen 5                            #97 8.533892
        Num handles: 1
        Handle: 1245 Address: DF:A9:FF:F6:B1:1A (OUI DF-A9-FF)
        Count: 1
zephyr.exe[2087080]: < ACL Data TX: Handle 1245 flags 0x00 dlen 9                                                    #98 8.534098
      ATT: Find By Type Value Response (0x07) len 4
        Handle range: 0x0037-0x0075
> HCI Event: Number of Completed Packets (0x13) plen 5                                                               #99 8.695551
        Num handles: 1
        Handle: 1245 Address: DF:A9:FF:F6:B1:1A (OUI DF-A9-FF)
        Count: 1
        #98: len 9 (0 Kb/s)
        Latency: 161 msec (71-171 msec ~162 msec)
> ACL Data RX: Handle 1245 flags 0x02 dlen 13                                                                       #100 8.695679
      ATT: Find By Type Value Request (0x06) len 8
        Handle range: 0x0076-0xffff
        Attribute type: Primary Service (0x2800)
          UUID: Generic Media Control (0x1849)
zephyr.exe[2087080]: < HCI Command: Host Number of Completed Packets (0x03|0x0035) plen 5                           #101 8.713861
        Num handles: 1
        Handle: 1245 Address: DF:A9:FF:F6:B1:1A (OUI DF-A9-FF)
        Count: 1
zephyr.exe[2087080]: < ACL Data TX: Handle 1245 flags 0x00 dlen 9                                                   #102 8.713984
      ATT: Error Response (0x01) len 4
        Find By Type Value Request (0x06)
        Handle: 0x0076
        Error: Attribute Not Found (0x0a)
> HCI Event: Number of Completed Packets (0x13) plen 5                                                              #103 8.870436
        Num handles: 1
        Handle: 1245 Address: DF:A9:FF:F6:B1:1A (OUI DF-A9-FF)
        Count: 1
        #102: len 9 (0 Kb/s)
        Latency: 156 msec (71-171 msec ~159 msec)
> ACL Data RX: Handle 1245 flags 0x02 dlen 11                                                                       #104 8.870645
      ATT: Read By Type Request (0x08) len 6
        Handle range: 0x0037-0x0075
        Attribute type: Characteristic (0x2803)
zephyr.exe[2087080]: < HCI Command: Host Number of Completed Packets (0x03|0x0035) plen 5                           #105 8.873715
        Num handles: 1
        Handle: 1245 Address: DF:A9:FF:F6:B1:1A (OUI DF-A9-FF)
        Count: 1
zephyr.exe[2087080]: < ACL Data TX: Handle 1245 flags 0x00 dlen 20                                                  #106 8.873842
      ATT: Read By Type Response (0x09) len 15
        Attribute data length: 7
        Attribute data list: 2 entries
        Handle: 0x0039
        Value: 123a00932b
            Properties: 0x12
              Read (0x02)
              Notify (0x10)
            Value Handle: 0x003a
            Value UUID: Media Player Name (0x2b93)
        Handle: 0x003c
        Value: 023d00942b
            Properties: 0x02
              Read (0x02)
            Value Handle: 0x003d
            Value UUID: Media Player Icon Object ID (0x2b94)
> HCI Event: Number of Completed Packets (0x13) plen 5                                                              #107 9.045404
        Num handles: 1
        Handle: 1245 Address: DF:A9:FF:F6:B1:1A (OUI DF-A9-FF)
        Count: 1
        #106: len 20 (0 Kb/s)
        Latency: 171 msec (71-171 msec ~165 msec)
> ACL Data RX: Handle 1245 flags 0x02 dlen 11                                                                       #108 9.045649
      ATT: Read By Type Request (0x08) len 6
        Handle range: 0x003d-0x0075
        Attribute type: Characteristic (0x2803)
zephyr.exe[2087080]: < HCI Command: Host Number of Completed Packets (0x03|0x0035) plen 5                           #109 9.053765
        Num handles: 1
        Handle: 1245 Address: DF:A9:FF:F6:B1:1A (OUI DF-A9-FF)
        Count: 1
zephyr.exe[2087080]: < ACL Data TX: Handle 1245 flags 0x00 dlen 20                                                  #110 9.053874
      ATT: Read By Type Response (0x09) len 15
        Attribute data length: 7
        Attribute data list: 2 entries
        Handle: 0x003e
        Value: 023f00952b
            Properties: 0x02
              Read (0x02)
            Value Handle: 0x003f
            Value UUID: Media Player Icon URL (0x2b95)
        Handle: 0x0040
        Value: 104100962b
            Properties: 0x10
              Notify (0x10)
            Value Handle: 0x0041
            Value UUID: Track Changed (0x2b96)
> HCI Event: Number of Completed Packets (0x13) plen 5                                                              #111 9.220483
        Num handles: 1
        Handle: 1245 Address: DF:A9:FF:F6:B1:1A (OUI DF-A9-FF)
        Count: 1
        #110: len 20 (0 Kb/s)
        Latency: 166 msec (71-171 msec ~166 msec)
> ACL Data RX: Handle 1245 flags 0x02 dlen 11                                                                       #112 9.220748
      ATT: Read By Type Request (0x08) len 6
        Handle range: 0x0041-0x0075
        Attribute type: Characteristic (0x2803)
zephyr.exe[2087080]: < HCI Command: Host Number of Completed Packets (0x03|0x0035) plen 5                           #113 9.233794
        Num handles: 1
        Handle: 1245 Address: DF:A9:FF:F6:B1:1A (OUI DF-A9-FF)
        Count: 1
zephyr.exe[2087080]: < ACL Data TX: Handle 1245 flags 0x00 dlen 20                                                  #114 9.233958
      ATT: Read By Type Response (0x09) len 15
        Attribute data length: 7
        Attribute data list: 2 entries
        Handle: 0x0043
        Value: 124400972b
            Properties: 0x12
              Read (0x02)
              Notify (0x10)
            Value Handle: 0x0044
            Value UUID: Track Title (0x2b97)
        Handle: 0x0046
        Value: 124700982b
            Properties: 0x12
              Read (0x02)
              Notify (0x10)
            Value Handle: 0x0047
            Value UUID: Track Duration (0x2b98)
> HCI Event: Number of Completed Packets (0x13) plen 5                                                              #115 9.395406
        Num handles: 1
        Handle: 1245 Address: DF:A9:FF:F6:B1:1A (OUI DF-A9-FF)
        Count: 1
        #114: len 20 (0 Kb/s)
        Latency: 161 msec (71-171 msec ~163 msec)
> ACL Data RX: Handle 1245 flags 0x02 dlen 11                                                                       #116 9.395685
      ATT: Read By Type Request (0x08) len 6
        Handle range: 0x0047-0x0075
        Attribute type: Characteristic (0x2803)
zephyr.exe[2087080]: < HCI Command: Host Number of Completed Packets (0x03|0x0035) plen 5                           #117 9.413868
        Num handles: 1
        Handle: 1245 Address: DF:A9:FF:F6:B1:1A (OUI DF-A9-FF)
        Count: 1
zephyr.exe[2087080]: < ACL Data TX: Handle 1245 flags 0x00 dlen 20                                                  #118 9.413996
      ATT: Read By Type Response (0x09) len 15
        Attribute data length: 7
        Attribute data list: 2 entries
        Handle: 0x0049
        Value: 1e4a00992b
            Properties: 0x1e
              Read (0x02)
              Write Without Response (0x04)
              Write (0x08)
              Notify (0x10)
            Value Handle: 0x004a
            Value UUID: Track Position (0x2b99)
        Handle: 0x004c
        Value: 1e4d009a2b
            Properties: 0x1e
              Read (0x02)
              Write Without Response (0x04)
              Write (0x08)
              Notify (0x10)
            Value Handle: 0x004d
            Value UUID: Playback Speed (0x2b9a)
> HCI Event: Number of Completed Packets (0x13) plen 5                                                              #119 9.570348
        Num handles: 1
        Handle: 1245 Address: DF:A9:FF:F6:B1:1A (OUI DF-A9-FF)
        Count: 1
        #118: len 20 (1 Kb/s)
        Latency: 156 msec (71-171 msec ~160 msec)
> ACL Data RX: Handle 1245 flags 0x02 dlen 11                                                                       #120 9.570683
      ATT: Read By Type Request (0x08) len 6
        Handle range: 0x004d-0x0075
        Attribute type: Characteristic (0x2803)
zephyr.exe[2087080]: < HCI Command: Host Number of Completed Packets (0x03|0x0035) plen 5                           #121 9.573806
        Num handles: 1
        Handle: 1245 Address: DF:A9:FF:F6:B1:1A (OUI DF-A9-FF)
        Count: 1
zephyr.exe[2087080]: < ACL Data TX: Handle 1245 flags 0x00 dlen 20                                                  #122 9.573921
      ATT: Read By Type Response (0x09) len 15
        Attribute data length: 7
        Attribute data list: 2 entries
        Handle: 0x004f
        Value: 1250009b2b
            Properties: 0x12
              Read (0x02)
              Notify (0x10)
            Value Handle: 0x0050
            Value UUID: Seeking Speed (0x2b9b)
        Handle: 0x0052
        Value: 0253009c2b
            Properties: 0x02
              Read (0x02)
            Value Handle: 0x0053
            Value UUID: Current Track Segments Object ID (0x2b9c)
> HCI Event: Number of Completed Packets (0x13) plen 5                                                              #123 9.745383
        Num handles: 1
        Handle: 1245 Address: DF:A9:FF:F6:B1:1A (OUI DF-A9-FF)
        Count: 1
        #122: len 20 (0 Kb/s)
        Latency: 171 msec (71-171 msec ~165 msec)
> ACL Data RX: Handle 1245 flags 0x02 dlen 11                                                                       #124 9.745686
      ATT: Read By Type Request (0x08) len 6
        Handle range: 0x0053-0x0075
        Attribute type: Characteristic (0x2803)
zephyr.exe[2087080]: < HCI Command: Host Number of Completed Packets (0x03|0x0035) plen 5                           #125 9.753918
        Num handles: 1
        Handle: 1245 Address: DF:A9:FF:F6:B1:1A (OUI DF-A9-FF)
        Count: 1
zephyr.exe[2087080]: < ACL Data TX: Handle 1245 flags 0x00 dlen 20                                                  #126 9.754036
      ATT: Read By Type Response (0x09) len 15
        Attribute data length: 7
        Attribute data list: 2 entries
        Handle: 0x0054
        Value: 1e55009d2b
            Properties: 0x1e
              Read (0x02)
              Write Without Response (0x04)
              Write (0x08)
              Notify (0x10)
            Value Handle: 0x0055
            Value UUID: Current Track Object ID (0x2b9d)
        Handle: 0x0057
        Value: 1e58009e2b
            Properties: 0x1e
              Read (0x02)
              Write Without Response (0x04)
              Write (0x08)
              Notify (0x10)
            Value Handle: 0x0058
            Value UUID: Next Track Object ID (0x2b9e)
> HCI Event: Number of Completed Packets (0x13) plen 5                                                              #127 9.920346
        Num handles: 1
        Handle: 1245 Address: DF:A9:FF:F6:B1:1A (OUI DF-A9-FF)
        Count: 1
        #126: len 20 (0 Kb/s)
        Latency: 166 msec (71-171 msec ~166 msec)
> ACL Data RX: Handle 1245 flags 0x02 dlen 11                                                                       #128 9.920643
      ATT: Read By Type Request (0x08) len 6
        Handle range: 0x0058-0x0075
        Attribute type: Characteristic (0x2803)
zephyr.exe[2087080]: < HCI Command: Host Number of Completed Packets (0x03|0x0035) plen 5                           #129 9.933793
        Num handles: 1
        Handle: 1245 Address: DF:A9:FF:F6:B1:1A (OUI DF-A9-FF)
        Count: 1
zephyr.exe[2087080]: < ACL Data TX: Handle 1245 flags 0x00 dlen 20                                                  #130 9.933893
      ATT: Read By Type Response (0x09) len 15
        Attribute data length: 7
        Attribute data list: 2 entries
        Handle: 0x005a
        Value: 125b009f2b
            Properties: 0x12
              Read (0x02)
              Notify (0x10)
            Value Handle: 0x005b
            Value UUID: Parent Group Object ID (0x2b9f)
        Handle: 0x005d
        Value: 1e5e00a02b
            Properties: 0x1e
              Read (0x02)
              Write Without Response (0x04)
              Write (0x08)
              Notify (0x10)
            Value Handle: 0x005e
            Value UUID: Current Group Object ID (0x2ba0)
> HCI Event: Number of Completed Packets (0x13) plen 5                                                             #131 10.095467
        Num handles: 1
        Handle: 1245 Address: DF:A9:FF:F6:B1:1A (OUI DF-A9-FF)
        Count: 1
        #130: len 20 (0 Kb/s)
        Latency: 161 msec (71-171 msec ~163 msec)
> ACL Data RX: Handle 1245 flags 0x02 dlen 11                                                                      #132 10.095694
      ATT: Read By Type Request (0x08) len 6
        Handle range: 0x005e-0x0075
        Attribute type: Characteristic (0x2803)
zephyr.exe[2087080]: < HCI Command: Host Number of Completed Packets (0x03|0x0035) plen 5                          #133 10.113861
        Num handles: 1
        Handle: 1245 Address: DF:A9:FF:F6:B1:1A (OUI DF-A9-FF)
        Count: 1
zephyr.exe[2087080]: < ACL Data TX: Handle 1245 flags 0x00 dlen 20                                                 #134 10.113968
      ATT: Read By Type Response (0x09) len 15
        Attribute data length: 7
        Attribute data list: 2 entries
        Handle: 0x0060
        Value: 1e6100a12b
            Properties: 0x1e
              Read (0x02)
              Write Without Response (0x04)
              Write (0x08)
              Notify (0x10)
            Value Handle: 0x0061
            Value UUID: Playing Order (0x2ba1)
        Handle: 0x0063
        Value: 026400a22b
            Properties: 0x02
              Read (0x02)
            Value Handle: 0x0064
            Value UUID: Playing Orders Supported (0x2ba2)
> HCI Event: Number of Completed Packets (0x13) plen 5                                                             #135 10.270414
        Num handles: 1
        Handle: 1245 Address: DF:A9:FF:F6:B1:1A (OUI DF-A9-FF)
        Count: 1
        #134: len 20 (1 Kb/s)
        Latency: 156 msec (71-171 msec ~160 msec)
> ACL Data RX: Handle 1245 flags 0x02 dlen 11                                                                      #136 10.270603
      ATT: Read By Type Request (0x08) len 6
        Handle range: 0x0064-0x0075
        Attribute type: Characteristic (0x2803)
zephyr.exe[2087080]: < HCI Command: Host Number of Completed Packets (0x03|0x0035) plen 5                          #137 10.273791
        Num handles: 1
        Handle: 1245 Address: DF:A9:FF:F6:B1:1A (OUI DF-A9-FF)
        Count: 1
zephyr.exe[2087080]: < ACL Data TX: Handle 1245 flags 0x00 dlen 20                                                 #138 10.273908
      ATT: Read By Type Response (0x09) len 15
        Attribute data length: 7
        Attribute data list: 2 entries
        Handle: 0x0065
        Value: 126600a32b
            Properties: 0x12
              Read (0x02)
              Notify (0x10)
            Value Handle: 0x0066
            Value UUID: Media State (0x2ba3)
        Handle: 0x0068
        Value: 1c6900a42b
            Properties: 0x1c
              Write Without Response (0x04)
              Write (0x08)
              Notify (0x10)
            Value Handle: 0x0069
            Value UUID: Media Control Point (0x2ba4)
> HCI Event: Number of Completed Packets (0x13) plen 5                                                             #139 10.445295
        Num handles: 1
        Handle: 1245 Address: DF:A9:FF:F6:B1:1A (OUI DF-A9-FF)
        Count: 1
        #138: len 20 (0 Kb/s)
        Latency: 171 msec (71-171 msec ~165 msec)
> ACL Data RX: Handle 1245 flags 0x02 dlen 11                                                                      #140 10.445656
      ATT: Read By Type Request (0x08) len 6
        Handle range: 0x0069-0x0075
        Attribute type: Characteristic (0x2803)
zephyr.exe[2087080]: < HCI Command: Host Number of Completed Packets (0x03|0x0035) plen 5                          #141 10.453841
        Num handles: 1
        Handle: 1245 Address: DF:A9:FF:F6:B1:1A (OUI DF-A9-FF)
        Count: 1
zephyr.exe[2087080]: < ACL Data TX: Handle 1245 flags 0x00 dlen 20                                                 #142 10.454058
      ATT: Read By Type Response (0x09) len 15
        Attribute data length: 7
        Attribute data list: 2 entries
        Handle: 0x006b
        Value: 126c00a52b
            Properties: 0x12
              Read (0x02)
              Notify (0x10)
            Value Handle: 0x006c
            Value UUID: Media Control Point Opcodes Supported (0x2ba5)
        Handle: 0x006e
        Value: 1c6f00a72b
            Properties: 0x1c
              Write Without Response (0x04)
              Write (0x08)
              Notify (0x10)
            Value Handle: 0x006f
            Value UUID: Search Control Point (0x2ba7)
> HCI Event: Number of Completed Packets (0x13) plen 5                                                             #143 10.620535
        Num handles: 1
        Handle: 1245 Address: DF:A9:FF:F6:B1:1A (OUI DF-A9-FF)
        Count: 1
        #142: len 20 (0 Kb/s)
        Latency: 166 msec (71-171 msec ~166 msec)
> ACL Data RX: Handle 1245 flags 0x02 dlen 11                                                                      #144 10.620543
      ATT: Read By Type Request (0x08) len 6
        Handle range: 0x006f-0x0075
        Attribute type: Characteristic (0x2803)
zephyr.exe[2087080]: < HCI Command: Host Number of Completed Packets (0x03|0x0035) plen 5                          #145 10.633856
        Num handles: 1
        Handle: 1245 Address: DF:A9:FF:F6:B1:1A (OUI DF-A9-FF)
        Count: 1
zephyr.exe[2087080]: < ACL Data TX: Handle 1245 flags 0x00 dlen 20                                                 #146 10.633998
      ATT: Read By Type Response (0x09) len 15
        Attribute data length: 7
        Attribute data list: 2 entries
        Handle: 0x0071
        Value: 127200a62b
            Properties: 0x12
              Read (0x02)
              Notify (0x10)
            Value Handle: 0x0072
            Value UUID: Search Results Object ID (0x2ba6)
        Handle: 0x0074
        Value: 027500ba2b
            Properties: 0x02
              Read (0x02)
            Value Handle: 0x0075
            Value UUID: Content Control ID (0x2bba)
> HCI Event: Number of Completed Packets (0x13) plen 5                                                             #147 10.795331
        Num handles: 1
        Handle: 1245 Address: DF:A9:FF:F6:B1:1A (OUI DF-A9-FF)
        Count: 1
        #146: len 20 (0 Kb/s)
        Latency: 161 msec (71-171 msec ~163 msec)
> ACL Data RX: Handle 1245 flags 0x02 dlen 11                                                                      #148 10.795521
      ATT: Read By Type Request (0x08) len 6
        Handle range: 0x0075-0x0075
        Attribute type: Characteristic (0x2803)
zephyr.exe[2087080]: < HCI Command: Host Number of Completed Packets (0x03|0x0035) plen 5                          #149 10.813821
        Num handles: 1
        Handle: 1245 Address: DF:A9:FF:F6:B1:1A (OUI DF-A9-FF)
        Count: 1
zephyr.exe[2087080]: < ACL Data TX: Handle 1245 flags 0x00 dlen 9                                                  #150 10.813925
      ATT: Error Response (0x01) len 4
        Read By Type Request (0x08)
        Handle: 0x0075
        Error: Attribute Not Found (0x0a)
> HCI Event: Number of Completed Packets (0x13) plen 5                                                             #151 10.970286
        Num handles: 1
        Handle: 1245 Address: DF:A9:FF:F6:B1:1A (OUI DF-A9-FF)
        Count: 1
        #150: len 9 (0 Kb/s)
        Latency: 156 msec (71-171 msec ~160 msec)
> ACL Data RX: Handle 1245 flags 0x02 dlen 9                                                                       #152 10.970543
      ATT: Find Information Request (0x04) len 4
        Handle range: 0x003b-0x003b
zephyr.exe[2087080]: < HCI Command: Host Number of Completed Packets (0x03|0x0035) plen 5                          #153 10.973740
        Num handles: 1
        Handle: 1245 Address: DF:A9:FF:F6:B1:1A (OUI DF-A9-FF)
        Count: 1
zephyr.exe[2087080]: < ACL Data TX: Handle 1245 flags 0x00 dlen 10                                                 #154 10.973825
      ATT: Find Information Response (0x05) len 5
        Format: UUID-16 (0x01)
        Handle: 0x003b
        UUID: Client Characteristic Configuration (0x2902)
> HCI Event: Number of Completed Packets (0x13) plen 5                                                             #155 11.145382
        Num handles: 1
        Handle: 1245 Address: DF:A9:FF:F6:B1:1A (OUI DF-A9-FF)
        Count: 1
        #154: len 10 (0 Kb/s)
        Latency: 171 msec (71-171 msec ~165 msec)
> ACL Data RX: Handle 1245 flags 0x02 dlen 9                                                                       #156 11.145569
      ATT: Find Information Request (0x04) len 4
        Handle range: 0x0042-0x0042
zephyr.exe[2087080]: < HCI Command: Host Number of Completed Packets (0x03|0x0035) plen 5                          #157 11.153546
        Num handles: 1
        Handle: 1245 Address: DF:A9:FF:F6:B1:1A (OUI DF-A9-FF)
        Count: 1
zephyr.exe[2087080]: < ACL Data TX: Handle 1245 flags 0x00 dlen 10                                                 #158 11.153582
      ATT: Find Information Response (0x05) len 5
        Format: UUID-16 (0x01)
        Handle: 0x0042
        UUID: Client Characteristic Configuration (0x2902)
> HCI Event: Number of Completed Packets (0x13) plen 5                                                             #159 11.320274
        Num handles: 1
        Handle: 1245 Address: DF:A9:FF:F6:B1:1A (OUI DF-A9-FF)
        Count: 1
        #158: len 10 (0 Kb/s)
        Latency: 166 msec (71-171 msec ~166 msec)
> ACL Data RX: Handle 1245 flags 0x02 dlen 9                                                                       #160 11.320587
      ATT: Find Information Request (0x04) len 4
        Handle range: 0x0045-0x0045
zephyr.exe[2087080]: < HCI Command: Host Number of Completed Packets (0x03|0x0035) plen 5                          #161 11.333886
        Num handles: 1
        Handle: 1245 Address: DF:A9:FF:F6:B1:1A (OUI DF-A9-FF)
        Count: 1
zephyr.exe[2087080]: < ACL Data TX: Handle 1245 flags 0x00 dlen 10                                                 #162 11.334000
      ATT: Find Information Response (0x05) len 5
        Format: UUID-16 (0x01)
        Handle: 0x0045
        UUID: Client Characteristic Configuration (0x2902)
> HCI Event: Number of Completed Packets (0x13) plen 5                                                             #163 11.495268
        Num handles: 1
        Handle: 1245 Address: DF:A9:FF:F6:B1:1A (OUI DF-A9-FF)
        Count: 1
        #162: len 10 (0 Kb/s)
        Latency: 161 msec (71-171 msec ~163 msec)
> ACL Data RX: Handle 1245 flags 0x02 dlen 9                                                                       #164 11.495511
      ATT: Find Information Request (0x04) len 4
        Handle range: 0x0048-0x0048
zephyr.exe[2087080]: < HCI Command: Host Number of Completed Packets (0x03|0x0035) plen 5                          #165 11.513442
        Num handles: 1
        Handle: 1245 Address: DF:A9:FF:F6:B1:1A (OUI DF-A9-FF)
        Count: 1
zephyr.exe[2087080]: < ACL Data TX: Handle 1245 flags 0x00 dlen 10                                                 #166 11.513515
      ATT: Find Information Response (0x05) len 5
        Format: UUID-16 (0x01)
        Handle: 0x0048
        UUID: Client Characteristic Configuration (0x2902)
> HCI Event: Number of Completed Packets (0x13) plen 5                                                             #167 11.670397
        Num handles: 1
        Handle: 1245 Address: DF:A9:FF:F6:B1:1A (OUI DF-A9-FF)
        Count: 1
        #166: len 10 (0 Kb/s)
        Latency: 156 msec (71-171 msec ~160 msec)
> ACL Data RX: Handle 1245 flags 0x02 dlen 9                                                                       #168 11.670536
      ATT: Find Information Request (0x04) len 4
        Handle range: 0x004b-0x004b
zephyr.exe[2087080]: < HCI Command: Host Number of Completed Packets (0x03|0x0035) plen 5                          #169 11.673765
        Num handles: 1
        Handle: 1245 Address: DF:A9:FF:F6:B1:1A (OUI DF-A9-FF)
        Count: 1
zephyr.exe[2087080]: < ACL Data TX: Handle 1245 flags 0x00 dlen 10                                                 #170 11.673878
      ATT: Find Information Response (0x05) len 5
        Format: UUID-16 (0x01)
        Handle: 0x004b
        UUID: Client Characteristic Configuration (0x2902)
> HCI Event: Number of Completed Packets (0x13) plen 5                                                             #171 11.845289
        Num handles: 1
        Handle: 1245 Address: DF:A9:FF:F6:B1:1A (OUI DF-A9-FF)
        Count: 1
        #170: len 10 (0 Kb/s)
        Latency: 171 msec (71-171 msec ~165 msec)
> ACL Data RX: Handle 1245 flags 0x02 dlen 9                                                                       #172 11.845541
      ATT: Find Information Request (0x04) len 4
        Handle range: 0x004e-0x004e
zephyr.exe[2087080]: < HCI Command: Host Number of Completed Packets (0x03|0x0035) plen 5                          #173 11.853756
        Num handles: 1
        Handle: 1245 Address: DF:A9:FF:F6:B1:1A (OUI DF-A9-FF)
        Count: 1
zephyr.exe[2087080]: < ACL Data TX: Handle 1245 flags 0x00 dlen 10                                                 #174 11.853811
      ATT: Find Information Response (0x05) len 5
        Format: UUID-16 (0x01)
        Handle: 0x004e
        UUID: Client Characteristic Configuration (0x2902)
> HCI Event: Number of Completed Packets (0x13) plen 5                                                             #175 12.020315
        Num handles: 1
        Handle: 1245 Address: DF:A9:FF:F6:B1:1A (OUI DF-A9-FF)
        Count: 1
        #174: len 10 (0 Kb/s)
        Latency: 166 msec (71-171 msec ~166 msec)
> ACL Data RX: Handle 1245 flags 0x02 dlen 9                                                                       #176 12.020551
      ATT: Find Information Request (0x04) len 4
        Handle range: 0x0051-0x0051
zephyr.exe[2087080]: < HCI Command: Host Number of Completed Packets (0x03|0x0035) plen 5                          #177 12.033683
        Num handles: 1
        Handle: 1245 Address: DF:A9:FF:F6:B1:1A (OUI DF-A9-FF)
        Count: 1
zephyr.exe[2087080]: < ACL Data TX: Handle 1245 flags 0x00 dlen 10                                                 #178 12.033806
      ATT: Find Information Response (0x05) len 5
        Format: UUID-16 (0x01)
        Handle: 0x0051
        UUID: Client Characteristic Configuration (0x2902)
> HCI Event: Number of Completed Packets (0x13) plen 5                                                             #179 12.195367
        Num handles: 1
        Handle: 1245 Address: DF:A9:FF:F6:B1:1A (OUI DF-A9-FF)
        Count: 1
        #178: len 10 (0 Kb/s)
        Latency: 161 msec (71-171 msec ~163 msec)
> ACL Data RX: Handle 1245 flags 0x02 dlen 9                                                                       #180 12.195559
      ATT: Find Information Request (0x04) len 4
        Handle range: 0x0056-0x0056
zephyr.exe[2087080]: < HCI Command: Host Number of Completed Packets (0x03|0x0035) plen 5                          #181 12.213893
        Num handles: 1
        Handle: 1245 Address: DF:A9:FF:F6:B1:1A (OUI DF-A9-FF)
        Count: 1
zephyr.exe[2087080]: < ACL Data TX: Handle 1245 flags 0x00 dlen 10                                                 #182 12.213946
      ATT: Find Information Response (0x05) len 5
        Format: UUID-16 (0x01)
        Handle: 0x0056
        UUID: Client Characteristic Configuration (0x2902)
> HCI Event: Number of Completed Packets (0x13) plen 5                                                             #183 12.370289
        Num handles: 1
        Handle: 1245 Address: DF:A9:FF:F6:B1:1A (OUI DF-A9-FF)
        Count: 1
        #182: len 10 (0 Kb/s)
        Latency: 156 msec (71-171 msec ~160 msec)
> ACL Data RX: Handle 1245 flags 0x02 dlen 9                                                                       #184 12.370505
      ATT: Find Information Request (0x04) len 4
        Handle range: 0x0059-0x0059
zephyr.exe[2087080]: < HCI Command: Host Number of Completed Packets (0x03|0x0035) plen 5                          #185 12.373775
        Num handles: 1
        Handle: 1245 Address: DF:A9:FF:F6:B1:1A (OUI DF-A9-FF)
        Count: 1
zephyr.exe[2087080]: < ACL Data TX: Handle 1245 flags 0x00 dlen 10                                                 #186 12.373861
      ATT: Find Information Response (0x05) len 5
        Format: UUID-16 (0x01)
        Handle: 0x0059
        UUID: Client Characteristic Configuration (0x2902)
> HCI Event: Number of Completed Packets (0x13) plen 5                                                             #187 12.545268
        Num handles: 1
        Handle: 1245 Address: DF:A9:FF:F6:B1:1A (OUI DF-A9-FF)
        Count: 1
        #186: len 10 (0 Kb/s)
        Latency: 171 msec (71-171 msec ~165 msec)
> ACL Data RX: Handle 1245 flags 0x02 dlen 9                                                                       #188 12.545430
      ATT: Find Information Request (0x04) len 4
        Handle range: 0x005c-0x005c
zephyr.exe[2087080]: < HCI Command: Host Number of Completed Packets (0x03|0x0035) plen 5                          #189 12.553858
        Num handles: 1
        Handle: 1245 Address: DF:A9:FF:F6:B1:1A (OUI DF-A9-FF)
        Count: 1
zephyr.exe[2087080]: < ACL Data TX: Handle 1245 flags 0x00 dlen 10                                                 #190 12.553954
      ATT: Find Information Response (0x05) len 5
        Format: UUID-16 (0x01)
        Handle: 0x005c
        UUID: Client Characteristic Configuration (0x2902)
> HCI Event: Number of Completed Packets (0x13) plen 5                                                             #191 12.720328
        Num handles: 1
        Handle: 1245 Address: DF:A9:FF:F6:B1:1A (OUI DF-A9-FF)
        Count: 1
        #190: len 10 (0 Kb/s)
        Latency: 166 msec (71-171 msec ~166 msec)
> ACL Data RX: Handle 1245 flags 0x02 dlen 9                                                                       #192 12.720420
      ATT: Find Information Request (0x04) len 4
        Handle range: 0x005f-0x005f
zephyr.exe[2087080]: < HCI Command: Host Number of Completed Packets (0x03|0x0035) plen 5                          #193 12.733875
        Num handles: 1
        Handle: 1245 Address: DF:A9:FF:F6:B1:1A (OUI DF-A9-FF)
        Count: 1
zephyr.exe[2087080]: < ACL Data TX: Handle 1245 flags 0x00 dlen 10                                                 #194 12.734027
      ATT: Find Information Response (0x05) len 5
        Format: UUID-16 (0x01)
        Handle: 0x005f
        UUID: Client Characteristic Configuration (0x2902)
> HCI Event: Number of Completed Packets (0x13) plen 5                                                             #195 12.895225
        Num handles: 1
        Handle: 1245 Address: DF:A9:FF:F6:B1:1A (OUI DF-A9-FF)
        Count: 1
        #194: len 10 (0 Kb/s)
        Latency: 161 msec (71-171 msec ~163 msec)
> ACL Data RX: Handle 1245 flags 0x02 dlen 9                                                                       #196 12.895474
      ATT: Find Information Request (0x04) len 4
        Handle range: 0x0062-0x0062
zephyr.exe[2087080]: < HCI Command: Host Number of Completed Packets (0x03|0x0035) plen 5                          #197 12.913872
        Num handles: 1
        Handle: 1245 Address: DF:A9:FF:F6:B1:1A (OUI DF-A9-FF)
        Count: 1
zephyr.exe[2087080]: < ACL Data TX: Handle 1245 flags 0x00 dlen 10                                                 #198 12.913953
      ATT: Find Information Response (0x05) len 5
        Format: UUID-16 (0x01)
        Handle: 0x0062
        UUID: Client Characteristic Configuration (0x2902)
> HCI Event: Number of Completed Packets (0x13) plen 5                                                             #199 13.070292
        Num handles: 1
        Handle: 1245 Address: DF:A9:FF:F6:B1:1A (OUI DF-A9-FF)
        Count: 1
        #198: len 10 (0 Kb/s)
        Latency: 156 msec (71-171 msec ~159 msec)
> ACL Data RX: Handle 1245 flags 0x02 dlen 9                                                                       #200 13.070457
      ATT: Find Information Request (0x04) len 4
        Handle range: 0x0067-0x0067
zephyr.exe[2087080]: < HCI Command: Host Number of Completed Packets (0x03|0x0035) plen 5                          #201 13.073830
        Num handles: 1
        Handle: 1245 Address: DF:A9:FF:F6:B1:1A (OUI DF-A9-FF)
        Count: 1
zephyr.exe[2087080]: < ACL Data TX: Handle 1245 flags 0x00 dlen 10                                                 #202 13.073922
      ATT: Find Information Response (0x05) len 5
        Format: UUID-16 (0x01)
        Handle: 0x0067
        UUID: Client Characteristic Configuration (0x2902)
> HCI Event: Number of Completed Packets (0x13) plen 5                                                             #203 13.245257
        Num handles: 1
        Handle: 1245 Address: DF:A9:FF:F6:B1:1A (OUI DF-A9-FF)
        Count: 1
        #202: len 10 (0 Kb/s)
        Latency: 171 msec (71-171 msec ~165 msec)
> ACL Data RX: Handle 1245 flags 0x02 dlen 9                                                                       #204 13.245445
      ATT: Find Information Request (0x04) len 4
        Handle range: 0x006a-0x006a
zephyr.exe[2087080]: < HCI Command: Host Number of Completed Packets (0x03|0x0035) plen 5                          #205 13.253900
        Num handles: 1
        Handle: 1245 Address: DF:A9:FF:F6:B1:1A (OUI DF-A9-FF)
        Count: 1
zephyr.exe[2087080]: < ACL Data TX: Handle 1245 flags 0x00 dlen 10                                                 #206 13.254005
      ATT: Find Information Response (0x05) len 5
        Format: UUID-16 (0x01)
        Handle: 0x006a
        UUID: Client Characteristic Configuration (0x2902)
> HCI Event: Number of Completed Packets (0x13) plen 5                                                             #207 13.420304
        Num handles: 1
        Handle: 1245 Address: DF:A9:FF:F6:B1:1A (OUI DF-A9-FF)
        Count: 1
        #206: len 10 (0 Kb/s)
        Latency: 166 msec (71-171 msec ~165 msec)
> ACL Data RX: Handle 1245 flags 0x02 dlen 9                                                                       #208 13.420449
      ATT: Find Information Request (0x04) len 4
        Handle range: 0x006d-0x006d
zephyr.exe[2087080]: < HCI Command: Host Number of Completed Packets (0x03|0x0035) plen 5                          #209 13.433821
        Num handles: 1
        Handle: 1245 Address: DF:A9:FF:F6:B1:1A (OUI DF-A9-FF)
        Count: 1
zephyr.exe[2087080]: < ACL Data TX: Handle 1245 flags 0x00 dlen 10                                                 #210 13.433967
      ATT: Find Information Response (0x05) len 5
        Format: UUID-16 (0x01)
        Handle: 0x006d
        UUID: Client Characteristic Configuration (0x2902)
> HCI Event: Number of Completed Packets (0x13) plen 5                                                             #211 13.595223
        Num handles: 1
        Handle: 1245 Address: DF:A9:FF:F6:B1:1A (OUI DF-A9-FF)
        Count: 1
        #210: len 10 (0 Kb/s)
        Latency: 161 msec (71-171 msec ~163 msec)
> ACL Data RX: Handle 1245 flags 0x02 dlen 9                                                                       #212 13.595434
      ATT: Find Information Request (0x04) len 4
        Handle range: 0x0070-0x0070
zephyr.exe[2087080]: < HCI Command: Host Number of Completed Packets (0x03|0x0035) plen 5                          #213 13.613815
        Num handles: 1
        Handle: 1245 Address: DF:A9:FF:F6:B1:1A (OUI DF-A9-FF)
        Count: 1
zephyr.exe[2087080]: < ACL Data TX: Handle 1245 flags 0x00 dlen 10                                                 #214 13.613926
      ATT: Find Information Response (0x05) len 5
        Format: UUID-16 (0x01)
        Handle: 0x0070
        UUID: Client Characteristic Configuration (0x2902)
> HCI Event: Number of Completed Packets (0x13) plen 5                                                             #215 13.770276
        Num handles: 1
        Handle: 1245 Address: DF:A9:FF:F6:B1:1A (OUI DF-A9-FF)
        Count: 1
        #214: len 10 (0 Kb/s)
        Latency: 156 msec (71-171 msec ~159 msec)
> ACL Data RX: Handle 1245 flags 0x02 dlen 9                                                                       #216 13.770452
      ATT: Find Information Request (0x04) len 4
        Handle range: 0x0073-0x0073
zephyr.exe[2087080]: < HCI Command: Host Number of Completed Packets (0x03|0x0035) plen 5                          #217 13.773761
        Num handles: 1
        Handle: 1245 Address: DF:A9:FF:F6:B1:1A (OUI DF-A9-FF)
        Count: 1
zephyr.exe[2087080]: < ACL Data TX: Handle 1245 flags 0x00 dlen 10                                                 #218 13.773840
      ATT: Find Information Response (0x05) len 5
        Format: UUID-16 (0x01)
        Handle: 0x0073
        UUID: Client Characteristic Configuration (0x2902)
> HCI Event: Number of Completed Packets (0x13) plen 5                                                             #219 13.945168
        Num handles: 1
        Handle: 1245 Address: DF:A9:FF:F6:B1:1A (OUI DF-A9-FF)
        Count: 1
        #218: len 10 (0 Kb/s)
        Latency: 171 msec (71-171 msec ~165 msec)
> ACL Data RX: Handle 1245 flags 0x02 dlen 9                                                                       #220 13.945462
      ATT: Write Request (0x12) len 4
        Handle: 0x0067
          Data: 0000
zephyr.exe[2087080]: < HCI Command: Host Number of Completed Packets (0x03|0x0035) plen 5                          #221 13.953617
        Num handles: 1
        Handle: 1245 Address: DF:A9:FF:F6:B1:1A (OUI DF-A9-FF)
        Count: 1
zephyr.exe[2087080]: < ACL Data TX: Handle 1245 flags 0x00 dlen 5                                                  #222 13.953731
      ATT: Write Response (0x13) len 0
> HCI Event: Number of Completed Packets (0x13) plen 5                                                             #223 14.120264
        Num handles: 1
        Handle: 1245 Address: DF:A9:FF:F6:B1:1A (OUI DF-A9-FF)
        Count: 1
        #222: len 5 (0 Kb/s)
        Latency: 166 msec (71-171 msec ~166 msec)
> ACL Data RX: Handle 1245 flags 0x02 dlen 9                                                                       #224 14.120438
      ATT: Write Request (0x12) len 4
        Handle: 0x0067
          Data: 0100
zephyr.exe[2087080]: < HCI Command: Host Number of Completed Packets (0x03|0x0035) plen 5                          #225 14.133797
        Num handles: 1
        Handle: 1245 Address: DF:A9:FF:F6:B1:1A (OUI DF-A9-FF)
        Count: 1
zephyr.exe[2087080]: < ACL Data TX: Handle 1245 flags 0x00 dlen 5                                                  #226 14.133899
      ATT: Write Response (0x13) len 0
> HCI Event: Number of Completed Packets (0x13) plen 5                                                             #227 14.295227
        Num handles: 1
        Handle: 1245 Address: DF:A9:FF:F6:B1:1A (OUI DF-A9-FF)
        Count: 1
        #226: len 5 (0 Kb/s)
        Latency: 161 msec (71-171 msec ~163 msec)
> ACL Data RX: Handle 1245 flags 0x02 dlen 9                                                                       #228 14.295435
      ATT: Write Request (0x12) len 4
        Handle: 0x006a
          Data: 0000
zephyr.exe[2087080]: < HCI Command: Host Number of Completed Packets (0x03|0x0035) plen 5                          #229 14.313917
        Num handles: 1
        Handle: 1245 Address: DF:A9:FF:F6:B1:1A (OUI DF-A9-FF)
        Count: 1
zephyr.exe[2087080]: < ACL Data TX: Handle 1245 flags 0x00 dlen 5                                                  #230 14.313997
      ATT: Write Response (0x13) len 0
> HCI Event: Number of Completed Packets (0x13) plen 5                                                             #231 14.470168
        Num handles: 1
        Handle: 1245 Address: DF:A9:FF:F6:B1:1A (OUI DF-A9-FF)
        Count: 1
        #230: len 5 (0 Kb/s)
        Latency: 156 msec (71-171 msec ~159 msec)
> ACL Data RX: Handle 1245 flags 0x02 dlen 9                                                                       #232 14.470373
      ATT: Write Request (0x12) len 4
        Handle: 0x006a
          Data: 0100
zephyr.exe[2087080]: < HCI Command: Host Number of Completed Packets (0x03|0x0035) plen 5                          #233 14.473896
        Num handles: 1
        Handle: 1245 Address: DF:A9:FF:F6:B1:1A (OUI DF-A9-FF)
        Count: 1
zephyr.exe[2087080]: < ACL Data TX: Handle 1245 flags 0x00 dlen 5                                                  #234 14.473970
      ATT: Write Response (0x13) len 0
> HCI Event: Number of Completed Packets (0x13) plen 5                                                             #235 14.645207
        Num handles: 1
        Handle: 1245 Address: DF:A9:FF:F6:B1:1A (OUI DF-A9-FF)
        Count: 1
        #234: len 5 (0 Kb/s)
        Latency: 171 msec (71-171 msec ~165 msec)
> ACL Data RX: Handle 1245 flags 0x02 dlen 9                                                                       #236 14.645402
      ATT: Write Request (0x12) len 4
        Handle: 0x0042
          Data: 0000
zephyr.exe[2087080]: < HCI Command: Host Number of Completed Packets (0x03|0x0035) plen 5                          #237 14.653823
        Num handles: 1
        Handle: 1245 Address: DF:A9:FF:F6:B1:1A (OUI DF-A9-FF)
        Count: 1
zephyr.exe[2087080]: < ACL Data TX: Handle 1245 flags 0x00 dlen 5                                                  #238 14.653909
      ATT: Write Response (0x13) len 0
> HCI Event: Number of Completed Packets (0x13) plen 5                                                             #239 14.820160
        Num handles: 1
        Handle: 1245 Address: DF:A9:FF:F6:B1:1A (OUI DF-A9-FF)
        Count: 1
        #238: len 5 (0 Kb/s)
        Latency: 166 msec (71-171 msec ~165 msec)
> ACL Data RX: Handle 1245 flags 0x02 dlen 9                                                                       #240 14.820511
      ATT: Write Request (0x12) len 4
        Handle: 0x0042
          Data: 0100
zephyr.exe[2087080]: < HCI Command: Host Number of Completed Packets (0x03|0x0035) plen 5                          #241 14.833865
        Num handles: 1
        Handle: 1245 Address: DF:A9:FF:F6:B1:1A (OUI DF-A9-FF)
        Count: 1
zephyr.exe[2087080]: < ACL Data TX: Handle 1245 flags 0x00 dlen 5                                                  #242 14.833955
      ATT: Write Response (0x13) len 0
> HCI Event: Number of Completed Packets (0x13) plen 5                                                             #243 14.995191
        Num handles: 1
        Handle: 1245 Address: DF:A9:FF:F6:B1:1A (OUI DF-A9-FF)
        Count: 1
        #242: len 5 (0 Kb/s)
        Latency: 161 msec (71-171 msec ~163 msec)
> ACL Data RX: Handle 1245 flags 0x02 dlen 9                                                                       #244 14.995365
      ATT: Write Request (0x12) len 4
        Handle: 0x004b
          Data: 0000
zephyr.exe[2087080]: < HCI Command: Host Number of Completed Packets (0x03|0x0035) plen 5                          #245 15.013825
        Num handles: 1
        Handle: 1245 Address: DF:A9:FF:F6:B1:1A (OUI DF-A9-FF)
        Count: 1
zephyr.exe[2087080]: < ACL Data TX: Handle 1245 flags 0x00 dlen 5                                                  #246 15.013910
      ATT: Write Response (0x13) len 0
> HCI Event: Number of Completed Packets (0x13) plen 5                                                             #247 15.170178
        Num handles: 1
        Handle: 1245 Address: DF:A9:FF:F6:B1:1A (OUI DF-A9-FF)
        Count: 1
        #246: len 5 (0 Kb/s)
        Latency: 156 msec (71-171 msec ~159 msec)
> ACL Data RX: Handle 1245 flags 0x02 dlen 9                                                                       #248 15.170371
      ATT: Write Request (0x12) len 4
        Handle: 0x004b
          Data: 0100
zephyr.exe[2087080]: < HCI Command: Host Number of Completed Packets (0x03|0x0035) plen 5                          #249 15.173801
        Num handles: 1
        Handle: 1245 Address: DF:A9:FF:F6:B1:1A (OUI DF-A9-FF)
        Count: 1
zephyr.exe[2087080]: < ACL Data TX: Handle 1245 flags 0x00 dlen 5                                                  #250 15.173913
      ATT: Write Response (0x13) len 0
> HCI Event: Number of Completed Packets (0x13) plen 5                                                             #251 15.345110
        Num handles: 1
        Handle: 1245 Address: DF:A9:FF:F6:B1:1A (OUI DF-A9-FF)
        Count: 1
        #250: len 5 (0 Kb/s)
        Latency: 171 msec (71-171 msec ~165 msec)
> ACL Data RX: Handle 1245 flags 0x02 dlen 9                                                                       #252 15.345375
      ATT: Write Request (0x12) len 4
        Handle: 0x0048
          Data: 0000
zephyr.exe[2087080]: < HCI Command: Host Number of Completed Packets (0x03|0x0035) plen 5                          #253 15.353863
        Num handles: 1
        Handle: 1245 Address: DF:A9:FF:F6:B1:1A (OUI DF-A9-FF)
        Count: 1
zephyr.exe[2087080]: < ACL Data TX: Handle 1245 flags 0x00 dlen 5                                                  #254 15.353941
      ATT: Write Response (0x13) len 0
> HCI Event: Number of Completed Packets (0x13) plen 5                                                             #255 15.520109
        Num handles: 1
        Handle: 1245 Address: DF:A9:FF:F6:B1:1A (OUI DF-A9-FF)
        Count: 1
        #254: len 5 (0 Kb/s)
        Latency: 166 msec (71-171 msec ~165 msec)
> ACL Data RX: Handle 1245 flags 0x02 dlen 9                                                                       #256 15.520368
      ATT: Write Request (0x12) len 4
        Handle: 0x0048
          Data: 0100
zephyr.exe[2087080]: < HCI Command: Host Number of Completed Packets (0x03|0x0035) plen 5                          #257 15.534028
        Num handles: 1
        Handle: 1245 Address: DF:A9:FF:F6:B1:1A (OUI DF-A9-FF)
        Count: 1
zephyr.exe[2087080]: < ACL Data TX: Handle 1245 flags 0x00 dlen 5                                                  #258 15.534124
      ATT: Write Response (0x13) len 0
> HCI Event: Number of Completed Packets (0x13) plen 5                                                             #259 15.695195
        Num handles: 1
        Handle: 1245 Address: DF:A9:FF:F6:B1:1A (OUI DF-A9-FF)
        Count: 1
        #258: len 5 (0 Kb/s)
        Latency: 161 msec (71-171 msec ~163 msec)
> ACL Data RX: Handle 1245 flags 0x02 dlen 9                                                                       #260 15.695388
      ATT: Write Request (0x12) len 4
        Handle: 0x0045
          Data: 0000
zephyr.exe[2087080]: < HCI Command: Host Number of Completed Packets (0x03|0x0035) plen 5                          #261 15.713935
        Num handles: 1
        Handle: 1245 Address: DF:A9:FF:F6:B1:1A (OUI DF-A9-FF)
        Count: 1
zephyr.exe[2087080]: < ACL Data TX: Handle 1245 flags 0x00 dlen 5                                                  #262 15.714043
      ATT: Write Response (0x13) len 0
> HCI Event: Number of Completed Packets (0x13) plen 5                                                             #263 15.870175
        Num handles: 1
        Handle: 1245 Address: DF:A9:FF:F6:B1:1A (OUI DF-A9-FF)
        Count: 1
        #262: len 5 (0 Kb/s)
        Latency: 156 msec (71-171 msec ~159 msec)
> ACL Data RX: Handle 1245 flags 0x02 dlen 9                                                                       #264 15.870366
      ATT: Write Request (0x12) len 4
        Handle: 0x0045
          Data: 0100
zephyr.exe[2087080]: < HCI Command: Host Number of Completed Packets (0x03|0x0035) plen 5                          #265 15.873922
        Num handles: 1
        Handle: 1245 Address: DF:A9:FF:F6:B1:1A (OUI DF-A9-FF)
        Count: 1
zephyr.exe[2087080]: < ACL Data TX: Handle 1245 flags 0x00 dlen 5                                                  #266 15.874001
      ATT: Write Response (0x13) len 0
> HCI Event: Number of Completed Packets (0x13) plen 5                                                             #267 16.045144
        Num handles: 1
        Handle: 1245 Address: DF:A9:FF:F6:B1:1A (OUI DF-A9-FF)
        Count: 1
        #266: len 5 (0 Kb/s)
        Latency: 171 msec (71-171 msec ~165 msec)
> ACL Data RX: Handle 1245 flags 0x02 dlen 9                                                                       #268 16.045429
      ATT: Write Request (0x12) len 4
        Handle: 0x0056
          Data: 0000
zephyr.exe[2087080]: < HCI Command: Host Number of Completed Packets (0x03|0x0035) plen 5                          #269 16.053877
        Num handles: 1
        Handle: 1245 Address: DF:A9:FF:F6:B1:1A (OUI DF-A9-FF)
        Count: 1
zephyr.exe[2087080]: < ACL Data TX: Handle 1245 flags 0x00 dlen 5                                                  #270 16.054027
      ATT: Write Response (0x13) len 0
> HCI Event: Number of Completed Packets (0x13) plen 5                                                             #271 16.220141
        Num handles: 1
        Handle: 1245 Address: DF:A9:FF:F6:B1:1A (OUI DF-A9-FF)
        Count: 1
        #270: len 5 (0 Kb/s)
        Latency: 166 msec (71-171 msec ~165 msec)
> ACL Data RX: Handle 1245 flags 0x02 dlen 9                                                                       #272 16.220376
      ATT: Write Request (0x12) len 4
        Handle: 0x0056
          Data: 0100
zephyr.exe[2087080]: < HCI Command: Host Number of Completed Packets (0x03|0x0035) plen 5                          #273 16.233982
        Num handles: 1
        Handle: 1245 Address: DF:A9:FF:F6:B1:1A (OUI DF-A9-FF)
        Count: 1
zephyr.exe[2087080]: < ACL Data TX: Handle 1245 flags 0x00 dlen 5                                                  #274 16.234071
      ATT: Write Response (0x13) len 0
> HCI Event: Number of Completed Packets (0x13) plen 5                                                             #275 16.395108
        Num handles: 1
        Handle: 1245 Address: DF:A9:FF:F6:B1:1A (OUI DF-A9-FF)
        Count: 1
        #274: len 5 (0 Kb/s)
        Latency: 161 msec (71-171 msec ~163 msec)
> ACL Data RX: Handle 1245 flags 0x02 dlen 9                                                                       #276 16.395335
      ATT: Write Request (0x12) len 4
        Handle: 0x0059
          Data: 0000
zephyr.exe[2087080]: < HCI Command: Host Number of Completed Packets (0x03|0x0035) plen 5                          #277 16.413765
        Num handles: 1
        Handle: 1245 Address: DF:A9:FF:F6:B1:1A (OUI DF-A9-FF)
        Count: 1
zephyr.exe[2087080]: < ACL Data TX: Handle 1245 flags 0x00 dlen 5                                                  #278 16.413847
      ATT: Write Response (0x13) len 0
> HCI Event: Number of Completed Packets (0x13) plen 5                                                             #279 16.570140
        Num handles: 1
        Handle: 1245 Address: DF:A9:FF:F6:B1:1A (OUI DF-A9-FF)
        Count: 1
        #278: len 5 (0 Kb/s)
        Latency: 156 msec (71-171 msec ~159 msec)
> ACL Data RX: Handle 1245 flags 0x02 dlen 9                                                                       #280 16.570339
      ATT: Write Request (0x12) len 4
        Handle: 0x0059
          Data: 0100
zephyr.exe[2087080]: < HCI Command: Host Number of Completed Packets (0x03|0x0035) plen 5                          #281 16.573619
        Num handles: 1
        Handle: 1245 Address: DF:A9:FF:F6:B1:1A (OUI DF-A9-FF)
        Count: 1
zephyr.exe[2087080]: < ACL Data TX: Handle 1245 flags 0x00 dlen 5                                                  #282 16.573669
      ATT: Write Response (0x13) len 0
> HCI Event: Number of Completed Packets (0x13) plen 5                                                             #283 16.745176
        Num handles: 1
        Handle: 1245 Address: DF:A9:FF:F6:B1:1A (OUI DF-A9-FF)
        Count: 1
        #282: len 5 (0 Kb/s)
        Latency: 171 msec (71-171 msec ~165 msec)
> ACL Data RX: Handle 1245 flags 0x02 dlen 9                                                                       #284 16.745317
      ATT: Write Request (0x12) len 4
        Handle: 0x005f
          Data: 0000
zephyr.exe[2087080]: < HCI Command: Host Number of Completed Packets (0x03|0x0035) plen 5                          #285 16.753843
        Num handles: 1
        Handle: 1245 Address: DF:A9:FF:F6:B1:1A (OUI DF-A9-FF)
        Count: 1
zephyr.exe[2087080]: < ACL Data TX: Handle 1245 flags 0x00 dlen 5                                                  #286 16.753996
      ATT: Write Response (0x13) len 0
> HCI Event: Number of Completed Packets (0x13) plen 5                                                             #287 16.920174
        Num handles: 1
        Handle: 1245 Address: DF:A9:FF:F6:B1:1A (OUI DF-A9-FF)
        Count: 1
        #286: len 5 (0 Kb/s)
        Latency: 166 msec (71-171 msec ~165 msec)
> ACL Data RX: Handle 1245 flags 0x02 dlen 9                                                                       #288 16.920358
      ATT: Write Request (0x12) len 4
        Handle: 0x005f
          Data: 0100
zephyr.exe[2087080]: < HCI Command: Host Number of Completed Packets (0x03|0x0035) plen 5                          #289 16.933942
        Num handles: 1
        Handle: 1245 Address: DF:A9:FF:F6:B1:1A (OUI DF-A9-FF)
        Count: 1
zephyr.exe[2087080]: < ACL Data TX: Handle 1245 flags 0x00 dlen 5                                                  #290 16.934053
      ATT: Write Response (0x13) len 0
> HCI Event: Number of Completed Packets (0x13) plen 5                                                             #291 17.095137
        Num handles: 1
        Handle: 1245 Address: DF:A9:FF:F6:B1:1A (OUI DF-A9-FF)
        Count: 1
        #290: len 5 (0 Kb/s)
        Latency: 161 msec (71-171 msec ~163 msec)
> ACL Data RX: Handle 1245 flags 0x02 dlen 7                                                                       #292 17.095320
      ATT: Read Request (0x0a) len 2
        Handle: 0x0075
zephyr.exe[2087080]: < HCI Command: Host Number of Completed Packets (0x03|0x0035) plen 5                          #293 17.113838
        Num handles: 1
        Handle: 1245 Address: DF:A9:FF:F6:B1:1A (OUI DF-A9-FF)
        Count: 1
zephyr.exe[2087080]: < ACL Data TX: Handle 1245 flags 0x00 dlen 6                                                  #294 17.113862
      ATT: Read Response (0x0b) len 1
> HCI Event: Number of Completed Packets (0x13) plen 5                                                             #295 17.269979
        Num handles: 1
        Handle: 1245 Address: DF:A9:FF:F6:B1:1A (OUI DF-A9-FF)
        Count: 1
        #294: len 6 (0 Kb/s)
        Latency: 156 msec (71-171 msec ~159 msec)
> HCI Event: Disconnect Complete (0x05) plen 4                                                                     #296 17.357795
        Status: Success (0x00)
        Handle: 1245 Address: DF:A9:FF:F6:B1:1A (OUI DF-A9-FF)
        Reason: Remote User Terminated Connection (0x13)
zephyr.exe[2087080]: < HCI Command: LE Set Extended Advertising Parameters (0x08|0x0036) plen 25                   #297 18.893292
        Handle: 0x00
        Properties: 0x0013
          Connectable
          Scannable
          Use legacy advertising PDUs: ADV_IND
        Min advertising interval: 100.000 msec (0x00a0)
        Max advertising interval: 150.000 msec (0x00f0)
        Channel map: 37, 38, 39 (0x07)
        Own address type: Random (0x01)
        Peer address type: Public (0x00)
        Peer address: 00:00:00:00:00:00 (OUI 00-00-00)
        Filter policy: Allow Scan Request from Any, Allow Connect Request from Any (0x00)
        TX power: Host has no preference (0x7f)
        Primary PHY: LE 1M (0x01)
        Secondary max skip: 0x00
        Secondary PHY: LE 1M (0x01)
        SID: 0x00
        Scan request notifications: Disabled (0x00)
> HCI Event: Command Complete (0x0e) plen 5                                                                        #298 18.894009
      LE Set Extended Advertising Parameters (0x08|0x0036) ncmd 1
        Status: Success (0x00)
        TX power (selected): 0 dbm (0x00)
zephyr.exe[2087080]: < HCI Command: LE Set Advertising Set Random Address (0x08|0x0035) plen 7                     #299 18.913186
        Advertising handle: 0x00
        Advertising random address: D5:B6:CC:31:DB:3B (Static)
> HCI Event: Command Complete (0x0e) plen 4                                                                        #300 18.913779
      LE Set Advertising Set Random Address (0x08|0x0035) ncmd 1
        Status: Success (0x00)
zephyr.exe[2087080]: < HCI Command: LE Set Extended Advertising Data (0x08|0x0037) plen 22                         #301 18.933258
        Handle: 0x00
        Operation: Complete extended advertising data (0x03)
        Fragment preference: Minimize fragmentation (0x01)
        Data length: 0x12
        Flags: 0x06
          LE General Discoverable Mode
          BR/EDR Not Supported
        Name (complete): Tester_F6B11A
> HCI Event: Command Complete (0x0e) plen 4                                                                        #302 18.934087
      LE Set Extended Advertising Data (0x08|0x0037) ncmd 1
        Status: Success (0x00)
zephyr.exe[2087080]: < HCI Command: LE Set Extended Scan Response Data (0x08|0x0038) plen 4                        #303 18.953258
        Handle: 0x00
        Operation: Complete scan response data (0x03)
        Fragment preference: Minimize fragmentation (0x01)
        Data length: 0x00
> HCI Event: Command Complete (0x0e) plen 4                                                                        #304 18.953721
      LE Set Extended Scan Response Data (0x08|0x0038) ncmd 1
        Status: Success (0x00)
zephyr.exe[2087080]: < HCI Command: LE Set Extended Advertising Enable (0x08|0x0039) plen 6                        #305 18.973265
        Extended advertising: Enabled (0x01)
        Number of sets: 1 (0x01)
        Entry 0
          Handle: 0x00
          Duration: 0 ms (0x00)
          Max ext adv events: 0
> HCI Event: Command Complete (0x0e) plen 4                                                                        #306 18.973913
      LE Set Extended Advertising Enable (0x08|0x0039) ncmd 1
        Status: Success (0x00)
> HCI Event: LE Meta Event (0x3e) plen 31                                                                          #307 19.288203
      LE Enhanced Connection Complete (0x0a)
        Status: Success (0x00)
        Handle: 1263
        Role: Peripheral (0x01)
        Peer address type: Public (0x00)
        Peer address: DF:A9:FF:F6:B1:1A (OUI DF-A9-FF)
        Local resolvable private address: 00:00:00:00:00:00 (Non-Resolvable)
        Peer resolvable private address: 00:00:00:00:00:00 (Non-Resolvable)
        Connection interval: 87.50 msec (0x0046)
        Connection latency: 0 (0x0000)
        Supervision timeout: 25120 msec (0x09d0)
        Central clock accuracy: 0x01
> HCI Event: LE Meta Event (0x3e) plen 6                                                                           #308 19.288303
      LE Advertising Set Terminated (0x12)
        Status: Success (0x00)
        Handle: 0
        Connection handle: 1263
        Number of completed extended advertising events: 0
zephyr.exe[2087080]: < HCI Command: LE Read Remote Used Features (0x08|0x0016) plen 2                              #309 19.294232
        Handle: 1263 Address: DF:A9:FF:F6:B1:1A (OUI DF-A9-FF)
zephyr.exe[2087080]: < ACL Data TX: Handle 1263 flags 0x00 dlen 6                                                  #310 19.294256
      SMP: Security Request (0x0b) len 1
        Authentication requirement: Bonding, No MITM, SC, No Keypresses (0x09)
zephyr.exe[2087080]: < ACL Data TX: Handle 1263 flags 0x00 dlen 7                                                  #311 19.294260
      ATT: Exchange MTU Request (0x02) len 2
        Client RX MTU: 251
> HCI Event: Command Status (0x0f) plen 4                                                                          #312 19.294832
      LE Read Remote Used Features (0x08|0x0016) ncmd 1
        Status: Success (0x00)
> HCI Event: Number of Completed Packets (0x13) plen 5                                                             #313 19.377217
        Num handles: 1
        Handle: 1263 Address: DF:A9:FF:F6:B1:1A (OUI DF-A9-FF)
        Count: 1
        #310: len 6 (0 Kb/s)
        Latency: 82 msec (82-82 msec ~82 msec)
> HCI Event: Number of Completed Packets (0x13) plen 5                                                             #314 19.464226
        Num handles: 1
        Handle: 1263 Address: DF:A9:FF:F6:B1:1A (OUI DF-A9-FF)
        Count: 1
        #311: len 7 (0 Kb/s)
        Latency: 169 msec (82-169 msec ~126 msec)
> HCI Event: LE Meta Event (0x3e) plen 12                                                                          #315 19.55