Bluetooth monitor ver 5.72
= Note: Linux version 6.14.0-36-generic (x86_64)                       0.861570
= Note: Bluetooth subsystem version 2.22                               0.861572
= New Index: 00:00:00:00:00:00 (Primary,UART,hci2)              [hci2] 0.861572
= New Index: 00:00:00:00:00:00 (Primary,UART,hci1)              [hci1] 0.861573
= New Index: 48:5F:99:8E:E0:64 (Primary,USB,hci0)               [hci0] 0.861574
= Open Index: 00:00:00:00:00:00                                 [hci1] 0.994709
= Index Info: 00:00:00:00:00:00 (Nordic Semiconductor ASA)      [hci1] 0.994714
@ USER Open: main (privileged) version 2.22            {0x0001} [hci1] 0.994718
< HCI Command: Reset (0x03|0x0003) plen 0                    #1 [hci1] 0.995062
> HCI Event: Command Complete (0x0e) plen 4                  #2 [hci1] 0.995544
      Reset (0x03|0x0003) ncmd 1
        Status: Success (0x00)
< HCI Command: Read Local Supported... (0x04|0x0003) plen 0  #3 [hci1] 1.014715
> HCI Event: Command Complete (0x0e) plen 12                 #4 [hci1] 1.015250
      Read Local Supported Features (0x04|0x0003) ncmd 1
        Status: Success (0x00)
        Features: 0x00 0x00 0x00 0x00 0x60 0x00 0x00 0x00
          BR/EDR Not Supported
          LE Supported (Controller)
< HCI Command: Read Local Version In.. (0x04|0x0001) plen 0  #5 [hci1] 1.034709
> HCI Event: Command Complete (0x0e) plen 12                 #6 [hci1] 1.035260
      Read Local Version Information (0x04|0x0001) ncmd 1
        Status: Success (0x00)
        HCI version: Reserved (0x0f) - Revision 12393 (0x3069)
        LMP version: Reserved (0x0f) - Subversion 12393 (0x3069)
        Manufacturer: Nordic Semiconductor ASA (89)
< HCI Command: Read Local Supported... (0x04|0x0002) plen 0  #7 [hci1] 1.054618
> HCI Event: Command Complete (0x0e) plen 68                 #8 [hci1] 1.055753
      Read Local Supported Commands (0x04|0x0002) ncmd 1
        Status: Success (0x00)
        Commands: 119 entries
          Disconnect (Octet 0 - Bit 5)
          Read Remote Version Information (Octet 2 - Bit 7)
          Set Event Mask (Octet 5 - Bit 6)
          Reset (Octet 5 - Bit 7)
          Read Connection Accept Timeout (Octet 7 - Bit 2)
          Write Connection Accept Timeout (Octet 7 - Bit 3)
          Read Transmit Power Level (Octet 10 - Bit 2)
          Set Controller To Host Flow Control (Octet 10 - Bit 5)
          Host Buffer Size (Octet 10 - Bit 6)
          Host Number of Completed Packets (Octet 10 - Bit 7)
          Read Local Version Information (Octet 14 - Bit 3)
          Read Local Supported Features (Octet 14 - Bit 5)
          Read BD ADDR (Octet 15 - Bit 1)
          Read RSSI (Octet 15 - Bit 5)
          Set Event Mask Page 2 (Octet 22 - Bit 2)
          LE Set Event Mask (Octet 25 - Bit 0)
          LE Read Buffer Size (Octet 25 - Bit 1)
          LE Read Local Supported Features (Octet 25 - Bit 2)
          LE Set Random Address (Octet 25 - Bit 4)
          LE Set Advertising Parameters (Octet 25 - Bit 5)
          LE Read Advertising Channel TX Power (Octet 25 - Bit 6)
          LE Set Advertising Data (Octet 25 - Bit 7)
          LE Set Scan Response Data (Octet 26 - Bit 0)
          LE Set Advertise Enable (Octet 26 - Bit 1)
          LE Set Scan Parameters (Octet 26 - Bit 2)
          LE Set Scan Enable (Octet 26 - Bit 3)
          LE Create Connection (Octet 26 - Bit 4)
          LE Create Connection Cancel (Octet 26 - Bit 5)
          LE Read Accept List Size (Octet 26 - Bit 6)
          LE Clear Accept List (Octet 26 - Bit 7)
          LE Add Device To Accept List (Octet 27 - Bit 0)
          LE Remove Device From Accept List (Octet 27 - Bit 1)
          LE Connection Update (Octet 27 - Bit 2)
          LE Set Host Channel Classification (Octet 27 - Bit 3)
          LE Read Channel Map (Octet 27 - Bit 4)
          LE Read Remote Used Features (Octet 27 - Bit 5)
          LE Encrypt (Octet 27 - Bit 6)
          LE Rand (Octet 27 - Bit 7)
          LE Start Encryption (Octet 28 - Bit 0)
          LE Long Term Key Request Reply (Octet 28 - Bit 1)
          LE Long Term Key Request Neg Reply (Octet 28 - Bit 2)
          LE Read Supported States (Octet 28 - Bit 3)
          LE Receiver Test (Octet 28 - Bit 4)
          LE Transmitter Test (Octet 28 - Bit 5)
          LE Test End (Octet 28 - Bit 6)
          Read Authenticated Payload Timeout (Octet 32 - Bit 4)
          Write Authenticated Payload Timeout (Octet 32 - Bit 5)
          LE Set Data Length (Octet 33 - Bit 6)
          LE Read Suggested Default Data Length (Octet 33 - Bit 7)
          LE Write Suggested Default Data Length (Octet 34 - Bit 0)
          LE Add Device To Resolving List (Octet 34 - Bit 3)
          LE Remove Device From Resolving List (Octet 34 - Bit 4)
          LE Clear Resolving List (Octet 34 - Bit 5)
          LE Read Resolving List Size (Octet 34 - Bit 6)
          LE Set Address Resolution Enable (Octet 35 - Bit 1)
          LE Set Resolvable Private Address Timeout (Octet 35 - Bit 2)
          LE Read Maximum Data Length (Octet 35 - Bit 3)
          LE Read PHY (Octet 35 - Bit 4)
          LE Set Default PHY (Octet 35 - Bit 5)
          LE Set PHY (Octet 35 - Bit 6)
          LE Enhanced Receiver Test (Octet 35 - Bit 7)
          LE Enhanced Transmitter Test (Octet 36 - Bit 0)
          LE Set Advertising Set Random Address (Octet 36 - Bit 1)
          LE Set Extended Advertising Parameters (Octet 36 - Bit 2)
          LE Set Extended Advertising Data (Octet 36 - Bit 3)
          LE Set Extended Scan Response Data (Octet 36 - Bit 4)
          LE Set Extended Advertising Enable (Octet 36 - Bit 5)
          LE Read Maximum Advertising Data Length (Octet 36 - Bit 6)
          LE Read Number of Supported Advertising Sets (Octet 36 - Bit 7)
          LE Remove Advertising Set (Octet 37 - Bit 0)
          LE Clear Advertising Sets (Octet 37 - Bit 1)
          LE Set Periodic Advertising Parameters (Octet 37 - Bit 2)
          LE Set Periodic Advertising Data (Octet 37 - Bit 3)
          LE Set Periodic Advertising Enable (Octet 37 - Bit 4)
          LE Set Extended Scan Parameters (Octet 37 - Bit 5)
          LE Set Extended Scan Enable (Octet 37 - Bit 6)
          LE Extended Create Connection (Octet 37 - Bit 7)
          LE Periodic Advertising Create Sync (Octet 38 - Bit 0)
          LE Periodic Advertising Create Sync Cancel (Octet 38 - Bit 1)
          LE Periodic Advertising Terminate Sync (Octet 38 - Bit 2)
          LE Add Device To Periodic Advertiser List (Octet 38 - Bit 3)
          LE Remove Device From Periodic Advertiser List (Octet 38 - Bit 4)
          LE Clear Periodic Advertiser List (Octet 38 - Bit 5)
          LE Read Periodic Advertiser List Size (Octet 38 - Bit 6)
          LE Read Transmit Power (Octet 38 - Bit 7)
          LE Read RF Path Compensation (Octet 39 - Bit 0)
          LE Write RF Path Compensation (Octet 39 - Bit 1)
          LE Set Privacy Mode (Octet 39 - Bit 2)
          LE Periodic Advertising Receive Enable (Octet 40 - Bit 5)
          LE Periodic Advertising Sync Transfer (Octet 40 - Bit 6)
          LE Periodic Advertising Set Info Transfer (Octet 40 - Bit 7)
          LE Periodic Advertising Sync Transfer Parameters (Octet 41 - Bit 0)
          LE Set Default Periodic Advertisng Sync Transfer Parameters (Octet 41 - Bit 1)
          LE Read Buffer v2 (Octet 41 - Bit 5)
          LE Read ISO TX Sync (Octet 41 - Bit 6)
          LE Set Connected Isochronous Group Parameters (Octet 41 - Bit 7)
          LE Set Connected Isochronous Group Parameters Test (Octet 42 - Bit 0)
          LE Create Connected Isochronous Stream (Octet 42 - Bit 1)
          LE Remove Connected Isochronous Group (Octet 42 - Bit 2)
          LE Accept Connected Isochronous Stream Request (Octet 42 - Bit 3)
          LE Reject Connected Isochronous Stream Request (Octet 42 - Bit 4)
          LE Create Broadcast Isochronous Group (Octet 42 - Bit 5)
          LE Create Broadcast Isochronous Group Test (Octet 42 - Bit 6)
          LE Terminate Broadcast Isochronous Group (Octet 42 - Bit 7)
          LE Broadcast Isochronous Group Create Sync (Octet 43 - Bit 0)
          LE Broadcast Isochronous Group Terminate Sync (Octet 43 - Bit 1)
          LE Request Peer SCA (Octet 43 - Bit 2)
          LE Setup Isochronous Data Path (Octet 43 - Bit 3)
          LE Remove Isochronous Data Path (Octet 43 - Bit 4)
          LE Isochronous Transmit Test (Octet 43 - Bit 5)
          LE Isochronous Receive Test (Octet 43 - Bit 6)
          LE Isochronous Read Test Counters (Octet 43 - Bit 7)
          LE Isochronous Read Test Counters (Octet 44 - Bit 0)
          LE Set Host Feature (Octet 44 - Bit 1)
          Octet 44 - Bit 2 
          Octet 45 - Bit 6 
          Octet 46 - Bit 0 
          Octet 46 - Bit 1 
          Octet 46 - Bit 2 
< HCI Command: Host Buffer Size (0x03|0x0033) plen 7         #9 [hci1] 1.074717
        ACL MTU: 255  ACL max packet: 16
        SCO MTU: 0    SCO max packet: 0
> HCI Event: Command Complete (0x0e) plen 4                 #10 [hci1] 1.075329
      Host Buffer Size (0x03|0x0033) ncmd 1
        Status: Success (0x00)
< HCI Command: Set Controller To Ho.. (0x03|0x0031) plen 1  #11 [hci1] 1.094720
        Flow control: ACL Data Packets (0x01)
> HCI Event: Command Complete (0x0e) plen 4                 #12 [hci1] 1.095167
      Set Controller To Host Flow Control (0x03|0x0031) ncmd 1
        Status: Success (0x00)
< HCI Command: LE Read Local Suppor.. (0x08|0x0003) plen 0  #13 [hci1] 1.114727
> HCI Event: Command Complete (0x0e) plen 12                #14 [hci1] 1.115236
      LE Read Local Supported Features (0x08|0x0003) ncmd 1
        Status: Success (0x00)
        Features: 0xfd 0x79 0x00 0xf7 0x30 0x01 0x00 0x00
          LE Encryption
          Extended Reject Indication
          Peripheral-initiated Features Exchange
          LE Ping
          LE Data Packet Length Extension
          LL Privacy
          Extended Scanner Filter Policies
          LE 2M PHY
          LE Coded PHY
          LE Extended Advertising
          LE Periodic Advertising
          Channel Selection Algorithm #2
          Periodic Advertising Sync Transfer - Sender
          Periodic Advertising Sync Transfer - Recipient
          Sleep Clock Accuracy Updates
          Connected Isochronous Stream - Central
          Connected Isochronous Stream - Peripheral
          Isochronous Broadcaster
          Synchronized Receiver
          Periodic Advertising ADI support
          Connection Subrating
          Unknown features (0x0000010000000000)
< HCI Command: LE Set Host Feature (0x08|0x0074) plen 2     #15 [hci1] 1.134687
        Bit Number: 32
          Connected Isochronous Stream (Host Support)
        Bit Value: 1
> HCI Event: Command Complete (0x0e) plen 4                 #16 [hci1] 1.135305
      LE Set Host Feature (0x08|0x0074) ncmd 1
        Status: Success (0x00)
< HCI Command: LE Read Buffer v2 (0x08|0x0060) plen 0       #17 [hci1] 1.154710
> HCI Event: Command Complete (0x0e) plen 10                #18 [hci1] 1.155246
      LE Read Buffer v2 (0x08|0x0060) ncmd 1
        Status: Success (0x00)
        ACL MTU: 27
        ACL max packet: 3
        ISO MTU: 318
        ISO max packet: 3
< HCI Command: LE Read Maximum Adve.. (0x08|0x003a) plen 0  #19 [hci1] 1.174710
> HCI Event: Command Complete (0x0e) plen 6                 #20 [hci1] 1.175259
      LE Read Maximum Advertising Data Length (0x08|0x003a) ncmd 1
        Status: Success (0x00)
        Max length: 1650
< HCI Command: LE Read Supported St.. (0x08|0x001c) plen 0  #21 [hci1] 1.194709
> HCI Event: Command Complete (0x0e) plen 12                #22 [hci1] 1.195223
      LE Read Supported States (0x08|0x001c) ncmd 1
        Status: Success (0x00)
        States: 0x000003ff3e0306ff
          Non-connectable Advertising State
          Scannable Advertising State
          Connectable Advertising State
          High Duty Cycle Directed Advertising State
          Passive Scanning State
          Active Scanning State
          Initiating State
            and Connection State (Central Role)
          Connection State (Peripheral Role)
          Scannable Advertising State
            and Passive Scanning State
          Connectable Advertising State
            and Passive Scanning State
          Non-connectable Advertising State
            and Initiating State
          Scannable Advertising State
            and Initiating State
          Active Scanning State
            and Connection State (Central Role)
          Passive Scanning State
            and Connection State (Peripheral Role)
          Active Scanning State
            and Connection State (Peripheral Role)
          Initiating State
            and Connection State (Central Role)
            and Central Role & Central Role
          Low Duty Cycle Directed Advertising State
          Connectable Advertising State
            and Initiating State
            and Central Role & Peripheral Role
          High Duty Cycle Directed Advertising State
            and Initiating State
            and Central Role & Peripheral Role
          Low Duty Cycle Directed Advertising State
            and Initiating State
            and Central Role & Peripheral Role
          Connectable Advertising State
            and Connection State (Central Role)
            and Central Role & Peripheral Role
          High Duty Cycle Directed Advertising State
            and Connection State (Central Role)
            and Central Role & Peripheral Role
          Low Duty Cycle Directed Advertising State
            and Connection State (Central Role)
            and Central Role & Peripheral Role
          Connectable Advertising State
            and Connection State (Peripheral Role)
            and Central Role & Peripheral Role
          High Duty Cycle Directed Advertising State
            and Connection State (Peripheral Role)
            and Peripheral Role & Peripheral Role
          Low Duty Cycle Directed Advertising State
            and Connection State (Peripheral Role)
            and Peripheral Role & Peripheral Role
          Initiating State
            and Connection State (Peripheral Role)
            and Central Role & Peripheral Role
< HCI Command: LE Read Maximum Data.. (0x08|0x002f) plen 0  #23 [hci1] 1.214706
> HCI Event: Command Complete (0x0e) plen 12                #24 [hci1] 1.215307
      LE Read Maximum Data Length (0x08|0x002f) ncmd 1
        Status: Success (0x00)
        Max TX octets: 251
        Max TX time: 2704
        Max RX octets: 251
        Max RX time: 2704
< HCI Command: LE Write Suggested D.. (0x08|0x0024) plen 4  #25 [hci1] 1.234708
        TX octets: 251
        TX time: 2704
> HCI Event: Command Complete (0x0e) plen 4                 #26 [hci1] 1.235268
      LE Write Suggested Default Data Length (0x08|0x0024) ncmd 1
        Status: Success (0x00)
< HCI Command: LE Set Resolvable Pr.. (0x08|0x002e) plen 2  #27 [hci1] 1.254727
        Timeout: 900 seconds
> HCI Event: Command Complete (0x0e) plen 4                 #28 [hci1] 1.255207
      LE Set Resolvable Private Address Timeout (0x08|0x002e) ncmd 1
        Status: Success (0x00)
< HCI Command: LE Read Resolving Li.. (0x08|0x002a) plen 0  #29 [hci1] 1.274706
> HCI Event: Command Complete (0x0e) plen 5                 #30 [hci1] 1.275260
      LE Read Resolving List Size (0x08|0x002a) ncmd 1
        Status: Success (0x00)
        Size: 8
< HCI Command: LE Set Event Mask (0x08|0x0001) plen 8       #31 [hci1] 1.294616
        Mask: 0x000002023f87fa5e
          LE Advertising Report
          LE Connection Update Complete
          LE Read Remote Used Features Complete
          LE Long Term Key Request
          LE Data Length Change
          LE Enhanced Connection Complete
          LE PHY Update Complete
          LE Extended Advertising Report
          LE Periodic Advertising Sync Established
          LE Periodic Advertising Report
          LE Periodic Advertising Sync Lost
          LE Extended Scan Timeout
          LE Extended Advertising Set Terminated
          LE Scan Request Received
          LE Periodic Advertising Sync Transfer Rvc
          LE CIS Established
          LE CIS Request
          LE Create BIG Complete
          LE Terminate BIG Complete
          LE BIG Sync Estabilished Complete
          LE BIG Sync Lost
          LE BIG Info Advertising Report
          Unknown mask (0x0000020000000000)
> HCI Event: Command Complete (0x0e) plen 4                 #32 [hci1] 1.295190
      LE Set Event Mask (0x08|0x0001) ncmd 1
        Status: Success (0x00)
< HCI Command: Set Event Mask (0x03|0x0001) plen 8          #33 [hci1] 1.314749
        Mask: 0x2000800002008890
          Disconnection Complete
          Encryption Change
          Read Remote Version Information Complete
          Hardware Error
          Data Buffer Overflow
          Encryption Key Refresh Complete
          LE Meta
> HCI Event: Command Complete (0x0e) plen 4                 #34 [hci1] 1.315329
      Set Event Mask (0x03|0x0001) ncmd 1
        Status: Success (0x00)
< HCI Command: Read BD ADDR (0x04|0x0009) plen 0            #35 [hci1] 1.334718
> HCI Event: Command Complete (0x0e) plen 10                #36 [hci1] 1.335241
      Read BD ADDR (0x04|0x0009) ncmd 1
        Status: Success (0x00)
        Address: 00:00:00:00:00:00 (OUI 00-00-00)
< HCI Command: LE Set Random Address (0x08|0x0005) plen 6   #37 [hci1] 1.354724
        Address: D5:B6:CC:31:DB:3B (Static)
> HCI Event: Command Complete (0x0e) plen 4                 #38 [hci1] 1.355270
      LE Set Random Address (0x08|0x0005) ncmd 1
        Status: Success (0x00)
< HCI Command: LE Set Random Address (0x08|0x0005) plen 6   #39 [hci1] 1.494770
        Address: 48:61:8E:DB:C6:F9 (Resolvable)
> HCI Event: Command Complete (0x0e) plen 4                 #40 [hci1] 1.495337
      LE Set Random Address (0x08|0x0005) ncmd 1
        Status: Success (0x00)
< HCI Command: LE Set Extended Adv.. (0x08|0x0036) plen 25  #41 [hci1] 5.244779
        Handle: 0x00
        Properties: 0x0013
          Connectable
          Scannable
          Use legacy advertising PDUs: ADV_IND
        Min advertising interval: 100.000 msec (0x00a0)
        Max advertising interval: 150.000 msec (0x00f0)
        Channel map: 37, 38, 39 (0x07)
        Own address type: Random (0x01)
        Peer address type: Public (0x00)
        Peer address: 00:00:00:00:00:00 (OUI 00-00-00)
        Filter policy: Allow Scan Request from Any, Allow Connect Request from Any (0x00)
        TX power: Host has no preference (0x7f)
        Primary PHY: LE 1M (0x01)
        Secondary max skip: 0x00
        Secondary PHY: LE 1M (0x01)
        SID: 0x00
        Scan request notifications: Disabled (0x00)
> HCI Event: Command Complete (0x0e) plen 5                 #42 [hci1] 5.245575
      LE Set Extended Advertising Parameters (0x08|0x0036) ncmd 1
        Status: Success (0x00)
        TX power (selected): 0 dbm (0x00)
< HCI Command: LE Set Advertising S.. (0x08|0x0035) plen 7  #43 [hci1] 5.254760
        Advertising handle: 0x00
        Advertising random address: D5:B6:CC:31:DB:3B (Static)
> HCI Event: Command Complete (0x0e) plen 4                 #44 [hci1] 5.255344
      LE Set Advertising Set Random Address (0x08|0x0035) ncmd 1
        Status: Success (0x00)
< HCI Command: LE Set Extended Adv.. (0x08|0x0037) plen 22  #45 [hci1] 5.274774
        Handle: 0x00
        Operation: Complete extended advertising data (0x03)
        Fragment preference: Minimize fragmentation (0x01)
        Data length: 0x12
        Flags: 0x04
          BR/EDR Not Supported
        Name (complete): Tester_F6B11A
> HCI Event: Command Complete (0x0e) plen 4                 #46 [hci1] 5.275458
      LE Set Extended Advertising Data (0x08|0x0037) ncmd 1
        Status: Success (0x00)
< HCI Command: LE Set Extended Scan.. (0x08|0x0038) plen 4  #47 [hci1] 5.294777
        Handle: 0x00
        Operation: Complete scan response data (0x03)
        Fragment preference: Minimize fragmentation (0x01)
        Data length: 0x00
> HCI Event: Command Complete (0x0e) plen 4                 #48 [hci1] 5.295291
      LE Set Extended Scan Response Data (0x08|0x0038) ncmd 1
        Status: Success (0x00)
< HCI Command: LE Set Extended Adve.. (0x08|0x0039) plen 6  #49 [hci1] 5.314769
        Extended advertising: Enabled (0x01)
        Number of sets: 1 (0x01)
        Entry 0
          Handle: 0x00
          Duration: 0 ms (0x00)
          Max ext adv events: 0
> HCI Event: Command Complete (0x0e) plen 4                 #50 [hci1] 5.315389
      LE Set Extended Advertising Enable (0x08|0x0039) ncmd 1
        Status: Success (0x00)
> HCI Event: LE Meta Event (0x3e) plen 31                   #51 [hci1] 5.942723
      LE Enhanced Connection Complete (0x0a)
        Status: Success (0x00)
        Handle: 2631
        Role: Peripheral (0x01)
        Peer address type: Public (0x00)
        Peer address: DF:A9:FF:F6:B1:1A (OUI DF-A9-FF)
        Local resolvable private address: 00:00:00:00:00:00 (Non-Resolvable)
        Peer resolvable private address: 00:00:00:00:00:00 (Non-Resolvable)
        Connection interval: 87.50 msec (0x0046)
        Connection latency: 0 (0x0000)
        Supervision timeout: 20000 msec (0x07d0)
        Central clock accuracy: 0x01
> HCI Event: LE Meta Event (0x3e) plen 6                    #52 [hci1] 5.942870
      LE Advertising Set Terminated (0x12)
        Status: Success (0x00)
        Handle: 0
        Connection handle: 2631
        Number of completed extended advertising events: 0
< HCI Command: LE Read Remote Used... (0x08|0x0016) plen 2  #53 [hci1] 5.955634
        Handle: 2631 Address: DF:A9:FF:F6:B1:1A (OUI DF-A9-FF)
> HCI Event: Command Status (0x0f) plen 4                   #54 [hci1] 5.956301
      LE Read Remote Used Features (0x08|0x0016) ncmd 1
        Status: Success (0x00)
> HCI Event: LE Meta Event (0x3e) plen 12                   #55 [hci1] 6.206555
      LE Read Remote Used Features (0x04)
        Status: Success (0x00)
        Handle: 2631 Address: DF:A9:FF:F6:B1:1A (OUI DF-A9-FF)
        Features: 0x2d 0x49 0x00 0xf7 0x67 0xd9 0x00 0x80
          LE Encryption
          Extended Reject Indication
          Peripheral-initiated Features Exchange
          LE Data Packet Length Extension
          LE 2M PHY
          LE Coded PHY
          Channel Selection Algorithm #2
          Periodic Advertising Sync Transfer - Sender
          Periodic Advertising Sync Transfer - Recipient
          Sleep Clock Accuracy Updates
          Connected Isochronous Stream - Central
          Connected Isochronous Stream - Peripheral
          Isochronous Broadcaster
          Synchronized Receiver
          Connected Isochronous Stream (Host Support)
          LE Power Control Request
          LE Power Control Request
          Connection Subrating
          Connection Subrating (Host Support)
          Unknown features (0x8000d90000000000)
> ACL Data RX: Handle 2631 flags 0x02 dlen 11               #56 [hci1] 6.643849
      ATT: Read By Group Type Request (0x10) len 6
        Handle range: 0x0001-0xffff
        Attribute group type: Primary Service (0x2800)
< HCI Command: Host Number of Compl.. (0x03|0x0035) plen 5  #57 [hci1] 6.655333
        Num handles: 1
        Handle: 2631 Address: DF:A9:FF:F6:B1:1A (OUI DF-A9-FF)
        Count: 1
< ACL Data TX: Handle 2631 flags 0x00 dlen 24               #58 [hci1] 6.655409
      ATT: Read By Group Type Response (0x11) len 19
        Attribute data length: 6
        Attribute group list: 3 entries
        Handle range: 0x0001-0x000a
        UUID: Generic Attribute Profile (0x1801)
        Handle range: 0x000b-0x0013
        UUID: Generic Access Profile (0x1800)
        Handle range: 0x0014-0x0028
        UUID: Device Information (0x180a)
> HCI Event: Number of Completed Packets (0x13) plen 5      #59 [hci1] 6.818787
        Num handles: 1
        Handle: 2631 Address: DF:A9:FF:F6:B1:1A (OUI DF-A9-FF)
        Count: 1
        #58: len 24 (1 Kb/s)
        Latency: 163 msec (163-163 msec ~163 msec)
> ACL Data RX: Handle 2631 flags 0x02 dlen 11               #60 [hci1] 6.818948
      ATT: Read By Group Type Request (0x10) len 6
        Handle range: 0x0029-0xffff
        Attribute group type: Primary Service (0x2800)
< HCI Command: Host Number of Compl.. (0x03|0x0035) plen 5  #61 [hci1] 6.835338
        Num handles: 1
        Handle: 2631 Address: DF:A9:FF:F6:B1:1A (OUI DF-A9-FF)
        Count: 1
< ACL Data TX: Handle 2631 flags 0x00 dlen 12               #62 [hci1] 6.835414
      ATT: Read By Group Type Response (0x11) len 7
        Attribute data length: 6
        Attribute group list: 1 entry
        Handle range: 0x0029-0x002f
        UUID: Unknown (0xaa51)
> HCI Event: Number of Completed Packets (0x13) plen 5      #63 [hci1] 6.993868
        Num handles: 1
        Handle: 2631 Address: DF:A9:FF:F6:B1:1A (OUI DF-A9-FF)
        Count: 1
        #62: len 12 (0 Kb/s)
        Latency: 158 msec (158-163 msec ~160 msec)
> ACL Data RX: Handle 2631 flags 0x02 dlen 11               #64 [hci1] 6.993975
      ATT: Read By Group Type Request (0x10) len 6
        Handle range: 0x0030-0xffff
        Attribute group type: Primary Service (0x2800)
< HCI Command: Host Number of Compl.. (0x03|0x0035) plen 5  #65 [hci1] 6.995368
        Num handles: 1
        Handle: 2631 Address: DF:A9:FF:F6:B1:1A (OUI DF-A9-FF)
        Count: 1
< ACL Data TX: Handle 2631 flags 0x00 dlen 9                #66 [hci1] 6.995585
      ATT: Error Response (0x01) len 4
        Read By Group Type Request (0x10)
        Handle: 0x0030
        Error: Attribute Not Found (0x0a)
> HCI Event: Number of Completed Packets (0x13) plen 5      #67 [hci1] 7.168778
        Num handles: 1
        Handle: 2631 Address: DF:A9:FF:F6:B1:1A (OUI DF-A9-FF)
        Count: 1
        #66: len 9 (0 Kb/s)
        Latency: 173 msec (158-173 msec ~167 msec)
> ACL Data RX: Handle 2631 flags 0x02 dlen 11               #68 [hci1] 7.168957
      ATT: Read By Type Request (0x08) len 6
        Handle range: 0x0001-0x000a
        Attribute type: Characteristic (0x2803)
< HCI Command: Host Number of Compl.. (0x03|0x0035) plen 5  #69 [hci1] 7.175039
        Num handles: 1
        Handle: 2631 Address: DF:A9:FF:F6:B1:1A (OUI DF-A9-FF)
        Count: 1
< ACL Data TX: Handle 2631 flags 0x00 dlen 20               #70 [hci1] 7.175069
      ATT: Read By Type Response (0x09) len 15
        Attribute data length: 7
        Attribute data list: 2 entries
        Handle: 0x0002
        Value: 200300052a
            Properties: 0x20
              Indicate (0x20)
            Value Handle: 0x0003
            Value UUID: Service Changed (0x2a05)
        Handle: 0x0005
        Value: 0a0600292b
            Properties: 0x0a
              Read (0x02)
              Write (0x08)
            Value Handle: 0x0006
            Value UUID: Client Supported Features (0x2b29)
> HCI Event: Number of Completed Packets (0x13) plen 5      #71 [hci1] 7.343852
        Num handles: 1
        Handle: 2631 Address: DF:A9:FF:F6:B1:1A (OUI DF-A9-FF)
        Count: 1
        #70: len 20 (0 Kb/s)
        Latency: 168 msec (158-173 msec ~167 msec)
> ACL Data RX: Handle 2631 flags 0x02 dlen 11               #72 [hci1] 7.344054
      ATT: Read By Type Request (0x08) len 6
        Handle range: 0x0006-0x000a
        Attribute type: Characteristic (0x2803)
< HCI Command: Host Number of Compl.. (0x03|0x0035) plen 5  #73 [hci1] 7.355171
        Num handles: 1
        Handle: 2631 Address: DF:A9:FF:F6:B1:1A (OUI DF-A9-FF)
        Count: 1
< ACL Data TX: Handle 2631 flags 0x00 dlen 20               #74 [hci1] 7.355285
      ATT: Read By Type Response (0x09) len 15
        Attribute data length: 7
        Attribute data list: 2 entries
        Handle: 0x0007
        Value: 0208002a2b
            Properties: 0x02
              Read (0x02)
            Value Handle: 0x0008
            Value UUID: Database Hash (0x2b2a)
        Handle: 0x0009
        Value: 020a003a2b
            Properties: 0x02
              Read (0x02)
            Value Handle: 0x000a
            Value UUID: Server Supported Features (0x2b3a)
> HCI Event: Number of Completed Packets (0x13) plen 5      #75 [hci1] 7.518791
        Num handles: 1
        Handle: 2631 Address: DF:A9:FF:F6:B1:1A (OUI DF-A9-FF)
        Count: 1
        #74: len 20 (0 Kb/s)
        Latency: 163 msec (158-173 msec ~165 msec)
> ACL Data RX: Handle 2631 flags 0x02 dlen 11               #76 [hci1] 7.518981
      ATT: Read By Type Request (0x08) len 6
        Handle range: 0x000a-0x000a
        Attribute type: Characteristic (0x2803)
< HCI Command: Host Number of Compl.. (0x03|0x0035) plen 5  #77 [hci1] 7.535313
        Num handles: 1
        Handle: 2631 Address: DF:A9:FF:F6:B1:1A (OUI DF-A9-FF)
        Count: 1
< ACL Data TX: Handle 2631 flags 0x00 dlen 9                #78 [hci1] 7.535505
      ATT: Error Response (0x01) len 4
        Read By Type Request (0x08)
        Handle: 0x000a
        Error: Attribute Not Found (0x0a)
> HCI Event: Number of Completed Packets (0x13) plen 5      #79 [hci1] 7.693740
        Num handles: 1
        Handle: 2631 Address: DF:A9:FF:F6:B1:1A (OUI DF-A9-FF)
        Count: 1
        #78: len 9 (0 Kb/s)
        Latency: 158 msec (158-173 msec ~161 msec)
> ACL Data RX: Handle 2631 flags 0x02 dlen 9                #80 [hci1] 7.693879
      ATT: Find Information Request (0x04) len 4
        Handle range: 0x0004-0x0004
< HCI Command: Host Number of Compl.. (0x03|0x0035) plen 5  #81 [hci1] 7.695399
        Num handles: 1
        Handle: 2631 Address: DF:A9:FF:F6:B1:1A (OUI DF-A9-FF)
        Count: 1
< ACL Data TX: Handle 2631 flags 0x00 dlen 10               #82 [hci1] 7.695532
      ATT: Find Information Response (0x05) len 5
        Format: UUID-16 (0x01)
        Handle: 0x0004
        UUID: Client Characteristic Configuration (0x2902)
> HCI Event: Number of Completed Packets (0x13) plen 5      #83 [hci1] 7.868716
        Num handles: 1
        Handle: 2631 Address: DF:A9:FF:F6:B1:1A (OUI DF-A9-FF)
        Count: 1
        #82: len 10 (0 Kb/s)
        Latency: 173 msec (158-173 msec ~167 msec)
> ACL Data RX: Handle 2631 flags 0x02 dlen 11               #84 [hci1] 7.868860
      ATT: Read By Type Request (0x08) len 6
        Handle range: 0x000b-0x0013
        Attribute type: Characteristic (0x2803)
< HCI Command: Host Number of Compl.. (0x03|0x0035) plen 5  #85 [hci1] 7.875089
        Num handles: 1
        Handle: 2631 Address: DF:A9:FF:F6:B1:1A (OUI DF-A9-FF)
        Count: 1
< ACL Data TX: Handle 2631 flags 0x00 dlen 20               #86 [hci1] 7.875131
      ATT: Read By Type Response (0x09) len 15
        Attribute data length: 7
        Attribute data list: 2 entries
        Handle: 0x000c
        Value: 0a0d00002a
            Properties: 0x0a
              Read (0x02)
              Write (0x08)
            Value Handle: 0x000d
            Value UUID: Device Name (0x2a00)
        Handle: 0x000e
        Value: 0a0f00012a
            Properties: 0x0a
              Read (0x02)
              Write (0x08)
            Value Handle: 0x000f
            Value UUID: Appearance (0x2a01)
> HCI Event: Number of Completed Packets (0x13) plen 5      #87 [hci1] 8.043817
        Num handles: 1
        Handle: 2631 Address: DF:A9:FF:F6:B1:1A (OUI DF-A9-FF)
        Count: 1
        #86: len 20 (0 Kb/s)
        Latency: 168 msec (158-173 msec ~168 msec)
> ACL Data RX: Handle 2631 flags 0x02 dlen 11               #88 [hci1] 8.043985
      ATT: Read By Type Request (0x08) len 6
        Handle range: 0x000f-0x0013
        Attribute type: Characteristic (0x2803)
< HCI Command: Host Number of Compl.. (0x03|0x0035) plen 5  #89 [hci1] 8.055428
        Num handles: 1
        Handle: 2631 Address: DF:A9:FF:F6:B1:1A (OUI DF-A9-FF)
        Count: 1
< ACL Data TX: Handle 2631 flags 0x00 dlen 20               #90 [hci1] 8.055528
      ATT: Read By Type Response (0x09) len 15
        Attribute data length: 7
        Attribute data list: 2 entries
        Handle: 0x0010
        Value: 021100a62a
            Properties: 0x02
              Read (0x02)
            Value Handle: 0x0011
            Value UUID: Central Address Resolution (0x2aa6)
        Handle: 0x0012
        Value: 021300042a
            Properties: 0x02
              Read (0x02)
            Value Handle: 0x0013
            Value UUID: Peripheral Preferred Connection Parameters (0x2a04)
> HCI Event: Number of Completed Packets (0x13) plen 5      #91 [hci1] 8.218797
        Num handles: 1
        Handle: 2631 Address: DF:A9:FF:F6:B1:1A (OUI DF-A9-FF)
        Count: 1
        #90: len 20 (0 Kb/s)
        Latency: 163 msec (158-173 msec ~165 msec)
> ACL Data RX: Handle 2631 flags 0x02 dlen 11               #92 [hci1] 8.218933
      ATT: Read By Type Request (0x08) len 6
        Handle range: 0x0013-0x0013
        Attribute type: Characteristic (0x2803)
< HCI Command: Host Number of Compl.. (0x03|0x0035) plen 5  #93 [hci1] 8.235382
        Num handles: 1
        Handle: 2631 Address: DF:A9:FF:F6:B1:1A (OUI DF-A9-FF)
        Count: 1
< ACL Data TX: Handle 2631 flags 0x00 dlen 9                #94 [hci1] 8.235534
      ATT: Error Response (0x01) len 4
        Read By Type Request (0x08)
        Handle: 0x0013
        Error: Attribute Not Found (0x0a)
> HCI Event: Number of Completed Packets (0x13) plen 5      #95 [hci1] 8.393827
        Num handles: 1
        Handle: 2631 Address: DF:A9:FF:F6:B1:1A (OUI DF-A9-FF)
        Count: 1
        #94: len 9 (0 Kb/s)
        Latency: 158 msec (158-173 msec ~161 msec)
> ACL Data RX: Handle 2631 flags 0x02 dlen 11               #96 [hci1] 8.394011
      ATT: Read By Type Request (0x08) len 6
        Handle range: 0x0014-0x0028
        Attribute type: Characteristic (0x2803)
< HCI Command: Host Number of Compl.. (0x03|0x0035) plen 5  #97 [hci1] 8.395342
        Num handles: 1
        Handle: 2631 Address: DF:A9:FF:F6:B1:1A (OUI DF-A9-FF)
        Count: 1
< ACL Data TX: Handle 2631 flags 0x00 dlen 20               #98 [hci1] 8.395442
      ATT: Read By Type Response (0x09) len 15
        Attribute data length: 7
        Attribute data list: 2 entries
        Handle: 0x0015
        Value: 021600242a
            Properties: 0x02
              Read (0x02)
            Value Handle: 0x0016
            Value UUID: Model Number String (0x2a24)
        Handle: 0x0017
        Value: 021800292a
            Properties: 0x02
              Read (0x02)
            Value Handle: 0x0018
            Value UUID: Manufacturer Name String (0x2a29)
> HCI Event: Number of Completed Packets (0x13) plen 5      #99 [hci1] 8.568696
        Num handles: 1
        Handle: 2631 Address: DF:A9:FF:F6:B1:1A (OUI DF-A9-FF)
        Count: 1
        #98: len 20 (0 Kb/s)
        Latency: 173 msec (158-173 msec ~167 msec)
> ACL Data RX: Handle 2631 flags 0x02 dlen 11              #100 [hci1] 8.568882
      ATT: Read By Type Request (0x08) len 6
        Handle range: 0x0018-0x0028
        Attribute type: Characteristic (0x2803)
< HCI Command: Host Number of Comp.. (0x03|0x0035) plen 5  #101 [hci1] 8.575349
        Num handles: 1
        Handle: 2631 Address: DF:A9:FF:F6:B1:1A (OUI DF-A9-FF)
        Count: 1
< ACL Data TX: Handle 2631 flags 0x00 dlen 20              #102 [hci1] 8.575428
      ATT: Read By Type Response (0x09) len 15
        Attribute data length: 7
        Attribute data list: 2 entries
        Handle: 0x0019
        Value: 021a00502a
            Properties: 0x02
              Read (0x02)
            Value Handle: 0x001a
            Value UUID: PnP ID (0x2a50)
        Handle: 0x001b
        Value: 021c00252a
            Properties: 0x02
              Read (0x02)
            Value Handle: 0x001c
            Value UUID: Serial Number String (0x2a25)
> HCI Event: Number of Completed Packets (0x13) plen 5     #103 [hci1] 8.743703
        Num handles: 1
        Handle: 2631 Address: DF:A9:FF:F6:B1:1A (OUI DF-A9-FF)
        Count: 1
        #102: len 20 (0 Kb/s)
        Latency: 168 msec (158-173 msec ~167 msec)
> ACL Data RX: Handle 2631 flags 0x02 dlen 11              #104 [hci1] 8.743925
      ATT: Read By Type Request (0x08) len 6
        Handle range: 0x001c-0x0028
        Attribute type: Characteristic (0x2803)
< HCI Command: Host Number of Comp.. (0x03|0x0035) plen 5  #105 [hci1] 8.755089
        Num handles: 1
        Handle: 2631 Address: DF:A9:FF:F6:B1:1A (OUI DF-A9-FF)
        Count: 1
< ACL Data TX: Handle 2631 flags 0x00 dlen 20              #106 [hci1] 8.755141
      ATT: Read By Type Response (0x09) len 15
        Attribute data length: 7
        Attribute data list: 2 entries
        Handle: 0x001d
        Value: 021e00262a
            Properties: 0x02
              Read (0x02)
            Value Handle: 0x001e
            Value UUID: Firmware Revision String (0x2a26)
        Handle: 0x001f
        Value: 022000272a
            Properties: 0x02
              Read (0x02)
            Value Handle: 0x0020
            Value UUID: Hardware Revision String (0x2a27)
> HCI Event: Number of Completed Packets (0x13) plen 5     #107 [hci1] 8.918700
        Num handles: 1
        Handle: 2631 Address: DF:A9:FF:F6:B1:1A (OUI DF-A9-FF)
        Count: 1
        #106: len 20 (0 Kb/s)
        Latency: 163 msec (158-173 msec ~165 msec)
> ACL Data RX: Handle 2631 flags 0x02 dlen 11              #108 [hci1] 8.918848
      ATT: Read By Type Request (0x08) len 6
        Handle range: 0x0020-0x0028
        Attribute type: Characteristic (0x2803)
< HCI Command: Host Number of Comp.. (0x03|0x0035) plen 5  #109 [hci1] 8.935221
        Num handles: 1
        Handle: 2631 Address: DF:A9:FF:F6:B1:1A (OUI DF-A9-FF)
        Count: 1
< ACL Data TX: Handle 2631 flags 0x00 dlen 20              #110 [hci1] 8.935247
      ATT: Read By Type Response (0x09) len 15
        Attribute data length: 7
        Attribute data list: 2 entries
        Handle: 0x0021
        Value: 022200282a
            Properties: 0x02
              Read (0x02)
            Value Handle: 0x0022
            Value UUID: Software Revision String (0x2a28)
        Handle: 0x0023
        Value: 022400ff2b
            Properties: 0x02
              Read (0x02)
            Value Handle: 0x0024
            Value UUID: Unknown (0x2bff)
> HCI Event: Number of Completed Packets (0x13) plen 5     #111 [hci1] 9.093755
        Num handles: 1
        Handle: 2631 Address: DF:A9:FF:F6:B1:1A (OUI DF-A9-FF)
        Count: 1
        #110: len 20 (1 Kb/s)
        Latency: 158 msec (158-173 msec ~162 msec)
> ACL Data RX: Handle 2631 flags 0x02 dlen 11              #112 [hci1] 9.093887
      ATT: Read By Type Request (0x08) len 6
        Handle range: 0x0024-0x0028
        Attribute type: Characteristic (0x2803)
< HCI Command: Host Number of Comp.. (0x03|0x0035) plen 5  #113 [hci1] 9.095280
        Num handles: 1
        Handle: 2631 Address: DF:A9:FF:F6:B1:1A (OUI DF-A9-FF)
        Count: 1
< ACL Data TX: Handle 2631 flags 0x00 dlen 20              #114 [hci1] 9.095363
      ATT: Read By Type Response (0x09) len 15
        Attribute data length: 7
        Attribute data list: 2 entries
        Handle: 0x0025
        Value: 022600232a
            Properties: 0x02
              Read (0x02)
            Value Handle: 0x0026
            Value UUID: System ID (0x2a23)
        Handle: 0x0027
        Value: 0228002a2a
            Properties: 0x02
              Read (0x02)
            Value Handle: 0x0028
            Value UUID: IEEE 11073-20601 Regulatory Cert. Data List (0x2a2a)
> HCI Event: Number of Completed Packets (0x13) plen 5     #115 [hci1] 9.268759
        Num handles: 1
        Handle: 2631 Address: DF:A9:FF:F6:B1:1A (OUI DF-A9-FF)
        Count: 1
        #114: len 20 (0 Kb/s)
        Latency: 173 msec (158-173 msec ~167 msec)
> ACL Data RX: Handle 2631 flags 0x02 dlen 11              #116 [hci1] 9.268937
      ATT: Read By Type Request (0x08) len 6
        Handle range: 0x0028-0x0028
        Attribute type: Characteristic (0x2803)
< HCI Command: Host Number of Comp.. (0x03|0x0035) plen 5  #117 [hci1] 9.275240
        Num handles: 1
        Handle: 2631 Address: DF:A9:FF:F6:B1:1A (OUI DF-A9-FF)
        Count: 1
< ACL Data TX: Handle 2631 flags 0x00 dlen 9               #118 [hci1] 9.275382
      ATT: Error Response (0x01) len 4
        Read By Type Request (0x08)
        Handle: 0x0028
        Error: Attribute Not Found (0x0a)
> HCI Event: Number of Completed Packets (0x13) plen 5     #119 [hci1] 9.443694
        Num handles: 1
        Handle: 2631 Address: DF:A9:FF:F6:B1:1A (OUI DF-A9-FF)
        Count: 1
        #118: len 9 (0 Kb/s)
        Latency: 168 msec (158-173 msec ~168 msec)
> ACL Data RX: Handle 2631 flags 0x02 dlen 11              #120 [hci1] 9.443960
      ATT: Read By Type Request (0x08) len 6
        Handle range: 0x0029-0x002f
        Attribute type: Characteristic (0x2803)
< HCI Command: Host Number of Comp.. (0x03|0x0035) plen 5  #121 [hci1] 9.455030
        Num handles: 1
        Handle: 2631 Address: DF:A9:FF:F6:B1:1A (OUI DF-A9-FF)
        Count: 1
< ACL Data TX: Handle 2631 flags 0x00 dlen 20              #122 [hci1] 9.455065
      ATT: Read By Type Response (0x09) len 15
        Attribute data length: 7
        Attribute data list: 2 entries
        Handle: 0x002a
        Value: 022b0052aa
            Properties: 0x02
              Read (0x02)
            Value Handle: 0x002b
            Value UUID: Unknown (0xaa52)
        Handle: 0x002c
        Value: 022d0053aa
            Properties: 0x02
              Read (0x02)
            Value Handle: 0x002d
            Value UUID: Unknown (0xaa53)
> HCI Event: Number of Completed Packets (0x13) plen 5     #123 [hci1] 9.618740
        Num handles: 1
        Handle: 2631 Address: DF:A9:FF:F6:B1:1A (OUI DF-A9-FF)
        Count: 1
        #122: len 20 (0 Kb/s)
        Latency: 163 msec (158-173 msec ~165 msec)
> ACL Data RX: Handle 2631 flags 0x02 dlen 11              #124 [hci1] 9.618849
      ATT: Read By Type Request (0x08) len 6
        Handle range: 0x002d-0x002f
        Attribute type: Characteristic (0x2803)
< HCI Command: Host Number of Comp.. (0x03|0x0035) plen 5  #125 [hci1] 9.634903
        Num handles: 1
        Handle: 2631 Address: DF:A9:FF:F6:B1:1A (OUI DF-A9-FF)
        Count: 1
< ACL Data TX: Handle 2631 flags 0x00 dlen 13              #126 [hci1] 9.634983
      ATT: Read By Type Response (0x09) len 8
        Attribute data length: 7
        Attribute data list: 1 entry
        Handle: 0x002e
        Value: 0a2f0055aa
            Properties: 0x0a
              Read (0x02)
              Write (0x08)
            Value Handle: 0x002f
            Value UUID: Unknown (0xaa55)
> HCI Event: Number of Completed Packets (0x13) plen 5     #127 [hci1] 9.793734
        Num handles: 1
        Handle: 2631 Address: DF:A9:FF:F6:B1:1A (OUI DF-A9-FF)
        Count: 1
        #126: len 13 (0 Kb/s)
        Latency: 158 msec (158-173 msec ~162 msec)
> ACL Data RX: Handle 2631 flags 0x02 dlen 11              #128 [hci1] 9.793998
      ATT: Read By Type Request (0x08) len 6
        Handle range: 0x002f-0x002f
        Attribute type: Characteristic (0x2803)
< HCI Command: Host Number of Comp.. (0x03|0x0035) plen 5  #129 [hci1] 9.795079
        Num handles: 1
        Handle: 2631 Address: DF:A9:FF:F6:B1:1A (OUI DF-A9-FF)
        Count: 1
< ACL Data TX: Handle 2631 flags 0x00 dlen 9               #130 [hci1] 9.795133
      ATT: Error Response (0x01) len 4
        Read By Type Request (0x08)
        Handle: 0x002f
        Error: Attribute Not Found (0x0a)
> HCI Event: Number of Completed Packets (0x13) plen 5     #131 [hci1] 9.968699
        Num handles: 1
        Handle: 2631 Address: DF:A9:FF:F6:B1:1A (OUI DF-A9-FF)
        Count: 1
        #130: len 9 (0 Kb/s)
        Latency: 173 msec (158-173 msec ~167 msec)
> ACL Data RX: Handle 2631 flags 0x02 dlen 11              #132 [hci1] 9.968862
      ATT: Read By Type Request (0x08) len 6
        Handle range: 0x0001-0xffff
        Attribute type: Include (0x2802)
< HCI Command: Host Number of Comp.. (0x03|0x0035) plen 5  #133 [hci1] 9.975604
        Num handles: 1
        Handle: 2631 Address: DF:A9:FF:F6:B1:1A (OUI DF-A9-FF)
        Count: 1
< ACL Data TX: Handle 2631 flags 0x00 dlen 9               #134 [hci1] 9.975775
      ATT: Error Response (0x01) len 4
        Read By Type Request (0x08)
        Handle: 0x0001
        Error: Attribute Not Found (0x0a)
> HCI Event: Number of Completed Packets (0x13) plen 5    #135 [hci1] 10.143805
        Num handles: 1
        Handle: 2631 Address: DF:A9:FF:F6:B1:1A (OUI DF-A9-FF)
        Count: 1
        #134: len 9 (0 Kb/s)
        Latency: 168 msec (158-173 msec ~167 msec)
> ACL Data RX: Handle 2631 flags 0x02 dlen 11             #136 [hci1] 10.143973
      SMP: Pairing Request (0x01) len 6
        IO capability: KeyboardDisplay (0x04)
        OOB data: Authentication data not present (0x00)
        Authentication requirement: Bonding, No MITM, SC, No Keypresses (0x09)
        Max encryption key size: 7
        Initiator key distribution: <none> (0x00)
        Responder key distribution: <none> (0x00)
< HCI Command: Host Number of Com.. (0x03|0x0035) plen 5  #137 [hci1] 10.155559
        Num handles: 1
        Handle: 2631 Address: DF:A9:FF:F6:B1:1A (OUI DF-A9-FF)
        Count: 1
< ACL Data TX: Handle 2631 flags 0x00 dlen 6              #138 [hci1] 10.155672
      SMP: Pairing Failed (0x05) len 1
        Reason: Encryption key size (0x06)
> HCI Event: Number of Completed Packets (0x13) plen 5    #139 [hci1] 10.318526
        Num handles: 1
        Handle: 2631 Address: DF:A9:FF:F6:B1:1A (OUI DF-A9-FF)
        Count: 1
        #138: len 6 (0 Kb/s)
        Latency: 162 msec (158-173 msec ~165 msec)
> HCI Event: Disconnect Complete (0x05) plen 4            #140 [hci1] 10.406341
        Status: Success (0x00)
        Handle: 2631 Address: DF:A9:FF:F6:B1:1A (OUI DF-A9-FF)
        Reason: Remote User Terminated Connection (0x13)
< HCI Command: LE Set Extended A.. (0x08|0x0036) plen 25  #141 [hci1] 11.394947
        Handle: 0x00
        Properties: 0x0013
          Connectable
          Scannable
          Use legacy advertising PDUs: ADV_IND
        Min advertising interval: 100.000 msec (0x00a0)
        Max advertising interval: 150.000 msec (0x00f0)
        Channel map: 37, 38, 39 (0x07)
        Own address type: Random (0x01)
        Peer address type: Public (0x00)
        Peer address: 00:00:00:00:00:00 (OUI 00-00-00)
        Filter policy: Allow Scan Request from Any, Allow Connect Request from Any (0x00)
        TX power: Host has no preference (0x7f)
        Primary PHY: LE 1M (0x01)
        Secondary max skip: 0x00
        Secondary PHY: LE 1M (0x01)
        SID: 0x00
        Scan request notifications: Disabled (0x00)
> HCI Event: Command Complete (0x0e) plen 5               #142 [hci1] 11.395714
      LE Set Extended Advertising Parameters (0x08|0x0036) ncmd 1
        Status: Success (0x00)
        TX power (selected): 0 dbm (0x00)
< HCI Command: LE Set Advertising.. (0x08|0x0035) plen 7  #143 [hci1] 11.414875
        Advertising handle: 0x00
        Advertising random address: 48:61:8E:DB:C6:F9 (Resolvable)
> HCI Event: Command Complete (0x0e) plen 4               #144 [hci1] 11.415428
      LE Set Advertising Set Random Address (0x08|0x0035) ncmd 1
        Status: Success (0x00)
< HCI Command: LE Set Extended A.. (0x08|0x0037) plen 22  #145 [hci1] 11.434839
        Handle: 0x00
        Operation: Complete extended advertising data (0x03)
        Fragment preference: Minimize fragmentation (0x01)
        Data length: 0x12
        Flags: 0x04
          BR/EDR Not Supported
        Name (complete): Tester_F6B11A
> HCI Event: Command Complete (0x0e) plen 4               #146 [hci1] 11.435654
      LE Set Extended Advertising Data (0x08|0x0037) ncmd 1
        Status: Success (0x00)
< HCI Command: LE Set Extended Sc.. (0x08|0x0038) plen 4  #147 [hci1] 11.454831
        Handle: 0x00
        Operation: Complete scan response data (0x03)
        Fragment preference: Minimize fragmentation (0x01)
        Data length: 0x00
> HCI Event: Command Complete (0x0e) plen 4               #148 [hci1] 11.455339
      LE Set Extended Scan Response Data (0x08|0x0038) ncmd 1
        Status: Success (0x00)
< HCI Command: LE Set Extended Ad.. (0x08|0x0039) plen 6  #149 [hci1] 11.474850
        Extended advertising: Enabled (0x01)
        Number of sets: 1 (0x01)
        Entry 0
          Handle: 0x00
          Duration: 0 ms (0x00)
          Max ext adv events: 0
> HCI Event: Command Complete (0x0e) plen 4               #150 [hci1] 11.475479
      LE Set Extended Advertising Enable (0x08|0x0039) ncmd 1
        Status: Success (0x00)
> HCI Event: LE Meta Event (0x3e) plen 31                 #151 [hci1] 12.119770
      LE Enhanced Connection Complete (0x0a)
        Status: Success (0x00)
        Handle: 2649
        Role: Peripheral (0x01)
        Peer address type: Public (0x00)
        Peer address: DF:A9:FF:F6:B1:1A (OUI DF-A9-FF)
        Local resolvable private address: 00:00:00:00:00:00 (Non-Resolvable)
        Peer resolvable private address: 00:00:00:00:00:00 (Non-Resolvable)
        Connection interval: 87.50 msec (0x0046)
        Connection latency: 0 (0x0000)
        Supervision timeout: 20000 msec (0x07d0)
        Central clock accuracy: 0x01
> HCI Event: LE Meta Event (0x3e) plen 6                  #152 [hci1] 12.119909
      LE Advertising Set Terminated (0x12)
        Status: Success (0x00)
        Handle: 0
        Connection handle: 2649
        Number of completed extended advertising events: 0
< HCI Command: LE Read Remote Use.. (0x08|0x0016) plen 2  #153 [hci1] 12.135758
        Handle: 2649 Address: DF:A9:FF:F6:B1:1A (OUI DF-A9-FF)
> HCI Event: Command Status (0x0f) plen 4                 #154 [hci1] 12.136249
      LE Read Remote Used Features (0x08|0x0016) ncmd 1
        Status: Success (0x00)
> HCI Event: LE Meta Event (0x3e) plen 12                 #155 [hci1] 12.383711
      LE Read Remote Used Features (0x04)
        Status: Success (0x00)
        Handle: 2649 Address: DF:A9:FF:F6:B1:1A (OUI DF-A9-FF)
        Features: 0x2d 0x49 0x00 0xf7 0x67 0xd9 0x00 0x80
          LE Encryption
          Extended Reject Indication
          Peripheral-initiated Features Exchange
          LE Data Packet Length Extension
          LE 2M PHY
          LE Coded PHY
          Channel Selection Algorithm #2
          Periodic Advertising Sync Transfer - Sender
          Periodic Advertising Sync Transfer - Recipient
          Sleep Clock Accuracy Updates
          Connected Isochronous Stream - Central
          Connected Isochronous Stream - Peripheral
          Isochronous Broadcaster
          Synchronized Receiver
          Connected Isochronous Stream (Host Support)
          LE Power Control Request
          LE Power Control Request
          Connection Subrating
          Connection Subrating (Host Support)
          Unknown features (0x8000d90000000000)
> ACL Data RX: Handle 2649 flags 0x02 dlen 11             #156 [hci1] 12.821098
      SMP: Pairing Request (0x01) len 6
        IO capability: KeyboardDisplay (0x04)
        OOB data: Authentication data not present (0x00)
        Authentication requirement: Bonding, No MITM, SC, No Keypresses (0x09)
        Max encryption key size: 8
        Initiator key distribution: <none> (0x00)
        Responder key distribution: <none> (0x00)
< HCI Command: Host Number of Com.. (0x03|0x0035) plen 5  #157 [hci1] 12.834982
        Num handles: 1
        Handle: 2649 Address: DF:A9:FF:F6:B1:1A (OUI DF-A9-FF)
        Count: 1
< ACL Data TX: Handle 2649 flags 0x00 dlen 6              #158 [hci1] 12.835020
      SMP: Pairing Failed (0x05) len 1
        Reason: Encryption key size (0x06)
> HCI Event: Number of Completed Packets (0x13) plen 5    #159 [hci1] 12.995749
        Num handles: 1
        Handle: 2649 Address: DF:A9:FF:F6:B1:1A (OUI DF-A9-FF)
        Count: 1
        #158: len 6 (0 Kb/s)
        Latency: 160 msec (160-160 msec ~160 msec)
> HCI Event: Disconnect Complete (0x05) plen 4            #160 [hci1] 13.083563
        Status: Success (0x00)
        Handle: 2649 Address: DF:A9:FF:F6:B1:1A (OUI DF-A9-FF)
        Reason: Remote User Terminated Connection (0x13)
< HCI Command: LE Set Extended A.. (0x08|0x0036) plen 25  #161 [hci1] 13.534964
        Handle: 0x00
        Properties: 0x0013
          Connectable
          Scannable
          Use legacy advertising PDUs: ADV_IND
        Min advertising interval: 100.000 msec (0x00a0)
        Max advertising interval: 150.000 msec (0x00f0)
        Channel map: 37, 38, 39 (0x07)
        Own address type: Random (0x01)
        Peer address type: Public (0x00)
        Peer address: 00:00:00:00:00:00 (OUI 00-00-00)
        Filter policy: Allow Scan Request from Any, Allow Connect Request from Any (0x00)
        TX power: Host has no preference (0x7f)
        Primary PHY: LE 1M (0x01)
        Secondary max skip: 0x00
        Secondary PHY: LE 1M (0x01)
        SID: 0x00
        Scan request notifications: Disabled (0x00)
> HCI Event: Command Complete (0x0e) plen 5               #162 [hci1] 13.535761
      LE Set Extended Advertising Parameters (0x08|0x0036) ncmd 1
        Status: Success (0x00)
        TX power (selected): 0 dbm (0x00)
< HCI Command: LE Set Advertising.. (0x08|0x0035) plen 7  #163 [hci1] 13.554867
        Advertising handle: 0x00
        Advertising random address: 48:61:8E:DB:C6:F9 (Resolvable)
> HCI Event: Command Complete (0x0e) plen 4               #164 [hci1] 13.555374
      LE Set Advertising Set Random Address (0x08|0x0035) ncmd 1
        Status: Success (0x00)
< HCI Command: LE Set Extended A.. (0x08|0x0037) plen 22  #165 [hci1] 13.574863
        Handle: 0x00
        Operation: Complete extended advertising data (0x03)
        Fragment preference: Minimize fragmentation (0x01)
        Data length: 0x12
        Flags: 0x04
          BR/EDR Not Supported
        Name (complete): Tester_F6B11A
> HCI Event: Command Complete (0x0e) plen 4               #166 [hci1] 13.575650
      LE Set Extended Advertising Data (0x08|0x0037) ncmd 1
        Status: Success (0x00)
< HCI Command: LE Set Extended Sc.. (0x08|0x0038) plen 4  #167 [hci1] 13.594836
        Handle: 0x00
        Operation: Complete scan response data (0x03)
        Fragment preference: Minimize fragmentation (0x01)
        Data length: 0x00
> HCI Event: Command Complete (0x0e) plen 4               #168 [hci1] 13.595486
      LE Set Extended Scan Response Data (0x08|0x0038) ncmd 1
        Status: Success (0x00)
< HCI Command: LE Set Extended Ad.. (0x08|0x0039) plen 6  #169 [hci1] 13.614861
        Extended advertising: Enabled (0x01)
        Number of sets: 1 (0x01)
        Entry 0
          Handle: 0x00
          Duration: 0 ms (0x00)
          Max ext adv events: 0
> HCI Event: Command Complete (0x0e) plen 4               #170 [hci1] 13.615435
      LE Set Extended Advertising Enable (0x08|0x0039) ncmd 1
        Status: Success (0x00)
> HCI Event: LE Meta Event (0x3e) plen 31                 #171 [hci1] 13.933554
      LE Enhanced Connection Complete (0x0a)
        Status: Success (0x00)
        Handle: 2667
        Role: Peripheral (0x01)
        Peer address type: Public (0x00)
        Peer address: DF:A9:FF:F6:B1:1A (OUI DF-A9-FF)
        Local resolvable private address: 00:00:00:00:00:00 (Non-Resolvable)
        Peer resolvable private address: 00:00:00:00:00:00 (Non-Resolvable)
        Connection interval: 87.50 msec (0x0046)
        Connection latency: 0 (0x0000)
        Supervision timeout: 20000 msec (0x07d0)
        Central clock accuracy: 0x01
> HCI Event: LE Meta Event (0x3e) plen 6                  #172 [hci1] 13.933634
      LE Advertising Set Terminated (0x12)
        Status: Success (0x00)
        Handle: 0
        Connection handle: 2667
        Number of completed extended advertising events: 0
< HCI Command: LE Read Remote Use.. (0x08|0x0016) plen 2  #173 [hci1] 13.940412
        Handle: 2667 Address: DF:A9:FF:F6:B1:1A (OUI DF-A9-FF)
> HCI Event: Command Status (0x0f) plen 4                 #174 [hci1] 13.940971
      LE Read Remote Used Features (0x08|0x0016) ncmd 1
        Status: Success (0x00)
> HCI Event: LE Meta Event (0x3e) plen 12                 #175 [hci1] 14.197365
      LE Read Remote Used Features (0x04)
        Status: Success (0x00)
        Handle: 2667 Address: DF:A9:FF:F6:B1:1A (OUI DF-A9-FF)
        Features: 0x2d 0x49 0x00 0xf7 0x67 0xd9 0x00 0x80
          LE Encryption
          Extended Reject Indication
          Peripheral-initiated Features Exchange
          LE Data Packet Length Extension
          LE 2M PHY
          LE Coded PHY
          Channel Selection Algorithm #2
          Periodic Advertising Sync Transfer - Sender
          Periodic Advertising Sync Transfer - Recipient
          Sleep Clock Accuracy Updates
          Connected Isochronous Stream - Central
          Connected Isochronous Stream - Peripheral
          Isochronous Broadcaster
          Synchronized Receiver
          Connected Isochronous Stream (Host Support)
          LE Power Control Request
          LE Power Control Request
          Connection Subrating
          Connection Subrating (Host Support)
          Unknown features (0x8000d90000000000)
> ACL Data RX: Handle 2667 flags 0x02 dlen 11             #176 [hci1] 14.634723
      SMP: Pairing Request (0x01) len 6
        IO capability: KeyboardDisplay (0x04)
        OOB data: Authentication data not present (0x00)
        Authentication requirement: Bonding, No MITM, SC, No Keypresses (0x09)
        Max encryption key size: 9
        Initiator key distribution: <none> (0x00)
        Responder key distribution: <none> (0x00)
< HCI Command: Host Number of Com.. (0x03|0x0035) plen 5  #177 [hci1] 14.635205
        Num handles: 1
        Handle: 2667 Address: DF:A9:FF:F6:B1:1A (OUI DF-A9-FF)
        Count: 1
< ACL Data TX: Handle 2667 flags 0x00 dlen 6              #178 [hci1] 14.635293
      SMP: Pairing Failed (0x05) len 1
        Reason: Encryption key size (0x06)
> HCI Event: Number of Completed Packets (0x13) plen 5    #179 [hci1] 14.809558
        Num handles: 1
        Handle: 2667 Address: DF:A9:FF:F6:B1:1A (OUI DF-A9-FF)
        Count: 1
        #178: len 6 (0 Kb/s)
        Latency: 174 msec (174-174 msec ~174 msec)
> HCI Event: Disconnect Complete (0x05) plen 4            #180 [hci1] 14.897296
        Status: Success (0x00)
        Handle: 2667 Address: DF:A9:FF:F6:B1:1A (OUI DF-A9-FF)
        Reason: Remote User Terminated Connection (0x13)
< HCI Command: LE Set Extended A.. (0x08|0x0036) plen 25  #181 [hci1] 15.705458
        Handle: 0x00
        Properties: 0x0013
          Connectable
          Scannable
          Use legacy advertising PDUs: ADV_IND
        Min advertising interval: 100.000 msec (0x00a0)
        Max advertising interval: 150.000 msec (0x00f0)
        Channel map: 37, 38, 39 (0x07)
        Own address type: Random (0x01)
        Peer address type: Public (0x00)
        Peer address: 00:00:00:00:00:00 (OUI 00-00-00)
        Filter policy: Allow Scan Request from Any, Allow Connect Request from Any (0x00)
        TX power: Host has no preference (0x7f)
        Primary PHY: LE 1M (0x01)
        Secondary max skip: 0x00
        Secondary PHY: LE 1M (0x01)
        SID: 0x00
        Scan request notifications: Disabled (0x00)
> HCI Event: Command Complete (0x0e) plen 5               #182 [hci1] 15.706280
      LE Set Extended Advertising Parameters (0x08|0x0036) ncmd 1
        Status: Success (0x00)
        TX power (selected): 0 dbm (0x00)
< HCI Command: LE Set Advertising.. (0x08|0x0035) plen 7  #183 [hci1] 15.715289
        Advertising handle: 0x00
        Advertising random address: 48:61:8E:DB:C6:F9 (Resolvable)
> HCI Event: Command Complete (0x0e) plen 4               #184 [hci1] 15.715965
      LE Set Advertising Set Random Address (0x08|0x0035) ncmd 1
        Status: Success (0x00)
< HCI Command: LE Set Extended A.. (0x08|0x0037) plen 22  #185 [hci1] 15.734940
        Handle: 0x00
        Operation: Complete extended advertising data (0x03)
        Fragment preference: Minimize fragmentation (0x01)
        Data length: 0x12
        Flags: 0x04
          BR/EDR Not Supported
        Name (complete): Tester_F6B11A
> HCI Event: Command Complete (0x0e) plen 4               #186 [hci1] 15.735690
      LE Set Extended Advertising Data (0x08|0x0037) ncmd 1
        Status: Success (0x00)
< HCI Command: LE Set Extended Sc.. (0x08|0x0038) plen 4  #187 [hci1] 15.754909
        Handle: 0x00
        Operation: Complete scan response data (0x03)
        Fragment preference: Minimize fragmentation (0x01)
        Data length: 0x00
> HCI Event: Command Complete (0x0e) plen 4               #188 [hci1] 15.755508
      LE Set Extended Scan Response Data (0x08|0x0038) ncmd 1
        Status: Success (0x00)
< HCI Command: LE Set Extended Ad.. (0x08|0x0039) plen 6  #189 [hci1] 15.774884
        Extended advertising: Enabled (0x01)
        Number of sets: 1 (0x01)
        Entry 0
          Handle: 0x00
          Duration: 0 ms (0x00)
          Max ext adv events: 0
> HCI Event: Command Complete (0x0e) plen 4               #190 [hci1] 15.775516
      LE Set Extended Advertising Enable (0x08|0x0039) ncmd 1
        Status: Success (0x00)
> HCI Event: LE Meta Event (0x3e) plen 31                 #191 [hci1] 16.422174
      LE Enhanced Connection Complete (0x0a)
        Status: Success (0x00)
        Handle: 2685
        Role: Peripheral (0x01)
        Peer address type: Public (0x00)
        Peer address: DF:A9:FF:F6:B1:1A (OUI DF-A9-FF)
        Local resolvable private address: 00:00:00:00:00:00 (Non-Resolvable)
        Peer resolvable private address: 00:00:00:00:00:00 (Non-Resolvable)
        Connection interval: 87.50 msec (0x0046)
        Connection latency: 0 (0x0000)
        Supervision timeout: 20000 msec (0x07d0)
        Central clock accuracy: 0x01
> HCI Event: LE Meta Event (0x3e) plen 6                  #192 [hci1] 16.422254
      LE Advertising Set Terminated (0x12)
        Status: Success (0x00)
        Handle: 0
        Connection handle: 2685
        Number of completed extended advertising events: 0
< HCI Command: LE Read Remote Use.. (0x08|0x0016) plen 2  #193 [hci1] 16.435263
        Handle: 2685 Address: DF:A9:FF:F6:B1:1A (OUI DF-A9-FF)
> HCI Event: Command Status (0x0f) plen 4                 #194 [hci1] 16.435736
      LE Read Remote Used Features (0x08|0x0016) ncmd 1
        Status: Success (0x00)
> HCI Event: LE Meta Event (0x3e) plen 12                 #195 [hci1] 16.686092
      LE Read Remote Used Features (0x04)
        Status: Success (0x00)
        Handle: 2685 Address: DF:A9:FF:F6:B1:1A (OUI DF-A9-FF)
        Features: 0x2d 0x49 0x00 0xf7 0x67 0xd9 0x00 0x80
          LE Encryption
          Extended Reject Indication
          Peripheral-initiated Features Exchange
          LE Data Packet Length Extension
          LE 2M PHY
          LE Coded PHY
          Channel Selection Algorithm #2
          Periodic Advertising Sync Transfer - Sender
          Periodic Advertising Sync Transfer - Recipient
          Sleep Clock Accuracy Updates
          Connected Isochronous Stream - Central
          Connected Isochronous Stream - Peripheral
          Isochronous Broadcaster
          Synchronized Receiver
          Connected Isochronous Stream (Host Support)
          LE Power Control Request
          LE Power Control Request
          Connection Subrating
          Connection Subrating (Host Support)
          Unknown features (0x8000d90000000000)
> ACL Data RX: Handle 2685 flags 0x02 dlen 11             #196 [hci1] 17.123331
      SMP: Pairing Request (0x01) len 6
        IO capability: KeyboardDisplay (0x04)
        OOB data: Authentication data not present (0x00)
        Authentication requirement: Bonding, No MITM, SC, No Keypresses (0x09)
        Max encryption key size: 10
        Initiator key distribution: <none> (0x00)
        Responder key distribution: <none> (0x00)
< HCI Command: Host Number of Com.. (0x03|0x0035) plen 5  #197 [hci1] 17.135146
        Num handles: 1
        Handle: 2685 Address: DF:A9:FF:F6:B1:1A (OUI DF-A9-FF)
        Count: 1
< ACL Data TX: Handle 2685 flags 0x00 dlen 6              #198 [hci1] 17.135210
      SMP: Pairing Failed (0x05) len 1
        Reason: Encryption key size (0x06)
> HCI Event: Number of Completed Packets (0x13) plen 5    #199 [hci1] 17.298067
        Num handles: 1
        Handle: 2685 Address: DF:A9:FF:F6:B1:1A (OUI DF-A9-FF)
        Count: 1
        #198: len 6 (0 Kb/s)
        Latency: 162 msec (162-162 msec ~162 msec)
> HCI Event: Disconnect Complete (0x05) plen 4            #200 [hci1] 17.385780
        Status: Success (0x00)
        Handle: 2685 Address: DF:A9:FF:F6:B1:1A (OUI DF-A9-FF)
        Reason: Remote User Terminated Connection (0x13)
< HCI Command: LE Set Extended A.. (0x08|0x0036) plen 25  #201 [hci1] 17.825468
        Handle: 0x00
        Properties: 0x0013
          Connectable
          Scannable
          Use legacy advertising PDUs: ADV_IND
        Min advertising interval: 100.000 msec (0x00a0)
        Max advertising interval: 150.000 msec (0x00f0)
        Channel map: 37, 38, 39 (0x07)
        Own address type: Random (0x01)
        Peer address type: Public (0x00)
        Peer address: 00:00:00:00:00:00 (OUI 00-00-00)
        Filter policy: Allow Scan Request from Any, Allow Connect Request from Any (0x00)
        TX power: Host has no preference (0x7f)
        Primary PHY: LE 1M (0x01)
        Secondary max skip: 0x00
        Secondary PHY: LE 1M (0x01)
        SID: 0x00
        Scan request notifications: Disabled (0x00)
> HCI Event: Command Complete (0x0e) plen 5               #202 [hci1] 17.826334
      LE Set Extended Advertising Parameters (0x08|0x0036) ncmd 1
        Status: Success (0x00)
        TX power (selected): 0 dbm (0x00)
< HCI Command: LE Set Advertising.. (0x08|0x0035) plen 7  #203 [hci1] 17.835277
        Advertising handle: 0x00
        Advertising random address: 48:61:8E:DB:C6:F9 (Resolvable)
> HCI Event: Command Complete (0x0e) plen 4               #204 [hci1] 17.835952
      LE Set Advertising Set Random Address (0x08|0x0035) ncmd 1
        Status: Success (0x00)
< HCI Command: LE Set Extended A.. (0x08|0x0037) plen 22  #205 [hci1] 17.855017
        Handle: 0x00
        Operation: Complete extended advertising data (0x03)
        Fragment preference: Minimize fragmentation (0x01)
        Data length: 0x12
        Flags: 0x04
          BR/EDR Not Supported
        Name (complete): Tester_F6B11A
> HCI Event: Command Complete (0x0e) plen 4               #206 [hci1] 17.855751
      LE Set Extended Advertising Data (0x08|0x0037) ncmd 1
        Status: Success (0x00)
< HCI Command: LE Set Extended Sc.. (0x08|0x0038) plen 4  #207 [hci1] 17.874879
        Handle: 0x00
        Operation: Complete scan response data (0x03)
        Fragment preference: Minimize fragmentation (0x01)
        Data length: 0x00
> HCI Event: Command Complete (0x0e) plen 4               #208 [hci1] 17.875316
      LE Set Extended Scan Response Data (0x08|0x0038) ncmd 1
        Status: Success (0x00)
< HCI Command: LE Set Extended Ad.. (0x08|0x0039) plen 6  #209 [hci1] 17.894894
        Extended advertising: Enabled (0x01)
        Number of sets: 1 (0x01)
        Entry 0
          Handle: 0x00
          Duration: 0 ms (0x00)
          Max ext adv events: 0
> HCI Event: Command Complete (0x0e) plen 4               #210 [hci1] 17.895535
      LE Set Extended Advertising Enable (0x08|0x0039) ncmd 1
        Status: Success (0x00)
> HCI Event: LE Meta Event (0x3e) plen 31                 #211 [hci1] 18.219462
      LE Enhanced Connection Complete (0x0a)
        Status: Success (0x00)
        Handle: 2703
        Role: Peripheral (0x01)
        Peer address type: Public (0x00)
        Peer address: DF:A9:FF:F6:B1:1A (OUI DF-A9-FF)
        Local resolvable private address: 00:00:00:00:00:00 (Non-Resolvable)
        Peer resolvable private address: 00:00:00:00:00:00 (Non-Resolvable)
        Connection interval: 87.50 msec (0x0046)
        Connection latency: 0 (0x0000)
        Supervision timeout: 20000 msec (0x07d0)
        Central clock accuracy: 0x01
> HCI Event: LE Meta Event (0x3e) plen 6                  #212 [hci1] 18.219553
      LE Advertising Set Terminated (0x12)
        Status: Success (0x00)
        Handle: 0
        Connection handle: 2703
        Number of completed extended advertising events: 0
< HCI Command: LE Read Remote Use.. (0x08|0x0016) plen 2  #213 [hci1] 18.235307
        Handle: 2703 Address: DF:A9:FF:F6:B1:1A (OUI DF-A9-FF)
> HCI Event: Command Status (0x0f) plen 4                 #214 [hci1] 18.235786
      LE Read Remote Used Features (0x08|0x0016) ncmd 1
        Status: Success (0x00)
> HCI Event: LE Meta Event (0x3e) plen 12                 #215 [hci1] 18.483429
      LE Read Remote Used Features (0x04)
        Status: Success (0x00)
        Handle: 2703 Address: DF:A9:FF:F6:B1:1A (OUI DF-A9-FF)
        Features: 0x2d 0x49 0x00 0xf7 0x67 0xd9 0x00 0x80
          LE Encryption
          Extended Reject Indication
          Peripheral-initiated Features Exchange
          LE Data Packet Length Extension
          LE 2M PHY
          LE Coded PHY
          Channel Selection Algorithm #2
          Periodic Advertising Sync Transfer - Sender
          Periodic Advertising Sync Transfer - Recipient
          Sleep Clock Accuracy Updates
          Connected Isochronous Stream - Central
          Connected Isochronous Stream - Peripheral
          Isochronous Broadcaster
          Synchronized Receiver
          Connected Isochronous Stream (Host Support)
          LE Power Control Request
          LE Power Control Request
          Connection Subrating
          Connection Subrating (Host Support)
          Unknown features (0x8000d90000000000)
> ACL Data RX: Handle 2703 flags 0x02 dlen 11             #216 [hci1] 18.920784
      SMP: Pairing Request (0x01) len 6
        IO capability: KeyboardDisplay (0x04)
        OOB data: Authentication data not present (0x00)
        Authentication requirement: Bonding, No MITM, SC, No Keypresses (0x09)
        Max encryption key size: 11
        Initiator key distribution: <none> (0x00)
        Responder key distribution: <none> (0x00)
< HCI Command: Host Number of Com.. (0x03|0x0035) plen 5  #217 [hci1] 18.935394
        Num handles: 1
        Handle: 2703 Address: DF:A9:FF:F6:B1:1A (OUI DF-A9-FF)
        Count: 1
< ACL Data TX: Handle 2703 flags 0x00 dlen 6              #218 [hci1] 18.935438
      SMP: Pairing Failed (0x05) len 1
        Reason: Encryption key size (0x06)
> HCI Event: Number of Completed Packets (0x13) plen 5    #219 [hci1] 19.095434
        Num handles: 1
        Handle: 2703 Address: DF:A9:FF:F6:B1:1A (OUI DF-A9-FF)
        Count: 1
        #218: len 6 (0 Kb/s)
        Latency: 159 msec (159-159 msec ~159 msec)
> HCI Event: Disconnect Complete (0x05) plen 4            #220 [hci1] 19.183383
        Status: Success (0x00)
        Handle: 2703 Address: DF:A9:FF:F6:B1:1A (OUI DF-A9-FF)
        Reason: Remote User Terminated Connection (0x13)
< HCI Command: LE Set Extended A.. (0x08|0x0036) plen 25  #221 [hci1] 19.945495
        Handle: 0x00
        Properties: 0x0013
          Connectable
          Scannable
          Use legacy advertising PDUs: ADV_IND
        Min advertising interval: 100.000 msec (0x00a0)
        Max advertising interval: 150.000 msec (0x00f0)
        Channel map: 37, 38, 39 (0x07)
        Own address type: Random (0x01)
        Peer address type: Public (0x00)
        Peer address: 00:00:00:00:00:00 (OUI 00-00-00)
        Filter policy: Allow Scan Request from Any, Allow Connect Request from Any (0x00)
        TX power: Host has no preference (0x7f)
        Primary PHY: LE 1M (0x01)
        Secondary max skip: 0x00
        Secondary PHY: LE 1M (0x01)
        SID: 0x00
        Scan request notifications: Disabled (0x00)
> HCI Event: Command Complete (0x0e) plen 5               #222 [hci1] 19.946349
      LE Set Extended Advertising Parameters (0x08|0x0036) ncmd 1
        Status: Success (0x00)
        TX power (selected): 0 dbm (0x00)
< HCI Command: LE Set Advertising.. (0x08|0x0035) plen 7  #223 [hci1] 19.955291
        Advertising handle: 0x00
        Advertising random address: 48:61:8E:DB:C6:F9 (Resolvable)
> HCI Event: Command Complete (0x0e) plen 4               #224 [hci1] 19.955838
      LE Set Advertising Set Random Address (0x08|0x0035) ncmd 1
        Status: Success (0x00)
< HCI Command: LE Set Extended A.. (0x08|0x0037) plen 22  #225 [hci1] 19.975023
        Handle: 0x00
        Operation: Complete extended advertising data (0x03)
        Fragment preference: Minimize fragmentation (0x01)
        Data length: 0x12
        Flags: 0x04
          BR/EDR Not Supported
        Name (complete): Tester_F6B11A
> HCI Event: Command Complete (0x0e) plen 4               #226 [hci1] 19.975944
      LE Set Extended Advertising Data (0x08|0x0037) ncmd 1
        Status: Success (0x00)
< HCI Command: LE Set Extended Sc.. (0x08|0x0038) plen 4  #227 [hci1] 19.994950
        Handle: 0x00
        Operation: Complete scan response data (0x03)
        Fragment preference: Minimize fragmentation (0x01)
        Data length: 0x00
> HCI Event: Command Complete (0x0e) plen 4               #228 [hci1] 19.995515
      LE Set Extended Scan Response Data (0x08|0x0038) ncmd 1
        Status: Success (0x00)
< HCI Command: LE Set Extended Ad.. (0x08|0x0039) plen 6  #229 [hci1] 20.014939
        Extended advertising: Enabled (0x01)
        Number of sets: 1 (0x01)
        Entry 0
          Handle: 0x00
          Duration: 0 ms (0x00)
          Max ext adv events: 0
> HCI Event: Command Complete (0x0e) plen 4               #230 [hci1] 20.015588
      LE Set Extended Advertising Enable (0x08|0x0039) ncmd 1
        Status: Success (0x00)
> HCI Event: LE Meta Event (0x3e) plen 31                 #231 [hci1] 20.339491
      LE Enhanced Connection Complete (0x0a)
        Status: Success (0x00)
        Handle: 2721
        Role: Peripheral (0x01)
        Peer address type: Public (0x00)
        Peer address: DF:A9:FF:F6:B1:1A (OUI DF-A9-FF)
        Local resolvable private address: 00:00:00:00:00:00 (Non-Resolvable)
        Peer resolvable private address: 00:00:00:00:00:00 (Non-Resolvable)
        Connection interval: 87.50 msec (0x0046)
        Connection latency: 0 (0x0000)
        Supervision timeout: 20000 msec (0x07d0)
        Central clock accuracy: 0x01
> HCI Event: LE Meta Event (0x3e) plen 6                  #232 [hci1] 20.339494
      LE Advertising Set Terminated (0x12)
        Status: Success (0x00)
        Handle: 0
        Connection handle: 2721
        Number of completed extended advertising events: 0
< HCI Command: LE Read Remote Use.. (0x08|0x0016) plen 2  #233 [hci1] 20.355214
        Handle: 2721 Address: DF:A9:FF:F6:B1:1A (OUI DF-A9-FF)
> HCI Event: Command Status (0x0f) plen 4                 #234 [hci1] 20.355717
      LE Read Remote Used Features (0x08|0x0016) ncmd 1
        Status: Success (0x00)
> HCI Event: LE Meta Event (0x3e) plen 12                 #235 [hci1] 20.603235
      LE Read Remote Used Features (0x04)
        Status: Success (0x00)
        Handle: 2721 Address: DF:A9:FF:F6:B1:1A (OUI DF-A9-FF)
        Features: 0x2d 0x49 0x00 0xf7 0x67 0xd9 0x00 0x80
          LE Encryption
          Extended Reject Indication
          Peripheral-initiated Features Exchange
          LE Data Packet Length Extension
          LE 2M PHY
          LE Coded PHY
          Channel Selection Algorithm #2
          Periodic Advertising Sync Transfer - Sender
          Periodic Advertising Sync Transfer - Recipient
          Sleep Clock Accuracy Updates
          Connected Isochronous Stream - Central
          Connected Isochronous Stream - Peripheral
          Isochronous Broadcaster
          Synchronized Receiver
          Connected Isochronous Stream (Host Support)
          LE Power Control Request
          LE Power Control Request
          Connection Subrating
          Connection Subrating (Host Support)
          Unknown features (0x8000d90000000000)
> ACL Data RX: Handle 2721 flags 0x02 dlen 11             #236 [hci1] 21.040462
      SMP: Pairing Request (0x01) len 6
        IO capability: KeyboardDisplay (0x04)
        OOB data: Authentication data not present (0x00)
        Authentication requirement: Bonding, No MITM, SC, No Keypresses (0x09)
        Max encryption key size: 12
        Initiator key distribution: <none> (0x00)
        Responder key distribution: <none> (0x00)
< HCI Command: Host Number of Com.. (0x03|0x0035) plen 5  #237 [hci1] 21.055152
        Num handles: 1
        Handle: 2721 Address: DF:A9:FF:F6:B1:1A (OUI DF-A9-FF)
        Count: 1
< ACL Data TX: Handle 2721 flags 0x00 dlen 6              #238 [hci1] 21.055212
      SMP: Pairing Failed (0x05) len 1
        Reason: Encryption key size (0x06)
> HCI Event: Number of Completed Packets (0x13) plen 5    #239 [hci1] 21.215338
        Num handles: 1
        Handle: 2721 Address: DF:A9:FF:F6:B1:1A (OUI DF-A9-FF)
        Count: 1
        #238: len 6 (0 Kb/s)
        Latency: 160 msec (160-160 msec ~160 msec)
> HCI Event: Disconnect Complete (0x05) plen 4            #240 [hci1] 21.303225
        Status: Success (0x00)
        Handle: 2721 Address: DF:A9:FF:F6:B1:1A (OUI DF-A9-FF)
        Reason: Remote User Terminated Connection (0x13)
< HCI Command: LE Set Extended A.. (0x08|0x0036) plen 25  #241 [hci1] 22.055040
        Handle: 0x00
        Properties: 0x0013
          Connectable
          Scannable
          Use legacy advertising PDUs: ADV_IND
        Min advertising interval: 100.000 msec (0x00a0)
        Max advertising interval: 150.000 msec (0x00f0)
        Channel map: 37, 38, 39 (0x07)
        Own address type: Random (0x01)
        Peer address type: Public (0x00)
        Peer address: 00:00:00:00:00:00 (OUI 00-00-00)
        Filter policy: Allow Scan Request from Any, Allow Connect Request from Any (0x00)
        TX power: Host has no preference (0x7f)
        Primary PHY: LE 1M (0x01)
        Secondary max skip: 0x00
        Secondary PHY: LE 1M (0x01)
        SID: 0x00
        Scan request notifications: Disabled (0x00)
> HCI Event: Command Complete (0x0e) plen 5               #242 [hci1] 22.055785
      LE Set Extended Advertising Parameters (0x08|0x0036) ncmd 1
        Status: Success (0x00)
        TX power (selected): 0 dbm (0x00)
< HCI Command: LE Set Advertising.. (0x08|0x0035) plen 7  #243 [hci1] 22.074982
        Advertising handle: 0x00
        Advertising random address: 48:61:8E:DB:C6:F9 (Resolvable)
> HCI Event: Command Complete (0x0e) plen 4               #244 [hci1] 22.075553
      LE Set Advertising Set Random Address (0x08|0x0035) ncmd 1
        Status: Success (0x00)
< HCI Command: LE Set Extended A.. (0x08|0x0037) plen 22  #245 [hci1] 22.094955
        Handle: 0x00
        Operation: Complete extended advertising data (0x03)
        Fragment preference: Minimize fragmentation (0x01)
        Data length: 0x12
        Flags: 0x04
          BR/EDR Not Supported
        Name (complete): Tester_F6B11A
> HCI Event: Command Complete (0x0e) plen 4               #246 [hci1] 22.095780
      LE Set Extended Advertising Data (0x08|0x0037) ncmd 1
        Status: Success (0x00)
< HCI Command: LE Set Extended Sc.. (0x08|0x0038) plen 4  #247 [hci1] 22.114960
        Handle: 0x00
        Operation: Complete scan response data (0x03)
        Fragment preference: Minimize fragmentation (0x01)
        Data length: 0x00
> HCI Event: Command Complete (0x0e) plen 4               #248 [hci1] 22.115407
      LE Set Extended Scan Response Data (0x08|0x0038) ncmd 1
        Status: Success (0x00)
< HCI Command: LE Set Extended Ad.. (0x08|0x0039) plen 6  #249 [hci1] 22.134966
        Extended advertising: Enabled (0x01)
        Number of sets: 1 (0x01)
        Entry 0
          Handle: 0x00
          Duration: 0 ms (0x00)
          Max ext adv events: 0
> HCI Event: Command Complete (0x0e) plen 4               #250 [hci1] 22.135612
      LE Set Extended Advertising Enable (0x08|0x0039) ncmd 1
        Status: Success (0x00)
> HCI Event: LE Meta Event (0x3e) plen 31                 #251 [hci1] 22.664710
      LE Enhanced Connection Complete (0x0a)
        Status: Success (0x00)
        Handle: 2739
        Role: Peripheral (0x01)
        Peer address type: Public (0x00)
        Peer address: DF:A9:FF:F6:B1:1A (OUI DF-A9-FF)
        Local resolvable private address: 00:00:00:00:00:00 (Non-Resolvable)
        Peer resolvable private address: 00:00:00:00:00:00 (Non-Resolvable)
        Connection interval: 87.50 msec (0x0046)
        Connection latency: 0 (0x0000)
        Supervision timeout: 20000 msec (0x07d0)
        Central clock accuracy: 0x01
> HCI Event: LE Meta Event (0x3e) plen 6                  #252 [hci1] 22.664817
      LE Advertising Set Terminated (0x12)
        Status: Success (0x00)
        Handle: 0
        Connection handle: 2739
        Number of completed extended advertising events: 0
< HCI Command: LE Read Remote Use.. (0x08|0x0016) plen 2  #253 [hci1] 22.675169
        Handle: 2739 Address: DF:A9:FF:F6:B1:1A (OUI DF-A9-FF)
> HCI Event: Command Status (0x0f) plen 4                 #254 [hci1] 22.675726
      LE Read Remote Used Features (0x08|0x0016) ncmd 1
        Status: Success (0x00)
> HCI Event: LE Meta Event (0x3e) plen 12                 #255 [hci1] 22.928450
      LE Read Remote Used Features (0x04)
        Status: Success (0x00)
        Handle: 2739 Address: DF:A9:FF:F6:B1:1A (OUI DF-A9-FF)
        Features: 0x2d 0x49 0x00 0xf7 0x67 0xd9 0x00 0x80
          LE Encryption
          Extended Reject Indication
          Peripheral-initiated Features Exchange
          LE Data Packet Length Extension
          LE 2M PHY
          LE Coded PHY
          Channel Selection Algorithm #2
          Periodic Advertising Sync Transfer - Sender
          Periodic Advertising Sync Transfer - Recipient
          Sleep Clock Accuracy Updates
          Connected Isochronous Stream - Central
          Connected Isochronous Stream - Peripheral
          Isochronous Broadcaster
          Synchronized Receiver
          Connected Isochronous Stream (Host Support)
          LE Power Control Request
          LE Power Control Request
          Connection Subrating
          Connection Subrating (Host Support)
          Unknown features (0x8000d90000000000)
> ACL Data RX: Handle 2739 flags 0x02 dlen 11             #256 [hci1] 23.365783
      SMP: Pairing Request (0x01) len 6
        IO capability: KeyboardDisplay (0x04)
        OOB data: Authentication data not present (0x00)
        Authentication requirement: Bonding, No MITM, SC, No Keypresses (0x09)
        Max encryption key size: 13
        Initiator key distribution: <none> (0x00)
        Responder key distribution: <none> (0x00)
< HCI Command: Host Number of Com.. (0x03|0x0035) plen 5  #257 [hci1] 23.375116
        Num handles: 1
        Handle: 2739 Address: DF:A9:FF:F6:B1:1A (OUI DF-A9-FF)
        Count: 1
< ACL Data TX: Handle 2739 flags 0x00 dlen 6              #258 [hci1] 23.375151
      SMP: Pairing Failed (0x05) len 1
        Reason: Encryption key size (0x06)
> HCI Event: Number of Completed Packets (0x13) plen 5    #259 [hci1] 23.540687
        Num handles: 1
        Handle: 2739 Address: DF:A9:FF:F6:B1:1A (OUI DF-A9-FF)
        Count: 1
        #258: len 6 (0 Kb/s)
        Latency: 165 msec (165-165 msec ~165 msec)
> HCI Event: Disconnect Complete (0x05) plen 4            #260 [hci1] 23.628286
        Status: Success (0x00)
        Handle: 2739 Address: DF:A9:FF:F6:B1:1A (OUI DF-A9-FF)
        Reason: Remote User Terminated Connection (0x13)
< HCI Command: LE Set Extended A.. (0x08|0x0036) plen 25  #261 [hci1] 24.175045
        Handle: 0x00
        Properties: 0x0013
          Connectable
          Scannable
          Use legacy advertising PDUs: ADV_IND
        Min advertising interval: 100.000 msec (0x00a0)
        Max advertising interval: 150.000 msec (0x00f0)
        Channel map: 37, 38, 39 (0x07)
        Own address type: Random (0x01)
        Peer address type: Public (0x00)
        Peer address: 00:00:00:00:00:00 (OUI 00-00-00)
        Filter policy: Allow Scan Request from Any, Allow Connect Request from Any (0x00)
        TX power: Host has no preference (0x7f)
        Primary PHY: LE 1M (0x01)
        Secondary max skip: 0x00
        Secondary PHY: LE 1M (0x01)
        SID: 0x00
        Scan request notifications: Disabled (0x00)
> HCI Event: Command Complete (0x0e) plen 5               #262 [hci1] 24.175797
      LE Set Extended Advertising Parameters (0x08|0x0036) ncmd 1
        Status: Success (0x00)
        TX power (selected): 0 dbm (0x00)
< HCI Command: LE Set Advertising.. (0x08|0x0035) plen 7  #263 [hci1] 24.195029
        Advertising handle: 0x00
        Advertising random address: 48:61:8E:DB:C6:F9 (Resolvable)
> HCI Event: Command Complete (0x0e) plen 4               #264 [hci1] 24.195532
      LE Set Advertising Set Random Address (0x08|0x0035) ncmd 1
        Status: Success (0x00)
< HCI Command: LE Set Extended A.. (0x08|0x0037) plen 22  #265 [hci1] 24.215032
        Handle: 0x00
        Operation: Complete extended advertising data (0x03)
        Fragment preference: Minimize fragmentation (0x01)
        Data length: 0x12
        Flags: 0x04
          BR/EDR Not Supported
        Name (complete): Tester_F6B11A
> HCI Event: Command Complete (0x0e) plen 4               #266 [hci1] 24.215778
      LE Set Extended Advertising Data (0x08|0x0037) ncmd 1
        Status: Success (0x00)
< HCI Command: LE Set Extended Sc.. (0x08|0x0038) plen 4  #267 [hci1] 24.234999
        Handle: 0x00
        Operation: Complete scan response data (0x03)
        Fragment preference: Minimize fragmentation (0x01)
        Data length: 0x00
> HCI Event: Command Complete (0x0e) plen 4               #268 [hci1] 24.235531
      LE Set Extended Scan Response Data (0x08|0x0038) ncmd 1
        Status: Success (0x00)
< HCI Command: LE Set Extended Ad.. (0x08|0x0039) plen 6  #269 [hci1] 24.255006
        Extended advertising: Enabled (0x01)
        Number of sets: 1 (0x01)
        Entry 0
          Handle: 0x00
          Duration: 0 ms (0x00)
          Max ext adv events: 0
> HCI Event: Command Complete (0x0e) plen 4               #270 [hci1] 24.255595
      LE Set Extended Advertising Enable (0x08|0x0039) ncmd 1
        Status: Success (0x00)
> HCI Event: LE Meta Event (0x3e) plen 31                 #271 [hci1] 24.790390
      LE Enhanced Connection Complete (0x0a)
        Status: Success (0x00)
        Handle: 2757
        Role: Peripheral (0x01)
        Peer address type: Public (0x00)
        Peer address: DF:A9:FF:F6:B1:1A (OUI DF-A9-FF)
        Local resolvable private address: 00:00:00:00:00:00 (Non-Resolvable)
        Peer resolvable private address: 00:00:00:00:00:00 (Non-Resolvable)
        Connection interval: 87.50 msec (0x0046)
        Connection latency: 0 (0x0000)
        Supervision timeout: 20000 msec (0x07d0)
        Central clock accuracy: 0x01
> HCI Event: LE Meta Event (0x3e) plen 6                  #272 [hci1] 24.790481
      LE Advertising Set Terminated (0x12)
        Status: Success (0x00)
        Handle: 0
        Connection handle: 2757
        Number of completed extended advertising events: 0
< HCI Command: LE Read Remote Use.. (0x08|0x0016) plen 2  #273 [hci1] 24.795410
        Handle: 2757 Address: DF:A9:FF:F6:B1:1A (OUI DF-A9-FF)
> HCI Event: Command Status (0x0f) plen 4                 #274 [hci1] 24.795879
      LE Read Remote Used Features (0x08|0x0016) ncmd 1
        Status: Success (0x00)
> HCI Event: LE Meta Event (0x3e) plen 12                 #275 [hci1] 25.054221
      LE Read Remote Used Features (0x04)
        Status: Success (0x00)
        Handle: 2757 Address: DF:A9:FF:F6:B1:1A (OUI DF-A9-FF)
        Features: 0x2d 0x49 0x00 0xf7 0x67 0xd9 0x00 0x80
          LE Encryption
          Extended Reject Indication
          Peripheral-initiated Features Exchange
          LE Data Packet Length Extension
          LE 2M PHY
          LE Coded PHY
          Channel Selection Algorithm #2
          Periodic Advertising Sync Transfer - Sender
          Periodic Advertising Sync Transfer - Recipient
          Sleep Clock Accuracy Updates
          Connected Isochronous Stream - Central
          Connected Isochronous Stream - Peripheral
          Isochronous Broadcaster
          Synchronized Receiver
          Connected Isochronous Stream (Host Support)
          LE Power Control Request
          LE Power Control Request
          Connection Subrating
          Connection Subrating (Host Support)
          Unknown features (0x8000d90000000000)
> ACL Data RX: Handle 2757 flags 0x02 dlen 11             #276 [hci1] 25.491550
      SMP: Pairing Request (0x01) len 6
        IO capability: KeyboardDisplay (0x04)
        OOB data: Authentication data not present (0x00)
        Authentication requirement: Bonding, No MITM, SC, No Keypresses (0x09)
        Max encryption key size: 14
        Initiator key distribution: <none> (0x00)
        Responder key distribution: <none> (0x00)
< HCI Command: Host Number of Com.. (0x03|0x0035) plen 5  #277 [hci1] 25.495531
        Num handles: 1
        Handle: 2757 Address: DF:A9:FF:F6:B1:1A (OUI DF-A9-FF)
        Count: 1
< ACL Data TX: Handle 2757 flags 0x00 dlen 6              #278 [hci1] 25.495610
      SMP: Pairing Failed (0x05) len 1
        Reason: Encryption key size (0x06)
> HCI Event: Number of Completed Packets (0x13) plen 5    #279 [hci1] 25.666321
        Num handles: 1
        Handle: 2757 Address: DF:A9:FF:F6:B1:1A (OUI DF-A9-FF)
        Count: 1
        #278: len 6 (0 Kb/s)
        Latency: 170 msec (170-170 msec ~170 msec)
> HCI Event: Disconnect Complete (0x05) plen 4            #280 [hci1] 25.754046
        Status: Success (0x00)
        Handle: 2757 Address: DF:A9:FF:F6:B1:1A (OUI DF-A9-FF)
        Reason: Remote User Terminated Connection (0x13)
< HCI Command: LE Set Extended A.. (0x08|0x0036) plen 25  #281 [hci1] 26.285282
        Handle: 0x00
        Properties: 0x0013
          Connectable
          Scannable
          Use legacy advertising PDUs: ADV_IND
        Min advertising interval: 100.000 msec (0x00a0)
        Max advertising interval: 150.000 msec (0x00f0)
        Channel map: 37, 38, 39 (0x07)
        Own address type: Random (0x01)
        Peer address type: Public (0x00)
        Peer address: 00:00:00:00:00:00 (OUI 00-00-00)
        Filter policy: Allow Scan Request from Any, Allow Connect Request from Any (0x00)
        TX power: Host has no preference (0x7f)
        Primary PHY: LE 1M (0x01)
        Secondary max skip: 0x00
        Secondary PHY: LE 1M (0x01)
        SID: 0x00
        Scan request notifications: Disabled (0x00)
> HCI Event: Command Complete (0x0e) plen 5               #282 [hci1] 26.286100
      LE Set Extended Advertising Parameters (0x08|0x0036) ncmd 1
        Status: Success (0x00)
        TX power (selected): 0 dbm (0x00)
< HCI Command: LE Set Advertising.. (0x08|0x0035) plen 7  #283 [hci1] 26.295054
        Advertising handle: 0x00
        Advertising random address: 48:61:8E:DB:C6:F9 (Resolvable)
> HCI Event: Command Complete (0x0e) plen 4               #284 [hci1] 26.295652
      LE Set Advertising Set Random Address (0x08|0x0035) ncmd 1
        Status: Success (0x00)
< HCI Command: LE Set Extended A.. (0x08|0x0037) plen 22  #285 [hci1] 26.315012
        Handle: 0x00
        Operation: Complete extended advertising data (0x03)
        Fragment preference: Minimize fragmentation (0x01)
        Data length: 0x12
        Flags: 0x04
          BR/EDR Not Supported
        Name (complete): Tester_F6B11A
> HCI Event: Command Complete (0x0e) plen 4               #286 [hci1] 26.315806
      LE Set Extended Advertising Data (0x08|0x0037) ncmd 1
        Status: Success (0x00)
< HCI Command: LE Set Extended Sc.. (0x08|0x0038) plen 4  #287 [hci1] 26.335040
        Handle: 0x00
        Operation: Complete scan response data (0x03)
        Fragment preference: Minimize fragmentation (0x01)
        Data length: 0x00
> HCI Event: Command Complete (0x0e) plen 4               #288 [hci1] 26.335507
      LE Set Extended Scan Response Data (0x08|0x0038) ncmd 1
        Status: Success (0x00)
< HCI Command: LE Set Extended Ad.. (0x08|0x0039) plen 6  #289 [hci1] 26.355006
        Extended advertising: Enabled (0x01)
        Number of sets: 1 (0x01)
        Entry 0
          Handle: 0x00
          Duration: 0 ms (0x00)
          Max ext adv events: 0
> HCI Event: Command Complete (0x0e) plen 4               #290 [hci1] 26.355547
      LE Set Extended Advertising Enable (0x08|0x0039) ncmd 1
        Status: Success (0x00)
> HCI Event: LE Meta Event (0x3e) plen 31                 #291 [hci1] 26.790072
      LE Enhanced Connection Complete (0x0a)
        Status: Success (0x00)
        Handle: 2775
        Role: Peripheral (0x01)
        Peer address type: Public (0x00)
        Peer address: DF:A9:FF:F6:B1:1A (OUI DF-A9-FF)
        Local resolvable private address: 00:00:00:00:00:00 (Non-Resolvable)
        Peer resolvable private address: 00:00:00:00:00:00 (Non-Resolvable)
        Connection interval: 87.50 msec (0x0046)
        Connection latency: 0 (0x0000)
        Supervision timeout: 20000 msec (0x07d0)
        Central clock accuracy: 0x01
> HCI Event: LE Meta Event (0x3e) plen 6                  #292 [hci1] 26.790122
      LE Advertising Set Terminated (0x12)
        Status: Success (0x00)
        Handle: 0
        Connection handle: 2775
        Number of completed extended advertising events: 0
< HCI Command: LE Read Remote Use.. (0x08|0x0016) plen 2  #293 [hci1] 26.795995
        Handle: 2775 Address: DF:A9:FF:F6:B1:1A (OUI DF-A9-FF)
> HCI Event: Command Status (0x0f) plen 4                 #294 [hci1] 26.796488
      LE Read Remote Used Features (0x08|0x0016) ncmd 1
        Status: Success (0x00)
> HCI Event: LE Meta Event (0x3e) plen 12                 #295 [hci1] 27.053960
      LE Read Remote Used Features (0x04)
        Status: Success (0x00)
        Handle: 2775 Address: DF:A9:FF:F6:B1:1A (OUI DF-A9-FF)
        Features: 0x2d 0x49 0x00 0xf7 0x67 0xd9 0x00 0x80
          LE Encryption
          Extended Reject Indication
          Peripheral-initiated Features Exchange
          LE Data Packet Length Extension
          LE 2M PHY
          LE Coded PHY
          Channel Selection Algorithm #2
          Periodic Advertising Sync Transfer - Sender
          Periodic Advertising Sync Transfer - Recipient
          Sleep Clock Accuracy Updates
          Connected Isochronous Stream - Central
          Connected Isochronous Stream - Peripheral
          Isochronous Broadcaster
          Synchronized Receiver
          Connected Isochronous Stream (Host Support)
          LE Power Control Request
          LE Power Control Request
          Connection Subrating
          Connection Subrating (Host Support)
          Unknown features (0x8000d90000000000)
> ACL Data RX: Handle 2775 flags 0x02 dlen 11             #296 [hci1] 27.491207
      SMP: Pairing Request (0x01) len 6
        IO capability: KeyboardDisplay (0x04)
        OOB data: Authentication data not present (0x00)
        Authentication requirement: Bonding, No MITM, SC, No Keypresses (0x09)
        Max encryption key size: 15
        Initiator key distribution: <none> (0x00)
        Responder key distribution: <none> (0x00)
< HCI Command: Host Number of Com.. (0x03|0x0035) plen 5  #297 [hci1] 27.495519
        Num handles: 1
        Handle: 2775 Address: DF:A9:FF:F6:B1:1A (OUI DF-A9-FF)
        Count: 1
< ACL Data TX: Handle 2775 flags 0x00 dlen 6              #298 [hci1] 27.495628
      SMP: Pairing Failed (0x05) len 1
        Reason: Encryption key size (0x06)
> HCI Event: Number of Completed Packets (0x13) plen 5    #299 [hci1] 27.666202
        Num handles: 1
        Handle: 2775 Address: DF:A9:FF:F6:B1:1A (OUI DF-A9-FF)
        Count: 1
        #298: len 6 (0 Kb/s)
        Latency: 170 msec (170-170 msec ~170 msec)
> HCI Event: Disconnect Complete (0x05) plen 4            #300 [hci1] 27.753805
        Status: Success (0x00)
        Handle: 2775 Address: DF:A9:FF:F6:B1:1A (OUI DF-A9-FF)
        Reason: Remote User Terminated Connection (0x13)
< HCI Command: Reset (0x03|0x0003) plen 0                 #301 [hci1] 33.385071
> HCI Event: Command Complete (0x0e) plen 4               #302 [hci1] 33.385618
      Reset (0x03|0x0003) ncmd 1
        Status: Success (0x00)
@ USER Close: main                                    {0x0001} [hci1] 33.395018
= Close Index: 00:00:00:00:00:00                               [hci1] 33.395025
