Bluetooth monitor ver 5.72
= Note: Linux version 6.14.0-36-generic (x86_64)                       0.415109
= Note: Bluetooth subsystem version 2.22                               0.415111
= New Index: 00:00:00:00:00:00 (Primary,UART,hci1)              [hci1] 0.415112
= New Index: 48:5F:99:8E:E0:64 (Primary,USB,hci0)               [hci0] 0.415113
= Open Index: 00:00:00:00:00:00                                 [hci1] 0.428418
= Index Info: 00:00:00:00:00:00 (Nordic Semiconductor ASA)      [hci1] 0.428423
@ USER Open: main (privileged) version 2.22            {0x0001} [hci1] 0.428426
< HCI Command: Reset (0x03|0x0003) plen 0                    #1 [hci1] 0.428798
> HCI Event: Command Complete (0x0e) plen 4                  #2 [hci1] 0.429246
      Reset (0x03|0x0003) ncmd 1
        Status: Success (0x00)
< HCI Command: Read Local Supported... (0x04|0x0003) plen 0  #3 [hci1] 0.448300
> HCI Event: Command Complete (0x0e) plen 12                 #4 [hci1] 0.448812
      Read Local Supported Features (0x04|0x0003) ncmd 1
        Status: Success (0x00)
        Features: 0x00 0x00 0x00 0x00 0x60 0x00 0x00 0x00
          BR/EDR Not Supported
          LE Supported (Controller)
< HCI Command: Read Local Version In.. (0x04|0x0001) plen 0  #5 [hci1] 0.468295
> HCI Event: Command Complete (0x0e) plen 12                 #6 [hci1] 0.468824
      Read Local Version Information (0x04|0x0001) ncmd 1
        Status: Success (0x00)
        HCI version: Reserved (0x0f) - Revision 12393 (0x3069)
        LMP version: Reserved (0x0f) - Subversion 12393 (0x3069)
        Manufacturer: Nordic Semiconductor ASA (89)
< HCI Command: Read Local Supported... (0x04|0x0002) plen 0  #7 [hci1] 0.490421
> HCI Event: Command Complete (0x0e) plen 68                 #8 [hci1] 0.491595
      Read Local Supported Commands (0x04|0x0002) ncmd 1
        Status: Success (0x00)
        Commands: 119 entries
          Disconnect (Octet 0 - Bit 5)
          Read Remote Version Information (Octet 2 - Bit 7)
          Set Event Mask (Octet 5 - Bit 6)
          Reset (Octet 5 - Bit 7)
          Read Connection Accept Timeout (Octet 7 - Bit 2)
          Write Connection Accept Timeout (Octet 7 - Bit 3)
          Read Transmit Power Level (Octet 10 - Bit 2)
          Set Controller To Host Flow Control (Octet 10 - Bit 5)
          Host Buffer Size (Octet 10 - Bit 6)
          Host Number of Completed Packets (Octet 10 - Bit 7)
          Read Local Version Information (Octet 14 - Bit 3)
          Read Local Supported Features (Octet 14 - Bit 5)
          Read BD ADDR (Octet 15 - Bit 1)
          Read RSSI (Octet 15 - Bit 5)
          Set Event Mask Page 2 (Octet 22 - Bit 2)
          LE Set Event Mask (Octet 25 - Bit 0)
          LE Read Buffer Size (Octet 25 - Bit 1)
          LE Read Local Supported Features (Octet 25 - Bit 2)
          LE Set Random Address (Octet 25 - Bit 4)
          LE Set Advertising Parameters (Octet 25 - Bit 5)
          LE Read Advertising Channel TX Power (Octet 25 - Bit 6)
          LE Set Advertising Data (Octet 25 - Bit 7)
          LE Set Scan Response Data (Octet 26 - Bit 0)
          LE Set Advertise Enable (Octet 26 - Bit 1)
          LE Set Scan Parameters (Octet 26 - Bit 2)
          LE Set Scan Enable (Octet 26 - Bit 3)
          LE Create Connection (Octet 26 - Bit 4)
          LE Create Connection Cancel (Octet 26 - Bit 5)
          LE Read Accept List Size (Octet 26 - Bit 6)
          LE Clear Accept List (Octet 26 - Bit 7)
          LE Add Device To Accept List (Octet 27 - Bit 0)
          LE Remove Device From Accept List (Octet 27 - Bit 1)
          LE Connection Update (Octet 27 - Bit 2)
          LE Set Host Channel Classification (Octet 27 - Bit 3)
          LE Read Channel Map (Octet 27 - Bit 4)
          LE Read Remote Used Features (Octet 27 - Bit 5)
          LE Encrypt (Octet 27 - Bit 6)
          LE Rand (Octet 27 - Bit 7)
          LE Start Encryption (Octet 28 - Bit 0)
          LE Long Term Key Request Reply (Octet 28 - Bit 1)
          LE Long Term Key Request Neg Reply (Octet 28 - Bit 2)
          LE Read Supported States (Octet 28 - Bit 3)
          LE Receiver Test (Octet 28 - Bit 4)
          LE Transmitter Test (Octet 28 - Bit 5)
          LE Test End (Octet 28 - Bit 6)
          Read Authenticated Payload Timeout (Octet 32 - Bit 4)
          Write Authenticated Payload Timeout (Octet 32 - Bit 5)
          LE Set Data Length (Octet 33 - Bit 6)
          LE Read Suggested Default Data Length (Octet 33 - Bit 7)
          LE Write Suggested Default Data Length (Octet 34 - Bit 0)
          LE Add Device To Resolving List (Octet 34 - Bit 3)
          LE Remove Device From Resolving List (Octet 34 - Bit 4)
          LE Clear Resolving List (Octet 34 - Bit 5)
          LE Read Resolving List Size (Octet 34 - Bit 6)
          LE Set Address Resolution Enable (Octet 35 - Bit 1)
          LE Set Resolvable Private Address Timeout (Octet 35 - Bit 2)
          LE Read Maximum Data Length (Octet 35 - Bit 3)
          LE Read PHY (Octet 35 - Bit 4)
          LE Set Default PHY (Octet 35 - Bit 5)
          LE Set PHY (Octet 35 - Bit 6)
          LE Enhanced Receiver Test (Octet 35 - Bit 7)
          LE Enhanced Transmitter Test (Octet 36 - Bit 0)
          LE Set Advertising Set Random Address (Octet 36 - Bit 1)
          LE Set Extended Advertising Parameters (Octet 36 - Bit 2)
          LE Set Extended Advertising Data (Octet 36 - Bit 3)
          LE Set Extended Scan Response Data (Octet 36 - Bit 4)
          LE Set Extended Advertising Enable (Octet 36 - Bit 5)
          LE Read Maximum Advertising Data Length (Octet 36 - Bit 6)
          LE Read Number of Supported Advertising Sets (Octet 36 - Bit 7)
          LE Remove Advertising Set (Octet 37 - Bit 0)
          LE Clear Advertising Sets (Octet 37 - Bit 1)
          LE Set Periodic Advertising Parameters (Octet 37 - Bit 2)
          LE Set Periodic Advertising Data (Octet 37 - Bit 3)
          LE Set Periodic Advertising Enable (Octet 37 - Bit 4)
          LE Set Extended Scan Parameters (Octet 37 - Bit 5)
          LE Set Extended Scan Enable (Octet 37 - Bit 6)
          LE Extended Create Connection (Octet 37 - Bit 7)
          LE Periodic Advertising Create Sync (Octet 38 - Bit 0)
          LE Periodic Advertising Create Sync Cancel (Octet 38 - Bit 1)
          LE Periodic Advertising Terminate Sync (Octet 38 - Bit 2)
          LE Add Device To Periodic Advertiser List (Octet 38 - Bit 3)
          LE Remove Device From Periodic Advertiser List (Octet 38 - Bit 4)
          LE Clear Periodic Advertiser List (Octet 38 - Bit 5)
          LE Read Periodic Advertiser List Size (Octet 38 - Bit 6)
          LE Read Transmit Power (Octet 38 - Bit 7)
          LE Read RF Path Compensation (Octet 39 - Bit 0)
          LE Write RF Path Compensation (Octet 39 - Bit 1)
          LE Set Privacy Mode (Octet 39 - Bit 2)
          LE Periodic Advertising Receive Enable (Octet 40 - Bit 5)
          LE Periodic Advertising Sync Transfer (Octet 40 - Bit 6)
          LE Periodic Advertising Set Info Transfer (Octet 40 - Bit 7)
          LE Periodic Advertising Sync Transfer Parameters (Octet 41 - Bit 0)
          LE Set Default Periodic Advertisng Sync Transfer Parameters (Octet 41 - Bit 1)
          LE Read Buffer v2 (Octet 41 - Bit 5)
          LE Read ISO TX Sync (Octet 41 - Bit 6)
          LE Set Connected Isochronous Group Parameters (Octet 41 - Bit 7)
          LE Set Connected Isochronous Group Parameters Test (Octet 42 - Bit 0)
          LE Create Connected Isochronous Stream (Octet 42 - Bit 1)
          LE Remove Connected Isochronous Group (Octet 42 - Bit 2)
          LE Accept Connected Isochronous Stream Request (Octet 42 - Bit 3)
          LE Reject Connected Isochronous Stream Request (Octet 42 - Bit 4)
          LE Create Broadcast Isochronous Group (Octet 42 - Bit 5)
          LE Create Broadcast Isochronous Group Test (Octet 42 - Bit 6)
          LE Terminate Broadcast Isochronous Group (Octet 42 - Bit 7)
          LE Broadcast Isochronous Group Create Sync (Octet 43 - Bit 0)
          LE Broadcast Isochronous Group Terminate Sync (Octet 43 - Bit 1)
          LE Request Peer SCA (Octet 43 - Bit 2)
          LE Setup Isochronous Data Path (Octet 43 - Bit 3)
          LE Remove Isochronous Data Path (Octet 43 - Bit 4)
          LE Isochronous Transmit Test (Octet 43 - Bit 5)
          LE Isochronous Receive Test (Octet 43 - Bit 6)
          LE Isochronous Read Test Counters (Octet 43 - Bit 7)
          LE Isochronous Read Test Counters (Octet 44 - Bit 0)
          LE Set Host Feature (Octet 44 - Bit 1)
          Octet 44 - Bit 2 
          Octet 45 - Bit 6 
          Octet 46 - Bit 0 
          Octet 46 - Bit 1 
          Octet 46 - Bit 2 
< HCI Command: Host Buffer Size (0x03|0x0033) plen 7         #9 [hci1] 0.508186
        ACL MTU: 255  ACL max packet: 16
        SCO MTU: 0    SCO max packet: 0
> HCI Event: Command Complete (0x0e) plen 4                 #10 [hci1] 0.508699
      Host Buffer Size (0x03|0x0033) ncmd 1
        Status: Success (0x00)
< HCI Command: Set Controller To Ho.. (0x03|0x0031) plen 1  #11 [hci1] 0.528320
        Flow control: ACL Data Packets (0x01)
> HCI Event: Command Complete (0x0e) plen 4                 #12 [hci1] 0.528724
      Set Controller To Host Flow Control (0x03|0x0031) ncmd 1
        Status: Success (0x00)
< HCI Command: LE Read Local Suppor.. (0x08|0x0003) plen 0  #13 [hci1] 0.548309
> HCI Event: Command Complete (0x0e) plen 12                #14 [hci1] 0.548814
      LE Read Local Supported Features (0x08|0x0003) ncmd 1
        Status: Success (0x00)
        Features: 0xfd 0x79 0x00 0xf7 0x30 0x01 0x00 0x00
          LE Encryption
          Extended Reject Indication
          Peripheral-initiated Features Exchange
          LE Ping
          LE Data Packet Length Extension
          LL Privacy
          Extended Scanner Filter Policies
          LE 2M PHY
          LE Coded PHY
          LE Extended Advertising
          LE Periodic Advertising
          Channel Selection Algorithm #2
          Periodic Advertising Sync Transfer - Sender
          Periodic Advertising Sync Transfer - Recipient
          Sleep Clock Accuracy Updates
          Connected Isochronous Stream - Central
          Connected Isochronous Stream - Peripheral
          Isochronous Broadcaster
          Synchronized Receiver
          Periodic Advertising ADI support
          Connection Subrating
          Unknown features (0x0000010000000000)
< HCI Command: LE Set Host Feature (0x08|0x0074) plen 2     #15 [hci1] 0.568350
        Bit Number: 32
          Connected Isochronous Stream (Host Support)
        Bit Value: 1
> HCI Event: Command Complete (0x0e) plen 4                 #16 [hci1] 0.568708
      LE Set Host Feature (0x08|0x0074) ncmd 1
        Status: Success (0x00)
< HCI Command: LE Read Buffer v2 (0x08|0x0060) plen 0       #17 [hci1] 0.588317
> HCI Event: Command Complete (0x0e) plen 10                #18 [hci1] 0.588774
      LE Read Buffer v2 (0x08|0x0060) ncmd 1
        Status: Success (0x00)
        ACL MTU: 27
        ACL max packet: 3
        ISO MTU: 318
        ISO max packet: 3
< HCI Command: LE Read Maximum Adve.. (0x08|0x003a) plen 0  #19 [hci1] 0.608306
> HCI Event: Command Complete (0x0e) plen 6                 #20 [hci1] 0.608806
      LE Read Maximum Advertising Data Length (0x08|0x003a) ncmd 1
        Status: Success (0x00)
        Max length: 1650
< HCI Command: LE Read Supported St.. (0x08|0x001c) plen 0  #21 [hci1] 0.628279
> HCI Event: Command Complete (0x0e) plen 12                #22 [hci1] 0.628842
      LE Read Supported States (0x08|0x001c) ncmd 1
        Status: Success (0x00)
        States: 0x000003ff3e0306ff
          Non-connectable Advertising State
          Scannable Advertising State
          Connectable Advertising State
          High Duty Cycle Directed Advertising State
          Passive Scanning State
          Active Scanning State
          Initiating State
            and Connection State (Central Role)
          Connection State (Peripheral Role)
          Scannable Advertising State
            and Passive Scanning State
          Connectable Advertising State
            and Passive Scanning State
          Non-connectable Advertising State
            and Initiating State
          Scannable Advertising State
            and Initiating State
          Active Scanning State
            and Connection State (Central Role)
          Passive Scanning State
            and Connection State (Peripheral Role)
          Active Scanning State
            and Connection State (Peripheral Role)
          Initiating State
            and Connection State (Central Role)
            and Central Role & Central Role
          Low Duty Cycle Directed Advertising State
          Connectable Advertising State
            and Initiating State
            and Central Role & Peripheral Role
          High Duty Cycle Directed Advertising State
            and Initiating State
            and Central Role & Peripheral Role
          Low Duty Cycle Directed Advertising State
            and Initiating State
            and Central Role & Peripheral Role
          Connectable Advertising State
            and Connection State (Central Role)
            and Central Role & Peripheral Role
          High Duty Cycle Directed Advertising State
            and Connection State (Central Role)
            and Central Role & Peripheral Role
          Low Duty Cycle Directed Advertising State
            and Connection State (Central Role)
            and Central Role & Peripheral Role
          Connectable Advertising State
            and Connection State (Peripheral Role)
            and Central Role & Peripheral Role
          High Duty Cycle Directed Advertising State
            and Connection State (Peripheral Role)
            and Peripheral Role & Peripheral Role
          Low Duty Cycle Directed Advertising State
            and Connection State (Peripheral Role)
            and Peripheral Role & Peripheral Role
          Initiating State
            and Connection State (Peripheral Role)
            and Central Role & Peripheral Role
< HCI Command: LE Read Maximum Data.. (0x08|0x002f) plen 0  #23 [hci1] 0.648338
> HCI Event: Command Complete (0x0e) plen 12                #24 [hci1] 0.648773
      LE Read Maximum Data Length (0x08|0x002f) ncmd 1
        Status: Success (0x00)
        Max TX octets: 251
        Max TX time: 2704
        Max RX octets: 251
        Max RX time: 2704
< HCI Command: LE Write Suggested D.. (0x08|0x0024) plen 4  #25 [hci1] 0.668306
        TX octets: 251
        TX time: 2704
> HCI Event: Command Complete (0x0e) plen 4                 #26 [hci1] 0.668758
      LE Write Suggested Default Data Length (0x08|0x0024) ncmd 1
        Status: Success (0x00)
< HCI Command: LE Read Resolving Li.. (0x08|0x002a) plen 0  #27 [hci1] 0.688301
> HCI Event: Command Complete (0x0e) plen 5                 #28 [hci1] 0.688795
      LE Read Resolving List Size (0x08|0x002a) ncmd 1
        Status: Success (0x00)
        Size: 8
< HCI Command: LE Set Event Mask (0x08|0x0001) plen 8       #29 [hci1] 0.708330
        Mask: 0x000002023f87fa5e
          LE Advertising Report
          LE Connection Update Complete
          LE Read Remote Used Features Complete
          LE Long Term Key Request
          LE Data Length Change
          LE Enhanced Connection Complete
          LE PHY Update Complete
          LE Extended Advertising Report
          LE Periodic Advertising Sync Established
          LE Periodic Advertising Report
          LE Periodic Advertising Sync Lost
          LE Extended Scan Timeout
          LE Extended Advertising Set Terminated
          LE Scan Request Received
          LE Periodic Advertising Sync Transfer Rvc
          LE CIS Established
          LE CIS Request
          LE Create BIG Complete
          LE Terminate BIG Complete
          LE BIG Sync Estabilished Complete
          LE BIG Sync Lost
          LE BIG Info Advertising Report
          Unknown mask (0x0000020000000000)
> HCI Event: Command Complete (0x0e) plen 4                 #30 [hci1] 0.708876
      LE Set Event Mask (0x08|0x0001) ncmd 1
        Status: Success (0x00)
< HCI Command: Set Event Mask (0x03|0x0001) plen 8          #31 [hci1] 0.728283
        Mask: 0x2000800002008890
          Disconnection Complete
          Encryption Change
          Read Remote Version Information Complete
          Hardware Error
          Data Buffer Overflow
          Encryption Key Refresh Complete
          LE Meta
> HCI Event: Command Complete (0x0e) plen 4                 #32 [hci1] 0.728846
      Set Event Mask (0x03|0x0001) ncmd 1
        Status: Success (0x00)
< HCI Command: Read BD ADDR (0x04|0x0009) plen 0            #33 [hci1] 0.748324
> HCI Event: Command Complete (0x0e) plen 10                #34 [hci1] 0.748852
      Read BD ADDR (0x04|0x0009) ncmd 1
        Status: Success (0x00)
        Address: 00:00:00:00:00:00 (OUI 00-00-00)
< HCI Command: LE Set Random Address (0x08|0x0005) plen 6   #35 [hci1] 0.768317
        Address: D5:B6:CC:31:DB:3B (Static)
> HCI Event: Command Complete (0x0e) plen 4                 #36 [hci1] 0.768838
      LE Set Random Address (0x08|0x0005) ncmd 1
        Status: Success (0x00)
< HCI Command: LE Set Extended Adv.. (0x08|0x0036) plen 25  #37 [hci1] 5.068346
        Handle: 0x00
        Properties: 0x0013
          Connectable
          Scannable
          Use legacy advertising PDUs: ADV_IND
        Min advertising interval: 100.000 msec (0x00a0)
        Max advertising interval: 150.000 msec (0x00f0)
        Channel map: 37, 38, 39 (0x07)
        Own address type: Random (0x01)
        Peer address type: Public (0x00)
        Peer address: 00:00:00:00:00:00 (OUI 00-00-00)
        Filter policy: Allow Scan Request from Any, Allow Connect Request from Any (0x00)
        TX power: Host has no preference (0x7f)
        Primary PHY: LE 1M (0x01)
        Secondary max skip: 0x00
        Secondary PHY: LE 1M (0x01)
        SID: 0x00
        Scan request notifications: Disabled (0x00)
> HCI Event: Command Complete (0x0e) plen 5                 #38 [hci1] 5.069203
      LE Set Extended Advertising Parameters (0x08|0x0036) ncmd 1
        Status: Success (0x00)
        TX power (selected): 0 dbm (0x00)
< HCI Command: LE Set Advertising S.. (0x08|0x0035) plen 7  #39 [hci1] 5.088322
        Advertising handle: 0x00
        Advertising random address: D5:B6:CC:31:DB:3B (Static)
> HCI Event: Command Complete (0x0e) plen 4                 #40 [hci1] 5.088839
      LE Set Advertising Set Random Address (0x08|0x0035) ncmd 1
        Status: Success (0x00)
< HCI Command: LE Set Extended Adv.. (0x08|0x0037) plen 22  #41 [hci1] 5.108357
        Handle: 0x00
        Operation: Complete extended advertising data (0x03)
        Fragment preference: Minimize fragmentation (0x01)
        Data length: 0x12
        Flags: 0x06
          LE General Discoverable Mode
          BR/EDR Not Supported
        Name (complete): Tester_F6B11A
> HCI Event: Command Complete (0x0e) plen 4                 #42 [hci1] 5.109029
      LE Set Extended Advertising Data (0x08|0x0037) ncmd 1
        Status: Success (0x00)
< HCI Command: LE Set Extended Scan.. (0x08|0x0038) plen 4  #43 [hci1] 5.128279
        Handle: 0x00
        Operation: Complete scan response data (0x03)
        Fragment preference: Minimize fragmentation (0x01)
        Data length: 0x00
> HCI Event: Command Complete (0x0e) plen 4                 #44 [hci1] 5.128841
      LE Set Extended Scan Response Data (0x08|0x0038) ncmd 1
        Status: Success (0x00)
< HCI Command: LE Set Extended Adve.. (0x08|0x0039) plen 6  #45 [hci1] 5.148331
        Extended advertising: Enabled (0x01)
        Number of sets: 1 (0x01)
        Entry 0
          Handle: 0x00
          Duration: 0 ms (0x00)
          Max ext adv events: 0
> HCI Event: Command Complete (0x0e) plen 4                 #46 [hci1] 5.148869
      LE Set Extended Advertising Enable (0x08|0x0039) ncmd 1
        Status: Success (0x00)
> HCI Event: LE Meta Event (0x3e) plen 31                   #47 [hci1] 5.479489
      LE Enhanced Connection Complete (0x0a)
        Status: Success (0x00)
        Handle: 1767
        Role: Peripheral (0x01)
        Peer address type: Public (0x00)
        Peer address: DF:A9:FF:F6:B1:1A (OUI DF-A9-FF)
        Local resolvable private address: 00:00:00:00:00:00 (Non-Resolvable)
        Peer resolvable private address: 00:00:00:00:00:00 (Non-Resolvable)
        Connection interval: 87.50 msec (0x0046)
        Connection latency: 0 (0x0000)
        Supervision timeout: 20000 msec (0x07d0)
        Central clock accuracy: 0x01
> HCI Event: LE Meta Event (0x3e) plen 6                    #48 [hci1] 5.479652
      LE Advertising Set Terminated (0x12)
        Status: Success (0x00)
        Handle: 0
        Connection handle: 1767
        Number of completed extended advertising events: 0
< HCI Command: LE Read Remote Used... (0x08|0x0016) plen 2  #49 [hci1] 5.488646
        Handle: 1767 Address: DF:A9:FF:F6:B1:1A (OUI DF-A9-FF)
> HCI Event: Command Status (0x0f) plen 4                   #50 [hci1] 5.489142
      LE Read Remote Used Features (0x08|0x0016) ncmd 1
        Status: Success (0x00)
> HCI Event: LE Meta Event (0x3e) plen 12                   #51 [hci1] 5.743263
      LE Read Remote Used Features (0x04)
        Status: Success (0x00)
        Handle: 1767 Address: DF:A9:FF:F6:B1:1A (OUI DF-A9-FF)
        Features: 0x2d 0x49 0x00 0xf7 0x67 0xd8 0x00 0x00
          LE Encryption
          Extended Reject Indication
          Peripheral-initiated Features Exchange
          LE Data Packet Length Extension
          LE 2M PHY
          LE Coded PHY
          Channel Selection Algorithm #2
          Periodic Advertising Sync Transfer - Sender
          Periodic Advertising Sync Transfer - Recipient
          Sleep Clock Accuracy Updates
          Connected Isochronous Stream - Central
          Connected Isochronous Stream - Peripheral
          Isochronous Broadcaster
          Synchronized Receiver
          Connected Isochronous Stream (Host Support)
          LE Power Control Request
          LE Power Control Request
          Connection Subrating
          Connection Subrating (Host Support)
          Unknown features (0x0000d80000000000)
< ACL Data TX: Handle 1767 flags 0x00 dlen 16              #52 [hci1] 10.498640
      LE L2CAP: Connection Parameter Update Request (0x12) ident 1 len 8
        Min interval: 24
        Max interval: 40
        Peripheral latency: 0
        Timeout multiplier: 42
> HCI Event: Number of Completed Packets (0x13) plen 5     #53 [hci1] 10.642887
        Num handles: 1
        Handle: 1767 Address: DF:A9:FF:F6:B1:1A (OUI DF-A9-FF)
        Count: 1
        #52: len 16 (0 Kb/s)
        Latency: 144 msec (144-144 msec ~144 msec)
> ACL Data RX: Handle 1767 flags 0x02 dlen 10              #54 [hci1] 10.643070
      LE L2CAP: Connection Parameter Update Response (0x13) ident 1 len 2
        Result: Connection Parameters accepted (0x0000)
< HCI Command: Host Number of Comp.. (0x03|0x0035) plen 5  #55 [hci1] 10.649169
        Num handles: 1
        Handle: 1767 Address: DF:A9:FF:F6:B1:1A (OUI DF-A9-FF)
        Count: 1
> ACL Data RX: Handle 1767 flags 0x02 dlen 11              #56 [hci1] 13.442858
      SMP: Pairing Request (0x01) len 6
        IO capability: KeyboardDisplay (0x04)
        OOB data: Authentication data not present (0x00)
        Authentication requirement: Bonding, No MITM, Legacy, No Keypresses (0x01)
        Max encryption key size: 16
        Initiator key distribution: EncKey IdKey Sign (0x07)
        Responder key distribution: EncKey IdKey Sign (0x07)
< HCI Command: Host Number of Comp.. (0x03|0x0035) plen 5  #57 [hci1] 13.448647
        Num handles: 1
        Handle: 1767 Address: DF:A9:FF:F6:B1:1A (OUI DF-A9-FF)
        Count: 1
< ACL Data TX: Handle 1767 flags 0x00 dlen 11              #58 [hci1] 13.448794
      SMP: Pairing Response (0x02) len 6
        IO capability: NoInputNoOutput (0x03)
        OOB data: Authentication data not present (0x00)
        Authentication requirement: Bonding, No MITM, Legacy, No Keypresses (0x01)
        Max encryption key size: 16
        Initiator key distribution: EncKey IdKey (0x03)
        Responder key distribution: EncKey (0x01)
> HCI Event: Number of Completed Packets (0x13) plen 5     #59 [hci1] 13.617894
        Num handles: 1
        Handle: 1767 Address: DF:A9:FF:F6:B1:1A (OUI DF-A9-FF)
        Count: 1
        #58: len 11 (0 Kb/s)
        Latency: 169 msec (144-169 msec ~156 msec)
> ACL Data RX: Handle 1767 flags 0x02 dlen 21              #60 [hci1] 13.618150
      SMP: Pairing Confirm (0x03) len 16
        Confim value: ca5f36ec016a4e0a02c2ba7fcca62709
< HCI Command: Host Number of Comp.. (0x03|0x0035) plen 5  #61 [hci1] 13.629265
        Num handles: 1
        Handle: 1767 Address: DF:A9:FF:F6:B1:1A (OUI DF-A9-FF)
        Count: 1
< ACL Data TX: Handle 1767 flags 0x00 dlen 21              #62 [hci1] 13.629355
      SMP: Pairing Confirm (0x03) len 16
        Confim value: da9c45dd7031e04493b907413e4a0ff7
> HCI Event: Number of Completed Packets (0x13) plen 5     #63 [hci1] 13.792955
        Num handles: 1
        Handle: 1767 Address: DF:A9:FF:F6:B1:1A (OUI DF-A9-FF)
        Count: 1
        #62: len 21 (1 Kb/s)
        Latency: 163 msec (144-169 msec ~160 msec)
> ACL Data RX: Handle 1767 flags 0x02 dlen 21              #64 [hci1] 13.793059
      SMP: Pairing Random (0x04) len 16
        Random value: f2d93c5964f32dc70000000000000000
< HCI Command: Host Number of Comp.. (0x03|0x0035) plen 5  #65 [hci1] 13.809326
        Num handles: 1
        Handle: 1767 Address: DF:A9:FF:F6:B1:1A (OUI DF-A9-FF)
        Count: 1
< ACL Data TX: Handle 1767 flags 0x00 dlen 21              #66 [hci1] 13.809485
      SMP: Pairing Random (0x04) len 16
        Random value: 8e6108f966a694cbe26df70bb96773e6
> HCI Event: Number of Completed Packets (0x13) plen 5     #67 [hci1] 13.967552
        Num handles: 1
        Handle: 1767 Address: DF:A9:FF:F6:B1:1A (OUI DF-A9-FF)
        Count: 1
        #66: len 21 (1 Kb/s)
        Latency: 158 msec (144-169 msec ~159 msec)
> HCI Event: LE Meta Event (0x3e) plen 13                  #68 [hci1] 14.055665
      LE Long Term Key Request (0x05)
        Handle: 1767 Address: DF:A9:FF:F6:B1:1A (OUI DF-A9-FF)
        Random number: 0x0000000000000000
        Encrypted diversifier: 0x0000
< HCI Command: LE Long Term Key R.. (0x08|0x001a) plen 18  #69 [hci1] 14.068343
        Handle: 1767 Address: DF:A9:FF:F6:B1:1A (OUI DF-A9-FF)
        Long term key: 7c19df4c582ae0a1324e10c7de3ef204
> HCI Event: Command Complete (0x0e) plen 6                #70 [hci1] 14.069021
      LE Long Term Key Request Reply (0x08|0x001a) ncmd 1
        Status: Success (0x00)
        Handle: 1767 Address: DF:A9:FF:F6:B1:1A (OUI DF-A9-FF)
> HCI Event: Encryption Change (0x08) plen 4               #71 [hci1] 14.492928
        Status: Success (0x00)
        Handle: 1767 Address: DF:A9:FF:F6:B1:1A (OUI DF-A9-FF)
        Encryption: Enabled with AES-CCM (0x01)
< ACL Data TX: Handle 1767 flags 0x00 dlen 21              #72 [hci1] 14.619011
      SMP: Encryption Information (0x06) len 16
        Long term key: 5da095555cc64d02679f89a05211af56
< ACL Data TX: Handle 1767 flags 0x00 dlen 15              #73 [hci1] 14.619041
      SMP: Central Identification (0x07) len 10
        EDIV: 0x825e
        Rand: 0x84c81ed264dab3d8
> HCI Event: Number of Completed Packets (0x13) plen 5     #74 [hci1] 14.668152
        Num handles: 1
        Handle: 1767 Address: DF:A9:FF:F6:B1:1A (OUI DF-A9-FF)
        Count: 1
        #72: len 21 (3 Kb/s)
        Latency: 49 msec (49-169 msec ~104 msec)
> HCI Event: Number of Completed Packets (0x13) plen 5     #75 [hci1] 14.755375
        Num handles: 1
        Handle: 1767 Address: DF:A9:FF:F6:B1:1A (OUI DF-A9-FF)
        Count: 1
        #73: len 15 (0 Kb/s)
        Latency: 136 msec (49-169 msec ~120 msec)
> ACL Data RX: Handle 1767 flags 0x02 dlen 21              #76 [hci1] 14.755567
      SMP: Encryption Information (0x06) len 16
        Long term key: 272d84b91fca652eb56b9898b00f2c98
> ACL Data RX: Handle 1767 flags 0x02 dlen 15              #77 [hci1] 14.755938
      SMP: Central Identification (0x07) len 10
        EDIV: 0x36e1
        Rand: 0xd5b80faf196df9bf
> ACL Data RX: Handle 1767 flags 0x02 dlen 21              #78 [hci1] 14.756565
      SMP: Identity Information (0x08) len 16
        Identity resolving key: 808d1bfca9e6d0df3ac7b5da9417e71d
< HCI Command: Host Number of Comp.. (0x03|0x0035) plen 5  #79 [hci1] 14.768838
        Num handles: 1
        Handle: 1767 Address: DF:A9:FF:F6:B1:1A (OUI DF-A9-FF)
        Count: 1
< HCI Command: Host Number of Comp.. (0x03|0x0035) plen 5  #80 [hci1] 14.769052
        Num handles: 1
        Handle: 1767 Address: DF:A9:FF:F6:B1:1A (OUI DF-A9-FF)
        Count: 1
< HCI Command: Host Number of Comp.. (0x03|0x0035) plen 5  #81 [hci1] 14.769199
        Num handles: 1
        Handle: 1767 Address: DF:A9:FF:F6:B1:1A (OUI DF-A9-FF)
        Count: 1
> ACL Data RX: Handle 1767 flags 0x02 dlen 12              #82 [hci1] 14.842821
      SMP: Identity Address Information (0x09) len 7
        Address: DF:A9:FF:F6:B1:1A (OUI DF-A9-FF)
> ACL Data RX: Handle 1767 flags 0x02 dlen 26              #83 [hci1] 14.843571
      LE L2CAP: Enhanced Credit Connection Request (0x17) ident 1 len 18
        PSM: 39 (0x0027)
        MTU: 64
        MPS: 64
        Credits: 5
        Source CID: 84
        Source CID: 83
        Source CID: 82
        Source CID: 81
        Source CID: 80
< HCI Command: LE Add Device To R.. (0x08|0x0027) plen 39  #84 [hci1] 14.848631
        Address type: Public (0x00)
        Address: DF:A9:FF:F6:B1:1A (OUI DF-A9-FF)
        Peer identity resolving key: 808d1bfca9e6d0df3ac7b5da9417e71d
        Local identity resolving key: 00000000000000000000000000000000
> HCI Event: Command Complete (0x0e) plen 4                #85 [hci1] 14.849536
      LE Add Device To Resolving List (0x08|0x0027) ncmd 1
        Status: Success (0x00)
< HCI Command: LE Set Privacy Mode (0x08|0x004e) plen 8    #86 [hci1] 14.868776
        Peer Identity address type: Public (0x00)
        Peer Identity address: DF:A9:FF:F6:B1:1A (OUI DF-A9-FF)
        Privacy Mode: Use Device Privacy (0x01)
> HCI Event: Command Complete (0x0e) plen 4                #87 [hci1] 14.869289
      LE Set Privacy Mode (0x08|0x004e) ncmd 1
        Status: Success (0x00)
< HCI Command: LE Set Address Reso.. (0x08|0x002d) plen 1  #88 [hci1] 14.888859
        Address resolution: Enabled (0x01)
> HCI Event: Command Complete (0x0e) plen 4                #89 [hci1] 14.889302
      LE Set Address Resolution Enable (0x08|0x002d) ncmd 1
        Status: Success (0x00)
< HCI Command: Host Number of Comp.. (0x03|0x0035) plen 5  #90 [hci1] 14.908729
        Num handles: 1
        Handle: 1767 Address: DF:A9:FF:F6:B1:1A (OUI DF-A9-FF)
        Count: 1
< HCI Command: Host Number of Comp.. (0x03|0x0035) plen 5  #91 [hci1] 14.909265
        Num handles: 1
        Handle: 1767 Address: DF:A9:FF:F6:B1:1A (OUI DF-A9-FF)
        Count: 1
< ACL Data TX: Handle 1767 flags 0x00 dlen 26              #92 [hci1] 14.909446
      LE L2CAP: Enhanced Credit Connection Response (0x18) ident 1 len 18
        MTU: 249
        MPS: 251
        Credits: 1
        Result: Connection successful (0x0000)
        Destination CID: 64
        Destination CID: 65
        Destination CID: 66
        Destination CID: 67
        Destination CID: 68
> HCI Event: Number of Completed Packets (0x13) plen 5     #93 [hci1] 15.017514
        Num handles: 1
        Handle: 1767 Address: DF:A9:FF:F6:B1:1A (OUI DF-A9-FF)
        Count: 1
        #92: len 26 (1 Kb/s)
        Latency: 108 msec (49-169 msec ~114 msec)
< ACL Data TX: Handle 1767 flags 0x00 dlen 9               #94 [hci1] 18.578689
      Channel: 80 len 5 sdu 3 [PSM 39 mode Enhanced Credit (0x81)] {chan 4}
      ATT: Read Request (0x0a) len 2
        Handle: 0x01aa
> HCI Event: Number of Completed Packets (0x13) plen 5     #95 [hci1] 18.692665
        Num handles: 1
        Handle: 1767 Address: DF:A9:FF:F6:B1:1A (OUI DF-A9-FF)
        Count: 1
        #94: len 9 (0 Kb/s)
        Latency: 113 msec (49-169 msec ~114 msec)
        Channel: 80 [PSM 39 mode Enhanced Credit (0x81)] {chan 4}
        Channel Latency: 113 msec (113-113 msec ~113 msec)
> ACL Data RX: Handle 1767 flags 0x02 dlen 27              #96 [hci1] 18.692984
> ACL Data RX: Handle 1767 flags 0x01 dlen 27              #97 [hci1] 18.693649
> ACL Data RX: Handle 1767 flags 0x01 dlen 16              #98 [hci1] 18.694062
      Channel: 68 len 66 sdu 64 [PSM 39 mode Enhanced Credit (0x81)] {chan 4}
      ATT: Read Response (0x0b) len 63
< HCI Command: Host Number of Comp.. (0x03|0x0035) plen 5  #99 [hci1] 18.708728
        Num handles: 1
        Handle: 1767 Address: DF:A9:FF:F6:B1:1A (OUI DF-A9-FF)
        Count: 1
< HCI Command: Host Number of Com.. (0x03|0x0035) plen 5  #100 [hci1] 18.708810
        Num handles: 1
        Handle: 1767 Address: DF:A9:FF:F6:B1:1A (OUI DF-A9-FF)
        Count: 1
< HCI Command: Host Number of Com.. (0x03|0x0035) plen 5  #101 [hci1] 18.708813
        Num handles: 1
        Handle: 1767 Address: DF:A9:FF:F6:B1:1A (OUI DF-A9-FF)
        Count: 1
< ACL Data TX: Handle 1767 flags 0x00 dlen 11             #102 [hci1] 18.708890
      Channel: 80 len 7 sdu 5 [PSM 39 mode Enhanced Credit (0x81)] {chan 4}
      ATT: Read Blob Request (0x0c) len 4
        Handle: 0x01aa
        Offset: 0x003f
< ACL Data TX: Handle 1767 flags 0x00 dlen 12             #103 [hci1] 18.708973
      LE L2CAP: LE Flow Control Credit (0x16) ident 2 len 4
        Source CID: 68
        Credits: 1
> HCI Event: Number of Completed Packets (0x13) plen 5    #104 [hci1] 18.780408
        Num handles: 1
        Handle: 1767 Address: DF:A9:FF:F6:B1:1A (OUI DF-A9-FF)
        Count: 1
        #102: len 11 (1 Kb/s)
        Latency: 71 msec (49-169 msec ~92 msec)
        Channel: 80 [PSM 39 mode Enhanced Credit (0x81)] {chan 4}
        Channel Latency: 71 msec (71-113 msec ~92 msec)
> HCI Event: Number of Completed Packets (0x13) plen 5    #105 [hci1] 18.867716
        Num handles: 1
        Handle: 1767 Address: DF:A9:FF:F6:B1:1A (OUI DF-A9-FF)
        Count: 1
        #103: len 12 (0 Kb/s)
        Latency: 158 msec (49-169 msec ~125 msec)
        Channel: 80 [PSM 39 mode Enhanced Credit (0x81)] {chan 4}
        Channel Latency: 158 msec (71-158 msec ~125 msec)
> ACL Data RX: Handle 1767 flags 0x02 dlen 27             #106 [hci1] 18.868043
> ACL Data RX: Handle 1767 flags 0x01 dlen 27             #107 [hci1] 18.868536
> ACL Data RX: Handle 1767 flags 0x01 dlen 16             #108 [hci1] 18.869057
      Channel: 68 len 66 sdu 64 [PSM 39 mode Enhanced Credit (0x81)] {chan 4}
      ATT: Read Blob Response (0x0d) len 63
        33 44 55 66 77 88 99 00 11 22 33 44 55 66 77 88  3DUfw...."3DUfw.
        99 00 11 22 33 44 55 66 77 88 99 00 11 22 33 44  ..."3DUfw...."3D
        55 66 77 88 99 00 11 22 33 44 55 66 77 88 99 00  Ufw...."3DUfw...
        11 22 33 44 55 66 77 88 99 00 11 22 33 44 55     ."3DUfw...."3DU 
< HCI Command: Host Number of Com.. (0x03|0x0035) plen 5  #109 [hci1] 18.888538
        Num handles: 1
        Handle: 1767 Address: DF:A9:FF:F6:B1:1A (OUI DF-A9-FF)
        Count: 1
< HCI Command: Host Number of Com.. (0x03|0x0035) plen 5  #110 [hci1] 18.888620
        Num handles: 1
        Handle: 1767 Address: DF:A9:FF:F6:B1:1A (OUI DF-A9-FF)
        Count: 1
< HCI Command: Host Number of Com.. (0x03|0x0035) plen 5  #111 [hci1] 18.888642
        Num handles: 1
        Handle: 1767 Address: DF:A9:FF:F6:B1:1A (OUI DF-A9-FF)
        Count: 1
< ACL Data TX: Handle 1767 flags 0x00 dlen 11             #112 [hci1] 18.888683
      Channel: 80 len 7 sdu 5 [PSM 39 mode Enhanced Credit (0x81)] {chan 4}
      ATT: Read Blob Request (0x0c) len 4
        Handle: 0x01aa
        Offset: 0x007e
< ACL Data TX: Handle 1767 flags 0x00 dlen 12             #113 [hci1] 18.888775
      LE L2CAP: LE Flow Control Credit (0x16) ident 3 len 4
        Source CID: 68
        Credits: 1
> HCI Event: Number of Completed Packets (0x13) plen 5    #114 [hci1] 18.955523
        Num handles: 1
        Handle: 1767 Address: DF:A9:FF:F6:B1:1A (OUI DF-A9-FF)
        Count: 1
        #112: len 11 (1 Kb/s)
        Latency: 66 msec (49-169 msec ~96 msec)
        Channel: 80 [PSM 39 mode Enhanced Credit (0x81)] {chan 4}
        Channel Latency: 66 msec (66-158 msec ~96 msec)
> HCI Event: Number of Completed Packets (0x13) plen 5    #115 [hci1] 19.042625
        Num handles: 1
        Handle: 1767 Address: DF:A9:FF:F6:B1:1A (OUI DF-A9-FF)
        Count: 1
        #113: len 12 (0 Kb/s)
        Latency: 153 msec (49-169 msec ~125 msec)
> ACL Data RX: Handle 1767 flags 0x02 dlen 9              #116 [hci1] 19.042729
      Channel: 68 len 5 sdu 3 [PSM 39 mode Enhanced Credit (0x81)] {chan 4}
      ATT: Read Blob Response (0x0d) len 2
        66 77                                            fw              
< HCI Command: Host Number of Com.. (0x03|0x0035) plen 5  #117 [hci1] 19.048685
        Num handles: 1
        Handle: 1767 Address: DF:A9:FF:F6:B1:1A (OUI DF-A9-FF)
        Count: 1
< ACL Data TX: Handle 1767 flags 0x00 dlen 12             #118 [hci1] 19.048758
      LE L2CAP: LE Flow Control Credit (0x16) ident 4 len 4
        Source CID: 68
        Credits: 1
> HCI Event: Number of Completed Packets (0x13) plen 5    #119 [hci1] 19.217364
        Num handles: 1
        Handle: 1767 Address: DF:A9:FF:F6:B1:1A (OUI DF-A9-FF)
        Count: 1
        #118: len 12 (0 Kb/s)
        Latency: 168 msec (49-169 msec ~146 msec)
        Channel: 80 [PSM 39 mode Enhanced Credit (0x81)] {chan 4}
        Channel Latency: 168 msec (66-168 msec ~132 msec)
< ACL Data TX: Handle 1767 flags 0x00 dlen 9              #120 [hci1] 21.099099
      Channel: 80 len 5 sdu 3 [PSM 39 mode Enhanced Credit (0x81)] {chan 4}
      ATT: Read Request (0x0a) len 2
        Handle: 0x01b0
> HCI Event: Number of Completed Packets (0x13) plen 5    #121 [hci1] 21.229969
        Num handles: 1
        Handle: 1767 Address: DF:A9:FF:F6:B1:1A (OUI DF-A9-FF)
        Count: 1
        #120: len 9 (0 Kb/s)
        Latency: 130 msec (49-169 msec ~138 msec)
        Channel: 80 [PSM 39 mode Enhanced Credit (0x81)] {chan 4}
        Channel Latency: 130 msec (66-168 msec ~131 msec)
> ACL Data RX: Handle 1767 flags 0x02 dlen 12             #122 [hci1] 21.230219
      LE L2CAP: LE Flow Control Credit (0x16) ident 2 len 4
        Source CID: 80
        Credits: 10
> ACL Data RX: Handle 1767 flags 0x02 dlen 27             #123 [hci1] 21.230867
> ACL Data RX: Handle 1767 flags 0x01 dlen 27             #124 [hci1] 21.231524
> ACL Data RX: Handle 1767 flags 0x01 dlen 16             #125 [hci1] 21.232061
      Channel: 68 len 66 sdu 64 [PSM 39 mode Enhanced Credit (0x81)] {chan 4}
      ATT: Read Response (0x0b) len 63
< HCI Command: Host Number of Com.. (0x03|0x0035) plen 5  #126 [hci1] 21.248665
        Num handles: 1
        Handle: 1767 Address: DF:A9:FF:F6:B1:1A (OUI DF-A9-FF)
        Count: 1
< HCI Command: Host Number of Com.. (0x03|0x0035) plen 5  #127 [hci1] 21.248899
        Num handles: 1
        Handle: 1767 Address: DF:A9:FF:F6:B1:1A (OUI DF-A9-FF)
        Count: 1
< HCI Command: Host Number of Com.. (0x03|0x0035) plen 5  #128 [hci1] 21.248990
        Num handles: 1
        Handle: 1767 Address: DF:A9:FF:F6:B1:1A (OUI DF-A9-FF)
        Count: 1
< HCI Command: Host Number of Com.. (0x03|0x0035) plen 5  #129 [hci1] 21.249030
        Num handles: 1
        Handle: 1767 Address: DF:A9:FF:F6:B1:1A (OUI DF-A9-FF)
        Count: 1
< ACL Data TX: Handle 1767 flags 0x00 dlen 11             #130 [hci1] 21.249105
      Channel: 80 len 7 sdu 5 [PSM 39 mode Enhanced Credit (0x81)] {chan 4}
      ATT: Read Blob Request (0x0c) len 4
        Handle: 0x01b0
        Offset: 0x003f
< ACL Data TX: Handle 1767 flags 0x00 dlen 12             #131 [hci1] 21.249109
      LE L2CAP: LE Flow Control Credit (0x16) ident 5 len 4
        Source CID: 68
        Credits: 1
> HCI Event: Number of Completed Packets (0x13) plen 5    #132 [hci1] 21.317996
        Num handles: 1
        Handle: 1767 Address: DF:A9:FF:F6:B1:1A (OUI DF-A9-FF)
        Count: 1
        #130: len 11 (1 Kb/s)
        Latency: 68 msec (49-169 msec ~103 msec)
> HCI Event: Number of Completed Packets (0x13) plen 5    #133 [hci1] 21.405099
        Num handles: 1
        Handle: 1767 Address: DF:A9:FF:F6:B1:1A (OUI DF-A9-FF)
        Count: 1
        #131: len 12 (0 Kb/s)
        Latency: 155 msec (49-169 msec ~129 msec)
> ACL Data RX: Handle 1767 flags 0x02 dlen 27             #134 [hci1] 21.405390
> ACL Data RX: Handle 1767 flags 0x01 dlen 27             #135 [hci1] 21.405975
> ACL Data RX: Handle 1767 flags 0x01 dlen 16             #136 [hci1] 21.406476
      Channel: 68 len 66 sdu 64 [PSM 39 mode Enhanced Credit (0x81)] {chan 4}
      ATT: Read Blob Response (0x0d) len 63
        99 ff ee dd cc bb aa 00 11 22 33 44 55 66 77 88  ........."3DUfw.
        99 ff ee dd cc bb aa 00 11 22 33 44 55 66 77 88  ........."3DUfw.
        99 ff ee dd cc bb aa 00 11 22 33 44 55 66 77 88  ........."3DUfw.
        99 ff ee dd cc bb aa 00 11 22 33 44 55 66 77     ........."3DUfw 
< HCI Command: Host Number of Com.. (0x03|0x0035) plen 5  #137 [hci1] 21.408696
        Num handles: 1
        Handle: 1767 Address: DF:A9:FF:F6:B1:1A (OUI DF-A9-FF)
        Count: 1
< HCI Command: Host Number of Com.. (0x03|0x0035) plen 5  #138 [hci1] 21.408712
        Num handles: 1
        Handle: 1767 Address: DF:A9:FF:F6:B1:1A (OUI DF-A9-FF)
        Count: 1
< HCI Command: Host Number of Com.. (0x03|0x0035) plen 5  #139 [hci1] 21.408817
        Num handles: 1
        Handle: 1767 Address: DF:A9:FF:F6:B1:1A (OUI DF-A9-FF)
        Count: 1
< ACL Data TX: Handle 1767 flags 0x00 dlen 11             #140 [hci1] 21.409044
      Channel: 80 len 7 sdu 5 [PSM 39 mode Enhanced Credit (0x81)] {chan 4}
      ATT: Read Blob Request (0x0c) len 4
        Handle: 0x01b0
        Offset: 0x007e
< ACL Data TX: Handle 1767 flags 0x00 dlen 12             #141 [hci1] 21.409049
      LE L2CAP: LE Flow Control Credit (0x16) ident 6 len 4
        Source CID: 68
        Credits: 1
> HCI Event: Number of Completed Packets (0x13) plen 5    #142 [hci1] 21.492949
        Num handles: 1
        Handle: 1767 Address: DF:A9:FF:F6:B1:1A (OUI DF-A9-FF)
        Count: 1
        #140: len 11 (1 Kb/s)
        Latency: 83 msec (49-169 msec ~106 msec)
        Channel: 80 [PSM 39 mode Enhanced Credit (0x81)] {chan 4}
        Channel Latency: 83 msec (66-168 msec ~107 msec)
> HCI Event: Number of Completed Packets (0x13) plen 5    #143 [hci1] 21.579891
        Num handles: 1
        Handle: 1767 Address: DF:A9:FF:F6:B1:1A (OUI DF-A9-FF)
        Count: 1
        #141: len 12 (0 Kb/s)
        Latency: 170 msec (49-170 msec ~138 msec)
        Channel: 80 [PSM 39 mode Enhanced Credit (0x81)] {chan 4}
        Channel Latency: 170 msec (66-170 msec ~139 msec)
> ACL Data RX: Handle 1767 flags 0x02 dlen 8              #144 [hci1] 21.580184
      Channel: 68 len 4 sdu 2 [PSM 39 mode Enhanced Credit (0x81)] {chan 4}
      ATT: Read Blob Response (0x0d) len 1
        88                                               .               
< HCI Command: Host Number of Com.. (0x03|0x0035) plen 5  #145 [hci1] 21.588888
        Num handles: 1
        Handle: 1767 Address: DF:A9:FF:F6:B1:1A (OUI DF-A9-FF)
        Count: 1
< ACL Data TX: Handle 1767 flags 0x00 dlen 12             #146 [hci1] 21.588917
      LE L2CAP: LE Flow Control Credit (0x16) ident 7 len 4
        Source CID: 68
        Credits: 1
> HCI Event: Number of Completed Packets (0x13) plen 5    #147 [hci1] 21.754801
        Num handles: 1
        Handle: 1767 Address: DF:A9:FF:F6:B1:1A (OUI DF-A9-FF)
        Count: 1
        #146: len 12 (0 Kb/s)
        Latency: 165 msec (49-170 msec ~152 msec)
        Channel: 80 [PSM 39 mode Enhanced Credit (0x81)] {chan 4}
        Channel Latency: 165 msec (66-170 msec ~152 msec)
< ACL Data TX: Handle 1767 flags 0x00 dlen 9              #148 [hci1] 23.619018
      Channel: 80 len 5 sdu 3 [PSM 39 mode Enhanced Credit (0x81)] {chan 4}
      ATT: Read Request (0x0a) len 2
        Handle: 0x01a4
> HCI Event: Number of Completed Packets (0x13) plen 5    #149 [hci1] 23.767519
        Num handles: 1
        Handle: 1767 Address: DF:A9:FF:F6:B1:1A (OUI DF-A9-FF)
        Count: 1
        #148: len 9 (0 Kb/s)
        Latency: 148 msec (49-170 msec ~150 msec)
        Channel: 80 [PSM 39 mode Enhanced Credit (0x81)] {chan 4}
        Channel Latency: 148 msec (66-170 msec ~150 msec)
> ACL Data RX: Handle 1767 flags 0x02 dlen 27             #150 [hci1] 23.767858
> ACL Data RX: Handle 1767 flags 0x01 dlen 27             #151 [hci1] 23.768384
< HCI Command: Host Number of Com.. (0x03|0x0035) plen 5  #152 [hci1] 23.768735
        Num handles: 1
        Handle: 1767 Address: DF:A9:FF:F6:B1:1A (OUI DF-A9-FF)
        Count: 1
> ACL Data RX: Handle 1767 flags 0x01 dlen 16             #153 [hci1] 23.768897
      Channel: 68 len 66 sdu 64 [PSM 39 mode Enhanced Credit (0x81)] {chan 4}
      ATT: Read Response (0x0b) len 63
< HCI Command: Host Number of Com.. (0x03|0x0035) plen 5  #154 [hci1] 23.788494
        Num handles: 1
        Handle: 1767 Address: DF:A9:FF:F6:B1:1A (OUI DF-A9-FF)
        Count: 1
< HCI Command: Host Number of Com.. (0x03|0x0035) plen 5  #155 [hci1] 23.788557
        Num handles: 1
        Handle: 1767 Address: DF:A9:FF:F6:B1:1A (OUI DF-A9-FF)
        Count: 1
< ACL Data TX: Handle 1767 flags 0x00 dlen 11             #156 [hci1] 23.788678
      Channel: 80 len 7 sdu 5 [PSM 39 mode Enhanced Credit (0x81)] {chan 4}
      ATT: Read Blob Request (0x0c) len 4
        Handle: 0x01a4
        Offset: 0x003f
< ACL Data TX: Handle 1767 flags 0x00 dlen 12             #157 [hci1] 23.788781
      LE L2CAP: LE Flow Control Credit (0x16) ident 8 len 4
        Source CID: 68
        Credits: 1
> HCI Event: Number of Completed Packets (0x13) plen 5    #158 [hci1] 23.855237
        Num handles: 1
        Handle: 1767 Address: DF:A9:FF:F6:B1:1A (OUI DF-A9-FF)
        Count: 1
        #156: len 11 (1 Kb/s)
        Latency: 66 msec (49-170 msec ~108 msec)
> HCI Event: Number of Completed Packets (0x13) plen 5    #159 [hci1] 23.942286
        Num handles: 1
        Handle: 1767 Address: DF:A9:FF:F6:B1:1A (OUI DF-A9-FF)
        Count: 1
        #157: len 12 (0 Kb/s)
        Latency: 153 msec (49-170 msec ~131 msec)
        Channel: 80 [PSM 39 mode Enhanced Credit (0x81)] {chan 4}
        Channel Latency: 153 msec (66-170 msec ~152 msec)
> ACL Data RX: Handle 1767 flags 0x02 dlen 7              #160 [hci1] 23.942584
      Channel: 68 len 3 sdu 1 [PSM 39 mode Enhanced Credit (0x81)] {chan 4}
      ATT: Read Blob Response (0x0d) len 0
< HCI Command: Host Number of Com.. (0x03|0x0035) plen 5  #161 [hci1] 23.948788
        Num handles: 1
        Handle: 1767 Address: DF:A9:FF:F6:B1:1A (OUI DF-A9-FF)
        Count: 1
< ACL Data TX: Handle 1767 flags 0x00 dlen 12             #162 [hci1] 23.948817
      LE L2CAP: LE Flow Control Credit (0x16) ident 9 len 4
        Source CID: 68
        Credits: 1
> HCI Event: Number of Completed Packets (0x13) plen 5    #163 [hci1] 24.117210
        Num handles: 1
        Handle: 1767 Address: DF:A9:FF:F6:B1:1A (OUI DF-A9-FF)
        Count: 1
        #162: len 12 (0 Kb/s)
        Latency: 168 msec (49-170 msec ~149 msec)
        Channel: 80 [PSM 39 mode Enhanced Credit (0x81)] {chan 4}
        Channel Latency: 168 msec (66-170 msec ~160 msec)
< ACL Data TX: Handle 1767 flags 0x00 dlen 9              #164 [hci1] 25.978619
      Channel: 80 len 5 sdu 3 [PSM 39 mode Enhanced Credit (0x81)] {chan 4}
      ATT: Read Request (0x0a) len 2
        Handle: 0x0195
> HCI Event: Number of Completed Packets (0x13) plen 5    #165 [hci1] 26.129927
        Num handles: 1
        Handle: 1767 Address: DF:A9:FF:F6:B1:1A (OUI DF-A9-FF)
        Count: 1
        #164: len 9 (0 Kb/s)
        Latency: 151 msec (49-170 msec ~150 msec)
> ACL Data RX: Handle 1767 flags 0x02 dlen 27             #166 [hci1] 26.130224
> ACL Data RX: Handle 1767 flags 0x01 dlen 27             #167 [hci1] 26.130781
> ACL Data RX: Handle 1767 flags 0x01 dlen 1              #168 [hci1] 26.131089
      Channel: 68 len 51 sdu 49 [PSM 39 mode Enhanced Credit (0x81)] {chan 4}
      ATT: Read Response (0x0b) len 48
< HCI Command: Host Number of Com.. (0x03|0x0035) plen 5  #169 [hci1] 26.148821
        Num handles: 1
        Handle: 1767 Address: DF:A9:FF:F6:B1:1A (OUI DF-A9-FF)
        Count: 1
< HCI Command: Host Number of Com.. (0x03|0x0035) plen 5  #170 [hci1] 26.148910
        Num handles: 1
        Handle: 1767 Address: DF:A9:FF:F6:B1:1A (OUI DF-A9-FF)
        Count: 1
< HCI Command: Host Number of Com.. (0x03|0x0035) plen 5  #171 [hci1] 26.149064
        Num handles: 1
        Handle: 1767 Address: DF:A9:FF:F6:B1:1A (OUI DF-A9-FF)
        Count: 1
< ACL Data TX: Handle 1767 flags 0x00 dlen 12             #172 [hci1] 26.149124
      LE L2CAP: LE Flow Control Credit (0x16) ident 10 len 4
        Source CID: 68
        Credits: 1
> HCI Event: Number of Completed Packets (0x13) plen 5    #173 [hci1] 26.304602
        Num handles: 1
        Handle: 1767 Address: DF:A9:FF:F6:B1:1A (OUI DF-A9-FF)
        Count: 1
        #172: len 12 (0 Kb/s)
        Latency: 155 msec (49-170 msec ~152 msec)
> HCI Event: Disconnect Complete (0x05) plen 4            #174 [hci1] 28.667297
        Status: Success (0x00)
        Handle: 1767 Address: DF:A9:FF:F6:B1:1A (OUI DF-A9-FF)
        Reason: Remote User Terminated Connection (0x13)
< HCI Command: Reset (0x03|0x0003) plen 0                 #175 [hci1] 35.248824
> HCI Event: Command Complete (0x0e) plen 4               #176 [hci1] 35.249347
      Reset (0x03|0x0003) ncmd 1
        Status: Success (0x00)
@ USER Close: main                                    {0x0001} [hci1] 35.268549
= Close Index: 00:00:00:00:00:00                               [hci1] 35.268557
