Bluetooth monitor ver 5.72
= Note: Linux version 6.14.0-36-generic (x86_64)                       0.940033
= Note: Bluetooth subsystem version 2.22                               0.940035
= New Index: 00:00:00:00:00:00 (Primary,UART,hci1)              [hci1] 0.940035
= New Index: 48:5F:99:8E:E0:64 (Primary,USB,hci0)               [hci0] 0.940036
= Open Index: 00:00:00:00:00:00                                 [hci1] 1.053737
= Index Info: 00:00:00:00:00:00 (Nordic Semiconductor ASA)      [hci1] 1.053755
@ USER Open: main (privileged) version 2.22            {0x0001} [hci1] 1.053765
< HCI Command: Reset (0x03|0x0003) plen 0                    #1 [hci1] 1.054888
> HCI Event: Command Complete (0x0e) plen 4                  #2 [hci1] 1.055413
      Reset (0x03|0x0003) ncmd 1
        Status: Success (0x00)
< HCI Command: Read Local Supported... (0x04|0x0003) plen 0  #3 [hci1] 1.073568
> HCI Event: Command Complete (0x0e) plen 12                 #4 [hci1] 1.074113
      Read Local Supported Features (0x04|0x0003) ncmd 1
        Status: Success (0x00)
        Features: 0x00 0x00 0x00 0x00 0x60 0x00 0x00 0x00
          BR/EDR Not Supported
          LE Supported (Controller)
< HCI Command: Read Local Version In.. (0x04|0x0001) plen 0  #5 [hci1] 1.093267
> HCI Event: Command Complete (0x0e) plen 12                 #6 [hci1] 1.093769
      Read Local Version Information (0x04|0x0001) ncmd 1
        Status: Success (0x00)
        HCI version: Reserved (0x0f) - Revision 12393 (0x3069)
        LMP version: Reserved (0x0f) - Subversion 12393 (0x3069)
        Manufacturer: Nordic Semiconductor ASA (89)
< HCI Command: Read Local Supported... (0x04|0x0002) plen 0  #7 [hci1] 1.113209
> HCI Event: Command Complete (0x0e) plen 68                 #8 [hci1] 1.114374
      Read Local Supported Commands (0x04|0x0002) ncmd 1
        Status: Success (0x00)
        Commands: 119 entries
          Disconnect (Octet 0 - Bit 5)
          Read Remote Version Information (Octet 2 - Bit 7)
          Set Event Mask (Octet 5 - Bit 6)
          Reset (Octet 5 - Bit 7)
          Read Connection Accept Timeout (Octet 7 - Bit 2)
          Write Connection Accept Timeout (Octet 7 - Bit 3)
          Read Transmit Power Level (Octet 10 - Bit 2)
          Set Controller To Host Flow Control (Octet 10 - Bit 5)
          Host Buffer Size (Octet 10 - Bit 6)
          Host Number of Completed Packets (Octet 10 - Bit 7)
          Read Local Version Information (Octet 14 - Bit 3)
          Read Local Supported Features (Octet 14 - Bit 5)
          Read BD ADDR (Octet 15 - Bit 1)
          Read RSSI (Octet 15 - Bit 5)
          Set Event Mask Page 2 (Octet 22 - Bit 2)
          LE Set Event Mask (Octet 25 - Bit 0)
          LE Read Buffer Size (Octet 25 - Bit 1)
          LE Read Local Supported Features (Octet 25 - Bit 2)
          LE Set Random Address (Octet 25 - Bit 4)
          LE Set Advertising Parameters (Octet 25 - Bit 5)
          LE Read Advertising Channel TX Power (Octet 25 - Bit 6)
          LE Set Advertising Data (Octet 25 - Bit 7)
          LE Set Scan Response Data (Octet 26 - Bit 0)
          LE Set Advertise Enable (Octet 26 - Bit 1)
          LE Set Scan Parameters (Octet 26 - Bit 2)
          LE Set Scan Enable (Octet 26 - Bit 3)
          LE Create Connection (Octet 26 - Bit 4)
          LE Create Connection Cancel (Octet 26 - Bit 5)
          LE Read Accept List Size (Octet 26 - Bit 6)
          LE Clear Accept List (Octet 26 - Bit 7)
          LE Add Device To Accept List (Octet 27 - Bit 0)
          LE Remove Device From Accept List (Octet 27 - Bit 1)
          LE Connection Update (Octet 27 - Bit 2)
          LE Set Host Channel Classification (Octet 27 - Bit 3)
          LE Read Channel Map (Octet 27 - Bit 4)
          LE Read Remote Used Features (Octet 27 - Bit 5)
          LE Encrypt (Octet 27 - Bit 6)
          LE Rand (Octet 27 - Bit 7)
          LE Start Encryption (Octet 28 - Bit 0)
          LE Long Term Key Request Reply (Octet 28 - Bit 1)
          LE Long Term Key Request Neg Reply (Octet 28 - Bit 2)
          LE Read Supported States (Octet 28 - Bit 3)
          LE Receiver Test (Octet 28 - Bit 4)
          LE Transmitter Test (Octet 28 - Bit 5)
          LE Test End (Octet 28 - Bit 6)
          Read Authenticated Payload Timeout (Octet 32 - Bit 4)
          Write Authenticated Payload Timeout (Octet 32 - Bit 5)
          LE Set Data Length (Octet 33 - Bit 6)
          LE Read Suggested Default Data Length (Octet 33 - Bit 7)
          LE Write Suggested Default Data Length (Octet 34 - Bit 0)
          LE Add Device To Resolving List (Octet 34 - Bit 3)
          LE Remove Device From Resolving List (Octet 34 - Bit 4)
          LE Clear Resolving List (Octet 34 - Bit 5)
          LE Read Resolving List Size (Octet 34 - Bit 6)
          LE Set Address Resolution Enable (Octet 35 - Bit 1)
          LE Set Resolvable Private Address Timeout (Octet 35 - Bit 2)
          LE Read Maximum Data Length (Octet 35 - Bit 3)
          LE Read PHY (Octet 35 - Bit 4)
          LE Set Default PHY (Octet 35 - Bit 5)
          LE Set PHY (Octet 35 - Bit 6)
          LE Enhanced Receiver Test (Octet 35 - Bit 7)
          LE Enhanced Transmitter Test (Octet 36 - Bit 0)
          LE Set Advertising Set Random Address (Octet 36 - Bit 1)
          LE Set Extended Advertising Parameters (Octet 36 - Bit 2)
          LE Set Extended Advertising Data (Octet 36 - Bit 3)
          LE Set Extended Scan Response Data (Octet 36 - Bit 4)
          LE Set Extended Advertising Enable (Octet 36 - Bit 5)
          LE Read Maximum Advertising Data Length (Octet 36 - Bit 6)
          LE Read Number of Supported Advertising Sets (Octet 36 - Bit 7)
          LE Remove Advertising Set (Octet 37 - Bit 0)
          LE Clear Advertising Sets (Octet 37 - Bit 1)
          LE Set Periodic Advertising Parameters (Octet 37 - Bit 2)
          LE Set Periodic Advertising Data (Octet 37 - Bit 3)
          LE Set Periodic Advertising Enable (Octet 37 - Bit 4)
          LE Set Extended Scan Parameters (Octet 37 - Bit 5)
          LE Set Extended Scan Enable (Octet 37 - Bit 6)
          LE Extended Create Connection (Octet 37 - Bit 7)
          LE Periodic Advertising Create Sync (Octet 38 - Bit 0)
          LE Periodic Advertising Create Sync Cancel (Octet 38 - Bit 1)
          LE Periodic Advertising Terminate Sync (Octet 38 - Bit 2)
          LE Add Device To Periodic Advertiser List (Octet 38 - Bit 3)
          LE Remove Device From Periodic Advertiser List (Octet 38 - Bit 4)
          LE Clear Periodic Advertiser List (Octet 38 - Bit 5)
          LE Read Periodic Advertiser List Size (Octet 38 - Bit 6)
          LE Read Transmit Power (Octet 38 - Bit 7)
          LE Read RF Path Compensation (Octet 39 - Bit 0)
          LE Write RF Path Compensation (Octet 39 - Bit 1)
          LE Set Privacy Mode (Octet 39 - Bit 2)
          LE Periodic Advertising Receive Enable (Octet 40 - Bit 5)
          LE Periodic Advertising Sync Transfer (Octet 40 - Bit 6)
          LE Periodic Advertising Set Info Transfer (Octet 40 - Bit 7)
          LE Periodic Advertising Sync Transfer Parameters (Octet 41 - Bit 0)
          LE Set Default Periodic Advertisng Sync Transfer Parameters (Octet 41 - Bit 1)
          LE Read Buffer v2 (Octet 41 - Bit 5)
          LE Read ISO TX Sync (Octet 41 - Bit 6)
          LE Set Connected Isochronous Group Parameters (Octet 41 - Bit 7)
          LE Set Connected Isochronous Group Parameters Test (Octet 42 - Bit 0)
          LE Create Connected Isochronous Stream (Octet 42 - Bit 1)
          LE Remove Connected Isochronous Group (Octet 42 - Bit 2)
          LE Accept Connected Isochronous Stream Request (Octet 42 - Bit 3)
          LE Reject Connected Isochronous Stream Request (Octet 42 - Bit 4)
          LE Create Broadcast Isochronous Group (Octet 42 - Bit 5)
          LE Create Broadcast Isochronous Group Test (Octet 42 - Bit 6)
          LE Terminate Broadcast Isochronous Group (Octet 42 - Bit 7)
          LE Broadcast Isochronous Group Create Sync (Octet 43 - Bit 0)
          LE Broadcast Isochronous Group Terminate Sync (Octet 43 - Bit 1)
          LE Request Peer SCA (Octet 43 - Bit 2)
          LE Setup Isochronous Data Path (Octet 43 - Bit 3)
          LE Remove Isochronous Data Path (Octet 43 - Bit 4)
          LE Isochronous Transmit Test (Octet 43 - Bit 5)
          LE Isochronous Receive Test (Octet 43 - Bit 6)
          LE Isochronous Read Test Counters (Octet 43 - Bit 7)
          LE Isochronous Read Test Counters (Octet 44 - Bit 0)
          LE Set Host Feature (Octet 44 - Bit 1)
          Octet 44 - Bit 2 
          Octet 45 - Bit 6 
          Octet 46 - Bit 0 
          Octet 46 - Bit 1 
          Octet 46 - Bit 2 
< HCI Command: Host Buffer Size (0x03|0x0033) plen 7         #9 [hci1] 1.133182
        ACL MTU: 255  ACL max packet: 16
        SCO MTU: 0    SCO max packet: 0
> HCI Event: Command Complete (0x0e) plen 4                 #10 [hci1] 1.133692
      Host Buffer Size (0x03|0x0033) ncmd 1
        Status: Success (0x00)
< HCI Command: Set Controller To Ho.. (0x03|0x0031) plen 1  #11 [hci1] 1.153215
        Flow control: ACL Data Packets (0x01)
> HCI Event: Command Complete (0x0e) plen 4                 #12 [hci1] 1.153675
      Set Controller To Host Flow Control (0x03|0x0031) ncmd 1
        Status: Success (0x00)
< HCI Command: LE Read Local Suppor.. (0x08|0x0003) plen 0  #13 [hci1] 1.173214
> HCI Event: Command Complete (0x0e) plen 12                #14 [hci1] 1.173739
      LE Read Local Supported Features (0x08|0x0003) ncmd 1
        Status: Success (0x00)
        Features: 0xfd 0x79 0x00 0xf7 0x30 0x01 0x00 0x00
          LE Encryption
          Extended Reject Indication
          Peripheral-initiated Features Exchange
          LE Ping
          LE Data Packet Length Extension
          LL Privacy
          Extended Scanner Filter Policies
          LE 2M PHY
          LE Coded PHY
          LE Extended Advertising
          LE Periodic Advertising
          Channel Selection Algorithm #2
          Periodic Advertising Sync Transfer - Sender
          Periodic Advertising Sync Transfer - Recipient
          Sleep Clock Accuracy Updates
          Connected Isochronous Stream - Central
          Connected Isochronous Stream - Peripheral
          Isochronous Broadcaster
          Synchronized Receiver
          Periodic Advertising ADI support
          Connection Subrating
          Unknown features (0x0000010000000000)
< HCI Command: LE Set Host Feature (0x08|0x0074) plen 2     #15 [hci1] 1.193230
        Bit Number: 32
          Connected Isochronous Stream (Host Support)
        Bit Value: 1
> HCI Event: Command Complete (0x0e) plen 4                 #16 [hci1] 1.193691
      LE Set Host Feature (0x08|0x0074) ncmd 1
        Status: Success (0x00)
< HCI Command: LE Read Buffer v2 (0x08|0x0060) plen 0       #17 [hci1] 1.213207
> HCI Event: Command Complete (0x0e) plen 10                #18 [hci1] 1.213717
      LE Read Buffer v2 (0x08|0x0060) ncmd 1
        Status: Success (0x00)
        ACL MTU: 27
        ACL max packet: 3
        ISO MTU: 318
        ISO max packet: 3
< HCI Command: LE Read Maximum Adve.. (0x08|0x003a) plen 0  #19 [hci1] 1.233230
> HCI Event: Command Complete (0x0e) plen 6                 #20 [hci1] 1.233665
      LE Read Maximum Advertising Data Length (0x08|0x003a) ncmd 1
        Status: Success (0x00)
        Max length: 1650
< HCI Command: LE Read Supported St.. (0x08|0x001c) plen 0  #21 [hci1] 1.253183
> HCI Event: Command Complete (0x0e) plen 12                #22 [hci1] 1.253646
      LE Read Supported States (0x08|0x001c) ncmd 1
        Status: Success (0x00)
        States: 0x000003ff3e0306ff
          Non-connectable Advertising State
          Scannable Advertising State
          Connectable Advertising State
          High Duty Cycle Directed Advertising State
          Passive Scanning State
          Active Scanning State
          Initiating State
            and Connection State (Central Role)
          Connection State (Peripheral Role)
          Scannable Advertising State
            and Passive Scanning State
          Connectable Advertising State
            and Passive Scanning State
          Non-connectable Advertising State
            and Initiating State
          Scannable Advertising State
            and Initiating State
          Active Scanning State
            and Connection State (Central Role)
          Passive Scanning State
            and Connection State (Peripheral Role)
          Active Scanning State
            and Connection State (Peripheral Role)
          Initiating State
            and Connection State (Central Role)
            and Central Role & Central Role
          Low Duty Cycle Directed Advertising State
          Connectable Advertising State
            and Initiating State
            and Central Role & Peripheral Role
          High Duty Cycle Directed Advertising State
            and Initiating State
            and Central Role & Peripheral Role
          Low Duty Cycle Directed Advertising State
            and Initiating State
            and Central Role & Peripheral Role
          Connectable Advertising State
            and Connection State (Central Role)
            and Central Role & Peripheral Role
          High Duty Cycle Directed Advertising State
            and Connection State (Central Role)
            and Central Role & Peripheral Role
          Low Duty Cycle Directed Advertising State
            and Connection State (Central Role)
            and Central Role & Peripheral Role
          Connectable Advertising State
            and Connection State (Peripheral Role)
            and Central Role & Peripheral Role
          High Duty Cycle Directed Advertising State
            and Connection State (Peripheral Role)
            and Peripheral Role & Peripheral Role
          Low Duty Cycle Directed Advertising State
            and Connection State (Peripheral Role)
            and Peripheral Role & Peripheral Role
          Initiating State
            and Connection State (Peripheral Role)
            and Central Role & Peripheral Role
< HCI Command: LE Read Maximum Data.. (0x08|0x002f) plen 0  #23 [hci1] 1.273206
> HCI Event: Command Complete (0x0e) plen 12                #24 [hci1] 1.273709
      LE Read Maximum Data Length (0x08|0x002f) ncmd 1
        Status: Success (0x00)
        Max TX octets: 251
        Max TX time: 2704
        Max RX octets: 251
        Max RX time: 2704
< HCI Command: LE Write Suggested D.. (0x08|0x0024) plen 4  #25 [hci1] 1.293215
        TX octets: 251
        TX time: 2704
> HCI Event: Command Complete (0x0e) plen 4                 #26 [hci1] 1.293721
      LE Write Suggested Default Data Length (0x08|0x0024) ncmd 1
        Status: Success (0x00)
< HCI Command: LE Read Resolving Li.. (0x08|0x002a) plen 0  #27 [hci1] 1.313181
> HCI Event: Command Complete (0x0e) plen 5                 #28 [hci1] 1.313591
      LE Read Resolving List Size (0x08|0x002a) ncmd 1
        Status: Success (0x00)
        Size: 8
< HCI Command: LE Set Event Mask (0x08|0x0001) plen 8       #29 [hci1] 1.333197
        Mask: 0x000002023f87fa5e
          LE Advertising Report
          LE Connection Update Complete
          LE Read Remote Used Features Complete
          LE Long Term Key Request
          LE Data Length Change
          LE Enhanced Connection Complete
          LE PHY Update Complete
          LE Extended Advertising Report
          LE Periodic Advertising Sync Established
          LE Periodic Advertising Report
          LE Periodic Advertising Sync Lost
          LE Extended Scan Timeout
          LE Extended Advertising Set Terminated
          LE Scan Request Received
          LE Periodic Advertising Sync Transfer Rvc
          LE CIS Established
          LE CIS Request
          LE Create BIG Complete
          LE Terminate BIG Complete
          LE BIG Sync Estabilished Complete
          LE BIG Sync Lost
          LE BIG Info Advertising Report
          Unknown mask (0x0000020000000000)
> HCI Event: Command Complete (0x0e) plen 4                 #30 [hci1] 1.333744
      LE Set Event Mask (0x08|0x0001) ncmd 1
        Status: Success (0x00)
< HCI Command: Set Event Mask (0x03|0x0001) plen 8          #31 [hci1] 1.353180
        Mask: 0x2000800002008890
          Disconnection Complete
          Encryption Change
          Read Remote Version Information Complete
          Hardware Error
          Data Buffer Overflow
          Encryption Key Refresh Complete
          LE Meta
> HCI Event: Command Complete (0x0e) plen 4                 #32 [hci1] 1.353708
      Set Event Mask (0x03|0x0001) ncmd 1
        Status: Success (0x00)
< HCI Command: Read BD ADDR (0x04|0x0009) plen 0            #33 [hci1] 1.373209
> HCI Event: Command Complete (0x0e) plen 10                #34 [hci1] 1.373664
      Read BD ADDR (0x04|0x0009) ncmd 1
        Status: Success (0x00)
        Address: 00:00:00:00:00:00 (OUI 00-00-00)
< HCI Command: LE Set Random Address (0x08|0x0005) plen 6   #35 [hci1] 1.393221
        Address: D5:B6:CC:31:DB:3B (Static)
> HCI Event: Command Complete (0x0e) plen 4                 #36 [hci1] 1.393682
      LE Set Random Address (0x08|0x0005) ncmd 1
        Status: Success (0x00)
< HCI Command: LE Set Extended Adv.. (0x08|0x0036) plen 25  #37 [hci1] 2.633266
        Handle: 0x00
        Properties: 0x0001
          Connectable
        Min advertising interval: 100.000 msec (0x00a0)
        Max advertising interval: 150.000 msec (0x00f0)
        Channel map: 37, 38, 39 (0x07)
        Own address type: Random (0x01)
        Peer address type: Public (0x00)
        Peer address: 00:00:00:00:00:00 (OUI 00-00-00)
        Filter policy: Allow Scan Request from Any, Allow Connect Request from Any (0x00)
        TX power: Host has no preference (0x7f)
        Primary PHY: LE 1M (0x01)
        Secondary max skip: 0x00
        Secondary PHY: LE 2M (0x02)
        SID: 0x00
        Scan request notifications: Disabled (0x00)
> HCI Event: Command Complete (0x0e) plen 5                 #38 [hci1] 2.634070
      LE Set Extended Advertising Parameters (0x08|0x0036) ncmd 1
        Status: Success (0x00)
        TX power (selected): 0 dbm (0x00)
< HCI Command: LE Set Advertising S.. (0x08|0x0035) plen 7  #39 [hci1] 2.653242
        Advertising handle: 0x00
        Advertising random address: D5:B6:CC:31:DB:3B (Static)
> HCI Event: Command Complete (0x0e) plen 4                 #40 [hci1] 2.653748
      LE Set Advertising Set Random Address (0x08|0x0035) ncmd 1
        Status: Success (0x00)
< HCI Command: LE Set Extended Adv.. (0x08|0x0037) plen 30  #41 [hci1] 2.673247
        Handle: 0x00
        Operation: Complete extended advertising data (0x03)
        Fragment preference: Minimize fragmentation (0x01)
        Data length: 0x1a
        Flags: 0x06
          LE General Discoverable Mode
          BR/EDR Not Supported
        Service Data: Common Audio (0x1853)
          Data: 01
        Service Data: Audio Stream Control (0x184e)
          Data: 014400400000
        Resolvable Set Identifier: 48-61-8E-0C-80-97
          Hash: 0x c8097
          Random: 0x48618e
> HCI Event: Command Complete (0x0e) plen 4                 #42 [hci1] 2.674074
      LE Set Extended Advertising Data (0x08|0x0037) ncmd 1
        Status: Success (0x00)
< HCI Command: LE Set Extended Adve.. (0x08|0x0039) plen 6  #43 [hci1] 2.693231
        Extended advertising: Enabled (0x01)
        Number of sets: 1 (0x01)
        Entry 0
          Handle: 0x00
          Duration: 0 ms (0x00)
          Max ext adv events: 0
> HCI Event: Command Complete (0x0e) plen 4                 #44 [hci1] 2.693755
      LE Set Extended Advertising Enable (0x08|0x0039) ncmd 1
        Status: Success (0x00)
> HCI Event: LE Meta Event (0x3e) plen 31                   #45 [hci1] 5.001022
      LE Enhanced Connection Complete (0x0a)
        Status: Success (0x00)
        Handle: 1587
        Role: Peripheral (0x01)
        Peer address type: Public (0x00)
        Peer address: DF:A9:FF:F6:B1:1A (OUI DF-A9-FF)
        Local resolvable private address: 00:00:00:00:00:00 (Non-Resolvable)
        Peer resolvable private address: 00:00:00:00:00:00 (Non-Resolvable)
        Connection interval: 150.00 msec (0x0078)
        Connection latency: 0 (0x0000)
        Supervision timeout: 25120 msec (0x09d0)
        Central clock accuracy: 0x01
> HCI Event: LE Meta Event (0x3e) plen 6                    #46 [hci1] 5.001159
      LE Advertising Set Terminated (0x12)
        Status: Success (0x00)
        Handle: 0
        Connection handle: 1587
        Number of completed extended advertising events: 0
< HCI Command: LE Read Remote Used... (0x08|0x0016) plen 2  #47 [hci1] 5.013874
        Handle: 1587 Address: DF:A9:FF:F6:B1:1A (OUI DF-A9-FF)
< ACL Data TX: Handle 1587 flags 0x00 dlen 7                #48 [hci1] 5.013890
      ATT: Exchange MTU Request (0x02) len 2
        Client RX MTU: 251
> HCI Event: Command Status (0x0f) plen 4                   #49 [hci1] 5.014451
      LE Read Remote Used Features (0x08|0x0016) ncmd 1
        Status: Success (0x00)
> HCI Event: Number of Completed Packets (0x13) plen 5      #50 [hci1] 5.302996
        Num handles: 1
        Handle: 1587 Address: DF:A9:FF:F6:B1:1A (OUI DF-A9-FF)
        Count: 1
        #48: len 7 (0 Kb/s)
        Latency: 289 msec (289-289 msec ~289 msec)
> HCI Event: LE Meta Event (0x3e) plen 12                   #51 [hci1] 5.453293
      LE Read Remote Used Features (0x04)
        Status: Success (0x00)
        Handle: 1587 Address: DF:A9:FF:F6:B1:1A (OUI DF-A9-FF)
        Features: 0x2d 0x49 0x00 0xf7 0x67 0xd9 0x00 0x80
          LE Encryption
          Extended Reject Indication
          Peripheral-initiated Features Exchange
          LE Data Packet Length Extension
          LE 2M PHY
          LE Coded PHY
          Channel Selection Algorithm #2
          Periodic Advertising Sync Transfer - Sender
          Periodic Advertising Sync Transfer - Recipient
          Sleep Clock Accuracy Updates
          Connected Isochronous Stream - Central
          Connected Isochronous Stream - Peripheral
          Isochronous Broadcaster
          Synchronized Receiver
          Connected Isochronous Stream (Host Support)
          LE Power Control Request
          LE Power Control Request
          Connection Subrating
          Connection Subrating (Host Support)
          Unknown features (0x8000d90000000000)
< HCI Command: LE Remove Advertisin.. (0x08|0x003c) plen 1  #52 [hci1] 5.833735
        Handle: 0
> HCI Event: Command Complete (0x0e) plen 4                 #53 [hci1] 5.834257
      LE Remove Advertising Set (0x08|0x003c) ncmd 1
        Status: Success (0x00)
< HCI Command: LE Set Extended Adv.. (0x08|0x0036) plen 25  #54 [hci1] 5.853464
        Handle: 0x00
        Properties: 0x0001
          Connectable
        Min advertising interval: 100.000 msec (0x00a0)
        Max advertising interval: 150.000 msec (0x00f0)
        Channel map: 37, 38, 39 (0x07)
        Own address type: Random (0x01)
        Peer address type: Public (0x00)
        Peer address: 00:00:00:00:00:00 (OUI 00-00-00)
        Filter policy: Allow Scan Request from Any, Allow Connect Request from Any (0x00)
        TX power: Host has no preference (0x7f)
        Primary PHY: LE 1M (0x01)
        Secondary max skip: 0x00
        Secondary PHY: LE 2M (0x02)
        SID: 0x01
        Scan request notifications: Disabled (0x00)
> HCI Event: Command Complete (0x0e) plen 5                 #55 [hci1] 5.854216
      LE Set Extended Advertising Parameters (0x08|0x0036) ncmd 1
        Status: Success (0x00)
        TX power (selected): 0 dbm (0x00)
< HCI Command: LE Set Advertising S.. (0x08|0x0035) plen 7  #56 [hci1] 5.873323
        Advertising handle: 0x00
        Advertising random address: D5:B6:CC:31:DB:3B (Static)
> HCI Event: Command Complete (0x0e) plen 4                 #57 [hci1] 5.873868
      LE Set Advertising Set Random Address (0x08|0x0035) ncmd 1
        Status: Success (0x00)
< HCI Command: LE Set Extended Adv.. (0x08|0x0037) plen 22  #58 [hci1] 5.893272
        Handle: 0x00
        Operation: Complete extended advertising data (0x03)
        Fragment preference: Minimize fragmentation (0x01)
        Data length: 0x12
        Flags: 0x06
          LE General Discoverable Mode
          BR/EDR Not Supported
        Name (complete): Tester_F6B11A
> HCI Event: Command Complete (0x0e) plen 4                 #59 [hci1] 5.893971
      LE Set Extended Advertising Data (0x08|0x0037) ncmd 1
        Status: Success (0x00)
< HCI Command: LE Set Extended Adve.. (0x08|0x0039) plen 6  #60 [hci1] 5.913237
        Extended advertising: Enabled (0x01)
        Number of sets: 1 (0x01)
        Entry 0
          Handle: 0x00
          Duration: 0 ms (0x00)
          Max ext adv events: 0
> HCI Event: Command Complete (0x0e) plen 4                 #61 [hci1] 5.913773
      LE Set Extended Advertising Enable (0x08|0x0039) ncmd 1
        Status: Success (0x00)
> ACL Data RX: Handle 1587 flags 0x02 dlen 7                #62 [hci1] 6.202980
      ATT: Exchange MTU Request (0x02) len 2
        Client RX MTU: 64
> ACL Data RX: Handle 1587 flags 0x02 dlen 7                #63 [hci1] 6.203391
      ATT: Exchange MTU Response (0x03) len 2
        Server RX MTU: 64
< HCI Command: Host Number of Compl.. (0x03|0x0035) plen 5  #64 [hci1] 6.213774
        Num handles: 1
        Handle: 1587 Address: DF:A9:FF:F6:B1:1A (OUI DF-A9-FF)
        Count: 1
< ACL Data TX: Handle 1587 flags 0x00 dlen 7                #65 [hci1] 6.213894
      ATT: Exchange MTU Response (0x03) len 2
        Server RX MTU: 251
< HCI Command: Host Number of Compl.. (0x03|0x0035) plen 5  #66 [hci1] 6.214403
        Num handles: 1
        Handle: 1587 Address: DF:A9:FF:F6:B1:1A (OUI DF-A9-FF)
        Count: 1
> HCI Event: Number of Completed Packets (0x13) plen 5      #67 [hci1] 6.502960
        Num handles: 1
        Handle: 1587 Address: DF:A9:FF:F6:B1:1A (OUI DF-A9-FF)
        Count: 1
        #65: len 7 (0 Kb/s)
        Latency: 289 msec (289-289 msec ~289 msec)
> ACL Data RX: Handle 1587 flags 0x02 dlen 11               #68 [hci1] 8.453014
      SMP: Pairing Request (0x01) len 6
        IO capability: KeyboardDisplay (0x04)
        OOB data: Authentication data not present (0x00)
        Authentication requirement: Bonding, No MITM, SC, No Keypresses (0x09)
        Max encryption key size: 16
        Initiator key distribution: EncKey IdKey Sign (0x07)
        Responder key distribution: EncKey IdKey Sign (0x07)
< HCI Command: Host Number of Compl.. (0x03|0x0035) plen 5  #69 [hci1] 8.453777
        Num handles: 1
        Handle: 1587 Address: DF:A9:FF:F6:B1:1A (OUI DF-A9-FF)
        Count: 1
< ACL Data TX: Handle 1587 flags 0x00 dlen 11               #70 [hci1] 8.453881
      SMP: Pairing Response (0x02) len 6
        IO capability: NoInputNoOutput (0x03)
        OOB data: Authentication data not present (0x00)
        Authentication requirement: Bonding, No MITM, SC, No Keypresses (0x09)
        Max encryption key size: 16
        Initiator key distribution: IdKey (0x02)
        Responder key distribution: <none> (0x00)
> HCI Event: Number of Completed Packets (0x13) plen 5      #71 [hci1] 8.753079
        Num handles: 1
        Handle: 1587 Address: DF:A9:FF:F6:B1:1A (OUI DF-A9-FF)
        Count: 1
        #70: len 11 (0 Kb/s)
        Latency: 299 msec (289-299 msec ~294 msec)
> ACL Data RX: Handle 1587 flags 0x02 dlen 27               #72 [hci1] 8.753356
> ACL Data RX: Handle 1587 flags 0x01 dlen 27               #73 [hci1] 8.753712
> ACL Data RX: Handle 1587 flags 0x01 dlen 15               #74 [hci1] 8.754083
      SMP: Pairing Public Key (0x0c) len 64
        X: 2399a982a235bd994a00ed97ed7c58fe7bd806690d4ceb164f8628df86e9d199
        Y: c4564eb868963e4dd742cca914ae6a65c16632d4f2626ff424eb7b951c71fb29
< HCI Command: Host Number of Compl.. (0x03|0x0035) plen 5  #75 [hci1] 8.773954
        Num handles: 1
        Handle: 1587 Address: DF:A9:FF:F6:B1:1A (OUI DF-A9-FF)
        Count: 1
< HCI Command: Host Number of Compl.. (0x03|0x0035) plen 5  #76 [hci1] 8.774159
        Num handles: 1
        Handle: 1587 Address: DF:A9:FF:F6:B1:1A (OUI DF-A9-FF)
        Count: 1
< HCI Command: Host Number of Compl.. (0x03|0x0035) plen 5  #77 [hci1] 8.774490
        Num handles: 1
        Handle: 1587 Address: DF:A9:FF:F6:B1:1A (OUI DF-A9-FF)
        Count: 1
< ACL Data TX: Handle 1587 flags 0x00 dlen 27               #78 [hci1] 8.774566
< ACL Data TX: Handle 1587 flags 0x01 dlen 27               #79 [hci1] 8.774590
< ACL Data TX: Handle 1587 flags 0x01 dlen 15               #80 [hci1] 8.774619
      SMP: Pairing Public Key (0x0c) len 64
        X: 98308440221e2d910f0e54b71e7ec652857aa9b5a0dc65028824cc19db1226e9
        Y: 67a4816bcb62efb21701e31fdb27561a6217575fb007a8bbdabe7e28b6f68482
> HCI Event: Number of Completed Packets (0x13) plen 5      #81 [hci1] 8.903352
        Num handles: 1
        Handle: 1587 Address: DF:A9:FF:F6:B1:1A (OUI DF-A9-FF)
        Count: 1
        #78: len 27 (1 Kb/s)
        Latency: 128 msec (128-299 msec ~211 msec)
> HCI Event: Number of Completed Packets (0x13) plen 5      #82 [hci1] 8.903890
        Num handles: 1
        Handle: 1587 Address: DF:A9:FF:F6:B1:1A (OUI DF-A9-FF)
        Count: 1
        #79: len 27 (1 Kb/s)
        Latency: 129 msec (128-299 msec ~170 msec)
< ACL Data TX: Handle 1587 flags 0x00 dlen 21               #83 [hci1] 8.913686
      SMP: Pairing Confirm (0x03) len 16
        Confim value: 0d2db03aa61f863951b0ed6c4bf77bd8
> HCI Event: Number of Completed Packets (0x13) plen 5      #84 [hci1] 9.052932
        Num handles: 1
        Handle: 1587 Address: DF:A9:FF:F6:B1:1A (OUI DF-A9-FF)
        Count: 1
        #80: len 15 (0 Kb/s)
        Latency: 278 msec (128-299 msec ~224 msec)
> HCI Event: Number of Completed Packets (0x13) plen 5      #85 [hci1] 9.203003
        Num handles: 1
        Handle: 1587 Address: DF:A9:FF:F6:B1:1A (OUI DF-A9-FF)
        Count: 1
        #83: len 21 (0 Kb/s)
        Latency: 289 msec (128-299 msec ~256 msec)
> ACL Data RX: Handle 1587 flags 0x02 dlen 21               #86 [hci1] 9.203382
      SMP: Pairing Random (0x04) len 16
        Random value: 51868f31edac555d0000000000000000
< HCI Command: Host Number of Compl.. (0x03|0x0035) plen 5  #87 [hci1] 9.213944
        Num handles: 1
        Handle: 1587 Address: DF:A9:FF:F6:B1:1A (OUI DF-A9-FF)
        Count: 1
< ACL Data TX: Handle 1587 flags 0x00 dlen 21               #88 [hci1] 9.214017
      SMP: Pairing Random (0x04) len 16
        Random value: f966a694cbe26df70bb96773e6cc6f5d
> HCI Event: Number of Completed Packets (0x13) plen 5      #89 [hci1] 9.502908
        Num handles: 1
        Handle: 1587 Address: DF:A9:FF:F6:B1:1A (OUI DF-A9-FF)
        Count: 1
        #88: len 21 (0 Kb/s)
        Latency: 288 msec (128-299 msec ~272 msec)
> ACL Data RX: Handle 1587 flags 0x02 dlen 21               #90 [hci1] 9.653192
      SMP: Pairing DHKey Check (0x0d) len 16
        E: 29bb308af86b80db63cdb4ec2b28294b
< HCI Command: Host Number of Compl.. (0x03|0x0035) plen 5  #91 [hci1] 9.654034
        Num handles: 1
        Handle: 1587 Address: DF:A9:FF:F6:B1:1A (OUI DF-A9-FF)
        Count: 1
< ACL Data TX: Handle 1587 flags 0x00 dlen 21               #92 [hci1] 9.654156
      SMP: Pairing DHKey Check (0x0d) len 16
        E: 4d7c760be3e9af49e25b3d820e0ffa8b
> HCI Event: Number of Completed Packets (0x13) plen 5      #93 [hci1] 9.952918
        Num handles: 1
        Handle: 1587 Address: DF:A9:FF:F6:B1:1A (OUI DF-A9-FF)
        Count: 1
        #92: len 21 (0 Kb/s)
        Latency: 298 msec (128-299 msec ~285 msec)
> HCI Event: LE Meta Event (0x3e) plen 13                  #94 [hci1] 10.103521
      LE Long Term Key Request (0x05)
        Handle: 1587 Address: DF:A9:FF:F6:B1:1A (OUI DF-A9-FF)
        Random number: 0x0000000000000000
        Encrypted diversifier: 0x0000
< HCI Command: LE Long Term Key R.. (0x08|0x001a) plen 18  #95 [hci1] 10.113725
        Handle: 1587 Address: DF:A9:FF:F6:B1:1A (OUI DF-A9-FF)
        Long term key: 5ca10b67876d4c7e8dc045290f790ad1
> HCI Event: Command Complete (0x0e) plen 6                #96 [hci1] 10.114509
      LE Long Term Key Request Reply (0x08|0x001a) ncmd 1
        Status: Success (0x00)
        Handle: 1587 Address: DF:A9:FF:F6:B1:1A (OUI DF-A9-FF)
> HCI Event: Encryption Change (0x08) plen 4               #97 [hci1] 10.853163
        Status: Success (0x00)
        Handle: 1587 Address: DF:A9:FF:F6:B1:1A (OUI DF-A9-FF)
        Encryption: Enabled with AES-CCM (0x01)
> ACL Data RX: Handle 1587 flags 0x02 dlen 21              #98 [hci1] 11.003287
      SMP: Identity Information (0x08) len 16
        Identity resolving key: d52a5d1efc6ea73af8cae0ec103c9bc9
< HCI Command: Host Number of Comp.. (0x03|0x0035) plen 5  #99 [hci1] 11.013771
        Num handles: 1
        Handle: 1587 Address: DF:A9:FF:F6:B1:1A (OUI DF-A9-FF)
        Count: 1
> ACL Data RX: Handle 1587 flags 0x02 dlen 12             #100 [hci1] 11.303117
      SMP: Identity Address Information (0x09) len 7
        Address: DF:A9:FF:F6:B1:1A (OUI DF-A9-FF)
< HCI Command: LE Set Extended Ad.. (0x08|0x0039) plen 6  #101 [hci1] 11.313918
        Extended advertising: Disabled (0x00)
        Number of sets: 1 (0x01)
        Entry 0
          Handle: 0x00
          Duration: 0 ms (0x00)
          Max ext adv events: 0
> HCI Event: Command Complete (0x0e) plen 4               #102 [hci1] 11.314516
      LE Set Extended Advertising Enable (0x08|0x0039) ncmd 1
        Status: Success (0x00)
< HCI Command: LE Add Device To... (0x08|0x0027) plen 39  #103 [hci1] 11.333417
        Address type: Public (0x00)
        Address: DF:A9:FF:F6:B1:1A (OUI DF-A9-FF)
        Peer identity resolving key: d52a5d1efc6ea73af8cae0ec103c9bc9
        Local identity resolving key: 00000000000000000000000000000000
> HCI Event: Command Complete (0x0e) plen 4               #104 [hci1] 11.334339
      LE Add Device To Resolving List (0x08|0x0027) ncmd 1
        Status: Success (0x00)
< HCI Command: LE Set Privacy Mode (0x08|0x004e) plen 8   #105 [hci1] 11.353318
        Peer Identity address type: Public (0x00)
        Peer Identity address: DF:A9:FF:F6:B1:1A (OUI DF-A9-FF)
        Privacy Mode: Use Device Privacy (0x01)
> HCI Event: Command Complete (0x0e) plen 4               #106 [hci1] 11.353827
      LE Set Privacy Mode (0x08|0x004e) ncmd 1
        Status: Success (0x00)
< HCI Command: LE Set Address Res.. (0x08|0x002d) plen 1  #107 [hci1] 11.373419
        Address resolution: Enabled (0x01)
> HCI Event: Command Complete (0x0e) plen 4               #108 [hci1] 11.373806
      LE Set Address Resolution Enable (0x08|0x002d) ncmd 1
        Status: Success (0x00)
< HCI Command: LE Set Extended Ad.. (0x08|0x0039) plen 6  #109 [hci1] 11.393705
        Extended advertising: Enabled (0x01)
        Number of sets: 1 (0x01)
        Entry 0
          Handle: 0x00
          Duration: 0 ms (0x00)
          Max ext adv events: 0
> HCI Event: Command Complete (0x0e) plen 4               #110 [hci1] 11.394356
      LE Set Extended Advertising Enable (0x08|0x0039) ncmd 1
        Status: Success (0x00)
< HCI Command: Host Number of Com.. (0x03|0x0035) plen 5  #111 [hci1] 11.413586
        Num handles: 1
        Handle: 1587 Address: DF:A9:FF:F6:B1:1A (OUI DF-A9-FF)
        Count: 1
> ACL Data RX: Handle 1587 flags 0x02 dlen 13             #112 [hci1] 11.453235
      ATT: Find By Type Value Request (0x06) len 8
        Handle range: 0x0001-0xffff
        Attribute type: Primary Service (0x2800)
          UUID: Hearing Aid (0x1854)
< HCI Command: Host Number of Com.. (0x03|0x0035) plen 5  #113 [hci1] 11.474076
        Num handles: 1
        Handle: 1587 Address: DF:A9:FF:F6:B1:1A (OUI DF-A9-FF)
        Count: 1
< ACL Data TX: Handle 1587 flags 0x00 dlen 9              #114 [hci1] 11.474238
      ATT: Find By Type Value Response (0x07) len 4
        Handle range: 0x00af-0x00b7
> HCI Event: Number of Completed Packets (0x13) plen 5    #115 [hci1] 11.752906
        Num handles: 1
        Handle: 1587 Address: DF:A9:FF:F6:B1:1A (OUI DF-A9-FF)
        Count: 1
        #114: len 9 (0 Kb/s)
        Latency: 278 msec (128-299 msec ~282 msec)
> ACL Data RX: Handle 1587 flags 0x02 dlen 13             #116 [hci1] 11.753175
      ATT: Find By Type Value Request (0x06) len 8
        Handle range: 0x00b8-0xffff
        Attribute type: Primary Service (0x2800)
          UUID: Hearing Aid (0x1854)
< HCI Command: Host Number of Com.. (0x03|0x0035) plen 5  #117 [hci1] 11.753738
        Num handles: 1
        Handle: 1587 Address: DF:A9:FF:F6:B1:1A (OUI DF-A9-FF)
        Count: 1
< ACL Data TX: Handle 1587 flags 0x00 dlen 9              #118 [hci1] 11.753958
      ATT: Error Response (0x01) len 4
        Find By Type Value Request (0x06)
        Handle: 0x00b8
        Error: Attribute Not Found (0x0a)
> HCI Event: Number of Completed Packets (0x13) plen 5    #119 [hci1] 12.053038
        Num handles: 1
        Handle: 1587 Address: DF:A9:FF:F6:B1:1A (OUI DF-A9-FF)
        Count: 1
        #118: len 9 (0 Kb/s)
        Latency: 299 msec (128-299 msec ~290 msec)
> ACL Data RX: Handle 1587 flags 0x02 dlen 11             #120 [hci1] 12.053190
      ATT: Read By Type Request (0x08) len 6
        Handle range: 0x00af-0x00b7
        Attribute type: Characteristic (0x2803)
< HCI Command: Host Number of Com.. (0x03|0x0035) plen 5  #121 [hci1] 12.053650
        Num handles: 1
        Handle: 1587 Address: DF:A9:FF:F6:B1:1A (OUI DF-A9-FF)
        Count: 1
< ACL Data TX: Handle 1587 flags 0x00 dlen 27             #122 [hci1] 12.053726
      ATT: Read By Type Response (0x09) len 22
        Attribute data length: 7
        Attribute data list: 3 entries
        Handle: 0x00b0
        Value: 02b100da2b
            Properties: 0x02
              Read (0x02)
            Value Handle: 0x00b1
            Value UUID: Hearing Aid Features (0x2bda)
        Handle: 0x00b2
        Value: 28b300db2b
            Properties: 0x28
              Write (0x08)
              Indicate (0x20)
            Value Handle: 0x00b3
            Value UUID: Hearing Aid Preset Control Point (0x2bdb)
        Handle: 0x00b5
        Value: 12b600dc2b
            Properties: 0x12
              Read (0x02)
              Notify (0x10)
            Value Handle: 0x00b6
            Value UUID: Active Preset Index (0x2bdc)
> HCI Event: Number of Completed Packets (0x13) plen 5    #123 [hci1] 12.352972
        Num handles: 1
        Handle: 1587 Address: DF:A9:FF:F6:B1:1A (OUI DF-A9-FF)
        Count: 1
        #122: len 27 (0 Kb/s)
        Latency: 299 msec (128-299 msec ~294 msec)
> ACL Data RX: Handle 1587 flags 0x02 dlen 11             #124 [hci1] 12.353211
      ATT: Read By Type Request (0x08) len 6
        Handle range: 0x00b6-0x00b7
        Attribute type: Characteristic (0x2803)
< HCI Command: Host Number of Com.. (0x03|0x0035) plen 5  #125 [hci1] 12.353829
        Num handles: 1
        Handle: 1587 Address: DF:A9:FF:F6:B1:1A (OUI DF-A9-FF)
        Count: 1
< ACL Data TX: Handle 1587 flags 0x00 dlen 9              #126 [hci1] 12.353922
      ATT: Error Response (0x01) len 4
        Read By Type Request (0x08)
        Handle: 0x00b6
        Error: Attribute Not Found (0x0a)
> HCI Event: Number of Completed Packets (0x13) plen 5    #127 [hci1] 12.652963
        Num handles: 1
        Handle: 1587 Address: DF:A9:FF:F6:B1:1A (OUI DF-A9-FF)
        Count: 1
        #126: len 9 (0 Kb/s)
        Latency: 299 msec (128-299 msec ~296 msec)
> ACL Data RX: Handle 1587 flags 0x02 dlen 9              #128 [hci1] 12.653121
      ATT: Find Information Request (0x04) len 4
        Handle range: 0x00b4-0x00b4
< HCI Command: Host Number of Com.. (0x03|0x0035) plen 5  #129 [hci1] 12.653510
        Num handles: 1
        Handle: 1587 Address: DF:A9:FF:F6:B1:1A (OUI DF-A9-FF)
        Count: 1
< ACL Data TX: Handle 1587 flags 0x00 dlen 10             #130 [hci1] 12.653549
      ATT: Find Information Response (0x05) len 5
        Format: UUID-16 (0x01)
        Handle: 0x00b4
        UUID: Client Characteristic Configuration (0x2902)
> HCI Event: Number of Completed Packets (0x13) plen 5    #131 [hci1] 12.952905
        Num handles: 1
        Handle: 1587 Address: DF:A9:FF:F6:B1:1A (OUI DF-A9-FF)
        Count: 1
        #130: len 10 (0 Kb/s)
        Latency: 299 msec (128-299 msec ~298 msec)
> ACL Data RX: Handle 1587 flags 0x02 dlen 9              #132 [hci1] 12.953189
      ATT: Find Information Request (0x04) len 4
        Handle range: 0x00b7-0x00b7
< HCI Command: Host Number of Com.. (0x03|0x0035) plen 5  #133 [hci1] 12.953764
        Num handles: 1
        Handle: 1587 Address: DF:A9:FF:F6:B1:1A (OUI DF-A9-FF)
        Count: 1
< ACL Data TX: Handle 1587 flags 0x00 dlen 10             #134 [hci1] 12.953878
      ATT: Find Information Response (0x05) len 5
        Format: UUID-16 (0x01)
        Handle: 0x00b7
        UUID: Client Characteristic Configuration (0x2902)
> HCI Event: Number of Completed Packets (0x13) plen 5    #135 [hci1] 13.252990
        Num handles: 1
        Handle: 1587 Address: DF:A9:FF:F6:B1:1A (OUI DF-A9-FF)
        Count: 1
        #134: len 10 (0 Kb/s)
        Latency: 299 msec (128-299 msec ~298 msec)
> ACL Data RX: Handle 1587 flags 0x02 dlen 13             #136 [hci1] 13.253216
      ATT: Find By Type Value Request (0x06) len 8
        Handle range: 0x0001-0xffff
        Attribute type: Primary Service (0x2800)
          UUID: Published Audio Capabilities (0x1850)
< HCI Command: Host Number of Com.. (0x03|0x0035) plen 5  #137 [hci1] 13.253522
        Num handles: 1
        Handle: 1587 Address: DF:A9:FF:F6:B1:1A (OUI DF-A9-FF)
        Count: 1
< ACL Data TX: Handle 1587 flags 0x00 dlen 9              #138 [hci1] 13.253563
      ATT: Find By Type Value Response (0x07) len 4
        Handle range: 0x0039-0x004b
> HCI Event: Number of Completed Packets (0x13) plen 5    #139 [hci1] 13.552890
        Num handles: 1
        Handle: 1587 Address: DF:A9:FF:F6:B1:1A (OUI DF-A9-FF)
        Count: 1
        #138: len 9 (0 Kb/s)
        Latency: 299 msec (128-299 msec ~298 msec)
> ACL Data RX: Handle 1587 flags 0x02 dlen 13             #140 [hci1] 13.553200
      ATT: Find By Type Value Request (0x06) len 8
        Handle range: 0x004c-0xffff
        Attribute type: Primary Service (0x2800)
          UUID: Published Audio Capabilities (0x1850)
< HCI Command: Host Number of Com.. (0x03|0x0035) plen 5  #141 [hci1] 13.554290
        Num handles: 1
        Handle: 1587 Address: DF:A9:FF:F6:B1:1A (OUI DF-A9-FF)
        Count: 1
< ACL Data TX: Handle 1587 flags 0x00 dlen 9              #142 [hci1] 13.554519
      ATT: Error Response (0x01) len 4
        Find By Type Value Request (0x06)
        Handle: 0x004c
        Error: Attribute Not Found (0x0a)
> HCI Event: Number of Completed Packets (0x13) plen 5    #143 [hci1] 13.852984
        Num handles: 1
        Handle: 1587 Address: DF:A9:FF:F6:B1:1A (OUI DF-A9-FF)
        Count: 1
        #142: len 9 (0 Kb/s)
        Latency: 298 msec (128-299 msec ~298 msec)
> ACL Data RX: Handle 1587 flags 0x02 dlen 11             #144 [hci1] 13.853168
      ATT: Read By Type Request (0x08) len 6
        Handle range: 0x0039-0x004b
        Attribute type: Characteristic (0x2803)
< HCI Command: Host Number of Com.. (0x03|0x0035) plen 5  #145 [hci1] 13.853786
        Num handles: 1
        Handle: 1587 Address: DF:A9:FF:F6:B1:1A (OUI DF-A9-FF)
        Count: 1
< ACL Data TX: Handle 1587 flags 0x00 dlen 27             #146 [hci1] 13.853900
< ACL Data TX: Handle 1587 flags 0x01 dlen 21             #147 [hci1] 13.853929
      ATT: Read By Type Response (0x09) len 43
        Attribute data length: 7
        Attribute data list: 6 entries
        Handle: 0x003a
        Value: 123b00c92b
            Properties: 0x12
              Read (0x02)
              Notify (0x10)
            Value Handle: 0x003b
            Value UUID: Sink PAC (0x2bc9)
        Handle: 0x003d
        Value: 1a3e00ca2b
            Properties: 0x1a
              Read (0x02)
              Write (0x08)
              Notify (0x10)
            Value Handle: 0x003e
            Value UUID: Sink Audio Locations (0x2bca)
        Handle: 0x0040
        Value: 124100cb2b
            Properties: 0x12
              Read (0x02)
              Notify (0x10)
            Value Handle: 0x0041
            Value UUID: Source PAC (0x2bcb)
        Handle: 0x0043
        Value: 1a4400cc2b
            Properties: 0x1a
              Read (0x02)
              Write (0x08)
              Notify (0x10)
            Value Handle: 0x0044
            Value UUID: Source Audio Locations (0x2bcc)
        Handle: 0x0046
        Value: 124700cd2b
            Properties: 0x12
              Read (0x02)
              Notify (0x10)
            Value Handle: 0x0047
            Value UUID: Available Audio Contexts (0x2bcd)
        Handle: 0x0049
        Value: 124a00ce2b
            Properties: 0x12
              Read (0x02)
              Notify (0x10)
            Value Handle: 0x004a
            Value UUID: Supported Audio Contexts (0x2bce)
> HCI Event: Number of Completed Packets (0x13) plen 5    #148 [hci1] 14.003314
        Num handles: 1
        Handle: 1587 Address: DF:A9:FF:F6:B1:1A (OUI DF-A9-FF)
        Count: 1
        #146: len 27 (1 Kb/s)
        Latency: 149 msec (128-299 msec ~224 msec)
> HCI Event: Number of Completed Packets (0x13) plen 5    #149 [hci1] 14.152985
        Num handles: 1
        Handle: 1587 Address: DF:A9:FF:F6:B1:1A (OUI DF-A9-FF)
        Count: 1
        #147: len 21 (0 Kb/s)
        Latency: 299 msec (128-299 msec ~261 msec)
> ACL Data RX: Handle 1587 flags 0x02 dlen 11             #150 [hci1] 14.153175
      ATT: Read By Type Request (0x08) len 6
        Handle range: 0x004a-0x004b
        Attribute type: Characteristic (0x2803)
< HCI Command: Host Number of Com.. (0x03|0x0035) plen 5  #151 [hci1] 14.153299
        Num handles: 1
        Handle: 1587 Address: DF:A9:FF:F6:B1:1A (OUI DF-A9-FF)
        Count: 1
< ACL Data TX: Handle 1587 flags 0x00 dlen 9              #152 [hci1] 14.153342
      ATT: Error Response (0x01) len 4
        Read By Type Request (0x08)
        Handle: 0x004a
        Error: Attribute Not Found (0x0a)
> HCI Event: Number of Completed Packets (0x13) plen 5    #153 [hci1] 14.452955
        Num handles: 1
        Handle: 1587 Address: DF:A9:FF:F6:B1:1A (OUI DF-A9-FF)
        Count: 1
        #152: len 9 (0 Kb/s)
        Latency: 299 msec (128-299 msec ~280 msec)
> ACL Data RX: Handle 1587 flags 0x02 dlen 9              #154 [hci1] 14.453045
      ATT: Find Information Request (0x04) len 4
        Handle range: 0x003c-0x003c
< HCI Command: Host Number of Com.. (0x03|0x0035) plen 5  #155 [hci1] 14.453344
        Num handles: 1
        Handle: 1587 Address: DF:A9:FF:F6:B1:1A (OUI DF-A9-FF)
        Count: 1
< ACL Data TX: Handle 1587 flags 0x00 dlen 10             #156 [hci1] 14.453361
      ATT: Find Information Response (0x05) len 5
        Format: UUID-16 (0x01)
        Handle: 0x003c
        UUID: Client Characteristic Configuration (0x2902)
> HCI Event: Number of Completed Packets (0x13) plen 5    #157 [hci1] 14.752890
        Num handles: 1
        Handle: 1587 Address: DF:A9:FF:F6:B1:1A (OUI DF-A9-FF)
        Count: 1
        #156: len 10 (0 Kb/s)
        Latency: 299 msec (128-299 msec ~290 msec)
> ACL Data RX: Handle 1587 flags 0x02 dlen 9              #158 [hci1] 14.753255
      ATT: Find Information Request (0x04) len 4
        Handle range: 0x003f-0x003f
< HCI Command: Host Number of Com.. (0x03|0x0035) plen 5  #159 [hci1] 14.754056
        Num handles: 1
        Handle: 1587 Address: DF:A9:FF:F6:B1:1A (OUI DF-A9-FF)
        Count: 1
< ACL Data TX: Handle 1587 flags 0x00 dlen 10             #160 [hci1] 14.754172
      ATT: Find Information Response (0x05) len 5
        Format: UUID-16 (0x01)
        Handle: 0x003f
        UUID: Client Characteristic Configuration (0x2902)
> HCI Event: Number of Completed Packets (0x13) plen 5    #161 [hci1] 15.052910
        Num handles: 1
        Handle: 1587 Address: DF:A9:FF:F6:B1:1A (OUI DF-A9-FF)
        Count: 1
        #160: len 10 (0 Kb/s)
        Latency: 298 msec (128-299 msec ~294 msec)
> ACL Data RX: Handle 1587 flags 0x02 dlen 9              #162 [hci1] 15.053067
      ATT: Find Information Request (0x04) len 4
        Handle range: 0x0042-0x0042
< HCI Command: Host Number of Com.. (0x03|0x0035) plen 5  #163 [hci1] 15.053951
        Num handles: 1
        Handle: 1587 Address: DF:A9:FF:F6:B1:1A (OUI DF-A9-FF)
        Count: 1
< ACL Data TX: Handle 1587 flags 0x00 dlen 10             #164 [hci1] 15.054067
      ATT: Find Information Response (0x05) len 5
        Format: UUID-16 (0x01)
        Handle: 0x0042
        UUID: Client Characteristic Configuration (0x2902)
> HCI Event: Number of Completed Packets (0x13) plen 5    #165 [hci1] 15.352922
        Num handles: 1
        Handle: 1587 Address: DF:A9:FF:F6:B1:1A (OUI DF-A9-FF)
        Count: 1
        #164: len 10 (0 Kb/s)
        Latency: 298 msec (128-299 msec ~296 msec)
> ACL Data RX: Handle 1587 flags 0x02 dlen 9              #166 [hci1] 15.353106
      ATT: Find Information Request (0x04) len 4
        Handle range: 0x0045-0x0045
< HCI Command: Host Number of Com.. (0x03|0x0035) plen 5  #167 [hci1] 15.353517
        Num handles: 1
        Handle: 1587 Address: DF:A9:FF:F6:B1:1A (OUI DF-A9-FF)
        Count: 1
< ACL Data TX: Handle 1587 flags 0x00 dlen 10             #168 [hci1] 15.353579
      ATT: Find Information Response (0x05) len 5
        Format: UUID-16 (0x01)
        Handle: 0x0045
        UUID: Client Characteristic Configuration (0x2902)
> HCI Event: Number of Completed Packets (0x13) plen 5    #169 [hci1] 15.652887
        Num handles: 1
        Handle: 1587 Address: DF:A9:FF:F6:B1:1A (OUI DF-A9-FF)
        Count: 1
        #168: len 10 (0 Kb/s)
        Latency: 299 msec (128-299 msec ~297 msec)
> ACL Data RX: Handle 1587 flags 0x02 dlen 9              #170 [hci1] 15.653218
      ATT: Find Information Request (0x04) len 4
        Handle range: 0x0048-0x0048
< HCI Command: Host Number of Com.. (0x03|0x0035) plen 5  #171 [hci1] 15.653594
        Num handles: 1
        Handle: 1587 Address: DF:A9:FF:F6:B1:1A (OUI DF-A9-FF)
        Count: 1
< ACL Data TX: Handle 1587 flags 0x00 dlen 10             #172 [hci1] 15.653700
      ATT: Find Information Response (0x05) len 5
        Format: UUID-16 (0x01)
        Handle: 0x0048
        UUID: Client Characteristic Configuration (0x2902)
> HCI Event: Number of Completed Packets (0x13) plen 5    #173 [hci1] 15.952939
        Num handles: 1
        Handle: 1587 Address: DF:A9:FF:F6:B1:1A (OUI DF-A9-FF)
        Count: 1
        #172: len 10 (0 Kb/s)
        Latency: 299 msec (128-299 msec ~298 msec)
> ACL Data RX: Handle 1587 flags 0x02 dlen 9              #174 [hci1] 15.953120
      ATT: Find Information Request (0x04) len 4
        Handle range: 0x004b-0x004b
< HCI Command: Host Number of Com.. (0x03|0x0035) plen 5  #175 [hci1] 15.953449
        Num handles: 1
        Handle: 1587 Address: DF:A9:FF:F6:B1:1A (OUI DF-A9-FF)
        Count: 1
< ACL Data TX: Handle 1587 flags 0x00 dlen 10             #176 [hci1] 15.953523
      ATT: Find Information Response (0x05) len 5
        Format: UUID-16 (0x01)
        Handle: 0x004b
        UUID: Client Characteristic Configuration (0x2902)
> HCI Event: Number of Completed Packets (0x13) plen 5    #177 [hci1] 16.252881
        Num handles: 1
        Handle: 1587 Address: DF:A9:FF:F6:B1:1A (OUI DF-A9-FF)
        Count: 1
        #176: len 10 (0 Kb/s)
        Latency: 299 msec (128-299 msec ~298 msec)
> ACL Data RX: Handle 1587 flags 0x02 dlen 13             #178 [hci1] 16.253239
      ATT: Find By Type Value Request (0x06) len 8
        Handle range: 0x0001-0xffff
        Attribute type: Primary Service (0x2800)
          UUID: Audio Stream Control (0x184e)
< HCI Command: Host Number of Com.. (0x03|0x0035) plen 5  #179 [hci1] 16.254392
        Num handles: 1
        Handle: 1587 Address: DF:A9:FF:F6:B1:1A (OUI DF-A9-FF)
        Count: 1
< ACL Data TX: Handle 1587 flags 0x00 dlen 9              #180 [hci1] 16.254446
      ATT: Find By Type Value Response (0x07) len 4
        Handle range: 0x004c-0x005b
> HCI Event: Number of Completed Packets (0x13) plen 5    #181 [hci1] 16.552911
        Num handles: 1
        Handle: 1587 Address: DF:A9:FF:F6:B1:1A (OUI DF-A9-FF)
        Count: 1
        #180: len 9 (0 Kb/s)
        Latency: 298 msec (128-299 msec ~298 msec)
> ACL Data RX: Handle 1587 flags 0x02 dlen 13             #182 [hci1] 16.553139
      ATT: Find By Type Value Request (0x06) len 8
        Handle range: 0x005c-0xffff
        Attribute type: Primary Service (0x2800)
          UUID: Audio Stream Control (0x184e)
< HCI Command: Host Number of Com.. (0x03|0x0035) plen 5  #183 [hci1] 16.554083
        Num handles: 1
        Handle: 1587 Address: DF:A9:FF:F6:B1:1A (OUI DF-A9-FF)
        Count: 1
< ACL Data TX: Handle 1587 flags 0x00 dlen 9              #184 [hci1] 16.554217
      ATT: Error Response (0x01) len 4
        Find By Type Value Request (0x06)
        Handle: 0x005c
        Error: Attribute Not Found (0x0a)
> HCI Event: Number of Completed Packets (0x13) plen 5    #185 [hci1] 16.852830
        Num handles: 1
        Handle: 1587 Address: DF:A9:FF:F6:B1:1A (OUI DF-A9-FF)
        Count: 1
        #184: len 9 (0 Kb/s)
        Latency: 298 msec (128-299 msec ~298 msec)
> ACL Data RX: Handle 1587 flags 0x02 dlen 11             #186 [hci1] 16.853093
      ATT: Read By Type Request (0x08) len 6
        Handle range: 0x004c-0x005b
        Attribute type: Characteristic (0x2803)
< HCI Command: Host Number of Com.. (0x03|0x0035) plen 5  #187 [hci1] 16.853720
        Num handles: 1
        Handle: 1587 Address: DF:A9:FF:F6:B1:1A (OUI DF-A9-FF)
        Count: 1
< ACL Data TX: Handle 1587 flags 0x00 dlen 27             #188 [hci1] 16.853732
< ACL Data TX: Handle 1587 flags 0x01 dlen 14             #189 [hci1] 16.853734
      ATT: Read By Type Response (0x09) len 36
        Attribute data length: 7
        Attribute data list: 5 entries
        Handle: 0x004d
        Value: 1c4e00c62b
            Properties: 0x1c
              Write Without Response (0x04)
              Write (0x08)
              Notify (0x10)
            Value Handle: 0x004e
            Value UUID: ASE Control Point (0x2bc6)
        Handle: 0x0050
        Value: 125100c42b
            Properties: 0x12
              Read (0x02)
              Notify (0x10)
            Value Handle: 0x0051
            Value UUID: Sink ASE (0x2bc4)
        Handle: 0x0053
        Value: 125400c42b
            Properties: 0x12
              Read (0x02)
              Notify (0x10)
            Value Handle: 0x0054
            Value UUID: Sink ASE (0x2bc4)
        Handle: 0x0056
        Value: 125700c52b
            Properties: 0x12
              Read (0x02)
              Notify (0x10)
            Value Handle: 0x0057
            Value UUID: Source ASE (0x2bc5)
        Handle: 0x0059
        Value: 125a00c52b
            Properties: 0x12
              Read (0x02)
              Notify (0x10)
            Value Handle: 0x005a
            Value UUID: Source ASE (0x2bc5)
> HCI Event: Number of Completed Packets (0x13) plen 5    #190 [hci1] 17.003243
        Num handles: 1
        Handle: 1587 Address: DF:A9:FF:F6:B1:1A (OUI DF-A9-FF)
        Count: 1
        #188: len 27 (1 Kb/s)
        Latency: 149 msec (128-299 msec ~224 msec)
> HCI Event: Number of Completed Packets (0x13) plen 5    #191 [hci1] 17.152994
        Num handles: 1
        Handle: 1587 Address: DF:A9:FF:F6:B1:1A (OUI DF-A9-FF)
        Count: 1
        #189: len 14 (0 Kb/s)
        Latency: 299 msec (128-299 msec ~261 msec)
> ACL Data RX: Handle 1587 flags 0x02 dlen 11             #192 [hci1] 17.153098
      ATT: Read By Type Request (0x08) len 6
        Handle range: 0x005a-0x005b
        Attribute type: Characteristic (0x2803)
< HCI Command: Host Number of Com.. (0x03|0x0035) plen 5  #193 [hci1] 17.153592
        Num handles: 1
        Handle: 1587 Address: DF:A9:FF:F6:B1:1A (OUI DF-A9-FF)
        Count: 1
< ACL Data TX: Handle 1587 flags 0x00 dlen 9              #194 [hci1] 17.153719
      ATT: Error Response (0x01) len 4
        Read By Type Request (0x08)
        Handle: 0x005a
        Error: Attribute Not Found (0x0a)
> HCI Event: Number of Completed Packets (0x13) plen 5    #195 [hci1] 17.452928
        Num handles: 1
        Handle: 1587 Address: DF:A9:FF:F6:B1:1A (OUI DF-A9-FF)
        Count: 1
        #194: len 9 (0 Kb/s)
        Latency: 299 msec (128-299 msec ~280 msec)
> ACL Data RX: Handle 1587 flags 0x02 dlen 9              #196 [hci1] 17.453112
      ATT: Find Information Request (0x04) len 4
        Handle range: 0x004f-0x004f
< HCI Command: Host Number of Com.. (0x03|0x0035) plen 5  #197 [hci1] 17.453369
        Num handles: 1
        Handle: 1587 Address: DF:A9:FF:F6:B1:1A (OUI DF-A9-FF)
        Count: 1
< ACL Data TX: Handle 1587 flags 0x00 dlen 10             #198 [hci1] 17.453390
      ATT: Find Information Response (0x05) len 5
        Format: UUID-16 (0x01)
        Handle: 0x004f
        UUID: Client Characteristic Configuration (0x2902)
> HCI Event: Number of Completed Packets (0x13) plen 5    #199 [hci1] 17.752941
        Num handles: 1
        Handle: 1587 Address: DF:A9:FF:F6:B1:1A (OUI DF-A9-FF)
        Count: 1
        #198: len 10 (0 Kb/s)
        Latency: 299 msec (128-299 msec ~289 msec)
> ACL Data RX: Handle 1587 flags 0x02 dlen 9              #200 [hci1] 17.753026
      ATT: Find Information Request (0x04) len 4
        Handle range: 0x0052-0x0052
< HCI Command: Host Number of Com.. (0x03|0x0035) plen 5  #201 [hci1] 17.753599
        Num handles: 1
        Handle: 1587 Address: DF:A9:FF:F6:B1:1A (OUI DF-A9-FF)
        Count: 1
< ACL Data TX: Handle 1587 flags 0x00 dlen 10             #202 [hci1] 17.753661
      ATT: Find Information Response (0x05) len 5
        Format: UUID-16 (0x01)
        Handle: 0x0052
        UUID: Client Characteristic Configuration (0x2902)
> HCI Event: Number of Completed Packets (0x13) plen 5    #203 [hci1] 18.052924
        Num handles: 1
        Handle: 1587 Address: DF:A9:FF:F6:B1:1A (OUI DF-A9-FF)
        Count: 1
        #202: len 10 (0 Kb/s)
        Latency: 299 msec (128-299 msec ~294 msec)
> ACL Data RX: Handle 1587 flags 0x02 dlen 9              #204 [hci1] 18.053107
      ATT: Find Information Request (0x04) len 4
        Handle range: 0x0055-0x0055
< HCI Command: Host Number of Com.. (0x03|0x0035) plen 5  #205 [hci1] 18.053841
        Num handles: 1
        Handle: 1587 Address: DF:A9:FF:F6:B1:1A (OUI DF-A9-FF)
        Count: 1
< ACL Data TX: Handle 1587 flags 0x00 dlen 10             #206 [hci1] 18.053961
      ATT: Find Information Response (0x05) len 5
        Format: UUID-16 (0x01)
        Handle: 0x0055
        UUID: Client Characteristic Configuration (0x2902)
> HCI Event: Number of Completed Packets (0x13) plen 5    #207 [hci1] 18.352848
        Num handles: 1
        Handle: 1587 Address: DF:A9:FF:F6:B1:1A (OUI DF-A9-FF)
        Count: 1
        #206: len 10 (0 Kb/s)
        Latency: 298 msec (128-299 msec ~296 msec)
> ACL Data RX: Handle 1587 flags 0x02 dlen 9              #208 [hci1] 18.353103
      ATT: Find Information Request (0x04) len 4
        Handle range: 0x0058-0x0058
< HCI Command: Host Number of Com.. (0x03|0x0035) plen 5  #209 [hci1] 18.353908
        Num handles: 1
        Handle: 1587 Address: DF:A9:FF:F6:B1:1A (OUI DF-A9-FF)
        Count: 1
< ACL Data TX: Handle 1587 flags 0x00 dlen 10             #210 [hci1] 18.354027
      ATT: Find Information Response (0x05) len 5
        Format: UUID-16 (0x01)
        Handle: 0x0058
        UUID: Client Characteristic Configuration (0x2902)
> HCI Event: Number of Completed Packets (0x13) plen 5    #211 [hci1] 18.652817
        Num handles: 1
        Handle: 1587 Address: DF:A9:FF:F6:B1:1A (OUI DF-A9-FF)
        Count: 1
        #210: len 10 (0 Kb/s)
        Latency: 298 msec (128-299 msec ~297 msec)
> ACL Data RX: Handle 1587 flags 0x02 dlen 9              #212 [hci1] 18.653095
      ATT: Find Information Request (0x04) len 4
        Handle range: 0x005b-0x005b
< HCI Command: Host Number of Com.. (0x03|0x0035) plen 5  #213 [hci1] 18.654032
        Num handles: 1
        Handle: 1587 Address: DF:A9:FF:F6:B1:1A (OUI DF-A9-FF)
        Count: 1
< ACL Data TX: Handle 1587 flags 0x00 dlen 10             #214 [hci1] 18.654098
      ATT: Find Information Response (0x05) len 5
        Format: UUID-16 (0x01)
        Handle: 0x005b
        UUID: Client Characteristic Configuration (0x2902)
> HCI Event: Number of Completed Packets (0x13) plen 5    #215 [hci1] 18.952945
        Num handles: 1
        Handle: 1587 Address: DF:A9:FF:F6:B1:1A (OUI DF-A9-FF)
        Count: 1
        #214: len 10 (0 Kb/s)
        Latency: 298 msec (128-299 msec ~298 msec)
> ACL Data RX: Handle 1587 flags 0x02 dlen 13             #216 [hci1] 18.953215
      ATT: Find By Type Value Request (0x06) len 8
        Handle range: 0x0001-0xffff
        Attribute type: Primary Service (0x2800)
          UUID: Common Audio (0x1853)
< HCI Command: Host Number of Com.. (0x03|0x0035) plen 5  #217 [hci1] 18.953672
        Num handles: 1
        Handle: 1587 Address: DF:A9:FF:F6:B1:1A (OUI DF-A9-FF)
        Count: 1
< ACL Data TX: Handle 1587 flags 0x00 dlen 9              #218 [hci1] 18.953680
      ATT: Find By Type Value Response (0x07) len 4
        Handle range: 0x00ad-0x00ae
> HCI Event: Number of Completed Packets (0x13) plen 5    #219 [hci1] 19.252833
        Num handles: 1
        Handle: 1587 Address: DF:A9:FF:F6:B1:1A (OUI DF-A9-FF)
        Count: 1
        #218: len 9 (0 Kb/s)
        Latency: 299 msec (128-299 msec ~298 msec)
> ACL Data RX: Handle 1587 flags 0x02 dlen 13             #220 [hci1] 19.253117
      ATT: Find By Type Value Request (0x06) len 8
        Handle range: 0x00af-0xffff
        Attribute type: Primary Service (0x2800)
          UUID: Common Audio (0x1853)
< HCI Command: Host Number of Com.. (0x03|0x0035) plen 5  #221 [hci1] 19.253858
        Num handles: 1
        Handle: 1587 Address: DF:A9:FF:F6:B1:1A (OUI DF-A9-FF)
        Count: 1
< ACL Data TX: Handle 1587 flags 0x00 dlen 9              #222 [hci1] 19.254031
      ATT: Error Response (0x01) len 4
        Find By Type Value Request (0x06)
        Handle: 0x00af
        Error: Attribute Not Found (0x0a)
> HCI Event: Number of Completed Packets (0x13) plen 5    #223 [hci1] 19.552962
        Num handles: 1
        Handle: 1587 Address: DF:A9:FF:F6:B1:1A (OUI DF-A9-FF)
        Count: 1
        #222: len 9 (0 Kb/s)
        Latency: 298 msec (128-299 msec ~298 msec)
> ACL Data RX: Handle 1587 flags 0x02 dlen 11             #224 [hci1] 19.553029
      ATT: Read By Type Request (0x08) len 6
        Handle range: 0x00ad-0x00ae
        Attribute type: Include (0x2802)
< HCI Command: Host Number of Com.. (0x03|0x0035) plen 5  #225 [hci1] 19.554045
        Num handles: 1
        Handle: 1587 Address: DF:A9:FF:F6:B1:1A (OUI DF-A9-FF)
        Count: 1
< ACL Data TX: Handle 1587 flags 0x00 dlen 14             #226 [hci1] 19.554095
      ATT: Read By Type Response (0x09) len 9
        Attribute data length: 8
        Attribute data list: 1 entry
        Handle: 0x00ae
        Value: a100ac004618
> HCI Event: Number of Completed Packets (0x13) plen 5    #227 [hci1] 19.852892
        Num handles: 1
        Handle: 1587 Address: DF:A9:FF:F6:B1:1A (OUI DF-A9-FF)
        Count: 1
        #226: len 14 (0 Kb/s)
        Latency: 298 msec (128-299 msec ~298 msec)
> ACL Data RX: Handle 1587 flags 0x02 dlen 11             #228 [hci1] 19.853080
      ATT: Read By Type Request (0x08) len 6
        Handle range: 0x00a1-0x00ac
        Attribute type: Characteristic (0x2803)
< HCI Command: Host Number of Com.. (0x03|0x0035) plen 5  #229 [hci1] 19.853608
        Num handles: 1
        Handle: 1587 Address: DF:A9:FF:F6:B1:1A (OUI DF-A9-FF)
        Count: 1
< ACL Data TX: Handle 1587 flags 0x00 dlen 27             #230 [hci1] 19.853641
< ACL Data TX: Handle 1587 flags 0x01 dlen 7              #231 [hci1] 19.853644
      ATT: Read By Type Response (0x09) len 29
        Attribute data length: 7
        Attribute data list: 4 entries
        Handle: 0x00a2
        Value: 12a300842b
            Properties: 0x12
              Read (0x02)
              Notify (0x10)
            Value Handle: 0x00a3
            Value UUID: Set Identity Resolving Key (0x2b84)
        Handle: 0x00a5
        Value: 12a600852b
            Properties: 0x12
              Read (0x02)
              Notify (0x10)
            Value Handle: 0x00a6
            Value UUID: Coordinated Set Size (0x2b85)
        Handle: 0x00a8
        Value: 1aa900862b
            Properties: 0x1a
              Read (0x02)
              Write (0x08)
              Notify (0x10)
            Value Handle: 0x00a9
            Value UUID: Set Member Lock (0x2b86)
        Handle: 0x00ab
        Value: 02ac00872b
            Properties: 0x02
              Read (0x02)
            Value Handle: 0x00ac
            Value UUID: Set Member Rank (0x2b87)
> HCI Event: Number of Completed Packets (0x13) plen 5    #232 [hci1] 20.003281
        Num handles: 1
        Handle: 1587 Address: DF:A9:FF:F6:B1:1A (OUI DF-A9-FF)
        Count: 1
        #230: len 27 (1 Kb/s)
        Latency: 149 msec (128-299 msec ~224 msec)
> HCI Event: Number of Completed Packets (0x13) plen 5    #233 [hci1] 20.152922
        Num handles: 1
        Handle: 1587 Address: DF:A9:FF:F6:B1:1A (OUI DF-A9-FF)
        Count: 1
        #231: len 7 (0 Kb/s)
        Latency: 299 msec (128-299 msec ~261 msec)
> ACL Data RX: Handle 1587 flags 0x02 dlen 11             #234 [hci1] 20.153159
      ATT: Read By Type Request (0x08) len 6
        Handle range: 0x00ac-0x00ac
        Attribute type: Characteristic (0x2803)
< HCI Command: Host Number of Com.. (0x03|0x0035) plen 5  #235 [hci1] 20.153892
        Num handles: 1
        Handle: 1587 Address: DF:A9:FF:F6:B1:1A (OUI DF-A9-FF)
        Count: 1
< ACL Data TX: Handle 1587 flags 0x00 dlen 9              #236 [hci1] 20.154076
      ATT: Error Response (0x01) len 4
        Read By Type Request (0x08)
        Handle: 0x00ac
        Error: Attribute Not Found (0x0a)
> HCI Event: Number of Completed Packets (0x13) plen 5    #237 [hci1] 20.452887
        Num handles: 1
        Handle: 1587 Address: DF:A9:FF:F6:B1:1A (OUI DF-A9-FF)
        Count: 1
        #236: len 9 (0 Kb/s)
        Latency: 298 msec (128-299 msec ~280 msec)
> ACL Data RX: Handle 1587 flags 0x02 dlen 9              #238 [hci1] 20.453028
      ATT: Find Information Request (0x04) len 4
        Handle range: 0x00a4-0x00a4
< HCI Command: Host Number of Com.. (0x03|0x0035) plen 5  #239 [hci1] 20.453995
        Num handles: 1
        Handle: 1587 Address: DF:A9:FF:F6:B1:1A (OUI DF-A9-FF)
        Count: 1
< ACL Data TX: Handle 1587 flags 0x00 dlen 10             #240 [hci1] 20.454048
      ATT: Find Information Response (0x05) len 5
        Format: UUID-16 (0x01)
        Handle: 0x00a4
        UUID: Client Characteristic Configuration (0x2902)
> HCI Event: Number of Completed Packets (0x13) plen 5    #241 [hci1] 20.752819
        Num handles: 1
        Handle: 1587 Address: DF:A9:FF:F6:B1:1A (OUI DF-A9-FF)
        Count: 1
        #240: len 10 (0 Kb/s)
        Latency: 298 msec (128-299 msec ~289 msec)
> ACL Data RX: Handle 1587 flags 0x02 dlen 9              #242 [hci1] 20.752960
      ATT: Find Information Request (0x04) len 4
        Handle range: 0x00a7-0x00a7
< HCI Command: Host Number of Com.. (0x03|0x0035) plen 5  #243 [hci1] 20.753873
        Num handles: 1
        Handle: 1587 Address: DF:A9:FF:F6:B1:1A (OUI DF-A9-FF)
        Count: 1
< ACL Data TX: Handle 1587 flags 0x00 dlen 10             #244 [hci1] 20.754006
      ATT: Find Information Response (0x05) len 5
        Format: UUID-16 (0x01)
        Handle: 0x00a7
        UUID: Client Characteristic Configuration (0x2902)
> HCI Event: Number of Completed Packets (0x13) plen 5    #245 [hci1] 21.052813
        Num handles: 1
        Handle: 1587 Address: DF:A9:FF:F6:B1:1A (OUI DF-A9-FF)
        Count: 1
        #244: len 10 (0 Kb/s)
        Latency: 298 msec (128-299 msec ~294 msec)
> ACL Data RX: Handle 1587 flags 0x02 dlen 9              #246 [hci1] 21.052963
      ATT: Find Information Request (0x04) len 4
        Handle range: 0x00aa-0x00aa
< HCI Command: Host Number of Com.. (0x03|0x0035) plen 5  #247 [hci1] 21.053554
        Num handles: 1
        Handle: 1587 Address: DF:A9:FF:F6:B1:1A (OUI DF-A9-FF)
        Count: 1
< ACL Data TX: Handle 1587 flags 0x00 dlen 10             #248 [hci1] 21.053580
      ATT: Find Information Response (0x05) len 5
        Format: UUID-16 (0x01)
        Handle: 0x00aa
        UUID: Client Characteristic Configuration (0x2902)
> HCI Event: Number of Completed Packets (0x13) plen 5    #249 [hci1] 21.352842
        Num handles: 1
        Handle: 1587 Address: DF:A9:FF:F6:B1:1A (OUI DF-A9-FF)
        Count: 1
        #248: len 10 (0 Kb/s)
        Latency: 299 msec (128-299 msec ~296 msec)
> ACL Data RX: Handle 1587 flags 0x02 dlen 9              #250 [hci1] 21.352934
      ATT: Write Request (0x12) len 4
        Handle: 0x0048
          Data: 0000
< HCI Command: Host Number of Com.. (0x03|0x0035) plen 5  #251 [hci1] 21.354059
        Num handles: 1
        Handle: 1587 Address: DF:A9:FF:F6:B1:1A (OUI DF-A9-FF)
        Count: 1
< ACL Data TX: Handle 1587 flags 0x00 dlen 5              #252 [hci1] 21.354203
      ATT: Write Response (0x13) len 0
> HCI Event: Number of Completed Packets (0x13) plen 5    #253 [hci1] 21.652872
        Num handles: 1
        Handle: 1587 Address: DF:A9:FF:F6:B1:1A (OUI DF-A9-FF)
        Count: 1
        #252: len 5 (0 Kb/s)
        Latency: 298 msec (128-299 msec ~297 msec)
> ACL Data RX: Handle 1587 flags 0x02 dlen 9              #254 [hci1] 21.652978
      ATT: Write Request (0x12) len 4
        Handle: 0x0048
          Data: 0100
< HCI Command: Host Number of Com.. (0x03|0x0035) plen 5  #255 [hci1] 21.653889
        Num handles: 1
        Handle: 1587 Address: DF:A9:FF:F6:B1:1A (OUI DF-A9-FF)
        Count: 1
< ACL Data TX: Handle 1587 flags 0x00 dlen 5              #256 [hci1] 21.653928
      ATT: Write Response (0x13) len 0
> HCI Event: Number of Completed Packets (0x13) plen 5    #257 [hci1] 21.952863
        Num handles: 1
        Handle: 1587 Address: DF:A9:FF:F6:B1:1A (OUI DF-A9-FF)
        Count: 1
        #256: len 5 (0 Kb/s)
        Latency: 298 msec (128-299 msec ~298 msec)
> ACL Data RX: Handle 1587 flags 0x02 dlen 9              #258 [hci1] 21.953091
      ATT: Write Request (0x12) len 4
        Handle: 0x004f
          Data: 0000
< HCI Command: Host Number of Com.. (0x03|0x0035) plen 5  #259 [hci1] 21.953895
        Num handles: 1
        Handle: 1587 Address: DF:A9:FF:F6:B1:1A (OUI DF-A9-FF)
        Count: 1
< ACL Data TX: Handle 1587 flags 0x00 dlen 5              #260 [hci1] 21.953956
      ATT: Write Response (0x13) len 0
> HCI Event: Number of Completed Packets (0x13) plen 5    #261 [hci1] 22.252846
        Num handles: 1
        Handle: 1587 Address: DF:A9:FF:F6:B1:1A (OUI DF-A9-FF)
        Count: 1
        #260: len 5 (0 Kb/s)
        Latency: 298 msec (128-299 msec ~298 msec)
> ACL Data RX: Handle 1587 flags 0x02 dlen 9              #262 [hci1] 22.252983
      ATT: Write Request (0x12) len 4
        Handle: 0x004f
          Data: 0100
< HCI Command: Host Number of Com.. (0x03|0x0035) plen 5  #263 [hci1] 22.253785
        Num handles: 1
        Handle: 1587 Address: DF:A9:FF:F6:B1:1A (OUI DF-A9-FF)
        Count: 1
< ACL Data TX: Handle 1587 flags 0x00 dlen 5              #264 [hci1] 22.253890
      ATT: Write Response (0x13) len 0
> HCI Event: Number of Completed Packets (0x13) plen 5    #265 [hci1] 22.552807
        Num handles: 1
        Handle: 1587 Address: DF:A9:FF:F6:B1:1A (OUI DF-A9-FF)
        Count: 1
        #264: len 5 (0 Kb/s)
        Latency: 298 msec (128-299 msec ~298 msec)
> ACL Data RX: Handle 1587 flags 0x02 dlen 9              #266 [hci1] 22.553013
      ATT: Write Request (0x12) len 4
        Handle: 0x0052
          Data: 0000
< HCI Command: Host Number of Com.. (0x03|0x0035) plen 5  #267 [hci1] 22.553505
        Num handles: 1
        Handle: 1587 Address: DF:A9:FF:F6:B1:1A (OUI DF-A9-FF)
        Count: 1
< ACL Data TX: Handle 1587 flags 0x00 dlen 5              #268 [hci1] 22.553568
      ATT: Write Response (0x13) len 0
> HCI Event: Number of Completed Packets (0x13) plen 5    #269 [hci1] 22.852785
        Num handles: 1
        Handle: 1587 Address: DF:A9:FF:F6:B1:1A (OUI DF-A9-FF)
        Count: 1
        #268: len 5 (0 Kb/s)
        Latency: 299 msec (128-299 msec ~298 msec)
> ACL Data RX: Handle 1587 flags 0x02 dlen 9              #270 [hci1] 22.853011
      ATT: Write Request (0x12) len 4
        Handle: 0x0052
          Data: 0100
< HCI Command: Host Number of Com.. (0x03|0x0035) plen 5  #271 [hci1] 22.853584
        Num handles: 1
        Handle: 1587 Address: DF:A9:FF:F6:B1:1A (OUI DF-A9-FF)
        Count: 1
< ACL Data TX: Handle 1587 flags 0x00 dlen 5              #272 [hci1] 22.853648
      ATT: Write Response (0x13) len 0
> HCI Event: Number of Completed Packets (0x13) plen 5    #273 [hci1] 23.152805
        Num handles: 1
        Handle: 1587 Address: DF:A9:FF:F6:B1:1A (OUI DF-A9-FF)
        Count: 1
        #272: len 5 (0 Kb/s)
        Latency: 299 msec (128-299 msec ~299 msec)
> ACL Data RX: Handle 1587 flags 0x02 dlen 9              #274 [hci1] 23.152965
      ATT: Write Request (0x12) len 4
        Handle: 0x0055
          Data: 0000
< HCI Command: Host Number of Com.. (0x03|0x0035) plen 5  #275 [hci1] 23.153832
        Num handles: 1
        Handle: 1587 Address: DF:A9:FF:F6:B1:1A (OUI DF-A9-FF)
        Count: 1
< ACL Data TX: Handle 1587 flags 0x00 dlen 5              #276 [hci1] 23.153890
      ATT: Write Response (0x13) len 0
> HCI Event: Number of Completed Packets (0x13) plen 5    #277 [hci1] 23.452753
        Num handles: 1
        Handle: 1587 Address: DF:A9:FF:F6:B1:1A (OUI DF-A9-FF)
        Count: 1
        #276: len 5 (0 Kb/s)
        Latency: 298 msec (128-299 msec ~298 msec)
> ACL Data RX: Handle 1587 flags 0x02 dlen 9              #278 [hci1] 23.452946
      ATT: Write Request (0x12) len 4
        Handle: 0x0055
          Data: 0100
< HCI Command: Host Number of Com.. (0x03|0x0035) plen 5  #279 [hci1] 23.453992
        Num handles: 1
        Handle: 1587 Address: DF:A9:FF:F6:B1:1A (OUI DF-A9-FF)
        Count: 1
< ACL Data TX: Handle 1587 flags 0x00 dlen 5              #280 [hci1] 23.454049
      ATT: Write Response (0x13) len 0
> HCI Event: Number of Completed Packets (0x13) plen 5    #281 [hci1] 23.752768
        Num handles: 1
        Handle: 1587 Address: DF:A9:FF:F6:B1:1A (OUI DF-A9-FF)
        Count: 1
        #280: len 5 (0 Kb/s)
        Latency: 298 msec (128-299 msec ~298 msec)
> ACL Data RX: Handle 1587 flags 0x02 dlen 9              #282 [hci1] 23.752960
      ATT: Write Request (0x12) len 4
        Handle: 0x0058
          Data: 0000
< HCI Command: Host Number of Com.. (0x03|0x0035) plen 5  #283 [hci1] 23.753965
        Num handles: 1
        Handle: 1587 Address: DF:A9:FF:F6:B1:1A (OUI DF-A9-FF)
        Count: 1
< ACL Data TX: Handle 1587 flags 0x00 dlen 5              #284 [hci1] 23.754081
      ATT: Write Response (0x13) len 0
> HCI Event: Number of Completed Packets (0x13) plen 5    #285 [hci1] 24.052839
        Num handles: 1
        Handle: 1587 Address: DF:A9:FF:F6:B1:1A (OUI DF-A9-FF)
        Count: 1
        #284: len 5 (0 Kb/s)
        Latency: 298 msec (128-299 msec ~298 msec)
> ACL Data RX: Handle 1587 flags 0x02 dlen 9              #286 [hci1] 24.052946
      ATT: Write Request (0x12) len 4
        Handle: 0x0058
          Data: 0100
< HCI Command: Host Number of Com.. (0x03|0x0035) plen 5  #287 [hci1] 24.053688
        Num handles: 1
        Handle: 1587 Address: DF:A9:FF:F6:B1:1A (OUI DF-A9-FF)
        Count: 1
< ACL Data TX: Handle 1587 flags 0x00 dlen 5              #288 [hci1] 24.053729
      ATT: Write Response (0x13) len 0
> HCI Event: Number of Completed Packets (0x13) plen 5    #289 [hci1] 24.352739
        Num handles: 1
        Handle: 1587 Address: DF:A9:FF:F6:B1:1A (OUI DF-A9-FF)
        Count: 1
        #288: len 5 (0 Kb/s)
        Latency: 299 msec (128-299 msec ~298 msec)
> ACL Data RX: Handle 1587 flags 0x02 dlen 9              #290 [hci1] 24.352988
      ATT: Write Request (0x12) len 4
        Handle: 0x005b
          Data: 0000
< HCI Command: Host Number of Com.. (0x03|0x0035) plen 5  #291 [hci1] 24.353806
        Num handles: 1
        Handle: 1587 Address: DF:A9:FF:F6:B1:1A (OUI DF-A9-FF)
        Count: 1
< ACL Data TX: Handle 1587 flags 0x00 dlen 5              #292 [hci1] 24.353851
      ATT: Write Response (0x13) len 0
> HCI Event: Number of Completed Packets (0x13) plen 5    #293 [hci1] 24.652781
        Num handles: 1
        Handle: 1587 Address: DF:A9:FF:F6:B1:1A (OUI DF-A9-FF)
        Count: 1
        #292: len 5 (0 Kb/s)
        Latency: 298 msec (128-299 msec ~298 msec)
> ACL Data RX: Handle 1587 flags 0x02 dlen 9              #294 [hci1] 24.652999
      ATT: Write Request (0x12) len 4
        Handle: 0x005b
          Data: 0100
< HCI Command: Host Number of Com.. (0x03|0x0035) plen 5  #295 [hci1] 24.653663
        Num handles: 1
        Handle: 1587 Address: DF:A9:FF:F6:B1:1A (OUI DF-A9-FF)
        Count: 1
< ACL Data TX: Handle 1587 flags 0x00 dlen 5              #296 [hci1] 24.653737
      ATT: Write Response (0x13) len 0
> HCI Event: Number of Completed Packets (0x13) plen 5    #297 [hci1] 24.952800
        Num handles: 1
        Handle: 1587 Address: DF:A9:FF:F6:B1:1A (OUI DF-A9-FF)
        Count: 1
        #296: len 5 (0 Kb/s)
        Latency: 299 msec (128-299 msec ~298 msec)
> ACL Data RX: Handle 1587 flags 0x02 dlen 7              #298 [hci1] 24.952927
      ATT: Read Request (0x0a) len 2
        Handle: 0x0051
< HCI Command: Host Number of Com.. (0x03|0x0035) plen 5  #299 [hci1] 24.953623
        Num handles: 1
        Handle: 1587 Address: DF:A9:FF:F6:B1:1A (OUI DF-A9-FF)
        Count: 1
< ACL Data TX: Handle 1587 flags 0x00 dlen 7              #300 [hci1] 24.953679
      ATT: Read Response (0x0b) len 2
> HCI Event: Number of Completed Packets (0x13) plen 5    #301 [hci1] 25.252721
        Num handles: 1
        Handle: 1587 Address: DF:A9:FF:F6:B1:1A (OUI DF-A9-FF)
        Count: 1
        #300: len 7 (0 Kb/s)
        Latency: 299 msec (128-299 msec ~299 msec)
> ACL Data RX: Handle 1587 flags 0x02 dlen 7              #302 [hci1] 25.252976
      ATT: Read Request (0x0a) len 2
        Handle: 0x0054
< HCI Command: Host Number of Com.. (0x03|0x0035) plen 5  #303 [hci1] 25.253982
        Num handles: 1
        Handle: 1587 Address: DF:A9:FF:F6:B1:1A (OUI DF-A9-FF)
        Count: 1
< ACL Data TX: Handle 1587 flags 0x00 dlen 7              #304 [hci1] 25.254093
      ATT: Read Response (0x0b) len 2
> HCI Event: Number of Completed Packets (0x13) plen 5    #305 [hci1] 25.552753
        Num handles: 1
        Handle: 1587 Address: DF:A9:FF:F6:B1:1A (OUI DF-A9-FF)
        Count: 1
        #304: len 7 (0 Kb/s)
        Latency: 298 msec (128-299 msec ~298 msec)
> ACL Data RX: Handle 1587 flags 0x02 dlen 7              #306 [hci1] 25.552898
      ATT: Read Request (0x0a) len 2
        Handle: 0x0057
< HCI Command: Host Number of Com.. (0x03|0x0035) plen 5  #307 [hci1] 25.554071
        Num handles: 1
        Handle: 1587 Address: DF:A9:FF:F6:B1:1A (OUI DF-A9-FF)
        Count: 1
< ACL Data TX: Handle 1587 flags 0x00 dlen 7              #308 [hci1] 25.554192
      ATT: Read Response (0x0b) len 2
> HCI Event: Number of Completed Packets (0x13) plen 5    #309 [hci1] 25.852759
        Num handles: 1
        Handle: 1587 Address: DF:A9:FF:F6:B1:1A (OUI DF-A9-FF)
        Count: 1
        #308: len 7 (0 Kb/s)
        Latency: 298 msec (128-299 msec ~298 msec)
> ACL Data RX: Handle 1587 flags 0x02 dlen 7              #310 [hci1] 25.852946
      ATT: Read Request (0x0a) len 2
        Handle: 0x005a
< HCI Command: Host Number of Com.. (0x03|0x0035) plen 5  #311 [hci1] 25.853640
        Num handles: 1
        Handle: 1587 Address: DF:A9:FF:F6:B1:1A (OUI DF-A9-FF)
        Count: 1
< ACL Data TX: Handle 1587 flags 0x00 dlen 7              #312 [hci1] 25.853672
      ATT: Read Response (0x0b) len 2
> HCI Event: Number of Completed Packets (0x13) plen 5    #313 [hci1] 26.152747
        Num handles: 1
        Handle: 1587 Address: DF:A9:FF:F6:B1:1A (OUI DF-A9-FF)
        Count: 1
        #312: len 7 (0 Kb/s)
        Latency: 299 msec (128-299 msec ~298 msec)
> ACL Data RX: Handle 1587 flags 0x02 dlen 9              #314 [hci1] 26.152941
      ATT: Write Request (0x12) len 4
        Handle: 0x00aa
          Data: 0000
< HCI Command: Host Number of Com.. (0x03|0x0035) plen 5  #315 [hci1] 26.153669
        Num handles: 1
        Handle: 1587 Address: DF:A9:FF:F6:B1:1A (OUI DF-A9-FF)
        Count: 1
< ACL Data TX: Handle 1587 flags 0x00 dlen 5              #316 [hci1] 26.153701
      ATT: Write Response (0x13) len 0
> HCI Event: Number of Completed Packets (0x13) plen 5    #317 [hci1] 26.452769
        Num handles: 1
        Handle: 1587 Address: DF:A9:FF:F6:B1:1A (OUI DF-A9-FF)
        Count: 1
        #316: len 5 (0 Kb/s)
        Latency: 299 msec (128-299 msec ~298 msec)
> ACL Data RX: Handle 1587 flags 0x02 dlen 9              #318 [hci1] 26.452980
      ATT: Write Request (0x12) len 4
        Handle: 0x00aa
          Data: 0100
< HCI Command: Host Number of Com.. (0x03|0x0035) plen 5  #319 [hci1] 26.453764
        Num handles: 1
        Handle: 1587 Address: DF:A9:FF:F6:B1:1A (OUI DF-A9-FF)
        Count: 1
< ACL Data TX: Handle 1587 flags 0x00 dlen 5              #320 [hci1] 26.453845
      ATT: Write Response (0x13) len 0
> HCI Event: Number of Completed Packets (0x13) plen 5    #321 [hci1] 26.752718
        Num handles: 1
        Handle: 1587 Address: DF:A9:FF:F6:B1:1A (OUI DF-A9-FF)
        Count: 1
        #320: len 5 (0 Kb/s)
        Latency: 298 msec (128-299 msec ~298 msec)
> ACL Data RX: Handle 1587 flags 0x02 dlen 7              #322 [hci1] 26.752919
      ATT: Read Request (0x0a) len 2
        Handle: 0x003e
< HCI Command: Host Number of Com.. (0x03|0x0035) plen 5  #323 [hci1] 26.753979
        Num handles: 1
        Handle: 1587 Address: DF:A9:FF:F6:B1:1A (OUI DF-A9-FF)
        Count: 1
< ACL Data TX: Handle 1587 flags 0x00 dlen 9              #324 [hci1] 26.754125
      ATT: Read Response (0x0b) len 4
> HCI Event: Number of Completed Packets (0x13) plen 5    #325 [hci1] 27.052834
        Num handles: 1
        Handle: 1587 Address: DF:A9:FF:F6:B1:1A (OUI DF-A9-FF)
        Count: 1
        #324: len 9 (0 Kb/s)
        Latency: 298 msec (128-299 msec ~298 msec)
> ACL Data RX: Handle 1587 flags 0x02 dlen 7              #326 [hci1] 27.052908
      ATT: Read Request (0x0a) len 2
        Handle: 0x003b
< HCI Command: Host Number of Com.. (0x03|0x0035) plen 5  #327 [hci1] 27.054064
        Num handles: 1
        Handle: 1587 Address: DF:A9:FF:F6:B1:1A (OUI DF-A9-FF)
        Count: 1
< ACL Data TX: Handle 1587 flags 0x00 dlen 27             #328 [hci1] 27.054137
< ACL Data TX: Handle 1587 flags 0x01 dlen 27             #329 [hci1] 27.054159
< ACL Data TX: Handle 1587 flags 0x01 dlen 12             #330 [hci1] 27.054188
      ATT: Read Response (0x0b) len 61
> HCI Event: Number of Completed Packets (0x13) plen 5    #331 [hci1] 27.203148
        Num handles: 1
        Handle: 1587 Address: DF:A9:FF:F6:B1:1A (OUI DF-A9-FF)
        Count: 1
        #328: len 27 (1 Kb/s)
        Latency: 149 msec (128-299 msec ~223 msec)
> HCI Event: Number of Completed Packets (0x13) plen 5    #332 [hci1] 27.203623
        Num handles: 1
        Handle: 1587 Address: DF:A9:FF:F6:B1:1A (OUI DF-A9-FF)
        Count: 1
        #329: len 27 (1 Kb/s)
        Latency: 149 msec (128-299 msec ~186 msec)
> HCI Event: Number of Completed Packets (0x13) plen 5    #333 [hci1] 27.352709
        Num handles: 1
        Handle: 1587 Address: DF:A9:FF:F6:B1:1A (OUI DF-A9-FF)
        Count: 1
        #330: len 12 (0 Kb/s)
        Latency: 298 msec (128-299 msec ~242 msec)
> ACL Data RX: Handle 1587 flags 0x02 dlen 7              #334 [hci1] 27.352942
      ATT: Read Request (0x0a) len 2
        Handle: 0x0047
< HCI Command: Host Number of Com.. (0x03|0x0035) plen 5  #335 [hci1] 27.353639
        Num handles: 1
        Handle: 1587 Address: DF:A9:FF:F6:B1:1A (OUI DF-A9-FF)
        Count: 1
< ACL Data TX: Handle 1587 flags 0x00 dlen 9              #336 [hci1] 27.353650
      ATT: Read Response (0x0b) len 4
> HCI Event: Number of Completed Packets (0x13) plen 5    #337 [hci1] 27.652698
        Num handles: 1
        Handle: 1587 Address: DF:A9:FF:F6:B1:1A (OUI DF-A9-FF)
        Count: 1
        #336: len 9 (0 Kb/s)
        Latency: 299 msec (128-299 msec ~270 msec)
> ACL Data RX: Handle 1587 flags 0x02 dlen 7              #338 [hci1] 27.652957
      ATT: Read Request (0x0a) len 2
        Handle: 0x004a
< HCI Command: Host Number of Com.. (0x03|0x0035) plen 5  #339 [hci1] 27.654033
        Num handles: 1
        Handle: 1587 Address: DF:A9:FF:F6:B1:1A (OUI DF-A9-FF)
        Count: 1
< ACL Data TX: Handle 1587 flags 0x00 dlen 9              #340 [hci1] 27.654143
      ATT: Read Response (0x0b) len 4
> HCI Event: Number of Completed Packets (0x13) plen 5    #341 [hci1] 27.952712
        Num handles: 1
        Handle: 1587 Address: DF:A9:FF:F6:B1:1A (OUI DF-A9-FF)
        Count: 1
        #340: len 9 (0 Kb/s)
        Latency: 298 msec (128-299 msec ~284 msec)
> ACL Data RX: Handle 1587 flags 0x02 dlen 9              #342 [hci1] 27.952919
      ATT: Write Request (0x12) len 4
        Handle: 0x00b4
          Data: 0000
< HCI Command: Host Number of Com.. (0x03|0x0035) plen 5  #343 [hci1] 27.953644
        Num handles: 1
        Handle: 1587 Address: DF:A9:FF:F6:B1:1A (OUI DF-A9-FF)
        Count: 1
< ACL Data TX: Handle 1587 flags 0x00 dlen 5              #344 [hci1] 27.953676
      ATT: Write Response (0x13) len 0
> HCI Event: Number of Completed Packets (0x13) plen 5    #345 [hci1] 28.252736
        Num handles: 1
        Handle: 1587 Address: DF:A9:FF:F6:B1:1A (OUI DF-A9-FF)
        Count: 1
        #344: len 5 (0 Kb/s)
        Latency: 299 msec (128-299 msec ~291 msec)
> ACL Data RX: Handle 1587 flags 0x02 dlen 9              #346 [hci1] 28.252945
      ATT: Write Request (0x12) len 4
        Handle: 0x00b4
          Data: 0200
< HCI Command: Host Number of Com.. (0x03|0x0035) plen 5  #347 [hci1] 28.254232
        Num handles: 1
        Handle: 1587 Address: DF:A9:FF:F6:B1:1A (OUI DF-A9-FF)
        Count: 1
< ACL Data TX: Handle 1587 flags 0x00 dlen 5              #348 [hci1] 28.254336
      ATT: Write Response (0x13) len 0
> HCI Event: Number of Completed Packets (0x13) plen 5    #349 [hci1] 28.552771
        Num handles: 1
        Handle: 1587 Address: DF:A9:FF:F6:B1:1A (OUI DF-A9-FF)
        Count: 1
        #348: len 5 (0 Kb/s)
        Latency: 298 msec (128-299 msec ~295 msec)
> ACL Data RX: Handle 1587 flags 0x02 dlen 9              #350 [hci1] 28.552851
      ATT: Write Request (0x12) len 4
        Handle: 0x00b7
          Data: 0000
< HCI Command: Host Number of Com.. (0x03|0x0035) plen 5  #351 [hci1] 28.554071
        Num handles: 1
        Handle: 1587 Address: DF:A9:FF:F6:B1:1A (OUI DF-A9-FF)
        Count: 1
< ACL Data TX: Handle 1587 flags 0x00 dlen 5              #352 [hci1] 28.554203
      ATT: Write Response (0x13) len 0
> HCI Event: Number of Completed Packets (0x13) plen 5    #353 [hci1] 28.852796
        Num handles: 1
        Handle: 1587 Address: DF:A9:FF:F6:B1:1A (OUI DF-A9-FF)
        Count: 1
        #352: len 5 (0 Kb/s)
        Latency: 298 msec (128-299 msec ~296 msec)
> ACL Data RX: Handle 1587 flags 0x02 dlen 9              #354 [hci1] 28.852908
      ATT: Write Request (0x12) len 4
        Handle: 0x00b7
          Data: 0100
< HCI Command: Host Number of Com.. (0x03|0x0035) plen 5  #355 [hci1] 28.854209
        Num handles: 1
        Handle: 1587 Address: DF:A9:FF:F6:B1:1A (OUI DF-A9-FF)
        Count: 1
< ACL Data TX: Handle 1587 flags 0x00 dlen 5              #356 [hci1] 28.854230
      ATT: Write Response (0x13) len 0
> HCI Event: Number of Completed Packets (0x13) plen 5    #357 [hci1] 29.152668
        Num handles: 1
        Handle: 1587 Address: DF:A9:FF:F6:B1:1A (OUI DF-A9-FF)
        Count: 1
        #356: len 5 (0 Kb/s)
        Latency: 298 msec (128-299 msec ~297 msec)
> ACL Data RX: Handle 1587 flags 0x02 dlen 7              #358 [hci1] 29.152895
      ATT: Read Request (0x0a) len 2
        Handle: 0x00b1
< HCI Command: Host Number of Com.. (0x03|0x0035) plen 5  #359 [hci1] 29.153741
        Num handles: 1
        Handle: 1587 Address: DF:A9:FF:F6:B1:1A (OUI DF-A9-FF)
        Count: 1
< ACL Data TX: Handle 1587 flags 0x00 dlen 6              #360 [hci1] 29.153817
      ATT: Read Response (0x0b) len 1
> HCI Event: Number of Completed Packets (0x13) plen 5    #361 [hci1] 29.452717
        Num handles: 1
        Handle: 1587 Address: DF:A9:FF:F6:B1:1A (OUI DF-A9-FF)
        Count: 1
        #360: len 6 (0 Kb/s)
        Latency: 298 msec (128-299 msec ~298 msec)
> ACL Data RX: Handle 1587 flags 0x02 dlen 7              #362 [hci1] 29.452840
      ATT: Read Request (0x0a) len 2
        Handle: 0x00b1
< HCI Command: Host Number of Com.. (0x03|0x0035) plen 5  #363 [hci1] 29.454082
        Num handles: 1
        Handle: 1587 Address: DF:A9:FF:F6:B1:1A (OUI DF-A9-FF)
        Count: 1
< ACL Data TX: Handle 1587 flags 0x00 dlen 6              #364 [hci1] 29.454154
      ATT: Read Response (0x0b) len 1
> HCI Event: Number of Completed Packets (0x13) plen 5    #365 [hci1] 29.752614
        Num handles: 1
        Handle: 1587 Address: DF:A9:FF:F6:B1:1A (OUI DF-A9-FF)
        Count: 1
        #364: len 6 (0 Kb/s)
        Latency: 298 msec (128-299 msec ~298 msec)
> HCI Event: Disconnect Complete (0x05) plen 4            #366 [hci1] 31.102860
        Status: Success (0x00)
        Handle: 1587 Address: DF:A9:FF:F6:B1:1A (OUI DF-A9-FF)
        Reason: Remote User Terminated Connection (0x13)
< HCI Command: Reset (0x03|0x0003) plen 0                 #367 [hci1] 36.983696
> HCI Event: Command Complete (0x0e) plen 4               #368 [hci1] 36.984233
      Reset (0x03|0x0003) ncmd 1
        Status: Success (0x00)
@ USER Close: main                                    {0x0001} [hci1] 36.993549
= Close Index: 00:00:00:00:00:00                               [hci1] 36.993555
