Bluetooth monitor ver 5.84
btmon[1946604]: = Note: Linux version 6.8.0-83-generic (x86_64)                                                          0.954862
btmon[1946604]: = Note: Bluetooth subsystem version 2.22                                                                 0.954864
= New Index: 00:00:00:00:00:00 (Primary,UART,hci0)                                                                       0.954865
= Open Index: 00:00:00:00:00:00                                                                                          1.459159
= Index Info: 00:00:00:00:00:00 (Nordic Semiconductor ASA)                                                               1.459311
zephyr.exe[1946606]: @ USER Open: main (privileged) version 2.22                                                {0x0001} 1.459349
zephyr.exe[1946606]: < HCI Command: Reset (0x03|0x0003) plen 0                                                        #1 1.459972
> HCI Event: Command Complete (0x0e) plen 4                                                                           #2 1.460671
      Reset (0x03|0x0003) ncmd 1
        Status: Success (0x00)
zephyr.exe[1946606]: < HCI Command: Read Local Supported Features (0x04|0x0003) plen 0                                #3 1.479198
> HCI Event: Command Complete (0x0e) plen 12                                                                          #4 1.480326
      Read Local Supported Features (0x04|0x0003) ncmd 1
        Status: Success (0x00)
        Features: 0x00 0x00 0x00 0x00 0x60 0x00 0x00 0x00
          BR/EDR Not Supported
          LE Supported (Controller)
zephyr.exe[1946606]: < HCI Command: Read Local Version Information (0x04|0x0001) plen 0                               #5 1.499171
> HCI Event: Command Complete (0x0e) plen 12                                                                          #6 1.499964
      Read Local Version Information (0x04|0x0001) ncmd 1
        Status: Success (0x00)
        HCI version: Reserved (0x0e) - Revision 12520 (0x30e8)
        LMP version: Reserved (0x0e) - Subversion 12520 (0x30e8)
        Manufacturer: Nordic Semiconductor ASA (89)
zephyr.exe[1946606]: < HCI Command: Read Local Supported Commands (0x04|0x0002) plen 0                                #7 1.519164
> HCI Event: Command Complete (0x0e) plen 68                                                                          #8 1.520429
      Read Local Supported Commands (0x04|0x0002) ncmd 1
        Status: Success (0x00)
        Commands: 119 entries
          Disconnect (Octet 0 - Bit 5)
          Read Remote Version Information (Octet 2 - Bit 7)
          Set Event Mask (Octet 5 - Bit 6)
          Reset (Octet 5 - Bit 7)
          Read Connection Accept Timeout (Octet 7 - Bit 2)
          Write Connection Accept Timeout (Octet 7 - Bit 3)
          Read Transmit Power Level (Octet 10 - Bit 2)
          Set Controller To Host Flow Control (Octet 10 - Bit 5)
          Host Buffer Size (Octet 10 - Bit 6)
          Host Number of Completed Packets (Octet 10 - Bit 7)
          Read Local Version Information (Octet 14 - Bit 3)
          Read Local Supported Features (Octet 14 - Bit 5)
          Read BD ADDR (Octet 15 - Bit 1)
          Read RSSI (Octet 15 - Bit 5)
          Set Event Mask Page 2 (Octet 22 - Bit 2)
          LE Set Event Mask (Octet 25 - Bit 0)
          LE Read Buffer Size (Octet 25 - Bit 1)
          LE Read Local Supported Features (Octet 25 - Bit 2)
          LE Set Random Address (Octet 25 - Bit 4)
          LE Set Advertising Parameters (Octet 25 - Bit 5)
          LE Read Advertising Channel TX Power (Octet 25 - Bit 6)
          LE Set Advertising Data (Octet 25 - Bit 7)
          LE Set Scan Response Data (Octet 26 - Bit 0)
          LE Set Advertise Enable (Octet 26 - Bit 1)
          LE Set Scan Parameters (Octet 26 - Bit 2)
          LE Set Scan Enable (Octet 26 - Bit 3)
          LE Create Connection (Octet 26 - Bit 4)
          LE Create Connection Cancel (Octet 26 - Bit 5)
          LE Read Accept List Size (Octet 26 - Bit 6)
          LE Clear Accept List (Octet 26 - Bit 7)
          LE Add Device To Accept List (Octet 27 - Bit 0)
          LE Remove Device From Accept List (Octet 27 - Bit 1)
          LE Connection Update (Octet 27 - Bit 2)
          LE Set Host Channel Classification (Octet 27 - Bit 3)
          LE Read Channel Map (Octet 27 - Bit 4)
          LE Read Remote Used Features (Octet 27 - Bit 5)
          LE Encrypt (Octet 27 - Bit 6)
          LE Rand (Octet 27 - Bit 7)
          LE Start Encryption (Octet 28 - Bit 0)
          LE Long Term Key Request Reply (Octet 28 - Bit 1)
          LE Long Term Key Request Neg Reply (Octet 28 - Bit 2)
          LE Read Supported States (Octet 28 - Bit 3)
          LE Receiver Test (Octet 28 - Bit 4)
          LE Transmitter Test (Octet 28 - Bit 5)
          LE Test End (Octet 28 - Bit 6)
          Read Authenticated Payload Timeout (Octet 32 - Bit 4)
          Write Authenticated Payload Timeout (Octet 32 - Bit 5)
          LE Set Data Length (Octet 33 - Bit 6)
          LE Read Suggested Default Data Length (Octet 33 - Bit 7)
          LE Write Suggested Default Data Length (Octet 34 - Bit 0)
          LE Add Device To Resolving List (Octet 34 - Bit 3)
          LE Remove Device From Resolving List (Octet 34 - Bit 4)
          LE Clear Resolving List (Octet 34 - Bit 5)
          LE Read Resolving List Size (Octet 34 - Bit 6)
          LE Set Address Resolution Enable (Octet 35 - Bit 1)
          LE Set Resolvable Private Address Timeout (Octet 35 - Bit 2)
          LE Read Maximum Data Length (Octet 35 - Bit 3)
          LE Read PHY (Octet 35 - Bit 4)
          LE Set Default PHY (Octet 35 - Bit 5)
          LE Set PHY (Octet 35 - Bit 6)
          LE Enhanced Receiver Test (Octet 35 - Bit 7)
          LE Enhanced Transmitter Test (Octet 36 - Bit 0)
          LE Set Advertising Set Random Address (Octet 36 - Bit 1)
          LE Set Extended Advertising Parameters (Octet 36 - Bit 2)
          LE Set Extended Advertising Data (Octet 36 - Bit 3)
          LE Set Extended Scan Response Data (Octet 36 - Bit 4)
          LE Set Extended Advertising Enable (Octet 36 - Bit 5)
          LE Read Maximum Advertising Data Length (Octet 36 - Bit 6)
          LE Read Number of Supported Advertising Sets (Octet 36 - Bit 7)
          LE Remove Advertising Set (Octet 37 - Bit 0)
          LE Clear Advertising Sets (Octet 37 - Bit 1)
          LE Set Periodic Advertising Parameters (Octet 37 - Bit 2)
          LE Set Periodic Advertising Data (Octet 37 - Bit 3)
          LE Set Periodic Advertising Enable (Octet 37 - Bit 4)
          LE Set Extended Scan Parameters (Octet 37 - Bit 5)
          LE Set Extended Scan Enable (Octet 37 - Bit 6)
          LE Extended Create Connection (Octet 37 - Bit 7)
          LE Periodic Advertising Create Sync (Octet 38 - Bit 0)
          LE Periodic Advertising Create Sync Cancel (Octet 38 - Bit 1)
          LE Periodic Advertising Terminate Sync (Octet 38 - Bit 2)
          LE Add Device To Periodic Advertiser List (Octet 38 - Bit 3)
          LE Remove Device From Periodic Advertiser List (Octet 38 - Bit 4)
          LE Clear Periodic Advertiser List (Octet 38 - Bit 5)
          LE Read Periodic Advertiser List Size (Octet 38 - Bit 6)
          LE Read Transmit Power (Octet 38 - Bit 7)
          LE Read RF Path Compensation (Octet 39 - Bit 0)
          LE Write RF Path Compensation (Octet 39 - Bit 1)
          LE Set Privacy Mode (Octet 39 - Bit 2)
          LE Periodic Advertising Receive Enable (Octet 40 - Bit 5)
          LE Periodic Advertising Sync Transfer (Octet 40 - Bit 6)
          LE Periodic Advertising Set Info Transfer (Octet 40 - Bit 7)
          LE Periodic Advertising Sync Transfer Parameters (Octet 41 - Bit 0)
          LE Set Default Periodic Advertisng Sync Transfer Parameters (Octet 41 - Bit 1)
          LE Read Buffer v2 (Octet 41 - Bit 5)
          LE Read ISO TX Sync (Octet 41 - Bit 6)
          LE Set Connected Isochronous Group Parameters (Octet 41 - Bit 7)
          LE Set Connected Isochronous Group Parameters Test (Octet 42 - Bit 0)
          LE Create Connected Isochronous Stream (Octet 42 - Bit 1)
          LE Remove Connected Isochronous Group (Octet 42 - Bit 2)
          LE Accept Connected Isochronous Stream Request (Octet 42 - Bit 3)
          LE Reject Connected Isochronous Stream Request (Octet 42 - Bit 4)
          LE Create Broadcast Isochronous Group (Octet 42 - Bit 5)
          LE Create Broadcast Isochronous Group Test (Octet 42 - Bit 6)
          LE Terminate Broadcast Isochronous Group (Octet 42 - Bit 7)
          LE Broadcast Isochronous Group Create Sync (Octet 43 - Bit 0)
          LE Broadcast Isochronous Group Terminate Sync (Octet 43 - Bit 1)
          LE Request Peer SCA (Octet 43 - Bit 2)
          LE Setup Isochronous Data Path (Octet 43 - Bit 3)
          LE Remove Isochronous Data Path (Octet 43 - Bit 4)
          LE Isochronous Transmit Test (Octet 43 - Bit 5)
          LE Isochronous Receive Test (Octet 43 - Bit 6)
          LE Isochronous Read Test Counters (Octet 43 - Bit 7)
          LE Isochronous Read Test Counters (Octet 44 - Bit 0)
          LE Set Host Feature (Octet 44 - Bit 1)
          LE Read ISO link quality (Octet 44 - Bit 2)
          Octet 45 - Bit 6 
          Octet 46 - Bit 0 
          Octet 46 - Bit 1 
          Octet 46 - Bit 2 
zephyr.exe[1946606]: < HCI Command: Host Buffer Size (0x03|0x0033) plen 7                                             #9 1.539155
        ACL MTU: 255  ACL max packet: 16
        SCO MTU: 0    SCO max packet: 0
> HCI Event: Command Complete (0x0e) plen 4                                                                          #10 1.539815
      Host Buffer Size (0x03|0x0033) ncmd 1
        Status: Success (0x00)
zephyr.exe[1946606]: < HCI Command: Set Controller To Host Flow Control (0x03|0x0031) plen 1                         #11 1.559164
        Flow control: ACL Data Packets (0x01)
> HCI Event: Command Complete (0x0e) plen 4                                                                          #12 1.560084
      Set Controller To Host Flow Control (0x03|0x0031) ncmd 1
        Status: Success (0x00)
zephyr.exe[1946606]: < HCI Command: LE Read Local Supported Features (0x08|0x0003) plen 0                            #13 1.579158
> HCI Event: Command Complete (0x0e) plen 12                                                                         #14 1.580354
      LE Read Local Supported Features (0x08|0x0003) ncmd 1
        Status: Success (0x00)
        Features: 0xfd 0x79 0x00 0xf7 0x30 0x01 0x00 0x00
          LE Encryption
          Extended Reject Indication
          Peripheral-initiated Features Exchange
          LE Ping
          LE Data Packet Length Extension
          LL Privacy
          Extended Scanner Filter Policies
          LE 2M PHY
          LE Coded PHY
          LE Extended Advertising
          LE Periodic Advertising
          Channel Selection Algorithm #2
          Periodic Advertising Sync Transfer - Sender
          Periodic Advertising Sync Transfer - Recipient
          Sleep Clock Accuracy Updates
          Connected Isochronous Stream - Central
          Connected Isochronous Stream - Peripheral
          Isochronous Broadcaster
          Synchronized Receiver
          Periodic Advertising ADI support
          Connection Subrating
          Unknown features (0x0000010000000000)
zephyr.exe[1946606]: < HCI Command: LE Set Host Feature (0x08|0x0074) plen 2                                         #15 1.599162
        Bit Number: 32
          Connected Isochronous Stream (Host Support)
        Bit Value: 1
> HCI Event: Command Complete (0x0e) plen 4                                                                          #16 1.599678
      LE Set Host Feature (0x08|0x0074) ncmd 1
        Status: Success (0x00)
zephyr.exe[1946606]: < HCI Command: LE Read Buffer v2 (0x08|0x0060) plen 0                                           #17 1.619165
> HCI Event: Command Complete (0x0e) plen 10                                                                         #18 1.619805
      LE Read Buffer v2 (0x08|0x0060) ncmd 1
        Status: Success (0x00)
        ACL MTU: 27
        ACL max packet: 3
        ISO MTU: 318
        ISO max packet: 3
zephyr.exe[1946606]: < HCI Command: LE Read Maximum Advertising Data Length (0x08|0x003a) plen 0                     #19 1.639106
> HCI Event: Command Complete (0x0e) plen 6                                                                          #20 1.639666
      LE Read Maximum Advertising Data Length (0x08|0x003a) ncmd 1
        Status: Success (0x00)
        Max length: 1650
zephyr.exe[1946606]: < HCI Command: LE Read Supported States (0x08|0x001c) plen 0                                    #21 1.659121
> HCI Event: Command Complete (0x0e) plen 12                                                                         #22 1.659833
      LE Read Supported States (0x08|0x001c) ncmd 1
        Status: Success (0x00)
        States: 0x000003ff3e0306ff
          Non-connectable Advertising State
          Scannable Advertising State
          Connectable Advertising State
          High Duty Cycle Directed Advertising State
          Passive Scanning State
          Active Scanning State
          Initiating State
            and Connection State (Central Role)
          Connection State (Peripheral Role)
          Scannable Advertising State
            and Passive Scanning State
          Connectable Advertising State
            and Passive Scanning State
          Non-connectable Advertising State
            and Initiating State
          Scannable Advertising State
            and Initiating State
          Active Scanning State
            and Connection State (Central Role)
          Passive Scanning State
            and Connection State (Peripheral Role)
          Active Scanning State
            and Connection State (Peripheral Role)
          Initiating State
            and Connection State (Central Role)
            and Central Role & Central Role
          Low Duty Cycle Directed Advertising State
          Connectable Advertising State
            and Initiating State
            and Central Role & Peripheral Role
          High Duty Cycle Directed Advertising State
            and Initiating State
            and Central Role & Peripheral Role
          Low Duty Cycle Directed Advertising State
            and Initiating State
            and Central Role & Peripheral Role
          Connectable Advertising State
            and Connection State (Central Role)
            and Central Role & Peripheral Role
          High Duty Cycle Directed Advertising State
            and Connection State (Central Role)
            and Central Role & Peripheral Role
          Low Duty Cycle Directed Advertising State
            and Connection State (Central Role)
            and Central Role & Peripheral Role
          Connectable Advertising State
            and Connection State (Peripheral Role)
            and Central Role & Peripheral Role
          High Duty Cycle Directed Advertising State
            and Connection State (Peripheral Role)
            and Peripheral Role & Peripheral Role
          Low Duty Cycle Directed Advertising State
            and Connection State (Peripheral Role)
            and Peripheral Role & Peripheral Role
          Initiating State
            and Connection State (Peripheral Role)
            and Central Role & Peripheral Role
zephyr.exe[1946606]: < HCI Command: LE Read Maximum Data Length (0x08|0x002f) plen 0                                 #23 1.679094
> HCI Event: Command Complete (0x0e) plen 12                                                                         #24 1.679667
      LE Read Maximum Data Length (0x08|0x002f) ncmd 1
        Status: Success (0x00)
        Max TX octets: 251
        Max TX time: 2704
        Max RX octets: 251
        Max RX time: 2704
zephyr.exe[1946606]: < HCI Command: LE Write Suggested Default Data Length (0x08|0x0024) plen 4                      #25 1.699153
        TX octets: 251
        TX time: 2704
> HCI Event: Command Complete (0x0e) plen 4                                                                          #26 1.699709
      LE Write Suggested Default Data Length (0x08|0x0024) ncmd 1
        Status: Success (0x00)
zephyr.exe[1946606]: < HCI Command: LE Read Resolving List Size (0x08|0x002a) plen 0                                 #27 1.719159
> HCI Event: Command Complete (0x0e) plen 5                                                                          #28 1.719680
      LE Read Resolving List Size (0x08|0x002a) ncmd 1
        Status: Success (0x00)
        Size: 8
zephyr.exe[1946606]: < HCI Command: LE Set Event Mask (0x08|0x0001) plen 8                                           #29 1.739122
        Mask: 0x000002023f87fa5e
          LE Advertising Report
          LE Connection Update Complete
          LE Read Remote Used Features Complete
          LE Long Term Key Request
          LE Data Length Change
          LE Enhanced Connection Complete
          LE PHY Update Complete
          LE Extended Advertising Report
          LE Periodic Advertising Sync Established
          LE Periodic Advertising Report
          LE Periodic Advertising Sync Lost
          LE Extended Scan Timeout
          LE Extended Advertising Set Terminated
          LE Scan Request Received
          LE Periodic Advertising Sync Transfer Rvc
          LE CIS Established
          LE CIS Request
          LE Create BIG Complete
          LE Terminate BIG Complete
          LE BIG Sync Established Complete
          LE BIG Sync Lost
          LE BIG Info Advertising Report
          Unknown mask (0x0000020000000000)
> HCI Event: Command Complete (0x0e) plen 4                                                                          #30 1.739763
      LE Set Event Mask (0x08|0x0001) ncmd 1
        Status: Success (0x00)
zephyr.exe[1946606]: < HCI Command: Set Event Mask (0x03|0x0001) plen 8                                              #31 1.759128
        Mask: 0x2000800002008890
          Disconnection Complete
          Encryption Change
          Read Remote Version Information Complete
          Hardware Error
          Data Buffer Overflow
          Encryption Key Refresh Complete
          LE Meta
> HCI Event: Command Complete (0x0e) plen 4                                                                          #32 1.759885
      Set Event Mask (0x03|0x0001) ncmd 1
        Status: Success (0x00)
zephyr.exe[1946606]: < HCI Command: Read BD ADDR (0x04|0x0009) plen 0                                                #33 1.779120
> HCI Event: Command Complete (0x0e) plen 10                                                                         #34 1.779834
      Read BD ADDR (0x04|0x0009) ncmd 1
        Status: Success (0x00)
        Address: 00:00:00:00:00:00 (OUI 00-00-00)
zephyr.exe[1946606]: < HCI Command: LE Set Random Address (0x08|0x0005) plen 6                                       #35 1.799125
        Address: D5:B6:CC:31:DB:3B (Static)
> HCI Event: Command Complete (0x0e) plen 4                                                                          #36 1.799798
      LE Set Random Address (0x08|0x0005) ncmd 1
        Status: Success (0x00)
zephyr.exe[1946606]: < HCI Command: LE Set Extended Advertising Parameters (0x08|0x0036) plen 25                     #37 4.019286
        Handle: 0x00
        Properties: 0x0013
          Connectable
          Scannable
          Use legacy advertising PDUs: ADV_IND
        Min advertising interval: 100.000 msec (0x00a0)
        Max advertising interval: 150.000 msec (0x00f0)
        Channel map: 37, 38, 39 (0x07)
        Own address type: Random (0x01)
        Peer address type: Public (0x00)
        Peer address: 00:00:00:00:00:00 (OUI 00-00-00)
        Filter policy: Allow Scan Request from Any, Allow Connect Request from Any (0x00)
        TX power: Host has no preference (0x7f)
        Primary PHY: LE 1M (0x01)
        Secondary max skip: 0x00
        Secondary PHY: LE 1M (0x01)
        SID: 0x00
        Scan request notifications: Disabled (0x00)
> HCI Event: Command Complete (0x0e) plen 5                                                                          #38 4.020814
      LE Set Extended Advertising Parameters (0x08|0x0036) ncmd 1
        Status: Success (0x00)
        TX power (selected): 0 dbm (0x00)
zephyr.exe[1946606]: < HCI Command: LE Set Advertising Set Random Address (0x08|0x0035) plen 7                       #39 4.039188
        Advertising handle: 0x00
        Advertising random address: D5:B6:CC:31:DB:3B (Static)
> HCI Event: Command Complete (0x0e) plen 4                                                                          #40 4.040352
      LE Set Advertising Set Random Address (0x08|0x0035) ncmd 1
        Status: Success (0x00)
zephyr.exe[1946606]: < HCI Command: LE Set Extended Advertising Data (0x08|0x0037) plen 22                           #41 4.059217
        Handle: 0x00
        Operation: Complete extended advertising data (0x03)
        Fragment preference: Minimize fragmentation (0x01)
        Data length: 0x12
        Flags: 0x06
          LE General Discoverable Mode
          BR/EDR Not Supported
        Name (complete): Tester_2CB6EE
> HCI Event: Command Complete (0x0e) plen 4                                                                          #42 4.060186
      LE Set Extended Advertising Data (0x08|0x0037) ncmd 1
        Status: Success (0x00)
zephyr.exe[1946606]: < HCI Command: LE Set Extended Scan Response Data (0x08|0x0038) plen 4                          #43 4.079167
        Handle: 0x00
        Operation: Complete scan response data (0x03)
        Fragment preference: Minimize fragmentation (0x01)
        Data length: 0x00
> HCI Event: Command Complete (0x0e) plen 4                                                                          #44 4.080354
      LE Set Extended Scan Response Data (0x08|0x0038) ncmd 1
        Status: Success (0x00)
zephyr.exe[1946606]: < HCI Command: LE Set Extended Advertising Enable (0x08|0x0039) plen 6                          #45 4.099220
        Extended advertising: Enabled (0x01)
        Number of sets: 1 (0x01)
        Entry 0
          Handle: 0x00
          Duration: 0 ms (0x00)
          Max ext adv events: 0
> HCI Event: Command Complete (0x0e) plen 4                                                                          #46 4.100714
      LE Set Extended Advertising Enable (0x08|0x0039) ncmd 1
        Status: Success (0x00)
> HCI Event: LE Meta Event (0x3e) plen 31                                                                            #47 4.534859
      LE Enhanced Connection Complete (0x0a)
        Status: Success (0x00)
        Handle: 237
        Role: Peripheral (0x01)
        Peer address type: Public (0x00)
        Peer address: C0:07:E8:2C:B6:EE (OUI C0-07-E8)
        Local resolvable private address: 00:00:00:00:00:00 (Non-Resolvable)
        Peer resolvable private address: 00:00:00:00:00:00 (Non-Resolvable)
        Connection interval: 62.50 msec (0x0032)
        Connection latency: 0 (0x0000)
        Supervision timeout: 20000 msec (0x07d0)
        Central clock accuracy: 0x07
> HCI Event: LE Meta Event (0x3e) plen 6                                                                             #48 4.535249
      LE Advertising Set Terminated (0x12)
        Status: Success (0x00)
        Handle: 0
        Connection handle: 237
        Number of completed extended advertising events: 0
zephyr.exe[1946606]: < HCI Command: LE Read Remote Used Features (0x08|0x0016) plen 2                                #49 4.539169
        Handle: 237 Address: C0:07:E8:2C:B6:EE (OUI C0-07-E8)
> HCI Event: Command Status (0x0f) plen 4                                                                            #50 4.539889
      LE Read Remote Used Features (0x08|0x0016) ncmd 1
        Status: Success (0x00)
zephyr.exe[1946606]: < HCI Command: LE Set PHY (0x08|0x0032) plen 7                                                  #51 4.559181
        Handle: 237 Address: C0:07:E8:2C:B6:EE (OUI C0-07-E8)
        All PHYs preference: 0x00
        TX PHYs preference: 0x02
          LE 2M
        RX PHYs preference: 0x02
          LE 2M
        PHY options preference: Reserved (0x0000)
> HCI Event: Command Status (0x0f) plen 4                                                                            #52 4.559913
      LE Set PHY (0x08|0x0032) ncmd 1
        Status: Success (0x00)
> HCI Event: LE Meta Event (0x3e) plen 12                                                                            #53 4.723732
      LE Read Remote Used Features (0x04)
        Status: Success (0x00)
        Handle: 237 Address: C0:07:E8:2C:B6:EE (OUI C0-07-E8)
        Features: 0x2d 0x49 0x01 0xf7 0xef 0x39 0x00 0x80
          LE Encryption
          Extended Reject Indication
          Peripheral-initiated Features Exchange
          LE Data Packet Length Extension
          LE 2M PHY
          LE Coded PHY
          Channel Selection Algorithm #2
          Minimum Number of Used Channels Procedure
          Periodic Advertising Sync Transfer - Sender
          Periodic Advertising Sync Transfer - Recipient
          Sleep Clock Accuracy Updates
          Connected Isochronous Stream - Central
          Connected Isochronous Stream - Peripheral
          Isochronous Broadcaster
          Synchronized Receiver
          Connected Isochronous Stream (Host Support)
          LE Power Control Request
          LE Power Control Request
          LE Path Loss Monitoring
          Connection Subrating
          Connection Subrating (Host Support)
          Channel Classification
          Unknown features (0x8000390000000000)
> ACL Data RX: Handle 237 flags 0x02 dlen 11                                                                         #54 5.035992
      SMP: Pairing Request (0x01) len 6
        IO capability: KeyboardOnly (0x02)
        OOB data: Authentication data not present (0x00)
        Authentication requirement: No bonding, MITM, SC, No Keypresses (0xcc)
        Max encryption key size: 16
        Initiator key distribution: <none> (0x00)
        Responder key distribution: <none> (0x00)
zephyr.exe[1946606]: < HCI Command: Host Number of Completed Packets (0x03|0x0035) plen 5                            #55 5.039343
        Num handles: 1
        Handle: 237 Address: C0:07:E8:2C:B6:EE (OUI C0-07-E8)
        Count: 1
zephyr.exe[1946606]: < ACL Data TX: Handle 237 [1/3] flags 0x00 dlen 11                                              #56 5.039547
      SMP: Pairing Response (0x02) len 6
        IO capability: DisplayOnly (0x00)
        OOB data: Authentication data not present (0x00)
        Authentication requirement: Bonding, No MITM, SC, No Keypresses (0x09)
        Max encryption key size: 16
        Initiator key distribution: <none> (0x00)
        Responder key distribution: <none> (0x00)
> HCI Event: Number of Completed Packets (0x13) plen 5                                                               #57 5.161136
        Num handles: 1
        Handle: 237 Address: C0:07:E8:2C:B6:EE (OUI C0-07-E8)
        Count: 1
        Buffers: 0/3
        #56: len 11 (0 Kb/s)
        Latency: 121 msec (121-121 msec ~121 msec)
> ACL Data RX: Handle 237 flags 0x02 dlen 27                                                                         #58 5.161498
> ACL Data RX: Handle 237 flags 0x01 dlen 27                                                                         #59 5.161976
> ACL Data RX: Handle 237 flags 0x01 dlen 15                                                                         #60 5.162428
      SMP: Pairing Public Key (0x0c) len 64
        X[32]: 341ee1bd3b1f3a8e7e890fb8ba6c79311e0857650b6cbcc8a91c73fbda98b648
        Y[32]: 013c1b4e022962afa0aaf0fcbefea51b673ec2e6d7ef809b4fe25e1413efe459
zephyr.exe[1946606]: < HCI Command: Host Number of Completed Packets (0x03|0x0035) plen 5                            #61 5.179417
        Num handles: 1
        Handle: 237 Address: C0:07:E8:2C:B6:EE (OUI C0-07-E8)
        Count: 1
zephyr.exe[1946606]: < HCI Command: Host Number of Completed Packets (0x03|0x0035) plen 5                            #62 5.179783
        Num handles: 1
        Handle: 237 Address: C0:07:E8:2C:B6:EE (OUI C0-07-E8)
        Count: 1
zephyr.exe[1946606]: < HCI Command: Host Number of Completed Packets (0x03|0x0035) plen 5                            #63 5.179868
        Num handles: 1
        Handle: 237 Address: C0:07:E8:2C:B6:EE (OUI C0-07-E8)
        Count: 1
zephyr.exe[1946606]: < ACL Data TX: Handle 237 [1/3] flags 0x00 dlen 27                                              #64 5.179892
zephyr.exe[1946606]: < ACL Data TX: Handle 237 flags 0x01 dlen 27                                                    #65 5.179912
zephyr.exe[1946606]: < ACL Data TX: Handle 237 flags 0x01 dlen 15                                                    #66 5.179926
      SMP: Pairing Public Key (0x0c) len 64
        X[32]: 98308440221e2d910f0e54b71e7ec652857aa9b5a0dc65028824cc19db1226e9
        Y[32]: 67a4816bcb62efb21701e31fdb27561a6217575fb007a8bbdabe7e28b6f68482
> HCI Event: LE Meta Event (0x3e) plen 6                                                                             #67 5.223047
      LE PHY Update Complete (0x0c)
        Status: Success (0x00)
        Handle: 237 Address: C0:07:E8:2C:B6:EE (OUI C0-07-E8)
        TX PHY: LE 2M (0x02)
        RX PHY: LE 2M (0x02)
> HCI Event: Number of Completed Packets (0x13) plen 5                                                               #68 5.223739
        Num handles: 1
        Handle: 237 Address: C0:07:E8:2C:B6:EE (OUI C0-07-E8)
        Count: 1
        Buffers: 0/3
        #64: len 27 (5 Kb/s)
        Latency: 43 msec (43-121 msec ~82 msec)
> HCI Event: Number of Completed Packets (0x13) plen 5                                                               #69 5.224227
        Num handles: 1
        Handle: 237 Address: C0:07:E8:2C:B6:EE (OUI C0-07-E8)
        Count: 1
        Buffers: underflow/3
        #65: len 27 (4 Kb/s)
        Latency: 44 msec (43-121 msec ~63 msec)
> HCI Event: Number of Completed Packets (0x13) plen 5                                                               #70 5.285817
        Num handles: 1
        Handle: 237 Address: C0:07:E8:2C:B6:EE (OUI C0-07-E8)
        Count: 1
        Buffers: underflow/3
        #66: len 15 (1 Kb/s)
        Latency: 105 msec (43-121 msec ~84 msec)
> ACL Data RX: Handle 237 flags 0x02 dlen 21                                                                         #71 6.223614
      SMP: Pairing Confirm (0x03) len 16
        Confirm value[16]: 2e9131913971c268773ddf4756aef35f
zephyr.exe[1946606]: < HCI Command: Host Number of Completed Packets (0x03|0x0035) plen 5                            #72 6.239330
        Num handles: 1
        Handle: 237 Address: C0:07:E8:2C:B6:EE (OUI C0-07-E8)
        Count: 1
zephyr.exe[1946606]: < ACL Data TX: Handle 237 [1/3] flags 0x00 dlen 21                                              #73 6.239529
      SMP: Pairing Confirm (0x03) len 16
        Confirm value[16]: 340c80973ca7713177424453026d6b90
> HCI Event: Number of Completed Packets (0x13) plen 5                                                               #74 6.348412
        Num handles: 1
        Handle: 237 Address: C0:07:E8:2C:B6:EE (OUI C0-07-E8)
        Count: 1
        Buffers: 0/3
        #73: len 21 (1 Kb/s)
        Latency: 108 msec (43-121 msec ~96 msec)
> ACL Data RX: Handle 237 flags 0x02 dlen 21                                                                         #75 6.348747
      SMP: Pairing Random (0x04) len 16
        Random value[16]: 198859d10f68bd52c3f77cf51ef74e61
zephyr.exe[1946606]: < HCI Command: Host Number of Completed Packets (0x03|0x0035) plen 5                            #76 6.359381
        Num handles: 1
        Handle: 237 Address: C0:07:E8:2C:B6:EE (OUI C0-07-E8)
        Count: 1
zephyr.exe[1946606]: < ACL Data TX: Handle 237 [1/3] flags 0x00 dlen 21                                              #77 6.359662
      SMP: Pairing Random (0x04) len 16
        Random value[16]: 8e6108f966a694cbe26df70bb96773e6
> HCI Event: Number of Completed Packets (0x13) plen 5                                                               #78 6.473368
        Num handles: 1
        Handle: 237 Address: C0:07:E8:2C:B6:EE (OUI C0-07-E8)
        Count: 1
        Buffers: 0/3
        #77: len 21 (1 Kb/s)
        Latency: 113 msec (43-121 msec ~105 msec)
> ACL Data RX: Handle 237 flags 0x02 dlen 21                                                                         #79 6.473771
      SMP: Pairing Confirm (0x03) len 16
        Confirm value[16]: 88628a06c8d572da26c5bdc4b5ee09ed
zephyr.exe[1946606]: < HCI Command: Host Number of Completed Packets (0x03|0x0035) plen 5                            #80 6.479352
        Num handles: 1
        Handle: 237 Address: C0:07:E8:2C:B6:EE (OUI C0-07-E8)
        Count: 1
zephyr.exe[1946606]: < ACL Data TX: Handle 237 [1/3] flags 0x00 dlen 21                                              #81 6.479492
      SMP: Pairing Confirm (0x03) len 16
        Confirm value[16]: c40266afc61cd86860420cebc917e768
> HCI Event: Number of Completed Packets (0x13) plen 5                                                               #82 6.598378
        Num handles: 1
        Handle: 237 Address: C0:07:E8:2C:B6:EE (OUI C0-07-E8)
        Count: 1
        Buffers: 0/3
        #81: len 21 (1 Kb/s)
        Latency: 118 msec (43-121 msec ~112 msec)
> ACL Data RX: Handle 237 flags 0x02 dlen 21                                                                         #83 6.598714
      SMP: Pairing Random (0x04) len 16
        Random value[16]: f62748e790ba3f80ebbb66b4daf3caba
zephyr.exe[1946606]: < HCI Command: Host Number of Completed Packets (0x03|0x0035) plen 5                            #84 6.599292
        Num handles: 1
        Handle: 237 Address: C0:07:E8:2C:B6:EE (OUI C0-07-E8)
        Count: 1
zephyr.exe[1946606]: < ACL Data TX: Handle 237 [1/3] flags 0x00 dlen 21                                              #85 6.599397
      SMP: Pairing Random (0x04) len 16
        Random value[16]: 4d02679f89a05211af56d8b3da64d21e
> HCI Event: Number of Completed Packets (0x13) plen 5                                                               #86 6.723475
        Num handles: 1
        Handle: 237 Address: C0:07:E8:2C:B6:EE (OUI C0-07-E8)
        Count: 1
        Buffers: 0/3
        #85: len 21 (1 Kb/s)
        Latency: 124 msec (43-124 msec ~118 msec)
> ACL Data RX: Handle 237 flags 0x02 dlen 21                                                                         #87 6.723795
      SMP: Pairing Confirm (0x03) len 16
        Confirm value[16]: 7ae3a8c3fe02066aa3014a5385aa662a
zephyr.exe[1946606]: < HCI Command: Host Number of Completed Packets (0x03|0x0035) plen 5                            #88 6.739373
        Num handles: 1
        Handle: 237 Address: C0:07:E8:2C:B6:EE (OUI C0-07-E8)
        Count: 1
zephyr.exe[1946606]: < ACL Data TX: Handle 237 [1/3] flags 0x00 dlen 21                                              #89 6.739552
      SMP: Pairing Confirm (0x03) len 16
        Confirm value[16]: 4491d467d525d6a3a6fdea1004117c17
> HCI Event: Number of Completed Packets (0x13) plen 5                                                               #90 6.848432
        Num handles: 1
        Handle: 237 Address: C0:07:E8:2C:B6:EE (OUI C0-07-E8)
        Count: 1
        Buffers: 0/3
        #89: len 21 (1 Kb/s)
        Latency: 108 msec (43-124 msec ~113 msec)
> ACL Data RX: Handle 237 flags 0x02 dlen 21                                                                         #91 6.848738
      SMP: Pairing Random (0x04) len 16
        Random value[16]: aa5af618cea8283ca927b458b968b9f1
zephyr.exe[1946606]: < HCI Command: Host Number of Completed Packets (0x03|0x0035) plen 5                            #92 6.859335
        Num handles: 1
        Handle: 237 Address: C0:07:E8:2C:B6:EE (OUI C0-07-E8)
        Count: 1
zephyr.exe[1946606]: < ACL Data TX: Handle 237 [1/3] flags 0x00 dlen 21                                              #93 6.859485
      SMP: Pairing Random (0x04) len 16
        Random value[16]: 5e8286bc235a02440d0c3424a2acf8fd
> HCI Event: Number of Completed Packets (0x13) plen 5                                                               #94 6.973376
        Num handles: 1
        Handle: 237 Address: C0:07:E8:2C:B6:EE (OUI C0-07-E8)
        Count: 1
        Buffers: 0/3
        #93: len 21 (1 Kb/s)
        Latency: 113 msec (43-124 msec ~113 msec)
> ACL Data RX: Handle 237 flags 0x02 dlen 21                                                                         #95 6.973750
      SMP: Pairing Confirm (0x03) len 16
        Confirm value[16]: e6e7ca3c7f0aaf55447fc5ac61ac9716
zephyr.exe[1946606]: < HCI Command: Host Number of Completed Packets (0x03|0x0035) plen 5                            #96 6.979363
        Num handles: 1
        Handle: 237 Address: C0:07:E8:2C:B6:EE (OUI C0-07-E8)
        Count: 1
zephyr.exe[1946606]: < ACL Data TX: Handle 237 [1/3] flags 0x00 dlen 21                                              #97 6.979508
      SMP: Pairing Confirm (0x03) len 16
        Confirm value[16]: 02547b47d7665509a914c11f2459b6db
> HCI Event: Number of Completed Packets (0x13) plen 5                                                               #98 7.098411
        Num handles: 1
        Handle: 237 Address: C0:07:E8:2C:B6:EE (OUI C0-07-E8)
        Count: 1
        Buffers: 0/3
        #97: len 21 (1 Kb/s)
        Latency: 118 msec (43-124 msec ~116 msec)
> ACL Data RX: Handle 237 flags 0x02 dlen 21                                                                         #99 7.098708
      SMP: Pairing Random (0x04) len 16
        Random value[16]: 25250b8269a750934f216cdebdac52f5
zephyr.exe[1946606]: < HCI Command: Host Number of Completed Packets (0x03|0x0035) plen 5                           #100 7.099384
        Num handles: 1
        Handle: 237 Address: C0:07:E8:2C:B6:EE (OUI C0-07-E8)
        Count: 1
zephyr.exe[1946606]: < ACL Data TX: Handle 237 [1/3] flags 0x00 dlen 21                                             #101 7.099798
      SMP: Pairing Random (0x04) len 16
        Random value[16]: 5c4a1bcadd27bd58e945097b00bad7ac
> HCI Event: Number of Completed Packets (0x13) plen 5                                                              #102 7.223461
        Num handles: 1
        Handle: 237 Address: C0:07:E8:2C:B6:EE (OUI C0-07-E8)
        Count: 1
        Buffers: 0/3
        #101: len 21 (1 Kb/s)
        Latency: 123 msec (43-124 msec ~119 msec)
> ACL Data RX: Handle 237 flags 0x02 dlen 21                                                                        #103 7.223710
      SMP: Pairing Confirm (0x03) len 16
        Confirm value[16]: f3fdadda596f056bddc77c091918b876
zephyr.exe[1946606]: < HCI Command: Host Number of Completed Packets (0x03|0x0035) plen 5                           #104 7.239351
        Num handles: 1
        Handle: 237 Address: C0:07:E8:2C:B6:EE (OUI C0-07-E8)
        Count: 1
zephyr.exe[1946606]: < ACL Data TX: Handle 237 [1/3] flags 0x00 dlen 21                                             #105 7.239531
      SMP: Pairing Confirm (0x03) len 16
        Confirm value[16]: 5cb46726bb0e83807e3e2a80ce16a28b
> HCI Event: Number of Completed Packets (0x13) plen 5                                                              #106 7.348464
        Num handles: 1
        Handle: 237 Address: C0:07:E8:2C:B6:EE (OUI C0-07-E8)
        Count: 1
        Buffers: 0/3
        #105: len 21 (1 Kb/s)
        Latency: 108 msec (43-124 msec ~114 msec)
> ACL Data RX: Handle 237 flags 0x02 dlen 21                                                                        #107 7.348744
      SMP: Pairing Random (0x04) len 16
        Random value[16]: 98cc7280436cd2d26cceda82275310f2
zephyr.exe[1946606]: < HCI Command: Host Number of Completed Packets (0x03|0x0035) plen 5                           #108 7.359367
        Num handles: 1
        Handle: 237 Address: C0:07:E8:2C:B6:EE (OUI C0-07-E8)
        Count: 1
zephyr.exe[1946606]: < ACL Data TX: Handle 237 [1/3] flags 0x00 dlen 21                                             #109 7.359523
      SMP: Pairing Random (0x04) len 16
        Random value[16]: 32527e6e64e79f33b2e374394db8ab2d
> HCI Event: Number of Completed Packets (0x13) plen 5                                                              #110 7.473450
        Num handles: 1
        Handle: 237 Address: C0:07:E8:2C:B6:EE (OUI C0-07-E8)
        Count: 1
        Buffers: 0/3
        #109: len 21 (1 Kb/s)
        Latency: 113 msec (43-124 msec ~114 msec)
> ACL Data RX: Handle 237 flags 0x02 dlen 21                                                                        #111 7.473768
      SMP: Pairing Confirm (0x03) len 16
        Confirm value[16]: 2862eeaac79c0b1491c86e92fb678682
zephyr.exe[1946606]: < HCI Command: Host Number of Completed Packets (0x03|0x0035) plen 5                           #112 7.479357
        Num handles: 1
        Handle: 237 Address: C0:07:E8:2C:B6:EE (OUI C0-07-E8)
        Count: 1
zephyr.exe[1946606]: < ACL Data TX: Handle 237 [1/3] flags 0x00 dlen 21                                             #113 7.479484
      SMP: Pairing Confirm (0x03) len 16
        Confirm value[16]: 36513dadd4b59618abce639f7d1664fe
> HCI Event: Number of Completed Packets (0x13) plen 5                                                              #114 7.598443
        Num handles: 1
        Handle: 237 Address: C0:07:E8:2C:B6:EE (OUI C0-07-E8)
        Count: 1
        Buffers: 0/3
        #113: len 21 (1 Kb/s)
        Latency: 118 msec (43-124 msec ~116 msec)
> ACL Data RX: Handle 237 flags 0x02 dlen 21                                                                        #115 7.598756
      SMP: Pairing Random (0x04) len 16
        Random value[16]: 75d753b07beb0585d29284c17832ab56
zephyr.exe[1946606]: < HCI Command: Host Number of Completed Packets (0x03|0x0035) plen 5                           #116 7.599526
        Num handles: 1
        Handle: 237 Address: C0:07:E8:2C:B6:EE (OUI C0-07-E8)
        Count: 1
zephyr.exe[1946606]: < ACL Data TX: Handle 237 [1/3] flags 0x00 dlen 21                                             #117 7.599653
      SMP: Pairing Random (0x04) len 16
        Random value[16]: dddbdfe2838e9a8cc6964353c850fef7
> HCI Event: Number of Completed Packets (0x13) plen 5                                                              #118 7.723400
        Num handles: 1
        Handle: 237 Address: C0:07:E8:2C:B6:EE (OUI C0-07-E8)
        Count: 1
        Buffers: 0/3
        #117: len 21 (1 Kb/s)
        Latency: 123 msec (43-124 msec ~120 msec)
> ACL Data RX: Handle 237 flags 0x02 dlen 21                                                                        #119 7.723826
      SMP: Pairing Confirm (0x03) len 16
        Confirm value[16]: a85c518e1d56b1e1ed2e100fe4f6d514
zephyr.exe[1946606]: < HCI Command: Host Number of Completed Packets (0x03|0x0035) plen 5                           #120 7.739334
        Num handles: 1
        Handle: 237 Address: C0:07:E8:2C:B6:EE (OUI C0-07-E8)
        Count: 1
zephyr.exe[1946606]: < ACL Data TX: Handle 237 [1/3] flags 0x00 dlen 21                                             #121 7.739477
      SMP: Pairing Confirm (0x03) len 16
        Confirm value[16]: 39297b5dbc6c1a3b3ba5a8f81ca1126d
> HCI Event: Number of Completed Packets (0x13) plen 5                                                              #122 7.848422
        Num handles: 1
        Handle: 237 Address: C0:07:E8:2C:B6:EE (OUI C0-07-E8)
        Count: 1
        Buffers: 0/3
        #121: len 21 (1 Kb/s)
        Latency: 108 msec (43-124 msec ~114 msec)
> ACL Data RX: Handle 237 flags 0x02 dlen 21                                                                        #123 7.848718
      SMP: Pairing Random (0x04) len 16
        Random value[16]: 6d0817ef745b827b92133559715f1ccc
zephyr.exe[1946606]: < HCI Command: Host Number of Completed Packets (0x03|0x0035) plen 5                           #124 7.859323
        Num handles: 1
        Handle: 237 Address: C0:07:E8:2C:B6:EE (OUI C0-07-E8)
        Count: 1
zephyr.exe[1946606]: < ACL Data TX: Handle 237 [1/3] flags 0x00 dlen 21                                             #125 7.859501
      SMP: Pairing Random (0x04) len 16
        Random value[16]: eb9f1915536596b6fc3db1c86b2b1970
> HCI Event: Number of Completed Packets (0x13) plen 5                                                              #126 7.973436
        Num handles: 1
        Handle: 237 Address: C0:07:E8:2C:B6:EE (OUI C0-07-E8)
        Count: 1
        Buffers: 0/3
        #125: len 21 (1 Kb/s)
        Latency: 113 msec (43-124 msec ~114 msec)
> ACL Data RX: Handle 237 flags 0x02 dlen 21                                                                        #127 7.973806
      SMP: Pairing Confirm (0x03) len 16
        Confirm value[16]: 735a550f5e5f6e0b9d7a91c35b60451f
zephyr.exe[1946606]: < HCI Command: Host Number of Completed Packets (0x03|0x0035) plen 5                           #128 7.979326
        Num handles: 1
        Handle: 237 Address: C0:07:E8:2C:B6:EE (OUI C0-07-E8)
        Count: 1
zephyr.exe[1946606]: < ACL Data TX: Handle 237 [1/3] flags 0x00 dlen 21                                             #129 7.979482
      SMP: Pairing Confirm (0x03) len 16
        Confirm value[16]: d54b93dad0e38e58dd2a60b892384e35
> HCI Event: Number of Completed Packets (0x13) plen 5                                                              #130 8.098446
        Num handles: 1
        Handle: 237 Address: C0:07:E8:2C:B6:EE (OUI C0-07-E8)
        Count: 1
        Buffers: 0/3
        #129: len 21 (1 Kb/s)
        Latency: 118 msec (43-124 msec ~116 msec)
> ACL Data RX: Handle 237 flags 0x02 dlen 21                                                                        #131 8.098839
      SMP: Pairing Random (0x04) len 16
        Random value[16]: 7065665acf2f24bffe36f647132e9c43
zephyr.exe[1946606]: < HCI Command: Host Number of Completed Packets (0x03|0x0035) plen 5                           #132 8.099541
        Num handles: 1
        Handle: 237 Address: C0:07:E8:2C:B6:EE (OUI C0-07-E8)
        Count: 1
zephyr.exe[1946606]: < ACL Data TX: Handle 237 [1/3] flags 0x00 dlen 21                                             #133 8.099699
      SMP: Pairing Random (0x04) len 16
        Random value[16]: 5c794dc9ad9f2c3f295ebd5ad5e1c3cf
> HCI Event: Number of Completed Packets (0x13) plen 5                                                              #134 8.223459
        Num handles: 1
        Handle: 237 Address: C0:07:E8:2C:B6:EE (OUI C0-07-E8)
        Count: 1
        Buffers: 0/3
        #133: len 21 (1 Kb/s)
        Latency: 123 msec (43-124 msec ~120 msec)
> ACL Data RX: Handle 237 flags 0x02 dlen 21                                                                        #135 8.223784
      SMP: Pairing Confirm (0x03) len 16
        Confirm value[16]: bff224ffb642f2ba26868c5b1a3a7631
zephyr.exe[1946606]: < HCI Command: Host Number of Completed Packets (0x03|0x0035) plen 5                           #136 8.239394
        Num handles: 1
        Handle: 237 Address: C0:07:E8:2C:B6:EE (OUI C0-07-E8)
        Count: 1
zephyr.exe[1946606]: < ACL Data TX: Handle 237 [1/3] flags 0x00 dlen 21                                             #137 8.239577
      SMP: Pairing Confirm (0x03) len 16
        Confirm value[16]: 5112126ed4c0bb5bc0c64cc355bb17ed
> HCI Event: Number of Completed Packets (0x13) plen 5                                                              #138 8.348484
        Num handles: 1
        Handle: 237 Address: C0:07:E8:2C:B6:EE (OUI C0-07-E8)
        Count: 1
        Buffers: 0/3
        #137: len 21 (1 Kb/s)
        Latency: 108 msec (43-124 msec ~114 msec)
> ACL Data RX: Handle 237 flags 0x02 dlen 21                                                                        #139 8.348996
      SMP: Pairing Random (0x04) len 16
        Random value[16]: b0332b4e6b1d029ea51f0fc79e35a5e8
zephyr.exe[1946606]: < HCI Command: Host Number of Completed Packets (0x03|0x0035) plen 5                           #140 8.359380
        Num handles: 1
        Handle: 237 Address: C0:07:E8:2C:B6:EE (OUI C0-07-E8)
        Count: 1
zephyr.exe[1946606]: < ACL Data TX: Handle 237 [1/3] flags 0x00 dlen 21                                             #141 8.359735
      SMP: Pairing Random (0x04) len 16
        Random value[16]: 5c2fff312cdf99c9491988e877355a9a
> HCI Event: Number of Completed Packets (0x13) plen 5                                                              #142 8.473446
        Num handles: 1
        Handle: 237 Address: C0:07:E8:2C:B6:EE (OUI C0-07-E8)
        Count: 1
        Buffers: 0/3
        #141: len 21 (1 Kb/s)
        Latency: 113 msec (43-124 msec ~114 msec)
> ACL Data RX: Handle 237 flags 0x02 dlen 21                                                                        #143 8.473724
      SMP: Pairing Confirm (0x03) len 16
        Confirm value[16]: 9d83d3aebdf575a6ac0d86fee92bcbea
zephyr.exe[1946606]: < HCI Command: Host Number of Completed Packets (0x03|0x0035) plen 5                           #144 8.479360
        Num handles: 1
        Handle: 237 Address: C0:07:E8:2C:B6:EE (OUI C0-07-E8)
        Count: 1
zephyr.exe[1946606]: < ACL Data TX: Handle 237 [1/3] flags 0x00 dlen 21                                             #145 8.479496
      SMP: Pairing Confirm (0x03) len 16
        Confirm value[16]: 9dfe0693c8ff5ba9e7ba248f7dc64468
> HCI Event: Number of Completed Packets (0x13) plen 5                                                              #146 8.598466
        Num handles: 1
        Handle: 237 Address: C0:07:E8:2C:B6:EE (OUI C0-07-E8)
        Count: 1
        Buffers: 0/3
        #145: len 21 (1 Kb/s)
        Latency: 118 msec (43-124 msec ~116 msec)
> ACL Data RX: Handle 237 flags 0x02 dlen 21                                                                        #147 8.598841
      SMP: Pairing Random (0x04) len 16
        Random value[16]: 9ef88d696b1a75a75a3409579448ef26
zephyr.exe[1946606]: < HCI Command: Host Number of Completed Packets (0x03|0x0035) plen 5                           #148 8.599633
        Num handles: 1
        Handle: 237 Address: C0:07:E8:2C:B6:EE (OUI C0-07-E8)
        Count: 1
zephyr.exe[1946606]: < ACL Data TX: Handle 237 [1/3] flags 0x00 dlen 21                                             #149 8.599836
      SMP: Pairing Random (0x04) len 16
        Random value[16]: c629a3a987d808e808655d558dfc1155
> HCI Event: Number of Completed Packets (0x13) plen 5                                                              #150 8.723423
        Num handles: 1
        Handle: 237 Address: C0:07:E8:2C:B6:EE (OUI C0-07-E8)
        Count: 1
        Buffers: 0/3
        #149: len 21 (1 Kb/s)
        Latency: 123 msec (43-124 msec ~120 msec)
> ACL Data RX: Handle 237 flags 0x02 dlen 21                                                                        #151 8.723769
      SMP: Pairing Confirm (0x03) len 16
        Confirm value[16]: 6dd1524ee34bd2f105a2c638a8d33a6d
zephyr.exe[1946606]: < HCI Command: Host Number of Completed Packets (0x03|0x0035) plen 5                           #152 8.739416
        Num handles: 1
        Handle: 237 Address: C0:07:E8:2C:B6:EE (OUI C0-07-E8)
        Count: 1
zephyr.exe[1946606]: < ACL Data TX: Handle 237 [1/3] flags 0x00 dlen 21                                             #153 8.739609
      SMP: Pairing Confirm (0x03) len 16
        Confirm value[16]: c91029e438a1673a935d031a72e4d30c
> HCI Event: Number of Completed Packets (0x13) plen 5                                                              #154 8.848469
        Num handles: 1
        Handle: 237 Address: C0:07:E8:2C:B6:EE (OUI C0-07-E8)
        Count: 1
        Buffers: 0/3
        #153: len 21 (1 Kb/s)
        Latency: 108 msec (43-124 msec ~114 msec)
> ACL Data RX: Handle 237 flags 0x02 dlen 21                                                                        #155 8.848881
      SMP: Pairing Random (0x04) len 16
        Random value[16]: ea78f786305b18a52d1aaeb3b67c73ac
zephyr.exe[1946606]: < HCI Command: Host Number of Completed Packets (0x03|0x0035) plen 5                           #156 8.859415
        Num handles: 1
        Handle: 237 Address: C0:07:E8:2C:B6:EE (OUI C0-07-E8)
        Count: 1
zephyr.exe[1946606]: < ACL Data TX: Handle 237 [1/3] flags 0x00 dlen 21                                             #157 8.859558
      SMP: Pairing Random (0x04) len 16
        Random value[16]: 92f20f6ad8f13724432c7fd6001c45ff
> HCI Event: Number of Completed Packets (0x13) plen 5                                                              #158 8.973453
        Num handles: 1
        Handle: 237 Address: C0:07:E8:2C:B6:EE (OUI C0-07-E8)
        Count: 1
        Buffers: 0/3
        #157: len 21 (1 Kb/s)
        Latency: 113 msec (43-124 msec ~114 msec)
> ACL Data RX: Handle 237 flags 0x02 dlen 21                                                                        #159 8.973779
      SMP: Pairing Confirm (0x03) len 16
        Confirm value[16]: 97415b576f03ae5a076bbd0d8f2e9588
zephyr.exe[1946606]: < HCI Command: Host Number of Completed Packets (0x03|0x0035) plen 5                           #160 8.979306
        Num handles: 1
        Handle: 237 Address: C0:07:E8:2C:B6:EE (OUI C0-07-E8)
        Count: 1
zephyr.exe[1946606]: < ACL Data TX: Handle 237 [1/3] flags 0x00 dlen 21                                             #161 8.979656
      SMP: Pairing Confirm (0x03) len 16
        Confirm value[16]: c39b7554f00bf0d6adb12327a385280c
> HCI Event: Number of Completed Packets (0x13) plen 5                                                              #162 9.098474
        Num handles: 1
        Handle: 237 Address: C0:07:E8:2C:B6:EE (OUI C0-07-E8)
        Count: 1
        Buffers: 0/3
        #161: len 21 (1 Kb/s)
        Latency: 118 msec (43-124 msec ~116 msec)
> ACL Data RX: Handle 237 flags 0x02 dlen 21                                                                        #163 9.098766
      SMP: Pairing Random (0x04) len 16
        Random value[16]: 86b810c35955c2a66eb507d805276a66
zephyr.exe[1946606]: < HCI Command: Host Number of Completed Packets (0x03|0x0035) plen 5                           #164 9.099537
        Num handles: 1
        Handle: 237 Address: C0:07:E8:2C:B6:EE (OUI C0-07-E8)
        Count: 1
zephyr.exe[1946606]: < ACL Data TX: Handle 237 [1/3] flags 0x00 dlen 21                                             #165 9.099655
      SMP: Pairing Random (0x04) len 16
        Random value[16]: 23ac32ebbb5e14c8a6b9622f296d277f
> HCI Event: Number of Completed Packets (0x13) plen 5                                                              #166 9.286001
        Num handles: 1
        Handle: 237 Address: C0:07:E8:2C:B6:EE (OUI C0-07-E8)
        Count: 1
        Buffers: 0/3
        #165: len 21 (0 Kb/s)
        Latency: 186 msec (43-186 msec ~151 msec)
> ACL Data RX: Handle 237 flags 0x02 dlen 21                                                                        #167 9.286340
      SMP: Pairing Confirm (0x03) len 16
        Confirm value[16]: e01e62c58e21bece404fa43a1a44fb19
zephyr.exe[1946606]: < HCI Command: Host Number of Completed Packets (0x03|0x0035) plen 5                           #168 9.299513
        Num handles: 1
        Handle: 237 Address: C0:07:E8:2C:B6:EE (OUI C0-07-E8)
        Count: 1
zephyr.exe[1946606]: < ACL Data TX: Handle 237 [1/3] flags 0x00 dlen 21                                             #169 9.299855
      SMP: Pairing Confirm (0x03) len 16
        Confirm value[16]: 6e8c529da41555787fe2f1721765fe90
> HCI Event: Number of Completed Packets (0x13) plen 5                                                              #170 9.411001
        Num handles: 1
        Handle: 237 Address: C0:07:E8:2C:B6:EE (OUI C0-07-E8)
        Count: 1
        Buffers: 0/3
        #169: len 21 (1 Kb/s)
        Latency: 111 msec (43-186 msec ~131 msec)
> ACL Data RX: Handle 237 flags 0x02 dlen 21                                                                        #171 9.411233
      SMP: Pairing Random (0x04) len 16
        Random value[16]: a2fdc37dc9bd8df7b02b5b04c2dd4d81
zephyr.exe[1946606]: < HCI Command: Host Number of Completed Packets (0x03|0x0035) plen 5                           #172 9.419418
        Num handles: 1
        Handle: 237 Address: C0:07:E8:2C:B6:EE (OUI C0-07-E8)
        Count: 1
zephyr.exe[1946606]: < ACL Data TX: Handle 237 [1/3] flags 0x00 dlen 21                                             #173 9.419594
      SMP: Pairing Random (0x04) len 16
        Random value[16]: 297efe85e67448a15f56bd27e3a3cf1d
> HCI Event: Number of Completed Packets (0x13) plen 5                                                              #174 9.535989
        Num handles: 1
        Handle: 237 Address: C0:07:E8:2C:B6:EE (OUI C0-07-E8)
        Count: 1
        Buffers: 0/3
        #173: len 21 (1 Kb/s)
        Latency: 116 msec (43-186 msec ~123 msec)
> ACL Data RX: Handle 237 flags 0x02 dlen 21                                                                        #175 9.536256
      SMP: Pairing Confirm (0x03) len 16
        Confirm value[16]: 52ca8d6c73e0a1547b9f3f0a71dbb39a
zephyr.exe[1946606]: < HCI Command: Host Number of Completed Packets (0x03|0x0035) plen 5                           #176 9.539374
        Num handles: 1
        Handle: 237 Address: C0:07:E8:2C:B6:EE (OUI C0-07-E8)
        Count: 1
zephyr.exe[1946606]: < ACL Data TX: Handle 237 [1/3] flags 0x00 dlen 21                                             #177 9.539522
      SMP: Pairing Confirm (0x03) len 16
        Confirm value[16]: f0f343c8fbd49b271b7b07baf91c56a3
zephyr.exe[1946606]: < ACL Data TX: Handle 237 [2/3] flags 0x00 dlen 16                                             #178 9.549126
      LE L2CAP: Connection Parameter Update Request (0x12) ident 1 len 8
        Min interval: 24
        Max interval: 40
        Peripheral latency: 0
        Timeout multiplier: 42
> HCI Event: Number of Completed Packets (0x13) plen 5                                                              #179 9.598753
        Num handles: 1
        Handle: 237 Address: C0:07:E8:2C:B6:EE (OUI C0-07-E8)
        Count: 1
        Buffers: 1/3
        #177: len 21 (2 Kb/s)
        Latency: 59 msec (43-186 msec ~91 msec)
> HCI Event: Number of Completed Packets (0x13) plen 5                                                              #180 9.661003
        Num handles: 1
        Handle: 237 Address: C0:07:E8:2C:B6:EE (OUI C0-07-E8)
        Count: 1
        Buffers: 0/3
        #178: len 16 (1 Kb/s)
        Latency: 111 msec (43-186 msec ~101 msec)
> ACL Data RX: Handle 237 flags 0x02 dlen 21                                                                        #181 9.661257
      SMP: Pairing Random (0x04) len 16
        Random value[16]: b0cc3752a187d125c3e036b46d74d66b
zephyr.exe[1946606]: < HCI Command: Host Number of Completed Packets (0x03|0x0035) plen 5                           #182 9.679340
        Num handles: 1
        Handle: 237 Address: C0:07:E8:2C:B6:EE (OUI C0-07-E8)
        Count: 1
zephyr.exe[1946606]: < ACL Data TX: Handle 237 [1/3] flags 0x00 dlen 21                                             #183 9.679515
      SMP: Pairing Random (0x04) len 16
        Random value[16]: 25a9493fd3ce4faf02be7293595bb7c6
> ACL Data RX: Handle 237 flags 0x02 dlen 10                                                                        #184 9.723487
      LE L2CAP: Connection Parameter Update Response (0x13) ident 1 len 2
        Result: Connection Parameters accepted (0x0000)
zephyr.exe[1946606]: < HCI Command: Host Number of Completed Packets (0x03|0x0035) plen 5                           #185 9.739330
        Num handles: 1
        Handle: 237 Address: C0:07:E8:2C:B6:EE (OUI C0-07-E8)
        Count: 1
> HCI Event: Number of Completed Packets (0x13) plen 5                                                              #186 9.786007
        Num handles: 1
        Handle: 237 Address: C0:07:E8:2C:B6:EE (OUI C0-07-E8)
        Count: 1
        Buffers: 0/3
        #183: len 21 (1 Kb/s)
        Latency: 106 msec (43-186 msec ~104 msec)
> ACL Data RX: Handle 237 flags 0x02 dlen 21                                                                        #187 9.786281
      SMP: Pairing Confirm (0x03) len 16
        Confirm value[16]: c198bd7377667fd7ec08730578db31f1
zephyr.exe[1946606]: < HCI Command: Host Number of Completed Packets (0x03|0x0035) plen 5                           #188 9.799409
        Num handles: 1
        Handle: 237 Address: C0:07:E8:2C:B6:EE (OUI C0-07-E8)
        Count: 1
zephyr.exe[1946606]: < ACL Data TX: Handle 237 [1/3] flags 0x00 dlen 21                                             #189 9.799583
      SMP: Pairing Confirm (0x03) len 16
        Confirm value[16]: 45b6c094c3cab986b76f8e551c74745a
> HCI Event: Number of Completed Packets (0x13) plen 5                                                              #190 9.910960
        Num handles: 1
        Handle: 237 Address: C0:07:E8:2C:B6:EE (OUI C0-07-E8)
        Count: 1
        Buffers: 0/3
        #189: len 21 (1 Kb/s)
        Latency: 111 msec (43-186 msec ~107 msec)
> ACL Data RX: Handle 237 flags 0x02 dlen 21                                                                        #191 9.911299
      SMP: Pairing Random (0x04) len 16
        Random value[16]: 60ead71d40ea28fcb87a5ea4c900fcd0
zephyr.exe[1946606]: < HCI Command: Host Number of Completed Packets (0x03|0x0035) plen 5                           #192 9.919387
        Num handles: 1
        Handle: 237 Address: C0:07:E8:2C:B6:EE (OUI C0-07-E8)
        Count: 1
zephyr.exe[1946606]: < ACL Data TX: Handle 237 [1/3] flags 0x00 dlen 21                                             #193 9.919527
      SMP: Pairing Random (0x04) len 16
        Random value[16]: 58f6b41f855a6f6c3560debd84e2affc
> HCI Event: Number of Completed Packets (0x13) plen 5                                                             #194 10.035995
        Num handles: 1
        Handle: 237 Address: C0:07:E8:2C:B6:EE (OUI C0-07-E8)
        Count: 1
        Buffers: 0/3
        #193: len 21 (1 Kb/s)
        Latency: 116 msec (43-186 msec ~112 msec)
> ACL Data RX: Handle 237 flags 0x02 dlen 21                                                                       #195 10.036447
      SMP: Pairing Confirm (0x03) len 16
        Confirm value[16]: 5c7657eb55b8a638a62c59964e451703
zephyr.exe[1946606]: < HCI Command: Host Number of Completed Packets (0x03|0x0035) plen 5                          #196 10.039404
        Num handles: 1
        Handle: 237 Address: C0:07:E8:2C:B6:EE (OUI C0-07-E8)
        Count: 1
zephyr.exe[1946606]: < ACL Data TX: Handle 237 [1/3] flags 0x00 dlen 21                                            #197 10.039615
      SMP: Pairing Confirm (0x03) len 16
        Confirm value[16]: a041736e5f0bfa338e589dc236fdd35d
> HCI Event: Number of Completed Packets (0x13) plen 5                                                             #198 10.161008
        Num handles: 1
        Handle: 237 Address: C0:07:E8:2C:B6:EE (OUI C0-07-E8)
        Count: 1
        Buffers: 0/3
        #197: len 21 (1 Kb/s)
        Latency: 121 msec (43-186 msec ~116 msec)
> ACL Data RX: Handle 237 flags 0x02 dlen 21                                                                       #199 10.161600
      SMP: Pairing Random (0x04) len 16
        Random value[16]: a45c4afc49596b8ae0dedfd2d5d6fa9d
zephyr.exe[1946606]: < HCI Command: Host Number of Completed Packets (0x03|0x0035) plen 5                          #200 10.179511
        Num handles: 1
        Handle: 237 Address: C0:07:E8:2C:B6:EE (OUI C0-07-E8)
        Count: 1
zephyr.exe[1946606]: < ACL Data TX: Handle 237 [1/3] flags 0x00 dlen 21                                            #201 10.180014
      SMP: Pairing Random (0x04) len 16
        Random value[16]: b67e7216d5bf664139eda2b542549666
> HCI Event: Number of Completed Packets (0x13) plen 5                                                             #202 10.286009
        Num handles: 1
        Handle: 237 Address: C0:07:E8:2C:B6:EE (OUI C0-07-E8)
        Count: 1
        Buffers: 0/3
        #201: len 21 (1 Kb/s)
        Latency: 105 msec (43-186 msec ~111 msec)
> ACL Data RX: Handle 237 flags 0x02 dlen 21                                                                       #203 10.286286
      SMP: Pairing Confirm (0x03) len 16
        Confirm value[16]: f5144bb1525f55776b97a009aeee7220
zephyr.exe[1946606]: < HCI Command: Host Number of Completed Packets (0x03|0x0035) plen 5                          #204 10.299426
        Num handles: 1
        Handle: 237 Address: C0:07:E8:2C:B6:EE (OUI C0-07-E8)
        Count: 1
zephyr.exe[1946606]: < ACL Data TX: Handle 237 [1/3] flags 0x00 dlen 21                                            #205 10.299596
      SMP: Pairing Confirm (0x03) len 16
        Confirm value[16]: 13f500d0eacfa953010d99bb4d00446e
> HCI Event: Number of Completed Packets (0x13) plen 5                                                             #206 10.411001
        Num handles: 1
        Handle: 237 Address: C0:07:E8:2C:B6:EE (OUI C0-07-E8)
        Count: 1
        Buffers: 0/3
        #205: len 21 (1 Kb/s)
        Latency: 111 msec (43-186 msec ~111 msec)
> ACL Data RX: Handle 237 flags 0x02 dlen 21                                                                       #207 10.411223
      SMP: Pairing Random (0x04) len 16
        Random value[16]: ad687a4d9d8bb31ccc30ff7ad38c49ff
zephyr.exe[1946606]: < HCI Command: Host Number of Completed Packets (0x03|0x0035) plen 5                          #208 10.419410
        Num handles: 1
        Handle: 237 Address: C0:07:E8:2C:B6:EE (OUI C0-07-E8)
        Count: 1
zephyr.exe[1946606]: < ACL Data TX: Handle 237 [1/3] flags 0x00 dlen 21                                            #209 10.419556
      SMP: Pairing Random (0x04) len 16
        Random value[16]: ed17f76500c95219dd01e09d1e63f87b
> HCI Event: Number of Completed Packets (0x13) plen 5                                                             #210 10.536006
        Num handles: 1
        Handle: 237 Address: C0:07:E8:2C:B6:EE (OUI C0-07-E8)
        Count: 1
        Buffers: 0/3
        #209: len 21 (1 Kb/s)
        Latency: 116 msec (43-186 msec ~113 msec)
> ACL Data RX: Handle 237 flags 0x02 dlen 21                                                                       #211 10.536298
      SMP: Pairing Confirm (0x03) len 16
        Confirm value[16]: 47db9a254a6a7947d85745535f3c18fb
zephyr.exe[1946606]: < HCI Command: Host Number of Completed Packets (0x03|0x0035) plen 5                          #212 10.539349
        Num handles: 1
        Handle: 237 Address: C0:07:E8:2C:B6:EE (OUI C0-07-E8)
        Count: 1
zephyr.exe[1946606]: < ACL Data TX: Handle 237 [1/3] flags 0x00 dlen 21                                            #213 10.539498
      SMP: Pairing Confirm (0x03) len 16
        Confirm value[16]: 745535a96d5d1c01c3e4d4bc07a35a1b
> HCI Event: Number of Completed Packets (0x13) plen 5                                                             #214 10.660939
        Num handles: 1
        Handle: 237 Address: C0:07:E8:2C:B6:EE (OUI C0-07-E8)
        Count: 1
        Buffers: 0/3
        #213: len 21 (1 Kb/s)
        Latency: 121 msec (43-186 msec ~117 msec)
> ACL Data RX: Handle 237 flags 0x02 dlen 21                                                                       #215 10.661266
      SMP: Pairing Random (0x04) len 16
        Random value[16]: eb9290ab5b73583e4dd6491a44f6a064
zephyr.exe[1946606]: < HCI Command: Host Number of Completed Packets (0x03|0x0035) plen 5                          #216 10.679393
        Num handles: 1
        Handle: 237 Address: C0:07:E8:2C:B6:EE (OUI C0-07-E8)
        Count: 1
zephyr.exe[1946606]: < ACL Data TX: Handle 237 [1/3] flags 0x00 dlen 21                                            #217 10.679568
      SMP: Pairing Random (0x04) len 16
        Random value[16]: 81d35d47e1f6006d79c974bd9d9e1ee3
> HCI Event: Number of Completed Packets (0x13) plen 5                                                             #218 10.786018
        Num handles: 1
        Handle: 237 Address: C0:07:E8:2C:B6:EE (OUI C0-07-E8)
        Count: 1
        Buffers: 0/3
        #217: len 21 (1 Kb/s)
        Latency: 106 msec (43-186 msec ~112 msec)
> ACL Data RX: Handle 237 flags 0x02 dlen 21                                                                       #219 10.786294
      SMP: Pairing Confirm (0x03) len 16
        Confirm value[16]: 1ce08435a0dadfe798c5462d70455068
zephyr.exe[1946606]: < HCI Command: Host Number of Completed Packets (0x03|0x0035) plen 5                          #220 10.799428
        Num handles: 1
        Handle: 237 Address: C0:07:E8:2C:B6:EE (OUI C0-07-E8)
        Count: 1
zephyr.exe[1946606]: < ACL Data TX: Handle 237 [1/3] flags 0x00 dlen 21                                            #221 10.799612
      SMP: Pairing Confirm (0x03) len 16
        Confirm value[16]: a2eb277119c9799a77ef9bbb52782631
> HCI Event: Number of Completed Packets (0x13) plen 5                                                             #222 10.911046
        Num handles: 1
        Handle: 237 Address: C0:07:E8:2C:B6:EE (OUI C0-07-E8)
        Count: 1
        Buffers: 0/3
        #221: len 21 (1 Kb/s)
        Laten