Bluetooth monitor ver 5.72
= Note: Linux version 6.14.0-36-generic (x86_64)                       0.670958
= Note: Bluetooth subsystem version 2.22                               0.670960
= New Index: 00:00:00:00:00:00 (Primary,UART,hci1)              [hci1] 0.670961
= New Index: 48:5F:99:8E:E0:64 (Primary,USB,hci0)               [hci0] 0.670961
= Open Index: 00:00:00:00:00:00                                 [hci1] 0.784873
= Index Info: 00:00:00:00:00:00 (Nordic Semiconductor ASA)      [hci1] 0.784891
@ USER Open: main (privileged) version 2.22            {0x0001} [hci1] 0.784900
< HCI Command: Reset (0x03|0x0003) plen 0                    #1 [hci1] 0.786216
> HCI Event: Command Complete (0x0e) plen 4                  #2 [hci1] 0.786772
      Reset (0x03|0x0003) ncmd 1
        Status: Success (0x00)
< HCI Command: Read Local Supported... (0x04|0x0003) plen 0  #3 [hci1] 0.804703
> HCI Event: Command Complete (0x0e) plen 12                 #4 [hci1] 0.805273
      Read Local Supported Features (0x04|0x0003) ncmd 1
        Status: Success (0x00)
        Features: 0x00 0x00 0x00 0x00 0x60 0x00 0x00 0x00
          BR/EDR Not Supported
          LE Supported (Controller)
< HCI Command: Read Local Version In.. (0x04|0x0001) plen 0  #5 [hci1] 0.824307
> HCI Event: Command Complete (0x0e) plen 12                 #6 [hci1] 0.824844
      Read Local Version Information (0x04|0x0001) ncmd 1
        Status: Success (0x00)
        HCI version: Reserved (0x0f) - Revision 12393 (0x3069)
        LMP version: Reserved (0x0f) - Subversion 12393 (0x3069)
        Manufacturer: Nordic Semiconductor ASA (89)
< HCI Command: Read Local Supported... (0x04|0x0002) plen 0  #7 [hci1] 0.844267
> HCI Event: Command Complete (0x0e) plen 68                 #8 [hci1] 0.845384
      Read Local Supported Commands (0x04|0x0002) ncmd 1
        Status: Success (0x00)
        Commands: 119 entries
          Disconnect (Octet 0 - Bit 5)
          Read Remote Version Information (Octet 2 - Bit 7)
          Set Event Mask (Octet 5 - Bit 6)
          Reset (Octet 5 - Bit 7)
          Read Connection Accept Timeout (Octet 7 - Bit 2)
          Write Connection Accept Timeout (Octet 7 - Bit 3)
          Read Transmit Power Level (Octet 10 - Bit 2)
          Set Controller To Host Flow Control (Octet 10 - Bit 5)
          Host Buffer Size (Octet 10 - Bit 6)
          Host Number of Completed Packets (Octet 10 - Bit 7)
          Read Local Version Information (Octet 14 - Bit 3)
          Read Local Supported Features (Octet 14 - Bit 5)
          Read BD ADDR (Octet 15 - Bit 1)
          Read RSSI (Octet 15 - Bit 5)
          Set Event Mask Page 2 (Octet 22 - Bit 2)
          LE Set Event Mask (Octet 25 - Bit 0)
          LE Read Buffer Size (Octet 25 - Bit 1)
          LE Read Local Supported Features (Octet 25 - Bit 2)
          LE Set Random Address (Octet 25 - Bit 4)
          LE Set Advertising Parameters (Octet 25 - Bit 5)
          LE Read Advertising Channel TX Power (Octet 25 - Bit 6)
          LE Set Advertising Data (Octet 25 - Bit 7)
          LE Set Scan Response Data (Octet 26 - Bit 0)
          LE Set Advertise Enable (Octet 26 - Bit 1)
          LE Set Scan Parameters (Octet 26 - Bit 2)
          LE Set Scan Enable (Octet 26 - Bit 3)
          LE Create Connection (Octet 26 - Bit 4)
          LE Create Connection Cancel (Octet 26 - Bit 5)
          LE Read Accept List Size (Octet 26 - Bit 6)
          LE Clear Accept List (Octet 26 - Bit 7)
          LE Add Device To Accept List (Octet 27 - Bit 0)
          LE Remove Device From Accept List (Octet 27 - Bit 1)
          LE Connection Update (Octet 27 - Bit 2)
          LE Set Host Channel Classification (Octet 27 - Bit 3)
          LE Read Channel Map (Octet 27 - Bit 4)
          LE Read Remote Used Features (Octet 27 - Bit 5)
          LE Encrypt (Octet 27 - Bit 6)
          LE Rand (Octet 27 - Bit 7)
          LE Start Encryption (Octet 28 - Bit 0)
          LE Long Term Key Request Reply (Octet 28 - Bit 1)
          LE Long Term Key Request Neg Reply (Octet 28 - Bit 2)
          LE Read Supported States (Octet 28 - Bit 3)
          LE Receiver Test (Octet 28 - Bit 4)
          LE Transmitter Test (Octet 28 - Bit 5)
          LE Test End (Octet 28 - Bit 6)
          Read Authenticated Payload Timeout (Octet 32 - Bit 4)
          Write Authenticated Payload Timeout (Octet 32 - Bit 5)
          LE Set Data Length (Octet 33 - Bit 6)
          LE Read Suggested Default Data Length (Octet 33 - Bit 7)
          LE Write Suggested Default Data Length (Octet 34 - Bit 0)
          LE Add Device To Resolving List (Octet 34 - Bit 3)
          LE Remove Device From Resolving List (Octet 34 - Bit 4)
          LE Clear Resolving List (Octet 34 - Bit 5)
          LE Read Resolving List Size (Octet 34 - Bit 6)
          LE Set Address Resolution Enable (Octet 35 - Bit 1)
          LE Set Resolvable Private Address Timeout (Octet 35 - Bit 2)
          LE Read Maximum Data Length (Octet 35 - Bit 3)
          LE Read PHY (Octet 35 - Bit 4)
          LE Set Default PHY (Octet 35 - Bit 5)
          LE Set PHY (Octet 35 - Bit 6)
          LE Enhanced Receiver Test (Octet 35 - Bit 7)
          LE Enhanced Transmitter Test (Octet 36 - Bit 0)
          LE Set Advertising Set Random Address (Octet 36 - Bit 1)
          LE Set Extended Advertising Parameters (Octet 36 - Bit 2)
          LE Set Extended Advertising Data (Octet 36 - Bit 3)
          LE Set Extended Scan Response Data (Octet 36 - Bit 4)
          LE Set Extended Advertising Enable (Octet 36 - Bit 5)
          LE Read Maximum Advertising Data Length (Octet 36 - Bit 6)
          LE Read Number of Supported Advertising Sets (Octet 36 - Bit 7)
          LE Remove Advertising Set (Octet 37 - Bit 0)
          LE Clear Advertising Sets (Octet 37 - Bit 1)
          LE Set Periodic Advertising Parameters (Octet 37 - Bit 2)
          LE Set Periodic Advertising Data (Octet 37 - Bit 3)
          LE Set Periodic Advertising Enable (Octet 37 - Bit 4)
          LE Set Extended Scan Parameters (Octet 37 - Bit 5)
          LE Set Extended Scan Enable (Octet 37 - Bit 6)
          LE Extended Create Connection (Octet 37 - Bit 7)
          LE Periodic Advertising Create Sync (Octet 38 - Bit 0)
          LE Periodic Advertising Create Sync Cancel (Octet 38 - Bit 1)
          LE Periodic Advertising Terminate Sync (Octet 38 - Bit 2)
          LE Add Device To Periodic Advertiser List (Octet 38 - Bit 3)
          LE Remove Device From Periodic Advertiser List (Octet 38 - Bit 4)
          LE Clear Periodic Advertiser List (Octet 38 - Bit 5)
          LE Read Periodic Advertiser List Size (Octet 38 - Bit 6)
          LE Read Transmit Power (Octet 38 - Bit 7)
          LE Read RF Path Compensation (Octet 39 - Bit 0)
          LE Write RF Path Compensation (Octet 39 - Bit 1)
          LE Set Privacy Mode (Octet 39 - Bit 2)
          LE Periodic Advertising Receive Enable (Octet 40 - Bit 5)
          LE Periodic Advertising Sync Transfer (Octet 40 - Bit 6)
          LE Periodic Advertising Set Info Transfer (Octet 40 - Bit 7)
          LE Periodic Advertising Sync Transfer Parameters (Octet 41 - Bit 0)
          LE Set Default Periodic Advertisng Sync Transfer Parameters (Octet 41 - Bit 1)
          LE Read Buffer v2 (Octet 41 - Bit 5)
          LE Read ISO TX Sync (Octet 41 - Bit 6)
          LE Set Connected Isochronous Group Parameters (Octet 41 - Bit 7)
          LE Set Connected Isochronous Group Parameters Test (Octet 42 - Bit 0)
          LE Create Connected Isochronous Stream (Octet 42 - Bit 1)
          LE Remove Connected Isochronous Group (Octet 42 - Bit 2)
          LE Accept Connected Isochronous Stream Request (Octet 42 - Bit 3)
          LE Reject Connected Isochronous Stream Request (Octet 42 - Bit 4)
          LE Create Broadcast Isochronous Group (Octet 42 - Bit 5)
          LE Create Broadcast Isochronous Group Test (Octet 42 - Bit 6)
          LE Terminate Broadcast Isochronous Group (Octet 42 - Bit 7)
          LE Broadcast Isochronous Group Create Sync (Octet 43 - Bit 0)
          LE Broadcast Isochronous Group Terminate Sync (Octet 43 - Bit 1)
          LE Request Peer SCA (Octet 43 - Bit 2)
          LE Setup Isochronous Data Path (Octet 43 - Bit 3)
          LE Remove Isochronous Data Path (Octet 43 - Bit 4)
          LE Isochronous Transmit Test (Octet 43 - Bit 5)
          LE Isochronous Receive Test (Octet 43 - Bit 6)
          LE Isochronous Read Test Counters (Octet 43 - Bit 7)
          LE Isochronous Read Test Counters (Octet 44 - Bit 0)
          LE Set Host Feature (Octet 44 - Bit 1)
          Octet 44 - Bit 2 
          Octet 45 - Bit 6 
          Octet 46 - Bit 0 
          Octet 46 - Bit 1 
          Octet 46 - Bit 2 
< HCI Command: Host Buffer Size (0x03|0x0033) plen 7         #9 [hci1] 0.864240
        ACL MTU: 255  ACL max packet: 16
        SCO MTU: 0    SCO max packet: 0
> HCI Event: Command Complete (0x0e) plen 4                 #10 [hci1] 0.864726
      Host Buffer Size (0x03|0x0033) ncmd 1
        Status: Success (0x00)
< HCI Command: Set Controller To Ho.. (0x03|0x0031) plen 1  #11 [hci1] 0.884262
        Flow control: ACL Data Packets (0x01)
> HCI Event: Command Complete (0x0e) plen 4                 #12 [hci1] 0.884713
      Set Controller To Host Flow Control (0x03|0x0031) ncmd 1
        Status: Success (0x00)
< HCI Command: LE Read Local Suppor.. (0x08|0x0003) plen 0  #13 [hci1] 0.904263
> HCI Event: Command Complete (0x0e) plen 12                #14 [hci1] 0.904805
      LE Read Local Supported Features (0x08|0x0003) ncmd 1
        Status: Success (0x00)
        Features: 0xfd 0x79 0x00 0xf7 0x30 0x01 0x00 0x00
          LE Encryption
          Extended Reject Indication
          Peripheral-initiated Features Exchange
          LE Ping
          LE Data Packet Length Extension
          LL Privacy
          Extended Scanner Filter Policies
          LE 2M PHY
          LE Coded PHY
          LE Extended Advertising
          LE Periodic Advertising
          Channel Selection Algorithm #2
          Periodic Advertising Sync Transfer - Sender
          Periodic Advertising Sync Transfer - Recipient
          Sleep Clock Accuracy Updates
          Connected Isochronous Stream - Central
          Connected Isochronous Stream - Peripheral
          Isochronous Broadcaster
          Synchronized Receiver
          Periodic Advertising ADI support
          Connection Subrating
          Unknown features (0x0000010000000000)
< HCI Command: LE Set Host Feature (0x08|0x0074) plen 2     #15 [hci1] 0.924298
        Bit Number: 32
          Connected Isochronous Stream (Host Support)
        Bit Value: 1
> HCI Event: Command Complete (0x0e) plen 4                 #16 [hci1] 0.924784
      LE Set Host Feature (0x08|0x0074) ncmd 1
        Status: Success (0x00)
< HCI Command: LE Read Buffer v2 (0x08|0x0060) plen 0       #17 [hci1] 0.944283
> HCI Event: Command Complete (0x0e) plen 10                #18 [hci1] 0.944751
      LE Read Buffer v2 (0x08|0x0060) ncmd 1
        Status: Success (0x00)
        ACL MTU: 27
        ACL max packet: 3
        ISO MTU: 318
        ISO max packet: 3
< HCI Command: LE Read Maximum Adve.. (0x08|0x003a) plen 0  #19 [hci1] 0.964328
> HCI Event: Command Complete (0x0e) plen 6                 #20 [hci1] 0.964792
      LE Read Maximum Advertising Data Length (0x08|0x003a) ncmd 1
        Status: Success (0x00)
        Max length: 1650
< HCI Command: LE Read Supported St.. (0x08|0x001c) plen 0  #21 [hci1] 0.984272
> HCI Event: Command Complete (0x0e) plen 12                #22 [hci1] 0.984754
      LE Read Supported States (0x08|0x001c) ncmd 1
        Status: Success (0x00)
        States: 0x000003ff3e0306ff
          Non-connectable Advertising State
          Scannable Advertising State
          Connectable Advertising State
          High Duty Cycle Directed Advertising State
          Passive Scanning State
          Active Scanning State
          Initiating State
            and Connection State (Central Role)
          Connection State (Peripheral Role)
          Scannable Advertising State
            and Passive Scanning State
          Connectable Advertising State
            and Passive Scanning State
          Non-connectable Advertising State
            and Initiating State
          Scannable Advertising State
            and Initiating State
          Active Scanning State
            and Connection State (Central Role)
          Passive Scanning State
            and Connection State (Peripheral Role)
          Active Scanning State
            and Connection State (Peripheral Role)
          Initiating State
            and Connection State (Central Role)
            and Central Role & Central Role
          Low Duty Cycle Directed Advertising State
          Connectable Advertising State
            and Initiating State
            and Central Role & Peripheral Role
          High Duty Cycle Directed Advertising State
            and Initiating State
            and Central Role & Peripheral Role
          Low Duty Cycle Directed Advertising State
            and Initiating State
            and Central Role & Peripheral Role
          Connectable Advertising State
            and Connection State (Central Role)
            and Central Role & Peripheral Role
          High Duty Cycle Directed Advertising State
            and Connection State (Central Role)
            and Central Role & Peripheral Role
          Low Duty Cycle Directed Advertising State
            and Connection State (Central Role)
            and Central Role & Peripheral Role
          Connectable Advertising State
            and Connection State (Peripheral Role)
            and Central Role & Peripheral Role
          High Duty Cycle Directed Advertising State
            and Connection State (Peripheral Role)
            and Peripheral Role & Peripheral Role
          Low Duty Cycle Directed Advertising State
            and Connection State (Peripheral Role)
            and Peripheral Role & Peripheral Role
          Initiating State
            and Connection State (Peripheral Role)
            and Central Role & Peripheral Role
< HCI Command: LE Read Maximum Data.. (0x08|0x002f) plen 0  #23 [hci1] 1.004271
> HCI Event: Command Complete (0x0e) plen 12                #24 [hci1] 1.004796
      LE Read Maximum Data Length (0x08|0x002f) ncmd 1
        Status: Success (0x00)
        Max TX octets: 251
        Max TX time: 2704
        Max RX octets: 251
        Max RX time: 2704
< HCI Command: LE Write Suggested D.. (0x08|0x0024) plen 4  #25 [hci1] 1.024238
        TX octets: 251
        TX time: 2704
> HCI Event: Command Complete (0x0e) plen 4                 #26 [hci1] 1.024759
      LE Write Suggested Default Data Length (0x08|0x0024) ncmd 1
        Status: Success (0x00)
< HCI Command: LE Read Resolving Li.. (0x08|0x002a) plen 0  #27 [hci1] 1.044246
> HCI Event: Command Complete (0x0e) plen 5                 #28 [hci1] 1.044704
      LE Read Resolving List Size (0x08|0x002a) ncmd 1
        Status: Success (0x00)
        Size: 8
< HCI Command: LE Set Event Mask (0x08|0x0001) plen 8       #29 [hci1] 1.064243
        Mask: 0x000002023f87fa5e
          LE Advertising Report
          LE Connection Update Complete
          LE Read Remote Used Features Complete
          LE Long Term Key Request
          LE Data Length Change
          LE Enhanced Connection Complete
          LE PHY Update Complete
          LE Extended Advertising Report
          LE Periodic Advertising Sync Established
          LE Periodic Advertising Report
          LE Periodic Advertising Sync Lost
          LE Extended Scan Timeout
          LE Extended Advertising Set Terminated
          LE Scan Request Received
          LE Periodic Advertising Sync Transfer Rvc
          LE CIS Established
          LE CIS Request
          LE Create BIG Complete
          LE Terminate BIG Complete
          LE BIG Sync Estabilished Complete
          LE BIG Sync Lost
          LE BIG Info Advertising Report
          Unknown mask (0x0000020000000000)
> HCI Event: Command Complete (0x0e) plen 4                 #30 [hci1] 1.064765
      LE Set Event Mask (0x08|0x0001) ncmd 1
        Status: Success (0x00)
< HCI Command: Set Event Mask (0x03|0x0001) plen 8          #31 [hci1] 1.084239
        Mask: 0x2000800002008890
          Disconnection Complete
          Encryption Change
          Read Remote Version Information Complete
          Hardware Error
          Data Buffer Overflow
          Encryption Key Refresh Complete
          LE Meta
> HCI Event: Command Complete (0x0e) plen 4                 #32 [hci1] 1.084792
      Set Event Mask (0x03|0x0001) ncmd 1
        Status: Success (0x00)
< HCI Command: Read BD ADDR (0x04|0x0009) plen 0            #33 [hci1] 1.104247
> HCI Event: Command Complete (0x0e) plen 10                #34 [hci1] 1.104717
      Read BD ADDR (0x04|0x0009) ncmd 1
        Status: Success (0x00)
        Address: 00:00:00:00:00:00 (OUI 00-00-00)
< HCI Command: LE Set Random Address (0x08|0x0005) plen 6   #35 [hci1] 1.124247
        Address: D5:B6:CC:31:DB:3B (Static)
> HCI Event: Command Complete (0x0e) plen 4                 #36 [hci1] 1.124752
      LE Set Random Address (0x08|0x0005) ncmd 1
        Status: Success (0x00)
< HCI Command: LE Set Extended Adv.. (0x08|0x0036) plen 25  #37 [hci1] 4.664956
        Handle: 0x00
        Properties: 0x0013
          Connectable
          Scannable
          Use legacy advertising PDUs: ADV_IND
        Min advertising interval: 100.000 msec (0x00a0)
        Max advertising interval: 150.000 msec (0x00f0)
        Channel map: 37, 38, 39 (0x07)
        Own address type: Random (0x01)
        Peer address type: Public (0x00)
        Peer address: 00:00:00:00:00:00 (OUI 00-00-00)
        Filter policy: Allow Scan Request from Any, Allow Connect Request from Any (0x00)
        TX power: Host has no preference (0x7f)
        Primary PHY: LE 1M (0x01)
        Secondary max skip: 0x00
        Secondary PHY: LE 1M (0x01)
        SID: 0x00
        Scan request notifications: Disabled (0x00)
> HCI Event: Command Complete (0x0e) plen 5                 #38 [hci1] 4.665887
      LE Set Extended Advertising Parameters (0x08|0x0036) ncmd 1
        Status: Success (0x00)
        TX power (selected): 0 dbm (0x00)
< HCI Command: LE Set Advertising S.. (0x08|0x0035) plen 7  #39 [hci1] 4.684310
        Advertising handle: 0x00
        Advertising random address: D5:B6:CC:31:DB:3B (Static)
> HCI Event: Command Complete (0x0e) plen 4                 #40 [hci1] 4.684813
      LE Set Advertising Set Random Address (0x08|0x0035) ncmd 1
        Status: Success (0x00)
< HCI Command: LE Set Extended Adv.. (0x08|0x0037) plen 22  #41 [hci1] 4.704259
        Handle: 0x00
        Operation: Complete extended advertising data (0x03)
        Fragment preference: Minimize fragmentation (0x01)
        Data length: 0x12
        Flags: 0x06
          LE General Discoverable Mode
          BR/EDR Not Supported
        Name (complete): Tester_F6B11A
> HCI Event: Command Complete (0x0e) plen 4                 #42 [hci1] 4.704987
      LE Set Extended Advertising Data (0x08|0x0037) ncmd 1
        Status: Success (0x00)
< HCI Command: LE Set Extended Scan.. (0x08|0x0038) plen 4  #43 [hci1] 4.724253
        Handle: 0x00
        Operation: Complete scan response data (0x03)
        Fragment preference: Minimize fragmentation (0x01)
        Data length: 0x00
> HCI Event: Command Complete (0x0e) plen 4                 #44 [hci1] 4.724718
      LE Set Extended Scan Response Data (0x08|0x0038) ncmd 1
        Status: Success (0x00)
< HCI Command: LE Set Extended Adve.. (0x08|0x0039) plen 6  #45 [hci1] 4.744304
        Extended advertising: Enabled (0x01)
        Number of sets: 1 (0x01)
        Entry 0
          Handle: 0x00
          Duration: 0 ms (0x00)
          Max ext adv events: 0
> HCI Event: Command Complete (0x0e) plen 4                 #46 [hci1] 4.744955
      LE Set Extended Advertising Enable (0x08|0x0039) ncmd 1
        Status: Success (0x00)
> HCI Event: LE Meta Event (0x3e) plen 31                   #47 [hci1] 4.856403
      LE Enhanced Connection Complete (0x0a)
        Status: Success (0x00)
        Handle: 1209
        Role: Peripheral (0x01)
        Peer address type: Public (0x00)
        Peer address: DF:A9:FF:F6:B1:1A (OUI DF-A9-FF)
        Local resolvable private address: 00:00:00:00:00:00 (Non-Resolvable)
        Peer resolvable private address: 00:00:00:00:00:00 (Non-Resolvable)
        Connection interval: 87.50 msec (0x0046)
        Connection latency: 0 (0x0000)
        Supervision timeout: 25120 msec (0x09d0)
        Central clock accuracy: 0x01
> HCI Event: LE Meta Event (0x3e) plen 6                    #48 [hci1] 4.856552
      LE Advertising Set Terminated (0x12)
        Status: Success (0x00)
        Handle: 0
        Connection handle: 1209
        Number of completed extended advertising events: 0
< HCI Command: LE Read Remote Used... (0x08|0x0016) plen 2  #49 [hci1] 4.865295
        Handle: 1209 Address: DF:A9:FF:F6:B1:1A (OUI DF-A9-FF)
< ACL Data TX: Handle 1209 flags 0x00 dlen 7                #50 [hci1] 4.865332
      ATT: Exchange MTU Request (0x02) len 2
        Client RX MTU: 251
> HCI Event: Command Status (0x0f) plen 4                   #51 [hci1] 4.865849
      LE Read Remote Used Features (0x08|0x0016) ncmd 1
        Status: Success (0x00)
> HCI Event: Number of Completed Packets (0x13) plen 5      #52 [hci1] 5.032424
        Num handles: 1
        Handle: 1209 Address: DF:A9:FF:F6:B1:1A (OUI DF-A9-FF)
        Count: 1
        #50: len 7 (0 Kb/s)
        Latency: 167 msec (167-167 msec ~167 msec)
> HCI Event: LE Meta Event (0x3e) plen 12                   #53 [hci1] 5.120285
      LE Read Remote Used Features (0x04)
        Status: Success (0x00)
        Handle: 1209 Address: DF:A9:FF:F6:B1:1A (OUI DF-A9-FF)
        Features: 0x2d 0x49 0x00 0xf7 0x67 0xd9 0x00 0x80
          LE Encryption
          Extended Reject Indication
          Peripheral-initiated Features Exchange
          LE Data Packet Length Extension
          LE 2M PHY
          LE Coded PHY
          Channel Selection Algorithm #2
          Periodic Advertising Sync Transfer - Sender
          Periodic Advertising Sync Transfer - Recipient
          Sleep Clock Accuracy Updates
          Connected Isochronous Stream - Central
          Connected Isochronous Stream - Peripheral
          Isochronous Broadcaster
          Synchronized Receiver
          Connected Isochronous Stream (Host Support)
          LE Power Control Request
          LE Power Control Request
          Connection Subrating
          Connection Subrating (Host Support)
          Unknown features (0x8000d90000000000)
> ACL Data RX: Handle 1209 flags 0x02 dlen 11               #54 [hci1] 7.570029
      SMP: Pairing Request (0x01) len 6
        IO capability: KeyboardDisplay (0x04)
        OOB data: Authentication data not present (0x00)
        Authentication requirement: Bonding, No MITM, SC, No Keypresses (0x09)
        Max encryption key size: 16
        Initiator key distribution: EncKey IdKey (0x03)
        Responder key distribution: EncKey IdKey Sign (0x07)
> ACL Data RX: Handle 1209 flags 0x02 dlen 7                #55 [hci1] 7.570498
      ATT: Exchange MTU Response (0x03) len 2
        Server RX MTU: 23
< HCI Command: Host Number of Compl.. (0x03|0x0035) plen 5  #56 [hci1] 7.584877
        Num handles: 1
        Handle: 1209 Address: DF:A9:FF:F6:B1:1A (OUI DF-A9-FF)
        Count: 1
< ACL Data TX: Handle 1209 flags 0x00 dlen 11               #57 [hci1] 7.584934
      SMP: Pairing Response (0x02) len 6
        IO capability: DisplayOnly (0x00)
        OOB data: Authentication data not present (0x00)
        Authentication requirement: Bonding, No MITM, SC, No Keypresses (0x09)
        Max encryption key size: 16
        Initiator key distribution: IdKey (0x02)
        Responder key distribution: <none> (0x00)
< HCI Command: Host Number of Compl.. (0x03|0x0035) plen 5  #58 [hci1] 7.585216
        Num handles: 1
        Handle: 1209 Address: DF:A9:FF:F6:B1:1A (OUI DF-A9-FF)
        Count: 1
> HCI Event: Number of Completed Packets (0x13) plen 5      #59 [hci1] 7.745269
        Num handles: 1
        Handle: 1209 Address: DF:A9:FF:F6:B1:1A (OUI DF-A9-FF)
        Count: 1
        #57: len 11 (0 Kb/s)
        Latency: 160 msec (160-167 msec ~163 msec)
> ACL Data RX: Handle 1209 flags 0x02 dlen 27               #60 [hci1] 7.745423
> ACL Data RX: Handle 1209 flags 0x01 dlen 27               #61 [hci1] 7.745977
> ACL Data RX: Handle 1209 flags 0x01 dlen 15               #62 [hci1] 7.746456
      SMP: Pairing Public Key (0x0c) len 64
        X: 8b0fa05050141efea42a2c313a5fca803182cd7175eadc11d399bf7528b76c09
        Y: b0d9d6d9f483f91d0a4370617de7a1653edc254bafec486d160cc9ac4c57fee5
< HCI Command: Host Number of Compl.. (0x03|0x0035) plen 5  #63 [hci1] 7.765115
        Num handles: 1
        Handle: 1209 Address: DF:A9:FF:F6:B1:1A (OUI DF-A9-FF)
        Count: 1
< HCI Command: Host Number of Compl.. (0x03|0x0035) plen 5  #64 [hci1] 7.765164
        Num handles: 1
        Handle: 1209 Address: DF:A9:FF:F6:B1:1A (OUI DF-A9-FF)
        Count: 1
< HCI Command: Host Number of Compl.. (0x03|0x0035) plen 5  #65 [hci1] 7.765486
        Num handles: 1
        Handle: 1209 Address: DF:A9:FF:F6:B1:1A (OUI DF-A9-FF)
        Count: 1
< ACL Data TX: Handle 1209 flags 0x00 dlen 27               #66 [hci1] 7.765555
< ACL Data TX: Handle 1209 flags 0x01 dlen 27               #67 [hci1] 7.765578
< ACL Data TX: Handle 1209 flags 0x01 dlen 15               #68 [hci1] 7.765662
      SMP: Pairing Public Key (0x0c) len 64
        X: 98308440221e2d910f0e54b71e7ec652857aa9b5a0dc65028824cc19db1226e9
        Y: 67a4816bcb62efb21701e31fdb27561a6217575fb007a8bbdabe7e28b6f68482
> HCI Event: Number of Completed Packets (0x13) plen 5      #69 [hci1] 7.833084
        Num handles: 1
        Handle: 1209 Address: DF:A9:FF:F6:B1:1A (OUI DF-A9-FF)
        Count: 1
        #66: len 27 (3 Kb/s)
        Latency: 67 msec (67-167 msec ~115 msec)
> HCI Event: Number of Completed Packets (0x13) plen 5      #70 [hci1] 7.833649
        Num handles: 1
        Handle: 1209 Address: DF:A9:FF:F6:B1:1A (OUI DF-A9-FF)
        Count: 1
        #67: len 27 (3 Kb/s)
        Latency: 68 msec (67-167 msec ~91 msec)
< ACL Data TX: Handle 1209 flags 0x00 dlen 21               #71 [hci1] 7.844670
      SMP: Pairing Confirm (0x03) len 16
        Confim value: 864470d25ac86c502211708fb044e696
> HCI Event: Number of Completed Packets (0x13) plen 5      #72 [hci1] 7.919969
        Num handles: 1
        Handle: 1209 Address: DF:A9:FF:F6:B1:1A (OUI DF-A9-FF)
        Count: 1
        #68: len 15 (0 Kb/s)
        Latency: 154 msec (67-167 msec ~123 msec)
> HCI Event: Number of Completed Packets (0x13) plen 5      #73 [hci1] 8.007659
        Num handles: 1
        Handle: 1209 Address: DF:A9:FF:F6:B1:1A (OUI DF-A9-FF)
        Count: 1
        #71: len 21 (1 Kb/s)
        Latency: 162 msec (67-167 msec ~143 msec)
> ACL Data RX: Handle 1209 flags 0x02 dlen 21               #74 [hci1] 8.007965
      SMP: Pairing Random (0x04) len 16
        Random value: c9d14cbc6c4bc1e00000000000000000
< HCI Command: Host Number of Compl.. (0x03|0x0035) plen 5  #75 [hci1] 8.025034
        Num handles: 1
        Handle: 1209 Address: DF:A9:FF:F6:B1:1A (OUI DF-A9-FF)
        Count: 1
< ACL Data TX: Handle 1209 flags 0x00 dlen 21               #76 [hci1] 8.025112
      SMP: Pairing Random (0x04) len 16
        Random value: 8e6108f966a694cbe26df70bb96773e6
> HCI Event: Number of Completed Packets (0x13) plen 5      #77 [hci1] 8.182355
        Num handles: 1
        Handle: 1209 Address: DF:A9:FF:F6:B1:1A (OUI DF-A9-FF)
        Count: 1
        #76: len 21 (1 Kb/s)
        Latency: 157 msec (67-167 msec ~150 msec)
> ACL Data RX: Handle 1209 flags 0x02 dlen 21               #78 [hci1] 8.357783
      SMP: Pairing DHKey Check (0x0d) len 16
        E: ac2afe400f0fd4caef8557c3d2b37b20
< HCI Command: Host Number of Compl.. (0x03|0x0035) plen 5  #79 [hci1] 8.365082
        Num handles: 1
        Handle: 1209 Address: DF:A9:FF:F6:B1:1A (OUI DF-A9-FF)
        Count: 1
< ACL Data TX: Handle 1209 flags 0x00 dlen 21               #80 [hci1] 8.365150
      SMP: Pairing DHKey Check (0x0d) len 16
        E: 5dfaebc0f0c20b8798301da277b229e2
> HCI Event: Number of Completed Packets (0x13) plen 5      #81 [hci1] 8.532305
        Num handles: 1
        Handle: 1209 Address: DF:A9:FF:F6:B1:1A (OUI DF-A9-FF)
        Count: 1
        #80: len 21 (1 Kb/s)
        Latency: 167 msec (67-167 msec ~158 msec)
> HCI Event: LE Meta Event (0x3e) plen 13                   #82 [hci1] 8.620504
      LE Long Term Key Request (0x05)
        Handle: 1209 Address: DF:A9:FF:F6:B1:1A (OUI DF-A9-FF)
        Random number: 0x0000000000000000
        Encrypted diversifier: 0x0000
< HCI Command: LE Long Term Key Re.. (0x08|0x001a) plen 18  #83 [hci1] 8.624693
        Handle: 1209 Address: DF:A9:FF:F6:B1:1A (OUI DF-A9-FF)
        Long term key: e83e2f77bed76b1204b3cbdd90ab0ef0
> HCI Event: Command Complete (0x0e) plen 6                 #84 [hci1] 8.625428
      LE Long Term Key Request Reply (0x08|0x001a) ncmd 1
        Status: Success (0x00)
        Handle: 1209 Address: DF:A9:FF:F6:B1:1A (OUI DF-A9-FF)
> HCI Event: Encryption Change (0x08) plen 4                #85 [hci1] 9.057632
        Status: Success (0x00)
        Handle: 1209 Address: DF:A9:FF:F6:B1:1A (OUI DF-A9-FF)
        Encryption: Enabled with AES-CCM (0x01)
> ACL Data RX: Handle 1209 flags 0x02 dlen 21               #86 [hci1] 9.145209
      SMP: Identity Information (0x08) len 16
        Identity resolving key: a152f1337f14db1ffc1c87117fc72981
< HCI Command: Host Number of Compl.. (0x03|0x0035) plen 5  #87 [hci1] 9.175167
        Num handles: 1
        Handle: 1209 Address: DF:A9:FF:F6:B1:1A (OUI DF-A9-FF)
        Count: 1
> ACL Data RX: Handle 1209 flags 0x02 dlen 12               #88 [hci1] 9.320221
      SMP: Identity Address Information (0x09) len 7
        Address: DF:A9:FF:F6:B1:1A (OUI DF-A9-FF)
< HCI Command: LE Add Device To Re.. (0x08|0x0027) plen 39  #89 [hci1] 9.324913
        Address type: Public (0x00)
        Address: DF:A9:FF:F6:B1:1A (OUI DF-A9-FF)
        Peer identity resolving key: a152f1337f14db1ffc1c87117fc72981
        Local identity resolving key: 00000000000000000000000000000000
> HCI Event: Command Complete (0x0e) plen 4                 #90 [hci1] 9.325929
      LE Add Device To Resolving List (0x08|0x0027) ncmd 1
        Status: Success (0x00)
< HCI Command: LE Set Privacy Mode (0x08|0x004e) plen 8     #91 [hci1] 9.344652
        Peer Identity address type: Public (0x00)
        Peer Identity address: DF:A9:FF:F6:B1:1A (OUI DF-A9-FF)
        Privacy Mode: Use Device Privacy (0x01)
> HCI Event: Command Complete (0x0e) plen 4                 #92 [hci1] 9.345210
      LE Set Privacy Mode (0x08|0x004e) ncmd 1
        Status: Success (0x00)
< HCI Command: LE Set Address Resol.. (0x08|0x002d) plen 1  #93 [hci1] 9.364689
        Address resolution: Enabled (0x01)
> HCI Event: Command Complete (0x0e) plen 4                 #94 [hci1] 9.365213
      LE Set Address Resolution Enable (0x08|0x002d) ncmd 1
        Status: Success (0x00)
< HCI Command: Host Number of Compl.. (0x03|0x0035) plen 5  #95 [hci1] 9.384627
        Num handles: 1
        Handle: 1209 Address: DF:A9:FF:F6:B1:1A (OUI DF-A9-FF)
        Count: 1
> ACL Data RX: Handle 1209 flags 0x02 dlen 13               #96 [hci1] 9.407582
      ATT: Find By Type Value Request (0x06) len 8
        Handle range: 0x0001-0xffff
        Attribute type: Primary Service (0x2800)
          UUID: Generic Media Control (0x1849)
< HCI Command: Host Number of Compl.. (0x03|0x0035) plen 5  #97 [hci1] 9.425037
        Num handles: 1
        Handle: 1209 Address: DF:A9:FF:F6:B1:1A (OUI DF-A9-FF)
        Count: 1
< ACL Data TX: Handle 1209 flags 0x00 dlen 9                #98 [hci1] 9.425120
      ATT: Find By Type Value Response (0x07) len 4
        Handle range: 0x0037-0x0075
> HCI Event: Number of Completed Packets (0x13) plen 5      #99 [hci1] 9.582511
        Num handles: 1
        Handle: 1209 Address: DF:A9:FF:F6:B1:1A (OUI DF-A9-FF)
        Count: 1
        #98: len 9 (0 Kb/s)
        Latency: 157 msec (67-167 msec ~158 msec)
> ACL Data RX: Handle 1209 flags 0x02 dlen 13              #100 [hci1] 9.582772
      ATT: Find By Type Value Request (0x06) len 8
        Handle range: 0x0076-0xffff
        Attribute type: Primary Service (0x2800)
          UUID: Generic Media Control (0x1849)
< HCI Command: Host Number of Comp.. (0x03|0x0035) plen 5  #101 [hci1] 9.584669
        Num handles: 1
        Handle: 1209 Address: DF:A9:FF:F6:B1:1A (OUI DF-A9-FF)
        Count: 1
< ACL Data TX: Handle 1209 flags 0x00 dlen 9               #102 [hci1] 9.584768
      ATT: Error Response (0x01) len 4
        Find By Type Value Request (0x06)
        Handle: 0x0076
        Error: Attribute Not Found (0x0a)
> HCI Event: Number of Completed Packets (0x13) plen 5     #103 [hci1] 9.757462
        Num handles: 1
        Handle: 1209 Address: DF:A9:FF:F6:B1:1A (OUI DF-A9-FF)
        Count: 1
        #102: len 9 (0 Kb/s)
        Latency: 172 msec (67-172 msec ~165 msec)
> ACL Data RX: Handle 1209 flags 0x02 dlen 11              #104 [hci1] 9.757701
      ATT: Read By Type Request (0x08) len 6
        Handle range: 0x0037-0x0075
        Attribute type: Characteristic (0x2803)
< HCI Command: Host Number of Comp.. (0x03|0x0035) plen 5  #105 [hci1] 9.765019
        Num handles: 1
        Handle: 1209 Address: DF:A9:FF:F6:B1:1A (OUI DF-A9-FF)
        Count: 1
< ACL Data TX: Handle 1209 flags 0x00 dlen 20              #106 [hci1] 9.765097
      ATT: Read By Type Response (0x09) len 15
        Attribute data length: 7
        Attribute data list: 2 entries
        Handle: 0x0039
        Value: 123a00932b
            Properties: 0x12
              Read (0x02)
              Notify (0x10)
            Value Handle: 0x003a
            Value UUID: Media Player Name (0x2b93)
        Handle: 0x003c
        Value: 023d00942b
            Properties: 0x02
              Read (0x02)
            Value Handle: 0x003d
            Value UUID: Media Player Icon Object ID (0x2b94)
> HCI Event: Number of Completed Packets (0x13) plen 5     #107 [hci1] 9.932494
        Num handles: 1
        Handle: 1209 Address: DF:A9:FF:F6:B1:1A (OUI DF-A9-FF)
        Count: 1
        #106: len 20 (0 Kb/s)
        Latency: 167 msec (67-172 msec ~166 msec)
> ACL Data RX: Handle 1209 flags 0x02 dlen 11              #108 [hci1] 9.932748
      ATT: Read By Type Request (0x08) len 6
        Handle range: 0x003d-0x0075
        Attribute type: Characteristic (0x2803)
< HCI Command: Host Number of Comp.. (0x03|0x0035) plen 5  #109 [hci1] 9.945040
        Num handles: 1
        Handle: 1209 Address: DF:A9:FF:F6:B1:1A (OUI DF-A9-FF)
        Count: 1
< ACL Data TX: Handle 1209 flags 0x00 dlen 20              #110 [hci1] 9.945110
      ATT: Read By Type Response (0x09) len 15
        Attribute data length: 7
        Attribute data list: 2 entries
        Handle: 0x003e
        Value: 023f00952b
            Properties: 0x02
              Read (0x02)
            Value Handle: 0x003f
            Value UUID: Media Player Icon URL (0x2b95)
        Handle: 0x0040
        Value: 104100962b
            Properties: 0x10
              Notify (0x10)
            Value Handle: 0x0041
            Value UUID: Track Changed (0x2b96)
> HCI Event: Number of Completed Packets (0x13) plen 5    #111 [hci1] 10.107535
        Num handles: 1
        Handle: 1209 Address: DF:A9:FF:F6:B1:1A (OUI DF-A9-FF)
        Count: 1
        #110: len 20 (0 Kb/s)
        Latency: 162 msec (67-172 msec ~164 msec)
> ACL Data RX: Handle 1209 flags 0x02 dlen 11             #112 [hci1] 10.107751
      ATT: Read By Type Request (0x08) len 6
        Handle range: 0x0041-0x0075
        Attribute type: Characteristic (0x2803)
< HCI Command: Host Number of Com.. (0x03|0x0035) plen 5  #113 [hci1] 10.125056
        Num handles: 1
        Handle: 1209 Address: DF:A9:FF:F6:B1:1A (OUI DF-A9-FF)
        Count: 1
< ACL Data TX: Handle 1209 flags 0x00 dlen 20             #114 [hci1] 10.125134
      ATT: Read By Type Response (0x09) len 15
        Attribute data length: 7
        Attribute data list: 2 entries
        Handle: 0x0043
        Value: 124400972b
            Properties: 0x12
              Read (0x02)
              Notify (0x10)
            Value Handle: 0x0044
            Value UUID: Track Title (0x2b97)
        Handle: 0x0046
        Value: 124700982b
            Properties: 0x12
              Read (0x02)
              Notify (0x10)
            Value Handle: 0x0047
            Value UUID: Track Duration (0x2b98)
> HCI Event: Number of Completed Packets (0x13) plen 5    #115 [hci1] 10.282414
        Num handles: 1
        Handle: 1209 Address: DF:A9:FF:F6:B1:1A (OUI DF-A9-FF)
        Count: 1
        #114: len 20 (1 Kb/s)
        Latency: 157 msec (67-172 msec ~160 msec)
> ACL Data RX: Handle 1209 flags 0x02 dlen 11             #116 [hci1] 10.282707
      ATT: Read By Type Request (0x08) len 6
        Handle range: 0x0047-0x0075
        Attribute type: Characteristic (0x2803)
< HCI Command: Host Number of Com.. (0x03|0x0035) plen 5  #117 [hci1] 10.284911
        Num handles: 1
        Handle: 1209 Address: DF:A9:FF:F6:B1:1A (OUI DF-A9-FF)
        Count: 1
< ACL Data TX: Handle 1209 flags 0x00 dlen 20             #118 [hci1] 10.285026
      ATT: Read By Type Response (0x09) len 15
        Attribute data length: 7
        Attribute data list: 2 entries
        Handle: 0x0049
        Value: 1e4a00992b
            Properties: 0x1e
              Read (0x02)
              Write Without Response (0x04)
              Write (0x08)
              Notify (0x10)
            Value Handle: 0x004a
            Value UUID: Track Position (0x2b99)
        Handle: 0x004c
        Value: 1e4d009a2b
            Properties: 0x1e
              Read (0x02)
              Write Without Response (0x04)
              Write (0x08)
              Notify (0x10)
            Value Handle: 0x004d
            Value UUID: Playback Speed (0x2b9a)
> HCI Event: Number of Completed Packets (0x13) plen 5    #119 [hci1] 10.457483
        Num handles: 1
        Handle: 1209 Address: DF:A9:FF:F6:B1:1A (OUI DF-A9-FF)
        Count: 1
        #118: len 20 (0 Kb/s)
        Latency: 172 msec (67-172 msec ~166 msec)
> ACL Data RX: Handle 1209 flags 0x02 dlen 11             #120 [hci1] 10.457720
      ATT: Read By Type Request (0x08) len 6
        Handle range: 0x004d-0x0075
        Attribute type: Characteristic (0x2803)
< HCI Command: Host Number of Com.. (0x03|0x0035) plen 5  #121 [hci1] 10.465019
        Num handles: 1
        Handle: 1209 Address: DF:A9:FF:F6:B1:1A (OUI DF-A9-FF)
        Count: 1
< ACL Data TX: Handle 1209 flags 0x00 dlen 20             #122 [hci1] 10.465089
      ATT: Read By Type Response (0x09) len 15
        Attribute data length: 7
        Attribute data list: 2 entries
        Handle: 0x004f
        Value: 1250009b2b
            Properties: 0x12
              Read (0x02)
              Notify (0x10)
            Value Handle: 0x0050
            Value UUID: Seeking Speed (0x2b9b)
        Handle: 0x0052
        Value: 0253009c2b
            Properties: 0x02
              Read (0x02)
            Value Handle: 0x0053
            Value UUID: Current Track Segments Object ID (0x2b9c)
> HCI Event: Number of Completed Packets (0x13) plen 5    #123 [hci1] 10.632454
        Num handles: 1
        Handle: 1209 Address: DF:A9:FF:F6:B1:1A (OUI DF-A9-FF)
        Count: 1
        #122: len 20 (0 Kb/s)
        Latency: 167 msec (67-172 msec ~167 msec)
> ACL Data RX: Handle 1209 flags 0x02 dlen 11             #124 [hci1] 10.632734
      ATT: Read By Type Request (0x08) len 6
        Handle range: 0x0053-0x0075
        Attribute type: Characteristic (0x2803)
< HCI Command: Host Number of Com.. (0x03|0x0035) plen 5  #125 [hci1] 10.645261
        Num handles: 1
        Handle: 1209 Address: DF:A9:FF:F6:B1:1A (OUI DF-A9-FF)
        Count: 1
< ACL Data TX: Handle 1209 flags 0x00 dlen 20             #126 [hci1] 10.645285
      ATT: Read By Type Response (0x09) len 15
        Attribute data length: 7
        Attribute data list: 2 entries
        Handle: 0x0054
        Value: 1e55009d2b
            Properties: 0x1e
              Read (0x02)
              Write Without Response (0x04)
              Write (0x08)
              Notify (0x10)
            Value Handle: 0x0055
            Value UUID: Current Track Object ID (0x2b9d)
        Handle: 0x0057
        Value: 1e58009e2b
            Properties: 0x1e
              Read (0x02)
              Write Without Response (0x04)
              Write (0x08)
              Notify (0x10)
            Value Handle: 0x0058
            Value UUID: Next Track Object ID (0x2b9e)
> HCI Event: Number of Completed Packets (0x13) plen 5    #127 [hci1] 10.807468
        Num handles: 1
        Handle: 1209 Address: DF:A9:FF:F6:B1:1A (OUI DF-A9-FF)
        Count: 1
        #126: len 20 (0 Kb/s)
        Latency: 162 msec (67-172 msec ~164 msec)
> ACL Data RX: Handle 1209 flags 0x02 dlen 11             #128 [hci1] 10.807661
      ATT: Read By Type Request (0x08) len 6
        Handle range: 0x0058-0x0075
        Attribute type: Characteristic (0x2803)
< HCI Command: Host Number of Com.. (0x03|0x0035) plen 5  #129 [hci1] 10.824961
        Num handles: 1
        Handle: 1209 Address: DF:A9:FF:F6:B1:1A (OUI DF-A9-FF)
        Count: 1
< ACL Data TX: Handle 1209 flags 0x00 dlen 20             #130 [hci1] 10.825065
      ATT: Read By Type Response (0x09) len 15
        Attribute data length: 7
        Attribute data list: 2 entries
        Handle: 0x005a
        Value: 125b009f2b
            Properties: 0x12
              Read (0x02)
              Notify (0x10)
            Value Handle: 0x005b
            Value UUID: Parent Group Object ID (0x2b9f)
        Handle: 0x005d
        Value: 1e5e00a02b
            Properties: 0x1e
              Read (0x02)
              Write Without Response (0x04)
              Write (0x08)
              Notify (0x10)
            Value Handle: 0x005e
            Value UUID: Current Group Object ID (0x2ba0)
> HCI Event: Number of Completed Packets (0x13) plen 5    #131 [hci1] 10.982512
        Num handles: 1
        Handle: 1209 Address: DF:A9:FF:F6:B1:1A (OUI DF-A9-FF)
        Count: 1
        #130: len 20 (1 Kb/s)
        Latency: 157 msec (67-172 msec ~161 msec)
> ACL Data RX: Handle 1209 flags 0x02 dlen 11             #132 [hci1] 10.982781
      ATT: Read By Type Request (0x08) len 6
        Handle range: 0x005e-0x0075
        Attribute type: Characteristic (0x2803)
< HCI Command: Host Number of Com.. (0x03|0x0035) plen 5  #133 [hci1] 10.985065
        Num handles: 1
        Handle: 1209 Address: DF:A9:FF:F6:B1:1A (OUI DF-A9-FF)
        Count: 1
< ACL Data TX: Handle 1209 flags 0x00 dlen 20             #134 [hci1] 10.985149
      ATT: Read By Type Response (0x09) len 15
        Attribute data length: 7
        Attribute data list: 2 entries
        Handle: 0x0060
        Value: 1e6100a12b
            Properties: 0x1e
              Read (0x02)
              Write Without Response (0x04)
              Write (0x08)
              Notify (0x10)
            Value Handle: 0x0061
            Value UUID: Playing Order (0x2ba1)
        Handle: 0x0063
        Value: 026400a22b
            Properties: 0x02
              Read (0x02)
            Value Handle: 0x0064
            Value UUID: Playing Orders Supported (0x2ba2)
> HCI Event: Number of Completed Packets (0x13) plen 5    #135 [hci1] 11.157536
        Num handles: 1
        Handle: 1209 Address: DF:A9:FF:F6:B1:1A (OUI DF-A9-FF)
        Count: 1
        #134: len 20 (0 Kb/s)
        Latency: 172 msec (67-172 msec ~166 msec)
> ACL Data RX: Handle 1209 flags 0x02 dlen 11             #136 [hci1] 11.157661
      ATT: Read By Type Request (0x08) len 6
        Handle range: 0x0064-0x0075
        Attribute type: Characteristic (0x2803)
< HCI Command: Host Number of Com.. (0x03|0x0035) plen 5  #137 [hci1] 11.164901
        Num handles: 1
        Handle: 1209 Address: DF:A9:FF:F6:B1:1A (OUI DF-A9-FF)
        Count: 1
< ACL Data TX: Handle 1209 flags 0x00 dlen 20             #138 [hci1] 11.165042
      ATT: Read By Type Response (0x09) len 15
        Attribute data length: 7
        Attribute data list: 2 entries
        Handle: 0x0065
        Value: 126600a32b
            Properties: 0x12
              Read (0x02)
              Notify (0x10)
            Value Handle: 0x0066
            Value UUID: Media State (0x2ba3)
        Handle: 0x0068
        Value: 1c6900a42b
            Properties: 0x1c
              Write Without Response (0x04)
              Write (0x08)
              Notify (0x10)
            Value Handle: 0x0069
            Value UUID: Media Control Point (0x2ba4)
> HCI Event: Number of Completed Packets (0x13) plen 5    #139 [hci1] 11.332510
        Num handles: 1
        Handle: 1209 Address: DF:A9:FF:F6:B1:1A (OUI DF-A9-FF)
        Count: 1
        #138: len 20 (0 Kb/s)
        Latency: 167 msec (67-172 msec ~167 msec)
> ACL Data RX: Handle 1209 flags 0x02 dlen 11             #140 [hci1] 11.332755
      ATT: Read By Type Request (0x08) len 6
        Handle range: 0x0069-0x0075
        Attribute type: Characteristic (0x2803)
< HCI Command: Host Number of Com.. (0x03|0x0035) plen 5  #141 [hci1] 11.344982
        Num handles: 1
        Handle: 1209 Address: DF:A9:FF:F6:B1:1A (OUI DF-A9-FF)
        Count: 1
< ACL Data TX: Handle 1209 flags 0x00 dlen 20             #142 [hci1] 11.345210
      ATT: Read By Type Response (0x09) len 15
        Attribute data length: 7
        Attribute data list: 2 entries
        Handle: 0x006b
        Value: 126c00a52b
            Properties: 0x12
              Read (0x02)
              Notify (0x10)
            Value Handle: 0x006c
            Value UUID: Media Control Point Opcodes Supported (0x2ba5)
        Handle: 0x006e
        Value: 1c6f00a72b
            Properties: 0x1c
              Write Without Response (0x04)
              Write (0x08)
              Notify (0x10)
            Value Handle: 0x006f
            Value UUID: Search Control Point (0x2ba7)
> HCI Event: Number of Completed Packets (0x13) plen 5    #143 [hci1] 11.507530
        Num handles: 1
        Handle: 1209 Address: DF:A9:FF:F6:B1:1A (OUI DF-A9-FF)
        Count: 1
        #142: len 20 (0 Kb/s)
        Latency: 162 msec (67-172 msec ~164 msec)
> ACL Data RX: Handle 1209 flags 0x02 dlen 11             #144 [hci1] 11.507809
      ATT: Read By Type Request (0x08) len 6
        Handle range: 0x006f-0x0075
        Attribute type: Characteristic (0x2803)
< HCI Command: Host Number of Com.. (0x03|0x0035) plen 5  #145 [hci1] 11.525006
        Num handles: 1
        Handle: 1209 Address: DF:A9:FF:F6:B1:1A (OUI DF-A9-FF)
        Count: 1
< ACL Data TX: Handle 1209 flags 0x00 dlen 20             #146 [hci1] 11.525052
      ATT: Read By Type Response (0x09) len 15
        Attribute data length: 7
        Attribute data list: 2 entries
        Handle: 0x0071
        Value: 127200a62b
            Properties: 0x12
              Read (0x02)
              Notify (0x10)
            Value Handle: 0x0072
            Value UUID: Search Results Object ID (0x2ba6)
        Handle: 0x0074
        Value: 027500ba2b
            Properties: 0x02
              Read (0x02)
            Value Handle: 0x0075
            Value UUID: Content Control ID (0x2bba)
> HCI Event: Number of Completed Packets (0x13) plen 5    #147 [hci1] 11.682457
        Num handles: 1
        Handle: 1209 Address: DF:A9:FF:F6:B1:1A (OUI DF-A9-FF)
        Count: 1
        #146: len 20 (1 Kb/s)
        Latency: 157 msec (67-172 msec ~161 msec)
> ACL Data RX: Handle 1209 flags 0x02 dlen 11             #148 [hci1] 11.682733
      ATT: Read By Type Request (0x08) len 6
        Handle range: 0x0075-0x0075
        Attribute type: Characteristic (0x2803)
< HCI Command: Host Number of Com.. (0x03|0x0035) plen 5  #149 [hci1] 11.685034
        Num handles: 1
        Handle: 1209 Address: DF:A9:FF:F6:B1:1A (OUI DF-A9-FF)
        Count: 1
< ACL Data TX: Handle 1209 flags 0x00 dlen 9              #150 [hci1] 11.685252
      ATT: Error Response (0x01) len 4
        Read By Type Request (0x08)
        Handle: 0x0075
        Error: Attribute Not Found (0x0a)
> HCI Event: Number of Completed Packets (0x13) plen 5    #151 [hci1] 11.857437
        Num handles: 1
        Handle: 1209 Address: DF:A9:FF:F6:B1:1A (OUI DF-A9-FF)
        Count: 1
        #150: len 9 (0 Kb/s)
        Latency: 172 msec (67-172 msec ~166 msec)
> ACL Data RX: Handle 1209 flags 0x02 dlen 9              #152 [hci1] 11.857725
      ATT: Find Information Request (0x04) len 4
        Handle range: 0x003b-0x003b
< HCI Command: Host Number of Com.. (0x03|0x0035) plen 5  #153 [hci1] 11.864990
        Num handles: 1
        Handle: 1209 Address: DF:A9:FF:F6:B1:1A (OUI DF-A9-FF)
        Count: 1
< ACL Data TX: Handle 1209 flags 0x00 dlen 10             #154 [hci1] 11.865079
      ATT: Find Information Response (0x05) len 5
        Format: UUID-16 (0x01)
        Handle: 0x003b
        UUID: Client Characteristic Configuration (0x2902)
> HCI Event: Number of Completed Packets (0x13) plen 5    #155 [hci1] 12.032567
        Num handles: 1
        Handle: 1209 Address: DF:A9:FF:F6:B1:1A (OUI DF-A9-FF)
        Count: 1
        #154: len 10 (0 Kb/s)
        Latency: 167 msec (67-172 msec ~167 msec)
> ACL Data RX: Handle 1209 flags 0x02 dlen 9              #156 [hci1] 12.032693
      ATT: Find Information Request (0x04) len 4
        Handle range: 0x0042-0x0042
< HCI Command: Host Number of Com.. (0x03|0x0035) plen 5  #157 [hci1] 12.044990
        Num handles: 1
        Handle: 1209 Address: DF:A9:FF:F6:B1:1A (OUI DF-A9-FF)
        Count: 1
< ACL Data TX: Handle 1209 flags 0x00 dlen 10             #158 [hci1] 12.045107
      ATT: Find Information Response (0x05) len 5
        Format: UUID-16 (0x01)
        Handle: 0x0042
        UUID: Client Characteristic Configuration (0x2902)
> HCI Event: Number of Completed Packets (0x13) plen 5    #159 [hci1] 12.207437
        Num handles: 1
        Handle: 1209 Address: DF:A9:FF:F6:B1:1A (OUI DF-A9-FF)
        Count: 1
        #158: len 10 (0 Kb/s)
        Latency: 162 msec (67-172 msec ~164 msec)
> ACL Data RX: Handle 1209 flags 0x02 dlen 9              #160 [hci1] 12.207734
      ATT: Find Information Request (0x04) len 4
        Handle range: 0x0045-0x0045
< HCI Command: Host Number of Com.. (0x03|0x0035) plen 5  #161 [hci1] 12.224994
        Num handles: 1
        Handle: 1209 Address: DF:A9:FF:F6:B1:1A (OUI DF-A9-FF)
        Count: 1
< ACL Data TX: Handle 1209 flags 0x00 dlen 10             #162 [hci1] 12.225069
      ATT: Find Information Response (0x05) len 5
        Format: UUID-16 (0x01)
        Handle: 0x0045
        UUID: Client Characteristic Configuration (0x2902)
> HCI Event: Number of Completed Packets (0x13) plen 5    #163 [hci1] 12.382451
        Num handles: 1
        Handle: 1209 Address: DF:A9:FF:F6:B1:1A (OUI DF-A9-FF)
        Count: 1
        #162: len 10 (0 Kb/s)
        Latency: 157 msec (67-172 msec ~161 msec)
> ACL Data RX: Handle 1209 flags 0x02 dlen 9              #164 [hci1] 12.382652
      ATT: Find Information Request (0x04) len 4
        Handle range: 0x0048-0x0048
< HCI Command: Host Number of Com.. (0x03|0x0035) plen 5  #165 [hci1] 12.384978
        Num handles: 1
        Handle: 1209 Address: DF:A9:FF:F6:B1:1A (OUI DF-A9-FF)
        Count: 1
< ACL Data TX: Handle 1209 flags 0x00 dlen 10             #166 [hci1] 12.385090
      ATT: Find Information Response (0x05) len 5
        Format: UUID-16 (0x01)
        Handle: 0x0048
        UUID: Client Characteristic Configuration (0x2902)
> HCI Event: Number of Completed Packets (0x13) plen 5    #167 [hci1] 12.557444
        Num handles: 1
        Handle: 1209 Address: DF:A9:FF:F6:B1:1A (OUI DF-A9-FF)
        Count: 1
        #166: len 10 (0 Kb/s)
        Latency: 172 msec (67-172 msec ~166 msec)
> ACL Data RX: Handle 1209 flags 0x02 dlen 9              #168 [hci1] 12.557622
      ATT: Find Information Request (0x04) len 4
        Handle range: 0x004b-0x004b
< HCI Command: Host Number of Com.. (0x03|0x0035) plen 5  #169 [hci1] 12.565039
        Num handles: 1
        Handle: 1209 Address: DF:A9:FF:F6:B1:1A (OUI DF-A9-FF)
        Count: 1
< ACL Data TX: Handle 1209 flags 0x00 dlen 10             #170 [hci1] 12.565184
      ATT: Find Information Response (0x05) len 5
        Format: UUID-16 (0x01)
        Handle: 0x004b
        UUID: Client Characteristic Configuration (0x2902)
> HCI Event: Number of Completed Packets (0x13) plen 5    #171 [hci1] 12.732430
        Num handles: 1
        Handle: 1209 Address: DF:A9:FF:F6:B1:1A (OUI DF-A9-FF)
        Count: 1
        #170: len 10 (0 Kb/s)
        Latency: 167 msec (67-172 msec ~166 msec)
> ACL Data RX: Handle 1209 flags 0x02 dlen 9              #172 [hci1] 12.732677
      ATT: Find Information Request (0x04) len 4
        Handle range: 0x004e-0x004e
< HCI Command: Host Number of Com.. (0x03|0x0035) plen 5  #173 [hci1] 12.744877
        Num handles: 1
        Handle: 1209 Address: DF:A9:FF:F6:B1:1A (OUI DF-A9-FF)
        Count: 1
< ACL Data TX: Handle 1209 flags 0x00 dlen 10             #174 [hci1] 12.744990
      ATT: Find Information Response (0x05) len 5
        Format: UUID-16 (0x01)
        Handle: 0x004e
        UUID: Client Characteristic Configuration (0x2902)
> HCI Event: Number of Completed Packets (0x13) plen 5    #175 [hci1] 12.907419
        Num handles: 1
        Handle: 1209 Address: DF:A9:FF:F6:B1:1A (OUI DF-A9-FF)
        Count: 1
        #174: len 10 (0 Kb/s)
        Latency: 162 msec (67-172 msec ~164 msec)
> ACL Data RX: Handle 1209 flags 0x02 dlen 9              #176 [hci1] 12.907600
      ATT: Find Information Request (0x04) len 4
        Handle range: 0x0051-0x0051
< HCI Command: Host Number of Com.. (0x03|0x0035) plen 5  #177 [hci1] 12.924918
        Num handles: 1
        Handle: 1209 Address: DF:A9:FF:F6:B1:1A (OUI DF-A9-FF)
        Count: 1
< ACL Data TX: Handle 1209 flags 0x00 dlen 10             #178 [hci1] 12.924984
      ATT: Find Information Response (0x05) len 5
        Format: UUID-16 (0x01)
        Handle: 0x0051
        UUID: Client Characteristic Configuration (0x2902)
> HCI Event: Number of Completed Packets (0x13) plen 5    #179 [hci1] 13.082444
        Num handles: 1
        Handle: 1209 Address: DF:A9:FF:F6:B1:1A (OUI DF-A9-FF)
        Count: 1
        #178: len 10 (0 Kb/s)
        Latency: 157 msec (67-172 msec ~161 msec)
> ACL Data RX: Handle 1209 flags 0x02 dlen 9              #180 [hci1] 13.082675
      ATT: Find Information Request (0x04) len 4
        Handle range: 0x0056-0x0056
< HCI Command: Host Number of Com.. (0x03|0x0035) plen 5  #181 [hci1] 13.084928
        Num handles: 1
        Handle: 1209 Address: DF:A9:FF:F6:B1:1A (OUI DF-A9-FF)
        Count: 1
< ACL Data TX: Handle 1209 flags 0x00 dlen 10             #182 [hci1] 13.085067
      ATT: Find Information Response (0x05) len 5
        Format: UUID-16 (0x01)
        Handle: 0x0056
        UUID: Client Characteristic Configuration (0x2902)
> HCI Event: Number of Completed Packets (0x13) plen 5    #183 [hci1] 13.257400
        Num handles: 1
        Handle: 1209 Address: DF:A9:FF:F6:B1:1A (OUI DF-A9-FF)
        Count: 1
        #182: len 10 (0 Kb/s)
        Latency: 172 msec (67-172 msec ~166 msec)
> ACL Data RX: Handle 1209 flags 0x02 dlen 9              #184 [hci1] 13.257604
      ATT: Find Information Request (0x04) len 4
        Handle range: 0x0059-0x0059
< HCI Command: Host Number of Com.. (0x03|0x0035) plen 5  #185 [hci1] 13.264987
        Num handles: 1
        Handle: 1209 Address: DF:A9:FF:F6:B1:1A (OUI DF-A9-FF)
        Count: 1
< ACL Data TX: Handle 1209 flags 0x00 dlen 10             #186 [hci1] 13.265086
      ATT: Find Information Response (0x05) len 5
        Format: UUID-16 (0x01)
        Handle: 0x0059
        UUID: Client Characteristic Configuration (0x2902)
> HCI Event: Number of Completed Packets (0x13) plen 5    #187 [hci1] 13.432470
        Num handles: 1
        Handle: 1209 Address: DF:A9:FF:F6:B1:1A (OUI DF-A9-FF)
        Count: 1
        #186: len 10 (0 Kb/s)
        Latency: 167 msec (67-172 msec ~167 msec)
> ACL Data RX: Handle 1209 flags 0x02 dlen 9              #188 [hci1] 13.432646
      ATT: Find Information Request (0x04) len 4
        Handle range: 0x005c-0x005c
< HCI Command: Host Number of Com.. (0x03|0x0035) plen 5  #189 [hci1] 13.445050
        Num handles: 1
        Handle: 1209 Address: DF:A9:FF:F6:B1:1A (OUI DF-A9-FF)
        Count: 1
< ACL Data TX: Handle 1209 flags 0x00 dlen 10             #190 [hci1] 13.445194
      ATT: Find Information Response (0x05) len 5
        Format: UUID-16 (0x01)
        Handle: 0x005c
        UUID: Client Characteristic Configuration (0x2902)
> HCI Event: Number of Completed Packets (0x13) plen 5    #191 [hci1] 13.607360
        Num handles: 1
        Handle: 1209 Address: DF:A9:FF:F6:B1:1A (OUI DF-A9-FF)
        Count: 1
        #190: len 10 (0 Kb/s)
        Latency: 162 msec (67-172 msec ~164 msec)
> ACL Data RX: Handle 1209 flags 0x02 dlen 9              #192 [hci1] 13.607656
      ATT: Find Information Request (0x04) len 4
        Handle range: 0x005f-0x005f
< HCI Command: Host Number of Com.. (0x03|0x0035) plen 5  #193 [hci1] 13.625041
        Num handles: 1
        Handle: 1209 Address: DF:A9:FF:F6:B1:1A (OUI DF-A9-FF)
        Count: 1
< ACL Data TX: Handle 1209 flags 0x00 dlen 10             #194 [hci1] 13.625116
      ATT: Find Information Response (0x05) len 5
        Format: UUID-16 (0x01)
        Handle: 0x005f
        UUID: Client Characteristic Configuration (0x2902)
> HCI Event: Number of Completed Packets (0x13) plen 5    #195 [hci1] 13.782460
        Num handles: 1
        Handle: 1209 Address: DF:A9:FF:F6:B1:1A (OUI DF-A9-FF)
        Count: 1
        #194: len 10 (0 Kb/s)
        Latency: 157 msec (67-172 msec ~160 msec)
> ACL Data RX: Handle 1209 flags 0x02 dlen 9              #196 [hci1] 13.782614
      ATT: Find Information Request (0x04) len 4
        Handle range: 0x0062-0x0062
< HCI Command: Host Number of Com.. (0x03|0x0035) plen 5  #197 [hci1] 13.784977
        Num handles: 1
        Handle: 1209 Address: DF:A9:FF:F6:B1:1A (OUI DF-A9-FF)
        Count: 1
< ACL Data TX: Handle 1209 flags 0x00 dlen 10             #198 [hci1] 13.785093
      ATT: Find Information Response (0x05) len 5
        Format: UUID-16 (0x01)
        Handle: 0x0062
        UUID: Client Characteristic Configuration (0x2902)
> HCI Event: Number of Completed Packets (0x13) plen 5    #199 [hci1] 13.957470
        Num handles: 1
        Handle: 1209 Address: DF:A9:FF:F6:B1:1A (OUI DF-A9-FF)
        Count: 1
        #198: len 10 (0 Kb/s)
        Latency: 172 msec (67-172 msec ~166 msec)
> ACL Data RX: Handle 1209 flags 0x02 dlen 9              #200 [hci1] 13.957635
      ATT: Find Information Request (0x04) len 4
        Handle range: 0x0067-0x0067
< HCI Command: Host Number of Com.. (0x03|0x0035) plen 5  #201 [hci1] 13.964980
        Num handles: 1
        Handle: 1209 Address: DF:A9:FF:F6:B1:1A (OUI DF-A9-FF)
        Count: 1
< ACL Data TX: Handle 1209 flags 0x00 dlen 10             #202 [hci1] 13.965096
      ATT: Find Information Response (0x05) len 5
        Format: UUID-16 (0x01)
        Handle: 0x0067
        UUID: Client Characteristic Configuration (0x2902)
> HCI Event: Number of Completed Packets (0x13) plen 5    #203 [hci1] 14.132406
        Num handles: 1
        Handle: 1209 Address: DF:A9:FF:F6:B1:1A (OUI DF-A9-FF)
        Count: 1
        #202: len 10 (0 Kb/s)
        Latency: 167 msec (67-172 msec ~166 msec)
> ACL Data RX: Handle 1209 flags 0x02 dlen 9              #204 [hci1] 14.132662
      ATT: Find Information Request (0x04) len 4
        Handle range: 0x006a-0x006a
< HCI Command: Host Number of Com.. (0x03|0x0035) plen 5  #205 [hci1] 14.145117
        Num handles: 1
        Handle: 1209 Address: DF:A9:FF:F6:B1:1A (OUI DF-A9-FF)
        Count: 1
< ACL Data TX: Handle 1209 flags 0x00 dlen 10             #206 [hci1] 14.145235
      ATT: Find Information Response (0x05) len 5
        Format: UUID-16 (0x01)
        Handle: 0x006a
        UUID: Client Characteristic Configuration (0x2902)
> HCI Event: Number of Completed Packets (0x13) plen 5    #207 [hci1] 14.307387
        Num handles: 1
        Handle: 1209 Address: DF:A9:FF:F6:B1:1A (OUI DF-A9-FF)
        Count: 1
        #206: len 10 (0 Kb/s)
        Latency: 162 msec (67-172 msec ~164 msec)
> ACL Data RX: Handle 1209 flags 0x02 dlen 9              #208 [hci1] 14.307613
      ATT: Find Information Request (0x04) len 4
        Handle range: 0x006d-0x006d
< HCI Command: Host Number of Com.. (0x03|0x0035) plen 5  #209 [hci1] 14.325082
        Num handles: 1
        Handle: 1209 Address: DF:A9:FF:F6:B1:1A (OUI DF-A9-FF)
        Count: 1
< ACL Data TX: Handle 1209 flags 0x00 dlen 10             #210 [hci1] 14.325179
      ATT: Find Information Response (0x05) len 5
        Format: UUID-16 (0x01)
        Handle: 0x006d
        UUID: Client Characteristic Configuration (0x2902)
> HCI Event: Number of Completed Packets (0x13) plen 5    #211 [hci1] 14.482394
        Num handles: 1
        Handle: 1209 Address: DF:A9:FF:F6:B1:1A (OUI DF-A9-FF)
        Count: 1
        #210: len 10 (0 Kb/s)
        Latency: 157 msec (67-172 msec ~160 msec)
> ACL Data RX: Handle 1209 flags 0x02 dlen 9              #212 [hci1] 14.482608
      ATT: Find Information Request (0x04) len 4
        Handle range: 0x0070-0x0070
< HCI Command: Host Number of Com.. (0x03|0x0035) plen 5  #213 [hci1] 14.484757
        Num handles: 1
        Handle: 1209 Address: DF:A9:FF:F6:B1:1A (OUI DF-A9-FF)
        Count: 1
< ACL Data TX: Handle 1209 flags 0x00 dlen 10             #214 [hci1] 14.484799
      ATT: Find Information Response (0x05) len 5
        Format: UUID-16 (0x01)
        Handle: 0x0070
        UUID: Client Characteristic Configuration (0x2902)
> HCI Event: Number of Completed Packets (0x13) plen 5    #215 [hci1] 14.657451
        Num handles: 1
        Handle: 1209 Address: DF:A9:FF:F6:B1:1A (OUI DF-A9-FF)
        Count: 1
        #214: len 10 (0 Kb/s)
        Latency: 172 msec (67-172 msec ~166 msec)
> ACL Data RX: Handle 1209 flags 0x02 dlen 9              #216 [hci1] 14.657716
      ATT: Find Information Request (0x04) len 4
        Handle range: 0x0073-0x0073
< HCI Command: Host Number of Com.. (0x03|0x0035) plen 5  #217 [hci1] 14.665123
        Num handles: 1
        Handle: 1209 Address: DF:A9:FF:F6:B1:1A (OUI DF-A9-FF)
        Count: 1
< ACL Data TX: Handle 1209 flags 0x00 dlen 10             #218 [hci1] 14.665296
      ATT: Find Information Response (0x05) len 5
        Format: UUID-16 (0x01)
        Handle: 0x0073
        UUID: Client Characteristic Configuration (0x2902)
> HCI Event: Number of Completed Packets (0x13) plen 5    #219 [hci1] 14.832398
        Num handles: 1
        Handle: 1209 Address: DF:A9:FF:F6:B1:1A (OUI DF-A9-FF)
        Count: 1
        #218: len 10 (0 Kb/s)
        Latency: 167 msec (67-172 msec ~166 msec)
> ACL Data RX: Handle 1209 flags 0x02 dlen 9              #220 [hci1] 14.832709
      ATT: Write Request (0x12) len 4
        Handle: 0x0067
          Data: 0000
< HCI Command: Host Number of Com.. (0x03|0x0035) plen 5  #221 [hci1] 14.845116
        Num handles: 1
        Handle: 1209 Address: DF:A9:FF:F6:B1:1A (OUI DF-A9-FF)
        Count: 1
< ACL Data TX: Handle 1209 flags 0x00 dlen 5              #222 [hci1] 14.845233
      ATT: Write Response (0x13) len 0
> HCI Event: Number of Completed Packets (0x13) plen 5    #223 [hci1] 15.007361
        Num handles: 1
        Handle: 1209 Address: DF:A9:FF:F6:B1:1A (OUI DF-A9-FF)
        Count: 1
        #222: len 5 (0 Kb/s)
        Latency: 162 msec (67-172 msec ~164 msec)
> ACL Data RX: Handle 1209 flags 0x02 dlen 9              #224 [hci1] 15.007658
      ATT: Write Request (0x12) len 4
        Handle: 0x0067
          Data: 0100
< HCI Command: Host Number of Com.. (0x03|0x0035) plen 5  #225 [hci1] 15.025156
        Num handles: 1
        Handle: 1209 Address: DF:A9:FF:F6:B1:1A (OUI DF-A9-FF)
        Count: 1
< ACL Data TX: Handle 1209 flags 0x00 dlen 5              #226 [hci1] 15.025254
      ATT: Write Response (0x13) len 0
> HCI Event: Number of Completed Packets (0x13) plen 5    #227 [hci1] 15.182410
        Num handles: 1
        Handle: 1209 Address: DF:A9:FF:F6:B1:1A (OUI DF-A9-FF)
        Count: 1
        #226: len 5 (0 Kb/s)
        Latency: 157 msec (67-172 msec ~160 msec)
> ACL Data RX: Handle 1209 flags 0x02 dlen 9              #228 [hci1] 15.182698
      ATT: Write Request (0x12) len 4
        Handle: 0x006a
          Data: 0000
< HCI Command: Host Number of Com.. (0x03|0x0035) plen 5  #229 [hci1] 15.184985
        Num handles: 1
        Handle: 1209 Address: DF:A9:FF:F6:B1:1A (OUI DF-A9-FF)
        Count: 1
< ACL Data TX: Handle 1209 flags 0x00 dlen 5              #230 [hci1] 15.185091
      ATT: Write Response (0x13) len 0
> HCI Event: Number of Completed Packets (0x13) plen 5    #231 [hci1] 15.357356
        Num handles: 1
        Handle: 1209 Address: DF:A9:FF:F6:B1:1A (OUI DF-A9-FF)
        Count: 1
        #230: len 5 (0 Kb/s)
        Latency: 172 msec (67-172 msec ~166 msec)
> ACL Data RX: Handle 1209 flags 0x02 dlen 9              #232 [hci1] 15.357715
      ATT: Write Request (0x12) len 4
        Handle: 0x006a
          Data: 0100
< HCI Command: Host Number of Com.. (0x03|0x0035) plen 5  #233 [hci1] 15.365096
        Num handles: 1
        Handle: 1209 Address: DF:A9:FF:F6:B1:1A (OUI DF-A9-FF)
        Count: 1
< ACL Data TX: Handle 1209 flags 0x00 dlen 5              #234 [hci1] 15.365180
      ATT: Write Response (0x13) len 0
> HCI Event: Number of Completed Packets (0x13) plen 5    #235 [hci1] 15.532371
        Num handles: 1
        Handle: 1209 Address: DF:A9:FF:F6:B1:1A (OUI DF-A9-FF)
        Count: 1
        #234: len 5 (0 Kb/s)
        Latency: 167 msec (67-172 msec ~166 msec)
> ACL Data RX: Handle 1209 flags 0x02 dlen 9              #236 [hci1] 15.532657
      ATT: Write Request (0x12) len 4
        Handle: 0x004b
          Data: 0000
< HCI Command: Host Number of Com.. (0x03|0x0035) plen 5  #237 [hci1] 15.545084
        Num handles: 1
        Handle: 1209 Address: DF:A9:FF:F6:B1:1A (OUI DF-A9-FF)
        Count: 1
< ACL Data TX: Handle 1209 flags 0x00 dlen 5              #238 [hci1] 15.545199
      ATT: Write Response (0x13) len 0
> HCI Event: Number of Completed Packets (0x13) plen 5    #239 [hci1] 15.707412
        Num handles: 1
        Handle: 1209 Address: DF:A9:FF:F6:B1:1A (OUI DF-A9-FF)
        Count: 1
        #238: len 5 (0 Kb/s)
        Latency: 162 msec (67-172 msec ~164 msec)
> ACL Data RX: Handle 1209 flags 0x02 dlen 9              #240 [hci1] 15.707689
      ATT: Write Request (0x12) len 4
        Handle: 0x004b
          Data: 0100
< HCI Command: Host Number of Com.. (0x03|0x0035) plen 5  #241 [hci1] 15.725204
        Num handles: 1
        Handle: 1209 Address: DF:A9:FF:F6:B1:1A (OUI DF-A9-FF)
        Count: 1
< ACL Data TX: Handle 1209 flags 0x00 dlen 5              #242 [hci1] 15.725289
      ATT: Write Response (0x13) len 0
> HCI Event: Number of Completed Packets (0x13) plen 5    #243 [hci1] 15.882353
        Num handles: 1
        Handle: 1209 Address: DF:A9:FF:F6:B1:1A (OUI DF-A9-FF)
        Count: 1
        #242: len 5 (0 Kb/s)
        Latency: 157 msec (67-172 msec ~160 msec)
> ACL Data RX: Handle 1209 flags 0x02 dlen 11             #244 [hci1] 15.882707
      ATT: Read By Type Request (0x08) len 6
        Handle range: 0x0001-0xffff
        Attribute type: Include (0x2802)
< HCI Command: Host Number of Com.. (0x03|0x0035) plen 5  #245 [hci1] 15.885093
        Num handles: 1
        Handle: 1209 Address: DF:A9:FF:F6:B1:1A (OUI DF-A9-FF)
        Count: 1
< ACL Data TX: Handle 1209 flags 0x00 dlen 14             #246 [hci1] 15.885236
      ATT: Read By Type Response (0x09) len 9
        Attribute data length: 8
        Attribute data list: 1 entry
        Handle: 0x0038
        Value: 240036002518
> HCI Event: Number of Completed Packets (0x13) plen 5    #247 [hci1] 16.057365
        Num handles: 1
        Handle: 1209 Address: DF:A9:FF:F6:B1:1A (OUI DF-A9-FF)
        Count: 1
        #246: len 14 (0 Kb/s)
        Latency: 172 msec (67-172 msec ~166 msec)
> ACL Data RX: Handle 1209 flags 0x02 dlen 11             #248 [hci1] 16.057616
      ATT: Read By Type Request (0x08) len 6
        Handle range: 0x0039-0xffff
        Attribute type: Include (0x2802)
< HCI Command: Host Number of Com.. (0x03|0x0035) plen 5  #249 [hci1] 16.065167
        Num handles: 1
        Handle: 1209 Address: DF:A9:FF:F6:B1:1A (OUI DF-A9-FF)
        Count: 1
< ACL Data TX: Handle 1209 flags 0x00 dlen 9              #250 [hci1] 16.065332
      ATT: Error Response (0x01) len 4
        Read By Type Request (0x08)
        Handle: 0x0039
        Error: Attribute Not Found (0x0a)
> HCI Event: Number of Completed Packets (0x13) plen 5    #251 [hci1] 16.232366
        Num handles: 1
        Handle: 1209 Address: DF:A9:FF:F6:B1:1A (OUI DF-A9-FF)
        Count: 1
        #250: len 9 (0 Kb/s)
        Latency: 167 msec (67-172 msec ~166 msec)
> ACL Data RX: Handle 1209 flags 0x02 dlen 11             #252 [hci1] 16.232615
      ATT: Read By Type Request (0x08) len 6
        Handle range: 0x0024-0x0036
        Attribute type: Characteristic (0x2803)
< HCI Command: Host Number of Com.. (0x03|0x0035) plen 5  #253 [hci1] 16.245064
        Num handles: 1
        Handle: 1209 Address: DF:A9:FF:F6:B1:1A (OUI DF-A9-FF)
        Count: 1
< ACL Data TX: Handle 1209 flags 0x00 dlen 20             #254 [hci1] 16.245147
      ATT: Read By Type Response (0x09) len 15
        Attribute data length: 7
        Attribute data list: 2 entries
        Handle: 0x0025
        Value: 022600bd2a
            Properties: 0x02
              Read (0x02)
            Value Handle: 0x0026
            Value UUID: OTS Feature (0x2abd)
        Handle: 0x0027
        Value: 0a2800be2a
            Properties: 0x0a
              Read (0x02)
              Write (0x08)
            Value Handle: 0x0028
            Value UUID: Object Name (0x2abe)
> HCI Event: Number of Completed Packets (0x13) plen 5    #255 [hci1] 16.407404
        Num handles: 1
        Handle: 1209 Address: DF:A9:FF:F6:B1:1A (OUI DF-A9-FF)
        Count: 1
        #254: len 20 (0 Kb/s)
        Latency: 162 msec (67-172 msec ~164 msec)
> ACL Data RX: Handle 1209 flags 0x02 dlen 11             #256 [hci1] 16.407637
      ATT: Read By Type Request (0x08) len 6
        Handle range: 0x0028-0x0036
        Attribute type: Characteristic (0x2803)
< HCI Command: Host Number of Com.. (0x03|0x0035) plen 5  #257 [hci1] 16.425079
        Num handles: 1
        Handle: 1209 Address: DF:A9:FF:F6:B1:1A (OUI DF-A9-FF)
        Count: 1
< ACL Data TX: Handle 1209 flags 0x00 dlen 20             #258 [hci1] 16.425159
      ATT: Read By Type Response (0x09) len 15
        Attribute data length: 7
        Attribute data list: 2 entries
        Handle: 0x0029
        Value: 022a00bf2a
            Properties: 0x02
              Read (0x02)
            Value Handle: 0x002a
            Value UUID: Object Type (0x2abf)
        Handle: 0x002b
        Value: 022c00c02a
            Properties: 0x02
              Read (0x02)
            Value Handle: 0x002c
            Value UUID: Object Size (0x2ac0)
> HCI Event: Number of Completed Packets (0x13) plen 5    #259 [hci1] 16.582355
        Num handles: 1
        Handle: 1209 Address: DF:A9:FF:F6:B1:1A (OUI DF-A9-FF)
        Count: 1
        #258: len 20 (1 Kb/s)
        Latency: 157 msec (67-172 msec ~160 msec)
> ACL Data RX: Handle 1209 flags 0x02 dlen 11             #260 [hci1] 16.582605
      ATT: Read By Type Request (0x08) len 6
        Handle range: 0x002c-0x0036
        Attribute type: Characteristic (0x2803)
< HCI Command: Host Number of Com.. (0x03|0x0035) plen 5  #261 [hci1] 16.585024
        Num handles: 1
        Handle: 1209 Address: DF:A9:FF:F6:B1:1A (OUI DF-A9-FF)
        Count: 1
< ACL Data TX: Handle 1209 flags 0x00 dlen 20             #262 [hci1] 16.585121
      ATT: Read By Type Response (0x09) len 15
        Attribute data length: 7
        Attribute data list: 2 entries
        Handle: 0x002d
        Value: 022e00c32a
            Properties: 0x02
              Read (0x02)
            Value Handle: 0x002e
            Value UUID: Object ID (0x2ac3)
        Handle: 0x002f
        Value: 023000c42a
            Properties: 0x02
              Read (0x02)
            Value Handle: 0x0030
            Value UUID: Object Properties (0x2ac4)
> HCI Event: Number of Completed Packets (0x13) plen 5    #263 [hci1] 16.757553
        Num handles: 1
        Handle: 1209 Address: DF:A9:FF:F6:B1:1A (OUI DF-A9-FF)
        Count: 1
        #262: len 20 (0 Kb/s)
        Latency: 172 msec (67-172 msec ~166 msec)
> ACL Data RX: Handle 1209 flags 0x02 dlen 11             #264 [hci1] 16.757661
      ATT: Read By Type Request (0x08) len 6
        Handle range: 0x0030-0x0036
        Attribute type: Characteristic (0x2803)
< HCI Command: Host Number of Com.. (0x03|0x0035) plen 5  #265 [hci1] 16.765189
        Num handles: 1
        Handle: 1209 Address: DF:A9:FF:F6:B1:1A (OUI DF-A9-FF)
        Count: 1
< ACL Data TX: Handle 1209 flags 0x00 dlen 20             #266 [hci1] 16.765275
      ATT: Read By Type Response (0x09) len 15
        Attribute data length: 7
        Attribute data list: 2 entries
        Handle: 0x0031
        Value: 283200c52a
            Properties: 0x28
              Write (0x08)
              Indicate (0x20)
            Value Handle: 0x0032
            Value UUID: Object Action Control Point (0x2ac5)
        Handle: 0x0034
        Value: 283500c62a
            Properties: 0x28
              Write (0x08)
              Indicate (0x20)
            Value Handle: 0x0035
            Value UUID: Object List Control Point (0x2ac6)
> HCI Event: Number of Completed Packets (0x13) plen 5    #267 [hci1] 16.932365
        Num handles: 1
        Handle: 1209 Address: DF:A9:FF:F6:B1:1A (OUI DF-A9-FF)
        Count: 1
        #266: len 20 (0 Kb/s)
        Latency: 167 msec (67-172 msec ~166 msec)
> ACL Data RX: Handle 1209 flags 0x02 dlen 11             #268 [hci1] 16.932649
      ATT: Read By Type Request (0x08) len 6
        Handle range: 0x0035-0x0036
        Attribute type: Characteristic (0x2803)
< HCI Command: Host Number of Com.. (0x03|0x0035) plen 5  #269 [hci1] 16.945136
        Num handles: 1
        Handle: 1209 Address: DF:A9:FF:F6:B1:1A (OUI DF-A9-FF)
        Count: 1
< ACL Data TX: Handle 1209 flags 0x00 dlen 9              #270 [hci1] 16.945339
      ATT: Error Response (0x01) len 4
        Read By Type Request (0x08)
        Handle: 0x0035
        Error: Attribute Not Found (0x0a)
> HCI Event: Number of Completed Packets (0x13) plen 5    #271 [hci1] 17.107285
        Num handles: 1
        Handle: 1209 Address: DF:A9:FF:F6:B1:1A (OUI DF-A9-FF)
        Count: 1
        #270: len 9 (0 Kb/s)
        Latency: 161 msec (67-172 msec ~164 msec)
> ACL Data RX: Handle 1209 flags 0x02 dlen 9              #272 [hci1] 17.107545
      ATT: Find Information Request (0x04) len 4
        Handle range: 0x0033-0x0033
< HCI Command: Host Number of Com.. (0x03|0x0035) plen 5  #273 [hci1] 17.125132
        Num handles: 1
        Handle: 1209 Address: DF:A9:FF:F6:B1:1A (OUI DF-A9-FF)
        Count: 1
< ACL Data TX: Handle 1209 flags 0x00 dlen 10             #274 [hci1] 17.125211
      ATT: Find Information Response (0x05) len 5
        Format: UUID-16 (0x01)
        Handle: 0x0033
        UUID: Client Characteristic Configuration (0x2902)
> HCI Event: Number of Completed Packets (0x13) plen 5    #275 [hci1] 17.282511
        Num handles: 1
        Handle: 1209 Address: DF:A9:FF:F6:B1:1A (OUI DF-A9-FF)
        Count: 1
        #274: len 10 (0 Kb/s)
        Latency: 157 msec (67-172 msec ~160 msec)
> ACL Data RX: Handle 1209 flags 0x02 dlen 9              #276 [hci1] 17.282639
      ATT: Find Information Request (0x04) len 4
        Handle range: 0x0036-0x0036
< HCI Command: Host Number of Com.. (0x03|0x0035) plen 5  #277 [hci1] 17.284925
        Num handles: 1
        Handle: 1209 Address: DF:A9:FF:F6:B1:1A (OUI DF-A9-FF)
        Count: 1
< ACL Data TX: Handle 1209 flags 0x00 dlen 10             #278 [hci1] 17.285064
      ATT: Find Information Response (0x05) len 5
        Format: UUID-16 (0x01)
        Handle: 0x0036
        UUID: Client Characteristic Configuration (0x2902)
> HCI Event: Number of Completed Packets (0x13) plen 5    #279 [hci1] 17.457324
        Num handles: 1
        Handle: 1209 Address: DF:A9:FF:F6:B1:1A (OUI DF-A9-FF)
        Count: 1
        #278: len 10 (0 Kb/s)
        Latency: 172 msec (67-172 msec ~166 msec)
> ACL Data RX: Handle 1209 flags 0x02 dlen 7              #280 [hci1] 17.457580
      ATT: Read Request (0x0a) len 2
        Handle: 0x0026
< HCI Command: Host Number of Com.. (0x03|0x0035) plen 5  #281 [hci1] 17.465162
        Num handles: 1
        Handle: 1209 Address: DF:A9:FF:F6:B1:1A (OUI DF-A9-FF)
        Count: 1
< ACL Data TX: Handle 1209 flags 0x00 dlen 13             #282 [hci1] 17.465263
      ATT: Read Response (0x0b) len 8
> HCI Event: Number of Completed Packets (0x13) plen 5    #283 [hci1] 17.632330
        Num handles: 1
        Handle: 1209 Address: DF:A9:FF:F6:B1:1A (OUI DF-A9-FF)
        Count: 1
        #282: len 13 (0 Kb/s)
        Latency: 167 msec (67-172 msec ~166 msec)
> ACL Data RX: Handle 1209 flags 0x02 dlen 9              #284 [hci1] 17.632576
      ATT: Write Request (0x12) len 4
        Handle: 0x0033
          Data: 0000
< HCI Command: Host Number of Com.. (0x03|0x0035) plen 5  #285 [hci1] 17.645007
        Num handles: 1
        Handle: 1209 Address: DF:A9:FF:F6:B1:1A (OUI DF-A9-FF)
        Count: 1
< ACL Data TX: Handle 1209 flags 0x00 dlen 5              #286 [hci1] 17.645085
      ATT: Write Response (0x13) len 0
> HCI Event: Number of Completed Packets (0x13) plen 5    #287 [hci1] 17.807325
        Num handles: 1
        Handle: 1209 Address: DF:A9:FF:F6:B1:1A (OUI DF-A9-FF)
        Count: 1
        #286: len 5 (0 Kb/s)
        Latency: 162 msec (67-172 msec ~164 msec)
> ACL Data RX: Handle 1209 flags 0x02 dlen 9              #288 [hci1] 17.807625
      ATT: Write Request (0x12) len 4
        Handle: 0x0033
          Data: 0200
< HCI Command: Host Number of Com.. (0x03|0x0035) plen 5  #289 [hci1] 17.825170
        Num handles: 1
        Handle: 1209 Address: DF:A9:FF:F6:B1:1A (OUI DF-A9-FF)
        Count: 1
< ACL Data TX: Handle 1209 flags 0x00 dlen 5              #290 [hci1] 17.825328
      ATT: Write Response (0x13) len 0
> HCI Event: Number of Completed Packets (0x13) plen 5    #291 [hci1] 17.982327
        Num handles: 1
        Handle: 1209 Address: DF:A9:FF:F6:B1:1A (OUI DF-A9-FF)
        Count: 1
        #290: len 5 (0 Kb/s)
        Latency: 156 msec (67-172 msec ~160 msec)
> ACL Data RX: Handle 1209 flags 0x02 dlen 9              #292 [hci1] 17.982529
      ATT: Write Request (0x12) len 4
        Handle: 0x0036
          Data: 0000
< HCI Command: Host Number of Com.. (0x03|0x0035) plen 5  #293 [hci1] 17.985072
        Num handles: 1
        Handle: 1209 Address: DF:A9:FF:F6:B1:1A (OUI DF-A9-FF)
        Count: 1
< ACL Data TX: Handle 1209 flags 0x00 dlen 5              #294 [hci1] 17.985125
      ATT: Write Response (0x13) len 0
> HCI Event: Number of Completed Packets (0x13) plen 5    #295 [hci1] 18.157308
        Num handles: 1
        Handle: 1209 Address: DF:A9:FF:F6:B1:1A (OUI DF-A9-FF)
        Count: 1
        #294: len 5 (0 Kb/s)
        Latency: 172 msec (67-172 msec ~166 msec)
> ACL Data RX: Handle 1209 flags 0x02 dlen 9              #296 [hci1] 18.157578
      ATT: Write Request (0x12) len 4
        Handle: 0x0036
          Data: 0200
< HCI Command: Host Number of Com.. (0x03|0x0035) plen 5  #297 [hci1] 18.165196
        Num handles: 1
        Handle: 1209 Address: DF:A9:FF:F6:B1:1A (OUI DF-A9-FF)
        Count: 1
< ACL Data TX: Handle 1209 flags 0x00 dlen 5              #298 [hci1] 18.165300
      ATT: Write Response (0x13) len 0
> HCI Event: Number of Completed Packets (0x13) plen 5    #299 [hci1] 18.332359
        Num handles: 1
        Handle: 1209 Address: DF:A9:FF:F6:B1:1A (OUI DF-A9-FF)
        Count: 1
        #298: len 5 (0 Kb/s)
        Latency: 167 msec (67-172 msec ~166 msec)
> ACL Data RX: Handle 1209 flags 0x02 dlen 7              #300 [hci1] 18.332529
      ATT: Read Request (0x0a) len 2
        Handle: 0x006c
< HCI Command: Host Number of Com.. (0x03|0x0035) plen 5  #301 [hci1] 18.344872
        Num handles: 1
        Handle: 1209 Address: DF:A9:FF:F6:B1:1A (OUI DF-A9-FF)
        Count: 1
< ACL Data TX: Handle 1209 flags 0x00 dlen 9              #302 [hci1] 18.344921
      ATT: Read Response (0x0b) len 4
> HCI Event: Number of Completed Packets (0x13) plen 5    #303 [hci1] 18.507331
        Num handles: 1
        Handle: 1209 Address: DF:A9:FF:F6:B1:1A (OUI DF-A9-FF)
        Count: 1
        #302: len 9 (0 Kb/s)
        Latency: 162 msec (67-172 msec ~164 msec)
> ACL Data RX: Handle 1209 flags 0x02 dlen 7              #304 [hci1] 18.507632
      ATT: Read Request (0x0a) len 2
        Handle: 0x0066
< HCI Command: Host Number of Com.. (0x03|0x0035) plen 5  #305 [hci1] 18.525184
        Num handles: 1
        Handle: 1209 Address: DF:A9:FF:F6:B1:1A (OUI DF-A9-FF)
        Count: 1
< ACL Data TX: Handle 1209 flags 0x00 dlen 6              #306 [hci1] 18.525254
      ATT: Read Response (0x0b) len 1
> HCI Event: Number of Completed Packets (0x13) plen 5    #307 [hci1] 18.682351
        Num handles: 1
        Handle: 1209 Address: DF:A9:FF:F6:B1:1A (OUI DF-A9-FF)
        Count: 1
        #306: len 6 (0 Kb/s)
        Latency: 157 msec (67-172 msec ~160 msec)
> ACL Data RX: Handle 1209 flags 0x02 dlen 8              #308 [hci1] 18.682531
      ATT: Write Command (0x52) len 3
        Handle: 0x0069
          Data: 01
< HCI Command: Host Number of Com.. (0x03|0x0035) plen 5  #309 [hci1] 18.685459
        Num handles: 1
        Handle: 1209 Address: DF:A9:FF:F6:B1:1A (OUI DF-A9-FF)
        Count: 1
< ACL Data TX: Handle 1209 flags 0x00 dlen 8              #310 [hci1] 18.685885
      ATT: Handle Value Notification (0x1b) len 3
        Handle: 0x0066
          Data: 01
< ACL Data TX: Handle 1209 flags 0x00 dlen 9              #311 [hci1] 18.686064
      ATT: Handle Value Notification (0x1b) len 4
        Handle: 0x0069
          Data: 0101
> HCI Event: Number of Completed Packets (0x13) plen 5    #312 [hci1] 18.770316
        Num handles: 1
        Handle: 1209 Address: DF:A9:FF:F6:B1:1A (OUI DF-A9-FF)
        Count: 1
        #310: len 8 (0 Kb/s)
        Latency: 84 msec (67-172 msec ~122 msec)
> HCI Event: Number of Completed Packets (0x13) plen 5    #313 [hci1] 18.857349
        Num handles: 1
        Handle: 1209 Address: DF:A9:FF:F6:B1:1A (OUI DF-A9-FF)
        Count: 1
        #311: len 9 (0 Kb/s)
        Latency: 171 msec (67-172 msec ~146 msec)
> ACL Data RX: Handle 1209 flags 0x02 dlen 7              #314 [hci1] 18.857499
      ATT: Read Request (0x0a) len 2
        Handle: 0x0053
< HCI Command: Host Number of Com.. (0x03|0x0035) plen 5  #315 [hci1] 18.865201
        Num handles: 1
        Handle: 1209 Address: DF:A9:FF:F6:B1:1A (OUI DF-A9-FF)
        Count: 1
< ACL Data TX: Handle 1209 flags 0x00 dlen 11             #316 [hci1] 18.865389
      ATT: Read Response (0x0b) len 6
> HCI Event: Number of Completed Packets (0x13) plen 5    #317 [hci1] 19.032456
        Num handles: 1
        Handle: 1209 Address: DF:A9:FF:F6:B1:1A (OUI DF-A9-FF)
        Count: 1
        #316: len 11 (0 Kb/s)
        Latency: 167 msec (67-172 msec ~157 msec)
> ACL Data RX: Handle 1209 flags 0x02 dlen 14             #318 [hci1] 19.032716
      ATT: Write Request (0x12) len 9
        Handle: 0x0035
          Data: 05130100000000
< HCI Command: Host Number of Com.. (0x03|0x0035) plen 5  #319 [hci1] 19.045368
        Num handles: 1
        Handle: 1209 Address: DF:A9:FF:F6:B1:1A (OUI DF-A9-FF)
        Count: 1
< ACL Data TX: Handle 1209 flags 0x00 dlen 5              #320 [hci1] 19.045557
      ATT: Write Response (0x13) len 0
< ACL Data TX: Handle 1209 flags 0x00 dlen 10             #321 [hci1] 19.045741
      ATT: Handle Value Indication (0x1d) len 5
        Handle: 0x0035
          Data: 700501
> HCI Event: Number of Completed Packets (0x13) plen 5    #322 [hci1] 19.120326
        Num handles: 1
        Handle: 1209 Address: DF:A9:FF:F6:B1:1A (OUI DF-A9-FF)
        Count: 1
        #320: len 5 (0 Kb/s)
        Latency: 74 msec (67-172 msec ~115 msec)
> HCI Event: Number of Completed Packets (0x13) plen 5    #323 [hci1] 19.207340
        Num handles: 1
        Handle: 1209 Address: DF:A9:FF:F6:B1:1A (OUI DF-A9-FF)
        Count: 1
        #321: len 10 (0 Kb/s)
        Latency: 161 msec (67-172 msec ~138 msec)
> ACL Data RX: Handle 1209 flags 0x02 dlen 5              #324 [hci1] 19.207534
      ATT: Handle Value Confirmation (0x1e) len 0
< HCI Command: Host Number of Com.. (0x03|0x0035) plen 5  #325 [hci1] 19.225159
        Num handles: 1
        Handle: 1209 Address: DF:A9:FF:F6:B1:1A (OUI DF-A9-FF)
        Count: 1
> ACL Data RX: Handle 1209 flags 0x02 dlen 18             #326 [hci1] 20.170019
      LE L2CAP: LE Connection Request (0x14) ident 1 len 10
        PSM: 37 (0x0025)
        Source CID: 84
        MTU: 1024
        MPS: 64
        Credits: 10
< HCI Command: Host Number of Com.. (0x03|0x0035) plen 5  #327 [hci1] 20.184961
        Num handles: 1
        Handle: 1209 Address: DF:A9:FF:F6:B1:1A (OUI DF-A9-FF)
        Count: 1
< ACL Data TX: Handle 1209 flags 0x00 dlen 18             #328 [hci1] 20.185120
      LE L2CAP: LE Connection Response (0x15) ident 1 len 10
        Destination CID: 64
        MTU: 255
        MPS: 251
        Credits: 1
        Result: Connection successful (0x0000)
> HCI Event: Number of Completed Packets (0x13) plen 5    #329 [hci1] 20.344873
        Num handles: 1
        Handle: 1209 Address: DF:A9:FF:F6:B1:1A (OUI DF-A9-FF)
        Count: 1
        #328: len 18 (0 Kb/s)
        Latency: 159 msec (67-172 msec ~149 msec)
> ACL Data RX: Handle 1209 flags 0x02 dlen 7              #330 [hci1] 20.345011
      ATT: Read Request (0x0a) len 2
        Handle: 0x0028
< HCI Command: Host Number of Com.. (0x03|0x0035) plen 5  #331 [hci1] 20.365206
        Num handles: 1
        Handle: 1209 Address: DF:A9:FF:F6:B1:1A (OUI DF-A9-FF)
        Count: 1
< ACL Data TX: Handle 1209 flags 0x00 dlen 27             #332 [hci1] 20.365279
      ATT: Read Response (0x0b) len 22
> HCI Event: Number of Completed Packets (0x13) plen 5    #333 [hci1] 20.520498
        Num handles: 1
        Handle: 1209 Address: DF:A9:FF:F6:B1:1A (OUI DF-A9-FF)
        Count: 1
        #332: len 27 (1 Kb/s)
        Latency: 155 msec (67-172 msec ~152 msec)
> ACL Data RX: Handle 1209 flags 0x02 dlen 9              #334 [hci1] 20.520507
      ATT: Read Blob Request (0x0c) len 4
        Handle: 0x0028
        Offset: 0x0016
< HCI Command: Host Number of Com.. (0x03|0x0035) plen 5  #335 [hci1] 20.525136
        Num handles: 1
        Handle: 1209 Address: DF:A9:FF:F6:B1:1A (OUI DF-A9-FF)
        Count: 1
< ACL Data TX: Handle 1209 flags 0x00 dlen 13             #336 [hci1] 20.525243
      ATT: Read Blob Response (0x0d) len 8
        20 41 6c 69 73 6f 6e 29                           Alison)        
> HCI Event: Number of Completed Packets (0x13) plen 5    #337 [hci1] 20.694784
        Num handles: 1
        Handle: 1209 Address: DF:A9:FF:F6:B1:1A (OUI DF-A9-FF)
        Count: 1
        #336: len 13 (0 Kb/s)
        Latency: 169 msec (67-172 msec ~160 msec)
> ACL Data RX: Handle 1209 flags 0x02 dlen 7              #338 [hci1] 20.695015
      ATT: Read Request (0x0a) len 2
        Handle: 0x002a
< HCI Command: Host Number of Com.. (0x03|0x0035) plen 5  #339 [hci1] 20.705217
        Num handles: 1
        Handle: 1209 Address: DF:A9:FF:F6:B1:1A (OUI DF-A9-FF)
        Count: 1
< ACL Data TX: Handle 1209 flags 0x00 dlen 7              #340 [hci1] 20.705318
      ATT: Read Response (0x0b) len 2
> HCI Event: Number of Completed Packets (0x13) plen 5    #341 [hci1] 20.869799
        Num handles: 1
        Handle: 1209 Address: DF:A9:FF:F6:B1:1A (OUI DF-A9-FF)
        Count: 1
        #340: len 7 (0 Kb/s)
        Latency: 164 msec (67-172 msec ~162 msec)
> ACL Data RX: Handle 1209 flags 0x02 dlen 7              #342 [hci1] 20.870065
      ATT: Read Request (0x0a) len 2
        Handle: 0x002c
< HCI Command: Host Number of Com.. (0x03|0x0035) plen 5  #343 [hci1] 20.885199
        Num handles: 1
        Handle: 1209 Address: DF:A9:FF:F6:B1:1A (OUI DF-A9-FF)
        Count: 1
< ACL Data TX: Handle 1209 flags 0x00 dlen 13             #344 [hci1] 20.885297
      ATT: Read Response (0x0b) len 8
> HCI Event: Number of Completed Packets (0x13) plen 5    #345 [hci1] 21.044791
        Num handles: 1
        Handle: 1209 Address: DF:A9:FF:F6:B1:1A (OUI DF-A9-FF)
        Count: 1
        #344: len 13 (0 Kb/s)
        Latency: 159 msec (67-172 msec ~161 msec)
> ACL Data RX: Handle 1209 flags 0x02 dlen 7              #346 [hci1] 21.045071
      ATT: Read Request (0x0a) len 2
        Handle: 0x0030
< HCI Command: Host Number of Com.. (0x03|0x0035) plen 5  #347 [hci1] 21.065229
        Num handles: 1
        Handle: 1209 Address: DF:A9:FF:F6:B1:1A (OUI DF-A9-FF)
        Count: 1
< ACL Data TX: Handle 1209 flags 0x00 dlen 9              #348 [hci1] 21.065317
      ATT: Read Response (0x0b) len 4
> HCI Event: Number of Completed Packets (0x13) plen 5    #349 [hci1] 21.219749
        Num handles: 1
        Handle: 1209 Address: DF:A9:FF:F6:B1:1A (OUI DF-A9-FF)
        Count: 1
        #348: len 9 (0 Kb/s)
        Latency: 154 msec (67-172 msec ~157 msec)
> ACL Data RX: Handle 1209 flags 0x02 dlen 7              #350 [hci1] 21.220105
      ATT: Read Request (0x0a) len 2
        Handle: 0x002e
< HCI Command: Host Number of Com.. (0x03|0x0035) plen 5  #351 [hci1] 21.225109
        Num handles: 1
        Handle: 1209 Address: DF:A9:FF:F6:B1:1A (OUI DF-A9-FF)
        Count: 1
< ACL Data TX: Handle 1209 flags 0x00 dlen 11             #352 [hci1] 21.225199
      ATT: Read Response (0x0b) len 6
> HCI Event: Number of Completed Packets (0x13) plen 5    #353 [hci1] 21.394872
        Num handles: 1
        Handle: 1209 Address: DF:A9:FF:F6:B1:1A (OUI DF-A9-FF)
        Count: 1
        #352: len 11 (0 Kb/s)
        Latency: 169 msec (67-172 msec ~163 msec)
> ACL Data RX: Handle 1209 flags 0x02 dlen 16             #354 [hci1] 21.395167
      ATT: Write Request (0x12) len 11
        Handle: 0x0032
          Data: 05000000001d000000
< HCI Command: Host Number of Com.. (0x03|0x0035) plen 5  #355 [hci1] 21.405192
        Num handles: 1
        Handle: 1209 Address: DF:A9:FF:F6:B1:1A (OUI DF-A9-FF)
        Count: 1
< ACL Data TX: Handle 1209 flags 0x00 dlen 5              #356 [hci1] 21.405495
      ATT: Write Response (0x13) len 0
< ACL Data TX: Handle 1209 flags 0x00 dlen 10             #357 [hci1] 21.405620
      ATT: Handle Value Indication (0x1d) len 5
        Handle: 0x0032
          Data: 600501
> HCI Event: Number of Completed Packets (0x13) plen 5    #358 [hci1] 21.482638
        Num handles: 1
        Handle: 1209 Address: DF:A9:FF:F6:B1:1A (OUI DF-A9-FF)
        Count: 1
        #356: len 5 (0 Kb/s)
        Latency: 77 msec (67-172 msec ~120 msec)
> HCI Event: Number of Completed Packets (0x13) plen 5    #359 [hci1] 21.569749
        Num handles: 1
        Handle: 1209 Address: DF:A9:FF:F6:B1:1A (OUI DF-A9-FF)
        Count: 1
        #357: len 10 (0 Kb/s)
        Latency: 164 msec (67-172 msec ~142 msec)
> ACL Data RX: Handle 1209 flags 0x02 dlen 5              #360 [hci1] 21.569943
      ATT: Handle Value Confirmation (0x1e) len 0
< HCI Command: Host Number of Com.. (0x03|0x0035) plen 5  #361 [hci1] 21.585443
        Num handles: 1
        Handle: 1209 Address: DF:A9:FF:F6:B1:1A (OUI DF-A9-FF)
        Count: 1
< ACL Data TX: Handle 1209 flags 0x00 dlen 27             #362 [hci1] 21.585549
< ACL Data TX: Handle 1209 flags 0x01 dlen 8              #363 [hci1] 21.585643
      Channel: 84 len 31 sdu 29 [PSM 37 mode LE Flow Control (0x80)] {chan 0}
        1d 00 05 53 74 61 72 74 00 00 00 00 06 4d 69 64  ...Start.....Mid
        64 6c 65 d0 07 00 00 03 45 6e 64 88 13 00 00     dle.....End.... 
> HCI Event: Number of Completed Packets (0x13) plen 5    #364 [hci1] 21.657832
        Num handles: 1
        Handle: 1209 Address: DF:A9:FF:F6:B1:1A (OUI DF-A9-FF)
        Count: 1
        #362: len 27 (3 Kb/s)
        Latency: 72 msec (67-172 msec ~107 msec)
        Channel: 84 [PSM 37 mode LE Flow Control (0x80)] {chan 0}
        Channel Latency: 72 msec (72-72 msec ~72 msec)
> HCI Event: Number of Completed Packets (0x13) plen 5    #365 [hci1] 21.744676
        Num handles: 1
        Handle: 1209 Address: DF:A9:FF:F6:B1:1A (OUI DF-A9-FF)
        Count: 1
        #363: len 8 (0 Kb/s)
        Latency: 159 msec (67-172 msec ~133 msec)
> ACL Data RX: Handle 1209 flags 0x02 dlen 12             #366 [hci1] 22.269849
      LE L2CAP: Disconnection Request (0x06) ident 2 len 4
        Destination CID: 64
        Source CID: 84
< HCI Command: Host Number of Com.. (0x03|0x0035) plen 5  #367 [hci1] 22.284955
        Num handles: 1
        Handle: 1209 Address: DF:A9:FF:F6:B1:1A (OUI DF-A9-FF)
        Count: 1
< ACL Data TX: Handle 1209 flags 0x00 dlen 12             #368 [hci1] 22.285052
      LE L2CAP: Disconnection Response (0x07) ident 2 len 4
        Destination CID: 64
        Source CID: 84
> HCI Event: Number of Completed Packets (0x13) plen 5    #369 [hci1] 22.444722
        Num handles: 1
        Handle: 1209 Address: DF:A9:FF:F6:B1:1A (OUI DF-A9-FF)
        Count: 1
        #368: len 12 (0 Kb/s)
        Latency: 159 msec (67-172 msec ~146 msec)
> ACL Data RX: Handle 1209 flags 0x02 dlen 7              #370 [hci1] 22.444910
      ATT: Read Request (0x0a) len 2
        Handle: 0x004a
< HCI Command: Host Number of Com.. (0x03|0x0035) plen 5  #371 [hci1] 22.465203
        Num handles: 1
        Handle: 1209 Address: DF:A9:FF:F6:B1:1A (OUI DF-A9-FF)
        Count: 1
< ACL Data TX: Handle 1209 flags 0x00 dlen 9              #372 [hci1] 22.465290
      ATT: Read Response (0x0b) len 4
> HCI Event: Number of Completed Packets (0x13) plen 5    #373 [hci1] 22.619841
        Num handles: 1
        Handle: 1209 Address: DF:A9:FF:F6:B1:1A (OUI DF-A9-FF)
        Count: 1
        #372: len 9 (0 Kb/s)
        Latency: 154 msec (67-172 msec ~150 msec)
> ACL Data RX: Handle 1209 flags 0x02 dlen 12             #374 [hci1] 22.620188
      ATT: Write Command (0x52) len 7
        Handle: 0x0069
          Data: 2401000000
< HCI Command: Host Number of Com.. (0x03|0x0035) plen 5  #375 [hci1] 22.625737
        Num handles: 1
        Handle: 1209 Address: DF:A9:FF:F6:B1:1A (OUI DF-A9-FF)
        Count: 1
< ACL Data TX: Handle 1209 flags 0x00 dlen 9              #376 [hci1] 22.626008
      ATT: Handle Value Notification (0x1b) len 4
        Handle: 0x0069
          Data: 2401
> HCI Event: Number of Completed Packets (0x13) plen 5    #377 [hci1] 22.794757
        Num handles: 1
        Handle: 1209 Address: DF:A9:FF:F6:B1:1A (OUI DF-A9-FF)
        Count: 1
        #376: len 9 (0 Kb/s)
        Latency: 168 msec (67-172 msec ~159 msec)
> ACL Data RX: Handle 1209 flags 0x02 dlen 7              #378 [hci1] 22.882322
      ATT: Read Request (0x0a) len 2
        Handle: 0x004a
< HCI Command: Host Number of Com.. (0x03|0x0035) plen 5  #379 [hci1] 22.885011
        Num handles: 1
        Handle: 1209 Address: DF:A9:FF:F6:B1:1A (OUI DF-A9-FF)
        Count: 1
< ACL Data TX: Handle 1209 flags 0x00 dlen 9              #380 [hci1] 22.885099
      ATT: Read Response (0x0b) len 4
> HCI Event: Number of Completed Packets (0x13) plen 5    #381 [hci1] 23.057253
        Num handles: 1
        Handle: 1209 Address: DF:A9:FF:F6:B1:1A (OUI DF-A9-FF)
        Count: 1
        #380: len 9 (0 Kb/s)
        Latency: 172 msec (67-172 msec ~165 msec)
> ACL Data RX: Handle 1209 flags 0x02 dlen 7              #382 [hci1] 23.057460
      ATT: Read Request (0x0a) len 2
        Handle: 0x004a
< HCI Command: Host Number of Com.. (0x03|0x0035) plen 5  #383 [hci1] 23.065176
        Num handles: 1
        Handle: 1209 Address: DF:A9:FF:F6:B1:1A (OUI DF-A9-FF)
        Count: 1
< ACL Data TX: Handle 1209 flags 0x00 dlen 9              #384 [hci1] 23.065261
      ATT: Read Response (0x0b) len 4
> HCI Event: Number of Completed Packets (0x13) plen 5    #385 [hci1] 23.232306
        Num handles: 1
        Handle: 1209 Address: DF:A9:FF:F6:B1:1A (OUI DF-A9-FF)
        Count: 1
        #384: len 9 (0 Kb/s)
        Latency: 167 msec (67-172 msec ~166 msec)
> ACL Data RX: Handle 1209 flags 0x02 dlen 12             #386 [hci1] 23.232592
      ATT: Write Command (0x52) len 7
        Handle: 0x0069
          Data: 24ffffffff
< HCI Command: Host Number of Com.. (0x03|0x0035) plen 5  #387 [hci1] 23.245656
        Num handles: 1
        Handle: 1209 Address: DF:A9:FF:F6:B1:1A (OUI DF-A9-FF)
        Count: 1
< ACL Data TX: Handle 1209 flags 0x00 dlen 9              #388 [hci1] 23.245986
      ATT: Handle Value Notification (0x1b) len 4
        Handle: 0x0069
          Data: 2401
> HCI Event: Number of Completed Packets (0x13) plen 5    #389 [hci1] 23.407130
        Num handles: 1
        Handle: 1209 Address: DF:A9:FF:F6:B1:1A (OUI DF-A9-FF)
        Count: 1
        #388: len 9 (0 Kb/s)
        Latency: 161 msec (67-172 msec ~163 msec)
> ACL Data RX: Handle 1209 flags 0x02 dlen 7              #390 [hci1] 23.494812
      ATT: Read Request (0x0a) len 2
        Handle: 0x004a
< HCI Command: Host Number of Com.. (0x03|0x0035) plen 5  #391 [hci1] 23.505033
        Num handles: 1
        Handle: 1209 Address: DF:A9:FF:F6:B1:1A (OUI DF-A9-FF)
        Count: 1
< ACL Data TX: Handle 1209 flags 0x00 dlen 9              #392 [hci1] 23.505151
      ATT: Read Response (0x0b) len 4
> HCI Event: Number of Completed Packets (0x13) plen 5    #393 [hci1] 23.669640
        Num handles: 1
        Handle: 1209 Address: DF:A9:FF:F6:B1:1A (OUI DF-A9-FF)
        Count: 1
        #392: len 9 (0 Kb/s)
        Latency: 164 msec (67-172 msec ~164 msec)
> HCI Event: Disconnect Complete (0x05) plen 4            #394 [hci1] 25.070006
        Status: Success (0x00)
        Handle: 1209 Address: DF:A9:FF:F6:B1:1A (OUI DF-A9-FF)
        Reason: Remote User Terminated Connection (0x13)
< HCI Command: Reset (0x03|0x0003) plen 0                 #395 [hci1] 29.884954
> HCI Event: Command Complete (0x0e) plen 4               #396 [hci1] 29.885463
      Reset (0x03|0x0003) ncmd 1
        Status: Success (0x00)
@ USER Close: main                                    {0x0001} [hci1] 29.904568
= Close Index: 00:00:00:00:00:00                               [hci1] 29.904578
