Bluetooth monitor ver 5.84
btmon[2145976]: = Note: Linux version 6.8.0-83-generic (x86_64)                                                          0.537601
btmon[2145976]: = Note: Bluetooth subsystem version 2.22                                                                 0.537602
= New Index: 00:00:00:00:00:00 (Primary,UART,hci0)                                                                       0.537603
= Open Index: 00:00:00:00:00:00                                                                                          0.541887
= Index Info: 00:00:00:00:00:00 (Nordic Semiconductor ASA)                                                               0.541889
zephyr.exe[2145978]: @ USER Open: main (privileged) version 2.22                                                {0x0001} 0.541892
zephyr.exe[2145978]: < HCI Command: Reset (0x03|0x0003) plen 0                                                        #1 0.541980
> HCI Event: Command Complete (0x0e) plen 4                                                                           #2 0.542526
      Reset (0x03|0x0003) ncmd 1
        Status: Success (0x00)
zephyr.exe[2145978]: < HCI Command: Read Local Supported Features (0x04|0x0003) plen 0                                #3 0.561881
> HCI Event: Command Complete (0x0e) plen 12                                                                          #4 0.562371
      Read Local Supported Features (0x04|0x0003) ncmd 1
        Status: Success (0x00)
        Features: 0x00 0x00 0x00 0x00 0x60 0x00 0x00 0x00
          BR/EDR Not Supported
          LE Supported (Controller)
zephyr.exe[2145978]: < HCI Command: Read Local Version Information (0x04|0x0001) plen 0                               #5 0.581909
> HCI Event: Command Complete (0x0e) plen 12                                                                          #6 0.582396
      Read Local Version Information (0x04|0x0001) ncmd 1
        Status: Success (0x00)
        HCI version: Reserved (0x0e) - Revision 12520 (0x30e8)
        LMP version: Reserved (0x0e) - Subversion 12520 (0x30e8)
        Manufacturer: Nordic Semiconductor ASA (89)
zephyr.exe[2145978]: < HCI Command: Read Local Supported Commands (0x04|0x0002) plen 0                                #7 0.601926
> HCI Event: Command Complete (0x0e) plen 68                                                                          #8 0.602981
      Read Local Supported Commands (0x04|0x0002) ncmd 1
        Status: Success (0x00)
        Commands: 119 entries
          Disconnect (Octet 0 - Bit 5)
          Read Remote Version Information (Octet 2 - Bit 7)
          Set Event Mask (Octet 5 - Bit 6)
          Reset (Octet 5 - Bit 7)
          Read Connection Accept Timeout (Octet 7 - Bit 2)
          Write Connection Accept Timeout (Octet 7 - Bit 3)
          Read Transmit Power Level (Octet 10 - Bit 2)
          Set Controller To Host Flow Control (Octet 10 - Bit 5)
          Host Buffer Size (Octet 10 - Bit 6)
          Host Number of Completed Packets (Octet 10 - Bit 7)
          Read Local Version Information (Octet 14 - Bit 3)
          Read Local Supported Features (Octet 14 - Bit 5)
          Read BD ADDR (Octet 15 - Bit 1)
          Read RSSI (Octet 15 - Bit 5)
          Set Event Mask Page 2 (Octet 22 - Bit 2)
          LE Set Event Mask (Octet 25 - Bit 0)
          LE Read Buffer Size (Octet 25 - Bit 1)
          LE Read Local Supported Features (Octet 25 - Bit 2)
          LE Set Random Address (Octet 25 - Bit 4)
          LE Set Advertising Parameters (Octet 25 - Bit 5)
          LE Read Advertising Channel TX Power (Octet 25 - Bit 6)
          LE Set Advertising Data (Octet 25 - Bit 7)
          LE Set Scan Response Data (Octet 26 - Bit 0)
          LE Set Advertise Enable (Octet 26 - Bit 1)
          LE Set Scan Parameters (Octet 26 - Bit 2)
          LE Set Scan Enable (Octet 26 - Bit 3)
          LE Create Connection (Octet 26 - Bit 4)
          LE Create Connection Cancel (Octet 26 - Bit 5)
          LE Read Accept List Size (Octet 26 - Bit 6)
          LE Clear Accept List (Octet 26 - Bit 7)
          LE Add Device To Accept List (Octet 27 - Bit 0)
          LE Remove Device From Accept List (Octet 27 - Bit 1)
          LE Connection Update (Octet 27 - Bit 2)
          LE Set Host Channel Classification (Octet 27 - Bit 3)
          LE Read Channel Map (Octet 27 - Bit 4)
          LE Read Remote Used Features (Octet 27 - Bit 5)
          LE Encrypt (Octet 27 - Bit 6)
          LE Rand (Octet 27 - Bit 7)
          LE Start Encryption (Octet 28 - Bit 0)
          LE Long Term Key Request Reply (Octet 28 - Bit 1)
          LE Long Term Key Request Neg Reply (Octet 28 - Bit 2)
          LE Read Supported States (Octet 28 - Bit 3)
          LE Receiver Test (Octet 28 - Bit 4)
          LE Transmitter Test (Octet 28 - Bit 5)
          LE Test End (Octet 28 - Bit 6)
          Read Authenticated Payload Timeout (Octet 32 - Bit 4)
          Write Authenticated Payload Timeout (Octet 32 - Bit 5)
          LE Set Data Length (Octet 33 - Bit 6)
          LE Read Suggested Default Data Length (Octet 33 - Bit 7)
          LE Write Suggested Default Data Length (Octet 34 - Bit 0)
          LE Add Device To Resolving List (Octet 34 - Bit 3)
          LE Remove Device From Resolving List (Octet 34 - Bit 4)
          LE Clear Resolving List (Octet 34 - Bit 5)
          LE Read Resolving List Size (Octet 34 - Bit 6)
          LE Set Address Resolution Enable (Octet 35 - Bit 1)
          LE Set Resolvable Private Address Timeout (Octet 35 - Bit 2)
          LE Read Maximum Data Length (Octet 35 - Bit 3)
          LE Read PHY (Octet 35 - Bit 4)
          LE Set Default PHY (Octet 35 - Bit 5)
          LE Set PHY (Octet 35 - Bit 6)
          LE Enhanced Receiver Test (Octet 35 - Bit 7)
          LE Enhanced Transmitter Test (Octet 36 - Bit 0)
          LE Set Advertising Set Random Address (Octet 36 - Bit 1)
          LE Set Extended Advertising Parameters (Octet 36 - Bit 2)
          LE Set Extended Advertising Data (Octet 36 - Bit 3)
          LE Set Extended Scan Response Data (Octet 36 - Bit 4)
          LE Set Extended Advertising Enable (Octet 36 - Bit 5)
          LE Read Maximum Advertising Data Length (Octet 36 - Bit 6)
          LE Read Number of Supported Advertising Sets (Octet 36 - Bit 7)
          LE Remove Advertising Set (Octet 37 - Bit 0)
          LE Clear Advertising Sets (Octet 37 - Bit 1)
          LE Set Periodic Advertising Parameters (Octet 37 - Bit 2)
          LE Set Periodic Advertising Data (Octet 37 - Bit 3)
          LE Set Periodic Advertising Enable (Octet 37 - Bit 4)
          LE Set Extended Scan Parameters (Octet 37 - Bit 5)
          LE Set Extended Scan Enable (Octet 37 - Bit 6)
          LE Extended Create Connection (Octet 37 - Bit 7)
          LE Periodic Advertising Create Sync (Octet 38 - Bit 0)
          LE Periodic Advertising Create Sync Cancel (Octet 38 - Bit 1)
          LE Periodic Advertising Terminate Sync (Octet 38 - Bit 2)
          LE Add Device To Periodic Advertiser List (Octet 38 - Bit 3)
          LE Remove Device From Periodic Advertiser List (Octet 38 - Bit 4)
          LE Clear Periodic Advertiser List (Octet 38 - Bit 5)
          LE Read Periodic Advertiser List Size (Octet 38 - Bit 6)
          LE Read Transmit Power (Octet 38 - Bit 7)
          LE Read RF Path Compensation (Octet 39 - Bit 0)
          LE Write RF Path Compensation (Octet 39 - Bit 1)
          LE Set Privacy Mode (Octet 39 - Bit 2)
          LE Periodic Advertising Receive Enable (Octet 40 - Bit 5)
          LE Periodic Advertising Sync Transfer (Octet 40 - Bit 6)
          LE Periodic Advertising Set Info Transfer (Octet 40 - Bit 7)
          LE Periodic Advertising Sync Transfer Parameters (Octet 41 - Bit 0)
          LE Set Default Periodic Advertisng Sync Transfer Parameters (Octet 41 - Bit 1)
          LE Read Buffer v2 (Octet 41 - Bit 5)
          LE Read ISO TX Sync (Octet 41 - Bit 6)
          LE Set Connected Isochronous Group Parameters (Octet 41 - Bit 7)
          LE Set Connected Isochronous Group Parameters Test (Octet 42 - Bit 0)
          LE Create Connected Isochronous Stream (Octet 42 - Bit 1)
          LE Remove Connected Isochronous Group (Octet 42 - Bit 2)
          LE Accept Connected Isochronous Stream Request (Octet 42 - Bit 3)
          LE Reject Connected Isochronous Stream Request (Octet 42 - Bit 4)
          LE Create Broadcast Isochronous Group (Octet 42 - Bit 5)
          LE Create Broadcast Isochronous Group Test (Octet 42 - Bit 6)
          LE Terminate Broadcast Isochronous Group (Octet 42 - Bit 7)
          LE Broadcast Isochronous Group Create Sync (Octet 43 - Bit 0)
          LE Broadcast Isochronous Group Terminate Sync (Octet 43 - Bit 1)
          LE Request Peer SCA (Octet 43 - Bit 2)
          LE Setup Isochronous Data Path (Octet 43 - Bit 3)
          LE Remove Isochronous Data Path (Octet 43 - Bit 4)
          LE Isochronous Transmit Test (Octet 43 - Bit 5)
          LE Isochronous Receive Test (Octet 43 - Bit 6)
          LE Isochronous Read Test Counters (Octet 43 - Bit 7)
          LE Isochronous Read Test Counters (Octet 44 - Bit 0)
          LE Set Host Feature (Octet 44 - Bit 1)
          LE Read ISO link quality (Octet 44 - Bit 2)
          Octet 45 - Bit 6 
          Octet 46 - Bit 0 
          Octet 46 - Bit 1 
          Octet 46 - Bit 2 
zephyr.exe[2145978]: < HCI Command: Host Buffer Size (0x03|0x0033) plen 7                                             #9 0.621952
        ACL MTU: 255  ACL max packet: 16
        SCO MTU: 0    SCO max packet: 0
> HCI Event: Command Complete (0x0e) plen 4                                                                          #10 0.622478
      Host Buffer Size (0x03|0x0033) ncmd 1
        Status: Success (0x00)
zephyr.exe[2145978]: < HCI Command: Set Controller To Host Flow Control (0x03|0x0031) plen 1                         #11 0.641922
        Flow control: ACL Data Packets (0x01)
> HCI Event: Command Complete (0x0e) plen 4                                                                          #12 0.642317
      Set Controller To Host Flow Control (0x03|0x0031) ncmd 1
        Status: Success (0x00)
zephyr.exe[2145978]: < HCI Command: LE Read Local Supported Features (0x08|0x0003) plen 0                            #13 0.661969
> HCI Event: Command Complete (0x0e) plen 12                                                                         #14 0.663528
      LE Read Local Supported Features (0x08|0x0003) ncmd 1
        Status: Success (0x00)
        Features: 0xfd 0x79 0x00 0xf7 0x30 0x01 0x00 0x00
          LE Encryption
          Extended Reject Indication
          Peripheral-initiated Features Exchange
          LE Ping
          LE Data Packet Length Extension
          LL Privacy
          Extended Scanner Filter Policies
          LE 2M PHY
          LE Coded PHY
          LE Extended Advertising
          LE Periodic Advertising
          Channel Selection Algorithm #2
          Periodic Advertising Sync Transfer - Sender
          Periodic Advertising Sync Transfer - Recipient
          Sleep Clock Accuracy Updates
          Connected Isochronous Stream - Central
          Connected Isochronous Stream - Peripheral
          Isochronous Broadcaster
          Synchronized Receiver
          Periodic Advertising ADI support
          Connection Subrating
          Unknown features (0x0000010000000000)
zephyr.exe[2145978]: < HCI Command: LE Set Host Feature (0x08|0x0074) plen 2                                         #15 0.681956
        Bit Number: 32
          Connected Isochronous Stream (Host Support)
        Bit Value: 1
> HCI Event: Command Complete (0x0e) plen 4                                                                          #16 0.682378
      LE Set Host Feature (0x08|0x0074) ncmd 1
        Status: Success (0x00)
zephyr.exe[2145978]: < HCI Command: LE Read Buffer v2 (0x08|0x0060) plen 0                                           #17 0.701972
> HCI Event: Command Complete (0x0e) plen 10                                                                         #18 0.702406
      LE Read Buffer v2 (0x08|0x0060) ncmd 1
        Status: Success (0x00)
        ACL MTU: 27
        ACL max packet: 3
        ISO MTU: 318
        ISO max packet: 3
zephyr.exe[2145978]: < HCI Command: LE Read Maximum Advertising Data Length (0x08|0x003a) plen 0                     #19 0.721954
> HCI Event: Command Complete (0x0e) plen 6                                                                          #20 0.722291
      LE Read Maximum Advertising Data Length (0x08|0x003a) ncmd 1
        Status: Success (0x00)
        Max length: 1650
zephyr.exe[2145978]: < HCI Command: LE Read Supported States (0x08|0x001c) plen 0                                    #21 0.741941
> HCI Event: Command Complete (0x0e) plen 12                                                                         #22 0.742470
      LE Read Supported States (0x08|0x001c) ncmd 1
        Status: Success (0x00)
        States: 0x000003ff3e0306ff
          Non-connectable Advertising State
          Scannable Advertising State
          Connectable Advertising State
          High Duty Cycle Directed Advertising State
          Passive Scanning State
          Active Scanning State
          Initiating State
            and Connection State (Central Role)
          Connection State (Peripheral Role)
          Scannable Advertising State
            and Passive Scanning State
          Connectable Advertising State
            and Passive Scanning State
          Non-connectable Advertising State
            and Initiating State
          Scannable Advertising State
            and Initiating State
          Active Scanning State
            and Connection State (Central Role)
          Passive Scanning State
            and Connection State (Peripheral Role)
          Active Scanning State
            and Connection State (Peripheral Role)
          Initiating State
            and Connection State (Central Role)
            and Central Role & Central Role
          Low Duty Cycle Directed Advertising State
          Connectable Advertising State
            and Initiating State
            and Central Role & Peripheral Role
          High Duty Cycle Directed Advertising State
            and Initiating State
            and Central Role & Peripheral Role
          Low Duty Cycle Directed Advertising State
            and Initiating State
            and Central Role & Peripheral Role
          Connectable Advertising State
            and Connection State (Central Role)
            and Central Role & Peripheral Role
          High Duty Cycle Directed Advertising State
            and Connection State (Central Role)
            and Central Role & Peripheral Role
          Low Duty Cycle Directed Advertising State
            and Connection State (Central Role)
            and Central Role & Peripheral Role
          Connectable Advertising State
            and Connection State (Peripheral Role)
            and Central Role & Peripheral Role
          High Duty Cycle Directed Advertising State
            and Connection State (Peripheral Role)
            and Peripheral Role & Peripheral Role
          Low Duty Cycle Directed Advertising State
            and Connection State (Peripheral Role)
            and Peripheral Role & Peripheral Role
          Initiating State
            and Connection State (Peripheral Role)
            and Central Role & Peripheral Role
zephyr.exe[2145978]: < HCI Command: LE Read Maximum Data Length (0x08|0x002f) plen 0                                 #23 0.761928
> HCI Event: Command Complete (0x0e) plen 12                                                                         #24 0.762421
      LE Read Maximum Data Length (0x08|0x002f) ncmd 1
        Status: Success (0x00)
        Max TX octets: 251
        Max TX time: 2704
        Max RX octets: 251
        Max RX time: 2704
zephyr.exe[2145978]: < HCI Command: LE Write Suggested Default Data Length (0x08|0x0024) plen 4                      #25 0.781880
        TX octets: 251
        TX time: 2704
> HCI Event: Command Complete (0x0e) plen 4                                                                          #26 0.782312
      LE Write Suggested Default Data Length (0x08|0x0024) ncmd 1
        Status: Success (0x00)
zephyr.exe[2145978]: < HCI Command: LE Read Resolving List Size (0x08|0x002a) plen 0                                 #27 0.801938
> HCI Event: Command Complete (0x0e) plen 5                                                                          #28 0.802347
      LE Read Resolving List Size (0x08|0x002a) ncmd 1
        Status: Success (0x00)
        Size: 8
zephyr.exe[2145978]: < HCI Command: LE Set Event Mask (0x08|0x0001) plen 8                                           #29 0.821943
        Mask: 0x000002023f87fa5e
          LE Advertising Report
          LE Connection Update Complete
          LE Read Remote Used Features Complete
          LE Long Term Key Request
          LE Data Length Change
          LE Enhanced Connection Complete
          LE PHY Update Complete
          LE Extended Advertising Report
          LE Periodic Advertising Sync Established
          LE Periodic Advertising Report
          LE Periodic Advertising Sync Lost
          LE Extended Scan Timeout
          LE Extended Advertising Set Terminated
          LE Scan Request Received
          LE Periodic Advertising Sync Transfer Rvc
          LE CIS Established
          LE CIS Request
          LE Create BIG Complete
          LE Terminate BIG Complete
          LE BIG Sync Established Complete
          LE BIG Sync Lost
          LE BIG Info Advertising Report
          Unknown mask (0x0000020000000000)
> HCI Event: Command Complete (0x0e) plen 4                                                                          #30 0.822461
      LE Set Event Mask (0x08|0x0001) ncmd 1
        Status: Success (0x00)
zephyr.exe[2145978]: < HCI Command: Set Event Mask (0x03|0x0001) plen 8                                              #31 0.841810
        Mask: 0x2000800002008890
          Disconnection Complete
          Encryption Change
          Read Remote Version Information Complete
          Hardware Error
          Data Buffer Overflow
          Encryption Key Refresh Complete
          LE Meta
> HCI Event: Command Complete (0x0e) plen 4                                                                          #32 0.842280
      Set Event Mask (0x03|0x0001) ncmd 1
        Status: Success (0x00)
zephyr.exe[2145978]: < HCI Command: Read BD ADDR (0x04|0x0009) plen 0                                                #33 0.861933
> HCI Event: Command Complete (0x0e) plen 10                                                                         #34 0.862358
      Read BD ADDR (0x04|0x0009) ncmd 1
        Status: Success (0x00)
        Address: 00:00:00:00:00:00 (OUI 00-00-00)
zephyr.exe[2145978]: < HCI Command: LE Set Random Address (0x08|0x0005) plen 6                                       #35 0.881939
        Address: D5:B6:CC:31:DB:3B (Static)
> HCI Event: Command Complete (0x0e) plen 4                                                                          #36 0.882406
      LE Set Random Address (0x08|0x0005) ncmd 1
        Status: Success (0x00)
zephyr.exe[2145978]: < HCI Command: LE Set Extended Advertising Parameters (0x08|0x0036) plen 25                     #37 3.282000
        Handle: 0x00
        Properties: 0x0013
          Connectable
          Scannable
          Use legacy advertising PDUs: ADV_IND
        Min advertising interval: 100.000 msec (0x00a0)
        Max advertising interval: 150.000 msec (0x00f0)
        Channel map: 37, 38, 39 (0x07)
        Own address type: Random (0x01)
        Peer address type: Public (0x00)
        Peer address: 00:00:00:00:00:00 (OUI 00-00-00)
        Filter policy: Allow Scan Request from Any, Allow Connect Request from Any (0x00)
        TX power: Host has no preference (0x7f)
        Primary PHY: LE 1M (0x01)
        Secondary max skip: 0x00
        Secondary PHY: LE 1M (0x01)
        SID: 0x00
        Scan request notifications: Disabled (0x00)
> HCI Event: Command Complete (0x0e) plen 5                                                                          #38 3.282782
      LE Set Extended Advertising Parameters (0x08|0x0036) ncmd 1
        Status: Success (0x00)
        TX power (selected): 0 dbm (0x00)
zephyr.exe[2145978]: < HCI Command: LE Set Advertising Set Random Address (0x08|0x0035) plen 7                       #39 3.301941
        Advertising handle: 0x00
        Advertising random address: D5:B6:CC:31:DB:3B (Static)
> HCI Event: Command Complete (0x0e) plen 4                                                                          #40 3.302456
      LE Set Advertising Set Random Address (0x08|0x0035) ncmd 1
        Status: Success (0x00)
zephyr.exe[2145978]: < HCI Command: LE Set Extended Advertising Data (0x08|0x0037) plen 22                           #41 3.321951
        Handle: 0x00
        Operation: Complete extended advertising data (0x03)
        Fragment preference: Minimize fragmentation (0x01)
        Data length: 0x12
        Flags: 0x06
          LE General Discoverable Mode
          BR/EDR Not Supported
        Name (complete): Tester_2CB6EE
> HCI Event: Command Complete (0x0e) plen 4                                                                          #42 3.322693
      LE Set Extended Advertising Data (0x08|0x0037) ncmd 1
        Status: Success (0x00)
zephyr.exe[2145978]: < HCI Command: LE Set Extended Scan Response Data (0x08|0x0038) plen 4                          #43 3.341828
        Handle: 0x00
        Operation: Complete scan response data (0x03)
        Fragment preference: Minimize fragmentation (0x01)
        Data length: 0x00
> HCI Event: Command Complete (0x0e) plen 4                                                                          #44 3.342230
      LE Set Extended Scan Response Data (0x08|0x0038) ncmd 1
        Status: Success (0x00)
zephyr.exe[2145978]: < HCI Command: LE Set Extended Advertising Enable (0x08|0x0039) plen 6                          #45 3.361958
        Extended advertising: Enabled (0x01)
        Number of sets: 1 (0x01)
        Entry 0
          Handle: 0x00
          Duration: 0 ms (0x00)
          Max ext adv events: 0
> HCI Event: Command Complete (0x0e) plen 4                                                                          #46 3.362590
      LE Set Extended Advertising Enable (0x08|0x0039) ncmd 1
        Status: Success (0x00)
> HCI Event: LE Meta Event (0x3e) plen 31                                                                            #47 3.481000
      LE Enhanced Connection Complete (0x0a)
        Status: Success (0x00)
        Handle: 309
        Role: Peripheral (0x01)
        Peer address type: Public (0x00)
        Peer address: C0:07:E8:2C:B6:EE (OUI C0-07-E8)
        Local resolvable private address: 00:00:00:00:00:00 (Non-Resolvable)
        Peer resolvable private address: 00:00:00:00:00:00 (Non-Resolvable)
        Connection interval: 62.50 msec (0x0032)
        Connection latency: 0 (0x0000)
        Supervision timeout: 25120 msec (0x09d0)
        Central clock accuracy: 0x07
> HCI Event: LE Meta Event (0x3e) plen 6                                                                             #48 3.481116
      LE Advertising Set Terminated (0x12)
        Status: Success (0x00)
        Handle: 0
        Connection handle: 309
        Number of completed extended advertising events: 0
zephyr.exe[2145978]: < HCI Command: LE Read Remote Used Features (0x08|0x0016) plen 2                                #49 3.481943
        Handle: 309 Address: C0:07:E8:2C:B6:EE (OUI C0-07-E8)
> HCI Event: Command Status (0x0f) plen 4                                                                            #50 3.482593
      LE Read Remote Used Features (0x08|0x0016) ncmd 1
        Status: Success (0x00)
zephyr.exe[2145978]: < HCI Command: LE Set PHY (0x08|0x0032) plen 7                                                  #51 3.501901
        Handle: 309 Address: C0:07:E8:2C:B6:EE (OUI C0-07-E8)
        All PHYs preference: 0x00
        TX PHYs preference: 0x02
          LE 2M
        RX PHYs preference: 0x02
          LE 2M
        PHY options preference: Reserved (0x0000)
> HCI Event: Command Status (0x0f) plen 4                                                                            #52 3.502372
      LE Set PHY (0x08|0x0032) ncmd 1
        Status: Success (0x00)
zephyr.exe[2145978]: < ACL Data TX: Handle 309 [1/3] flags 0x00 dlen 7                                               #53 3.521946
      ATT: Exchange MTU Request (0x02) len 2
        Client RX MTU: 251
> HCI Event: Number of Completed Packets (0x13) plen 5                                                               #54 3.607070
        Num handles: 1
        Handle: 309 Address: C0:07:E8:2C:B6:EE (OUI C0-07-E8)
        Count: 1
        Buffers: 0/3
        #53: len 7 (0 Kb/s)
        Latency: 85 msec (85-85 msec ~85 msec)
> HCI Event: LE Meta Event (0x3e) plen 12                                                                            #55 3.669940
      LE Read Remote Used Features (0x04)
        Status: Success (0x00)
        Handle: 309 Address: C0:07:E8:2C:B6:EE (OUI C0-07-E8)
        Features: 0x2d 0x49 0x01 0xf7 0xef 0x39 0x00 0x80
          LE Encryption
          Extended Reject Indication
          Peripheral-initiated Features Exchange
          LE Data Packet Length Extension
          LE 2M PHY
          LE Coded PHY
          Channel Selection Algorithm #2
          Minimum Number of Used Channels Procedure
          Periodic Advertising Sync Transfer - Sender
          Periodic Advertising Sync Transfer - Recipient
          Sleep Clock Accuracy Updates
          Connected Isochronous Stream - Central
          Connected Isochronous Stream - Peripheral
          Isochronous Broadcaster
          Synchronized Receiver
          Connected Isochronous Stream (Host Support)
          LE Power Control Request
          LE Power Control Request
          LE Path Loss Monitoring
          Connection Subrating
          Connection Subrating (Host Support)
          Channel Classification
          Unknown features (0x8000390000000000)
> HCI Event: LE Meta Event (0x3e) plen 6                                                                             #56 4.169246
      LE PHY Update Complete (0x0c)
        Status: Success (0x00)
        Handle: 309 Address: C0:07:E8:2C:B6:EE (OUI C0-07-E8)
        TX PHY: LE 2M (0x02)
        RX PHY: LE 2M (0x02)
> ACL Data RX: Handle 309 flags 0x02 dlen 11                                                                         #57 5.982164
      SMP: Pairing Request (0x01) len 6
        IO capability: KeyboardDisplay (0x04)
        OOB data: Authentication data not present (0x00)
        Authentication requirement: Bonding, No MITM, SC, No Keypresses (0x09)
        Max encryption key size: 16
        Initiator key distribution: EncKey IdKey (0x03)
        Responder key distribution: EncKey IdKey Sign (0x07)
> ACL Data RX: Handle 309 flags 0x02 dlen 7                                                                          #58 5.982492
      ATT: Exchange MTU Response (0x03) len 2
        Server RX MTU: 23
zephyr.exe[2145978]: < HCI Command: Host Number of Completed Packets (0x03|0x0035) plen 5                            #59 6.001974
        Num handles: 1
        Handle: 309 Address: C0:07:E8:2C:B6:EE (OUI C0-07-E8)
        Count: 1
zephyr.exe[2145978]: < ACL Data TX: Handle 309 [1/3] flags 0x00 dlen 11                                              #60 6.001982
      SMP: Pairing Response (0x02) len 6
        IO capability: NoInputNoOutput (0x03)
        OOB data: Authentication data not present (0x00)
        Authentication requirement: Bonding, No MITM, SC, No Keypresses (0x09)
        Max encryption key size: 16
        Initiator key distribution: IdKey (0x02)
        Responder key distribution: Sign (0x04)
zephyr.exe[2145978]: < HCI Command: Host Number of Completed Packets (0x03|0x0035) plen 5                            #61 6.001994
        Num handles: 1
        Handle: 309 Address: C0:07:E8:2C:B6:EE (OUI C0-07-E8)
        Count: 1
> HCI Event: Number of Completed Packets (0x13) plen 5                                                               #62 6.107164
        Num handles: 1
        Handle: 309 Address: C0:07:E8:2C:B6:EE (OUI C0-07-E8)
        Count: 1
        Buffers: 0/3
        #60: len 11 (0 Kb/s)
        Latency: 105 msec (85-105 msec ~95 msec)
> ACL Data RX: Handle 309 flags 0x02 dlen 27                                                                         #63 6.107451
> ACL Data RX: Handle 309 flags 0x01 dlen 27                                                                         #64 6.107835
> ACL Data RX: Handle 309 flags 0x01 dlen 15                                                                         #65 6.108154
      SMP: Pairing Public Key (0x0c) len 64
        X[32]: 607d0b405ad6dee6b29a77de3c3890a004dd8cff591d163820206372b23645ce
        Y[32]: f0561bf5d2b014ae39d0bc10be819e1dafc2ed2121dfc16c0d858e47c4e76844
zephyr.exe[2145978]: < HCI Command: Host Number of Completed Packets (0x03|0x0035) plen 5                            #66 6.122015
        Num handles: 1
        Handle: 309 Address: C0:07:E8:2C:B6:EE (OUI C0-07-E8)
        Count: 1
zephyr.exe[2145978]: < HCI Command: Host Number of Completed Packets (0x03|0x0035) plen 5                            #67 6.122028
        Num handles: 1
        Handle: 309 Address: C0:07:E8:2C:B6:EE (OUI C0-07-E8)
        Count: 1
zephyr.exe[2145978]: < HCI Command: Host Number of Completed Packets (0x03|0x0035) plen 5                            #68 6.122133
        Num handles: 1
        Handle: 309 Address: C0:07:E8:2C:B6:EE (OUI C0-07-E8)
        Count: 1
zephyr.exe[2145978]: < ACL Data TX: Handle 309 [1/3] flags 0x00 dlen 27                                              #69 6.122161
zephyr.exe[2145978]: < ACL Data TX: Handle 309 flags 0x01 dlen 27                                                    #70 6.122163
zephyr.exe[2145978]: < ACL Data TX: Handle 309 flags 0x01 dlen 15                                                    #71 6.122164
      SMP: Pairing Public Key (0x0c) len 64
        X[32]: 98308440221e2d910f0e54b71e7ec652857aa9b5a0dc65028824cc19db1226e9
        Y[32]: 67a4816bcb62efb21701e31fdb27561a6217575fb007a8bbdabe7e28b6f68482
> HCI Event: Number of Completed Packets (0x13) plen 5                                                               #72 6.169922
        Num handles: 1
        Handle: 309 Address: C0:07:E8:2C:B6:EE (OUI C0-07-E8)
        Count: 1
        Buffers: 0/3
        #69: len 27 (4 Kb/s)
        Latency: 47 msec (47-105 msec ~71 msec)
> HCI Event: Number of Completed Packets (0x13) plen 5                                                               #73 6.170469
        Num handles: 1
        Handle: 309 Address: C0:07:E8:2C:B6:EE (OUI C0-07-E8)
        Count: 1
        Buffers: underflow/3
        #70: len 27 (4 Kb/s)
        Latency: 48 msec (47-105 msec ~59 msec)
zephyr.exe[2145978]: < ACL Data TX: Handle 309 [1/3] flags 0x00 dlen 21                                              #74 6.181930
      SMP: Pairing Confirm (0x03) len 16
        Confirm value[16]: 127811b42e22dcdcbe874efcc6181379
> HCI Event: Number of Completed Packets (0x13) plen 5                                                               #75 6.232052
        Num handles: 1
        Handle: 309 Address: C0:07:E8:2C:B6:EE (OUI C0-07-E8)
        Count: 1
        Buffers: 0/3
        #71: len 15 (1 Kb/s)
        Latency: 109 msec (47-109 msec ~84 msec)
> HCI Event: Number of Completed Packets (0x13) plen 5                                                               #76 6.294655
        Num handles: 1
        Handle: 309 Address: C0:07:E8:2C:B6:EE (OUI C0-07-E8)
        Count: 1
        Buffers: underflow/3
        #74: len 21 (1 Kb/s)
        Latency: 112 msec (47-112 msec ~98 msec)
> ACL Data RX: Handle 309 flags 0x02 dlen 21                                                                         #77 6.294893
      SMP: Pairing Random (0x04) len 16
        Random value[16]: d624b31fd38226fc0000000000000000
zephyr.exe[2145978]: < HCI Command: Host Number of Completed Packets (0x03|0x0035) plen 5                            #78 6.302016
        Num handles: 1
        Handle: 309 Address: C0:07:E8:2C:B6:EE (OUI C0-07-E8)
        Count: 1
zephyr.exe[2145978]: < ACL Data TX: Handle 309 [1/3] flags 0x00 dlen 21                                              #79 6.302024
      SMP: Pairing Random (0x04) len 16
        Random value[16]: 8e6108f966a694cbe26df70bb96773e6
> HCI Event: Number of Completed Packets (0x13) plen 5                                                               #80 6.419536
        Num handles: 1
        Handle: 309 Address: C0:07:E8:2C:B6:EE (OUI C0-07-E8)
        Count: 1
        Buffers: 0/3
        #79: len 21 (1 Kb/s)
        Latency: 117 msec (47-117 msec ~108 msec)
> ACL Data RX: Handle 309 flags 0x02 dlen 21                                                                         #81 6.482262
      SMP: Pairing DHKey Check (0x0d) len 16
        E[16]: 58f817656aa875e2e85d4f5b4a0ade9d
zephyr.exe[2145978]: < HCI Command: Host Number of Completed Packets (0x03|0x0035) plen 5                            #82 6.502054
        Num handles: 1
        Handle: 309 Address: C0:07:E8:2C:B6:EE (OUI C0-07-E8)
        Count: 1
zephyr.exe[2145978]: < ACL Data TX: Handle 309 [1/3] flags 0x00 dlen 21                                              #83 6.502060
      SMP: Pairing DHKey Check (0x0d) len 16
        E[16]: fc081e166058b868dd47a94a8208b1dd
> HCI Event: Number of Completed Packets (0x13) plen 5                                                               #84 6.607027
        Num handles: 1
        Handle: 309 Address: C0:07:E8:2C:B6:EE (OUI C0-07-E8)
        Count: 1
        Buffers: 0/3
        #83: len 21 (1 Kb/s)
        Latency: 104 msec (47-117 msec ~106 msec)
> HCI Event: LE Meta Event (0x3e) plen 13                                                                            #85 6.669968
      LE Long Term Key Request (0x05)
        Handle: 309 Address: C0:07:E8:2C:B6:EE (OUI C0-07-E8)
        Random number: 0x0000000000000000
        Encrypted diversifier: 0x0000
zephyr.exe[2145978]: < HCI Command: LE Long Term Key Request Reply (0x08|0x001a) plen 18                             #86 6.682037
        Handle: 309 Address: C0:07:E8:2C:B6:EE (OUI C0-07-E8)
        Long term key[16]: ac4046f4eb2ac21a9b4199ebcd49a66f
> HCI Event: Command Complete (0x0e) plen 6                                                                          #87 6.682731
      LE Long Term Key Request Reply (0x08|0x001a) ncmd 1
        Status: Success (0x00)
        Handle: 309 Address: C0:07:E8:2C:B6:EE (OUI C0-07-E8)
> HCI Event: Encryption Change (0x08) plen 4                                                                         #88 6.982209
        Status: Success (0x00)
        Handle: 309 Address: C0:07:E8:2C:B6:EE (OUI C0-07-E8)
        Encryption: Enabled with AES-CCM (0x01)
zephyr.exe[2145978]: < ACL Data TX: Handle 309 [1/3] flags 0x00 dlen 21                                              #89 7.112165
      SMP: Signing Information (0x0a) len 16
        Signature key[16]: 5da095555cc64d02679f89a05211af56
> HCI Event: Number of Completed Packets (0x13) plen 5                                                               #90 7.232165
        Num handles: 1
        Handle: 309 Address: C0:07:E8:2C:B6:EE (OUI C0-07-E8)
        Count: 1
        Buffers: 0/3
        #89: len 21 (1 Kb/s)
        Latency: 120 msec (47-120 msec ~113 msec)
> ACL Data RX: Handle 309 flags 0x02 dlen 21                                                                         #91 7.232371
      SMP: Identity Information (0x08) len 16
        Identity resolving key[16]: 693ba72bfb67bd5863a0fa2b8e75c049
> ACL Data RX: Handle 309 flags 0x02 dlen 12                                                                         #92 7.232593
      SMP: Identity Address Information (0x09) len 7
        Address: C0:07:E8:2C:B6:EE (OUI C0-07-E8)
zephyr.exe[2145978]: < HCI Command: Host Number of Completed Packets (0x03|0x0035) plen 5                            #93 7.242143
        Num handles: 1
        Handle: 309 Address: C0:07:E8:2C:B6:EE (OUI C0-07-E8)
        Count: 1
zephyr.exe[2145978]: < HCI Command: LE Add Device To Resolving List (0x08|0x0027) plen 39                            #94 7.242273
        Address type: Public (0x00)
        Address: C0:07:E8:2C:B6:EE (OUI C0-07-E8)
        Peer identity resolving key[16]: 693ba72bfb67bd5863a0fa2b8e75c049
        Local identity resolving key[16]: 00000000000000000000000000000000
> HCI Event: Command Complete (0x0e) plen 4                                                                          #95 7.243201
      LE Add Device To Resolving List (0x08|0x0027) ncmd 1
        Status: Success (0x00)
zephyr.exe[2145978]: < HCI Command: LE Set Privacy Mode (0x08|0x004e) plen 8                                         #96 7.261998
        Peer Identity address type: Public (0x00)
        Peer Identity address: C0:07:E8:2C:B6:EE (OUI C0-07-E8)
        Privacy Mode: Use Device Privacy (0x01)
> HCI Event: Command Complete (0x0e) plen 4                                                                          #97 7.262524
      LE Set Privacy Mode (0x08|0x004e) ncmd 1
        Status: Success (0x00)
zephyr.exe[2145978]: < HCI Command: LE Set Address Resolution Enable (0x08|0x002d) plen 1                            #98 7.281998
        Address resolution: Enabled (0x01)
> HCI Event: Command Complete (0x0e) plen 4                                                                          #99 7.282484
      LE Set Address Resolution Enable (0x08|0x002d) ncmd 1
        Status: Success (0x00)
zephyr.exe[2145978]: < HCI Command: Host Number of Completed Packets (0x03|0x0035) plen 5                           #100 7.301973
        Num handles: 1
        Handle: 309 Address: C0:07:E8:2C:B6:EE (OUI C0-07-E8)
        Count: 1
> ACL Data RX: Handle 309 flags 0x02 dlen 13                                                                        #101 7.357182
      ATT: Find By Type Value Request (0x06) len 8
        Handle range: 0x0001-0xffff
        Attribute type: Primary Service (0x2800)
          UUID: Audio Input Control (0x1843)
zephyr.exe[2145978]: < HCI Command: Host Number of Completed Packets (0x03|0x0035) plen 5                           #102 7.362059
        Num handles: 1
        Handle: 309 Address: C0:07:E8:2C:B6:EE (OUI C0-07-E8)
        Count: 1
zephyr.exe[2145978]: < ACL Data TX: Handle 309 [1/3] flags 0x00 dlen 9                                              #103 7.362070
      ATT: Error Response (0x01) len 4
        Find By Type Value Request (0x06)
        Handle: 0x0001
        Error: Attribute Not Found (0x0a)
> HCI Event: Number of Completed Packets (0x13) plen 5                                                              #104 7.482109
        Num handles: 1
        Handle: 309 Address: C0:07:E8:2C:B6:EE (OUI C0-07-E8)
        Count: 1
        Buffers: 0/3
        #103: len 9 (0 Kb/s)
        Latency: 120 msec (47-120 msec ~116 msec)
> ACL Data RX: Handle 309 flags 0x02 dlen 11                                                                        #105 7.482297
      ATT: Read By Type Request (0x08) len 6
        Handle range: 0x0001-0xffff
        Attribute type: Include (0x2802)
zephyr.exe[2145978]: < HCI Command: Host Number of Completed Packets (0x03|0x0035) plen 5                           #106 7.502034
        Num handles: 1
        Handle: 309 Address: C0:07:E8:2C:B6:EE (OUI C0-07-E8)
        Count: 1
zephyr.exe[2145978]: < ACL Data TX: Handle 309 [1/3] flags 0x00 dlen 22                                             #107 7.502101
      ATT: Read By Type Response (0x09) len 17
        Attribute data length: 8
        Attribute data list: 2 entries
        Handle: 0x005d
        Value[6]: 24002f004518
        Handle: 0x005e
        Value[6]: 30003b004518
> HCI Event: Number of Completed Packets (0x13) plen 5                                                              #108 7.607142
        Num handles: 1
        Handle: 309 Address: C0:07:E8:2C:B6:EE (OUI C0-07-E8)
        Count: 1
        Buffers: 0/3
        #107: len 22 (1 Kb/s)
        Latency: 105 msec (47-120 msec ~110 msec)
> ACL Data RX: Handle 309 flags 0x02 dlen 11                                                                        #109 7.607321
      ATT: Read By Type Request (0x08) len 6
        Handle range: 0x005f-0xffff
        Attribute type: Include (0x2802)
zephyr.exe[2145978]: < HCI Command: Host Number of Completed Packets (0x03|0x0035) plen 5                           #110 7.622040
        Num handles: 1
        Handle: 309 Address: C0:07:E8:2C:B6:EE (OUI C0-07-E8)
        Count: 1
zephyr.exe[2145978]: < ACL Data TX: Handle 309 [1/3] flags 0x00 dlen 22                                             #111 7.622046
      ATT: Read By Type Response (0x09) len 17
        Attribute data length: 8
        Attribute data list: 2 entries
        Handle: 0x005f
        Value[6]: 3c004b004318
        Handle: 0x0060
        Value[6]: 4c005b004318
> HCI Event: Number of Completed Packets (0x13) plen 5                                                              #112 7.732093
        Num handles: 1
        Handle: 309 Address: C0:07:E8:2C:B6:EE (OUI C0-07-E8)
        Count: 1
        Buffers: 0/3
        #111: len 22 (1 Kb/s)
        Latency: 110 msec (47-120 msec ~110 msec)
> ACL Data RX: Handle 309 flags 0x02 dlen 11                                                                        #113 7.732303
      ATT: Read By Type Request (0x08) len 6
        Handle range: 0x0061-0xffff
        Attribute type: Include (0x2802)
zephyr.exe[2145978]: < HCI Command: Host Number of Completed Packets (0x03|0x0035) plen 5                           #114 7.742037
        Num handles: 1
        Handle: 309 Address: C0:07:E8:2C:B6:EE (OUI C0-07-E8)
        Count: 1
zephyr.exe[2145978]: < ACL Data TX: Handle 309 [1/3] flags 0x00 dlen 9                                              #115 7.742042
      ATT: Error Response (0x01) len 4
        Read By Type Request (0x08)
        Handle: 0x0061
        Error: Attribute Not Found (0x0a)
> HCI Event: Number of Completed Packets (0x13) plen 5                                                              #116 7.857074
        Num handles: 1
        Handle: 309 Address: C0:07:E8:2C:B6:EE (OUI C0-07-E8)
        Count: 1
        Buffers: 0/3
        #115: len 9 (0 Kb/s)
        Latency: 115 msec (47-120 msec ~112 msec)
> ACL Data RX: Handle 309 flags 0x02 dlen 11                                                                        #117 7.857346
      ATT: Read By Type Request (0x08) len 6
        Handle range: 0x003c-0x004b
        Attribute type: Characteristic (0x2803)
zephyr.exe[2145978]: < HCI Command: Host Number of Completed Packets (0x03|0x0035) plen 5                           #118 7.862043
        Num handles: 1
        Handle: 309 Address: C0:07:E8:2C:B6:EE (OUI C0-07-E8)
        Count: 1
zephyr.exe[2145978]: < ACL Data TX: Handle 309 [1/3] flags 0x00 dlen 20                                             #119 7.862083
      ATT: Read By Type Response (0x09) len 15
        Attribute data length: 7
        Attribute data list: 2 entries
        Handle: 0x003d
        Value[5]: 123e00772b
            Properties: 0x12
              Read (0x02)
              Notify (0x10)
            Value Handle: 0x003e
            Value UUID: Audio Input State (0x2b77)
        Handle: 0x0040
        Value[5]: 024100782b
            Properties: 0x02
              Read (0x02)
            Value Handle: 0x0041
            Value UUID: Gain Settings Attribute (0x2b78)
> HCI Event: Number of Completed Packets (0x13) plen 5                                                              #120 7.982045
        Num handles: 1
        Handle: 309 Address: C0:07:E8:2C:B6:EE (OUI C0-07-E8)
        Count: 1
        Buffers: 0/3
        #119: len 20 (1 Kb/s)
        Latency: 119 msec (47-120 msec ~116 msec)
> ACL Data RX: Handle 309 flags 0x02 dlen 11                                                                        #121 7.982272
      ATT: Read By Type Request (0x08) len 6
        Handle range: 0x0041-0x004b
        Attribute type: Characteristic (0x2803)
zephyr.exe[2145978]: < HCI Command: Host Number of Completed Packets (0x03|0x0035) plen 5                           #122 8.001973
        Num handles: 1
        Handle: 309 Address: C0:07:E8:2C:B6:EE (OUI C0-07-E8)
        Count: 1
zephyr.exe[2145978]: < ACL Data TX: Handle 309 [1/3] flags 0x00 dlen 20                                             #123 8.001982
      ATT: Read By Type Response (0x09) len 15
        Attribute data length: 7
        Attribute data list: 2 entries
        Handle: 0x0042
        Value[5]: 024300792b
            Properties: 0x02
              Read (0x02)
            Value Handle: 0x0043
            Value UUID: Audio Input Type (0x2b79)
        Handle: 0x0044
        Value[5]: 1245007a2b
            Properties: 0x12
              Read (0x02)
              Notify (0x10)
            Value Handle: 0x0045
            Value UUID: Audio Input Status (0x2b7a)
> HCI Event: Number of Completed Packets (0x13) plen 5                                                              #124 8.107056
        Num handles: 1
        Handle: 309 Address: C0:07:E8:2C:B6:EE (OUI C0-07-E8)
        Count: 1
        Buffers: 0/3
        #123: len 20 (1 Kb/s)
        Latency: 105 msec (47-120 msec ~110 msec)
> ACL Data RX: Handle 309 flags 0x02 dlen 11                                                                        #125 8.107321
      ATT: Read By Type Request (0x08) len 6
        Handle range: 0x0045-0x004b
        Attribute type: Characteristic (0x2803)
zephyr.exe[2145978]: < HCI Command: Host Number of Completed Packets (0x03|0x0035) plen 5                           #126 8.122015
        Num handles: 1
        Handle: 309 Address: C0:07:E8:2C:B6:EE (OUI C0-07-E8)
        Count: 1
zephyr.exe[2145978]: < ACL Data TX: Handle 309 [1/3] flags 0x00 dlen 20                                             #127 8.122026
      ATT: Read By Type Response (0x09) len 15
        Attribute data length: 7
        Attribute data list: 2 entries
        Handle: 0x0047
        Value[5]: 0848007b2b
            Properties: 0x08
              Write (0x08)
            Value Handle: 0x0048
            Value UUID: Audio Input Control Point (0x2b7b)
        Handle: 0x0049
        Value[5]: 164a007c2b
            Properties: 0x16
              Read (0x02)
              Write Without Response (0x04)
              Notify (0x10)
            Value Handle: 0x004a
            Value UUID: Audio Input Description (0x2b7c)
> HCI Event: Number of Completed Packets (0x13) plen 5                                                              #128 8.232060
        Num handles: 1
        Handle: 309 Address: C0:07:E8:2C:B6:EE (OUI C0-07-E8)
        Count: 1
        Buffers: 0/3
        #127: len 20 (1 Kb/s)
        Latency: 110 msec (47-120 msec ~110 msec)
> ACL Data RX: Handle 309 flags 0x02 dlen 11                                                                        #129 8.232308
      ATT: Read By Type Request (0x08) len 6
        Handle range: 0x004a-0x004b
        Attribute type: Characteristic (0x2803)
zephyr.exe[2145978]: < HCI Command: Host Number of Completed Packets (0x03|0x0035) plen 5                           #130 8.242092
        Num handles: 1
        Handle: 309 Address: C0:07:E8:2C:B6:EE (OUI C0-07-E8)
        Count: 1
zephyr.exe[2145978]: < ACL Data TX: Handle 309 [1/3] flags 0x00 dlen 9                                              #131 8.242097
      ATT: Error Response (0x01) len 4
        Read By Type Request (0x08)
        Handle: 0x004a
        Error: Attribute Not Found (0x0a)
> HCI Event: Number of Completed Packets (0x13) plen 5                                                              #132 8.357033
        Num handles: 1
        Handle: 309 Address: C0:07:E8:2C:B6:EE (OUI C0-07-E8)
        Count: 1
        Buffers: 0/3
        #131: len 9 (0 Kb/s)
        Latency: 114 msec (47-120 msec ~112 msec)
> ACL Data RX: Handle 309 flags 0x02 dlen 9                                                                         #133 8.357233
      ATT: Find Information Request (0x04) len 4
        Handle range: 0x003f-0x003f
zephyr.exe[2145978]: < HCI Command: Host Number of Completed Packets (0x03|0x0035) plen 5                           #134 8.362029
        Num handles: 1
        Handle: 309 Address: C0:07:E8:2C:B6:EE (OUI C0-07-E8)
        Count: 1
zephyr.exe[2145978]: < ACL Data TX: Handle 309 [1/3] flags 0x00 dlen 10                                             #135 8.362034
      ATT: Find Information Response (0x05) len 5
        Format: UUID-16 (0x01)
        Handle: 0x003f
        UUID: Client Characteristic Configuration (0x2902)
> HCI Event: Number of Completed Packets (0x13) plen 5                                                              #136 8.482145
        Num handles: 1
        Handle: 309 Address: C0:07:E8:2C:B6:EE (OUI C0-07-E8)
        Count: 1
        Buffers: 0/3
        #135: len 10 (0 Kb/s)
        Latency: 120 msec (47-120 msec ~116 msec)
> ACL Data RX: Handle 309 flags 0x02 dlen 9                                                                         #137 8.482316
      ATT: Find Information Request (0x04) len 4
        Handle range: 0x0046-0x0046
zephyr.exe[2145978]: < HCI Command: Host Number of Completed Packets (0x03|0x0035) plen 5                           #138 8.502045
        Num handles: 1
        Handle: 309 Address: C0:07:E8:2C:B6:EE (OUI C0-07-E8)
        Count: 1
zephyr.exe[2145978]: < ACL Data TX: Handle 309 [1/3] flags 0x00 dlen 10                                             #139 8.502054
      ATT: Find Information Response (0x05) len 5
        Format: UUID-16 (0x01)
        Handle: 0x0046
        UUID: Client Characteristic Configuration (0x2902)
> HCI Event: Number of Completed Packets (0x13) plen 5                                                              #140 8.607059
        Num handles: 1
        Handle: 309 Address: C0:07:E8:2C:B6:EE (OUI C0-07-E8)
        Count: 1
        Buffers: 0/3
        #139: len 10 (0 Kb/s)
        Latency: 105 msec (47-120 msec ~110 msec)
> ACL Data RX: Handle 309 flags 0x02 dlen 9                                                                         #141 8.607328
      ATT: Find Information Request (0x04) len 4
        Handle range: 0x004b-0x004b
zephyr.exe[2145978]: < HCI Command: Host Number of Completed Packets (0x03|0x0035) plen 5                           #142 8.622065
        Num handles: 1
        Handle: 309 Address: C0:07:E8:2C:B6:EE (OUI C0-07-E8)
        Count: 1
zephyr.exe[2145978]: < ACL Data TX: Handle 309 [1/3] flags 0x00 dlen 10                                             #143 8.622072
      ATT: Find Information Response (0x05) len 5
        Format: UUID-16 (0x01)
        Handle: 0x004b
        UUID: Client Characteristic Configuration (0x2902)
> HCI Event: Number of Completed Packets (0x13) plen 5                                                              #144 8.732051
        Num handles: 1
        Handle: 309 Address: C0:07:E8:2C:B6:EE (OUI C0-07-E8)
        Count: 1
        Buffers: 0/3
        #143: len 10 (0 Kb/s)
        Latency: 109 msec (47-120 msec ~110 msec)
> ACL Data RX: Handle 309 flags 0x02 dlen 11                                                                        #145 8.732299
      ATT: Read By Type Request (0x08) len 6
        Handle range: 0x004c-0x005b
        Attribute type: Characteristic (0x2803)
zephyr.exe[2145978]: < HCI Command: Host Number of Completed Packets (0x03|0x0035) plen 5                           #146 8.742062
        Num handles: 1
        Handle: 309 Address: C0:07:E8:2C:B6:EE (OUI C0-07-E8)
        Count: 1
zephyr.exe[2145978]: < ACL Data TX: Handle 309 [1/3] flags 0x00 dlen 20                                             #147 8.742103
      ATT: Read By Type Response (0x09) len 15
        Attribute data length: 7
        Attribute data list: 2 entries
        Handle: 0x004d
        Value[5]: 124e00772b
            Properties: 0x12
              Read (0x02)
              Notify (0x10)
            Value Handle: 0x004e
            Value UUID: Audio Input State (0x2b77)
        Handle: 0x0050
        Value[5]: 025100782b
            Properties: 0x02
              Read (0x02)
            Value Handle: 0x0051
            Value UUID: Gain Settings Attribute (0x2b78)
> HCI Event: Number of Completed Packets (0x13) plen 5                                                              #148 8.857083
        Num handles: 1
        Handle: 309 Address: C0:07:E8:2C:B6:EE (OUI C0-07-E8)
        Count: 1
        Buffers: 0/3
        #147: len 20 (1 Kb/s)
        Latency: 114 msec (47-120 msec ~112 msec)
> ACL Data RX: Handle 309 flags 0x02 dlen 11                                                                        #149 8.857276
      ATT: Read By Type Request (0x08) len 6
        Handle range: 0x0051-0x005b
        Attribute type: Characteristic (0x2803)
zephyr.exe[2145978]: < HCI Command: Host Number of Completed Packets (0x03|0x0035) plen 5                           #150 8.861978
        Num handles: 1
        Handle: 309 Address: C0:07:E8:2C:B6:EE (OUI C0-07-E8)
        Count: 1
zephyr.exe[2145978]: < ACL Data TX: Handle 309 [1/3] flags 0x00 dlen 20                                             #151 8.861983
      ATT: Read By Type Response (0x09) len 15
        Attribute data length: 7
        Attribute data list: 2 entries
        Handle: 0x0052
        Value[5]: 025300792b
            Properties: 0x02
              Read (0x02)
            Value Handle: 0x0053
            Value UUID: Audio Input Type (0x2b79)
        Handle: 0x0054
        Value[5]: 1255007a2b
            Properties: 0x12
              Read (0x02)
              Notify (0x10)
            Value Handle: 0x0055
            Value UUID: Audio Input Status (0x2b7a)
> HCI Event: Number of Completed Packets (0x13) plen 5                                                              #152 8.982045
        Num handles: 1
        Handle: 309 Address: C0:07:E8:2C:B6:EE (OUI C0-07-E8)
        Count: 1
        Buffers: 0/3
        #151: len 20 (1 Kb/s)
        Latency: 120 msec (47-120 msec ~116 msec)
> ACL Data RX: Handle 309 flags 0x02 dlen 11                                                                        #153 8.982334
      ATT: Read By Type Request (0x08) len 6
        Handle range: 0x0055-0x005b
        Attribute type: Characteristic (0x2803)
zephyr.exe[2145978]: < HCI Command: Host Number of Completed Packets (0x03|0x0035) plen 5                           #154 9.001990
        Num handles: 1
        Handle: 309 Address: C0:07:E8:2C:B6:EE (OUI C0-07-E8)
        Count: 1
zephyr.exe[2145978]: < ACL Data TX: Handle 309 [1/3] flags 0x00 dlen 20                                             #155 9.001998
      ATT: Read By Type Response (0x09) len 15
        Attribute data length: 7
        Attribute data list: 2 entries
        Handle: 0x0057
        Value[5]: 0858007b2b
            Properties: 0x08
              Write (0x08)
            Value Handle: 0x0058
            Value UUID: Audio Input Control Point (0x2b7b)
        Handle: 0x0059
        Value[5]: 165a007c2b
            Properties: 0x16
              Read (0x02)
              Write Without Response (0x04)
              Notify (0x10)
            Value Handle: 0x005a
            Value UUID: Audio Input Description (0x2b7c)
> HCI Event: Number of Completed Packets (0x13) plen 5                                                              #156 9.107082
        Num handles: 1
        Handle: 309 Address: C0:07:E8:2C:B6:EE (OUI C0-07-E8)
        Count: 1
        Buffers: 0/3
        #155: len 20 (1 Kb/s)
        Latency: 105 msec (47-120 msec ~110 msec)
> ACL Data RX: Handle 309 flags 0x02 dlen 11                                                                        #157 9.107335
      ATT: Read By Type Request (0x08) len 6
        Handle range: 0x005a-0x005b
        Attribute type: Characteristic (0x2803)
zephyr.exe[2145978]: < HCI Command: Host Number of Completed Packets (0x03|0x0035) plen 5                           #158 9.122025
        Num handles: 1
        Handle: 309 Address: C0:07:E8:2C:B6:EE (OUI C0-07-E8)
        Count: 1
zephyr.exe[2145978]: < ACL Data TX: Handle 309 [1/3] flags 0x00 dlen 9                                              #159 9.122034
      ATT: Error Response (0x01) len 4
        Read By Type Request (0x08)
        Handle: 0x005a
        Error: Attribute Not Found (0x0a)
> HCI Event: Number of Completed Packets (0x13) plen 5                                                              #160 9.232180
        Num handles: 1
        Handle: 309 Address: C0:07:E8:2C:B6:EE (OUI C0-07-E8)
        Count: 1
        Buffers: 0/3
        #159: len 9 (0 Kb/s)
        Latency: 110 msec (47-120 msec ~110 msec)
> ACL Data RX: Handle 309 flags 0x02 dlen 9                                                                         #161 9.232317
      ATT: Find Information Request (0x04) len 4
        Handle range: 0x004f-0x004f
zephyr.exe[2145978]: < HCI Command: Host Number of Completed Packets (0x03|0x0035) plen 5                           #162 9.242116
        Num handles: 1
        Handle: 309 Address: C0:07:E8:2C:B6:EE (OUI C0-07-E8)
        Count: 1
zephyr.exe[2145978]: < ACL Data TX: Handle 309 [1/3] flags 0x00 dlen 10                                             #163 9.242164
      ATT: Find Information Response (0x05) len 5
        Format: UUID-16 (0x01)
        Handle: 0x004f
        UUID: Client Characteristic Configuration (0x2902)
> HCI Event: Number of Completed Packets (0x13) plen 5                                                              #164 9.357084
        Num handles: 1
        Handle: 309 Address: C0:07:E8:2C:B6:EE (OUI C0-07-E8)
        Count: 1
        Buffers: 0/3
        #163: len 10 (0 Kb/s)
        Latency: 114 msec (47-120 msec ~112 msec)
> ACL Data RX: Handle 309 flags 0x02 dlen 9                                                                         #165 9.357306
      ATT: Find Information Request (0x04) len 4
        Handle range: 0x0056-0x0056
zephyr.exe[2145978]: < HCI Command: Host Number of Completed Packets (0x03|0x0035) plen 5                           #166 9.362019
        Num handles: 1
        Handle: 309 Address: C0:07:E8:2C:B6:EE (OUI C0-07-E8)
        Count: 1
zephyr.exe[2145978]: < ACL Data TX: Handle 309 [1/3] flags 0x00 dlen 10                                             #167 9.362027
      ATT: Find Information Response (0x05) len 5
        Format: UUID-16 (0x01)
        Handle: 0x0056
        UUID: Client Characteristic Configuration (0x2902)
> HCI Event: Number of Completed Packets (0x13) plen 5                                                              #168 9.482082
        Num handles: 1
        Handle: 309 Address: C0:07:E8:2C:B6:EE (OUI C0-07-E8)
        Count: 1
        Buffers: 0/3
        #167: len 10 (0 Kb/s)
        Latency: 120 msec (47-120 msec ~116 msec)
> ACL Data RX: Handle 309 flags 0x02 dlen 9                                                                         #169 9.482312
      ATT: Find Information Request (0x04) len 4
        Handle range: 0x005b-0x005b
zephyr.exe[2145978]: < HCI Command: Host Number of Completed Packets (0x03|0x0035) plen 5                           #170 9.502025
        Num handles: 1
        Handle: 309 Address: C0:07:E8:2C:B6:EE (OUI C0-07-E8)
        Count: 1
zephyr.exe[2145978]: < ACL Data TX: Handle 309 [1/3] flags 0x00 dlen 10                                             #171 9.502033
      ATT: Find Information Response (0x05) len 5
        Format: UUID-16 (0x01)
        Handle: 0x005b
        UUID: Client Characteristic Configuration (0x2902)
> HCI Event: Number of Completed Packets (0x13) plen 5                                                              #172 9.607103
        Num handles: 1
        Handle: 309 Address: C0:07:E8:2C:B6:EE (OUI C0-07-E8)
        Count: 1
        Buffers: 0/3
        #171: len 10 (0 Kb/s)
        Latency: 105 msec (47-120 msec ~110 msec)
> ACL Data RX: Handle 309 flags 0x02 dlen 9                                                                         #173 9.607304
      ATT: Write Request (0x12) len 4
        Handle: 0x003f
          Data[2]: 0000
zephyr.exe[2145978]: < HCI Command: Host Number of Completed Packets (0x03|0x0035) plen 5                           #174 9.622073
        Num handles: 1
        Handle: 309 Address: C0:07:E8:2C:B6:EE (OUI C0-07-E8)
        Count: 1
zephyr.exe[2145978]: < ACL Data TX: Handle 309 [1/3] flags 0x00 dlen 5                                              #175 9.622087
      ATT: Write Response (0x13) len 0
> HCI Event: Number of Completed Packets (0x13) plen 5                                                              #176 9.732039
        Num handles: 1
        Handle: 309 Address: C0:07:E8:2C:B6:EE (OUI C0-07-E8)
        Count: 1
        Buffers: 0/3
        #175: len 5 (0 Kb/s)
        Latency: 109 msec (47-120 msec ~110 msec)
> ACL Data RX: Handle 309 flags 0x02 dlen 9                                                                         #177 9.732318
      ATT: Write Request (0x12) len 4
        Handle: 0x003f
          Data[2]: 0100
zephyr.exe[2145978]: < HCI Command: Host Number of Completed Packets (0x03|0x0035) plen 5                           #178 9.742105
        Num handles: 1
        Handle: 309 Address: C0:07:E8:2C:B6:EE (OUI C0-07-E8)
        Count: 1
zephyr.exe[2145978]: < ACL Data TX: Handle 309 [1/3] flags 0x00 dlen 5                                              #179 9.742110
      ATT: Write Response (0x13) len 0
> HCI Event: Number of Completed Packets (0x13) plen 5                                                              #180 9.857141
        Num handles: 1
        Handle: 309 Address: C0:07:E8:2C:B6:EE (OUI C0-07-E8)
        Count: 1
        Buffers: 0/3
        #179: len 5 (0 Kb/s)
        Latency: 115 msec (47-120 msec ~112 msec)
> ACL Data RX: Handle 309 flags 0x02 dlen 9                                                                         #181 9.857309
      ATT: Write Request (0x12) len 4
        Handle: 0x004f
          Data[2]: 0000
zephyr.exe[2145978]: < HCI Command: Host Number of Completed Packets (0x03|0x0035) plen 5                           #182 9.861989
        Num handles: 1
        Handle: 309 Address: C0:07:E8:2C:B6:EE (OUI C0-07-E8)
        Count: 1
zephyr.exe[2145978]: < ACL Data TX: Handle 309 [1/3] flags 0x00 dlen 5                                              #183 9.862002
      ATT: Write Response (0x13) len 0
> HCI Event: Number of Completed Packets (0x13) plen 5                                                              #184 9.982053
        Num handles: 1
        Handle: 309 Address: C0:07:E8:2C:B6:EE (OUI C0-07-E8)
        Count: 1
        Buffers: 0/3
        #183: len 5 (0 Kb/s)
        Latency: 120 msec (47-120 msec ~116 msec)
> ACL Data RX: Handle 309 flags 0x02 dlen 9                                                                         #185 9.982288
      ATT: Write Request (0x12) len 4
        Handle: 0x004f
          Data[2]: 0100
zephyr.exe[2145978]: < HCI Command: Host Number of Completed Packets (0x03|0x0035) plen 5                          #186 10.002041
        Num handles: 1
        Handle: 309 Address: C0:07:E8:2C:B6:EE (OUI C0-07-E8)
        Count: 1
zephyr.exe[2145978]: < ACL Data TX: Handle 309 [1/3] flags 0x00 dlen 5                                             #187 10.002048
      ATT: Write Response (0x13) len 0
> HCI Event: Number of Completed Packets (0x13) plen 5                                                             #188 10.107087
        Num handles: 1
        Handle: 309 Address: C0:07:E8:2C:B6:EE (OUI C0-07-E8)
        Count: 1
        Buffers: 0/3
        #187: len 5 (0 Kb/s)
        Latency: 105 msec (47-120 msec ~110 msec)
> ACL Data RX: Handle 309 flags 0x02 dlen 7                                                                        #189 10.107221
      ATT: Read Request (0x0a) len 2
        Handle: 0x003e
zephyr.exe[2145978]: < HCI Command: Host Number of Completed Packets (0x03|0x0035) plen 5                          #190 10.122085
        Num handles: 1
        Handle: 309 Address: C0:07:E8:2C:B6:EE (OUI C0-07-E8)
        Count: 1
zephyr.exe[2145978]: < ACL Data TX: Handle 309 [1/3] flags 0x00 dlen 9                                             #191 10.122094
      ATT: Read Response (0x0b) len 4
        Value[4]: 00000200
> HCI Event: Number of Completed Packets (0x13) plen 5                                                             #192 10.232058
        Num handles: 1
        Handle: 309 Address: C0:07:E8:2C:B6:EE (OUI C0-07-E8)
        Count: 1
        Buffers: 0/3
        #191: len 9 (0 Kb/s)
        Latency: 109 msec (47-120 msec ~110 msec)
> ACL Data RX: Handle 309 flags 0x02 dlen 10                                                                       #193 10.232268
      ATT: Write Request (0x12) len 5
        Handle: 0x0048
          Data[3]: 016400
zephyr.exe[2145978]: < HCI Command: Host Number o