Bluetooth monitor ver 5.72
= Note: Linux version 6.14.0-36-generic (x86_64)                       0.018265
= Note: Bluetooth subsystem version 2.22                               0.018267
= New Index: 00:00:00:00:00:00 (Primary,UART,hci2)              [hci2] 0.018268
= New Index: 00:00:00:00:00:00 (Primary,UART,hci1)              [hci1] 0.018268
= New Index: 48:5F:99:8E:E0:64 (Primary,USB,hci0)               [hci0] 0.018269
= Open Index: 00:00:00:00:00:00                                 [hci1] 0.101487
= Index Info: 00:00:00:00:00:00 (Nordic Semiconductor ASA)      [hci1] 0.101491
@ USER Open: main (privileged) version 2.22            {0x0001} [hci1] 0.101494
< HCI Command: Reset (0x03|0x0003) plen 0                    #1 [hci1] 0.101852
> HCI Event: Command Complete (0x0e) plen 4                  #2 [hci1] 0.102385
      Reset (0x03|0x0003) ncmd 1
        Status: Success (0x00)
< HCI Command: Read Local Supported... (0x04|0x0003) plen 0  #3 [hci1] 0.121497
> HCI Event: Command Complete (0x0e) plen 12                 #4 [hci1] 0.122046
      Read Local Supported Features (0x04|0x0003) ncmd 1
        Status: Success (0x00)
        Features: 0x00 0x00 0x00 0x00 0x60 0x00 0x00 0x00
          BR/EDR Not Supported
          LE Supported (Controller)
< HCI Command: Read Local Version In.. (0x04|0x0001) plen 0  #5 [hci1] 0.141486
> HCI Event: Command Complete (0x0e) plen 12                 #6 [hci1] 0.141956
      Read Local Version Information (0x04|0x0001) ncmd 1
        Status: Success (0x00)
        HCI version: Reserved (0x0f) - Revision 12393 (0x3069)
        LMP version: Reserved (0x0f) - Subversion 12393 (0x3069)
        Manufacturer: Nordic Semiconductor ASA (89)
< HCI Command: Read Local Supported... (0x04|0x0002) plen 0  #7 [hci1] 0.161496
> HCI Event: Command Complete (0x0e) plen 68                 #8 [hci1] 0.162664
      Read Local Supported Commands (0x04|0x0002) ncmd 1
        Status: Success (0x00)
        Commands: 119 entries
          Disconnect (Octet 0 - Bit 5)
          Read Remote Version Information (Octet 2 - Bit 7)
          Set Event Mask (Octet 5 - Bit 6)
          Reset (Octet 5 - Bit 7)
          Read Connection Accept Timeout (Octet 7 - Bit 2)
          Write Connection Accept Timeout (Octet 7 - Bit 3)
          Read Transmit Power Level (Octet 10 - Bit 2)
          Set Controller To Host Flow Control (Octet 10 - Bit 5)
          Host Buffer Size (Octet 10 - Bit 6)
          Host Number of Completed Packets (Octet 10 - Bit 7)
          Read Local Version Information (Octet 14 - Bit 3)
          Read Local Supported Features (Octet 14 - Bit 5)
          Read BD ADDR (Octet 15 - Bit 1)
          Read RSSI (Octet 15 - Bit 5)
          Set Event Mask Page 2 (Octet 22 - Bit 2)
          LE Set Event Mask (Octet 25 - Bit 0)
          LE Read Buffer Size (Octet 25 - Bit 1)
          LE Read Local Supported Features (Octet 25 - Bit 2)
          LE Set Random Address (Octet 25 - Bit 4)
          LE Set Advertising Parameters (Octet 25 - Bit 5)
          LE Read Advertising Channel TX Power (Octet 25 - Bit 6)
          LE Set Advertising Data (Octet 25 - Bit 7)
          LE Set Scan Response Data (Octet 26 - Bit 0)
          LE Set Advertise Enable (Octet 26 - Bit 1)
          LE Set Scan Parameters (Octet 26 - Bit 2)
          LE Set Scan Enable (Octet 26 - Bit 3)
          LE Create Connection (Octet 26 - Bit 4)
          LE Create Connection Cancel (Octet 26 - Bit 5)
          LE Read Accept List Size (Octet 26 - Bit 6)
          LE Clear Accept List (Octet 26 - Bit 7)
          LE Add Device To Accept List (Octet 27 - Bit 0)
          LE Remove Device From Accept List (Octet 27 - Bit 1)
          LE Connection Update (Octet 27 - Bit 2)
          LE Set Host Channel Classification (Octet 27 - Bit 3)
          LE Read Channel Map (Octet 27 - Bit 4)
          LE Read Remote Used Features (Octet 27 - Bit 5)
          LE Encrypt (Octet 27 - Bit 6)
          LE Rand (Octet 27 - Bit 7)
          LE Start Encryption (Octet 28 - Bit 0)
          LE Long Term Key Request Reply (Octet 28 - Bit 1)
          LE Long Term Key Request Neg Reply (Octet 28 - Bit 2)
          LE Read Supported States (Octet 28 - Bit 3)
          LE Receiver Test (Octet 28 - Bit 4)
          LE Transmitter Test (Octet 28 - Bit 5)
          LE Test End (Octet 28 - Bit 6)
          Read Authenticated Payload Timeout (Octet 32 - Bit 4)
          Write Authenticated Payload Timeout (Octet 32 - Bit 5)
          LE Set Data Length (Octet 33 - Bit 6)
          LE Read Suggested Default Data Length (Octet 33 - Bit 7)
          LE Write Suggested Default Data Length (Octet 34 - Bit 0)
          LE Add Device To Resolving List (Octet 34 - Bit 3)
          LE Remove Device From Resolving List (Octet 34 - Bit 4)
          LE Clear Resolving List (Octet 34 - Bit 5)
          LE Read Resolving List Size (Octet 34 - Bit 6)
          LE Set Address Resolution Enable (Octet 35 - Bit 1)
          LE Set Resolvable Private Address Timeout (Octet 35 - Bit 2)
          LE Read Maximum Data Length (Octet 35 - Bit 3)
          LE Read PHY (Octet 35 - Bit 4)
          LE Set Default PHY (Octet 35 - Bit 5)
          LE Set PHY (Octet 35 - Bit 6)
          LE Enhanced Receiver Test (Octet 35 - Bit 7)
          LE Enhanced Transmitter Test (Octet 36 - Bit 0)
          LE Set Advertising Set Random Address (Octet 36 - Bit 1)
          LE Set Extended Advertising Parameters (Octet 36 - Bit 2)
          LE Set Extended Advertising Data (Octet 36 - Bit 3)
          LE Set Extended Scan Response Data (Octet 36 - Bit 4)
          LE Set Extended Advertising Enable (Octet 36 - Bit 5)
          LE Read Maximum Advertising Data Length (Octet 36 - Bit 6)
          LE Read Number of Supported Advertising Sets (Octet 36 - Bit 7)
          LE Remove Advertising Set (Octet 37 - Bit 0)
          LE Clear Advertising Sets (Octet 37 - Bit 1)
          LE Set Periodic Advertising Parameters (Octet 37 - Bit 2)
          LE Set Periodic Advertising Data (Octet 37 - Bit 3)
          LE Set Periodic Advertising Enable (Octet 37 - Bit 4)
          LE Set Extended Scan Parameters (Octet 37 - Bit 5)
          LE Set Extended Scan Enable (Octet 37 - Bit 6)
          LE Extended Create Connection (Octet 37 - Bit 7)
          LE Periodic Advertising Create Sync (Octet 38 - Bit 0)
          LE Periodic Advertising Create Sync Cancel (Octet 38 - Bit 1)
          LE Periodic Advertising Terminate Sync (Octet 38 - Bit 2)
          LE Add Device To Periodic Advertiser List (Octet 38 - Bit 3)
          LE Remove Device From Periodic Advertiser List (Octet 38 - Bit 4)
          LE Clear Periodic Advertiser List (Octet 38 - Bit 5)
          LE Read Periodic Advertiser List Size (Octet 38 - Bit 6)
          LE Read Transmit Power (Octet 38 - Bit 7)
          LE Read RF Path Compensation (Octet 39 - Bit 0)
          LE Write RF Path Compensation (Octet 39 - Bit 1)
          LE Set Privacy Mode (Octet 39 - Bit 2)
          LE Periodic Advertising Receive Enable (Octet 40 - Bit 5)
          LE Periodic Advertising Sync Transfer (Octet 40 - Bit 6)
          LE Periodic Advertising Set Info Transfer (Octet 40 - Bit 7)
          LE Periodic Advertising Sync Transfer Parameters (Octet 41 - Bit 0)
          LE Set Default Periodic Advertisng Sync Transfer Parameters (Octet 41 - Bit 1)
          LE Read Buffer v2 (Octet 41 - Bit 5)
          LE Read ISO TX Sync (Octet 41 - Bit 6)
          LE Set Connected Isochronous Group Parameters (Octet 41 - Bit 7)
          LE Set Connected Isochronous Group Parameters Test (Octet 42 - Bit 0)
          LE Create Connected Isochronous Stream (Octet 42 - Bit 1)
          LE Remove Connected Isochronous Group (Octet 42 - Bit 2)
          LE Accept Connected Isochronous Stream Request (Octet 42 - Bit 3)
          LE Reject Connected Isochronous Stream Request (Octet 42 - Bit 4)
          LE Create Broadcast Isochronous Group (Octet 42 - Bit 5)
          LE Create Broadcast Isochronous Group Test (Octet 42 - Bit 6)
          LE Terminate Broadcast Isochronous Group (Octet 42 - Bit 7)
          LE Broadcast Isochronous Group Create Sync (Octet 43 - Bit 0)
          LE Broadcast Isochronous Group Terminate Sync (Octet 43 - Bit 1)
          LE Request Peer SCA (Octet 43 - Bit 2)
          LE Setup Isochronous Data Path (Octet 43 - Bit 3)
          LE Remove Isochronous Data Path (Octet 43 - Bit 4)
          LE Isochronous Transmit Test (Octet 43 - Bit 5)
          LE Isochronous Receive Test (Octet 43 - Bit 6)
          LE Isochronous Read Test Counters (Octet 43 - Bit 7)
          LE Isochronous Read Test Counters (Octet 44 - Bit 0)
          LE Set Host Feature (Octet 44 - Bit 1)
          Octet 44 - Bit 2 
          Octet 45 - Bit 6 
          Octet 46 - Bit 0 
          Octet 46 - Bit 1 
          Octet 46 - Bit 2 
< HCI Command: Host Buffer Size (0x03|0x0033) plen 7         #9 [hci1] 0.181481
        ACL MTU: 255  ACL max packet: 16
        SCO MTU: 0    SCO max packet: 0
> HCI Event: Command Complete (0x0e) plen 4                 #10 [hci1] 0.182012
      Host Buffer Size (0x03|0x0033) ncmd 1
        Status: Success (0x00)
< HCI Command: Set Controller To Ho.. (0x03|0x0031) plen 1  #11 [hci1] 0.201474
        Flow control: ACL Data Packets (0x01)
> HCI Event: Command Complete (0x0e) plen 4                 #12 [hci1] 0.201900
      Set Controller To Host Flow Control (0x03|0x0031) ncmd 1
        Status: Success (0x00)
< HCI Command: LE Read Local Suppor.. (0x08|0x0003) plen 0  #13 [hci1] 0.221483
> HCI Event: Command Complete (0x0e) plen 12                #14 [hci1] 0.221950
      LE Read Local Supported Features (0x08|0x0003) ncmd 1
        Status: Success (0x00)
        Features: 0xfd 0x79 0x00 0xf7 0x30 0x01 0x00 0x00
          LE Encryption
          Extended Reject Indication
          Peripheral-initiated Features Exchange
          LE Ping
          LE Data Packet Length Extension
          LL Privacy
          Extended Scanner Filter Policies
          LE 2M PHY
          LE Coded PHY
          LE Extended Advertising
          LE Periodic Advertising
          Channel Selection Algorithm #2
          Periodic Advertising Sync Transfer - Sender
          Periodic Advertising Sync Transfer - Recipient
          Sleep Clock Accuracy Updates
          Connected Isochronous Stream - Central
          Connected Isochronous Stream - Peripheral
          Isochronous Broadcaster
          Synchronized Receiver
          Periodic Advertising ADI support
          Connection Subrating
          Unknown features (0x0000010000000000)
< HCI Command: LE Set Host Feature (0x08|0x0074) plen 2     #15 [hci1] 0.241498
        Bit Number: 32
          Connected Isochronous Stream (Host Support)
        Bit Value: 1
> HCI Event: Command Complete (0x0e) plen 4                 #16 [hci1] 0.241883
      LE Set Host Feature (0x08|0x0074) ncmd 1
        Status: Success (0x00)
< HCI Command: LE Read Buffer v2 (0x08|0x0060) plen 0       #17 [hci1] 0.261484
> HCI Event: Command Complete (0x0e) plen 10                #18 [hci1] 0.261975
      LE Read Buffer v2 (0x08|0x0060) ncmd 1
        Status: Success (0x00)
        ACL MTU: 27
        ACL max packet: 3
        ISO MTU: 318
        ISO max packet: 3
< HCI Command: LE Read Maximum Adve.. (0x08|0x003a) plen 0  #19 [hci1] 0.281513
> HCI Event: Command Complete (0x0e) plen 6                 #20 [hci1] 0.282026
      LE Read Maximum Advertising Data Length (0x08|0x003a) ncmd 1
        Status: Success (0x00)
        Max length: 1650
< HCI Command: LE Read Supported St.. (0x08|0x001c) plen 0  #21 [hci1] 0.301484
> HCI Event: Command Complete (0x0e) plen 12                #22 [hci1] 0.301955
      LE Read Supported States (0x08|0x001c) ncmd 1
        Status: Success (0x00)
        States: 0x000003ff3e0306ff
          Non-connectable Advertising State
          Scannable Advertising State
          Connectable Advertising State
          High Duty Cycle Directed Advertising State
          Passive Scanning State
          Active Scanning State
          Initiating State
            and Connection State (Central Role)
          Connection State (Peripheral Role)
          Scannable Advertising State
            and Passive Scanning State
          Connectable Advertising State
            and Passive Scanning State
          Non-connectable Advertising State
            and Initiating State
          Scannable Advertising State
            and Initiating State
          Active Scanning State
            and Connection State (Central Role)
          Passive Scanning State
            and Connection State (Peripheral Role)
          Active Scanning State
            and Connection State (Peripheral Role)
          Initiating State
            and Connection State (Central Role)
            and Central Role & Central Role
          Low Duty Cycle Directed Advertising State
          Connectable Advertising State
            and Initiating State
            and Central Role & Peripheral Role
          High Duty Cycle Directed Advertising State
            and Initiating State
            and Central Role & Peripheral Role
          Low Duty Cycle Directed Advertising State
            and Initiating State
            and Central Role & Peripheral Role
          Connectable Advertising State
            and Connection State (Central Role)
            and Central Role & Peripheral Role
          High Duty Cycle Directed Advertising State
            and Connection State (Central Role)
            and Central Role & Peripheral Role
          Low Duty Cycle Directed Advertising State
            and Connection State (Central Role)
            and Central Role & Peripheral Role
          Connectable Advertising State
            and Connection State (Peripheral Role)
            and Central Role & Peripheral Role
          High Duty Cycle Directed Advertising State
            and Connection State (Peripheral Role)
            and Peripheral Role & Peripheral Role
          Low Duty Cycle Directed Advertising State
            and Connection State (Peripheral Role)
            and Peripheral Role & Peripheral Role
          Initiating State
            and Connection State (Peripheral Role)
            and Central Role & Peripheral Role
< HCI Command: LE Read Maximum Data.. (0x08|0x002f) plen 0  #23 [hci1] 0.321494
> HCI Event: Command Complete (0x0e) plen 12                #24 [hci1] 0.322052
      LE Read Maximum Data Length (0x08|0x002f) ncmd 1
        Status: Success (0x00)
        Max TX octets: 251
        Max TX time: 2704
        Max RX octets: 251
        Max RX time: 2704
< HCI Command: LE Write Suggested D.. (0x08|0x0024) plen 4  #25 [hci1] 0.341481
        TX octets: 251
        TX time: 2704
> HCI Event: Command Complete (0x0e) plen 4                 #26 [hci1] 0.341997
      LE Write Suggested Default Data Length (0x08|0x0024) ncmd 1
        Status: Success (0x00)
< HCI Command: LE Read Resolving Li.. (0x08|0x002a) plen 0  #27 [hci1] 0.361482
> HCI Event: Command Complete (0x0e) plen 5                 #28 [hci1] 0.361940
      LE Read Resolving List Size (0x08|0x002a) ncmd 1
        Status: Success (0x00)
        Size: 8
< HCI Command: LE Set Host Feature (0x08|0x0074) plen 2     #29 [hci1] 0.381474
        Bit Number: 38
          Connection Subrating (Host Support)
        Bit Value: 1
> HCI Event: Command Complete (0x0e) plen 4                 #30 [hci1] 0.381907
      LE Set Host Feature (0x08|0x0074) ncmd 1
        Status: Success (0x00)
< HCI Command: LE Set Event Mask (0x08|0x0001) plen 8       #31 [hci1] 0.401485
        Mask: 0x000002063f87fa5e
          LE Advertising Report
          LE Connection Update Complete
          LE Read Remote Used Features Complete
          LE Long Term Key Request
          LE Data Length Change
          LE Enhanced Connection Complete
          LE PHY Update Complete
          LE Extended Advertising Report
          LE Periodic Advertising Sync Established
          LE Periodic Advertising Report
          LE Periodic Advertising Sync Lost
          LE Extended Scan Timeout
          LE Extended Advertising Set Terminated
          LE Scan Request Received
          LE Periodic Advertising Sync Transfer Rvc
          LE CIS Established
          LE CIS Request
          LE Create BIG Complete
          LE Terminate BIG Complete
          LE BIG Sync Estabilished Complete
          LE BIG Sync Lost
          LE BIG Info Advertising Report
          LE Subrate Change
          Unknown mask (0x0000020000000000)
> HCI Event: Command Complete (0x0e) plen 4                 #32 [hci1] 0.402104
      LE Set Event Mask (0x08|0x0001) ncmd 1
        Status: Success (0x00)
< HCI Command: Set Event Mask (0x03|0x0001) plen 8          #33 [hci1] 0.421488
        Mask: 0x2000800002008890
          Disconnection Complete
          Encryption Change
          Read Remote Version Information Complete
          Hardware Error
          Data Buffer Overflow
          Encryption Key Refresh Complete
          LE Meta
> HCI Event: Command Complete (0x0e) plen 4                 #34 [hci1] 0.422040
      Set Event Mask (0x03|0x0001) ncmd 1
        Status: Success (0x00)
< HCI Command: Read BD ADDR (0x04|0x0009) plen 0            #35 [hci1] 0.441457
> HCI Event: Command Complete (0x0e) plen 10                #36 [hci1] 0.441962
      Read BD ADDR (0x04|0x0009) ncmd 1
        Status: Success (0x00)
        Address: 00:00:00:00:00:00 (OUI 00-00-00)
< HCI Command: LE Set Random Address (0x08|0x0005) plen 6   #37 [hci1] 0.461523
        Address: D5:B6:CC:31:DB:3B (Static)
> HCI Event: Command Complete (0x0e) plen 4                 #38 [hci1] 0.462092
      LE Set Random Address (0x08|0x0005) ncmd 1
        Status: Success (0x00)
< HCI Command: LE Set Extended Adv.. (0x08|0x0036) plen 25  #39 [hci1] 5.401521
        Handle: 0x00
        Properties: 0x0013
          Connectable
          Scannable
          Use legacy advertising PDUs: ADV_IND
        Min advertising interval: 100.000 msec (0x00a0)
        Max advertising interval: 150.000 msec (0x00f0)
        Channel map: 37, 38, 39 (0x07)
        Own address type: Random (0x01)
        Peer address type: Public (0x00)
        Peer address: 00:00:00:00:00:00 (OUI 00-00-00)
        Filter policy: Allow Scan Request from Any, Allow Connect Request from Any (0x00)
        TX power: Host has no preference (0x7f)
        Primary PHY: LE 1M (0x01)
        Secondary max skip: 0x00
        Secondary PHY: LE 1M (0x01)
        SID: 0x00
        Scan request notifications: Disabled (0x00)
> HCI Event: Command Complete (0x0e) plen 5                 #40 [hci1] 5.402336
      LE Set Extended Advertising Parameters (0x08|0x0036) ncmd 1
        Status: Success (0x00)
        TX power (selected): 0 dbm (0x00)
< HCI Command: LE Set Advertising S.. (0x08|0x0035) plen 7  #41 [hci1] 5.421611
        Advertising handle: 0x00
        Advertising random address: D5:B6:CC:31:DB:3B (Static)
> HCI Event: Command Complete (0x0e) plen 4                 #42 [hci1] 5.422202
      LE Set Advertising Set Random Address (0x08|0x0035) ncmd 1
        Status: Success (0x00)
< HCI Command: LE Set Extended Adv.. (0x08|0x0037) plen 22  #43 [hci1] 5.441598
        Handle: 0x00
        Operation: Complete extended advertising data (0x03)
        Fragment preference: Minimize fragmentation (0x01)
        Data length: 0x12
        Flags: 0x06
          LE General Discoverable Mode
          BR/EDR Not Supported
        Name (complete): Tester_F6B11A
> HCI Event: Command Complete (0x0e) plen 4                 #44 [hci1] 5.442399
      LE Set Extended Advertising Data (0x08|0x0037) ncmd 1
        Status: Success (0x00)
< HCI Command: LE Set Extended Scan.. (0x08|0x0038) plen 4  #45 [hci1] 5.461568
        Handle: 0x00
        Operation: Complete scan response data (0x03)
        Fragment preference: Minimize fragmentation (0x01)
        Data length: 0x00
> HCI Event: Command Complete (0x0e) plen 4                 #46 [hci1] 5.462181
      LE Set Extended Scan Response Data (0x08|0x0038) ncmd 1
        Status: Success (0x00)
< HCI Command: LE Set Extended Adve.. (0x08|0x0039) plen 6  #47 [hci1] 5.481593
        Extended advertising: Enabled (0x01)
        Number of sets: 1 (0x01)
        Entry 0
          Handle: 0x00
          Duration: 0 ms (0x00)
          Max ext adv events: 0
> HCI Event: Command Complete (0x0e) plen 4                 #48 [hci1] 5.482147
      LE Set Extended Advertising Enable (0x08|0x0039) ncmd 1
        Status: Success (0x00)
> HCI Event: LE Meta Event (0x3e) plen 31                   #49 [hci1] 5.895403
      LE Enhanced Connection Complete (0x0a)
        Status: Success (0x00)
        Handle: 1083
        Role: Peripheral (0x01)
        Peer address type: Public (0x00)
        Peer address: DF:A9:FF:F6:B1:1A (OUI DF-A9-FF)
        Local resolvable private address: 00:00:00:00:00:00 (Non-Resolvable)
        Peer resolvable private address: 00:00:00:00:00:00 (Non-Resolvable)
        Connection interval: 87.50 msec (0x0046)
        Connection latency: 0 (0x0000)
        Supervision timeout: 20000 msec (0x07d0)
        Central clock accuracy: 0x01
> HCI Event: LE Meta Event (0x3e) plen 6                    #50 [hci1] 5.895733
      LE Advertising Set Terminated (0x12)
        Status: Success (0x00)
        Handle: 0
        Connection handle: 1083
        Number of completed extended advertising events: 0
< HCI Command: LE Read Remote Used... (0x08|0x0016) plen 2  #51 [hci1] 5.901914
        Handle: 1083 Address: DF:A9:FF:F6:B1:1A (OUI DF-A9-FF)
> HCI Event: Command Status (0x0f) plen 4                   #52 [hci1] 5.902396
      LE Read Remote Used Features (0x08|0x0016) ncmd 1
        Status: Success (0x00)
> HCI Event: LE Meta Event (0x3e) plen 12                   #53 [hci1] 6.159367
      LE Read Remote Used Features (0x04)
        Status: Success (0x00)
        Handle: 1083 Address: DF:A9:FF:F6:B1:1A (OUI DF-A9-FF)
        Features: 0x2d 0x49 0x00 0xf7 0x67 0xd9 0x00 0x80
          LE Encryption
          Extended Reject Indication
          Peripheral-initiated Features Exchange
          LE Data Packet Length Extension
          LE 2M PHY
          LE Coded PHY
          Channel Selection Algorithm #2
          Periodic Advertising Sync Transfer - Sender
          Periodic Advertising Sync Transfer - Recipient
          Sleep Clock Accuracy Updates
          Connected Isochronous Stream - Central
          Connected Isochronous Stream - Peripheral
          Isochronous Broadcaster
          Synchronized Receiver
          Connected Isochronous Stream (Host Support)
          LE Power Control Request
          LE Power Control Request
          Connection Subrating
          Connection Subrating (Host Support)
          Unknown features (0x8000d90000000000)
> ACL Data RX: Handle 1083 flags 0x02 dlen 11               #54 [hci1] 8.609196
      SMP: Pairing Request (0x01) len 6
        IO capability: KeyboardDisplay (0x04)
        OOB data: Authentication data not present (0x00)
        Authentication requirement: Bonding, No MITM, SC, No Keypresses (0x09)
        Max encryption key size: 7
        Initiator key distribution: EncKey IdKey Sign (0x07)
        Responder key distribution: EncKey IdKey Sign (0x07)
< HCI Command: Host Number of Compl.. (0x03|0x0035) plen 5  #55 [hci1] 8.621999
        Num handles: 1
        Handle: 1083 Address: DF:A9:FF:F6:B1:1A (OUI DF-A9-FF)
        Count: 1
< ACL Data TX: Handle 1083 flags 0x00 dlen 11               #56 [hci1] 8.622138
      SMP: Pairing Response (0x02) len 6
        IO capability: DisplayOnly (0x00)
        OOB data: Authentication data not present (0x00)
        Authentication requirement: Bonding, No MITM, SC, No Keypresses (0x09)
        Max encryption key size: 16
        Initiator key distribution: IdKey (0x02)
        Responder key distribution: <none> (0x00)
> HCI Event: Number of Completed Packets (0x13) plen 5      #57 [hci1] 8.784070
        Num handles: 1
        Handle: 1083 Address: DF:A9:FF:F6:B1:1A (OUI DF-A9-FF)
        Count: 1
        #56: len 11 (0 Kb/s)
        Latency: 161 msec (161-161 msec ~161 msec)
> ACL Data RX: Handle 1083 flags 0x02 dlen 27               #58 [hci1] 8.784445
> ACL Data RX: Handle 1083 flags 0x01 dlen 27               #59 [hci1] 8.784990
> ACL Data RX: Handle 1083 flags 0x01 dlen 15               #60 [hci1] 8.785410
      SMP: Pairing Public Key (0x0c) len 64
        X: 5f7fbaab37d2fb6cebdf8eb5e82427a2a98f23dc953687fa7166fbdb9b18db0f
        Y: 58d6205c639e72ac6a2419efa3aa8f9f5af94e3275d5415479932954c4512dae
< HCI Command: Host Number of Compl.. (0x03|0x0035) plen 5  #61 [hci1] 8.801907
        Num handles: 1
        Handle: 1083 Address: DF:A9:FF:F6:B1:1A (OUI DF-A9-FF)
        Count: 1
< HCI Command: Host Number of Compl.. (0x03|0x0035) plen 5  #62 [hci1] 8.802032
        Num handles: 1
        Handle: 1083 Address: DF:A9:FF:F6:B1:1A (OUI DF-A9-FF)
        Count: 1
< HCI Command: Host Number of Compl.. (0x03|0x0035) plen 5  #63 [hci1] 8.802199
        Num handles: 1
        Handle: 1083 Address: DF:A9:FF:F6:B1:1A (OUI DF-A9-FF)
        Count: 1
< ACL Data TX: Handle 1083 flags 0x00 dlen 27               #64 [hci1] 8.802278
< ACL Data TX: Handle 1083 flags 0x01 dlen 27               #65 [hci1] 8.802297
< ACL Data TX: Handle 1083 flags 0x01 dlen 15               #66 [hci1] 8.802314
      SMP: Pairing Public Key (0x0c) len 64
        X: 98308440221e2d910f0e54b71e7ec652857aa9b5a0dc65028824cc19db1226e9
        Y: 67a4816bcb62efb21701e31fdb27561a6217575fb007a8bbdabe7e28b6f68482
> HCI Event: Number of Completed Packets (0x13) plen 5      #67 [hci1] 8.871985
        Num handles: 1
        Handle: 1083 Address: DF:A9:FF:F6:B1:1A (OUI DF-A9-FF)
        Count: 1
        #64: len 27 (3 Kb/s)
        Latency: 69 msec (69-161 msec ~115 msec)
> HCI Event: Number of Completed Packets (0x13) plen 5      #68 [hci1] 8.872662
        Num handles: 1
        Handle: 1083 Address: DF:A9:FF:F6:B1:1A (OUI DF-A9-FF)
        Count: 1
        #65: len 27 (3 Kb/s)
        Latency: 70 msec (69-161 msec ~93 msec)
< ACL Data TX: Handle 1083 flags 0x00 dlen 21               #69 [hci1] 8.881518
      SMP: Pairing Confirm (0x03) len 16
        Confim value: 699aad2363bf7e1966ddd19091298708
> HCI Event: Number of Completed Packets (0x13) plen 5      #70 [hci1] 8.958912
        Num handles: 1
        Handle: 1083 Address: DF:A9:FF:F6:B1:1A (OUI DF-A9-FF)
        Count: 1
        #66: len 15 (0 Kb/s)
        Latency: 156 msec (69-161 msec ~124 msec)
> HCI Event: Number of Completed Packets (0x13) plen 5      #71 [hci1] 9.046560
        Num handles: 1
        Handle: 1083 Address: DF:A9:FF:F6:B1:1A (OUI DF-A9-FF)
        Count: 1
        #69: len 21 (1 Kb/s)
        Latency: 165 msec (69-165 msec ~144 msec)
> ACL Data RX: Handle 1083 flags 0x02 dlen 21               #72 [hci1] 9.046857
      SMP: Pairing Random (0x04) len 16
        Random value: fc752199fd5051b90000000000000000
< HCI Command: Host Number of Compl.. (0x03|0x0035) plen 5  #73 [hci1] 9.061918
        Num handles: 1
        Handle: 1083 Address: DF:A9:FF:F6:B1:1A (OUI DF-A9-FF)
        Count: 1
< ACL Data TX: Handle 1083 flags 0x00 dlen 21               #74 [hci1] 9.061971
      SMP: Pairing Random (0x04) len 16
        Random value: 8e6108f966a694cbe26df70bb96773e6
> HCI Event: Number of Completed Packets (0x13) plen 5      #75 [hci1] 9.221456
        Num handles: 1
        Handle: 1083 Address: DF:A9:FF:F6:B1:1A (OUI DF-A9-FF)
        Count: 1
        #74: len 21 (1 Kb/s)
        Latency: 159 msec (69-165 msec ~152 msec)
> ACL Data RX: Handle 1083 flags 0x02 dlen 21               #76 [hci1] 9.396670
      SMP: Pairing DHKey Check (0x0d) len 16
        E: 22522377a048fa14d4006c3557ac2e6a
< HCI Command: Host Number of Compl.. (0x03|0x0035) plen 5  #77 [hci1] 9.402380
        Num handles: 1
        Handle: 1083 Address: DF:A9:FF:F6:B1:1A (OUI DF-A9-FF)
        Count: 1
< ACL Data TX: Handle 1083 flags 0x00 dlen 21               #78 [hci1] 9.402547
      SMP: Pairing DHKey Check (0x0d) len 16
        E: dbd113b269318656c607522a476cff1d
> HCI Event: Number of Completed Packets (0x13) plen 5      #79 [hci1] 9.571323
        Num handles: 1
        Handle: 1083 Address: DF:A9:FF:F6:B1:1A (OUI DF-A9-FF)
        Count: 1
        #78: len 21 (1 Kb/s)
        Latency: 168 msec (69-168 msec ~160 msec)
> HCI Event: LE Meta Event (0x3e) plen 13                   #80 [hci1] 9.659453
      LE Long Term Key Request (0x05)
        Handle: 1083 Address: DF:A9:FF:F6:B1:1A (OUI DF-A9-FF)
        Random number: 0x0000000000000000
        Encrypted diversifier: 0x0000
< HCI Command: LE Long Term Key Re.. (0x08|0x001a) plen 18  #81 [hci1] 9.661432
        Handle: 1083 Address: DF:A9:FF:F6:B1:1A (OUI DF-A9-FF)
        Long term key: 84dd2215286716000000000000000000
> HCI Event: Command Complete (0x0e) plen 6                 #82 [hci1] 9.662169
      LE Long Term Key Request Reply (0x08|0x001a) ncmd 1
        Status: Success (0x00)
        Handle: 1083 Address: DF:A9:FF:F6:B1:1A (OUI DF-A9-FF)
> HCI Event: Encryption Change (0x08) plen 4               #83 [hci1] 10.096736
        Status: Success (0x00)
        Handle: 1083 Address: DF:A9:FF:F6:B1:1A (OUI DF-A9-FF)
        Encryption: Enabled with AES-CCM (0x01)
> ACL Data RX: Handle 1083 flags 0x02 dlen 21              #84 [hci1] 10.184213
      SMP: Identity Information (0x08) len 16
        Identity resolving key: 8fcfd4e9ee0194e489d08c12feb16938
< HCI Command: Host Number of Comp.. (0x03|0x0035) plen 5  #85 [hci1] 10.212120
        Num handles: 1
        Handle: 1083 Address: DF:A9:FF:F6:B1:1A (OUI DF-A9-FF)
        Count: 1
> ACL Data RX: Handle 1083 flags 0x02 dlen 12              #86 [hci1] 10.271544
      SMP: Identity Address Information (0x09) len 7
        Address: DF:A9:FF:F6:B1:1A (OUI DF-A9-FF)
> ACL Data RX: Handle 1083 flags 0x02 dlen 11              #87 [hci1] 10.272044
      ATT: Read By Type Request (0x08) len 6
        Handle range: 0x0001-0xffff
        Attribute type: Characteristic (0x2803)
< HCI Command: LE Add Device To R.. (0x08|0x0027) plen 39  #88 [hci1] 10.282113
        Address type: Public (0x00)
        Address: DF:A9:FF:F6:B1:1A (OUI DF-A9-FF)
        Peer identity resolving key: 8fcfd4e9ee0194e489d08c12feb16938
        Local identity resolving key: 00000000000000000000000000000000
> HCI Event: Command Complete (0x0e) plen 4                #89 [hci1] 10.283184
      LE Add Device To Resolving List (0x08|0x0027) ncmd 1
        Status: Success (0x00)
< HCI Command: LE Set Privacy Mode (0x08|0x004e) plen 8    #90 [hci1] 10.301887
        Peer Identity address type: Public (0x00)
        Peer Identity address: DF:A9:FF:F6:B1:1A (OUI DF-A9-FF)
        Privacy Mode: Use Device Privacy (0x01)
> HCI Event: Command Complete (0x0e) plen 4                #91 [hci1] 10.302434
      LE Set Privacy Mode (0x08|0x004e) ncmd 1
        Status: Success (0x00)
< HCI Command: LE Set Address Reso.. (0x08|0x002d) plen 1  #92 [hci1] 10.321879
        Address resolution: Enabled (0x01)
> HCI Event: Command Complete (0x0e) plen 4                #93 [hci1] 10.322299
      LE Set Address Resolution Enable (0x08|0x002d) ncmd 1
        Status: Success (0x00)
< HCI Command: Host Number of Comp.. (0x03|0x0035) plen 5  #94 [hci1] 10.341815
        Num handles: 1
        Handle: 1083 Address: DF:A9:FF:F6:B1:1A (OUI DF-A9-FF)
        Count: 1
< HCI Command: Host Number of Comp.. (0x03|0x0035) plen 5  #95 [hci1] 10.342226
        Num handles: 1
        Handle: 1083 Address: DF:A9:FF:F6:B1:1A (OUI DF-A9-FF)
        Count: 1
< ACL Data TX: Handle 1083 flags 0x00 dlen 20              #96 [hci1] 10.342420
      ATT: Read By Type Response (0x09) len 15
        Attribute data length: 7
        Attribute data list: 2 entries
        Handle: 0x0002
        Value: 200300052a
            Properties: 0x20
              Indicate (0x20)
            Value Handle: 0x0003
            Value UUID: Service Changed (0x2a05)
        Handle: 0x0005
        Value: 0a0600292b
            Properties: 0x0a
              Read (0x02)
              Write (0x08)
            Value Handle: 0x0006
            Value UUID: Client Supported Features (0x2b29)
> HCI Event: Number of Completed Packets (0x13) plen 5     #97 [hci1] 10.446625
        Num handles: 1
        Handle: 1083 Address: DF:A9:FF:F6:B1:1A (OUI DF-A9-FF)
        Count: 1
        #96: len 20 (1 Kb/s)
        Latency: 104 msec (69-168 msec ~132 msec)
> ACL Data RX: Handle 1083 flags 0x02 dlen 11              #98 [hci1] 10.446710
      ATT: Read By Type Request (0x08) len 6
        Handle range: 0x0006-0xffff
        Attribute type: Characteristic (0x2803)
< HCI Command: Host Number of Comp.. (0x03|0x0035) plen 5  #99 [hci1] 10.461708
        Num handles: 1
        Handle: 1083 Address: DF:A9:FF:F6:B1:1A (OUI DF-A9-FF)
        Count: 1
< ACL Data TX: Handle 1083 flags 0x00 dlen 20             #100 [hci1] 10.461738
      ATT: Read By Type Response (0x09) len 15
        Attribute data length: 7
        Attribute data list: 2 entries
        Handle: 0x0007
        Value: 0208002a2b
            Properties: 0x02
              Read (0x02)
            Value Handle: 0x0008
            Value UUID: Database Hash (0x2b2a)
        Handle: 0x0009
        Value: 020a003a2b
            Properties: 0x02
              Read (0x02)
            Value Handle: 0x000a
            Value UUID: Server Supported Features (0x2b3a)
> HCI Event: Number of Completed Packets (0x13) plen 5    #101 [hci1] 10.621606
        Num handles: 1
        Handle: 1083 Address: DF:A9:FF:F6:B1:1A (OUI DF-A9-FF)
        Count: 1
        #100: len 20 (1 Kb/s)
        Latency: 159 msec (69-168 msec ~146 msec)
> ACL Data RX: Handle 1083 flags 0x02 dlen 11             #102 [hci1] 10.621736
      ATT: Read By Type Request (0x08) len 6
        Handle range: 0x000a-0xffff
        Attribute type: Characteristic (0x2803)
< HCI Command: Host Number of Com.. (0x03|0x0035) plen 5  #103 [hci1] 10.641735
        Num handles: 1
        Handle: 1083 Address: DF:A9:FF:F6:B1:1A (OUI DF-A9-FF)
        Count: 1
< ACL Data TX: Handle 1083 flags 0x00 dlen 20             #104 [hci1] 10.641818
      ATT: Read By Type Response (0x09) len 15
        Attribute data length: 7
        Attribute data list: 2 entries
        Handle: 0x000c
        Value: 0a0d00002a
            Properties: 0x0a
              Read (0x02)
              Write (0x08)
            Value Handle: 0x000d
            Value UUID: Device Name (0x2a00)
        Handle: 0x000e
        Value: 0a0f00012a
            Properties: 0x0a
              Read (0x02)
              Write (0x08)
            Value Handle: 0x000f
            Value UUID: Appearance (0x2a01)
> HCI Event: Number of Completed Packets (0x13) plen 5    #105 [hci1] 10.796483
        Num handles: 1
        Handle: 1083 Address: DF:A9:FF:F6:B1:1A (OUI DF-A9-FF)
        Count: 1
        #104: len 20 (1 Kb/s)
        Latency: 154 msec (69-168 msec ~150 msec)
> ACL Data RX: Handle 1083 flags 0x02 dlen 11             #106 [hci1] 10.796723
      ATT: Read By Type Request (0x08) len 6
        Handle range: 0x000f-0xffff
        Attribute type: Characteristic (0x2803)
< HCI Command: Host Number of Com.. (0x03|0x0035) plen 5  #107 [hci1] 10.801955
        Num handles: 1
        Handle: 1083 Address: DF:A9:FF:F6:B1:1A (OUI DF-A9-FF)
        Count: 1
< ACL Data TX: Handle 1083 flags 0x00 dlen 20             #108 [hci1] 10.802006
      ATT: Read By Type Response (0x09) len 15
        Attribute data length: 7
        Attribute data list: 2 entries
        Handle: 0x0010
        Value: 021100042a
            Properties: 0x02
              Read (0x02)
            Value Handle: 0x0011
            Value UUID: Peripheral Preferred Connection Parameters (0x2a04)
        Handle: 0x0013
        Value: 021400242a
            Properties: 0x02
              Read (0x02)
            Value Handle: 0x0014
            Value UUID: Model Number String (0x2a24)
< ACL Data TX: Handle 1083 flags 0x00 dlen 16             #109 [hci1] 10.911559
      LE L2CAP: Connection Parameter Update Request (0x12) ident 1 len 8
        Min interval: 24
        Max interval: 40
        Peripheral latency: 0
        Timeout multiplier: 42
> HCI Event: Number of Completed Packets (0x13) plen 5    #110 [hci1] 10.971691
        Num handles: 1
        Handle: 1083 Address: DF:A9:FF:F6:B1:1A (OUI DF-A9-FF)
        Count: 1
        #108: len 20 (0 Kb/s)
        Latency: 169 msec (69-169 msec ~160 msec)
> ACL Data RX: Handle 1083 flags 0x02 dlen 11             #111 [hci1] 10.971698
      ATT: Read By Type Request (0x08) len 6
        Handle range: 0x0014-0xffff
        Attribute type: Characteristic (0x2803)
< HCI Command: Host Number of Com.. (0x03|0x0035) plen 5  #112 [hci1] 10.982285
        Num handles: 1
        Handle: 1083 Address: DF:A9:FF:F6:B1:1A (OUI DF-A9-FF)
        Count: 1
< ACL Data TX: Handle 1083 flags 0x00 dlen 20             #113 [hci1] 10.982412
      ATT: Read By Type Response (0x09) len 15
        Attribute data length: 7
        Attribute data list: 2 entries
        Handle: 0x0015
        Value: 021600292a
            Properties: 0x02
              Read (0x02)
            Value Handle: 0x0016
            Value UUID: Manufacturer Name String (0x2a29)
        Handle: 0x0017
        Value: 021800502a
            Properties: 0x02
              Read (0x02)
            Value Handle: 0x0018
            Value UUID: PnP ID (0x2a50)
> HCI Event: Number of Completed Packets (0x13) plen 5    #114 [hci1] 11.058969
        Num handles: 1
        Handle: 1083 Address: DF:A9:FF:F6:B1:1A (OUI DF-A9-FF)
        Count: 1
        #109: len 16 (0 Kb/s)
        Latency: 147 msec (69-169 msec ~153 msec)
> ACL Data RX: Handle 1083 flags 0x02 dlen 10             #115 [hci1] 11.059348
      LE L2CAP: Connection Parameter Update Response (0x13) ident 1 len 2
        Result: Connection Parameters accepted (0x0000)
< HCI Command: Host Number of Com.. (0x03|0x0035) plen 5  #116 [hci1] 11.062199
        Num handles: 1
        Handle: 1083 Address: DF:A9:FF:F6:B1:1A (OUI DF-A9-FF)
        Count: 1
> HCI Event: Number of Completed Packets (0x13) plen 5    #117 [hci1] 11.146449
        Num handles: 1
        Handle: 1083 Address: DF:A9:FF:F6:B1:1A (OUI DF-A9-FF)
        Count: 1
        #113: len 20 (0 Kb/s)
        Latency: 164 msec (69-169 msec ~158 msec)
> ACL Data RX: Handle 1083 flags 0x02 dlen 11             #118 [hci1] 11.146742
      ATT: Read By Type Request (0x08) len 6
        Handle range: 0x0018-0xffff
        Attribute type: Characteristic (0x2803)
< HCI Command: Host Number of Com.. (0x03|0x0035) plen 5  #119 [hci1] 11.161971
        Num handles: 1
        Handle: 1083 Address: DF:A9:FF:F6:B1:1A (OUI DF-A9-FF)
        Count: 1
< ACL Data TX: Handle 1083 flags 0x00 dlen 20             #120 [hci1] 11.162016
      ATT: Read By Type Response (0x09) len 15
        Attribute data length: 7
        Attribute data list: 2 entries
        Handle: 0x0019
        Value: 021a00252a
            Properties: 0x02
              Read (0x02)
            Value Handle: 0x001a
            Value UUID: Serial Number String (0x2a25)
        Handle: 0x001b
        Value: 021c00262a
            Properties: 0x02
              Read (0x02)
            Value Handle: 0x001c
            Value UUID: Firmware Revision String (0x2a26)
> HCI Event: Number of Completed Packets (0x13) plen 5    #121 [hci1] 11.321492
        Num handles: 1
        Handle: 1083 Address: DF:A9:FF:F6:B1:1A (OUI DF-A9-FF)
        Count: 1
        #120: len 20 (1 Kb/s)
        Latency: 159 msec (69-169 msec ~159 msec)
> ACL Data RX: Handle 1083 flags 0x02 dlen 11             #122 [hci1] 11.321672
      ATT: Read By Type Request (0x08) len 6
        Handle range: 0x001c-0xffff
        Attribute type: Characteristic (0x2803)
< HCI Command: Host Number of Com.. (0x03|0x0035) plen 5  #123 [hci1] 11.341889
        Num handles: 1
        Handle: 1083 Address: DF:A9:FF:F6:B1:1A (OUI DF-A9-FF)
        Count: 1
< ACL Data TX: Handle 1083 flags 0x00 dlen 20             #124 [hci1] 11.341933
      ATT: Read By Type Response (0x09) len 15
        Attribute data length: 7
        Attribute data list: 2 entries
        Handle: 0x001d
        Value: 021e00272a
            Properties: 0x02
              Read (0x02)
            Value Handle: 0x001e
            Value UUID: Hardware Revision String (0x2a27)
        Handle: 0x001f
        Value: 022000282a
            Properties: 0x02
              Read (0x02)
            Value Handle: 0x0020
            Value UUID: Software Revision String (0x2a28)
> HCI Event: Number of Completed Packets (0x13) plen 5    #125 [hci1] 11.496561
        Num handles: 1
        Handle: 1083 Address: DF:A9:FF:F6:B1:1A (OUI DF-A9-FF)
        Count: 1
        #124: len 20 (1 Kb/s)
        Latency: 154 msec (69-169 msec ~156 msec)
> ACL Data RX: Handle 1083 flags 0x02 dlen 11             #126 [hci1] 11.496773
      ATT: Read By Type Request (0x08) len 6
        Handle range: 0x0020-0xffff
        Attribute type: Characteristic (0x2803)
< HCI Command: Host Number of Com.. (0x03|0x0035) plen 5  #127 [hci1] 11.502173
        Num handles: 1
        Handle: 1083 Address: DF:A9:FF:F6:B1:1A (OUI DF-A9-FF)
        Count: 1
< ACL Data TX: Handle 1083 flags 0x00 dlen 20             #128 [hci1] 11.502269
      ATT: Read By Type Response (0x09) len 15
        Attribute data length: 7
        Attribute data list: 2 entries
        Handle: 0x0021
        Value: 022200ff2b
            Properties: 0x02
              Read (0x02)
            Value Handle: 0x0022
            Value UUID: Unknown (0x2bff)
        Handle: 0x0023
        Value: 022400232a
            Properties: 0x02
              Read (0x02)
            Value Handle: 0x0024
            Value UUID: System ID (0x2a23)
> HCI Event: Number of Completed Packets (0x13) plen 5    #129 [hci1] 11.671512
        Num handles: 1
        Handle: 1083 Address: DF:A9:FF:F6:B1:1A (OUI DF-A9-FF)
        Count: 1
        #128: len 20 (0 Kb/s)
        Latency: 169 msec (69-169 msec ~163 msec)
> ACL Data RX: Handle 1083 flags 0x02 dlen 11             #130 [hci1] 11.671747
      ATT: Read By Type Request (0x08) len 6
        Handle range: 0x0024-0xffff
        Attribute type: Characteristic (0x2803)
< HCI Command: Host Number of Com.. (0x03|0x0035) plen 5  #131 [hci1] 11.681931
        Num handles: 1
        Handle: 1083 Address: DF:A9:FF:F6:B1:1A (OUI DF-A9-FF)
        Count: 1
< ACL Data TX: Handle 1083 flags 0x00 dlen 20             #132 [hci1] 11.681981
      ATT: Read By Type Response (0x09) len 15
        Attribute data length: 7
        Attribute data list: 2 entries
        Handle: 0x0025
        Value: 0226002a2a
            Properties: 0x02
              Read (0x02)
            Value Handle: 0x0026
            Value UUID: IEEE 11073-20601 Regulatory Cert. Data List (0x2a2a)
        Handle: 0x0028
        Value: 0a290050aa
            Properties: 0x0a
              Read (0x02)
              Write (0x08)
            Value Handle: 0x0029
            Value UUID: Unknown (0xaa50)
> HCI Event: Number of Completed Packets (0x13) plen 5    #133 [hci1] 11.846532
        Num handles: 1
        Handle: 1083 Address: DF:A9:FF:F6:B1:1A (OUI DF-A9-FF)
        Count: 1
        #132: len 20 (0 Kb/s)
        Latency: 164 msec (69-169 msec ~163 msec)
> ACL Data RX: Handle 1083 flags 0x02 dlen 11             #134 [hci1] 11.846770
      ATT: Read By Type Request (0x08) len 6
        Handle range: 0x0029-0xffff
        Attribute type: Characteristic (0x2803)
< HCI Command: Host Number of Com.. (0x03|0x0035) plen 5  #135 [hci1] 11.861736
        Num handles: 1
        Handle: 1083 Address: DF:A9:FF:F6:B1:1A (OUI DF-A9-FF)
        Count: 1
< ACL Data TX: Handle 1083 flags 0x00 dlen 20             #136 [hci1] 11.861804
      ATT: Read By Type Response (0x09) len 15
        Attribute data length: 7
        Attribute data list: 2 entries
        Handle: 0x002a
        Value: 0a2b0051aa
            Properties: 0x0a
              Read (0x02)
              Write (0x08)
            Value Handle: 0x002b
            Value UUID: Unknown (0xaa51)
        Handle: 0x002c
        Value: 0a2d0052aa
            Properties: 0x0a
              Read (0x02)
              Write (0x08)
            Value Handle: 0x002d
            Value UUID: Unknown (0xaa52)
> HCI Event: Number of Completed Packets (0x13) plen 5    #137 [hci1] 12.021489
        Num handles: 1
        Handle: 1083 Address: DF:A9:FF:F6:B1:1A (OUI DF-A9-FF)
        Count: 1
        #136: len 20 (1 Kb/s)
        Latency: 159 msec (69-169 msec ~161 msec)
> ACL Data RX: Handle 1083 flags 0x02 dlen 11             #138 [hci1] 12.021761
      ATT: Read By Type Request (0x08) len 6
        Handle range: 0x002d-0xffff
        Attribute type: Characteristic (0x2803)
< HCI Command: Host Number of Com.. (0x03|0x0035) plen 5  #139 [hci1] 12.042054
        Num handles: 1
        Handle: 1083 Address: DF:A9:FF:F6:B1:1A (OUI DF-A9-FF)
        Count: 1
< ACL Data TX: Handle 1083 flags 0x00 dlen 20             #140 [hci1] 12.042210
      ATT: Read By Type Response (0x09) len 15
        Attribute data length: 7
        Attribute data list: 2 entries
        Handle: 0x002e
        Value: 0a2f0053aa
            Properties: 0x0a
              Read (0x02)
              Write (0x08)
            Value Handle: 0x002f
            Value UUID: Unknown (0xaa53)
        Handle: 0x0030
        Value: 3a310054aa
            Properties: 0x3a
              Read (0x02)
              Write (0x08)
              Notify (0x10)
              Indicate (0x20)
            Value Handle: 0x0031
            Value UUID: Unknown (0xaa54)
> HCI Event: Number of Completed Packets (0x13) plen 5    #141 [hci1] 12.196675
        Num handles: 1
        Handle: 1083 Address: DF:A9:FF:F6:B1:1A (OUI DF-A9-FF)
        Count: 1
        #140: len 20 (1 Kb/s)
        Latency: 154 msec (69-169 msec ~158 msec)
> ACL Data RX: Handle 1083 flags 0x02 dlen 11             #142 [hci1] 12.196771
      ATT: Read By Type Request (0x08) len 6
        Handle range: 0x0031-0xffff
        Attribute type: Characteristic (0x2803)
< HCI Command: Host Number of Com.. (0x03|0x0035) plen 5  #143 [hci1] 12.201960
        Num handles: 1
        Handle: 1083 Address: DF:A9:FF:F6:B1:1A (OUI DF-A9-FF)
        Count: 1
< ACL Data TX: Handle 1083 flags 0x00 dlen 20             #144 [hci1] 12.202021
      ATT: Read By Type Response (0x09) len 15
        Attribute data length: 7
        Attribute data list: 2 entries
        Handle: 0x0033
        Value: 3a340055aa
            Properties: 0x3a
              Read (0x02)
              Write (0x08)
              Notify (0x10)
              Indicate (0x20)
            Value Handle: 0x0034
            Value UUID: Unknown (0xaa55)
        Handle: 0x0036
        Value: 06370056aa
            Properties: 0x06
              Read (0x02)
              Write Without Response (0x04)
            Value Handle: 0x0037
            Value UUID: Unknown (0xaa56)
> HCI Event: Number of Completed Packets (0x13) plen 5    #145 [hci1] 12.371472
        Num handles: 1
        Handle: 1083 Address: DF:A9:FF:F6:B1:1A (OUI DF-A9-FF)
        Count: 1
        #144: len 20 (0 Kb/s)
        Latency: 169 msec (69-169 msec ~163 msec)
> ACL Data RX: Handle 1083 flags 0x02 dlen 11             #146 [hci1] 12.371693
      ATT: Read By Type Request (0x08) len 6
        Handle range: 0x0037-0xffff
        Attribute type: Characteristic (0x2803)
< HCI Command: Host Number of Com.. (0x03|0x0035) plen 5  #147 [hci1] 12.381768
        Num handles: 1
        Handle: 1083 Address: DF:A9:FF:F6:B1:1A (OUI DF-A9-FF)
        Count: 1
< ACL Data TX: Handle 1083 flags 0x00 dlen 20             #148 [hci1] 12.381798
      ATT: Read By Type Response (0x09) len 15
        Attribute data length: 7
        Attribute data list: 2 entries
        Handle: 0x0038
        Value: 06390057aa
            Properties: 0x06
              Read (0x02)
              Write Without Response (0x04)
            Value Handle: 0x0039
            Value UUID: Unknown (0xaa57)
        Handle: 0x003a
        Value: 8a3b0058aa
            Properties: 0x8a
              Read (0x02)
              Write (0x08)
            Unknown fields (0x80)
            Value Handle: 0x003b
            Value UUID: Unknown (0xaa58)
> HCI Event: Number of Completed Packets (0x13) plen 5    #149 [hci1] 12.546455
        Num handles: 1
        Handle: 1083 Address: DF:A9:FF:F6:B1:1A (OUI DF-A9-FF)
        Count: 1
        #148: len 20 (0 Kb/s)
        Latency: 164 msec (69-169 msec ~164 msec)
> ACL Data RX: Handle 1083 flags 0x02 dlen 11             #150 [hci1] 12.546691
      ATT: Read By Type Request (0x08) len 6
        Handle range: 0x003b-0xffff
        Attribute type: Characteristic (0x2803)
< HCI Command: Host Number of Com.. (0x03|0x0035) plen 5  #151 [hci1] 12.561977
        Num handles: 1
        Handle: 1083 Address: DF:A9:FF:F6:B1:1A (OUI DF-A9-FF)
        Count: 1
< ACL Data TX: Handle 1083 flags 0x00 dlen 20             #152 [hci1] 12.562057
      ATT: Read By Type Response (0x09) len 15
        Attribute data length: 7
        Attribute data list: 2 entries
        Handle: 0x003d
        Value: 0a3e0059aa
            Properties: 0x0a
              Read (0x02)
              Write (0x08)
            Value Handle: 0x003e
            Value UUID: Unknown (0xaa59)
        Handle: 0x003f
        Value: 0a40005aaa
            Properties: 0x0a
              Read (0x02)
              Write (0x08)
            Value Handle: 0x0040
            Value UUID: Unknown (0xaa5a)
> HCI Event: Number of Completed Packets (0x13) plen 5    #153 [hci1] 12.721593
        Num handles: 1
        Handle: 1083 Address: DF:A9:FF:F6:B1:1A (OUI DF-A9-FF)
        Count: 1
        #152: len 20 (1 Kb/s)
        Latency: 159 msec (69-169 msec ~161 msec)
> ACL Data RX: Handle 1083 flags 0x02 dlen 11             #154 [hci1] 12.721720
      ATT: Read By Type Request (0x08) len 6
        Handle range: 0x0040-0xffff
        Attribute type: Characteristic (0x2803)
< HCI Command: Host Number of Com.. (0x03|0x0035) plen 5  #155 [hci1] 12.742111
        Num handles: 1
        Handle: 1083 Address: DF:A9:FF:F6:B1:1A (OUI DF-A9-FF)
        Count: 1
< ACL Data TX: Handle 1083 flags 0x00 dlen 27             #156 [hci1] 12.742176
      ATT: Read By Type Response (0x09) len 22
        Attribute data length: 21
        Attribute data list: 1 entry
        Handle: 0x0041
        Value: 0a4200efcdab89674523b10040510450bb00f0
            Properties: 0x0a
              Read (0x02)
              Write (0x08)
            Value Handle: 0x0042
            Value UUID: Vendor specific (f000bb50-0451-4000-b123-456789abcdef)
> HCI Event: Number of Completed Packets (0x13) plen 5    #157 [hci1] 12.896456
        Num handles: 1
        Handle: 1083 Address: DF:A9:FF:F6:B1:1A (OUI DF-A9-FF)
        Count: 1
        #156: len 27 (1 Kb/s)
        Latency: 154 msec (69-169 msec ~158 msec)
> ACL Data RX: Handle 1083 flags 0x02 dlen 11             #158 [hci1] 12.896783
      ATT: Read By Type Request (0x08) len 6
        Handle range: 0x0042-0xffff
        Attribute type: Characteristic (0x2803)
< HCI Command: Host Number of Com.. (0x03|0x0035) plen 5  #159 [hci1] 12.901752
        Num handles: 1
        Handle: 1083 Address: DF:A9:FF:F6:B1:1A (OUI DF-A9-FF)
        Count: 1
< ACL Data TX: Handle 1083 flags 0x00 dlen 20             #160 [hci1] 12.901782
      ATT: Read By Type Response (0x09) len 15
        Attribute data length: 7
        Attribute data list: 2 entries
        Handle: 0x0045
        Value: 0a460050aa
            Properties: 0x0a
              Read (0x02)
              Write (0x08)
            Value Handle: 0x0046
            Value UUID: Unknown (0xaa50)
        Handle: 0x0047
        Value: 0a480051aa
            Properties: 0x0a
              Read (0x02)
              Write (0x08)
            Value Handle: 0x0048
            Value UUID: Unknown (0xaa51)
> HCI Event: Number of Completed Packets (0x13) plen 5    #161 [hci1] 13.071599
        Num handles: 1
        Handle: 1083 Address: DF:A9:FF:F6:B1:1A (OUI DF-A9-FF)
        Count: 1
        #160: len 20 (0 Kb/s)
        Latency: 169 msec (69-169 msec ~163 msec)
> ACL Data RX: Handle 1083 flags 0x02 dlen 11             #162 [hci1] 13.071693
      ATT: Read By Type Request (0x08) len 6
        Handle range: 0x0048-0xffff
        Attribute type: Characteristic (0x2803)
< HCI Command: Host Number of Com.. (0x03|0x0035) plen 5  #163 [hci1] 13.082153
        Num handles: 1
        Handle: 1083 Address: DF:A9:FF:F6:B1:1A (OUI DF-A9-FF)
        Count: 1
< ACL Data TX: Handle 1083 flags 0x00 dlen 20             #164 [hci1] 13.082215
      ATT: Read By Type Response (0x09) len 15
        Attribute data length: 7
        Attribute data list: 2 entries
        Handle: 0x0049
        Value: 0a4a0052aa
            Properties: 0x0a
              Read (0x02)
              Write (0x08)
            Value Handle: 0x004a
            Value UUID: Unknown (0xaa52)
        Handle: 0x004b
        Value: 024c0053aa
            Properties: 0x02
              Read (0x02)
            Value Handle: 0x004c
            Value UUID: Unknown (0xaa53)
> HCI Event: Number of Completed Packets (0x13) plen 5    #165 [hci1] 13.246464
        Num handles: 1
        Handle: 1083 Address: DF:A9:FF:F6:B1:1A (OUI DF-A9-FF)
        Count: 1
        #164: len 20 (0 Kb/s)
        Latency: 164 msec (69-169 msec ~164 msec)
> ACL Data RX: Handle 1083 flags 0x02 dlen 11             #166 [hci1] 13.246734
      ATT: Read By Type Request (0x08) len 6
        Handle range: 0x004c-0xffff
        Attribute type: Characteristic (0x2803)
< HCI Command: Host Number of Com.. (0x03|0x0035) plen 5  #167 [hci1] 13.262208
        Num handles: 1
        Handle: 1083 Address: DF:A9:FF:F6:B1:1A (OUI DF-A9-FF)
        Count: 1
< ACL Data TX: Handle 1083 flags 0x00 dlen 20             #168 [hci1] 13.262380
      ATT: Read By Type Response (0x09) len 15
        Attribute data length: 7
        Attribute data list: 2 entries
        Handle: 0x004e
        Value: 0a4f0055aa
            Properties: 0x0a
              Read (0x02)
              Write (0x08)
            Value Handle: 0x004f
            Value UUID: Unknown (0xaa55)
        Handle: 0x0050
        Value: 0a510056aa
            Properties: 0x0a
              Read (0x02)
              Write (0x08)
            Value Handle: 0x0051
            Value UUID: Unknown (0xaa56)
> HCI Event: Number of Completed Packets (0x13) plen 5    #169 [hci1] 13.421362
        Num handles: 1
        Handle: 1083 Address: DF:A9:FF:F6:B1:1A (OUI DF-A9-FF)
        Count: 1
        #168: len 20 (1 Kb/s)
        Latency: 158 msec (69-169 msec ~161 msec)
> ACL Data RX: Handle 1083 flags 0x02 dlen 11             #170 [hci1] 13.421682
      ATT: Read By Type Request (0x08) len 6
        Handle range: 0x0051-0xffff
        Attribute type: Characteristic (0x2803)
< HCI Command: Host Number of Com.. (0x03|0x0035) plen 5  #171 [hci1] 13.441981
        Num handles: 1
        Handle: 1083 Address: DF:A9:FF:F6:B1:1A (OUI DF-A9-FF)
        Count: 1
< ACL Data TX: Handle 1083 flags 0x00 dlen 9              #172 [hci1] 13.442149
      ATT: Error Response (0x01) len 4
        Read By Type Request (0x08)
        Handle: 0x0051
        Error: Attribute Not Found (0x0a)
> HCI Event: Number of Completed Packets (0x13) plen 5    #173 [hci1] 13.596404
        Num handles: 1
        Handle: 1083 Address: DF:A9:FF:F6:B1:1A (OUI DF-A9-FF)
        Count: 1
        #172: len 9 (0 Kb/s)
        Latency: 154 msec (69-169 msec ~157 msec)
> ACL Data RX: Handle 1083 flags 0x02 dlen 7              #174 [hci1] 13.596625
      ATT: Read Request (0x0a) len 2
        Handle: 0x0048
< HCI Command: Host Number of Com.. (0x03|0x0035) plen 5  #175 [hci1] 13.601831
        Num handles: 1
        Handle: 1083 Address: DF:A9:FF:F6:B1:1A (OUI DF-A9-FF)
        Count: 1
< ACL Data TX: Handle 1083 flags 0x00 dlen 27             #176 [hci1] 13.601909
      ATT: Read Response (0x0b) len 22
> HCI Event: Number of Completed Packets (0x13) plen 5    #177 [hci1] 13.771472
        Num handles: 1
        Handle: 1083 Address: DF:A9:FF:F6:B1:1A (OUI DF-A9-FF)
        Count: 1
        #176: len 27 (1 Kb/s)
        Latency: 169 msec (69-169 msec ~163 msec)
> ACL Data RX: Handle 1083 flags 0x02 dlen 9              #178 [hci1] 13.771630
      ATT: Read Blob Request (0x0c) len 4
        Handle: 0x0048
        Offset: 0x0016
< HCI Command: Host Number of Com.. (0x03|0x0035) plen 5  #179 [hci1] 13.781850
        Num handles: 1
        Handle: 1083 Address: DF:A9:FF:F6:B1:1A (OUI DF-A9-FF)
        Count: 1
< ACL Data TX: Handle 1083 flags 0x00 dlen 15             #180 [hci1] 13.781893
      ATT: Read Blob Response (0x0d) len 10
        32 10 fe dc ba 98 76 54 32 10                    2.....vT2.      
> HCI Event: Number of Completed Packets (0x13) plen 5    #181 [hci1] 13.946661
        Num handles: 1
        Handle: 1083 Address: DF:A9:FF:F6:B1:1A (OUI DF-A9-FF)
        Count: 1
        #180: len 15 (0 Kb/s)
        Latency: 164 msec (69-169 msec ~164 msec)
> ACL Data RX: Handle 1083 flags 0x02 dlen 27             #182 [hci1] 13.946972
      ATT: Prepare Write Request (0x16) len 22
        Handle: 0x0048
        Offset: 0x0000
          Data: fedcba9876543210fedcba9876543210fedc
< HCI Command: Host Number of Com.. (0x03|0x0035) plen 5  #183 [hci1] 13.961914
        Num handles: 1
        Handle: 1083 Address: DF:A9:FF:F6:B1:1A (OUI DF-A9-FF)
        Count: 1
< ACL Data TX: Handle 1083 flags 0x00 dlen 27             #184 [hci1] 13.962003
      ATT: Prepare Write Response (0x17) len 22
        Handle: 0x0048
        Offset: 0x0000
          Data: fedcba9876543210fedcba9876543210fedc
> HCI Event: Number of Completed Packets (0x13) plen 5    #185 [hci1] 14.121495
        Num handles: 1
        Handle: 1083 Address: DF:A9:FF:F6:B1:1A (OUI DF-A9-FF)
        Count: 1
        #184: len 27 (1 Kb/s)
        Latency: 159 msec (69-169 msec ~161 msec)
> ACL Data RX: Handle 1083 flags 0x02 dlen 23             #186 [hci1] 14.121840
      ATT: Prepare Write Request (0x16) len 18
        Handle: 0x0048
        Offset: 0x0012
          Data: ba9876543210fedcba9876543210
< HCI Command: Host Number of Com.. (0x03|0x0035) plen 5  #187 [hci1] 14.141935
        Num handles: 1
        Handle: 1083 Address: DF:A9:FF:F6:B1:1A (OUI DF-A9-FF)
        Count: 1
< ACL Data TX: Handle 1083 flags 0x00 dlen 23             #188 [hci1] 14.141982
      ATT: Prepare Write Response (0x17) len 18
        Handle: 0x0048
        Offset: 0x0012
          Data: ba9876543210fedcba9876543210
> HCI Event: Number of Completed Packets (0x13) plen 5    #189 [hci1] 14.296465
        Num handles: 1
        Handle: 1083 Address: DF:A9:FF:F6:B1:1A (OUI DF-A9-FF)
        Count: 1
        #188: len 23 (1 Kb/s)
        Latency: 154 msec (69-169 msec ~158 msec)
> ACL Data RX: Handle 1083 flags 0x02 dlen 6              #190 [hci1] 14.296653
      ATT: Execute Write Request (0x18) len 1
        Flags: Cancel all prepared writes (0x00)
< HCI Command: Host Number of Com.. (0x03|0x0035) plen 5  #191 [hci1] 14.302239
        Num handles: 1
        Handle: 1083 Address: DF:A9:FF:F6:B1:1A (OUI DF-A9-FF)
        Count: 1
< ACL Data TX: Handle 1083 flags 0x00 dlen 5              #192 [hci1] 14.302385
      ATT: Execute Write Response (0x19) len 0
> HCI Event: Number of Completed Packets (0x13) plen 5    #193 [hci1] 14.471377
        Num handles: 1
        Handle: 1083 Address: DF:A9:FF:F6:B1:1A (OUI DF-A9-FF)
        Count: 1
        #192: len 5 (0 Kb/s)
        Latency: 168 msec (69-169 msec ~163 msec)
> ACL Data RX: Handle 1083 flags 0x02 dlen 7              #194 [hci1] 14.471780
      ATT: Read Request (0x0a) len 2
        Handle: 0x002b
< HCI Command: Host Number of Com.. (0x03|0x0035) plen 5  #195 [hci1] 14.482158
        Num handles: 1
        Handle: 1083 Address: DF:A9:FF:F6:B1:1A (OUI DF-A9-FF)
        Count: 1
< ACL Data TX: Handle 1083 flags 0x00 dlen 13             #196 [hci1] 14.482227
      ATT: Read Response (0x0b) len 8
> HCI Event: Number of Completed Packets (0x13) plen 5    #197 [hci1] 14.646516
        Num handles: 1
        Handle: 1083 Address: DF:A9:FF:F6:B1:1A (OUI DF-A9-FF)
        Count: 1
        #196: len 13 (0 Kb/s)
        Latency: 164 msec (69-169 msec ~163 msec)
> ACL Data RX: Handle 1083 flags 0x02 dlen 15             #198 [hci1] 14.646846
      ATT: Write Request (0x12) len 10
        Handle: 0x002b
          Data: 0123456789abcdef
< HCI Command: Host Number of Com.. (0x03|0x0035) plen 5  #199 [hci1] 14.662274
        Num handles: 1
        Handle: 1083 Address: DF:A9:FF:F6:B1:1A (OUI DF-A9-FF)
        Count: 1
< ACL Data TX: Handle 1083 flags 0x00 dlen 5              #200 [hci1] 14.662320
      ATT: Write Response (0x13) len 0
> HCI Event: Number of Completed Packets (0x13) plen 5    #201 [hci1] 14.821450
        Num handles: 1
        Handle: 1083 Address: DF:A9:FF:F6:B1:1A (OUI DF-A9-FF)
        Count: 1
        #200: len 5 (0 Kb/s)
        Latency: 159 msec (69-169 msec ~161 msec)
> ACL Data RX: Handle 1083 flags 0x02 dlen 7              #202 [hci1] 14.821589
      ATT: Read Request (0x0a) len 2
        Handle: 0x0042
< HCI Command: Host Number of Com.. (0x03|0x0035) plen 5  #203 [hci1] 14.822229
        Num handles: 1
        Handle: 1083 Address: DF:A9:FF:F6:B1:1A (OUI DF-A9-FF)
        Count: 1
< ACL Data TX: Handle 1083 flags 0x00 dlen 13             #204 [hci1] 14.822373
      ATT: Read Response (0x0b) len 8
> HCI Event: Number of Completed Packets (0x13) plen 5    #205 [hci1] 14.996417
        Num handles: 1
        Handle: 1083 Address: DF:A9:FF:F6:B1:1A (OUI DF-A9-FF)
        Count: 1
        #204: len 13 (0 Kb/s)
        Latency: 174 msec (69-174 msec ~167 msec)
> ACL Data RX: Handle 1083 flags 0x02 dlen 15             #206 [hci1] 14.996729
      ATT: Write Request (0x12) len 10
        Handle: 0x0042
          Data: 0123456789abcdef
< HCI Command: Host Number of Com.. (0x03|0x0035) plen 5  #207 [hci1] 15.002570
        Num handles: 1
        Handle: 1083 Address: DF:A9:FF:F6:B1:1A (OUI DF-A9-FF)
        Count: 1
< ACL Data TX: Handle 1083 flags 0x00 dlen 5              #208 [hci1] 15.002599
      ATT: Write Response (0x13) len 0
> HCI Event: Number of Completed Packets (0x13) plen 5    #209 [hci1] 15.171348
        Num handles: 1
        Handle: 1083 Address: DF:A9:FF:F6:B1:1A (OUI DF-A9-FF)
        Count: 1
        #208: len 5 (0 Kb/s)
        Latency: 168 msec (69-174 msec ~168 msec)
> ACL Data RX: Handle 1083 flags 0x02 dlen 7              #210 [hci1] 15.171674
      ATT: Read Request (0x0a) len 2
        Handle: 0x002f
< HCI Command: Host Number of Com.. (0x03|0x0035) plen 5  #211 [hci1] 15.181802
        Num handles: 1
        Handle: 1083 Address: DF:A9:FF:F6:B1:1A (OUI DF-A9-FF)
        Count: 1
< ACL Data TX: Handle 1083 flags 0x00 dlen 9              #212 [hci1] 15.181912
      ATT: Error Response (0x01) len 4
        Read Request (0x0a)
        Handle: 0x002f
        Error: Insufficient Authorization (0x08)
> HCI Event: Number of Completed Packets (0x13) plen 5    #213 [hci1] 15.346411
        Num handles: 1
        Handle: 1083 Address: DF:A9:FF:F6:B1:1A (OUI DF-A9-FF)
        Count: 1
        #212: len 9 (0 Kb/s)
        Latency: 164 msec (69-174 msec ~166 msec)
> ACL Data RX: Handle 1083 flags 0x02 dlen 7              #214 [hci1] 15.346795
      ATT: Write Request (0x12) len 2
        Handle: 0x002f
          Data: 
< HCI Command: Host Number of Com.. (0x03|0x0035) plen 5  #215 [hci1] 15.362236
        Num handles: 1
        Handle: 1083 Address: DF:A9:FF:F6:B1:1A (OUI DF-A9-FF)
        Count: 1
< ACL Data TX: Handle 1083 flags 0x00 dlen 9              #216 [hci1] 15.362359
      ATT: Error Response (0x01) len 4
        Write Request (0x12)
        Handle: 0x002f
        Error: Insufficient Authorization (0x08)
> HCI Event: Number of Completed Packets (0x13) plen 5    #217 [hci1] 15.521420
        Num handles: 1
        Handle: 1083 Address: DF:A9:FF:F6:B1:1A (OUI DF-A9-FF)
        Count: 1
        #216: len 9 (0 Kb/s)
        Latency: 159 msec (69-174 msec ~162 msec)
> ACL Data RX: Handle 1083 flags 0x02 dlen 7              #218 [hci1] 15.521626
      ATT: Read Request (0x0a) len 2
        Handle: 0x004f
< HCI Command: Host Number of Com.. (0x03|0x0035) plen 5  #219 [hci1] 15.542120
        Num handles: 1
        Handle: 1083 Address: DF:A9:FF:F6:B1:1A (OUI DF-A9-FF)
        Count: 1
< ACL Data TX: Handle 1083 flags 0x00 dlen 27             #220 [hci1] 15.542204
      ATT: Read Response (0x0b) len 22
> HCI Event: Number of Completed Packets (0x13) plen 5    #221 [hci1] 15.696339
        Num handles: 1
        Handle: 1083 Address: DF:A9:FF:F6:B1:1A (OUI DF-A9-FF)
        Count: 1
        #220: len 27 (1 Kb/s)
        Latency: 154 msec (69-174 msec ~158 msec)
> ACL Data RX: Handle 1083 flags 0x02 dlen 9              #222 [hci1] 15.696808
      ATT: Read Blob Request (0x0c) len 4
        Handle: 0x004f
        Offset: 0x0016
< HCI Command: Host Number of Com.. (0x03|0x0035) plen 5  #223 [hci1] 15.701985
        Num handles: 1
        Handle: 1083 Address: DF:A9:FF:F6:B1:1A (OUI DF-A9-FF)
        Count: 1
< ACL Data TX: Handle 1083 flags 0x00 dlen 27             #224 [hci1] 15.702061
      ATT: Read Blob Response (0x0d) len 22
        cd ef 01 23 45 67 89 ab cd ef 01 23 45 67 89 ab  ...#Eg.....#Eg..
        cd ef 01 23 45 67                                ...#Eg          
> HCI Event: Number of Completed Packets (0x13) plen 5    #225 [hci1] 15.871487
        Num handles: 1
        Handle: 1083 Address: DF:A9:FF:F6:B1:1A (OUI DF-A9-FF)
        Count: 1
        #224: len 27 (1 Kb/s)
        Latency: 169 msec (69-174 msec ~163 msec)
> ACL Data RX: Handle 1083 flags 0x02 dlen 9              #226 [hci1] 15.871609
      ATT: Read Blob Request (0x0c) len 4
        Handle: 0x004f
        Offset: 0x002c
< HCI Command: Host Number of Com.. (0x03|0x0035) plen 5  #227 [hci1] 15.881788
        Num handles: 1
        Handle: 1083 Address: DF:A9:FF:F6:B1:1A (OUI DF-A9-FF)
        Count: 1
< ACL Data TX: Handle 1083 flags 0x00 dlen 27             #228 [hci1] 15.881859
      ATT: Read Blob Response (0x0d) len 22
        89 ab cd ef 01 23 45 67 89 ab cd ef 01 23 45 67  .....#Eg.....#Eg
        89 ab cd ef 01 23                                .....#          
> HCI Event: Number of Completed Packets (0x13) plen 5    #229 [hci1] 16.046452
        Num handles: 1
        Handle: 1083 Address: DF:A9:FF:F6:B1:1A (OUI DF-A9-FF)
        Count: 1
        #228: len 27 (1 Kb/s)
        Latency: 164 msec (69-174 msec ~164 msec)
> ACL Data RX: Handle 1083 flags 0x02 dlen 9              #230 [hci1] 16.046704
      ATT: Read Blob Request (0x0c) len 4
        Handle: 0x004f
        Offset: 0x0042
< HCI Command: Host Number of Com.. (0x03|0x0035) plen 5  #231 [hci1] 16.062281
        Num handles: 1
        Handle: 1083 Address: DF:A9:FF:F6:B1:1A (OUI DF-A9-FF)
        Count: 1
< ACL Data TX: Handle 1083 flags 0x00 dlen 19             #232 [hci1] 16.062388
      ATT: Read Blob Response (0x0d) len 14
        45 67 89 ab cd ef 01 23 45 67 89 ab cd ef        Eg.....#Eg....  
> HCI Event: Number of Completed Packets (0x13) plen 5    #233 [hci1] 16.221522
        Num handles: 1
        Handle: 1083 Address: DF:A9:FF:F6:B1:1A (OUI DF-A9-FF)
        Count: 1
        #232: len 19 (0 Kb/s)
        Latency: 159 msec (69-174 msec ~161 msec)
> ACL Data RX: Handle 1083 flags 0x02 dlen 27             #234 [hci1] 16.221935
      ATT: Prepare Write Request (0x16) len 22
        Handle: 0x004f
        Offset: 0x0000
          Data: 0123456789abcdef0123456789abcdef0123
< HCI Command: Host Number of Com.. (0x03|0x0035) plen 5  #235 [hci1] 16.241768
        Num handles: 1
        Handle: 1083 Address: DF:A9:FF:F6:B1:1A (OUI DF-A9-FF)
        Count: 1
< ACL Data TX: Handle 1083 flags 0x00 dlen 27             #236 [hci1] 16.241809
      ATT: Prepare Write Response (0x17) len 22
        Handle: 0x004f
        Offset: 0x0000
          Data: 0123456789abcdef0123456789abcdef0123
> HCI Event: Number of Completed Packets (0x13) plen 5    #237 [hci1] 16.396634
        Num handles: 1
        Handle: 1083 Address: DF:A9:FF:F6:B1:1A (OUI DF-A9-FF)
        Count: 1
        #236: len 27 (1 Kb/s)
        Latency: 154 msec (69-174 msec ~158 msec)
> ACL Data RX: Handle 1083 flags 0x02 dlen 27             #238 [hci1] 16.396941
      ATT: Prepare Write Request (0x16) len 22
        Handle: 0x004f
        Offset: 0x0012
          Data: 456789abcdef0123456789abcdef01234567
< HCI Command: Host Number of Com.. (0x03|0x0035) plen 5  #239 [hci1] 16.402292
        Num handles: 1
        Handle: 1083 Address: DF:A9:FF:F6:B1:1A (OUI DF-A9-FF)
        Count: 1
< ACL Data TX: Handle 1083 flags 0x00 dlen 27             #240 [hci1] 16.402382
      ATT: Prepare Write Response (0x17) len 22
        Handle: 0x004f
        Offset: 0x0012
          Data: 456789abcdef0123456789abcdef01234567
> HCI Event: Number of Completed Packets (0x13) plen 5    #241 [hci1] 16.571495
        Num handles: 1
        Handle: 1083 Address: DF:A9:FF:F6:B1:1A (OUI DF-A9-FF)
        Count: 1
        #240: len 27 (1 Kb/s)
        Latency: 169 msec (69-174 msec ~163 msec)
> ACL Data RX: Handle 1083 flags 0x02 dlen 27             #242 [hci1] 16.571894
      ATT: Prepare Write Request (0x16) len 22
        Handle: 0x004f
        Offset: 0x0024
          Data: 89abcdef0123456789abcdef0123456789ab
< HCI Command: Host Number of Com.. (0x03|0x0035) plen 5  #243 [hci1] 16.582221
        Num handles: 1
        Handle: 1083 Address: DF:A9:FF:F6:B1:1A (OUI DF-A9-FF)
        Count: 1
< ACL Data TX: Handle 1083 flags 0x00 dlen 27             #244 [hci1] 16.582317
      ATT: Prepare Write Response (0x17) len 22
        Handle: 0x004f
        Offset: 0x0024
          Data: 89abcdef0123456789abcdef0123456789ab
> HCI Event: Number of Completed Packets (0x13) plen 5    #245 [hci1] 16.746544
        Num handles: 1
        Handle: 1083 Address: DF:A9:FF:F6:B1:1A (OUI DF-A9-FF)
        Count: 1
        #244: len 27 (1 Kb/s)
        Latency: 164 msec (69-174 msec ~163 msec)
> ACL Data RX: Handle 1083 flags 0x02 dlen 27             #246 [hci1] 16.746925
      ATT: Prepare Write Request (0x16) len 22
        Handle: 0x004f
        Offset: 0x0036
          Data: cdef0123456789abcdef0123456789abcdef
< HCI Command: Host Number of Com.. (0x03|0x0035) plen 5  #247 [hci1] 16.762114
        Num handles: 1
        Handle: 1083 Address: DF:A9:FF:F6:B1:1A (OUI DF-A9-FF)
        Count: 1
< ACL Data TX: Handle 1083 flags 0x00 dlen 27             #248 [hci1] 16.762171
      ATT: Prepare Write Response (0x17) len 22
        Handle: 0x004f
        Offset: 0x0036
          Data: cdef0123456789abcdef0123456789abcdef
> HCI Event: Number of Completed Packets (0x13) plen 5    #249 [hci1] 16.921519
        Num handles: 1
        Handle: 1083 Address: DF:A9:FF:F6:B1:1A (OUI DF-A9-FF)
        Count: 1
        #248: len 27 (1 Kb/s)
        Latency: 159 msec (69-174 msec ~161 msec)
> ACL Data RX: Handle 1083 flags 0x02 dlen 17             #250 [hci1] 16.921852
      ATT: Prepare Write Request (0x16) len 12
        Handle: 0x004f
        Offset: 0x0048
          Data: 0123456789abcdef
< HCI Command: Host Number of Com.. (0x03|0x0035) plen 5  #251 [hci1] 16.941954
        Num handles: 1
        Handle: 1083 Address: DF:A9:FF:F6:B1:1A (OUI DF-A9-FF)
        Count: 1
< ACL Data TX: Handle 1083 flags 0x00 dlen 17             #252 [hci1] 16.942009
      ATT: Prepare Write Response (0x17) len 12
        Handle: 0x004f
        Offset: 0x0048
          Data: 0123456789abcdef
> HCI Event: Number of Completed Packets (0x13) plen 5    #253 [hci1] 17.096337
        Num handles: 1
        Handle: 1083 Address: DF:A9:FF:F6:B1:1A (OUI DF-A9-FF)
        Count: 1
        #252: len 17 (0 Kb/s)
        Latency: 154 msec (69-174 msec ~157 msec)
> ACL Data RX: Handle 1083 flags 0x02 dlen 6              #254 [hci1] 17.096545
      ATT: Execute Write Request (0x18) len 1
        Flags: Cancel all prepared writes (0x00)
< HCI Command: Host Number of Com.. (0x03|0x0035) plen 5  #255 [hci1] 17.102312
        Num handles: 1
        Handle: 1083 Address: DF:A9:FF:F6:B1:1A (OUI DF-A9-FF)
        Count: 1
< ACL Data TX: Handle 1083 flags 0x00 dlen 5              #256 [hci1] 17.102364
      ATT: Execute Write Response (0x19) len 0
> HCI Event: Number of Completed Packets (0x13) plen 5    #257 [hci1] 17.271423
        Num handles: 1
        Handle: 1083 Address: DF:A9:FF:F6:B1:1A (OUI DF-A9-FF)
        Count: 1
        #256: len 5 (0 Kb/s)
        Latency: 169 msec (69-174 msec ~163 msec)
> ACL Data RX: Handle 1083 flags 0x02 dlen 7              #258 [hci1] 17.271561
      ATT: Read Request (0x0a) len 2
        Handle: 0x000f
< HCI Command: Host Number of Com.. (0x03|0x0035) plen 5  #259 [hci1] 17.282137
        Num handles: 1
        Handle: 1083 Address: DF:A9:FF:F6:B1:1A (OUI DF-A9-FF)
        Count: 1
< ACL Data TX: Handle 1083 flags 0x00 dlen 7              #260 [hci1] 17.282203
      ATT: Read Response (0x0b) len 2
> HCI Event: Number of Completed Packets (0x13) plen 5    #261 [hci1] 17.446323
        Num handles: 1
        Handle: 1083 Address: DF:A9:FF:F6:B1:1A (OUI DF-A9-FF)
        Count: 1
        #260: len 7 (0 Kb/s)
        Latency: 164 msec (69-174 msec ~163 msec)
> ACL Data RX: Handle 1083 flags 0x02 dlen 9              #262 [hci1] 17.446590
      ATT: Write Request (0x12) len 4
        Handle: 0x000f
          Data: 0000
< HCI Command: Host Number of Com.. (0x03|0x0035) plen 5  #263 [hci1] 17.461893
        Num handles: 1
        Handle: 1083 Address: DF:A9:FF:F6:B1:1A (OUI DF-A9-FF)
        Count: 1
< ACL Data TX: Handle 1083 flags 0x00 dlen 9              #264 [hci1] 17.461930
      ATT: Error Response (0x01) len 4
        Write Request (0x12)
        Handle: 0x000f
        Error: Insufficient Authentication (0x05)
> HCI Event: Number of Completed Packets (0x13) plen 5    #265 [hci1] 17.621347
        Num handles: 1
        Handle: 1083 Address: DF:A9:FF:F6:B1:1A (OUI DF-A9-FF)
        Count: 1
        #264: len 9 (0 Kb/s)
        Latency: 159 msec (69-174 msec ~161 msec)
> ACL Data RX: Handle 1083 flags 0x02 dlen 7              #266 [hci1] 17.621559
      ATT: Read Request (0x0a) len 2
        Handle: 0x003b
< HCI Command: Host Number of Com.. (0x03|0x0035) plen 5  #267 [hci1] 17.622266
        Num handles: 1
        Handle: 1083 Address: DF:A9:FF:F6:B1:1A (OUI DF-A9-FF)
        Count: 1
< ACL Data TX: Handle 1083 flags 0x00 dlen 13             #268 [hci1] 17.622432
      ATT: Read Response (0x0b) len 8
> HCI Event: Number of Completed Packets (0x13) plen 5    #269 [hci1] 17.796409
        Num handles: 1
        Handle: 1083 Address: DF:A9:FF:F6:B1:1A (OUI DF-A9-FF)
        Count: 1
        #268: len 13 (0 Kb/s)
        Latency: 173 msec (69-174 msec ~167 msec)
> ACL Data RX: Handle 1083 flags 0x02 dlen 15             #270 [hci1] 17.796774
      ATT: Write Request (0x12) len 10
        Handle: 0x003b
          Data: 0123456789abcdef
< HCI Command: Host Number of Com.. (0x03|0x0035) plen 5  #271 [hci1] 17.802305
        Num handles: 1
        Handle: 1083 Address: DF:A9:FF:F6:B1:1A (OUI DF-A9-FF)
        Count: 1
< ACL Data TX: Handle 1083 flags 0x00 dlen 5              #272 [hci1] 17.802456
      ATT: Write Response (0x13) len 0
> HCI Event: Number of Completed Packets (0x13) plen 5    #273 [hci1] 17.971390
        Num handles: 1
        Handle: 1083 Address: DF:A9:FF:F6:B1:1A (OUI DF-A9-FF)
        Count: 1
        #272: len 5 (0 Kb/s)
        Latency: 168 msec (69-174 msec ~168 msec)
> ACL Data RX: Handle 1083 flags 0x02 dlen 7              #274 [hci1] 17.971527
      ATT: Read Request (0x0a) len 2
        Handle: 0x004a
< HCI Command: Host Number of Com.. (0x03|0x0035) plen 5  #275 [hci1] 17.981822
        Num handles: 1
        Handle: 1083 Address: DF:A9:FF:F6:B1:1A (OUI DF-A9-FF)
        Count: 1
< ACL Data TX: Handle 1083 flags 0x00 dlen 9              #276 [hci1] 17.981911
      ATT: Error Response (0x01) len 4
        Read Request (0x0a)
        Handle: 0x004a
        Error: Insufficient Encryption Key Size (0x0c)
> HCI Event: Number of Completed Packets (0x13) plen 5    #277 [hci1] 18.146321
        Num handles: 1
        Handle: 1083 Address: DF:A9:FF:F6:B1:1A (OUI DF-A9-FF)
        Count: 1
        #276: len 9 (0 Kb/s)
        Latency: 164 msec (69-174 msec ~166 msec)
> ACL Data RX: Handle 1083 flags 0x02 dlen 7              #278 [hci1] 18.146635
      ATT: Write Request (0x12) len 2
        Handle: 0x004a
          Data: 
< HCI Command: Host Number of Com.. (0x03|0x0035) plen 5  #279 [hci1] 18.162214
        Num handles: 1
        Handle: 1083 Address: DF:A9:FF:F6:B1:1A (OUI DF-A9-FF)
        Count: 1
< ACL Data TX: Handle 1083 flags 0x00 dlen 9              #280 [hci1] 18.162316
      ATT: Error Response (0x01) len 4
        Write Request (0x12)
        Handle: 0x004a
        Error: Insufficient Encryption Key Size (0x0c)
> HCI Event: Number of Completed Packets (0x13) plen 5    #281 [hci1] 18.321215
        Num handles: 1
        Handle: 1083 Address: DF:A9:FF:F6:B1:1A (OUI DF-A9-FF)
        Count: 1
        #280: len 9 (0 Kb/s)
        Latency: 158 msec (69-174 msec ~162 msec)
> HCI Event: Disconnect Complete (0x05) plen 4            #282 [hci1] 19.721568
        Status: Success (0x00)
        Handle: 1083 Address: DF:A9:FF:F6:B1:1A (OUI DF-A9-FF)
        Reason: Remote User Terminated Connection (0x13)
< HCI Command: Reset (0x03|0x0003) plen 0                 #283 [hci1] 27.031801
> HCI Event: Command Complete (0x0e) plen 4               #284 [hci1] 27.032371
      Reset (0x03|0x0003) ncmd 1
        Status: Success (0x00)
@ USER Close: main                                    {0x0001} [hci1] 27.041727
= Close Index: 00:00:00:00:00:00                               [hci1] 27.041734
