Bluetooth monitor ver 5.72
= Note: Linux version 6.14.0-36-generic (x86_64)                       0.929619
= Note: Bluetooth subsystem version 2.22                               0.929621
= New Index: 00:00:00:00:00:00 (Primary,UART,hci1)              [hci1] 0.929622
= New Index: 48:5F:99:8E:E0:64 (Primary,USB,hci0)               [hci0] 0.929623
= Open Index: 00:00:00:00:00:00                                 [hci1] 1.443203
= Index Info: 00:00:00:00:00:00 (Nordic Semiconductor ASA)      [hci1] 1.443216
@ USER Open: main (privileged) version 2.22            {0x0001} [hci1] 1.443228
< HCI Command: Reset (0x03|0x0003) plen 0                    #1 [hci1] 1.444336
> HCI Event: Command Complete (0x0e) plen 4                  #2 [hci1] 1.444863
      Reset (0x03|0x0003) ncmd 1
        Status: Success (0x00)
< HCI Command: Read Local Supported... (0x04|0x0003) plen 0  #3 [hci1] 1.462996
> HCI Event: Command Complete (0x0e) plen 12                 #4 [hci1] 1.463539
      Read Local Supported Features (0x04|0x0003) ncmd 1
        Status: Success (0x00)
        Features: 0x00 0x00 0x00 0x00 0x60 0x00 0x00 0x00
          BR/EDR Not Supported
          LE Supported (Controller)
< HCI Command: Read Local Version In.. (0x04|0x0001) plen 0  #5 [hci1] 1.482704
> HCI Event: Command Complete (0x0e) plen 12                 #6 [hci1] 1.483155
      Read Local Version Information (0x04|0x0001) ncmd 1
        Status: Success (0x00)
        HCI version: Reserved (0x0f) - Revision 12393 (0x3069)
        LMP version: Reserved (0x0f) - Subversion 12393 (0x3069)
        Manufacturer: Nordic Semiconductor ASA (89)
< HCI Command: Read Local Supported... (0x04|0x0002) plen 0  #7 [hci1] 1.502739
> HCI Event: Command Complete (0x0e) plen 68                 #8 [hci1] 1.503787
      Read Local Supported Commands (0x04|0x0002) ncmd 1
        Status: Success (0x00)
        Commands: 119 entries
          Disconnect (Octet 0 - Bit 5)
          Read Remote Version Information (Octet 2 - Bit 7)
          Set Event Mask (Octet 5 - Bit 6)
          Reset (Octet 5 - Bit 7)
          Read Connection Accept Timeout (Octet 7 - Bit 2)
          Write Connection Accept Timeout (Octet 7 - Bit 3)
          Read Transmit Power Level (Octet 10 - Bit 2)
          Set Controller To Host Flow Control (Octet 10 - Bit 5)
          Host Buffer Size (Octet 10 - Bit 6)
          Host Number of Completed Packets (Octet 10 - Bit 7)
          Read Local Version Information (Octet 14 - Bit 3)
          Read Local Supported Features (Octet 14 - Bit 5)
          Read BD ADDR (Octet 15 - Bit 1)
          Read RSSI (Octet 15 - Bit 5)
          Set Event Mask Page 2 (Octet 22 - Bit 2)
          LE Set Event Mask (Octet 25 - Bit 0)
          LE Read Buffer Size (Octet 25 - Bit 1)
          LE Read Local Supported Features (Octet 25 - Bit 2)
          LE Set Random Address (Octet 25 - Bit 4)
          LE Set Advertising Parameters (Octet 25 - Bit 5)
          LE Read Advertising Channel TX Power (Octet 25 - Bit 6)
          LE Set Advertising Data (Octet 25 - Bit 7)
          LE Set Scan Response Data (Octet 26 - Bit 0)
          LE Set Advertise Enable (Octet 26 - Bit 1)
          LE Set Scan Parameters (Octet 26 - Bit 2)
          LE Set Scan Enable (Octet 26 - Bit 3)
          LE Create Connection (Octet 26 - Bit 4)
          LE Create Connection Cancel (Octet 26 - Bit 5)
          LE Read Accept List Size (Octet 26 - Bit 6)
          LE Clear Accept List (Octet 26 - Bit 7)
          LE Add Device To Accept List (Octet 27 - Bit 0)
          LE Remove Device From Accept List (Octet 27 - Bit 1)
          LE Connection Update (Octet 27 - Bit 2)
          LE Set Host Channel Classification (Octet 27 - Bit 3)
          LE Read Channel Map (Octet 27 - Bit 4)
          LE Read Remote Used Features (Octet 27 - Bit 5)
          LE Encrypt (Octet 27 - Bit 6)
          LE Rand (Octet 27 - Bit 7)
          LE Start Encryption (Octet 28 - Bit 0)
          LE Long Term Key Request Reply (Octet 28 - Bit 1)
          LE Long Term Key Request Neg Reply (Octet 28 - Bit 2)
          LE Read Supported States (Octet 28 - Bit 3)
          LE Receiver Test (Octet 28 - Bit 4)
          LE Transmitter Test (Octet 28 - Bit 5)
          LE Test End (Octet 28 - Bit 6)
          Read Authenticated Payload Timeout (Octet 32 - Bit 4)
          Write Authenticated Payload Timeout (Octet 32 - Bit 5)
          LE Set Data Length (Octet 33 - Bit 6)
          LE Read Suggested Default Data Length (Octet 33 - Bit 7)
          LE Write Suggested Default Data Length (Octet 34 - Bit 0)
          LE Add Device To Resolving List (Octet 34 - Bit 3)
          LE Remove Device From Resolving List (Octet 34 - Bit 4)
          LE Clear Resolving List (Octet 34 - Bit 5)
          LE Read Resolving List Size (Octet 34 - Bit 6)
          LE Set Address Resolution Enable (Octet 35 - Bit 1)
          LE Set Resolvable Private Address Timeout (Octet 35 - Bit 2)
          LE Read Maximum Data Length (Octet 35 - Bit 3)
          LE Read PHY (Octet 35 - Bit 4)
          LE Set Default PHY (Octet 35 - Bit 5)
          LE Set PHY (Octet 35 - Bit 6)
          LE Enhanced Receiver Test (Octet 35 - Bit 7)
          LE Enhanced Transmitter Test (Octet 36 - Bit 0)
          LE Set Advertising Set Random Address (Octet 36 - Bit 1)
          LE Set Extended Advertising Parameters (Octet 36 - Bit 2)
          LE Set Extended Advertising Data (Octet 36 - Bit 3)
          LE Set Extended Scan Response Data (Octet 36 - Bit 4)
          LE Set Extended Advertising Enable (Octet 36 - Bit 5)
          LE Read Maximum Advertising Data Length (Octet 36 - Bit 6)
          LE Read Number of Supported Advertising Sets (Octet 36 - Bit 7)
          LE Remove Advertising Set (Octet 37 - Bit 0)
          LE Clear Advertising Sets (Octet 37 - Bit 1)
          LE Set Periodic Advertising Parameters (Octet 37 - Bit 2)
          LE Set Periodic Advertising Data (Octet 37 - Bit 3)
          LE Set Periodic Advertising Enable (Octet 37 - Bit 4)
          LE Set Extended Scan Parameters (Octet 37 - Bit 5)
          LE Set Extended Scan Enable (Octet 37 - Bit 6)
          LE Extended Create Connection (Octet 37 - Bit 7)
          LE Periodic Advertising Create Sync (Octet 38 - Bit 0)
          LE Periodic Advertising Create Sync Cancel (Octet 38 - Bit 1)
          LE Periodic Advertising Terminate Sync (Octet 38 - Bit 2)
          LE Add Device To Periodic Advertiser List (Octet 38 - Bit 3)
          LE Remove Device From Periodic Advertiser List (Octet 38 - Bit 4)
          LE Clear Periodic Advertiser List (Octet 38 - Bit 5)
          LE Read Periodic Advertiser List Size (Octet 38 - Bit 6)
          LE Read Transmit Power (Octet 38 - Bit 7)
          LE Read RF Path Compensation (Octet 39 - Bit 0)
          LE Write RF Path Compensation (Octet 39 - Bit 1)
          LE Set Privacy Mode (Octet 39 - Bit 2)
          LE Periodic Advertising Receive Enable (Octet 40 - Bit 5)
          LE Periodic Advertising Sync Transfer (Octet 40 - Bit 6)
          LE Periodic Advertising Set Info Transfer (Octet 40 - Bit 7)
          LE Periodic Advertising Sync Transfer Parameters (Octet 41 - Bit 0)
          LE Set Default Periodic Advertisng Sync Transfer Parameters (Octet 41 - Bit 1)
          LE Read Buffer v2 (Octet 41 - Bit 5)
          LE Read ISO TX Sync (Octet 41 - Bit 6)
          LE Set Connected Isochronous Group Parameters (Octet 41 - Bit 7)
          LE Set Connected Isochronous Group Parameters Test (Octet 42 - Bit 0)
          LE Create Connected Isochronous Stream (Octet 42 - Bit 1)
          LE Remove Connected Isochronous Group (Octet 42 - Bit 2)
          LE Accept Connected Isochronous Stream Request (Octet 42 - Bit 3)
          LE Reject Connected Isochronous Stream Request (Octet 42 - Bit 4)
          LE Create Broadcast Isochronous Group (Octet 42 - Bit 5)
          LE Create Broadcast Isochronous Group Test (Octet 42 - Bit 6)
          LE Terminate Broadcast Isochronous Group (Octet 42 - Bit 7)
          LE Broadcast Isochronous Group Create Sync (Octet 43 - Bit 0)
          LE Broadcast Isochronous Group Terminate Sync (Octet 43 - Bit 1)
          LE Request Peer SCA (Octet 43 - Bit 2)
          LE Setup Isochronous Data Path (Octet 43 - Bit 3)
          LE Remove Isochronous Data Path (Octet 43 - Bit 4)
          LE Isochronous Transmit Test (Octet 43 - Bit 5)
          LE Isochronous Receive Test (Octet 43 - Bit 6)
          LE Isochronous Read Test Counters (Octet 43 - Bit 7)
          LE Isochronous Read Test Counters (Octet 44 - Bit 0)
          LE Set Host Feature (Octet 44 - Bit 1)
          Octet 44 - Bit 2 
          Octet 45 - Bit 6 
          Octet 46 - Bit 0 
          Octet 46 - Bit 1 
          Octet 46 - Bit 2 
< HCI Command: Host Buffer Size (0x03|0x0033) plen 7         #9 [hci1] 1.522760
        ACL MTU: 255  ACL max packet: 16
        SCO MTU: 0    SCO max packet: 0
> HCI Event: Command Complete (0x0e) plen 4                 #10 [hci1] 1.523292
      Host Buffer Size (0x03|0x0033) ncmd 1
        Status: Success (0x00)
< HCI Command: Set Controller To Ho.. (0x03|0x0031) plen 1  #11 [hci1] 1.542753
        Flow control: ACL Data Packets (0x01)
> HCI Event: Command Complete (0x0e) plen 4                 #12 [hci1] 1.543215
      Set Controller To Host Flow Control (0x03|0x0031) ncmd 1
        Status: Success (0x00)
< HCI Command: LE Read Local Suppor.. (0x08|0x0003) plen 0  #13 [hci1] 1.562747
> HCI Event: Command Complete (0x0e) plen 12                #14 [hci1] 1.563253
      LE Read Local Supported Features (0x08|0x0003) ncmd 1
        Status: Success (0x00)
        Features: 0xfd 0x79 0x00 0xf7 0x30 0x01 0x00 0x00
          LE Encryption
          Extended Reject Indication
          Peripheral-initiated Features Exchange
          LE Ping
          LE Data Packet Length Extension
          LL Privacy
          Extended Scanner Filter Policies
          LE 2M PHY
          LE Coded PHY
          LE Extended Advertising
          LE Periodic Advertising
          Channel Selection Algorithm #2
          Periodic Advertising Sync Transfer - Sender
          Periodic Advertising Sync Transfer - Recipient
          Sleep Clock Accuracy Updates
          Connected Isochronous Stream - Central
          Connected Isochronous Stream - Peripheral
          Isochronous Broadcaster
          Synchronized Receiver
          Periodic Advertising ADI support
          Connection Subrating
          Unknown features (0x0000010000000000)
< HCI Command: LE Set Host Feature (0x08|0x0074) plen 2     #15 [hci1] 1.582788
        Bit Number: 32
          Connected Isochronous Stream (Host Support)
        Bit Value: 1
> HCI Event: Command Complete (0x0e) plen 4                 #16 [hci1] 1.583271
      LE Set Host Feature (0x08|0x0074) ncmd 1
        Status: Success (0x00)
< HCI Command: LE Read Buffer v2 (0x08|0x0060) plen 0       #17 [hci1] 1.602763
> HCI Event: Command Complete (0x0e) plen 10                #18 [hci1] 1.603222
      LE Read Buffer v2 (0x08|0x0060) ncmd 1
        Status: Success (0x00)
        ACL MTU: 27
        ACL max packet: 3
        ISO MTU: 318
        ISO max packet: 3
< HCI Command: LE Read Maximum Adve.. (0x08|0x003a) plen 0  #19 [hci1] 1.622811
> HCI Event: Command Complete (0x0e) plen 6                 #20 [hci1] 1.623223
      LE Read Maximum Advertising Data Length (0x08|0x003a) ncmd 1
        Status: Success (0x00)
        Max length: 1650
< HCI Command: LE Read Supported St.. (0x08|0x001c) plen 0  #21 [hci1] 1.642752
> HCI Event: Command Complete (0x0e) plen 12                #22 [hci1] 1.643316
      LE Read Supported States (0x08|0x001c) ncmd 1
        Status: Success (0x00)
        States: 0x000003ff3e0306ff
          Non-connectable Advertising State
          Scannable Advertising State
          Connectable Advertising State
          High Duty Cycle Directed Advertising State
          Passive Scanning State
          Active Scanning State
          Initiating State
            and Connection State (Central Role)
          Connection State (Peripheral Role)
          Scannable Advertising State
            and Passive Scanning State
          Connectable Advertising State
            and Passive Scanning State
          Non-connectable Advertising State
            and Initiating State
          Scannable Advertising State
            and Initiating State
          Active Scanning State
            and Connection State (Central Role)
          Passive Scanning State
            and Connection State (Peripheral Role)
          Active Scanning State
            and Connection State (Peripheral Role)
          Initiating State
            and Connection State (Central Role)
            and Central Role & Central Role
          Low Duty Cycle Directed Advertising State
          Connectable Advertising State
            and Initiating State
            and Central Role & Peripheral Role
          High Duty Cycle Directed Advertising State
            and Initiating State
            and Central Role & Peripheral Role
          Low Duty Cycle Directed Advertising State
            and Initiating State
            and Central Role & Peripheral Role
          Connectable Advertising State
            and Connection State (Central Role)
            and Central Role & Peripheral Role
          High Duty Cycle Directed Advertising State
            and Connection State (Central Role)
            and Central Role & Peripheral Role
          Low Duty Cycle Directed Advertising State
            and Connection State (Central Role)
            and Central Role & Peripheral Role
          Connectable Advertising State
            and Connection State (Peripheral Role)
            and Central Role & Peripheral Role
          High Duty Cycle Directed Advertising State
            and Connection State (Peripheral Role)
            and Peripheral Role & Peripheral Role
          Low Duty Cycle Directed Advertising State
            and Connection State (Peripheral Role)
            and Peripheral Role & Peripheral Role
          Initiating State
            and Connection State (Peripheral Role)
            and Central Role & Peripheral Role
< HCI Command: LE Read Maximum Data.. (0x08|0x002f) plen 0  #23 [hci1] 1.662749
> HCI Event: Command Complete (0x0e) plen 12                #24 [hci1] 1.663202
      LE Read Maximum Data Length (0x08|0x002f) ncmd 1
        Status: Success (0x00)
        Max TX octets: 251
        Max TX time: 2704
        Max RX octets: 251
        Max RX time: 2704
< HCI Command: LE Write Suggested D.. (0x08|0x0024) plen 4  #25 [hci1] 1.682746
        TX octets: 251
        TX time: 2704
> HCI Event: Command Complete (0x0e) plen 4                 #26 [hci1] 1.683295
      LE Write Suggested Default Data Length (0x08|0x0024) ncmd 1
        Status: Success (0x00)
< HCI Command: LE Read Resolving Li.. (0x08|0x002a) plen 0  #27 [hci1] 1.702799
> HCI Event: Command Complete (0x0e) plen 5                 #28 [hci1] 1.703233
      LE Read Resolving List Size (0x08|0x002a) ncmd 1
        Status: Success (0x00)
        Size: 8
< HCI Command: LE Set Event Mask (0x08|0x0001) plen 8       #29 [hci1] 1.722790
        Mask: 0x000002023f87fa5e
          LE Advertising Report
          LE Connection Update Complete
          LE Read Remote Used Features Complete
          LE Long Term Key Request
          LE Data Length Change
          LE Enhanced Connection Complete
          LE PHY Update Complete
          LE Extended Advertising Report
          LE Periodic Advertising Sync Established
          LE Periodic Advertising Report
          LE Periodic Advertising Sync Lost
          LE Extended Scan Timeout
          LE Extended Advertising Set Terminated
          LE Scan Request Received
          LE Periodic Advertising Sync Transfer Rvc
          LE CIS Established
          LE CIS Request
          LE Create BIG Complete
          LE Terminate BIG Complete
          LE BIG Sync Estabilished Complete
          LE BIG Sync Lost
          LE BIG Info Advertising Report
          Unknown mask (0x0000020000000000)
> HCI Event: Command Complete (0x0e) plen 4                 #30 [hci1] 1.723289
      LE Set Event Mask (0x08|0x0001) ncmd 1
        Status: Success (0x00)
< HCI Command: Set Event Mask (0x03|0x0001) plen 8          #31 [hci1] 1.742779
        Mask: 0x2000800002008890
          Disconnection Complete
          Encryption Change
          Read Remote Version Information Complete
          Hardware Error
          Data Buffer Overflow
          Encryption Key Refresh Complete
          LE Meta
> HCI Event: Command Complete (0x0e) plen 4                 #32 [hci1] 1.743376
      Set Event Mask (0x03|0x0001) ncmd 1
        Status: Success (0x00)
< HCI Command: Read BD ADDR (0x04|0x0009) plen 0            #33 [hci1] 1.762754
> HCI Event: Command Complete (0x0e) plen 10                #34 [hci1] 1.763296
      Read BD ADDR (0x04|0x0009) ncmd 1
        Status: Success (0x00)
        Address: 00:00:00:00:00:00 (OUI 00-00-00)
< HCI Command: LE Set Random Address (0x08|0x0005) plen 6   #35 [hci1] 1.782762
        Address: D5:B6:CC:31:DB:3B (Static)
> HCI Event: Command Complete (0x0e) plen 4                 #36 [hci1] 1.783237
      LE Set Random Address (0x08|0x0005) ncmd 1
        Status: Success (0x00)
< HCI Command: LE Extended Create... (0x08|0x0043) plen 26  #37 [hci1] 3.993146
        Filter policy: Accept list is not used (0x00)
        Own address type: Random (0x01)
        Peer address type: Public (0x00)
        Peer address: DF:A9:FF:F6:B1:1A (OUI DF-A9-FF)
        Initiating PHYs: 0x01
        Entry 0: LE 1M
          Scan interval: 60.000 msec (0x0060)
          Scan window: 60.000 msec (0x0060)
          Min connection interval: 30.00 msec (0x0018)
          Max connection interval: 50.00 msec (0x0028)
          Connection latency: 0 (0x0000)
          Supervision timeout: 4000 msec (0x0190)
          Min connection length: 0.000 msec (0x0000)
          Max connection length: 0.000 msec (0x0000)
> HCI Event: Command Status (0x0f) plen 4                   #38 [hci1] 3.994028
      LE Extended Create Connection (0x08|0x0043) ncmd 1
        Status: Success (0x00)
> HCI Event: LE Meta Event (0x3e) plen 31                   #39 [hci1] 4.025404
      LE Enhanced Connection Complete (0x0a)
        Status: Success (0x00)
        Handle: 720
        Role: Central (0x00)
        Peer address type: Public (0x00)
        Peer address: DF:A9:FF:F6:B1:1A (OUI DF-A9-FF)
        Local resolvable private address: 00:00:00:00:00:00 (Non-Resolvable)
        Peer resolvable private address: 00:00:00:00:00:00 (Non-Resolvable)
        Connection interval: 50.00 msec (0x0028)
        Connection latency: 0 (0x0000)
        Supervision timeout: 4000 msec (0x0190)
        Central clock accuracy: 0x00
< HCI Command: LE Read Remote Used... (0x08|0x0016) plen 2  #40 [hci1] 4.042990
        Handle: 720 Address: DF:A9:FF:F6:B1:1A (OUI DF-A9-FF)
> HCI Event: Command Status (0x0f) plen 4                   #41 [hci1] 4.043389
      LE Read Remote Used Features (0x08|0x0016) ncmd 1
        Status: Success (0x00)
< HCI Command: LE Set PHY (0x08|0x0032) plen 7              #42 [hci1] 4.062779
        Handle: 720 Address: DF:A9:FF:F6:B1:1A (OUI DF-A9-FF)
        All PHYs preference: 0x00
        TX PHYs preference: 0x02
          LE 2M
        RX PHYs preference: 0x02
          LE 2M
        PHY options preference: Reserved (0x0000)
> HCI Event: Command Status (0x0f) plen 4                   #43 [hci1] 4.063260
      LE Set PHY (0x08|0x0032) ncmd 1
        Status: Success (0x00)
> HCI Event: LE Meta Event (0x3e) plen 12                   #44 [hci1] 4.177013
      LE Read Remote Used Features (0x04)
        Status: Success (0x00)
        Handle: 720 Address: DF:A9:FF:F6:B1:1A (OUI DF-A9-FF)
        Features: 0x2d 0x49 0x00 0xf7 0x67 0xd8 0x00 0x00
          LE Encryption
          Extended Reject Indication
          Peripheral-initiated Features Exchange
          LE Data Packet Length Extension
          LE 2M PHY
          LE Coded PHY
          Channel Selection Algorithm #2
          Periodic Advertising Sync Transfer - Sender
          Periodic Advertising Sync Transfer - Recipient
          Sleep Clock Accuracy Updates
          Connected Isochronous Stream - Central
          Connected Isochronous Stream - Peripheral
          Isochronous Broadcaster
          Synchronized Receiver
          Connected Isochronous Stream (Host Support)
          LE Power Control Request
          LE Power Control Request
          Connection Subrating
          Connection Subrating (Host Support)
          Unknown features (0x0000d80000000000)
> HCI Event: LE Meta Event (0x3e) plen 6                    #45 [hci1] 4.676265
      LE PHY Update Complete (0x0c)
        Status: Success (0x00)
        Handle: 720 Address: DF:A9:FF:F6:B1:1A (OUI DF-A9-FF)
        TX PHY: LE 2M (0x02)
        RX PHY: LE 2M (0x02)
< ACL Data TX: Handle 720 flags 0x00 dlen 11                #46 [hci1] 5.112869
      SMP: Pairing Request (0x01) len 6
        IO capability: DisplayOnly (0x00)
        OOB data: Authentication data not present (0x00)
        Authentication requirement: Bonding, No MITM, SC, No Keypresses (0x09)
        Max encryption key size: 16
        Initiator key distribution: EncKey (0x01)
        Responder key distribution: EncKey IdKey (0x03)
> HCI Event: Number of Completed Packets (0x13) plen 5      #47 [hci1] 5.126726
        Num handles: 1
        Handle: 720 Address: DF:A9:FF:F6:B1:1A (OUI DF-A9-FF)
        Count: 1
        #46: len 11 (6 Kb/s)
        Latency: 13 msec (13-13 msec ~13 msec)
> ACL Data RX: Handle 720 flags 0x02 dlen 11                #48 [hci1] 5.176780
      SMP: Pairing Response (0x02) len 6
        IO capability: KeyboardOnly (0x02)
        OOB data: Authentication data not present (0x00)
        Authentication requirement: No bonding, MITM, SC, No Keypresses (0x0c)
        Max encryption key size: 16
        Initiator key distribution: <none> (0x00)
        Responder key distribution: <none> (0x00)
< HCI Command: Host Number of Compl.. (0x03|0x0035) plen 5  #49 [hci1] 5.183123
        Num handles: 1
        Handle: 720 Address: DF:A9:FF:F6:B1:1A (OUI DF-A9-FF)
        Count: 1
< ACL Data TX: Handle 720 flags 0x00 dlen 27                #50 [hci1] 5.183262
< ACL Data TX: Handle 720 flags 0x01 dlen 27                #51 [hci1] 5.183273
< ACL Data TX: Handle 720 flags 0x01 dlen 15                #52 [hci1] 5.183294
      SMP: Pairing Public Key (0x0c) len 64
        X: 98308440221e2d910f0e54b71e7ec652857aa9b5a0dc65028824cc19db1226e9
        Y: 67a4816bcb62efb21701e31fdb27561a6217575fb007a8bbdabe7e28b6f68482
> HCI Event: Number of Completed Packets (0x13) plen 5      #53 [hci1] 5.226700
        Num handles: 1
        Handle: 720 Address: DF:A9:FF:F6:B1:1A (OUI DF-A9-FF)
        Count: 1
        #50: len 27 (5 Kb/s)
        Latency: 43 msec (13-43 msec ~28 msec)
> HCI Event: Number of Completed Packets (0x13) plen 5      #54 [hci1] 5.227261
        Num handles: 1
        Handle: 720 Address: DF:A9:FF:F6:B1:1A (OUI DF-A9-FF)
        Count: 1
        #51: len 27 (5 Kb/s)
        Latency: 43 msec (13-43 msec ~36 msec)
> HCI Event: Number of Completed Packets (0x13) plen 5      #55 [hci1] 5.227737
        Num handles: 1
        Handle: 720 Address: DF:A9:FF:F6:B1:1A (OUI DF-A9-FF)
        Count: 1
        #52: len 15 (2 Kb/s)
        Latency: 44 msec (13-44 msec ~40 msec)
> ACL Data RX: Handle 720 flags 0x02 dlen 27                #56 [hci1] 5.277170
> ACL Data RX: Handle 720 flags 0x01 dlen 27                #57 [hci1] 5.277401
> ACL Data RX: Handle 720 flags 0x01 dlen 15                #58 [hci1] 5.277842
      SMP: Pairing Public Key (0x0c) len 64
        X: 625a33aed19077025b908406645134a64c423ed99e2989c7599bc4425ca2e196
        Y: 9cd184da552b87bc604e7e06f6f9b77c1c058b458482a834f16a4d0bf14306f7
< HCI Command: Host Number of Compl.. (0x03|0x0035) plen 5  #59 [hci1] 5.282956
        Num handles: 1
        Handle: 720 Address: DF:A9:FF:F6:B1:1A (OUI DF-A9-FF)
        Count: 1
< HCI Command: Host Number of Compl.. (0x03|0x0035) plen 5  #60 [hci1] 5.283088
        Num handles: 1
        Handle: 720 Address: DF:A9:FF:F6:B1:1A (OUI DF-A9-FF)
        Count: 1
< HCI Command: Host Number of Compl.. (0x03|0x0035) plen 5  #61 [hci1] 5.283319
        Num handles: 1
        Handle: 720 Address: DF:A9:FF:F6:B1:1A (OUI DF-A9-FF)
        Count: 1
< ACL Data TX: Handle 720 flags 0x00 dlen 21                #62 [hci1] 5.283347
      SMP: Pairing Confirm (0x03) len 16
        Confim value: 9055de2212eaae9ccb2a41255e349838
> HCI Event: Number of Completed Packets (0x13) plen 5      #63 [hci1] 5.326761
        Num handles: 1
        Handle: 720 Address: DF:A9:FF:F6:B1:1A (OUI DF-A9-FF)
        Count: 1
        #62: len 21 (3 Kb/s)
        Latency: 43 msec (13-44 msec ~41 msec)
> ACL Data RX: Handle 720 flags 0x02 dlen 21                #64 [hci1] 6.176943
      SMP: Pairing Confirm (0x03) len 16
        Confim value: 097934b30d8f46dbe4245b8cdb0c6923
< HCI Command: Host Number of Compl.. (0x03|0x0035) plen 5  #65 [hci1] 6.183289
        Num handles: 1
        Handle: 720 Address: DF:A9:FF:F6:B1:1A (OUI DF-A9-FF)
        Count: 1
< ACL Data TX: Handle 720 flags 0x00 dlen 21                #66 [hci1] 6.183465
      SMP: Pairing Random (0x04) len 16
        Random value: 8e6108f966a694cbe26df70bb96773e6
> HCI Event: Number of Completed Packets (0x13) plen 5      #67 [hci1] 6.226881
        Num handles: 1
        Handle: 720 Address: DF:A9:FF:F6:B1:1A (OUI DF-A9-FF)
        Count: 1
        #66: len 21 (3 Kb/s)
        Latency: 43 msec (13-44 msec ~42 msec)
> ACL Data RX: Handle 720 flags 0x02 dlen 21                #68 [hci1] 6.476881
      SMP: Pairing Random (0x04) len 16
        Random value: c64890c5bf94e5ef210ed7c7fd9596a3
< HCI Command: Host Number of Compl.. (0x03|0x0035) plen 5  #69 [hci1] 6.483613
        Num handles: 1
        Handle: 720 Address: DF:A9:FF:F6:B1:1A (OUI DF-A9-FF)
        Count: 1
< ACL Data TX: Handle 720 flags 0x00 dlen 21                #70 [hci1] 6.483923
      SMP: Pairing Confirm (0x03) len 16
        Confim value: eb6e879a7df98d9a924b789be26279f2
> HCI Event: Number of Completed Packets (0x13) plen 5      #71 [hci1] 6.526752
        Num handles: 1
        Handle: 720 Address: DF:A9:FF:F6:B1:1A (OUI DF-A9-FF)
        Count: 1
        #70: len 21 (4 Kb/s)
        Latency: 42 msec (13-44 msec ~42 msec)
> ACL Data RX: Handle 720 flags 0x02 dlen 21                #72 [hci1] 6.576944
      SMP: Pairing Confirm (0x03) len 16
        Confim value: 651514a71a3480b841c5899482a9a624
< HCI Command: Host Number of Compl.. (0x03|0x0035) plen 5  #73 [hci1] 6.582952
        Num handles: 1
        Handle: 720 Address: DF:A9:FF:F6:B1:1A (OUI DF-A9-FF)
        Count: 1
< ACL Data TX: Handle 720 flags 0x00 dlen 21                #74 [hci1] 6.583099
      SMP: Pairing Random (0x04) len 16
        Random value: 4d02679f89a05211af56d8b3da64d21e
> HCI Event: Number of Completed Packets (0x13) plen 5      #75 [hci1] 6.626824
        Num handles: 1
        Handle: 720 Address: DF:A9:FF:F6:B1:1A (OUI DF-A9-FF)
        Count: 1
        #74: len 21 (3 Kb/s)
        Latency: 43 msec (13-44 msec ~43 msec)
> ACL Data RX: Handle 720 flags 0x02 dlen 21                #76 [hci1] 6.876948
      SMP: Pairing Random (0x04) len 16
        Random value: 9bba82fb647675aee7ae57b617a3e08d
< HCI Command: Host Number of Compl.. (0x03|0x0035) plen 5  #77 [hci1] 6.882910
        Num handles: 1
        Handle: 720 Address: DF:A9:FF:F6:B1:1A (OUI DF-A9-FF)
        Count: 1
< ACL Data TX: Handle 720 flags 0x00 dlen 21                #78 [hci1] 6.883004
      SMP: Pairing Confirm (0x03) len 16
        Confim value: fbee3af7ce4160fa42a6d21f064dcb65
> HCI Event: Number of Completed Packets (0x13) plen 5      #79 [hci1] 6.926822
        Num handles: 1
        Handle: 720 Address: DF:A9:FF:F6:B1:1A (OUI DF-A9-FF)
        Count: 1
        #78: len 21 (3 Kb/s)
        Latency: 43 msec (13-44 msec ~43 msec)
> ACL Data RX: Handle 720 flags 0x02 dlen 21                #80 [hci1] 6.977076
      SMP: Pairing Confirm (0x03) len 16
        Confim value: 4bfc6b2a80daed46ffe7e67aaae8149d
< HCI Command: Host Number of Compl.. (0x03|0x0035) plen 5  #81 [hci1] 6.983268
        Num handles: 1
        Handle: 720 Address: DF:A9:FF:F6:B1:1A (OUI DF-A9-FF)
        Count: 1
< ACL Data TX: Handle 720 flags 0x00 dlen 21                #82 [hci1] 6.983524
      SMP: Pairing Random (0x04) len 16
        Random value: 5e8286bc235a02440d0c3424a2acf8fd
> HCI Event: Number of Completed Packets (0x13) plen 5      #83 [hci1] 7.026714
        Num handles: 1
        Handle: 720 Address: DF:A9:FF:F6:B1:1A (OUI DF-A9-FF)
        Count: 1
        #82: len 21 (3 Kb/s)
        Latency: 43 msec (13-44 msec ~43 msec)
> ACL Data RX: Handle 720 flags 0x02 dlen 21                #84 [hci1] 7.276887
      SMP: Pairing Random (0x04) len 16
        Random value: c815ebe4bd766bd1d0489e3c99e88788
< HCI Command: Host Number of Compl.. (0x03|0x0035) plen 5  #85 [hci1] 7.283402
        Num handles: 1
        Handle: 720 Address: DF:A9:FF:F6:B1:1A (OUI DF-A9-FF)
        Count: 1
< ACL Data TX: Handle 720 flags 0x00 dlen 21                #86 [hci1] 7.283652
      SMP: Pairing Confirm (0x03) len 16
        Confim value: e1edba28087f1b25ffbfa28bfcb0c9ad
> HCI Event: Number of Completed Packets (0x13) plen 5      #87 [hci1] 7.326711
        Num handles: 1
        Handle: 720 Address: DF:A9:FF:F6:B1:1A (OUI DF-A9-FF)
        Count: 1
        #86: len 21 (3 Kb/s)
        Latency: 43 msec (13-44 msec ~43 msec)
> ACL Data RX: Handle 720 flags 0x02 dlen 21                #88 [hci1] 7.377023
      SMP: Pairing Confirm (0x03) len 16
        Confim value: 16dbf4ea64e99296deb84392c5b5f3d6
< HCI Command: Host Number of Compl.. (0x03|0x0035) plen 5  #89 [hci1] 7.383011
        Num handles: 1
        Handle: 720 Address: DF:A9:FF:F6:B1:1A (OUI DF-A9-FF)
        Count: 1
< ACL Data TX: Handle 720 flags 0x00 dlen 21                #90 [hci1] 7.383159
      SMP: Pairing Random (0x04) len 16
        Random value: 5c4a1bcadd27bd58e945097b00bad7ac
> HCI Event: Number of Completed Packets (0x13) plen 5      #91 [hci1] 7.426705
        Num handles: 1
        Handle: 720 Address: DF:A9:FF:F6:B1:1A (OUI DF-A9-FF)
        Count: 1
        #90: len 21 (3 Kb/s)
        Latency: 43 msec (13-44 msec ~43 msec)
> ACL Data RX: Handle 720 flags 0x02 dlen 21                #92 [hci1] 7.677009
      SMP: Pairing Random (0x04) len 16
        Random value: a7e59de45411482d9747dda06cc26c48
< HCI Command: Host Number of Compl.. (0x03|0x0035) plen 5  #93 [hci1] 7.683033
        Num handles: 1
        Handle: 720 Address: DF:A9:FF:F6:B1:1A (OUI DF-A9-FF)
        Count: 1
< ACL Data TX: Handle 720 flags 0x00 dlen 21                #94 [hci1] 7.683169
      SMP: Pairing Confirm (0x03) len 16
        Confim value: 2dfeb6282e45e6abf7b126bf9ec63565
> HCI Event: Number of Completed Packets (0x13) plen 5      #95 [hci1] 7.726698
        Num handles: 1
        Handle: 720 Address: DF:A9:FF:F6:B1:1A (OUI DF-A9-FF)
        Count: 1
        #94: len 21 (3 Kb/s)
        Latency: 43 msec (13-44 msec ~43 msec)
> ACL Data RX: Handle 720 flags 0x02 dlen 21                #96 [hci1] 7.776924
      SMP: Pairing Confirm (0x03) len 16
        Confim value: ee2e55ce1a2b9147f52b47124b9bc3ba
< HCI Command: Host Number of Compl.. (0x03|0x0035) plen 5  #97 [hci1] 7.783249
        Num handles: 1
        Handle: 720 Address: DF:A9:FF:F6:B1:1A (OUI DF-A9-FF)
        Count: 1
< ACL Data TX: Handle 720 flags 0x00 dlen 21                #98 [hci1] 7.783534
      SMP: Pairing Random (0x04) len 16
        Random value: 32527e6e64e79f33b2e374394db8ab2d
> HCI Event: Number of Completed Packets (0x13) plen 5      #99 [hci1] 7.826649
        Num handles: 1
        Handle: 720 Address: DF:A9:FF:F6:B1:1A (OUI DF-A9-FF)
        Count: 1
        #98: len 21 (3 Kb/s)
        Latency: 43 msec (13-44 msec ~43 msec)
> ACL Data RX: Handle 720 flags 0x02 dlen 21               #100 [hci1] 8.076962
      SMP: Pairing Random (0x04) len 16
        Random value: d1f6a9a1f105cdd6345a8666b8ceb1c4
< HCI Command: Host Number of Comp.. (0x03|0x0035) plen 5  #101 [hci1] 8.083403
        Num handles: 1
        Handle: 720 Address: DF:A9:FF:F6:B1:1A (OUI DF-A9-FF)
        Count: 1
< ACL Data TX: Handle 720 flags 0x00 dlen 21               #102 [hci1] 8.083576
      SMP: Pairing Confirm (0x03) len 16
        Confim value: c51169803ef3d305e7d49e0b6b6c4c4b
> HCI Event: Number of Completed Packets (0x13) plen 5     #103 [hci1] 8.126734
        Num handles: 1
        Handle: 720 Address: DF:A9:FF:F6:B1:1A (OUI DF-A9-FF)
        Count: 1
        #102: len 21 (3 Kb/s)
        Latency: 43 msec (13-44 msec ~43 msec)
> ACL Data RX: Handle 720 flags 0x02 dlen 21               #104 [hci1] 8.176912
      SMP: Pairing Confirm (0x03) len 16
        Confim value: bf9df4e8ee7ba345cd5fdbe6e4d298c4
< HCI Command: Host Number of Comp.. (0x03|0x0035) plen 5  #105 [hci1] 8.183215
        Num handles: 1
        Handle: 720 Address: DF:A9:FF:F6:B1:1A (OUI DF-A9-FF)
        Count: 1
< ACL Data TX: Handle 720 flags 0x00 dlen 21               #106 [hci1] 8.183380
      SMP: Pairing Random (0x04) len 16
        Random value: dddbdfe2838e9a8cc6964353c850fef7
> HCI Event: Number of Completed Packets (0x13) plen 5     #107 [hci1] 8.226720
        Num handles: 1
        Handle: 720 Address: DF:A9:FF:F6:B1:1A (OUI DF-A9-FF)
        Count: 1
        #106: len 21 (3 Kb/s)
        Latency: 43 msec (13-44 msec ~43 msec)
> ACL Data RX: Handle 720 flags 0x02 dlen 21               #108 [hci1] 8.476900
      SMP: Pairing Random (0x04) len 16
        Random value: 1e5661009d4ffb21e16d4a53e8e9b62f
< HCI Command: Host Number of Comp.. (0x03|0x0035) plen 5  #109 [hci1] 8.483347
        Num handles: 1
        Handle: 720 Address: DF:A9:FF:F6:B1:1A (OUI DF-A9-FF)
        Count: 1
< ACL Data TX: Handle 720 flags 0x00 dlen 21               #110 [hci1] 8.483546
      SMP: Pairing Confirm (0x03) len 16
        Confim value: a0289cd4abc530328a20b6efaab3055d
> HCI Event: Number of Completed Packets (0x13) plen 5     #111 [hci1] 8.526679
        Num handles: 1
        Handle: 720 Address: DF:A9:FF:F6:B1:1A (OUI DF-A9-FF)
        Count: 1
        #110: len 21 (3 Kb/s)
        Latency: 43 msec (13-44 msec ~43 msec)
> ACL Data RX: Handle 720 flags 0x02 dlen 21               #112 [hci1] 8.577111
      SMP: Pairing Confirm (0x03) len 16
        Confim value: 2c1d8de4ee8cf191e244c912b33dd521
< HCI Command: Host Number of Comp.. (0x03|0x0035) plen 5  #113 [hci1] 8.583298
        Num handles: 1
        Handle: 720 Address: DF:A9:FF:F6:B1:1A (OUI DF-A9-FF)
        Count: 1
< ACL Data TX: Handle 720 flags 0x00 dlen 21               #114 [hci1] 8.583405
      SMP: Pairing Random (0x04) len 16
        Random value: eb9f1915536596b6fc3db1c86b2b1970
> HCI Event: Number of Completed Packets (0x13) plen 5     #115 [hci1] 8.626785
        Num handles: 1
        Handle: 720 Address: DF:A9:FF:F6:B1:1A (OUI DF-A9-FF)
        Count: 1
        #114: len 21 (3 Kb/s)
        Latency: 43 msec (13-44 msec ~43 msec)
> ACL Data RX: Handle 720 flags 0x02 dlen 21               #116 [hci1] 8.876910
      SMP: Pairing Random (0x04) len 16
        Random value: a8525425a22b12a415ad196da4301d00
< HCI Command: Host Number of Comp.. (0x03|0x0035) plen 5  #117 [hci1] 8.883107
        Num handles: 1
        Handle: 720 Address: DF:A9:FF:F6:B1:1A (OUI DF-A9-FF)
        Count: 1
< ACL Data TX: Handle 720 flags 0x00 dlen 21               #118 [hci1] 8.883164
      SMP: Pairing Confirm (0x03) len 16
        Confim value: e57f4328d7b80c6a4c5b67a520fa73bb
> HCI Event: Number of Completed Packets (0x13) plen 5     #119 [hci1] 8.926691
        Num handles: 1
        Handle: 720 Address: DF:A9:FF:F6:B1:1A (OUI DF-A9-FF)
        Count: 1
        #118: len 21 (3 Kb/s)
        Latency: 43 msec (13-44 msec ~43 msec)
> ACL Data RX: Handle 720 flags 0x02 dlen 21               #120 [hci1] 8.976942
      SMP: Pairing Confirm (0x03) len 16
        Confim value: 63f1ac9398022aab38ce4d51bfe74a7c
< HCI Command: Host Number of Comp.. (0x03|0x0035) plen 5  #121 [hci1] 8.983038
        Num handles: 1
        Handle: 720 Address: DF:A9:FF:F6:B1:1A (OUI DF-A9-FF)
        Count: 1
< ACL Data TX: Handle 720 flags 0x00 dlen 21               #122 [hci1] 8.983080
      SMP: Pairing Random (0x04) len 16
        Random value: 5c794dc9ad9f2c3f295ebd5ad5e1c3cf
> HCI Event: Number of Completed Packets (0x13) plen 5     #123 [hci1] 9.026648
        Num handles: 1
        Handle: 720 Address: DF:A9:FF:F6:B1:1A (OUI DF-A9-FF)
        Count: 1
        #122: len 21 (3 Kb/s)
        Latency: 43 msec (13-44 msec ~43 msec)
> ACL Data RX: Handle 720 flags 0x02 dlen 21               #124 [hci1] 9.276866
      SMP: Pairing Random (0x04) len 16
        Random value: c8765576891794338b8725f7d401c5ea
< HCI Command: Host Number of Comp.. (0x03|0x0035) plen 5  #125 [hci1] 9.283514
        Num handles: 1
        Handle: 720 Address: DF:A9:FF:F6:B1:1A (OUI DF-A9-FF)
        Count: 1
< ACL Data TX: Handle 720 flags 0x00 dlen 21               #126 [hci1] 9.283689
      SMP: Pairing Confirm (0x03) len 16
        Confim value: 9c669ff11aa649207a9d2c11472c7c85
> HCI Event: Number of Completed Packets (0x13) plen 5     #127 [hci1] 9.326664
        Num handles: 1
        Handle: 720 Address: DF:A9:FF:F6:B1:1A (OUI DF-A9-FF)
        Count: 1
        #126: len 21 (4 Kb/s)
        Latency: 42 msec (13-44 msec ~43 msec)
> ACL Data RX: Handle 720 flags 0x02 dlen 21               #128 [hci1] 9.376979
      SMP: Pairing Confirm (0x03) len 16
        Confim value: f40f5835ab7277b1ca218b6404f9ba95
< HCI Command: Host Number of Comp.. (0x03|0x0035) plen 5  #129 [hci1] 9.383338
        Num handles: 1
        Handle: 720 Address: DF:A9:FF:F6:B1:1A (OUI DF-A9-FF)
        Count: 1
< ACL Data TX: Handle 720 flags 0x00 dlen 21               #130 [hci1] 9.383567
      SMP: Pairing Random (0x04) len 16
        Random value: 5c2fff312cdf99c9491988e877355a9a
> HCI Event: Number of Completed Packets (0x13) plen 5     #131 [hci1] 9.426715
        Num handles: 1
        Handle: 720 Address: DF:A9:FF:F6:B1:1A (OUI DF-A9-FF)
        Count: 1
        #130: len 21 (3 Kb/s)
        Latency: 43 msec (13-44 msec ~43 msec)
> ACL Data RX: Handle 720 flags 0x02 dlen 21               #132 [hci1] 9.676963
      SMP: Pairing Random (0x04) len 16
        Random value: 169073971acf42e33ba9df78a3f7d1e3
< HCI Command: Host Number of Comp.. (0x03|0x0035) plen 5  #133 [hci1] 9.683465
        Num handles: 1
        Handle: 720 Address: DF:A9:FF:F6:B1:1A (OUI DF-A9-FF)
        Count: 1
< ACL Data TX: Handle 720 flags 0x00 dlen 21               #134 [hci1] 9.683712
      SMP: Pairing Confirm (0x03) len 16
        Confim value: 905593b94d72d173ba4845f1ff0d4c74
> HCI Event: Number of Completed Packets (0x13) plen 5     #135 [hci1] 9.726640
        Num handles: 1
        Handle: 720 Address: DF:A9:FF:F6:B1:1A (OUI DF-A9-FF)
        Count: 1
        #134: len 21 (4 Kb/s)
        Latency: 42 msec (13-44 msec ~43 msec)
> ACL Data RX: Handle 720 flags 0x02 dlen 21               #136 [hci1] 9.776943
      SMP: Pairing Confirm (0x03) len 16
        Confim value: c7049c27b795ff86020a207d2b48f07e
< HCI Command: Host Number of Comp.. (0x03|0x0035) plen 5  #137 [hci1] 9.783284
        Num handles: 1
        Handle: 720 Address: DF:A9:FF:F6:B1:1A (OUI DF-A9-FF)
        Count: 1
< ACL Data TX: Handle 720 flags 0x00 dlen 21               #138 [hci1] 9.783481
      SMP: Pairing Random (0x04) len 16
        Random value: c629a3a987d808e808655d558dfc1155
> HCI Event: Number of Completed Packets (0x13) plen 5     #139 [hci1] 9.826674
        Num handles: 1
        Handle: 720 Address: DF:A9:FF:F6:B1:1A (OUI DF-A9-FF)
        Count: 1
        #138: len 21 (3 Kb/s)
        Latency: 43 msec (13-44 msec ~43 msec)
> ACL Data RX: Handle 720 flags 0x02 dlen 21              #140 [hci1] 10.076975
      SMP: Pairing Random (0x04) len 16
        Random value: 6cad016f5e501d0a5efff7b378f0a220
< HCI Command: Host Number of Com.. (0x03|0x0035) plen 5  #141 [hci1] 10.083283
        Num handles: 1
        Handle: 720 Address: DF:A9:FF:F6:B1:1A (OUI DF-A9-FF)
        Count: 1
< ACL Data TX: Handle 720 flags 0x00 dlen 21              #142 [hci1] 10.083436
      SMP: Pairing Confirm (0x03) len 16
        Confim value: ea7b4c34fd73ed771d0caeebff005e44
> HCI Event: Number of Completed Packets (0x13) plen 5    #143 [hci1] 10.126660
        Num handles: 1
        Handle: 720 Address: DF:A9:FF:F6:B1:1A (OUI DF-A9-FF)
        Count: 1
        #142: len 21 (3 Kb/s)
        Latency: 43 msec (13-44 msec ~43 msec)
> ACL Data RX: Handle 720 flags 0x02 dlen 21              #144 [hci1] 10.176967
      SMP: Pairing Confirm (0x03) len 16
        Confim value: 947e7687565b836f198ca63899d7eb73
< HCI Command: Host Number of Com.. (0x03|0x0035) plen 5  #145 [hci1] 10.183303
        Num handles: 1
        Handle: 720 Address: DF:A9:FF:F6:B1:1A (OUI DF-A9-FF)
        Count: 1
< ACL Data TX: Handle 720 flags 0x00 dlen 21              #146 [hci1] 10.183560
      SMP: Pairing Random (0x04) len 16
        Random value: 92f20f6ad8f13724432c7fd6001c45ff
> HCI Event: Number of Completed Packets (0x13) plen 5    #147 [hci1] 10.226659
        Num handles: 1
        Handle: 720 Address: DF:A9:FF:F6:B1:1A (OUI DF-A9-FF)
        Count: 1
        #146: len 21 (3 Kb/s)
        Latency: 43 msec (13-44 msec ~43 msec)
> ACL Data RX: Handle 720 flags 0x02 dlen 21              #148 [hci1] 10.476962
      SMP: Pairing Random (0x04) len 16
        Random value: e31a8f209fd9663c6eb65faffe09d716
< HCI Command: Host Number of Com.. (0x03|0x0035) plen 5  #149 [hci1] 10.483328
        Num handles: 1
        Handle: 720 Address: DF:A9:FF:F6:B1:1A (OUI DF-A9-FF)
        Count: 1
< ACL Data TX: Handle 720 flags 0x00 dlen 21              #150 [hci1] 10.483511
      SMP: Pairing Confirm (0x03) len 16
        Confim value: 4be88cd3582478e32e7aa5540764a104
> HCI Event: Number of Completed Packets (0x13) plen 5    #151 [hci1] 10.526721
        Num handles: 1
        Handle: 720 Address: DF:A9:FF:F6:B1:1A (OUI DF-A9-FF)
        Count: 1
        #150: len 21 (3 Kb/s)
        Latency: 43 msec (13-44 msec ~43 msec)
> ACL Data RX: Handle 720 flags 0x02 dlen 21              #152 [hci1] 10.576989
      SMP: Pairing Confirm (0x03) len 16
        Confim value: ab072c194f9d983a2ba701aa8763bcb6
< HCI Command: Host Number of Com.. (0x03|0x0035) plen 5  #153 [hci1] 10.583164
        Num handles: 1
        Handle: 720 Address: DF:A9:FF:F6:B1:1A (OUI DF-A9-FF)
        Count: 1
< ACL Data TX: Handle 720 flags 0x00 dlen 21              #154 [hci1] 10.583336
      SMP: Pairing Random (0x04) len 16
        Random value: 23ac32ebbb5e14c8a6b9622f296d277f
> HCI Event: Number of Completed Packets (0x13) plen 5    #155 [hci1] 10.626632
        Num handles: 1
        Handle: 720 Address: DF:A9:FF:F6:B1:1A (OUI DF-A9-FF)
        Count: 1
        #154: len 21 (3 Kb/s)
        Latency: 43 msec (13-44 msec ~43 msec)
> ACL Data RX: Handle 720 flags 0x02 dlen 21              #156 [hci1] 10.876791
      SMP: Pairing Random (0x04) len 16
        Random value: d464ee1265e49d4f223c47b01ca05379
< HCI Command: Host Number of Com.. (0x03|0x0035) plen 5  #157 [hci1] 10.883101
        Num handles: 1
        Handle: 720 Address: DF:A9:FF:F6:B1:1A (OUI DF-A9-FF)
        Count: 1
< ACL Data TX: Handle 720 flags 0x00 dlen 21              #158 [hci1] 10.883167
      SMP: Pairing Confirm (0x03) len 16
        Confim value: 46f5bc3453b3eb7040dd7884506b45bc
> HCI Event: Number of Completed Packets (0x13) plen 5    #159 [hci1] 10.926723
        Num handles: 1
        Handle: 720 Address: DF:A9:FF:F6:B1:1A (OUI DF-A9-FF)
        Count: 1
        #158: len 21 (3 Kb/s)
        Latency: 43 msec (13-44 msec ~43 msec)
> ACL Data RX: Handle 720 flags 0x02 dlen 21              #160 [hci1] 10.976824
      SMP: Pairing Confirm (0x03) len 16
        Confim value: 95e0a28abe48ed9459c25524c28db5f9
< HCI Command: Host Number of Com.. (0x03|0x0035) plen 5  #161 [hci1] 10.982939
        Num handles: 1
        Handle: 720 Address: DF:A9:FF:F6:B1:1A (OUI DF-A9-FF)
        Count: 1
< ACL Data TX: Handle 720 flags 0x00 dlen 21              #162 [hci1] 10.983032
      SMP: Pairing Random (0x04) len 16
        Random value: 297efe85e67448a15f56bd27e3a3cf1d
> HCI Event: Number of Completed Packets (0x13) plen 5    #163 [hci1] 11.026628
        Num handles: 1
        Handle: 720 Address: DF:A9:FF:F6:B1:1A (OUI DF-A9-FF)
        Count: 1
        #162: len 21 (3 Kb/s)
        Latency: 43 msec (13-44 msec ~43 msec)
> ACL Data RX: Handle 720 flags 0x02 dlen 21              #164 [hci1] 11.276917
      SMP: Pairing Random (0x04) len 16
        Random value: d7572fe87a308556753d213bfd503740
< HCI Command: Host Number of Com.. (0x03|0x0035) plen 5  #165 [hci1] 11.283465
        Num handles: 1
        Handle: 720 Address: DF:A9:FF:F6:B1:1A (OUI DF-A9-FF)
        Count: 1
< ACL Data TX: Handle 720 flags 0x00 dlen 21              #166 [hci1] 11.283761
      SMP: Pairing Confirm (0x03) len 16
        Confim value: 3e131587ef2284c764c292d8b4b7862c
> HCI Event: Number of Completed Packets (0x13) plen 5    #167 [hci1] 11.326588
        Num handles: 1
        Handle: 720 Address: DF:A9:FF:F6:B1:1A (OUI DF-A9-FF)
        Count: 1
        #166: len 21 (4 Kb/s)
        Latency: 42 msec (13-44 msec ~43 msec)
> ACL Data RX: Handle 720 flags 0x02 dlen 21              #168 [hci1] 11.376767
      SMP: Pairing Confirm (0x03) len 16
        Confim value: 7b37506cdb851be56b9db8a29f368863
< HCI Command: Host Number of Com.. (0x03|0x0035) plen 5  #169 [hci1] 11.383412
        Num handles: 1
        Handle: 720 Address: DF:A9:FF:F6:B1:1A (OUI DF-A9-FF)
        Count: 1
< ACL Data TX: Handle 720 flags 0x00 dlen 21              #170 [hci1] 11.383625
      SMP: Pairing Random (0x04) len 16
        Random value: 25a9493fd3ce4faf02be7293595bb7c6
> HCI Event: Number of Completed Packets (0x13) plen 5    #171 [hci1] 11.426608
        Num handles: 1
        Handle: 720 Address: DF:A9:FF:F6:B1:1A (OUI DF-A9-FF)
        Count: 1
        #170: len 21 (4 Kb/s)
        Latency: 42 msec (13-44 msec ~43 msec)
> ACL Data RX: Handle 720 flags 0x02 dlen 21              #172 [hci1] 11.676882
      SMP: Pairing Random (0x04) len 16
        Random value: c601a388e6ba1da99fa69d1608f7e29f
< HCI Command: Host Number of Com.. (0x03|0x0035) plen 5  #173 [hci1] 11.683519
        Num handles: 1
        Handle: 720 Address: DF:A9:FF:F6:B1:1A (OUI DF-A9-FF)
        Count: 1
< ACL Data TX: Handle 720 flags 0x00 dlen 21              #174 [hci1] 11.683748
      SMP: Pairing Confirm (0x03) len 16
        Confim value: bb89afc010d402c9acc047abf8b253c9
> HCI Event: Number of Completed Packets (0x13) plen 5    #175 [hci1] 11.726634
        Num handles: 1
        Handle: 720 Address: DF:A9:FF:F6:B1:1A (OUI DF-A9-FF)
        Count: 1
        #174: len 21 (4 Kb/s)
        Latency: 42 msec (13-44 msec ~42 msec)
> ACL Data RX: Handle 720 flags 0x02 dlen 21              #176 [hci1] 11.776781
      SMP: Pairing Confirm (0x03) len 16
        Confim value: 4161ec1bff3111f51c8096bde3ff4109
< HCI Command: Host Number of Com.. (0x03|0x0035) plen 5  #177 [hci1] 11.783315
        Num handles: 1
        Handle: 720 Address: DF:A9:FF:F6:B1:1A (OUI DF-A9-FF)
        Count: 1
< ACL Data TX: Handle 720 flags 0x00 dlen 21              #178 [hci1] 11.783550
      SMP: Pairing Random (0x04) len 16
        Random value: 58f6b41f855a6f6c3560debd84e2affc
> HCI Event: Number of Completed Packets (0x13) plen 5    #179 [hci1] 11.826684
        Num handles: 1
        Handle: 720 Address: DF:A9:FF:F6:B1:1A (OUI DF-A9-FF)
        Count: 1
        #178: len 21 (3 Kb/s)
        Latency: 43 msec (13-44 msec ~43 msec)
> ACL Data RX: Handle 720 flags 0x02 dlen 21              #180 [hci1] 12.076867
      SMP: Pairing Random (0x04) len 16
        Random value: b9afdb16f3bea7db19a4ad44e7b3f70a
< HCI Command: Host Number of Com.. (0x03|0x0035) plen 5  #181 [hci1] 12.083073
        Num handles: 1
        Handle: 720 Address: DF:A9:FF:F6:B1:1A (OUI DF-A9-FF)
        Count: 1
< ACL Data TX: Handle 720 flags 0x00 dlen 21              #182 [hci1] 12.083085
      SMP: Pairing Confirm (0x03) len 16
        Confim value: 938373a2d85060768a419e746bc2010b
> HCI Event: Number of Completed Packets (0x13) plen 5    #183 [hci1] 12.126573
        Num handles: 1
        Handle: 720 Address: DF:A9:FF:F6:B1:1A (OUI DF-A9-FF)
        Count: 1
        #182: len 21 (3 Kb/s)
        Latency: 43 msec (13-44 msec ~43 msec)
> ACL Data RX: Handle 720 flags 0x02 dlen 21              #184 [hci1] 12.176852
      SMP: Pairing Confirm (0x03) len 16
        Confim value: 42b53408e89d797d5ff5b68f9219232c
< HCI Command: Host Number of Com.. (0x03|0x0035) plen 5  #185 [hci1] 12.183318
        Num handles: 1
        Handle: 720 Address: DF:A9:FF:F6:B1:1A (OUI DF-A9-FF)
        Count: 1
< ACL Data TX: Handle 720 flags 0x00 dlen 21              #186 [hci1] 12.183341
      SMP: Pairing Random (0x04) len 16
        Random value: b67e7216d5bf664139eda2b542549666
> HCI Event: Number of Completed Packets (0x13) plen 5    #187 [hci1] 12.226690
        Num handles: 1
        Handle: 720 Address: DF:A9:FF:F6:B1:1A (OUI DF-A9-FF)
        Count: 1
        #186: len 21 (3 Kb/s)
        Latency: 43 msec (13-44 msec ~43 msec)
> ACL Data RX: Handle 720 flags 0x02 dlen 21              #188 [hci1] 12.476771
      SMP: Pairing Random (0x04) len 16
        Random value: 0beea8f829baa4c19ca5810c83df5637
< HCI Command: Host Number of Com.. (0x03|0x0035) plen 5  #189 [hci1] 12.483022
        Num handles: 1
        Handle: 720 Address: DF:A9:FF:F6:B1:1A (OUI DF-A9-FF)
        Count: 1
< ACL Data TX: Handle 720 flags 0x00 dlen 21              #190 [hci1] 12.483100
      SMP: Pairing Confirm (0x03) len 16
        Confim value: 745f2dbaac0debafa820779c81abf9f9
> HCI Event: Number of Completed Packets (0x13) plen 5    #191 [hci1] 12.526650
        Num handles: 1
        Handle: 720 Address: DF:A9:FF:F6:B1:1A (OUI DF-A9-FF)
        Count: 1
        #190: len 21 (3 Kb/s)
        Latency: 43 msec (13-44 msec ~43 msec)
> ACL Data RX: Handle 720 flags 0x02 dlen 21              #192 [hci1] 12.576757
      SMP: Pairing Confirm (0x03) len 16
        Confim value: 044acbefb08756203dd081688438c620
< HCI Command: Host Number of Com.. (0x03|0x0035) plen 5  #193 [hci1] 12.582898
        Num handles: 1
        Handle: 720 Address: DF:A9:FF:F6:B1:1A (OUI DF-A9-FF)
        Count: 1
< ACL Data TX: Handle 720 flags 0x00 dlen 21              #194 [hci1] 12.582995
      SMP: Pairing Random (0x04) len 16
        Random value: ed17f76500c95219dd01e09d1e63f87b
> HCI Event: Number of Completed Packets (0x13) plen 5    #195 [hci1] 12.626544
        Num handles: 1
        Handle: 720 Address: DF:A9:FF:F6:B1:1A (OUI DF-A9-FF)
        Count: 1
        #194: len 21 (3 Kb/s)
        Latency: 43 msec (13-44 msec ~43 msec)
> ACL Data RX: Handle 720 flags 0x02 dlen 21              #196 [hci1] 12.826790
      SMP: Pairing Random (0x04) len 16
        Random value: 538a1cd3516ad47022558cf10619211b
< HCI Command: Host Number of Com.. (0x03|0x0035) plen 5  #197 [hci1] 12.843044
        Num handles: 1
        Handle: 720 Address: DF:A9:FF:F6:B1:1A (OUI DF-A9-FF)
        Count: 1
< ACL Data TX: Handle 720 flags 0x00 dlen 21              #198 [hci1] 12.843147
      SMP: Pairing Confirm (0x03) len 16
        Confim value: bb3e3d5fd7dbd7e070d234a449b6af9a
> HCI Event: Number of Completed Packets (0x13) plen 5    #199 [hci1] 12.876636
        Num handles: 1
        Handle: 720 Address: DF:A9:FF:F6:B1:1A (OUI DF-A9-FF)
        Count: 1
        #198: len 21 (5 Kb/s)
        Latency: 33 msec (13-44 msec ~38 msec)
> ACL Data RX: Handle 720 flags 0x02 dlen 21              #200 [hci1] 12.926800
      SMP: Pairing Confirm (0x03) len 16
        Confim value: 0184100126fcd22f6f63f294b1e02293
< HCI Command: Host Number of Com.. (0x03|0x0035) plen 5  #201 [hci1] 12.943317
        Num handles: 1
        Handle: 720 Address: DF:A9:FF:F6:B1:1A (OUI DF-A9-FF)
        Count: 1
< ACL Data TX: Handle 720 flags 0x00 dlen 21              #202 [hci1] 12.943549
      SMP: Pairing Random (0x04) len 16
        Random value: 81d35d47e1f6006d79c974bd9d9e1ee3
> HCI Event: Number of Completed Packets (0x13) plen 5    #203 [hci1] 12.976676
        Num handles: 1
        Handle: 720 Address: DF:A9:FF:F6:B1:1A (OUI DF-A9-FF)
        Count: 1
        #202: len 21 (5 Kb/s)
        Latency: 33 msec (13-44 msec ~35 msec)
> ACL Data RX: Handle 720 flags 0x02 dlen 21              #204 [hci1] 13.226775
      SMP: Pairing Random (0x04) len 16
        Random value: 6b91868b75cc3a3ee3a17cbad73fb8ec
< HCI Command: Host Number of Com.. (0x03|0x0035) plen 5  #205 [hci1] 13.243214
        Num handles: 1
        Handle: 720 Address: DF:A9:FF:F6:B1:1A (OUI DF-A9-FF)
        Count: 1
< ACL Data TX: Handle 720 flags 0x00 dlen 21              #206 [hci1] 13.243334
      SMP: Pairing Confirm (0x03) len 16
        Confim value: 0fc37e501eb2a4894a93f1fdae0308d3
> HCI Event: Number of Completed Packets (0x13) plen 5    #207 [hci1] 13.276717
        Num handles: 1
        Handle: 720 Address: DF:A9:FF:F6:B1:1A (OUI DF-A9-FF)
        Count: 1
        #206: len 21 (5 Kb/s)
        Latency: 33 msec (13-44 msec ~34 msec)
> ACL Data RX: Handle 720 flags 0x02 dlen 21              #208 [hci1] 13.326725
      SMP: Pairing Confirm (0x03) len 16
        Confim value: b217626e1602704da46448c0b248c543
< HCI Command: Host Number of Com.. (0x03|0x0035) plen 5  #209 [hci1] 13.343484
        Num handles: 1
        Handle: 720 Address: DF:A9:FF:F6:B1:1A (OUI DF-A9-FF)
        Count: 1
< ACL Data TX: Handle 720 flags 0x00 dlen 21              #210 [hci1] 13.343789
      SMP: Pairing Random (0x04) len 16
        Random value: e7f7e0c2476823e41736a7e381bafb7c
> HCI Event: Number of Completed Packets (0x13) plen 5    #211 [hci1] 13.376684
        Num handles: 1
        Handle: 720 Address: DF:A9:FF:F6:B1:1A (OUI DF-A9-FF)
        Count: 1
        #210: len 21 (5 Kb/s)
        Latency: 32 msec (13-44 msec ~33 msec)
> ACL Data RX: Handle 720 flags 0x02 dlen 21              #212 [hci1] 13.626800
      SMP: Pairing Random (0x04) len 16
        Random value: 6b507846de1c15bf58b6456ba06cbc1d
< HCI Command: Host Number of Com.. (0x03|0x0035) plen 5  #213 [hci1] 13.643599
        Num handles: 1
        Handle: 720 Address: DF:A9:FF:F6:B1:1A (OUI DF-A9-FF)
        Count: 1
< ACL Data TX: Handle 720 flags 0x00 dlen 21              #214 [hci1] 13.643868
      SMP: Pairing Confirm (0x03) len 16
        Confim value: 1905a9f868acb0620ac3e57eb70f5018
> HCI Event: Number of Completed Packets (0x13) plen 5    #215 [hci1] 13.676629
        Num handles: 1
        Handle: 720 Address: DF:A9:FF:F6:B1:1A (OUI DF-A9-FF)
        Count: 1
        #214: len 21 (5 Kb/s)
        Latency: 32 msec (13-44 msec ~33 msec)
> ACL Data RX: Handle 720 flags 0x02 dlen 21              #216 [hci1] 13.726796
      SMP: Pairing Confirm (0x03) len 16
        Confim value: 4741f46e9c010e1a7955f4e994d29abf
< HCI Command: Host Number of Com.. (0x03|0x0035) plen 5  #217 [hci1] 13.743455
        Num handles: 1
        Handle: 720 Address: DF:A9:FF:F6:B1:1A (OUI DF-A9-FF)
        Count: 1
< ACL Data TX: Handle 720 flags 0x00 dlen 21              #218 [hci1] 13.743711
      SMP: Pairing Random (0x04) len 16
        Random value: fc8b40d9b0b09bc4296bf8753a8f6e1f
> HCI Event: Number of Completed Packets (0x13) plen 5    #219 [hci1] 13.776660
        Num handles: 1
        Handle: 720 Address: DF:A9:FF:F6:B1:1A (OUI DF-A9-FF)
        Count: 1
        #218: len 21 (5 Kb/s)
        Latency: 32 msec (13-44 msec ~33 msec)
> ACL Data RX: Handle 720 flags 0x02 dlen 21              #220 [hci1] 14.026778
      SMP: Pairing Random (0x04) len 16
        Random value: ad54c46814d8e7c93a0215494afe0f63
< HCI Command: Host Number of Com.. (0x03|0x0035) plen 5  #221 [hci1] 14.043867
        Num handles: 1
        Handle: 720 Address: DF:A9:FF:F6:B1:1A (OUI DF-A9-FF)
        Count: 1
< ACL Data TX: Handle 720 flags 0x00 dlen 21              #222 [hci1] 14.044092
      SMP: Pairing DHKey Check (0x0d) len 16
        E: 9be5332cad4e18daed7484cabb3033db
> HCI Event: Number of Completed Packets (0x13) plen 5    #223 [hci1] 14.076600
        Num handles: 1
        Handle: 720 Address: DF:A9:FF:F6:B1:1A (OUI DF-A9-FF)
        Count: 1
        #222: len 21 (5 Kb/s)
        Latency: 32 msec (13-44 msec ~32 msec)
> ACL Data RX: Handle 720 flags 0x02 dlen 21              #224 [hci1] 14.126794
      SMP: Pairing DHKey Check (0x0d) len 16
        E: c8e398ff9552a19069d9762cb94b9053
< HCI Command: LE Start Encryption (0x08|0x0019) plen 28  #225 [hci1] 14.143206
        Handle: 720 Address: DF:A9:FF:F6:B1:1A (OUI DF-A9-FF)
        Random number: 0x0000000000000000
        Encrypted diversifier: 0x0000
        Long term key: 577bdfa8e5d291c4e536c3daa77b5073
> HCI Event: Command Status (0x0f) plen 4                 #226 [hci1] 14.144074
      LE Start Encryption (0x08|0x0019) ncmd 1
        Status: Success (0x00)
< HCI Command: Host Number of Com.. (0x03|0x0035) plen 5  #227 [hci1] 14.162988
        Num handles: 1
        Handle: 720 Address: DF:A9:FF:F6:B1:1A (OUI DF-A9-FF)
        Count: 1
> HCI Event: Encryption Change (0x08) plen 4              #228 [hci1] 14.476546
        Status: Success (0x00)
        Handle: 720 Address: DF:A9:FF:F6:B1:1A (OUI DF-A9-FF)
        Encryption: Enabled with AES-CCM (0x01)
< HCI Command: Disconnect (0x01|0x0006) plen 3            #229 [hci1] 15.132939
        Handle: 720 Address: DF:A9:FF:F6:B1:1A (OUI DF-A9-FF)
        Reason: Remote User Terminated Connection (0x13)
> HCI Event: Command Status (0x0f) plen 4                 #230 [hci1] 15.133377
      Disconnect (0x01|0x0006) ncmd 1
        Status: Success (0x00)
