Bluetooth monitor ver 5.72
= Note: Linux version 7.0.0-31-generic (x86_64)                        0.360326
= Note: Bluetooth subsystem version 2.22                               0.360328
= New Index: 00:00:00:00:00:00 (Primary,UART,hci1)              [hci1] 0.360329
= New Index: 48:5F:99:8E:E0:64 (Primary,USB,hci0)               [hci0] 0.360329
= Open Index: 00:00:00:00:00:00                                 [hci1] 0.513527
= Index Info: 00:00:00:00:00:00 (Nordic Semiconductor ASA)      [hci1] 0.513533
@ USER Open: main (privileged) version 2.22            {0x0001} [hci1] 0.513536
< HCI Command: Reset (0x03|0x0003) plen 0                    #1 [hci1] 0.513861
> HCI Event: Command Complete (0x0e) plen 4                  #2 [hci1] 0.514332
      Reset (0x03|0x0003) ncmd 1
        Status: Success (0x00)
< HCI Command: Read Local Supported... (0x04|0x0003) plen 0  #3 [hci1] 0.533530
> HCI Event: Command Complete (0x0e) plen 12                 #4 [hci1] 0.534024
      Read Local Supported Features (0x04|0x0003) ncmd 1
        Status: Success (0x00)
        Features: 0x00 0x00 0x00 0x00 0x60 0x00 0x00 0x00
          BR/EDR Not Supported
          LE Supported (Controller)
< HCI Command: Read Local Version In.. (0x04|0x0001) plen 0  #5 [hci1] 0.553415
> HCI Event: Command Complete (0x0e) plen 12                 #6 [hci1] 0.553883
      Read Local Version Information (0x04|0x0001) ncmd 1
        Status: Success (0x00)
        HCI version: Reserved (0x11) - Revision 12345 (0x3039)
        LMP version: Reserved (0x11) - Subversion 12345 (0x3039)
        Manufacturer: Nordic Semiconductor ASA (89)
< HCI Command: Read Local Supported... (0x04|0x0002) plen 0  #7 [hci1] 0.573498
> HCI Event: Command Complete (0x0e) plen 68                 #8 [hci1] 0.574609
      Read Local Supported Commands (0x04|0x0002) ncmd 1
        Status: Success (0x00)
        Commands: 115 entries
          Disconnect (Octet 0 - Bit 5)
          Read Remote Version Information (Octet 2 - Bit 7)
          Set Event Mask (Octet 5 - Bit 6)
          Reset (Octet 5 - Bit 7)
          Read Connection Accept Timeout (Octet 7 - Bit 2)
          Write Connection Accept Timeout (Octet 7 - Bit 3)
          Read Transmit Power Level (Octet 10 - Bit 2)
          Set Controller To Host Flow Control (Octet 10 - Bit 5)
          Host Buffer Size (Octet 10 - Bit 6)
          Host Number of Completed Packets (Octet 10 - Bit 7)
          Read Local Version Information (Octet 14 - Bit 3)
          Read Local Supported Features (Octet 14 - Bit 5)
          Read BD ADDR (Octet 15 - Bit 1)
          Read RSSI (Octet 15 - Bit 5)
          Set Event Mask Page 2 (Octet 22 - Bit 2)
          LE Set Event Mask (Octet 25 - Bit 0)
          LE Read Buffer Size (Octet 25 - Bit 1)
          LE Read Local Supported Features (Octet 25 - Bit 2)
          LE Set Random Address (Octet 25 - Bit 4)
          LE Set Advertising Parameters (Octet 25 - Bit 5)
          LE Read Advertising Channel TX Power (Octet 25 - Bit 6)
          LE Set Advertising Data (Octet 25 - Bit 7)
          LE Set Scan Response Data (Octet 26 - Bit 0)
          LE Set Advertise Enable (Octet 26 - Bit 1)
          LE Set Scan Parameters (Octet 26 - Bit 2)
          LE Set Scan Enable (Octet 26 - Bit 3)
          LE Create Connection (Octet 26 - Bit 4)
          LE Create Connection Cancel (Octet 26 - Bit 5)
          LE Read Accept List Size (Octet 26 - Bit 6)
          LE Clear Accept List (Octet 26 - Bit 7)
          LE Add Device To Accept List (Octet 27 - Bit 0)
          LE Remove Device From Accept List (Octet 27 - Bit 1)
          LE Connection Update (Octet 27 - Bit 2)
          LE Set Host Channel Classification (Octet 27 - Bit 3)
          LE Read Channel Map (Octet 27 - Bit 4)
          LE Read Remote Used Features (Octet 27 - Bit 5)
          LE Encrypt (Octet 27 - Bit 6)
          LE Rand (Octet 27 - Bit 7)
          LE Start Encryption (Octet 28 - Bit 0)
          LE Long Term Key Request Reply (Octet 28 - Bit 1)
          LE Long Term Key Request Neg Reply (Octet 28 - Bit 2)
          LE Read Supported States (Octet 28 - Bit 3)
          Read Authenticated Payload Timeout (Octet 32 - Bit 4)
          Write Authenticated Payload Timeout (Octet 32 - Bit 5)
          LE Set Data Length (Octet 33 - Bit 6)
          LE Read Suggested Default Data Length (Octet 33 - Bit 7)
          LE Write Suggested Default Data Length (Octet 34 - Bit 0)
          LE Add Device To Resolving List (Octet 34 - Bit 3)
          LE Remove Device From Resolving List (Octet 34 - Bit 4)
          LE Clear Resolving List (Octet 34 - Bit 5)
          LE Read Resolving List Size (Octet 34 - Bit 6)
          LE Set Address Resolution Enable (Octet 35 - Bit 1)
          LE Set Resolvable Private Address Timeout (Octet 35 - Bit 2)
          LE Read Maximum Data Length (Octet 35 - Bit 3)
          LE Read PHY (Octet 35 - Bit 4)
          LE Set Default PHY (Octet 35 - Bit 5)
          LE Set PHY (Octet 35 - Bit 6)
          LE Set Advertising Set Random Address (Octet 36 - Bit 1)
          LE Set Extended Advertising Parameters (Octet 36 - Bit 2)
          LE Set Extended Advertising Data (Octet 36 - Bit 3)
          LE Set Extended Scan Response Data (Octet 36 - Bit 4)
          LE Set Extended Advertising Enable (Octet 36 - Bit 5)
          LE Read Maximum Advertising Data Length (Octet 36 - Bit 6)
          LE Read Number of Supported Advertising Sets (Octet 36 - Bit 7)
          LE Remove Advertising Set (Octet 37 - Bit 0)
          LE Clear Advertising Sets (Octet 37 - Bit 1)
          LE Set Periodic Advertising Parameters (Octet 37 - Bit 2)
          LE Set Periodic Advertising Data (Octet 37 - Bit 3)
          LE Set Periodic Advertising Enable (Octet 37 - Bit 4)
          LE Set Extended Scan Parameters (Octet 37 - Bit 5)
          LE Set Extended Scan Enable (Octet 37 - Bit 6)
          LE Extended Create Connection (Octet 37 - Bit 7)
          LE Periodic Advertising Create Sync (Octet 38 - Bit 0)
          LE Periodic Advertising Create Sync Cancel (Octet 38 - Bit 1)
          LE Periodic Advertising Terminate Sync (Octet 38 - Bit 2)
          LE Add Device To Periodic Advertiser List (Octet 38 - Bit 3)
          LE Remove Device From Periodic Advertiser List (Octet 38 - Bit 4)
          LE Clear Periodic Advertiser List (Octet 38 - Bit 5)
          LE Read Periodic Advertiser List Size (Octet 38 - Bit 6)
          LE Read Transmit Power (Octet 38 - Bit 7)
          LE Read RF Path Compensation (Octet 39 - Bit 0)
          LE Write RF Path Compensation (Octet 39 - Bit 1)
          LE Set Privacy Mode (Octet 39 - Bit 2)
          LE Periodic Advertising Receive Enable (Octet 40 - Bit 5)
          LE Periodic Advertising Sync Transfer (Octet 40 - Bit 6)
          LE Periodic Advertising Set Info Transfer (Octet 40 - Bit 7)
          LE Periodic Advertising Sync Transfer Parameters (Octet 41 - Bit 0)
          LE Set Default Periodic Advertisng Sync Transfer Parameters (Octet 41 - Bit 1)
          LE Read Buffer v2 (Octet 41 - Bit 5)
          LE Read ISO TX Sync (Octet 41 - Bit 6)
          LE Set Connected Isochronous Group Parameters (Octet 41 - Bit 7)
          LE Set Connected Isochronous Group Parameters Test (Octet 42 - Bit 0)
          LE Create Connected Isochronous Stream (Octet 42 - Bit 1)
          LE Remove Connected Isochronous Group (Octet 42 - Bit 2)
          LE Accept Connected Isochronous Stream Request (Octet 42 - Bit 3)
          LE Reject Connected Isochronous Stream Request (Octet 42 - Bit 4)
          LE Create Broadcast Isochronous Group (Octet 42 - Bit 5)
          LE Create Broadcast Isochronous Group Test (Octet 42 - Bit 6)
          LE Terminate Broadcast Isochronous Group (Octet 42 - Bit 7)
          LE Broadcast Isochronous Group Create Sync (Octet 43 - Bit 0)
          LE Broadcast Isochronous Group Terminate Sync (Octet 43 - Bit 1)
          LE Request Peer SCA (Octet 43 - Bit 2)
          LE Setup Isochronous Data Path (Octet 43 - Bit 3)
          LE Remove Isochronous Data Path (Octet 43 - Bit 4)
          LE Isochronous Transmit Test (Octet 43 - Bit 5)
          LE Isochronous Receive Test (Octet 43 - Bit 6)
          LE Isochronous Read Test Counters (Octet 43 - Bit 7)
          LE Isochronous Read Test Counters (Octet 44 - Bit 0)
          LE Set Host Feature (Octet 44 - Bit 1)
          Octet 44 - Bit 2 
          Octet 45 - Bit 6 
          Octet 46 - Bit 0 
          Octet 46 - Bit 1 
          Octet 46 - Bit 2 
          Octet 47 - Bit 4 
< HCI Command: Host Buffer Size (0x03|0x0033) plen 7         #9 [hci1] 0.593479
        ACL MTU: 255  ACL max packet: 16
        SCO MTU: 0    SCO max packet: 0
> HCI Event: Command Complete (0x0e) plen 4                 #10 [hci1] 0.593927
      Host Buffer Size (0x03|0x0033) ncmd 1
        Status: Success (0x00)
< HCI Command: Set Controller To Ho.. (0x03|0x0031) plen 1  #11 [hci1] 0.613496
        Flow control: ACL Data Packets (0x01)
> HCI Event: Command Complete (0x0e) plen 4                 #12 [hci1] 0.613929
      Set Controller To Host Flow Control (0x03|0x0031) ncmd 1
        Status: Success (0x00)
< HCI Command: LE Read Local Suppor.. (0x08|0x0003) plen 0  #13 [hci1] 0.633472
> HCI Event: Command Complete (0x0e) plen 12                #14 [hci1] 0.633926
      LE Read Local Supported Features (0x08|0x0003) ncmd 1
        Status: Success (0x00)
        Features: 0xfd 0x79 0x00 0xf7 0x30 0x01 0x00 0x00
          LE Encryption
          Extended Reject Indication
          Peripheral-initiated Features Exchange
          LE Ping
          LE Data Packet Length Extension
          LL Privacy
          Extended Scanner Filter Policies
          LE 2M PHY
          LE Coded PHY
          LE Extended Advertising
          LE Periodic Advertising
          Channel Selection Algorithm #2
          Periodic Advertising Sync Transfer - Sender
          Periodic Advertising Sync Transfer - Recipient
          Sleep Clock Accuracy Updates
          Connected Isochronous Stream - Central
          Connected Isochronous Stream - Peripheral
          Isochronous Broadcaster
          Synchronized Receiver
          Periodic Advertising ADI support
          Connection Subrating
          Unknown features (0x0000010000000000)
< HCI Command: LE Set Host Feature (0x08|0x0074) plen 2     #15 [hci1] 0.653470
        Bit Number: 32
          Connected Isochronous Stream (Host Support)
        Bit Value: 1
> HCI Event: Command Complete (0x0e) plen 4                 #16 [hci1] 0.653865
      LE Set Host Feature (0x08|0x0074) ncmd 1
        Status: Success (0x00)
< HCI Command: LE Read Buffer v2 (0x08|0x0060) plen 0       #17 [hci1] 0.673498
> HCI Event: Command Complete (0x0e) plen 10                #18 [hci1] 0.674046
      LE Read Buffer v2 (0x08|0x0060) ncmd 1
        Status: Success (0x00)
        ACL MTU: 27
        ACL max packet: 3
        ISO MTU: 318
        ISO max packet: 3
< HCI Command: LE Read Maximum Adve.. (0x08|0x003a) plen 0  #19 [hci1] 0.693545
> HCI Event: Command Complete (0x0e) plen 6                 #20 [hci1] 0.693975
      LE Read Maximum Advertising Data Length (0x08|0x003a) ncmd 1
        Status: Success (0x00)
        Max length: 1650
< HCI Command: LE Read Supported St.. (0x08|0x001c) plen 0  #21 [hci1] 0.713523
> HCI Event: Command Complete (0x0e) plen 12                #22 [hci1] 0.713960
      LE Read Supported States (0x08|0x001c) ncmd 1
        Status: Success (0x00)
        States: 0x000003ff3e0306ff
          Non-connectable Advertising State
          Scannable Advertising State
          Connectable Advertising State
          High Duty Cycle Directed Advertising State
          Passive Scanning State
          Active Scanning State
          Initiating State
            and Connection State (Central Role)
          Connection State (Peripheral Role)
          Scannable Advertising State
            and Passive Scanning State
          Connectable Advertising State
            and Passive Scanning State
          Non-connectable Advertising State
            and Initiating State
          Scannable Advertising State
            and Initiating State
          Active Scanning State
            and Connection State (Central Role)
          Passive Scanning State
            and Connection State (Peripheral Role)
          Active Scanning State
            and Connection State (Peripheral Role)
          Initiating State
            and Connection State (Central Role)
            and Central Role & Central Role
          Low Duty Cycle Directed Advertising State
          Connectable Advertising State
            and Initiating State
            and Central Role & Peripheral Role
          High Duty Cycle Directed Advertising State
            and Initiating State
            and Central Role & Peripheral Role
          Low Duty Cycle Directed Advertising State
            and Initiating State
            and Central Role & Peripheral Role
          Connectable Advertising State
            and Connection State (Central Role)
            and Central Role & Peripheral Role
          High Duty Cycle Directed Advertising State
            and Connection State (Central Role)
            and Central Role & Peripheral Role
          Low Duty Cycle Directed Advertising State
            and Connection State (Central Role)
            and Central Role & Peripheral Role
          Connectable Advertising State
            and Connection State (Peripheral Role)
            and Central Role & Peripheral Role
          High Duty Cycle Directed Advertising State
            and Connection State (Peripheral Role)
            and Peripheral Role & Peripheral Role
          Low Duty Cycle Directed Advertising State
            and Connection State (Peripheral Role)
            and Peripheral Role & Peripheral Role
          Initiating State
            and Connection State (Peripheral Role)
            and Central Role & Peripheral Role
< HCI Command: LE Read Maximum Data.. (0x08|0x002f) plen 0  #23 [hci1] 0.733522
> HCI Event: Command Complete (0x0e) plen 12                #24 [hci1] 0.734057
      LE Read Maximum Data Length (0x08|0x002f) ncmd 1
        Status: Success (0x00)
        Max TX octets: 251
        Max TX time: 2704
        Max RX octets: 251
        Max RX time: 2704
< HCI Command: LE Write Suggested D.. (0x08|0x0024) plen 4  #25 [hci1] 0.753522
        TX octets: 251
        TX time: 2704
> HCI Event: Command Complete (0x0e) plen 4                 #26 [hci1] 0.753959
      LE Write Suggested Default Data Length (0x08|0x0024) ncmd 1
        Status: Success (0x00)
< HCI Command: LE Read Resolving Li.. (0x08|0x002a) plen 0  #27 [hci1] 0.773523
> HCI Event: Command Complete (0x0e) plen 5                 #28 [hci1] 0.773956
      LE Read Resolving List Size (0x08|0x002a) ncmd 1
        Status: Success (0x00)
        Size: 8
< HCI Command: LE Set Host Feature (0x08|0x0074) plen 2     #29 [hci1] 0.793503
        Bit Number: 38
          Connection Subrating (Host Support)
        Bit Value: 1
> HCI Event: Command Complete (0x0e) plen 4                 #30 [hci1] 0.793931
      LE Set Host Feature (0x08|0x0074) ncmd 1
        Status: Success (0x00)
< HCI Command: LE Set Event Mask (0x08|0x0001) plen 8       #31 [hci1] 0.813536
        Mask: 0x000002063f87fa5e
          LE Advertising Report
          LE Connection Update Complete
          LE Read Remote Used Features Complete
          LE Long Term Key Request
          LE Data Length Change
          LE Enhanced Connection Complete
          LE PHY Update Complete
          LE Extended Advertising Report
          LE Periodic Advertising Sync Established
          LE Periodic Advertising Report
          LE Periodic Advertising Sync Lost
          LE Extended Scan Timeout
          LE Extended Advertising Set Terminated
          LE Scan Request Received
          LE Periodic Advertising Sync Transfer Rvc
          LE CIS Established
          LE CIS Request
          LE Create BIG Complete
          LE Terminate BIG Complete
          LE BIG Sync Estabilished Complete
          LE BIG Sync Lost
          LE BIG Info Advertising Report
          LE Subrate Change
          Unknown mask (0x0000020000000000)
> HCI Event: Command Complete (0x0e) plen 4                 #32 [hci1] 0.814016
      LE Set Event Mask (0x08|0x0001) ncmd 1
        Status: Success (0x00)
< HCI Command: Set Event Mask (0x03|0x0001) plen 8          #33 [hci1] 0.833526
        Mask: 0x2000800002008890
          Disconnection Complete
          Encryption Change
          Read Remote Version Information Complete
          Hardware Error
          Data Buffer Overflow
          Encryption Key Refresh Complete
          LE Meta
> HCI Event: Command Complete (0x0e) plen 4                 #34 [hci1] 0.834007
      Set Event Mask (0x03|0x0001) ncmd 1
        Status: Success (0x00)
< HCI Command: Read BD ADDR (0x04|0x0009) plen 0            #35 [hci1] 0.853515
> HCI Event: Command Complete (0x0e) plen 10                #36 [hci1] 0.853973
      Read BD ADDR (0x04|0x0009) ncmd 1
        Status: Success (0x00)
        Address: 00:00:00:00:00:00 (OUI 00-00-00)
< HCI Command: LE Set Random Address (0x08|0x0005) plen 6   #37 [hci1] 0.873510
        Address: D5:B6:CC:31:DB:3B (Static)
> HCI Event: Command Complete (0x0e) plen 4                 #38 [hci1] 0.873944
      LE Set Random Address (0x08|0x0005) ncmd 1
        Status: Success (0x00)
< HCI Command: LE Set Extended Adv.. (0x08|0x0036) plen 25  #39 [hci1] 4.583581
        Handle: 0x00
        Properties: 0x0013
          Connectable
          Scannable
          Use legacy advertising PDUs: ADV_IND
        Min advertising interval: 100.000 msec (0x00a0)
        Max advertising interval: 150.000 msec (0x00f0)
        Channel map: 37, 38, 39 (0x07)
        Own address type: Random (0x01)
        Peer address type: Public (0x00)
        Peer address: 00:00:00:00:00:00 (OUI 00-00-00)
        Filter policy: Allow Scan Request from Any, Allow Connect Request from Any (0x00)
        TX power: Host has no preference (0x7f)
        Primary PHY: LE 1M (0x01)
        Secondary max skip: 0x00
        Secondary PHY: LE 1M (0x01)
        SID: 0x00
        Scan request notifications: Disabled (0x00)
> HCI Event: Command Complete (0x0e) plen 5                 #40 [hci1] 4.584366
      LE Set Extended Advertising Parameters (0x08|0x0036) ncmd 1
        Status: Success (0x00)
        TX power (selected): 0 dbm (0x00)
< HCI Command: LE Set Advertising S.. (0x08|0x0035) plen 7  #41 [hci1] 4.593557
        Advertising handle: 0x00
        Advertising random address: D5:B6:CC:31:DB:3B (Static)
> HCI Event: Command Complete (0x0e) plen 4                 #42 [hci1] 4.594040
      LE Set Advertising Set Random Address (0x08|0x0035) ncmd 1
        Status: Success (0x00)
< HCI Command: LE Set Extended Adv.. (0x08|0x0037) plen 22  #43 [hci1] 4.613553
        Handle: 0x00
        Operation: Complete extended advertising data (0x03)
        Fragment preference: Minimize fragmentation (0x01)
        Data length: 0x12
        Flags: 0x06
          LE General Discoverable Mode
          BR/EDR Not Supported
        Name (complete): Tester_F6B11A
> HCI Event: Command Complete (0x0e) plen 4                 #44 [hci1] 4.614233
      LE Set Extended Advertising Data (0x08|0x0037) ncmd 1
        Status: Success (0x00)
< HCI Command: LE Set Extended Scan.. (0x08|0x0038) plen 4  #45 [hci1] 4.633605
        Handle: 0x00
        Operation: Complete scan response data (0x03)
        Fragment preference: Minimize fragmentation (0x01)
        Data length: 0x00
> HCI Event: Command Complete (0x0e) plen 4                 #46 [hci1] 4.634056
      LE Set Extended Scan Response Data (0x08|0x0038) ncmd 1
        Status: Success (0x00)
< HCI Command: LE Set Extended Adve.. (0x08|0x0039) plen 6  #47 [hci1] 4.653554
        Extended advertising: Enabled (0x01)
        Number of sets: 1 (0x01)
        Entry 0
          Handle: 0x00
          Duration: 0 ms (0x00)
          Max ext adv events: 0
> HCI Event: Command Complete (0x0e) plen 4                 #48 [hci1] 4.654099
      LE Set Extended Advertising Enable (0x08|0x0039) ncmd 1
        Status: Success (0x00)
> HCI Event: LE Meta Event (0x3e) plen 31                   #49 [hci1] 4.768763
      LE Enhanced Connection Complete (0x0a)
        Status: Success (0x00)
        Handle: 2685
        Role: Peripheral (0x01)
        Peer address type: Public (0x00)
        Peer address: DF:A9:FF:F6:B1:1A (OUI DF-A9-FF)
        Local resolvable private address: 00:00:00:00:00:00 (Non-Resolvable)
        Peer resolvable private address: 00:00:00:00:00:00 (Non-Resolvable)
        Connection interval: 87.50 msec (0x0046)
        Connection latency: 0 (0x0000)
        Supervision timeout: 25120 msec (0x09d0)
        Central clock accuracy: 0x01
> HCI Event: LE Meta Event (0x3e) plen 6                    #50 [hci1] 4.768766
      LE Advertising Set Terminated (0x12)
        Status: Success (0x00)
        Handle: 0
        Connection handle: 2685
        Number of completed extended advertising events: 0
< HCI Command: LE Read Remote Used... (0x08|0x0016) plen 2  #51 [hci1] 4.773732
        Handle: 2685 Address: DF:A9:FF:F6:B1:1A (OUI DF-A9-FF)
< ACL Data TX: Handle 2685 flags 0x00 dlen 7                #52 [hci1] 4.773747
      ATT: Exchange MTU Request (0x02) len 2
        Client RX MTU: 251
> HCI Event: Command Status (0x0f) plen 4                   #53 [hci1] 4.774240
      LE Read Remote Used Features (0x08|0x0016) ncmd 1
        Status: Success (0x00)
> HCI Event: Number of Completed Packets (0x13) plen 5      #54 [hci1] 4.944707
        Num handles: 1
        Handle: 2685 Address: DF:A9:FF:F6:B1:1A (OUI DF-A9-FF)
        Count: 1
        #52: len 7 (0 Kb/s)
        Latency: 170 msec (170-170 msec ~170 msec)
> HCI Event: LE Meta Event (0x3e) plen 12                   #55 [hci1] 5.032483
      LE Read Remote Used Features (0x04)
        Status: Success (0x00)
        Handle: 2685 Address: DF:A9:FF:F6:B1:1A (OUI DF-A9-FF)
        Features: 0x2d 0x49 0x00 0xf7 0x67 0xd9 0x00 0x80
          LE Encryption
          Extended Reject Indication
          Peripheral-initiated Features Exchange
          LE Data Packet Length Extension
          LE 2M PHY
          LE Coded PHY
          Channel Selection Algorithm #2
          Periodic Advertising Sync Transfer - Sender
          Periodic Advertising Sync Transfer - Recipient
          Sleep Clock Accuracy Updates
          Connected Isochronous Stream - Central
          Connected Isochronous Stream - Peripheral
          Isochronous Broadcaster
          Synchronized Receiver
          Connected Isochronous Stream (Host Support)
          LE Power Control Request
          LE Power Control Request
          Connection Subrating
          Connection Subrating (Host Support)
          Unknown features (0x8000d90000000000)
> ACL Data RX: Handle 2685 flags 0x02 dlen 7                #56 [hci1] 5.469775
      ATT: Exchange MTU Request (0x02) len 2
        Client RX MTU: 64
> ACL Data RX: Handle 2685 flags 0x02 dlen 7                #57 [hci1] 5.470351
      ATT: Exchange MTU Response (0x03) len 2
        Server RX MTU: 64
< HCI Command: Host Number of Compl.. (0x03|0x0035) plen 5  #58 [hci1] 5.473684
        Num handles: 1
        Handle: 2685 Address: DF:A9:FF:F6:B1:1A (OUI DF-A9-FF)
        Count: 1
< ACL Data TX: Handle 2685 flags 0x00 dlen 7                #59 [hci1] 5.473721
      ATT: Exchange MTU Response (0x03) len 2
        Server RX MTU: 251
< HCI Command: Host Number of Compl.. (0x03|0x0035) plen 5  #60 [hci1] 5.473821
        Num handles: 1
        Handle: 2685 Address: DF:A9:FF:F6:B1:1A (OUI DF-A9-FF)
        Count: 1
> HCI Event: Number of Completed Packets (0x13) plen 5      #61 [hci1] 5.644631
        Num handles: 1
        Handle: 2685 Address: DF:A9:FF:F6:B1:1A (OUI DF-A9-FF)
        Count: 1
        #59: len 7 (0 Kb/s)
        Latency: 170 msec (170-170 msec ~170 msec)
> ACL Data RX: Handle 2685 flags 0x02 dlen 11               #62 [hci1] 7.569769
      SMP: Pairing Request (0x01) len 6
        IO capability: KeyboardDisplay (0x04)
        OOB data: Authentication data not present (0x00)
        Authentication requirement: Bonding, No MITM, SC, No Keypresses (0x09)
        Max encryption key size: 16
        Initiator key distribution: EncKey IdKey (0x03)
        Responder key distribution: EncKey IdKey Sign (0x07)
< HCI Command: Host Number of Compl.. (0x03|0x0035) plen 5  #63 [hci1] 7.573639
        Num handles: 1
        Handle: 2685 Address: DF:A9:FF:F6:B1:1A (OUI DF-A9-FF)
        Count: 1
< ACL Data TX: Handle 2685 flags 0x00 dlen 11               #64 [hci1] 7.573725
      SMP: Pairing Response (0x02) len 6
        IO capability: NoInputNoOutput (0x03)
        OOB data: Authentication data not present (0x00)
        Authentication requirement: Bonding, No MITM, SC, No Keypresses (0x09)
        Max encryption key size: 16
        Initiator key distribution: IdKey (0x02)
        Responder key distribution: <none> (0x00)
> HCI Event: Number of Completed Packets (0x13) plen 5      #65 [hci1] 7.744835
        Num handles: 1
        Handle: 2685 Address: DF:A9:FF:F6:B1:1A (OUI DF-A9-FF)
        Count: 1
        #64: len 11 (0 Kb/s)
        Latency: 171 msec (170-171 msec ~171 msec)
> ACL Data RX: Handle 2685 flags 0x02 dlen 27               #66 [hci1] 7.745214
> ACL Data RX: Handle 2685 flags 0x01 dlen 27               #67 [hci1] 7.745701
> ACL Data RX: Handle 2685 flags 0x01 dlen 15               #68 [hci1] 7.746180
      SMP: Pairing Public Key (0x0c) len 64
        X: c50dd9413da57708af4b34bf9643f67c42d6c94d79f54dde66c58663fe9bc61f
        Y: 57626bff95511e60f560da0364b8041e1338047e2fe5741a6309c59212d8e4f4
< HCI Command: Host Number of Compl.. (0x03|0x0035) plen 5  #69 [hci1] 7.753936
        Num handles: 1
        Handle: 2685 Address: DF:A9:FF:F6:B1:1A (OUI DF-A9-FF)
        Count: 1
< HCI Command: Host Number of Compl.. (0x03|0x0035) plen 5  #70 [hci1] 7.754068
        Num handles: 1
        Handle: 2685 Address: DF:A9:FF:F6:B1:1A (OUI DF-A9-FF)
        Count: 1
< HCI Command: Host Number of Compl.. (0x03|0x0035) plen 5  #71 [hci1] 7.754166
        Num handles: 1
        Handle: 2685 Address: DF:A9:FF:F6:B1:1A (OUI DF-A9-FF)
        Count: 1
< ACL Data TX: Handle 2685 flags 0x00 dlen 27               #72 [hci1] 7.754183
< ACL Data TX: Handle 2685 flags 0x01 dlen 27               #73 [hci1] 7.754192
< ACL Data TX: Handle 2685 flags 0x01 dlen 15               #74 [hci1] 7.754196
      SMP: Pairing Public Key (0x0c) len 64
        X: 98308440221e2d910f0e54b71e7ec652857aa9b5a0dc65028824cc19db1226e9
        Y: 67a4816bcb62efb21701e31fdb27561a6217575fb007a8bbdabe7e28b6f68482
> HCI Event: Number of Completed Packets (0x13) plen 5      #75 [hci1] 7.832735
        Num handles: 1
        Handle: 2685 Address: DF:A9:FF:F6:B1:1A (OUI DF-A9-FF)
        Count: 1
        #72: len 27 (2 Kb/s)
        Latency: 78 msec (78-171 msec ~124 msec)
> HCI Event: Number of Completed Packets (0x13) plen 5      #76 [hci1] 7.833377
        Num handles: 1
        Handle: 2685 Address: DF:A9:FF:F6:B1:1A (OUI DF-A9-FF)
        Count: 1
        #73: len 27 (2 Kb/s)
        Latency: 79 msec (78-171 msec ~101 msec)
< ACL Data TX: Handle 2685 flags 0x00 dlen 21               #77 [hci1] 7.833615
      SMP: Pairing Confirm (0x03) len 16
        Confim value: cb275f6b20b02087b73562dc9f75a942
> HCI Event: Number of Completed Packets (0x13) plen 5      #78 [hci1] 7.919653
        Num handles: 1
        Handle: 2685 Address: DF:A9:FF:F6:B1:1A (OUI DF-A9-FF)
        Count: 1
        #74: len 15 (0 Kb/s)
        Latency: 165 msec (78-171 msec ~133 msec)
> HCI Event: Number of Completed Packets (0x13) plen 5      #79 [hci1] 8.007289
        Num handles: 1
        Handle: 2685 Address: DF:A9:FF:F6:B1:1A (OUI DF-A9-FF)
        Count: 1
        #77: len 21 (0 Kb/s)
        Latency: 173 msec (78-173 msec ~153 msec)
> ACL Data RX: Handle 2685 flags 0x02 dlen 21               #80 [hci1] 8.007597
      SMP: Pairing Random (0x04) len 16
        Random value: ea7a997cfd4cbb400000000000000000
< HCI Command: Host Number of Compl.. (0x03|0x0035) plen 5  #81 [hci1] 8.013732
        Num handles: 1
        Handle: 2685 Address: DF:A9:FF:F6:B1:1A (OUI DF-A9-FF)
        Count: 1
< ACL Data TX: Handle 2685 flags 0x00 dlen 21               #82 [hci1] 8.013760
      SMP: Pairing Random (0x04) len 16
        Random value: 8e6108f966a694cbe26df70bb96773e6
> HCI Event: Number of Completed Packets (0x13) plen 5      #83 [hci1] 8.182157
        Num handles: 1
        Handle: 2685 Address: DF:A9:FF:F6:B1:1A (OUI DF-A9-FF)
        Count: 1
        #82: len 21 (1 Kb/s)
        Latency: 168 msec (78-173 msec ~161 msec)
> ACL Data RX: Handle 2685 flags 0x02 dlen 21               #84 [hci1] 8.357509
      SMP: Pairing DHKey Check (0x0d) len 16
        E: 7dd0fed48f692c8fc871fcd382e68567
< HCI Command: Host Number of Compl.. (0x03|0x0035) plen 5  #85 [hci1] 8.374435
        Num handles: 1
        Handle: 2685 Address: DF:A9:FF:F6:B1:1A (OUI DF-A9-FF)
        Count: 1
< ACL Data TX: Handle 2685 flags 0x00 dlen 21               #86 [hci1] 8.374580
      SMP: Pairing DHKey Check (0x0d) len 16
        E: a06a4e87373822d4c253a5b44b348016
> HCI Event: Number of Completed Packets (0x13) plen 5      #87 [hci1] 8.532052
        Num handles: 1
        Handle: 2685 Address: DF:A9:FF:F6:B1:1A (OUI DF-A9-FF)
        Count: 1
        #86: len 21 (1 Kb/s)
        Latency: 157 msec (78-173 msec ~159 msec)
> HCI Event: LE Meta Event (0x3e) plen 13                   #88 [hci1] 8.620182
      LE Long Term Key Request (0x05)
        Handle: 2685 Address: DF:A9:FF:F6:B1:1A (OUI DF-A9-FF)
        Random number: 0x0000000000000000
        Encrypted diversifier: 0x0000
< HCI Command: LE Long Term Key Re.. (0x08|0x001a) plen 18  #89 [hci1] 8.633715
        Handle: 2685 Address: DF:A9:FF:F6:B1:1A (OUI DF-A9-FF)
        Long term key: fd9f8fb5a934c0d9806d23882e506267
> HCI Event: Command Complete (0x0e) plen 6                 #90 [hci1] 8.634495
      LE Long Term Key Request Reply (0x08|0x001a) ncmd 1
        Status: Success (0x00)
        Handle: 2685 Address: DF:A9:FF:F6:B1:1A (OUI DF-A9-FF)
> HCI Event: Encryption Change (0x08) plen 4                #91 [hci1] 9.057368
        Status: Success (0x00)
        Handle: 2685 Address: DF:A9:FF:F6:B1:1A (OUI DF-A9-FF)
        Encryption: Enabled with AES-CCM (0x01)
> ACL Data RX: Handle 2685 flags 0x02 dlen 21               #92 [hci1] 9.144991
      SMP: Identity Information (0x08) len 16
        Identity resolving key: 42f00cb180cbf7bf2e7807843e70e3df
< HCI Command: Host Number of Compl.. (0x03|0x0035) plen 5  #93 [hci1] 9.184222
        Num handles: 1
        Handle: 2685 Address: DF:A9:FF:F6:B1:1A (OUI DF-A9-FF)
        Count: 1
> ACL Data RX: Handle 2685 flags 0x02 dlen 12               #94 [hci1] 9.319816
      SMP: Identity Address Information (0x09) len 7
        Address: DF:A9:FF:F6:B1:1A (OUI DF-A9-FF)
< HCI Command: LE Add Device To Re.. (0x08|0x0027) plen 39  #95 [hci1] 9.333826
        Address type: Public (0x00)
        Address: DF:A9:FF:F6:B1:1A (OUI DF-A9-FF)
        Peer identity resolving key: 42f00cb180cbf7bf2e7807843e70e3df
        Local identity resolving key: 00000000000000000000000000000000
> HCI Event: Command Complete (0x0e) plen 4                 #96 [hci1] 9.334805
      LE Add Device To Resolving List (0x08|0x0027) ncmd 1
        Status: Success (0x00)
< HCI Command: LE Set Privacy Mode (0x08|0x004e) plen 8     #97 [hci1] 9.353671
        Peer Identity address type: Public (0x00)
        Peer Identity address: DF:A9:FF:F6:B1:1A (OUI DF-A9-FF)
        Privacy Mode: Use Device Privacy (0x01)
> HCI Event: Command Complete (0x0e) plen 4                 #98 [hci1] 9.354250
      LE Set Privacy Mode (0x08|0x004e) ncmd 1
        Status: Success (0x00)
< HCI Command: LE Set Address Resol.. (0x08|0x002d) plen 1  #99 [hci1] 9.373681
        Address resolution: Enabled (0x01)
> HCI Event: Command Complete (0x0e) plen 4                #100 [hci1] 9.374126
      LE Set Address Resolution Enable (0x08|0x002d) ncmd 1
        Status: Success (0x00)
< HCI Command: Host Number of Comp.. (0x03|0x0035) plen 5  #101 [hci1] 9.393594
        Num handles: 1
        Handle: 2685 Address: DF:A9:FF:F6:B1:1A (OUI DF-A9-FF)
        Count: 1
> ACL Data RX: Handle 2685 flags 0x02 dlen 11              #102 [hci1] 9.494877
      ATT: Read By Group Type Request (0x10) len 6
        Handle range: 0x0001-0xffff
        Attribute group type: Primary Service (0x2800)
< HCI Command: Host Number of Comp.. (0x03|0x0035) plen 5  #103 [hci1] 9.513792
        Num handles: 1
        Handle: 2685 Address: DF:A9:FF:F6:B1:1A (OUI DF-A9-FF)
        Count: 1
< ACL Data TX: Handle 2685 flags 0x00 dlen 27              #104 [hci1] 9.513849
< ACL Data TX: Handle 2685 flags 0x01 dlen 27              #105 [hci1] 9.513851
< ACL Data TX: Handle 2685 flags 0x01 dlen 12              #106 [hci1] 9.513853
      ATT: Read By Group Type Response (0x11) len 61
        Attribute data length: 6
        Attribute group list: 10 entries
        Handle range: 0x0001-0x000a
        UUID: Generic Attribute Profile (0x1801)
        Handle range: 0x000b-0x0011
        UUID: Generic Access Profile (0x1800)
        Handle range: 0x0012-0x0026
        UUID: Device Information (0x180a)
        Handle range: 0x0027-0x0029
        UUID: Immediate Alert (0x1802)
        Handle range: 0x002a-0x003c
        UUID: Published Audio Capabilities (0x1850)
        Handle range: 0x003d-0x004c
        UUID: Audio Stream Control (0x184e)
        Handle range: 0x004d-0x004f
        UUID: Telephony and Media Audio (0x1855)
        Handle range: 0x0060-0x0064
        UUID: Microphone Control (0x184d)
        Handle range: 0x0078-0x00b6
        UUID: Generic Media Control (0x1849)
        Handle range: 0x00b7-0x00c2
        UUID: Coordinated Set Identification (0x1846)
> HCI Event: Number of Completed Packets (0x13) plen 5     #107 [hci1] 9.582778
        Num handles: 1
        Handle: 2685 Address: DF:A9:FF:F6:B1:1A (OUI DF-A9-FF)
        Count: 1
        #104: len 27 (3 Kb/s)
        Latency: 68 msec (68-173 msec ~114 msec)
> HCI Event: Number of Completed Packets (0x13) plen 5     #108 [hci1] 9.583496
        Num handles: 1
        Handle: 2685 Address: DF:A9:FF:F6:B1:1A (OUI DF-A9-FF)
        Count: 1
        #105: len 27 (3 Kb/s)
        Latency: 69 msec (68-173 msec ~91 msec)
> HCI Event: Number of Completed Packets (0x13) plen 5     #109 [hci1] 9.669790
        Num handles: 1
        Handle: 2685 Address: DF:A9:FF:F6:B1:1A (OUI DF-A9-FF)
        Count: 1
        #106: len 12 (0 Kb/s)
        Latency: 155 msec (68-173 msec ~123 msec)
> ACL Data RX: Handle 2685 flags 0x02 dlen 11              #110 [hci1] 9.669952
      ATT: Read By Group Type Request (0x10) len 6
        Handle range: 0x00c3-0xffff
        Attribute group type: Primary Service (0x2800)
< HCI Command: Host Number of Comp.. (0x03|0x0035) plen 5  #111 [hci1] 9.674482
        Num handles: 1
        Handle: 2685 Address: DF:A9:FF:F6:B1:1A (OUI DF-A9-FF)
        Count: 1
< ACL Data TX: Handle 2685 flags 0x00 dlen 27              #112 [hci1] 9.674643
< ACL Data TX: Handle 2685 flags 0x01 dlen 3               #113 [hci1] 9.674664
      ATT: Read By Group Type Response (0x11) len 25
        Attribute data length: 6
        Attribute group list: 4 entries
        Handle range: 0x00c3-0x00c4
        UUID: Common Audio (0x1853)
        Handle range: 0x00fd-0x0109
        UUID: Volume Control (0x1844)
        Handle range: 0x010a-0x0136
        UUID: Generic Telephony Bearer (0x184c)
        Handle range: 0x0137-0x0163
        UUID: Telephony Bearer (0x184b)
> HCI Event: Number of Completed Packets (0x13) plen 5     #114 [hci1] 9.757754
        Num handles: 1
        Handle: 2685 Address: DF:A9:FF:F6:B1:1A (OUI DF-A9-FF)
        Count: 1
        #112: len 27 (2 Kb/s)
        Latency: 83 msec (68-173 msec ~103 msec)
> HCI Event: Number of Completed Packets (0x13) plen 5     #115 [hci1] 9.844835
        Num handles: 1
        Handle: 2685 Address: DF:A9:FF:F6:B1:1A (OUI DF-A9-FF)
        Count: 1
        #113: len 3 (0 Kb/s)
        Latency: 170 msec (68-173 msec ~136 msec)
> ACL Data RX: Handle 2685 flags 0x02 dlen 11              #116 [hci1] 9.844993
      ATT: Read By Group Type Request (0x10) len 6
        Handle range: 0x0164-0xffff
        Attribute group type: Primary Service (0x2800)
< HCI Command: Host Number of Comp.. (0x03|0x0035) plen 5  #117 [hci1] 9.854208
        Num handles: 1
        Handle: 2685 Address: DF:A9:FF:F6:B1:1A (OUI DF-A9-FF)
        Count: 1
< ACL Data TX: Handle 2685 flags 0x00 dlen 9               #118 [hci1] 9.854349
      ATT: Error Response (0x01) len 4
        Read By Group Type Request (0x10)
        Handle: 0x0164
        Error: Attribute Not Found (0x0a)
> HCI Event: Number of Completed Packets (0x13) plen 5    #119 [hci1] 10.019827
        Num handles: 1
        Handle: 2685 Address: DF:A9:FF:F6:B1:1A (OUI DF-A9-FF)
        Count: 1
        #118: len 9 (0 Kb/s)
        Latency: 165 msec (68-173 msec ~151 msec)
> ACL Data RX: Handle 2685 flags 0x02 dlen 13             #120 [hci1] 10.019984
      ATT: Find By Type Value Request (0x06) len 8
        Handle range: 0x0001-0xffff
        Attribute type: Primary Service (0x2800)
          UUID: Telephony and Media Audio (0x1855)
< HCI Command: Host Number of Com.. (0x03|0x0035) plen 5  #121 [hci1] 10.033941
        Num handles: 1
        Handle: 2685 Address: DF:A9:FF:F6:B1:1A (OUI DF-A9-FF)
        Count: 1
< ACL Data TX: Handle 2685 flags 0x00 dlen 9              #122 [hci1] 10.033971
      ATT: Find By Type Value Response (0x07) len 4
        Handle range: 0x004d-0x004f
> HCI Event: Number of Completed Packets (0x13) plen 5    #123 [hci1] 10.194695
        Num handles: 1
        Handle: 2685 Address: DF:A9:FF:F6:B1:1A (OUI DF-A9-FF)
        Count: 1
        #122: len 9 (0 Kb/s)
        Latency: 160 msec (68-173 msec ~155 msec)
> ACL Data RX: Handle 2685 flags 0x02 dlen 13             #124 [hci1] 10.194955
      ATT: Find By Type Value Request (0x06) len 8
        Handle range: 0x0050-0xffff
        Attribute type: Primary Service (0x2800)
          UUID: Telephony and Media Audio (0x1855)
< HCI Command: Host Number of Com.. (0x03|0x0035) plen 5  #125 [hci1] 10.213934
        Num handles: 1
        Handle: 2685 Address: DF:A9:FF:F6:B1:1A (OUI DF-A9-FF)
        Count: 1
< ACL Data TX: Handle 2685 flags 0x00 dlen 9              #126 [hci1] 10.214050
      ATT: Error Response (0x01) len 4
        Find By Type Value Request (0x06)
        Handle: 0x0050
        Error: Attribute Not Found (0x0a)
> HCI Event: Number of Completed Packets (0x13) plen 5    #127 [hci1] 10.369692
        Num handles: 1
        Handle: 2685 Address: DF:A9:FF:F6:B1:1A (OUI DF-A9-FF)
        Count: 1
        #126: len 9 (0 Kb/s)
        Latency: 155 msec (68-173 msec ~155 msec)
> ACL Data RX: Handle 2685 flags 0x02 dlen 11             #128 [hci1] 10.369984
      ATT: Read By Type Request (0x08) len 6
        Handle range: 0x004d-0x004f
        Attribute type: Characteristic (0x2803)
< HCI Command: Host Number of Com.. (0x03|0x0035) plen 5  #129 [hci1] 10.374180
        Num handles: 1
        Handle: 2685 Address: DF:A9:FF:F6:B1:1A (OUI DF-A9-FF)
        Count: 1
< ACL Data TX: Handle 2685 flags 0x00 dlen 13             #130 [hci1] 10.374267
      ATT: Read By Type Response (0x09) len 8
        Attribute data length: 7
        Attribute data list: 1 entry
        Handle: 0x004e
        Value: 024f00512b
            Properties: 0x02
              Read (0x02)
            Value Handle: 0x004f
            Value UUID: Telephony and Media Audio Profile Role (0x2b51)
> HCI Event: Number of Completed Packets (0x13) plen 5    #131 [hci1] 10.544701
        Num handles: 1
        Handle: 2685 Address: DF:A9:FF:F6:B1:1A (OUI DF-A9-FF)
        Count: 1
        #130: len 13 (0 Kb/s)
        Latency: 170 msec (68-173 msec ~163 msec)
> ACL Data RX: Handle 2685 flags 0x02 dlen 11             #132 [hci1] 10.544907
      ATT: Read By Type Request (0x08) len 6
        Handle range: 0x004f-0x004f
        Attribute type: Characteristic (0x2803)
< HCI Command: Host Number of Com.. (0x03|0x0035) plen 5  #133 [hci1] 10.553749
        Num handles: 1
        Handle: 2685 Address: DF:A9:FF:F6:B1:1A (OUI DF-A9-FF)
        Count: 1
< ACL Data TX: Handle 2685 flags 0x00 dlen 9              #134 [hci1] 10.553815
      ATT: Error Response (0x01) len 4
        Read By Type Request (0x08)
        Handle: 0x004f
        Error: Attribute Not Found (0x0a)
> HCI Event: Number of Completed Packets (0x13) plen 5    #135 [hci1] 10.719711
        Num handles: 1
        Handle: 2685 Address: DF:A9:FF:F6:B1:1A (OUI DF-A9-FF)
        Count: 1
        #134: len 9 (0 Kb/s)
        Latency: 165 msec (68-173 msec ~164 msec)
> ACL Data RX: Handle 2685 flags 0x02 dlen 13             #136 [hci1] 10.720108
      ATT: Find By Type Value Request (0x06) len 8
        Handle range: 0x0001-0xffff
        Attribute type: Primary Service (0x2800)
          UUID: Telephony and Media Audio (0x1855)
< HCI Command: Host Number of Com.. (0x03|0x0035) plen 5  #137 [hci1] 10.734916
        Num handles: 1
        Handle: 2685 Address: DF:A9:FF:F6:B1:1A (OUI DF-A9-FF)
        Count: 1
< ACL Data TX: Handle 2685 flags 0x00 dlen 9              #138 [hci1] 10.735038
      ATT: Find By Type Value Response (0x07) len 4
        Handle range: 0x004d-0x004f
> HCI Event: Number of Completed Packets (0x13) plen 5    #139 [hci1] 10.895235
        Num handles: 1
        Handle: 2685 Address: DF:A9:FF:F6:B1:1A (OUI DF-A9-FF)
        Count: 1
        #138: len 9 (0 Kb/s)
        Latency: 160 msec (68-173 msec ~162 msec)
> ACL Data RX: Handle 2685 flags 0x02 dlen 13             #140 [hci1] 10.895240
      ATT: Find By Type Value Request (0x06) len 8
        Handle range: 0x0050-0xffff
        Attribute type: Primary Service (0x2800)
          UUID: Telephony and Media Audio (0x1855)
< HCI Command: Host Number of Com.. (0x03|0x0035) plen 5  #141 [hci1] 10.913767
        Num handles: 1
        Handle: 2685 Address: DF:A9:FF:F6:B1:1A (OUI DF-A9-FF)
        Count: 1
< ACL Data TX: Handle 2685 flags 0x00 dlen 9              #142 [hci1] 10.913860
      ATT: Error Response (0x01) len 4
        Find By Type Value Request (0x06)
        Handle: 0x0050
        Error: Attribute Not Found (0x0a)
> HCI Event: Number of Completed Packets (0x13) plen 5    #143 [hci1] 11.069642
        Num handles: 1
        Handle: 2685 Address: DF:A9:FF:F6:B1:1A (OUI DF-A9-FF)
        Count: 1
        #142: len 9 (0 Kb/s)
        Latency: 155 msec (68-173 msec ~159 msec)
> ACL Data RX: Handle 2685 flags 0x02 dlen 11             #144 [hci1] 11.069888
      ATT: Read By Type Request (0x08) len 6
        Handle range: 0x004d-0x004f
        Attribute type: Characteristic (0x2803)
< HCI Command: Host Number of Com.. (0x03|0x0035) plen 5  #145 [hci1] 11.073776
        Num handles: 1
        Handle: 2685 Address: DF:A9:FF:F6:B1:1A (OUI DF-A9-FF)
        Count: 1
< ACL Data TX: Handle 2685 flags 0x00 dlen 13             #146 [hci1] 11.073952
      ATT: Read By Type Response (0x09) len 8
        Attribute data length: 7
        Attribute data list: 1 entry
        Handle: 0x004e
        Value: 024f00512b
            Properties: 0x02
              Read (0x02)
            Value Handle: 0x004f
            Value UUID: Telephony and Media Audio Profile Role (0x2b51)
> HCI Event: Number of Completed Packets (0x13) plen 5    #147 [hci1] 11.244801
        Num handles: 1
        Handle: 2685 Address: DF:A9:FF:F6:B1:1A (OUI DF-A9-FF)
        Count: 1
        #146: len 13 (0 Kb/s)
        Latency: 170 msec (68-173 msec ~164 msec)
> ACL Data RX: Handle 2685 flags 0x02 dlen 11             #148 [hci1] 11.244865
      ATT: Read By Type Request (0x08) len 6
        Handle range: 0x004f-0x004f
        Attribute type: Characteristic (0x2803)
< HCI Command: Host Number of Com.. (0x03|0x0035) plen 5  #149 [hci1] 11.253776
        Num handles: 1
        Handle: 2685 Address: DF:A9:FF:F6:B1:1A (OUI DF-A9-FF)
        Count: 1
< ACL Data TX: Handle 2685 flags 0x00 dlen 9              #150 [hci1] 11.253885
      ATT: Error Response (0x01) len 4
        Read By Type Request (0x08)
        Handle: 0x004f
        Error: Attribute Not Found (0x0a)
> HCI Event: Number of Completed Packets (0x13) plen 5    #151 [hci1] 11.419742
        Num handles: 1
        Handle: 2685 Address: DF:A9:FF:F6:B1:1A (OUI DF-A9-FF)
        Count: 1
        #150: len 9 (0 Kb/s)
        Latency: 165 msec (68-173 msec ~165 msec)
> ACL Data RX: Handle 2685 flags 0x02 dlen 7              #152 [hci1] 11.419850
      ATT: Read Request (0x0a) len 2
        Handle: 0x004f Type: Telephony and Media Audio Profile Role (0x2b51)
< HCI Command: Host Number of Com.. (0x03|0x0035) plen 5  #153 [hci1] 11.434221
        Num handles: 1
        Handle: 2685 Address: DF:A9:FF:F6:B1:1A (OUI DF-A9-FF)
        Count: 1
< ACL Data TX: Handle 2685 flags 0x00 dlen 7              #154 [hci1] 11.434296
      ATT: Read Response (0x0b) len 2
> HCI Event: Number of Completed Packets (0x13) plen 5    #155 [hci1] 11.594582
        Num handles: 1
        Handle: 2685 Address: DF:A9:FF:F6:B1:1A (OUI DF-A9-FF)
        Count: 1
        #154: len 7 (0 Kb/s)
        Latency: 160 msec (68-173 msec ~162 msec)
> HCI Event: Disconnect Complete (0x05) plen 4            #156 [hci1] 12.994872
        Status: Success (0x00)
        Handle: 2685 Address: DF:A9:FF:F6:B1:1A (OUI DF-A9-FF)
        Reason: Remote User Terminated Connection (0x13)
< HCI Command: Reset (0x03|0x0003) plen 0                 #157 [hci1] 18.613726
> HCI Event: Command Complete (0x0e) plen 4               #158 [hci1] 18.614207
      Reset (0x03|0x0003) ncmd 1
        Status: Success (0x00)
@ USER Close: main                                    {0x0001} [hci1] 18.633553
= Close Index: 00:00:00:00:00:00                               [hci1] 18.637434
