Bluetooth monitor ver 5.72
= Note: Linux version 6.14.0-36-generic (x86_64)                       0.699038
= Note: Bluetooth subsystem version 2.22                               0.699040
= New Index: 00:00:00:00:00:00 (Primary,UART,hci2)              [hci2] 0.699041
= New Index: 00:00:00:00:00:00 (Primary,UART,hci1)              [hci1] 0.699042
= New Index: 48:5F:99:8E:E0:64 (Primary,USB,hci0)               [hci0] 0.699042
= Open Index: 00:00:00:00:00:00                                 [hci1] 1.212480
= Index Info: 00:00:00:00:00:00 (Nordic Semiconductor ASA)      [hci1] 1.212489
@ USER Open: main (privileged) version 2.22            {0x0001} [hci1] 1.212495
< HCI Command: Reset (0x03|0x0003) plen 0                    #1 [hci1] 1.213241
> HCI Event: Command Complete (0x0e) plen 4                  #2 [hci1] 1.213744
      Reset (0x03|0x0003) ncmd 1
        Status: Success (0x00)
< HCI Command: Read Local Supported... (0x04|0x0003) plen 0  #3 [hci1] 1.232298
> HCI Event: Command Complete (0x0e) plen 12                 #4 [hci1] 1.232906
      Read Local Supported Features (0x04|0x0003) ncmd 1
        Status: Success (0x00)
        Features: 0x00 0x00 0x00 0x00 0x60 0x00 0x00 0x00
          BR/EDR Not Supported
          LE Supported (Controller)
< HCI Command: Read Local Version In.. (0x04|0x0001) plen 0  #5 [hci1] 1.252215
> HCI Event: Command Complete (0x0e) plen 12                 #6 [hci1] 1.252794
      Read Local Version Information (0x04|0x0001) ncmd 1
        Status: Success (0x00)
        HCI version: Reserved (0x0f) - Revision 12393 (0x3069)
        LMP version: Reserved (0x0f) - Subversion 12393 (0x3069)
        Manufacturer: Nordic Semiconductor ASA (89)
< HCI Command: Read Local Supported... (0x04|0x0002) plen 0  #7 [hci1] 1.272317
> HCI Event: Command Complete (0x0e) plen 68                 #8 [hci1] 1.273366
      Read Local Supported Commands (0x04|0x0002) ncmd 1
        Status: Success (0x00)
        Commands: 119 entries
          Disconnect (Octet 0 - Bit 5)
          Read Remote Version Information (Octet 2 - Bit 7)
          Set Event Mask (Octet 5 - Bit 6)
          Reset (Octet 5 - Bit 7)
          Read Connection Accept Timeout (Octet 7 - Bit 2)
          Write Connection Accept Timeout (Octet 7 - Bit 3)
          Read Transmit Power Level (Octet 10 - Bit 2)
          Set Controller To Host Flow Control (Octet 10 - Bit 5)
          Host Buffer Size (Octet 10 - Bit 6)
          Host Number of Completed Packets (Octet 10 - Bit 7)
          Read Local Version Information (Octet 14 - Bit 3)
          Read Local Supported Features (Octet 14 - Bit 5)
          Read BD ADDR (Octet 15 - Bit 1)
          Read RSSI (Octet 15 - Bit 5)
          Set Event Mask Page 2 (Octet 22 - Bit 2)
          LE Set Event Mask (Octet 25 - Bit 0)
          LE Read Buffer Size (Octet 25 - Bit 1)
          LE Read Local Supported Features (Octet 25 - Bit 2)
          LE Set Random Address (Octet 25 - Bit 4)
          LE Set Advertising Parameters (Octet 25 - Bit 5)
          LE Read Advertising Channel TX Power (Octet 25 - Bit 6)
          LE Set Advertising Data (Octet 25 - Bit 7)
          LE Set Scan Response Data (Octet 26 - Bit 0)
          LE Set Advertise Enable (Octet 26 - Bit 1)
          LE Set Scan Parameters (Octet 26 - Bit 2)
          LE Set Scan Enable (Octet 26 - Bit 3)
          LE Create Connection (Octet 26 - Bit 4)
          LE Create Connection Cancel (Octet 26 - Bit 5)
          LE Read Accept List Size (Octet 26 - Bit 6)
          LE Clear Accept List (Octet 26 - Bit 7)
          LE Add Device To Accept List (Octet 27 - Bit 0)
          LE Remove Device From Accept List (Octet 27 - Bit 1)
          LE Connection Update (Octet 27 - Bit 2)
          LE Set Host Channel Classification (Octet 27 - Bit 3)
          LE Read Channel Map (Octet 27 - Bit 4)
          LE Read Remote Used Features (Octet 27 - Bit 5)
          LE Encrypt (Octet 27 - Bit 6)
          LE Rand (Octet 27 - Bit 7)
          LE Start Encryption (Octet 28 - Bit 0)
          LE Long Term Key Request Reply (Octet 28 - Bit 1)
          LE Long Term Key Request Neg Reply (Octet 28 - Bit 2)
          LE Read Supported States (Octet 28 - Bit 3)
          LE Receiver Test (Octet 28 - Bit 4)
          LE Transmitter Test (Octet 28 - Bit 5)
          LE Test End (Octet 28 - Bit 6)
          Read Authenticated Payload Timeout (Octet 32 - Bit 4)
          Write Authenticated Payload Timeout (Octet 32 - Bit 5)
          LE Set Data Length (Octet 33 - Bit 6)
          LE Read Suggested Default Data Length (Octet 33 - Bit 7)
          LE Write Suggested Default Data Length (Octet 34 - Bit 0)
          LE Add Device To Resolving List (Octet 34 - Bit 3)
          LE Remove Device From Resolving List (Octet 34 - Bit 4)
          LE Clear Resolving List (Octet 34 - Bit 5)
          LE Read Resolving List Size (Octet 34 - Bit 6)
          LE Set Address Resolution Enable (Octet 35 - Bit 1)
          LE Set Resolvable Private Address Timeout (Octet 35 - Bit 2)
          LE Read Maximum Data Length (Octet 35 - Bit 3)
          LE Read PHY (Octet 35 - Bit 4)
          LE Set Default PHY (Octet 35 - Bit 5)
          LE Set PHY (Octet 35 - Bit 6)
          LE Enhanced Receiver Test (Octet 35 - Bit 7)
          LE Enhanced Transmitter Test (Octet 36 - Bit 0)
          LE Set Advertising Set Random Address (Octet 36 - Bit 1)
          LE Set Extended Advertising Parameters (Octet 36 - Bit 2)
          LE Set Extended Advertising Data (Octet 36 - Bit 3)
          LE Set Extended Scan Response Data (Octet 36 - Bit 4)
          LE Set Extended Advertising Enable (Octet 36 - Bit 5)
          LE Read Maximum Advertising Data Length (Octet 36 - Bit 6)
          LE Read Number of Supported Advertising Sets (Octet 36 - Bit 7)
          LE Remove Advertising Set (Octet 37 - Bit 0)
          LE Clear Advertising Sets (Octet 37 - Bit 1)
          LE Set Periodic Advertising Parameters (Octet 37 - Bit 2)
          LE Set Periodic Advertising Data (Octet 37 - Bit 3)
          LE Set Periodic Advertising Enable (Octet 37 - Bit 4)
          LE Set Extended Scan Parameters (Octet 37 - Bit 5)
          LE Set Extended Scan Enable (Octet 37 - Bit 6)
          LE Extended Create Connection (Octet 37 - Bit 7)
          LE Periodic Advertising Create Sync (Octet 38 - Bit 0)
          LE Periodic Advertising Create Sync Cancel (Octet 38 - Bit 1)
          LE Periodic Advertising Terminate Sync (Octet 38 - Bit 2)
          LE Add Device To Periodic Advertiser List (Octet 38 - Bit 3)
          LE Remove Device From Periodic Advertiser List (Octet 38 - Bit 4)
          LE Clear Periodic Advertiser List (Octet 38 - Bit 5)
          LE Read Periodic Advertiser List Size (Octet 38 - Bit 6)
          LE Read Transmit Power (Octet 38 - Bit 7)
          LE Read RF Path Compensation (Octet 39 - Bit 0)
          LE Write RF Path Compensation (Octet 39 - Bit 1)
          LE Set Privacy Mode (Octet 39 - Bit 2)
          LE Periodic Advertising Receive Enable (Octet 40 - Bit 5)
          LE Periodic Advertising Sync Transfer (Octet 40 - Bit 6)
          LE Periodic Advertising Set Info Transfer (Octet 40 - Bit 7)
          LE Periodic Advertising Sync Transfer Parameters (Octet 41 - Bit 0)
          LE Set Default Periodic Advertisng Sync Transfer Parameters (Octet 41 - Bit 1)
          LE Read Buffer v2 (Octet 41 - Bit 5)
          LE Read ISO TX Sync (Octet 41 - Bit 6)
          LE Set Connected Isochronous Group Parameters (Octet 41 - Bit 7)
          LE Set Connected Isochronous Group Parameters Test (Octet 42 - Bit 0)
          LE Create Connected Isochronous Stream (Octet 42 - Bit 1)
          LE Remove Connected Isochronous Group (Octet 42 - Bit 2)
          LE Accept Connected Isochronous Stream Request (Octet 42 - Bit 3)
          LE Reject Connected Isochronous Stream Request (Octet 42 - Bit 4)
          LE Create Broadcast Isochronous Group (Octet 42 - Bit 5)
          LE Create Broadcast Isochronous Group Test (Octet 42 - Bit 6)
          LE Terminate Broadcast Isochronous Group (Octet 42 - Bit 7)
          LE Broadcast Isochronous Group Create Sync (Octet 43 - Bit 0)
          LE Broadcast Isochronous Group Terminate Sync (Octet 43 - Bit 1)
          LE Request Peer SCA (Octet 43 - Bit 2)
          LE Setup Isochronous Data Path (Octet 43 - Bit 3)
          LE Remove Isochronous Data Path (Octet 43 - Bit 4)
          LE Isochronous Transmit Test (Octet 43 - Bit 5)
          LE Isochronous Receive Test (Octet 43 - Bit 6)
          LE Isochronous Read Test Counters (Octet 43 - Bit 7)
          LE Isochronous Read Test Counters (Octet 44 - Bit 0)
          LE Set Host Feature (Octet 44 - Bit 1)
          Octet 44 - Bit 2 
          Octet 45 - Bit 6 
          Octet 46 - Bit 0 
          Octet 46 - Bit 1 
          Octet 46 - Bit 2 
< HCI Command: Host Buffer Size (0x03|0x0033) plen 7         #9 [hci1] 1.292313
        ACL MTU: 255  ACL max packet: 16
        SCO MTU: 0    SCO max packet: 0
> HCI Event: Command Complete (0x0e) plen 4                 #10 [hci1] 1.292909
      Host Buffer Size (0x03|0x0033) ncmd 1
        Status: Success (0x00)
< HCI Command: Set Controller To Ho.. (0x03|0x0031) plen 1  #11 [hci1] 1.312243
        Flow control: ACL Data Packets (0x01)
> HCI Event: Command Complete (0x0e) plen 4                 #12 [hci1] 1.312854
      Set Controller To Host Flow Control (0x03|0x0031) ncmd 1
        Status: Success (0x00)
< HCI Command: LE Read Local Suppor.. (0x08|0x0003) plen 0  #13 [hci1] 1.332245
> HCI Event: Command Complete (0x0e) plen 12                #14 [hci1] 1.332824
      LE Read Local Supported Features (0x08|0x0003) ncmd 1
        Status: Success (0x00)
        Features: 0xfd 0x79 0x00 0xf7 0x30 0x01 0x00 0x00
          LE Encryption
          Extended Reject Indication
          Peripheral-initiated Features Exchange
          LE Ping
          LE Data Packet Length Extension
          LL Privacy
          Extended Scanner Filter Policies
          LE 2M PHY
          LE Coded PHY
          LE Extended Advertising
          LE Periodic Advertising
          Channel Selection Algorithm #2
          Periodic Advertising Sync Transfer - Sender
          Periodic Advertising Sync Transfer - Recipient
          Sleep Clock Accuracy Updates
          Connected Isochronous Stream - Central
          Connected Isochronous Stream - Peripheral
          Isochronous Broadcaster
          Synchronized Receiver
          Periodic Advertising ADI support
          Connection Subrating
          Unknown features (0x0000010000000000)
< HCI Command: LE Set Host Feature (0x08|0x0074) plen 2     #15 [hci1] 1.352277
        Bit Number: 32
          Connected Isochronous Stream (Host Support)
        Bit Value: 1
> HCI Event: Command Complete (0x0e) plen 4                 #16 [hci1] 1.352827
      LE Set Host Feature (0x08|0x0074) ncmd 1
        Status: Success (0x00)
< HCI Command: LE Read Buffer v2 (0x08|0x0060) plen 0       #17 [hci1] 1.372269
> HCI Event: Command Complete (0x0e) plen 10                #18 [hci1] 1.372769
      LE Read Buffer v2 (0x08|0x0060) ncmd 1
        Status: Success (0x00)
        ACL MTU: 27
        ACL max packet: 3
        ISO MTU: 318
        ISO max packet: 3
< HCI Command: LE Read Maximum Adve.. (0x08|0x003a) plen 0  #19 [hci1] 1.392333
> HCI Event: Command Complete (0x0e) plen 6                 #20 [hci1] 1.392933
      LE Read Maximum Advertising Data Length (0x08|0x003a) ncmd 1
        Status: Success (0x00)
        Max length: 1650
< HCI Command: LE Read Supported St.. (0x08|0x001c) plen 0  #21 [hci1] 1.412321
> HCI Event: Command Complete (0x0e) plen 12                #22 [hci1] 1.412885
      LE Read Supported States (0x08|0x001c) ncmd 1
        Status: Success (0x00)
        States: 0x000003ff3e0306ff
          Non-connectable Advertising State
          Scannable Advertising State
          Connectable Advertising State
          High Duty Cycle Directed Advertising State
          Passive Scanning State
          Active Scanning State
          Initiating State
            and Connection State (Central Role)
          Connection State (Peripheral Role)
          Scannable Advertising State
            and Passive Scanning State
          Connectable Advertising State
            and Passive Scanning State
          Non-connectable Advertising State
            and Initiating State
          Scannable Advertising State
            and Initiating State
          Active Scanning State
            and Connection State (Central Role)
          Passive Scanning State
            and Connection State (Peripheral Role)
          Active Scanning State
            and Connection State (Peripheral Role)
          Initiating State
            and Connection State (Central Role)
            and Central Role & Central Role
          Low Duty Cycle Directed Advertising State
          Connectable Advertising State
            and Initiating State
            and Central Role & Peripheral Role
          High Duty Cycle Directed Advertising State
            and Initiating State
            and Central Role & Peripheral Role
          Low Duty Cycle Directed Advertising State
            and Initiating State
            and Central Role & Peripheral Role
          Connectable Advertising State
            and Connection State (Central Role)
            and Central Role & Peripheral Role
          High Duty Cycle Directed Advertising State
            and Connection State (Central Role)
            and Central Role & Peripheral Role
          Low Duty Cycle Directed Advertising State
            and Connection State (Central Role)
            and Central Role & Peripheral Role
          Connectable Advertising State
            and Connection State (Peripheral Role)
            and Central Role & Peripheral Role
          High Duty Cycle Directed Advertising State
            and Connection State (Peripheral Role)
            and Peripheral Role & Peripheral Role
          Low Duty Cycle Directed Advertising State
            and Connection State (Peripheral Role)
            and Peripheral Role & Peripheral Role
          Initiating State
            and Connection State (Peripheral Role)
            and Central Role & Peripheral Role
< HCI Command: LE Read Maximum Data.. (0x08|0x002f) plen 0  #23 [hci1] 1.432175
> HCI Event: Command Complete (0x0e) plen 12                #24 [hci1] 1.432732
      LE Read Maximum Data Length (0x08|0x002f) ncmd 1
        Status: Success (0x00)
        Max TX octets: 251
        Max TX time: 2704
        Max RX octets: 251
        Max RX time: 2704
< HCI Command: LE Write Suggested D.. (0x08|0x0024) plen 4  #25 [hci1] 1.452237
        TX octets: 251
        TX time: 2704
> HCI Event: Command Complete (0x0e) plen 4                 #26 [hci1] 1.452719
      LE Write Suggested Default Data Length (0x08|0x0024) ncmd 1
        Status: Success (0x00)
< HCI Command: LE Read Resolving Li.. (0x08|0x002a) plen 0  #27 [hci1] 1.472184
> HCI Event: Command Complete (0x0e) plen 5                 #28 [hci1] 1.472606
      LE Read Resolving List Size (0x08|0x002a) ncmd 1
        Status: Success (0x00)
        Size: 8
< HCI Command: LE Set Event Mask (0x08|0x0001) plen 8       #29 [hci1] 1.492231
        Mask: 0x000002023f87fa5e
          LE Advertising Report
          LE Connection Update Complete
          LE Read Remote Used Features Complete
          LE Long Term Key Request
          LE Data Length Change
          LE Enhanced Connection Complete
          LE PHY Update Complete
          LE Extended Advertising Report
          LE Periodic Advertising Sync Established
          LE Periodic Advertising Report
          LE Periodic Advertising Sync Lost
          LE Extended Scan Timeout
          LE Extended Advertising Set Terminated
          LE Scan Request Received
          LE Periodic Advertising Sync Transfer Rvc
          LE CIS Established
          LE CIS Request
          LE Create BIG Complete
          LE Terminate BIG Complete
          LE BIG Sync Estabilished Complete
          LE BIG Sync Lost
          LE BIG Info Advertising Report
          Unknown mask (0x0000020000000000)
> HCI Event: Command Complete (0x0e) plen 4                 #30 [hci1] 1.492749
      LE Set Event Mask (0x08|0x0001) ncmd 1
        Status: Success (0x00)
< HCI Command: Set Event Mask (0x03|0x0001) plen 8          #31 [hci1] 1.512233
        Mask: 0x2000800002008890
          Disconnection Complete
          Encryption Change
          Read Remote Version Information Complete
          Hardware Error
          Data Buffer Overflow
          Encryption Key Refresh Complete
          LE Meta
> HCI Event: Command Complete (0x0e) plen 4                 #32 [hci1] 1.512844
      Set Event Mask (0x03|0x0001) ncmd 1
        Status: Success (0x00)
< HCI Command: Read BD ADDR (0x04|0x0009) plen 0            #33 [hci1] 1.532226
> HCI Event: Command Complete (0x0e) plen 10                #34 [hci1] 1.532748
      Read BD ADDR (0x04|0x0009) ncmd 1
        Status: Success (0x00)
        Address: 00:00:00:00:00:00 (OUI 00-00-00)
< HCI Command: LE Set Random Address (0x08|0x0005) plen 6   #35 [hci1] 1.552294
        Address: D5:B6:CC:31:DB:3B (Static)
> HCI Event: Command Complete (0x0e) plen 4                 #36 [hci1] 1.552875
      LE Set Random Address (0x08|0x0005) ncmd 1
        Status: Success (0x00)
< HCI Command: LE Set Extended Adv.. (0x08|0x0036) plen 25  #37 [hci1] 5.812432
        Handle: 0x00
        Properties: 0x0013
          Connectable
          Scannable
          Use legacy advertising PDUs: ADV_IND
        Min advertising interval: 100.000 msec (0x00a0)
        Max advertising interval: 150.000 msec (0x00f0)
        Channel map: 37, 38, 39 (0x07)
        Own address type: Random (0x01)
        Peer address type: Public (0x00)
        Peer address: 00:00:00:00:00:00 (OUI 00-00-00)
        Filter policy: Allow Scan Request from Any, Allow Connect Request from Any (0x00)
        TX power: Host has no preference (0x7f)
        Primary PHY: LE 1M (0x01)
        Secondary max skip: 0x00
        Secondary PHY: LE 1M (0x01)
        SID: 0x00
        Scan request notifications: Disabled (0x00)
> HCI Event: Command Complete (0x0e) plen 5                 #38 [hci1] 5.813358
      LE Set Extended Advertising Parameters (0x08|0x0036) ncmd 1
        Status: Success (0x00)
        TX power (selected): 0 dbm (0x00)
< HCI Command: LE Set Advertising S.. (0x08|0x0035) plen 7  #39 [hci1] 5.832297
        Advertising handle: 0x00
        Advertising random address: D5:B6:CC:31:DB:3B (Static)
> HCI Event: Command Complete (0x0e) plen 4                 #40 [hci1] 5.832952
      LE Set Advertising Set Random Address (0x08|0x0035) ncmd 1
        Status: Success (0x00)
< HCI Command: LE Set Extended Adv.. (0x08|0x0037) plen 22  #41 [hci1] 5.852310
        Handle: 0x00
        Operation: Complete extended advertising data (0x03)
        Fragment preference: Minimize fragmentation (0x01)
        Data length: 0x12
        Flags: 0x06
          LE General Discoverable Mode
          BR/EDR Not Supported
        Name (complete): Tester_F6B11A
> HCI Event: Command Complete (0x0e) plen 4                 #42 [hci1] 5.853061
      LE Set Extended Advertising Data (0x08|0x0037) ncmd 1
        Status: Success (0x00)
< HCI Command: LE Set Extended Scan.. (0x08|0x0038) plen 4  #43 [hci1] 5.872329
        Handle: 0x00
        Operation: Complete scan response data (0x03)
        Fragment preference: Minimize fragmentation (0x01)
        Data length: 0x00
> HCI Event: Command Complete (0x0e) plen 4                 #44 [hci1] 5.872971
      LE Set Extended Scan Response Data (0x08|0x0038) ncmd 1
        Status: Success (0x00)
< HCI Command: LE Set Extended Adve.. (0x08|0x0039) plen 6  #45 [hci1] 5.892368
        Extended advertising: Enabled (0x01)
        Number of sets: 1 (0x01)
        Entry 0
          Handle: 0x00
          Duration: 0 ms (0x00)
          Max ext adv events: 0
> HCI Event: Command Complete (0x0e) plen 4                 #46 [hci1] 5.893018
      LE Set Extended Advertising Enable (0x08|0x0039) ncmd 1
        Status: Success (0x00)
> HCI Event: LE Meta Event (0x3e) plen 31                   #47 [hci1] 6.217047
      LE Enhanced Connection Complete (0x0a)
        Status: Success (0x00)
        Handle: 1569
        Role: Peripheral (0x01)
        Peer address type: Public (0x00)
        Peer address: DF:A9:FF:F6:B1:1A (OUI DF-A9-FF)
        Local resolvable private address: 00:00:00:00:00:00 (Non-Resolvable)
        Peer resolvable private address: 00:00:00:00:00:00 (Non-Resolvable)
        Connection interval: 87.50 msec (0x0046)
        Connection latency: 0 (0x0000)
        Supervision timeout: 20000 msec (0x07d0)
        Central clock accuracy: 0x01
> HCI Event: LE Meta Event (0x3e) plen 6                    #48 [hci1] 6.217049
      LE Advertising Set Terminated (0x12)
        Status: Success (0x00)
        Handle: 0
        Connection handle: 1569
        Number of completed extended advertising events: 0
< HCI Command: LE Read Remote Used... (0x08|0x0016) plen 2  #49 [hci1] 6.232553
        Handle: 1569 Address: DF:A9:FF:F6:B1:1A (OUI DF-A9-FF)
> HCI Event: Command Status (0x0f) plen 4                   #50 [hci1] 6.232972
      LE Read Remote Used Features (0x08|0x0016) ncmd 1
        Status: Success (0x00)
> HCI Event: LE Meta Event (0x3e) plen 12                   #51 [hci1] 6.480821
      LE Read Remote Used Features (0x04)
        Status: Success (0x00)
        Handle: 1569 Address: DF:A9:FF:F6:B1:1A (OUI DF-A9-FF)
        Features: 0x2d 0x49 0x00 0xf7 0x67 0xd8 0x00 0x00
          LE Encryption
          Extended Reject Indication
          Peripheral-initiated Features Exchange
          LE Data Packet Length Extension
          LE 2M PHY
          LE Coded PHY
          Channel Selection Algorithm #2
          Periodic Advertising Sync Transfer - Sender
          Periodic Advertising Sync Transfer - Recipient
          Sleep Clock Accuracy Updates
          Connected Isochronous Stream - Central
          Connected Isochronous Stream - Peripheral
          Isochronous Broadcaster
          Synchronized Receiver
          Connected Isochronous Stream (Host Support)
          LE Power Control Request
          LE Power Control Request
          Connection Subrating
          Connection Subrating (Host Support)
          Unknown features (0x0000d80000000000)
< ACL Data TX: Handle 1569 flags 0x00 dlen 16              #52 [hci1] 11.242452
      LE L2CAP: Connection Parameter Update Request (0x12) ident 1 len 8
        Min interval: 24
        Max interval: 40
        Peripheral latency: 0
        Timeout multiplier: 42
> HCI Event: Number of Completed Packets (0x13) plen 5     #53 [hci1] 11.380371
        Num handles: 1
        Handle: 1569 Address: DF:A9:FF:F6:B1:1A (OUI DF-A9-FF)
        Count: 1
        #52: len 16 (0 Kb/s)
        Latency: 137 msec (137-137 msec ~137 msec)
> ACL Data RX: Handle 1569 flags 0x02 dlen 10              #54 [hci1] 11.380625
      LE L2CAP: Connection Parameter Update Response (0x13) ident 1 len 2
        Result: Connection Parameters accepted (0x0000)
< HCI Command: Host Number of Comp.. (0x03|0x0035) plen 5  #55 [hci1] 11.393136
        Num handles: 1
        Handle: 1569 Address: DF:A9:FF:F6:B1:1A (OUI DF-A9-FF)
        Count: 1
> ACL Data RX: Handle 1569 flags 0x02 dlen 11              #56 [hci1] 14.005405
      SMP: Pairing Request (0x01) len 6
        IO capability: KeyboardDisplay (0x04)
        OOB data: Authentication data not present (0x00)
        Authentication requirement: Bonding, No MITM, SC, No Keypresses (0x09)
        Max encryption key size: 16
        Initiator key distribution: EncKey IdKey Sign (0x07)
        Responder key distribution: EncKey IdKey Sign (0x07)
< HCI Command: Host Number of Comp.. (0x03|0x0035) plen 5  #57 [hci1] 14.013004
        Num handles: 1
        Handle: 1569 Address: DF:A9:FF:F6:B1:1A (OUI DF-A9-FF)
        Count: 1
< ACL Data TX: Handle 1569 flags 0x00 dlen 11              #58 [hci1] 14.013222
      SMP: Pairing Response (0x02) len 6
        IO capability: NoInputNoOutput (0x03)
        OOB data: Authentication data not present (0x00)
        Authentication requirement: Bonding, No MITM, SC, No Keypresses (0x09)
        Max encryption key size: 16
        Initiator key distribution: IdKey (0x02)
        Responder key distribution: <none> (0x00)
> HCI Event: Number of Completed Packets (0x13) plen 5     #59 [hci1] 14.180440
        Num handles: 1
        Handle: 1569 Address: DF:A9:FF:F6:B1:1A (OUI DF-A9-FF)
        Count: 1
        #58: len 11 (0 Kb/s)
        Latency: 167 msec (137-167 msec ~152 msec)
> ACL Data RX: Handle 1569 flags 0x02 dlen 27              #60 [hci1] 14.180734
> ACL Data RX: Handle 1569 flags 0x01 dlen 27              #61 [hci1] 14.181329
> ACL Data RX: Handle 1569 flags 0x01 dlen 15              #62 [hci1] 14.181691
      SMP: Pairing Public Key (0x0c) len 64
        X: fb6e9894465290a6f62868d7ec8d48c95286fce2e9ab32e347c22576a4695d17
        Y: ce615025348f624b3f195c0b835717564a756cf1861d4b69d289e128d3e93567
< HCI Command: Host Number of Comp.. (0x03|0x0035) plen 5  #63 [hci1] 14.193564
        Num handles: 1
        Handle: 1569 Address: DF:A9:FF:F6:B1:1A (OUI DF-A9-FF)
        Count: 1
< HCI Command: Host Number of Comp.. (0x03|0x0035) plen 5  #64 [hci1] 14.193847
        Num handles: 1
        Handle: 1569 Address: DF:A9:FF:F6:B1:1A (OUI DF-A9-FF)
        Count: 1
< HCI Command: Host Number of Comp.. (0x03|0x0035) plen 5  #65 [hci1] 14.194296
        Num handles: 1
        Handle: 1569 Address: DF:A9:FF:F6:B1:1A (OUI DF-A9-FF)
        Count: 1
< ACL Data TX: Handle 1569 flags 0x00 dlen 27              #66 [hci1] 14.194497
< ACL Data TX: Handle 1569 flags 0x01 dlen 27              #67 [hci1] 14.194517
< ACL Data TX: Handle 1569 flags 0x01 dlen 15              #68 [hci1] 14.194552
      SMP: Pairing Public Key (0x0c) len 64
        X: 98308440221e2d910f0e54b71e7ec652857aa9b5a0dc65028824cc19db1226e9
        Y: 67a4816bcb62efb21701e31fdb27561a6217575fb007a8bbdabe7e28b6f68482
> HCI Event: Number of Completed Packets (0x13) plen 5     #69 [hci1] 14.268298
        Num handles: 1
        Handle: 1569 Address: DF:A9:FF:F6:B1:1A (OUI DF-A9-FF)
        Count: 1
        #66: len 27 (2 Kb/s)
        Latency: 73 msec (73-167 msec ~113 msec)
> HCI Event: Number of Completed Packets (0x13) plen 5     #70 [hci1] 14.269038
        Num handles: 1
        Handle: 1569 Address: DF:A9:FF:F6:B1:1A (OUI DF-A9-FF)
        Count: 1
        #67: len 27 (2 Kb/s)
        Latency: 74 msec (73-167 msec ~93 msec)
< ACL Data TX: Handle 1569 flags 0x00 dlen 21              #71 [hci1] 14.272488
      SMP: Pairing Confirm (0x03) len 16
        Confim value: e36922c43df193c9eeadbb8fe48c00dd
> HCI Event: Number of Completed Packets (0x13) plen 5     #72 [hci1] 14.355246
        Num handles: 1
        Handle: 1569 Address: DF:A9:FF:F6:B1:1A (OUI DF-A9-FF)
        Count: 1
        #68: len 15 (0 Kb/s)
        Latency: 160 msec (73-167 msec ~127 msec)
> HCI Event: Number of Completed Packets (0x13) plen 5     #73 [hci1] 14.442889
        Num handles: 1
        Handle: 1569 Address: DF:A9:FF:F6:B1:1A (OUI DF-A9-FF)
        Count: 1
        #71: len 21 (0 Kb/s)
        Latency: 170 msec (73-170 msec ~148 msec)
> ACL Data RX: Handle 1569 flags 0x02 dlen 21              #74 [hci1] 14.443366
      SMP: Pairing Random (0x04) len 16
        Random value: adb8de8629b9847a0000000000000000
< HCI Command: Host Number of Comp.. (0x03|0x0035) plen 5  #75 [hci1] 14.453196
        Num handles: 1
        Handle: 1569 Address: DF:A9:FF:F6:B1:1A (OUI DF-A9-FF)
        Count: 1
< ACL Data TX: Handle 1569 flags 0x00 dlen 21              #76 [hci1] 14.453365
      SMP: Pairing Random (0x04) len 16
        Random value: 8e6108f966a694cbe26df70bb96773e6
> HCI Event: Number of Completed Packets (0x13) plen 5     #77 [hci1] 14.617593
        Num handles: 1
        Handle: 1569 Address: DF:A9:FF:F6:B1:1A (OUI DF-A9-FF)
        Count: 1
        #76: len 21 (1 Kb/s)
        Latency: 164 msec (73-170 msec ~156 msec)
> ACL Data RX: Handle 1569 flags 0x02 dlen 21              #78 [hci1] 14.793115
      SMP: Pairing DHKey Check (0x0d) len 16
        E: 32c673c8a9e6d3b7bdabd131392ffa39
< HCI Command: Host Number of Comp.. (0x03|0x0035) plen 5  #79 [hci1] 14.813286
        Num handles: 1
        Handle: 1569 Address: DF:A9:FF:F6:B1:1A (OUI DF-A9-FF)
        Count: 1
< ACL Data TX: Handle 1569 flags 0x00 dlen 21              #80 [hci1] 14.813449
      SMP: Pairing DHKey Check (0x0d) len 16
        E: 58f31df07bd2ef386f3465845afeb760
> HCI Event: Number of Completed Packets (0x13) plen 5     #81 [hci1] 14.967625
        Num handles: 1
        Handle: 1569 Address: DF:A9:FF:F6:B1:1A (OUI DF-A9-FF)
        Count: 1
        #80: len 21 (1 Kb/s)
        Latency: 154 msec (73-170 msec ~155 msec)
> HCI Event: LE Meta Event (0x3e) plen 13                  #82 [hci1] 15.055791
      LE Long Term Key Request (0x05)
        Handle: 1569 Address: DF:A9:FF:F6:B1:1A (OUI DF-A9-FF)
        Random number: 0x0000000000000000
        Encrypted diversifier: 0x0000
< HCI Command: LE Long Term Key R.. (0x08|0x001a) plen 18  #83 [hci1] 15.072804
        Handle: 1569 Address: DF:A9:FF:F6:B1:1A (OUI DF-A9-FF)
        Long term key: 9ac818beb7a7a40e4865ee98a0aa911c
> HCI Event: Command Complete (0x0e) plen 6                #84 [hci1] 15.073528
      LE Long Term Key Request Reply (0x08|0x001a) ncmd 1
        Status: Success (0x00)
        Handle: 1569 Address: DF:A9:FF:F6:B1:1A (OUI DF-A9-FF)
> HCI Event: Encryption Change (0x08) plen 4               #85 [hci1] 15.493108
        Status: Success (0x00)
        Handle: 1569 Address: DF:A9:FF:F6:B1:1A (OUI DF-A9-FF)
        Encryption: Enabled with AES-CCM (0x01)
> ACL Data RX: Handle 1569 flags 0x02 dlen 21              #86 [hci1] 15.580588
      SMP: Identity Information (0x08) len 16
        Identity resolving key: cf2824070a6cb57d6d34d01527bb518e
< HCI Command: Host Number of Comp.. (0x03|0x0035) plen 5  #87 [hci1] 15.622628
        Num handles: 1
        Handle: 1569 Address: DF:A9:FF:F6:B1:1A (OUI DF-A9-FF)
        Count: 1
> ACL Data RX: Handle 1569 flags 0x02 dlen 12              #88 [hci1] 15.667932
      SMP: Identity Address Information (0x09) len 7
        Address: DF:A9:FF:F6:B1:1A (OUI DF-A9-FF)
> ACL Data RX: Handle 1569 flags 0x02 dlen 26              #89 [hci1] 15.668678
      LE L2CAP: Enhanced Credit Connection Request (0x17) ident 1 len 18
        PSM: 39 (0x0027)
        MTU: 64
        MPS: 64
        Credits: 5
        Source CID: 84
        Source CID: 83
        Source CID: 82
        Source CID: 81
        Source CID: 80
< HCI Command: LE Add Device To R.. (0x08|0x0027) plen 39  #90 [hci1] 15.672810
        Address type: Public (0x00)
        Address: DF:A9:FF:F6:B1:1A (OUI DF-A9-FF)
        Peer identity resolving key: cf2824070a6cb57d6d34d01527bb518e
        Local identity resolving key: 00000000000000000000000000000000
> HCI Event: Command Complete (0x0e) plen 4                #91 [hci1] 15.673757
      LE Add Device To Resolving List (0x08|0x0027) ncmd 1
        Status: Success (0x00)
< HCI Command: LE Set Privacy Mode (0x08|0x004e) plen 8    #92 [hci1] 15.692853
        Peer Identity address type: Public (0x00)
        Peer Identity address: DF:A9:FF:F6:B1:1A (OUI DF-A9-FF)
        Privacy Mode: Use Device Privacy (0x01)
> HCI Event: Command Complete (0x0e) plen 4                #93 [hci1] 15.693579
      LE Set Privacy Mode (0x08|0x004e) ncmd 1
        Status: Success (0x00)
< HCI Command: LE Set Address Reso.. (0x08|0x002d) plen 1  #94 [hci1] 15.712860
        Address resolution: Enabled (0x01)
> HCI Event: Command Complete (0x0e) plen 4                #95 [hci1] 15.713331
      LE Set Address Resolution Enable (0x08|0x002d) ncmd 1
        Status: Success (0x00)
< HCI Command: Host Number of Comp.. (0x03|0x0035) plen 5  #96 [hci1] 15.732573
        Num handles: 1
        Handle: 1569 Address: DF:A9:FF:F6:B1:1A (OUI DF-A9-FF)
        Count: 1
< HCI Command: Host Number of Comp.. (0x03|0x0035) plen 5  #97 [hci1] 15.732988
        Num handles: 1
        Handle: 1569 Address: DF:A9:FF:F6:B1:1A (OUI DF-A9-FF)
        Count: 1
< ACL Data TX: Handle 1569 flags 0x00 dlen 26              #98 [hci1] 15.733110
      LE L2CAP: Enhanced Credit Connection Response (0x18) ident 1 len 18
        MTU: 249
        MPS: 251
        Credits: 1
        Result: Connection successful (0x0000)
        Destination CID: 64
        Destination CID: 65
        Destination CID: 66
        Destination CID: 67
        Destination CID: 68
> HCI Event: Number of Completed Packets (0x13) plen 5     #99 [hci1] 15.842776
        Num handles: 1
        Handle: 1569 Address: DF:A9:FF:F6:B1:1A (OUI DF-A9-FF)
        Count: 1
        #98: len 26 (1 Kb/s)
        Latency: 109 msec (73-170 msec ~132 msec)
< ACL Data TX: Handle 1569 flags 0x00 dlen 13             #100 [hci1] 18.322524
      Channel: 80 len 9 sdu 7 [PSM 39 mode Enhanced Credit (0x81)] {chan 4}
      ATT: Read By Type Request (0x08) len 6
        Handle range: 0x0060-0x0079
        Attribute type: Characteristic (0x2803)
> HCI Event: Number of Completed Packets (0x13) plen 5    #101 [hci1] 18.467784
        Num handles: 1
        Handle: 1569 Address: DF:A9:FF:F6:B1:1A (OUI DF-A9-FF)
        Count: 1
        #100: len 13 (0 Kb/s)
        Latency: 145 msec (73-170 msec ~138 msec)
        Channel: 80 [PSM 39 mode Enhanced Credit (0x81)] {chan 4}
        Channel Latency: 145 msec (145-145 msec ~145 msec)
> ACL Data RX: Handle 1569 flags 0x02 dlen 27             #102 [hci1] 18.468172
> ACL Data RX: Handle 1569 flags 0x01 dlen 27             #103 [hci1] 18.468684
> ACL Data RX: Handle 1569 flags 0x01 dlen 10             #104 [hci1] 18.469094
      Channel: 68 len 60 sdu 58 [PSM 39 mode Enhanced Credit (0x81)] {chan 4}
      ATT: Read By Type Response (0x09) len 57
        Attribute data length: 7
        Attribute data list: 8 entries
        Handle: 0x0061
        Value: 0262000945
            Properties: 0x02
              Read (0x02)
            Value Handle: 0x0062
            Value UUID: Unknown (0x4509)
        Handle: 0x0063
        Value: 026400232a
            Properties: 0x02
              Read (0x02)
            Value Handle: 0x0064
            Value UUID: System ID (0x2a23)
        Handle: 0x0065
        Value: 026600242a
            Properties: 0x02
              Read (0x02)
            Value Handle: 0x0066
            Value UUID: Model Number String (0x2a24)
        Handle: 0x0067
        Value: 026800252a
            Properties: 0x02
              Read (0x02)
            Value Handle: 0x0068
            Value UUID: Serial Number String (0x2a25)
        Handle: 0x0069
        Value: 026a00262a
            Properties: 0x02
              Read (0x02)
            Value Handle: 0x006a
            Value UUID: Firmware Revision String (0x2a26)
        Handle: 0x006b
        Value: 026c00272a
            Properties: 0x02
              Read (0x02)
            Value Handle: 0x006c
            Value UUID: Hardware Revision String (0x2a27)
        Handle: 0x006d
        Value: 026e00282a
            Properties: 0x02
              Read (0x02)
            Value Handle: 0x006e
            Value UUID: Software Revision String (0x2a28)
        Handle: 0x006f
        Value: 027000292a
            Properties: 0x02
              Read (0x02)
            Value Handle: 0x0070
            Value UUID: Manufacturer Name String (0x2a29)
< HCI Command: Host Number of Com.. (0x03|0x0035) plen 5  #105 [hci1] 18.472731
        Num handles: 1
        Handle: 1569 Address: DF:A9:FF:F6:B1:1A (OUI DF-A9-FF)
        Count: 1
< HCI Command: Host Number of Com.. (0x03|0x0035) plen 5  #106 [hci1] 18.472870
        Num handles: 1
        Handle: 1569 Address: DF:A9:FF:F6:B1:1A (OUI DF-A9-FF)
        Count: 1
< HCI Command: Host Number of Com.. (0x03|0x0035) plen 5  #107 [hci1] 18.473064
        Num handles: 1
        Handle: 1569 Address: DF:A9:FF:F6:B1:1A (OUI DF-A9-FF)
        Count: 1
< ACL Data TX: Handle 1569 flags 0x00 dlen 13             #108 [hci1] 18.473130
      Channel: 80 len 9 sdu 7 [PSM 39 mode Enhanced Credit (0x81)] {chan 4}
      ATT: Read By Type Request (0x08) len 6
        Handle range: 0x0070-0x0079
        Attribute type: Characteristic (0x2803)
< ACL Data TX: Handle 1569 flags 0x00 dlen 12             #109 [hci1] 18.473161
      LE L2CAP: LE Flow Control Credit (0x16) ident 2 len 4
        Source CID: 68
        Credits: 1
> HCI Event: Number of Completed Packets (0x13) plen 5    #110 [hci1] 18.555631
        Num handles: 1
        Handle: 1569 Address: DF:A9:FF:F6:B1:1A (OUI DF-A9-FF)
        Count: 1
        #108: len 13 (1 Kb/s)
        Latency: 82 msec (73-170 msec ~110 msec)
        Channel: 80 [PSM 39 mode Enhanced Credit (0x81)] {chan 4}
        Channel Latency: 82 msec (82-145 msec ~113 msec)
> HCI Event: Number of Completed Packets (0x13) plen 5    #111 [hci1] 18.642750
        Num handles: 1
        Handle: 1569 Address: DF:A9:FF:F6:B1:1A (OUI DF-A9-FF)
        Count: 1
        #109: len 12 (0 Kb/s)
        Latency: 169 msec (73-170 msec ~140 msec)
        Channel: 80 [PSM 39 mode Enhanced Credit (0x81)] {chan 4}
        Channel Latency: 169 msec (82-169 msec ~141 msec)
> ACL Data RX: Handle 1569 flags 0x02 dlen 27             #112 [hci1] 18.643177
> ACL Data RX: Handle 1569 flags 0x01 dlen 9              #113 [hci1] 18.643350
      Channel: 68 len 32 sdu 30 [PSM 39 mode Enhanced Credit (0x81)] {chan 4}
      ATT: Read By Type Response (0x09) len 29
        Attribute data length: 7
        Attribute data list: 4 entries
        Handle: 0x0071
        Value: 0272002a2a
            Properties: 0x02
              Read (0x02)
            Value Handle: 0x0072
            Value UUID: IEEE 11073-20601 Regulatory Cert. Data List (0x2a2a)
        Handle: 0x0073
        Value: 027400502a
            Properties: 0x02
              Read (0x02)
            Value Handle: 0x0074
            Value UUID: PnP ID (0x2a50)
        Handle: 0x0075
        Value: 0276002234
            Properties: 0x02
              Read (0x02)
            Value Handle: 0x0076
            Value UUID: Unknown (0x3422)
        Handle: 0x0078
        Value: 027900ff2b
            Properties: 0x02
              Read (0x02)
            Value Handle: 0x0079
            Value UUID: Unknown (0x2bff)
< HCI Command: Host Number of Com.. (0x03|0x0035) plen 5  #114 [hci1] 18.652741
        Num handles: 1
        Handle: 1569 Address: DF:A9:FF:F6:B1:1A (OUI DF-A9-FF)
        Count: 1
< HCI Command: Host Number of Com.. (0x03|0x0035) plen 5  #115 [hci1] 18.652876
        Num handles: 1
        Handle: 1569 Address: DF:A9:FF:F6:B1:1A (OUI DF-A9-FF)
        Count: 1
< ACL Data TX: Handle 1569 flags 0x00 dlen 13             #116 [hci1] 18.652980
      Channel: 80 len 9 sdu 7 [PSM 39 mode Enhanced Credit (0x81)] {chan 4}
      ATT: Read By Type Request (0x08) len 6
        Handle range: 0x0079-0x0079
        Attribute type: Characteristic (0x2803)
< ACL Data TX: Handle 1569 flags 0x00 dlen 12             #117 [hci1] 18.653081
      LE L2CAP: LE Flow Control Credit (0x16) ident 3 len 4
        Source CID: 68
        Credits: 1
> HCI Event: Number of Completed Packets (0x13) plen 5    #118 [hci1] 18.730606
        Num handles: 1
        Handle: 1569 Address: DF:A9:FF:F6:B1:1A (OUI DF-A9-FF)
        Count: 1
        #116: len 13 (1 Kb/s)
        Latency: 77 msec (73-170 msec ~108 msec)
        Channel: 80 [PSM 39 mode Enhanced Credit (0x81)] {chan 4}
        Channel Latency: 77 msec (77-169 msec ~109 msec)
> HCI Event: Number of Completed Packets (0x13) plen 5    #119 [hci1] 18.817612
        Num handles: 1
        Handle: 1569 Address: DF:A9:FF:F6:B1:1A (OUI DF-A9-FF)
        Count: 1
        #117: len 12 (0 Kb/s)
        Latency: 164 msec (73-170 msec ~136 msec)
> ACL Data RX: Handle 1569 flags 0x02 dlen 11             #120 [hci1] 18.817883
      Channel: 68 len 7 sdu 5 [PSM 39 mode Enhanced Credit (0x81)] {chan 4}
      ATT: Error Response (0x01) len 4
        Read By Type Request (0x08)
        Handle: 0x0079
        Error: Attribute Not Found (0x0a)
< HCI Command: Host Number of Com.. (0x03|0x0035) plen 5  #121 [hci1] 18.832834
        Num handles: 1
        Handle: 1569 Address: DF:A9:FF:F6:B1:1A (OUI DF-A9-FF)
        Count: 1
< ACL Data TX: Handle 1569 flags 0x00 dlen 12             #122 [hci1] 18.832863
      LE L2CAP: LE Flow Control Credit (0x16) ident 4 len 4
        Source CID: 68
        Credits: 1
> HCI Event: Number of Completed Packets (0x13) plen 5    #123 [hci1] 18.992498
        Num handles: 1
        Handle: 1569 Address: DF:A9:FF:F6:B1:1A (OUI DF-A9-FF)
        Count: 1
        #122: len 12 (0 Kb/s)
        Latency: 159 msec (73-170 msec ~148 msec)
        Channel: 80 [PSM 39 mode Enhanced Credit (0x81)] {chan 4}
        Channel Latency: 159 msec (77-169 msec ~134 msec)
> HCI Event: Disconnect Complete (0x05) plen 4            #124 [hci1] 21.355251
        Status: Success (0x00)
        Handle: 1569 Address: DF:A9:FF:F6:B1:1A (OUI DF-A9-FF)
        Reason: Remote User Terminated Connection (0x13)
< HCI Command: LE Set Extended A.. (0x08|0x0036) plen 25  #125 [hci1] 21.912521
        Handle: 0x00
        Properties: 0x0013
          Connectable
          Scannable
          Use legacy advertising PDUs: ADV_IND
        Min advertising interval: 100.000 msec (0x00a0)
        Max advertising interval: 150.000 msec (0x00f0)
        Channel map: 37, 38, 39 (0x07)
        Own address type: Random (0x01)
        Peer address type: Public (0x00)
        Peer address: 00:00:00:00:00:00 (OUI 00-00-00)
        Filter policy: Allow Scan Request from Any, Allow Connect Request from Any (0x00)
        TX power: Host has no preference (0x7f)
        Primary PHY: LE 1M (0x01)
        Secondary max skip: 0x00
        Secondary PHY: LE 1M (0x01)
        SID: 0x00
        Scan request notifications: Disabled (0x00)
> HCI Event: Command Complete (0x0e) plen 5               #126 [hci1] 21.913381
      LE Set Extended Advertising Parameters (0x08|0x0036) ncmd 1
        Status: Success (0x00)
        TX power (selected): 0 dbm (0x00)
< HCI Command: LE Set Advertising.. (0x08|0x0035) plen 7  #127 [hci1] 21.932444
        Advertising handle: 0x00
        Advertising random address: D5:B6:CC:31:DB:3B (Static)
> HCI Event: Command Complete (0x0e) plen 4               #128 [hci1] 21.933083
      LE Set Advertising Set Random Address (0x08|0x0035) ncmd 1
        Status: Success (0x00)
< HCI Command: LE Set Extended A.. (0x08|0x0037) plen 22  #129 [hci1] 21.952475
        Handle: 0x00
        Operation: Complete extended advertising data (0x03)
        Fragment preference: Minimize fragmentation (0x01)
        Data length: 0x12
        Flags: 0x06
          LE General Discoverable Mode
          BR/EDR Not Supported
        Name (complete): Tester_F6B11A
> HCI Event: Command Complete (0x0e) plen 4               #130 [hci1] 21.953404
      LE Set Extended Advertising Data (0x08|0x0037) ncmd 1
        Status: Success (0x00)
< HCI Command: LE Set Extended Sc.. (0x08|0x0038) plen 4  #131 [hci1] 21.972443
        Handle: 0x00
        Operation: Complete scan response data (0x03)
        Fragment preference: Minimize fragmentation (0x01)
        Data length: 0x00
> HCI Event: Command Complete (0x0e) plen 4               #132 [hci1] 21.972970
      LE Set Extended Scan Response Data (0x08|0x0038) ncmd 1
        Status: Success (0x00)
< HCI Command: LE Set Extended Ad.. (0x08|0x0039) plen 6  #133 [hci1] 21.992460
        Extended advertising: Enabled (0x01)
        Number of sets: 1 (0x01)
        Entry 0
          Handle: 0x00
          Duration: 0 ms (0x00)
          Max ext adv events: 0
> HCI Event: Command Complete (0x0e) plen 4               #134 [hci1] 21.993077
      LE Set Extended Advertising Enable (0x08|0x0039) ncmd 1
        Status: Success (0x00)
> HCI Event: LE Meta Event (0x3e) plen 31                 #135 [hci1] 22.527317
      LE Enhanced Connection Complete (0x0a)
        Status: Success (0x00)
        Handle: 1587
        Role: Peripheral (0x01)
        Peer address type: Public (0x00)
        Peer address: DF:A9:FF:F6:B1:1A (OUI DF-A9-FF)
        Local resolvable private address: 00:00:00:00:00:00 (Non-Resolvable)
        Peer resolvable private address: 00:00:00:00:00:00 (Non-Resolvable)
        Connection interval: 87.50 msec (0x0046)
        Connection latency: 0 (0x0000)
        Supervision timeout: 20000 msec (0x07d0)
        Central clock accuracy: 0x01
> HCI Event: LE Meta Event (0x3e) plen 6                  #136 [hci1] 22.527461
      LE Advertising Set Terminated (0x12)
        Status: Success (0x00)
        Handle: 0
        Connection handle: 1587
        Number of completed extended advertising events: 0
< HCI Command: LE Read Remote Use.. (0x08|0x0016) plen 2  #137 [hci1] 22.532658
        Handle: 1587 Address: DF:A9:FF:F6:B1:1A (OUI DF-A9-FF)
> HCI Event: Command Status (0x0f) plen 4                 #138 [hci1] 22.533251
      LE Read Remote Used Features (0x08|0x0016) ncmd 1
        Status: Success (0x00)
> HCI Event: LE Meta Event (0x3e) plen 12                 #139 [hci1] 22.791352
      LE Read Remote Used Features (0x04)
        Status: Success (0x00)
        Handle: 1587 Address: DF:A9:FF:F6:B1:1A (OUI DF-A9-FF)
        Features: 0x2d 0x49 0x00 0xf7 0x67 0xd8 0x00 0x00
          LE Encryption
          Extended Reject Indication
          Peripheral-initiated Features Exchange
          LE Data Packet Length Extension
          LE 2M PHY
          LE Coded PHY
          Channel Selection Algorithm #2
          Periodic Advertising Sync Transfer - Sender
          Periodic Advertising Sync Transfer - Recipient
          Sleep Clock Accuracy Updates
          Connected Isochronous Stream - Central
          Connected Isochronous Stream - Peripheral
          Isochronous Broadcaster
          Synchronized Receiver
          Connected Isochronous Stream (Host Support)
          LE Power Control Request
          LE Power Control Request
          Connection Subrating
          Connection Subrating (Host Support)
          Unknown features (0x0000d80000000000)
< ACL Data TX: Handle 1587 flags 0x00 dlen 16             #140 [hci1] 27.542935
      LE L2CAP: Connection Parameter Update Request (0x12) ident 5 len 8
        Min interval: 24
        Max interval: 40
        Peripheral latency: 0
        Timeout multiplier: 42
> HCI Event: Number of Completed Packets (0x13) plen 5    #141 [hci1] 27.690754
        Num handles: 1
        Handle: 1587 Address: DF:A9:FF:F6:B1:1A (OUI DF-A9-FF)
        Count: 1
        #140: len 16 (0 Kb/s)
        Latency: 147 msec (147-147 msec ~147 msec)
> ACL Data RX: Handle 1587 flags 0x02 dlen 10             #142 [hci1] 27.691007
      LE L2CAP: Connection Parameter Update Response (0x13) ident 5 len 2
        Result: Connection Parameters accepted (0x0000)
< HCI Command: Host Number of Com.. (0x03|0x0035) plen 5  #143 [hci1] 27.692988
        Num handles: 1
        Handle: 1587 Address: DF:A9:FF:F6:B1:1A (OUI DF-A9-FF)
        Count: 1
> HCI Event: LE Meta Event (0x3e) plen 13                 #144 [hci1] 30.403687
      LE Long Term Key Request (0x05)
        Handle: 1587 Address: DF:A9:FF:F6:B1:1A (OUI DF-A9-FF)
        Random number: 0x0000000000000000
        Encrypted diversifier: 0x0000
< HCI Command: LE Long Term Key... (0x08|0x001a) plen 18  #145 [hci1] 30.412986
        Handle: 1587 Address: DF:A9:FF:F6:B1:1A (OUI DF-A9-FF)
        Long term key: 9ac818beb7a7a40e4865ee98a0aa911c
> HCI Event: Command Complete (0x0e) plen 6               #146 [hci1] 30.413885
      LE Long Term Key Request Reply (0x08|0x001a) ncmd 1
        Status: Success (0x00)
        Handle: 1587 Address: DF:A9:FF:F6:B1:1A (OUI DF-A9-FF)
> HCI Event: Encryption Change (0x08) plen 4              #147 [hci1] 30.840975
        Status: Success (0x00)
        Handle: 1587 Address: DF:A9:FF:F6:B1:1A (OUI DF-A9-FF)
        Encryption: Enabled with AES-CCM (0x01)
> ACL Data RX: Handle 1587 flags 0x02 dlen 26             #148 [hci1] 30.928639
      LE L2CAP: Enhanced Credit Connection Request (0x17) ident 2 len 18
        PSM: 39 (0x0027)
        MTU: 64
        MPS: 64
        Credits: 5
        Source CID: 84
        Source CID: 83
        Source CID: 82
        Source CID: 81
        Source CID: 80
< HCI Command: Host Number of Com.. (0x03|0x0035) plen 5  #149 [hci1] 30.933201
        Num handles: 1
        Handle: 1587 Address: DF:A9:FF:F6:B1:1A (OUI DF-A9-FF)
        Count: 1
< ACL Data TX: Handle 1587 flags 0x00 dlen 26             #150 [hci1] 30.933420
      LE L2CAP: Enhanced Credit Connection Response (0x18) ident 2 len 18
        MTU: 249
        MPS: 251
        Credits: 1
        Result: Connection successful (0x0000)
        Destination CID: 64
        Destination CID: 65
        Destination CID: 66
        Destination CID: 67
        Destination CID: 68
> HCI Event: Number of Completed Packets (0x13) plen 5    #151 [hci1] 31.103000
        Num handles: 1
        Handle: 1587 Address: DF:A9:FF:F6:B1:1A (OUI DF-A9-FF)
        Count: 1
        #150: len 26 (1 Kb/s)
        Latency: 169 msec (147-169 msec ~158 msec)
< ACL Data TX: Handle 1587 flags 0x00 dlen 13             #152 [hci1] 33.623313
      Channel: 80 len 9 sdu 7 [PSM 39 mode Enhanced Credit (0x81)] {chan 9}
      ATT: Read By Type Request (0x08) len 6
        Handle range: 0x01f0-0x01f7
        Attribute type: Characteristic (0x2803)
> HCI Event: Number of Completed Packets (0x13) plen 5    #153 [hci1] 33.728343
        Num handles: 1
        Handle: 1587 Address: DF:A9:FF:F6:B1:1A (OUI DF-A9-FF)
        Count: 1
        #152: len 13 (0 Kb/s)
        Latency: 105 msec (105-169 msec ~131 msec)
        Channel: 80 [PSM 39 mode Enhanced Credit (0x81)] {chan 9}
        Channel Latency: 105 msec (105-105 msec ~105 msec)
> ACL Data RX: Handle 1587 flags 0x02 dlen 27             #154 [hci1] 33.728695
> ACL Data RX: Handle 1587 flags 0x01 dlen 2              #155 [hci1] 33.728696
      Channel: 68 len 25 sdu 23 [PSM 39 mode Enhanced Credit (0x81)] {chan 9}
      ATT: Read By Type Response (0x09) len 22
        Attribute data length: 7
        Attribute data list: 3 entries
        Handle: 0x01f1
        Value: 12f2012b2a
            Properties: 0x12
              Read (0x02)
              Notify (0x10)
            Value Handle: 0x01f2
            Value UUID: Current Time (0x2a2b)
        Handle: 0x01f4
        Value: 02f5010f2a
            Properties: 0x02
              Read (0x02)
            Value Handle: 0x01f5
            Value UUID: Local Time Information (0x2a0f)
        Handle: 0x01f6
        Value: 02f701142a
            Properties: 0x02
              Read (0x02)
            Value Handle: 0x01f7
            Value UUID: Reference Time Information (0x2a14)
< HCI Command: Host Number of Com.. (0x03|0x0035) plen 5  #156 [hci1] 33.732941
        Num handles: 1
        Handle: 1587 Address: DF:A9:FF:F6:B1:1A (OUI DF-A9-FF)
        Count: 1
< HCI Command: Host Number of Com.. (0x03|0x0035) plen 5  #157 [hci1] 33.733044
        Num handles: 1
        Handle: 1587 Address: DF:A9:FF:F6:B1:1A (OUI DF-A9-FF)
        Count: 1
< ACL Data TX: Handle 1587 flags 0x00 dlen 13             #158 [hci1] 33.733070
      Channel: 80 len 9 sdu 7 [PSM 39 mode Enhanced Credit (0x81)] {chan 9}
      ATT: Read By Type Request (0x08) len 6
        Handle range: 0x01f7-0x01f7
        Attribute type: Characteristic (0x2803)
< ACL Data TX: Handle 1587 flags 0x00 dlen 12             #159 [hci1] 33.733105
      LE L2CAP: LE Flow Control Credit (0x16) ident 6 len 4
        Source CID: 68
        Credits: 1
> HCI Event: Number of Completed Packets (0x13) plen 5    #160 [hci1] 33.816119
        Num handles: 1
        Handle: 1587 Address: DF:A9:FF:F6:B1:1A (OUI DF-A9-FF)
        Count: 1
        #158: len 13 (1 Kb/s)
        Latency: 83 msec (83-169 msec ~107 msec)
        Channel: 80 [PSM 39 mode Enhanced Credit (0x81)] {chan 9}
        Channel Latency: 83 msec (83-105 msec ~94 msec)
> HCI Event: Number of Completed Packets (0x13) plen 5    #161 [hci1] 33.903280
        Num handles: 1
        Handle: 1587 Address: DF:A9:FF:F6:B1:1A (OUI DF-A9-FF)
        Count: 1
        #159: len 12 (0 Kb/s)
        Latency: 170 msec (83-170 msec ~138 msec)
        Channel: 80 [PSM 39 mode Enhanced Credit (0x81)] {chan 9}
        Channel Latency: 170 msec (83-170 msec ~132 msec)
> ACL Data RX: Handle 1587 flags 0x02 dlen 11             #162 [hci1] 33.903376
      Channel: 68 len 7 sdu 5 [PSM 39 mode Enhanced Credit (0x81)] {chan 9}
      ATT: Error Response (0x01) len 4
        Read By Type Request (0x08)
        Handle: 0x01f7
        Error: Attribute Not Found (0x0a)
< HCI Command: Host Number of Com.. (0x03|0x0035) plen 5  #163 [hci1] 33.912903
        Num handles: 1
        Handle: 1587 Address: DF:A9:FF:F6:B1:1A (OUI DF-A9-FF)
        Count: 1
< ACL Data TX: Handle 1587 flags 0x00 dlen 12             #164 [hci1] 33.912998
      LE L2CAP: LE Flow Control Credit (0x16) ident 7 len 4
        Source CID: 68
        Credits: 1
> HCI Event: Number of Completed Packets (0x13) plen 5    #165 [hci1] 34.078001
        Num handles: 1
        Handle: 1587 Address: DF:A9:FF:F6:B1:1A (OUI DF-A9-FF)
        Count: 1
        #164: len 12 (0 Kb/s)
        Latency: 165 msec (83-170 msec ~151 msec)
        Channel: 80 [PSM 39 mode Enhanced Credit (0x81)] {chan 9}
        Channel Latency: 165 msec (83-170 msec ~148 msec)
> HCI Event: Disconnect Complete (0x05) plen 4            #166 [hci1] 36.440687
        Status: Success (0x00)
        Handle: 1587 Address: DF:A9:FF:F6:B1:1A (OUI DF-A9-FF)
        Reason: Remote User Terminated Connection (0x13)
< HCI Command: LE Set Extended A.. (0x08|0x0036) plen 25  #167 [hci1] 37.002703
        Handle: 0x00
        Properties: 0x0013
          Connectable
          Scannable
          Use legacy advertising PDUs: ADV_IND
        Min advertising interval: 100.000 msec (0x00a0)
        Max advertising interval: 150.000 msec (0x00f0)
        Channel map: 37, 38, 39 (0x07)
        Own address type: Random (0x01)
        Peer address type: Public (0x00)
        Peer address: 00:00:00:00:00:00 (OUI 00-00-00)
        Filter policy: Allow Scan Request from Any, Allow Connect Request from Any (0x00)
        TX power: Host has no preference (0x7f)
        Primary PHY: LE 1M (0x01)
        Secondary max skip: 0x00
        Secondary PHY: LE 1M (0x01)
        SID: 0x00
        Scan request notifications: Disabled (0x00)
> HCI Event: Command Complete (0x0e) plen 5               #168 [hci1] 37.003592
      LE Set Extended Advertising Parameters (0x08|0x0036) ncmd 1
        Status: Success (0x00)
        TX power (selected): 0 dbm (0x00)
< HCI Command: LE Set Advertising.. (0x08|0x0035) plen 7  #169 [hci1] 37.012716
        Advertising handle: 0x00
        Advertising random address: D5:B6:CC:31:DB:3B (Static)
> HCI Event: Command Complete (0x0e) plen 4               #170 [hci1] 37.013331
      LE Set Advertising Set Random Address (0x08|0x0035) ncmd 1
        Status: Success (0x00)
< HCI Command: LE Set Extended A.. (0x08|0x0037) plen 22  #171 [hci1] 37.032703
        Handle: 0x00
        Operation: Complete extended advertising data (0x03)
        Fragment preference: Minimize fragmentation (0x01)
        Data length: 0x12
        Flags: 0x06
          LE General Discoverable Mode
          BR/EDR Not Supported
        Name (complete): Tester_F6B11A
> HCI Event: Command Complete (0x0e) plen 4               #172 [hci1] 37.033437
      LE Set Extended Advertising Data (0x08|0x0037) ncmd 1
        Status: Success (0x00)
< HCI Command: LE Set Extended Sc.. (0x08|0x0038) plen 4  #173 [hci1] 37.052694
        Handle: 0x00
        Operation: Complete scan response data (0x03)
        Fragment preference: Minimize fragmentation (0x01)
        Data length: 0x00
> HCI Event: Command Complete (0x0e) plen 4               #174 [hci1] 37.053297
      LE Set Extended Scan Response Data (0x08|0x0038) ncmd 1
        Status: Success (0x00)
< HCI Command: LE Set Extended Ad.. (0x08|0x0039) plen 6  #175 [hci1] 37.072721
        Extended advertising: Enabled (0x01)
        Number of sets: 1 (0x01)
        Entry 0
          Handle: 0x00
          Duration: 0 ms (0x00)
          Max ext adv events: 0
> HCI Event: Command Complete (0x0e) plen 4               #176 [hci1] 37.073314
      LE Set Extended Advertising Enable (0x08|0x0039) ncmd 1
        Status: Success (0x00)
> HCI Event: LE Meta Event (0x3e) plen 31                 #177 [hci1] 37.393256
      LE Enhanced Connection Complete (0x0a)
        Status: Success (0x00)
        Handle: 1605
        Role: Peripheral (0x01)
        Peer address type: Public (0x00)
        Peer address: DF:A9:FF:F6:B1:1A (OUI DF-A9-FF)
        Local resolvable private address: 00:00:00:00:00:00 (Non-Resolvable)
        Peer resolvable private address: 00:00:00:00:00:00 (Non-Resolvable)
        Connection interval: 87.50 msec (0x0046)
        Connection latency: 0 (0x0000)
        Supervision timeout: 20000 msec (0x07d0)
        Central clock accuracy: 0x01
> HCI Event: LE Meta Event (0x3e) plen 6                  #178 [hci1] 37.393257
      LE Advertising Set Terminated (0x12)
        Status: Success (0x00)
        Handle: 0
        Connection handle: 1605
        Number of completed extended advertising events: 0
< HCI Command: LE Read Remote Use.. (0x08|0x0016) plen 2  #179 [hci1] 37.412954
        Handle: 1605 Address: DF:A9:FF:F6:B1:1A (OUI DF-A9-FF)
> HCI Event: Command Status (0x0f) plen 4                 #180 [hci1] 37.413475
      LE Read Remote Used Features (0x08|0x0016) ncmd 1
        Status: Success (0x00)
> HCI Event: LE Meta Event (0x3e) plen 12                 #181 [hci1] 37.657187
      LE Read Remote Used Features (0x04)
        Status: Success (0x00)
        Handle: 1605 Address: DF:A9:FF:F6:B1:1A (OUI DF-A9-FF)
        Features: 0x2d 0x49 0x00 0xf7 0x67 0xd8 0x00 0x00
          LE Encryption
          Extended Reject Indication
          Peripheral-initiated Features Exchange
          LE Data Packet Length Extension
          LE 2M PHY
          LE Coded PHY
          Channel Selection Algorithm #2
          Periodic Advertising Sync Transfer - Sender
          Periodic Advertising Sync Transfer - Recipient
          Sleep Clock Accuracy Updates
          Connected Isochronous Stream - Central
          Connected Isochronous Stream - Peripheral
          Isochronous Broadcaster
          Synchronized Receiver
          Connected Isochronous Stream (Host Support)
          LE Power Control Request
          LE Power Control Request
          Connection Subrating
          Connection Subrating (Host Support)
          Unknown features (0x0000d80000000000)
< ACL Data TX: Handle 1605 flags 0x00 dlen 16             #182 [hci1] 42.423073
      LE L2CAP: Connection Parameter Update Request (0x12) ident 8 len 8
        Min interval: 24
        Max interval: 40
        Peripheral latency: 0
        Timeout multiplier: 42
> HCI Event: Number of Completed Packets (0x13) plen 5    #183 [hci1] 42.556680
        Num handles: 1
        Handle: 1605 Address: DF:A9:FF:F6:B1:1A (OUI DF-A9-FF)
        Count: 1
        #182: len 16 (0 Kb/s)
        Latency: 133 msec (133-133 msec ~133 msec)
> ACL Data RX: Handle 1605 flags 0x02 dlen 10             #184 [hci1] 42.556913
      LE L2CAP: Connection Parameter Update Response (0x13) ident 8 len 2
        Result: Connection Parameters accepted (0x0000)
< HCI Command: Host Number of Com.. (0x03|0x0035) plen 5  #185 [hci1] 42.573529
        Num handles: 1
        Handle: 1605 Address: DF:A9:FF:F6:B1:1A (OUI DF-A9-FF)
        Count: 1
> HCI Event: LE Meta Event (0x3e) plen 13                 #186 [hci1] 45.269613
      LE Long Term Key Request (0x05)
        Handle: 1605 Address: DF:A9:FF:F6:B1:1A (OUI DF-A9-FF)
        Random number: 0x0000000000000000
        Encrypted diversifier: 0x0000
