Bluetooth monitor ver 5.72
= Note: Linux version 6.14.0-36-generic (x86_64)                       0.376189
= Note: Bluetooth subsystem version 2.22                               0.376191
= New Index: 00:00:00:00:00:00 (Primary,UART,hci1)              [hci1] 0.376192
= New Index: 48:5F:99:8E:E0:64 (Primary,USB,hci0)               [hci0] 0.376193
= Open Index: 00:00:00:00:00:00                                 [hci1] 0.889877
= Index Info: 00:00:00:00:00:00 (Nordic Semiconductor ASA)      [hci1] 0.889885
@ USER Open: main (privileged) version 2.22            {0x0001} [hci1] 0.889890
< HCI Command: Reset (0x03|0x0003) plen 0                    #1 [hci1] 0.890452
> HCI Event: Command Complete (0x0e) plen 4                  #2 [hci1] 0.890972
      Reset (0x03|0x0003) ncmd 1
        Status: Success (0x00)
< HCI Command: Read Local Supported... (0x04|0x0003) plen 0  #3 [hci1] 0.909773
> HCI Event: Command Complete (0x0e) plen 12                 #4 [hci1] 0.910255
      Read Local Supported Features (0x04|0x0003) ncmd 1
        Status: Success (0x00)
        Features: 0x00 0x00 0x00 0x00 0x60 0x00 0x00 0x00
          BR/EDR Not Supported
          LE Supported (Controller)
< HCI Command: Read Local Version In.. (0x04|0x0001) plen 0  #5 [hci1] 0.929698
> HCI Event: Command Complete (0x0e) plen 12                 #6 [hci1] 0.930181
      Read Local Version Information (0x04|0x0001) ncmd 1
        Status: Success (0x00)
        HCI version: Reserved (0x0f) - Revision 12393 (0x3069)
        LMP version: Reserved (0x0f) - Subversion 12393 (0x3069)
        Manufacturer: Nordic Semiconductor ASA (89)
< HCI Command: Read Local Supported... (0x04|0x0002) plen 0  #7 [hci1] 0.949709
> HCI Event: Command Complete (0x0e) plen 68                 #8 [hci1] 0.950774
      Read Local Supported Commands (0x04|0x0002) ncmd 1
        Status: Success (0x00)
        Commands: 119 entries
          Disconnect (Octet 0 - Bit 5)
          Read Remote Version Information (Octet 2 - Bit 7)
          Set Event Mask (Octet 5 - Bit 6)
          Reset (Octet 5 - Bit 7)
          Read Connection Accept Timeout (Octet 7 - Bit 2)
          Write Connection Accept Timeout (Octet 7 - Bit 3)
          Read Transmit Power Level (Octet 10 - Bit 2)
          Set Controller To Host Flow Control (Octet 10 - Bit 5)
          Host Buffer Size (Octet 10 - Bit 6)
          Host Number of Completed Packets (Octet 10 - Bit 7)
          Read Local Version Information (Octet 14 - Bit 3)
          Read Local Supported Features (Octet 14 - Bit 5)
          Read BD ADDR (Octet 15 - Bit 1)
          Read RSSI (Octet 15 - Bit 5)
          Set Event Mask Page 2 (Octet 22 - Bit 2)
          LE Set Event Mask (Octet 25 - Bit 0)
          LE Read Buffer Size (Octet 25 - Bit 1)
          LE Read Local Supported Features (Octet 25 - Bit 2)
          LE Set Random Address (Octet 25 - Bit 4)
          LE Set Advertising Parameters (Octet 25 - Bit 5)
          LE Read Advertising Channel TX Power (Octet 25 - Bit 6)
          LE Set Advertising Data (Octet 25 - Bit 7)
          LE Set Scan Response Data (Octet 26 - Bit 0)
          LE Set Advertise Enable (Octet 26 - Bit 1)
          LE Set Scan Parameters (Octet 26 - Bit 2)
          LE Set Scan Enable (Octet 26 - Bit 3)
          LE Create Connection (Octet 26 - Bit 4)
          LE Create Connection Cancel (Octet 26 - Bit 5)
          LE Read Accept List Size (Octet 26 - Bit 6)
          LE Clear Accept List (Octet 26 - Bit 7)
          LE Add Device To Accept List (Octet 27 - Bit 0)
          LE Remove Device From Accept List (Octet 27 - Bit 1)
          LE Connection Update (Octet 27 - Bit 2)
          LE Set Host Channel Classification (Octet 27 - Bit 3)
          LE Read Channel Map (Octet 27 - Bit 4)
          LE Read Remote Used Features (Octet 27 - Bit 5)
          LE Encrypt (Octet 27 - Bit 6)
          LE Rand (Octet 27 - Bit 7)
          LE Start Encryption (Octet 28 - Bit 0)
          LE Long Term Key Request Reply (Octet 28 - Bit 1)
          LE Long Term Key Request Neg Reply (Octet 28 - Bit 2)
          LE Read Supported States (Octet 28 - Bit 3)
          LE Receiver Test (Octet 28 - Bit 4)
          LE Transmitter Test (Octet 28 - Bit 5)
          LE Test End (Octet 28 - Bit 6)
          Read Authenticated Payload Timeout (Octet 32 - Bit 4)
          Write Authenticated Payload Timeout (Octet 32 - Bit 5)
          LE Set Data Length (Octet 33 - Bit 6)
          LE Read Suggested Default Data Length (Octet 33 - Bit 7)
          LE Write Suggested Default Data Length (Octet 34 - Bit 0)
          LE Add Device To Resolving List (Octet 34 - Bit 3)
          LE Remove Device From Resolving List (Octet 34 - Bit 4)
          LE Clear Resolving List (Octet 34 - Bit 5)
          LE Read Resolving List Size (Octet 34 - Bit 6)
          LE Set Address Resolution Enable (Octet 35 - Bit 1)
          LE Set Resolvable Private Address Timeout (Octet 35 - Bit 2)
          LE Read Maximum Data Length (Octet 35 - Bit 3)
          LE Read PHY (Octet 35 - Bit 4)
          LE Set Default PHY (Octet 35 - Bit 5)
          LE Set PHY (Octet 35 - Bit 6)
          LE Enhanced Receiver Test (Octet 35 - Bit 7)
          LE Enhanced Transmitter Test (Octet 36 - Bit 0)
          LE Set Advertising Set Random Address (Octet 36 - Bit 1)
          LE Set Extended Advertising Parameters (Octet 36 - Bit 2)
          LE Set Extended Advertising Data (Octet 36 - Bit 3)
          LE Set Extended Scan Response Data (Octet 36 - Bit 4)
          LE Set Extended Advertising Enable (Octet 36 - Bit 5)
          LE Read Maximum Advertising Data Length (Octet 36 - Bit 6)
          LE Read Number of Supported Advertising Sets (Octet 36 - Bit 7)
          LE Remove Advertising Set (Octet 37 - Bit 0)
          LE Clear Advertising Sets (Octet 37 - Bit 1)
          LE Set Periodic Advertising Parameters (Octet 37 - Bit 2)
          LE Set Periodic Advertising Data (Octet 37 - Bit 3)
          LE Set Periodic Advertising Enable (Octet 37 - Bit 4)
          LE Set Extended Scan Parameters (Octet 37 - Bit 5)
          LE Set Extended Scan Enable (Octet 37 - Bit 6)
          LE Extended Create Connection (Octet 37 - Bit 7)
          LE Periodic Advertising Create Sync (Octet 38 - Bit 0)
          LE Periodic Advertising Create Sync Cancel (Octet 38 - Bit 1)
          LE Periodic Advertising Terminate Sync (Octet 38 - Bit 2)
          LE Add Device To Periodic Advertiser List (Octet 38 - Bit 3)
          LE Remove Device From Periodic Advertiser List (Octet 38 - Bit 4)
          LE Clear Periodic Advertiser List (Octet 38 - Bit 5)
          LE Read Periodic Advertiser List Size (Octet 38 - Bit 6)
          LE Read Transmit Power (Octet 38 - Bit 7)
          LE Read RF Path Compensation (Octet 39 - Bit 0)
          LE Write RF Path Compensation (Octet 39 - Bit 1)
          LE Set Privacy Mode (Octet 39 - Bit 2)
          LE Periodic Advertising Receive Enable (Octet 40 - Bit 5)
          LE Periodic Advertising Sync Transfer (Octet 40 - Bit 6)
          LE Periodic Advertising Set Info Transfer (Octet 40 - Bit 7)
          LE Periodic Advertising Sync Transfer Parameters (Octet 41 - Bit 0)
          LE Set Default Periodic Advertisng Sync Transfer Parameters (Octet 41 - Bit 1)
          LE Read Buffer v2 (Octet 41 - Bit 5)
          LE Read ISO TX Sync (Octet 41 - Bit 6)
          LE Set Connected Isochronous Group Parameters (Octet 41 - Bit 7)
          LE Set Connected Isochronous Group Parameters Test (Octet 42 - Bit 0)
          LE Create Connected Isochronous Stream (Octet 42 - Bit 1)
          LE Remove Connected Isochronous Group (Octet 42 - Bit 2)
          LE Accept Connected Isochronous Stream Request (Octet 42 - Bit 3)
          LE Reject Connected Isochronous Stream Request (Octet 42 - Bit 4)
          LE Create Broadcast Isochronous Group (Octet 42 - Bit 5)
          LE Create Broadcast Isochronous Group Test (Octet 42 - Bit 6)
          LE Terminate Broadcast Isochronous Group (Octet 42 - Bit 7)
          LE Broadcast Isochronous Group Create Sync (Octet 43 - Bit 0)
          LE Broadcast Isochronous Group Terminate Sync (Octet 43 - Bit 1)
          LE Request Peer SCA (Octet 43 - Bit 2)
          LE Setup Isochronous Data Path (Octet 43 - Bit 3)
          LE Remove Isochronous Data Path (Octet 43 - Bit 4)
          LE Isochronous Transmit Test (Octet 43 - Bit 5)
          LE Isochronous Receive Test (Octet 43 - Bit 6)
          LE Isochronous Read Test Counters (Octet 43 - Bit 7)
          LE Isochronous Read Test Counters (Octet 44 - Bit 0)
          LE Set Host Feature (Octet 44 - Bit 1)
          Octet 44 - Bit 2 
          Octet 45 - Bit 6 
          Octet 46 - Bit 0 
          Octet 46 - Bit 1 
          Octet 46 - Bit 2 
< HCI Command: Host Buffer Size (0x03|0x0033) plen 7         #9 [hci1] 0.969704
        ACL MTU: 255  ACL max packet: 16
        SCO MTU: 0    SCO max packet: 0
> HCI Event: Command Complete (0x0e) plen 4                 #10 [hci1] 0.970192
      Host Buffer Size (0x03|0x0033) ncmd 1
        Status: Success (0x00)
< HCI Command: Set Controller To Ho.. (0x03|0x0031) plen 1  #11 [hci1] 0.989702
        Flow control: ACL Data Packets (0x01)
> HCI Event: Command Complete (0x0e) plen 4                 #12 [hci1] 0.990129
      Set Controller To Host Flow Control (0x03|0x0031) ncmd 1
        Status: Success (0x00)
< HCI Command: LE Read Local Suppor.. (0x08|0x0003) plen 0  #13 [hci1] 1.009690
> HCI Event: Command Complete (0x0e) plen 12                #14 [hci1] 1.010147
      LE Read Local Supported Features (0x08|0x0003) ncmd 1
        Status: Success (0x00)
        Features: 0xfd 0x79 0x00 0xf7 0x30 0x01 0x00 0x00
          LE Encryption
          Extended Reject Indication
          Peripheral-initiated Features Exchange
          LE Ping
          LE Data Packet Length Extension
          LL Privacy
          Extended Scanner Filter Policies
          LE 2M PHY
          LE Coded PHY
          LE Extended Advertising
          LE Periodic Advertising
          Channel Selection Algorithm #2
          Periodic Advertising Sync Transfer - Sender
          Periodic Advertising Sync Transfer - Recipient
          Sleep Clock Accuracy Updates
          Connected Isochronous Stream - Central
          Connected Isochronous Stream - Peripheral
          Isochronous Broadcaster
          Synchronized Receiver
          Periodic Advertising ADI support
          Connection Subrating
          Unknown features (0x0000010000000000)
< HCI Command: LE Set Host Feature (0x08|0x0074) plen 2     #15 [hci1] 1.029702
        Bit Number: 32
          Connected Isochronous Stream (Host Support)
        Bit Value: 1
> HCI Event: Command Complete (0x0e) plen 4                 #16 [hci1] 1.030089
      LE Set Host Feature (0x08|0x0074) ncmd 1
        Status: Success (0x00)
< HCI Command: LE Read Buffer v2 (0x08|0x0060) plen 0       #17 [hci1] 1.049692
> HCI Event: Command Complete (0x0e) plen 10                #18 [hci1] 1.050204
      LE Read Buffer v2 (0x08|0x0060) ncmd 1
        Status: Success (0x00)
        ACL MTU: 27
        ACL max packet: 3
        ISO MTU: 318
        ISO max packet: 3
< HCI Command: LE Read Maximum Adve.. (0x08|0x003a) plen 0  #19 [hci1] 1.069716
> HCI Event: Command Complete (0x0e) plen 6                 #20 [hci1] 1.070169
      LE Read Maximum Advertising Data Length (0x08|0x003a) ncmd 1
        Status: Success (0x00)
        Max length: 1650
< HCI Command: LE Read Supported St.. (0x08|0x001c) plen 0  #21 [hci1] 1.089757
> HCI Event: Command Complete (0x0e) plen 12                #22 [hci1] 1.090247
      LE Read Supported States (0x08|0x001c) ncmd 1
        Status: Success (0x00)
        States: 0x000003ff3e0306ff
          Non-connectable Advertising State
          Scannable Advertising State
          Connectable Advertising State
          High Duty Cycle Directed Advertising State
          Passive Scanning State
          Active Scanning State
          Initiating State
            and Connection State (Central Role)
          Connection State (Peripheral Role)
          Scannable Advertising State
            and Passive Scanning State
          Connectable Advertising State
            and Passive Scanning State
          Non-connectable Advertising State
            and Initiating State
          Scannable Advertising State
            and Initiating State
          Active Scanning State
            and Connection State (Central Role)
          Passive Scanning State
            and Connection State (Peripheral Role)
          Active Scanning State
            and Connection State (Peripheral Role)
          Initiating State
            and Connection State (Central Role)
            and Central Role & Central Role
          Low Duty Cycle Directed Advertising State
          Connectable Advertising State
            and Initiating State
            and Central Role & Peripheral Role
          High Duty Cycle Directed Advertising State
            and Initiating State
            and Central Role & Peripheral Role
          Low Duty Cycle Directed Advertising State
            and Initiating State
            and Central Role & Peripheral Role
          Connectable Advertising State
            and Connection State (Central Role)
            and Central Role & Peripheral Role
          High Duty Cycle Directed Advertising State
            and Connection State (Central Role)
            and Central Role & Peripheral Role
          Low Duty Cycle Directed Advertising State
            and Connection State (Central Role)
            and Central Role & Peripheral Role
          Connectable Advertising State
            and Connection State (Peripheral Role)
            and Central Role & Peripheral Role
          High Duty Cycle Directed Advertising State
            and Connection State (Peripheral Role)
            and Peripheral Role & Peripheral Role
          Low Duty Cycle Directed Advertising State
            and Connection State (Peripheral Role)
            and Peripheral Role & Peripheral Role
          Initiating State
            and Connection State (Peripheral Role)
            and Central Role & Peripheral Role
< HCI Command: LE Read Maximum Data.. (0x08|0x002f) plen 0  #23 [hci1] 1.109697
> HCI Event: Command Complete (0x0e) plen 12                #24 [hci1] 1.110146
      LE Read Maximum Data Length (0x08|0x002f) ncmd 1
        Status: Success (0x00)
        Max TX octets: 251
        Max TX time: 2704
        Max RX octets: 251
        Max RX time: 2704
< HCI Command: LE Write Suggested D.. (0x08|0x0024) plen 4  #25 [hci1] 1.129922
        TX octets: 251
        TX time: 2704
> HCI Event: Command Complete (0x0e) plen 4                 #26 [hci1] 1.130395
      LE Write Suggested Default Data Length (0x08|0x0024) ncmd 1
        Status: Success (0x00)
< HCI Command: LE Read Resolving Li.. (0x08|0x002a) plen 0  #27 [hci1] 1.149706
> HCI Event: Command Complete (0x0e) plen 5                 #28 [hci1] 1.150173
      LE Read Resolving List Size (0x08|0x002a) ncmd 1
        Status: Success (0x00)
        Size: 8
< HCI Command: LE Set Event Mask (0x08|0x0001) plen 8       #29 [hci1] 1.169643
        Mask: 0x000002023f87fa5e
          LE Advertising Report
          LE Connection Update Complete
          LE Read Remote Used Features Complete
          LE Long Term Key Request
          LE Data Length Change
          LE Enhanced Connection Complete
          LE PHY Update Complete
          LE Extended Advertising Report
          LE Periodic Advertising Sync Established
          LE Periodic Advertising Report
          LE Periodic Advertising Sync Lost
          LE Extended Scan Timeout
          LE Extended Advertising Set Terminated
          LE Scan Request Received
          LE Periodic Advertising Sync Transfer Rvc
          LE CIS Established
          LE CIS Request
          LE Create BIG Complete
          LE Terminate BIG Complete
          LE BIG Sync Estabilished Complete
          LE BIG Sync Lost
          LE BIG Info Advertising Report
          Unknown mask (0x0000020000000000)
> HCI Event: Command Complete (0x0e) plen 4                 #30 [hci1] 1.170171
      LE Set Event Mask (0x08|0x0001) ncmd 1
        Status: Success (0x00)
< HCI Command: Set Event Mask (0x03|0x0001) plen 8          #31 [hci1] 1.189701
        Mask: 0x2000800002008890
          Disconnection Complete
          Encryption Change
          Read Remote Version Information Complete
          Hardware Error
          Data Buffer Overflow
          Encryption Key Refresh Complete
          LE Meta
> HCI Event: Command Complete (0x0e) plen 4                 #32 [hci1] 1.190247
      Set Event Mask (0x03|0x0001) ncmd 1
        Status: Success (0x00)
< HCI Command: Read BD ADDR (0x04|0x0009) plen 0            #33 [hci1] 1.209742
> HCI Event: Command Complete (0x0e) plen 10                #34 [hci1] 1.210209
      Read BD ADDR (0x04|0x0009) ncmd 1
        Status: Success (0x00)
        Address: 00:00:00:00:00:00 (OUI 00-00-00)
< HCI Command: LE Set Random Address (0x08|0x0005) plen 6   #35 [hci1] 1.229737
        Address: D5:B6:CC:31:DB:3B (Static)
> HCI Event: Command Complete (0x0e) plen 4                 #36 [hci1] 1.230226
      LE Set Random Address (0x08|0x0005) ncmd 1
        Status: Success (0x00)
< HCI Command: LE Set Extended Adv.. (0x08|0x0036) plen 25  #37 [hci1] 3.769743
        Handle: 0x00
        Properties: 0x0013
          Connectable
          Scannable
          Use legacy advertising PDUs: ADV_IND
        Min advertising interval: 100.000 msec (0x00a0)
        Max advertising interval: 150.000 msec (0x00f0)
        Channel map: 37, 38, 39 (0x07)
        Own address type: Random (0x01)
        Peer address type: Public (0x00)
        Peer address: 00:00:00:00:00:00 (OUI 00-00-00)
        Filter policy: Allow Scan Request from Any, Allow Connect Request from Any (0x00)
        TX power: Host has no preference (0x7f)
        Primary PHY: LE 1M (0x01)
        Secondary max skip: 0x00
        Secondary PHY: LE 1M (0x01)
        SID: 0x00
        Scan request notifications: Disabled (0x00)
> HCI Event: Command Complete (0x0e) plen 5                 #38 [hci1] 3.770537
      LE Set Extended Advertising Parameters (0x08|0x0036) ncmd 1
        Status: Success (0x00)
        TX power (selected): 0 dbm (0x00)
< HCI Command: LE Set Advertising S.. (0x08|0x0035) plen 7  #39 [hci1] 3.789704
        Advertising handle: 0x00
        Advertising random address: D5:B6:CC:31:DB:3B (Static)
> HCI Event: Command Complete (0x0e) plen 4                 #40 [hci1] 3.790208
      LE Set Advertising Set Random Address (0x08|0x0035) ncmd 1
        Status: Success (0x00)
< HCI Command: LE Set Extended Adv.. (0x08|0x0037) plen 22  #41 [hci1] 3.809717
        Handle: 0x00
        Operation: Complete extended advertising data (0x03)
        Fragment preference: Minimize fragmentation (0x01)
        Data length: 0x12
        Flags: 0x06
          LE General Discoverable Mode
          BR/EDR Not Supported
        Name (complete): Tester_F6B11A
> HCI Event: Command Complete (0x0e) plen 4                 #42 [hci1] 3.810539
      LE Set Extended Advertising Data (0x08|0x0037) ncmd 1
        Status: Success (0x00)
< HCI Command: LE Set Extended Scan.. (0x08|0x0038) plen 4  #43 [hci1] 3.829707
        Handle: 0x00
        Operation: Complete scan response data (0x03)
        Fragment preference: Minimize fragmentation (0x01)
        Data length: 0x00
> HCI Event: Command Complete (0x0e) plen 4                 #44 [hci1] 3.830166
      LE Set Extended Scan Response Data (0x08|0x0038) ncmd 1
        Status: Success (0x00)
< HCI Command: LE Set Extended Adve.. (0x08|0x0039) plen 6  #45 [hci1] 3.849757
        Extended advertising: Enabled (0x01)
        Number of sets: 1 (0x01)
        Entry 0
          Handle: 0x00
          Duration: 0 ms (0x00)
          Max ext adv events: 0
> HCI Event: Command Complete (0x0e) plen 4                 #46 [hci1] 3.850293
      LE Set Extended Advertising Enable (0x08|0x0039) ncmd 1
        Status: Success (0x00)
> HCI Event: LE Meta Event (0x3e) plen 31                   #47 [hci1] 3.964282
      LE Enhanced Connection Complete (0x0a)
        Status: Success (0x00)
        Handle: 399
        Role: Peripheral (0x01)
        Peer address type: Public (0x00)
        Peer address: DF:A9:FF:F6:B1:1A (OUI DF-A9-FF)
        Local resolvable private address: 00:00:00:00:00:00 (Non-Resolvable)
        Peer resolvable private address: 00:00:00:00:00:00 (Non-Resolvable)
        Connection interval: 87.50 msec (0x0046)
        Connection latency: 0 (0x0000)
        Supervision timeout: 25120 msec (0x09d0)
        Central clock accuracy: 0x01
> HCI Event: LE Meta Event (0x3e) plen 6                    #48 [hci1] 3.964401
      LE Advertising Set Terminated (0x12)
        Status: Success (0x00)
        Handle: 0
        Connection handle: 399
        Number of completed extended advertising events: 0
< HCI Command: LE Read Remote Used... (0x08|0x0016) plen 2  #49 [hci1] 3.970813
        Handle: 399 Address: DF:A9:FF:F6:B1:1A (OUI DF-A9-FF)
< ACL Data TX: Handle 399 flags 0x00 dlen 7                 #50 [hci1] 3.970841
      ATT: Exchange MTU Request (0x02) len 2
        Client RX MTU: 251
> HCI Event: Command Status (0x0f) plen 4                   #51 [hci1] 3.971319
      LE Read Remote Used Features (0x08|0x0016) ncmd 1
        Status: Success (0x00)
> HCI Event: Number of Completed Packets (0x13) plen 5      #52 [hci1] 4.140203
        Num handles: 1
        Handle: 399 Address: DF:A9:FF:F6:B1:1A (OUI DF-A9-FF)
        Count: 1
        #50: len 7 (0 Kb/s)
        Latency: 169 msec (169-169 msec ~169 msec)
> HCI Event: LE Meta Event (0x3e) plen 12                   #53 [hci1] 4.228199
      LE Read Remote Used Features (0x04)
        Status: Success (0x00)
        Handle: 399 Address: DF:A9:FF:F6:B1:1A (OUI DF-A9-FF)
        Features: 0x2d 0x49 0x00 0xf7 0x67 0xd8 0x00 0x00
          LE Encryption
          Extended Reject Indication
          Peripheral-initiated Features Exchange
          LE Data Packet Length Extension
          LE 2M PHY
          LE Coded PHY
          Channel Selection Algorithm #2
          Periodic Advertising Sync Transfer - Sender
          Periodic Advertising Sync Transfer - Recipient
          Sleep Clock Accuracy Updates
          Connected Isochronous Stream - Central
          Connected Isochronous Stream - Peripheral
          Isochronous Broadcaster
          Synchronized Receiver
          Connected Isochronous Stream (Host Support)
          LE Power Control Request
          LE Power Control Request
          Connection Subrating
          Connection Subrating (Host Support)
          Unknown features (0x0000d80000000000)
> ACL Data RX: Handle 399 flags 0x02 dlen 11                #54 [hci1] 6.677833
      SMP: Pairing Request (0x01) len 6
        IO capability: KeyboardDisplay (0x04)
        OOB data: Authentication data not present (0x00)
        Authentication requirement: Bonding, MITM, SC, No Keypresses (0x0d)
        Max encryption key size: 16
        Initiator key distribution: EncKey IdKey (0x03)
        Responder key distribution: EncKey IdKey Sign (0x07)
< HCI Command: Host Number of Compl.. (0x03|0x0035) plen 5  #55 [hci1] 6.689770
        Num handles: 1
        Handle: 399 Address: DF:A9:FF:F6:B1:1A (OUI DF-A9-FF)
        Count: 1
< ACL Data TX: Handle 399 flags 0x00 dlen 11                #56 [hci1] 6.689873
      SMP: Pairing Response (0x02) len 6
        IO capability: DisplayOnly (0x00)
        OOB data: Authentication data not present (0x00)
        Authentication requirement: Bonding, No MITM, SC, No Keypresses (0x09)
        Max encryption key size: 16
        Initiator key distribution: IdKey (0x02)
        Responder key distribution: <none> (0x00)
> ACL Data RX: Handle 399 flags 0x02 dlen 7                 #57 [hci1] 6.765217
      ATT: Exchange MTU Response (0x03) len 2
        Server RX MTU: 23
< HCI Command: Host Number of Compl.. (0x03|0x0035) plen 5  #58 [hci1] 6.769906
        Num handles: 1
        Handle: 399 Address: DF:A9:FF:F6:B1:1A (OUI DF-A9-FF)
        Count: 1
> HCI Event: Number of Completed Packets (0x13) plen 5      #59 [hci1] 6.852951
        Num handles: 1
        Handle: 399 Address: DF:A9:FF:F6:B1:1A (OUI DF-A9-FF)
        Count: 1
        #56: len 11 (0 Kb/s)
        Latency: 163 msec (163-169 msec ~166 msec)
> ACL Data RX: Handle 399 flags 0x02 dlen 27                #60 [hci1] 6.853221
> ACL Data RX: Handle 399 flags 0x01 dlen 27                #61 [hci1] 6.853747
> ACL Data RX: Handle 399 flags 0x01 dlen 15                #62 [hci1] 6.854160
      SMP: Pairing Public Key (0x0c) len 64
        X: e2ad3492a3829ec3644c1e7ec7ab3cdced9cfbe3b2a14582de7d258ff0830d47
        Y: 9a0de3d95e426b6e05bd4d40fe750232a3fb7b2e0053ee9f13612182060b2f24
< HCI Command: Host Number of Compl.. (0x03|0x0035) plen 5  #63 [hci1] 6.870505
        Num handles: 1
        Handle: 399 Address: DF:A9:FF:F6:B1:1A (OUI DF-A9-FF)
        Count: 1
< HCI Command: Host Number of Compl.. (0x03|0x0035) plen 5  #64 [hci1] 6.870702
        Num handles: 1
        Handle: 399 Address: DF:A9:FF:F6:B1:1A (OUI DF-A9-FF)
        Count: 1
< HCI Command: Host Number of Compl.. (0x03|0x0035) plen 5  #65 [hci1] 6.871134
        Num handles: 1
        Handle: 399 Address: DF:A9:FF:F6:B1:1A (OUI DF-A9-FF)
        Count: 1
< ACL Data TX: Handle 399 flags 0x00 dlen 27                #66 [hci1] 6.871365
< ACL Data TX: Handle 399 flags 0x01 dlen 27                #67 [hci1] 6.871396
< ACL Data TX: Handle 399 flags 0x01 dlen 15                #68 [hci1] 6.871430
      SMP: Pairing Public Key (0x0c) len 64
        X: 98308440221e2d910f0e54b71e7ec652857aa9b5a0dc65028824cc19db1226e9
        Y: 67a4816bcb62efb21701e31fdb27561a6217575fb007a8bbdabe7e28b6f68482
> HCI Event: Number of Completed Packets (0x13) plen 5      #69 [hci1] 6.940693
        Num handles: 1
        Handle: 399 Address: DF:A9:FF:F6:B1:1A (OUI DF-A9-FF)
        Count: 1
        #66: len 27 (3 Kb/s)
        Latency: 69 msec (69-169 msec ~117 msec)
> HCI Event: Number of Completed Packets (0x13) plen 5      #70 [hci1] 6.941463
        Num handles: 1
        Handle: 399 Address: DF:A9:FF:F6:B1:1A (OUI DF-A9-FF)
        Count: 1
        #67: len 27 (3 Kb/s)
        Latency: 70 msec (69-169 msec ~93 msec)
> HCI Event: Number of Completed Packets (0x13) plen 5      #71 [hci1] 7.027565
        Num handles: 1
        Handle: 399 Address: DF:A9:FF:F6:B1:1A (OUI DF-A9-FF)
        Count: 1
        #68: len 15 (0 Kb/s)
        Latency: 156 msec (69-169 msec ~125 msec)
> ACL Data RX: Handle 399 flags 0x02 dlen 21                #72 [hci1] 7.990483
      SMP: Pairing Confirm (0x03) len 16
        Confim value: 9a0a284c1fa7f71f4f1efee461d8480d
< HCI Command: Host Number of Compl.. (0x03|0x0035) plen 5  #73 [hci1] 8.010218
        Num handles: 1
        Handle: 399 Address: DF:A9:FF:F6:B1:1A (OUI DF-A9-FF)
        Count: 1
< ACL Data TX: Handle 399 flags 0x00 dlen 21                #74 [hci1] 8.010303
      SMP: Pairing Confirm (0x03) len 16
        Confim value: 4cc29cc561803bbce4dd23ad1580a5cb
> HCI Event: Number of Completed Packets (0x13) plen 5      #75 [hci1] 8.165273
        Num handles: 1
        Handle: 399 Address: DF:A9:FF:F6:B1:1A (OUI DF-A9-FF)
        Count: 1
        #74: len 21 (1 Kb/s)
        Latency: 154 msec (69-169 msec ~139 msec)
> ACL Data RX: Handle 399 flags 0x02 dlen 21                #76 [hci1] 8.165649
      SMP: Pairing Random (0x04) len 16
        Random value: c894a37c8525fc370000000000000000
< HCI Command: Host Number of Compl.. (0x03|0x0035) plen 5  #77 [hci1] 8.170409
        Num handles: 1
        Handle: 399 Address: DF:A9:FF:F6:B1:1A (OUI DF-A9-FF)
        Count: 1
< ACL Data TX: Handle 399 flags 0x00 dlen 21                #78 [hci1] 8.170486
      SMP: Pairing Random (0x04) len 16
        Random value: 8e6108f966a694cbe26df70bb96773e6
> HCI Event: Number of Completed Packets (0x13) plen 5      #79 [hci1] 8.340025
        Num handles: 1
        Handle: 399 Address: DF:A9:FF:F6:B1:1A (OUI DF-A9-FF)
        Count: 1
        #78: len 21 (0 Kb/s)
        Latency: 169 msec (69-169 msec ~154 msec)
> ACL Data RX: Handle 399 flags 0x02 dlen 21                #80 [hci1] 8.427975
      SMP: Pairing Confirm (0x03) len 16
        Confim value: 9a897c6403c553af848db586da2980a5
< HCI Command: Host Number of Compl.. (0x03|0x0035) plen 5  #81 [hci1] 8.430122
        Num handles: 1
        Handle: 399 Address: DF:A9:FF:F6:B1:1A (OUI DF-A9-FF)
        Count: 1
< ACL Data TX: Handle 399 flags 0x00 dlen 21                #82 [hci1] 8.430488
      SMP: Pairing Confirm (0x03) len 16
        Confim value: d1d1b1f115d4837692d10f749cd1260d
> HCI Event: Number of Completed Packets (0x13) plen 5      #83 [hci1] 8.602743
        Num handles: 1
        Handle: 399 Address: DF:A9:FF:F6:B1:1A (OUI DF-A9-FF)
        Count: 1
        #82: len 21 (0 Kb/s)
        Latency: 172 msec (69-172 msec ~163 msec)
> ACL Data RX: Handle 399 flags 0x02 dlen 21                #84 [hci1] 8.603118
      SMP: Pairing Random (0x04) len 16
        Random value: aee9dcf6ca2b949f0000000000000000
< HCI Command: Host Number of Compl.. (0x03|0x0035) plen 5  #85 [hci1] 8.610435
        Num handles: 1
        Handle: 399 Address: DF:A9:FF:F6:B1:1A (OUI DF-A9-FF)
        Count: 1
< ACL Data TX: Handle 399 flags 0x00 dlen 21                #86 [hci1] 8.610499
      SMP: Pairing Random (0x04) len 16
        Random value: 4d02679f89a05211af56d8b3da64d21e
> HCI Event: Number of Completed Packets (0x13) plen 5      #87 [hci1] 8.777518
        Num handles: 1
        Handle: 399 Address: DF:A9:FF:F6:B1:1A (OUI DF-A9-FF)
        Count: 1
        #86: len 21 (1 Kb/s)
        Latency: 167 msec (69-172 msec ~165 msec)
> ACL Data RX: Handle 399 flags 0x02 dlen 21                #88 [hci1] 8.865436
      SMP: Pairing Confirm (0x03) len 16
        Confim value: 0733d97c88fdadd5d0396a3102d6cfad
< HCI Command: Host Number of Compl.. (0x03|0x0035) plen 5  #89 [hci1] 8.870175
        Num handles: 1
        Handle: 399 Address: DF:A9:FF:F6:B1:1A (OUI DF-A9-FF)
        Count: 1
< ACL Data TX: Handle 399 flags 0x00 dlen 21                #90 [hci1] 8.870389
      SMP: Pairing Confirm (0x03) len 16
        Confim value: 2ddad654ce569ac8c3b79b0dfa2102c9
> HCI Event: Number of Completed Packets (0x13) plen 5      #91 [hci1] 9.040271
        Num handles: 1
        Handle: 399 Address: DF:A9:FF:F6:B1:1A (OUI DF-A9-FF)
        Count: 1
        #90: len 21 (0 Kb/s)
        Latency: 169 msec (69-172 msec ~167 msec)
> ACL Data RX: Handle 399 flags 0x02 dlen 21                #92 [hci1] 9.040512
      SMP: Pairing Random (0x04) len 16
        Random value: 5727f360a2168aeb0000000000000000
< HCI Command: Host Number of Compl.. (0x03|0x0035) plen 5  #93 [hci1] 9.050333
        Num handles: 1
        Handle: 399 Address: DF:A9:FF:F6:B1:1A (OUI DF-A9-FF)
        Count: 1
< ACL Data TX: Handle 399 flags 0x00 dlen 21                #94 [hci1] 9.050488
      SMP: Pairing Random (0x04) len 16
        Random value: 5e8286bc235a02440d0c3424a2acf8fd
> HCI Event: Number of Completed Packets (0x13) plen 5      #95 [hci1] 9.215048
        Num handles: 1
        Handle: 399 Address: DF:A9:FF:F6:B1:1A (OUI DF-A9-FF)
        Count: 1
        #94: len 21 (1 Kb/s)
        Latency: 164 msec (69-172 msec ~166 msec)
> ACL Data RX: Handle 399 flags 0x02 dlen 21                #96 [hci1] 9.302835
      SMP: Pairing Confirm (0x03) len 16
        Confim value: 7407cd4201d9c95013c61427c1102b1a
< HCI Command: Host Number of Compl.. (0x03|0x0035) plen 5  #97 [hci1] 9.310168
        Num handles: 1
        Handle: 399 Address: DF:A9:FF:F6:B1:1A (OUI DF-A9-FF)
        Count: 1
< ACL Data TX: Handle 399 flags 0x00 dlen 21                #98 [hci1] 9.310371
      SMP: Pairing Confirm (0x03) len 16
        Confim value: 109212661734572e574ab518f06dbceb
> HCI Event: Number of Completed Packets (0x13) plen 5      #99 [hci1] 9.477634
        Num handles: 1
        Handle: 399 Address: DF:A9:FF:F6:B1:1A (OUI DF-A9-FF)
        Count: 1
        #98: len 21 (1 Kb/s)
        Latency: 167 msec (69-172 msec ~166 msec)
> ACL Data RX: Handle 399 flags 0x02 dlen 21               #100 [hci1] 9.478036
      SMP: Pairing Random (0x04) len 16
        Random value: f0ea3c04f2117aec0000000000000000
< HCI Command: Host Number of Comp.. (0x03|0x0035) plen 5  #101 [hci1] 9.490273
        Num handles: 1
        Handle: 399 Address: DF:A9:FF:F6:B1:1A (OUI DF-A9-FF)
        Count: 1
< ACL Data TX: Handle 399 flags 0x00 dlen 21               #102 [hci1] 9.490454
      SMP: Pairing Random (0x04) len 16
        Random value: 5c4a1bcadd27bd58e945097b00bad7ac
> HCI Event: Number of Completed Packets (0x13) plen 5     #103 [hci1] 9.652508
        Num handles: 1
        Handle: 399 Address: DF:A9:FF:F6:B1:1A (OUI DF-A9-FF)
        Count: 1
        #102: len 21 (1 Kb/s)
        Latency: 162 msec (69-172 msec ~164 msec)
> ACL Data RX: Handle 399 flags 0x02 dlen 21               #104 [hci1] 9.740327
      SMP: Pairing Confirm (0x03) len 16
        Confim value: 4197a7896ac73df9fdb77663432dd729
< HCI Command: Host Number of Comp.. (0x03|0x0035) plen 5  #105 [hci1] 9.750289
        Num handles: 1
        Handle: 399 Address: DF:A9:FF:F6:B1:1A (OUI DF-A9-FF)
        Count: 1
< ACL Data TX: Handle 399 flags 0x00 dlen 21               #106 [hci1] 9.750461
      SMP: Pairing Confirm (0x03) len 16
        Confim value: 91e8d9bb9910a9ce05bdc2fc1f5c5c58
> HCI Event: Number of Completed Packets (0x13) plen 5     #107 [hci1] 9.915185
        Num handles: 1
        Handle: 399 Address: DF:A9:FF:F6:B1:1A (OUI DF-A9-FF)
        Count: 1
        #106: len 21 (1 Kb/s)
        Latency: 164 msec (69-172 msec ~164 msec)
> ACL Data RX: Handle 399 flags 0x02 dlen 21               #108 [hci1] 9.915514
      SMP: Pairing Random (0x04) len 16
        Random value: 8dd7aad0219e16dd0000000000000000
< HCI Command: Host Number of Comp.. (0x03|0x0035) plen 5  #109 [hci1] 9.930441
        Num handles: 1
        Handle: 399 Address: DF:A9:FF:F6:B1:1A (OUI DF-A9-FF)
        Count: 1
< ACL Data TX: Handle 399 flags 0x00 dlen 21               #110 [hci1] 9.930661
      SMP: Pairing Random (0x04) len 16
        Random value: 32527e6e64e79f33b2e374394db8ab2d
> HCI Event: Number of Completed Packets (0x13) plen 5    #111 [hci1] 10.089896
        Num handles: 1
        Handle: 399 Address: DF:A9:FF:F6:B1:1A (OUI DF-A9-FF)
        Count: 1
        #110: len 21 (1 Kb/s)
        Latency: 159 msec (69-172 msec ~161 msec)
> ACL Data RX: Handle 399 flags 0x02 dlen 21              #112 [hci1] 10.177786
      SMP: Pairing Confirm (0x03) len 16
        Confim value: 87bd3e5358f544c38b4da250bab2c06a
< HCI Command: Host Number of Com.. (0x03|0x0035) plen 5  #113 [hci1] 10.189847
        Num handles: 1
        Handle: 399 Address: DF:A9:FF:F6:B1:1A (OUI DF-A9-FF)
        Count: 1
< ACL Data TX: Handle 399 flags 0x00 dlen 21              #114 [hci1] 10.189975
      SMP: Pairing Confirm (0x03) len 16
        Confim value: 747f85af5497ad34feb67f0f150a41fc
> HCI Event: Number of Completed Packets (0x13) plen 5    #115 [hci1] 10.352673
        Num handles: 1
        Handle: 399 Address: DF:A9:FF:F6:B1:1A (OUI DF-A9-FF)
        Count: 1
        #114: len 21 (1 Kb/s)
        Latency: 162 msec (69-172 msec ~162 msec)
> ACL Data RX: Handle 399 flags 0x02 dlen 21              #116 [hci1] 10.353021
      SMP: Pairing Random (0x04) len 16
        Random value: 9f0e60e1b46eef360000000000000000
< HCI Command: Host Number of Com.. (0x03|0x0035) plen 5  #117 [hci1] 10.370373
        Num handles: 1
        Handle: 399 Address: DF:A9:FF:F6:B1:1A (OUI DF-A9-FF)
        Count: 1
< ACL Data TX: Handle 399 flags 0x00 dlen 21              #118 [hci1] 10.370459
      SMP: Pairing Random (0x04) len 16
        Random value: dddbdfe2838e9a8cc6964353c850fef7
> HCI Event: Number of Completed Packets (0x13) plen 5    #119 [hci1] 10.527392
        Num handles: 1
        Handle: 399 Address: DF:A9:FF:F6:B1:1A (OUI DF-A9-FF)
        Count: 1
        #118: len 21 (1 Kb/s)
        Latency: 156 msec (69-172 msec ~159 msec)
> ACL Data RX: Handle 399 flags 0x02 dlen 21              #120 [hci1] 10.615329
      SMP: Pairing Confirm (0x03) len 16
        Confim value: 52a6acb77730d76866d6ff9b085d7b4b
< HCI Command: Host Number of Com.. (0x03|0x0035) plen 5  #121 [hci1] 10.630119
        Num handles: 1
        Handle: 399 Address: DF:A9:FF:F6:B1:1A (OUI DF-A9-FF)
        Count: 1
< ACL Data TX: Handle 399 flags 0x00 dlen 21              #122 [hci1] 10.630302
      SMP: Pairing Confirm (0x03) len 16
        Confim value: 1a275c82f2d679f201c840e4f8424a99
> HCI Event: Number of Completed Packets (0x13) plen 5    #123 [hci1] 10.790213
        Num handles: 1
        Handle: 399 Address: DF:A9:FF:F6:B1:1A (OUI DF-A9-FF)
        Count: 1
        #122: len 21 (1 Kb/s)
        Latency: 159 msec (69-172 msec ~159 msec)
> ACL Data RX: Handle 399 flags 0x02 dlen 21              #124 [hci1] 10.790444
      SMP: Pairing Random (0x04) len 16
        Random value: b7ecbc6d392ded330000000000000000
< HCI Command: Host Number of Com.. (0x03|0x0035) plen 5  #125 [hci1] 10.810461
        Num handles: 1
        Handle: 399 Address: DF:A9:FF:F6:B1:1A (OUI DF-A9-FF)
        Count: 1
< ACL Data TX: Handle 399 flags 0x00 dlen 21              #126 [hci1] 10.810517
      SMP: Pairing Random (0x04) len 16
        Random value: eb9f1915536596b6fc3db1c86b2b1970
> HCI Event: Number of Completed Packets (0x13) plen 5    #127 [hci1] 10.964891
        Num handles: 1
        Handle: 399 Address: DF:A9:FF:F6:B1:1A (OUI DF-A9-FF)
        Count: 1
        #126: len 21 (1 Kb/s)
        Latency: 154 msec (69-172 msec ~157 msec)
> ACL Data RX: Handle 399 flags 0x02 dlen 21              #128 [hci1] 11.052820
      SMP: Pairing Confirm (0x03) len 16
        Confim value: 71dbebe1e34c62ea73aa3556aef5da6c
< HCI Command: Host Number of Com.. (0x03|0x0035) plen 5  #129 [hci1] 11.069758
        Num handles: 1
        Handle: 399 Address: DF:A9:FF:F6:B1:1A (OUI DF-A9-FF)
        Count: 1
< ACL Data TX: Handle 399 flags 0x00 dlen 21              #130 [hci1] 11.069868
      SMP: Pairing Confirm (0x03) len 16
        Confim value: ace4aa278724ddda7fc2e53734b2f926
> HCI Event: Number of Completed Packets (0x13) plen 5    #131 [hci1] 11.227548
        Num handles: 1
        Handle: 399 Address: DF:A9:FF:F6:B1:1A (OUI DF-A9-FF)
        Count: 1
        #130: len 21 (1 Kb/s)
        Latency: 157 msec (69-172 msec ~157 msec)
> ACL Data RX: Handle 399 flags 0x02 dlen 21              #132 [hci1] 11.228023
      SMP: Pairing Random (0x04) len 16
        Random value: ceffd39672c385120000000000000000
< HCI Command: Host Number of Com.. (0x03|0x0035) plen 5  #133 [hci1] 11.230448
        Num handles: 1
        Handle: 399 Address: DF:A9:FF:F6:B1:1A (OUI DF-A9-FF)
        Count: 1
< ACL Data TX: Handle 399 flags 0x00 dlen 21              #134 [hci1] 11.230600
      SMP: Pairing Random (0x04) len 16
        Random value: 5c794dc9ad9f2c3f295ebd5ad5e1c3cf
> HCI Event: Number of Completed Packets (0x13) plen 5    #135 [hci1] 11.402429
        Num handles: 1
        Handle: 399 Address: DF:A9:FF:F6:B1:1A (OUI DF-A9-FF)
        Count: 1
        #134: len 21 (0 Kb/s)
        Latency: 171 msec (69-172 msec ~164 msec)
> ACL Data RX: Handle 399 flags 0x02 dlen 21              #136 [hci1] 11.490183
      SMP: Pairing Confirm (0x03) len 16
        Confim value: 8db5d695cba7220de63d5c443c5dc281
< HCI Command: Host Number of Com.. (0x03|0x0035) plen 5  #137 [hci1] 11.510034
        Num handles: 1
        Handle: 399 Address: DF:A9:FF:F6:B1:1A (OUI DF-A9-FF)
        Count: 1
< ACL Data TX: Handle 399 flags 0x00 dlen 21              #138 [hci1] 11.510197
      SMP: Pairing Confirm (0x03) len 16
        Confim value: 8a8dcaf9f9a53fc1385b78e9aae67a9a
> HCI Event: Number of Completed Packets (0x13) plen 5    #139 [hci1] 11.665097
        Num handles: 1
        Handle: 399 Address: DF:A9:FF:F6:B1:1A (OUI DF-A9-FF)
        Count: 1
        #138: len 21 (1 Kb/s)
        Latency: 154 msec (69-172 msec ~159 msec)
> ACL Data RX: Handle 399 flags 0x02 dlen 21              #140 [hci1] 11.665384
      SMP: Pairing Random (0x04) len 16
        Random value: d34baa59ee8b888f0000000000000000
< HCI Command: Host Number of Com.. (0x03|0x0035) plen 5  #141 [hci1] 11.670316
        Num handles: 1
        Handle: 399 Address: DF:A9:FF:F6:B1:1A (OUI DF-A9-FF)
        Count: 1
< ACL Data TX: Handle 399 flags 0x00 dlen 21              #142 [hci1] 11.670467
      SMP: Pairing Random (0x04) len 16
        Random value: 5c2fff312cdf99c9491988e877355a9a
> HCI Event: Number of Completed Packets (0x13) plen 5    #143 [hci1] 11.839809
        Num handles: 1
        Handle: 399 Address: DF:A9:FF:F6:B1:1A (OUI DF-A9-FF)
        Count: 1
        #142: len 21 (0 Kb/s)
        Latency: 169 msec (69-172 msec ~164 msec)
> ACL Data RX: Handle 399 flags 0x02 dlen 21              #144 [hci1] 11.927749
      SMP: Pairing Confirm (0x03) len 16
        Confim value: 46be7e1bb0e2dba4aaa83708d5e99a4c
< HCI Command: Host Number of Com.. (0x03|0x0035) plen 5  #145 [hci1] 11.930100
        Num handles: 1
        Handle: 399 Address: DF:A9:FF:F6:B1:1A (OUI DF-A9-FF)
        Count: 1
< ACL Data TX: Handle 399 flags 0x00 dlen 21              #146 [hci1] 11.930333
      SMP: Pairing Confirm (0x03) len 16
        Confim value: 49202a2cd95910f151a2680cedba158b
> HCI Event: Number of Completed Packets (0x13) plen 5    #147 [hci1] 12.102616
        Num handles: 1
        Handle: 399 Address: DF:A9:FF:F6:B1:1A (OUI DF-A9-FF)
        Count: 1
        #146: len 21 (0 Kb/s)
        Latency: 172 msec (69-172 msec ~168 msec)
> ACL Data RX: Handle 399 flags 0x02 dlen 21              #148 [hci1] 12.102886
      SMP: Pairing Random (0x04) len 16
        Random value: 1e4bd5c50faf638f0000000000000000
< HCI Command: Host Number of Com.. (0x03|0x0035) plen 5  #149 [hci1] 12.110447
        Num handles: 1
        Handle: 399 Address: DF:A9:FF:F6:B1:1A (OUI DF-A9-FF)
        Count: 1
< ACL Data TX: Handle 399 flags 0x00 dlen 21              #150 [hci1] 12.110504
      SMP: Pairing Random (0x04) len 16
        Random value: c629a3a987d808e808655d558dfc1155
> HCI Event: Number of Completed Packets (0x13) plen 5    #151 [hci1] 12.277335
        Num handles: 1
        Handle: 399 Address: DF:A9:FF:F6:B1:1A (OUI DF-A9-FF)
        Count: 1
        #150: len 21 (1 Kb/s)
        Latency: 166 msec (69-172 msec ~167 msec)
> ACL Data RX: Handle 399 flags 0x02 dlen 21              #152 [hci1] 12.365154
      SMP: Pairing Confirm (0x03) len 16
        Confim value: c009770a9e86791ce6751e23492eaa5a
< HCI Command: Host Number of Com.. (0x03|0x0035) plen 5  #153 [hci1] 12.370210
        Num handles: 1
        Handle: 399 Address: DF:A9:FF:F6:B1:1A (OUI DF-A9-FF)
        Count: 1
< ACL Data TX: Handle 399 flags 0x00 dlen 21              #154 [hci1] 12.370334
      SMP: Pairing Confirm (0x03) len 16
        Confim value: 37cf33cfe7576d179184aed766044a47
> HCI Event: Number of Completed Packets (0x13) plen 5    #155 [hci1] 12.540044
        Num handles: 1
        Handle: 399 Address: DF:A9:FF:F6:B1:1A (OUI DF-A9-FF)
        Count: 1
        #154: len 21 (0 Kb/s)
        Latency: 169 msec (69-172 msec ~168 msec)
> ACL Data RX: Handle 399 flags 0x02 dlen 21              #156 [hci1] 12.540353
      SMP: Pairing Random (0x04) len 16
        Random value: 9394d82a14f7595c0000000000000000
< HCI Command: Host Number of Com.. (0x03|0x0035) plen 5  #157 [hci1] 12.550438
        Num handles: 1
        Handle: 399 Address: DF:A9:FF:F6:B1:1A (OUI DF-A9-FF)
        Count: 1
< ACL Data TX: Handle 399 flags 0x00 dlen 21              #158 [hci1] 12.550541
      SMP: Pairing Random (0x04) len 16
        Random value: 92f20f6ad8f13724432c7fd6001c45ff
> HCI Event: Number of Completed Packets (0x13) plen 5    #159 [hci1] 12.714807
        Num handles: 1
        Handle: 399 Address: DF:A9:FF:F6:B1:1A (OUI DF-A9-FF)
        Count: 1
        #158: len 21 (1 Kb/s)
        Latency: 164 msec (69-172 msec ~166 msec)
> ACL Data RX: Handle 399 flags 0x02 dlen 21              #160 [hci1] 12.802686
      SMP: Pairing Confirm (0x03) len 16
        Confim value: d30f4419e762243f5824322c1f6bd85a
< HCI Command: Host Number of Com.. (0x03|0x0035) plen 5  #161 [hci1] 12.809911
        Num handles: 1
        Handle: 399 Address: DF:A9:FF:F6:B1:1A (OUI DF-A9-FF)
        Count: 1
< ACL Data TX: Handle 399 flags 0x00 dlen 21              #162 [hci1] 12.810067
      SMP: Pairing Confirm (0x03) len 16
        Confim value: 1ab998e336eb301956eaf14d46681bd3
> HCI Event: Number of Completed Packets (0x13) plen 5    #163 [hci1] 12.977516
        Num handles: 1
        Handle: 399 Address: DF:A9:FF:F6:B1:1A (OUI DF-A9-FF)
        Count: 1
        #162: len 21 (1 Kb/s)
        Latency: 167 msec (69-172 msec ~166 msec)
> ACL Data RX: Handle 399 flags 0x02 dlen 21              #164 [hci1] 12.977829
      SMP: Pairing Random (0x04) len 16
        Random value: 6fae9791f886fb570000000000000000
< HCI Command: Host Number of Com.. (0x03|0x0035) plen 5  #165 [hci1] 12.990415
        Num handles: 1
        Handle: 399 Address: DF:A9:FF:F6:B1:1A (OUI DF-A9-FF)
        Count: 1
< ACL Data TX: Handle 399 flags 0x00 dlen 21              #166 [hci1] 12.990497
      SMP: Pairing Random (0x04) len 16
        Random value: 23ac32ebbb5e14c8a6b9622f296d277f
> HCI Event: Number of Completed Packets (0x13) plen 5    #167 [hci1] 13.152334
        Num handles: 1
        Handle: 399 Address: DF:A9:FF:F6:B1:1A (OUI DF-A9-FF)
        Count: 1
        #166: len 21 (1 Kb/s)
        Latency: 161 msec (69-172 msec ~164 msec)
> ACL Data RX: Handle 399 flags 0x02 dlen 21              #168 [hci1] 13.240080
      SMP: Pairing Confirm (0x03) len 16
        Confim value: fe8cd9e06f15bc00f292d59845eb13db
< HCI Command: Host Number of Com.. (0x03|0x0035) plen 5  #169 [hci1] 13.249829
        Num handles: 1
        Handle: 399 Address: DF:A9:FF:F6:B1:1A (OUI DF-A9-FF)
        Count: 1
< ACL Data TX: Handle 399 flags 0x00 dlen 21              #170 [hci1] 13.249956
      SMP: Pairing Confirm (0x03) len 16
        Confim value: 0f352f82e88674d6098e463a11ba1a8e
> HCI Event: Number of Completed Packets (0x13) plen 5    #171 [hci1] 13.415112
        Num handles: 1
        Handle: 399 Address: DF:A9:FF:F6:B1:1A (OUI DF-A9-FF)
        Count: 1
        #170: len 21 (1 Kb/s)
        Latency: 165 msec (69-172 msec ~164 msec)
> ACL Data RX: Handle 399 flags 0x02 dlen 21              #172 [hci1] 13.415264
      SMP: Pairing Random (0x04) len 16
        Random value: a4b78aca15fb084c0000000000000000
< HCI Command: Host Number of Com.. (0x03|0x0035) plen 5  #173 [hci1] 13.430281
        Num handles: 1
        Handle: 399 Address: DF:A9:FF:F6:B1:1A (OUI DF-A9-FF)
        Count: 1
< ACL Data TX: Handle 399 flags 0x00 dlen 21              #174 [hci1] 13.430305
      SMP: Pairing Random (0x04) len 16
        Random value: 297efe85e67448a15f56bd27e3a3cf1d
> HCI Event: Number of Completed Packets (0x13) plen 5    #175 [hci1] 13.589776
        Num handles: 1
        Handle: 399 Address: DF:A9:FF:F6:B1:1A (OUI DF-A9-FF)
        Count: 1
        #174: len 21 (1 Kb/s)
        Latency: 159 msec (69-172 msec ~162 msec)
> ACL Data RX: Handle 399 flags 0x02 dlen 21              #176 [hci1] 13.677642
      SMP: Pairing Confirm (0x03) len 16
        Confim value: f7448e5fcd8fc0d42aa71e97e0d7bc17
< HCI Command: Host Number of Com.. (0x03|0x0035) plen 5  #177 [hci1] 13.689877
        Num handles: 1
        Handle: 399 Address: DF:A9:FF:F6:B1:1A (OUI DF-A9-FF)
        Count: 1
< ACL Data TX: Handle 399 flags 0x00 dlen 21              #178 [hci1] 13.690030
      SMP: Pairing Confirm (0x03) len 16
        Confim value: 6c8ceb29ed05a965b38c2c739e46ce0a
> HCI Event: Number of Completed Packets (0x13) plen 5    #179 [hci1] 13.852494
        Num handles: 1
        Handle: 399 Address: DF:A9:FF:F6:B1:1A (OUI DF-A9-FF)
        Count: 1
        #178: len 21 (1 Kb/s)
        Latency: 162 msec (69-172 msec ~162 msec)
> ACL Data RX: Handle 399 flags 0x02 dlen 21              #180 [hci1] 13.852997
      SMP: Pairing Random (0x04) len 16
        Random value: ca7c66f1066dc7a40000000000000000
< HCI Command: Host Number of Com.. (0x03|0x0035) plen 5  #181 [hci1] 13.869771
        Num handles: 1
        Handle: 399 Address: DF:A9:FF:F6:B1:1A (OUI DF-A9-FF)
        Count: 1
< ACL Data TX: Handle 399 flags 0x00 dlen 21              #182 [hci1] 13.869836
      SMP: Pairing Random (0x04) len 16
        Random value: 25a9493fd3ce4faf02be7293595bb7c6
> HCI Event: Number of Completed Packets (0x13) plen 5    #183 [hci1] 14.027245
        Num handles: 1
        Handle: 399 Address: DF:A9:FF:F6:B1:1A (OUI DF-A9-FF)
        Count: 1
        #182: len 21 (1 Kb/s)
        Latency: 157 msec (69-172 msec ~159 msec)
> ACL Data RX: Handle 399 flags 0x02 dlen 21              #184 [hci1] 14.115075
      SMP: Pairing Confirm (0x03) len 16
        Confim value: f6b6239056b440875fd3c9a79071c558
< HCI Command: Host Number of Com.. (0x03|0x0035) plen 5  #185 [hci1] 14.129652
        Num handles: 1
        Handle: 399 Address: DF:A9:FF:F6:B1:1A (OUI DF-A9-FF)
        Count: 1
< ACL Data TX: Handle 399 flags 0x00 dlen 21              #186 [hci1] 14.129687
      SMP: Pairing Confirm (0x03) len 16
        Confim value: e61effc1718660f3b685f1a1fd885918
> HCI Event: Number of Completed Packets (0x13) plen 5    #187 [hci1] 14.290007
        Num handles: 1
        Handle: 399 Address: DF:A9:FF:F6:B1:1A (OUI DF-A9-FF)
        Count: 1
        #186: len 21 (1 Kb/s)
        Latency: 160 msec (69-172 msec ~160 msec)
> ACL Data RX: Handle 399 flags 0x02 dlen 21              #188 [hci1] 14.290306
      SMP: Pairing Random (0x04) len 16
        Random value: d1af8d84a9830c680000000000000000
< HCI Command: Host Number of Com.. (0x03|0x0035) plen 5  #189 [hci1] 14.309854
        Num handles: 1
        Handle: 399 Address: DF:A9:FF:F6:B1:1A (OUI DF-A9-FF)
        Count: 1
< ACL Data TX: Handle 399 flags 0x00 dlen 21              #190 [hci1] 14.309933
      SMP: Pairing Random (0x04) len 16
        Random value: 58f6b41f855a6f6c3560debd84e2affc
> HCI Event: Number of Completed Packets (0x13) plen 5    #191 [hci1] 14.464769
        Num handles: 1
        Handle: 399 Address: DF:A9:FF:F6:B1:1A (OUI DF-A9-FF)
        Count: 1
        #190: len 21 (1 Kb/s)
        Latency: 154 msec (69-172 msec ~157 msec)
> ACL Data RX: Handle 399 flags 0x02 dlen 21              #192 [hci1] 14.552619
      SMP: Pairing Confirm (0x03) len 16
        Confim value: 41b664ffd0a460238dfdc944a3155f8c
< HCI Command: Host Number of Com.. (0x03|0x0035) plen 5  #193 [hci1] 14.570229
        Num handles: 1
        Handle: 399 Address: DF:A9:FF:F6:B1:1A (OUI DF-A9-FF)
        Count: 1
< ACL Data TX: Handle 399 flags 0x00 dlen 21              #194 [hci1] 14.570462
      SMP: Pairing Confirm (0x03) len 16
        Confim value: 83f5383356433a764bf96ac18f717e5c
> HCI Event: Number of Completed Packets (0x13) plen 5    #195 [hci1] 14.727420
        Num handles: 1
        Handle: 399 Address: DF:A9:FF:F6:B1:1A (OUI DF-A9-FF)
        Count: 1
        #194: len 21 (1 Kb/s)
        Latency: 156 msec (69-172 msec ~157 msec)
> ACL Data RX: Handle 399 flags 0x02 dlen 21              #196 [hci1] 14.727720
      SMP: Pairing Random (0x04) len 16
        Random value: 9912665f995d860e0000000000000000
< HCI Command: Host Number of Com.. (0x03|0x0035) plen 5  #197 [hci1] 14.730331
        Num handles: 1
        Handle: 399 Address: DF:A9:FF:F6:B1:1A (OUI DF-A9-FF)
        Count: 1
< ACL Data TX: Handle 399 flags 0x00 dlen 21              #198 [hci1] 14.730396
      SMP: Pairing Random (0x04) len 16
        Random value: b67e7216d5bf664139eda2b542549666
> HCI Event: Number of Completed Packets (0x13) plen 5    #199 [hci1] 14.902162
        Num handles: 1
        Handle: 399 Address: DF:A9:FF:F6:B1:1A (OUI DF-A9-FF)
        Count: 1
        #198: len 21 (0 Kb/s)
        Latency: 171 msec (69-172 msec ~164 msec)
> ACL Data RX: Handle 399 flags 0x02 dlen 21              #200 [hci1] 14.990078
      SMP: Pairing Confirm (0x03) len 16
        Confim value: 1c27c58626bcbb74cd66b530e08d231a
< HCI Command: Host Number of Com.. (0x03|0x0035) plen 5  #201 [hci1] 15.009889
        Num handles: 1
        Handle: 399 Address: DF:A9:FF:F6:B1:1A (OUI DF-A9-FF)
        Count: 1
< ACL Data TX: Handle 399 flags 0x00 dlen 21              #202 [hci1] 15.010061
      SMP: Pairing Confirm (0x03) len 16
        Confim value: 7f807cdca051a2e5df82b63fb68810a7
> HCI Event: Number of Completed Packets (0x13) plen 5    #203 [hci1] 15.165016
        Num handles: 1
        Handle: 399 Address: DF:A9:FF:F6:B1:1A (OUI DF-A9-FF)
        Count: 1
        #202: len 21 (1 Kb/s)
        Latency: 154 msec (69-172 msec ~159 msec)
> ACL Data RX: Handle 399 flags 0x02 dlen 21              #204 [hci1] 15.165267
      SMP: Pairing Random (0x04) len 16
        Random value: 26dea877b40909930000000000000000
< HCI Command: Host Number of Com.. (0x03|0x0035) plen 5  #205 [hci1] 15.170317
        Num handles: 1
        Handle: 399 Address: DF:A9:FF:F6:B1:1A (OUI DF-A9-FF)
        Count: 1
< ACL Data TX: Handle 399 flags 0x00 dlen 21              #206 [hci1] 15.170501
      SMP: Pairing Random (0x04) len 16
        Random value: ed17f76500c95219dd01e09d1e63f87b
> HCI Event: Number of Completed Packets (0x13) plen 5    #207 [hci1] 15.339684
        Num handles: 1
        Handle: 399 Address: DF:A9:FF:F6:B1:1A (OUI DF-A9-FF)
        Count: 1
        #206: len 21 (0 Kb/s)
        Latency: 169 msec (69-172 msec ~164 msec)
> ACL Data RX: Handle 399 flags 0x02 dlen 21              #208 [hci1] 15.427599
      SMP: Pairing Confirm (0x03) len 16
        Confim value: fdb8cca7d097673e93a168dbb9757df7
< HCI Command: Host Number of Com.. (0x03|0x0035) plen 5  #209 [hci1] 15.430230
        Num handles: 1
        Handle: 399 Address: DF:A9:FF:F6:B1:1A (OUI DF-A9-FF)
        Count: 1
< ACL Data TX: Handle 399 flags 0x00 dlen 21              #210 [hci1] 15.430517
      SMP: Pairing Confirm (0x03) len 16
        Confim value: 2dbf9f4839302ce0bdbf3a3d2b5dd958
> HCI Event: Number of Completed Packets (0x13) plen 5    #211 [hci1] 15.602433
        Num handles: 1
        Handle: 399 Address: DF:A9:FF:F6:B1:1A (OUI DF-A9-FF)
        Count: 1
        #210: len 21 (0 Kb/s)
        Latency: 171 msec (69-172 msec ~168 msec)
> ACL Data RX: Handle 399 flags 0x02 dlen 21              #212 [hci1] 15.602762
      SMP: Pairing Random (0x04) len 16
        Random value: bd862470f8aae6300000000000000000
< HCI Command: Host Number of Com.. (0x03|0x0035) plen 5  #213 [hci1] 15.610317
        Num handles: 1
        Handle: 399 Address: DF:A9:FF:F6:B1:1A (OUI DF-A9-FF)
        Count: 1
< ACL Data TX: Handle 399 flags 0x00 dlen 21              #214 [hci1] 15.610412
      SMP: Pairing Random (0x04) len 16
        Random value: 81d35d47e1f6006d79c974bd9d9e1ee3
> HCI Event: Number of Completed Packets (0x13) plen 5    #215 [hci1] 15.777260
        Num handles: 1
        Handle: 399 Address: DF:A9:FF:F6:B1:1A (OUI DF-A9-FF)
        Count: 1
        #214: len 21 (1 Kb/s)
        Latency: 166 msec (69-172 msec ~167 msec)
> ACL Data RX: Handle 399 flags 0x02 dlen 21              #216 [hci1] 15.865004
      SMP: Pairing Confirm (0x03) len 16
        Confim value: b5f5ef5afa8da4066ccb5416a7fedb82
< HCI Command: Host Number of Com.. (0x03|0x0035) plen 5  #217 [hci1] 15.869645
        Num handles: 1
        Handle: 399 Address: DF:A9:FF:F6:B1:1A (OUI DF-A9-FF)
        Count: 1
< ACL Data TX: Handle 399 flags 0x00 dlen 21              #218 [hci1] 15.869915
      SMP: Pairing Confirm (0x03) len 16
        Confim value: 15b7be13a5ca212b3fab168a44e2fdf9
> HCI Event: Number of Completed Packets (0x13) plen 5    #219 [hci1] 16.039911
        Num handles: 1
        Handle: 399 Address: DF:A9:FF:F6:B1:1A (OUI DF-A9-FF)
        Count: 1
        #218: len 21 (0 Kb/s)
        Latency: 169 msec (69-172 msec ~168 msec)
> ACL Data RX: Handle 399 flags 0x02 dlen 21              #220 [hci1] 16.040169
      SMP: Pairing Random (0x04) len 16
        Random value: f4f30cd1cf8274c00000000000000000
< HCI Command: Host Number of Com.. (0x03|0x0035) plen 5  #221 [hci1] 16.050034
        Num handles: 1
        Handle: 399 Address: DF:A9:FF:F6:B1:1A (OUI DF-A9-FF)
        Count: 1
< ACL Data TX: Handle 399 flags 0x00 dlen 21              #222 [hci1] 16.050113
      SMP: Pairing Random (0x04) len 16
        Random value: e7f7e0c2476823e41736a7e381bafb7c
> HCI Event: Number of Completed Packets (0x13) plen 5    #223 [hci1] 16.214641
        Num handles: 1
        Handle: 399 Address: DF:A9:FF:F6:B1:1A (OUI DF-A9-FF)
        Count: 1
        #222: len 21 (1 Kb/s)
        Latency: 164 msec (69-172 msec ~166 msec)
> ACL Data RX: Handle 399 flags 0x02 dlen 21              #224 [hci1] 16.302517
      SMP: Pairing Confirm (0x03) len 16
        Confim value: 54479d1572cfd87ebf427d1af9efccf9
< HCI Command: Host Number of Com.. (0x03|0x0035) plen 5  #225 [hci1] 16.309772
        Num handles: 1
        Handle: 399 Address: DF:A9:FF:F6:B1:1A (OUI DF-A9-FF)
        Count: 1
< ACL Data TX: Handle 399 flags 0x00 dlen 21              #226 [hci1] 16.309887
      SMP: Pairing Confirm (0x03) len 16
        Confim value: 9f8ce789e329e07a43848d2f441791b0
> HCI Event: Number of Completed Packets (0x13) plen 5    #227 [hci1] 16.477336
        Num handles: 1
        Handle: 399 Address: DF:A9:FF:F6:B1:1A (OUI DF-A9-FF)
        Count: 1
        #226: len 21 (1 Kb/s)
        Latency: 167 msec (69-172 msec ~167 msec)
> ACL Data RX: Handle 399 flags 0x02 dlen 21              #228 [hci1] 16.477677
      SMP: Pairing Random (0x04) len 16
        Random value: 10a936c63366fac50000000000000000
< HCI Command: Host Number of Com.. (0x03|0x0035) plen 5  #229 [hci1] 16.490380
        Num handles: 1
        Handle: 399 Address: DF:A9:FF:F6:B1:1A (OUI DF-A9-FF)
        Count: 1
