Bluetooth monitor ver 5.84
btmon[1299595]: = Note: Linux version 6.8.0-83-generic (x86_64)                                                          0.427797
btmon[1299595]: = Note: Bluetooth subsystem version 2.22                                                                 0.427799
= New Index: 00:00:00:00:00:00 (Primary,UART,hci0)                                                                       0.427799
= Open Index: 00:00:00:00:00:00                                                                                          0.432183
= Index Info: 00:00:00:00:00:00 (Nordic Semiconductor ASA)                                                               0.432196
zephyr.exe[1299597]: @ USER Open: main (privileged) version 2.22                                                {0x0001} 0.432199
zephyr.exe[1299597]: < HCI Command: Reset (0x03|0x0003) plen 0                                                        #1 0.432514
> HCI Event: Command Complete (0x0e) plen 4                                                                           #2 0.433030
      Reset (0x03|0x0003) ncmd 1
        Status: Success (0x00)
zephyr.exe[1299597]: < HCI Command: Read Local Supported Features (0x04|0x0003) plen 0                                #3 0.452189
> HCI Event: Command Complete (0x0e) plen 12                                                                          #4 0.452697
      Read Local Supported Features (0x04|0x0003) ncmd 1
        Status: Success (0x00)
        Features: 0x00 0x00 0x00 0x00 0x60 0x00 0x00 0x00
          BR/EDR Not Supported
          LE Supported (Controller)
zephyr.exe[1299597]: < HCI Command: Read Local Version Information (0x04|0x0001) plen 0                               #5 0.472186
> HCI Event: Command Complete (0x0e) plen 12                                                                          #6 0.472692
      Read Local Version Information (0x04|0x0001) ncmd 1
        Status: Success (0x00)
        HCI version: Reserved (0x0e) - Revision 12520 (0x30e8)
        LMP version: Reserved (0x0e) - Subversion 12520 (0x30e8)
        Manufacturer: Nordic Semiconductor ASA (89)
zephyr.exe[1299597]: < HCI Command: Read Local Supported Commands (0x04|0x0002) plen 0                                #7 0.492222
> HCI Event: Command Complete (0x0e) plen 68                                                                          #8 0.493380
      Read Local Supported Commands (0x04|0x0002) ncmd 1
        Status: Success (0x00)
        Commands: 119 entries
          Disconnect (Octet 0 - Bit 5)
          Read Remote Version Information (Octet 2 - Bit 7)
          Set Event Mask (Octet 5 - Bit 6)
          Reset (Octet 5 - Bit 7)
          Read Connection Accept Timeout (Octet 7 - Bit 2)
          Write Connection Accept Timeout (Octet 7 - Bit 3)
          Read Transmit Power Level (Octet 10 - Bit 2)
          Set Controller To Host Flow Control (Octet 10 - Bit 5)
          Host Buffer Size (Octet 10 - Bit 6)
          Host Number of Completed Packets (Octet 10 - Bit 7)
          Read Local Version Information (Octet 14 - Bit 3)
          Read Local Supported Features (Octet 14 - Bit 5)
          Read BD ADDR (Octet 15 - Bit 1)
          Read RSSI (Octet 15 - Bit 5)
          Set Event Mask Page 2 (Octet 22 - Bit 2)
          LE Set Event Mask (Octet 25 - Bit 0)
          LE Read Buffer Size (Octet 25 - Bit 1)
          LE Read Local Supported Features (Octet 25 - Bit 2)
          LE Set Random Address (Octet 25 - Bit 4)
          LE Set Advertising Parameters (Octet 25 - Bit 5)
          LE Read Advertising Channel TX Power (Octet 25 - Bit 6)
          LE Set Advertising Data (Octet 25 - Bit 7)
          LE Set Scan Response Data (Octet 26 - Bit 0)
          LE Set Advertise Enable (Octet 26 - Bit 1)
          LE Set Scan Parameters (Octet 26 - Bit 2)
          LE Set Scan Enable (Octet 26 - Bit 3)
          LE Create Connection (Octet 26 - Bit 4)
          LE Create Connection Cancel (Octet 26 - Bit 5)
          LE Read Accept List Size (Octet 26 - Bit 6)
          LE Clear Accept List (Octet 26 - Bit 7)
          LE Add Device To Accept List (Octet 27 - Bit 0)
          LE Remove Device From Accept List (Octet 27 - Bit 1)
          LE Connection Update (Octet 27 - Bit 2)
          LE Set Host Channel Classification (Octet 27 - Bit 3)
          LE Read Channel Map (Octet 27 - Bit 4)
          LE Read Remote Used Features (Octet 27 - Bit 5)
          LE Encrypt (Octet 27 - Bit 6)
          LE Rand (Octet 27 - Bit 7)
          LE Start Encryption (Octet 28 - Bit 0)
          LE Long Term Key Request Reply (Octet 28 - Bit 1)
          LE Long Term Key Request Neg Reply (Octet 28 - Bit 2)
          LE Read Supported States (Octet 28 - Bit 3)
          LE Receiver Test (Octet 28 - Bit 4)
          LE Transmitter Test (Octet 28 - Bit 5)
          LE Test End (Octet 28 - Bit 6)
          Read Authenticated Payload Timeout (Octet 32 - Bit 4)
          Write Authenticated Payload Timeout (Octet 32 - Bit 5)
          LE Set Data Length (Octet 33 - Bit 6)
          LE Read Suggested Default Data Length (Octet 33 - Bit 7)
          LE Write Suggested Default Data Length (Octet 34 - Bit 0)
          LE Add Device To Resolving List (Octet 34 - Bit 3)
          LE Remove Device From Resolving List (Octet 34 - Bit 4)
          LE Clear Resolving List (Octet 34 - Bit 5)
          LE Read Resolving List Size (Octet 34 - Bit 6)
          LE Set Address Resolution Enable (Octet 35 - Bit 1)
          LE Set Resolvable Private Address Timeout (Octet 35 - Bit 2)
          LE Read Maximum Data Length (Octet 35 - Bit 3)
          LE Read PHY (Octet 35 - Bit 4)
          LE Set Default PHY (Octet 35 - Bit 5)
          LE Set PHY (Octet 35 - Bit 6)
          LE Enhanced Receiver Test (Octet 35 - Bit 7)
          LE Enhanced Transmitter Test (Octet 36 - Bit 0)
          LE Set Advertising Set Random Address (Octet 36 - Bit 1)
          LE Set Extended Advertising Parameters (Octet 36 - Bit 2)
          LE Set Extended Advertising Data (Octet 36 - Bit 3)
          LE Set Extended Scan Response Data (Octet 36 - Bit 4)
          LE Set Extended Advertising Enable (Octet 36 - Bit 5)
          LE Read Maximum Advertising Data Length (Octet 36 - Bit 6)
          LE Read Number of Supported Advertising Sets (Octet 36 - Bit 7)
          LE Remove Advertising Set (Octet 37 - Bit 0)
          LE Clear Advertising Sets (Octet 37 - Bit 1)
          LE Set Periodic Advertising Parameters (Octet 37 - Bit 2)
          LE Set Periodic Advertising Data (Octet 37 - Bit 3)
          LE Set Periodic Advertising Enable (Octet 37 - Bit 4)
          LE Set Extended Scan Parameters (Octet 37 - Bit 5)
          LE Set Extended Scan Enable (Octet 37 - Bit 6)
          LE Extended Create Connection (Octet 37 - Bit 7)
          LE Periodic Advertising Create Sync (Octet 38 - Bit 0)
          LE Periodic Advertising Create Sync Cancel (Octet 38 - Bit 1)
          LE Periodic Advertising Terminate Sync (Octet 38 - Bit 2)
          LE Add Device To Periodic Advertiser List (Octet 38 - Bit 3)
          LE Remove Device From Periodic Advertiser List (Octet 38 - Bit 4)
          LE Clear Periodic Advertiser List (Octet 38 - Bit 5)
          LE Read Periodic Advertiser List Size (Octet 38 - Bit 6)
          LE Read Transmit Power (Octet 38 - Bit 7)
          LE Read RF Path Compensation (Octet 39 - Bit 0)
          LE Write RF Path Compensation (Octet 39 - Bit 1)
          LE Set Privacy Mode (Octet 39 - Bit 2)
          LE Periodic Advertising Receive Enable (Octet 40 - Bit 5)
          LE Periodic Advertising Sync Transfer (Octet 40 - Bit 6)
          LE Periodic Advertising Set Info Transfer (Octet 40 - Bit 7)
          LE Periodic Advertising Sync Transfer Parameters (Octet 41 - Bit 0)
          LE Set Default Periodic Advertisng Sync Transfer Parameters (Octet 41 - Bit 1)
          LE Read Buffer v2 (Octet 41 - Bit 5)
          LE Read ISO TX Sync (Octet 41 - Bit 6)
          LE Set Connected Isochronous Group Parameters (Octet 41 - Bit 7)
          LE Set Connected Isochronous Group Parameters Test (Octet 42 - Bit 0)
          LE Create Connected Isochronous Stream (Octet 42 - Bit 1)
          LE Remove Connected Isochronous Group (Octet 42 - Bit 2)
          LE Accept Connected Isochronous Stream Request (Octet 42 - Bit 3)
          LE Reject Connected Isochronous Stream Request (Octet 42 - Bit 4)
          LE Create Broadcast Isochronous Group (Octet 42 - Bit 5)
          LE Create Broadcast Isochronous Group Test (Octet 42 - Bit 6)
          LE Terminate Broadcast Isochronous Group (Octet 42 - Bit 7)
          LE Broadcast Isochronous Group Create Sync (Octet 43 - Bit 0)
          LE Broadcast Isochronous Group Terminate Sync (Octet 43 - Bit 1)
          LE Request Peer SCA (Octet 43 - Bit 2)
          LE Setup Isochronous Data Path (Octet 43 - Bit 3)
          LE Remove Isochronous Data Path (Octet 43 - Bit 4)
          LE Isochronous Transmit Test (Octet 43 - Bit 5)
          LE Isochronous Receive Test (Octet 43 - Bit 6)
          LE Isochronous Read Test Counters (Octet 43 - Bit 7)
          LE Isochronous Read Test Counters (Octet 44 - Bit 0)
          LE Set Host Feature (Octet 44 - Bit 1)
          LE Read ISO link quality (Octet 44 - Bit 2)
          Octet 45 - Bit 6 
          Octet 46 - Bit 0 
          Octet 46 - Bit 1 
          Octet 46 - Bit 2 
zephyr.exe[1299597]: < HCI Command: Host Buffer Size (0x03|0x0033) plen 7                                             #9 0.512180
        ACL MTU: 255  ACL max packet: 16
        SCO MTU: 0    SCO max packet: 0
> HCI Event: Command Complete (0x0e) plen 4                                                                          #10 0.512731
      Host Buffer Size (0x03|0x0033) ncmd 1
        Status: Success (0x00)
zephyr.exe[1299597]: < HCI Command: Set Controller To Host Flow Control (0x03|0x0031) plen 1                         #11 0.532184
        Flow control: ACL Data Packets (0x01)
> HCI Event: Command Complete (0x0e) plen 4                                                                          #12 0.532705
      Set Controller To Host Flow Control (0x03|0x0031) ncmd 1
        Status: Success (0x00)
zephyr.exe[1299597]: < HCI Command: LE Read Local Supported Features (0x08|0x0003) plen 0                            #13 0.552189
> HCI Event: Command Complete (0x0e) plen 12                                                                         #14 0.552611
      LE Read Local Supported Features (0x08|0x0003) ncmd 1
        Status: Success (0x00)
        Features: 0xfd 0x79 0x00 0xf7 0x30 0x01 0x00 0x00
          LE Encryption
          Extended Reject Indication
          Peripheral-initiated Features Exchange
          LE Ping
          LE Data Packet Length Extension
          LL Privacy
          Extended Scanner Filter Policies
          LE 2M PHY
          LE Coded PHY
          LE Extended Advertising
          LE Periodic Advertising
          Channel Selection Algorithm #2
          Periodic Advertising Sync Transfer - Sender
          Periodic Advertising Sync Transfer - Recipient
          Sleep Clock Accuracy Updates
          Connected Isochronous Stream - Central
          Connected Isochronous Stream - Peripheral
          Isochronous Broadcaster
          Synchronized Receiver
          Periodic Advertising ADI support
          Connection Subrating
          Unknown features (0x0000010000000000)
zephyr.exe[1299597]: < HCI Command: LE Set Host Feature (0x08|0x0074) plen 2                                         #15 0.572224
        Bit Number: 32
          Connected Isochronous Stream (Host Support)
        Bit Value: 1
> HCI Event: Command Complete (0x0e) plen 4                                                                          #16 0.572651
      LE Set Host Feature (0x08|0x0074) ncmd 1
        Status: Success (0x00)
zephyr.exe[1299597]: < HCI Command: LE Read Buffer v2 (0x08|0x0060) plen 0                                           #17 0.592193
> HCI Event: Command Complete (0x0e) plen 10                                                                         #18 0.592675
      LE Read Buffer v2 (0x08|0x0060) ncmd 1
        Status: Success (0x00)
        ACL MTU: 27
        ACL max packet: 3
        ISO MTU: 318
        ISO max packet: 3
zephyr.exe[1299597]: < HCI Command: LE Read Maximum Advertising Data Length (0x08|0x003a) plen 0                     #19 0.612172
> HCI Event: Command Complete (0x0e) plen 6                                                                          #20 0.612655
      LE Read Maximum Advertising Data Length (0x08|0x003a) ncmd 1
        Status: Success (0x00)
        Max length: 1650
zephyr.exe[1299597]: < HCI Command: LE Read Supported States (0x08|0x001c) plen 0                                    #21 0.632217
> HCI Event: Command Complete (0x0e) plen 12                                                                         #22 0.632767
      LE Read Supported States (0x08|0x001c) ncmd 1
        Status: Success (0x00)
        States: 0x000003ff3e0306ff
          Non-connectable Advertising State
          Scannable Advertising State
          Connectable Advertising State
          High Duty Cycle Directed Advertising State
          Passive Scanning State
          Active Scanning State
          Initiating State
            and Connection State (Central Role)
          Connection State (Peripheral Role)
          Scannable Advertising State
            and Passive Scanning State
          Connectable Advertising State
            and Passive Scanning State
          Non-connectable Advertising State
            and Initiating State
          Scannable Advertising State
            and Initiating State
          Active Scanning State
            and Connection State (Central Role)
          Passive Scanning State
            and Connection State (Peripheral Role)
          Active Scanning State
            and Connection State (Peripheral Role)
          Initiating State
            and Connection State (Central Role)
            and Central Role & Central Role
          Low Duty Cycle Directed Advertising State
          Connectable Advertising State
            and Initiating State
            and Central Role & Peripheral Role
          High Duty Cycle Directed Advertising State
            and Initiating State
            and Central Role & Peripheral Role
          Low Duty Cycle Directed Advertising State
            and Initiating State
            and Central Role & Peripheral Role
          Connectable Advertising State
            and Connection State (Central Role)
            and Central Role & Peripheral Role
          High Duty Cycle Directed Advertising State
            and Connection State (Central Role)
            and Central Role & Peripheral Role
          Low Duty Cycle Directed Advertising State
            and Connection State (Central Role)
            and Central Role & Peripheral Role
          Connectable Advertising State
            and Connection State (Peripheral Role)
            and Central Role & Peripheral Role
          High Duty Cycle Directed Advertising State
            and Connection State (Peripheral Role)
            and Peripheral Role & Peripheral Role
          Low Duty Cycle Directed Advertising State
            and Connection State (Peripheral Role)
            and Peripheral Role & Peripheral Role
          Initiating State
            and Connection State (Peripheral Role)
            and Central Role & Peripheral Role
zephyr.exe[1299597]: < HCI Command: LE Read Maximum Data Length (0x08|0x002f) plen 0                                 #23 0.652204
> HCI Event: Command Complete (0x0e) plen 12                                                                         #24 0.652714
      LE Read Maximum Data Length (0x08|0x002f) ncmd 1
        Status: Success (0x00)
        Max TX octets: 251
        Max TX time: 2704
        Max RX octets: 251
        Max RX time: 2704
zephyr.exe[1299597]: < HCI Command: LE Write Suggested Default Data Length (0x08|0x0024) plen 4                      #25 0.672185
        TX octets: 251
        TX time: 2704
> HCI Event: Command Complete (0x0e) plen 4                                                                          #26 0.672689
      LE Write Suggested Default Data Length (0x08|0x0024) ncmd 1
        Status: Success (0x00)
zephyr.exe[1299597]: < HCI Command: LE Read Resolving List Size (0x08|0x002a) plen 0                                 #27 0.692182
> HCI Event: Command Complete (0x0e) plen 5                                                                          #28 0.692656
      LE Read Resolving List Size (0x08|0x002a) ncmd 1
        Status: Success (0x00)
        Size: 8
zephyr.exe[1299597]: < HCI Command: LE Set Event Mask (0x08|0x0001) plen 8                                           #29 0.712187
        Mask: 0x000002023f87fa5e
          LE Advertising Report
          LE Connection Update Complete
          LE Read Remote Used Features Complete
          LE Long Term Key Request
          LE Data Length Change
          LE Enhanced Connection Complete
          LE PHY Update Complete
          LE Extended Advertising Report
          LE Periodic Advertising Sync Established
          LE Periodic Advertising Report
          LE Periodic Advertising Sync Lost
          LE Extended Scan Timeout
          LE Extended Advertising Set Terminated
          LE Scan Request Received
          LE Periodic Advertising Sync Transfer Rvc
          LE CIS Established
          LE CIS Request
          LE Create BIG Complete
          LE Terminate BIG Complete
          LE BIG Sync Established Complete
          LE BIG Sync Lost
          LE BIG Info Advertising Report
          Unknown mask (0x0000020000000000)
> HCI Event: Command Complete (0x0e) plen 4                                                                          #30 0.712799
      LE Set Event Mask (0x08|0x0001) ncmd 1
        Status: Success (0x00)
zephyr.exe[1299597]: < HCI Command: Set Event Mask (0x03|0x0001) plen 8                                              #31 0.732207
        Mask: 0x2000800002008890
          Disconnection Complete
          Encryption Change
          Read Remote Version Information Complete
          Hardware Error
          Data Buffer Overflow
          Encryption Key Refresh Complete
          LE Meta
> HCI Event: Command Complete (0x0e) plen 4                                                                          #32 0.732847
      Set Event Mask (0x03|0x0001) ncmd 1
        Status: Success (0x00)
zephyr.exe[1299597]: < HCI Command: Read BD ADDR (0x04|0x0009) plen 0                                                #33 0.752154
> HCI Event: Command Complete (0x0e) plen 10                                                                         #34 0.752672
      Read BD ADDR (0x04|0x0009) ncmd 1
        Status: Success (0x00)
        Address: 00:00:00:00:00:00 (OUI 00-00-00)
zephyr.exe[1299597]: < HCI Command: LE Set Random Address (0x08|0x0005) plen 6                                       #35 0.772203
        Address: D5:B6:CC:31:DB:3B (Static)
> HCI Event: Command Complete (0x0e) plen 4                                                                          #36 0.772825
      LE Set Random Address (0x08|0x0005) ncmd 1
        Status: Success (0x00)
zephyr.exe[1299597]: < HCI Command: LE Set Extended Advertising Parameters (0x08|0x0036) plen 25                     #37 7.032302
        Handle: 0x00
        Properties: 0x0013
          Connectable
          Scannable
          Use legacy advertising PDUs: ADV_IND
        Min advertising interval: 100.000 msec (0x00a0)
        Max advertising interval: 150.000 msec (0x00f0)
        Channel map: 37, 38, 39 (0x07)
        Own address type: Random (0x01)
        Peer address type: Public (0x00)
        Peer address: 00:00:00:00:00:00 (OUI 00-00-00)
        Filter policy: Allow Scan Request from Any, Allow Connect Request from Any (0x00)
        TX power: Host has no preference (0x7f)
        Primary PHY: LE 1M (0x01)
        Secondary max skip: 0x00
        Secondary PHY: LE 1M (0x01)
        SID: 0x00
        Scan request notifications: Disabled (0x00)
> HCI Event: Command Complete (0x0e) plen 5                                                                          #38 7.033137
      LE Set Extended Advertising Parameters (0x08|0x0036) ncmd 1
        Status: Success (0x00)
        TX power (selected): 0 dbm (0x00)
zephyr.exe[1299597]: < HCI Command: LE Set Advertising Set Random Address (0x08|0x0035) plen 7                       #39 7.052265
        Advertising handle: 0x00
        Advertising random address: D5:B6:CC:31:DB:3B (Static)
> HCI Event: Command Complete (0x0e) plen 4                                                                          #40 7.052807
      LE Set Advertising Set Random Address (0x08|0x0035) ncmd 1
        Status: Success (0x00)
zephyr.exe[1299597]: < HCI Command: LE Set Extended Advertising Data (0x08|0x0037) plen 22                           #41 7.072297
        Handle: 0x00
        Operation: Complete extended advertising data (0x03)
        Fragment preference: Minimize fragmentation (0x01)
        Data length: 0x12
        Flags: 0x06
          LE General Discoverable Mode
          BR/EDR Not Supported
        Name (complete): Tester_2CB6EE
> HCI Event: Command Complete (0x0e) plen 4                                                                          #42 7.073050
      LE Set Extended Advertising Data (0x08|0x0037) ncmd 1
        Status: Success (0x00)
zephyr.exe[1299597]: < HCI Command: LE Set Extended Scan Response Data (0x08|0x0038) plen 4                          #43 7.092267
        Handle: 0x00
        Operation: Complete scan response data (0x03)
        Fragment preference: Minimize fragmentation (0x01)
        Data length: 0x00
> HCI Event: Command Complete (0x0e) plen 4                                                                          #44 7.092807
      LE Set Extended Scan Response Data (0x08|0x0038) ncmd 1
        Status: Success (0x00)
zephyr.exe[1299597]: < HCI Command: LE Set Extended Advertising Enable (0x08|0x0039) plen 6                          #45 7.112270
        Extended advertising: Enabled (0x01)
        Number of sets: 1 (0x01)
        Entry 0
          Handle: 0x00
          Duration: 0 ms (0x00)
          Max ext adv events: 0
> HCI Event: Command Complete (0x0e) plen 4                                                                          #46 7.112897
      LE Set Extended Advertising Enable (0x08|0x0039) ncmd 1
        Status: Success (0x00)
> HCI Event: LE Meta Event (0x3e) plen 31                                                                            #47 7.428502
      LE Enhanced Connection Complete (0x0a)
        Status: Success (0x00)
        Handle: 3
        Role: Peripheral (0x01)
        Peer address type: Public (0x00)
        Peer address: C0:07:E8:2C:B6:EE (OUI C0-07-E8)
        Local resolvable private address: 00:00:00:00:00:00 (Non-Resolvable)
        Peer resolvable private address: 00:00:00:00:00:00 (Non-Resolvable)
        Connection interval: 62.50 msec (0x0032)
        Connection latency: 0 (0x0000)
        Supervision timeout: 20000 msec (0x07d0)
        Central clock accuracy: 0x07
> HCI Event: LE Meta Event (0x3e) plen 6                                                                             #48 7.428617
      LE Advertising Set Terminated (0x12)
        Status: Success (0x00)
        Handle: 0
        Connection handle: 3
        Number of completed extended advertising events: 0
zephyr.exe[1299597]: < HCI Command: LE Read Remote Used Features (0x08|0x0016) plen 2                                #49 7.432381
        Handle: 3 Address: C0:07:E8:2C:B6:EE (OUI C0-07-E8)
> HCI Event: Command Status (0x0f) plen 4                                                                            #50 7.432747
      LE Read Remote Used Features (0x08|0x0016) ncmd 1
        Status: Success (0x00)
zephyr.exe[1299597]: < HCI Command: LE Set PHY (0x08|0x0032) plen 7                                                  #51 7.452226
        Handle: 3 Address: C0:07:E8:2C:B6:EE (OUI C0-07-E8)
        All PHYs preference: 0x00
        TX PHYs preference: 0x02
          LE 2M
        RX PHYs preference: 0x02
          LE 2M
        PHY options preference: Reserved (0x0000)
> HCI Event: Command Status (0x0f) plen 4                                                                            #52 7.452858
      LE Set PHY (0x08|0x0032) ncmd 1
        Status: Success (0x00)
> HCI Event: LE Meta Event (0x3e) plen 12                                                                            #53 7.617384
      LE Read Remote Used Features (0x04)
        Status: Success (0x00)
        Handle: 3 Address: C0:07:E8:2C:B6:EE (OUI C0-07-E8)
        Features: 0x2d 0x49 0x01 0xf7 0xef 0x39 0x00 0x80
          LE Encryption
          Extended Reject Indication
          Peripheral-initiated Features Exchange
          LE Data Packet Length Extension
          LE 2M PHY
          LE Coded PHY
          Channel Selection Algorithm #2
          Minimum Number of Used Channels Procedure
          Periodic Advertising Sync Transfer - Sender
          Periodic Advertising Sync Transfer - Recipient
          Sleep Clock Accuracy Updates
          Connected Isochronous Stream - Central
          Connected Isochronous Stream - Peripheral
          Isochronous Broadcaster
          Synchronized Receiver
          Connected Isochronous Stream (Host Support)
          LE Power Control Request
          LE Power Control Request
          LE Path Loss Monitoring
          Connection Subrating
          Connection Subrating (Host Support)
          Channel Classification
          Unknown features (0x8000390000000000)
> HCI Event: LE Meta Event (0x3e) plen 6                                                                             #54 8.116667
      LE PHY Update Complete (0x0c)
        Status: Success (0x00)
        Handle: 3 Address: C0:07:E8:2C:B6:EE (OUI C0-07-E8)
        TX PHY: LE 2M (0x02)
        RX PHY: LE 2M (0x02)
zephyr.exe[1299597]: < ACL Data TX: Handle 3 [1/3] flags 0x00 dlen 16                                               #55 12.442329
      LE L2CAP: Connection Parameter Update Request (0x12) ident 1 len 8
        Min interval: 24
        Max interval: 40
        Peripheral latency: 0
        Timeout multiplier: 42
> HCI Event: Number of Completed Packets (0x13) plen 5                                                              #56 12.554572
        Num handles: 1
        Handle: 3 Address: C0:07:E8:2C:B6:EE (OUI C0-07-E8)
        Count: 1
        Buffers: 0/3
        #55: len 16 (1 Kb/s)
        Latency: 112 msec (112-112 msec ~112 msec)
> ACL Data RX: Handle 3 flags 0x02 dlen 10                                                                          #57 12.554689
      LE L2CAP: Connection Parameter Update Response (0x13) ident 1 len 2
        Result: Connection Parameters accepted (0x0000)
zephyr.exe[1299597]: < HCI Command: Host Number of Completed Packets (0x03|0x0035) plen 5                           #58 12.572373
        Num handles: 1
        Handle: 3 Address: C0:07:E8:2C:B6:EE (OUI C0-07-E8)
        Count: 1
> ACL Data RX: Handle 3 flags 0x02 dlen 11                                                                          #59 15.117240
      SMP: Pairing Request (0x01) len 6
        IO capability: KeyboardDisplay (0x04)
        OOB data: Authentication data not present (0x00)
        Authentication requirement: Bonding, No MITM, Legacy, No Keypresses (0x01)
        Max encryption key size: 16
        Initiator key distribution: EncKey IdKey Sign (0x07)
        Responder key distribution: EncKey IdKey Sign (0x07)
zephyr.exe[1299597]: < HCI Command: Host Number of Completed Packets (0x03|0x0035) plen 5                           #60 15.132317
        Num handles: 1
        Handle: 3 Address: C0:07:E8:2C:B6:EE (OUI C0-07-E8)
        Count: 1
zephyr.exe[1299597]: < ACL Data TX: Handle 3 [1/3] flags 0x00 dlen 11                                               #61 15.132340
      SMP: Pairing Response (0x02) len 6
        IO capability: NoInputNoOutput (0x03)
        OOB data: Authentication data not present (0x00)
        Authentication requirement: Bonding, No MITM, Legacy, No Keypresses (0x01)
        Max encryption key size: 16
        Initiator key distribution: EncKey IdKey Sign (0x07)
        Responder key distribution: EncKey Sign (0x05)
> HCI Event: Number of Completed Packets (0x13) plen 5                                                              #62 15.242133
        Num handles: 1
        Handle: 3 Address: C0:07:E8:2C:B6:EE (OUI C0-07-E8)
        Count: 1
        Buffers: 0/3
        #61: len 11 (0 Kb/s)
        Latency: 109 msec (109-112 msec ~111 msec)
> ACL Data RX: Handle 3 flags 0x02 dlen 21                                                                          #63 15.242477
      SMP: Pairing Confirm (0x03) len 16
        Confirm value[16]: ceeb66f80b3ce0d4c25e00d1fb0fa953
zephyr.exe[1299597]: < HCI Command: Host Number of Completed Packets (0x03|0x0035) plen 5                           #64 15.252466
        Num handles: 1
        Handle: 3 Address: C0:07:E8:2C:B6:EE (OUI C0-07-E8)
        Count: 1
zephyr.exe[1299597]: < ACL Data TX: Handle 3 [1/3] flags 0x00 dlen 21                                               #65 15.252478
      SMP: Pairing Confirm (0x03) len 16
        Confirm value[16]: 9cc011b59f9603478615e2e41424d094
> HCI Event: Number of Completed Packets (0x13) plen 5                                                              #66 15.367162
        Num handles: 1
        Handle: 3 Address: C0:07:E8:2C:B6:EE (OUI C0-07-E8)
        Count: 1
        Buffers: 0/3
        #65: len 21 (1 Kb/s)
        Latency: 114 msec (109-114 msec ~112 msec)
> ACL Data RX: Handle 3 flags 0x02 dlen 21                                                                          #67 15.367424
      SMP: Pairing Random (0x04) len 16
        Random value[16]: 634bed0aac90bf480000000000000000
zephyr.exe[1299597]: < HCI Command: Host Number of Completed Packets (0x03|0x0035) plen 5                           #68 15.372481
        Num handles: 1
        Handle: 3 Address: C0:07:E8:2C:B6:EE (OUI C0-07-E8)
        Count: 1
zephyr.exe[1299597]: < ACL Data TX: Handle 3 [1/3] flags 0x00 dlen 21                                               #69 15.372642
      SMP: Pairing Random (0x04) len 16
        Random value[16]: 8e6108f966a694cbe26df70bb96773e6
> HCI Event: Number of Completed Packets (0x13) plen 5                                                              #70 15.491967
        Num handles: 1
        Handle: 3 Address: C0:07:E8:2C:B6:EE (OUI C0-07-E8)
        Count: 1
        Buffers: 0/3
        #69: len 21 (1 Kb/s)
        Latency: 119 msec (109-119 msec ~116 msec)
> HCI Event: LE Meta Event (0x3e) plen 13                                                                           #71 15.554939
      LE Long Term Key Request (0x05)
        Handle: 3 Address: C0:07:E8:2C:B6:EE (OUI C0-07-E8)
        Random number: 0x0000000000000000
        Encrypted diversifier: 0x0000
zephyr.exe[1299597]: < HCI Command: LE Long Term Key Request Reply (0x08|0x001a) plen 18                            #72 15.572311
        Handle: 3 Address: C0:07:E8:2C:B6:EE (OUI C0-07-E8)
        Long term key[16]: fac3092269f64fd34d8d8cd40c2bea26
> HCI Event: Command Complete (0x0e) plen 6                                                                         #73 15.572956
      LE Long Term Key Request Reply (0x08|0x001a) ncmd 1
        Status: Success (0x00)
        Handle: 3 Address: C0:07:E8:2C:B6:EE (OUI C0-07-E8)
> HCI Event: Encryption Change (0x08) plen 4                                                                        #74 15.867240
        Status: Success (0x00)
        Handle: 3 Address: C0:07:E8:2C:B6:EE (OUI C0-07-E8)
        Encryption: Enabled with AES-CCM (0x01)
zephyr.exe[1299597]: < ACL Data TX: Handle 3 [1/3] flags 0x00 dlen 21                                               #75 15.982392
      SMP: Encryption Information (0x06) len 16
        Long term key[16]: 5da095555cc64d02679f89a05211af56
zephyr.exe[1299597]: < ACL Data TX: Handle 3 [2/3] flags 0x00 dlen 15                                               #76 15.982412
      SMP: Central Identification (0x07) len 10
        EDIV: 0x825e
        Rand: 0x84c81ed264dab3d8
zephyr.exe[1299597]: < ACL Data TX: Handle 3 [3/3] flags 0x00 dlen 21                                               #77 15.982414
      SMP: Signing Information (0x0a) len 16
        Signature key[16]: bc235a02440d0c3424a2acf8fd71a45c
> HCI Event: Number of Completed Packets (0x13) plen 5                                                              #78 15.992489
        Num handles: 1
        Handle: 3 Address: C0:07:E8:2C:B6:EE (OUI C0-07-E8)
        Count: 1
        Buffers: 2/3
        #75: len 21 (16 Kb/s)
        Latency: 10 msec (10-119 msec ~63 msec)
> HCI Event: Number of Completed Packets (0x13) plen 5                                                              #79 15.992886
        Num handles: 1
        Handle: 3 Address: C0:07:E8:2C:B6:EE (OUI C0-07-E8)
        Count: 1
        Buffers: 1/3
        #76: len 15 (12 Kb/s)
        Latency: 10 msec (10-119 msec ~36 msec)
> HCI Event: Number of Completed Packets (0x13) plen 5                                                              #80 16.054663
        Num handles: 1
        Handle: 3 Address: C0:07:E8:2C:B6:EE (OUI C0-07-E8)
        Count: 1
        Buffers: 0/3
        #77: len 21 (2 Kb/s)
        Latency: 72 msec (10-119 msec ~54 msec)
> ACL Data RX: Handle 3 flags 0x02 dlen 21                                                                          #81 16.054871
      SMP: Encryption Information (0x06) len 16
        Long term key[16]: 11f25e9c4b3602a78b94cecbc14cd761
> ACL Data RX: Handle 3 flags 0x02 dlen 15                                                                          #82 16.055188
      SMP: Central Identification (0x07) len 10
        EDIV: 0x58a3
        Rand: 0x04a5db20c32d9d33
> ACL Data RX: Handle 3 flags 0x02 dlen 21                                                                          #83 16.055658
      SMP: Identity Information (0x08) len 16
        Identity resolving key[16]: c2dcdedb0a78eb493bb11879c31158e5
zephyr.exe[1299597]: < HCI Command: Host Number of Completed Packets (0x03|0x0035) plen 5                           #84 16.072436
        Num handles: 1
        Handle: 3 Address: C0:07:E8:2C:B6:EE (OUI C0-07-E8)
        Count: 1
zephyr.exe[1299597]: < HCI Command: Host Number of Completed Packets (0x03|0x0035) plen 5                           #85 16.072624
        Num handles: 1
        Handle: 3 Address: C0:07:E8:2C:B6:EE (OUI C0-07-E8)
        Count: 1
zephyr.exe[1299597]: < HCI Command: Host Number of Completed Packets (0x03|0x0035) plen 5                           #86 16.072632
        Num handles: 1
        Handle: 3 Address: C0:07:E8:2C:B6:EE (OUI C0-07-E8)
        Count: 1
> ACL Data RX: Handle 3 flags 0x02 dlen 12                                                                          #87 16.073013
      SMP: Identity Address Information (0x09) len 7
        Address: C0:07:E8:2C:B6:EE (OUI C0-07-E8)
zephyr.exe[1299597]: < HCI Command: LE Add Device To Resolving List (0x08|0x0027) plen 39                           #88 16.092421
        Address type: Public (0x00)
        Address: C0:07:E8:2C:B6:EE (OUI C0-07-E8)
        Peer identity resolving key[16]: c2dcdedb0a78eb493bb11879c31158e5
        Local identity resolving key[16]: 00000000000000000000000000000000
> HCI Event: Command Complete (0x0e) plen 4                                                                         #89 16.093440
      LE Add Device To Resolving List (0x08|0x0027) ncmd 1
        Status: Success (0x00)
zephyr.exe[1299597]: < HCI Command: LE Set Privacy Mode (0x08|0x004e) plen 8                                        #90 16.112367
        Peer Identity address type: Public (0x00)
        Peer Identity address: C0:07:E8:2C:B6:EE (OUI C0-07-E8)
        Privacy Mode: Use Device Privacy (0x01)
> HCI Event: Command Complete (0x0e) plen 4                                                                         #91 16.112953
      LE Set Privacy Mode (0x08|0x004e) ncmd 1
        Status: Success (0x00)
> ACL Data RX: Handle 3 flags 0x02 dlen 21                                                                          #92 16.117238
      SMP: Signing Information (0x0a) len 16
        Signature key[16]: 467795163562ec0ca26c19e0531530a8
> ACL Data RX: Handle 3 flags 0x02 dlen 26                                                                          #93 16.117773
      LE L2CAP: Enhanced Credit Connection Request (0x17) ident 1 len 18
        PSM: 39 (0x0027)
        MTU: 64
        MPS: 64
        Credits: 5
        Source CID: 84
        Source CID: 83
        Source CID: 82
        Source CID: 81
        Source CID: 80
zephyr.exe[1299597]: < HCI Command: LE Set Address Resolution Enable (0x08|0x002d) plen 1                           #94 16.132362
        Address resolution: Enabled (0x01)
> HCI Event: Command Complete (0x0e) plen 4                                                                         #95 16.132849
      LE Set Address Resolution Enable (0x08|0x002d) ncmd 1
        Status: Success (0x00)
zephyr.exe[1299597]: < HCI Command: Host Number of Completed Packets (0x03|0x0035) plen 5                           #96 16.152359
        Num handles: 1
        Handle: 3 Address: C0:07:E8:2C:B6:EE (OUI C0-07-E8)
        Count: 1
zephyr.exe[1299597]: < HCI Command: Host Number of Completed Packets (0x03|0x0035) plen 5                           #97 16.152392
        Num handles: 1
        Handle: 3 Address: C0:07:E8:2C:B6:EE (OUI C0-07-E8)
        Count: 1
zephyr.exe[1299597]: < HCI Command: Host Number of Completed Packets (0x03|0x0035) plen 5                           #98 16.152409
        Num handles: 1
        Handle: 3 Address: C0:07:E8:2C:B6:EE (OUI C0-07-E8)
        Count: 1
zephyr.exe[1299597]: < ACL Data TX: Handle 3 [1/3] flags 0x00 dlen 26                                               #99 16.152415
      LE L2CAP: Enhanced Credit Connection Response (0x18) ident 1 len 18
        MTU: 249
        MPS: 251
        Credits: 1
        Result: Connection successful (0x0000)
        Destination CID: 64
        Destination CID: 65
        Destination CID: 66
        Destination CID: 67
        Destination CID: 68
> HCI Event: Number of Completed Packets (0x13) plen 5                                                             #100 16.242116
        Num handles: 1
        Handle: 3 Address: C0:07:E8:2C:B6:EE (OUI C0-07-E8)
        Count: 1
        Buffers: 0/3
        #99: len 26 (2 Kb/s)
        Latency: 89 msec (10-119 msec ~72 msec)
zephyr.exe[1299597]: < ACL Data TX: Handle 3 [1/3] flags 0x00 dlen 13                                              #101 18.462399
      Channel: 80 len 9 sdu 7 [PSM 39 mode Enhanced Credit (0x81)] {chan 4}
      ATT: Read By Type Request (0x08) len 6
        Handle range: 0x0001-0x0023
        Attribute type: Characteristic (0x2803)
> HCI Event: Number of Completed Packets (0x13) plen 5                                                             #102 18.554663
        Num handles: 1
        Handle: 3 Address: C0:07:E8:2C:B6:EE (OUI C0-07-E8)
        Count: 1
        Buffers: 0/3
        #101: len 13 (1 Kb/s)
        Latency: 92 msec (10-119 msec ~82 msec)
        Channel: 80 [PSM 39 mode Enhanced Credit (0x81)] {chan 4}
        Channel Latency: 92 msec (92-92 msec ~92 msec)
> ACL Data RX: Handle 3 flags 0x02 dlen 15                                                                         #103 18.554839
      Channel: 68 len 11 sdu 9 [PSM 39 mode Enhanced Credit (0x81)] {chan 4}
      ATT: Read By Type Response (0x09) len 8
        Attribute data length: 7
        Attribute data list: 1 entry
        Handle: 0x0003
        Value[5]: 0204000cb0
            Properties: 0x02
              Read (0x02)
            Value Handle: 0x0004
            Value UUID: Unknown (0xb00c)
zephyr.exe[1299597]: < HCI Command: Host Number of Completed Packets (0x03|0x0035) plen 5                          #104 18.572436
        Num handles: 1
        Handle: 3 Address: C0:07:E8:2C:B6:EE (OUI C0-07-E8)
        Count: 1
zephyr.exe[1299597]: < ACL Data TX: Handle 3 [1/3] flags 0x00 dlen 13                                              #105 18.572646
      Channel: 80 len 9 sdu 7 [PSM 39 mode Enhanced Credit (0x81)] {chan 4}
      ATT: Read By Type Request (0x08) len 6
        Handle range: 0x0004-0x0023
        Attribute type: Characteristic (0x2803)
zephyr.exe[1299597]: < ACL Data TX: Handle 3 [2/3] flags 0x00 dlen 12                                              #106 18.572736
      LE L2CAP: LE Flow Control Credit (0x16) ident 2 len 4
        Source CID: 68
        Credits: 1
> HCI Event: Number of Completed Packets (0x13) plen 5                                                             #107 18.617392
        Num handles: 1
        Handle: 3 Address: C0:07:E8:2C:B6:EE (OUI C0-07-E8)
        Count: 1
        Buffers: 1/3
        #105: len 13 (2 Kb/s)
        Latency: 44 msec (10-119 msec ~63 msec)
        Channel: 80 [PSM 39 mode Enhanced Credit (0x81)] {chan 4}
        Channel Latency: 44 msec (44-92 msec ~68 msec)
> HCI Event: Number of Completed Packets (0x13) plen 5                                                             #108 18.679700
        Num handles: 1
        Handle: 3 Address: C0:07:E8:2C:B6:EE (OUI C0-07-E8)
        Count: 1
        Buffers: 0/3
        #106: len 12 (0 Kb/s)
        Latency: 106 msec (10-119 msec ~85 msec)
        Channel: 80 [PSM 39 mode Enhanced Credit (0x81)] {chan 4}
        Channel Latency: 106 msec (44-106 msec ~87 msec)
> ACL Data RX: Handle 3 flags 0x02 dlen 27                                                                         #109 18.679954
> ACL Data RX: Handle 3 flags 0x01 dlen 2                                                                          #110 18.680033
      Channel: 68 len 25 sdu 23 [PSM 39 mode Enhanced Credit (0x81)] {chan 4}
      ATT: Read By Type Response (0x09) len 22
        Attribute data length: 21
        Attribute data list: 1 entry
        Handle: 0x0005
        Value[19]: 020600efcdab8967452301000000000bb00000
            Properties: 0x02
              Read (0x02)
            Value Handle: 0x0006
            Value UUID: Vendor specific (0000b00b-0000-0000-0123-456789abcdef)
zephyr.exe[1299597]: < HCI Command: Host Number of Completed Packets (0x03|0x0035) plen 5                          #111 18.692496
        Num handles: 1
        Handle: 3 Address: C0:07:E8:2C:B6:EE (OUI C0-07-E8)
        Count: 1
zephyr.exe[1299597]: < HCI Command: Host Number of Completed Packets (0x03|0x0035) plen 5                          #112 18.692765
        Num handles: 1
        Handle: 3 Address: C0:07:E8:2C:B6:EE (OUI C0-07-E8)
        Count: 1
zephyr.exe[1299597]: < ACL Data TX: Handle 3 [1/3] flags 0x00 dlen 13                                              #113 18.692771
      Channel: 80 len 9 sdu 7 [PSM 39 mode Enhanced Credit (0x81)] {chan 4}
      ATT: Read By Type Request (0x08) len 6
        Handle range: 0x0006-0x0023
        Attribute type: Characteristic (0x2803)
zephyr.exe[1299597]: < ACL Data TX: Handle 3 [2/3] flags 0x00 dlen 12                                              #114 18.692772
      LE L2CAP: LE Flow Control Credit (0x16) ident 3 len 4
        Source CID: 68
        Credits: 1
> HCI Event: Number of Completed Packets (0x13) plen 5                                                             #115 18.742478
        Num handles: 1
        Handle: 3 Address: C0:07:E8:2C:B6:EE (OUI C0-07-E8)
        Count: 1
        Buffers: 1/3
        #113: len 13 (2 Kb/s)
        Latency: 49 msec (10-119 msec ~67 msec)
        Channel: 80 [PSM 39 mode Enhanced Credit (0x81)] {chan 4}
        Channel Latency: 49 msec (44-106 msec ~68 msec)
> HCI Event: Number of Completed Packets (0x13) plen 5                                                             #116 18.804583
        Num handles: 1
        Handle: 3 Address: C0:07:E8:2C:B6:EE (OUI C0-07-E8)
        Count: 1
        Buffers: 0/3
        #114: len 12 (0 Kb/s)
        Latency: 111 msec (10-119 msec ~89 msec)
> ACL Data RX: Handle 3 flags 0x02 dlen 15                                                                         #117 18.804897
      Channel: 68 len 11 sdu 9 [PSM 39 mode Enhanced Credit (0x81)] {chan 4}
      ATT: Read By Type Response (0x09) len 8
        Attribute data length: 7
        Attribute data list: 1 entry
        Handle: 0x0021
        Value[5]: 202200052a
            Properties: 0x20
              Indicate (0x20)
            Value Handle: 0x0022
            Value UUID: Service Changed (0x2a05)
zephyr.exe[1299597]: < HCI Command: Host Number of Completed Packets (0x03|0x0035) plen 5         