Bluetooth monitor ver 5.72
btmon[325837]: = Note: Linux version 6.14.0-36-generic (x86_64)                                                          0.048804
btmon[325837]: = Note: Bluetooth subsystem version 2.22                                                                  0.048806
= New Index: 00:00:00:00:00:00 (Primary,UART,hci1)                                                                       0.048807
= New Index: 48:5F:99:8E:E0:64 (Primary,USB,hci0)                                                                        0.048808
= Open Index: 00:00:00:00:00:00                                                                                          0.063022
= Index Info: 00:00:00:00:00:00 (Nordic Semiconductor ASA)                                                               0.063028
zephyr.exe[325839]: @ USER Open: main (privileged) version 2.22                                                 {0x0001} 0.063031
zephyr.exe[325839]: < HCI Command: Reset (0x03|0x0003) plen 0                                                         #1 0.063488
> HCI Event: Command Complete (0x0e) plen 4                                                                           #2 0.064063
      Reset (0x03|0x0003) ncmd 1
        Status: Success (0x00)
zephyr.exe[325839]: < HCI Command: Read Local Supported Features (0x04|0x0003) plen 0                                 #3 0.082932
> HCI Event: Command Complete (0x0e) plen 12                                                                          #4 0.083433
      Read Local Supported Features (0x04|0x0003) ncmd 1
        Status: Success (0x00)
        Features: 0x00 0x00 0x00 0x00 0x60 0x00 0x00 0x00
          BR/EDR Not Supported
          LE Supported (Controller)
zephyr.exe[325839]: < HCI Command: Read Local Version Information (0x04|0x0001) plen 0                                #5 0.102903
> HCI Event: Command Complete (0x0e) plen 12                                                                          #6 0.103441
      Read Local Version Information (0x04|0x0001) ncmd 1
        Status: Success (0x00)
        HCI version: Reserved (0x0e) - Revision 12520 (0x30e8)
        LMP version: Reserved (0x0e) - Subversion 12520 (0x30e8)
        Manufacturer: Nordic Semiconductor ASA (89)
zephyr.exe[325839]: < HCI Command: Read Local Supported Commands (0x04|0x0002) plen 0                                 #7 0.122892
> HCI Event: Command Complete (0x0e) plen 68                                                                          #8 0.123906
      Read Local Supported Commands (0x04|0x0002) ncmd 1
        Status: Success (0x00)
        Commands: 119 entries
          Disconnect (Octet 0 - Bit 5)
          Read Remote Version Information (Octet 2 - Bit 7)
          Set Event Mask (Octet 5 - Bit 6)
          Reset (Octet 5 - Bit 7)
          Read Connection Accept Timeout (Octet 7 - Bit 2)
          Write Connection Accept Timeout (Octet 7 - Bit 3)
          Read Transmit Power Level (Octet 10 - Bit 2)
          Set Controller To Host Flow Control (Octet 10 - Bit 5)
          Host Buffer Size (Octet 10 - Bit 6)
          Host Number of Completed Packets (Octet 10 - Bit 7)
          Read Local Version Information (Octet 14 - Bit 3)
          Read Local Supported Features (Octet 14 - Bit 5)
          Read BD ADDR (Octet 15 - Bit 1)
          Read RSSI (Octet 15 - Bit 5)
          Set Event Mask Page 2 (Octet 22 - Bit 2)
          LE Set Event Mask (Octet 25 - Bit 0)
          LE Read Buffer Size (Octet 25 - Bit 1)
          LE Read Local Supported Features (Octet 25 - Bit 2)
          LE Set Random Address (Octet 25 - Bit 4)
          LE Set Advertising Parameters (Octet 25 - Bit 5)
          LE Read Advertising Channel TX Power (Octet 25 - Bit 6)
          LE Set Advertising Data (Octet 25 - Bit 7)
          LE Set Scan Response Data (Octet 26 - Bit 0)
          LE Set Advertise Enable (Octet 26 - Bit 1)
          LE Set Scan Parameters (Octet 26 - Bit 2)
          LE Set Scan Enable (Octet 26 - Bit 3)
          LE Create Connection (Octet 26 - Bit 4)
          LE Create Connection Cancel (Octet 26 - Bit 5)
          LE Read Accept List Size (Octet 26 - Bit 6)
          LE Clear Accept List (Octet 26 - Bit 7)
          LE Add Device To Accept List (Octet 27 - Bit 0)
          LE Remove Device From Accept List (Octet 27 - Bit 1)
          LE Connection Update (Octet 27 - Bit 2)
          LE Set Host Channel Classification (Octet 27 - Bit 3)
          LE Read Channel Map (Octet 27 - Bit 4)
          LE Read Remote Used Features (Octet 27 - Bit 5)
          LE Encrypt (Octet 27 - Bit 6)
          LE Rand (Octet 27 - Bit 7)
          LE Start Encryption (Octet 28 - Bit 0)
          LE Long Term Key Request Reply (Octet 28 - Bit 1)
          LE Long Term Key Request Neg Reply (Octet 28 - Bit 2)
          LE Read Supported States (Octet 28 - Bit 3)
          LE Receiver Test (Octet 28 - Bit 4)
          LE Transmitter Test (Octet 28 - Bit 5)
          LE Test End (Octet 28 - Bit 6)
          Read Authenticated Payload Timeout (Octet 32 - Bit 4)
          Write Authenticated Payload Timeout (Octet 32 - Bit 5)
          LE Set Data Length (Octet 33 - Bit 6)
          LE Read Suggested Default Data Length (Octet 33 - Bit 7)
          LE Write Suggested Default Data Length (Octet 34 - Bit 0)
          LE Add Device To Resolving List (Octet 34 - Bit 3)
          LE Remove Device From Resolving List (Octet 34 - Bit 4)
          LE Clear Resolving List (Octet 34 - Bit 5)
          LE Read Resolving List Size (Octet 34 - Bit 6)
          LE Set Address Resolution Enable (Octet 35 - Bit 1)
          LE Set Resolvable Private Address Timeout (Octet 35 - Bit 2)
          LE Read Maximum Data Length (Octet 35 - Bit 3)
          LE Read PHY (Octet 35 - Bit 4)
          LE Set Default PHY (Octet 35 - Bit 5)
          LE Set PHY (Octet 35 - Bit 6)
          LE Enhanced Receiver Test (Octet 35 - Bit 7)
          LE Enhanced Transmitter Test (Octet 36 - Bit 0)
          LE Set Advertising Set Random Address (Octet 36 - Bit 1)
          LE Set Extended Advertising Parameters (Octet 36 - Bit 2)
          LE Set Extended Advertising Data (Octet 36 - Bit 3)
          LE Set Extended Scan Response Data (Octet 36 - Bit 4)
          LE Set Extended Advertising Enable (Octet 36 - Bit 5)
          LE Read Maximum Advertising Data Length (Octet 36 - Bit 6)
          LE Read Number of Supported Advertising Sets (Octet 36 - Bit 7)
          LE Remove Advertising Set (Octet 37 - Bit 0)
          LE Clear Advertising Sets (Octet 37 - Bit 1)
          LE Set Periodic Advertising Parameters (Octet 37 - Bit 2)
          LE Set Periodic Advertising Data (Octet 37 - Bit 3)
          LE Set Periodic Advertising Enable (Octet 37 - Bit 4)
          LE Set Extended Scan Parameters (Octet 37 - Bit 5)
          LE Set Extended Scan Enable (Octet 37 - Bit 6)
          LE Extended Create Connection (Octet 37 - Bit 7)
          LE Periodic Advertising Create Sync (Octet 38 - Bit 0)
          LE Periodic Advertising Create Sync Cancel (Octet 38 - Bit 1)
          LE Periodic Advertising Terminate Sync (Octet 38 - Bit 2)
          LE Add Device To Periodic Advertiser List (Octet 38 - Bit 3)
          LE Remove Device From Periodic Advertiser List (Octet 38 - Bit 4)
          LE Clear Periodic Advertiser List (Octet 38 - Bit 5)
          LE Read Periodic Advertiser List Size (Octet 38 - Bit 6)
          LE Read Transmit Power (Octet 38 - Bit 7)
          LE Read RF Path Compensation (Octet 39 - Bit 0)
          LE Write RF Path Compensation (Octet 39 - Bit 1)
          LE Set Privacy Mode (Octet 39 - Bit 2)
          LE Periodic Advertising Receive Enable (Octet 40 - Bit 5)
          LE Periodic Advertising Sync Transfer (Octet 40 - Bit 6)
          LE Periodic Advertising Set Info Transfer (Octet 40 - Bit 7)
          LE Periodic Advertising Sync Transfer Parameters (Octet 41 - Bit 0)
          LE Set Default Periodic Advertisng Sync Transfer Parameters (Octet 41 - Bit 1)
          LE Read Buffer v2 (Octet 41 - Bit 5)
          LE Read ISO TX Sync (Octet 41 - Bit 6)
          LE Set Connected Isochronous Group Parameters (Octet 41 - Bit 7)
          LE Set Connected Isochronous Group Parameters Test (Octet 42 - Bit 0)
          LE Create Connected Isochronous Stream (Octet 42 - Bit 1)
          LE Remove Connected Isochronous Group (Octet 42 - Bit 2)
          LE Accept Connected Isochronous Stream Request (Octet 42 - Bit 3)
          LE Reject Connected Isochronous Stream Request (Octet 42 - Bit 4)
          LE Create Broadcast Isochronous Group (Octet 42 - Bit 5)
          LE Create Broadcast Isochronous Group Test (Octet 42 - Bit 6)
          LE Terminate Broadcast Isochronous Group (Octet 42 - Bit 7)
          LE Broadcast Isochronous Group Create Sync (Octet 43 - Bit 0)
          LE Broadcast Isochronous Group Terminate Sync (Octet 43 - Bit 1)
          LE Request Peer SCA (Octet 43 - Bit 2)
          LE Setup Isochronous Data Path (Octet 43 - Bit 3)
          LE Remove Isochronous Data Path (Octet 43 - Bit 4)
          LE Isochronous Transmit Test (Octet 43 - Bit 5)
          LE Isochronous Receive Test (Octet 43 - Bit 6)
          LE Isochronous Read Test Counters (Octet 43 - Bit 7)
          LE Isochronous Read Test Counters (Octet 44 - Bit 0)
          LE Set Host Feature (Octet 44 - Bit 1)
          Octet 44 - Bit 2 
          Octet 45 - Bit 6 
          Octet 46 - Bit 0 
          Octet 46 - Bit 1 
          Octet 46 - Bit 2 
zephyr.exe[325839]: < HCI Command: Host Buffer Size (0x03|0x0033) plen 7                                              #9 0.142910
        ACL MTU: 255  ACL max packet: 16
        SCO MTU: 0    SCO max packet: 0
> HCI Event: Command Complete (0x0e) plen 4                                                                          #10 0.143406
      Host Buffer Size (0x03|0x0033) ncmd 1
        Status: Success (0x00)
zephyr.exe[325839]: < HCI Command: Set Controller To Host Flow Control (0x03|0x0031) plen 1                          #11 0.162911
        Flow control: ACL Data Packets (0x01)
> HCI Event: Command Complete (0x0e) plen 4                                                                          #12 0.163346
      Set Controller To Host Flow Control (0x03|0x0031) ncmd 1
        Status: Success (0x00)
zephyr.exe[325839]: < HCI Command: LE Read Local Supported Features (0x08|0x0003) plen 0                             #13 0.182917
> HCI Event: Command Complete (0x0e) plen 12                                                                         #14 0.183330
      LE Read Local Supported Features (0x08|0x0003) ncmd 1
        Status: Success (0x00)
        Features: 0xfd 0x79 0x00 0xf7 0x30 0x01 0x00 0x00
          LE Encryption
          Extended Reject Indication
          Peripheral-initiated Features Exchange
          LE Ping
          LE Data Packet Length Extension
          LL Privacy
          Extended Scanner Filter Policies
          LE 2M PHY
          LE Coded PHY
          LE Extended Advertising
          LE Periodic Advertising
          Channel Selection Algorithm #2
          Periodic Advertising Sync Transfer - Sender
          Periodic Advertising Sync Transfer - Recipient
          Sleep Clock Accuracy Updates
          Connected Isochronous Stream - Central
          Connected Isochronous Stream - Peripheral
          Isochronous Broadcaster
          Synchronized Receiver
          Periodic Advertising ADI support
          Connection Subrating
          Unknown features (0x0000010000000000)
zephyr.exe[325839]: < HCI Command: LE Set Host Feature (0x08|0x0074) plen 2                                          #15 0.202919
        Bit Number: 32
          Connected Isochronous Stream (Host Support)
        Bit Value: 1
> HCI Event: Command Complete (0x0e) plen 4                                                                          #16 0.203318
      LE Set Host Feature (0x08|0x0074) ncmd 1
        Status: Success (0x00)
zephyr.exe[325839]: < HCI Command: LE Read Buffer v2 (0x08|0x0060) plen 0                                            #17 0.222870
> HCI Event: Command Complete (0x0e) plen 10                                                                         #18 0.223303
      LE Read Buffer v2 (0x08|0x0060) ncmd 1
        Status: Success (0x00)
        ACL MTU: 27
        ACL max packet: 3
        ISO MTU: 318
        ISO max packet: 3
zephyr.exe[325839]: < HCI Command: LE Read Maximum Advertising Data Length (0x08|0x003a) plen 0                      #19 0.242938
> HCI Event: Command Complete (0x0e) plen 6                                                                          #20 0.243381
      LE Read Maximum Advertising Data Length (0x08|0x003a) ncmd 1
        Status: Success (0x00)
        Max length: 1650
zephyr.exe[325839]: < HCI Command: LE Read Supported States (0x08|0x001c) plen 0                                     #21 0.262917
> HCI Event: Command Complete (0x0e) plen 12                                                                         #22 0.263320
      LE Read Supported States (0x08|0x001c) ncmd 1
        Status: Success (0x00)
        States: 0x000003ff3e0306ff
          Non-connectable Advertising State
          Scannable Advertising State
          Connectable Advertising State
          High Duty Cycle Directed Advertising State
          Passive Scanning State
          Active Scanning State
          Initiating State
            and Connection State (Central Role)
          Connection State (Peripheral Role)
          Scannable Advertising State
            and Passive Scanning State
          Connectable Advertising State
            and Passive Scanning State
          Non-connectable Advertising State
            and Initiating State
          Scannable Advertising State
            and Initiating State
          Active Scanning State
            and Connection State (Central Role)
          Passive Scanning State
            and Connection State (Peripheral Role)
          Active Scanning State
            and Connection State (Peripheral Role)
          Initiating State
            and Connection State (Central Role)
            and Central Role & Central Role
          Low Duty Cycle Directed Advertising State
          Connectable Advertising State
            and Initiating State
            and Central Role & Peripheral Role
          High Duty Cycle Directed Advertising State
            and Initiating State
            and Central Role & Peripheral Role
          Low Duty Cycle Directed Advertising State
            and Initiating State
            and Central Role & Peripheral Role
          Connectable Advertising State
            and Connection State (Central Role)
            and Central Role & Peripheral Role
          High Duty Cycle Directed Advertising State
            and Connection State (Central Role)
            and Central Role & Peripheral Role
          Low Duty Cycle Directed Advertising State
            and Connection State (Central Role)
            and Central Role & Peripheral Role
          Connectable Advertising State
            and Connection State (Peripheral Role)
            and Central Role & Peripheral Role
          High Duty Cycle Directed Advertising State
            and Connection State (Peripheral Role)
            and Peripheral Role & Peripheral Role
          Low Duty Cycle Directed Advertising State
            and Connection State (Peripheral Role)
            and Peripheral Role & Peripheral Role
          Initiating State
            and Connection State (Peripheral Role)
            and Central Role & Peripheral Role
zephyr.exe[325839]: < HCI Command: LE Read Maximum Data Length (0x08|0x002f) plen 0                                  #23 0.282894
> HCI Event: Command Complete (0x0e) plen 12                                                                         #24 0.283368
      LE Read Maximum Data Length (0x08|0x002f) ncmd 1
        Status: Success (0x00)
        Max TX octets: 251
        Max TX time: 2704
        Max RX octets: 251
        Max RX time: 2704
zephyr.exe[325839]: < HCI Command: LE Write Suggested Default Data Length (0x08|0x0024) plen 4                       #25 0.302889
        TX octets: 251
        TX time: 2704
> HCI Event: Command Complete (0x0e) plen 4                                                                          #26 0.303360
      LE Write Suggested Default Data Length (0x08|0x0024) ncmd 1
        Status: Success (0x00)
zephyr.exe[325839]: < HCI Command: LE Read Resolving List Size (0x08|0x002a) plen 0                                  #27 0.322940
> HCI Event: Command Complete (0x0e) plen 5                                                                          #28 0.323328
      LE Read Resolving List Size (0x08|0x002a) ncmd 1
        Status: Success (0x00)
        Size: 8
zephyr.exe[325839]: < HCI Command: LE Set Event Mask (0x08|0x0001) plen 8                                            #29 0.342905
        Mask: 0x000002023f87fa5e
          LE Advertising Report
          LE Connection Update Complete
          LE Read Remote Used Features Complete
          LE Long Term Key Request
          LE Data Length Change
          LE Enhanced Connection Complete
          LE PHY Update Complete
          LE Extended Advertising Report
          LE Periodic Advertising Sync Established
          LE Periodic Advertising Report
          LE Periodic Advertising Sync Lost
          LE Extended Scan Timeout
          LE Extended Advertising Set Terminated
          LE Scan Request Received
          LE Periodic Advertising Sync Transfer Rvc
          LE CIS Established
          LE CIS Request
          LE Create BIG Complete
          LE Terminate BIG Complete
          LE BIG Sync Estabilished Complete
          LE BIG Sync Lost
          LE BIG Info Advertising Report
          Unknown mask (0x0000020000000000)
> HCI Event: Command Complete (0x0e) plen 4                                                                          #30 0.343504
      LE Set Event Mask (0x08|0x0001) ncmd 1
        Status: Success (0x00)
zephyr.exe[325839]: < HCI Command: Set Event Mask (0x03|0x0001) plen 8                                               #31 0.362874
        Mask: 0x2000800002008890
          Disconnection Complete
          Encryption Change
          Read Remote Version Information Complete
          Hardware Error
          Data Buffer Overflow
          Encryption Key Refresh Complete
          LE Meta
> HCI Event: Command Complete (0x0e) plen 4                                                                          #32 0.363435
      Set Event Mask (0x03|0x0001) ncmd 1
        Status: Success (0x00)
zephyr.exe[325839]: < HCI Command: Read BD ADDR (0x04|0x0009) plen 0                                                 #33 0.382926
> HCI Event: Command Complete (0x0e) plen 10                                                                         #34 0.383478
      Read BD ADDR (0x04|0x0009) ncmd 1
        Status: Success (0x00)
        Address: 00:00:00:00:00:00 (OUI 00-00-00)
zephyr.exe[325839]: < HCI Command: LE Set Random Address (0x08|0x0005) plen 6                                        #35 0.402886
        Address: D5:B6:CC:31:DB:3B (Static)
> HCI Event: Command Complete (0x0e) plen 4                                                                          #36 0.403438
      LE Set Random Address (0x08|0x0005) ncmd 1
        Status: Success (0x00)
zephyr.exe[325839]: < HCI Command: LE Extended Create Connection (0x08|0x0043) plen 26                               #37 5.673378
        Filter policy: Accept list is not used (0x00)
        Own address type: Random (0x01)
        Peer address type: Public (0x00)
        Peer address: DF:A9:FF:F6:B1:1A (OUI DF-A9-FF)
        Initiating PHYs: 0x01
        Entry 0: LE 1M
          Scan interval: 60.000 msec (0x0060)
          Scan window: 60.000 msec (0x0060)
          Min connection interval: 30.00 msec (0x0018)
          Max connection interval: 50.00 msec (0x0028)
          Connection latency: 0 (0x0000)
          Supervision timeout: 4000 msec (0x0190)
          Min connection length: 0.000 msec (0x0000)
          Max connection length: 0.000 msec (0x0000)
> HCI Event: Command Status (0x0f) plen 4                                                                            #38 5.674289
      LE Extended Create Connection (0x08|0x0043) ncmd 1
        Status: Success (0x00)
> HCI Event: LE Meta Event (0x3e) plen 31                                                                            #39 5.741799
      LE Enhanced Connection Complete (0x0a)
        Status: Success (0x00)
        Handle: 486
        Role: Central (0x00)
        Peer address type: Public (0x00)
        Peer address: DF:A9:FF:F6:B1:1A (OUI DF-A9-FF)
        Local resolvable private address: 00:00:00:00:00:00 (Non-Resolvable)
        Peer resolvable private address: 00:00:00:00:00:00 (Non-Resolvable)
        Connection interval: 50.00 msec (0x0028)
        Connection latency: 0 (0x0000)
        Supervision timeout: 4000 msec (0x0190)
        Central clock accuracy: 0x00
zephyr.exe[325839]: < HCI Command: LE Read Remote Used Features (0x08|0x0016) plen 2                                 #40 5.743010
        Handle: 486 Address: DF:A9:FF:F6:B1:1A (OUI DF-A9-FF)
> HCI Event: Command Status (0x0f) plen 4                                                                            #41 5.743422
      LE Read Remote Used Features (0x08|0x0016) ncmd 1
        Status: Success (0x00)
zephyr.exe[325839]: < HCI Command: LE Set PHY (0x08|0x0032) plen 7                                                   #42 5.762982
        Handle: 486 Address: DF:A9:FF:F6:B1:1A (OUI DF-A9-FF)
        All PHYs preference: 0x00
        TX PHYs preference: 0x02
          LE 2M
        RX PHYs preference: 0x02
          LE 2M
        PHY options preference: Reserved (0x0000)
> HCI Event: Command Status (0x0f) plen 4                                                                            #43 5.763401
      LE Set PHY (0x08|0x0032) ncmd 1
        Status: Success (0x00)
> HCI Event: LE Meta Event (0x3e) plen 12                                                                            #44 5.893314
      LE Read Remote Used Features (0x04)
        Status: Success (0x00)
        Handle: 486 Address: DF:A9:FF:F6:B1:1A (OUI DF-A9-FF)
        Features: 0x2d 0x49 0x00 0xf7 0x67 0xd8 0x00 0x00
          LE Encryption
          Extended Reject Indication
          Peripheral-initiated Features Exchange
          LE Data Packet Length Extension
          LE 2M PHY
          LE Coded PHY
          Channel Selection Algorithm #2
          Periodic Advertising Sync Transfer - Sender
          Periodic Advertising Sync Transfer - Recipient
          Sleep Clock Accuracy Updates
          Connected Isochronous Stream - Central
          Connected Isochronous Stream - Peripheral
          Isochronous Broadcaster
          Synchronized Receiver
          Connected Isochronous Stream (Host Support)
          LE Power Control Request
          LE Power Control Request
          Connection Subrating
          Connection Subrating (Host Support)
          Unknown features (0x0000d80000000000)
> HCI Event: LE Meta Event (0x3e) plen 6                                                                             #45 6.392583
      LE PHY Update Complete (0x0c)
        Status: Success (0x00)
        Handle: 486 Address: DF:A9:FF:F6:B1:1A (OUI DF-A9-FF)
        TX PHY: LE 2M (0x02)
        RX PHY: LE 2M (0x02)
zephyr.exe[325839]: < ACL Data TX: Handle 486 flags 0x00 dlen 11                                                     #46 6.763498
      SMP: Pairing Request (0x01) len 6
        IO capability: DisplayOnly (0x00)
        OOB data: Authentication data not present (0x00)
        Authentication requirement: Bonding, No MITM, SC, No Keypresses (0x09)
        Max encryption key size: 16
        Initiator key distribution: EncKey (0x01)
        Responder key distribution: EncKey IdKey (0x03)
> HCI Event: Number of Completed Packets (0x13) plen 5                                                               #47 6.792997
        Num handles: 1
        Handle: 486 Address: DF:A9:FF:F6:B1:1A (OUI DF-A9-FF)
        Count: 1
        #46: len 11 (3 Kb/s)
        Latency: 29 msec (29-29 msec ~29 msec)
> ACL Data RX: Handle 486 flags 0x02 dlen 11                                                                         #48 6.843141
      SMP: Pairing Response (0x02) len 6
        IO capability: KeyboardDisplay (0x04)
        OOB data: Authentication data from remote device present (0x01)
        Authentication requirement: No bonding, MITM, SC, No Keypresses (0x0c)
        Max encryption key size: 16
        Initiator key distribution: <none> (0x00)
        Responder key distribution: <none> (0x00)
zephyr.exe[325839]: < HCI Command: Host Number of Completed Packets (0x03|0x0035) plen 5                             #49 6.863166
        Num handles: 1
        Handle: 486 Address: DF:A9:FF:F6:B1:1A (OUI DF-A9-FF)
        Count: 1
zephyr.exe[325839]: < ACL Data TX: Handle 486 flags 0x00 dlen 27                                                     #50 6.863195
zephyr.exe[325839]: < ACL Data TX: Handle 486 flags 0x01 dlen 27                                                     #51 6.863198
zephyr.exe[325839]: < ACL Data TX: Handle 486 flags 0x01 dlen 15                                                     #52 6.863222
      SMP: Pairing Public Key (0x0c) len 64
        X: 98308440221e2d910f0e54b71e7ec652857aa9b5a0dc65028824cc19db1226e9
        Y: 67a4816bcb62efb21701e31fdb27561a6217575fb007a8bbdabe7e28b6f68482
> HCI Event: Number of Completed Packets (0x13) plen 5                                                               #53 6.892872
        Num handles: 1
        Handle: 486 Address: DF:A9:FF:F6:B1:1A (OUI DF-A9-FF)
        Count: 1
        #50: len 27 (7 Kb/s)
        Latency: 29 msec (29-29 msec ~29 msec)
> HCI Event: Number of Completed Packets (0x13) plen 5                                                               #54 6.893431
        Num handles: 1
        Handle: 486 Address: DF:A9:FF:F6:B1:1A (OUI DF-A9-FF)
        Count: 1
        #51: len 27 (7 Kb/s)
        Latency: 30 msec (29-30 msec ~29 msec)
> HCI Event: Number of Completed Packets (0x13) plen 5                                                               #55 6.893948
        Num handles: 1
        Handle: 486 Address: DF:A9:FF:F6:B1:1A (OUI DF-A9-FF)
        Count: 1
        #52: len 15 (4 Kb/s)
        Latency: 30 msec (29-30 msec ~30 msec)
> ACL Data RX: Handle 486 flags 0x02 dlen 27                                                                         #56 6.943246
> ACL Data RX: Handle 486 flags 0x01 dlen 27                                                                         #57 6.943747
> ACL Data RX: Handle 486 flags 0x01 dlen 15                                                                         #58 6.944130
      SMP: Pairing Public Key (0x0c) len 64
        X: 2b85c71db5afdac4d771ca30c52d59edd5047d69c30d6e3fdc83e6531cf8ee25
        Y: 695fbeac0a923c8f5fdd69c4cf1a73c89c4af18fb505ec3d14710c921699e91d
zephyr.exe[325839]: < HCI Command: Host Number of Completed Packets (0x03|0x0035) plen 5                             #59 6.963109
        Num handles: 1
        Handle: 486 Address: DF:A9:FF:F6:B1:1A (OUI DF-A9-FF)
        Count: 1
zephyr.exe[325839]: < HCI Command: Host Number of Completed Packets (0x03|0x0035) plen 5                             #60 6.963118
        Num handles: 1
        Handle: 486 Address: DF:A9:FF:F6:B1:1A (OUI DF-A9-FF)
        Count: 1
zephyr.exe[325839]: < HCI Command: Host Number of Completed Packets (0x03|0x0035) plen 5                             #61 6.963266
        Num handles: 1
        Handle: 486 Address: DF:A9:FF:F6:B1:1A (OUI DF-A9-FF)
        Count: 1
zephyr.exe[325839]: < ACL Data TX: Handle 486 flags 0x00 dlen 21                                                     #62 6.963379
      SMP: Pairing Random (0x04) len 16
        Random value: 5da095555cc64d02679f89a05211af56
> HCI Event: Number of Completed Packets (0x13) plen 5                                                               #63 6.992976
        Num handles: 1
        Handle: 486 Address: DF:A9:FF:F6:B1:1A (OUI DF-A9-FF)
        Count: 1
        #62: len 21 (5 Kb/s)
        Latency: 29 msec (29-30 msec ~29 msec)
> ACL Data RX: Handle 486 flags 0x02 dlen 21                                                                         #64 7.043218
      SMP: Pairing Random (0x04) len 16
        Random value: e35565b394a1facdc008c6178e8cc275
zephyr.exe[325839]: < HCI Command: Host Number of Completed Packets (0x03|0x0035) plen 5                             #65 7.063714
        Num handles: 1
        Handle: 486 Address: DF:A9:FF:F6:B1:1A (OUI DF-A9-FF)
        Count: 1
zephyr.exe[325839]: < ACL Data TX: Handle 486 flags 0x00 dlen 21                                                     #66 7.063888
      SMP: Pairing DHKey Check (0x0d) len 16
        E: 9c2845bcd3400bddd710c18e01e1cb66
> HCI Event: Number of Completed Packets (0x13) plen 5                                                               #67 7.093111
        Num handles: 1
        Handle: 486 Address: DF:A9:FF:F6:B1:1A (OUI DF-A9-FF)
        Count: 1
        #66: len 21 (5 Kb/s)
        Latency: 29 msec (29-30 msec ~29 msec)
> ACL Data RX: Handle 486 flags 0x02 dlen 21                                                                         #68 7.143102
      SMP: Pairing DHKey Check (0x0d) len 16
        E: a70d15264f4005ad6e0db34da24f4613
zephyr.exe[325839]: < HCI Command: LE Start Encryption (0x08|0x0019) plen 28                                         #69 7.163155
        Handle: 486 Address: DF:A9:FF:F6:B1:1A (OUI DF-A9-FF)
        Random number: 0x0000000000000000
        Encrypted diversifier: 0x0000
        Long term key: 4b1714a598eca6dd143de053659d1f84
> HCI Event: Command Status (0x0f) plen 4                                                                            #70 7.164094
      LE Start Encryption (0x08|0x0019) ncmd 1
        Status: Success (0x00)
zephyr.exe[325839]: < HCI Command: Host Number of Completed Packets (0x03|0x0035) plen 5                             #71 7.183025
        Num handles: 1
        Handle: 486 Address: DF:A9:FF:F6:B1:1A (OUI DF-A9-FF)
        Count: 1
> HCI Event: Encryption Change (0x08) plen 4                                                                         #72 7.492869
        Status: Success (0x00)
        Handle: 486 Address: DF:A9:FF:F6:B1:1A (OUI DF-A9-FF)
        Encryption: Enabled with AES-CCM (0x01)
zephyr.exe[325839]: < HCI Command: Disconnect (0x01|0x0006) plen 3                                                   #73 7.783487
        Handle: 486 Address: DF:A9:FF:F6:B1:1A (OUI DF-A9-FF)
        Reason: Remote User Terminated Connection (0x13)
> HCI Event: Command Status (0x0f) plen 4                                                                            #74 7.783982
      Disconnect (0x01|0x0006) ncmd 1
        Status: Success (0x00)
> HCI Event: Disconnect Complete (0x05) plen 4                                                                       #75 7.842881
        Status: Success (0x00)
        Handle: 486 Address: DF:A9:FF:F6:B1:1A (OUI DF-A9-FF)
        Reason: Connection Terminated By Local Host (0x16)
zephyr.exe[325839]: < HCI Command: LE Extended Create Connection (0x08|0x0043) plen 26                              #76 10.983327
        Filter policy: Accept list is not used (0x00)
        Own address type: Random (0x01)
        Peer address type: Public (0x00)
        Peer address: DF:A9:FF:F6:B1:1A (OUI DF-A9-FF)
        Initiating PHYs: 0x01
        Entry 0: LE 1M
          Scan interval: 60.000 msec (0x0060)
          Scan window: 60.000 msec (0x0060)
          Min connection interval: 30.00 msec (0x0018)
          Max connection interval: 50.00 msec (0x0028)
          Connection latency: 0 (0x0000)
          Supervision timeout: 4000 msec (0x0190)
          Min connection length: 0.000 msec (0x0000)
          Max connection length: 0.000 msec (0x0000)
> HCI Event: Command Status (0x0f) plen 4                                                                           #77 10.984258
      LE Extended Create Connection (0x08|0x0043) ncmd 1
        Status: Success (0x00)
> HCI Event: LE Meta Event (0x3e) plen 31                                                                           #78 11.052941
      LE Enhanced Connection Complete (0x0a)
        Status: Success (0x00)
        Handle: 504
        Role: Central (0x00)
        Peer address type: Public (0x00)
        Peer address: DF:A9:FF:F6:B1:1A (OUI DF-A9-FF)
        Local resolvable private address: 00:00:00:00:00:00 (Non-Resolvable)
        Peer resolvable private address: 00:00:00:00:00:00 (Non-Resolvable)
        Connection interval: 50.00 msec (0x0028)
        Connection latency: 0 (0x0000)
        Supervision timeout: 4000 msec (0x0190)
        Central clock accuracy: 0x00
zephyr.exe[325839]: < HCI Command: LE Read Remote Used Features (0x08|0x0016) plen 2                                #79 11.063147
        Handle: 504 Address: DF:A9:FF:F6:B1:1A (OUI DF-A9-FF)
> HCI Event: Command Status (0x0f) plen 4                                                                           #80 11.063619
      LE Read Remote Used Features (0x08|0x0016) ncmd 1
        Status: Success (0x00)
zephyr.exe[325839]: < HCI Command: LE Set PHY (0x08|0x0032) plen 7                                                  #81 11.083004
        Handle: 504 Address: DF:A9:FF:F6:B1:1A (OUI DF-A9-FF)
        All PHYs preference: 0x00
        TX PHYs preference: 0x02
          LE 2M
        RX PHYs preference: 0x02
          LE 2M
        PHY options preference: Reserved (0x0000)
> HCI Event: Command Status (0x0f) plen 4                                                                           #82 11.083484
      LE Set PHY (0x08|0x0032) ncmd 1
        Status: Success (0x00)
> HCI Event: LE Meta Event (0x3e) plen 12                                                                           #83 11.204326
      LE Read Remote Used Features (0x04)
        Status: Success (0x00)
        Handle: 504 Address: DF:A9:FF:F6:B1:1A (OUI DF-A9-FF)
        Features: 0x2d 0x49 0x00 0xf7 0x67 0xd8 0x00 0x00
          LE Encryption
          Extended Reject Indication
          Peripheral-initiated Features Exchange
          LE Data Packet Length Extension
          LE 2M PHY
          LE Coded PHY
          Channel Selection Algorithm #2
          Periodic Advertising Sync Transfer - Sender
          Periodic Advertising Sync Transfer - Recipient
          Sleep Clock Accuracy Updates
          Connected Isochronous Stream - Central
          Connected Isochronous Stream - Peripheral
          Isochronous Broadcaster
          Synchronized Receiver
          Connected Isochronous Stream (Host Support)
          LE Power Control Request
          LE Power Control Request
          Connection Subrating
          Connection Subrating (Host Support)
          Unknown features (0x0000d80000000000)
> HCI Event: LE Meta Event (0x3e) plen 6                                                                            #84 11.703760
      LE PHY Update Complete (0x0c)
        Status: Success (0x00)
        Handle: 504 Address: DF:A9:FF:F6:B1:1A (OUI DF-A9-FF)
        TX PHY: LE 2M (0x02)
        RX PHY: LE 2M (0x02)
zephyr.exe[325839]: < ACL Data TX: Handle 504 flags 0x00 dlen 11                                                    #85 12.153538
      SMP: Pairing Request (0x01) len 6
        IO capability: DisplayOnly (0x00)
        OOB data: Authentication data from remote device present (0x01)
        Authentication requirement: Bonding, No MITM, SC, No Keypresses (0x09)
        Max encryption key size: 16
        Initiator key distribution: EncKey (0x01)
        Responder key distribution: EncKey IdKey (0x03)
> HCI Event: Number of Completed Packets (0x13) plen 5                                                              #86 12.204076
        Num handles: 1
        Handle: 504 Address: DF:A9:FF:F6:B1:1A (OUI DF-A9-FF)
        Count: 1
        #85: len 11 (1 Kb/s)
        Latency: 50 msec (50-50 msec ~50 msec)
> ACL Data RX: Handle 504 flags 0x02 dlen 11                                                                        #87 12.254165
      SMP: Pairing Response (0x02) len 6
        IO capability: KeyboardDisplay (0x04)
        OOB data: Authentication data not present (0x00)
        Authentication requirement: No bonding, MITM, SC, No Keypresses (0x0c)
        Max encryption key size: 16
        Initiator key distribution: <none> (0x00)
        Responder key distribution: <none> (0x00)
zephyr.exe[325839]: < HCI Command: Host Number of Completed Packets (0x03|0x0035) plen 5                            #88 12.263091
        Num handles: 1
        Handle: 504 Address: DF:A9:FF:F6:B1:1A (OUI DF-A9-FF)
        Count: 1
zephyr.exe[325839]: < ACL Data TX: Handle 504 flags 0x00 dlen 27                                                    #89 12.263125
zephyr.exe[325839]: < ACL Data TX: Handle 504 flags 0x01 dlen 27                                                    #90 12.263127
zephyr.exe[325839]: < ACL Data TX: Handle 504 flags 0x01 dlen 15                                                    #91 12.263135
      SMP: Pairing Public Key (0x0c) len 64
        X: 98308440221e2d910f0e54b71e7ec652857aa9b5a0dc65028824cc19db1226e9
        Y: 67a4816bcb62efb21701e31fdb27561a6217575fb007a8bbdabe7e28b6f68482
> HCI Event: Number of Completed Packets (0x13) plen 5                                                              #92 12.304178
        Num handles: 1
        Handle: 504 Address: DF:A9:FF:F6:B1:1A (OUI DF-A9-FF)
        Count: 1
        #89: len 27 (5 Kb/s)
        Latency: 41 msec (41-50 msec ~45 msec)
> HCI Event: Number of Completed Packets (0x13) plen 5                                                              #93 12.304677
        Num handles: 1
        Handle: 504 Address: DF:A9:FF:F6:B1:1A (OUI DF-A9-FF)
        Count: 1
        #90: len 27 (5 Kb/s)
        Latency: 41 msec (41-50 msec ~43 msec)
> HCI Event: Number of Completed Packets (0x13) plen 5                                                              #94 12.305102
        Num handles: 1
        Handle: 504 Address: DF:A9:FF:F6:B1:1A (OUI DF-A9-FF)
        Count: 1
        #91: len 15 (2 Kb/s)
        Latency: 41 msec (41-50 msec ~42 msec)
> ACL Data RX: Handle 504 flags 0x02 dlen 27                                                                        #95 12.354271
> ACL Data RX: Handle 504 flags 0x01 dlen 27                                                                        #96 12.354923
> ACL Data RX: Handle 504 flags 0x01 dlen 15                                                                        #97 12.355219
      SMP: Pairing Public Key (0x0c) len 64
        X: 789e9962dff3e0de8d8edce6382f0c95d39051cb7ff67002f08fede324ab42b4
        Y: 951419ab074ed7515af35cc22f51c88bd2daec59944ba7b3e2708f11082fa475
zephyr.exe[325839]: < HCI Command: Host Number of Completed Packets (0x03|0x0035) plen 5                            #98 12.363214
        Num handles: 1
        Handle: 504 Address: DF:A9:FF:F6:B1:1A (OUI DF-A9-FF)
        Count: 1
zephyr.exe[325839]: < HCI Command: Host Number of Completed Packets (0x03|0x0035) plen 5                            #99 12.363383
        Num handles: 1
        Handle: 504 Address: DF:A9:FF:F6:B1:1A (OUI DF-A9-FF)
        Count: 1
zephyr.exe[325839]: < HCI Command: Host Number of Completed Packets (0x03|0x0035) plen 5                           #100 12.363596
        Num handles: 1
        Handle: 504 Address: DF:A9:FF:F6:B1:1A (OUI DF-A9-FF)
        Count: 1
zephyr.exe[325839]: < ACL Data TX: Handle 504 flags 0x00 dlen 21                                                   #101 12.363732
      SMP: Pairing Random (0x04) len 16
        Random value: a2acf8fd71a45c4a1bcadd27bd58e945
> HCI Event: Number of Completed Packets (0x13) plen 5                                                             #102 12.404129
        Num handles: 1
        Handle: 504 Address: DF:A9:FF:F6:B1:1A (OUI DF-A9-FF)
        Count: 1
        #101: len 21 (4 Kb/s)
        Latency: 40 msec (40-50 msec ~41 msec)
> ACL Data RX: Handle 504 flags 0x02 dlen 21                                                                       #103 12.454311
      SMP: Pairing Random (0x04) len 16
        Random value: be660f4609f567d8094feb367c47a498
zephyr.exe[325839]: < HCI Command: Host Number of Completed Packets (0x03|0x0035) plen 5                           #104 12.463641
        Num handles: 1
        Handle: 504 Address: DF:A9:FF:F6:B1:1A (OUI DF-A9-FF)
        Count: 1
zephyr.exe[325839]: < ACL Data TX: Handle 504 flags 0x00 dlen 21                                                   #105 12.463847
      SMP: Pairing DHKey Check (0x0d) len 16
        E: 90aeae8a535e039e5f3ca8e9613981d8
> HCI Event: Number of Completed Packets (0x13) plen 5                                                             #106 12.504200
        Num handles: 1
        Handle: 504 Address: DF:A9:FF:F6:B1:1A (OUI DF-A9-FF)
        Count: 1
        #105: len 21 (4 Kb/s)
        Latency: 40 msec (40-50 msec ~40 msec)
> ACL Data RX: Handle 504 flags 0x02 dlen 21                                                                       #107 12.554312
      SMP: Pairing DHKey Check (0x0d) len 16
        E: 758d31d683b0ee300ef69fb2a1ec2e02
zephyr.exe[325839]: < HCI Command: LE Start Encryption (0x08|0x0019) plen 28                                       #108 12.563390
        Handle: 504 Address: DF:A9:FF:F6:B1:1A (OUI DF-A9-FF)
        Random number: 0x0000000000000000
        Encrypted diversifier: 0x0000
        Long term key: 47805559f927caddf545ec6680e60b91
> HCI Event: Command Status (0x0f) plen 4                                                                          #109 12.564290
      LE Start Encryption (0x08|0x0019) ncmd 1
        Status: Success (0x00)
zephyr.exe[325839]: < HCI Command: Host Number of Completed Packets (0x03|0x0035) plen 5                           #110 12.583275
        Num handles: 1
        Handle: 504 Address: DF:A9:FF:F6:B1:1A (OUI DF-A9-FF)
        Count: 1
> HCI Event: Encryption Change (0x08) plen 4                                                                       #111 12.904067
        Status: Success (0x00)
        Handle: 504 Address: DF:A9:FF:F6:B1:1A (OUI DF-A9-FF)
        Encryption: Enabled with AES-CCM (0x01)
zephyr.exe[325839]: < HCI Command: Disconnect (0x01|0x0006) plen 3                                                 #112 13.183487
        Handle: 504 Address: DF:A9:FF:F6:B1:1A (OUI DF-A9-FF)
        Reason: Remote User Terminated Connection (0x13)
> HCI Event: Command Status (0x0f) plen 4                                                                          #113 13.183980
      Disconnect (0x01|0x0006) ncmd 1
        Status: Success (0x00)
> HCI Event: Disconnect Complete (0x05) plen 4                                                                     #114 13.254029
        Status: Success (0x00)
        Handle: 504 Address: DF:A9:FF:F6:B1:1A (OUI DF-A9-FF)
        Reason: Connection Terminated By Local Host (0x16)
zephyr.exe[325839]: < HCI Command: LE Extended Create Connection (0x08|0x0043) plen 26                             #115 18.403349
        Filter policy: Accept list is not used (0x00)
        Own address type: Random (0x01)
        Peer address type: Public (0x00)
        Peer address: DF:A9:FF:F6:B1:1A (OUI DF-A9-FF)
        Initiating PHYs: 0x01
        Entry 0: LE 1M
          Scan interval: 60.000 msec (0x0060)
          Scan window: 60.000 msec (0x0060)
          Min connection interval: 30.00 msec (0x0018)
          Max connection interval: 50.00 msec (0x0028)
          Connection latency: 0 (0x0000)
          Supervision timeout: 4000 msec (0x0190)
          Min connection length: 0.000 msec (0x0000)
          Max connection length: 0.000 msec (0x0000)
> HCI Event: Command Status (0x0f) plen 4                                                                          #116 18.404306
      LE Extended Create Connection (0x08|0x0043) ncmd 1
        Status: Success (0x00)
> HCI Event: LE Meta Event (0x3e) plen 31                                                                          #117 18.454052
      LE Enhanced Connection Complete (0x0a)
        Status: Success (0x00)
        Handle: 522
        Role: Central (0x00)
        Peer address type: Public (0x00)
        Peer address: DF:A9:FF:F6:B1:1A (OUI DF-A9-FF)
        Local resolvable private address: 00:00:00:00:00:00 (Non-Resolvable)
        Peer resolvable private address: 00:00:00:00:00:00 (Non-Resolvable)
        Connection interval: 50.00 msec (0x0028)
        Connection latency: 0 (0x0000)
        Supervision timeout: 4000 msec (0x0190)
        Central clock accuracy: 0x00
zephyr.exe[325839]: < HCI Command: LE Read Remote Used Features (0x08|0x0016) plen 2                               #118 18.463251
        Handle: 522 Address: DF:A9:FF:F6:B1:1A (OUI DF-A9-FF)
> HCI Event: Command Status (0x0f) plen 4                                                                          #119 18.463721
      LE Read Remote Used Features (0x08|0x0016) ncmd 1
        Status: Success (0x00)
zephyr.exe[325839]: < HCI Command: LE Set PHY (0x08|0x0032) plen 7                                                 #120 18.483080
        Handle: 522 Address: DF:A9:FF:F6:B1:1A (OUI DF-A9-FF)
        All PHYs preference: 0x00
        TX PHYs preference: 0x02
          LE 2M
        RX PHYs preference: 0x02
          LE 2M
        PHY options preference: Reserved (0x0000)
> HCI Event: Command Status (0x0f) plen 4                                                                          #121 18.483695
      LE Set PHY (0x08|0x0032) ncmd 1
        Status: Success (0x00)
> HCI Event: LE Meta Event (0x3e) plen 12                                                                          #122 18.605386
      LE Read Remote Used Features (0x04)
        Status: Success (0x00)
        Handle: 522 Address: DF:A9:FF:F6:B1:1A (OUI DF-A9-FF)
        Features: 0x2d 0x49 0x00 0xf7 0x67 0xd8 0x00 0x00
          LE Encryption
          Extended Reject Indication
          Peripheral-initiated Features Exchange
          LE Data Packet Length Extension
          LE 2M PHY
          LE Coded PHY
          Channel Selection Algorithm #2
          Periodic Advertising Sync Transfer - Sender
          Periodic Advertising Sync Transfer - Recipient
          Sleep Clock Accuracy Updates
          Connected Isochronous Stream - Central
          Connected Isochronous Stream - Peripheral
          Isochronous Broadcaster
          Synchronized Receiver
          Connected Isochronous Stream (Host Support)
          LE Power Control Request
          LE Power Control Request
          Connection Subrating
          Connection Subrating (Host Support)
          Unknown features (0x0000d80000000000)
> HCI Event: LE Meta Event (0x3e) plen 6                                                                           #123 19.104793
      LE PHY Update Complete (0x0c)
        Status: Success (0x00)
        Handle: 522 Address: DF:A9:FF:F6:B1:1A (OUI DF-A9-FF)
        TX PHY: LE 2M (0x02)
        RX PHY: LE 2M (0x02)
zephyr.exe[325839]: < ACL Data TX: Handle 522 flags 0x00 dlen 11                                                   #124 19.543147
      SMP: Pairing Request (0x01) len 6
        IO capability: DisplayOnly (0x00)
        OOB data: Authentication data from remote device present (0x01)
        Authentication requirement: Bonding, No MITM, SC, No Keypresses (0x09)
        Max encryption key size: 16
        Initiator key distribution: EncKey (0x01)
        Responder key distribution: EncKey IdKey (0x03)
> HCI Event: Number of Completed Packets (0x13) plen 5                                                             #125 19.555177
        Num handles: 1
        Handle: 522 Address: DF:A9:FF:F6:B1:1A (OUI DF-A9-FF)
        Count: 1
        #124: len 11 (7 Kb/s)
        Latency: 12 msec (12-12 msec ~12 msec)
> ACL Data RX: Handle 522 flags 0x02 dlen 11                                                                       #126 19.605390
      SMP: Pairing Response (0x02) len 6
        IO capability: KeyboardDisplay (0x04)
        OOB data: Authentication data from remote device present (0x01)
        Authentication requirement: No bonding, MITM, SC, No Keypresses (0x0c)
        Max encryption key size: 16
        Initiator key distribution: <none> (0x00)
        Responder key distribution: <none> (0x00)
zephyr.exe[325839]: < HCI Command: Host Number of Completed Packets (0x03|0x0035) plen 5                           #127 19.623406
        Num handles: 1
        Handle: 522 Address: DF:A9:FF:F6:B1:1A (OUI DF-A9-FF)
        Count: 1
zephyr.exe[325839]: < ACL Data TX: Handle 522 flags 0x00 dlen 27                                                   #128 19.623596
zephyr.exe[325839]: < ACL Data TX: Handle 522 flags 0x01 dlen 27 