Bluetooth monitor ver 5.72
= Note: Linux version 6.14.0-36-generic (x86_64)                       0.057803
= Note: Bluetooth subsystem version 2.22                               0.057805
= New Index: 00:00:00:00:00:00 (Primary,UART,hci1)              [hci1] 0.057806
= New Index: 48:5F:99:8E:E0:64 (Primary,USB,hci0)               [hci0] 0.057806
= Open Index: 00:00:00:00:00:00                                 [hci1] 0.570964
= Index Info: 00:00:00:00:00:00 (Nordic Semiconductor ASA)      [hci1] 0.570973
@ USER Open: main (privileged) version 2.22            {0x0001} [hci1] 0.570975
< HCI Command: Reset (0x03|0x0003) plen 0                    #1 [hci1] 0.571316
> HCI Event: Command Complete (0x0e) plen 4                  #2 [hci1] 0.571827
      Reset (0x03|0x0003) ncmd 1
        Status: Success (0x00)
< HCI Command: Read Local Supported... (0x04|0x0003) plen 0  #3 [hci1] 0.590900
> HCI Event: Command Complete (0x0e) plen 12                 #4 [hci1] 0.591345
      Read Local Supported Features (0x04|0x0003) ncmd 1
        Status: Success (0x00)
        Features: 0x00 0x00 0x00 0x00 0x60 0x00 0x00 0x00
          BR/EDR Not Supported
          LE Supported (Controller)
< HCI Command: Read Local Version In.. (0x04|0x0001) plen 0  #5 [hci1] 0.611260
> HCI Event: Command Complete (0x0e) plen 12                 #6 [hci1] 0.611781
      Read Local Version Information (0x04|0x0001) ncmd 1
        Status: Success (0x00)
        HCI version: Reserved (0x0f) - Revision 12393 (0x3069)
        LMP version: Reserved (0x0f) - Subversion 12393 (0x3069)
        Manufacturer: Nordic Semiconductor ASA (89)
< HCI Command: Read Local Supported... (0x04|0x0002) plen 0  #7 [hci1] 0.630998
> HCI Event: Command Complete (0x0e) plen 68                 #8 [hci1] 0.632124
      Read Local Supported Commands (0x04|0x0002) ncmd 1
        Status: Success (0x00)
        Commands: 119 entries
          Disconnect (Octet 0 - Bit 5)
          Read Remote Version Information (Octet 2 - Bit 7)
          Set Event Mask (Octet 5 - Bit 6)
          Reset (Octet 5 - Bit 7)
          Read Connection Accept Timeout (Octet 7 - Bit 2)
          Write Connection Accept Timeout (Octet 7 - Bit 3)
          Read Transmit Power Level (Octet 10 - Bit 2)
          Set Controller To Host Flow Control (Octet 10 - Bit 5)
          Host Buffer Size (Octet 10 - Bit 6)
          Host Number of Completed Packets (Octet 10 - Bit 7)
          Read Local Version Information (Octet 14 - Bit 3)
          Read Local Supported Features (Octet 14 - Bit 5)
          Read BD ADDR (Octet 15 - Bit 1)
          Read RSSI (Octet 15 - Bit 5)
          Set Event Mask Page 2 (Octet 22 - Bit 2)
          LE Set Event Mask (Octet 25 - Bit 0)
          LE Read Buffer Size (Octet 25 - Bit 1)
          LE Read Local Supported Features (Octet 25 - Bit 2)
          LE Set Random Address (Octet 25 - Bit 4)
          LE Set Advertising Parameters (Octet 25 - Bit 5)
          LE Read Advertising Channel TX Power (Octet 25 - Bit 6)
          LE Set Advertising Data (Octet 25 - Bit 7)
          LE Set Scan Response Data (Octet 26 - Bit 0)
          LE Set Advertise Enable (Octet 26 - Bit 1)
          LE Set Scan Parameters (Octet 26 - Bit 2)
          LE Set Scan Enable (Octet 26 - Bit 3)
          LE Create Connection (Octet 26 - Bit 4)
          LE Create Connection Cancel (Octet 26 - Bit 5)
          LE Read Accept List Size (Octet 26 - Bit 6)
          LE Clear Accept List (Octet 26 - Bit 7)
          LE Add Device To Accept List (Octet 27 - Bit 0)
          LE Remove Device From Accept List (Octet 27 - Bit 1)
          LE Connection Update (Octet 27 - Bit 2)
          LE Set Host Channel Classification (Octet 27 - Bit 3)
          LE Read Channel Map (Octet 27 - Bit 4)
          LE Read Remote Used Features (Octet 27 - Bit 5)
          LE Encrypt (Octet 27 - Bit 6)
          LE Rand (Octet 27 - Bit 7)
          LE Start Encryption (Octet 28 - Bit 0)
          LE Long Term Key Request Reply (Octet 28 - Bit 1)
          LE Long Term Key Request Neg Reply (Octet 28 - Bit 2)
          LE Read Supported States (Octet 28 - Bit 3)
          LE Receiver Test (Octet 28 - Bit 4)
          LE Transmitter Test (Octet 28 - Bit 5)
          LE Test End (Octet 28 - Bit 6)
          Read Authenticated Payload Timeout (Octet 32 - Bit 4)
          Write Authenticated Payload Timeout (Octet 32 - Bit 5)
          LE Set Data Length (Octet 33 - Bit 6)
          LE Read Suggested Default Data Length (Octet 33 - Bit 7)
          LE Write Suggested Default Data Length (Octet 34 - Bit 0)
          LE Add Device To Resolving List (Octet 34 - Bit 3)
          LE Remove Device From Resolving List (Octet 34 - Bit 4)
          LE Clear Resolving List (Octet 34 - Bit 5)
          LE Read Resolving List Size (Octet 34 - Bit 6)
          LE Set Address Resolution Enable (Octet 35 - Bit 1)
          LE Set Resolvable Private Address Timeout (Octet 35 - Bit 2)
          LE Read Maximum Data Length (Octet 35 - Bit 3)
          LE Read PHY (Octet 35 - Bit 4)
          LE Set Default PHY (Octet 35 - Bit 5)
          LE Set PHY (Octet 35 - Bit 6)
          LE Enhanced Receiver Test (Octet 35 - Bit 7)
          LE Enhanced Transmitter Test (Octet 36 - Bit 0)
          LE Set Advertising Set Random Address (Octet 36 - Bit 1)
          LE Set Extended Advertising Parameters (Octet 36 - Bit 2)
          LE Set Extended Advertising Data (Octet 36 - Bit 3)
          LE Set Extended Scan Response Data (Octet 36 - Bit 4)
          LE Set Extended Advertising Enable (Octet 36 - Bit 5)
          LE Read Maximum Advertising Data Length (Octet 36 - Bit 6)
          LE Read Number of Supported Advertising Sets (Octet 36 - Bit 7)
          LE Remove Advertising Set (Octet 37 - Bit 0)
          LE Clear Advertising Sets (Octet 37 - Bit 1)
          LE Set Periodic Advertising Parameters (Octet 37 - Bit 2)
          LE Set Periodic Advertising Data (Octet 37 - Bit 3)
          LE Set Periodic Advertising Enable (Octet 37 - Bit 4)
          LE Set Extended Scan Parameters (Octet 37 - Bit 5)
          LE Set Extended Scan Enable (Octet 37 - Bit 6)
          LE Extended Create Connection (Octet 37 - Bit 7)
          LE Periodic Advertising Create Sync (Octet 38 - Bit 0)
          LE Periodic Advertising Create Sync Cancel (Octet 38 - Bit 1)
          LE Periodic Advertising Terminate Sync (Octet 38 - Bit 2)
          LE Add Device To Periodic Advertiser List (Octet 38 - Bit 3)
          LE Remove Device From Periodic Advertiser List (Octet 38 - Bit 4)
          LE Clear Periodic Advertiser List (Octet 38 - Bit 5)
          LE Read Periodic Advertiser List Size (Octet 38 - Bit 6)
          LE Read Transmit Power (Octet 38 - Bit 7)
          LE Read RF Path Compensation (Octet 39 - Bit 0)
          LE Write RF Path Compensation (Octet 39 - Bit 1)
          LE Set Privacy Mode (Octet 39 - Bit 2)
          LE Periodic Advertising Receive Enable (Octet 40 - Bit 5)
          LE Periodic Advertising Sync Transfer (Octet 40 - Bit 6)
          LE Periodic Advertising Set Info Transfer (Octet 40 - Bit 7)
          LE Periodic Advertising Sync Transfer Parameters (Octet 41 - Bit 0)
          LE Set Default Periodic Advertisng Sync Transfer Parameters (Octet 41 - Bit 1)
          LE Read Buffer v2 (Octet 41 - Bit 5)
          LE Read ISO TX Sync (Octet 41 - Bit 6)
          LE Set Connected Isochronous Group Parameters (Octet 41 - Bit 7)
          LE Set Connected Isochronous Group Parameters Test (Octet 42 - Bit 0)
          LE Create Connected Isochronous Stream (Octet 42 - Bit 1)
          LE Remove Connected Isochronous Group (Octet 42 - Bit 2)
          LE Accept Connected Isochronous Stream Request (Octet 42 - Bit 3)
          LE Reject Connected Isochronous Stream Request (Octet 42 - Bit 4)
          LE Create Broadcast Isochronous Group (Octet 42 - Bit 5)
          LE Create Broadcast Isochronous Group Test (Octet 42 - Bit 6)
          LE Terminate Broadcast Isochronous Group (Octet 42 - Bit 7)
          LE Broadcast Isochronous Group Create Sync (Octet 43 - Bit 0)
          LE Broadcast Isochronous Group Terminate Sync (Octet 43 - Bit 1)
          LE Request Peer SCA (Octet 43 - Bit 2)
          LE Setup Isochronous Data Path (Octet 43 - Bit 3)
          LE Remove Isochronous Data Path (Octet 43 - Bit 4)
          LE Isochronous Transmit Test (Octet 43 - Bit 5)
          LE Isochronous Receive Test (Octet 43 - Bit 6)
          LE Isochronous Read Test Counters (Octet 43 - Bit 7)
          LE Isochronous Read Test Counters (Octet 44 - Bit 0)
          LE Set Host Feature (Octet 44 - Bit 1)
          Octet 44 - Bit 2 
          Octet 45 - Bit 6 
          Octet 46 - Bit 0 
          Octet 46 - Bit 1 
          Octet 46 - Bit 2 
< HCI Command: Host Buffer Size (0x03|0x0033) plen 7         #9 [hci1] 0.650977
        ACL MTU: 255  ACL max packet: 16
        SCO MTU: 0    SCO max packet: 0
> HCI Event: Command Complete (0x0e) plen 4                 #10 [hci1] 0.651471
      Host Buffer Size (0x03|0x0033) ncmd 1
        Status: Success (0x00)
< HCI Command: Set Controller To Ho.. (0x03|0x0031) plen 1  #11 [hci1] 0.671006
        Flow control: ACL Data Packets (0x01)
> HCI Event: Command Complete (0x0e) plen 4                 #12 [hci1] 0.671480
      Set Controller To Host Flow Control (0x03|0x0031) ncmd 1
        Status: Success (0x00)
< HCI Command: LE Read Local Suppor.. (0x08|0x0003) plen 0  #13 [hci1] 0.690987
> HCI Event: Command Complete (0x0e) plen 12                #14 [hci1] 0.691479
      LE Read Local Supported Features (0x08|0x0003) ncmd 1
        Status: Success (0x00)
        Features: 0xfd 0x79 0x00 0xf7 0x30 0x01 0x00 0x00
          LE Encryption
          Extended Reject Indication
          Peripheral-initiated Features Exchange
          LE Ping
          LE Data Packet Length Extension
          LL Privacy
          Extended Scanner Filter Policies
          LE 2M PHY
          LE Coded PHY
          LE Extended Advertising
          LE Periodic Advertising
          Channel Selection Algorithm #2
          Periodic Advertising Sync Transfer - Sender
          Periodic Advertising Sync Transfer - Recipient
          Sleep Clock Accuracy Updates
          Connected Isochronous Stream - Central
          Connected Isochronous Stream - Peripheral
          Isochronous Broadcaster
          Synchronized Receiver
          Periodic Advertising ADI support
          Connection Subrating
          Unknown features (0x0000010000000000)
< HCI Command: LE Set Host Feature (0x08|0x0074) plen 2     #15 [hci1] 0.710996
        Bit Number: 32
          Connected Isochronous Stream (Host Support)
        Bit Value: 1
> HCI Event: Command Complete (0x0e) plen 4                 #16 [hci1] 0.711473
      LE Set Host Feature (0x08|0x0074) ncmd 1
        Status: Success (0x00)
< HCI Command: LE Read Buffer v2 (0x08|0x0060) plen 0       #17 [hci1] 0.730999
> HCI Event: Command Complete (0x0e) plen 10                #18 [hci1] 0.731452
      LE Read Buffer v2 (0x08|0x0060) ncmd 1
        Status: Success (0x00)
        ACL MTU: 27
        ACL max packet: 3
        ISO MTU: 318
        ISO max packet: 3
< HCI Command: LE Read Maximum Adve.. (0x08|0x003a) plen 0  #19 [hci1] 0.751007
> HCI Event: Command Complete (0x0e) plen 6                 #20 [hci1] 0.751476
      LE Read Maximum Advertising Data Length (0x08|0x003a) ncmd 1
        Status: Success (0x00)
        Max length: 1650
< HCI Command: LE Read Supported St.. (0x08|0x001c) plen 0  #21 [hci1] 0.770975
> HCI Event: Command Complete (0x0e) plen 12                #22 [hci1] 0.771463
      LE Read Supported States (0x08|0x001c) ncmd 1
        Status: Success (0x00)
        States: 0x000003ff3e0306ff
          Non-connectable Advertising State
          Scannable Advertising State
          Connectable Advertising State
          High Duty Cycle Directed Advertising State
          Passive Scanning State
          Active Scanning State
          Initiating State
            and Connection State (Central Role)
          Connection State (Peripheral Role)
          Scannable Advertising State
            and Passive Scanning State
          Connectable Advertising State
            and Passive Scanning State
          Non-connectable Advertising State
            and Initiating State
          Scannable Advertising State
            and Initiating State
          Active Scanning State
            and Connection State (Central Role)
          Passive Scanning State
            and Connection State (Peripheral Role)
          Active Scanning State
            and Connection State (Peripheral Role)
          Initiating State
            and Connection State (Central Role)
            and Central Role & Central Role
          Low Duty Cycle Directed Advertising State
          Connectable Advertising State
            and Initiating State
            and Central Role & Peripheral Role
          High Duty Cycle Directed Advertising State
            and Initiating State
            and Central Role & Peripheral Role
          Low Duty Cycle Directed Advertising State
            and Initiating State
            and Central Role & Peripheral Role
          Connectable Advertising State
            and Connection State (Central Role)
            and Central Role & Peripheral Role
          High Duty Cycle Directed Advertising State
            and Connection State (Central Role)
            and Central Role & Peripheral Role
          Low Duty Cycle Directed Advertising State
            and Connection State (Central Role)
            and Central Role & Peripheral Role
          Connectable Advertising State
            and Connection State (Peripheral Role)
            and Central Role & Peripheral Role
          High Duty Cycle Directed Advertising State
            and Connection State (Peripheral Role)
            and Peripheral Role & Peripheral Role
          Low Duty Cycle Directed Advertising State
            and Connection State (Peripheral Role)
            and Peripheral Role & Peripheral Role
          Initiating State
            and Connection State (Peripheral Role)
            and Central Role & Peripheral Role
< HCI Command: LE Read Maximum Data.. (0x08|0x002f) plen 0  #23 [hci1] 0.791020
> HCI Event: Command Complete (0x0e) plen 12                #24 [hci1] 0.791593
      LE Read Maximum Data Length (0x08|0x002f) ncmd 1
        Status: Success (0x00)
        Max TX octets: 251
        Max TX time: 2704
        Max RX octets: 251
        Max RX time: 2704
< HCI Command: LE Write Suggested D.. (0x08|0x0024) plen 4  #25 [hci1] 0.810958
        TX octets: 251
        TX time: 2704
> HCI Event: Command Complete (0x0e) plen 4                 #26 [hci1] 0.811460
      LE Write Suggested Default Data Length (0x08|0x0024) ncmd 1
        Status: Success (0x00)
< HCI Command: LE Read Resolving Li.. (0x08|0x002a) plen 0  #27 [hci1] 0.830984
> HCI Event: Command Complete (0x0e) plen 5                 #28 [hci1] 0.831393
      LE Read Resolving List Size (0x08|0x002a) ncmd 1
        Status: Success (0x00)
        Size: 8
< HCI Command: LE Set Event Mask (0x08|0x0001) plen 8       #29 [hci1] 0.850974
        Mask: 0x000002023f87fa5e
          LE Advertising Report
          LE Connection Update Complete
          LE Read Remote Used Features Complete
          LE Long Term Key Request
          LE Data Length Change
          LE Enhanced Connection Complete
          LE PHY Update Complete
          LE Extended Advertising Report
          LE Periodic Advertising Sync Established
          LE Periodic Advertising Report
          LE Periodic Advertising Sync Lost
          LE Extended Scan Timeout
          LE Extended Advertising Set Terminated
          LE Scan Request Received
          LE Periodic Advertising Sync Transfer Rvc
          LE CIS Established
          LE CIS Request
          LE Create BIG Complete
          LE Terminate BIG Complete
          LE BIG Sync Estabilished Complete
          LE BIG Sync Lost
          LE BIG Info Advertising Report
          Unknown mask (0x0000020000000000)
> HCI Event: Command Complete (0x0e) plen 4                 #30 [hci1] 0.851525
      LE Set Event Mask (0x08|0x0001) ncmd 1
        Status: Success (0x00)
< HCI Command: Set Event Mask (0x03|0x0001) plen 8          #31 [hci1] 0.870988
        Mask: 0x2000800002008890
          Disconnection Complete
          Encryption Change
          Read Remote Version Information Complete
          Hardware Error
          Data Buffer Overflow
          Encryption Key Refresh Complete
          LE Meta
> HCI Event: Command Complete (0x0e) plen 4                 #32 [hci1] 0.871554
      Set Event Mask (0x03|0x0001) ncmd 1
        Status: Success (0x00)
< HCI Command: Read BD ADDR (0x04|0x0009) plen 0            #33 [hci1] 0.890979
> HCI Event: Command Complete (0x0e) plen 10                #34 [hci1] 0.891420
      Read BD ADDR (0x04|0x0009) ncmd 1
        Status: Success (0x00)
        Address: 00:00:00:00:00:00 (OUI 00-00-00)
< HCI Command: LE Set Random Address (0x08|0x0005) plen 6   #35 [hci1] 0.910989
        Address: D5:B6:CC:31:DB:3B (Static)
> HCI Event: Command Complete (0x0e) plen 4                 #36 [hci1] 0.911531
      LE Set Random Address (0x08|0x0005) ncmd 1
        Status: Success (0x00)
< HCI Command: LE Set Extended Adv.. (0x08|0x0036) plen 25  #37 [hci1] 3.471087
        Handle: 0x00
        Properties: 0x0013
          Connectable
          Scannable
          Use legacy advertising PDUs: ADV_IND
        Min advertising interval: 100.000 msec (0x00a0)
        Max advertising interval: 150.000 msec (0x00f0)
        Channel map: 37, 38, 39 (0x07)
        Own address type: Random (0x01)
        Peer address type: Public (0x00)
        Peer address: 00:00:00:00:00:00 (OUI 00-00-00)
        Filter policy: Allow Scan Request from Any, Allow Connect Request from Any (0x00)
        TX power: Host has no preference (0x7f)
        Primary PHY: LE 1M (0x01)
        Secondary max skip: 0x00
        Secondary PHY: LE 1M (0x01)
        SID: 0x00
        Scan request notifications: Disabled (0x00)
> HCI Event: Command Complete (0x0e) plen 5                 #38 [hci1] 3.471799
      LE Set Extended Advertising Parameters (0x08|0x0036) ncmd 1
        Status: Success (0x00)
        TX power (selected): 0 dbm (0x00)
< HCI Command: LE Set Advertising S.. (0x08|0x0035) plen 7  #39 [hci1] 3.491024
        Advertising handle: 0x00
        Advertising random address: D5:B6:CC:31:DB:3B (Static)
> HCI Event: Command Complete (0x0e) plen 4                 #40 [hci1] 3.491520
      LE Set Advertising Set Random Address (0x08|0x0035) ncmd 1
        Status: Success (0x00)
< HCI Command: LE Set Extended Adv.. (0x08|0x0037) plen 22  #41 [hci1] 3.511026
        Handle: 0x00
        Operation: Complete extended advertising data (0x03)
        Fragment preference: Minimize fragmentation (0x01)
        Data length: 0x12
        Flags: 0x06
          LE General Discoverable Mode
          BR/EDR Not Supported
        Name (complete): Tester_F6B11A
> HCI Event: Command Complete (0x0e) plen 4                 #42 [hci1] 3.511791
      LE Set Extended Advertising Data (0x08|0x0037) ncmd 1
        Status: Success (0x00)
< HCI Command: LE Set Extended Scan.. (0x08|0x0038) plen 4  #43 [hci1] 3.531052
        Handle: 0x00
        Operation: Complete scan response data (0x03)
        Fragment preference: Minimize fragmentation (0x01)
        Data length: 0x00
> HCI Event: Command Complete (0x0e) plen 4                 #44 [hci1] 3.531574
      LE Set Extended Scan Response Data (0x08|0x0038) ncmd 1
        Status: Success (0x00)
< HCI Command: LE Set Extended Adve.. (0x08|0x0039) plen 6  #45 [hci1] 3.551092
        Extended advertising: Enabled (0x01)
        Number of sets: 1 (0x01)
        Entry 0
          Handle: 0x00
          Duration: 0 ms (0x00)
          Max ext adv events: 0
> HCI Event: Command Complete (0x0e) plen 4                 #46 [hci1] 3.551667
      LE Set Extended Advertising Enable (0x08|0x0039) ncmd 1
        Status: Success (0x00)
> HCI Event: LE Meta Event (0x3e) plen 31                   #47 [hci1] 3.872462
      LE Enhanced Connection Complete (0x0a)
        Status: Success (0x00)
        Handle: 165
        Role: Peripheral (0x01)
        Peer address type: Public (0x00)
        Peer address: DF:A9:FF:F6:B1:1A (OUI DF-A9-FF)
        Local resolvable private address: 00:00:00:00:00:00 (Non-Resolvable)
        Peer resolvable private address: 00:00:00:00:00:00 (Non-Resolvable)
        Connection interval: 87.50 msec (0x0046)
        Connection latency: 0 (0x0000)
        Supervision timeout: 25120 msec (0x09d0)
        Central clock accuracy: 0x01
> HCI Event: LE Meta Event (0x3e) plen 6                    #48 [hci1] 3.872545
      LE Advertising Set Terminated (0x12)
        Status: Success (0x00)
        Handle: 0
        Connection handle: 165
        Number of completed extended advertising events: 0
< HCI Command: LE Read Remote Used... (0x08|0x0016) plen 2  #49 [hci1] 3.891218
        Handle: 165 Address: DF:A9:FF:F6:B1:1A (OUI DF-A9-FF)
< ACL Data TX: Handle 165 flags 0x00 dlen 7                 #50 [hci1] 3.891227
      ATT: Exchange MTU Request (0x02) len 2
        Client RX MTU: 251
> HCI Event: Command Status (0x0f) plen 4                   #51 [hci1] 3.891732
      LE Read Remote Used Features (0x08|0x0016) ncmd 1
        Status: Success (0x00)
> HCI Event: Number of Completed Packets (0x13) plen 5      #52 [hci1] 4.048396
        Num handles: 1
        Handle: 165 Address: DF:A9:FF:F6:B1:1A (OUI DF-A9-FF)
        Count: 1
        #50: len 7 (0 Kb/s)
        Latency: 157 msec (157-157 msec ~157 msec)
> HCI Event: LE Meta Event (0x3e) plen 12                   #53 [hci1] 4.136366
      LE Read Remote Used Features (0x04)
        Status: Success (0x00)
        Handle: 165 Address: DF:A9:FF:F6:B1:1A (OUI DF-A9-FF)
        Features: 0x2d 0x49 0x00 0xf7 0x67 0xd8 0x00 0x00
          LE Encryption
          Extended Reject Indication
          Peripheral-initiated Features Exchange
          LE Data Packet Length Extension
          LE 2M PHY
          LE Coded PHY
          Channel Selection Algorithm #2
          Periodic Advertising Sync Transfer - Sender
          Periodic Advertising Sync Transfer - Recipient
          Sleep Clock Accuracy Updates
          Connected Isochronous Stream - Central
          Connected Isochronous Stream - Peripheral
          Isochronous Broadcaster
          Synchronized Receiver
          Connected Isochronous Stream (Host Support)
          LE Power Control Request
          LE Power Control Request
          Connection Subrating
          Connection Subrating (Host Support)
          Unknown features (0x0000d80000000000)
> ACL Data RX: Handle 165 flags 0x02 dlen 11                #54 [hci1] 6.585985
      SMP: Pairing Request (0x01) len 6
        IO capability: KeyboardDisplay (0x04)
        OOB data: Authentication data not present (0x00)
        Authentication requirement: Bonding, MITM, SC, No Keypresses (0x0d)
        Max encryption key size: 16
        Initiator key distribution: EncKey IdKey (0x03)
        Responder key distribution: EncKey IdKey Sign (0x07)
> ACL Data RX: Handle 165 flags 0x02 dlen 7                 #55 [hci1] 6.586505
      ATT: Exchange MTU Response (0x03) len 2
        Server RX MTU: 23
< HCI Command: Host Number of Compl.. (0x03|0x0035) plen 5  #56 [hci1] 6.591488
        Num handles: 1
        Handle: 165 Address: DF:A9:FF:F6:B1:1A (OUI DF-A9-FF)
        Count: 1
< ACL Data TX: Handle 165 flags 0x00 dlen 11                #57 [hci1] 6.591547
      SMP: Pairing Response (0x02) len 6
        IO capability: DisplayOnly (0x00)
        OOB data: Authentication data not present (0x00)
        Authentication requirement: Bonding, No MITM, SC, No Keypresses (0x09)
        Max encryption key size: 16
        Initiator key distribution: IdKey (0x02)
        Responder key distribution: <none> (0x00)
< HCI Command: Host Number of Compl.. (0x03|0x0035) plen 5  #58 [hci1] 6.591731
        Num handles: 1
        Handle: 165 Address: DF:A9:FF:F6:B1:1A (OUI DF-A9-FF)
        Count: 1
> HCI Event: Number of Completed Packets (0x13) plen 5      #59 [hci1] 6.761224
        Num handles: 1
        Handle: 165 Address: DF:A9:FF:F6:B1:1A (OUI DF-A9-FF)
        Count: 1
        #57: len 11 (0 Kb/s)
        Latency: 169 msec (157-169 msec ~163 msec)
> ACL Data RX: Handle 165 flags 0x02 dlen 27                #60 [hci1] 6.761423
> ACL Data RX: Handle 165 flags 0x01 dlen 27                #61 [hci1] 6.761967
> ACL Data RX: Handle 165 flags 0x01 dlen 15                #62 [hci1] 6.762482
      SMP: Pairing Public Key (0x0c) len 64
        X: c360f11aec67452925c03c2212a92561ac19de4750127c7f1ccfa4f93b3d4760
        Y: c394e838c04b91ff6237027a6c6cfe41bb25a701e58af9e0f89a0e5f9afe7ad1
< HCI Command: Host Number of Compl.. (0x03|0x0035) plen 5  #63 [hci1] 6.771909
        Num handles: 1
        Handle: 165 Address: DF:A9:FF:F6:B1:1A (OUI DF-A9-FF)
        Count: 1
< HCI Command: Host Number of Compl.. (0x03|0x0035) plen 5  #64 [hci1] 6.772065
        Num handles: 1
        Handle: 165 Address: DF:A9:FF:F6:B1:1A (OUI DF-A9-FF)
        Count: 1
< HCI Command: Host Number of Compl.. (0x03|0x0035) plen 5  #65 [hci1] 6.772360
        Num handles: 1
        Handle: 165 Address: DF:A9:FF:F6:B1:1A (OUI DF-A9-FF)
        Count: 1
< ACL Data TX: Handle 165 flags 0x00 dlen 27                #66 [hci1] 6.772529
< ACL Data TX: Handle 165 flags 0x01 dlen 27                #67 [hci1] 6.772547
< ACL Data TX: Handle 165 flags 0x01 dlen 15                #68 [hci1] 6.772551
      SMP: Pairing Public Key (0x0c) len 64
        X: 98308440221e2d910f0e54b71e7ec652857aa9b5a0dc65028824cc19db1226e9
        Y: 67a4816bcb62efb21701e31fdb27561a6217575fb007a8bbdabe7e28b6f68482
> HCI Event: Number of Completed Packets (0x13) plen 5      #69 [hci1] 6.849050
        Num handles: 1
        Handle: 165 Address: DF:A9:FF:F6:B1:1A (OUI DF-A9-FF)
        Count: 1
        #66: len 27 (2 Kb/s)
        Latency: 76 msec (76-169 msec ~119 msec)
> HCI Event: Number of Completed Packets (0x13) plen 5      #70 [hci1] 6.849671
        Num handles: 1
        Handle: 165 Address: DF:A9:FF:F6:B1:1A (OUI DF-A9-FF)
        Count: 1
        #67: len 27 (2 Kb/s)
        Latency: 77 msec (76-169 msec ~98 msec)
> HCI Event: Number of Completed Packets (0x13) plen 5      #71 [hci1] 6.935896
        Num handles: 1
        Handle: 165 Address: DF:A9:FF:F6:B1:1A (OUI DF-A9-FF)
        Count: 1
        #68: len 15 (0 Kb/s)
        Latency: 163 msec (76-169 msec ~130 msec)
> ACL Data RX: Handle 165 flags 0x02 dlen 21                #72 [hci1] 7.723663
      SMP: Pairing Confirm (0x03) len 16
        Confim value: 89dd57cab7c9cbdeec09af130952c4cd
< HCI Command: Host Number of Compl.. (0x03|0x0035) plen 5  #73 [hci1] 7.731223
        Num handles: 1
        Handle: 165 Address: DF:A9:FF:F6:B1:1A (OUI DF-A9-FF)
        Count: 1
< ACL Data TX: Handle 165 flags 0x00 dlen 21                #74 [hci1] 7.731318
      SMP: Pairing Confirm (0x03) len 16
        Confim value: e6f24a5220a332bf7c2ff3fa69031c7e
> HCI Event: Number of Completed Packets (0x13) plen 5      #75 [hci1] 7.898569
        Num handles: 1
        Handle: 165 Address: DF:A9:FF:F6:B1:1A (OUI DF-A9-FF)
        Count: 1
        #74: len 21 (1 Kb/s)
        Latency: 167 msec (76-169 msec ~149 msec)
> ACL Data RX: Handle 165 flags 0x02 dlen 21                #76 [hci1] 7.898878
      SMP: Pairing Random (0x04) len 16
        Random value: e791fc5f765876bf0000000000000000
< HCI Command: Host Number of Compl.. (0x03|0x0035) plen 5  #77 [hci1] 7.914067
        Num handles: 1
        Handle: 165 Address: DF:A9:FF:F6:B1:1A (OUI DF-A9-FF)
        Count: 1
< ACL Data TX: Handle 165 flags 0x00 dlen 21                #78 [hci1] 7.914125
      SMP: Pairing Random (0x04) len 16
        Random value: 8e6108f966a694cbe26df70bb96773e6
> HCI Event: Number of Completed Packets (0x13) plen 5      #79 [hci1] 8.073327
        Num handles: 1
        Handle: 165 Address: DF:A9:FF:F6:B1:1A (OUI DF-A9-FF)
        Count: 1
        #78: len 21 (1 Kb/s)
        Latency: 159 msec (76-169 msec ~154 msec)
> ACL Data RX: Handle 165 flags 0x02 dlen 21                #80 [hci1] 8.161284
      SMP: Pairing Confirm (0x03) len 16
        Confim value: 450e49c6cddb8204270f051095cf4596
< HCI Command: Host Number of Compl.. (0x03|0x0035) plen 5  #81 [hci1] 8.171621
        Num handles: 1
        Handle: 165 Address: DF:A9:FF:F6:B1:1A (OUI DF-A9-FF)
        Count: 1
< ACL Data TX: Handle 165 flags 0x00 dlen 21                #82 [hci1] 8.171862
      SMP: Pairing Confirm (0x03) len 16
        Confim value: ce01e9a081f077cbad3b4769bc39ba33
> HCI Event: Number of Completed Packets (0x13) plen 5      #83 [hci1] 8.336112
        Num handles: 1
        Handle: 165 Address: DF:A9:FF:F6:B1:1A (OUI DF-A9-FF)
        Count: 1
        #82: len 21 (1 Kb/s)
        Latency: 164 msec (76-169 msec ~159 msec)
> ACL Data RX: Handle 165 flags 0x02 dlen 21                #84 [hci1] 8.336390
      SMP: Pairing Random (0x04) len 16
        Random value: 9a3d8575f08535b60000000000000000
< HCI Command: Host Number of Compl.. (0x03|0x0035) plen 5  #85 [hci1] 8.351649
        Num handles: 1
        Handle: 165 Address: DF:A9:FF:F6:B1:1A (OUI DF-A9-FF)
        Count: 1
< ACL Data TX: Handle 165 flags 0x00 dlen 21                #86 [hci1] 8.351673
      SMP: Pairing Random (0x04) len 16
        Random value: 4d02679f89a05211af56d8b3da64d21e
> HCI Event: Number of Completed Packets (0x13) plen 5      #87 [hci1] 8.510754
        Num handles: 1
        Handle: 165 Address: DF:A9:FF:F6:B1:1A (OUI DF-A9-FF)
        Count: 1
        #86: len 21 (1 Kb/s)
        Latency: 159 msec (76-169 msec ~159 msec)
> ACL Data RX: Handle 165 flags 0x02 dlen 21                #88 [hci1] 8.598651
      SMP: Pairing Confirm (0x03) len 16
        Confim value: e0f4b54912f6e6fbd75a31f7bd2d2f3e
< HCI Command: Host Number of Compl.. (0x03|0x0035) plen 5  #89 [hci1] 8.611648
        Num handles: 1
        Handle: 165 Address: DF:A9:FF:F6:B1:1A (OUI DF-A9-FF)
        Count: 1
< ACL Data TX: Handle 165 flags 0x00 dlen 21                #90 [hci1] 8.611845
      SMP: Pairing Confirm (0x03) len 16
        Confim value: 990cd1856e203172e7b28e00a2e46019
> HCI Event: Number of Completed Packets (0x13) plen 5      #91 [hci1] 8.773442
        Num handles: 1
        Handle: 165 Address: DF:A9:FF:F6:B1:1A (OUI DF-A9-FF)
        Count: 1
        #90: len 21 (1 Kb/s)
        Latency: 161 msec (76-169 msec ~160 msec)
> ACL Data RX: Handle 165 flags 0x02 dlen 21                #92 [hci1] 8.773852
      SMP: Pairing Random (0x04) len 16
        Random value: 922d456bf751aea70000000000000000
< HCI Command: Host Number of Compl.. (0x03|0x0035) plen 5  #93 [hci1] 8.791725
        Num handles: 1
        Handle: 165 Address: DF:A9:FF:F6:B1:1A (OUI DF-A9-FF)
        Count: 1
< ACL Data TX: Handle 165 flags 0x00 dlen 21                #94 [hci1] 8.791873
      SMP: Pairing Random (0x04) len 16
        Random value: 5e8286bc235a02440d0c3424a2acf8fd
> HCI Event: Number of Completed Packets (0x13) plen 5      #95 [hci1] 8.948285
        Num handles: 1
        Handle: 165 Address: DF:A9:FF:F6:B1:1A (OUI DF-A9-FF)
        Count: 1
        #94: len 21 (1 Kb/s)
        Latency: 156 msec (76-169 msec ~158 msec)
> ACL Data RX: Handle 165 flags 0x02 dlen 21                #96 [hci1] 9.036188
      SMP: Pairing Confirm (0x03) len 16
        Confim value: ca713ad17ac21ea4fc8874e2c8940a24
< HCI Command: Host Number of Compl.. (0x03|0x0035) plen 5  #97 [hci1] 9.051536
        Num handles: 1
        Handle: 165 Address: DF:A9:FF:F6:B1:1A (OUI DF-A9-FF)
        Count: 1
< ACL Data TX: Handle 165 flags 0x00 dlen 21                #98 [hci1] 9.051743
      SMP: Pairing Confirm (0x03) len 16
        Confim value: ab599a24532bce48cc87edf93a6d4651
> HCI Event: Number of Completed Packets (0x13) plen 5      #99 [hci1] 9.210988
        Num handles: 1
        Handle: 165 Address: DF:A9:FF:F6:B1:1A (OUI DF-A9-FF)
        Count: 1
        #98: len 21 (1 Kb/s)
        Latency: 159 msec (76-169 msec ~158 msec)
> ACL Data RX: Handle 165 flags 0x02 dlen 21               #100 [hci1] 9.211275
      SMP: Pairing Random (0x04) len 16
        Random value: b9e1dade0d0d14ef0000000000000000
< HCI Command: Host Number of Comp.. (0x03|0x0035) plen 5  #101 [hci1] 9.211971
        Num handles: 1
        Handle: 165 Address: DF:A9:FF:F6:B1:1A (OUI DF-A9-FF)
        Count: 1
< ACL Data TX: Handle 165 flags 0x00 dlen 21               #102 [hci1] 9.212115
      SMP: Pairing Random (0x04) len 16
        Random value: 5c4a1bcadd27bd58e945097b00bad7ac
> HCI Event: Number of Completed Packets (0x13) plen 5     #103 [hci1] 9.385789
        Num handles: 1
        Handle: 165 Address: DF:A9:FF:F6:B1:1A (OUI DF-A9-FF)
        Count: 1
        #102: len 21 (0 Kb/s)
        Latency: 173 msec (76-173 msec ~166 msec)
> ACL Data RX: Handle 165 flags 0x02 dlen 21               #104 [hci1] 9.473656
      SMP: Pairing Confirm (0x03) len 16
        Confim value: 1caaa6be33cc7858c4c4a8707e213b26
< HCI Command: Host Number of Comp.. (0x03|0x0035) plen 5  #105 [hci1] 9.491367
        Num handles: 1
        Handle: 165 Address: DF:A9:FF:F6:B1:1A (OUI DF-A9-FF)
        Count: 1
< ACL Data TX: Handle 165 flags 0x00 dlen 21               #106 [hci1] 9.491420
      SMP: Pairing Confirm (0x03) len 16
        Confim value: b590250d3bf97531fc24127b02908d18
> HCI Event: Number of Completed Packets (0x13) plen 5     #107 [hci1] 9.648541
        Num handles: 1
        Handle: 165 Address: DF:A9:FF:F6:B1:1A (OUI DF-A9-FF)
        Count: 1
        #106: len 21 (1 Kb/s)
        Latency: 157 msec (76-173 msec ~161 msec)
> ACL Data RX: Handle 165 flags 0x02 dlen 21               #108 [hci1] 9.648939
      SMP: Pairing Random (0x04) len 16
        Random value: 495e766b64ef35220000000000000000
< HCI Command: Host Number of Comp.. (0x03|0x0035) plen 5  #109 [hci1] 9.651675
        Num handles: 1
        Handle: 165 Address: DF:A9:FF:F6:B1:1A (OUI DF-A9-FF)
        Count: 1
< ACL Data TX: Handle 165 flags 0x00 dlen 21               #110 [hci1] 9.651776
      SMP: Pairing Random (0x04) len 16
        Random value: 32527e6e64e79f33b2e374394db8ab2d
> HCI Event: Number of Completed Packets (0x13) plen 5     #111 [hci1] 9.823150
        Num handles: 1
        Handle: 165 Address: DF:A9:FF:F6:B1:1A (OUI DF-A9-FF)
        Count: 1
        #110: len 21 (0 Kb/s)
        Latency: 171 msec (76-173 msec ~166 msec)
> ACL Data RX: Handle 165 flags 0x02 dlen 21               #112 [hci1] 9.911124
      SMP: Pairing Confirm (0x03) len 16
        Confim value: 40d77d4549d218789974ebfc42c8f90e
< HCI Command: Host Number of Comp.. (0x03|0x0035) plen 5  #113 [hci1] 9.931661
        Num handles: 1
        Handle: 165 Address: DF:A9:FF:F6:B1:1A (OUI DF-A9-FF)
        Count: 1
< ACL Data TX: Handle 165 flags 0x00 dlen 21               #114 [hci1] 9.931880
      SMP: Pairing Confirm (0x03) len 16
        Confim value: 1f25d82dcef283c2f0f7349ad189cf1f
> HCI Event: Number of Completed Packets (0x13) plen 5    #115 [hci1] 10.085962
        Num handles: 1
        Handle: 165 Address: DF:A9:FF:F6:B1:1A (OUI DF-A9-FF)
        Count: 1
        #114: len 21 (1 Kb/s)
        Latency: 154 msec (76-173 msec ~160 msec)
> ACL Data RX: Handle 165 flags 0x02 dlen 21              #116 [hci1] 10.086252
      SMP: Pairing Random (0x04) len 16
        Random value: 099ffc2a73d074560000000000000000
< HCI Command: Host Number of Com.. (0x03|0x0035) plen 5  #117 [hci1] 10.091646
        Num handles: 1
        Handle: 165 Address: DF:A9:FF:F6:B1:1A (OUI DF-A9-FF)
        Count: 1
< ACL Data TX: Handle 165 flags 0x00 dlen 21              #118 [hci1] 10.091728
      SMP: Pairing Random (0x04) len 16
        Random value: dddbdfe2838e9a8cc6964353c850fef7
> HCI Event: Number of Completed Packets (0x13) plen 5    #119 [hci1] 10.260730
        Num handles: 1
        Handle: 165 Address: DF:A9:FF:F6:B1:1A (OUI DF-A9-FF)
        Count: 1
        #118: len 21 (0 Kb/s)
        Latency: 169 msec (76-173 msec ~164 msec)
> ACL Data RX: Handle 165 flags 0x02 dlen 21              #120 [hci1] 10.348588
      SMP: Pairing Confirm (0x03) len 16
        Confim value: fa30266ded213cefbdfffff88c262c4d
< HCI Command: Host Number of Com.. (0x03|0x0035) plen 5  #121 [hci1] 10.351472
        Num handles: 1
        Handle: 165 Address: DF:A9:FF:F6:B1:1A (OUI DF-A9-FF)
        Count: 1
< ACL Data TX: Handle 165 flags 0x00 dlen 21              #122 [hci1] 10.351665
      SMP: Pairing Confirm (0x03) len 16
        Confim value: 9004cd7e62311bd25014f11a064f74c4
> HCI Event: Number of Completed Packets (0x13) plen 5    #123 [hci1] 10.523409
        Num handles: 1
        Handle: 165 Address: DF:A9:FF:F6:B1:1A (OUI DF-A9-FF)
        Count: 1
        #122: len 21 (0 Kb/s)
        Latency: 171 msec (76-173 msec ~168 msec)
> ACL Data RX: Handle 165 flags 0x02 dlen 21              #124 [hci1] 10.523759
      SMP: Pairing Random (0x04) len 16
        Random value: 6d85edb6db9101ff0000000000000000
< HCI Command: Host Number of Com.. (0x03|0x0035) plen 5  #125 [hci1] 10.531816
        Num handles: 1
        Handle: 165 Address: DF:A9:FF:F6:B1:1A (OUI DF-A9-FF)
        Count: 1
< ACL Data TX: Handle 165 flags 0x00 dlen 21              #126 [hci1] 10.531980
      SMP: Pairing Random (0x04) len 16
        Random value: eb9f1915536596b6fc3db1c86b2b1970
> HCI Event: Number of Completed Packets (0x13) plen 5    #127 [hci1] 10.698171
        Num handles: 1
        Handle: 165 Address: DF:A9:FF:F6:B1:1A (OUI DF-A9-FF)
        Count: 1
        #126: len 21 (1 Kb/s)
        Latency: 166 msec (76-173 msec ~167 msec)
> ACL Data RX: Handle 165 flags 0x02 dlen 21              #128 [hci1] 10.786050
      SMP: Pairing Confirm (0x03) len 16
        Confim value: f932da84fb63f876aa5410cd536a4c65
< HCI Command: Host Number of Com.. (0x03|0x0035) plen 5  #129 [hci1] 10.791374
        Num handles: 1
        Handle: 165 Address: DF:A9:FF:F6:B1:1A (OUI DF-A9-FF)
        Count: 1
< ACL Data TX: Handle 165 flags 0x00 dlen 21              #130 [hci1] 10.791436
      SMP: Pairing Confirm (0x03) len 16
        Confim value: 0e383018b7ffade967eb0fd506b9a06e
> HCI Event: Number of Completed Packets (0x13) plen 5    #131 [hci1] 10.960896
        Num handles: 1
        Handle: 165 Address: DF:A9:FF:F6:B1:1A (OUI DF-A9-FF)
        Count: 1
        #130: len 21 (0 Kb/s)
        Latency: 169 msec (76-173 msec ~168 msec)
> ACL Data RX: Handle 165 flags 0x02 dlen 21              #132 [hci1] 10.961311
      SMP: Pairing Random (0x04) len 16
        Random value: 8234edcbe43643af0000000000000000
< HCI Command: Host Number of Com.. (0x03|0x0035) plen 5  #133 [hci1] 10.971806
        Num handles: 1
        Handle: 165 Address: DF:A9:FF:F6:B1:1A (OUI DF-A9-FF)
        Count: 1
< ACL Data TX: Handle 165 flags 0x00 dlen 21              #134 [hci1] 10.971892
      SMP: Pairing Random (0x04) len 16
        Random value: 5c794dc9ad9f2c3f295ebd5ad5e1c3cf
> HCI Event: Number of Completed Packets (0x13) plen 5    #135 [hci1] 11.135661
        Num handles: 1
        Handle: 165 Address: DF:A9:FF:F6:B1:1A (OUI DF-A9-FF)
        Count: 1
        #134: len 21 (1 Kb/s)
        Latency: 163 msec (76-173 msec ~166 msec)
> ACL Data RX: Handle 165 flags 0x02 dlen 21              #136 [hci1] 11.223620
      SMP: Pairing Confirm (0x03) len 16
        Confim value: 8902060046dd8ec36ffde41b55710036
< HCI Command: Host Number of Com.. (0x03|0x0035) plen 5  #137 [hci1] 11.231319
        Num handles: 1
        Handle: 165 Address: DF:A9:FF:F6:B1:1A (OUI DF-A9-FF)
        Count: 1
< ACL Data TX: Handle 165 flags 0x00 dlen 21              #138 [hci1] 11.231482
      SMP: Pairing Confirm (0x03) len 16
        Confim value: ee0273ba9a0717cc018df0e2540127fb
> HCI Event: Number of Completed Packets (0x13) plen 5    #139 [hci1] 11.398378
        Num handles: 1
        Handle: 165 Address: DF:A9:FF:F6:B1:1A (OUI DF-A9-FF)
        Count: 1
        #138: len 21 (1 Kb/s)
        Latency: 166 msec (76-173 msec ~166 msec)
> ACL Data RX: Handle 165 flags 0x02 dlen 21              #140 [hci1] 11.398755
      SMP: Pairing Random (0x04) len 16
        Random value: 6aa73870bf86bb410000000000000000
< HCI Command: Host Number of Com.. (0x03|0x0035) plen 5  #141 [hci1] 11.411823
        Num handles: 1
        Handle: 165 Address: DF:A9:FF:F6:B1:1A (OUI DF-A9-FF)
        Count: 1
< ACL Data TX: Handle 165 flags 0x00 dlen 21              #142 [hci1] 11.412032
      SMP: Pairing Random (0x04) len 16
        Random value: 5c2fff312cdf99c9491988e877355a9a
> HCI Event: Number of Completed Packets (0x13) plen 5    #143 [hci1] 11.573199
        Num handles: 1
        Handle: 165 Address: DF:A9:FF:F6:B1:1A (OUI DF-A9-FF)
        Count: 1
        #142: len 21 (1 Kb/s)
        Latency: 161 msec (76-173 msec ~163 msec)
> ACL Data RX: Handle 165 flags 0x02 dlen 21              #144 [hci1] 11.661080
      SMP: Pairing Confirm (0x03) len 16
        Confim value: 2966eabb3462f7af96117b2220069df8
< HCI Command: Host Number of Com.. (0x03|0x0035) plen 5  #145 [hci1] 11.671533
        Num handles: 1
        Handle: 165 Address: DF:A9:FF:F6:B1:1A (OUI DF-A9-FF)
        Count: 1
< ACL Data TX: Handle 165 flags 0x00 dlen 21              #146 [hci1] 11.671840
      SMP: Pairing Confirm (0x03) len 16
        Confim value: 8087491d32dcd7fc1d354800d122f3c2
> HCI Event: Number of Completed Packets (0x13) plen 5    #147 [hci1] 11.836144
        Num handles: 1
        Handle: 165 Address: DF:A9:FF:F6:B1:1A (OUI DF-A9-FF)
        Count: 1
        #146: len 21 (1 Kb/s)
        Latency: 164 msec (76-173 msec ~164 msec)
> ACL Data RX: Handle 165 flags 0x02 dlen 21              #148 [hci1] 11.836223
      SMP: Pairing Random (0x04) len 16
        Random value: d2c1de5973ec5cd50000000000000000
< HCI Command: Host Number of Com.. (0x03|0x0035) plen 5  #149 [hci1] 11.851885
        Num handles: 1
        Handle: 165 Address: DF:A9:FF:F6:B1:1A (OUI DF-A9-FF)
        Count: 1
< ACL Data TX: Handle 165 flags 0x00 dlen 21              #150 [hci1] 11.851960
      SMP: Pairing Random (0x04) len 16
        Random value: c629a3a987d808e808655d558dfc1155
> HCI Event: Number of Completed Packets (0x13) plen 5    #151 [hci1] 12.010640
        Num handles: 1
        Handle: 165 Address: DF:A9:FF:F6:B1:1A (OUI DF-A9-FF)
        Count: 1
        #150: len 21 (1 Kb/s)
        Latency: 158 msec (76-173 msec ~161 msec)
> ACL Data RX: Handle 165 flags 0x02 dlen 21              #152 [hci1] 12.098574
      SMP: Pairing Confirm (0x03) len 16
        Confim value: 5c9539415c620791eeb5a512f8259591
< HCI Command: Host Number of Com.. (0x03|0x0035) plen 5  #153 [hci1] 12.111539
        Num handles: 1
        Handle: 165 Address: DF:A9:FF:F6:B1:1A (OUI DF-A9-FF)
        Count: 1
< ACL Data TX: Handle 165 flags 0x00 dlen 21              #154 [hci1] 12.111798
      SMP: Pairing Confirm (0x03) len 16
        Confim value: 28376e822d3b4fc15eca01a3635971f1
> HCI Event: Number of Completed Packets (0x13) plen 5    #155 [hci1] 12.273326
        Num handles: 1
        Handle: 165 Address: DF:A9:FF:F6:B1:1A (OUI DF-A9-FF)
        Count: 1
        #154: len 21 (1 Kb/s)
        Latency: 161 msec (76-173 msec ~161 msec)
> ACL Data RX: Handle 165 flags 0x02 dlen 21              #156 [hci1] 12.273772
      SMP: Pairing Random (0x04) len 16
        Random value: d5006b607ecf15080000000000000000
< HCI Command: Host Number of Com.. (0x03|0x0035) plen 5  #157 [hci1] 12.291883
        Num handles: 1
        Handle: 165 Address: DF:A9:FF:F6:B1:1A (OUI DF-A9-FF)
        Count: 1
< ACL Data TX: Handle 165 flags 0x00 dlen 21              #158 [hci1] 12.291990
      SMP: Pairing Random (0x04) len 16
        Random value: 92f20f6ad8f13724432c7fd6001c45ff
> HCI Event: Number of Completed Packets (0x13) plen 5    #159 [hci1] 12.448225
        Num handles: 1
        Handle: 165 Address: DF:A9:FF:F6:B1:1A (OUI DF-A9-FF)
        Count: 1
        #158: len 21 (1 Kb/s)
        Latency: 156 msec (76-173 msec ~158 msec)
> ACL Data RX: Handle 165 flags 0x02 dlen 21              #160 [hci1] 12.536054
      SMP: Pairing Confirm (0x03) len 16
        Confim value: d391322f53cb7025619479d8767dff06
< HCI Command: Host Number of Com.. (0x03|0x0035) plen 5  #161 [hci1] 12.551163
        Num handles: 1
        Handle: 165 Address: DF:A9:FF:F6:B1:1A (OUI DF-A9-FF)
        Count: 1
< ACL Data TX: Handle 165 flags 0x00 dlen 21              #162 [hci1] 12.551234
      SMP: Pairing Confirm (0x03) len 16
        Confim value: e49ca0fdc34acbd6597c2eee2741d61e
> HCI Event: Number of Completed Packets (0x13) plen 5    #163 [hci1] 12.710836
        Num handles: 1
        Handle: 165 Address: DF:A9:FF:F6:B1:1A (OUI DF-A9-FF)
        Count: 1
        #162: len 21 (1 Kb/s)
        Latency: 159 msec (76-173 msec ~159 msec)
> ACL Data RX: Handle 165 flags 0x02 dlen 21              #164 [hci1] 12.711315
      SMP: Pairing Random (0x04) len 16
        Random value: 914d1f36b20ccb970000000000000000
< HCI Command: Host Number of Com.. (0x03|0x0035) plen 5  #165 [hci1] 12.731682
        Num handles: 1
        Handle: 165 Address: DF:A9:FF:F6:B1:1A (OUI DF-A9-FF)
        Count: 1
< ACL Data TX: Handle 165 flags 0x00 dlen 21              #166 [hci1] 12.731910
      SMP: Pairing Random (0x04) len 16
        Random value: 23ac32ebbb5e14c8a6b9622f296d277f
> HCI Event: Number of Completed Packets (0x13) plen 5    #167 [hci1] 12.885704
        Num handles: 1
        Handle: 165 Address: DF:A9:FF:F6:B1:1A (OUI DF-A9-FF)
        Count: 1
        #166: len 21 (1 Kb/s)
        Latency: 153 msec (76-173 msec ~156 msec)
> ACL Data RX: Handle 165 flags 0x02 dlen 21              #168 [hci1] 12.973471
      SMP: Pairing Confirm (0x03) len 16
        Confim value: 7b56b9b2eca0b3c1471eda4aa49837dc
< HCI Command: Host Number of Com.. (0x03|0x0035) plen 5  #169 [hci1] 12.991633
        Num handles: 1
        Handle: 165 Address: DF:A9:FF:F6:B1:1A (OUI DF-A9-FF)
        Count: 1
< ACL Data TX: Handle 165 flags 0x00 dlen 21              #170 [hci1] 12.991842
      SMP: Pairing Confirm (0x03) len 16
        Confim value: 20ecec087ec8c2ffa76bed53215de3ee
> HCI Event: Number of Completed Packets (0x13) plen 5    #171 [hci1] 13.148350
        Num handles: 1
        Handle: 165 Address: DF:A9:FF:F6:B1:1A (OUI DF-A9-FF)
        Count: 1
        #170: len 21 (1 Kb/s)
        Latency: 156 msec (76-173 msec ~156 msec)
> ACL Data RX: Handle 165 flags 0x02 dlen 21              #172 [hci1] 13.148695
      SMP: Pairing Random (0x04) len 16
        Random value: 44c3b8a53d713a900000000000000000
< HCI Command: Host Number of Com.. (0x03|0x0035) plen 5  #173 [hci1] 13.152047
        Num handles: 1
        Handle: 165 Address: DF:A9:FF:F6:B1:1A (OUI DF-A9-FF)
        Count: 1
< ACL Data TX: Handle 165 flags 0x00 dlen 21              #174 [hci1] 13.152168
      SMP: Pairing Random (0x04) len 16
        Random value: 297efe85e67448a15f56bd27e3a3cf1d
> HCI Event: Number of Completed Packets (0x13) plen 5    #175 [hci1] 13.323161
        Num handles: 1
        Handle: 165 Address: DF:A9:FF:F6:B1:1A (OUI DF-A9-FF)
        Count: 1
        #174: len 21 (0 Kb/s)
        Latency: 170 msec (76-173 msec ~163 msec)
> ACL Data RX: Handle 165 flags 0x02 dlen 21              #176 [hci1] 13.411024
      SMP: Pairing Confirm (0x03) len 16
        Confim value: 1fab30477215d3eb536f71f8dffcf8e2
< HCI Command: Host Number of Com.. (0x03|0x0035) plen 5  #177 [hci1] 13.411541
        Num handles: 1
        Handle: 165 Address: DF:A9:FF:F6:B1:1A (OUI DF-A9-FF)
        Count: 1
< ACL Data TX: Handle 165 flags 0x00 dlen 21              #178 [hci1] 13.411752
      SMP: Pairing Confirm (0x03) len 16
        Confim value: c7e77a923430951913bca3494fb9d7d0
> HCI Event: Number of Completed Packets (0x13) plen 5    #179 [hci1] 13.585811
        Num handles: 1
        Handle: 165 Address: DF:A9:FF:F6:B1:1A (OUI DF-A9-FF)
        Count: 1
        #178: len 21 (0 Kb/s)
        Latency: 174 msec (76-174 msec ~168 msec)
> ACL Data RX: Handle 165 flags 0x02 dlen 21              #180 [hci1] 13.586239
      SMP: Pairing Random (0x04) len 16
        Random value: 1ab80c31e13e35f40000000000000000
< HCI Command: Host Number of Com.. (0x03|0x0035) plen 5  #181 [hci1] 13.591745
        Num handles: 1
        Handle: 165 Address: DF:A9:FF:F6:B1:1A (OUI DF-A9-FF)
        Count: 1
< ACL Data TX: Handle 165 flags 0x00 dlen 21              #182 [hci1] 13.591831
      SMP: Pairing Random (0x04) len 16
        Random value: 25a9493fd3ce4faf02be7293595bb7c6
> HCI Event: Number of Completed Packets (0x13) plen 5    #183 [hci1] 13.760622
        Num handles: 1
        Handle: 165 Address: DF:A9:FF:F6:B1:1A (OUI DF-A9-FF)
        Count: 1
        #182: len 21 (1 Kb/s)
        Latency: 168 msec (76-174 msec ~168 msec)
> ACL Data RX: Handle 165 flags 0x02 dlen 21              #184 [hci1] 13.848587
      SMP: Pairing Confirm (0x03) len 16
        Confim value: 6df6fdee218e2038230121bbc287a8dd
< HCI Command: Host Number of Com.. (0x03|0x0035) plen 5  #185 [hci1] 13.851648
        Num handles: 1
        Handle: 165 Address: DF:A9:FF:F6:B1:1A (OUI DF-A9-FF)
        Count: 1
< ACL Data TX: Handle 165 flags 0x00 dlen 21              #186 [hci1] 13.851815
      SMP: Pairing Confirm (0x03) len 16
        Confim value: d1dcd92eeec7cc12ebef2fc4b43d4e88
> HCI Event: Number of Completed Packets (0x13) plen 5    #187 [hci1] 14.023372
        Num handles: 1
        Handle: 165 Address: DF:A9:FF:F6:B1:1A (OUI DF-A9-FF)
        Count: 1
        #186: len 21 (0 Kb/s)
        Latency: 171 msec (76-174 msec ~170 msec)
> ACL Data RX: Handle 165 flags 0x02 dlen 21              #188 [hci1] 14.023618
      SMP: Pairing Random (0x04) len 16
        Random value: 8666627074c5b09d0000000000000000
< HCI Command: Host Number of Com.. (0x03|0x0035) plen 5  #189 [hci1] 14.031828
        Num handles: 1
        Handle: 165 Address: DF:A9:FF:F6:B1:1A (OUI DF-A9-FF)
        Count: 1
< ACL Data TX: Handle 165 flags 0x00 dlen 21              #190 [hci1] 14.031936
      SMP: Pairing Random (0x04) len 16
        Random value: 58f6b41f855a6f6c3560debd84e2affc
> HCI Event: Number of Completed Packets (0x13) plen 5    #191 [hci1] 14.198276
        Num handles: 1
        Handle: 165 Address: DF:A9:FF:F6:B1:1A (OUI DF-A9-FF)
        Count: 1
        #190: len 21 (1 Kb/s)
        Latency: 166 msec (76-174 msec ~168 msec)
> ACL Data RX: Handle 165 flags 0x02 dlen 21              #192 [hci1] 14.286064
      SMP: Pairing Confirm (0x03) len 16
        Confim value: d72a440f294ceaa16cf7e900ec265b30
< HCI Command: Host Number of Com.. (0x03|0x0035) plen 5  #193 [hci1] 14.291367
        Num handles: 1
        Handle: 165 Address: DF:A9:FF:F6:B1:1A (OUI DF-A9-FF)
        Count: 1
< ACL Data TX: Handle 165 flags 0x00 dlen 21              #194 [hci1] 14.291451
      SMP: Pairing Confirm (0x03) len 16
        Confim value: c3ac5c873b4d17993d869b1ccce8a66b
> HCI Event: Number of Completed Packets (0x13) plen 5    #195 [hci1] 14.460827
        Num handles: 1
        Handle: 165 Address: DF:A9:FF:F6:B1:1A (OUI DF-A9-FF)
        Count: 1
        #194: len 21 (0 Kb/s)
        Latency: 169 msec (76-174 msec ~168 msec)
> ACL Data RX: Handle 165 flags 0x02 dlen 21              #196 [hci1] 14.461168
      SMP: Pairing Random (0x04) len 16
        Random value: 88682aad6985f7090000000000000000
< HCI Command: Host Number of Com.. (0x03|0x0035) plen 5  #197 [hci1] 14.471994
        Num handles: 1
        Handle: 165 Address: DF:A9:FF:F6:B1:1A (OUI DF-A9-FF)
        Count: 1
< ACL Data TX: Handle 165 flags 0x00 dlen 21              #198 [hci1] 14.472104
      SMP: Pairing Random (0x04) len 16
        Random value: b67e7216d5bf664139eda2b542549666
> HCI Event: Number of Completed Packets (0x13) plen 5    #199 [hci1] 14.635630
        Num handles: 1
        Handle: 165 Address: DF:A9:FF:F6:B1:1A (OUI DF-A9-FF)
        Count: 1
        #198: len 21 (1 Kb/s)
        Latency: 163 msec (76-174 msec ~166 msec)
> ACL Data RX: Handle 165 flags 0x02 dlen 21              #200 [hci1] 14.723426
      SMP: Pairing Confirm (0x03) len 16
        Confim value: d173cc7570141066b2919b97f469d96a
< HCI Command: Host Number of Com.. (0x03|0x0035) plen 5  #201 [hci1] 14.731312
        Num handles: 1
        Handle: 165 Address: DF:A9:FF:F6:B1:1A (OUI DF-A9-FF)
        Count: 1
< ACL Data TX: Handle 165 flags 0x00 dlen 21              #202 [hci1] 14.731422
      SMP: Pairing Confirm (0x03) len 16
        Confim value: c865e482c0b4108b17feb34af5439b28
> HCI Event: Number of Completed Packets (0x13) plen 5    #203 [hci1] 14.898453
        Num handles: 1
        Handle: 165 Address: DF:A9:FF:F6:B1:1A (OUI DF-A9-FF)
        Count: 1
        #202: len 21 (1 Kb/s)
        Latency: 167 msec (76-174 msec ~166 msec)
> ACL Data RX: Handle 165 flags 0x02 dlen 21              #204 [hci1] 14.898594
      SMP: Pairing Random (0x04) len 16
        Random value: aaeec40db7a0a6730000000000000000
< HCI Command: Host Number of Com.. (0x03|0x0035) plen 5  #205 [hci1] 14.911921
        Num handles: 1
        Handle: 165 Address: DF:A9:FF:F6:B1:1A (OUI DF-A9-FF)
        Count: 1
< ACL Data TX: Handle 165 flags 0x00 dlen 21              #206 [hci1] 14.912007
      SMP: Pairing Random (0x04) len 16
        Random value: ed17f76500c95219dd01e09d1e63f87b
> HCI Event: Number of Completed Packets (0x13) plen 5    #207 [hci1] 15.073096
        Num handles: 1
        Handle: 165 Address: DF:A9:FF:F6:B1:1A (OUI DF-A9-FF)
        Count: 1
        #206: len 21 (1 Kb/s)
        Latency: 161 msec (76-174 msec ~163 msec)
> ACL Data RX: Handle 165 flags 0x02 dlen 21              #208 [hci1] 15.161049
      SMP: Pairing Confirm (0x03) len 16
        Confim value: 09d13aca2ae802aaf56fe182ec382bfa
< HCI Command: Host Number of Com.. (0x03|0x0035) plen 5  #209 [hci1] 15.171622
        Num handles: 1
        Handle: 165 Address: DF:A9:FF:F6:B1:1A (OUI DF-A9-FF)
        Count: 1
< ACL Data TX: Handle 165 flags 0x00 dlen 21              #210 [hci1] 15.171851
      SMP: Pairing Confirm (0x03) len 16
        Confim value: 769f0c1da04aa80e78915f46f42ac645
> HCI Event: Number of Completed Packets (0x13) plen 5    #211 [hci1] 15.335718
        Num handles: 1
        Handle: 165 Address: DF:A9:FF:F6:B1:1A (OUI DF-A9-FF)
        Count: 1
        #210: len 21 (1 Kb/s)
        Latency: 163 msec (76-174 msec ~163 msec)
> ACL Data RX: Handle 165 flags 0x02 dlen 21              #212 [hci1] 15.336098
      SMP: Pairing Random (0x04) len 16
        Random value: 992a66e2658c0a510000000000000000
< HCI Command: Host Number of Com.. (0x03|0x0035) plen 5  #213 [hci1] 15.351320
        Num handles: 1
        Handle: 165 Address: DF:A9:FF:F6:B1:1A (OUI DF-A9-FF)
        Count: 1
< ACL Data TX: Handle 165 flags 0x00 dlen 21              #214 [hci1] 15.351365
      SMP: Pairing Random (0x04) len 16
        Random value: 81d35d47e1f6006d79c974bd9d9e1ee3
> HCI Event: Number of Completed Packets (0x13) plen 5    #215 [hci1] 15.510631
        Num handles: 1
        Handle: 165 Address: DF:A9:FF:F6:B1:1A (OUI DF-A9-FF)
        Count: 1
        #214: len 21 (1 Kb/s)
        Latency: 159 msec (76-174 msec ~161 msec)
> ACL Data RX: Handle 165 flags 0x02 dlen 21              #216 [hci1] 15.598503
      SMP: Pairing Confirm (0x03) len 16
        Confim value: bd403a178a26460b4c20ce34c1ea44fc
< HCI Command: Host Number of Com.. (0x03|0x0035) plen 5  #217 [hci1] 15.611709
        Num handles: 1
        Handle: 165 Address: DF:A9:FF:F6:B1:1A (OUI DF-A9-FF)
        Count: 1
< ACL Data TX: Handle 165 flags 0x00 dlen 21              #218 [hci1] 15.611917
      SMP: Pairing Confirm (0x03) len 16
        Confim value: d6d3555540483e8395cf63fdda85b72f
> HCI Event: Number of Completed Packets (0x13) plen 5    #219 [hci1] 15.773275
        Num handles: 1
        Handle: 165 Address: DF:A9:FF:F6:B1:1A (OUI DF-A9-FF)
        Count: 1
        #218: len 21 (1 Kb/s)
        Latency: 161 msec (76-174 msec ~161 msec)
> ACL Data RX: Handle 165 flags 0x02 dlen 21              #220 [hci1] 15.773660
      SMP: Pairing Random (0x04) len 16
        Random value: f0e5be440b78ffbe0000000000000000
< HCI Command: Host Number of Com.. (0x03|0x0035) plen 5  #221 [hci1] 15.791417
        Num handles: 1
        Handle: 165 Address: DF:A9:FF:F6:B1:1A (OUI DF-A9-FF)
        Count: 1
< ACL Data TX: Handle 165 flags 0x00 dlen 21              #222 [hci1] 15.791501
      SMP: Pairing Random (0x04) len 16
        Random value: e7f7e0c2476823e41736a7e381bafb7c
> HCI Event: Number of Completed Packets (0x13) plen 5    #223 [hci1] 15.948034
        Num handles: 1
        Handle: 165 Address: DF:A9:FF:F6:B1:1A (OUI DF-A9-FF)
        Count: 1
        #222: len 21 (1 Kb/s)
        Latency: 156 msec (76-174 msec ~158 msec)
> ACL Data RX: Handle 165 flags 0x02 dlen 21              #224 [hci1] 16.035973
      SMP: Pairing Confirm (0x03) len 16
        Confim value: e0e53202c895a6c4a734e683bab7d944
< HCI Command: Host Number of Com.. (0x03|0x0035) plen 5  #225 [hci1] 16.051712
        Num handles: 1
        Handle: 165 Address: DF:A9:FF:F6:B1:1A (OUI DF-A9-FF)
        Count: 1
< ACL Data TX: Handle 165 flags 0x00 dlen 21              #226 [hci1] 16.051932
      SMP: Pairing Confirm (0x03) len 16
        Confim value: 57aa51b8d579275ac85431ed40a2dc69
> HCI Event: Number of Completed Packets (0x13) plen 5    #227 [hci1] 16.210771
        Num handles: 1
        Handle: 165 Address: DF:A9:FF:F6:B1:1A (OUI DF-A9-FF)
        Count: 1
        #226: len 21 (1 Kb/s)
        Latency: 158 msec (76-174 msec ~158 msec)
> ACL Data RX: Handle 165 flags 0x02 dlen 21              #228 [hci1] 16.211072
      SMP: Pairing Random (0x04) len 16
        Random value: 9c74f8092725013f0000000000000000
< HCI Command: Host Number of Com.. (0x03|0x0035) plen 5  #229 [hci1] 16.211895
        Num handles: 1
        Handle: 165 Address: DF:A9:FF:F6:B1:1A (OUI DF-A9-FF)
        Count: 1
