Bluetooth monitor ver 5.72
= Note: Linux version 6.14.0-36-generic (x86_64)                       0.026699
= Note: Bluetooth subsystem version 2.22                               0.026702
= New Index: 00:00:00:00:00:00 (Primary,UART,hci1)              [hci1] 0.026703
= New Index: 48:5F:99:8E:E0:64 (Primary,USB,hci0)               [hci0] 0.026703
= Open Index: 00:00:00:00:00:00                                 [hci1] 0.142140
= Index Info: 00:00:00:00:00:00 (Nordic Semiconductor ASA)      [hci1] 0.142162
@ USER Open: main (privileged) version 2.22            {0x0001} [hci1] 0.142173
< HCI Command: Reset (0x03|0x0003) plen 0                    #1 [hci1] 0.142998
> HCI Event: Command Complete (0x0e) plen 4                  #2 [hci1] 0.143473
      Reset (0x03|0x0003) ncmd 1
        Status: Success (0x00)
< HCI Command: Read Local Supported... (0x04|0x0003) plen 0  #3 [hci1] 0.161462
> HCI Event: Command Complete (0x0e) plen 12                 #4 [hci1] 0.162010
      Read Local Supported Features (0x04|0x0003) ncmd 1
        Status: Success (0x00)
        Features: 0x00 0x00 0x00 0x00 0x60 0x00 0x00 0x00
          BR/EDR Not Supported
          LE Supported (Controller)
< HCI Command: Read Local Version In.. (0x04|0x0001) plen 0  #5 [hci1] 0.181334
> HCI Event: Command Complete (0x0e) plen 12                 #6 [hci1] 0.181866
      Read Local Version Information (0x04|0x0001) ncmd 1
        Status: Success (0x00)
        HCI version: Reserved (0x0f) - Revision 12393 (0x3069)
        LMP version: Reserved (0x0f) - Subversion 12393 (0x3069)
        Manufacturer: Nordic Semiconductor ASA (89)
< HCI Command: Read Local Supported... (0x04|0x0002) plen 0  #7 [hci1] 0.201494
> HCI Event: Command Complete (0x0e) plen 68                 #8 [hci1] 0.202603
      Read Local Supported Commands (0x04|0x0002) ncmd 1
        Status: Success (0x00)
        Commands: 119 entries
          Disconnect (Octet 0 - Bit 5)
          Read Remote Version Information (Octet 2 - Bit 7)
          Set Event Mask (Octet 5 - Bit 6)
          Reset (Octet 5 - Bit 7)
          Read Connection Accept Timeout (Octet 7 - Bit 2)
          Write Connection Accept Timeout (Octet 7 - Bit 3)
          Read Transmit Power Level (Octet 10 - Bit 2)
          Set Controller To Host Flow Control (Octet 10 - Bit 5)
          Host Buffer Size (Octet 10 - Bit 6)
          Host Number of Completed Packets (Octet 10 - Bit 7)
          Read Local Version Information (Octet 14 - Bit 3)
          Read Local Supported Features (Octet 14 - Bit 5)
          Read BD ADDR (Octet 15 - Bit 1)
          Read RSSI (Octet 15 - Bit 5)
          Set Event Mask Page 2 (Octet 22 - Bit 2)
          LE Set Event Mask (Octet 25 - Bit 0)
          LE Read Buffer Size (Octet 25 - Bit 1)
          LE Read Local Supported Features (Octet 25 - Bit 2)
          LE Set Random Address (Octet 25 - Bit 4)
          LE Set Advertising Parameters (Octet 25 - Bit 5)
          LE Read Advertising Channel TX Power (Octet 25 - Bit 6)
          LE Set Advertising Data (Octet 25 - Bit 7)
          LE Set Scan Response Data (Octet 26 - Bit 0)
          LE Set Advertise Enable (Octet 26 - Bit 1)
          LE Set Scan Parameters (Octet 26 - Bit 2)
          LE Set Scan Enable (Octet 26 - Bit 3)
          LE Create Connection (Octet 26 - Bit 4)
          LE Create Connection Cancel (Octet 26 - Bit 5)
          LE Read Accept List Size (Octet 26 - Bit 6)
          LE Clear Accept List (Octet 26 - Bit 7)
          LE Add Device To Accept List (Octet 27 - Bit 0)
          LE Remove Device From Accept List (Octet 27 - Bit 1)
          LE Connection Update (Octet 27 - Bit 2)
          LE Set Host Channel Classification (Octet 27 - Bit 3)
          LE Read Channel Map (Octet 27 - Bit 4)
          LE Read Remote Used Features (Octet 27 - Bit 5)
          LE Encrypt (Octet 27 - Bit 6)
          LE Rand (Octet 27 - Bit 7)
          LE Start Encryption (Octet 28 - Bit 0)
          LE Long Term Key Request Reply (Octet 28 - Bit 1)
          LE Long Term Key Request Neg Reply (Octet 28 - Bit 2)
          LE Read Supported States (Octet 28 - Bit 3)
          LE Receiver Test (Octet 28 - Bit 4)
          LE Transmitter Test (Octet 28 - Bit 5)
          LE Test End (Octet 28 - Bit 6)
          Read Authenticated Payload Timeout (Octet 32 - Bit 4)
          Write Authenticated Payload Timeout (Octet 32 - Bit 5)
          LE Set Data Length (Octet 33 - Bit 6)
          LE Read Suggested Default Data Length (Octet 33 - Bit 7)
          LE Write Suggested Default Data Length (Octet 34 - Bit 0)
          LE Add Device To Resolving List (Octet 34 - Bit 3)
          LE Remove Device From Resolving List (Octet 34 - Bit 4)
          LE Clear Resolving List (Octet 34 - Bit 5)
          LE Read Resolving List Size (Octet 34 - Bit 6)
          LE Set Address Resolution Enable (Octet 35 - Bit 1)
          LE Set Resolvable Private Address Timeout (Octet 35 - Bit 2)
          LE Read Maximum Data Length (Octet 35 - Bit 3)
          LE Read PHY (Octet 35 - Bit 4)
          LE Set Default PHY (Octet 35 - Bit 5)
          LE Set PHY (Octet 35 - Bit 6)
          LE Enhanced Receiver Test (Octet 35 - Bit 7)
          LE Enhanced Transmitter Test (Octet 36 - Bit 0)
          LE Set Advertising Set Random Address (Octet 36 - Bit 1)
          LE Set Extended Advertising Parameters (Octet 36 - Bit 2)
          LE Set Extended Advertising Data (Octet 36 - Bit 3)
          LE Set Extended Scan Response Data (Octet 36 - Bit 4)
          LE Set Extended Advertising Enable (Octet 36 - Bit 5)
          LE Read Maximum Advertising Data Length (Octet 36 - Bit 6)
          LE Read Number of Supported Advertising Sets (Octet 36 - Bit 7)
          LE Remove Advertising Set (Octet 37 - Bit 0)
          LE Clear Advertising Sets (Octet 37 - Bit 1)
          LE Set Periodic Advertising Parameters (Octet 37 - Bit 2)
          LE Set Periodic Advertising Data (Octet 37 - Bit 3)
          LE Set Periodic Advertising Enable (Octet 37 - Bit 4)
          LE Set Extended Scan Parameters (Octet 37 - Bit 5)
          LE Set Extended Scan Enable (Octet 37 - Bit 6)
          LE Extended Create Connection (Octet 37 - Bit 7)
          LE Periodic Advertising Create Sync (Octet 38 - Bit 0)
          LE Periodic Advertising Create Sync Cancel (Octet 38 - Bit 1)
          LE Periodic Advertising Terminate Sync (Octet 38 - Bit 2)
          LE Add Device To Periodic Advertiser List (Octet 38 - Bit 3)
          LE Remove Device From Periodic Advertiser List (Octet 38 - Bit 4)
          LE Clear Periodic Advertiser List (Octet 38 - Bit 5)
          LE Read Periodic Advertiser List Size (Octet 38 - Bit 6)
          LE Read Transmit Power (Octet 38 - Bit 7)
          LE Read RF Path Compensation (Octet 39 - Bit 0)
          LE Write RF Path Compensation (Octet 39 - Bit 1)
          LE Set Privacy Mode (Octet 39 - Bit 2)
          LE Periodic Advertising Receive Enable (Octet 40 - Bit 5)
          LE Periodic Advertising Sync Transfer (Octet 40 - Bit 6)
          LE Periodic Advertising Set Info Transfer (Octet 40 - Bit 7)
          LE Periodic Advertising Sync Transfer Parameters (Octet 41 - Bit 0)
          LE Set Default Periodic Advertisng Sync Transfer Parameters (Octet 41 - Bit 1)
          LE Read Buffer v2 (Octet 41 - Bit 5)
          LE Read ISO TX Sync (Octet 41 - Bit 6)
          LE Set Connected Isochronous Group Parameters (Octet 41 - Bit 7)
          LE Set Connected Isochronous Group Parameters Test (Octet 42 - Bit 0)
          LE Create Connected Isochronous Stream (Octet 42 - Bit 1)
          LE Remove Connected Isochronous Group (Octet 42 - Bit 2)
          LE Accept Connected Isochronous Stream Request (Octet 42 - Bit 3)
          LE Reject Connected Isochronous Stream Request (Octet 42 - Bit 4)
          LE Create Broadcast Isochronous Group (Octet 42 - Bit 5)
          LE Create Broadcast Isochronous Group Test (Octet 42 - Bit 6)
          LE Terminate Broadcast Isochronous Group (Octet 42 - Bit 7)
          LE Broadcast Isochronous Group Create Sync (Octet 43 - Bit 0)
          LE Broadcast Isochronous Group Terminate Sync (Octet 43 - Bit 1)
          LE Request Peer SCA (Octet 43 - Bit 2)
          LE Setup Isochronous Data Path (Octet 43 - Bit 3)
          LE Remove Isochronous Data Path (Octet 43 - Bit 4)
          LE Isochronous Transmit Test (Octet 43 - Bit 5)
          LE Isochronous Receive Test (Octet 43 - Bit 6)
          LE Isochronous Read Test Counters (Octet 43 - Bit 7)
          LE Isochronous Read Test Counters (Octet 44 - Bit 0)
          LE Set Host Feature (Octet 44 - Bit 1)
          Octet 44 - Bit 2 
          Octet 45 - Bit 6 
          Octet 46 - Bit 0 
          Octet 46 - Bit 1 
          Octet 46 - Bit 2 
< HCI Command: Host Buffer Size (0x03|0x0033) plen 7         #9 [hci1] 0.221364
        ACL MTU: 255  ACL max packet: 16
        SCO MTU: 0    SCO max packet: 0
> HCI Event: Command Complete (0x0e) plen 4                 #10 [hci1] 0.221870
      Host Buffer Size (0x03|0x0033) ncmd 1
        Status: Success (0x00)
< HCI Command: Set Controller To Ho.. (0x03|0x0031) plen 1  #11 [hci1] 0.241411
        Flow control: ACL Data Packets (0x01)
> HCI Event: Command Complete (0x0e) plen 4                 #12 [hci1] 0.241827
      Set Controller To Host Flow Control (0x03|0x0031) ncmd 1
        Status: Success (0x00)
< HCI Command: LE Read Local Suppor.. (0x08|0x0003) plen 0  #13 [hci1] 0.261448
> HCI Event: Command Complete (0x0e) plen 12                #14 [hci1] 0.262015
      LE Read Local Supported Features (0x08|0x0003) ncmd 1
        Status: Success (0x00)
        Features: 0xfd 0x79 0x00 0xf7 0x30 0x01 0x00 0x00
          LE Encryption
          Extended Reject Indication
          Peripheral-initiated Features Exchange
          LE Ping
          LE Data Packet Length Extension
          LL Privacy
          Extended Scanner Filter Policies
          LE 2M PHY
          LE Coded PHY
          LE Extended Advertising
          LE Periodic Advertising
          Channel Selection Algorithm #2
          Periodic Advertising Sync Transfer - Sender
          Periodic Advertising Sync Transfer - Recipient
          Sleep Clock Accuracy Updates
          Connected Isochronous Stream - Central
          Connected Isochronous Stream - Peripheral
          Isochronous Broadcaster
          Synchronized Receiver
          Periodic Advertising ADI support
          Connection Subrating
          Unknown features (0x0000010000000000)
< HCI Command: LE Set Host Feature (0x08|0x0074) plen 2     #15 [hci1] 0.281462
        Bit Number: 32
          Connected Isochronous Stream (Host Support)
        Bit Value: 1
> HCI Event: Command Complete (0x0e) plen 4                 #16 [hci1] 0.281875
      LE Set Host Feature (0x08|0x0074) ncmd 1
        Status: Success (0x00)
< HCI Command: LE Read Buffer v2 (0x08|0x0060) plen 0       #17 [hci1] 0.301449
> HCI Event: Command Complete (0x0e) plen 10                #18 [hci1] 0.301895
      LE Read Buffer v2 (0x08|0x0060) ncmd 1
        Status: Success (0x00)
        ACL MTU: 27
        ACL max packet: 3
        ISO MTU: 318
        ISO max packet: 3
< HCI Command: LE Read Maximum Adve.. (0x08|0x003a) plen 0  #19 [hci1] 0.321441
> HCI Event: Command Complete (0x0e) plen 6                 #20 [hci1] 0.321861
      LE Read Maximum Advertising Data Length (0x08|0x003a) ncmd 1
        Status: Success (0x00)
        Max length: 1650
< HCI Command: LE Read Supported St.. (0x08|0x001c) plen 0  #21 [hci1] 0.341461
> HCI Event: Command Complete (0x0e) plen 12                #22 [hci1] 0.341953
      LE Read Supported States (0x08|0x001c) ncmd 1
        Status: Success (0x00)
        States: 0x000003ff3e0306ff
          Non-connectable Advertising State
          Scannable Advertising State
          Connectable Advertising State
          High Duty Cycle Directed Advertising State
          Passive Scanning State
          Active Scanning State
          Initiating State
            and Connection State (Central Role)
          Connection State (Peripheral Role)
          Scannable Advertising State
            and Passive Scanning State
          Connectable Advertising State
            and Passive Scanning State
          Non-connectable Advertising State
            and Initiating State
          Scannable Advertising State
            and Initiating State
          Active Scanning State
            and Connection State (Central Role)
          Passive Scanning State
            and Connection State (Peripheral Role)
          Active Scanning State
            and Connection State (Peripheral Role)
          Initiating State
            and Connection State (Central Role)
            and Central Role & Central Role
          Low Duty Cycle Directed Advertising State
          Connectable Advertising State
            and Initiating State
            and Central Role & Peripheral Role
          High Duty Cycle Directed Advertising State
            and Initiating State
            and Central Role & Peripheral Role
          Low Duty Cycle Directed Advertising State
            and Initiating State
            and Central Role & Peripheral Role
          Connectable Advertising State
            and Connection State (Central Role)
            and Central Role & Peripheral Role
          High Duty Cycle Directed Advertising State
            and Connection State (Central Role)
            and Central Role & Peripheral Role
          Low Duty Cycle Directed Advertising State
            and Connection State (Central Role)
            and Central Role & Peripheral Role
          Connectable Advertising State
            and Connection State (Peripheral Role)
            and Central Role & Peripheral Role
          High Duty Cycle Directed Advertising State
            and Connection State (Peripheral Role)
            and Peripheral Role & Peripheral Role
          Low Duty Cycle Directed Advertising State
            and Connection State (Peripheral Role)
            and Peripheral Role & Peripheral Role
          Initiating State
            and Connection State (Peripheral Role)
            and Central Role & Peripheral Role
< HCI Command: LE Read Maximum Data.. (0x08|0x002f) plen 0  #23 [hci1] 0.361486
> HCI Event: Command Complete (0x0e) plen 12                #24 [hci1] 0.361969
      LE Read Maximum Data Length (0x08|0x002f) ncmd 1
        Status: Success (0x00)
        Max TX octets: 251
        Max TX time: 2704
        Max RX octets: 251
        Max RX time: 2704
< HCI Command: LE Write Suggested D.. (0x08|0x0024) plen 4  #25 [hci1] 0.381487
        TX octets: 251
        TX time: 2704
> HCI Event: Command Complete (0x0e) plen 4                 #26 [hci1] 0.381904
      LE Write Suggested Default Data Length (0x08|0x0024) ncmd 1
        Status: Success (0x00)
< HCI Command: LE Read Resolving Li.. (0x08|0x002a) plen 0  #27 [hci1] 0.401463
> HCI Event: Command Complete (0x0e) plen 5                 #28 [hci1] 0.401873
      LE Read Resolving List Size (0x08|0x002a) ncmd 1
        Status: Success (0x00)
        Size: 8
< HCI Command: LE Set Event Mask (0x08|0x0001) plen 8       #29 [hci1] 0.421454
        Mask: 0x000002023f87fa5e
          LE Advertising Report
          LE Connection Update Complete
          LE Read Remote Used Features Complete
          LE Long Term Key Request
          LE Data Length Change
          LE Enhanced Connection Complete
          LE PHY Update Complete
          LE Extended Advertising Report
          LE Periodic Advertising Sync Established
          LE Periodic Advertising Report
          LE Periodic Advertising Sync Lost
          LE Extended Scan Timeout
          LE Extended Advertising Set Terminated
          LE Scan Request Received
          LE Periodic Advertising Sync Transfer Rvc
          LE CIS Established
          LE CIS Request
          LE Create BIG Complete
          LE Terminate BIG Complete
          LE BIG Sync Estabilished Complete
          LE BIG Sync Lost
          LE BIG Info Advertising Report
          Unknown mask (0x0000020000000000)
> HCI Event: Command Complete (0x0e) plen 4                 #30 [hci1] 0.421915
      LE Set Event Mask (0x08|0x0001) ncmd 1
        Status: Success (0x00)
< HCI Command: Set Event Mask (0x03|0x0001) plen 8          #31 [hci1] 0.441462
        Mask: 0x2000800002008890
          Disconnection Complete
          Encryption Change
          Read Remote Version Information Complete
          Hardware Error
          Data Buffer Overflow
          Encryption Key Refresh Complete
          LE Meta
> HCI Event: Command Complete (0x0e) plen 4                 #32 [hci1] 0.441974
      Set Event Mask (0x03|0x0001) ncmd 1
        Status: Success (0x00)
< HCI Command: Read BD ADDR (0x04|0x0009) plen 0            #33 [hci1] 0.461479
> HCI Event: Command Complete (0x0e) plen 10                #34 [hci1] 0.462020
      Read BD ADDR (0x04|0x0009) ncmd 1
        Status: Success (0x00)
        Address: 00:00:00:00:00:00 (OUI 00-00-00)
< HCI Command: LE Set Random Address (0x08|0x0005) plen 6   #35 [hci1] 0.481512
        Address: D5:B6:CC:31:DB:3B (Static)
> HCI Event: Command Complete (0x0e) plen 4                 #36 [hci1] 0.482051
      LE Set Random Address (0x08|0x0005) ncmd 1
        Status: Success (0x00)
< HCI Command: LE Set Extended Adv.. (0x08|0x0036) plen 25  #37 [hci1] 3.191545
        Handle: 0x00
        Properties: 0x0001
          Connectable
        Min advertising interval: 100.000 msec (0x00a0)
        Max advertising interval: 150.000 msec (0x00f0)
        Channel map: 37, 38, 39 (0x07)
        Own address type: Random (0x01)
        Peer address type: Public (0x00)
        Peer address: 00:00:00:00:00:00 (OUI 00-00-00)
        Filter policy: Allow Scan Request from Any, Allow Connect Request from Any (0x00)
        TX power: Host has no preference (0x7f)
        Primary PHY: LE 1M (0x01)
        Secondary max skip: 0x00
        Secondary PHY: LE 2M (0x02)
        SID: 0x00
        Scan request notifications: Disabled (0x00)
> HCI Event: Command Complete (0x0e) plen 5                 #38 [hci1] 3.192394
      LE Set Extended Advertising Parameters (0x08|0x0036) ncmd 1
        Status: Success (0x00)
        TX power (selected): 0 dbm (0x00)
< HCI Command: LE Set Advertising S.. (0x08|0x0035) plen 7  #39 [hci1] 3.201529
        Advertising handle: 0x00
        Advertising random address: D5:B6:CC:31:DB:3B (Static)
> HCI Event: Command Complete (0x0e) plen 4                 #40 [hci1] 3.202003
      LE Set Advertising Set Random Address (0x08|0x0035) ncmd 1
        Status: Success (0x00)
< HCI Command: LE Set Extended Adv.. (0x08|0x0037) plen 39  #41 [hci1] 3.221560
        Handle: 0x00
        Operation: Complete extended advertising data (0x03)
        Fragment preference: Minimize fragmentation (0x01)
        Data length: 0x23
        Flags: 0x06
          LE General Discoverable Mode
          BR/EDR Not Supported
        Name (complete): Tester_F6B11A
        Flags: 0x06
          LE General Discoverable Mode
          BR/EDR Not Supported
        16-bit Service UUIDs (complete): 1 entry
          Audio Stream Control (0x184e)
        Service Data: Audio Stream Control (0x184e)
          Data: 01ff0fff0f00
> HCI Event: Command Complete (0x0e) plen 4                 #42 [hci1] 3.222584
      LE Set Extended Advertising Data (0x08|0x0037) ncmd 1
        Status: Success (0x00)
< HCI Command: LE Set Extended Adve.. (0x08|0x0039) plen 6  #43 [hci1] 3.241519
        Extended advertising: Enabled (0x01)
        Number of sets: 1 (0x01)
        Entry 0
          Handle: 0x00
          Duration: 0 ms (0x00)
          Max ext adv events: 0
> HCI Event: Command Complete (0x0e) plen 4                 #44 [hci1] 3.242184
      LE Set Extended Advertising Enable (0x08|0x0039) ncmd 1
        Status: Success (0x00)
> HCI Event: LE Meta Event (0x3e) plen 31                   #45 [hci1] 3.353484
      LE Enhanced Connection Complete (0x0a)
        Status: Success (0x00)
        Handle: 1425
        Role: Peripheral (0x01)
        Peer address type: Public (0x00)
        Peer address: DF:A9:FF:F6:B1:1A (OUI DF-A9-FF)
        Local resolvable private address: 00:00:00:00:00:00 (Non-Resolvable)
        Peer resolvable private address: 00:00:00:00:00:00 (Non-Resolvable)
        Connection interval: 87.50 msec (0x0046)
        Connection latency: 0 (0x0000)
        Supervision timeout: 25120 msec (0x09d0)
        Central clock accuracy: 0x01
> HCI Event: LE Meta Event (0x3e) plen 6                    #46 [hci1] 3.353487
      LE Advertising Set Terminated (0x12)
        Status: Success (0x00)
        Handle: 0
        Connection handle: 1425
        Number of completed extended advertising events: 0
< HCI Command: LE Read Remote Used... (0x08|0x0016) plen 2  #47 [hci1] 3.361932
        Handle: 1425 Address: DF:A9:FF:F6:B1:1A (OUI DF-A9-FF)
< ACL Data TX: Handle 1425 flags 0x00 dlen 7                #48 [hci1] 3.361941
      ATT: Exchange MTU Request (0x02) len 2
        Client RX MTU: 251
> HCI Event: Command Status (0x0f) plen 4                   #49 [hci1] 3.362523
      LE Read Remote Used Features (0x08|0x0016) ncmd 1
        Status: Success (0x00)
> HCI Event: Number of Completed Packets (0x13) plen 5      #50 [hci1] 3.530469
        Num handles: 1
        Handle: 1425 Address: DF:A9:FF:F6:B1:1A (OUI DF-A9-FF)
        Count: 1
        #48: len 7 (0 Kb/s)
        Latency: 168 msec (168-168 msec ~168 msec)
> HCI Event: LE Meta Event (0x3e) plen 12                   #51 [hci1] 3.618321
      LE Read Remote Used Features (0x04)
        Status: Success (0x00)
        Handle: 1425 Address: DF:A9:FF:F6:B1:1A (OUI DF-A9-FF)
        Features: 0x2d 0x49 0x00 0xf7 0x67 0xd9 0x00 0x80
          LE Encryption
          Extended Reject Indication
          Peripheral-initiated Features Exchange
          LE Data Packet Length Extension
          LE 2M PHY
          LE Coded PHY
          Channel Selection Algorithm #2
          Periodic Advertising Sync Transfer - Sender
          Periodic Advertising Sync Transfer - Recipient
          Sleep Clock Accuracy Updates
          Connected Isochronous Stream - Central
          Connected Isochronous Stream - Peripheral
          Isochronous Broadcaster
          Synchronized Receiver
          Connected Isochronous Stream (Host Support)
          LE Power Control Request
          LE Power Control Request
          Connection Subrating
          Connection Subrating (Host Support)
          Unknown features (0x8000d90000000000)
> ACL Data RX: Handle 1425 flags 0x02 dlen 7                #52 [hci1] 4.055578
      ATT: Exchange MTU Request (0x02) len 2
        Client RX MTU: 64
> ACL Data RX: Handle 1425 flags 0x02 dlen 7                #53 [hci1] 4.055968
      ATT: Exchange MTU Response (0x03) len 2
        Server RX MTU: 64
< HCI Command: Host Number of Compl.. (0x03|0x0035) plen 5  #54 [hci1] 4.062022
        Num handles: 1
        Handle: 1425 Address: DF:A9:FF:F6:B1:1A (OUI DF-A9-FF)
        Count: 1
< ACL Data TX: Handle 1425 flags 0x00 dlen 7                #55 [hci1] 4.062183
      ATT: Exchange MTU Response (0x03) len 2
        Server RX MTU: 251
< HCI Command: Host Number of Compl.. (0x03|0x0035) plen 5  #56 [hci1] 4.062526
        Num handles: 1
        Handle: 1425 Address: DF:A9:FF:F6:B1:1A (OUI DF-A9-FF)
        Count: 1
> HCI Event: Number of Completed Packets (0x13) plen 5      #57 [hci1] 4.230411
        Num handles: 1
        Handle: 1425 Address: DF:A9:FF:F6:B1:1A (OUI DF-A9-FF)
        Count: 1
        #55: len 7 (0 Kb/s)
        Latency: 168 msec (168-168 msec ~168 msec)
> ACL Data RX: Handle 1425 flags 0x02 dlen 11               #58 [hci1] 6.155550
      SMP: Pairing Request (0x01) len 6
        IO capability: KeyboardDisplay (0x04)
        OOB data: Authentication data not present (0x00)
        Authentication requirement: Bonding, No MITM, SC, No Keypresses (0x09)
        Max encryption key size: 16
        Initiator key distribution: EncKey IdKey (0x03)
        Responder key distribution: EncKey IdKey Sign (0x07)
< HCI Command: Host Number of Compl.. (0x03|0x0035) plen 5  #59 [hci1] 6.161648
        Num handles: 1
        Handle: 1425 Address: DF:A9:FF:F6:B1:1A (OUI DF-A9-FF)
        Count: 1
< ACL Data TX: Handle 1425 flags 0x00 dlen 11               #60 [hci1] 6.161718
      SMP: Pairing Response (0x02) len 6
        IO capability: NoInputNoOutput (0x03)
        OOB data: Authentication data not present (0x00)
        Authentication requirement: Bonding, No MITM, SC, No Keypresses (0x09)
        Max encryption key size: 16
        Initiator key distribution: IdKey (0x02)
        Responder key distribution: <none> (0x00)
> HCI Event: Number of Completed Packets (0x13) plen 5      #61 [hci1] 6.330574
        Num handles: 1
        Handle: 1425 Address: DF:A9:FF:F6:B1:1A (OUI DF-A9-FF)
        Count: 1
        #60: len 11 (0 Kb/s)
        Latency: 168 msec (168-168 msec ~168 msec)
> ACL Data RX: Handle 1425 flags 0x02 dlen 27               #62 [hci1] 6.330878
> ACL Data RX: Handle 1425 flags 0x01 dlen 27               #63 [hci1] 6.331207
> ACL Data RX: Handle 1425 flags 0x01 dlen 15               #64 [hci1] 6.331529
      SMP: Pairing Public Key (0x0c) len 64
        X: 6c6a50d5d86b6321ef1a252db69eafa7abd97358ec79d85cad35c2153035c925
        Y: d1c0dd21a21dcec32a6c18b449573eee7f4c37a8c13e932cd7c3aaae0bfad2eb
< HCI Command: Host Number of Compl.. (0x03|0x0035) plen 5  #65 [hci1] 6.342425
        Num handles: 1
        Handle: 1425 Address: DF:A9:FF:F6:B1:1A (OUI DF-A9-FF)
        Count: 1
< HCI Command: Host Number of Compl.. (0x03|0x0035) plen 5  #66 [hci1] 6.342709
        Num handles: 1
        Handle: 1425 Address: DF:A9:FF:F6:B1:1A (OUI DF-A9-FF)
        Count: 1
< HCI Command: Host Number of Compl.. (0x03|0x0035) plen 5  #67 [hci1] 6.343087
        Num handles: 1
        Handle: 1425 Address: DF:A9:FF:F6:B1:1A (OUI DF-A9-FF)
        Count: 1
< ACL Data TX: Handle 1425 flags 0x00 dlen 27               #68 [hci1] 6.343194
< ACL Data TX: Handle 1425 flags 0x01 dlen 27               #69 [hci1] 6.343213
< ACL Data TX: Handle 1425 flags 0x01 dlen 15               #70 [hci1] 6.343251
      SMP: Pairing Public Key (0x0c) len 64
        X: 98308440221e2d910f0e54b71e7ec652857aa9b5a0dc65028824cc19db1226e9
        Y: 67a4816bcb62efb21701e31fdb27561a6217575fb007a8bbdabe7e28b6f68482
> HCI Event: Number of Completed Packets (0x13) plen 5      #71 [hci1] 6.418477
        Num handles: 1
        Handle: 1425 Address: DF:A9:FF:F6:B1:1A (OUI DF-A9-FF)
        Count: 1
        #68: len 27 (2 Kb/s)
        Latency: 75 msec (75-168 msec ~121 msec)
> HCI Event: Number of Completed Packets (0x13) plen 5      #72 [hci1] 6.418823
        Num handles: 1
        Handle: 1425 Address: DF:A9:FF:F6:B1:1A (OUI DF-A9-FF)
        Count: 1
        #69: len 27 (2 Kb/s)
        Latency: 75 msec (75-168 msec ~98 msec)
< ACL Data TX: Handle 1425 flags 0x00 dlen 21               #73 [hci1] 6.421672
      SMP: Pairing Confirm (0x03) len 16
        Confim value: ac2d93a350ce8000066d7b4a6dddfdb2
> HCI Event: Number of Completed Packets (0x13) plen 5      #74 [hci1] 6.505364
        Num handles: 1
        Handle: 1425 Address: DF:A9:FF:F6:B1:1A (OUI DF-A9-FF)
        Count: 1
        #70: len 15 (0 Kb/s)
        Latency: 162 msec (75-168 msec ~130 msec)
> HCI Event: Number of Completed Packets (0x13) plen 5      #75 [hci1] 6.592992
        Num handles: 1
        Handle: 1425 Address: DF:A9:FF:F6:B1:1A (OUI DF-A9-FF)
        Count: 1
        #73: len 21 (0 Kb/s)
        Latency: 171 msec (75-171 msec ~150 msec)
> ACL Data RX: Handle 1425 flags 0x02 dlen 21               #76 [hci1] 6.593336
      SMP: Pairing Random (0x04) len 16
        Random value: 56d6f7346273f44c0000000000000000
< HCI Command: Host Number of Compl.. (0x03|0x0035) plen 5  #77 [hci1] 6.602356
        Num handles: 1
        Handle: 1425 Address: DF:A9:FF:F6:B1:1A (OUI DF-A9-FF)
        Count: 1
< ACL Data TX: Handle 1425 flags 0x00 dlen 21               #78 [hci1] 6.602426
      SMP: Pairing Random (0x04) len 16
        Random value: 8e6108f966a694cbe26df70bb96773e6
> HCI Event: Number of Completed Packets (0x13) plen 5      #79 [hci1] 6.767841
        Num handles: 1
        Handle: 1425 Address: DF:A9:FF:F6:B1:1A (OUI DF-A9-FF)
        Count: 1
        #78: len 21 (1 Kb/s)
        Latency: 165 msec (75-171 msec ~158 msec)
> ACL Data RX: Handle 1425 flags 0x02 dlen 21               #80 [hci1] 6.943129
      SMP: Pairing DHKey Check (0x0d) len 16
        E: 64b333cb6f77bee2c3431cc889831e64
< HCI Command: Host Number of Compl.. (0x03|0x0035) plen 5  #81 [hci1] 6.961803
        Num handles: 1
        Handle: 1425 Address: DF:A9:FF:F6:B1:1A (OUI DF-A9-FF)
        Count: 1
< ACL Data TX: Handle 1425 flags 0x00 dlen 21               #82 [hci1] 6.961919
      SMP: Pairing DHKey Check (0x0d) len 16
        E: fe4ee3049c207df3dee4211456be70a1
> HCI Event: Number of Completed Packets (0x13) plen 5      #83 [hci1] 7.117915
        Num handles: 1
        Handle: 1425 Address: DF:A9:FF:F6:B1:1A (OUI DF-A9-FF)
        Count: 1
        #82: len 21 (1 Kb/s)
        Latency: 155 msec (75-171 msec ~157 msec)
> HCI Event: LE Meta Event (0x3e) plen 13                   #84 [hci1] 7.205920
      LE Long Term Key Request (0x05)
        Handle: 1425 Address: DF:A9:FF:F6:B1:1A (OUI DF-A9-FF)
        Random number: 0x0000000000000000
        Encrypted diversifier: 0x0000
< HCI Command: LE Long Term Key Re.. (0x08|0x001a) plen 18  #85 [hci1] 7.221926
        Handle: 1425 Address: DF:A9:FF:F6:B1:1A (OUI DF-A9-FF)
        Long term key: 88973e3a81ad3afacbf980110ff5eea8
> HCI Event: Command Complete (0x0e) plen 6                 #86 [hci1] 7.222744
      LE Long Term Key Request Reply (0x08|0x001a) ncmd 1
        Status: Success (0x00)
        Handle: 1425 Address: DF:A9:FF:F6:B1:1A (OUI DF-A9-FF)
> HCI Event: Encryption Change (0x08) plen 4                #87 [hci1] 7.643134
        Status: Success (0x00)
        Handle: 1425 Address: DF:A9:FF:F6:B1:1A (OUI DF-A9-FF)
        Encryption: Enabled with AES-CCM (0x01)
> ACL Data RX: Handle 1425 flags 0x02 dlen 21               #88 [hci1] 7.730749
      SMP: Identity Information (0x08) len 16
        Identity resolving key: e2b056e892a0c711e582ca47bec0f266
< HCI Command: Host Number of Compl.. (0x03|0x0035) plen 5  #89 [hci1] 7.772586
        Num handles: 1
        Handle: 1425 Address: DF:A9:FF:F6:B1:1A (OUI DF-A9-FF)
        Count: 1
> ACL Data RX: Handle 1425 flags 0x02 dlen 12               #90 [hci1] 7.905669
      SMP: Identity Address Information (0x09) len 7
        Address: DF:A9:FF:F6:B1:1A (OUI DF-A9-FF)
< HCI Command: LE Add Device To Re.. (0x08|0x0027) plen 39  #91 [hci1] 7.922010
        Address type: Public (0x00)
        Address: DF:A9:FF:F6:B1:1A (OUI DF-A9-FF)
        Peer identity resolving key: e2b056e892a0c711e582ca47bec0f266
        Local identity resolving key: 00000000000000000000000000000000
> HCI Event: Command Complete (0x0e) plen 4                 #92 [hci1] 7.922935
      LE Add Device To Resolving List (0x08|0x0027) ncmd 1
        Status: Success (0x00)
< HCI Command: LE Set Privacy Mode (0x08|0x004e) plen 8     #93 [hci1] 7.941762
        Peer Identity address type: Public (0x00)
        Peer Identity address: DF:A9:FF:F6:B1:1A (OUI DF-A9-FF)
        Privacy Mode: Use Device Privacy (0x01)
> HCI Event: Command Complete (0x0e) plen 4                 #94 [hci1] 7.942296
      LE Set Privacy Mode (0x08|0x004e) ncmd 1
        Status: Success (0x00)
< HCI Command: LE Set Address Resol.. (0x08|0x002d) plen 1  #95 [hci1] 7.961947
        Address resolution: Enabled (0x01)
> HCI Event: Command Complete (0x0e) plen 4                 #96 [hci1] 7.962435
      LE Set Address Resolution Enable (0x08|0x002d) ncmd 1
        Status: Success (0x00)
< HCI Command: Host Number of Compl.. (0x03|0x0035) plen 5  #97 [hci1] 7.981865
        Num handles: 1
        Handle: 1425 Address: DF:A9:FF:F6:B1:1A (OUI DF-A9-FF)
        Count: 1
> ACL Data RX: Handle 1425 flags 0x02 dlen 11               #98 [hci1] 7.993038
      ATT: Read By Group Type Request (0x10) len 6
        Handle range: 0x0001-0xffff
        Attribute group type: Primary Service (0x2800)
< HCI Command: Host Number of Compl.. (0x03|0x0035) plen 5  #99 [hci1] 8.002022
        Num handles: 1
        Handle: 1425 Address: DF:A9:FF:F6:B1:1A (OUI DF-A9-FF)
        Count: 1
< ACL Data TX: Handle 1425 flags 0x00 dlen 27              #100 [hci1] 8.002166
< ACL Data TX: Handle 1425 flags 0x01 dlen 21              #101 [hci1] 8.002183
      ATT: Read By Group Type Response (0x11) len 43
        Attribute data length: 6
        Attribute group list: 7 entries
        Handle range: 0x0001-0x000a
        UUID: Generic Attribute Profile (0x1801)
        Handle range: 0x000b-0x0011
        UUID: Generic Access Profile (0x1800)
        Handle range: 0x0012-0x0020
        UUID: Device Information (0x180a)
        Handle range: 0x0021-0x0023
        UUID: Immediate Alert (0x1802)
        Handle range: 0x0024-0x0036
        UUID: Published Audio Capabilities (0x1850)
        Handle range: 0x0037-0x0046
        UUID: Audio Stream Control (0x184e)
        Handle range: 0x0047-0x004c
        UUID: Broadcast Audio Scan (0x184f)
> HCI Event: Number of Completed Packets (0x13) plen 5     #102 [hci1] 8.080857
        Num handles: 1
        Handle: 1425 Address: DF:A9:FF:F6:B1:1A (OUI DF-A9-FF)
        Count: 1
        #100: len 27 (2 Kb/s)
        Latency: 78 msec (75-171 msec ~117 msec)
> HCI Event: Number of Completed Packets (0x13) plen 5     #103 [hci1] 8.167990
        Num handles: 1
        Handle: 1425 Address: DF:A9:FF:F6:B1:1A (OUI DF-A9-FF)
        Count: 1
        #101: len 21 (1 Kb/s)
        Latency: 165 msec (75-171 msec ~141 msec)
> ACL Data RX: Handle 1425 flags 0x02 dlen 11              #104 [hci1] 8.168216
      ATT: Read By Group Type Request (0x10) len 6
        Handle range: 0x004d-0xffff
        Attribute group type: Primary Service (0x2800)
< HCI Command: Host Number of Comp.. (0x03|0x0035) plen 5  #105 [hci1] 8.182329
        Num handles: 1
        Handle: 1425 Address: DF:A9:FF:F6:B1:1A (OUI DF-A9-FF)
        Count: 1
< ACL Data TX: Handle 1425 flags 0x00 dlen 9               #106 [hci1] 8.182603
      ATT: Error Response (0x01) len 4
        Read By Group Type Request (0x10)
        Handle: 0x004d
        Error: Attribute Not Found (0x0a)
> HCI Event: Number of Completed Packets (0x13) plen 5     #107 [hci1] 8.342926
        Num handles: 1
        Handle: 1425 Address: DF:A9:FF:F6:B1:1A (OUI DF-A9-FF)
        Count: 1
        #106: len 9 (0 Kb/s)
        Latency: 160 msec (75-171 msec ~151 msec)
> ACL Data RX: Handle 1425 flags 0x02 dlen 11              #108 [hci1] 8.343169
      ATT: Read By Type Request (0x08) len 6
        Handle range: 0x0001-0x000a
        Attribute type: Characteristic (0x2803)
< HCI Command: Host Number of Comp.. (0x03|0x0035) plen 5  #109 [hci1] 8.362303
        Num handles: 1
        Handle: 1425 Address: DF:A9:FF:F6:B1:1A (OUI DF-A9-FF)
        Count: 1
< ACL Data TX: Handle 1425 flags 0x00 dlen 27              #110 [hci1] 8.362521
< ACL Data TX: Handle 1425 flags 0x01 dlen 7               #111 [hci1] 8.362540
      ATT: Read By Type Response (0x09) len 29
        Attribute data length: 7
        Attribute data list: 4 entries
        Handle: 0x0002
        Value: 200300052a
            Properties: 0x20
              Indicate (0x20)
            Value Handle: 0x0003
            Value UUID: Service Changed (0x2a05)
        Handle: 0x0005
        Value: 0a0600292b
            Properties: 0x0a
              Read (0x02)
              Write (0x08)
            Value Handle: 0x0006
            Value UUID: Client Supported Features (0x2b29)
        Handle: 0x0007
        Value: 0208002a2b
            Properties: 0x02
              Read (0x02)
            Value Handle: 0x0008
            Value UUID: Database Hash (0x2b2a)
        Handle: 0x0009
        Value: 020a003a2b
            Properties: 0x02
              Read (0x02)
            Value Handle: 0x000a
            Value UUID: Server Supported Features (0x2b3a)
> HCI Event: Number of Completed Packets (0x13) plen 5     #112 [hci1] 8.430945
        Num handles: 1
        Handle: 1425 Address: DF:A9:FF:F6:B1:1A (OUI DF-A9-FF)
        Count: 1
        #110: len 27 (3 Kb/s)
        Latency: 68 msec (68-171 msec ~109 msec)
> HCI Event: Number of Completed Packets (0x13) plen 5     #113 [hci1] 8.517952
        Num handles: 1
        Handle: 1425 Address: DF:A9:FF:F6:B1:1A (OUI DF-A9-FF)
        Count: 1
        #111: len 7 (0 Kb/s)
        Latency: 155 msec (68-171 msec ~132 msec)
> ACL Data RX: Handle 1425 flags 0x02 dlen 11              #114 [hci1] 8.518177
      ATT: Read By Type Request (0x08) len 6
        Handle range: 0x000a-0x000a
        Attribute type: Characteristic (0x2803)
< HCI Command: Host Number of Comp.. (0x03|0x0035) plen 5  #115 [hci1] 8.522358
        Num handles: 1
        Handle: 1425 Address: DF:A9:FF:F6:B1:1A (OUI DF-A9-FF)
        Count: 1
< ACL Data TX: Handle 1425 flags 0x00 dlen 9               #116 [hci1] 8.522578
      ATT: Error Response (0x01) len 4
        Read By Type Request (0x08)
        Handle: 0x000a
        Error: Attribute Not Found (0x0a)
> HCI Event: Number of Completed Packets (0x13) plen 5     #117 [hci1] 8.692894
        Num handles: 1
        Handle: 1425 Address: DF:A9:FF:F6:B1:1A (OUI DF-A9-FF)
        Count: 1
        #116: len 9 (0 Kb/s)
        Latency: 170 msec (68-171 msec ~151 msec)
> ACL Data RX: Handle 1425 flags 0x02 dlen 9               #118 [hci1] 8.693146
      ATT: Find Information Request (0x04) len 4
        Handle range: 0x0004-0x0004
< HCI Command: Host Number of Comp.. (0x03|0x0035) plen 5  #119 [hci1] 8.702272
        Num handles: 1
        Handle: 1425 Address: DF:A9:FF:F6:B1:1A (OUI DF-A9-FF)
        Count: 1
< ACL Data TX: Handle 1425 flags 0x00 dlen 10              #120 [hci1] 8.702520
      ATT: Find Information Response (0x05) len 5
        Format: UUID-16 (0x01)
        Handle: 0x0004
        UUID: Client Characteristic Configuration (0x2902)
> HCI Event: Number of Completed Packets (0x13) plen 5     #121 [hci1] 8.868022
        Num handles: 1
        Handle: 1425 Address: DF:A9:FF:F6:B1:1A (OUI DF-A9-FF)
        Count: 1
        #120: len 10 (0 Kb/s)
        Latency: 165 msec (68-171 msec ~158 msec)
> ACL Data RX: Handle 1425 flags 0x02 dlen 11              #122 [hci1] 8.868101
      ATT: Read By Type Request (0x08) len 6
        Handle range: 0x000b-0x0011
        Attribute type: Characteristic (0x2803)
< HCI Command: Host Number of Comp.. (0x03|0x0035) plen 5  #123 [hci1] 8.882339
        Num handles: 1
        Handle: 1425 Address: DF:A9:FF:F6:B1:1A (OUI DF-A9-FF)
        Count: 1
< ACL Data TX: Handle 1425 flags 0x00 dlen 27              #124 [hci1] 8.882528
      ATT: Read By Type Response (0x09) len 22
        Attribute data length: 7
        Attribute data list: 3 entries
        Handle: 0x000c
        Value: 0a0d00002a
            Properties: 0x0a
              Read (0x02)
              Write (0x08)
            Value Handle: 0x000d
            Value UUID: Device Name (0x2a00)
        Handle: 0x000e
        Value: 0a0f00012a
            Properties: 0x0a
              Read (0x02)
              Write (0x08)
            Value Handle: 0x000f
            Value UUID: Appearance (0x2a01)
        Handle: 0x0010
        Value: 021100042a
            Properties: 0x02
              Read (0x02)
            Value Handle: 0x0011
            Value UUID: Peripheral Preferred Connection Parameters (0x2a04)
> HCI Event: Number of Completed Packets (0x13) plen 5     #125 [hci1] 9.042949
        Num handles: 1
        Handle: 1425 Address: DF:A9:FF:F6:B1:1A (OUI DF-A9-FF)
        Count: 1
        #124: len 27 (1 Kb/s)
        Latency: 160 msec (68-171 msec ~159 msec)
> ACL Data RX: Handle 1425 flags 0x02 dlen 11              #126 [hci1] 9.043206
      ATT: Read By Type Request (0x08) len 6
        Handle range: 0x0011-0x0011
        Attribute type: Characteristic (0x2803)
< HCI Command: Host Number of Comp.. (0x03|0x0035) plen 5  #127 [hci1] 9.062507
        Num handles: 1
        Handle: 1425 Address: DF:A9:FF:F6:B1:1A (OUI DF-A9-FF)
        Count: 1
< ACL Data TX: Handle 1425 flags 0x00 dlen 9               #128 [hci1] 9.062797
      ATT: Error Response (0x01) len 4
        Read By Type Request (0x08)
        Handle: 0x0011
        Error: Attribute Not Found (0x0a)
> HCI Event: Number of Completed Packets (0x13) plen 5     #129 [hci1] 9.217977
        Num handles: 1
        Handle: 1425 Address: DF:A9:FF:F6:B1:1A (OUI DF-A9-FF)
        Count: 1
        #128: len 9 (0 Kb/s)
        Latency: 155 msec (68-171 msec ~157 msec)
> ACL Data RX: Handle 1425 flags 0x02 dlen 11              #130 [hci1] 9.218199
      ATT: Read By Type Request (0x08) len 6
        Handle range: 0x0012-0x0020
        Attribute type: Characteristic (0x2803)
< HCI Command: Host Number of Comp.. (0x03|0x0035) plen 5  #131 [hci1] 9.222370
        Num handles: 1
        Handle: 1425 Address: DF:A9:FF:F6:B1:1A (OUI DF-A9-FF)
        Count: 1
< ACL Data TX: Handle 1425 flags 0x00 dlen 27              #132 [hci1] 9.222523
< ACL Data TX: Handle 1425 flags 0x01 dlen 27              #133 [hci1] 9.222567
< ACL Data TX: Handle 1425 flags 0x01 dlen 1               #134 [hci1] 9.222640
      ATT: Read By Type Response (0x09) len 50
        Attribute data length: 7
        Attribute data list: 7 entries
        Handle: 0x0013
        Value: 021400242a
            Properties: 0x02
              Read (0x02)
            Value Handle: 0x0014
            Value UUID: Model Number String (0x2a24)
        Handle: 0x0015
        Value: 021600292a
            Properties: 0x02
              Read (0x02)
            Value Handle: 0x0016
            Value UUID: Manufacturer Name String (0x2a29)
        Handle: 0x0017
        Value: 021800502a
            Properties: 0x02
              Read (0x02)
            Value Handle: 0x0018
            Value UUID: PnP ID (0x2a50)
        Handle: 0x0019
        Value: 021a00252a
            Properties: 0x02
              Read (0x02)
            Value Handle: 0x001a
            Value UUID: Serial Number String (0x2a25)
        Handle: 0x001b
        Value: 021c00262a
            Properties: 0x02
              Read (0x02)
            Value Handle: 0x001c
            Value UUID: Firmware Revision String (0x2a26)
        Handle: 0x001d
        Value: 021e00272a
            Properties: 0x02
              Read (0x02)
            Value Handle: 0x001e
            Value UUID: Hardware Revision String (0x2a27)
        Handle: 0x001f
        Value: 022000282a
            Properties: 0x02
              Read (0x02)
            Value Handle: 0x0020
            Value UUID: Software Revision String (0x2a28)
> HCI Event: Number of Completed Packets (0x13) plen 5     #135 [hci1] 9.305909
        Num handles: 1
        Handle: 1425 Address: DF:A9:FF:F6:B1:1A (OUI DF-A9-FF)
        Count: 1
        #132: len 27 (2 Kb/s)
        Latency: 83 msec (68-171 msec ~120 msec)
> HCI Event: Number of Completed Packets (0x13) plen 5     #136 [hci1] 9.306343
        Num handles: 1
        Handle: 1425 Address: DF:A9:FF:F6:B1:1A (OUI DF-A9-FF)
        Count: 1
        #133: len 27 (2 Kb/s)
        Latency: 83 msec (68-171 msec ~102 msec)
> HCI Event: Number of Completed Packets (0x13) plen 5     #137 [hci1] 9.392936
        Num handles: 1
        Handle: 1425 Address: DF:A9:FF:F6:B1:1A (OUI DF-A9-FF)
        Count: 1
        #134: len 1 (0 Kb/s)
        Latency: 170 msec (68-171 msec ~136 msec)
> ACL Data RX: Handle 1425 flags 0x02 dlen 11              #138 [hci1] 9.393152
      ATT: Read By Type Request (0x08) len 6
        Handle range: 0x0020-0x0020
        Attribute type: Characteristic (0x2803)
< HCI Command: Host Number of Comp.. (0x03|0x0035) plen 5  #139 [hci1] 9.402336
        Num handles: 1
        Handle: 1425 Address: DF:A9:FF:F6:B1:1A (OUI DF-A9-FF)
        Count: 1
< ACL Data TX: Handle 1425 flags 0x00 dlen 9               #140 [hci1] 9.402599
      ATT: Error Response (0x01) len 4
        Read By Type Request (0x08)
        Handle: 0x0020
        Error: Attribute Not Found (0x0a)
> HCI Event: Number of Completed Packets (0x13) plen 5     #141 [hci1] 9.567928
        Num handles: 1
        Handle: 1425 Address: DF:A9:FF:F6:B1:1A (OUI DF-A9-FF)
        Count: 1
        #140: len 9 (0 Kb/s)
        Latency: 165 msec (68-171 msec ~150 msec)
> ACL Data RX: Handle 1425 flags 0x02 dlen 11              #142 [hci1] 9.568159
      ATT: Read By Type Request (0x08) len 6
        Handle range: 0x0021-0x0023
        Attribute type: Characteristic (0x2803)
< HCI Command: Host Number of Comp.. (0x03|0x0035) plen 5  #143 [hci1] 9.582138
        Num handles: 1
        Handle: 1425 Address: DF:A9:FF:F6:B1:1A (OUI DF-A9-FF)
        Count: 1
< ACL Data TX: Handle 1425 flags 0x00 dlen 13              #144 [hci1] 9.582214
      ATT: Read By Type Response (0x09) len 8
        Attribute data length: 7
        Attribute data list: 1 entry
        Handle: 0x0022
        Value: 042300062a
            Properties: 0x04
              Write Without Response (0x04)
            Value Handle: 0x0023
            Value UUID: Alert Level (0x2a06)
> HCI Event: Number of Completed Packets (0x13) plen 5     #145 [hci1] 9.742955
        Num handles: 1
        Handle: 1425 Address: DF:A9:FF:F6:B1:1A (OUI DF-A9-FF)
        Count: 1
        #144: len 13 (0 Kb/s)
        Latency: 160 msec (68-171 msec ~155 msec)
> ACL Data RX: Handle 1425 flags 0x02 dlen 11              #146 [hci1] 9.743119
      ATT: Read By Type Request (0x08) len 6
        Handle range: 0x0023-0x0023
        Attribute type: Characteristic (0x2803)
< HCI Command: Host Number of Comp.. (0x03|0x0035) plen 5  #147 [hci1] 9.762398
        Num handles: 1
        Handle: 1425 Address: DF:A9:FF:F6:B1:1A (OUI DF-A9-FF)
        Count: 1
< ACL Data TX: Handle 1425 flags 0x00 dlen 9               #148 [hci1] 9.762698
      ATT: Error Response (0x01) len 4
        Read By Type Request (0x08)
        Handle: 0x0023
        Error: Attribute Not Found (0x0a)
> HCI Event: Number of Completed Packets (0x13) plen 5     #149 [hci1] 9.917915
        Num handles: 1
        Handle: 1425 Address: DF:A9:FF:F6:B1:1A (OUI DF-A9-FF)
        Count: 1
        #148: len 9 (0 Kb/s)
        Latency: 155 msec (68-171 msec ~155 msec)
> ACL Data RX: Handle 1425 flags 0x02 dlen 11              #150 [hci1] 9.918151
      ATT: Read By Type Request (0x08) len 6
        Handle range: 0x0024-0x0036
        Attribute type: Characteristic (0x2803)
< HCI Command: Host Number of Comp.. (0x03|0x0035) plen 5  #151 [hci1] 9.922282
        Num handles: 1
        Handle: 1425 Address: DF:A9:FF:F6:B1:1A (OUI DF-A9-FF)
        Count: 1
< ACL Data TX: Handle 1425 flags 0x00 dlen 27              #152 [hci1] 9.922388
< ACL Data TX: Handle 1425 flags 0x01 dlen 21              #153 [hci1] 9.922472
      ATT: Read By Type Response (0x09) len 43
        Attribute data length: 7
        Attribute data list: 6 entries
        Handle: 0x0025
        Value: 122600c92b
            Properties: 0x12
              Read (0x02)
              Notify (0x10)
            Value Handle: 0x0026
            Value UUID: Sink PAC (0x2bc9)
        Handle: 0x0028
        Value: 1a2900ca2b
            Properties: 0x1a
              Read (0x02)
              Write (0x08)
              Notify (0x10)
            Value Handle: 0x0029
            Value UUID: Sink Audio Locations (0x2bca)
        Handle: 0x002b
        Value: 122c00cb2b
            Properties: 0x12
              Read (0x02)
              Notify (0x10)
            Value Handle: 0x002c
            Value UUID: Source PAC (0x2bcb)
        Handle: 0x002e
        Value: 1a2f00cc2b
            Properties: 0x1a
              Read (0x02)
              Write (0x08)
              Notify (0x10)
            Value Handle: 0x002f
            Value UUID: Source Audio Locations (0x2bcc)
        Handle: 0x0031
        Value: 123200cd2b
            Properties: 0x12
              Read (0x02)
              Notify (0x10)
            Value Handle: 0x0032
            Value UUID: Available Audio Contexts (0x2bcd)
        Handle: 0x0034
        Value: 123500ce2b
            Properties: 0x12
              Read (0x02)
              Notify (0x10)
            Value Handle: 0x0035
            Value UUID: Supported Audio Contexts (0x2bce)
> HCI Event: Number of Completed Packets (0x13) plen 5    #154 [hci1] 10.005956
        Num handles: 1
        Handle: 1425 Address: DF:A9:FF:F6:B1:1A (OUI DF-A9-FF)
        Count: 1
        #152: len 27 (2 Kb/s)
        Latency: 83 msec (68-171 msec ~119 msec)
> HCI Event: Number of Completed Packets (0x13) plen 5    #155 [hci1] 10.093026
        Num handles: 1
        Handle: 1425 Address: DF:A9:FF:F6:B1:1A (OUI DF-A9-FF)
        Count: 1
        #153: len 21 (0 Kb/s)
        Latency: 170 msec (68-171 msec ~145 msec)
> ACL Data RX: Handle 1425 flags 0x02 dlen 11             #156 [hci1] 10.093141
      ATT: Read By Type Request (0x08) len 6
        Handle range: 0x0035-0x0036
        Attribute type: Characteristic (0x2803)
< HCI Command: Host Number of Com.. (0x03|0x0035) plen 5  #157 [hci1] 10.102397
        Num handles: 1
        Handle: 1425 Address: DF:A9:FF:F6:B1:1A (OUI DF-A9-FF)
        Count: 1
< ACL Data TX: Handle 1425 flags 0x00 dlen 9              #158 [hci1] 10.102595
      ATT: Error Response (0x01) len 4
        Read By Type Request (0x08)
        Handle: 0x0035
        Error: Attribute Not Found (0x0a)
> HCI Event: Number of Completed Packets (0x13) plen 5    #159 [hci1] 10.267947
        Num handles: 1
        Handle: 1425 Address: DF:A9:FF:F6:B1:1A (OUI DF-A9-FF)
        Count: 1
        #158: len 9 (0 Kb/s)
        Latency: 165 msec (68-171 msec ~155 msec)
> ACL Data RX: Handle 1425 flags 0x02 dlen 9              #160 [hci1] 10.268212
      ATT: Find Information Request (0x04) len 4
        Handle range: 0x0027-0x0027
< HCI Command: Host Number of Com.. (0x03|0x0035) plen 5  #161 [hci1] 10.282385
        Num handles: 1
        Handle: 1425 Address: DF:A9:FF:F6:B1:1A (OUI DF-A9-FF)
        Count: 1
< ACL Data TX: Handle 1425 flags 0x00 dlen 10             #162 [hci1] 10.282484
      ATT: Find Information Response (0x05) len 5
        Format: UUID-16 (0x01)
        Handle: 0x0027
        UUID: Client Characteristic Configuration (0x2902)
> HCI Event: Number of Completed Packets (0x13) plen 5    #163 [hci1] 10.442916
        Num handles: 1
        Handle: 1425 Address: DF:A9:FF:F6:B1:1A (OUI DF-A9-FF)
        Count: 1
        #162: len 10 (0 Kb/s)
        Latency: 160 msec (68-171 msec ~157 msec)
> ACL Data RX: Handle 1425 flags 0x02 dlen 9              #164 [hci1] 10.443100
      ATT: Find Information Request (0x04) len 4
        Handle range: 0x002a-0x002a
< HCI Command: Host Number of Com.. (0x03|0x0035) plen 5  #165 [hci1] 10.461973
        Num handles: 1
        Handle: 1425 Address: DF:A9:FF:F6:B1:1A (OUI DF-A9-FF)
        Count: 1
< ACL Data TX: Handle 1425 flags 0x00 dlen 10             #166 [hci1] 10.462032
      ATT: Find Information Response (0x05) len 5
        Format: UUID-16 (0x01)
        Handle: 0x002a
        UUID: Client Characteristic Configuration (0x2902)
> HCI Event: Number of Completed Packets (0x13) plen 5    #167 [hci1] 10.617884
        Num handles: 1
        Handle: 1425 Address: DF:A9:FF:F6:B1:1A (OUI DF-A9-FF)
        Count: 1
        #166: len 10 (0 Kb/s)
        Latency: 155 msec (68-171 msec ~156 msec)
> ACL Data RX: Handle 1425 flags 0x02 dlen 9              #168 [hci1] 10.618131
      ATT: Find Information Request (0x04) len 4
        Handle range: 0x002d-0x002d
< HCI Command: Host Number of Com.. (0x03|0x0035) plen 5  #169 [hci1] 10.622299
        Num handles: 1
        Handle: 1425 Address: DF:A9:FF:F6:B1:1A (OUI DF-A9-FF)
        Count: 1
< ACL Data TX: Handle 1425 flags 0x00 dlen 10             #170 [hci1] 10.622483
      ATT: Find Information Response (0x05) len 5
        Format: UUID-16 (0x01)
        Handle: 0x002d
        UUID: Client Characteristic Configuration (0x2902)
> HCI Event: Number of Completed Packets (0x13) plen 5    #171 [hci1] 10.792924
        Num handles: 1
        Handle: 1425 Address: DF:A9:FF:F6:B1:1A (OUI DF-A9-FF)
        Count: 1
        #170: len 10 (0 Kb/s)
        Latency: 170 msec (68-171 msec ~163 msec)
> ACL Data RX: Handle 1425 flags 0x02 dlen 9              #172 [hci1] 10.793128
      ATT: Find Information Request (0x04) len 4
        Handle range: 0x0030-0x0030
< HCI Command: Host Number of Com.. (0x03|0x0035) plen 5  #173 [hci1] 10.802231
        Num handles: 1
        Handle: 1425 Address: DF:A9:FF:F6:B1:1A (OUI DF-A9-FF)
        Count: 1
< ACL Data TX: Handle 1425 flags 0x00 dlen 10             #174 [hci1] 10.802365
      ATT: Find Information Response (0x05) len 5
        Format: UUID-16 (0x01)
        Handle: 0x0030
        UUID: Client Characteristic Configuration (0x2902)
> HCI Event: Number of Completed Packets (0x13) plen 5    #175 [hci1] 10.967948
        Num handles: 1
        Handle: 1425 Address: DF:A9:FF:F6:B1:1A (OUI DF-A9-FF)
        Count: 1
        #174: len 10 (0 Kb/s)
        Latency: 165 msec (68-171 msec ~164 msec)
> ACL Data RX: Handle 1425 flags 0x02 dlen 9              #176 [hci1] 10.968099
      ATT: Find Information Request (0x04) len 4
        Handle range: 0x0033-0x0033
< HCI Command: Host Number of Com.. (0x03|0x0035) plen 5  #177 [hci1] 10.982433
        Num handles: 1
        Handle: 1425 Address: DF:A9:FF:F6:B1:1A (OUI DF-A9-FF)
        Count: 1
< ACL Data TX: Handle 1425 flags 0x00 dlen 10             #178 [hci1] 10.982538
      ATT: Find Information Response (0x05) len 5
        Format: UUID-16 (0x01)
        Handle: 0x0033
        UUID: Client Characteristic Configuration (0x2902)
> HCI Event: Number of Completed Packets (0x13) plen 5    #179 [hci1] 11.142921
        Num handles: 1
        Handle: 1425 Address: DF:A9:FF:F6:B1:1A (OUI DF-A9-FF)
        Count: 1
        #178: len 10 (0 Kb/s)
        Latency: 160 msec (68-171 msec ~162 msec)
> ACL Data RX: Handle 1425 flags 0x02 dlen 9              #180 [hci1] 11.143153
      ATT: Find Information Request (0x04) len 4
        Handle range: 0x0036-0x0036
< HCI Command: Host Number of Com.. (0x03|0x0035) plen 5  #181 [hci1] 11.161987
        Num handles: 1
        Handle: 1425 Address: DF:A9:FF:F6:B1:1A (OUI DF-A9-FF)
        Count: 1
< ACL Data TX: Handle 1425 flags 0x00 dlen 10             #182 [hci1] 11.162116
      ATT: Find Information Response (0x05) len 5
        Format: UUID-16 (0x01)
        Handle: 0x0036
        UUID: Client Characteristic Configuration (0x2902)
> HCI Event: Number of Completed Packets (0x13) plen 5    #183 [hci1] 11.317920
        Num handles: 1
        Handle: 1425 Address: DF:A9:FF:F6:B1:1A (OUI DF-A9-FF)
        Count: 1
        #182: len 10 (0 Kb/s)
        Latency: 155 msec (68-171 msec ~159 msec)
> ACL Data RX: Handle 1425 flags 0x02 dlen 11             #184 [hci1] 11.318092
      ATT: Read By Type Request (0x08) len 6
        Handle range: 0x0037-0x0046
        Attribute type: Characteristic (0x2803)
< HCI Command: Host Number of Com.. (0x03|0x0035) plen 5  #185 [hci1] 11.322329
        Num handles: 1
        Handle: 1425 Address: DF:A9:FF:F6:B1:1A (OUI DF-A9-FF)
        Count: 1
< ACL Data TX: Handle 1425 flags 0x00 dlen 27             #186 [hci1] 11.322504
< ACL Data TX: Handle 1425 flags 0x01 dlen 14             #187 [hci1] 11.322521
      ATT: Read By Type Response (0x09) len 36
        Attribute data length: 7
        Attribute data list: 5 entries
        Handle: 0x0038
        Value: 1c3900c62b
            Properties: 0x1c
              Write Without Response (0x04)
              Write (0x08)
              Notify (0x10)
            Value Handle: 0x0039
            Value UUID: ASE Control Point (0x2bc6)
        Handle: 0x003b
        Value: 123c00c42b
            Properties: 0x12
              Read (0x02)
              Notify (0x10)
            Value Handle: 0x003c
            Value UUID: Sink ASE (0x2bc4)
        Handle: 0x003e
        Value: 123f00c42b
            Properties: 0x12
              Read (0x02)
              Notify (0x10)
            Value Handle: 0x003f
            Value UUID: Sink ASE (0x2bc4)
        Handle: 0x0041
        Value: 124200c52b
            Properties: 0x12
              Read (0x02)
              Notify (0x10)
            Value Handle: 0x0042
            Value UUID: Source ASE (0x2bc5)
        Handle: 0x0044
        Value: 124500c52b
            Properties: 0x12
              Read (0x02)
              Notify (0x10)
            Value Handle: 0x0045
            Value UUID: Source ASE (0x2bc5)
> HCI Event: Number of Completed Packets (0x13) plen 5    #188 [hci1] 11.405839
        Num handles: 1
        Handle: 1425 Address: DF:A9:FF:F6:B1:1A (OUI DF-A9-FF)
        Count: 1
        #186: len 27 (2 Kb/s)
        Latency: 83 msec (68-171 msec ~121 msec)
> HCI Event: Number of Completed Packets (0x13) plen 5    #189 [hci1] 11.492915
        Num handles: 1
        Handle: 1425 Address: DF:A9:FF:F6:B1:1A (OUI DF-A9-FF)
        Count: 1
        #187: len 14 (0 Kb/s)
        Latency: 170 msec (68-171 msec ~145 msec)
> ACL Data RX: Handle 1425 flags 0x02 dlen 11             #190 [hci1] 11.493162
      ATT: Read By Type Request (0x08) len 6
        Handle range: 0x0045-0x0046
        Attribute type: Characteristic (0x2803)
< HCI Command: Host Number of Com.. (0x03|0x0035) plen 5  #191 [hci1] 11.502347
        Num handles: 1
        Handle: 1425 Address: DF:A9:FF:F6:B1:1A (OUI DF-A9-FF)
        Count: 1
< ACL Data TX: Handle 1425 flags 0x00 dlen 9              #192 [hci1] 11.502626
      ATT: Error Response (0x01) len 4
        Read By Type Request (0x08)
        Handle: 0x0045
        Error: Attribute Not Found (0x0a)
> HCI Event: Number of Completed Packets (0x13) plen 5    #193 [hci1] 11.667837
        Num handles: 1
        Handle: 1425 Address: DF:A9:FF:F6:B1:1A (OUI DF-A9-FF)
        Count: 1
        #192: len 9 (0 Kb/s)
        Latency: 165 msec (68-171 msec ~155 msec)
> ACL Data RX: Handle 1425 flags 0x02 dlen 9              #194 [hci1] 11.668112
      ATT: Find Information Request (0x04) len 4
        Handle range: 0x003a-0x003a
< HCI Command: Host Number of Com.. (0x03|0x0035) plen 5  #195 [hci1] 11.682073
        Num handles: 1
        Handle: 1425 Address: DF:A9:FF:F6:B1:1A (OUI DF-A9-FF)
        Count: 1
< ACL Data TX: Handle 1425 flags 0x00 dlen 10             #196 [hci1] 11.682131
      ATT: Find Information Response (0x05) len 5
        Format: UUID-16 (0x01)
        Handle: 0x003a
        UUID: Client Characteristic Configuration (0x2902)
> HCI Event: Number of Completed Packets (0x13) plen 5    #197 [hci1] 11.842857
        Num handles: 1
        Handle: 1425 Address: DF:A9:FF:F6:B1:1A (OUI DF-A9-FF)
        Count: 1
        #196: len 10 (0 Kb/s)
        Latency: 160 msec (68-171 msec ~158 msec)
> ACL Data RX: Handle 1425 flags 0x02 dlen 9              #198 [hci1] 11.843076
      ATT: Find Information Request (0x04) len 4
        Handle range: 0x003d-0x003d
< HCI Command: Host Number of Com.. (0x03|0x0035) plen 5  #199 [hci1] 11.862445
        Num handles: 1
        Handle: 1425 Address: DF:A9:FF:F6:B1:1A (OUI DF-A9-FF)
        Count: 1
< ACL Data TX: Handle 1425 flags 0x00 dlen 10             #200 [hci1] 11.862556
      ATT: Find Information Response (0x05) len 5
        Format: UUID-16 (0x01)
        Handle: 0x003d
        UUID: Client Characteristic Configuration (0x2902)
> HCI Event: Number of Completed Packets (0x13) plen 5    #201 [hci1] 12.017931
        Num handles: 1
        Handle: 1425 Address: DF:A9:FF:F6:B1:1A (OUI DF-A9-FF)
        Count: 1
        #200: len 10 (0 Kb/s)
        Latency: 155 msec (68-171 msec ~156 msec)
> ACL Data RX: Handle 1425 flags 0x02 dlen 9              #202 [hci1] 12.018026
      ATT: Find Information Request (0x04) len 4
        Handle range: 0x0040-0x0040
< HCI Command: Host Number of Com.. (0x03|0x0035) plen 5  #203 [hci1] 12.022304
        Num handles: 1
        Handle: 1425 Address: DF:A9:FF:F6:B1:1A (OUI DF-A9-FF)
        Count: 1
< ACL Data TX: Handle 1425 flags 0x00 dlen 10             #204 [hci1] 12.022539
      ATT: Find Information Response (0x05) len 5
        Format: UUID-16 (0x01)
        Handle: 0x0040
        UUID: Client Characteristic Configuration (0x2902)
> HCI Event: Number of Completed Packets (0x13) plen 5    #205 [hci1] 12.192929
        Num handles: 1
        Handle: 1425 Address: DF:A9:FF:F6:B1:1A (OUI DF-A9-FF)
        Count: 1
        #204: len 10 (0 Kb/s)
        Latency: 170 msec (68-171 msec ~163 msec)
> ACL Data RX: Handle 1425 flags 0x02 dlen 9              #206 [hci1] 12.193075
      ATT: Find Information Request (0x04) len 4
        Handle range: 0x0043-0x0043
< HCI Command: Host Number of Com.. (0x03|0x0035) plen 5  #207 [hci1] 12.202342
        Num handles: 1
        Handle: 1425 Address: DF:A9:FF:F6:B1:1A (OUI DF-A9-FF)
        Count: 1
< ACL Data TX: Handle 1425 flags 0x00 dlen 10             #208 [hci1] 12.202518
      ATT: Find Information Response (0x05) len 5
        Format: UUID-16 (0x01)
        Handle: 0x0043
        UUID: Client Characteristic Configuration (0x2902)
> HCI Event: Number of Completed Packets (0x13) plen 5    #209 [hci1] 12.367853
        Num handles: 1
        Handle: 1425 Address: DF:A9:FF:F6:B1:1A (OUI DF-A9-FF)
        Count: 1
        #208: len 10 (0 Kb/s)
        Latency: 165 msec (68-171 msec ~164 msec)
> ACL Data RX: Handle 1425 flags 0x02 dlen 9              #210 [hci1] 12.368162
      ATT: Find Information Request (0x04) len 4
        Handle range: 0x0046-0x0046
< HCI Command: Host Number of Com.. (0x03|0x0035) plen 5  #211 [hci1] 12.381803
        Num handles: 1
        Handle: 1425 Address: DF:A9:FF:F6:B1:1A (OUI DF-A9-FF)
        Count: 1
< ACL Data TX: Handle 1425 flags 0x00 dlen 10             #212 [hci1] 12.381855
      ATT: Find Information Response (0x05) len 5
        Format: UUID-16 (0x01)
        Handle: 0x0046
        UUID: Client Characteristic Configuration (0x2902)
> HCI Event: Number of Completed Packets (0x13) plen 5    #213 [hci1] 12.542876
        Num handles: 1
        Handle: 1425 Address: DF:A9:FF:F6:B1:1A (OUI DF-A9-FF)
        Count: 1
        #212: len 10 (0 Kb/s)
        Latency: 161 msec (68-171 msec ~162 msec)
> ACL Data RX: Handle 1425 flags 0x02 dlen 11             #214 [hci1] 12.543115
      ATT: Read By Type Request (0x08) len 6
        Handle range: 0x0047-0x004c
        Attribute type: Characteristic (0x2803)
< HCI Command: Host Number of Com.. (0x03|0x0035) plen 5  #215 [hci1] 12.562332
        Num handles: 1
        Handle: 1425 Address: DF:A9:FF:F6:B1:1A (OUI DF-A9-FF)
        Count: 1
< ACL Data TX: Handle 1425 flags 0x00 dlen 20             #216 [hci1] 12.562526
      ATT: Read By Type Response (0x09) len 15
        Attribute data length: 7
        Attribute data list: 2 entries
        Handle: 0x0048
        Value: 0c4900c72b
            Properties: 0x0c
              Write Without Response (0x04)
              Write (0x08)
            Value Handle: 0x0049
            Value UUID: Broadcast Audio Scan Control Point (0x2bc7)
        Handle: 0x004a
        Value: 124b00c82b
            Properties: 0x12
              Read (0x02)
              Notify (0x10)
            Value Handle: 0x004b
            Value UUID: Broadcast Receive State (0x2bc8)
> HCI Event: Number of Completed Packets (0x13) plen 5    #217 [hci1] 12.717949
        Num handles: 1
        Handle: 1425 Address: DF:A9:FF:F6:B1:1A (OUI DF-A9-FF)
        Count: 1
        #216: len 20 (1 Kb/s)
        Latency: 155 msec (68-171 msec ~159 msec)
> ACL Data RX: Handle 1425 flags 0x02 dlen 11             #218 [hci1] 12.718097
      ATT: Read By Type Request (0x08) len 6
        Handle range: 0x004b-0x004c
        Attribute type: Characteristic (0x2803)
< HCI Command: Host Number of Com.. (0x03|0x0035) plen 5  #219 [hci1] 12.722391
        Num handles: 1
        Handle: 1425 Address: DF:A9:FF:F6:B1:1A (OUI DF-A9-FF)
        Count: 1
< ACL Data TX: Handle 1425 flags 0x00 dlen 9              #220 [hci1] 12.722576
      ATT: Error Response (0x01) len 4
        Read By Type Request (0x08)
        Handle: 0x004b
        Error: Attribute Not Found (0x0a)
> HCI Event: Number of Completed Packets (0x13) plen 5    #221 [hci1] 12.892856
        Num handles: 1
        Handle: 1425 Address: DF:A9:FF:F6:B1:1A (OUI DF-A9-FF)
        Count: 1
        #220: len 9 (0 Kb/s)
        Latency: 170 msec (68-171 msec ~164 msec)
> ACL Data RX: Handle 1425 flags 0x02 dlen 9              #222 [hci1] 12.893068
      ATT: Find Information Request (0x04) len 4
        Handle range: 0x004c-0x004c
< HCI Command: Host Number of Com.. (0x03|0x0035) plen 5  #223 [hci1] 12.902279
        Num handles: 1
        Handle: 1425 Address: DF:A9:FF:F6:B1:1A (OUI DF-A9-FF)
        Count: 1
< ACL Data TX: Handle 1425 flags 0x00 dlen 10             #224 [hci1] 12.902365
      ATT: Find Information Response (0x05) len 5
        Format: UUID-16 (0x01)
        Handle: 0x004c
        UUID: Client Characteristic Configuration (0x2902)
> HCI Event: Number of Completed Packets (0x13) plen 5    #225 [hci1] 13.067872
        Num handles: 1
        Handle: 1425 Address: DF:A9:FF:F6:B1:1A (OUI DF-A9-FF)
        Count: 1
        #224: len 10 (0 Kb/s)
        Latency: 165 msec (68-171 msec ~165 msec)
> ACL Data RX: Handle 1425 flags 0x02 dlen 11             #226 [hci1] 13.068132
      ATT: Read By Type Request (0x08) len 6
        Handle range: 0x0001-0xffff
        Attribute type: Include (0x2802)
< HCI Command: Host Number of Com.. (0x03|0x0035) plen 5  #227 [hci1] 13.082446
        Num handles: 1
        Handle: 1425 Address: DF:A9:FF:F6:B1:1A (OUI DF-A9-FF)
        Count: 1
< ACL Data TX: Handle 1425 flags 0x00 dlen 9              #228 [hci1] 13.082631
      ATT: Error Response (0x01) len 4
        Read By Type Request (0x08)
        Handle: 0x0001
        Error: Attribute Not Found (0x0a)
> HCI Event: Number of Completed Packets (0x13) plen 5    #229 [hci1] 13.242884
        Num handles: 1
        Handle: 1425 Address: DF:A9:FF:F6:B1:1A (OUI DF-A9-FF)
        Count: 1
        #228: len 9 (0 Kb/s)
        Latency: 160 msec (68-171 msec ~162 msec)
> ACL Data RX: Handle 1425 flags 0x02 dlen 9              #230 [hci1] 13.243016
      ATT: Write Request (0x12) len 4
        Handle: 0x004c Type: Client Characteristic Configuration (0x2902)
        Value Handle: 0x004b Type: Broadcast Receive State (0x2bc8)
          Data: 0000
< HCI Command: Host Number of Com.. (0x03|0x0035) plen 5  #231 [hci1] 13.262466
        Num handles: 1
        Handle: 1425 Address: DF:A9:FF:F6:B1:1A (OUI DF-A9-FF)
        Count: 1
< ACL Data TX: Handle 1425 flags 0x00 dlen 5              #232 [hci1] 13.262634
      ATT: Write Response (0x13) len 0
> HCI Event: Number of Completed Packets (0x13) plen 5    #233 [hci1] 13.417882
        Num handles: 1
        Handle: 1425 Address: DF:A9:FF:F6:B1:1A (OUI DF-A9-FF)
        Count: 1
        #232: len 5 (0 Kb/s)
        Latency: 155 msec (68-171 msec ~158 msec)
> ACL Data RX: Handle 1425 flags 0x02 dlen 9              #234 [hci1] 13.418089
      ATT: Write Request (0x12) len 4
        Handle: 0x004c Type: Client Characteristic Configuration (0x2902)
        Value Handle: 0x004b Type: Broadcast Receive State (0x2bc8)
          Data: 0100
            Notification (0x01)
< HCI Command: Host Number of Com.. (0x03|0x0035) plen 5  #235 [hci1] 13.422405
        Num handles: 1
        Handle: 1425 Address: DF:A9:FF:F6:B1:1A (OUI DF-A9-FF)
        Count: 1
< ACL Data TX: Handle 1425 flags 0x00 dlen 5              #236 [hci1] 13.422581
      ATT: Write Response (0x13) len 0
> HCI Event: Number of Completed Packets (0x13) plen 5    #237 [hci1] 13.592888
        Num handles: 1
        Handle: 1425 Address: DF:A9:FF:F6:B1:1A (OUI DF-A9-FF)
        Count: 1
        #236: len 5 (0 Kb/s)
        Latency: 170 msec (68-171 msec ~164 msec)
> ACL Data RX: Handle 1425 flags 0x02 dlen 7              #238 [hci1] 13.593026
      ATT: Read Request (0x0a) len 2
        Handle: 0x004b Type: Broadcast Receive State (0x2bc8)
< HCI Command: Host Number of Com.. (0x03|0x0035) plen 5  #239 [hci1] 13.602364
        Num handles: 1
        Handle: 1425 Address: DF:A9:FF:F6:B1:1A (OUI DF-A9-FF)
        Count: 1
< ACL Data TX: Handle 1425 flags 0x00 dlen 5              #240 [hci1] 13.602632
      ATT: Read Response (0x0b) len 0
        Handle: 0x004b Type: Broadcast Receive State (0x2bc8)
        Value: 
          Empty characteristic
> HCI Event: Number of Completed Packets (0x13) plen 5    #241 [hci1] 13.767953
        Num handles: 1
        Handle: 1425 Address: DF:A9:FF:F6:B1:1A (OUI DF-A9-FF)
        Count: 1
        #240: len 5 (0 Kb/s)
        Latency: 165 msec (68-171 msec ~164 msec)
> ACL Data RX: Handle 1425 flags 0x02 dlen 27             #242 [hci1] 13.768249
> ACL Data RX: Handle 1425 flags 0x01 dlen 27             #243 [hci1] 13.768589
> ACL Data RX: Handle 1425 flags 0x01 dlen 14             #244 [hci1] 13.768938
      ATT: Prepare Write Request (0x16) len 63
        Handle: 0x0049 Type: Broadcast Audio Scan Control Point (0x2bc7)
        Offset: 0x0000
          Data: 02001ab1f6ffa9df0d34120000401f01000000004e0302020003010200030aff0041050102030405060708090a0b0c0d0e0f101112131415161718
< HCI Command: Host Number of Com.. (0x03|0x0035) plen 5  #245 [hci1] 13.781763
        Num handles: 1
        Handle: 1425 Address: DF:A9:FF:F6:B1:1A (OUI DF-A9-FF)
        Count: 1
< HCI Command: Host Number of Com.. (0x03|0x0035) plen 5  #246 [hci1] 13.781921
        Num handles: 1
        Handle: 1425 Address: DF:A9:FF:F6:B1:1A (OUI DF-A9-FF)
        Count: 1
< HCI Command: Host Number of Com.. (0x03|0x0035) plen 5  #247 [hci1] 13.781950
        Num handles: 1
        Handle: 1425 Address: DF:A9:FF:F6:B1:1A (OUI DF-A9-FF)
        Count: 1
< ACL Data TX: Handle 1425 flags 0x00 dlen 27             #248 [hci1] 13.782019
< ACL Data TX: Handle 1425 flags 0x01 dlen 27             #249 [hci1] 13.782048
< ACL Data TX: Handle 1425 flags 0x01 dlen 14             #250 [hci1] 13.782057
      ATT: Prepare Write Response (0x17) len 63
        Handle: 0x0049 Type: Broadcast Audio Scan Control Point (0x2bc7)
        Offset: 0x0000
          Data: 02001ab1f6ffa9df0d34120000401f01000000004e0302020003010200030aff0041050102030405060708090a0b0c0d0e0f101112131415161718
> HCI Event: Number of Completed Packets (0x13) plen 5    #251 [hci1] 13.855780
        Num handles: 1
        Handle: 1425 Address: DF:A9:FF:F6:B1:1A (OUI DF-A9-FF)
        Count: 1
        #248: len 27 (2 Kb/s)
        Latency: 73 msec (68-171 msec ~119 msec)
> HCI Event: Number of Completed Packets (0x13) plen 5    #252 [hci1] 13.856261
        Num handles: 1
        Handle: 1425 Address: DF:A9:FF:F6:B1:1A (OUI DF-A9-FF)
        Count: 1
        #249: len 27 (2 Kb/s)
        Latency: 74 msec (68-171 msec ~96 msec)
> HCI Event: Number of Completed Packets (0x13) plen 5    #253 [hci1] 13.942988
        Num handles: 1
        Handle: 1425 Address: DF:A9:FF:F6:B1:1A (OUI DF-A9-FF)
        Count: 1
        #250: len 14 (0 Kb/s)
        Latency: 160 msec (68-171 msec ~128 msec)
> ACL Data RX: Handle 1425 flags 0x02 dlen 27             #254 [hci1] 13.943248
> ACL Data RX: Handle 1425 flags 0x01 dlen 22             #255 [hci1] 13.943637
      ATT: Prepare Write Request (0x16) len 44
        Handle: 0x0049 Type: Broadcast Audio Scan Control Point (0x2bc7)
        Offset: 0x003b
          Data: 191a1b1c1d1e1f202122232425262728292a2b2c2d2e2f303132333435363738393a3b3c3d3e3f40
< HCI Command: Host Number of Com.. (0x03|0x0035) plen 5  #256 [hci1] 13.962335
        Num handles: 1
        Handle: 1425 Address: DF:A9:FF:F6:B1:1A (OUI DF-A9-FF)
        Count: 1
< HCI Command: Host Number of Com.. (0x03|0x0035) plen 5  #257 [hci1] 13.962505
        Num handles: 1
        Handle: 1425 Address: DF:A9:FF:F6:B1:1A (OUI DF-A9-FF)
        Count: 1
< ACL Data TX: Handle 1425 flags 0x00 dlen 27             #258 [hci1] 13.962615
< ACL Data TX: Handle 1425 flags 0x01 dlen 22             #259 [hci1] 13.962631
      ATT: Prepare Write Response (0x17) len 44
        Handle: 0x0049 Type: Broadcast Audio Scan Control Point (0x2bc7)
        Offset: 0x003b
          Data: 191a1b1c1d1e1f202122232425262728292a2b2c2d2e2f303132333435363738393a3b3c3d3e3f40
> HCI Event: Number of Completed Packets (0x13) plen 5    #260 [hci1] 14.030774
        Num handles: 1
        Handle: 1425 Address: DF:A9:FF:F6:B1:1A (OUI DF-A9-FF)
        Count: 1
        #258: len 27 (3 Kb/s)
        Latency: 68 msec (68-171 msec ~98 msec)
> HCI Event: Number of Completed Packets (0x13) plen 5    #261 [hci1] 14.117921
        Num handles: 1
        Handle: 1425 Address: DF:A9:FF:F6:B1:1A (OUI DF-A9-FF)
        Count: 1
        #259: len 22 (1 Kb/s)
        Latency: 155 msec (68-171 msec ~126 msec)
> ACL Data RX: Handle 1425 flags 0x02 dlen 6              #262 [hci1] 14.118069
      ATT: Execute Write Request (0x18) len 1
        Flags: Immediately write all pending values (0x01)
< HCI Command: Host Number of Com.. (0x03|0x0035) plen 5  #263 [hci1] 14.123546
        Num handles: 1
        Handle: 1425 Address: DF:A9:FF:F6:B1:1A (OUI DF-A9-FF)
        Count: 1
< ACL Data TX: Handle 1425 flags 0x00 dlen 5              #264 [hci1] 14.123905
      ATT: Execute Write Response (0x19) len 0
< ACL Data TX: Handle 1425 flags 0x00 dlen 27             #265 [hci1] 14.123984
< ACL Data TX: Handle 1425 flags 0x01 dlen 27             #266 [hci1] 14.124028
> HCI Event: Number of Completed Packets (0x13) plen 5    #267 [hci1] 14.205638
        Num handles: 1
        Handle: 1425 Address: DF:A9:FF:F6:B1:1A (OUI DF-A9-FF)
        Count: 1
        #264: len 5 (0 Kb/s)
        Latency: 81 msec (68-171 msec ~104 msec)
> HCI Event: Number of Completed Packets (0x13) plen 5    #268 [hci1] 14.206140
        Num handles: 1
        Handle: 1425 Address: DF:A9:FF:F6:B1:1A (OUI DF-A9-FF)
        Count: 1
        #265: len 27 (2 Kb/s)
        Latency: 82 msec (68-171 msec ~93 msec)
< ACL Data TX: Handle 1425 flags 0x01 dlen 14             #269 [hci1] 14.222094
      ATT: Handle Value Notification (0x1b) len 63
        Handle: 0x004b Type: Broadcast Receive State (0x2bc8)
          Data: 00001ab1f6ffa9df0d341200000001000000004e0302020003010200030aff0041050102030405060708090a0b0c0d0e0f101112131415161718191a1b
          Source_ID: 0
          Source_Address_Type: 0
          Source_Address: DF:A9:FF:F6:B1:1A
          Source_Adv_SID: 13
          Broadcast_ID: 0x001234
          PA_Sync_State: Not synchronized to PA
          BIG_Encryption: Not encrypted
          Num_Subgroups: 1
          Subgroup #0:
            BIS_Sync State: 0x00000000
            Metadata: invalid size
          Data: 0302020003010200030aff0041050102030405060708090a0b0c0d0e0f101112131415161718191a1b
> HCI Event: Number of Completed Packets (0x13) plen 5    #270 [hci1] 14.292816
        Num handles: 1
        Handle: 1425 Address: DF:A9:FF:F6:B1:1A (OUI DF-A9-FF)
        Count: 1
        #266: len 27 (1 Kb/s)
        Latency: 168 msec (68-171 msec ~131 msec)
> HCI Event: Number of Completed Packets (0x13) plen 5    #271 [hci1] 14.380272
        Num handles: 1
        Handle: 1425 Address: DF:A9:FF:F6:B1:1A (OUI DF-A9-FF)
        Count: 1
        #269: len 14 (0 Kb/s)
        Latency: 158 msec (68-171 msec ~144 msec)
> ACL Data RX: Handle 1425 flags 0x02 dlen 9              #272 [hci1] 15.342962
      ATT: Write Request (0x12) len 4
        Handle: 0x0049 Type: Broadcast Audio Scan Control Point (0x2bc7)
          Data: 0500
            Opcode: Remove Source (0x05)
            Source_ID: 0
< HCI Command: Host Number of Com.. (0x03|0x0035) plen 5  #273 [hci1] 15.362754
        Num handles: 1
        Handle: 1425 Address: DF:A9:FF:F6:B1:1A (OUI DF-A9-FF)
        Count: 1
< ACL Data TX: Handle 1425 flags 0x00 dlen 5              #274 [hci1] 15.363156
      ATT: Write Response (0x13) len 0
< ACL Data TX: Handle 1425 flags 0x00 dlen 7              #275 [hci1] 15.363356
      ATT: Handle Value Notification (0x1b) len 2
        Handle: 0x004b Type: Broadcast Receive State (0x2bc8)
          Data: 
          Empty characteristic
> HCI Event: Number of Completed Packets (0x13) plen 5    #276 [hci1] 15.430646
        Num handles: 1
        Handle: 1425 Address: DF:A9:FF:F6:B1:1A (OUI DF-A9-FF)
        Count: 1
        #274: len 5 (0 Kb/s)
        Latency: 67 msec (67-171 msec ~106 msec)
> HCI Event: Number of Completed Packets (0x13) plen 5    #277 [hci1] 15.517898
        Num handles: 1
        Handle: 1425 Address: DF:A9:FF:F6:B1:1A (OUI DF-A9-FF)
        Count: 1
        #275: len 7 (0 Kb/s)
        Latency: 154 msec (67-171 msec ~130 msec)
> ACL Data RX: Handle 1425 flags 0x02 dlen 27             #278 [hci1] 15.518250
> ACL Data RX: Handle 1425 flags 0x01 dlen 27             #279 [hci1] 15.518597
> ACL Data RX: Handle 1425 flags 0x01 dlen 14             #280 [hci1] 15.518871
      ATT: Prepare Write Request (0x16) len 63
        Handle: 0x0049 Type: Broadcast Audio Scan Control Point (0x2bc7)
        Offset: 0x0000
          Data: 020173d382cbdfcd0634120000401f01000000004e0302020003010200030aff0041050102030405060708090a0b0c0d0e0f101112131415161718
< HCI Command: Host Number of Com.. (0x03|0x0035) plen 5  #281 [hci1] 15.521686
        Num handles: 1
        Handle: 1425 Address: DF:A9:FF:F6:B1:1A (OUI DF-A9-FF)
        Count: 1
< HCI Command: Host Number of Com.. (0x03|0x0035) plen 5  #282 [hci1] 15.521716
        Num handles: 1
        Handle: 1425 Address: DF:A9:FF:F6:B1:1A (OUI DF-A9-FF)
        Count: 1
< HCI Command: Host Number of Com.. (0x03|0x0035) plen 5  #283 [hci1] 15.521733
        Num handles: 1
        Handle: 1425 Address: DF:A9:FF:F6:B1:1A (OUI DF-A9-FF)
        Count: 1
< ACL Data TX: Handle 1425 flags 0x00 dlen 27             #284 [hci1] 15.521813
< ACL Data TX: Handle 1425 flags 0x01 dlen 27             #285 [hci1] 15.521815
< ACL Data TX: Handle 1425 flags 0x01 dlen 14             #286 [hci1] 15.521815
      ATT: Prepare Write Response (0x17) len 63
        Handle: 0x0049 Type: Broadcast Audio Scan Control Point (0x2bc7)
        Offset: 0x0000
          Data: 020173d382cbdfcd0634120000401f01000000004e0302020003010200030aff0041050102030405060708090a0b0c0d0e0f101112131415161718
> HCI Event: Number of Completed Packets (0x13) plen 5    #287 [hci1] 15.605708
        Num handles: 1
        Handle: 1425 Address: DF:A9:FF:F6:B1:1A (OUI DF-A9-FF)
        Count: 1
        #284: len 27 (2 Kb/s)
        Latency: 83 msec (67-171 msec ~107 msec)
> HCI Event: Number of Completed Packets (0x13) plen 5    #288 [hci1] 15.606230
        Num handles: 1
        Handle: 1425 Address: DF:A9:FF:F6:B1:1A (OUI DF-A9-FF)
        Count: 1
        #285: len 27 (2 Kb/s)
        Latency: 84 msec (67-171 msec ~95 msec)
> HCI Event: Number of Completed Packets (0x13) plen 5    #289 [hci1] 15.692957
        Num handles: 1
        Handle: 1425 Address: DF:A9:FF:F6:B1:1A (OUI DF-A9-FF)
        Count: 1
        #286: len 14 (0 Kb/s)
        Latency: 171 msec (67-171 msec ~133 msec)
> ACL Data RX: Handle 1425 flags 0x02 dlen 27             #290 [hci1] 15.693259
> ACL Data RX: Handle 1425 flags 0x01 dlen 22             #291 [hci1] 15.693529
      ATT: Prepare Write Request (0x16) len 44
        Handle: 0x0049 Type: Broadcast Audio Scan Control Point (0x2bc7)
        Offset: 0x003b
          Data: 191a1b1c1d1e1f202122232425262728292a2b2c2d2e2f303132333435363738393a3b3c3d3e3f40
< HCI Command: Host Number of Com.. (0x03|0x0035) plen 5  #292 [hci1] 15.702625
        Num handles: 1
        Handle: 1425 Address: DF:A9:FF:F6:B1:1A (OUI DF-A9-FF)
        Count: 1
< HCI Command: Host Number of Com.. (0x03|0x0035) plen 5  #293 [hci1] 15.702678
        Num handles: 1
        Handle: 1425 Address: DF:A9:FF:F6:B1:1A (OUI DF-A9-FF)
        Count: 1
< ACL Data TX: Handle 1425 flags 0x00 dlen 27             #294 [hci1] 15.702844
< ACL Data TX: Handle 1425 flags 0x01 dlen 22             #295 [hci1] 15.702862
      ATT: Prepare Write Response (0x17) len 44
        Handle: 0x0049 Type: Broadcast Audio Scan Control Point (0x2bc7)
        Offset: 0x003b
          Data: 191a1b1c1d1e1f202122232425262728292a2b2c2d2e2f303132333435363738393a3b3c3d3e3f40
> HCI Event: Number of Completed Packets (0x13) plen 5    #296 [hci1] 15.780824
        Num handles: 1
        Handle: 1425 Address: DF:A9:FF:F6:B1:1A (OUI DF-A9-FF)
        Count: 1
        #294: len 27 (2 Kb/s)
        Latency: 77 msec (67-171 msec ~105 msec)
> HCI Event: Number of Completed Packets (0x13) plen 5    #297 [hci1] 15.867850
        Num handles: 1
        Handle: 1425 Address: DF:A9:FF:F6:B1:1A (OUI DF-A9-FF)
        Count: 1
        #295: len 22 (1 Kb/s)
        Latency: 164 msec (67-171 msec ~135 msec)
> ACL Data RX: Handle 1425 flags 0x02 dlen 6              #298 [hci1] 15.867959
      ATT: Execute Write Request (0x18) len 1
        Flags: Immediately write all pending values (0x01)
< HCI Command: Host Number of Com.. (0x03|0x0035) plen 5  #299 [hci1] 15.882587
        Num handles: 1
        Handle: 1425 Address: DF:A9:FF:F6:B1:1A (OUI DF-A9-FF)
        Count: 1
< ACL Data TX: Handle 1425 flags 0x00 dlen 5              #300 [hci1] 15.882750
      ATT: Execute Write Response (0x19) len 0
< ACL Data TX: Handle 1425 flags 0x00 dlen 27             #301 [hci1] 15.882877
< ACL Data TX: Handle 1425 flags 0x01 dlen 27             #302 [hci1] 15.882884
> HCI Event: Number of Completed Packets (0x13) plen 5    #303 [hci1] 15.955661
        Num handles: 1
        Handle: 1425 Address: DF:A9:FF:F6:B1:1A (OUI DF-A9-FF)
        Count: 1
        #300: len 5 (0 Kb/s)
        Latency: 72 msec (67-171 msec ~104 msec)
> HCI Event: Number of Completed Packets (0x13) plen 5    #304 [hci1] 15.956162
        Num handles: 1
        Handle: 1425 Address: DF:A9:FF:F6:B1:1A (OUI DF-A9-FF)
        Count: 1
        #301: len 27 (2 Kb/s)
        Latency: 73 msec (67-171 msec ~88 msec)
< ACL Data TX: Handle 1425 flags 0x01 dlen 14             #305 [hci1] 15.962101
      ATT: Handle Value Notification (0x1b) len 63
        Handle: 0x004b Type: Broadcast Receive State (0x2bc8)
          Data: 010173d382cbdfcd06341200000001000000004e0302020003010200030aff0041050102030405060708090a0b0c0d0e0f101112131415161718191a1b
          Source_ID: 1
          Source_Address_Type: 1
          Source_Address: CD:DF:CB:82:D3:73
          Source_Adv_SID: 6
          Broadcast_ID: 0x001234
          PA_Sync_State: Not synchronized to PA
          BIG_Encryption: Not encrypted
          Num_Subgroups: 1
          Subgroup #0:
            BIS_Sync State: 0x00000000
            Metadata: invalid size
          Data: 0302020003010200030aff0041050102030405060708090a0b0c0d0e0f101112131415161718191a1b
> HCI Event: Number of Completed Packets (0x13) plen 5    #306 [hci1] 16.042744
        Num handles: 1
        Handle: 1425 Address: DF:A9:FF:F6:B1:1A (OUI DF-A9-FF)
        Count: 1
        #302: len 27 (1 Kb/s)
        Latency: 159 msec (67-171 msec ~124 msec)
> HCI Event: Number of Completed Packets (0x13) plen 5    #307 [hci1] 16.130238
        Num handles: 1
        Handle: 1425 Address: DF:A9:FF:F6:B1:1A (OUI DF-A9-FF)
        Count: 1
        #305: len 14 (0 Kb/s)
        Latency: 168 msec (67-171 msec ~146 msec)
> ACL Data RX: Handle 1425 flags 0x02 dlen 9              #308 [hci1] 18.405306
      ATT: Write Request (0x12) len 4
        Handle: 0x0049 Type: Broadcast Audio Scan Control Point (0x2bc7)
          Data: 0501
            Opcode: Remove Source (0x05)
            Source_ID: 1
< HCI Command: Host Number of Com.. (0x03|0x0035) plen 5  #309 [hci1] 18.421951
        Num handles: 1
        Handle: 1425 Address: DF:A9:FF:F6:B1:1A (OUI DF-A9-FF)
        Count: 1
< ACL Data TX: Handle 1425 flags 0x00 dlen 5              #310 [hci1] 18.422115
      ATT: Write Response (0x13) len 0
< ACL Data TX: Handle 1425 flags 0x00 dlen 7              #311 [hci1] 18.422216
      ATT: Handle Value Notification (0x1b) len 2
        Handle: 0x004b Type: Broadcast Receive State (0x2bc8)
          Data: 
          Empty characteristic
> HCI Event: Number of Completed Packets (0x13) plen 5    #312 [hci1] 18.493105
        Num handles: 1
        Handle: 1425 Address: DF:A9:FF:F6:B1:1A (OUI DF-A9-FF)
        Count: 1
        #310: len 5 (0 Kb/s)
        Latency: 70 msec (67-171 msec ~108 msec)
> HCI Event: Number of Completed Packets (0x13) plen 5    #313 [hci1] 18.580220
        Num handles: 1
        Handle: 1425 Address: DF:A9:FF:F6:B1:1A (OUI DF-A9-FF)
        Count: 1
        #311: len 7 (0 Kb/s)
        Latency: 158 msec (67-171 msec ~133 msec)
> HCI Event: Disconnect Complete (0x05) plen 4            #314 [hci1] 19.980474
        Status: Success (0x00)
        Handle: 1425 Address: DF:A9:FF:F6:B1:1A (OUI DF-A9-FF)
        Reason: Remote User Terminated Connection (0x13)
< HCI Command: Reset (0x03|0x0003) plen 0                 #315 [hci1] 24.381769
> HCI Event: Command Complete (0x0e) plen 4               #316 [hci1] 24.382261
      Reset (0x03|0x0003) ncmd 1
        Status: Success (0x00)
@ USER Close: main                                    {0x0001} [hci1] 24.401647
= Close Index: 00:00:00:00:00:00                               [hci1] 24.401654
