Bluetooth monitor ver 5.72
= Note: Linux version 6.14.0-36-generic (x86_64)                       0.925046
= Note: Bluetooth subsystem version 2.22                               0.925048
= New Index: 00:00:00:00:00:00 (Primary,UART,hci1)              [hci1] 0.925048
= New Index: 48:5F:99:8E:E0:64 (Primary,USB,hci0)               [hci0] 0.925049
= Open Index: 00:00:00:00:00:00                                 [hci1] 1.038211
= Index Info: 00:00:00:00:00:00 (Nordic Semiconductor ASA)      [hci1] 1.038215
@ USER Open: main (privileged) version 2.22            {0x0001} [hci1] 1.038218
< HCI Command: Reset (0x03|0x0003) plen 0                    #1 [hci1] 1.038640
> HCI Event: Command Complete (0x0e) plen 4                  #2 [hci1] 1.039086
      Reset (0x03|0x0003) ncmd 1
        Status: Success (0x00)
< HCI Command: Read Local Supported... (0x04|0x0003) plen 0  #3 [hci1] 1.058158
> HCI Event: Command Complete (0x0e) plen 12                 #4 [hci1] 1.058647
      Read Local Supported Features (0x04|0x0003) ncmd 1
        Status: Success (0x00)
        Features: 0x00 0x00 0x00 0x00 0x60 0x00 0x00 0x00
          BR/EDR Not Supported
          LE Supported (Controller)
< HCI Command: Read Local Version In.. (0x04|0x0001) plen 0  #5 [hci1] 1.078213
> HCI Event: Command Complete (0x0e) plen 12                 #6 [hci1] 1.078692
      Read Local Version Information (0x04|0x0001) ncmd 1
        Status: Success (0x00)
        HCI version: Reserved (0x0f) - Revision 12393 (0x3069)
        LMP version: Reserved (0x0f) - Subversion 12393 (0x3069)
        Manufacturer: Nordic Semiconductor ASA (89)
< HCI Command: Read Local Supported... (0x04|0x0002) plen 0  #7 [hci1] 1.098198
> HCI Event: Command Complete (0x0e) plen 68                 #8 [hci1] 1.099235
      Read Local Supported Commands (0x04|0x0002) ncmd 1
        Status: Success (0x00)
        Commands: 119 entries
          Disconnect (Octet 0 - Bit 5)
          Read Remote Version Information (Octet 2 - Bit 7)
          Set Event Mask (Octet 5 - Bit 6)
          Reset (Octet 5 - Bit 7)
          Read Connection Accept Timeout (Octet 7 - Bit 2)
          Write Connection Accept Timeout (Octet 7 - Bit 3)
          Read Transmit Power Level (Octet 10 - Bit 2)
          Set Controller To Host Flow Control (Octet 10 - Bit 5)
          Host Buffer Size (Octet 10 - Bit 6)
          Host Number of Completed Packets (Octet 10 - Bit 7)
          Read Local Version Information (Octet 14 - Bit 3)
          Read Local Supported Features (Octet 14 - Bit 5)
          Read BD ADDR (Octet 15 - Bit 1)
          Read RSSI (Octet 15 - Bit 5)
          Set Event Mask Page 2 (Octet 22 - Bit 2)
          LE Set Event Mask (Octet 25 - Bit 0)
          LE Read Buffer Size (Octet 25 - Bit 1)
          LE Read Local Supported Features (Octet 25 - Bit 2)
          LE Set Random Address (Octet 25 - Bit 4)
          LE Set Advertising Parameters (Octet 25 - Bit 5)
          LE Read Advertising Channel TX Power (Octet 25 - Bit 6)
          LE Set Advertising Data (Octet 25 - Bit 7)
          LE Set Scan Response Data (Octet 26 - Bit 0)
          LE Set Advertise Enable (Octet 26 - Bit 1)
          LE Set Scan Parameters (Octet 26 - Bit 2)
          LE Set Scan Enable (Octet 26 - Bit 3)
          LE Create Connection (Octet 26 - Bit 4)
          LE Create Connection Cancel (Octet 26 - Bit 5)
          LE Read Accept List Size (Octet 26 - Bit 6)
          LE Clear Accept List (Octet 26 - Bit 7)
          LE Add Device To Accept List (Octet 27 - Bit 0)
          LE Remove Device From Accept List (Octet 27 - Bit 1)
          LE Connection Update (Octet 27 - Bit 2)
          LE Set Host Channel Classification (Octet 27 - Bit 3)
          LE Read Channel Map (Octet 27 - Bit 4)
          LE Read Remote Used Features (Octet 27 - Bit 5)
          LE Encrypt (Octet 27 - Bit 6)
          LE Rand (Octet 27 - Bit 7)
          LE Start Encryption (Octet 28 - Bit 0)
          LE Long Term Key Request Reply (Octet 28 - Bit 1)
          LE Long Term Key Request Neg Reply (Octet 28 - Bit 2)
          LE Read Supported States (Octet 28 - Bit 3)
          LE Receiver Test (Octet 28 - Bit 4)
          LE Transmitter Test (Octet 28 - Bit 5)
          LE Test End (Octet 28 - Bit 6)
          Read Authenticated Payload Timeout (Octet 32 - Bit 4)
          Write Authenticated Payload Timeout (Octet 32 - Bit 5)
          LE Set Data Length (Octet 33 - Bit 6)
          LE Read Suggested Default Data Length (Octet 33 - Bit 7)
          LE Write Suggested Default Data Length (Octet 34 - Bit 0)
          LE Add Device To Resolving List (Octet 34 - Bit 3)
          LE Remove Device From Resolving List (Octet 34 - Bit 4)
          LE Clear Resolving List (Octet 34 - Bit 5)
          LE Read Resolving List Size (Octet 34 - Bit 6)
          LE Set Address Resolution Enable (Octet 35 - Bit 1)
          LE Set Resolvable Private Address Timeout (Octet 35 - Bit 2)
          LE Read Maximum Data Length (Octet 35 - Bit 3)
          LE Read PHY (Octet 35 - Bit 4)
          LE Set Default PHY (Octet 35 - Bit 5)
          LE Set PHY (Octet 35 - Bit 6)
          LE Enhanced Receiver Test (Octet 35 - Bit 7)
          LE Enhanced Transmitter Test (Octet 36 - Bit 0)
          LE Set Advertising Set Random Address (Octet 36 - Bit 1)
          LE Set Extended Advertising Parameters (Octet 36 - Bit 2)
          LE Set Extended Advertising Data (Octet 36 - Bit 3)
          LE Set Extended Scan Response Data (Octet 36 - Bit 4)
          LE Set Extended Advertising Enable (Octet 36 - Bit 5)
          LE Read Maximum Advertising Data Length (Octet 36 - Bit 6)
          LE Read Number of Supported Advertising Sets (Octet 36 - Bit 7)
          LE Remove Advertising Set (Octet 37 - Bit 0)
          LE Clear Advertising Sets (Octet 37 - Bit 1)
          LE Set Periodic Advertising Parameters (Octet 37 - Bit 2)
          LE Set Periodic Advertising Data (Octet 37 - Bit 3)
          LE Set Periodic Advertising Enable (Octet 37 - Bit 4)
          LE Set Extended Scan Parameters (Octet 37 - Bit 5)
          LE Set Extended Scan Enable (Octet 37 - Bit 6)
          LE Extended Create Connection (Octet 37 - Bit 7)
          LE Periodic Advertising Create Sync (Octet 38 - Bit 0)
          LE Periodic Advertising Create Sync Cancel (Octet 38 - Bit 1)
          LE Periodic Advertising Terminate Sync (Octet 38 - Bit 2)
          LE Add Device To Periodic Advertiser List (Octet 38 - Bit 3)
          LE Remove Device From Periodic Advertiser List (Octet 38 - Bit 4)
          LE Clear Periodic Advertiser List (Octet 38 - Bit 5)
          LE Read Periodic Advertiser List Size (Octet 38 - Bit 6)
          LE Read Transmit Power (Octet 38 - Bit 7)
          LE Read RF Path Compensation (Octet 39 - Bit 0)
          LE Write RF Path Compensation (Octet 39 - Bit 1)
          LE Set Privacy Mode (Octet 39 - Bit 2)
          LE Periodic Advertising Receive Enable (Octet 40 - Bit 5)
          LE Periodic Advertising Sync Transfer (Octet 40 - Bit 6)
          LE Periodic Advertising Set Info Transfer (Octet 40 - Bit 7)
          LE Periodic Advertising Sync Transfer Parameters (Octet 41 - Bit 0)
          LE Set Default Periodic Advertisng Sync Transfer Parameters (Octet 41 - Bit 1)
          LE Read Buffer v2 (Octet 41 - Bit 5)
          LE Read ISO TX Sync (Octet 41 - Bit 6)
          LE Set Connected Isochronous Group Parameters (Octet 41 - Bit 7)
          LE Set Connected Isochronous Group Parameters Test (Octet 42 - Bit 0)
          LE Create Connected Isochronous Stream (Octet 42 - Bit 1)
          LE Remove Connected Isochronous Group (Octet 42 - Bit 2)
          LE Accept Connected Isochronous Stream Request (Octet 42 - Bit 3)
          LE Reject Connected Isochronous Stream Request (Octet 42 - Bit 4)
          LE Create Broadcast Isochronous Group (Octet 42 - Bit 5)
          LE Create Broadcast Isochronous Group Test (Octet 42 - Bit 6)
          LE Terminate Broadcast Isochronous Group (Octet 42 - Bit 7)
          LE Broadcast Isochronous Group Create Sync (Octet 43 - Bit 0)
          LE Broadcast Isochronous Group Terminate Sync (Octet 43 - Bit 1)
          LE Request Peer SCA (Octet 43 - Bit 2)
          LE Setup Isochronous Data Path (Octet 43 - Bit 3)
          LE Remove Isochronous Data Path (Octet 43 - Bit 4)
          LE Isochronous Transmit Test (Octet 43 - Bit 5)
          LE Isochronous Receive Test (Octet 43 - Bit 6)
          LE Isochronous Read Test Counters (Octet 43 - Bit 7)
          LE Isochronous Read Test Counters (Octet 44 - Bit 0)
          LE Set Host Feature (Octet 44 - Bit 1)
          Octet 44 - Bit 2 
          Octet 45 - Bit 6 
          Octet 46 - Bit 0 
          Octet 46 - Bit 1 
          Octet 46 - Bit 2 
< HCI Command: Host Buffer Size (0x03|0x0033) plen 7         #9 [hci1] 1.118204
        ACL MTU: 255  ACL max packet: 16
        SCO MTU: 0    SCO max packet: 0
> HCI Event: Command Complete (0x0e) plen 4                 #10 [hci1] 1.118737
      Host Buffer Size (0x03|0x0033) ncmd 1
        Status: Success (0x00)
< HCI Command: Set Controller To Ho.. (0x03|0x0031) plen 1  #11 [hci1] 1.138142
        Flow control: ACL Data Packets (0x01)
> HCI Event: Command Complete (0x0e) plen 4                 #12 [hci1] 1.138586
      Set Controller To Host Flow Control (0x03|0x0031) ncmd 1
        Status: Success (0x00)
< HCI Command: LE Read Local Suppor.. (0x08|0x0003) plen 0  #13 [hci1] 1.158203
> HCI Event: Command Complete (0x0e) plen 12                #14 [hci1] 1.158690
      LE Read Local Supported Features (0x08|0x0003) ncmd 1
        Status: Success (0x00)
        Features: 0xfd 0x79 0x00 0xf7 0x30 0x01 0x00 0x00
          LE Encryption
          Extended Reject Indication
          Peripheral-initiated Features Exchange
          LE Ping
          LE Data Packet Length Extension
          LL Privacy
          Extended Scanner Filter Policies
          LE 2M PHY
          LE Coded PHY
          LE Extended Advertising
          LE Periodic Advertising
          Channel Selection Algorithm #2
          Periodic Advertising Sync Transfer - Sender
          Periodic Advertising Sync Transfer - Recipient
          Sleep Clock Accuracy Updates
          Connected Isochronous Stream - Central
          Connected Isochronous Stream - Peripheral
          Isochronous Broadcaster
          Synchronized Receiver
          Periodic Advertising ADI support
          Connection Subrating
          Unknown features (0x0000010000000000)
< HCI Command: LE Set Host Feature (0x08|0x0074) plen 2     #15 [hci1] 1.178231
        Bit Number: 32
          Connected Isochronous Stream (Host Support)
        Bit Value: 1
> HCI Event: Command Complete (0x0e) plen 4                 #16 [hci1] 1.178651
      LE Set Host Feature (0x08|0x0074) ncmd 1
        Status: Success (0x00)
< HCI Command: LE Read Buffer v2 (0x08|0x0060) plen 0       #17 [hci1] 1.198205
> HCI Event: Command Complete (0x0e) plen 10                #18 [hci1] 1.198703
      LE Read Buffer v2 (0x08|0x0060) ncmd 1
        Status: Success (0x00)
        ACL MTU: 27
        ACL max packet: 3
        ISO MTU: 318
        ISO max packet: 3
< HCI Command: LE Read Maximum Adve.. (0x08|0x003a) plen 0  #19 [hci1] 1.218232
> HCI Event: Command Complete (0x0e) plen 6                 #20 [hci1] 1.218646
      LE Read Maximum Advertising Data Length (0x08|0x003a) ncmd 1
        Status: Success (0x00)
        Max length: 1650
< HCI Command: LE Read Supported St.. (0x08|0x001c) plen 0  #21 [hci1] 1.238167
> HCI Event: Command Complete (0x0e) plen 12                #22 [hci1] 1.238625
      LE Read Supported States (0x08|0x001c) ncmd 1
        Status: Success (0x00)
        States: 0x000003ff3e0306ff
          Non-connectable Advertising State
          Scannable Advertising State
          Connectable Advertising State
          High Duty Cycle Directed Advertising State
          Passive Scanning State
          Active Scanning State
          Initiating State
            and Connection State (Central Role)
          Connection State (Peripheral Role)
          Scannable Advertising State
            and Passive Scanning State
          Connectable Advertising State
            and Passive Scanning State
          Non-connectable Advertising State
            and Initiating State
          Scannable Advertising State
            and Initiating State
          Active Scanning State
            and Connection State (Central Role)
          Passive Scanning State
            and Connection State (Peripheral Role)
          Active Scanning State
            and Connection State (Peripheral Role)
          Initiating State
            and Connection State (Central Role)
            and Central Role & Central Role
          Low Duty Cycle Directed Advertising State
          Connectable Advertising State
            and Initiating State
            and Central Role & Peripheral Role
          High Duty Cycle Directed Advertising State
            and Initiating State
            and Central Role & Peripheral Role
          Low Duty Cycle Directed Advertising State
            and Initiating State
            and Central Role & Peripheral Role
          Connectable Advertising State
            and Connection State (Central Role)
            and Central Role & Peripheral Role
          High Duty Cycle Directed Advertising State
            and Connection State (Central Role)
            and Central Role & Peripheral Role
          Low Duty Cycle Directed Advertising State
            and Connection State (Central Role)
            and Central Role & Peripheral Role
          Connectable Advertising State
            and Connection State (Peripheral Role)
            and Central Role & Peripheral Role
          High Duty Cycle Directed Advertising State
            and Connection State (Peripheral Role)
            and Peripheral Role & Peripheral Role
          Low Duty Cycle Directed Advertising State
            and Connection State (Peripheral Role)
            and Peripheral Role & Peripheral Role
          Initiating State
            and Connection State (Peripheral Role)
            and Central Role & Peripheral Role
< HCI Command: LE Read Maximum Data.. (0x08|0x002f) plen 0  #23 [hci1] 1.258169
> HCI Event: Command Complete (0x0e) plen 12                #24 [hci1] 1.258608
      LE Read Maximum Data Length (0x08|0x002f) ncmd 1
        Status: Success (0x00)
        Max TX octets: 251
        Max TX time: 2704
        Max RX octets: 251
        Max RX time: 2704
< HCI Command: LE Write Suggested D.. (0x08|0x0024) plen 4  #25 [hci1] 1.278202
        TX octets: 251
        TX time: 2704
> HCI Event: Command Complete (0x0e) plen 4                 #26 [hci1] 1.278627
      LE Write Suggested Default Data Length (0x08|0x0024) ncmd 1
        Status: Success (0x00)
< HCI Command: LE Read Resolving Li.. (0x08|0x002a) plen 0  #27 [hci1] 1.298194
> HCI Event: Command Complete (0x0e) plen 5                 #28 [hci1] 1.298646
      LE Read Resolving List Size (0x08|0x002a) ncmd 1
        Status: Success (0x00)
        Size: 8
< HCI Command: LE Set Event Mask (0x08|0x0001) plen 8       #29 [hci1] 1.318218
        Mask: 0x000002023f87fa5e
          LE Advertising Report
          LE Connection Update Complete
          LE Read Remote Used Features Complete
          LE Long Term Key Request
          LE Data Length Change
          LE Enhanced Connection Complete
          LE PHY Update Complete
          LE Extended Advertising Report
          LE Periodic Advertising Sync Established
          LE Periodic Advertising Report
          LE Periodic Advertising Sync Lost
          LE Extended Scan Timeout
          LE Extended Advertising Set Terminated
          LE Scan Request Received
          LE Periodic Advertising Sync Transfer Rvc
          LE CIS Established
          LE CIS Request
          LE Create BIG Complete
          LE Terminate BIG Complete
          LE BIG Sync Estabilished Complete
          LE BIG Sync Lost
          LE BIG Info Advertising Report
          Unknown mask (0x0000020000000000)
> HCI Event: Command Complete (0x0e) plen 4                 #30 [hci1] 1.318745
      LE Set Event Mask (0x08|0x0001) ncmd 1
        Status: Success (0x00)
< HCI Command: Set Event Mask (0x03|0x0001) plen 8          #31 [hci1] 1.338203
        Mask: 0x2000800002008890
          Disconnection Complete
          Encryption Change
          Read Remote Version Information Complete
          Hardware Error
          Data Buffer Overflow
          Encryption Key Refresh Complete
          LE Meta
> HCI Event: Command Complete (0x0e) plen 4                 #32 [hci1] 1.338700
      Set Event Mask (0x03|0x0001) ncmd 1
        Status: Success (0x00)
< HCI Command: Read BD ADDR (0x04|0x0009) plen 0            #33 [hci1] 1.358212
> HCI Event: Command Complete (0x0e) plen 10                #34 [hci1] 1.358758
      Read BD ADDR (0x04|0x0009) ncmd 1
        Status: Success (0x00)
        Address: 00:00:00:00:00:00 (OUI 00-00-00)
< HCI Command: LE Set Random Address (0x08|0x0005) plen 6   #35 [hci1] 1.378218
        Address: D5:B6:CC:31:DB:3B (Static)
> HCI Event: Command Complete (0x0e) plen 4                 #36 [hci1] 1.378736
      LE Set Random Address (0x08|0x0005) ncmd 1
        Status: Success (0x00)
< HCI Command: LE Set Extended Adv.. (0x08|0x0036) plen 25  #37 [hci1] 3.918752
        Handle: 0x00
        Properties: 0x0013
          Connectable
          Scannable
          Use legacy advertising PDUs: ADV_IND
        Min advertising interval: 100.000 msec (0x00a0)
        Max advertising interval: 150.000 msec (0x00f0)
        Channel map: 37, 38, 39 (0x07)
        Own address type: Random (0x01)
        Peer address type: Public (0x00)
        Peer address: 00:00:00:00:00:00 (OUI 00-00-00)
        Filter policy: Allow Scan Request from Any, Allow Connect Request from Any (0x00)
        TX power: Host has no preference (0x7f)
        Primary PHY: LE 1M (0x01)
        Secondary max skip: 0x00
        Secondary PHY: LE 1M (0x01)
        SID: 0x00
        Scan request notifications: Disabled (0x00)
> HCI Event: Command Complete (0x0e) plen 5                 #38 [hci1] 3.919543
      LE Set Extended Advertising Parameters (0x08|0x0036) ncmd 1
        Status: Success (0x00)
        TX power (selected): 0 dbm (0x00)
< HCI Command: LE Set Advertising S.. (0x08|0x0035) plen 7  #39 [hci1] 3.938238
        Advertising handle: 0x00
        Advertising random address: D5:B6:CC:31:DB:3B (Static)
> HCI Event: Command Complete (0x0e) plen 4                 #40 [hci1] 3.938767
      LE Set Advertising Set Random Address (0x08|0x0035) ncmd 1
        Status: Success (0x00)
< HCI Command: LE Set Extended Adv.. (0x08|0x0037) plen 22  #41 [hci1] 3.958282
        Handle: 0x00
        Operation: Complete extended advertising data (0x03)
        Fragment preference: Minimize fragmentation (0x01)
        Data length: 0x12
        Flags: 0x06
          LE General Discoverable Mode
          BR/EDR Not Supported
        Name (complete): Tester_F6B11A
> HCI Event: Command Complete (0x0e) plen 4                 #42 [hci1] 3.958946
      LE Set Extended Advertising Data (0x08|0x0037) ncmd 1
        Status: Success (0x00)
< HCI Command: LE Set Extended Scan.. (0x08|0x0038) plen 4  #43 [hci1] 3.978233
        Handle: 0x00
        Operation: Complete scan response data (0x03)
        Fragment preference: Minimize fragmentation (0x01)
        Data length: 0x00
> HCI Event: Command Complete (0x0e) plen 4                 #44 [hci1] 3.978707
      LE Set Extended Scan Response Data (0x08|0x0038) ncmd 1
        Status: Success (0x00)
< HCI Command: LE Set Extended Adve.. (0x08|0x0039) plen 6  #45 [hci1] 3.998242
        Extended advertising: Enabled (0x01)
        Number of sets: 1 (0x01)
        Entry 0
          Handle: 0x00
          Duration: 0 ms (0x00)
          Max ext adv events: 0
> HCI Event: Command Complete (0x0e) plen 4                 #46 [hci1] 3.998771
      LE Set Extended Advertising Enable (0x08|0x0039) ncmd 1
        Status: Success (0x00)
> HCI Event: LE Meta Event (0x3e) plen 31                   #47 [hci1] 4.110635
      LE Enhanced Connection Complete (0x0a)
        Status: Success (0x00)
        Handle: 2325
        Role: Peripheral (0x01)
        Peer address type: Public (0x00)
        Peer address: DF:A9:FF:F6:B1:1A (OUI DF-A9-FF)
        Local resolvable private address: 00:00:00:00:00:00 (Non-Resolvable)
        Peer resolvable private address: 00:00:00:00:00:00 (Non-Resolvable)
        Connection interval: 87.50 msec (0x0046)
        Connection latency: 0 (0x0000)
        Supervision timeout: 25120 msec (0x09d0)
        Central clock accuracy: 0x01
> HCI Event: LE Meta Event (0x3e) plen 6                    #48 [hci1] 4.110637
      LE Advertising Set Terminated (0x12)
        Status: Success (0x00)
        Handle: 0
        Connection handle: 2325
        Number of completed extended advertising events: 0
< HCI Command: LE Read Remote Used... (0x08|0x0016) plen 2  #49 [hci1] 4.118620
        Handle: 2325 Address: DF:A9:FF:F6:B1:1A (OUI DF-A9-FF)
< ACL Data TX: Handle 2325 flags 0x00 dlen 7                #50 [hci1] 4.118628
      ATT: Exchange MTU Request (0x02) len 2
        Client RX MTU: 251
> HCI Event: Command Status (0x0f) plen 4                   #51 [hci1] 4.119184
      LE Read Remote Used Features (0x08|0x0016) ncmd 1
        Status: Success (0x00)
> HCI Event: Number of Completed Packets (0x13) plen 5      #52 [hci1] 4.286606
        Num handles: 1
        Handle: 2325 Address: DF:A9:FF:F6:B1:1A (OUI DF-A9-FF)
        Count: 1
        #50: len 7 (0 Kb/s)
        Latency: 167 msec (167-167 msec ~167 msec)
> HCI Event: LE Meta Event (0x3e) plen 12                   #53 [hci1] 4.374383
      LE Read Remote Used Features (0x04)
        Status: Success (0x00)
        Handle: 2325 Address: DF:A9:FF:F6:B1:1A (OUI DF-A9-FF)
        Features: 0x2d 0x49 0x00 0xf7 0x67 0xd9 0x00 0x80
          LE Encryption
          Extended Reject Indication
          Peripheral-initiated Features Exchange
          LE Data Packet Length Extension
          LE 2M PHY
          LE Coded PHY
          Channel Selection Algorithm #2
          Periodic Advertising Sync Transfer - Sender
          Periodic Advertising Sync Transfer - Recipient
          Sleep Clock Accuracy Updates
          Connected Isochronous Stream - Central
          Connected Isochronous Stream - Peripheral
          Isochronous Broadcaster
          Synchronized Receiver
          Connected Isochronous Stream (Host Support)
          LE Power Control Request
          LE Power Control Request
          Connection Subrating
          Connection Subrating (Host Support)
          Unknown features (0x8000d90000000000)
> ACL Data RX: Handle 2325 flags 0x02 dlen 7                #54 [hci1] 4.811708
      ATT: Exchange MTU Request (0x02) len 2
        Client RX MTU: 64
> ACL Data RX: Handle 2325 flags 0x02 dlen 7                #55 [hci1] 4.812067
      ATT: Exchange MTU Response (0x03) len 2
        Server RX MTU: 64
< HCI Command: Host Number of Compl.. (0x03|0x0035) plen 5  #56 [hci1] 4.818605
        Num handles: 1
        Handle: 2325 Address: DF:A9:FF:F6:B1:1A (OUI DF-A9-FF)
        Count: 1
< ACL Data TX: Handle 2325 flags 0x00 dlen 7                #57 [hci1] 4.818693
      ATT: Exchange MTU Response (0x03) len 2
        Server RX MTU: 251
< HCI Command: Host Number of Compl.. (0x03|0x0035) plen 5  #58 [hci1] 4.819046
        Num handles: 1
        Handle: 2325 Address: DF:A9:FF:F6:B1:1A (OUI DF-A9-FF)
        Count: 1
> HCI Event: Number of Completed Packets (0x13) plen 5      #59 [hci1] 4.986528
        Num handles: 1
        Handle: 2325 Address: DF:A9:FF:F6:B1:1A (OUI DF-A9-FF)
        Count: 1
        #57: len 7 (0 Kb/s)
        Latency: 167 msec (167-167 msec ~167 msec)
> ACL Data RX: Handle 2325 flags 0x02 dlen 11               #60 [hci1] 6.999172
      SMP: Pairing Request (0x01) len 6
        IO capability: KeyboardDisplay (0x04)
        OOB data: Authentication data not present (0x00)
        Authentication requirement: Bonding, No MITM, SC, No Keypresses (0x09)
        Max encryption key size: 16
        Initiator key distribution: EncKey IdKey (0x03)
        Responder key distribution: EncKey IdKey Sign (0x07)
< HCI Command: Host Number of Compl.. (0x03|0x0035) plen 5  #61 [hci1] 7.018787
        Num handles: 1
        Handle: 2325 Address: DF:A9:FF:F6:B1:1A (OUI DF-A9-FF)
        Count: 1
< ACL Data TX: Handle 2325 flags 0x00 dlen 11               #62 [hci1] 7.018858
      SMP: Pairing Response (0x02) len 6
        IO capability: NoInputNoOutput (0x03)
        OOB data: Authentication data not present (0x00)
        Authentication requirement: Bonding, No MITM, SC, No Keypresses (0x09)
        Max encryption key size: 16
        Initiator key distribution: IdKey (0x02)
        Responder key distribution: <none> (0x00)
> HCI Event: Number of Completed Packets (0x13) plen 5      #63 [hci1] 7.174271
        Num handles: 1
        Handle: 2325 Address: DF:A9:FF:F6:B1:1A (OUI DF-A9-FF)
        Count: 1
        #62: len 11 (0 Kb/s)
        Latency: 155 msec (155-167 msec ~161 msec)
> ACL Data RX: Handle 2325 flags 0x02 dlen 27               #64 [hci1] 7.174598
> ACL Data RX: Handle 2325 flags 0x01 dlen 27               #65 [hci1] 7.175043
> ACL Data RX: Handle 2325 flags 0x01 dlen 15               #66 [hci1] 7.175530
      SMP: Pairing Public Key (0x0c) len 64
        X: 6ff6c1eab98a498ba49648790b0d4b87a9fd17e664543e91a145e667cb66adc8
        Y: e2365d306a1faf4afd15b1066fed9d4c27e6dfdfa611e078ae43162214593d39
< HCI Command: Host Number of Compl.. (0x03|0x0035) plen 5  #67 [hci1] 7.179108
        Num handles: 1
        Handle: 2325 Address: DF:A9:FF:F6:B1:1A (OUI DF-A9-FF)
        Count: 1
< HCI Command: Host Number of Compl.. (0x03|0x0035) plen 5  #68 [hci1] 7.179336
        Num handles: 1
        Handle: 2325 Address: DF:A9:FF:F6:B1:1A (OUI DF-A9-FF)
        Count: 1
< HCI Command: Host Number of Compl.. (0x03|0x0035) plen 5  #69 [hci1] 7.179613
        Num handles: 1
        Handle: 2325 Address: DF:A9:FF:F6:B1:1A (OUI DF-A9-FF)
        Count: 1
< ACL Data TX: Handle 2325 flags 0x00 dlen 27               #70 [hci1] 7.179655
< ACL Data TX: Handle 2325 flags 0x01 dlen 27               #71 [hci1] 7.179681
< ACL Data TX: Handle 2325 flags 0x01 dlen 15               #72 [hci1] 7.179712
      SMP: Pairing Public Key (0x0c) len 64
        X: 98308440221e2d910f0e54b71e7ec652857aa9b5a0dc65028824cc19db1226e9
        Y: 67a4816bcb62efb21701e31fdb27561a6217575fb007a8bbdabe7e28b6f68482
> HCI Event: Number of Completed Packets (0x13) plen 5      #73 [hci1] 7.262172
        Num handles: 1
        Handle: 2325 Address: DF:A9:FF:F6:B1:1A (OUI DF-A9-FF)
        Count: 1
        #70: len 27 (2 Kb/s)
        Latency: 82 msec (82-167 msec ~122 msec)
> HCI Event: Number of Completed Packets (0x13) plen 5      #74 [hci1] 7.262764
        Num handles: 1
        Handle: 2325 Address: DF:A9:FF:F6:B1:1A (OUI DF-A9-FF)
        Count: 1
        #71: len 27 (2 Kb/s)
        Latency: 83 msec (82-167 msec ~102 msec)
< ACL Data TX: Handle 2325 flags 0x00 dlen 21               #75 [hci1] 7.278682
      SMP: Pairing Confirm (0x03) len 16
        Confim value: 198b7402a4ddbc2f10b96f35cbef417a
> HCI Event: Number of Completed Packets (0x13) plen 5      #76 [hci1] 7.348955
        Num handles: 1
        Handle: 2325 Address: DF:A9:FF:F6:B1:1A (OUI DF-A9-FF)
        Count: 1
        #72: len 15 (0 Kb/s)
        Latency: 169 msec (82-169 msec ~135 msec)
> HCI Event: Number of Completed Packets (0x13) plen 5      #77 [hci1] 7.436697
        Num handles: 1
        Handle: 2325 Address: DF:A9:FF:F6:B1:1A (OUI DF-A9-FF)
        Count: 1
        #75: len 21 (1 Kb/s)
        Latency: 158 msec (82-169 msec ~146 msec)
> ACL Data RX: Handle 2325 flags 0x02 dlen 21               #78 [hci1] 7.436999
      SMP: Pairing Random (0x04) len 16
        Random value: 70286738470cf0350000000000000000
< HCI Command: Host Number of Compl.. (0x03|0x0035) plen 5  #79 [hci1] 7.438752
        Num handles: 1
        Handle: 2325 Address: DF:A9:FF:F6:B1:1A (OUI DF-A9-FF)
        Count: 1
< ACL Data TX: Handle 2325 flags 0x00 dlen 21               #80 [hci1] 7.438776
      SMP: Pairing Random (0x04) len 16
        Random value: 8e6108f966a694cbe26df70bb96773e6
> HCI Event: Number of Completed Packets (0x13) plen 5      #81 [hci1] 7.611548
        Num handles: 1
        Handle: 2325 Address: DF:A9:FF:F6:B1:1A (OUI DF-A9-FF)
        Count: 1
        #80: len 21 (0 Kb/s)
        Latency: 172 msec (82-172 msec ~159 msec)
> ACL Data RX: Handle 2325 flags 0x02 dlen 21               #82 [hci1] 7.786887
      SMP: Pairing DHKey Check (0x0d) len 16
        E: 463f4889cf37eaa1f3cf6079b41fb706
< HCI Command: Host Number of Compl.. (0x03|0x0035) plen 5  #83 [hci1] 7.799119
        Num handles: 1
        Handle: 2325 Address: DF:A9:FF:F6:B1:1A (OUI DF-A9-FF)
        Count: 1
< ACL Data TX: Handle 2325 flags 0x00 dlen 21               #84 [hci1] 7.799228
      SMP: Pairing DHKey Check (0x0d) len 16
        E: 05dac412cfdb72c7d7cb02c3eab75f21
> HCI Event: Number of Completed Packets (0x13) plen 5      #85 [hci1] 7.961550
        Num handles: 1
        Handle: 2325 Address: DF:A9:FF:F6:B1:1A (OUI DF-A9-FF)
        Count: 1
        #84: len 21 (1 Kb/s)
        Latency: 162 msec (82-172 msec ~161 msec)
> HCI Event: LE Meta Event (0x3e) plen 13                   #86 [hci1] 8.049582
      LE Long Term Key Request (0x05)
        Handle: 2325 Address: DF:A9:FF:F6:B1:1A (OUI DF-A9-FF)
        Random number: 0x0000000000000000
        Encrypted diversifier: 0x0000
< HCI Command: LE Long Term Key Re.. (0x08|0x001a) plen 18  #87 [hci1] 8.058568
        Handle: 2325 Address: DF:A9:FF:F6:B1:1A (OUI DF-A9-FF)
        Long term key: fb34281cd1ec0adc0eb723e17c389f21
> HCI Event: Command Complete (0x0e) plen 6                 #88 [hci1] 8.059249
      LE Long Term Key Request Reply (0x08|0x001a) ncmd 1
        Status: Success (0x00)
        Handle: 2325 Address: DF:A9:FF:F6:B1:1A (OUI DF-A9-FF)
> HCI Event: Encryption Change (0x08) plen 4                #89 [hci1] 8.486762
        Status: Success (0x00)
        Handle: 2325 Address: DF:A9:FF:F6:B1:1A (OUI DF-A9-FF)
        Encryption: Enabled with AES-CCM (0x01)
> ACL Data RX: Handle 2325 flags 0x02 dlen 21               #90 [hci1] 8.574330
      SMP: Identity Information (0x08) len 16
        Identity resolving key: 5e8e68cf291e27827d14a42874bc507f
< HCI Command: Host Number of Compl.. (0x03|0x0035) plen 5  #91 [hci1] 8.609030
        Num handles: 1
        Handle: 2325 Address: DF:A9:FF:F6:B1:1A (OUI DF-A9-FF)
        Count: 1
> ACL Data RX: Handle 2325 flags 0x02 dlen 12               #92 [hci1] 8.749244
      SMP: Identity Address Information (0x09) len 7
        Address: DF:A9:FF:F6:B1:1A (OUI DF-A9-FF)
< HCI Command: LE Add Device To Re.. (0x08|0x0027) plen 39  #93 [hci1] 8.758845
        Address type: Public (0x00)
        Address: DF:A9:FF:F6:B1:1A (OUI DF-A9-FF)
        Peer identity resolving key: 5e8e68cf291e27827d14a42874bc507f
        Local identity resolving key: 00000000000000000000000000000000
> HCI Event: Command Complete (0x0e) plen 4                 #94 [hci1] 8.759931
      LE Add Device To Resolving List (0x08|0x0027) ncmd 1
        Status: Success (0x00)
< HCI Command: LE Set Privacy Mode (0x08|0x004e) plen 8     #95 [hci1] 8.778638
        Peer Identity address type: Public (0x00)
        Peer Identity address: DF:A9:FF:F6:B1:1A (OUI DF-A9-FF)
        Privacy Mode: Use Device Privacy (0x01)
> HCI Event: Command Complete (0x0e) plen 4                 #96 [hci1] 8.779159
      LE Set Privacy Mode (0x08|0x004e) ncmd 1
        Status: Success (0x00)
< HCI Command: LE Set Address Resol.. (0x08|0x002d) plen 1  #97 [hci1] 8.798647
        Address resolution: Enabled (0x01)
> HCI Event: Command Complete (0x0e) plen 4                 #98 [hci1] 8.799168
      LE Set Address Resolution Enable (0x08|0x002d) ncmd 1
        Status: Success (0x00)
< HCI Command: Host Number of Compl.. (0x03|0x0035) plen 5  #99 [hci1] 8.818526
        Num handles: 1
        Handle: 2325 Address: DF:A9:FF:F6:B1:1A (OUI DF-A9-FF)
        Count: 1
> ACL Data RX: Handle 2325 flags 0x02 dlen 11              #100 [hci1] 8.836739
      ATT: Read By Group Type Request (0x10) len 6
        Handle range: 0x0001-0xffff
        Attribute group type: Primary Service (0x2800)
< HCI Command: Host Number of Comp.. (0x03|0x0035) plen 5  #101 [hci1] 8.838774
        Num handles: 1
        Handle: 2325 Address: DF:A9:FF:F6:B1:1A (OUI DF-A9-FF)
        Count: 1
< ACL Data TX: Handle 2325 flags 0x00 dlen 27              #102 [hci1] 8.838940
< ACL Data TX: Handle 2325 flags 0x01 dlen 15              #103 [hci1] 8.838952
      ATT: Read By Group Type Response (0x11) len 37
        Attribute data length: 6
        Attribute group list: 6 entries
        Handle range: 0x0001-0x000a
        UUID: Generic Attribute Profile (0x1801)
        Handle range: 0x000b-0x0011
        UUID: Generic Access Profile (0x1800)
        Handle range: 0x0012-0x0020
        UUID: Device Information (0x180a)
        Handle range: 0x0021-0x0023
        UUID: Immediate Alert (0x1802)
        Handle range: 0x0024-0x0036
        UUID: Published Audio Capabilities (0x1850)
        Handle range: 0x0037-0x0046
        UUID: Audio Stream Control (0x184e)
> HCI Event: Number of Completed Packets (0x13) plen 5     #104 [hci1] 8.924759
        Num handles: 1
        Handle: 2325 Address: DF:A9:FF:F6:B1:1A (OUI DF-A9-FF)
        Count: 1
        #102: len 27 (2 Kb/s)
        Latency: 85 msec (82-172 msec ~123 msec)
> HCI Event: Number of Completed Packets (0x13) plen 5     #105 [hci1] 9.011730
        Num handles: 1
        Handle: 2325 Address: DF:A9:FF:F6:B1:1A (OUI DF-A9-FF)
        Count: 1
        #103: len 15 (0 Kb/s)
        Latency: 172 msec (82-172 msec ~148 msec)
> ACL Data RX: Handle 2325 flags 0x02 dlen 11              #106 [hci1] 9.011837
      ATT: Read By Group Type Request (0x10) len 6
        Handle range: 0x0047-0xffff
        Attribute group type: Primary Service (0x2800)
< HCI Command: Host Number of Comp.. (0x03|0x0035) plen 5  #107 [hci1] 9.018896
        Num handles: 1
        Handle: 2325 Address: DF:A9:FF:F6:B1:1A (OUI DF-A9-FF)
        Count: 1
< ACL Data TX: Handle 2325 flags 0x00 dlen 9               #108 [hci1] 9.019127
      ATT: Error Response (0x01) len 4
        Read By Group Type Request (0x10)
        Handle: 0x0047
        Error: Attribute Not Found (0x0a)
> HCI Event: Number of Completed Packets (0x13) plen 5     #109 [hci1] 9.186600
        Num handles: 1
        Handle: 2325 Address: DF:A9:FF:F6:B1:1A (OUI DF-A9-FF)
        Count: 1
        #108: len 9 (0 Kb/s)
        Latency: 167 msec (82-172 msec ~157 msec)
> ACL Data RX: Handle 2325 flags 0x02 dlen 11              #110 [hci1] 9.186829
      ATT: Read By Type Request (0x08) len 6
        Handle range: 0x0001-0x000a
        Attribute type: Characteristic (0x2803)
< HCI Command: Host Number of Comp.. (0x03|0x0035) plen 5  #111 [hci1] 9.199026
        Num handles: 1
        Handle: 2325 Address: DF:A9:FF:F6:B1:1A (OUI DF-A9-FF)
        Count: 1
< ACL Data TX: Handle 2325 flags 0x00 dlen 27              #112 [hci1] 9.199111
< ACL Data TX: Handle 2325 flags 0x01 dlen 7               #113 [hci1] 9.199134
      ATT: Read By Type Response (0x09) len 29
        Attribute data length: 7
        Attribute data list: 4 entries
        Handle: 0x0002
        Value: 200300052a
            Properties: 0x20
              Indicate (0x20)
            Value Handle: 0x0003
            Value UUID: Service Changed (0x2a05)
        Handle: 0x0005
        Value: 0a0600292b
            Properties: 0x0a
              Read (0x02)
              Write (0x08)
            Value Handle: 0x0006
            Value UUID: Client Supported Features (0x2b29)
        Handle: 0x0007
        Value: 0208002a2b
            Properties: 0x02
              Read (0x02)
            Value Handle: 0x0008
            Value UUID: Database Hash (0x2b2a)
        Handle: 0x0009
        Value: 020a003a2b
            Properties: 0x02
              Read (0x02)
            Value Handle: 0x000a
            Value UUID: Server Supported Features (0x2b3a)
> HCI Event: Number of Completed Packets (0x13) plen 5     #114 [hci1] 9.274737
        Num handles: 1
        Handle: 2325 Address: DF:A9:FF:F6:B1:1A (OUI DF-A9-FF)
        Count: 1
        #112: len 27 (2 Kb/s)
        Latency: 75 msec (75-172 msec ~116 msec)
> HCI Event: Number of Completed Packets (0x13) plen 5     #115 [hci1] 9.361600
        Num handles: 1
        Handle: 2325 Address: DF:A9:FF:F6:B1:1A (OUI DF-A9-FF)
        Count: 1
        #113: len 7 (0 Kb/s)
        Latency: 162 msec (75-172 msec ~139 msec)
> ACL Data RX: Handle 2325 flags 0x02 dlen 11              #116 [hci1] 9.361898
      ATT: Read By Type Request (0x08) len 6
        Handle range: 0x000a-0x000a
        Attribute type: Characteristic (0x2803)
< HCI Command: Host Number of Comp.. (0x03|0x0035) plen 5  #117 [hci1] 9.378923
        Num handles: 1
        Handle: 2325 Address: DF:A9:FF:F6:B1:1A (OUI DF-A9-FF)
        Count: 1
< ACL Data TX: Handle 2325 flags 0x00 dlen 9               #118 [hci1] 9.379124
      ATT: Error Response (0x01) len 4
        Read By Type Request (0x08)
        Handle: 0x000a
        Error: Attribute Not Found (0x0a)
> HCI Event: Number of Completed Packets (0x13) plen 5     #119 [hci1] 9.536582
        Num handles: 1
        Handle: 2325 Address: DF:A9:FF:F6:B1:1A (OUI DF-A9-FF)
        Count: 1
        #118: len 9 (0 Kb/s)
        Latency: 157 msec (75-172 msec ~148 msec)
> ACL Data RX: Handle 2325 flags 0x02 dlen 9               #120 [hci1] 9.536825
      ATT: Find Information Request (0x04) len 4
        Handle range: 0x0004-0x0004
< HCI Command: Host Number of Comp.. (0x03|0x0035) plen 5  #121 [hci1] 9.538997
        Num handles: 1
        Handle: 2325 Address: DF:A9:FF:F6:B1:1A (OUI DF-A9-FF)
        Count: 1
< ACL Data TX: Handle 2325 flags 0x00 dlen 10              #122 [hci1] 9.539567
      ATT: Find Information Response (0x05) len 5
        Format: UUID-16 (0x01)
        Handle: 0x0004
        UUID: Client Characteristic Configuration (0x2902)
> HCI Event: Number of Completed Packets (0x13) plen 5     #123 [hci1] 9.711614
        Num handles: 1
        Handle: 2325 Address: DF:A9:FF:F6:B1:1A (OUI DF-A9-FF)
        Count: 1
        #122: len 10 (0 Kb/s)
        Latency: 172 msec (75-172 msec ~160 msec)
> ACL Data RX: Handle 2325 flags 0x02 dlen 11              #124 [hci1] 9.711849
      ATT: Read By Type Request (0x08) len 6
        Handle range: 0x000b-0x0011
        Attribute type: Characteristic (0x2803)
< HCI Command: Host Number of Comp.. (0x03|0x0035) plen 5  #125 [hci1] 9.718932
        Num handles: 1
        Handle: 2325 Address: DF:A9:FF:F6:B1:1A (OUI DF-A9-FF)
        Count: 1
< ACL Data TX: Handle 2325 flags 0x00 dlen 27              #126 [hci1] 9.719071
      ATT: Read By Type Response (0x09) len 22
        Attribute data length: 7
        Attribute data list: 3 entries
        Handle: 0x000c
        Value: 0a0d00002a
            Properties: 0x0a
              Read (0x02)
              Write (0x08)
            Value Handle: 0x000d
            Value UUID: Device Name (0x2a00)
        Handle: 0x000e
        Value: 0a0f00012a
            Properties: 0x0a
              Read (0x02)
              Write (0x08)
            Value Handle: 0x000f
            Value UUID: Appearance (0x2a01)
        Handle: 0x0010
        Value: 021100042a
            Properties: 0x02
              Read (0x02)
            Value Handle: 0x0011
            Value UUID: Peripheral Preferred Connection Parameters (0x2a04)
> HCI Event: Number of Completed Packets (0x13) plen 5     #127 [hci1] 9.886698
        Num handles: 1
        Handle: 2325 Address: DF:A9:FF:F6:B1:1A (OUI DF-A9-FF)
        Count: 1
        #126: len 27 (1 Kb/s)
        Latency: 167 msec (75-172 msec ~163 msec)
> ACL Data RX: Handle 2325 flags 0x02 dlen 11              #128 [hci1] 9.886834
      ATT: Read By Type Request (0x08) len 6
        Handle range: 0x0011-0x0011
        Attribute type: Characteristic (0x2803)
< HCI Command: Host Number of Comp.. (0x03|0x0035) plen 5  #129 [hci1] 9.898922
        Num handles: 1
        Handle: 2325 Address: DF:A9:FF:F6:B1:1A (OUI DF-A9-FF)
        Count: 1
< ACL Data TX: Handle 2325 flags 0x00 dlen 9               #130 [hci1] 9.899067
      ATT: Error Response (0x01) len 4
        Read By Type Request (0x08)
        Handle: 0x0011
        Error: Attribute Not Found (0x0a)
> HCI Event: Number of Completed Packets (0x13) plen 5    #131 [hci1] 10.061621
        Num handles: 1
        Handle: 2325 Address: DF:A9:FF:F6:B1:1A (OUI DF-A9-FF)
        Count: 1
        #130: len 9 (0 Kb/s)
        Latency: 162 msec (75-172 msec ~163 msec)
> ACL Data RX: Handle 2325 flags 0x02 dlen 11             #132 [hci1] 10.061845
      ATT: Read By Type Request (0x08) len 6
        Handle range: 0x0012-0x0020
        Attribute type: Characteristic (0x2803)
< HCI Command: Host Number of Com.. (0x03|0x0035) plen 5  #133 [hci1] 10.078990
        Num handles: 1
        Handle: 2325 Address: DF:A9:FF:F6:B1:1A (OUI DF-A9-FF)
        Count: 1
< ACL Data TX: Handle 2325 flags 0x00 dlen 27             #134 [hci1] 10.079077
< ACL Data TX: Handle 2325 flags 0x01 dlen 27             #135 [hci1] 10.079186
< ACL Data TX: Handle 2325 flags 0x01 dlen 1              #136 [hci1] 10.079203
      ATT: Read By Type Response (0x09) len 50
        Attribute data length: 7
        Attribute data list: 7 entries
        Handle: 0x0013
        Value: 021400242a
            Properties: 0x02
              Read (0x02)
            Value Handle: 0x0014
            Value UUID: Model Number String (0x2a24)
        Handle: 0x0015
        Value: 021600292a
            Properties: 0x02
              Read (0x02)
            Value Handle: 0x0016
            Value UUID: Manufacturer Name String (0x2a29)
        Handle: 0x0017
        Value: 021800502a
            Properties: 0x02
              Read (0x02)
            Value Handle: 0x0018
            Value UUID: PnP ID (0x2a50)
        Handle: 0x0019
        Value: 021a00252a
            Properties: 0x02
              Read (0x02)
            Value Handle: 0x001a
            Value UUID: Serial Number String (0x2a25)
        Handle: 0x001b
        Value: 021c00262a
            Properties: 0x02
              Read (0x02)
            Value Handle: 0x001c
            Value UUID: Firmware Revision String (0x2a26)
        Handle: 0x001d
        Value: 021e00272a
            Properties: 0x02
              Read (0x02)
            Value Handle: 0x001e
            Value UUID: Hardware Revision String (0x2a27)
        Handle: 0x001f
        Value: 022000282a
            Properties: 0x02
              Read (0x02)
            Value Handle: 0x0020
            Value UUID: Software Revision String (0x2a28)
> HCI Event: Number of Completed Packets (0x13) plen 5    #137 [hci1] 10.149740
        Num handles: 1
        Handle: 2325 Address: DF:A9:FF:F6:B1:1A (OUI DF-A9-FF)
        Count: 1
        #134: len 27 (3 Kb/s)
        Latency: 70 msec (70-172 msec ~116 msec)
> HCI Event: Number of Completed Packets (0x13) plen 5    #138 [hci1] 10.150302
        Num handles: 1
        Handle: 2325 Address: DF:A9:FF:F6:B1:1A (OUI DF-A9-FF)
        Count: 1
        #135: len 27 (3 Kb/s)
        Latency: 71 msec (70-172 msec ~94 msec)
> HCI Event: Number of Completed Packets (0x13) plen 5    #139 [hci1] 10.236650
        Num handles: 1
        Handle: 2325 Address: DF:A9:FF:F6:B1:1A (OUI DF-A9-FF)
        Count: 1
        #136: len 1 (0 Kb/s)
        Latency: 157 msec (70-172 msec ~125 msec)
> ACL Data RX: Handle 2325 flags 0x02 dlen 11             #140 [hci1] 10.236851
      ATT: Read By Type Request (0x08) len 6
        Handle range: 0x0020-0x0020
        Attribute type: Characteristic (0x2803)
< HCI Command: Host Number of Com.. (0x03|0x0035) plen 5  #141 [hci1] 10.238673
        Num handles: 1
        Handle: 2325 Address: DF:A9:FF:F6:B1:1A (OUI DF-A9-FF)
        Count: 1
< ACL Data TX: Handle 2325 flags 0x00 dlen 9              #142 [hci1] 10.238809
      ATT: Error Response (0x01) len 4
        Read By Type Request (0x08)
        Handle: 0x0020
        Error: Attribute Not Found (0x0a)
> HCI Event: Number of Completed Packets (0x13) plen 5    #143 [hci1] 10.411569
        Num handles: 1
        Handle: 2325 Address: DF:A9:FF:F6:B1:1A (OUI DF-A9-FF)
        Count: 1
        #142: len 9 (0 Kb/s)
        Latency: 172 msec (70-172 msec ~149 msec)
> ACL Data RX: Handle 2325 flags 0x02 dlen 11             #144 [hci1] 10.411835
      ATT: Read By Type Request (0x08) len 6
        Handle range: 0x0021-0x0023
        Attribute type: Characteristic (0x2803)
< HCI Command: Host Number of Com.. (0x03|0x0035) plen 5  #145 [hci1] 10.418931
        Num handles: 1
        Handle: 2325 Address: DF:A9:FF:F6:B1:1A (OUI DF-A9-FF)
        Count: 1
< ACL Data TX: Handle 2325 flags 0x00 dlen 13             #146 [hci1] 10.419020
      ATT: Read By Type Response (0x09) len 8
        Attribute data length: 7
        Attribute data list: 1 entry
        Handle: 0x0022
        Value: 042300062a
            Properties: 0x04
              Write Without Response (0x04)
            Value Handle: 0x0023
            Value UUID: Alert Level (0x2a06)
> HCI Event: Number of Completed Packets (0x13) plen 5    #147 [hci1] 10.586520
        Num handles: 1
        Handle: 2325 Address: DF:A9:FF:F6:B1:1A (OUI DF-A9-FF)
        Count: 1
        #146: len 13 (0 Kb/s)
        Latency: 167 msec (70-172 msec ~158 msec)
> ACL Data RX: Handle 2325 flags 0x02 dlen 11             #148 [hci1] 10.586839
      ATT: Read By Type Request (0x08) len 6
        Handle range: 0x0023-0x0023
        Attribute type: Characteristic (0x2803)
< HCI Command: Host Number of Com.. (0x03|0x0035) plen 5  #149 [hci1] 10.599072
        Num handles: 1
        Handle: 2325 Address: DF:A9:FF:F6:B1:1A (OUI DF-A9-FF)
        Count: 1
< ACL Data TX: Handle 2325 flags 0x00 dlen 9              #150 [hci1] 10.599300
      ATT: Error Response (0x01) len 4
        Read By Type Request (0x08)
        Handle: 0x0023
        Error: Attribute Not Found (0x0a)
> HCI Event: Number of Completed Packets (0x13) plen 5    #151 [hci1] 10.761689
        Num handles: 1
        Handle: 2325 Address: DF:A9:FF:F6:B1:1A (OUI DF-A9-FF)
        Count: 1
        #150: len 9 (0 Kb/s)
        Latency: 162 msec (70-172 msec ~160 msec)
> ACL Data RX: Handle 2325 flags 0x02 dlen 11             #152 [hci1] 10.761816
      ATT: Read By Type Request (0x08) len 6
        Handle range: 0x0024-0x0036
        Attribute type: Characteristic (0x2803)
< HCI Command: Host Number of Com.. (0x03|0x0035) plen 5  #153 [hci1] 10.779055
        Num handles: 1
        Handle: 2325 Address: DF:A9:FF:F6:B1:1A (OUI DF-A9-FF)
        Count: 1
< ACL Data TX: Handle 2325 flags 0x00 dlen 27             #154 [hci1] 10.779139
< ACL Data TX: Handle 2325 flags 0x01 dlen 21             #155 [hci1] 10.779166
      ATT: Read By Type Response (0x09) len 43
        Attribute data length: 7
        Attribute data list: 6 entries
        Handle: 0x0025
        Value: 122600c92b
            Properties: 0x12
              Read (0x02)
              Notify (0x10)
            Value Handle: 0x0026
            Value UUID: Sink PAC (0x2bc9)
        Handle: 0x0028
        Value: 1a2900ca2b
            Properties: 0x1a
              Read (0x02)
              Write (0x08)
              Notify (0x10)
            Value Handle: 0x0029
            Value UUID: Sink Audio Locations (0x2bca)
        Handle: 0x002b
        Value: 122c00cb2b
            Properties: 0x12
              Read (0x02)
              Notify (0x10)
            Value Handle: 0x002c
            Value UUID: Source PAC (0x2bcb)
        Handle: 0x002e
        Value: 1a2f00cc2b
            Properties: 0x1a
              Read (0x02)
              Write (0x08)
              Notify (0x10)
            Value Handle: 0x002f
            Value UUID: Source Audio Locations (0x2bcc)
        Handle: 0x0031
        Value: 123200cd2b
            Properties: 0x12
              Read (0x02)
              Notify (0x10)
            Value Handle: 0x0032
            Value UUID: Available Audio Contexts (0x2bcd)
        Handle: 0x0034
        Value: 123500ce2b
            Properties: 0x12
              Read (0x02)
              Notify (0x10)
            Value Handle: 0x0035
            Value UUID: Supported Audio Contexts (0x2bce)
> HCI Event: Number of Completed Packets (0x13) plen 5    #156 [hci1] 10.849720
        Num handles: 1
        Handle: 2325 Address: DF:A9:FF:F6:B1:1A (OUI DF-A9-FF)
        Count: 1
        #154: len 27 (3 Kb/s)
        Latency: 70 msec (70-172 msec ~115 msec)
> HCI Event: Number of Completed Packets (0x13) plen 5    #157 [hci1] 10.936548
        Num handles: 1
        Handle: 2325 Address: DF:A9:FF:F6:B1:1A (OUI DF-A9-FF)
        Count: 1
        #155: len 21 (1 Kb/s)
        Latency: 157 msec (70-172 msec ~136 msec)
> ACL Data RX: Handle 2325 flags 0x02 dlen 11             #158 [hci1] 10.936838
      ATT: Read By Type Request (0x08) len 6
        Handle range: 0x0035-0x0036
        Attribute type: Characteristic (0x2803)
< HCI Command: Host Number of Com.. (0x03|0x0035) plen 5  #159 [hci1] 10.939054
        Num handles: 1
        Handle: 2325 Address: DF:A9:FF:F6:B1:1A (OUI DF-A9-FF)
        Count: 1
< ACL Data TX: Handle 2325 flags 0x00 dlen 9              #160 [hci1] 10.939272
      ATT: Error Response (0x01) len 4
        Read By Type Request (0x08)
        Handle: 0x0035
        Error: Attribute Not Found (0x0a)
> HCI Event: Number of Completed Packets (0x13) plen 5    #161 [hci1] 11.111528
        Num handles: 1
        Handle: 2325 Address: DF:A9:FF:F6:B1:1A (OUI DF-A9-FF)
        Count: 1
        #160: len 9 (0 Kb/s)
        Latency: 172 msec (70-172 msec ~154 msec)
> ACL Data RX: Handle 2325 flags 0x02 dlen 9              #162 [hci1] 11.111799
      ATT: Find Information Request (0x04) len 4
        Handle range: 0x0027-0x0027
< HCI Command: Host Number of Com.. (0x03|0x0035) plen 5  #163 [hci1] 11.118409
        Num handles: 1
        Handle: 2325 Address: DF:A9:FF:F6:B1:1A (OUI DF-A9-FF)
        Count: 1
< ACL Data TX: Handle 2325 flags 0x00 dlen 10             #164 [hci1] 11.118475
      ATT: Find Information Response (0x05) len 5
        Format: UUID-16 (0x01)
        Handle: 0x0027
        UUID: Client Characteristic Configuration (0x2902)
> HCI Event: Number of Completed Packets (0x13) plen 5    #165 [hci1] 11.286525
        Num handles: 1
        Handle: 2325 Address: DF:A9:FF:F6:B1:1A (OUI DF-A9-FF)
        Count: 1
        #164: len 10 (0 Kb/s)
        Latency: 168 msec (70-172 msec ~161 msec)
> ACL Data RX: Handle 2325 flags 0x02 dlen 9              #166 [hci1] 11.286747
      ATT: Find Information Request (0x04) len 4
        Handle range: 0x002a-0x002a
< HCI Command: Host Number of Com.. (0x03|0x0035) plen 5  #167 [hci1] 11.299036
        Num handles: 1
        Handle: 2325 Address: DF:A9:FF:F6:B1:1A (OUI DF-A9-FF)
        Count: 1
< ACL Data TX: Handle 2325 flags 0x00 dlen 10             #168 [hci1] 11.299142
      ATT: Find Information Response (0x05) len 5
        Format: UUID-16 (0x01)
        Handle: 0x002a
        UUID: Client Characteristic Configuration (0x2902)
> HCI Event: Number of Completed Packets (0x13) plen 5    #169 [hci1] 11.461571
        Num handles: 1
        Handle: 2325 Address: DF:A9:FF:F6:B1:1A (OUI DF-A9-FF)
        Count: 1
        #168: len 10 (0 Kb/s)
        Latency: 162 msec (70-172 msec ~161 msec)
> ACL Data RX: Handle 2325 flags 0x02 dlen 9              #170 [hci1] 11.461760
      ATT: Find Information Request (0x04) len 4
        Handle range: 0x002d-0x002d
< HCI Command: Host Number of Com.. (0x03|0x0035) plen 5  #171 [hci1] 11.478963
        Num handles: 1
        Handle: 2325 Address: DF:A9:FF:F6:B1:1A (OUI DF-A9-FF)
        Count: 1
< ACL Data TX: Handle 2325 flags 0x00 dlen 10             #172 [hci1] 11.479041
      ATT: Find Information Response (0x05) len 5
        Format: UUID-16 (0x01)
        Handle: 0x002d
        UUID: Client Characteristic Configuration (0x2902)
> HCI Event: Number of Completed Packets (0x13) plen 5    #173 [hci1] 11.636555
        Num handles: 1
        Handle: 2325 Address: DF:A9:FF:F6:B1:1A (OUI DF-A9-FF)
        Count: 1
        #172: len 10 (0 Kb/s)
        Latency: 157 msec (70-172 msec ~159 msec)
> ACL Data RX: Handle 2325 flags 0x02 dlen 9              #174 [hci1] 11.636728
      ATT: Find Information Request (0x04) len 4
        Handle range: 0x0030-0x0030
< HCI Command: Host Number of Com.. (0x03|0x0035) plen 5  #175 [hci1] 11.638927
        Num handles: 1
        Handle: 2325 Address: DF:A9:FF:F6:B1:1A (OUI DF-A9-FF)
        Count: 1
< ACL Data TX: Handle 2325 flags 0x00 dlen 10             #176 [hci1] 11.639094
      ATT: Find Information Response (0x05) len 5
        Format: UUID-16 (0x01)
        Handle: 0x0030
        UUID: Client Characteristic Configuration (0x2902)
> HCI Event: Number of Completed Packets (0x13) plen 5    #177 [hci1] 11.811574
        Num handles: 1
        Handle: 2325 Address: DF:A9:FF:F6:B1:1A (OUI DF-A9-FF)
        Count: 1
        #176: len 10 (0 Kb/s)
        Latency: 172 msec (70-172 msec ~166 msec)
> ACL Data RX: Handle 2325 flags 0x02 dlen 9              #178 [hci1] 11.811744
      ATT: Find Information Request (0x04) len 4
        Handle range: 0x0033-0x0033
< HCI Command: Host Number of Com.. (0x03|0x0035) plen 5  #179 [hci1] 11.818973
        Num handles: 1
        Handle: 2325 Address: DF:A9:FF:F6:B1:1A (OUI DF-A9-FF)
        Count: 1
< ACL Data TX: Handle 2325 flags 0x00 dlen 10             #180 [hci1] 11.819084
      ATT: Find Information Response (0x05) len 5
        Format: UUID-16 (0x01)
        Handle: 0x0033
        UUID: Client Characteristic Configuration (0x2902)
> HCI Event: Number of Completed Packets (0x13) plen 5    #181 [hci1] 11.986654
        Num handles: 1
        Handle: 2325 Address: DF:A9:FF:F6:B1:1A (OUI DF-A9-FF)
        Count: 1
        #180: len 10 (0 Kb/s)
        Latency: 167 msec (70-172 msec ~166 msec)
> ACL Data RX: Handle 2325 flags 0x02 dlen 9              #182 [hci1] 11.986815
      ATT: Find Information Request (0x04) len 4
        Handle range: 0x0036-0x0036
< HCI Command: Host Number of Com.. (0x03|0x0035) plen 5  #183 [hci1] 11.998993
        Num handles: 1
        Handle: 2325 Address: DF:A9:FF:F6:B1:1A (OUI DF-A9-FF)
        Count: 1
< ACL Data TX: Handle 2325 flags 0x00 dlen 10             #184 [hci1] 11.999065
      ATT: Find Information Response (0x05) len 5
        Format: UUID-16 (0x01)
        Handle: 0x0036
        UUID: Client Characteristic Configuration (0x2902)
> HCI Event: Number of Completed Packets (0x13) plen 5    #185 [hci1] 12.161646
        Num handles: 1
        Handle: 2325 Address: DF:A9:FF:F6:B1:1A (OUI DF-A9-FF)
        Count: 1
        #184: len 10 (0 Kb/s)
        Latency: 162 msec (70-172 msec ~164 msec)
> ACL Data RX: Handle 2325 flags 0x02 dlen 11             #186 [hci1] 12.161892
      ATT: Read By Type Request (0x08) len 6
        Handle range: 0x0037-0x0046
        Attribute type: Characteristic (0x2803)
< HCI Command: Host Number of Com.. (0x03|0x0035) plen 5  #187 [hci1] 12.178888
        Num handles: 1
        Handle: 2325 Address: DF:A9:FF:F6:B1:1A (OUI DF-A9-FF)
        Count: 1
< ACL Data TX: Handle 2325 flags 0x00 dlen 27             #188 [hci1] 12.178950
< ACL Data TX: Handle 2325 flags 0x01 dlen 14             #189 [hci1] 12.179050
      ATT: Read By Type Response (0x09) len 36
        Attribute data length: 7
        Attribute data list: 5 entries
        Handle: 0x0038
        Value: 1c3900c62b
            Properties: 0x1c
              Write Without Response (0x04)
              Write (0x08)
              Notify (0x10)
            Value Handle: 0x0039
            Value UUID: ASE Control Point (0x2bc6)
        Handle: 0x003b
        Value: 123c00c42b
            Properties: 0x12
              Read (0x02)
              Notify (0x10)
            Value Handle: 0x003c
            Value UUID: Sink ASE (0x2bc4)
        Handle: 0x003e
        Value: 123f00c42b
            Properties: 0x12
              Read (0x02)
              Notify (0x10)
            Value Handle: 0x003f
            Value UUID: Sink ASE (0x2bc4)
        Handle: 0x0041
        Value: 124200c52b
            Properties: 0x12
              Read (0x02)
              Notify (0x10)
            Value Handle: 0x0042
            Value UUID: Source ASE (0x2bc5)
        Handle: 0x0044
        Value: 124500c52b
            Properties: 0x12
              Read (0x02)
              Notify (0x10)
            Value Handle: 0x0045
            Value UUID: Source ASE (0x2bc5)
> HCI Event: Number of Completed Packets (0x13) plen 5    #190 [hci1] 12.249679
        Num handles: 1
        Handle: 2325 Address: DF:A9:FF:F6:B1:1A (OUI DF-A9-FF)
        Count: 1
        #188: len 27 (3 Kb/s)
        Latency: 70 msec (70-172 msec ~117 msec)
> HCI Event: Number of Completed Packets (0x13) plen 5    #191 [hci1] 12.336534
        Num handles: 1
        Handle: 2325 Address: DF:A9:FF:F6:B1:1A (OUI DF-A9-FF)
        Count: 1
        #189: len 14 (0 Kb/s)
        Latency: 157 msec (70-172 msec ~137 msec)
> ACL Data RX: Handle 2325 flags 0x02 dlen 11             #192 [hci1] 12.336783
      ATT: Read By Type Request (0x08) len 6
        Handle range: 0x0045-0x0046
        Attribute type: Characteristic (0x2803)
< HCI Command: Host Number of Com.. (0x03|0x0035) plen 5  #193 [hci1] 12.338317
        Num handles: 1
        Handle: 2325 Address: DF:A9:FF:F6:B1:1A (OUI DF-A9-FF)
        Count: 1
< ACL Data TX: Handle 2325 flags 0x00 dlen 9              #194 [hci1] 12.338361
      ATT: Error Response (0x01) len 4
        Read By Type Request (0x08)
        Handle: 0x0045
        Error: Attribute Not Found (0x0a)
> HCI Event: Number of Completed Packets (0x13) plen 5    #195 [hci1] 12.511489
        Num handles: 1
        Handle: 2325 Address: DF:A9:FF:F6:B1:1A (OUI DF-A9-FF)
        Count: 1
        #194: len 9 (0 Kb/s)
        Latency: 173 msec (70-173 msec ~155 msec)
> ACL Data RX: Handle 2325 flags 0x02 dlen 9              #196 [hci1] 12.511883
      ATT: Find Information Request (0x04) len 4
        Handle range: 0x003a-0x003a
< HCI Command: Host Number of Com.. (0x03|0x0035) plen 5  #197 [hci1] 12.518649
        Num handles: 1
        Handle: 2325 Address: DF:A9:FF:F6:B1:1A (OUI DF-A9-FF)
        Count: 1
< ACL Data TX: Handle 2325 flags 0x00 dlen 10             #198 [hci1] 12.518689
      ATT: Find Information Response (0x05) len 5
        Format: UUID-16 (0x01)
        Handle: 0x003a
        UUID: Client Characteristic Configuration (0x2902)
> HCI Event: Number of Completed Packets (0x13) plen 5    #199 [hci1] 12.686510
        Num handles: 1
        Handle: 2325 Address: DF:A9:FF:F6:B1:1A (OUI DF-A9-FF)
        Count: 1
        #198: len 10 (0 Kb/s)
        Latency: 167 msec (70-173 msec ~161 msec)
> ACL Data RX: Handle 2325 flags 0x02 dlen 9              #200 [hci1] 12.686752
      ATT: Find Information Request (0x04) len 4
        Handle range: 0x003d-0x003d
< HCI Command: Host Number of Com.. (0x03|0x0035) plen 5  #201 [hci1] 12.698982
        Num handles: 1
        Handle: 2325 Address: DF:A9:FF:F6:B1:1A (OUI DF-A9-FF)
        Count: 1
< ACL Data TX: Handle 2325 flags 0x00 dlen 10             #202 [hci1] 12.699061
      ATT: Find Information Response (0x05) len 5
        Format: UUID-16 (0x01)
        Handle: 0x003d
        UUID: Client Characteristic Configuration (0x2902)
> HCI Event: Number of Completed Packets (0x13) plen 5    #203 [hci1] 12.861537
        Num handles: 1
        Handle: 2325 Address: DF:A9:FF:F6:B1:1A (OUI DF-A9-FF)
        Count: 1
        #202: len 10 (0 Kb/s)
        Latency: 162 msec (70-173 msec ~162 msec)
> ACL Data RX: Handle 2325 flags 0x02 dlen 9              #204 [hci1] 12.861851
      ATT: Find Information Request (0x04) len 4
        Handle range: 0x0040-0x0040
< HCI Command: Host Number of Com.. (0x03|0x0035) plen 5  #205 [hci1] 12.878945
        Num handles: 1
        Handle: 2325 Address: DF:A9:FF:F6:B1:1A (OUI DF-A9-FF)
        Count: 1
< ACL Data TX: Handle 2325 flags 0x00 dlen 10             #206 [hci1] 12.879020
      ATT: Find Information Response (0x05) len 5
        Format: UUID-16 (0x01)
        Handle: 0x0040
        UUID: Client Characteristic Configuration (0x2902)
> HCI Event: Number of Completed Packets (0x13) plen 5    #207 [hci1] 13.036519
        Num handles: 1
        Handle: 2325 Address: DF:A9:FF:F6:B1:1A (OUI DF-A9-FF)
        Count: 1
        #206: len 10 (0 Kb/s)
        Latency: 157 msec (70-173 msec ~159 msec)
> ACL Data RX: Handle 2325 flags 0x02 dlen 9              #208 [hci1] 13.036731
      ATT: Find Information Request (0x04) len 4
        Handle range: 0x0043-0x0043
< HCI Command: Host Number of Com.. (0x03|0x0035) plen 5  #209 [hci1] 13.039060
        Num handles: 1
        Handle: 2325 Address: DF:A9:FF:F6:B1:1A (OUI DF-A9-FF)
        Count: 1
< ACL Data TX: Handle 2325 flags 0x00 dlen 10             #210 [hci1] 13.039136
      ATT: Find Information Response (0x05) len 5
        Format: UUID-16 (0x01)
        Handle: 0x0043
        UUID: Client Characteristic Configuration (0x2902)
> HCI Event: Number of Completed Packets (0x13) plen 5    #211 [hci1] 13.211541
        Num handles: 1
        Handle: 2325 Address: DF:A9:FF:F6:B1:1A (OUI DF-A9-FF)
        Count: 1
        #210: len 10 (0 Kb/s)
        Latency: 172 msec (70-173 msec ~166 msec)
> ACL Data RX: Handle 2325 flags 0x02 dlen 9              #212 [hci1] 13.211749
      ATT: Find Information Request (0x04) len 4
        Handle range: 0x0046-0x0046
< HCI Command: Host Number of Com.. (0x03|0x0035) plen 5  #213 [hci1] 13.218920
        Num handles: 1
        Handle: 2325 Address: DF:A9:FF:F6:B1:1A (OUI DF-A9-FF)
        Count: 1
< ACL Data TX: Handle 2325 flags 0x00 dlen 10             #214 [hci1] 13.218975
      ATT: Find Information Response (0x05) len 5
        Format: UUID-16 (0x01)
        Handle: 0x0046
        UUID: Client Characteristic Configuration (0x2902)
> HCI Event: Number of Completed Packets (0x13) plen 5    #215 [hci1] 13.386533
        Num handles: 1
        Handle: 2325 Address: DF:A9:FF:F6:B1:1A (OUI DF-A9-FF)
        Count: 1
        #214: len 10 (0 Kb/s)
        Latency: 167 msec (70-173 msec ~166 msec)
> ACL Data RX: Handle 2325 flags 0x02 dlen 11             #216 [hci1] 13.386844
      ATT: Read By Type Request (0x08) len 6
        Handle range: 0x0001-0xffff
        Attribute type: Include (0x2802)
< HCI Command: Host Number of Com.. (0x03|0x0035) plen 5  #217 [hci1] 13.399032
        Num handles: 1
        Handle: 2325 Address: DF:A9:FF:F6:B1:1A (OUI DF-A9-FF)
        Count: 1
< ACL Data TX: Handle 2325 flags 0x00 dlen 9              #218 [hci1] 13.399228
      ATT: Error Response (0x01) len 4
        Read By Type Request (0x08)
        Handle: 0x0001
        Error: Attribute Not Found (0x0a)
> HCI Event: Number of Completed Packets (0x13) plen 5    #219 [hci1] 13.561502
        Num handles: 1
        Handle: 2325 Address: DF:A9:FF:F6:B1:1A (OUI DF-A9-FF)
        Count: 1
        #218: len 9 (0 Kb/s)
        Latency: 162 msec (70-173 msec ~164 msec)
> ACL Data RX: Handle 2325 flags 0x02 dlen 9              #220 [hci1] 13.561738
      ATT: Write Request (0x12) len 4
        Handle: 0x003a Type: Client Characteristic Configuration (0x2902)
        Value Handle: 0x0045 Type: Source ASE (0x2bc5)
          Data: 0000
< HCI Command: Host Number of Com.. (0x03|0x0035) plen 5  #221 [hci1] 13.578960
        Num handles: 1
        Handle: 2325 Address: DF:A9:FF:F6:B1:1A (OUI DF-A9-FF)
        Count: 1
< ACL Data TX: Handle 2325 flags 0x00 dlen 5              #222 [hci1] 13.579059
      ATT: Write Response (0x13) len 0
> HCI Event: Number of Completed Packets (0x13) plen 5    #223 [hci1] 13.736535
        Num handles: 1
        Handle: 2325 Address: DF:A9:FF:F6:B1:1A (OUI DF-A9-FF)
        Count: 1
        #222: len 5 (0 Kb/s)
        Latency: 157 msec (70-173 msec ~161 msec)
> ACL Data RX: Handle 2325 flags 0x02 dlen 9              #224 [hci1] 13.736808
      ATT: Write Request (0x12) len 4
        Handle: 0x003a Type: Client Characteristic Configuration (0x2902)
        Value Handle: 0x0045 Type: Source ASE (0x2bc5)
          Data: 0100
            Notification (0x01)
< HCI Command: Host Number of Com.. (0x03|0x0035) plen 5  #225 [hci1] 13.739090
        Num handles: 1
        Handle: 2325 Address: DF:A9:FF:F6:B1:1A (OUI DF-A9-FF)
        Count: 1
< ACL Data TX: Handle 2325 flags 0x00 dlen 5              #226 [hci1] 13.739181
      ATT: Write Response (0x13) len 0
> HCI Event: Number of Completed Packets (0x13) plen 5    #227 [hci1] 13.911592
        Num handles: 1
        Handle: 2325 Address: DF:A9:FF:F6:B1:1A (OUI DF-A9-FF)
        Count: 1
        #226: len 5 (0 Kb/s)
        Latency: 172 msec (70-173 msec ~166 msec)
> ACL Data RX: Handle 2325 flags 0x02 dlen 9              #228 [hci1] 13.911776
      ATT: Write Request (0x12) len 4
        Handle: 0x003d Type: Client Characteristic Configuration (0x2902)
        Value Handle: 0x0045 Type: Source ASE (0x2bc5)
          Data: 0000
< HCI Command: Host Number of Com.. (0x03|0x0035) plen 5  #229 [hci1] 13.918963
        Num handles: 1
        Handle: 2325 Address: DF:A9:FF:F6:B1:1A (OUI DF-A9-FF)
        Count: 1
< ACL Data TX: Handle 2325 flags 0x00 dlen 5              #230 [hci1] 13.919043
      ATT: Write Response (0x13) len 0
> HCI Event: Number of Completed Packets (0x13) plen 5    #231 [hci1] 14.086497
        Num handles: 1
        Handle: 2325 Address: DF:A9:FF:F6:B1:1A (OUI DF-A9-FF)
        Count: 1
        #230: len 5 (0 Kb/s)
        Latency: 167 msec (70-173 msec ~167 msec)
> ACL Data RX: Handle 2325 flags 0x02 dlen 9              #232 [hci1] 14.086783
      ATT: Write Request (0x12) len 4
        Handle: 0x003d Type: Client Characteristic Configuration (0x2902)
        Value Handle: 0x0045 Type: Source ASE (0x2bc5)
          Data: 0100
            Notification (0x01)
< HCI Command: Host Number of Com.. (0x03|0x0035) plen 5  #233 [hci1] 14.098983
        Num handles: 1
        Handle: 2325 Address: DF:A9:FF:F6:B1:1A (OUI DF-A9-FF)
        Count: 1
< ACL Data TX: Handle 2325 flags 0x00 dlen 5              #234 [hci1] 14.099056
      ATT: Write Response (0x13) len 0
> HCI Event: Number of Completed Packets (0x13) plen 5    #235 [hci1] 14.261578
        Num handles: 1
        Handle: 2325 Address: DF:A9:FF:F6:B1:1A (OUI DF-A9-FF)
        Count: 1
        #234: len 5 (0 Kb/s)
        Latency: 162 msec (70-173 msec ~164 msec)
> ACL Data RX: Handle 2325 flags 0x02 dlen 9              #236 [hci1] 14.261804
      ATT: Write Request (0x12) len 4
        Handle: 0x0040 Type: Client Characteristic Configuration (0x2902)
        Value Handle: 0x0045 Type: Source ASE (0x2bc5)
          Data: 0000
< HCI Command: Host Number of Com.. (0x03|0x0035) plen 5  #237 [hci1] 14.279004
        Num handles: 1
        Handle: 2325 Address: DF:A9:FF:F6:B1:1A (OUI DF-A9-FF)
        Count: 1
< ACL Data TX: Handle 2325 flags 0x00 dlen 5              #238 [hci1] 14.279060
      ATT: Write Response (0x13) len 0
> HCI Event: Number of Completed Packets (0x13) plen 5    #239 [hci1] 14.436562
        Num handles: 1
        Handle: 2325 Address: DF:A9:FF:F6:B1:1A (OUI DF-A9-FF)
        Count: 1
        #238: len 5 (0 Kb/s)
        Latency: 157 msec (70-173 msec ~161 msec)
> ACL Data RX: Handle 2325 flags 0x02 dlen 9              #240 [hci1] 14.436731
      ATT: Write Request (0x12) len 4
        Handle: 0x0040 Type: Client Characteristic Configuration (0x2902)
        Value Handle: 0x0045 Type: Source ASE (0x2bc5)
          Data: 0100
            Notification (0x01)
< HCI Command: Host Number of Com.. (0x03|0x0035) plen 5  #241 [hci1] 14.438936
        Num handles: 1
        Handle: 2325 Address: DF:A9:FF:F6:B1:1A (OUI DF-A9-FF)
        Count: 1
< ACL Data TX: Handle 2325 flags 0x00 dlen 5              #242 [hci1] 14.438985
      ATT: Write Response (0x13) len 0
> HCI Event: Number of Completed Packets (0x13) plen 5    #243 [hci1] 14.611472
        Num handles: 1
        Handle: 2325 Address: DF:A9:FF:F6:B1:1A (OUI DF-A9-FF)
        Count: 1
        #242: len 5 (0 Kb/s)
        Latency: 172 msec (70-173 msec ~166 msec)
> ACL Data RX: Handle 2325 flags 0x02 dlen 9              #244 [hci1] 14.611731
      ATT: Write Request (0x12) len 4
        Handle: 0x0043 Type: Client Characteristic Configuration (0x2902)
        Value Handle: 0x0045 Type: Source ASE (0x2bc5)
          Data: 0000
< HCI Command: Host Number of Com.. (0x03|0x0035) plen 5  #245 [hci1] 14.618798
        Num handles: 1
        Handle: 2325 Address: DF:A9:FF:F6:B1:1A (OUI DF-A9-FF)
        Count: 1
< ACL Data TX: Handle 2325 flags 0x00 dlen 5              #246 [hci1] 14.618861
      ATT: Write Response (0x13) len 0
> HCI Event: Number of Completed Packets (0x13) plen 5    #247 [hci1] 14.786490
        Num handles: 1
        Handle: 2325 Address: DF:A9:FF:F6:B1:1A (OUI DF-A9-FF)
        Count: 1
        #246: len 5 (0 Kb/s)
        Latency: 167 msec (70-173 msec ~167 msec)
> ACL Data RX: Handle 2325 flags 0x02 dlen 9              #248 [hci1] 14.786826
      ATT: Write Request (0x12) len 4
        Handle: 0x0043 Type: Client Characteristic Configuration (0x2902)
        Value Handle: 0x0045 Type: Source ASE (0x2bc5)
          Data: 0100
            Notification (0x01)
< HCI Command: Host Number of Com.. (0x03|0x0035) plen 5  #249 [hci1] 14.799122
        Num handles: 1
        Handle: 2325 Address: DF:A9:FF:F6:B1:1A (OUI DF-A9-FF)
        Count: 1
< ACL Data TX: Handle 2325 flags 0x00 dlen 5              #250 [hci1] 14.799194
      ATT: Write Response (0x13) len 0
> HCI Event: Number of Completed Packets (0x13) plen 5    #251 [hci1] 14.961522
        Num handles: 1
        Handle: 2325 Address: DF:A9:FF:F6:B1:1A (OUI DF-A9-FF)
        Count: 1
        #250: len 5 (0 Kb/s)
        Latency: 162 msec (70-173 msec ~164 msec)
> ACL Data RX: Handle 2325 flags 0x02 dlen 9              #252 [hci1] 14.961775
      ATT: Write Request (0x12) len 4
        Handle: 0x0046 Type: Client Characteristic Configuration (0x2902)
        Value Handle: 0x0045 Type: Source ASE (0x2bc5)
          Data: 0000
< HCI Command: Host Number of Com.. (0x03|0x0035) plen 5  #253 [hci1] 14.979050
        Num handles: 1
        Handle: 2325 Address: DF:A9:FF:F6:B1:1A (OUI DF-A9-FF)
        Count: 1
< ACL Data TX: Handle 2325 flags 0x00 dlen 5              #254 [hci1] 14.979160
      ATT: Write Response (0x13) len 0
> HCI Event: Number of Completed Packets (0x13) plen 5    #255 [hci1] 15.136485
        Num handles: 1
        Handle: 2325 Address: DF:A9:FF:F6:B1:1A (OUI DF-A9-FF)
        Count: 1
        #254: len 5 (0 Kb/s)
        Latency: 157 msec (70-173 msec ~161 msec)
> ACL Data RX: Handle 2325 flags 0x02 dlen 9              #256 [hci1] 15.136815
      ATT: Write Request (0x12) len 4
        Handle: 0x0046 Type: Client Characteristic Configuration (0x2902)
        Value Handle: 0x0045 Type: Source ASE (0x2bc5)
          Data: 0100
            Notification (0x01)
< HCI Command: Host Number of Com.. (0x03|0x0035) plen 5  #257 [hci1] 15.139055
        Num handles: 1
        Handle: 2325 Address: DF:A9:FF:F6:B1:1A (OUI DF-A9-FF)
        Count: 1
< ACL Data TX: Handle 2325 flags 0x00 dlen 5              #258 [hci1] 15.139130
      ATT: Write Response (0x13) len 0
> HCI Event: Number of Completed Packets (0x13) plen 5    #259 [hci1] 15.311463
        Num handles: 1
        Handle: 2325 Address: DF:A9:FF:F6:B1:1A (OUI DF-A9-FF)
        Count: 1
        #258: len 5 (0 Kb/s)
        Latency: 172 msec (70-173 msec ~166 msec)
> ACL Data RX: Handle 2325 flags 0x02 dlen 7              #260 [hci1] 15.311805
      ATT: Read Request (0x0a) len 2
        Handle: 0x003c Type: Sink ASE (0x2bc4)
< HCI Command: Host Number of Com.. (0x03|0x0035) plen 5  #261 [hci1] 15.318827
        Num handles: 1
        Handle: 2325 Address: DF:A9:FF:F6:B1:1A (OUI DF-A9-FF)
        Count: 1
< ACL Data TX: Handle 2325 flags 0x00 dlen 7              #262 [hci1] 15.318917
      ATT: Read Response (0x0b) len 2
        Handle: 0x003c Type: Sink ASE (0x2bc4)
        Value: 0100
            ASE ID: 1
            State: Idle (0x00)
> HCI Event: Number of Completed Packets (0x13) plen 5    #263 [hci1] 15.486442
        Num handles: 1
        Handle: 2325 Address: DF:A9:FF:F6:B1:1A (OUI DF-A9-FF)
        Count: 1
        #262: len 7 (0 Kb/s)
        Latency: 167 msec (70-173 msec ~167 msec)
> ACL Data RX: Handle 2325 flags 0x02 dlen 7              #264 [hci1] 15.486634
      ATT: Read Request (0x0a) len 2
        Handle: 0x003f Type: Sink ASE (0x2bc4)
< HCI Command: Host Number of Com.. (0x03|0x0035) plen 5  #265 [hci1] 15.498704
        Num handles: 1
        Handle: 2325 Address: DF:A9:FF:F6:B1:1A (OUI DF-A9-FF)
        Count: 1
< ACL Data TX: Handle 2325 flags 0x00 dlen 7              #266 [hci1] 15.498784
      ATT: Read Response (0x0b) len 2
        Handle: 0x003f Type: Sink ASE (0x2bc4)
        Value: 0200
            ASE ID: 2
            State: Idle (0x00)
> HCI Event: Number of Completed Packets (0x13) plen 5    #267 [hci1] 15.661462
        Num handles: 1
        Handle: 2325 Address: DF:A9:FF:F6:B1:1A (OUI DF-A9-FF)
        Count: 1
        #266: len 7 (0 Kb/s)
        Latency: 162 msec (70-173 msec ~164 msec)
> ACL Data RX: Handle 2325 flags 0x02 dlen 7              #268 [hci1] 15.661775
      ATT: Read Request (0x0a) len 2
        Handle: 0x0042 Type: Source ASE (0x2bc5)
< HCI Command: Host Number of Com.. (0x03|0x0035) plen 5  #269 [hci1] 15.678884
        Num handles: 1
        Handle: 2325 Address: DF:A9:FF:F6:B1:1A (OUI DF-A9-FF)
        Count: 1
< ACL Data TX: Handle 2325 flags 0x00 dlen 7              #270 [hci1] 15.678975
      ATT: Read Response (0x0b) len 2
        Handle: 0x0042 Type: Source ASE (0x2bc5)
        Value: 0300
            ASE ID: 3
            State: Idle (0x00)
> HCI Event: Number of Completed Packets (0x13) plen 5    #271 [hci1] 15.836445
        Num handles: 1
        Handle: 2325 Address: DF:A9:FF:F6:B1:1A (OUI DF-A9-FF)
        Count: 1
        #270: len 7 (0 Kb/s)
        Latency: 157 msec (70-173 msec ~161 msec)
> ACL Data RX: Handle 2325 flags 0x02 dlen 7              #272 [hci1] 15.836731
      ATT: Read Request (0x0a) len 2
        Handle: 0x0045 Type: Source ASE (0x2bc5)
< HCI Command: Host Number of Com.. (0x03|0x0035) plen 5  #273 [hci1] 15.838757
        Num handles: 1
        Handle: 2325 Address: DF:A9:FF:F6:B1:1A (OUI DF-A9-FF)
        Count: 1
< ACL Data TX: Handle 2325 flags 0x00 dlen 7              #274 [hci1] 15.838892
      ATT: Read Response (0x0b) len 2
        Handle: 0x0045 Type: Source ASE (0x2bc5)
        Value: 0400
            ASE ID: 4
            State: Idle (0x00)
> HCI Event: Number of Completed Packets (0x13) plen 5    #275 [hci1] 16.011523
        Num handles: 1
        Handle: 2325 Address: DF:A9:FF:F6:B1:1A (OUI DF-A9-FF)
        Count: 1
        #274: len 7 (0 Kb/s)
        Latency: 172 msec (70-173 msec ~166 msec)
> ACL Data RX: Handle 2325 flags 0x02 dlen 7              #276 [hci1] 16.011620
      ATT: Read Request (0x0a) len 2
        Handle: 0x003c Type: Sink ASE (0x2bc4)
< HCI Command: Host Number of Com.. (0x03|0x0035) plen 5  #277 [hci1] 16.018800
        Num handles: 1
        Handle: 2325 Address: DF:A9:FF:F6:B1:1A (OUI DF-A9-FF)
        Count: 1
< ACL Data TX: Handle 2325 flags 0x00 dlen 7              #278 [hci1] 16.018903
      ATT: Read Response (0x0b) len 2
        Handle: 0x003c Type: Sink ASE (0x2bc4)
        Value: 0100
            ASE ID: 1
            State: Idle (0x00)
> HCI Event: Number of Completed Packets (0x13) plen 5    #279 [hci1] 16.186370
        Num handles: 1
        Handle: 2325 Address: DF:A9:FF:F6:B1:1A (OUI DF-A9-FF)
        Count: 1
        #278: len 7 (0 Kb/s)
        Latency: 167 msec (70-173 msec ~167 msec)
> ACL Data RX: Handle 2325 flags 0x02 dlen 27             #280 [hci1] 16.274342
> ACL Data RX: Handle 2325 flags 0x01 dlen 7              #281 [hci1] 16.274614
      ATT: Write Command (0x52) len 29
        Handle: 0x0039 Type: ASE Control Point (0x2bc6)
          Data: 010101010206000000001002010302020105030100000003042800
            Opcode: Codec Configuration (0x01)
            Number of ASE(s): 1
            ASE: #0
            ASE ID: 0x01
            Target Latency: Low Latency (0x01)
            PHY: 0x02
            LE 2M PHY (0x02)
            Codec: LC3 (0x06)
            Codec Specific Configuration: #0: len 0x02 type 0x01
              Sampling Frequency: 16 Khz (0x03)
            Codec Specific Configuration: #1: len 0x02 type 0x02
              Frame Duration: 10 ms (0x01)
            Codec Specific Configuration: #2: len 0x05 type 0x03
           Location: 0x00000001
              Front Left (0x00000001)
            Codec Specific Configuration: #3: len 0x03 type 0x04
              Frame Length: 40 (0x0028)
< HCI Command: Host Number of Com.. (0x03|0x0035) plen 5  #282 [hci1] 16.278657
        Num handles: 1
        Handle: 2325 Address: DF:A9:FF:F6:B1:1A (OUI DF-A9-FF)
        Count: 1
< HCI Command: Host Number of Com.. (0x03|0x0035) plen 5  #283 [hci1] 16.279420
        Num handles: 1
        Handle: 2325 Address: DF:A9:FF:F6:B1:1A (OUI DF-A9-FF)
        Count: 1
< ACL Data TX: Handle 2325 flags 0x00 dlen 12             #284 [hci1] 16.279680
      ATT: Handle Value Notification (0x1b) len 7
        Handle: 0x0039 Type: ASE Control Point (0x2bc6)
          Data: 0101010000
            Opcode: Codec Configuration (0x01)
            Number of ASE(s): 1
            ASE: #0
            ASE ID: 0x01
            ASE Response Code: Success (0x00)
            ASE Response Reason: None (0x00)
< ACL Data TX: Handle 2325 flags 0x00 dlen 27             #285 [hci1] 16.279755
< ACL Data TX: Handle 2325 flags 0x01 dlen 21             #286 [hci1] 16.279760
      ATT: Handle Value Notification (0x1b) len 43
        Handle: 0x003c Type: Sink ASE (0x2bc4)
          Data: 01010002020a00102700409c00102700409c0006000000001002010302020105030100000003042800
            ASE ID: 1
            State: Codec Configured (0x01)
            Framing: Unframed PDUs supported (0x00)
            PHY: 0x02
            LE 2M PHY preferred (0x02)
            RTN: 2
            Max Transport Latency: 10
            Presentation Delay Min: 10000 us
            Presentation Delay Max: 40000 us
            Preferred Presentation Delay Min: 10000 us
            Preferred Presentation Delay Max: 40000 us
            Codec: LC3 (0x06)
            Codec Specific Configuration: #0: len 0x02 type 0x01
              Sampling Frequency: 16 Khz (0x03)
            Codec Specific Configuration: #1: len 0x02 type 0x02
              Frame Duration: 10 ms (0x01)
            Codec Specific Configuration: #2: len 0x05 type 0x03
           Location: 0x00000001
              Front Left (0x00000001)
            Codec Specific Configuration: #3: len 0x03 type 0x04
              Frame Length: 40 (0x0028)
> HCI Event: Number of Completed Packets (0x13) plen 5    #287 [hci1] 16.361907
        Num handles: 1
        Handle: 2325 Address: DF:A9:FF:F6:B1:1A (OUI DF-A9-FF)
        Count: 1
        #284: len 12 (1 Kb/s)
        Latency: 82 msec (70-173 msec ~124 msec)
> HCI Event: Number of Completed Packets (0x13) plen 5    #288 [hci1] 16.362640
        Num handles: 1
        Handle: 2325 Address: DF:A9:FF:F6:B1:1A (OUI DF-A9-FF)
        Count: 1
        #285: len 27 (2 Kb/s)
        Latency: 82 msec (70-173 msec ~103 msec)
> HCI Event: Number of Completed Packets (0x13) plen 5    #289 [hci1] 16.448837
        Num handles: 1
        Handle: 2325 Address: DF:A9:FF:F6:B1:1A (OUI DF-A9-FF)
        Count: 1
        #286: len 21 (0 Kb/s)
        Latency: 169 msec (70-173 msec ~136 msec)
> ACL Data RX: Handle 2325 flags 0x02 dlen 25             #290 [hci1] 16.711916
      ATT: Write Request (0x12) len 20
        Handle: 0x0039 Type: ASE Control Point (0x2bc6)
          Data: 0201010101fe000000022800020a00a86100
            Opcode: QoS Configuration (0x02)
            Number of ASE(s): 1
            ASE: #0
            ASE ID: 0x01
            CIG ID: 0x01
            CIS ID: 0x01
            SDU Interval: 254 usec
            Framing: Unframed (0x00)
            PHY: 0x02
            LE 2M PHY (0x02)
            Max SDU: 40
            RTN: 2
            Max Transport Latency: 10
            Presentation Delay: 25000 us
< HCI Command: Host Number of Com.. (0x03|0x0035) plen 5  #291 [hci1] 16.718782
        Num handles: 1
        Handle: 2325 Address: DF:A9:FF:F6:B1:1A (OUI DF-A9-FF)
        Count: 1
< ACL Data TX: Handle 2325 flags 0x00 dlen 12             #292 [hci1] 16.718873
      ATT: Handle Value Notification (0x1b) len 7
        Handle: 0x0039 Type: ASE Control Point (0x2bc6)
          Data: 0201010903
            Opcode: QoS Configuration (0x02)
            Number of ASE(s): 1
            ASE: #0
            ASE ID: 0x01
            ASE Response Code: Invalid Configuration (0x09)
            ASE Response Reason: SDU Interval (0x03)
< ACL Data TX: Handle 2325 flags 0x00 dlen 5              #293 [hci1] 16.719050
      ATT: Write Response (0x13) len 0
> HCI Event: Number of Completed Packets (0x13) plen 5    #294 [hci1] 16.799390
        Num handles: 1
        Handle: 2325 Address: DF:A9:FF:F6:B1:1A (OUI DF-A9-FF)
        Count: 1
        #292: len 12 (1 Kb/s)
        Latency: 80 msec (70-173 msec ~108 msec)
> HCI Event: Number of Completed Packets (0x13) plen 5    #295 [hci1] 16.886362
        Num handles: 1
        Handle: 2325 Address: DF:A9:FF:F6:B1:1A (OUI DF-A9-FF)
        Count: 1
        #293: len 5 (0 Kb/s)
        Latency: 167 msec (70-173 msec ~137 msec)
> ACL Data RX: Handle 2325 flags 0x02 dlen 25             #296 [hci1] 36.924026
      ATT: Write Request (0x12) len 20
        Handle: 0x0039 Type: ASE Control Point (0x2bc6)
          Data: 020101010110270002022800020a00a86100
            Opcode: QoS Configuration (0x02)
            Number of ASE(s): 1
            ASE: #0
            ASE ID: 0x01
            CIG ID: 0x01
            CIS ID: 0x01
            SDU Interval: 10000 usec
            Framing: Reserved (0x02)
            PHY: 0x02
            LE 2M PHY (0x02)
            Max SDU: 40
            RTN: 2
            Max Transport Latency: 10
            Presentation Delay: 25000 us
< HCI Command: Host Number of Com.. (0x03|0x0035) plen 5  #297 [hci1] 36.939165
        Num handles: 1
        Handle: 2325 Address: DF:A9:FF:F6:B1:1A (OUI DF-A9-FF)
        Count: 1
< ACL Data TX: Handle 2325 flags 0x00 dlen 12             #298 [hci1] 36.939275
      ATT: Handle Value Notification (0x1b) len 7
        Handle: 0x0039 Type: ASE Control Point (0x2bc6)
          Data: 0201010904
            Opcode: QoS Configuration (0x02)
            Number of ASE(s): 1
            ASE: #0
            ASE ID: 0x01
            ASE Response Code: Invalid Configuration (0x09)
            ASE Response Reason: Framing (0x04)
< ACL Data TX: Handle 2325 flags 0x00 dlen 5              #299 [hci1] 36.939483
      ATT: Write Response (0x13) len 0
> HCI Event: Number of Completed Packets (0x13) plen 5    #300 [hci1] 37.011568
        Num handles: 1
        Handle: 2325 Address: DF:A9:FF:F6:B1:1A (OUI DF-A9-FF)
        Count: 1
        #298: len 12 (1 Kb/s)
        Latency: 72 msec (70-173 msec ~105 msec)
> HCI Event: Number of Completed Packets (0x13) plen 5    #301 [hci1] 37.098581
        Num handles: 1
        Handle: 2325 Address: DF:A9:FF:F6:B1:1A (OUI DF-A9-FF)
        Count: 1
        #299: len 5 (0 Kb/s)
        Latency: 159 msec (70-173 msec ~132 msec)
> ACL Data RX: Handle 2325 flags 0x02 dlen 25             #302 [hci1] 57.136271
      ATT: Write Request (0x12) len 20
        Handle: 0x0039 Type: ASE Control Point (0x2bc6)
          Data: 020101010110270000802800020a00a86100
            Opcode: QoS Configuration (0x02)
            Number of ASE(s): 1
            ASE: #0
            ASE ID: 0x01
            CIG ID: 0x01
            CIS ID: 0x01
            SDU Interval: 10000 usec
            Framing: Unframed (0x00)
            PHY: 0x80
            Unknown fields (0x80)
            Max SDU: 40
            RTN: 2
            Max Transport Latency: 10
            Presentation Delay: 25000 us
< HCI Command: Host Number of Com.. (0x03|0x0035) plen 5  #303 [hci1] 57.139306
        Num handles: 1
        Handle: 2325 Address: DF:A9:FF:F6:B1:1A (OUI DF-A9-FF)
        Count: 1
< ACL Data TX: Handle 2325 flags 0x00 dlen 12             #304 [hci1] 57.139466
      ATT: Handle Value Notification (0x1b) len 7
        Handle: 0x0039 Type: ASE Control Point (0x2bc6)
          Data: 0201010905
            Opcode: QoS Configuration (0x02)
            Number of ASE(s): 1
            ASE: #0
            ASE ID: 0x01
            ASE Response Code: Invalid Configuration (0x09)
            ASE Response Reason: PHY (0x05)
< ACL Data TX: Handle 2325 flags 0x00 dlen 5              #305 [hci1] 57.139504
      ATT: Write Response (0x13) len 0
> HCI Event: Number of Completed Packets (0x13) plen 5    #306 [hci1] 57.223817
        Num handles: 1
        Handle: 2325 Address: DF:A9:FF:F6:B1:1A (OUI DF-A9-FF)
        Count: 1
        #304: len 12 (1 Kb/s)
        Latency: 84 msec (70-173 msec ~108 msec)
> HCI Event: Number of Completed Packets (0x13) plen 5    #307 [hci1] 57.310790
        Num handles: 1
        Handle: 2325 Address: DF:A9:FF:F6:B1:1A (OUI DF-A9-FF)
        Count: 1
        #305: len 5 (0 Kb/s)
        Latency: 171 msec (70-173 msec ~139 msec)
> ACL Data RX: Handle 2325 flags 0x02 dlen 25             #308 [hci1] 77.348442
      ATT: Write Request (0x12) len 20
        Handle: 0x0039 Type: ASE Control Point (0x2bc6)
          Data: 02010101011027000002ff1f020a00a86100
            Opcode: QoS Configuration (0x02)
            Number of ASE(s): 1
            ASE: #0
            ASE ID: 0x01
            CIG ID: 0x01
            CIS ID: 0x01
            SDU Interval: 10000 usec
            Framing: Unframed (0x00)
            PHY: 0x02
            LE 2M PHY (0x02)
            Max SDU: 8191
            RTN: 2
            Max Transport Latency: 10
            Presentation Delay: 25000 us
< HCI Command: Host Number of Com.. (0x03|0x0035) plen 5  #309 [hci1] 77.359598
        Num handles: 1
        Handle: 2325 Address: DF:A9:FF:F6:B1:1A (OUI DF-A9-FF)
        Count: 1
< ACL Data TX: Handle 2325 flags 0x00 dlen 12             #310 [hci1] 77.359714
      ATT: Handle Value Notification (0x1b) len 7
        Handle: 0x0039 Type: ASE Control Point (0x2bc6)
          Data: 0201010906
            Opcode: QoS Configuration (0x02)
            Number of ASE(s): 1
            ASE: #0
            ASE ID: 0x01
            ASE Response Code: Invalid Configuration (0x09)
            ASE Response Reason: Max SDU (0x06)
< ACL Data TX: Handle 2325 flags 0x00 dlen 5              #311 [hci1] 77.359967
      ATT: Write Response (0x13) len 0
> HCI Event: Number of Completed Packets (0x13) plen 5    #312 [hci1] 77.436063
        Num handles: 1
        Handle: 2325 Address: DF:A9:FF:F6:B1:1A (OUI DF-A9-FF)
        Count: 1
        #310: len 12 (1 Kb/s)
        Latency: 76 msec (70-173 msec ~108 msec)
> HCI Event: Number of Completed Packets (0x13) plen 5    #313 [hci1] 77.522958
        Num handles: 1
        Handle: 2325 Address: DF:A9:FF:F6:B1:1A (OUI DF-A9-FF)
        Count: 1
        #311: len 5 (0 Kb/s)
        Latency: 162 msec (70-173 msec ~135 msec)
> ACL Data RX: Handle 2325 flags 0x02 dlen 25             #314 [hci1] 97.560704
      ATT: Write Request (0x12) len 20
        Handle: 0x0039 Type: ASE Control Point (0x2bc6)
          Data: 02010101011027000002280002ff0fa86100
            Opcode: QoS Configuration (0x02)
            Number of ASE(s): 1
            ASE: #0
            ASE ID: 0x01
            CIG ID: 0x01
            CIS ID: 0x01
            SDU Interval: 10000 usec
            Framing: Unframed (0x00)
            PHY: 0x02
            LE 2M PHY (0x02)
            Max SDU: 40
            RTN: 2
            Max Transport Latency: 4095
            Presentation Delay: 25000 us
< HCI Command: Host Number of Com.. (0x03|0x0035) plen 5  #315 [hci1] 97.579559
        Num handles: 1
        Handle: 2325 Address: DF:A9:FF:F6:B1:1A (OUI DF-A9-FF)
        Count: 1
< ACL Data TX: Handle 2325 flags 0x00 dlen 12             #316 [hci1] 97.579613
      ATT: Handle Value Notification (0x1b) len 7
        Handle: 0x0039 Type: ASE Control Point (0x2bc6)
          Data: 0201010908
            Opcode: QoS Configuration (0x02)
            Number of ASE(s): 1
            ASE: #0
            ASE ID: 0x01
            ASE Response Code: Invalid Configuration (0x09)
            ASE Response Reason: Max Transport Latency (0x08)
< ACL Data TX: Handle 2325 flags 0x00 dlen 5              #317 [hci1] 97.579704
      ATT: Write Response (0x13) len 0
> HCI Event: Number of Completed Packets (0x13) plen 5    #318 [hci1] 97.648176
        Num handles: 1
        Handle: 2325 Address: DF:A9:FF:F6:B1:1A (OUI DF-A9-FF)
        Count: 1
        #316: len 12 (1 Kb/s)
        Latency: 68 msec (68-173 msec ~102 msec)
> HCI Event: Number of Completed Packets (0x13) plen 5    #319 [hci1] 97.735169
        Num handles: 1
        Handle: 2325 Address: DF:A9:FF:F6:B1:1A (OUI DF-A9-FF)
        Count: 1
        #317: len 5 (0 Kb/s)
        Latency: 155 msec (68-173 msec ~128 msec)
> ACL Data RX: Handle 2325 flags 0x02 dlen 25            #320 [hci1] 117.772886
      ATT: Write Request (0x12) len 20
        Handle: 0x0039 Type: ASE Control Point (0x2bc6)
          Data: 020101010110270000022800020a00419c00
            Opcode: QoS Configuration (0x02)
            Number of ASE(s): 1
            ASE: #0
            ASE ID: 0x01
            CIG ID: 0x01
            CIS ID: 0x01
            SDU Interval: 10000 usec
            Framing: Unframed (0x00)
            PHY: 0x02
            LE 2M PHY (0x02)
            Max SDU: 40
            RTN: 2
            Max Transport Latency: 10
            Presentation Delay: 40001 us
< HCI Command: Host Number of Co.. (0x03|0x0035) plen 5  #321 [hci1] 117.780070
        Num handles: 1
        Handle: 2325 Address: DF:A9:FF:F6:B1:1A (OUI DF-A9-FF)
        Count: 1
< ACL Data TX: Handle 2325 flags 0x00 dlen 12            #322 [hci1] 117.780258
      ATT: Handle Value Notification (0x1b) len 7
        Handle: 0x0039 Type: ASE Control Point (0x2bc6)
          Data: 0201010909
            Opcode: QoS Configuration (0x02)
            Number of ASE(s): 1
            ASE: #0
            ASE ID: 0x01
            ASE Response Code: Invalid Configuration (0x09)
            ASE Response Reason: Presentation Delay (0x09)
< ACL Data TX: Handle 2325 flags 0x00 dlen 5             #323 [hci1] 117.780346
      ATT: Write Response (0x13) len 0
> HCI Event: Number of Completed Packets (0x13) plen 5   #324 [hci1] 117.860407
        Num handles: 1
        Handle: 2325 Address: DF:A9:FF:F6:B1:1A (OUI DF-A9-FF)
        Count: 1
        #322: len 12 (1 Kb/s)
        Latency: 80 msec (68-173 msec ~104 msec)
> HCI Event: Number of Completed Packets (0x13) plen 5   #325 [hci1] 117.947410
        Num handles: 1
        Handle: 2325 Address: DF:A9:FF:F6:B1:1A (OUI DF-A9-FF)
        Count: 1
        #323: len 5 (0 Kb/s)
        Latency: 167 msec (68-173 msec ~135 msec)
> HCI Event: Disconnect Complete (0x05) plen 4           #326 [hci1] 139.297307
        Status: Success (0x00)
        Handle: 2325 Address: DF:A9:FF:F6:B1:1A (OUI DF-A9-FF)
        Reason: Remote User Terminated Connection (0x13)
< HCI Command: Reset (0x03|0x0003) plen 0                #327 [hci1] 143.720450
> HCI Event: Command Complete (0x0e) plen 4              #328 [hci1] 143.721056
      Reset (0x03|0x0003) ncmd 1
        Status: Success (0x00)
@ USER Close: main                                   {0x0001} [hci1] 143.739900
= Close Index: 00:00:00:00:00:00                              [hci1] 143.739908
