Bluetooth monitor ver 5.72
= Note: Linux version 6.14.0-36-generic (x86_64)                       0.588563
= Note: Bluetooth subsystem version 2.22                               0.588565
= New Index: 00:00:00:00:00:00 (Primary,UART,hci1)              [hci1] 0.588566
= New Index: 48:5F:99:8E:E0:64 (Primary,USB,hci0)               [hci0] 0.588567
= Open Index: 00:00:00:00:00:00                                 [hci1] 0.741693
= Index Info: 00:00:00:00:00:00 (Nordic Semiconductor ASA)      [hci1] 0.741703
@ USER Open: main (privileged) version 2.22            {0x0001} [hci1] 0.741707
< HCI Command: Reset (0x03|0x0003) plen 0                    #1 [hci1] 0.742291
> HCI Event: Command Complete (0x0e) plen 4                  #2 [hci1] 0.742845
      Reset (0x03|0x0003) ncmd 1
        Status: Success (0x00)
< HCI Command: Read Local Supported... (0x04|0x0003) plen 0  #3 [hci1] 0.761573
> HCI Event: Command Complete (0x0e) plen 12                 #4 [hci1] 0.762036
      Read Local Supported Features (0x04|0x0003) ncmd 1
        Status: Success (0x00)
        Features: 0x00 0x00 0x00 0x00 0x60 0x00 0x00 0x00
          BR/EDR Not Supported
          LE Supported (Controller)
< HCI Command: Read Local Version In.. (0x04|0x0001) plen 0  #5 [hci1] 0.781537
> HCI Event: Command Complete (0x0e) plen 12                 #6 [hci1] 0.782003
      Read Local Version Information (0x04|0x0001) ncmd 1
        Status: Success (0x00)
        HCI version: Reserved (0x0f) - Revision 12393 (0x3069)
        LMP version: Reserved (0x0f) - Subversion 12393 (0x3069)
        Manufacturer: Nordic Semiconductor ASA (89)
< HCI Command: Read Local Supported... (0x04|0x0002) plen 0  #7 [hci1] 0.801574
> HCI Event: Command Complete (0x0e) plen 68                 #8 [hci1] 0.802648
      Read Local Supported Commands (0x04|0x0002) ncmd 1
        Status: Success (0x00)
        Commands: 119 entries
          Disconnect (Octet 0 - Bit 5)
          Read Remote Version Information (Octet 2 - Bit 7)
          Set Event Mask (Octet 5 - Bit 6)
          Reset (Octet 5 - Bit 7)
          Read Connection Accept Timeout (Octet 7 - Bit 2)
          Write Connection Accept Timeout (Octet 7 - Bit 3)
          Read Transmit Power Level (Octet 10 - Bit 2)
          Set Controller To Host Flow Control (Octet 10 - Bit 5)
          Host Buffer Size (Octet 10 - Bit 6)
          Host Number of Completed Packets (Octet 10 - Bit 7)
          Read Local Version Information (Octet 14 - Bit 3)
          Read Local Supported Features (Octet 14 - Bit 5)
          Read BD ADDR (Octet 15 - Bit 1)
          Read RSSI (Octet 15 - Bit 5)
          Set Event Mask Page 2 (Octet 22 - Bit 2)
          LE Set Event Mask (Octet 25 - Bit 0)
          LE Read Buffer Size (Octet 25 - Bit 1)
          LE Read Local Supported Features (Octet 25 - Bit 2)
          LE Set Random Address (Octet 25 - Bit 4)
          LE Set Advertising Parameters (Octet 25 - Bit 5)
          LE Read Advertising Channel TX Power (Octet 25 - Bit 6)
          LE Set Advertising Data (Octet 25 - Bit 7)
          LE Set Scan Response Data (Octet 26 - Bit 0)
          LE Set Advertise Enable (Octet 26 - Bit 1)
          LE Set Scan Parameters (Octet 26 - Bit 2)
          LE Set Scan Enable (Octet 26 - Bit 3)
          LE Create Connection (Octet 26 - Bit 4)
          LE Create Connection Cancel (Octet 26 - Bit 5)
          LE Read Accept List Size (Octet 26 - Bit 6)
          LE Clear Accept List (Octet 26 - Bit 7)
          LE Add Device To Accept List (Octet 27 - Bit 0)
          LE Remove Device From Accept List (Octet 27 - Bit 1)
          LE Connection Update (Octet 27 - Bit 2)
          LE Set Host Channel Classification (Octet 27 - Bit 3)
          LE Read Channel Map (Octet 27 - Bit 4)
          LE Read Remote Used Features (Octet 27 - Bit 5)
          LE Encrypt (Octet 27 - Bit 6)
          LE Rand (Octet 27 - Bit 7)
          LE Start Encryption (Octet 28 - Bit 0)
          LE Long Term Key Request Reply (Octet 28 - Bit 1)
          LE Long Term Key Request Neg Reply (Octet 28 - Bit 2)
          LE Read Supported States (Octet 28 - Bit 3)
          LE Receiver Test (Octet 28 - Bit 4)
          LE Transmitter Test (Octet 28 - Bit 5)
          LE Test End (Octet 28 - Bit 6)
          Read Authenticated Payload Timeout (Octet 32 - Bit 4)
          Write Authenticated Payload Timeout (Octet 32 - Bit 5)
          LE Set Data Length (Octet 33 - Bit 6)
          LE Read Suggested Default Data Length (Octet 33 - Bit 7)
          LE Write Suggested Default Data Length (Octet 34 - Bit 0)
          LE Add Device To Resolving List (Octet 34 - Bit 3)
          LE Remove Device From Resolving List (Octet 34 - Bit 4)
          LE Clear Resolving List (Octet 34 - Bit 5)
          LE Read Resolving List Size (Octet 34 - Bit 6)
          LE Set Address Resolution Enable (Octet 35 - Bit 1)
          LE Set Resolvable Private Address Timeout (Octet 35 - Bit 2)
          LE Read Maximum Data Length (Octet 35 - Bit 3)
          LE Read PHY (Octet 35 - Bit 4)
          LE Set Default PHY (Octet 35 - Bit 5)
          LE Set PHY (Octet 35 - Bit 6)
          LE Enhanced Receiver Test (Octet 35 - Bit 7)
          LE Enhanced Transmitter Test (Octet 36 - Bit 0)
          LE Set Advertising Set Random Address (Octet 36 - Bit 1)
          LE Set Extended Advertising Parameters (Octet 36 - Bit 2)
          LE Set Extended Advertising Data (Octet 36 - Bit 3)
          LE Set Extended Scan Response Data (Octet 36 - Bit 4)
          LE Set Extended Advertising Enable (Octet 36 - Bit 5)
          LE Read Maximum Advertising Data Length (Octet 36 - Bit 6)
          LE Read Number of Supported Advertising Sets (Octet 36 - Bit 7)
          LE Remove Advertising Set (Octet 37 - Bit 0)
          LE Clear Advertising Sets (Octet 37 - Bit 1)
          LE Set Periodic Advertising Parameters (Octet 37 - Bit 2)
          LE Set Periodic Advertising Data (Octet 37 - Bit 3)
          LE Set Periodic Advertising Enable (Octet 37 - Bit 4)
          LE Set Extended Scan Parameters (Octet 37 - Bit 5)
          LE Set Extended Scan Enable (Octet 37 - Bit 6)
          LE Extended Create Connection (Octet 37 - Bit 7)
          LE Periodic Advertising Create Sync (Octet 38 - Bit 0)
          LE Periodic Advertising Create Sync Cancel (Octet 38 - Bit 1)
          LE Periodic Advertising Terminate Sync (Octet 38 - Bit 2)
          LE Add Device To Periodic Advertiser List (Octet 38 - Bit 3)
          LE Remove Device From Periodic Advertiser List (Octet 38 - Bit 4)
          LE Clear Periodic Advertiser List (Octet 38 - Bit 5)
          LE Read Periodic Advertiser List Size (Octet 38 - Bit 6)
          LE Read Transmit Power (Octet 38 - Bit 7)
          LE Read RF Path Compensation (Octet 39 - Bit 0)
          LE Write RF Path Compensation (Octet 39 - Bit 1)
          LE Set Privacy Mode (Octet 39 - Bit 2)
          LE Periodic Advertising Receive Enable (Octet 40 - Bit 5)
          LE Periodic Advertising Sync Transfer (Octet 40 - Bit 6)
          LE Periodic Advertising Set Info Transfer (Octet 40 - Bit 7)
          LE Periodic Advertising Sync Transfer Parameters (Octet 41 - Bit 0)
          LE Set Default Periodic Advertisng Sync Transfer Parameters (Octet 41 - Bit 1)
          LE Read Buffer v2 (Octet 41 - Bit 5)
          LE Read ISO TX Sync (Octet 41 - Bit 6)
          LE Set Connected Isochronous Group Parameters (Octet 41 - Bit 7)
          LE Set Connected Isochronous Group Parameters Test (Octet 42 - Bit 0)
          LE Create Connected Isochronous Stream (Octet 42 - Bit 1)
          LE Remove Connected Isochronous Group (Octet 42 - Bit 2)
          LE Accept Connected Isochronous Stream Request (Octet 42 - Bit 3)
          LE Reject Connected Isochronous Stream Request (Octet 42 - Bit 4)
          LE Create Broadcast Isochronous Group (Octet 42 - Bit 5)
          LE Create Broadcast Isochronous Group Test (Octet 42 - Bit 6)
          LE Terminate Broadcast Isochronous Group (Octet 42 - Bit 7)
          LE Broadcast Isochronous Group Create Sync (Octet 43 - Bit 0)
          LE Broadcast Isochronous Group Terminate Sync (Octet 43 - Bit 1)
          LE Request Peer SCA (Octet 43 - Bit 2)
          LE Setup Isochronous Data Path (Octet 43 - Bit 3)
          LE Remove Isochronous Data Path (Octet 43 - Bit 4)
          LE Isochronous Transmit Test (Octet 43 - Bit 5)
          LE Isochronous Receive Test (Octet 43 - Bit 6)
          LE Isochronous Read Test Counters (Octet 43 - Bit 7)
          LE Isochronous Read Test Counters (Octet 44 - Bit 0)
          LE Set Host Feature (Octet 44 - Bit 1)
          Octet 44 - Bit 2 
          Octet 45 - Bit 6 
          Octet 46 - Bit 0 
          Octet 46 - Bit 1 
          Octet 46 - Bit 2 
< HCI Command: Host Buffer Size (0x03|0x0033) plen 7         #9 [hci1] 0.821595
        ACL MTU: 255  ACL max packet: 16
        SCO MTU: 0    SCO max packet: 0
> HCI Event: Command Complete (0x0e) plen 4                 #10 [hci1] 0.822079
      Host Buffer Size (0x03|0x0033) ncmd 1
        Status: Success (0x00)
< HCI Command: Set Controller To Ho.. (0x03|0x0031) plen 1  #11 [hci1] 0.841599
        Flow control: ACL Data Packets (0x01)
> HCI Event: Command Complete (0x0e) plen 4                 #12 [hci1] 0.842092
      Set Controller To Host Flow Control (0x03|0x0031) ncmd 1
        Status: Success (0x00)
< HCI Command: LE Read Local Suppor.. (0x08|0x0003) plen 0  #13 [hci1] 0.861532
> HCI Event: Command Complete (0x0e) plen 12                #14 [hci1] 0.862033
      LE Read Local Supported Features (0x08|0x0003) ncmd 1
        Status: Success (0x00)
        Features: 0xfd 0x79 0x00 0xf7 0x30 0x01 0x00 0x00
          LE Encryption
          Extended Reject Indication
          Peripheral-initiated Features Exchange
          LE Ping
          LE Data Packet Length Extension
          LL Privacy
          Extended Scanner Filter Policies
          LE 2M PHY
          LE Coded PHY
          LE Extended Advertising
          LE Periodic Advertising
          Channel Selection Algorithm #2
          Periodic Advertising Sync Transfer - Sender
          Periodic Advertising Sync Transfer - Recipient
          Sleep Clock Accuracy Updates
          Connected Isochronous Stream - Central
          Connected Isochronous Stream - Peripheral
          Isochronous Broadcaster
          Synchronized Receiver
          Periodic Advertising ADI support
          Connection Subrating
          Unknown features (0x0000010000000000)
< HCI Command: LE Set Host Feature (0x08|0x0074) plen 2     #15 [hci1] 0.881609
        Bit Number: 32
          Connected Isochronous Stream (Host Support)
        Bit Value: 1
> HCI Event: Command Complete (0x0e) plen 4                 #16 [hci1] 0.882101
      LE Set Host Feature (0x08|0x0074) ncmd 1
        Status: Success (0x00)
< HCI Command: LE Read Buffer v2 (0x08|0x0060) plen 0       #17 [hci1] 0.901477
> HCI Event: Command Complete (0x0e) plen 10                #18 [hci1] 0.901922
      LE Read Buffer v2 (0x08|0x0060) ncmd 1
        Status: Success (0x00)
        ACL MTU: 27
        ACL max packet: 3
        ISO MTU: 318
        ISO max packet: 3
< HCI Command: LE Read Maximum Adve.. (0x08|0x003a) plen 0  #19 [hci1] 0.921636
> HCI Event: Command Complete (0x0e) plen 6                 #20 [hci1] 0.922095
      LE Read Maximum Advertising Data Length (0x08|0x003a) ncmd 1
        Status: Success (0x00)
        Max length: 1650
< HCI Command: LE Read Supported St.. (0x08|0x001c) plen 0  #21 [hci1] 0.942161
> HCI Event: Command Complete (0x0e) plen 12                #22 [hci1] 0.942640
      LE Read Supported States (0x08|0x001c) ncmd 1
        Status: Success (0x00)
        States: 0x000003ff3e0306ff
          Non-connectable Advertising State
          Scannable Advertising State
          Connectable Advertising State
          High Duty Cycle Directed Advertising State
          Passive Scanning State
          Active Scanning State
          Initiating State
            and Connection State (Central Role)
          Connection State (Peripheral Role)
          Scannable Advertising State
            and Passive Scanning State
          Connectable Advertising State
            and Passive Scanning State
          Non-connectable Advertising State
            and Initiating State
          Scannable Advertising State
            and Initiating State
          Active Scanning State
            and Connection State (Central Role)
          Passive Scanning State
            and Connection State (Peripheral Role)
          Active Scanning State
            and Connection State (Peripheral Role)
          Initiating State
            and Connection State (Central Role)
            and Central Role & Central Role
          Low Duty Cycle Directed Advertising State
          Connectable Advertising State
            and Initiating State
            and Central Role & Peripheral Role
          High Duty Cycle Directed Advertising State
            and Initiating State
            and Central Role & Peripheral Role
          Low Duty Cycle Directed Advertising State
            and Initiating State
            and Central Role & Peripheral Role
          Connectable Advertising State
            and Connection State (Central Role)
            and Central Role & Peripheral Role
          High Duty Cycle Directed Advertising State
            and Connection State (Central Role)
            and Central Role & Peripheral Role
          Low Duty Cycle Directed Advertising State
            and Connection State (Central Role)
            and Central Role & Peripheral Role
          Connectable Advertising State
            and Connection State (Peripheral Role)
            and Central Role & Peripheral Role
          High Duty Cycle Directed Advertising State
            and Connection State (Peripheral Role)
            and Peripheral Role & Peripheral Role
          Low Duty Cycle Directed Advertising State
            and Connection State (Peripheral Role)
            and Peripheral Role & Peripheral Role
          Initiating State
            and Connection State (Peripheral Role)
            and Central Role & Peripheral Role
< HCI Command: LE Read Maximum Data.. (0x08|0x002f) plen 0  #23 [hci1] 0.961598
> HCI Event: Command Complete (0x0e) plen 12                #24 [hci1] 0.962060
      LE Read Maximum Data Length (0x08|0x002f) ncmd 1
        Status: Success (0x00)
        Max TX octets: 251
        Max TX time: 2704
        Max RX octets: 251
        Max RX time: 2704
< HCI Command: LE Write Suggested D.. (0x08|0x0024) plen 4  #25 [hci1] 0.981576
        TX octets: 251
        TX time: 2704
> HCI Event: Command Complete (0x0e) plen 4                 #26 [hci1] 0.982094
      LE Write Suggested Default Data Length (0x08|0x0024) ncmd 1
        Status: Success (0x00)
< HCI Command: LE Read Resolving Li.. (0x08|0x002a) plen 0  #27 [hci1] 1.001578
> HCI Event: Command Complete (0x0e) plen 5                 #28 [hci1] 1.002034
      LE Read Resolving List Size (0x08|0x002a) ncmd 1
        Status: Success (0x00)
        Size: 8
< HCI Command: LE Set Host Feature (0x08|0x0074) plen 2     #29 [hci1] 1.021608
        Bit Number: 38
          Connection Subrating (Host Support)
        Bit Value: 1
> HCI Event: Command Complete (0x0e) plen 4                 #30 [hci1] 1.022024
      LE Set Host Feature (0x08|0x0074) ncmd 1
        Status: Success (0x00)
< HCI Command: LE Set Event Mask (0x08|0x0001) plen 8       #31 [hci1] 1.041575
        Mask: 0x000002063f87fa5e
          LE Advertising Report
          LE Connection Update Complete
          LE Read Remote Used Features Complete
          LE Long Term Key Request
          LE Data Length Change
          LE Enhanced Connection Complete
          LE PHY Update Complete
          LE Extended Advertising Report
          LE Periodic Advertising Sync Established
          LE Periodic Advertising Report
          LE Periodic Advertising Sync Lost
          LE Extended Scan Timeout
          LE Extended Advertising Set Terminated
          LE Scan Request Received
          LE Periodic Advertising Sync Transfer Rvc
          LE CIS Established
          LE CIS Request
          LE Create BIG Complete
          LE Terminate BIG Complete
          LE BIG Sync Estabilished Complete
          LE BIG Sync Lost
          LE BIG Info Advertising Report
          LE Subrate Change
          Unknown mask (0x0000020000000000)
> HCI Event: Command Complete (0x0e) plen 4                 #32 [hci1] 1.042103
      LE Set Event Mask (0x08|0x0001) ncmd 1
        Status: Success (0x00)
< HCI Command: Set Event Mask (0x03|0x0001) plen 8          #33 [hci1] 1.061606
        Mask: 0x2000800002008890
          Disconnection Complete
          Encryption Change
          Read Remote Version Information Complete
          Hardware Error
          Data Buffer Overflow
          Encryption Key Refresh Complete
          LE Meta
> HCI Event: Command Complete (0x0e) plen 4                 #34 [hci1] 1.062124
      Set Event Mask (0x03|0x0001) ncmd 1
        Status: Success (0x00)
< HCI Command: Read BD ADDR (0x04|0x0009) plen 0            #35 [hci1] 1.081575
> HCI Event: Command Complete (0x0e) plen 10                #36 [hci1] 1.082064
      Read BD ADDR (0x04|0x0009) ncmd 1
        Status: Success (0x00)
        Address: 00:00:00:00:00:00 (OUI 00-00-00)
< HCI Command: LE Set Random Address (0x08|0x0005) plen 6   #37 [hci1] 1.101580
        Address: D5:B6:CC:31:DB:3B (Static)
> HCI Event: Command Complete (0x0e) plen 4                 #38 [hci1] 1.102131
      LE Set Random Address (0x08|0x0005) ncmd 1
        Status: Success (0x00)
< HCI Command: LE Set Extended Adv.. (0x08|0x0036) plen 25  #39 [hci1] 3.811688
        Handle: 0x00
        Properties: 0x0001
          Connectable
        Min advertising interval: 100.000 msec (0x00a0)
        Max advertising interval: 150.000 msec (0x00f0)
        Channel map: 37, 38, 39 (0x07)
        Own address type: Random (0x01)
        Peer address type: Public (0x00)
        Peer address: 00:00:00:00:00:00 (OUI 00-00-00)
        Filter policy: Allow Scan Request from Any, Allow Connect Request from Any (0x00)
        TX power: Host has no preference (0x7f)
        Primary PHY: LE 1M (0x01)
        Secondary max skip: 0x00
        Secondary PHY: LE 2M (0x02)
        SID: 0x00
        Scan request notifications: Disabled (0x00)
> HCI Event: Command Complete (0x0e) plen 5                 #40 [hci1] 3.812548
      LE Set Extended Advertising Parameters (0x08|0x0036) ncmd 1
        Status: Success (0x00)
        TX power (selected): 0 dbm (0x00)
< HCI Command: LE Set Advertising S.. (0x08|0x0035) plen 7  #41 [hci1] 3.821635
        Advertising handle: 0x00
        Advertising random address: D5:B6:CC:31:DB:3B (Static)
> HCI Event: Command Complete (0x0e) plen 4                 #42 [hci1] 3.822168
      LE Set Advertising Set Random Address (0x08|0x0035) ncmd 1
        Status: Success (0x00)
< HCI Command: LE Set Extended Adv.. (0x08|0x0037) plen 39  #43 [hci1] 3.841698
        Handle: 0x00
        Operation: Complete extended advertising data (0x03)
        Fragment preference: Minimize fragmentation (0x01)
        Data length: 0x23
        Flags: 0x06
          LE General Discoverable Mode
          BR/EDR Not Supported
        Name (complete): Tester_F6B11A
        Flags: 0x06
          LE General Discoverable Mode
          BR/EDR Not Supported
        16-bit Service UUIDs (complete): 1 entry
          Audio Stream Control (0x184e)
        Service Data: Audio Stream Control (0x184e)
          Data: 01ff0fff0f00
> HCI Event: Command Complete (0x0e) plen 4                 #44 [hci1] 3.842613
      LE Set Extended Advertising Data (0x08|0x0037) ncmd 1
        Status: Success (0x00)
< HCI Command: LE Set Extended Adve.. (0x08|0x0039) plen 6  #45 [hci1] 3.861671
        Extended advertising: Enabled (0x01)
        Number of sets: 1 (0x01)
        Entry 0
          Handle: 0x00
          Duration: 0 ms (0x00)
          Max ext adv events: 0
> HCI Event: Command Complete (0x0e) plen 4                 #46 [hci1] 3.862182
      LE Set Extended Advertising Enable (0x08|0x0039) ncmd 1
        Status: Success (0x00)
> HCI Event: LE Meta Event (0x3e) plen 31                   #47 [hci1] 3.973158
      LE Enhanced Connection Complete (0x0a)
        Status: Success (0x00)
        Handle: 1803
        Role: Peripheral (0x01)
        Peer address type: Random (0x01)
        Peer address: C7:1B:DC:08:AA:BB (Static)
        Local resolvable private address: 00:00:00:00:00:00 (Non-Resolvable)
        Peer resolvable private address: 00:00:00:00:00:00 (Non-Resolvable)
        Connection interval: 60.00 msec (0x0030)
        Connection latency: 0 (0x0000)
        Supervision timeout: 25120 msec (0x09d0)
        Central clock accuracy: 0x01
> HCI Event: LE Meta Event (0x3e) plen 6                    #48 [hci1] 3.973273
      LE Advertising Set Terminated (0x12)
        Status: Success (0x00)
        Handle: 0
        Connection handle: 1803
        Number of completed extended advertising events: 0
< HCI Command: LE Read Remote Used... (0x08|0x0016) plen 2  #49 [hci1] 3.981769
        Handle: 1803 Address: C7:1B:DC:08:AA:BB (Static)
< ACL Data TX: Handle 1803 flags 0x00 dlen 7                #50 [hci1] 3.981779
      ATT: Exchange MTU Request (0x02) len 2
        Client RX MTU: 251
> HCI Event: Command Status (0x0f) plen 4                   #51 [hci1] 3.982291
      LE Read Remote Used Features (0x08|0x0016) ncmd 1
        Status: Success (0x00)
> HCI Event: Number of Completed Packets (0x13) plen 5      #52 [hci1] 4.095115
        Num handles: 1
        Handle: 1803 Address: C7:1B:DC:08:AA:BB (Static)
        Count: 1
        #50: len 7 (0 Kb/s)
        Latency: 113 msec (113-113 msec ~113 msec)
> HCI Event: LE Meta Event (0x3e) plen 12                   #53 [hci1] 4.155473
      LE Read Remote Used Features (0x04)
        Status: Success (0x00)
        Handle: 1803 Address: C7:1B:DC:08:AA:BB (Static)
        Features: 0x2d 0x49 0x00 0xf7 0x67 0xd9 0x00 0x80
          LE Encryption
          Extended Reject Indication
          Peripheral-initiated Features Exchange
          LE Data Packet Length Extension
          LE 2M PHY
          LE Coded PHY
          Channel Selection Algorithm #2
          Periodic Advertising Sync Transfer - Sender
          Periodic Advertising Sync Transfer - Recipient
          Sleep Clock Accuracy Updates
          Connected Isochronous Stream - Central
          Connected Isochronous Stream - Peripheral
          Isochronous Broadcaster
          Synchronized Receiver
          Connected Isochronous Stream (Host Support)
          LE Power Control Request
          LE Power Control Request
          Connection Subrating
          Connection Subrating (Host Support)
          Unknown features (0x8000d90000000000)
> ACL Data RX: Handle 1803 flags 0x02 dlen 7                #54 [hci1] 4.455157
      ATT: Exchange MTU Request (0x02) len 2
        Client RX MTU: 64
> ACL Data RX: Handle 1803 flags 0x02 dlen 7                #55 [hci1] 4.455601
      ATT: Exchange MTU Response (0x03) len 2
        Server RX MTU: 64
< HCI Command: Host Number of Compl.. (0x03|0x0035) plen 5  #56 [hci1] 4.461798
        Num handles: 1
        Handle: 1803 Address: C7:1B:DC:08:AA:BB (Static)
        Count: 1
< ACL Data TX: Handle 1803 flags 0x00 dlen 7                #57 [hci1] 4.461847
      ATT: Exchange MTU Response (0x03) len 2
        Server RX MTU: 251
< HCI Command: Host Number of Compl.. (0x03|0x0035) plen 5  #58 [hci1] 4.462101
        Num handles: 1
        Handle: 1803 Address: C7:1B:DC:08:AA:BB (Static)
        Count: 1
> HCI Event: Number of Completed Packets (0x13) plen 5      #59 [hci1] 4.575163
        Num handles: 1
        Handle: 1803 Address: C7:1B:DC:08:AA:BB (Static)
        Count: 1
        #57: len 7 (0 Kb/s)
        Latency: 113 msec (113-113 msec ~113 msec)
> ACL Data RX: Handle 1803 flags 0x02 dlen 11               #60 [hci1] 6.555246
      SMP: Pairing Request (0x01) len 6
        IO capability: KeyboardDisplay (0x04)
        OOB data: Authentication data not present (0x00)
        Authentication requirement: Bonding, No MITM, SC, No Keypresses (0x09)
        Max encryption key size: 16
        Initiator key distribution: EncKey IdKey (0x03)
        Responder key distribution: EncKey IdKey Sign (0x07)
< HCI Command: Host Number of Compl.. (0x03|0x0035) plen 5  #61 [hci1] 6.562089
        Num handles: 1
        Handle: 1803 Address: C7:1B:DC:08:AA:BB (Static)
        Count: 1
< ACL Data TX: Handle 1803 flags 0x00 dlen 11               #62 [hci1] 6.562164
      SMP: Pairing Response (0x02) len 6
        IO capability: NoInputNoOutput (0x03)
        OOB data: Authentication data not present (0x00)
        Authentication requirement: Bonding, No MITM, SC, No Keypresses (0x09)
        Max encryption key size: 16
        Initiator key distribution: IdKey (0x02)
        Responder key distribution: <none> (0x00)
> HCI Event: Number of Completed Packets (0x13) plen 5      #63 [hci1] 6.675155
        Num handles: 1
        Handle: 1803 Address: C7:1B:DC:08:AA:BB (Static)
        Count: 1
        #62: len 11 (0 Kb/s)
        Latency: 112 msec (112-113 msec ~113 msec)
> ACL Data RX: Handle 1803 flags 0x02 dlen 27               #64 [hci1] 6.675605
> ACL Data RX: Handle 1803 flags 0x01 dlen 27               #65 [hci1] 6.675964
> ACL Data RX: Handle 1803 flags 0x01 dlen 15               #66 [hci1] 6.676233
      SMP: Pairing Public Key (0x0c) len 64
        X: c81b19d79c17b474c28f54480a25d28de43ac89f78cd464d373727546a0431ce
        Y: 1955d56ed8d06854a4115ff6eaba8516bf39e3bebfdb4b1fd784bfca77d6a47c
< HCI Command: Host Number of Compl.. (0x03|0x0035) plen 5  #67 [hci1] 6.682054
        Num handles: 1
        Handle: 1803 Address: C7:1B:DC:08:AA:BB (Static)
        Count: 1
< HCI Command: Host Number of Compl.. (0x03|0x0035) plen 5  #68 [hci1] 6.682156
        Num handles: 1
        Handle: 1803 Address: C7:1B:DC:08:AA:BB (Static)
        Count: 1
< HCI Command: Host Number of Compl.. (0x03|0x0035) plen 5  #69 [hci1] 6.682339
        Num handles: 1
        Handle: 1803 Address: C7:1B:DC:08:AA:BB (Static)
        Count: 1
< ACL Data TX: Handle 1803 flags 0x00 dlen 27               #70 [hci1] 6.682416
< ACL Data TX: Handle 1803 flags 0x01 dlen 27               #71 [hci1] 6.682424
< ACL Data TX: Handle 1803 flags 0x01 dlen 15               #72 [hci1] 6.682425
      SMP: Pairing Public Key (0x0c) len 64
        X: 98308440221e2d910f0e54b71e7ec652857aa9b5a0dc65028824cc19db1226e9
        Y: 67a4816bcb62efb21701e31fdb27561a6217575fb007a8bbdabe7e28b6f68482
> HCI Event: Number of Completed Packets (0x13) plen 5      #73 [hci1] 6.735591
        Num handles: 1
        Handle: 1803 Address: C7:1B:DC:08:AA:BB (Static)
        Count: 1
        #70: len 27 (4 Kb/s)
        Latency: 53 msec (53-113 msec ~83 msec)
> HCI Event: Number of Completed Packets (0x13) plen 5      #74 [hci1] 6.736122
        Num handles: 1
        Handle: 1803 Address: C7:1B:DC:08:AA:BB (Static)
        Count: 1
        #71: len 27 (4 Kb/s)
        Latency: 53 msec (53-113 msec ~68 msec)
< ACL Data TX: Handle 1803 flags 0x00 dlen 21               #75 [hci1] 6.741911
      SMP: Pairing Confirm (0x03) len 16
        Confim value: 9764cc2a23f1d5536c329e6b1099981b
> HCI Event: Number of Completed Packets (0x13) plen 5      #76 [hci1] 6.795154
        Num handles: 1
        Handle: 1803 Address: C7:1B:DC:08:AA:BB (Static)
        Count: 1
        #72: len 15 (1 Kb/s)
        Latency: 112 msec (53-113 msec ~90 msec)
> HCI Event: Number of Completed Packets (0x13) plen 5      #77 [hci1] 6.855298
        Num handles: 1
        Handle: 1803 Address: C7:1B:DC:08:AA:BB (Static)
        Count: 1
        #75: len 21 (1 Kb/s)
        Latency: 113 msec (53-113 msec ~101 msec)
> ACL Data RX: Handle 1803 flags 0x02 dlen 21               #78 [hci1] 6.855478
      SMP: Pairing Random (0x04) len 16
        Random value: 5883a8d03326dd0a0000000000000000
< HCI Command: Host Number of Compl.. (0x03|0x0035) plen 5  #79 [hci1] 6.862277
        Num handles: 1
        Handle: 1803 Address: C7:1B:DC:08:AA:BB (Static)
        Count: 1
< ACL Data TX: Handle 1803 flags 0x00 dlen 21               #80 [hci1] 6.862378
      SMP: Pairing Random (0x04) len 16
        Random value: 8e6108f966a694cbe26df70bb96773e6
> HCI Event: Number of Completed Packets (0x13) plen 5      #81 [hci1] 6.975048
        Num handles: 1
        Handle: 1803 Address: C7:1B:DC:08:AA:BB (Static)
        Count: 1
        #80: len 21 (1 Kb/s)
        Latency: 112 msec (53-113 msec ~107 msec)
> ACL Data RX: Handle 1803 flags 0x02 dlen 21               #82 [hci1] 7.155478
      SMP: Pairing DHKey Check (0x0d) len 16
        E: 081bb27a413229667813714118c7fee9
< HCI Command: Host Number of Compl.. (0x03|0x0035) plen 5  #83 [hci1] 7.161911
        Num handles: 1
        Handle: 1803 Address: C7:1B:DC:08:AA:BB (Static)
        Count: 1
< ACL Data TX: Handle 1803 flags 0x00 dlen 21               #84 [hci1] 7.161997
      SMP: Pairing DHKey Check (0x0d) len 16
        E: 18ebe69bef30782d29fac8535b75c516
> HCI Event: Number of Completed Packets (0x13) plen 5      #85 [hci1] 7.275035
        Num handles: 1
        Handle: 1803 Address: C7:1B:DC:08:AA:BB (Static)
        Count: 1
        #84: len 21 (1 Kb/s)
        Latency: 113 msec (53-113 msec ~110 msec)
> HCI Event: LE Meta Event (0x3e) plen 13                   #86 [hci1] 7.395521
      LE Long Term Key Request (0x05)
        Handle: 1803 Address: C7:1B:DC:08:AA:BB (Static)
        Random number: 0x0000000000000000
        Encrypted diversifier: 0x0000
< HCI Command: LE Long Term Key Re.. (0x08|0x001a) plen 18  #87 [hci1] 7.401919
        Handle: 1803 Address: C7:1B:DC:08:AA:BB (Static)
        Long term key: 82f6e845048624fe28dea714671be721
> HCI Event: Command Complete (0x0e) plen 6                 #88 [hci1] 7.402570
      LE Long Term Key Request Reply (0x08|0x001a) ncmd 1
        Status: Success (0x00)
        Handle: 1803 Address: C7:1B:DC:08:AA:BB (Static)
> HCI Event: Encryption Change (0x08) plen 4                #89 [hci1] 7.695378
        Status: Success (0x00)
        Handle: 1803 Address: C7:1B:DC:08:AA:BB (Static)
        Encryption: Enabled with AES-CCM (0x01)
> ACL Data RX: Handle 1803 flags 0x02 dlen 21               #90 [hci1] 7.755399
      SMP: Identity Information (0x08) len 16
        Identity resolving key: 2e785c97a1005b15f6db81bdf43d8674
< HCI Command: Host Number of Compl.. (0x03|0x0035) plen 5  #91 [hci1] 7.812462
        Num handles: 1
        Handle: 1803 Address: C7:1B:DC:08:AA:BB (Static)
        Count: 1
> ACL Data RX: Handle 1803 flags 0x02 dlen 12               #92 [hci1] 7.875247
      SMP: Identity Address Information (0x09) len 7
        Address: C7:1B:DC:08:AA:BB (Static)
< HCI Command: LE Add Device To Re.. (0x08|0x0027) plen 39  #93 [hci1] 7.882210
        Address type: Random (0x01)
        Address: C7:1B:DC:08:AA:BB (Static)
        Peer identity resolving key: 2e785c97a1005b15f6db81bdf43d8674
        Local identity resolving key: 00000000000000000000000000000000
> HCI Event: Command Complete (0x0e) plen 4                 #94 [hci1] 7.883180
      LE Add Device To Resolving List (0x08|0x0027) ncmd 1
        Status: Success (0x00)
< HCI Command: LE Set Privacy Mode (0x08|0x004e) plen 8     #95 [hci1] 7.901783
        Peer Identity address type: Random (0x01)
        Peer Identity address: C7:1B:DC:08:AA:BB (Static)
        Privacy Mode: Use Device Privacy (0x01)
> HCI Event: Command Complete (0x0e) plen 4                 #96 [hci1] 7.902363
      LE Set Privacy Mode (0x08|0x004e) ncmd 1
        Status: Success (0x00)
< HCI Command: LE Set Address Resol.. (0x08|0x002d) plen 1  #97 [hci1] 7.922014
        Address resolution: Enabled (0x01)
> HCI Event: Command Complete (0x0e) plen 4                 #98 [hci1] 7.922477
      LE Set Address Resolution Enable (0x08|0x002d) ncmd 1
        Status: Success (0x00)
> ACL Data RX: Handle 1803 flags 0x02 dlen 11               #99 [hci1] 7.935239
      ATT: Read By Group Type Request (0x10) len 6
        Handle range: 0x0001-0xffff
        Attribute group type: Primary Service (0x2800)
< HCI Command: Host Number of Comp.. (0x03|0x0035) plen 5  #100 [hci1] 7.941929
        Num handles: 1
        Handle: 1803 Address: C7:1B:DC:08:AA:BB (Static)
        Count: 1
< HCI Command: Host Number of Comp.. (0x03|0x0035) plen 5  #101 [hci1] 7.942436
        Num handles: 1
        Handle: 1803 Address: C7:1B:DC:08:AA:BB (Static)
        Count: 1
< ACL Data TX: Handle 1803 flags 0x00 dlen 27              #102 [hci1] 7.942535
< ACL Data TX: Handle 1803 flags 0x01 dlen 21              #103 [hci1] 7.942546
      ATT: Read By Group Type Response (0x11) len 43
        Attribute data length: 6
        Attribute group list: 7 entries
        Handle range: 0x0001-0x000a
        UUID: Generic Attribute Profile (0x1801)
        Handle range: 0x000b-0x0011
        UUID: Generic Access Profile (0x1800)
        Handle range: 0x0012-0x0026
        UUID: Device Information (0x180a)
        Handle range: 0x0027-0x0029
        UUID: Immediate Alert (0x1802)
        Handle range: 0x002a-0x003c
        UUID: Published Audio Capabilities (0x1850)
        Handle range: 0x003d-0x004c
        UUID: Audio Stream Control (0x184e)
        Handle range: 0x004d-0x0052
        UUID: Broadcast Audio Scan (0x184f)
> HCI Event: Number of Completed Packets (0x13) plen 5     #104 [hci1] 7.995567
        Num handles: 1
        Handle: 1803 Address: C7:1B:DC:08:AA:BB (Static)
        Count: 1
        #102: len 27 (4 Kb/s)
        Latency: 53 msec (53-113 msec ~81 msec)
> HCI Event: Number of Completed Packets (0x13) plen 5     #105 [hci1] 8.055199
        Num handles: 1
        Handle: 1803 Address: C7:1B:DC:08:AA:BB (Static)
        Count: 1
        #103: len 21 (1 Kb/s)
        Latency: 112 msec (53-113 msec ~97 msec)
> ACL Data RX: Handle 1803 flags 0x02 dlen 11              #106 [hci1] 8.055454
      ATT: Read By Group Type Request (0x10) len 6
        Handle range: 0x0053-0xffff
        Attribute group type: Primary Service (0x2800)
< HCI Command: Host Number of Comp.. (0x03|0x0035) plen 5  #107 [hci1] 8.061830
        Num handles: 1
        Handle: 1803 Address: C7:1B:DC:08:AA:BB (Static)
        Count: 1
< ACL Data TX: Handle 1803 flags 0x00 dlen 9               #108 [hci1] 8.061898
      ATT: Error Response (0x01) len 4
        Read By Group Type Request (0x10)
        Handle: 0x0053
        Error: Attribute Not Found (0x0a)
> HCI Event: Number of Completed Packets (0x13) plen 5     #109 [hci1] 8.175117
        Num handles: 1
        Handle: 1803 Address: C7:1B:DC:08:AA:BB (Static)
        Count: 1
        #108: len 9 (0 Kb/s)
        Latency: 113 msec (53-113 msec ~105 msec)
> ACL Data RX: Handle 1803 flags 0x02 dlen 11              #110 [hci1] 8.175387
      ATT: Read By Type Request (0x08) len 6
        Handle range: 0x0001-0x000a
        Attribute type: Characteristic (0x2803)
< HCI Command: Host Number of Comp.. (0x03|0x0035) plen 5  #111 [hci1] 8.182188
        Num handles: 1
        Handle: 1803 Address: C7:1B:DC:08:AA:BB (Static)
        Count: 1
< ACL Data TX: Handle 1803 flags 0x00 dlen 27              #112 [hci1] 8.182310
< ACL Data TX: Handle 1803 flags 0x01 dlen 7               #113 [hci1] 8.182457
      ATT: Read By Type Response (0x09) len 29
        Attribute data length: 7
        Attribute data list: 4 entries
        Handle: 0x0002
        Value: 200300052a
            Properties: 0x20
              Indicate (0x20)
            Value Handle: 0x0003
            Value UUID: Service Changed (0x2a05)
        Handle: 0x0005
        Value: 0a0600292b
            Properties: 0x0a
              Read (0x02)
              Write (0x08)
            Value Handle: 0x0006
            Value UUID: Client Supported Features (0x2b29)
        Handle: 0x0007
        Value: 0208002a2b
            Properties: 0x02
              Read (0x02)
            Value Handle: 0x0008
            Value UUID: Database Hash (0x2b2a)
        Handle: 0x0009
        Value: 020a003a2b
            Properties: 0x02
              Read (0x02)
            Value Handle: 0x000a
            Value UUID: Server Supported Features (0x2b3a)
> HCI Event: Number of Completed Packets (0x13) plen 5     #114 [hci1] 8.235552
        Num handles: 1
        Handle: 1803 Address: C7:1B:DC:08:AA:BB (Static)
        Count: 1
        #112: len 27 (4 Kb/s)
        Latency: 53 msec (53-113 msec ~79 msec)
> HCI Event: Number of Completed Packets (0x13) plen 5     #115 [hci1] 8.295121
        Num handles: 1
        Handle: 1803 Address: C7:1B:DC:08:AA:BB (Static)
        Count: 1
        #113: len 7 (0 Kb/s)
        Latency: 112 msec (53-113 msec ~95 msec)
> ACL Data RX: Handle 1803 flags 0x02 dlen 11              #116 [hci1] 8.295409
      ATT: Read By Type Request (0x08) len 6
        Handle range: 0x000a-0x000a
        Attribute type: Characteristic (0x2803)
< HCI Command: Host Number of Comp.. (0x03|0x0035) plen 5  #117 [hci1] 8.301822
        Num handles: 1
        Handle: 1803 Address: C7:1B:DC:08:AA:BB (Static)
        Count: 1
< ACL Data TX: Handle 1803 flags 0x00 dlen 9               #118 [hci1] 8.301956
      ATT: Error Response (0x01) len 4
        Read By Type Request (0x08)
        Handle: 0x000a
        Error: Attribute Not Found (0x0a)
> HCI Event: Number of Completed Packets (0x13) plen 5     #119 [hci1] 8.415140
        Num handles: 1
        Handle: 1803 Address: C7:1B:DC:08:AA:BB (Static)
        Count: 1
        #118: len 9 (0 Kb/s)
        Latency: 113 msec (53-113 msec ~104 msec)
> ACL Data RX: Handle 1803 flags 0x02 dlen 9               #120 [hci1] 8.415370
      ATT: Find Information Request (0x04) len 4
        Handle range: 0x0004-0x0004
< HCI Command: Host Number of Comp.. (0x03|0x0035) plen 5  #121 [hci1] 8.421990
        Num handles: 1
        Handle: 1803 Address: C7:1B:DC:08:AA:BB (Static)
        Count: 1
< ACL Data TX: Handle 1803 flags 0x00 dlen 10              #122 [hci1] 8.422038
      ATT: Find Information Response (0x05) len 5
        Format: UUID-16 (0x01)
        Handle: 0x0004
        UUID: Client Characteristic Configuration (0x2902)
> HCI Event: Number of Completed Packets (0x13) plen 5     #123 [hci1] 8.535216
        Num handles: 1
        Handle: 1803 Address: C7:1B:DC:08:AA:BB (Static)
        Count: 1
        #122: len 10 (0 Kb/s)
        Latency: 113 msec (53-113 msec ~108 msec)
> ACL Data RX: Handle 1803 flags 0x02 dlen 11              #124 [hci1] 8.535435
      ATT: Read By Type Request (0x08) len 6
        Handle range: 0x000b-0x0011
        Attribute type: Characteristic (0x2803)
< HCI Command: Host Number of Comp.. (0x03|0x0035) plen 5  #125 [hci1] 8.542102
        Num handles: 1
        Handle: 1803 Address: C7:1B:DC:08:AA:BB (Static)
        Count: 1
< ACL Data TX: Handle 1803 flags 0x00 dlen 27              #126 [hci1] 8.542158
      ATT: Read By Type Response (0x09) len 22
        Attribute data length: 7
        Attribute data list: 3 entries
        Handle: 0x000c
        Value: 0a0d00002a
            Properties: 0x0a
              Read (0x02)
              Write (0x08)
            Value Handle: 0x000d
            Value UUID: Device Name (0x2a00)
        Handle: 0x000e
        Value: 0a0f00012a
            Properties: 0x0a
              Read (0x02)
              Write (0x08)
            Value Handle: 0x000f
            Value UUID: Appearance (0x2a01)
        Handle: 0x0010
        Value: 021100042a
            Properties: 0x02
              Read (0x02)
            Value Handle: 0x0011
            Value UUID: Peripheral Preferred Connection Parameters (0x2a04)
> HCI Event: Number of Completed Packets (0x13) plen 5     #127 [hci1] 8.655173
        Num handles: 1
        Handle: 1803 Address: C7:1B:DC:08:AA:BB (Static)
        Count: 1
        #126: len 27 (1 Kb/s)
        Latency: 113 msec (53-113 msec ~110 msec)
> ACL Data RX: Handle 1803 flags 0x02 dlen 11              #128 [hci1] 8.655385
      ATT: Read By Type Request (0x08) len 6
        Handle range: 0x0011-0x0011
        Attribute type: Characteristic (0x2803)
< HCI Command: Host Number of Comp.. (0x03|0x0035) plen 5  #129 [hci1] 8.662353
        Num handles: 1
        Handle: 1803 Address: C7:1B:DC:08:AA:BB (Static)
        Count: 1
< ACL Data TX: Handle 1803 flags 0x00 dlen 9               #130 [hci1] 8.662603
      ATT: Error Response (0x01) len 4
        Read By Type Request (0x08)
        Handle: 0x0011
        Error: Attribute Not Found (0x0a)
> HCI Event: Number of Completed Packets (0x13) plen 5     #131 [hci1] 8.775160
        Num handles: 1
        Handle: 1803 Address: C7:1B:DC:08:AA:BB (Static)
        Count: 1
        #130: len 9 (0 Kb/s)
        Latency: 112 msec (53-113 msec ~111 msec)
> ACL Data RX: Handle 1803 flags 0x02 dlen 11              #132 [hci1] 8.775354
      ATT: Read By Type Request (0x08) len 6
        Handle range: 0x0012-0x0026
        Attribute type: Characteristic (0x2803)
< HCI Command: Host Number of Comp.. (0x03|0x0035) plen 5  #133 [hci1] 8.782410
        Num handles: 1
        Handle: 1803 Address: C7:1B:DC:08:AA:BB (Static)
        Count: 1
< ACL Data TX: Handle 1803 flags 0x00 dlen 27              #134 [hci1] 8.782542
< ACL Data TX: Handle 1803 flags 0x01 dlen 27              #135 [hci1] 8.782577
< ACL Data TX: Handle 1803 flags 0x01 dlen 8               #136 [hci1] 8.782648
      ATT: Read By Type Response (0x09) len 57
        Attribute data length: 7
        Attribute data list: 8 entries
        Handle: 0x0013
        Value: 021400242a
            Properties: 0x02
              Read (0x02)
            Value Handle: 0x0014
            Value UUID: Model Number String (0x2a24)
        Handle: 0x0015
        Value: 021600292a
            Properties: 0x02
              Read (0x02)
            Value Handle: 0x0016
            Value UUID: Manufacturer Name String (0x2a29)
        Handle: 0x0017
        Value: 021800502a
            Properties: 0x02
              Read (0x02)
            Value Handle: 0x0018
            Value UUID: PnP ID (0x2a50)
        Handle: 0x0019
        Value: 021a00252a
            Properties: 0x02
              Read (0x02)
            Value Handle: 0x001a
            Value UUID: Serial Number String (0x2a25)
        Handle: 0x001b
        Value: 021c00262a
            Properties: 0x02
              Read (0x02)
            Value Handle: 0x001c
            Value UUID: Firmware Revision String (0x2a26)
        Handle: 0x001d
        Value: 021e00272a
            Properties: 0x02
              Read (0x02)
            Value Handle: 0x001e
            Value UUID: Hardware Revision String (0x2a27)
        Handle: 0x001f
        Value: 022000282a
            Properties: 0x02
              Read (0x02)
            Value Handle: 0x0020
            Value UUID: Software Revision String (0x2a28)
        Handle: 0x0021
        Value: 022200ff2b
            Properties: 0x02
              Read (0x02)
            Value Handle: 0x0022
            Value UUID: Unknown (0x2bff)
> HCI Event: Number of Completed Packets (0x13) plen 5     #137 [hci1] 8.835578
        Num handles: 1
        Handle: 1803 Address: C7:1B:DC:08:AA:BB (Static)
        Count: 1
        #134: len 27 (4 Kb/s)
        Latency: 53 msec (53-113 msec ~82 msec)
> HCI Event: Number of Completed Packets (0x13) plen 5     #138 [hci1] 8.836035
        Num handles: 1
        Handle: 1803 Address: C7:1B:DC:08:AA:BB (Static)
        Count: 1
        #135: len 27 (4 Kb/s)
        Latency: 53 msec (53-113 msec ~67 msec)
> HCI Event: Number of Completed Packets (0x13) plen 5     #139 [hci1] 8.895124
        Num handles: 1
        Handle: 1803 Address: C7:1B:DC:08:AA:BB (Static)
        Count: 1
        #136: len 8 (0 Kb/s)
        Latency: 112 msec (53-113 msec ~90 msec)
> ACL Data RX: Handle 1803 flags 0x02 dlen 11              #140 [hci1] 8.895464
      ATT: Read By Type Request (0x08) len 6
        Handle range: 0x0022-0x0026
        Attribute type: Characteristic (0x2803)
< HCI Command: Host Number of Comp.. (0x03|0x0035) plen 5  #141 [hci1] 8.902331
        Num handles: 1
        Handle: 1803 Address: C7:1B:DC:08:AA:BB (Static)
        Count: 1
< ACL Data TX: Handle 1803 flags 0x00 dlen 20              #142 [hci1] 8.902416
      ATT: Read By Type Response (0x09) len 15
        Attribute data length: 7
        Attribute data list: 2 entries
        Handle: 0x0023
        Value: 022400232a
            Properties: 0x02
              Read (0x02)
            Value Handle: 0x0024
            Value UUID: System ID (0x2a23)
        Handle: 0x0025
        Value: 0226002a2a
            Properties: 0x02
              Read (0x02)
            Value Handle: 0x0026
            Value UUID: IEEE 11073-20601 Regulatory Cert. Data List (0x2a2a)
> HCI Event: Number of Completed Packets (0x13) plen 5     #143 [hci1] 9.015202
        Num handles: 1
        Handle: 1803 Address: C7:1B:DC:08:AA:BB (Static)
        Count: 1
        #142: len 20 (1 Kb/s)
        Latency: 112 msec (53-113 msec ~101 msec)
> ACL Data RX: Handle 1803 flags 0x02 dlen 11              #144 [hci1] 9.015467
      ATT: Read By Type Request (0x08) len 6
        Handle range: 0x0026-0x0026
        Attribute type: Characteristic (0x2803)
< HCI Command: Host Number of Comp.. (0x03|0x0035) plen 5  #145 [hci1] 9.021980
        Num handles: 1
        Handle: 1803 Address: C7:1B:DC:08:AA:BB (Static)
        Count: 1
< ACL Data TX: Handle 1803 flags 0x00 dlen 9               #146 [hci1] 9.022131
      ATT: Error Response (0x01) len 4
        Read By Type Request (0x08)
        Handle: 0x0026
        Error: Attribute Not Found (0x0a)
> HCI Event: Number of Completed Packets (0x13) plen 5     #147 [hci1] 9.135133
        Num handles: 1
        Handle: 1803 Address: C7:1B:DC:08:AA:BB (Static)
        Count: 1
        #146: len 9 (0 Kb/s)
        Latency: 113 msec (53-113 msec ~107 msec)
> ACL Data RX: Handle 1803 flags 0x02 dlen 11              #148 [hci1] 9.135428
      ATT: Read By Type Request (0x08) len 6
        Handle range: 0x0027-0x0029
        Attribute type: Characteristic (0x2803)
< HCI Command: Host Number of Comp.. (0x03|0x0035) plen 5  #149 [hci1] 9.142362
        Num handles: 1
        Handle: 1803 Address: C7:1B:DC:08:AA:BB (Static)
        Count: 1
< ACL Data TX: Handle 1803 flags 0x00 dlen 13              #150 [hci1] 9.142466
      ATT: Read By Type Response (0x09) len 8
        Attribute data length: 7
        Attribute data list: 1 entry
        Handle: 0x0028
        Value: 042900062a
            Properties: 0x04
              Write Without Response (0x04)
            Value Handle: 0x0029
            Value UUID: Alert Level (0x2a06)
> HCI Event: Number of Completed Packets (0x13) plen 5     #151 [hci1] 9.255131
        Num handles: 1
        Handle: 1803 Address: C7:1B:DC:08:AA:BB (Static)
        Count: 1
        #150: len 13 (0 Kb/s)
        Latency: 112 msec (53-113 msec ~109 msec)
> ACL Data RX: Handle 1803 flags 0x02 dlen 11              #152 [hci1] 9.255400
      ATT: Read By Type Request (0x08) len 6
        Handle range: 0x0029-0x0029
        Attribute type: Characteristic (0x2803)
< HCI Command: Host Number of Comp.. (0x03|0x0035) plen 5  #153 [hci1] 9.262360
        Num handles: 1
        Handle: 1803 Address: C7:1B:DC:08:AA:BB (Static)
        Count: 1
< ACL Data TX: Handle 1803 flags 0x00 dlen 9               #154 [hci1] 9.262581
      ATT: Error Response (0x01) len 4
        Read By Type Request (0x08)
        Handle: 0x0029
        Error: Attribute Not Found (0x0a)
> HCI Event: Number of Completed Packets (0x13) plen 5     #155 [hci1] 9.375176
        Num handles: 1
        Handle: 1803 Address: C7:1B:DC:08:AA:BB (Static)
        Count: 1
        #154: len 9 (0 Kb/s)
        Latency: 112 msec (53-113 msec ~111 msec)
> ACL Data RX: Handle 1803 flags 0x02 dlen 11              #156 [hci1] 9.375331
      ATT: Read By Type Request (0x08) len 6
        Handle range: 0x002a-0x003c
        Attribute type: Characteristic (0x2803)
< HCI Command: Host Number of Comp.. (0x03|0x0035) plen 5  #157 [hci1] 9.382355
        Num handles: 1
        Handle: 1803 Address: C7:1B:DC:08:AA:BB (Static)
        Count: 1
< ACL Data TX: Handle 1803 flags 0x00 dlen 27              #158 [hci1] 9.382436
< ACL Data TX: Handle 1803 flags 0x01 dlen 21              #159 [hci1] 9.382520
      ATT: Read By Type Response (0x09) len 43
        Attribute data length: 7
        Attribute data list: 6 entries
        Handle: 0x002b
        Value: 122c00c92b
            Properties: 0x12
              Read (0x02)
              Notify (0x10)
            Value Handle: 0x002c
            Value UUID: Sink PAC (0x2bc9)
        Handle: 0x002e
        Value: 1a2f00ca2b
            Properties: 0x1a
              Read (0x02)
              Write (0x08)
              Notify (0x10)
            Value Handle: 0x002f
            Value UUID: Sink Audio Locations (0x2bca)
        Handle: 0x0031
        Value: 123200cb2b
            Properties: 0x12
              Read (0x02)
              Notify (0x10)
            Value Handle: 0x0032
            Value UUID: Source PAC (0x2bcb)
        Handle: 0x0034
        Value: 1a3500cc2b
            Properties: 0x1a
              Read (0x02)
              Write (0x08)
              Notify (0x10)
            Value Handle: 0x0035
            Value UUID: Source Audio Locations (0x2bcc)
        Handle: 0x0037
        Value: 123800cd2b
            Properties: 0x12
              Read (0x02)
              Notify (0x10)
            Value Handle: 0x0038
            Value UUID: Available Audio Contexts (0x2bcd)
        Handle: 0x003a
        Value: 123b00ce2b
            Properties: 0x12
              Read (0x02)
              Notify (0x10)
            Value Handle: 0x003b
            Value UUID: Supported Audio Contexts (0x2bce)
> HCI Event: Number of Completed Packets (0x13) plen 5     #160 [hci1] 9.435604
        Num handles: 1
        Handle: 1803 Address: C7:1B:DC:08:AA:BB (Static)
        Count: 1
        #158: len 27 (4 Kb/s)
        Latency: 53 msec (53-113 msec ~82 msec)
> HCI Event: Number of Completed Packets (0x13) plen 5     #161 [hci1] 9.495158
        Num handles: 1
        Handle: 1803 Address: C7:1B:DC:08:AA:BB (Static)
        Count: 1
        #159: len 21 (1 Kb/s)
        Latency: 112 msec (53-113 msec ~97 msec)
> ACL Data RX: Handle 1803 flags 0x02 dlen 11              #162 [hci1] 9.495399
      ATT: Read By Type Request (0x08) len 6
        Handle range: 0x003b-0x003c
        Attribute type: Characteristic (0x2803)
< HCI Command: Host Number of Comp.. (0x03|0x0035) plen 5  #163 [hci1] 9.502315
        Num handles: 1
        Handle: 1803 Address: C7:1B:DC:08:AA:BB (Static)
        Count: 1
< ACL Data TX: Handle 1803 flags 0x00 dlen 9               #164 [hci1] 9.502559
      ATT: Error Response (0x01) len 4
        Read By Type Request (0x08)
        Handle: 0x003b
        Error: Attribute Not Found (0x0a)
> HCI Event: Number of Completed Packets (0x13) plen 5     #165 [hci1] 9.615090
        Num handles: 1
        Handle: 1803 Address: C7:1B:DC:08:AA:BB (Static)
        Count: 1
        #164: len 9 (0 Kb/s)
        Latency: 112 msec (53-113 msec ~104 msec)
> ACL Data RX: Handle 1803 flags 0x02 dlen 9               #166 [hci1] 9.615350
      ATT: Find Information Request (0x04) len 4
        Handle range: 0x002d-0x002d
< HCI Command: Host Number of Comp.. (0x03|0x0035) plen 5  #167 [hci1] 9.622254
        Num handles: 1
        Handle: 1803 Address: C7:1B:DC:08:AA:BB (Static)
        Count: 1
< ACL Data TX: Handle 1803 flags 0x00 dlen 10              #168 [hci1] 9.622433
      ATT: Find Information Response (0x05) len 5
        Format: UUID-16 (0x01)
        Handle: 0x002d
        UUID: Client Characteristic Configuration (0x2902)
> HCI Event: Number of Completed Packets (0x13) plen 5     #169 [hci1] 9.735196
        Num handles: 1
        Handle: 1803 Address: C7:1B:DC:08:AA:BB (Static)
        Count: 1
        #168: len 10 (0 Kb/s)
        Latency: 112 msec (53-113 msec ~108 msec)
> ACL Data RX: Handle 1803 flags 0x02 dlen 9               #170 [hci1] 9.735358
      ATT: Find Information Request (0x04) len 4
        Handle range: 0x0030-0x0030
< HCI Command: Host Number of Comp.. (0x03|0x0035) plen 5  #171 [hci1] 9.742221
        Num handles: 1
        Handle: 1803 Address: C7:1B:DC:08:AA:BB (Static)
        Count: 1
< ACL Data TX: Handle 1803 flags 0x00 dlen 10              #172 [hci1] 9.742338
      ATT: Find Information Response (0x05) len 5
        Format: UUID-16 (0x01)
        Handle: 0x0030
        UUID: Client Characteristic Configuration (0x2902)
> HCI Event: Number of Completed Packets (0x13) plen 5     #173 [hci1] 9.855123
        Num handles: 1
        Handle: 1803 Address: C7:1B:DC:08:AA:BB (Static)
        Count: 1
        #172: len 10 (0 Kb/s)
        Latency: 112 msec (53-113 msec ~110 msec)
> ACL Data RX: Handle 1803 flags 0x02 dlen 9               #174 [hci1] 9.855437
      ATT: Find Information Request (0x04) len 4
        Handle range: 0x0033-0x0033
< HCI Command: Host Number of Comp.. (0x03|0x0035) plen 5  #175 [hci1] 9.862055
        Num handles: 1
        Handle: 1803 Address: C7:1B:DC:08:AA:BB (Static)
        Count: 1
< ACL Data TX: Handle 1803 flags 0x00 dlen 10              #176 [hci1] 9.862119
      ATT: Find Information Response (0x05) len 5
        Format: UUID-16 (0x01)
        Handle: 0x0033
        UUID: Client Characteristic Configuration (0x2902)
> HCI Event: Number of Completed Packets (0x13) plen 5     #177 [hci1] 9.975183
        Num handles: 1
        Handle: 1803 Address: C7:1B:DC:08:AA:BB (Static)
        Count: 1
        #176: len 10 (0 Kb/s)
        Latency: 113 msec (53-113 msec ~111 msec)
> ACL Data RX: Handle 1803 flags 0x02 dlen 9               #178 [hci1] 9.975342
      ATT: Find Information Request (0x04) len 4
        Handle range: 0x0036-0x0036
< HCI Command: Host Number of Comp.. (0x03|0x0035) plen 5  #179 [hci1] 9.982293
        Num handles: 1
        Handle: 1803 Address: C7:1B:DC:08:AA:BB (Static)
        Count: 1
< ACL Data TX: Handle 1803 flags 0x00 dlen 10              #180 [hci1] 9.982395
      ATT: Find Information Response (0x05) len 5
        Format: UUID-16 (0x01)
        Handle: 0x0036
        UUID: Client Characteristic Configuration (0x2902)
> HCI Event: Number of Completed Packets (0x13) plen 5    #181 [hci1] 10.095101
        Num handles: 1
        Handle: 1803 Address: C7:1B:DC:08:AA:BB (Static)
        Count: 1
        #180: len 10 (0 Kb/s)
        Latency: 112 msec (53-113 msec ~112 msec)
> ACL Data RX: Handle 1803 flags 0x02 dlen 9              #182 [hci1] 10.095451
      ATT: Find Information Request (0x04) len 4
        Handle range: 0x0039-0x0039
< HCI Command: Host Number of Com.. (0x03|0x0035) plen 5  #183 [hci1] 10.102248
        Num handles: 1
        Handle: 1803 Address: C7:1B:DC:08:AA:BB (Static)
        Count: 1
< ACL Data TX: Handle 1803 flags 0x00 dlen 10             #184 [hci1] 10.102352
      ATT: Find Information Response (0x05) len 5
        Format: UUID-16 (0x01)
        Handle: 0x0039
        UUID: Client Characteristic Configuration (0x2902)
> HCI Event: Number of Completed Packets (0x13) plen 5    #185 [hci1] 10.215213
        Num handles: 1
        Handle: 1803 Address: C7:1B:DC:08:AA:BB (Static)
        Count: 1
        #184: len 10 (0 Kb/s)
        Latency: 112 msec (53-113 msec ~112 msec)
> ACL Data RX: Handle 1803 flags 0x02 dlen 9              #186 [hci1] 10.215307
      ATT: Find Information Request (0x04) len 4
        Handle range: 0x003c-0x003c
< HCI Command: Host Number of Com.. (0x03|0x0035) plen 5  #187 [hci1] 10.221855
        Num handles: 1
        Handle: 1803 Address: C7:1B:DC:08:AA:BB (Static)
        Count: 1
< ACL Data TX: Handle 1803 flags 0x00 dlen 10             #188 [hci1] 10.221929
      ATT: Find Information Response (0x05) len 5
        Format: UUID-16 (0x01)
        Handle: 0x003c
        UUID: Client Characteristic Configuration (0x2902)
> HCI Event: Number of Completed Packets (0x13) plen 5    #189 [hci1] 10.335170
        Num handles: 1
        Handle: 1803 Address: C7:1B:DC:08:AA:BB (Static)
        Count: 1
        #188: len 10 (0 Kb/s)
        Latency: 113 msec (53-113 msec ~112 msec)
> ACL Data RX: Handle 1803 flags 0x02 dlen 11             #190 [hci1] 10.335272
      ATT: Read By Type Request (0x08) len 6
        Handle range: 0x003d-0x004c
        Attribute type: Characteristic (0x2803)
< HCI Command: Host Number of Com.. (0x03|0x0035) plen 5  #191 [hci1] 10.341956
        Num handles: 1
        Handle: 1803 Address: C7:1B:DC:08:AA:BB (Static)
        Count: 1
< ACL Data TX: Handle 1803 flags 0x00 dlen 27             #192 [hci1] 10.341988
< ACL Data TX: Handle 1803 flags 0x01 dlen 14             #193 [hci1] 10.342000
      ATT: Read By Type Response (0x09) len 36
        Attribute data length: 7
        Attribute data list: 5 entries
        Handle: 0x003e
        Value: 1c3f00c62b
            Properties: 0x1c
              Write Without Response (0x04)
              Write (0x08)
              Notify (0x10)
            Value Handle: 0x003f
            Value UUID: ASE Control Point (0x2bc6)
        Handle: 0x0041
        Value: 124200c42b
            Properties: 0x12
              Read (0x02)
              Notify (0x10)
            Value Handle: 0x0042
            Value UUID: Sink ASE (0x2bc4)
        Handle: 0x0044
        Value: 124500c42b
            Properties: 0x12
              Read (0x02)
              Notify (0x10)
            Value Handle: 0x0045
            Value UUID: Sink ASE (0x2bc4)
        Handle: 0x0047
        Value: 124800c52b
            Properties: 0x12
              Read (0x02)
              Notify (0x10)
            Value Handle: 0x0048
            Value UUID: Source ASE (0x2bc5)
        Handle: 0x004a
        Value: 124b00c52b
            Properties: 0x12
              Read (0x02)
              Notify (0x10)
            Value Handle: 0x004b
            Value UUID: Source ASE (0x2bc5)
> HCI Event: Number of Completed Packets (0x13) plen 5    #194 [hci1] 10.395557
        Num handles: 1
        Handle: 1803 Address: C7:1B:DC:08:AA:BB (Static)
        Count: 1
        #192: len 27 (4 Kb/s)
        Latency: 53 msec (53-113 msec ~83 msec)
> HCI Event: Number of Completed Packets (0x13) plen 5    #195 [hci1] 10.455119
        Num handles: 1
        Handle: 1803 Address: C7:1B:DC:08:AA:BB (Static)
        Count: 1
        #193: len 14 (0 Kb/s)
        Latency: 113 msec (53-113 msec ~98 msec)
> ACL Data RX: Handle 1803 flags 0x02 dlen 11             #196 [hci1] 10.455358
      ATT: Read By Type Request (0x08) len 6
        Handle range: 0x004b-0x004c
        Attribute type: Characteristic (0x2803)
< HCI Command: Host Number of Com.. (0x03|0x0035) plen 5  #197 [hci1] 10.462401
        Num handles: 1
        Handle: 1803 Address: C7:1B:DC:08:AA:BB (Static)
        Count: 1
< ACL Data TX: Handle 1803 flags 0x00 dlen 9              #198 [hci1] 10.462650
      ATT: Error Response (0x01) len 4
        Read By Type Request (0x08)
        Handle: 0x004b
        Error: Attribute Not Found (0x0a)
> HCI Event: Number of Completed Packets (0x13) plen 5    #199 [hci1] 10.575187
        Num handles: 1
        Handle: 1803 Address: C7:1B:DC:08:AA:BB (Static)
        Count: 1
        #198: len 9 (0 Kb/s)
        Latency: 112 msec (53-113 msec ~105 msec)
> ACL Data RX: Handle 1803 flags 0x02 dlen 9              #200 [hci1] 10.575295
      ATT: Find Information Request (0x04) len 4
        Handle range: 0x0040-0x0040
< HCI Command: Host Number of Com.. (0x03|0x0035) plen 5  #201 [hci1] 10.581922
        Num handles: 1
        Handle: 1803 Address: C7:1B:DC:08:AA:BB (Static)
        Count: 1
< ACL Data TX: Handle 1803 flags 0x00 dlen 10             #202 [hci1] 10.581956
      ATT: Find Information Response (0x05) len 5
        Format: UUID-16 (0x01)
        Handle: 0x0040
        UUID: Client Characteristic Configuration (0x2902)
> HCI Event: Number of Completed Packets (0x13) plen 5    #203 [hci1] 10.695103
        Num handles: 1
        Handle: 1803 Address: C7:1B:DC:08:AA:BB (Static)
        Count: 1
        #202: len 10 (0 Kb/s)
        Latency: 113 msec (53-113 msec ~109 msec)
> ACL Data RX: Handle 1803 flags 0x02 dlen 9              #204 [hci1] 10.695316
      ATT: Find Information Request (0x04) len 4
        Handle range: 0x0043-0x0043
< HCI Command: Host Number of Com.. (0x03|0x0035) plen 5  #205 [hci1] 10.702394
        Num handles: 1
        Handle: 1803 Address: C7:1B:DC:08:AA:BB (Static)
        Count: 1
< ACL Data TX: Handle 1803 flags 0x00 dlen 10             #206 [hci1] 10.702495
      ATT: Find Information Response (0x05) len 5
        Format: UUID-16 (0x01)
        Handle: 0x0043
        UUID: Client Characteristic Configuration (0x2902)
> HCI Event: Number of Completed Packets (0x13) plen 5    #207 [hci1] 10.815095
        Num handles: 1
        Handle: 1803 Address: C7:1B:DC:08:AA:BB (Static)
        Count: 1
        #206: len 10 (0 Kb/s)
        Latency: 112 msec (53-113 msec ~110 msec)
> ACL Data RX: Handle 1803 flags 0x02 dlen 9              #208 [hci1] 10.815306
      ATT: Find Information Request (0x04) len 4
        Handle range: 0x0046-0x0046
< HCI Command: Host Number of Com.. (0x03|0x0035) plen 5  #209 [hci1] 10.822418
        Num handles: 1
        Handle: 1803 Address: C7:1B:DC:08:AA:BB (Static)
        Count: 1
< ACL Data TX: Handle 1803 flags 0x00 dlen 10             #210 [hci1] 10.822522
      ATT: Find Information Response (0x05) len 5
        Format: UUID-16 (0x01)
        Handle: 0x0046
        UUID: Client Characteristic Configuration (0x2902)
> HCI Event: Number of Completed Packets (0x13) plen 5    #211 [hci1] 10.935143
        Num handles: 1
        Handle: 1803 Address: C7:1B:DC:08:AA:BB (Static)
        Count: 1
        #210: len 10 (0 Kb/s)
        Latency: 112 msec (53-113 msec ~111 msec)
> ACL Data RX: Handle 1803 flags 0x02 dlen 9              #212 [hci1] 10.935307
      ATT: Find Information Request (0x04) len 4
        Handle range: 0x0049-0x0049
< HCI Command: Host Number of Com.. (0x03|0x0035) plen 5  #213 [hci1] 10.942240
        Num handles: 1
        Handle: 1803 Address: C7:1B:DC:08:AA:BB (Static)
        Count: 1
< ACL Data TX: Handle 1803 flags 0x00 dlen 10             #214 [hci1] 10.942377
      ATT: Find Information Response (0x05) len 5
        Format: UUID-16 (0x01)
        Handle: 0x0049
        UUID: Client Characteristic Configuration (0x2902)
> HCI Event: Number of Completed Packets (0x13) plen 5    #215 [hci1] 11.055148
        Num handles: 1
        Handle: 1803 Address: C7:1B:DC:08:AA:BB (Static)
        Count: 1
        #214: len 10 (0 Kb/s)
        Latency: 112 msec (53-113 msec ~112 msec)
> ACL Data RX: Handle 1803 flags 0x02 dlen 9              #216 [hci1] 11.055341
      ATT: Find Information Request (0x04) len 4
        Handle range: 0x004c-0x004c
< HCI Command: Host Number of Com.. (0x03|0x0035) plen 5  #217 [hci1] 11.061923
        Num handles: 1
        Handle: 1803 Address: C7:1B:DC:08:AA:BB (Static)
        Count: 1
< ACL Data TX: Handle 1803 flags 0x00 dlen 10             #218 [hci1] 11.062028
      ATT: Find Information Response (0x05) len 5
        Format: UUID-16 (0x01)
        Handle: 0x004c
        UUID: Client Characteristic Configuration (0x2902)
> HCI Event: Number of Completed Packets (0x13) plen 5    #219 [hci1] 11.175177
        Num handles: 1
        Handle: 1803 Address: C7:1B:DC:08:AA:BB (Static)
        Count: 1
        #218: len 10 (0 Kb/s)
        Latency: 113 msec (53-113 msec ~112 msec)
> ACL Data RX: Handle 1803 flags 0x02 dlen 11             #220 [hci1] 11.175328
      ATT: Read By Type Request (0x08) len 6
        Handle range: 0x004d-0x0052
        Attribute type: Characteristic (0x2803)
< HCI Command: Host Number of Com.. (0x03|0x0035) plen 5  #221 [hci1] 11.182355
        Num handles: 1
        Handle: 1803 Address: C7:1B:DC:08:AA:BB (Static)
        Count: 1
< ACL Data TX: Handle 1803 flags 0x00 dlen 20             #222 [hci1] 11.182405
      ATT: Read By Type Response (0x09) len 15
        Attribute data length: 7
        Attribute data list: 2 entries
        Handle: 0x004e
        Value: 0c4f00c72b
            Properties: 0x0c
              Write Without Response (0x04)
              Write (0x08)
            Value Handle: 0x004f
            Value UUID: Broadcast Audio Scan Control Point (0x2bc7)
        Handle: 0x0050
        Value: 125100c82b
            Properties: 0x12
              Read (0x02)
              Notify (0x10)
            Value Handle: 0x0051
            Value UUID: Broadcast Receive State (0x2bc8)
> HCI Event: Number of Completed Packets (0x13) plen 5    #223 [hci1] 11.295100
        Num handles: 1
        Handle: 1803 Address: C7:1B:DC:08:AA:BB (Static)
        Count: 1
        #222: len 20 (1 Kb/s)
        Latency: 112 msec (53-113 msec ~112 msec)
> ACL Data RX: Handle 1803 flags 0x02 dlen 11             #224 [hci1] 11.295333
      ATT: Read By Type Request (0x08) len 6
        Handle range: 0x0051-0x0052
        Attribute type: Characteristic (0x2803)
< HCI Command: Host Number of Com.. (0x03|0x0035) plen 5  #225 [hci1] 11.301941
        Num handles: 1
        Handle: 1803 Address: C7:1B:DC:08:AA:BB (Static)
        Count: 1
< ACL Data TX: Handle 1803 flags 0x00 dlen 9              #226 [hci1] 11.302064
      ATT: Error Response (0x01) len 4
        Read By Type Request (0x08)
        Handle: 0x0051
        Error: Attribute Not Found (0x0a)
> HCI Event: Number of Completed Packets (0x13) plen 5    #227 [hci1] 11.415078
        Num handles: 1
        Handle: 1803 Address: C7:1B:DC:08:AA:BB (Static)
        Count: 1
        #226: len 9 (0 Kb/s)
        Latency: 113 msec (53-113 msec ~112 msec)
> ACL Data RX: Handle 1803 flags 0x02 dlen 9              #228 [hci1] 11.415297
      ATT: Find Information Request (0x04) len 4
        Handle range: 0x0052-0x0052
< HCI Command: Host Number of Com.. (0x03|0x0035) plen 5  #229 [hci1] 11.422300
        Num handles: 1
        Handle: 1803 Address: C7:1B:DC:08:AA:BB (Static)
        Count: 1
< ACL Data TX: Handle 1803 flags 0x00 dlen 10             #230 [hci1] 11.422466
      ATT: Find Information Response (0x05) len 5
        Format: UUID-16 (0x01)
        Handle: 0x0052
        UUID: Client Characteristic Configuration (0x2902)
> HCI Event: Number of Completed Packets (0x13) plen 5    #231 [hci1] 11.535152
        Num handles: 1
        Handle: 1803 Address: C7:1B:DC:08:AA:BB (Static)
        Count: 1
        #230: len 10 (0 Kb/s)
        Latency: 112 msec (53-113 msec ~112 msec)
> ACL Data RX: Handle 1803 flags 0x02 dlen 11             #232 [hci1] 11.535446
      ATT: Read By Type Request (0x08) len 6
        Handle range: 0x0001-0xffff
        Attribute type: Include (0x2802)
< HCI Command: Host Number of Com.. (0x03|0x0035) plen 5  #233 [hci1] 11.542340
        Num handles: 1
        Handle: 1803 Address: C7:1B:DC:08:AA:BB (Static)
        Count: 1
< ACL Data TX: Handle 1803 flags 0x00 dlen 9              #234 [hci1] 11.542495
      ATT: Error Response (0x01) len 4
        Read By Type Request (0x08)
        Handle: 0x0001
        Error: Attribute Not Found (0x0a)
> HCI Event: Number of Completed Packets (0x13) plen 5    #235 [hci1] 11.655126
        Num handles: 1
        Handle: 1803 Address: C7:1B:DC:08:AA:BB (Static)
        Count: 1
        #234: len 9 (0 Kb/s)
        Latency: 112 msec (53-113 msec ~112 msec)
> ACL Data RX: Handle 1803 flags 0x02 dlen 9              #236 [hci1] 11.655351
      ATT: Write Request (0x12) len 4
        Handle: 0x0052 Type: Client Characteristic Configuration (0x2902)
        Value Handle: 0x0051 Type: Broadcast Receive State (0x2bc8)
          Data: 0000
< HCI Command: Host Number of Com.. (0x03|0x0035) plen 5  #237 [hci1] 11.662245
        Num handles: 1
        Handle: 1803 Address: C7:1B:DC:08:AA:BB (Static)
        Count: 1
< ACL Data TX: Handle 1803 flags 0x00 dlen 5              #238 [hci1] 11.662408
      ATT: Write Response (0x13) len 0
> HCI Event: Number of Completed Packets (0x13) plen 5    #239 [hci1] 11.775105
        Num handles: 1
        Handle: 1803 Address: C7:1B:DC:08:AA:BB (Static)
        Count: 1
        #238: len 5 (0 Kb/s)
        Latency: 112 msec (53-113 msec ~112 msec)
> ACL Data RX: Handle 1803 flags 0x02 dlen 9              #240 [hci1] 11.775285
      ATT: Write Request (0x12) len 4
        Handle: 0x0052 Type: Client Characteristic Configuration (0x2902)
        Value Handle: 0x0051 Type: Broadcast Receive State (0x2bc8)
          Data: 0100
            Notification (0x01)
< HCI Command: Host Number of Com.. (0x03|0x0035) plen 5  #241 [hci1] 11.782394
        Num handles: 1
        Handle: 1803 Address: C7:1B:DC:08:AA:BB (Static)
        Count: 1
< ACL Data TX: Handle 1803 flags 0x00 dlen 5              #242 [hci1] 11.782485
      ATT: Write Response (0x13) len 0
> HCI Event: Number of Completed Packets (0x13) plen 5    #243 [hci1] 11.895069
        Num handles: 1
        Handle: 1803 Address: C7:1B:DC:08:AA:BB (Static)
        Count: 1
        #242: len 5 (0 Kb/s)
        Latency: 112 msec (53-113 msec ~112 msec)
> ACL Data RX: Handle 1803 flags 0x02 dlen 7              #244 [hci1] 11.895260
      ATT: Read Request (0x0a) len 2
        Handle: 0x0051 Type: Broadcast Receive State (0x2bc8)
< HCI Command: Host Number of Com.. (0x03|0x0035) plen 5  #245 [hci1] 11.901959
        Num handles: 1
        Handle: 1803 Address: C7:1B:DC:08:AA:BB (Static)
        Count: 1
< ACL Data TX: Handle 1803 flags 0x00 dlen 5              #246 [hci1] 11.902010
      ATT: Read Response (0x0b) len 0
        Handle: 0x0051 Type: Broadcast Receive State (0x2bc8)
        Value: 
          Empty characteristic
> HCI Event: Number of Completed Packets (0x13) plen 5    #247 [hci1] 12.015060
        Num handles: 1
        Handle: 1803 Address: C7:1B:DC:08:AA:BB (Static)
        Count: 1
        #246: len 5 (0 Kb/s)
        Latency: 113 msec (53-113 msec ~112 msec)
> ACL Data RX: Handle 1803 flags 0x02 dlen 27             #248 [hci1] 12.375378
> ACL Data RX: Handle 1803 flags 0x01 dlen 1              #249 [hci1] 12.375474
      ATT: Write Command (0x52) len 23
        Handle: 0x004f Type: Broadcast Audio Scan Control Point (0x2bc7)
          Data: 0201bbaa08dc1bc700ab01d5017800010100000000
            Opcode: Add Source (0x02)
            Source_Address_Type: 1
            Source_Address: C7:1B:DC:08:AA:BB
            Source_Adv_SID: 0
            Broadcast_ID: 0xd501ab
            PA_Sync_State: Synchronize to PA - PAST available
            PA_Interval: 0x0078
            Num_Subgroups: 1
            Subgroup #0:
              BIS_Sync State: 0x00000001
< HCI Command: Host Number of Com.. (0x03|0x0035) plen 5  #250 [hci1] 12.381842
        Num handles: 1
        Handle: 1803 Address: C7:1B:DC:08:AA:BB (Static)
        Count: 1
< HCI Command: Host Number of Com.. (0x03|0x0035) plen 5  #251 [hci1] 12.382075
        Num handles: 1
        Handle: 1803 Address: C7:1B:DC:08:AA:BB (Static)
        Count: 1
< ACL Data TX: Handle 1803 flags 0x00 dlen 27             #252 [hci1] 12.382160
      ATT: Handle Value Notification (0x1b) len 22
        Handle: 0x0051 Type: Broadcast Receive State (0x2bc8)
          Data: 0001bbaa08dc1bc700ab01d50000010000000000
          Source_ID: 0
          Source_Address_Type: 1
          Source_Address: C7:1B:DC:08:AA:BB
          Source_Adv_SID: 0
          Broadcast_ID: 0xd501ab
          PA_Sync_State: Not synchronized to PA
          BIG_Encryption: Not encrypted
          Num_Subgroups: 1
          Subgroup #0:
            BIS_Sync State: 0x00000000
> HCI Event: Number of Completed Packets (0x13) plen 5    #253 [hci1] 12.494976
        Num handles: 1
        Handle: 1803 Address: C7:1B:DC:08:AA:BB (Static)
        Count: 1
        #252: len 27 (1 Kb/s)
        Latency: 112 msec (53-113 msec ~112 msec)
< HCI Command: LE Periodic Advert.. (0x08|0x005c) plen 8  #254 [hci1] 13.942941
        Connection handle: 1803
        Mode: Enabled with report events enabled (0x02)
        Skip: 0x05
        Sync timeout: 10000 msec (0x03e8)
        Sync CTE type: 0x0000
< ACL Data TX: Handle 1803 flags 0x00 dlen 27             #255 [hci1] 13.942968
      ATT: Handle Value Notification (0x1b) len 22
        Handle: 0x0051 Type: Broadcast Receive State (0x2bc8)
          Data: 0001bbaa08dc1bc700ab01d50100010000000000
          Source_ID: 0
          Source_Address_Type: 1
          Source_Address: C7:1B:DC:08:AA:BB
          Source_Adv_SID: 0
          Broadcast_ID: 0xd501ab
          PA_Sync_State: SyncInfo Request
          BIG_Encryption: Not encrypted
          Num_Subgroups: 1
          Subgroup #0:
            BIS_Sync State: 0x00000000
> HCI Event: Command Complete (0x0e) plen 6               #256 [hci1] 13.943546
      LE Periodic Advertising Sync Transfer Parameters (0x08|0x005c) ncmd 1
        Status: Success (0x00)
        Connection handle: 11
> HCI Event: Number of Completed Packets (0x13) plen 5    #257 [hci1] 14.055008
        Num handles: 1
        Handle: 1803 Address: C7:1B:DC:08:AA:BB (Static)
        Count: 1
        #255: len 27 (1 Kb/s)
        Latency: 112 msec (53-113 msec ~112 msec)
> HCI Event: LE Meta Event (0x3e) plen 20                 #258 [hci1] 14.239588
      LE Periodic Advertising Sync Transfer Received (0x18)
        Status: Success (0x00)
        Handle: 1803
        Connection handle: 1803
        Service data: 0x0000
        Sync handle: 2270
        SID: 0x00
        Address type:: Random (0x01)
        Address:: C7:1B:DC:08:AA:BB (Static)
        PHY:: LE 1M (0x01)
        Periodic advertising Interval: 150.000
        Accuracy: 0.3125 msec (0x0001)
> HCI Event: LE Meta Event (0x3e) plen 48                 #259 [hci1] 14.240176
      LE Periodic Advertising Report (0x0f)
        Sync handle: 2270
        TX power: 127 dbm (0x7f)
        RSSI: -22 dBm (0xea)
        CTE Type: No Constant Tone Extension (0xff)
        Data status: [0;32mComplete[0m
        Data length: 0x28
        27 16 51 18 40 9c 00 01 01 06 00 00 00 00 0a 02  '.Q.@...........
        01 03 02 02 01 03 04 28 00 06 03 02 04 00 01 09  .......(........
        01 06 05 03 01 00 00 00                          ........        
> HCI Event: LE Meta Event (0x3e) plen 20                 #260 [hci1] 14.240305
      LE Broadcast Isochronous Group Info Advertising Report (0x22)
        Sync Handle: 0x08de
        Number BIS: 1
        NSE: 3
        ISO Interval: 10.00 msec (0x0008)
        BN: 1
        PTO: 1
        IRC: 2
        Maximum PDU: 40
        SDU Interval: 10000 us (0x002710)
        Maximum SDU: 40
        PHY: LE 1M (0x01)
        Framing: Unframed (0x00)
        Encryption: 0x00
< HCI Command: LE Broadcast Isoc.. (0x08|0x006b) plen 25  #261 [hci1] 14.244744
        BIG Handle: 0x00
        BIG Sync Handle: 0x08de
        Encryption: Unencrypted (0x00)
        Broadcast Code: 00000000000000000000000000000000
        Maximum Number Subevents: 0x00
        Timeout: 200 ms (0x0014)
        Number of BIS: 1
        BIS ID: 0x01
< ACL Data TX: Handle 1803 flags 0x00 dlen 27             #262 [hci1] 14.244770
< ACL Data TX: Handle 1803 flags 0x01 dlen 6              #263 [hci1] 14.244775
      ATT: Handle Value Notification (0x1b) len 28
        Handle: 0x0051 Type: Broadcast Receive State (0x2bc8)
          Data: 0001bbaa08dc1bc700ab01d50200010000000006030204000109
          Source_ID: 0
          Source_Address_Type: 1
          Source_Address: C7:1B:DC:08:AA:BB
          Source_Adv_SID: 0
          Broadcast_ID: 0xd501ab
          PA_Sync_State: Synchronized to PA
          BIG_Encryption: Not encrypted
          Num_Subgroups: 1
          Subgroup #0:
            BIS_Sync State: 0x00000000
            Metadata: #0: len 0x03 type 0x02
            Metadata:   04 00                                            ..              
            Metadata: #1: len 0x01 type 0x09
> HCI Event: Command Status (0x0f) plen 4                 #264 [hci1] 14.245651
      LE Broadcast Isochronous Group Create Sync (0x08|0x006b) ncmd 1
        Status: Success (0x00)
> HCI Event: Number of Completed Packets (0x13) plen 5    #265 [hci1] 14.295595
        Num handles: 1
        Handle: 1803 Address: C7:1B:DC:08:AA:BB (Static)
        Count: 1
        #262: len 27 (4 Kb/s)
        Latency: 50 msec (50-113 msec ~81 msec)
> HCI Event: Number of Completed Packets (0x13) plen 5    #266 [hci1] 14.354969
        Num handles: 1
        Handle: 1803 Address: C7:1B:DC:08:AA:BB (Static)
        Count: 1
        #263: len 6 (0 Kb/s)
        Latency: 110 msec (50-113 msec ~95 msec)
> HCI Event: LE Meta Event (0x3e) plen 48                 #267 [hci1] 15.139778
      LE Periodic Advertising Report (0x0f)
        Sync handle: 2270
        TX power: 127 dbm (0x7f)
        RSSI: -17 dBm (0xef)
        CTE Type: No Constant Tone Extension (0xff)
        Data status: [0;32mComplete[0m
        Data length: 0x28
        27 16 51 18 40 9c 00 01 01 06 00 00 00 00 0a 02  '.Q.@...........
        01 03 02 02 01 03 04 28 00 06 03 02 04 00 01 09  .......(........
        01 06 05 03 01 00 00 00                          ........        
> HCI Event: LE Meta Event (0x3e) plen 20                 #268 [hci1] 15.140158
      LE Broadcast Isochronous Group Info Advertising Report (0x22)
        Sync Handle: 0x08de
        Number BIS: 1
        NSE: 3
        ISO Interval: 10.00 msec (0x0008)
        BN: 1
        PTO: 1
        IRC: 2
        Maximum PDU: 40
        SDU Interval: 10000 us (0x002710)
        Maximum SDU: 40
        PHY: LE 1M (0x01)
        Framing: Unframed (0x00)
        Encryption: 0x00
> HCI Event: LE Meta Event (0x3e) plen 17                 #269 [hci1] 15.146129
      LE Broadcast Isochronous Group Sync Estabilished (0x1d)
        Status: Success (0x00)
        BIG Handle: 0x00
        Transport Latency: 11500 us (0x002cec)
        NSE: 3
        BN: 1
        PTO: 1
        IRC: 2
        Maximum PDU: 40
        ISO Interval: 10.00 msec (0x0008)
        Connection Handle #0: 2066
< HCI Command: LE Setup Isochron.. (0x08|0x006e) plen 13  #270 [hci1] 15.162183
        Handle: 2066
        Data Path Direction: Output (Controller to Host) (0x01)
        Data Path: HCI (0x00)
        Coding Format: Transparent (0x03)
        Company Codec ID: Ericsson Technology Licensing (0)
        Vendor Codec ID: 0
        Controller Delay: 0 us (0x000000)
        Codec Configuration Length: 0
        Codec Configuration: 
> HCI Event: Command Complete (0x0e) plen 6               #271 [hci1] 15.162807
      LE Setup Isochronous Data Path (0x08|0x006e) ncmd 1
        Status: Success (0x00)
        Handle: 2066
> ISO Data RX: Handle 2066 flags 0x06 dlen 8              #272 [hci1] 15.165944
> ISO Data RX: Handle 2066 flags 0x06 dlen 8              #273 [hci1] 15.167230
> ISO Data RX: Handle 2066 flags 0x06 dlen 8              #274 [hci1] 15.177077
< ACL Data TX: Handle 1803 flags 0x00 dlen 27             #275 [hci1] 15.183301
< ACL Data TX: Handle 1803 flags 0x01 dlen 6              #276 [hci1] 15.183532
      ATT: Handle Value Notification (0x1b) len 28
        Handle: 0x0051 Type: Broadcast Receive State (0x2bc8)
          Data: 0001bbaa08dc1bc700ab01d50200010100000006030204000109
          Source_ID: 0
          Source_Address_Type: 1
          Source_Address: C7:1B:DC:08:AA:BB
          Source_Adv_SID: 0
          Broadcast_ID: 0xd501ab
          PA_Sync_State: Synchronized to PA
          BIG_Encryption: Not encrypted
          Num_Subgroups: 1
          Subgroup #0:
            BIS_Sync State: 0x00000001
            Metadata: #0: len 0x03 type 0x02
            Metadata:   04 00                                            ..              
            Metadata: #1: len 0x01 type 0x09
> ISO Data RX: Handle 2066 flags 0x06 dlen 8              #277 [hci1] 15.187155
> ISO Data RX: Handle 2066 flags 0x06 dlen 8              #278 [hci1] 15.197061
> ISO Data RX: Handle 2066 flags 0x06 dlen 8              #279 [hci1] 15.207166
> ISO Data RX: Handle 2066 flags 0x06 dlen 8              #280 [hci1] 15.217143
> ISO Data RX: Handle 2066 flags 0x06 dlen 8              #281 [hci1] 15.227145
> ISO Data RX: Handle 2066 flags 0x06 dlen 8              #282 [hci1] 15.237132
> ISO Data RX: Handle 2066 flags 0x06 dlen 8              #283 [hci1] 15.247153
> ISO Data RX: Handle 2066 flags 0x06 dlen 8              #284 [hci1] 15.257161
> ISO Data RX: Handle 2066 flags 0x06 dlen 8              #285 [hci1] 15.267050
> ISO Data RX: Handle 2066 flags 0x06 dlen 8              #286 [hci1] 15.277075
> ISO Data RX: Handle 2066 flags 0x06 dlen 8              #287 [hci1] 15.287103
> ISO Data RX: Handle 2066 flags 0x06 dlen 8              #288 [hci1] 15.297083
> ISO Data RX: Handle 2066 flags 0x06 dlen 8              #289 [hci1] 15.307119
> ISO Data RX: Handle 2066 flags 0x06 dlen 8              #290 [hci1] 15.317079
> ISO Data RX: Handle 2066 flags 0x06 dlen 8              #291 [hci1] 15.327072
> ISO Data RX: Handle 2066 flags 0x06 dlen 8              #292 [hci1] 15.337088
> ISO Data RX: Handle 2066 flags 0x06 dlen 8              #293 [hci1] 15.347141
> ISO Data RX: Handle 2066 flags 0x06 dlen 8              #294 [hci1] 15.357055
> ISO Data RX: Handle 2066 flags 0x06 dlen 8              #295 [hci1] 15.367115
> ISO Data RX: Handle 2066 flags 0x06 dlen 8              #296 [hci1] 15.377089
> ISO Data RX: Handle 2066 flags 0x06 dlen 8              #297 [hci1] 15.387085
> ISO Data RX: Handle 2066 flags 0x06 dlen 8              #298 [hci1] 15.397053
> ISO Data RX: Handle 2066 flags 0x06 dlen 8              #299 [hci1] 15.407087
> ISO Data RX: Handle 2066 flags 0x06 dlen 8              #300 [hci1] 15.417145
> ISO Data RX: Handle 2066 flags 0x06 dlen 8              #301 [hci1] 15.427193
> ISO Data RX: Handle 2066 flags 0x06 dlen 8              #302 [hci1] 15.437095
> ISO Data RX: Handle 2066 flags 0x06 dlen 8              #303 [hci1] 15.447147
> ISO Data RX: Handle 2066 flags 0x06 dlen 8              #304 [hci1] 15.457117
> ISO Data RX: Handle 2066 flags 0x06 dlen 8              #305 [hci1] 15.467148
> ISO Data RX: Handle 2066 flags 0x06 dlen 8              #306 [hci1] 15.477100
> ISO Data RX: Handle 2066 flags 0x06 dlen 8              #307 [hci1] 15.487222
> ISO Data RX: Handle 2066 flags 0x06 dlen 8              #308 [hci1] 15.497118
> ISO Data RX: Handle 2066 flags 0x06 dlen 8              #309 [hci1] 15.507146
> ISO Data RX: Handle 2066 flags 0x06 dlen 8              #310 [hci1] 15.517193
> ISO Data RX: Handle 2066 flags 0x06 dlen 8              #311 [hci1] 15.527039
> ISO Data RX: Handle 2066 flags 0x06 dlen 8              #312 [hci1] 15.537087
> ISO Data RX: Handle 2066 flags 0x06 dlen 8              #313 [hci1] 15.547076
> ISO Data RX: Handle 2066 flags 0x06 dlen 8              #314 [hci1] 15.557141
> ISO Data RX: Handle 2066 flags 0x06 dlen 8              #315 [hci1] 15.567132
> ISO Data RX: Handle 2066 flags 0x06 dlen 8              #316 [hci1] 15.577119
> ISO Data RX: Handle 2066 flags 0x06 dlen 8              #317 [hci1] 15.587059
> ISO Data RX: Handle 2066 flags 0x06 dlen 8              #318 [hci1] 15.597098
> ISO Data RX: Handle 2066 flags 0x06 dlen 8              #319 [hci1] 15.607160
> ISO Data RX: Handle 2066 flags 0x06 dlen 8              #320 [hci1] 15.617075
> ISO Data RX: Handle 2066 flags 0x06 dlen 8              #321 [hci1] 15.627074
> ISO Data RX: Handle 2066 flags 0x06 dlen 8              #322 [hci1] 15.637194
> ISO Data RX: Handle 2066 flags 0x06 dlen 8              #323 [hci1] 15.647115
> ISO Data RX: Handle 2066 flags 0x06 dlen 8              #324 [hci1] 15.657142
> ISO Data RX: Handle 2066 flags 0x06 dlen 8              #325 [hci1] 15.667160
> ISO Data RX: Handle 2066 flags 0x06 dlen 8              #326 [hci1] 15.677126
> ISO Data RX: Handle 2066 flags 0x06 dlen 8              #327 [hci1] 15.687145
> ISO Data RX: Handle 2066 flags 0x06 dlen 8              #328 [hci1] 15.697096
> ISO Data RX: Handle 2066 flags 0x06 dlen 8              #329 [hci1] 15.707125
> ISO Data RX: Handle 2066 flags 0x06 dlen 8              #330 [hci1] 15.717149
> ISO Data RX: Handle 2066 flags 0x06 dlen 8              #331 [hci1] 15.727131
> ISO Data RX: Handle 2066 flags 0x06 dlen 8              #332 [hci1] 15.737117
> ISO Data RX: Handle 2066 flags 0x06 dlen 8              #333 [hci1] 15.747077
> ISO Data RX: Handle 2066 flags 0x06 dlen 8              #334 [hci1] 15.757102
> ISO Data RX: Handle 2066 flags 0x06 dlen 8              #335 [hci1] 15.767156
> ISO Data RX: Handle 2066 flags 0x06 dlen 8              #336 [hci1] 15.777138
> ISO Data RX: Handle 2066 flags 0x06 dlen 8              #337 [hci1] 15.787162
> ISO Data RX: Handle 2066 flags 0x06 dlen 8              #338 [hci1] 15.797125
> ISO Data RX: Handle 2066 flags 0x06 dlen 8              #339 [hci1] 15.807038
> ISO Data RX: Handle 2066 flags 0x06 dlen 8              #340 [hci1] 15.817071
> ISO Data RX: Handle 2066 flags 0x06 dlen 8              #341 [hci1] 15.827022
> ISO Data RX: Handle 2066 flags 0x06 dlen 8              #342 [hci1] 15.837126
> ISO Data RX: Handle 2066 flags 0x06 dlen 8              #343 [hci1] 15.847104
> ISO Data RX: Handle 2066 flags 0x06 dlen 8              #344 [hci1] 15.857158
> ISO Data RX: Handle 2066 flags 0x06 dlen 8              #345 [hci1] 15.867143
> ISO Data RX: Handle 2066 flags 0x06 dlen 8              #346 [hci1] 15.877077
> ISO Data RX: Handle 2066 flags 0x06 dlen 8              #347 [hci1] 15.887107
> ISO Data RX: Handle 2066 flags 0x06 dlen 8              #348 [hci1] 15.897027
> ISO Data RX: Handle 2066 flags 0x06 dlen 8              #349 [hci1] 15.907089
> ISO Data RX: Handle 2066 flags 0x06 dlen 8              #350 [hci1] 15.917074
> ISO Data RX: Handle 2066 flags 0x06 dlen 8              #351 [hci1] 15.927223
> ISO Data RX: Handle 2066 flags 0x06 dlen 8              #352 [hci1] 15.937068
> ISO Data RX: Handle 2066 flags 0x06 dlen 8              #353 [hci1] 15.947041
> ISO Data RX: Handle 2066 flags 0x06 dlen 8              #354 [hci1] 15.957067
> ISO Data RX: Handle 2066 flags 0x06 dlen 8              #355 [hci1] 15.967104
> ISO Data RX: Handle 2066 flags 0x06 dlen 8              #356 [hci1] 15.977080
> ISO Data RX: Handle 2066 flags 0x06 dlen 8              #357 [hci1] 15.987186
> ISO Data RX: Handle 2066 flags 0x06 dlen 8              #358 [hci1] 15.997035
> ISO Data RX: Handle 2066 flags 0x06 dlen 8              #359 [hci1] 16.007065
> ISO Data RX: Handle 2066 flags 0x06 dlen 8              #360 [hci1] 16.017073
> ISO Data RX: Handle 2066 flags 0x06 dlen 8              #361 [hci1] 16.027153
> ISO Data RX: Handle 2066 flags 0x06 dlen 8              #362 [hci1] 16.037193
> HCI Event: LE Meta Event (0x3e) plen 48                 #363 [hci1] 16.039739
      LE Periodic Advertising Report (0x0f)
        Sync handle: 2270
        TX power: 127 dbm (0x7f)
        RSSI: -17 dBm (0xef)
        CTE Type: No Constant Tone Extension (0xff)
        Data status: [0;32mComplete[0m
        Data length: 0x28
        27 16 51 18 40 9c 00 01 01 06 00 00 00 00 0a 02  '.Q.@...........
        01 03 02 02 01 03 04 28 00 06 03 02 04 00 01 09  .......(........
        01 06 05 03 01 00 00 00                          ........        
> HCI Event: LE Meta Event (0x3e) plen 20                 #364 [hci1] 16.039980
      LE Broadcast Isochronous Group Info Advertising Report (0x22)
        Sync Handle: 0x08de
        Number BIS: 1
        NSE: 3
        ISO Interval: 10.00 msec (0x0008)
        BN: 1
        PTO: 1
        IRC: 2
        Maximum PDU: 40
        SDU Interval: 10000 us (0x002710)
        Maximum SDU: 40
        PHY: LE 1M (0x01)
        Framing: Unframed (0x00)
        Encryption: 0x00
> ISO Data RX: Handle 2066 flags 0x06 dlen 8              #365 [hci1] 16.047075
> ISO Data RX: Handle 2066 flags 0x06 dlen 8              #366 [hci1] 16.057058
> ISO Data RX: Handle 2066 flags 0x06 dlen 8              #367 [hci1] 16.067076
> ISO Data RX: Handle 2066 flags 0x06 dlen 8              #368 [hci1] 16.077039
> ISO Data RX: Handle 2066 flags 0x06 dlen 8              #369 [hci1] 16.087181
> ISO Data RX: Handle 2066 flags 0x06 dlen 8              #370 [hci1] 16.097075
> ISO Data RX: Handle 2066 flags 0x06 dlen 8              #371 [hci1] 16.107133
> ISO Data RX: Handle 2066 flags 0x06 dlen 8              #372 [hci1] 16.117055
> ISO Data RX: Handle 2066 flags 0x06 dlen 8              #373 [hci1] 16.127065
> ISO Data RX: Handle 2066 flags 0x06 dlen 8              #374 [hci1] 16.137077
> ISO Data RX: Handle 2066 flags 0x06 dlen 8              #375 [hci1] 16.147181
> ISO Data RX: Handle 2066 flags 0x06 dlen 8              #376 [hci1] 16.157159
> ISO Data RX: Handle 2066 flags 0x06 dlen 8              #377 [hci1] 16.167130
> ISO Data RX: Handle 2066 flags 0x06 dlen 8              #378 [hci1] 16.177140
> ISO Data RX: Handle 2066 flags 0x06 dlen 8              #379 [hci1] 16.187045
> ISO Data RX: Handle 2066 flags 0x06 dlen 8              #380 [hci1] 16.197039
> ISO Data RX: Handle 2066 flags 0x06 dlen 8              #381 [hci1] 16.207148
> ISO Data RX: Handle 2066 flags 0x06 dlen 8              #382 [hci1] 16.217165
> ISO Data RX: Handle 2066 flags 0x06 dlen 8              #383 [hci1] 16.227063
> ISO Data RX: Handle 2066 flags 0x06 dlen 8              #384 [hci1] 16.237080
> ISO Data RX: Handle 2066 flags 0x06 dlen 8              #385 [hci1] 16.247041
> ISO Data RX: Handle 2066 flags 0x06 dlen 8              #386 [hci1] 16.257054
> ISO Data RX: Handle 2066 flags 0x06 dlen 8              #387 [hci1] 16.267042
> ISO Data RX: Handle 2066 flags 0x06 dlen 8              #388 [hci1] 16.277022
> ISO Data RX: Handle 2066 flags 0x06 dlen 8              #389 [hci1] 16.287135
> ISO Data RX: Handle 2066 flags 0x06 dlen 8              #390 [hci1] 16.297022
> ISO Data RX: Handle 2066 flags 0x06 dlen 8              #391 [hci1] 16.307078
> HCI Event: LE Meta Event (0x3e) plen 3                  #392 [hci1] 16.307179
      LE Broadcast Isochronous Group Sync Lost (0x1e)
        BIG Handle: 0x00
        Reason: Remote User Terminated Connection (0x13)
< ACL Data TX: Handle 1803 flags 0x00 dlen 27             #393 [hci1] 16.322189
> HCI Event: Number of Completed Packets (0x13) plen 5    #394 [hci1] 16.335523
        Num handles: 1
        Handle: 1803 Address: C7:1B:DC:08:AA:BB (Static)
        Count: 1
        #275: len 27 (0 Kb/s)
        Latency: 1152 msec (50-1152 msec ~124 msec)
> HCI Event: Number of Completed Packets (0x13) plen 5    #395 [hci1] 16.335887
        Num handles: 1
        Handle: 1803 Address: C7:1B:DC:08:AA:BB (Static)
        Count: 1
        #276: len 6 (0 Kb/s)
        Latency: 1152 msec (50-1152 msec ~138 msec)
< ACL Data TX: Handle 1803 flags 0x01 dlen 6              #396 [hci1] 16.341818
      ATT: Handle Value Notification (0x1b) len 28
        Handle: 0x0051 Type: Broadcast Receive State (0x2bc8)
          Data: 0001bbaa08dc1bc700ab01d50200010000000006030204000109
          Source_ID: 0
          Source_Address_Type: 1
          Source_Address: C7:1B:DC:08:AA:BB
          Source_Adv_SID: 0
          Broadcast_ID: 0xd501ab
          PA_Sync_State: Synchronized to PA
          BIG_Encryption: Not encrypted
          Num_Subgroups: 1
          Subgroup #0:
            BIS_Sync State: 0x00000000
            Metadata: #0: len 0x03 type 0x02
            Metadata:   04 00                                            ..              
            Metadata: #1: len 0x01 type 0x09
> HCI Event: Number of Completed Packets (0x13) plen 5    #397 [hci1] 16.395119
        Num handles: 1
        Handle: 1803 Address: C7:1B:DC:08:AA:BB (Static)
        Count: 1
        #393: len 27 (3 Kb/s)
        Latency: 72 msec (50-1152 msec ~105 msec)
> ACL Data RX: Handle 1803 flags 0x02 dlen 18             #398 [hci1] 16.395509
      ATT: Write Command (0x52) len 13
        Handle: 0x004f Type: Broadcast Audio Scan Control Point (0x2bc7)
          Data: 030001401f010000000000
            Opcode: Modify Source (0x03)
            Source_ID: 0
            PA_Sync_State: Synchronize to PA - PAST available
            PA_Interval: 0x1f40
            Num_Subgroups: 1
            Subgroup #0:
              BIS_Sync State: 0x00000000
< HCI Command: Host Number of Com.. (0x03|0x0035) plen 5  #399 [hci1] 16.402707
        Num handles: 1
        Handle: 1803 Address: C7:1B:DC:08:AA:BB (Static)
        Count: 1
< ACL Data TX: Handle 1803 flags 0x00 dlen 27             #400 [hci1] 16.402898
      ATT: Handle Value Notification (0x1b) len 22
        Handle: 0x0051 Type: Broadcast Receive State (0x2bc8)
          Data: 0001bbaa08dc1bc700ab01d50200010000000000
          Source_ID: 0
          Source_Address_Type: 1
          Source_Address: C7:1B:DC:08:AA:BB
          Source_Adv_SID: 0
          Broadcast_ID: 0xd501ab
          PA_Sync_State: Synchronized to PA
          BIG_Encryption: Not encrypted
          Num_Subgroups: 1
          Subgroup #0:
            BIS_Sync State: 0x00000000
> HCI Event: Number of Completed Packets (0x13) plen 5    #401 [hci1] 16.454976
        Num handles: 1
        Handle: 1803 Address: C7:1B:DC:08:AA:BB (Static)
        Count: 1
        #396: len 6 (0 Kb/s)
        Latency: 113 msec (50-1152 msec ~109 msec)
> HCI Event: Number of Completed Packets (0x13) plen 5    #402 [hci1] 16.515006
        Num handles: 1
        Handle: 1803 Address: C7:1B:DC:08:AA:BB (Static)
        Count: 1
        #400: len 27 (1 Kb/s)
        Latency: 112 msec (50-1152 msec ~110 msec)
> HCI Event: LE Meta Event (0x3e) plen 48                 #403 [hci1] 16.939376
      LE Periodic Advertising Report (0x0f)
        Sync handle: 2270
        TX power: 127 dbm (0x7f)
        RSSI: -22 dBm (0xea)
        CTE Type: No Constant Tone Extension (0xff)
        Data status: [0;32mComplete[0m
        Data length: 0x28
        27 16 51 18 40 9c 00 01 01 06 00 00 00 00 0a 02  '.Q.@...........
        01 03 02 02 01 03 04 28 00 06 03 02 04 00 01 09  .......(........
        01 06 05 03 01 00 00 00                          ........        
< HCI Command: Reset (0x03|0x0003) plen 0                 #404 [hci1] 23.352121
> HCI Event: Command Complete (0x0e) plen 4               #405 [hci1] 23.352668
      Reset (0x03|0x0003) ncmd 1
        Status: Success (0x00)
@ USER Close: main                                    {0x0001} [hci1] 23.361776
= Close Index: 00:00:00:00:00:00                               [hci1] 23.361785
