Bluetooth monitor ver 5.72
= Note: Linux version 7.0.0-31-generic (x86_64)                        0.887982
= Note: Bluetooth subsystem version 2.22                               0.887985
= New Index: 00:00:00:00:00:00 (Primary,UART,hci2)              [hci2] 0.887986
= New Index: 00:00:00:00:00:00 (Primary,UART,hci1)              [hci1] 0.887986
= New Index: 48:5F:99:8E:E0:64 (Primary,USB,hci0)               [hci0] 0.887987
= Open Index: 00:00:00:00:00:00                                 [hci1] 1.041222
= Index Info: 00:00:00:00:00:00 (Nordic Semiconductor ASA)      [hci1] 1.041227
@ USER Open: main (privileged) version 2.22            {0x0001} [hci1] 1.041230
< HCI Command: Reset (0x03|0x0003) plen 0                    #1 [hci1] 1.041609
> HCI Event: Command Complete (0x0e) plen 4                  #2 [hci1] 1.042147
      Reset (0x03|0x0003) ncmd 1
        Status: Success (0x00)
< HCI Command: Read Local Supported... (0x04|0x0003) plen 0  #3 [hci1] 1.061199
> HCI Event: Command Complete (0x0e) plen 12                 #4 [hci1] 1.061706
      Read Local Supported Features (0x04|0x0003) ncmd 1
        Status: Success (0x00)
        Features: 0x00 0x00 0x00 0x00 0x60 0x00 0x00 0x00
          BR/EDR Not Supported
          LE Supported (Controller)
< HCI Command: Read Local Version In.. (0x04|0x0001) plen 0  #5 [hci1] 1.081151
> HCI Event: Command Complete (0x0e) plen 12                 #6 [hci1] 1.081745
      Read Local Version Information (0x04|0x0001) ncmd 1
        Status: Success (0x00)
        HCI version: Reserved (0x11) - Revision 12345 (0x3039)
        LMP version: Reserved (0x11) - Subversion 12345 (0x3039)
        Manufacturer: Nordic Semiconductor ASA (89)
< HCI Command: Read Local Supported... (0x04|0x0002) plen 0  #7 [hci1] 1.101183
> HCI Event: Command Complete (0x0e) plen 68                 #8 [hci1] 1.102348
      Read Local Supported Commands (0x04|0x0002) ncmd 1
        Status: Success (0x00)
        Commands: 115 entries
          Disconnect (Octet 0 - Bit 5)
          Read Remote Version Information (Octet 2 - Bit 7)
          Set Event Mask (Octet 5 - Bit 6)
          Reset (Octet 5 - Bit 7)
          Read Connection Accept Timeout (Octet 7 - Bit 2)
          Write Connection Accept Timeout (Octet 7 - Bit 3)
          Read Transmit Power Level (Octet 10 - Bit 2)
          Set Controller To Host Flow Control (Octet 10 - Bit 5)
          Host Buffer Size (Octet 10 - Bit 6)
          Host Number of Completed Packets (Octet 10 - Bit 7)
          Read Local Version Information (Octet 14 - Bit 3)
          Read Local Supported Features (Octet 14 - Bit 5)
          Read BD ADDR (Octet 15 - Bit 1)
          Read RSSI (Octet 15 - Bit 5)
          Set Event Mask Page 2 (Octet 22 - Bit 2)
          LE Set Event Mask (Octet 25 - Bit 0)
          LE Read Buffer Size (Octet 25 - Bit 1)
          LE Read Local Supported Features (Octet 25 - Bit 2)
          LE Set Random Address (Octet 25 - Bit 4)
          LE Set Advertising Parameters (Octet 25 - Bit 5)
          LE Read Advertising Channel TX Power (Octet 25 - Bit 6)
          LE Set Advertising Data (Octet 25 - Bit 7)
          LE Set Scan Response Data (Octet 26 - Bit 0)
          LE Set Advertise Enable (Octet 26 - Bit 1)
          LE Set Scan Parameters (Octet 26 - Bit 2)
          LE Set Scan Enable (Octet 26 - Bit 3)
          LE Create Connection (Octet 26 - Bit 4)
          LE Create Connection Cancel (Octet 26 - Bit 5)
          LE Read Accept List Size (Octet 26 - Bit 6)
          LE Clear Accept List (Octet 26 - Bit 7)
          LE Add Device To Accept List (Octet 27 - Bit 0)
          LE Remove Device From Accept List (Octet 27 - Bit 1)
          LE Connection Update (Octet 27 - Bit 2)
          LE Set Host Channel Classification (Octet 27 - Bit 3)
          LE Read Channel Map (Octet 27 - Bit 4)
          LE Read Remote Used Features (Octet 27 - Bit 5)
          LE Encrypt (Octet 27 - Bit 6)
          LE Rand (Octet 27 - Bit 7)
          LE Start Encryption (Octet 28 - Bit 0)
          LE Long Term Key Request Reply (Octet 28 - Bit 1)
          LE Long Term Key Request Neg Reply (Octet 28 - Bit 2)
          LE Read Supported States (Octet 28 - Bit 3)
          Read Authenticated Payload Timeout (Octet 32 - Bit 4)
          Write Authenticated Payload Timeout (Octet 32 - Bit 5)
          LE Set Data Length (Octet 33 - Bit 6)
          LE Read Suggested Default Data Length (Octet 33 - Bit 7)
          LE Write Suggested Default Data Length (Octet 34 - Bit 0)
          LE Add Device To Resolving List (Octet 34 - Bit 3)
          LE Remove Device From Resolving List (Octet 34 - Bit 4)
          LE Clear Resolving List (Octet 34 - Bit 5)
          LE Read Resolving List Size (Octet 34 - Bit 6)
          LE Set Address Resolution Enable (Octet 35 - Bit 1)
          LE Set Resolvable Private Address Timeout (Octet 35 - Bit 2)
          LE Read Maximum Data Length (Octet 35 - Bit 3)
          LE Read PHY (Octet 35 - Bit 4)
          LE Set Default PHY (Octet 35 - Bit 5)
          LE Set PHY (Octet 35 - Bit 6)
          LE Set Advertising Set Random Address (Octet 36 - Bit 1)
          LE Set Extended Advertising Parameters (Octet 36 - Bit 2)
          LE Set Extended Advertising Data (Octet 36 - Bit 3)
          LE Set Extended Scan Response Data (Octet 36 - Bit 4)
          LE Set Extended Advertising Enable (Octet 36 - Bit 5)
          LE Read Maximum Advertising Data Length (Octet 36 - Bit 6)
          LE Read Number of Supported Advertising Sets (Octet 36 - Bit 7)
          LE Remove Advertising Set (Octet 37 - Bit 0)
          LE Clear Advertising Sets (Octet 37 - Bit 1)
          LE Set Periodic Advertising Parameters (Octet 37 - Bit 2)
          LE Set Periodic Advertising Data (Octet 37 - Bit 3)
          LE Set Periodic Advertising Enable (Octet 37 - Bit 4)
          LE Set Extended Scan Parameters (Octet 37 - Bit 5)
          LE Set Extended Scan Enable (Octet 37 - Bit 6)
          LE Extended Create Connection (Octet 37 - Bit 7)
          LE Periodic Advertising Create Sync (Octet 38 - Bit 0)
          LE Periodic Advertising Create Sync Cancel (Octet 38 - Bit 1)
          LE Periodic Advertising Terminate Sync (Octet 38 - Bit 2)
          LE Add Device To Periodic Advertiser List (Octet 38 - Bit 3)
          LE Remove Device From Periodic Advertiser List (Octet 38 - Bit 4)
          LE Clear Periodic Advertiser List (Octet 38 - Bit 5)
          LE Read Periodic Advertiser List Size (Octet 38 - Bit 6)
          LE Read Transmit Power (Octet 38 - Bit 7)
          LE Read RF Path Compensation (Octet 39 - Bit 0)
          LE Write RF Path Compensation (Octet 39 - Bit 1)
          LE Set Privacy Mode (Octet 39 - Bit 2)
          LE Periodic Advertising Receive Enable (Octet 40 - Bit 5)
          LE Periodic Advertising Sync Transfer (Octet 40 - Bit 6)
          LE Periodic Advertising Set Info Transfer (Octet 40 - Bit 7)
          LE Periodic Advertising Sync Transfer Parameters (Octet 41 - Bit 0)
          LE Set Default Periodic Advertisng Sync Transfer Parameters (Octet 41 - Bit 1)
          LE Read Buffer v2 (Octet 41 - Bit 5)
          LE Read ISO TX Sync (Octet 41 - Bit 6)
          LE Set Connected Isochronous Group Parameters (Octet 41 - Bit 7)
          LE Set Connected Isochronous Group Parameters Test (Octet 42 - Bit 0)
          LE Create Connected Isochronous Stream (Octet 42 - Bit 1)
          LE Remove Connected Isochronous Group (Octet 42 - Bit 2)
          LE Accept Connected Isochronous Stream Request (Octet 42 - Bit 3)
          LE Reject Connected Isochronous Stream Request (Octet 42 - Bit 4)
          LE Create Broadcast Isochronous Group (Octet 42 - Bit 5)
          LE Create Broadcast Isochronous Group Test (Octet 42 - Bit 6)
          LE Terminate Broadcast Isochronous Group (Octet 42 - Bit 7)
          LE Broadcast Isochronous Group Create Sync (Octet 43 - Bit 0)
          LE Broadcast Isochronous Group Terminate Sync (Octet 43 - Bit 1)
          LE Request Peer SCA (Octet 43 - Bit 2)
          LE Setup Isochronous Data Path (Octet 43 - Bit 3)
          LE Remove Isochronous Data Path (Octet 43 - Bit 4)
          LE Isochronous Transmit Test (Octet 43 - Bit 5)
          LE Isochronous Receive Test (Octet 43 - Bit 6)
          LE Isochronous Read Test Counters (Octet 43 - Bit 7)
          LE Isochronous Read Test Counters (Octet 44 - Bit 0)
          LE Set Host Feature (Octet 44 - Bit 1)
          Octet 44 - Bit 2 
          Octet 45 - Bit 6 
          Octet 46 - Bit 0 
          Octet 46 - Bit 1 
          Octet 46 - Bit 2 
          Octet 47 - Bit 4 
< HCI Command: Host Buffer Size (0x03|0x0033) plen 7         #9 [hci1] 1.121183
        ACL MTU: 255  ACL max packet: 16
        SCO MTU: 0    SCO max packet: 0
> HCI Event: Command Complete (0x0e) plen 4                 #10 [hci1] 1.121794
      Host Buffer Size (0x03|0x0033) ncmd 1
        Status: Success (0x00)
< HCI Command: Set Controller To Ho.. (0x03|0x0031) plen 1  #11 [hci1] 1.141185
        Flow control: ACL Data Packets (0x01)
> HCI Event: Command Complete (0x0e) plen 4                 #12 [hci1] 1.141735
      Set Controller To Host Flow Control (0x03|0x0031) ncmd 1
        Status: Success (0x00)
< HCI Command: LE Read Local Suppor.. (0x08|0x0003) plen 0  #13 [hci1] 1.161197
> HCI Event: Command Complete (0x0e) plen 12                #14 [hci1] 1.161767
      LE Read Local Supported Features (0x08|0x0003) ncmd 1
        Status: Success (0x00)
        Features: 0xfd 0x79 0x00 0xf7 0x30 0x01 0x00 0x00
          LE Encryption
          Extended Reject Indication
          Peripheral-initiated Features Exchange
          LE Ping
          LE Data Packet Length Extension
          LL Privacy
          Extended Scanner Filter Policies
          LE 2M PHY
          LE Coded PHY
          LE Extended Advertising
          LE Periodic Advertising
          Channel Selection Algorithm #2
          Periodic Advertising Sync Transfer - Sender
          Periodic Advertising Sync Transfer - Recipient
          Sleep Clock Accuracy Updates
          Connected Isochronous Stream - Central
          Connected Isochronous Stream - Peripheral
          Isochronous Broadcaster
          Synchronized Receiver
          Periodic Advertising ADI support
          Connection Subrating
          Unknown features (0x0000010000000000)
< HCI Command: LE Set Host Feature (0x08|0x0074) plen 2     #15 [hci1] 1.181196
        Bit Number: 32
          Connected Isochronous Stream (Host Support)
        Bit Value: 1
> HCI Event: Command Complete (0x0e) plen 4                 #16 [hci1] 1.181663
      LE Set Host Feature (0x08|0x0074) ncmd 1
        Status: Success (0x00)
< HCI Command: LE Read Buffer v2 (0x08|0x0060) plen 0       #17 [hci1] 1.201195
> HCI Event: Command Complete (0x0e) plen 10                #18 [hci1] 1.201829
      LE Read Buffer v2 (0x08|0x0060) ncmd 1
        Status: Success (0x00)
        ACL MTU: 27
        ACL max packet: 3
        ISO MTU: 318
        ISO max packet: 3
< HCI Command: LE Read Maximum Adve.. (0x08|0x003a) plen 0  #19 [hci1] 1.221230
> HCI Event: Command Complete (0x0e) plen 6                 #20 [hci1] 1.221699
      LE Read Maximum Advertising Data Length (0x08|0x003a) ncmd 1
        Status: Success (0x00)
        Max length: 1650
< HCI Command: LE Read Supported St.. (0x08|0x001c) plen 0  #21 [hci1] 1.241176
> HCI Event: Command Complete (0x0e) plen 12                #22 [hci1] 1.241679
      LE Read Supported States (0x08|0x001c) ncmd 1
        Status: Success (0x00)
        States: 0x000003ff3e0306ff
          Non-connectable Advertising State
          Scannable Advertising State
          Connectable Advertising State
          High Duty Cycle Directed Advertising State
          Passive Scanning State
          Active Scanning State
          Initiating State
            and Connection State (Central Role)
          Connection State (Peripheral Role)
          Scannable Advertising State
            and Passive Scanning State
          Connectable Advertising State
            and Passive Scanning State
          Non-connectable Advertising State
            and Initiating State
          Scannable Advertising State
            and Initiating State
          Active Scanning State
            and Connection State (Central Role)
          Passive Scanning State
            and Connection State (Peripheral Role)
          Active Scanning State
            and Connection State (Peripheral Role)
          Initiating State
            and Connection State (Central Role)
            and Central Role & Central Role
          Low Duty Cycle Directed Advertising State
          Connectable Advertising State
            and Initiating State
            and Central Role & Peripheral Role
          High Duty Cycle Directed Advertising State
            and Initiating State
            and Central Role & Peripheral Role
          Low Duty Cycle Directed Advertising State
            and Initiating State
            and Central Role & Peripheral Role
          Connectable Advertising State
            and Connection State (Central Role)
            and Central Role & Peripheral Role
          High Duty Cycle Directed Advertising State
            and Connection State (Central Role)
            and Central Role & Peripheral Role
          Low Duty Cycle Directed Advertising State
            and Connection State (Central Role)
            and Central Role & Peripheral Role
          Connectable Advertising State
            and Connection State (Peripheral Role)
            and Central Role & Peripheral Role
          High Duty Cycle Directed Advertising State
            and Connection State (Peripheral Role)
            and Peripheral Role & Peripheral Role
          Low Duty Cycle Directed Advertising State
            and Connection State (Peripheral Role)
            and Peripheral Role & Peripheral Role
          Initiating State
            and Connection State (Peripheral Role)
            and Central Role & Peripheral Role
< HCI Command: LE Read Maximum Data.. (0x08|0x002f) plen 0  #23 [hci1] 1.261193
> HCI Event: Command Complete (0x0e) plen 12                #24 [hci1] 1.261817
      LE Read Maximum Data Length (0x08|0x002f) ncmd 1
        Status: Success (0x00)
        Max TX octets: 251
        Max TX time: 2704
        Max RX octets: 251
        Max RX time: 2704
< HCI Command: LE Write Suggested D.. (0x08|0x0024) plen 4  #25 [hci1] 1.281190
        TX octets: 251
        TX time: 2704
> HCI Event: Command Complete (0x0e) plen 4                 #26 [hci1] 1.281814
      LE Write Suggested Default Data Length (0x08|0x0024) ncmd 1
        Status: Success (0x00)
< HCI Command: LE Read Resolving Li.. (0x08|0x002a) plen 0  #27 [hci1] 1.301189
> HCI Event: Command Complete (0x0e) plen 5                 #28 [hci1] 1.301644
      LE Read Resolving List Size (0x08|0x002a) ncmd 1
        Status: Success (0x00)
        Size: 8
< HCI Command: LE Set Host Feature (0x08|0x0074) plen 2     #29 [hci1] 1.321244
        Bit Number: 38
          Connection Subrating (Host Support)
        Bit Value: 1
> HCI Event: Command Complete (0x0e) plen 4                 #30 [hci1] 1.321839
      LE Set Host Feature (0x08|0x0074) ncmd 1
        Status: Success (0x00)
< HCI Command: LE Set Event Mask (0x08|0x0001) plen 8       #31 [hci1] 1.341162
        Mask: 0x000002063f87fa5e
          LE Advertising Report
          LE Connection Update Complete
          LE Read Remote Used Features Complete
          LE Long Term Key Request
          LE Data Length Change
          LE Enhanced Connection Complete
          LE PHY Update Complete
          LE Extended Advertising Report
          LE Periodic Advertising Sync Established
          LE Periodic Advertising Report
          LE Periodic Advertising Sync Lost
          LE Extended Scan Timeout
          LE Extended Advertising Set Terminated
          LE Scan Request Received
          LE Periodic Advertising Sync Transfer Rvc
          LE CIS Established
          LE CIS Request
          LE Create BIG Complete
          LE Terminate BIG Complete
          LE BIG Sync Estabilished Complete
          LE BIG Sync Lost
          LE BIG Info Advertising Report
          LE Subrate Change
          Unknown mask (0x0000020000000000)
> HCI Event: Command Complete (0x0e) plen 4                 #32 [hci1] 1.341844
      LE Set Event Mask (0x08|0x0001) ncmd 1
        Status: Success (0x00)
< HCI Command: Set Event Mask (0x03|0x0001) plen 8          #33 [hci1] 1.361187
        Mask: 0x2000800002008890
          Disconnection Complete
          Encryption Change
          Read Remote Version Information Complete
          Hardware Error
          Data Buffer Overflow
          Encryption Key Refresh Complete
          LE Meta
> HCI Event: Command Complete (0x0e) plen 4                 #34 [hci1] 1.361806
      Set Event Mask (0x03|0x0001) ncmd 1
        Status: Success (0x00)
< HCI Command: Read BD ADDR (0x04|0x0009) plen 0            #35 [hci1] 1.381184
> HCI Event: Command Complete (0x0e) plen 10                #36 [hci1] 1.381645
      Read BD ADDR (0x04|0x0009) ncmd 1
        Status: Success (0x00)
        Address: 00:00:00:00:00:00 (OUI 00-00-00)
< HCI Command: LE Set Random Address (0x08|0x0005) plen 6   #37 [hci1] 1.401183
        Address: D5:B6:CC:31:DB:3B (Static)
> HCI Event: Command Complete (0x0e) plen 4                 #38 [hci1] 1.401716
      LE Set Random Address (0x08|0x0005) ncmd 1
        Status: Success (0x00)
< HCI Command: LE Set Extended Adv.. (0x08|0x0036) plen 25  #39 [hci1] 3.571216
        Handle: 0x00
        Properties: 0x0013
          Connectable
          Scannable
          Use legacy advertising PDUs: ADV_IND
        Min advertising interval: 100.000 msec (0x00a0)
        Max advertising interval: 150.000 msec (0x00f0)
        Channel map: 37, 38, 39 (0x07)
        Own address type: Random (0x01)
        Peer address type: Public (0x00)
        Peer address: 00:00:00:00:00:00 (OUI 00-00-00)
        Filter policy: Allow Scan Request from Any, Allow Connect Request from Any (0x00)
        TX power: Host has no preference (0x7f)
        Primary PHY: LE 1M (0x01)
        Secondary max skip: 0x00
        Secondary PHY: LE 1M (0x01)
        SID: 0x00
        Scan request notifications: Disabled (0x00)
> HCI Event: Command Complete (0x0e) plen 5                 #40 [hci1] 3.572052
      LE Set Extended Advertising Parameters (0x08|0x0036) ncmd 1
        Status: Success (0x00)
        TX power (selected): 0 dbm (0x00)
< HCI Command: LE Set Advertising S.. (0x08|0x0035) plen 7  #41 [hci1] 3.581240
        Advertising handle: 0x00
        Advertising random address: D5:B6:CC:31:DB:3B (Static)
> HCI Event: Command Complete (0x0e) plen 4                 #42 [hci1] 3.581805
      LE Set Advertising Set Random Address (0x08|0x0035) ncmd 1
        Status: Success (0x00)
< HCI Command: LE Set Extended Adv.. (0x08|0x0037) plen 22  #43 [hci1] 3.601265
        Handle: 0x00
        Operation: Complete extended advertising data (0x03)
        Fragment preference: Minimize fragmentation (0x01)
        Data length: 0x12
        Flags: 0x06
          LE General Discoverable Mode
          BR/EDR Not Supported
        Name (complete): Tester_F6B11A
> HCI Event: Command Complete (0x0e) plen 4                 #44 [hci1] 3.602051
      LE Set Extended Advertising Data (0x08|0x0037) ncmd 1
        Status: Success (0x00)
< HCI Command: LE Set Extended Scan.. (0x08|0x0038) plen 4  #45 [hci1] 3.621243
        Handle: 0x00
        Operation: Complete scan response data (0x03)
        Fragment preference: Minimize fragmentation (0x01)
        Data length: 0x00
> HCI Event: Command Complete (0x0e) plen 4                 #46 [hci1] 3.621706
      LE Set Extended Scan Response Data (0x08|0x0038) ncmd 1
        Status: Success (0x00)
< HCI Command: LE Set Extended Adve.. (0x08|0x0039) plen 6  #47 [hci1] 3.641216
        Extended advertising: Enabled (0x01)
        Number of sets: 1 (0x01)
        Entry 0
          Handle: 0x00
          Duration: 0 ms (0x00)
          Max ext adv events: 0
> HCI Event: Command Complete (0x0e) plen 4                 #48 [hci1] 3.641831
      LE Set Extended Advertising Enable (0x08|0x0039) ncmd 1
        Status: Success (0x00)
> HCI Event: LE Meta Event (0x3e) plen 31                   #49 [hci1] 4.070728
      LE Enhanced Connection Complete (0x0a)
        Status: Success (0x00)
        Handle: 1569
        Role: Peripheral (0x01)
        Peer address type: Public (0x00)
        Peer address: DF:A9:FF:F6:B1:1A (OUI DF-A9-FF)
        Local resolvable private address: 00:00:00:00:00:00 (Non-Resolvable)
        Peer resolvable private address: 00:00:00:00:00:00 (Non-Resolvable)
        Connection interval: 87.50 msec (0x0046)
        Connection latency: 0 (0x0000)
        Supervision timeout: 20000 msec (0x07d0)
        Central clock accuracy: 0x01
> HCI Event: LE Meta Event (0x3e) plen 6                    #50 [hci1] 4.070837
      LE Advertising Set Terminated (0x12)
        Status: Success (0x00)
        Handle: 0
        Connection handle: 1569
        Number of completed extended advertising events: 0
< HCI Command: LE Read Remote Used... (0x08|0x0016) plen 2  #51 [hci1] 4.082087
        Handle: 1569 Address: DF:A9:FF:F6:B1:1A (OUI DF-A9-FF)
> HCI Event: Command Status (0x0f) plen 4                   #52 [hci1] 4.082674
      LE Read Remote Used Features (0x08|0x0016) ncmd 1
        Status: Success (0x00)
> HCI Event: LE Meta Event (0x3e) plen 12                   #53 [hci1] 4.334648
      LE Read Remote Used Features (0x04)
        Status: Success (0x00)
        Handle: 1569 Address: DF:A9:FF:F6:B1:1A (OUI DF-A9-FF)
        Features: 0x2d 0x49 0x00 0xf7 0x67 0xd9 0x00 0x80
          LE Encryption
          Extended Reject Indication
          Peripheral-initiated Features Exchange
          LE Data Packet Length Extension
          LE 2M PHY
          LE Coded PHY
          Channel Selection Algorithm #2
          Periodic Advertising Sync Transfer - Sender
          Periodic Advertising Sync Transfer - Recipient
          Sleep Clock Accuracy Updates
          Connected Isochronous Stream - Central
          Connected Isochronous Stream - Peripheral
          Isochronous Broadcaster
          Synchronized Receiver
          Connected Isochronous Stream (Host Support)
          LE Power Control Request
          LE Power Control Request
          Connection Subrating
          Connection Subrating (Host Support)
          Unknown features (0x8000d90000000000)
> ACL Data RX: Handle 1569 flags 0x02 dlen 11               #54 [hci1] 4.771894
      SMP: Pairing Request (0x01) len 6
        IO capability: KeyboardOnly (0x02)
        OOB data: Authentication data not present (0x00)
        Authentication requirement: No bonding, MITM, SC, No Keypresses (0xcc)
        Max encryption key size: 16
        Initiator key distribution: <none> (0x00)
        Responder key distribution: <none> (0x00)
< HCI Command: Host Number of Compl.. (0x03|0x0035) plen 5  #55 [hci1] 4.781311
        Num handles: 1
        Handle: 1569 Address: DF:A9:FF:F6:B1:1A (OUI DF-A9-FF)
        Count: 1
< ACL Data TX: Handle 1569 flags 0x00 dlen 11               #56 [hci1] 4.781356
      SMP: Pairing Response (0x02) len 6
        IO capability: DisplayOnly (0x00)
        OOB data: Authentication data not present (0x00)
        Authentication requirement: Bonding, No MITM, SC, No Keypresses (0x09)
        Max encryption key size: 16
        Initiator key distribution: <none> (0x00)
        Responder key distribution: <none> (0x00)
> HCI Event: Number of Completed Packets (0x13) plen 5      #57 [hci1] 4.947063
        Num handles: 1
        Handle: 1569 Address: DF:A9:FF:F6:B1:1A (OUI DF-A9-FF)
        Count: 1
        #56: len 11 (0 Kb/s)
        Latency: 165 msec (165-165 msec ~165 msec)
> ACL Data RX: Handle 1569 flags 0x02 dlen 27               #58 [hci1] 4.947263
> ACL Data RX: Handle 1569 flags 0x01 dlen 27               #59 [hci1] 4.947758
> ACL Data RX: Handle 1569 flags 0x01 dlen 15               #60 [hci1] 4.948314
      SMP: Pairing Public Key (0x0c) len 64
        X: 03999c8f957aec5753b7a706bc9c8f4623c3f14ff7f4545a90edb88b45c2f8f3
        Y: 33b5e19c0facba5f84e6383ff60c8ba5bd1526b3f5c206633af3ee5c07ae29cb
< HCI Command: Host Number of Compl.. (0x03|0x0035) plen 5  #61 [hci1] 4.961609
        Num handles: 1
        Handle: 1569 Address: DF:A9:FF:F6:B1:1A (OUI DF-A9-FF)
        Count: 1
< HCI Command: Host Number of Compl.. (0x03|0x0035) plen 5  #62 [hci1] 4.961617
        Num handles: 1
        Handle: 1569 Address: DF:A9:FF:F6:B1:1A (OUI DF-A9-FF)
        Count: 1
< HCI Command: Host Number of Compl.. (0x03|0x0035) plen 5  #63 [hci1] 4.961723
        Num handles: 1
        Handle: 1569 Address: DF:A9:FF:F6:B1:1A (OUI DF-A9-FF)
        Count: 1
< ACL Data TX: Handle 1569 flags 0x00 dlen 27               #64 [hci1] 4.961814
< ACL Data TX: Handle 1569 flags 0x01 dlen 27               #65 [hci1] 4.961819
< ACL Data TX: Handle 1569 flags 0x01 dlen 15               #66 [hci1] 4.961820
      SMP: Pairing Public Key (0x0c) len 64
        X: 98308440221e2d910f0e54b71e7ec652857aa9b5a0dc65028824cc19db1226e9
        Y: 67a4816bcb62efb21701e31fdb27561a6217575fb007a8bbdabe7e28b6f68482
> HCI Event: Number of Completed Packets (0x13) plen 5      #67 [hci1] 5.035020
        Num handles: 1
        Handle: 1569 Address: DF:A9:FF:F6:B1:1A (OUI DF-A9-FF)
        Count: 1
        #64: len 27 (2 Kb/s)
        Latency: 73 msec (73-165 msec ~119 msec)
> HCI Event: Number of Completed Packets (0x13) plen 5      #68 [hci1] 5.035478
        Num handles: 1
        Handle: 1569 Address: DF:A9:FF:F6:B1:1A (OUI DF-A9-FF)
        Count: 1
        #65: len 27 (2 Kb/s)
        Latency: 73 msec (73-165 msec ~96 msec)
> HCI Event: Number of Completed Packets (0x13) plen 5      #69 [hci1] 5.121694
        Num handles: 1
        Handle: 1569 Address: DF:A9:FF:F6:B1:1A (OUI DF-A9-FF)
        Count: 1
        #66: len 15 (0 Kb/s)
        Latency: 159 msec (73-165 msec ~128 msec)
> ACL Data RX: Handle 1569 flags 0x02 dlen 21               #70 [hci1] 5.734706
      SMP: Pairing Confirm (0x03) len 16
        Confim value: 76a6738c865ccaf19249dfddf87318cc
< HCI Command: Host Number of Compl.. (0x03|0x0035) plen 5  #71 [hci1] 5.741962
        Num handles: 1
        Handle: 1569 Address: DF:A9:FF:F6:B1:1A (OUI DF-A9-FF)
        Count: 1
< ACL Data TX: Handle 1569 flags 0x00 dlen 21               #72 [hci1] 5.742037
      SMP: Pairing Confirm (0x03) len 16
        Confim value: cd8d05e3519cdcb6f859f9d465555377
> HCI Event: Number of Completed Packets (0x13) plen 5      #73 [hci1] 5.909396
        Num handles: 1
        Handle: 1569 Address: DF:A9:FF:F6:B1:1A (OUI DF-A9-FF)
        Count: 1
        #72: len 21 (1 Kb/s)
        Latency: 167 msec (73-167 msec ~147 msec)
> ACL Data RX: Handle 1569 flags 0x02 dlen 21               #74 [hci1] 5.909815
      SMP: Pairing Random (0x04) len 16
        Random value: aeefed09f02ed43a2f049c5c0960d9eb
< HCI Command: Host Number of Compl.. (0x03|0x0035) plen 5  #75 [hci1] 5.921989
        Num handles: 1
        Handle: 1569 Address: DF:A9:FF:F6:B1:1A (OUI DF-A9-FF)
        Count: 1
< ACL Data TX: Handle 1569 flags 0x00 dlen 21               #76 [hci1] 5.922069
      SMP: Pairing Random (0x04) len 16
        Random value: 8e6108f966a694cbe26df70bb96773e6
> HCI Event: Number of Completed Packets (0x13) plen 5      #77 [hci1] 6.084463
        Num handles: 1
        Handle: 1569 Address: DF:A9:FF:F6:B1:1A (OUI DF-A9-FF)
        Count: 1
        #76: len 21 (1 Kb/s)
        Latency: 162 msec (73-167 msec ~155 msec)
> ACL Data RX: Handle 1569 flags 0x02 dlen 21               #78 [hci1] 6.084806
      SMP: Pairing Confirm (0x03) len 16
        Confim value: 298277ca9c4c3b69602cca1ead381875
< HCI Command: Host Number of Compl.. (0x03|0x0035) plen 5  #79 [hci1] 6.101969
        Num handles: 1
        Handle: 1569 Address: DF:A9:FF:F6:B1:1A (OUI DF-A9-FF)
        Count: 1
< ACL Data TX: Handle 1569 flags 0x00 dlen 21               #80 [hci1] 6.102059
      SMP: Pairing Confirm (0x03) len 16
        Confim value: 87269e78bfe914f9f4bcf0722411f955
> HCI Event: Number of Completed Packets (0x13) plen 5      #81 [hci1] 6.259460
        Num handles: 1
        Handle: 1569 Address: DF:A9:FF:F6:B1:1A (OUI DF-A9-FF)
        Count: 1
        #80: len 21 (1 Kb/s)
        Latency: 157 msec (73-167 msec ~156 msec)
> ACL Data RX: Handle 1569 flags 0x02 dlen 21               #82 [hci1] 6.259745
      SMP: Pairing Random (0x04) len 16
        Random value: 45db6f37e538a5da07de85ae24c4220c
< HCI Command: Host Number of Compl.. (0x03|0x0035) plen 5  #83 [hci1] 6.262153
        Num handles: 1
        Handle: 1569 Address: DF:A9:FF:F6:B1:1A (OUI DF-A9-FF)
        Count: 1
< ACL Data TX: Handle 1569 flags 0x00 dlen 21               #84 [hci1] 6.262228
      SMP: Pairing Random (0x04) len 16
        Random value: 4d02679f89a05211af56d8b3da64d21e
> HCI Event: Number of Completed Packets (0x13) plen 5      #85 [hci1] 6.434364
        Num handles: 1
        Handle: 1569 Address: DF:A9:FF:F6:B1:1A (OUI DF-A9-FF)
        Count: 1
        #84: len 21 (0 Kb/s)
        Latency: 172 msec (73-172 msec ~164 msec)
> ACL Data RX: Handle 1569 flags 0x02 dlen 21               #86 [hci1] 6.434735
      SMP: Pairing Confirm (0x03) len 16
        Confim value: 8be226da82c48773f0a1fc10cb7ff762
< HCI Command: Host Number of Compl.. (0x03|0x0035) plen 5  #87 [hci1] 6.441361
        Num handles: 1
        Handle: 1569 Address: DF:A9:FF:F6:B1:1A (OUI DF-A9-FF)
        Count: 1
< ACL Data TX: Handle 1569 flags 0x00 dlen 21               #88 [hci1] 6.441451
      SMP: Pairing Confirm (0x03) len 16
        Confim value: 0cdb3eb302ae0f2785ad03fc695c0210
> HCI Event: Number of Completed Packets (0x13) plen 5      #89 [hci1] 6.609392
        Num handles: 1
        Handle: 1569 Address: DF:A9:FF:F6:B1:1A (OUI DF-A9-FF)
        Count: 1
        #88: len 21 (1 Kb/s)
        Latency: 167 msec (73-172 msec ~166 msec)
> ACL Data RX: Handle 1569 flags 0x02 dlen 21               #90 [hci1] 6.609736
      SMP: Pairing Random (0x04) len 16
        Random value: 25777dd4d175e35cc9846dbc7b516c3c
< HCI Command: Host Number of Compl.. (0x03|0x0035) plen 5  #91 [hci1] 6.621409
        Num handles: 1
        Handle: 1569 Address: DF:A9:FF:F6:B1:1A (OUI DF-A9-FF)
        Count: 1
< ACL Data TX: Handle 1569 flags 0x00 dlen 21               #92 [hci1] 6.621418
      SMP: Pairing Random (0x04) len 16
        Random value: 5e8286bc235a02440d0c3424a2acf8fd
> HCI Event: Number of Completed Packets (0x13) plen 5      #93 [hci1] 6.784436
        Num handles: 1
        Handle: 1569 Address: DF:A9:FF:F6:B1:1A (OUI DF-A9-FF)
        Count: 1
        #92: len 21 (1 Kb/s)
        Latency: 163 msec (73-172 msec ~164 msec)
> ACL Data RX: Handle 1569 flags 0x02 dlen 21               #94 [hci1] 6.784812
      SMP: Pairing Confirm (0x03) len 16
        Confim value: 245412bc3b1658f3959d8810c9af474c
< HCI Command: Host Number of Compl.. (0x03|0x0035) plen 5  #95 [hci1] 6.802006
        Num handles: 1
        Handle: 1569 Address: DF:A9:FF:F6:B1:1A (OUI DF-A9-FF)
        Count: 1
< ACL Data TX: Handle 1569 flags 0x00 dlen 21               #96 [hci1] 6.802109
      SMP: Pairing Confirm (0x03) len 16
        Confim value: 7d40db5818729b4bc6e4229715958870
> HCI Event: Number of Completed Packets (0x13) plen 5      #97 [hci1] 6.959355
        Num handles: 1
        Handle: 1569 Address: DF:A9:FF:F6:B1:1A (OUI DF-A9-FF)
        Count: 1
        #96: len 21 (1 Kb/s)
        Latency: 157 msec (73-172 msec ~160 msec)
> ACL Data RX: Handle 1569 flags 0x02 dlen 21               #98 [hci1] 6.959769
      SMP: Pairing Random (0x04) len 16
        Random value: 874e587fc24965b81ea3433bcf419fc1
< HCI Command: Host Number of Compl.. (0x03|0x0035) plen 5  #99 [hci1] 6.961450
        Num handles: 1
        Handle: 1569 Address: DF:A9:FF:F6:B1:1A (OUI DF-A9-FF)
        Count: 1
< ACL Data TX: Handle 1569 flags 0x00 dlen 21              #100 [hci1] 6.961486
      SMP: Pairing Random (0x04) len 16
        Random value: 5c4a1bcadd27bd58e945097b00bad7ac
> HCI Event: Number of Completed Packets (0x13) plen 5     #101 [hci1] 7.134350
        Num handles: 1
        Handle: 1569 Address: DF:A9:FF:F6:B1:1A (OUI DF-A9-FF)
        Count: 1
        #100: len 21 (0 Kb/s)
        Latency: 172 msec (73-172 msec ~166 msec)
> ACL Data RX: Handle 1569 flags 0x02 dlen 21              #102 [hci1] 7.134673
      SMP: Pairing Confirm (0x03) len 16
        Confim value: 48fca9c43c1e89b34fdf44e4174672e5
< HCI Command: Host Number of Comp.. (0x03|0x0035) plen 5  #103 [hci1] 7.141623
        Num handles: 1
        Handle: 1569 Address: DF:A9:FF:F6:B1:1A (OUI DF-A9-FF)
        Count: 1
< ACL Data TX: Handle 1569 flags 0x00 dlen 21              #104 [hci1] 7.141663
      SMP: Pairing Confirm (0x03) len 16
        Confim value: 8815b789b57f3a9a322f3e7e6f0c9dcd
> HCI Event: Number of Completed Packets (0x13) plen 5     #105 [hci1] 7.309414
        Num handles: 1
        Handle: 1569 Address: DF:A9:FF:F6:B1:1A (OUI DF-A9-FF)
        Count: 1
        #104: len 21 (1 Kb/s)
        Latency: 167 msec (73-172 msec ~167 msec)
> ACL Data RX: Handle 1569 flags 0x02 dlen 21              #106 [hci1] 7.309696
      SMP: Pairing Random (0x04) len 16
        Random value: 2b32203e5cdb05059003549546fdaf36
< HCI Command: Host Number of Comp.. (0x03|0x0035) plen 5  #107 [hci1] 7.321364
        Num handles: 1
        Handle: 1569 Address: DF:A9:FF:F6:B1:1A (OUI DF-A9-FF)
        Count: 1
< ACL Data TX: Handle 1569 flags 0x00 dlen 21              #108 [hci1] 7.321404
      SMP: Pairing Random (0x04) len 16
        Random value: 32527e6e64e79f33b2e374394db8ab2d
> HCI Event: Number of Completed Packets (0x13) plen 5     #109 [hci1] 7.484462
        Num handles: 1
        Handle: 1569 Address: DF:A9:FF:F6:B1:1A (OUI DF-A9-FF)
        Count: 1
        #108: len 21 (1 Kb/s)
        Latency: 163 msec (73-172 msec ~165 msec)
> ACL Data RX: Handle 1569 flags 0x02 dlen 21              #110 [hci1] 7.484716
      SMP: Pairing Confirm (0x03) len 16
        Confim value: 4638321b7115321c2bc7e5d008a460d7
< HCI Command: Host Number of Comp.. (0x03|0x0035) plen 5  #111 [hci1] 7.501656
        Num handles: 1
        Handle: 1569 Address: DF:A9:FF:F6:B1:1A (OUI DF-A9-FF)
        Count: 1
< ACL Data TX: Handle 1569 flags 0x00 dlen 21              #112 [hci1] 7.501710
      SMP: Pairing Confirm (0x03) len 16
        Confim value: 81129de90550aa43b549b48241d9f7fe
> HCI Event: Number of Completed Packets (0x13) plen 5     #113 [hci1] 7.659355
        Num handles: 1
        Handle: 1569 Address: DF:A9:FF:F6:B1:1A (OUI DF-A9-FF)
        Count: 1
        #112: len 21 (1 Kb/s)
        Latency: 157 msec (73-172 msec ~161 msec)
> ACL Data RX: Handle 1569 flags 0x02 dlen 21              #114 [hci1] 7.659700
      SMP: Pairing Random (0x04) len 16
        Random value: 16e4ca58b9d606ef9cbb23808f4343bc
< HCI Command: Host Number of Comp.. (0x03|0x0035) plen 5  #115 [hci1] 7.662085
        Num handles: 1
        Handle: 1569 Address: DF:A9:FF:F6:B1:1A (OUI DF-A9-FF)
        Count: 1
< ACL Data TX: Handle 1569 flags 0x00 dlen 21              #116 [hci1] 7.662203
      SMP: Pairing Random (0x04) len 16
        Random value: dddbdfe2838e9a8cc6964353c850fef7
> HCI Event: Number of Completed Packets (0x13) plen 5     #117 [hci1] 7.834336
        Num handles: 1
        Handle: 1569 Address: DF:A9:FF:F6:B1:1A (OUI DF-A9-FF)
        Count: 1
        #116: len 21 (0 Kb/s)
        Latency: 172 msec (73-172 msec ~166 msec)
> ACL Data RX: Handle 1569 flags 0x02 dlen 21              #118 [hci1] 7.834664
      SMP: Pairing Confirm (0x03) len 16
        Confim value: 6fb776b803457d52862be08d25c3cd46
< HCI Command: Host Number of Comp.. (0x03|0x0035) plen 5  #119 [hci1] 7.842086
        Num handles: 1
        Handle: 1569 Address: DF:A9:FF:F6:B1:1A (OUI DF-A9-FF)
        Count: 1
< ACL Data TX: Handle 1569 flags 0x00 dlen 21              #120 [hci1] 7.842210
      SMP: Pairing Confirm (0x03) len 16
        Confim value: 49308508a9563d315d9fa1f85a42c08c
> HCI Event: Number of Completed Packets (0x13) plen 5     #121 [hci1] 8.009328
        Num handles: 1
        Handle: 1569 Address: DF:A9:FF:F6:B1:1A (OUI DF-A9-FF)
        Count: 1
        #120: len 21 (1 Kb/s)
        Latency: 167 msec (73-172 msec ~166 msec)
> ACL Data RX: Handle 1569 flags 0x02 dlen 21              #122 [hci1] 8.009654
      SMP: Pairing Random (0x04) len 16
        Random value: 09238fbb4e941be8cdf0ce8e40c5d99f
< HCI Command: Host Number of Comp.. (0x03|0x0035) plen 5  #123 [hci1] 8.021566
        Num handles: 1
        Handle: 1569 Address: DF:A9:FF:F6:B1:1A (OUI DF-A9-FF)
        Count: 1
< ACL Data TX: Handle 1569 flags 0x00 dlen 21              #124 [hci1] 8.021647
      SMP: Pairing Random (0x04) len 16
        Random value: eb9f1915536596b6fc3db1c86b2b1970
> HCI Event: Number of Completed Packets (0x13) plen 5     #125 [hci1] 8.184373
        Num handles: 1
        Handle: 1569 Address: DF:A9:FF:F6:B1:1A (OUI DF-A9-FF)
        Count: 1
        #124: len 21 (1 Kb/s)
        Latency: 162 msec (73-172 msec ~164 msec)
> ACL Data RX: Handle 1569 flags 0x02 dlen 21              #126 [hci1] 8.184735
      SMP: Pairing Confirm (0x03) len 16
        Confim value: 86a06d1501943c60cf0da84eebd8cd31
< HCI Command: Host Number of Comp.. (0x03|0x0035) plen 5  #127 [hci1] 8.202205
        Num handles: 1
        Handle: 1569 Address: DF:A9:FF:F6:B1:1A (OUI DF-A9-FF)
        Count: 1
< ACL Data TX: Handle 1569 flags 0x00 dlen 21              #128 [hci1] 8.202299
      SMP: Pairing Confirm (0x03) len 16
        Confim value: 6234d96a2b0336683c5b1077c2bc6ec8
> HCI Event: Number of Completed Packets (0x13) plen 5     #129 [hci1] 8.359376
        Num handles: 1
        Handle: 1569 Address: DF:A9:FF:F6:B1:1A (OUI DF-A9-FF)
        Count: 1
        #128: len 21 (1 Kb/s)
        Latency: 157 msec (73-172 msec ~160 msec)
> ACL Data RX: Handle 1569 flags 0x02 dlen 21              #130 [hci1] 8.359713
      SMP: Pairing Random (0x04) len 16
        Random value: 4f0613d47adad150d8ec0368b33b1790
< HCI Command: Host Number of Comp.. (0x03|0x0035) plen 5  #131 [hci1] 8.362044
        Num handles: 1
        Handle: 1569 Address: DF:A9:FF:F6:B1:1A (OUI DF-A9-FF)
        Count: 1
< ACL Data TX: Handle 1569 flags 0x00 dlen 21              #132 [hci1] 8.362197
      SMP: Pairing Random (0x04) len 16
        Random value: 5c794dc9ad9f2c3f295ebd5ad5e1c3cf
> HCI Event: Number of Completed Packets (0x13) plen 5     #133 [hci1] 8.534335
        Num handles: 1
        Handle: 1569 Address: DF:A9:FF:F6:B1:1A (OUI DF-A9-FF)
        Count: 1
        #132: len 21 (0 Kb/s)
        Latency: 172 msec (73-172 msec ~166 msec)
> ACL Data RX: Handle 1569 flags 0x02 dlen 21              #134 [hci1] 8.534632
      SMP: Pairing Confirm (0x03) len 16
        Confim value: f2f199cc639561580ebcbdefc2eec9eb
< HCI Command: Host Number of Comp.. (0x03|0x0035) plen 5  #135 [hci1] 8.541463
        Num handles: 1
        Handle: 1569 Address: DF:A9:FF:F6:B1:1A (OUI DF-A9-FF)
        Count: 1
< ACL Data TX: Handle 1569 flags 0x00 dlen 21              #136 [hci1] 8.541504
      SMP: Pairing Confirm (0x03) len 16
        Confim value: eb1b96a8c5d530b5ecc10548cae3d1c8
> HCI Event: Number of Completed Packets (0x13) plen 5     #137 [hci1] 8.709339
        Num handles: 1
        Handle: 1569 Address: DF:A9:FF:F6:B1:1A (OUI DF-A9-FF)
        Count: 1
        #136: len 21 (1 Kb/s)
        Latency: 167 msec (73-172 msec ~167 msec)
> ACL Data RX: Handle 1569 flags 0x02 dlen 21              #138 [hci1] 8.709650
      SMP: Pairing Random (0x04) len 16
        Random value: cc45b679d1380df3882550494ec5dcf5
< HCI Command: Host Number of Comp.. (0x03|0x0035) plen 5  #139 [hci1] 8.722045
        Num handles: 1
        Handle: 1569 Address: DF:A9:FF:F6:B1:1A (OUI DF-A9-FF)
        Count: 1
< ACL Data TX: Handle 1569 flags 0x00 dlen 21              #140 [hci1] 8.722145
      SMP: Pairing Random (0x04) len 16
        Random value: 5c2fff312cdf99c9491988e877355a9a
> HCI Event: Number of Completed Packets (0x13) plen 5     #141 [hci1] 8.884375
        Num handles: 1
        Handle: 1569 Address: DF:A9:FF:F6:B1:1A (OUI DF-A9-FF)
        Count: 1
        #140: len 21 (1 Kb/s)
        Latency: 162 msec (73-172 msec ~164 msec)
> ACL Data RX: Handle 1569 flags 0x02 dlen 21              #142 [hci1] 8.884783
      SMP: Pairing Confirm (0x03) len 16
        Confim value: e0618f30f145d9a515fbf3f1051da936
< HCI Command: Host Number of Comp.. (0x03|0x0035) plen 5  #143 [hci1] 8.901603
        Num handles: 1
        Handle: 1569 Address: DF:A9:FF:F6:B1:1A (OUI DF-A9-FF)
        Count: 1
< ACL Data TX: Handle 1569 flags 0x00 dlen 21              #144 [hci1] 8.901643
      SMP: Pairing Confirm (0x03) len 16
        Confim value: 54df64de2a21f7031fe7cc8998a70a03
> HCI Event: Number of Completed Packets (0x13) plen 5     #145 [hci1] 9.059389
        Num handles: 1
        Handle: 1569 Address: DF:A9:FF:F6:B1:1A (OUI DF-A9-FF)
        Count: 1
        #144: len 21 (1 Kb/s)
        Latency: 157 msec (73-172 msec ~161 msec)
> ACL Data RX: Handle 1569 flags 0x02 dlen 21              #146 [hci1] 9.059689
      SMP: Pairing Random (0x04) len 16
        Random value: 10c60cb897e5cb0a6726e4e6845a8ff2
< HCI Command: Host Number of Comp.. (0x03|0x0035) plen 5  #147 [hci1] 9.061362
        Num handles: 1
        Handle: 1569 Address: DF:A9:FF:F6:B1:1A (OUI DF-A9-FF)
        Count: 1
< ACL Data TX: Handle 1569 flags 0x00 dlen 21              #148 [hci1] 9.061368
      SMP: Pairing Random (0x04) len 16
        Random value: c629a3a987d808e808655d558dfc1155
< ACL Data TX: Handle 1569 flags 0x00 dlen 16              #149 [hci1] 9.091390
      LE L2CAP: Connection Parameter Update Request (0x12) ident 1 len 8
        Min interval: 24
        Max interval: 40
        Peripheral latency: 0
        Timeout multiplier: 42
> HCI Event: Number of Completed Packets (0x13) plen 5     #150 [hci1] 9.147219
        Num handles: 1
        Handle: 1569 Address: DF:A9:FF:F6:B1:1A (OUI DF-A9-FF)
        Count: 1
        #148: len 21 (1 Kb/s)
        Latency: 85 msec (73-172 msec ~123 msec)
> HCI Event: Number of Completed Packets (0x13) plen 5     #151 [hci1] 9.234374
        Num handles: 1
        Handle: 1569 Address: DF:A9:FF:F6:B1:1A (OUI DF-A9-FF)
        Count: 1
        #149: len 16 (0 Kb/s)
        Latency: 142 msec (73-172 msec ~133 msec)
> ACL Data RX: Handle 1569 flags 0x02 dlen 21              #152 [hci1] 9.234700
      SMP: Pairing Confirm (0x03) len 16
        Confim value: 88350b07ca294aaedd8755b8b674429e
< HCI Command: Host Number of Comp.. (0x03|0x0035) plen 5  #153 [hci1] 9.242110
        Num handles: 1
        Handle: 1569 Address: DF:A9:FF:F6:B1:1A (OUI DF-A9-FF)
        Count: 1
< ACL Data TX: Handle 1569 flags 0x00 dlen 21              #154 [hci1] 9.242246
      SMP: Pairing Confirm (0x03) len 16
        Confim value: 4da7a2a664dc6a9ca9a45dfc76af1c9c
> ACL Data RX: Handle 1569 flags 0x02 dlen 10              #155 [hci1] 9.321886
      LE L2CAP: Connection Parameter Update Response (0x13) ident 1 len 2
        Result: Connection Parameters accepted (0x0000)
< HCI Command: Host Number of Comp.. (0x03|0x0035) plen 5  #156 [hci1] 9.341406
        Num handles: 1
        Handle: 1569 Address: DF:A9:FF:F6:B1:1A (OUI DF-A9-FF)
        Count: 1
> HCI Event: Number of Completed Packets (0x13) plen 5     #157 [hci1] 9.409283
        Num handles: 1
        Handle: 1569 Address: DF:A9:FF:F6:B1:1A (OUI DF-A9-FF)
        Count: 1
        #154: len 21 (1 Kb/s)
        Latency: 167 msec (73-172 msec ~150 msec)
> ACL Data RX: Handle 1569 flags 0x02 dlen 21              #158 [hci1] 9.409721
      SMP: Pairing Random (0x04) len 16
        Random value: 1da57da1d50b0534a24fe8be011af790
< HCI Command: Host Number of Comp.. (0x03|0x0035) plen 5  #159 [hci1] 9.421567
        Num handles: 1
        Handle: 1569 Address: DF:A9:FF:F6:B1:1A (OUI DF-A9-FF)
        Count: 1
< ACL Data TX: Handle 1569 flags 0x00 dlen 21              #160 [hci1] 9.421641
      SMP: Pairing Random (0x04) len 16
        Random value: 92f20f6ad8f13724432c7fd6001c45ff
> HCI Event: Number of Completed Packets (0x13) plen 5     #161 [hci1] 9.584418
        Num handles: 1
        Handle: 1569 Address: DF:A9:FF:F6:B1:1A (OUI DF-A9-FF)
        Count: 1
        #160: len 21 (1 Kb/s)
        Latency: 162 msec (73-172 msec ~156 msec)
> ACL Data RX: Handle 1569 flags 0x02 dlen 21              #162 [hci1] 9.584700
      SMP: Pairing Confirm (0x03) len 16
        Confim value: 93fec6c5b24a216349b79492407e549f
< HCI Command: Host Number of Comp.. (0x03|0x0035) plen 5  #163 [hci1] 9.601546
        Num handles: 1
        Handle: 1569 Address: DF:A9:FF:F6:B1:1A (OUI DF-A9-FF)
        Count: 1
< ACL Data TX: Handle 1569 flags 0x00 dlen 21              #164 [hci1] 9.601554
      SMP: Pairing Confirm (0x03) len 16
        Confim value: 74e99bee25c597ea85b0dbbbf4c95e3d
> HCI Event: Number of Completed Packets (0x13) plen 5     #165 [hci1] 9.759303
        Num handles: 1
        Handle: 1569 Address: DF:A9:FF:F6:B1:1A (OUI DF-A9-FF)
        Count: 1
        #164: len 21 (1 Kb/s)
        Latency: 157 msec (73-172 msec ~157 msec)
> ACL Data RX: Handle 1569 flags 0x02 dlen 21              #166 [hci1] 9.759592
      SMP: Pairing Random (0x04) len 16
        Random value: a2a9fd1dc43db19e27c7bbe326251200
< HCI Command: Host Number of Comp.. (0x03|0x0035) plen 5  #167 [hci1] 9.761986
        Num handles: 1
        Handle: 1569 Address: DF:A9:FF:F6:B1:1A (OUI DF-A9-FF)
        Count: 1
< ACL Data TX: Handle 1569 flags 0x00 dlen 21              #168 [hci1] 9.762054
      SMP: Pairing Random (0x04) len 16
        Random value: 23ac32ebbb5e14c8a6b9622f296d277f
> HCI Event: Number of Completed Packets (0x13) plen 5     #169 [hci1] 9.934343
        Num handles: 1
        Handle: 1569 Address: DF:A9:FF:F6:B1:1A (OUI DF-A9-FF)
        Count: 1
        #168: len 21 (0 Kb/s)
        Latency: 172 msec (73-172 msec ~164 msec)
> ACL Data RX: Handle 1569 flags 0x02 dlen 21              #170 [hci1] 9.934631
      SMP: Pairing Confirm (0x03) len 16
        Confim value: a17659cee24f478e32562fbd763b9b1d
< HCI Command: Host Number of Comp.. (0x03|0x0035) plen 5  #171 [hci1] 9.941597
        Num handles: 1
        Handle: 1569 Address: DF:A9:FF:F6:B1:1A (OUI DF-A9-FF)
        Count: 1
< ACL Data TX: Handle 1569 flags 0x00 dlen 21              #172 [hci1] 9.941611
      SMP: Pairing Confirm (0x03) len 16
        Confim value: f7a93bace6316623668396711c3be83d
> HCI Event: Number of Completed Packets (0x13) plen 5    #173 [hci1] 10.109366
        Num handles: 1
        Handle: 1569 Address: DF:A9:FF:F6:B1:1A (OUI DF-A9-FF)
        Count: 1
        #172: len 21 (1 Kb/s)
        Latency: 167 msec (73-172 msec ~166 msec)
> ACL Data RX: Handle 1569 flags 0x02 dlen 21             #174 [hci1] 10.109740
      SMP: Pairing Random (0x04) len 16
        Random value: d456b6c123395e0c03ba51b2f8990aee
< HCI Command: Host Number of Com.. (0x03|0x0035) plen 5  #175 [hci1] 10.122155
        Num handles: 1
        Handle: 1569 Address: DF:A9:FF:F6:B1:1A (OUI DF-A9-FF)
        Count: 1
< ACL Data TX: Handle 1569 flags 0x00 dlen 21             #176 [hci1] 10.122337
      SMP: Pairing Random (0x04) len 16
        Random value: 297efe85e67448a15f56bd27e3a3cf1d
> HCI Event: Number of Completed Packets (0x13) plen 5    #177 [hci1] 10.284309
        Num handles: 1
        Handle: 1569 Address: DF:A9:FF:F6:B1:1A (OUI DF-A9-FF)
        Count: 1
        #176: len 21 (1 Kb/s)
        Latency: 161 msec (73-172 msec ~164 msec)
> ACL Data RX: Handle 1569 flags 0x02 dlen 21             #178 [hci1] 10.284635
      SMP: Pairing Confirm (0x03) len 16
        Confim value: 9152a40148bfd3e68e53a214ab1359e4
< HCI Command: Host Number of Com.. (0x03|0x0035) plen 5  #179 [hci1] 10.302138
        Num handles: 1
        Handle: 1569 Address: DF:A9:FF:F6:B1:1A (OUI DF-A9-FF)
        Count: 1
< ACL Data TX: Handle 1569 flags 0x00 dlen 21             #180 [hci1] 10.302232
      SMP: Pairing Confirm (0x03) len 16
        Confim value: 129a79e3ac140f8547db1ff107c7de09
> HCI Event: Number of Completed Packets (0x13) plen 5    #181 [hci1] 10.459486
        Num handles: 1
        Handle: 1569 Address: DF:A9:FF:F6:B1:1A (OUI DF-A9-FF)
        Count: 1
        #180: len 21 (1 Kb/s)
        Latency: 157 msec (73-172 msec ~160 msec)
> ACL Data RX: Handle 1569 flags 0x02 dlen 21             #182 [hci1] 10.459644
      SMP: Pairing Random (0x04) len 16
        Random value: b36a4124493a33f34e78f9e9a12fd72d
< HCI Command: Host Number of Com.. (0x03|0x0035) plen 5  #183 [hci1] 10.461552
        Num handles: 1
        Handle: 1569 Address: DF:A9:FF:F6:B1:1A (OUI DF-A9-FF)
        Count: 1
< ACL Data TX: Handle 1569 flags 0x00 dlen 21             #184 [hci1] 10.461595
      SMP: Pairing Random (0x04) len 16
        Random value: 25a9493fd3ce4faf02be7293595bb7c6
> HCI Event: Number of Completed Packets (0x13) plen 5    #185 [hci1] 10.634327
        Num handles: 1
        Handle: 1569 Address: DF:A9:FF:F6:B1:1A (OUI DF-A9-FF)
        Count: 1
        #184: len 21 (0 Kb/s)
        Latency: 172 msec (73-172 msec ~166 msec)
> ACL Data RX: Handle 1569 flags 0x02 dlen 21             #186 [hci1] 10.634576
      SMP: Pairing Confirm (0x03) len 16
        Confim value: 9902df50c89fcbf4d62a82c5145011b2
< HCI Command: Host Number of Com.. (0x03|0x0035) plen 5  #187 [hci1] 10.641367
        Num handles: 1
        Handle: 1569 Address: DF:A9:FF:F6:B1:1A (OUI DF-A9-FF)
        Count: 1
< ACL Data TX: Handle 1569 flags 0x00 dlen 21             #188 [hci1] 10.641395
      SMP: Pairing Confirm (0x03) len 16
        Confim value: c4458afabe090f796e78ee856b03b453
> HCI Event: Number of Completed Packets (0x13) plen 5    #189 [hci1] 10.809445
        Num handles: 1
        Handle: 1569 Address: DF:A9:FF:F6:B1:1A (OUI DF-A9-FF)
        Count: 1
        #188: len 21 (1 Kb/s)
        Latency: 168 msec (73-172 msec ~167 msec)
> ACL Data RX: Handle 1569 flags 0x02 dlen 21             #190 [hci1] 10.809578
      SMP: Pairing Random (0x04) len 16
        Random value: bada56c3fd07079bf9cf6156f33c0877
< HCI Command: Host Number of Com.. (0x03|0x0035) plen 5  #191 [hci1] 10.822060
        Num handles: 1
        Handle: 1569 Address: DF:A9:FF:F6:B1:1A (OUI DF-A9-FF)
        Count: 1
< ACL Data TX: Handle 1569 flags 0x00 dlen 21             #192 [hci1] 10.822340
      SMP: Pairing Random (0x04) len 16
        Random value: 58f6b41f855a6f6c3560debd84e2affc
> HCI Event: Number of Completed Packets (0x13) plen 5    #193 [hci1] 10.984230
        Num handles: 1
        Handle: 1569 Address: DF:A9:FF:F6:B1:1A (OUI DF-A9-FF)
        Count: 1
        #192: len 21 (1 Kb/s)
        Latency: 161 msec (73-172 msec ~164 msec)
> ACL Data RX: Handle 1569 flags 0x02 dlen 21             #194 [hci1] 10.984592
      SMP: Pairing Confirm (0x03) len 16
        Confim value: 401c8885d9034bbd906325a91ba181a7
< HCI Command: Host Number of Com.. (0x03|0x0035) plen 5  #195 [hci1] 11.001433
        Num handles: 1
        Handle: 1569 Address: DF:A9:FF:F6:B1:1A (OUI DF-A9-FF)
        Count: 1
< ACL Data TX: Handle 1569 flags 0x00 dlen 21             #196 [hci1] 11.001463
      SMP: Pairing Confirm (0x03) len 16
        Confim value: cdaf5db0b228e386dcbf925761ef7b13
> HCI Event: Number of Completed Packets (0x13) plen 5    #197 [hci1] 11.159251
        Num handles: 1
        Handle: 1569 Address: DF:A9:FF:F6:B1:1A (OUI DF-A9-FF)
        Count: 1
        #196: len 21 (1 Kb/s)
        Latency: 157 msec (73-172 msec ~161 msec)
> ACL Data RX: Handle 1569 flags 0x02 dlen 21             #198 [hci1] 11.159589
      SMP: Pairing Random (0x04) len 16
        Random value: b3d1d210f95fa54c3f15458227cda388
< HCI Command: Host Number of Com.. (0x03|0x0035) plen 5  #199 [hci1] 11.161655
        Num handles: 1
        Handle: 1569 Address: DF:A9:FF:F6:B1:1A (OUI DF-A9-FF)
        Count: 1
< ACL Data TX: Handle 1569 flags 0x00 dlen 21             #200 [hci1] 11.161666
      SMP: Pairing Random (0x04) len 16
        Random value: b67e7216d5bf664139eda2b542549666
> HCI Event: Number of Completed Packets (0x13) plen 5    #201 [hci1] 11.334275
        Num handles: 1
        Handle: 1569 Address: DF:A9:FF:F6:B1:1A (OUI DF-A9-FF)
        Count: 1
        #200: len 21 (0 Kb/s)
        Latency: 172 msec (73-172 msec ~166 msec)
> ACL Data RX: Handle 1569 flags 0x02 dlen 21             #202 [hci1] 11.334616
      SMP: Pairing Confirm (0x03) len 16
        Confim value: 62295deabfb9749d008292f07a5430bb
< HCI Command: Host Number of Com.. (0x03|0x0035) plen 5  #203 [hci1] 11.342091
        Num handles: 1
        Handle: 1569 Address: DF:A9:FF:F6:B1:1A (OUI DF-A9-FF)
        Count: 1
< ACL Data TX: Handle 1569 flags 0x00 dlen 21             #204 [hci1] 11.342265
      SMP: Pairing Confirm (0x03) len 16
        Confim value: 6b75a3626b84c4ba443c5009135d6089
> HCI Event: Number of Completed Packets (0x13) plen 5    #205 [hci1] 11.509318
        Num handles: 1
        Handle: 1569 Address: DF:A9:FF:F6:B1:1A (OUI DF-A9-FF)
        Count: 1
        #204: len 21 (1 Kb/s)
        Latency: 167 msec (73-172 msec ~166 msec)
> ACL Data RX: Handle 1569 flags 0x02 dlen 21             #206 [hci1] 11.509610
      SMP: Pairing Random (0x04) len 16
        Random value: 4da672e0c396659f55843f7152487e77
< HCI Command: Host Number of Com.. (0x03|0x0035) plen 5  #207 [hci1] 11.521688
        Num handles: 1
        Handle: 1569 Address: DF:A9:FF:F6:B1:1A (OUI DF-A9-FF)
        Count: 1
< ACL Data TX: Handle 1569 flags 0x00 dlen 21             #208 [hci1] 11.521720
      SMP: Pairing Random (0x04) len 16
        Random value: ed17f76500c95219dd01e09d1e63f87b
> HCI Event: Number of Completed Packets (0x13) plen 5    #209 [hci1] 11.684291
        Num handles: 1
        Handle: 1569 Address: DF:A9:FF:F6:B1:1A (OUI DF-A9-FF)
        Count: 1
        #208: len 21 (1 Kb/s)
        Latency: 162 msec (73-172 msec ~164 msec)
> ACL Data RX: Handle 1569 flags 0x02 dlen 21             #210 [hci1] 11.684589
      SMP: Pairing Confirm (0x03) len 16
        Confim value: d58a3a0e58065fc2a8fb5f1e7938b310
< HCI Command: Host Number of Com.. (0x03|0x0035) plen 5  #211 [hci1] 11.702097
        Num handles: 1
        Handle: 1569 Address: DF:A9:FF:F6:B1:1A (OUI DF-A9-FF)
        Count: 1
< ACL Data TX: Handle 1569 flags 0x00 dlen 21             #212 [hci1] 11.702178
      SMP: Pairing Confirm (0x03) len 16
        Confim value: 42c628e8b3d401fbf708682ad97a79e7
> HCI Event: Number of Completed Packets (0x13) plen 5    #213 [hci1] 11.859240
        Num handles: 1
        Handle: 1569 Address: DF:A9:FF:F6:B1:1A (OUI DF-A9-FF)
        Count: 1
        #212: len 21 (1 Kb/s)
        Latency: 157 msec (73-172 msec ~160 msec)
> ACL Data RX: Handle 1569 flags 0x02 dlen 21             #214 [hci1] 11.859641
      SMP: Pairing Random (0x04) len 16
        Random value: 6cf8dcda06c9719fe6ca9a6f72780044
< HCI Command: Host Number of Com.. (0x03|0x0035) plen 5  #215 [hci1] 11.862077
        Num handles: 1
        Handle: 1569 Address: DF:A9:FF:F6:B1:1A (OUI DF-A9-FF)
        Count: 1
< ACL Data TX: Handle 1569 flags 0x00 dlen 21             #216 [hci1] 11.862214
      SMP: Pairing Random (0x04) len 16
        Random value: 81d35d47e1f6006d79c974bd9d9e1ee3
> HCI Event: Number of Completed Packets (0x13) plen 5    #217 [hci1] 12.034330
        Num handles: 1
        Handle: 1569 Address: DF:A9:FF:F6:B1:1A (OUI DF-A9-FF)
        Count: 1
        #216: len 21 (0 Kb/s)
        Latency: 172 msec (73-172 msec ~166 msec)
> ACL Data RX: Handle 1569 flags 0x02 dlen 21             #218 [hci1] 12.034608
      SMP: Pairing Confirm (0x03) len 16
        Confim value: d1bb752746318bb9767db6665a4ee5d4
< HCI Command: Host Number of Com.. (0x03|0x0035) plen 5  #219 [hci1] 12.041425
        Num handles: 1
        Handle: 1569 Address: DF:A9:FF:F6:B1:1A (OUI DF-A9-FF)
        Count: 1
< ACL Data TX: Handle 1569 flags 0x00 dlen 21             #220 [hci1] 12.041459
      SMP: Pairing Confirm (0x03) len 16
        Confim value: fa11e5eeb32daeceaf1ab87e244f509c
> HCI Event: Number of Completed Packets (0x13) plen 5    #221 [hci1] 12.209298
        Num handles: 1
        Handle: 1569 Address: DF:A9:FF:F6:B1:1A (OUI DF-A9-FF)
        Count: 1
        #220: len 21 (1 Kb/s)
        Latency: 167 msec (73-172 msec ~167 msec)
> ACL Data RX: Handle 1569 flags 0x02 dlen 21             #222 [hci1] 12.209652
      SMP: Pairing Random (0x04) len 16
        Random value: a9f7f644d832b64153cb481f6b77a287
< HCI Command: Host Number of Com.. (0x03|0x0035) plen 5  #223 [hci1] 12.221473
        Num handles: 1
        Handle: 1569 Address: DF:A9:FF:F6:B1:1A (OUI DF-A9-FF)
        Count: 1
< ACL Data TX: Handle 1569 flags 0x00 dlen 21             #224 [hci1] 12.221534
      SMP: Pairing Random (0x04) len 16
        Random value: e7f7e0c2476823e41736a7e381bafb7c
> HCI Event: Number of Completed Packets (0x13) plen 5    #225 [hci1] 12.384407
        Num handles: 1
        Handle: 1569 Address: DF:A9:FF:F6:B1:1A (OUI DF-A9-FF)
        Count: 1
        #224: len 21 (1 Kb/s)
        Latency: 162 msec (73-172 msec ~165 msec)
> ACL Data RX: Handle 1569 flags 0x02 dlen 21             #226 [hci1] 12.384728
      SMP: Pairing Confirm (0x03) len 16
        Confim value: 9a04f6fb164505a3cad8bfe556f486b1
< HCI Command: Host Number of Com.. (0x03|0x0035) plen 5  #227 [hci1] 12.402093
        Num handles: 1
        Handle: 1569 Address: DF:A9:FF:F6:B1:1A (OUI DF-A9-FF)
        Count: 1
< ACL Data TX: Handle 1569 flags 0x00 dlen 21             #228 [hci1] 12.402117
      SMP: Pairing Confirm (0x03) len 16
        Confim value: 8dfe6ed9865834f3490e1eb59c33b6b9
> HCI Event: Number of Completed Packets (0x13) plen 5    #229 [hci1] 12.559335
        Num handles: 1
        Handle: 1569 Address: DF:A9:FF:F6:B1:1A (OUI DF-A9-FF)
        Count: 1
        #228: len 21 (1 Kb/s)
        Latency: 157 msec (73-172 msec ~161 msec)
> ACL Data RX: Handle 1569 flags 0x02 dlen 21             #230 [hci1] 12.559684
      SMP: Pairing Random (0x04) len 16
        Random value: b66b83f70ebe4b6c8597e778a45e2098
< HCI Command: Host Number of Com.. (0x03|0x0035) plen 5  #231 [hci1] 12.561569
        Num handles: 1
        Handle: 1569 Address: DF:A9:FF:F6:B1:1A (OUI DF-A9-FF)
        Count: 1
< ACL Data TX: Handle 1569 flags 0x00 dlen 21             #232 [hci1] 12.561580
      SMP: Pairing Random (0x04) len 16
        Random value: fc8b40d9b0b09bc4296bf8753a8f6e1f
> HCI Event: Number of Completed Packets (0x13) plen 5    #233 [hci1] 12.734306
        Num handles: 1
        Handle: 1569 Address: DF:A9:FF:F6:B1:1A (OUI DF-A9-FF)
        Count: 1
        #232: len 21 (0 Kb/s)
        Latency: 172 msec (73-172 msec ~166 msec)
> ACL Data RX: Handle 1569 flags 0x02 dlen 21             #234 [hci1] 12.734614
      SMP: Pairing DHKey Check (0x0d) len 16
        E: 2496a4c2b39bba9a1bdc923381b285cd
< HCI Command: Host Number of Com.. (0x03|0x0035) plen 5  #235 [hci1] 12.741694
        Num handles: 1
        Handle: 1569 Address: DF:A9:FF:F6:B1:1A (OUI DF-A9-FF)
        Count: 1
< ACL Data TX: Handle 1569 flags 0x00 dlen 21             #236 [hci1] 12.741702
      SMP: Pairing DHKey Check (0x0d) len 16
        E: b20ae997d1673b76945c5de645842610
> HCI Event: Number of Completed Packets (0x13) plen 5    #237 [hci1] 12.909140
        Num handles: 1
        Handle: 1569 Address: DF:A9:FF:F6:B1:1A (OUI DF-A9-FF)
        Count: 1
        #236: len 21 (1 Kb/s)
        Latency: 167 msec (73-172 msec ~167 msec)
> HCI Event: LE Meta Event (0x3e) plen 13                 #238 [hci1] 12.997154
      LE Long Term Key Request (0x05)
        Handle: 1569 Address: DF:A9:FF:F6:B1:1A (OUI DF-A9-FF)
        Random number: 0x0000000000000000
        Encrypted diversifier: 0x0000
< HCI Command: LE Long Term Key... (0x08|0x001a) plen 18  #239 [hci1] 13.001373
        Handle: 1569 Address: DF:A9:FF:F6:B1:1A (OUI DF-A9-FF)
        Long term key: fd4991bbef22aa1c351633b6336af073
> HCI Event: Command Complete (0x0e) plen 6               #240 [hci1] 13.002168
      LE Long Term Key Request Reply (0x08|0x001a) ncmd 1
        Status: Success (0x00)
        Handle: 1569 Address: DF:A9:FF:F6:B1:1A (OUI DF-A9-FF)
> HCI Event: Encryption Change (0x08) plen 4              #241 [hci1] 13.434517
        Status: Success (0x00)
        Handle: 1569 Address: DF:A9:FF:F6:B1:1A (OUI DF-A9-FF)
        Encryption: Enabled with AES-CCM (0x01)
> HCI Event: Disconnect Complete (0x05) plen 4            #242 [hci1] 16.584447
        Status: Success (0x00)
        Handle: 1569 Address: DF:A9:FF:F6:B1:1A (OUI DF-A9-FF)
        Reason: Remote User Terminated Connection (0x13)
< HCI Command: Reset (0x03|0x0003) plen 0                 #243 [hci1] 22.271449
> HCI Event: Command Complete (0x0e) plen 4               #244 [hci1] 22.271947
      Reset (0x03|0x0003) ncmd 1
        Status: Success (0x00)
@ USER Close: main                                    {0x0001} [hci1] 22.281394
= Close Index: 00:00:00:00:00:00                               [hci1] 22.285492
