Bluetooth monitor ver 5.72
= Note: Linux version 6.14.0-36-generic (x86_64)                       0.415183
= Note: Bluetooth subsystem version 2.22                               0.415184
= New Index: 00:00:00:00:00:00 (Primary,UART,hci1)              [hci1] 0.415185
= New Index: 48:5F:99:8E:E0:64 (Primary,USB,hci0)               [hci0] 0.415186
= Open Index: 00:00:00:00:00:00                                 [hci1] 0.558784
= Index Info: 00:00:00:00:00:00 (Nordic Semiconductor ASA)      [hci1] 0.558795
@ USER Open: main (privileged) version 2.22            {0x0001} [hci1] 0.558801
< HCI Command: Reset (0x03|0x0003) plen 0                    #1 [hci1] 0.559695
> HCI Event: Command Complete (0x0e) plen 4                  #2 [hci1] 0.560155
      Reset (0x03|0x0003) ncmd 1
        Status: Success (0x00)
< HCI Command: Read Local Supported... (0x04|0x0003) plen 0  #3 [hci1] 0.578484
> HCI Event: Command Complete (0x0e) plen 12                 #4 [hci1] 0.578955
      Read Local Supported Features (0x04|0x0003) ncmd 1
        Status: Success (0x00)
        Features: 0x00 0x00 0x00 0x00 0x60 0x00 0x00 0x00
          BR/EDR Not Supported
          LE Supported (Controller)
< HCI Command: Read Local Version In.. (0x04|0x0001) plen 0  #5 [hci1] 0.598447
> HCI Event: Command Complete (0x0e) plen 12                 #6 [hci1] 0.598922
      Read Local Version Information (0x04|0x0001) ncmd 1
        Status: Success (0x00)
        HCI version: Reserved (0x11) - Revision 12345 (0x3039)
        LMP version: Reserved (0x11) - Subversion 12345 (0x3039)
        Manufacturer: Nordic Semiconductor ASA (89)
< HCI Command: Read Local Supported... (0x04|0x0002) plen 0  #7 [hci1] 0.618436
> HCI Event: Command Complete (0x0e) plen 68                 #8 [hci1] 0.619475
      Read Local Supported Commands (0x04|0x0002) ncmd 1
        Status: Success (0x00)
        Commands: 115 entries
          Disconnect (Octet 0 - Bit 5)
          Read Remote Version Information (Octet 2 - Bit 7)
          Set Event Mask (Octet 5 - Bit 6)
          Reset (Octet 5 - Bit 7)
          Read Connection Accept Timeout (Octet 7 - Bit 2)
          Write Connection Accept Timeout (Octet 7 - Bit 3)
          Read Transmit Power Level (Octet 10 - Bit 2)
          Set Controller To Host Flow Control (Octet 10 - Bit 5)
          Host Buffer Size (Octet 10 - Bit 6)
          Host Number of Completed Packets (Octet 10 - Bit 7)
          Read Local Version Information (Octet 14 - Bit 3)
          Read Local Supported Features (Octet 14 - Bit 5)
          Read BD ADDR (Octet 15 - Bit 1)
          Read RSSI (Octet 15 - Bit 5)
          Set Event Mask Page 2 (Octet 22 - Bit 2)
          LE Set Event Mask (Octet 25 - Bit 0)
          LE Read Buffer Size (Octet 25 - Bit 1)
          LE Read Local Supported Features (Octet 25 - Bit 2)
          LE Set Random Address (Octet 25 - Bit 4)
          LE Set Advertising Parameters (Octet 25 - Bit 5)
          LE Read Advertising Channel TX Power (Octet 25 - Bit 6)
          LE Set Advertising Data (Octet 25 - Bit 7)
          LE Set Scan Response Data (Octet 26 - Bit 0)
          LE Set Advertise Enable (Octet 26 - Bit 1)
          LE Set Scan Parameters (Octet 26 - Bit 2)
          LE Set Scan Enable (Octet 26 - Bit 3)
          LE Create Connection (Octet 26 - Bit 4)
          LE Create Connection Cancel (Octet 26 - Bit 5)
          LE Read Accept List Size (Octet 26 - Bit 6)
          LE Clear Accept List (Octet 26 - Bit 7)
          LE Add Device To Accept List (Octet 27 - Bit 0)
          LE Remove Device From Accept List (Octet 27 - Bit 1)
          LE Connection Update (Octet 27 - Bit 2)
          LE Set Host Channel Classification (Octet 27 - Bit 3)
          LE Read Channel Map (Octet 27 - Bit 4)
          LE Read Remote Used Features (Octet 27 - Bit 5)
          LE Encrypt (Octet 27 - Bit 6)
          LE Rand (Octet 27 - Bit 7)
          LE Start Encryption (Octet 28 - Bit 0)
          LE Long Term Key Request Reply (Octet 28 - Bit 1)
          LE Long Term Key Request Neg Reply (Octet 28 - Bit 2)
          LE Read Supported States (Octet 28 - Bit 3)
          Read Authenticated Payload Timeout (Octet 32 - Bit 4)
          Write Authenticated Payload Timeout (Octet 32 - Bit 5)
          LE Set Data Length (Octet 33 - Bit 6)
          LE Read Suggested Default Data Length (Octet 33 - Bit 7)
          LE Write Suggested Default Data Length (Octet 34 - Bit 0)
          LE Add Device To Resolving List (Octet 34 - Bit 3)
          LE Remove Device From Resolving List (Octet 34 - Bit 4)
          LE Clear Resolving List (Octet 34 - Bit 5)
          LE Read Resolving List Size (Octet 34 - Bit 6)
          LE Set Address Resolution Enable (Octet 35 - Bit 1)
          LE Set Resolvable Private Address Timeout (Octet 35 - Bit 2)
          LE Read Maximum Data Length (Octet 35 - Bit 3)
          LE Read PHY (Octet 35 - Bit 4)
          LE Set Default PHY (Octet 35 - Bit 5)
          LE Set PHY (Octet 35 - Bit 6)
          LE Set Advertising Set Random Address (Octet 36 - Bit 1)
          LE Set Extended Advertising Parameters (Octet 36 - Bit 2)
          LE Set Extended Advertising Data (Octet 36 - Bit 3)
          LE Set Extended Scan Response Data (Octet 36 - Bit 4)
          LE Set Extended Advertising Enable (Octet 36 - Bit 5)
          LE Read Maximum Advertising Data Length (Octet 36 - Bit 6)
          LE Read Number of Supported Advertising Sets (Octet 36 - Bit 7)
          LE Remove Advertising Set (Octet 37 - Bit 0)
          LE Clear Advertising Sets (Octet 37 - Bit 1)
          LE Set Periodic Advertising Parameters (Octet 37 - Bit 2)
          LE Set Periodic Advertising Data (Octet 37 - Bit 3)
          LE Set Periodic Advertising Enable (Octet 37 - Bit 4)
          LE Set Extended Scan Parameters (Octet 37 - Bit 5)
          LE Set Extended Scan Enable (Octet 37 - Bit 6)
          LE Extended Create Connection (Octet 37 - Bit 7)
          LE Periodic Advertising Create Sync (Octet 38 - Bit 0)
          LE Periodic Advertising Create Sync Cancel (Octet 38 - Bit 1)
          LE Periodic Advertising Terminate Sync (Octet 38 - Bit 2)
          LE Add Device To Periodic Advertiser List (Octet 38 - Bit 3)
          LE Remove Device From Periodic Advertiser List (Octet 38 - Bit 4)
          LE Clear Periodic Advertiser List (Octet 38 - Bit 5)
          LE Read Periodic Advertiser List Size (Octet 38 - Bit 6)
          LE Read Transmit Power (Octet 38 - Bit 7)
          LE Read RF Path Compensation (Octet 39 - Bit 0)
          LE Write RF Path Compensation (Octet 39 - Bit 1)
          LE Set Privacy Mode (Octet 39 - Bit 2)
          LE Periodic Advertising Receive Enable (Octet 40 - Bit 5)
          LE Periodic Advertising Sync Transfer (Octet 40 - Bit 6)
          LE Periodic Advertising Set Info Transfer (Octet 40 - Bit 7)
          LE Periodic Advertising Sync Transfer Parameters (Octet 41 - Bit 0)
          LE Set Default Periodic Advertisng Sync Transfer Parameters (Octet 41 - Bit 1)
          LE Read Buffer v2 (Octet 41 - Bit 5)
          LE Read ISO TX Sync (Octet 41 - Bit 6)
          LE Set Connected Isochronous Group Parameters (Octet 41 - Bit 7)
          LE Set Connected Isochronous Group Parameters Test (Octet 42 - Bit 0)
          LE Create Connected Isochronous Stream (Octet 42 - Bit 1)
          LE Remove Connected Isochronous Group (Octet 42 - Bit 2)
          LE Accept Connected Isochronous Stream Request (Octet 42 - Bit 3)
          LE Reject Connected Isochronous Stream Request (Octet 42 - Bit 4)
          LE Create Broadcast Isochronous Group (Octet 42 - Bit 5)
          LE Create Broadcast Isochronous Group Test (Octet 42 - Bit 6)
          LE Terminate Broadcast Isochronous Group (Octet 42 - Bit 7)
          LE Broadcast Isochronous Group Create Sync (Octet 43 - Bit 0)
          LE Broadcast Isochronous Group Terminate Sync (Octet 43 - Bit 1)
          LE Request Peer SCA (Octet 43 - Bit 2)
          LE Setup Isochronous Data Path (Octet 43 - Bit 3)
          LE Remove Isochronous Data Path (Octet 43 - Bit 4)
          LE Isochronous Transmit Test (Octet 43 - Bit 5)
          LE Isochronous Receive Test (Octet 43 - Bit 6)
          LE Isochronous Read Test Counters (Octet 43 - Bit 7)
          LE Isochronous Read Test Counters (Octet 44 - Bit 0)
          LE Set Host Feature (Octet 44 - Bit 1)
          Octet 44 - Bit 2 
          Octet 45 - Bit 6 
          Octet 46 - Bit 0 
          Octet 46 - Bit 1 
          Octet 46 - Bit 2 
          Octet 47 - Bit 4 
< HCI Command: Host Buffer Size (0x03|0x0033) plen 7         #9 [hci1] 0.638409
        ACL MTU: 255  ACL max packet: 16
        SCO MTU: 0    SCO max packet: 0
> HCI Event: Command Complete (0x0e) plen 4                 #10 [hci1] 0.638885
      Host Buffer Size (0x03|0x0033) ncmd 1
        Status: Success (0x00)
< HCI Command: Set Controller To Ho.. (0x03|0x0031) plen 1  #11 [hci1] 0.658437
        Flow control: ACL Data Packets (0x01)
> HCI Event: Command Complete (0x0e) plen 4                 #12 [hci1] 0.658796
      Set Controller To Host Flow Control (0x03|0x0031) ncmd 1
        Status: Success (0x00)
< HCI Command: LE Read Local Suppor.. (0x08|0x0003) plen 0  #13 [hci1] 0.678439
> HCI Event: Command Complete (0x0e) plen 12                #14 [hci1] 0.678931
      LE Read Local Supported Features (0x08|0x0003) ncmd 1
        Status: Success (0x00)
        Features: 0xfd 0x79 0x00 0xf7 0x30 0x01 0x00 0x00
          LE Encryption
          Extended Reject Indication
          Peripheral-initiated Features Exchange
          LE Ping
          LE Data Packet Length Extension
          LL Privacy
          Extended Scanner Filter Policies
          LE 2M PHY
          LE Coded PHY
          LE Extended Advertising
          LE Periodic Advertising
          Channel Selection Algorithm #2
          Periodic Advertising Sync Transfer - Sender
          Periodic Advertising Sync Transfer - Recipient
          Sleep Clock Accuracy Updates
          Connected Isochronous Stream - Central
          Connected Isochronous Stream - Peripheral
          Isochronous Broadcaster
          Synchronized Receiver
          Periodic Advertising ADI support
          Connection Subrating
          Unknown features (0x0000010000000000)
< HCI Command: LE Set Host Feature (0x08|0x0074) plen 2     #15 [hci1] 0.698463
        Bit Number: 32
          Connected Isochronous Stream (Host Support)
        Bit Value: 1
> HCI Event: Command Complete (0x0e) plen 4                 #16 [hci1] 0.698886
      LE Set Host Feature (0x08|0x0074) ncmd 1
        Status: Success (0x00)
< HCI Command: LE Read Buffer v2 (0x08|0x0060) plen 0       #17 [hci1] 0.718457
> HCI Event: Command Complete (0x0e) plen 10                #18 [hci1] 0.718884
      LE Read Buffer v2 (0x08|0x0060) ncmd 1
        Status: Success (0x00)
        ACL MTU: 27
        ACL max packet: 3
        ISO MTU: 318
        ISO max packet: 3
< HCI Command: LE Read Maximum Adve.. (0x08|0x003a) plen 0  #19 [hci1] 0.738475
> HCI Event: Command Complete (0x0e) plen 6                 #20 [hci1] 0.738885
      LE Read Maximum Advertising Data Length (0x08|0x003a) ncmd 1
        Status: Success (0x00)
        Max length: 1650
< HCI Command: LE Read Supported St.. (0x08|0x001c) plen 0  #21 [hci1] 0.758432
> HCI Event: Command Complete (0x0e) plen 12                #22 [hci1] 0.758918
      LE Read Supported States (0x08|0x001c) ncmd 1
        Status: Success (0x00)
        States: 0x000003ff3e0306ff
          Non-connectable Advertising State
          Scannable Advertising State
          Connectable Advertising State
          High Duty Cycle Directed Advertising State
          Passive Scanning State
          Active Scanning State
          Initiating State
            and Connection State (Central Role)
          Connection State (Peripheral Role)
          Scannable Advertising State
            and Passive Scanning State
          Connectable Advertising State
            and Passive Scanning State
          Non-connectable Advertising State
            and Initiating State
          Scannable Advertising State
            and Initiating State
          Active Scanning State
            and Connection State (Central Role)
          Passive Scanning State
            and Connection State (Peripheral Role)
          Active Scanning State
            and Connection State (Peripheral Role)
          Initiating State
            and Connection State (Central Role)
            and Central Role & Central Role
          Low Duty Cycle Directed Advertising State
          Connectable Advertising State
            and Initiating State
            and Central Role & Peripheral Role
          High Duty Cycle Directed Advertising State
            and Initiating State
            and Central Role & Peripheral Role
          Low Duty Cycle Directed Advertising State
            and Initiating State
            and Central Role & Peripheral Role
          Connectable Advertising State
            and Connection State (Central Role)
            and Central Role & Peripheral Role
          High Duty Cycle Directed Advertising State
            and Connection State (Central Role)
            and Central Role & Peripheral Role
          Low Duty Cycle Directed Advertising State
            and Connection State (Central Role)
            and Central Role & Peripheral Role
          Connectable Advertising State
            and Connection State (Peripheral Role)
            and Central Role & Peripheral Role
          High Duty Cycle Directed Advertising State
            and Connection State (Peripheral Role)
            and Peripheral Role & Peripheral Role
          Low Duty Cycle Directed Advertising State
            and Connection State (Peripheral Role)
            and Peripheral Role & Peripheral Role
          Initiating State
            and Connection State (Peripheral Role)
            and Central Role & Peripheral Role
< HCI Command: LE Read Maximum Data.. (0x08|0x002f) plen 0  #23 [hci1] 0.778467
> HCI Event: Command Complete (0x0e) plen 12                #24 [hci1] 0.779023
      LE Read Maximum Data Length (0x08|0x002f) ncmd 1
        Status: Success (0x00)
        Max TX octets: 251
        Max TX time: 2704
        Max RX octets: 251
        Max RX time: 2704
< HCI Command: LE Write Suggested D.. (0x08|0x0024) plen 4  #25 [hci1] 0.798439
        TX octets: 251
        TX time: 2704
> HCI Event: Command Complete (0x0e) plen 4                 #26 [hci1] 0.798892
      LE Write Suggested Default Data Length (0x08|0x0024) ncmd 1
        Status: Success (0x00)
< HCI Command: LE Read Resolving Li.. (0x08|0x002a) plen 0  #27 [hci1] 0.818426
> HCI Event: Command Complete (0x0e) plen 5                 #28 [hci1] 0.818925
      LE Read Resolving List Size (0x08|0x002a) ncmd 1
        Status: Success (0x00)
        Size: 8
< HCI Command: LE Set Host Feature (0x08|0x0074) plen 2     #29 [hci1] 0.838422
        Bit Number: 38
          Connection Subrating (Host Support)
        Bit Value: 1
> HCI Event: Command Complete (0x0e) plen 4                 #30 [hci1] 0.838832
      LE Set Host Feature (0x08|0x0074) ncmd 1
        Status: Success (0x00)
< HCI Command: LE Set Event Mask (0x08|0x0001) plen 8       #31 [hci1] 0.858463
        Mask: 0x000002063f87fa5e
          LE Advertising Report
          LE Connection Update Complete
          LE Read Remote Used Features Complete
          LE Long Term Key Request
          LE Data Length Change
          LE Enhanced Connection Complete
          LE PHY Update Complete
          LE Extended Advertising Report
          LE Periodic Advertising Sync Established
          LE Periodic Advertising Report
          LE Periodic Advertising Sync Lost
          LE Extended Scan Timeout
          LE Extended Advertising Set Terminated
          LE Scan Request Received
          LE Periodic Advertising Sync Transfer Rvc
          LE CIS Established
          LE CIS Request
          LE Create BIG Complete
          LE Terminate BIG Complete
          LE BIG Sync Estabilished Complete
          LE BIG Sync Lost
          LE BIG Info Advertising Report
          LE Subrate Change
          Unknown mask (0x0000020000000000)
> HCI Event: Command Complete (0x0e) plen 4                 #32 [hci1] 0.858975
      LE Set Event Mask (0x08|0x0001) ncmd 1
        Status: Success (0x00)
< HCI Command: Set Event Mask (0x03|0x0001) plen 8          #33 [hci1] 0.878450
        Mask: 0x2000800002008890
          Disconnection Complete
          Encryption Change
          Read Remote Version Information Complete
          Hardware Error
          Data Buffer Overflow
          Encryption Key Refresh Complete
          LE Meta
> HCI Event: Command Complete (0x0e) plen 4                 #34 [hci1] 0.878993
      Set Event Mask (0x03|0x0001) ncmd 1
        Status: Success (0x00)
< HCI Command: Read BD ADDR (0x04|0x0009) plen 0            #35 [hci1] 0.898465
> HCI Event: Command Complete (0x0e) plen 10                #36 [hci1] 0.898909
      Read BD ADDR (0x04|0x0009) ncmd 1
        Status: Success (0x00)
        Address: 00:00:00:00:00:00 (OUI 00-00-00)
< HCI Command: LE Set Random Address (0x08|0x0005) plen 6   #37 [hci1] 0.918443
        Address: D5:B6:CC:31:DB:3B (Static)
> HCI Event: Command Complete (0x0e) plen 4                 #38 [hci1] 0.918949
      LE Set Random Address (0x08|0x0005) ncmd 1
        Status: Success (0x00)
< HCI Command: LE Set Extended Adv.. (0x08|0x0036) plen 25  #39 [hci1] 3.448521
        Handle: 0x00
        Properties: 0x0010
          Use legacy advertising PDUs: ADV_NONCONN_IND
        Min advertising interval: 20.000 msec (0x0020)
        Max advertising interval: 20.000 msec (0x0020)
        Channel map: 37, 38, 39 (0x07)
        Own address type: Random (0x01)
        Peer address type: Public (0x00)
        Peer address: 00:00:00:00:00:00 (OUI 00-00-00)
        Filter policy: Allow Scan Request from Any, Allow Connect Request from Any (0x00)
        TX power: Host has no preference (0x7f)
        Primary PHY: LE 1M (0x01)
        Secondary max skip: 0x00
        Secondary PHY: LE 1M (0x01)
        SID: 0x00
        Scan request notifications: Disabled (0x00)
> HCI Event: Command Complete (0x0e) plen 5                 #40 [hci1] 3.449261
      LE Set Extended Advertising Parameters (0x08|0x0036) ncmd 1
        Status: Success (0x00)
        TX power (selected): 0 dbm (0x00)
< HCI Command: LE Set Advertising S.. (0x08|0x0035) plen 7  #41 [hci1] 3.458463
        Advertising handle: 0x00
        Advertising random address: 24:34:0C:0D:44:02 (Non-Resolvable)
> HCI Event: Command Complete (0x0e) plen 4                 #42 [hci1] 3.458898
      LE Set Advertising Set Random Address (0x08|0x0035) ncmd 1
        Status: Success (0x00)
< HCI Command: LE Set Random Address (0x08|0x0005) plen 6   #43 [hci1] 3.478368
        Address: 24:71:FD:F8:AC:A2 (Non-Resolvable)
> HCI Event: Command Complete (0x0e) plen 4                 #44 [hci1] 3.478838
      LE Set Random Address (0x08|0x0005) ncmd 1
        Status: Success (0x00)
< HCI Command: LE Set Extended Scan.. (0x08|0x0041) plen 8  #45 [hci1] 3.498494
        Own address type: Random (0x01)
        Filter policy: Accept all advertisement (0x00)
        PHYs: 0x01
        Entry 0: LE 1M
          Type: Passive (0x00)
          Interval: 30.000 msec (0x0030)
          Window: 30.000 msec (0x0030)
> HCI Event: Command Complete (0x0e) plen 4                 #46 [hci1] 3.499068
      LE Set Extended Scan Parameters (0x08|0x0041) ncmd 1
        Status: Success (0x00)
< HCI Command: LE Set Extended Scan.. (0x08|0x0042) plen 6  #47 [hci1] 3.518489
        Extended scan: Enabled (0x01)
        Filter duplicates: Disabled (0x00)
        Duration: 0 msec (0x0000)
        Period: 0.00 sec (0x0000)
> HCI Event: Command Complete (0x0e) plen 4                 #48 [hci1] 3.519031
      LE Set Extended Scan Enable (0x08|0x0042) ncmd 1
        Status: Success (0x00)
< HCI Command: LE Set Advertising S.. (0x08|0x0035) plen 7  #49 [hci1] 3.538647
        Advertising handle: 0x00
        Advertising random address: D5:B6:CC:31:DB:3B (Static)
> HCI Event: Command Complete (0x0e) plen 4                 #50 [hci1] 3.539166
      LE Set Advertising Set Random Address (0x08|0x0035) ncmd 1
        Status: Success (0x00)
< HCI Command: LE Set Extended Adv.. (0x08|0x0036) plen 25  #51 [hci1] 3.558561
        Handle: 0x00
        Properties: 0x0013
          Connectable
          Scannable
          Use legacy advertising PDUs: ADV_IND
        Min advertising interval: 100.000 msec (0x00a0)
        Max advertising interval: 150.000 msec (0x00f0)
        Channel map: 37, 38, 39 (0x07)
        Own address type: Random (0x01)
        Peer address type: Public (0x00)
        Peer address: 00:00:00:00:00:00 (OUI 00-00-00)
        Filter policy: Allow Scan Request from Any, Allow Connect Request from Any (0x00)
        TX power: Host has no preference (0x7f)
        Primary PHY: LE 1M (0x01)
        Secondary max skip: 0x00
        Secondary PHY: LE 1M (0x01)
        SID: 0x00
        Scan request notifications: Disabled (0x00)
> HCI Event: Command Complete (0x0e) plen 5                 #52 [hci1] 3.559384
      LE Set Extended Advertising Parameters (0x08|0x0036) ncmd 1
        Status: Success (0x00)
        TX power (selected): 0 dbm (0x00)
< HCI Command: LE Set Extended Adv.. (0x08|0x0037) plen 33  #53 [hci1] 3.578495
        Handle: 0x00
        Operation: Complete extended advertising data (0x03)
        Fragment preference: Minimize fragmentation (0x01)
        Data length: 0x1d
        Flags: 0x06
          LE General Discoverable Mode
          BR/EDR Not Supported
        16-bit Service UUIDs (complete): 1 entry
          Mesh Provisioning (0x1827)
        Service Data: Mesh Provisioning (0x1827)
          Data: 8c60615c76274be4896ffdec74f9bd260000
> HCI Event: Command Complete (0x0e) plen 4                 #54 [hci1] 3.579339
      LE Set Extended Advertising Data (0x08|0x0037) ncmd 1
        Status: Success (0x00)
< HCI Command: LE Set Extended Sca.. (0x08|0x0038) plen 20  #55 [hci1] 3.598506
        Handle: 0x00
        Operation: Complete scan response data (0x03)
        Fragment preference: Minimize fragmentation (0x01)
        Data length: 0x10
        Unknown EIR field 0x24: 546573746572
        Name (complete): Tester
> HCI Event: Command Complete (0x0e) plen 4                 #56 [hci1] 3.599160
      LE Set Extended Scan Response Data (0x08|0x0038) ncmd 1
        Status: Success (0x00)
< HCI Command: LE Set Extended Adve.. (0x08|0x0039) plen 6  #57 [hci1] 3.618556
        Extended advertising: Enabled (0x01)
        Number of sets: 1 (0x01)
        Entry 0
          Handle: 0x00
          Duration: 60000 ms (0x1770)
          Max ext adv events: 0
> HCI Event: Command Complete (0x0e) plen 4                 #58 [hci1] 3.619111
      LE Set Extended Advertising Enable (0x08|0x0039) ncmd 1
        Status: Success (0x00)
< HCI Command: LE Set Extended Adve.. (0x08|0x0039) plen 6  #59 [hci1] 3.638530
        Extended advertising: Disabled (0x00)
        Number of sets: 1 (0x01)
        Entry 0
          Handle: 0x00
          Duration: 0 ms (0x00)
          Max ext adv events: 0
> HCI Event: Command Complete (0x0e) plen 4                 #60 [hci1] 3.639033
      LE Set Extended Advertising Enable (0x08|0x0039) ncmd 1
        Status: Success (0x00)
< HCI Command: LE Set Advertising S.. (0x08|0x0035) plen 7  #61 [hci1] 3.658476
        Advertising handle: 0x00
        Advertising random address: 27:DD:CA:1B:4A:5C (Non-Resolvable)
> HCI Event: Command Complete (0x0e) plen 4                 #62 [hci1] 3.658999
      LE Set Advertising Set Random Address (0x08|0x0035) ncmd 1
        Status: Success (0x00)
< HCI Command: LE Set Extended Adv.. (0x08|0x0036) plen 25  #63 [hci1] 3.678498
        Handle: 0x00
        Properties: 0x0010
          Use legacy advertising PDUs: ADV_NONCONN_IND
        Min advertising interval: 20.000 msec (0x0020)
        Max advertising interval: 20.000 msec (0x0020)
        Channel map: 37, 38, 39 (0x07)
        Own address type: Random (0x01)
        Peer address type: Public (0x00)
        Peer address: 00:00:00:00:00:00 (OUI 00-00-00)
        Filter policy: Allow Scan Request from Any, Allow Connect Request from Any (0x00)
        TX power: Host has no preference (0x7f)
        Primary PHY: LE 1M (0x01)
        Secondary max skip: 0x00
        Secondary PHY: LE 1M (0x01)
        SID: 0x00
        Scan request notifications: Disabled (0x00)
> HCI Event: Command Complete (0x0e) plen 5                 #64 [hci1] 3.679215
      LE Set Extended Advertising Parameters (0x08|0x0036) ncmd 1
        Status: Success (0x00)
        TX power (selected): 0 dbm (0x00)
< HCI Command: LE Set Extended Adv.. (0x08|0x0037) plen 29  #65 [hci1] 3.698520
        Handle: 0x00
        Operation: Complete extended advertising data (0x03)
        Fragment preference: Minimize fragmentation (0x01)
        Data length: 0x19
        Mesh Beacon: 008c60615c76274be4896ffdec74f9bd260002a30a8708
          Unprovisioned Device Beacon (0x00)
          Device UUID: 8c60615c76274be4896ffdec74f9bd26
          OOB Information: 0x0002
            Electronic / URI
          URI Hash: 0xa30a8708
> HCI Event: Command Complete (0x0e) plen 4                 #66 [hci1] 3.699328
      LE Set Extended Advertising Data (0x08|0x0037) ncmd 1
        Status: Success (0x00)
< HCI Command: LE Set Extended Adve.. (0x08|0x0039) plen 6  #67 [hci1] 3.718499
        Extended advertising: Enabled (0x01)
        Number of sets: 1 (0x01)
        Entry 0
          Handle: 0x00
          Duration: 0 ms (0x00)
          Max ext adv events: 3
> HCI Event: Command Complete (0x0e) plen 4                 #68 [hci1] 3.719050
      LE Set Extended Advertising Enable (0x08|0x0039) ncmd 1
        Status: Success (0x00)
> HCI Event: LE Meta Event (0x3e) plen 50                   #69 [hci1] 3.743585
      LE Extended Advertising Report (0x0d)
        Num reports: 1
        Entry 0
          Event type: 0x0010
            Props: 0x0010
              Use legacy advertising PDUs
            Data status: [0;32mComplete[0m
          Legacy PDU Type: ADV_NONCONN_IND (0x0010)
          Address type: Public (0x00)
          Address: DF:A9:FF:F6:B1:1A (OUI DF-A9-FF)
          Primary PHY: LE 1M
          Secondary PHY: No packets
          SID: no ADI field (0xff)
          TX power: 127 dBm
          RSSI: -25 dBm (0xe7)
          Periodic advertising interval: 0.00 msec (0x0000)
          Direct address type: Reserved (0xff)
          Direct address: 00-00-00-00-00-00
          Data length: 0x18
        17 29 39 d0 a9 72 00 03 8c 60 61 5c 76 27 4b e4  .)9..r...`a\v'K.
        89 6f fd ec 74 f9 bd 26                          .o..t..&        
        Mesh Provisioning: 39d0a97200038c60615c76274be4896ffdec74f9bd26
          Link ID: 0x39d0a972
          Transaction Number: 0
          Provisioning Bearer Control (0x03)
          Link Open (0x00)
          Device UUID: 038c60615c76274be4896ffdec74f9bd
> HCI Event: LE Meta Event (0x3e) plen 6                    #70 [hci1] 3.773131
      LE Advertising Set Terminated (0x12)
        Status: Limit Reached (0x43)
        Handle: 0
        Connection handle: 65535
        Number of completed extended advertising events: 3
< HCI Command: LE Set Extended Adv.. (0x08|0x0037) plen 12  #71 [hci1] 3.778523
        Handle: 0x00
        Operation: Complete extended advertising data (0x03)
        Fragment preference: Minimize fragmentation (0x01)
        Data length: 0x08
        Unknown EIR field 0x24: 546573746572
> HCI Event: Command Complete (0x0e) plen 4                 #72 [hci1] 3.779143
      LE Set Extended Advertising Data (0x08|0x0037) ncmd 1
        Status: Success (0x00)
< HCI Command: LE Set Advertising S.. (0x08|0x0035) plen 7  #73 [hci1] 3.798539
        Advertising handle: 0x00
        Advertising random address: 17:BA:00:7B:09:45 (Non-Resolvable)
> HCI Event: Command Complete (0x0e) plen 4                 #74 [hci1] 3.799014
      LE Set Advertising Set Random Address (0x08|0x0035) ncmd 1
        Status: Success (0x00)
> HCI Event: LE Meta Event (0x3e) plen 50                   #75 [hci1] 3.805240
      LE Extended Advertising Report (0x0d)
        Num reports: 1
        Entry 0
          Event type: 0x0010
            Props: 0x0010
              Use legacy advertising PDUs
            Data status: [0;32mComplete[0m
          Legacy PDU Type: ADV_NONCONN_IND (0x0010)
          Address type: Public (0x00)
          Address: DF:A9:FF:F6:B1:1A (OUI DF-A9-FF)
          Primary PHY: LE 1M
          Secondary PHY: No packets
          SID: no ADI field (0xff)
          TX power: 127 dBm
          RSSI: -25 dBm (0xe7)
          Periodic advertising interval: 0.00 msec (0x0000)
          Direct address type: Reserved (0xff)
          Direct address: 00-00-00-00-00-00
          Data length: 0x18
        17 29 39 d0 a9 72 00 03 8c 60 61 5c 76 27 4b e4  .)9..r...`a\v'K.
        89 6f fd ec 74 f9 bd 26                          .o..t..&        
        Mesh Provisioning: 39d0a97200038c60615c76274be4896ffdec74f9bd26
          Link ID: 0x39d0a972
          Transaction Number: 0
          Provisioning Bearer Control (0x03)
          Link Open (0x00)
          Device UUID: 038c60615c76274be4896ffdec74f9bd
< HCI Command: LE Set Extended Adve.. (0x08|0x0039) plen 6  #76 [hci1] 3.818526
        Extended advertising: Enabled (0x01)
        Number of sets: 1 (0x01)
        Entry 0
          Handle: 0x00
          Duration: 0 ms (0x00)
          Max ext adv events: 3
> HCI Event: Command Complete (0x0e) plen 4                 #77 [hci1] 3.819059
      LE Set Extended Advertising Enable (0x08|0x0039) ncmd 1
        Status: Success (0x00)
> HCI Event: LE Meta Event (0x3e) plen 6                    #78 [hci1] 3.876767
      LE Advertising Set Terminated (0x12)
        Status: Limit Reached (0x43)
        Handle: 0
        Connection handle: 65535
        Number of completed extended advertising events: 3
< HCI Command: LE Set Extended Adv.. (0x08|0x0037) plen 12  #79 [hci1] 3.878561
        Handle: 0x00
        Operation: Complete extended advertising data (0x03)
        Fragment preference: Minimize fragmentation (0x01)
        Data length: 0x08
        Mesh Provisioning: 39d0a9720007
          Link ID: 0x39d0a972
          Transaction Number: 0
          Provisioning Bearer Control (0x03)
          Link Ack (0x01)
> HCI Event: Command Complete (0x0e) plen 4                 #80 [hci1] 3.879142
      LE Set Extended Advertising Data (0x08|0x0037) ncmd 1
        Status: Success (0x00)
< HCI Command: LE Set Advertising S.. (0x08|0x0035) plen 7  #81 [hci1] 3.898510
        Advertising handle: 0x00
        Advertising random address: 3E:52:32:BA:A1:AC (Non-Resolvable)
> HCI Event: Command Complete (0x0e) plen 4                 #82 [hci1] 3.899005
      LE Set Advertising Set Random Address (0x08|0x0035) ncmd 1
        Status: Success (0x00)
< HCI Command: LE Set Extended Adve.. (0x08|0x0039) plen 6  #83 [hci1] 3.918517
        Extended advertising: Enabled (0x01)
        Number of sets: 1 (0x01)
        Entry 0
          Handle: 0x00
          Duration: 0 ms (0x00)
          Max ext adv events: 3
> HCI Event: Command Complete (0x0e) plen 4                 #84 [hci1] 3.919063
      LE Set Extended Advertising Enable (0x08|0x0039) ncmd 1
        Status: Success (0x00)
> HCI Event: LE Meta Event (0x3e) plen 39                   #85 [hci1] 3.952376
      LE Extended Advertising Report (0x0d)
        Num reports: 1
        Entry 0
          Event type: 0x0010
            Props: 0x0010
              Use legacy advertising PDUs
            Data status: [0;32mComplete[0m
          Legacy PDU Type: ADV_NONCONN_IND (0x0010)
          Address type: Public (0x00)
          Address: DF:A9:FF:F6:B1:1A (OUI DF-A9-FF)
          Primary PHY: LE 1M
          Secondary PHY: No packets
          SID: no ADI field (0xff)
          TX power: 127 dBm
          RSSI: -25 dBm (0xe7)
          Periodic advertising interval: 0.00 msec (0x0000)
          Direct address type: Reserved (0xff)
          Direct address: 00-00-00-00-00-00
          Data length: 0x0d
        0c 29 39 d0 a9 72 00 00 00 02 f7 00 02           .)9..r.......   
        Mesh Provisioning: 39d0a97200000002f70002
          Link ID: 0x39d0a972
          Transaction Number: 0
          Transaction Start (0x00)
          SeqN: 0
          TotalLength: 2
          FCS: 0xf7
          Data: 0002
        02                                               .               
> HCI Event: LE Meta Event (0x3e) plen 6                    #86 [hci1] 3.985154
      LE Advertising Set Terminated (0x12)
        Status: Limit Reached (0x43)
        Handle: 0
        Connection handle: 65535
        Number of completed extended advertising events: 3
< HCI Command: LE Set Extended Adv.. (0x08|0x0037) plen 12  #87 [hci1] 4.028508
        Handle: 0x00
        Operation: Complete extended advertising data (0x03)
        Fragment preference: Minimize fragmentation (0x01)
        Data length: 0x08
        Mesh Provisioning: 39d0a9720001
          Link ID: 0x39d0a972
          Transaction Number: 0
          Transaction Acknowledgment (0x01)
> HCI Event: Command Complete (0x0e) plen 4                 #88 [hci1] 4.029156
      LE Set Extended Advertising Data (0x08|0x0037) ncmd 1
        Status: Success (0x00)
< HCI Command: LE Set Advertising S.. (0x08|0x0035) plen 7  #89 [hci1] 4.038540
        Advertising handle: 0x00
        Advertising random address: 39:74:E3:B2:33:9F (Non-Resolvable)
> HCI Event: Command Complete (0x0e) plen 4                 #90 [hci1] 4.039064
      LE Set Advertising Set Random Address (0x08|0x0035) ncmd 1
        Status: Success (0x00)
< HCI Command: LE Set Extended Adve.. (0x08|0x0039) plen 6  #91 [hci1] 4.058513
        Extended advertising: Enabled (0x01)
        Number of sets: 1 (0x01)
        Entry 0
          Handle: 0x00
          Duration: 0 ms (0x00)
          Max ext adv events: 3
> HCI Event: Command Complete (0x0e) plen 4                 #92 [hci1] 4.059111
      LE Set Extended Advertising Enable (0x08|0x0039) ncmd 1
        Status: Success (0x00)
> HCI Event: LE Meta Event (0x3e) plen 6                    #93 [hci1] 4.122832
      LE Advertising Set Terminated (0x12)
        Status: Limit Reached (0x43)
        Handle: 0
        Connection handle: 65535
        Number of completed extended advertising events: 3
< HCI Command: LE Set Extended Adv.. (0x08|0x0037) plen 27  #94 [hci1] 4.198554
        Handle: 0x00
        Operation: Complete extended advertising data (0x03)
        Fragment preference: Minimize fragmentation (0x01)
        Data length: 0x17
        Mesh Provisioning: 39d0a9728000000c6801040003010100000002000c
          Link ID: 0x39d0a972
          Transaction Number: 128
          Transaction Start (0x00)
          SeqN: 0
          TotalLength: 12
          FCS: 0x68
          Data: 01040003010100000002000c
        04 00 03 01 01 00 00 00 02 00 0c                 ...........     
> HCI Event: Command Complete (0x0e) plen 4                 #95 [hci1] 4.199315
      LE Set Extended Advertising Data (0x08|0x0037) ncmd 1
        Status: Success (0x00)
< HCI Command: LE Set Advertising S.. (0x08|0x0035) plen 7  #96 [hci1] 4.218494
        Advertising handle: 0x00
        Advertising random address: 1F:DB:DD:BA:95:2D (Non-Resolvable)
> HCI Event: Command Complete (0x0e) plen 4                 #97 [hci1] 4.218984
      LE Set Advertising Set Random Address (0x08|0x0035) ncmd 1
        Status: Success (0x00)
< HCI Command: LE Set Extended Adve.. (0x08|0x0039) plen 6  #98 [hci1] 4.238554
        Extended advertising: Enabled (0x01)
        Number of sets: 1 (0x01)
        Entry 0
          Handle: 0x00
          Duration: 0 ms (0x00)
          Max ext adv events: 1
> HCI Event: Command Complete (0x0e) plen 4                 #99 [hci1] 4.239024
      LE Set Extended Advertising Enable (0x08|0x0039) ncmd 1
        Status: Success (0x00)
> HCI Event: LE Meta Event (0x3e) plen 6                   #100 [hci1] 4.245717
      LE Advertising Set Terminated (0x12)
        Status: Limit Reached (0x43)
        Handle: 0
        Connection handle: 65535
        Number of completed extended advertising events: 1
> HCI Event: LE Meta Event (0x3e) plen 34                  #101 [hci1] 4.294366
      LE Extended Advertising Report (0x0d)
        Num reports: 1
        Entry 0
          Event type: 0x0010
            Props: 0x0010
              Use legacy advertising PDUs
            Data status: [0;32mComplete[0m
          Legacy PDU Type: ADV_NONCONN_IND (0x0010)
          Address type: Public (0x00)
          Address: DF:A9:FF:F6:B1:1A (OUI DF-A9-FF)
          Primary PHY: LE 1M
          Secondary PHY: No packets
          SID: no ADI field (0xff)
          TX power: 127 dBm
          RSSI: -25 dBm (0xe7)
          Periodic advertising interval: 0.00 msec (0x0000)
          Direct address type: Reserved (0xff)
          Direct address: 00-00-00-00-00-00
          Data length: 0x08
        07 29 39 d0 a9 72 80 01                          .)9..r..        
        Mesh Provisioning: 39d0a9728001
          Link ID: 0x39d0a972
          Transaction Number: 128
          Transaction Acknowledgment (0x01)
> HCI Event: LE Meta Event (0x3e) plen 34                  #102 [hci1] 4.335540
      LE Extended Advertising Report (0x0d)
        Num reports: 1
        Entry 0
          Event type: 0x0010
            Props: 0x0010
              Use legacy advertising PDUs
            Data status: [0;32mComplete[0m
          Legacy PDU Type: ADV_NONCONN_IND (0x0010)
          Address type: Public (0x00)
          Address: DF:A9:FF:F6:B1:1A (OUI DF-A9-FF)
          Primary PHY: LE 1M
          Secondary PHY: No packets
          SID: no ADI field (0xff)
          TX power: 127 dBm
          RSSI: -25 dBm (0xe7)
          Periodic advertising interval: 0.00 msec (0x0000)
          Direct address type: Reserved (0xff)
          Direct address: 00-00-00-00-00-00
          Data length: 0x08
        07 29 39 d0 a9 72 80 01                          .)9..r..        
        Mesh Provisioning: 39d0a9728001
          Link ID: 0x39d0a972
          Transaction Number: 128
          Transaction Acknowledgment (0x01)
> HCI Event: LE Meta Event (0x3e) plen 34                  #103 [hci1] 4.380388
      LE Extended Advertising Report (0x0d)
        Num reports: 1
        Entry 0
          Event type: 0x0010
            Props: 0x0010
              Use legacy advertising PDUs
            Data status: [0;32mComplete[0m
          Legacy PDU Type: ADV_NONCONN_IND (0x0010)
          Address type: Public (0x00)
          Address: DF:A9:FF:F6:B1:1A (OUI DF-A9-FF)
          Primary PHY: LE 1M
          Secondary PHY: No packets
          SID: no ADI field (0xff)
          TX power: 127 dBm
          RSSI: -25 dBm (0xe7)
          Periodic advertising interval: 0.00 msec (0x0000)
          Direct address type: Reserved (0xff)
          Direct address: 00-00-00-00-00-00
          Data length: 0x08
        07 29 39 d0 a9 72 80 01                          .)9..r..        
        Mesh Provisioning: 39d0a9728001
          Link ID: 0x39d0a972
          Transaction Number: 128
          Transaction Acknowledgment (0x01)
> HCI Event: LE Meta Event (0x3e) plen 43                  #104 [hci1] 4.450562
      LE Extended Advertising Report (0x0d)
        Num reports: 1
        Entry 0
          Event type: 0x0010
            Props: 0x0010
              Use legacy advertising PDUs
            Data status: [0;32mComplete[0m
          Legacy PDU Type: ADV_NONCONN_IND (0x0010)
          Address type: Public (0x00)
          Address: DF:A9:FF:F6:B1:1A (OUI DF-A9-FF)
          Primary PHY: LE 1M
          Secondary PHY: No packets
          SID: no ADI field (0xff)
          TX power: 127 dBm
          RSSI: -25 dBm (0xe7)
          Periodic advertising interval: 0.00 msec (0x0000)
          Direct address type: Reserved (0xff)
          Direct address: 00-00-00-00-00-00
          Data length: 0x11
        10 29 39 d0 a9 72 01 00 00 06 38 02 00 01 01 00  .)9..r....8.....
        00                                               .               
        Mesh Provisioning: 39d0a9720100000638020001010000
          Link ID: 0x39d0a972
          Transaction Number: 1
          Transaction Start (0x00)
          SeqN: 0
          TotalLength: 6
          FCS: 0x38
          Data: 020001010000
        00 01 01 00 00                                   .....           
< HCI Command: LE Set Extended Ad.. (0x08|0x0037) plen 12  #105 [hci1] 4.518561
        Handle: 0x00
        Operation: Complete extended advertising data (0x03)
        Fragment preference: Minimize fragmentation (0x01)
        Data length: 0x08
        Mesh Provisioning: 39d0a9720101
          Link ID: 0x39d0a972
          Transaction Number: 1
          Transaction Acknowledgment (0x01)
> HCI Event: Command Complete (0x0e) plen 4                #106 [hci1] 4.519147
      LE Set Extended Advertising Data (0x08|0x0037) ncmd 1
        Status: Success (0x00)
< HCI Command: LE Set Advertising... (0x08|0x0035) plen 7  #107 [hci1] 4.538506
        Advertising handle: 0x00
        Advertising random address: 3E:50:C8:53:43:96 (Non-Resolvable)
> HCI Event: Command Complete (0x0e) plen 4                #108 [hci1] 4.538994
      LE Set Advertising Set Random Address (0x08|0x0035) ncmd 1
        Status: Success (0x00)
< HCI Command: LE Set Extended Adv.. (0x08|0x0039) plen 6  #109 [hci1] 4.558444
        Extended advertising: Enabled (0x01)
        Number of sets: 1 (0x01)
        Entry 0
          Handle: 0x00
          Duration: 0 ms (0x00)
          Max ext adv events: 3
> HCI Event: Command Complete (0x0e) plen 4                #110 [hci1] 4.558968
      LE Set Extended Advertising Enable (0x08|0x0039) ncmd 1
        Status: Success (0x00)
> HCI Event: LE Meta Event (0x3e) plen 57                  #111 [hci1] 4.583159
      LE Extended Advertising Report (0x0d)
        Num reports: 1
        Entry 0
          Event type: 0x0010
            Props: 0x0010
              Use legacy advertising PDUs
            Data status: [0;32mComplete[0m
          Legacy PDU Type: ADV_NONCONN_IND (0x0010)
          Address type: Public (0x00)
          Address: DF:A9:FF:F6:B1:1A (OUI DF-A9-FF)
          Primary PHY: LE 1M
          Secondary PHY: No packets
          SID: no ADI field (0xff)
          TX power: 127 dBm
          RSSI: -24 dBm (0xe8)
          Periodic advertising interval: 0.00 msec (0x0000)
          Direct address type: Reserved (0xff)
          Direct address: 00-00-00-00-00-00
          Data length: 0x1f
        1e 29 39 d0 a9 72 02 08 00 41 9f 03 23 ac 9f 29  .)9..r...A..#..)
        f3 b6 8b 3a 45 07 2a e6 ba 43 3f a2 8f 38 74     ...:E.*..C?..8t 
        Mesh Provisioning: 39d0a972020800419f0323ac9f29f3b68b3a45072ae6ba433fa28f3874
          Link ID: 0x39d0a972
          Transaction Number: 2
          Transaction Start (0x00)
          SeqN: 8
          TotalLength: 65
          FCS: 0x9f
          Data: 0323ac9f29f3b68b3a45072ae6ba433fa28f3874
        23 ac 9f 29 f3 b6 8b 3a 45 07 2a e6 ba 43 3f a2  #..)...:E.*..C?.
        8f 38 74                                         .8t             
> HCI Event: LE Meta Event (0x3e) plen 6                   #112 [hci1] 4.608581
      LE Advertising Set Terminated (0x12)
        Status: Limit Reached (0x43)
        Handle: 0
        Connection handle: 65535
        Number of completed extended advertising events: 3
> HCI Event: LE Meta Event (0x3e) plen 57                  #113 [hci1] 4.632515
      LE Extended Advertising Report (0x0d)
        Num reports: 1
        Entry 0
          Event type: 0x0010
            Props: 0x0010
              Use legacy advertising PDUs
            Data status: [0;32mComplete[0m
          Legacy PDU Type: ADV_NONCONN_IND (0x0010)
          Address type: Public (0x00)
          Address: DF:A9:FF:F6:B1:1A (OUI DF-A9-FF)
          Primary PHY: LE 1M
          Secondary PHY: No packets
          SID: no ADI field (0xff)
          TX power: 127 dBm
          RSSI: -25 dBm (0xe7)
          Periodic advertising interval: 0.00 msec (0x0000)
          Direct address type: Reserved (0xff)
          Direct address: 00-00-00-00-00-00
          Data length: 0x1f
        1e 29 39 d0 a9 72 02 06 a8 33 ac ef 90 5c 6b c1  .)9..r...3...\k.
        52 c1 5e 2a 61 3e 1a 78 d5 36 f9 5b 75 21 89     R.^*a>.x.6.[u!. 
        Mesh Provisioning: 39d0a9720206a833acef905c6bc152c15e2a613e1a78d536f95b752189
          Link ID: 0x39d0a972
          Transaction Number: 2
          Transaction Continuation (0x02)
          SegmentIndex: 1
          Data: a833acef905c6bc152c15e2a613e1a78d536f95b752189
        33 ac ef 90 5c 6b c1 52 c1 5e 2a 61 3e 1a 78 d5  3...\k.R.^*a>.x.
        36 f9 5b 75 21 89                                6.[u!.          
> HCI Event: LE Meta Event (0x3e) plen 56                  #114 [hci1] 4.698985
      LE Extended Advertising Report (0x0d)
        Num reports: 1
        Entry 0
          Event type: 0x0010
            Props: 0x0010
              Use legacy advertising PDUs
            Data status: [0;32mComplete[0m
          Legacy PDU Type: ADV_NONCONN_IND (0x0010)
          Address type: Public (0x00)
          Address: DF:A9:FF:F6:B1:1A (OUI DF-A9-FF)
          Primary PHY: LE 1M
          Secondary PHY: No packets
          SID: no ADI field (0xff)
          TX power: 127 dBm
          RSSI: -25 dBm (0xe7)
          Periodic advertising interval: 0.00 msec (0x0000)
          Direct address type: Reserved (0xff)
          Direct address: 00-00-00-00-00-00
          Data length: 0x1e
        1d 29 39 d0 a9 72 02 0a 10 c4 4c 5e b6 40 75 83  .)9..r....L^.@u.
        17 4f ab 49 07 e3 ac 93 f3 28 74 05 02 61        .O.I.....(t..a  
        Mesh Provisioning: 39d0a972020a10c44c5eb6407583174fab4907e3ac93f32874050261
          Link ID: 0x39d0a972
          Transaction Number: 2
          Transaction Continuation (0x02)
          SegmentIndex: 2
          Data: 10c44c5eb6407583174fab4907e3ac93f32874050261
        c4 4c 5e b6 40 75 83 17 4f ab 49 07 e3 ac 93 f3  .L^.@u..O.I.....
        28 74 05 02 61                                   (t..a           
< HCI Command: LE Set Extended Ad.. (0x08|0x0037) plen 12  #115 [hci1] 4.768465
        Handle: 0x00
        Operation: Complete extended advertising data (0x03)
        Fragment preference: Minimize fragmentation (0x01)
        Data length: 0x08
        Mesh Provisioning: 39d0a9720201
          Link ID: 0x39d0a972
          Transaction Number: 2
          Transaction Acknowledgment (0x01)
> HCI Event: Command Complete (0x0e) plen 4                #116 [hci1] 4.768992
      LE Set Extended Advertising Data (0x08|0x0037) ncmd 1
        Status: Success (0x00)
< HCI Command: LE Set Advertising... (0x08|0x0035) plen 7  #117 [hci1] 4.778501
        Advertising handle: 0x00
        Advertising random address: 3C:B6:96:65:53:15 (Non-Resolvable)
> HCI Event: Command Complete (0x0e) plen 4                #118 [hci1] 4.778994
      LE Set Advertising Set Random Address (0x08|0x0035) ncmd 1
        Status: Success (0x00)
< HCI Command: LE Set Extended Adv.. (0x08|0x0039) plen 6  #119 [hci1] 4.798497
        Extended advertising: Enabled (0x01)
        Number of sets: 1 (0x01)
        Entry 0
          Handle: 0x00
          Duration: 0 ms (0x00)
          Max ext adv events: 3
> HCI Event: Command Complete (0x0e) plen 4                #120 [hci1] 4.799015
      LE Set Extended Advertising Enable (0x08|0x0039) ncmd 1
        Status: Success (0x00)
> HCI Event: LE Meta Event (0x3e) plen 54                  #121 [hci1] 4.830473
      LE Extended Advertising Report (0x0d)
        Num reports: 1
        Entry 0
          Event type: 0x0010
            Props: 0x0010
              Use legacy advertising PDUs
            Data status: [0;32mComplete[0m
          Legacy PDU Type: ADV_NONCONN_IND (0x0010)
          Address type: Public (0x00)
          Address: DF:A9:FF:F6:B1:1A (OUI DF-A9-FF)
          Primary PHY: LE 1M
          Secondary PHY: No packets
          SID: no ADI field (0xff)
          TX power: 127 dBm
          RSSI: -25 dBm (0xe7)
          Periodic advertising interval: 0.00 msec (0x0000)
          Direct address type: Reserved (0xff)
          Direct address: 00-00-00-00-00-00
          Data length: 0x1c
        1b 29 39 d0 a9 72 03 00 00 11 67 05 52 81 ff 74  .)9..r....g.R..t
        71 e3 9f c8 5f a5 50 02 29 1a 60 d9              q..._.P.).`.    
        Mesh Provisioning: 39d0a9720300001167055281ff7471e39fc85fa55002291a60d9
          Link ID: 0x39d0a972
          Transaction Number: 3
          Transaction Start (0x00)
          SeqN: 0
          TotalLength: 17
          FCS: 0x67
          Data: 055281ff7471e39fc85fa55002291a60d9
        52 81 ff 74 71 e3 9f c8 5f a5 50 02 29 1a 60 d9  R..tq..._.P.).`.
> HCI Event: LE Meta Event (0x3e) plen 6                   #122 [hci1] 4.851297
      LE Advertising Set Terminated (0x12)
        Status: Limit Reached (0x43)
        Handle: 0
        Connection handle: 65535
        Number of completed extended advertising events: 3
< HCI Command: LE Set Extended Ad.. (0x08|0x0037) plen 12  #123 [hci1] 4.918552
        Handle: 0x00
        Operation: Complete extended advertising data (0x03)
        Fragment preference: Minimize fragmentation (0x01)
        Data length: 0x08
        Mesh Provisioning: 39d0a9720301
          Link ID: 0x39d0a972
          Transaction Number: 3
          Transaction Acknowledgment (0x01)
> HCI Event: Command Complete (0x0e) plen 4                #124 [hci1] 4.919174
      LE Set Extended Advertising Data (0x08|0x0037) ncmd 1
        Status: Success (0x00)
< HCI Command: LE Set Advertising... (0x08|0x0035) plen 7  #125 [hci1] 4.938492
        Advertising handle: 0x00
        Advertising random address: 21:EB:CF:C3:E1:D5 (Non-Resolvable)
> HCI Event: Command Complete (0x0e) plen 4                #126 [hci1] 4.938991
      LE Set Advertising Set Random Address (0x08|0x0035) ncmd 1
        Status: Success (0x00)
< HCI Command: LE Set Extended Adv.. (0x08|0x0039) plen 6  #127 [hci1] 4.958495
        Extended advertising: Enabled (0x01)
        Number of sets: 1 (0x01)
        Entry 0
          Handle: 0x00
          Duration: 0 ms (0x00)
          Max ext adv events: 3
> HCI Event: Command Complete (0x0e) plen 4                #128 [hci1] 4.958997
      LE Set Extended Advertising Enable (0x08|0x0039) ncmd 1
        Status: Success (0x00)
> HCI Event: LE Meta Event (0x3e) plen 6                   #129 [hci1] 5.022007
      LE Advertising Set Terminated (0x12)
        Status: Limit Reached (0x43)
        Handle: 0
        Connection handle: 65535
        Number of completed extended advertising events: 3
< HCI Command: LE Set Extended Ad.. (0x08|0x0037) plen 32  #130 [hci1] 5.078533
        Handle: 0x00
        Operation: Complete extended advertising data (0x03)
        Fragment preference: Minimize fragmentation (0x01)
        Data length: 0x1c
        Mesh Provisioning: 39d0a972810000119205b0fc9440400011d97b92ccad8c92b741
          Link ID: 0x39d0a972
          Transaction Number: 129
          Transaction Start (0x00)
          SeqN: 0
          TotalLength: 17
          FCS: 0x92
          Data: 05b0fc9440400011d97b92ccad8c92b741
        b0 fc 94 40 40 00 11 d9 7b 92 cc ad 8c 92 b7 41  ...@@...{......A
> HCI Event: Command Complete (0x0e) plen 4                #131 [hci1] 5.079370
      LE Set Extended Advertising Data (0x08|0x0037) ncmd 1
        Status: Success (0x00)
< HCI Command: LE Set Advertising... (0x08|0x0035) plen 7  #132 [hci1] 5.098417
        Advertising handle: 0x00
        Advertising random address: 09:C9:99:DF:2C:31 (Non-Resolvable)
> HCI Event: Command Complete (0x0e) plen 4                #133 [hci1] 5.098930
      LE Set Advertising Set Random Address (0x08|0x0035) ncmd 1
        Status: Success (0x00)
< HCI Command: LE Set Extended Adv.. (0x08|0x0039) plen 6  #134 [hci1] 5.118483
        Extended advertising: Enabled (0x01)
        Number of sets: 1 (0x01)
        Entry 0
          Handle: 0x00
          Duration: 0 ms (0x00)
          Max ext adv events: 1
> HCI Event: Command Complete (0x0e) plen 4                #135 [hci1] 5.119023
      LE Set Extended Advertising Enable (0x08|0x0039) ncmd 1
        Status: Success (0x00)
> HCI Event: LE Meta Event (0x3e) plen 6                   #136 [hci1] 5.129460
      LE Advertising Set Terminated (0x12)
        Status: Limit Reached (0x43)
        Handle: 0
        Connection handle: 65535
        Number of completed extended advertising events: 1
> HCI Event: LE Meta Event (0x3e) plen 34                  #137 [hci1] 5.205607
      LE Extended Advertising Report (0x0d)
        Num reports: 1
        Entry 0
          Event type: 0x0010
            Props: 0x0010
              Use legacy advertising PDUs
            Data status: [0;32mComplete[0m
          Legacy PDU Type: ADV_NONCONN_IND (0x0010)
          Address type: Public (0x00)
          Address: DF:A9:FF:F6:B1:1A (OUI DF-A9-FF)
          Primary PHY: LE 1M
          Secondary PHY: No packets
          SID: no ADI field (0xff)
          TX power: 127 dBm
          RSSI: -35 dBm (0xdd)
          Periodic advertising interval: 0.00 msec (0x0000)
          Direct address type: Reserved (0xff)
          Direct address: 00-00-00-00-00-00
          Data length: 0x08
        07 29 39 d0 a9 72 81 01                          .)9..r..        
        Mesh Provisioning: 39d0a9728101
          Link ID: 0x39d0a972
          Transaction Number: 129
          Transaction Acknowledgment (0x01)
> HCI Event: LE Meta Event (0x3e) plen 34                  #138 [hci1] 5.282474
      LE Extended Advertising Report (0x0d)
        Num reports: 1
        Entry 0
          Event type: 0x0010
            Props: 0x0010
              Use legacy advertising PDUs
            Data status: [0;32mComplete[0m
          Legacy PDU Type: ADV_NONCONN_IND (0x0010)
          Address type: Public (0x00)
          Address: DF:A9:FF:F6:B1:1A (OUI DF-A9-FF)
          Primary PHY: LE 1M
          Secondary PHY: No packets
          SID: no ADI field (0xff)
          TX power: 127 dBm
          RSSI: -24 dBm (0xe8)
          Periodic advertising interval: 0.00 msec (0x0000)
          Direct address type: Reserved (0xff)
          Direct address: 00-00-00-00-00-00
          Data length: 0x08
        07 29 39 d0 a9 72 81 01                          .)9..r..        
        Mesh Provisioning: 39d0a9728101
          Link ID: 0x39d0a972
          Transaction Number: 129
          Transaction Acknowledgment (0x01)
> HCI Event: LE Meta Event (0x3e) plen 54                  #139 [hci1] 5.343933
      LE Extended Advertising Report (0x0d)
        Num reports: 1
        Entry 0
          Event type: 0x0010
            Props: 0x0010
              Use legacy advertising PDUs
            Data status: [0;32mComplete[0m
          Legacy PDU Type: ADV_NONCONN_IND (0x0010)
          Address type: Public (0x00)
          Address: DF:A9:FF:F6:B1:1A (OUI DF-A9-FF)
          Primary PHY: LE 1M
          Secondary PHY: No packets
          SID: no ADI field (0xff)
          TX power: 127 dBm
          RSSI: -25 dBm (0xe7)
          Periodic advertising interval: 0.00 msec (0x0000)
          Direct address type: Reserved (0xff)
          Direct address: 00-00-00-00-00-00
          Data length: 0x1c
        1b 29 39 d0 a9 72 04 00 00 11 bd 06 6b c8 44 64  .)9..r......k.Dd
        fe 4e 01 88 10 fa 5a f8 98 48 e1 87              .N....Z..H..    
        Mesh Provisioning: 39d0a97204000011bd066bc84464fe4e018810fa5af89848e187
          Link ID: 0x39d0a972
          Transaction Number: 4
          Transaction Start (0x00)
          SeqN: 0
          TotalLength: 17
          FCS: 0xbd
          Data: 066bc84464fe4e018810fa5af89848e187
        6b c8 44 64 fe 4e 01 88 10 fa 5a f8 98 48 e1 87  k.Dd.N....Z..H..
< HCI Command: LE Set Extended Ad.. (0x08|0x0037) plen 12  #140 [hci1] 5.398763
        Handle: 0x00
        Operation: Complete extended advertising data (0x03)
        Fragment preference: Minimize fragmentation (0x01)
        Data length: 0x08
        Mesh Provisioning: 39d0a9720401
          Link ID: 0x39d0a972
          Transaction Number: 4
          Transaction Acknowledgment (0x01)
> HCI Event: Command Complete (0x0e) plen 4                #141 [hci1] 5.399402
      LE Set Extended Advertising Data (0x08|0x0037) ncmd 1
        Status: Success (0x00)
< HCI Command: LE Set Advertising... (0x08|0x0035) plen 7  #142 [hci1] 5.418559
        Advertising handle: 0x00
        Advertising random address: 18:87:A9:A3:29:C6 (Non-Resolvable)
> HCI Event: Command Complete (0x0e) plen 4                #143 [hci1] 5.419093
      LE Set Advertising Set Random Address (0x08|0x0035) ncmd 1
        Status: Success (0x00)
< HCI Command: LE Set Extended Adv.. (0x08|0x0039) plen 6  #144 [hci1] 5.438501
        Extended advertising: Enabled (0x01)
        Number of sets: 1 (0x01)
        Entry 0
          Handle: 0x00
          Duration: 0 ms (0x00)
          Max ext adv events: 3
> HCI Event: Command Complete (0x0e) plen 4                #145 [hci1] 5.439034
      LE Set Extended Advertising Enable (0x08|0x0039) ncmd 1
        Status: Success (0x00)
> HCI Event: LE Meta Event (0x3e) plen 6                   #146 [hci1] 5.488171
      LE Advertising Set Terminated (0x12)
        Status: Limit Reached (0x43)
        Handle: 0
        Connection handle: 65535
        Number of completed extended advertising events: 3
< HCI Command: LE Set Extended Ad.. (0x08|0x0037) plen 32  #147 [hci1] 5.528489
        Handle: 0x00
        Operation: Complete extended advertising data (0x03)
        Fragment preference: Minimize fragmentation (0x01)
        Data length: 0x1c
        Mesh Provisioning: 39d0a9728200001160063db1c86b2b19701bcf5c794dc9ad9f2c
          Link ID: 0x39d0a972
          Transaction Number: 130
          Transaction Start (0x00)
          SeqN: 0
          TotalLength: 17
          FCS: 0x60
          Data: 063db1c86b2b19701bcf5c794dc9ad9f2c
        3d b1 c8 6b 2b 19 70 1b cf 5c 79 4d c9 ad 9f 2c  =..k+.p..\yM...,
> HCI Event: Command Complete (0x0e) plen 4                #148 [hci1] 5.529346
      LE Set Extended Advertising Data (0x08|0x0037) ncmd 1
        Status: Success (0x00)
< HCI Command: LE Set Advertising... (0x08|0x0035) plen 7  #149 [hci1] 5.538465
        Advertising handle: 0x00
        Advertising random address: 11:FC:8D:55:5D:65 (Non-Resolvable)
> HCI Event: Command Complete (0x0e) plen 4                #150 [hci1] 5.538960
      LE Set Advertising Set Random Address (0x08|0x0035) ncmd 1
        Status: Success (0x00)
< HCI Command: LE Set Extended Adv.. (0x08|0x0039) plen 6  #151 [hci1] 5.558540
        Extended advertising: Enabled (0x01)
        Number of sets: 1 (0x01)
        Entry 0
          Handle: 0x00
          Duration: 0 ms (0x00)
          Max ext adv events: 1
> HCI Event: Command Complete (0x0e) plen 4                #152 [hci1] 5.559054
      LE Set Extended Advertising Enable (0x08|0x0039) ncmd 1
        Status: Success (0x00)
> HCI Event: LE Meta Event (0x3e) plen 6                   #153 [hci1] 5.568355
      LE Advertising Set Terminated (0x12)
        Status: Limit Reached (0x43)
        Handle: 0
        Connection handle: 65535
        Number of completed extended advertising events: 1
> HCI Event: LE Meta Event (0x3e) plen 34                  #154 [hci1] 5.641738
      LE Extended Advertising Report (0x0d)
        Num reports: 1
        Entry 0
          Event type: 0x0010
            Props: 0x0010
              Use legacy advertising PDUs
            Data status: [0;32mComplete[0m
          Legacy PDU Type: ADV_NONCONN_IND (0x0010)
          Address type: Public (0x00)
          Address: DF:A9:FF:F6:B1:1A (OUI DF-A9-FF)
          Primary PHY: LE 1M
          Secondary PHY: No packets
          SID: no ADI field (0xff)
          TX power: 127 dBm
          RSSI: -25 dBm (0xe7)
          Periodic advertising interval: 0.00 msec (0x0000)
          Direct address type: Reserved (0xff)
          Direct address: 00-00-00-00-00-00
          Data length: 0x08
        07 29 39 d0 a9 72 82 01                          .)9..r..        
        Mesh Provisioning: 39d0a9728201
          Link ID: 0x39d0a972
          Transaction Number: 130
          Transaction Acknowledgment (0x01)
> HCI Event: LE Meta Event (0x3e) plen 34                  #155 [hci1] 5.694431
      LE Extended Advertising Report (0x0d)
        Num reports: 1
        Entry 0
          Event type: 0x0010
            Props: 0x0010
              Use legacy advertising PDUs
            Data status: [0;32mComplete[0m
          Legacy PDU Type: ADV_NONCONN_IND (0x0010)
          Address type: Public (0x00)
          Address: DF:A9:FF:F6:B1:1A (OUI DF-A9-FF)
          Primary PHY: LE 1M
          Secondary PHY: No packets
          SID: no ADI field (0xff)
          TX power: 127 dBm
          RSSI: -25 dBm (0xe7)
          Periodic advertising interval: 0.00 msec (0x0000)
          Direct address type: Reserved (0xff)
          Direct address: 00-00-00-00-00-00
          Data length: 0x08
        07 29 39 d0 a9 72 82 01                          .)9..r..        
        Mesh Provisioning: 39d0a9728201
          Link ID: 0x39d0a972
          Transaction Number: 130
          Transaction Acknowledgment (0x01)
> HCI Event: LE Meta Event (0x3e) plen 34                  #156 [hci1] 5.737470
      LE Extended Advertising Report (0x0d)
        Num reports: 1
        Entry 0
          Event type: 0x0010
            Props: 0x0010
              Use legacy advertising PDUs
            Data status: [0;32mComplete[0m
          Legacy PDU Type: ADV_NONCONN_IND (0x0010)
          Address type: Public (0x00)
          Address: DF:A9:FF:F6:B1:1A (OUI DF-A9-FF)
          Primary PHY: LE 1M
          Secondary PHY: No packets
          SID: no ADI field (0xff)
          TX power: 127 dBm
          RSSI: -25 dBm (0xe7)
          Periodic advertising interval: 0.00 msec (0x0000)
          Direct address type: Reserved (0xff)
          Direct address: 00-00-00-00-00-00
          Data length: 0x08
        07 29 39 d0 a9 72 82 01                          .)9..r..        
        Mesh Provisioning: 39d0a9728201
          Link ID: 0x39d0a972
          Transaction Number: 130
          Transaction Acknowledgment (0x01)
> HCI Event: LE Meta Event (0x3e) plen 57                  #157 [hci1] 5.796395
      LE Extended Advertising Report (0x0d)
        Num reports: 1
        Entry 0
          Event type: 0x0010
            Props: 0x0010
              Use legacy advertising PDUs
            Data status: [0;32mComplete[0m
          Legacy PDU Type: ADV_NONCONN_IND (0x0010)
          Address type: Public (0x00)
          Address: DF:A9:FF:F6:B1:1A (OUI DF-A9-FF)
          Primary PHY: LE 1M
          Secondary PHY: No packets
          SID: no ADI field (0xff)
          TX power: 127 dBm
          RSSI: -25 dBm (0xe7)
          Periodic advertising interval: 0.00 msec (0x0000)
          Direct address type: Reserved (0xff)
          Direct address: 00-00-00-00-00-00
          Data length: 0x1f
        1e 29 39 d0 a9 72 05 04 00 22 66 07 ee fd 66 b2  .)9..r..."f...f.
        b5 cd d8 20 3c 6a 18 bf 56 e1 63 64 fe c3 b1     ... <j..V.cd... 
        Mesh Provisioning: 39d0a972050400226607eefd66b2b5cdd8203c6a18bf56e16364fec3b1
          Link ID: 0x39d0a972
          Transaction Number: 5
          Transaction Start (0x00)
          SeqN: 4
          TotalLength: 34
          FCS: 0x66
          Data: 07eefd66b2b5cdd8203c6a18bf56e16364fec3b1
        ee fd 66 b2 b5 cd d8 20 3c 6a 18 bf 56 e1 63 64  ..f.... <j..V.cd
        fe c3 b1                                         ...             
> HCI Event: LE Meta Event (0x3e) plen 48                  #158 [hci1] 5.847056
      LE Extended Advertising Report (0x0d)
        Num reports: 1
        Entry 0
          Event type: 0x0010
            Props: 0x0010
              Use legacy advertising PDUs
            Data status: [0;32mComplete[0m
          Legacy PDU Type: ADV_NONCONN_IND (0x0010)
          Address type: Public (0x00)
          Address: DF:A9:FF:F6:B1:1A (OUI DF-A9-FF)
          Primary PHY: LE 1M
          Secondary PHY: No packets
          SID: no ADI field (0xff)
          TX power: 127 dBm
          RSSI: -35 dBm (0xdd)
          Periodic advertising interval: 0.00 msec (0x0000)
          Direct address type: Reserved (0xff)
          Direct address: 00-00-00-00-00-00
          Data length: 0x16
        15 29 39 d0 a9 72 05 06 e6 35 37 03 d6 53 32 68  .)9..r...57..S2h
        61 ac 8c 6e 4a e0                                a..nJ.          
        Mesh Provisioning: 39d0a9720506e6353703d653326861ac8c6e4ae0
          Link ID: 0x39d0a972
          Transaction Number: 5
          Transaction Continuation (0x02)
          SegmentIndex: 1
          Data: e6353703d653326861ac8c6e4ae0
        35 37 03 d6 53 32 68 61 ac 8c 6e 4a e0           57..S2ha..nJ.   
< HCI Command: LE Set Advertising... (0x08|0x0035) plen 7  #159 [hci1] 5.859957
        Advertising handle: 0x00
        Advertising random address: D5:B6:CC:31:DB:3B (Static)
> HCI Event: Command Complete (0x0e) plen 4                #160 [hci1] 5.860442
      LE Set Advertising Set Random Address (0x08|0x0035) ncmd 1
        Status: Success (0x00)
< HCI Command: LE Set Extended Ad.. (0x08|0x0036) plen 25  #161 [hci1] 5.878744
        Handle: 0x00
        Properties: 0x0013
          Connectable
          Scannable
          Use legacy advertising PDUs: ADV_IND
        Min advertising interval: 1000.000 msec (0x0640)
        Max advertising interval: 1200.000 msec (0x0780)
        Channel map: 37, 38, 39 (0x07)
        Own address type: Random (0x01)
        Peer address type: Public (0x00)
        Peer address: 00:00:00:00:00:00 (OUI 00-00-00)
        Filter policy: Allow Scan Request from Any, Allow Connect Request from Any (0x00)
        TX power: Host has no preference (0x7f)
        Primary PHY: LE 1M (0x01)
        Secondary max skip: 0x00
        Secondary PHY: LE 1M (0x01)
        SID: 0x00
        Scan request notifications: Disabled (0x00)
> HCI Event: Command Complete (0x0e) plen 5                #162 [hci1] 5.879509
      LE Set Extended Advertising Parameters (0x08|0x0036) ncmd 1
        Status: Success (0x00)
        TX power (selected): 0 dbm (0x00)
< HCI Command: LE Set Extended Ad.. (0x08|0x0037) plen 24  #163 [hci1] 5.898625
        Handle: 0x00
        Operation: Complete extended advertising data (0x03)
        Fragment preference: Minimize fragmentation (0x01)
        Data length: 0x14
        Flags: 0x06
          LE General Discoverable Mode
          BR/EDR Not Supported
        16-bit Service UUIDs (complete): 1 entry
          Mesh Proxy (0x1828)
        Service Data: Mesh Proxy (0x1828)
          Data: 0075d043f7e5c3178c
> HCI Event: Command Complete (0x0e) plen 4                #164 [hci1] 5.899328
      LE Set Extended Advertising Data (0x08|0x0037) ncmd 1
        Status: Success (0x00)
< HCI Command: LE Set Extended Sca.. (0x08|0x0038) plen 4  #165 [hci1] 5.918656
        Handle: 0x00
        Operation: Complete scan response data (0x03)
        Fragment preference: Minimize fragmentation (0x01)
        Data length: 0x00
> HCI Event: Command Complete (0x0e) plen 4                #166 [hci1] 5.919064
      LE Set Extended Scan Response Data (0x08|0x0038) ncmd 1
        Status: Success (0x00)
< HCI Command: LE Set Extended Adv.. (0x08|0x0039) plen 6  #167 [hci1] 5.938531
        Extended advertising: Enabled (0x01)
        Number of sets: 1 (0x01)
        Entry 0
          Handle: 0x00
          Duration: 0 ms (0x00)
          Max ext adv events: 0
> HCI Event: Command Complete (0x0e) plen 4                #168 [hci1] 5.939133
      LE Set Extended Advertising Enable (0x08|0x0039) ncmd 1
        Status: Success (0x00)
< HCI Command: LE Set Extended Adv.. (0x08|0x0039) plen 6  #169 [hci1] 5.958522
        Extended advertising: Disabled (0x00)
        Number of sets: 1 (0x01)
        Entry 0
          Handle: 0x00
          Duration: 0 ms (0x00)
          Max ext adv events: 0
> HCI Event: Command Complete (0x0e) plen 4                #170 [hci1] 5.959042
      LE Set Extended Advertising Enable (0x08|0x0039) ncmd 1
        Status: Success (0x00)
< HCI Command: LE Set Advertising... (0x08|0x0035) plen 7  #171 [hci1] 5.978483
        Advertising handle: 0x00
        Advertising random address: 16:7F:2C:43:24:37 (Non-Resolvable)
> HCI Event: Command Complete (0x0e) plen 4                #172 [hci1] 5.979051
      LE Set Advertising Set Random Address (0x08|0x0035) ncmd 1
        Status: Success (0x00)
< HCI Command: LE Set Extended Ad.. (0x08|0x0036) plen 25  #173 [hci1] 5.998542
        Handle: 0x00
        Properties: 0x0010
          Use legacy advertising PDUs: ADV_NONCONN_IND
        Min advertising interval: 20.000 msec (0x0020)
        Max advertising interval: 20.000 msec (0x0020)
        Channel map: 37, 38, 39 (0x07)
        Own address type: Random (0x01)
        Peer address type: Public (0x00)
        Peer address: 00:00:00:00:00:00 (OUI 00-00-00)
        Filter policy: Allow Scan Request from Any, Allow Connect Request from Any (0x00)
        TX power: Host has no preference (0x7f)
        Primary PHY: LE 1M (0x01)
        Secondary max skip: 0x00
        Secondary PHY: LE 1M (0x01)
        SID: 0x00
        Scan request notifications: Disabled (0x00)
> HCI Event: Command Complete (0x0e) plen 5                #174 [hci1] 5.999350
      LE Set Extended Advertising Parameters (0x08|0x0036) ncmd 1
        Status: Success (0x00)
        TX power (selected): 0 dbm (0x00)
< HCI Command: LE Set Extended Ad.. (0x08|0x0037) plen 12  #175 [hci1] 6.018540
        Handle: 0x00
        Operation: Complete extended advertising data (0x03)
        Fragment preference: Minimize fragmentation (0x01)
        Data length: 0x08
        Mesh Provisioning: 39d0a9720501
          Link ID: 0x39d0a972
          Transaction Number: 5
          Transaction Acknowledgment (0x01)
> HCI Event: Command Complete (0x0e) plen 4                #176 [hci1] 6.019195
      LE Set Extended Advertising Data (0x08|0x0037) ncmd 1
        Status: Success (0x00)
< HCI Command: LE Set Extended Adv.. (0x08|0x0039) plen 6  #177 [hci1] 6.038560
        Extended advertising: Enabled (0x01)
        Number of sets: 1 (0x01)
        Entry 0
          Handle: 0x00
          Duration: 0 ms (0x00)
          Max ext adv events: 3
> HCI Event: Command Complete (0x0e) plen 4                #178 [hci1] 6.038996
      LE Set Extended Advertising Enable (0x08|0x0039) ncmd 1
        Status: Success (0x00)
> HCI Event: LE Meta Event (0x3e) plen 6                   #179 [hci1] 6.093790
      LE Advertising Set Terminated (0x12)
        Status: Limit Reached (0x43)
        Handle: 0
        Connection handle: 65535
        Number of completed extended advertising events: 3
< HCI Command: LE Set Advertising... (0x08|0x0035) plen 7  #180 [hci1] 6.098525
        Advertising handle: 0x00
        Advertising random address: D5:B6:CC:31:DB:3B (Static)
> HCI Event: Command Complete (0x0e) plen 4                #181 [hci1] 6.099052
      LE Set Advertising Set Random Address (0x08|0x0035) ncmd 1
        Status: Success (0x00)
< HCI Command: LE Set Extended Ad.. (0x08|0x0036) plen 25  #182 [hci1] 6.118492
        Handle: 0x00
        Properties: 0x0013
          Connectable
          Scannable
          Use legacy advertising PDUs: ADV_IND
        Min advertising interval: 1000.000 msec (0x0640)
        Max advertising interval: 1200.000 msec (0x0780)
        Channel map: 37, 38, 39 (0x07)
        Own address type: Random (0x01)
        Peer address type: Public (0x00)
        Peer address: 00:00:00:00:00:00 (OUI 00-00-00)
        Filter policy: Allow Scan Request from Any, Allow Connect Request from Any (0x00)
        TX power: Host has no preference (0x7f)
        Primary PHY: LE 1M (0x01)
        Secondary max skip: 0x00
        Secondary PHY: LE 1M (0x01)
        SID: 0x00
        Scan request notifications: Disabled (0x00)
> HCI Event: Command Complete (0x0e) plen 5                #183 [hci1] 6.119209
      LE Set Extended Advertising Parameters (0x08|0x0036) ncmd 1
        Status: Success (0x00)
        TX power (selected): 0 dbm (0x00)
< HCI Command: LE Set Extended Ad.. (0x08|0x0037) plen 24  #184 [hci1] 6.138505
        Handle: 0x00
        Operation: Complete extended advertising data (0x03)
        Fragment preference: Minimize fragmentation (0x01)
        Data length: 0x14
        Flags: 0x06
          LE General Discoverable Mode
          BR/EDR Not Supported
        16-bit Service UUIDs (complete): 1 entry
          Mesh Proxy (0x1828)
        Service Data: Mesh Proxy (0x1828)
          Data: 0075d043f7e5c3178c
> HCI Event: Command Complete (0x0e) plen 4                #185 [hci1] 6.139187
      LE Set Extended Advertising Data (0x08|0x0037) ncmd 1
        Status: Success (0x00)
< HCI Command: LE Set Extended Sca.. (0x08|0x0038) plen 4  #186 [hci1] 6.158576
        Handle: 0x00
        Operation: Complete scan response data (0x03)
        Fragment preference: Minimize fragmentation (0x01)
        Data length: 0x00
> HCI Event: Command Complete (0x0e) plen 4                #187 [hci1] 6.158984
      LE Set Extended Scan Response Data (0x08|0x0038) ncmd 1
        Status: Success (0x00)
< HCI Command: LE Set Extended Adv.. (0x08|0x0039) plen 6  #188 [hci1] 6.178514
        Extended advertising: Enabled (0x01)
        Number of sets: 1 (0x01)
        Entry 0
          Handle: 0x00
          Duration: 0 ms (0x00)
          Max ext adv events: 0
> HCI Event: Command Complete (0x0e) plen 4                #189 [hci1] 6.179028
      LE Set Extended Advertising Enable (0x08|0x0039) ncmd 1
        Status: Success (0x00)
< HCI Command: LE Set Extended Adv.. (0x08|0x0039) plen 6  #190 [hci1] 6.198541
        Extended advertising: Disabled (0x00)
        Number of sets: 1 (0x01)
        Entry 0
          Handle: 0x00
          Duration: 0 ms (0x00)
          Max ext adv events: 0
> HCI Event: Command Complete (0x0e) plen 4                #191 [hci1] 6.199008
      LE Set Extended Advertising Enable (0x08|0x0039) ncmd 1
        Status: Success (0x00)
< HCI Command: LE Set Advertising... (0x08|0x0035) plen 7  #192 [hci1] 6.218513
        Advertising handle: 0x00
        Advertising random address: 32:AC:23:41:74:FF (Non-Resolvable)
> HCI Event: Command Complete (0x0e) plen 4                #193 [hci1] 6.219037
      LE Set Advertising Set Random Address (0x08|0x0035) ncmd 1
        Status: Success (0x00)
< HCI Command: LE Set Extended Ad.. (0x08|0x0036) plen 25  #194 [hci1] 6.238530
        Handle: 0x00
        Properties: 0x0010
          Use legacy advertising PDUs: ADV_NONCONN_IND
        Min advertising interval: 20.000 msec (0x0020)
        Max advertising interval: 20.000 msec (0x0020)
        Channel map: 37, 38, 39 (0x07)
        Own address type: Random (0x01)
        Peer address type: Public (0x00)
        Peer address: 00:00:00:00:00:00 (OUI 00-00-00)
        Filter policy: Allow Scan Request from Any, Allow Connect Request from Any (0x00)
        TX power: Host has no preference (0x7f)
        Primary PHY: LE 1M (0x01)
        Secondary max skip: 0x00
        Secondary PHY: LE 1M (0x01)
        SID: 0x00
        Scan request notifications: Disabled (0x00)
> HCI Event: Command Complete (0x0e) plen 5                #195 [hci1] 6.239214
      LE Set Extended Advertising Parameters (0x08|0x0036) ncmd 1
        Status: Success (0x00)
        TX power (selected): 0 dbm (0x00)
< HCI Command: LE Set Extended Ad.. (0x08|0x0037) plen 16  #196 [hci1] 6.258489
        Handle: 0x00
        Operation: Complete extended advertising data (0x03)
        Fragment preference: Minimize fragmentation (0x01)
        Data length: 0x0c
        Mesh Provisioning: 39d0a972830000013e08
          Link ID: 0x39d0a972
          Transaction Number: 131
          Transaction Start (0x00)
          SeqN: 0
          TotalLength: 1
          FCS: 0x3e
          Data: 08
> HCI Event: Command Complete (0x0e) plen 4                #197 [hci1] 6.259139
      LE Set Extended Advertising Data (0x08|0x0037) ncmd 1
        Status: Success (0x00)
< HCI Command: LE Set Extended Adv.. (0x08|0x0039) plen 6  #198 [hci1] 6.278454
        Extended advertising: Enabled (0x01)
        Number of sets: 1 (0x01)
        Entry 0
          Handle: 0x00
          Duration: 0 ms (0x00)
          Max ext adv events: 1
> HCI Event: Command Complete (0x0e) plen 4                #199 [hci1] 6.278969
      LE Set Extended Advertising Enable (0x08|0x0039) ncmd 1
        Status: Success (0x00)
> HCI Event: LE Meta Event (0x3e) plen 6                   #200 [hci1] 6.287164
      LE Advertising Set Terminated (0x12)
        Status: Limit Reached (0x43)
        Handle: 0
        Connection handle: 65535
        Number of completed extended advertising events: 1
< HCI Command: LE Set Advertising... (0x08|0x0035) plen 7  #201 [hci1] 6.298747
        Advertising handle: 0x00
        Advertising random address: D5:B6:CC:31:DB:3B (Static)
> HCI Event: Command Complete (0x0e) plen 4                #202 [hci1] 6.299357
      LE Set Advertising Set Random Address (0x08|0x0035) ncmd 1
        Status: Success (0x00)
< HCI Command: LE Set Extended Ad.. (0x08|0x0036) plen 25  #203 [hci1] 6.318610
        Handle: 0x00
        Properties: 0x0013
          Connectable
          Scannable
          Use legacy advertising PDUs: ADV_IND
        Min advertising interval: 1000.000 msec (0x0640)
        Max advertising interval: 1200.000 msec (0x0780)
        Channel map: 37, 38, 39 (0x07)
        Own address type: Random (0x01)
        Peer address type: Public (0x00)
        Peer address: 00:00:00:00:00:00 (OUI 00-00-00)
        Filter policy: Allow Scan Request from Any, Allow Connect Request from Any (0x00)
        TX power: Host has no preference (0x7f)
        Primary PHY: LE 1M (0x01)
        Secondary max skip: 0x00
        Secondary PHY: LE 1M (0x01)
        SID: 0x00
        Scan request notifications: Disabled (0x00)
> HCI Event: Command Complete (0x0e) plen 5                #204 [hci1] 6.319446
      LE Set Extended Advertising Parameters (0x08|0x0036) ncmd 1
        Status: Success (0x00)
        TX power (selected): 0 dbm (0x00)
< HCI Command: LE Set Extended Ad.. (0x08|0x0037) plen 24  #205 [hci1] 6.338908
        Handle: 0x00
        Operation: Complete extended advertising data (0x03)
        Fragment preference: Minimize fragmentation (0x01)
        Data length: 0x14
        Flags: 0x06
          LE General Discoverable Mode
          BR/EDR Not Supported
        16-bit Service UUIDs (complete): 1 entry
          Mesh Proxy (0x1828)
        Service Data: Mesh Proxy (0x1828)
          Data: 0075d043f7e5c3178c
> HCI Event: LE Meta Event (0x3e) plen 34                  #206 [hci1] 6.339891
      LE Extended Advertising Report (0x0d)
        Num reports: 1
        Entry 0
          Event type: 0x0010
            Props: 0x0010
              Use legacy advertising PDUs
            Data status: [0;32mComplete[0m
          Legacy PDU Type: ADV_NONCONN_IND (0x0010)
          Address type: Public (0x00)
          Address: DF:A9:FF:F6:B1:1A (OUI DF-A9-FF)
          Primary PHY: LE 1M
          Secondary PHY: No packets
          SID: no ADI field (0xff)
          TX power: 127 dBm
          RSSI: -25 dBm (0xe7)
          Periodic advertising interval: 0.00 msec (0x0000)
          Direct address type: Reserved (0xff)
          Direct address: 00-00-00-00-00-00
          Data length: 0x08
        07 29 39 d0 a9 72 83 01                          .)9..r..        
        Mesh Provisioning: 39d0a9728301
          Link ID: 0x39d0a972
          Transaction Number: 131
          Transaction Acknowledgment (0x01)
> HCI Event: Command Complete (0x0e) plen 4                #207 [hci1] 6.340013
      LE Set Extended Advertising Data (0x08|0x0037) ncmd 1
        Status: Success (0x00)
< HCI Command: LE Set Extended Sca.. (0x08|0x0038) plen 4  #208 [hci1] 6.358977
        Handle: 0x00
        Operation: Complete scan response data (0x03)
        Fragment preference: Minimize fragmentation (0x01)
        Data length: 0x00
> HCI Event: Command Complete (0x0e) plen 4                #209 [hci1] 6.359476
      LE Set Extended Scan Response Data (0x08|0x0038) ncmd 1
        Status: Success (0x00)
> HCI Event: LE Meta Event (0x3e) plen 34                  #210 [hci1] 6.371821
      LE Extended Advertising Report (0x0d)
        Num reports: 1
        Entry 0
          Event type: 0x0010
            Props: 0x0010
              Use legacy advertising PDUs
            Data status: [0;32mComplete[0m
          Legacy PDU Type: ADV_NONCONN_IND (0x0010)
          Address type: Public (0x00)
          Address: DF:A9:FF:F6:B1:1A (OUI DF-A9-FF)
          Primary PHY: LE 1M
          Secondary PHY: No packets
          SID: no ADI field (0xff)
          TX power: 127 dBm
          RSSI: -35 dBm (0xdd)
          Periodic advertising interval: 0.00 msec (0x0000)
          Direct address type: Reserved (0xff)
          Direct address: 00-00-00-00-00-00
          Data length: 0x08
        07 29 39 d0 a9 72 83 01                          .)9..r..        
        Mesh Provisioning: 39d0a9728301
          Link ID: 0x39d0a972
          Transaction Number: 131
          Transaction Acknowledgment (0x01)
< HCI Command: LE Set Extended Adv.. (0x08|0x0039) plen 6  #211 [hci1] 6.378945
        Extended advertising: Enabled (0x01)
        Number of sets: 1 (0x01)
        Entry 0
          Handle: 0x00
          Duration: 0 ms (0x00)
          Max ext adv events: 0
> HCI Event: Command Complete (0x0e) plen 4                #212 [hci1] 6.379573
      LE Set Extended Advertising Enable (0x08|0x0039) ncmd 1
        Status: Success (0x00)
> HCI Event: LE Meta Event (0x3e) plen 34                  #213 [hci1] 6.424421
      LE Extended Advertising Report (0x0d)
        Num reports: 1
        Entry 0
          Event type: 0x0010
            Props: 0x0010
              Use legacy advertising PDUs
            Data status: [0;32mComplete[0m
          Legacy PDU Type: ADV_NONCONN_IND (0x0010)
          Address type: Public (0x00)
          Address: DF:A9:FF:F6:B1:1A (OUI DF-A9-FF)
          Primary PHY: LE 1M
          Secondary PHY: No packets
          SID: no ADI field (0xff)
          TX power: 127 dBm
          RSSI: -25 dBm (0xe7)
          Periodic advertising interval: 0.00 msec (0x0000)
          Direct address type: Reserved (0xff)
          Direct address: 00-00-00-00-00-00
          Data length: 0x08
        07 29 39 d0 a9 72 83 01                          .)9..r..        
        Mesh Provisioning: 39d0a9728301
          Link ID: 0x39d0a972
          Transaction Number: 131
          Transaction Acknowledgment (0x01)
> HCI Event: LE Meta Event (0x3e) plen 35                  #214 [hci1] 7.483533
      LE Extended Advertising Report (0x0d)
        Num reports: 1
        Entry 0
          Event type: 0x0010
            Props: 0x0010
              Use legacy advertising PDUs
            Data status: [0;32mComplete[0m
          Legacy PDU Type: ADV_NONCONN_IND (0x0010)
          Address type: Public (0x00)
          Address: DF:A9:FF:F6:B1:1A (OUI DF-A9-FF)
          Primary PHY: LE 1M
          Secondary PHY: No packets
          SID: no ADI field (0xff)
          TX power: 127 dBm
          RSSI: -25 dBm (0xe7)
          Periodic advertising interval: 0.00 msec (0x0000)
          Direct address type: Reserved (0xff)
          Direct address: 00-00-00-00-00-00
          Data length: 0x09
        08 29 39 d0 a9 72 00 0b 00                       .)9..r...       
        Mesh Provisioning: 39d0a972000b00
          Link ID: 0x39d0a972
          Transaction Number: 0
          Provisioning Bearer Control (0x03)
          Link Close (0x02)
          Reason: Success (0x00)
> HCI Event: LE Meta Event (0x3e) plen 35                  #215 [hci1] 7.523471
      LE Extended Advertising Report (0x0d)
        Num reports: 1
        Entry 0
          Event type: 0x0010
            Props: 0x0010
              Use legacy advertising PDUs
            Data status: [0;32mComplete[0m
          Legacy PDU Type: ADV_NONCONN_IND (0x0010)
          Address type: Public (0x00)
          Address: DF:A9:FF:F6:B1:1A (OUI DF-A9-FF)
          Primary PHY: LE 1M
          Secondary PHY: No packets
          SID: no ADI field (0xff)
          TX power: 127 dBm
          RSSI: -25 dBm (0xe7)
          Periodic advertising interval: 0.00 msec (0x0000)
          Direct address type: Reserved (0xff)
          Direct address: 00-00-00-00-00-00
          Data length: 0x09
        08 29 39 d0 a9 72 00 0b 00                       .)9..r...       
        Mesh Provisioning: 39d0a972000b00
          Link ID: 0x39d0a972
          Transaction Number: 0
          Provisioning Bearer Control (0x03)
          Link Close (0x02)
          Reason: Success (0x00)
> HCI Event: LE Meta Event (0x3e) plen 35                  #216 [hci1] 7.554025
      LE Extended Advertising Report (0x0d)
        Num reports: 1
        Entry 0
          Event type: 0x0010
            Props: 0x0010
              Use legacy advertising PDUs
            Data status: [0;32mComplete[0m
          Legacy PDU Type: ADV_NONCONN_IND (0x0010)
          Address type: Public (0x00)
          Address: DF:A9:FF:F6:B1:1A (OUI DF-A9-FF)
          Primary PHY: LE 1M
          Secondary PHY: No packets
          SID: no ADI field (0xff)
          TX power: 127 dBm
          RSSI: -35 dBm (0xdd)
          Periodic advertising interval: 0.00 msec (0x0000)
          Direct address type: Reserved (0xff)
          Direct address: 00-00-00-00-00-00
          Data length: 0x09
        08 29 39 d0 a9 72 00 0b 00                       .)9..r...       
        Mesh Provisioning: 39d0a972000b00
          Link ID: 0x39d0a972
          Transaction Number: 0
          Provisioning Bearer Control (0x03)
          Link Close (0x02)
          Reason: Success (0x00)
< HCI Command: Reset (0x03|0x0003) plen 0                 #217 [hci1] 14.588554
> HCI Event: Command Complete (0x0e) plen 4               #218 [hci1] 14.590721
      Reset (0x03|0x0003) ncmd 1
        Status: Success (0x00)
@ USER Close: main                                    {0x0001} [hci1] 14.598495
= Close Index: 00:00:00:00:00:00                               [hci1] 14.598502
