Bluetooth monitor ver 5.72
= Note: Linux version 6.14.0-36-generic (x86_64)                       0.422519
= Note: Bluetooth subsystem version 2.22                               0.422521
= New Index: 00:00:00:00:00:00 (Primary,UART,hci1)              [hci1] 0.422522
= New Index: 48:5F:99:8E:E0:64 (Primary,USB,hci0)               [hci0] 0.422523
= Open Index: 00:00:00:00:00:00                                 [hci1] 0.936441
= Index Info: 00:00:00:00:00:00 (Nordic Semiconductor ASA)      [hci1] 0.936455
@ USER Open: main (privileged) version 2.22            {0x0001} [hci1] 0.936464
< HCI Command: Reset (0x03|0x0003) plen 0                    #1 [hci1] 0.937826
> HCI Event: Command Complete (0x0e) plen 4                  #2 [hci1] 0.938297
      Reset (0x03|0x0003) ncmd 1
        Status: Success (0x00)
< HCI Command: Read Local Supported... (0x04|0x0003) plen 0  #3 [hci1] 0.956218
> HCI Event: Command Complete (0x0e) plen 12                 #4 [hci1] 0.956753
      Read Local Supported Features (0x04|0x0003) ncmd 1
        Status: Success (0x00)
        Features: 0x00 0x00 0x00 0x00 0x60 0x00 0x00 0x00
          BR/EDR Not Supported
          LE Supported (Controller)
< HCI Command: Read Local Version In.. (0x04|0x0001) plen 0  #5 [hci1] 0.975857
> HCI Event: Command Complete (0x0e) plen 12                 #6 [hci1] 0.976294
      Read Local Version Information (0x04|0x0001) ncmd 1
        Status: Success (0x00)
        HCI version: Reserved (0x0f) - Revision 12393 (0x3069)
        LMP version: Reserved (0x0f) - Subversion 12393 (0x3069)
        Manufacturer: Nordic Semiconductor ASA (89)
< HCI Command: Read Local Supported... (0x04|0x0002) plen 0  #7 [hci1] 0.995790
> HCI Event: Command Complete (0x0e) plen 68                 #8 [hci1] 0.996843
      Read Local Supported Commands (0x04|0x0002) ncmd 1
        Status: Success (0x00)
        Commands: 119 entries
          Disconnect (Octet 0 - Bit 5)
          Read Remote Version Information (Octet 2 - Bit 7)
          Set Event Mask (Octet 5 - Bit 6)
          Reset (Octet 5 - Bit 7)
          Read Connection Accept Timeout (Octet 7 - Bit 2)
          Write Connection Accept Timeout (Octet 7 - Bit 3)
          Read Transmit Power Level (Octet 10 - Bit 2)
          Set Controller To Host Flow Control (Octet 10 - Bit 5)
          Host Buffer Size (Octet 10 - Bit 6)
          Host Number of Completed Packets (Octet 10 - Bit 7)
          Read Local Version Information (Octet 14 - Bit 3)
          Read Local Supported Features (Octet 14 - Bit 5)
          Read BD ADDR (Octet 15 - Bit 1)
          Read RSSI (Octet 15 - Bit 5)
          Set Event Mask Page 2 (Octet 22 - Bit 2)
          LE Set Event Mask (Octet 25 - Bit 0)
          LE Read Buffer Size (Octet 25 - Bit 1)
          LE Read Local Supported Features (Octet 25 - Bit 2)
          LE Set Random Address (Octet 25 - Bit 4)
          LE Set Advertising Parameters (Octet 25 - Bit 5)
          LE Read Advertising Channel TX Power (Octet 25 - Bit 6)
          LE Set Advertising Data (Octet 25 - Bit 7)
          LE Set Scan Response Data (Octet 26 - Bit 0)
          LE Set Advertise Enable (Octet 26 - Bit 1)
          LE Set Scan Parameters (Octet 26 - Bit 2)
          LE Set Scan Enable (Octet 26 - Bit 3)
          LE Create Connection (Octet 26 - Bit 4)
          LE Create Connection Cancel (Octet 26 - Bit 5)
          LE Read Accept List Size (Octet 26 - Bit 6)
          LE Clear Accept List (Octet 26 - Bit 7)
          LE Add Device To Accept List (Octet 27 - Bit 0)
          LE Remove Device From Accept List (Octet 27 - Bit 1)
          LE Connection Update (Octet 27 - Bit 2)
          LE Set Host Channel Classification (Octet 27 - Bit 3)
          LE Read Channel Map (Octet 27 - Bit 4)
          LE Read Remote Used Features (Octet 27 - Bit 5)
          LE Encrypt (Octet 27 - Bit 6)
          LE Rand (Octet 27 - Bit 7)
          LE Start Encryption (Octet 28 - Bit 0)
          LE Long Term Key Request Reply (Octet 28 - Bit 1)
          LE Long Term Key Request Neg Reply (Octet 28 - Bit 2)
          LE Read Supported States (Octet 28 - Bit 3)
          LE Receiver Test (Octet 28 - Bit 4)
          LE Transmitter Test (Octet 28 - Bit 5)
          LE Test End (Octet 28 - Bit 6)
          Read Authenticated Payload Timeout (Octet 32 - Bit 4)
          Write Authenticated Payload Timeout (Octet 32 - Bit 5)
          LE Set Data Length (Octet 33 - Bit 6)
          LE Read Suggested Default Data Length (Octet 33 - Bit 7)
          LE Write Suggested Default Data Length (Octet 34 - Bit 0)
          LE Add Device To Resolving List (Octet 34 - Bit 3)
          LE Remove Device From Resolving List (Octet 34 - Bit 4)
          LE Clear Resolving List (Octet 34 - Bit 5)
          LE Read Resolving List Size (Octet 34 - Bit 6)
          LE Set Address Resolution Enable (Octet 35 - Bit 1)
          LE Set Resolvable Private Address Timeout (Octet 35 - Bit 2)
          LE Read Maximum Data Length (Octet 35 - Bit 3)
          LE Read PHY (Octet 35 - Bit 4)
          LE Set Default PHY (Octet 35 - Bit 5)
          LE Set PHY (Octet 35 - Bit 6)
          LE Enhanced Receiver Test (Octet 35 - Bit 7)
          LE Enhanced Transmitter Test (Octet 36 - Bit 0)
          LE Set Advertising Set Random Address (Octet 36 - Bit 1)
          LE Set Extended Advertising Parameters (Octet 36 - Bit 2)
          LE Set Extended Advertising Data (Octet 36 - Bit 3)
          LE Set Extended Scan Response Data (Octet 36 - Bit 4)
          LE Set Extended Advertising Enable (Octet 36 - Bit 5)
          LE Read Maximum Advertising Data Length (Octet 36 - Bit 6)
          LE Read Number of Supported Advertising Sets (Octet 36 - Bit 7)
          LE Remove Advertising Set (Octet 37 - Bit 0)
          LE Clear Advertising Sets (Octet 37 - Bit 1)
          LE Set Periodic Advertising Parameters (Octet 37 - Bit 2)
          LE Set Periodic Advertising Data (Octet 37 - Bit 3)
          LE Set Periodic Advertising Enable (Octet 37 - Bit 4)
          LE Set Extended Scan Parameters (Octet 37 - Bit 5)
          LE Set Extended Scan Enable (Octet 37 - Bit 6)
          LE Extended Create Connection (Octet 37 - Bit 7)
          LE Periodic Advertising Create Sync (Octet 38 - Bit 0)
          LE Periodic Advertising Create Sync Cancel (Octet 38 - Bit 1)
          LE Periodic Advertising Terminate Sync (Octet 38 - Bit 2)
          LE Add Device To Periodic Advertiser List (Octet 38 - Bit 3)
          LE Remove Device From Periodic Advertiser List (Octet 38 - Bit 4)
          LE Clear Periodic Advertiser List (Octet 38 - Bit 5)
          LE Read Periodic Advertiser List Size (Octet 38 - Bit 6)
          LE Read Transmit Power (Octet 38 - Bit 7)
          LE Read RF Path Compensation (Octet 39 - Bit 0)
          LE Write RF Path Compensation (Octet 39 - Bit 1)
          LE Set Privacy Mode (Octet 39 - Bit 2)
          LE Periodic Advertising Receive Enable (Octet 40 - Bit 5)
          LE Periodic Advertising Sync Transfer (Octet 40 - Bit 6)
          LE Periodic Advertising Set Info Transfer (Octet 40 - Bit 7)
          LE Periodic Advertising Sync Transfer Parameters (Octet 41 - Bit 0)
          LE Set Default Periodic Advertisng Sync Transfer Parameters (Octet 41 - Bit 1)
          LE Read Buffer v2 (Octet 41 - Bit 5)
          LE Read ISO TX Sync (Octet 41 - Bit 6)
          LE Set Connected Isochronous Group Parameters (Octet 41 - Bit 7)
          LE Set Connected Isochronous Group Parameters Test (Octet 42 - Bit 0)
          LE Create Connected Isochronous Stream (Octet 42 - Bit 1)
          LE Remove Connected Isochronous Group (Octet 42 - Bit 2)
          LE Accept Connected Isochronous Stream Request (Octet 42 - Bit 3)
          LE Reject Connected Isochronous Stream Request (Octet 42 - Bit 4)
          LE Create Broadcast Isochronous Group (Octet 42 - Bit 5)
          LE Create Broadcast Isochronous Group Test (Octet 42 - Bit 6)
          LE Terminate Broadcast Isochronous Group (Octet 42 - Bit 7)
          LE Broadcast Isochronous Group Create Sync (Octet 43 - Bit 0)
          LE Broadcast Isochronous Group Terminate Sync (Octet 43 - Bit 1)
          LE Request Peer SCA (Octet 43 - Bit 2)
          LE Setup Isochronous Data Path (Octet 43 - Bit 3)
          LE Remove Isochronous Data Path (Octet 43 - Bit 4)
          LE Isochronous Transmit Test (Octet 43 - Bit 5)
          LE Isochronous Receive Test (Octet 43 - Bit 6)
          LE Isochronous Read Test Counters (Octet 43 - Bit 7)
          LE Isochronous Read Test Counters (Octet 44 - Bit 0)
          LE Set Host Feature (Octet 44 - Bit 1)
          Octet 44 - Bit 2 
          Octet 45 - Bit 6 
          Octet 46 - Bit 0 
          Octet 46 - Bit 1 
          Octet 46 - Bit 2 
< HCI Command: Host Buffer Size (0x03|0x0033) plen 7         #9 [hci1] 1.015799
        ACL MTU: 255  ACL max packet: 16
        SCO MTU: 0    SCO max packet: 0
> HCI Event: Command Complete (0x0e) plen 4                 #10 [hci1] 1.016300
      Host Buffer Size (0x03|0x0033) ncmd 1
        Status: Success (0x00)
< HCI Command: Set Controller To Ho.. (0x03|0x0031) plen 1  #11 [hci1] 1.035828
        Flow control: ACL Data Packets (0x01)
> HCI Event: Command Complete (0x0e) plen 4                 #12 [hci1] 1.036213
      Set Controller To Host Flow Control (0x03|0x0031) ncmd 1
        Status: Success (0x00)
< HCI Command: LE Read Local Suppor.. (0x08|0x0003) plen 0  #13 [hci1] 1.055752
> HCI Event: Command Complete (0x0e) plen 12                #14 [hci1] 1.056197
      LE Read Local Supported Features (0x08|0x0003) ncmd 1
        Status: Success (0x00)
        Features: 0xfd 0x79 0x00 0xf7 0x30 0x01 0x00 0x00
          LE Encryption
          Extended Reject Indication
          Peripheral-initiated Features Exchange
          LE Ping
          LE Data Packet Length Extension
          LL Privacy
          Extended Scanner Filter Policies
          LE 2M PHY
          LE Coded PHY
          LE Extended Advertising
          LE Periodic Advertising
          Channel Selection Algorithm #2
          Periodic Advertising Sync Transfer - Sender
          Periodic Advertising Sync Transfer - Recipient
          Sleep Clock Accuracy Updates
          Connected Isochronous Stream - Central
          Connected Isochronous Stream - Peripheral
          Isochronous Broadcaster
          Synchronized Receiver
          Periodic Advertising ADI support
          Connection Subrating
          Unknown features (0x0000010000000000)
< HCI Command: LE Set Host Feature (0x08|0x0074) plen 2     #15 [hci1] 1.075796
        Bit Number: 32
          Connected Isochronous Stream (Host Support)
        Bit Value: 1
> HCI Event: Command Complete (0x0e) plen 4                 #16 [hci1] 1.076219
      LE Set Host Feature (0x08|0x0074) ncmd 1
        Status: Success (0x00)
< HCI Command: LE Read Buffer v2 (0x08|0x0060) plen 0       #17 [hci1] 1.095794
> HCI Event: Command Complete (0x0e) plen 10                #18 [hci1] 1.096230
      LE Read Buffer v2 (0x08|0x0060) ncmd 1
        Status: Success (0x00)
        ACL MTU: 27
        ACL max packet: 3
        ISO MTU: 318
        ISO max packet: 3
< HCI Command: LE Read Maximum Adve.. (0x08|0x003a) plen 0  #19 [hci1] 1.115813
> HCI Event: Command Complete (0x0e) plen 6                 #20 [hci1] 1.116213
      LE Read Maximum Advertising Data Length (0x08|0x003a) ncmd 1
        Status: Success (0x00)
        Max length: 1650
< HCI Command: LE Read Supported St.. (0x08|0x001c) plen 0  #21 [hci1] 1.135831
> HCI Event: Command Complete (0x0e) plen 12                #22 [hci1] 1.136286
      LE Read Supported States (0x08|0x001c) ncmd 1
        Status: Success (0x00)
        States: 0x000003ff3e0306ff
          Non-connectable Advertising State
          Scannable Advertising State
          Connectable Advertising State
          High Duty Cycle Directed Advertising State
          Passive Scanning State
          Active Scanning State
          Initiating State
            and Connection State (Central Role)
          Connection State (Peripheral Role)
          Scannable Advertising State
            and Passive Scanning State
          Connectable Advertising State
            and Passive Scanning State
          Non-connectable Advertising State
            and Initiating State
          Scannable Advertising State
            and Initiating State
          Active Scanning State
            and Connection State (Central Role)
          Passive Scanning State
            and Connection State (Peripheral Role)
          Active Scanning State
            and Connection State (Peripheral Role)
          Initiating State
            and Connection State (Central Role)
            and Central Role & Central Role
          Low Duty Cycle Directed Advertising State
          Connectable Advertising State
            and Initiating State
            and Central Role & Peripheral Role
          High Duty Cycle Directed Advertising State
            and Initiating State
            and Central Role & Peripheral Role
          Low Duty Cycle Directed Advertising State
            and Initiating State
            and Central Role & Peripheral Role
          Connectable Advertising State
            and Connection State (Central Role)
            and Central Role & Peripheral Role
          High Duty Cycle Directed Advertising State
            and Connection State (Central Role)
            and Central Role & Peripheral Role
          Low Duty Cycle Directed Advertising State
            and Connection State (Central Role)
            and Central Role & Peripheral Role
          Connectable Advertising State
            and Connection State (Peripheral Role)
            and Central Role & Peripheral Role
          High Duty Cycle Directed Advertising State
            and Connection State (Peripheral Role)
            and Peripheral Role & Peripheral Role
          Low Duty Cycle Directed Advertising State
            and Connection State (Peripheral Role)
            and Peripheral Role & Peripheral Role
          Initiating State
            and Connection State (Peripheral Role)
            and Central Role & Peripheral Role
< HCI Command: LE Read Maximum Data.. (0x08|0x002f) plen 0  #23 [hci1] 1.155777
> HCI Event: Command Complete (0x0e) plen 12                #24 [hci1] 1.156221
      LE Read Maximum Data Length (0x08|0x002f) ncmd 1
        Status: Success (0x00)
        Max TX octets: 251
        Max TX time: 2704
        Max RX octets: 251
        Max RX time: 2704
< HCI Command: LE Write Suggested D.. (0x08|0x0024) plen 4  #25 [hci1] 1.175804
        TX octets: 251
        TX time: 2704
> HCI Event: Command Complete (0x0e) plen 4                 #26 [hci1] 1.176221
      LE Write Suggested Default Data Length (0x08|0x0024) ncmd 1
        Status: Success (0x00)
< HCI Command: LE Read Resolving Li.. (0x08|0x002a) plen 0  #27 [hci1] 1.195793
> HCI Event: Command Complete (0x0e) plen 5                 #28 [hci1] 1.196160
      LE Read Resolving List Size (0x08|0x002a) ncmd 1
        Status: Success (0x00)
        Size: 8
< HCI Command: LE Set Event Mask (0x08|0x0001) plen 8       #29 [hci1] 1.215783
        Mask: 0x000002023f87fa5e
          LE Advertising Report
          LE Connection Update Complete
          LE Read Remote Used Features Complete
          LE Long Term Key Request
          LE Data Length Change
          LE Enhanced Connection Complete
          LE PHY Update Complete
          LE Extended Advertising Report
          LE Periodic Advertising Sync Established
          LE Periodic Advertising Report
          LE Periodic Advertising Sync Lost
          LE Extended Scan Timeout
          LE Extended Advertising Set Terminated
          LE Scan Request Received
          LE Periodic Advertising Sync Transfer Rvc
          LE CIS Established
          LE CIS Request
          LE Create BIG Complete
          LE Terminate BIG Complete
          LE BIG Sync Estabilished Complete
          LE BIG Sync Lost
          LE BIG Info Advertising Report
          Unknown mask (0x0000020000000000)
> HCI Event: Command Complete (0x0e) plen 4                 #30 [hci1] 1.216243
      LE Set Event Mask (0x08|0x0001) ncmd 1
        Status: Success (0x00)
< HCI Command: Set Event Mask (0x03|0x0001) plen 8          #31 [hci1] 1.235804
        Mask: 0x2000800002008890
          Disconnection Complete
          Encryption Change
          Read Remote Version Information Complete
          Hardware Error
          Data Buffer Overflow
          Encryption Key Refresh Complete
          LE Meta
> HCI Event: Command Complete (0x0e) plen 4                 #32 [hci1] 1.236277
      Set Event Mask (0x03|0x0001) ncmd 1
        Status: Success (0x00)
< HCI Command: Read BD ADDR (0x04|0x0009) plen 0            #33 [hci1] 1.255782
> HCI Event: Command Complete (0x0e) plen 10                #34 [hci1] 1.256217
      Read BD ADDR (0x04|0x0009) ncmd 1
        Status: Success (0x00)
        Address: 00:00:00:00:00:00 (OUI 00-00-00)
< HCI Command: LE Set Random Address (0x08|0x0005) plen 6   #35 [hci1] 1.275834
        Address: D5:B6:CC:31:DB:3B (Static)
> HCI Event: Command Complete (0x0e) plen 4                 #36 [hci1] 1.276333
      LE Set Random Address (0x08|0x0005) ncmd 1
        Status: Success (0x00)
< HCI Command: LE Set Extended Adv.. (0x08|0x0036) plen 25  #37 [hci1] 3.755901
        Handle: 0x00
        Properties: 0x0013
          Connectable
          Scannable
          Use legacy advertising PDUs: ADV_IND
        Min advertising interval: 100.000 msec (0x00a0)
        Max advertising interval: 150.000 msec (0x00f0)
        Channel map: 37, 38, 39 (0x07)
        Own address type: Random (0x01)
        Peer address type: Public (0x00)
        Peer address: 00:00:00:00:00:00 (OUI 00-00-00)
        Filter policy: Allow Scan Request from Any, Allow Connect Request from Any (0x00)
        TX power: Host has no preference (0x7f)
        Primary PHY: LE 1M (0x01)
        Secondary max skip: 0x00
        Secondary PHY: LE 1M (0x01)
        SID: 0x00
        Scan request notifications: Disabled (0x00)
> HCI Event: Command Complete (0x0e) plen 5                 #38 [hci1] 3.756637
      LE Set Extended Advertising Parameters (0x08|0x0036) ncmd 1
        Status: Success (0x00)
        TX power (selected): 0 dbm (0x00)
< HCI Command: LE Set Advertising S.. (0x08|0x0035) plen 7  #39 [hci1] 3.775843
        Advertising handle: 0x00
        Advertising random address: D5:B6:CC:31:DB:3B (Static)
> HCI Event: Command Complete (0x0e) plen 4                 #40 [hci1] 3.776295
      LE Set Advertising Set Random Address (0x08|0x0035) ncmd 1
        Status: Success (0x00)
< HCI Command: LE Set Extended Adv.. (0x08|0x0037) plen 22  #41 [hci1] 3.795772
        Handle: 0x00
        Operation: Complete extended advertising data (0x03)
        Fragment preference: Minimize fragmentation (0x01)
        Data length: 0x12
        Flags: 0x06
          LE General Discoverable Mode
          BR/EDR Not Supported
        Name (complete): Tester_F6B11A
> HCI Event: Command Complete (0x0e) plen 4                 #42 [hci1] 3.796501
      LE Set Extended Advertising Data (0x08|0x0037) ncmd 1
        Status: Success (0x00)
< HCI Command: LE Set Extended Scan.. (0x08|0x0038) plen 4  #43 [hci1] 3.815830
        Handle: 0x00
        Operation: Complete scan response data (0x03)
        Fragment preference: Minimize fragmentation (0x01)
        Data length: 0x00
> HCI Event: Command Complete (0x0e) plen 4                 #44 [hci1] 3.816241
      LE Set Extended Scan Response Data (0x08|0x0038) ncmd 1
        Status: Success (0x00)
< HCI Command: LE Set Extended Adve.. (0x08|0x0039) plen 6  #45 [hci1] 3.835828
        Extended advertising: Enabled (0x01)
        Number of sets: 1 (0x01)
        Entry 0
          Handle: 0x00
          Duration: 0 ms (0x00)
          Max ext adv events: 0
> HCI Event: Command Complete (0x0e) plen 4                 #46 [hci1] 3.836476
      LE Set Extended Advertising Enable (0x08|0x0039) ncmd 1
        Status: Success (0x00)
> HCI Event: LE Meta Event (0x3e) plen 31                   #47 [hci1] 4.059511
      LE Enhanced Connection Complete (0x0a)
        Status: Success (0x00)
        Handle: 21
        Role: Peripheral (0x01)
        Peer address type: Public (0x00)
        Peer address: DF:A9:FF:F6:B1:1A (OUI DF-A9-FF)
        Local resolvable private address: 00:00:00:00:00:00 (Non-Resolvable)
        Peer resolvable private address: 00:00:00:00:00:00 (Non-Resolvable)
        Connection interval: 87.50 msec (0x0046)
        Connection latency: 0 (0x0000)
        Supervision timeout: 25120 msec (0x09d0)
        Central clock accuracy: 0x01
> HCI Event: LE Meta Event (0x3e) plen 6                    #48 [hci1] 4.059652
      LE Advertising Set Terminated (0x12)
        Status: Success (0x00)
        Handle: 0
        Connection handle: 21
        Number of completed extended advertising events: 0
< HCI Command: LE Read Remote Used... (0x08|0x0016) plen 2  #49 [hci1] 4.077058
        Handle: 21 Address: DF:A9:FF:F6:B1:1A (OUI DF-A9-FF)
< ACL Data TX: Handle 21 flags 0x00 dlen 7                  #50 [hci1] 4.077082
      ATT: Exchange MTU Request (0x02) len 2
        Client RX MTU: 251
> HCI Event: Command Status (0x0f) plen 4                   #51 [hci1] 4.077640
      LE Read Remote Used Features (0x08|0x0016) ncmd 1
        Status: Success (0x00)
> HCI Event: Number of Completed Packets (0x13) plen 5      #52 [hci1] 4.235503
        Num handles: 1
        Handle: 21 Address: DF:A9:FF:F6:B1:1A (OUI DF-A9-FF)
        Count: 1
        #50: len 7 (0 Kb/s)
        Latency: 158 msec (158-158 msec ~158 msec)
> HCI Event: LE Meta Event (0x3e) plen 12                   #53 [hci1] 4.323527
      LE Read Remote Used Features (0x04)
        Status: Success (0x00)
        Handle: 21 Address: DF:A9:FF:F6:B1:1A (OUI DF-A9-FF)
        Features: 0x2d 0x49 0x00 0xf7 0x67 0xd8 0x00 0x00
          LE Encryption
          Extended Reject Indication
          Peripheral-initiated Features Exchange
          LE Data Packet Length Extension
          LE 2M PHY
          LE Coded PHY
          Channel Selection Algorithm #2
          Periodic Advertising Sync Transfer - Sender
          Periodic Advertising Sync Transfer - Recipient
          Sleep Clock Accuracy Updates
          Connected Isochronous Stream - Central
          Connected Isochronous Stream - Peripheral
          Isochronous Broadcaster
          Synchronized Receiver
          Connected Isochronous Stream (Host Support)
          LE Power Control Request
          LE Power Control Request
          Connection Subrating
          Connection Subrating (Host Support)
          Unknown features (0x0000d80000000000)
> ACL Data RX: Handle 21 flags 0x02 dlen 11                 #54 [hci1] 6.773217
      SMP: Pairing Request (0x01) len 6
        IO capability: KeyboardDisplay (0x04)
        OOB data: Authentication data not present (0x00)
        Authentication requirement: Bonding, MITM, SC, No Keypresses (0x0d)
        Max encryption key size: 16
        Initiator key distribution: EncKey IdKey (0x03)
        Responder key distribution: EncKey IdKey Sign (0x07)
> ACL Data RX: Handle 21 flags 0x02 dlen 7                  #55 [hci1] 6.773465
      ATT: Exchange MTU Response (0x03) len 2
        Server RX MTU: 23
< HCI Command: Host Number of Compl.. (0x03|0x0035) plen 5  #56 [hci1] 6.775977
        Num handles: 1
        Handle: 21 Address: DF:A9:FF:F6:B1:1A (OUI DF-A9-FF)
        Count: 1
< ACL Data TX: Handle 21 flags 0x00 dlen 11                 #57 [hci1] 6.776050
      SMP: Pairing Response (0x02) len 6
        IO capability: DisplayOnly (0x00)
        OOB data: Authentication data not present (0x00)
        Authentication requirement: Bonding, No MITM, SC, No Keypresses (0x09)
        Max encryption key size: 16
        Initiator key distribution: IdKey (0x02)
        Responder key distribution: <none> (0x00)
< HCI Command: Host Number of Compl.. (0x03|0x0035) plen 5  #58 [hci1] 6.776154
        Num handles: 1
        Handle: 21 Address: DF:A9:FF:F6:B1:1A (OUI DF-A9-FF)
        Count: 1
> HCI Event: Number of Completed Packets (0x13) plen 5      #59 [hci1] 6.948240
        Num handles: 1
        Handle: 21 Address: DF:A9:FF:F6:B1:1A (OUI DF-A9-FF)
        Count: 1
        #57: len 11 (0 Kb/s)
        Latency: 172 msec (158-172 msec ~165 msec)
> ACL Data RX: Handle 21 flags 0x02 dlen 27                 #60 [hci1] 6.948494
> ACL Data RX: Handle 21 flags 0x01 dlen 27                 #61 [hci1] 6.948981
> ACL Data RX: Handle 21 flags 0x01 dlen 15                 #62 [hci1] 6.949403
      SMP: Pairing Public Key (0x0c) len 64
        X: 24d7d91495f87d67ce3b50bdedd93f9c61976848b3edaecbf13747e965bb2a43
        Y: 161172c64db5a245fed2fdb1b08746f1f7b3053a20000c891424ee3860b3baca
< HCI Command: Host Number of Compl.. (0x03|0x0035) plen 5  #63 [hci1] 6.956638
        Num handles: 1
        Handle: 21 Address: DF:A9:FF:F6:B1:1A (OUI DF-A9-FF)
        Count: 1
< HCI Command: Host Number of Compl.. (0x03|0x0035) plen 5  #64 [hci1] 6.956814
        Num handles: 1
        Handle: 21 Address: DF:A9:FF:F6:B1:1A (OUI DF-A9-FF)
        Count: 1
< HCI Command: Host Number of Compl.. (0x03|0x0035) plen 5  #65 [hci1] 6.957123
        Num handles: 1
        Handle: 21 Address: DF:A9:FF:F6:B1:1A (OUI DF-A9-FF)
        Count: 1
< ACL Data TX: Handle 21 flags 0x00 dlen 27                 #66 [hci1] 6.957193
< ACL Data TX: Handle 21 flags 0x01 dlen 27                 #67 [hci1] 6.957216
< ACL Data TX: Handle 21 flags 0x01 dlen 15                 #68 [hci1] 6.957291
      SMP: Pairing Public Key (0x0c) len 64
        X: 98308440221e2d910f0e54b71e7ec652857aa9b5a0dc65028824cc19db1226e9
        Y: 67a4816bcb62efb21701e31fdb27561a6217575fb007a8bbdabe7e28b6f68482
> HCI Event: Number of Completed Packets (0x13) plen 5      #69 [hci1] 7.036173
        Num handles: 1
        Handle: 21 Address: DF:A9:FF:F6:B1:1A (OUI DF-A9-FF)
        Count: 1
        #66: len 27 (2 Kb/s)
        Latency: 78 msec (78-172 msec ~122 msec)
> HCI Event: Number of Completed Packets (0x13) plen 5      #70 [hci1] 7.036652
        Num handles: 1
        Handle: 21 Address: DF:A9:FF:F6:B1:1A (OUI DF-A9-FF)
        Count: 1
        #67: len 27 (2 Kb/s)
        Latency: 79 msec (78-172 msec ~100 msec)
> HCI Event: Number of Completed Packets (0x13) plen 5      #71 [hci1] 7.122863
        Num handles: 1
        Handle: 21 Address: DF:A9:FF:F6:B1:1A (OUI DF-A9-FF)
        Count: 1
        #68: len 15 (0 Kb/s)
        Latency: 165 msec (78-172 msec ~133 msec)
> ACL Data RX: Handle 21 flags 0x02 dlen 21                 #72 [hci1] 7.998172
      SMP: Pairing Confirm (0x03) len 16
        Confim value: ce8f099183f58412d14d460bf96b989f
< HCI Command: Host Number of Compl.. (0x03|0x0035) plen 5  #73 [hci1] 8.015847
        Num handles: 1
        Handle: 21 Address: DF:A9:FF:F6:B1:1A (OUI DF-A9-FF)
        Count: 1
< ACL Data TX: Handle 21 flags 0x00 dlen 21                 #74 [hci1] 8.015966
      SMP: Pairing Confirm (0x03) len 16
        Confim value: f3bdfdedcd6f84a5d914688c377abf21
> HCI Event: Number of Completed Packets (0x13) plen 5      #75 [hci1] 8.173008
        Num handles: 1
        Handle: 21 Address: DF:A9:FF:F6:B1:1A (OUI DF-A9-FF)
        Count: 1
        #74: len 21 (1 Kb/s)
        Latency: 157 msec (78-172 msec ~145 msec)
> ACL Data RX: Handle 21 flags 0x02 dlen 21                 #76 [hci1] 8.173351
      SMP: Pairing Random (0x04) len 16
        Random value: dbc5fa5cc6b8ac810000000000000000
< HCI Command: Host Number of Compl.. (0x03|0x0035) plen 5  #77 [hci1] 8.176146
        Num handles: 1
        Handle: 21 Address: DF:A9:FF:F6:B1:1A (OUI DF-A9-FF)
        Count: 1
< ACL Data TX: Handle 21 flags 0x00 dlen 21                 #78 [hci1] 8.176316
      SMP: Pairing Random (0x04) len 16
        Random value: 8e6108f966a694cbe26df70bb96773e6
> HCI Event: Number of Completed Packets (0x13) plen 5      #79 [hci1] 8.347815
        Num handles: 1
        Handle: 21 Address: DF:A9:FF:F6:B1:1A (OUI DF-A9-FF)
        Count: 1
        #78: len 21 (0 Kb/s)
        Latency: 171 msec (78-172 msec ~158 msec)
> ACL Data RX: Handle 21 flags 0x02 dlen 21                 #80 [hci1] 8.435751
      SMP: Pairing Confirm (0x03) len 16
        Confim value: 630e004f208e20285df2186b15efadfa
< HCI Command: Host Number of Compl.. (0x03|0x0035) plen 5  #81 [hci1] 8.455927
        Num handles: 1
        Handle: 21 Address: DF:A9:FF:F6:B1:1A (OUI DF-A9-FF)
        Count: 1
< ACL Data TX: Handle 21 flags 0x00 dlen 21                 #82 [hci1] 8.456029
      SMP: Pairing Confirm (0x03) len 16
        Confim value: 9c43426a0014919865d6a894ec6100f8
> HCI Event: Number of Completed Packets (0x13) plen 5      #83 [hci1] 8.610545
        Num handles: 1
        Handle: 21 Address: DF:A9:FF:F6:B1:1A (OUI DF-A9-FF)
        Count: 1
        #82: len 21 (1 Kb/s)
        Latency: 154 msec (78-172 msec ~156 msec)
> ACL Data RX: Handle 21 flags 0x02 dlen 21                 #84 [hci1] 8.610871
      SMP: Pairing Random (0x04) len 16
        Random value: 61253e864b79e0750000000000000000
< HCI Command: Host Number of Compl.. (0x03|0x0035) plen 5  #85 [hci1] 8.616608
        Num handles: 1
        Handle: 21 Address: DF:A9:FF:F6:B1:1A (OUI DF-A9-FF)
        Count: 1
< ACL Data TX: Handle 21 flags 0x00 dlen 21                 #86 [hci1] 8.616657
      SMP: Pairing Random (0x04) len 16
        Random value: 4d02679f89a05211af56d8b3da64d21e
> HCI Event: Number of Completed Packets (0x13) plen 5      #87 [hci1] 8.785316
        Num handles: 1
        Handle: 21 Address: DF:A9:FF:F6:B1:1A (OUI DF-A9-FF)
        Count: 1
        #86: len 21 (1 Kb/s)
        Latency: 168 msec (78-172 msec ~162 msec)
> ACL Data RX: Handle 21 flags 0x02 dlen 21                 #88 [hci1] 8.873253
      SMP: Pairing Confirm (0x03) len 16
        Confim value: dbf99772fbf9c632c406618679f90d04
< HCI Command: Host Number of Compl.. (0x03|0x0035) plen 5  #89 [hci1] 8.876123
        Num handles: 1
        Handle: 21 Address: DF:A9:FF:F6:B1:1A (OUI DF-A9-FF)
        Count: 1
< ACL Data TX: Handle 21 flags 0x00 dlen 21                 #90 [hci1] 8.876266
      SMP: Pairing Confirm (0x03) len 16
        Confim value: 636b04d9eb3f9aff450633d4034fe54b
> HCI Event: Number of Completed Packets (0x13) plen 5      #91 [hci1] 9.047973
        Num handles: 1
        Handle: 21 Address: DF:A9:FF:F6:B1:1A (OUI DF-A9-FF)
        Count: 1
        #90: len 21 (0 Kb/s)
        Latency: 171 msec (78-172 msec ~167 msec)
> ACL Data RX: Handle 21 flags 0x02 dlen 21                 #92 [hci1] 9.048375
      SMP: Pairing Random (0x04) len 16
        Random value: 4eb5a92d090e62080000000000000000
< HCI Command: Host Number of Compl.. (0x03|0x0035) plen 5  #93 [hci1] 9.056578
        Num handles: 1
        Handle: 21 Address: DF:A9:FF:F6:B1:1A (OUI DF-A9-FF)
        Count: 1
< ACL Data TX: Handle 21 flags 0x00 dlen 21                 #94 [hci1] 9.056770
      SMP: Pairing Random (0x04) len 16
        Random value: 5e8286bc235a02440d0c3424a2acf8fd
> HCI Event: Number of Completed Packets (0x13) plen 5      #95 [hci1] 9.222824
        Num handles: 1
        Handle: 21 Address: DF:A9:FF:F6:B1:1A (OUI DF-A9-FF)
        Count: 1
        #94: len 21 (1 Kb/s)
        Latency: 166 msec (78-172 msec ~166 msec)
> ACL Data RX: Handle 21 flags 0x02 dlen 21                 #96 [hci1] 9.310653
      SMP: Pairing Confirm (0x03) len 16
        Confim value: 75814f554fc8ec36b0cca9842cf9fc42
< HCI Command: Host Number of Compl.. (0x03|0x0035) plen 5  #97 [hci1] 9.316082
        Num handles: 1
        Handle: 21 Address: DF:A9:FF:F6:B1:1A (OUI DF-A9-FF)
        Count: 1
< ACL Data TX: Handle 21 flags 0x00 dlen 21                 #98 [hci1] 9.316261
      SMP: Pairing Confirm (0x03) len 16
        Confim value: 0d940314d24faf681765d8278ecaad48
> HCI Event: Number of Completed Packets (0x13) plen 5      #99 [hci1] 9.485460
        Num handles: 1
        Handle: 21 Address: DF:A9:FF:F6:B1:1A (OUI DF-A9-FF)
        Count: 1
        #98: len 21 (0 Kb/s)
        Latency: 169 msec (78-172 msec ~167 msec)
> ACL Data RX: Handle 21 flags 0x02 dlen 21                #100 [hci1] 9.485845
      SMP: Pairing Random (0x04) len 16
        Random value: a977df56c67147350000000000000000
< HCI Command: Host Number of Comp.. (0x03|0x0035) plen 5  #101 [hci1] 9.496086
        Num handles: 1
        Handle: 21 Address: DF:A9:FF:F6:B1:1A (OUI DF-A9-FF)
        Count: 1
< ACL Data TX: Handle 21 flags 0x00 dlen 21                #102 [hci1] 9.496125
      SMP: Pairing Random (0x04) len 16
        Random value: 5c4a1bcadd27bd58e945097b00bad7ac
> HCI Event: Number of Completed Packets (0x13) plen 5     #103 [hci1] 9.660264
        Num handles: 1
        Handle: 21 Address: DF:A9:FF:F6:B1:1A (OUI DF-A9-FF)
        Count: 1
        #102: len 21 (1 Kb/s)
        Latency: 164 msec (78-172 msec ~166 msec)
> ACL Data RX: Handle 21 flags 0x02 dlen 21                #104 [hci1] 9.748220
      SMP: Pairing Confirm (0x03) len 16
        Confim value: 036b1935fdd7dfaa20bfe73b05cfcfe4
< HCI Command: Host Number of Comp.. (0x03|0x0035) plen 5  #105 [hci1] 9.755976
        Num handles: 1
        Handle: 21 Address: DF:A9:FF:F6:B1:1A (OUI DF-A9-FF)
        Count: 1
< ACL Data TX: Handle 21 flags 0x00 dlen 21                #106 [hci1] 9.756063
      SMP: Pairing Confirm (0x03) len 16
        Confim value: deb906cf1e862b091a0965e0ecaa1ec1
> HCI Event: Number of Completed Packets (0x13) plen 5     #107 [hci1] 9.923003
        Num handles: 1
        Handle: 21 Address: DF:A9:FF:F6:B1:1A (OUI DF-A9-FF)
        Count: 1
        #106: len 21 (1 Kb/s)
        Latency: 166 msec (78-172 msec ~166 msec)
> ACL Data RX: Handle 21 flags 0x02 dlen 21                #108 [hci1] 9.923311
      SMP: Pairing Random (0x04) len 16
        Random value: e619ca9c03bcee6d0000000000000000
< HCI Command: Host Number of Comp.. (0x03|0x0035) plen 5  #109 [hci1] 9.936685
        Num handles: 1
        Handle: 21 Address: DF:A9:FF:F6:B1:1A (OUI DF-A9-FF)
        Count: 1
< ACL Data TX: Handle 21 flags 0x00 dlen 21                #110 [hci1] 9.936771
      SMP: Pairing Random (0x04) len 16
        Random value: 32527e6e64e79f33b2e374394db8ab2d
> HCI Event: Number of Completed Packets (0x13) plen 5    #111 [hci1] 10.097778
        Num handles: 1
        Handle: 21 Address: DF:A9:FF:F6:B1:1A (OUI DF-A9-FF)
        Count: 1
        #110: len 21 (1 Kb/s)
        Latency: 161 msec (78-172 msec ~163 msec)
> ACL Data RX: Handle 21 flags 0x02 dlen 21               #112 [hci1] 10.185600
      SMP: Pairing Confirm (0x03) len 16
        Confim value: 1518b9aa87c1fc4c62630bd067e34a07
< HCI Command: Host Number of Com.. (0x03|0x0035) plen 5  #113 [hci1] 10.196046
        Num handles: 1
        Handle: 21 Address: DF:A9:FF:F6:B1:1A (OUI DF-A9-FF)
        Count: 1
< ACL Data TX: Handle 21 flags 0x00 dlen 21               #114 [hci1] 10.196237
      SMP: Pairing Confirm (0x03) len 16
        Confim value: 7b0b3eb8343ef1bdf59babd87794345c
> HCI Event: Number of Completed Packets (0x13) plen 5    #115 [hci1] 10.360536
        Num handles: 1
        Handle: 21 Address: DF:A9:FF:F6:B1:1A (OUI DF-A9-FF)
        Count: 1
        #114: len 21 (1 Kb/s)
        Latency: 164 msec (78-172 msec ~164 msec)
> ACL Data RX: Handle 21 flags 0x02 dlen 21               #116 [hci1] 10.360796
      SMP: Pairing Random (0x04) len 16
        Random value: ec084e986a00f29e0000000000000000
< HCI Command: Host Number of Com.. (0x03|0x0035) plen 5  #117 [hci1] 10.376660
        Num handles: 1
        Handle: 21 Address: DF:A9:FF:F6:B1:1A (OUI DF-A9-FF)
        Count: 1
< ACL Data TX: Handle 21 flags 0x00 dlen 21               #118 [hci1] 10.376810
      SMP: Pairing Random (0x04) len 16
        Random value: dddbdfe2838e9a8cc6964353c850fef7
> HCI Event: Number of Completed Packets (0x13) plen 5    #119 [hci1] 10.535278
        Num handles: 1
        Handle: 21 Address: DF:A9:FF:F6:B1:1A (OUI DF-A9-FF)
        Count: 1
        #118: len 21 (1 Kb/s)
        Latency: 158 msec (78-172 msec ~161 msec)
> ACL Data RX: Handle 21 flags 0x02 dlen 21               #120 [hci1] 10.623054
      SMP: Pairing Confirm (0x03) len 16
        Confim value: 105847c5053f563a210d0d1a6d2cae67
< HCI Command: Host Number of Com.. (0x03|0x0035) plen 5  #121 [hci1] 10.636468
        Num handles: 1
        Handle: 21 Address: DF:A9:FF:F6:B1:1A (OUI DF-A9-FF)
        Count: 1
< ACL Data TX: Handle 21 flags 0x00 dlen 21               #122 [hci1] 10.636661
      SMP: Pairing Confirm (0x03) len 16
        Confim value: d78b261d28340557127b5d9753990673
> HCI Event: Number of Completed Packets (0x13) plen 5    #123 [hci1] 10.797984
        Num handles: 1
        Handle: 21 Address: DF:A9:FF:F6:B1:1A (OUI DF-A9-FF)
        Count: 1
        #122: len 21 (1 Kb/s)
        Latency: 161 msec (78-172 msec ~161 msec)
> ACL Data RX: Handle 21 flags 0x02 dlen 21               #124 [hci1] 10.798277
      SMP: Pairing Random (0x04) len 16
        Random value: 5c61cd8c7a1f47210000000000000000
< HCI Command: Host Number of Com.. (0x03|0x0035) plen 5  #125 [hci1] 10.816318
        Num handles: 1
        Handle: 21 Address: DF:A9:FF:F6:B1:1A (OUI DF-A9-FF)
        Count: 1
< ACL Data TX: Handle 21 flags 0x00 dlen 21               #126 [hci1] 10.816427
      SMP: Pairing Random (0x04) len 16
        Random value: eb9f1915536596b6fc3db1c86b2b1970
> HCI Event: Number of Completed Packets (0x13) plen 5    #127 [hci1] 10.972757
        Num handles: 1
        Handle: 21 Address: DF:A9:FF:F6:B1:1A (OUI DF-A9-FF)
        Count: 1
        #126: len 21 (1 Kb/s)
        Latency: 156 msec (78-172 msec ~158 msec)
> ACL Data RX: Handle 21 flags 0x02 dlen 21               #128 [hci1] 11.060614
      SMP: Pairing Confirm (0x03) len 16
        Confim value: 07dd01eebba1d1055f8bb03916729e11
< HCI Command: Host Number of Com.. (0x03|0x0035) plen 5  #129 [hci1] 11.076536
        Num handles: 1
        Handle: 21 Address: DF:A9:FF:F6:B1:1A (OUI DF-A9-FF)
        Count: 1
< ACL Data TX: Handle 21 flags 0x00 dlen 21               #130 [hci1] 11.076774
      SMP: Pairing Confirm (0x03) len 16
        Confim value: 0e24052317cc67b88353cd9a6eeb3c63
> HCI Event: Number of Completed Packets (0x13) plen 5    #131 [hci1] 11.235459
        Num handles: 1
        Handle: 21 Address: DF:A9:FF:F6:B1:1A (OUI DF-A9-FF)
        Count: 1
        #130: len 21 (1 Kb/s)
        Latency: 158 msec (78-172 msec ~158 msec)
> ACL Data RX: Handle 21 flags 0x02 dlen 21               #132 [hci1] 11.235790
      SMP: Pairing Random (0x04) len 16
        Random value: dfddcef1b94b93e40000000000000000
< HCI Command: Host Number of Com.. (0x03|0x0035) plen 5  #133 [hci1] 11.236505
        Num handles: 1
        Handle: 21 Address: DF:A9:FF:F6:B1:1A (OUI DF-A9-FF)
        Count: 1
< ACL Data TX: Handle 21 flags 0x00 dlen 21               #134 [hci1] 11.236668
      SMP: Pairing Random (0x04) len 16
        Random value: 5c794dc9ad9f2c3f295ebd5ad5e1c3cf
> HCI Event: Number of Completed Packets (0x13) plen 5    #135 [hci1] 11.410248
        Num handles: 1
        Handle: 21 Address: DF:A9:FF:F6:B1:1A (OUI DF-A9-FF)
        Count: 1
        #134: len 21 (0 Kb/s)
        Latency: 173 msec (78-173 msec ~166 msec)
> ACL Data RX: Handle 21 flags 0x02 dlen 21               #136 [hci1] 11.498183
      SMP: Pairing Confirm (0x03) len 16
        Confim value: 0d273377eb4acfc138e3cff04881ecb8
< HCI Command: Host Number of Com.. (0x03|0x0035) plen 5  #137 [hci1] 11.516462
        Num handles: 1
        Handle: 21 Address: DF:A9:FF:F6:B1:1A (OUI DF-A9-FF)
        Count: 1
< ACL Data TX: Handle 21 flags 0x00 dlen 21               #138 [hci1] 11.516758
      SMP: Pairing Confirm (0x03) len 16
        Confim value: 7718f29db820d81a5b7aabb339247134
> HCI Event: Number of Completed Packets (0x13) plen 5    #139 [hci1] 11.672904
        Num handles: 1
        Handle: 21 Address: DF:A9:FF:F6:B1:1A (OUI DF-A9-FF)
        Count: 1
        #138: len 21 (1 Kb/s)
        Latency: 156 msec (78-173 msec ~161 msec)
> ACL Data RX: Handle 21 flags 0x02 dlen 21               #140 [hci1] 11.673291
      SMP: Pairing Random (0x04) len 16
        Random value: 415b44b9f228ca600000000000000000
< HCI Command: Host Number of Com.. (0x03|0x0035) plen 5  #141 [hci1] 11.676629
        Num handles: 1
        Handle: 21 Address: DF:A9:FF:F6:B1:1A (OUI DF-A9-FF)
        Count: 1
< ACL Data TX: Handle 21 flags 0x00 dlen 21               #142 [hci1] 11.676777
      SMP: Pairing Random (0x04) len 16
        Random value: 5c2fff312cdf99c9491988e877355a9a
> HCI Event: Number of Completed Packets (0x13) plen 5    #143 [hci1] 11.847692
        Num handles: 1
        Handle: 21 Address: DF:A9:FF:F6:B1:1A (OUI DF-A9-FF)
        Count: 1
        #142: len 21 (0 Kb/s)
        Latency: 170 msec (78-173 msec ~166 msec)
> ACL Data RX: Handle 21 flags 0x02 dlen 21               #144 [hci1] 11.935544
      SMP: Pairing Confirm (0x03) len 16
        Confim value: 12183834ce2aff8b50c30353b1c1e157
< HCI Command: Host Number of Com.. (0x03|0x0035) plen 5  #145 [hci1] 11.936134
        Num handles: 1
        Handle: 21 Address: DF:A9:FF:F6:B1:1A (OUI DF-A9-FF)
        Count: 1
< ACL Data TX: Handle 21 flags 0x00 dlen 21               #146 [hci1] 11.936193
      SMP: Pairing Confirm (0x03) len 16
        Confim value: 8388f5bb48ee1e39ecd52ca0347c834a
> HCI Event: Number of Completed Packets (0x13) plen 5    #147 [hci1] 12.110391
        Num handles: 1
        Handle: 21 Address: DF:A9:FF:F6:B1:1A (OUI DF-A9-FF)
        Count: 1
        #146: len 21 (0 Kb/s)
        Latency: 174 msec (78-174 msec ~170 msec)
> ACL Data RX: Handle 21 flags 0x02 dlen 21               #148 [hci1] 12.110772
      SMP: Pairing Random (0x04) len 16
        Random value: fd7008b39ecb1af10000000000000000
< HCI Command: Host Number of Com.. (0x03|0x0035) plen 5  #149 [hci1] 12.116733
        Num handles: 1
        Handle: 21 Address: DF:A9:FF:F6:B1:1A (OUI DF-A9-FF)
        Count: 1
< ACL Data TX: Handle 21 flags 0x00 dlen 21               #150 [hci1] 12.116833
      SMP: Pairing Random (0x04) len 16
        Random value: c629a3a987d808e808655d558dfc1155
> HCI Event: Number of Completed Packets (0x13) plen 5    #151 [hci1] 12.285235
        Num handles: 1
        Handle: 21 Address: DF:A9:FF:F6:B1:1A (OUI DF-A9-FF)
        Count: 1
        #150: len 21 (1 Kb/s)
        Latency: 168 msec (78-174 msec ~169 msec)
> ACL Data RX: Handle 21 flags 0x02 dlen 21               #152 [hci1] 12.373165
      SMP: Pairing Confirm (0x03) len 16
        Confim value: 748f916f10648a3d83ede99db76297cf
< HCI Command: Host Number of Com.. (0x03|0x0035) plen 5  #153 [hci1] 12.376527
        Num handles: 1
        Handle: 21 Address: DF:A9:FF:F6:B1:1A (OUI DF-A9-FF)
        Count: 1
< ACL Data TX: Handle 21 flags 0x00 dlen 21               #154 [hci1] 12.376754
      SMP: Pairing Confirm (0x03) len 16
        Confim value: 4a691cac5aa613d25e1d4d0df9076fde
> HCI Event: Number of Completed Packets (0x13) plen 5    #155 [hci1] 12.547887
        Num handles: 1
        Handle: 21 Address: DF:A9:FF:F6:B1:1A (OUI DF-A9-FF)
        Count: 1
        #154: len 21 (0 Kb/s)
        Latency: 171 msec (78-174 msec ~170 msec)
> ACL Data RX: Handle 21 flags 0x02 dlen 21               #156 [hci1] 12.548254
      SMP: Pairing Random (0x04) len 16
        Random value: c80e4b0cf5ad60450000000000000000
< HCI Command: Host Number of Com.. (0x03|0x0035) plen 5  #157 [hci1] 12.556178
        Num handles: 1
        Handle: 21 Address: DF:A9:FF:F6:B1:1A (OUI DF-A9-FF)
        Count: 1
< ACL Data TX: Handle 21 flags 0x00 dlen 21               #158 [hci1] 12.556186
      SMP: Pairing Random (0x04) len 16
        Random value: 92f20f6ad8f13724432c7fd6001c45ff
> HCI Event: Number of Completed Packets (0x13) plen 5    #159 [hci1] 12.722694
        Num handles: 1
        Handle: 21 Address: DF:A9:FF:F6:B1:1A (OUI DF-A9-FF)
        Count: 1
        #158: len 21 (1 Kb/s)
        Latency: 166 msec (78-174 msec ~168 msec)
> ACL Data RX: Handle 21 flags 0x02 dlen 21               #160 [hci1] 12.810499
      SMP: Pairing Confirm (0x03) len 16
        Confim value: e0b31c6974c362b38a0d4c08539fe573
< HCI Command: Host Number of Com.. (0x03|0x0035) plen 5  #161 [hci1] 12.816260
        Num handles: 1
        Handle: 21 Address: DF:A9:FF:F6:B1:1A (OUI DF-A9-FF)
        Count: 1
< ACL Data TX: Handle 21 flags 0x00 dlen 21               #162 [hci1] 12.816415
      SMP: Pairing Confirm (0x03) len 16
        Confim value: 0528c2d218f1d333adcf2d766fc0963b
> HCI Event: Number of Completed Packets (0x13) plen 5    #163 [hci1] 12.985400
        Num handles: 1
        Handle: 21 Address: DF:A9:FF:F6:B1:1A (OUI DF-A9-FF)
        Count: 1
        #162: len 21 (1 Kb/s)
        Latency: 168 msec (78-174 msec ~168 msec)
> ACL Data RX: Handle 21 flags 0x02 dlen 21               #164 [hci1] 12.985807
      SMP: Pairing Random (0x04) len 16
        Random value: 82d0e8c98b6611490000000000000000
< HCI Command: Host Number of Com.. (0x03|0x0035) plen 5  #165 [hci1] 12.996285
        Num handles: 1
        Handle: 21 Address: DF:A9:FF:F6:B1:1A (OUI DF-A9-FF)
        Count: 1
< ACL Data TX: Handle 21 flags 0x00 dlen 21               #166 [hci1] 12.996413
      SMP: Pairing Random (0x04) len 16
        Random value: 23ac32ebbb5e14c8a6b9622f296d277f
> HCI Event: Number of Completed Packets (0x13) plen 5    #167 [hci1] 13.160216
        Num handles: 1
        Handle: 21 Address: DF:A9:FF:F6:B1:1A (OUI DF-A9-FF)
        Count: 1
        #166: len 21 (1 Kb/s)
        Latency: 163 msec (78-174 msec ~166 msec)
> ACL Data RX: Handle 21 flags 0x02 dlen 21               #168 [hci1] 13.248034
      SMP: Pairing Confirm (0x03) len 16
        Confim value: d8dbc9af8740a65427d224d31722b4f5
< HCI Command: Host Number of Com.. (0x03|0x0035) plen 5  #169 [hci1] 13.256281
        Num handles: 1
        Handle: 21 Address: DF:A9:FF:F6:B1:1A (OUI DF-A9-FF)
        Count: 1
< ACL Data TX: Handle 21 flags 0x00 dlen 21               #170 [hci1] 13.256420
      SMP: Pairing Confirm (0x03) len 16
        Confim value: 1bd68e1328091afcea40b993e2fdecc4
> HCI Event: Number of Completed Packets (0x13) plen 5    #171 [hci1] 13.422910
        Num handles: 1
        Handle: 21 Address: DF:A9:FF:F6:B1:1A (OUI DF-A9-FF)
        Count: 1
        #170: len 21 (1 Kb/s)
        Latency: 166 msec (78-174 msec ~166 msec)
> ACL Data RX: Handle 21 flags 0x02 dlen 21               #172 [hci1] 13.423269
      SMP: Pairing Random (0x04) len 16
        Random value: 1452719e168642730000000000000000
< HCI Command: Host Number of Com.. (0x03|0x0035) plen 5  #173 [hci1] 13.436793
        Num handles: 1
        Handle: 21 Address: DF:A9:FF:F6:B1:1A (OUI DF-A9-FF)
        Count: 1
< ACL Data TX: Handle 21 flags 0x00 dlen 21               #174 [hci1] 13.436900
      SMP: Pairing Random (0x04) len 16
        Random value: 297efe85e67448a15f56bd27e3a3cf1d
> HCI Event: Number of Completed Packets (0x13) plen 5    #175 [hci1] 13.597710
        Num handles: 1
        Handle: 21 Address: DF:A9:FF:F6:B1:1A (OUI DF-A9-FF)
        Count: 1
        #174: len 21 (1 Kb/s)
        Latency: 160 msec (78-174 msec ~163 msec)
> ACL Data RX: Handle 21 flags 0x02 dlen 21               #176 [hci1] 13.685549
      SMP: Pairing Confirm (0x03) len 16
        Confim value: 1d93d6b86bbc623f286d40fb06b05add
< HCI Command: Host Number of Com.. (0x03|0x0035) plen 5  #177 [hci1] 13.696453
        Num handles: 1
        Handle: 21 Address: DF:A9:FF:F6:B1:1A (OUI DF-A9-FF)
        Count: 1
< ACL Data TX: Handle 21 flags 0x00 dlen 21               #178 [hci1] 13.696762
      SMP: Pairing Confirm (0x03) len 16
        Confim value: a6fb3b8fde8516645260b0b5e09d8b33
> HCI Event: Number of Completed Packets (0x13) plen 5    #179 [hci1] 13.860439
        Num handles: 1
        Handle: 21 Address: DF:A9:FF:F6:B1:1A (OUI DF-A9-FF)
        Count: 1
        #178: len 21 (1 Kb/s)
        Latency: 163 msec (78-174 msec ~163 msec)
> ACL Data RX: Handle 21 flags 0x02 dlen 21               #180 [hci1] 13.860665
      SMP: Pairing Random (0x04) len 16
        Random value: 438eef62590eb5850000000000000000
< HCI Command: Host Number of Com.. (0x03|0x0035) plen 5  #181 [hci1] 13.876730
        Num handles: 1
        Handle: 21 Address: DF:A9:FF:F6:B1:1A (OUI DF-A9-FF)
        Count: 1
< ACL Data TX: Handle 21 flags 0x00 dlen 21               #182 [hci1] 13.876823
      SMP: Pairing Random (0x04) len 16
        Random value: 25a9493fd3ce4faf02be7293595bb7c6
> HCI Event: Number of Completed Packets (0x13) plen 5    #183 [hci1] 14.035251
        Num handles: 1
        Handle: 21 Address: DF:A9:FF:F6:B1:1A (OUI DF-A9-FF)
        Count: 1
        #182: len 21 (1 Kb/s)
        Latency: 158 msec (78-174 msec ~161 msec)
> ACL Data RX: Handle 21 flags 0x02 dlen 21               #184 [hci1] 14.123062
      SMP: Pairing Confirm (0x03) len 16
        Confim value: 8ec2ba9a6c1b3b50326783aff16df873
< HCI Command: Host Number of Com.. (0x03|0x0035) plen 5  #185 [hci1] 14.136606
        Num handles: 1
        Handle: 21 Address: DF:A9:FF:F6:B1:1A (OUI DF-A9-FF)
        Count: 1
< ACL Data TX: Handle 21 flags 0x00 dlen 21               #186 [hci1] 14.136837
      SMP: Pairing Confirm (0x03) len 16
        Confim value: 7643968eaa1f8d5540d67afbf55b8ee2
> HCI Event: Number of Completed Packets (0x13) plen 5    #187 [hci1] 14.297881
        Num handles: 1
        Handle: 21 Address: DF:A9:FF:F6:B1:1A (OUI DF-A9-FF)
        Count: 1
        #186: len 21 (1 Kb/s)
        Latency: 161 msec (78-174 msec ~161 msec)
> ACL Data RX: Handle 21 flags 0x02 dlen 21               #188 [hci1] 14.298207
      SMP: Pairing Random (0x04) len 16
        Random value: 6dc8b77742ddab4f0000000000000000
< HCI Command: Host Number of Com.. (0x03|0x0035) plen 5  #189 [hci1] 14.316828
        Num handles: 1
        Handle: 21 Address: DF:A9:FF:F6:B1:1A (OUI DF-A9-FF)
        Count: 1
< ACL Data TX: Handle 21 flags 0x00 dlen 21               #190 [hci1] 14.316927
      SMP: Pairing Random (0x04) len 16
        Random value: 58f6b41f855a6f6c3560debd84e2affc
> HCI Event: Number of Completed Packets (0x13) plen 5    #191 [hci1] 14.472684
        Num handles: 1
        Handle: 21 Address: DF:A9:FF:F6:B1:1A (OUI DF-A9-FF)
        Count: 1
        #190: len 21 (1 Kb/s)
        Latency: 155 msec (78-174 msec ~158 msec)
> ACL Data RX: Handle 21 flags 0x02 dlen 21               #192 [hci1] 14.560434
      SMP: Pairing Confirm (0x03) len 16
        Confim value: 4dbf28e869f957c9f6bc362d212775cb
< HCI Command: Host Number of Com.. (0x03|0x0035) plen 5  #193 [hci1] 14.576363
        Num handles: 1
        Handle: 21 Address: DF:A9:FF:F6:B1:1A (OUI DF-A9-FF)
        Count: 1
< ACL Data TX: Handle 21 flags 0x00 dlen 21               #194 [hci1] 14.576506
      SMP: Pairing Confirm (0x03) len 16
        Confim value: 5398eb2fc6dd76a161d81ac58e9f20aa
> HCI Event: Number of Completed Packets (0x13) plen 5    #195 [hci1] 14.735330
        Num handles: 1
        Handle: 21 Address: DF:A9:FF:F6:B1:1A (OUI DF-A9-FF)
        Count: 1
        #194: len 21 (1 Kb/s)
        Latency: 158 msec (78-174 msec ~158 msec)
> ACL Data RX: Handle 21 flags 0x02 dlen 21               #196 [hci1] 14.735697
      SMP: Pairing Random (0x04) len 16
        Random value: c5760be2d22be79b0000000000000000
< HCI Command: Host Number of Com.. (0x03|0x0035) plen 5  #197 [hci1] 14.736680
        Num handles: 1
        Handle: 21 Address: DF:A9:FF:F6:B1:1A (OUI DF-A9-FF)
        Count: 1
< ACL Data TX: Handle 21 flags 0x00 dlen 21               #198 [hci1] 14.736847
      SMP: Pairing Random (0x04) len 16
        Random value: b67e7216d5bf664139eda2b542549666
> HCI Event: Number of Completed Packets (0x13) plen 5    #199 [hci1] 14.910222
        Num handles: 1
        Handle: 21 Address: DF:A9:FF:F6:B1:1A (OUI DF-A9-FF)
        Count: 1
        #198: len 21 (0 Kb/s)
        Latency: 173 msec (78-174 msec ~165 msec)
> ACL Data RX: Handle 21 flags 0x02 dlen 21               #200 [hci1] 14.997946
      SMP: Pairing Confirm (0x03) len 16
        Confim value: c539a6a4c70b0a87c7bc05990deeedd1
< HCI Command: Host Number of Com.. (0x03|0x0035) plen 5  #201 [hci1] 15.016375
        Num handles: 1
        Handle: 21 Address: DF:A9:FF:F6:B1:1A (OUI DF-A9-FF)
        Count: 1
< ACL Data TX: Handle 21 flags 0x00 dlen 21               #202 [hci1] 15.016559
      SMP: Pairing Confirm (0x03) len 16
        Confim value: 18f4bc3c467bf0c0a1bb43ce29e4453a
> HCI Event: Number of Completed Packets (0x13) plen 5    #203 [hci1] 15.172843
        Num handles: 1
        Handle: 21 Address: DF:A9:FF:F6:B1:1A (OUI DF-A9-FF)
        Count: 1
        #202: len 21 (1 Kb/s)
        Latency: 156 msec (78-174 msec ~161 msec)
> ACL Data RX: Handle 21 flags 0x02 dlen 21               #204 [hci1] 15.173211
      SMP: Pairing Random (0x04) len 16
        Random value: e29100dcf9298a810000000000000000
< HCI Command: Host Number of Com.. (0x03|0x0035) plen 5  #205 [hci1] 15.176871
        Num handles: 1
        Handle: 21 Address: DF:A9:FF:F6:B1:1A (OUI DF-A9-FF)
        Count: 1
< ACL Data TX: Handle 21 flags 0x00 dlen 21               #206 [hci1] 15.177039
      SMP: Pairing Random (0x04) len 16
        Random value: ed17f76500c95219dd01e09d1e63f87b
> HCI Event: Number of Completed Packets (0x13) plen 5    #207 [hci1] 15.347618
        Num handles: 1
        Handle: 21 Address: DF:A9:FF:F6:B1:1A (OUI DF-A9-FF)
        Count: 1
        #206: len 21 (0 Kb/s)
        Latency: 170 msec (78-174 msec ~165 msec)
> ACL Data RX: Handle 21 flags 0x02 dlen 21               #208 [hci1] 15.435464
      SMP: Pairing Confirm (0x03) len 16
        Confim value: 16133cbdc1556afabfc55f5263636c3f
< HCI Command: Host Number of Com.. (0x03|0x0035) plen 5  #209 [hci1] 15.436184
        Num handles: 1
        Handle: 21 Address: DF:A9:FF:F6:B1:1A (OUI DF-A9-FF)
        Count: 1
< ACL Data TX: Handle 21 flags 0x00 dlen 21               #210 [hci1] 15.436264
      SMP: Pairing Confirm (0x03) len 16
        Confim value: 074ba4f8d05c8af27fda465e2be89d40
> HCI Event: Number of Completed Packets (0x13) plen 5    #211 [hci1] 15.610337
        Num handles: 1
        Handle: 21 Address: DF:A9:FF:F6:B1:1A (OUI DF-A9-FF)
        Count: 1
        #210: len 21 (0 Kb/s)
        Latency: 174 msec (78-174 msec ~169 msec)
> ACL Data RX: Handle 21 flags 0x02 dlen 21               #212 [hci1] 15.610660
      SMP: Pairing Random (0x04) len 16
        Random value: 0406314d173fff8e0000000000000000
< HCI Command: Host Number of Com.. (0x03|0x0035) plen 5  #213 [hci1] 15.616074
        Num handles: 1
        Handle: 21 Address: DF:A9:FF:F6:B1:1A (OUI DF-A9-FF)
        Count: 1
< ACL Data TX: Handle 21 flags 0x00 dlen 21               #214 [hci1] 15.616123
      SMP: Pairing Random (0x04) len 16
        Random value: 81d35d47e1f6006d79c974bd9d9e1ee3
> HCI Event: Number of Completed Packets (0x13) plen 5    #215 [hci1] 15.785138
        Num handles: 1
        Handle: 21 Address: DF:A9:FF:F6:B1:1A (OUI DF-A9-FF)
        Count: 1
        #214: len 21 (0 Kb/s)
        Latency: 169 msec (78-174 msec ~169 msec)
> ACL Data RX: Handle 21 flags 0x02 dlen 21               #216 [hci1] 15.873001
      SMP: Pairing Confirm (0x03) len 16
        Confim value: e75b5f39933acfabad6088818a84dd21
< HCI Command: Host Number of Com.. (0x03|0x0035) plen 5  #217 [hci1] 15.876594
        Num handles: 1
        Handle: 21 Address: DF:A9:FF:F6:B1:1A (OUI DF-A9-FF)
        Count: 1
< ACL Data TX: Handle 21 flags 0x00 dlen 21               #218 [hci1] 15.876830
      SMP: Pairing Confirm (0x03) len 16
        Confim value: f56b01413edcab279b30a608d6ff7b45
> HCI Event: Number of Completed Packets (0x13) plen 5    #219 [hci1] 16.047765
        Num handles: 1
        Handle: 21 Address: DF:A9:FF:F6:B1:1A (OUI DF-A9-FF)
        Count: 1
        #218: len 21 (0 Kb/s)
        Latency: 170 msec (78-174 msec ~170 msec)
> ACL Data RX: Handle 21 flags 0x02 dlen 21               #220 [hci1] 16.048115
      SMP: Pairing Random (0x04) len 16
        Random value: b43b204783d508650000000000000000
< HCI Command: Host Number of Com.. (0x03|0x0035) plen 5  #221 [hci1] 16.056610
        Num handles: 1
        Handle: 21 Address: DF:A9:FF:F6:B1:1A (OUI DF-A9-FF)
        Count: 1
< ACL Data TX: Handle 21 flags 0x00 dlen 21               #222 [hci1] 16.056696
      SMP: Pairing Random (0x04) len 16
        Random value: e7f7e0c2476823e41736a7e381bafb7c
> HCI Event: Number of Completed Packets (0x13) plen 5    #223 [hci1] 16.222602
        Num handles: 1
        Handle: 21 Address: DF:A9:FF:F6:B1:1A (OUI DF-A9-FF)
        Count: 1
        #222: len 21 (1 Kb/s)
        Latency: 165 msec (78-174 msec ~168 msec)
> ACL Data RX: Handle 21 flags 0x02 dlen 21               #224 [hci1] 16.310413
      SMP: Pairing Confirm (0x03) len 16
        Confim value: 9eaf108463048fb056ebd9dea86b4663
< HCI Command: Host Number of Com.. (0x03|0x0035) plen 5  #225 [hci1] 16.316543
        Num handles: 1
        Handle: 21 Address: DF:A9:FF:F6:B1:1A (OUI DF-A9-FF)
        Count: 1
< ACL Data TX: Handle 21 flags 0x00 dlen 21               #226 [hci1] 16.316806
      SMP: Pairing Confirm (0x03) len 16
        Confim value: 5898afbe7fe32e958fe8518cee747f8f
> HCI Event: Number of Completed Packets (0x13) plen 5    #227 [hci1] 16.485315
        Num handles: 1
        Handle: 21 Address: DF:A9:FF:F6:B1:1A (OUI DF-A9-FF)
        Count: 1
        #226: len 21 (1 Kb/s)
        Latency: 168 msec (78-174 msec ~168 msec)
> ACL Data RX: Handle 21 flags 0x02 dlen 21               #228 [hci1] 16.485657
      SMP: Pairing Random (0x04) len 16
        Random value: 6388966a8849dcc70000000000000000
< HCI Command: Host Number of Com.. (0x03|0x0035) plen 5  #229 [hci1] 16.496979
        Num handles: 1
        Handle: 21 Address: DF:A9:FF:F6:B1:1A (OUI DF-A9-FF)
        Count: 1
