Bluetooth monitor ver 5.72
= Note: Linux version 6.14.0-36-generic (x86_64)                       0.781663
= Note: Bluetooth subsystem version 2.22                               0.781665
= New Index: 00:00:00:00:00:00 (Primary,UART,hci1)              [hci1] 0.781666
= New Index: 48:5F:99:8E:E0:64 (Primary,USB,hci0)               [hci0] 0.781667
= Open Index: 00:00:00:00:00:00                                 [hci1] 1.295386
= Index Info: 00:00:00:00:00:00 (Nordic Semiconductor ASA)      [hci1] 1.295402
@ USER Open: main (privileged) version 2.22            {0x0001} [hci1] 1.295412
< HCI Command: Reset (0x03|0x0003) plen 0                    #1 [hci1] 1.296653
> HCI Event: Command Complete (0x0e) plen 4                  #2 [hci1] 1.297172
      Reset (0x03|0x0003) ncmd 1
        Status: Success (0x00)
< HCI Command: Read Local Supported... (0x04|0x0003) plen 0  #3 [hci1] 1.315218
> HCI Event: Command Complete (0x0e) plen 12                 #4 [hci1] 1.315890
      Read Local Supported Features (0x04|0x0003) ncmd 1
        Status: Success (0x00)
        Features: 0x00 0x00 0x00 0x00 0x60 0x00 0x00 0x00
          BR/EDR Not Supported
          LE Supported (Controller)
< HCI Command: Read Local Version In.. (0x04|0x0001) plen 0  #5 [hci1] 1.334948
> HCI Event: Command Complete (0x0e) plen 12                 #6 [hci1] 1.335409
      Read Local Version Information (0x04|0x0001) ncmd 1
        Status: Success (0x00)
        HCI version: Reserved (0x0f) - Revision 12393 (0x3069)
        LMP version: Reserved (0x0f) - Subversion 12393 (0x3069)
        Manufacturer: Nordic Semiconductor ASA (89)
< HCI Command: Read Local Supported... (0x04|0x0002) plen 0  #7 [hci1] 1.354867
> HCI Event: Command Complete (0x0e) plen 68                 #8 [hci1] 1.355990
      Read Local Supported Commands (0x04|0x0002) ncmd 1
        Status: Success (0x00)
        Commands: 119 entries
          Disconnect (Octet 0 - Bit 5)
          Read Remote Version Information (Octet 2 - Bit 7)
          Set Event Mask (Octet 5 - Bit 6)
          Reset (Octet 5 - Bit 7)
          Read Connection Accept Timeout (Octet 7 - Bit 2)
          Write Connection Accept Timeout (Octet 7 - Bit 3)
          Read Transmit Power Level (Octet 10 - Bit 2)
          Set Controller To Host Flow Control (Octet 10 - Bit 5)
          Host Buffer Size (Octet 10 - Bit 6)
          Host Number of Completed Packets (Octet 10 - Bit 7)
          Read Local Version Information (Octet 14 - Bit 3)
          Read Local Supported Features (Octet 14 - Bit 5)
          Read BD ADDR (Octet 15 - Bit 1)
          Read RSSI (Octet 15 - Bit 5)
          Set Event Mask Page 2 (Octet 22 - Bit 2)
          LE Set Event Mask (Octet 25 - Bit 0)
          LE Read Buffer Size (Octet 25 - Bit 1)
          LE Read Local Supported Features (Octet 25 - Bit 2)
          LE Set Random Address (Octet 25 - Bit 4)
          LE Set Advertising Parameters (Octet 25 - Bit 5)
          LE Read Advertising Channel TX Power (Octet 25 - Bit 6)
          LE Set Advertising Data (Octet 25 - Bit 7)
          LE Set Scan Response Data (Octet 26 - Bit 0)
          LE Set Advertise Enable (Octet 26 - Bit 1)
          LE Set Scan Parameters (Octet 26 - Bit 2)
          LE Set Scan Enable (Octet 26 - Bit 3)
          LE Create Connection (Octet 26 - Bit 4)
          LE Create Connection Cancel (Octet 26 - Bit 5)
          LE Read Accept List Size (Octet 26 - Bit 6)
          LE Clear Accept List (Octet 26 - Bit 7)
          LE Add Device To Accept List (Octet 27 - Bit 0)
          LE Remove Device From Accept List (Octet 27 - Bit 1)
          LE Connection Update (Octet 27 - Bit 2)
          LE Set Host Channel Classification (Octet 27 - Bit 3)
          LE Read Channel Map (Octet 27 - Bit 4)
          LE Read Remote Used Features (Octet 27 - Bit 5)
          LE Encrypt (Octet 27 - Bit 6)
          LE Rand (Octet 27 - Bit 7)
          LE Start Encryption (Octet 28 - Bit 0)
          LE Long Term Key Request Reply (Octet 28 - Bit 1)
          LE Long Term Key Request Neg Reply (Octet 28 - Bit 2)
          LE Read Supported States (Octet 28 - Bit 3)
          LE Receiver Test (Octet 28 - Bit 4)
          LE Transmitter Test (Octet 28 - Bit 5)
          LE Test End (Octet 28 - Bit 6)
          Read Authenticated Payload Timeout (Octet 32 - Bit 4)
          Write Authenticated Payload Timeout (Octet 32 - Bit 5)
          LE Set Data Length (Octet 33 - Bit 6)
          LE Read Suggested Default Data Length (Octet 33 - Bit 7)
          LE Write Suggested Default Data Length (Octet 34 - Bit 0)
          LE Add Device To Resolving List (Octet 34 - Bit 3)
          LE Remove Device From Resolving List (Octet 34 - Bit 4)
          LE Clear Resolving List (Octet 34 - Bit 5)
          LE Read Resolving List Size (Octet 34 - Bit 6)
          LE Set Address Resolution Enable (Octet 35 - Bit 1)
          LE Set Resolvable Private Address Timeout (Octet 35 - Bit 2)
          LE Read Maximum Data Length (Octet 35 - Bit 3)
          LE Read PHY (Octet 35 - Bit 4)
          LE Set Default PHY (Octet 35 - Bit 5)
          LE Set PHY (Octet 35 - Bit 6)
          LE Enhanced Receiver Test (Octet 35 - Bit 7)
          LE Enhanced Transmitter Test (Octet 36 - Bit 0)
          LE Set Advertising Set Random Address (Octet 36 - Bit 1)
          LE Set Extended Advertising Parameters (Octet 36 - Bit 2)
          LE Set Extended Advertising Data (Octet 36 - Bit 3)
          LE Set Extended Scan Response Data (Octet 36 - Bit 4)
          LE Set Extended Advertising Enable (Octet 36 - Bit 5)
          LE Read Maximum Advertising Data Length (Octet 36 - Bit 6)
          LE Read Number of Supported Advertising Sets (Octet 36 - Bit 7)
          LE Remove Advertising Set (Octet 37 - Bit 0)
          LE Clear Advertising Sets (Octet 37 - Bit 1)
          LE Set Periodic Advertising Parameters (Octet 37 - Bit 2)
          LE Set Periodic Advertising Data (Octet 37 - Bit 3)
          LE Set Periodic Advertising Enable (Octet 37 - Bit 4)
          LE Set Extended Scan Parameters (Octet 37 - Bit 5)
          LE Set Extended Scan Enable (Octet 37 - Bit 6)
          LE Extended Create Connection (Octet 37 - Bit 7)
          LE Periodic Advertising Create Sync (Octet 38 - Bit 0)
          LE Periodic Advertising Create Sync Cancel (Octet 38 - Bit 1)
          LE Periodic Advertising Terminate Sync (Octet 38 - Bit 2)
          LE Add Device To Periodic Advertiser List (Octet 38 - Bit 3)
          LE Remove Device From Periodic Advertiser List (Octet 38 - Bit 4)
          LE Clear Periodic Advertiser List (Octet 38 - Bit 5)
          LE Read Periodic Advertiser List Size (Octet 38 - Bit 6)
          LE Read Transmit Power (Octet 38 - Bit 7)
          LE Read RF Path Compensation (Octet 39 - Bit 0)
          LE Write RF Path Compensation (Octet 39 - Bit 1)
          LE Set Privacy Mode (Octet 39 - Bit 2)
          LE Periodic Advertising Receive Enable (Octet 40 - Bit 5)
          LE Periodic Advertising Sync Transfer (Octet 40 - Bit 6)
          LE Periodic Advertising Set Info Transfer (Octet 40 - Bit 7)
          LE Periodic Advertising Sync Transfer Parameters (Octet 41 - Bit 0)
          LE Set Default Periodic Advertisng Sync Transfer Parameters (Octet 41 - Bit 1)
          LE Read Buffer v2 (Octet 41 - Bit 5)
          LE Read ISO TX Sync (Octet 41 - Bit 6)
          LE Set Connected Isochronous Group Parameters (Octet 41 - Bit 7)
          LE Set Connected Isochronous Group Parameters Test (Octet 42 - Bit 0)
          LE Create Connected Isochronous Stream (Octet 42 - Bit 1)
          LE Remove Connected Isochronous Group (Octet 42 - Bit 2)
          LE Accept Connected Isochronous Stream Request (Octet 42 - Bit 3)
          LE Reject Connected Isochronous Stream Request (Octet 42 - Bit 4)
          LE Create Broadcast Isochronous Group (Octet 42 - Bit 5)
          LE Create Broadcast Isochronous Group Test (Octet 42 - Bit 6)
          LE Terminate Broadcast Isochronous Group (Octet 42 - Bit 7)
          LE Broadcast Isochronous Group Create Sync (Octet 43 - Bit 0)
          LE Broadcast Isochronous Group Terminate Sync (Octet 43 - Bit 1)
          LE Request Peer SCA (Octet 43 - Bit 2)
          LE Setup Isochronous Data Path (Octet 43 - Bit 3)
          LE Remove Isochronous Data Path (Octet 43 - Bit 4)
          LE Isochronous Transmit Test (Octet 43 - Bit 5)
          LE Isochronous Receive Test (Octet 43 - Bit 6)
          LE Isochronous Read Test Counters (Octet 43 - Bit 7)
          LE Isochronous Read Test Counters (Octet 44 - Bit 0)
          LE Set Host Feature (Octet 44 - Bit 1)
          Octet 44 - Bit 2 
          Octet 45 - Bit 6 
          Octet 46 - Bit 0 
          Octet 46 - Bit 1 
          Octet 46 - Bit 2 
< HCI Command: Host Buffer Size (0x03|0x0033) plen 7         #9 [hci1] 1.374871
        ACL MTU: 255  ACL max packet: 16
        SCO MTU: 0    SCO max packet: 0
> HCI Event: Command Complete (0x0e) plen 4                 #10 [hci1] 1.375379
      Host Buffer Size (0x03|0x0033) ncmd 1
        Status: Success (0x00)
< HCI Command: Set Controller To Ho.. (0x03|0x0031) plen 1  #11 [hci1] 1.394871
        Flow control: ACL Data Packets (0x01)
> HCI Event: Command Complete (0x0e) plen 4                 #12 [hci1] 1.395420
      Set Controller To Host Flow Control (0x03|0x0031) ncmd 1
        Status: Success (0x00)
< HCI Command: LE Read Local Suppor.. (0x08|0x0003) plen 0  #13 [hci1] 1.414869
> HCI Event: Command Complete (0x0e) plen 12                #14 [hci1] 1.415412
      LE Read Local Supported Features (0x08|0x0003) ncmd 1
        Status: Success (0x00)
        Features: 0xfd 0x79 0x00 0xf7 0x30 0x01 0x00 0x00
          LE Encryption
          Extended Reject Indication
          Peripheral-initiated Features Exchange
          LE Ping
          LE Data Packet Length Extension
          LL Privacy
          Extended Scanner Filter Policies
          LE 2M PHY
          LE Coded PHY
          LE Extended Advertising
          LE Periodic Advertising
          Channel Selection Algorithm #2
          Periodic Advertising Sync Transfer - Sender
          Periodic Advertising Sync Transfer - Recipient
          Sleep Clock Accuracy Updates
          Connected Isochronous Stream - Central
          Connected Isochronous Stream - Peripheral
          Isochronous Broadcaster
          Synchronized Receiver
          Periodic Advertising ADI support
          Connection Subrating
          Unknown features (0x0000010000000000)
< HCI Command: LE Set Host Feature (0x08|0x0074) plen 2     #15 [hci1] 1.434876
        Bit Number: 32
          Connected Isochronous Stream (Host Support)
        Bit Value: 1
> HCI Event: Command Complete (0x0e) plen 4                 #16 [hci1] 1.435354
      LE Set Host Feature (0x08|0x0074) ncmd 1
        Status: Success (0x00)
< HCI Command: LE Read Buffer v2 (0x08|0x0060) plen 0       #17 [hci1] 1.454863
> HCI Event: Command Complete (0x0e) plen 10                #18 [hci1] 1.455347
      LE Read Buffer v2 (0x08|0x0060) ncmd 1
        Status: Success (0x00)
        ACL MTU: 27
        ACL max packet: 3
        ISO MTU: 318
        ISO max packet: 3
< HCI Command: LE Read Maximum Adve.. (0x08|0x003a) plen 0  #19 [hci1] 1.474896
> HCI Event: Command Complete (0x0e) plen 6                 #20 [hci1] 1.475367
      LE Read Maximum Advertising Data Length (0x08|0x003a) ncmd 1
        Status: Success (0x00)
        Max length: 1650
< HCI Command: LE Read Supported St.. (0x08|0x001c) plen 0  #21 [hci1] 1.494863
> HCI Event: Command Complete (0x0e) plen 12                #22 [hci1] 1.495430
      LE Read Supported States (0x08|0x001c) ncmd 1
        Status: Success (0x00)
        States: 0x000003ff3e0306ff
          Non-connectable Advertising State
          Scannable Advertising State
          Connectable Advertising State
          High Duty Cycle Directed Advertising State
          Passive Scanning State
          Active Scanning State
          Initiating State
            and Connection State (Central Role)
          Connection State (Peripheral Role)
          Scannable Advertising State
            and Passive Scanning State
          Connectable Advertising State
            and Passive Scanning State
          Non-connectable Advertising State
            and Initiating State
          Scannable Advertising State
            and Initiating State
          Active Scanning State
            and Connection State (Central Role)
          Passive Scanning State
            and Connection State (Peripheral Role)
          Active Scanning State
            and Connection State (Peripheral Role)
          Initiating State
            and Connection State (Central Role)
            and Central Role & Central Role
          Low Duty Cycle Directed Advertising State
          Connectable Advertising State
            and Initiating State
            and Central Role & Peripheral Role
          High Duty Cycle Directed Advertising State
            and Initiating State
            and Central Role & Peripheral Role
          Low Duty Cycle Directed Advertising State
            and Initiating State
            and Central Role & Peripheral Role
          Connectable Advertising State
            and Connection State (Central Role)
            and Central Role & Peripheral Role
          High Duty Cycle Directed Advertising State
            and Connection State (Central Role)
            and Central Role & Peripheral Role
          Low Duty Cycle Directed Advertising State
            and Connection State (Central Role)
            and Central Role & Peripheral Role
          Connectable Advertising State
            and Connection State (Peripheral Role)
            and Central Role & Peripheral Role
          High Duty Cycle Directed Advertising State
            and Connection State (Peripheral Role)
            and Peripheral Role & Peripheral Role
          Low Duty Cycle Directed Advertising State
            and Connection State (Peripheral Role)
            and Peripheral Role & Peripheral Role
          Initiating State
            and Connection State (Peripheral Role)
            and Central Role & Peripheral Role
< HCI Command: LE Read Maximum Data.. (0x08|0x002f) plen 0  #23 [hci1] 1.514865
> HCI Event: Command Complete (0x0e) plen 12                #24 [hci1] 1.515447
      LE Read Maximum Data Length (0x08|0x002f) ncmd 1
        Status: Success (0x00)
        Max TX octets: 251
        Max TX time: 2704
        Max RX octets: 251
        Max RX time: 2704
< HCI Command: LE Write Suggested D.. (0x08|0x0024) plen 4  #25 [hci1] 1.534867
        TX octets: 251
        TX time: 2704
> HCI Event: Command Complete (0x0e) plen 4                 #26 [hci1] 1.535332
      LE Write Suggested Default Data Length (0x08|0x0024) ncmd 1
        Status: Success (0x00)
< HCI Command: LE Read Resolving Li.. (0x08|0x002a) plen 0  #27 [hci1] 1.554873
> HCI Event: Command Complete (0x0e) plen 5                 #28 [hci1] 1.555335
      LE Read Resolving List Size (0x08|0x002a) ncmd 1
        Status: Success (0x00)
        Size: 8
< HCI Command: LE Set Event Mask (0x08|0x0001) plen 8       #29 [hci1] 1.574864
        Mask: 0x000002023f87fa5e
          LE Advertising Report
          LE Connection Update Complete
          LE Read Remote Used Features Complete
          LE Long Term Key Request
          LE Data Length Change
          LE Enhanced Connection Complete
          LE PHY Update Complete
          LE Extended Advertising Report
          LE Periodic Advertising Sync Established
          LE Periodic Advertising Report
          LE Periodic Advertising Sync Lost
          LE Extended Scan Timeout
          LE Extended Advertising Set Terminated
          LE Scan Request Received
          LE Periodic Advertising Sync Transfer Rvc
          LE CIS Established
          LE CIS Request
          LE Create BIG Complete
          LE Terminate BIG Complete
          LE BIG Sync Estabilished Complete
          LE BIG Sync Lost
          LE BIG Info Advertising Report
          Unknown mask (0x0000020000000000)
> HCI Event: Command Complete (0x0e) plen 4                 #30 [hci1] 1.575375
      LE Set Event Mask (0x08|0x0001) ncmd 1
        Status: Success (0x00)
< HCI Command: Set Event Mask (0x03|0x0001) plen 8          #31 [hci1] 1.594806
        Mask: 0x2000800002008890
          Disconnection Complete
          Encryption Change
          Read Remote Version Information Complete
          Hardware Error
          Data Buffer Overflow
          Encryption Key Refresh Complete
          LE Meta
> HCI Event: Command Complete (0x0e) plen 4                 #32 [hci1] 1.595469
      Set Event Mask (0x03|0x0001) ncmd 1
        Status: Success (0x00)
< HCI Command: Read BD ADDR (0x04|0x0009) plen 0            #33 [hci1] 1.614864
> HCI Event: Command Complete (0x0e) plen 10                #34 [hci1] 1.615442
      Read BD ADDR (0x04|0x0009) ncmd 1
        Status: Success (0x00)
        Address: 00:00:00:00:00:00 (OUI 00-00-00)
< HCI Command: LE Set Random Address (0x08|0x0005) plen 6   #35 [hci1] 1.634875
        Address: D5:B6:CC:31:DB:3B (Static)
> HCI Event: Command Complete (0x0e) plen 4                 #36 [hci1] 1.635434
      LE Set Random Address (0x08|0x0005) ncmd 1
        Status: Success (0x00)
< HCI Command: LE Set Extended Adv.. (0x08|0x0036) plen 25  #37 [hci1] 4.085300
        Handle: 0x00
        Properties: 0x0013
          Connectable
          Scannable
          Use legacy advertising PDUs: ADV_IND
        Min advertising interval: 100.000 msec (0x00a0)
        Max advertising interval: 150.000 msec (0x00f0)
        Channel map: 37, 38, 39 (0x07)
        Own address type: Random (0x01)
        Peer address type: Public (0x00)
        Peer address: 00:00:00:00:00:00 (OUI 00-00-00)
        Filter policy: Allow Scan Request from Any, Allow Connect Request from Any (0x00)
        TX power: Host has no preference (0x7f)
        Primary PHY: LE 1M (0x01)
        Secondary max skip: 0x00
        Secondary PHY: LE 1M (0x01)
        SID: 0x00
        Scan request notifications: Disabled (0x00)
> HCI Event: Command Complete (0x0e) plen 5                 #38 [hci1] 4.086270
      LE Set Extended Advertising Parameters (0x08|0x0036) ncmd 1
        Status: Success (0x00)
        TX power (selected): 0 dbm (0x00)
< HCI Command: LE Set Advertising S.. (0x08|0x0035) plen 7  #39 [hci1] 4.095206
        Advertising handle: 0x00
        Advertising random address: D5:B6:CC:31:DB:3B (Static)
> HCI Event: Command Complete (0x0e) plen 4                 #40 [hci1] 4.095738
      LE Set Advertising Set Random Address (0x08|0x0035) ncmd 1
        Status: Success (0x00)
< HCI Command: LE Set Extended Adv.. (0x08|0x0037) plen 22  #41 [hci1] 4.114978
        Handle: 0x00
        Operation: Complete extended advertising data (0x03)
        Fragment preference: Minimize fragmentation (0x01)
        Data length: 0x12
        Flags: 0x06
          LE General Discoverable Mode
          BR/EDR Not Supported
        Name (complete): Tester_F6B11A
> HCI Event: Command Complete (0x0e) plen 4                 #42 [hci1] 4.115746
      LE Set Extended Advertising Data (0x08|0x0037) ncmd 1
        Status: Success (0x00)
< HCI Command: LE Set Extended Scan.. (0x08|0x0038) plen 4  #43 [hci1] 4.134877
        Handle: 0x00
        Operation: Complete scan response data (0x03)
        Fragment preference: Minimize fragmentation (0x01)
        Data length: 0x00
> HCI Event: Command Complete (0x0e) plen 4                 #44 [hci1] 4.135354
      LE Set Extended Scan Response Data (0x08|0x0038) ncmd 1
        Status: Success (0x00)
< HCI Command: LE Set Extended Adve.. (0x08|0x0039) plen 6  #45 [hci1] 4.154922
        Extended advertising: Enabled (0x01)
        Number of sets: 1 (0x01)
        Entry 0
          Handle: 0x00
          Duration: 0 ms (0x00)
          Max ext adv events: 0
> HCI Event: Command Complete (0x0e) plen 4                 #46 [hci1] 4.155472
      LE Set Extended Advertising Enable (0x08|0x0039) ncmd 1
        Status: Success (0x00)
> HCI Event: LE Meta Event (0x3e) plen 31                   #47 [hci1] 4.274886
      LE Enhanced Connection Complete (0x0a)
        Status: Success (0x00)
        Handle: 21
        Role: Peripheral (0x01)
        Peer address type: Public (0x00)
        Peer address: DF:A9:FF:F6:B1:1A (OUI DF-A9-FF)
        Local resolvable private address: 00:00:00:00:00:00 (Non-Resolvable)
        Peer resolvable private address: 00:00:00:00:00:00 (Non-Resolvable)
        Connection interval: 87.50 msec (0x0046)
        Connection latency: 0 (0x0000)
        Supervision timeout: 25120 msec (0x09d0)
        Central clock accuracy: 0x01
> HCI Event: LE Meta Event (0x3e) plen 6                    #48 [hci1] 4.275005
      LE Advertising Set Terminated (0x12)
        Status: Success (0x00)
        Handle: 0
        Connection handle: 21
        Number of completed extended advertising events: 0
< HCI Command: LE Read Remote Used... (0x08|0x0016) plen 2  #49 [hci1] 4.295921
        Handle: 21 Address: DF:A9:FF:F6:B1:1A (OUI DF-A9-FF)
< ACL Data TX: Handle 21 flags 0x00 dlen 7                  #50 [hci1] 4.295944
      ATT: Exchange MTU Request (0x02) len 2
        Client RX MTU: 251
> HCI Event: Command Status (0x0f) plen 4                   #51 [hci1] 4.296495
      LE Read Remote Used Features (0x08|0x0016) ncmd 1
        Status: Success (0x00)
> HCI Event: Number of Completed Packets (0x13) plen 5      #52 [hci1] 4.450917
        Num handles: 1
        Handle: 21 Address: DF:A9:FF:F6:B1:1A (OUI DF-A9-FF)
        Count: 1
        #50: len 7 (0 Kb/s)
        Latency: 154 msec (154-154 msec ~154 msec)
> HCI Event: LE Meta Event (0x3e) plen 12                   #53 [hci1] 4.538846
      LE Read Remote Used Features (0x04)
        Status: Success (0x00)
        Handle: 21 Address: DF:A9:FF:F6:B1:1A (OUI DF-A9-FF)
        Features: 0x2d 0x49 0x00 0xf7 0x67 0xd8 0x00 0x00
          LE Encryption
          Extended Reject Indication
          Peripheral-initiated Features Exchange
          LE Data Packet Length Extension
          LE 2M PHY
          LE Coded PHY
          Channel Selection Algorithm #2
          Periodic Advertising Sync Transfer - Sender
          Periodic Advertising Sync Transfer - Recipient
          Sleep Clock Accuracy Updates
          Connected Isochronous Stream - Central
          Connected Isochronous Stream - Peripheral
          Isochronous Broadcaster
          Synchronized Receiver
          Connected Isochronous Stream (Host Support)
          LE Power Control Request
          LE Power Control Request
          Connection Subrating
          Connection Subrating (Host Support)
          Unknown features (0x0000d80000000000)
> ACL Data RX: Handle 21 flags 0x02 dlen 11                 #54 [hci1] 6.988438
      SMP: Pairing Request (0x01) len 6
        IO capability: KeyboardDisplay (0x04)
        OOB data: Authentication data not present (0x00)
        Authentication requirement: Bonding, MITM, SC, No Keypresses (0x0d)
        Max encryption key size: 16
        Initiator key distribution: EncKey IdKey (0x03)
        Responder key distribution: EncKey IdKey Sign (0x07)
> ACL Data RX: Handle 21 flags 0x02 dlen 7                  #55 [hci1] 6.988873
      ATT: Exchange MTU Response (0x03) len 2
        Server RX MTU: 23
< HCI Command: Host Number of Compl.. (0x03|0x0035) plen 5  #56 [hci1] 6.995052
        Num handles: 1
        Handle: 21 Address: DF:A9:FF:F6:B1:1A (OUI DF-A9-FF)
        Count: 1
< ACL Data TX: Handle 21 flags 0x00 dlen 11                 #57 [hci1] 6.995159
      SMP: Pairing Response (0x02) len 6
        IO capability: DisplayOnly (0x00)
        OOB data: Authentication data not present (0x00)
        Authentication requirement: Bonding, No MITM, SC, No Keypresses (0x09)
        Max encryption key size: 16
        Initiator key distribution: IdKey (0x02)
        Responder key distribution: <none> (0x00)
< HCI Command: Host Number of Compl.. (0x03|0x0035) plen 5  #58 [hci1] 6.995240
        Num handles: 1
        Handle: 21 Address: DF:A9:FF:F6:B1:1A (OUI DF-A9-FF)
        Count: 1
> HCI Event: Number of Completed Packets (0x13) plen 5      #59 [hci1] 7.163532
        Num handles: 1
        Handle: 21 Address: DF:A9:FF:F6:B1:1A (OUI DF-A9-FF)
        Count: 1
        #57: len 11 (0 Kb/s)
        Latency: 168 msec (154-168 msec ~161 msec)
> ACL Data RX: Handle 21 flags 0x02 dlen 27                 #60 [hci1] 7.163842
> ACL Data RX: Handle 21 flags 0x01 dlen 27                 #61 [hci1] 7.164300
> ACL Data RX: Handle 21 flags 0x01 dlen 15                 #62 [hci1] 7.164810
      SMP: Pairing Public Key (0x0c) len 64
        X: 4ee9cde281d4ef45c0c44755161ebfabce5cd9c82b8b28bf2cd78f8781d3c51c
        Y: 6c2031d19348489ecc9c1f227dd4a115aeee613d316ba2a28a07a832923934e9
< HCI Command: Host Number of Compl.. (0x03|0x0035) plen 5  #63 [hci1] 7.175489
        Num handles: 1
        Handle: 21 Address: DF:A9:FF:F6:B1:1A (OUI DF-A9-FF)
        Count: 1
< HCI Command: Host Number of Compl.. (0x03|0x0035) plen 5  #64 [hci1] 7.175652
        Num handles: 1
        Handle: 21 Address: DF:A9:FF:F6:B1:1A (OUI DF-A9-FF)
        Count: 1
< HCI Command: Host Number of Compl.. (0x03|0x0035) plen 5  #65 [hci1] 7.176003
        Num handles: 1
        Handle: 21 Address: DF:A9:FF:F6:B1:1A (OUI DF-A9-FF)
        Count: 1
< ACL Data TX: Handle 21 flags 0x00 dlen 27                 #66 [hci1] 7.176123
< ACL Data TX: Handle 21 flags 0x01 dlen 27                 #67 [hci1] 7.176151
< ACL Data TX: Handle 21 flags 0x01 dlen 15                 #68 [hci1] 7.176175
      SMP: Pairing Public Key (0x0c) len 64
        X: 98308440221e2d910f0e54b71e7ec652857aa9b5a0dc65028824cc19db1226e9
        Y: 67a4816bcb62efb21701e31fdb27561a6217575fb007a8bbdabe7e28b6f68482
> HCI Event: Number of Completed Packets (0x13) plen 5      #69 [hci1] 7.251376
        Num handles: 1
        Handle: 21 Address: DF:A9:FF:F6:B1:1A (OUI DF-A9-FF)
        Count: 1
        #66: len 27 (2 Kb/s)
        Latency: 75 msec (75-168 msec ~118 msec)
> HCI Event: Number of Completed Packets (0x13) plen 5      #70 [hci1] 7.252124
        Num handles: 1
        Handle: 21 Address: DF:A9:FF:F6:B1:1A (OUI DF-A9-FF)
        Count: 1
        #67: len 27 (2 Kb/s)
        Latency: 75 msec (75-168 msec ~97 msec)
> HCI Event: Number of Completed Packets (0x13) plen 5      #71 [hci1] 7.338270
        Num handles: 1
        Handle: 21 Address: DF:A9:FF:F6:B1:1A (OUI DF-A9-FF)
        Count: 1
        #68: len 15 (0 Kb/s)
        Latency: 162 msec (75-168 msec ~129 msec)
> ACL Data RX: Handle 21 flags 0x02 dlen 21                 #72 [hci1] 8.301102
      SMP: Pairing Confirm (0x03) len 16
        Confim value: 2da87f19238c086875767ca893be9fa0
< HCI Command: Host Number of Compl.. (0x03|0x0035) plen 5  #73 [hci1] 8.315351
        Num handles: 1
        Handle: 21 Address: DF:A9:FF:F6:B1:1A (OUI DF-A9-FF)
        Count: 1
< ACL Data TX: Handle 21 flags 0x00 dlen 21                 #74 [hci1] 8.315470
      SMP: Pairing Confirm (0x03) len 16
        Confim value: 604fa5beccbb42c466bdd9cc021b8f68
> HCI Event: Number of Completed Packets (0x13) plen 5      #75 [hci1] 8.475883
        Num handles: 1
        Handle: 21 Address: DF:A9:FF:F6:B1:1A (OUI DF-A9-FF)
        Count: 1
        #74: len 21 (1 Kb/s)
        Latency: 160 msec (75-168 msec ~145 msec)
> ACL Data RX: Handle 21 flags 0x02 dlen 21                 #76 [hci1] 8.476263
      SMP: Pairing Random (0x04) len 16
        Random value: 5389eca773f63dc50000000000000000
< HCI Command: Host Number of Compl.. (0x03|0x0035) plen 5  #77 [hci1] 8.495342
        Num handles: 1
        Handle: 21 Address: DF:A9:FF:F6:B1:1A (OUI DF-A9-FF)
        Count: 1
< ACL Data TX: Handle 21 flags 0x00 dlen 21                 #78 [hci1] 8.495392
      SMP: Pairing Random (0x04) len 16
        Random value: 8e6108f966a694cbe26df70bb96773e6
> HCI Event: Number of Completed Packets (0x13) plen 5      #79 [hci1] 8.650778
        Num handles: 1
        Handle: 21 Address: DF:A9:FF:F6:B1:1A (OUI DF-A9-FF)
        Count: 1
        #78: len 21 (1 Kb/s)
        Latency: 155 msec (75-168 msec ~150 msec)
> ACL Data RX: Handle 21 flags 0x02 dlen 21                 #80 [hci1] 8.738607
      SMP: Pairing Confirm (0x03) len 16
        Confim value: 6fa406244cbb426d5f8cff844c18f4c6
< HCI Command: Host Number of Compl.. (0x03|0x0035) plen 5  #81 [hci1] 8.755503
        Num handles: 1
        Handle: 21 Address: DF:A9:FF:F6:B1:1A (OUI DF-A9-FF)
        Count: 1
< ACL Data TX: Handle 21 flags 0x00 dlen 21                 #82 [hci1] 8.755745
      SMP: Pairing Confirm (0x03) len 16
        Confim value: 3377ad1eb1ccc96f45707f9e05302189
> HCI Event: Number of Completed Packets (0x13) plen 5      #83 [hci1] 8.913371
        Num handles: 1
        Handle: 21 Address: DF:A9:FF:F6:B1:1A (OUI DF-A9-FF)
        Count: 1
        #82: len 21 (1 Kb/s)
        Latency: 157 msec (75-168 msec ~153 msec)
> ACL Data RX: Handle 21 flags 0x02 dlen 21                 #84 [hci1] 8.913736
      SMP: Pairing Random (0x04) len 16
        Random value: 50505b62b62973760000000000000000
< HCI Command: Host Number of Compl.. (0x03|0x0035) plen 5  #85 [hci1] 8.915609
        Num handles: 1
        Handle: 21 Address: DF:A9:FF:F6:B1:1A (OUI DF-A9-FF)
        Count: 1
< ACL Data TX: Handle 21 flags 0x00 dlen 21                 #86 [hci1] 8.915631
      SMP: Pairing Random (0x04) len 16
        Random value: 4d02679f89a05211af56d8b3da64d21e
> HCI Event: Number of Completed Packets (0x13) plen 5      #87 [hci1] 9.088166
        Num handles: 1
        Handle: 21 Address: DF:A9:FF:F6:B1:1A (OUI DF-A9-FF)
        Count: 1
        #86: len 21 (0 Kb/s)
        Latency: 172 msec (75-172 msec ~163 msec)
> ACL Data RX: Handle 21 flags 0x02 dlen 21                 #88 [hci1] 9.176073
      SMP: Pairing Confirm (0x03) len 16
        Confim value: 7345c081f1e86e19c9b0f917f520ab5e
< HCI Command: Host Number of Compl.. (0x03|0x0035) plen 5  #89 [hci1] 9.195457
        Num handles: 1
        Handle: 21 Address: DF:A9:FF:F6:B1:1A (OUI DF-A9-FF)
        Count: 1
< ACL Data TX: Handle 21 flags 0x00 dlen 21                 #90 [hci1] 9.195715
      SMP: Pairing Confirm (0x03) len 16
        Confim value: 46ade8fc3b1b499807b760021692d7ff
> HCI Event: Number of Completed Packets (0x13) plen 5      #91 [hci1] 9.350905
        Num handles: 1
        Handle: 21 Address: DF:A9:FF:F6:B1:1A (OUI DF-A9-FF)
        Count: 1
        #90: len 21 (1 Kb/s)
        Latency: 155 msec (75-172 msec ~159 msec)
> ACL Data RX: Handle 21 flags 0x02 dlen 21                 #92 [hci1] 9.351217
      SMP: Pairing Random (0x04) len 16
        Random value: c5108095f53b45e10000000000000000
< HCI Command: Host Number of Compl.. (0x03|0x0035) plen 5  #93 [hci1] 9.355547
        Num handles: 1
        Handle: 21 Address: DF:A9:FF:F6:B1:1A (OUI DF-A9-FF)
        Count: 1
< ACL Data TX: Handle 21 flags 0x00 dlen 21                 #94 [hci1] 9.355646
      SMP: Pairing Random (0x04) len 16
        Random value: 5e8286bc235a02440d0c3424a2acf8fd
> HCI Event: Number of Completed Packets (0x13) plen 5      #95 [hci1] 9.525624
        Num handles: 1
        Handle: 21 Address: DF:A9:FF:F6:B1:1A (OUI DF-A9-FF)
        Count: 1
        #94: len 21 (0 Kb/s)
        Latency: 169 msec (75-172 msec ~164 msec)
> ACL Data RX: Handle 21 flags 0x02 dlen 21                 #96 [hci1] 9.613533
      SMP: Pairing Confirm (0x03) len 16
        Confim value: 82b02dcde1d6e9bd289539fea8677e34
< HCI Command: Host Number of Compl.. (0x03|0x0035) plen 5  #97 [hci1] 9.615226
        Num handles: 1
        Handle: 21 Address: DF:A9:FF:F6:B1:1A (OUI DF-A9-FF)
        Count: 1
< ACL Data TX: Handle 21 flags 0x00 dlen 21                 #98 [hci1] 9.615334
      SMP: Pairing Confirm (0x03) len 16
        Confim value: 7668730ec2d61bee4099e4dec848abd4
> HCI Event: Number of Completed Packets (0x13) plen 5      #99 [hci1] 9.788337
        Num handles: 1
        Handle: 21 Address: DF:A9:FF:F6:B1:1A (OUI DF-A9-FF)
        Count: 1
        #98: len 21 (0 Kb/s)
        Latency: 173 msec (75-173 msec ~168 msec)
> ACL Data RX: Handle 21 flags 0x02 dlen 21                #100 [hci1] 9.788788
      SMP: Pairing Random (0x04) len 16
        Random value: e58c2f425319c3240000000000000000
< HCI Command: Host Number of Comp.. (0x03|0x0035) plen 5  #101 [hci1] 9.795692
        Num handles: 1
        Handle: 21 Address: DF:A9:FF:F6:B1:1A (OUI DF-A9-FF)
        Count: 1
< ACL Data TX: Handle 21 flags 0x00 dlen 21                #102 [hci1] 9.795852
      SMP: Pairing Random (0x04) len 16
        Random value: 5c4a1bcadd27bd58e945097b00bad7ac
> HCI Event: Number of Completed Packets (0x13) plen 5     #103 [hci1] 9.963171
        Num handles: 1
        Handle: 21 Address: DF:A9:FF:F6:B1:1A (OUI DF-A9-FF)
        Count: 1
        #102: len 21 (1 Kb/s)
        Latency: 167 msec (75-173 msec ~168 msec)
> ACL Data RX: Handle 21 flags 0x02 dlen 21               #104 [hci1] 10.050975
      SMP: Pairing Confirm (0x03) len 16
        Confim value: 586dd804665a3c5f139576e8bc75ffd6
< HCI Command: Host Number of Com.. (0x03|0x0035) plen 5  #105 [hci1] 10.055495
        Num handles: 1
        Handle: 21 Address: DF:A9:FF:F6:B1:1A (OUI DF-A9-FF)
        Count: 1
< ACL Data TX: Handle 21 flags 0x00 dlen 21               #106 [hci1] 10.055699
      SMP: Pairing Confirm (0x03) len 16
        Confim value: c31748fce30e16b86dfaf9151b2ccfd9
> HCI Event: Number of Completed Packets (0x13) plen 5    #107 [hci1] 10.225860
        Num handles: 1
        Handle: 21 Address: DF:A9:FF:F6:B1:1A (OUI DF-A9-FF)
        Count: 1
        #106: len 21 (0 Kb/s)
        Latency: 170 msec (75-173 msec ~169 msec)
> ACL Data RX: Handle 21 flags 0x02 dlen 21               #108 [hci1] 10.226154
      SMP: Pairing Random (0x04) len 16
        Random value: 5346cffd36a1a86e0000000000000000
< HCI Command: Host Number of Com.. (0x03|0x0035) plen 5  #109 [hci1] 10.235716
        Num handles: 1
        Handle: 21 Address: DF:A9:FF:F6:B1:1A (OUI DF-A9-FF)
        Count: 1
< ACL Data TX: Handle 21 flags 0x00 dlen 21               #110 [hci1] 10.235815
      SMP: Pairing Random (0x04) len 16
        Random value: 32527e6e64e79f33b2e374394db8ab2d
> HCI Event: Number of Completed Packets (0x13) plen 5    #111 [hci1] 10.400566
        Num handles: 1
        Handle: 21 Address: DF:A9:FF:F6:B1:1A (OUI DF-A9-FF)
        Count: 1
        #110: len 21 (1 Kb/s)
        Latency: 164 msec (75-173 msec ~166 msec)
> ACL Data RX: Handle 21 flags 0x02 dlen 21               #112 [hci1] 10.488515
      SMP: Pairing Confirm (0x03) len 16
        Confim value: c0b4b9f2075220e9400f3a28aaece9ed
< HCI Command: Host Number of Com.. (0x03|0x0035) plen 5  #113 [hci1] 10.495051
        Num handles: 1
        Handle: 21 Address: DF:A9:FF:F6:B1:1A (OUI DF-A9-FF)
        Count: 1
< ACL Data TX: Handle 21 flags 0x00 dlen 21               #114 [hci1] 10.495060
      SMP: Pairing Confirm (0x03) len 16
        Confim value: 21e9e753e03518de52049725ae70fb5c
> HCI Event: Number of Completed Packets (0x13) plen 5    #115 [hci1] 10.663382
        Num handles: 1
        Handle: 21 Address: DF:A9:FF:F6:B1:1A (OUI DF-A9-FF)
        Count: 1
        #114: len 21 (1 Kb/s)
        Latency: 168 msec (75-173 msec ~167 msec)
> ACL Data RX: Handle 21 flags 0x02 dlen 21               #116 [hci1] 10.663728
      SMP: Pairing Random (0x04) len 16
        Random value: 7f72e777d2389a230000000000000000
< HCI Command: Host Number of Com.. (0x03|0x0035) plen 5  #117 [hci1] 10.675681
        Num handles: 1
        Handle: 21 Address: DF:A9:FF:F6:B1:1A (OUI DF-A9-FF)
        Count: 1
< ACL Data TX: Handle 21 flags 0x00 dlen 21               #118 [hci1] 10.675754
      SMP: Pairing Random (0x04) len 16
        Random value: dddbdfe2838e9a8cc6964353c850fef7
> HCI Event: Number of Completed Packets (0x13) plen 5    #119 [hci1] 10.838120
        Num handles: 1
        Handle: 21 Address: DF:A9:FF:F6:B1:1A (OUI DF-A9-FF)
        Count: 1
        #118: len 21 (1 Kb/s)
        Latency: 162 msec (75-173 msec ~164 msec)
> ACL Data RX: Handle 21 flags 0x02 dlen 21               #120 [hci1] 10.925948
      SMP: Pairing Confirm (0x03) len 16
        Confim value: 78038a9b910d3f77cade7da7d8bd44f6
< HCI Command: Host Number of Com.. (0x03|0x0035) plen 5  #121 [hci1] 10.935189
        Num handles: 1
        Handle: 21 Address: DF:A9:FF:F6:B1:1A (OUI DF-A9-FF)
        Count: 1
< ACL Data TX: Handle 21 flags 0x00 dlen 21               #122 [hci1] 10.935333
      SMP: Pairing Confirm (0x03) len 16
        Confim value: 9fabada30604cc24c74398e84e8aab5c
> HCI Event: Number of Completed Packets (0x13) plen 5    #123 [hci1] 11.100854
        Num handles: 1
        Handle: 21 Address: DF:A9:FF:F6:B1:1A (OUI DF-A9-FF)
        Count: 1
        #122: len 21 (1 Kb/s)
        Latency: 165 msec (75-173 msec ~165 msec)
> ACL Data RX: Handle 21 flags 0x02 dlen 21               #124 [hci1] 11.101102
      SMP: Pairing Random (0x04) len 16
        Random value: 83b29470b9eb002a0000000000000000
< HCI Command: Host Number of Com.. (0x03|0x0035) plen 5  #125 [hci1] 11.115730
        Num handles: 1
        Handle: 21 Address: DF:A9:FF:F6:B1:1A (OUI DF-A9-FF)
        Count: 1
< ACL Data TX: Handle 21 flags 0x00 dlen 21               #126 [hci1] 11.115837
      SMP: Pairing Random (0x04) len 16
        Random value: eb9f1915536596b6fc3db1c86b2b1970
> HCI Event: Number of Completed Packets (0x13) plen 5    #127 [hci1] 11.275655
        Num handles: 1
        Handle: 21 Address: DF:A9:FF:F6:B1:1A (OUI DF-A9-FF)
        Count: 1
        #126: len 21 (1 Kb/s)
        Latency: 159 msec (75-173 msec ~162 msec)
> ACL Data RX: Handle 21 flags 0x02 dlen 21               #128 [hci1] 11.363544
      SMP: Pairing Confirm (0x03) len 16
        Confim value: 97c87afb02d41bb0cf05edf6cf36159d
< HCI Command: Host Number of Com.. (0x03|0x0035) plen 5  #129 [hci1] 11.375509
        Num handles: 1
        Handle: 21 Address: DF:A9:FF:F6:B1:1A (OUI DF-A9-FF)
        Count: 1
< ACL Data TX: Handle 21 flags 0x00 dlen 21               #130 [hci1] 11.375691
      SMP: Pairing Confirm (0x03) len 16
        Confim value: 04c4a292310dbd73d7597289210a1e08
> HCI Event: Number of Completed Packets (0x13) plen 5    #131 [hci1] 11.538472
        Num handles: 1
        Handle: 21 Address: DF:A9:FF:F6:B1:1A (OUI DF-A9-FF)
        Count: 1
        #130: len 21 (1 Kb/s)
        Latency: 162 msec (75-173 msec ~162 msec)
> ACL Data RX: Handle 21 flags 0x02 dlen 21               #132 [hci1] 11.538633
      SMP: Pairing Random (0x04) len 16
        Random value: cae4a18ba199c5250000000000000000
< HCI Command: Host Number of Com.. (0x03|0x0035) plen 5  #133 [hci1] 11.555629
        Num handles: 1
        Handle: 21 Address: DF:A9:FF:F6:B1:1A (OUI DF-A9-FF)
        Count: 1
< ACL Data TX: Handle 21 flags 0x00 dlen 21               #134 [hci1] 11.555752
      SMP: Pairing Random (0x04) len 16
        Random value: 5c794dc9ad9f2c3f295ebd5ad5e1c3cf
> HCI Event: Number of Completed Packets (0x13) plen 5    #135 [hci1] 11.713051
        Num handles: 1
        Handle: 21 Address: DF:A9:FF:F6:B1:1A (OUI DF-A9-FF)
        Count: 1
        #134: len 21 (1 Kb/s)
        Latency: 157 msec (75-173 msec ~159 msec)
> ACL Data RX: Handle 21 flags 0x02 dlen 21               #136 [hci1] 11.801019
      SMP: Pairing Confirm (0x03) len 16
        Confim value: e8f69d87bc26ca6391322d92f7bf1b0e
< HCI Command: Host Number of Com.. (0x03|0x0035) plen 5  #137 [hci1] 11.815158
        Num handles: 1
        Handle: 21 Address: DF:A9:FF:F6:B1:1A (OUI DF-A9-FF)
        Count: 1
< ACL Data TX: Handle 21 flags 0x00 dlen 21               #138 [hci1] 11.815306
      SMP: Pairing Confirm (0x03) len 16
        Confim value: 5fc932d3ac62383b756fdc7725bfa444
> HCI Event: Number of Completed Packets (0x13) plen 5    #139 [hci1] 11.975799
        Num handles: 1
        Handle: 21 Address: DF:A9:FF:F6:B1:1A (OUI DF-A9-FF)
        Count: 1
        #138: len 21 (1 Kb/s)
        Latency: 160 msec (75-173 msec ~160 msec)
> ACL Data RX: Handle 21 flags 0x02 dlen 21               #140 [hci1] 11.976106
      SMP: Pairing Random (0x04) len 16
        Random value: 9bf3739dcd4bf20d0000000000000000
< HCI Command: Host Number of Com.. (0x03|0x0035) plen 5  #141 [hci1] 11.995298
        Num handles: 1
        Handle: 21 Address: DF:A9:FF:F6:B1:1A (OUI DF-A9-FF)
        Count: 1
< ACL Data TX: Handle 21 flags 0x00 dlen 21               #142 [hci1] 11.995398
      SMP: Pairing Random (0x04) len 16
        Random value: 5c2fff312cdf99c9491988e877355a9a
> HCI Event: Number of Completed Packets (0x13) plen 5    #143 [hci1] 12.150595
        Num handles: 1
        Handle: 21 Address: DF:A9:FF:F6:B1:1A (OUI DF-A9-FF)
        Count: 1
        #142: len 21 (1 Kb/s)
        Latency: 155 msec (75-173 msec ~157 msec)
> ACL Data RX: Handle 21 flags 0x02 dlen 21               #144 [hci1] 12.238462
      SMP: Pairing Confirm (0x03) len 16
        Confim value: 39420c40ca940e648f6ce37c7441b290
< HCI Command: Host Number of Com.. (0x03|0x0035) plen 5  #145 [hci1] 12.255472
        Num handles: 1
        Handle: 21 Address: DF:A9:FF:F6:B1:1A (OUI DF-A9-FF)
        Count: 1
< ACL Data TX: Handle 21 flags 0x00 dlen 21               #146 [hci1] 12.255638
      SMP: Pairing Confirm (0x03) len 16
        Confim value: bef478f8e374aca2ba4480b080a95955
> HCI Event: Number of Completed Packets (0x13) plen 5    #147 [hci1] 12.413280
        Num handles: 1
        Handle: 21 Address: DF:A9:FF:F6:B1:1A (OUI DF-A9-FF)
        Count: 1
        #146: len 21 (1 Kb/s)
        Latency: 157 msec (75-173 msec ~157 msec)
> ACL Data RX: Handle 21 flags 0x02 dlen 21               #148 [hci1] 12.413688
      SMP: Pairing Random (0x04) len 16
        Random value: 19e64d45f4a1991c0000000000000000
< HCI Command: Host Number of Com.. (0x03|0x0035) plen 5  #149 [hci1] 12.415703
        Num handles: 1
        Handle: 21 Address: DF:A9:FF:F6:B1:1A (OUI DF-A9-FF)
        Count: 1
< ACL Data TX: Handle 21 flags 0x00 dlen 21               #150 [hci1] 12.415812
      SMP: Pairing Random (0x04) len 16
        Random value: c629a3a987d808e808655d558dfc1155
> HCI Event: Number of Completed Packets (0x13) plen 5    #151 [hci1] 12.588197
        Num handles: 1
        Handle: 21 Address: DF:A9:FF:F6:B1:1A (OUI DF-A9-FF)
        Count: 1
        #150: len 21 (0 Kb/s)
        Latency: 172 msec (75-173 msec ~165 msec)
> ACL Data RX: Handle 21 flags 0x02 dlen 21               #152 [hci1] 12.675911
      SMP: Pairing Confirm (0x03) len 16
        Confim value: f77f98fb99702f7c460a7d35baf5c4a9
< HCI Command: Host Number of Com.. (0x03|0x0035) plen 5  #153 [hci1] 12.695245
        Num handles: 1
        Handle: 21 Address: DF:A9:FF:F6:B1:1A (OUI DF-A9-FF)
        Count: 1
< ACL Data TX: Handle 21 flags 0x00 dlen 21               #154 [hci1] 12.695408
      SMP: Pairing Confirm (0x03) len 16
        Confim value: 71bc2ef5c86c37cfaffb7cf8b0f431fd
> HCI Event: Number of Completed Packets (0x13) plen 5    #155 [hci1] 12.850956
        Num handles: 1
        Handle: 21 Address: DF:A9:FF:F6:B1:1A (OUI DF-A9-FF)
        Count: 1
        #154: len 21 (1 Kb/s)
        Latency: 155 msec (75-173 msec ~160 msec)
> ACL Data RX: Handle 21 flags 0x02 dlen 21               #156 [hci1] 12.851105
      SMP: Pairing Random (0x04) len 16
        Random value: b530db18c274eee00000000000000000
< HCI Command: Host Number of Com.. (0x03|0x0035) plen 5  #157 [hci1] 12.855665
        Num handles: 1
        Handle: 21 Address: DF:A9:FF:F6:B1:1A (OUI DF-A9-FF)
        Count: 1
< ACL Data TX: Handle 21 flags 0x00 dlen 21               #158 [hci1] 12.855765
      SMP: Pairing Random (0x04) len 16
        Random value: 92f20f6ad8f13724432c7fd6001c45ff
> HCI Event: Number of Completed Packets (0x13) plen 5    #159 [hci1] 13.025584
        Num handles: 1
        Handle: 21 Address: DF:A9:FF:F6:B1:1A (OUI DF-A9-FF)
        Count: 1
        #158: len 21 (0 Kb/s)
        Latency: 169 msec (75-173 msec ~165 msec)
> ACL Data RX: Handle 21 flags 0x02 dlen 21               #160 [hci1] 13.113330
      SMP: Pairing Confirm (0x03) len 16
        Confim value: de17158c9771961c3faccb46208025e6
< HCI Command: Host Number of Com.. (0x03|0x0035) plen 5  #161 [hci1] 13.115542
        Num handles: 1
        Handle: 21 Address: DF:A9:FF:F6:B1:1A (OUI DF-A9-FF)
        Count: 1
< ACL Data TX: Handle 21 flags 0x00 dlen 21               #162 [hci1] 13.115700
      SMP: Pairing Confirm (0x03) len 16
        Confim value: c749dae88199db7416733f72591587f9
> HCI Event: Number of Completed Packets (0x13) plen 5    #163 [hci1] 13.288224
        Num handles: 1
        Handle: 21 Address: DF:A9:FF:F6:B1:1A (OUI DF-A9-FF)
        Count: 1
        #162: len 21 (0 Kb/s)
        Latency: 172 msec (75-173 msec ~168 msec)
> ACL Data RX: Handle 21 flags 0x02 dlen 21               #164 [hci1] 13.288607
      SMP: Pairing Random (0x04) len 16
        Random value: 2905126f5b757f7b0000000000000000
< HCI Command: Host Number of Com.. (0x03|0x0035) plen 5  #165 [hci1] 13.295599
        Num handles: 1
        Handle: 21 Address: DF:A9:FF:F6:B1:1A (OUI DF-A9-FF)
        Count: 1
< ACL Data TX: Handle 21 flags 0x00 dlen 21               #166 [hci1] 13.295671
      SMP: Pairing Random (0x04) len 16
        Random value: 23ac32ebbb5e14c8a6b9622f296d277f
> HCI Event: Number of Completed Packets (0x13) plen 5    #167 [hci1] 13.463012
        Num handles: 1
        Handle: 21 Address: DF:A9:FF:F6:B1:1A (OUI DF-A9-FF)
        Count: 1
        #166: len 21 (1 Kb/s)
        Latency: 167 msec (75-173 msec ~168 msec)
> ACL Data RX: Handle 21 flags 0x02 dlen 21               #168 [hci1] 13.550899
      SMP: Pairing Confirm (0x03) len 16
        Confim value: 069855bb42261491fb6fd4fe9cfab1b5
< HCI Command: Host Number of Com.. (0x03|0x0035) plen 5  #169 [hci1] 13.555281
        Num handles: 1
        Handle: 21 Address: DF:A9:FF:F6:B1:1A (OUI DF-A9-FF)
        Count: 1
< ACL Data TX: Handle 21 flags 0x00 dlen 21               #170 [hci1] 13.555354
      SMP: Pairing Confirm (0x03) len 16
        Confim value: 69dc316133734020f7bb7f33e83981e9
> HCI Event: Number of Completed Packets (0x13) plen 5    #171 [hci1] 13.725793
        Num handles: 1
        Handle: 21 Address: DF:A9:FF:F6:B1:1A (OUI DF-A9-FF)
        Count: 1
        #170: len 21 (0 Kb/s)
        Latency: 170 msec (75-173 msec ~169 msec)
> ACL Data RX: Handle 21 flags 0x02 dlen 21               #172 [hci1] 13.726062
      SMP: Pairing Random (0x04) len 16
        Random value: 78c45e7a0b667f7b0000000000000000
< HCI Command: Host Number of Com.. (0x03|0x0035) plen 5  #173 [hci1] 13.735774
        Num handles: 1
        Handle: 21 Address: DF:A9:FF:F6:B1:1A (OUI DF-A9-FF)
        Count: 1
< ACL Data TX: Handle 21 flags 0x00 dlen 21               #174 [hci1] 13.735877
      SMP: Pairing Random (0x04) len 16
        Random value: 297efe85e67448a15f56bd27e3a3cf1d
> HCI Event: Number of Completed Packets (0x13) plen 5    #175 [hci1] 13.900556
        Num handles: 1
        Handle: 21 Address: DF:A9:FF:F6:B1:1A (OUI DF-A9-FF)
        Count: 1
        #174: len 21 (1 Kb/s)
        Latency: 164 msec (75-173 msec ~166 msec)
> ACL Data RX: Handle 21 flags 0x02 dlen 21               #176 [hci1] 13.988366
      SMP: Pairing Confirm (0x03) len 16
        Confim value: 29820a4bb97e5e6fa33ac28a8a92056d
< HCI Command: Host Number of Com.. (0x03|0x0035) plen 5  #177 [hci1] 13.995489
        Num handles: 1
        Handle: 21 Address: DF:A9:FF:F6:B1:1A (OUI DF-A9-FF)
        Count: 1
< ACL Data TX: Handle 21 flags 0x00 dlen 21               #178 [hci1] 13.995712
      SMP: Pairing Confirm (0x03) len 16
        Confim value: 6ffea19d531f4d10fb7cd186b0402acb
> HCI Event: Number of Completed Packets (0x13) plen 5    #179 [hci1] 14.163363
        Num handles: 1
        Handle: 21 Address: DF:A9:FF:F6:B1:1A (OUI DF-A9-FF)
        Count: 1
        #178: len 21 (1 Kb/s)
        Latency: 167 msec (75-173 msec ~167 msec)
> ACL Data RX: Handle 21 flags 0x02 dlen 21               #180 [hci1] 14.163536
      SMP: Pairing Random (0x04) len 16
        Random value: ac787af83d81ad860000000000000000
< HCI Command: Host Number of Com.. (0x03|0x0035) plen 5  #181 [hci1] 14.175758
        Num handles: 1
        Handle: 21 Address: DF:A9:FF:F6:B1:1A (OUI DF-A9-FF)
        Count: 1
< ACL Data TX: Handle 21 flags 0x00 dlen 21               #182 [hci1] 14.175848
      SMP: Pairing Random (0x04) len 16
        Random value: 25a9493fd3ce4faf02be7293595bb7c6
> HCI Event: Number of Completed Packets (0x13) plen 5    #183 [hci1] 14.338024
        Num handles: 1
        Handle: 21 Address: DF:A9:FF:F6:B1:1A (OUI DF-A9-FF)
        Count: 1
        #182: len 21 (1 Kb/s)
        Latency: 162 msec (75-173 msec ~164 msec)
> ACL Data RX: Handle 21 flags 0x02 dlen 21               #184 [hci1] 14.425927
      SMP: Pairing Confirm (0x03) len 16
        Confim value: 8666d4d3ffe38317edd149d51496edc8
< HCI Command: Host Number of Com.. (0x03|0x0035) plen 5  #185 [hci1] 14.435528
        Num handles: 1
        Handle: 21 Address: DF:A9:FF:F6:B1:1A (OUI DF-A9-FF)
        Count: 1
< ACL Data TX: Handle 21 flags 0x00 dlen 21               #186 [hci1] 14.435687
      SMP: Pairing Confirm (0x03) len 16
        Confim value: f954666976a480046ea997b60dd188db
> HCI Event: Number of Completed Packets (0x13) plen 5    #187 [hci1] 14.600720
        Num handles: 1
        Handle: 21 Address: DF:A9:FF:F6:B1:1A (OUI DF-A9-FF)
        Count: 1
        #186: len 21 (1 Kb/s)
        Latency: 165 msec (75-173 msec ~164 msec)
> ACL Data RX: Handle 21 flags 0x02 dlen 21               #188 [hci1] 14.601073
      SMP: Pairing Random (0x04) len 16
        Random value: b460fc939cf9d5c60000000000000000
< HCI Command: Host Number of Com.. (0x03|0x0035) plen 5  #189 [hci1] 14.615703
        Num handles: 1
        Handle: 21 Address: DF:A9:FF:F6:B1:1A (OUI DF-A9-FF)
        Count: 1
< ACL Data TX: Handle 21 flags 0x00 dlen 21               #190 [hci1] 14.615863
      SMP: Pairing Random (0x04) len 16
        Random value: 58f6b41f855a6f6c3560debd84e2affc
> HCI Event: Number of Completed Packets (0x13) plen 5    #191 [hci1] 14.775397
        Num handles: 1
        Handle: 21 Address: DF:A9:FF:F6:B1:1A (OUI DF-A9-FF)
        Count: 1
        #190: len 21 (1 Kb/s)
        Latency: 159 msec (75-173 msec ~162 msec)
> ACL Data RX: Handle 21 flags 0x02 dlen 21               #192 [hci1] 14.863415
      SMP: Pairing Confirm (0x03) len 16
        Confim value: 6b7c46733c1abca0294645c3ee3e16f3
< HCI Command: Host Number of Com.. (0x03|0x0035) plen 5  #193 [hci1] 14.875507
        Num handles: 1
        Handle: 21 Address: DF:A9:FF:F6:B1:1A (OUI DF-A9-FF)
        Count: 1
< ACL Data TX: Handle 21 flags 0x00 dlen 21               #194 [hci1] 14.875702
      SMP: Pairing Confirm (0x03) len 16
        Confim value: 417e90bb851c3358707fb032cd37cdc2
> HCI Event: Number of Completed Packets (0x13) plen 5    #195 [hci1] 15.038224
        Num handles: 1
        Handle: 21 Address: DF:A9:FF:F6:B1:1A (OUI DF-A9-FF)
        Count: 1
        #194: len 21 (1 Kb/s)
        Latency: 162 msec (75-173 msec ~162 msec)
> ACL Data RX: Handle 21 flags 0x02 dlen 21               #196 [hci1] 15.038510
      SMP: Pairing Random (0x04) len 16
        Random value: a3baa5ec09fb15370000000000000000
< HCI Command: Host Number of Com.. (0x03|0x0035) plen 5  #197 [hci1] 15.055620
        Num handles: 1
        Handle: 21 Address: DF:A9:FF:F6:B1:1A (OUI DF-A9-FF)
        Count: 1
< ACL Data TX: Handle 21 flags 0x00 dlen 21               #198 [hci1] 15.055642
      SMP: Pairing Random (0x04) len 16
        Random value: b67e7216d5bf664139eda2b542549666
> HCI Event: Number of Completed Packets (0x13) plen 5    #199 [hci1] 15.213095
        Num handles: 1
        Handle: 21 Address: DF:A9:FF:F6:B1:1A (OUI DF-A9-FF)
        Count: 1
        #198: len 21 (1 Kb/s)
        Latency: 157 msec (75-173 msec ~159 msec)
> ACL Data RX: Handle 21 flags 0x02 dlen 21               #200 [hci1] 15.300946
      SMP: Pairing Confirm (0x03) len 16
        Confim value: aa39085a5b47f53f704bd928ac79d2e1
< HCI Command: Host Number of Com.. (0x03|0x0035) plen 5  #201 [hci1] 15.315171
        Num handles: 1
        Handle: 21 Address: DF:A9:FF:F6:B1:1A (OUI DF-A9-FF)
        Count: 1
< ACL Data TX: Handle 21 flags 0x00 dlen 21               #202 [hci1] 15.315222
      SMP: Pairing Confirm (0x03) len 16
        Confim value: 06f3fdff409375052fa1f155cc8c394b
> HCI Event: Number of Completed Packets (0x13) plen 5    #203 [hci1] 15.475639
        Num handles: 1
        Handle: 21 Address: DF:A9:FF:F6:B1:1A (OUI DF-A9-FF)
        Count: 1
        #202: len 21 (1 Kb/s)
        Latency: 160 msec (75-173 msec ~160 msec)
> ACL Data RX: Handle 21 flags 0x02 dlen 21               #204 [hci1] 15.475958
      SMP: Pairing Random (0x04) len 16
        Random value: 3a7582453319cc590000000000000000
< HCI Command: Host Number of Com.. (0x03|0x0035) plen 5  #205 [hci1] 15.495156
        Num handles: 1
        Handle: 21 Address: DF:A9:FF:F6:B1:1A (OUI DF-A9-FF)
        Count: 1
< ACL Data TX: Handle 21 flags 0x00 dlen 21               #206 [hci1] 15.495164
      SMP: Pairing Random (0x04) len 16
        Random value: ed17f76500c95219dd01e09d1e63f87b
> HCI Event: Number of Completed Packets (0x13) plen 5    #207 [hci1] 15.650567
        Num handles: 1
        Handle: 21 Address: DF:A9:FF:F6:B1:1A (OUI DF-A9-FF)
        Count: 1
        #206: len 21 (1 Kb/s)
        Latency: 155 msec (75-173 msec ~157 msec)
> ACL Data RX: Handle 21 flags 0x02 dlen 21               #208 [hci1] 15.738323
      SMP: Pairing Confirm (0x03) len 16
        Confim value: 3a17cfe63ad7f4018aa1c7c4e0b6875e
< HCI Command: Host Number of Com.. (0x03|0x0035) plen 5  #209 [hci1] 15.755560
        Num handles: 1
        Handle: 21 Address: DF:A9:FF:F6:B1:1A (OUI DF-A9-FF)
        Count: 1
< ACL Data TX: Handle 21 flags 0x00 dlen 21               #210 [hci1] 15.755783
      SMP: Pairing Confirm (0x03) len 16
        Confim value: 099ccf6a16ab0f03380cb78f8fb3940a
> HCI Event: Number of Completed Packets (0x13) plen 5    #211 [hci1] 15.913283
        Num handles: 1
        Handle: 21 Address: DF:A9:FF:F6:B1:1A (OUI DF-A9-FF)
        Count: 1
        #210: len 21 (1 Kb/s)
        Latency: 157 msec (75-173 msec ~157 msec)
> ACL Data RX: Handle 21 flags 0x02 dlen 21               #212 [hci1] 15.913432
      SMP: Pairing Random (0x04) len 16
        Random value: a72a2c334d6870ef0000000000000000
< HCI Command: Host Number of Com.. (0x03|0x0035) plen 5  #213 [hci1] 15.915715
        Num handles: 1
        Handle: 21 Address: DF:A9:FF:F6:B1:1A (OUI DF-A9-FF)
        Count: 1
< ACL Data TX: Handle 21 flags 0x00 dlen 21               #214 [hci1] 15.915801
      SMP: Pairing Random (0x04) len 16
        Random value: 81d35d47e1f6006d79c974bd9d9e1ee3
> HCI Event: Number of Completed Packets (0x13) plen 5    #215 [hci1] 16.088019
        Num handles: 1
        Handle: 21 Address: DF:A9:FF:F6:B1:1A (OUI DF-A9-FF)
        Count: 1
        #214: len 21 (0 Kb/s)
        Latency: 172 msec (75-173 msec ~164 msec)
> ACL Data RX: Handle 21 flags 0x02 dlen 21               #216 [hci1] 16.175877
      SMP: Pairing Confirm (0x03) len 16
        Confim value: 17a2c84fcf2e6a533e97ff19807b9cf6
< HCI Command: Host Number of Com.. (0x03|0x0035) plen 5  #217 [hci1] 16.195444
        Num handles: 1
        Handle: 21 Address: DF:A9:FF:F6:B1:1A (OUI DF-A9-FF)
        Count: 1
< ACL Data TX: Handle 21 flags 0x00 dlen 21               #218 [hci1] 16.195602
      SMP: Pairing Confirm (0x03) len 16
        Confim value: b1e5b762b23280f8ce369be76de9fcc9
> HCI Event: Number of Completed Packets (0x13) plen 5    #219 [hci1] 16.350712
        Num handles: 1
        Handle: 21 Address: DF:A9:FF:F6:B1:1A (OUI DF-A9-FF)
        Count: 1
        #218: len 21 (1 Kb/s)
        Latency: 155 msec (75-173 msec ~160 msec)
> ACL Data RX: Handle 21 flags 0x02 dlen 21               #220 [hci1] 16.350989
      SMP: Pairing Random (0x04) len 16
        Random value: 08ca8a0db142a0e70000000000000000
< HCI Command: Host Number of Com.. (0x03|0x0035) plen 5  #221 [hci1] 16.355715
        Num handles: 1
        Handle: 21 Address: DF:A9:FF:F6:B1:1A (OUI DF-A9-FF)
        Count: 1
< ACL Data TX: Handle 21 flags 0x00 dlen 21               #222 [hci1] 16.355862
      SMP: Pairing Random (0x04) len 16
        Random value: e7f7e0c2476823e41736a7e381bafb7c
> HCI Event: Number of Completed Packets (0x13) plen 5    #223 [hci1] 16.525392
        Num handles: 1
        Handle: 21 Address: DF:A9:FF:F6:B1:1A (OUI DF-A9-FF)
        Count: 1
        #222: len 21 (0 Kb/s)
        Latency: 169 msec (75-173 msec ~164 msec)
> ACL Data RX: Handle 21 flags 0x02 dlen 21               #224 [hci1] 16.613209
      SMP: Pairing Confirm (0x03) len 16
        Confim value: 3366c02b7fc34c7894a45c08c4b29871
< HCI Command: Host Number of Com.. (0x03|0x0035) plen 5  #225 [hci1] 16.615532
        Num handles: 1
        Handle: 21 Address: DF:A9:FF:F6:B1:1A (OUI DF-A9-FF)
        Count: 1
< ACL Data TX: Handle 21 flags 0x00 dlen 21               #226 [hci1] 16.615714
      SMP: Pairing Confirm (0x03) len 16
        Confim value: 724a89ceaf2d14cce5a5240db92cd544
> HCI Event: Number of Completed Packets (0x13) plen 5    #227 [hci1] 16.788133
        Num handles: 1
        Handle: 21 Address: DF:A9:FF:F6:B1:1A (OUI DF-A9-FF)
        Count: 1
        #226: len 21 (0 Kb/s)
        Latency: 172 msec (75-173 msec ~168 msec)
> ACL Data RX: Handle 21 flags 0x02 dlen 21               #228 [hci1] 16.788472
      SMP: Pairing Random (0x04) len 16
        Random value: 93feba1649a168100000000000000000
< HCI Command: Host Number of Com.. (0x03|0x0035) plen 5  #229 [hci1] 16.795774
        Num handles: 1
        Handle: 21 Address: DF:A9:FF:F6:B1:1A (OUI DF-A9-FF)
        Count: 1
