Bluetooth monitor ver 5.84
btmon[874520]: = Note: Linux version 6.8.0-83-generic (x86_64)                                                           0.322447
btmon[874520]: = Note: Bluetooth subsystem version 2.22                                                                  0.322448
= New Index: 00:00:00:00:00:00 (Primary,UART,hci0)                                                                       0.322449
= Open Index: 00:00:00:00:00:00                                                                                          0.329791
= Index Info: 00:00:00:00:00:00 (Nordic Semiconductor ASA)                                                               0.329796
zephyr.exe[874522]: @ USER Open: main (privileged) version 2.22                                                 {0x0001} 0.329798
zephyr.exe[874522]: < HCI Command: Reset (0x03|0x0003) plen 0                                                         #1 0.329976
> HCI Event: Command Complete (0x0e) plen 4                                                                           #2 0.330717
      Reset (0x03|0x0003) ncmd 1
        Status: Success (0x00)
zephyr.exe[874522]: < HCI Command: Read Local Supported Features (0x04|0x0003) plen 0                                 #3 0.349734
> HCI Event: Command Complete (0x0e) plen 12                                                                          #4 0.350907
      Read Local Supported Features (0x04|0x0003) ncmd 1
        Status: Success (0x00)
        Features: 0x00 0x00 0x00 0x00 0x60 0x00 0x00 0x00
          BR/EDR Not Supported
          LE Supported (Controller)
zephyr.exe[874522]: < HCI Command: Read Local Version Information (0x04|0x0001) plen 0                                #5 0.369734
> HCI Event: Command Complete (0x0e) plen 12                                                                          #6 0.370343
      Read Local Version Information (0x04|0x0001) ncmd 1
        Status: Success (0x00)
        HCI version: Reserved (0x0e) - Revision 12520 (0x30e8)
        LMP version: Reserved (0x0e) - Subversion 12520 (0x30e8)
        Manufacturer: Nordic Semiconductor ASA (89)
zephyr.exe[874522]: < HCI Command: Read Local Supported Commands (0x04|0x0002) plen 0                                 #7 0.389731
> HCI Event: Command Complete (0x0e) plen 68                                                                          #8 0.390998
      Read Local Supported Commands (0x04|0x0002) ncmd 1
        Status: Success (0x00)
        Commands: 119 entries
          Disconnect (Octet 0 - Bit 5)
          Read Remote Version Information (Octet 2 - Bit 7)
          Set Event Mask (Octet 5 - Bit 6)
          Reset (Octet 5 - Bit 7)
          Read Connection Accept Timeout (Octet 7 - Bit 2)
          Write Connection Accept Timeout (Octet 7 - Bit 3)
          Read Transmit Power Level (Octet 10 - Bit 2)
          Set Controller To Host Flow Control (Octet 10 - Bit 5)
          Host Buffer Size (Octet 10 - Bit 6)
          Host Number of Completed Packets (Octet 10 - Bit 7)
          Read Local Version Information (Octet 14 - Bit 3)
          Read Local Supported Features (Octet 14 - Bit 5)
          Read BD ADDR (Octet 15 - Bit 1)
          Read RSSI (Octet 15 - Bit 5)
          Set Event Mask Page 2 (Octet 22 - Bit 2)
          LE Set Event Mask (Octet 25 - Bit 0)
          LE Read Buffer Size (Octet 25 - Bit 1)
          LE Read Local Supported Features (Octet 25 - Bit 2)
          LE Set Random Address (Octet 25 - Bit 4)
          LE Set Advertising Parameters (Octet 25 - Bit 5)
          LE Read Advertising Channel TX Power (Octet 25 - Bit 6)
          LE Set Advertising Data (Octet 25 - Bit 7)
          LE Set Scan Response Data (Octet 26 - Bit 0)
          LE Set Advertise Enable (Octet 26 - Bit 1)
          LE Set Scan Parameters (Octet 26 - Bit 2)
          LE Set Scan Enable (Octet 26 - Bit 3)
          LE Create Connection (Octet 26 - Bit 4)
          LE Create Connection Cancel (Octet 26 - Bit 5)
          LE Read Accept List Size (Octet 26 - Bit 6)
          LE Clear Accept List (Octet 26 - Bit 7)
          LE Add Device To Accept List (Octet 27 - Bit 0)
          LE Remove Device From Accept List (Octet 27 - Bit 1)
          LE Connection Update (Octet 27 - Bit 2)
          LE Set Host Channel Classification (Octet 27 - Bit 3)
          LE Read Channel Map (Octet 27 - Bit 4)
          LE Read Remote Used Features (Octet 27 - Bit 5)
          LE Encrypt (Octet 27 - Bit 6)
          LE Rand (Octet 27 - Bit 7)
          LE Start Encryption (Octet 28 - Bit 0)
          LE Long Term Key Request Reply (Octet 28 - Bit 1)
          LE Long Term Key Request Neg Reply (Octet 28 - Bit 2)
          LE Read Supported States (Octet 28 - Bit 3)
          LE Receiver Test (Octet 28 - Bit 4)
          LE Transmitter Test (Octet 28 - Bit 5)
          LE Test End (Octet 28 - Bit 6)
          Read Authenticated Payload Timeout (Octet 32 - Bit 4)
          Write Authenticated Payload Timeout (Octet 32 - Bit 5)
          LE Set Data Length (Octet 33 - Bit 6)
          LE Read Suggested Default Data Length (Octet 33 - Bit 7)
          LE Write Suggested Default Data Length (Octet 34 - Bit 0)
          LE Add Device To Resolving List (Octet 34 - Bit 3)
          LE Remove Device From Resolving List (Octet 34 - Bit 4)
          LE Clear Resolving List (Octet 34 - Bit 5)
          LE Read Resolving List Size (Octet 34 - Bit 6)
          LE Set Address Resolution Enable (Octet 35 - Bit 1)
          LE Set Resolvable Private Address Timeout (Octet 35 - Bit 2)
          LE Read Maximum Data Length (Octet 35 - Bit 3)
          LE Read PHY (Octet 35 - Bit 4)
          LE Set Default PHY (Octet 35 - Bit 5)
          LE Set PHY (Octet 35 - Bit 6)
          LE Enhanced Receiver Test (Octet 35 - Bit 7)
          LE Enhanced Transmitter Test (Octet 36 - Bit 0)
          LE Set Advertising Set Random Address (Octet 36 - Bit 1)
          LE Set Extended Advertising Parameters (Octet 36 - Bit 2)
          LE Set Extended Advertising Data (Octet 36 - Bit 3)
          LE Set Extended Scan Response Data (Octet 36 - Bit 4)
          LE Set Extended Advertising Enable (Octet 36 - Bit 5)
          LE Read Maximum Advertising Data Length (Octet 36 - Bit 6)
          LE Read Number of Supported Advertising Sets (Octet 36 - Bit 7)
          LE Remove Advertising Set (Octet 37 - Bit 0)
          LE Clear Advertising Sets (Octet 37 - Bit 1)
          LE Set Periodic Advertising Parameters (Octet 37 - Bit 2)
          LE Set Periodic Advertising Data (Octet 37 - Bit 3)
          LE Set Periodic Advertising Enable (Octet 37 - Bit 4)
          LE Set Extended Scan Parameters (Octet 37 - Bit 5)
          LE Set Extended Scan Enable (Octet 37 - Bit 6)
          LE Extended Create Connection (Octet 37 - Bit 7)
          LE Periodic Advertising Create Sync (Octet 38 - Bit 0)
          LE Periodic Advertising Create Sync Cancel (Octet 38 - Bit 1)
          LE Periodic Advertising Terminate Sync (Octet 38 - Bit 2)
          LE Add Device To Periodic Advertiser List (Octet 38 - Bit 3)
          LE Remove Device From Periodic Advertiser List (Octet 38 - Bit 4)
          LE Clear Periodic Advertiser List (Octet 38 - Bit 5)
          LE Read Periodic Advertiser List Size (Octet 38 - Bit 6)
          LE Read Transmit Power (Octet 38 - Bit 7)
          LE Read RF Path Compensation (Octet 39 - Bit 0)
          LE Write RF Path Compensation (Octet 39 - Bit 1)
          LE Set Privacy Mode (Octet 39 - Bit 2)
          LE Periodic Advertising Receive Enable (Octet 40 - Bit 5)
          LE Periodic Advertising Sync Transfer (Octet 40 - Bit 6)
          LE Periodic Advertising Set Info Transfer (Octet 40 - Bit 7)
          LE Periodic Advertising Sync Transfer Parameters (Octet 41 - Bit 0)
          LE Set Default Periodic Advertisng Sync Transfer Parameters (Octet 41 - Bit 1)
          LE Read Buffer v2 (Octet 41 - Bit 5)
          LE Read ISO TX Sync (Octet 41 - Bit 6)
          LE Set Connected Isochronous Group Parameters (Octet 41 - Bit 7)
          LE Set Connected Isochronous Group Parameters Test (Octet 42 - Bit 0)
          LE Create Connected Isochronous Stream (Octet 42 - Bit 1)
          LE Remove Connected Isochronous Group (Octet 42 - Bit 2)
          LE Accept Connected Isochronous Stream Request (Octet 42 - Bit 3)
          LE Reject Connected Isochronous Stream Request (Octet 42 - Bit 4)
          LE Create Broadcast Isochronous Group (Octet 42 - Bit 5)
          LE Create Broadcast Isochronous Group Test (Octet 42 - Bit 6)
          LE Terminate Broadcast Isochronous Group (Octet 42 - Bit 7)
          LE Broadcast Isochronous Group Create Sync (Octet 43 - Bit 0)
          LE Broadcast Isochronous Group Terminate Sync (Octet 43 - Bit 1)
          LE Request Peer SCA (Octet 43 - Bit 2)
          LE Setup Isochronous Data Path (Octet 43 - Bit 3)
          LE Remove Isochronous Data Path (Octet 43 - Bit 4)
          LE Isochronous Transmit Test (Octet 43 - Bit 5)
          LE Isochronous Receive Test (Octet 43 - Bit 6)
          LE Isochronous Read Test Counters (Octet 43 - Bit 7)
          LE Isochronous Read Test Counters (Octet 44 - Bit 0)
          LE Set Host Feature (Octet 44 - Bit 1)
          LE Read ISO link quality (Octet 44 - Bit 2)
          Octet 45 - Bit 6 
          Octet 46 - Bit 0 
          Octet 46 - Bit 1 
          Octet 46 - Bit 2 
zephyr.exe[874522]: < HCI Command: Host Buffer Size (0x03|0x0033) plen 7                                              #9 0.409730
        ACL MTU: 255  ACL max packet: 16
        SCO MTU: 0    SCO max packet: 0
> HCI Event: Command Complete (0x0e) plen 4                                                                          #10 0.410425
      Host Buffer Size (0x03|0x0033) ncmd 1
        Status: Success (0x00)
zephyr.exe[874522]: < HCI Command: Set Controller To Host Flow Control (0x03|0x0031) plen 1                          #11 0.429736
        Flow control: ACL Data Packets (0x01)
> HCI Event: Command Complete (0x0e) plen 4                                                                          #12 0.430715
      Set Controller To Host Flow Control (0x03|0x0031) ncmd 1
        Status: Success (0x00)
zephyr.exe[874522]: < HCI Command: LE Read Local Supported Features (0x08|0x0003) plen 0                             #13 0.449731
> HCI Event: Command Complete (0x0e) plen 12                                                                         #14 0.450261
      LE Read Local Supported Features (0x08|0x0003) ncmd 1
        Status: Success (0x00)
        Features: 0xfd 0x79 0x00 0xf7 0x30 0x01 0x00 0x00
          LE Encryption
          Extended Reject Indication
          Peripheral-initiated Features Exchange
          LE Ping
          LE Data Packet Length Extension
          LL Privacy
          Extended Scanner Filter Policies
          LE 2M PHY
          LE Coded PHY
          LE Extended Advertising
          LE Periodic Advertising
          Channel Selection Algorithm #2
          Periodic Advertising Sync Transfer - Sender
          Periodic Advertising Sync Transfer - Recipient
          Sleep Clock Accuracy Updates
          Connected Isochronous Stream - Central
          Connected Isochronous Stream - Peripheral
          Isochronous Broadcaster
          Synchronized Receiver
          Periodic Advertising ADI support
          Connection Subrating
          Unknown features (0x0000010000000000)
zephyr.exe[874522]: < HCI Command: LE Set Host Feature (0x08|0x0074) plen 2                                          #15 0.469734
        Bit Number: 32
          Connected Isochronous Stream (Host Support)
        Bit Value: 1
> HCI Event: Command Complete (0x0e) plen 4                                                                          #16 0.470518
      LE Set Host Feature (0x08|0x0074) ncmd 1
        Status: Success (0x00)
zephyr.exe[874522]: < HCI Command: LE Read Buffer v2 (0x08|0x0060) plen 0                                            #17 0.489737
> HCI Event: Command Complete (0x0e) plen 10                                                                         #18 0.490447
      LE Read Buffer v2 (0x08|0x0060) ncmd 1
        Status: Success (0x00)
        ACL MTU: 27
        ACL max packet: 3
        ISO MTU: 318
        ISO max packet: 3
zephyr.exe[874522]: < HCI Command: LE Read Maximum Advertising Data Length (0x08|0x003a) plen 0                      #19 0.509752
> HCI Event: Command Complete (0x0e) plen 6                                                                          #20 0.510785
      LE Read Maximum Advertising Data Length (0x08|0x003a) ncmd 1
        Status: Success (0x00)
        Max length: 1650
zephyr.exe[874522]: < HCI Command: LE Read Supported States (0x08|0x001c) plen 0                                     #21 0.529743
> HCI Event: Command Complete (0x0e) plen 12                                                                         #22 0.530454
      LE Read Supported States (0x08|0x001c) ncmd 1
        Status: Success (0x00)
        States: 0x000003ff3e0306ff
          Non-connectable Advertising State
          Scannable Advertising State
          Connectable Advertising State
          High Duty Cycle Directed Advertising State
          Passive Scanning State
          Active Scanning State
          Initiating State
            and Connection State (Central Role)
          Connection State (Peripheral Role)
          Scannable Advertising State
            and Passive Scanning State
          Connectable Advertising State
            and Passive Scanning State
          Non-connectable Advertising State
            and Initiating State
          Scannable Advertising State
            and Initiating State
          Active Scanning State
            and Connection State (Central Role)
          Passive Scanning State
            and Connection State (Peripheral Role)
          Active Scanning State
            and Connection State (Peripheral Role)
          Initiating State
            and Connection State (Central Role)
            and Central Role & Central Role
          Low Duty Cycle Directed Advertising State
          Connectable Advertising State
            and Initiating State
            and Central Role & Peripheral Role
          High Duty Cycle Directed Advertising State
            and Initiating State
            and Central Role & Peripheral Role
          Low Duty Cycle Directed Advertising State
            and Initiating State
            and Central Role & Peripheral Role
          Connectable Advertising State
            and Connection State (Central Role)
            and Central Role & Peripheral Role
          High Duty Cycle Directed Advertising State
            and Connection State (Central Role)
            and Central Role & Peripheral Role
          Low Duty Cycle Directed Advertising State
            and Connection State (Central Role)
            and Central Role & Peripheral Role
          Connectable Advertising State
            and Connection State (Peripheral Role)
            and Central Role & Peripheral Role
          High Duty Cycle Directed Advertising State
            and Connection State (Peripheral Role)
            and Peripheral Role & Peripheral Role
          Low Duty Cycle Directed Advertising State
            and Connection State (Peripheral Role)
            and Peripheral Role & Peripheral Role
          Initiating State
            and Connection State (Peripheral Role)
            and Central Role & Peripheral Role
zephyr.exe[874522]: < HCI Command: LE Read Maximum Data Length (0x08|0x002f) plen 0                                  #23 0.549742
> HCI Event: Command Complete (0x0e) plen 12                                                                         #24 0.550742
      LE Read Maximum Data Length (0x08|0x002f) ncmd 1
        Status: Success (0x00)
        Max TX octets: 251
        Max TX time: 2704
        Max RX octets: 251
        Max RX time: 2704
zephyr.exe[874522]: < HCI Command: LE Write Suggested Default Data Length (0x08|0x0024) plen 4                       #25 0.569738
        TX octets: 251
        TX time: 2704
> HCI Event: Command Complete (0x0e) plen 4                                                                          #26 0.570355
      LE Write Suggested Default Data Length (0x08|0x0024) ncmd 1
        Status: Success (0x00)
zephyr.exe[874522]: < HCI Command: LE Read Resolving List Size (0x08|0x002a) plen 0                                  #27 0.589736
> HCI Event: Command Complete (0x0e) plen 5                                                                          #28 0.590498
      LE Read Resolving List Size (0x08|0x002a) ncmd 1
        Status: Success (0x00)
        Size: 8
zephyr.exe[874522]: < HCI Command: LE Set Event Mask (0x08|0x0001) plen 8                                            #29 0.609733
        Mask: 0x000002023f87fa5e
          LE Advertising Report
          LE Connection Update Complete
          LE Read Remote Used Features Complete
          LE Long Term Key Request
          LE Data Length Change
          LE Enhanced Connection Complete
          LE PHY Update Complete
          LE Extended Advertising Report
          LE Periodic Advertising Sync Established
          LE Periodic Advertising Report
          LE Periodic Advertising Sync Lost
          LE Extended Scan Timeout
          LE Extended Advertising Set Terminated
          LE Scan Request Received
          LE Periodic Advertising Sync Transfer Rvc
          LE CIS Established
          LE CIS Request
          LE Create BIG Complete
          LE Terminate BIG Complete
          LE BIG Sync Established Complete
          LE BIG Sync Lost
          LE BIG Info Advertising Report
          Unknown mask (0x0000020000000000)
> HCI Event: Command Complete (0x0e) plen 4                                                                          #30 0.610278
      LE Set Event Mask (0x08|0x0001) ncmd 1
        Status: Success (0x00)
zephyr.exe[874522]: < HCI Command: Set Event Mask (0x03|0x0001) plen 8                                               #31 0.629747
        Mask: 0x2000800002008890
          Disconnection Complete
          Encryption Change
          Read Remote Version Information Complete
          Hardware Error
          Data Buffer Overflow
          Encryption Key Refresh Complete
          LE Meta
> HCI Event: Command Complete (0x0e) plen 4                                                                          #32 0.630594
      Set Event Mask (0x03|0x0001) ncmd 1
        Status: Success (0x00)
zephyr.exe[874522]: < HCI Command: Read BD ADDR (0x04|0x0009) plen 0                                                 #33 0.649740
> HCI Event: Command Complete (0x0e) plen 10                                                                         #34 0.650439
      Read BD ADDR (0x04|0x0009) ncmd 1
        Status: Success (0x00)
        Address: 00:00:00:00:00:00 (OUI 00-00-00)
zephyr.exe[874522]: < HCI Command: LE Set Random Address (0x08|0x0005) plen 6                                        #35 0.669723
        Address: D5:B6:CC:31:DB:3B (Static)
> HCI Event: Command Complete (0x0e) plen 4                                                                          #36 0.670366
      LE Set Random Address (0x08|0x0005) ncmd 1
        Status: Success (0x00)
zephyr.exe[874522]: < HCI Command: LE Set Extended Advertising Parameters (0x08|0x0036) plen 25                      #37 3.039771
        Handle: 0x00
        Properties: 0x0013
          Connectable
          Scannable
          Use legacy advertising PDUs: ADV_IND
        Min advertising interval: 100.000 msec (0x00a0)
        Max advertising interval: 150.000 msec (0x00f0)
        Channel map: 37, 38, 39 (0x07)
        Own address type: Random (0x01)
        Peer address type: Public (0x00)
        Peer address: 00:00:00:00:00:00 (OUI 00-00-00)
        Filter policy: Allow Scan Request from Any, Allow Connect Request from Any (0x00)
        TX power: Host has no preference (0x7f)
        Primary PHY: LE 1M (0x01)
        Secondary max skip: 0x00
        Secondary PHY: LE 1M (0x01)
        SID: 0x00
        Scan request notifications: Disabled (0x00)
> HCI Event: Command Complete (0x0e) plen 5                                                                          #38 3.040708
      LE Set Extended Advertising Parameters (0x08|0x0036) ncmd 1
        Status: Success (0x00)
        TX power (selected): 0 dbm (0x00)
zephyr.exe[874522]: < HCI Command: LE Set Advertising Set Random Address (0x08|0x0035) plen 7                        #39 3.049777
        Advertising handle: 0x00
        Advertising random address: D5:B6:CC:31:DB:3B (Static)
> HCI Event: Command Complete (0x0e) plen 4                                                                          #40 3.050512
      LE Set Advertising Set Random Address (0x08|0x0035) ncmd 1
        Status: Success (0x00)
zephyr.exe[874522]: < HCI Command: LE Set Extended Advertising Data (0x08|0x0037) plen 22                            #41 3.069762
        Handle: 0x00
        Operation: Complete extended advertising data (0x03)
        Fragment preference: Minimize fragmentation (0x01)
        Data length: 0x12
        Flags: 0x06
          LE General Discoverable Mode
          BR/EDR Not Supported
        Name (complete): Tester_F6B11A
> HCI Event: Command Complete (0x0e) plen 4                                                                          #42 3.070690
      LE Set Extended Advertising Data (0x08|0x0037) ncmd 1
        Status: Success (0x00)
zephyr.exe[874522]: < HCI Command: LE Set Extended Scan Response Data (0x08|0x0038) plen 4                           #43 3.089761
        Handle: 0x00
        Operation: Complete scan response data (0x03)
        Fragment preference: Minimize fragmentation (0x01)
        Data length: 0x00
> HCI Event: Command Complete (0x0e) plen 4                                                                          #44 3.091064
      LE Set Extended Scan Response Data (0x08|0x0038) ncmd 1
        Status: Success (0x00)
zephyr.exe[874522]: < HCI Command: LE Set Extended Advertising Enable (0x08|0x0039) plen 6                           #45 3.109771
        Extended advertising: Enabled (0x01)
        Number of sets: 1 (0x01)
        Entry 0
          Handle: 0x00
          Duration: 0 ms (0x00)
          Max ext adv events: 0
> HCI Event: Command Complete (0x0e) plen 4                                                                          #46 3.110314
      LE Set Extended Advertising Enable (0x08|0x0039) ncmd 1
        Status: Success (0x00)
> HCI Event: LE Meta Event (0x3e) plen 31                                                                            #47 3.226471
      LE Enhanced Connection Complete (0x0a)
        Status: Success (0x00)
        Handle: 453
        Role: Peripheral (0x01)
        Peer address type: Public (0x00)
        Peer address: DF:A9:FF:F6:B1:1A (OUI DF-A9-FF)
        Local resolvable private address: 00:00:00:00:00:00 (Non-Resolvable)
        Peer resolvable private address: 00:00:00:00:00:00 (Non-Resolvable)
        Connection interval: 87.50 msec (0x0046)
        Connection latency: 0 (0x0000)
        Supervision timeout: 25120 msec (0x09d0)
        Central clock accuracy: 0x01
> HCI Event: LE Meta Event (0x3e) plen 6                                                                             #48 3.226473
      LE Advertising Set Terminated (0x12)
        Status: Success (0x00)
        Handle: 0
        Connection handle: 453
        Number of completed extended advertising events: 0
zephyr.exe[874522]: < HCI Command: LE Read Remote Used Features (0x08|0x0016) plen 2                                 #49 3.229875
        Handle: 453 Address: DF:A9:FF:F6:B1:1A (OUI DF-A9-FF)
> HCI Event: Command Status (0x0f) plen 4                                                                            #50 3.230441
      LE Read Remote Used Features (0x08|0x0016) ncmd 1
        Status: Success (0x00)
zephyr.exe[874522]: < ACL Data TX: Handle 453 [1/3] flags 0x00 dlen 7                                                #51 3.249820
      ATT: Exchange MTU Request (0x02) len 2
        Client RX MTU: 251
> HCI Event: Number of Completed Packets (0x13) plen 5                                                               #52 3.402727
        Num handles: 1
        Handle: 453 Address: DF:A9:FF:F6:B1:1A (OUI DF-A9-FF)
        Count: 1
        Buffers: 0/3
        #51: len 7 (0 Kb/s)
        Latency: 152 msec (152-152 msec ~152 msec)
> HCI Event: LE Meta Event (0x3e) plen 12                                                                            #53 3.490488
      LE Read Remote Used Features (0x04)
        Status: Success (0x00)
        Handle: 453 Address: DF:A9:FF:F6:B1:1A (OUI DF-A9-FF)
        Features: 0x2d 0x49 0x00 0xf7 0x67 0xd8 0x00 0x00
          LE Encryption
          Extended Reject Indication
          Peripheral-initiated Features Exchange
          LE Data Packet Length Extension
          LE 2M PHY
          LE Coded PHY
          Channel Selection Algorithm #2
          Periodic Advertising Sync Transfer - Sender
          Periodic Advertising Sync Transfer - Recipient
          Sleep Clock Accuracy Updates
          Connected Isochronous Stream - Central
          Connected Isochronous Stream - Peripheral
          Isochronous Broadcaster
          Synchronized Receiver
          Connected Isochronous Stream (Host Support)
          LE Power Control Request
          LE Power Control Request
          Connection Subrating
          Connection Subrating (Host Support)
          Unknown features (0x0000d80000000000)
> ACL Data RX: Handle 453 flags 0x02 dlen 7                                                                          #54 3.927537
      ATT: Exchange MTU Request (0x02) len 2
        Client RX MTU: 60
> ACL Data RX: Handle 453 flags 0x02 dlen 7                                                                          #55 3.927904
      ATT: Exchange MTU Response (0x03) len 2
        Server RX MTU: 60
zephyr.exe[874522]: < HCI Command: Host Number of Completed Packets (0x03|0x0035) plen 5                             #56 3.929849
        Num handles: 1
        Handle: 453 Address: DF:A9:FF:F6:B1:1A (OUI DF-A9-FF)
        Count: 1
zephyr.exe[874522]: < ACL Data TX: Handle 453 [1/3] flags 0x00 dlen 7                                                #57 3.929875
      ATT: Exchange MTU Response (0x03) len 2
        Server RX MTU: 251
zephyr.exe[874522]: < HCI Command: Host Number of Completed Packets (0x03|0x0035) plen 5                             #58 3.929950
        Num handles: 1
        Handle: 453 Address: DF:A9:FF:F6:B1:1A (OUI DF-A9-FF)
        Count: 1
> HCI Event: Number of Completed Packets (0x13) plen 5                                                               #59 4.102603
        Num handles: 1
        Handle: 453 Address: DF:A9:FF:F6:B1:1A (OUI DF-A9-FF)
        Count: 1
        Buffers: 0/3
        #57: len 7 (0 Kb/s)
        Latency: 172 msec (152-172 msec ~162 msec)
> ACL Data RX: Handle 453 flags 0x02 dlen 11                                                                         #60 6.027533
      SMP: Pairing Request (0x01) len 6
        IO capability: KeyboardDisplay (0x04)
        OOB data: Authentication data not present (0x00)
        Authentication requirement: Bonding, MITM, SC, No Keypresses (0x0d)
        Max encryption key size: 16
        Initiator key distribution: EncKey IdKey (0x03)
        Responder key distribution: EncKey IdKey Sign (0x07)
zephyr.exe[874522]: < HCI Command: Host Number of Completed Packets (0x03|0x0035) plen 5                             #61 6.029830
        Num handles: 1
        Handle: 453 Address: DF:A9:FF:F6:B1:1A (OUI DF-A9-FF)
        Count: 1
zephyr.exe[874522]: < ACL Data TX: Handle 453 [1/3] flags 0x00 dlen 11                                               #62 6.029857
      SMP: Pairing Response (0x02) len 6
        IO capability: NoInputNoOutput (0x03)
        OOB data: Authentication data not present (0x00)
        Authentication requirement: Bonding, No MITM, SC, No Keypresses (0x09)
        Max encryption key size: 16
        Initiator key distribution: IdKey (0x02)
        Responder key distribution: Sign (0x04)
> HCI Event: Number of Completed Packets (0x13) plen 5                                                               #63 6.203338
        Num handles: 1
        Handle: 453 Address: DF:A9:FF:F6:B1:1A (OUI DF-A9-FF)
        Count: 1
        Buffers: 0/3
        #62: len 11 (0 Kb/s)
        Latency: 173 msec (152-173 msec ~168 msec)
> ACL Data RX: Handle 453 flags 0x02 dlen 27                                                                         #64 6.203568
> ACL Data RX: Handle 453 flags 0x01 dlen 27                                                                         #65 6.203762
> ACL Data RX: Handle 453 flags 0x01 dlen 15                                                                         #66 6.204426
      SMP: Pairing Public Key (0x0c) len 64
        X[32]: 78e8b8fd2cef5cec17c503b4322fe821c52b1d203bb5d776da1ce23e54627fa4
        Y[32]: 95b4934fed4c302fd17db90fd5c60a7ae6dc0fe97706e51a64997dd8f00c2a21
zephyr.exe[874522]: < HCI Command: Host Number of Completed Packets (0x03|0x0035) plen 5                             #67 6.209910
        Num handles: 1
        Handle: 453 Address: DF:A9:FF:F6:B1:1A (OUI DF-A9-FF)
        Count: 1
zephyr.exe[874522]: < HCI Command: Host Number of Completed Packets (0x03|0x0035) plen 5                             #68 6.209962
        Num handles: 1
        Handle: 453 Address: DF:A9:FF:F6:B1:1A (OUI DF-A9-FF)
        Count: 1
zephyr.exe[874522]: < HCI Command: Host Number of Completed Packets (0x03|0x0035) plen 5                             #69 6.210013
        Num handles: 1
        Handle: 453 Address: DF:A9:FF:F6:B1:1A (OUI DF-A9-FF)
        Count: 1
zephyr.exe[874522]: < ACL Data TX: Handle 453 [1/3] flags 0x00 dlen 27                                               #70 6.210027
zephyr.exe[874522]: < ACL Data TX: Handle 453 flags 0x01 dlen 27                                                     #71 6.210034
zephyr.exe[874522]: < ACL Data TX: Handle 453 flags 0x01 dlen 15                                                     #72 6.210036
      SMP: Pairing Public Key (0x0c) len 64
        X[32]: 98308440221e2d910f0e54b71e7ec652857aa9b5a0dc65028824cc19db1226e9
        Y[32]: 67a4816bcb62efb21701e31fdb27561a6217575fb007a8bbdabe7e28b6f68482
> HCI Event: Number of Completed Packets (0x13) plen 5                                                               #73 6.290420
        Num handles: 1
        Handle: 453 Address: DF:A9:FF:F6:B1:1A (OUI DF-A9-FF)
        Count: 1
        Buffers: 0/3
        #70: len 27 (2 Kb/s)
        Latency: 80 msec (80-173 msec ~124 msec)
> HCI Event: Number of Completed Packets (0x13) plen 5                                                               #74 6.291013
        Num handles: 1
        Handle: 453 Address: DF:A9:FF:F6:B1:1A (OUI DF-A9-FF)
        Count: 1
        Buffers: underflow/3
        #71: len 27 (2 Kb/s)
        Latency: 80 msec (80-173 msec ~102 msec)
zephyr.exe[874522]: < ACL Data TX: Handle 453 [1/3] flags 0x00 dlen 21                                               #75 6.309777
      SMP: Pairing Confirm (0x03) len 16
        Confirm value[16]: 5084fe39fdb1cee435362c0e92781863
> HCI Event: Number of Completed Packets (0x13) plen 5                                                               #76 6.377242
        Num handles: 1
        Handle: 453 Address: DF:A9:FF:F6:B1:1A (OUI DF-A9-FF)
        Count: 1
        Buffers: 0/3
        #72: len 15 (0 Kb/s)
        Latency: 167 msec (80-173 msec ~134 msec)
> HCI Event: Number of Completed Packets (0x13) plen 5                                                               #77 6.464814
        Num handles: 1
        Handle: 453 Address: DF:A9:FF:F6:B1:1A (OUI DF-A9-FF)
        Count: 1
        Buffers: underflow/3
        #75: len 21 (1 Kb/s)
        Latency: 155 msec (80-173 msec ~144 msec)
> ACL Data RX: Handle 453 flags 0x02 dlen 21                                                                         #78 6.465315
      SMP: Pairing Random (0x04) len 16
        Random value[16]: 8718d3f4b29fcf460000000000000000
zephyr.exe[874522]: < HCI Command: Host Number of Completed Packets (0x03|0x0035) plen 5                             #79 6.469906
        Num handles: 1
        Handle: 453 Address: DF:A9:FF:F6:B1:1A (OUI DF-A9-FF)
        Count: 1
zephyr.exe[874522]: < ACL Data TX: Handle 453 [1/3] flags 0x00 dlen 21                                               #80 6.469931
      SMP: Pairing Random (0x04) len 16
        Random value[16]: 8e6108f966a694cbe26df70bb96773e6
> HCI Event: Number of Completed Packets (0x13) plen 5                                                               #81 6.639923
        Num handles: 1
        Handle: 453 Address: DF:A9:FF:F6:B1:1A (OUI DF-A9-FF)
        Count: 1
        Buffers: 0/3
        #80: len 21 (0 Kb/s)
        Latency: 169 msec (80-173 msec ~157 msec)
> ACL Data RX: Handle 453 flags 0x02 dlen 21                                                                         #82 6.815327
      SMP: Pairing DHKey Check (0x0d) len 16
        E[16]: db77d1705ddfd077b027a63c59f71c5b
zephyr.exe[874522]: < HCI Command: Host Number of Completed Packets (0x03|0x0035) plen 5                             #83 6.830040
        Num handles: 1
        Handle: 453 Address: DF:A9:FF:F6:B1:1A (OUI DF-A9-FF)
        Count: 1
zephyr.exe[874522]: < ACL Data TX: Handle 453 [1/3] flags 0x00 dlen 21                                               #84 6.830067
      SMP: Pairing DHKey Check (0x0d) len 16
        E[16]: eba2b921967080671eba2f2d15e9feef
> HCI Event: Number of Completed Packets (0x13) plen 5                                                               #85 6.989758
        Num handles: 1
        Handle: 453 Address: DF:A9:FF:F6:B1:1A (OUI DF-A9-FF)
        Count: 1
        Buffers: 0/3
        #84: len 21 (1 Kb/s)
        Latency: 159 msec (80-173 msec ~158 msec)
> HCI Event: LE Meta Event (0x3e) plen 13                                                                            #86 7.077985
      LE Long Term Key Request (0x05)
        Handle: 453 Address: DF:A9:FF:F6:B1:1A (OUI DF-A9-FF)
        Random number: 0x0000000000000000
        Encrypted diversifier: 0x0000
zephyr.exe[874522]: < HCI Command: LE Long Term Key Request Reply (0x08|0x001a) plen 18                              #87 7.089918
        Handle: 453 Address: DF:A9:FF:F6:B1:1A (OUI DF-A9-FF)
        Long term key[16]: 4ee8abf9f9844fa9dab2d1714287d399
> HCI Event: Command Complete (0x0e) plen 6                                                                          #88 7.090730
      LE Long Term Key Request Reply (0x08|0x001a) ncmd 1
        Status: Success (0x00)
        Handle: 453 Address: DF:A9:FF:F6:B1:1A (OUI DF-A9-FF)
> HCI Event: Encryption Change (0x08) plen 4                                                                         #89 7.514998
        Status: Success (0x00)
        Handle: 453 Address: DF:A9:FF:F6:B1:1A (OUI DF-A9-FF)
        Encryption: Enabled with AES-CCM (0x01)
zephyr.exe[874522]: < ACL Data TX: Handle 453 [1/3] flags 0x00 dlen 21                                               #90 7.639954
      SMP: Signing Information (0x0a) len 16
        Signature key[16]: 5da095555cc64d02679f89a05211af56
> HCI Event: Number of Completed Packets (0x13) plen 5                                                               #91 7.777475
        Num handles: 1
        Handle: 453 Address: DF:A9:FF:F6:B1:1A (OUI DF-A9-FF)
        Count: 1
        Buffers: 0/3
        #90: len 21 (1 Kb/s)
        Latency: 137 msec (80-173 msec ~148 msec)
> ACL Data RX: Handle 453 flags 0x02 dlen 21                                                                         #92 7.778417
      SMP: Identity Information (0x08) len 16
        Identity resolving key[16]: 5e9dacca7d6df5ffeb3b7fc7a1309bbe
> ACL Data RX: Handle 453 flags 0x02 dlen 12                                                                         #93 7.778482
      SMP: Identity Address Information (0x09) len 7
        Address: DF:A9:FF:F6:B1:1A (OUI DF-A9-FF)
zephyr.exe[874522]: < HCI Command: Host Number of Completed Packets (0x03|0x0035) plen 5                             #94 7.789906
        Num handles: 1
        Handle: 453 Address: DF:A9:FF:F6:B1:1A (OUI DF-A9-FF)
        Count: 1
zephyr.exe[874522]: < HCI Command: LE Add Device To Resolving List (0x08|0x0027) plen 39                             #95 7.789972
        Address type: Public (0x00)
        Address: DF:A9:FF:F6:B1:1A (OUI DF-A9-FF)
        Peer identity resolving key[16]: 5e9dacca7d6df5ffeb3b7fc7a1309bbe
        Local identity resolving key[16]: 00000000000000000000000000000000
> HCI Event: Command Complete (0x0e) plen 4                                                                          #96 7.791416
      LE Add Device To Resolving List (0x08|0x0027) ncmd 1
        Status: Success (0x00)
zephyr.exe[874522]: < HCI Command: LE Set Privacy Mode (0x08|0x004e) plen 8                                          #97 7.809927
        Peer Identity address type: Public (0x00)
        Peer Identity address: DF:A9:FF:F6:B1:1A (OUI DF-A9-FF)
        Privacy Mode: Use Device Privacy (0x01)
> HCI Event: Command Complete (0x0e) plen 4                                                                          #98 7.811325
      LE Set Privacy Mode (0x08|0x004e) ncmd 1
        Status: Success (0x00)
zephyr.exe[874522]: < HCI Command: LE Set Address Resolution Enable (0x08|0x002d) plen 1                             #99 7.829905
        Address resolution: Enabled (0x01)
> HCI Event: Command Complete (0x0e) plen 4                                                                         #100 7.830691
      LE Set Address Resolution Enable (0x08|0x002d) ncmd 1
        Status: Success (0x00)
zephyr.exe[874522]: < HCI Command: Host Number of Completed Packets (0x03|0x0035) plen 5                            #101 7.849880
        Num handles: 1
        Handle: 453 Address: DF:A9:FF:F6:B1:1A (OUI DF-A9-FF)
        Count: 1
> ACL Data RX: Handle 453 flags 0x02 dlen 13                                                                        #102 8.040033
      ATT: Find By Type Value Request (0x06) len 8
        Handle range: 0x0001-0xffff
        Attribute type: Primary Service (0x2800)
          UUID: Published Audio Capabilities (0x1850)
zephyr.exe[874522]: < HCI Command: Host Number of Completed Packets (0x03|0x0035) plen 5                            #103 8.049938
        Num handles: 1
        Handle: 453 Address: DF:A9:FF:F6:B1:1A (OUI DF-A9-FF)
        Count: 1
zephyr.exe[874522]: < ACL Data TX: Handle 453 [1/3] flags 0x00 dlen 9                                               #104 8.050157
      ATT: Find By Type Value Response (0x07) len 4
        Handle range: 0x0024-0x0036
> HCI Event: Number of Completed Packets (0x13) plen 5                                                              #105 8.214891
        Num handles: 1
        Handle: 453 Address: DF:A9:FF:F6:B1:1A (OUI DF-A9-FF)
        Count: 1
        Buffers: 0/3
        #104: len 9 (0 Kb/s)
        Latency: 164 msec (80-173 msec ~156 msec)
> ACL Data RX: Handle 453 flags 0x02 dlen 13                                                                        #106 8.215043
      ATT: Find By Type Value Request (0x06) len 8
        Handle range: 0x0037-0xffff
        Attribute type: Primary Service (0x2800)
          UUID: Published Audio Capabilities (0x1850)
zephyr.exe[874522]: < HCI Command: Host Number of Completed Packets (0x03|0x0035) plen 5                            #107 8.229953
        Num handles: 1
        Handle: 453 Address: DF:A9:FF:F6:B1:1A (OUI DF-A9-FF)
        Count: 1
zephyr.exe[874522]: < ACL Data TX: Handle 453 [1/3] flags 0x00 dlen 9                                               #108 8.229983
      ATT: Error Response (0x01) len 4
        Find By Type Value Request (0x06)
        Handle: 0x0037
        Error: Attribute Not Found (0x0a)
> HCI Event: Number of Completed Packets (0x13) plen 5                                                              #109 8.389878
        Num handles: 1
        Handle: 453 Address: DF:A9:FF:F6:B1:1A (OUI DF-A9-FF)
        Count: 1
        Buffers: 0/3
        #108: len 9 (0 Kb/s)
        Latency: 159 msec (80-173 msec ~158 msec)
> ACL Data RX: Handle 453 flags 0x02 dlen 11                                                                        #110 8.390068
      ATT: Read By Type Request (0x08) len 6
        Handle range: 0x0024-0x0036
        Attribute type: Characteristic (0x2803)
zephyr.exe[874522]: < HCI Command: Host Number of Completed Packets (0x03|0x0035) plen 5                            #111 8.409957
        Num handles: 1
        Handle: 453 Address: DF:A9:FF:F6:B1:1A (OUI DF-A9-FF)
        Count: 1
zephyr.exe[874522]: < ACL Data TX: Handle 453 [1/3] flags 0x00 dlen 27                                              #112 8.409989
zephyr.exe[874522]: < ACL Data TX: Handle 453 flags 0x01 dlen 21                                                    #113 8.409993
      ATT: Read By Type Response (0x09) len 43
        Attribute data length: 7
        Attribute data list: 6 entries
        Handle: 0x0025
        Value[5]: 122600c92b
            Properties: 0x12
              Read (0x02)
              Notify (0x10)
            Value Handle: 0x0026
            Value UUID: Sink PAC (0x2bc9)
        Handle: 0x0028
        Value[5]: 1a2900ca2b
            Properties: 0x1a
              Read (0x02)
              Write (0x08)
              Notify (0x10)
            Value Handle: 0x0029
            Value UUID: Sink Audio Locations (0x2bca)
        Handle: 0x002b
        Value[5]: 122c00cb2b
            Properties: 0x12
              Read (0x02)
              Notify (0x10)
            Value Handle: 0x002c
            Value UUID: Source PAC (0x2bcb)
        Handle: 0x002e
        Value[5]: 1a2f00cc2b
            Properties: 0x1a
              Read (0x02)
              Write (0x08)
              Notify (0x10)
            Value Handle: 0x002f
            Value UUID: Source Audio Locations (0x2bcc)
        Handle: 0x0031
        Value[5]: 123200cd2b
            Properties: 0x12
              Read (0x02)
              Notify (0x10)
            Value Handle: 0x0032
            Value UUID: Available Audio Contexts (0x2bcd)
        Handle: 0x0034
        Value[5]: 123500ce2b
            Properties: 0x12
              Read (0x02)
              Notify (0x10)
            Value Handle: 0x0035
            Value UUID: Supported Audio Contexts (0x2bce)
> HCI Event: Number of Completed Packets (0x13) plen 5                                                              #114 8.477857
        Num handles: 1
        Handle: 453 Address: DF:A9:FF:F6:B1:1A (OUI DF-A9-FF)
        Count: 1
        Buffers: 0/3
        #112: len 27 (3 Kb/s)
        Latency: 67 msec (67-173 msec ~113 msec)
> HCI Event: Number of Completed Packets (0x13) plen 5                                                              #115 8.564839
        Num handles: 1
        Handle: 453 Address: DF:A9:FF:F6:B1:1A (OUI DF-A9-FF)
        Count: 1
        Buffers: underflow/3
        #113: len 21 (1 Kb/s)
        Latency: 154 msec (67-173 msec ~133 msec)
> ACL Data RX: Handle 453 flags 0x02 dlen 11                                                                        #116 8.564932
      ATT: Read By Type Request (0x08) len 6
        Handle range: 0x0035-0x0036
        Attribute type: Characteristic (0x2803)
zephyr.exe[874522]: < HCI Command: Host Number of Completed Packets (0x03|0x0035) plen 5                            #117 8.569851
        Num handles: 1
        Handle: 453 Address: DF:A9:FF:F6:B1:1A (OUI DF-A9-FF)
        Count: 1
zephyr.exe[874522]: < ACL Data TX: Handle 453 [1/3] flags 0x00 dlen 9                                               #118 8.569877
      ATT: Error Response (0x01) len 4
        Read By Type Request (0x08)
        Handle: 0x0035
        Error: Attribute Not Found (0x0a)
> HCI Event: Number of Completed Packets (0x13) plen 5                                                              #119 8.739921
        Num handles: 1
        Handle: 453 Address: DF:A9:FF:F6:B1:1A (OUI DF-A9-FF)
        Count: 1
        Buffers: 0/3
        #118: len 9 (0 Kb/s)
        Latency: 170 msec (67-173 msec ~151 msec)
> ACL Data RX: Handle 453 flags 0x02 dlen 9                                                                         #120 8.740095
      ATT: Find Information Request (0x04) len 4
        Handle range: 0x0027-0x0027
zephyr.exe[874522]: < HCI Command: Host Number of Completed Packets (0x03|0x0035) plen 5                            #121 8.749895
        Num handles: 1
        Handle: 453 Address: DF:A9:FF:F6:B1:1A (OUI DF-A9-FF)
        Count: 1
zephyr.exe[874522]: < ACL Data TX: Handle 453 [1/3] flags 0x00 dlen 10                                              #122 8.749922
      ATT: Find Information Response (0x05) len 5
        Format: UUID-16 (0x01)
        Handle: 0x0027
        UUID: Client Characteristic Configuration (0x2902)
> HCI Event: Number of Completed Packets (0x13) plen 5                                                              #123 8.914894
        Num handles: 1
        Handle: 453 Address: DF:A9:FF:F6:B1:1A (OUI DF-A9-FF)
        Count: 1
        Buffers: 0/3
        #122: len 10 (0 Kb/s)
        Latency: 164 msec (67-173 msec ~158 msec)
> ACL Data RX: Handle 453 flags 0x02 dlen 9                                                                         #124 8.914948
      ATT: Find Information Request (0x04) len 4
        Handle range: 0x002a-0x002a
zephyr.exe[874522]: < HCI Command: Host Number of Completed Packets (0x03|0x0035) plen 5                            #125 8.929881
        Num handles: 1
        Handle: 453 Address: DF:A9:FF:F6:B1:1A (OUI DF-A9-FF)
        Count: 1
zephyr.exe[874522]: < ACL Data TX: Handle 453 [1/3] flags 0x00 dlen 10                                              #126 8.929928
      ATT: Find Information Response (0x05) len 5
        Format: UUID-16 (0x01)
        Handle: 0x002a
        UUID: Client Characteristic Configuration (0x2902)
> HCI Event: Number of Completed Packets (0x13) plen 5                                                              #127 9.090284
        Num handles: 1
        Handle: 453 Address: DF:A9:FF:F6:B1:1A (OUI DF-A9-FF)
        Count: 1
        Buffers: 0/3
        #126: len 10 (0 Kb/s)
        Latency: 160 msec (67-173 msec ~159 msec)
> ACL Data RX: Handle 453 flags 0x02 dlen 9                                                                         #128 9.090286
      ATT: Find Information Request (0x04) len 4
        Handle range: 0x002d-0x002d
zephyr.exe[874522]: < HCI Command: Host Number of Completed Packets (0x03|0x0035) plen 5                            #129 9.109969
        Num handles: 1
        Handle: 453 Address: DF:A9:FF:F6:B1:1A (OUI DF-A9-FF)
        Count: 1
zephyr.exe[874522]: < ACL Data TX: Handle 453 [1/3] flags 0x00 dlen 10                                              #130 9.110018
      ATT: Find Information Response (0x05) len 5
        Format: UUID-16 (0x01)
        Handle: 0x002d
        UUID: Client Characteristic Configuration (0x2902)
> HCI Event: Number of Completed Packets (0x13) plen 5                                                              #131 9.264911
        Num handles: 1
        Handle: 453 Address: DF:A9:FF:F6:B1:1A (OUI DF-A9-FF)
        Count: 1
        Buffers: 0/3
        #130: len 10 (0 Kb/s)
        Latency: 154 msec (67-173 msec ~157 msec)
> ACL Data RX: Handle 453 flags 0x02 dlen 9                                                                         #132 9.264994
      ATT: Find Information Request (0x04) len 4
        Handle range: 0x0030-0x0030
zephyr.exe[874522]: < HCI Command: Host Number of Completed Packets (0x03|0x0035) plen 5                            #133 9.269950
        Num handles: 1
        Handle: 453 Address: DF:A9:FF:F6:B1:1A (OUI DF-A9-FF)
        Count: 1
zephyr.exe[874522]: < ACL Data TX: Handle 453 [1/3] flags 0x00 dlen 10                                              #134 9.270045
      ATT: Find Information Response (0x05) len 5
        Format: UUID-16 (0x01)
        Handle: 0x0030
        UUID: Client Characteristic Configuration (0x2902)
> HCI Event: Number of Completed Packets (0x13) plen 5                                                              #135 9.439977
        Num handles: 1
        Handle: 453 Address: DF:A9:FF:F6:B1:1A (OUI DF-A9-FF)
        Count: 1
        Buffers: 0/3
        #134: len 10 (0 Kb/s)
        Latency: 169 msec (67-173 msec ~163 msec)
> ACL Data RX: Handle 453 flags 0x02 dlen 9                                                                         #136 9.440089
      ATT: Find Information Request (0x04) len 4
        Handle range: 0x0033-0x0033
zephyr.exe[874522]: < HCI Command: Host Number of Completed Packets (0x03|0x0035) plen 5                            #137 9.449973
        Num handles: 1
        Handle: 453 Address: DF:A9:FF:F6:B1:1A (OUI DF-A9-FF)
        Count: 1
zephyr.exe[874522]: < ACL Data TX: Handle 453 [1/3] flags 0x00 dlen 10                                              #138 9.449993
      ATT: Find Information Response (0x05) len 5
        Format: UUID-16 (0x01)
        Handle: 0x0033
        UUID: Client Characteristic Configuration (0x2902)
> HCI Event: Number of Completed Packets (0x13) plen 5                                                              #139 9.614845
        Num handles: 1
        Handle: 453 Address: DF:A9:FF:F6:B1:1A (OUI DF-A9-FF)
        Count: 1
        Buffers: 0/3
        #138: len 10 (0 Kb/s)
        Latency: 164 msec (67-173 msec ~164 msec)
> ACL Data RX: Handle 453 flags 0x02 dlen 9                                                                         #140 9.615006
      ATT: Find Information Request (0x04) len 4
        Handle range: 0x0036-0x0036
zephyr.exe[874522]: < HCI Command: Host Number of Completed Packets (0x03|0x0035) plen 5                            #141 9.629977
        Num handles: 1
        Handle: 453 Address: DF:A9:FF:F6:B1:1A (OUI DF-A9-FF)
        Count: 1
zephyr.exe[874522]: < ACL Data TX: Handle 453 [1/3] flags 0x00 dlen 10                                              #142 9.630000
      ATT: Find Information Response (0x05) len 5
        Format: UUID-16 (0x01)
        Handle: 0x0036
        UUID: Client Characteristic Configuration (0x2902)
> HCI Event: Number of Completed Packets (0x13) plen 5                                                              #143 9.790405
        Num handles: 1
        Handle: 453 Address: DF:A9:FF:F6:B1:1A (OUI DF-A9-FF)
        Count: 1
        Buffers: 0/3
        #142: len 10 (0 Kb/s)
        Latency: 160 msec (67-173 msec ~162 msec)
> ACL Data RX: Handle 453 flags 0x02 dlen 9                                                                         #144 9.790657
      ATT: Write Request (0x12) len 4
        Handle: 0x0027
          Data[2]: 0000
zephyr.exe[874522]: < HCI Command: Host Number of Completed Packets (0x03|0x0035) plen 5                            #145 9.809962
        Num handles: 1
        Handle: 453 Address: DF:A9:FF:F6:B1:1A (OUI DF-A9-FF)
        Count: 1
zephyr.exe[874522]: < ACL Data TX: Handle 453 [1/3] flags 0x00 dlen 5                                               #146 9.809985
      ATT: Write Response (0x13) len 0
> HCI Event: Number of Completed Packets (0x13) plen 5                                                              #147 9.965095
        Num handles: 1
        Handle: 453 Address: DF:A9:FF:F6:B1:1A (OUI DF-A9-FF)
        Count: 1
        Buffers: 0/3
        #146: len 5 (0 Kb/s)
        Latency: 155 msec (67-173 msec ~158 msec)
> ACL Data RX: Handle 453 flags 0x02 dlen 9                                                                         #148 9.965098
      ATT: Write Request (0x12) len 4
        Handle: 0x0027
          Data[2]: 0100
zephyr.exe[874522]: < HCI Command: Host Number of Completed Packets (0x03|0x0035) plen 5                            #149 9.969940
        Num handles: 1
        Handle: 453 Address: DF:A9:FF:F6:B1:1A (OUI DF-A9-FF)
        Count: 1
zephyr.exe[874522]: < ACL Data TX: Handle 453 [1/3] flags 0x00 dlen 5                                               #150 9.969953
      ATT: Write Response (0x13) len 0
> HCI Event: Number of Completed Packets (0x13) plen 5                                                             #151 10.139864
        Num handles: 1
        Handle: 453 Address: DF:A9:FF:F6:B1:1A (OUI DF-A9-FF)
        Count: 1
        Buffers: 0/3
        #150: len 5 (0 Kb/s)
        Latency: 169 msec (67-173 msec ~164 msec)
> ACL Data RX: Handle 453 flags 0x02 dlen 9                                                                        #152 10.140296
      ATT: Write Request (0x12) len 4
        Handle: 0x002a
          Data[2]: 0000
zephyr.exe[874522]: < HCI Command: Host Number of Completed Packets (0x03|0x0035) plen 5                           #153 10.149945
        Num handles: 1
        Handle: 453 Address: DF:A9:FF:F6:B1:1A (OUI DF-A9-FF)
        Count: 1
zephyr.exe[874522]: < ACL Data TX: Handle 453 [1/3] flags 0x00 dlen 5                                              #154 10.149966
      ATT: Write Response (0x13) len 0
> HCI Event: Number of Completed Packets (0x13) plen 5                                                             #155 10.314960
        Num handles: 1
        Handle: 453 Address: DF:A9:FF:F6:B1:1A (OUI DF-A9-FF)
        Count: 1
        Buffers: 0/3
        #154: len 5 (0 Kb/s)
        Latency: 164 msec (67-173 msec ~164 msec)
> ACL Data RX: Handle 453 flags 0x02 dlen 9                                                                        #156 10.315197
      ATT: Write Request (0x12) len 4
        Handle: 0x002a
          Data[2]: 0100
zephyr.exe[874522]: < HCI Command: Host Number of Completed Packets (0x03|0x0035) plen 5                           #157 10.329921
        Num handles: 1
        Handle: 453 Address: DF:A9:FF:F6:B1:1A (OUI DF-A9-FF)
        Count: 1
zephyr.exe[874522]: < ACL Data TX: Handle 453 [1/3] flags 0x00 dlen 5                                              #158 10.329944
      ATT: Write Response (0x13) len 0
> HCI Event: Number of Completed Packets (0x13) plen 5                                                             #159 10.489809
        Num handles: 1
        Handle: 453 Address: DF:A9:FF:F6:B1:1A (OUI DF-A9-FF)
        Count: 1
        Buffers: 0/3
        #158: len 5 (0 Kb/s)
        Latency: 159 msec (67-173 msec ~162 msec)
> ACL Data RX: Handle 453 flags 0x02 dlen 9                                                                        #160 10.489893
      ATT: Write Request (0x12) len 4
        Handle: 0x0033
          Data[2]: 0000
zephyr.exe[874522]: < HCI Command: Host Number of Completed Packets (0x03|0x0035) plen 5                           #161 10.509971
        Num handles: 1
        Handle: 453 Address: DF:A9:FF:F6:B1:1A (OUI DF-A9-FF)
        Count: 1
zephyr.exe[874522]: < ACL Data TX: Handle 453 [1/3] flags 0x00 dlen 5                                              #162 10.509998
      ATT: Write Response (0x13) len 0
> HCI Event: Number of Completed Packets (0x13) plen 5                                                             #163 10.664909
        Num handles: 1
        Handle: 453 Address: DF:A9:FF:F6:B1:1A (OUI DF-A9-FF)
        Count: 1
        Buffers: 0/3
        #162: len 5 (0 Kb/s)
        Latency: 154 msec (67-173 msec ~158 msec)
> ACL Data RX: Handle 453 flags 0x02 dlen 9                                                                        #164 10.664973
      ATT: Write Request (0x12) len 4
        Handle: 0x0033
          Data[2]: 0100
zephyr.exe[874522]: < HCI Command: Host Number of Completed Packets (0x03|0x0035) plen 5                           #165 10.669864
        Num handles: 1
        Handle: 453 Address: DF:A9:FF:F6:B1:1A (OUI DF-A9-FF)
        Count: 1
zephyr.exe[874522]: < ACL Data TX: Handle 453 [1/3] flags 0x00 dlen 5                                              #166 10.669879
      ATT: Write Response (0x13) len 0
> HCI Event: Number of Completed Packets (0x13) plen 5                                                             #167 10.839680
        Num handles: 1
        Handle: 453 Address: DF:A9:FF:F6:B1:1A (OUI DF-A9-FF)
        Count: 1
        Buffers: 0/3
        #166: len 5 (0 Kb/s)
        Latency: 169 msec (67-173 msec ~164 msec)
> ACL Data RX: Handle 453 flags 0x02 dlen 9                                                                        #168 10.839922
      ATT: Write Request (0x12) len 4
        Handle: 0x0036
          Data[2]: 0000
zephyr.exe[874522]: < HCI Command: Host Number of Completed Packets (0x03|0x0035) plen 5                           #169 10.849963
        Num handles: 1
        Handle: 453 Address: DF:A9:FF:F6:B1:1A (OUI DF-A9-FF)
        Count: 1
zephyr.exe[874522]: < ACL Data TX: Handle 453 [1/3] flags 0x00 dlen 5                                              #170 10.849988
      ATT: Write Response (0x13) len 0
> HCI Event: Number of Completed Packets (0x13) plen 5                                                             #171 11.014877
        Num handles: 1
        Handle: 453 Address: DF:A9:FF:F6:B1:1A (OUI DF-A9-FF)
        Count: 1
        Buffers: 0/3
        #170: len 5 (0 Kb/s)
        Latency: 164 msec (67-173 msec ~164 msec)
> ACL Data RX: Handle 453 flags 0x02 dlen 9                                                                        #172 11.014955
      ATT: Write Request (0x12) len 4
        Handle: 0x0036
          Data[2]: 0100
zephyr.exe[874522]: < HCI Command: Host Number of Completed Packets (0x03|0x0035) plen 5                           #173 11.029977
        Num handles: 1
        Handle: 453 Address: DF:A9:FF:F6:B1:1A (OUI DF-A9-FF)
        Count: 1
zephyr.exe[874522]: < ACL Data TX: Handle 453 [1/3] flags 0x00 dlen 5                                              #174 11.029996
      ATT: Write Response (0x13) len 0
> HCI Event: Number of Completed Packets (0x13) plen 5                                                             #175 11.189762
        Num handles: 1
        Handle: 453 Address: DF:A9:FF:F6:B1:1A (OUI DF-A9-FF)
        Count: 1
        Buffers: 0/3
        #174: len 5 (0 Kb/s)
        Latency: 159 msec (67-173 msec ~162 msec)
> ACL Data RX: Handle 453 flags 0x02 dlen 7                                                                        #176 11.189850
      ATT: Read Request (0x0a) len 2
        Handle: 0x0029
zephyr.exe[874522]: < HCI Command: Host Number of Completed Packets (0x03|0x0035) plen 5                           #177 11.209992
        Num handles: 1
        Handle: 453 Address: DF:A9:FF:F6:B1:1A (OUI DF-A9-FF)
        Count: 1
zephyr.exe[874522]: < ACL Data TX: Handle 453 [1/3] flags 0x00 dlen 9                                              #178 11.209997
      ATT: Read Response (0x0b) len 4
        Value[4]: 06000000
> HCI Event: Number of Completed Packets (0x13) plen 5                                                             #179 11.365008
        Num handles: 1
        Handle: 453 Address: DF:A9:FF:F6:B1:1A (OUI DF-A9-FF)
        Count: 1
        Buffers: 0/3
        #178: len 9 (0 Kb/s)
        Latency: 155 msec (67-173 msec ~158 msec)
> HCI Event: Disconnect Complete (0x05) plen 4                                                                     #180 11.452297
        Status: Success (0x00)
        Handle: 453 Address: DF:A9:FF:F6:B1:1A (OUI DF-A9-FF)
        Reason: Remote User Terminated Connection (0x13)
zephyr.exe[874522]: < HCI Command: LE Set Extended Advertising Parameters (0x08|0x0036) plen 25                    #181 13.149869
        Handle: 0x00
        Properties: 0x0013
          Connectable
          Scannable
          Use legacy advertising PDUs: ADV_IND
        Min advertising interval: 100.000 msec (0x00a0)
        Max advertising interval: 150.000 msec (0x00f0)
        Channel map: 37, 38, 39 (0x07)
        Own address type: Random (0x01)
        Peer address type: Public (0x00)
        Peer address: 00:00:00:00:00:00 (OUI 00-00-00)
        Filter policy: Allow Scan Request from Any, Allow Connect Request from Any (0x00)
        TX power: Host has no preference (0x7f)
        Primary PHY: LE 1M (0x01)
        Secondary max skip: 0x00
        Secondary PHY: LE 1M (0x01)
        SID: 0x00
        Scan request notifications: Disabled (0x00)
> HCI Event: Command Complete (0x0e) plen 5                                                                        #182 13.151647
      LE Set Extended Advertising Parameters (0x08|0x0036) ncmd 1
        Status: Success (0x00)
        TX power (selected): 0 dbm (0x00)
zephyr.exe[874522]: < HCI Command: LE Set Advertising Set Random Address (0x08|0x0035) plen 7                      #183 13.169886
        Advertising handle: 0x00
        Advertising random address: D5:B6:CC:31:DB:3B (Static)
> HCI Event: Command Complete (0x0e) plen 4                                                                        #184 13.170445
      LE Set Advertising Set Random Address (0x08|0x0035) ncmd 1
        Status: Success (0x00)
zephyr.exe[874522]: < HCI Command: LE Set Extended Advertising Data (0x08|0x0037) plen 22                          #185 13.189876
        Handle: 0x00
        Operation: Complete extended advertising data (0x03)
        Fragment preference: Minimize fragmentation (0x01)
        Data length: 0x12
        Flags: 0x06
          LE General Discoverable Mode
          BR/EDR Not Supported
        Name (complete): Tester_F6B11A
> HCI Event: Command Complete (0x0e) plen 4                                                                        #186 13.190726
      LE Set Extended Advertising Data (0x08|0x0037) ncmd 1
        Status: Success (0x00)
zephyr.exe[874522]: < HCI Command: LE Set Extended Scan Response Data (0x08|0x0038) plen 4                         #187 13.209876
        Handle: 0x00
        Operation: Complete scan response data (0x03)
        Fragment preference: Minimize fragmentation (0x01)
        Data length: 0x00
> HCI Event: Command Complete (0x0e) plen 4                                                                        #188 13.210780
      LE Set Extended Scan Response Data (0x08|0x0038) ncmd 1
        Status: Success (0x00)
zephyr.exe[874522]: < HCI Command: LE Set Extended Advertising Enable (0x08|0x0039) plen 6                         #189 13.229879
        Extended advertising: Enabled (0x01)
        Number of sets: 1 (0x01)
        Entry 0
          Handle: 0x00
          Duration: 0 ms (0x00)
          Max ext adv events: 0
> HCI Event: Command Complete (0x0e) plen 4                                                                        #190 13.230744
      LE Set Extended Advertising Enable (0x08|0x0039) ncmd 1
        Status: Success (0x00)
> HCI Event: LE Meta Event (0x3e) plen 31                                                                          #191 13.340639
      LE Enhanced Connection Complete (0x0a)
        Status: Success (0x00)
        Handle: 471
        Role: Peripheral (0x01)
        Peer address type: Public (0x00)
        Peer address: DF:A9:FF:F6:B1:1A (OUI DF-A9-FF)
        Local resolvable private address: 00:00:00:00:00:00 (Non-Resolvable)
        Peer resolvable private address: 00:00:00:00:00:00 (Non-Resolvable)
        Connection interval: 87.50 msec (0x0046)
        Connection latency: 0 (0x0000)
        Supervision timeout: 25120 msec (0x09d0)
        Central clock accuracy: 0x01
> HCI Event: LE Meta Event (0x3e) plen 6                                                                           #192 13.340640
      LE Advertising Set Terminated (0x12)
        Status: Success (0x00)
        Handle: 0
        Connection handle: 471
        Number of completed extended advertising events: 0
zephyr.exe[874522]: < HCI Command: LE Read Remote Used Features (0x08|0x0016) plen 2                               #193 13.349953
        Handle: 471 Address: DF:A9:FF:F6:B1:1A (OUI DF-A9-FF)
> HCI Event: Command Status (0x0f) plen 4                                                                          #194 13.350455
      LE Read Remote Used Features (0x08|0x0016) ncmd 1
        Status: Success (0x00)
zephyr.exe[874522]: < ACL Data TX: Handle 471 [1/3] flags 0x00 dlen 6                                              #195 13.369921
      SMP: Security Request (0x0b) len 1
        Authentication requirement: Bonding, No MITM, SC, No Keypresses (0x09)
zephyr.exe[874522]: < ACL Data TX: Handle 471 [2/3] flags 0x00 dlen 7                                              #196 13.369928
      ATT: Exchange MTU Request (0x02) len 2
        Client RX MTU: 251
> HCI Event: Number of Completed Packets (0x13) plen 5                                                             #197 13.429424
        Num handles: 1
        Handle: 471 Address: DF:A9:FF:F6:B1:1A (OUI DF-A9-FF)
        Count: 1
        Buffers: 1/3
        #195: len 6 (0 Kb/s)
        Latency: 59 msec (59-59 msec ~59 msec)
> HCI Event: Number of Completed Packets (0x13) plen 5                                                             #198 13.516653
        Num handles: 1
        Handle: 471 Address: DF:A9:FF:F6:B1:1A (OUI DF-A9-FF)
        Count: 1
        Buffers: 0/3
        #196: len 7 (0 Kb/s)
        La