Bluetooth monitor ver 5.72
= Note: Linux version 6.14.0-36-generic (x86_64)                       0.747030
= Note: Bluetooth subsystem version 2.22                               0.747032
= New Index: 00:00:00:00:00:00 (Primary,UART,hci1)              [hci1] 0.747033
= New Index: 48:5F:99:8E:E0:64 (Primary,USB,hci0)               [hci0] 0.747034
= Open Index: 00:00:00:00:00:00                                 [hci1] 0.890565
= Index Info: 00:00:00:00:00:00 (Nordic Semiconductor ASA)      [hci1] 0.890576
@ USER Open: main (privileged) version 2.22            {0x0001} [hci1] 0.890583
< HCI Command: Reset (0x03|0x0003) plen 0                    #1 [hci1] 0.891433
> HCI Event: Command Complete (0x0e) plen 4                  #2 [hci1] 0.891899
      Reset (0x03|0x0003) ncmd 1
        Status: Success (0x00)
< HCI Command: Read Local Supported... (0x04|0x0003) plen 0  #3 [hci1] 0.910201
> HCI Event: Command Complete (0x0e) plen 12                 #4 [hci1] 0.910699
      Read Local Supported Features (0x04|0x0003) ncmd 1
        Status: Success (0x00)
        Features: 0x00 0x00 0x00 0x00 0x60 0x00 0x00 0x00
          BR/EDR Not Supported
          LE Supported (Controller)
< HCI Command: Read Local Version In.. (0x04|0x0001) plen 0  #5 [hci1] 0.930159
> HCI Event: Command Complete (0x0e) plen 12                 #6 [hci1] 0.930660
      Read Local Version Information (0x04|0x0001) ncmd 1
        Status: Success (0x00)
        HCI version: Reserved (0x0f) - Revision 12393 (0x3069)
        LMP version: Reserved (0x0f) - Subversion 12393 (0x3069)
        Manufacturer: Nordic Semiconductor ASA (89)
< HCI Command: Read Local Supported... (0x04|0x0002) plen 0  #7 [hci1] 0.950169
> HCI Event: Command Complete (0x0e) plen 68                 #8 [hci1] 0.951267
      Read Local Supported Commands (0x04|0x0002) ncmd 1
        Status: Success (0x00)
        Commands: 119 entries
          Disconnect (Octet 0 - Bit 5)
          Read Remote Version Information (Octet 2 - Bit 7)
          Set Event Mask (Octet 5 - Bit 6)
          Reset (Octet 5 - Bit 7)
          Read Connection Accept Timeout (Octet 7 - Bit 2)
          Write Connection Accept Timeout (Octet 7 - Bit 3)
          Read Transmit Power Level (Octet 10 - Bit 2)
          Set Controller To Host Flow Control (Octet 10 - Bit 5)
          Host Buffer Size (Octet 10 - Bit 6)
          Host Number of Completed Packets (Octet 10 - Bit 7)
          Read Local Version Information (Octet 14 - Bit 3)
          Read Local Supported Features (Octet 14 - Bit 5)
          Read BD ADDR (Octet 15 - Bit 1)
          Read RSSI (Octet 15 - Bit 5)
          Set Event Mask Page 2 (Octet 22 - Bit 2)
          LE Set Event Mask (Octet 25 - Bit 0)
          LE Read Buffer Size (Octet 25 - Bit 1)
          LE Read Local Supported Features (Octet 25 - Bit 2)
          LE Set Random Address (Octet 25 - Bit 4)
          LE Set Advertising Parameters (Octet 25 - Bit 5)
          LE Read Advertising Channel TX Power (Octet 25 - Bit 6)
          LE Set Advertising Data (Octet 25 - Bit 7)
          LE Set Scan Response Data (Octet 26 - Bit 0)
          LE Set Advertise Enable (Octet 26 - Bit 1)
          LE Set Scan Parameters (Octet 26 - Bit 2)
          LE Set Scan Enable (Octet 26 - Bit 3)
          LE Create Connection (Octet 26 - Bit 4)
          LE Create Connection Cancel (Octet 26 - Bit 5)
          LE Read Accept List Size (Octet 26 - Bit 6)
          LE Clear Accept List (Octet 26 - Bit 7)
          LE Add Device To Accept List (Octet 27 - Bit 0)
          LE Remove Device From Accept List (Octet 27 - Bit 1)
          LE Connection Update (Octet 27 - Bit 2)
          LE Set Host Channel Classification (Octet 27 - Bit 3)
          LE Read Channel Map (Octet 27 - Bit 4)
          LE Read Remote Used Features (Octet 27 - Bit 5)
          LE Encrypt (Octet 27 - Bit 6)
          LE Rand (Octet 27 - Bit 7)
          LE Start Encryption (Octet 28 - Bit 0)
          LE Long Term Key Request Reply (Octet 28 - Bit 1)
          LE Long Term Key Request Neg Reply (Octet 28 - Bit 2)
          LE Read Supported States (Octet 28 - Bit 3)
          LE Receiver Test (Octet 28 - Bit 4)
          LE Transmitter Test (Octet 28 - Bit 5)
          LE Test End (Octet 28 - Bit 6)
          Read Authenticated Payload Timeout (Octet 32 - Bit 4)
          Write Authenticated Payload Timeout (Octet 32 - Bit 5)
          LE Set Data Length (Octet 33 - Bit 6)
          LE Read Suggested Default Data Length (Octet 33 - Bit 7)
          LE Write Suggested Default Data Length (Octet 34 - Bit 0)
          LE Add Device To Resolving List (Octet 34 - Bit 3)
          LE Remove Device From Resolving List (Octet 34 - Bit 4)
          LE Clear Resolving List (Octet 34 - Bit 5)
          LE Read Resolving List Size (Octet 34 - Bit 6)
          LE Set Address Resolution Enable (Octet 35 - Bit 1)
          LE Set Resolvable Private Address Timeout (Octet 35 - Bit 2)
          LE Read Maximum Data Length (Octet 35 - Bit 3)
          LE Read PHY (Octet 35 - Bit 4)
          LE Set Default PHY (Octet 35 - Bit 5)
          LE Set PHY (Octet 35 - Bit 6)
          LE Enhanced Receiver Test (Octet 35 - Bit 7)
          LE Enhanced Transmitter Test (Octet 36 - Bit 0)
          LE Set Advertising Set Random Address (Octet 36 - Bit 1)
          LE Set Extended Advertising Parameters (Octet 36 - Bit 2)
          LE Set Extended Advertising Data (Octet 36 - Bit 3)
          LE Set Extended Scan Response Data (Octet 36 - Bit 4)
          LE Set Extended Advertising Enable (Octet 36 - Bit 5)
          LE Read Maximum Advertising Data Length (Octet 36 - Bit 6)
          LE Read Number of Supported Advertising Sets (Octet 36 - Bit 7)
          LE Remove Advertising Set (Octet 37 - Bit 0)
          LE Clear Advertising Sets (Octet 37 - Bit 1)
          LE Set Periodic Advertising Parameters (Octet 37 - Bit 2)
          LE Set Periodic Advertising Data (Octet 37 - Bit 3)
          LE Set Periodic Advertising Enable (Octet 37 - Bit 4)
          LE Set Extended Scan Parameters (Octet 37 - Bit 5)
          LE Set Extended Scan Enable (Octet 37 - Bit 6)
          LE Extended Create Connection (Octet 37 - Bit 7)
          LE Periodic Advertising Create Sync (Octet 38 - Bit 0)
          LE Periodic Advertising Create Sync Cancel (Octet 38 - Bit 1)
          LE Periodic Advertising Terminate Sync (Octet 38 - Bit 2)
          LE Add Device To Periodic Advertiser List (Octet 38 - Bit 3)
          LE Remove Device From Periodic Advertiser List (Octet 38 - Bit 4)
          LE Clear Periodic Advertiser List (Octet 38 - Bit 5)
          LE Read Periodic Advertiser List Size (Octet 38 - Bit 6)
          LE Read Transmit Power (Octet 38 - Bit 7)
          LE Read RF Path Compensation (Octet 39 - Bit 0)
          LE Write RF Path Compensation (Octet 39 - Bit 1)
          LE Set Privacy Mode (Octet 39 - Bit 2)
          LE Periodic Advertising Receive Enable (Octet 40 - Bit 5)
          LE Periodic Advertising Sync Transfer (Octet 40 - Bit 6)
          LE Periodic Advertising Set Info Transfer (Octet 40 - Bit 7)
          LE Periodic Advertising Sync Transfer Parameters (Octet 41 - Bit 0)
          LE Set Default Periodic Advertisng Sync Transfer Parameters (Octet 41 - Bit 1)
          LE Read Buffer v2 (Octet 41 - Bit 5)
          LE Read ISO TX Sync (Octet 41 - Bit 6)
          LE Set Connected Isochronous Group Parameters (Octet 41 - Bit 7)
          LE Set Connected Isochronous Group Parameters Test (Octet 42 - Bit 0)
          LE Create Connected Isochronous Stream (Octet 42 - Bit 1)
          LE Remove Connected Isochronous Group (Octet 42 - Bit 2)
          LE Accept Connected Isochronous Stream Request (Octet 42 - Bit 3)
          LE Reject Connected Isochronous Stream Request (Octet 42 - Bit 4)
          LE Create Broadcast Isochronous Group (Octet 42 - Bit 5)
          LE Create Broadcast Isochronous Group Test (Octet 42 - Bit 6)
          LE Terminate Broadcast Isochronous Group (Octet 42 - Bit 7)
          LE Broadcast Isochronous Group Create Sync (Octet 43 - Bit 0)
          LE Broadcast Isochronous Group Terminate Sync (Octet 43 - Bit 1)
          LE Request Peer SCA (Octet 43 - Bit 2)
          LE Setup Isochronous Data Path (Octet 43 - Bit 3)
          LE Remove Isochronous Data Path (Octet 43 - Bit 4)
          LE Isochronous Transmit Test (Octet 43 - Bit 5)
          LE Isochronous Receive Test (Octet 43 - Bit 6)
          LE Isochronous Read Test Counters (Octet 43 - Bit 7)
          LE Isochronous Read Test Counters (Octet 44 - Bit 0)
          LE Set Host Feature (Octet 44 - Bit 1)
          Octet 44 - Bit 2 
          Octet 45 - Bit 6 
          Octet 46 - Bit 0 
          Octet 46 - Bit 1 
          Octet 46 - Bit 2 
< HCI Command: Host Buffer Size (0x03|0x0033) plen 7         #9 [hci1] 0.970191
        ACL MTU: 255  ACL max packet: 16
        SCO MTU: 0    SCO max packet: 0
> HCI Event: Command Complete (0x0e) plen 4                 #10 [hci1] 0.970667
      Host Buffer Size (0x03|0x0033) ncmd 1
        Status: Success (0x00)
< HCI Command: Set Controller To Ho.. (0x03|0x0031) plen 1  #11 [hci1] 0.990160
        Flow control: ACL Data Packets (0x01)
> HCI Event: Command Complete (0x0e) plen 4                 #12 [hci1] 0.990575
      Set Controller To Host Flow Control (0x03|0x0031) ncmd 1
        Status: Success (0x00)
< HCI Command: LE Read Local Suppor.. (0x08|0x0003) plen 0  #13 [hci1] 1.010193
> HCI Event: Command Complete (0x0e) plen 12                #14 [hci1] 1.010775
      LE Read Local Supported Features (0x08|0x0003) ncmd 1
        Status: Success (0x00)
        Features: 0xfd 0x79 0x00 0xf7 0x30 0x01 0x00 0x00
          LE Encryption
          Extended Reject Indication
          Peripheral-initiated Features Exchange
          LE Ping
          LE Data Packet Length Extension
          LL Privacy
          Extended Scanner Filter Policies
          LE 2M PHY
          LE Coded PHY
          LE Extended Advertising
          LE Periodic Advertising
          Channel Selection Algorithm #2
          Periodic Advertising Sync Transfer - Sender
          Periodic Advertising Sync Transfer - Recipient
          Sleep Clock Accuracy Updates
          Connected Isochronous Stream - Central
          Connected Isochronous Stream - Peripheral
          Isochronous Broadcaster
          Synchronized Receiver
          Periodic Advertising ADI support
          Connection Subrating
          Unknown features (0x0000010000000000)
< HCI Command: LE Set Host Feature (0x08|0x0074) plen 2     #15 [hci1] 1.030140
        Bit Number: 32
          Connected Isochronous Stream (Host Support)
        Bit Value: 1
> HCI Event: Command Complete (0x0e) plen 4                 #16 [hci1] 1.030614
      LE Set Host Feature (0x08|0x0074) ncmd 1
        Status: Success (0x00)
< HCI Command: LE Read Buffer v2 (0x08|0x0060) plen 0       #17 [hci1] 1.050179
> HCI Event: Command Complete (0x0e) plen 10                #18 [hci1] 1.050637
      LE Read Buffer v2 (0x08|0x0060) ncmd 1
        Status: Success (0x00)
        ACL MTU: 27
        ACL max packet: 3
        ISO MTU: 318
        ISO max packet: 3
< HCI Command: LE Read Maximum Adve.. (0x08|0x003a) plen 0  #19 [hci1] 1.070217
> HCI Event: Command Complete (0x0e) plen 6                 #20 [hci1] 1.070660
      LE Read Maximum Advertising Data Length (0x08|0x003a) ncmd 1
        Status: Success (0x00)
        Max length: 1650
< HCI Command: LE Read Supported St.. (0x08|0x001c) plen 0  #21 [hci1] 1.090195
> HCI Event: Command Complete (0x0e) plen 12                #22 [hci1] 1.090681
      LE Read Supported States (0x08|0x001c) ncmd 1
        Status: Success (0x00)
        States: 0x000003ff3e0306ff
          Non-connectable Advertising State
          Scannable Advertising State
          Connectable Advertising State
          High Duty Cycle Directed Advertising State
          Passive Scanning State
          Active Scanning State
          Initiating State
            and Connection State (Central Role)
          Connection State (Peripheral Role)
          Scannable Advertising State
            and Passive Scanning State
          Connectable Advertising State
            and Passive Scanning State
          Non-connectable Advertising State
            and Initiating State
          Scannable Advertising State
            and Initiating State
          Active Scanning State
            and Connection State (Central Role)
          Passive Scanning State
            and Connection State (Peripheral Role)
          Active Scanning State
            and Connection State (Peripheral Role)
          Initiating State
            and Connection State (Central Role)
            and Central Role & Central Role
          Low Duty Cycle Directed Advertising State
          Connectable Advertising State
            and Initiating State
            and Central Role & Peripheral Role
          High Duty Cycle Directed Advertising State
            and Initiating State
            and Central Role & Peripheral Role
          Low Duty Cycle Directed Advertising State
            and Initiating State
            and Central Role & Peripheral Role
          Connectable Advertising State
            and Connection State (Central Role)
            and Central Role & Peripheral Role
          High Duty Cycle Directed Advertising State
            and Connection State (Central Role)
            and Central Role & Peripheral Role
          Low Duty Cycle Directed Advertising State
            and Connection State (Central Role)
            and Central Role & Peripheral Role
          Connectable Advertising State
            and Connection State (Peripheral Role)
            and Central Role & Peripheral Role
          High Duty Cycle Directed Advertising State
            and Connection State (Peripheral Role)
            and Peripheral Role & Peripheral Role
          Low Duty Cycle Directed Advertising State
            and Connection State (Peripheral Role)
            and Peripheral Role & Peripheral Role
          Initiating State
            and Connection State (Peripheral Role)
            and Central Role & Peripheral Role
< HCI Command: LE Read Maximum Data.. (0x08|0x002f) plen 0  #23 [hci1] 1.110191
> HCI Event: Command Complete (0x0e) plen 12                #24 [hci1] 1.110691
      LE Read Maximum Data Length (0x08|0x002f) ncmd 1
        Status: Success (0x00)
        Max TX octets: 251
        Max TX time: 2704
        Max RX octets: 251
        Max RX time: 2704
< HCI Command: LE Write Suggested D.. (0x08|0x0024) plen 4  #25 [hci1] 1.130193
        TX octets: 251
        TX time: 2704
> HCI Event: Command Complete (0x0e) plen 4                 #26 [hci1] 1.130692
      LE Write Suggested Default Data Length (0x08|0x0024) ncmd 1
        Status: Success (0x00)
< HCI Command: LE Read Resolving Li.. (0x08|0x002a) plen 0  #27 [hci1] 1.150192
> HCI Event: Command Complete (0x0e) plen 5                 #28 [hci1] 1.150608
      LE Read Resolving List Size (0x08|0x002a) ncmd 1
        Status: Success (0x00)
        Size: 8
< HCI Command: LE Set Event Mask (0x08|0x0001) plen 8       #29 [hci1] 1.170183
        Mask: 0x000002023f87fa5e
          LE Advertising Report
          LE Connection Update Complete
          LE Read Remote Used Features Complete
          LE Long Term Key Request
          LE Data Length Change
          LE Enhanced Connection Complete
          LE PHY Update Complete
          LE Extended Advertising Report
          LE Periodic Advertising Sync Established
          LE Periodic Advertising Report
          LE Periodic Advertising Sync Lost
          LE Extended Scan Timeout
          LE Extended Advertising Set Terminated
          LE Scan Request Received
          LE Periodic Advertising Sync Transfer Rvc
          LE CIS Established
          LE CIS Request
          LE Create BIG Complete
          LE Terminate BIG Complete
          LE BIG Sync Estabilished Complete
          LE BIG Sync Lost
          LE BIG Info Advertising Report
          Unknown mask (0x0000020000000000)
> HCI Event: Command Complete (0x0e) plen 4                 #30 [hci1] 1.170742
      LE Set Event Mask (0x08|0x0001) ncmd 1
        Status: Success (0x00)
< HCI Command: Set Event Mask (0x03|0x0001) plen 8          #31 [hci1] 1.190189
        Mask: 0x2000800002008890
          Disconnection Complete
          Encryption Change
          Read Remote Version Information Complete
          Hardware Error
          Data Buffer Overflow
          Encryption Key Refresh Complete
          LE Meta
> HCI Event: Command Complete (0x0e) plen 4                 #32 [hci1] 1.190768
      Set Event Mask (0x03|0x0001) ncmd 1
        Status: Success (0x00)
< HCI Command: Read BD ADDR (0x04|0x0009) plen 0            #33 [hci1] 1.210192
> HCI Event: Command Complete (0x0e) plen 10                #34 [hci1] 1.210671
      Read BD ADDR (0x04|0x0009) ncmd 1
        Status: Success (0x00)
        Address: 00:00:00:00:00:00 (OUI 00-00-00)
< HCI Command: LE Set Random Address (0x08|0x0005) plen 6   #35 [hci1] 1.230191
        Address: D5:B6:CC:31:DB:3B (Static)
> HCI Event: Command Complete (0x0e) plen 4                 #36 [hci1] 1.230665
      LE Set Random Address (0x08|0x0005) ncmd 1
        Status: Success (0x00)
< HCI Command: LE Set Extended Adv.. (0x08|0x0036) plen 25  #37 [hci1] 3.830818
        Handle: 0x00
        Properties: 0x0013
          Connectable
          Scannable
          Use legacy advertising PDUs: ADV_IND
        Min advertising interval: 100.000 msec (0x00a0)
        Max advertising interval: 150.000 msec (0x00f0)
        Channel map: 37, 38, 39 (0x07)
        Own address type: Random (0x01)
        Peer address type: Public (0x00)
        Peer address: 00:00:00:00:00:00 (OUI 00-00-00)
        Filter policy: Allow Scan Request from Any, Allow Connect Request from Any (0x00)
        TX power: Host has no preference (0x7f)
        Primary PHY: LE 1M (0x01)
        Secondary max skip: 0x00
        Secondary PHY: LE 1M (0x01)
        SID: 0x00
        Scan request notifications: Disabled (0x00)
> HCI Event: Command Complete (0x0e) plen 5                 #38 [hci1] 3.831668
      LE Set Extended Advertising Parameters (0x08|0x0036) ncmd 1
        Status: Success (0x00)
        TX power (selected): 0 dbm (0x00)
< HCI Command: LE Set Advertising S.. (0x08|0x0035) plen 7  #39 [hci1] 3.850602
        Advertising handle: 0x00
        Advertising random address: D5:B6:CC:31:DB:3B (Static)
> HCI Event: Command Complete (0x0e) plen 4                 #40 [hci1] 3.851153
      LE Set Advertising Set Random Address (0x08|0x0035) ncmd 1
        Status: Success (0x00)
< HCI Command: LE Set Extended Adv.. (0x08|0x0037) plen 22  #41 [hci1] 3.870293
        Handle: 0x00
        Operation: Complete extended advertising data (0x03)
        Fragment preference: Minimize fragmentation (0x01)
        Data length: 0x12
        Flags: 0x06
          LE General Discoverable Mode
          BR/EDR Not Supported
        Name (complete): Tester_F6B11A
> HCI Event: Command Complete (0x0e) plen 4                 #42 [hci1] 3.870977
      LE Set Extended Advertising Data (0x08|0x0037) ncmd 1
        Status: Success (0x00)
< HCI Command: LE Set Extended Scan.. (0x08|0x0038) plen 4  #43 [hci1] 3.890232
        Handle: 0x00
        Operation: Complete scan response data (0x03)
        Fragment preference: Minimize fragmentation (0x01)
        Data length: 0x00
> HCI Event: Command Complete (0x0e) plen 4                 #44 [hci1] 3.890754
      LE Set Extended Scan Response Data (0x08|0x0038) ncmd 1
        Status: Success (0x00)
< HCI Command: LE Set Extended Adve.. (0x08|0x0039) plen 6  #45 [hci1] 3.910206
        Extended advertising: Enabled (0x01)
        Number of sets: 1 (0x01)
        Entry 0
          Handle: 0x00
          Duration: 0 ms (0x00)
          Max ext adv events: 0
> HCI Event: Command Complete (0x0e) plen 4                 #46 [hci1] 3.910805
      LE Set Extended Advertising Enable (0x08|0x0039) ncmd 1
        Status: Success (0x00)
> HCI Event: LE Meta Event (0x3e) plen 31                   #47 [hci1] 4.019508
      LE Enhanced Connection Complete (0x0a)
        Status: Success (0x00)
        Handle: 3819
        Role: Peripheral (0x01)
        Peer address type: Public (0x00)
        Peer address: DF:A9:FF:F6:B1:1A (OUI DF-A9-FF)
        Local resolvable private address: 00:00:00:00:00:00 (Non-Resolvable)
        Peer resolvable private address: 00:00:00:00:00:00 (Non-Resolvable)
        Connection interval: 87.50 msec (0x0046)
        Connection latency: 0 (0x0000)
        Supervision timeout: 25120 msec (0x09d0)
        Central clock accuracy: 0x01
> HCI Event: LE Meta Event (0x3e) plen 6                    #48 [hci1] 4.019568
      LE Advertising Set Terminated (0x12)
        Status: Success (0x00)
        Handle: 0
        Connection handle: 3819
        Number of completed extended advertising events: 0
< HCI Command: LE Read Remote Used... (0x08|0x0016) plen 2  #49 [hci1] 4.030985
        Handle: 3819 Address: DF:A9:FF:F6:B1:1A (OUI DF-A9-FF)
< ACL Data TX: Handle 3819 flags 0x00 dlen 7                #50 [hci1] 4.031011
      ATT: Exchange MTU Request (0x02) len 2
        Client RX MTU: 251
> HCI Event: Command Status (0x0f) plen 4                   #51 [hci1] 4.031558
      LE Read Remote Used Features (0x08|0x0016) ncmd 1
        Status: Success (0x00)
> HCI Event: Number of Completed Packets (0x13) plen 5      #52 [hci1] 4.195430
        Num handles: 1
        Handle: 3819 Address: DF:A9:FF:F6:B1:1A (OUI DF-A9-FF)
        Count: 1
        #50: len 7 (0 Kb/s)
        Latency: 164 msec (164-164 msec ~164 msec)
> HCI Event: LE Meta Event (0x3e) plen 12                   #53 [hci1] 4.283442
      LE Read Remote Used Features (0x04)
        Status: Success (0x00)
        Handle: 3819 Address: DF:A9:FF:F6:B1:1A (OUI DF-A9-FF)
        Features: 0x2d 0x49 0x00 0xf7 0x67 0xd9 0x00 0x80
          LE Encryption
          Extended Reject Indication
          Peripheral-initiated Features Exchange
          LE Data Packet Length Extension
          LE 2M PHY
          LE Coded PHY
          Channel Selection Algorithm #2
          Periodic Advertising Sync Transfer - Sender
          Periodic Advertising Sync Transfer - Recipient
          Sleep Clock Accuracy Updates
          Connected Isochronous Stream - Central
          Connected Isochronous Stream - Peripheral
          Isochronous Broadcaster
          Synchronized Receiver
          Connected Isochronous Stream (Host Support)
          LE Power Control Request
          LE Power Control Request
          Connection Subrating
          Connection Subrating (Host Support)
          Unknown features (0x8000d90000000000)
> ACL Data RX: Handle 3819 flags 0x02 dlen 11               #54 [hci1] 6.733051
      SMP: Pairing Request (0x01) len 6
        IO capability: KeyboardDisplay (0x04)
        OOB data: Authentication data not present (0x00)
        Authentication requirement: Bonding, MITM, SC, No Keypresses (0x0d)
        Max encryption key size: 16
        Initiator key distribution: EncKey IdKey (0x03)
        Responder key distribution: EncKey IdKey Sign (0x07)
> ACL Data RX: Handle 3819 flags 0x02 dlen 7                #55 [hci1] 6.733522
      ATT: Exchange MTU Response (0x03) len 2
        Server RX MTU: 23
< HCI Command: Host Number of Compl.. (0x03|0x0035) plen 5  #56 [hci1] 6.750434
        Num handles: 1
        Handle: 3819 Address: DF:A9:FF:F6:B1:1A (OUI DF-A9-FF)
        Count: 1
< ACL Data TX: Handle 3819 flags 0x00 dlen 11               #57 [hci1] 6.750527
      SMP: Pairing Response (0x02) len 6
        IO capability: DisplayOnly (0x00)
        OOB data: Authentication data not present (0x00)
        Authentication requirement: Bonding, No MITM, SC, No Keypresses (0x09)
        Max encryption key size: 16
        Initiator key distribution: IdKey (0x02)
        Responder key distribution: <none> (0x00)
< HCI Command: Host Number of Compl.. (0x03|0x0035) plen 5  #58 [hci1] 6.750783
        Num handles: 1
        Handle: 3819 Address: DF:A9:FF:F6:B1:1A (OUI DF-A9-FF)
        Count: 1
> HCI Event: Number of Completed Packets (0x13) plen 5      #59 [hci1] 6.908145
        Num handles: 1
        Handle: 3819 Address: DF:A9:FF:F6:B1:1A (OUI DF-A9-FF)
        Count: 1
        #57: len 11 (0 Kb/s)
        Latency: 157 msec (157-164 msec ~161 msec)
> ACL Data RX: Handle 3819 flags 0x02 dlen 27               #60 [hci1] 6.908460
> ACL Data RX: Handle 3819 flags 0x01 dlen 27               #61 [hci1] 6.908982
> ACL Data RX: Handle 3819 flags 0x01 dlen 15               #62 [hci1] 6.909455
      SMP: Pairing Public Key (0x0c) len 64
        X: 60a3f596e379150ac1ee1ab7cb0d36451be4aca4c83c30a8944500f24fa11e5e
        Y: 50fb647128a10605eff1af14491ce2202fdc38e752eb66a1800bd4c6e2068aa7
< HCI Command: Host Number of Compl.. (0x03|0x0035) plen 5  #63 [hci1] 6.910985
        Num handles: 1
        Handle: 3819 Address: DF:A9:FF:F6:B1:1A (OUI DF-A9-FF)
        Count: 1
< HCI Command: Host Number of Compl.. (0x03|0x0035) plen 5  #64 [hci1] 6.911156
        Num handles: 1
        Handle: 3819 Address: DF:A9:FF:F6:B1:1A (OUI DF-A9-FF)
        Count: 1
< HCI Command: Host Number of Compl.. (0x03|0x0035) plen 5  #65 [hci1] 6.911487
        Num handles: 1
        Handle: 3819 Address: DF:A9:FF:F6:B1:1A (OUI DF-A9-FF)
        Count: 1
< ACL Data TX: Handle 3819 flags 0x00 dlen 27               #66 [hci1] 6.911569
< ACL Data TX: Handle 3819 flags 0x01 dlen 27               #67 [hci1] 6.911595
< ACL Data TX: Handle 3819 flags 0x01 dlen 15               #68 [hci1] 6.911617
      SMP: Pairing Public Key (0x0c) len 64
        X: 98308440221e2d910f0e54b71e7ec652857aa9b5a0dc65028824cc19db1226e9
        Y: 67a4816bcb62efb21701e31fdb27561a6217575fb007a8bbdabe7e28b6f68482
> HCI Event: Number of Completed Packets (0x13) plen 5      #69 [hci1] 6.996059
        Num handles: 1
        Handle: 3819 Address: DF:A9:FF:F6:B1:1A (OUI DF-A9-FF)
        Count: 1
        #66: len 27 (2 Kb/s)
        Latency: 84 msec (84-164 msec ~122 msec)
> HCI Event: Number of Completed Packets (0x13) plen 5      #70 [hci1] 6.996681
        Num handles: 1
        Handle: 3819 Address: DF:A9:FF:F6:B1:1A (OUI DF-A9-FF)
        Count: 1
        #67: len 27 (2 Kb/s)
        Latency: 85 msec (84-164 msec ~103 msec)
> HCI Event: Number of Completed Packets (0x13) plen 5      #71 [hci1] 7.082891
        Num handles: 1
        Handle: 3819 Address: DF:A9:FF:F6:B1:1A (OUI DF-A9-FF)
        Count: 1
        #68: len 15 (0 Kb/s)
        Latency: 171 msec (84-171 msec ~137 msec)
> ACL Data RX: Handle 3819 flags 0x02 dlen 21               #72 [hci1] 8.045749
      SMP: Pairing Confirm (0x03) len 16
        Confim value: bc81dea6aa654678a68819b606af6031
< HCI Command: Host Number of Compl.. (0x03|0x0035) plen 5  #73 [hci1] 8.050627
        Num handles: 1
        Handle: 3819 Address: DF:A9:FF:F6:B1:1A (OUI DF-A9-FF)
        Count: 1
< ACL Data TX: Handle 3819 flags 0x00 dlen 21               #74 [hci1] 8.050678
      SMP: Pairing Confirm (0x03) len 16
        Confim value: a95df0c373e3c8eabae52c2cd1424aa0
> HCI Event: Number of Completed Packets (0x13) plen 5      #75 [hci1] 8.220603
        Num handles: 1
        Handle: 3819 Address: DF:A9:FF:F6:B1:1A (OUI DF-A9-FF)
        Count: 1
        #74: len 21 (0 Kb/s)
        Latency: 169 msec (84-171 msec ~153 msec)
> ACL Data RX: Handle 3819 flags 0x02 dlen 21               #76 [hci1] 8.220870
      SMP: Pairing Random (0x04) len 16
        Random value: 7dd50f0bd4f5bcfa0000000000000000
< HCI Command: Host Number of Compl.. (0x03|0x0035) plen 5  #77 [hci1] 8.231042
        Num handles: 1
        Handle: 3819 Address: DF:A9:FF:F6:B1:1A (OUI DF-A9-FF)
        Count: 1
< ACL Data TX: Handle 3819 flags 0x00 dlen 21               #78 [hci1] 8.231113
      SMP: Pairing Random (0x04) len 16
        Random value: 8e6108f966a694cbe26df70bb96773e6
> HCI Event: Number of Completed Packets (0x13) plen 5      #79 [hci1] 8.395426
        Num handles: 1
        Handle: 3819 Address: DF:A9:FF:F6:B1:1A (OUI DF-A9-FF)
        Count: 1
        #78: len 21 (1 Kb/s)
        Latency: 164 msec (84-171 msec ~159 msec)
> ACL Data RX: Handle 3819 flags 0x02 dlen 21               #80 [hci1] 8.483272
      SMP: Pairing Confirm (0x03) len 16
        Confim value: 76925411a312761eefb624a8e17312f0
< HCI Command: Host Number of Compl.. (0x03|0x0035) plen 5  #81 [hci1] 8.490842
        Num handles: 1
        Handle: 3819 Address: DF:A9:FF:F6:B1:1A (OUI DF-A9-FF)
        Count: 1
< ACL Data TX: Handle 3819 flags 0x00 dlen 21               #82 [hci1] 8.490948
      SMP: Pairing Confirm (0x03) len 16
        Confim value: 8c71b36c57de48f819ebba336cf5df37
> HCI Event: Number of Completed Packets (0x13) plen 5      #83 [hci1] 8.658128
        Num handles: 1
        Handle: 3819 Address: DF:A9:FF:F6:B1:1A (OUI DF-A9-FF)
        Count: 1
        #82: len 21 (1 Kb/s)
        Latency: 167 msec (84-171 msec ~163 msec)
> ACL Data RX: Handle 3819 flags 0x02 dlen 21               #84 [hci1] 8.658390
      SMP: Pairing Random (0x04) len 16
        Random value: 88336a5ea0a8e24a0000000000000000
< HCI Command: Host Number of Compl.. (0x03|0x0035) plen 5  #85 [hci1] 8.671081
        Num handles: 1
        Handle: 3819 Address: DF:A9:FF:F6:B1:1A (OUI DF-A9-FF)
        Count: 1
< ACL Data TX: Handle 3819 flags 0x00 dlen 21               #86 [hci1] 8.671162
      SMP: Pairing Random (0x04) len 16
        Random value: 4d02679f89a05211af56d8b3da64d21e
> HCI Event: Number of Completed Packets (0x13) plen 5      #87 [hci1] 8.832902
        Num handles: 1
        Handle: 3819 Address: DF:A9:FF:F6:B1:1A (OUI DF-A9-FF)
        Count: 1
        #86: len 21 (1 Kb/s)
        Latency: 161 msec (84-171 msec ~162 msec)
> ACL Data RX: Handle 3819 flags 0x02 dlen 21               #88 [hci1] 8.920666
      SMP: Pairing Confirm (0x03) len 16
        Confim value: f0e5249bbbd1ae699d95915ffb67c569
< HCI Command: Host Number of Compl.. (0x03|0x0035) plen 5  #89 [hci1] 8.930871
        Num handles: 1
        Handle: 3819 Address: DF:A9:FF:F6:B1:1A (OUI DF-A9-FF)
        Count: 1
< ACL Data TX: Handle 3819 flags 0x00 dlen 21               #90 [hci1] 8.930984
      SMP: Pairing Confirm (0x03) len 16
        Confim value: bb4a7ad2c2df5a7aff236723846e1212
> HCI Event: Number of Completed Packets (0x13) plen 5      #91 [hci1] 9.095625
        Num handles: 1
        Handle: 3819 Address: DF:A9:FF:F6:B1:1A (OUI DF-A9-FF)
        Count: 1
        #90: len 21 (1 Kb/s)
        Latency: 164 msec (84-171 msec ~163 msec)
> ACL Data RX: Handle 3819 flags 0x02 dlen 21               #92 [hci1] 9.095971
      SMP: Pairing Random (0x04) len 16
        Random value: 5eaea912682ae3840000000000000000
< HCI Command: Host Number of Compl.. (0x03|0x0035) plen 5  #93 [hci1] 9.111002
        Num handles: 1
        Handle: 3819 Address: DF:A9:FF:F6:B1:1A (OUI DF-A9-FF)
        Count: 1
< ACL Data TX: Handle 3819 flags 0x00 dlen 21               #94 [hci1] 9.111141
      SMP: Pairing Random (0x04) len 16
        Random value: 5e8286bc235a02440d0c3424a2acf8fd
> HCI Event: Number of Completed Packets (0x13) plen 5      #95 [hci1] 9.270411
        Num handles: 1
        Handle: 3819 Address: DF:A9:FF:F6:B1:1A (OUI DF-A9-FF)
        Count: 1
        #94: len 21 (1 Kb/s)
        Latency: 159 msec (84-171 msec ~161 msec)
> ACL Data RX: Handle 3819 flags 0x02 dlen 21               #96 [hci1] 9.358198
      SMP: Pairing Confirm (0x03) len 16
        Confim value: 708b8e50714b4e71a66d824b90f3e88f
< HCI Command: Host Number of Compl.. (0x03|0x0035) plen 5  #97 [hci1] 9.370920
        Num handles: 1
        Handle: 3819 Address: DF:A9:FF:F6:B1:1A (OUI DF-A9-FF)
        Count: 1
< ACL Data TX: Handle 3819 flags 0x00 dlen 21               #98 [hci1] 9.370973
      SMP: Pairing Confirm (0x03) len 16
        Confim value: c7b36a133c788ea1fd6abb6e502d4d7c
> HCI Event: Number of Completed Packets (0x13) plen 5      #99 [hci1] 9.533032
        Num handles: 1
        Handle: 3819 Address: DF:A9:FF:F6:B1:1A (OUI DF-A9-FF)
        Count: 1
        #98: len 21 (1 Kb/s)
        Latency: 162 msec (84-171 msec ~161 msec)
> ACL Data RX: Handle 3819 flags 0x02 dlen 21              #100 [hci1] 9.533347
      SMP: Pairing Random (0x04) len 16
        Random value: 4157b64477c342f20000000000000000
< HCI Command: Host Number of Comp.. (0x03|0x0035) plen 5  #101 [hci1] 9.551030
        Num handles: 1
        Handle: 3819 Address: DF:A9:FF:F6:B1:1A (OUI DF-A9-FF)
        Count: 1
< ACL Data TX: Handle 3819 flags 0x00 dlen 21              #102 [hci1] 9.551118
      SMP: Pairing Random (0x04) len 16
        Random value: 5c4a1bcadd27bd58e945097b00bad7ac
> HCI Event: Number of Completed Packets (0x13) plen 5     #103 [hci1] 9.707893
        Num handles: 1
        Handle: 3819 Address: DF:A9:FF:F6:B1:1A (OUI DF-A9-FF)
        Count: 1
        #102: len 21 (1 Kb/s)
        Latency: 156 msec (84-171 msec ~159 msec)
> ACL Data RX: Handle 3819 flags 0x02 dlen 21              #104 [hci1] 9.795727
      SMP: Pairing Confirm (0x03) len 16
        Confim value: 2b7486290263d2524e56da1aadedbde4
< HCI Command: Host Number of Comp.. (0x03|0x0035) plen 5  #105 [hci1] 9.810536
        Num handles: 1
        Handle: 3819 Address: DF:A9:FF:F6:B1:1A (OUI DF-A9-FF)
        Count: 1
< ACL Data TX: Handle 3819 flags 0x00 dlen 21              #106 [hci1] 9.810575
      SMP: Pairing Confirm (0x03) len 16
        Confim value: 8bc801105f16e84415d97fbc590eb8de
> HCI Event: Number of Completed Packets (0x13) plen 5     #107 [hci1] 9.970509
        Num handles: 1
        Handle: 3819 Address: DF:A9:FF:F6:B1:1A (OUI DF-A9-FF)
        Count: 1
        #106: len 21 (1 Kb/s)
        Latency: 159 msec (84-171 msec ~159 msec)
> ACL Data RX: Handle 3819 flags 0x02 dlen 21              #108 [hci1] 9.971013
      SMP: Pairing Random (0x04) len 16
        Random value: 654357b141d01f640000000000000000
< HCI Command: Host Number of Comp.. (0x03|0x0035) plen 5  #109 [hci1] 9.991059
        Num handles: 1
        Handle: 3819 Address: DF:A9:FF:F6:B1:1A (OUI DF-A9-FF)
        Count: 1
< ACL Data TX: Handle 3819 flags 0x00 dlen 21              #110 [hci1] 9.991157
      SMP: Pairing Random (0x04) len 16
        Random value: 32527e6e64e79f33b2e374394db8ab2d
> HCI Event: Number of Completed Packets (0x13) plen 5    #111 [hci1] 10.145336
        Num handles: 1
        Handle: 3819 Address: DF:A9:FF:F6:B1:1A (OUI DF-A9-FF)
        Count: 1
        #110: len 21 (1 Kb/s)
        Latency: 154 msec (84-171 msec ~156 msec)
> ACL Data RX: Handle 3819 flags 0x02 dlen 21             #112 [hci1] 10.233164
      SMP: Pairing Confirm (0x03) len 16
        Confim value: 61e9a7dd1bf46e7debc374c182f3abe4
< HCI Command: Host Number of Com.. (0x03|0x0035) plen 5  #113 [hci1] 10.250743
        Num handles: 1
        Handle: 3819 Address: DF:A9:FF:F6:B1:1A (OUI DF-A9-FF)
        Count: 1
< ACL Data TX: Handle 3819 flags 0x00 dlen 21             #114 [hci1] 10.250838
      SMP: Pairing Confirm (0x03) len 16
        Confim value: b27564c8659477a8743eb1bece4b97bd
> HCI Event: Number of Completed Packets (0x13) plen 5    #115 [hci1] 10.408078
        Num handles: 1
        Handle: 3819 Address: DF:A9:FF:F6:B1:1A (OUI DF-A9-FF)
        Count: 1
        #114: len 21 (1 Kb/s)
        Latency: 157 msec (84-171 msec ~157 msec)
> ACL Data RX: Handle 3819 flags 0x02 dlen 21             #116 [hci1] 10.408418
      SMP: Pairing Random (0x04) len 16
        Random value: f59bb744e909dcbd0000000000000000
< HCI Command: Host Number of Com.. (0x03|0x0035) plen 5  #117 [hci1] 10.410980
        Num handles: 1
        Handle: 3819 Address: DF:A9:FF:F6:B1:1A (OUI DF-A9-FF)
        Count: 1
< ACL Data TX: Handle 3819 flags 0x00 dlen 21             #118 [hci1] 10.411067
      SMP: Pairing Random (0x04) len 16
        Random value: dddbdfe2838e9a8cc6964353c850fef7
> HCI Event: Number of Completed Packets (0x13) plen 5    #119 [hci1] 10.582841
        Num handles: 1
        Handle: 3819 Address: DF:A9:FF:F6:B1:1A (OUI DF-A9-FF)
        Count: 1
        #118: len 21 (0 Kb/s)
        Latency: 171 msec (84-171 msec ~164 msec)
> ACL Data RX: Handle 3819 flags 0x02 dlen 21             #120 [hci1] 10.670667
      SMP: Pairing Confirm (0x03) len 16
        Confim value: 78ed2d14905dbd4e83e4fb4ae1c42a03
< HCI Command: Host Number of Com.. (0x03|0x0035) plen 5  #121 [hci1] 10.690812
        Num handles: 1
        Handle: 3819 Address: DF:A9:FF:F6:B1:1A (OUI DF-A9-FF)
        Count: 1
< ACL Data TX: Handle 3819 flags 0x00 dlen 21             #122 [hci1] 10.690915
      SMP: Pairing Confirm (0x03) len 16
        Confim value: b4f9e840190f20587384565cc7d45384
> HCI Event: Number of Completed Packets (0x13) plen 5    #123 [hci1] 10.845496
        Num handles: 1
        Handle: 3819 Address: DF:A9:FF:F6:B1:1A (OUI DF-A9-FF)
        Count: 1
        #122: len 21 (1 Kb/s)
        Latency: 154 msec (84-171 msec ~159 msec)
> ACL Data RX: Handle 3819 flags 0x02 dlen 21             #124 [hci1] 10.845955
      SMP: Pairing Random (0x04) len 16
        Random value: 03423f254454bb090000000000000000
< HCI Command: Host Number of Com.. (0x03|0x0035) plen 5  #125 [hci1] 10.851030
        Num handles: 1
        Handle: 3819 Address: DF:A9:FF:F6:B1:1A (OUI DF-A9-FF)
        Count: 1
< ACL Data TX: Handle 3819 flags 0x00 dlen 21             #126 [hci1] 10.851122
      SMP: Pairing Random (0x04) len 16
        Random value: eb9f1915536596b6fc3db1c86b2b1970
> HCI Event: Number of Completed Packets (0x13) plen 5    #127 [hci1] 11.020368
        Num handles: 1
        Handle: 3819 Address: DF:A9:FF:F6:B1:1A (OUI DF-A9-FF)
        Count: 1
        #126: len 21 (0 Kb/s)
        Latency: 169 msec (84-171 msec ~164 msec)
> ACL Data RX: Handle 3819 flags 0x02 dlen 21             #128 [hci1] 11.108146
      SMP: Pairing Confirm (0x03) len 16
        Confim value: 08e795cebe6553c34dc321c8c7550afa
< HCI Command: Host Number of Com.. (0x03|0x0035) plen 5  #129 [hci1] 11.110879
        Num handles: 1
        Handle: 3819 Address: DF:A9:FF:F6:B1:1A (OUI DF-A9-FF)
        Count: 1
< ACL Data TX: Handle 3819 flags 0x00 dlen 21             #130 [hci1] 11.110989
      SMP: Pairing Confirm (0x03) len 16
        Confim value: a578027804b7e500d86d7e013a04705e
> HCI Event: Number of Completed Packets (0x13) plen 5    #131 [hci1] 11.282972
        Num handles: 1
        Handle: 3819 Address: DF:A9:FF:F6:B1:1A (OUI DF-A9-FF)
        Count: 1
        #130: len 21 (0 Kb/s)
        Latency: 171 msec (84-171 msec ~168 msec)
> ACL Data RX: Handle 3819 flags 0x02 dlen 21             #132 [hci1] 11.283379
      SMP: Pairing Random (0x04) len 16
        Random value: 6f3a85602a79fe5e0000000000000000
< HCI Command: Host Number of Com.. (0x03|0x0035) plen 5  #133 [hci1] 11.291056
        Num handles: 1
        Handle: 3819 Address: DF:A9:FF:F6:B1:1A (OUI DF-A9-FF)
        Count: 1
< ACL Data TX: Handle 3819 flags 0x00 dlen 21             #134 [hci1] 11.291151
      SMP: Pairing Random (0x04) len 16
        Random value: 5c794dc9ad9f2c3f295ebd5ad5e1c3cf
> HCI Event: Number of Completed Packets (0x13) plen 5    #135 [hci1] 11.457746
        Num handles: 1
        Handle: 3819 Address: DF:A9:FF:F6:B1:1A (OUI DF-A9-FF)
        Count: 1
        #134: len 21 (1 Kb/s)
        Latency: 166 msec (84-171 msec ~167 msec)
> ACL Data RX: Handle 3819 flags 0x02 dlen 21             #136 [hci1] 11.545699
      SMP: Pairing Confirm (0x03) len 16
        Confim value: d1abdf0c696f95a9c98ec42f889a853b
< HCI Command: Host Number of Com.. (0x03|0x0035) plen 5  #137 [hci1] 11.550749
        Num handles: 1
        Handle: 3819 Address: DF:A9:FF:F6:B1:1A (OUI DF-A9-FF)
        Count: 1
< ACL Data TX: Handle 3819 flags 0x00 dlen 21             #138 [hci1] 11.550831
      SMP: Pairing Confirm (0x03) len 16
        Confim value: f3513b673fbea1748f520f7a8c7cdb27
> HCI Event: Number of Completed Packets (0x13) plen 5    #139 [hci1] 11.720469
        Num handles: 1
        Handle: 3819 Address: DF:A9:FF:F6:B1:1A (OUI DF-A9-FF)
        Count: 1
        #138: len 21 (0 Kb/s)
        Latency: 169 msec (84-171 msec ~168 msec)
> ACL Data RX: Handle 3819 flags 0x02 dlen 21             #140 [hci1] 11.720859
      SMP: Pairing Random (0x04) len 16
        Random value: 75315cbad4369ef80000000000000000
< HCI Command: Host Number of Com.. (0x03|0x0035) plen 5  #141 [hci1] 11.731015
        Num handles: 1
        Handle: 3819 Address: DF:A9:FF:F6:B1:1A (OUI DF-A9-FF)
        Count: 1
< ACL Data TX: Handle 3819 flags 0x00 dlen 21             #142 [hci1] 11.731110
      SMP: Pairing Random (0x04) len 16
        Random value: 5c2fff312cdf99c9491988e877355a9a
> HCI Event: Number of Completed Packets (0x13) plen 5    #143 [hci1] 11.895281
        Num handles: 1
        Handle: 3819 Address: DF:A9:FF:F6:B1:1A (OUI DF-A9-FF)
        Count: 1
        #142: len 21 (1 Kb/s)
        Latency: 164 msec (84-171 msec ~166 msec)
> ACL Data RX: Handle 3819 flags 0x02 dlen 21             #144 [hci1] 11.983138
      SMP: Pairing Confirm (0x03) len 16
        Confim value: 4a7ea2e3e0f2ad27398b1dcd8be50970
< HCI Command: Host Number of Com.. (0x03|0x0035) plen 5  #145 [hci1] 11.990678
        Num handles: 1
        Handle: 3819 Address: DF:A9:FF:F6:B1:1A (OUI DF-A9-FF)
        Count: 1
< ACL Data TX: Handle 3819 flags 0x00 dlen 21             #146 [hci1] 11.990720
      SMP: Pairing Confirm (0x03) len 16
        Confim value: 3d7ba63d487dbdd9047e5e3a75b1d7b3
> HCI Event: Number of Completed Packets (0x13) plen 5    #147 [hci1] 12.158096
        Num handles: 1
        Handle: 3819 Address: DF:A9:FF:F6:B1:1A (OUI DF-A9-FF)
        Count: 1
        #146: len 21 (1 Kb/s)
        Latency: 167 msec (84-171 msec ~166 msec)
> ACL Data RX: Handle 3819 flags 0x02 dlen 21             #148 [hci1] 12.158343
      SMP: Pairing Random (0x04) len 16
        Random value: 2435bf852196f6810000000000000000
< HCI Command: Host Number of Com.. (0x03|0x0035) plen 5  #149 [hci1] 12.171072
        Num handles: 1
        Handle: 3819 Address: DF:A9:FF:F6:B1:1A (OUI DF-A9-FF)
        Count: 1
< ACL Data TX: Handle 3819 flags 0x00 dlen 21             #150 [hci1] 12.171193
      SMP: Pairing Random (0x04) len 16
        Random value: c629a3a987d808e808655d558dfc1155
> HCI Event: Number of Completed Packets (0x13) plen 5    #151 [hci1] 12.332848
        Num handles: 1
        Handle: 3819 Address: DF:A9:FF:F6:B1:1A (OUI DF-A9-FF)
        Count: 1
        #150: len 21 (1 Kb/s)
        Latency: 161 msec (84-171 msec ~164 msec)
> ACL Data RX: Handle 3819 flags 0x02 dlen 21             #152 [hci1] 12.420697
      SMP: Pairing Confirm (0x03) len 16
        Confim value: 22d6a380df1160c38a5d9f541782731a
< HCI Command: Host Number of Com.. (0x03|0x0035) plen 5  #153 [hci1] 12.430855
        Num handles: 1
        Handle: 3819 Address: DF:A9:FF:F6:B1:1A (OUI DF-A9-FF)
        Count: 1
< ACL Data TX: Handle 3819 flags 0x00 dlen 21             #154 [hci1] 12.430959
      SMP: Pairing Confirm (0x03) len 16
        Confim value: 48f85af5acafed9b7adb8ccaa34972a6
> HCI Event: Number of Completed Packets (0x13) plen 5    #155 [hci1] 12.595494
        Num handles: 1
        Handle: 3819 Address: DF:A9:FF:F6:B1:1A (OUI DF-A9-FF)
        Count: 1
        #154: len 21 (1 Kb/s)
        Latency: 164 msec (84-171 msec ~164 msec)
> ACL Data RX: Handle 3819 flags 0x02 dlen 21             #156 [hci1] 12.595783
      SMP: Pairing Random (0x04) len 16
        Random value: e8eb04d0db69a83f0000000000000000
< HCI Command: Host Number of Com.. (0x03|0x0035) plen 5  #157 [hci1] 12.611080
        Num handles: 1
        Handle: 3819 Address: DF:A9:FF:F6:B1:1A (OUI DF-A9-FF)
        Count: 1
< ACL Data TX: Handle 3819 flags 0x00 dlen 21             #158 [hci1] 12.611179
      SMP: Pairing Random (0x04) len 16
        Random value: 92f20f6ad8f13724432c7fd6001c45ff
> HCI Event: Number of Completed Packets (0x13) plen 5    #159 [hci1] 12.770268
        Num handles: 1
        Handle: 3819 Address: DF:A9:FF:F6:B1:1A (OUI DF-A9-FF)
        Count: 1
        #158: len 21 (1 Kb/s)
        Latency: 159 msec (84-171 msec ~161 msec)
> ACL Data RX: Handle 3819 flags 0x02 dlen 21             #160 [hci1] 12.858122
      SMP: Pairing Confirm (0x03) len 16
        Confim value: 2c38ed2867a42eeaeb6f583202a84bb7
< HCI Command: Host Number of Com.. (0x03|0x0035) plen 5  #161 [hci1] 12.870740
        Num handles: 1
        Handle: 3819 Address: DF:A9:FF:F6:B1:1A (OUI DF-A9-FF)
        Count: 1
< ACL Data TX: Handle 3819 flags 0x00 dlen 21             #162 [hci1] 12.870854
      SMP: Pairing Confirm (0x03) len 16
        Confim value: c2c133afe6a7dc5ae5573228704a7c99
> HCI Event: Number of Completed Packets (0x13) plen 5    #163 [hci1] 13.032971
        Num handles: 1
        Handle: 3819 Address: DF:A9:FF:F6:B1:1A (OUI DF-A9-FF)
        Count: 1
        #162: len 21 (1 Kb/s)
        Latency: 162 msec (84-171 msec ~161 msec)
> ACL Data RX: Handle 3819 flags 0x02 dlen 21             #164 [hci1] 13.033381
      SMP: Pairing Random (0x04) len 16
        Random value: 32b5504d390149410000000000000000
< HCI Command: Host Number of Com.. (0x03|0x0035) plen 5  #165 [hci1] 13.051014
        Num handles: 1
        Handle: 3819 Address: DF:A9:FF:F6:B1:1A (OUI DF-A9-FF)
        Count: 1
< ACL Data TX: Handle 3819 flags 0x00 dlen 21             #166 [hci1] 13.051096
      SMP: Pairing Random (0x04) len 16
        Random value: 23ac32ebbb5e14c8a6b9622f296d277f
> HCI Event: Number of Completed Packets (0x13) plen 5    #167 [hci1] 13.207790
        Num handles: 1
        Handle: 3819 Address: DF:A9:FF:F6:B1:1A (OUI DF-A9-FF)
        Count: 1
        #166: len 21 (1 Kb/s)
        Latency: 156 msec (84-171 msec ~159 msec)
> ACL Data RX: Handle 3819 flags 0x02 dlen 21             #168 [hci1] 13.295775
      SMP: Pairing Confirm (0x03) len 16
        Confim value: 2e6b7fa17d984dd83a83d82bec54bad0
< HCI Command: Host Number of Com.. (0x03|0x0035) plen 5  #169 [hci1] 13.310906
        Num handles: 1
        Handle: 3819 Address: DF:A9:FF:F6:B1:1A (OUI DF-A9-FF)
        Count: 1
< ACL Data TX: Handle 3819 flags 0x00 dlen 21             #170 [hci1] 13.311007
      SMP: Pairing Confirm (0x03) len 16
        Confim value: 0cf249ec235ce77352667d33298a2a64
> HCI Event: Number of Completed Packets (0x13) plen 5    #171 [hci1] 13.470505
        Num handles: 1
        Handle: 3819 Address: DF:A9:FF:F6:B1:1A (OUI DF-A9-FF)
        Count: 1
        #170: len 21 (1 Kb/s)
        Latency: 159 msec (84-171 msec ~159 msec)
> ACL Data RX: Handle 3819 flags 0x02 dlen 21             #172 [hci1] 13.470901
      SMP: Pairing Random (0x04) len 16
        Random value: 21917fd02399c71e0000000000000000
< HCI Command: Host Number of Com.. (0x03|0x0035) plen 5  #173 [hci1] 13.490979
        Num handles: 1
        Handle: 3819 Address: DF:A9:FF:F6:B1:1A (OUI DF-A9-FF)
        Count: 1
< ACL Data TX: Handle 3819 flags 0x00 dlen 21             #174 [hci1] 13.491108
      SMP: Pairing Random (0x04) len 16
        Random value: 297efe85e67448a15f56bd27e3a3cf1d
> HCI Event: Number of Completed Packets (0x13) plen 5    #175 [hci1] 13.645269
        Num handles: 1
        Handle: 3819 Address: DF:A9:FF:F6:B1:1A (OUI DF-A9-FF)
        Count: 1
        #174: len 21 (1 Kb/s)
        Latency: 154 msec (84-171 msec ~156 msec)
> ACL Data RX: Handle 3819 flags 0x02 dlen 21             #176 [hci1] 13.733145
      SMP: Pairing Confirm (0x03) len 16
        Confim value: 6c375786d814300a2e4e4c069818619b
< HCI Command: Host Number of Com.. (0x03|0x0035) plen 5  #177 [hci1] 13.750868
        Num handles: 1
        Handle: 3819 Address: DF:A9:FF:F6:B1:1A (OUI DF-A9-FF)
        Count: 1
< ACL Data TX: Handle 3819 flags 0x00 dlen 21             #178 [hci1] 13.751026
      SMP: Pairing Confirm (0x03) len 16
        Confim value: 25e583a5ef50f089af5f548449f7f4ab
> HCI Event: Number of Completed Packets (0x13) plen 5    #179 [hci1] 13.907942
        Num handles: 1
        Handle: 3819 Address: DF:A9:FF:F6:B1:1A (OUI DF-A9-FF)
        Count: 1
        #178: len 21 (1 Kb/s)
        Latency: 156 msec (84-171 msec ~156 msec)
> ACL Data RX: Handle 3819 flags 0x02 dlen 21             #180 [hci1] 13.908296
      SMP: Pairing Random (0x04) len 16
        Random value: fce96b5bbcda5d190000000000000000
< HCI Command: Host Number of Com.. (0x03|0x0035) plen 5  #181 [hci1] 13.911082
        Num handles: 1
        Handle: 3819 Address: DF:A9:FF:F6:B1:1A (OUI DF-A9-FF)
        Count: 1
< ACL Data TX: Handle 3819 flags 0x00 dlen 21             #182 [hci1] 13.911160
      SMP: Pairing Random (0x04) len 16
        Random value: 25a9493fd3ce4faf02be7293595bb7c6
> HCI Event: Number of Completed Packets (0x13) plen 5    #183 [hci1] 14.082823
        Num handles: 1
        Handle: 3819 Address: DF:A9:FF:F6:B1:1A (OUI DF-A9-FF)
        Count: 1
        #182: len 21 (0 Kb/s)
        Latency: 171 msec (84-171 msec ~164 msec)
> ACL Data RX: Handle 3819 flags 0x02 dlen 21             #184 [hci1] 14.170645
      SMP: Pairing Confirm (0x03) len 16
        Confim value: 9be633a7e3e17bac78d3c3632c9e3ee6
< HCI Command: Host Number of Com.. (0x03|0x0035) plen 5  #185 [hci1] 14.190818
        Num handles: 1
        Handle: 3819 Address: DF:A9:FF:F6:B1:1A (OUI DF-A9-FF)
        Count: 1
< ACL Data TX: Handle 3819 flags 0x00 dlen 21             #186 [hci1] 14.190989
      SMP: Pairing Confirm (0x03) len 16
        Confim value: e03849752831770e04f4ac114b0d07d0
> HCI Event: Number of Completed Packets (0x13) plen 5    #187 [hci1] 14.345486
        Num handles: 1
        Handle: 3819 Address: DF:A9:FF:F6:B1:1A (OUI DF-A9-FF)
        Count: 1
        #186: len 21 (1 Kb/s)
        Latency: 154 msec (84-171 msec ~159 msec)
> ACL Data RX: Handle 3819 flags 0x02 dlen 21             #188 [hci1] 14.345785
      SMP: Pairing Random (0x04) len 16
        Random value: 2d7c638f520778bd0000000000000000
< HCI Command: Host Number of Com.. (0x03|0x0035) plen 5  #189 [hci1] 14.351063
        Num handles: 1
        Handle: 3819 Address: DF:A9:FF:F6:B1:1A (OUI DF-A9-FF)
        Count: 1
< ACL Data TX: Handle 3819 flags 0x00 dlen 21             #190 [hci1] 14.351173
      SMP: Pairing Random (0x04) len 16
        Random value: 58f6b41f855a6f6c3560debd84e2affc
> HCI Event: Number of Completed Packets (0x13) plen 5    #191 [hci1] 14.520239
        Num handles: 1
        Handle: 3819 Address: DF:A9:FF:F6:B1:1A (OUI DF-A9-FF)
        Count: 1
        #190: len 21 (0 Kb/s)
        Latency: 169 msec (84-171 msec ~164 msec)
> ACL Data RX: Handle 3819 flags 0x02 dlen 21             #192 [hci1] 14.608145
      SMP: Pairing Confirm (0x03) len 16
        Confim value: 7d2ce0a1c8a09f676ef2b5385bfaab71
< HCI Command: Host Number of Com.. (0x03|0x0035) plen 5  #193 [hci1] 14.610849
        Num handles: 1
        Handle: 3819 Address: DF:A9:FF:F6:B1:1A (OUI DF-A9-FF)
        Count: 1
< ACL Data TX: Handle 3819 flags 0x00 dlen 21             #194 [hci1] 14.611007
      SMP: Pairing Confirm (0x03) len 16
        Confim value: dad0d20dac6beafe538c8e569ac8e611
> HCI Event: Number of Completed Packets (0x13) plen 5    #195 [hci1] 14.782939
        Num handles: 1
        Handle: 3819 Address: DF:A9:FF:F6:B1:1A (OUI DF-A9-FF)
        Count: 1
        #194: len 21 (0 Kb/s)
        Latency: 171 msec (84-171 msec ~168 msec)
> ACL Data RX: Handle 3819 flags 0x02 dlen 21             #196 [hci1] 14.783310
      SMP: Pairing Random (0x04) len 16
        Random value: f84e1c61461ab5c90000000000000000
< HCI Command: Host Number of Com.. (0x03|0x0035) plen 5  #197 [hci1] 14.790684
        Num handles: 1
        Handle: 3819 Address: DF:A9:FF:F6:B1:1A (OUI DF-A9-FF)
        Count: 1
< ACL Data TX: Handle 3819 flags 0x00 dlen 21             #198 [hci1] 14.790763
      SMP: Pairing Random (0x04) len 16
        Random value: b67e7216d5bf664139eda2b542549666
> HCI Event: Number of Completed Packets (0x13) plen 5    #199 [hci1] 14.957693
        Num handles: 1
        Handle: 3819 Address: DF:A9:FF:F6:B1:1A (OUI DF-A9-FF)
        Count: 1
        #198: len 21 (1 Kb/s)
        Latency: 166 msec (84-171 msec ~167 msec)
> ACL Data RX: Handle 3819 flags 0x02 dlen 21             #200 [hci1] 15.045669
      SMP: Pairing Confirm (0x03) len 16
        Confim value: 7a77550c123c8de74c5ef0221983fa8f
< HCI Command: Host Number of Com.. (0x03|0x0035) plen 5  #201 [hci1] 15.050838
        Num handles: 1
        Handle: 3819 Address: DF:A9:FF:F6:B1:1A (OUI DF-A9-FF)
        Count: 1
< ACL Data TX: Handle 3819 flags 0x00 dlen 21             #202 [hci1] 15.050918
      SMP: Pairing Confirm (0x03) len 16
        Confim value: a092b0d17adceb844dde4c7af0eb988f
> HCI Event: Number of Completed Packets (0x13) plen 5    #203 [hci1] 15.220430
        Num handles: 1
        Handle: 3819 Address: DF:A9:FF:F6:B1:1A (OUI DF-A9-FF)
        Count: 1
        #202: len 21 (0 Kb/s)
        Latency: 169 msec (84-171 msec ~168 msec)
> ACL Data RX: Handle 3819 flags 0x02 dlen 21             #204 [hci1] 15.220783
      SMP: Pairing Random (0x04) len 16
        Random value: daa2223880aad6a00000000000000000
< HCI Command: Host Number of Com.. (0x03|0x0035) plen 5  #205 [hci1] 15.230995
        Num handles: 1
        Handle: 3819 Address: DF:A9:FF:F6:B1:1A (OUI DF-A9-FF)
        Count: 1
< ACL Data TX: Handle 3819 flags 0x00 dlen 21             #206 [hci1] 15.231097
      SMP: Pairing Random (0x04) len 16
        Random value: ed17f76500c95219dd01e09d1e63f87b
> HCI Event: Number of Completed Packets (0x13) plen 5    #207 [hci1] 15.395198
        Num handles: 1
        Handle: 3819 Address: DF:A9:FF:F6:B1:1A (OUI DF-A9-FF)
        Count: 1
        #206: len 21 (1 Kb/s)
        Latency: 164 msec (84-171 msec ~166 msec)
> ACL Data RX: Handle 3819 flags 0x02 dlen 21             #208 [hci1] 15.483109
      SMP: Pairing Confirm (0x03) len 16
        Confim value: d86805c75403e878bc471520881e3b17
< HCI Command: Host Number of Com.. (0x03|0x0035) plen 5  #209 [hci1] 15.490950
        Num handles: 1
        Handle: 3819 Address: DF:A9:FF:F6:B1:1A (OUI DF-A9-FF)
        Count: 1
< ACL Data TX: Handle 3819 flags 0x00 dlen 21             #210 [hci1] 15.491113
      SMP: Pairing Confirm (0x03) len 16
        Confim value: 04c0a2afc10ad193976816e5ad337fe3
> HCI Event: Number of Completed Packets (0x13) plen 5    #211 [hci1] 15.657963
        Num handles: 1
        Handle: 3819 Address: DF:A9:FF:F6:B1:1A (OUI DF-A9-FF)
        Count: 1
        #210: len 21 (1 Kb/s)
        Latency: 166 msec (84-171 msec ~166 msec)
> ACL Data RX: Handle 3819 flags 0x02 dlen 21             #212 [hci1] 15.658288
      SMP: Pairing Random (0x04) len 16
        Random value: e5ed9a16b4e2896a0000000000000000
< HCI Command: Host Number of Com.. (0x03|0x0035) plen 5  #213 [hci1] 15.671091
        Num handles: 1
        Handle: 3819 Address: DF:A9:FF:F6:B1:1A (OUI DF-A9-FF)
        Count: 1
< ACL Data TX: Handle 3819 flags 0x00 dlen 21             #214 [hci1] 15.671210
      SMP: Pairing Random (0x04) len 16
        Random value: 81d35d47e1f6006d79c974bd9d9e1ee3
> HCI Event: Number of Completed Packets (0x13) plen 5    #215 [hci1] 15.832665
        Num handles: 1
        Handle: 3819 Address: DF:A9:FF:F6:B1:1A (OUI DF-A9-FF)
        Count: 1
        #214: len 21 (1 Kb/s)
        Latency: 161 msec (84-171 msec ~164 msec)
> ACL Data RX: Handle 3819 flags 0x02 dlen 21             #216 [hci1] 15.920626
      SMP: Pairing Confirm (0x03) len 16
        Confim value: 3d3aae39c9c5d0c9445780aec4812289
< HCI Command: Host Number of Com.. (0x03|0x0035) plen 5  #217 [hci1] 15.930576
        Num handles: 1
        Handle: 3819 Address: DF:A9:FF:F6:B1:1A (OUI DF-A9-FF)
        Count: 1
< ACL Data TX: Handle 3819 flags 0x00 dlen 21             #218 [hci1] 15.930615
      SMP: Pairing Confirm (0x03) len 16
        Confim value: b8e70b44a16b624f50b94bfdb000cafc
> HCI Event: Number of Completed Packets (0x13) plen 5    #219 [hci1] 16.095405
        Num handles: 1
        Handle: 3819 Address: DF:A9:FF:F6:B1:1A (OUI DF-A9-FF)
        Count: 1
        #218: len 21 (1 Kb/s)
        Latency: 164 msec (84-171 msec ~164 msec)
> ACL Data RX: Handle 3819 flags 0x02 dlen 21             #220 [hci1] 16.095779
      SMP: Pairing Random (0x04) len 16
        Random value: 3ddaf027dd25ee7b0000000000000000
< HCI Command: Host Number of Com.. (0x03|0x0035) plen 5  #221 [hci1] 16.111110
        Num handles: 1
        Handle: 3819 Address: DF:A9:FF:F6:B1:1A (OUI DF-A9-FF)
        Count: 1
< ACL Data TX: Handle 3819 flags 0x00 dlen 21             #222 [hci1] 16.111198
      SMP: Pairing Random (0x04) len 16
        Random value: e7f7e0c2476823e41736a7e381bafb7c
> HCI Event: Number of Completed Packets (0x13) plen 5    #223 [hci1] 16.270215
        Num handles: 1
        Handle: 3819 Address: DF:A9:FF:F6:B1:1A (OUI DF-A9-FF)
        Count: 1
        #222: len 21 (1 Kb/s)
        Latency: 159 msec (84-171 msec ~161 msec)
> ACL Data RX: Handle 3819 flags 0x02 dlen 21             #224 [hci1] 16.358106
      SMP: Pairing Confirm (0x03) len 16
        Confim value: 4a1ec600d1fa74c526a89b535a9e161e
< HCI Command: Host Number of Com.. (0x03|0x0035) plen 5  #225 [hci1] 16.370618
        Num handles: 1
        Handle: 3819 Address: DF:A9:FF:F6:B1:1A (OUI DF-A9-FF)
        Count: 1
< ACL Data TX: Handle 3819 flags 0x00 dlen 21             #226 [hci1] 16.370720
      SMP: Pairing Confirm (0x03) len 16
        Confim value: 598b8adf8c0db3e75e6101cf5a43c281
> HCI Event: Number of Completed Packets (0x13) plen 5    #227 [hci1] 16.532884
        Num handles: 1
        Handle: 3819 Address: DF:A9:FF:F6:B1:1A (OUI DF-A9-FF)
        Count: 1
        #226: len 21 (1 Kb/s)
        Latency: 162 msec (84-171 msec ~161 msec)
> ACL Data RX: Handle 3819 flags 0x02 dlen 21             #228 [hci1] 16.533306
      SMP: Pairing Random (0x04) len 16
        Random value: 50702f27e0e4e6740000000000000000
< HCI Command: Host Number of Com.. (0x03|0x0035) plen 5  #229 [hci1] 16.551140
        Num handles: 1
        Handle: 3819 Address: DF:A9:FF:F6:B1:1A (OUI DF-A9-FF)
        Count: 1
< ACL Data TX: Handle 3819 flags 0x00 dlen 21             #230 [hci1] 16.551220
      SMP: Pairing Random (0x04) len 16
        Random value: fc8b40d9b0b09bc4296bf8753a8f6e1f
> HCI Event: Number of Completed Packets (0x13) plen 5    #231 [hci1] 16.707668
        Num handles: 1
        Handle: 3819 Address: DF:A9:FF:F6:B1:1A (OUI DF-A9-FF)
        Count: 1
        #230: len 21 (1 Kb/s)
        Latency: 156 msec (84-171 msec ~159 msec)
> ACL Data RX: Handle 3819 flags 0x02 dlen 21             #232 [hci1] 16.883073
      SMP: Pairing DHKey Check (0x0d) len 16
        E: cae12db4478ae2716c07a1fad6ad1ca0
< HCI Command: Host Number of Com.. (0x03|0x0035) plen 5  #233 [hci1] 16.891079
        Num handles: 1
        Handle: 3819 Address: DF:A9:FF:F6:B1:1A (OUI DF-A9-FF)
        Count: 1
< ACL Data TX: Handle 3819 flags 0x00 dlen 21             #234 [hci1] 16.891136
      SMP: Pairing DHKey Check (0x0d) len 16
        E: ec0e0e0289105f598193d241de608f49
> HCI Event: Number of Completed Packets (0x13) plen 5    #235 [hci1] 17.057712
        Num handles: 1
        Handle: 3819 Address: DF:A9:FF:F6:B1:1A (OUI DF-A9-FF)
        Count: 1
        #234: len 21 (1 Kb/s)
        Latency: 166 msec (84-171 msec ~162 msec)
> HCI Event: LE Meta Event (0x3e) plen 13                 #236 [hci1] 17.146003
      LE Long Term Key Request (0x05)
        Handle: 3819 Address: DF:A9:FF:F6:B1:1A (OUI DF-A9-FF)
        Random number: 0x0000000000000000
        Encrypted diversifier: 0x0000
< HCI Command: LE Long Term Key... (0x08|0x001a) plen 18  #237 [hci1] 17.150759
        Handle: 3819 Address: DF:A9:FF:F6:B1:1A (OUI DF-A9-FF)
        Long term key: 9a5daadfbd00abee48fdd142de43aeb4
> HCI Event: Command Complete (0x0e) plen 6               #238 [hci1] 17.151415
      LE Long Term Key Request Reply (0x08|0x001a) ncmd 1
        Status: Success (0x00)
        Handle: 3819 Address: DF:A9:FF:F6:B1:1A (OUI DF-A9-FF)
> HCI Event: Encryption Change (0x08) plen 4              #239 [hci1] 17.583033
        Status: Success (0x00)
        Handle: 3819 Address: DF:A9:FF:F6:B1:1A (OUI DF-A9-FF)
        Encryption: Enabled with AES-CCM (0x01)
> ACL Data RX: Handle 3819 flags 0x02 dlen 21             #240 [hci1] 17.670726
      SMP: Identity Information (0x08) len 16
        Identity resolving key: 6cbe277faac21be10f303b816da28be8
< HCI Command: Host Number of Com.. (0x03|0x0035) plen 5  #241 [hci1] 17.701109
        Num handles: 1
        Handle: 3819 Address: DF:A9:FF:F6:B1:1A (OUI DF-A9-FF)
        Count: 1
> ACL Data RX: Handle 3819 flags 0x02 dlen 12             #242 [hci1] 17.845502
      SMP: Identity Address Information (0x09) len 7
        Address: DF:A9:FF:F6:B1:1A (OUI DF-A9-FF)
< HCI Command: LE Add Device To... (0x08|0x0027) plen 39  #243 [hci1] 17.851030
        Address type: Public (0x00)
        Address: DF:A9:FF:F6:B1:1A (OUI DF-A9-FF)
        Peer identity resolving key: 6cbe277faac21be10f303b816da28be8
        Local identity resolving key: 00000000000000000000000000000000
> HCI Event: Command Complete (0x0e) plen 4               #244 [hci1] 17.852021
      LE Add Device To Resolving List (0x08|0x0027) ncmd 1
        Status: Success (0x00)
< HCI Command: LE Set Privacy Mode (0x08|0x004e) plen 8   #245 [hci1] 17.870733
        Peer Identity address type: Public (0x00)
        Peer Identity address: DF:A9:FF:F6:B1:1A (OUI DF-A9-FF)
        Privacy Mode: Use Device Privacy (0x01)
> HCI Event: Command Complete (0x0e) plen 4               #246 [hci1] 17.871285
      LE Set Privacy Mode (0x08|0x004e) ncmd 1
        Status: Success (0x00)
< HCI Command: LE Set Address Res.. (0x08|0x002d) plen 1  #247 [hci1] 17.890726
        Address resolution: Enabled (0x01)
> HCI Event: Command Complete (0x0e) plen 4               #248 [hci1] 17.891203
      LE Set Address Resolution Enable (0x08|0x002d) ncmd 1
        Status: Success (0x00)
< HCI Command: Host Number of Com.. (0x03|0x0035) plen 5  #249 [hci1] 17.910679
        Num handles: 1
        Handle: 3819 Address: DF:A9:FF:F6:B1:1A (OUI DF-A9-FF)
        Count: 1
> ACL Data RX: Handle 3819 flags 0x02 dlen 13             #250 [hci1] 17.932960
      ATT: Find By Type Value Request (0x06) len 8
        Handle range: 0x0001-0xffff
        Attribute type: Primary Service (0x2800)
          UUID: Telephony Bearer (0x184b)
< HCI Command: Host Number of Com.. (0x03|0x0035) plen 5  #251 [hci1] 17.951065
        Num handles: 1
        Handle: 3819 Address: DF:A9:FF:F6:B1:1A (OUI DF-A9-FF)
        Count: 1
< ACL Data TX: Handle 3819 flags 0x00 dlen 9              #252 [hci1] 17.951186
      ATT: Find By Type Value Response (0x07) len 4
        Handle range: 0x0057-0x0083
> HCI Event: Number of Completed Packets (0x13) plen 5    #253 [hci1] 18.107950
        Num handles: 1
        Handle: 3819 Address: DF:A9:FF:F6:B1:1A (OUI DF-A9-FF)
        Count: 1
        #252: len 9 (0 Kb/s)
        Latency: 156 msec (84-171 msec ~159 msec)
> ACL Data RX: Handle 3819 flags 0x02 dlen 13             #254 [hci1] 18.108123
      ATT: Find By Type Value Request (0x06) len 8
        Handle range: 0x0084-0xffff
        Attribute type: Primary Service (0x2800)
          UUID: Telephony Bearer (0x184b)
< HCI Command: Host Number of Com.. (0x03|0x0035) plen 5  #255 [hci1] 18.110638
        Num handles: 1
        Handle: 3819 Address: DF:A9:FF:F6:B1:1A (OUI DF-A9-FF)
        Count: 1
< ACL Data TX: Handle 3819 flags 0x00 dlen 9              #256 [hci1] 18.110753
      ATT: Error Response (0x01) len 4
        Find By Type Value Request (0x06)
        Handle: 0x0084
        Error: Attribute Not Found (0x0a)
> HCI Event: Number of Completed Packets (0x13) plen 5    #257 [hci1] 18.282850
        Num handles: 1
        Handle: 3819 Address: DF:A9:FF:F6:B1:1A (OUI DF-A9-FF)
        Count: 1
        #256: len 9 (0 Kb/s)
        Latency: 172 msec (84-172 msec ~165 msec)
> ACL Data RX: Handle 3819 flags 0x02 dlen 11             #258 [hci1] 18.283183
      ATT: Read By Type Request (0x08) len 6
        Handle range: 0x0057-0x0083
        Attribute type: Characteristic (0x2803)
< HCI Command: Host Number of Com.. (0x03|0x0035) plen 5  #259 [hci1] 18.291067
        Num handles: 1
        Handle: 3819 Address: DF:A9:FF:F6:B1:1A (OUI DF-A9-FF)
        Count: 1
< ACL Data TX: Handle 3819 flags 0x00 dlen 20             #260 [hci1] 18.291184
      ATT: Read By Type Response (0x09) len 15
        Attribute data length: 7
        Attribute data list: 2 entries
        Handle: 0x0058
        Value: 125900b32b
            Properties: 0x12
              Read (0x02)
              Notify (0x10)
            Value Handle: 0x0059
            Value UUID: Bearer Provider Name (0x2bb3)
        Handle: 0x005b
        Value: 025c00b42b
            Properties: 0x02
              Read (0x02)
            Value Handle: 0x005c
            Value UUID: Bearer UCI (0x2bb4)
> HCI Event: Number of Completed Packets (0x13) plen 5    #261 [hci1] 18.457924
        Num handles: 1
        Handle: 3819 Address: DF:A9:FF:F6:B1:1A (OUI DF-A9-FF)
        Count: 1
        #260: len 20 (0 Kb/s)
        Latency: 166 msec (84-172 msec ~166 msec)
> ACL Data RX: Handle 3819 flags 0x02 dlen 11             #262 [hci1] 18.458072
      ATT: Read By Type Request (0x08) len 6
        Handle range: 0x005c-0x0083
        Attribute type: Characteristic (0x2803)
< HCI Command: Host Number of Com.. (0x03|0x0035) plen 5  #263 [hci1] 18.471113
        Num handles: 1
        Handle: 3819 Address: DF:A9:FF:F6:B1:1A (OUI DF-A9-FF)
        Count: 1
< ACL Data TX: Handle 3819 flags 0x00 dlen 20             #264 [hci1] 18.471166
      ATT: Read By Type Response (0x09) len 15
        Attribute data length: 7
        Attribute data list: 2 entries
        Handle: 0x005d
        Value: 125e00b52b
            Properties: 0x12
              Read (0x02)
              Notify (0x10)
            Value Handle: 0x005e
            Value UUID: Bearer Technology (0x2bb5)
        Handle: 0x0060
        Value: 126100b62b
            Properties: 0x12
              Read (0x02)
              Notify (0x10)
            Value Handle: 0x0061
            Value UUID: Bearer URI Schemes Supported List (0x2bb6)
> HCI Event: Number of Completed Packets (0x13) plen 5    #265 [hci1] 18.632805
        Num handles: 1
        Handle: 3819 Address: DF:A9:FF:F6:B1:1A (OUI DF-A9-FF)
        Count: 1
        #264: len 20 (0 Kb/s)
        Latency: 161 msec (84-172 msec ~163 msec)
> ACL Data RX: Handle 3819 flags 0x02 dlen 11             #266 [hci1] 18.633181
      ATT: Read By Type Request (0x08) len 6
        Handle range: 0x0061-0x0083
        Attribute type: Characteristic (0x2803)
< HCI Command: Host Number of Com.. (0x03|0x0035) plen 5  #267 [hci1] 18.651002
        Num handles: 1
        Handle: 3819 Address: DF:A9:FF:F6:B1:1A (OUI DF-A9-FF)
        Count: 1
< ACL Data TX: Handle 3819 flags 0x00 dlen 20             #268 [hci1] 18.651088
      ATT: Read By Type Response (0x09) len 15
        Attribute data length: 7
        Attribute data list: 2 entries
        Handle: 0x0063
        Value: 126400b72b
            Properties: 0x12
              Read (0x02)
              Notify (0x10)
            Value Handle: 0x0064
            Value UUID: Bearer Signal Strength (0x2bb7)
        Handle: 0x0066
        Value: 0e6700b82b
            Properties: 0x0e
              Read (0x02)
              Write Without Response (0x04)
              Write (0x08)
            Value Handle: 0x0067
            Value UUID: Bearer Signal Strength Reporting Interval (0x2bb8)
> HCI Event: Number of Completed Packets (0x13) plen 5    #269 [hci1] 18.807903
        Num handles: 1
        Handle: 3819 Address: DF:A9:FF:F6:B1:1A (OUI DF-A9-FF)
        Count: 1
        #268: len 20 (1 Kb/s)
        Latency: 156 msec (84-172 msec ~160 msec)
> ACL Data RX: Handle 3819 flags 0x02 dlen 11             #270 [hci1] 18.808078
      ATT: Read By Type Request (0x08) len 6
        Handle range: 0x0067-0x0083
        Attribute type: Characteristic (0x2803)
< HCI Command: Host Number of Com.. (0x03|0x0035) plen 5  #271 [hci1] 18.811074
        Num handles: 1
        Handle: 3819 Address: DF:A9:FF:F6:B1:1A (OUI DF-A9-FF)
        Count: 1
< ACL Data TX: Handle 3819 flags 0x00 dlen 20             #272 [hci1] 18.811163
      ATT: Read By Type Response (0x09) len 15
        Attribute data length: 7
        Attribute data list: 2 entries
        Handle: 0x0068
        Value: 126900b92b
            Properties: 0x12
              Read (0x02)
              Notify (0x10)
            Value Handle: 0x0069
            Value UUID: Bearer List Current Calls (0x2bb9)
        Handle: 0x006b
        Value: 026c00ba2b
            Properties: 0x02
              Read (0x02)
            Value Handle: 0x006c
            Value UUID: Content Control ID (0x2bba)
> HCI Event: Number of Completed Packets (0x13) plen 5    #273 [hci1] 18.982795
        Num handles: 1
        Handle: 3819 Address: DF:A9:FF:F6:B1:1A (OUI DF-A9-FF)
        Count: 1
        #272: len 20 (0 Kb/s)
        Latency: 171 msec (84-172 msec ~166 msec)
> ACL Data RX: Handle 3819 flags 0x02 dlen 11             #274 [hci1] 18.983123
      ATT: Read By Type Request (0x08) len 6
        Handle range: 0x006c-0x0083
        Attribute type: Characteristic (0x2803)
< HCI Command: Host Number of Com.. (0x03|0x0035) plen 5  #275 [hci1] 18.991078
        Num handles: 1
        Handle: 3819 Address: DF:A9:FF:F6:B1:1A (OUI DF-A9-FF)
        Count: 1
< ACL Data TX: Handle 3819 flags 0x00 dlen 20             #276 [hci1] 18.991164
      ATT: Read By Type Response (0x09) len 15
        Attribute data length: 7
        Attribute data list: 2 entries
        Handle: 0x006d
        Value: 126e00bb2b
            Properties: 0x12
              Read (0x02)
              Notify (0x10)
            Value Handle: 0x006e
            Value UUID: Status Flags (0x2bbb)
        Handle: 0x0070
        Value: 127100bc2b
            Properties: 0x12
              Read (0x02)
              Notify (0x10)
            Value Handle: 0x0071
            Value UUID: Incoming Call Target Bearer URI (0x2bbc)
> HCI Event: Number of Completed Packets (0x13) plen 5    #277 [hci1] 19.157870
        Num handles: 1
        Handle: 3819 Address: DF:A9:FF:F6:B1:1A (OUI DF-A9-FF)
        Count: 1
        #276: len 20 (0 Kb/s)
        Latency: 166 msec (84-172 msec ~166 msec)
> ACL Data RX: Handle 3819 flags 0x02 dlen 11             #278 [hci1] 19.158065
      ATT: Read By Type Request (0x08) len 6
        Handle range: 0x0071-0x0083
        Attribute type: Characteristic (0x2803)
< HCI Command: Host Number of Com.. (0x03|0x0035) plen 5  #279 [hci1] 19.171055
        Num handles: 1
        Handle: 3819 Address: DF:A9:FF:F6:B1:1A (OUI DF-A9-FF)
        Count: 1
< ACL Data TX: Handle 3819 flags 0x00 dlen 20             #280 [hci1] 19.171128
      ATT: Read By Type Response (0x09) len 15
        Attribute data length: 7
        Attribute data list: 2 entries
        Handle: 0x0073
        Value: 127400bd2b
            Properties: 0x12
              Read (0x02)
              Notify (0x10)
            Value Handle: 0x0074
            Value UUID: Call State (0x2bbd)
        Handle: 0x0076
        Value: 1c7700be2b
            Properties: 0x1c
              Write Without Response (0x04)
              Write (0x08)
              Notify (0x10)
            Value Handle: 0x0077
            Value UUID: Call Control Point (0x2bbe)
> HCI Event: Number of Completed Packets (0x13) plen 5    #281 [hci1] 19.332960
        Num handles: 1
        Handle: 3819 Address: DF:A9:FF:F6:B1:1A (OUI DF-A9-FF)
        Count: 1
        #280: len 20 (0 Kb/s)
        Latency: 161 msec (84-172 msec ~164 msec)
> ACL Data RX: Handle 3819 flags 0x02 dlen 11             #282 [hci1] 19.333125
      ATT: Read By Type Request (0x08) len 6
        Handle range: 0x0077-0x0083
        Attribute type: Characteristic (0x2803)
< HCI Command: Host Number of Com.. (0x03|0x0035) plen 5  #283 [hci1] 19.351124
        Num handles: 1
        Handle: 3819 Address: DF:A9:FF:F6:B1:1A (OUI DF-A9-FF)
        Count: 1
< ACL Data TX: Handle 3819 flags 0x00 dlen 20             #284 [hci1] 19.351172
      ATT: Read By Type Response (0x09) len 15
        Attribute data length: 7
        Attribute data list: 2 entries
        Handle: 0x0079
        Value: 027a00bf2b
            Properties: 0x02
              Read (0x02)
            Value Handle: 0x007a
            Value UUID: Call Control Point Optional Opcodes (0x2bbf)
        Handle: 0x007b
        Value: 107c00c02b
            Properties: 0x10
              Notify (0x10)
            Value Handle: 0x007c
            Value UUID: Termination Reason (0x2bc0)
> HCI Event: Number of Completed Packets (0x13) plen 5    #285 [hci1] 19.507833
        Num handles: 1
        Handle: 3819 Address: DF:A9:FF:F6:B1:1A (OUI DF-A9-FF)
        Count: 1
        #284: len 20 (1 Kb/s)
        Latency: 156 msec (84-172 msec ~160 msec)
> ACL Data RX: Handle 3819 flags 0x02 dlen 11             #286 [hci1] 19.508098
      ATT: Read By Type Request (0x08) len 6
        Handle range: 0x007c-0x0083
        Attribute type: Characteristic (0x2803)
< HCI Command: Host Number of Com.. (0x03|0x0035) plen 5  #287 [hci1] 19.511075
        Num handles: 1
        Handle: 3819 Address: DF:A9:FF:F6:B1:1A (OUI DF-A9-FF)
        Count: 1
< ACL Data TX: Handle 3819 flags 0x00 dlen 20             #288 [hci1] 19.511175
      ATT: Read By Type Response (0x09) len 15
        Attribute data length: 7
        Attribute data list: 2 entries
        Handle: 0x007e
        Value: 127f00c12b
            Properties: 0x12
              Read (0x02)
              Notify (0x10)
            Value Handle: 0x007f
            Value UUID: Incoming Call (0x2bc1)
        Handle: 0x0081
        Value: 128200c22b
            Properties: 0x12
              Read (0x02)
              Notify (0x10)
            Value Handle: 0x0082
            Value UUID: Call Friendly Name (0x2bc2)
> HCI Event: Number of Completed Packets (0x13) plen 5    #289 [hci1] 19.682882
        Num handles: 1
        Handle: 3819 Address: DF:A9:FF:F6:B1:1A (OUI DF-A9-FF)
        Count: 1
        #288: len 20 (0 Kb/s)
        Latency: 171 msec (84-172 msec ~166 msec)
> ACL Data RX: Handle 3819 flags 0x02 dlen 11             #290 [hci1] 19.683075
      ATT: Read By Type Request (0x08) len 6
        Handle range: 0x0082-0x0083
        Attribute type: Characteristic (0x2803)
< HCI Command: Host Number of Com.. (0x03|0x0035) plen 5  #291 [hci1] 19.691047
        Num handles: 1
        Handle: 3819 Address: DF:A9:FF:F6:B1:1A (OUI DF-A9-FF)
        Count: 1
< ACL Data TX: Handle 3819 flags 0x00 dlen 9              #292 [hci1] 19.691265
      ATT: Error Response (0x01) len 4
        Read By Type Request (0x08)
        Handle: 0x0082
        Error: Attribute Not Found (0x0a)
> HCI Event: Number of Completed Packets (0x13) plen 5    #293 [hci1] 19.857811
        Num handles: 1
        Handle: 3819 Address: DF:A9:FF:F6:B1:1A (OUI DF-A9-FF)
        Count: 1
        #292: len 9 (0 Kb/s)
        Latency: 166 msec (84-172 msec ~166 msec)
> ACL Data RX: Handle 3819 flags 0x02 dlen 9              #294 [hci1] 19.858051
      ATT: Find Information Request (0x04) len 4
        Handle range: 0x005a-0x005a
< HCI Command: Host Number of Com.. (0x03|0x0035) plen 5  #295 [hci1] 19.871061
        Num handles: 1
        Handle: 3819 Address: DF:A9:FF:F6:B1:1A (OUI DF-A9-FF)
        Count: 1
< ACL Data TX: Handle 3819 flags 0x00 dlen 10             #296 [hci1] 19.871175
      ATT: Find Information Response (0x05) len 5
        Format: UUID-16 (0x01)
        Handle: 0x005a
        UUID: Client Characteristic Configuration (0x2902)
> HCI Event: Number of Completed Packets (0x13) plen 5    #297 [hci1] 20.032843
        Num handles: 1
        Handle: 3819 Address: DF:A9:FF:F6:B1:1A (OUI DF-A9-FF)
        Count: 1
        #296: len 10 (0 Kb/s)
        Latency: 161 msec (84-172 msec ~163 msec)
> ACL Data RX: Handle 3819 flags 0x02 dlen 9              #298 [hci1] 20.033021
      ATT: Find Information Request (0x04) len 4
        Handle range: 0x005f-0x005f
< HCI Command: Host Number of Com.. (0x03|0x0035) plen 5  #299 [hci1] 20.051038
        Num handles: 1
        Handle: 3819 Address: DF:A9:FF:F6:B1:1A (OUI DF-A9-FF)
        Count: 1
< ACL Data TX: Handle 3819 flags 0x00 dlen 10             #300 [hci1] 20.051176
      ATT: Find Information Response (0x05) len 5
        Format: UUID-16 (0x01)
        Handle: 0x005f
        UUID: Client Characteristic Configuration (0x2902)
> HCI Event: Number of Completed Packets (0x13) plen 5    #301 [hci1] 20.207830
        Num handles: 1
        Handle: 3819 Address: DF:A9:FF:F6:B1:1A (OUI DF-A9-FF)
        Count: 1
        #300: len 10 (0 Kb/s)
        Latency: 156 msec (84-172 msec ~160 msec)
> ACL Data RX: Handle 3819 flags 0x02 dlen 9              #302 [hci1] 20.208005
      ATT: Find Information Request (0x04) len 4
        Handle range: 0x0062-0x0062
< HCI Command: Host Number of Com.. (0x03|0x0035) plen 5  #303 [hci1] 20.211035
        Num handles: 1
        Handle: 3819 Address: DF:A9:FF:F6:B1:1A (OUI DF-A9-FF)
        Count: 1
< ACL Data TX: Handle 3819 flags 0x00 dlen 10             #304 [hci1] 20.211154
      ATT: Find Information Response (0x05) len 5
        Format: UUID-16 (0x01)
        Handle: 0x0062
        UUID: Client Characteristic Configuration (0x2902)
> HCI Event: Number of Completed Packets (0x13) plen 5    #305 [hci1] 20.382729
        Num handles: 1
        Handle: 3819 Address: DF:A9:FF:F6:B1:1A (OUI DF-A9-FF)
        Count: 1
        #304: len 10 (0 Kb/s)
        Latency: 171 msec (84-172 msec ~165 msec)
> ACL Data RX: Handle 3819 flags 0x02 dlen 9              #306 [hci1] 20.383068
      ATT: Find Information Request (0x04) len 4
        Handle range: 0x0065-0x0065
< HCI Command: Host Number of Com.. (0x03|0x0035) plen 5  #307 [hci1] 20.390984
        Num handles: 1
        Handle: 3819 Address: DF:A9:FF:F6:B1:1A (OUI DF-A9-FF)
        Count: 1
< ACL Data TX: Handle 3819 flags 0x00 dlen 10             #308 [hci1] 20.391008
      ATT: Find Information Response (0x05) len 5
        Format: UUID-16 (0x01)
        Handle: 0x0065
        UUID: Client Characteristic Configuration (0x2902)
> HCI Event: Number of Completed Packets (0x13) plen 5    #309 [hci1] 20.557769
        Num handles: 1
        Handle: 3819 Address: DF:A9:FF:F6:B1:1A (OUI DF-A9-FF)
        Count: 1
        #308: len 10 (0 Kb/s)
        Latency: 166 msec (84-172 msec ~166 msec)
> ACL Data RX: Handle 3819 flags 0x02 dlen 9              #310 [hci1] 20.558097
      ATT: Find Information Request (0x04) len 4
        Handle range: 0x006a-0x006a
< HCI Command: Host Number of Com.. (0x03|0x0035) plen 5  #311 [hci1] 20.571115
        Num handles: 1
        Handle: 3819 Address: DF:A9:FF:F6:B1:1A (OUI DF-A9-FF)
        Count: 1
< ACL Data TX: Handle 3819 flags 0x00 dlen 10             #312 [hci1] 20.571201
      ATT: Find Information Response (0x05) len 5
        Format: UUID-16 (0x01)
        Handle: 0x006a
        UUID: Client Characteristic Configuration (0x2902)
> HCI Event: Number of Completed Packets (0x13) plen 5    #313 [hci1] 20.732785
        Num handles: 1
        Handle: 3819 Address: DF:A9:FF:F6:B1:1A (OUI DF-A9-FF)
        Count: 1
        #312: len 10 (0 Kb/s)
        Latency: 161 msec (84-172 msec ~163 msec)
> ACL Data RX: Handle 3819 flags 0x02 dlen 9              #314 [hci1] 20.733130
      ATT: Find Information Request (0x04) len 4
        Handle range: 0x006f-0x006f
< HCI Command: Host Number of Com.. (0x03|0x0035) plen 5  #315 [hci1] 20.751084
        Num handles: 1
        Handle: 3819 Address: DF:A9:FF:F6:B1:1A (OUI DF-A9-FF)
        Count: 1
< ACL Data TX: Handle 3819 flags 0x00 dlen 10             #316 [hci1] 20.751167
      ATT: Find Information Response (0x05) len 5
        Format: UUID-16 (0x01)
        Handle: 0x006f
        UUID: Client Characteristic Configuration (0x2902)
> HCI Event: Number of Completed Packets (0x13) plen 5    #317 [hci1] 20.908012
        Num handles: 1
        Handle: 3819 Address: DF:A9:FF:F6:B1:1A (OUI DF-A9-FF)
        Count: 1
        #316: len 10 (0 Kb/s)
        Latency: 156 msec (84-172 msec ~160 msec)
> ACL Data RX: Handle 3819 flags 0x02 dlen 9              #318 [hci1] 20.908132
      ATT: Find Information Request (0x04) len 4
        Handle range: 0x0072-0x0072
< HCI Command: Host Number of Com.. (0x03|0x0035) plen 5  #319 [hci1] 20.910954
        Num handles: 1
        Handle: 3819 Address: DF:A9:FF:F6:B1:1A (OUI DF-A9-FF)
        Count: 1
< ACL Data TX: Handle 3819 flags 0x00 dlen 10             #320 [hci1] 20.911029
      ATT: Find Information Response (0x05) len 5
        Format: UUID-16 (0x01)
        Handle: 0x0072
        UUID: Client Characteristic Configuration (0x2902)
> HCI Event: Number of Completed Packets (0x13) plen 5    #321 [hci1] 21.082868
        Num handles: 1
        Handle: 3819 Address: DF:A9:FF:F6:B1:1A (OUI DF-A9-FF)
        Count: 1
        #320: len 10 (0 Kb/s)
        Latency: 171 msec (84-172 msec ~166 msec)
> ACL Data RX: Handle 3819 flags 0x02 dlen 9              #322 [hci1] 21.083013
      ATT: Find Information Request (0x04) len 4
        Handle range: 0x0075-0x0075
< HCI Command: Host Number of Com.. (0x03|0x0035) plen 5  #323 [hci1] 21.090967
        Num handles: 1
        Handle: 3819 Address: DF:A9:FF:F6:B1:1A (OUI DF-A9-FF)
        Count: 1
< ACL Data TX: Handle 3819 flags 0x00 dlen 10             #324 [hci1] 21.091041
      ATT: Find Information Response (0x05) len 5
        Format: UUID-16 (0x01)
        Handle: 0x0075
        UUID: Client Characteristic Configuration (0x2902)
> HCI Event: Number of Completed Packets (0x13) plen 5    #325 [hci1] 21.257784
        Num handles: 1
        Handle: 3819 Address: DF:A9:FF:F6:B1:1A (OUI DF-A9-FF)
        Count: 1
        #324: len 10 (0 Kb/s)
        Latency: 166 msec (84-172 msec ~166 msec)
> ACL Data RX: Handle 3819 flags 0x02 dlen 9              #326 [hci1] 21.258114
      ATT: Find Information Request (0x04) len 4
        Handle range: 0x0078-0x0078
< HCI Command: Host Number of Com.. (0x03|0x0035) plen 5  #327 [hci1] 21.271094
        Num handles: 1
        Handle: 3819 Address: DF:A9:FF:F6:B1:1A (OUI DF-A9-FF)
        Count: 1
< ACL Data TX: Handle 3819 flags 0x00 dlen 10             #328 [hci1] 21.271187
      ATT: Find Information Response (0x05) len 5
        Format: UUID-16 (0x01)
        Handle: 0x0078
        UUID: Client Characteristic Configuration (0x2902)
> HCI Event: Number of Completed Packets (0x13) plen 5    #329 [hci1] 21.432801
        Num handles: 1
        Handle: 3819 Address: DF:A9:FF:F6:B1:1A (OUI DF-A9-FF)
        Count: 1
        #328: len 10 (0 Kb/s)
        Latency: 161 msec (84-172 msec ~164 msec)
> ACL Data RX: Handle 3819 flags 0x02 dlen 9              #330 [hci1] 21.433017
      ATT: Find Information Request (0x04) len 4
        Handle range: 0x007d-0x007d
< HCI Command: Host Number of Com.. (0x03|0x0035) plen 5  #331 [hci1] 21.451067
        Num handles: 1
        Handle: 3819 Address: DF:A9:FF:F6:B1:1A (OUI DF-A9-FF)
        Count: 1
< ACL Data TX: Handle 3819 flags 0x00 dlen 10             #332 [hci1] 21.451162
      ATT: Find Information Response (0x05) len 5
        Format: UUID-16 (0x01)
        Handle: 0x007d
        UUID: Client Characteristic Configuration (0x2902)
> HCI Event: Number of Completed Packets (0x13) plen 5    #333 [hci1] 21.607865
        Num handles: 1
        Handle: 3819 Address: DF:A9:FF:F6:B1:1A (OUI DF-A9-FF)
        Count: 1
        #332: len 10 (0 Kb/s)
        Latency: 156 msec (84-172 msec ~160 msec)
> ACL Data RX: Handle 3819 flags 0x02 dlen 9              #334 [hci1] 21.607999
      ATT: Find Information Request (0x04) len 4
        Handle range: 0x0080-0x0080
< HCI Command: Host Number of Com.. (0x03|0x0035) plen 5  #335 [hci1] 21.611092
        Num handles: 1
        Handle: 3819 Address: DF:A9:FF:F6:B1:1A (OUI DF-A9-FF)
        Count: 1
< ACL Data TX: Handle 3819 flags 0x00 dlen 10             #336 [hci1] 21.611263
      ATT: Find Information Response (0x05) len 5
        Format: UUID-16 (0x01)
        Handle: 0x0080
        UUID: Client Characteristic Configuration (0x2902)
> HCI Event: Number of Completed Packets (0x13) plen 5    #337 [hci1] 21.782780
        Num handles: 1
        Handle: 3819 Address: DF:A9:FF:F6:B1:1A (OUI DF-A9-FF)
        Count: 1
        #336: len 10 (0 Kb/s)
        Latency: 171 msec (84-172 msec ~165 msec)
> ACL Data RX: Handle 3819 flags 0x02 dlen 9              #338 [hci1] 21.783004
      ATT: Find Information Request (0x04) len 4
        Handle range: 0x0083-0x0083
< HCI Command: Host Number of Com.. (0x03|0x0035) plen 5  #339 [hci1] 21.791059
        Num handles: 1
        Handle: 3819 Address: DF:A9:FF:F6:B1:1A (OUI DF-A9-FF)
        Count: 1
< ACL Data TX: Handle 3819 flags 0x00 dlen 10             #340 [hci1] 21.791144
      ATT: Find Information Response (0x05) len 5
        Format: UUID-16 (0x01)
        Handle: 0x0083
        UUID: Client Characteristic Configuration (0x2902)
> HCI Event: Number of Completed Packets (0x13) plen 5    #341 [hci1] 21.957803
        Num handles: 1
        Handle: 3819 Address: DF:A9:FF:F6:B1:1A (OUI DF-A9-FF)
        Count: 1
        #340: len 10 (0 Kb/s)
        Latency: 166 msec (84-172 msec ~166 msec)
> ACL Data RX: Handle 3819 flags 0x02 dlen 9              #342 [hci1] 21.958047
      ATT: Write Request (0x12) len 4
        Handle: 0x0075
          Data: 0000
< HCI Command: Host Number of Com.. (0x03|0x0035) plen 5  #343 [hci1] 21.971105
        Num handles: 1
        Handle: 3819 Address: DF:A9:FF:F6:B1:1A (OUI DF-A9-FF)
        Count: 1
< ACL Data TX: Handle 3819 flags 0x00 dlen 5              #344 [hci1] 21.971168
      ATT: Write Response (0x13) len 0
> HCI Event: Number of Completed Packets (0x13) plen 5    #345 [hci1] 22.132770
        Num handles: 1
        Handle: 3819 Address: DF:A9:FF:F6:B1:1A (OUI DF-A9-FF)
        Count: 1
        #344: len 5 (0 Kb/s)
        Latency: 161 msec (84-172 msec ~163 msec)
> ACL Data RX: Handle 3819 flags 0x02 dlen 9              #346 [hci1] 22.133082
      ATT: Write Request (0x12) len 4
        Handle: 0x0075
          Data: 0100
< HCI Command: Host Number of Com.. (0x03|0x0035) plen 5  #347 [hci1] 22.151128
        Num handles: 1
        Handle: 3819 Address: DF:A9:FF:F6:B1:1A (OUI DF-A9-FF)
        Count: 1
< ACL Data TX: Handle 3819 flags 0x00 dlen 5              #348 [hci1] 22.151262
      ATT: Write Response (0x13) len 0
> HCI Event: Number of Completed Packets (0x13) plen 5    #349 [hci1] 22.307877
        Num handles: 1
        Handle: 3819 Address: DF:A9:FF:F6:B1:1A (OUI DF-A9-FF)
        Count: 1
        #348: len 5 (0 Kb/s)
        Latency: 156 msec (84-172 msec ~160 msec)
> ACL Data RX: Handle 3819 flags 0x02 dlen 9              #350 [hci1] 22.308004
      ATT: Write Request (0x12) len 4
        Handle: 0x0080
          Data: 0000
< HCI Command: Host Number of Com.. (0x03|0x0035) plen 5  #351 [hci1] 22.311096
        Num handles: 1
        Handle: 3819 Address: DF:A9:FF:F6:B1:1A (OUI DF-A9-FF)
        Count: 1
< ACL Data TX: Handle 3819 flags 0x00 dlen 5              #352 [hci1] 22.311199
      ATT: Write Response (0x13) len 0
> HCI Event: Number of Completed Packets (0x13) plen 5    #353 [hci1] 22.482769
        Num handles: 1
        Handle: 3819 Address: DF:A9:FF:F6:B1:1A (OUI DF-A9-FF)
        Count: 1
        #352: len 5 (0 Kb/s)
        Latency: 171 msec (84-172 msec ~165 msec)
> ACL Data RX: Handle 3819 flags 0x02 dlen 9              #354 [hci1] 22.482957
      ATT: Write Request (0x12) len 4
        Handle: 0x0080
          Data: 0100
< HCI Command: Host Number of Com.. (0x03|0x0035) plen 5  #355 [hci1] 22.490573
        Num handles: 1
        Handle: 3819 Address: DF:A9:FF:F6:B1:1A (OUI DF-A9-FF)
        Count: 1
< ACL Data TX: Handle 3819 flags 0x00 dlen 5              #356 [hci1] 22.490583
      ATT: Write Response (0x13) len 0
> HCI Event: Number of Completed Packets (0x13) plen 5    #357 [hci1] 22.657802
        Num handles: 1
        Handle: 3819 Address: DF:A9:FF:F6:B1:1A (OUI DF-A9-FF)
        Count: 1
        #356: len 5 (0 Kb/s)
        Latency: 167 msec (84-172 msec ~166 msec)
> ACL Data RX: Handle 3819 flags 0x02 dlen 9              #358 [hci1] 22.657972
      ATT: Write Request (0x12) len 4
        Handle: 0x007d
          Data: 0000
< HCI Command: Host Number of Com.. (0x03|0x0035) plen 5  #359 [hci1] 22.671167
        Num handles: 1
        Handle: 3819 Address: DF:A9:FF:F6:B1:1A (OUI DF-A9-FF)
        Count: 1
< ACL Data TX: Handle 3819 flags 0x00 dlen 5              #360 [hci1] 22.671275
      ATT: Write Response (0x13) len 0
> HCI Event: Number of Completed Packets (0x13) plen 5    #361 [hci1] 22.832727
        Num handles: 1
        Handle: 3819 Address: DF:A9:FF:F6:B1:1A (OUI DF-A9-FF)
        Count: 1
        #360: len 5 (0 Kb/s)
        Latency: 161 msec (84-172 msec ~164 msec)
> ACL Data RX: Handle 3819 flags 0x02 dlen 9              #362 [hci1] 22.833033
      ATT: Write Request (0x12) len 4
        Handle: 0x007d
          Data: 0100
< HCI Command: Host Number of Com.. (0x03|0x0035) plen 5  #363 [hci1] 22.850571
        Num handles: 1
        Handle: 3819 Address: DF:A9:FF:F6:B1:1A (OUI DF-A9-FF)
        Count: 1
< ACL Data TX: Handle 3819 flags 0x00 dlen 5              #364 [hci1] 22.850653
      ATT: Write Response (0x13) len 0
> HCI Event: Number of Completed Packets (0x13) plen 5    #365 [hci1] 23.007821
        Num handles: 1
        Handle: 3819 Address: DF:A9:FF:F6:B1:1A (OUI DF-A9-FF)
        Count: 1
        #364: len 5 (0 Kb/s)
        Latency: 157 msec (84-172 msec ~160 msec)
> ACL Data RX: Handle 3819 flags 0x02 dlen 9              #366 [hci1] 23.008078
      ATT: Write Request (0x12) len 4
        Handle: 0x0078
          Data: 0000
< HCI Command: Host Number of Com.. (0x03|0x0035) plen 5  #367 [hci1] 23.010989
        Num handles: 1
        Handle: 3819 Address: DF:A9:FF:F6:B1:1A (OUI DF-A9-FF)
        Count: 1
< ACL Data TX: Handle 3819 flags 0x00 dlen 5              #368 [hci1] 23.011033
      ATT: Write Response (0x13) len 0
> HCI Event: Number of Completed Packets (0x13) plen 5    #369 [hci1] 23.182830
        Num handles: 1
        Handle: 3819 Address: DF:A9:FF:F6:B1:1A (OUI DF-A9-FF)
        Count: 1
        #368: len 5 (0 Kb/s)
        Latency: 171 msec (84-172 msec ~166 msec)
> ACL Data RX: Handle 3819 flags 0x02 dlen 9              #370 [hci1] 23.183396
      ATT: Write Request (0x12) len 4
        Handle: 0x0078
          Data: 0100
< HCI Command: Host Number of Com.. (0x03|0x0035) plen 5  #371 [hci1] 23.191095
        Num handles: 1
        Handle: 3819 Address: DF:A9:FF:F6:B1:1A (OUI DF-A9-FF)
        Count: 1
< ACL Data TX: Handle 3819 flags 0x00 dlen 5              #372 [hci1] 23.191173
      ATT: Write Response (0x13) len 0
> HCI Event: Number of Completed Packets (0x13) plen 5    #373 [hci1] 23.357747
        Num handles: 1
        Handle: 3819 Address: DF:A9:FF:F6:B1:1A (OUI DF-A9-FF)
        Count: 1
        #372: len 5 (0 Kb/s)
        Latency: 166 msec (84-172 msec ~166 msec)
> ACL Data RX: Handle 3819 flags 0x02 dlen 9              #374 [hci1] 23.357961
      ATT: Write Request (0x12) len 4
        Handle: 0x0072
          Data: 0000
< HCI Command: Host Number of Com.. (0x03|0x0035) plen 5  #375 [hci1] 23.370630
        Num handles: 1
        Handle: 3819 Address: DF:A9:FF:F6:B1:1A (OUI DF-A9-FF)
        Count: 1
< ACL Data TX: Handle 3819 flags 0x00 dlen 5              #376 [hci1] 23.370653
      ATT: Write Response (0x13) len 0
> HCI Event: Number of Completed Packets (0x13) plen 5    #377 [hci1] 23.532742
        Num handles: 1
        Handle: 3819 Address: DF:A9:FF:F6:B1:1A (OUI DF-A9-FF)
        Count: 1
        #376: len 5 (0 Kb/s)
        Latency: 162 msec (84-172 msec ~164 msec)
> ACL Data RX: Handle 3819 flags 0x02 dlen 9              #378 [hci1] 23.532992
      ATT: Write Request (0x12) len 4
        Handle: 0x0072
          Data: 0100
< HCI Command: Host Number of Com.. (0x03|0x0035) plen 5  #379 [hci1] 23.551136
        Num handles: 1
        Handle: 3819 Address: DF:A9:FF:F6:B1:1A (OUI DF-A9-FF)
        Count: 1
< ACL Data TX: Handle 3819 flags 0x00 dlen 5              #380 [hci1] 23.551214
      ATT: Write Response (0x13) len 0
> HCI Event: Number of Completed Packets (0x13) plen 5    #381 [hci1] 23.707830
        Num handles: 1
        Handle: 3819 Address: DF:A9:FF:F6:B1:1A (OUI DF-A9-FF)
        Count: 1
        #380: len 5 (0 Kb/s)
        Latency: 156 msec (84-172 msec ~160 msec)
> ACL Data RX: Handle 3819 flags 0x02 dlen 9              #382 [hci1] 23.707981
      ATT: Write Request (0x12) len 4
        Handle: 0x0083
          Data: 0000
< HCI Command: Host Number of Com.. (0x03|0x0035) plen 5  #383 [hci1] 23.711129
        Num handles: 1
        Handle: 3819 Address: DF:A9:FF:F6:B1:1A (OUI DF-A9-FF)
        Count: 1
< ACL Data TX: Handle 3819 flags 0x00 dlen 5              #384 [hci1] 23.711245
      ATT: Write Response (0x13) len 0
> HCI Event: Number of Completed Packets (0x13) plen 5    #385 [hci1] 23.882883
        Num handles: 1
        Handle: 3819 Address: DF:A9:FF:F6:B1:1A (OUI DF-A9-FF)
        Count: 1
        #384: len 5 (0 Kb/s)
        Latency: 171 msec (84-172 msec ~166 msec)
> ACL Data RX: Handle 3819 flags 0x02 dlen 9              #386 [hci1] 23.883004
      ATT: Write Request (0x12) len 4
        Handle: 0x0083
          Data: 0100
< HCI Command: Host Number of Com.. (0x03|0x0035) plen 5  #387 [hci1] 23.891133
        Num handles: 1
        Handle: 3819 Address: DF:A9:FF:F6:B1:1A (OUI DF-A9-FF)
        Count: 1
< ACL Data TX: Handle 3819 flags 0x00 dlen 5              #388 [hci1] 23.891185
      ATT: Write Response (0x13) len 0
> HCI Event: Number of Completed Packets (0x13) plen 5    #389 [hci1] 24.057789
        Num handles: 1
        Handle: 3819 Address: DF:A9:FF:F6:B1:1A (OUI DF-A9-FF)
        Count: 1
        #388: len 5 (0 Kb/s)
        Latency: 166 msec (84-172 msec ~166 msec)
> ACL Data RX: Handle 3819 flags 0x02 dlen 9              #390 [hci1] 24.057945
      ATT: Write Request (0x12) len 4
        Handle: 0x0065
          Data: 0000
< HCI Command: Host Number of Com.. (0x03|0x0035) plen 5  #391 [hci1] 24.071149
        Num handles: 1
        Handle: 3819 Address: DF:A9:FF:F6:B1:1A (OUI DF-A9-FF)
        Count: 1
< ACL Data TX: Handle 3819 flags 0x00 dlen 5              #392 [hci1] 24.071365
      ATT: Write Response (0x13) len 0
> HCI Event: Number of Completed Packets (0x13) plen 5    #393 [hci1] 24.232831
        Num handles: 1
        Handle: 3819 Address: DF:A9:FF:F6:B1:1A (OUI DF-A9-FF)
        Count: 1
        #392: len 5 (0 Kb/s)
        Latency: 161 msec (84-172 msec ~163 msec)
> ACL Data RX: Handle 3819 flags 0x02 dlen 9              #394 [hci1] 24.232979
      ATT: Write Request (0x12) len 4
        Handle: 0x0065
          Data: 0100
< HCI Command: Host Number of Com.. (0x03|0x0035) plen 5  #395 [hci1] 24.251124
        Num handles: 1
        Handle: 3819 Address: DF:A9:FF:F6:B1:1A (OUI DF-A9-FF)
        Count: 1
< ACL Data TX: Handle 3819 flags 0x00 dlen 5              #396 [hci1] 24.251202
      ATT: Write Response (0x13) len 0
> HCI Event: Number of Completed Packets (0x13) plen 5    #397 [hci1] 24.407800
        Num handles: 1
        Handle: 3819 Address: DF:A9:FF:F6:B1:1A (OUI DF-A9-FF)
        Count: 1
        #396: len 5 (0 Kb/s)
        Latency: 156 msec (84-172 msec ~160 msec)
> ACL Data RX: Handle 3819 flags 0x02 dlen 7              #398 [hci1] 24.407913
      ATT: Read Request (0x0a) len 2
        Handle: 0x006e
< HCI Command: Host Number of Com.. (0x03|0x0035) plen 5  #399 [hci1] 24.411138
        Num handles: 1
        Handle: 3819 Address: DF:A9:FF:F6:B1:1A (OUI DF-A9-FF)
        Count: 1
< ACL Data TX: Handle 3819 flags 0x00 dlen 7              #400 [hci1] 24.411236
      ATT: Read Response (0x0b) len 2
> HCI Event: Number of Completed Packets (0x13) plen 5    #401 [hci1] 24.582761
        Num handles: 1
        Handle: 3819 Address: DF:A9:FF:F6:B1:1A (OUI DF-A9-FF)
        Count: 1
        #400: len 7 (0 Kb/s)
        Latency: 171 msec (84-172 msec ~165 msec)
> ACL Data RX: Handle 3819 flags 0x02 dlen 7              #402 [hci1] 24.582940
      ATT: Read Request (0x0a) len 2
        Handle: 0x007a
< HCI Command: Host Number of Com.. (0x03|0x0035) plen 5  #403 [hci1] 24.591104
        Num handles: 1
        Handle: 3819 Address: DF:A9:FF:F6:B1:1A (OUI DF-A9-FF)
        Count: 1
< ACL Data TX: Handle 3819 flags 0x00 dlen 7              #404 [hci1] 24.591214
      ATT: Read Response (0x0b) len 2
> HCI Event: Number of Completed Packets (0x13) plen 5    #405 [hci1] 24.757853
        Num handles: 1
        Handle: 3819 Address: DF:A9:FF:F6:B1:1A (OUI DF-A9-FF)
        Count: 1
        #404: len 7 (0 Kb/s)
        Latency: 166 msec (84-172 msec ~166 msec)
> ACL Data RX: Handle 3819 flags 0x02 dlen 8              #406 [hci1] 24.758003
      ATT: Write Request (0x12) len 3
        Handle: 0x0067
          Data: 0a
< HCI Command: Host Number of Com.. (0x03|0x0035) plen 5  #407 [hci1] 24.771216
        Num handles: 1
        Handle: 3819 Address: DF:A9:FF:F6:B1:1A (OUI DF-A9-FF)
        Count: 1
< ACL Data TX: Handle 3819 flags 0x00 dlen 5              #408 [hci1] 24.771297
      ATT: Write Response (0x13) len 0
> HCI Event: Number of Completed Packets (0x13) plen 5    #409 [hci1] 24.932638
        Num handles: 1
        Handle: 3819 Address: DF:A9:FF:F6:B1:1A (OUI DF-A9-FF)
        Count: 1
        #408: len 5 (0 Kb/s)
        Latency: 161 msec (84-172 msec ~163 msec)
< ACL Data TX: Handle 3819 flags 0x00 dlen 8              #410 [hci1] 24.961313
      ATT: Handle Value Notification (0x1b) len 3
        Handle: 0x0064
          Data: 0a
> HCI Event: Number of Completed Packets (0x13) plen 5    #411 [hci1] 25.107598
        Num handles: 1
        Handle: 3819 Address: DF:A9:FF:F6:B1:1A (OUI DF-A9-FF)
        Count: 1
        #410: len 8 (0 Kb/s)
        Latency: 146 msec (84-172 msec ~155 msec)
< ACL Data TX: Handle 3819 flags 0x00 dlen 8              #412 [hci1] 34.970916
      ATT: Handle Value Notification (0x1b) len 3
        Handle: 0x0064
          Data: 07
> HCI Event: Number of Completed Packets (0x13) plen 5    #413 [hci1] 35.082459
        Num handles: 1
        Handle: 3819 Address: DF:A9:FF:F6:B1:1A (OUI DF-A9-FF)
        Count: 1
        #412: len 8 (0 Kb/s)
        Latency: 111 msec (84-172 msec ~133 msec)
< ACL Data TX: Handle 3819 flags 0x00 dlen 8              #414 [hci1] 44.980965
      ATT: Handle Value Notification (0x1b) len 3
        Handle: 0x0064
          Data: 0a
> HCI Event: Number of Completed Packets (0x13) plen 5    #415 [hci1] 45.144771
        Num handles: 1
        Handle: 3819 Address: DF:A9:FF:F6:B1:1A (OUI DF-A9-FF)
        Count: 1
        #414: len 8 (0 Kb/s)
        Latency: 163 msec (84-172 msec ~148 msec)
> HCI Event: Disconnect Complete (0x05) plen 4            #416 [hci1] 46.457593
        Status: Success (0x00)
        Handle: 3819 Address: DF:A9:FF:F6:B1:1A (OUI DF-A9-FF)
        Reason: Remote User Terminated Connection (0x13)
< HCI Command: Reset (0x03|0x0003) plen 0                 #417 [hci1] 51.670828
> HCI Event: Command Complete (0x0e) plen 4               #418 [hci1] 51.671375
      Reset (0x03|0x0003) ncmd 1
        Status: Success (0x00)
@ USER Close: main                                    {0x0001} [hci1] 51.690704
= Close Index: 00:00:00:00:00:00                               [hci1] 51.690711
