Bluetooth monitor ver 5.84
btmon[1635039]: = Note: Linux version 6.8.0-83-generic (x86_64)                                                          0.409810
btmon[1635039]: = Note: Bluetooth subsystem version 2.22                                                                 0.409812
= New Index: 00:00:00:00:00:00 (Primary,UART,hci0)                                                                       0.409813
= Open Index: 00:00:00:00:00:00                                                                                          0.913394
= Index Info: 00:00:00:00:00:00 (Nordic Semiconductor ASA)                                                               0.913571
zephyr.exe[1635041]: @ USER Open: main (privileged) version 2.22                                                {0x0001} 0.913617
zephyr.exe[1635041]: < HCI Command: Reset (0x03|0x0003) plen 0                                                        #1 0.914327
> HCI Event: Command Complete (0x0e) plen 4                                                                           #2 0.915050
      Reset (0x03|0x0003) ncmd 1
        Status: Success (0x00)
zephyr.exe[1635041]: < HCI Command: Read Local Supported Features (0x04|0x0003) plen 0                                #3 0.933419
> HCI Event: Command Complete (0x0e) plen 12                                                                          #4 0.934434
      Read Local Supported Features (0x04|0x0003) ncmd 1
        Status: Success (0x00)
        Features: 0x00 0x00 0x00 0x00 0x60 0x00 0x00 0x00
          BR/EDR Not Supported
          LE Supported (Controller)
zephyr.exe[1635041]: < HCI Command: Read Local Version Information (0x04|0x0001) plen 0                               #5 0.953416
> HCI Event: Command Complete (0x0e) plen 12                                                                          #6 0.954311
      Read Local Version Information (0x04|0x0001) ncmd 1
        Status: Success (0x00)
        HCI version: Reserved (0x0e) - Revision 12520 (0x30e8)
        LMP version: Reserved (0x0e) - Subversion 12520 (0x30e8)
        Manufacturer: Nordic Semiconductor ASA (89)
zephyr.exe[1635041]: < HCI Command: Read Local Supported Commands (0x04|0x0002) plen 0                                #7 0.973418
> HCI Event: Command Complete (0x0e) plen 68                                                                          #8 0.974885
      Read Local Supported Commands (0x04|0x0002) ncmd 1
        Status: Success (0x00)
        Commands: 119 entries
          Disconnect (Octet 0 - Bit 5)
          Read Remote Version Information (Octet 2 - Bit 7)
          Set Event Mask (Octet 5 - Bit 6)
          Reset (Octet 5 - Bit 7)
          Read Connection Accept Timeout (Octet 7 - Bit 2)
          Write Connection Accept Timeout (Octet 7 - Bit 3)
          Read Transmit Power Level (Octet 10 - Bit 2)
          Set Controller To Host Flow Control (Octet 10 - Bit 5)
          Host Buffer Size (Octet 10 - Bit 6)
          Host Number of Completed Packets (Octet 10 - Bit 7)
          Read Local Version Information (Octet 14 - Bit 3)
          Read Local Supported Features (Octet 14 - Bit 5)
          Read BD ADDR (Octet 15 - Bit 1)
          Read RSSI (Octet 15 - Bit 5)
          Set Event Mask Page 2 (Octet 22 - Bit 2)
          LE Set Event Mask (Octet 25 - Bit 0)
          LE Read Buffer Size (Octet 25 - Bit 1)
          LE Read Local Supported Features (Octet 25 - Bit 2)
          LE Set Random Address (Octet 25 - Bit 4)
          LE Set Advertising Parameters (Octet 25 - Bit 5)
          LE Read Advertising Channel TX Power (Octet 25 - Bit 6)
          LE Set Advertising Data (Octet 25 - Bit 7)
          LE Set Scan Response Data (Octet 26 - Bit 0)
          LE Set Advertise Enable (Octet 26 - Bit 1)
          LE Set Scan Parameters (Octet 26 - Bit 2)
          LE Set Scan Enable (Octet 26 - Bit 3)
          LE Create Connection (Octet 26 - Bit 4)
          LE Create Connection Cancel (Octet 26 - Bit 5)
          LE Read Accept List Size (Octet 26 - Bit 6)
          LE Clear Accept List (Octet 26 - Bit 7)
          LE Add Device To Accept List (Octet 27 - Bit 0)
          LE Remove Device From Accept List (Octet 27 - Bit 1)
          LE Connection Update (Octet 27 - Bit 2)
          LE Set Host Channel Classification (Octet 27 - Bit 3)
          LE Read Channel Map (Octet 27 - Bit 4)
          LE Read Remote Used Features (Octet 27 - Bit 5)
          LE Encrypt (Octet 27 - Bit 6)
          LE Rand (Octet 27 - Bit 7)
          LE Start Encryption (Octet 28 - Bit 0)
          LE Long Term Key Request Reply (Octet 28 - Bit 1)
          LE Long Term Key Request Neg Reply (Octet 28 - Bit 2)
          LE Read Supported States (Octet 28 - Bit 3)
          LE Receiver Test (Octet 28 - Bit 4)
          LE Transmitter Test (Octet 28 - Bit 5)
          LE Test End (Octet 28 - Bit 6)
          Read Authenticated Payload Timeout (Octet 32 - Bit 4)
          Write Authenticated Payload Timeout (Octet 32 - Bit 5)
          LE Set Data Length (Octet 33 - Bit 6)
          LE Read Suggested Default Data Length (Octet 33 - Bit 7)
          LE Write Suggested Default Data Length (Octet 34 - Bit 0)
          LE Add Device To Resolving List (Octet 34 - Bit 3)
          LE Remove Device From Resolving List (Octet 34 - Bit 4)
          LE Clear Resolving List (Octet 34 - Bit 5)
          LE Read Resolving List Size (Octet 34 - Bit 6)
          LE Set Address Resolution Enable (Octet 35 - Bit 1)
          LE Set Resolvable Private Address Timeout (Octet 35 - Bit 2)
          LE Read Maximum Data Length (Octet 35 - Bit 3)
          LE Read PHY (Octet 35 - Bit 4)
          LE Set Default PHY (Octet 35 - Bit 5)
          LE Set PHY (Octet 35 - Bit 6)
          LE Enhanced Receiver Test (Octet 35 - Bit 7)
          LE Enhanced Transmitter Test (Octet 36 - Bit 0)
          LE Set Advertising Set Random Address (Octet 36 - Bit 1)
          LE Set Extended Advertising Parameters (Octet 36 - Bit 2)
          LE Set Extended Advertising Data (Octet 36 - Bit 3)
          LE Set Extended Scan Response Data (Octet 36 - Bit 4)
          LE Set Extended Advertising Enable (Octet 36 - Bit 5)
          LE Read Maximum Advertising Data Length (Octet 36 - Bit 6)
          LE Read Number of Supported Advertising Sets (Octet 36 - Bit 7)
          LE Remove Advertising Set (Octet 37 - Bit 0)
          LE Clear Advertising Sets (Octet 37 - Bit 1)
          LE Set Periodic Advertising Parameters (Octet 37 - Bit 2)
          LE Set Periodic Advertising Data (Octet 37 - Bit 3)
          LE Set Periodic Advertising Enable (Octet 37 - Bit 4)
          LE Set Extended Scan Parameters (Octet 37 - Bit 5)
          LE Set Extended Scan Enable (Octet 37 - Bit 6)
          LE Extended Create Connection (Octet 37 - Bit 7)
          LE Periodic Advertising Create Sync (Octet 38 - Bit 0)
          LE Periodic Advertising Create Sync Cancel (Octet 38 - Bit 1)
          LE Periodic Advertising Terminate Sync (Octet 38 - Bit 2)
          LE Add Device To Periodic Advertiser List (Octet 38 - Bit 3)
          LE Remove Device From Periodic Advertiser List (Octet 38 - Bit 4)
          LE Clear Periodic Advertiser List (Octet 38 - Bit 5)
          LE Read Periodic Advertiser List Size (Octet 38 - Bit 6)
          LE Read Transmit Power (Octet 38 - Bit 7)
          LE Read RF Path Compensation (Octet 39 - Bit 0)
          LE Write RF Path Compensation (Octet 39 - Bit 1)
          LE Set Privacy Mode (Octet 39 - Bit 2)
          LE Periodic Advertising Receive Enable (Octet 40 - Bit 5)
          LE Periodic Advertising Sync Transfer (Octet 40 - Bit 6)
          LE Periodic Advertising Set Info Transfer (Octet 40 - Bit 7)
          LE Periodic Advertising Sync Transfer Parameters (Octet 41 - Bit 0)
          LE Set Default Periodic Advertisng Sync Transfer Parameters (Octet 41 - Bit 1)
          LE Read Buffer v2 (Octet 41 - Bit 5)
          LE Read ISO TX Sync (Octet 41 - Bit 6)
          LE Set Connected Isochronous Group Parameters (Octet 41 - Bit 7)
          LE Set Connected Isochronous Group Parameters Test (Octet 42 - Bit 0)
          LE Create Connected Isochronous Stream (Octet 42 - Bit 1)
          LE Remove Connected Isochronous Group (Octet 42 - Bit 2)
          LE Accept Connected Isochronous Stream Request (Octet 42 - Bit 3)
          LE Reject Connected Isochronous Stream Request (Octet 42 - Bit 4)
          LE Create Broadcast Isochronous Group (Octet 42 - Bit 5)
          LE Create Broadcast Isochronous Group Test (Octet 42 - Bit 6)
          LE Terminate Broadcast Isochronous Group (Octet 42 - Bit 7)
          LE Broadcast Isochronous Group Create Sync (Octet 43 - Bit 0)
          LE Broadcast Isochronous Group Terminate Sync (Octet 43 - Bit 1)
          LE Request Peer SCA (Octet 43 - Bit 2)
          LE Setup Isochronous Data Path (Octet 43 - Bit 3)
          LE Remove Isochronous Data Path (Octet 43 - Bit 4)
          LE Isochronous Transmit Test (Octet 43 - Bit 5)
          LE Isochronous Receive Test (Octet 43 - Bit 6)
          LE Isochronous Read Test Counters (Octet 43 - Bit 7)
          LE Isochronous Read Test Counters (Octet 44 - Bit 0)
          LE Set Host Feature (Octet 44 - Bit 1)
          LE Read ISO link quality (Octet 44 - Bit 2)
          Octet 45 - Bit 6 
          Octet 46 - Bit 0 
          Octet 46 - Bit 1 
          Octet 46 - Bit 2 
zephyr.exe[1635041]: < HCI Command: Host Buffer Size (0x03|0x0033) plen 7                                             #9 0.993420
        ACL MTU: 255  ACL max packet: 16
        SCO MTU: 0    SCO max packet: 0
> HCI Event: Command Complete (0x0e) plen 4                                                                          #10 0.994433
      Host Buffer Size (0x03|0x0033) ncmd 1
        Status: Success (0x00)
zephyr.exe[1635041]: < HCI Command: Set Controller To Host Flow Control (0x03|0x0031) plen 1                         #11 1.013475
        Flow control: ACL Data Packets (0x01)
> HCI Event: Command Complete (0x0e) plen 4                                                                          #12 1.014227
      Set Controller To Host Flow Control (0x03|0x0031) ncmd 1
        Status: Success (0x00)
zephyr.exe[1635041]: < HCI Command: LE Read Local Supported Features (0x08|0x0003) plen 0                            #13 1.033421
> HCI Event: Command Complete (0x0e) plen 12                                                                         #14 1.034812
      LE Read Local Supported Features (0x08|0x0003) ncmd 1
        Status: Success (0x00)
        Features: 0xfd 0x79 0x00 0xf7 0x30 0x01 0x00 0x00
          LE Encryption
          Extended Reject Indication
          Peripheral-initiated Features Exchange
          LE Ping
          LE Data Packet Length Extension
          LL Privacy
          Extended Scanner Filter Policies
          LE 2M PHY
          LE Coded PHY
          LE Extended Advertising
          LE Periodic Advertising
          Channel Selection Algorithm #2
          Periodic Advertising Sync Transfer - Sender
          Periodic Advertising Sync Transfer - Recipient
          Sleep Clock Accuracy Updates
          Connected Isochronous Stream - Central
          Connected Isochronous Stream - Peripheral
          Isochronous Broadcaster
          Synchronized Receiver
          Periodic Advertising ADI support
          Connection Subrating
          Unknown features (0x0000010000000000)
zephyr.exe[1635041]: < HCI Command: LE Set Host Feature (0x08|0x0074) plen 2                                         #15 1.053426
        Bit Number: 32
          Connected Isochronous Stream (Host Support)
        Bit Value: 1
> HCI Event: Command Complete (0x0e) plen 4                                                                          #16 1.055343
      LE Set Host Feature (0x08|0x0074) ncmd 1
        Status: Success (0x00)
zephyr.exe[1635041]: < HCI Command: LE Read Buffer v2 (0x08|0x0060) plen 0                                           #17 1.073419
> HCI Event: Command Complete (0x0e) plen 10                                                                         #18 1.074163
      LE Read Buffer v2 (0x08|0x0060) ncmd 1
        Status: Success (0x00)
        ACL MTU: 27
        ACL max packet: 3
        ISO MTU: 318
        ISO max packet: 3
zephyr.exe[1635041]: < HCI Command: LE Read Maximum Advertising Data Length (0x08|0x003a) plen 0                     #19 1.093452
> HCI Event: Command Complete (0x0e) plen 6                                                                          #20 1.094957
      LE Read Maximum Advertising Data Length (0x08|0x003a) ncmd 1
        Status: Success (0x00)
        Max length: 1650
zephyr.exe[1635041]: < HCI Command: LE Read Supported States (0x08|0x001c) plen 0                                    #21 1.113421
> HCI Event: Command Complete (0x0e) plen 12                                                                         #22 1.115088
      LE Read Supported States (0x08|0x001c) ncmd 1
        Status: Success (0x00)
        States: 0x000003ff3e0306ff
          Non-connectable Advertising State
          Scannable Advertising State
          Connectable Advertising State
          High Duty Cycle Directed Advertising State
          Passive Scanning State
          Active Scanning State
          Initiating State
            and Connection State (Central Role)
          Connection State (Peripheral Role)
          Scannable Advertising State
            and Passive Scanning State
          Connectable Advertising State
            and Passive Scanning State
          Non-connectable Advertising State
            and Initiating State
          Scannable Advertising State
            and Initiating State
          Active Scanning State
            and Connection State (Central Role)
          Passive Scanning State
            and Connection State (Peripheral Role)
          Active Scanning State
            and Connection State (Peripheral Role)
          Initiating State
            and Connection State (Central Role)
            and Central Role & Central Role
          Low Duty Cycle Directed Advertising State
          Connectable Advertising State
            and Initiating State
            and Central Role & Peripheral Role
          High Duty Cycle Directed Advertising State
            and Initiating State
            and Central Role & Peripheral Role
          Low Duty Cycle Directed Advertising State
            and Initiating State
            and Central Role & Peripheral Role
          Connectable Advertising State
            and Connection State (Central Role)
            and Central Role & Peripheral Role
          High Duty Cycle Directed Advertising State
            and Connection State (Central Role)
            and Central Role & Peripheral Role
          Low Duty Cycle Directed Advertising State
            and Connection State (Central Role)
            and Central Role & Peripheral Role
          Connectable Advertising State
            and Connection State (Peripheral Role)
            and Central Role & Peripheral Role
          High Duty Cycle Directed Advertising State
            and Connection State (Peripheral Role)
            and Peripheral Role & Peripheral Role
          Low Duty Cycle Directed Advertising State
            and Connection State (Peripheral Role)
            and Peripheral Role & Peripheral Role
          Initiating State
            and Connection State (Peripheral Role)
            and Central Role & Peripheral Role
zephyr.exe[1635041]: < HCI Command: LE Read Maximum Data Length (0x08|0x002f) plen 0                                 #23 1.133416
> HCI Event: Command Complete (0x0e) plen 12                                                                         #24 1.134360
      LE Read Maximum Data Length (0x08|0x002f) ncmd 1
        Status: Success (0x00)
        Max TX octets: 251
        Max TX time: 2704
        Max RX octets: 251
        Max RX time: 2704
zephyr.exe[1635041]: < HCI Command: LE Write Suggested Default Data Length (0x08|0x0024) plen 4                      #25 1.153422
        TX octets: 251
        TX time: 2704
> HCI Event: Command Complete (0x0e) plen 4                                                                          #26 1.154018
      LE Write Suggested Default Data Length (0x08|0x0024) ncmd 1
        Status: Success (0x00)
zephyr.exe[1635041]: < HCI Command: LE Read Resolving List Size (0x08|0x002a) plen 0                                 #27 1.173429
> HCI Event: Command Complete (0x0e) plen 5                                                                          #28 1.174021
      LE Read Resolving List Size (0x08|0x002a) ncmd 1
        Status: Success (0x00)
        Size: 8
zephyr.exe[1635041]: < HCI Command: LE Set Event Mask (0x08|0x0001) plen 8                                           #29 1.193430
        Mask: 0x000002023f87fa5e
          LE Advertising Report
          LE Connection Update Complete
          LE Read Remote Used Features Complete
          LE Long Term Key Request
          LE Data Length Change
          LE Enhanced Connection Complete
          LE PHY Update Complete
          LE Extended Advertising Report
          LE Periodic Advertising Sync Established
          LE Periodic Advertising Report
          LE Periodic Advertising Sync Lost
          LE Extended Scan Timeout
          LE Extended Advertising Set Terminated
          LE Scan Request Received
          LE Periodic Advertising Sync Transfer Rvc
          LE CIS Established
          LE CIS Request
          LE Create BIG Complete
          LE Terminate BIG Complete
          LE BIG Sync Established Complete
          LE BIG Sync Lost
          LE BIG Info Advertising Report
          Unknown mask (0x0000020000000000)
> HCI Event: Command Complete (0x0e) plen 4                                                                          #30 1.194124
      LE Set Event Mask (0x08|0x0001) ncmd 1
        Status: Success (0x00)
zephyr.exe[1635041]: < HCI Command: Set Event Mask (0x03|0x0001) plen 8                                              #31 1.213421
        Mask: 0x2000800002008890
          Disconnection Complete
          Encryption Change
          Read Remote Version Information Complete
          Hardware Error
          Data Buffer Overflow
          Encryption Key Refresh Complete
          LE Meta
> HCI Event: Command Complete (0x0e) plen 4                                                                          #32 1.214297
      Set Event Mask (0x03|0x0001) ncmd 1
        Status: Success (0x00)
zephyr.exe[1635041]: < HCI Command: Read BD ADDR (0x04|0x0009) plen 0                                                #33 1.233419
> HCI Event: Command Complete (0x0e) plen 10                                                                         #34 1.234195
      Read BD ADDR (0x04|0x0009) ncmd 1
        Status: Success (0x00)
        Address: 00:00:00:00:00:00 (OUI 00-00-00)
zephyr.exe[1635041]: < HCI Command: LE Set Random Address (0x08|0x0005) plen 6                                       #35 1.253427
        Address: D5:B6:CC:31:DB:3B (Static)
> HCI Event: Command Complete (0x0e) plen 4                                                                          #36 1.254054
      LE Set Random Address (0x08|0x0005) ncmd 1
        Status: Success (0x00)
zephyr.exe[1635041]: < HCI Command: LE Set Extended Advertising Parameters (0x08|0x0036) plen 25                     #37 1.913507
        Handle: 0x00
        Properties: 0x0001
          Connectable
        Min advertising interval: 100.000 msec (0x00a0)
        Max advertising interval: 150.000 msec (0x00f0)
        Channel map: 37, 38, 39 (0x07)
        Own address type: Random (0x01)
        Peer address type: Public (0x00)
        Peer address: 00:00:00:00:00:00 (OUI 00-00-00)
        Filter policy: Allow Scan Request from Any, Allow Connect Request from Any (0x00)
        TX power: Host has no preference (0x7f)
        Primary PHY: LE 1M (0x01)
        Secondary max skip: 0x00
        Secondary PHY: LE 2M (0x02)
        SID: 0x00
        Scan request notifications: Disabled (0x00)
> HCI Event: Command Complete (0x0e) plen 5                                                                          #38 1.915463
      LE Set Extended Advertising Parameters (0x08|0x0036) ncmd 1
        Status: Success (0x00)
        TX power (selected): 0 dbm (0x00)
zephyr.exe[1635041]: < HCI Command: LE Set Advertising Set Random Address (0x08|0x0035) plen 7                       #39 1.933429
        Advertising handle: 0x00
        Advertising random address: D5:B6:CC:31:DB:3B (Static)
> HCI Event: Command Complete (0x0e) plen 4                                                                          #40 1.934080
      LE Set Advertising Set Random Address (0x08|0x0035) ncmd 1
        Status: Success (0x00)
zephyr.exe[1635041]: < HCI Command: LE Set Extended Advertising Data (0x08|0x0037) plen 39                           #41 1.953429
        Handle: 0x00
        Operation: Complete extended advertising data (0x03)
        Fragment preference: Minimize fragmentation (0x01)
        Data length: 0x23
        Flags: 0x06
          LE General Discoverable Mode
          BR/EDR Not Supported
        Name (complete): Tester_2CB6EE
        Flags: 0x06
          LE General Discoverable Mode
          BR/EDR Not Supported
        16-bit Service UUIDs (complete): 1 entry
          Audio Stream Control (0x184e)
        Service Data: Audio Stream Control (0x184e)
          Data[6]: 01ff0fff0f00
> HCI Event: Command Complete (0x0e) plen 4                                                                          #42 1.954489
      LE Set Extended Advertising Data (0x08|0x0037) ncmd 1
        Status: Success (0x00)
zephyr.exe[1635041]: < HCI Command: LE Set Extended Advertising Enable (0x08|0x0039) plen 6                          #43 1.973432
        Extended advertising: Enabled (0x01)
        Number of sets: 1 (0x01)
        Entry 0
          Handle: 0x00
          Duration: 0 ms (0x00)
          Max ext adv events: 0
> HCI Event: Command Complete (0x0e) plen 4                                                                          #44 1.974760
      LE Set Extended Advertising Enable (0x08|0x0039) ncmd 1
        Status: Success (0x00)
> HCI Event: LE Meta Event (0x3e) plen 31                                                                            #45 4.379798
      LE Enhanced Connection Complete (0x0a)
        Status: Success (0x00)
        Handle: 417
        Role: Peripheral (0x01)
        Peer address type: Public (0x00)
        Peer address: C0:07:E8:2C:B6:EE (OUI C0-07-E8)
        Local resolvable private address: 00:00:00:00:00:00 (Non-Resolvable)
        Peer resolvable private address: 00:00:00:00:00:00 (Non-Resolvable)
        Connection interval: 80.00 msec (0x0040)
        Connection latency: 0 (0x0000)
        Supervision timeout: 25120 msec (0x09d0)
        Central clock accuracy: 0x07
> HCI Event: LE Meta Event (0x3e) plen 6                                                                             #46 4.380115
      LE Advertising Set Terminated (0x12)
        Status: Success (0x00)
        Handle: 0
        Connection handle: 417
        Number of completed extended advertising events: 0
zephyr.exe[1635041]: < HCI Command: LE Read Remote Used Features (0x08|0x0016) plen 2                                #47 4.393577
        Handle: 417 Address: C0:07:E8:2C:B6:EE (OUI C0-07-E8)
> HCI Event: Command Status (0x0f) plen 4                                                                            #48 4.394175
      LE Read Remote Used Features (0x08|0x0016) ncmd 1
        Status: Success (0x00)
zephyr.exe[1635041]: < HCI Command: LE Set PHY (0x08|0x0032) plen 7                                                  #49 4.413538
        Handle: 417 Address: C0:07:E8:2C:B6:EE (OUI C0-07-E8)
        All PHYs preference: 0x00
        TX PHYs preference: 0x02
          LE 2M
        RX PHYs preference: 0x02
          LE 2M
        PHY options preference: Reserved (0x0000)
> HCI Event: Command Status (0x0f) plen 4                                                                            #50 4.414245
      LE Set PHY (0x08|0x0032) ncmd 1
        Status: Success (0x00)
zephyr.exe[1635041]: < ACL Data TX: Handle 417 [1/3] flags 0x00 dlen 7                                               #51 4.433625
      ATT: Exchange MTU Request (0x02) len 2
        Client RX MTU: 251
> HCI Event: Number of Completed Packets (0x13) plen 5                                                               #52 4.541725
        Num handles: 1
        Handle: 417 Address: C0:07:E8:2C:B6:EE (OUI C0-07-E8)
        Count: 1
        Buffers: 0/3
        #51: len 7 (0 Kb/s)
        Latency: 108 msec (108-108 msec ~108 msec)
> HCI Event: LE Meta Event (0x3e) plen 12                                                                            #53 4.622065
      LE Read Remote Used Features (0x04)
        Status: Success (0x00)
        Handle: 417 Address: C0:07:E8:2C:B6:EE (OUI C0-07-E8)
        Features: 0x2d 0x49 0x01 0xf7 0xef 0x39 0x00 0x80
          LE Encryption
          Extended Reject Indication
          Peripheral-initiated Features Exchange
          LE Data Packet Length Extension
          LE 2M PHY
          LE Coded PHY
          Channel Selection Algorithm #2
          Minimum Number of Used Channels Procedure
          Periodic Advertising Sync Transfer - Sender
          Periodic Advertising Sync Transfer - Recipient
          Sleep Clock Accuracy Updates
          Connected Isochronous Stream - Central
          Connected Isochronous Stream - Peripheral
          Isochronous Broadcaster
          Synchronized Receiver
          Connected Isochronous Stream (Host Support)
          LE Power Control Request
          LE Power Control Request
          LE Path Loss Monitoring
          Connection Subrating
          Connection Subrating (Host Support)
          Channel Classification
          Unknown features (0x8000390000000000)
> HCI Event: LE Meta Event (0x3e) plen 6                                                                             #54 4.622328
      LE PHY Update Complete (0x0c)
        Status: Success (0x00)
        Handle: 417 Address: C0:07:E8:2C:B6:EE (OUI C0-07-E8)
        TX PHY: LE 2M (0x02)
        RX PHY: LE 2M (0x02)
> ACL Data RX: Handle 417 flags 0x02 dlen 7                                                                          #55 5.021812
      ATT: Exchange MTU Request (0x02) len 2
        Client RX MTU: 64
> ACL Data RX: Handle 417 flags 0x02 dlen 7                                                                          #56 5.022428
      ATT: Exchange MTU Response (0x03) len 2
        Server RX MTU: 64
zephyr.exe[1635041]: < HCI Command: LE Remove Advertising Set (0x08|0x003c) plen 1                                   #57 5.023464
        Handle: 0
> HCI Event: Command Complete (0x0e) plen 4                                                                          #58 5.024394
      LE Remove Advertising Set (0x08|0x003c) ncmd 1
        Status: Success (0x00)
zephyr.exe[1635041]: < HCI Command: LE Set Extended Advertising Parameters (0x08|0x0036) plen 25                     #59 5.033529
        Handle: 0x00
        Properties: 0x0001
          Connectable
        Min advertising interval: 100.000 msec (0x00a0)
        Max advertising interval: 150.000 msec (0x00f0)
        Channel map: 37, 38, 39 (0x07)
        Own address type: Random (0x01)
        Peer address type: Public (0x00)
        Peer address: 00:00:00:00:00:00 (OUI 00-00-00)
        Filter policy: Allow Scan Request from Any, Allow Connect Request from Any (0x00)
        TX power: Host has no preference (0x7f)
        Primary PHY: LE 1M (0x01)
        Secondary max skip: 0x00
        Secondary PHY: LE 2M (0x02)
        SID: 0x01
        Scan request notifications: Disabled (0x00)
zephyr.exe[1635041]: < HCI Command: Host Number of Completed Packets (0x03|0x0035) plen 5                            #60 5.033801
        Num handles: 1
        Handle: 417 Address: C0:07:E8:2C:B6:EE (OUI C0-07-E8)
        Count: 1
zephyr.exe[1635041]: < ACL Data TX: Handle 417 [1/3] flags 0x00 dlen 7                                               #61 5.033846
      ATT: Exchange MTU Response (0x03) len 2
        Server RX MTU: 251
zephyr.exe[1635041]: < HCI Command: Host Number of Completed Packets (0x03|0x0035) plen 5                            #62 5.034504
        Num handles: 1
        Handle: 417 Address: C0:07:E8:2C:B6:EE (OUI C0-07-E8)
        Count: 1
> HCI Event: Command Complete (0x0e) plen 5                                                                          #63 5.035132
      LE Set Extended Advertising Parameters (0x08|0x0036) ncmd 1
        Status: Success (0x00)
        TX power (selected): 0 dbm (0x00)
zephyr.exe[1635041]: < HCI Command: LE Set Advertising Set Random Address (0x08|0x0035) plen 7                       #64 5.053488
        Advertising handle: 0x00
        Advertising random address: D5:B6:CC:31:DB:3B (Static)
> HCI Event: Command Complete (0x0e) plen 4                                                                          #65 5.054044
      LE Set Advertising Set Random Address (0x08|0x0035) ncmd 1
        Status: Success (0x00)
zephyr.exe[1635041]: < HCI Command: LE Set Extended Advertising Data (0x08|0x0037) plen 39                           #66 5.073476
        Handle: 0x00
        Operation: Complete extended advertising data (0x03)
        Fragment preference: Minimize fragmentation (0x01)
        Data length: 0x23
        Flags: 0x06
          LE General Discoverable Mode
          BR/EDR Not Supported
        Name (complete): Tester_2CB6EE
        Flags: 0x06
          LE General Discoverable Mode
          BR/EDR Not Supported
        16-bit Service UUIDs (complete): 1 entry
          Audio Stream Control (0x184e)
        Service Data: Audio Stream Control (0x184e)
          Data[6]: 01ff0fff0f00
> HCI Event: Command Complete (0x0e) plen 4                                                                          #67 5.074510
      LE Set Extended Advertising Data (0x08|0x0037) ncmd 1
        Status: Success (0x00)
zephyr.exe[1635041]: < HCI Command: LE Set Extended Advertising Enable (0x08|0x0039) plen 6                          #68 5.093467
        Extended advertising: Enabled (0x01)
        Number of sets: 1 (0x01)
        Entry 0
          Handle: 0x00
          Duration: 0 ms (0x00)
          Max ext adv events: 0
> HCI Event: Command Complete (0x0e) plen 4                                                                          #69 5.094218
      LE Set Extended Advertising Enable (0x08|0x0039) ncmd 1
        Status: Success (0x00)
> HCI Event: Number of Completed Packets (0x13) plen 5                                                               #70 5.181726
        Num handles: 1
        Handle: 417 Address: C0:07:E8:2C:B6:EE (OUI C0-07-E8)
        Count: 1
        Buffers: 0/3
        #61: len 7 (0 Kb/s)
        Latency: 147 msec (108-147 msec ~127 msec)
> ACL Data RX: Handle 417 flags 0x02 dlen 11                                                                         #71 7.182276
      SMP: Pairing Request (0x01) len 6
        IO capability: KeyboardDisplay (0x04)
        OOB data: Authentication data not present (0x00)
        Authentication requirement: Bonding, No MITM, SC, No Keypresses (0x09)
        Max encryption key size: 16
        Initiator key distribution: EncKey IdKey Sign (0x07)
        Responder key distribution: EncKey IdKey Sign (0x07)
zephyr.exe[1635041]: < HCI Command: Host Number of Completed Packets (0x03|0x0035) plen 5                            #72 7.193649
        Num handles: 1
        Handle: 417 Address: C0:07:E8:2C:B6:EE (OUI C0-07-E8)
        Count: 1
zephyr.exe[1635041]: < ACL Data TX: Handle 417 [1/3] flags 0x00 dlen 11                                              #73 7.193962
      SMP: Pairing Response (0x02) len 6
        IO capability: NoInputNoOutput (0x03)
        OOB data: Authentication data not present (0x00)
        Authentication requirement: Bonding, No MITM, SC, No Keypresses (0x09)
        Max encryption key size: 16
        Initiator key distribution: IdKey Sign (0x06)
        Responder key distribution: Sign (0x04)
> HCI Event: Number of Completed Packets (0x13) plen 5                                                               #74 7.341894
        Num handles: 1
        Handle: 417 Address: C0:07:E8:2C:B6:EE (OUI C0-07-E8)
        Count: 1
        Buffers: 0/3
        #73: len 11 (0 Kb/s)
        Latency: 147 msec (108-147 msec ~137 msec)
> ACL Data RX: Handle 417 flags 0x02 dlen 27                                                                         #75 7.342171
> ACL Data RX: Handle 417 flags 0x01 dlen 27                                                                         #76 7.342533
> ACL Data RX: Handle 417 flags 0x01 dlen 15                                                                         #77 7.342906
      SMP: Pairing Public Key (0x0c) len 64
        X[32]: 716c0f85b33091ef8c02367256a034590d24ffe2f33aec34898cdc06ab3d38e7
        Y[32]: 4ebe90d9d463ca27a7ea415bdec021b00967a0f737c1b81d1daa245eb280e285
zephyr.exe[1635041]: < HCI Command: Host Number of Completed Packets (0x03|0x0035) plen 5                            #78 7.353636
        Num handles: 1
        Handle: 417 Address: C0:07:E8:2C:B6:EE (OUI C0-07-E8)
        Count: 1
zephyr.exe[1635041]: < HCI Command: Host Number of Completed Packets (0x03|0x0035) plen 5                            #79 7.354092
        Num handles: 1
        Handle: 417 Address: C0:07:E8:2C:B6:EE (OUI C0-07-E8)
        Count: 1
zephyr.exe[1635041]: < HCI Command: Host Number of Completed Packets (0x03|0x0035) plen 5                            #80 7.354162
        Num handles: 1
        Handle: 417 Address: C0:07:E8:2C:B6:EE (OUI C0-07-E8)
        Count: 1
zephyr.exe[1635041]: < ACL Data TX: Handle 417 [1/3] flags 0x00 dlen 27                                              #81 7.354568
zephyr.exe[1635041]: < ACL Data TX: Handle 417 flags 0x01 dlen 27                                                    #82 7.354630
zephyr.exe[1635041]: < ACL Data TX: Handle 417 flags 0x01 dlen 15                                                    #83 7.354647
      SMP: Pairing Public Key (0x0c) len 64
        X[32]: 98308440221e2d910f0e54b71e7ec652857aa9b5a0dc65028824cc19db1226e9
        Y[32]: 67a4816bcb62efb21701e31fdb27561a6217575fb007a8bbdabe7e28b6f68482
> HCI Event: Number of Completed Packets (0x13) plen 5                                                               #84 7.422243
        Num handles: 1
        Handle: 417 Address: C0:07:E8:2C:B6:EE (OUI C0-07-E8)
        Count: 1
        Buffers: 0/3
        #81: len 27 (3 Kb/s)
        Latency: 67 msec (67-147 msec ~102 msec)
> HCI Event: Number of Completed Packets (0x13) plen 5                                                               #85 7.422706
        Num handles: 1
        Handle: 417 Address: C0:07:E8:2C:B6:EE (OUI C0-07-E8)
        Count: 1
        Buffers: underflow/3
        #82: len 27 (3 Kb/s)
        Latency: 68 msec (67-147 msec ~85 msec)
zephyr.exe[1635041]: < ACL Data TX: Handle 417 [1/3] flags 0x00 dlen 21                                              #86 7.433474
      SMP: Pairing Confirm (0x03) len 16
        Confirm value[16]: 0035a0a2f0cfd845b1b6d339a4dae1b3
> HCI Event: Number of Completed Packets (0x13) plen 5                                                               #87 7.501767
        Num handles: 1
        Handle: 417 Address: C0:07:E8:2C:B6:EE (OUI C0-07-E8)
        Count: 1
        Buffers: 0/3
        #83: len 15 (0 Kb/s)
        Latency: 147 msec (67-147 msec ~116 msec)
> HCI Event: Number of Completed Packets (0x13) plen 5                                                               #88 7.581901
        Num handles: 1
        Handle: 417 Address: C0:07:E8:2C:B6:EE (OUI C0-07-E8)
        Count: 1
        Buffers: underflow/3
        #86: len 21 (1 Kb/s)
        Latency: 148 msec (67-148 msec ~132 msec)
> ACL Data RX: Handle 417 flags 0x02 dlen 21                                                                         #89 7.582185
      SMP: Pairing Random (0x04) len 16
        Random value[16]: f785eba6da615ecd0000000000000000
zephyr.exe[1635041]: < HCI Command: Host Number of Completed Packets (0x03|0x0035) plen 5                            #90 7.593557
        Num handles: 1
        Handle: 417 Address: C0:07:E8:2C:B6:EE (OUI C0-07-E8)
        Count: 1
zephyr.exe[1635041]: < ACL Data TX: Handle 417 [1/3] flags 0x00 dlen 21                                              #91 7.593733
      SMP: Pairing Random (0x04) len 16
        Random value[16]: 8e6108f966a694cbe26df70bb96773e6
> HCI Event: Number of Completed Packets (0x13) plen 5                                                               #92 7.741714
        Num handles: 1
        Handle: 417 Address: C0:07:E8:2C:B6:EE (OUI C0-07-E8)
        Count: 1
        Buffers: 0/3
        #91: len 21 (1 Kb/s)
        Latency: 147 msec (67-148 msec ~140 msec)
> ACL Data RX: Handle 417 flags 0x02 dlen 21                                                                         #93 7.901966
      SMP: Pairing DHKey Check (0x0d) len 16
        E[16]: c6b5d3e80ee81314ecc8fb82c4c8c1e6
zephyr.exe[1635041]: < HCI Command: Host Number of Completed Packets (0x03|0x0035) plen 5                            #94 7.913572
        Num handles: 1
        Handle: 417 Address: C0:07:E8:2C:B6:EE (OUI C0-07-E8)
        Count: 1
zephyr.exe[1635041]: < ACL Data TX: Handle 417 [1/3] flags 0x00 dlen 21                                              #95 7.913682
      SMP: Pairing DHKey Check (0x0d) len 16
        E[16]: 0a3d4a5dcbf10036eb344669c2c5593c
> HCI Event: Number of Completed Packets (0x13) plen 5                                                               #96 8.061842
        Num handles: 1
        Handle: 417 Address: C0:07:E8:2C:B6:EE (OUI C0-07-E8)
        Count: 1
        Buffers: 0/3
        #95: len 21 (1 Kb/s)
        Latency: 148 msec (67-148 msec ~144 msec)
> HCI Event: LE Meta Event (0x3e) plen 13                                                                            #97 8.142257
      LE Long Term Key Request (0x05)
        Handle: 417 Address: C0:07:E8:2C:B6:EE (OUI C0-07-E8)
        Random number: 0x0000000000000000
        Encrypted diversifier: 0x0000
zephyr.exe[1635041]: < HCI Command: LE Long Term Key Request Reply (0x08|0x001a) plen 18                             #98 8.153533
        Handle: 417 Address: C0:07:E8:2C:B6:EE (OUI C0-07-E8)
        Long term key[16]: 405bf6de9fd50f04700c427eb1f67994
> HCI Event: Command Complete (0x0e) plen 6                                                                          #99 8.154428
      LE Long Term Key Request Reply (0x08|0x001a) ncmd 1
        Status: Success (0x00)
        Handle: 417 Address: C0:07:E8:2C:B6:EE (OUI C0-07-E8)
> HCI Event: Encryption Change (0x08) plen 4                                                                        #100 8.541962
        Status: Success (0x00)
        Handle: 417 Address: C0:07:E8:2C:B6:EE (OUI C0-07-E8)
        Encryption: Enabled with AES-CCM (0x01)
zephyr.exe[1635041]: < ACL Data TX: Handle 417 [1/3] flags 0x00 dlen 21                                             #101 8.663670
      SMP: Signing Information (0x0a) len 16
        Signature key[16]: 5da095555cc64d02679f89a05211af56
> HCI Event: Number of Completed Packets (0x13) plen 5                                                              #102 8.781956
        Num handles: 1
        Handle: 417 Address: C0:07:E8:2C:B6:EE (OUI C0-07-E8)
        Count: 1
        Buffers: 0/3
        #101: len 21 (1 Kb/s)
        Latency: 118 msec (67-148 msec ~131 msec)
> ACL Data RX: Handle 417 flags 0x02 dlen 21                                                                        #103 8.782181
      SMP: Identity Information (0x08) len 16
        Identity resolving key[16]: f0a589c972ac0daac124b4c680f656e1
> ACL Data RX: Handle 417 flags 0x02 dlen 12                                                                        #104 8.782376
      SMP: Identity Address Information (0x09) len 7
        Address: C0:07:E8:2C:B6:EE (OUI C0-07-E8)
> ACL Data RX: Handle 417 flags 0x02 dlen 21                                                                        #105 8.783029
      SMP: Signing Information (0x0a) len 16
        Signature key[16]: 6abfa536e61a62d1dc21d13ac8316a53
zephyr.exe[1635041]: < HCI Command: Host Number of Completed Packets (0x03|0x0035) plen 5                           #106 8.793603
        Num handles: 1
        Handle: 417 Address: C0:07:E8:2C:B6:EE (OUI C0-07-E8)
        Count: 1
zephyr.exe[1635041]: < HCI Command: LE Set Extended Advertising Enable (0x08|0x0039) plen 6                         #107 8.794185
        Extended advertising: Disabled (0x00)
        Number of sets: 1 (0x01)
        Entry 0
          Handle: 0x00
          Duration: 0 ms (0x00)
          Max ext adv events: 0
> HCI Event: Command Complete (0x0e) plen 4                                                                         #108 8.794750
      LE Set Extended Advertising Enable (0x08|0x0039) ncmd 1
        Status: Success (0x00)
zephyr.exe[1635041]: < HCI Command: LE Add Device To Resolving List (0x08|0x0027) plen 39                           #109 8.813556
        Address type: Public (0x00)
        Address: C0:07:E8:2C:B6:EE (OUI C0-07-E8)
        Peer identity resolving key[16]: f0a589c972ac0daac124b4c680f656e1
        Local identity resolving key[16]: 00000000000000000000000000000000
> HCI Event: Command Complete (0x0e) plen 4                                                                         #110 8.815270
      LE Add Device To Resolving List (0x08|0x0027) ncmd 1
        Status: Success (0x00)
zephyr.exe[1635041]: < HCI Command: LE Set Privacy Mode (0x08|0x004e) plen 8                                        #111 8.833573
        Peer Identity address type: Public (0x00)
        Peer Identity address: C0:07:E8:2C:B6:EE (OUI C0-07-E8)
        Privacy Mode: Use Device Privacy (0x01)
> HCI Event: Command Complete (0x0e) plen 4                                                                         #112 8.834484
      LE Set Privacy Mode (0x08|0x004e) ncmd 1
        Status: Success (0x00)
zephyr.exe[1635041]: < HCI Command: LE Set Address Resolution Enable (0x08|0x002d) plen 1                           #113 8.853532
        Address resolution: Enabled (0x01)
> HCI Event: Command Complete (0x0e) plen 4                                                                         #114 8.853976
      LE Set Address Resolution Enable (0x08|0x002d) ncmd 1
        Status: Success (0x00)
zephyr.exe[1635041]: < HCI Command: LE Set Extended Advertising Enable (0x08|0x0039) plen 6                         #115 8.873643
        Extended advertising: Enabled (0x01)
        Number of sets: 1 (0x01)
        Entry 0
          Handle: 0x00
          Duration: 0 ms (0x00)
          Max ext adv events: 0
> HCI Event: Command Complete (0x0e) plen 4                                                                         #116 8.874513
      LE Set Extended Advertising Enable (0x08|0x0039) ncmd 1
        Status: Success (0x00)
zephyr.exe[1635041]: < HCI Command: Host Number of Completed Packets (0x03|0x0035) plen 5                           #117 8.893494
        Num handles: 1
        Handle: 417 Address: C0:07:E8:2C:B6:EE (OUI C0-07-E8)
        Count: 1
zephyr.exe[1635041]: < HCI Command: Host Number of Completed Packets (0x03|0x0035) plen 5                           #118 8.894017
        Num handles: 1
        Handle: 417 Address: C0:07:E8:2C:B6:EE (OUI C0-07-E8)
        Count: 1
> ACL Data RX: Handle 417 flags 0x02 dlen 13                                                                        #119 8.941885
      ATT: Find By Type Value Request (0x06) len 8
        Handle range: 0x0001-0xffff
        Attribute type: Primary Service (0x2800)
          UUID: Published Audio Capabilities (0x1850)
zephyr.exe[1635041]: < HCI Command: Host Number of Completed Packets (0x03|0x0035) plen 5                           #120 8.953629
        Num handles: 1
        Handle: 417 Address: C0:07:E8:2C:B6:EE (OUI C0-07-E8)
        Count: 1
zephyr.exe[1635041]: < ACL Data TX: Handle 417 [1/3] flags 0x00 dlen 9                                              #121 8.953795
      ATT: Find By Type Value Response (0x07) len 4
        Handle range: 0x0024-0x0036
> HCI Event: Number of Completed Packets (0x13) plen 5                                                              #122 9.101922
        Num handles: 1
        Handle: 417 Address: C0:07:E8:2C:B6:EE (OUI C0-07-E8)
        Count: 1
        Buffers: 0/3
        #121: len 9 (0 Kb/s)
        Latency: 148 msec (67-148 msec ~139 msec)
> ACL Data RX: Handle 417 flags 0x02 dlen 13                                                                        #123 9.102152
      ATT: Find By Type Value Request (0x06) len 8
        Handle range: 0x0037-0xffff
        Attribute type: Primary Service (0x2800)
          UUID: Published Audio Capabilities (0x1850)
zephyr.exe[1635041]: < HCI Command: Host Number of Completed Packets (0x03|0x0035) plen 5                           #124 9.113679
        Num handles: 1
        Handle: 417 Address: C0:07:E8:2C:B6:EE (OUI C0-07-E8)
        Count: 1
zephyr.exe[1635041]: < ACL Data TX: Handle 417 [1/3] flags 0x00 dlen 9                                              #125 9.113791
      ATT: Error Response (0x01) len 4
        Find By Type Value Request (0x06)
        Handle: 0x0037
        Error: Attribute Not Found (0x0a)
> HCI Event: Number of Completed Packets (0x13) plen 5                                                              #126 9.261882
        Num handles: 1
        Handle: 417 Address: C0:07:E8:2C:B6:EE (OUI C0-07-E8)
        Count: 1
        Buffers: 0/3
        #125: len 9 (0 Kb/s)
        Latency: 148 msec (67-148 msec ~143 msec)
> ACL Data RX: Handle 417 flags 0x02 dlen 11                                                                        #127 9.262121
      ATT: Read By Type Request (0x08) len 6
        Handle range: 0x0024-0x0036
        Attribute type: Characteristic (0x2803)
zephyr.exe[1635041]: < HCI Command: Host Number of Completed Packets (0x03|0x0035) plen 5                           #128 9.273678
        Num handles: 1
        Handle: 417 Address: C0:07:E8:2C:B6:EE (OUI C0-07-E8)
        Count: 1
zephyr.exe[1635041]: < ACL Data TX: Handle 417 [1/3] flags 0x00 dlen 27                                             #129 9.273791
zephyr.exe[1635041]: < ACL Data TX: Handle 417 flags 0x01 dlen 21                                                   #130 9.273809
      ATT: Read By Type Response (0x09) len 43
        Attribute data length: 7
        Attribute data list: 6 entries
        Handle: 0x0025
        Value[5]: 122600c92b
            Properties: 0x12
              Read (0x02)
              Notify (0x10)
            Value Handle: 0x0026
            Value UUID: Sink PAC (0x2bc9)
        Handle: 0x0028
        Value[5]: 1a2900ca2b
            Properties: 0x1a
              Read (0x02)
              Write (0x08)
              Notify (0x10)
            Value Handle: 0x0029
            Value UUID: Sink Audio Locations (0x2bca)
        Handle: 0x002b
        Value[5]: 122c00cb2b
            Properties: 0x12
              Read (0x02)
              Notify (0x10)
            Value Handle: 0x002c
            Value UUID: Source PAC (0x2bcb)
        Handle: 0x002e
        Value[5]: 1a2f00cc2b
            Properties: 0x1a
              Read (0x02)
              Write (0x08)
              Notify (0x10)
            Value Handle: 0x002f
            Value UUID: Source Audio Locations (0x2bcc)
        Handle: 0x0031
        Value[5]: 123200cd2b
            Properties: 0x12
              Read (0x02)
              Notify (0x10)
            Value Handle: 0x0032
            Value UUID: Available Audio Contexts (0x2bcd)
        Handle: 0x0034
        Value[5]: 123500ce2b
            Properties: 0x12
              Read (0x02)
              Notify (0x10)
            Value Handle: 0x0035
            Value UUID: Supported Audio Contexts (0x2bce)
> HCI Event: Number of Completed Packets (0x13) plen 5                                                              #131 9.342269
        Num handles: 1
        Handle: 417 Address: C0:07:E8:2C:B6:EE (OUI C0-07-E8)
        Count: 1
        Buffers: 0/3
        #129: len 27 (3 Kb/s)
        Latency: 68 msec (67-148 msec ~106 msec)
> HCI Event: Number of Completed Packets (0x13) plen 5                                                              #132 9.421870
        Num handles: 1
        Handle: 417 Address: C0:07:E8:2C:B6:EE (OUI C0-07-E8)
        Count: 1
        Buffers: underflow/3
        #130: len 21 (1 Kb/s)
        Latency: 148 msec (67-148 msec ~127 msec)
> ACL Data RX: Handle 417 flags 0x02 dlen 11                                                                        #133 9.422096
      ATT: Read By Type Request (0x08) len 6
        Handle range: 0x0035-0x0036
        Attribute type: Characteristic (0x2803)
zephyr.exe[1635041]: < HCI Command: Host Number of Completed Packets (0x03|0x0035) plen 5                           #134 9.433588
        Num handles: 1
        Handle: 417 Address: C0:07:E8:2C:B6:EE (OUI C0-07-E8)
        Count: 1
zephyr.exe[1635041]: < ACL Data TX: Handle 417 [1/3] flags 0x00 dlen 9                                              #135 9.434217
      ATT: Error Response (0x01) len 4
        Read By Type Request (0x08)
        Handle: 0x0035
        Error: Attribute Not Found (0x0a)
> HCI Event: Number of Completed Packets (0x13) plen 5                                                              #136 9.581917
        Num handles: 1
        Handle: 417 Address: C0:07:E8:2C:B6:EE (OUI C0-07-E8)
        Count: 1
        Buffers: 0/3
        #135: len 9 (0 Kb/s)
        Latency: 147 msec (67-148 msec ~137 msec)
> ACL Data RX: Handle 417 flags 0x02 dlen 9                                                                         #137 9.582287
      ATT: Find Information Request (0x04) len 4
        Handle range: 0x0027-0x0027
zephyr.exe[1635041]: < HCI Command: Host Number of Completed Packets (0x03|0x0035) plen 5                           #138 9.593677
        Num handles: 1
        Handle: 417 Address: C0:07:E8:2C:B6:EE (OUI C0-07-E8)
        Count: 1
zephyr.exe[1635041]: < ACL Data TX: Handle 417 [1/3] flags 0x00 dlen 10                                             #139 9.594222
      ATT: Find Information Response (0x05) len 5
        Format: UUID-16 (0x01)
        Handle: 0x0027
        UUID: Client Characteristic Configuration (0x2902)
> HCI Event: Number of Completed Packets (0x13) plen 5                                                              #140 9.741896
        Num handles: 1
        Handle: 417 Address: C0:07:E8:2C:B6:EE (OUI C0-07-E8)
        Count: 1
        Buffers: 0/3
        #139: len 10 (0 Kb/s)
        Latency: 147 msec (67-148 msec ~142 msec)
> ACL Data RX: Handle 417 flags 0x02 dlen 9                                                                         #141 9.742249
      ATT: Find Information Request (0x04) len 4
        Handle range: 0x002a-0x002a
zephyr.exe[1635041]: < HCI Command: Host Number of Completed Packets (0x03|0x0035) plen 5                           #142 9.753586
        Num handles: 1
        Handle: 417 Address: C0:07:E8:2C:B6:EE (OUI C0-07-E8)
        Count: 1
zephyr.exe[1635041]: < ACL Data TX: Handle 417 [1/3] flags 0x00 dlen 10                                             #143 9.753755
      ATT: Find Information Response (0x05) len 5
        Format: UUID-16 (0x01)
        Handle: 0x002a
        UUID: Client Characteristic Configuration (0x2902)
> HCI Event: Number of Completed Packets (0x13) plen 5                                                              #144 9.901890
        Num handles: 1
        Handle: 417 Address: C0:07:E8:2C:B6:EE (OUI C0-07-E8)
        Count: 1
        Buffers: 0/3
        #143: len 10 (0 Kb/s)
        Latency: 148 msec (67-148 msec ~145 msec)
> ACL Data RX: Handle 417 flags 0x02 dlen 9                                                                         #145 9.902260
      ATT: Find Information Request (0x04) len 4
        Handle range: 0x002d-0x002d
zephyr.exe[1635041]: < HCI Command: Host Number of Completed Packets (0x03|0x0035) plen 5                           #146 9.913684
        Num handles: 1
        Handle: 417 Address: C0:07:E8:2C:B6:EE (OUI C0-07-E8)
        Count: 1
zephyr.exe[1635041]: < ACL Data TX: Handle 417 [1/3] flags 0x00 dlen 10                                             #147 9.914242
      ATT: Find Information Response (0x05) len 5
        Format: UUID-16 (0x01)
        Handle: 0x002d
        UUID: Client Characteristic Configuration (0x2902)
> HCI Event: Number of Completed Packets (0x13) plen 5                                                             #148 10.061912
        Num handles: 1
        Handle: 417 Address: C0:07:E8:2C:B6:EE (OUI C0-07-E8)
        Count: 1
        Buffers: 0/3
        #147: len 10 (0 Kb/s)
        Latency: 147 msec (67-148 msec ~146 msec)
> ACL Data RX: Handle 417 flags 0x02 dlen 9                                                                        #149 10.062190
      ATT: Find Information Request (0x04) len 4
        Handle range: 0x0030-0x0030
zephyr.exe[1635041]: < HCI Command: Host Number of Completed Packets (0x03|0x0035) plen 5                          #150 10.073690
        Num handles: 1
        Handle: 417 Address: C0:07:E8:2C:B6:EE (OUI C0-07-E8)
        Count: 1
zephyr.exe[1635041]: < ACL Data TX: Handle 417 [1/3] flags 0x00 dlen 10                                            #151 10.074222
      ATT: Find Information Response (0x05) len 5
        Format: UUID-16 (0x01)
        Handle: 0x0030
        UUID: Client Characteristic Configuration (0x2902)
> HCI Event: Number of Completed Packets (0x13) plen 5                                                             #152 10.221915
        Num handles: 1
        Handle: 417 Address: C0:07:E8:2C:B6:EE (OUI C0-07-E8)
        Count: 1
        Buffers: 0/3
        #151: len 10 (0 Kb/s)
        Latency: 147 msec (67-148 msec ~147 msec)
> ACL Data RX: Handle 417 flags 0x02 dlen 9                                                                        #153 10.222320
      ATT: Find Information Request (0x04) len 4
        Handle range: 0x0033-0x0033
zephyr.exe[1635041]: < HCI Command: Host Number of Completed Packets (0x03|0x0035) plen 5                          #154 10.233593
        Num handles: 1
        Handle: 417 Address: C0:07:E8:2C:B6:EE (OUI C0-07-E8)
        Count: 1
zephyr.exe[1635041]: < ACL Data TX: Handle 417 [1/3] flags 0x00 dlen 10                                            #155 10.234091
      ATT: Find Information Response (0x05) len 5
        Format: UUID-16 (0x01)
        Handle: 0x0033
        UUID: Client Characteristic Configuration (0x2902)
> HCI Event: Number of Completed Packets (0x13) plen 5                                                             #156 10.381953
        Num handles: 1
        Handle: 417 Address: C0:07:E8:2C:B6:EE (OUI C0-07-E8)
        Count: 1
        Buffers: 0/3
        #155: len 10 (0 Kb/s)
        Latency: 147 msec (67-148 msec ~147 msec)
> ACL Data RX: Handle 417 flags 0x02 dlen 9                                                                        #157 10.382322
      ATT: Find Information Request (0x04) len 4
        Handle range: 0x0036-0x0036
zephyr.exe[1635041]: < HCI Command: Host Number of Completed Packets (0x03|0x0035) plen 5                          #158 10.393601
        Num handles: 1
        Handle: 417 Address: C0:07:E8:2C:B6:EE (OUI C0-07-E8)
        Count: 1
zephyr.exe[1635041]: < ACL Data TX: Handle 417 [1/3] flags 0x00 dlen 10                                            #159 10.394043
      ATT: Find Information Response (0x05) len 5
        Format: UUID-16 (0x01)
        Handle: 0x0036
        UUID: Client Characteristic Configuration (0x2902)
> HCI Event: Number of Completed Packets (0x13) plen 5                                                             #160 10.541875
        Num handles: 1
        Handle: 417 Address: C0:07:E8:2C:B6:EE (OUI C0-07-E8)
        Count: 1
        Buffers: 0/3
        #159: len 10 (0 Kb/s)
        Latency: 147 msec (67-148 msec ~147 msec)
> ACL Data RX: Handle 417 flags 0x02 dlen 13                                                                       #161 10.542113
      ATT: Find By Type Value Request (0x06) len 8
        Handle range: 0x0001-0xffff
        Attribute type: Primary Service (0x2800)
          UUID: Audio Stream Control (0x184e)
zephyr.exe[1635041]: < HCI Command: Host Number of Completed Packets (0x03|0x0035) plen 5                          #162 10.553608
        Num handles: 1
        Handle: 417 Address: C0:07:E8:2C:B6:EE (OUI C0-07-E8)
        Count: 1
zephyr.exe[1635041]: < ACL Data TX: Handle 417 [1/3] flags 0x00 dlen 9                                             #163 10.554182
      ATT: Find By Type Value Response (0x07) len 4
        Handle range: 0x0037-0x0046
> HCI Event: Number of Completed Packets (0x13) plen 5                                                             #164 10.701942
        Num handles: 1
        Handle: 417 Address: C0:07:E8:2C:B6:EE (OUI C0-07-E8)
        Count: 1
        Buffers: 0/3
        #163: len 9 (0 Kb/s)
        Latency: 147 msec (67-148 msec ~147 msec)
> ACL Data RX: Handle 417 flags 0x02 dlen 13                                                                       #165 10.702272
      ATT: Find By Type Value Request (0x06) len 8
        Handle range: 0x0047-0xffff
        Attribute type: Primary Service (0x2800)
          UUID: Audio Stream Control (0x184e)
zephyr.exe[1635041]: < HCI Command: Host Number of Completed Packets (0x03|0x0035) plen 5                          #166 10.713638
        Num handles: 1
        Handle: 417 Address: C0:07:E8:2C:B6:EE (OUI C0-07-E8)
        Count: 1
zephyr.exe[1635041]: < ACL Data TX: Handle 417 [1/3] flags 0x00 dlen 9                                             #167 10.714172
      ATT: Error Response (0x01) len 4
        Find By Type Value Request (0x06)
        Handle: 0x0047
        Error: Attribute Not Found (0x0a)
> HCI Event: Number of Completed Packets (0x13) plen 5                                                             #168 10.861857
        Num handles: 1
        Handle: 417 Address: C0:07:E8:2C:B6:EE (OUI C0-07-E8)
        Count: 1
        Buffers: 0/3
        #167: len 9 (0 Kb/s)
        Latency: 147 msec (67-148 msec ~147 msec)
> ACL Data RX: Handle 417 flags 0x02 dlen 11                                                                       #169 10.862390
      ATT: Read By Type Request (0x08) len 6
        Handle range: 0x0037-0x0046
        Attribute type: Characteristic (0x2803)
zephyr.exe[1635041]: < HCI Command: Host Number of Completed Packets (0x03|0x0035) plen 5                          #170 10.873606
        Num handles: 1
        Handle: 417 Address: C0:07:E8:2C:B6:EE (OUI C0-07-E8)
        Count: 1
zephyr.exe[1635041]: < ACL Data TX: Handle 417 [1/3] flags 0x00 dlen 27                                            #171 10.874203
zephyr.exe[1635041]: < ACL Data TX: Handle 417 flags 0x01 dlen 14                                                  #172 10.874381
      ATT: Read By Type Response (0x09) len 36
        Attribute data length: 7
        Attribute data list: 5 entries
        Handle: 0x0038
        Value[5]: 1c3900c62b
            Properties: 0x1c
              Write Without Response (0x04)
              Write (0x08)
              Notify (0x10)
            Value Handle: 0x0039
            Value UUID: ASE Control Point (0x2bc6)
        Handle: 0x003b
        Value[5]: 123c00c42b
            Properties: 0x12
              Read (0x02)
              Notify (0x10)
            Value Handle: 0x003c
            Value UUID: Sink ASE (0x2bc4)
        Handle: 0x003e
        Value[5]: 123f00c42b
            Properties: 0x12
              Read (0x02)
              Notify (0x10)
            Value Handle: 0x003f
            Value UUID: Sink ASE (0x2bc4)
        Handle: 0x0041
        Value[5]: 124200c52b
            Properties: 0x12
              Read (0x02)
              Notify (0x10)
            Value Handle: 0x0042
            Value UUID: Source ASE (0x2bc5)
        Handle: 0x0044
        Value[5]: 124500c52b
            Properties: 0x12
              Read (0x02)
              Notify (0x10)
            Value Handle: 0x0045
            Value UUID: Source ASE (0x2bc5)
> HCI Event: Number of Completed Packets (0x13) plen 5                                                             #173 10.942258
        Num handles: 1
        Handle: 417 Address: C0:07:E8:2C:B6:EE (OUI C0-07-E8)
        Count: 1
        Buffers: 0/3
        #171: len 27 (3 Kb/s)
        Latency: 68 msec (67-148 msec ~107 msec)
> HCI Event: Number of Completed Packets (0x13) plen 5                                                             #174 11.021916
        Num handles: 1
        Handle: 417 Address: C0:07:E8:2C:B6:EE (OUI C0-07-E8)
        Count: 1
        Buffers: underflow/3
        #172: len 14 (0 Kb/s)
        Latency: 147 msec (67-148 msec ~127 msec)
> ACL Data RX: Handle 417 flags 0x02 dlen 11                                                                       #175 11.022222
      ATT: Read By Type Request (0x08) len 6
        Handle range: 0x0045-0x0046
        Attribute type: Characteristic (0x2803)
zephyr.exe[1635041]: < HCI Command: Host Number of Completed Packets (0x03|0x0035) plen 5                          #176 11.033609
        Num handles: 1
        Handle: 417 Address: C0:07:E8:2C:B6:EE (OUI C0-07-E8)
        Count: 1
zephyr.exe[1635041]: < ACL Data TX: Handle 417 [1/3] flags 0x00 dlen 9                                             #177 11.033771
      ATT: Error Response (0x01) len 4
        Read By Type Request (0x08)
        Handle: 0x0045
        Error: Attribute Not Found (0x0a)
> HCI Event: Number of Completed Packets (0x13) plen 5                                                             #178 11.261852
        Num handles: 1
        Handle: 417 Address: C0:07:E8:2C:B6:EE (OUI C0-07-E8)
        Count: 1
        Buffers: 0/3
        #177: len 9 (0 Kb/s)
        Latency: 228 msec (67-228 msec ~177 msec)
> ACL Data RX: Handle 417 flags 0x02 dlen 9                                                                        #179 11.262106
      ATT: Find Information Request (0x04) len 4
        Handle range: 0x003a-0x003a
zephyr.exe[1635041]: < HCI Command: Host Number of Completed Packets (0x03|0x0035) plen 5                          #180 11.273565
        Num handles: 1
        Handle: 417 Address: C0:07:E8:2C:B6:EE (OUI C0-07-E8)
        Count: 1
zephyr.exe[1635041]: < ACL Data TX: Handle 417 [1/3] flags 0x00 dlen 10                                            #181 11.274005
      ATT: Find Information Response (0x05) len 5
        Format: UUID-16 (0x01)
        Handle: 0x003a
        UUID: Client Characteristic Configuration (0x2902)
> HCI Event: Number of Completed Packets (0x13) plen 5                                                             #182 11.421937
        Num handles: 1
        Handle: 417 Address: C0:07:E8:2C:B6:EE (OUI C0-07-E8)
        Count: 1
        Buffers: 0/3
        #181: len 10 (0 Kb/s)
        Latency: 147 msec (67-228 msec ~162 msec)
> ACL Data RX: Handle 417 flags 0x02 dlen 9                                                                        #183 11.422217
      ATT: Find Information Request (0x04) len 4
        Handle range: 0x003d-0x003d
zephyr.exe[1635041]: < HCI Command: Host Number of Completed Packets (0x03|0x0035) plen 5                          #184 11.433692
        Num handles: 1
        Handle: 417 Address: C0:07:E8:2C:B6:EE (OUI C0-07-E8)
        Count: 1
zephyr.exe[1635041]: < ACL Data TX: Handle 417 [1/3] flags 0x00 dlen 10                                            #185 11.434171
      ATT: Find Information Response (0x05) len 5
        Format: UUID-16 (0x01)
        Handle: 0x003d
        UUID: Client Characteristic Configuration (0x2902)
> HCI Event: Number of Completed Packets (0x13) plen 5                                                             #186 11.581881
        Num handles: 1
        Handle: 417 Address: C0:07:E8:2C:B6:EE (OUI C0-07-E8)
        Count: 1
        Buffers: 0/3
        #185: len 10 (0 Kb/s)
        Latency: 147 msec (67-228 msec ~155 msec)
> ACL Data RX: Handle 417 flags 0x02 dlen 9                                                                        #187 11.582108
      ATT: Find Information Request (0x04) len 4
        Handle range: 0x0040-0x0040
zephyr.exe[1635041]: < HCI Command: Host Number of Completed Packets (0x03|0x0035) plen 5                          #188 11.593706
        Num handles: 1
        Handle: 417 Address: C0:07:E8:2C:B6:EE (OUI C0-07-E8)
        Count: 1
zephyr.exe[1635041]: < ACL Data TX: Handle 417 [1/3] flags 0x00 dlen 10                                            #189 11.593922
      ATT: Find Information Response (0x05) len 5
        Format: UUID-16 (0x01)
        Handle: 0x0040
        UUID: Client Characteristic Configuration (0x2902)
> HCI Event: Number of Completed Packets (0x13) plen 5                                                             #190 11.741924
        Num handles: 1
        Handle: 417 Address: C0:07:E8:2C:B6:EE (OUI C0-07-E8)
        Count: 1
        Buffers: 0/3
        #189: len 10 (0 Kb/s)
        Latency: 148 msec (67-228 msec ~151 msec)
> ACL Data RX: Handle 417 flags 0x02 dlen 9                                                                        #191 11.742287
      ATT: Find Information Request (0x04) len 4
        Handle range: 0x0043-0x0043
zephyr.exe[1635041]: < HCI Command: Host Number of Completed Packets (0x03|0x0035) plen 5                          #192 11.753615
        Num handles: 1
        Handle: 417 Address: C0:07:E8:2C:B6:EE (OUI C0-07-E8)
        Count: 1
zephyr.exe[1635041]: < ACL Data TX: Handle 417 [1/3] flags 0x00 dlen 10                                            #193 11.754225
      ATT: Find Information Response (0x05) len 5
        Format: UUID-16 (0x01)
        Handle: 0x0043
        UUID: Client Characteristic Configuration (0x2902)
> HCI Event: Number of Completed Packets (0x13) plen 5                                                             #194 11.981920
        Num handles: 1
        Handle: 417 Address: C0:07:E8:2C:B6:EE (OUI C0-07-E8)
        Count: 1
        Buffers: 0/3
        #193: len 10 (0 Kb/s)
        Latency: 227 msec (67-228 msec ~189 msec)
> ACL Data RX: Handle 417 flags 0x02 dlen 9                                                                        #195 11.982262
      ATT: Find Information Request (0x04) len 4
        Handle range: 0x0046-0x0046
zephyr.exe[1635041]: < HCI Command: Host Number of Completed Packets (0x03|0x0035) plen 5                          #196 11.993659
        Num handles: 1
        Handle: 417 Address: C0:07:E8:2C:B6:EE (OUI C0-07-E8)
        Count: 1
zephyr.exe[1635041]: < ACL Data TX: Handle 417 [1/3] flags 0x00 dlen 10                                            #197 11.994677
      ATT: Find Information Response (0x05) len 5
        Format: UUID-16 (0x01)
        Handle: 0x0046
        UUID: Client Characteristic Configuration (0x2902)
> HCI Event: Number of Completed Packets (0x13) plen 5                                                             #198 12.141921
        Num handles: 1
        Handle: 417 Address: C0:07:E8:2C:B6:EE (OUI C0-07-E8)
        Count: 1
        Buffers: 0/3
        #197: len 10 (0 Kb/s)
        Latency: 147 msec (67-228 msec ~168 msec)
> ACL Data RX: Handle 417 flags 0x02 dlen 9                                                                        #199 12.142252
      ATT: Write Request (0x12) len 4
        Handle: 0x0033
          Data[2]: 0000
zephyr.exe[1635041]: < HCI Command: Host Number of Completed Packets (0x03|0x0035) plen 5                          #200 12.154527
        Num handles: 1
        Handle: 417 Address: C0:07:E8:2C:B6:EE (OUI C0-07-E8)
        Count: 1
zephyr.exe[1635041]: < ACL Data TX: Handle 417 [1/3] flags 0x00 dlen 5                                             #201 12.155687
      ATT: Write Response (0x13) len 0
> HCI Event: Number of Completed Packets (0x13) plen 5                                                             #202 12.301839
        Num handles: 1
        Handle: 417 Address: C0:07:E8:2C:B6:EE (OUI C0-07-E8)
        Count: 1
        Buffers: 0/3
        #201: len 5 (0 Kb/s)
        Latency: 146 msec (67-228 msec ~157 msec)
> ACL Data RX: Handle 417 flags 0x02 dlen 9                                                                        #203 12.305086
      ATT: Write Request (0x12) len 4
        Handle: 0x0033
          Data[2]: 0100
zephyr.exe[1635041]: < HCI Command: Host Number of Completed Packets (0x03|0x0035) plen 5                          #204 12.317171
        Num handles: 1
        Handle: 417 Address: C0:07:E8:2C:B6:EE (OUI C0-07-E8)
        Count: 1
zephyr.exe[1635041]: < ACL Data TX: Handle 417 [1/3] flags 0x00 dlen 5                                             #205 12.318372
      ATT: Write Response (0x13) len 0
> HCI Event: Number of Completed Packets (0x13) plen 5                                                             #206 12.461900
        Num handles: 1
        Handle: 417 Address: C0:07:E8:2C:B6:EE (OUI C0-07-E8)
        Count: 1
        Buffers: 0/3
        #205: len 5 (0 Kb/s)
        Latency: 143 msec (67-228 msec ~150 msec)
> ACL Data RX: Handle 417 flags 0x02 dlen 9                                                                        #207 12.462194
      ATT: Write Request (0x12) len 4
        Handle: 0x003a
          Data[2]: 0000
zephyr.exe[1635041]: < HCI Command: Host Number of Completed Packets (0x03|0x0035) plen 5                          #208 12.473445
        Num handles: 1
        Handle: 417 Address: C0:07:E8:2C:B6:EE (OUI C0-07-E8)
        Count: 1
zephyr.exe[1635041]: < ACL Data TX: Handle 417 [1/3] flags 0x00 dlen 5                                             #209 12.474952
      ATT: Write Response (0x13) len 0
> HCI Event: Number of Completed Packets (0x13) plen 5                                                             #210 12.621890
        Num handles: 1
        Handle: 417 Address: C0:07:E8:2C:B6:EE (OUI C0-07-E8)
        Count: 1
        Buffers: 0/3
        #209: len 5 (0 Kb/s)
        Latency: 146 msec (67-228 msec ~148 msec)
> ACL Data RX: Handle 417 flags 0x02 dlen 9                                                                        #211 12.622095
      ATT: Write Request (0x12) len 4
        Handle: 0x003a
          Data[2]: 0100
zephyr.exe[1635041]: < HCI Command: Host Number of Completed Packets (0x03|0x0035) plen 5                          #212 12.634194
        Num handles: 1
        Handle: 417 Address: C0:07:E8:2C:B6:EE (OUI C0-07-E8)
        Count: 1
zephyr.exe[1635041]: < ACL Data TX: Handle 417 [1/3] flags 0x00 dlen 5                                             #213 12.638123
      ATT: Write Response (0x13) len 0
> HCI Event: Number of Completed Packets (0x13) plen 5                                                             #214 12.781886
        Num handles: 1
        Handle: 417 Address: C0:07:E8:2C:B6:EE (OUI C0-07-E8)
        Count: 1
        Buffers: 0/3
        #213: len 5 (0 Kb/s)
        Latency: 143 msec (67-228 msec ~146 msec)
> ACL Data RX: Handle 417 flags 0x02 dlen 9                                                                        #215 12.782141
      ATT: Write Request (0x12) len 4
        Handle: 0x003d
          Data[2]: 0000
zephyr.exe[1635041]: < HCI Command: Host Number of Completed Packets (0x03|0x0035) plen 5                          #216 12.795184
        Num handles: 1
        Handle: 417 Address: C0:07:E8:2C:B6:EE (OUI C0-07-E8)
        Count: 1
zephyr.exe[1635041]: < ACL Data TX: Handle 417 [1/3] flags 0x00 dlen 5                                             #217 12.797150
      ATT: Write Response (0x13) len 0
> HCI Event: Number of Completed Packets (0x13) plen 5                                                             #218 13.021946
        Num handles: 1
        Handle: 417 Address: C0:07:E8:2C:B6:EE (OUI C0-07-E8)
        Count: 1
        Buffers: 0/3
        #217: len 5 (0 Kb/s)
        Latency: 224 msec (67-228 msec ~185 msec)
> ACL Data RX: Handle 417 flags 0x02 dlen 9                                                                        #219 13.022195
      ATT: Write Request (0x12) len 4
        Handle: 0x003d
          Data[2]: 0100
zephyr.exe[1635041]: < HCI Command: Host Number of Completed Packets (0x03|0x0035) plen 5                          #220 13.033895
        Num handles: 1
        Handle: 417 Address: C0:07:E8:2C:B6:EE (OUI C0-07-E8)
        Count: 1
zephyr.exe[1635041]: < ACL Data TX: Handle 417 [1/3] flags 0x00 dlen 5                                             #221 13.034759
      ATT: Write Response (0x13) len 0
> HCI Event: Number of Completed Packets (0x13) plen 5                                                             #222 13.181906
        Num handles: 1
        Handle: 417 Address: C0:07:E8:2C:B6:EE (OUI C0-07-E8)
        Count: 1
        Buffers: 0/3
        #221: len 5 (0 Kb/s)
        Latency: 147 msec (67-228 msec ~166 msec)
> ACL Data RX: Handle 417 flags 0x02 dlen 9                                                                        #223 13.182341
      ATT: Write Request (0x12) len 4
        Handle: 0x0040
          Data[2]: 0000
zephyr.exe[1635041]: < HCI Command: Host Number of Completed Packets (0x03|0x0035) plen 5                          #224 13.196263
        Num handles: 1
        Handle: 417 Address: C0:07:E8:2C:B6:EE (OUI C0-07-E8)
        Count: 1
zephyr.exe[1635041]: < ACL Data TX: Handle 417 [1/3] flags 0x00 dlen 5                                             #225 13.197188
      ATT: Write Response (0x13) len 0
> HCI Event: Number of Completed Packets (0x13) plen 5                                                             #226 13.341907
        Num handles: 1
        Handle: 417 Address: C0:07:E8:2C:B6:EE (OUI C0-07-E8)
        Count: 1
        Buffers: 0/3
        #225: len 5 (0 Kb/s)
        Latency: 144 msec (67-228 msec ~155 msec)
> ACL Data RX: Handle 417 flags 0x02 dlen 9                                                                        #227 13.342275
      ATT: Write Request (0x12) len 4
        Handle: 0x0040
          Data[2]: 0100
zephyr.exe[1635041]: < HCI Command: Host Number of Completed Packets (0x03|0x0035) plen 5                          #228 13.355151
        Num handles: 1
        Handle: 417 Address: C0:07:E8:2C:B6:EE (OUI C0-07-E8)
        Count: 1
zephyr.exe[1635041]: < ACL Data TX: Handle 417 [1/3] flags 0x00 dlen 5                                             #229 13.355655
      ATT: Write Response (0x13) len 0
> HCI Event: Number of Completed Packets (0x13) plen 5                                                             #230 13.501949
        Num handles: 1
        Handle: 417 Address: C0:07:E8:2C:B6:EE (OUI C0-07-E8)
        Count: 1
        Buffers: 0/3
        #229: len 5 (0 Kb/s)
        Latency: 146 msec (67-228 msec ~150 msec)
> ACL Data RX: Handle 417 flags 0x02 dlen 9                                                                        #231 13.502235
      ATT: Write Request (0x12) len 4
        Handle: 0x0043
          Data[2]: 0000
zephyr.exe[1635041]: < HCI Command: Host Number of Completed Packets (0x03|0x0035) plen 5                          #232 13.515041
        Num handles: 1
        Handle: 417 Address: C0:07:E8:2C:B6:EE (OUI C0-07-E8)
        Count: 1
zephyr.exe[1635041]: < ACL Data TX: Handle 417 [1/3] flags 0x00 dlen 5                                             #233 13.516328
      ATT: Write Response (0x13) len 0
> HCI Event: Number of Completed Packets (0x13) plen 5                                                             #234 13.661973
        Num handles: 1
        Handle: 417 Address: C0:07:E8:2C:B6:EE (OUI C0-07-E8)
        Count: 1
        Buffers: 0/3
        #233: len 5 (0 Kb/s)
        Latency: 145 msec (67-228 msec ~148 msec)
> ACL Data RX: Handle 417 flags 0x02 dlen 9                                                                        #235 13.662221
      ATT: Write Request (0x12) len 4
        Handle: 0x0043
          Data[2]: 0100
zephyr.exe[1635041]: < HCI Command: Host Number of Completed Packets (0x03|0x0035) plen 5                          #236 13.675010
        Num handles: 1
        Handle: 417 Address: C0:07:E8:2C:B6:EE (OUI C0-07-E8)
        Count: 1
zephyr.exe[1635041]: < ACL Data TX: Handle 417 [1/3] flags 0x00 dlen 5                                             #237 13.675817
      ATT: Write Response (0x13) len 0
> HCI Event: Number of Completed Packets (0x13) plen 5                                                             #238 13.821901
        Num handles: 1
        Handle: 417 Address: C0:07:E8:2C:B6:EE (OUI C0-07-E8)
        Count: 1
        Buffers: 0/3
        #237: len 5 (0 Kb/s)
        Latency: 146 msec (67-228 msec ~147 msec)
> ACL Data RX: Handle 417 flags 0x02 dlen 9                                                                        #239 13.822160
      ATT: Write Request (0x12) len 4
        Handle: 0x0046
          Data[2]: 0000
zephyr.exe[1635041]: < HCI Command: Host Number of Completed Packets (0x03|0x0035) plen 5                          #240 13.834434
        Num handles: 1
        Handle: 417 Address: C0:07:E8:2C:B6:EE (OUI C0-07-E8)
        Count: 1
zephyr.exe[1635041]: < ACL Data TX: Handle 417 [1/3] flags 0x00 dlen 5                                             #241 13.834695
      ATT: Write Response (0x13) len 0
> HCI Event: Number of Completed Packets (0x13) plen 5                                                             #242 14.061879
        Num handles: 1
        Handle: 417 Address: C0:07:E8:2C:B6:EE (OUI C0-07-E8)
        Count: 1
        Buffers: 0/3
        #241: len 5 (0 Kb/s)
        Latency: 227 msec (67-228 msec ~187 msec)
> ACL Data RX: Handle 417 flags 0x02 dlen 9                                                                        #243 14.062131
      ATT: Write Request (0x12) len 4
        Handle: 0x0046
          Data[2]: 0100
zephyr.exe[1635041]: < HCI Command: Host Number of Completed Packets (0x03|0x0035) plen 5                          #244 14.075985
        Num handles: 1
        Handle: 417 Address: C0:07:E8:2C:B6:EE (OUI C0-07-E8)
        Count: 1
zephyr.exe[1635041]: < ACL Data TX: Handle 417 [1/3] flags 0x00 dlen 5                                             #245 14.076628
      ATT: Write Response (0x13) len 0
> HCI Event: Number of Completed Packets (0x13) plen 5                                                             #246 14.221922
        Num handles: 1
        Handle: 417 Address: C0:07:E8:2C:B6:EE (OUI C0-07-E8)
        Count: 1
        Buffers: 0/3
        #245: len 5 (0 Kb/s)
        Latency: 145 msec (67-228 msec ~166 msec)
> ACL Data RX: Handle 417 flags 0x02 dlen 7                                                                        #247 14.222051
      ATT: Read Request (0x0a) len 2
        Handle: 0x003c
zephyr.exe[1635041]: < HCI Command: Host Number of Completed Packets (0x03|0x0035) plen 5                          #248 14.233471
        Num handles: 1
        Handle: 417 Address: C0:07:E8:2C:B6:EE (OUI C0-07-E8)
        Count: 1
zephyr.exe[1635041]: < ACL Data TX: Handle 417 [1/3] flags 0x00 dlen 7                                             #249 14.234708
      ATT: Read Response (0x0b) len 2
        Value[2]: 0100
> HCI Event: Number of Completed Packets (0x13) plen 5                                                             #250 14.381902
        Num handles: 1
        Handle: 417 Address: C0:07:E8:2C:B6:EE (OUI C0-07-E8)
        Count: 1
        Buffers: 0/3
        #249: len 7 (0 Kb/s)
        Latency: 147 msec (67-228 msec ~156 msec)
> ACL Data RX: Handle 417 flags 0x02 dlen 7                                                                        #251 14.382164
      ATT: Read Request (0x0a) len 2
        Handle: 0x003f
zephyr.exe[1635041]: < HCI Command: Host Number of Completed Packets (0x03|0x0035) plen 5                          #252 14.393511
        Num handles: 1
        Handle: 417 Address: C0:07:E8:2C:B6:EE (OUI C0-07-E8)
        Count: 1
zephyr.exe[1635041]: < ACL Data TX: Handle 417 [1/3] flags 0x00 dlen 7                                             #253 14.394592
      ATT: Read Response (0x0b) len 2
        Value[2]: 0200
> HCI Event: Number of Completed Packets (0x13) plen 5                                                             #254 14.541880
        Num handles: 1
        Handle: 417 Address: C0:07:E8:2C:B6:EE (OUI C0-07-E8)
        Count: 1
        Buffers: 0/3
        #253: len 7 (0 Kb/s)
        Latency: 147 msec (67-228 msec ~152 msec)
> ACL Data RX: Handle 417 flags 0x02 dlen 7                                                                        #255 14.542030
      ATT: Read Request (0x0a) len 2
        Handle: 0x0042
zephyr.exe[1635041]: < HCI Command: Host Number of Completed Packets (0x03|0x0035) plen 5                          #256 14.553750
        Num handles: 1
        Handle: 417 Address: C0:07:E8:2C:B6:EE (OUI C0-07-E8)
        Count: 1
zephyr.exe[1635041]: < ACL Data TX: Handle 417 [1/3] flags 0x00 dlen 7                                             #257 14.554555
      ATT: Read Response (0x0b) len 2
        Value[2]: 0300
> HCI Event: Number of Completed Packets (0x13) plen 5                                                             #258 14.701860
        Num handles: 1
        Handle: 417 Address: C0:07:E8:2C:B6:EE (OUI C0-07-E8)
        Count: 1
        Buffers: 0/3
        #257: len 7 (0 Kb/s)
        Latency: 147 msec (67-228 msec ~149 msec)
> ACL Data RX: Handle 417 flags 0x02 dlen 7                                                                        #259 14.702236
      ATT: Read Request (0x0a) len 2
        Handle: 0x0045
zephyr.exe[1635041]: < HCI Command: Host Number of Completed Packets (0x03|0x0035) plen 5                          #260 14.713475
        Num handles: 1
        Handle: 417 Address: C0:07:E8:2C:B6:EE (OUI C0-07-E8)
        Count: 1
zephyr.exe[1635041]: < ACL Data TX: Handle 417 [1/3] flags 0x00 dlen 7                                             #261 14.714590
      ATT: Read Response (0x0b) len 2
        Value[2]: 0400
> HCI Event: Number of Completed Packets (0x13) plen 5                                                             #262 14.861920
        Num handles: 1
        Handle: 417 Address: C0:07:E8:2C:B6:EE (OUI C0-07-E8)
        Count: 1
        Buffers: 0/3
        #261: len 7 (0 Kb/s)
        Latency: 147 msec (67-228 msec ~148 msec)
> ACL Data RX: Handle 417 flags 0x02 dlen 7                                                                        #263 14.862208
      ATT: Read Request (0x0a) len 2
        Handle: 0x002f
zephyr.exe[1635041]: < HCI Command: Host Number of Completed Packets (0x03|0x0035) plen 5                          #264 14.875527
        Num handles: 1
        Handle: 417 Address: C0:07:E8:2C:B6:EE (OUI C0-07-E8)
        Count: 1
zephyr.exe[1635041]: < ACL Data TX: Handle 417 [1/3] flags 0x00 dlen 9                                             #265 14.876152
      ATT: Read Response (0x0b) len 4
        Value[4]: 03000000
> HCI Event: Number of Completed Packets (0x13) plen 5                                                             #266 15.021912
        Num handles: 1
        Handle: 417 Address: C0:07:E8:2C:B6:EE (OUI C0-07-E8)
        Count: 1
        Buffers: 0/3
        #265: len 9 (0 Kb/s)
        Latency: 145 msec (67-228 msec ~147 msec)
> ACL Data RX: Handle 417 flags 0x02 dlen 7                                                                        #267 15.022131
      ATT: Read Request (0x0a) len 2
        Handle: 0x002c
zephyr.exe[1635041]: < HCI Command: Host Number of Completed Packets (0x03|0x0035) plen 5                          #268 15.034915
        Num handles: 1
        Handle: 417 Address: C0:07:E8:2C:B6:EE (OUI C0-07-E8)
        Count: 1
zephyr.exe[1635041]: < ACL Data TX: Handle 417 [1/3] flags 0x00 dlen 27                                            #269 15.035674
zephyr.exe[1635041]: < ACL Data TX: Handle 417 flags 0x01 dlen 27                                                  #270 15.036557
zephyr.exe[1635041]: < ACL Data TX: Handle 417 flags 0x01 dlen 12                                                  #271 15.037204
      ATT: Read Response (0x0b) len 61
        Value[61]: 020600000000130301ff1f02020302030305041a009b00020501040301ff0fffffffffff130301ff1f02020302030305041a009b00020501040301ff0f
> HCI Event: Number of Completed Packets (0x13) plen 5                                                             #272 15.102263
        Num handles: 1
        Handle: 417 Address: C0:07:E8:2C:B6:EE (OUI C0-07-E8)
        Count: 1
        Buffers: 0/3
        #269: len 27 (3 Kb/s)
        Latency: 66 msec (66-228 msec ~106 msec)
> HCI Event: Number of Completed Packets (0x13) plen 5                                                             #273 15.102853
        Num handles: 1
        Handle: 417 Address: C0:07:E8:2C:B6:EE (OUI C0-07-E8)
        Count: 1
        Buffers: underflow/3
        #270: len 27 (3 Kb/s)
        Latency: 66 msec (66-228 msec ~86 msec)
> HCI Event: Number of Completed Packets (0x13) plen 5                                                             #274 15.181907
        Num handles: 1
        Handle: 417 Address: C0:07:E8:2C:B6:EE (OUI C0-07-E8)
        Count: 1
        Buffers: underflow/3
        #271: len 12 (0 Kb/s)
        Latency: 144 msec (66-228 msec ~115 msec)
> ACL Data RX: Handle 417 flags 0x02 dlen 7                                                                        #275 15.182175
      ATT: Read Request (0x0a) len 2
        Handle: 0x0032
zephyr.exe[1635041]: < HCI Command: Host Number of Completed Packets (0x03|0x0035) plen 5                          #276 15.195690
        Num handles: 1
        Handle: 417 Address: C0:07:E8:2C:B6:EE (OUI C0-07-E8)
        Count: 1
zephyr.exe[1635041]: < ACL Data TX: Handle 417 [1/3] flags 0x00 dlen 9                                             #277 15.195814
      ATT: Read Response (0x0b) len 4
        Value[4]: ff0fff0f
> HCI Event: Number of Completed Packets (0x13) plen 5                                                             #278 15.341928
        Num handles: 1
        Handle: 417 Address: C0:07:E8:2C:B6:EE (OUI C0-07-E8)
        Count: 1
        Buffers: 0/3
        #277: len 9 (0 Kb/s)
        Latency: 146 msec (66-228 msec ~130 msec)
> ACL Data RX: Handle 417 flags 0x02 dlen 7                                                                        #279 15.342153
      ATT: Read Request (0x0a) len 2
        Handle: 0x0035
zephyr.exe[1635041]: < HCI Command: Host Number of Completed Packets (0x03|0x0035) plen 5                          #280 15.353512
        Num handles: 1
        Handle: 417 Address: C0:07:E8:2C:B6:EE (OUI C0-07-E8)
        Count: 1
zephyr.exe[1635041]: < ACL Data TX: Handle 417 [1/3] flags 0x00 dlen 9                                             #281 15.354037
      ATT: Read Response (0x0b) len 4
        Value[4]: ff0fff0f
> HCI Event: Number of Completed Packets (0x13) plen 5                                                             #282 15.501930
        Num handles: 1
        Handle: 417 Address: C0:07:E8:2C:B6:EE (OUI C0-07-E8)
        Count: 1
        Buffers: 0/3
        #281: len 9 (0 Kb/s)
        Latency: 147 msec (66-228 msec ~139 msec)
> ACL Data RX: Handle 417 flags 0x02 dlen 7                                                                        #283 15.502226
      ATT: Read Request (0x0a) len 2
        Handle: 0x0042
zephyr.exe[1635041]: < HCI Command: Host Number of Completed Packets (0x03|0x0035) plen 5                          #284 15.513487
        Num handles: 1
        Handle: 417 Address: C0:07:E8:2C:B6:EE (OUI C0-07-E8)
        Count: 1
zephyr.exe[1635041]: < ACL Data TX: Handle 417 [1/3] flags 0x00 dlen 7                                             #285 15.514273
      ATT: Read Response (0x0b) len 2
        Value[2]: 0300
> HCI Event: Number of Completed Packets (0x13) plen 5                                                             #286 15.661979
        Num handles: 1
        Handle: 417 Address: C0:07:E8:2C:B6:EE (OUI C0-07-E8)
        Count: 1
        Buffers: 0/3
        #285: len 7 (0 Kb/s)
        Latency: 147 msec (66-228 msec ~143 msec)
> ACL Data RX: Handle 417 flags 0x02 dlen 27                                                                       #287 15.662442
> ACL Data RX: Handle 417 flags 0x01 dlen 7                                                                        #288 15.662443
      ATT: Write Command (0x52) len 29
        Handle: 0x0039
          Data[27]: 010103010206000000001002010502020105030100000003043c00
zephyr.exe[1635041]: < HCI Command: Host Number of Completed Packets (0x03|0x0035) plen 5                          #289 15.674478
        Num handles: 1
        Handle: 417 Address: C0:07:E8:2C:B6:EE (OUI C0-07-E8)
        Count: 1
zephyr.exe[1635041]: < HCI Command: Host Number of Completed Packets (0x03|0x0035) plen 5                          #290 15.675154
        Num handles: 1
        Handle: 417 Address: C0:07:E8:2C:B6:EE (OUI C0-07-E8)
        Count: 1
zephyr.exe[1635041]: < ACL Data TX: Handle 417 [1/3] flags 0x00 dlen 12                                            #291 15.675601
      ATT: Handle Value Notification (0x1b) len 7
        Handle: 0x0039
          Data[5]: 0101030000
zephyr.exe[1635041]: < ACL Data TX: Handle 417 [2/3] flags 0x00 dlen 27                                            #292 15.676011
zephyr.exe[1635041]: < ACL Data TX: Handle 417 flags 0x01 dlen 21                                                  #293 15.676294
      ATT: Handle Value Notification (0x1b) len 43
        Handle: 0x0042
          Data[41]: 03010002020a00102700409c00102700409c0006000000001002010502020105030100000003043c00
> HCI Event: Number of Completed Packets (0x13) plen 5                                                             #294 15.742253
        Num handles: 1
        Handle: 417 Address: C0:07:E8:2C:B6:EE (OUI C0-07-E8)
        Count: 1
        Buffers: 1/3
        #291: len 12 (1 Kb/s)
        Latency: 66 msec (66-228 msec ~105 msec)
> HCI Event: Number of Completed Packets (0x13) plen 5                                                             #295 15.742763
        Num handles: 1
        Handle: 417 Address: C0:07:E8:2C:B6:EE (OUI C0-07-E8)
        Count: 1
        Buffers: 0/3
        #292: len 27 (3 Kb/s)
        Latency: 66 msec (66-228 msec ~85 msec)
> HCI Event: Number of Completed Packets (0x13) plen 5                                                             #296 15.822001
        Num handles: 1
        Handle: 417 Address: C0:07:E8:2C:B6:EE (OUI C0-07-E8)
        Count: 1
        Buffers: underflow/3
        #293: len 21 (1 Kb/s)
        Latency: 145 msec (66-228 msec ~115 msec)
> ACL Data RX: Handle 417 flags 0x02 dlen 27                                                                       #297 15.822264
> ACL Data RX: Handle 417 flags 0x01 dlen 7                                                                        #298 15.822465
      ATT: Write Command (0x52) len 29
        Handle: 0x0039
          Data[27]: 010103010206000000001002010502020105030100000003043c00
zephyr.exe[1635041]: < HCI Command: Host Number of Completed Packets (0x03|0x0035) plen 5                          #299 15.833495
        Num handles: 1
        Handle: 417 Address: C0:07:E8:2C:B6:EE (OUI C0-07-E8)
        Count: 1
zephyr.exe[1635041]: < HCI Command: Host Number of Completed Packets (0x03|0x0035) plen 5                          #300 15.833611
        Num handles: 1
        Handle: 417 Address: C0:07:E8:2C:B6:EE (OUI C0-07-E8)
        Count: 1
zephyr.exe[1635041]: < ACL Data TX: Handle 417 [1/3] flags 0x00 dlen 12                                            #301 15.833929
      ATT: Handle Value Notification (0x1b) len 7
        Handle: 0x0039
          Data[5]: 0101030000
zephyr.exe[1635041]: < ACL Data TX: Handle 417 [2/3] flags 0x00 dlen 27                                            #302 15.834267
zephyr.exe[1635041]: < ACL Data TX: Handle 417 flags 0x01 dlen 21                                                  #303 15.834414
      ATT: Handle Value Notification (0x1b) len 43
        Handle: 0x0042
          Data[41]: 03010002020a00102700409c00102700409c0006000000001002010502020105030100000003043c00
> HCI Event: Number of Completed Packets (0x13) plen 5                                                             #304 15.902207
        Num handles: 1
        Handle: 417 Address: C0:07:E8:2C:B6:EE (OUI C0-07-E8)
        Count: 1
        Buffers: 1/3
        #301: len 12 (1 Kb/s)
        Latency: 68 msec (66-228 msec ~92 msec)
> HCI Event: Number of Completed Packets (0x13) plen 5                                                             #305 15.902787
        Num handles: 1
        Handle: 417 Address: C0:07:E8:2C:B6:EE (OUI C0-07-E8)
        Count: 1
        Buffers: 0/3
        #302: len 27 (3 Kb/s)
        Latency: 68 msec (66-228 msec ~80 msec)
> HCI Event: Number of Completed Packets (0x13) plen 5                                                             #306 15.981935
        Num handles: 1
        Handle: 417 Address: C0:07:E8:2C:B6:EE (OUI C0-07-E8)
        Count: 1
        Buffers: underflow/3
        #303: len 21 (1 Kb/s)
        Latency: 147 msec (66-228 msec ~113 msec)
> ACL Data RX: Handle 417 flags 0x02 dlen 25                                                                       #307 15.982584
      ATT: Write Command (0x52) len 20
        Handle: 0x0039
          Data[18]: 020103010110270000023c00020a00a86100
zephyr.exe[1635041]: < HCI Command: Host Number 