Bluetooth monitor ver 5.72
= Note: Linux version 6.14.0-36-generic (x86_64)                       0.795850
= Note: Bluetooth subsystem version 2.22                               0.795851
= New Index: 00:00:00:00:00:00 (Primary,UART,hci1)              [hci1] 0.795852
= New Index: 48:5F:99:8E:E0:64 (Primary,USB,hci0)               [hci0] 0.795853
= Open Index: 00:00:00:00:00:00                                 [hci1] 0.939443
= Index Info: 00:00:00:00:00:00 (Nordic Semiconductor ASA)      [hci1] 0.939454
@ USER Open: main (privileged) version 2.22            {0x0001} [hci1] 0.939462
< HCI Command: Reset (0x03|0x0003) plen 0                    #1 [hci1] 0.940299
> HCI Event: Command Complete (0x0e) plen 4                  #2 [hci1] 0.940917
      Reset (0x03|0x0003) ncmd 1
        Status: Success (0x00)
< HCI Command: Read Local Supported... (0x04|0x0003) plen 0  #3 [hci1] 0.959095
> HCI Event: Command Complete (0x0e) plen 12                 #4 [hci1] 0.959586
      Read Local Supported Features (0x04|0x0003) ncmd 1
        Status: Success (0x00)
        Features: 0x00 0x00 0x00 0x00 0x60 0x00 0x00 0x00
          BR/EDR Not Supported
          LE Supported (Controller)
< HCI Command: Read Local Version In.. (0x04|0x0001) plen 0  #5 [hci1] 0.979061
> HCI Event: Command Complete (0x0e) plen 12                 #6 [hci1] 0.979579
      Read Local Version Information (0x04|0x0001) ncmd 1
        Status: Success (0x00)
        HCI version: Reserved (0x11) - Revision 12345 (0x3039)
        LMP version: Reserved (0x11) - Subversion 12345 (0x3039)
        Manufacturer: Nordic Semiconductor ASA (89)
< HCI Command: Read Local Supported... (0x04|0x0002) plen 0  #7 [hci1] 0.999095
> HCI Event: Command Complete (0x0e) plen 68                 #8 [hci1] 1.000184
      Read Local Supported Commands (0x04|0x0002) ncmd 1
        Status: Success (0x00)
        Commands: 115 entries
          Disconnect (Octet 0 - Bit 5)
          Read Remote Version Information (Octet 2 - Bit 7)
          Set Event Mask (Octet 5 - Bit 6)
          Reset (Octet 5 - Bit 7)
          Read Connection Accept Timeout (Octet 7 - Bit 2)
          Write Connection Accept Timeout (Octet 7 - Bit 3)
          Read Transmit Power Level (Octet 10 - Bit 2)
          Set Controller To Host Flow Control (Octet 10 - Bit 5)
          Host Buffer Size (Octet 10 - Bit 6)
          Host Number of Completed Packets (Octet 10 - Bit 7)
          Read Local Version Information (Octet 14 - Bit 3)
          Read Local Supported Features (Octet 14 - Bit 5)
          Read BD ADDR (Octet 15 - Bit 1)
          Read RSSI (Octet 15 - Bit 5)
          Set Event Mask Page 2 (Octet 22 - Bit 2)
          LE Set Event Mask (Octet 25 - Bit 0)
          LE Read Buffer Size (Octet 25 - Bit 1)
          LE Read Local Supported Features (Octet 25 - Bit 2)
          LE Set Random Address (Octet 25 - Bit 4)
          LE Set Advertising Parameters (Octet 25 - Bit 5)
          LE Read Advertising Channel TX Power (Octet 25 - Bit 6)
          LE Set Advertising Data (Octet 25 - Bit 7)
          LE Set Scan Response Data (Octet 26 - Bit 0)
          LE Set Advertise Enable (Octet 26 - Bit 1)
          LE Set Scan Parameters (Octet 26 - Bit 2)
          LE Set Scan Enable (Octet 26 - Bit 3)
          LE Create Connection (Octet 26 - Bit 4)
          LE Create Connection Cancel (Octet 26 - Bit 5)
          LE Read Accept List Size (Octet 26 - Bit 6)
          LE Clear Accept List (Octet 26 - Bit 7)
          LE Add Device To Accept List (Octet 27 - Bit 0)
          LE Remove Device From Accept List (Octet 27 - Bit 1)
          LE Connection Update (Octet 27 - Bit 2)
          LE Set Host Channel Classification (Octet 27 - Bit 3)
          LE Read Channel Map (Octet 27 - Bit 4)
          LE Read Remote Used Features (Octet 27 - Bit 5)
          LE Encrypt (Octet 27 - Bit 6)
          LE Rand (Octet 27 - Bit 7)
          LE Start Encryption (Octet 28 - Bit 0)
          LE Long Term Key Request Reply (Octet 28 - Bit 1)
          LE Long Term Key Request Neg Reply (Octet 28 - Bit 2)
          LE Read Supported States (Octet 28 - Bit 3)
          Read Authenticated Payload Timeout (Octet 32 - Bit 4)
          Write Authenticated Payload Timeout (Octet 32 - Bit 5)
          LE Set Data Length (Octet 33 - Bit 6)
          LE Read Suggested Default Data Length (Octet 33 - Bit 7)
          LE Write Suggested Default Data Length (Octet 34 - Bit 0)
          LE Add Device To Resolving List (Octet 34 - Bit 3)
          LE Remove Device From Resolving List (Octet 34 - Bit 4)
          LE Clear Resolving List (Octet 34 - Bit 5)
          LE Read Resolving List Size (Octet 34 - Bit 6)
          LE Set Address Resolution Enable (Octet 35 - Bit 1)
          LE Set Resolvable Private Address Timeout (Octet 35 - Bit 2)
          LE Read Maximum Data Length (Octet 35 - Bit 3)
          LE Read PHY (Octet 35 - Bit 4)
          LE Set Default PHY (Octet 35 - Bit 5)
          LE Set PHY (Octet 35 - Bit 6)
          LE Set Advertising Set Random Address (Octet 36 - Bit 1)
          LE Set Extended Advertising Parameters (Octet 36 - Bit 2)
          LE Set Extended Advertising Data (Octet 36 - Bit 3)
          LE Set Extended Scan Response Data (Octet 36 - Bit 4)
          LE Set Extended Advertising Enable (Octet 36 - Bit 5)
          LE Read Maximum Advertising Data Length (Octet 36 - Bit 6)
          LE Read Number of Supported Advertising Sets (Octet 36 - Bit 7)
          LE Remove Advertising Set (Octet 37 - Bit 0)
          LE Clear Advertising Sets (Octet 37 - Bit 1)
          LE Set Periodic Advertising Parameters (Octet 37 - Bit 2)
          LE Set Periodic Advertising Data (Octet 37 - Bit 3)
          LE Set Periodic Advertising Enable (Octet 37 - Bit 4)
          LE Set Extended Scan Parameters (Octet 37 - Bit 5)
          LE Set Extended Scan Enable (Octet 37 - Bit 6)
          LE Extended Create Connection (Octet 37 - Bit 7)
          LE Periodic Advertising Create Sync (Octet 38 - Bit 0)
          LE Periodic Advertising Create Sync Cancel (Octet 38 - Bit 1)
          LE Periodic Advertising Terminate Sync (Octet 38 - Bit 2)
          LE Add Device To Periodic Advertiser List (Octet 38 - Bit 3)
          LE Remove Device From Periodic Advertiser List (Octet 38 - Bit 4)
          LE Clear Periodic Advertiser List (Octet 38 - Bit 5)
          LE Read Periodic Advertiser List Size (Octet 38 - Bit 6)
          LE Read Transmit Power (Octet 38 - Bit 7)
          LE Read RF Path Compensation (Octet 39 - Bit 0)
          LE Write RF Path Compensation (Octet 39 - Bit 1)
          LE Set Privacy Mode (Octet 39 - Bit 2)
          LE Periodic Advertising Receive Enable (Octet 40 - Bit 5)
          LE Periodic Advertising Sync Transfer (Octet 40 - Bit 6)
          LE Periodic Advertising Set Info Transfer (Octet 40 - Bit 7)
          LE Periodic Advertising Sync Transfer Parameters (Octet 41 - Bit 0)
          LE Set Default Periodic Advertisng Sync Transfer Parameters (Octet 41 - Bit 1)
          LE Read Buffer v2 (Octet 41 - Bit 5)
          LE Read ISO TX Sync (Octet 41 - Bit 6)
          LE Set Connected Isochronous Group Parameters (Octet 41 - Bit 7)
          LE Set Connected Isochronous Group Parameters Test (Octet 42 - Bit 0)
          LE Create Connected Isochronous Stream (Octet 42 - Bit 1)
          LE Remove Connected Isochronous Group (Octet 42 - Bit 2)
          LE Accept Connected Isochronous Stream Request (Octet 42 - Bit 3)
          LE Reject Connected Isochronous Stream Request (Octet 42 - Bit 4)
          LE Create Broadcast Isochronous Group (Octet 42 - Bit 5)
          LE Create Broadcast Isochronous Group Test (Octet 42 - Bit 6)
          LE Terminate Broadcast Isochronous Group (Octet 42 - Bit 7)
          LE Broadcast Isochronous Group Create Sync (Octet 43 - Bit 0)
          LE Broadcast Isochronous Group Terminate Sync (Octet 43 - Bit 1)
          LE Request Peer SCA (Octet 43 - Bit 2)
          LE Setup Isochronous Data Path (Octet 43 - Bit 3)
          LE Remove Isochronous Data Path (Octet 43 - Bit 4)
          LE Isochronous Transmit Test (Octet 43 - Bit 5)
          LE Isochronous Receive Test (Octet 43 - Bit 6)
          LE Isochronous Read Test Counters (Octet 43 - Bit 7)
          LE Isochronous Read Test Counters (Octet 44 - Bit 0)
          LE Set Host Feature (Octet 44 - Bit 1)
          Octet 44 - Bit 2 
          Octet 45 - Bit 6 
          Octet 46 - Bit 0 
          Octet 46 - Bit 1 
          Octet 46 - Bit 2 
          Octet 47 - Bit 4 
< HCI Command: Host Buffer Size (0x03|0x0033) plen 7         #9 [hci1] 1.019072
        ACL MTU: 255  ACL max packet: 16
        SCO MTU: 0    SCO max packet: 0
> HCI Event: Command Complete (0x0e) plen 4                 #10 [hci1] 1.019528
      Host Buffer Size (0x03|0x0033) ncmd 1
        Status: Success (0x00)
< HCI Command: Set Controller To Ho.. (0x03|0x0031) plen 1  #11 [hci1] 1.039059
        Flow control: ACL Data Packets (0x01)
> HCI Event: Command Complete (0x0e) plen 4                 #12 [hci1] 1.039505
      Set Controller To Host Flow Control (0x03|0x0031) ncmd 1
        Status: Success (0x00)
< HCI Command: LE Read Local Suppor.. (0x08|0x0003) plen 0  #13 [hci1] 1.059068
> HCI Event: Command Complete (0x0e) plen 12                #14 [hci1] 1.059555
      LE Read Local Supported Features (0x08|0x0003) ncmd 1
        Status: Success (0x00)
        Features: 0xfd 0x79 0x00 0xf7 0x30 0x01 0x00 0x00
          LE Encryption
          Extended Reject Indication
          Peripheral-initiated Features Exchange
          LE Ping
          LE Data Packet Length Extension
          LL Privacy
          Extended Scanner Filter Policies
          LE 2M PHY
          LE Coded PHY
          LE Extended Advertising
          LE Periodic Advertising
          Channel Selection Algorithm #2
          Periodic Advertising Sync Transfer - Sender
          Periodic Advertising Sync Transfer - Recipient
          Sleep Clock Accuracy Updates
          Connected Isochronous Stream - Central
          Connected Isochronous Stream - Peripheral
          Isochronous Broadcaster
          Synchronized Receiver
          Periodic Advertising ADI support
          Connection Subrating
          Unknown features (0x0000010000000000)
< HCI Command: LE Set Host Feature (0x08|0x0074) plen 2     #15 [hci1] 1.079071
        Bit Number: 32
          Connected Isochronous Stream (Host Support)
        Bit Value: 1
> HCI Event: Command Complete (0x0e) plen 4                 #16 [hci1] 1.079524
      LE Set Host Feature (0x08|0x0074) ncmd 1
        Status: Success (0x00)
< HCI Command: LE Read Buffer v2 (0x08|0x0060) plen 0       #17 [hci1] 1.099086
> HCI Event: Command Complete (0x0e) plen 10                #18 [hci1] 1.099558
      LE Read Buffer v2 (0x08|0x0060) ncmd 1
        Status: Success (0x00)
        ACL MTU: 27
        ACL max packet: 3
        ISO MTU: 318
        ISO max packet: 3
< HCI Command: LE Read Maximum Adve.. (0x08|0x003a) plen 0  #19 [hci1] 1.119032
> HCI Event: Command Complete (0x0e) plen 6                 #20 [hci1] 1.119438
      LE Read Maximum Advertising Data Length (0x08|0x003a) ncmd 1
        Status: Success (0x00)
        Max length: 1650
< HCI Command: LE Read Supported St.. (0x08|0x001c) plen 0  #21 [hci1] 1.139069
> HCI Event: Command Complete (0x0e) plen 12                #22 [hci1] 1.139506
      LE Read Supported States (0x08|0x001c) ncmd 1
        Status: Success (0x00)
        States: 0x000003ff3e0306ff
          Non-connectable Advertising State
          Scannable Advertising State
          Connectable Advertising State
          High Duty Cycle Directed Advertising State
          Passive Scanning State
          Active Scanning State
          Initiating State
            and Connection State (Central Role)
          Connection State (Peripheral Role)
          Scannable Advertising State
            and Passive Scanning State
          Connectable Advertising State
            and Passive Scanning State
          Non-connectable Advertising State
            and Initiating State
          Scannable Advertising State
            and Initiating State
          Active Scanning State
            and Connection State (Central Role)
          Passive Scanning State
            and Connection State (Peripheral Role)
          Active Scanning State
            and Connection State (Peripheral Role)
          Initiating State
            and Connection State (Central Role)
            and Central Role & Central Role
          Low Duty Cycle Directed Advertising State
          Connectable Advertising State
            and Initiating State
            and Central Role & Peripheral Role
          High Duty Cycle Directed Advertising State
            and Initiating State
            and Central Role & Peripheral Role
          Low Duty Cycle Directed Advertising State
            and Initiating State
            and Central Role & Peripheral Role
          Connectable Advertising State
            and Connection State (Central Role)
            and Central Role & Peripheral Role
          High Duty Cycle Directed Advertising State
            and Connection State (Central Role)
            and Central Role & Peripheral Role
          Low Duty Cycle Directed Advertising State
            and Connection State (Central Role)
            and Central Role & Peripheral Role
          Connectable Advertising State
            and Connection State (Peripheral Role)
            and Central Role & Peripheral Role
          High Duty Cycle Directed Advertising State
            and Connection State (Peripheral Role)
            and Peripheral Role & Peripheral Role
          Low Duty Cycle Directed Advertising State
            and Connection State (Peripheral Role)
            and Peripheral Role & Peripheral Role
          Initiating State
            and Connection State (Peripheral Role)
            and Central Role & Peripheral Role
< HCI Command: LE Read Maximum Data.. (0x08|0x002f) plen 0  #23 [hci1] 1.159038
> HCI Event: Command Complete (0x0e) plen 12                #24 [hci1] 1.159575
      LE Read Maximum Data Length (0x08|0x002f) ncmd 1
        Status: Success (0x00)
        Max TX octets: 251
        Max TX time: 2704
        Max RX octets: 251
        Max RX time: 2704
< HCI Command: LE Write Suggested D.. (0x08|0x0024) plen 4  #25 [hci1] 1.179076
        TX octets: 251
        TX time: 2704
> HCI Event: Command Complete (0x0e) plen 4                 #26 [hci1] 1.179575
      LE Write Suggested Default Data Length (0x08|0x0024) ncmd 1
        Status: Success (0x00)
< HCI Command: LE Read Resolving Li.. (0x08|0x002a) plen 0  #27 [hci1] 1.199075
> HCI Event: Command Complete (0x0e) plen 5                 #28 [hci1] 1.199546
      LE Read Resolving List Size (0x08|0x002a) ncmd 1
        Status: Success (0x00)
        Size: 8
< HCI Command: LE Set Host Feature (0x08|0x0074) plen 2     #29 [hci1] 1.219124
        Bit Number: 38
          Connection Subrating (Host Support)
        Bit Value: 1
> HCI Event: Command Complete (0x0e) plen 4                 #30 [hci1] 1.219523
      LE Set Host Feature (0x08|0x0074) ncmd 1
        Status: Success (0x00)
< HCI Command: LE Set Event Mask (0x08|0x0001) plen 8       #31 [hci1] 1.239067
        Mask: 0x000002063f87fa5e
          LE Advertising Report
          LE Connection Update Complete
          LE Read Remote Used Features Complete
          LE Long Term Key Request
          LE Data Length Change
          LE Enhanced Connection Complete
          LE PHY Update Complete
          LE Extended Advertising Report
          LE Periodic Advertising Sync Established
          LE Periodic Advertising Report
          LE Periodic Advertising Sync Lost
          LE Extended Scan Timeout
          LE Extended Advertising Set Terminated
          LE Scan Request Received
          LE Periodic Advertising Sync Transfer Rvc
          LE CIS Established
          LE CIS Request
          LE Create BIG Complete
          LE Terminate BIG Complete
          LE BIG Sync Estabilished Complete
          LE BIG Sync Lost
          LE BIG Info Advertising Report
          LE Subrate Change
          Unknown mask (0x0000020000000000)
> HCI Event: Command Complete (0x0e) plen 4                 #32 [hci1] 1.239543
      LE Set Event Mask (0x08|0x0001) ncmd 1
        Status: Success (0x00)
< HCI Command: Set Event Mask (0x03|0x0001) plen 8          #33 [hci1] 1.259072
        Mask: 0x2000800002008890
          Disconnection Complete
          Encryption Change
          Read Remote Version Information Complete
          Hardware Error
          Data Buffer Overflow
          Encryption Key Refresh Complete
          LE Meta
> HCI Event: Command Complete (0x0e) plen 4                 #34 [hci1] 1.259643
      Set Event Mask (0x03|0x0001) ncmd 1
        Status: Success (0x00)
< HCI Command: Read BD ADDR (0x04|0x0009) plen 0            #35 [hci1] 1.279059
> HCI Event: Command Complete (0x0e) plen 10                #36 [hci1] 1.279600
      Read BD ADDR (0x04|0x0009) ncmd 1
        Status: Success (0x00)
        Address: 00:00:00:00:00:00 (OUI 00-00-00)
< HCI Command: LE Set Random Address (0x08|0x0005) plen 6   #37 [hci1] 1.299044
        Address: D5:B6:CC:31:DB:3B (Static)
> HCI Event: Command Complete (0x0e) plen 4                 #38 [hci1] 1.299494
      LE Set Random Address (0x08|0x0005) ncmd 1
        Status: Success (0x00)
< HCI Command: LE Set Extended Adv.. (0x08|0x0036) plen 25  #39 [hci1] 2.599152
        Handle: 0x00
        Properties: 0x0001
          Connectable
        Min advertising interval: 100.000 msec (0x00a0)
        Max advertising interval: 150.000 msec (0x00f0)
        Channel map: 37, 38, 39 (0x07)
        Own address type: Random (0x01)
        Peer address type: Public (0x00)
        Peer address: 00:00:00:00:00:00 (OUI 00-00-00)
        Filter policy: Allow Scan Request from Any, Allow Connect Request from Any (0x00)
        TX power: Host has no preference (0x7f)
        Primary PHY: LE 1M (0x01)
        Secondary max skip: 0x00
        Secondary PHY: LE 2M (0x02)
        SID: 0x00
        Scan request notifications: Disabled (0x00)
> HCI Event: Command Complete (0x0e) plen 5                 #40 [hci1] 2.599923
      LE Set Extended Advertising Parameters (0x08|0x0036) ncmd 1
        Status: Success (0x00)
        TX power (selected): 0 dbm (0x00)
< HCI Command: LE Set Advertising S.. (0x08|0x0035) plen 7  #41 [hci1] 2.619090
        Advertising handle: 0x00
        Advertising random address: D5:B6:CC:31:DB:3B (Static)
> HCI Event: Command Complete (0x0e) plen 4                 #42 [hci1] 2.619619
      LE Set Advertising Set Random Address (0x08|0x0035) ncmd 1
        Status: Success (0x00)
< HCI Command: LE Set Extended Adv.. (0x08|0x0037) plen 30  #43 [hci1] 2.639059
        Handle: 0x00
        Operation: Complete extended advertising data (0x03)
        Fragment preference: Minimize fragmentation (0x01)
        Data length: 0x1a
        Flags: 0x06
          LE General Discoverable Mode
          BR/EDR Not Supported
        Service Data: Common Audio (0x1853)
          Data: 01
        Service Data: Audio Stream Control (0x184e)
          Data: 014400400000
        Resolvable Set Identifier: 48-61-8E-0C-80-97
          Hash: 0x c8097
          Random: 0x48618e
> HCI Event: Command Complete (0x0e) plen 4                 #44 [hci1] 2.639888
      LE Set Extended Advertising Data (0x08|0x0037) ncmd 1
        Status: Success (0x00)
< HCI Command: LE Set Extended Adve.. (0x08|0x0039) plen 6  #45 [hci1] 2.659087
        Extended advertising: Enabled (0x01)
        Number of sets: 1 (0x01)
        Entry 0
          Handle: 0x00
          Duration: 0 ms (0x00)
          Max ext adv events: 0
> HCI Event: Command Complete (0x0e) plen 4                 #46 [hci1] 2.659703
      LE Set Extended Advertising Enable (0x08|0x0039) ncmd 1
        Status: Success (0x00)
> HCI Event: LE Meta Event (0x3e) plen 31                   #47 [hci1] 4.578834
      LE Enhanced Connection Complete (0x0a)
        Status: Success (0x00)
        Handle: 3747
        Role: Peripheral (0x01)
        Peer address type: Public (0x00)
        Peer address: DF:A9:FF:F6:B1:1A (OUI DF-A9-FF)
        Local resolvable private address: 00:00:00:00:00:00 (Non-Resolvable)
        Peer resolvable private address: 00:00:00:00:00:00 (Non-Resolvable)
        Connection interval: 87.50 msec (0x0046)
        Connection latency: 0 (0x0000)
        Supervision timeout: 25120 msec (0x09d0)
        Central clock accuracy: 0x01
> HCI Event: LE Meta Event (0x3e) plen 6                    #48 [hci1] 4.578936
      LE Advertising Set Terminated (0x12)
        Status: Success (0x00)
        Handle: 0
        Connection handle: 3747
        Number of completed extended advertising events: 0
< HCI Command: LE Read Remote Used... (0x08|0x0016) plen 2  #49 [hci1] 4.579389
        Handle: 3747 Address: DF:A9:FF:F6:B1:1A (OUI DF-A9-FF)
< ACL Data TX: Handle 3747 flags 0x00 dlen 7                #50 [hci1] 4.579396
      ATT: Exchange MTU Request (0x02) len 2
        Client RX MTU: 251
> HCI Event: Command Status (0x0f) plen 4                   #51 [hci1] 4.579831
      LE Read Remote Used Features (0x08|0x0016) ncmd 1
        Status: Success (0x00)
> HCI Event: Number of Completed Packets (0x13) plen 5      #52 [hci1] 4.668392
        Num handles: 1
        Handle: 3747 Address: DF:A9:FF:F6:B1:1A (OUI DF-A9-FF)
        Count: 1
        #50: len 7 (0 Kb/s)
        Latency: 88 msec (88-88 msec ~88 msec)
> HCI Event: LE Meta Event (0x3e) plen 12                   #53 [hci1] 4.756174
      LE Read Remote Used Features (0x04)
        Status: Success (0x00)
        Handle: 3747 Address: DF:A9:FF:F6:B1:1A (OUI DF-A9-FF)
        Features: 0x2d 0x49 0x00 0xf7 0x67 0xd9 0x00 0x80
          LE Encryption
          Extended Reject Indication
          Peripheral-initiated Features Exchange
          LE Data Packet Length Extension
          LE 2M PHY
          LE Coded PHY
          Channel Selection Algorithm #2
          Periodic Advertising Sync Transfer - Sender
          Periodic Advertising Sync Transfer - Recipient
          Sleep Clock Accuracy Updates
          Connected Isochronous Stream - Central
          Connected Isochronous Stream - Peripheral
          Isochronous Broadcaster
          Synchronized Receiver
          Connected Isochronous Stream (Host Support)
          LE Power Control Request
          LE Power Control Request
          Connection Subrating
          Connection Subrating (Host Support)
          Unknown features (0x8000d90000000000)
< HCI Command: LE Remove Advertisin.. (0x08|0x003c) plen 1  #54 [hci1] 4.779478
        Handle: 0
> HCI Event: Command Complete (0x0e) plen 4                 #55 [hci1] 4.779919
      LE Remove Advertising Set (0x08|0x003c) ncmd 1
        Status: Success (0x00)
< HCI Command: LE Set Extended Adv.. (0x08|0x0036) plen 25  #56 [hci1] 4.799133
        Handle: 0x00
        Properties: 0x0001
          Connectable
        Min advertising interval: 100.000 msec (0x00a0)
        Max advertising interval: 150.000 msec (0x00f0)
        Channel map: 37, 38, 39 (0x07)
        Own address type: Random (0x01)
        Peer address type: Public (0x00)
        Peer address: 00:00:00:00:00:00 (OUI 00-00-00)
        Filter policy: Allow Scan Request from Any, Allow Connect Request from Any (0x00)
        TX power: Host has no preference (0x7f)
        Primary PHY: LE 1M (0x01)
        Secondary max skip: 0x00
        Secondary PHY: LE 2M (0x02)
        SID: 0x01
        Scan request notifications: Disabled (0x00)
> HCI Event: Command Complete (0x0e) plen 5                 #57 [hci1] 4.800085
      LE Set Extended Advertising Parameters (0x08|0x0036) ncmd 1
        Status: Success (0x00)
        TX power (selected): 0 dbm (0x00)
< HCI Command: LE Set Advertising S.. (0x08|0x0035) plen 7  #58 [hci1] 4.819136
        Advertising handle: 0x00
        Advertising random address: D5:B6:CC:31:DB:3B (Static)
> HCI Event: Command Complete (0x0e) plen 4                 #59 [hci1] 4.819633
      LE Set Advertising Set Random Address (0x08|0x0035) ncmd 1
        Status: Success (0x00)
< HCI Command: LE Set Extended Adv.. (0x08|0x0037) plen 22  #60 [hci1] 4.839104
        Handle: 0x00
        Operation: Complete extended advertising data (0x03)
        Fragment preference: Minimize fragmentation (0x01)
        Data length: 0x12
        Flags: 0x06
          LE General Discoverable Mode
          BR/EDR Not Supported
        Name (complete): Tester_F6B11A
> HCI Event: Command Complete (0x0e) plen 4                 #61 [hci1] 4.839864
      LE Set Extended Advertising Data (0x08|0x0037) ncmd 1
        Status: Success (0x00)
< HCI Command: LE Set Extended Adve.. (0x08|0x0039) plen 6  #62 [hci1] 4.859140
        Extended advertising: Enabled (0x01)
        Number of sets: 1 (0x01)
        Entry 0
          Handle: 0x00
          Duration: 0 ms (0x00)
          Max ext adv events: 0
> HCI Event: Command Complete (0x0e) plen 4                 #63 [hci1] 4.859709
      LE Set Extended Advertising Enable (0x08|0x0039) ncmd 1
        Status: Success (0x00)
> ACL Data RX: Handle 3747 flags 0x02 dlen 7                #64 [hci1] 5.280902
      ATT: Exchange MTU Request (0x02) len 2
        Client RX MTU: 64
> ACL Data RX: Handle 3747 flags 0x02 dlen 7                #65 [hci1] 5.281401
      ATT: Exchange MTU Response (0x03) len 2
        Server RX MTU: 64
< HCI Command: Host Number of Compl.. (0x03|0x0035) plen 5  #66 [hci1] 5.299159
        Num handles: 1
        Handle: 3747 Address: DF:A9:FF:F6:B1:1A (OUI DF-A9-FF)
        Count: 1
< ACL Data TX: Handle 3747 flags 0x00 dlen 7                #67 [hci1] 5.299165
      ATT: Exchange MTU Response (0x03) len 2
        Server RX MTU: 251
< HCI Command: Host Number of Compl.. (0x03|0x0035) plen 5  #68 [hci1] 5.299232
        Num handles: 1
        Handle: 3747 Address: DF:A9:FF:F6:B1:1A (OUI DF-A9-FF)
        Count: 1
> HCI Event: Number of Completed Packets (0x13) plen 5      #69 [hci1] 5.455875
        Num handles: 1
        Handle: 3747 Address: DF:A9:FF:F6:B1:1A (OUI DF-A9-FF)
        Count: 1
        #67: len 7 (0 Kb/s)
        Latency: 156 msec (88-156 msec ~122 msec)
> ACL Data RX: Handle 3747 flags 0x02 dlen 11               #70 [hci1] 7.380947
      SMP: Pairing Request (0x01) len 6
        IO capability: KeyboardDisplay (0x04)
        OOB data: Authentication data not present (0x00)
        Authentication requirement: Bonding, No MITM, SC, No Keypresses (0x09)
        Max encryption key size: 16
        Initiator key distribution: EncKey IdKey (0x03)
        Responder key distribution: EncKey IdKey Sign (0x07)
< HCI Command: Host Number of Compl.. (0x03|0x0035) plen 5  #71 [hci1] 7.399185
        Num handles: 1
        Handle: 3747 Address: DF:A9:FF:F6:B1:1A (OUI DF-A9-FF)
        Count: 1
< ACL Data TX: Handle 3747 flags 0x00 dlen 11               #72 [hci1] 7.399214
      SMP: Pairing Response (0x02) len 6
        IO capability: NoInputNoOutput (0x03)
        OOB data: Authentication data not present (0x00)
        Authentication requirement: Bonding, No MITM, SC, No Keypresses (0x09)
        Max encryption key size: 16
        Initiator key distribution: IdKey (0x02)
        Responder key distribution: <none> (0x00)
> HCI Event: Number of Completed Packets (0x13) plen 5      #73 [hci1] 7.555953
        Num handles: 1
        Handle: 3747 Address: DF:A9:FF:F6:B1:1A (OUI DF-A9-FF)
        Count: 1
        #72: len 11 (0 Kb/s)
        Latency: 156 msec (88-156 msec ~139 msec)
> ACL Data RX: Handle 3747 flags 0x02 dlen 27               #74 [hci1] 7.556287
> ACL Data RX: Handle 3747 flags 0x01 dlen 27               #75 [hci1] 7.556633
> ACL Data RX: Handle 3747 flags 0x01 dlen 15               #76 [hci1] 7.556954
      SMP: Pairing Public Key (0x0c) len 64
        X: 7d7852aae32abf425e0ec2e4643d9fcf5ed1e4fbf42dd2764a69f8ad53976372
        Y: d4003f819fdd586d690fbc4545d13aa3010a140c171604ac25e6a6b075b2c0c6
< HCI Command: Host Number of Compl.. (0x03|0x0035) plen 5  #77 [hci1] 7.559121
        Num handles: 1
        Handle: 3747 Address: DF:A9:FF:F6:B1:1A (OUI DF-A9-FF)
        Count: 1
< HCI Command: Host Number of Compl.. (0x03|0x0035) plen 5  #78 [hci1] 7.559130
        Num handles: 1
        Handle: 3747 Address: DF:A9:FF:F6:B1:1A (OUI DF-A9-FF)
        Count: 1
< HCI Command: Host Number of Compl.. (0x03|0x0035) plen 5  #79 [hci1] 7.559197
        Num handles: 1
        Handle: 3747 Address: DF:A9:FF:F6:B1:1A (OUI DF-A9-FF)
        Count: 1
< ACL Data TX: Handle 3747 flags 0x00 dlen 27               #80 [hci1] 7.559213
< ACL Data TX: Handle 3747 flags 0x01 dlen 27               #81 [hci1] 7.559219
< ACL Data TX: Handle 3747 flags 0x01 dlen 15               #82 [hci1] 7.559223
      SMP: Pairing Public Key (0x0c) len 64
        X: 98308440221e2d910f0e54b71e7ec652857aa9b5a0dc65028824cc19db1226e9
        Y: 67a4816bcb62efb21701e31fdb27561a6217575fb007a8bbdabe7e28b6f68482
> HCI Event: Number of Completed Packets (0x13) plen 5      #83 [hci1] 7.643880
        Num handles: 1
        Handle: 3747 Address: DF:A9:FF:F6:B1:1A (OUI DF-A9-FF)
        Count: 1
        #80: len 27 (2 Kb/s)
        Latency: 84 msec (84-156 msec ~112 msec)
> HCI Event: Number of Completed Packets (0x13) plen 5      #84 [hci1] 7.644273
        Num handles: 1
        Handle: 3747 Address: DF:A9:FF:F6:B1:1A (OUI DF-A9-FF)
        Count: 1
        #81: len 27 (2 Kb/s)
        Latency: 85 msec (84-156 msec ~98 msec)
< ACL Data TX: Handle 3747 flags 0x00 dlen 21               #85 [hci1] 7.659274
      SMP: Pairing Confirm (0x03) len 16
        Confim value: 459346099e257c94c2dbbdd7e04d7e8e
> HCI Event: Number of Completed Packets (0x13) plen 5      #86 [hci1] 7.730854
        Num handles: 1
        Handle: 3747 Address: DF:A9:FF:F6:B1:1A (OUI DF-A9-FF)
        Count: 1
        #82: len 15 (0 Kb/s)
        Latency: 171 msec (84-171 msec ~135 msec)
> HCI Event: Number of Completed Packets (0x13) plen 5      #87 [hci1] 7.818433
        Num handles: 1
        Handle: 3747 Address: DF:A9:FF:F6:B1:1A (OUI DF-A9-FF)
        Count: 1
        #85: len 21 (1 Kb/s)
        Latency: 159 msec (84-171 msec ~147 msec)
> ACL Data RX: Handle 3747 flags 0x02 dlen 21               #88 [hci1] 7.818773
      SMP: Pairing Random (0x04) len 16
        Random value: 3b8bbe055e90cb950000000000000000
< HCI Command: Host Number of Compl.. (0x03|0x0035) plen 5  #89 [hci1] 7.819641
        Num handles: 1
        Handle: 3747 Address: DF:A9:FF:F6:B1:1A (OUI DF-A9-FF)
        Count: 1
< ACL Data TX: Handle 3747 flags 0x00 dlen 21               #90 [hci1] 7.819721
      SMP: Pairing Random (0x04) len 16
        Random value: f966a694cbe26df70bb96773e6cc6f5d
> HCI Event: Number of Completed Packets (0x13) plen 5      #91 [hci1] 7.993336
        Num handles: 1
        Handle: 3747 Address: DF:A9:FF:F6:B1:1A (OUI DF-A9-FF)
        Count: 1
        #90: len 21 (0 Kb/s)
        Latency: 173 msec (84-173 msec ~160 msec)
> ACL Data RX: Handle 3747 flags 0x02 dlen 21               #92 [hci1] 8.168645
      SMP: Pairing DHKey Check (0x0d) len 16
        E: 7b833e2e3574a252a5bf19e3fbb91567
< HCI Command: Host Number of Compl.. (0x03|0x0035) plen 5  #93 [hci1] 8.179972
        Num handles: 1
        Handle: 3747 Address: DF:A9:FF:F6:B1:1A (OUI DF-A9-FF)
        Count: 1
< ACL Data TX: Handle 3747 flags 0x00 dlen 21               #94 [hci1] 8.180073
      SMP: Pairing DHKey Check (0x0d) len 16
        E: 86357ffcce9427809f5b39d9ea88498f
> HCI Event: Number of Completed Packets (0x13) plen 5      #95 [hci1] 8.343246
        Num handles: 1
        Handle: 3747 Address: DF:A9:FF:F6:B1:1A (OUI DF-A9-FF)
        Count: 1
        #94: len 21 (1 Kb/s)
        Latency: 163 msec (84-173 msec ~161 msec)
> HCI Event: LE Meta Event (0x3e) plen 13                   #96 [hci1] 8.518785
      LE Long Term Key Request (0x05)
        Handle: 3747 Address: DF:A9:FF:F6:B1:1A (OUI DF-A9-FF)
        Random number: 0x0000000000000000
        Encrypted diversifier: 0x0000
< HCI Command: LE Long Term Key Re.. (0x08|0x001a) plen 18  #97 [hci1] 8.519159
        Handle: 3747 Address: DF:A9:FF:F6:B1:1A (OUI DF-A9-FF)
        Long term key: bd695581e9813fc4c2913c392acbe92a
> HCI Event: Command Complete (0x0e) plen 6                 #98 [hci1] 8.519894
      LE Long Term Key Request Reply (0x08|0x001a) ncmd 1
        Status: Success (0x00)
        Handle: 3747 Address: DF:A9:FF:F6:B1:1A (OUI DF-A9-FF)
> HCI Event: Encryption Change (0x08) plen 4                #99 [hci1] 8.956001
        Status: Success (0x00)
        Handle: 3747 Address: DF:A9:FF:F6:B1:1A (OUI DF-A9-FF)
        Encryption: Enabled with AES-CCM (0x01)
> ACL Data RX: Handle 3747 flags 0x02 dlen 21              #100 [hci1] 9.043652
      SMP: Identity Information (0x08) len 16
        Identity resolving key: a1808ce223822e426f97453b068c77ae
< HCI Command: Host Number of Comp.. (0x03|0x0035) plen 5  #101 [hci1] 9.069821
        Num handles: 1
        Handle: 3747 Address: DF:A9:FF:F6:B1:1A (OUI DF-A9-FF)
        Count: 1
> ACL Data RX: Handle 3747 flags 0x02 dlen 12              #102 [hci1] 9.218445
      SMP: Identity Address Information (0x09) len 7
        Address: DF:A9:FF:F6:B1:1A (OUI DF-A9-FF)
< HCI Command: LE Set Extended Adv.. (0x08|0x0039) plen 6  #103 [hci1] 9.219646
        Extended advertising: Disabled (0x00)
        Number of sets: 1 (0x01)
        Entry 0
          Handle: 0x00
          Duration: 0 ms (0x00)
          Max ext adv events: 0
> HCI Event: Command Complete (0x0e) plen 4                #104 [hci1] 9.220140
      LE Set Extended Advertising Enable (0x08|0x0039) ncmd 1
        Status: Success (0x00)
< HCI Command: LE Add Device To R.. (0x08|0x0027) plen 39  #105 [hci1] 9.239509
        Address type: Public (0x00)
        Address: DF:A9:FF:F6:B1:1A (OUI DF-A9-FF)
        Peer identity resolving key: a1808ce223822e426f97453b068c77ae
        Local identity resolving key: 00000000000000000000000000000000
> HCI Event: Command Complete (0x0e) plen 4                #106 [hci1] 9.240443
      LE Add Device To Resolving List (0x08|0x0027) ncmd 1
        Status: Success (0x00)
< HCI Command: LE Set Privacy Mode (0x08|0x004e) plen 8    #107 [hci1] 9.259447
        Peer Identity address type: Public (0x00)
        Peer Identity address: DF:A9:FF:F6:B1:1A (OUI DF-A9-FF)
        Privacy Mode: Use Device Privacy (0x01)
> HCI Event: Command Complete (0x0e) plen 4                #108 [hci1] 9.259988
      LE Set Privacy Mode (0x08|0x004e) ncmd 1
        Status: Success (0x00)
< HCI Command: LE Set Address Reso.. (0x08|0x002d) plen 1  #109 [hci1] 9.279592
        Address resolution: Enabled (0x01)
> HCI Event: Command Complete (0x0e) plen 4                #110 [hci1] 9.280074
      LE Set Address Resolution Enable (0x08|0x002d) ncmd 1
        Status: Success (0x00)
< HCI Command: LE Set Extended Adv.. (0x08|0x0039) plen 6  #111 [hci1] 9.299564
        Extended advertising: Enabled (0x01)
        Number of sets: 1 (0x01)
        Entry 0
          Handle: 0x00
          Duration: 0 ms (0x00)
          Max ext adv events: 0
> HCI Event: Command Complete (0x0e) plen 4                #112 [hci1] 9.300143
      LE Set Extended Advertising Enable (0x08|0x0039) ncmd 1
        Status: Success (0x00)
< HCI Command: Host Number of Comp.. (0x03|0x0035) plen 5  #113 [hci1] 9.319411
        Num handles: 1
        Handle: 3747 Address: DF:A9:FF:F6:B1:1A (OUI DF-A9-FF)
        Count: 1
> ACL Data RX: Handle 3747 flags 0x02 dlen 11              #114 [hci1] 9.393424
      ATT: Read By Group Type Request (0x10) len 6
        Handle range: 0x0001-0xffff
        Attribute group type: Primary Service (0x2800)
< HCI Command: Host Number of Comp.. (0x03|0x0035) plen 5  #115 [hci1] 9.399196
        Num handles: 1
        Handle: 3747 Address: DF:A9:FF:F6:B1:1A (OUI DF-A9-FF)
        Count: 1
< ACL Data TX: Handle 3747 flags 0x00 dlen 27              #116 [hci1] 9.399277
< ACL Data TX: Handle 3747 flags 0x01 dlen 27              #117 [hci1] 9.399281
< ACL Data TX: Handle 3747 flags 0x01 dlen 12              #118 [hci1] 9.399282
      ATT: Read By Group Type Response (0x11) len 61
        Attribute data length: 6
        Attribute group list: 10 entries
        Handle range: 0x0001-0x000a
        UUID: Generic Attribute Profile (0x1801)
        Handle range: 0x000b-0x0011
        UUID: Generic Access Profile (0x1800)
        Handle range: 0x0012-0x0026
        UUID: Device Information (0x180a)
        Handle range: 0x0027-0x0029
        UUID: Immediate Alert (0x1802)
        Handle range: 0x003a-0x003e
        UUID: Microphone Control (0x184d)
        Handle range: 0x003f-0x0051
        UUID: Published Audio Capabilities (0x1850)
        Handle range: 0x0052-0x0061
        UUID: Audio Stream Control (0x184e)
        Handle range: 0x009a-0x00a6
        UUID: Volume Control (0x1844)
        Handle range: 0x00a7-0x00b2
        UUID: Coordinated Set Identification (0x1846)
        Handle range: 0x00b3-0x00b4
        UUID: Common Audio (0x1853)
> HCI Event: Number of Completed Packets (0x13) plen 5     #119 [hci1] 9.481271
        Num handles: 1
        Handle: 3747 Address: DF:A9:FF:F6:B1:1A (OUI DF-A9-FF)
        Count: 1
        #116: len 27 (2 Kb/s)
        Latency: 81 msec (81-173 msec ~121 msec)
> HCI Event: Number of Completed Packets (0x13) plen 5     #120 [hci1] 9.481827
        Num handles: 1
        Handle: 3747 Address: DF:A9:FF:F6:B1:1A (OUI DF-A9-FF)
        Count: 1
        #117: len 27 (2 Kb/s)
        Latency: 82 msec (81-173 msec ~102 msec)
> HCI Event: Number of Completed Packets (0x13) plen 5     #121 [hci1] 9.568364
        Num handles: 1
        Handle: 3747 Address: DF:A9:FF:F6:B1:1A (OUI DF-A9-FF)
        Count: 1
        #118: len 12 (0 Kb/s)
        Latency: 169 msec (81-173 msec ~135 msec)
> ACL Data RX: Handle 3747 flags 0x02 dlen 11              #122 [hci1] 9.568703
      ATT: Read By Group Type Request (0x10) len 6
        Handle range: 0x00b5-0xffff
        Attribute group type: Primary Service (0x2800)
< HCI Command: Host Number of Comp.. (0x03|0x0035) plen 5  #123 [hci1] 9.579808
        Num handles: 1
        Handle: 3747 Address: DF:A9:FF:F6:B1:1A (OUI DF-A9-FF)
        Count: 1
< ACL Data TX: Handle 3747 flags 0x00 dlen 12              #124 [hci1] 9.579918
      ATT: Read By Group Type Response (0x11) len 7
        Attribute data length: 6
        Attribute group list: 1 entry
        Handle range: 0x00b5-0x00bd
        UUID: Hearing Aid (0x1854)
> HCI Event: Number of Completed Packets (0x13) plen 5     #125 [hci1] 9.743508
        Num handles: 1
        Handle: 3747 Address: DF:A9:FF:F6:B1:1A (OUI DF-A9-FF)
        Count: 1
        #124: len 12 (0 Kb/s)
        Latency: 163 msec (81-173 msec ~149 msec)
> ACL Data RX: Handle 3747 flags 0x02 dlen 11              #126 [hci1] 9.743560
      ATT: Read By Group Type Request (0x10) len 6
        Handle range: 0x00be-0xffff
        Attribute group type: Primary Service (0x2800)
< HCI Command: Host Number of Comp.. (0x03|0x0035) plen 5  #127 [hci1] 9.759974
        Num handles: 1
        Handle: 3747 Address: DF:A9:FF:F6:B1:1A (OUI DF-A9-FF)
        Count: 1
< ACL Data TX: Handle 3747 flags 0x00 dlen 9               #128 [hci1] 9.760137
      ATT: Error Response (0x01) len 4
        Read By Group Type Request (0x10)
        Handle: 0x00be
        Error: Attribute Not Found (0x0a)
> HCI Event: Number of Completed Packets (0x13) plen 5     #129 [hci1] 9.918391
        Num handles: 1
        Handle: 3747 Address: DF:A9:FF:F6:B1:1A (OUI DF-A9-FF)
        Count: 1
        #128: len 9 (0 Kb/s)
        Latency: 158 msec (81-173 msec ~153 msec)
> ACL Data RX: Handle 3747 flags 0x02 dlen 11              #130 [hci1] 9.918578
      ATT: Read By Type Request (0x08) len 6
        Handle range: 0x0001-0x000a
        Attribute type: Include (0x2802)
< HCI Command: Host Number of Comp.. (0x03|0x0035) plen 5  #131 [hci1] 9.919560
        Num handles: 1
        Handle: 3747 Address: DF:A9:FF:F6:B1:1A (OUI DF-A9-FF)
        Count: 1
< ACL Data TX: Handle 3747 flags 0x00 dlen 9               #132 [hci1] 9.919743
      ATT: Error Response (0x01) len 4
        Read By Type Request (0x08)
        Handle: 0x0001
        Error: Attribute Not Found (0x0a)
> HCI Event: Number of Completed Packets (0x13) plen 5    #133 [hci1] 10.093396
        Num handles: 1
        Handle: 3747 Address: DF:A9:FF:F6:B1:1A (OUI DF-A9-FF)
        Count: 1
        #132: len 9 (0 Kb/s)
        Latency: 173 msec (81-173 msec ~163 msec)
> ACL Data RX: Handle 3747 flags 0x02 dlen 11             #134 [hci1] 10.093634
      ATT: Read By Type Request (0x08) len 6
        Handle range: 0x000b-0x0011
        Attribute type: Include (0x2802)
< HCI Command: Host Number of Com.. (0x03|0x0035) plen 5  #135 [hci1] 10.099801
        Num handles: 1
        Handle: 3747 Address: DF:A9:FF:F6:B1:1A (OUI DF-A9-FF)
        Count: 1
< ACL Data TX: Handle 3747 flags 0x00 dlen 9              #136 [hci1] 10.099964
      ATT: Error Response (0x01) len 4
        Read By Type Request (0x08)
        Handle: 0x000b
        Error: Attribute Not Found (0x0a)
> HCI Event: Number of Completed Packets (0x13) plen 5    #137 [hci1] 10.268437
        Num handles: 1
        Handle: 3747 Address: DF:A9:FF:F6:B1:1A (OUI DF-A9-FF)
        Count: 1
        #136: len 9 (0 Kb/s)
        Latency: 168 msec (81-173 msec ~166 msec)
> ACL Data RX: Handle 3747 flags 0x02 dlen 11             #138 [hci1] 10.268555
      ATT: Read By Type Request (0x08) len 6
        Handle range: 0x0012-0x0026
        Attribute type: Include (0x2802)
< HCI Command: Host Number of Com.. (0x03|0x0035) plen 5  #139 [hci1] 10.279840
        Num handles: 1
        Handle: 3747 Address: DF:A9:FF:F6:B1:1A (OUI DF-A9-FF)
        Count: 1
< ACL Data TX: Handle 3747 flags 0x00 dlen 9              #140 [hci1] 10.280037
      ATT: Error Response (0x01) len 4
        Read By Type Request (0x08)
        Handle: 0x0012
        Error: Attribute Not Found (0x0a)
> HCI Event: Number of Completed Packets (0x13) plen 5    #141 [hci1] 10.443481
        Num handles: 1
        Handle: 3747 Address: DF:A9:FF:F6:B1:1A (OUI DF-A9-FF)
        Count: 1
        #140: len 9 (0 Kb/s)
        Latency: 163 msec (81-173 msec ~164 msec)
> ACL Data RX: Handle 3747 flags 0x02 dlen 11             #142 [hci1] 10.443664
      ATT: Read By Type Request (0x08) len 6
        Handle range: 0x0027-0x0029
        Attribute type: Include (0x2802)
< HCI Command: Host Number of Com.. (0x03|0x0035) plen 5  #143 [hci1] 10.459303
        Num handles: 1
        Handle: 3747 Address: DF:A9:FF:F6:B1:1A (OUI DF-A9-FF)
        Count: 1
< ACL Data TX: Handle 3747 flags 0x00 dlen 9              #144 [hci1] 10.459438
      ATT: Error Response (0x01) len 4
        Read By Type Request (0x08)
        Handle: 0x0027
        Error: Attribute Not Found (0x0a)
> HCI Event: Number of Completed Packets (0x13) plen 5    #145 [hci1] 10.618426
        Num handles: 1
        Handle: 3747 Address: DF:A9:FF:F6:B1:1A (OUI DF-A9-FF)
        Count: 1
        #144: len 9 (0 Kb/s)
        Latency: 158 msec (81-173 msec ~161 msec)
> ACL Data RX: Handle 3747 flags 0x02 dlen 11             #146 [hci1] 10.618601
      ATT: Read By Type Request (0x08) len 6
        Handle range: 0x003a-0x003e
        Attribute type: Include (0x2802)
< HCI Command: Host Number of Com.. (0x03|0x0035) plen 5  #147 [hci1] 10.619772
        Num handles: 1
        Handle: 3747 Address: DF:A9:FF:F6:B1:1A (OUI DF-A9-FF)
        Count: 1
< ACL Data TX: Handle 3747 flags 0x00 dlen 14             #148 [hci1] 10.619896
      ATT: Read By Type Response (0x09) len 9
        Attribute data length: 8
        Attribute data list: 1 entry
        Handle: 0x003b
        Value: 2a0039004318
> HCI Event: Number of Completed Packets (0x13) plen 5    #149 [hci1] 10.793350
        Num handles: 1
        Handle: 3747 Address: DF:A9:FF:F6:B1:1A (OUI DF-A9-FF)
        Count: 1
        #148: len 14 (0 Kb/s)
        Latency: 173 msec (81-173 msec ~167 msec)
> ACL Data RX: Handle 3747 flags 0x02 dlen 11             #150 [hci1] 10.793631
      ATT: Read By Type Request (0x08) len 6
        Handle range: 0x003c-0x003e
        Attribute type: Include (0x2802)
< HCI Command: Host Number of Com.. (0x03|0x0035) plen 5  #151 [hci1] 10.799540
        Num handles: 1
        Handle: 3747 Address: DF:A9:FF:F6:B1:1A (OUI DF-A9-FF)
        Count: 1
< ACL Data TX: Handle 3747 flags 0x00 dlen 9              #152 [hci1] 10.799817
      ATT: Error Response (0x01) len 4
        Read By Type Request (0x08)
        Handle: 0x003c
        Error: Attribute Not Found (0x0a)
> HCI Event: Number of Completed Packets (0x13) plen 5    #153 [hci1] 10.968335
        Num handles: 1
        Handle: 3747 Address: DF:A9:FF:F6:B1:1A (OUI DF-A9-FF)
        Count: 1
        #152: len 9 (0 Kb/s)
        Latency: 168 msec (81-173 msec ~168 msec)
> ACL Data RX: Handle 3747 flags 0x02 dlen 11             #154 [hci1] 10.968572
      ATT: Read By Type Request (0x08) len 6
        Handle range: 0x003f-0x0051
        Attribute type: Include (0x2802)
< HCI Command: Host Number of Com.. (0x03|0x0035) plen 5  #155 [hci1] 10.979589
        Num handles: 1
        Handle: 3747 Address: DF:A9:FF:F6:B1:1A (OUI DF-A9-FF)
        Count: 1
< ACL Data TX: Handle 3747 flags 0x00 dlen 9              #156 [hci1] 10.979733
      ATT: Error Response (0x01) len 4
        Read By Type Request (0x08)
        Handle: 0x003f
        Error: Attribute Not Found (0x0a)
> HCI Event: Number of Completed Packets (0x13) plen 5    #157 [hci1] 11.143380
        Num handles: 1
        Handle: 3747 Address: DF:A9:FF:F6:B1:1A (OUI DF-A9-FF)
        Count: 1
        #156: len 9 (0 Kb/s)
        Latency: 163 msec (81-173 msec ~165 msec)
> ACL Data RX: Handle 3747 flags 0x02 dlen 11             #158 [hci1] 11.143581
      ATT: Read By Type Request (0x08) len 6
        Handle range: 0x0052-0x0061
        Attribute type: Include (0x2802)
< HCI Command: Host Number of Com.. (0x03|0x0035) plen 5  #159 [hci1] 11.159888
        Num handles: 1
        Handle: 3747 Address: DF:A9:FF:F6:B1:1A (OUI DF-A9-FF)
        Count: 1
< ACL Data TX: Handle 3747 flags 0x00 dlen 9              #160 [hci1] 11.160144
      ATT: Error Response (0x01) len 4
        Read By Type Request (0x08)
        Handle: 0x0052
        Error: Attribute Not Found (0x0a)
> HCI Event: Number of Completed Packets (0x13) plen 5    #161 [hci1] 11.318419
        Num handles: 1
        Handle: 3747 Address: DF:A9:FF:F6:B1:1A (OUI DF-A9-FF)
        Count: 1
        #160: len 9 (0 Kb/s)
        Latency: 158 msec (81-173 msec ~162 msec)
> ACL Data RX: Handle 3747 flags 0x02 dlen 11             #162 [hci1] 11.318533
      ATT: Read By Type Request (0x08) len 6
        Handle range: 0x009a-0x00a6
        Attribute type: Include (0x2802)
< HCI Command: Host Number of Com.. (0x03|0x0035) plen 5  #163 [hci1] 11.319912
        Num handles: 1
        Handle: 3747 Address: DF:A9:FF:F6:B1:1A (OUI DF-A9-FF)
        Count: 1
< ACL Data TX: Handle 3747 flags 0x00 dlen 27             #164 [hci1] 11.319935
< ACL Data TX: Handle 3747 flags 0x01 dlen 11             #165 [hci1] 11.319940
      ATT: Read By Type Response (0x09) len 33
        Attribute data length: 8
        Attribute data list: 4 entries
        Handle: 0x009b
        Value: 62006d004518
        Handle: 0x009c
        Value: 6e0079004518
        Handle: 0x009d
        Value: 7a0089004318
        Handle: 0x009e
        Value: 8a0099004318
> HCI Event: Number of Completed Packets (0x13) plen 5    #166 [hci1] 11.406248
        Num handles: 1
        Handle: 3747 Address: DF:A9:FF:F6:B1:1A (OUI DF-A9-FF)
        Count: 1
        #164: len 27 (2 Kb/s)
        Latency: 86 msec (81-173 msec ~124 msec)
> HCI Event: Number of Completed Packets (0x13) plen 5    #167 [hci1] 11.493327
        Num handles: 1
        Handle: 3747 Address: DF:A9:FF:F6:B1:1A (OUI DF-A9-FF)
        Count: 1
        #165: len 11 (0 Kb/s)
        Latency: 173 msec (81-173 msec ~148 msec)
> ACL Data RX: Handle 3747 flags 0x02 dlen 11             #168 [hci1] 11.493547
      ATT: Read By Type Request (0x08) len 6
        Handle range: 0x009f-0x00a6
        Attribute type: Include (0x2802)
< HCI Command: Host Number of Com.. (0x03|0x0035) plen 5  #169 [hci1] 11.499803
        Num handles: 1
        Handle: 3747 Address: DF:A9:FF:F6:B1:1A (OUI DF-A9-FF)
        Count: 1
< ACL Data TX: Handle 3747 flags 0x00 dlen 9              #170 [hci1] 11.499987
      ATT: Error Response (0x01) len 4
        Read By Type Request (0x08)
        Handle: 0x009f
        Error: Attribute Not Found (0x0a)
> HCI Event: Number of Completed Packets (0x13) plen 5    #171 [hci1] 11.668370
        Num handles: 1
        Handle: 3747 Address: DF:A9:FF:F6:B1:1A (OUI DF-A9-FF)
        Count: 1
        #170: len 9 (0 Kb/s)
        Latency: 168 msec (81-173 msec ~158 msec)
> ACL Data RX: Handle 3747 flags 0x02 dlen 11             #172 [hci1] 11.668633
      ATT: Read By Type Request (0x08) len 6
        Handle range: 0x0062-0x006d
        Attribute type: Characteristic (0x2803)
< HCI Command: Host Number of Com.. (0x03|0x0035) plen 5  #173 [hci1] 11.679579
        Num handles: 1
        Handle: 3747 Address: DF:A9:FF:F6:B1:1A (OUI DF-A9-FF)
        Count: 1
< ACL Data TX: Handle 3747 flags 0x00 dlen 27             #174 [hci1] 11.679630
< ACL Data TX: Handle 3747 flags 0x01 dlen 7              #175 [hci1] 11.679693
      ATT: Read By Type Response (0x09) len 29
        Attribute data length: 7
        Attribute data list: 4 entries
        Handle: 0x0063
        Value: 126400802b
            Properties: 0x12
              Read (0x02)
              Notify (0x10)
            Value Handle: 0x0064
            Value UUID: Offset State (0x2b80)
        Handle: 0x0066
        Value: 166700812b
            Properties: 0x16
              Read (0x02)
              Write Without Response (0x04)
              Notify (0x10)
            Value Handle: 0x0067
            Value UUID: Audio Location (0x2b81)
        Handle: 0x0069
        Value: 086a00822b
            Properties: 0x08
              Write (0x08)
            Value Handle: 0x006a
            Value UUID: Volume Offset Control Point (0x2b82)
        Handle: 0x006b
        Value: 166c00832b
            Properties: 0x16
              Read (0x02)
              Write Without Response (0x04)
              Notify (0x10)
            Value Handle: 0x006c
            Value UUID: Audio Output Description (0x2b83)
> HCI Event: Number of Completed Packets (0x13) plen 5    #176 [hci1] 11.756261
        Num handles: 1
        Handle: 3747 Address: DF:A9:FF:F6:B1:1A (OUI DF-A9-FF)
        Count: 1
        #174: len 27 (2 Kb/s)
        Latency: 76 msec (76-173 msec ~117 msec)
> HCI Event: Number of Completed Packets (0x13) plen 5    #177 [hci1] 11.843342
        Num handles: 1
        Handle: 3747 Address: DF:A9:FF:F6:B1:1A (OUI DF-A9-FF)
        Count: 1
        #175: len 7 (0 Kb/s)
        Latency: 163 msec (76-173 msec ~140 msec)
> ACL Data RX: Handle 3747 flags 0x02 dlen 11             #178 [hci1] 11.843492
      ATT: Read By Type Request (0x08) len 6
        Handle range: 0x006c-0x006d
        Attribute type: Characteristic (0x2803)
< HCI Command: Host Number of Com.. (0x03|0x0035) plen 5  #179 [hci1] 11.859921
        Num handles: 1
        Handle: 3747 Address: DF:A9:FF:F6:B1:1A (OUI DF-A9-FF)
        Count: 1
< ACL Data TX: Handle 3747 flags 0x00 dlen 9              #180 [hci1] 11.860102
      ATT: Error Response (0x01) len 4
        Read By Type Request (0x08)
        Handle: 0x006c
        Error: Attribute Not Found (0x0a)
> HCI Event: Number of Completed Packets (0x13) plen 5    #181 [hci1] 12.018323
        Num handles: 1
        Handle: 3747 Address: DF:A9:FF:F6:B1:1A (OUI DF-A9-FF)
        Count: 1
        #180: len 9 (0 Kb/s)
        Latency: 158 msec (76-173 msec ~149 msec)
> HCI Event: Disconnect Complete (0x05) plen 4            #182 [hci1] 13.418905
        Status: Success (0x00)
        Handle: 3747 Address: DF:A9:FF:F6:B1:1A (OUI DF-A9-FF)
        Reason: Remote User Terminated Connection (0x13)
< HCI Command: Reset (0x03|0x0003) plen 0                 #183 [hci1] 17.839646
> HCI Event: Command Complete (0x0e) plen 4               #184 [hci1] 17.840168
      Reset (0x03|0x0003) ncmd 1
        Status: Success (0x00)
@ USER Close: main                                    {0x0001} [hci1] 17.859182
= Close Index: 00:00:00:00:00:00                               [hci1] 17.859193
