Bluetooth monitor ver 5.72
= Note: Linux version 6.14.0-36-generic (x86_64)                       0.641493
= Note: Bluetooth subsystem version 2.22                               0.641495
= New Index: 00:00:00:00:00:00 (Primary,UART,hci2)              [hci2] 0.641496
= New Index: 00:00:00:00:00:00 (Primary,UART,hci1)              [hci1] 0.641497
= New Index: 48:5F:99:8E:E0:64 (Primary,USB,hci0)               [hci0] 0.641497
= Open Index: 00:00:00:00:00:00                                 [hci1] 0.664720
= Index Info: 00:00:00:00:00:00 (Nordic Semiconductor ASA)      [hci1] 0.664724
@ USER Open: main (privileged) version 2.22            {0x0001} [hci1] 0.664727
< HCI Command: Reset (0x03|0x0003) plen 0                    #1 [hci1] 0.665121
> HCI Event: Command Complete (0x0e) plen 4                  #2 [hci1] 0.665810
      Reset (0x03|0x0003) ncmd 1
        Status: Success (0x00)
< HCI Command: Read Local Supported... (0x04|0x0003) plen 0  #3 [hci1] 0.684663
> HCI Event: Command Complete (0x0e) plen 12                 #4 [hci1] 0.685230
      Read Local Supported Features (0x04|0x0003) ncmd 1
        Status: Success (0x00)
        Features: 0x00 0x00 0x00 0x00 0x60 0x00 0x00 0x00
          BR/EDR Not Supported
          LE Supported (Controller)
< HCI Command: Read Local Version In.. (0x04|0x0001) plen 0  #5 [hci1] 0.704648
> HCI Event: Command Complete (0x0e) plen 12                 #6 [hci1] 0.705156
      Read Local Version Information (0x04|0x0001) ncmd 1
        Status: Success (0x00)
        HCI version: Reserved (0x0f) - Revision 12393 (0x3069)
        LMP version: Reserved (0x0f) - Subversion 12393 (0x3069)
        Manufacturer: Nordic Semiconductor ASA (89)
< HCI Command: Read Local Supported... (0x04|0x0002) plen 0  #7 [hci1] 0.724627
> HCI Event: Command Complete (0x0e) plen 68                 #8 [hci1] 0.725697
      Read Local Supported Commands (0x04|0x0002) ncmd 1
        Status: Success (0x00)
        Commands: 119 entries
          Disconnect (Octet 0 - Bit 5)
          Read Remote Version Information (Octet 2 - Bit 7)
          Set Event Mask (Octet 5 - Bit 6)
          Reset (Octet 5 - Bit 7)
          Read Connection Accept Timeout (Octet 7 - Bit 2)
          Write Connection Accept Timeout (Octet 7 - Bit 3)
          Read Transmit Power Level (Octet 10 - Bit 2)
          Set Controller To Host Flow Control (Octet 10 - Bit 5)
          Host Buffer Size (Octet 10 - Bit 6)
          Host Number of Completed Packets (Octet 10 - Bit 7)
          Read Local Version Information (Octet 14 - Bit 3)
          Read Local Supported Features (Octet 14 - Bit 5)
          Read BD ADDR (Octet 15 - Bit 1)
          Read RSSI (Octet 15 - Bit 5)
          Set Event Mask Page 2 (Octet 22 - Bit 2)
          LE Set Event Mask (Octet 25 - Bit 0)
          LE Read Buffer Size (Octet 25 - Bit 1)
          LE Read Local Supported Features (Octet 25 - Bit 2)
          LE Set Random Address (Octet 25 - Bit 4)
          LE Set Advertising Parameters (Octet 25 - Bit 5)
          LE Read Advertising Channel TX Power (Octet 25 - Bit 6)
          LE Set Advertising Data (Octet 25 - Bit 7)
          LE Set Scan Response Data (Octet 26 - Bit 0)
          LE Set Advertise Enable (Octet 26 - Bit 1)
          LE Set Scan Parameters (Octet 26 - Bit 2)
          LE Set Scan Enable (Octet 26 - Bit 3)
          LE Create Connection (Octet 26 - Bit 4)
          LE Create Connection Cancel (Octet 26 - Bit 5)
          LE Read Accept List Size (Octet 26 - Bit 6)
          LE Clear Accept List (Octet 26 - Bit 7)
          LE Add Device To Accept List (Octet 27 - Bit 0)
          LE Remove Device From Accept List (Octet 27 - Bit 1)
          LE Connection Update (Octet 27 - Bit 2)
          LE Set Host Channel Classification (Octet 27 - Bit 3)
          LE Read Channel Map (Octet 27 - Bit 4)
          LE Read Remote Used Features (Octet 27 - Bit 5)
          LE Encrypt (Octet 27 - Bit 6)
          LE Rand (Octet 27 - Bit 7)
          LE Start Encryption (Octet 28 - Bit 0)
          LE Long Term Key Request Reply (Octet 28 - Bit 1)
          LE Long Term Key Request Neg Reply (Octet 28 - Bit 2)
          LE Read Supported States (Octet 28 - Bit 3)
          LE Receiver Test (Octet 28 - Bit 4)
          LE Transmitter Test (Octet 28 - Bit 5)
          LE Test End (Octet 28 - Bit 6)
          Read Authenticated Payload Timeout (Octet 32 - Bit 4)
          Write Authenticated Payload Timeout (Octet 32 - Bit 5)
          LE Set Data Length (Octet 33 - Bit 6)
          LE Read Suggested Default Data Length (Octet 33 - Bit 7)
          LE Write Suggested Default Data Length (Octet 34 - Bit 0)
          LE Add Device To Resolving List (Octet 34 - Bit 3)
          LE Remove Device From Resolving List (Octet 34 - Bit 4)
          LE Clear Resolving List (Octet 34 - Bit 5)
          LE Read Resolving List Size (Octet 34 - Bit 6)
          LE Set Address Resolution Enable (Octet 35 - Bit 1)
          LE Set Resolvable Private Address Timeout (Octet 35 - Bit 2)
          LE Read Maximum Data Length (Octet 35 - Bit 3)
          LE Read PHY (Octet 35 - Bit 4)
          LE Set Default PHY (Octet 35 - Bit 5)
          LE Set PHY (Octet 35 - Bit 6)
          LE Enhanced Receiver Test (Octet 35 - Bit 7)
          LE Enhanced Transmitter Test (Octet 36 - Bit 0)
          LE Set Advertising Set Random Address (Octet 36 - Bit 1)
          LE Set Extended Advertising Parameters (Octet 36 - Bit 2)
          LE Set Extended Advertising Data (Octet 36 - Bit 3)
          LE Set Extended Scan Response Data (Octet 36 - Bit 4)
          LE Set Extended Advertising Enable (Octet 36 - Bit 5)
          LE Read Maximum Advertising Data Length (Octet 36 - Bit 6)
          LE Read Number of Supported Advertising Sets (Octet 36 - Bit 7)
          LE Remove Advertising Set (Octet 37 - Bit 0)
          LE Clear Advertising Sets (Octet 37 - Bit 1)
          LE Set Periodic Advertising Parameters (Octet 37 - Bit 2)
          LE Set Periodic Advertising Data (Octet 37 - Bit 3)
          LE Set Periodic Advertising Enable (Octet 37 - Bit 4)
          LE Set Extended Scan Parameters (Octet 37 - Bit 5)
          LE Set Extended Scan Enable (Octet 37 - Bit 6)
          LE Extended Create Connection (Octet 37 - Bit 7)
          LE Periodic Advertising Create Sync (Octet 38 - Bit 0)
          LE Periodic Advertising Create Sync Cancel (Octet 38 - Bit 1)
          LE Periodic Advertising Terminate Sync (Octet 38 - Bit 2)
          LE Add Device To Periodic Advertiser List (Octet 38 - Bit 3)
          LE Remove Device From Periodic Advertiser List (Octet 38 - Bit 4)
          LE Clear Periodic Advertiser List (Octet 38 - Bit 5)
          LE Read Periodic Advertiser List Size (Octet 38 - Bit 6)
          LE Read Transmit Power (Octet 38 - Bit 7)
          LE Read RF Path Compensation (Octet 39 - Bit 0)
          LE Write RF Path Compensation (Octet 39 - Bit 1)
          LE Set Privacy Mode (Octet 39 - Bit 2)
          LE Periodic Advertising Receive Enable (Octet 40 - Bit 5)
          LE Periodic Advertising Sync Transfer (Octet 40 - Bit 6)
          LE Periodic Advertising Set Info Transfer (Octet 40 - Bit 7)
          LE Periodic Advertising Sync Transfer Parameters (Octet 41 - Bit 0)
          LE Set Default Periodic Advertisng Sync Transfer Parameters (Octet 41 - Bit 1)
          LE Read Buffer v2 (Octet 41 - Bit 5)
          LE Read ISO TX Sync (Octet 41 - Bit 6)
          LE Set Connected Isochronous Group Parameters (Octet 41 - Bit 7)
          LE Set Connected Isochronous Group Parameters Test (Octet 42 - Bit 0)
          LE Create Connected Isochronous Stream (Octet 42 - Bit 1)
          LE Remove Connected Isochronous Group (Octet 42 - Bit 2)
          LE Accept Connected Isochronous Stream Request (Octet 42 - Bit 3)
          LE Reject Connected Isochronous Stream Request (Octet 42 - Bit 4)
          LE Create Broadcast Isochronous Group (Octet 42 - Bit 5)
          LE Create Broadcast Isochronous Group Test (Octet 42 - Bit 6)
          LE Terminate Broadcast Isochronous Group (Octet 42 - Bit 7)
          LE Broadcast Isochronous Group Create Sync (Octet 43 - Bit 0)
          LE Broadcast Isochronous Group Terminate Sync (Octet 43 - Bit 1)
          LE Request Peer SCA (Octet 43 - Bit 2)
          LE Setup Isochronous Data Path (Octet 43 - Bit 3)
          LE Remove Isochronous Data Path (Octet 43 - Bit 4)
          LE Isochronous Transmit Test (Octet 43 - Bit 5)
          LE Isochronous Receive Test (Octet 43 - Bit 6)
          LE Isochronous Read Test Counters (Octet 43 - Bit 7)
          LE Isochronous Read Test Counters (Octet 44 - Bit 0)
          LE Set Host Feature (Octet 44 - Bit 1)
          Octet 44 - Bit 2 
          Octet 45 - Bit 6 
          Octet 46 - Bit 0 
          Octet 46 - Bit 1 
          Octet 46 - Bit 2 
< HCI Command: Host Buffer Size (0x03|0x0033) plen 7         #9 [hci1] 0.744642
        ACL MTU: 255  ACL max packet: 16
        SCO MTU: 0    SCO max packet: 0
> HCI Event: Command Complete (0x0e) plen 4                 #10 [hci1] 0.745139
      Host Buffer Size (0x03|0x0033) ncmd 1
        Status: Success (0x00)
< HCI Command: Set Controller To Ho.. (0x03|0x0031) plen 1  #11 [hci1] 0.764642
        Flow control: ACL Data Packets (0x01)
> HCI Event: Command Complete (0x0e) plen 4                 #12 [hci1] 0.765034
      Set Controller To Host Flow Control (0x03|0x0031) ncmd 1
        Status: Success (0x00)
< HCI Command: LE Read Local Suppor.. (0x08|0x0003) plen 0  #13 [hci1] 0.784631
> HCI Event: Command Complete (0x0e) plen 12                #14 [hci1] 0.785237
      LE Read Local Supported Features (0x08|0x0003) ncmd 1
        Status: Success (0x00)
        Features: 0xfd 0x79 0x00 0xf7 0x30 0x01 0x00 0x00
          LE Encryption
          Extended Reject Indication
          Peripheral-initiated Features Exchange
          LE Ping
          LE Data Packet Length Extension
          LL Privacy
          Extended Scanner Filter Policies
          LE 2M PHY
          LE Coded PHY
          LE Extended Advertising
          LE Periodic Advertising
          Channel Selection Algorithm #2
          Periodic Advertising Sync Transfer - Sender
          Periodic Advertising Sync Transfer - Recipient
          Sleep Clock Accuracy Updates
          Connected Isochronous Stream - Central
          Connected Isochronous Stream - Peripheral
          Isochronous Broadcaster
          Synchronized Receiver
          Periodic Advertising ADI support
          Connection Subrating
          Unknown features (0x0000010000000000)
< HCI Command: LE Set Host Feature (0x08|0x0074) plen 2     #15 [hci1] 0.804647
        Bit Number: 32
          Connected Isochronous Stream (Host Support)
        Bit Value: 1
> HCI Event: Command Complete (0x0e) plen 4                 #16 [hci1] 0.805052
      LE Set Host Feature (0x08|0x0074) ncmd 1
        Status: Success (0x00)
< HCI Command: LE Read Buffer v2 (0x08|0x0060) plen 0       #17 [hci1] 0.824626
> HCI Event: Command Complete (0x0e) plen 10                #18 [hci1] 0.825241
      LE Read Buffer v2 (0x08|0x0060) ncmd 1
        Status: Success (0x00)
        ACL MTU: 27
        ACL max packet: 3
        ISO MTU: 318
        ISO max packet: 3
< HCI Command: LE Read Maximum Adve.. (0x08|0x003a) plen 0  #19 [hci1] 0.844665
> HCI Event: Command Complete (0x0e) plen 6                 #20 [hci1] 0.845258
      LE Read Maximum Advertising Data Length (0x08|0x003a) ncmd 1
        Status: Success (0x00)
        Max length: 1650
< HCI Command: LE Read Supported St.. (0x08|0x001c) plen 0  #21 [hci1] 0.864642
> HCI Event: Command Complete (0x0e) plen 12                #22 [hci1] 0.865294
      LE Read Supported States (0x08|0x001c) ncmd 1
        Status: Success (0x00)
        States: 0x000003ff3e0306ff
          Non-connectable Advertising State
          Scannable Advertising State
          Connectable Advertising State
          High Duty Cycle Directed Advertising State
          Passive Scanning State
          Active Scanning State
          Initiating State
            and Connection State (Central Role)
          Connection State (Peripheral Role)
          Scannable Advertising State
            and Passive Scanning State
          Connectable Advertising State
            and Passive Scanning State
          Non-connectable Advertising State
            and Initiating State
          Scannable Advertising State
            and Initiating State
          Active Scanning State
            and Connection State (Central Role)
          Passive Scanning State
            and Connection State (Peripheral Role)
          Active Scanning State
            and Connection State (Peripheral Role)
          Initiating State
            and Connection State (Central Role)
            and Central Role & Central Role
          Low Duty Cycle Directed Advertising State
          Connectable Advertising State
            and Initiating State
            and Central Role & Peripheral Role
          High Duty Cycle Directed Advertising State
            and Initiating State
            and Central Role & Peripheral Role
          Low Duty Cycle Directed Advertising State
            and Initiating State
            and Central Role & Peripheral Role
          Connectable Advertising State
            and Connection State (Central Role)
            and Central Role & Peripheral Role
          High Duty Cycle Directed Advertising State
            and Connection State (Central Role)
            and Central Role & Peripheral Role
          Low Duty Cycle Directed Advertising State
            and Connection State (Central Role)
            and Central Role & Peripheral Role
          Connectable Advertising State
            and Connection State (Peripheral Role)
            and Central Role & Peripheral Role
          High Duty Cycle Directed Advertising State
            and Connection State (Peripheral Role)
            and Peripheral Role & Peripheral Role
          Low Duty Cycle Directed Advertising State
            and Connection State (Peripheral Role)
            and Peripheral Role & Peripheral Role
          Initiating State
            and Connection State (Peripheral Role)
            and Central Role & Peripheral Role
< HCI Command: LE Read Maximum Data.. (0x08|0x002f) plen 0  #23 [hci1] 0.884644
> HCI Event: Command Complete (0x0e) plen 12                #24 [hci1] 0.885121
      LE Read Maximum Data Length (0x08|0x002f) ncmd 1
        Status: Success (0x00)
        Max TX octets: 251
        Max TX time: 2704
        Max RX octets: 251
        Max RX time: 2704
< HCI Command: LE Write Suggested D.. (0x08|0x0024) plen 4  #25 [hci1] 0.904664
        TX octets: 251
        TX time: 2704
> HCI Event: Command Complete (0x0e) plen 4                 #26 [hci1] 0.905270
      LE Write Suggested Default Data Length (0x08|0x0024) ncmd 1
        Status: Success (0x00)
< HCI Command: LE Set Resolvable Pr.. (0x08|0x002e) plen 2  #27 [hci1] 0.924683
        Timeout: 900 seconds
> HCI Event: Command Complete (0x0e) plen 4                 #28 [hci1] 0.925196
      LE Set Resolvable Private Address Timeout (0x08|0x002e) ncmd 1
        Status: Success (0x00)
< HCI Command: LE Read Resolving Li.. (0x08|0x002a) plen 0  #29 [hci1] 0.944642
> HCI Event: Command Complete (0x0e) plen 5                 #30 [hci1] 0.945256
      LE Read Resolving List Size (0x08|0x002a) ncmd 1
        Status: Success (0x00)
        Size: 8
< HCI Command: LE Set Event Mask (0x08|0x0001) plen 8       #31 [hci1] 0.964680
        Mask: 0x000002023f87fa5e
          LE Advertising Report
          LE Connection Update Complete
          LE Read Remote Used Features Complete
          LE Long Term Key Request
          LE Data Length Change
          LE Enhanced Connection Complete
          LE PHY Update Complete
          LE Extended Advertising Report
          LE Periodic Advertising Sync Established
          LE Periodic Advertising Report
          LE Periodic Advertising Sync Lost
          LE Extended Scan Timeout
          LE Extended Advertising Set Terminated
          LE Scan Request Received
          LE Periodic Advertising Sync Transfer Rvc
          LE CIS Established
          LE CIS Request
          LE Create BIG Complete
          LE Terminate BIG Complete
          LE BIG Sync Estabilished Complete
          LE BIG Sync Lost
          LE BIG Info Advertising Report
          Unknown mask (0x0000020000000000)
> HCI Event: Command Complete (0x0e) plen 4                 #32 [hci1] 0.965239
      LE Set Event Mask (0x08|0x0001) ncmd 1
        Status: Success (0x00)
< HCI Command: Set Event Mask (0x03|0x0001) plen 8          #33 [hci1] 0.984649
        Mask: 0x2000800002008890
          Disconnection Complete
          Encryption Change
          Read Remote Version Information Complete
          Hardware Error
          Data Buffer Overflow
          Encryption Key Refresh Complete
          LE Meta
> HCI Event: Command Complete (0x0e) plen 4                 #34 [hci1] 0.985364
      Set Event Mask (0x03|0x0001) ncmd 1
        Status: Success (0x00)
< HCI Command: Read BD ADDR (0x04|0x0009) plen 0            #35 [hci1] 1.004642
> HCI Event: Command Complete (0x0e) plen 10                #36 [hci1] 1.005256
      Read BD ADDR (0x04|0x0009) ncmd 1
        Status: Success (0x00)
        Address: 00:00:00:00:00:00 (OUI 00-00-00)
< HCI Command: LE Set Random Address (0x08|0x0005) plen 6   #37 [hci1] 1.024633
        Address: D5:B6:CC:31:DB:3B (Static)
> HCI Event: Command Complete (0x0e) plen 4                 #38 [hci1] 1.025265
      LE Set Random Address (0x08|0x0005) ncmd 1
        Status: Success (0x00)
< HCI Command: LE Set Random Address (0x08|0x0005) plen 6   #39 [hci1] 1.154643
        Address: 48:61:8E:DB:C6:F9 (Resolvable)
> HCI Event: Command Complete (0x0e) plen 4                 #40 [hci1] 1.155126
      LE Set Random Address (0x08|0x0005) ncmd 1
        Status: Success (0x00)
< HCI Command: LE Set Extended Adv.. (0x08|0x0036) plen 25  #41 [hci1] 4.894692
        Handle: 0x00
        Properties: 0x0013
          Connectable
          Scannable
          Use legacy advertising PDUs: ADV_IND
        Min advertising interval: 100.000 msec (0x00a0)
        Max advertising interval: 150.000 msec (0x00f0)
        Channel map: 37, 38, 39 (0x07)
        Own address type: Random (0x01)
        Peer address type: Public (0x00)
        Peer address: 00:00:00:00:00:00 (OUI 00-00-00)
        Filter policy: Allow Scan Request from Any, Allow Connect Request from Any (0x00)
        TX power: Host has no preference (0x7f)
        Primary PHY: LE 1M (0x01)
        Secondary max skip: 0x00
        Secondary PHY: LE 1M (0x01)
        SID: 0x00
        Scan request notifications: Disabled (0x00)
> HCI Event: Command Complete (0x0e) plen 5                 #42 [hci1] 4.895436
      LE Set Extended Advertising Parameters (0x08|0x0036) ncmd 1
        Status: Success (0x00)
        TX power (selected): 0 dbm (0x00)
< HCI Command: LE Set Advertising S.. (0x08|0x0035) plen 7  #43 [hci1] 4.904668
        Advertising handle: 0x00
        Advertising random address: D5:B6:CC:31:DB:3B (Static)
> HCI Event: Command Complete (0x0e) plen 4                 #44 [hci1] 4.905260
      LE Set Advertising Set Random Address (0x08|0x0035) ncmd 1
        Status: Success (0x00)
< HCI Command: LE Set Extended Adv.. (0x08|0x0037) plen 22  #45 [hci1] 4.924697
        Handle: 0x00
        Operation: Complete extended advertising data (0x03)
        Fragment preference: Minimize fragmentation (0x01)
        Data length: 0x12
        Flags: 0x04
          BR/EDR Not Supported
        Name (complete): Tester_F6B11A
> HCI Event: Command Complete (0x0e) plen 4                 #46 [hci1] 4.925443
      LE Set Extended Advertising Data (0x08|0x0037) ncmd 1
        Status: Success (0x00)
< HCI Command: LE Set Extended Scan.. (0x08|0x0038) plen 4  #47 [hci1] 4.944634
        Handle: 0x00
        Operation: Complete scan response data (0x03)
        Fragment preference: Minimize fragmentation (0x01)
        Data length: 0x00
> HCI Event: Command Complete (0x0e) plen 4                 #48 [hci1] 4.945283
      LE Set Extended Scan Response Data (0x08|0x0038) ncmd 1
        Status: Success (0x00)
< HCI Command: LE Set Extended Adve.. (0x08|0x0039) plen 6  #49 [hci1] 4.964630
        Extended advertising: Enabled (0x01)
        Number of sets: 1 (0x01)
        Entry 0
          Handle: 0x00
          Duration: 0 ms (0x00)
          Max ext adv events: 0
> HCI Event: Command Complete (0x0e) plen 4                 #50 [hci1] 4.965362
      LE Set Extended Advertising Enable (0x08|0x0039) ncmd 1
        Status: Success (0x00)
> HCI Event: LE Meta Event (0x3e) plen 31                   #51 [hci1] 5.392804
      LE Enhanced Connection Complete (0x0a)
        Status: Success (0x00)
        Handle: 2703
        Role: Peripheral (0x01)
        Peer address type: Public (0x00)
        Peer address: DF:A9:FF:F6:B1:1A (OUI DF-A9-FF)
        Local resolvable private address: 00:00:00:00:00:00 (Non-Resolvable)
        Peer resolvable private address: 00:00:00:00:00:00 (Non-Resolvable)
        Connection interval: 87.50 msec (0x0046)
        Connection latency: 0 (0x0000)
        Supervision timeout: 20000 msec (0x07d0)
        Central clock accuracy: 0x01
> HCI Event: LE Meta Event (0x3e) plen 6                    #52 [hci1] 5.393013
      LE Advertising Set Terminated (0x12)
        Status: Success (0x00)
        Handle: 0
        Connection handle: 2703
        Number of completed extended advertising events: 0
< HCI Command: LE Read Remote Used... (0x08|0x0016) plen 2  #53 [hci1] 5.405636
        Handle: 2703 Address: DF:A9:FF:F6:B1:1A (OUI DF-A9-FF)
> HCI Event: Command Status (0x0f) plen 4                   #54 [hci1] 5.406146
      LE Read Remote Used Features (0x08|0x0016) ncmd 1
        Status: Success (0x00)
> HCI Event: LE Meta Event (0x3e) plen 12                   #55 [hci1] 5.656667
      LE Read Remote Used Features (0x04)
        Status: Success (0x00)
        Handle: 2703 Address: DF:A9:FF:F6:B1:1A (OUI DF-A9-FF)
        Features: 0x2d 0x49 0x00 0xf7 0x67 0xd9 0x00 0x80
          LE Encryption
          Extended Reject Indication
          Peripheral-initiated Features Exchange
          LE Data Packet Length Extension
          LE 2M PHY
          LE Coded PHY
          Channel Selection Algorithm #2
          Periodic Advertising Sync Transfer - Sender
          Periodic Advertising Sync Transfer - Recipient
          Sleep Clock Accuracy Updates
          Connected Isochronous Stream - Central
          Connected Isochronous Stream - Peripheral
          Isochronous Broadcaster
          Synchronized Receiver
          Connected Isochronous Stream (Host Support)
          LE Power Control Request
          LE Power Control Request
          Connection Subrating
          Connection Subrating (Host Support)
          Unknown features (0x8000d90000000000)
> ACL Data RX: Handle 2703 flags 0x02 dlen 11               #56 [hci1] 7.056438
      SMP: Pairing Request (0x01) len 6
        IO capability: KeyboardDisplay (0x04)
        OOB data: Authentication data not present (0x00)
        Authentication requirement: Bonding, MITM, SC, No Keypresses (0x0d)
        Max encryption key size: 16
        Initiator key distribution: IdKey (0x02)
        Responder key distribution: IdKey (0x02)
< HCI Command: Host Number of Compl.. (0x03|0x0035) plen 5  #57 [hci1] 7.064811
        Num handles: 1
        Handle: 2703 Address: DF:A9:FF:F6:B1:1A (OUI DF-A9-FF)
        Count: 1
< ACL Data TX: Handle 2703 flags 0x00 dlen 11               #58 [hci1] 7.064874
      SMP: Pairing Response (0x02) len 6
        IO capability: KeyboardDisplay (0x04)
        OOB data: Authentication data not present (0x00)
        Authentication requirement: Bonding, MITM, SC, No Keypresses (0x0d)
        Max encryption key size: 16
        Initiator key distribution: IdKey (0x02)
        Responder key distribution: IdKey (0x02)
> HCI Event: Number of Completed Packets (0x13) plen 5      #59 [hci1] 7.231558
        Num handles: 1
        Handle: 2703 Address: DF:A9:FF:F6:B1:1A (OUI DF-A9-FF)
        Count: 1
        #58: len 11 (0 Kb/s)
        Latency: 166 msec (166-166 msec ~166 msec)
> ACL Data RX: Handle 2703 flags 0x02 dlen 27               #60 [hci1] 7.231750
> ACL Data RX: Handle 2703 flags 0x01 dlen 27               #61 [hci1] 7.232295
> ACL Data RX: Handle 2703 flags 0x01 dlen 15               #62 [hci1] 7.232775
      SMP: Pairing Public Key (0x0c) len 64
        X: a66c3b54d06b8da24985ad03ea21e155abd5531cb7a0865256de4ad6037b283f
        Y: eaf770af42041dd682312b8ef56fcb0046620da9d8329df3c311a9be0ae7c2a7
< HCI Command: Host Number of Compl.. (0x03|0x0035) plen 5  #63 [hci1] 7.244909
        Num handles: 1
        Handle: 2703 Address: DF:A9:FF:F6:B1:1A (OUI DF-A9-FF)
        Count: 1
< HCI Command: Host Number of Compl.. (0x03|0x0035) plen 5  #64 [hci1] 7.245001
        Num handles: 1
        Handle: 2703 Address: DF:A9:FF:F6:B1:1A (OUI DF-A9-FF)
        Count: 1
< HCI Command: Host Number of Compl.. (0x03|0x0035) plen 5  #65 [hci1] 7.245108
        Num handles: 1
        Handle: 2703 Address: DF:A9:FF:F6:B1:1A (OUI DF-A9-FF)
        Count: 1
< ACL Data TX: Handle 2703 flags 0x00 dlen 27               #66 [hci1] 7.245142
< ACL Data TX: Handle 2703 flags 0x01 dlen 27               #67 [hci1] 7.245153
< ACL Data TX: Handle 2703 flags 0x01 dlen 15               #68 [hci1] 7.245155
      SMP: Pairing Public Key (0x0c) len 64
        X: 68f6ada634ce84d11617383d57f070fe3445c38b33b569efa5eb771a0dc8aea5
        Y: 83c407aaa8337331fdc418e55085d75e6c1c6e5d42f8bf9c18fb5a2a7d4f31aa
> HCI Event: Number of Completed Packets (0x13) plen 5      #69 [hci1] 7.319479
        Num handles: 1
        Handle: 2703 Address: DF:A9:FF:F6:B1:1A (OUI DF-A9-FF)
        Count: 1
        #66: len 27 (2 Kb/s)
        Latency: 74 msec (74-166 msec ~120 msec)
> HCI Event: Number of Completed Packets (0x13) plen 5      #70 [hci1] 7.320074
        Num handles: 1
        Handle: 2703 Address: DF:A9:FF:F6:B1:1A (OUI DF-A9-FF)
        Count: 1
        #67: len 27 (2 Kb/s)
        Latency: 74 msec (74-166 msec ~97 msec)
< ACL Data TX: Handle 2703 flags 0x00 dlen 21               #71 [hci1] 7.324864
      SMP: Pairing Confirm (0x03) len 16
        Confim value: f9d981ba7ec7cde2c6039746268daae1
> HCI Event: Number of Completed Packets (0x13) plen 5      #72 [hci1] 7.406313
        Num handles: 1
        Handle: 2703 Address: DF:A9:FF:F6:B1:1A (OUI DF-A9-FF)
        Count: 1
        #68: len 15 (0 Kb/s)
        Latency: 161 msec (74-166 msec ~129 msec)
> HCI Event: Number of Completed Packets (0x13) plen 5      #73 [hci1] 7.493929
        Num handles: 1
        Handle: 2703 Address: DF:A9:FF:F6:B1:1A (OUI DF-A9-FF)
        Count: 1
        #71: len 21 (0 Kb/s)
        Latency: 169 msec (74-169 msec ~149 msec)
> ACL Data RX: Handle 2703 flags 0x02 dlen 21               #74 [hci1] 7.494259
      SMP: Pairing Random (0x04) len 16
        Random value: 4434f0f69f8553a36efc73083d2772a8
< HCI Command: Host Number of Compl.. (0x03|0x0035) plen 5  #75 [hci1] 7.505663
        Num handles: 1
        Handle: 2703 Address: DF:A9:FF:F6:B1:1A (OUI DF-A9-FF)
        Count: 1
< ACL Data TX: Handle 2703 flags 0x00 dlen 21               #76 [hci1] 7.505735
      SMP: Pairing Random (0x04) len 16
        Random value: 555cc64d02679f89a05211af56d8b3da
> HCI Event: Number of Completed Packets (0x13) plen 5      #77 [hci1] 7.669067
        Num handles: 1
        Handle: 2703 Address: DF:A9:FF:F6:B1:1A (OUI DF-A9-FF)
        Count: 1
        #76: len 21 (1 Kb/s)
        Latency: 163 msec (74-169 msec ~156 msec)
> ACL Data RX: Handle 2703 flags 0x02 dlen 21               #78 [hci1] 8.106643
      SMP: Pairing DHKey Check (0x0d) len 16
        E: 10255079d2fb87a3c00ed520f75cf0c0
< HCI Command: Host Number of Compl.. (0x03|0x0035) plen 5  #79 [hci1] 8.125686
        Num handles: 1
        Handle: 2703 Address: DF:A9:FF:F6:B1:1A (OUI DF-A9-FF)
        Count: 1
< ACL Data TX: Handle 2703 flags 0x00 dlen 21               #80 [hci1] 8.125743
      SMP: Pairing DHKey Check (0x0d) len 16
        E: 76e3d00c88331e7126ed2cecdfa62d93
> HCI Event: Number of Completed Packets (0x13) plen 5      #81 [hci1] 8.281321
        Num handles: 1
        Handle: 2703 Address: DF:A9:FF:F6:B1:1A (OUI DF-A9-FF)
        Count: 1
        #80: len 21 (1 Kb/s)
        Latency: 155 msec (74-169 msec ~155 msec)
> HCI Event: LE Meta Event (0x3e) plen 13                   #82 [hci1] 8.369363
      LE Long Term Key Request (0x05)
        Handle: 2703 Address: DF:A9:FF:F6:B1:1A (OUI DF-A9-FF)
        Random number: 0x0000000000000000
        Encrypted diversifier: 0x0000
< HCI Command: LE Long Term Key Re.. (0x08|0x001a) plen 18  #83 [hci1] 8.385073
        Handle: 2703 Address: DF:A9:FF:F6:B1:1A (OUI DF-A9-FF)
        Long term key: ef1e4604e455c480c85df5144c37aa12
> HCI Event: Command Complete (0x0e) plen 6                 #84 [hci1] 8.385949
      LE Long Term Key Request Reply (0x08|0x001a) ncmd 1
        Status: Success (0x00)
        Handle: 2703 Address: DF:A9:FF:F6:B1:1A (OUI DF-A9-FF)
> HCI Event: Encryption Change (0x08) plen 4                #85 [hci1] 8.806506
        Status: Success (0x00)
        Handle: 2703 Address: DF:A9:FF:F6:B1:1A (OUI DF-A9-FF)
        Encryption: Enabled with AES-CCM (0x01)
< ACL Data TX: Handle 2703 flags 0x00 dlen 21               #86 [hci1] 8.935359
      SMP: Identity Information (0x08) len 16
        Identity resolving key: 08aad2e1be87e47b88aeb19de6889efb
< ACL Data TX: Handle 2703 flags 0x00 dlen 12               #87 [hci1] 8.935406
      SMP: Identity Address Information (0x09) len 7
        Address: D5:B6:CC:31:DB:3B (Static)
> HCI Event: Number of Completed Packets (0x13) plen 5      #88 [hci1] 8.981841
        Num handles: 1
        Handle: 2703 Address: DF:A9:FF:F6:B1:1A (OUI DF-A9-FF)
        Count: 1
        #86: len 21 (3 Kb/s)
        Latency: 46 msec (46-169 msec ~101 msec)
> HCI Event: Number of Completed Packets (0x13) plen 5      #89 [hci1] 9.068942
        Num handles: 1
        Handle: 2703 Address: DF:A9:FF:F6:B1:1A (OUI DF-A9-FF)
        Count: 1
        #87: len 12 (0 Kb/s)
        Latency: 133 msec (46-169 msec ~117 msec)
> ACL Data RX: Handle 2703 flags 0x02 dlen 21               #90 [hci1] 9.069370
      SMP: Identity Information (0x08) len 16
        Identity resolving key: 6cf0d45ffcfbbc186cdd142739e03843
< HCI Command: Host Number of Compl.. (0x03|0x0035) plen 5  #91 [hci1] 9.085326
        Num handles: 1
        Handle: 2703 Address: DF:A9:FF:F6:B1:1A (OUI DF-A9-FF)
        Count: 1
> ACL Data RX: Handle 2703 flags 0x02 dlen 12               #92 [hci1] 9.156543
      SMP: Identity Address Information (0x09) len 7
        Address: DF:A9:FF:F6:B1:1A (OUI DF-A9-FF)
< HCI Command: LE Add Device To Re.. (0x08|0x0027) plen 39  #93 [hci1] 9.164920
        Address type: Public (0x00)
        Address: DF:A9:FF:F6:B1:1A (OUI DF-A9-FF)
        Peer identity resolving key: 6cf0d45ffcfbbc186cdd142739e03843
        Local identity resolving key: 08aad2e1be87e47b88aeb19de6889efb
> HCI Event: Command Complete (0x0e) plen 4                 #94 [hci1] 9.166020
      LE Add Device To Resolving List (0x08|0x0027) ncmd 1
        Status: Success (0x00)
< HCI Command: LE Set Privacy Mode (0x08|0x004e) plen 8     #95 [hci1] 9.184842
        Peer Identity address type: Public (0x00)
        Peer Identity address: DF:A9:FF:F6:B1:1A (OUI DF-A9-FF)
        Privacy Mode: Use Device Privacy (0x01)
> HCI Event: Command Complete (0x0e) plen 4                 #96 [hci1] 9.185395
      LE Set Privacy Mode (0x08|0x004e) ncmd 1
        Status: Success (0x00)
< HCI Command: LE Set Address Resol.. (0x08|0x002d) plen 1  #97 [hci1] 9.204782
        Address resolution: Enabled (0x01)
> HCI Event: Command Complete (0x0e) plen 4                 #98 [hci1] 9.205390
      LE Set Address Resolution Enable (0x08|0x002d) ncmd 1
        Status: Success (0x00)
< HCI Command: Host Number of Compl.. (0x03|0x0035) plen 5  #99 [hci1] 9.224668
        Num handles: 1
        Handle: 2703 Address: DF:A9:FF:F6:B1:1A (OUI DF-A9-FF)
        Count: 1
< ACL Data TX: Handle 2703 flags 0x00 dlen 11              #100 [hci1] 9.224696
      ATT: Read By Type Request (0x08) len 6
        Handle range: 0x0001-0xffff
        Attribute type: Central Address Resolution (0x2aa6)
> HCI Event: Number of Completed Packets (0x13) plen 5     #101 [hci1] 9.331493
        Num handles: 1
        Handle: 2703 Address: DF:A9:FF:F6:B1:1A (OUI DF-A9-FF)
        Count: 1
        #100: len 11 (0 Kb/s)
        Latency: 106 msec (46-169 msec ~112 msec)
> ACL Data RX: Handle 2703 flags 0x02 dlen 9               #102 [hci1] 9.331693
      ATT: Read By Type Response (0x09) len 4
        Attribute data length: 3
        Attribute data list: 1 entry
        Handle: 0x000f
        Value: 01
< HCI Command: Host Number of Comp.. (0x03|0x0035) plen 5  #103 [hci1] 9.345524
        Num handles: 1
        Handle: 2703 Address: DF:A9:FF:F6:B1:1A (OUI DF-A9-FF)
        Count: 1
< ACL Data TX: Handle 2703 flags 0x00 dlen 11             #104 [hci1] 10.024814
      ATT: Read By Type Request (0x08) len 6
        Handle range: 0x0001-0x000d
        Attribute type: Characteristic (0x2803)
> HCI Event: Number of Completed Packets (0x13) plen 5    #105 [hci1] 10.118937
        Num handles: 1
        Handle: 2703 Address: DF:A9:FF:F6:B1:1A (OUI DF-A9-FF)
        Count: 1
        #104: len 11 (0 Kb/s)
        Latency: 94 msec (46-169 msec ~103 msec)
> ACL Data RX: Handle 2703 flags 0x02 dlen 27             #106 [hci1] 10.119533
      ATT: Read By Type Response (0x09) len 22
        Attribute data length: 7
        Attribute data list: 3 entries
        Handle: 0x0002
        Value: 0a0300002a
            Properties: 0x0a
              Read (0x02)
              Write (0x08)
            Value Handle: 0x0003
            Value UUID: Device Name (0x2a00)
        Handle: 0x0004
        Value: 0a0500012a
            Properties: 0x0a
              Read (0x02)
              Write (0x08)
            Value Handle: 0x0005
            Value UUID: Appearance (0x2a01)
        Handle: 0x0006
        Value: 4e07000945
            Properties: 0x4e
              Read (0x02)
              Write Without Response (0x04)
              Write (0x08)
              Authorize (0x40)
              Extended Properties (0x80)
            Value Handle: 0x0007
            Value UUID: Unknown (0x4509)
< HCI Command: Host Number of Com.. (0x03|0x0035) plen 5  #107 [hci1] 10.124850
        Num handles: 1
        Handle: 2703 Address: DF:A9:FF:F6:B1:1A (OUI DF-A9-FF)
        Count: 1
< ACL Data TX: Handle 2703 flags 0x00 dlen 11             #108 [hci1] 10.124939
      ATT: Read By Type Request (0x08) len 6
        Handle range: 0x0007-0x000d
        Attribute type: Characteristic (0x2803)
> HCI Event: Number of Completed Packets (0x13) plen 5    #109 [hci1] 10.293980
        Num handles: 1
        Handle: 2703 Address: DF:A9:FF:F6:B1:1A (OUI DF-A9-FF)
        Count: 1
        #108: len 11 (0 Kb/s)
        Latency: 169 msec (46-169 msec ~136 msec)
> ACL Data RX: Handle 2703 flags 0x02 dlen 20             #110 [hci1] 10.294259
      ATT: Read By Type Response (0x09) len 15
        Attribute data length: 7
        Attribute data list: 2 entries
        Handle: 0x0008
        Value: 020900042a
            Properties: 0x02
              Read (0x02)
            Value Handle: 0x0009
            Value UUID: Peripheral Preferred Connection Parameters (0x2a04)
        Handle: 0x000a
        Value: 320b00192a
            Properties: 0x32
              Read (0x02)
              Notify (0x10)
              Indicate (0x20)
            Value Handle: 0x000b
            Value UUID: Battery Level (0x2a19)
< HCI Command: Host Number of Com.. (0x03|0x0035) plen 5  #111 [hci1] 10.304867
        Num handles: 1
        Handle: 2703 Address: DF:A9:FF:F6:B1:1A (OUI DF-A9-FF)
        Count: 1
< ACL Data TX: Handle 2703 flags 0x00 dlen 11             #112 [hci1] 10.304892
      ATT: Read By Type Request (0x08) len 6
        Handle range: 0x000b-0x000d
        Attribute type: Characteristic (0x2803)
< ACL Data TX: Handle 2703 flags 0x00 dlen 16             #113 [hci1] 10.414701
      LE L2CAP: Connection Parameter Update Request (0x12) ident 1 len 8
        Min interval: 24
        Max interval: 40
        Peripheral latency: 0
        Timeout multiplier: 42
> HCI Event: Number of Completed Packets (0x13) plen 5    #114 [hci1] 10.468863
        Num handles: 1
        Handle: 2703 Address: DF:A9:FF:F6:B1:1A (OUI DF-A9-FF)
        Count: 1
        #112: len 11 (0 Kb/s)
        Latency: 163 msec (46-169 msec ~150 msec)
> ACL Data RX: Handle 2703 flags 0x02 dlen 9              #115 [hci1] 10.468972
      ATT: Error Response (0x01) len 4
        Read By Type Request (0x08)
        Handle: 0x000b
        Error: Attribute Not Found (0x0a)
< HCI Command: Host Number of Com.. (0x03|0x0035) plen 5  #116 [hci1] 10.484959
        Num handles: 1
        Handle: 2703 Address: DF:A9:FF:F6:B1:1A (OUI DF-A9-FF)
        Count: 1
< ACL Data TX: Handle 2703 flags 0x00 dlen 9              #117 [hci1] 10.484975
      ATT: Write Request (0x12) len 4
        Handle: 0x000d
          Data: 0200
> HCI Event: Number of Completed Packets (0x13) plen 5    #118 [hci1] 10.556368
        Num handles: 1
        Handle: 2703 Address: DF:A9:FF:F6:B1:1A (OUI DF-A9-FF)
        Count: 1
        #113: len 16 (0 Kb/s)
        Latency: 141 msec (46-169 msec ~145 msec)
> ACL Data RX: Handle 2703 flags 0x02 dlen 10             #119 [hci1] 10.556486
      LE L2CAP: Connection Parameter Update Response (0x13) ident 1 len 2
        Result: Connection Parameters accepted (0x0000)
< HCI Command: Host Number of Com.. (0x03|0x0035) plen 5  #120 [hci1] 10.564901
        Num handles: 1
        Handle: 2703 Address: DF:A9:FF:F6:B1:1A (OUI DF-A9-FF)
        Count: 1
> HCI Event: Number of Completed Packets (0x13) plen 5    #121 [hci1] 10.643963
        Num handles: 1
        Handle: 2703 Address: DF:A9:FF:F6:B1:1A (OUI DF-A9-FF)
        Count: 1
        #117: len 9 (0 Kb/s)
        Latency: 158 msec (46-169 msec ~152 msec)
> ACL Data RX: Handle 2703 flags 0x02 dlen 5              #122 [hci1] 10.644048
      ATT: Write Response (0x13) len 0
< HCI Command: Host Number of Com.. (0x03|0x0035) plen 5  #123 [hci1] 10.645201
        Num handles: 1
        Handle: 2703 Address: DF:A9:FF:F6:B1:1A (OUI DF-A9-FF)
        Count: 1
> HCI Event: Disconnect Complete (0x05) plen 4            #124 [hci1] 11.869000
        Status: Success (0x00)
        Handle: 2703 Address: DF:A9:FF:F6:B1:1A (OUI DF-A9-FF)
        Reason: Remote User Terminated Connection (0x13)
< HCI Command: LE Set Extended A.. (0x08|0x0036) plen 25  #125 [hci1] 12.544831
        Handle: 0x00
        Properties: 0x0013
          Connectable
          Scannable
          Use legacy advertising PDUs: ADV_IND
        Min advertising interval: 100.000 msec (0x00a0)
        Max advertising interval: 150.000 msec (0x00f0)
        Channel map: 37, 38, 39 (0x07)
        Own address type: Random (0x01)
        Peer address type: Public (0x00)
        Peer address: 00:00:00:00:00:00 (OUI 00-00-00)
        Filter policy: Allow Scan Request from Any, Allow Connect Request from Any (0x00)
        TX power: Host has no preference (0x7f)
        Primary PHY: LE 1M (0x01)
        Secondary max skip: 0x00
        Secondary PHY: LE 1M (0x01)
        SID: 0x00
        Scan request notifications: Disabled (0x00)
> HCI Event: Command Complete (0x0e) plen 5               #126 [hci1] 12.545745
      LE Set Extended Advertising Parameters (0x08|0x0036) ncmd 1
        Status: Success (0x00)
        TX power (selected): 0 dbm (0x00)
< HCI Command: LE Set Advertising.. (0x08|0x0035) plen 7  #127 [hci1] 12.564774
        Advertising handle: 0x00
        Advertising random address: D5:B6:CC:31:DB:3B (Static)
> HCI Event: Command Complete (0x0e) plen 4               #128 [hci1] 12.565298
      LE Set Advertising Set Random Address (0x08|0x0035) ncmd 1
        Status: Success (0x00)
< HCI Command: LE Set Extended A.. (0x08|0x0037) plen 22  #129 [hci1] 12.584741
        Handle: 0x00
        Operation: Complete extended advertising data (0x03)
        Fragment preference: Minimize fragmentation (0x01)
        Data length: 0x12
        Flags: 0x04
          BR/EDR Not Supported
        Name (complete): Tester_F6B11A
> HCI Event: Command Complete (0x0e) plen 4               #130 [hci1] 12.585556
      LE Set Extended Advertising Data (0x08|0x0037) ncmd 1
        Status: Success (0x00)
< HCI Command: LE Set Extended Sc.. (0x08|0x0038) plen 4  #131 [hci1] 12.604742
        Handle: 0x00
        Operation: Complete scan response data (0x03)
        Fragment preference: Minimize fragmentation (0x01)
        Data length: 0x00
> HCI Event: Command Complete (0x0e) plen 4               #132 [hci1] 12.605174
      LE Set Extended Scan Response Data (0x08|0x0038) ncmd 1
        Status: Success (0x00)
< HCI Command: LE Set Extended Ad.. (0x08|0x0039) plen 6  #133 [hci1] 12.624823
        Extended advertising: Enabled (0x01)
        Number of sets: 1 (0x01)
        Entry 0
          Handle: 0x00
          Duration: 0 ms (0x00)
          Max ext adv events: 0
> HCI Event: Command Complete (0x0e) plen 4               #134 [hci1] 12.625419
      LE Set Extended Advertising Enable (0x08|0x0039) ncmd 1
        Status: Success (0x00)
> HCI Event: LE Meta Event (0x3e) plen 31                 #135 [hci1] 12.949942
      LE Enhanced Connection Complete (0x0a)
        Status: Success (0x00)
        Handle: 2721
        Role: Peripheral (0x01)
        Peer address type: Public (0x00)
        Peer address: DF:A9:FF:F6:B1:1A (OUI DF-A9-FF)
        Local resolvable private address: 00:00:00:00:00:00 (Non-Resolvable)
        Peer resolvable private address: 00:00:00:00:00:00 (Non-Resolvable)
        Connection interval: 87.50 msec (0x0046)
        Connection latency: 0 (0x0000)
        Supervision timeout: 20000 msec (0x07d0)
        Central clock accuracy: 0x01
> HCI Event: LE Meta Event (0x3e) plen 6                  #136 [hci1] 12.949982
      LE Advertising Set Terminated (0x12)
        Status: Success (0x00)
        Handle: 0
        Connection handle: 2721
        Number of completed extended advertising events: 0
< HCI Command: LE Read Remote Use.. (0x08|0x0016) plen 2  #137 [hci1] 12.965773
        Handle: 2721 Address: DF:A9:FF:F6:B1:1A (OUI DF-A9-FF)
> HCI Event: Command Status (0x0f) plen 4                 #138 [hci1] 12.966323
      LE Read Remote Used Features (0x08|0x0016) ncmd 1
        Status: Success (0x00)
> HCI Event: LE Meta Event (0x3e) plen 12                 #139 [hci1] 13.213747
      LE Read Remote Used Features (0x04)
        Status: Success (0x00)
        Handle: 2721 Address: DF:A9:FF:F6:B1:1A (OUI DF-A9-FF)
        Features: 0x2d 0x49 0x00 0xf7 0x67 0xd9 0x00 0x80
          LE Encryption
          Extended Reject Indication
          Peripheral-initiated Features Exchange
          LE Data Packet Length Extension
          LE 2M PHY
          LE Coded PHY
          Channel Selection Algorithm #2
          Periodic Advertising Sync Transfer - Sender
          Periodic Advertising Sync Transfer - Recipient
          Sleep Clock Accuracy Updates
          Connected Isochronous Stream - Central
          Connected Isochronous Stream - Peripheral
          Isochronous Broadcaster
          Synchronized Receiver
          Connected Isochronous Stream (Host Support)
          LE Power Control Request
          LE Power Control Request
          Connection Subrating
          Connection Subrating (Host Support)
          Unknown features (0x8000d90000000000)
> ACL Data RX: Handle 2721 flags 0x02 dlen 8              #140 [hci1] 13.650943
      ATT: Handle Value Indication (0x1d) len 3
        Handle: 0x000b
          Data: 63
< HCI Command: Host Number of Com.. (0x03|0x0035) plen 5  #141 [hci1] 13.665204
        Num handles: 1
        Handle: 2721 Address: DF:A9:FF:F6:B1:1A (OUI DF-A9-FF)
        Count: 1
< ACL Data TX: Handle 2721 flags 0x00 dlen 5              #142 [hci1] 13.665316
      ATT: Handle Value Confirmation (0x1e) len 0
> HCI Event: Number of Completed Packets (0x13) plen 5    #143 [hci1] 13.827008
        Num handles: 1
        Handle: 2721 Address: DF:A9:FF:F6:B1:1A (OUI DF-A9-FF)
        Count: 1
        #142: len 5 (0 Kb/s)
        Latency: 161 msec (161-161 msec ~161 msec)
< ACL Data TX: Handle 2721 flags 0x00 dlen 16             #144 [hci1] 17.974897
      LE L2CAP: Connection Parameter Update Request (0x12) ident 2 len 8
        Min interval: 24
        Max interval: 40
        Peripheral latency: 0
        Timeout multiplier: 42
> HCI Event: Number of Completed Packets (0x13) plen 5    #145 [hci1] 18.113443
        Num handles: 1
        Handle: 2721 Address: DF:A9:FF:F6:B1:1A (OUI DF-A9-FF)
        Count: 1
        #144: len 16 (0 Kb/s)
        Latency: 138 msec (138-161 msec ~150 msec)
> ACL Data RX: Handle 2721 flags 0x02 dlen 10             #146 [hci1] 18.113648
      LE L2CAP: Connection Parameter Update Response (0x13) ident 2 len 2
        Result: Connection Parameters accepted (0x0000)
< HCI Command: Host Number of Com.. (0x03|0x0035) plen 5  #147 [hci1] 18.125264
        Num handles: 1
        Handle: 2721 Address: DF:A9:FF:F6:B1:1A (OUI DF-A9-FF)
        Count: 1
> HCI Event: LE Meta Event (0x3e) plen 13                 #148 [hci1] 19.863878
      LE Long Term Key Request (0x05)
        Handle: 2721 Address: DF:A9:FF:F6:B1:1A (OUI DF-A9-FF)
        Random number: 0x0000000000000000
        Encrypted diversifier: 0x0000
< HCI Command: LE Long Term Key... (0x08|0x001a) plen 18  #149 [hci1] 19.864938
        Handle: 2721 Address: DF:A9:FF:F6:B1:1A (OUI DF-A9-FF)
        Long term key: ef1e4604e455c480c85df5144c37aa12
> HCI Event: Command Complete (0x0e) plen 6               #150 [hci1] 19.865664
      LE Long Term Key Request Reply (0x08|0x001a) ncmd 1
        Status: Success (0x00)
        Handle: 2721 Address: DF:A9:FF:F6:B1:1A (OUI DF-A9-FF)
> HCI Event: Encryption Change (0x08) plen 4              #151 [hci1] 20.300997
        Status: Success (0x00)
        Handle: 2721 Address: DF:A9:FF:F6:B1:1A (OUI DF-A9-FF)
        Encryption: Enabled with AES-CCM (0x01)
< ACL Data TX: Handle 2721 flags 0x00 dlen 9              #152 [hci1] 20.305563
      ATT: Write Request (0x12) len 4
        Handle: 0x000d
          Data: 0200
> ACL Data RX: Handle 2721 flags 0x02 dlen 8              #153 [hci1] 20.388351
      ATT: Handle Value Indication (0x1d) len 3
        Handle: 0x000b
          Data: 62
< HCI Command: Host Number of Com.. (0x03|0x0035) plen 5  #154 [hci1] 20.405448
        Num handles: 1
        Handle: 2721 Address: DF:A9:FF:F6:B1:1A (OUI DF-A9-FF)
        Count: 1
< ACL Data TX: Handle 2721 flags 0x00 dlen 5              #155 [hci1] 20.405582
      ATT: Handle Value Confirmation (0x1e) len 0
> HCI Event: Number of Completed Packets (0x13) plen 5    #156 [hci1] 20.475787
        Num handles: 1
        Handle: 2721 Address: DF:A9:FF:F6:B1:1A (OUI DF-A9-FF)
        Count: 1
        #152: len 9 (0 Kb/s)
        Latency: 170 msec (138-170 msec ~160 msec)
> ACL Data RX: Handle 2721 flags 0x02 dlen 5              #157 [hci1] 20.475947
      ATT: Write Response (0x13) len 0
< HCI Command: Host Number of Com.. (0x03|0x0035) plen 5  #158 [hci1] 20.485473
        Num handles: 1
        Handle: 2721 Address: DF:A9:FF:F6:B1:1A (OUI DF-A9-FF)
        Count: 1
> HCI Event: Number of Completed Packets (0x13) plen 5    #159 [hci1] 20.563229
        Num handles: 1
        Handle: 2721 Address: DF:A9:FF:F6:B1:1A (OUI DF-A9-FF)
        Count: 1
        #155: len 5 (0 Kb/s)
        Latency: 157 msec (138-170 msec ~158 msec)
> HCI Event: Disconnect Complete (0x05) plen 4            #160 [hci1] 52.238018
        Status: Success (0x00)
        Handle: 2721 Address: DF:A9:FF:F6:B1:1A (OUI DF-A9-FF)
        Reason: Remote User Terminated Connection (0x13)
< HCI Command: Reset (0x03|0x0003) plen 0                 #161 [hci1] 57.845307
> HCI Event: Command Complete (0x0e) plen 4               #162 [hci1] 57.845872
      Reset (0x03|0x0003) ncmd 1
        Status: Success (0x00)
@ USER Close: main                                    {0x0001} [hci1] 57.865213
= Close Index: 00:00:00:00:00:00                               [hci1] 57.865221
