Bluetooth monitor ver 5.72
= Note: Linux version 6.14.0-36-generic (x86_64)                       0.073859
= Note: Bluetooth subsystem version 2.22                               0.073861
= New Index: 00:00:00:00:00:00 (Primary,UART,hci1)              [hci1] 0.073862
= New Index: 48:5F:99:8E:E0:64 (Primary,USB,hci0)               [hci0] 0.073863
= Open Index: 00:00:00:00:00:00                                 [hci1] 0.187051
= Index Info: 00:00:00:00:00:00 (Nordic Semiconductor ASA)      [hci1] 0.187056
@ USER Open: main (privileged) version 2.22            {0x0001} [hci1] 0.187059
< HCI Command: Reset (0x03|0x0003) plen 0                    #1 [hci1] 0.187445
> HCI Event: Command Complete (0x0e) plen 4                  #2 [hci1] 0.188005
      Reset (0x03|0x0003) ncmd 1
        Status: Success (0x00)
< HCI Command: Read Local Supported... (0x04|0x0003) plen 0  #3 [hci1] 0.207058
> HCI Event: Command Complete (0x0e) plen 12                 #4 [hci1] 0.207518
      Read Local Supported Features (0x04|0x0003) ncmd 1
        Status: Success (0x00)
        Features: 0x00 0x00 0x00 0x00 0x60 0x00 0x00 0x00
          BR/EDR Not Supported
          LE Supported (Controller)
< HCI Command: Read Local Version In.. (0x04|0x0001) plen 0  #5 [hci1] 0.227068
> HCI Event: Command Complete (0x0e) plen 12                 #6 [hci1] 0.227607
      Read Local Version Information (0x04|0x0001) ncmd 1
        Status: Success (0x00)
        HCI version: Reserved (0x0f) - Revision 12393 (0x3069)
        LMP version: Reserved (0x0f) - Subversion 12393 (0x3069)
        Manufacturer: Nordic Semiconductor ASA (89)
< HCI Command: Read Local Supported... (0x04|0x0002) plen 0  #7 [hci1] 0.247070
> HCI Event: Command Complete (0x0e) plen 68                 #8 [hci1] 0.248185
      Read Local Supported Commands (0x04|0x0002) ncmd 1
        Status: Success (0x00)
        Commands: 119 entries
          Disconnect (Octet 0 - Bit 5)
          Read Remote Version Information (Octet 2 - Bit 7)
          Set Event Mask (Octet 5 - Bit 6)
          Reset (Octet 5 - Bit 7)
          Read Connection Accept Timeout (Octet 7 - Bit 2)
          Write Connection Accept Timeout (Octet 7 - Bit 3)
          Read Transmit Power Level (Octet 10 - Bit 2)
          Set Controller To Host Flow Control (Octet 10 - Bit 5)
          Host Buffer Size (Octet 10 - Bit 6)
          Host Number of Completed Packets (Octet 10 - Bit 7)
          Read Local Version Information (Octet 14 - Bit 3)
          Read Local Supported Features (Octet 14 - Bit 5)
          Read BD ADDR (Octet 15 - Bit 1)
          Read RSSI (Octet 15 - Bit 5)
          Set Event Mask Page 2 (Octet 22 - Bit 2)
          LE Set Event Mask (Octet 25 - Bit 0)
          LE Read Buffer Size (Octet 25 - Bit 1)
          LE Read Local Supported Features (Octet 25 - Bit 2)
          LE Set Random Address (Octet 25 - Bit 4)
          LE Set Advertising Parameters (Octet 25 - Bit 5)
          LE Read Advertising Channel TX Power (Octet 25 - Bit 6)
          LE Set Advertising Data (Octet 25 - Bit 7)
          LE Set Scan Response Data (Octet 26 - Bit 0)
          LE Set Advertise Enable (Octet 26 - Bit 1)
          LE Set Scan Parameters (Octet 26 - Bit 2)
          LE Set Scan Enable (Octet 26 - Bit 3)
          LE Create Connection (Octet 26 - Bit 4)
          LE Create Connection Cancel (Octet 26 - Bit 5)
          LE Read Accept List Size (Octet 26 - Bit 6)
          LE Clear Accept List (Octet 26 - Bit 7)
          LE Add Device To Accept List (Octet 27 - Bit 0)
          LE Remove Device From Accept List (Octet 27 - Bit 1)
          LE Connection Update (Octet 27 - Bit 2)
          LE Set Host Channel Classification (Octet 27 - Bit 3)
          LE Read Channel Map (Octet 27 - Bit 4)
          LE Read Remote Used Features (Octet 27 - Bit 5)
          LE Encrypt (Octet 27 - Bit 6)
          LE Rand (Octet 27 - Bit 7)
          LE Start Encryption (Octet 28 - Bit 0)
          LE Long Term Key Request Reply (Octet 28 - Bit 1)
          LE Long Term Key Request Neg Reply (Octet 28 - Bit 2)
          LE Read Supported States (Octet 28 - Bit 3)
          LE Receiver Test (Octet 28 - Bit 4)
          LE Transmitter Test (Octet 28 - Bit 5)
          LE Test End (Octet 28 - Bit 6)
          Read Authenticated Payload Timeout (Octet 32 - Bit 4)
          Write Authenticated Payload Timeout (Octet 32 - Bit 5)
          LE Set Data Length (Octet 33 - Bit 6)
          LE Read Suggested Default Data Length (Octet 33 - Bit 7)
          LE Write Suggested Default Data Length (Octet 34 - Bit 0)
          LE Add Device To Resolving List (Octet 34 - Bit 3)
          LE Remove Device From Resolving List (Octet 34 - Bit 4)
          LE Clear Resolving List (Octet 34 - Bit 5)
          LE Read Resolving List Size (Octet 34 - Bit 6)
          LE Set Address Resolution Enable (Octet 35 - Bit 1)
          LE Set Resolvable Private Address Timeout (Octet 35 - Bit 2)
          LE Read Maximum Data Length (Octet 35 - Bit 3)
          LE Read PHY (Octet 35 - Bit 4)
          LE Set Default PHY (Octet 35 - Bit 5)
          LE Set PHY (Octet 35 - Bit 6)
          LE Enhanced Receiver Test (Octet 35 - Bit 7)
          LE Enhanced Transmitter Test (Octet 36 - Bit 0)
          LE Set Advertising Set Random Address (Octet 36 - Bit 1)
          LE Set Extended Advertising Parameters (Octet 36 - Bit 2)
          LE Set Extended Advertising Data (Octet 36 - Bit 3)
          LE Set Extended Scan Response Data (Octet 36 - Bit 4)
          LE Set Extended Advertising Enable (Octet 36 - Bit 5)
          LE Read Maximum Advertising Data Length (Octet 36 - Bit 6)
          LE Read Number of Supported Advertising Sets (Octet 36 - Bit 7)
          LE Remove Advertising Set (Octet 37 - Bit 0)
          LE Clear Advertising Sets (Octet 37 - Bit 1)
          LE Set Periodic Advertising Parameters (Octet 37 - Bit 2)
          LE Set Periodic Advertising Data (Octet 37 - Bit 3)
          LE Set Periodic Advertising Enable (Octet 37 - Bit 4)
          LE Set Extended Scan Parameters (Octet 37 - Bit 5)
          LE Set Extended Scan Enable (Octet 37 - Bit 6)
          LE Extended Create Connection (Octet 37 - Bit 7)
          LE Periodic Advertising Create Sync (Octet 38 - Bit 0)
          LE Periodic Advertising Create Sync Cancel (Octet 38 - Bit 1)
          LE Periodic Advertising Terminate Sync (Octet 38 - Bit 2)
          LE Add Device To Periodic Advertiser List (Octet 38 - Bit 3)
          LE Remove Device From Periodic Advertiser List (Octet 38 - Bit 4)
          LE Clear Periodic Advertiser List (Octet 38 - Bit 5)
          LE Read Periodic Advertiser List Size (Octet 38 - Bit 6)
          LE Read Transmit Power (Octet 38 - Bit 7)
          LE Read RF Path Compensation (Octet 39 - Bit 0)
          LE Write RF Path Compensation (Octet 39 - Bit 1)
          LE Set Privacy Mode (Octet 39 - Bit 2)
          LE Periodic Advertising Receive Enable (Octet 40 - Bit 5)
          LE Periodic Advertising Sync Transfer (Octet 40 - Bit 6)
          LE Periodic Advertising Set Info Transfer (Octet 40 - Bit 7)
          LE Periodic Advertising Sync Transfer Parameters (Octet 41 - Bit 0)
          LE Set Default Periodic Advertisng Sync Transfer Parameters (Octet 41 - Bit 1)
          LE Read Buffer v2 (Octet 41 - Bit 5)
          LE Read ISO TX Sync (Octet 41 - Bit 6)
          LE Set Connected Isochronous Group Parameters (Octet 41 - Bit 7)
          LE Set Connected Isochronous Group Parameters Test (Octet 42 - Bit 0)
          LE Create Connected Isochronous Stream (Octet 42 - Bit 1)
          LE Remove Connected Isochronous Group (Octet 42 - Bit 2)
          LE Accept Connected Isochronous Stream Request (Octet 42 - Bit 3)
          LE Reject Connected Isochronous Stream Request (Octet 42 - Bit 4)
          LE Create Broadcast Isochronous Group (Octet 42 - Bit 5)
          LE Create Broadcast Isochronous Group Test (Octet 42 - Bit 6)
          LE Terminate Broadcast Isochronous Group (Octet 42 - Bit 7)
          LE Broadcast Isochronous Group Create Sync (Octet 43 - Bit 0)
          LE Broadcast Isochronous Group Terminate Sync (Octet 43 - Bit 1)
          LE Request Peer SCA (Octet 43 - Bit 2)
          LE Setup Isochronous Data Path (Octet 43 - Bit 3)
          LE Remove Isochronous Data Path (Octet 43 - Bit 4)
          LE Isochronous Transmit Test (Octet 43 - Bit 5)
          LE Isochronous Receive Test (Octet 43 - Bit 6)
          LE Isochronous Read Test Counters (Octet 43 - Bit 7)
          LE Isochronous Read Test Counters (Octet 44 - Bit 0)
          LE Set Host Feature (Octet 44 - Bit 1)
          Octet 44 - Bit 2 
          Octet 45 - Bit 6 
          Octet 46 - Bit 0 
          Octet 46 - Bit 1 
          Octet 46 - Bit 2 
< HCI Command: Host Buffer Size (0x03|0x0033) plen 7         #9 [hci1] 0.267060
        ACL MTU: 255  ACL max packet: 16
        SCO MTU: 0    SCO max packet: 0
> HCI Event: Command Complete (0x0e) plen 4                 #10 [hci1] 0.267664
      Host Buffer Size (0x03|0x0033) ncmd 1
        Status: Success (0x00)
< HCI Command: Set Controller To Ho.. (0x03|0x0031) plen 1  #11 [hci1] 0.287054
        Flow control: ACL Data Packets (0x01)
> HCI Event: Command Complete (0x0e) plen 4                 #12 [hci1] 0.287467
      Set Controller To Host Flow Control (0x03|0x0031) ncmd 1
        Status: Success (0x00)
< HCI Command: LE Read Local Suppor.. (0x08|0x0003) plen 0  #13 [hci1] 0.307053
> HCI Event: Command Complete (0x0e) plen 12                #14 [hci1] 0.307489
      LE Read Local Supported Features (0x08|0x0003) ncmd 1
        Status: Success (0x00)
        Features: 0xfd 0x79 0x00 0xf7 0x30 0x01 0x00 0x00
          LE Encryption
          Extended Reject Indication
          Peripheral-initiated Features Exchange
          LE Ping
          LE Data Packet Length Extension
          LL Privacy
          Extended Scanner Filter Policies
          LE 2M PHY
          LE Coded PHY
          LE Extended Advertising
          LE Periodic Advertising
          Channel Selection Algorithm #2
          Periodic Advertising Sync Transfer - Sender
          Periodic Advertising Sync Transfer - Recipient
          Sleep Clock Accuracy Updates
          Connected Isochronous Stream - Central
          Connected Isochronous Stream - Peripheral
          Isochronous Broadcaster
          Synchronized Receiver
          Periodic Advertising ADI support
          Connection Subrating
          Unknown features (0x0000010000000000)
< HCI Command: LE Set Host Feature (0x08|0x0074) plen 2     #15 [hci1] 0.327049
        Bit Number: 32
          Connected Isochronous Stream (Host Support)
        Bit Value: 1
> HCI Event: Command Complete (0x0e) plen 4                 #16 [hci1] 0.327526
      LE Set Host Feature (0x08|0x0074) ncmd 1
        Status: Success (0x00)
< HCI Command: LE Read Buffer v2 (0x08|0x0060) plen 0       #17 [hci1] 0.347059
> HCI Event: Command Complete (0x0e) plen 10                #18 [hci1] 0.347531
      LE Read Buffer v2 (0x08|0x0060) ncmd 1
        Status: Success (0x00)
        ACL MTU: 27
        ACL max packet: 3
        ISO MTU: 318
        ISO max packet: 3
< HCI Command: LE Read Maximum Adve.. (0x08|0x003a) plen 0  #19 [hci1] 0.367049
> HCI Event: Command Complete (0x0e) plen 6                 #20 [hci1] 0.367526
      LE Read Maximum Advertising Data Length (0x08|0x003a) ncmd 1
        Status: Success (0x00)
        Max length: 1650
< HCI Command: LE Read Supported St.. (0x08|0x001c) plen 0  #21 [hci1] 0.387065
> HCI Event: Command Complete (0x0e) plen 12                #22 [hci1] 0.387575
      LE Read Supported States (0x08|0x001c) ncmd 1
        Status: Success (0x00)
        States: 0x000003ff3e0306ff
          Non-connectable Advertising State
          Scannable Advertising State
          Connectable Advertising State
          High Duty Cycle Directed Advertising State
          Passive Scanning State
          Active Scanning State
          Initiating State
            and Connection State (Central Role)
          Connection State (Peripheral Role)
          Scannable Advertising State
            and Passive Scanning State
          Connectable Advertising State
            and Passive Scanning State
          Non-connectable Advertising State
            and Initiating State
          Scannable Advertising State
            and Initiating State
          Active Scanning State
            and Connection State (Central Role)
          Passive Scanning State
            and Connection State (Peripheral Role)
          Active Scanning State
            and Connection State (Peripheral Role)
          Initiating State
            and Connection State (Central Role)
            and Central Role & Central Role
          Low Duty Cycle Directed Advertising State
          Connectable Advertising State
            and Initiating State
            and Central Role & Peripheral Role
          High Duty Cycle Directed Advertising State
            and Initiating State
            and Central Role & Peripheral Role
          Low Duty Cycle Directed Advertising State
            and Initiating State
            and Central Role & Peripheral Role
          Connectable Advertising State
            and Connection State (Central Role)
            and Central Role & Peripheral Role
          High Duty Cycle Directed Advertising State
            and Connection State (Central Role)
            and Central Role & Peripheral Role
          Low Duty Cycle Directed Advertising State
            and Connection State (Central Role)
            and Central Role & Peripheral Role
          Connectable Advertising State
            and Connection State (Peripheral Role)
            and Central Role & Peripheral Role
          High Duty Cycle Directed Advertising State
            and Connection State (Peripheral Role)
            and Peripheral Role & Peripheral Role
          Low Duty Cycle Directed Advertising State
            and Connection State (Peripheral Role)
            and Peripheral Role & Peripheral Role
          Initiating State
            and Connection State (Peripheral Role)
            and Central Role & Peripheral Role
< HCI Command: LE Read Maximum Data.. (0x08|0x002f) plen 0  #23 [hci1] 0.407057
> HCI Event: Command Complete (0x0e) plen 12                #24 [hci1] 0.407536
      LE Read Maximum Data Length (0x08|0x002f) ncmd 1
        Status: Success (0x00)
        Max TX octets: 251
        Max TX time: 2704
        Max RX octets: 251
        Max RX time: 2704
< HCI Command: LE Write Suggested D.. (0x08|0x0024) plen 4  #25 [hci1] 0.427065
        TX octets: 251
        TX time: 2704
> HCI Event: Command Complete (0x0e) plen 4                 #26 [hci1] 0.427586
      LE Write Suggested Default Data Length (0x08|0x0024) ncmd 1
        Status: Success (0x00)
< HCI Command: LE Read Resolving Li.. (0x08|0x002a) plen 0  #27 [hci1] 0.447042
> HCI Event: Command Complete (0x0e) plen 5                 #28 [hci1] 0.447500
      LE Read Resolving List Size (0x08|0x002a) ncmd 1
        Status: Success (0x00)
        Size: 8
< HCI Command: LE Set Event Mask (0x08|0x0001) plen 8       #29 [hci1] 0.467073
        Mask: 0x000002023f87fa5e
          LE Advertising Report
          LE Connection Update Complete
          LE Read Remote Used Features Complete
          LE Long Term Key Request
          LE Data Length Change
          LE Enhanced Connection Complete
          LE PHY Update Complete
          LE Extended Advertising Report
          LE Periodic Advertising Sync Established
          LE Periodic Advertising Report
          LE Periodic Advertising Sync Lost
          LE Extended Scan Timeout
          LE Extended Advertising Set Terminated
          LE Scan Request Received
          LE Periodic Advertising Sync Transfer Rvc
          LE CIS Established
          LE CIS Request
          LE Create BIG Complete
          LE Terminate BIG Complete
          LE BIG Sync Estabilished Complete
          LE BIG Sync Lost
          LE BIG Info Advertising Report
          Unknown mask (0x0000020000000000)
> HCI Event: Command Complete (0x0e) plen 4                 #30 [hci1] 0.467563
      LE Set Event Mask (0x08|0x0001) ncmd 1
        Status: Success (0x00)
< HCI Command: Set Event Mask (0x03|0x0001) plen 8          #31 [hci1] 0.487054
        Mask: 0x2000800002008890
          Disconnection Complete
          Encryption Change
          Read Remote Version Information Complete
          Hardware Error
          Data Buffer Overflow
          Encryption Key Refresh Complete
          LE Meta
> HCI Event: Command Complete (0x0e) plen 4                 #32 [hci1] 0.487564
      Set Event Mask (0x03|0x0001) ncmd 1
        Status: Success (0x00)
< HCI Command: Read BD ADDR (0x04|0x0009) plen 0            #33 [hci1] 0.507058
> HCI Event: Command Complete (0x0e) plen 10                #34 [hci1] 0.507507
      Read BD ADDR (0x04|0x0009) ncmd 1
        Status: Success (0x00)
        Address: 00:00:00:00:00:00 (OUI 00-00-00)
< HCI Command: LE Set Random Address (0x08|0x0005) plen 6   #35 [hci1] 0.527069
        Address: D5:B6:CC:31:DB:3B (Static)
> HCI Event: Command Complete (0x0e) plen 4                 #36 [hci1] 0.527469
      LE Set Random Address (0x08|0x0005) ncmd 1
        Status: Success (0x00)
< HCI Command: LE Set Random Address (0x08|0x0005) plen 6   #37 [hci1] 3.327124
        Address: 26:66:F9:08:61:8E (Non-Resolvable)
> HCI Event: Command Complete (0x0e) plen 4                 #38 [hci1] 3.327699
      LE Set Random Address (0x08|0x0005) ncmd 1
        Status: Success (0x00)
< HCI Command: LE Set Extended Scan.. (0x08|0x0041) plen 8  #39 [hci1] 3.347082
        Own address type: Random (0x01)
        Filter policy: Accept all advertisement (0x00)
        PHYs: 0x01
        Entry 0: LE 1M
          Type: Active (0x01)
          Interval: 60.000 msec (0x0060)
          Window: 30.000 msec (0x0030)
> HCI Event: Command Complete (0x0e) plen 4                 #40 [hci1] 3.347612
      LE Set Extended Scan Parameters (0x08|0x0041) ncmd 1
        Status: Success (0x00)
< HCI Command: LE Set Extended Scan.. (0x08|0x0042) plen 6  #41 [hci1] 3.367062
        Extended scan: Enabled (0x01)
        Filter duplicates: Enabled (0x01)
        Duration: 0 msec (0x0000)
        Period: 0.00 sec (0x0000)
> HCI Event: Command Complete (0x0e) plen 4                 #42 [hci1] 3.367589
      LE Set Extended Scan Enable (0x08|0x0042) ncmd 1
        Status: Success (0x00)
> HCI Event: LE Meta Event (0x3e) plen 44                   #43 [hci1] 4.656259
      LE Extended Advertising Report (0x0d)
        Num reports: 1
        Entry 0
          Event type: 0x0012
            Props: 0x0012
              Scannable
              Use legacy advertising PDUs
            Data status: [0;32mComplete[0m
          Legacy PDU Type: ADV_SCAN_IND (0x0012)
          Address type: Public (0x00)
          Address: DF:A9:FF:F6:B1:1A (OUI DF-A9-FF)
          Primary PHY: LE 1M
          Secondary PHY: No packets
          SID: no ADI field (0xff)
          TX power: 127 dBm
          RSSI: -20 dBm (0xec)
          Periodic advertising interval: 0.00 msec (0x0000)
          Direct address type: Reserved (0xff)
          Direct address: 00-00-00-00-00-00
          Data length: 0x12
        02 01 04 0e 09 54 65 73 74 65 72 5f 46 36 42 31  .....Tester_F6B1
        31 41                                            1A              
        Flags: 0x04
          BR/EDR Not Supported
        Name (complete): Tester_F6B11A
> HCI Event: LE Meta Event (0x3e) plen 50                   #44 [hci1] 4.657147
      LE Extended Advertising Report (0x0d)
        Num reports: 1
        Entry 0
          Event type: 0x001a
            Props: 0x001a
              Scannable
              Scan response
              Use legacy advertising PDUs
            Data status: [0;32mComplete[0m
          Legacy PDU Type: SCAN_RSP to an ADV_IND (0x001a)
          Address type: Public (0x00)
          Address: DF:A9:FF:F6:B1:1A (OUI DF-A9-FF)
          Primary PHY: LE 1M
          Secondary PHY: No packets
          SID: no ADI field (0xff)
          TX power: 127 dBm
          RSSI: -20 dBm (0xec)
          Periodic advertising interval: 0.00 msec (0x0000)
          Direct address type: Reserved (0xff)
          Direct address: 00-00-00-00-00-00
          Data length: 0x18
        13 24 16 2f 2f 62 6c 75 65 74 6f 6f 74 68 2e 63  .$.//bluetooth.c
        6f 6d 0d 0a 03 19 00 00                          om......        
        Unknown EIR field 0x24: 162f2f626c7565746f6f74682e636f6d0d0a
        Appearance: Unknown (0x0000)
> HCI Event: LE Meta Event (0x3e) plen 44                   #45 [hci1] 4.764456
      LE Extended Advertising Report (0x0d)
        Num reports: 1
        Entry 0
          Event type: 0x0012
            Props: 0x0012
              Scannable
              Use legacy advertising PDUs
            Data status: [0;32mComplete[0m
          Legacy PDU Type: ADV_SCAN_IND (0x0012)
          Address type: Public (0x00)
          Address: DF:A9:FF:F6:B1:1A (OUI DF-A9-FF)
          Primary PHY: LE 1M
          Secondary PHY: No packets
          SID: no ADI field (0xff)
          TX power: 127 dBm
          RSSI: -20 dBm (0xec)
          Periodic advertising interval: 0.00 msec (0x0000)
          Direct address type: Reserved (0xff)
          Direct address: 00-00-00-00-00-00
          Data length: 0x12
        02 01 04 0e 09 54 65 73 74 65 72 5f 46 36 42 31  .....Tester_F6B1
        31 41                                            1A              
        Flags: 0x04
          BR/EDR Not Supported
        Name (complete): Tester_F6B11A
> HCI Event: LE Meta Event (0x3e) plen 50                   #46 [hci1] 4.765395
      LE Extended Advertising Report (0x0d)
        Num reports: 1
        Entry 0
          Event type: 0x001a
            Props: 0x001a
              Scannable
              Scan response
              Use legacy advertising PDUs
            Data status: [0;32mComplete[0m
          Legacy PDU Type: SCAN_RSP to an ADV_IND (0x001a)
          Address type: Public (0x00)
          Address: DF:A9:FF:F6:B1:1A (OUI DF-A9-FF)
          Primary PHY: LE 1M
          Secondary PHY: No packets
          SID: no ADI field (0xff)
          TX power: 127 dBm
          RSSI: -20 dBm (0xec)
          Periodic advertising interval: 0.00 msec (0x0000)
          Direct address type: Reserved (0xff)
          Direct address: 00-00-00-00-00-00
          Data length: 0x18
        13 24 16 2f 2f 62 6c 75 65 74 6f 6f 74 68 2e 63  .$.//bluetooth.c
        6f 6d 0d 0a 03 19 00 00                          om......        
        Unknown EIR field 0x24: 162f2f626c7565746f6f74682e636f6d0d0a
        Appearance: Unknown (0x0000)
> HCI Event: LE Meta Event (0x3e) plen 44                   #47 [hci1] 5.075087
      LE Extended Advertising Report (0x0d)
        Num reports: 1
        Entry 0
          Event type: 0x0012
            Props: 0x0012
              Scannable
              Use legacy advertising PDUs
            Data status: [0;32mComplete[0m
          Legacy PDU Type: ADV_SCAN_IND (0x0012)
          Address type: Public (0x00)
          Address: DF:A9:FF:F6:B1:1A (OUI DF-A9-FF)
          Primary PHY: LE 1M
          Secondary PHY: No packets
          SID: no ADI field (0xff)
          TX power: 127 dBm
          RSSI: -23 dBm (0xe9)
          Periodic advertising interval: 0.00 msec (0x0000)
          Direct address type: Reserved (0xff)
          Direct address: 00-00-00-00-00-00
          Data length: 0x12
        02 01 04 0e 09 54 65 73 74 65 72 5f 46 36 42 31  .....Tester_F6B1
        31 41                                            1A              
        Flags: 0x04
          BR/EDR Not Supported
        Name (complete): Tester_F6B11A
> HCI Event: LE Meta Event (0x3e) plen 50                   #48 [hci1] 5.075856
      LE Extended Advertising Report (0x0d)
        Num reports: 1
        Entry 0
          Event type: 0x001a
            Props: 0x001a
              Scannable
              Scan response
              Use legacy advertising PDUs
            Data status: [0;32mComplete[0m
          Legacy PDU Type: SCAN_RSP to an ADV_IND (0x001a)
          Address type: Public (0x00)
          Address: DF:A9:FF:F6:B1:1A (OUI DF-A9-FF)
          Primary PHY: LE 1M
          Secondary PHY: No packets
          SID: no ADI field (0xff)
          TX power: 127 dBm
          RSSI: -23 dBm (0xe9)
          Periodic advertising interval: 0.00 msec (0x0000)
          Direct address type: Reserved (0xff)
          Direct address: 00-00-00-00-00-00
          Data length: 0x18
        13 24 16 2f 2f 62 6c 75 65 74 6f 6f 74 68 2e 63  .$.//bluetooth.c
        6f 6d 0d 0a 03 19 00 00                          om......        
        Unknown EIR field 0x24: 162f2f626c7565746f6f74682e636f6d0d0a
        Appearance: Unknown (0x0000)
> HCI Event: LE Meta Event (0x3e) plen 44                   #49 [hci1] 5.177610
      LE Extended Advertising Report (0x0d)
        Num reports: 1
        Entry 0
          Event type: 0x0012
            Props: 0x0012
              Scannable
              Use legacy advertising PDUs
            Data status: [0;32mComplete[0m
          Legacy PDU Type: ADV_SCAN_IND (0x0012)
          Address type: Public (0x00)
          Address: DF:A9:FF:F6:B1:1A (OUI DF-A9-FF)
          Primary PHY: LE 1M
          Secondary PHY: No packets
          SID: no ADI field (0xff)
          TX power: 127 dBm
          RSSI: -20 dBm (0xec)
          Periodic advertising interval: 0.00 msec (0x0000)
          Direct address type: Reserved (0xff)
          Direct address: 00-00-00-00-00-00
          Data length: 0x12
        02 01 04 0e 09 54 65 73 74 65 72 5f 46 36 42 31  .....Tester_F6B1
        31 41                                            1A              
        Flags: 0x04
          BR/EDR Not Supported
        Name (complete): Tester_F6B11A
> HCI Event: LE Meta Event (0x3e) plen 50                   #50 [hci1] 5.178416
      LE Extended Advertising Report (0x0d)
        Num reports: 1
        Entry 0
          Event type: 0x001a
            Props: 0x001a
              Scannable
              Scan response
              Use legacy advertising PDUs
            Data status: [0;32mComplete[0m
          Legacy PDU Type: SCAN_RSP to an ADV_IND (0x001a)
          Address type: Public (0x00)
          Address: DF:A9:FF:F6:B1:1A (OUI DF-A9-FF)
          Primary PHY: LE 1M
          Secondary PHY: No packets
          SID: no ADI field (0xff)
          TX power: 127 dBm
          RSSI: -20 dBm (0xec)
          Periodic advertising interval: 0.00 msec (0x0000)
          Direct address type: Reserved (0xff)
          Direct address: 00-00-00-00-00-00
          Data length: 0x18
        13 24 16 2f 2f 62 6c 75 65 74 6f 6f 74 68 2e 63  .$.//bluetooth.c
        6f 6d 0d 0a 03 19 00 00                          om......        
        Unknown EIR field 0x24: 162f2f626c7565746f6f74682e636f6d0d0a
        Appearance: Unknown (0x0000)
> HCI Event: LE Meta Event (0x3e) plen 44                   #51 [hci1] 5.494491
      LE Extended Advertising Report (0x0d)
        Num reports: 1
        Entry 0
          Event type: 0x0012
            Props: 0x0012
              Scannable
              Use legacy advertising PDUs
            Data status: [0;32mComplete[0m
          Legacy PDU Type: ADV_SCAN_IND (0x0012)
          Address type: Public (0x00)
          Address: DF:A9:FF:F6:B1:1A (OUI DF-A9-FF)
          Primary PHY: LE 1M
          Secondary PHY: No packets
          SID: no ADI field (0xff)
          TX power: 127 dBm
          RSSI: -20 dBm (0xec)
          Periodic advertising interval: 0.00 msec (0x0000)
          Direct address type: Reserved (0xff)
          Direct address: 00-00-00-00-00-00
          Data length: 0x12
        02 01 04 0e 09 54 65 73 74 65 72 5f 46 36 42 31  .....Tester_F6B1
        31 41                                            1A              
        Flags: 0x04
          BR/EDR Not Supported
        Name (complete): Tester_F6B11A
> HCI Event: LE Meta Event (0x3e) plen 50                   #52 [hci1] 5.495257
      LE Extended Advertising Report (0x0d)
        Num reports: 1
        Entry 0
          Event type: 0x001a
            Props: 0x001a
              Scannable
              Scan response
              Use legacy advertising PDUs
            Data status: [0;32mComplete[0m
          Legacy PDU Type: SCAN_RSP to an ADV_IND (0x001a)
          Address type: Public (0x00)
          Address: DF:A9:FF:F6:B1:1A (OUI DF-A9-FF)
          Primary PHY: LE 1M
          Secondary PHY: No packets
          SID: no ADI field (0xff)
          TX power: 127 dBm
          RSSI: -20 dBm (0xec)
          Periodic advertising interval: 0.00 msec (0x0000)
          Direct address type: Reserved (0xff)
          Direct address: 00-00-00-00-00-00
          Data length: 0x18
        13 24 16 2f 2f 62 6c 75 65 74 6f 6f 74 68 2e 63  .$.//bluetooth.c
        6f 6d 0d 0a 03 19 00 00                          om......        
        Unknown EIR field 0x24: 162f2f626c7565746f6f74682e636f6d0d0a
        Appearance: Unknown (0x0000)
> HCI Event: LE Meta Event (0x3e) plen 44                   #53 [hci1] 5.601727
      LE Extended Advertising Report (0x0d)
        Num reports: 1
        Entry 0
          Event type: 0x0012
            Props: 0x0012
              Scannable
              Use legacy advertising PDUs
            Data status: [0;32mComplete[0m
          Legacy PDU Type: ADV_SCAN_IND (0x0012)
          Address type: Public (0x00)
          Address: DF:A9:FF:F6:B1:1A (OUI DF-A9-FF)
          Primary PHY: LE 1M
          Secondary PHY: No packets
          SID: no ADI field (0xff)
          TX power: 127 dBm
          RSSI: -23 dBm (0xe9)
          Periodic advertising interval: 0.00 msec (0x0000)
          Direct address type: Reserved (0xff)
          Direct address: 00-00-00-00-00-00
          Data length: 0x12
        02 01 04 0e 09 54 65 73 74 65 72 5f 46 36 42 31  .....Tester_F6B1
        31 41                                            1A              
        Flags: 0x04
          BR/EDR Not Supported
        Name (complete): Tester_F6B11A
> HCI Event: LE Meta Event (0x3e) plen 50                   #54 [hci1] 5.602504
      LE Extended Advertising Report (0x0d)
        Num reports: 1
        Entry 0
          Event type: 0x001a
            Props: 0x001a
              Scannable
              Scan response
              Use legacy advertising PDUs
            Data status: [0;32mComplete[0m
          Legacy PDU Type: SCAN_RSP to an ADV_IND (0x001a)
          Address type: Public (0x00)
          Address: DF:A9:FF:F6:B1:1A (OUI DF-A9-FF)
          Primary PHY: LE 1M
          Secondary PHY: No packets
          SID: no ADI field (0xff)
          TX power: 127 dBm
          RSSI: -23 dBm (0xe9)
          Periodic advertising interval: 0.00 msec (0x0000)
          Direct address type: Reserved (0xff)
          Direct address: 00-00-00-00-00-00
          Data length: 0x18
        13 24 16 2f 2f 62 6c 75 65 74 6f 6f 74 68 2e 63  .$.//bluetooth.c
        6f 6d 0d 0a 03 19 00 00                          om......        
        Unknown EIR field 0x24: 162f2f626c7565746f6f74682e636f6d0d0a
        Appearance: Unknown (0x0000)
> HCI Event: LE Meta Event (0x3e) plen 44                   #55 [hci1] 5.911981
      LE Extended Advertising Report (0x0d)
        Num reports: 1
        Entry 0
          Event type: 0x0012
            Props: 0x0012
              Scannable
              Use legacy advertising PDUs
            Data status: [0;32mComplete[0m
          Legacy PDU Type: ADV_SCAN_IND (0x0012)
          Address type: Public (0x00)
          Address: DF:A9:FF:F6:B1:1A (OUI DF-A9-FF)
          Primary PHY: LE 1M
          Secondary PHY: No packets
          SID: no ADI field (0xff)
          TX power: 127 dBm
          RSSI: -20 dBm (0xec)
          Periodic advertising interval: 0.00 msec (0x0000)
          Direct address type: Reserved (0xff)
          Direct address: 00-00-00-00-00-00
          Data length: 0x12
        02 01 04 0e 09 54 65 73 74 65 72 5f 46 36 42 31  .....Tester_F6B1
        31 41                                            1A              
        Flags: 0x04
          BR/EDR Not Supported
        Name (complete): Tester_F6B11A
> HCI Event: LE Meta Event (0x3e) plen 50                   #56 [hci1] 5.912783
      LE Extended Advertising Report (0x0d)
        Num reports: 1
        Entry 0
          Event type: 0x001a
            Props: 0x001a
              Scannable
              Scan response
              Use legacy advertising PDUs
            Data status: [0;32mComplete[0m
          Legacy PDU Type: SCAN_RSP to an ADV_IND (0x001a)
          Address type: Public (0x00)
          Address: DF:A9:FF:F6:B1:1A (OUI DF-A9-FF)
          Primary PHY: LE 1M
          Secondary PHY: No packets
          SID: no ADI field (0xff)
          TX power: 127 dBm
          RSSI: -20 dBm (0xec)
          Periodic advertising interval: 0.00 msec (0x0000)
          Direct address type: Reserved (0xff)
          Direct address: 00-00-00-00-00-00
          Data length: 0x18
        13 24 16 2f 2f 62 6c 75 65 74 6f 6f 74 68 2e 63  .$.//bluetooth.c
        6f 6d 0d 0a 03 19 00 00                          om......        
        Unknown EIR field 0x24: 162f2f626c7565746f6f74682e636f6d0d0a
        Appearance: Unknown (0x0000)
> HCI Event: LE Meta Event (0x3e) plen 44                   #57 [hci1] 6.019561
      LE Extended Advertising Report (0x0d)
        Num reports: 1
        Entry 0
          Event type: 0x0012
            Props: 0x0012
              Scannable
              Use legacy advertising PDUs
            Data status: [0;32mComplete[0m
          Legacy PDU Type: ADV_SCAN_IND (0x0012)
          Address type: Public (0x00)
          Address: DF:A9:FF:F6:B1:1A (OUI DF-A9-FF)
          Primary PHY: LE 1M
          Secondary PHY: No packets
          SID: no ADI field (0xff)
          TX power: 127 dBm
          RSSI: -20 dBm (0xec)
          Periodic advertising interval: 0.00 msec (0x0000)
          Direct address type: Reserved (0xff)
          Direct address: 00-00-00-00-00-00
          Data length: 0x12
        02 01 04 0e 09 54 65 73 74 65 72 5f 46 36 42 31  .....Tester_F6B1
        31 41                                            1A              
        Flags: 0x04
          BR/EDR Not Supported
        Name (complete): Tester_F6B11A
> HCI Event: LE Meta Event (0x3e) plen 50                   #58 [hci1] 6.020422
      LE Extended Advertising Report (0x0d)
        Num reports: 1
        Entry 0
          Event type: 0x001a
            Props: 0x001a
              Scannable
              Scan response
              Use legacy advertising PDUs
            Data status: [0;32mComplete[0m
          Legacy PDU Type: SCAN_RSP to an ADV_IND (0x001a)
          Address type: Public (0x00)
          Address: DF:A9:FF:F6:B1:1A (OUI DF-A9-FF)
          Primary PHY: LE 1M
          Secondary PHY: No packets
          SID: no ADI field (0xff)
          TX power: 127 dBm
          RSSI: -20 dBm (0xec)
          Periodic advertising interval: 0.00 msec (0x0000)
          Direct address type: Reserved (0xff)
          Direct address: 00-00-00-00-00-00
          Data length: 0x18
        13 24 16 2f 2f 62 6c 75 65 74 6f 6f 74 68 2e 63  .$.//bluetooth.c
        6f 6d 0d 0a 03 19 00 00                          om......        
        Unknown EIR field 0x24: 162f2f626c7565746f6f74682e636f6d0d0a
        Appearance: Unknown (0x0000)
> HCI Event: LE Meta Event (0x3e) plen 44                   #59 [hci1] 6.327069
      LE Extended Advertising Report (0x0d)
        Num reports: 1
        Entry 0
          Event type: 0x0012
            Props: 0x0012
              Scannable
              Use legacy advertising PDUs
            Data status: [0;32mComplete[0m
          Legacy PDU Type: ADV_SCAN_IND (0x0012)
          Address type: Public (0x00)
          Address: DF:A9:FF:F6:B1:1A (OUI DF-A9-FF)
          Primary PHY: LE 1M
          Secondary PHY: No packets
          SID: no ADI field (0xff)
          TX power: 127 dBm
          RSSI: -23 dBm (0xe9)
          Periodic advertising interval: 0.00 msec (0x0000)
          Direct address type: Reserved (0xff)
          Direct address: 00-00-00-00-00-00
          Data length: 0x12
        02 01 04 0e 09 54 65 73 74 65 72 5f 46 36 42 31  .....Tester_F6B1
        31 41                                            1A              
        Flags: 0x04
          BR/EDR Not Supported
        Name (complete): Tester_F6B11A
> HCI Event: LE Meta Event (0x3e) plen 50                   #60 [hci1] 6.327925
      LE Extended Advertising Report (0x0d)
        Num reports: 1
        Entry 0
          Event type: 0x001a
            Props: 0x001a
              Scannable
              Scan response
              Use legacy advertising PDUs
            Data status: [0;32mComplete[0m
          Legacy PDU Type: SCAN_RSP to an ADV_IND (0x001a)
          Address type: Public (0x00)
          Address: DF:A9:FF:F6:B1:1A (OUI DF-A9-FF)
          Primary PHY: LE 1M
          Secondary PHY: No packets
          SID: no ADI field (0xff)
          TX power: 127 dBm
          RSSI: -23 dBm (0xe9)
          Periodic advertising interval: 0.00 msec (0x0000)
          Direct address type: Reserved (0xff)
          Direct address: 00-00-00-00-00-00
          Data length: 0x18
        13 24 16 2f 2f 62 6c 75 65 74 6f 6f 74 68 2e 63  .$.//bluetooth.c
        6f 6d 0d 0a 03 19 00 00                          om......        
        Unknown EIR field 0x24: 162f2f626c7565746f6f74682e636f6d0d0a
        Appearance: Unknown (0x0000)
> HCI Event: LE Meta Event (0x3e) plen 44                   #61 [hci1] 6.748328
      LE Extended Advertising Report (0x0d)
        Num reports: 1
        Entry 0
          Event type: 0x0012
            Props: 0x0012
              Scannable
              Use legacy advertising PDUs
            Data status: [0;32mComplete[0m
          Legacy PDU Type: ADV_SCAN_IND (0x0012)
          Address type: Public (0x00)
          Address: DF:A9:FF:F6:B1:1A (OUI DF-A9-FF)
          Primary PHY: LE 1M
          Secondary PHY: No packets
          SID: no ADI field (0xff)
          TX power: 127 dBm
          RSSI: -20 dBm (0xec)
          Periodic advertising interval: 0.00 msec (0x0000)
          Direct address type: Reserved (0xff)
          Direct address: 00-00-00-00-00-00
          Data length: 0x12
        02 01 04 0e 09 54 65 73 74 65 72 5f 46 36 42 31  .....Tester_F6B1
        31 41                                            1A              
        Flags: 0x04
          BR/EDR Not Supported
        Name (complete): Tester_F6B11A
> HCI Event: LE Meta Event (0x3e) plen 50                   #62 [hci1] 6.749067
      LE Extended Advertising Report (0x0d)
        Num reports: 1
        Entry 0
          Event type: 0x001a
            Props: 0x001a
              Scannable
              Scan response
              Use legacy advertising PDUs
            Data status: [0;32mComplete[0m
          Legacy PDU Type: SCAN_RSP to an ADV_IND (0x001a)
          Address type: Public (0x00)
          Address: DF:A9:FF:F6:B1:1A (OUI DF-A9-FF)
          Primary PHY: LE 1M
          Secondary PHY: No packets
          SID: no ADI field (0xff)
          TX power: 127 dBm
          RSSI: -20 dBm (0xec)
          Periodic advertising interval: 0.00 msec (0x0000)
          Direct address type: Reserved (0xff)
          Direct address: 00-00-00-00-00-00
          Data length: 0x18
        13 24 16 2f 2f 62 6c 75 65 74 6f 6f 74 68 2e 63  .$.//bluetooth.c
        6f 6d 0d 0a 03 19 00 00                          om......        
        Unknown EIR field 0x24: 162f2f626c7565746f6f74682e636f6d0d0a
        Appearance: Unknown (0x0000)
> HCI Event: LE Meta Event (0x3e) plen 44                   #63 [hci1] 7.054064
      LE Extended Advertising Report (0x0d)
        Num reports: 1
        Entry 0
          Event type: 0x0012
            Props: 0x0012
              Scannable
              Use legacy advertising PDUs
            Data status: [0;32mComplete[0m
          Legacy PDU Type: ADV_SCAN_IND (0x0012)
          Address type: Public (0x00)
          Address: DF:A9:FF:F6:B1:1A (OUI DF-A9-FF)
          Primary PHY: LE 1M
          Secondary PHY: No packets
          SID: no ADI field (0xff)
          TX power: 127 dBm
          RSSI: -23 dBm (0xe9)
          Periodic advertising interval: 0.00 msec (0x0000)
          Direct address type: Reserved (0xff)
          Direct address: 00-00-00-00-00-00
          Data length: 0x12
        02 01 04 0e 09 54 65 73 74 65 72 5f 46 36 42 31  .....Tester_F6B1
        31 41                                            1A              
        Flags: 0x04
          BR/EDR Not Supported
        Name (complete): Tester_F6B11A
> HCI Event: LE Meta Event (0x3e) plen 50                   #64 [hci1] 7.054931
      LE Extended Advertising Report (0x0d)
        Num reports: 1
        Entry 0
          Event type: 0x001a
            Props: 0x001a
              Scannable
              Scan response
              Use legacy advertising PDUs
            Data status: [0;32mComplete[0m
          Legacy PDU Type: SCAN_RSP to an ADV_IND (0x001a)
          Address type: Public (0x00)
          Address: DF:A9:FF:F6:B1:1A (OUI DF-A9-FF)
          Primary PHY: LE 1M
          Secondary PHY: No packets
          SID: no ADI field (0xff)
          TX power: 127 dBm
          RSSI: -23 dBm (0xe9)
          Periodic advertising interval: 0.00 msec (0x0000)
          Direct address type: Reserved (0xff)
          Direct address: 00-00-00-00-00-00
          Data length: 0x18
        13 24 16 2f 2f 62 6c 75 65 74 6f 6f 74 68 2e 63  .$.//bluetooth.c
        6f 6d 0d 0a 03 19 00 00                          om......        
        Unknown EIR field 0x24: 162f2f626c7565746f6f74682e636f6d0d0a
        Appearance: Unknown (0x0000)
> HCI Event: LE Meta Event (0x3e) plen 44                   #65 [hci1] 7.158857
      LE Extended Advertising Report (0x0d)
        Num reports: 1
        Entry 0
          Event type: 0x0012
            Props: 0x0012
              Scannable
              Use legacy advertising PDUs
            Data status: [0;32mComplete[0m
          Legacy PDU Type: ADV_SCAN_IND (0x0012)
          Address type: Public (0x00)
          Address: DF:A9:FF:F6:B1:1A (OUI DF-A9-FF)
          Primary PHY: LE 1M
          Secondary PHY: No packets
          SID: no ADI field (0xff)
          TX power: 127 dBm
          RSSI: -20 dBm (0xec)
          Periodic advertising interval: 0.00 msec (0x0000)
          Direct address type: Reserved (0xff)
          Direct address: 00-00-00-00-00-00
          Data length: 0x12
        02 01 04 0e 09 54 65 73 74 65 72 5f 46 36 42 31  .....Tester_F6B1
        31 41                                            1A              
        Flags: 0x04
          BR/EDR Not Supported
        Name (complete): Tester_F6B11A
> HCI Event: LE Meta Event (0x3e) plen 50                   #66 [hci1] 7.159702
      LE Extended Advertising Report (0x0d)
        Num reports: 1
        Entry 0
          Event type: 0x001a
            Props: 0x001a
              Scannable
              Scan response
              Use legacy advertising PDUs
            Data status: [0;32mComplete[0m
          Legacy PDU Type: SCAN_RSP to an ADV_IND (0x001a)
          Address type: Public (0x00)
          Address: DF:A9:FF:F6:B1:1A (OUI DF-A9-FF)
          Primary PHY: LE 1M
          Secondary PHY: No packets
          SID: no ADI field (0xff)
          TX power: 127 dBm
          RSSI: -20 dBm (0xec)
          Periodic advertising interval: 0.00 msec (0x0000)
          Direct address type: Reserved (0xff)
          Direct address: 00-00-00-00-00-00
          Data length: 0x18
        13 24 16 2f 2f 62 6c 75 65 74 6f 6f 74 68 2e 63  .$.//bluetooth.c
        6f 6d 0d 0a 03 19 00 00                          om......        
        Unknown EIR field 0x24: 162f2f626c7565746f6f74682e636f6d0d0a
        Appearance: Unknown (0x0000)
> HCI Event: LE Meta Event (0x3e) plen 44                   #67 [hci1] 7.478294
      LE Extended Advertising Report (0x0d)
        Num reports: 1
        Entry 0
          Event type: 0x0012
            Props: 0x0012
              Scannable
              Use legacy advertising PDUs
            Data status: [0;32mComplete[0m
          Legacy PDU Type: ADV_SCAN_IND (0x0012)
          Address type: Public (0x00)
          Address: DF:A9:FF:F6:B1:1A (OUI DF-A9-FF)
          Primary PHY: LE 1M
          Secondary PHY: No packets
          SID: no ADI field (0xff)
          TX power: 127 dBm
          RSSI: -20 dBm (0xec)
          Periodic advertising interval: 0.00 msec (0x0000)
          Direct address type: Reserved (0xff)
          Direct address: 00-00-00-00-00-00
          Data length: 0x12
        02 01 04 0e 09 54 65 73 74 65 72 5f 46 36 42 31  .....Tester_F6B1
        31 41                                            1A              
        Flags: 0x04
          BR/EDR Not Supported
        Name (complete): Tester_F6B11A
> HCI Event: LE Meta Event (0x3e) plen 50                   #68 [hci1] 7.479157
      LE Extended Advertising Report (0x0d)
        Num reports: 1
        Entry 0
          Event type: 0x001a
            Props: 0x001a
              Scannable
              Scan response
              Use legacy advertising PDUs
            Data status: [0;32mComplete[0m
          Legacy PDU Type: SCAN_RSP to an ADV_IND (0x001a)
          Address type: Public (0x00)
          Address: DF:A9:FF:F6:B1:1A (OUI DF-A9-FF)
          Primary PHY: LE 1M
          Secondary PHY: No packets
          SID: no ADI field (0xff)
          TX power: 127 dBm
          RSSI: -20 dBm (0xec)
          Periodic advertising interval: 0.00 msec (0x0000)
          Direct address type: Reserved (0xff)
          Direct address: 00-00-00-00-00-00
          Data length: 0x18
        13 24 16 2f 2f 62 6c 75 65 74 6f 6f 74 68 2e 63  .$.//bluetooth.c
        6f 6d 0d 0a 03 19 00 00                          om......        
        Unknown EIR field 0x24: 162f2f626c7565746f6f74682e636f6d0d0a
        Appearance: Unknown (0x0000)
> HCI Event: LE Meta Event (0x3e) plen 44                   #69 [hci1] 7.586823
      LE Extended Advertising Report (0x0d)
        Num reports: 1
        Entry 0
          Event type: 0x0012
            Props: 0x0012
              Scannable
              Use legacy advertising PDUs
            Data status: [0;32mComplete[0m
          Legacy PDU Type: ADV_SCAN_IND (0x0012)
          Address type: Public (0x00)
          Address: DF:A9:FF:F6:B1:1A (OUI DF-A9-FF)
          Primary PHY: LE 1M
          Secondary PHY: No packets
          SID: no ADI field (0xff)
          TX power: 127 dBm
          RSSI: -23 dBm (0xe9)
          Periodic advertising interval: 0.00 msec (0x0000)
          Direct address type: Reserved (0xff)
          Direct address: 00-00-00-00-00-00
          Data length: 0x12
        02 01 04 0e 09 54 65 73 74 65 72 5f 46 36 42 31  .....Tester_F6B1
        31 41                                            1A              
        Flags: 0x04
          BR/EDR Not Supported
        Name (complete): Tester_F6B11A
> HCI Event: LE Meta Event (0x3e) plen 50                   #70 [hci1] 7.587629
      LE Extended Advertising Report (0x0d)
        Num reports: 1
        Entry 0
          Event type: 0x001a
            Props: 0x001a
              Scannable
              Scan response
              Use legacy advertising PDUs
            Data status: [0;32mComplete[0m
          Legacy PDU Type: SCAN_RSP to an ADV_IND (0x001a)
          Address type: Public (0x00)
          Address: DF:A9:FF:F6:B1:1A (OUI DF-A9-FF)
          Primary PHY: LE 1M
          Secondary PHY: No packets
          SID: no ADI field (0xff)
          TX power: 127 dBm
          RSSI: -23 dBm (0xe9)
          Periodic advertising interval: 0.00 msec (0x0000)
          Direct address type: Reserved (0xff)
          Direct address: 00-00-00-00-00-00
          Data length: 0x18
        13 24 16 2f 2f 62 6c 75 65 74 6f 6f 74 68 2e 63  .$.//bluetooth.c
        6f 6d 0d 0a 03 19 00 00                          om......        
        Unknown EIR field 0x24: 162f2f626c7565746f6f74682e636f6d0d0a
        Appearance: Unknown (0x0000)
> HCI Event: LE Meta Event (0x3e) plen 44                   #71 [hci1] 7.896095
      LE Extended Advertising Report (0x0d)
        Num reports: 1
        Entry 0
          Event type: 0x0012
            Props: 0x0012
              Scannable
              Use legacy advertising PDUs
            Data status: [0;32mComplete[0m
          Legacy PDU Type: ADV_SCAN_IND (0x0012)
          Address type: Public (0x00)
          Address: DF:A9:FF:F6:B1:1A (OUI DF-A9-FF)
          Primary PHY: LE 1M
          Secondary PHY: No packets
          SID: no ADI field (0xff)
          TX power: 127 dBm
          RSSI: -20 dBm (0xec)
          Periodic advertising interval: 0.00 msec (0x0000)
          Direct address type: Reserved (0xff)
          Direct address: 00-00-00-00-00-00
          Data length: 0x12
        02 01 04 0e 09 54 65 73 74 65 72 5f 46 36 42 31  .....Tester_F6B1
        31 41                                            1A              
        Flags: 0x04
          BR/EDR Not Supported
        Name (complete): Tester_F6B11A
> HCI Event: LE Meta Event (0x3e) plen 50                   #72 [hci1] 7.896942
      LE Extended Advertising Report (0x0d)
        Num reports: 1
        Entry 0
          Event type: 0x001a
            Props: 0x001a
              Scannable
              Scan response
              Use legacy advertising PDUs
            Data status: [0;32mComplete[0m
          Legacy PDU Type: SCAN_RSP to an ADV_IND (0x001a)
          Address type: Public (0x00)
          Address: DF:A9:FF:F6:B1:1A (OUI DF-A9-FF)
          Primary PHY: LE 1M
          Secondary PHY: No packets
          SID: no ADI field (0xff)
          TX power: 127 dBm
          RSSI: -20 dBm (0xec)
          Periodic advertising interval: 0.00 msec (0x0000)
          Direct address type: Reserved (0xff)
          Direct address: 00-00-00-00-00-00
          Data length: 0x18
        13 24 16 2f 2f 62 6c 75 65 74 6f 6f 74 68 2e 63  .$.//bluetooth.c
        6f 6d 0d 0a 03 19 00 00                          om......        
        Unknown EIR field 0x24: 162f2f626c7565746f6f74682e636f6d0d0a
        Appearance: Unknown (0x0000)
> HCI Event: LE Meta Event (0x3e) plen 44                   #73 [hci1] 7.998618
      LE Extended Advertising Report (0x0d)
        Num reports: 1
        Entry 0
          Event type: 0x0012
            Props: 0x0012
              Scannable
              Use legacy advertising PDUs
            Data status: [0;32mComplete[0m
          Legacy PDU Type: ADV_SCAN_IND (0x0012)
          Address type: Public (0x00)
          Address: DF:A9:FF:F6:B1:1A (OUI DF-A9-FF)
          Primary PHY: LE 1M
          Secondary PHY: No packets
          SID: no ADI field (0xff)
          TX power: 127 dBm
          RSSI: -20 dBm (0xec)
          Periodic advertising interval: 0.00 msec (0x0000)
          Direct address type: Reserved (0xff)
          Direct address: 00-00-00-00-00-00
          Data length: 0x12
        02 01 04 0e 09 54 65 73 74 65 72 5f 46 36 42 31  .....Tester_F6B1
        31 41                                            1A              
        Flags: 0x04
          BR/EDR Not Supported
        Name (complete): Tester_F6B11A
> HCI Event: LE Meta Event (0x3e) plen 50                   #74 [hci1] 7.999449
      LE Extended Advertising Report (0x0d)
        Num reports: 1
        Entry 0
          Event type: 0x001a
            Props: 0x001a
              Scannable
              Scan response
              Use legacy advertising PDUs
            Data status: [0;32mComplete[0m
          Legacy PDU Type: SCAN_RSP to an ADV_IND (0x001a)
          Address type: Public (0x00)
          Address: DF:A9:FF:F6:B1:1A (OUI DF-A9-FF)
          Primary PHY: LE 1M
          Secondary PHY: No packets
          SID: no ADI field (0xff)
          TX power: 127 dBm
          RSSI: -20 dBm (0xec)
          Periodic advertising interval: 0.00 msec (0x0000)
          Direct address type: Reserved (0xff)
          Direct address: 00-00-00-00-00-00
          Data length: 0x18
        13 24 16 2f 2f 62 6c 75 65 74 6f 6f 74 68 2e 63  .$.//bluetooth.c
        6f 6d 0d 0a 03 19 00 00                          om......        
        Unknown EIR field 0x24: 162f2f626c7565746f6f74682e636f6d0d0a
        Appearance: Unknown (0x0000)
> HCI Event: LE Meta Event (0x3e) plen 44                   #75 [hci1] 8.314681
      LE Extended Advertising Report (0x0d)
        Num reports: 1
        Entry 0
          Event type: 0x0012
            Props: 0x0012
              Scannable
              Use legacy advertising PDUs
            Data status: [0;32mComplete[0m
          Legacy PDU Type: ADV_SCAN_IND (0x0012)
          Address type: Public (0x00)
          Address: DF:A9:FF:F6:B1:1A (OUI DF-A9-FF)
          Primary PHY: LE 1M
          Secondary PHY: No packets
          SID: no ADI field (0xff)
          TX power: 127 dBm
          RSSI: -23 dBm (0xe9)
          Periodic advertising interval: 0.00 msec (0x0000)
          Direct address type: Reserved (0xff)
          Direct address: 00-00-00-00-00-00
          Data length: 0x12
        02 01 04 0e 09 54 65 73 74 65 72 5f 46 36 42 31  .....Tester_F6B1
        31 41                                            1A              
        Flags: 0x04
          BR/EDR Not Supported
        Name (complete): Tester_F6B11A
> HCI Event: LE Meta Event (0x3e) plen 50                   #76 [hci1] 8.315400
      LE Extended Advertising Report (0x0d)
        Num reports: 1
        Entry 0
          Event type: 0x001a
            Props: 0x001a
              Scannable
              Scan response
              Use legacy advertising PDUs
            Data status: [0;32mComplete[0m
          Legacy PDU Type: SCAN_RSP to an ADV_IND (0x001a)
          Address type: Public (0x00)
          Address: DF:A9:FF:F6:B1:1A (OUI DF-A9-FF)
          Primary PHY: LE 1M
          Secondary PHY: No packets
          SID: no ADI field (0xff)
          TX power: 127 dBm
          RSSI: -23 dBm (0xe9)
          Periodic advertising interval: 0.00 msec (0x0000)
          Direct address type: Reserved (0xff)
          Direct address: 00-00-00-00-00-00
          Data length: 0x18
        13 24 16 2f 2f 62 6c 75 65 74 6f 6f 74 68 2e 63  .$.//bluetooth.c
        6f 6d 0d 0a 03 19 00 00                          om......        
        Unknown EIR field 0x24: 162f2f626c7565746f6f74682e636f6d0d0a
        Appearance: Unknown (0x0000)
> HCI Event: LE Meta Event (0x3e) plen 44                   #77 [hci1] 8.414761
      LE Extended Advertising Report (0x0d)
        Num reports: 1
        Entry 0
          Event type: 0x0012
            Props: 0x0012
              Scannable
              Use legacy advertising PDUs
            Data status: [0;32mComplete[0m
          Legacy PDU Type: ADV_SCAN_IND (0x0012)
          Address type: Public (0x00)
          Address: DF:A9:FF:F6:B1:1A (OUI DF-A9-FF)
          Primary PHY: LE 1M
          Secondary PHY: No packets
          SID: no ADI field (0xff)
          TX power: 127 dBm
          RSSI: -20 dBm (0xec)
          Periodic advertising interval: 0.00 msec (0x0000)
          Direct address type: Reserved (0xff)
          Direct address: 00-00-00-00-00-00
          Data length: 0x12
        02 01 04 0e 09 54 65 73 74 65 72 5f 46 36 42 31  .....Tester_F6B1
        31 41                                            1A              
        Flags: 0x04
          BR/EDR Not Supported
        Name (complete): Tester_F6B11A
> HCI Event: LE Meta Event (0x3e) plen 50                   #78 [hci1] 8.415551
      LE Extended Advertising Report (0x0d)
        Num reports: 1
        Entry 0
          Event type: 0x001a
            Props: 0x001a
              Scannable
              Scan response
              Use legacy advertising PDUs
            Data status: [0;32mComplete[0m
          Legacy PDU Type: SCAN_RSP to an ADV_IND (0x001a)
          Address type: Public (0x00)
          Address: DF:A9:FF:F6:B1:1A (OUI DF-A9-FF)
          Primary PHY: LE 1M
          Secondary PHY: No packets
          SID: no ADI field (0xff)
          TX power: 127 dBm
          RSSI: -20 dBm (0xec)
          Periodic advertising interval: 0.00 msec (0x0000)
          Direct address type: Reserved (0xff)
          Direct address: 00-00-00-00-00-00
          Data length: 0x18
        13 24 16 2f 2f 62 6c 75 65 74 6f 6f 74 68 2e 63  .$.//bluetooth.c
        6f 6d 0d 0a 03 19 00 00                          om......        
        Unknown EIR field 0x24: 162f2f626c7565746f6f74682e636f6d0d0a
        Appearance: Unknown (0x0000)
> HCI Event: LE Meta Event (0x3e) plen 44                   #79 [hci1] 8.725068
      LE Extended Advertising Report (0x0d)
        Num reports: 1
        Entry 0
          Event type: 0x0012
            Props: 0x0012
              Scannable
              Use legacy advertising PDUs
            Data status: [0;32mComplete[0m
          Legacy PDU Type: ADV_SCAN_IND (0x0012)
          Address type: Public (0x00)
          Address: DF:A9:FF:F6:B1:1A (OUI DF-A9-FF)
          Primary PHY: LE 1M
          Secondary PHY: No packets
          SID: no ADI field (0xff)
          TX power: 127 dBm
          RSSI: -20 dBm (0xec)
          Periodic advertising interval: 0.00 msec (0x0000)
          Direct address type: Reserved (0xff)
          Direct address: 00-00-00-00-00-00
          Data length: 0x12
        02 01 04 0e 09 54 65 73 74 65 72 5f 46 36 42 31  .....Tester_F6B1
        31 41                                            1A              
        Flags: 0x04
          BR/EDR Not Supported
        Name (complete): Tester_F6B11A
> HCI Event: LE Meta Event (0x3e) plen 50                   #80 [hci1] 8.725922
      LE Extended Advertising Report (0x0d)
        Num reports: 1
        Entry 0
          Event type: 0x001a
            Props: 0x001a
              Scannable
              Scan response
              Use legacy advertising PDUs
            Data status: [0;32mComplete[0m
          Legacy PDU Type: SCAN_RSP to an ADV_IND (0x001a)
          Address type: Public (0x00)
          Address: DF:A9:FF:F6:B1:1A (OUI DF-A9-FF)
          Primary PHY: LE 1M
          Secondary PHY: No packets
          SID: no ADI field (0xff)
          TX power: 127 dBm
          RSSI: -20 dBm (0xec)
          Periodic advertising interval: 0.00 msec (0x0000)
          Direct address type: Reserved (0xff)
          Direct address: 00-00-00-00-00-00
          Data length: 0x18
        13 24 16 2f 2f 62 6c 75 65 74 6f 6f 74 68 2e 63  .$.//bluetooth.c
        6f 6d 0d 0a 03 19 00 00                          om......        
        Unknown EIR field 0x24: 162f2f626c7565746f6f74682e636f6d0d0a
        Appearance: Unknown (0x0000)
> HCI Event: LE Meta Event (0x3e) plen 44                   #81 [hci1] 9.033407
      LE Extended Advertising Report (0x0d)
        Num reports: 1
        Entry 0
          Event type: 0x0012
            Props: 0x0012
              Scannable
              Use legacy advertising PDUs
            Data status: [0;32mComplete[0m
          Legacy PDU Type: ADV_SCAN_IND (0x0012)
          Address type: Public (0x00)
          Address: DF:A9:FF:F6:B1:1A (OUI DF-A9-FF)
          Primary PHY: LE 1M
          Secondary PHY: No packets
          SID: no ADI field (0xff)
          TX power: 127 dBm
          RSSI: -23 dBm (0xe9)
          Periodic advertising interval: 0.00 msec (0x0000)
          Direct address type: Reserved (0xff)
          Direct address: 00-00-00-00-00-00
          Data length: 0x12
        02 01 04 0e 09 54 65 73 74 65 72 5f 46 36 42 31  .....Tester_F6B1
        31 41                                            1A              
        Flags: 0x04
          BR/EDR Not Supported
        Name (complete): Tester_F6B11A
> HCI Event: LE Meta Event (0x3e) plen 50                   #82 [hci1] 9.034200
      LE Extended Advertising Report (0x0d)
        Num reports: 1
        Entry 0
          Event type: 0x001a
            Props: 0x001a
              Scannable
              Scan response
              Use legacy advertising PDUs
            Data status: [0;32mComplete[0m
          Legacy PDU Type: SCAN_RSP to an ADV_IND (0x001a)
          Address type: Public (0x00)
          Address: DF:A9:FF:F6:B1:1A (OUI DF-A9-FF)
          Primary PHY: LE 1M
          Secondary PHY: No packets
          SID: no ADI field (0xff)
          TX power: 127 dBm
          RSSI: -23 dBm (0xe9)
          Periodic advertising interval: 0.00 msec (0x0000)
          Direct address type: Reserved (0xff)
          Direct address: 00-00-00-00-00-00
          Data length: 0x18
        13 24 16 2f 2f 62 6c 75 65 74 6f 6f 74 68 2e 63  .$.//bluetooth.c
        6f 6d 0d 0a 03 19 00 00                          om......        
        Unknown EIR field 0x24: 162f2f626c7565746f6f74682e636f6d0d0a
        Appearance: Unknown (0x0000)
> HCI Event: LE Meta Event (0x3e) plen 44                   #83 [hci1] 9.137403
      LE Extended Advertising Report (0x0d)
        Num reports: 1
        Entry 0
          Event type: 0x0012
            Props: 0x0012
              Scannable
              Use legacy advertising PDUs
            Data status: [0;32mComplete[0m
          Legacy PDU Type: ADV_SCAN_IND (0x0012)
          Address type: Public (0x00)
          Address: DF:A9:FF:F6:B1:1A (OUI DF-A9-FF)
          Primary PHY: LE 1M
          Secondary PHY: No packets
          SID: no ADI field (0xff)
          TX power: 127 dBm
          RSSI: -20 dBm (0xec)
          Periodic advertising interval: 0.00 msec (0x0000)
          Direct address type: Reserved (0xff)
          Direct address: 00-00-00-00-00-00
          Data length: 0x12
        02 01 04 0e 09 54 65 73 74 65 72 5f 46 36 42 31  .....Tester_F6B1
        31 41                                            1A              
        Flags: 0x04
          BR/EDR Not Supported
        Name (complete): Tester_F6B11A
> HCI Event: LE Meta Event (0x3e) plen 50                   #84 [hci1] 9.138178
      LE Extended Advertising Report (0x0d)
        Num reports: 1
        Entry 0
          Event type: 0x001a
            Props: 0x001a
              Scannable
              Scan response
              Use legacy advertising PDUs
            Data status: [0;32mComplete[0m
          Legacy PDU Type: SCAN_RSP to an ADV_IND (0x001a)
          Address type: Public (0x00)
          Address: DF:A9:FF:F6:B1:1A (OUI DF-A9-FF)
          Primary PHY: LE 1M
          Secondary PHY: No packets
          SID: no ADI field (0xff)
          TX power: 127 dBm
          RSSI: -20 dBm (0xec)
          Periodic advertising interval: 0.00 msec (0x0000)
          Direct address type: Reserved (0xff)
          Direct address: 00-00-00-00-00-00
          Data length: 0x18
        13 24 16 2f 2f 62 6c 75 65 74 6f 6f 74 68 2e 63  .$.//bluetooth.c
        6f 6d 0d 0a 03 19 00 00                          om......        
        Unknown EIR field 0x24: 162f2f626c7565746f6f74682e636f6d0d0a
        Appearance: Unknown (0x0000)
> HCI Event: LE Meta Event (0x3e) plen 44                   #85 [hci1] 9.449244
      LE Extended Advertising Report (0x0d)
        Num reports: 1
        Entry 0
          Event type: 0x0012
            Props: 0x0012
              Scannable
              Use legacy advertising PDUs
            Data status: [0;32mComplete[0m
          Legacy PDU Type: ADV_SCAN_IND (0x0012)
          Address type: Public (0x00)
          Address: DF:A9:FF:F6:B1:1A (OUI DF-A9-FF)
          Primary PHY: LE 1M
          Secondary PHY: No packets
          SID: no ADI field (0xff)
          TX power: 127 dBm
          RSSI: -20 dBm (0xec)
          Periodic advertising interval: 0.00 msec (0x0000)
          Direct address type: Reserved (0xff)
          Direct address: 00-00-00-00-00-00
          Data length: 0x12
        02 01 04 0e 09 54 65 73 74 65 72 5f 46 36 42 31  .....Tester_F6B1
        31 41                                            1A              
        Flags: 0x04
          BR/EDR Not Supported
        Name (complete): Tester_F6B11A
> HCI Event: LE Meta Event (0x3e) plen 50                   #86 [hci1] 9.450064
      LE Extended Advertising Report (0x0d)
        Num reports: 1
        Entry 0
          Event type: 0x001a
            Props: 0x001a
              Scannable
              Scan response
              Use legacy advertising PDUs
            Data status: [0;32mComplete[0m
          Legacy PDU Type: SCAN_RSP to an ADV_IND (0x001a)
          Address type: Public (0x00)
          Address: DF:A9:FF:F6:B1:1A (OUI DF-A9-FF)
          Primary PHY: LE 1M
          Secondary PHY: No packets
          SID: no ADI field (0xff)
          TX power: 127 dBm
          RSSI: -20 dBm (0xec)
          Periodic advertising interval: 0.00 msec (0x0000)
          Direct address type: Reserved (0xff)
          Direct address: 00-00-00-00-00-00
          Data length: 0x18
        13 24 16 2f 2f 62 6c 75 65 74 6f 6f 74 68 2e 63  .$.//bluetooth.c
        6f 6d 0d 0a 03 19 00 00                          om......        
        Unknown EIR field 0x24: 162f2f626c7565746f6f74682e636f6d0d0a
        Appearance: Unknown (0x0000)
