Bluetooth monitor ver 5.84
btmon[1736764]: = Note: Linux version 6.8.0-83-generic (x86_64)                                                          0.885751
btmon[1736764]: = Note: Bluetooth subsystem version 2.22                                                                 0.885753
= New Index: 00:00:00:00:00:00 (Primary,UART,hci0)                                                                       0.885754
= Open Index: 00:00:00:00:00:00                                                                                          1.389479
= Index Info: 00:00:00:00:00:00 (Nordic Semiconductor ASA)                                                               1.389648
zephyr.exe[1736766]: @ USER Open: main (privileged) version 2.22                                                {0x0001} 1.389697
zephyr.exe[1736766]: < HCI Command: Reset (0x03|0x0003) plen 0                                                        #1 1.390306
> HCI Event: Command Complete (0x0e) plen 4                                                                           #2 1.390953
      Reset (0x03|0x0003) ncmd 1
        Status: Success (0x00)
zephyr.exe[1736766]: < HCI Command: Read Local Supported Features (0x04|0x0003) plen 0                                #3 1.409491
> HCI Event: Command Complete (0x0e) plen 12                                                                          #4 1.410268
      Read Local Supported Features (0x04|0x0003) ncmd 1
        Status: Success (0x00)
        Features: 0x00 0x00 0x00 0x00 0x60 0x00 0x00 0x00
          BR/EDR Not Supported
          LE Supported (Controller)
zephyr.exe[1736766]: < HCI Command: Read Local Version Information (0x04|0x0001) plen 0                               #5 1.429490
> HCI Event: Command Complete (0x0e) plen 12                                                                          #6 1.430183
      Read Local Version Information (0x04|0x0001) ncmd 1
        Status: Success (0x00)
        HCI version: Reserved (0x0e) - Revision 12520 (0x30e8)
        LMP version: Reserved (0x0e) - Subversion 12520 (0x30e8)
        Manufacturer: Nordic Semiconductor ASA (89)
zephyr.exe[1736766]: < HCI Command: Read Local Supported Commands (0x04|0x0002) plen 0                                #7 1.449433
> HCI Event: Command Complete (0x0e) plen 68                                                                          #8 1.450690
      Read Local Supported Commands (0x04|0x0002) ncmd 1
        Status: Success (0x00)
        Commands: 119 entries
          Disconnect (Octet 0 - Bit 5)
          Read Remote Version Information (Octet 2 - Bit 7)
          Set Event Mask (Octet 5 - Bit 6)
          Reset (Octet 5 - Bit 7)
          Read Connection Accept Timeout (Octet 7 - Bit 2)
          Write Connection Accept Timeout (Octet 7 - Bit 3)
          Read Transmit Power Level (Octet 10 - Bit 2)
          Set Controller To Host Flow Control (Octet 10 - Bit 5)
          Host Buffer Size (Octet 10 - Bit 6)
          Host Number of Completed Packets (Octet 10 - Bit 7)
          Read Local Version Information (Octet 14 - Bit 3)
          Read Local Supported Features (Octet 14 - Bit 5)
          Read BD ADDR (Octet 15 - Bit 1)
          Read RSSI (Octet 15 - Bit 5)
          Set Event Mask Page 2 (Octet 22 - Bit 2)
          LE Set Event Mask (Octet 25 - Bit 0)
          LE Read Buffer Size (Octet 25 - Bit 1)
          LE Read Local Supported Features (Octet 25 - Bit 2)
          LE Set Random Address (Octet 25 - Bit 4)
          LE Set Advertising Parameters (Octet 25 - Bit 5)
          LE Read Advertising Channel TX Power (Octet 25 - Bit 6)
          LE Set Advertising Data (Octet 25 - Bit 7)
          LE Set Scan Response Data (Octet 26 - Bit 0)
          LE Set Advertise Enable (Octet 26 - Bit 1)
          LE Set Scan Parameters (Octet 26 - Bit 2)
          LE Set Scan Enable (Octet 26 - Bit 3)
          LE Create Connection (Octet 26 - Bit 4)
          LE Create Connection Cancel (Octet 26 - Bit 5)
          LE Read Accept List Size (Octet 26 - Bit 6)
          LE Clear Accept List (Octet 26 - Bit 7)
          LE Add Device To Accept List (Octet 27 - Bit 0)
          LE Remove Device From Accept List (Octet 27 - Bit 1)
          LE Connection Update (Octet 27 - Bit 2)
          LE Set Host Channel Classification (Octet 27 - Bit 3)
          LE Read Channel Map (Octet 27 - Bit 4)
          LE Read Remote Used Features (Octet 27 - Bit 5)
          LE Encrypt (Octet 27 - Bit 6)
          LE Rand (Octet 27 - Bit 7)
          LE Start Encryption (Octet 28 - Bit 0)
          LE Long Term Key Request Reply (Octet 28 - Bit 1)
          LE Long Term Key Request Neg Reply (Octet 28 - Bit 2)
          LE Read Supported States (Octet 28 - Bit 3)
          LE Receiver Test (Octet 28 - Bit 4)
          LE Transmitter Test (Octet 28 - Bit 5)
          LE Test End (Octet 28 - Bit 6)
          Read Authenticated Payload Timeout (Octet 32 - Bit 4)
          Write Authenticated Payload Timeout (Octet 32 - Bit 5)
          LE Set Data Length (Octet 33 - Bit 6)
          LE Read Suggested Default Data Length (Octet 33 - Bit 7)
          LE Write Suggested Default Data Length (Octet 34 - Bit 0)
          LE Add Device To Resolving List (Octet 34 - Bit 3)
          LE Remove Device From Resolving List (Octet 34 - Bit 4)
          LE Clear Resolving List (Octet 34 - Bit 5)
          LE Read Resolving List Size (Octet 34 - Bit 6)
          LE Set Address Resolution Enable (Octet 35 - Bit 1)
          LE Set Resolvable Private Address Timeout (Octet 35 - Bit 2)
          LE Read Maximum Data Length (Octet 35 - Bit 3)
          LE Read PHY (Octet 35 - Bit 4)
          LE Set Default PHY (Octet 35 - Bit 5)
          LE Set PHY (Octet 35 - Bit 6)
          LE Enhanced Receiver Test (Octet 35 - Bit 7)
          LE Enhanced Transmitter Test (Octet 36 - Bit 0)
          LE Set Advertising Set Random Address (Octet 36 - Bit 1)
          LE Set Extended Advertising Parameters (Octet 36 - Bit 2)
          LE Set Extended Advertising Data (Octet 36 - Bit 3)
          LE Set Extended Scan Response Data (Octet 36 - Bit 4)
          LE Set Extended Advertising Enable (Octet 36 - Bit 5)
          LE Read Maximum Advertising Data Length (Octet 36 - Bit 6)
          LE Read Number of Supported Advertising Sets (Octet 36 - Bit 7)
          LE Remove Advertising Set (Octet 37 - Bit 0)
          LE Clear Advertising Sets (Octet 37 - Bit 1)
          LE Set Periodic Advertising Parameters (Octet 37 - Bit 2)
          LE Set Periodic Advertising Data (Octet 37 - Bit 3)
          LE Set Periodic Advertising Enable (Octet 37 - Bit 4)
          LE Set Extended Scan Parameters (Octet 37 - Bit 5)
          LE Set Extended Scan Enable (Octet 37 - Bit 6)
          LE Extended Create Connection (Octet 37 - Bit 7)
          LE Periodic Advertising Create Sync (Octet 38 - Bit 0)
          LE Periodic Advertising Create Sync Cancel (Octet 38 - Bit 1)
          LE Periodic Advertising Terminate Sync (Octet 38 - Bit 2)
          LE Add Device To Periodic Advertiser List (Octet 38 - Bit 3)
          LE Remove Device From Periodic Advertiser List (Octet 38 - Bit 4)
          LE Clear Periodic Advertiser List (Octet 38 - Bit 5)
          LE Read Periodic Advertiser List Size (Octet 38 - Bit 6)
          LE Read Transmit Power (Octet 38 - Bit 7)
          LE Read RF Path Compensation (Octet 39 - Bit 0)
          LE Write RF Path Compensation (Octet 39 - Bit 1)
          LE Set Privacy Mode (Octet 39 - Bit 2)
          LE Periodic Advertising Receive Enable (Octet 40 - Bit 5)
          LE Periodic Advertising Sync Transfer (Octet 40 - Bit 6)
          LE Periodic Advertising Set Info Transfer (Octet 40 - Bit 7)
          LE Periodic Advertising Sync Transfer Parameters (Octet 41 - Bit 0)
          LE Set Default Periodic Advertisng Sync Transfer Parameters (Octet 41 - Bit 1)
          LE Read Buffer v2 (Octet 41 - Bit 5)
          LE Read ISO TX Sync (Octet 41 - Bit 6)
          LE Set Connected Isochronous Group Parameters (Octet 41 - Bit 7)
          LE Set Connected Isochronous Group Parameters Test (Octet 42 - Bit 0)
          LE Create Connected Isochronous Stream (Octet 42 - Bit 1)
          LE Remove Connected Isochronous Group (Octet 42 - Bit 2)
          LE Accept Connected Isochronous Stream Request (Octet 42 - Bit 3)
          LE Reject Connected Isochronous Stream Request (Octet 42 - Bit 4)
          LE Create Broadcast Isochronous Group (Octet 42 - Bit 5)
          LE Create Broadcast Isochronous Group Test (Octet 42 - Bit 6)
          LE Terminate Broadcast Isochronous Group (Octet 42 - Bit 7)
          LE Broadcast Isochronous Group Create Sync (Octet 43 - Bit 0)
          LE Broadcast Isochronous Group Terminate Sync (Octet 43 - Bit 1)
          LE Request Peer SCA (Octet 43 - Bit 2)
          LE Setup Isochronous Data Path (Octet 43 - Bit 3)
          LE Remove Isochronous Data Path (Octet 43 - Bit 4)
          LE Isochronous Transmit Test (Octet 43 - Bit 5)
          LE Isochronous Receive Test (Octet 43 - Bit 6)
          LE Isochronous Read Test Counters (Octet 43 - Bit 7)
          LE Isochronous Read Test Counters (Octet 44 - Bit 0)
          LE Set Host Feature (Octet 44 - Bit 1)
          LE Read ISO link quality (Octet 44 - Bit 2)
          Octet 45 - Bit 6 
          Octet 46 - Bit 0 
          Octet 46 - Bit 1 
          Octet 46 - Bit 2 
zephyr.exe[1736766]: < HCI Command: Host Buffer Size (0x03|0x0033) plen 7                                             #9 1.469495
        ACL MTU: 255  ACL max packet: 16
        SCO MTU: 0    SCO max packet: 0
> HCI Event: Command Complete (0x0e) plen 4                                                                          #10 1.470269
      Host Buffer Size (0x03|0x0033) ncmd 1
        Status: Success (0x00)
zephyr.exe[1736766]: < HCI Command: Set Controller To Host Flow Control (0x03|0x0031) plen 1                         #11 1.489496
        Flow control: ACL Data Packets (0x01)
> HCI Event: Command Complete (0x0e) plen 4                                                                          #12 1.490042
      Set Controller To Host Flow Control (0x03|0x0031) ncmd 1
        Status: Success (0x00)
zephyr.exe[1736766]: < HCI Command: LE Read Local Supported Features (0x08|0x0003) plen 0                            #13 1.509492
> HCI Event: Command Complete (0x0e) plen 12                                                                         #14 1.510166
      LE Read Local Supported Features (0x08|0x0003) ncmd 1
        Status: Success (0x00)
        Features: 0xfd 0x79 0x00 0xf7 0x30 0x01 0x00 0x00
          LE Encryption
          Extended Reject Indication
          Peripheral-initiated Features Exchange
          LE Ping
          LE Data Packet Length Extension
          LL Privacy
          Extended Scanner Filter Policies
          LE 2M PHY
          LE Coded PHY
          LE Extended Advertising
          LE Periodic Advertising
          Channel Selection Algorithm #2
          Periodic Advertising Sync Transfer - Sender
          Periodic Advertising Sync Transfer - Recipient
          Sleep Clock Accuracy Updates
          Connected Isochronous Stream - Central
          Connected Isochronous Stream - Peripheral
          Isochronous Broadcaster
          Synchronized Receiver
          Periodic Advertising ADI support
          Connection Subrating
          Unknown features (0x0000010000000000)
zephyr.exe[1736766]: < HCI Command: LE Set Host Feature (0x08|0x0074) plen 2                                         #15 1.529486
        Bit Number: 32
          Connected Isochronous Stream (Host Support)
        Bit Value: 1
> HCI Event: Command Complete (0x0e) plen 4                                                                          #16 1.530251
      LE Set Host Feature (0x08|0x0074) ncmd 1
        Status: Success (0x00)
zephyr.exe[1736766]: < HCI Command: LE Read Buffer v2 (0x08|0x0060) plen 0                                           #17 1.549481
> HCI Event: Command Complete (0x0e) plen 10                                                                         #18 1.550137
      LE Read Buffer v2 (0x08|0x0060) ncmd 1
        Status: Success (0x00)
        ACL MTU: 27
        ACL max packet: 3
        ISO MTU: 318
        ISO max packet: 3
zephyr.exe[1736766]: < HCI Command: LE Read Maximum Advertising Data Length (0x08|0x003a) plen 0                     #19 1.569516
> HCI Event: Command Complete (0x0e) plen 6                                                                          #20 1.570440
      LE Read Maximum Advertising Data Length (0x08|0x003a) ncmd 1
        Status: Success (0x00)
        Max length: 1650
zephyr.exe[1736766]: < HCI Command: LE Read Supported States (0x08|0x001c) plen 0                                    #21 1.589498
> HCI Event: Command Complete (0x0e) plen 12                                                                         #22 1.590395
      LE Read Supported States (0x08|0x001c) ncmd 1
        Status: Success (0x00)
        States: 0x000003ff3e0306ff
          Non-connectable Advertising State
          Scannable Advertising State
          Connectable Advertising State
          High Duty Cycle Directed Advertising State
          Passive Scanning State
          Active Scanning State
          Initiating State
            and Connection State (Central Role)
          Connection State (Peripheral Role)
          Scannable Advertising State
            and Passive Scanning State
          Connectable Advertising State
            and Passive Scanning State
          Non-connectable Advertising State
            and Initiating State
          Scannable Advertising State
            and Initiating State
          Active Scanning State
            and Connection State (Central Role)
          Passive Scanning State
            and Connection State (Peripheral Role)
          Active Scanning State
            and Connection State (Peripheral Role)
          Initiating State
            and Connection State (Central Role)
            and Central Role & Central Role
          Low Duty Cycle Directed Advertising State
          Connectable Advertising State
            and Initiating State
            and Central Role & Peripheral Role
          High Duty Cycle Directed Advertising State
            and Initiating State
            and Central Role & Peripheral Role
          Low Duty Cycle Directed Advertising State
            and Initiating State
            and Central Role & Peripheral Role
          Connectable Advertising State
            and Connection State (Central Role)
            and Central Role & Peripheral Role
          High Duty Cycle Directed Advertising State
            and Connection State (Central Role)
            and Central Role & Peripheral Role
          Low Duty Cycle Directed Advertising State
            and Connection State (Central Role)
            and Central Role & Peripheral Role
          Connectable Advertising State
            and Connection State (Peripheral Role)
            and Central Role & Peripheral Role
          High Duty Cycle Directed Advertising State
            and Connection State (Peripheral Role)
            and Peripheral Role & Peripheral Role
          Low Duty Cycle Directed Advertising State
            and Connection State (Peripheral Role)
            and Peripheral Role & Peripheral Role
          Initiating State
            and Connection State (Peripheral Role)
            and Central Role & Peripheral Role
zephyr.exe[1736766]: < HCI Command: LE Read Maximum Data Length (0x08|0x002f) plen 0                                 #23 1.609491
> HCI Event: Command Complete (0x0e) plen 12                                                                         #24 1.610142
      LE Read Maximum Data Length (0x08|0x002f) ncmd 1
        Status: Success (0x00)
        Max TX octets: 251
        Max TX time: 2704
        Max RX octets: 251
        Max RX time: 2704
zephyr.exe[1736766]: < HCI Command: LE Write Suggested Default Data Length (0x08|0x0024) plen 4                      #25 1.629493
        TX octets: 251
        TX time: 2704
> HCI Event: Command Complete (0x0e) plen 4                                                                          #26 1.630545
      LE Write Suggested Default Data Length (0x08|0x0024) ncmd 1
        Status: Success (0x00)
zephyr.exe[1736766]: < HCI Command: LE Read Resolving List Size (0x08|0x002a) plen 0                                 #27 1.649488
> HCI Event: Command Complete (0x0e) plen 5                                                                          #28 1.650024
      LE Read Resolving List Size (0x08|0x002a) ncmd 1
        Status: Success (0x00)
        Size: 8
zephyr.exe[1736766]: < HCI Command: LE Set Event Mask (0x08|0x0001) plen 8                                           #29 1.669504
        Mask: 0x000002023f87fa5e
          LE Advertising Report
          LE Connection Update Complete
          LE Read Remote Used Features Complete
          LE Long Term Key Request
          LE Data Length Change
          LE Enhanced Connection Complete
          LE PHY Update Complete
          LE Extended Advertising Report
          LE Periodic Advertising Sync Established
          LE Periodic Advertising Report
          LE Periodic Advertising Sync Lost
          LE Extended Scan Timeout
          LE Extended Advertising Set Terminated
          LE Scan Request Received
          LE Periodic Advertising Sync Transfer Rvc
          LE CIS Established
          LE CIS Request
          LE Create BIG Complete
          LE Terminate BIG Complete
          LE BIG Sync Established Complete
          LE BIG Sync Lost
          LE BIG Info Advertising Report
          Unknown mask (0x0000020000000000)
> HCI Event: Command Complete (0x0e) plen 4                                                                          #30 1.670314
      LE Set Event Mask (0x08|0x0001) ncmd 1
        Status: Success (0x00)
zephyr.exe[1736766]: < HCI Command: Set Event Mask (0x03|0x0001) plen 8                                              #31 1.689501
        Mask: 0x2000800002008890
          Disconnection Complete
          Encryption Change
          Read Remote Version Information Complete
          Hardware Error
          Data Buffer Overflow
          Encryption Key Refresh Complete
          LE Meta
> HCI Event: Command Complete (0x0e) plen 4                                                                          #32 1.690411
      Set Event Mask (0x03|0x0001) ncmd 1
        Status: Success (0x00)
zephyr.exe[1736766]: < HCI Command: Read BD ADDR (0x04|0x0009) plen 0                                                #33 1.709496
> HCI Event: Command Complete (0x0e) plen 10                                                                         #34 1.710144
      Read BD ADDR (0x04|0x0009) ncmd 1
        Status: Success (0x00)
        Address: 00:00:00:00:00:00 (OUI 00-00-00)
zephyr.exe[1736766]: < HCI Command: LE Set Random Address (0x08|0x0005) plen 6                                       #35 1.731251
        Address: D5:B6:CC:31:DB:3B (Static)
> HCI Event: Command Complete (0x0e) plen 4                                                                          #36 1.732285
      LE Set Random Address (0x08|0x0005) ncmd 1
        Status: Success (0x00)
zephyr.exe[1736766]: < HCI Command: LE Set Extended Advertising Parameters (0x08|0x0036) plen 25                     #37 4.009586
        Handle: 0x00
        Properties: 0x0013
          Connectable
          Scannable
          Use legacy advertising PDUs: ADV_IND
        Min advertising interval: 100.000 msec (0x00a0)
        Max advertising interval: 150.000 msec (0x00f0)
        Channel map: 37, 38, 39 (0x07)
        Own address type: Random (0x01)
        Peer address type: Public (0x00)
        Peer address: 00:00:00:00:00:00 (OUI 00-00-00)
        Filter policy: Allow Scan Request from Any, Allow Connect Request from Any (0x00)
        TX power: Host has no preference (0x7f)
        Primary PHY: LE 1M (0x01)
        Secondary max skip: 0x00
        Secondary PHY: LE 1M (0x01)
        SID: 0x00
        Scan request notifications: Disabled (0x00)
> HCI Event: Command Complete (0x0e) plen 5                                                                          #38 4.010690
      LE Set Extended Advertising Parameters (0x08|0x0036) ncmd 1
        Status: Success (0x00)
        TX power (selected): 0 dbm (0x00)
zephyr.exe[1736766]: < HCI Command: LE Set Advertising Set Random Address (0x08|0x0035) plen 7                       #39 4.029540
        Advertising handle: 0x00
        Advertising random address: D5:B6:CC:31:DB:3B (Static)
> HCI Event: Command Complete (0x0e) plen 4                                                                          #40 4.030360
      LE Set Advertising Set Random Address (0x08|0x0035) ncmd 1
        Status: Success (0x00)
zephyr.exe[1736766]: < HCI Command: LE Set Extended Advertising Data (0x08|0x0037) plen 22                           #41 4.049535
        Handle: 0x00
        Operation: Complete extended advertising data (0x03)
        Fragment preference: Minimize fragmentation (0x01)
        Data length: 0x12
        Flags: 0x06
          LE General Discoverable Mode
          BR/EDR Not Supported
        Name (complete): Tester_2CB6EE
> HCI Event: Command Complete (0x0e) plen 4                                                                          #42 4.050463
      LE Set Extended Advertising Data (0x08|0x0037) ncmd 1
        Status: Success (0x00)
zephyr.exe[1736766]: < HCI Command: LE Set Extended Scan Response Data (0x08|0x0038) plen 4                          #43 4.069536
        Handle: 0x00
        Operation: Complete scan response data (0x03)
        Fragment preference: Minimize fragmentation (0x01)
        Data length: 0x00
> HCI Event: Command Complete (0x0e) plen 4                                                                          #44 4.070166
      LE Set Extended Scan Response Data (0x08|0x0038) ncmd 1
        Status: Success (0x00)
zephyr.exe[1736766]: < HCI Command: LE Set Extended Advertising Enable (0x08|0x0039) plen 6                          #45 4.089509
        Extended advertising: Enabled (0x01)
        Number of sets: 1 (0x01)
        Entry 0
          Handle: 0x00
          Duration: 0 ms (0x00)
          Max ext adv events: 0
> HCI Event: Command Complete (0x0e) plen 4                                                                          #46 4.090268
      LE Set Extended Advertising Enable (0x08|0x0039) ncmd 1
        Status: Success (0x00)
> HCI Event: LE Meta Event (0x3e) plen 31                                                                            #47 4.203982
      LE Enhanced Connection Complete (0x0a)
        Status: Success (0x00)
        Handle: 381
        Role: Peripheral (0x01)
        Peer address type: Public (0x00)
        Peer address: C0:07:E8:2C:B6:EE (OUI C0-07-E8)
        Local resolvable private address: 00:00:00:00:00:00 (Non-Resolvable)
        Peer resolvable private address: 00:00:00:00:00:00 (Non-Resolvable)
        Connection interval: 62.50 msec (0x0032)
        Connection latency: 0 (0x0000)
        Supervision timeout: 25120 msec (0x09d0)
        Central clock accuracy: 0x07
> HCI Event: LE Meta Event (0x3e) plen 6                                                                             #48 4.204155
      LE Advertising Set Terminated (0x12)
        Status: Success (0x00)
        Handle: 0
        Connection handle: 381
        Number of completed extended advertising events: 0
zephyr.exe[1736766]: < HCI Command: LE Read Remote Used Features (0x08|0x0016) plen 2                                #49 4.209628
        Handle: 381 Address: C0:07:E8:2C:B6:EE (OUI C0-07-E8)
> HCI Event: Command Status (0x0f) plen 4                                                                            #50 4.210784
      LE Read Remote Used Features (0x08|0x0016) ncmd 1
        Status: Success (0x00)
zephyr.exe[1736766]: < HCI Command: LE Set PHY (0x08|0x0032) plen 7                                                  #51 4.229511
        Handle: 381 Address: C0:07:E8:2C:B6:EE (OUI C0-07-E8)
        All PHYs preference: 0x00
        TX PHYs preference: 0x02
          LE 2M
        RX PHYs preference: 0x02
          LE 2M
        PHY options preference: Reserved (0x0000)
> HCI Event: Command Status (0x0f) plen 4                                                                            #52 4.230431
      LE Set PHY (0x08|0x0032) ncmd 1
        Status: Success (0x00)
zephyr.exe[1736766]: < ACL Data TX: Handle 381 [1/3] flags 0x00 dlen 7                                               #53 4.249481
      ATT: Exchange MTU Request (0x02) len 2
        Client RX MTU: 251
> HCI Event: Number of Completed Packets (0x13) plen 5                                                               #54 4.330021
        Num handles: 1
        Handle: 381 Address: C0:07:E8:2C:B6:EE (OUI C0-07-E8)
        Count: 1
        Buffers: 0/3
        #53: len 7 (0 Kb/s)
        Latency: 80 msec (80-80 msec ~80 msec)
> HCI Event: LE Meta Event (0x3e) plen 12                                                                            #55 4.392969
      LE Read Remote Used Features (0x04)
        Status: Success (0x00)
        Handle: 381 Address: C0:07:E8:2C:B6:EE (OUI C0-07-E8)
        Features: 0x2d 0x49 0x01 0xf7 0xef 0x39 0x00 0x80
          LE Encryption
          Extended Reject Indication
          Peripheral-initiated Features Exchange
          LE Data Packet Length Extension
          LE 2M PHY
          LE Coded PHY
          Channel Selection Algorithm #2
          Minimum Number of Used Channels Procedure
          Periodic Advertising Sync Transfer - Sender
          Periodic Advertising Sync Transfer - Recipient
          Sleep Clock Accuracy Updates
          Connected Isochronous Stream - Central
          Connected Isochronous Stream - Peripheral
          Isochronous Broadcaster
          Synchronized Receiver
          Connected Isochronous Stream (Host Support)
          LE Power Control Request
          LE Power Control Request
          LE Path Loss Monitoring
          Connection Subrating
          Connection Subrating (Host Support)
          Channel Classification
          Unknown features (0x8000390000000000)
> ACL Data RX: Handle 381 flags 0x02 dlen 7                                                                          #56 4.705105
      ATT: Exchange MTU Request (0x02) len 2
        Client RX MTU: 60
> ACL Data RX: Handle 381 flags 0x02 dlen 7                                                                          #57 4.705571
      ATT: Exchange MTU Response (0x03) len 2
        Server RX MTU: 60
zephyr.exe[1736766]: < HCI Command: Host Number of Completed Packets (0x03|0x0035) plen 5                            #58 4.709689
        Num handles: 1
        Handle: 381 Address: C0:07:E8:2C:B6:EE (OUI C0-07-E8)
        Count: 1
zephyr.exe[1736766]: < ACL Data TX: Handle 381 [1/3] flags 0x00 dlen 7                                               #59 4.709963
      ATT: Exchange MTU Response (0x03) len 2
        Server RX MTU: 251
zephyr.exe[1736766]: < HCI Command: Host Number of Completed Packets (0x03|0x0035) plen 5                            #60 4.710039
        Num handles: 1
        Handle: 381 Address: C0:07:E8:2C:B6:EE (OUI C0-07-E8)
        Count: 1
> HCI Event: Number of Completed Packets (0x13) plen 5                                                               #61 4.829925
        Num handles: 1
        Handle: 381 Address: C0:07:E8:2C:B6:EE (OUI C0-07-E8)
        Count: 1
        Buffers: 0/3
        #59: len 7 (0 Kb/s)
        Latency: 119 msec (80-119 msec ~100 msec)
> HCI Event: LE Meta Event (0x3e) plen 6                                                                             #62 4.892150
      LE PHY Update Complete (0x0c)
        Status: Success (0x00)
        Handle: 381 Address: C0:07:E8:2C:B6:EE (OUI C0-07-E8)
        TX PHY: LE 2M (0x02)
        RX PHY: LE 2M (0x02)
> ACL Data RX: Handle 381 flags 0x02 dlen 11                                                                         #63 6.830087
      SMP: Pairing Request (0x01) len 6
        IO capability: KeyboardDisplay (0x04)
        OOB data: Authentication data not present (0x00)
        Authentication requirement: Bonding, MITM, SC, No Keypresses (0x0d)
        Max encryption key size: 16
        Initiator key distribution: EncKey IdKey (0x03)
        Responder key distribution: EncKey IdKey Sign (0x07)
zephyr.exe[1736766]: < HCI Command: Host Number of Completed Packets (0x03|0x0035) plen 5                            #64 6.849558
        Num handles: 1
        Handle: 381 Address: C0:07:E8:2C:B6:EE (OUI C0-07-E8)
        Count: 1
zephyr.exe[1736766]: < ACL Data TX: Handle 381 [1/3] flags 0x00 dlen 11                                              #65 6.850173
      SMP: Pairing Response (0x02) len 6
        IO capability: NoInputNoOutput (0x03)
        OOB data: Authentication data not present (0x00)
        Authentication requirement: Bonding, No MITM, SC, No Keypresses (0x09)
        Max encryption key size: 16
        Initiator key distribution: IdKey (0x02)
        Responder key distribution: Sign (0x04)
> HCI Event: Number of Completed Packets (0x13) plen 5                                                               #66 6.955162
        Num handles: 1
        Handle: 381 Address: C0:07:E8:2C:B6:EE (OUI C0-07-E8)
        Count: 1
        Buffers: 0/3
        #65: len 11 (0 Kb/s)
        Latency: 104 msec (80-119 msec ~102 msec)
> ACL Data RX: Handle 381 flags 0x02 dlen 27                                                                         #67 6.955501
> ACL Data RX: Handle 381 flags 0x01 dlen 27                                                                         #68 6.955856
> ACL Data RX: Handle 381 flags 0x01 dlen 15                                                                         #69 6.956063
      SMP: Pairing Public Key (0x0c) len 64
        X[32]: 82b9dd77e2d22e1a8a62b60009fa1fef41e7dbe1d720325d274c1caf17c55567
        Y[32]: b9cb50cf7747398e057bd3bdc8d4de91e8f3a7a42dc20dc6656416001487f0bf
zephyr.exe[1736766]: < HCI Command: Host Number of Completed Packets (0x03|0x0035) plen 5                            #70 6.969607
        Num handles: 1
        Handle: 381 Address: C0:07:E8:2C:B6:EE (OUI C0-07-E8)
        Count: 1
zephyr.exe[1736766]: < HCI Command: Host Number of Completed Packets (0x03|0x0035) plen 5                            #71 6.969910
        Num handles: 1
        Handle: 381 Address: C0:07:E8:2C:B6:EE (OUI C0-07-E8)
        Count: 1
zephyr.exe[1736766]: < HCI Command: Host Number of Completed Packets (0x03|0x0035) plen 5                            #72 6.970028
        Num handles: 1
        Handle: 381 Address: C0:07:E8:2C:B6:EE (OUI C0-07-E8)
        Count: 1
zephyr.exe[1736766]: < ACL Data TX: Handle 381 [1/3] flags 0x00 dlen 27                                              #73 6.970059
zephyr.exe[1736766]: < ACL Data TX: Handle 381 flags 0x01 dlen 27                                                    #74 6.970086
zephyr.exe[1736766]: < ACL Data TX: Handle 381 flags 0x01 dlen 15                                                    #75 6.970101
      SMP: Pairing Public Key (0x0c) len 64
        X[32]: 98308440221e2d910f0e54b71e7ec652857aa9b5a0dc65028824cc19db1226e9
        Y[32]: 67a4816bcb62efb21701e31fdb27561a6217575fb007a8bbdabe7e28b6f68482
> HCI Event: Number of Completed Packets (0x13) plen 5                                                               #76 7.017979
        Num handles: 1
        Handle: 381 Address: C0:07:E8:2C:B6:EE (OUI C0-07-E8)
        Count: 1
        Buffers: 0/3
        #73: len 27 (4 Kb/s)
        Latency: 47 msec (47-119 msec ~75 msec)
> HCI Event: Number of Completed Packets (0x13) plen 5                                                               #77 7.018410
        Num handles: 1
        Handle: 381 Address: C0:07:E8:2C:B6:EE (OUI C0-07-E8)
        Count: 1
        Buffers: underflow/3
        #74: len 27 (4 Kb/s)
        Latency: 48 msec (47-119 msec ~61 msec)
zephyr.exe[1736766]: < ACL Data TX: Handle 381 [1/3] flags 0x00 dlen 21                                              #78 7.029511
      SMP: Pairing Confirm (0x03) len 16
        Confirm value[16]: 0007067a9ccc6b0b6cdc776ec62d7133
> HCI Event: Number of Completed Packets (0x13) plen 5                                                               #79 7.079961
        Num handles: 1
        Handle: 381 Address: C0:07:E8:2C:B6:EE (OUI C0-07-E8)
        Count: 1
        Buffers: 0/3
        #75: len 15 (1 Kb/s)
        Latency: 109 msec (47-119 msec ~85 msec)
> HCI Event: Number of Completed Packets (0x13) plen 5                                                               #80 7.142621
        Num handles: 1
        Handle: 381 Address: C0:07:E8:2C:B6:EE (OUI C0-07-E8)
        Count: 1
        Buffers: underflow/3
        #78: len 21 (1 Kb/s)
        Latency: 113 msec (47-119 msec ~99 msec)
> ACL Data RX: Handle 381 flags 0x02 dlen 21                                                                         #81 7.142848
      SMP: Pairing Random (0x04) len 16
        Random value[16]: 87d91c8c3ea266f80000000000000000
zephyr.exe[1736766]: < HCI Command: Host Number of Completed Packets (0x03|0x0035) plen 5                            #82 7.149713
        Num handles: 1
        Handle: 381 Address: C0:07:E8:2C:B6:EE (OUI C0-07-E8)
        Count: 1
zephyr.exe[1736766]: < ACL Data TX: Handle 381 [1/3] flags 0x00 dlen 21                                              #83 7.149873
      SMP: Pairing Random (0x04) len 16
        Random value[16]: 8e6108f966a694cbe26df70bb96773e6
> HCI Event: Number of Completed Packets (0x13) plen 5                                                               #84 7.267439
        Num handles: 1
        Handle: 381 Address: C0:07:E8:2C:B6:EE (OUI C0-07-E8)
        Count: 1
        Buffers: 0/3
        #83: len 21 (1 Kb/s)
        Latency: 117 msec (47-119 msec ~108 msec)
> ACL Data RX: Handle 381 flags 0x02 dlen 21                                                                         #85 7.330367
      SMP: Pairing DHKey Check (0x0d) len 16
        E[16]: 94c00f5d01ba297720c57ffa8853efe1
zephyr.exe[1736766]: < HCI Command: Host Number of Completed Packets (0x03|0x0035) plen 5                            #86 7.349628
        Num handles: 1
        Handle: 381 Address: C0:07:E8:2C:B6:EE (OUI C0-07-E8)
        Count: 1
zephyr.exe[1736766]: < ACL Data TX: Handle 381 [1/3] flags 0x00 dlen 21                                              #87 7.349865
      SMP: Pairing DHKey Check (0x0d) len 16
        E[16]: b009941c0eefeda83bbe1fd2d80dc6ec
> HCI Event: Number of Completed Packets (0x13) plen 5                                                               #88 7.454976
        Num handles: 1
        Handle: 381 Address: C0:07:E8:2C:B6:EE (OUI C0-07-E8)
        Count: 1
        Buffers: 0/3
        #87: len 21 (1 Kb/s)
        Latency: 105 msec (47-119 msec ~106 msec)
> HCI Event: LE Meta Event (0x3e) plen 13                                                                            #89 7.517907
      LE Long Term Key Request (0x05)
        Handle: 381 Address: C0:07:E8:2C:B6:EE (OUI C0-07-E8)
        Random number: 0x0000000000000000
        Encrypted diversifier: 0x0000
zephyr.exe[1736766]: < HCI Command: LE Long Term Key Request Reply (0x08|0x001a) plen 18                             #90 7.529563
        Handle: 381 Address: C0:07:E8:2C:B6:EE (OUI C0-07-E8)
        Long term key[16]: ae054985c7e03b99ee9cfb1f6a80bcd8
> HCI Event: Command Complete (0x0e) plen 6                                                                          #91 7.530532
      LE Long Term Key Request Reply (0x08|0x001a) ncmd 1
        Status: Success (0x00)
        Handle: 381 Address: C0:07:E8:2C:B6:EE (OUI C0-07-E8)
> HCI Event: Encryption Change (0x08) plen 4                                                                         #92 7.830222
        Status: Success (0x00)
        Handle: 381 Address: C0:07:E8:2C:B6:EE (OUI C0-07-E8)
        Encryption: Enabled with AES-CCM (0x01)
zephyr.exe[1736766]: < ACL Data TX: Handle 381 [1/3] flags 0x00 dlen 21                                              #93 7.959671
      SMP: Signing Information (0x0a) len 16
        Signature key[16]: 5da095555cc64d02679f89a05211af56
> HCI Event: Number of Completed Packets (0x13) plen 5                                                               #94 8.080015
        Num handles: 1
        Handle: 381 Address: C0:07:E8:2C:B6:EE (OUI C0-07-E8)
        Count: 1
        Buffers: 0/3
        #93: len 21 (1 Kb/s)
        Latency: 120 msec (47-120 msec ~113 msec)
> ACL Data RX: Handle 381 flags 0x02 dlen 21                                                                         #95 8.080317
      SMP: Identity Information (0x08) len 16
        Identity resolving key[16]: dd1812cc977c6d6ce83a61457e56b692
> ACL Data RX: Handle 381 flags 0x02 dlen 12                                                                         #96 8.080564
      SMP: Identity Address Information (0x09) len 7
        Address: C0:07:E8:2C:B6:EE (OUI C0-07-E8)
zephyr.exe[1736766]: < HCI Command: Host Number of Completed Packets (0x03|0x0035) plen 5                            #97 8.089621
        Num handles: 1
        Handle: 381 Address: C0:07:E8:2C:B6:EE (OUI C0-07-E8)
        Count: 1
zephyr.exe[1736766]: < HCI Command: LE Add Device To Resolving List (0x08|0x0027) plen 39                            #98 8.089976
        Address type: Public (0x00)
        Address: C0:07:E8:2C:B6:EE (OUI C0-07-E8)
        Peer identity resolving key[16]: dd1812cc977c6d6ce83a61457e56b692
        Local identity resolving key[16]: 00000000000000000000000000000000
> HCI Event: Command Complete (0x0e) plen 4                                                                          #99 8.091533
      LE Add Device To Resolving List (0x08|0x0027) ncmd 1
        Status: Success (0x00)
zephyr.exe[1736766]: < HCI Command: LE Set Privacy Mode (0x08|0x004e) plen 8                                        #100 8.109546
        Peer Identity address type: Public (0x00)
        Peer Identity address: C0:07:E8:2C:B6:EE (OUI C0-07-E8)
        Privacy Mode: Use Device Privacy (0x01)
> HCI Event: Command Complete (0x0e) plen 4                                                                         #101 8.110364
      LE Set Privacy Mode (0x08|0x004e) ncmd 1
        Status: Success (0x00)
zephyr.exe[1736766]: < HCI Command: LE Set Address Resolution Enable (0x08|0x002d) plen 1                           #102 8.129510
        Address resolution: Enabled (0x01)
> HCI Event: Command Complete (0x0e) plen 4                                                                         #103 8.130212
      LE Set Address Resolution Enable (0x08|0x002d) ncmd 1
        Status: Success (0x00)
zephyr.exe[1736766]: < HCI Command: Host Number of Completed Packets (0x03|0x0035) plen 5                           #104 8.149648
        Num handles: 1
        Handle: 381 Address: C0:07:E8:2C:B6:EE (OUI C0-07-E8)
        Count: 1
> ACL Data RX: Handle 381 flags 0x02 dlen 13                                                                        #105 8.205120
      ATT: Find By Type Value Request (0x06) len 8
        Handle range: 0x0001-0xffff
        Attribute type: Primary Service (0x2800)
          UUID: Published Audio Capabilities (0x1850)
zephyr.exe[1736766]: < HCI Command: Host Number of Completed Packets (0x03|0x0035) plen 5                           #106 8.209612
        Num handles: 1
        Handle: 381 Address: C0:07:E8:2C:B6:EE (OUI C0-07-E8)
        Count: 1
zephyr.exe[1736766]: < ACL Data TX: Handle 381 [1/3] flags 0x00 dlen 9                                              #107 8.209788
      ATT: Find By Type Value Response (0x07) len 4
        Handle range: 0x0024-0x0036
> HCI Event: Number of Completed Packets (0x13) plen 5                                                              #108 8.392558
        Num handles: 1
        Handle: 381 Address: C0:07:E8:2C:B6:EE (OUI C0-07-E8)
        Count: 1
        Buffers: 0/3
        #107: len 9 (0 Kb/s)
        Latency: 182 msec (47-182 msec ~148 msec)
> ACL Data RX: Handle 381 flags 0x02 dlen 13                                                                        #109 8.392911
      ATT: Find By Type Value Request (0x06) len 8
        Handle range: 0x0037-0xffff
        Attribute type: Primary Service (0x2800)
          UUID: Published Audio Capabilities (0x1850)
zephyr.exe[1736766]: < HCI Command: Host Number of Completed Packets (0x03|0x0035) plen 5                           #110 8.409666
        Num handles: 1
        Handle: 381 Address: C0:07:E8:2C:B6:EE (OUI C0-07-E8)
        Count: 1
zephyr.exe[1736766]: < ACL Data TX: Handle 381 [1/3] flags 0x00 dlen 9                                              #111 8.410003
      ATT: Error Response (0x01) len 4
        Find By Type Value Request (0x06)
        Handle: 0x0037
        Error: Attribute Not Found (0x0a)
> HCI Event: Number of Completed Packets (0x13) plen 5                                                              #112 8.517524
        Num handles: 1
        Handle: 381 Address: C0:07:E8:2C:B6:EE (OUI C0-07-E8)
        Count: 1
        Buffers: 0/3
        #111: len 9 (0 Kb/s)
        Latency: 107 msec (47-182 msec ~127 msec)
> ACL Data RX: Handle 381 flags 0x02 dlen 11                                                                        #113 8.517779
      ATT: Read By Type Request (0x08) len 6
        Handle range: 0x0024-0x0036
        Attribute type: Characteristic (0x2803)
zephyr.exe[1736766]: < HCI Command: Host Number of Completed Packets (0x03|0x0035) plen 5                           #114 8.529709
        Num handles: 1
        Handle: 381 Address: C0:07:E8:2C:B6:EE (OUI C0-07-E8)
        Count: 1
zephyr.exe[1736766]: < ACL Data TX: Handle 381 [1/3] flags 0x00 dlen 27                                             #115 8.529964
zephyr.exe[1736766]: < ACL Data TX: Handle 381 flags 0x01 dlen 21                                                   #116 8.530035
      ATT: Read By Type Response (0x09) len 43
        Attribute data length: 7
        Attribute data list: 6 entries
        Handle: 0x0025
        Value[5]: 122600c92b
            Properties: 0x12
              Read (0x02)
              Notify (0x10)
            Value Handle: 0x0026
            Value UUID: Sink PAC (0x2bc9)
        Handle: 0x0028
        Value[5]: 1a2900ca2b
            Properties: 0x1a
              Read (0x02)
              Write (0x08)
              Notify (0x10)
            Value Handle: 0x0029
            Value UUID: Sink Audio Locations (0x2bca)
        Handle: 0x002b
        Value[5]: 122c00cb2b
            Properties: 0x12
              Read (0x02)
              Notify (0x10)
            Value Handle: 0x002c
            Value UUID: Source PAC (0x2bcb)
        Handle: 0x002e
        Value[5]: 1a2f00cc2b
            Properties: 0x1a
              Read (0x02)
              Write (0x08)
              Notify (0x10)
            Value Handle: 0x002f
            Value UUID: Source Audio Locations (0x2bcc)
        Handle: 0x0031
        Value[5]: 123200cd2b
            Properties: 0x12
              Read (0x02)
              Notify (0x10)
            Value Handle: 0x0032
            Value UUID: Available Audio Contexts (0x2bcd)
        Handle: 0x0034
        Value[5]: 123500ce2b
            Properties: 0x12
              Read (0x02)
              Notify (0x10)
            Value Handle: 0x0035
            Value UUID: Supported Audio Contexts (0x2bce)
> HCI Event: Number of Completed Packets (0x13) plen 5                                                              #117 8.580892
        Num handles: 1
        Handle: 381 Address: C0:07:E8:2C:B6:EE (OUI C0-07-E8)
        Count: 1
        Buffers: 0/3
        #115: len 27 (4 Kb/s)
        Latency: 50 msec (47-182 msec ~89 msec)
> HCI Event: Number of Completed Packets (0x13) plen 5                                                              #118 8.645084
        Num handles: 1
        Handle: 381 Address: C0:07:E8:2C:B6:EE (OUI C0-07-E8)
        Count: 1
        Buffers: underflow/3
        #116: len 21 (1 Kb/s)
        Latency: 115 msec (47-182 msec ~102 msec)
> ACL Data RX: Handle 381 flags 0x02 dlen 11                                                                        #119 8.645087
      ATT: Read By Type Request (0x08) len 6
        Handle range: 0x0035-0x0036
        Attribute type: Characteristic (0x2803)
zephyr.exe[1736766]: < HCI Command: Host Number of Completed Packets (0x03|0x0035) plen 5                           #120 8.649616
        Num handles: 1
        Handle: 381 Address: C0:07:E8:2C:B6:EE (OUI C0-07-E8)
        Count: 1
zephyr.exe[1736766]: < ACL Data TX: Handle 381 [1/3] flags 0x00 dlen 9                                              #121 8.650564
      ATT: Error Response (0x01) len 4
        Read By Type Request (0x08)
        Handle: 0x0035
        Error: Attribute Not Found (0x0a)
> HCI Event: Number of Completed Packets (0x13) plen 5                                                              #122 8.767564
        Num handles: 1
        Handle: 381 Address: C0:07:E8:2C:B6:EE (OUI C0-07-E8)
        Count: 1
        Buffers: 0/3
        #121: len 9 (0 Kb/s)
        Latency: 117 msec (47-182 msec ~109 msec)
> ACL Data RX: Handle 381 flags 0x02 dlen 9                                                                         #123 8.768026
      ATT: Find Information Request (0x04) len 4
        Handle range: 0x0027-0x0027
zephyr.exe[1736766]: < HCI Command: Host Number of Completed Packets (0x03|0x0035) plen 5                           #124 8.769733
        Num handles: 1
        Handle: 381 Address: C0:07:E8:2C:B6:EE (OUI C0-07-E8)
        Count: 1
zephyr.exe[1736766]: < ACL Data TX: Handle 381 [1/3] flags 0x00 dlen 10                                             #125 8.770073
      ATT: Find Information Response (0x05) len 5
        Format: UUID-16 (0x01)
        Handle: 0x0027
        UUID: Client Characteristic Configuration (0x2902)
> HCI Event: Number of Completed Packets (0x13) plen 5                                                              #126 8.892589
        Num handles: 1
        Handle: 381 Address: C0:07:E8:2C:B6:EE (OUI C0-07-E8)
        Count: 1
        Buffers: 0/3
        #125: len 10 (0 Kb/s)
        Latency: 122 msec (47-182 msec ~116 msec)
> ACL Data RX: Handle 381 flags 0x02 dlen 9                                                                         #127 8.893145
      ATT: Find Information Request (0x04) len 4
        Handle range: 0x002a-0x002a
zephyr.exe[1736766]: < HCI Command: Host Number of Completed Packets (0x03|0x0035) plen 5                           #128 8.909721
        Num handles: 1
        Handle: 381 Address: C0:07:E8:2C:B6:EE (OUI C0-07-E8)
        Count: 1
zephyr.exe[1736766]: < ACL Data TX: Handle 381 [1/3] flags 0x00 dlen 10                                             #129 8.910121
      ATT: Find Information Response (0x05) len 5
        Format: UUID-16 (0x01)
        Handle: 0x002a
        UUID: Client Characteristic Configuration (0x2902)
> HCI Event: Number of Completed Packets (0x13) plen 5                                                              #130 9.017577
        Num handles: 1
        Handle: 381 Address: C0:07:E8:2C:B6:EE (OUI C0-07-E8)
        Count: 1
        Buffers: 0/3
        #129: len 10 (0 Kb/s)
        Latency: 107 msec (47-182 msec ~111 msec)
> ACL Data RX: Handle 381 flags 0x02 dlen 9                                                                         #131 9.018131
      ATT: Find Information Request (0x04) len 4
        Handle range: 0x002d-0x002d
zephyr.exe[1736766]: < HCI Command: Host Number of Completed Packets (0x03|0x0035) plen 5                           #132 9.029637
        Num handles: 1
        Handle: 381 Address: C0:07:E8:2C:B6:EE (OUI C0-07-E8)
        Count: 1
zephyr.exe[1736766]: < ACL Data TX: Handle 381 [1/3] flags 0x00 dlen 10                                             #133 9.030217
      ATT: Find Information Response (0x05) len 5
        Format: UUID-16 (0x01)
        Handle: 0x002d
        UUID: Client Characteristic Configuration (0x2902)
> HCI Event: Number of Completed Packets (0x13) plen 5                                                              #134 9.142552
        Num handles: 1
        Handle: 381 Address: C0:07:E8:2C:B6:EE (OUI C0-07-E8)
        Count: 1
        Buffers: 0/3
        #133: len 10 (0 Kb/s)
        Latency: 112 msec (47-182 msec ~112 msec)
> ACL Data RX: Handle 381 flags 0x02 dlen 9                                                                         #135 9.142818
      ATT: Find Information Request (0x04) len 4
        Handle range: 0x0030-0x0030
zephyr.exe[1736766]: < HCI Command: Host Number of Completed Packets (0x03|0x0035) plen 5                           #136 9.149600
        Num handles: 1
        Handle: 381 Address: C0:07:E8:2C:B6:EE (OUI C0-07-E8)
        Count: 1
zephyr.exe[1736766]: < ACL Data TX: Handle 381 [1/3] flags 0x00 dlen 10                                             #137 9.150193
      ATT: Find Information Response (0x05) len 5
        Format: UUID-16 (0x01)
        Handle: 0x0030
        UUID: Client Characteristic Configuration (0x2902)
> HCI Event: Number of Completed Packets (0x13) plen 5                                                              #138 9.267656
        Num handles: 1
        Handle: 381 Address: C0:07:E8:2C:B6:EE (OUI C0-07-E8)
        Count: 1
        Buffers: 0/3
        #137: len 10 (0 Kb/s)
        Latency: 117 msec (47-182 msec ~114 msec)
> ACL Data RX: Handle 381 flags 0x02 dlen 9                                                                         #139 9.268028
      ATT: Find Information Request (0x04) len 4
        Handle range: 0x0033-0x0033
zephyr.exe[1736766]: < HCI Command: Host Number of Completed Packets (0x03|0x0035) plen 5                           #140 9.269634
        Num handles: 1
        Handle: 381 Address: C0:07:E8:2C:B6:EE (OUI C0-07-E8)
        Count: 1
zephyr.exe[1736766]: < ACL Data TX: Handle 381 [1/3] flags 0x00 dlen 10                                             #141 9.270182
      ATT: Find Information Response (0x05) len 5
        Format: UUID-16 (0x01)
        Handle: 0x0033
        UUID: Client Characteristic Configuration (0x2902)
> HCI Event: Number of Completed Packets (0x13) plen 5                                                              #142 9.392613
        Num handles: 1
        Handle: 381 Address: C0:07:E8:2C:B6:EE (OUI C0-07-E8)
        Count: 1
        Buffers: 0/3
        #141: len 10 (0 Kb/s)
        Latency: 122 msec (47-182 msec ~118 msec)
> ACL Data RX: Handle 381 flags 0x02 dlen 9                                                                         #143 9.392763
      ATT: Find Information Request (0x04) len 4
        Handle range: 0x0036-0x0036
zephyr.exe[1736766]: < HCI Command: Host Number of Completed Packets (0x03|0x0035) plen 5                           #144 9.409699
        Num handles: 1
        Handle: 381 Address: C0:07:E8:2C:B6:EE (OUI C0-07-E8)
        Count: 1
zephyr.exe[1736766]: < ACL Data TX: Handle 381 [1/3] flags 0x00 dlen 10                                             #145 9.410250
      ATT: Find Information Response (0x05) len 5
        Format: UUID-16 (0x01)
        Handle: 0x0036
        UUID: Client Characteristic Configuration (0x2902)
> HCI Event: Number of Completed Packets (0x13) plen 5                                                              #146 9.517595
        Num handles: 1
        Handle: 381 Address: C0:07:E8:2C:B6:EE (OUI C0-07-E8)
        Count: 1
        Buffers: 0/3
        #145: len 10 (0 Kb/s)
        Latency: 107 msec (47-182 msec ~112 msec)
> ACL Data RX: Handle 381 flags 0x02 dlen 9                                                                         #147 9.517840
      ATT: Write Request (0x12) len 4
        Handle: 0x0027
          Data[2]: 0000
zephyr.exe[1736766]: < HCI Command: Host Number of Completed Packets (0x03|0x0035) plen 5                           #148 9.529448
        Num handles: 1
        Handle: 381 Address: C0:07:E8:2C:B6:EE (OUI C0-07-E8)
        Count: 1
zephyr.exe[1736766]: < ACL Data TX: Handle 381 [1/3] flags 0x00 dlen 5                                              #149 9.530963
      ATT: Write Response (0x13) len 0
> HCI Event: Number of Completed Packets (0x13) plen 5                                                              #150 9.642589
        Num handles: 1
        Handle: 381 Address: C0:07:E8:2C:B6:EE (OUI C0-07-E8)
        Count: 1
        Buffers: 0/3
        #149: len 5 (0 Kb/s)
        Latency: 111 msec (47-182 msec ~112 msec)
> ACL Data RX: Handle 381 flags 0x02 dlen 9                                                                         #151 9.642859
      ATT: Write Request (0x12) len 4
        Handle: 0x0027
          Data[2]: 0100
zephyr.exe[1736766]: < HCI Command: Host Number of Completed Packets (0x03|0x0035) plen 5                           #152 9.652137
        Num handles: 1
        Handle: 381 Address: C0:07:E8:2C:B6:EE (OUI C0-07-E8)
        Count: 1
zephyr.exe[1736766]: < ACL Data TX: Handle 381 [1/3] flags 0x00 dlen 5                                              #153 9.653312
      ATT: Write Response (0x13) len 0
> HCI Event: Number of Completed Packets (0x13) plen 5                                                              #154 9.767615
        Num handles: 1
        Handle: 381 Address: C0:07:E8:2C:B6:EE (OUI C0-07-E8)
        Count: 1
        Buffers: 0/3
        #153: len 5 (0 Kb/s)
        Latency: 114 msec (47-182 msec ~113 msec)
> ACL Data RX: Handle 381 flags 0x02 dlen 9                                                                         #155 9.767870
      ATT: Write Request (0x12) len 4
        Handle: 0x002a
          Data[2]: 0000
zephyr.exe[1736766]: < HCI Command: Host Number of Completed Packets (0x03|0x0035) plen 5                           #156 9.774216
        Num handles: 1
        Handle: 381 Address: C0:07:E8:2C:B6:EE (OUI C0-07-E8)
        Count: 1
zephyr.exe[1736766]: < ACL Data TX: Handle 381 [1/3] flags 0x00 dlen 5                                              #157 9.775295
      ATT: Write Response (0x13) len 0
> HCI Event: Number of Completed Packets (0x13) plen 5                                                              #158 9.892595
        Num handles: 1
        Handle: 381 Address: C0:07:E8:2C:B6:EE (OUI C0-07-E8)
        Count: 1
        Buffers: 0/3
        #157: len 5 (0 Kb/s)
        Latency: 117 msec (47-182 msec ~115 msec)
> ACL Data RX: Handle 381 flags 0x02 dlen 9                                                                         #159 9.892970
      ATT: Write Request (0x12) len 4
        Handle: 0x002a
          Data[2]: 0100
zephyr.exe[1736766]: < HCI Command: Host Number of Completed Packets (0x03|0x0035) plen 5                           #160 9.909456
        Num handles: 1
        Handle: 381 Address: C0:07:E8:2C:B6:EE (OUI C0-07-E8)
        Count: 1
zephyr.exe[1736766]: < ACL Data TX: Handle 381 [1/3] flags 0x00 dlen 5                                              #161 9.910761
      ATT: Write Response (0x13) len 0
> HCI Event: Number of Completed Packets (0x13) plen 5                                                             #162 10.017585
        Num handles: 1
        Handle: 381 Address: C0:07:E8:2C:B6:EE (OUI C0-07-E8)
        Count: 1
        Buffers: 0/3
        #161: len 5 (0 Kb/s)
        Latency: 106 msec (47-182 msec ~111 msec)
> ACL Data RX: Handle 381 flags 0x02 dlen 9                                                                        #163 10.017942
      ATT: Write Request (0x12) len 4
        Handle: 0x0033
          Data[2]: 0000
zephyr.exe[1736766]: < HCI Command: Host Number of Completed Packets (0x03|0x0035) plen 5                          #164 10.030222
        Num handles: 1
        Handle: 381 Address: C0:07:E8:2C:B6:EE (OUI C0-07-E8)
        Count: 1
zephyr.exe[1736766]: < ACL Data TX: Handle 381 [1/3] flags 0x00 dlen 5                                             #165 10.031540
      ATT: Write Response (0x13) len 0
> HCI Event: Number of Completed Packets (0x13) plen 5                                                             #166 10.142601
        Num handles: 1
        Handle: 381 Address: C0:07:E8:2C:B6:EE (OUI C0-07-E8)
        Count: 1
        Buffers: 0/3
        #165: len 5 (0 Kb/s)
        Latency: 111 msec (47-182 msec ~111 msec)
> ACL Data RX: Handle 381 flags 0x02 dlen 9                                                                        #167 10.142706
      ATT: Write Request (0x12) len 4
        Handle: 0x0033
          Data[2]: 0100
zephyr.exe[1736766]: < HCI Command: Host Number of Completed Packets (0x03|0x0035) plen 5                          #168 10.159324
        Num handles: 1
        Handle: 381 Address: C0:07:E8:2C:B6:EE (OUI C0-07-E8)
        Count: 1
zephyr.exe[1736766]: < ACL Data TX: Handle 381 [1/3] flags 0x00 dlen 5                                             #169 10.159617
      ATT: Write Response (0x13) len 0
> HCI Event: Number of Completed Packets (0x13) plen 5                                                             #170 10.267601
        Num handles: 1
        Handle: 381 Address: C0:07:E8:2C:B6:EE (OUI C0-07-E8)
        Count: 1
        Buffers: 0/3
        #169: len 5 (0 Kb/s)
        Latency: 107 msec (47-182 msec ~109 msec)
> ACL Data RX: Handle 381 flags 0x02 dlen 9                                                                        #171 10.267735
      ATT: Write Request (0x12) len 4
        Handle: 0x0036
          Data[2]: 0000
zephyr.exe[1736766]: < HCI Command: Host Number of Completed Packets (0x03|0x0035) plen 5                          #172 10.281084
        Num handles: 1
        Handle: 381 Address: C0:07:E8:2C:B6:EE (OUI C0-07-E8)
        Count: 1
zephyr.exe[1736766]: < ACL Data TX: Handle 381 [1/3] flags 0x00 dlen 5                                             #173 10.281192
      ATT: Write Response (0x13) len 0
> HCI Event: Number of Completed Packets (0x13) plen 5                                                             #174 10.392591
        Num handles: 1
        Handle: 381 Address: C0:07:E8:2C:B6:EE (OUI C0-07-E8)
        Count: 1
        Buffers: 0/3
        #173: len 5 (0 Kb/s)
        Latency: 111 msec (47-182 msec ~110 msec)
> ACL Data RX: Handle 381 flags 0x02 dlen 9                                                                        #175 10.392897
      ATT: Write Request (0x12) len 4
        Handle: 0x0036
          Data[2]: 0100
zephyr.exe[1736766]: < HCI Command: Host Number of Completed Packets (0x03|0x0035) plen 5                          #176 10.409453
        Num handles: 1
        Handle: 381 Address: C0:07:E8:2C:B6:EE (OUI C0-07-E8)
        Count: 1
zephyr.exe[1736766]: < ACL Data TX: Handle 381 [1/3] flags 0x00 dlen 5                                             #177 10.414087
      ATT: Write Response (0x13) len 0
> HCI Event: Number of Completed Packets (0x13) plen 5                                                             #178 10.517606
        Num handles: 1
        Handle: 381 Address: C0:07:E8:2C:B6:EE (OUI C0-07-E8)
        Count: 1
        Buffers: 0/3
        #177: len 5 (0 Kb/s)
        Latency: 103 msec (47-182 msec ~106 msec)
> ACL Data RX: Handle 381 flags 0x02 dlen 7                                                                        #179 10.517670
      ATT: Read Request (0x0a) len 2
        Handle: 0x0026
zephyr.exe[1736766]: < HCI Command: Host Number of Completed Packets (0x03|0x0035) plen 5                          #180 10.529783
        Num handles: 1
        Handle: 381 Address: C0:07:E8:2C:B6:EE (OUI C0-07-E8)
        Count: 1
zephyr.exe[1736766]: < ACL Data TX: Handle 381 [1/3] flags 0x00 dlen 27                                            #181 10.530719
zephyr.exe[1736766]: < ACL Data TX: Handle 381 flags 0x01 dlen 27                                                  #182 10.531233
zephyr.exe[1736766]: < ACL Data TX: Handle 381 flags 0x01 dlen 10                                                  #183 10.531664
      ATT: Read Response (0x0b) len 59
        Value[59]: 020600000000130301ff1f02020302030305041a009b00020501040301ff0fffffffffff130301ff1f02020302030305041a009b00020501040301
> HCI Event: Number of Completed Packets (0x13) plen 5                                                             #184 10.580439
        Num handles: 1
        Handle: 381 Address: C0:07:E8:2C:B6:EE (OUI C0-07-E8)
        Count: 1
        Buffers: 0/3
        #181: len 27 (4 Kb/s)
        Latency: 49 msec (47-182 msec ~78 msec)
> HCI Event: Number of Completed Packets (0x13) plen 5                                                             #185 10.580979
        Num handles: 1
        Handle: 381 Address: C0:07:E8:2C:B6:EE (OUI C0-07-E8)
        Count: 1
        Buffers: underflow/3
        #182: len 27 (4 Kb/s)
        Latency: 49 msec (47-182 msec ~64 msec)
> HCI Event: Number of Completed Packets (0x13) plen 5                                                             #186 10.642607
        Num handles: 1
        Handle: 381 Address: C0:07:E8:2C:B6:EE (OUI C0-07-E8)
        Count: 1
        Buffers: underflow/3
        #183: len 10 (0 Kb/s)
        Latency: 110 msec (47-182 msec ~87 msec)
> ACL Data RX: Handle 381 flags 0x02 dlen 9                                                                        #187 10.642865
      ATT: Read Blob Request (0x0c) len 4
        Handle: 0x0026
        Offset: 0x003b
zephyr.exe[1736766]: < HCI Command: Host Number of Completed Packets (0x03|0x0035) plen 5                          #188 10.660084
        Num handles: 1
        Handle: 381 Address: C0:07:E8:2C:B6:EE (OUI C0-07-E8)
        Count: 1
zephyr.exe[1736766]: < ACL Data TX: Handle 381 [1/3] flags 0x00 dlen 7                                             #189 10.661837
      ATT: Read Blob Response (0x0d) len 2
        Value[2]: ff0f
> HCI Event: Number of Completed Packets (0x13) plen 5                                                             #190 10.767529
        Num handles: 1
        Handle: 381 Address: C0:07:E8:2C:B6:EE (OUI C0-07-E8)
        Count: 1
        Buffers: 0/3
        #189: len 7 (0 Kb/s)
        Latency: 105 msec (47-182 msec ~96 msec)
> HCI Event: Disconnect Complete (0x05) plen 4                                                                     #191 10.767812
        Status: Success (0x00)
        Handle: 381 Address: C0:07:E8:2C:B6:EE (OUI C0-07-E8)
        Reason: Remote User Terminated Connection (0x13)
zephyr.exe[1736766]: < HCI Command: LE Set Extended Advertising Parameters (0x08|0x0036) plen 25                   #192 12.159625
        Handle: 0x00
        Properties: 0x0013
          Connectable
          Scannable
          Use legacy advertising PDUs: ADV_IND
        Min advertising interval: 100.000 msec (0x00a0)
        Max advertising interval: 150.000 msec (0x00f0)
        Channel map: 37, 38, 39 (0x07)
        Own address type: Random (0x01)
        Peer address type: Public (0x00)
        Peer address: 00:00:00:00:00:00 (OUI 00-00-00)
        Filter policy: Allow Scan Request from Any, Allow Connect Request from Any (0x00)
        TX power: Host has no preference (0x7f)
        Primary PHY: LE 1M (0x01)
        Secondary max skip: 0x00
        Secondary PHY: LE 1M (0x01)
        SID: 0x00
        Scan request notifications: Disabled (0x00)
> HCI Event: Command Complete (0x0e) plen 5                                                                        #193 12.160986
      LE Set Extended Advertising Parameters (0x08|0x0036) ncmd 1
        Status: Success (0x00)
        TX power (selected): 0 dbm (0x00)
zephyr.exe[1736766]: < HCI Command: LE Set Advertising Set Random Address (0x08|0x0035) plen 7                     #194 12.169641
        Advertising handle: 0x00
        Advertising random address: D5:B6:CC:31:DB:3B (Static)
> HCI Event: Command Complete (0x0e) plen 4                                                                        #195 12.170526
      LE Set Advertising Set Random Address (0x08|0x0035) ncmd 1
        Status: Success (0x00)
zephyr.exe[1736766]: < HCI Command: LE Set Extended Advertising Data (0x08|0x0037) plen 22                         #196 12.189640
        Handle: 0x00
        Operation: Complete extended advertising data (0x03)
        Fragment preference: Minimize fragmentation (0x01)
        Data length: 0x12
        Flags: 0x06
          LE General Discoverable Mode
          BR/EDR Not Supported
        Name (complete): Tester_2CB6EE
> HCI Event: Command Complete (0x0e) plen 4                                                                        #197 12.190778
      LE Set Extended Advertising Data (0x08|0x0037) ncmd 1
        Status: Success (0x00)
zephyr.exe[1736766]: < HCI Command: LE Set Extended Scan Response Data (0x08|0x0038) plen 4                        #198 12.209627
        Handle: 0x00
        Operation: Complete scan response data (0x03)
        Fragment preference: Minimize fragmentation (0x01)
        Data length: 0x00
> HCI Event: Command Complete (0x0e) plen 4                                                                        #199 12.210515
      LE Set Extended Scan Response Data (0x08|0x0038) ncmd 1
        Status: Success (0x00)
zephyr.exe[1736766]: < HCI Command: LE Set Extended Advertising Enable (0x08|0x0039) plen 6                        #200 12.229637
        Extended advertising: Enabled (0x01)
        Number of sets: 1 (0x01)
        Entry 0
          Handle: 0x00
          Duration: 0 ms (0x00)
          Max ext adv events: 0
> HCI Event: Command Complete (0x0e) plen 4                                                                        #201 12.230560
      LE Set Extended Advertising Enable (0x08|0x0039) ncmd 1
        Status: Success (0x00)
> HCI Event: LE Meta Event (0x3e) plen 31                                                                          #202 12.347935
      LE Enhanced Connection Complete (0x0a)
        Status: Success (0x00)
        Handle: 399
        Role: Peripheral (0x01)
        Peer address type: Public (0x00)
        Peer address: C0:07:E8:2C:B6:EE (OUI C0-07-E8)
        Local resolvable private address: 00:00:00:00:00:00 (Non-Resolvable)
        Peer resolvable private address: 00:00:00:00:00:00 (Non-Resolvable)
        Connection interval: 62.50 msec (0x0032)
        Connection latency: 0 (0x0000)
        Supervision timeout: 25120 msec (0x09d0)
        Central clock accuracy: 0x07
> HCI Event: LE Meta Event (0x3e) plen 6                                                                           #203 12.348110
      LE Advertising Set Terminated (0x12)
        Status: Success (0x00)
        Handle: 0
        Connection handle: 399
        Number of completed extended advertising events: 0
zephyr.exe[1736766]: < HCI Command: LE Read Remote Used Features (0x08|0x0016) plen 2                              #204 12.349580
        Handle: 399 Address: C0:07:E8:2C:B6:EE (OUI C0-07-E8)
> HCI Event: Command Status (0x0f) plen 4                                                                          #205 12.350464
      LE Read Remote Used Features (0x08|0x0016) ncmd 1
        Status: Success (0x00)
zephyr.exe[1736766]: < HCI Command: LE Set PHY (0x08|0x0032) plen 7                                                #206 12.369602
        Handle: 399 Address: C0:07:E8:2C:B6:EE (OUI C0-07-E8)
        All PHYs preference: 0x00
        TX PHYs preference: 0x02
          LE 2M
        RX PHYs preference: 0x02
          LE 2M
        PHY options preference: Reserved (0x0000)
> HCI Event: Command Status (0x0f) plen 4                                                                          #207 12.370399
      LE Set PHY (0x08|0x0032) ncmd 1
        Status: Success (0x00)
zephyr.exe[1736766]: < ACL Data TX: Handle 399 [1/3] flags 0x00 dlen 6                                             #208 12.389706
      SMP: Security Request (0x0b) len 1
        Authentication requirement: Bonding, No MITM, SC, No Keypresses (0x09)
zephyr.exe[1736766]: < ACL Data TX: Handle 399 [2/3] flags 0x00 dlen 7                                             #209 12.390121
      ATT: Exchange MTU Request (0x02) len 2
        Client RX MTU: 251
> HCI Event: Number of Completed Packets (0x13) plen 5                                                             #210 12.411928
        Num handles: 1
        Handle: 399 Address: C0:07:E8:2C:B6:EE (OUI C0-07-E8)
        Count: 1
        Buffers: 1/3
        #208: len 6 (2 Kb/s)
        Latency: 22 msec (22-22 msec ~22 msec)
> HCI Event: Number of Completed Packets (0x13) plen 5                                                             #211 12.474052
        Num handles: 1
        Handle: 399 Address: C0:07:E8:2C:B6:EE (OUI C0-07-E8)
        Count: 1
        Buffers: 0/3
        #209: len 7 (0 Kb/s)
        Latency: 83 msec (22-83 msec ~53 msec)
> HCI Event: LE Meta Event (0x3e) plen 12                                                                          #212 12.536920
      LE Read Remote Used Features (0x04)
        Status: Success (0x00)
        Handle: 399 Address: C0:07:E8:2C:B6:EE (OUI C0-07-E8)
        Features: 0x2d 0x49 0x01 0xf7 0xef 0x39 0x00 0x80
          LE Encryption
          Extended Reject Indication
          Peripheral-initiated Features Exchange
          LE Data Packet Len