Bluetooth monitor ver 5.72
= Note: Linux version 6.14.0-36-generic (x86_64)                       0.002495
= Note: Bluetooth subsystem version 2.22                               0.002497
= New Index: 00:00:00:00:00:00 (Primary,UART,hci1)              [hci1] 0.002498
= New Index: 48:5F:99:8E:E0:64 (Primary,USB,hci0)               [hci0] 0.002499
= Open Index: 00:00:00:00:00:00                                 [hci1] 0.516473
= Index Info: 00:00:00:00:00:00 (Nordic Semiconductor ASA)      [hci1] 0.516487
@ USER Open: main (privileged) version 2.22            {0x0001} [hci1] 0.516495
< HCI Command: Reset (0x03|0x0003) plen 0                    #1 [hci1] 0.517735
> HCI Event: Command Complete (0x0e) plen 4                  #2 [hci1] 0.518276
      Reset (0x03|0x0003) ncmd 1
        Status: Success (0x00)
< HCI Command: Read Local Supported... (0x04|0x0003) plen 0  #3 [hci1] 0.536229
> HCI Event: Command Complete (0x0e) plen 12                 #4 [hci1] 0.536774
      Read Local Supported Features (0x04|0x0003) ncmd 1
        Status: Success (0x00)
        Features: 0x00 0x00 0x00 0x00 0x60 0x00 0x00 0x00
          BR/EDR Not Supported
          LE Supported (Controller)
< HCI Command: Read Local Version In.. (0x04|0x0001) plen 0  #5 [hci1] 0.555927
> HCI Event: Command Complete (0x0e) plen 12                 #6 [hci1] 0.556459
      Read Local Version Information (0x04|0x0001) ncmd 1
        Status: Success (0x00)
        HCI version: Reserved (0x0f) - Revision 12393 (0x3069)
        LMP version: Reserved (0x0f) - Subversion 12393 (0x3069)
        Manufacturer: Nordic Semiconductor ASA (89)
< HCI Command: Read Local Supported... (0x04|0x0002) plen 0  #7 [hci1] 0.575840
> HCI Event: Command Complete (0x0e) plen 68                 #8 [hci1] 0.576973
      Read Local Supported Commands (0x04|0x0002) ncmd 1
        Status: Success (0x00)
        Commands: 119 entries
          Disconnect (Octet 0 - Bit 5)
          Read Remote Version Information (Octet 2 - Bit 7)
          Set Event Mask (Octet 5 - Bit 6)
          Reset (Octet 5 - Bit 7)
          Read Connection Accept Timeout (Octet 7 - Bit 2)
          Write Connection Accept Timeout (Octet 7 - Bit 3)
          Read Transmit Power Level (Octet 10 - Bit 2)
          Set Controller To Host Flow Control (Octet 10 - Bit 5)
          Host Buffer Size (Octet 10 - Bit 6)
          Host Number of Completed Packets (Octet 10 - Bit 7)
          Read Local Version Information (Octet 14 - Bit 3)
          Read Local Supported Features (Octet 14 - Bit 5)
          Read BD ADDR (Octet 15 - Bit 1)
          Read RSSI (Octet 15 - Bit 5)
          Set Event Mask Page 2 (Octet 22 - Bit 2)
          LE Set Event Mask (Octet 25 - Bit 0)
          LE Read Buffer Size (Octet 25 - Bit 1)
          LE Read Local Supported Features (Octet 25 - Bit 2)
          LE Set Random Address (Octet 25 - Bit 4)
          LE Set Advertising Parameters (Octet 25 - Bit 5)
          LE Read Advertising Channel TX Power (Octet 25 - Bit 6)
          LE Set Advertising Data (Octet 25 - Bit 7)
          LE Set Scan Response Data (Octet 26 - Bit 0)
          LE Set Advertise Enable (Octet 26 - Bit 1)
          LE Set Scan Parameters (Octet 26 - Bit 2)
          LE Set Scan Enable (Octet 26 - Bit 3)
          LE Create Connection (Octet 26 - Bit 4)
          LE Create Connection Cancel (Octet 26 - Bit 5)
          LE Read Accept List Size (Octet 26 - Bit 6)
          LE Clear Accept List (Octet 26 - Bit 7)
          LE Add Device To Accept List (Octet 27 - Bit 0)
          LE Remove Device From Accept List (Octet 27 - Bit 1)
          LE Connection Update (Octet 27 - Bit 2)
          LE Set Host Channel Classification (Octet 27 - Bit 3)
          LE Read Channel Map (Octet 27 - Bit 4)
          LE Read Remote Used Features (Octet 27 - Bit 5)
          LE Encrypt (Octet 27 - Bit 6)
          LE Rand (Octet 27 - Bit 7)
          LE Start Encryption (Octet 28 - Bit 0)
          LE Long Term Key Request Reply (Octet 28 - Bit 1)
          LE Long Term Key Request Neg Reply (Octet 28 - Bit 2)
          LE Read Supported States (Octet 28 - Bit 3)
          LE Receiver Test (Octet 28 - Bit 4)
          LE Transmitter Test (Octet 28 - Bit 5)
          LE Test End (Octet 28 - Bit 6)
          Read Authenticated Payload Timeout (Octet 32 - Bit 4)
          Write Authenticated Payload Timeout (Octet 32 - Bit 5)
          LE Set Data Length (Octet 33 - Bit 6)
          LE Read Suggested Default Data Length (Octet 33 - Bit 7)
          LE Write Suggested Default Data Length (Octet 34 - Bit 0)
          LE Add Device To Resolving List (Octet 34 - Bit 3)
          LE Remove Device From Resolving List (Octet 34 - Bit 4)
          LE Clear Resolving List (Octet 34 - Bit 5)
          LE Read Resolving List Size (Octet 34 - Bit 6)
          LE Set Address Resolution Enable (Octet 35 - Bit 1)
          LE Set Resolvable Private Address Timeout (Octet 35 - Bit 2)
          LE Read Maximum Data Length (Octet 35 - Bit 3)
          LE Read PHY (Octet 35 - Bit 4)
          LE Set Default PHY (Octet 35 - Bit 5)
          LE Set PHY (Octet 35 - Bit 6)
          LE Enhanced Receiver Test (Octet 35 - Bit 7)
          LE Enhanced Transmitter Test (Octet 36 - Bit 0)
          LE Set Advertising Set Random Address (Octet 36 - Bit 1)
          LE Set Extended Advertising Parameters (Octet 36 - Bit 2)
          LE Set Extended Advertising Data (Octet 36 - Bit 3)
          LE Set Extended Scan Response Data (Octet 36 - Bit 4)
          LE Set Extended Advertising Enable (Octet 36 - Bit 5)
          LE Read Maximum Advertising Data Length (Octet 36 - Bit 6)
          LE Read Number of Supported Advertising Sets (Octet 36 - Bit 7)
          LE Remove Advertising Set (Octet 37 - Bit 0)
          LE Clear Advertising Sets (Octet 37 - Bit 1)
          LE Set Periodic Advertising Parameters (Octet 37 - Bit 2)
          LE Set Periodic Advertising Data (Octet 37 - Bit 3)
          LE Set Periodic Advertising Enable (Octet 37 - Bit 4)
          LE Set Extended Scan Parameters (Octet 37 - Bit 5)
          LE Set Extended Scan Enable (Octet 37 - Bit 6)
          LE Extended Create Connection (Octet 37 - Bit 7)
          LE Periodic Advertising Create Sync (Octet 38 - Bit 0)
          LE Periodic Advertising Create Sync Cancel (Octet 38 - Bit 1)
          LE Periodic Advertising Terminate Sync (Octet 38 - Bit 2)
          LE Add Device To Periodic Advertiser List (Octet 38 - Bit 3)
          LE Remove Device From Periodic Advertiser List (Octet 38 - Bit 4)
          LE Clear Periodic Advertiser List (Octet 38 - Bit 5)
          LE Read Periodic Advertiser List Size (Octet 38 - Bit 6)
          LE Read Transmit Power (Octet 38 - Bit 7)
          LE Read RF Path Compensation (Octet 39 - Bit 0)
          LE Write RF Path Compensation (Octet 39 - Bit 1)
          LE Set Privacy Mode (Octet 39 - Bit 2)
          LE Periodic Advertising Receive Enable (Octet 40 - Bit 5)
          LE Periodic Advertising Sync Transfer (Octet 40 - Bit 6)
          LE Periodic Advertising Set Info Transfer (Octet 40 - Bit 7)
          LE Periodic Advertising Sync Transfer Parameters (Octet 41 - Bit 0)
          LE Set Default Periodic Advertisng Sync Transfer Parameters (Octet 41 - Bit 1)
          LE Read Buffer v2 (Octet 41 - Bit 5)
          LE Read ISO TX Sync (Octet 41 - Bit 6)
          LE Set Connected Isochronous Group Parameters (Octet 41 - Bit 7)
          LE Set Connected Isochronous Group Parameters Test (Octet 42 - Bit 0)
          LE Create Connected Isochronous Stream (Octet 42 - Bit 1)
          LE Remove Connected Isochronous Group (Octet 42 - Bit 2)
          LE Accept Connected Isochronous Stream Request (Octet 42 - Bit 3)
          LE Reject Connected Isochronous Stream Request (Octet 42 - Bit 4)
          LE Create Broadcast Isochronous Group (Octet 42 - Bit 5)
          LE Create Broadcast Isochronous Group Test (Octet 42 - Bit 6)
          LE Terminate Broadcast Isochronous Group (Octet 42 - Bit 7)
          LE Broadcast Isochronous Group Create Sync (Octet 43 - Bit 0)
          LE Broadcast Isochronous Group Terminate Sync (Octet 43 - Bit 1)
          LE Request Peer SCA (Octet 43 - Bit 2)
          LE Setup Isochronous Data Path (Octet 43 - Bit 3)
          LE Remove Isochronous Data Path (Octet 43 - Bit 4)
          LE Isochronous Transmit Test (Octet 43 - Bit 5)
          LE Isochronous Receive Test (Octet 43 - Bit 6)
          LE Isochronous Read Test Counters (Octet 43 - Bit 7)
          LE Isochronous Read Test Counters (Octet 44 - Bit 0)
          LE Set Host Feature (Octet 44 - Bit 1)
          Octet 44 - Bit 2 
          Octet 45 - Bit 6 
          Octet 46 - Bit 0 
          Octet 46 - Bit 1 
          Octet 46 - Bit 2 
< HCI Command: Host Buffer Size (0x03|0x0033) plen 7         #9 [hci1] 0.595885
        ACL MTU: 255  ACL max packet: 16
        SCO MTU: 0    SCO max packet: 0
> HCI Event: Command Complete (0x0e) plen 4                 #10 [hci1] 0.596452
      Host Buffer Size (0x03|0x0033) ncmd 1
        Status: Success (0x00)
< HCI Command: Set Controller To Ho.. (0x03|0x0031) plen 1  #11 [hci1] 0.615881
        Flow control: ACL Data Packets (0x01)
> HCI Event: Command Complete (0x0e) plen 4                 #12 [hci1] 0.616284
      Set Controller To Host Flow Control (0x03|0x0031) ncmd 1
        Status: Success (0x00)
< HCI Command: LE Read Local Suppor.. (0x08|0x0003) plen 0  #13 [hci1] 0.635872
> HCI Event: Command Complete (0x0e) plen 12                #14 [hci1] 0.636433
      LE Read Local Supported Features (0x08|0x0003) ncmd 1
        Status: Success (0x00)
        Features: 0xfd 0x79 0x00 0xf7 0x30 0x01 0x00 0x00
          LE Encryption
          Extended Reject Indication
          Peripheral-initiated Features Exchange
          LE Ping
          LE Data Packet Length Extension
          LL Privacy
          Extended Scanner Filter Policies
          LE 2M PHY
          LE Coded PHY
          LE Extended Advertising
          LE Periodic Advertising
          Channel Selection Algorithm #2
          Periodic Advertising Sync Transfer - Sender
          Periodic Advertising Sync Transfer - Recipient
          Sleep Clock Accuracy Updates
          Connected Isochronous Stream - Central
          Connected Isochronous Stream - Peripheral
          Isochronous Broadcaster
          Synchronized Receiver
          Periodic Advertising ADI support
          Connection Subrating
          Unknown features (0x0000010000000000)
< HCI Command: LE Set Host Feature (0x08|0x0074) plen 2     #15 [hci1] 0.655882
        Bit Number: 32
          Connected Isochronous Stream (Host Support)
        Bit Value: 1
> HCI Event: Command Complete (0x0e) plen 4                 #16 [hci1] 0.656279
      LE Set Host Feature (0x08|0x0074) ncmd 1
        Status: Success (0x00)
< HCI Command: LE Read Buffer v2 (0x08|0x0060) plen 0       #17 [hci1] 0.675876
> HCI Event: Command Complete (0x0e) plen 10                #18 [hci1] 0.676433
      LE Read Buffer v2 (0x08|0x0060) ncmd 1
        Status: Success (0x00)
        ACL MTU: 27
        ACL max packet: 3
        ISO MTU: 318
        ISO max packet: 3
< HCI Command: LE Read Maximum Adve.. (0x08|0x003a) plen 0  #19 [hci1] 0.695893
> HCI Event: Command Complete (0x0e) plen 6                 #20 [hci1] 0.696307
      LE Read Maximum Advertising Data Length (0x08|0x003a) ncmd 1
        Status: Success (0x00)
        Max length: 1650
< HCI Command: LE Read Supported St.. (0x08|0x001c) plen 0  #21 [hci1] 0.715878
> HCI Event: Command Complete (0x0e) plen 12                #22 [hci1] 0.716343
      LE Read Supported States (0x08|0x001c) ncmd 1
        Status: Success (0x00)
        States: 0x000003ff3e0306ff
          Non-connectable Advertising State
          Scannable Advertising State
          Connectable Advertising State
          High Duty Cycle Directed Advertising State
          Passive Scanning State
          Active Scanning State
          Initiating State
            and Connection State (Central Role)
          Connection State (Peripheral Role)
          Scannable Advertising State
            and Passive Scanning State
          Connectable Advertising State
            and Passive Scanning State
          Non-connectable Advertising State
            and Initiating State
          Scannable Advertising State
            and Initiating State
          Active Scanning State
            and Connection State (Central Role)
          Passive Scanning State
            and Connection State (Peripheral Role)
          Active Scanning State
            and Connection State (Peripheral Role)
          Initiating State
            and Connection State (Central Role)
            and Central Role & Central Role
          Low Duty Cycle Directed Advertising State
          Connectable Advertising State
            and Initiating State
            and Central Role & Peripheral Role
          High Duty Cycle Directed Advertising State
            and Initiating State
            and Central Role & Peripheral Role
          Low Duty Cycle Directed Advertising State
            and Initiating State
            and Central Role & Peripheral Role
          Connectable Advertising State
            and Connection State (Central Role)
            and Central Role & Peripheral Role
          High Duty Cycle Directed Advertising State
            and Connection State (Central Role)
            and Central Role & Peripheral Role
          Low Duty Cycle Directed Advertising State
            and Connection State (Central Role)
            and Central Role & Peripheral Role
          Connectable Advertising State
            and Connection State (Peripheral Role)
            and Central Role & Peripheral Role
          High Duty Cycle Directed Advertising State
            and Connection State (Peripheral Role)
            and Peripheral Role & Peripheral Role
          Low Duty Cycle Directed Advertising State
            and Connection State (Peripheral Role)
            and Peripheral Role & Peripheral Role
          Initiating State
            and Connection State (Peripheral Role)
            and Central Role & Peripheral Role
< HCI Command: LE Read Maximum Data.. (0x08|0x002f) plen 0  #23 [hci1] 0.735845
> HCI Event: Command Complete (0x0e) plen 12                #24 [hci1] 0.736378
      LE Read Maximum Data Length (0x08|0x002f) ncmd 1
        Status: Success (0x00)
        Max TX octets: 251
        Max TX time: 2704
        Max RX octets: 251
        Max RX time: 2704
< HCI Command: LE Write Suggested D.. (0x08|0x0024) plen 4  #25 [hci1] 0.755876
        TX octets: 251
        TX time: 2704
> HCI Event: Command Complete (0x0e) plen 4                 #26 [hci1] 0.756360
      LE Write Suggested Default Data Length (0x08|0x0024) ncmd 1
        Status: Success (0x00)
< HCI Command: LE Read Resolving Li.. (0x08|0x002a) plen 0  #27 [hci1] 0.775875
> HCI Event: Command Complete (0x0e) plen 5                 #28 [hci1] 0.776402
      LE Read Resolving List Size (0x08|0x002a) ncmd 1
        Status: Success (0x00)
        Size: 8
< HCI Command: LE Set Event Mask (0x08|0x0001) plen 8       #29 [hci1] 0.795836
        Mask: 0x000002023f87fa5e
          LE Advertising Report
          LE Connection Update Complete
          LE Read Remote Used Features Complete
          LE Long Term Key Request
          LE Data Length Change
          LE Enhanced Connection Complete
          LE PHY Update Complete
          LE Extended Advertising Report
          LE Periodic Advertising Sync Established
          LE Periodic Advertising Report
          LE Periodic Advertising Sync Lost
          LE Extended Scan Timeout
          LE Extended Advertising Set Terminated
          LE Scan Request Received
          LE Periodic Advertising Sync Transfer Rvc
          LE CIS Established
          LE CIS Request
          LE Create BIG Complete
          LE Terminate BIG Complete
          LE BIG Sync Estabilished Complete
          LE BIG Sync Lost
          LE BIG Info Advertising Report
          Unknown mask (0x0000020000000000)
> HCI Event: Command Complete (0x0e) plen 4                 #30 [hci1] 0.796333
      LE Set Event Mask (0x08|0x0001) ncmd 1
        Status: Success (0x00)
< HCI Command: Set Event Mask (0x03|0x0001) plen 8          #31 [hci1] 0.815856
        Mask: 0x2000800002008890
          Disconnection Complete
          Encryption Change
          Read Remote Version Information Complete
          Hardware Error
          Data Buffer Overflow
          Encryption Key Refresh Complete
          LE Meta
> HCI Event: Command Complete (0x0e) plen 4                 #32 [hci1] 0.816590
      Set Event Mask (0x03|0x0001) ncmd 1
        Status: Success (0x00)
< HCI Command: Read BD ADDR (0x04|0x0009) plen 0            #33 [hci1] 0.835880
> HCI Event: Command Complete (0x0e) plen 10                #34 [hci1] 0.836328
      Read BD ADDR (0x04|0x0009) ncmd 1
        Status: Success (0x00)
        Address: 00:00:00:00:00:00 (OUI 00-00-00)
< HCI Command: LE Set Random Address (0x08|0x0005) plen 6   #35 [hci1] 0.855896
        Address: D5:B6:CC:31:DB:3B (Static)
> HCI Event: Command Complete (0x0e) plen 4                 #36 [hci1] 0.856416
      LE Set Random Address (0x08|0x0005) ncmd 1
        Status: Success (0x00)
< HCI Command: LE Set Extended Adv.. (0x08|0x0036) plen 25  #37 [hci1] 3.435960
        Handle: 0x00
        Properties: 0x0013
          Connectable
          Scannable
          Use legacy advertising PDUs: ADV_IND
        Min advertising interval: 100.000 msec (0x00a0)
        Max advertising interval: 150.000 msec (0x00f0)
        Channel map: 37, 38, 39 (0x07)
        Own address type: Random (0x01)
        Peer address type: Public (0x00)
        Peer address: 00:00:00:00:00:00 (OUI 00-00-00)
        Filter policy: Allow Scan Request from Any, Allow Connect Request from Any (0x00)
        TX power: Host has no preference (0x7f)
        Primary PHY: LE 1M (0x01)
        Secondary max skip: 0x00
        Secondary PHY: LE 1M (0x01)
        SID: 0x00
        Scan request notifications: Disabled (0x00)
> HCI Event: Command Complete (0x0e) plen 5                 #38 [hci1] 3.436688
      LE Set Extended Advertising Parameters (0x08|0x0036) ncmd 1
        Status: Success (0x00)
        TX power (selected): 0 dbm (0x00)
< HCI Command: LE Set Advertising S.. (0x08|0x0035) plen 7  #39 [hci1] 3.455875
        Advertising handle: 0x00
        Advertising random address: D5:B6:CC:31:DB:3B (Static)
> HCI Event: Command Complete (0x0e) plen 4                 #40 [hci1] 3.456462
      LE Set Advertising Set Random Address (0x08|0x0035) ncmd 1
        Status: Success (0x00)
< HCI Command: LE Set Extended Adv.. (0x08|0x0037) plen 22  #41 [hci1] 3.475914
        Handle: 0x00
        Operation: Complete extended advertising data (0x03)
        Fragment preference: Minimize fragmentation (0x01)
        Data length: 0x12
        Flags: 0x06
          LE General Discoverable Mode
          BR/EDR Not Supported
        Name (complete): Tester_F6B11A
> HCI Event: Command Complete (0x0e) plen 4                 #42 [hci1] 3.476732
      LE Set Extended Advertising Data (0x08|0x0037) ncmd 1
        Status: Success (0x00)
< HCI Command: LE Set Extended Scan.. (0x08|0x0038) plen 4  #43 [hci1] 3.495915
        Handle: 0x00
        Operation: Complete scan response data (0x03)
        Fragment preference: Minimize fragmentation (0x01)
        Data length: 0x00
> HCI Event: Command Complete (0x0e) plen 4                 #44 [hci1] 3.496327
      LE Set Extended Scan Response Data (0x08|0x0038) ncmd 1
        Status: Success (0x00)
< HCI Command: LE Set Extended Adve.. (0x08|0x0039) plen 6  #45 [hci1] 3.515919
        Extended advertising: Enabled (0x01)
        Number of sets: 1 (0x01)
        Entry 0
          Handle: 0x00
          Duration: 0 ms (0x00)
          Max ext adv events: 0
> HCI Event: Command Complete (0x0e) plen 4                 #46 [hci1] 3.516512
      LE Set Extended Advertising Enable (0x08|0x0039) ncmd 1
        Status: Success (0x00)
> HCI Event: LE Meta Event (0x3e) plen 31                   #47 [hci1] 3.739821
      LE Enhanced Connection Complete (0x0a)
        Status: Success (0x00)
        Handle: 111
        Role: Peripheral (0x01)
        Peer address type: Public (0x00)
        Peer address: DF:A9:FF:F6:B1:1A (OUI DF-A9-FF)
        Local resolvable private address: 00:00:00:00:00:00 (Non-Resolvable)
        Peer resolvable private address: 00:00:00:00:00:00 (Non-Resolvable)
        Connection interval: 87.50 msec (0x0046)
        Connection latency: 0 (0x0000)
        Supervision timeout: 25120 msec (0x09d0)
        Central clock accuracy: 0x01
> HCI Event: LE Meta Event (0x3e) plen 6                    #48 [hci1] 3.740026
      LE Advertising Set Terminated (0x12)
        Status: Success (0x00)
        Handle: 0
        Connection handle: 111
        Number of completed extended advertising events: 0
< HCI Command: LE Read Remote Used... (0x08|0x0016) plen 2  #49 [hci1] 3.757035
        Handle: 111 Address: DF:A9:FF:F6:B1:1A (OUI DF-A9-FF)
< ACL Data TX: Handle 111 flags 0x00 dlen 7                 #50 [hci1] 3.757064
      ATT: Exchange MTU Request (0x02) len 2
        Client RX MTU: 251
> HCI Event: Command Status (0x0f) plen 4                   #51 [hci1] 3.757592
      LE Read Remote Used Features (0x08|0x0016) ncmd 1
        Status: Success (0x00)
> HCI Event: Number of Completed Packets (0x13) plen 5      #52 [hci1] 3.915843
        Num handles: 1
        Handle: 111 Address: DF:A9:FF:F6:B1:1A (OUI DF-A9-FF)
        Count: 1
        #50: len 7 (0 Kb/s)
        Latency: 158 msec (158-158 msec ~158 msec)
> HCI Event: LE Meta Event (0x3e) plen 12                   #53 [hci1] 4.003753
      LE Read Remote Used Features (0x04)
        Status: Success (0x00)
        Handle: 111 Address: DF:A9:FF:F6:B1:1A (OUI DF-A9-FF)
        Features: 0x2d 0x49 0x00 0xf7 0x67 0xd8 0x00 0x00
          LE Encryption
          Extended Reject Indication
          Peripheral-initiated Features Exchange
          LE Data Packet Length Extension
          LE 2M PHY
          LE Coded PHY
          Channel Selection Algorithm #2
          Periodic Advertising Sync Transfer - Sender
          Periodic Advertising Sync Transfer - Recipient
          Sleep Clock Accuracy Updates
          Connected Isochronous Stream - Central
          Connected Isochronous Stream - Peripheral
          Isochronous Broadcaster
          Synchronized Receiver
          Connected Isochronous Stream (Host Support)
          LE Power Control Request
          LE Power Control Request
          Connection Subrating
          Connection Subrating (Host Support)
          Unknown features (0x0000d80000000000)
> ACL Data RX: Handle 111 flags 0x02 dlen 11                #54 [hci1] 6.453441
      SMP: Pairing Request (0x01) len 6
        IO capability: KeyboardDisplay (0x04)
        OOB data: Authentication data not present (0x00)
        Authentication requirement: Bonding, MITM, SC, No Keypresses (0x0d)
        Max encryption key size: 16
        Initiator key distribution: EncKey IdKey (0x03)
        Responder key distribution: EncKey IdKey Sign (0x07)
> ACL Data RX: Handle 111 flags 0x02 dlen 7                 #55 [hci1] 6.453785
      ATT: Exchange MTU Response (0x03) len 2
        Server RX MTU: 23
< HCI Command: Host Number of Compl.. (0x03|0x0035) plen 5  #56 [hci1] 6.456358
        Num handles: 1
        Handle: 111 Address: DF:A9:FF:F6:B1:1A (OUI DF-A9-FF)
        Count: 1
< ACL Data TX: Handle 111 flags 0x00 dlen 11                #57 [hci1] 6.456656
      SMP: Pairing Response (0x02) len 6
        IO capability: DisplayOnly (0x00)
        OOB data: Authentication data not present (0x00)
        Authentication requirement: Bonding, No MITM, SC, No Keypresses (0x09)
        Max encryption key size: 16
        Initiator key distribution: IdKey (0x02)
        Responder key distribution: <none> (0x00)
< HCI Command: Host Number of Compl.. (0x03|0x0035) plen 5  #58 [hci1] 6.456706
        Num handles: 1
        Handle: 111 Address: DF:A9:FF:F6:B1:1A (OUI DF-A9-FF)
        Count: 1
> HCI Event: Number of Completed Packets (0x13) plen 5      #59 [hci1] 6.628597
        Num handles: 1
        Handle: 111 Address: DF:A9:FF:F6:B1:1A (OUI DF-A9-FF)
        Count: 1
        #57: len 11 (0 Kb/s)
        Latency: 171 msec (158-171 msec ~165 msec)
> ACL Data RX: Handle 111 flags 0x02 dlen 27                #60 [hci1] 6.628809
> ACL Data RX: Handle 111 flags 0x01 dlen 27                #61 [hci1] 6.629302
> ACL Data RX: Handle 111 flags 0x01 dlen 15                #62 [hci1] 6.629915
      SMP: Pairing Public Key (0x0c) len 64
        X: 13a3dd0e947fdec9d420ddf0625c657d2fba31a297c52c05e7f30dbe0a7daa67
        Y: 4f6a24b37fad56b895a36939ced7c9c05669fe822412be7c37a7b68696b3ce33
< HCI Command: Host Number of Compl.. (0x03|0x0035) plen 5  #63 [hci1] 6.636755
        Num handles: 1
        Handle: 111 Address: DF:A9:FF:F6:B1:1A (OUI DF-A9-FF)
        Count: 1
< HCI Command: Host Number of Compl.. (0x03|0x0035) plen 5  #64 [hci1] 6.637018
        Num handles: 1
        Handle: 111 Address: DF:A9:FF:F6:B1:1A (OUI DF-A9-FF)
        Count: 1
< HCI Command: Host Number of Compl.. (0x03|0x0035) plen 5  #65 [hci1] 6.637609
        Num handles: 1
        Handle: 111 Address: DF:A9:FF:F6:B1:1A (OUI DF-A9-FF)
        Count: 1
< ACL Data TX: Handle 111 flags 0x00 dlen 27                #66 [hci1] 6.637630
< ACL Data TX: Handle 111 flags 0x01 dlen 27                #67 [hci1] 6.637633
< ACL Data TX: Handle 111 flags 0x01 dlen 15                #68 [hci1] 6.637636
      SMP: Pairing Public Key (0x0c) len 64
        X: 98308440221e2d910f0e54b71e7ec652857aa9b5a0dc65028824cc19db1226e9
        Y: 67a4816bcb62efb21701e31fdb27561a6217575fb007a8bbdabe7e28b6f68482
> HCI Event: Number of Completed Packets (0x13) plen 5      #69 [hci1] 6.716355
        Num handles: 1
        Handle: 111 Address: DF:A9:FF:F6:B1:1A (OUI DF-A9-FF)
        Count: 1
        #66: len 27 (2 Kb/s)
        Latency: 78 msec (78-171 msec ~122 msec)
> HCI Event: Number of Completed Packets (0x13) plen 5      #70 [hci1] 6.717074
        Num handles: 1
        Handle: 111 Address: DF:A9:FF:F6:B1:1A (OUI DF-A9-FF)
        Count: 1
        #67: len 27 (2 Kb/s)
        Latency: 79 msec (78-171 msec ~100 msec)
> HCI Event: Number of Completed Packets (0x13) plen 5      #71 [hci1] 6.803205
        Num handles: 1
        Handle: 111 Address: DF:A9:FF:F6:B1:1A (OUI DF-A9-FF)
        Count: 1
        #68: len 15 (0 Kb/s)
        Latency: 165 msec (78-171 msec ~133 msec)
> ACL Data RX: Handle 111 flags 0x02 dlen 21                #72 [hci1] 7.678478
      SMP: Pairing Confirm (0x03) len 16
        Confim value: 9c8ce1572f10d32756cef65f2b6ffcf9
< HCI Command: Host Number of Compl.. (0x03|0x0035) plen 5  #73 [hci1] 7.696214
        Num handles: 1
        Handle: 111 Address: DF:A9:FF:F6:B1:1A (OUI DF-A9-FF)
        Count: 1
< ACL Data TX: Handle 111 flags 0x00 dlen 21                #74 [hci1] 7.696311
      SMP: Pairing Confirm (0x03) len 16
        Confim value: 40849127f6c0e31a2afdf3bf9c3e425e
> HCI Event: Number of Completed Packets (0x13) plen 5      #75 [hci1] 7.853434
        Num handles: 1
        Handle: 111 Address: DF:A9:FF:F6:B1:1A (OUI DF-A9-FF)
        Count: 1
        #74: len 21 (1 Kb/s)
        Latency: 157 msec (78-171 msec ~145 msec)
> ACL Data RX: Handle 111 flags 0x02 dlen 21                #76 [hci1] 7.853760
      SMP: Pairing Random (0x04) len 16
        Random value: 6617b701531431180000000000000000
< HCI Command: Host Number of Compl.. (0x03|0x0035) plen 5  #77 [hci1] 7.856585
        Num handles: 1
        Handle: 111 Address: DF:A9:FF:F6:B1:1A (OUI DF-A9-FF)
        Count: 1
< ACL Data TX: Handle 111 flags 0x00 dlen 21                #78 [hci1] 7.856699
      SMP: Pairing Random (0x04) len 16
        Random value: 8e6108f966a694cbe26df70bb96773e6
> HCI Event: Number of Completed Packets (0x13) plen 5      #79 [hci1] 8.028136
        Num handles: 1
        Handle: 111 Address: DF:A9:FF:F6:B1:1A (OUI DF-A9-FF)
        Count: 1
        #78: len 21 (0 Kb/s)
        Latency: 171 msec (78-171 msec ~158 msec)
> ACL Data RX: Handle 111 flags 0x02 dlen 21                #80 [hci1] 8.116034
      SMP: Pairing Confirm (0x03) len 16
        Confim value: 0aaaee1b0996a38b019d4d786045d94c
< HCI Command: Host Number of Compl.. (0x03|0x0035) plen 5  #81 [hci1] 8.136576
        Num handles: 1
        Handle: 111 Address: DF:A9:FF:F6:B1:1A (OUI DF-A9-FF)
        Count: 1
< ACL Data TX: Handle 111 flags 0x00 dlen 21                #82 [hci1] 8.136809
      SMP: Pairing Confirm (0x03) len 16
        Confim value: eafd6d0dcaaf755e6b92944012c3a93b
> HCI Event: Number of Completed Packets (0x13) plen 5      #83 [hci1] 8.290935
        Num handles: 1
        Handle: 111 Address: DF:A9:FF:F6:B1:1A (OUI DF-A9-FF)
        Count: 1
        #82: len 21 (1 Kb/s)
        Latency: 154 msec (78-171 msec ~156 msec)
> ACL Data RX: Handle 111 flags 0x02 dlen 21                #84 [hci1] 8.291267
      SMP: Pairing Random (0x04) len 16
        Random value: 4c053ac85deb7cf10000000000000000
< HCI Command: Host Number of Compl.. (0x03|0x0035) plen 5  #85 [hci1] 8.296652
        Num handles: 1
        Handle: 111 Address: DF:A9:FF:F6:B1:1A (OUI DF-A9-FF)
        Count: 1
< ACL Data TX: Handle 111 flags 0x00 dlen 21                #86 [hci1] 8.296726
      SMP: Pairing Random (0x04) len 16
        Random value: 4d02679f89a05211af56d8b3da64d21e
> HCI Event: Number of Completed Packets (0x13) plen 5      #87 [hci1] 8.465636
        Num handles: 1
        Handle: 111 Address: DF:A9:FF:F6:B1:1A (OUI DF-A9-FF)
        Count: 1
        #86: len 21 (1 Kb/s)
        Latency: 168 msec (78-171 msec ~162 msec)
> ACL Data RX: Handle 111 flags 0x02 dlen 21                #88 [hci1] 8.553496
      SMP: Pairing Confirm (0x03) len 16
        Confim value: 663935df54c2ccbad4ff8a109890e89b
< HCI Command: Host Number of Compl.. (0x03|0x0035) plen 5  #89 [hci1] 8.556141
        Num handles: 1
        Handle: 111 Address: DF:A9:FF:F6:B1:1A (OUI DF-A9-FF)
        Count: 1
< ACL Data TX: Handle 111 flags 0x00 dlen 21                #90 [hci1] 8.556189
      SMP: Pairing Confirm (0x03) len 16
        Confim value: 10919590a8817a7c97d3d3743509dc2a
> HCI Event: Number of Completed Packets (0x13) plen 5      #91 [hci1] 8.728290
        Num handles: 1
        Handle: 111 Address: DF:A9:FF:F6:B1:1A (OUI DF-A9-FF)
        Count: 1
        #90: len 21 (0 Kb/s)
        Latency: 172 msec (78-172 msec ~167 msec)
> ACL Data RX: Handle 111 flags 0x02 dlen 21                #92 [hci1] 8.728644
      SMP: Pairing Random (0x04) len 16
        Random value: c2e5d56d47c7f6240000000000000000
< HCI Command: Host Number of Compl.. (0x03|0x0035) plen 5  #93 [hci1] 8.736568
        Num handles: 1
        Handle: 111 Address: DF:A9:FF:F6:B1:1A (OUI DF-A9-FF)
        Count: 1
< ACL Data TX: Handle 111 flags 0x00 dlen 21                #94 [hci1] 8.736696
      SMP: Pairing Random (0x04) len 16
        Random value: 5e8286bc235a02440d0c3424a2acf8fd
> HCI Event: Number of Completed Packets (0x13) plen 5      #95 [hci1] 8.903249
        Num handles: 1
        Handle: 111 Address: DF:A9:FF:F6:B1:1A (OUI DF-A9-FF)
        Count: 1
        #94: len 21 (1 Kb/s)
        Latency: 166 msec (78-172 msec ~166 msec)
> ACL Data RX: Handle 111 flags 0x02 dlen 21                #96 [hci1] 8.990909
      SMP: Pairing Confirm (0x03) len 16
        Confim value: 3ebaf650592955b0d1f8ee227fe330fc
< HCI Command: Host Number of Compl.. (0x03|0x0035) plen 5  #97 [hci1] 8.996366
        Num handles: 1
        Handle: 111 Address: DF:A9:FF:F6:B1:1A (OUI DF-A9-FF)
        Count: 1
< ACL Data TX: Handle 111 flags 0x00 dlen 21                #98 [hci1] 8.996446
      SMP: Pairing Confirm (0x03) len 16
        Confim value: 4d79598776a4e6985150a4a853a3cc1f
> HCI Event: Number of Completed Packets (0x13) plen 5      #99 [hci1] 9.165817
        Num handles: 1
        Handle: 111 Address: DF:A9:FF:F6:B1:1A (OUI DF-A9-FF)
        Count: 1
        #98: len 21 (0 Kb/s)
        Latency: 169 msec (78-172 msec ~168 msec)
> ACL Data RX: Handle 111 flags 0x02 dlen 21               #100 [hci1] 9.166251
      SMP: Pairing Random (0x04) len 16
        Random value: 10fcd39bb1358b040000000000000000
< HCI Command: Host Number of Comp.. (0x03|0x0035) plen 5  #101 [hci1] 9.176469
        Num handles: 1
        Handle: 111 Address: DF:A9:FF:F6:B1:1A (OUI DF-A9-FF)
        Count: 1
< ACL Data TX: Handle 111 flags 0x00 dlen 21               #102 [hci1] 9.176638
      SMP: Pairing Random (0x04) len 16
        Random value: 5c4a1bcadd27bd58e945097b00bad7ac
> HCI Event: Number of Completed Packets (0x13) plen 5     #103 [hci1] 9.340598
        Num handles: 1
        Handle: 111 Address: DF:A9:FF:F6:B1:1A (OUI DF-A9-FF)
        Count: 1
        #102: len 21 (1 Kb/s)
        Latency: 163 msec (78-172 msec ~166 msec)
> ACL Data RX: Handle 111 flags 0x02 dlen 21               #104 [hci1] 9.428509
      SMP: Pairing Confirm (0x03) len 16
        Confim value: d7c4194d92c66e933b6790c274e3a1f5
< HCI Command: Host Number of Comp.. (0x03|0x0035) plen 5  #105 [hci1] 9.436491
        Num handles: 1
        Handle: 111 Address: DF:A9:FF:F6:B1:1A (OUI DF-A9-FF)
        Count: 1
< ACL Data TX: Handle 111 flags 0x00 dlen 21               #106 [hci1] 9.436735
      SMP: Pairing Confirm (0x03) len 16
        Confim value: 9d934f7639cfceb0f88757b73b75ba68
> HCI Event: Number of Completed Packets (0x13) plen 5     #107 [hci1] 9.603407
        Num handles: 1
        Handle: 111 Address: DF:A9:FF:F6:B1:1A (OUI DF-A9-FF)
        Count: 1
        #106: len 21 (1 Kb/s)
        Latency: 166 msec (78-172 msec ~166 msec)
> ACL Data RX: Handle 111 flags 0x02 dlen 21               #108 [hci1] 9.603679
      SMP: Pairing Random (0x04) len 16
        Random value: 676f66ce9c8f34fa0000000000000000
< HCI Command: Host Number of Comp.. (0x03|0x0035) plen 5  #109 [hci1] 9.616767
        Num handles: 1
        Handle: 111 Address: DF:A9:FF:F6:B1:1A (OUI DF-A9-FF)
        Count: 1
< ACL Data TX: Handle 111 flags 0x00 dlen 21               #110 [hci1] 9.616917
      SMP: Pairing Random (0x04) len 16
        Random value: 32527e6e64e79f33b2e374394db8ab2d
> HCI Event: Number of Completed Packets (0x13) plen 5     #111 [hci1] 9.778148
        Num handles: 1
        Handle: 111 Address: DF:A9:FF:F6:B1:1A (OUI DF-A9-FF)
        Count: 1
        #110: len 21 (1 Kb/s)
        Latency: 161 msec (78-172 msec ~163 msec)
> ACL Data RX: Handle 111 flags 0x02 dlen 21               #112 [hci1] 9.865902
      SMP: Pairing Confirm (0x03) len 16
        Confim value: 0c2b734e2ef890a127a7cf1a8365d774
< HCI Command: Host Number of Comp.. (0x03|0x0035) plen 5  #113 [hci1] 9.876149
        Num handles: 1
        Handle: 111 Address: DF:A9:FF:F6:B1:1A (OUI DF-A9-FF)
        Count: 1
< ACL Data TX: Handle 111 flags 0x00 dlen 21               #114 [hci1] 9.876248
      SMP: Pairing Confirm (0x03) len 16
        Confim value: 103f7cdc5fe084e7aa3453300dfb18ab
> HCI Event: Number of Completed Packets (0x13) plen 5    #115 [hci1] 10.040849
        Num handles: 1
        Handle: 111 Address: DF:A9:FF:F6:B1:1A (OUI DF-A9-FF)
        Count: 1
        #114: len 21 (1 Kb/s)
        Latency: 164 msec (78-172 msec ~164 msec)
> ACL Data RX: Handle 111 flags 0x02 dlen 21              #116 [hci1] 10.041146
      SMP: Pairing Random (0x04) len 16
        Random value: 5f0013725f9c4c820000000000000000
< HCI Command: Host Number of Com.. (0x03|0x0035) plen 5  #117 [hci1] 10.056660
        Num handles: 1
        Handle: 111 Address: DF:A9:FF:F6:B1:1A (OUI DF-A9-FF)
        Count: 1
< ACL Data TX: Handle 111 flags 0x00 dlen 21              #118 [hci1] 10.056751
      SMP: Pairing Random (0x04) len 16
        Random value: dddbdfe2838e9a8cc6964353c850fef7
> HCI Event: Number of Completed Packets (0x13) plen 5    #119 [hci1] 10.215553
        Num handles: 1
        Handle: 111 Address: DF:A9:FF:F6:B1:1A (OUI DF-A9-FF)
        Count: 1
        #118: len 21 (1 Kb/s)
        Latency: 158 msec (78-172 msec ~161 msec)
> ACL Data RX: Handle 111 flags 0x02 dlen 21              #120 [hci1] 10.303454
      SMP: Pairing Confirm (0x03) len 16
        Confim value: 6e5b97648c265e047f5a23c1916f0947
< HCI Command: Host Number of Com.. (0x03|0x0035) plen 5  #121 [hci1] 10.316201
        Num handles: 1
        Handle: 111 Address: DF:A9:FF:F6:B1:1A (OUI DF-A9-FF)
        Count: 1
< ACL Data TX: Handle 111 flags 0x00 dlen 21              #122 [hci1] 10.316332
      SMP: Pairing Confirm (0x03) len 16
        Confim value: e7fdb6681a110577b4e33bf0d5cf0d62
> HCI Event: Number of Completed Packets (0x13) plen 5    #123 [hci1] 10.478269
        Num handles: 1
        Handle: 111 Address: DF:A9:FF:F6:B1:1A (OUI DF-A9-FF)
        Count: 1
        #122: len 21 (1 Kb/s)
        Latency: 161 msec (78-172 msec ~161 msec)
> ACL Data RX: Handle 111 flags 0x02 dlen 21              #124 [hci1] 10.478652
      SMP: Pairing Random (0x04) len 16
        Random value: b08ccd759ef105ed0000000000000000
< HCI Command: Host Number of Com.. (0x03|0x0035) plen 5  #125 [hci1] 10.496755
        Num handles: 1
        Handle: 111 Address: DF:A9:FF:F6:B1:1A (OUI DF-A9-FF)
        Count: 1
< ACL Data TX: Handle 111 flags 0x00 dlen 21              #126 [hci1] 10.496904
      SMP: Pairing Random (0x04) len 16
        Random value: eb9f1915536596b6fc3db1c86b2b1970
> HCI Event: Number of Completed Packets (0x13) plen 5    #127 [hci1] 10.653059
        Num handles: 1
        Handle: 111 Address: DF:A9:FF:F6:B1:1A (OUI DF-A9-FF)
        Count: 1
        #126: len 21 (1 Kb/s)
        Latency: 156 msec (78-172 msec ~158 msec)
> ACL Data RX: Handle 111 flags 0x02 dlen 21              #128 [hci1] 10.740951
      SMP: Pairing Confirm (0x03) len 16
        Confim value: 93a57f3956e94a9952048f3ef4d4a828
< HCI Command: Host Number of Com.. (0x03|0x0035) plen 5  #129 [hci1] 10.756447
        Num handles: 1
        Handle: 111 Address: DF:A9:FF:F6:B1:1A (OUI DF-A9-FF)
        Count: 1
< ACL Data TX: Handle 111 flags 0x00 dlen 21              #130 [hci1] 10.756666
      SMP: Pairing Confirm (0x03) len 16
        Confim value: 8b2f1002b4eeda6a7df6f6a46dc5b0b0
> HCI Event: Number of Completed Packets (0x13) plen 5    #131 [hci1] 10.915748
        Num handles: 1
        Handle: 111 Address: DF:A9:FF:F6:B1:1A (OUI DF-A9-FF)
        Count: 1
        #130: len 21 (1 Kb/s)
        Latency: 159 msec (78-172 msec ~159 msec)
> ACL Data RX: Handle 111 flags 0x02 dlen 21              #132 [hci1] 10.916098
      SMP: Pairing Random (0x04) len 16
        Random value: d729162e1a811d900000000000000000
< HCI Command: Host Number of Com.. (0x03|0x0035) plen 5  #133 [hci1] 10.936466
        Num handles: 1
        Handle: 111 Address: DF:A9:FF:F6:B1:1A (OUI DF-A9-FF)
        Count: 1
< ACL Data TX: Handle 111 flags 0x00 dlen 21              #134 [hci1] 10.936635
      SMP: Pairing Random (0x04) len 16
        Random value: 5c794dc9ad9f2c3f295ebd5ad5e1c3cf
> HCI Event: Number of Completed Packets (0x13) plen 5    #135 [hci1] 11.090589
        Num handles: 1
        Handle: 111 Address: DF:A9:FF:F6:B1:1A (OUI DF-A9-FF)
        Count: 1
        #134: len 21 (1 Kb/s)
        Latency: 153 msec (78-172 msec ~156 msec)
> ACL Data RX: Handle 111 flags 0x02 dlen 21              #136 [hci1] 11.178510
      SMP: Pairing Confirm (0x03) len 16
        Confim value: 3bb9308f69828f28f6b6116e3ee37ff5
< HCI Command: Host Number of Com.. (0x03|0x0035) plen 5  #137 [hci1] 11.196511
        Num handles: 1
        Handle: 111 Address: DF:A9:FF:F6:B1:1A (OUI DF-A9-FF)
        Count: 1
< ACL Data TX: Handle 111 flags 0x00 dlen 21              #138 [hci1] 11.196678
      SMP: Pairing Confirm (0x03) len 16
        Confim value: 617a10d20ae50ea0173b89ef4e8b053f
> HCI Event: Number of Completed Packets (0x13) plen 5    #139 [hci1] 11.353484
        Num handles: 1
        Handle: 111 Address: DF:A9:FF:F6:B1:1A (OUI DF-A9-FF)
        Count: 1
        #138: len 21 (1 Kb/s)
        Latency: 156 msec (78-172 msec ~156 msec)
> ACL Data RX: Handle 111 flags 0x02 dlen 21              #140 [hci1] 11.353565
      SMP: Pairing Random (0x04) len 16
        Random value: 52a1ac81b409750f0000000000000000
< HCI Command: Host Number of Com.. (0x03|0x0035) plen 5  #141 [hci1] 11.356758
        Num handles: 1
        Handle: 111 Address: DF:A9:FF:F6:B1:1A (OUI DF-A9-FF)
        Count: 1
< ACL Data TX: Handle 111 flags 0x00 dlen 21              #142 [hci1] 11.356919
      SMP: Pairing Random (0x04) len 16
        Random value: 5c2fff312cdf99c9491988e877355a9a
> HCI Event: Number of Completed Packets (0x13) plen 5    #143 [hci1] 11.528036
        Num handles: 1
        Handle: 111 Address: DF:A9:FF:F6:B1:1A (OUI DF-A9-FF)
        Count: 1
        #142: len 21 (0 Kb/s)
        Latency: 171 msec (78-172 msec ~163 msec)
> ACL Data RX: Handle 111 flags 0x02 dlen 21              #144 [hci1] 11.615903
      SMP: Pairing Confirm (0x03) len 16
        Confim value: 495ebd8d914e3bf6552483f42b3cf79f
< HCI Command: Host Number of Com.. (0x03|0x0035) plen 5  #145 [hci1] 11.616503
        Num handles: 1
        Handle: 111 Address: DF:A9:FF:F6:B1:1A (OUI DF-A9-FF)
        Count: 1
< ACL Data TX: Handle 111 flags 0x00 dlen 21              #146 [hci1] 11.616697
      SMP: Pairing Confirm (0x03) len 16
        Confim value: c28d928ca9dde711bbdb09abf753be4d
> HCI Event: Number of Completed Packets (0x13) plen 5    #147 [hci1] 11.790865
        Num handles: 1
        Handle: 111 Address: DF:A9:FF:F6:B1:1A (OUI DF-A9-FF)
        Count: 1
        #146: len 21 (0 Kb/s)
        Latency: 174 msec (78-174 msec ~169 msec)
> ACL Data RX: Handle 111 flags 0x02 dlen 21              #148 [hci1] 11.791018
      SMP: Pairing Random (0x04) len 16
        Random value: 5c6a6d8b7bcabd050000000000000000
< HCI Command: Host Number of Com.. (0x03|0x0035) plen 5  #149 [hci1] 11.796752
        Num handles: 1
        Handle: 111 Address: DF:A9:FF:F6:B1:1A (OUI DF-A9-FF)
        Count: 1
< ACL Data TX: Handle 111 flags 0x00 dlen 21              #150 [hci1] 11.796852
      SMP: Pairing Random (0x04) len 16
        Random value: c629a3a987d808e808655d558dfc1155
> HCI Event: Number of Completed Packets (0x13) plen 5    #151 [hci1] 11.965514
        Num handles: 1
        Handle: 111 Address: DF:A9:FF:F6:B1:1A (OUI DF-A9-FF)
        Count: 1
        #150: len 21 (1 Kb/s)
        Latency: 168 msec (78-174 msec ~168 msec)
> ACL Data RX: Handle 111 flags 0x02 dlen 21              #152 [hci1] 12.053524
      SMP: Pairing Confirm (0x03) len 16
        Confim value: 009fe40d7effb52e342a81cd2faf6bf5
< HCI Command: Host Number of Com.. (0x03|0x0035) plen 5  #153 [hci1] 12.056593
        Num handles: 1
        Handle: 111 Address: DF:A9:FF:F6:B1:1A (OUI DF-A9-FF)
        Count: 1
< ACL Data TX: Handle 111 flags 0x00 dlen 21              #154 [hci1] 12.056799
      SMP: Pairing Confirm (0x03) len 16
        Confim value: b047bd7ebc5fcfea90e92d558003358f
> HCI Event: Number of Completed Packets (0x13) plen 5    #155 [hci1] 12.228234
        Num handles: 1
        Handle: 111 Address: DF:A9:FF:F6:B1:1A (OUI DF-A9-FF)
        Count: 1
        #154: len 21 (0 Kb/s)
        Latency: 171 msec (78-174 msec ~170 msec)
> ACL Data RX: Handle 111 flags 0x02 dlen 21              #156 [hci1] 12.228564
      SMP: Pairing Random (0x04) len 16
        Random value: eae9ed98b8f2f2790000000000000000
< HCI Command: Host Number of Com.. (0x03|0x0035) plen 5  #157 [hci1] 12.236557
        Num handles: 1
        Handle: 111 Address: DF:A9:FF:F6:B1:1A (OUI DF-A9-FF)
        Count: 1
< ACL Data TX: Handle 111 flags 0x00 dlen 21              #158 [hci1] 12.236668
      SMP: Pairing Random (0x04) len 16
        Random value: 92f20f6ad8f13724432c7fd6001c45ff
> HCI Event: Number of Completed Packets (0x13) plen 5    #159 [hci1] 12.403010
        Num handles: 1
        Handle: 111 Address: DF:A9:FF:F6:B1:1A (OUI DF-A9-FF)
        Count: 1
        #158: len 21 (1 Kb/s)
        Latency: 166 msec (78-174 msec ~168 msec)
> ACL Data RX: Handle 111 flags 0x02 dlen 21              #160 [hci1] 12.490881
      SMP: Pairing Confirm (0x03) len 16
        Confim value: eb73297b23257f4de9be4528c98bd6d7
< HCI Command: Host Number of Com.. (0x03|0x0035) plen 5  #161 [hci1] 12.496481
        Num handles: 1
        Handle: 111 Address: DF:A9:FF:F6:B1:1A (OUI DF-A9-FF)
        Count: 1
< ACL Data TX: Handle 111 flags 0x00 dlen 21              #162 [hci1] 12.496585
      SMP: Pairing Confirm (0x03) len 16
        Confim value: 42fd97aeed2a65ba3408b0d359fc54ab
> HCI Event: Number of Completed Packets (0x13) plen 5    #163 [hci1] 12.665709
        Num handles: 1
        Handle: 111 Address: DF:A9:FF:F6:B1:1A (OUI DF-A9-FF)
        Count: 1
        #162: len 21 (0 Kb/s)
        Latency: 169 msec (78-174 msec ~168 msec)
> ACL Data RX: Handle 111 flags 0x02 dlen 21              #164 [hci1] 12.666013
      SMP: Pairing Random (0x04) len 16
        Random value: a2a8798a1cd9d76f0000000000000000
< HCI Command: Host Number of Com.. (0x03|0x0035) plen 5  #165 [hci1] 12.676644
        Num handles: 1
        Handle: 111 Address: DF:A9:FF:F6:B1:1A (OUI DF-A9-FF)
        Count: 1
< ACL Data TX: Handle 111 flags 0x00 dlen 21              #166 [hci1] 12.676735
      SMP: Pairing Random (0x04) len 16
        Random value: 23ac32ebbb5e14c8a6b9622f296d277f
> HCI Event: Number of Completed Packets (0x13) plen 5    #167 [hci1] 12.840512
        Num handles: 1
        Handle: 111 Address: DF:A9:FF:F6:B1:1A (OUI DF-A9-FF)
        Count: 1
        #166: len 21 (1 Kb/s)
        Latency: 163 msec (78-174 msec ~166 msec)
> ACL Data RX: Handle 111 flags 0x02 dlen 21              #168 [hci1] 12.928292
      SMP: Pairing Confirm (0x03) len 16
        Confim value: 03a9cf33a1938461085615395b4a81a3
< HCI Command: Host Number of Com.. (0x03|0x0035) plen 5  #169 [hci1] 12.936566
        Num handles: 1
        Handle: 111 Address: DF:A9:FF:F6:B1:1A (OUI DF-A9-FF)
        Count: 1
< ACL Data TX: Handle 111 flags 0x00 dlen 21              #170 [hci1] 12.936649
      SMP: Pairing Confirm (0x03) len 16
        Confim value: 16c161b935c4417813ea42392026d401
> HCI Event: Number of Completed Packets (0x13) plen 5    #171 [hci1] 13.103229
        Num handles: 1
        Handle: 111 Address: DF:A9:FF:F6:B1:1A (OUI DF-A9-FF)
        Count: 1
        #170: len 21 (1 Kb/s)
        Latency: 166 msec (78-174 msec ~166 msec)
> ACL Data RX: Handle 111 flags 0x02 dlen 21              #172 [hci1] 13.103504
      SMP: Pairing Random (0x04) len 16
        Random value: 30e33ec879f273840000000000000000
< HCI Command: Host Number of Com.. (0x03|0x0035) plen 5  #173 [hci1] 13.116775
        Num handles: 1
        Handle: 111 Address: DF:A9:FF:F6:B1:1A (OUI DF-A9-FF)
        Count: 1
< ACL Data TX: Handle 111 flags 0x00 dlen 21              #174 [hci1] 13.116898
      SMP: Pairing Random (0x04) len 16
        Random value: 297efe85e67448a15f56bd27e3a3cf1d
> HCI Event: Number of Completed Packets (0x13) plen 5    #175 [hci1] 13.278025
        Num handles: 1
        Handle: 111 Address: DF:A9:FF:F6:B1:1A (OUI DF-A9-FF)
        Count: 1
        #174: len 21 (1 Kb/s)
        Latency: 161 msec (78-174 msec ~163 msec)
> ACL Data RX: Handle 111 flags 0x02 dlen 21              #176 [hci1] 13.365792
      SMP: Pairing Confirm (0x03) len 16
        Confim value: bacbc04ee3c1342e22f435397b874e25
< HCI Command: Host Number of Com.. (0x03|0x0035) plen 5  #177 [hci1] 13.376428
        Num handles: 1
        Handle: 111 Address: DF:A9:FF:F6:B1:1A (OUI DF-A9-FF)
        Count: 1
< ACL Data TX: Handle 111 flags 0x00 dlen 21              #178 [hci1] 13.376622
      SMP: Pairing Confirm (0x03) len 16
        Confim value: 2ac6afe112627c8f46f3bbf18635615d
> HCI Event: Number of Completed Packets (0x13) plen 5    #179 [hci1] 13.540721
        Num handles: 1
        Handle: 111 Address: DF:A9:FF:F6:B1:1A (OUI DF-A9-FF)
        Count: 1
        #178: len 21 (1 Kb/s)
        Latency: 164 msec (78-174 msec ~163 msec)
> ACL Data RX: Handle 111 flags 0x02 dlen 21              #180 [hci1] 13.540963
      SMP: Pairing Random (0x04) len 16
        Random value: 3344a8c703ccd5840000000000000000
< HCI Command: Host Number of Com.. (0x03|0x0035) plen 5  #181 [hci1] 13.556683
        Num handles: 1
        Handle: 111 Address: DF:A9:FF:F6:B1:1A (OUI DF-A9-FF)
        Count: 1
< ACL Data TX: Handle 111 flags 0x00 dlen 21              #182 [hci1] 13.556781
      SMP: Pairing Random (0x04) len 16
        Random value: 25a9493fd3ce4faf02be7293595bb7c6
> HCI Event: Number of Completed Packets (0x13) plen 5    #183 [hci1] 13.715446
        Num handles: 1
        Handle: 111 Address: DF:A9:FF:F6:B1:1A (OUI DF-A9-FF)
        Count: 1
        #182: len 21 (1 Kb/s)
        Latency: 158 msec (78-174 msec ~161 msec)
> ACL Data RX: Handle 111 flags 0x02 dlen 21              #184 [hci1] 13.803297
      SMP: Pairing Confirm (0x03) len 16
        Confim value: af0d66e1ac2ec92c7bdd3768d5d0d887
< HCI Command: Host Number of Com.. (0x03|0x0035) plen 5  #185 [hci1] 13.816231
        Num handles: 1
        Handle: 111 Address: DF:A9:FF:F6:B1:1A (OUI DF-A9-FF)
        Count: 1
< ACL Data TX: Handle 111 flags 0x00 dlen 21              #186 [hci1] 13.816314
      SMP: Pairing Confirm (0x03) len 16
        Confim value: 3f5d939a676d7106aef1d7feae0ed9e0
> HCI Event: Number of Completed Packets (0x13) plen 5    #187 [hci1] 13.978151
        Num handles: 1
        Handle: 111 Address: DF:A9:FF:F6:B1:1A (OUI DF-A9-FF)
        Count: 1
        #186: len 21 (1 Kb/s)
        Latency: 161 msec (78-174 msec ~161 msec)
> ACL Data RX: Handle 111 flags 0x02 dlen 21              #188 [hci1] 13.978476
      SMP: Pairing Random (0x04) len 16
        Random value: 82a9a5eba897c1980000000000000000
< HCI Command: Host Number of Com.. (0x03|0x0035) plen 5  #189 [hci1] 13.996594
        Num handles: 1
        Handle: 111 Address: DF:A9:FF:F6:B1:1A (OUI DF-A9-FF)
        Count: 1
< ACL Data TX: Handle 111 flags 0x00 dlen 21              #190 [hci1] 13.996740
      SMP: Pairing Random (0x04) len 16
        Random value: 58f6b41f855a6f6c3560debd84e2affc
> HCI Event: Number of Completed Packets (0x13) plen 5    #191 [hci1] 14.152972
        Num handles: 1
        Handle: 111 Address: DF:A9:FF:F6:B1:1A (OUI DF-A9-FF)
        Count: 1
        #190: len 21 (1 Kb/s)
        Latency: 156 msec (78-174 msec ~158 msec)
> ACL Data RX: Handle 111 flags 0x02 dlen 21              #192 [hci1] 14.240807
      SMP: Pairing Confirm (0x03) len 16
        Confim value: 3d20c42ad54d14af426d5e3062eb3e30
< HCI Command: Host Number of Com.. (0x03|0x0035) plen 5  #193 [hci1] 14.256289
        Num handles: 1
        Handle: 111 Address: DF:A9:FF:F6:B1:1A (OUI DF-A9-FF)
        Count: 1
< ACL Data TX: Handle 111 flags 0x00 dlen 21              #194 [hci1] 14.256426
      SMP: Pairing Confirm (0x03) len 16
        Confim value: 4041700cd16712f128b6422903dca707
> HCI Event: Number of Completed Packets (0x13) plen 5    #195 [hci1] 14.415667
        Num handles: 1
        Handle: 111 Address: DF:A9:FF:F6:B1:1A (OUI DF-A9-FF)
        Count: 1
        #194: len 21 (1 Kb/s)
        Latency: 159 msec (78-174 msec ~159 msec)
> ACL Data RX: Handle 111 flags 0x02 dlen 21              #196 [hci1] 14.416006
      SMP: Pairing Random (0x04) len 16
        Random value: 79fbac356ccff7420000000000000000
< HCI Command: Host Number of Com.. (0x03|0x0035) plen 5  #197 [hci1] 14.416672
        Num handles: 1
        Handle: 111 Address: DF:A9:FF:F6:B1:1A (OUI DF-A9-FF)
        Count: 1
< ACL Data TX: Handle 111 flags 0x00 dlen 21              #198 [hci1] 14.416753
      SMP: Pairing Random (0x04) len 16
        Random value: b67e7216d5bf664139eda2b542549666
> HCI Event: Number of Completed Packets (0x13) plen 5    #199 [hci1] 14.590473
        Num handles: 1
        Handle: 111 Address: DF:A9:FF:F6:B1:1A (OUI DF-A9-FF)
        Count: 1
        #198: len 21 (0 Kb/s)
        Latency: 173 msec (78-174 msec ~166 msec)
> ACL Data RX: Handle 111 flags 0x02 dlen 21              #200 [hci1] 14.678301
      SMP: Pairing Confirm (0x03) len 16
        Confim value: 376b2958535ab44f150b64963fde63ef
< HCI Command: Host Number of Com.. (0x03|0x0035) plen 5  #201 [hci1] 14.696266
        Num handles: 1
        Handle: 111 Address: DF:A9:FF:F6:B1:1A (OUI DF-A9-FF)
        Count: 1
< ACL Data TX: Handle 111 flags 0x00 dlen 21              #202 [hci1] 14.696409
      SMP: Pairing Confirm (0x03) len 16
        Confim value: 3a6bf6adbc6452b0528bee0ec79e8b9b
> HCI Event: Number of Completed Packets (0x13) plen 5    #203 [hci1] 14.853150
        Num handles: 1
        Handle: 111 Address: DF:A9:FF:F6:B1:1A (OUI DF-A9-FF)
        Count: 1
        #202: len 21 (1 Kb/s)
        Latency: 156 msec (78-174 msec ~161 msec)
> ACL Data RX: Handle 111 flags 0x02 dlen 21              #204 [hci1] 14.853493
      SMP: Pairing Random (0x04) len 16
        Random value: 6e520361a74b18da0000000000000000
< HCI Command: Host Number of Com.. (0x03|0x0035) plen 5  #205 [hci1] 14.856701
        Num handles: 1
        Handle: 111 Address: DF:A9:FF:F6:B1:1A (OUI DF-A9-FF)
        Count: 1
< ACL Data TX: Handle 111 flags 0x00 dlen 21              #206 [hci1] 14.856815
      SMP: Pairing Random (0x04) len 16
        Random value: ed17f76500c95219dd01e09d1e63f87b
> HCI Event: Number of Completed Packets (0x13) plen 5    #207 [hci1] 15.028021
        Num handles: 1
        Handle: 111 Address: DF:A9:FF:F6:B1:1A (OUI DF-A9-FF)
        Count: 1
        #206: len 21 (0 Kb/s)
        Latency: 171 msec (78-174 msec ~166 msec)
> ACL Data RX: Handle 111 flags 0x02 dlen 21              #208 [hci1] 15.115739
      SMP: Pairing Confirm (0x03) len 16
        Confim value: 324edbbb6ab4d6928af5f1a4dadc6e26
< HCI Command: Host Number of Com.. (0x03|0x0035) plen 5  #209 [hci1] 15.116438
        Num handles: 1
        Handle: 111 Address: DF:A9:FF:F6:B1:1A (OUI DF-A9-FF)
        Count: 1
< ACL Data TX: Handle 111 flags 0x00 dlen 21              #210 [hci1] 15.116519
      SMP: Pairing Confirm (0x03) len 16
        Confim value: f86ec4c7916fd77650969a7261166761
> HCI Event: Number of Completed Packets (0x13) plen 5    #211 [hci1] 15.290598
        Num handles: 1
        Handle: 111 Address: DF:A9:FF:F6:B1:1A (OUI DF-A9-FF)
        Count: 1
        #210: len 21 (0 Kb/s)
        Latency: 174 msec (78-174 msec ~170 msec)
> ACL Data RX: Handle 111 flags 0x02 dlen 21              #212 [hci1] 15.290998
      SMP: Pairing Random (0x04) len 16
        Random value: 485e8cb72781391d0000000000000000
< HCI Command: Host Number of Com.. (0x03|0x0035) plen 5  #213 [hci1] 15.296630
        Num handles: 1
        Handle: 111 Address: DF:A9:FF:F6:B1:1A (OUI DF-A9-FF)
        Count: 1
< ACL Data TX: Handle 111 flags 0x00 dlen 21              #214 [hci1] 15.296725
      SMP: Pairing Random (0x04) len 16
        Random value: 81d35d47e1f6006d79c974bd9d9e1ee3
> HCI Event: Number of Completed Packets (0x13) plen 5    #215 [hci1] 15.465361
        Num handles: 1
        Handle: 111 Address: DF:A9:FF:F6:B1:1A (OUI DF-A9-FF)
        Count: 1
        #214: len 21 (1 Kb/s)
        Latency: 168 msec (78-174 msec ~169 msec)
> ACL Data RX: Handle 111 flags 0x02 dlen 21              #216 [hci1] 15.553281
      SMP: Pairing Confirm (0x03) len 16
        Confim value: a80d0c78d0ec12c766fba8c039c7b3ea
< HCI Command: Host Number of Com.. (0x03|0x0035) plen 5  #217 [hci1] 15.556373
        Num handles: 1
        Handle: 111 Address: DF:A9:FF:F6:B1:1A (OUI DF-A9-FF)
        Count: 1
< ACL Data TX: Handle 111 flags 0x00 dlen 21              #218 [hci1] 15.556433
      SMP: Pairing Confirm (0x03) len 16
        Confim value: 3e41e6c0c21673cadf5f73bb76b59bd4
> HCI Event: Number of Completed Packets (0x13) plen 5    #219 [hci1] 15.728105
        Num handles: 1
        Handle: 111 Address: DF:A9:FF:F6:B1:1A (OUI DF-A9-FF)
        Count: 1
        #218: len 21 (0 Kb/s)
        Latency: 171 msec (78-174 msec ~170 msec)
> ACL Data RX: Handle 111 flags 0x02 dlen 21              #220 [hci1] 15.728403
      SMP: Pairing Random (0x04) len 16
        Random value: 4e21cc198294be130000000000000000
< HCI Command: Host Number of Com.. (0x03|0x0035) plen 5  #221 [hci1] 15.736169
        Num handles: 1
        Handle: 111 Address: DF:A9:FF:F6:B1:1A (OUI DF-A9-FF)
        Count: 1
< ACL Data TX: Handle 111 flags 0x00 dlen 21              #222 [hci1] 15.736245
      SMP: Pairing Random (0x04) len 16
        Random value: e7f7e0c2476823e41736a7e381bafb7c
> HCI Event: Number of Completed Packets (0x13) plen 5    #223 [hci1] 15.902866
        Num handles: 1
        Handle: 111 Address: DF:A9:FF:F6:B1:1A (OUI DF-A9-FF)
        Count: 1
        #222: len 21 (1 Kb/s)
        Latency: 166 msec (78-174 msec ~168 msec)
> ACL Data RX: Handle 111 flags 0x02 dlen 21              #224 [hci1] 15.990653
      SMP: Pairing Confirm (0x03) len 16
        Confim value: c3314ac1064edd3d167674f41bda89f8
< HCI Command: Host Number of Com.. (0x03|0x0035) plen 5  #225 [hci1] 15.996441
        Num handles: 1
        Handle: 111 Address: DF:A9:FF:F6:B1:1A (OUI DF-A9-FF)
        Count: 1
< ACL Data TX: Handle 111 flags 0x00 dlen 21              #226 [hci1] 15.996570
      SMP: Pairing Confirm (0x03) len 16
        Confim value: 8a5d9dceec7b5acf3e46cce9b1a2b2a3
> HCI Event: Number of Completed Packets (0x13) plen 5    #227 [hci1] 16.165679
        Num handles: 1
        Handle: 111 Address: DF:A9:FF:F6:B1:1A (OUI DF-A9-FF)
        Count: 1
        #226: len 21 (0 Kb/s)
        Latency: 169 msec (78-174 msec ~168 msec)
> ACL Data RX: Handle 111 flags 0x02 dlen 21              #228 [hci1] 16.165919
      SMP: Pairing Random (0x04) len 16
        Random value: fd22fcd5914b6cd00000000000000000
< HCI Command: Host Number of Com.. (0x03|0x0035) plen 5  #229 [hci1] 16.176329
        Num handles: 1
        Handle: 111 Address: DF:A9:FF:F6:B1:1A (OUI DF-A9-FF)
        Count: 1
