Bluetooth monitor ver 5.72
= Note: Linux version 6.14.0-36-generic (x86_64)                       0.483548
= Note: Bluetooth subsystem version 2.22                               0.483550
= New Index: 00:00:00:00:00:00 (Primary,UART,hci1)              [hci1] 0.483551
= New Index: 48:5F:99:8E:E0:64 (Primary,USB,hci0)               [hci0] 0.483552
= Open Index: 00:00:00:00:00:00                                 [hci1] 0.596803
= Index Info: 00:00:00:00:00:00 (Nordic Semiconductor ASA)      [hci1] 0.596807
@ USER Open: main (privileged) version 2.22            {0x0001} [hci1] 0.596810
< HCI Command: Reset (0x03|0x0003) plen 0                    #1 [hci1] 0.597188
> HCI Event: Command Complete (0x0e) plen 4                  #2 [hci1] 0.597624
      Reset (0x03|0x0003) ncmd 1
        Status: Success (0x00)
< HCI Command: Read Local Supported... (0x04|0x0003) plen 0  #3 [hci1] 0.616825
> HCI Event: Command Complete (0x0e) plen 12                 #4 [hci1] 0.617279
      Read Local Supported Features (0x04|0x0003) ncmd 1
        Status: Success (0x00)
        Features: 0x00 0x00 0x00 0x00 0x60 0x00 0x00 0x00
          BR/EDR Not Supported
          LE Supported (Controller)
< HCI Command: Read Local Version In.. (0x04|0x0001) plen 0  #5 [hci1] 0.636837
> HCI Event: Command Complete (0x0e) plen 12                 #6 [hci1] 0.637282
      Read Local Version Information (0x04|0x0001) ncmd 1
        Status: Success (0x00)
        HCI version: Reserved (0x0f) - Revision 12393 (0x3069)
        LMP version: Reserved (0x0f) - Subversion 12393 (0x3069)
        Manufacturer: Nordic Semiconductor ASA (89)
< HCI Command: Read Local Supported... (0x04|0x0002) plen 0  #7 [hci1] 0.656817
> HCI Event: Command Complete (0x0e) plen 68                 #8 [hci1] 0.657862
      Read Local Supported Commands (0x04|0x0002) ncmd 1
        Status: Success (0x00)
        Commands: 119 entries
          Disconnect (Octet 0 - Bit 5)
          Read Remote Version Information (Octet 2 - Bit 7)
          Set Event Mask (Octet 5 - Bit 6)
          Reset (Octet 5 - Bit 7)
          Read Connection Accept Timeout (Octet 7 - Bit 2)
          Write Connection Accept Timeout (Octet 7 - Bit 3)
          Read Transmit Power Level (Octet 10 - Bit 2)
          Set Controller To Host Flow Control (Octet 10 - Bit 5)
          Host Buffer Size (Octet 10 - Bit 6)
          Host Number of Completed Packets (Octet 10 - Bit 7)
          Read Local Version Information (Octet 14 - Bit 3)
          Read Local Supported Features (Octet 14 - Bit 5)
          Read BD ADDR (Octet 15 - Bit 1)
          Read RSSI (Octet 15 - Bit 5)
          Set Event Mask Page 2 (Octet 22 - Bit 2)
          LE Set Event Mask (Octet 25 - Bit 0)
          LE Read Buffer Size (Octet 25 - Bit 1)
          LE Read Local Supported Features (Octet 25 - Bit 2)
          LE Set Random Address (Octet 25 - Bit 4)
          LE Set Advertising Parameters (Octet 25 - Bit 5)
          LE Read Advertising Channel TX Power (Octet 25 - Bit 6)
          LE Set Advertising Data (Octet 25 - Bit 7)
          LE Set Scan Response Data (Octet 26 - Bit 0)
          LE Set Advertise Enable (Octet 26 - Bit 1)
          LE Set Scan Parameters (Octet 26 - Bit 2)
          LE Set Scan Enable (Octet 26 - Bit 3)
          LE Create Connection (Octet 26 - Bit 4)
          LE Create Connection Cancel (Octet 26 - Bit 5)
          LE Read Accept List Size (Octet 26 - Bit 6)
          LE Clear Accept List (Octet 26 - Bit 7)
          LE Add Device To Accept List (Octet 27 - Bit 0)
          LE Remove Device From Accept List (Octet 27 - Bit 1)
          LE Connection Update (Octet 27 - Bit 2)
          LE Set Host Channel Classification (Octet 27 - Bit 3)
          LE Read Channel Map (Octet 27 - Bit 4)
          LE Read Remote Used Features (Octet 27 - Bit 5)
          LE Encrypt (Octet 27 - Bit 6)
          LE Rand (Octet 27 - Bit 7)
          LE Start Encryption (Octet 28 - Bit 0)
          LE Long Term Key Request Reply (Octet 28 - Bit 1)
          LE Long Term Key Request Neg Reply (Octet 28 - Bit 2)
          LE Read Supported States (Octet 28 - Bit 3)
          LE Receiver Test (Octet 28 - Bit 4)
          LE Transmitter Test (Octet 28 - Bit 5)
          LE Test End (Octet 28 - Bit 6)
          Read Authenticated Payload Timeout (Octet 32 - Bit 4)
          Write Authenticated Payload Timeout (Octet 32 - Bit 5)
          LE Set Data Length (Octet 33 - Bit 6)
          LE Read Suggested Default Data Length (Octet 33 - Bit 7)
          LE Write Suggested Default Data Length (Octet 34 - Bit 0)
          LE Add Device To Resolving List (Octet 34 - Bit 3)
          LE Remove Device From Resolving List (Octet 34 - Bit 4)
          LE Clear Resolving List (Octet 34 - Bit 5)
          LE Read Resolving List Size (Octet 34 - Bit 6)
          LE Set Address Resolution Enable (Octet 35 - Bit 1)
          LE Set Resolvable Private Address Timeout (Octet 35 - Bit 2)
          LE Read Maximum Data Length (Octet 35 - Bit 3)
          LE Read PHY (Octet 35 - Bit 4)
          LE Set Default PHY (Octet 35 - Bit 5)
          LE Set PHY (Octet 35 - Bit 6)
          LE Enhanced Receiver Test (Octet 35 - Bit 7)
          LE Enhanced Transmitter Test (Octet 36 - Bit 0)
          LE Set Advertising Set Random Address (Octet 36 - Bit 1)
          LE Set Extended Advertising Parameters (Octet 36 - Bit 2)
          LE Set Extended Advertising Data (Octet 36 - Bit 3)
          LE Set Extended Scan Response Data (Octet 36 - Bit 4)
          LE Set Extended Advertising Enable (Octet 36 - Bit 5)
          LE Read Maximum Advertising Data Length (Octet 36 - Bit 6)
          LE Read Number of Supported Advertising Sets (Octet 36 - Bit 7)
          LE Remove Advertising Set (Octet 37 - Bit 0)
          LE Clear Advertising Sets (Octet 37 - Bit 1)
          LE Set Periodic Advertising Parameters (Octet 37 - Bit 2)
          LE Set Periodic Advertising Data (Octet 37 - Bit 3)
          LE Set Periodic Advertising Enable (Octet 37 - Bit 4)
          LE Set Extended Scan Parameters (Octet 37 - Bit 5)
          LE Set Extended Scan Enable (Octet 37 - Bit 6)
          LE Extended Create Connection (Octet 37 - Bit 7)
          LE Periodic Advertising Create Sync (Octet 38 - Bit 0)
          LE Periodic Advertising Create Sync Cancel (Octet 38 - Bit 1)
          LE Periodic Advertising Terminate Sync (Octet 38 - Bit 2)
          LE Add Device To Periodic Advertiser List (Octet 38 - Bit 3)
          LE Remove Device From Periodic Advertiser List (Octet 38 - Bit 4)
          LE Clear Periodic Advertiser List (Octet 38 - Bit 5)
          LE Read Periodic Advertiser List Size (Octet 38 - Bit 6)
          LE Read Transmit Power (Octet 38 - Bit 7)
          LE Read RF Path Compensation (Octet 39 - Bit 0)
          LE Write RF Path Compensation (Octet 39 - Bit 1)
          LE Set Privacy Mode (Octet 39 - Bit 2)
          LE Periodic Advertising Receive Enable (Octet 40 - Bit 5)
          LE Periodic Advertising Sync Transfer (Octet 40 - Bit 6)
          LE Periodic Advertising Set Info Transfer (Octet 40 - Bit 7)
          LE Periodic Advertising Sync Transfer Parameters (Octet 41 - Bit 0)
          LE Set Default Periodic Advertisng Sync Transfer Parameters (Octet 41 - Bit 1)
          LE Read Buffer v2 (Octet 41 - Bit 5)
          LE Read ISO TX Sync (Octet 41 - Bit 6)
          LE Set Connected Isochronous Group Parameters (Octet 41 - Bit 7)
          LE Set Connected Isochronous Group Parameters Test (Octet 42 - Bit 0)
          LE Create Connected Isochronous Stream (Octet 42 - Bit 1)
          LE Remove Connected Isochronous Group (Octet 42 - Bit 2)
          LE Accept Connected Isochronous Stream Request (Octet 42 - Bit 3)
          LE Reject Connected Isochronous Stream Request (Octet 42 - Bit 4)
          LE Create Broadcast Isochronous Group (Octet 42 - Bit 5)
          LE Create Broadcast Isochronous Group Test (Octet 42 - Bit 6)
          LE Terminate Broadcast Isochronous Group (Octet 42 - Bit 7)
          LE Broadcast Isochronous Group Create Sync (Octet 43 - Bit 0)
          LE Broadcast Isochronous Group Terminate Sync (Octet 43 - Bit 1)
          LE Request Peer SCA (Octet 43 - Bit 2)
          LE Setup Isochronous Data Path (Octet 43 - Bit 3)
          LE Remove Isochronous Data Path (Octet 43 - Bit 4)
          LE Isochronous Transmit Test (Octet 43 - Bit 5)
          LE Isochronous Receive Test (Octet 43 - Bit 6)
          LE Isochronous Read Test Counters (Octet 43 - Bit 7)
          LE Isochronous Read Test Counters (Octet 44 - Bit 0)
          LE Set Host Feature (Octet 44 - Bit 1)
          Octet 44 - Bit 2 
          Octet 45 - Bit 6 
          Octet 46 - Bit 0 
          Octet 46 - Bit 1 
          Octet 46 - Bit 2 
< HCI Command: Host Buffer Size (0x03|0x0033) plen 7         #9 [hci1] 0.676791
        ACL MTU: 255  ACL max packet: 16
        SCO MTU: 0    SCO max packet: 0
> HCI Event: Command Complete (0x0e) plen 4                 #10 [hci1] 0.677320
      Host Buffer Size (0x03|0x0033) ncmd 1
        Status: Success (0x00)
< HCI Command: Set Controller To Ho.. (0x03|0x0031) plen 1  #11 [hci1] 0.696786
        Flow control: ACL Data Packets (0x01)
> HCI Event: Command Complete (0x0e) plen 4                 #12 [hci1] 0.697256
      Set Controller To Host Flow Control (0x03|0x0031) ncmd 1
        Status: Success (0x00)
< HCI Command: LE Read Local Suppor.. (0x08|0x0003) plen 0  #13 [hci1] 0.716824
> HCI Event: Command Complete (0x0e) plen 12                #14 [hci1] 0.717299
      LE Read Local Supported Features (0x08|0x0003) ncmd 1
        Status: Success (0x00)
        Features: 0xfd 0x79 0x00 0xf7 0x30 0x01 0x00 0x00
          LE Encryption
          Extended Reject Indication
          Peripheral-initiated Features Exchange
          LE Ping
          LE Data Packet Length Extension
          LL Privacy
          Extended Scanner Filter Policies
          LE 2M PHY
          LE Coded PHY
          LE Extended Advertising
          LE Periodic Advertising
          Channel Selection Algorithm #2
          Periodic Advertising Sync Transfer - Sender
          Periodic Advertising Sync Transfer - Recipient
          Sleep Clock Accuracy Updates
          Connected Isochronous Stream - Central
          Connected Isochronous Stream - Peripheral
          Isochronous Broadcaster
          Synchronized Receiver
          Periodic Advertising ADI support
          Connection Subrating
          Unknown features (0x0000010000000000)
< HCI Command: LE Set Host Feature (0x08|0x0074) plen 2     #15 [hci1] 0.736823
        Bit Number: 32
          Connected Isochronous Stream (Host Support)
        Bit Value: 1
> HCI Event: Command Complete (0x0e) plen 4                 #16 [hci1] 0.737259
      LE Set Host Feature (0x08|0x0074) ncmd 1
        Status: Success (0x00)
< HCI Command: LE Read Buffer v2 (0x08|0x0060) plen 0       #17 [hci1] 0.756824
> HCI Event: Command Complete (0x0e) plen 10                #18 [hci1] 0.757287
      LE Read Buffer v2 (0x08|0x0060) ncmd 1
        Status: Success (0x00)
        ACL MTU: 27
        ACL max packet: 3
        ISO MTU: 318
        ISO max packet: 3
< HCI Command: LE Read Maximum Adve.. (0x08|0x003a) plen 0  #19 [hci1] 0.776850
> HCI Event: Command Complete (0x0e) plen 6                 #20 [hci1] 0.777316
      LE Read Maximum Advertising Data Length (0x08|0x003a) ncmd 1
        Status: Success (0x00)
        Max length: 1650
< HCI Command: LE Read Supported St.. (0x08|0x001c) plen 0  #21 [hci1] 0.796801
> HCI Event: Command Complete (0x0e) plen 12                #22 [hci1] 0.797356
      LE Read Supported States (0x08|0x001c) ncmd 1
        Status: Success (0x00)
        States: 0x000003ff3e0306ff
          Non-connectable Advertising State
          Scannable Advertising State
          Connectable Advertising State
          High Duty Cycle Directed Advertising State
          Passive Scanning State
          Active Scanning State
          Initiating State
            and Connection State (Central Role)
          Connection State (Peripheral Role)
          Scannable Advertising State
            and Passive Scanning State
          Connectable Advertising State
            and Passive Scanning State
          Non-connectable Advertising State
            and Initiating State
          Scannable Advertising State
            and Initiating State
          Active Scanning State
            and Connection State (Central Role)
          Passive Scanning State
            and Connection State (Peripheral Role)
          Active Scanning State
            and Connection State (Peripheral Role)
          Initiating State
            and Connection State (Central Role)
            and Central Role & Central Role
          Low Duty Cycle Directed Advertising State
          Connectable Advertising State
            and Initiating State
            and Central Role & Peripheral Role
          High Duty Cycle Directed Advertising State
            and Initiating State
            and Central Role & Peripheral Role
          Low Duty Cycle Directed Advertising State
            and Initiating State
            and Central Role & Peripheral Role
          Connectable Advertising State
            and Connection State (Central Role)
            and Central Role & Peripheral Role
          High Duty Cycle Directed Advertising State
            and Connection State (Central Role)
            and Central Role & Peripheral Role
          Low Duty Cycle Directed Advertising State
            and Connection State (Central Role)
            and Central Role & Peripheral Role
          Connectable Advertising State
            and Connection State (Peripheral Role)
            and Central Role & Peripheral Role
          High Duty Cycle Directed Advertising State
            and Connection State (Peripheral Role)
            and Peripheral Role & Peripheral Role
          Low Duty Cycle Directed Advertising State
            and Connection State (Peripheral Role)
            and Peripheral Role & Peripheral Role
          Initiating State
            and Connection State (Peripheral Role)
            and Central Role & Peripheral Role
< HCI Command: LE Read Maximum Data.. (0x08|0x002f) plen 0  #23 [hci1] 0.816787
> HCI Event: Command Complete (0x0e) plen 12                #24 [hci1] 0.817260
      LE Read Maximum Data Length (0x08|0x002f) ncmd 1
        Status: Success (0x00)
        Max TX octets: 251
        Max TX time: 2704
        Max RX octets: 251
        Max RX time: 2704
< HCI Command: LE Write Suggested D.. (0x08|0x0024) plen 4  #25 [hci1] 0.836799
        TX octets: 251
        TX time: 2704
> HCI Event: Command Complete (0x0e) plen 4                 #26 [hci1] 0.837245
      LE Write Suggested Default Data Length (0x08|0x0024) ncmd 1
        Status: Success (0x00)
< HCI Command: LE Read Resolving Li.. (0x08|0x002a) plen 0  #27 [hci1] 0.856803
> HCI Event: Command Complete (0x0e) plen 5                 #28 [hci1] 0.857258
      LE Read Resolving List Size (0x08|0x002a) ncmd 1
        Status: Success (0x00)
        Size: 8
< HCI Command: LE Set Event Mask (0x08|0x0001) plen 8       #29 [hci1] 0.876788
        Mask: 0x000002023f87fa5e
          LE Advertising Report
          LE Connection Update Complete
          LE Read Remote Used Features Complete
          LE Long Term Key Request
          LE Data Length Change
          LE Enhanced Connection Complete
          LE PHY Update Complete
          LE Extended Advertising Report
          LE Periodic Advertising Sync Established
          LE Periodic Advertising Report
          LE Periodic Advertising Sync Lost
          LE Extended Scan Timeout
          LE Extended Advertising Set Terminated
          LE Scan Request Received
          LE Periodic Advertising Sync Transfer Rvc
          LE CIS Established
          LE CIS Request
          LE Create BIG Complete
          LE Terminate BIG Complete
          LE BIG Sync Estabilished Complete
          LE BIG Sync Lost
          LE BIG Info Advertising Report
          Unknown mask (0x0000020000000000)
> HCI Event: Command Complete (0x0e) plen 4                 #30 [hci1] 0.877271
      LE Set Event Mask (0x08|0x0001) ncmd 1
        Status: Success (0x00)
< HCI Command: Set Event Mask (0x03|0x0001) plen 8          #31 [hci1] 0.896818
        Mask: 0x2000800002008890
          Disconnection Complete
          Encryption Change
          Read Remote Version Information Complete
          Hardware Error
          Data Buffer Overflow
          Encryption Key Refresh Complete
          LE Meta
> HCI Event: Command Complete (0x0e) plen 4                 #32 [hci1] 0.897279
      Set Event Mask (0x03|0x0001) ncmd 1
        Status: Success (0x00)
< HCI Command: Read BD ADDR (0x04|0x0009) plen 0            #33 [hci1] 0.916847
> HCI Event: Command Complete (0x0e) plen 10                #34 [hci1] 0.917302
      Read BD ADDR (0x04|0x0009) ncmd 1
        Status: Success (0x00)
        Address: 00:00:00:00:00:00 (OUI 00-00-00)
< HCI Command: LE Set Random Address (0x08|0x0005) plen 6   #35 [hci1] 0.936835
        Address: D5:B6:CC:31:DB:3B (Static)
> HCI Event: Command Complete (0x0e) plen 4                 #36 [hci1] 0.937290
      LE Set Random Address (0x08|0x0005) ncmd 1
        Status: Success (0x00)
< HCI Command: LE Extended Create... (0x08|0x0043) plen 26  #37 [hci1] 3.707273
        Filter policy: Accept list is not used (0x00)
        Own address type: Random (0x01)
        Peer address type: Public (0x00)
        Peer address: DF:A9:FF:F6:B1:1A (OUI DF-A9-FF)
        Initiating PHYs: 0x01
        Entry 0: LE 1M
          Scan interval: 60.000 msec (0x0060)
          Scan window: 60.000 msec (0x0060)
          Min connection interval: 50.00 msec (0x0028)
          Max connection interval: 70.00 msec (0x0038)
          Connection latency: 0 (0x0000)
          Supervision timeout: 4000 msec (0x0190)
          Min connection length: 0.000 msec (0x0000)
          Max connection length: 0.000 msec (0x0000)
> HCI Event: Command Status (0x0f) plen 4                   #38 [hci1] 3.708183
      LE Extended Create Connection (0x08|0x0043) ncmd 1
        Status: Success (0x00)
> HCI Event: LE Meta Event (0x3e) plen 31                   #39 [hci1] 3.741820
      LE Enhanced Connection Complete (0x0a)
        Status: Success (0x00)
        Handle: 2646
        Role: Central (0x00)
        Peer address type: Public (0x00)
        Peer address: DF:A9:FF:F6:B1:1A (OUI DF-A9-FF)
        Local resolvable private address: 00:00:00:00:00:00 (Non-Resolvable)
        Peer resolvable private address: 00:00:00:00:00:00 (Non-Resolvable)
        Connection interval: 70.00 msec (0x0038)
        Connection latency: 0 (0x0000)
        Supervision timeout: 4000 msec (0x0190)
        Central clock accuracy: 0x00
< HCI Command: LE Read Remote Used... (0x08|0x0016) plen 2  #40 [hci1] 3.758006
        Handle: 2646 Address: DF:A9:FF:F6:B1:1A (OUI DF-A9-FF)
< ACL Data TX: Handle 2646 flags 0x00 dlen 7                #41 [hci1] 3.758030
      ATT: Exchange MTU Request (0x02) len 2
        Client RX MTU: 251
> HCI Event: Command Status (0x0f) plen 4                   #42 [hci1] 3.758652
      LE Read Remote Used Features (0x08|0x0016) ncmd 1
        Status: Success (0x00)
< HCI Command: LE Set PHY (0x08|0x0032) plen 7              #43 [hci1] 3.777194
        Handle: 2646 Address: DF:A9:FF:F6:B1:1A (OUI DF-A9-FF)
        All PHYs preference: 0x00
        TX PHYs preference: 0x02
          LE 2M
        RX PHYs preference: 0x02
          LE 2M
        PHY options preference: Reserved (0x0000)
> HCI Event: Command Status (0x0f) plen 4                   #44 [hci1] 3.777749
      LE Set PHY (0x08|0x0032) ncmd 1
        Status: Success (0x00)
> HCI Event: Number of Completed Packets (0x13) plen 5      #45 [hci1] 3.814026
        Num handles: 1
        Handle: 2646 Address: DF:A9:FF:F6:B1:1A (OUI DF-A9-FF)
        Count: 1
        #41: len 7 (1 Kb/s)
        Latency: 55 msec (55-55 msec ~55 msec)
> HCI Event: LE Meta Event (0x3e) plen 12                   #46 [hci1] 3.954008
      LE Read Remote Used Features (0x04)
        Status: Success (0x00)
        Handle: 2646 Address: DF:A9:FF:F6:B1:1A (OUI DF-A9-FF)
        Features: 0x2d 0x49 0x00 0xf7 0x67 0xd9 0x00 0x80
          LE Encryption
          Extended Reject Indication
          Peripheral-initiated Features Exchange
          LE Data Packet Length Extension
          LE 2M PHY
          LE Coded PHY
          Channel Selection Algorithm #2
          Periodic Advertising Sync Transfer - Sender
          Periodic Advertising Sync Transfer - Recipient
          Sleep Clock Accuracy Updates
          Connected Isochronous Stream - Central
          Connected Isochronous Stream - Peripheral
          Isochronous Broadcaster
          Synchronized Receiver
          Connected Isochronous Stream (Host Support)
          LE Power Control Request
          LE Power Control Request
          Connection Subrating
          Connection Subrating (Host Support)
          Unknown features (0x8000d90000000000)
> HCI Event: LE Meta Event (0x3e) plen 6                    #47 [hci1] 4.653457
      LE PHY Update Complete (0x0c)
        Status: Success (0x00)
        Handle: 2646 Address: DF:A9:FF:F6:B1:1A (OUI DF-A9-FF)
        TX PHY: LE 2M (0x02)
        RX PHY: LE 2M (0x02)
> ACL Data RX: Handle 2646 flags 0x02 dlen 6                #48 [hci1] 4.793896
      SMP: Security Request (0x0b) len 1
        Authentication requirement: Bonding, No MITM, SC, No Keypresses (0x09)
> ACL Data RX: Handle 2646 flags 0x02 dlen 7                #49 [hci1] 4.794344
      ATT: Exchange MTU Response (0x03) len 2
        Server RX MTU: 64
< HCI Command: Host Number of Compl.. (0x03|0x0035) plen 5  #50 [hci1] 4.797368
        Num handles: 1
        Handle: 2646 Address: DF:A9:FF:F6:B1:1A (OUI DF-A9-FF)
        Count: 1
< ACL Data TX: Handle 2646 flags 0x00 dlen 11               #51 [hci1] 4.797549
      SMP: Pairing Request (0x01) len 6
        IO capability: NoInputNoOutput (0x03)
        OOB data: Authentication data not present (0x00)
        Authentication requirement: Bonding, No MITM, SC, No Keypresses (0x09)
        Max encryption key size: 16
        Initiator key distribution: EncKey (0x01)
        Responder key distribution: EncKey IdKey (0x03)
< HCI Command: Host Number of Compl.. (0x03|0x0035) plen 5  #52 [hci1] 4.797997
        Num handles: 1
        Handle: 2646 Address: DF:A9:FF:F6:B1:1A (OUI DF-A9-FF)
        Count: 1
> HCI Event: Number of Completed Packets (0x13) plen 5      #53 [hci1] 4.863913
        Num handles: 1
        Handle: 2646 Address: DF:A9:FF:F6:B1:1A (OUI DF-A9-FF)
        Count: 1
        #51: len 11 (1 Kb/s)
        Latency: 66 msec (55-66 msec ~61 msec)
> ACL Data RX: Handle 2646 flags 0x02 dlen 11               #54 [hci1] 4.933984
      SMP: Pairing Response (0x02) len 6
        IO capability: KeyboardDisplay (0x04)
        OOB data: Authentication data not present (0x00)
        Authentication requirement: Bonding, No MITM, SC, No Keypresses (0x09)
        Max encryption key size: 16
        Initiator key distribution: EncKey (0x01)
        Responder key distribution: EncKey IdKey (0x03)
< HCI Command: Host Number of Compl.. (0x03|0x0035) plen 5  #55 [hci1] 4.936850
        Num handles: 1
        Handle: 2646 Address: DF:A9:FF:F6:B1:1A (OUI DF-A9-FF)
        Count: 1
< ACL Data TX: Handle 2646 flags 0x00 dlen 27               #56 [hci1] 4.936896
< ACL Data TX: Handle 2646 flags 0x01 dlen 27               #57 [hci1] 4.936900
< ACL Data TX: Handle 2646 flags 0x01 dlen 15               #58 [hci1] 4.936901
      SMP: Pairing Public Key (0x0c) len 64
        X: 98308440221e2d910f0e54b71e7ec652857aa9b5a0dc65028824cc19db1226e9
        Y: 67a4816bcb62efb21701e31fdb27561a6217575fb007a8bbdabe7e28b6f68482
> HCI Event: Number of Completed Packets (0x13) plen 5      #59 [hci1] 5.003850
        Num handles: 1
        Handle: 2646 Address: DF:A9:FF:F6:B1:1A (OUI DF-A9-FF)
        Count: 1
        #56: len 27 (3 Kb/s)
        Latency: 66 msec (55-66 msec ~64 msec)
> HCI Event: Number of Completed Packets (0x13) plen 5      #60 [hci1] 5.004300
        Num handles: 1
        Handle: 2646 Address: DF:A9:FF:F6:B1:1A (OUI DF-A9-FF)
        Count: 1
        #57: len 27 (3 Kb/s)
        Latency: 67 msec (55-67 msec ~65 msec)
> HCI Event: Number of Completed Packets (0x13) plen 5      #61 [hci1] 5.004866
        Num handles: 1
        Handle: 2646 Address: DF:A9:FF:F6:B1:1A (OUI DF-A9-FF)
        Count: 1
        #58: len 15 (1 Kb/s)
        Latency: 67 msec (55-67 msec ~66 msec)
> ACL Data RX: Handle 2646 flags 0x02 dlen 27               #62 [hci1] 5.074122
> ACL Data RX: Handle 2646 flags 0x01 dlen 27               #63 [hci1] 5.074628
> ACL Data RX: Handle 2646 flags 0x01 dlen 15               #64 [hci1] 5.074948
      SMP: Pairing Public Key (0x0c) len 64
        X: 01513d632075dc42feab7f6d3efa36b93019ae35306267e8978a9bd4a2820b67
        Y: 8adced267c47798cc490adce79f827671f1feb16127c9fc1e0d18479a6dc6d08
< HCI Command: Host Number of Compl.. (0x03|0x0035) plen 5  #65 [hci1] 5.077301
        Num handles: 1
        Handle: 2646 Address: DF:A9:FF:F6:B1:1A (OUI DF-A9-FF)
        Count: 1
< HCI Command: Host Number of Compl.. (0x03|0x0035) plen 5  #66 [hci1] 5.077479
        Num handles: 1
        Handle: 2646 Address: DF:A9:FF:F6:B1:1A (OUI DF-A9-FF)
        Count: 1
< HCI Command: Host Number of Compl.. (0x03|0x0035) plen 5  #67 [hci1] 5.077567
        Num handles: 1
        Handle: 2646 Address: DF:A9:FF:F6:B1:1A (OUI DF-A9-FF)
        Count: 1
> ACL Data RX: Handle 2646 flags 0x02 dlen 21               #68 [hci1] 5.144028
      SMP: Pairing Confirm (0x03) len 16
        Confim value: 6db2bada81ccde00f6300986024fc707
< HCI Command: Host Number of Compl.. (0x03|0x0035) plen 5  #69 [hci1] 5.157043
        Num handles: 1
        Handle: 2646 Address: DF:A9:FF:F6:B1:1A (OUI DF-A9-FF)
        Count: 1
< ACL Data TX: Handle 2646 flags 0x00 dlen 21               #70 [hci1] 5.157137
      SMP: Pairing Random (0x04) len 16
        Random value: 8e6108f966a694cbe26df70bb96773e6
> HCI Event: Number of Completed Packets (0x13) plen 5      #71 [hci1] 5.213904
        Num handles: 1
        Handle: 2646 Address: DF:A9:FF:F6:B1:1A (OUI DF-A9-FF)
        Count: 1
        #70: len 21 (3 Kb/s)
        Latency: 56 msec (55-67 msec ~61 msec)
> ACL Data RX: Handle 2646 flags 0x02 dlen 21               #72 [hci1] 5.284005
      SMP: Pairing Random (0x04) len 16
        Random value: 1601603b4f11d7b90000000000000000
< HCI Command: Host Number of Compl.. (0x03|0x0035) plen 5  #73 [hci1] 5.298018
        Num handles: 1
        Handle: 2646 Address: DF:A9:FF:F6:B1:1A (OUI DF-A9-FF)
        Count: 1
< ACL Data TX: Handle 2646 flags 0x00 dlen 21               #74 [hci1] 5.298157
      SMP: Pairing DHKey Check (0x0d) len 16
        E: fbfddaa1ec6c3c2010a2cfcc8ad682ec
> HCI Event: Number of Completed Packets (0x13) plen 5      #75 [hci1] 5.353818
        Num handles: 1
        Handle: 2646 Address: DF:A9:FF:F6:B1:1A (OUI DF-A9-FF)
        Count: 1
        #74: len 21 (3 Kb/s)
        Latency: 55 msec (55-67 msec ~58 msec)
> ACL Data RX: Handle 2646 flags 0x02 dlen 21               #76 [hci1] 5.634076
      SMP: Pairing DHKey Check (0x0d) len 16
        E: ee670c3de2ebabf4ed55b31a1f9d1af1
< HCI Command: LE Start Encryption (0x08|0x0019) plen 28    #77 [hci1] 5.637640
        Handle: 2646 Address: DF:A9:FF:F6:B1:1A (OUI DF-A9-FF)
        Random number: 0x0000000000000000
        Encrypted diversifier: 0x0000
        Long term key: aa34be49809e540bcc65ba33c7587853
> HCI Event: Command Status (0x0f) plen 4                   #78 [hci1] 5.638544
      LE Start Encryption (0x08|0x0019) ncmd 1
        Status: Success (0x00)
< HCI Command: Host Number of Compl.. (0x03|0x0035) plen 5  #79 [hci1] 5.657128
        Num handles: 1
        Handle: 2646 Address: DF:A9:FF:F6:B1:1A (OUI DF-A9-FF)
        Count: 1
> HCI Event: Encryption Change (0x08) plen 4                #80 [hci1] 6.123756
        Status: Success (0x00)
        Handle: 2646 Address: DF:A9:FF:F6:B1:1A (OUI DF-A9-FF)
        Encryption: Enabled with AES-CCM (0x01)
> ACL Data RX: Handle 2646 flags 0x02 dlen 21               #81 [hci1] 6.194069
      SMP: Identity Information (0x08) len 16
        Identity resolving key: 2e3191286fe65094705003e4854ca676
< HCI Command: Host Number of Compl.. (0x03|0x0035) plen 5  #82 [hci1] 6.197371
        Num handles: 1
        Handle: 2646 Address: DF:A9:FF:F6:B1:1A (OUI DF-A9-FF)
        Count: 1
> ACL Data RX: Handle 2646 flags 0x02 dlen 12               #83 [hci1] 6.333986
      SMP: Identity Address Information (0x09) len 7
        Address: DF:A9:FF:F6:B1:1A (OUI DF-A9-FF)
< HCI Command: LE Add Device To Re.. (0x08|0x0027) plen 39  #84 [hci1] 6.337575
        Address type: Public (0x00)
        Address: DF:A9:FF:F6:B1:1A (OUI DF-A9-FF)
        Peer identity resolving key: 2e3191286fe65094705003e4854ca676
        Local identity resolving key: 00000000000000000000000000000000
> HCI Event: Command Complete (0x0e) plen 4                 #85 [hci1] 6.338497
      LE Add Device To Resolving List (0x08|0x0027) ncmd 1
        Status: Success (0x00)
< HCI Command: LE Set Privacy Mode (0x08|0x004e) plen 8     #86 [hci1] 6.357293
        Peer Identity address type: Public (0x00)
        Peer Identity address: DF:A9:FF:F6:B1:1A (OUI DF-A9-FF)
        Privacy Mode: Use Device Privacy (0x01)
> HCI Event: Command Complete (0x0e) plen 4                 #87 [hci1] 6.357813
      LE Set Privacy Mode (0x08|0x004e) ncmd 1
        Status: Success (0x00)
< HCI Command: LE Set Address Resol.. (0x08|0x002d) plen 1  #88 [hci1] 6.377012
        Address resolution: Enabled (0x01)
> HCI Event: Command Complete (0x0e) plen 4                 #89 [hci1] 6.377400
      LE Set Address Resolution Enable (0x08|0x002d) ncmd 1
        Status: Success (0x00)
< HCI Command: Host Number of Compl.. (0x03|0x0035) plen 5  #90 [hci1] 6.396884
        Num handles: 1
        Handle: 2646 Address: DF:A9:FF:F6:B1:1A (OUI DF-A9-FF)
        Count: 1
< ACL Data TX: Handle 2646 flags 0x00 dlen 11               #91 [hci1] 7.237834
      ATT: Read By Type Request (0x08) len 6
        Handle range: 0x0001-0xffff
        Attribute type: Characteristic (0x2803)
> HCI Event: Number of Completed Packets (0x13) plen 5      #92 [hci1] 7.243840
        Num handles: 1
        Handle: 2646 Address: DF:A9:FF:F6:B1:1A (OUI DF-A9-FF)
        Count: 1
        #91: len 11 (14 Kb/s)
        Latency: 6 msec (6-67 msec ~32 msec)
> ACL Data RX: Handle 2646 flags 0x02 dlen 27               #93 [hci1] 7.314072
> ACL Data RX: Handle 2646 flags 0x01 dlen 27               #94 [hci1] 7.314571
> ACL Data RX: Handle 2646 flags 0x01 dlen 8                #95 [hci1] 7.314848
      ATT: Read By Type Response (0x09) len 57
        Attribute data length: 7
        Attribute data list: 8 entries
        Handle: 0x0002
        Value: 0a0300002a
            Properties: 0x0a
              Read (0x02)
              Write (0x08)
            Value Handle: 0x0003
            Value UUID: Device Name (0x2a00)
        Handle: 0x0004
        Value: 0a0500012a
            Properties: 0x0a
              Read (0x02)
              Write (0x08)
            Value Handle: 0x0005
            Value UUID: Appearance (0x2a01)
        Handle: 0x0006
        Value: 4e07000945
            Properties: 0x4e
              Read (0x02)
              Write Without Response (0x04)
              Write (0x08)
              Authorize (0x40)
              Extended Properties (0x80)
            Value Handle: 0x0007
            Value UUID: Unknown (0x4509)
        Handle: 0x0008
        Value: 020900042a
            Properties: 0x02
              Read (0x02)
            Value Handle: 0x0009
            Value UUID: Peripheral Preferred Connection Parameters (0x2a04)
        Handle: 0x000a
        Value: 120b00192a
            Properties: 0x12
              Read (0x02)
              Notify (0x10)
            Value Handle: 0x000b
            Value UUID: Battery Level (0x2a19)
        Handle: 0x000e
        Value: 020f00a62a
            Properties: 0x02
              Read (0x02)
            Value Handle: 0x000f
            Value UUID: Central Address Resolution (0x2aa6)
        Handle: 0x0041
        Value: 204200052a
            Properties: 0x20
              Indicate (0x20)
            Value Handle: 0x0042
            Value UUID: Service Changed (0x2a05)
        Handle: 0x0044
        Value: 0a4500292b
            Properties: 0x0a
              Read (0x02)
              Write (0x08)
            Value Handle: 0x0045
            Value UUID: Client Supported Features (0x2b29)
< HCI Command: Host Number of Compl.. (0x03|0x0035) plen 5  #96 [hci1] 7.317698
        Num handles: 1
        Handle: 2646 Address: DF:A9:FF:F6:B1:1A (OUI DF-A9-FF)
        Count: 1
< HCI Command: Host Number of Compl.. (0x03|0x0035) plen 5  #97 [hci1] 7.317984
        Num handles: 1
        Handle: 2646 Address: DF:A9:FF:F6:B1:1A (OUI DF-A9-FF)
        Count: 1
< HCI Command: Host Number of Compl.. (0x03|0x0035) plen 5  #98 [hci1] 7.318097
        Num handles: 1
        Handle: 2646 Address: DF:A9:FF:F6:B1:1A (OUI DF-A9-FF)
        Count: 1
< ACL Data TX: Handle 2646 flags 0x00 dlen 11               #99 [hci1] 7.318167
      ATT: Read By Type Request (0x08) len 6
        Handle range: 0x0045-0xffff
        Attribute type: Characteristic (0x2803)
> HCI Event: Number of Completed Packets (0x13) plen 5     #100 [hci1] 7.383826
        Num handles: 1
        Handle: 2646 Address: DF:A9:FF:F6:B1:1A (OUI DF-A9-FF)
        Count: 1
        #99: len 11 (1 Kb/s)
        Latency: 65 msec (6-67 msec ~49 msec)
> ACL Data RX: Handle 2646 flags 0x02 dlen 27              #101 [hci1] 7.454032
> ACL Data RX: Handle 2646 flags 0x01 dlen 27              #102 [hci1] 7.454528
> ACL Data RX: Handle 2646 flags 0x01 dlen 8               #103 [hci1] 7.454864
      ATT: Read By Type Response (0x09) len 57
        Attribute data length: 7
        Attribute data list: 8 entries
        Handle: 0x0046
        Value: 0247003a2b
            Properties: 0x02
              Read (0x02)
            Value Handle: 0x0047
            Value UUID: Server Supported Features (0x2b3a)
        Handle: 0x0081
        Value: 0282000945
            Properties: 0x02
              Read (0x02)
            Value Handle: 0x0082
            Value UUID: Unknown (0x4509)
        Handle: 0x0083
        Value: 028400232a
            Properties: 0x02
              Read (0x02)
            Value Handle: 0x0084
            Value UUID: System ID (0x2a23)
        Handle: 0x0085
        Value: 028600242a
            Properties: 0x02
              Read (0x02)
            Value Handle: 0x0086
            Value UUID: Model Number String (0x2a24)
        Handle: 0x0087
        Value: 028800252a
            Properties: 0x02
              Read (0x02)
            Value Handle: 0x0088
            Value UUID: Serial Number String (0x2a25)
        Handle: 0x0089
        Value: 028a00262a
            Properties: 0x02
              Read (0x02)
            Value Handle: 0x008a
            Value UUID: Firmware Revision String (0x2a26)
        Handle: 0x008b
        Value: 028c00272a
            Properties: 0x02
              Read (0x02)
            Value Handle: 0x008c
            Value UUID: Hardware Revision String (0x2a27)
        Handle: 0x008d
        Value: 028e00282a
            Properties: 0x02
              Read (0x02)
            Value Handle: 0x008e
            Value UUID: Software Revision String (0x2a28)
< HCI Command: Host Number of Comp.. (0x03|0x0035) plen 5  #104 [hci1] 7.457713
        Num handles: 1
        Handle: 2646 Address: DF:A9:FF:F6:B1:1A (OUI DF-A9-FF)
        Count: 1
< HCI Command: Host Number of Comp.. (0x03|0x0035) plen 5  #105 [hci1] 7.457976
        Num handles: 1
        Handle: 2646 Address: DF:A9:FF:F6:B1:1A (OUI DF-A9-FF)
        Count: 1
< HCI Command: Host Number of Comp.. (0x03|0x0035) plen 5  #106 [hci1] 7.458118
        Num handles: 1
        Handle: 2646 Address: DF:A9:FF:F6:B1:1A (OUI DF-A9-FF)
        Count: 1
< ACL Data TX: Handle 2646 flags 0x00 dlen 11              #107 [hci1] 7.458227
      ATT: Read By Type Request (0x08) len 6
        Handle range: 0x008e-0xffff
        Attribute type: Characteristic (0x2803)
> HCI Event: Number of Completed Packets (0x13) plen 5     #108 [hci1] 7.523855
        Num handles: 1
        Handle: 2646 Address: DF:A9:FF:F6:B1:1A (OUI DF-A9-FF)
        Count: 1
        #107: len 11 (1 Kb/s)
        Latency: 65 msec (6-67 msec ~57 msec)
> ACL Data RX: Handle 2646 flags 0x02 dlen 27              #109 [hci1] 7.594037
> ACL Data RX: Handle 2646 flags 0x01 dlen 27              #110 [hci1] 7.594577
> ACL Data RX: Handle 2646 flags 0x01 dlen 8               #111 [hci1] 7.594870
      ATT: Read By Type Response (0x09) len 57
        Attribute data length: 7
        Attribute data list: 8 entries
        Handle: 0x008f
        Value: 029000292a
            Properties: 0x02
              Read (0x02)
            Value Handle: 0x0090
            Value UUID: Manufacturer Name String (0x2a29)
        Handle: 0x0091
        Value: 0292002a2a
            Properties: 0x02
              Read (0x02)
            Value Handle: 0x0092
            Value UUID: IEEE 11073-20601 Regulatory Cert. Data List (0x2a2a)
        Handle: 0x0093
        Value: 029400502a
            Properties: 0x02
              Read (0x02)
            Value Handle: 0x0094
            Value UUID: PnP ID (0x2a50)
        Handle: 0x0095
        Value: 0296002234
            Properties: 0x02
              Read (0x02)
            Value Handle: 0x0096
            Value UUID: Unknown (0x3422)
        Handle: 0x0098
        Value: 029900ff2b
            Properties: 0x02
              Read (0x02)
            Value Handle: 0x0099
            Value UUID: Unknown (0x2bff)
        Handle: 0x00d1
        Value: 38d200db2b
            Properties: 0x38
              Write (0x08)
              Notify (0x10)
              Indicate (0x20)
            Value Handle: 0x00d2
            Value UUID: Hearing Aid Preset Control Point (0x2bdb)
        Handle: 0x00d4
        Value: 12d500da2b
            Properties: 0x12
              Read (0x02)
              Notify (0x10)
            Value Handle: 0x00d5
            Value UUID: Hearing Aid Features (0x2bda)
        Handle: 0x00d7
        Value: 12d800dc2b
            Properties: 0x12
              Read (0x02)
              Notify (0x10)
            Value Handle: 0x00d8
            Value UUID: Active Preset Index (0x2bdc)
< HCI Command: Host Number of Comp.. (0x03|0x0035) plen 5  #112 [hci1] 7.597696
        Num handles: 1
        Handle: 2646 Address: DF:A9:FF:F6:B1:1A (OUI DF-A9-FF)
        Count: 1
< HCI Command: Host Number of Comp.. (0x03|0x0035) plen 5  #113 [hci1] 7.597948
        Num handles: 1
        Handle: 2646 Address: DF:A9:FF:F6:B1:1A (OUI DF-A9-FF)
        Count: 1
< HCI Command: Host Number of Comp.. (0x03|0x0035) plen 5  #114 [hci1] 7.598078
        Num handles: 1
        Handle: 2646 Address: DF:A9:FF:F6:B1:1A (OUI DF-A9-FF)
        Count: 1
< ACL Data TX: Handle 2646 flags 0x00 dlen 11              #115 [hci1] 7.598266
      ATT: Read By Type Request (0x08) len 6
        Handle range: 0x00d8-0xffff
        Attribute type: Characteristic (0x2803)
> HCI Event: Number of Completed Packets (0x13) plen 5     #116 [hci1] 7.663779
        Num handles: 1
        Handle: 2646 Address: DF:A9:FF:F6:B1:1A (OUI DF-A9-FF)
        Count: 1
        #115: len 11 (1 Kb/s)
        Latency: 65 msec (6-67 msec ~61 msec)
> ACL Data RX: Handle 2646 flags 0x02 dlen 27              #117 [hci1] 7.734169
> ACL Data RX: Handle 2646 flags 0x01 dlen 27              #118 [hci1] 7.734557
> ACL Data RX: Handle 2646 flags 0x01 dlen 8               #119 [hci1] 7.734932
      ATT: Read By Type Response (0x09) len 57
        Attribute data length: 7
        Attribute data list: 8 entries
        Handle: 0x0111
        Value: 121201c92b
            Properties: 0x12
              Read (0x02)
              Notify (0x10)
            Value Handle: 0x0112
            Value UUID: Sink PAC (0x2bc9)
        Handle: 0x0114
        Value: 1a1501ca2b
            Properties: 0x1a
              Read (0x02)
              Write (0x08)
              Notify (0x10)
            Value Handle: 0x0115
            Value UUID: Sink Audio Locations (0x2bca)
        Handle: 0x011d
        Value: 121e01cd2b
            Properties: 0x12
              Read (0x02)
              Notify (0x10)
            Value Handle: 0x011e
            Value UUID: Available Audio Contexts (0x2bcd)
        Handle: 0x0120
        Value: 122101ce2b
            Properties: 0x12
              Read (0x02)
              Notify (0x10)
            Value Handle: 0x0121
            Value UUID: Supported Audio Contexts (0x2bce)
        Handle: 0x0161
        Value: 126201c42b
            Properties: 0x12
              Read (0x02)
              Notify (0x10)
            Value Handle: 0x0162
            Value UUID: Sink ASE (0x2bc4)
        Handle: 0x016d
        Value: 1c6e01c62b
            Properties: 0x1c
              Write Without Response (0x04)
              Write (0x08)
              Notify (0x10)
            Value Handle: 0x016e
            Value UUID: ASE Control Point (0x2bc6)
        Handle: 0x01c1
        Value: 02c201842b
            Properties: 0x02
              Read (0x02)
            Value Handle: 0x01c2
            Value UUID: Set Identity Resolving Key (0x2b84)
        Handle: 0x01c3
        Value: 1ac401862b
            Properties: 0x1a
              Read (0x02)
              Write (0x08)
              Notify (0x10)
            Value Handle: 0x01c4
            Value UUID: Set Member Lock (0x2b86)
< HCI Command: Host Number of Comp.. (0x03|0x0035) plen 5  #120 [hci1] 7.737486
        Num handles: 1
        Handle: 2646 Address: DF:A9:FF:F6:B1:1A (OUI DF-A9-FF)
        Count: 1
< HCI Command: Host Number of Comp.. (0x03|0x0035) plen 5  #121 [hci1] 7.737743
        Num handles: 1
        Handle: 2646 Address: DF:A9:FF:F6:B1:1A (OUI DF-A9-FF)
        Count: 1
< HCI Command: Host Number of Comp.. (0x03|0x0035) plen 5  #122 [hci1] 7.737847
        Num handles: 1
        Handle: 2646 Address: DF:A9:FF:F6:B1:1A (OUI DF-A9-FF)
        Count: 1
< ACL Data TX: Handle 2646 flags 0x00 dlen 7               #123 [hci1] 7.737955
      ATT: Read Request (0x0a) len 2
        Handle: 0x0112
> HCI Event: Number of Completed Packets (0x13) plen 5     #124 [hci1] 7.803890
        Num handles: 1
        Handle: 2646 Address: DF:A9:FF:F6:B1:1A (OUI DF-A9-FF)
        Count: 1
        #123: len 7 (0 Kb/s)
        Latency: 65 msec (6-67 msec ~63 msec)
> ACL Data RX: Handle 2646 flags 0x02 dlen 27              #125 [hci1] 7.874186
> ACL Data RX: Handle 2646 flags 0x01 dlen 6               #126 [hci1] 7.874408
      ATT: Read Response (0x0b) len 28
< HCI Command: Host Number of Comp.. (0x03|0x0035) plen 5  #127 [hci1] 7.877702
        Num handles: 1
        Handle: 2646 Address: DF:A9:FF:F6:B1:1A (OUI DF-A9-FF)
        Count: 1
< HCI Command: Host Number of Comp.. (0x03|0x0035) plen 5  #128 [hci1] 7.879708
        Num handles: 1
        Handle: 2646 Address: DF:A9:FF:F6:B1:1A (OUI DF-A9-FF)
        Count: 1
< ACL Data TX: Handle 2646 flags 0x00 dlen 11              #129 [hci1] 7.879760
      ATT: Read By Type Request (0x08) len 6
        Handle range: 0x0001-0xffff
        Attribute type: Characteristic (0x2803)
> HCI Event: Number of Completed Packets (0x13) plen 5     #130 [hci1] 7.943831
        Num handles: 1
        Handle: 2646 Address: DF:A9:FF:F6:B1:1A (OUI DF-A9-FF)
        Count: 1
        #129: len 11 (1 Kb/s)
        Latency: 64 msec (6-67 msec ~63 msec)
> ACL Data RX: Handle 2646 flags 0x02 dlen 27              #131 [hci1] 8.014084
> ACL Data RX: Handle 2646 flags 0x01 dlen 27              #132 [hci1] 8.014545
> ACL Data RX: Handle 2646 flags 0x01 dlen 8               #133 [hci1] 8.014854
      ATT: Read By Type Response (0x09) len 57
        Attribute data length: 7
        Attribute data list: 8 entries
        Handle: 0x0002
        Value: 0a0300002a
            Properties: 0x0a
              Read (0x02)
              Write (0x08)
            Value Handle: 0x0003
            Value UUID: Device Name (0x2a00)
        Handle: 0x0004
        Value: 0a0500012a
            Properties: 0x0a
              Read (0x02)
              Write (0x08)
            Value Handle: 0x0005
            Value UUID: Appearance (0x2a01)
        Handle: 0x0006
        Value: 4e07000945
            Properties: 0x4e
              Read (0x02)
              Write Without Response (0x04)
              Write (0x08)
              Authorize (0x40)
              Extended Properties (0x80)
            Value Handle: 0x0007
            Value UUID: Unknown (0x4509)
        Handle: 0x0008
        Value: 020900042a
            Properties: 0x02
              Read (0x02)
            Value Handle: 0x0009
            Value UUID: Peripheral Preferred Connection Parameters (0x2a04)
        Handle: 0x000a
        Value: 120b00192a
            Properties: 0x12
              Read (0x02)
              Notify (0x10)
            Value Handle: 0x000b
            Value UUID: Battery Level (0x2a19)
        Handle: 0x000e
        Value: 020f00a62a
            Properties: 0x02
              Read (0x02)
            Value Handle: 0x000f
            Value UUID: Central Address Resolution (0x2aa6)
        Handle: 0x0041
        Value: 204200052a
            Properties: 0x20
              Indicate (0x20)
            Value Handle: 0x0042
            Value UUID: Service Changed (0x2a05)
        Handle: 0x0044
        Value: 0a4500292b
            Properties: 0x0a
              Read (0x02)
              Write (0x08)
            Value Handle: 0x0045
            Value UUID: Client Supported Features (0x2b29)
< HCI Command: Host Number of Comp.. (0x03|0x0035) plen 5  #134 [hci1] 8.017578
        Num handles: 1
        Handle: 2646 Address: DF:A9:FF:F6:B1:1A (OUI DF-A9-FF)
        Count: 1
< HCI Command: Host Number of Comp.. (0x03|0x0035) plen 5  #135 [hci1] 8.017875
        Num handles: 1
        Handle: 2646 Address: DF:A9:FF:F6:B1:1A (OUI DF-A9-FF)
        Count: 1
< HCI Command: Host Number of Comp.. (0x03|0x0035) plen 5  #136 [hci1] 8.017951
        Num handles: 1
        Handle: 2646 Address: DF:A9:FF:F6:B1:1A (OUI DF-A9-FF)
        Count: 1
< ACL Data TX: Handle 2646 flags 0x00 dlen 11              #137 [hci1] 8.018163
      ATT: Read By Type Request (0x08) len 6
        Handle range: 0x0045-0xffff
        Attribute type: Characteristic (0x2803)
> HCI Event: Number of Completed Packets (0x13) plen 5     #138 [hci1] 8.083850
        Num handles: 1
        Handle: 2646 Address: DF:A9:FF:F6:B1:1A (OUI DF-A9-FF)
        Count: 1
        #137: len 11 (1 Kb/s)
        Latency: 65 msec (6-67 msec ~64 msec)
> ACL Data RX: Handle 2646 flags 0x02 dlen 27              #139 [hci1] 8.154123
> ACL Data RX: Handle 2646 flags 0x01 dlen 27              #140 [hci1] 8.154604
> ACL Data RX: Handle 2646 flags 0x01 dlen 8               #141 [hci1] 8.154873
      ATT: Read By Type Response (0x09) len 57
        Attribute data length: 7
        Attribute data list: 8 entries
        Handle: 0x0046
        Value: 0247003a2b
            Properties: 0x02
              Read (0x02)
            Value Handle: 0x0047
            Value UUID: Server Supported Features (0x2b3a)
        Handle: 0x0081
        Value: 0282000945
            Properties: 0x02
              Read (0x02)
            Value Handle: 0x0082
            Value UUID: Unknown (0x4509)
        Handle: 0x0083
        Value: 028400232a
            Properties: 0x02
              Read (0x02)
            Value Handle: 0x0084
            Value UUID: System ID (0x2a23)
        Handle: 0x0085
        Value: 028600242a
            Properties: 0x02
              Read (0x02)
            Value Handle: 0x0086
            Value UUID: Model Number String (0x2a24)
        Handle: 0x0087
        Value: 028800252a
            Properties: 0x02
              Read (0x02)
            Value Handle: 0x0088
            Value UUID: Serial Number String (0x2a25)
        Handle: 0x0089
        Value: 028a00262a
            Properties: 0x02
              Read (0x02)
            Value Handle: 0x008a
            Value UUID: Firmware Revision String (0x2a26)
        Handle: 0x008b
        Value: 028c00272a
            Properties: 0x02
              Read (0x02)
            Value Handle: 0x008c
            Value UUID: Hardware Revision String (0x2a27)
        Handle: 0x008d
        Value: 028e00282a
            Properties: 0x02
              Read (0x02)
            Value Handle: 0x008e
            Value UUID: Software Revision String (0x2a28)
< HCI Command: Host Number of Comp.. (0x03|0x0035) plen 5  #142 [hci1] 8.157542
        Num handles: 1
        Handle: 2646 Address: DF:A9:FF:F6:B1:1A (OUI DF-A9-FF)
        Count: 1
< HCI Command: Host Number of Comp.. (0x03|0x0035) plen 5  #143 [hci1] 8.157809
        Num handles: 1
        Handle: 2646 Address: DF:A9:FF:F6:B1:1A (OUI DF-A9-FF)
        Count: 1
< HCI Command: Host Number of Comp.. (0x03|0x0035) plen 5  #144 [hci1] 8.157917
        Num handles: 1
        Handle: 2646 Address: DF:A9:FF:F6:B1:1A (OUI DF-A9-FF)
        Count: 1
< ACL Data TX: Handle 2646 flags 0x00 dlen 11              #145 [hci1] 8.158040
      ATT: Read By Type Request (0x08) len 6
        Handle range: 0x008e-0xffff
        Attribute type: Characteristic (0x2803)
> HCI Event: Number of Completed Packets (0x13) plen 5     #146 [hci1] 8.223975
        Num handles: 1
        Handle: 2646 Address: DF:A9:FF:F6:B1:1A (OUI DF-A9-FF)
        Count: 1
        #145: len 11 (1 Kb/s)
        Latency: 65 msec (6-67 msec ~65 msec)
> ACL Data RX: Handle 2646 flags 0x02 dlen 27              #147 [hci1] 8.294022
> ACL Data RX: Handle 2646 flags 0x01 dlen 27              #148 [hci1] 8.294469
> ACL Data RX: Handle 2646 flags 0x01 dlen 8               #149 [hci1] 8.294859
      ATT: Read By Type Response (0x09) len 57
        Attribute data length: 7
        Attribute data list: 8 entries
        Handle: 0x008f
        Value: 029000292a
            Properties: 0x02
              Read (0x02)
            Value Handle: 0x0090
            Value UUID: Manufacturer Name String (0x2a29)
        Handle: 0x0091
        Value: 0292002a2a
            Properties: 0x02
              Read (0x02)
            Value Handle: 0x0092
            Value UUID: IEEE 11073-20601 Regulatory Cert. Data List (0x2a2a)
        Handle: 0x0093
        Value: 029400502a
            Properties: 0x02
              Read (0x02)
            Value Handle: 0x0094
            Value UUID: PnP ID (0x2a50)
        Handle: 0x0095
        Value: 0296002234
            Properties: 0x02
              Read (0x02)
            Value Handle: 0x0096
            Value UUID: Unknown (0x3422)
        Handle: 0x0098
        Value: 029900ff2b
            Properties: 0x02
              Read (0x02)
            Value Handle: 0x0099
            Value UUID: Unknown (0x2bff)
        Handle: 0x00d1
        Value: 38d200db2b
            Properties: 0x38
              Write (0x08)
              Notify (0x10)
              Indicate (0x20)
            Value Handle: 0x00d2
            Value UUID: Hearing Aid Preset Control Point (0x2bdb)
        Handle: 0x00d4
        Value: 12d500da2b
            Properties: 0x12
              Read (0x02)
              Notify (0x10)
            Value Handle: 0x00d5
            Value UUID: Hearing Aid Features (0x2bda)
        Handle: 0x00d7
        Value: 12d800dc2b
            Properties: 0x12
              Read (0x02)
              Notify (0x10)
            Value Handle: 0x00d8
            Value UUID: Active Preset Index (0x2bdc)
< HCI Command: Host Number of Comp.. (0x03|0x0035) plen 5  #150 [hci1] 8.297272
        Num handles: 1
        Handle: 2646 Address: DF:A9:FF:F6:B1:1A (OUI DF-A9-FF)
        Count: 1
< HCI Command: Host Number of Comp.. (0x03|0x0035) plen 5  #151 [hci1] 8.297370
        Num handles: 1
        Handle: 2646 Address: DF:A9:FF:F6:B1:1A (OUI DF-A9-FF)
        Count: 1
< HCI Command: Host Number of Comp.. (0x03|0x0035) plen 5  #152 [hci1] 8.297465
        Num handles: 1
        Handle: 2646 Address: DF:A9:FF:F6:B1:1A (OUI DF-A9-FF)
        Count: 1
< ACL Data TX: Handle 2646 flags 0x00 dlen 11              #153 [hci1] 8.297553
      ATT: Read By Type Request (0x08) len 6
        Handle range: 0x00d8-0xffff
        Attribute type: Characteristic (0x2803)
> HCI Event: Number of Completed Packets (0x13) plen 5     #154 [hci1] 8.363858
        Num handles: 1
        Handle: 2646 Address: DF:A9:FF:F6:B1:1A (OUI DF-A9-FF)
        Count: 1
        #153: len 11 (1 Kb/s)
        Latency: 66 msec (6-67 msec ~65 msec)
> ACL Data RX: Handle 2646 flags 0x02 dlen 27              #155 [hci1] 8.434074
> ACL Data RX: Handle 2646 flags 0x01 dlen 27              #156 [hci1] 8.434528
> ACL Data RX: Handle 2646 flags 0x01 dlen 8               #157 [hci1] 8.434932
      ATT: Read By Type Response (0x09) len 57
        Attribute data length: 7
        Attribute data list: 8 entries
        Handle: 0x0111
        Value: 121201c92b
            Properties: 0x12
              Read (0x02)
              Notify (0x10)
            Value Handle: 0x0112
            Value UUID: Sink PAC (0x2bc9)
        Handle: 0x0114
        Value: 1a1501ca2b
            Properties: 0x1a
              Read (0x02)
              Write (0x08)
              Notify (0x10)
            Value Handle: 0x0115
            Value UUID: Sink Audio Locations (0x2bca)
        Handle: 0x011d
        Value: 121e01cd2b
            Properties: 0x12
              Read (0x02)
              Notify (0x10)
            Value Handle: 0x011e
            Value UUID: Available Audio Contexts (0x2bcd)
        Handle: 0x0120
        Value: 122101ce2b
            Properties: 0x12
              Read (0x02)
              Notify (0x10)
            Value Handle: 0x0121
            Value UUID: Supported Audio Contexts (0x2bce)
        Handle: 0x0161
        Value: 126201c42b
            Properties: 0x12
              Read (0x02)
              Notify (0x10)
            Value Handle: 0x0162
            Value UUID: Sink ASE (0x2bc4)
        Handle: 0x016d
        Value: 1c6e01c62b
            Properties: 0x1c
              Write Without Response (0x04)
              Write (0x08)
              Notify (0x10)
            Value Handle: 0x016e
            Value UUID: ASE Control Point (0x2bc6)
        Handle: 0x01c1
        Value: 02c201842b
            Properties: 0x02
              Read (0x02)
            Value Handle: 0x01c2
            Value UUID: Set Identity Resolving Key (0x2b84)
        Handle: 0x01c3
        Value: 1ac401862b
            Properties: 0x1a
              Read (0x02)
              Write (0x08)
              Notify (0x10)
            Value Handle: 0x01c4
            Value UUID: Set Member Lock (0x2b86)
< HCI Command: Host Number of Comp.. (0x03|0x0035) plen 5  #158 [hci1] 8.437623
        Num handles: 1
        Handle: 2646 Address: DF:A9:FF:F6:B1:1A (OUI DF-A9-FF)
        Count: 1
< HCI Command: Host Number of Comp.. (0x03|0x0035) plen 5  #159 [hci1] 8.437911
        Num handles: 1
        Handle: 2646 Address: DF:A9:FF:F6:B1:1A (OUI DF-A9-FF)
        Count: 1
< HCI Command: Host Number of Comp.. (0x03|0x0035) plen 5  #160 [hci1] 8.438057
        Num handles: 1
        Handle: 2646 Address: DF:A9:FF:F6:B1:1A (OUI DF-A9-FF)
        Count: 1
< ACL Data TX: Handle 2646 flags 0x00 dlen 9               #161 [hci1] 8.438208
      ATT: Find Information Request (0x04) len 4
        Handle range: 0x0121-0xffff
> HCI Event: Number of Completed Packets (0x13) plen 5     #162 [hci1] 8.503757
        Num handles: 1
        Handle: 2646 Address: DF:A9:FF:F6:B1:1A (OUI DF-A9-FF)
        Count: 1
        #161: len 9 (1 Kb/s)
        Latency: 65 msec (6-67 msec ~65 msec)
> ACL Data RX: Handle 2646 flags 0x02 dlen 27              #163 [hci1] 8.573991
> ACL Data RX: Handle 2646 flags 0x01 dlen 27              #164 [hci1] 8.574593
> ACL Data RX: Handle 2646 flags 0x01 dlen 12              #165 [hci1] 8.574926
      ATT: Find Information Response (0x05) len 61
        Format: UUID-16 (0x01)
        Handle: 0x0121
        UUID: Supported Audio Contexts (0x2bce)
        Handle: 0x0122
        UUID: Client Characteristic Configuration (0x2902)
        Handle: 0x0160
        UUID: Primary Service (0x2800)
        Handle: 0x0161
        UUID: Characteristic (0x2803)
        Handle: 0x0162
        UUID: Sink ASE (0x2bc4)
        Handle: 0x0163
        UUID: Client Characteristic Configuration (0x2902)
        Handle: 0x016d
        UUID: Characteristic (0x2803)
        Handle: 0x016e
        UUID: ASE Control Point (0x2bc6)
        Handle: 0x016f
        UUID: Client Characteristic Configuration (0x2902)
        Handle: 0x01a0
        UUID: Primary Service (0x2800)
        Handle: 0x01a1
        UUID: Include (0x2802)
        Handle: 0x01c0
        UUID: Primary Service (0x2800)
        Handle: 0x01c1
        UUID: Characteristic (0x2803)
        Handle: 0x01c2
        UUID: Set Identity Resolving Key (0x2b84)
        Handle: 0x01c3
        UUID: Characteristic (0x2803)
< HCI Command: Host Number of Comp.. (0x03|0x0035) plen 5  #166 [hci1] 8.577461
        Num handles: 1
        Handle: 2646 Address: DF:A9:FF:F6:B1:1A (OUI DF-A9-FF)
        Count: 1
< HCI Command: Host Number of Comp.. (0x03|0x0035) plen 5  #167 [hci1] 8.577793
        Num handles: 1
        Handle: 2646 Address: DF:A9:FF:F6:B1:1A (OUI DF-A9-FF)
        Count: 1
< HCI Command: Host Number of Comp.. (0x03|0x0035) plen 5  #168 [hci1] 8.577858
        Num handles: 1
        Handle: 2646 Address: DF:A9:FF:F6:B1:1A (OUI DF-A9-FF)
        Count: 1
< ACL Data TX: Handle 2646 flags 0x00 dlen 7               #169 [hci1] 8.578053
      ATT: Read Request (0x0a) len 2
        Handle: 0x0121
> HCI Event: Number of Completed Packets (0x13) plen 5     #170 [hci1] 8.643773
        Num handles: 1
        Handle: 2646 Address: DF:A9:FF:F6:B1:1A (OUI DF-A9-FF)
        Count: 1
        #169: len 7 (0 Kb/s)
        Latency: 65 msec (6-67 msec ~65 msec)
> ACL Data RX: Handle 2646 flags 0x02 dlen 9               #171 [hci1] 8.713923
      ATT: Read Response (0x0b) len 4
< HCI Command: Host Number of Comp.. (0x03|0x0035) plen 5  #172 [hci1] 8.720917
        Num handles: 1
        Handle: 2646 Address: DF:A9:FF:F6:B1:1A (OUI DF-A9-FF)
        Count: 1
< ACL Data TX: Handle 2646 flags 0x00 dlen 9               #173 [hci1] 8.721064
      ATT: Write Request (0x12) len 4
        Handle: 0x0122
          Data: 0100
> HCI Event: Number of Completed Packets (0x13) plen 5     #174 [hci1] 8.783889
        Num handles: 1
        Handle: 2646 Address: DF:A9:FF:F6:B1:1A (OUI DF-A9-FF)
        Count: 1
        #173: len 9 (1 Kb/s)
        Latency: 62 msec (6-67 msec ~64 msec)
> ACL Data RX: Handle 2646 flags 0x02 dlen 5               #175 [hci1] 8.853838
      ATT: Write Response (0x13) len 0
< HCI Command: Host Number of Comp.. (0x03|0x0035) plen 5  #176 [hci1] 8.857515
        Num handles: 1
        Handle: 2646 Address: DF:A9:FF:F6:B1:1A (OUI DF-A9-FF)
        Count: 1
< ACL Data TX: Handle 2646 flags 0x00 dlen 11              #177 [hci1] 8.857624
      ATT: Read By Type Request (0x08) len 6
        Handle range: 0x0001-0xffff
        Attribute type: Characteristic (0x2803)
> HCI Event: Number of Completed Packets (0x13) plen 5     #178 [hci1] 8.923806
        Num handles: 1
        Handle: 2646 Address: DF:A9:FF:F6:B1:1A (OUI DF-A9-FF)
        Count: 1
        #177: len 11 (1 Kb/s)
        Latency: 66 msec (6-67 msec ~65 msec)
> ACL Data RX: Handle 2646 flags 0x02 dlen 27              #179 [hci1] 8.994009
> ACL Data RX: Handle 2646 flags 0x01 dlen 27              #180 [hci1] 8.994481
> ACL Data RX: Handle 2646 flags 0x01 dlen 8               #181 [hci1] 8.994903
      ATT: Read By Type Response (0x09) len 57
        Attribute data length: 7
        Attribute data list: 8 entries
        Handle: 0x0002
        Value: 0a0300002a
            Properties: 0x0a
              Read (0x02)
              Write (0x08)
            Value Handle: 0x0003
            Value UUID: Device Name (0x2a00)
        Handle: 0x0004
        Value: 0a0500012a
            Properties: 0x0a
              Read (0x02)
              Write (0x08)
            Value Handle: 0x0005
            Value UUID: Appearance (0x2a01)
        Handle: 0x0006
        Value: 4e07000945
            Properties: 0x4e
              Read (0x02)
              Write Without Response (0x04)
              Write (0x08)
              Authorize (0x40)
              Extended Properties (0x80)
            Value Handle: 0x0007
            Value UUID: Unknown (0x4509)
        Handle: 0x0008
        Value: 020900042a
            Properties: 0x02
              Read (0x02)
            Value Handle: 0x0009
            Value UUID: Peripheral Preferred Connection Parameters (0x2a04)
        Handle: 0x000a
        Value: 120b00192a
            Properties: 0x12
              Read (0x02)
              Notify (0x10)
            Value Handle: 0x000b
            Value UUID: Battery Level (0x2a19)
        Handle: 0x000e
        Value: 020f00a62a
            Properties: 0x02
              Read (0x02)
            Value Handle: 0x000f
            Value UUID: Central Address Resolution (0x2aa6)
        Handle: 0x0041
        Value: 204200052a
            Properties: 0x20
              Indicate (0x20)
            Value Handle: 0x0042
            Value UUID: Service Changed (0x2a05)
        Handle: 0x0044
        Value: 0a4500292b
            Properties: 0x0a
              Read (0x02)
              Write (0x08)
            Value Handle: 0x0045
            Value UUID: Client Supported Features (0x2b29)
