Bluetooth monitor ver 5.84
btmon[1763241]: = Note: Linux version 6.8.0-83-generic (x86_64)                                                          0.132658
btmon[1763241]: = Note: Bluetooth subsystem version 2.22                                                                 0.132660
= New Index: 00:00:00:00:00:00 (Primary,UART,hci0)                                                                       0.132660
= Open Index: 00:00:00:00:00:00                                                                                          0.636160
= Index Info: 00:00:00:00:00:00 (Nordic Semiconductor ASA)                                                               0.636332
zephyr.exe[1763243]: @ USER Open: main (privileged) version 2.22                                                {0x0001} 0.636380
zephyr.exe[1763243]: < HCI Command: Reset (0x03|0x0003) plen 0                                                        #1 0.636964
> HCI Event: Command Complete (0x0e) plen 4                                                                           #2 0.637711
      Reset (0x03|0x0003) ncmd 1
        Status: Success (0x00)
zephyr.exe[1763243]: < HCI Command: Read Local Supported Features (0x04|0x0003) plen 0                                #3 0.656141
> HCI Event: Command Complete (0x0e) plen 12                                                                          #4 0.657054
      Read Local Supported Features (0x04|0x0003) ncmd 1
        Status: Success (0x00)
        Features: 0x00 0x00 0x00 0x00 0x60 0x00 0x00 0x00
          BR/EDR Not Supported
          LE Supported (Controller)
zephyr.exe[1763243]: < HCI Command: Read Local Version Information (0x04|0x0001) plen 0                               #5 0.676063
> HCI Event: Command Complete (0x0e) plen 12                                                                          #6 0.676949
      Read Local Version Information (0x04|0x0001) ncmd 1
        Status: Success (0x00)
        HCI version: Reserved (0x0e) - Revision 12520 (0x30e8)
        LMP version: Reserved (0x0e) - Subversion 12520 (0x30e8)
        Manufacturer: Nordic Semiconductor ASA (89)
zephyr.exe[1763243]: < HCI Command: Read Local Supported Commands (0x04|0x0002) plen 0                                #7 0.696111
> HCI Event: Command Complete (0x0e) plen 68                                                                          #8 0.697693
      Read Local Supported Commands (0x04|0x0002) ncmd 1
        Status: Success (0x00)
        Commands: 119 entries
          Disconnect (Octet 0 - Bit 5)
          Read Remote Version Information (Octet 2 - Bit 7)
          Set Event Mask (Octet 5 - Bit 6)
          Reset (Octet 5 - Bit 7)
          Read Connection Accept Timeout (Octet 7 - Bit 2)
          Write Connection Accept Timeout (Octet 7 - Bit 3)
          Read Transmit Power Level (Octet 10 - Bit 2)
          Set Controller To Host Flow Control (Octet 10 - Bit 5)
          Host Buffer Size (Octet 10 - Bit 6)
          Host Number of Completed Packets (Octet 10 - Bit 7)
          Read Local Version Information (Octet 14 - Bit 3)
          Read Local Supported Features (Octet 14 - Bit 5)
          Read BD ADDR (Octet 15 - Bit 1)
          Read RSSI (Octet 15 - Bit 5)
          Set Event Mask Page 2 (Octet 22 - Bit 2)
          LE Set Event Mask (Octet 25 - Bit 0)
          LE Read Buffer Size (Octet 25 - Bit 1)
          LE Read Local Supported Features (Octet 25 - Bit 2)
          LE Set Random Address (Octet 25 - Bit 4)
          LE Set Advertising Parameters (Octet 25 - Bit 5)
          LE Read Advertising Channel TX Power (Octet 25 - Bit 6)
          LE Set Advertising Data (Octet 25 - Bit 7)
          LE Set Scan Response Data (Octet 26 - Bit 0)
          LE Set Advertise Enable (Octet 26 - Bit 1)
          LE Set Scan Parameters (Octet 26 - Bit 2)
          LE Set Scan Enable (Octet 26 - Bit 3)
          LE Create Connection (Octet 26 - Bit 4)
          LE Create Connection Cancel (Octet 26 - Bit 5)
          LE Read Accept List Size (Octet 26 - Bit 6)
          LE Clear Accept List (Octet 26 - Bit 7)
          LE Add Device To Accept List (Octet 27 - Bit 0)
          LE Remove Device From Accept List (Octet 27 - Bit 1)
          LE Connection Update (Octet 27 - Bit 2)
          LE Set Host Channel Classification (Octet 27 - Bit 3)
          LE Read Channel Map (Octet 27 - Bit 4)
          LE Read Remote Used Features (Octet 27 - Bit 5)
          LE Encrypt (Octet 27 - Bit 6)
          LE Rand (Octet 27 - Bit 7)
          LE Start Encryption (Octet 28 - Bit 0)
          LE Long Term Key Request Reply (Octet 28 - Bit 1)
          LE Long Term Key Request Neg Reply (Octet 28 - Bit 2)
          LE Read Supported States (Octet 28 - Bit 3)
          LE Receiver Test (Octet 28 - Bit 4)
          LE Transmitter Test (Octet 28 - Bit 5)
          LE Test End (Octet 28 - Bit 6)
          Read Authenticated Payload Timeout (Octet 32 - Bit 4)
          Write Authenticated Payload Timeout (Octet 32 - Bit 5)
          LE Set Data Length (Octet 33 - Bit 6)
          LE Read Suggested Default Data Length (Octet 33 - Bit 7)
          LE Write Suggested Default Data Length (Octet 34 - Bit 0)
          LE Add Device To Resolving List (Octet 34 - Bit 3)
          LE Remove Device From Resolving List (Octet 34 - Bit 4)
          LE Clear Resolving List (Octet 34 - Bit 5)
          LE Read Resolving List Size (Octet 34 - Bit 6)
          LE Set Address Resolution Enable (Octet 35 - Bit 1)
          LE Set Resolvable Private Address Timeout (Octet 35 - Bit 2)
          LE Read Maximum Data Length (Octet 35 - Bit 3)
          LE Read PHY (Octet 35 - Bit 4)
          LE Set Default PHY (Octet 35 - Bit 5)
          LE Set PHY (Octet 35 - Bit 6)
          LE Enhanced Receiver Test (Octet 35 - Bit 7)
          LE Enhanced Transmitter Test (Octet 36 - Bit 0)
          LE Set Advertising Set Random Address (Octet 36 - Bit 1)
          LE Set Extended Advertising Parameters (Octet 36 - Bit 2)
          LE Set Extended Advertising Data (Octet 36 - Bit 3)
          LE Set Extended Scan Response Data (Octet 36 - Bit 4)
          LE Set Extended Advertising Enable (Octet 36 - Bit 5)
          LE Read Maximum Advertising Data Length (Octet 36 - Bit 6)
          LE Read Number of Supported Advertising Sets (Octet 36 - Bit 7)
          LE Remove Advertising Set (Octet 37 - Bit 0)
          LE Clear Advertising Sets (Octet 37 - Bit 1)
          LE Set Periodic Advertising Parameters (Octet 37 - Bit 2)
          LE Set Periodic Advertising Data (Octet 37 - Bit 3)
          LE Set Periodic Advertising Enable (Octet 37 - Bit 4)
          LE Set Extended Scan Parameters (Octet 37 - Bit 5)
          LE Set Extended Scan Enable (Octet 37 - Bit 6)
          LE Extended Create Connection (Octet 37 - Bit 7)
          LE Periodic Advertising Create Sync (Octet 38 - Bit 0)
          LE Periodic Advertising Create Sync Cancel (Octet 38 - Bit 1)
          LE Periodic Advertising Terminate Sync (Octet 38 - Bit 2)
          LE Add Device To Periodic Advertiser List (Octet 38 - Bit 3)
          LE Remove Device From Periodic Advertiser List (Octet 38 - Bit 4)
          LE Clear Periodic Advertiser List (Octet 38 - Bit 5)
          LE Read Periodic Advertiser List Size (Octet 38 - Bit 6)
          LE Read Transmit Power (Octet 38 - Bit 7)
          LE Read RF Path Compensation (Octet 39 - Bit 0)
          LE Write RF Path Compensation (Octet 39 - Bit 1)
          LE Set Privacy Mode (Octet 39 - Bit 2)
          LE Periodic Advertising Receive Enable (Octet 40 - Bit 5)
          LE Periodic Advertising Sync Transfer (Octet 40 - Bit 6)
          LE Periodic Advertising Set Info Transfer (Octet 40 - Bit 7)
          LE Periodic Advertising Sync Transfer Parameters (Octet 41 - Bit 0)
          LE Set Default Periodic Advertisng Sync Transfer Parameters (Octet 41 - Bit 1)
          LE Read Buffer v2 (Octet 41 - Bit 5)
          LE Read ISO TX Sync (Octet 41 - Bit 6)
          LE Set Connected Isochronous Group Parameters (Octet 41 - Bit 7)
          LE Set Connected Isochronous Group Parameters Test (Octet 42 - Bit 0)
          LE Create Connected Isochronous Stream (Octet 42 - Bit 1)
          LE Remove Connected Isochronous Group (Octet 42 - Bit 2)
          LE Accept Connected Isochronous Stream Request (Octet 42 - Bit 3)
          LE Reject Connected Isochronous Stream Request (Octet 42 - Bit 4)
          LE Create Broadcast Isochronous Group (Octet 42 - Bit 5)
          LE Create Broadcast Isochronous Group Test (Octet 42 - Bit 6)
          LE Terminate Broadcast Isochronous Group (Octet 42 - Bit 7)
          LE Broadcast Isochronous Group Create Sync (Octet 43 - Bit 0)
          LE Broadcast Isochronous Group Terminate Sync (Octet 43 - Bit 1)
          LE Request Peer SCA (Octet 43 - Bit 2)
          LE Setup Isochronous Data Path (Octet 43 - Bit 3)
          LE Remove Isochronous Data Path (Octet 43 - Bit 4)
          LE Isochronous Transmit Test (Octet 43 - Bit 5)
          LE Isochronous Receive Test (Octet 43 - Bit 6)
          LE Isochronous Read Test Counters (Octet 43 - Bit 7)
          LE Isochronous Read Test Counters (Octet 44 - Bit 0)
          LE Set Host Feature (Octet 44 - Bit 1)
          LE Read ISO link quality (Octet 44 - Bit 2)
          Octet 45 - Bit 6 
          Octet 46 - Bit 0 
          Octet 46 - Bit 1 
          Octet 46 - Bit 2 
zephyr.exe[1763243]: < HCI Command: Host Buffer Size (0x03|0x0033) plen 7                                             #9 0.716119
        ACL MTU: 255  ACL max packet: 16
        SCO MTU: 0    SCO max packet: 0
> HCI Event: Command Complete (0x0e) plen 4                                                                          #10 0.716873
      Host Buffer Size (0x03|0x0033) ncmd 1
        Status: Success (0x00)
zephyr.exe[1763243]: < HCI Command: Set Controller To Host Flow Control (0x03|0x0031) plen 1                         #11 0.736171
        Flow control: ACL Data Packets (0x01)
> HCI Event: Command Complete (0x0e) plen 4                                                                          #12 0.736920
      Set Controller To Host Flow Control (0x03|0x0031) ncmd 1
        Status: Success (0x00)
zephyr.exe[1763243]: < HCI Command: LE Read Local Supported Features (0x08|0x0003) plen 0                            #13 0.756108
> HCI Event: Command Complete (0x0e) plen 12                                                                         #14 0.756677
      LE Read Local Supported Features (0x08|0x0003) ncmd 1
        Status: Success (0x00)
        Features: 0xfd 0x79 0x00 0xf7 0x30 0x01 0x00 0x00
          LE Encryption
          Extended Reject Indication
          Peripheral-initiated Features Exchange
          LE Ping
          LE Data Packet Length Extension
          LL Privacy
          Extended Scanner Filter Policies
          LE 2M PHY
          LE Coded PHY
          LE Extended Advertising
          LE Periodic Advertising
          Channel Selection Algorithm #2
          Periodic Advertising Sync Transfer - Sender
          Periodic Advertising Sync Transfer - Recipient
          Sleep Clock Accuracy Updates
          Connected Isochronous Stream - Central
          Connected Isochronous Stream - Peripheral
          Isochronous Broadcaster
          Synchronized Receiver
          Periodic Advertising ADI support
          Connection Subrating
          Unknown features (0x0000010000000000)
zephyr.exe[1763243]: < HCI Command: LE Set Host Feature (0x08|0x0074) plen 2                                         #15 0.776162
        Bit Number: 32
          Connected Isochronous Stream (Host Support)
        Bit Value: 1
> HCI Event: Command Complete (0x0e) plen 4                                                                          #16 0.776789
      LE Set Host Feature (0x08|0x0074) ncmd 1
        Status: Success (0x00)
zephyr.exe[1763243]: < HCI Command: LE Read Buffer v2 (0x08|0x0060) plen 0                                           #17 0.796155
> HCI Event: Command Complete (0x0e) plen 10                                                                         #18 0.796789
      LE Read Buffer v2 (0x08|0x0060) ncmd 1
        Status: Success (0x00)
        ACL MTU: 27
        ACL max packet: 3
        ISO MTU: 318
        ISO max packet: 3
zephyr.exe[1763243]: < HCI Command: LE Read Maximum Advertising Data Length (0x08|0x003a) plen 0                     #19 0.816104
> HCI Event: Command Complete (0x0e) plen 6                                                                          #20 0.816945
      LE Read Maximum Advertising Data Length (0x08|0x003a) ncmd 1
        Status: Success (0x00)
        Max length: 1650
zephyr.exe[1763243]: < HCI Command: LE Read Supported States (0x08|0x001c) plen 0                                    #21 0.836060
> HCI Event: Command Complete (0x0e) plen 12                                                                         #22 0.836707
      LE Read Supported States (0x08|0x001c) ncmd 1
        Status: Success (0x00)
        States: 0x000003ff3e0306ff
          Non-connectable Advertising State
          Scannable Advertising State
          Connectable Advertising State
          High Duty Cycle Directed Advertising State
          Passive Scanning State
          Active Scanning State
          Initiating State
            and Connection State (Central Role)
          Connection State (Peripheral Role)
          Scannable Advertising State
            and Passive Scanning State
          Connectable Advertising State
            and Passive Scanning State
          Non-connectable Advertising State
            and Initiating State
          Scannable Advertising State
            and Initiating State
          Active Scanning State
            and Connection State (Central Role)
          Passive Scanning State
            and Connection State (Peripheral Role)
          Active Scanning State
            and Connection State (Peripheral Role)
          Initiating State
            and Connection State (Central Role)
            and Central Role & Central Role
          Low Duty Cycle Directed Advertising State
          Connectable Advertising State
            and Initiating State
            and Central Role & Peripheral Role
          High Duty Cycle Directed Advertising State
            and Initiating State
            and Central Role & Peripheral Role
          Low Duty Cycle Directed Advertising State
            and Initiating State
            and Central Role & Peripheral Role
          Connectable Advertising State
            and Connection State (Central Role)
            and Central Role & Peripheral Role
          High Duty Cycle Directed Advertising State
            and Connection State (Central Role)
            and Central Role & Peripheral Role
          Low Duty Cycle Directed Advertising State
            and Connection State (Central Role)
            and Central Role & Peripheral Role
          Connectable Advertising State
            and Connection State (Peripheral Role)
            and Central Role & Peripheral Role
          High Duty Cycle Directed Advertising State
            and Connection State (Peripheral Role)
            and Peripheral Role & Peripheral Role
          Low Duty Cycle Directed Advertising State
            and Connection State (Peripheral Role)
            and Peripheral Role & Peripheral Role
          Initiating State
            and Connection State (Peripheral Role)
            and Central Role & Peripheral Role
zephyr.exe[1763243]: < HCI Command: LE Read Maximum Data Length (0x08|0x002f) plen 0                                 #23 0.856089
> HCI Event: Command Complete (0x0e) plen 12                                                                         #24 0.856724
      LE Read Maximum Data Length (0x08|0x002f) ncmd 1
        Status: Success (0x00)
        Max TX octets: 251
        Max TX time: 2704
        Max RX octets: 251
        Max RX time: 2704
zephyr.exe[1763243]: < HCI Command: LE Write Suggested Default Data Length (0x08|0x0024) plen 4                      #25 0.876091
        TX octets: 251
        TX time: 2704
> HCI Event: Command Complete (0x0e) plen 4                                                                          #26 0.876661
      LE Write Suggested Default Data Length (0x08|0x0024) ncmd 1
        Status: Success (0x00)
zephyr.exe[1763243]: < HCI Command: LE Read Resolving List Size (0x08|0x002a) plen 0                                 #27 0.896061
> HCI Event: Command Complete (0x0e) plen 5                                                                          #28 0.896888
      LE Read Resolving List Size (0x08|0x002a) ncmd 1
        Status: Success (0x00)
        Size: 8
zephyr.exe[1763243]: < HCI Command: LE Set Event Mask (0x08|0x0001) plen 8                                           #29 0.916051
        Mask: 0x000002023f87fa5e
          LE Advertising Report
          LE Connection Update Complete
          LE Read Remote Used Features Complete
          LE Long Term Key Request
          LE Data Length Change
          LE Enhanced Connection Complete
          LE PHY Update Complete
          LE Extended Advertising Report
          LE Periodic Advertising Sync Established
          LE Periodic Advertising Report
          LE Periodic Advertising Sync Lost
          LE Extended Scan Timeout
          LE Extended Advertising Set Terminated
          LE Scan Request Received
          LE Periodic Advertising Sync Transfer Rvc
          LE CIS Established
          LE CIS Request
          LE Create BIG Complete
          LE Terminate BIG Complete
          LE BIG Sync Established Complete
          LE BIG Sync Lost
          LE BIG Info Advertising Report
          Unknown mask (0x0000020000000000)
> HCI Event: Command Complete (0x0e) plen 4                                                                          #30 0.916953
      LE Set Event Mask (0x08|0x0001) ncmd 1
        Status: Success (0x00)
zephyr.exe[1763243]: < HCI Command: Set Event Mask (0x03|0x0001) plen 8                                              #31 0.936083
        Mask: 0x2000800002008890
          Disconnection Complete
          Encryption Change
          Read Remote Version Information Complete
          Hardware Error
          Data Buffer Overflow
          Encryption Key Refresh Complete
          LE Meta
> HCI Event: Command Complete (0x0e) plen 4                                                                          #32 0.936885
      Set Event Mask (0x03|0x0001) ncmd 1
        Status: Success (0x00)
zephyr.exe[1763243]: < HCI Command: Read BD ADDR (0x04|0x0009) plen 0                                                #33 0.956084
> HCI Event: Command Complete (0x0e) plen 10                                                                         #34 0.956957
      Read BD ADDR (0x04|0x0009) ncmd 1
        Status: Success (0x00)
        Address: 00:00:00:00:00:00 (OUI 00-00-00)
zephyr.exe[1763243]: < HCI Command: LE Set Random Address (0x08|0x0005) plen 6                                       #35 0.976130
        Address: D5:B6:CC:31:DB:3B (Static)
> HCI Event: Command Complete (0x0e) plen 4                                                                          #36 0.976873
      LE Set Random Address (0x08|0x0005) ncmd 1
        Status: Success (0x00)
zephyr.exe[1763243]: < HCI Command: LE Extended Create Connection (0x08|0x0043) plen 26                              #37 3.536235
        Filter policy: Accept list is not used (0x00)
        Own address type: Random (0x01)
        Peer address type: Public (0x00)
        Peer address: C0:07:E8:2C:B6:EE (OUI C0-07-E8)
        Initiating PHYs: 0x01
        Entry 0: LE 1M
          Scan interval: 60.000 msec (0x0060)
          Scan window: 60.000 msec (0x0060)
          Min connection interval: 50.00 msec (0x0028)
          Max connection interval: 70.00 msec (0x0038)
          Connection latency: 0 (0x0000)
          Supervision timeout: 4000 msec (0x0190)
          Min connection length: 0.000 msec (0x0000)
          Max connection length: 0.000 msec (0x0000)
> HCI Event: Command Status (0x0f) plen 4                                                                            #38 3.538059
      LE Extended Create Connection (0x08|0x0043) ncmd 1
        Status: Success (0x00)
> HCI Event: LE Meta Event (0x3e) plen 31                                                                            #39 3.592989
      LE Enhanced Connection Complete (0x0a)
        Status: Success (0x00)
        Handle: 882
        Role: Central (0x00)
        Peer address type: Public (0x00)
        Peer address: C0:07:E8:2C:B6:EE (OUI C0-07-E8)
        Local resolvable private address: 00:00:00:00:00:00 (Non-Resolvable)
        Peer resolvable private address: 00:00:00:00:00:00 (Non-Resolvable)
        Connection interval: 70.00 msec (0x0038)
        Connection latency: 0 (0x0000)
        Supervision timeout: 4000 msec (0x0190)
        Central clock accuracy: 0x00
zephyr.exe[1763243]: < HCI Command: LE Read Remote Used Features (0x08|0x0016) plen 2                                #40 3.596236
        Handle: 882 Address: C0:07:E8:2C:B6:EE (OUI C0-07-E8)
> HCI Event: Command Status (0x0f) plen 4                                                                            #41 3.596962
      LE Read Remote Used Features (0x08|0x0016) ncmd 1
        Status: Success (0x00)
zephyr.exe[1763243]: < HCI Command: LE Set PHY (0x08|0x0032) plen 7                                                  #42 3.616201
        Handle: 882 Address: C0:07:E8:2C:B6:EE (OUI C0-07-E8)
        All PHYs preference: 0x00
        TX PHYs preference: 0x02
          LE 2M
        RX PHYs preference: 0x02
          LE 2M
        PHY options preference: Reserved (0x0000)
> HCI Event: Command Status (0x0f) plen 4                                                                            #43 3.616958
      LE Set PHY (0x08|0x0032) ncmd 1
        Status: Success (0x00)
zephyr.exe[1763243]: < ACL Data TX: Handle 882 [1/3] flags 0x00 dlen 7                                               #44 3.636177
      ATT: Exchange MTU Request (0x02) len 2
        Client RX MTU: 251
> HCI Event: Number of Completed Packets (0x13) plen 5                                                               #45 3.665237
        Num handles: 1
        Handle: 882 Address: C0:07:E8:2C:B6:EE (OUI C0-07-E8)
        Count: 1
        Buffers: 0/3
        #44: len 7 (1 Kb/s)
        Latency: 29 msec (29-29 msec ~29 msec)
> HCI Event: LE Meta Event (0x3e) plen 12                                                                            #46 3.805457
      LE Read Remote Used Features (0x04)
        Status: Success (0x00)
        Handle: 882 Address: C0:07:E8:2C:B6:EE (OUI C0-07-E8)
        Features: 0x2d 0x49 0x01 0xf7 0xef 0x39 0x00 0x80
          LE Encryption
          Extended Reject Indication
          Peripheral-initiated Features Exchange
          LE Data Packet Length Extension
          LE 2M PHY
          LE Coded PHY
          Channel Selection Algorithm #2
          Minimum Number of Used Channels Procedure
          Periodic Advertising Sync Transfer - Sender
          Periodic Advertising Sync Transfer - Recipient
          Sleep Clock Accuracy Updates
          Connected Isochronous Stream - Central
          Connected Isochronous Stream - Peripheral
          Isochronous Broadcaster
          Synchronized Receiver
          Connected Isochronous Stream (Host Support)
          LE Power Control Request
          LE Power Control Request
          LE Path Loss Monitoring
          Connection Subrating
          Connection Subrating (Host Support)
          Channel Classification
          Unknown features (0x8000390000000000)
> HCI Event: LE Meta Event (0x3e) plen 6                                                                             #47 4.434675
      LE PHY Update Complete (0x0c)
        Status: Success (0x00)
        Handle: 882 Address: C0:07:E8:2C:B6:EE (OUI C0-07-E8)
        TX PHY: LE 2M (0x02)
        RX PHY: LE 2M (0x02)
> ACL Data RX: Handle 882 flags 0x02 dlen 6                                                                          #48 4.645135
      SMP: Security Request (0x0b) len 1
        Authentication requirement: Bonding, No MITM, SC, No Keypresses (0x09)
> ACL Data RX: Handle 882 flags 0x02 dlen 7                                                                          #49 4.645587
      ATT: Exchange MTU Response (0x03) len 2
        Server RX MTU: 23
zephyr.exe[1763243]: < HCI Command: Host Number of Completed Packets (0x03|0x0035) plen 5                            #50 4.656282
        Num handles: 1
        Handle: 882 Address: C0:07:E8:2C:B6:EE (OUI C0-07-E8)
        Count: 1
zephyr.exe[1763243]: < ACL Data TX: Handle 882 [1/3] flags 0x00 dlen 11                                              #51 4.656517
      SMP: Pairing Request (0x01) len 6
        IO capability: DisplayOnly (0x00)
        OOB data: Authentication data not present (0x00)
        Authentication requirement: Bonding, No MITM, SC, No Keypresses (0x09)
        Max encryption key size: 16
        Initiator key distribution: EncKey Sign (0x05)
        Responder key distribution: EncKey IdKey Sign (0x07)
zephyr.exe[1763243]: < HCI Command: Host Number of Completed Packets (0x03|0x0035) plen 5                            #52 4.656559
        Num handles: 1
        Handle: 882 Address: C0:07:E8:2C:B6:EE (OUI C0-07-E8)
        Count: 1
> HCI Event: Number of Completed Packets (0x13) plen 5                                                               #53 4.715155
        Num handles: 1
        Handle: 882 Address: C0:07:E8:2C:B6:EE (OUI C0-07-E8)
        Count: 1
        Buffers: 0/3
        #51: len 11 (1 Kb/s)
        Latency: 58 msec (29-58 msec ~43 msec)
> ACL Data RX: Handle 882 flags 0x02 dlen 11                                                                         #54 4.785298
      SMP: Pairing Response (0x02) len 6
        IO capability: KeyboardDisplay (0x04)
        OOB data: Authentication data not present (0x00)
        Authentication requirement: Bonding, No MITM, SC, No Keypresses (0x09)
        Max encryption key size: 16
        Initiator key distribution: EncKey Sign (0x05)
        Responder key distribution: EncKey IdKey (0x03)
zephyr.exe[1763243]: < HCI Command: Host Number of Completed Packets (0x03|0x0035) plen 5                            #55 4.796059
        Num handles: 1
        Handle: 882 Address: C0:07:E8:2C:B6:EE (OUI C0-07-E8)
        Count: 1
zephyr.exe[1763243]: < ACL Data TX: Handle 882 [1/3] flags 0x00 dlen 27                                              #56 4.796189
zephyr.exe[1763243]: < ACL Data TX: Handle 882 flags 0x01 dlen 27                                                    #57 4.796211
zephyr.exe[1763243]: < ACL Data TX: Handle 882 flags 0x01 dlen 15                                                    #58 4.796227
      SMP: Pairing Public Key (0x0c) len 64
        X[32]: 98308440221e2d910f0e54b71e7ec652857aa9b5a0dc65028824cc19db1226e9
        Y[32]: 67a4816bcb62efb21701e31fdb27561a6217575fb007a8bbdabe7e28b6f68482
> HCI Event: Number of Completed Packets (0x13) plen 5                                                               #59 4.855139
        Num handles: 1
        Handle: 882 Address: C0:07:E8:2C:B6:EE (OUI C0-07-E8)
        Count: 1
        Buffers: 0/3
        #56: len 27 (3 Kb/s)
        Latency: 58 msec (29-58 msec ~51 msec)
> HCI Event: Number of Completed Packets (0x13) plen 5                                                               #60 4.855736
        Num handles: 1
        Handle: 882 Address: C0:07:E8:2C:B6:EE (OUI C0-07-E8)
        Count: 1
        Buffers: underflow/3
        #57: len 27 (3 Kb/s)
        Latency: 59 msec (29-59 msec ~55 msec)
> HCI Event: Number of Completed Packets (0x13) plen 5                                                               #61 4.856207
        Num handles: 1
        Handle: 882 Address: C0:07:E8:2C:B6:EE (OUI C0-07-E8)
        Count: 1
        Buffers: underflow/3
        #58: len 15 (2 Kb/s)
        Latency: 59 msec (29-59 msec ~57 msec)
> ACL Data RX: Handle 882 flags 0x02 dlen 27                                                                         #62 4.925440
> ACL Data RX: Handle 882 flags 0x01 dlen 27                                                                         #63 4.925908
> ACL Data RX: Handle 882 flags 0x01 dlen 15                                                                         #64 4.926228
      SMP: Pairing Public Key (0x0c) len 64
        X[32]: d02d82bbb7e1683080a45d9833545a959e517635505444b3c7bb078da3252a67
        Y[32]: 30a47a50b02268a9510269da2ec691254eea13d5e263a694378f872fb97b3cad
zephyr.exe[1763243]: < HCI Command: Host Number of Completed Packets (0x03|0x0035) plen 5                            #65 4.936268
        Num handles: 1
        Handle: 882 Address: C0:07:E8:2C:B6:EE (OUI C0-07-E8)
        Count: 1
zephyr.exe[1763243]: < HCI Command: Host Number of Completed Packets (0x03|0x0035) plen 5                            #66 4.936564
        Num handles: 1
        Handle: 882 Address: C0:07:E8:2C:B6:EE (OUI C0-07-E8)
        Count: 1
zephyr.exe[1763243]: < HCI Command: Host Number of Completed Packets (0x03|0x0035) plen 5                            #67 4.936612
        Num handles: 1
        Handle: 882 Address: C0:07:E8:2C:B6:EE (OUI C0-07-E8)
        Count: 1
> ACL Data RX: Handle 882 flags 0x02 dlen 21                                                                         #68 4.937286
      SMP: Pairing Confirm (0x03) len 16
        Confirm value[16]: ef60b0dd0ebdde12789566eb23cd9de5
zephyr.exe[1763243]: < HCI Command: Host Number of Completed Packets (0x03|0x0035) plen 5                            #69 4.956279
        Num handles: 1
        Handle: 882 Address: C0:07:E8:2C:B6:EE (OUI C0-07-E8)
        Count: 1
zephyr.exe[1763243]: < ACL Data TX: Handle 882 [1/3] flags 0x00 dlen 21                                              #70 4.956406
      SMP: Pairing Random (0x04) len 16
        Random value[16]: 8e6108f966a694cbe26df70bb96773e6
> HCI Event: Number of Completed Packets (0x13) plen 5                                                               #71 4.995177
        Num handles: 1
        Handle: 882 Address: C0:07:E8:2C:B6:EE (OUI C0-07-E8)
        Count: 1
        Buffers: 0/3
        #70: len 21 (4 Kb/s)
        Latency: 38 msec (29-59 msec ~48 msec)
> ACL Data RX: Handle 882 flags 0x02 dlen 21                                                                         #72 5.065381
      SMP: Pairing Random (0x04) len 16
        Random value[16]: 6d8f67b92761390e0000000000000000
zephyr.exe[1763243]: < HCI Command: Host Number of Completed Packets (0x03|0x0035) plen 5                            #73 5.076163
        Num handles: 1
        Handle: 882 Address: C0:07:E8:2C:B6:EE (OUI C0-07-E8)
        Count: 1
zephyr.exe[1763243]: < ACL Data TX: Handle 882 [1/3] flags 0x00 dlen 21                                              #74 5.076456
      SMP: Pairing DHKey Check (0x0d) len 16
        E[16]: 035c31734cc393166066baa61b58749e
> HCI Event: Number of Completed Packets (0x13) plen 5                                                               #75 5.135191
        Num handles: 1
        Handle: 882 Address: C0:07:E8:2C:B6:EE (OUI C0-07-E8)
        Count: 1
        Buffers: 0/3
        #74: len 21 (2 Kb/s)
        Latency: 58 msec (29-59 msec ~53 msec)
> ACL Data RX: Handle 882 flags 0x02 dlen 21                                                                         #76 5.276090
      SMP: Pairing DHKey Check (0x0d) len 16
        E[16]: 6fc096f9700ae3463e8fd733fa7a8b7c
zephyr.exe[1763243]: < HCI Command: LE Start Encryption (0x08|0x0019) plen 28                                        #77 5.296092
        Handle: 882 Address: C0:07:E8:2C:B6:EE (OUI C0-07-E8)
        Random number: 0x0000000000000000
        Encrypted diversifier: 0x0000
        Long term key[16]: a1bb45f5570f9e71220747f666ac9233
> HCI Event: Command Status (0x0f) plen 4                                                                            #78 5.299134
      LE Start Encryption (0x08|0x0019) ncmd 1
        Status: Success (0x00)
zephyr.exe[1763243]: < HCI Command: Host Number of Completed Packets (0x03|0x0035) plen 5                            #79 5.316086
        Num handles: 1
        Handle: 882 Address: C0:07:E8:2C:B6:EE (OUI C0-07-E8)
        Count: 1
> HCI Event: Encryption Change (0x08) plen 4                                                                         #80 5.695144
        Status: Success (0x00)
        Handle: 882 Address: C0:07:E8:2C:B6:EE (OUI C0-07-E8)
        Encryption: Enabled with AES-CCM (0x01)
> ACL Data RX: Handle 882 flags 0x02 dlen 21                                                                         #81 5.765395
      SMP: Identity Information (0x08) len 16
        Identity resolving key[16]: 03166703f19456415e1a9e1ee85f6736
zephyr.exe[1763243]: < HCI Command: Host Number of Completed Packets (0x03|0x0035) plen 5                            #82 5.776129
        Num handles: 1
        Handle: 882 Address: C0:07:E8:2C:B6:EE (OUI C0-07-E8)
        Count: 1
> ACL Data RX: Handle 882 flags 0x02 dlen 12                                                                         #83 5.835261
      SMP: Identity Address Information (0x09) len 7
        Address: C0:07:E8:2C:B6:EE (OUI C0-07-E8)
zephyr.exe[1763243]: < HCI Command: LE Add Device To Resolving List (0x08|0x0027) plen 39                            #84 5.837510
        Address type: Public (0x00)
        Address: C0:07:E8:2C:B6:EE (OUI C0-07-E8)
        Peer identity resolving key[16]: 03166703f19456415e1a9e1ee85f6736
        Local identity resolving key[16]: 00000000000000000000000000000000
> HCI Event: Command Complete (0x0e) plen 4                                                                          #85 5.839065
      LE Add Device To Resolving List (0x08|0x0027) ncmd 1
        Status: Success (0x00)
zephyr.exe[1763243]: < ACL Data TX: Handle 882 [1/3] flags 0x00 dlen 13                                              #86 5.846226
      ATT: Find By Type Value Request (0x06) len 8
        Handle range: 0x0001-0xffff
        Attribute type: Primary Service (0x2800)
          UUID: Volume Control (0x1844)
zephyr.exe[1763243]: < HCI Command: LE Set Privacy Mode (0x08|0x004e) plen 8                                         #87 5.856222
        Peer Identity address type: Public (0x00)
        Peer Identity address: C0:07:E8:2C:B6:EE (OUI C0-07-E8)
        Privacy Mode: Use Device Privacy (0x01)
> HCI Event: Command Complete (0x0e) plen 4                                                                          #88 5.856970
      LE Set Privacy Mode (0x08|0x004e) ncmd 1
        Status: Success (0x00)
zephyr.exe[1763243]: < HCI Command: LE Set Address Resolution Enable (0x08|0x002d) plen 1                            #89 5.876217
        Address resolution: Enabled (0x01)
> HCI Event: Command Complete (0x0e) plen 4                                                                          #90 5.876792
      LE Set Address Resolution Enable (0x08|0x002d) ncmd 1
        Status: Success (0x00)
zephyr.exe[1763243]: < HCI Command: Host Number of Completed Packets (0x03|0x0035) plen 5                            #91 5.896088
        Num handles: 1
        Handle: 882 Address: C0:07:E8:2C:B6:EE (OUI C0-07-E8)
        Count: 1
zephyr.exe[1763243]: < ACL Data TX: Handle 882 [2/3] flags 0x00 dlen 21                                              #92 5.896248
      SMP: Signing Information (0x0a) len 16
        Signature key[16]: 5da095555cc64d02679f89a05211af56
> HCI Event: Number of Completed Packets (0x13) plen 5                                                               #93 5.905141
        Num handles: 1
        Handle: 882 Address: C0:07:E8:2C:B6:EE (OUI C0-07-E8)
        Count: 1
        Buffers: 1/3
        #86: len 13 (1 Kb/s)
        Latency: 58 msec (29-59 msec ~56 msec)
> HCI Event: Number of Completed Packets (0x13) plen 5                                                               #94 5.905642
        Num handles: 1
        Handle: 882 Address: C0:07:E8:2C:B6:EE (OUI C0-07-E8)
        Count: 1
        Buffers: 0/3
        #92: len 21 (18 Kb/s)
        Latency: 9 msec (9-59 msec ~32 msec)
> ACL Data RX: Handle 882 flags 0x02 dlen 9                                                                          #95 5.975161
      ATT: Find By Type Value Response (0x07) len 4
        Handle range: 0x00d0-0x00da
zephyr.exe[1763243]: < HCI Command: Host Number of Completed Packets (0x03|0x0035) plen 5                            #96 5.976280
        Num handles: 1
        Handle: 882 Address: C0:07:E8:2C:B6:EE (OUI C0-07-E8)
        Count: 1
zephyr.exe[1763243]: < ACL Data TX: Handle 882 [1/3] flags 0x00 dlen 11                                              #97 5.976420
      ATT: Read By Type Request (0x08) len 6
        Handle range: 0x00d1-0x00da
        Attribute type: Characteristic (0x2803)
> HCI Event: Number of Completed Packets (0x13) plen 5                                                               #98 6.115146
        Num handles: 1
        Handle: 882 Address: C0:07:E8:2C:B6:EE (OUI C0-07-E8)
        Count: 1
        Buffers: 0/3
        #97: len 11 (0 Kb/s)
        Latency: 138 msec (9-138 msec ~85 msec)
> ACL Data RX: Handle 882 flags 0x02 dlen 27                                                                         #99 6.185488
      ATT: Read By Type Response (0x09) len 22
        Attribute data length: 7
        Attribute data list: 3 entries
        Handle: 0x00d3
        Value[5]: 12d4007d2b
            Properties: 0x12
              Read (0x02)
              Notify (0x10)
            Value Handle: 0x00d4
            Value UUID: Volume State (0x2b7d)
        Handle: 0x00d6
        Value[5]: 12d7007f2b
            Properties: 0x12
              Read (0x02)
              Notify (0x10)
            Value Handle: 0x00d7
            Value UUID: Volume Flags (0x2b7f)
        Handle: 0x00d9
        Value[5]: 08da007e2b
            Properties: 0x08
              Write (0x08)
            Value Handle: 0x00da
            Value UUID: Volume Control Point (0x2b7e)
zephyr.exe[1763243]: < HCI Command: Host Number of Completed Packets (0x03|0x0035) plen 5                           #100 6.196433
        Num handles: 1
        Handle: 882 Address: C0:07:E8:2C:B6:EE (OUI C0-07-E8)
        Count: 1
zephyr.exe[1763243]: < ACL Data TX: Handle 882 [1/3] flags 0x00 dlen 9                                              #101 6.196616
      ATT: Find Information Request (0x04) len 4
        Handle range: 0x00d4-0x00da
> HCI Event: Number of Completed Packets (0x13) plen 5                                                              #102 6.255163
        Num handles: 1
        Handle: 882 Address: C0:07:E8:2C:B6:EE (OUI C0-07-E8)
        Count: 1
        Buffers: 0/3
        #101: len 9 (1 Kb/s)
        Latency: 58 msec (9-138 msec ~72 msec)
> ACL Data RX: Handle 882 flags 0x02 dlen 26                                                                        #103 6.325425
      ATT: Find Information Response (0x05) len 21
        Format: UUID-16 (0x01)
        Handle: 0x00d4
        UUID: Volume State (0x2b7d)
        Handle: 0x00d5
        UUID: Client Characteristic Configuration (0x2902)
        Handle: 0x00d6
        UUID: Characteristic (0x2803)
        Handle: 0x00d7
        UUID: Volume Flags (0x2b7f)
        Handle: 0x00d8
        UUID: Client Characteristic Configuration (0x2902)
zephyr.exe[1763243]: < HCI Command: Host Number of Completed Packets (0x03|0x0035) plen 5                           #104 6.336347
        Num handles: 1
        Handle: 882 Address: C0:07:E8:2C:B6:EE (OUI C0-07-E8)
        Count: 1
zephyr.exe[1763243]: < ACL Data TX: Handle 882 [1/3] flags 0x00 dlen 9                                              #105 6.336511
      ATT: Find Information Request (0x04) len 4
        Handle range: 0x00d7-0x00da
> HCI Event: Number of Completed Packets (0x13) plen 5                                                              #106 6.395167
        Num handles: 1
        Handle: 882 Address: C0:07:E8:2C:B6:EE (OUI C0-07-E8)
        Count: 1
        Buffers: 0/3
        #105: len 9 (1 Kb/s)
        Latency: 58 msec (9-138 msec ~65 msec)
> ACL Data RX: Handle 882 flags 0x02 dlen 22                                                                        #107 6.465435
      ATT: Find Information Response (0x05) len 17
        Format: UUID-16 (0x01)
        Handle: 0x00d7
        UUID: Volume Flags (0x2b7f)
        Handle: 0x00d8
        UUID: Client Characteristic Configuration (0x2902)
        Handle: 0x00d9
        UUID: Characteristic (0x2803)
        Handle: 0x00da
        UUID: Volume Control Point (0x2b7e)
zephyr.exe[1763243]: < HCI Command: Host Number of Completed Packets (0x03|0x0035) plen 5                           #108 6.476285
        Num handles: 1
        Handle: 882 Address: C0:07:E8:2C:B6:EE (OUI C0-07-E8)
        Count: 1
zephyr.exe[1763243]: < ACL Data TX: Handle 882 [1/3] flags 0x00 dlen 11                                             #109 6.476463
      ATT: Read By Type Request (0x08) len 6
        Handle range: 0x00da-0x00da
        Attribute type: Characteristic (0x2803)
> HCI Event: Number of Completed Packets (0x13) plen 5                                                              #110 6.535126
        Num handles: 1
        Handle: 882 Address: C0:07:E8:2C:B6:EE (OUI C0-07-E8)
        Count: 1
        Buffers: 0/3
        #109: len 11 (1 Kb/s)
        Latency: 58 msec (9-138 msec ~62 msec)
> ACL Data RX: Handle 882 flags 0x02 dlen 9                                                                         #111 6.605246
      ATT: Error Response (0x01) len 4
        Read By Type Request (0x08)
        Handle: 0x00da
        Error: Attribute Not Found (0x0a)
zephyr.exe[1763243]: < HCI Command: Host Number of Completed Packets (0x03|0x0035) plen 5                           #112 6.616305
        Num handles: 1
        Handle: 882 Address: C0:07:E8:2C:B6:EE (OUI C0-07-E8)
        Count: 1
zephyr.exe[1763243]: < ACL Data TX: Handle 882 [1/3] flags 0x00 dlen 9                                              #113 6.616600
      ATT: Write Request (0x12) len 4
        Handle: 0x00d5
          Data[2]: 0100
> HCI Event: Number of Completed Packets (0x13) plen 5                                                              #114 6.675162
        Num handles: 1
        Handle: 882 Address: C0:07:E8:2C:B6:EE (OUI C0-07-E8)
        Count: 1
        Buffers: 0/3
        #113: len 9 (1 Kb/s)
        Latency: 58 msec (9-138 msec ~60 msec)
> ACL Data RX: Handle 882 flags 0x02 dlen 5                                                                         #115 6.745262
      ATT: Write Response (0x13) len 0
zephyr.exe[1763243]: < HCI Command: Host Number of Completed Packets (0x03|0x0035) plen 5                           #116 6.756269
        Num handles: 1
        Handle: 882 Address: C0:07:E8:2C:B6:EE (OUI C0-07-E8)
        Count: 1
zephyr.exe[1763243]: < ACL Data TX: Handle 882 [1/3] flags 0x00 dlen 9                                              #117 6.756441
      ATT: Write Request (0x12) len 4
        Handle: 0x00d8
          Data[2]: 0100
> HCI Event: Number of Completed Packets (0x13) plen 5                                                              #118 6.815141
        Num handles: 1
        Handle: 882 Address: C0:07:E8:2C:B6:EE (OUI C0-07-E8)
        Count: 1
        Buffers: 0/3
        #117: len 9 (1 Kb/s)
        Latency: 58 msec (9-138 msec ~59 msec)
> ACL Data RX: Handle 882 flags 0x02 dlen 5                                                                         #119 6.885226
      ATT: Write Response (0x13) len 0
zephyr.exe[1763243]: < HCI Command: Host Number of Completed Packets (0x03|0x0035) plen 5                           #120 6.896331
        Num handles: 1
        Handle: 882 Address: C0:07:E8:2C:B6:EE (OUI C0-07-E8)
        Count: 1
zephyr.exe[1763243]: < ACL Data TX: Handle 882 [1/3] flags 0x00 dlen 11                                             #121 6.896504
      ATT: Read By Type Request (0x08) len 6
        Handle range: 0x00d1-0x00da
        Attribute type: Include (0x2802)
> HCI Event: Number of Completed Packets (0x13) plen 5                                                              #122 6.955138
        Num handles: 1
        Handle: 882 Address: C0:07:E8:2C:B6:EE (OUI C0-07-E8)
        Count: 1
        Buffers: 0/3
        #121: len 11 (1 Kb/s)
        Latency: 58 msec (9-138 msec ~59 msec)
> ACL Data RX: Handle 882 flags 0x02 dlen 22                                                                        #123 7.025364
      ATT: Read By Type Response (0x09) len 17
        Attribute data length: 8
        Attribute data list: 2 entries
        Handle: 0x00d1
        Value[6]: 10011f014318
        Handle: 0x00d2
        Value[6]: f000fb004518
zephyr.exe[1763243]: < HCI Command: Host Number of Completed Packets (0x03|0x0035) plen 5                           #124 7.036319
        Num handles: 1
        Handle: 882 Address: C0:07:E8:2C:B6:EE (OUI C0-07-E8)
        Count: 1
zephyr.exe[1763243]: < ACL Data TX: Handle 882 [1/3] flags 0x00 dlen 11                                             #125 7.036491
      ATT: Read By Type Request (0x08) len 6
        Handle range: 0x0110-0x011f
        Attribute type: Characteristic (0x2803)
> HCI Event: Number of Completed Packets (0x13) plen 5                                                              #126 7.095173
        Num handles: 1
        Handle: 882 Address: C0:07:E8:2C:B6:EE (OUI C0-07-E8)
        Count: 1
        Buffers: 0/3
        #125: len 11 (1 Kb/s)
        Latency: 58 msec (9-138 msec ~58 msec)
> ACL Data RX: Handle 882 flags 0x02 dlen 27                                                                        #127 7.165493
      ATT: Read By Type Response (0x09) len 22
        Attribute data length: 7
        Attribute data list: 3 entries
        Handle: 0x0111
        Value[5]: 121201772b
            Properties: 0x12
              Read (0x02)
              Notify (0x10)
            Value Handle: 0x0112
            Value UUID: Audio Input State (0x2b77)
        Handle: 0x0114
        Value[5]: 021501782b
            Properties: 0x02
              Read (0x02)
            Value Handle: 0x0115
            Value UUID: Gain Settings Attribute (0x2b78)
        Handle: 0x0116
        Value[5]: 021701792b
            Properties: 0x02
              Read (0x02)
            Value Handle: 0x0117
            Value UUID: Audio Input Type (0x2b79)
zephyr.exe[1763243]: < HCI Command: Host Number of Completed Packets (0x03|0x0035) plen 5                           #128 7.176303
        Num handles: 1
        Handle: 882 Address: C0:07:E8:2C:B6:EE (OUI C0-07-E8)
        Count: 1
zephyr.exe[1763243]: < ACL Data TX: Handle 882 [1/3] flags 0x00 dlen 9                                              #129 7.176466
      ATT: Write Request (0x12) len 4
        Handle: 0x0113
          Data[2]: 0100
> HCI Event: Number of Completed Packets (0x13) plen 5                                                              #130 7.235164
        Num handles: 1
        Handle: 882 Address: C0:07:E8:2C:B6:EE (OUI C0-07-E8)
        Count: 1
        Buffers: 0/3
        #129: len 9 (1 Kb/s)
        Latency: 58 msec (9-138 msec ~58 msec)
> ACL Data RX: Handle 882 flags 0x02 dlen 5                                                                         #131 7.305124
      ATT: Write Response (0x13) len 0
zephyr.exe[1763243]: < HCI Command: Host Number of Completed Packets (0x03|0x0035) plen 5                           #132 7.316283
        Num handles: 1
        Handle: 882 Address: C0:07:E8:2C:B6:EE (OUI C0-07-E8)
        Count: 1
zephyr.exe[1763243]: < ACL Data TX: Handle 882 [1/3] flags 0x00 dlen 11                                             #133 7.316795
      ATT: Read By Type Request (0x08) len 6
        Handle range: 0x0117-0x011f
        Attribute type: Characteristic (0x2803)
> HCI Event: Number of Completed Packets (0x13) plen 5                                                              #134 7.375090
        Num handles: 1
        Handle: 882 Address: C0:07:E8:2C:B6:EE (OUI C0-07-E8)
        Count: 1
        Buffers: 0/3
        #133: len 11 (1 Kb/s)
        Latency: 58 msec (9-138 msec ~58 msec)
> ACL Data RX: Handle 882 flags 0x02 dlen 27                                                                        #135 7.445483
      ATT: Read By Type Response (0x09) len 22
        Attribute data length: 7
        Attribute data list: 3 entries
        Handle: 0x0118
        Value[5]: 1219017a2b
            Properties: 0x12
              Read (0x02)
              Notify (0x10)
            Value Handle: 0x0119
            Value UUID: Audio Input Status (0x2b7a)
        Handle: 0x011b
        Value[5]: 081c017b2b
            Properties: 0x08
              Write (0x08)
            Value Handle: 0x011c
            Value UUID: Audio Input Control Point (0x2b7b)
        Handle: 0x011d
        Value[5]: 161e017c2b
            Properties: 0x16
              Read (0x02)
              Write Without Response (0x04)
              Notify (0x10)
            Value Handle: 0x011e
            Value UUID: Audio Input Description (0x2b7c)
zephyr.exe[1763243]: < HCI Command: Host Number of Completed Packets (0x03|0x0035) plen 5                           #136 7.456363
        Num handles: 1
        Handle: 882 Address: C0:07:E8:2C:B6:EE (OUI C0-07-E8)
        Count: 1
zephyr.exe[1763243]: < ACL Data TX: Handle 882 [1/3] flags 0x00 dlen 9                                              #137 7.456539
      ATT: Write Request (0x12) len 4
        Handle: 0x011a
          Data[2]: 0100
> HCI Event: Number of Completed Packets (0x13) plen 5                                                              #138 7.515088
        Num handles: 1
        Handle: 882 Address: C0:07:E8:2C:B6:EE (OUI C0-07-E8)
        Count: 1
        Buffers: 0/3
        #137: len 9 (1 Kb/s)
        Latency: 58 msec (9-138 msec ~58 msec)
> ACL Data RX: Handle 882 flags 0x02 dlen 5                                                                         #139 7.585244
      ATT: Write Response (0x13) len 0
zephyr.exe[1763243]: < HCI Command: Host Number of Completed Packets (0x03|0x0035) plen 5                           #140 7.596316
        Num handles: 1
        Handle: 882 Address: C0:07:E8:2C:B6:EE (OUI C0-07-E8)
        Count: 1
zephyr.exe[1763243]: < ACL Data TX: Handle 882 [1/3] flags 0x00 dlen 9                                              #141 7.596551
      ATT: Write Request (0x12) len 4
        Handle: 0x011f
          Data[2]: 0100
> HCI Event: Number of Completed Packets (0x13) plen 5                                                              #142 7.655116
        Num handles: 1
        Handle: 882 Address: C0:07:E8:2C:B6:EE (OUI C0-07-E8)
        Count: 1
        Buffers: 0/3
        #141: len 9 (1 Kb/s)
        Latency: 58 msec (9-138 msec ~58 msec)
> ACL Data RX: Handle 882 flags 0x02 dlen 5                                                                         #143 7.725126
      ATT: Write Response (0x13) len 0
zephyr.exe[1763243]: < HCI Command: Host Number of Completed Packets (0x03|0x0035) plen 5                           #144 7.736368
        Num handles: 1
        Handle: 882 Address: C0:07:E8:2C:B6:EE (OUI C0-07-E8)
        Count: 1
zephyr.exe[1763243]: < ACL Data TX: Handle 882 [1/3] flags 0x00 dlen 11                                             #145 7.736525
      ATT: Read By Type Request (0x08) len 6
        Handle range: 0x011e-0x011f
        Attribute type: Characteristic (0x2803)
> HCI Event: Number of Completed Packets (0x13) plen 5                                                              #146 7.795050
        Num handles: 1
        Handle: 882 Address: C0:07:E8:2C:B6:EE (OUI C0-07-E8)
        Count: 1
        Buffers: 0/3
        #145: len 11 (1 Kb/s)
        Latency: 58 msec (9-138 msec ~58 msec)
> ACL Data RX: Handle 882 flags 0x02 dlen 9                                                                         #147 7.865188
      ATT: Error Response (0x01) len 4
        Read By Type Request (0x08)
        Handle: 0x011e
        Error: Attribute Not Found (0x0a)
zephyr.exe[1763243]: < HCI Command: Host Number of Completed Packets (0x03|0x0035) plen 5                           #148 7.876309
        Num handles: 1
        Handle: 882 Address: C0:07:E8:2C:B6:EE (OUI C0-07-E8)
        Count: 1
zephyr.exe[1763243]: < ACL Data TX: Handle 882 [1/3] flags 0x00 dlen 11                                             #149 7.876552
      ATT: Read By Type Request (0x08) len 6
        Handle range: 0x00d2-0x00da
        Attribute type: Include (0x2802)
> HCI Event: Number of Completed Packets (0x13) plen 5                                                              #150 7.935139
        Num handles: 1
        Handle: 882 Address: C0:07:E8:2C:B6:EE (OUI C0-07-E8)
        Count: 1
        Buffers: 0/3
        #149: len 11 (1 Kb/s)
        Latency: 58 msec (9-138 msec ~58 msec)
> ACL Data RX: Handle 882 flags 0x02 dlen 14                                                                        #151 8.005223
      ATT: Read By Type Response (0x09) len 9
        Attribute data length: 8
        Attribute data list: 1 entry
        Handle: 0x00d2
        Value[6]: f000fb004518
zephyr.exe[1763243]: < HCI Command: Host Number of Completed Packets (0x03|0x0035) plen 5                           #152 8.016300
        Num handles: 1
        Handle: 882 Address: C0:07:E8:2C:B6:EE (OUI C0-07-E8)
        Count: 1
zephyr.exe[1763243]: < ACL Data TX: Handle 882 [1/3] flags 0x00 dlen 11                                             #153 8.016436
      ATT: Read By Type Request (0x08) len 6
        Handle range: 0x00f0-0x00fb
        Attribute type: Characteristic (0x2803)
> HCI Event: Number of Completed Packets (0x13) plen 5                                                              #154 8.075145
        Num handles: 1
        Handle: 882 Address: C0:07:E8:2C:B6:EE (OUI C0-07-E8)
        Count: 1
        Buffers: 0/3
        #153: len 11 (1 Kb/s)
        Latency: 58 msec (9-138 msec ~58 msec)
> ACL Data RX: Handle 882 flags 0x02 dlen 27                                                                        #155 8.145370
      ATT: Read By Type Response (0x09) len 22
        Attribute data length: 7
        Attribute data list: 3 entries
        Handle: 0x00f1
        Value[5]: 12f200802b
            Properties: 0x12
              Read (0x02)
              Notify (0x10)
            Value Handle: 0x00f2
            Value UUID: Offset State (0x2b80)
        Handle: 0x00f4
        Value[5]: 16f500812b
            Properties: 0x16
              Read (0x02)
              Write Without Response (0x04)
              Notify (0x10)
            Value Handle: 0x00f5
            Value UUID: Audio Location (0x2b81)
        Handle: 0x00f7
        Value[5]: 08f800822b
            Properties: 0x08
              Write (0x08)
            Value Handle: 0x00f8
            Value UUID: Volume Offset Control Point (0x2b82)
zephyr.exe[1763243]: < HCI Command: Host Number of Completed Packets (0x03|0x0035) plen 5                           #156 8.156286
        Num handles: 1
        Handle: 882 Address: C0:07:E8:2C:B6:EE (OUI C0-07-E8)
        Count: 1
zephyr.exe[1763243]: < ACL Data TX: Handle 882 [1/3] flags 0x00 dlen 9                                              #157 8.156542
      ATT: Write Request (0x12) len 4
        Handle: 0x00f3
          Data[2]: 0100
> HCI Event: Number of Completed Packets (0x13) plen 5                                                              #158 8.215052
        Num handles: 1
        Handle: 882 Address: C0:07:E8:2C:B6:EE (OUI C0-07-E8)
        Count: 1
        Buffers: 0/3
        #157: len 9 (1 Kb/s)
        Latency: 58 msec (9-138 msec ~58 msec)
> ACL Data RX: Handle 882 flags 0x02 dlen 5                                                                         #159 8.285151
      ATT: Write Response (0x13) len 0
zephyr.exe[1763243]: < HCI Command: Host Number of Completed Packets (0x03|0x0035) plen 5                           #160 8.296309
        Num handles: 1
        Handle: 882 Address: C0:07:E8:2C:B6:EE (OUI C0-07-E8)
        Count: 1
zephyr.exe[1763243]: < ACL Data TX: Handle 882 [1/3] flags 0x00 dlen 9                                              #161 8.296470
      ATT: Write Request (0x12) len 4
        Handle: 0x00f6
          Data[2]: 0100
> HCI Event: Number of Completed Packets (0x13) plen 5                                                              #162 8.355085
        Num handles: 1
        Handle: 882 Address: C0:07:E8:2C:B6:EE (OUI C0-07-E8)
        Count: 1
        Buffers: 0/3
        #161: len 9 (1 Kb/s)
        Latency: 58 msec (9-138 msec ~58 msec)
> ACL Data RX: Handle 882 flags 0x02 dlen 5                                                                         #163 8.425161
      ATT: Write Response (0x13) len 0
zephyr.exe[1763243]: < HCI Command: Host Number of Completed Packets (0x03|0x0035) plen 5                           #164 8.436258
        Num handles: 1
        Handle: 882 Address: C0:07:E8:2C:B6:EE (OUI C0-07-E8)
        Count: 1
zephyr.exe[1763243]: < ACL Data TX: Handle 882 [1/3] flags 0x00 dlen 11                                             #165 8.436442
      ATT: Read By Type Request (0x08) len 6
        Handle range: 0x00f8-0x00fb
        Attribute type: Characteristic (0x2803)
> HCI Event: Number of Completed Packets (0x13) plen 5                                                              #166 8.495164
        Num handles: 1
        Handle: 882 Address: C0:07:E8:2C:B6:EE (OUI C0-07-E8)
        Count: 1
        Buffers: 0/3
        #165: len 11 (1 Kb/s)
        Latency: 58 msec (9-138 msec ~58 msec)
> ACL Data RX: Handle 882 flags 0x02 dlen 13                                                                        #167 8.565236
      ATT: Read By Type Response (0x09) len 8
        Attribute data length: 7
        Attribute data list: 1 entry
        Handle: 0x00f9
        Value[5]: 16fa00832b
            Properties: 0x16
              Read (0x02)
              Write Without Response (0x04)
              Notify (0x10)
            Value Handle: 0x00fa
            Value UUID: Audio Output Description (0x2b83)
zephyr.exe[1763243]: < HCI Command: Host Number of Completed Packets (0x03|0x0035) plen 5                           #168 8.576341
        Num handles: 1
        Handle: 882 Address: C0:07:E8:2C:B6:EE (OUI C0-07-E8)
        Count: 1
zephyr.exe[1763243]: < ACL Data TX: Handle 882 [1/3] flags 0x00 dlen 9                                              #169 8.576517
      ATT: Write Request (0x12) len 4
        Handle: 0x00fb
          Data[2]: 0100
> HCI Event: Number of Completed Packets (0x13) plen 5                                                              #170 8.635057
        Num handles: 1
        Handle: 882 Address: C0:07:E8:2C:B6:EE (OUI C0-07-E8)
        Count: 1
        Buffers: 0/3
        #169: len 9 (1 Kb/s)
        Latency: 58 msec (9-138 msec ~58 msec)
> ACL Data RX: Handle 882 flags 0x02 dlen 5                                                                         #171 8.705095
      ATT: Write Response (0x13) len 0
zephyr.exe[1763243]: < HCI Command: Host Number of Completed Packets (0x03|0x0035) plen 5                           #172 8.716319
        Num handles: 1
        Handle: 882 Address: C0:07:E8:2C:B6:EE (OUI C0-07-E8)
        Count: 1
zephyr.exe[1763243]: < ACL Data TX: Handle 882 [1/3] flags 0x00 dlen 11                                             #173 8.716504
      ATT: Read By Type Request (0x08) len 6
        Handle range: 0x00fa-0x00fb
        Attribute type: Characteristic (0x2803)
> HCI Event: Number of Completed Packets (0x13) plen 5                                                              #174 8.775058
        Num handles: 1
        Handle: 882 Address: C0:07:E8:2C:B6:EE (OUI C0-07-E8)
        Count: 1
        Buffers: 0/3
        #173: len 11 (1 Kb/s)
        Latency: 58 msec (9-138 msec ~58 msec)
> ACL Data RX: Handle 882 flags 0x02 dlen 9                                                                         #175 8.845123
      ATT: Error Response (0x01) len 4
        Read By Type Request (0x08)
        Handle: 0x00fa
        Error: Attribute Not Found (0x0a)
zephyr.exe[1763243]: < HCI Command: Host Number of Completed Packets (0x03|0x0035) plen 5                           #176 8.856300
        Num handles: 1
        Handle: 882 Address: C0:07:E8:2C:B6:EE (OUI C0-07-E8)
        Count: 1
zephyr.exe[1763243]: < ACL Data TX: Handle 882 [1/3] flags 0x00 dlen 11                                             #177 8.856464
      ATT: Read By Type Request (0x08) len 6
        Handle range: 0x00d3-0x00da
        Attribute type: Include (0x2802)
> HCI Event: Number of Completed Packets (0x13) plen 5                                                              #178 8.915072
        Num handles: 1
        Handle: 882 Address: C0:07:E8:2C:B6:EE (OUI C0-07-E8)
        Count: 1
        Buffers: 0/3
        #177: len 11 (1 Kb/s)
        Latency: 58 msec (9-138 msec ~58 msec)
> ACL Data RX: Handle 882 flags 0x02 dlen 9                                                        