Bluetooth monitor ver 5.72
= Note: Linux version 6.14.0-36-generic (x86_64)                       0.981037
= Note: Bluetooth subsystem version 2.22                               0.981039
= New Index: 00:00:00:00:00:00 (Primary,UART,hci1)              [hci1] 0.981040
= New Index: 48:5F:99:8E:E0:64 (Primary,USB,hci0)               [hci0] 0.981040
= Open Index: 00:00:00:00:00:00                                 [hci1] 1.494938
= Index Info: 00:00:00:00:00:00 (Nordic Semiconductor ASA)      [hci1] 1.494956
@ USER Open: main (privileged) version 2.22            {0x0001} [hci1] 1.494966
< HCI Command: Reset (0x03|0x0003) plen 0                    #1 [hci1] 1.496212
> HCI Event: Command Complete (0x0e) plen 4                  #2 [hci1] 1.496836
      Reset (0x03|0x0003) ncmd 1
        Status: Success (0x00)
< HCI Command: Read Local Supported... (0x04|0x0003) plen 0  #3 [hci1] 1.514339
> HCI Event: Command Complete (0x0e) plen 12                 #4 [hci1] 1.514824
      Read Local Supported Features (0x04|0x0003) ncmd 1
        Status: Success (0x00)
        Features: 0x00 0x00 0x00 0x00 0x60 0x00 0x00 0x00
          BR/EDR Not Supported
          LE Supported (Controller)
< HCI Command: Read Local Version In.. (0x04|0x0001) plen 0  #5 [hci1] 1.534320
> HCI Event: Command Complete (0x0e) plen 12                 #6 [hci1] 1.534969
      Read Local Version Information (0x04|0x0001) ncmd 1
        Status: Success (0x00)
        HCI version: Reserved (0x0f) - Revision 12393 (0x3069)
        LMP version: Reserved (0x0f) - Subversion 12393 (0x3069)
        Manufacturer: Nordic Semiconductor ASA (89)
< HCI Command: Read Local Supported... (0x04|0x0002) plen 0  #7 [hci1] 1.554319
> HCI Event: Command Complete (0x0e) plen 68                 #8 [hci1] 1.555390
      Read Local Supported Commands (0x04|0x0002) ncmd 1
        Status: Success (0x00)
        Commands: 119 entries
          Disconnect (Octet 0 - Bit 5)
          Read Remote Version Information (Octet 2 - Bit 7)
          Set Event Mask (Octet 5 - Bit 6)
          Reset (Octet 5 - Bit 7)
          Read Connection Accept Timeout (Octet 7 - Bit 2)
          Write Connection Accept Timeout (Octet 7 - Bit 3)
          Read Transmit Power Level (Octet 10 - Bit 2)
          Set Controller To Host Flow Control (Octet 10 - Bit 5)
          Host Buffer Size (Octet 10 - Bit 6)
          Host Number of Completed Packets (Octet 10 - Bit 7)
          Read Local Version Information (Octet 14 - Bit 3)
          Read Local Supported Features (Octet 14 - Bit 5)
          Read BD ADDR (Octet 15 - Bit 1)
          Read RSSI (Octet 15 - Bit 5)
          Set Event Mask Page 2 (Octet 22 - Bit 2)
          LE Set Event Mask (Octet 25 - Bit 0)
          LE Read Buffer Size (Octet 25 - Bit 1)
          LE Read Local Supported Features (Octet 25 - Bit 2)
          LE Set Random Address (Octet 25 - Bit 4)
          LE Set Advertising Parameters (Octet 25 - Bit 5)
          LE Read Advertising Channel TX Power (Octet 25 - Bit 6)
          LE Set Advertising Data (Octet 25 - Bit 7)
          LE Set Scan Response Data (Octet 26 - Bit 0)
          LE Set Advertise Enable (Octet 26 - Bit 1)
          LE Set Scan Parameters (Octet 26 - Bit 2)
          LE Set Scan Enable (Octet 26 - Bit 3)
          LE Create Connection (Octet 26 - Bit 4)
          LE Create Connection Cancel (Octet 26 - Bit 5)
          LE Read Accept List Size (Octet 26 - Bit 6)
          LE Clear Accept List (Octet 26 - Bit 7)
          LE Add Device To Accept List (Octet 27 - Bit 0)
          LE Remove Device From Accept List (Octet 27 - Bit 1)
          LE Connection Update (Octet 27 - Bit 2)
          LE Set Host Channel Classification (Octet 27 - Bit 3)
          LE Read Channel Map (Octet 27 - Bit 4)
          LE Read Remote Used Features (Octet 27 - Bit 5)
          LE Encrypt (Octet 27 - Bit 6)
          LE Rand (Octet 27 - Bit 7)
          LE Start Encryption (Octet 28 - Bit 0)
          LE Long Term Key Request Reply (Octet 28 - Bit 1)
          LE Long Term Key Request Neg Reply (Octet 28 - Bit 2)
          LE Read Supported States (Octet 28 - Bit 3)
          LE Receiver Test (Octet 28 - Bit 4)
          LE Transmitter Test (Octet 28 - Bit 5)
          LE Test End (Octet 28 - Bit 6)
          Read Authenticated Payload Timeout (Octet 32 - Bit 4)
          Write Authenticated Payload Timeout (Octet 32 - Bit 5)
          LE Set Data Length (Octet 33 - Bit 6)
          LE Read Suggested Default Data Length (Octet 33 - Bit 7)
          LE Write Suggested Default Data Length (Octet 34 - Bit 0)
          LE Add Device To Resolving List (Octet 34 - Bit 3)
          LE Remove Device From Resolving List (Octet 34 - Bit 4)
          LE Clear Resolving List (Octet 34 - Bit 5)
          LE Read Resolving List Size (Octet 34 - Bit 6)
          LE Set Address Resolution Enable (Octet 35 - Bit 1)
          LE Set Resolvable Private Address Timeout (Octet 35 - Bit 2)
          LE Read Maximum Data Length (Octet 35 - Bit 3)
          LE Read PHY (Octet 35 - Bit 4)
          LE Set Default PHY (Octet 35 - Bit 5)
          LE Set PHY (Octet 35 - Bit 6)
          LE Enhanced Receiver Test (Octet 35 - Bit 7)
          LE Enhanced Transmitter Test (Octet 36 - Bit 0)
          LE Set Advertising Set Random Address (Octet 36 - Bit 1)
          LE Set Extended Advertising Parameters (Octet 36 - Bit 2)
          LE Set Extended Advertising Data (Octet 36 - Bit 3)
          LE Set Extended Scan Response Data (Octet 36 - Bit 4)
          LE Set Extended Advertising Enable (Octet 36 - Bit 5)
          LE Read Maximum Advertising Data Length (Octet 36 - Bit 6)
          LE Read Number of Supported Advertising Sets (Octet 36 - Bit 7)
          LE Remove Advertising Set (Octet 37 - Bit 0)
          LE Clear Advertising Sets (Octet 37 - Bit 1)
          LE Set Periodic Advertising Parameters (Octet 37 - Bit 2)
          LE Set Periodic Advertising Data (Octet 37 - Bit 3)
          LE Set Periodic Advertising Enable (Octet 37 - Bit 4)
          LE Set Extended Scan Parameters (Octet 37 - Bit 5)
          LE Set Extended Scan Enable (Octet 37 - Bit 6)
          LE Extended Create Connection (Octet 37 - Bit 7)
          LE Periodic Advertising Create Sync (Octet 38 - Bit 0)
          LE Periodic Advertising Create Sync Cancel (Octet 38 - Bit 1)
          LE Periodic Advertising Terminate Sync (Octet 38 - Bit 2)
          LE Add Device To Periodic Advertiser List (Octet 38 - Bit 3)
          LE Remove Device From Periodic Advertiser List (Octet 38 - Bit 4)
          LE Clear Periodic Advertiser List (Octet 38 - Bit 5)
          LE Read Periodic Advertiser List Size (Octet 38 - Bit 6)
          LE Read Transmit Power (Octet 38 - Bit 7)
          LE Read RF Path Compensation (Octet 39 - Bit 0)
          LE Write RF Path Compensation (Octet 39 - Bit 1)
          LE Set Privacy Mode (Octet 39 - Bit 2)
          LE Periodic Advertising Receive Enable (Octet 40 - Bit 5)
          LE Periodic Advertising Sync Transfer (Octet 40 - Bit 6)
          LE Periodic Advertising Set Info Transfer (Octet 40 - Bit 7)
          LE Periodic Advertising Sync Transfer Parameters (Octet 41 - Bit 0)
          LE Set Default Periodic Advertisng Sync Transfer Parameters (Octet 41 - Bit 1)
          LE Read Buffer v2 (Octet 41 - Bit 5)
          LE Read ISO TX Sync (Octet 41 - Bit 6)
          LE Set Connected Isochronous Group Parameters (Octet 41 - Bit 7)
          LE Set Connected Isochronous Group Parameters Test (Octet 42 - Bit 0)
          LE Create Connected Isochronous Stream (Octet 42 - Bit 1)
          LE Remove Connected Isochronous Group (Octet 42 - Bit 2)
          LE Accept Connected Isochronous Stream Request (Octet 42 - Bit 3)
          LE Reject Connected Isochronous Stream Request (Octet 42 - Bit 4)
          LE Create Broadcast Isochronous Group (Octet 42 - Bit 5)
          LE Create Broadcast Isochronous Group Test (Octet 42 - Bit 6)
          LE Terminate Broadcast Isochronous Group (Octet 42 - Bit 7)
          LE Broadcast Isochronous Group Create Sync (Octet 43 - Bit 0)
          LE Broadcast Isochronous Group Terminate Sync (Octet 43 - Bit 1)
          LE Request Peer SCA (Octet 43 - Bit 2)
          LE Setup Isochronous Data Path (Octet 43 - Bit 3)
          LE Remove Isochronous Data Path (Octet 43 - Bit 4)
          LE Isochronous Transmit Test (Octet 43 - Bit 5)
          LE Isochronous Receive Test (Octet 43 - Bit 6)
          LE Isochronous Read Test Counters (Octet 43 - Bit 7)
          LE Isochronous Read Test Counters (Octet 44 - Bit 0)
          LE Set Host Feature (Octet 44 - Bit 1)
          Octet 44 - Bit 2 
          Octet 45 - Bit 6 
          Octet 46 - Bit 0 
          Octet 46 - Bit 1 
          Octet 46 - Bit 2 
< HCI Command: Host Buffer Size (0x03|0x0033) plen 7         #9 [hci1] 1.574337
        ACL MTU: 255  ACL max packet: 16
        SCO MTU: 0    SCO max packet: 0
> HCI Event: Command Complete (0x0e) plen 4                 #10 [hci1] 1.574842
      Host Buffer Size (0x03|0x0033) ncmd 1
        Status: Success (0x00)
< HCI Command: Set Controller To Ho.. (0x03|0x0031) plen 1  #11 [hci1] 1.594292
        Flow control: ACL Data Packets (0x01)
> HCI Event: Command Complete (0x0e) plen 4                 #12 [hci1] 1.594737
      Set Controller To Host Flow Control (0x03|0x0031) ncmd 1
        Status: Success (0x00)
< HCI Command: LE Read Local Suppor.. (0x08|0x0003) plen 0  #13 [hci1] 1.614315
> HCI Event: Command Complete (0x0e) plen 12                #14 [hci1] 1.614984
      LE Read Local Supported Features (0x08|0x0003) ncmd 1
        Status: Success (0x00)
        Features: 0xfd 0x79 0x00 0xf7 0x30 0x01 0x00 0x00
          LE Encryption
          Extended Reject Indication
          Peripheral-initiated Features Exchange
          LE Ping
          LE Data Packet Length Extension
          LL Privacy
          Extended Scanner Filter Policies
          LE 2M PHY
          LE Coded PHY
          LE Extended Advertising
          LE Periodic Advertising
          Channel Selection Algorithm #2
          Periodic Advertising Sync Transfer - Sender
          Periodic Advertising Sync Transfer - Recipient
          Sleep Clock Accuracy Updates
          Connected Isochronous Stream - Central
          Connected Isochronous Stream - Peripheral
          Isochronous Broadcaster
          Synchronized Receiver
          Periodic Advertising ADI support
          Connection Subrating
          Unknown features (0x0000010000000000)
< HCI Command: LE Set Host Feature (0x08|0x0074) plen 2     #15 [hci1] 1.634290
        Bit Number: 32
          Connected Isochronous Stream (Host Support)
        Bit Value: 1
> HCI Event: Command Complete (0x0e) plen 4                 #16 [hci1] 1.634832
      LE Set Host Feature (0x08|0x0074) ncmd 1
        Status: Success (0x00)
< HCI Command: LE Read Buffer v2 (0x08|0x0060) plen 0       #17 [hci1] 1.654288
> HCI Event: Command Complete (0x0e) plen 10                #18 [hci1] 1.654768
      LE Read Buffer v2 (0x08|0x0060) ncmd 1
        Status: Success (0x00)
        ACL MTU: 27
        ACL max packet: 3
        ISO MTU: 318
        ISO max packet: 3
< HCI Command: LE Read Maximum Adve.. (0x08|0x003a) plen 0  #19 [hci1] 1.674264
> HCI Event: Command Complete (0x0e) plen 6                 #20 [hci1] 1.674743
      LE Read Maximum Advertising Data Length (0x08|0x003a) ncmd 1
        Status: Success (0x00)
        Max length: 1650
< HCI Command: LE Read Supported St.. (0x08|0x001c) plen 0  #21 [hci1] 1.694338
> HCI Event: Command Complete (0x0e) plen 12                #22 [hci1] 1.694824
      LE Read Supported States (0x08|0x001c) ncmd 1
        Status: Success (0x00)
        States: 0x000003ff3e0306ff
          Non-connectable Advertising State
          Scannable Advertising State
          Connectable Advertising State
          High Duty Cycle Directed Advertising State
          Passive Scanning State
          Active Scanning State
          Initiating State
            and Connection State (Central Role)
          Connection State (Peripheral Role)
          Scannable Advertising State
            and Passive Scanning State
          Connectable Advertising State
            and Passive Scanning State
          Non-connectable Advertising State
            and Initiating State
          Scannable Advertising State
            and Initiating State
          Active Scanning State
            and Connection State (Central Role)
          Passive Scanning State
            and Connection State (Peripheral Role)
          Active Scanning State
            and Connection State (Peripheral Role)
          Initiating State
            and Connection State (Central Role)
            and Central Role & Central Role
          Low Duty Cycle Directed Advertising State
          Connectable Advertising State
            and Initiating State
            and Central Role & Peripheral Role
          High Duty Cycle Directed Advertising State
            and Initiating State
            and Central Role & Peripheral Role
          Low Duty Cycle Directed Advertising State
            and Initiating State
            and Central Role & Peripheral Role
          Connectable Advertising State
            and Connection State (Central Role)
            and Central Role & Peripheral Role
          High Duty Cycle Directed Advertising State
            and Connection State (Central Role)
            and Central Role & Peripheral Role
          Low Duty Cycle Directed Advertising State
            and Connection State (Central Role)
            and Central Role & Peripheral Role
          Connectable Advertising State
            and Connection State (Peripheral Role)
            and Central Role & Peripheral Role
          High Duty Cycle Directed Advertising State
            and Connection State (Peripheral Role)
            and Peripheral Role & Peripheral Role
          Low Duty Cycle Directed Advertising State
            and Connection State (Peripheral Role)
            and Peripheral Role & Peripheral Role
          Initiating State
            and Connection State (Peripheral Role)
            and Central Role & Peripheral Role
< HCI Command: LE Read Maximum Data.. (0x08|0x002f) plen 0  #23 [hci1] 1.714287
> HCI Event: Command Complete (0x0e) plen 12                #24 [hci1] 1.714865
      LE Read Maximum Data Length (0x08|0x002f) ncmd 1
        Status: Success (0x00)
        Max TX octets: 251
        Max TX time: 2704
        Max RX octets: 251
        Max RX time: 2704
< HCI Command: LE Write Suggested D.. (0x08|0x0024) plen 4  #25 [hci1] 1.734324
        TX octets: 251
        TX time: 2704
> HCI Event: Command Complete (0x0e) plen 4                 #26 [hci1] 1.734834
      LE Write Suggested Default Data Length (0x08|0x0024) ncmd 1
        Status: Success (0x00)
< HCI Command: LE Read Resolving Li.. (0x08|0x002a) plen 0  #27 [hci1] 1.754347
> HCI Event: Command Complete (0x0e) plen 5                 #28 [hci1] 1.754790
      LE Read Resolving List Size (0x08|0x002a) ncmd 1
        Status: Success (0x00)
        Size: 8
< HCI Command: LE Set Event Mask (0x08|0x0001) plen 8       #29 [hci1] 1.774350
        Mask: 0x000002023f87fa5e
          LE Advertising Report
          LE Connection Update Complete
          LE Read Remote Used Features Complete
          LE Long Term Key Request
          LE Data Length Change
          LE Enhanced Connection Complete
          LE PHY Update Complete
          LE Extended Advertising Report
          LE Periodic Advertising Sync Established
          LE Periodic Advertising Report
          LE Periodic Advertising Sync Lost
          LE Extended Scan Timeout
          LE Extended Advertising Set Terminated
          LE Scan Request Received
          LE Periodic Advertising Sync Transfer Rvc
          LE CIS Established
          LE CIS Request
          LE Create BIG Complete
          LE Terminate BIG Complete
          LE BIG Sync Estabilished Complete
          LE BIG Sync Lost
          LE BIG Info Advertising Report
          Unknown mask (0x0000020000000000)
> HCI Event: Command Complete (0x0e) plen 4                 #30 [hci1] 1.774822
      LE Set Event Mask (0x08|0x0001) ncmd 1
        Status: Success (0x00)
< HCI Command: Set Event Mask (0x03|0x0001) plen 8          #31 [hci1] 1.794328
        Mask: 0x2000800002008890
          Disconnection Complete
          Encryption Change
          Read Remote Version Information Complete
          Hardware Error
          Data Buffer Overflow
          Encryption Key Refresh Complete
          LE Meta
> HCI Event: Command Complete (0x0e) plen 4                 #32 [hci1] 1.794906
      Set Event Mask (0x03|0x0001) ncmd 1
        Status: Success (0x00)
< HCI Command: Read BD ADDR (0x04|0x0009) plen 0            #33 [hci1] 1.814330
> HCI Event: Command Complete (0x0e) plen 10                #34 [hci1] 1.814822
      Read BD ADDR (0x04|0x0009) ncmd 1
        Status: Success (0x00)
        Address: 00:00:00:00:00:00 (OUI 00-00-00)
< HCI Command: LE Set Random Address (0x08|0x0005) plen 6   #35 [hci1] 1.834384
        Address: D5:B6:CC:31:DB:3B (Static)
> HCI Event: Command Complete (0x0e) plen 4                 #36 [hci1] 1.834957
      LE Set Random Address (0x08|0x0005) ncmd 1
        Status: Success (0x00)
< HCI Command: LE Set Extended Adv.. (0x08|0x0036) plen 25  #37 [hci1] 4.314882
        Handle: 0x00
        Properties: 0x0013
          Connectable
          Scannable
          Use legacy advertising PDUs: ADV_IND
        Min advertising interval: 100.000 msec (0x00a0)
        Max advertising interval: 150.000 msec (0x00f0)
        Channel map: 37, 38, 39 (0x07)
        Own address type: Random (0x01)
        Peer address type: Public (0x00)
        Peer address: 00:00:00:00:00:00 (OUI 00-00-00)
        Filter policy: Allow Scan Request from Any, Allow Connect Request from Any (0x00)
        TX power: Host has no preference (0x7f)
        Primary PHY: LE 1M (0x01)
        Secondary max skip: 0x00
        Secondary PHY: LE 1M (0x01)
        SID: 0x00
        Scan request notifications: Disabled (0x00)
> HCI Event: Command Complete (0x0e) plen 5                 #38 [hci1] 4.315819
      LE Set Extended Advertising Parameters (0x08|0x0036) ncmd 1
        Status: Success (0x00)
        TX power (selected): 0 dbm (0x00)
< HCI Command: LE Set Advertising S.. (0x08|0x0035) plen 7  #39 [hci1] 4.334413
        Advertising handle: 0x00
        Advertising random address: D5:B6:CC:31:DB:3B (Static)
> HCI Event: Command Complete (0x0e) plen 4                 #40 [hci1] 4.335047
      LE Set Advertising Set Random Address (0x08|0x0035) ncmd 1
        Status: Success (0x00)
< HCI Command: LE Set Extended Adv.. (0x08|0x0037) plen 22  #41 [hci1] 4.354328
        Handle: 0x00
        Operation: Complete extended advertising data (0x03)
        Fragment preference: Minimize fragmentation (0x01)
        Data length: 0x12
        Flags: 0x06
          LE General Discoverable Mode
          BR/EDR Not Supported
        Name (complete): Tester_F6B11A
> HCI Event: Command Complete (0x0e) plen 4                 #42 [hci1] 4.355099
      LE Set Extended Advertising Data (0x08|0x0037) ncmd 1
        Status: Success (0x00)
< HCI Command: LE Set Extended Scan.. (0x08|0x0038) plen 4  #43 [hci1] 4.374347
        Handle: 0x00
        Operation: Complete scan response data (0x03)
        Fragment preference: Minimize fragmentation (0x01)
        Data length: 0x00
> HCI Event: Command Complete (0x0e) plen 4                 #44 [hci1] 4.374795
      LE Set Extended Scan Response Data (0x08|0x0038) ncmd 1
        Status: Success (0x00)
< HCI Command: LE Set Extended Adve.. (0x08|0x0039) plen 6  #45 [hci1] 4.394370
        Extended advertising: Enabled (0x01)
        Number of sets: 1 (0x01)
        Entry 0
          Handle: 0x00
          Duration: 0 ms (0x00)
          Max ext adv events: 0
> HCI Event: Command Complete (0x0e) plen 4                 #46 [hci1] 4.395006
      LE Set Extended Advertising Enable (0x08|0x0039) ncmd 1
        Status: Success (0x00)
> HCI Event: LE Meta Event (0x3e) plen 31                   #47 [hci1] 4.501353
      LE Enhanced Connection Complete (0x0a)
        Status: Success (0x00)
        Handle: 111
        Role: Peripheral (0x01)
        Peer address type: Public (0x00)
        Peer address: DF:A9:FF:F6:B1:1A (OUI DF-A9-FF)
        Local resolvable private address: 00:00:00:00:00:00 (Non-Resolvable)
        Peer resolvable private address: 00:00:00:00:00:00 (Non-Resolvable)
        Connection interval: 87.50 msec (0x0046)
        Connection latency: 0 (0x0000)
        Supervision timeout: 25120 msec (0x09d0)
        Central clock accuracy: 0x01
> HCI Event: LE Meta Event (0x3e) plen 6                    #48 [hci1] 4.501445
      LE Advertising Set Terminated (0x12)
        Status: Success (0x00)
        Handle: 0
        Connection handle: 111
        Number of completed extended advertising events: 0
< HCI Command: LE Read Remote Used... (0x08|0x0016) plen 2  #49 [hci1] 4.515445
        Handle: 111 Address: DF:A9:FF:F6:B1:1A (OUI DF-A9-FF)
< ACL Data TX: Handle 111 flags 0x00 dlen 7                 #50 [hci1] 4.515469
      ATT: Exchange MTU Request (0x02) len 2
        Client RX MTU: 251
> HCI Event: Command Status (0x0f) plen 4                   #51 [hci1] 4.516029
      LE Read Remote Used Features (0x08|0x0016) ncmd 1
        Status: Success (0x00)
> HCI Event: Number of Completed Packets (0x13) plen 5      #52 [hci1] 4.677275
        Num handles: 1
        Handle: 111 Address: DF:A9:FF:F6:B1:1A (OUI DF-A9-FF)
        Count: 1
        #50: len 7 (0 Kb/s)
        Latency: 161 msec (161-161 msec ~161 msec)
> HCI Event: LE Meta Event (0x3e) plen 12                   #53 [hci1] 4.765089
      LE Read Remote Used Features (0x04)
        Status: Success (0x00)
        Handle: 111 Address: DF:A9:FF:F6:B1:1A (OUI DF-A9-FF)
        Features: 0x2d 0x49 0x00 0xf7 0x67 0xd8 0x00 0x00
          LE Encryption
          Extended Reject Indication
          Peripheral-initiated Features Exchange
          LE Data Packet Length Extension
          LE 2M PHY
          LE Coded PHY
          Channel Selection Algorithm #2
          Periodic Advertising Sync Transfer - Sender
          Periodic Advertising Sync Transfer - Recipient
          Sleep Clock Accuracy Updates
          Connected Isochronous Stream - Central
          Connected Isochronous Stream - Peripheral
          Isochronous Broadcaster
          Synchronized Receiver
          Connected Isochronous Stream (Host Support)
          LE Power Control Request
          LE Power Control Request
          Connection Subrating
          Connection Subrating (Host Support)
          Unknown features (0x0000d80000000000)
> ACL Data RX: Handle 111 flags 0x02 dlen 11                #54 [hci1] 7.214804
      SMP: Pairing Request (0x01) len 6
        IO capability: KeyboardDisplay (0x04)
        OOB data: Authentication data not present (0x00)
        Authentication requirement: Bonding, MITM, SC, No Keypresses (0x0d)
        Max encryption key size: 16
        Initiator key distribution: EncKey IdKey (0x03)
        Responder key distribution: EncKey IdKey Sign (0x07)
> ACL Data RX: Handle 111 flags 0x02 dlen 7                 #55 [hci1] 7.215174
      ATT: Exchange MTU Response (0x03) len 2
        Server RX MTU: 23
< HCI Command: Host Number of Compl.. (0x03|0x0035) plen 5  #56 [hci1] 7.234886
        Num handles: 1
        Handle: 111 Address: DF:A9:FF:F6:B1:1A (OUI DF-A9-FF)
        Count: 1
< ACL Data TX: Handle 111 flags 0x00 dlen 11                #57 [hci1] 7.235121
      SMP: Pairing Response (0x02) len 6
        IO capability: DisplayOnly (0x00)
        OOB data: Authentication data not present (0x00)
        Authentication requirement: Bonding, No MITM, SC, No Keypresses (0x09)
        Max encryption key size: 16
        Initiator key distribution: IdKey (0x02)
        Responder key distribution: <none> (0x00)
< HCI Command: Host Number of Compl.. (0x03|0x0035) plen 5  #58 [hci1] 7.235275
        Num handles: 1
        Handle: 111 Address: DF:A9:FF:F6:B1:1A (OUI DF-A9-FF)
        Count: 1
> HCI Event: Number of Completed Packets (0x13) plen 5      #59 [hci1] 7.389965
        Num handles: 1
        Handle: 111 Address: DF:A9:FF:F6:B1:1A (OUI DF-A9-FF)
        Count: 1
        #57: len 11 (0 Kb/s)
        Latency: 154 msec (154-161 msec ~158 msec)
> ACL Data RX: Handle 111 flags 0x02 dlen 27                #60 [hci1] 7.390176
> ACL Data RX: Handle 111 flags 0x01 dlen 27                #61 [hci1] 7.390656
> ACL Data RX: Handle 111 flags 0x01 dlen 15                #62 [hci1] 7.391142
      SMP: Pairing Public Key (0x0c) len 64
        X: 99c5306dc12099603ad480ffd50f3fa741007957020590aa3ebb32e1128383ca
        Y: 63d4eb998ec75df9c1dfd82690a29ba4d666d52516c0877285d323764ec3a477
< HCI Command: Host Number of Compl.. (0x03|0x0035) plen 5  #63 [hci1] 7.395217
        Num handles: 1
        Handle: 111 Address: DF:A9:FF:F6:B1:1A (OUI DF-A9-FF)
        Count: 1
< HCI Command: Host Number of Compl.. (0x03|0x0035) plen 5  #64 [hci1] 7.395405
        Num handles: 1
        Handle: 111 Address: DF:A9:FF:F6:B1:1A (OUI DF-A9-FF)
        Count: 1
< HCI Command: Host Number of Compl.. (0x03|0x0035) plen 5  #65 [hci1] 7.395753
        Num handles: 1
        Handle: 111 Address: DF:A9:FF:F6:B1:1A (OUI DF-A9-FF)
        Count: 1
< ACL Data TX: Handle 111 flags 0x00 dlen 27                #66 [hci1] 7.395928
< ACL Data TX: Handle 111 flags 0x01 dlen 27                #67 [hci1] 7.395946
< ACL Data TX: Handle 111 flags 0x01 dlen 15                #68 [hci1] 7.395977
      SMP: Pairing Public Key (0x0c) len 64
        X: 98308440221e2d910f0e54b71e7ec652857aa9b5a0dc65028824cc19db1226e9
        Y: 67a4816bcb62efb21701e31fdb27561a6217575fb007a8bbdabe7e28b6f68482
> HCI Event: Number of Completed Packets (0x13) plen 5      #69 [hci1] 7.477888
        Num handles: 1
        Handle: 111 Address: DF:A9:FF:F6:B1:1A (OUI DF-A9-FF)
        Count: 1
        #66: len 27 (2 Kb/s)
        Latency: 81 msec (81-161 msec ~120 msec)
> HCI Event: Number of Completed Packets (0x13) plen 5      #70 [hci1] 7.478343
        Num handles: 1
        Handle: 111 Address: DF:A9:FF:F6:B1:1A (OUI DF-A9-FF)
        Count: 1
        #67: len 27 (2 Kb/s)
        Latency: 82 msec (81-161 msec ~101 msec)
> HCI Event: Number of Completed Packets (0x13) plen 5      #71 [hci1] 7.564583
        Num handles: 1
        Handle: 111 Address: DF:A9:FF:F6:B1:1A (OUI DF-A9-FF)
        Count: 1
        #68: len 15 (0 Kb/s)
        Latency: 168 msec (81-168 msec ~134 msec)
> ACL Data RX: Handle 111 flags 0x02 dlen 21                #72 [hci1] 8.527506
      SMP: Pairing Confirm (0x03) len 16
        Confim value: a009b09624f5bcdda79d549f26af700d
< HCI Command: Host Number of Compl.. (0x03|0x0035) plen 5  #73 [hci1] 8.534947
        Num handles: 1
        Handle: 111 Address: DF:A9:FF:F6:B1:1A (OUI DF-A9-FF)
        Count: 1
< ACL Data TX: Handle 111 flags 0x00 dlen 21                #74 [hci1] 8.535054
      SMP: Pairing Confirm (0x03) len 16
        Confim value: 3e91a6f61294d5a387584327e61cc0fa
> HCI Event: Number of Completed Packets (0x13) plen 5      #75 [hci1] 8.702223
        Num handles: 1
        Handle: 111 Address: DF:A9:FF:F6:B1:1A (OUI DF-A9-FF)
        Count: 1
        #74: len 21 (1 Kb/s)
        Latency: 167 msec (81-168 msec ~151 msec)
> ACL Data RX: Handle 111 flags 0x02 dlen 21                #76 [hci1] 8.702582
      SMP: Pairing Random (0x04) len 16
        Random value: 7a304340f332b8c90000000000000000
< HCI Command: Host Number of Compl.. (0x03|0x0035) plen 5  #77 [hci1] 8.715137
        Num handles: 1
        Handle: 111 Address: DF:A9:FF:F6:B1:1A (OUI DF-A9-FF)
        Count: 1
< ACL Data TX: Handle 111 flags 0x00 dlen 21                #78 [hci1] 8.715233
      SMP: Pairing Random (0x04) len 16
        Random value: 8e6108f966a694cbe26df70bb96773e6
> HCI Event: Number of Completed Packets (0x13) plen 5      #79 [hci1] 8.877102
        Num handles: 1
        Handle: 111 Address: DF:A9:FF:F6:B1:1A (OUI DF-A9-FF)
        Count: 1
        #78: len 21 (1 Kb/s)
        Latency: 161 msec (81-168 msec ~156 msec)
> ACL Data RX: Handle 111 flags 0x02 dlen 21                #80 [hci1] 8.964842
      SMP: Pairing Confirm (0x03) len 16
        Confim value: f355883a401b4aa0d49d1791e3e4c7dd
< HCI Command: Host Number of Compl.. (0x03|0x0035) plen 5  #81 [hci1] 8.974829
        Num handles: 1
        Handle: 111 Address: DF:A9:FF:F6:B1:1A (OUI DF-A9-FF)
        Count: 1
< ACL Data TX: Handle 111 flags 0x00 dlen 21                #82 [hci1] 8.975050
      SMP: Pairing Confirm (0x03) len 16
        Confim value: 4284aeb57cea5818808bdb100325cceb
> HCI Event: Number of Completed Packets (0x13) plen 5      #83 [hci1] 9.139700
        Num handles: 1
        Handle: 111 Address: DF:A9:FF:F6:B1:1A (OUI DF-A9-FF)
        Count: 1
        #82: len 21 (1 Kb/s)
        Latency: 164 msec (81-168 msec ~160 msec)
> ACL Data RX: Handle 111 flags 0x02 dlen 21                #84 [hci1] 9.140050
      SMP: Pairing Random (0x04) len 16
        Random value: 2c9359a2572d18e90000000000000000
< HCI Command: Host Number of Compl.. (0x03|0x0035) plen 5  #85 [hci1] 9.155054
        Num handles: 1
        Handle: 111 Address: DF:A9:FF:F6:B1:1A (OUI DF-A9-FF)
        Count: 1
< ACL Data TX: Handle 111 flags 0x00 dlen 21                #86 [hci1] 9.155129
      SMP: Pairing Random (0x04) len 16
        Random value: 4d02679f89a05211af56d8b3da64d21e
> HCI Event: Number of Completed Packets (0x13) plen 5      #87 [hci1] 9.314536
        Num handles: 1
        Handle: 111 Address: DF:A9:FF:F6:B1:1A (OUI DF-A9-FF)
        Count: 1
        #86: len 21 (1 Kb/s)
        Latency: 159 msec (81-168 msec ~159 msec)
> ACL Data RX: Handle 111 flags 0x02 dlen 21                #88 [hci1] 9.402489
      SMP: Pairing Confirm (0x03) len 16
        Confim value: cf6cd2d2dfb90b0a4577410bd221bc76
< HCI Command: Host Number of Compl.. (0x03|0x0035) plen 5  #89 [hci1] 9.414584
        Num handles: 1
        Handle: 111 Address: DF:A9:FF:F6:B1:1A (OUI DF-A9-FF)
        Count: 1
< ACL Data TX: Handle 111 flags 0x00 dlen 21                #90 [hci1] 9.414723
      SMP: Pairing Confirm (0x03) len 16
        Confim value: f4ab559db23480ba6f25e4e14e7793a1
> HCI Event: Number of Completed Packets (0x13) plen 5      #91 [hci1] 9.577272
        Num handles: 1
        Handle: 111 Address: DF:A9:FF:F6:B1:1A (OUI DF-A9-FF)
        Count: 1
        #90: len 21 (1 Kb/s)
        Latency: 162 msec (81-168 msec ~161 msec)
> ACL Data RX: Handle 111 flags 0x02 dlen 21                #92 [hci1] 9.577616
      SMP: Pairing Random (0x04) len 16
        Random value: 068a8bd96c7d2e570000000000000000
< HCI Command: Host Number of Compl.. (0x03|0x0035) plen 5  #93 [hci1] 9.595114
        Num handles: 1
        Handle: 111 Address: DF:A9:FF:F6:B1:1A (OUI DF-A9-FF)
        Count: 1
< ACL Data TX: Handle 111 flags 0x00 dlen 21                #94 [hci1] 9.595294
      SMP: Pairing Random (0x04) len 16
        Random value: 5e8286bc235a02440d0c3424a2acf8fd
> HCI Event: Number of Completed Packets (0x13) plen 5      #95 [hci1] 9.752005
        Num handles: 1
        Handle: 111 Address: DF:A9:FF:F6:B1:1A (OUI DF-A9-FF)
        Count: 1
        #94: len 21 (1 Kb/s)
        Latency: 156 msec (81-168 msec ~158 msec)
> ACL Data RX: Handle 111 flags 0x02 dlen 21                #96 [hci1] 9.839903
      SMP: Pairing Confirm (0x03) len 16
        Confim value: 8bda1178219456e95d84d422a921d1a9
< HCI Command: Host Number of Compl.. (0x03|0x0035) plen 5  #97 [hci1] 9.854953
        Num handles: 1
        Handle: 111 Address: DF:A9:FF:F6:B1:1A (OUI DF-A9-FF)
        Count: 1
< ACL Data TX: Handle 111 flags 0x00 dlen 21                #98 [hci1] 9.855116
      SMP: Pairing Confirm (0x03) len 16
        Confim value: 8251b2c44c93248000c4dac08ee55720
> HCI Event: Number of Completed Packets (0x13) plen 5     #99 [hci1] 10.014884
        Num handles: 1
        Handle: 111 Address: DF:A9:FF:F6:B1:1A (OUI DF-A9-FF)
        Count: 1
        #98: len 21 (1 Kb/s)
        Latency: 159 msec (81-168 msec ~159 msec)
> ACL Data RX: Handle 111 flags 0x02 dlen 21              #100 [hci1] 10.015035
      SMP: Pairing Random (0x04) len 16
        Random value: f367f4e14f22b48c0000000000000000
< HCI Command: Host Number of Com.. (0x03|0x0035) plen 5  #101 [hci1] 10.035135
        Num handles: 1
        Handle: 111 Address: DF:A9:FF:F6:B1:1A (OUI DF-A9-FF)
        Count: 1
< ACL Data TX: Handle 111 flags 0x00 dlen 21              #102 [hci1] 10.035202
      SMP: Pairing Random (0x04) len 16
        Random value: 5c4a1bcadd27bd58e945097b00bad7ac
> HCI Event: Number of Completed Packets (0x13) plen 5    #103 [hci1] 10.189515
        Num handles: 1
        Handle: 111 Address: DF:A9:FF:F6:B1:1A (OUI DF-A9-FF)
        Count: 1
        #102: len 21 (1 Kb/s)
        Latency: 154 msec (81-168 msec ~156 msec)
> ACL Data RX: Handle 111 flags 0x02 dlen 21              #104 [hci1] 10.277391
      SMP: Pairing Confirm (0x03) len 16
        Confim value: a87c74cfa68d607fb959ed54b194d27e
< HCI Command: Host Number of Com.. (0x03|0x0035) plen 5  #105 [hci1] 10.294668
        Num handles: 1
        Handle: 111 Address: DF:A9:FF:F6:B1:1A (OUI DF-A9-FF)
        Count: 1
< ACL Data TX: Handle 111 flags 0x00 dlen 21              #106 [hci1] 10.294806
      SMP: Pairing Confirm (0x03) len 16
        Confim value: 5b260c05527cbdbaef23cdee5fce38b4
> HCI Event: Number of Completed Packets (0x13) plen 5    #107 [hci1] 10.452318
        Num handles: 1
        Handle: 111 Address: DF:A9:FF:F6:B1:1A (OUI DF-A9-FF)
        Count: 1
        #106: len 21 (1 Kb/s)
        Latency: 157 msec (81-168 msec ~157 msec)
> ACL Data RX: Handle 111 flags 0x02 dlen 21              #108 [hci1] 10.452534
      SMP: Pairing Random (0x04) len 16
        Random value: a398787d363f77ba0000000000000000
< HCI Command: Host Number of Com.. (0x03|0x0035) plen 5  #109 [hci1] 10.455343
        Num handles: 1
        Handle: 111 Address: DF:A9:FF:F6:B1:1A (OUI DF-A9-FF)
        Count: 1
< ACL Data TX: Handle 111 flags 0x00 dlen 21              #110 [hci1] 10.455423
      SMP: Pairing Random (0x04) len 16
        Random value: 32527e6e64e79f33b2e374394db8ab2d
> HCI Event: Number of Completed Packets (0x13) plen 5    #111 [hci1] 10.627041
        Num handles: 1
        Handle: 111 Address: DF:A9:FF:F6:B1:1A (OUI DF-A9-FF)
        Count: 1
        #110: len 21 (0 Kb/s)
        Latency: 171 msec (81-171 msec ~164 msec)
> ACL Data RX: Handle 111 flags 0x02 dlen 21              #112 [hci1] 10.714979
      SMP: Pairing Confirm (0x03) len 16
        Confim value: 812f2a341ff69222555a5c09df15f66f
< HCI Command: Host Number of Com.. (0x03|0x0035) plen 5  #113 [hci1] 10.734955
        Num handles: 1
        Handle: 111 Address: DF:A9:FF:F6:B1:1A (OUI DF-A9-FF)
        Count: 1
< ACL Data TX: Handle 111 flags 0x00 dlen 21              #114 [hci1] 10.735102
      SMP: Pairing Confirm (0x03) len 16
        Confim value: 59b5037583c73260de829fa9709668e5
> HCI Event: Number of Completed Packets (0x13) plen 5    #115 [hci1] 10.889731
        Num handles: 1
        Handle: 111 Address: DF:A9:FF:F6:B1:1A (OUI DF-A9-FF)
        Count: 1
        #114: len 21 (1 Kb/s)
        Latency: 154 msec (81-171 msec ~159 msec)
> ACL Data RX: Handle 111 flags 0x02 dlen 21              #116 [hci1] 10.890009
      SMP: Pairing Random (0x04) len 16
        Random value: fb30263b316180630000000000000000
< HCI Command: Host Number of Com.. (0x03|0x0035) plen 5  #117 [hci1] 10.895195
        Num handles: 1
        Handle: 111 Address: DF:A9:FF:F6:B1:1A (OUI DF-A9-FF)
        Count: 1
< ACL Data TX: Handle 111 flags 0x00 dlen 21              #118 [hci1] 10.895327
      SMP: Pairing Random (0x04) len 16
        Random value: dddbdfe2838e9a8cc6964353c850fef7
> HCI Event: Number of Completed Packets (0x13) plen 5    #119 [hci1] 11.064524
        Num handles: 1
        Handle: 111 Address: DF:A9:FF:F6:B1:1A (OUI DF-A9-FF)
        Count: 1
        #118: len 21 (0 Kb/s)
        Latency: 169 msec (81-171 msec ~164 msec)
> ACL Data RX: Handle 111 flags 0x02 dlen 21              #120 [hci1] 11.152388
      SMP: Pairing Confirm (0x03) len 16
        Confim value: 7c48c05699e1deacea29224c694396fc
< HCI Command: Host Number of Com.. (0x03|0x0035) plen 5  #121 [hci1] 11.154619
        Num handles: 1
        Handle: 111 Address: DF:A9:FF:F6:B1:1A (OUI DF-A9-FF)
        Count: 1
< ACL Data TX: Handle 111 flags 0x00 dlen 21              #122 [hci1] 11.154714
      SMP: Pairing Confirm (0x03) len 16
        Confim value: ff3ad590b4a3ee776bf4c57a36d45288
> HCI Event: Number of Completed Packets (0x13) plen 5    #123 [hci1] 11.327170
        Num handles: 1
        Handle: 111 Address: DF:A9:FF:F6:B1:1A (OUI DF-A9-FF)
        Count: 1
        #122: len 21 (0 Kb/s)
        Latency: 172 msec (81-172 msec ~168 msec)
> ACL Data RX: Handle 111 flags 0x02 dlen 21              #124 [hci1] 11.327472
      SMP: Pairing Random (0x04) len 16
        Random value: e8f784204281cb680000000000000000
< HCI Command: Host Number of Com.. (0x03|0x0035) plen 5  #125 [hci1] 11.335177
        Num handles: 1
        Handle: 111 Address: DF:A9:FF:F6:B1:1A (OUI DF-A9-FF)
        Count: 1
< ACL Data TX: Handle 111 flags 0x00 dlen 21              #126 [hci1] 11.335329
      SMP: Pairing Random (0x04) len 16
        Random value: eb9f1915536596b6fc3db1c86b2b1970
> HCI Event: Number of Completed Packets (0x13) plen 5    #127 [hci1] 11.502020
        Num handles: 1
        Handle: 111 Address: DF:A9:FF:F6:B1:1A (OUI DF-A9-FF)
        Count: 1
        #126: len 21 (1 Kb/s)
        Latency: 166 msec (81-172 msec ~167 msec)
> ACL Data RX: Handle 111 flags 0x02 dlen 21              #128 [hci1] 11.589871
      SMP: Pairing Confirm (0x03) len 16
        Confim value: 1874fa188c63fb695a4de16bf1f913a2
< HCI Command: Host Number of Com.. (0x03|0x0035) plen 5  #129 [hci1] 11.594973
        Num handles: 1
        Handle: 111 Address: DF:A9:FF:F6:B1:1A (OUI DF-A9-FF)
        Count: 1
< ACL Data TX: Handle 111 flags 0x00 dlen 21              #130 [hci1] 11.595169
      SMP: Pairing Confirm (0x03) len 16
        Confim value: a9536264784aa08dd9fec9dfedcdd41b
> HCI Event: Number of Completed Packets (0x13) plen 5    #131 [hci1] 11.764649
        Num handles: 1
        Handle: 111 Address: DF:A9:FF:F6:B1:1A (OUI DF-A9-FF)
        Count: 1
        #130: len 21 (0 Kb/s)
        Latency: 169 msec (81-172 msec ~168 msec)
> ACL Data RX: Handle 111 flags 0x02 dlen 21              #132 [hci1] 11.764931
      SMP: Pairing Random (0x04) len 16
        Random value: 9f57b6656f6181b80000000000000000
< HCI Command: Host Number of Com.. (0x03|0x0035) plen 5  #133 [hci1] 11.775112
        Num handles: 1
        Handle: 111 Address: DF:A9:FF:F6:B1:1A (OUI DF-A9-FF)
        Count: 1
< ACL Data TX: Handle 111 flags 0x00 dlen 21              #134 [hci1] 11.775241
      SMP: Pairing Random (0x04) len 16
        Random value: 5c794dc9ad9f2c3f295ebd5ad5e1c3cf
> HCI Event: Number of Completed Packets (0x13) plen 5    #135 [hci1] 11.939445
        Num handles: 1
        Handle: 111 Address: DF:A9:FF:F6:B1:1A (OUI DF-A9-FF)
        Count: 1
        #134: len 21 (1 Kb/s)
        Latency: 164 msec (81-172 msec ~166 msec)
> ACL Data RX: Handle 111 flags 0x02 dlen 21              #136 [hci1] 12.027324
      SMP: Pairing Confirm (0x03) len 16
        Confim value: 0cc4817398d92f22ba979d7d9e4c3fc3
< HCI Command: Host Number of Com.. (0x03|0x0035) plen 5  #137 [hci1] 12.034620
        Num handles: 1
        Handle: 111 Address: DF:A9:FF:F6:B1:1A (OUI DF-A9-FF)
        Count: 1
< ACL Data TX: Handle 111 flags 0x00 dlen 21              #138 [hci1] 12.034751
      SMP: Pairing Confirm (0x03) len 16
        Confim value: 6d4510f7fcda91e778e86f8dad3100e0
> HCI Event: Number of Completed Packets (0x13) plen 5    #139 [hci1] 12.202129
        Num handles: 1
        Handle: 111 Address: DF:A9:FF:F6:B1:1A (OUI DF-A9-FF)
        Count: 1
        #138: len 21 (1 Kb/s)
        Latency: 167 msec (81-172 msec ~166 msec)
> ACL Data RX: Handle 111 flags 0x02 dlen 21              #140 [hci1] 12.202504
      SMP: Pairing Random (0x04) len 16
        Random value: de00bfa4b28bc6fd0000000000000000
< HCI Command: Host Number of Com.. (0x03|0x0035) plen 5  #141 [hci1] 12.215149
        Num handles: 1
        Handle: 111 Address: DF:A9:FF:F6:B1:1A (OUI DF-A9-FF)
        Count: 1
< ACL Data TX: Handle 111 flags 0x00 dlen 21              #142 [hci1] 12.215312
      SMP: Pairing Random (0x04) len 16
        Random value: 5c2fff312cdf99c9491988e877355a9a
> HCI Event: Number of Completed Packets (0x13) plen 5    #143 [hci1] 12.376987
        Num handles: 1
        Handle: 111 Address: DF:A9:FF:F6:B1:1A (OUI DF-A9-FF)
        Count: 1
        #142: len 21 (1 Kb/s)
        Latency: 161 msec (81-172 msec ~164 msec)
> ACL Data RX: Handle 111 flags 0x02 dlen 21              #144 [hci1] 12.464873
      SMP: Pairing Confirm (0x03) len 16
        Confim value: ee966bff0609025d989e047696a66661
< HCI Command: Host Number of Com.. (0x03|0x0035) plen 5  #145 [hci1] 12.474911
        Num handles: 1
        Handle: 111 Address: DF:A9:FF:F6:B1:1A (OUI DF-A9-FF)
        Count: 1
< ACL Data TX: Handle 111 flags 0x00 dlen 21              #146 [hci1] 12.475115
      SMP: Pairing Confirm (0x03) len 16
        Confim value: 74fcea6333864455dfc19e46bbdc7842
> HCI Event: Number of Completed Packets (0x13) plen 5    #147 [hci1] 12.639579
        Num handles: 1
        Handle: 111 Address: DF:A9:FF:F6:B1:1A (OUI DF-A9-FF)
        Count: 1
        #146: len 21 (1 Kb/s)
        Latency: 164 msec (81-172 msec ~164 msec)
> ACL Data RX: Handle 111 flags 0x02 dlen 21              #148 [hci1] 12.640010
      SMP: Pairing Random (0x04) len 16
        Random value: 05ec7974b7eaf0ba0000000000000000
< HCI Command: Host Number of Com.. (0x03|0x0035) plen 5  #149 [hci1] 12.655149
        Num handles: 1
        Handle: 111 Address: DF:A9:FF:F6:B1:1A (OUI DF-A9-FF)
        Count: 1
< ACL Data TX: Handle 111 flags 0x00 dlen 21              #150 [hci1] 12.655247
      SMP: Pairing Random (0x04) len 16
        Random value: c629a3a987d808e808655d558dfc1155
> HCI Event: Number of Completed Packets (0x13) plen 5    #151 [hci1] 12.814434
        Num handles: 1
        Handle: 111 Address: DF:A9:FF:F6:B1:1A (OUI DF-A9-FF)
        Count: 1
        #150: len 21 (1 Kb/s)
        Latency: 159 msec (81-172 msec ~161 msec)
> ACL Data RX: Handle 111 flags 0x02 dlen 21              #152 [hci1] 12.902188
      SMP: Pairing Confirm (0x03) len 16
        Confim value: 5c46a5ba198e498416a65247822e0693
< HCI Command: Host Number of Com.. (0x03|0x0035) plen 5  #153 [hci1] 12.915035
        Num handles: 1
        Handle: 111 Address: DF:A9:FF:F6:B1:1A (OUI DF-A9-FF)
        Count: 1
< ACL Data TX: Handle 111 flags 0x00 dlen 21              #154 [hci1] 12.915293
      SMP: Pairing Confirm (0x03) len 16
        Confim value: 68cd65f85d2165fd4e5c72ff7c4c3617
> HCI Event: Number of Completed Packets (0x13) plen 5    #155 [hci1] 13.077205
        Num handles: 1
        Handle: 111 Address: DF:A9:FF:F6:B1:1A (OUI DF-A9-FF)
        Count: 1
        #154: len 21 (1 Kb/s)
        Latency: 161 msec (81-172 msec ~161 msec)
> ACL Data RX: Handle 111 flags 0x02 dlen 21              #156 [hci1] 13.077453
      SMP: Pairing Random (0x04) len 16
        Random value: e7186640be0516540000000000000000
< HCI Command: Host Number of Com.. (0x03|0x0035) plen 5  #157 [hci1] 13.095093
        Num handles: 1
        Handle: 111 Address: DF:A9:FF:F6:B1:1A (OUI DF-A9-FF)
        Count: 1
< ACL Data TX: Handle 111 flags 0x00 dlen 21              #158 [hci1] 13.095214
      SMP: Pairing Random (0x04) len 16
        Random value: 92f20f6ad8f13724432c7fd6001c45ff
> HCI Event: Number of Completed Packets (0x13) plen 5    #159 [hci1] 13.251952
        Num handles: 1
        Handle: 111 Address: DF:A9:FF:F6:B1:1A (OUI DF-A9-FF)
        Count: 1
        #158: len 21 (1 Kb/s)
        Latency: 156 msec (81-172 msec ~159 msec)
> ACL Data RX: Handle 111 flags 0x02 dlen 21              #160 [hci1] 13.339764
      SMP: Pairing Confirm (0x03) len 16
        Confim value: 46b514fff8c0a3d24637f5973d5ddab0
< HCI Command: Host Number of Com.. (0x03|0x0035) plen 5  #161 [hci1] 13.354911
        Num handles: 1
        Handle: 111 Address: DF:A9:FF:F6:B1:1A (OUI DF-A9-FF)
        Count: 1
< ACL Data TX: Handle 111 flags 0x00 dlen 21              #162 [hci1] 13.355078
      SMP: Pairing Confirm (0x03) len 16
        Confim value: 11ed470986669cff56a12a9cb64be73f
> HCI Event: Number of Completed Packets (0x13) plen 5    #163 [hci1] 13.514645
        Num handles: 1
        Handle: 111 Address: DF:A9:FF:F6:B1:1A (OUI DF-A9-FF)
        Count: 1
        #162: len 21 (1 Kb/s)
        Latency: 159 msec (81-172 msec ~159 msec)
> ACL Data RX: Handle 111 flags 0x02 dlen 21              #164 [hci1] 13.514958
      SMP: Pairing Random (0x04) len 16
        Random value: 4da9dee71d7b11b70000000000000000
< HCI Command: Host Number of Com.. (0x03|0x0035) plen 5  #165 [hci1] 13.535024
        Num handles: 1
        Handle: 111 Address: DF:A9:FF:F6:B1:1A (OUI DF-A9-FF)
        Count: 1
< ACL Data TX: Handle 111 flags 0x00 dlen 21              #166 [hci1] 13.535047
      SMP: Pairing Random (0x04) len 16
        Random value: 23ac32ebbb5e14c8a6b9622f296d277f
> HCI Event: Number of Completed Packets (0x13) plen 5    #167 [hci1] 13.689311
        Num handles: 1
        Handle: 111 Address: DF:A9:FF:F6:B1:1A (OUI DF-A9-FF)
        Count: 1
        #166: len 21 (1 Kb/s)
        Latency: 154 msec (81-172 msec ~156 msec)
> ACL Data RX: Handle 111 flags 0x02 dlen 21              #168 [hci1] 13.777253
      SMP: Pairing Confirm (0x03) len 16
        Confim value: 0c9dd5270f04c318c62c24d92f150ad6
< HCI Command: Host Number of Com.. (0x03|0x0035) plen 5  #169 [hci1] 13.794581
        Num handles: 1
        Handle: 111 Address: DF:A9:FF:F6:B1:1A (OUI DF-A9-FF)
        Count: 1
< ACL Data TX: Handle 111 flags 0x00 dlen 21              #170 [hci1] 13.794746
      SMP: Pairing Confirm (0x03) len 16
        Confim value: c5ec08687a9e4ea672612d98097aca7d
> HCI Event: Number of Completed Packets (0x13) plen 5    #171 [hci1] 13.952267
        Num handles: 1
        Handle: 111 Address: DF:A9:FF:F6:B1:1A (OUI DF-A9-FF)
        Count: 1
        #170: len 21 (1 Kb/s)
        Latency: 157 msec (81-172 msec ~157 msec)
> ACL Data RX: Handle 111 flags 0x02 dlen 21              #172 [hci1] 13.952399
      SMP: Pairing Random (0x04) len 16
        Random value: e8e28b3663e16c630000000000000000
< HCI Command: Host Number of Com.. (0x03|0x0035) plen 5  #173 [hci1] 13.955106
        Num handles: 1
        Handle: 111 Address: DF:A9:FF:F6:B1:1A (OUI DF-A9-FF)
        Count: 1
< ACL Data TX: Handle 111 flags 0x00 dlen 21              #174 [hci1] 13.955198
      SMP: Pairing Random (0x04) len 16
        Random value: 297efe85e67448a15f56bd27e3a3cf1d
> HCI Event: Number of Completed Packets (0x13) plen 5    #175 [hci1] 14.126979
        Num handles: 1
        Handle: 111 Address: DF:A9:FF:F6:B1:1A (OUI DF-A9-FF)
        Count: 1
        #174: len 21 (0 Kb/s)
        Latency: 171 msec (81-172 msec ~164 msec)
> ACL Data RX: Handle 111 flags 0x02 dlen 21              #176 [hci1] 14.214772
      SMP: Pairing Confirm (0x03) len 16
        Confim value: 854ac57819af863a612ce072afb0ad8b
< HCI Command: Host Number of Com.. (0x03|0x0035) plen 5  #177 [hci1] 14.234919
        Num handles: 1
        Handle: 111 Address: DF:A9:FF:F6:B1:1A (OUI DF-A9-FF)
        Count: 1
< ACL Data TX: Handle 111 flags 0x00 dlen 21              #178 [hci1] 14.235099
      SMP: Pairing Confirm (0x03) len 16
        Confim value: ae896838814c16c1f8fc21da10880b9f
> HCI Event: Number of Completed Packets (0x13) plen 5    #179 [hci1] 14.389516
        Num handles: 1
        Handle: 111 Address: DF:A9:FF:F6:B1:1A (OUI DF-A9-FF)
        Count: 1
        #178: len 21 (1 Kb/s)
        Latency: 154 msec (81-172 msec ~159 msec)
> ACL Data RX: Handle 111 flags 0x02 dlen 21              #180 [hci1] 14.389946
      SMP: Pairing Random (0x04) len 16
        Random value: be02bc47b72b34fe0000000000000000
< HCI Command: Host Number of Com.. (0x03|0x0035) plen 5  #181 [hci1] 14.395066
        Num handles: 1
        Handle: 111 Address: DF:A9:FF:F6:B1:1A (OUI DF-A9-FF)
        Count: 1
< ACL Data TX: Handle 111 flags 0x00 dlen 21              #182 [hci1] 14.395147
      SMP: Pairing Random (0x04) len 16
        Random value: 25a9493fd3ce4faf02be7293595bb7c6
> HCI Event: Number of Completed Packets (0x13) plen 5    #183 [hci1] 14.564343
        Num handles: 1
        Handle: 111 Address: DF:A9:FF:F6:B1:1A (OUI DF-A9-FF)
        Count: 1
        #182: len 21 (0 Kb/s)
        Latency: 169 msec (81-172 msec ~164 msec)
> ACL Data RX: Handle 111 flags 0x02 dlen 21              #184 [hci1] 14.652288
      SMP: Pairing Confirm (0x03) len 16
        Confim value: 97c5699b0bb70c04cccbf5b647e6a86c
< HCI Command: Host Number of Com.. (0x03|0x0035) plen 5  #185 [hci1] 14.654895
        Num handles: 1
        Handle: 111 Address: DF:A9:FF:F6:B1:1A (OUI DF-A9-FF)
        Count: 1
< ACL Data TX: Handle 111 flags 0x00 dlen 21              #186 [hci1] 14.655040
      SMP: Pairing Confirm (0x03) len 16
        Confim value: 829d76809ce6b2a517ccb4e980816b12
> HCI Event: Number of Completed Packets (0x13) plen 5    #187 [hci1] 14.827045
        Num handles: 1
        Handle: 111 Address: DF:A9:FF:F6:B1:1A (OUI DF-A9-FF)
        Count: 1
        #186: len 21 (0 Kb/s)
        Latency: 172 msec (81-172 msec ~168 msec)
> ACL Data RX: Handle 111 flags 0x02 dlen 21              #188 [hci1] 14.827350
      SMP: Pairing Random (0x04) len 16
        Random value: 72054ac5ed94ac6c0000000000000000
< HCI Command: Host Number of Com.. (0x03|0x0035) plen 5  #189 [hci1] 14.835122
        Num handles: 1
        Handle: 111 Address: DF:A9:FF:F6:B1:1A (OUI DF-A9-FF)
        Count: 1
< ACL Data TX: Handle 111 flags 0x00 dlen 21              #190 [hci1] 14.835318
      SMP: Pairing Random (0x04) len 16
        Random value: 58f6b41f855a6f6c3560debd84e2affc
> HCI Event: Number of Completed Packets (0x13) plen 5    #191 [hci1] 15.001942
        Num handles: 1
        Handle: 111 Address: DF:A9:FF:F6:B1:1A (OUI DF-A9-FF)
        Count: 1
        #190: len 21 (1 Kb/s)
        Latency: 166 msec (81-172 msec ~167 msec)
> ACL Data RX: Handle 111 flags 0x02 dlen 21              #192 [hci1] 15.089750
      SMP: Pairing Confirm (0x03) len 16
        Confim value: b73081f1163a30ce80f0164f5e5ba23d
< HCI Command: Host Number of Com.. (0x03|0x0035) plen 5  #193 [hci1] 15.094785
        Num handles: 1
        Handle: 111 Address: DF:A9:FF:F6:B1:1A (OUI DF-A9-FF)
        Count: 1
< ACL Data TX: Handle 111 flags 0x00 dlen 21              #194 [hci1] 15.094997
      SMP: Pairing Confirm (0x03) len 16
        Confim value: cd1aeb80baf2ad4b73dae94590ffe9c2
> HCI Event: Number of Completed Packets (0x13) plen 5    #195 [hci1] 15.264538
        Num handles: 1
        Handle: 111 Address: DF:A9:FF:F6:B1:1A (OUI DF-A9-FF)
        Count: 1
        #194: len 21 (0 Kb/s)
        Latency: 169 msec (81-172 msec ~168 msec)
> ACL Data RX: Handle 111 flags 0x02 dlen 21              #196 [hci1] 15.264931
      SMP: Pairing Random (0x04) len 16
        Random value: 94c9379efcddafc30000000000000000
< HCI Command: Host Number of Com.. (0x03|0x0035) plen 5  #197 [hci1] 15.275197
        Num handles: 1
        Handle: 111 Address: DF:A9:FF:F6:B1:1A (OUI DF-A9-FF)
        Count: 1
< ACL Data TX: Handle 111 flags 0x00 dlen 21              #198 [hci1] 15.275270
      SMP: Pairing Random (0x04) len 16
        Random value: b67e7216d5bf664139eda2b542549666
> HCI Event: Number of Completed Packets (0x13) plen 5    #199 [hci1] 15.439400
        Num handles: 1
        Handle: 111 Address: DF:A9:FF:F6:B1:1A (OUI DF-A9-FF)
        Count: 1
        #198: len 21 (1 Kb/s)
        Latency: 164 msec (81-172 msec ~166 msec)
> ACL Data RX: Handle 111 flags 0x02 dlen 21              #200 [hci1] 15.527180
      SMP: Pairing Confirm (0x03) len 16
        Confim value: fd871edce39b072d4b4dc7764137cba6
< HCI Command: Host Number of Com.. (0x03|0x0035) plen 5  #201 [hci1] 15.534602
        Num handles: 1
        Handle: 111 Address: DF:A9:FF:F6:B1:1A (OUI DF-A9-FF)
        Count: 1
< ACL Data TX: Handle 111 flags 0x00 dlen 21              #202 [hci1] 15.534721
      SMP: Pairing Confirm (0x03) len 16
        Confim value: 5ba3d9a396c009c276397d67f3ba2f74
> HCI Event: Number of Completed Packets (0x13) plen 5    #203 [hci1] 15.702022
        Num handles: 1
        Handle: 111 Address: DF:A9:FF:F6:B1:1A (OUI DF-A9-FF)
        Count: 1
        #202: len 21 (1 Kb/s)
        Latency: 167 msec (81-172 msec ~166 msec)
> ACL Data RX: Handle 111 flags 0x02 dlen 21              #204 [hci1] 15.702367
      SMP: Pairing Random (0x04) len 16
        Random value: c4127af2d091bae20000000000000000
< HCI Command: Host Number of Com.. (0x03|0x0035) plen 5  #205 [hci1] 15.715112
        Num handles: 1
        Handle: 111 Address: DF:A9:FF:F6:B1:1A (OUI DF-A9-FF)
        Count: 1
< ACL Data TX: Handle 111 flags 0x00 dlen 21              #206 [hci1] 15.715204
      SMP: Pairing Random (0x04) len 16
        Random value: ed17f76500c95219dd01e09d1e63f87b
> HCI Event: Number of Completed Packets (0x13) plen 5    #207 [hci1] 15.876870
        Num handles: 1
        Handle: 111 Address: DF:A9:FF:F6:B1:1A (OUI DF-A9-FF)
        Count: 1
        #206: len 21 (1 Kb/s)
        Latency: 161 msec (81-172 msec ~164 msec)
> ACL Data RX: Handle 111 flags 0x02 dlen 21              #208 [hci1] 15.964740
      SMP: Pairing Confirm (0x03) len 16
        Confim value: 4f615c29a045389ad646d40f62921684
< HCI Command: Host Number of Com.. (0x03|0x0035) plen 5  #209 [hci1] 15.974676
        Num handles: 1
        Handle: 111 Address: DF:A9:FF:F6:B1:1A (OUI DF-A9-FF)
        Count: 1
< ACL Data TX: Handle 111 flags 0x00 dlen 21              #210 [hci1] 15.974812
      SMP: Pairing Confirm (0x03) len 16
        Confim value: a7b015722a3d7db42d209201e6f0dbe7
> HCI Event: Number of Completed Packets (0x13) plen 5    #211 [hci1] 16.139485
        Num handles: 1
        Handle: 111 Address: DF:A9:FF:F6:B1:1A (OUI DF-A9-FF)
        Count: 1
        #210: len 21 (1 Kb/s)
        Latency: 164 msec (81-172 msec ~164 msec)
> ACL Data RX: Handle 111 flags 0x02 dlen 21              #212 [hci1] 16.139909
      SMP: Pairing Random (0x04) len 16
        Random value: 2d14dcbd89ec29c50000000000000000
< HCI Command: Host Number of Com.. (0x03|0x0035) plen 5  #213 [hci1] 16.155153
        Num handles: 1
        Handle: 111 Address: DF:A9:FF:F6:B1:1A (OUI DF-A9-FF)
        Count: 1
< ACL Data TX: Handle 111 flags 0x00 dlen 21              #214 [hci1] 16.155175
      SMP: Pairing Random (0x04) len 16
        Random value: 81d35d47e1f6006d79c974bd9d9e1ee3
> HCI Event: Number of Completed Packets (0x13) plen 5    #215 [hci1] 16.314327
        Num handles: 1
        Handle: 111 Address: DF:A9:FF:F6:B1:1A (OUI DF-A9-FF)
        Count: 1
        #214: len 21 (1 Kb/s)
        Latency: 159 msec (81-172 msec ~161 msec)
> ACL Data RX: Handle 111 flags 0x02 dlen 21              #216 [hci1] 16.402177
      SMP: Pairing Confirm (0x03) len 16
        Confim value: 3c67ed052e3e34063839c43b12225c88
< HCI Command: Host Number of Com.. (0x03|0x0035) plen 5  #217 [hci1] 16.414949
        Num handles: 1
        Handle: 111 Address: DF:A9:FF:F6:B1:1A (OUI DF-A9-FF)
        Count: 1
< ACL Data TX: Handle 111 flags 0x00 dlen 21              #218 [hci1] 16.415111
      SMP: Pairing Confirm (0x03) len 16
        Confim value: c08536ff1d1f44ebc85c26cd352c7256
> HCI Event: Number of Completed Packets (0x13) plen 5    #219 [hci1] 16.577063
        Num handles: 1
        Handle: 111 Address: DF:A9:FF:F6:B1:1A (OUI DF-A9-FF)
        Count: 1
        #218: len 21 (1 Kb/s)
        Latency: 161 msec (81-172 msec ~161 msec)
> ACL Data RX: Handle 111 flags 0x02 dlen 21              #220 [hci1] 16.577309
      SMP: Pairing Random (0x04) len 16
        Random value: a8371a0e185c259c0000000000000000
< HCI Command: Host Number of Com.. (0x03|0x0035) plen 5  #221 [hci1] 16.595195
        Num handles: 1
        Handle: 111 Address: DF:A9:FF:F6:B1:1A (OUI DF-A9-FF)
        Count: 1
< ACL Data TX: Handle 111 flags 0x00 dlen 21              #222 [hci1] 16.595294
      SMP: Pairing Random (0x04) len 16
        Random value: e7f7e0c2476823e41736a7e381bafb7c
> HCI Event: Number of Completed Packets (0x13) plen 5    #223 [hci1] 16.751764
        Num handles: 1
        Handle: 111 Address: DF:A9:FF:F6:B1:1A (OUI DF-A9-FF)
        Count: 1
        #222: len 21 (1 Kb/s)
        Latency: 156 msec (81-172 msec ~159 msec)
> ACL Data RX: Handle 111 flags 0x02 dlen 21              #224 [hci1] 16.839632
      SMP: Pairing Confirm (0x03) len 16
        Confim value: 3bbe36a9e4c598c0219a87708ef3395b
< HCI Command: Host Number of Com.. (0x03|0x0035) plen 5  #225 [hci1] 16.854962
        Num handles: 1
        Handle: 111 Address: DF:A9:FF:F6:B1:1A (OUI DF-A9-FF)
        Count: 1
< ACL Data TX: Handle 111 flags 0x00 dlen 21              #226 [hci1] 16.855118
      SMP: Pairing Confirm (0x03) len 16
        Confim value: 356b575cf3e66d20675f7b3a6b72464a
> HCI Event: Number of Completed Packets (0x13) plen 5    #227 [hci1] 17.014495
        Num handles: 1
        Handle: 111 Address: DF:A9:FF:F6:B1:1A (OUI DF-A9-FF)
        Count: 1
        #226: len 21 (1 Kb/s)
        Latency: 159 msec (81-172 msec ~159 msec)
> ACL Data RX: Handle 111 flags 0x02 dlen 21              #228 [hci1] 17.014822
      SMP: Pairing Random (0x04) len 16
        Random value: 438e1116860780ff0000000000000000
< HCI Command: Host Number of Com.. (0x03|0x0035) plen 5  #229 [hci1] 17.035120
        Num handles: 1
        Handle: 111 Address: DF:A9:FF:F6:B1:1A (OUI DF-A9-FF)
        Count: 1
