Bluetooth monitor ver 5.72
= Note: Linux version 6.14.0-36-generic (x86_64)                       0.299539
= Note: Bluetooth subsystem version 2.22                               0.299541
= New Index: 00:00:00:00:00:00 (Primary,UART,hci2)              [hci2] 0.299542
= New Index: 00:00:00:00:00:00 (Primary,UART,hci1)              [hci1] 0.299543
= New Index: 48:5F:99:8E:E0:64 (Primary,USB,hci0)               [hci0] 0.299543
= Open Index: 00:00:00:00:00:00                                 [hci1] 0.442853
= Index Info: 00:00:00:00:00:00 (Nordic Semiconductor ASA)      [hci1] 0.442864
@ USER Open: main (privileged) version 2.22            {0x0001} [hci1] 0.442869
< HCI Command: Reset (0x03|0x0003) plen 0                    #1 [hci1] 0.443574
> HCI Event: Command Complete (0x0e) plen 4                  #2 [hci1] 0.444184
      Reset (0x03|0x0003) ncmd 1
        Status: Success (0x00)
< HCI Command: Read Local Supported... (0x04|0x0003) plen 0  #3 [hci1] 0.462643
> HCI Event: Command Complete (0x0e) plen 12                 #4 [hci1] 0.463176
      Read Local Supported Features (0x04|0x0003) ncmd 1
        Status: Success (0x00)
        Features: 0x00 0x00 0x00 0x00 0x60 0x00 0x00 0x00
          BR/EDR Not Supported
          LE Supported (Controller)
< HCI Command: Read Local Version In.. (0x04|0x0001) plen 0  #5 [hci1] 0.482626
> HCI Event: Command Complete (0x0e) plen 12                 #6 [hci1] 0.483239
      Read Local Version Information (0x04|0x0001) ncmd 1
        Status: Success (0x00)
        HCI version: Reserved (0x11) - Revision 12345 (0x3039)
        LMP version: Reserved (0x11) - Subversion 12345 (0x3039)
        Manufacturer: Nordic Semiconductor ASA (89)
< HCI Command: Read Local Supported... (0x04|0x0002) plen 0  #7 [hci1] 0.502616
> HCI Event: Command Complete (0x0e) plen 68                 #8 [hci1] 0.503771
      Read Local Supported Commands (0x04|0x0002) ncmd 1
        Status: Success (0x00)
        Commands: 115 entries
          Disconnect (Octet 0 - Bit 5)
          Read Remote Version Information (Octet 2 - Bit 7)
          Set Event Mask (Octet 5 - Bit 6)
          Reset (Octet 5 - Bit 7)
          Read Connection Accept Timeout (Octet 7 - Bit 2)
          Write Connection Accept Timeout (Octet 7 - Bit 3)
          Read Transmit Power Level (Octet 10 - Bit 2)
          Set Controller To Host Flow Control (Octet 10 - Bit 5)
          Host Buffer Size (Octet 10 - Bit 6)
          Host Number of Completed Packets (Octet 10 - Bit 7)
          Read Local Version Information (Octet 14 - Bit 3)
          Read Local Supported Features (Octet 14 - Bit 5)
          Read BD ADDR (Octet 15 - Bit 1)
          Read RSSI (Octet 15 - Bit 5)
          Set Event Mask Page 2 (Octet 22 - Bit 2)
          LE Set Event Mask (Octet 25 - Bit 0)
          LE Read Buffer Size (Octet 25 - Bit 1)
          LE Read Local Supported Features (Octet 25 - Bit 2)
          LE Set Random Address (Octet 25 - Bit 4)
          LE Set Advertising Parameters (Octet 25 - Bit 5)
          LE Read Advertising Channel TX Power (Octet 25 - Bit 6)
          LE Set Advertising Data (Octet 25 - Bit 7)
          LE Set Scan Response Data (Octet 26 - Bit 0)
          LE Set Advertise Enable (Octet 26 - Bit 1)
          LE Set Scan Parameters (Octet 26 - Bit 2)
          LE Set Scan Enable (Octet 26 - Bit 3)
          LE Create Connection (Octet 26 - Bit 4)
          LE Create Connection Cancel (Octet 26 - Bit 5)
          LE Read Accept List Size (Octet 26 - Bit 6)
          LE Clear Accept List (Octet 26 - Bit 7)
          LE Add Device To Accept List (Octet 27 - Bit 0)
          LE Remove Device From Accept List (Octet 27 - Bit 1)
          LE Connection Update (Octet 27 - Bit 2)
          LE Set Host Channel Classification (Octet 27 - Bit 3)
          LE Read Channel Map (Octet 27 - Bit 4)
          LE Read Remote Used Features (Octet 27 - Bit 5)
          LE Encrypt (Octet 27 - Bit 6)
          LE Rand (Octet 27 - Bit 7)
          LE Start Encryption (Octet 28 - Bit 0)
          LE Long Term Key Request Reply (Octet 28 - Bit 1)
          LE Long Term Key Request Neg Reply (Octet 28 - Bit 2)
          LE Read Supported States (Octet 28 - Bit 3)
          Read Authenticated Payload Timeout (Octet 32 - Bit 4)
          Write Authenticated Payload Timeout (Octet 32 - Bit 5)
          LE Set Data Length (Octet 33 - Bit 6)
          LE Read Suggested Default Data Length (Octet 33 - Bit 7)
          LE Write Suggested Default Data Length (Octet 34 - Bit 0)
          LE Add Device To Resolving List (Octet 34 - Bit 3)
          LE Remove Device From Resolving List (Octet 34 - Bit 4)
          LE Clear Resolving List (Octet 34 - Bit 5)
          LE Read Resolving List Size (Octet 34 - Bit 6)
          LE Set Address Resolution Enable (Octet 35 - Bit 1)
          LE Set Resolvable Private Address Timeout (Octet 35 - Bit 2)
          LE Read Maximum Data Length (Octet 35 - Bit 3)
          LE Read PHY (Octet 35 - Bit 4)
          LE Set Default PHY (Octet 35 - Bit 5)
          LE Set PHY (Octet 35 - Bit 6)
          LE Set Advertising Set Random Address (Octet 36 - Bit 1)
          LE Set Extended Advertising Parameters (Octet 36 - Bit 2)
          LE Set Extended Advertising Data (Octet 36 - Bit 3)
          LE Set Extended Scan Response Data (Octet 36 - Bit 4)
          LE Set Extended Advertising Enable (Octet 36 - Bit 5)
          LE Read Maximum Advertising Data Length (Octet 36 - Bit 6)
          LE Read Number of Supported Advertising Sets (Octet 36 - Bit 7)
          LE Remove Advertising Set (Octet 37 - Bit 0)
          LE Clear Advertising Sets (Octet 37 - Bit 1)
          LE Set Periodic Advertising Parameters (Octet 37 - Bit 2)
          LE Set Periodic Advertising Data (Octet 37 - Bit 3)
          LE Set Periodic Advertising Enable (Octet 37 - Bit 4)
          LE Set Extended Scan Parameters (Octet 37 - Bit 5)
          LE Set Extended Scan Enable (Octet 37 - Bit 6)
          LE Extended Create Connection (Octet 37 - Bit 7)
          LE Periodic Advertising Create Sync (Octet 38 - Bit 0)
          LE Periodic Advertising Create Sync Cancel (Octet 38 - Bit 1)
          LE Periodic Advertising Terminate Sync (Octet 38 - Bit 2)
          LE Add Device To Periodic Advertiser List (Octet 38 - Bit 3)
          LE Remove Device From Periodic Advertiser List (Octet 38 - Bit 4)
          LE Clear Periodic Advertiser List (Octet 38 - Bit 5)
          LE Read Periodic Advertiser List Size (Octet 38 - Bit 6)
          LE Read Transmit Power (Octet 38 - Bit 7)
          LE Read RF Path Compensation (Octet 39 - Bit 0)
          LE Write RF Path Compensation (Octet 39 - Bit 1)
          LE Set Privacy Mode (Octet 39 - Bit 2)
          LE Periodic Advertising Receive Enable (Octet 40 - Bit 5)
          LE Periodic Advertising Sync Transfer (Octet 40 - Bit 6)
          LE Periodic Advertising Set Info Transfer (Octet 40 - Bit 7)
          LE Periodic Advertising Sync Transfer Parameters (Octet 41 - Bit 0)
          LE Set Default Periodic Advertisng Sync Transfer Parameters (Octet 41 - Bit 1)
          LE Read Buffer v2 (Octet 41 - Bit 5)
          LE Read ISO TX Sync (Octet 41 - Bit 6)
          LE Set Connected Isochronous Group Parameters (Octet 41 - Bit 7)
          LE Set Connected Isochronous Group Parameters Test (Octet 42 - Bit 0)
          LE Create Connected Isochronous Stream (Octet 42 - Bit 1)
          LE Remove Connected Isochronous Group (Octet 42 - Bit 2)
          LE Accept Connected Isochronous Stream Request (Octet 42 - Bit 3)
          LE Reject Connected Isochronous Stream Request (Octet 42 - Bit 4)
          LE Create Broadcast Isochronous Group (Octet 42 - Bit 5)
          LE Create Broadcast Isochronous Group Test (Octet 42 - Bit 6)
          LE Terminate Broadcast Isochronous Group (Octet 42 - Bit 7)
          LE Broadcast Isochronous Group Create Sync (Octet 43 - Bit 0)
          LE Broadcast Isochronous Group Terminate Sync (Octet 43 - Bit 1)
          LE Request Peer SCA (Octet 43 - Bit 2)
          LE Setup Isochronous Data Path (Octet 43 - Bit 3)
          LE Remove Isochronous Data Path (Octet 43 - Bit 4)
          LE Isochronous Transmit Test (Octet 43 - Bit 5)
          LE Isochronous Receive Test (Octet 43 - Bit 6)
          LE Isochronous Read Test Counters (Octet 43 - Bit 7)
          LE Isochronous Read Test Counters (Octet 44 - Bit 0)
          LE Set Host Feature (Octet 44 - Bit 1)
          Octet 44 - Bit 2 
          Octet 45 - Bit 6 
          Octet 46 - Bit 0 
          Octet 46 - Bit 1 
          Octet 46 - Bit 2 
          Octet 47 - Bit 4 
< HCI Command: Host Buffer Size (0x03|0x0033) plen 7         #9 [hci1] 0.522630
        ACL MTU: 255  ACL max packet: 16
        SCO MTU: 0    SCO max packet: 0
> HCI Event: Command Complete (0x0e) plen 4                 #10 [hci1] 0.523180
      Host Buffer Size (0x03|0x0033) ncmd 1
        Status: Success (0x00)
< HCI Command: Set Controller To Ho.. (0x03|0x0031) plen 1  #11 [hci1] 0.542623
        Flow control: ACL Data Packets (0x01)
> HCI Event: Command Complete (0x0e) plen 4                 #12 [hci1] 0.543034
      Set Controller To Host Flow Control (0x03|0x0031) ncmd 1
        Status: Success (0x00)
< HCI Command: LE Read Local Suppor.. (0x08|0x0003) plen 0  #13 [hci1] 0.562627
> HCI Event: Command Complete (0x0e) plen 12                #14 [hci1] 0.563177
      LE Read Local Supported Features (0x08|0x0003) ncmd 1
        Status: Success (0x00)
        Features: 0xfd 0x79 0x00 0xf7 0x30 0x01 0x00 0x00
          LE Encryption
          Extended Reject Indication
          Peripheral-initiated Features Exchange
          LE Ping
          LE Data Packet Length Extension
          LL Privacy
          Extended Scanner Filter Policies
          LE 2M PHY
          LE Coded PHY
          LE Extended Advertising
          LE Periodic Advertising
          Channel Selection Algorithm #2
          Periodic Advertising Sync Transfer - Sender
          Periodic Advertising Sync Transfer - Recipient
          Sleep Clock Accuracy Updates
          Connected Isochronous Stream - Central
          Connected Isochronous Stream - Peripheral
          Isochronous Broadcaster
          Synchronized Receiver
          Periodic Advertising ADI support
          Connection Subrating
          Unknown features (0x0000010000000000)
< HCI Command: LE Set Host Feature (0x08|0x0074) plen 2     #15 [hci1] 0.582635
        Bit Number: 32
          Connected Isochronous Stream (Host Support)
        Bit Value: 1
> HCI Event: Command Complete (0x0e) plen 4                 #16 [hci1] 0.583099
      LE Set Host Feature (0x08|0x0074) ncmd 1
        Status: Success (0x00)
< HCI Command: LE Read Buffer v2 (0x08|0x0060) plen 0       #17 [hci1] 0.602624
> HCI Event: Command Complete (0x0e) plen 10                #18 [hci1] 0.603070
      LE Read Buffer v2 (0x08|0x0060) ncmd 1
        Status: Success (0x00)
        ACL MTU: 27
        ACL max packet: 3
        ISO MTU: 318
        ISO max packet: 3
< HCI Command: LE Read Maximum Adve.. (0x08|0x003a) plen 0  #19 [hci1] 0.622657
> HCI Event: Command Complete (0x0e) plen 6                 #20 [hci1] 0.623191
      LE Read Maximum Advertising Data Length (0x08|0x003a) ncmd 1
        Status: Success (0x00)
        Max length: 1650
< HCI Command: LE Read Supported St.. (0x08|0x001c) plen 0  #21 [hci1] 0.642666
> HCI Event: Command Complete (0x0e) plen 12                #22 [hci1] 0.643104
      LE Read Supported States (0x08|0x001c) ncmd 1
        Status: Success (0x00)
        States: 0x000003ff3e0306ff
          Non-connectable Advertising State
          Scannable Advertising State
          Connectable Advertising State
          High Duty Cycle Directed Advertising State
          Passive Scanning State
          Active Scanning State
          Initiating State
            and Connection State (Central Role)
          Connection State (Peripheral Role)
          Scannable Advertising State
            and Passive Scanning State
          Connectable Advertising State
            and Passive Scanning State
          Non-connectable Advertising State
            and Initiating State
          Scannable Advertising State
            and Initiating State
          Active Scanning State
            and Connection State (Central Role)
          Passive Scanning State
            and Connection State (Peripheral Role)
          Active Scanning State
            and Connection State (Peripheral Role)
          Initiating State
            and Connection State (Central Role)
            and Central Role & Central Role
          Low Duty Cycle Directed Advertising State
          Connectable Advertising State
            and Initiating State
            and Central Role & Peripheral Role
          High Duty Cycle Directed Advertising State
            and Initiating State
            and Central Role & Peripheral Role
          Low Duty Cycle Directed Advertising State
            and Initiating State
            and Central Role & Peripheral Role
          Connectable Advertising State
            and Connection State (Central Role)
            and Central Role & Peripheral Role
          High Duty Cycle Directed Advertising State
            and Connection State (Central Role)
            and Central Role & Peripheral Role
          Low Duty Cycle Directed Advertising State
            and Connection State (Central Role)
            and Central Role & Peripheral Role
          Connectable Advertising State
            and Connection State (Peripheral Role)
            and Central Role & Peripheral Role
          High Duty Cycle Directed Advertising State
            and Connection State (Peripheral Role)
            and Peripheral Role & Peripheral Role
          Low Duty Cycle Directed Advertising State
            and Connection State (Peripheral Role)
            and Peripheral Role & Peripheral Role
          Initiating State
            and Connection State (Peripheral Role)
            and Central Role & Peripheral Role
< HCI Command: LE Read Maximum Data.. (0x08|0x002f) plen 0  #23 [hci1] 0.662625
> HCI Event: Command Complete (0x0e) plen 12                #24 [hci1] 0.663119
      LE Read Maximum Data Length (0x08|0x002f) ncmd 1
        Status: Success (0x00)
        Max TX octets: 251
        Max TX time: 2704
        Max RX octets: 251
        Max RX time: 2704
< HCI Command: LE Write Suggested D.. (0x08|0x0024) plen 4  #25 [hci1] 0.682623
        TX octets: 251
        TX time: 2704
> HCI Event: Command Complete (0x0e) plen 4                 #26 [hci1] 0.683111
      LE Write Suggested Default Data Length (0x08|0x0024) ncmd 1
        Status: Success (0x00)
< HCI Command: LE Read Resolving Li.. (0x08|0x002a) plen 0  #27 [hci1] 0.702621
> HCI Event: Command Complete (0x0e) plen 5                 #28 [hci1] 0.703142
      LE Read Resolving List Size (0x08|0x002a) ncmd 1
        Status: Success (0x00)
        Size: 8
< HCI Command: LE Set Host Feature (0x08|0x0074) plen 2     #29 [hci1] 0.722599
        Bit Number: 38
          Connection Subrating (Host Support)
        Bit Value: 1
> HCI Event: Command Complete (0x0e) plen 4                 #30 [hci1] 0.723063
      LE Set Host Feature (0x08|0x0074) ncmd 1
        Status: Success (0x00)
< HCI Command: LE Set Event Mask (0x08|0x0001) plen 8       #31 [hci1] 0.742632
        Mask: 0x000002063f87fa5e
          LE Advertising Report
          LE Connection Update Complete
          LE Read Remote Used Features Complete
          LE Long Term Key Request
          LE Data Length Change
          LE Enhanced Connection Complete
          LE PHY Update Complete
          LE Extended Advertising Report
          LE Periodic Advertising Sync Established
          LE Periodic Advertising Report
          LE Periodic Advertising Sync Lost
          LE Extended Scan Timeout
          LE Extended Advertising Set Terminated
          LE Scan Request Received
          LE Periodic Advertising Sync Transfer Rvc
          LE CIS Established
          LE CIS Request
          LE Create BIG Complete
          LE Terminate BIG Complete
          LE BIG Sync Estabilished Complete
          LE BIG Sync Lost
          LE BIG Info Advertising Report
          LE Subrate Change
          Unknown mask (0x0000020000000000)
> HCI Event: Command Complete (0x0e) plen 4                 #32 [hci1] 0.743166
      LE Set Event Mask (0x08|0x0001) ncmd 1
        Status: Success (0x00)
< HCI Command: Set Event Mask (0x03|0x0001) plen 8          #33 [hci1] 0.762629
        Mask: 0x2000800002008890
          Disconnection Complete
          Encryption Change
          Read Remote Version Information Complete
          Hardware Error
          Data Buffer Overflow
          Encryption Key Refresh Complete
          LE Meta
> HCI Event: Command Complete (0x0e) plen 4                 #34 [hci1] 0.763139
      Set Event Mask (0x03|0x0001) ncmd 1
        Status: Success (0x00)
< HCI Command: Read BD ADDR (0x04|0x0009) plen 0            #35 [hci1] 0.782621
> HCI Event: Command Complete (0x0e) plen 10                #36 [hci1] 0.783196
      Read BD ADDR (0x04|0x0009) ncmd 1
        Status: Success (0x00)
        Address: 00:00:00:00:00:00 (OUI 00-00-00)
< HCI Command: LE Set Random Address (0x08|0x0005) plen 6   #37 [hci1] 0.802637
        Address: D5:B6:CC:31:DB:3B (Static)
> HCI Event: Command Complete (0x0e) plen 4                 #38 [hci1] 0.803124
      LE Set Random Address (0x08|0x0005) ncmd 1
        Status: Success (0x00)
< HCI Command: LE Extended Create... (0x08|0x0043) plen 26  #39 [hci1] 3.072672
        Filter policy: Accept list is not used (0x00)
        Own address type: Random (0x01)
        Peer address type: Public (0x00)
        Peer address: DF:A9:FF:F6:B1:1A (OUI DF-A9-FF)
        Initiating PHYs: 0x01
        Entry 0: LE 1M
          Scan interval: 60.000 msec (0x0060)
          Scan window: 60.000 msec (0x0060)
          Min connection interval: 30.00 msec (0x0018)
          Max connection interval: 50.00 msec (0x0028)
          Connection latency: 0 (0x0000)
          Supervision timeout: 4000 msec (0x0190)
          Min connection length: 0.000 msec (0x0000)
          Max connection length: 0.000 msec (0x0000)
> HCI Event: Command Status (0x0f) plen 4                   #40 [hci1] 3.073620
      LE Extended Create Connection (0x08|0x0043) ncmd 1
        Status: Success (0x00)
> HCI Event: LE Meta Event (0x3e) plen 31                   #41 [hci1] 3.153288
      LE Enhanced Connection Complete (0x0a)
        Status: Success (0x00)
        Handle: 3672
        Role: Central (0x00)
        Peer address type: Public (0x00)
        Peer address: DF:A9:FF:F6:B1:1A (OUI DF-A9-FF)
        Local resolvable private address: 00:00:00:00:00:00 (Non-Resolvable)
        Peer resolvable private address: 00:00:00:00:00:00 (Non-Resolvable)
        Connection interval: 50.00 msec (0x0028)
        Connection latency: 0 (0x0000)
        Supervision timeout: 4000 msec (0x0190)
        Central clock accuracy: 0x00
< HCI Command: LE Read Remote Used... (0x08|0x0016) plen 2  #42 [hci1] 3.163462
        Handle: 3672 Address: DF:A9:FF:F6:B1:1A (OUI DF-A9-FF)
> HCI Event: Command Status (0x0f) plen 4                   #43 [hci1] 3.164104
      LE Read Remote Used Features (0x08|0x0016) ncmd 1
        Status: Success (0x00)
< HCI Command: LE Set PHY (0x08|0x0032) plen 7              #44 [hci1] 3.182917
        Handle: 3672 Address: DF:A9:FF:F6:B1:1A (OUI DF-A9-FF)
        All PHYs preference: 0x00
        TX PHYs preference: 0x02
          LE 2M
        RX PHYs preference: 0x02
          LE 2M
        PHY options preference: Reserved (0x0000)
> HCI Event: Command Status (0x0f) plen 4                   #45 [hci1] 3.183530
      LE Set PHY (0x08|0x0032) ncmd 1
        Status: Success (0x00)
> HCI Event: LE Meta Event (0x3e) plen 12                   #46 [hci1] 3.304672
      LE Read Remote Used Features (0x04)
        Status: Success (0x00)
        Handle: 3672 Address: DF:A9:FF:F6:B1:1A (OUI DF-A9-FF)
        Features: 0x2d 0x49 0x00 0xf7 0x67 0xd9 0x00 0x80
          LE Encryption
          Extended Reject Indication
          Peripheral-initiated Features Exchange
          LE Data Packet Length Extension
          LE 2M PHY
          LE Coded PHY
          Channel Selection Algorithm #2
          Periodic Advertising Sync Transfer - Sender
          Periodic Advertising Sync Transfer - Recipient
          Sleep Clock Accuracy Updates
          Connected Isochronous Stream - Central
          Connected Isochronous Stream - Peripheral
          Isochronous Broadcaster
          Synchronized Receiver
          Connected Isochronous Stream (Host Support)
          LE Power Control Request
          LE Power Control Request
          Connection Subrating
          Connection Subrating (Host Support)
          Unknown features (0x8000d90000000000)
> HCI Event: LE Meta Event (0x3e) plen 6                    #47 [hci1] 3.804246
      LE PHY Update Complete (0x0c)
        Status: Success (0x00)
        Handle: 3672 Address: DF:A9:FF:F6:B1:1A (OUI DF-A9-FF)
        TX PHY: LE 2M (0x02)
        RX PHY: LE 2M (0x02)
< ACL Data TX: Handle 3672 flags 0x00 dlen 11               #48 [hci1] 4.203343
      SMP: Pairing Request (0x01) len 6
        IO capability: KeyboardOnly (0x02)
        OOB data: Authentication data not present (0x00)
        Authentication requirement: No bonding, No MITM, SC, No Keypresses (0x08)
        Max encryption key size: 16
        Initiator key distribution: <none> (0x00)
        Responder key distribution: <none> (0x00)
> HCI Event: Number of Completed Packets (0x13) plen 5      #49 [hci1] 4.254552
        Num handles: 1
        Handle: 3672 Address: DF:A9:FF:F6:B1:1A (OUI DF-A9-FF)
        Count: 1
        #48: len 11 (1 Kb/s)
        Latency: 51 msec (51-51 msec ~51 msec)
> ACL Data RX: Handle 3672 flags 0x02 dlen 11               #50 [hci1] 4.304647
      SMP: Pairing Response (0x02) len 6
        IO capability: KeyboardOnly (0x02)
        OOB data: Authentication data not present (0x00)
        Authentication requirement: No bonding, MITM, SC, No Keypresses (0x0c)
        Max encryption key size: 16
        Initiator key distribution: <none> (0x00)
        Responder key distribution: <none> (0x00)
< HCI Command: Host Number of Compl.. (0x03|0x0035) plen 5  #51 [hci1] 4.323187
        Num handles: 1
        Handle: 3672 Address: DF:A9:FF:F6:B1:1A (OUI DF-A9-FF)
        Count: 1
< ACL Data TX: Handle 3672 flags 0x00 dlen 27               #52 [hci1] 4.323296
< ACL Data TX: Handle 3672 flags 0x01 dlen 27               #53 [hci1] 4.323330
< ACL Data TX: Handle 3672 flags 0x01 dlen 15               #54 [hci1] 4.323363
      SMP: Pairing Public Key (0x0c) len 64
        X: 98308440221e2d910f0e54b71e7ec652857aa9b5a0dc65028824cc19db1226e9
        Y: 67a4816bcb62efb21701e31fdb27561a6217575fb007a8bbdabe7e28b6f68482
> HCI Event: Number of Completed Packets (0x13) plen 5      #55 [hci1] 4.354605
        Num handles: 1
        Handle: 3672 Address: DF:A9:FF:F6:B1:1A (OUI DF-A9-FF)
        Count: 1
        #52: len 27 (6 Kb/s)
        Latency: 31 msec (31-51 msec ~41 msec)
> HCI Event: Number of Completed Packets (0x13) plen 5      #56 [hci1] 4.355088
        Num handles: 1
        Handle: 3672 Address: DF:A9:FF:F6:B1:1A (OUI DF-A9-FF)
        Count: 1
        #53: len 27 (6 Kb/s)
        Latency: 31 msec (31-51 msec ~36 msec)
> HCI Event: Number of Completed Packets (0x13) plen 5      #57 [hci1] 4.355586
        Num handles: 1
        Handle: 3672 Address: DF:A9:FF:F6:B1:1A (OUI DF-A9-FF)
        Count: 1
        #54: len 15 (3 Kb/s)
        Latency: 32 msec (31-51 msec ~34 msec)
> ACL Data RX: Handle 3672 flags 0x02 dlen 27               #58 [hci1] 4.404754
> ACL Data RX: Handle 3672 flags 0x01 dlen 27               #59 [hci1] 4.405221
> ACL Data RX: Handle 3672 flags 0x01 dlen 15               #60 [hci1] 4.405587
      SMP: Pairing Public Key (0x0c) len 64
        X: ea2cf49e1f72d2ccc9f378b5ead3dd678218cead4573cdecc08118f5fa7e7a9f
        Y: 21898b02921ef4b0920c0ec849e89b4a4cfa484c3485d5acce24aec6b76eb277
< HCI Command: Host Number of Compl.. (0x03|0x0035) plen 5  #61 [hci1] 4.422966
        Num handles: 1
        Handle: 3672 Address: DF:A9:FF:F6:B1:1A (OUI DF-A9-FF)
        Count: 1
< HCI Command: Host Number of Compl.. (0x03|0x0035) plen 5  #62 [hci1] 4.423099
        Num handles: 1
        Handle: 3672 Address: DF:A9:FF:F6:B1:1A (OUI DF-A9-FF)
        Count: 1
< HCI Command: Host Number of Compl.. (0x03|0x0035) plen 5  #63 [hci1] 4.423239
        Num handles: 1
        Handle: 3672 Address: DF:A9:FF:F6:B1:1A (OUI DF-A9-FF)
        Count: 1
< ACL Data TX: Handle 3672 flags 0x00 dlen 21               #64 [hci1] 5.233197
      SMP: Pairing Confirm (0x03) len 16
        Confim value: 82b9caa80ef59c976d6c7c416d077cb9
> HCI Event: Number of Completed Packets (0x13) plen 5      #65 [hci1] 5.254505
        Num handles: 1
        Handle: 3672 Address: DF:A9:FF:F6:B1:1A (OUI DF-A9-FF)
        Count: 1
        #64: len 21 (8 Kb/s)
        Latency: 21 msec (21-51 msec ~27 msec)
> ACL Data RX: Handle 3672 flags 0x02 dlen 21               #66 [hci1] 5.304737
      SMP: Pairing Confirm (0x03) len 16
        Confim value: 6c6d3ef4ebdfa4483090e750de0e1a20
< HCI Command: Host Number of Compl.. (0x03|0x0035) plen 5  #67 [hci1] 5.323125
        Num handles: 1
        Handle: 3672 Address: DF:A9:FF:F6:B1:1A (OUI DF-A9-FF)
        Count: 1
< ACL Data TX: Handle 3672 flags 0x00 dlen 21               #68 [hci1] 5.323276
      SMP: Pairing Random (0x04) len 16
        Random value: 8e6108f966a694cbe26df70bb96773e6
> HCI Event: Number of Completed Packets (0x13) plen 5      #69 [hci1] 5.354516
        Num handles: 1
        Handle: 3672 Address: DF:A9:FF:F6:B1:1A (OUI DF-A9-FF)
        Count: 1
        #68: len 21 (5 Kb/s)
        Latency: 31 msec (21-51 msec ~29 msec)
> ACL Data RX: Handle 3672 flags 0x02 dlen 21               #70 [hci1] 5.604627
      SMP: Pairing Random (0x04) len 16
        Random value: 2070f51ff6ef051fd181fae3b3fa1999
< HCI Command: Host Number of Compl.. (0x03|0x0035) plen 5  #71 [hci1] 5.622897
        Num handles: 1
        Handle: 3672 Address: DF:A9:FF:F6:B1:1A (OUI DF-A9-FF)
        Count: 1
< ACL Data TX: Handle 3672 flags 0x00 dlen 21               #72 [hci1] 5.622927
      SMP: Pairing Confirm (0x03) len 16
        Confim value: b929f5f42f9cda4bec4711696c4c0a18
> HCI Event: Number of Completed Packets (0x13) plen 5      #73 [hci1] 5.654674
        Num handles: 1
        Handle: 3672 Address: DF:A9:FF:F6:B1:1A (OUI DF-A9-FF)
        Count: 1
        #72: len 21 (5 Kb/s)
        Latency: 31 msec (21-51 msec ~30 msec)
> ACL Data RX: Handle 3672 flags 0x02 dlen 21               #74 [hci1] 5.704823
      SMP: Pairing Confirm (0x03) len 16
        Confim value: fd8e29c03e206684773e0498fa00cb75
< HCI Command: Host Number of Compl.. (0x03|0x0035) plen 5  #75 [hci1] 5.723064
        Num handles: 1
        Handle: 3672 Address: DF:A9:FF:F6:B1:1A (OUI DF-A9-FF)
        Count: 1
< ACL Data TX: Handle 3672 flags 0x00 dlen 21               #76 [hci1] 5.723135
      SMP: Pairing Random (0x04) len 16
        Random value: 5da095555cc64d02679f89a05211af56
> HCI Event: Number of Completed Packets (0x13) plen 5      #77 [hci1] 5.754457
        Num handles: 1
        Handle: 3672 Address: DF:A9:FF:F6:B1:1A (OUI DF-A9-FF)
        Count: 1
        #76: len 21 (5 Kb/s)
        Latency: 31 msec (21-51 msec ~30 msec)
> ACL Data RX: Handle 3672 flags 0x02 dlen 21               #78 [hci1] 6.004784
      SMP: Pairing Random (0x04) len 16
        Random value: 5bd1f402653f0290d39b6a2cc2a54d43
< HCI Command: Host Number of Compl.. (0x03|0x0035) plen 5  #79 [hci1] 6.023345
        Num handles: 1
        Handle: 3672 Address: DF:A9:FF:F6:B1:1A (OUI DF-A9-FF)
        Count: 1
< ACL Data TX: Handle 3672 flags 0x00 dlen 21               #80 [hci1] 6.023463
      SMP: Pairing Confirm (0x03) len 16
        Confim value: 0f209d1661976669000b8eb1d728a395
> HCI Event: Number of Completed Packets (0x13) plen 5      #81 [hci1] 6.054528
        Num handles: 1
        Handle: 3672 Address: DF:A9:FF:F6:B1:1A (OUI DF-A9-FF)
        Count: 1
        #80: len 21 (5 Kb/s)
        Latency: 31 msec (21-51 msec ~31 msec)
> ACL Data RX: Handle 3672 flags 0x02 dlen 21               #82 [hci1] 6.104785
      SMP: Pairing Confirm (0x03) len 16
        Confim value: 7089d81024e0aa35b4f73870f8919c56
< HCI Command: Host Number of Compl.. (0x03|0x0035) plen 5  #83 [hci1] 6.123213
        Num handles: 1
        Handle: 3672 Address: DF:A9:FF:F6:B1:1A (OUI DF-A9-FF)
        Count: 1
< ACL Data TX: Handle 3672 flags 0x00 dlen 21               #84 [hci1] 6.123388
      SMP: Pairing Random (0x04) len 16
        Random value: da64d21ec8845e8286bc235a02440d0c
> HCI Event: Number of Completed Packets (0x13) plen 5      #85 [hci1] 6.154552
        Num handles: 1
        Handle: 3672 Address: DF:A9:FF:F6:B1:1A (OUI DF-A9-FF)
        Count: 1
        #84: len 21 (5 Kb/s)
        Latency: 31 msec (21-51 msec ~31 msec)
> ACL Data RX: Handle 3672 flags 0x02 dlen 21               #86 [hci1] 6.404704
      SMP: Pairing Random (0x04) len 16
        Random value: fd4299db27c19a9f321918ff01f0c072
< HCI Command: Host Number of Compl.. (0x03|0x0035) plen 5  #87 [hci1] 6.423066
        Num handles: 1
        Handle: 3672 Address: DF:A9:FF:F6:B1:1A (OUI DF-A9-FF)
        Count: 1
< ACL Data TX: Handle 3672 flags 0x00 dlen 21               #88 [hci1] 6.423121
      SMP: Pairing Confirm (0x03) len 16
        Confim value: 3ad921a30d3aac6f1c36c0427bf72800
> HCI Event: Number of Completed Packets (0x13) plen 5      #89 [hci1] 6.454547
        Num handles: 1
        Handle: 3672 Address: DF:A9:FF:F6:B1:1A (OUI DF-A9-FF)
        Count: 1
        #88: len 21 (5 Kb/s)
        Latency: 31 msec (21-51 msec ~31 msec)
> ACL Data RX: Handle 3672 flags 0x02 dlen 21               #90 [hci1] 6.504714
      SMP: Pairing Confirm (0x03) len 16
        Confim value: 183eaaeed7f3d77c263aed573f950004
< HCI Command: Host Number of Compl.. (0x03|0x0035) plen 5  #91 [hci1] 6.522934
        Num handles: 1
        Handle: 3672 Address: DF:A9:FF:F6:B1:1A (OUI DF-A9-FF)
        Count: 1
< ACL Data TX: Handle 3672 flags 0x00 dlen 21               #92 [hci1] 6.522991
      SMP: Pairing Random (0x04) len 16
        Random value: a2acf8fd71a45c4a1bcadd27bd58e945
> HCI Event: Number of Completed Packets (0x13) plen 5      #93 [hci1] 6.554611
        Num handles: 1
        Handle: 3672 Address: DF:A9:FF:F6:B1:1A (OUI DF-A9-FF)
        Count: 1
        #92: len 21 (5 Kb/s)
        Latency: 31 msec (21-51 msec ~31 msec)
> ACL Data RX: Handle 3672 flags 0x02 dlen 21               #94 [hci1] 6.804752
      SMP: Pairing Random (0x04) len 16
        Random value: 51e0633e43b3698f2c895a9f83d1d97d
< HCI Command: Host Number of Compl.. (0x03|0x0035) plen 5  #95 [hci1] 6.823039
        Num handles: 1
        Handle: 3672 Address: DF:A9:FF:F6:B1:1A (OUI DF-A9-FF)
        Count: 1
< ACL Data TX: Handle 3672 flags 0x00 dlen 21               #96 [hci1] 6.823114
      SMP: Pairing Confirm (0x03) len 16
        Confim value: b702937235ff84a5763695bfe9ad1b23
> HCI Event: Number of Completed Packets (0x13) plen 5      #97 [hci1] 6.854482
        Num handles: 1
        Handle: 3672 Address: DF:A9:FF:F6:B1:1A (OUI DF-A9-FF)
        Count: 1
        #96: len 21 (5 Kb/s)
        Latency: 31 msec (21-51 msec ~31 msec)
> ACL Data RX: Handle 3672 flags 0x02 dlen 21               #98 [hci1] 6.904687
      SMP: Pairing Confirm (0x03) len 16
        Confim value: 635fe1ac396ab989e55696b3b1a4f2af
< HCI Command: Host Number of Compl.. (0x03|0x0035) plen 5  #99 [hci1] 6.923244
        Num handles: 1
        Handle: 3672 Address: DF:A9:FF:F6:B1:1A (OUI DF-A9-FF)
        Count: 1
< ACL Data TX: Handle 3672 flags 0x00 dlen 21              #100 [hci1] 6.923429
      SMP: Pairing Random (0x04) len 16
        Random value: 00bad7aca1ba32527e6e64e79f33b2e3
> HCI Event: Number of Completed Packets (0x13) plen 5     #101 [hci1] 6.954594
        Num handles: 1
        Handle: 3672 Address: DF:A9:FF:F6:B1:1A (OUI DF-A9-FF)
        Count: 1
        #100: len 21 (5 Kb/s)
        Latency: 31 msec (21-51 msec ~31 msec)
> ACL Data RX: Handle 3672 flags 0x02 dlen 21              #102 [hci1] 7.204750
      SMP: Pairing Random (0x04) len 16
        Random value: 21e9cee69831a0ec4f45749d60f188ed
< HCI Command: Host Number of Comp.. (0x03|0x0035) plen 5  #103 [hci1] 7.223165
        Num handles: 1
        Handle: 3672 Address: DF:A9:FF:F6:B1:1A (OUI DF-A9-FF)
        Count: 1
< ACL Data TX: Handle 3672 flags 0x00 dlen 21              #104 [hci1] 7.223244
      SMP: Pairing Confirm (0x03) len 16
        Confim value: fb8b0dde31f660ccd42f9fa11a771530
> HCI Event: Number of Completed Packets (0x13) plen 5     #105 [hci1] 7.254481
        Num handles: 1
        Handle: 3672 Address: DF:A9:FF:F6:B1:1A (OUI DF-A9-FF)
        Count: 1
        #104: len 21 (5 Kb/s)
        Latency: 31 msec (21-51 msec ~31 msec)
> ACL Data RX: Handle 3672 flags 0x02 dlen 21              #106 [hci1] 7.304694
      SMP: Pairing Confirm (0x03) len 16
        Confim value: 8bbde6be450a5c60ce63bba888598553
< HCI Command: Host Number of Comp.. (0x03|0x0035) plen 5  #107 [hci1] 7.323082
        Num handles: 1
        Handle: 3672 Address: DF:A9:FF:F6:B1:1A (OUI DF-A9-FF)
        Count: 1
< ACL Data TX: Handle 3672 flags 0x00 dlen 21              #108 [hci1] 7.323156
      SMP: Pairing Random (0x04) len 16
        Random value: 4db8ab2d95badddbdfe2838e9a8cc696
> HCI Event: Number of Completed Packets (0x13) plen 5     #109 [hci1] 7.354535
        Num handles: 1
        Handle: 3672 Address: DF:A9:FF:F6:B1:1A (OUI DF-A9-FF)
        Count: 1
        #108: len 21 (5 Kb/s)
        Latency: 31 msec (21-51 msec ~31 msec)
> ACL Data RX: Handle 3672 flags 0x02 dlen 21              #110 [hci1] 7.604740
      SMP: Pairing Random (0x04) len 16
        Random value: 4e43a4296ce8cd3a9b525bd1007e5168
< HCI Command: Host Number of Comp.. (0x03|0x0035) plen 5  #111 [hci1] 7.623410
        Num handles: 1
        Handle: 3672 Address: DF:A9:FF:F6:B1:1A (OUI DF-A9-FF)
        Count: 1
< ACL Data TX: Handle 3672 flags 0x00 dlen 21              #112 [hci1] 7.623509
      SMP: Pairing Confirm (0x03) len 16
        Confim value: f9f352b92490497b747c41302657b223
> HCI Event: Number of Completed Packets (0x13) plen 5     #113 [hci1] 7.654575
        Num handles: 1
        Handle: 3672 Address: DF:A9:FF:F6:B1:1A (OUI DF-A9-FF)
        Count: 1
        #112: len 21 (5 Kb/s)
        Latency: 31 msec (21-51 msec ~31 msec)
> ACL Data RX: Handle 3672 flags 0x02 dlen 21              #114 [hci1] 7.704819
      SMP: Pairing Confirm (0x03) len 16
        Confim value: 20a1c9fb5d2676b3cb2272ad2ed6f705
< HCI Command: Host Number of Comp.. (0x03|0x0035) plen 5  #115 [hci1] 7.722955
        Num handles: 1
        Handle: 3672 Address: DF:A9:FF:F6:B1:1A (OUI DF-A9-FF)
        Count: 1
< ACL Data TX: Handle 3672 flags 0x00 dlen 21              #116 [hci1] 7.723009
      SMP: Pairing Random (0x04) len 16
        Random value: c850fef72c5ceb9f1915536596b6fc3d
> HCI Event: Number of Completed Packets (0x13) plen 5     #117 [hci1] 7.754462
        Num handles: 1
        Handle: 3672 Address: DF:A9:FF:F6:B1:1A (OUI DF-A9-FF)
        Count: 1
        #116: len 21 (5 Kb/s)
        Latency: 31 msec (21-51 msec ~31 msec)
> ACL Data RX: Handle 3672 flags 0x02 dlen 21              #118 [hci1] 8.004589
      SMP: Pairing Random (0x04) len 16
        Random value: 90fdd330eb03a79198c115224baaabee
< HCI Command: Host Number of Comp.. (0x03|0x0035) plen 5  #119 [hci1] 8.023347
        Num handles: 1
        Handle: 3672 Address: DF:A9:FF:F6:B1:1A (OUI DF-A9-FF)
        Count: 1
< ACL Data TX: Handle 3672 flags 0x00 dlen 21              #120 [hci1] 8.023424
      SMP: Pairing Confirm (0x03) len 16
        Confim value: fbe9ad20677e6b40a2153ff4caefe7aa
> HCI Event: Number of Completed Packets (0x13) plen 5     #121 [hci1] 8.054442
        Num handles: 1
        Handle: 3672 Address: DF:A9:FF:F6:B1:1A (OUI DF-A9-FF)
        Count: 1
        #120: len 21 (5 Kb/s)
        Latency: 31 msec (21-51 msec ~31 msec)
> ACL Data RX: Handle 3672 flags 0x02 dlen 21              #122 [hci1] 8.104628
      SMP: Pairing Confirm (0x03) len 16
        Confim value: 580a6369a57b5a626828ea0face4f06e
< HCI Command: Host Number of Comp.. (0x03|0x0035) plen 5  #123 [hci1] 8.123158
        Num handles: 1
        Handle: 3672 Address: DF:A9:FF:F6:B1:1A (OUI DF-A9-FF)
        Count: 1
< ACL Data TX: Handle 3672 flags 0x00 dlen 21              #124 [hci1] 8.123421
      SMP: Pairing Random (0x04) len 16
        Random value: 6b2b19701bcf5c794dc9ad9f2c3f295e
> HCI Event: Number of Completed Packets (0x13) plen 5     #125 [hci1] 8.154543
        Num handles: 1
        Handle: 3672 Address: DF:A9:FF:F6:B1:1A (OUI DF-A9-FF)
        Count: 1
        #124: len 21 (5 Kb/s)
        Latency: 31 msec (21-51 msec ~31 msec)
> ACL Data RX: Handle 3672 flags 0x02 dlen 21              #126 [hci1] 8.404610
      SMP: Pairing Random (0x04) len 16
        Random value: ba582c933351d6e6786b8db8ee708052
< HCI Command: Host Number of Comp.. (0x03|0x0035) plen 5  #127 [hci1] 8.423353
        Num handles: 1
        Handle: 3672 Address: DF:A9:FF:F6:B1:1A (OUI DF-A9-FF)
        Count: 1
< ACL Data TX: Handle 3672 flags 0x00 dlen 21              #128 [hci1] 8.423402
      SMP: Pairing Confirm (0x03) len 16
        Confim value: 88950f72479440c56a789ef8c523c762
> HCI Event: Number of Completed Packets (0x13) plen 5     #129 [hci1] 8.454423
        Num handles: 1
        Handle: 3672 Address: DF:A9:FF:F6:B1:1A (OUI DF-A9-FF)
        Count: 1
        #128: len 21 (5 Kb/s)
        Latency: 31 msec (21-51 msec ~31 msec)
> ACL Data RX: Handle 3672 flags 0x02 dlen 21              #130 [hci1] 8.504731
      SMP: Pairing Confirm (0x03) len 16
        Confim value: aeeafcd57fab878cbde28ed0784cda35
< HCI Command: Host Number of Comp.. (0x03|0x0035) plen 5  #131 [hci1] 8.523217
        Num handles: 1
        Handle: 3672 Address: DF:A9:FF:F6:B1:1A (OUI DF-A9-FF)
        Count: 1
< ACL Data TX: Handle 3672 flags 0x00 dlen 21              #132 [hci1] 8.523391
      SMP: Pairing Random (0x04) len 16
        Random value: d5e1c3cfeb215c2fff312cdf99c94919
> HCI Event: Number of Completed Packets (0x13) plen 5     #133 [hci1] 8.554436
        Num handles: 1
        Handle: 3672 Address: DF:A9:FF:F6:B1:1A (OUI DF-A9-FF)
        Count: 1
        #132: len 21 (5 Kb/s)
        Latency: 31 msec (21-51 msec ~31 msec)
> ACL Data RX: Handle 3672 flags 0x02 dlen 21              #134 [hci1] 8.804585
      SMP: Pairing Random (0x04) len 16
        Random value: e454bf2651fc1c87240b578860aade1e
< HCI Command: Host Number of Comp.. (0x03|0x0035) plen 5  #135 [hci1] 8.823491
        Num handles: 1
        Handle: 3672 Address: DF:A9:FF:F6:B1:1A (OUI DF-A9-FF)
        Count: 1
< ACL Data TX: Handle 3672 flags 0x00 dlen 21              #136 [hci1] 8.823587
      SMP: Pairing Confirm (0x03) len 16
        Confim value: a97f38b2e109fa026660088ed28747e2
> HCI Event: Number of Completed Packets (0x13) plen 5     #137 [hci1] 8.854412
        Num handles: 1
        Handle: 3672 Address: DF:A9:FF:F6:B1:1A (OUI DF-A9-FF)
        Count: 1
        #136: len 21 (5 Kb/s)
        Latency: 30 msec (21-51 msec ~30 msec)
> ACL Data RX: Handle 3672 flags 0x02 dlen 21              #138 [hci1] 8.904644
      SMP: Pairing Confirm (0x03) len 16
        Confim value: dc34f42ee0e5a6ebd7a52532426dddcb
< HCI Command: Host Number of Comp.. (0x03|0x0035) plen 5  #139 [hci1] 8.923280
        Num handles: 1
        Handle: 3672 Address: DF:A9:FF:F6:B1:1A (OUI DF-A9-FF)
        Count: 1
< ACL Data TX: Handle 3672 flags 0x00 dlen 21              #140 [hci1] 8.923475
      SMP: Pairing Random (0x04) len 16
        Random value: 77355a9a8321c629a3a987d808e80865
> HCI Event: Number of Completed Packets (0x13) plen 5     #141 [hci1] 8.954484
        Num handles: 1
        Handle: 3672 Address: DF:A9:FF:F6:B1:1A (OUI DF-A9-FF)
        Count: 1
        #140: len 21 (5 Kb/s)
        Latency: 31 msec (21-51 msec ~30 msec)
> ACL Data RX: Handle 3672 flags 0x02 dlen 21              #142 [hci1] 9.204716
      SMP: Pairing Random (0x04) len 16
        Random value: a4f5c98a687539286dbe465a46837707
< HCI Command: Host Number of Comp.. (0x03|0x0035) plen 5  #143 [hci1] 9.223388
        Num handles: 1
        Handle: 3672 Address: DF:A9:FF:F6:B1:1A (OUI DF-A9-FF)
        Count: 1
< ACL Data TX: Handle 3672 flags 0x00 dlen 21              #144 [hci1] 9.223545
      SMP: Pairing Confirm (0x03) len 16
        Confim value: b6e5759dc4c80679000f28b43883c48d
> HCI Event: Number of Completed Packets (0x13) plen 5     #145 [hci1] 9.254546
        Num handles: 1
        Handle: 3672 Address: DF:A9:FF:F6:B1:1A (OUI DF-A9-FF)
        Count: 1
        #144: len 21 (5 Kb/s)
        Latency: 31 msec (21-51 msec ~30 msec)
> ACL Data RX: Handle 3672 flags 0x02 dlen 21              #146 [hci1] 9.304594
      SMP: Pairing Confirm (0x03) len 16
        Confim value: 65d52d58b383eaaa8dde6a574eda5a11
< HCI Command: Host Number of Comp.. (0x03|0x0035) plen 5  #147 [hci1] 9.322909
        Num handles: 1
        Handle: 3672 Address: DF:A9:FF:F6:B1:1A (OUI DF-A9-FF)
        Count: 1
< ACL Data TX: Handle 3672 flags 0x00 dlen 21              #148 [hci1] 9.322956
      SMP: Pairing Random (0x04) len 16
        Random value: 8dfc1155a0b492f20f6ad8f13724432c
> HCI Event: Number of Completed Packets (0x13) plen 5     #149 [hci1] 9.354531
        Num handles: 1
        Handle: 3672 Address: DF:A9:FF:F6:B1:1A (OUI DF-A9-FF)
        Count: 1
        #148: len 21 (5 Kb/s)
        Latency: 31 msec (21-51 msec ~31 msec)
> ACL Data RX: Handle 3672 flags 0x02 dlen 21              #150 [hci1] 9.604720
      SMP: Pairing Random (0x04) len 16
        Random value: 3e315eb883473548363a8e506867b571
< HCI Command: Host Number of Comp.. (0x03|0x0035) plen 5  #151 [hci1] 9.623361
        Num handles: 1
        Handle: 3672 Address: DF:A9:FF:F6:B1:1A (OUI DF-A9-FF)
        Count: 1
< ACL Data TX: Handle 3672 flags 0x00 dlen 21              #152 [hci1] 9.623520
      SMP: Pairing Confirm (0x03) len 16
        Confim value: 239e41254660a5dd3c4f478b7643bdab
> HCI Event: Number of Completed Packets (0x13) plen 5     #153 [hci1] 9.654501
        Num handles: 1
        Handle: 3672 Address: DF:A9:FF:F6:B1:1A (OUI DF-A9-FF)
        Count: 1
        #152: len 21 (5 Kb/s)
        Latency: 30 msec (21-51 msec ~31 msec)
> ACL Data RX: Handle 3672 flags 0x02 dlen 21              #154 [hci1] 9.704679
      SMP: Pairing Confirm (0x03) len 16
        Confim value: 27ff181a3c820e48e70c7c00e1389b3d
< HCI Command: Host Number of Comp.. (0x03|0x0035) plen 5  #155 [hci1] 9.723317
        Num handles: 1
        Handle: 3672 Address: DF:A9:FF:F6:B1:1A (OUI DF-A9-FF)
        Count: 1
< ACL Data TX: Handle 3672 flags 0x00 dlen 21              #156 [hci1] 9.723485
      SMP: Pairing Random (0x04) len 16
        Random value: 001c45ff744123ac32ebbb5e14c8a6b9
> HCI Event: Number of Completed Packets (0x13) plen 5     #157 [hci1] 9.754446
        Num handles: 1
        Handle: 3672 Address: DF:A9:FF:F6:B1:1A (OUI DF-A9-FF)
        Count: 1
        #156: len 21 (5 Kb/s)
        Latency: 30 msec (21-51 msec ~31 msec)
> ACL Data RX: Handle 3672 flags 0x02 dlen 21             #158 [hci1] 10.004642
      SMP: Pairing Random (0x04) len 16
        Random value: fd5d736966f221bfdb9c871b81684b52
< HCI Command: Host Number of Com.. (0x03|0x0035) plen 5  #159 [hci1] 10.023420
        Num handles: 1
        Handle: 3672 Address: DF:A9:FF:F6:B1:1A (OUI DF-A9-FF)
        Count: 1
< ACL Data TX: Handle 3672 flags 0x00 dlen 21             #160 [hci1] 10.023532
      SMP: Pairing Confirm (0x03) len 16
        Confim value: dc44c0a9ff440355bef773a60e24ef39
> HCI Event: Number of Completed Packets (0x13) plen 5    #161 [hci1] 10.054393
        Num handles: 1
        Handle: 3672 Address: DF:A9:FF:F6:B1:1A (OUI DF-A9-FF)
        Count: 1
        #160: len 21 (5 Kb/s)
        Latency: 30 msec (21-51 msec ~30 msec)
> ACL Data RX: Handle 3672 flags 0x02 dlen 21             #162 [hci1] 10.104689
      SMP: Pairing Confirm (0x03) len 16
        Confim value: 807371dfca6baa55dc4bca6a406aca13
< HCI Command: Host Number of Com.. (0x03|0x0035) plen 5  #163 [hci1] 10.123406
        Num handles: 1
        Handle: 3672 Address: DF:A9:FF:F6:B1:1A (OUI DF-A9-FF)
        Count: 1
< ACL Data TX: Handle 3672 flags 0x00 dlen 21             #164 [hci1] 10.123570
      SMP: Pairing Random (0x04) len 16
        Random value: 296d277ff3bf297efe85e67448a15f56
> HCI Event: Number of Completed Packets (0x13) plen 5    #165 [hci1] 10.154453
        Num handles: 1
        Handle: 3672 Address: DF:A9:FF:F6:B1:1A (OUI DF-A9-FF)
        Count: 1
        #164: len 21 (5 Kb/s)
        Latency: 30 msec (21-51 msec ~30 msec)
> ACL Data RX: Handle 3672 flags 0x02 dlen 21             #166 [hci1] 10.404598
      SMP: Pairing Random (0x04) len 16
        Random value: dc3bcb98435ca9ab8a7e253d5d2d5759
< HCI Command: Host Number of Com.. (0x03|0x0035) plen 5  #167 [hci1] 10.423189
        Num handles: 1
        Handle: 3672 Address: DF:A9:FF:F6:B1:1A (OUI DF-A9-FF)
        Count: 1
< ACL Data TX: Handle 3672 flags 0x00 dlen 21             #168 [hci1] 10.423266
      SMP: Pairing Confirm (0x03) len 16
        Confim value: 9226839138389728a0bc3ab0c5ad4c4a
> HCI Event: Number of Completed Packets (0x13) plen 5    #169 [hci1] 10.454584
        Num handles: 1
        Handle: 3672 Address: DF:A9:FF:F6:B1:1A (OUI DF-A9-FF)
        Count: 1
        #168: len 21 (5 Kb/s)
        Latency: 31 msec (21-51 msec ~31 msec)
> ACL Data RX: Handle 3672 flags 0x02 dlen 21             #170 [hci1] 10.504528
      SMP: Pairing Confirm (0x03) len 16
        Confim value: 9a16c557ba15cd5b3f6a6672f2423889
< HCI Command: Host Number of Com.. (0x03|0x0035) plen 5  #171 [hci1] 10.522942
        Num handles: 1
        Handle: 3672 Address: DF:A9:FF:F6:B1:1A (OUI DF-A9-FF)
        Count: 1
< ACL Data TX: Handle 3672 flags 0x00 dlen 21             #172 [hci1] 10.522954
      SMP: Pairing Random (0x04) len 16
        Random value: e3a3cf1d832325a9493fd3ce4faf02be
> HCI Event: Number of Completed Packets (0x13) plen 5    #173 [hci1] 10.554517
        Num handles: 1
        Handle: 3672 Address: DF:A9:FF:F6:B1:1A (OUI DF-A9-FF)
        Count: 1
        #172: len 21 (5 Kb/s)
        Latency: 31 msec (21-51 msec ~31 msec)
> ACL Data RX: Handle 3672 flags 0x02 dlen 21             #174 [hci1] 10.804566
      SMP: Pairing Random (0x04) len 16
        Random value: a60017b3217ca4151aa04d77f560f858
< HCI Command: Host Number of Com.. (0x03|0x0035) plen 5  #175 [hci1] 10.823125
        Num handles: 1
        Handle: 3672 Address: DF:A9:FF:F6:B1:1A (OUI DF-A9-FF)
        Count: 1
< ACL Data TX: Handle 3672 flags 0x00 dlen 21             #176 [hci1] 10.823940
      SMP: Pairing Confirm (0x03) len 16
        Confim value: 2e037e60a1cce68e4401492cd949eacb
> HCI Event: Number of Completed Packets (0x13) plen 5    #177 [hci1] 10.855268
        Num handles: 1
        Handle: 3672 Address: DF:A9:FF:F6:B1:1A (OUI DF-A9-FF)
        Count: 1
        #176: len 21 (5 Kb/s)
        Latency: 31 msec (21-51 msec ~31 msec)
> ACL Data RX: Handle 3672 flags 0x02 dlen 21             #178 [hci1] 10.904603
      SMP: Pairing Confirm (0x03) len 16
        Confim value: aecf2cbce1c72b67badc29858225b60f
< HCI Command: Host Number of Com.. (0x03|0x0035) plen 5  #179 [hci1] 10.924317
        Num handles: 1
        Handle: 3672 Address: DF:A9:FF:F6:B1:1A (OUI DF-A9-FF)
        Count: 1
< ACL Data TX: Handle 3672 flags 0x00 dlen 21             #180 [hci1] 10.924328
      SMP: Pairing Random (0x04) len 16
        Random value: 595bb7c6e45c58f6b41f855a6f6c3560
> HCI Event: Number of Completed Packets (0x13) plen 5    #181 [hci1] 10.954407
        Num handles: 1
        Handle: 3672 Address: DF:A9:FF:F6:B1:1A (OUI DF-A9-FF)
        Count: 1
        #180: len 21 (5 Kb/s)
        Latency: 30 msec (21-51 msec ~30 msec)
> ACL Data RX: Handle 3672 flags 0x02 dlen 21             #182 [hci1] 11.154634
      SMP: Pairing Random (0x04) len 16
        Random value: ef142b07da43cbd691ef76c986232633
< HCI Command: Host Number of Com.. (0x03|0x0035) plen 5  #183 [hci1] 11.162829
        Num handles: 1
        Handle: 3672 Address: DF:A9:FF:F6:B1:1A (OUI DF-A9-FF)
        Count: 1
< ACL Data TX: Handle 3672 flags 0x00 dlen 21             #184 [hci1] 11.162858
      SMP: Pairing Confirm (0x03) len 16
        Confim value: 902fe515fdbf773919fadb57046cd826
> HCI Event: Number of Completed Packets (0x13) plen 5    #185 [hci1] 11.204432
        Num handles: 1
        Handle: 3672 Address: DF:A9:FF:F6:B1:1A (OUI DF-A9-FF)
        Count: 1
        #184: len 21 (4 Kb/s)
        Latency: 41 msec (21-51 msec ~36 msec)
> ACL Data RX: Handle 3672 flags 0x02 dlen 21             #186 [hci1] 11.254564
      SMP: Pairing Confirm (0x03) len 16
        Confim value: 396797ad7c5144eba82aa6fc93ecec5c
< HCI Command: Host Number of Com.. (0x03|0x0035) plen 5  #187 [hci1] 11.262811
        Num handles: 1
        Handle: 3672 Address: DF:A9:FF:F6:B1:1A (OUI DF-A9-FF)
        Count: 1
< ACL Data TX: Handle 3672 flags 0x00 dlen 21             #188 [hci1] 11.262862
      SMP: Pairing Random (0x04) len 16
        Random value: 84e2affc6847b67e7216d5bf664139ed
> HCI Event: Number of Completed Packets (0x13) plen 5    #189 [hci1] 11.304406
        Num handles: 1
        Handle: 3672 Address: DF:A9:FF:F6:B1:1A (OUI DF-A9-FF)
        Count: 1
        #188: len 21 (4 Kb/s)
        Latency: 41 msec (21-51 msec ~38 msec)
> ACL Data RX: Handle 3672 flags 0x02 dlen 21             #190 [hci1] 11.554674
      SMP: Pairing Random (0x04) len 16
        Random value: fb8cb445be3755a08d32cca4b986a818
< HCI Command: Host Number of Com.. (0x03|0x0035) plen 5  #191 [hci1] 11.563451
        Num handles: 1
        Handle: 3672 Address: DF:A9:FF:F6:B1:1A (OUI DF-A9-FF)
        Count: 1
< ACL Data TX: Handle 3672 flags 0x00 dlen 21             #192 [hci1] 11.563548
      SMP: Pairing Confirm (0x03) len 16
        Confim value: 1db4d90b40e75d13c1734d7a4736070c
> HCI Event: Number of Completed Packets (0x13) plen 5    #193 [hci1] 11.604581
        Num handles: 1
        Handle: 3672 Address: DF:A9:FF:F6:B1:1A (OUI DF-A9-FF)
        Count: 1
        #192: len 21 (4 Kb/s)
        Latency: 41 msec (21-51 msec ~39 msec)
> ACL Data RX: Handle 3672 flags 0x02 dlen 21             #194 [hci1] 11.654640
      SMP: Pairing Confirm (0x03) len 16
        Confim value: a6c9394009a27d528e542c4ddcc38e93
< HCI Command: Host Number of Com.. (0x03|0x0035) plen 5  #195 [hci1] 11.663241
        Num handles: 1
        Handle: 3672 Address: DF:A9:FF:F6:B1:1A (OUI DF-A9-FF)
        Count: 1
< ACL Data TX: Handle 3672 flags 0x00 dlen 21             #196 [hci1] 11.663359
      SMP: Pairing Random (0x04) len 16
        Random value: 425496665d7eed17f76500c95219dd01
> HCI Event: Number of Completed Packets (0x13) plen 5    #197 [hci1] 11.704609
        Num handles: 1
        Handle: 3672 Address: DF:A9:FF:F6:B1:1A (OUI DF-A9-FF)
        Count: 1
        #196: len 21 (4 Kb/s)
        Latency: 41 msec (21-51 msec ~40 msec)
> ACL Data RX: Handle 3672 flags 0x02 dlen 21             #198 [hci1] 11.954629
      SMP: Pairing Random (0x04) len 16
        Random value: 9942dfe8984e10d18ea29e13ddbe2976
< HCI Command: Host Number of Com.. (0x03|0x0035) plen 5  #199 [hci1] 11.963341
        Num handles: 1
        Handle: 3672 Address: DF:A9:FF:F6:B1:1A (OUI DF-A9-FF)
        Count: 1
< ACL Data TX: Handle 3672 flags 0x00 dlen 21             #200 [hci1] 11.963498
      SMP: Pairing Confirm (0x03) len 16
        Confim value: 7f34d6b6638d35d4661774710d5e73c7
> HCI Event: Number of Completed Packets (0x13) plen 5    #201 [hci1] 12.004425
        Num handles: 1
        Handle: 3672 Address: DF:A9:FF:F6:B1:1A (OUI DF-A9-FF)
        Count: 1
        #200: len 21 (4 Kb/s)
        Latency: 40 msec (21-51 msec ~40 msec)
> ACL Data RX: Handle 3672 flags 0x02 dlen 21             #202 [hci1] 12.054606
      SMP: Pairing Confirm (0x03) len 16
        Confim value: c519ba1da1aeab17689bad38ed5df751
< HCI Command: Host Number of Com.. (0x03|0x0035) plen 5  #203 [hci1] 12.063277
        Num handles: 1
        Handle: 3672 Address: DF:A9:FF:F6:B1:1A (OUI DF-A9-FF)
        Count: 1
< ACL Data TX: Handle 3672 flags 0x00 dlen 21             #204 [hci1] 12.063302
      SMP: Pairing Random (0x04) len 16
        Random value: 1e63f87b860481d35d47e1f6006d79c9
> HCI Event: Number of Completed Packets (0x13) plen 5    #205 [hci1] 12.104394
        Num handles: 1
        Handle: 3672 Address: DF:A9:FF:F6:B1:1A (OUI DF-A9-FF)
        Count: 1
        #204: len 21 (4 Kb/s)
        Latency: 41 msec (21-51 msec ~40 msec)
> ACL Data RX: Handle 3672 flags 0x02 dlen 21             #206 [hci1] 12.354659
      SMP: Pairing Random (0x04) len 16
        Random value: 9989c1500f21e3f7774ce93e8374a65b
< HCI Command: Host Number of Com.. (0x03|0x0035) plen 5  #207 [hci1] 12.363067
        Num handles: 1
        Handle: 3672 Address: DF:A9:FF:F6:B1:1A (OUI DF-A9-FF)
        Count: 1
< ACL Data TX: Handle 3672 flags 0x00 dlen 21             #208 [hci1] 12.363110
      SMP: Pairing Confirm (0x03) len 16
        Confim value: 4296fcff20bf2d5a8dbef30acb637764
> HCI Event: Number of Completed Packets (0x13) plen 5    #209 [hci1] 12.404423
        Num handles: 1
        Handle: 3672 Address: DF:A9:FF:F6:B1:1A (OUI DF-A9-FF)
        Count: 1
        #208: len 21 (4 Kb/s)
        Latency: 41 msec (21-51 msec ~41 msec)
> ACL Data RX: Handle 3672 flags 0x02 dlen 21             #210 [hci1] 12.454567
      SMP: Pairing Confirm (0x03) len 16
        Confim value: fb8470d7a1f8dbbdae7b21f49210aaf1
< HCI Command: Host Number of Com.. (0x03|0x0035) plen 5  #211 [hci1] 12.463173
        Num handles: 1
        Handle: 3672 Address: DF:A9:FF:F6:B1:1A (OUI DF-A9-FF)
        Count: 1
< ACL Data TX: Handle 3672 flags 0x00 dlen 21             #212 [hci1] 12.463251
      SMP: Pairing Random (0x04) len 16
        Random value: 9d9e1ee31049e7f7e0c2476823e41736
> HCI Event: Number of Completed Packets (0x13) plen 5    #213 [hci1] 12.504499
        Num handles: 1
        Handle: 3672 Address: DF:A9:FF:F6:B1:1A (OUI DF-A9-FF)
        Count: 1
        #212: len 21 (4 Kb/s)
        Latency: 41 msec (21-51 msec ~41 msec)
> ACL Data RX: Handle 3672 flags 0x02 dlen 21             #214 [hci1] 12.754708
      SMP: Pairing Random (0x04) len 16
        Random value: 86bc73bbe04bc6339c98f8a1576ecc61
< HCI Command: Host Number of Com.. (0x03|0x0035) plen 5  #215 [hci1] 12.763439
        Num handles: 1
        Handle: 3672 Address: DF:A9:FF:F6:B1:1A (OUI DF-A9-FF)
        Count: 1
< ACL Data TX: Handle 3672 flags 0x00 dlen 21             #216 [hci1] 12.763538
      SMP: Pairing Confirm (0x03) len 16
        Confim value: 7fcdd087b6d159a9033d5d1c75a71c55
> HCI Event: Number of Completed Packets (0x13) plen 5    #217 [hci1] 12.804428
        Num handles: 1
        Handle: 3672 Address: DF:A9:FF:F6:B1:1A (OUI DF-A9-FF)
        Count: 1
        #216: len 21 (4 Kb/s)
        Latency: 40 msec (21-51 msec ~41 msec)
> ACL Data RX: Handle 3672 flags 0x02 dlen 21             #218 [hci1] 12.854592
      SMP: Pairing Confirm (0x03) len 16
        Confim value: 42d342bab380601f629f07531fcc7970
< HCI Command: Host Number of Com.. (0x03|0x0035) plen 5  #219 [hci1] 12.863343
        Num handles: 1
        Handle: 3672 Address: DF:A9:FF:F6:B1:1A (OUI DF-A9-FF)
        Count: 1
< ACL Data TX: Handle 3672 flags 0x00 dlen 21             #220 [hci1] 12.863449
      SMP: Pairing Random (0x04) len 16
        Random value: 81bafb7c3fcffc8b40d9b0b09bc4296b
> HCI Event: Number of Completed Packets (0x13) plen 5    #221 [hci1] 12.904577
        Num handles: 1
        Handle: 3672 Address: DF:A9:FF:F6:B1:1A (OUI DF-A9-FF)
        Count: 1
        #220: len 21 (4 Kb/s)
        Latency: 41 msec (21-51 msec ~41 msec)
> ACL Data RX: Handle 3672 flags 0x02 dlen 21             #222 [hci1] 13.154641
      SMP: Pairing Random (0x04) len 16
        Random value: 361d764335d0f5f9c6c9c53c1fcb0965
< HCI Command: Host Number of Com.. (0x03|0x0035) plen 5  #223 [hci1] 13.163802
        Num handles: 1
        Handle: 3672 Address: DF:A9:FF:F6:B1:1A (OUI DF-A9-FF)
        Count: 1
< ACL Data TX: Handle 3672 flags 0x00 dlen 21             #224 [hci1] 13.163915
      SMP: Pairing DHKey Check (0x0d) len 16
        E: f5b05fb33c0efa046c3b5689439da061
> HCI Event: Number of Completed Packets (0x13) plen 5    #225 [hci1] 13.204283
        Num handles: 1
        Handle: 3672 Address: DF:A9:FF:F6:B1:1A (OUI DF-A9-FF)
        Count: 1
        #224: len 21 (4 Kb/s)
        Latency: 40 msec (21-51 msec ~40 msec)
> ACL Data RX: Handle 3672 flags 0x02 dlen 21             #226 [hci1] 13.254576
      SMP: Pairing DHKey Check (0x0d) len 16
        E: e4a567aff356b51c88022e8be022bdb4
< HCI Command: LE Start Encryption (0x08|0x0019) plen 28  #227 [hci1] 13.263482
        Handle: 3672 Address: DF:A9:FF:F6:B1:1A (OUI DF-A9-FF)
        Random number: 0x0000000000000000
        Encrypted diversifier: 0x0000
        Long term key: 469e1d0e3b1f100a7e3d0b5efb89db43
> HCI Event: Command Status (0x0f) plen 4                 #228 [hci1] 13.264343
      LE Start Encryption (0x08|0x0019) ncmd 1
        Status: Success (0x00)
< HCI Command: Host Number of Com.. (0x03|0x0035) plen 5  #229 [hci1] 13.283100
        Num handles: 1
        Handle: 3672 Address: DF:A9:FF:F6:B1:1A (OUI DF-A9-FF)
        Count: 1
> HCI Event: Encryption Change (0x08) plen 4              #230 [hci1] 13.604347
        Status: Success (0x00)
        Handle: 3672 Address: DF:A9:FF:F6:B1:1A (OUI DF-A9-FF)
        Encryption: Enabled with AES-CCM (0x01)
< HCI Command: Disconnect (0x01|0x0006) plen 3            #231 [hci1] 14.262795
        Handle: 3672 Address: DF:A9:FF:F6:B1:1A (OUI DF-A9-FF)
        Reason: Remote User Terminated Connection (0x13)
> HCI Event: Command Status (0x0f) plen 4                 #232 [hci1] 14.263172
      Disconnect (0x01|0x0006) ncmd 1
        Status: Success (0x00)
> HCI Event: Disconnect Complete (0x05) plen 4            #233 [hci1] 14.354278
        Status: Success (0x00)
        Handle: 3672 Address: DF:A9:FF:F6:B1:1A (OUI DF-A9-FF)
        Reason: Connection Terminated By Local Host (0x16)
< HCI Command: Reset (0x03|0x0003) plen 0                 #234 [hci1] 21.292896
> HCI Event: Command Complete (0x0e) plen 4               #235 [hci1] 21.293490
      Reset (0x03|0x0003) ncmd 1
        Status: Success (0x00)
@ USER Close: main                                    {0x0001} [hci1] 21.302845
= Close Index: 00:00:00:00:00:00                               [hci1] 21.302852
