Bluetooth monitor ver 5.72
= Note: Linux version 6.14.0-36-generic (x86_64)                       0.537482
= Note: Bluetooth subsystem version 2.22                               0.537483
= New Index: 00:00:00:00:00:00 (Primary,UART,hci1)              [hci1] 0.537485
= New Index: 48:5F:99:8E:E0:64 (Primary,USB,hci0)               [hci0] 0.537486
= Open Index: 00:00:00:00:00:00                                 [hci1] 0.651722
= Index Info: 00:00:00:00:00:00 (Nordic Semiconductor ASA)      [hci1] 0.651739
@ USER Open: main (privileged) version 2.22            {0x0001} [hci1] 0.651750
< HCI Command: Reset (0x03|0x0003) plen 0                    #1 [hci1] 0.653008
> HCI Event: Command Complete (0x0e) plen 4                  #2 [hci1] 0.653500
      Reset (0x03|0x0003) ncmd 1
        Status: Success (0x00)
< HCI Command: Read Local Supported... (0x04|0x0003) plen 0  #3 [hci1] 0.671518
> HCI Event: Command Complete (0x0e) plen 12                 #4 [hci1] 0.672110
      Read Local Supported Features (0x04|0x0003) ncmd 1
        Status: Success (0x00)
        Features: 0x00 0x00 0x00 0x00 0x60 0x00 0x00 0x00
          BR/EDR Not Supported
          LE Supported (Controller)
< HCI Command: Read Local Version In.. (0x04|0x0001) plen 0  #5 [hci1] 0.691175
> HCI Event: Command Complete (0x0e) plen 12                 #6 [hci1] 0.691678
      Read Local Version Information (0x04|0x0001) ncmd 1
        Status: Success (0x00)
        HCI version: Reserved (0x0f) - Revision 12393 (0x3069)
        LMP version: Reserved (0x0f) - Subversion 12393 (0x3069)
        Manufacturer: Nordic Semiconductor ASA (89)
< HCI Command: Read Local Supported... (0x04|0x0002) plen 0  #7 [hci1] 0.711108
> HCI Event: Command Complete (0x0e) plen 68                 #8 [hci1] 0.712155
      Read Local Supported Commands (0x04|0x0002) ncmd 1
        Status: Success (0x00)
        Commands: 119 entries
          Disconnect (Octet 0 - Bit 5)
          Read Remote Version Information (Octet 2 - Bit 7)
          Set Event Mask (Octet 5 - Bit 6)
          Reset (Octet 5 - Bit 7)
          Read Connection Accept Timeout (Octet 7 - Bit 2)
          Write Connection Accept Timeout (Octet 7 - Bit 3)
          Read Transmit Power Level (Octet 10 - Bit 2)
          Set Controller To Host Flow Control (Octet 10 - Bit 5)
          Host Buffer Size (Octet 10 - Bit 6)
          Host Number of Completed Packets (Octet 10 - Bit 7)
          Read Local Version Information (Octet 14 - Bit 3)
          Read Local Supported Features (Octet 14 - Bit 5)
          Read BD ADDR (Octet 15 - Bit 1)
          Read RSSI (Octet 15 - Bit 5)
          Set Event Mask Page 2 (Octet 22 - Bit 2)
          LE Set Event Mask (Octet 25 - Bit 0)
          LE Read Buffer Size (Octet 25 - Bit 1)
          LE Read Local Supported Features (Octet 25 - Bit 2)
          LE Set Random Address (Octet 25 - Bit 4)
          LE Set Advertising Parameters (Octet 25 - Bit 5)
          LE Read Advertising Channel TX Power (Octet 25 - Bit 6)
          LE Set Advertising Data (Octet 25 - Bit 7)
          LE Set Scan Response Data (Octet 26 - Bit 0)
          LE Set Advertise Enable (Octet 26 - Bit 1)
          LE Set Scan Parameters (Octet 26 - Bit 2)
          LE Set Scan Enable (Octet 26 - Bit 3)
          LE Create Connection (Octet 26 - Bit 4)
          LE Create Connection Cancel (Octet 26 - Bit 5)
          LE Read Accept List Size (Octet 26 - Bit 6)
          LE Clear Accept List (Octet 26 - Bit 7)
          LE Add Device To Accept List (Octet 27 - Bit 0)
          LE Remove Device From Accept List (Octet 27 - Bit 1)
          LE Connection Update (Octet 27 - Bit 2)
          LE Set Host Channel Classification (Octet 27 - Bit 3)
          LE Read Channel Map (Octet 27 - Bit 4)
          LE Read Remote Used Features (Octet 27 - Bit 5)
          LE Encrypt (Octet 27 - Bit 6)
          LE Rand (Octet 27 - Bit 7)
          LE Start Encryption (Octet 28 - Bit 0)
          LE Long Term Key Request Reply (Octet 28 - Bit 1)
          LE Long Term Key Request Neg Reply (Octet 28 - Bit 2)
          LE Read Supported States (Octet 28 - Bit 3)
          LE Receiver Test (Octet 28 - Bit 4)
          LE Transmitter Test (Octet 28 - Bit 5)
          LE Test End (Octet 28 - Bit 6)
          Read Authenticated Payload Timeout (Octet 32 - Bit 4)
          Write Authenticated Payload Timeout (Octet 32 - Bit 5)
          LE Set Data Length (Octet 33 - Bit 6)
          LE Read Suggested Default Data Length (Octet 33 - Bit 7)
          LE Write Suggested Default Data Length (Octet 34 - Bit 0)
          LE Add Device To Resolving List (Octet 34 - Bit 3)
          LE Remove Device From Resolving List (Octet 34 - Bit 4)
          LE Clear Resolving List (Octet 34 - Bit 5)
          LE Read Resolving List Size (Octet 34 - Bit 6)
          LE Set Address Resolution Enable (Octet 35 - Bit 1)
          LE Set Resolvable Private Address Timeout (Octet 35 - Bit 2)
          LE Read Maximum Data Length (Octet 35 - Bit 3)
          LE Read PHY (Octet 35 - Bit 4)
          LE Set Default PHY (Octet 35 - Bit 5)
          LE Set PHY (Octet 35 - Bit 6)
          LE Enhanced Receiver Test (Octet 35 - Bit 7)
          LE Enhanced Transmitter Test (Octet 36 - Bit 0)
          LE Set Advertising Set Random Address (Octet 36 - Bit 1)
          LE Set Extended Advertising Parameters (Octet 36 - Bit 2)
          LE Set Extended Advertising Data (Octet 36 - Bit 3)
          LE Set Extended Scan Response Data (Octet 36 - Bit 4)
          LE Set Extended Advertising Enable (Octet 36 - Bit 5)
          LE Read Maximum Advertising Data Length (Octet 36 - Bit 6)
          LE Read Number of Supported Advertising Sets (Octet 36 - Bit 7)
          LE Remove Advertising Set (Octet 37 - Bit 0)
          LE Clear Advertising Sets (Octet 37 - Bit 1)
          LE Set Periodic Advertising Parameters (Octet 37 - Bit 2)
          LE Set Periodic Advertising Data (Octet 37 - Bit 3)
          LE Set Periodic Advertising Enable (Octet 37 - Bit 4)
          LE Set Extended Scan Parameters (Octet 37 - Bit 5)
          LE Set Extended Scan Enable (Octet 37 - Bit 6)
          LE Extended Create Connection (Octet 37 - Bit 7)
          LE Periodic Advertising Create Sync (Octet 38 - Bit 0)
          LE Periodic Advertising Create Sync Cancel (Octet 38 - Bit 1)
          LE Periodic Advertising Terminate Sync (Octet 38 - Bit 2)
          LE Add Device To Periodic Advertiser List (Octet 38 - Bit 3)
          LE Remove Device From Periodic Advertiser List (Octet 38 - Bit 4)
          LE Clear Periodic Advertiser List (Octet 38 - Bit 5)
          LE Read Periodic Advertiser List Size (Octet 38 - Bit 6)
          LE Read Transmit Power (Octet 38 - Bit 7)
          LE Read RF Path Compensation (Octet 39 - Bit 0)
          LE Write RF Path Compensation (Octet 39 - Bit 1)
          LE Set Privacy Mode (Octet 39 - Bit 2)
          LE Periodic Advertising Receive Enable (Octet 40 - Bit 5)
          LE Periodic Advertising Sync Transfer (Octet 40 - Bit 6)
          LE Periodic Advertising Set Info Transfer (Octet 40 - Bit 7)
          LE Periodic Advertising Sync Transfer Parameters (Octet 41 - Bit 0)
          LE Set Default Periodic Advertisng Sync Transfer Parameters (Octet 41 - Bit 1)
          LE Read Buffer v2 (Octet 41 - Bit 5)
          LE Read ISO TX Sync (Octet 41 - Bit 6)
          LE Set Connected Isochronous Group Parameters (Octet 41 - Bit 7)
          LE Set Connected Isochronous Group Parameters Test (Octet 42 - Bit 0)
          LE Create Connected Isochronous Stream (Octet 42 - Bit 1)
          LE Remove Connected Isochronous Group (Octet 42 - Bit 2)
          LE Accept Connected Isochronous Stream Request (Octet 42 - Bit 3)
          LE Reject Connected Isochronous Stream Request (Octet 42 - Bit 4)
          LE Create Broadcast Isochronous Group (Octet 42 - Bit 5)
          LE Create Broadcast Isochronous Group Test (Octet 42 - Bit 6)
          LE Terminate Broadcast Isochronous Group (Octet 42 - Bit 7)
          LE Broadcast Isochronous Group Create Sync (Octet 43 - Bit 0)
          LE Broadcast Isochronous Group Terminate Sync (Octet 43 - Bit 1)
          LE Request Peer SCA (Octet 43 - Bit 2)
          LE Setup Isochronous Data Path (Octet 43 - Bit 3)
          LE Remove Isochronous Data Path (Octet 43 - Bit 4)
          LE Isochronous Transmit Test (Octet 43 - Bit 5)
          LE Isochronous Receive Test (Octet 43 - Bit 6)
          LE Isochronous Read Test Counters (Octet 43 - Bit 7)
          LE Isochronous Read Test Counters (Octet 44 - Bit 0)
          LE Set Host Feature (Octet 44 - Bit 1)
          Octet 44 - Bit 2 
          Octet 45 - Bit 6 
          Octet 46 - Bit 0 
          Octet 46 - Bit 1 
          Octet 46 - Bit 2 
< HCI Command: Host Buffer Size (0x03|0x0033) plen 7         #9 [hci1] 0.731116
        ACL MTU: 255  ACL max packet: 16
        SCO MTU: 0    SCO max packet: 0
> HCI Event: Command Complete (0x0e) plen 4                 #10 [hci1] 0.731574
      Host Buffer Size (0x03|0x0033) ncmd 1
        Status: Success (0x00)
< HCI Command: Set Controller To Ho.. (0x03|0x0031) plen 1  #11 [hci1] 0.751114
        Flow control: ACL Data Packets (0x01)
> HCI Event: Command Complete (0x0e) plen 4                 #12 [hci1] 0.751531
      Set Controller To Host Flow Control (0x03|0x0031) ncmd 1
        Status: Success (0x00)
< HCI Command: LE Read Local Suppor.. (0x08|0x0003) plen 0  #13 [hci1] 0.771123
> HCI Event: Command Complete (0x0e) plen 12                #14 [hci1] 0.771567
      LE Read Local Supported Features (0x08|0x0003) ncmd 1
        Status: Success (0x00)
        Features: 0xfd 0x79 0x00 0xf7 0x30 0x01 0x00 0x00
          LE Encryption
          Extended Reject Indication
          Peripheral-initiated Features Exchange
          LE Ping
          LE Data Packet Length Extension
          LL Privacy
          Extended Scanner Filter Policies
          LE 2M PHY
          LE Coded PHY
          LE Extended Advertising
          LE Periodic Advertising
          Channel Selection Algorithm #2
          Periodic Advertising Sync Transfer - Sender
          Periodic Advertising Sync Transfer - Recipient
          Sleep Clock Accuracy Updates
          Connected Isochronous Stream - Central
          Connected Isochronous Stream - Peripheral
          Isochronous Broadcaster
          Synchronized Receiver
          Periodic Advertising ADI support
          Connection Subrating
          Unknown features (0x0000010000000000)
< HCI Command: LE Set Host Feature (0x08|0x0074) plen 2     #15 [hci1] 0.791091
        Bit Number: 32
          Connected Isochronous Stream (Host Support)
        Bit Value: 1
> HCI Event: Command Complete (0x0e) plen 4                 #16 [hci1] 0.791528
      LE Set Host Feature (0x08|0x0074) ncmd 1
        Status: Success (0x00)
< HCI Command: LE Read Buffer v2 (0x08|0x0060) plen 0       #17 [hci1] 0.811078
> HCI Event: Command Complete (0x0e) plen 10                #18 [hci1] 0.811532
      LE Read Buffer v2 (0x08|0x0060) ncmd 1
        Status: Success (0x00)
        ACL MTU: 27
        ACL max packet: 3
        ISO MTU: 318
        ISO max packet: 3
< HCI Command: LE Read Maximum Adve.. (0x08|0x003a) plen 0  #19 [hci1] 0.831149
> HCI Event: Command Complete (0x0e) plen 6                 #20 [hci1] 0.831615
      LE Read Maximum Advertising Data Length (0x08|0x003a) ncmd 1
        Status: Success (0x00)
        Max length: 1650
< HCI Command: LE Read Supported St.. (0x08|0x001c) plen 0  #21 [hci1] 0.851109
> HCI Event: Command Complete (0x0e) plen 12                #22 [hci1] 0.851683
      LE Read Supported States (0x08|0x001c) ncmd 1
        Status: Success (0x00)
        States: 0x000003ff3e0306ff
          Non-connectable Advertising State
          Scannable Advertising State
          Connectable Advertising State
          High Duty Cycle Directed Advertising State
          Passive Scanning State
          Active Scanning State
          Initiating State
            and Connection State (Central Role)
          Connection State (Peripheral Role)
          Scannable Advertising State
            and Passive Scanning State
          Connectable Advertising State
            and Passive Scanning State
          Non-connectable Advertising State
            and Initiating State
          Scannable Advertising State
            and Initiating State
          Active Scanning State
            and Connection State (Central Role)
          Passive Scanning State
            and Connection State (Peripheral Role)
          Active Scanning State
            and Connection State (Peripheral Role)
          Initiating State
            and Connection State (Central Role)
            and Central Role & Central Role
          Low Duty Cycle Directed Advertising State
          Connectable Advertising State
            and Initiating State
            and Central Role & Peripheral Role
          High Duty Cycle Directed Advertising State
            and Initiating State
            and Central Role & Peripheral Role
          Low Duty Cycle Directed Advertising State
            and Initiating State
            and Central Role & Peripheral Role
          Connectable Advertising State
            and Connection State (Central Role)
            and Central Role & Peripheral Role
          High Duty Cycle Directed Advertising State
            and Connection State (Central Role)
            and Central Role & Peripheral Role
          Low Duty Cycle Directed Advertising State
            and Connection State (Central Role)
            and Central Role & Peripheral Role
          Connectable Advertising State
            and Connection State (Peripheral Role)
            and Central Role & Peripheral Role
          High Duty Cycle Directed Advertising State
            and Connection State (Peripheral Role)
            and Peripheral Role & Peripheral Role
          Low Duty Cycle Directed Advertising State
            and Connection State (Peripheral Role)
            and Peripheral Role & Peripheral Role
          Initiating State
            and Connection State (Peripheral Role)
            and Central Role & Peripheral Role
< HCI Command: LE Read Maximum Data.. (0x08|0x002f) plen 0  #23 [hci1] 0.871129
> HCI Event: Command Complete (0x0e) plen 12                #24 [hci1] 0.871676
      LE Read Maximum Data Length (0x08|0x002f) ncmd 1
        Status: Success (0x00)
        Max TX octets: 251
        Max TX time: 2704
        Max RX octets: 251
        Max RX time: 2704
< HCI Command: LE Write Suggested D.. (0x08|0x0024) plen 4  #25 [hci1] 0.891109
        TX octets: 251
        TX time: 2704
> HCI Event: Command Complete (0x0e) plen 4                 #26 [hci1] 0.891628
      LE Write Suggested Default Data Length (0x08|0x0024) ncmd 1
        Status: Success (0x00)
< HCI Command: LE Read Resolving Li.. (0x08|0x002a) plen 0  #27 [hci1] 0.911124
> HCI Event: Command Complete (0x0e) plen 5                 #28 [hci1] 0.911615
      LE Read Resolving List Size (0x08|0x002a) ncmd 1
        Status: Success (0x00)
        Size: 8
< HCI Command: LE Set Event Mask (0x08|0x0001) plen 8       #29 [hci1] 0.931118
        Mask: 0x000002023f87fa5e
          LE Advertising Report
          LE Connection Update Complete
          LE Read Remote Used Features Complete
          LE Long Term Key Request
          LE Data Length Change
          LE Enhanced Connection Complete
          LE PHY Update Complete
          LE Extended Advertising Report
          LE Periodic Advertising Sync Established
          LE Periodic Advertising Report
          LE Periodic Advertising Sync Lost
          LE Extended Scan Timeout
          LE Extended Advertising Set Terminated
          LE Scan Request Received
          LE Periodic Advertising Sync Transfer Rvc
          LE CIS Established
          LE CIS Request
          LE Create BIG Complete
          LE Terminate BIG Complete
          LE BIG Sync Estabilished Complete
          LE BIG Sync Lost
          LE BIG Info Advertising Report
          Unknown mask (0x0000020000000000)
> HCI Event: Command Complete (0x0e) plen 4                 #30 [hci1] 0.931590
      LE Set Event Mask (0x08|0x0001) ncmd 1
        Status: Success (0x00)
< HCI Command: Set Event Mask (0x03|0x0001) plen 8          #31 [hci1] 0.951126
        Mask: 0x2000800002008890
          Disconnection Complete
          Encryption Change
          Read Remote Version Information Complete
          Hardware Error
          Data Buffer Overflow
          Encryption Key Refresh Complete
          LE Meta
> HCI Event: Command Complete (0x0e) plen 4                 #32 [hci1] 0.951679
      Set Event Mask (0x03|0x0001) ncmd 1
        Status: Success (0x00)
< HCI Command: Read BD ADDR (0x04|0x0009) plen 0            #33 [hci1] 0.971134
> HCI Event: Command Complete (0x0e) plen 10                #34 [hci1] 0.971625
      Read BD ADDR (0x04|0x0009) ncmd 1
        Status: Success (0x00)
        Address: 00:00:00:00:00:00 (OUI 00-00-00)
< HCI Command: LE Set Random Address (0x08|0x0005) plen 6   #35 [hci1] 0.991124
        Address: D5:B6:CC:31:DB:3B (Static)
> HCI Event: Command Complete (0x0e) plen 4                 #36 [hci1] 0.991612
      LE Set Random Address (0x08|0x0005) ncmd 1
        Status: Success (0x00)
< HCI Command: LE Set Extended Adv.. (0x08|0x0036) plen 25  #37 [hci1] 3.521499
        Handle: 0x00
        Properties: 0x0013
          Connectable
          Scannable
          Use legacy advertising PDUs: ADV_IND
        Min advertising interval: 100.000 msec (0x00a0)
        Max advertising interval: 150.000 msec (0x00f0)
        Channel map: 37, 38, 39 (0x07)
        Own address type: Random (0x01)
        Peer address type: Public (0x00)
        Peer address: 00:00:00:00:00:00 (OUI 00-00-00)
        Filter policy: Allow Scan Request from Any, Allow Connect Request from Any (0x00)
        TX power: Host has no preference (0x7f)
        Primary PHY: LE 1M (0x01)
        Secondary max skip: 0x00
        Secondary PHY: LE 1M (0x01)
        SID: 0x00
        Scan request notifications: Disabled (0x00)
> HCI Event: Command Complete (0x0e) plen 5                 #38 [hci1] 3.522275
      LE Set Extended Advertising Parameters (0x08|0x0036) ncmd 1
        Status: Success (0x00)
        TX power (selected): 0 dbm (0x00)
< HCI Command: LE Set Advertising S.. (0x08|0x0035) plen 7  #39 [hci1] 3.531484
        Advertising handle: 0x00
        Advertising random address: D5:B6:CC:31:DB:3B (Static)
> HCI Event: Command Complete (0x0e) plen 4                 #40 [hci1] 3.532106
      LE Set Advertising Set Random Address (0x08|0x0035) ncmd 1
        Status: Success (0x00)
< HCI Command: LE Set Extended Adv.. (0x08|0x0037) plen 22  #41 [hci1] 3.551281
        Handle: 0x00
        Operation: Complete extended advertising data (0x03)
        Fragment preference: Minimize fragmentation (0x01)
        Data length: 0x12
        Flags: 0x06
          LE General Discoverable Mode
          BR/EDR Not Supported
        Name (complete): Tester_F6B11A
> HCI Event: Command Complete (0x0e) plen 4                 #42 [hci1] 3.552053
      LE Set Extended Advertising Data (0x08|0x0037) ncmd 1
        Status: Success (0x00)
< HCI Command: LE Set Extended Scan.. (0x08|0x0038) plen 4  #43 [hci1] 3.571166
        Handle: 0x00
        Operation: Complete scan response data (0x03)
        Fragment preference: Minimize fragmentation (0x01)
        Data length: 0x00
> HCI Event: Command Complete (0x0e) plen 4                 #44 [hci1] 3.571641
      LE Set Extended Scan Response Data (0x08|0x0038) ncmd 1
        Status: Success (0x00)
< HCI Command: LE Set Extended Adve.. (0x08|0x0039) plen 6  #45 [hci1] 3.591121
        Extended advertising: Enabled (0x01)
        Number of sets: 1 (0x01)
        Entry 0
          Handle: 0x00
          Duration: 0 ms (0x00)
          Max ext adv events: 0
> HCI Event: Command Complete (0x0e) plen 4                 #46 [hci1] 3.591705
      LE Set Extended Advertising Enable (0x08|0x0039) ncmd 1
        Status: Success (0x00)
> HCI Event: LE Meta Event (0x3e) plen 31                   #47 [hci1] 3.705369
      LE Enhanced Connection Complete (0x0a)
        Status: Success (0x00)
        Handle: 2631
        Role: Peripheral (0x01)
        Peer address type: Public (0x00)
        Peer address: DF:A9:FF:F6:B1:1A (OUI DF-A9-FF)
        Local resolvable private address: 00:00:00:00:00:00 (Non-Resolvable)
        Peer resolvable private address: 00:00:00:00:00:00 (Non-Resolvable)
        Connection interval: 87.50 msec (0x0046)
        Connection latency: 0 (0x0000)
        Supervision timeout: 25120 msec (0x09d0)
        Central clock accuracy: 0x01
> HCI Event: LE Meta Event (0x3e) plen 6                    #48 [hci1] 3.705507
      LE Advertising Set Terminated (0x12)
        Status: Success (0x00)
        Handle: 0
        Connection handle: 2631
        Number of completed extended advertising events: 0
< HCI Command: LE Read Remote Used... (0x08|0x0016) plen 2  #49 [hci1] 3.712074
        Handle: 2631 Address: DF:A9:FF:F6:B1:1A (OUI DF-A9-FF)
< ACL Data TX: Handle 2631 flags 0x00 dlen 7                #50 [hci1] 3.712107
      ATT: Exchange MTU Request (0x02) len 2
        Client RX MTU: 251
> HCI Event: Command Status (0x0f) plen 4                   #51 [hci1] 3.712647
      LE Read Remote Used Features (0x08|0x0016) ncmd 1
        Status: Success (0x00)
> HCI Event: Number of Completed Packets (0x13) plen 5      #52 [hci1] 3.881357
        Num handles: 1
        Handle: 2631 Address: DF:A9:FF:F6:B1:1A (OUI DF-A9-FF)
        Count: 1
        #50: len 7 (0 Kb/s)
        Latency: 169 msec (169-169 msec ~169 msec)
> HCI Event: LE Meta Event (0x3e) plen 12                   #53 [hci1] 3.969395
      LE Read Remote Used Features (0x04)
        Status: Success (0x00)
        Handle: 2631 Address: DF:A9:FF:F6:B1:1A (OUI DF-A9-FF)
        Features: 0x2d 0x49 0x00 0xf7 0x67 0xd9 0x00 0x80
          LE Encryption
          Extended Reject Indication
          Peripheral-initiated Features Exchange
          LE Data Packet Length Extension
          LE 2M PHY
          LE Coded PHY
          Channel Selection Algorithm #2
          Periodic Advertising Sync Transfer - Sender
          Periodic Advertising Sync Transfer - Recipient
          Sleep Clock Accuracy Updates
          Connected Isochronous Stream - Central
          Connected Isochronous Stream - Peripheral
          Isochronous Broadcaster
          Synchronized Receiver
          Connected Isochronous Stream (Host Support)
          LE Power Control Request
          LE Power Control Request
          Connection Subrating
          Connection Subrating (Host Support)
          Unknown features (0x8000d90000000000)
> ACL Data RX: Handle 2631 flags 0x02 dlen 11               #54 [hci1] 6.419011
      SMP: Pairing Request (0x01) len 6
        IO capability: KeyboardDisplay (0x04)
        OOB data: Authentication data not present (0x00)
        Authentication requirement: Bonding, MITM, SC, No Keypresses (0x0d)
        Max encryption key size: 16
        Initiator key distribution: EncKey IdKey (0x03)
        Responder key distribution: EncKey IdKey Sign (0x07)
> ACL Data RX: Handle 2631 flags 0x02 dlen 7                #55 [hci1] 6.419430
      ATT: Exchange MTU Response (0x03) len 2
        Server RX MTU: 23
< HCI Command: Host Number of Compl.. (0x03|0x0035) plen 5  #56 [hci1] 6.431601
        Num handles: 1
        Handle: 2631 Address: DF:A9:FF:F6:B1:1A (OUI DF-A9-FF)
        Count: 1
< ACL Data TX: Handle 2631 flags 0x00 dlen 11               #57 [hci1] 6.431643
      SMP: Pairing Response (0x02) len 6
        IO capability: DisplayOnly (0x00)
        OOB data: Authentication data not present (0x00)
        Authentication requirement: Bonding, No MITM, SC, No Keypresses (0x09)
        Max encryption key size: 16
        Initiator key distribution: IdKey (0x02)
        Responder key distribution: <none> (0x00)
< HCI Command: Host Number of Compl.. (0x03|0x0035) plen 5  #58 [hci1] 6.431968
        Num handles: 1
        Handle: 2631 Address: DF:A9:FF:F6:B1:1A (OUI DF-A9-FF)
        Count: 1
> HCI Event: Number of Completed Packets (0x13) plen 5      #59 [hci1] 6.594088
        Num handles: 1
        Handle: 2631 Address: DF:A9:FF:F6:B1:1A (OUI DF-A9-FF)
        Count: 1
        #57: len 11 (0 Kb/s)
        Latency: 162 msec (162-169 msec ~165 msec)
> ACL Data RX: Handle 2631 flags 0x02 dlen 27               #60 [hci1] 6.594465
> ACL Data RX: Handle 2631 flags 0x01 dlen 27               #61 [hci1] 6.594998
> ACL Data RX: Handle 2631 flags 0x01 dlen 15               #62 [hci1] 6.595346
      SMP: Pairing Public Key (0x0c) len 64
        X: 22b098e9ac672125580708f00ace203e216352bb5a9618e943e0df25e0141399
        Y: 701afeee79c4656bccf485485158264967f57a744ccf82a0502ec65f66c9cb47
< HCI Command: Host Number of Compl.. (0x03|0x0035) plen 5  #63 [hci1] 6.612061
        Num handles: 1
        Handle: 2631 Address: DF:A9:FF:F6:B1:1A (OUI DF-A9-FF)
        Count: 1
< HCI Command: Host Number of Compl.. (0x03|0x0035) plen 5  #64 [hci1] 6.612221
        Num handles: 1
        Handle: 2631 Address: DF:A9:FF:F6:B1:1A (OUI DF-A9-FF)
        Count: 1
< HCI Command: Host Number of Compl.. (0x03|0x0035) plen 5  #65 [hci1] 6.612567
        Num handles: 1
        Handle: 2631 Address: DF:A9:FF:F6:B1:1A (OUI DF-A9-FF)
        Count: 1
< ACL Data TX: Handle 2631 flags 0x00 dlen 27               #66 [hci1] 6.612781
< ACL Data TX: Handle 2631 flags 0x01 dlen 27               #67 [hci1] 6.612798
< ACL Data TX: Handle 2631 flags 0x01 dlen 15               #68 [hci1] 6.612827
      SMP: Pairing Public Key (0x0c) len 64
        X: 98308440221e2d910f0e54b71e7ec652857aa9b5a0dc65028824cc19db1226e9
        Y: 67a4816bcb62efb21701e31fdb27561a6217575fb007a8bbdabe7e28b6f68482
> HCI Event: Number of Completed Packets (0x13) plen 5      #69 [hci1] 6.682004
        Num handles: 1
        Handle: 2631 Address: DF:A9:FF:F6:B1:1A (OUI DF-A9-FF)
        Count: 1
        #66: len 27 (3 Kb/s)
        Latency: 69 msec (69-169 msec ~117 msec)
> HCI Event: Number of Completed Packets (0x13) plen 5      #70 [hci1] 6.682725
        Num handles: 1
        Handle: 2631 Address: DF:A9:FF:F6:B1:1A (OUI DF-A9-FF)
        Count: 1
        #67: len 27 (3 Kb/s)
        Latency: 69 msec (69-169 msec ~93 msec)
> HCI Event: Number of Completed Packets (0x13) plen 5      #71 [hci1] 6.768860
        Num handles: 1
        Handle: 2631 Address: DF:A9:FF:F6:B1:1A (OUI DF-A9-FF)
        Count: 1
        #68: len 15 (0 Kb/s)
        Latency: 156 msec (69-169 msec ~124 msec)
> ACL Data RX: Handle 2631 flags 0x02 dlen 21               #72 [hci1] 7.731684
      SMP: Pairing Confirm (0x03) len 16
        Confim value: e61a6c02b1c3f193f62344d01f86207b
< HCI Command: Host Number of Compl.. (0x03|0x0035) plen 5  #73 [hci1] 7.751756
        Num handles: 1
        Handle: 2631 Address: DF:A9:FF:F6:B1:1A (OUI DF-A9-FF)
        Count: 1
< ACL Data TX: Handle 2631 flags 0x00 dlen 21               #74 [hci1] 7.751778
      SMP: Pairing Confirm (0x03) len 16
        Confim value: b8c91d83411f79d3e9dc45845fe9efec
> HCI Event: Number of Completed Packets (0x13) plen 5      #75 [hci1] 7.906529
        Num handles: 1
        Handle: 2631 Address: DF:A9:FF:F6:B1:1A (OUI DF-A9-FF)
        Count: 1
        #74: len 21 (1 Kb/s)
        Latency: 154 msec (69-169 msec ~139 msec)
> ACL Data RX: Handle 2631 flags 0x02 dlen 21               #76 [hci1] 7.906826
      SMP: Pairing Random (0x04) len 16
        Random value: cc05fa7450fd63100000000000000000
< HCI Command: Host Number of Compl.. (0x03|0x0035) plen 5  #77 [hci1] 7.911948
        Num handles: 1
        Handle: 2631 Address: DF:A9:FF:F6:B1:1A (OUI DF-A9-FF)
        Count: 1
< ACL Data TX: Handle 2631 flags 0x00 dlen 21               #78 [hci1] 7.912025
      SMP: Pairing Random (0x04) len 16
        Random value: 8e6108f966a694cbe26df70bb96773e6
> HCI Event: Number of Completed Packets (0x13) plen 5      #79 [hci1] 8.081338
        Num handles: 1
        Handle: 2631 Address: DF:A9:FF:F6:B1:1A (OUI DF-A9-FF)
        Count: 1
        #78: len 21 (0 Kb/s)
        Latency: 169 msec (69-169 msec ~154 msec)
> ACL Data RX: Handle 2631 flags 0x02 dlen 21               #80 [hci1] 8.169187
      SMP: Pairing Confirm (0x03) len 16
        Confim value: 030c03711c24ecf2c55c5b0eb7df4d03
< HCI Command: Host Number of Compl.. (0x03|0x0035) plen 5  #81 [hci1] 8.171343
        Num handles: 1
        Handle: 2631 Address: DF:A9:FF:F6:B1:1A (OUI DF-A9-FF)
        Count: 1
< ACL Data TX: Handle 2631 flags 0x00 dlen 21               #82 [hci1] 8.171350
      SMP: Pairing Confirm (0x03) len 16
        Confim value: de9a0c8618c22054dee44584e8ce2af9
> HCI Event: Number of Completed Packets (0x13) plen 5      #83 [hci1] 8.344112
        Num handles: 1
        Handle: 2631 Address: DF:A9:FF:F6:B1:1A (OUI DF-A9-FF)
        Count: 1
        #82: len 21 (0 Kb/s)
        Latency: 172 msec (69-172 msec ~163 msec)
> ACL Data RX: Handle 2631 flags 0x02 dlen 21               #84 [hci1] 8.344313
      SMP: Pairing Random (0x04) len 16
        Random value: bbb2f47fc0b1a0890000000000000000
< HCI Command: Host Number of Compl.. (0x03|0x0035) plen 5  #85 [hci1] 8.351867
        Num handles: 1
        Handle: 2631 Address: DF:A9:FF:F6:B1:1A (OUI DF-A9-FF)
        Count: 1
< ACL Data TX: Handle 2631 flags 0x00 dlen 21               #86 [hci1] 8.351944
      SMP: Pairing Random (0x04) len 16
        Random value: 4d02679f89a05211af56d8b3da64d21e
> HCI Event: Number of Completed Packets (0x13) plen 5      #87 [hci1] 8.518793
        Num handles: 1
        Handle: 2631 Address: DF:A9:FF:F6:B1:1A (OUI DF-A9-FF)
        Count: 1
        #86: len 21 (1 Kb/s)
        Latency: 166 msec (69-172 msec ~165 msec)
> ACL Data RX: Handle 2631 flags 0x02 dlen 21               #88 [hci1] 8.606700
      SMP: Pairing Confirm (0x03) len 16
        Confim value: 41f64a0f3fe053e06042171b4d969b09
< HCI Command: Host Number of Compl.. (0x03|0x0035) plen 5  #89 [hci1] 8.611655
        Num handles: 1
        Handle: 2631 Address: DF:A9:FF:F6:B1:1A (OUI DF-A9-FF)
        Count: 1
< ACL Data TX: Handle 2631 flags 0x00 dlen 21               #90 [hci1] 8.611744
      SMP: Pairing Confirm (0x03) len 16
        Confim value: f86c1eda3db8d2c8b5d8207a5c7a6f2b
> HCI Event: Number of Completed Packets (0x13) plen 5      #91 [hci1] 8.781539
        Num handles: 1
        Handle: 2631 Address: DF:A9:FF:F6:B1:1A (OUI DF-A9-FF)
        Count: 1
        #90: len 21 (0 Kb/s)
        Latency: 169 msec (69-172 msec ~167 msec)
> ACL Data RX: Handle 2631 flags 0x02 dlen 21               #92 [hci1] 8.781936
      SMP: Pairing Random (0x04) len 16
        Random value: e2d47ec5763a1bf20000000000000000
< HCI Command: Host Number of Compl.. (0x03|0x0035) plen 5  #93 [hci1] 8.791892
        Num handles: 1
        Handle: 2631 Address: DF:A9:FF:F6:B1:1A (OUI DF-A9-FF)
        Count: 1
< ACL Data TX: Handle 2631 flags 0x00 dlen 21               #94 [hci1] 8.791982
      SMP: Pairing Random (0x04) len 16
        Random value: 5e8286bc235a02440d0c3424a2acf8fd
> HCI Event: Number of Completed Packets (0x13) plen 5      #95 [hci1] 8.956290
        Num handles: 1
        Handle: 2631 Address: DF:A9:FF:F6:B1:1A (OUI DF-A9-FF)
        Count: 1
        #94: len 21 (1 Kb/s)
        Latency: 164 msec (69-172 msec ~165 msec)
> ACL Data RX: Handle 2631 flags 0x02 dlen 21               #96 [hci1] 9.044131
      SMP: Pairing Confirm (0x03) len 16
        Confim value: 580c584a14b889559034cddabdc84cf3
< HCI Command: Host Number of Compl.. (0x03|0x0035) plen 5  #97 [hci1] 9.051454
        Num handles: 1
        Handle: 2631 Address: DF:A9:FF:F6:B1:1A (OUI DF-A9-FF)
        Count: 1
< ACL Data TX: Handle 2631 flags 0x00 dlen 21               #98 [hci1] 9.051500
      SMP: Pairing Confirm (0x03) len 16
        Confim value: cecc2fcf301f17c9ba09cef5e7d9dc67
> HCI Event: Number of Completed Packets (0x13) plen 5      #99 [hci1] 9.219158
        Num handles: 1
        Handle: 2631 Address: DF:A9:FF:F6:B1:1A (OUI DF-A9-FF)
        Count: 1
        #98: len 21 (1 Kb/s)
        Latency: 167 msec (69-172 msec ~166 msec)
> ACL Data RX: Handle 2631 flags 0x02 dlen 21              #100 [hci1] 9.219301
      SMP: Pairing Random (0x04) len 16
        Random value: 71aa1c3e74266bb90000000000000000
< HCI Command: Host Number of Comp.. (0x03|0x0035) plen 5  #101 [hci1] 9.231943
        Num handles: 1
        Handle: 2631 Address: DF:A9:FF:F6:B1:1A (OUI DF-A9-FF)
        Count: 1
< ACL Data TX: Handle 2631 flags 0x00 dlen 21              #102 [hci1] 9.232043
      SMP: Pairing Random (0x04) len 16
        Random value: 5c4a1bcadd27bd58e945097b00bad7ac
> HCI Event: Number of Completed Packets (0x13) plen 5     #103 [hci1] 9.393782
        Num handles: 1
        Handle: 2631 Address: DF:A9:FF:F6:B1:1A (OUI DF-A9-FF)
        Count: 1
        #102: len 21 (1 Kb/s)
        Latency: 161 msec (69-172 msec ~164 msec)
> ACL Data RX: Handle 2631 flags 0x02 dlen 21              #104 [hci1] 9.481726
      SMP: Pairing Confirm (0x03) len 16
        Confim value: 01a2f2822f2113671db2de2ddf7f376c
< HCI Command: Host Number of Comp.. (0x03|0x0035) plen 5  #105 [hci1] 9.491830
        Num handles: 1
        Handle: 2631 Address: DF:A9:FF:F6:B1:1A (OUI DF-A9-FF)
        Count: 1
< ACL Data TX: Handle 2631 flags 0x00 dlen 21              #106 [hci1] 9.491905
      SMP: Pairing Confirm (0x03) len 16
        Confim value: cd4e705982ff0517aa5ff36f4393e8ce
> HCI Event: Number of Completed Packets (0x13) plen 5     #107 [hci1] 9.656480
        Num handles: 1
        Handle: 2631 Address: DF:A9:FF:F6:B1:1A (OUI DF-A9-FF)
        Count: 1
        #106: len 21 (1 Kb/s)
        Latency: 164 msec (69-172 msec ~164 msec)
> ACL Data RX: Handle 2631 flags 0x02 dlen 21              #108 [hci1] 9.656829
      SMP: Pairing Random (0x04) len 16
        Random value: ea0fc07fcda4c1540000000000000000
< HCI Command: Host Number of Comp.. (0x03|0x0035) plen 5  #109 [hci1] 9.671999
        Num handles: 1
        Handle: 2631 Address: DF:A9:FF:F6:B1:1A (OUI DF-A9-FF)
        Count: 1
< ACL Data TX: Handle 2631 flags 0x00 dlen 21              #110 [hci1] 9.672085
      SMP: Pairing Random (0x04) len 16
        Random value: 32527e6e64e79f33b2e374394db8ab2d
> HCI Event: Number of Completed Packets (0x13) plen 5     #111 [hci1] 9.831331
        Num handles: 1
        Handle: 2631 Address: DF:A9:FF:F6:B1:1A (OUI DF-A9-FF)
        Count: 1
        #110: len 21 (1 Kb/s)
        Latency: 159 msec (69-172 msec ~161 msec)
> ACL Data RX: Handle 2631 flags 0x02 dlen 21              #112 [hci1] 9.919179
      SMP: Pairing Confirm (0x03) len 16
        Confim value: 260d0494619e1a1dd8d71f5dff1e3d65
< HCI Command: Host Number of Comp.. (0x03|0x0035) plen 5  #113 [hci1] 9.931319
        Num handles: 1
        Handle: 2631 Address: DF:A9:FF:F6:B1:1A (OUI DF-A9-FF)
        Count: 1
< ACL Data TX: Handle 2631 flags 0x00 dlen 21              #114 [hci1] 9.931360
      SMP: Pairing Confirm (0x03) len 16
        Confim value: 7baf4f9566791d21c3096d9e77663518
> HCI Event: Number of Completed Packets (0x13) plen 5    #115 [hci1] 10.093988
        Num handles: 1
        Handle: 2631 Address: DF:A9:FF:F6:B1:1A (OUI DF-A9-FF)
        Count: 1
        #114: len 21 (1 Kb/s)
        Latency: 162 msec (69-172 msec ~162 msec)
> ACL Data RX: Handle 2631 flags 0x02 dlen 21             #116 [hci1] 10.094303
      SMP: Pairing Random (0x04) len 16
        Random value: 3c4dab8ab7a630ae0000000000000000
< HCI Command: Host Number of Com.. (0x03|0x0035) plen 5  #117 [hci1] 10.112033
        Num handles: 1
        Handle: 2631 Address: DF:A9:FF:F6:B1:1A (OUI DF-A9-FF)
        Count: 1
< ACL Data TX: Handle 2631 flags 0x00 dlen 21             #118 [hci1] 10.112133
      SMP: Pairing Random (0x04) len 16
        Random value: dddbdfe2838e9a8cc6964353c850fef7
> HCI Event: Number of Completed Packets (0x13) plen 5    #119 [hci1] 10.269380
        Num handles: 1
        Handle: 2631 Address: DF:A9:FF:F6:B1:1A (OUI DF-A9-FF)
        Count: 1
        #118: len 21 (1 Kb/s)
        Latency: 157 msec (69-172 msec ~159 msec)
> ACL Data RX: Handle 2631 flags 0x02 dlen 21             #120 [hci1] 10.356651
      SMP: Pairing Confirm (0x03) len 16
        Confim value: db252d351597cd1279396b054763cf79
< HCI Command: Host Number of Com.. (0x03|0x0035) plen 5  #121 [hci1] 10.371766
        Num handles: 1
        Handle: 2631 Address: DF:A9:FF:F6:B1:1A (OUI DF-A9-FF)
        Count: 1
< ACL Data TX: Handle 2631 flags 0x00 dlen 21             #122 [hci1] 10.371849
      SMP: Pairing Confirm (0x03) len 16
        Confim value: a4aeeb50c011d871d2240b7280919280
> HCI Event: Number of Completed Packets (0x13) plen 5    #123 [hci1] 10.531417
        Num handles: 1
        Handle: 2631 Address: DF:A9:FF:F6:B1:1A (OUI DF-A9-FF)
        Count: 1
        #122: len 21 (1 Kb/s)
        Latency: 159 msec (69-172 msec ~159 msec)
> ACL Data RX: Handle 2631 flags 0x02 dlen 21             #124 [hci1] 10.531864
      SMP: Pairing Random (0x04) len 16
        Random value: 3967430e0b64cad60000000000000000
< HCI Command: Host Number of Com.. (0x03|0x0035) plen 5  #125 [hci1] 10.551220
        Num handles: 1
        Handle: 2631 Address: DF:A9:FF:F6:B1:1A (OUI DF-A9-FF)
        Count: 1
< ACL Data TX: Handle 2631 flags 0x00 dlen 21             #126 [hci1] 10.551236
      SMP: Pairing Random (0x04) len 16
        Random value: eb9f1915536596b6fc3db1c86b2b1970
> HCI Event: Number of Completed Packets (0x13) plen 5    #127 [hci1] 10.706199
        Num handles: 1
        Handle: 2631 Address: DF:A9:FF:F6:B1:1A (OUI DF-A9-FF)
        Count: 1
        #126: len 21 (1 Kb/s)
        Latency: 154 msec (69-172 msec ~157 msec)
> ACL Data RX: Handle 2631 flags 0x02 dlen 21             #128 [hci1] 10.794062
      SMP: Pairing Confirm (0x03) len 16
        Confim value: 1eadd4521ad2bf2dfa2a8fcb4e3f592c
< HCI Command: Host Number of Com.. (0x03|0x0035) plen 5  #129 [hci1] 10.811248
        Num handles: 1
        Handle: 2631 Address: DF:A9:FF:F6:B1:1A (OUI DF-A9-FF)
        Count: 1
< ACL Data TX: Handle 2631 flags 0x00 dlen 21             #130 [hci1] 10.811273
      SMP: Pairing Confirm (0x03) len 16
        Confim value: 34c6936b4d65739f054c50521f9c45aa
> HCI Event: Number of Completed Packets (0x13) plen 5    #131 [hci1] 10.968979
        Num handles: 1
        Handle: 2631 Address: DF:A9:FF:F6:B1:1A (OUI DF-A9-FF)
        Count: 1
        #130: len 21 (1 Kb/s)
        Latency: 157 msec (69-172 msec ~157 msec)
> ACL Data RX: Handle 2631 flags 0x02 dlen 21             #132 [hci1] 10.969282
      SMP: Pairing Random (0x04) len 16
        Random value: b05f92dc8173f3a10000000000000000
< HCI Command: Host Number of Com.. (0x03|0x0035) plen 5  #133 [hci1] 10.971346
        Num handles: 1
        Handle: 2631 Address: DF:A9:FF:F6:B1:1A (OUI DF-A9-FF)
        Count: 1
< ACL Data TX: Handle 2631 flags 0x00 dlen 21             #134 [hci1] 10.971453
      SMP: Pairing Random (0x04) len 16
        Random value: 5c794dc9ad9f2c3f295ebd5ad5e1c3cf
> HCI Event: Number of Completed Packets (0x13) plen 5    #135 [hci1] 11.143744
        Num handles: 1
        Handle: 2631 Address: DF:A9:FF:F6:B1:1A (OUI DF-A9-FF)
        Count: 1
        #134: len 21 (0 Kb/s)
        Latency: 172 msec (69-172 msec ~164 msec)
> ACL Data RX: Handle 2631 flags 0x02 dlen 21             #136 [hci1] 11.231695
      SMP: Pairing Confirm (0x03) len 16
        Confim value: b35cb948579c049fcf82f6911dfa59a8
< HCI Command: Host Number of Com.. (0x03|0x0035) plen 5  #137 [hci1] 11.251313
        Num handles: 1
        Handle: 2631 Address: DF:A9:FF:F6:B1:1A (OUI DF-A9-FF)
        Count: 1
< ACL Data TX: Handle 2631 flags 0x00 dlen 21             #138 [hci1] 11.251356
      SMP: Pairing Confirm (0x03) len 16
        Confim value: 1c3f4502b5d01679c0801745164b0a6e
> HCI Event: Number of Completed Packets (0x13) plen 5    #139 [hci1] 11.406505
        Num handles: 1
        Handle: 2631 Address: DF:A9:FF:F6:B1:1A (OUI DF-A9-FF)
        Count: 1
        #138: len 21 (1 Kb/s)
        Latency: 155 msec (69-172 msec ~160 msec)
> ACL Data RX: Handle 2631 flags 0x02 dlen 21             #140 [hci1] 11.406765
      SMP: Pairing Random (0x04) len 16
        Random value: 041e8189dc47ffba0000000000000000
< HCI Command: Host Number of Com.. (0x03|0x0035) plen 5  #141 [hci1] 11.411943
        Num handles: 1
        Handle: 2631 Address: DF:A9:FF:F6:B1:1A (OUI DF-A9-FF)
        Count: 1
< ACL Data TX: Handle 2631 flags 0x00 dlen 21             #142 [hci1] 11.411992
      SMP: Pairing Random (0x04) len 16
        Random value: 5c2fff312cdf99c9491988e877355a9a
> HCI Event: Number of Completed Packets (0x13) plen 5    #143 [hci1] 11.581249
        Num handles: 1
        Handle: 2631 Address: DF:A9:FF:F6:B1:1A (OUI DF-A9-FF)
        Count: 1
        #142: len 21 (0 Kb/s)
        Latency: 169 msec (69-172 msec ~164 msec)
> ACL Data RX: Handle 2631 flags 0x02 dlen 21             #144 [hci1] 11.669079
      SMP: Pairing Confirm (0x03) len 16
        Confim value: 68f9d619286332d3f0fdccb1e879cd0b
< HCI Command: Host Number of Com.. (0x03|0x0035) plen 5  #145 [hci1] 11.671431
        Num handles: 1
        Handle: 2631 Address: DF:A9:FF:F6:B1:1A (OUI DF-A9-FF)
        Count: 1
< ACL Data TX: Handle 2631 flags 0x00 dlen 21             #146 [hci1] 11.671499
      SMP: Pairing Confirm (0x03) len 16
        Confim value: 3cc47f50b3ef2be9eec27ea9b4405fe7
> HCI Event: Number of Completed Packets (0x13) plen 5    #147 [hci1] 11.844041
        Num handles: 1
        Handle: 2631 Address: DF:A9:FF:F6:B1:1A (OUI DF-A9-FF)
        Count: 1
        #146: len 21 (0 Kb/s)
        Latency: 172 msec (69-172 msec ~168 msec)
> ACL Data RX: Handle 2631 flags 0x02 dlen 21             #148 [hci1] 11.844289
      SMP: Pairing Random (0x04) len 16
        Random value: 3ee3d6d4b9e24a670000000000000000
< HCI Command: Host Number of Com.. (0x03|0x0035) plen 5  #149 [hci1] 11.852086
        Num handles: 1
        Handle: 2631 Address: DF:A9:FF:F6:B1:1A (OUI DF-A9-FF)
        Count: 1
< ACL Data TX: Handle 2631 flags 0x00 dlen 21             #150 [hci1] 11.852248
      SMP: Pairing Random (0x04) len 16
        Random value: c629a3a987d808e808655d558dfc1155
> HCI Event: Number of Completed Packets (0x13) plen 5    #151 [hci1] 12.018715
        Num handles: 1
        Handle: 2631 Address: DF:A9:FF:F6:B1:1A (OUI DF-A9-FF)
        Count: 1
        #150: len 21 (1 Kb/s)
        Latency: 166 msec (69-172 msec ~167 msec)
> ACL Data RX: Handle 2631 flags 0x02 dlen 21             #152 [hci1] 12.106549
      SMP: Pairing Confirm (0x03) len 16
        Confim value: 99d825edf5d4d777eb6642fe885dc358
< HCI Command: Host Number of Com.. (0x03|0x0035) plen 5  #153 [hci1] 12.111417
        Num handles: 1
        Handle: 2631 Address: DF:A9:FF:F6:B1:1A (OUI DF-A9-FF)
        Count: 1
< ACL Data TX: Handle 2631 flags 0x00 dlen 21             #154 [hci1] 12.111440
      SMP: Pairing Confirm (0x03) len 16
        Confim value: c5eca1a0ba6d79b147f69e776ae10bab
> HCI Event: Number of Completed Packets (0x13) plen 5    #155 [hci1] 12.281427
        Num handles: 1
        Handle: 2631 Address: DF:A9:FF:F6:B1:1A (OUI DF-A9-FF)
        Count: 1
        #154: len 21 (0 Kb/s)
        Latency: 169 msec (69-172 msec ~168 msec)
> ACL Data RX: Handle 2631 flags 0x02 dlen 21             #156 [hci1] 12.281790
      SMP: Pairing Random (0x04) len 16
        Random value: cbe2f574f98f63f20000000000000000
< HCI Command: Host Number of Com.. (0x03|0x0035) plen 5  #157 [hci1] 12.291929
        Num handles: 1
        Handle: 2631 Address: DF:A9:FF:F6:B1:1A (OUI DF-A9-FF)
        Count: 1
< ACL Data TX: Handle 2631 flags 0x00 dlen 21             #158 [hci1] 12.292026
      SMP: Pairing Random (0x04) len 16
        Random value: 92f20f6ad8f13724432c7fd6001c45ff
> HCI Event: Number of Completed Packets (0x13) plen 5    #159 [hci1] 12.456195
        Num handles: 1
        Handle: 2631 Address: DF:A9:FF:F6:B1:1A (OUI DF-A9-FF)
        Count: 1
        #158: len 21 (1 Kb/s)
        Latency: 164 msec (69-172 msec ~166 msec)
> ACL Data RX: Handle 2631 flags 0x02 dlen 21             #160 [hci1] 12.544110
      SMP: Pairing Confirm (0x03) len 16
        Confim value: d04f0699f8871753bcefcbde48122bd2
< HCI Command: Host Number of Com.. (0x03|0x0035) plen 5  #161 [hci1] 12.551711
        Num handles: 1
        Handle: 2631 Address: DF:A9:FF:F6:B1:1A (OUI DF-A9-FF)
        Count: 1
< ACL Data TX: Handle 2631 flags 0x00 dlen 21             #162 [hci1] 12.551786
      SMP: Pairing Confirm (0x03) len 16
        Confim value: 7eded8450b3597341e158a021ffa22eb
> HCI Event: Number of Completed Packets (0x13) plen 5    #163 [hci1] 12.719021
        Num handles: 1
        Handle: 2631 Address: DF:A9:FF:F6:B1:1A (OUI DF-A9-FF)
        Count: 1
        #162: len 21 (1 Kb/s)
        Latency: 167 msec (69-172 msec ~166 msec)
> ACL Data RX: Handle 2631 flags 0x02 dlen 21             #164 [hci1] 12.719246
      SMP: Pairing Random (0x04) len 16
        Random value: 90cb106dcc6e79210000000000000000
< HCI Command: Host Number of Com.. (0x03|0x0035) plen 5  #165 [hci1] 12.732010
        Num handles: 1
        Handle: 2631 Address: DF:A9:FF:F6:B1:1A (OUI DF-A9-FF)
        Count: 1
< ACL Data TX: Handle 2631 flags 0x00 dlen 21             #166 [hci1] 12.732113
      SMP: Pairing Random (0x04) len 16
        Random value: 23ac32ebbb5e14c8a6b9622f296d277f
> HCI Event: Number of Completed Packets (0x13) plen 5    #167 [hci1] 12.893772
        Num handles: 1
        Handle: 2631 Address: DF:A9:FF:F6:B1:1A (OUI DF-A9-FF)
        Count: 1
        #166: len 21 (1 Kb/s)
        Latency: 161 msec (69-172 msec ~164 msec)
> ACL Data RX: Handle 2631 flags 0x02 dlen 21             #168 [hci1] 12.981546
      SMP: Pairing Confirm (0x03) len 16
        Confim value: a7f8a3fbfe46a83952a3c38a983793e3
< HCI Command: Host Number of Com.. (0x03|0x0035) plen 5  #169 [hci1] 12.991605
        Num handles: 1
        Handle: 2631 Address: DF:A9:FF:F6:B1:1A (OUI DF-A9-FF)
        Count: 1
< ACL Data TX: Handle 2631 flags 0x00 dlen 21             #170 [hci1] 12.991718
      SMP: Pairing Confirm (0x03) len 16
        Confim value: 717cfb72fb0f817b8eb978dd6ec33693
> HCI Event: Number of Completed Packets (0x13) plen 5    #171 [hci1] 13.156423
        Num handles: 1
        Handle: 2631 Address: DF:A9:FF:F6:B1:1A (OUI DF-A9-FF)
        Count: 1
        #170: len 21 (1 Kb/s)
        Latency: 164 msec (69-172 msec ~164 msec)
> ACL Data RX: Handle 2631 flags 0x02 dlen 21             #172 [hci1] 13.156867
      SMP: Pairing Random (0x04) len 16
        Random value: ab1cff1501d163fb0000000000000000
< HCI Command: Host Number of Com.. (0x03|0x0035) plen 5  #173 [hci1] 13.171594
        Num handles: 1
        Handle: 2631 Address: DF:A9:FF:F6:B1:1A (OUI DF-A9-FF)
        Count: 1
< ACL Data TX: Handle 2631 flags 0x00 dlen 21             #174 [hci1] 13.171672
      SMP: Pairing Random (0x04) len 16
        Random value: 297efe85e67448a15f56bd27e3a3cf1d
> HCI Event: Number of Completed Packets (0x13) plen 5    #175 [hci1] 13.331281
        Num handles: 1
        Handle: 2631 Address: DF:A9:FF:F6:B1:1A (OUI DF-A9-FF)
        Count: 1
        #174: len 21 (1 Kb/s)
        Latency: 159 msec (69-172 msec ~162 msec)
> ACL Data RX: Handle 2631 flags 0x02 dlen 21             #176 [hci1] 13.419085
      SMP: Pairing Confirm (0x03) len 16
        Confim value: fde9f280ccb523b54b85da96c7269725
< HCI Command: Host Number of Com.. (0x03|0x0035) plen 5  #177 [hci1] 13.431903
        Num handles: 1
        Handle: 2631 Address: DF:A9:FF:F6:B1:1A (OUI DF-A9-FF)
        Count: 1
< ACL Data TX: Handle 2631 flags 0x00 dlen 21             #178 [hci1] 13.432020
      SMP: Pairing Confirm (0x03) len 16
        Confim value: 8ba70675a1126bcccc519f1299f013b4
> HCI Event: Number of Completed Packets (0x13) plen 5    #179 [hci1] 13.593949
        Num handles: 1
        Handle: 2631 Address: DF:A9:FF:F6:B1:1A (OUI DF-A9-FF)
        Count: 1
        #178: len 21 (1 Kb/s)
        Latency: 161 msec (69-172 msec ~161 msec)
> ACL Data RX: Handle 2631 flags 0x02 dlen 21             #180 [hci1] 13.594325
      SMP: Pairing Random (0x04) len 16
        Random value: c63be840b65433240000000000000000
< HCI Command: Host Number of Com.. (0x03|0x0035) plen 5  #181 [hci1] 13.612015
        Num handles: 1
        Handle: 2631 Address: DF:A9:FF:F6:B1:1A (OUI DF-A9-FF)
        Count: 1
< ACL Data TX: Handle 2631 flags 0x00 dlen 21             #182 [hci1] 13.612099
      SMP: Pairing Random (0x04) len 16
        Random value: 25a9493fd3ce4faf02be7293595bb7c6
> HCI Event: Number of Completed Packets (0x13) plen 5    #183 [hci1] 13.768776
        Num handles: 1
        Handle: 2631 Address: DF:A9:FF:F6:B1:1A (OUI DF-A9-FF)
        Count: 1
        #182: len 21 (1 Kb/s)
        Latency: 156 msec (69-172 msec ~159 msec)
> ACL Data RX: Handle 2631 flags 0x02 dlen 21             #184 [hci1] 13.856631
      SMP: Pairing Confirm (0x03) len 16
        Confim value: 356db42f99064832118c66dd7419c8f8
< HCI Command: Host Number of Com.. (0x03|0x0035) plen 5  #185 [hci1] 13.871848
        Num handles: 1
        Handle: 2631 Address: DF:A9:FF:F6:B1:1A (OUI DF-A9-FF)
        Count: 1
< ACL Data TX: Handle 2631 flags 0x00 dlen 21             #186 [hci1] 13.871956
      SMP: Pairing Confirm (0x03) len 16
        Confim value: 6f05afdb3e89d124da2a18aca1888f94
> HCI Event: Number of Completed Packets (0x13) plen 5    #187 [hci1] 14.031422
        Num handles: 1
        Handle: 2631 Address: DF:A9:FF:F6:B1:1A (OUI DF-A9-FF)
        Count: 1
        #186: len 21 (1 Kb/s)
        Latency: 159 msec (69-172 msec ~159 msec)
> ACL Data RX: Handle 2631 flags 0x02 dlen 21             #188 [hci1] 14.031822
      SMP: Pairing Random (0x04) len 16
        Random value: cf693e6872bde40f0000000000000000
< HCI Command: Host Number of Com.. (0x03|0x0035) plen 5  #189 [hci1] 14.052053
        Num handles: 1
        Handle: 2631 Address: DF:A9:FF:F6:B1:1A (OUI DF-A9-FF)
        Count: 1
< ACL Data TX: Handle 2631 flags 0x00 dlen 21             #190 [hci1] 14.052155
      SMP: Pairing Random (0x04) len 16
        Random value: 58f6b41f855a6f6c3560debd84e2affc
> HCI Event: Number of Completed Packets (0x13) plen 5    #191 [hci1] 14.206225
        Num handles: 1
        Handle: 2631 Address: DF:A9:FF:F6:B1:1A (OUI DF-A9-FF)
        Count: 1
        #190: len 21 (1 Kb/s)
        Latency: 154 msec (69-172 msec ~156 msec)
> ACL Data RX: Handle 2631 flags 0x02 dlen 21             #192 [hci1] 14.294006
      SMP: Pairing Confirm (0x03) len 16
        Confim value: 51a4673f108de5b0403e70cad5fb3e3e
< HCI Command: Host Number of Com.. (0x03|0x0035) plen 5  #193 [hci1] 14.311572
        Num handles: 1
        Handle: 2631 Address: DF:A9:FF:F6:B1:1A (OUI DF-A9-FF)
        Count: 1
< ACL Data TX: Handle 2631 flags 0x00 dlen 21             #194 [hci1] 14.311622
      SMP: Pairing Confirm (0x03) len 16
        Confim value: 0798074028a9b759363b42d4c39ff24d
> HCI Event: Number of Completed Packets (0x13) plen 5    #195 [hci1] 14.468884
        Num handles: 1
        Handle: 2631 Address: DF:A9:FF:F6:B1:1A (OUI DF-A9-FF)
        Count: 1
        #194: len 21 (1 Kb/s)
        Latency: 157 msec (69-172 msec ~156 msec)
> ACL Data RX: Handle 2631 flags 0x02 dlen 21             #196 [hci1] 14.469244
      SMP: Pairing Random (0x04) len 16
        Random value: b62575e546b326460000000000000000
< HCI Command: Host Number of Com.. (0x03|0x0035) plen 5  #197 [hci1] 14.472109
        Num handles: 1
        Handle: 2631 Address: DF:A9:FF:F6:B1:1A (OUI DF-A9-FF)
        Count: 1
< ACL Data TX: Handle 2631 flags 0x00 dlen 21             #198 [hci1] 14.472201
      SMP: Pairing Random (0x04) len 16
        Random value: b67e7216d5bf664139eda2b542549666
> HCI Event: Number of Completed Packets (0x13) plen 5    #199 [hci1] 14.643699
        Num handles: 1
        Handle: 2631 Address: DF:A9:FF:F6:B1:1A (OUI DF-A9-FF)
        Count: 1
        #198: len 21 (0 Kb/s)
        Latency: 171 msec (69-172 msec ~164 msec)
> ACL Data RX: Handle 2631 flags 0x02 dlen 21             #200 [hci1] 14.731569
      SMP: Pairing Confirm (0x03) len 16
        Confim value: 8cf2077f090d6d183b64a21d6ae928d1
< HCI Command: Host Number of Com.. (0x03|0x0035) plen 5  #201 [hci1] 14.751454
        Num handles: 1
        Handle: 2631 Address: DF:A9:FF:F6:B1:1A (OUI DF-A9-FF)
        Count: 1
< ACL Data TX: Handle 2631 flags 0x00 dlen 21             #202 [hci1] 14.751498
      SMP: Pairing Confirm (0x03) len 16
        Confim value: b822c51f18117649acc8713031f5b6d9
> HCI Event: Number of Completed Packets (0x13) plen 5    #203 [hci1] 14.906342
        Num handles: 1
        Handle: 2631 Address: DF:A9:FF:F6:B1:1A (OUI DF-A9-FF)
        Count: 1
        #202: len 21 (1 Kb/s)
        Latency: 154 msec (69-172 msec ~159 msec)
> ACL Data RX: Handle 2631 flags 0x02 dlen 21             #204 [hci1] 14.906734
      SMP: Pairing Random (0x04) len 16
        Random value: 23e458c1c585cba20000000000000000
< HCI Command: Host Number of Com.. (0x03|0x0035) plen 5  #205 [hci1] 14.912076
        Num handles: 1
        Handle: 2631 Address: DF:A9:FF:F6:B1:1A (OUI DF-A9-FF)
        Count: 1
< ACL Data TX: Handle 2631 flags 0x00 dlen 21             #206 [hci1] 14.912178
      SMP: Pairing Random (0x04) len 16
        Random value: ed17f76500c95219dd01e09d1e63f87b
> HCI Event: Number of Completed Packets (0x13) plen 5    #207 [hci1] 15.081185
        Num handles: 1
        Handle: 2631 Address: DF:A9:FF:F6:B1:1A (OUI DF-A9-FF)
        Count: 1
        #206: len 21 (0 Kb/s)
        Latency: 169 msec (69-172 msec ~164 msec)
> ACL Data RX: Handle 2631 flags 0x02 dlen 21             #208 [hci1] 15.169153
      SMP: Pairing Confirm (0x03) len 16
        Confim value: b820b7b2274bc488b945e8d8ffebd865
< HCI Command: Host Number of Com.. (0x03|0x0035) plen 5  #209 [hci1] 15.171638
        Num handles: 1
        Handle: 2631 Address: DF:A9:FF:F6:B1:1A (OUI DF-A9-FF)
        Count: 1
< ACL Data TX: Handle 2631 flags 0x00 dlen 21             #210 [hci1] 15.171724
      SMP: Pairing Confirm (0x03) len 16
        Confim value: 717d30b2fe951e3b969e930b2d388804
> HCI Event: Number of Completed Packets (0x13) plen 5    #211 [hci1] 15.343953
        Num handles: 1
        Handle: 2631 Address: DF:A9:FF:F6:B1:1A (OUI DF-A9-FF)
        Count: 1
        #210: len 21 (0 Kb/s)
        Latency: 172 msec (69-172 msec ~168 msec)
> ACL Data RX: Handle 2631 flags 0x02 dlen 21             #212 [hci1] 15.344250
      SMP: Pairing Random (0x04) len 16
        Random value: 57150398262b0ecc0000000000000000
< HCI Command: Host Number of Com.. (0x03|0x0035) plen 5  #213 [hci1] 15.352012
        Num handles: 1
        Handle: 2631 Address: DF:A9:FF:F6:B1:1A (OUI DF-A9-FF)
        Count: 1
< ACL Data TX: Handle 2631 flags 0x00 dlen 21             #214 [hci1] 15.352090
      SMP: Pairing Random (0x04) len 16
        Random value: 81d35d47e1f6006d79c974bd9d9e1ee3
> HCI Event: Number of Completed Packets (0x13) plen 5    #215 [hci1] 15.518718
        Num handles: 1
        Handle: 2631 Address: DF:A9:FF:F6:B1:1A (OUI DF-A9-FF)
        Count: 1
        #214: len 21 (1 Kb/s)
        Latency: 166 msec (69-172 msec ~167 msec)
> ACL Data RX: Handle 2631 flags 0x02 dlen 21             #216 [hci1] 15.606615
      SMP: Pairing Confirm (0x03) len 16
        Confim value: ab46a55c538429ec2e3e38639d2f91a2
< HCI Command: Host Number of Com.. (0x03|0x0035) plen 5  #217 [hci1] 15.611628
        Num handles: 1
        Handle: 2631 Address: DF:A9:FF:F6:B1:1A (OUI DF-A9-FF)
        Count: 1
< ACL Data TX: Handle 2631 flags 0x00 dlen 21             #218 [hci1] 15.611689
      SMP: Pairing Confirm (0x03) len 16
        Confim value: db9204c3e3e5216dfcc40e9806ad7d74
> HCI Event: Number of Completed Packets (0x13) plen 5    #219 [hci1] 15.781404
        Num handles: 1
        Handle: 2631 Address: DF:A9:FF:F6:B1:1A (OUI DF-A9-FF)
        Count: 1
        #218: len 21 (0 Kb/s)
        Latency: 169 msec (69-172 msec ~168 msec)
> ACL Data RX: Handle 2631 flags 0x02 dlen 21             #220 [hci1] 15.781768
      SMP: Pairing Random (0x04) len 16
        Random value: ee8315f8415ad0f00000000000000000
< HCI Command: Host Number of Com.. (0x03|0x0035) plen 5  #221 [hci1] 15.792127
        Num handles: 1
        Handle: 2631 Address: DF:A9:FF:F6:B1:1A (OUI DF-A9-FF)
        Count: 1
< ACL Data TX: Handle 2631 flags 0x00 dlen 21             #222 [hci1] 15.792212
      SMP: Pairing Random (0x04) len 16
        Random value: e7f7e0c2476823e41736a7e381bafb7c
> HCI Event: Number of Completed Packets (0x13) plen 5    #223 [hci1] 15.956146
        Num handles: 1
        Handle: 2631 Address: DF:A9:FF:F6:B1:1A (OUI DF-A9-FF)
        Count: 1
        #222: len 21 (1 Kb/s)
        Latency: 163 msec (69-172 msec ~166 msec)
> ACL Data RX: Handle 2631 flags 0x02 dlen 21             #224 [hci1] 16.044071
      SMP: Pairing Confirm (0x03) len 16
        Confim value: 8e0d483e0437768021bcd9adecad10ee
< HCI Command: Host Number of Com.. (0x03|0x0035) plen 5  #225 [hci1] 16.051568
        Num handles: 1
        Handle: 2631 Address: DF:A9:FF:F6:B1:1A (OUI DF-A9-FF)
        Count: 1
< ACL Data TX: Handle 2631 flags 0x00 dlen 21             #226 [hci1] 16.051619
      SMP: Pairing Confirm (0x03) len 16
        Confim value: 50b6ff8162eb91c7dfe72c1339e2b3c0
> HCI Event: Number of Completed Packets (0x13) plen 5    #227 [hci1] 16.218939
        Num handles: 1
        Handle: 2631 Address: DF:A9:FF:F6:B1:1A (OUI DF-A9-FF)
        Count: 1
        #226: len 21 (1 Kb/s)
        Latency: 167 msec (69-172 msec ~166 msec)
> ACL Data RX: Handle 2631 flags 0x02 dlen 21             #228 [hci1] 16.219243
      SMP: Pairing Random (0x04) len 16
        Random value: 995cbb081b9d0a420000000000000000
< HCI Command: Host Number of Com.. (0x03|0x0035) plen 5  #229 [hci1] 16.232063
        Num handles: 1
        Handle: 2631 Address: DF:A9:FF:F6:B1:1A (OUI DF-A9-FF)
        Count: 1
< ACL Data TX: Handle 2631 flags 0x00 dlen 21             #230 [hci1] 16.232148
      SMP: Pairing Random (0x04) len 16
        Random value: fc8b40d9b0b09bc4296bf8753a8f6e1f
> HCI Event: Number of Completed Packets (0x13) plen 5    #231 [hci1] 16.393692
        Num handles: 1
        Handle: 2631 Address: DF:A9:FF:F6:B1:1A (OUI DF-A9-FF)
        Count: 1
        #230: len 21 (1 Kb/s)
        Latency: 161 msec (69-172 msec ~164 msec)
> ACL Data RX: Handle 2631 flags 0x02 dlen 21             #232 [hci1] 16.569065
      SMP: Pairing DHKey Check (0x0d) len 16
        E: d63e4be17456294908d58e58c7c0768e
< HCI Command: Host Number of Com.. (0x03|0x0035) plen 5  #233 [hci1] 16.571836
        Num handles: 1
        Handle: 2631 Address: DF:A9:FF:F6:B1:1A (OUI DF-A9-FF)
        Count: 1
< ACL Data TX: Handle 2631 flags 0x00 dlen 21             #234 [hci1] 16.571883
      SMP: Pairing DHKey Check (0x0d) len 16
        E: 71eb8f38911bd61b82ec5ef42504c7cd
> HCI Event: Number of Completed Packets (0x13) plen 5    #235 [hci1] 16.743736
        Num handles: 1
        Handle: 2631 Address: DF:A9:FF:F6:B1:1A (OUI DF-A9-FF)
        Count: 1
        #234: len 21 (0 Kb/s)
        Latency: 171 msec (69-172 msec ~168 msec)
> HCI Event: LE Meta Event (0x3e) plen 13                 #236 [hci1] 16.831788
      LE Long Term Key Request (0x05)
        Handle: 2631 Address: DF:A9:FF:F6:B1:1A (OUI DF-A9-FF)
        Random number: 0x0000000000000000
        Encrypted diversifier: 0x0000
< HCI Command: LE Long Term Key... (0x08|0x001a) plen 18  #237 [hci1] 16.851705
        Handle: 2631 Address: DF:A9:FF:F6:B1:1A (OUI DF-A9-FF)
        Long term key: ab0e13157aed6c031c8e2339dddee9a6
> HCI Event: Command Complete (0x0e) plen 6               #238 [hci1] 16.852417
      LE Long Term Key Request Reply (0x08|0x001a) ncmd 1
        Status: Success (0x00)
        Handle: 2631 Address: DF:A9:FF:F6:B1:1A (OUI DF-A9-FF)
> HCI Event: Encryption Change (0x08) plen 4              #239 [hci1] 17.269043
        Status: Success (0x00)
        Handle: 2631 Address: DF:A9:FF:F6:B1:1A (OUI DF-A9-FF)
        Encryption: Enabled with AES-CCM (0x01)
> ACL Data RX: Handle 2631 flags 0x02 dlen 21             #240 [hci1] 17.356671
      SMP: Identity Information (0x08) len 16
        Identity resolving key: 25923ed3f5df676a3d208f6e039df3f5
< HCI Command: Host Number of Com.. (0x03|0x0035) plen 5  #241 [hci1] 17.382156
        Num handles: 1
        Handle: 2631 Address: DF:A9:FF:F6:B1:1A (OUI DF-A9-FF)
        Count: 1
> ACL Data RX: Handle 2631 flags 0x02 dlen 12             #242 [hci1] 17.531404
      SMP: Identity Address Information (0x09) len 7
        Address: DF:A9:FF:F6:B1:1A (OUI DF-A9-FF)
< HCI Command: LE Add Device To... (0x08|0x0027) plen 39  #243 [hci1] 17.551890
        Address type: Public (0x00)
        Address: DF:A9:FF:F6:B1:1A (OUI DF-A9-FF)
        Peer identity resolving key: 25923ed3f5df676a3d208f6e039df3f5
        Local identity resolving key: 00000000000000000000000000000000
> HCI Event: Command Complete (0x0e) plen 4               #244 [hci1] 17.552836
      LE Add Device To Resolving List (0x08|0x0027) ncmd 1
        Status: Success (0x00)
< HCI Command: LE Set Privacy Mode (0x08|0x004e) plen 8   #245 [hci1] 17.571686
        Peer Identity address type: Public (0x00)
        Peer Identity address: DF:A9:FF:F6:B1:1A (OUI DF-A9-FF)
        Privacy Mode: Use Device Privacy (0x01)
> HCI Event: Command Complete (0x0e) plen 4               #246 [hci1] 17.572244
      LE Set Privacy Mode (0x08|0x004e) ncmd 1
        Status: Success (0x00)
< HCI Command: LE Set Address Res.. (0x08|0x002d) plen 1  #247 [hci1] 17.591726
        Address resolution: Enabled (0x01)
> HCI Event: Command Complete (0x0e) plen 4               #248 [hci1] 17.592187
      LE Set Address Resolution Enable (0x08|0x002d) ncmd 1
        Status: Success (0x00)
< HCI Command: Host Number of Com.. (0x03|0x0035) plen 5  #249 [hci1] 17.611575
        Num handles: 1
        Handle: 2631 Address: DF:A9:FF:F6:B1:1A (OUI DF-A9-FF)
        Count: 1
> ACL Data RX: Handle 2631 flags 0x02 dlen 13             #250 [hci1] 17.618895
      ATT: Find By Type Value Request (0x06) len 8
        Handle range: 0x0001-0xffff
        Attribute type: Primary Service (0x2800)
          UUID: Generic Telephony Bearer (0x184c)
< HCI Command: Host Number of Com.. (0x03|0x0035) plen 5  #251 [hci1] 17.632115
        Num handles: 1
        Handle: 2631 Address: DF:A9:FF:F6:B1:1A (OUI DF-A9-FF)
        Count: 1
< ACL Data TX: Handle 2631 flags 0x00 dlen 9              #252 [hci1] 17.632212
      ATT: Find By Type Value Response (0x07) len 4
        Handle range: 0x0024-0x0050
> HCI Event: Number of Completed Packets (0x13) plen 5    #253 [hci1] 17.793826
        Num handles: 1
        Handle: 2631 Address: DF:A9:FF:F6:B1:1A (OUI DF-A9-FF)
        Count: 1
        #252: len 9 (0 Kb/s)
        Latency: 161 msec (69-172 msec ~164 msec)
> ACL Data RX: Handle 2631 flags 0x02 dlen 13             #254 [hci1] 17.794182
      ATT: Find By Type Value Request (0x06) len 8
        Handle range: 0x0051-0xffff
        Attribute type: Primary Service (0x2800)
          UUID: Generic Telephony Bearer (0x184c)
< HCI Command: Host Number of Com.. (0x03|0x0035) plen 5  #255 [hci1] 17.812062
        Num handles: 1
        Handle: 2631 Address: DF:A9:FF:F6:B1:1A (OUI DF-A9-FF)
        Count: 1
< ACL Data TX: Handle 2631 flags 0x00 dlen 9              #256 [hci1] 17.812302
      ATT: Error Response (0x01) len 4
        Find By Type Value Request (0x06)
        Handle: 0x0051
        Error: Attribute Not Found (0x0a)
> HCI Event: Number of Completed Packets (0x13) plen 5    #257 [hci1] 17.968877
        Num handles: 1
        Handle: 2631 Address: DF:A9:FF:F6:B1:1A (OUI DF-A9-FF)
        Count: 1
        #256: len 9 (0 Kb/s)
        Latency: 156 msec (69-172 msec ~160 msec)
> ACL Data RX: Handle 2631 flags 0x02 dlen 11             #258 [hci1] 17.969130
      ATT: Read By Type Request (0x08) len 6
        Handle range: 0x0024-0x0050
        Attribute type: Characteristic (0x2803)
< HCI Command: Host Number of Com.. (0x03|0x0035) plen 5  #259 [hci1] 17.971978
        Num handles: 1
        Handle: 2631 Address: DF:A9:FF:F6:B1:1A (OUI DF-A9-FF)
        Count: 1
< ACL Data TX: Handle 2631 flags 0x00 dlen 20             #260 [hci1] 17.972067
      ATT: Read By Type Response (0x09) len 15
        Attribute data length: 7
        Attribute data list: 2 entries
        Handle: 0x0025
        Value: 122600b32b
            Properties: 0x12
              Read (0x02)
              Notify (0x10)
            Value Handle: 0x0026
            Value UUID: Bearer Provider Name (0x2bb3)
        Handle: 0x0028
        Value: 022900b42b
            Properties: 0x02
              Read (0x02)
            Value Handle: 0x0029
            Value UUID: Bearer UCI (0x2bb4)
> HCI Event: Number of Completed Packets (0x13) plen 5    #261 [hci1] 18.143768
        Num handles: 1
        Handle: 2631 Address: DF:A9:FF:F6:B1:1A (OUI DF-A9-FF)
        Count: 1
        #260: len 20 (0 Kb/s)
        Latency: 171 msec (69-172 msec ~166 msec)
> ACL Data RX: Handle 2631 flags 0x02 dlen 11             #262 [hci1] 18.144102
      ATT: Read By Type Request (0x08) len 6
        Handle range: 0x0029-0x0050
        Attribute type: Characteristic (0x2803)
< HCI Command: Host Number of Com.. (0x03|0x0035) plen 5  #263 [hci1] 18.151515
        Num handles: 1
        Handle: 2631 Address: DF:A9:FF:F6:B1:1A (OUI DF-A9-FF)
        Count: 1
< ACL Data TX: Handle 2631 flags 0x00 dlen 20             #264 [hci1] 18.151575
      ATT: Read By Type Response (0x09) len 15
        Attribute data length: 7
        Attribute data list: 2 entries
        Handle: 0x002a
        Value: 122b00b52b
            Properties: 0x12
              Read (0x02)
              Notify (0x10)
            Value Handle: 0x002b
            Value UUID: Bearer Technology (0x2bb5)
        Handle: 0x002d
        Value: 122e00b62b
            Properties: 0x12
              Read (0x02)
              Notify (0x10)
            Value Handle: 0x002e
            Value UUID: Bearer URI Schemes Supported List (0x2bb6)
> HCI Event: Number of Completed Packets (0x13) plen 5    #265 [hci1] 18.318870
        Num handles: 1
        Handle: 2631 Address: DF:A9:FF:F6:B1:1A (OUI DF-A9-FF)
        Count: 1
        #264: len 20 (0 Kb/s)
        Latency: 167 msec (69-172 msec ~166 msec)
> ACL Data RX: Handle 2631 flags 0x02 dlen 11             #266 [hci1] 18.319099
      ATT: Read By Type Request (0x08) len 6
        Handle range: 0x002e-0x0050
        Attribute type: Characteristic (0x2803)
< HCI Command: Host Number of Com.. (0x03|0x0035) plen 5  #267 [hci1] 18.331942
        Num handles: 1
        Handle: 2631 Address: DF:A9:FF:F6:B1:1A (OUI DF-A9-FF)
        Count: 1
< ACL Data TX: Handle 2631 flags 0x00 dlen 20             #268 [hci1] 18.332094
      ATT: Read By Type Response (0x09) len 15
        Attribute data length: 7
        Attribute data list: 2 entries
        Handle: 0x0030
        Value: 123100b72b
            Properties: 0x12
              Read (0x02)
              Notify (0x10)
            Value Handle: 0x0031
            Value UUID: Bearer Signal Strength (0x2bb7)
        Handle: 0x0033
        Value: 0e3400b82b
            Properties: 0x0e
              Read (0x02)
              Write Without Response (0x04)
              Write (0x08)
            Value Handle: 0x0034
            Value UUID: Bearer Signal Strength Reporting Interval (0x2bb8)
> HCI Event: Number of Completed Packets (0x13) plen 5    #269 [hci1] 18.493867
        Num handles: 1
        Handle: 2631 Address: DF:A9:FF:F6:B1:1A (OUI DF-A9-FF)
        Count: 1
        #268: len 20 (0 Kb/s)
        Latency: 161 msec (69-172 msec ~164 msec)
> ACL Data RX: Handle 2631 flags 0x02 dlen 11             #270 [hci1] 18.494140
      ATT: Read By Type Request (0x08) len 6
        Handle range: 0x0034-0x0050
        Attribute type: Characteristic (0x2803)
< HCI Command: Host Number of Com.. (0x03|0x0035) plen 5  #271 [hci1] 18.512005
        Num handles: 1
        Handle: 2631 Address: DF:A9:FF:F6:B1:1A (OUI DF-A9-FF)
        Count: 1
< ACL Data TX: Handle 2631 flags 0x00 dlen 20             #272 [hci1] 18.512059
      ATT: Read By Type Response (0x09) len 15
        Attribute data length: 7
        Attribute data list: 2 entries
        Handle: 0x0035
        Value: 123600b92b
            Properties: 0x12
              Read (0x02)
              Notify (0x10)
            Value Handle: 0x0036
            Value UUID: Bearer List Current Calls (0x2bb9)
        Handle: 0x0038
        Value: 023900ba2b
            Properties: 0x02
              Read (0x02)
            Value Handle: 0x0039
            Value UUID: Content Control ID (0x2bba)
> HCI Event: Number of Completed Packets (0x13) plen 5    #273 [hci1] 18.668830
        Num handles: 1
        Handle: 2631 Address: DF:A9:FF:F6:B1:1A (OUI DF-A9-FF)
        Count: 1
        #272: len 20 (1 Kb/s)
        Latency: 156 msec (69-172 msec ~160 msec)
> ACL Data RX: Handle 2631 flags 0x02 dlen 11             #274 [hci1] 18.669041
      ATT: Read By Type Request (0x08) len 6
        Handle range: 0x0039-0x0050
        Attribute type: Characteristic (0x2803)
< HCI Command: Host Number of Com.. (0x03|0x0035) plen 5  #275 [hci1] 18.672059
        Num handles: 1
        Handle: 2631 Address: DF:A9:FF:F6:B1:1A (OUI DF-A9-FF)
        Count: 1
< ACL Data TX: Handle 2631 flags 0x00 dlen 20             #276 [hci1] 18.672176
      ATT: Read By Type Response (0x09) len 15
        Attribute data length: 7
        Attribute data list: 2 entries
        Handle: 0x003a
        Value: 123b00bb2b
            Properties: 0x12
              Read (0x02)
              Notify (0x10)
            Value Handle: 0x003b
            Value UUID: Status Flags (0x2bbb)
        Handle: 0x003d
        Value: 123e00bc2b
            Properties: 0x12
              Read (0x02)
              Notify (0x10)
            Value Handle: 0x003e
            Value UUID: Incoming Call Target Bearer URI (0x2bbc)
> HCI Event: Number of Completed Packets (0x13) plen 5    #277 [hci1] 18.843791
        Num handles: 1
        Handle: 2631 Address: DF:A9:FF:F6:B1:1A (OUI DF-A9-FF)
        Count: 1
        #276: len 20 (0 Kb/s)
        Latency: 171 msec (69-172 msec ~166 msec)
> ACL Data RX: Handle 2631 flags 0x02 dlen 11             #278 [hci1] 18.844182
      ATT: Read By Type Request (0x08) len 6
        Handle range: 0x003e-0x0050
        Attribute type: Characteristic (0x2803)
< HCI Command: Host Number of Com.. (0x03|0x0035) plen 5  #279 [hci1] 18.851961
        Num handles: 1
        Handle: 2631 Address: DF:A9:FF:F6:B1:1A (OUI DF-A9-FF)
        Count: 1
< ACL Data TX: Handle 2631 flags 0x00 dlen 20             #280 [hci1] 18.852063
      ATT: Read By Type Response (0x09) len 15
        Attribute data length: 7
        Attribute data list: 2 entries
        Handle: 0x0040
        Value: 124100bd2b
            Properties: 0x12
              Read (0x02)
              Notify (0x10)
            Value Handle: 0x0041
            Value UUID: Call State (0x2bbd)
        Handle: 0x0043
        Value: 1c4400be2b
            Properties: 0x1c
              Write Without Response (0x04)
              Write (0x08)
              Notify (0x10)
            Value Handle: 0x0044
            Value UUID: Call Control Point (0x2bbe)
> HCI Event: Number of Completed Packets (0x13) plen 5    #281 [hci1] 19.018770
        Num handles: 1
        Handle: 2631 Address: DF:A9:FF:F6:B1:1A (OUI DF-A9-FF)
        Count: 1
        #280: len 20 (0 Kb/s)
        Latency: 166 msec (69-172 msec ~166 msec)
> ACL Data RX: Handle 2631 flags 0x02 dlen 11             #282 [hci1] 19.019043
      ATT: Read By Type Request (0x08) len 6
        Handle range: 0x0044-0x0050
        Attribute type: Characteristic (0x2803)
< HCI Command: Host Number of Com.. (0x03|0x0035) plen 5  #283 [hci1] 19.031996
        Num handles: 1
        Handle: 2631 Address: DF:A9:FF:F6:B1:1A (OUI DF-A9-FF)
        Count: 1
< ACL Data TX: Handle 2631 flags 0x00 dlen 20             #284 [hci1] 19.032171
      ATT: Read By Type Response (0x09) len 15
        Attribute data length: 7
        Attribute data list: 2 entries
        Handle: 0x0046
        Value: 024700bf2b
            Properties: 0x02
              Read (0x02)
            Value Handle: 0x0047
            Value UUID: Call Control Point Optional Opcodes (0x2bbf)
        Handle: 0x0048
        Value: 104900c02b
            Properties: 0x10
              Notify (0x10)
            Value Handle: 0x0049
            Value UUID: Termination Reason (0x2bc0)
> HCI Event: Number of Completed Packets (0x13) plen 5    #285 [hci1] 19.193819
        Num handles: 1
        Handle: 2631 Address: DF:A9:FF:F6:B1:1A (OUI DF-A9-FF)
        Count: 1
        #284: len 20 (0 Kb/s)
        Latency: 161 msec (69-172 msec ~164 msec)
> ACL Data RX: Handle 2631 flags 0x02 dlen 11             #286 [hci1] 19.194061
      ATT: Read By Type Request (0x08) len 6
        Handle range: 0x0049-0x0050
        Attribute type: Characteristic (0x2803)
< HCI Command: Host Number of Com.. (0x03|0x0035) plen 5  #287 [hci1] 19.211979
        Num handles: 1
        Handle: 2631 Address: DF:A9:FF:F6:B1:1A (OUI DF-A9-FF)
        Count: 1
< ACL Data TX: Handle 2631 flags 0x00 dlen 20             #288 [hci1] 19.212077
      ATT: Read By Type Response (0x09) len 15
        Attribute data length: 7
        Attribute data list: 2 entries
        Handle: 0x004b
        Value: 124c00c12b
            Properties: 0x12
              Read (0x02)
              Notify (0x10)
            Value Handle: 0x004c
            Value UUID: Incoming Call (0x2bc1)
        Handle: 0x004e
        Value: 124f00c22b
            Properties: 0x12
              Read (0x02)
              Notify (0x10)
            Value Handle: 0x004f
            Value UUID: Call Friendly Name (0x2bc2)
> HCI Event: Number of Completed Packets (0x13) plen 5    #289 [hci1] 19.368814
        Num handles: 1
        Handle: 2631 Address: DF:A9:FF:F6:B1:1A (OUI DF-A9-FF)
        Count: 1
        #288: len 20 (1 Kb/s)
        Latency: 156 msec (69-172 msec ~160 msec)
> ACL Data RX: Handle 2631 flags 0x02 dlen 11             #290 [hci1] 19.369057
      ATT: Read By Type Request (0x08) len 6
        Handle range: 0x004f-0x0050
        Attribute type: Characteristic (0x2803)
< HCI Command: Host Number of Com.. (0x03|0x0035) plen 5  #291 [hci1] 19.372066
        Num handles: 1
        Handle: 2631 Address: DF:A9:FF:F6:B1:1A (OUI DF-A9-FF)
        Count: 1
< ACL Data TX: Handle 2631 flags 0x00 dlen 9              #292 [hci1] 19.372230
      ATT: Error Response (0x01) len 4
        Read By Type Request (0x08)
        Handle: 0x004f
        Error: Attribute Not Found (0x0a)
> HCI Event: Number of Completed Packets (0x13) plen 5    #293 [hci1] 19.543917
        Num handles: 1
        Handle: 2631 Address: DF:A9:FF:F6:B1:1A (OUI DF-A9-FF)
        Count: 1
        #292: len 9 (0 Kb/s)
        Latency: 171 msec (69-172 msec ~166 msec)
> ACL Data RX: Handle 2631 flags 0x02 dlen 9              #294 [hci1] 19.543984
      ATT: Find Information Request (0x04) len 4
        Handle range: 0x0027-0x0027
< HCI Command: Host Number of Com.. (0x03|0x0035) plen 5  #295 [hci1] 19.552036
        Num handles: 1
        Handle: 2631 Address: DF:A9:FF:F6:B1:1A (OUI DF-A9-FF)
        Count: 1
< ACL Data TX: Handle 2631 flags 0x00 dlen 10             #296 [hci1] 19.552180
      ATT: Find Information Response (0x05) len 5
        Format: UUID-16 (0x01)
        Handle: 0x0027
        UUID: Client Characteristic Configuration (0x2902)
> HCI Event: Number of Completed Packets (0x13) plen 5    #297 [hci1] 19.718814
        Num handles: 1
        Handle: 2631 Address: DF:A9:FF:F6:B1:1A (OUI DF-A9-FF)
        Count: 1
        #296: len 10 (0 Kb/s)
        Latency: 166 msec (69-172 msec ~166 msec)
> ACL Data RX: Handle 2631 flags 0x02 dlen 9              #298 [hci1] 19.719034
      ATT: Find Information Request (0x04) len 4
        Handle range: 0x002c-0x002c
< HCI Command: Host Number of Com.. (0x03|0x0035) plen 5  #299 [hci1] 19.732016
        Num handles: 1
        Handle: 2631 Address: DF:A9:FF:F6:B1:1A (OUI DF-A9-FF)
        Count: 1
< ACL Data TX: Handle 2631 flags 0x00 dlen 10             #300 [hci1] 19.732235
      ATT: Find Information Response (0x05) len 5
        Format: UUID-16 (0x01)
        Handle: 0x002c
        UUID: Client Characteristic Configuration (0x2902)
> HCI Event: Number of Completed Packets (0x13) plen 5    #301 [hci1] 19.893841
        Num handles: 1
        Handle: 2631 Address: DF:A9:FF:F6:B1:1A (OUI DF-A9-FF)
        Count: 1
        #300: len 10 (0 Kb/s)
        Latency: 161 msec (69-172 msec ~163 msec)
> ACL Data RX: Handle 2631 flags 0x02 dlen 9              #302 [hci1] 19.894017
      ATT: Find Information Request (0x04) len 4
        Handle range: 0x002f-0x002f
< HCI Command: Host Number of Com.. (0x03|0x0035) plen 5  #303 [hci1] 19.912067
        Num handles: 1
        Handle: 2631 Address: DF:A9:FF:F6:B1:1A (OUI DF-A9-FF)
        Count: 1
< ACL Data TX: Handle 2631 flags 0x00 dlen 10             #304 [hci1] 19.912089
      ATT: Find Information Response (0x05) len 5
        Format: UUID-16 (0x01)
        Handle: 0x002f
        UUID: Client Characteristic Configuration (0x2902)
> HCI Event: Number of Completed Packets (0x13) plen 5    #305 [hci1] 20.068772
        Num handles: 1
        Handle: 2631 Address: DF:A9:FF:F6:B1:1A (OUI DF-A9-FF)
        Count: 1
        #304: len 10 (0 Kb/s)
        Latency: 156 msec (69-172 msec ~160 msec)
> ACL Data RX: Handle 2631 flags 0x02 dlen 9              #306 [hci1] 20.069103
      ATT: Find Information Request (0x04) len 4
        Handle range: 0x0032-0x0032
< HCI Command: Host Number of Com.. (0x03|0x0035) plen 5  #307 [hci1] 20.071857
        Num handles: 1
        Handle: 2631 Address: DF:A9:FF:F6:B1:1A (OUI DF-A9-FF)
        Count: 1
< ACL Data TX: Handle 2631 flags 0x00 dlen 10             #308 [hci1] 20.071995
      ATT: Find Information Response (0x05) len 5
        Format: UUID-16 (0x01)
        Handle: 0x0032
        UUID: Client Characteristic Configuration (0x2902)
> HCI Event: Number of Completed Packets (0x13) plen 5    #309 [hci1] 20.243802
        Num handles: 1
        Handle: 2631 Address: DF:A9:FF:F6:B1:1A (OUI DF-A9-FF)
        Count: 1
        #308: len 10 (0 Kb/s)
        Latency: 171 msec (69-172 msec ~166 msec)
> ACL Data RX: Handle 2631 flags 0x02 dlen 9              #310 [hci1] 20.244005
      ATT: Find Information Request (0x04) len 4
        Handle range: 0x0037-0x0037
< HCI Command: Host Number of Com.. (0x03|0x0035) plen 5  #311 [hci1] 20.251969
        Num handles: 1
        Handle: 2631 Address: DF:A9:FF:F6:B1:1A (OUI DF-A9-FF)
        Count: 1
< ACL Data TX: Handle 2631 flags 0x00 dlen 10             #312 [hci1] 20.251992
      ATT: Find Information Response (0x05) len 5
        Format: UUID-16 (0x01)
        Handle: 0x0037
        UUID: Client Characteristic Configuration (0x2902)
> HCI Event: Number of Completed Packets (0x13) plen 5    #313 [hci1] 20.418867
        Num handles: 1
        Handle: 2631 Address: DF:A9:FF:F6:B1:1A (OUI DF-A9-FF)
        Count: 1
        #312: len 10 (0 Kb/s)
        Latency: 166 msec (69-172 msec ~166 msec)
> ACL Data RX: Handle 2631 flags 0x02 dlen 9              #314 [hci1] 20.419040
      ATT: Find Information Request (0x04) len 4
        Handle range: 0x003c-0x003c
< HCI Command: Host Number of Com.. (0x03|0x0035) plen 5  #315 [hci1] 20.431981
        Num handles: 1
        Handle: 2631 Address: DF:A9:FF:F6:B1:1A (OUI DF-A9-FF)
        Count: 1
< ACL Data TX: Handle 2631 flags 0x00 dlen 10             #316 [hci1] 20.432006
      ATT: Find Information Response (0x05) len 5
        Format: UUID-16 (0x01)
        Handle: 0x003c
        UUID: Client Characteristic Configuration (0x2902)
> HCI Event: Number of Completed Packets (0x13) plen 5    #317 [hci1] 20.593756
        Num handles: 1
        Handle: 2631 Address: DF:A9:FF:F6:B1:1A (OUI DF-A9-FF)
        Count: 1
        #316: len 10 (0 Kb/s)
        Latency: 161 msec (69-172 msec ~164 msec)
> ACL Data RX: Handle 2631 flags 0x02 dlen 9              #318 [hci1] 20.594014
      ATT: Find Information Request (0x04) len 4
        Handle range: 0x003f-0x003f
< HCI Command: Host Number of Com.. (0x03|0x0035) plen 5  #319 [hci1] 20.612009
        Num handles: 1
        Handle: 2631 Address: DF:A9:FF:F6:B1:1A (OUI DF-A9-FF)
        Count: 1
< ACL Data TX: Handle 2631 flags 0x00 dlen 10             #320 [hci1] 20.612128
      ATT: Find Information Response (0x05) len 5
        Format: UUID-16 (0x01)
        Handle: 0x003f
        UUID: Client Characteristic Configuration (0x2902)
> HCI Event: Number of Completed Packets (0x13) plen 5    #321 [hci1] 20.768862
        Num handles: 1
        Handle: 2631 Address: DF:A9:FF:F6:B1:1A (OUI DF-A9-FF)
        Count: 1
        #320: len 10 (0 Kb/s)
        Latency: 156 msec (69-172 msec ~160 msec)
> ACL Data RX: Handle 2631 flags 0x02 dlen 9              #322 [hci1] 20.769007
      ATT: Find Information Request (0x04) len 4
        Handle range: 0x0042-0x0042
< HCI Command: Host Number of Com.. (0x03|0x0035) plen 5  #323 [hci1] 20.771810
        Num handles: 1
        Handle: 2631 Address: DF:A9:FF:F6:B1:1A (OUI DF-A9-FF)
        Count: 1
< ACL Data TX: Handle 2631 flags 0x00 dlen 10             #324 [hci1] 20.771861
      ATT: Find Information Response (0x05) len 5
        Format: UUID-16 (0x01)
        Handle: 0x0042
        UUID: Client Characteristic Configuration (0x2902)
> HCI Event: Number of Completed Packets (0x13) plen 5    #325 [hci1] 20.943750
        Num handles: 1
        Handle: 2631 Address: DF:A9:FF:F6:B1:1A (OUI DF-A9-FF)
        Count: 1
        #324: len 10 (0 Kb/s)
        Latency: 171 msec (69-172 msec ~166 msec)
> ACL Data RX: Handle 2631 flags 0x02 dlen 9              #326 [hci1] 20.944036
      ATT: Find Information Request (0x04) len 4
        Handle range: 0x0045-0x0045
< HCI Command: Host Number of Com.. (0x03|0x0035) plen 5  #327 [hci1] 20.951978
        Num handles: 1
        Handle: 2631 Address: DF:A9:FF:F6:B1:1A (OUI DF-A9-FF)
        Count: 1
< ACL Data TX: Handle 2631 flags 0x00 dlen 10             #328 [hci1] 20.952099
      ATT: Find Information Response (0x05) len 5
        Format: UUID-16 (0x01)
        Handle: 0x0045
        UUID: Client Characteristic Configuration (0x2902)
> HCI Event: Number of Completed Packets (0x13) plen 5    #329 [hci1] 21.118835
        Num handles: 1
        Handle: 2631 Address: DF:A9:FF:F6:B1:1A (OUI DF-A9-FF)
        Count: 1
        #328: len 10 (0 Kb/s)
        Latency: 166 msec (69-172 msec ~166 msec)
> ACL Data RX: Handle 2631 flags 0x02 dlen 9              #330 [hci1] 21.118965
      ATT: Find Information Request (0x04) len 4
        Handle range: 0x004a-0x004a
< HCI Command: Host Number of Com.. (0x03|0x0035) plen 5  #331 [hci1] 21.131961
        Num handles: 1
        Handle: 2631 Address: DF:A9:FF:F6:B1:1A (OUI DF-A9-FF)
        Count: 1
< ACL Data TX: Handle 2631 flags 0x00 dlen 10             #332 [hci1] 21.132062
      ATT: Find Information Response (0x05) len 5
        Format: UUID-16 (0x01)
        Handle: 0x004a
        UUID: Client Characteristic Configuration (0x2902)
> HCI Event: Number of Completed Packets (0x13) plen 5    #333 [hci1] 21.293832
        Num handles: 1
        Handle: 2631 Address: DF:A9:FF:F6:B1:1A (OUI DF-A9-FF)
        Count: 1
        #332: len 10 (0 Kb/s)
        Latency: 161 msec (69-172 msec ~164 msec)
> ACL Data RX: Handle 2631 flags 0x02 dlen 9              #334 [hci1] 21.294006
      ATT: Find Information Request (0x04) len 4
        Handle range: 0x004d-0x004d
< HCI Command: Host Number of Com.. (0x03|0x0035) plen 5  #335 [hci1] 21.311957
        Num handles: 1
        Handle: 2631 Address: DF:A9:FF:F6:B1:1A (OUI DF-A9-FF)
        Count: 1
< ACL Data TX: Handle 2631 flags 0x00 dlen 10             #336 [hci1] 21.312042
      ATT: Find Information Response (0x05) len 5
        Format: UUID-16 (0x01)
        Handle: 0x004d
        UUID: Client Characteristic Configuration (0x2902)
> HCI Event: Number of Completed Packets (0x13) plen 5    #337 [hci1] 21.468820
        Num handles: 1
        Handle: 2631 Address: DF:A9:FF:F6:B1:1A (OUI DF-A9-FF)
        Count: 1
        #336: len 10 (0 Kb/s)
        Latency: 156 msec (69-172 msec ~160 msec)
> ACL Data RX: Handle 2631 flags 0x02 dlen 9              #338 [hci1] 21.468967
      ATT: Find Information Request (0x04) len 4
        Handle range: 0x0050-0x0050
< HCI Command: Host Number of Com.. (0x03|0x0035) plen 5  #339 [hci1] 21.472016
        Num handles: 1
        Handle: 2631 Address: DF:A9:FF:F6:B1:1A (OUI DF-A9-FF)
        Count: 1
< ACL Data TX: Handle 2631 flags 0x00 dlen 10             #340 [hci1] 21.472162
      ATT: Find Information Response (0x05) len 5
        Format: UUID-16 (0x01)
        Handle: 0x0050
        UUID: Client Characteristic Configuration (0x2902)
> HCI Event: Number of Completed Packets (0x13) plen 5    #341 [hci1] 21.643853
        Num handles: 1
        Handle: 2631 Address: DF:A9:FF:F6:B1:1A (OUI DF-A9-FF)
        Count: 1
        #340: len 10 (0 Kb/s)
        Latency: 171 msec (69-172 msec ~166 msec)
> ACL Data RX: Handle 2631 flags 0x02 dlen 9              #342 [hci1] 21.644013
      ATT: Write Request (0x12) len 4
        Handle: 0x0042
          Data: 0000
< HCI Command: Host Number of Com.. (0x03|0x0035) plen 5  #343 [hci1] 21.652014
        Num handles: 1
        Handle: 2631 Address: DF:A9:FF:F6:B1:1A (OUI DF-A9-FF)
        Count: 1
< ACL Data TX: Handle 2631 flags 0x00 dlen 5              #344 [hci1] 21.652114
      ATT: Write Response (0x13) len 0
> HCI Event: Number of Completed Packets (0x13) plen 5    #345 [hci1] 21.818791
        Num handles: 1
        Handle: 2631 Address: DF:A9:FF:F6:B1:1A (OUI DF-A9-FF)
        Count: 1
        #344: len 5 (0 Kb/s)
        Latency: 166 msec (69-172 msec ~166 msec)
> ACL Data RX: Handle 2631 flags 0x02 dlen 9              #346 [hci1] 21.819027
      ATT: Write Request (0x12) len 4
        Handle: 0x0042
          Data: 0100
< HCI Command: Host Number of Com.. (0x03|0x0035) plen 5  #347 [hci1] 21.831979
        Num handles: 1
        Handle: 2631 Address: DF:A9:FF:F6:B1:1A (OUI DF-A9-FF)
        Count: 1
< ACL Data TX: Handle 2631 flags 0x00 dlen 5              #348 [hci1] 21.832139
      ATT: Write Response (0x13) len 0
> HCI Event: Number of Completed Packets (0x13) plen 5    #349 [hci1] 21.993946
        Num handles: 1
        Handle: 2631 Address: DF:A9:FF:F6:B1:1A (OUI DF-A9-FF)
        Count: 1
        #348: len 5 (0 Kb/s)
        Latency: 161 msec (69-172 msec ~164 msec)
> ACL Data RX: Handle 2631 flags 0x02 dlen 9              #350 [hci1] 21.993991
      ATT: Write Request (0x12) len 4
        Handle: 0x004d
          Data: 0000
< HCI Command: Host Number of Com.. (0x03|0x0035) plen 5  #351 [hci1] 22.011988
        Num handles: 1
        Handle: 2631 Address: DF:A9:FF:F6:B1:1A (OUI DF-A9-FF)
        Count: 1
< ACL Data TX: Handle 2631 flags 0x00 dlen 5              #352 [hci1] 22.012172
      ATT: Write Response (0x13) len 0
> HCI Event: Number of Completed Packets (0x13) plen 5    #353 [hci1] 22.168730
        Num handles: 1
        Handle: 2631 Address: DF:A9:FF:F6:B1:1A (OUI DF-A9-FF)
        Count: 1
        #352: len 5 (0 Kb/s)
        Latency: 156 msec (69-172 msec ~160 msec)
> ACL Data RX: Handle 2631 flags 0x02 dlen 9              #354 [hci1] 22.169082
      ATT: Write Request (0x12) len 4
        Handle: 0x004d
          Data: 0100
< HCI Command: Host Number of Com.. (0x03|0x0035) plen 5  #355 [hci1] 22.172081
        Num handles: 1
        Handle: 2631 Address: DF:A9:FF:F6:B1:1A (OUI DF-A9-FF)
        Count: 1
< ACL Data TX: Handle 2631 flags 0x00 dlen 5              #356 [hci1] 22.172190
      ATT: Write Response (0x13) len 0
> HCI Event: Number of Completed Packets (0x13) plen 5    #357 [hci1] 22.343736
        Num handles: 1
        Handle: 2631 Address: DF:A9:FF:F6:B1:1A (OUI DF-A9-FF)
        Count: 1
        #356: len 5 (0 Kb/s)
        Latency: 171 msec (69-172 msec ~165 msec)
> ACL Data RX: Handle 2631 flags 0x02 dlen 9              #358 [hci1] 22.344007
      ATT: Write Request (0x12) len 4
        Handle: 0x004a
          Data: 0000
< HCI Command: Host Number of Com.. (0x03|0x0035) plen 5  #359 [hci1] 22.352037
        Num handles: 1
        Handle: 2631 Address: DF:A9:FF:F6:B1:1A (OUI DF-A9-FF)
        Count: 1
< ACL Data TX: Handle 2631 flags 0x00 dlen 5              #360 [hci1] 22.352138
      ATT: Write Response (0x13) len 0
> HCI Event: Number of Completed Packets (0x13) plen 5    #361 [hci1] 22.518807
        Num handles: 1
        Handle: 2631 Address: DF:A9:FF:F6:B1:1A (OUI DF-A9-FF)
        Count: 1
        #360: len 5 (0 Kb/s)
        Latency: 166 msec (69-172 msec ~166 msec)
> ACL Data RX: Handle 2631 flags 0x02 dlen 9              #362 [hci1] 22.519049
      ATT: Write Request (0x12) len 4
        Handle: 0x004a
          Data: 0100
< HCI Command: Host Number of Com.. (0x03|0x0035) plen 5  #363 [hci1] 22.531960
        Num handles: 1
        Handle: 2631 Address: DF:A9:FF:F6:B1:1A (OUI DF-A9-FF)
        Count: 1
< ACL Data TX: Handle 2631 flags 0x00 dlen 5              #364 [hci1] 22.532039
      ATT: Write Response (0x13) len 0
> HCI Event: Number of Completed Packets (0x13) plen 5    #365 [hci1] 22.693763
        Num handles: 1
        Handle: 2631 Address: DF:A9:FF:F6:B1:1A (OUI DF-A9-FF)
        Count: 1
        #364: len 5 (0 Kb/s)
        Latency: 161 msec (69-172 msec ~164 msec)
> ACL Data RX: Handle 2631 flags 0x02 dlen 9              #366 [hci1] 22.694018
      ATT: Write Request (0x12) len 4
        Handle: 0x0045
          Data: 0000
< HCI Command: Host Number of Com.. (0x03|0x0035) plen 5  #367 [hci1] 22.711903
        Num handles: 1
        Handle: 2631 Address: DF:A9:FF:F6:B1:1A (OUI DF-A9-FF)
        Count: 1
< ACL Data TX: Handle 2631 flags 0x00 dlen 5              #368 [hci1] 22.712008
      ATT: Write Response (0x13) len 0
> HCI Event: Number of Completed Packets (0x13) plen 5    #369 [hci1] 22.868702
        Num handles: 1
        Handle: 2631 Address: DF:A9:FF:F6:B1:1A (OUI DF-A9-FF)
        Count: 1
        #368: len 5 (0 Kb/s)
        Latency: 156 msec (69-172 msec ~160 msec)
> ACL Data RX: Handle 2631 flags 0x02 dlen 9              #370 [hci1] 22.868928
      ATT: Write Request (0x12) len 4
        Handle: 0x0045
          Data: 0100
< HCI Command: Host Number of Com.. (0x03|0x0035) plen 5  #371 [hci1] 22.871962
        Num handles: 1
        Handle: 2631 Address: DF:A9:FF:F6:B1:1A (OUI DF-A9-FF)
        Count: 1
< ACL Data TX: Handle 2631 flags 0x00 dlen 5              #372 [hci1] 22.872011
      ATT: Write Response (0x13) len 0
> HCI Event: Number of Completed Packets (0x13) plen 5    #373 [hci1] 23.043874
        Num handles: 1
        Handle: 2631 Address: DF:A9:FF:F6:B1:1A (OUI DF-A9-FF)
        Count: 1
        #372: len 5 (0 Kb/s)
        Latency: 171 msec (69-172 msec ~166 msec)
> ACL Data RX: Handle 2631 flags 0x02 dlen 9              #374 [hci1] 23.044058
      ATT: Write Request (0x12) len 4
        Handle: 0x003f
          Data: 0000
< HCI Command: Host Number of Com.. (0x03|0x0035) plen 5  #375 [hci1] 23.052064
        Num handles: 1
        Handle: 2631 Address: DF:A9:FF:F6:B1:1A (OUI DF-A9-FF)
        Count: 1
< ACL Data TX: Handle 2631 flags 0x00 dlen 5              #376 [hci1] 23.052180
      ATT: Write Response (0x13) len 0
> HCI Event: Number of Completed Packets (0x13) plen 5    #377 [hci1] 23.218799
        Num handles: 1
        Handle: 2631 Address: DF:A9:FF:F6:B1:1A (OUI DF-A9-FF)
        Count: 1
        #376: len 5 (0 Kb/s)
        Latency: 166 msec (69-172 msec ~166 msec)
> ACL Data RX: Handle 2631 flags 0x02 dlen 9              #378 [hci1] 23.218910
      ATT: Write Request (0x12) len 4
        Handle: 0x003f
          Data: 0100
< HCI Command: Host Number of Com.. (0x03|0x0035) plen 5  #379 [hci1] 23.231587
        Num handles: 1
        Handle: 2631 Address: DF:A9:FF:F6:B1:1A (OUI DF-A9-FF)
        Count: 1
< ACL Data TX: Handle 2631 flags 0x00 dlen 5              #380 [hci1] 23.231683
      ATT: Write Response (0x13) len 0
> HCI Event: Number of Completed Packets (0x13) plen 5    #381 [hci1] 23.393891
        Num handles: 1
        Handle: 2631 Address: DF:A9:FF:F6:B1:1A (OUI DF-A9-FF)
        Count: 1
        #380: len 5 (0 Kb/s)
        Latency: 162 msec (69-172 msec ~164 msec)
> ACL Data RX: Handle 2631 flags 0x02 dlen 9              #382 [hci1] 23.394058
      ATT: Write Request (0x12) len 4
        Handle: 0x0050
          Data: 0000
< HCI Command: Host Number of Com.. (0x03|0x0035) plen 5  #383 [hci1] 23.412060
        Num handles: 1
        Handle: 2631 Address: DF:A9:FF:F6:B1:1A (OUI DF-A9-FF)
        Count: 1
< ACL Data TX: Handle 2631 flags 0x00 dlen 5              #384 [hci1] 23.412160
      ATT: Write Response (0x13) len 0
> HCI Event: Number of Completed Packets (0x13) plen 5    #385 [hci1] 23.568706
        Num handles: 1
        Handle: 2631 Address: DF:A9:FF:F6:B1:1A (OUI DF-A9-FF)
        Count: 1
        #384: len 5 (0 Kb/s)
        Latency: 156 msec (69-172 msec ~160 msec)
> ACL Data RX: Handle 2631 flags 0x02 dlen 9              #386 [hci1] 23.568943
      ATT: Write Request (0x12) len 4
        Handle: 0x0050
          Data: 0100
< HCI Command: Host Number of Com.. (0x03|0x0035) plen 5  #387 [hci1] 23.572089
        Num handles: 1
        Handle: 2631 Address: DF:A9:FF:F6:B1:1A (OUI DF-A9-FF)
        Count: 1
< ACL Data TX: Handle 2631 flags 0x00 dlen 5              #388 [hci1] 23.572151
      ATT: Write Response (0x13) len 0
> HCI Event: Number of Completed Packets (0x13) plen 5    #389 [hci1] 23.743689
        Num handles: 1
        Handle: 2631 Address: DF:A9:FF:F6:B1:1A (OUI DF-A9-FF)
        Count: 1
        #388: len 5 (0 Kb/s)
        Latency: 171 msec (69-172 msec ~165 msec)
> ACL Data RX: Handle 2631 flags 0x02 dlen 9              #390 [hci1] 23.743910
      ATT: Write Request (0x12) len 4
        Handle: 0x0032
          Data: 0000
< HCI Command: Host Number of Com.. (0x03|0x0035) plen 5  #391 [hci1] 23.752057
        Num handles: 1
        Handle: 2631 Address: DF:A9:FF:F6:B1:1A (OUI DF-A9-FF)
        Count: 1
< ACL Data TX: Handle 2631 flags 0x00 dlen 5              #392 [hci1] 23.752174
      ATT: Write Response (0x13) len 0
> HCI Event: Number of Completed Packets (0x13) plen 5    #393 [hci1] 23.918729
        Num handles: 1
        Handle: 2631 Address: DF:A9:FF:F6:B1:1A (OUI DF-A9-FF)
        Count: 1
        #392: len 5 (0 Kb/s)
        Latency: 166 msec (69-172 msec ~166 msec)
> ACL Data RX: Handle 2631 flags 0x02 dlen 9              #394 [hci1] 23.918965
      ATT: Write Request (0x12) len 4
        Handle: 0x0032
          Data: 0100
< HCI Command: Host Number of Com.. (0x03|0x0035) plen 5  #395 [hci1] 23.932150
        Num handles: 1
        Handle: 2631 Address: DF:A9:FF:F6:B1:1A (OUI DF-A9-FF)
        Count: 1
< ACL Data TX: Handle 2631 flags 0x00 dlen 5              #396 [hci1] 23.932267
      ATT: Write Response (0x13) len 0
> HCI Event: Number of Completed Packets (0x13) plen 5    #397 [hci1] 24.093709
        Num handles: 1
        Handle: 2631 Address: DF:A9:FF:F6:B1:1A (OUI DF-A9-FF)
        Count: 1
        #396: len 5 (0 Kb/s)
        Latency: 161 msec (69-172 msec ~163 msec)
> ACL Data RX: Handle 2631 flags 0x02 dlen 7              #398 [hci1] 24.093885
      ATT: Read Request (0x0a) len 2
        Handle: 0x003b
< HCI Command: Host Number of Com.. (0x03|0x0035) plen 5  #399 [hci1] 24.112001
        Num handles: 1
        Handle: 2631 Address: DF:A9:FF:F6:B1:1A (OUI DF-A9-FF)
        Count: 1
< ACL Data TX: Handle 2631 flags 0x00 dlen 7              #400 [hci1] 24.112121
      ATT: Read Response (0x0b) len 2
> HCI Event: Number of Completed Packets (0x13) plen 5    #401 [hci1] 24.268703
        Num handles: 1
        Handle: 2631 Address: DF:A9:FF:F6:B1:1A (OUI DF-A9-FF)
        Count: 1
        #400: len 7 (0 Kb/s)
        Latency: 156 msec (69-172 msec ~160 msec)
> ACL Data RX: Handle 2631 flags 0x02 dlen 7              #402 [hci1] 24.268973
      ATT: Read Request (0x0a) len 2
        Handle: 0x0047
< HCI Command: Host Number of Com.. (0x03|0x0035) plen 5  #403 [hci1] 24.272053
        Num handles: 1
        Handle: 2631 Address: DF:A9:FF:F6:B1:1A (OUI DF-A9-FF)
        Count: 1
< ACL Data TX: Handle 2631 flags 0x00 dlen 7              #404 [hci1] 24.272162
      ATT: Read Response (0x0b) len 2
> HCI Event: Number of Completed Packets (0x13) plen 5    #405 [hci1] 24.443822
        Num handles: 1
        Handle: 2631 Address: DF:A9:FF:F6:B1:1A (OUI DF-A9-FF)
        Count: 1
        #404: len 7 (0 Kb/s)
        Latency: 171 msec (69-172 msec ~165 msec)
> ACL Data RX: Handle 2631 flags 0x02 dlen 21             #406 [hci1] 24.444192
      ATT: Write Command (0x52) len 16
        Handle: 0x0044
          Data: 04424c5545544f4f544831323334
< HCI Command: Host Number of Com.. (0x03|0x0035) plen 5  #407 [hci1] 24.452084
        Num handles: 1
        Handle: 2631 Address: DF:A9:FF:F6:B1:1A (OUI DF-A9-FF)
        Count: 1
< ACL Data TX: Handle 2631 flags 0x00 dlen 10             #408 [hci1] 24.452404
      ATT: Handle Value Notification (0x1b) len 5
        Handle: 0x0044
          Data: 040006
> HCI Event: Number of Completed Packets (0x13) plen 5    #409 [hci1] 24.618645
        Num handles: 1
        Handle: 2631 Address: DF:A9:FF:F6:B1:1A (OUI DF-A9-FF)
        Count: 1
        #408: len 10 (0 Kb/s)
        Latency: 166 msec (69-172 msec ~166 msec)
> HCI Event: Disconnect Complete (0x05) plen 4            #410 [hci1] 26.018840
        Status: Success (0x00)
        Handle: 2631 Address: DF:A9:FF:F6:B1:1A (OUI DF-A9-FF)
        Reason: Remote User Terminated Connection (0x13)
< HCI Command: Reset (0x03|0x0003) plen 0                 #411 [hci1] 31.011498
> HCI Event: Command Complete (0x0e) plen 4               #412 [hci1] 31.012047
      Reset (0x03|0x0003) ncmd 1
        Status: Success (0x00)
@ USER Close: main                                    {0x0001} [hci1] 31.031382
= Close Index: 00:00:00:00:00:00                               [hci1] 31.031390
