Bluetooth monitor ver 5.72
= Note: Linux version 6.14.0-36-generic (x86_64)                       0.235585
= Note: Bluetooth subsystem version 2.22                               0.235587
= New Index: 00:00:00:00:00:00 (Primary,UART,hci1)              [hci1] 0.235589
= New Index: 48:5F:99:8E:E0:64 (Primary,USB,hci0)               [hci0] 0.235590
= Open Index: 00:00:00:00:00:00                                 [hci1] 0.349506
= Index Info: 00:00:00:00:00:00 (Nordic Semiconductor ASA)      [hci1] 0.349524
@ USER Open: main (privileged) version 2.22            {0x0001} [hci1] 0.349536
< HCI Command: Reset (0x03|0x0003) plen 0                    #1 [hci1] 0.350910
> HCI Event: Command Complete (0x0e) plen 4                  #2 [hci1] 0.351410
      Reset (0x03|0x0003) ncmd 1
        Status: Success (0x00)
< HCI Command: Read Local Supported... (0x04|0x0003) plen 0  #3 [hci1] 0.369162
> HCI Event: Command Complete (0x0e) plen 12                 #4 [hci1] 0.369701
      Read Local Supported Features (0x04|0x0003) ncmd 1
        Status: Success (0x00)
        Features: 0x00 0x00 0x00 0x00 0x60 0x00 0x00 0x00
          BR/EDR Not Supported
          LE Supported (Controller)
< HCI Command: Read Local Version In.. (0x04|0x0001) plen 0  #5 [hci1] 0.388853
> HCI Event: Command Complete (0x0e) plen 12                 #6 [hci1] 0.389435
      Read Local Version Information (0x04|0x0001) ncmd 1
        Status: Success (0x00)
        HCI version: Reserved (0x0f) - Revision 12393 (0x3069)
        LMP version: Reserved (0x0f) - Subversion 12393 (0x3069)
        Manufacturer: Nordic Semiconductor ASA (89)
< HCI Command: Read Local Supported... (0x04|0x0002) plen 0  #7 [hci1] 0.408793
> HCI Event: Command Complete (0x0e) plen 68                 #8 [hci1] 0.409891
      Read Local Supported Commands (0x04|0x0002) ncmd 1
        Status: Success (0x00)
        Commands: 119 entries
          Disconnect (Octet 0 - Bit 5)
          Read Remote Version Information (Octet 2 - Bit 7)
          Set Event Mask (Octet 5 - Bit 6)
          Reset (Octet 5 - Bit 7)
          Read Connection Accept Timeout (Octet 7 - Bit 2)
          Write Connection Accept Timeout (Octet 7 - Bit 3)
          Read Transmit Power Level (Octet 10 - Bit 2)
          Set Controller To Host Flow Control (Octet 10 - Bit 5)
          Host Buffer Size (Octet 10 - Bit 6)
          Host Number of Completed Packets (Octet 10 - Bit 7)
          Read Local Version Information (Octet 14 - Bit 3)
          Read Local Supported Features (Octet 14 - Bit 5)
          Read BD ADDR (Octet 15 - Bit 1)
          Read RSSI (Octet 15 - Bit 5)
          Set Event Mask Page 2 (Octet 22 - Bit 2)
          LE Set Event Mask (Octet 25 - Bit 0)
          LE Read Buffer Size (Octet 25 - Bit 1)
          LE Read Local Supported Features (Octet 25 - Bit 2)
          LE Set Random Address (Octet 25 - Bit 4)
          LE Set Advertising Parameters (Octet 25 - Bit 5)
          LE Read Advertising Channel TX Power (Octet 25 - Bit 6)
          LE Set Advertising Data (Octet 25 - Bit 7)
          LE Set Scan Response Data (Octet 26 - Bit 0)
          LE Set Advertise Enable (Octet 26 - Bit 1)
          LE Set Scan Parameters (Octet 26 - Bit 2)
          LE Set Scan Enable (Octet 26 - Bit 3)
          LE Create Connection (Octet 26 - Bit 4)
          LE Create Connection Cancel (Octet 26 - Bit 5)
          LE Read Accept List Size (Octet 26 - Bit 6)
          LE Clear Accept List (Octet 26 - Bit 7)
          LE Add Device To Accept List (Octet 27 - Bit 0)
          LE Remove Device From Accept List (Octet 27 - Bit 1)
          LE Connection Update (Octet 27 - Bit 2)
          LE Set Host Channel Classification (Octet 27 - Bit 3)
          LE Read Channel Map (Octet 27 - Bit 4)
          LE Read Remote Used Features (Octet 27 - Bit 5)
          LE Encrypt (Octet 27 - Bit 6)
          LE Rand (Octet 27 - Bit 7)
          LE Start Encryption (Octet 28 - Bit 0)
          LE Long Term Key Request Reply (Octet 28 - Bit 1)
          LE Long Term Key Request Neg Reply (Octet 28 - Bit 2)
          LE Read Supported States (Octet 28 - Bit 3)
          LE Receiver Test (Octet 28 - Bit 4)
          LE Transmitter Test (Octet 28 - Bit 5)
          LE Test End (Octet 28 - Bit 6)
          Read Authenticated Payload Timeout (Octet 32 - Bit 4)
          Write Authenticated Payload Timeout (Octet 32 - Bit 5)
          LE Set Data Length (Octet 33 - Bit 6)
          LE Read Suggested Default Data Length (Octet 33 - Bit 7)
          LE Write Suggested Default Data Length (Octet 34 - Bit 0)
          LE Add Device To Resolving List (Octet 34 - Bit 3)
          LE Remove Device From Resolving List (Octet 34 - Bit 4)
          LE Clear Resolving List (Octet 34 - Bit 5)
          LE Read Resolving List Size (Octet 34 - Bit 6)
          LE Set Address Resolution Enable (Octet 35 - Bit 1)
          LE Set Resolvable Private Address Timeout (Octet 35 - Bit 2)
          LE Read Maximum Data Length (Octet 35 - Bit 3)
          LE Read PHY (Octet 35 - Bit 4)
          LE Set Default PHY (Octet 35 - Bit 5)
          LE Set PHY (Octet 35 - Bit 6)
          LE Enhanced Receiver Test (Octet 35 - Bit 7)
          LE Enhanced Transmitter Test (Octet 36 - Bit 0)
          LE Set Advertising Set Random Address (Octet 36 - Bit 1)
          LE Set Extended Advertising Parameters (Octet 36 - Bit 2)
          LE Set Extended Advertising Data (Octet 36 - Bit 3)
          LE Set Extended Scan Response Data (Octet 36 - Bit 4)
          LE Set Extended Advertising Enable (Octet 36 - Bit 5)
          LE Read Maximum Advertising Data Length (Octet 36 - Bit 6)
          LE Read Number of Supported Advertising Sets (Octet 36 - Bit 7)
          LE Remove Advertising Set (Octet 37 - Bit 0)
          LE Clear Advertising Sets (Octet 37 - Bit 1)
          LE Set Periodic Advertising Parameters (Octet 37 - Bit 2)
          LE Set Periodic Advertising Data (Octet 37 - Bit 3)
          LE Set Periodic Advertising Enable (Octet 37 - Bit 4)
          LE Set Extended Scan Parameters (Octet 37 - Bit 5)
          LE Set Extended Scan Enable (Octet 37 - Bit 6)
          LE Extended Create Connection (Octet 37 - Bit 7)
          LE Periodic Advertising Create Sync (Octet 38 - Bit 0)
          LE Periodic Advertising Create Sync Cancel (Octet 38 - Bit 1)
          LE Periodic Advertising Terminate Sync (Octet 38 - Bit 2)
          LE Add Device To Periodic Advertiser List (Octet 38 - Bit 3)
          LE Remove Device From Periodic Advertiser List (Octet 38 - Bit 4)
          LE Clear Periodic Advertiser List (Octet 38 - Bit 5)
          LE Read Periodic Advertiser List Size (Octet 38 - Bit 6)
          LE Read Transmit Power (Octet 38 - Bit 7)
          LE Read RF Path Compensation (Octet 39 - Bit 0)
          LE Write RF Path Compensation (Octet 39 - Bit 1)
          LE Set Privacy Mode (Octet 39 - Bit 2)
          LE Periodic Advertising Receive Enable (Octet 40 - Bit 5)
          LE Periodic Advertising Sync Transfer (Octet 40 - Bit 6)
          LE Periodic Advertising Set Info Transfer (Octet 40 - Bit 7)
          LE Periodic Advertising Sync Transfer Parameters (Octet 41 - Bit 0)
          LE Set Default Periodic Advertisng Sync Transfer Parameters (Octet 41 - Bit 1)
          LE Read Buffer v2 (Octet 41 - Bit 5)
          LE Read ISO TX Sync (Octet 41 - Bit 6)
          LE Set Connected Isochronous Group Parameters (Octet 41 - Bit 7)
          LE Set Connected Isochronous Group Parameters Test (Octet 42 - Bit 0)
          LE Create Connected Isochronous Stream (Octet 42 - Bit 1)
          LE Remove Connected Isochronous Group (Octet 42 - Bit 2)
          LE Accept Connected Isochronous Stream Request (Octet 42 - Bit 3)
          LE Reject Connected Isochronous Stream Request (Octet 42 - Bit 4)
          LE Create Broadcast Isochronous Group (Octet 42 - Bit 5)
          LE Create Broadcast Isochronous Group Test (Octet 42 - Bit 6)
          LE Terminate Broadcast Isochronous Group (Octet 42 - Bit 7)
          LE Broadcast Isochronous Group Create Sync (Octet 43 - Bit 0)
          LE Broadcast Isochronous Group Terminate Sync (Octet 43 - Bit 1)
          LE Request Peer SCA (Octet 43 - Bit 2)
          LE Setup Isochronous Data Path (Octet 43 - Bit 3)
          LE Remove Isochronous Data Path (Octet 43 - Bit 4)
          LE Isochronous Transmit Test (Octet 43 - Bit 5)
          LE Isochronous Receive Test (Octet 43 - Bit 6)
          LE Isochronous Read Test Counters (Octet 43 - Bit 7)
          LE Isochronous Read Test Counters (Octet 44 - Bit 0)
          LE Set Host Feature (Octet 44 - Bit 1)
          Octet 44 - Bit 2 
          Octet 45 - Bit 6 
          Octet 46 - Bit 0 
          Octet 46 - Bit 1 
          Octet 46 - Bit 2 
< HCI Command: Host Buffer Size (0x03|0x0033) plen 7         #9 [hci1] 0.428782
        ACL MTU: 255  ACL max packet: 16
        SCO MTU: 0    SCO max packet: 0
> HCI Event: Command Complete (0x0e) plen 4                 #10 [hci1] 0.429290
      Host Buffer Size (0x03|0x0033) ncmd 1
        Status: Success (0x00)
< HCI Command: Set Controller To Ho.. (0x03|0x0031) plen 1  #11 [hci1] 0.448783
        Flow control: ACL Data Packets (0x01)
> HCI Event: Command Complete (0x0e) plen 4                 #12 [hci1] 0.449281
      Set Controller To Host Flow Control (0x03|0x0031) ncmd 1
        Status: Success (0x00)
< HCI Command: LE Read Local Suppor.. (0x08|0x0003) plen 0  #13 [hci1] 0.468778
> HCI Event: Command Complete (0x0e) plen 12                #14 [hci1] 0.469375
      LE Read Local Supported Features (0x08|0x0003) ncmd 1
        Status: Success (0x00)
        Features: 0xfd 0x79 0x00 0xf7 0x30 0x01 0x00 0x00
          LE Encryption
          Extended Reject Indication
          Peripheral-initiated Features Exchange
          LE Ping
          LE Data Packet Length Extension
          LL Privacy
          Extended Scanner Filter Policies
          LE 2M PHY
          LE Coded PHY
          LE Extended Advertising
          LE Periodic Advertising
          Channel Selection Algorithm #2
          Periodic Advertising Sync Transfer - Sender
          Periodic Advertising Sync Transfer - Recipient
          Sleep Clock Accuracy Updates
          Connected Isochronous Stream - Central
          Connected Isochronous Stream - Peripheral
          Isochronous Broadcaster
          Synchronized Receiver
          Periodic Advertising ADI support
          Connection Subrating
          Unknown features (0x0000010000000000)
< HCI Command: LE Set Host Feature (0x08|0x0074) plen 2     #15 [hci1] 0.488793
        Bit Number: 32
          Connected Isochronous Stream (Host Support)
        Bit Value: 1
> HCI Event: Command Complete (0x0e) plen 4                 #16 [hci1] 0.489221
      LE Set Host Feature (0x08|0x0074) ncmd 1
        Status: Success (0x00)
< HCI Command: LE Read Buffer v2 (0x08|0x0060) plen 0       #17 [hci1] 0.508757
> HCI Event: Command Complete (0x0e) plen 10                #18 [hci1] 0.509308
      LE Read Buffer v2 (0x08|0x0060) ncmd 1
        Status: Success (0x00)
        ACL MTU: 27
        ACL max packet: 3
        ISO MTU: 318
        ISO max packet: 3
< HCI Command: LE Read Maximum Adve.. (0x08|0x003a) plen 0  #19 [hci1] 0.528825
> HCI Event: Command Complete (0x0e) plen 6                 #20 [hci1] 0.529273
      LE Read Maximum Advertising Data Length (0x08|0x003a) ncmd 1
        Status: Success (0x00)
        Max length: 1650
< HCI Command: LE Read Supported St.. (0x08|0x001c) plen 0  #21 [hci1] 0.548783
> HCI Event: Command Complete (0x0e) plen 12                #22 [hci1] 0.549359
      LE Read Supported States (0x08|0x001c) ncmd 1
        Status: Success (0x00)
        States: 0x000003ff3e0306ff
          Non-connectable Advertising State
          Scannable Advertising State
          Connectable Advertising State
          High Duty Cycle Directed Advertising State
          Passive Scanning State
          Active Scanning State
          Initiating State
            and Connection State (Central Role)
          Connection State (Peripheral Role)
          Scannable Advertising State
            and Passive Scanning State
          Connectable Advertising State
            and Passive Scanning State
          Non-connectable Advertising State
            and Initiating State
          Scannable Advertising State
            and Initiating State
          Active Scanning State
            and Connection State (Central Role)
          Passive Scanning State
            and Connection State (Peripheral Role)
          Active Scanning State
            and Connection State (Peripheral Role)
          Initiating State
            and Connection State (Central Role)
            and Central Role & Central Role
          Low Duty Cycle Directed Advertising State
          Connectable Advertising State
            and Initiating State
            and Central Role & Peripheral Role
          High Duty Cycle Directed Advertising State
            and Initiating State
            and Central Role & Peripheral Role
          Low Duty Cycle Directed Advertising State
            and Initiating State
            and Central Role & Peripheral Role
          Connectable Advertising State
            and Connection State (Central Role)
            and Central Role & Peripheral Role
          High Duty Cycle Directed Advertising State
            and Connection State (Central Role)
            and Central Role & Peripheral Role
          Low Duty Cycle Directed Advertising State
            and Connection State (Central Role)
            and Central Role & Peripheral Role
          Connectable Advertising State
            and Connection State (Peripheral Role)
            and Central Role & Peripheral Role
          High Duty Cycle Directed Advertising State
            and Connection State (Peripheral Role)
            and Peripheral Role & Peripheral Role
          Low Duty Cycle Directed Advertising State
            and Connection State (Peripheral Role)
            and Peripheral Role & Peripheral Role
          Initiating State
            and Connection State (Peripheral Role)
            and Central Role & Peripheral Role
< HCI Command: LE Read Maximum Data.. (0x08|0x002f) plen 0  #23 [hci1] 0.568782
> HCI Event: Command Complete (0x0e) plen 12                #24 [hci1] 0.569272
      LE Read Maximum Data Length (0x08|0x002f) ncmd 1
        Status: Success (0x00)
        Max TX octets: 251
        Max TX time: 2704
        Max RX octets: 251
        Max RX time: 2704
< HCI Command: LE Write Suggested D.. (0x08|0x0024) plen 4  #25 [hci1] 0.588788
        TX octets: 251
        TX time: 2704
> HCI Event: Command Complete (0x0e) plen 4                 #26 [hci1] 0.589331
      LE Write Suggested Default Data Length (0x08|0x0024) ncmd 1
        Status: Success (0x00)
< HCI Command: LE Read Resolving Li.. (0x08|0x002a) plen 0  #27 [hci1] 0.608788
> HCI Event: Command Complete (0x0e) plen 5                 #28 [hci1] 0.609294
      LE Read Resolving List Size (0x08|0x002a) ncmd 1
        Status: Success (0x00)
        Size: 8
< HCI Command: LE Set Event Mask (0x08|0x0001) plen 8       #29 [hci1] 0.628773
        Mask: 0x000002023f87fa5e
          LE Advertising Report
          LE Connection Update Complete
          LE Read Remote Used Features Complete
          LE Long Term Key Request
          LE Data Length Change
          LE Enhanced Connection Complete
          LE PHY Update Complete
          LE Extended Advertising Report
          LE Periodic Advertising Sync Established
          LE Periodic Advertising Report
          LE Periodic Advertising Sync Lost
          LE Extended Scan Timeout
          LE Extended Advertising Set Terminated
          LE Scan Request Received
          LE Periodic Advertising Sync Transfer Rvc
          LE CIS Established
          LE CIS Request
          LE Create BIG Complete
          LE Terminate BIG Complete
          LE BIG Sync Estabilished Complete
          LE BIG Sync Lost
          LE BIG Info Advertising Report
          Unknown mask (0x0000020000000000)
> HCI Event: Command Complete (0x0e) plen 4                 #30 [hci1] 0.629306
      LE Set Event Mask (0x08|0x0001) ncmd 1
        Status: Success (0x00)
< HCI Command: Set Event Mask (0x03|0x0001) plen 8          #31 [hci1] 0.648791
        Mask: 0x2000800002008890
          Disconnection Complete
          Encryption Change
          Read Remote Version Information Complete
          Hardware Error
          Data Buffer Overflow
          Encryption Key Refresh Complete
          LE Meta
> HCI Event: Command Complete (0x0e) plen 4                 #32 [hci1] 0.649324
      Set Event Mask (0x03|0x0001) ncmd 1
        Status: Success (0x00)
< HCI Command: Read BD ADDR (0x04|0x0009) plen 0            #33 [hci1] 0.668794
> HCI Event: Command Complete (0x0e) plen 10                #34 [hci1] 0.669233
      Read BD ADDR (0x04|0x0009) ncmd 1
        Status: Success (0x00)
        Address: 00:00:00:00:00:00 (OUI 00-00-00)
< HCI Command: LE Set Random Address (0x08|0x0005) plen 6   #35 [hci1] 0.688794
        Address: D5:B6:CC:31:DB:3B (Static)
> HCI Event: Command Complete (0x0e) plen 4                 #36 [hci1] 0.689351
      LE Set Random Address (0x08|0x0005) ncmd 1
        Status: Success (0x00)
< HCI Command: LE Set Extended Adv.. (0x08|0x0036) plen 25  #37 [hci1] 3.259348
        Handle: 0x00
        Properties: 0x0013
          Connectable
          Scannable
          Use legacy advertising PDUs: ADV_IND
        Min advertising interval: 100.000 msec (0x00a0)
        Max advertising interval: 150.000 msec (0x00f0)
        Channel map: 37, 38, 39 (0x07)
        Own address type: Random (0x01)
        Peer address type: Public (0x00)
        Peer address: 00:00:00:00:00:00 (OUI 00-00-00)
        Filter policy: Allow Scan Request from Any, Allow Connect Request from Any (0x00)
        TX power: Host has no preference (0x7f)
        Primary PHY: LE 1M (0x01)
        Secondary max skip: 0x00
        Secondary PHY: LE 1M (0x01)
        SID: 0x00
        Scan request notifications: Disabled (0x00)
> HCI Event: Command Complete (0x0e) plen 5                 #38 [hci1] 3.260271
      LE Set Extended Advertising Parameters (0x08|0x0036) ncmd 1
        Status: Success (0x00)
        TX power (selected): 0 dbm (0x00)
< HCI Command: LE Set Advertising S.. (0x08|0x0035) plen 7  #39 [hci1] 3.269194
        Advertising handle: 0x00
        Advertising random address: D5:B6:CC:31:DB:3B (Static)
> HCI Event: Command Complete (0x0e) plen 4                 #40 [hci1] 3.269736
      LE Set Advertising Set Random Address (0x08|0x0035) ncmd 1
        Status: Success (0x00)
< HCI Command: LE Set Extended Adv.. (0x08|0x0037) plen 22  #41 [hci1] 3.289017
        Handle: 0x00
        Operation: Complete extended advertising data (0x03)
        Fragment preference: Minimize fragmentation (0x01)
        Data length: 0x12
        Flags: 0x06
          LE General Discoverable Mode
          BR/EDR Not Supported
        Name (complete): Tester_F6B11A
> HCI Event: Command Complete (0x0e) plen 4                 #42 [hci1] 3.289784
      LE Set Extended Advertising Data (0x08|0x0037) ncmd 1
        Status: Success (0x00)
< HCI Command: LE Set Extended Scan.. (0x08|0x0038) plen 4  #43 [hci1] 3.308838
        Handle: 0x00
        Operation: Complete scan response data (0x03)
        Fragment preference: Minimize fragmentation (0x01)
        Data length: 0x00
> HCI Event: Command Complete (0x0e) plen 4                 #44 [hci1] 3.309328
      LE Set Extended Scan Response Data (0x08|0x0038) ncmd 1
        Status: Success (0x00)
< HCI Command: LE Set Extended Adve.. (0x08|0x0039) plen 6  #45 [hci1] 3.328820
        Extended advertising: Enabled (0x01)
        Number of sets: 1 (0x01)
        Entry 0
          Handle: 0x00
          Duration: 0 ms (0x00)
          Max ext adv events: 0
> HCI Event: Command Complete (0x0e) plen 4                 #46 [hci1] 3.329409
      LE Set Extended Advertising Enable (0x08|0x0039) ncmd 1
        Status: Success (0x00)
> HCI Event: LE Meta Event (0x3e) plen 31                   #47 [hci1] 3.438721
      LE Enhanced Connection Complete (0x0a)
        Status: Success (0x00)
        Handle: 2415
        Role: Peripheral (0x01)
        Peer address type: Public (0x00)
        Peer address: DF:A9:FF:F6:B1:1A (OUI DF-A9-FF)
        Local resolvable private address: 00:00:00:00:00:00 (Non-Resolvable)
        Peer resolvable private address: 00:00:00:00:00:00 (Non-Resolvable)
        Connection interval: 87.50 msec (0x0046)
        Connection latency: 0 (0x0000)
        Supervision timeout: 25120 msec (0x09d0)
        Central clock accuracy: 0x01
> HCI Event: LE Meta Event (0x3e) plen 6                    #48 [hci1] 3.438725
      LE Advertising Set Terminated (0x12)
        Status: Success (0x00)
        Handle: 0
        Connection handle: 2415
        Number of completed extended advertising events: 0
< HCI Command: LE Read Remote Used... (0x08|0x0016) plen 2  #49 [hci1] 3.449823
        Handle: 2415 Address: DF:A9:FF:F6:B1:1A (OUI DF-A9-FF)
< ACL Data TX: Handle 2415 flags 0x00 dlen 7                #50 [hci1] 3.449847
      ATT: Exchange MTU Request (0x02) len 2
        Client RX MTU: 251
> HCI Event: Command Status (0x0f) plen 4                   #51 [hci1] 3.450312
      LE Read Remote Used Features (0x08|0x0016) ncmd 1
        Status: Success (0x00)
> HCI Event: Number of Completed Packets (0x13) plen 5      #52 [hci1] 3.614662
        Num handles: 1
        Handle: 2415 Address: DF:A9:FF:F6:B1:1A (OUI DF-A9-FF)
        Count: 1
        #50: len 7 (0 Kb/s)
        Latency: 164 msec (164-164 msec ~164 msec)
> HCI Event: LE Meta Event (0x3e) plen 12                   #53 [hci1] 3.702452
      LE Read Remote Used Features (0x04)
        Status: Success (0x00)
        Handle: 2415 Address: DF:A9:FF:F6:B1:1A (OUI DF-A9-FF)
        Features: 0x2d 0x49 0x00 0xf7 0x67 0xd8 0x00 0x00
          LE Encryption
          Extended Reject Indication
          Peripheral-initiated Features Exchange
          LE Data Packet Length Extension
          LE 2M PHY
          LE Coded PHY
          Channel Selection Algorithm #2
          Periodic Advertising Sync Transfer - Sender
          Periodic Advertising Sync Transfer - Recipient
          Sleep Clock Accuracy Updates
          Connected Isochronous Stream - Central
          Connected Isochronous Stream - Peripheral
          Isochronous Broadcaster
          Synchronized Receiver
          Connected Isochronous Stream (Host Support)
          LE Power Control Request
          LE Power Control Request
          Connection Subrating
          Connection Subrating (Host Support)
          Unknown features (0x0000d80000000000)
> ACL Data RX: Handle 2415 flags 0x02 dlen 11               #54 [hci1] 6.152146
      SMP: Pairing Request (0x01) len 6
        IO capability: KeyboardDisplay (0x04)
        OOB data: Authentication data not present (0x00)
        Authentication requirement: Bonding, MITM, SC, No Keypresses (0x0d)
        Max encryption key size: 16
        Initiator key distribution: EncKey IdKey (0x03)
        Responder key distribution: EncKey IdKey Sign (0x07)
> ACL Data RX: Handle 2415 flags 0x02 dlen 7                #55 [hci1] 6.152605
      ATT: Exchange MTU Response (0x03) len 2
        Server RX MTU: 23
< HCI Command: Host Number of Compl.. (0x03|0x0035) plen 5  #56 [hci1] 6.169218
        Num handles: 1
        Handle: 2415 Address: DF:A9:FF:F6:B1:1A (OUI DF-A9-FF)
        Count: 1
< ACL Data TX: Handle 2415 flags 0x00 dlen 11               #57 [hci1] 6.169341
      SMP: Pairing Response (0x02) len 6
        IO capability: DisplayOnly (0x00)
        OOB data: Authentication data not present (0x00)
        Authentication requirement: Bonding, No MITM, SC, No Keypresses (0x09)
        Max encryption key size: 16
        Initiator key distribution: IdKey (0x02)
        Responder key distribution: <none> (0x00)
< HCI Command: Host Number of Compl.. (0x03|0x0035) plen 5  #58 [hci1] 6.169636
        Num handles: 1
        Handle: 2415 Address: DF:A9:FF:F6:B1:1A (OUI DF-A9-FF)
        Count: 1
> HCI Event: Number of Completed Packets (0x13) plen 5      #59 [hci1] 6.327317
        Num handles: 1
        Handle: 2415 Address: DF:A9:FF:F6:B1:1A (OUI DF-A9-FF)
        Count: 1
        #57: len 11 (0 Kb/s)
        Latency: 157 msec (157-164 msec ~161 msec)
> ACL Data RX: Handle 2415 flags 0x02 dlen 27               #60 [hci1] 6.327637
> ACL Data RX: Handle 2415 flags 0x01 dlen 27               #61 [hci1] 6.328202
> ACL Data RX: Handle 2415 flags 0x01 dlen 15               #62 [hci1] 6.328565
      SMP: Pairing Public Key (0x0c) len 64
        X: ce965361a897fa2dbdd40c8fc64ab552d0a8d52aab75aca382f09c41fb0579c6
        Y: e911f303b16bb4bd94819b495187227c10139d1aa8df00f5ac4f99d82f28f24b
< HCI Command: Host Number of Compl.. (0x03|0x0035) plen 5  #63 [hci1] 6.328906
        Num handles: 1
        Handle: 2415 Address: DF:A9:FF:F6:B1:1A (OUI DF-A9-FF)
        Count: 1
< HCI Command: Host Number of Compl.. (0x03|0x0035) plen 5  #64 [hci1] 6.328910
        Num handles: 1
        Handle: 2415 Address: DF:A9:FF:F6:B1:1A (OUI DF-A9-FF)
        Count: 1
< HCI Command: Host Number of Compl.. (0x03|0x0035) plen 5  #65 [hci1] 6.329025
        Num handles: 1
        Handle: 2415 Address: DF:A9:FF:F6:B1:1A (OUI DF-A9-FF)
        Count: 1
< ACL Data TX: Handle 2415 flags 0x00 dlen 27               #66 [hci1] 6.329037
< ACL Data TX: Handle 2415 flags 0x01 dlen 27               #67 [hci1] 6.329043
< ACL Data TX: Handle 2415 flags 0x01 dlen 15               #68 [hci1] 6.329050
      SMP: Pairing Public Key (0x0c) len 64
        X: 98308440221e2d910f0e54b71e7ec652857aa9b5a0dc65028824cc19db1226e9
        Y: 67a4816bcb62efb21701e31fdb27561a6217575fb007a8bbdabe7e28b6f68482
> HCI Event: Number of Completed Packets (0x13) plen 5      #69 [hci1] 6.415135
        Num handles: 1
        Handle: 2415 Address: DF:A9:FF:F6:B1:1A (OUI DF-A9-FF)
        Count: 1
        #66: len 27 (2 Kb/s)
        Latency: 86 msec (86-164 msec ~123 msec)
> HCI Event: Number of Completed Packets (0x13) plen 5      #70 [hci1] 6.415939
        Num handles: 1
        Handle: 2415 Address: DF:A9:FF:F6:B1:1A (OUI DF-A9-FF)
        Count: 1
        #67: len 27 (2 Kb/s)
        Latency: 86 msec (86-164 msec ~105 msec)
> HCI Event: Number of Completed Packets (0x13) plen 5      #71 [hci1] 6.502008
        Num handles: 1
        Handle: 2415 Address: DF:A9:FF:F6:B1:1A (OUI DF-A9-FF)
        Count: 1
        #68: len 15 (0 Kb/s)
        Latency: 172 msec (86-172 msec ~139 msec)
> ACL Data RX: Handle 2415 flags 0x02 dlen 21               #72 [hci1] 7.464781
      SMP: Pairing Confirm (0x03) len 16
        Confim value: fbd78645adfb3639504846876693f695
< HCI Command: Host Number of Compl.. (0x03|0x0035) plen 5  #73 [hci1] 7.469579
        Num handles: 1
        Handle: 2415 Address: DF:A9:FF:F6:B1:1A (OUI DF-A9-FF)
        Count: 1
< ACL Data TX: Handle 2415 flags 0x00 dlen 21               #74 [hci1] 7.469752
      SMP: Pairing Confirm (0x03) len 16
        Confim value: b87c4c0c681f6e7617c8fa9a52168a8f
> HCI Event: Number of Completed Packets (0x13) plen 5      #75 [hci1] 7.639660
        Num handles: 1
        Handle: 2415 Address: DF:A9:FF:F6:B1:1A (OUI DF-A9-FF)
        Count: 1
        #74: len 21 (0 Kb/s)
        Latency: 169 msec (86-172 msec ~154 msec)
> ACL Data RX: Handle 2415 flags 0x02 dlen 21               #76 [hci1] 7.639931
      SMP: Pairing Random (0x04) len 16
        Random value: 5b83aa8a45094d0d0000000000000000
< HCI Command: Host Number of Compl.. (0x03|0x0035) plen 5  #77 [hci1] 7.649683
        Num handles: 1
        Handle: 2415 Address: DF:A9:FF:F6:B1:1A (OUI DF-A9-FF)
        Count: 1
< ACL Data TX: Handle 2415 flags 0x00 dlen 21               #78 [hci1] 7.649830
      SMP: Pairing Random (0x04) len 16
        Random value: 8e6108f966a694cbe26df70bb96773e6
> HCI Event: Number of Completed Packets (0x13) plen 5      #79 [hci1] 7.814427
        Num handles: 1
        Handle: 2415 Address: DF:A9:FF:F6:B1:1A (OUI DF-A9-FF)
        Count: 1
        #78: len 21 (1 Kb/s)
        Latency: 164 msec (86-172 msec ~159 msec)
> ACL Data RX: Handle 2415 flags 0x02 dlen 21               #80 [hci1] 7.902295
      SMP: Pairing Confirm (0x03) len 16
        Confim value: 4fbaf52c6d5c366eb55738ec55c0876a
< HCI Command: Host Number of Compl.. (0x03|0x0035) plen 5  #81 [hci1] 7.908974
        Num handles: 1
        Handle: 2415 Address: DF:A9:FF:F6:B1:1A (OUI DF-A9-FF)
        Count: 1
< ACL Data TX: Handle 2415 flags 0x00 dlen 21               #82 [hci1] 7.909012
      SMP: Pairing Confirm (0x03) len 16
        Confim value: fd40ceb721da875b06fdbe0b52704d12
> HCI Event: Number of Completed Packets (0x13) plen 5      #83 [hci1] 8.077138
        Num handles: 1
        Handle: 2415 Address: DF:A9:FF:F6:B1:1A (OUI DF-A9-FF)
        Count: 1
        #82: len 21 (1 Kb/s)
        Latency: 168 msec (86-172 msec ~163 msec)
> ACL Data RX: Handle 2415 flags 0x02 dlen 21               #84 [hci1] 8.077460
      SMP: Pairing Random (0x04) len 16
        Random value: 3c9ce27c629329cc0000000000000000
< HCI Command: Host Number of Compl.. (0x03|0x0035) plen 5  #85 [hci1] 8.089709
        Num handles: 1
        Handle: 2415 Address: DF:A9:FF:F6:B1:1A (OUI DF-A9-FF)
        Count: 1
< ACL Data TX: Handle 2415 flags 0x00 dlen 21               #86 [hci1] 8.089827
      SMP: Pairing Random (0x04) len 16
        Random value: 4d02679f89a05211af56d8b3da64d21e
> HCI Event: Number of Completed Packets (0x13) plen 5      #87 [hci1] 8.251948
        Num handles: 1
        Handle: 2415 Address: DF:A9:FF:F6:B1:1A (OUI DF-A9-FF)
        Count: 1
        #86: len 21 (1 Kb/s)
        Latency: 162 msec (86-172 msec ~162 msec)
> ACL Data RX: Handle 2415 flags 0x02 dlen 21               #88 [hci1] 8.339862
      SMP: Pairing Confirm (0x03) len 16
        Confim value: ffe4799496d8a17bafbbee19b4ab5341
< HCI Command: Host Number of Compl.. (0x03|0x0035) plen 5  #89 [hci1] 8.349430
        Num handles: 1
        Handle: 2415 Address: DF:A9:FF:F6:B1:1A (OUI DF-A9-FF)
        Count: 1
< ACL Data TX: Handle 2415 flags 0x00 dlen 21               #90 [hci1] 8.349486
      SMP: Pairing Confirm (0x03) len 16
        Confim value: dffbcd84964c31bad10d91cfab403fa8
> HCI Event: Number of Completed Packets (0x13) plen 5      #91 [hci1] 8.514701
        Num handles: 1
        Handle: 2415 Address: DF:A9:FF:F6:B1:1A (OUI DF-A9-FF)
        Count: 1
        #90: len 21 (1 Kb/s)
        Latency: 165 msec (86-172 msec ~164 msec)
> ACL Data RX: Handle 2415 flags 0x02 dlen 21               #92 [hci1] 8.515009
      SMP: Pairing Random (0x04) len 16
        Random value: 6d477f0f00f947830000000000000000
< HCI Command: Host Number of Compl.. (0x03|0x0035) plen 5  #93 [hci1] 8.529733
        Num handles: 1
        Handle: 2415 Address: DF:A9:FF:F6:B1:1A (OUI DF-A9-FF)
        Count: 1
< ACL Data TX: Handle 2415 flags 0x00 dlen 21               #94 [hci1] 8.529786
      SMP: Pairing Random (0x04) len 16
        Random value: 5e8286bc235a02440d0c3424a2acf8fd
> HCI Event: Number of Completed Packets (0x13) plen 5      #95 [hci1] 8.689431
        Num handles: 1
        Handle: 2415 Address: DF:A9:FF:F6:B1:1A (OUI DF-A9-FF)
        Count: 1
        #94: len 21 (1 Kb/s)
        Latency: 159 msec (86-172 msec ~161 msec)
> ACL Data RX: Handle 2415 flags 0x02 dlen 21               #96 [hci1] 8.777273
      SMP: Pairing Confirm (0x03) len 16
        Confim value: b106b60c55b84171939e7ef1a79187bf
< HCI Command: Host Number of Compl.. (0x03|0x0035) plen 5  #97 [hci1] 8.789376
        Num handles: 1
        Handle: 2415 Address: DF:A9:FF:F6:B1:1A (OUI DF-A9-FF)
        Count: 1
< ACL Data TX: Handle 2415 flags 0x00 dlen 21               #98 [hci1] 8.789532
      SMP: Pairing Confirm (0x03) len 16
        Confim value: 666f714e4525863181dd3ca1340822a2
> HCI Event: Number of Completed Packets (0x13) plen 5      #99 [hci1] 8.952133
        Num handles: 1
        Handle: 2415 Address: DF:A9:FF:F6:B1:1A (OUI DF-A9-FF)
        Count: 1
        #98: len 21 (1 Kb/s)
        Latency: 162 msec (86-172 msec ~162 msec)
> ACL Data RX: Handle 2415 flags 0x02 dlen 21              #100 [hci1] 8.952429
      SMP: Pairing Random (0x04) len 16
        Random value: 470916b8ac7a90b00000000000000000
< HCI Command: Host Number of Comp.. (0x03|0x0035) plen 5  #101 [hci1] 8.969779
        Num handles: 1
        Handle: 2415 Address: DF:A9:FF:F6:B1:1A (OUI DF-A9-FF)
        Count: 1
< ACL Data TX: Handle 2415 flags 0x00 dlen 21              #102 [hci1] 8.969963
      SMP: Pairing Random (0x04) len 16
        Random value: 5c4a1bcadd27bd58e945097b00bad7ac
> HCI Event: Number of Completed Packets (0x13) plen 5     #103 [hci1] 9.126884
        Num handles: 1
        Handle: 2415 Address: DF:A9:FF:F6:B1:1A (OUI DF-A9-FF)
        Count: 1
        #102: len 21 (1 Kb/s)
        Latency: 156 msec (86-172 msec ~159 msec)
> ACL Data RX: Handle 2415 flags 0x02 dlen 21              #104 [hci1] 9.214885
      SMP: Pairing Confirm (0x03) len 16
        Confim value: 4957ea839a63c74cfd5536cadec8db3c
< HCI Command: Host Number of Comp.. (0x03|0x0035) plen 5  #105 [hci1] 9.229594
        Num handles: 1
        Handle: 2415 Address: DF:A9:FF:F6:B1:1A (OUI DF-A9-FF)
        Count: 1
< ACL Data TX: Handle 2415 flags 0x00 dlen 21              #106 [hci1] 9.229752
      SMP: Pairing Confirm (0x03) len 16
        Confim value: 6c7171977f021cdaf6a46868f3892b13
> HCI Event: Number of Completed Packets (0x13) plen 5     #107 [hci1] 9.389643
        Num handles: 1
        Handle: 2415 Address: DF:A9:FF:F6:B1:1A (OUI DF-A9-FF)
        Count: 1
        #106: len 21 (1 Kb/s)
        Latency: 159 msec (86-172 msec ~159 msec)
> ACL Data RX: Handle 2415 flags 0x02 dlen 21              #108 [hci1] 9.390028
      SMP: Pairing Random (0x04) len 16
        Random value: a067a3c01ee7487a0000000000000000
< HCI Command: Host Number of Comp.. (0x03|0x0035) plen 5  #109 [hci1] 9.409776
        Num handles: 1
        Handle: 2415 Address: DF:A9:FF:F6:B1:1A (OUI DF-A9-FF)
        Count: 1
< ACL Data TX: Handle 2415 flags 0x00 dlen 21              #110 [hci1] 9.409877
      SMP: Pairing Random (0x04) len 16
        Random value: 32527e6e64e79f33b2e374394db8ab2d
> HCI Event: Number of Completed Packets (0x13) plen 5     #111 [hci1] 9.564411
        Num handles: 1
        Handle: 2415 Address: DF:A9:FF:F6:B1:1A (OUI DF-A9-FF)
        Count: 1
        #110: len 21 (1 Kb/s)
        Latency: 154 msec (86-172 msec ~157 msec)
> ACL Data RX: Handle 2415 flags 0x02 dlen 21              #112 [hci1] 9.652255
      SMP: Pairing Confirm (0x03) len 16
        Confim value: ee3d61ecb2028eb293253f8ee2686d55
< HCI Command: Host Number of Comp.. (0x03|0x0035) plen 5  #113 [hci1] 9.669232
        Num handles: 1
        Handle: 2415 Address: DF:A9:FF:F6:B1:1A (OUI DF-A9-FF)
        Count: 1
< ACL Data TX: Handle 2415 flags 0x00 dlen 21              #114 [hci1] 9.669337
      SMP: Pairing Confirm (0x03) len 16
        Confim value: a49f494cecc598c272480b740924eb3d
> HCI Event: Number of Completed Packets (0x13) plen 5     #115 [hci1] 9.827038
        Num handles: 1
        Handle: 2415 Address: DF:A9:FF:F6:B1:1A (OUI DF-A9-FF)
        Count: 1
        #114: len 21 (1 Kb/s)
        Latency: 157 msec (86-172 msec ~157 msec)
> ACL Data RX: Handle 2415 flags 0x02 dlen 21              #116 [hci1] 9.827381
      SMP: Pairing Random (0x04) len 16
        Random value: e028c72d8946ade90000000000000000
< HCI Command: Host Number of Comp.. (0x03|0x0035) plen 5  #117 [hci1] 9.829716
        Num handles: 1
        Handle: 2415 Address: DF:A9:FF:F6:B1:1A (OUI DF-A9-FF)
        Count: 1
< ACL Data TX: Handle 2415 flags 0x00 dlen 21              #118 [hci1] 9.829906
      SMP: Pairing Random (0x04) len 16
        Random value: dddbdfe2838e9a8cc6964353c850fef7
> HCI Event: Number of Completed Packets (0x13) plen 5    #119 [hci1] 10.001879
        Num handles: 1
        Handle: 2415 Address: DF:A9:FF:F6:B1:1A (OUI DF-A9-FF)
        Count: 1
        #118: len 21 (0 Kb/s)
        Latency: 171 msec (86-172 msec ~164 msec)
> ACL Data RX: Handle 2415 flags 0x02 dlen 21             #120 [hci1] 10.089691
      SMP: Pairing Confirm (0x03) len 16
        Confim value: 32c3a7807c1927d52aff225bbfd6416a
< HCI Command: Host Number of Com.. (0x03|0x0035) plen 5  #121 [hci1] 10.109599
        Num handles: 1
        Handle: 2415 Address: DF:A9:FF:F6:B1:1A (OUI DF-A9-FF)
        Count: 1
< ACL Data TX: Handle 2415 flags 0x00 dlen 21             #122 [hci1] 10.109697
      SMP: Pairing Confirm (0x03) len 16
        Confim value: adaf62575a42a439289445fc1322b34d
> HCI Event: Number of Completed Packets (0x13) plen 5    #123 [hci1] 10.264649
        Num handles: 1
        Handle: 2415 Address: DF:A9:FF:F6:B1:1A (OUI DF-A9-FF)
        Count: 1
        #122: len 21 (1 Kb/s)
        Latency: 154 msec (86-172 msec ~159 msec)
> ACL Data RX: Handle 2415 flags 0x02 dlen 21             #124 [hci1] 10.264881
      SMP: Pairing Random (0x04) len 16
        Random value: 54827ae5e646624b0000000000000000
< HCI Command: Host Number of Com.. (0x03|0x0035) plen 5  #125 [hci1] 10.269924
        Num handles: 1
        Handle: 2415 Address: DF:A9:FF:F6:B1:1A (OUI DF-A9-FF)
        Count: 1
< ACL Data TX: Handle 2415 flags 0x00 dlen 21             #126 [hci1] 10.270046
      SMP: Pairing Random (0x04) len 16
        Random value: eb9f1915536596b6fc3db1c86b2b1970
> HCI Event: Number of Completed Packets (0x13) plen 5    #127 [hci1] 10.439313
        Num handles: 1
        Handle: 2415 Address: DF:A9:FF:F6:B1:1A (OUI DF-A9-FF)
        Count: 1
        #126: len 21 (0 Kb/s)
        Latency: 169 msec (86-172 msec ~164 msec)
> ACL Data RX: Handle 2415 flags 0x02 dlen 21             #128 [hci1] 10.527212
      SMP: Pairing Confirm (0x03) len 16
        Confim value: f47380df862c6cc8c439f6cad7c12a78
< HCI Command: Host Number of Com.. (0x03|0x0035) plen 5  #129 [hci1] 10.529535
        Num handles: 1
        Handle: 2415 Address: DF:A9:FF:F6:B1:1A (OUI DF-A9-FF)
        Count: 1
< ACL Data TX: Handle 2415 flags 0x00 dlen 21             #130 [hci1] 10.529593
      SMP: Pairing Confirm (0x03) len 16
        Confim value: 56e177623db269ecae1c42851ea77904
> HCI Event: Number of Completed Packets (0x13) plen 5    #131 [hci1] 10.702083
        Num handles: 1
        Handle: 2415 Address: DF:A9:FF:F6:B1:1A (OUI DF-A9-FF)
        Count: 1
        #130: len 21 (0 Kb/s)
        Latency: 172 msec (86-172 msec ~168 msec)
> ACL Data RX: Handle 2415 flags 0x02 dlen 21             #132 [hci1] 10.702386
      SMP: Pairing Random (0x04) len 16
        Random value: 9cbbfacf5b92924f0000000000000000
< HCI Command: Host Number of Com.. (0x03|0x0035) plen 5  #133 [hci1] 10.709756
        Num handles: 1
        Handle: 2415 Address: DF:A9:FF:F6:B1:1A (OUI DF-A9-FF)
        Count: 1
< ACL Data TX: Handle 2415 flags 0x00 dlen 21             #134 [hci1] 10.709921
      SMP: Pairing Random (0x04) len 16
        Random value: 5c794dc9ad9f2c3f295ebd5ad5e1c3cf
> HCI Event: Number of Completed Packets (0x13) plen 5    #135 [hci1] 10.876807
        Num handles: 1
        Handle: 2415 Address: DF:A9:FF:F6:B1:1A (OUI DF-A9-FF)
        Count: 1
        #134: len 21 (1 Kb/s)
        Latency: 166 msec (86-172 msec ~167 msec)
> ACL Data RX: Handle 2415 flags 0x02 dlen 21             #136 [hci1] 10.964773
      SMP: Pairing Confirm (0x03) len 16
        Confim value: 42c5796e1e9ed3415a9152f9eb3e5d76
< HCI Command: Host Number of Com.. (0x03|0x0035) plen 5  #137 [hci1] 10.969688
        Num handles: 1
        Handle: 2415 Address: DF:A9:FF:F6:B1:1A (OUI DF-A9-FF)
        Count: 1
< ACL Data TX: Handle 2415 flags 0x00 dlen 21             #138 [hci1] 10.969798
      SMP: Pairing Confirm (0x03) len 16
        Confim value: 1791bfd9903b409dd4111163f50ad9cb
> HCI Event: Number of Completed Packets (0x13) plen 5    #139 [hci1] 11.139630
        Num handles: 1
        Handle: 2415 Address: DF:A9:FF:F6:B1:1A (OUI DF-A9-FF)
        Count: 1
        #138: len 21 (0 Kb/s)
        Latency: 169 msec (86-172 msec ~168 msec)
> ACL Data RX: Handle 2415 flags 0x02 dlen 21             #140 [hci1] 11.139910
      SMP: Pairing Random (0x04) len 16
        Random value: d190986f0b2b54f90000000000000000
< HCI Command: Host Number of Com.. (0x03|0x0035) plen 5  #141 [hci1] 11.149829
        Num handles: 1
        Handle: 2415 Address: DF:A9:FF:F6:B1:1A (OUI DF-A9-FF)
        Count: 1
< ACL Data TX: Handle 2415 flags 0x00 dlen 21             #142 [hci1] 11.149984
      SMP: Pairing Random (0x04) len 16
        Random value: 5c2fff312cdf99c9491988e877355a9a
> HCI Event: Number of Completed Packets (0x13) plen 5    #143 [hci1] 11.314396
        Num handles: 1
        Handle: 2415 Address: DF:A9:FF:F6:B1:1A (OUI DF-A9-FF)
        Count: 1
        #142: len 21 (1 Kb/s)
        Latency: 164 msec (86-172 msec ~166 msec)
> ACL Data RX: Handle 2415 flags 0x02 dlen 21             #144 [hci1] 11.402124
      SMP: Pairing Confirm (0x03) len 16
        Confim value: 6b9524fd518df751565ccc7d6868ab2c
< HCI Command: Host Number of Com.. (0x03|0x0035) plen 5  #145 [hci1] 11.409215
        Num handles: 1
        Handle: 2415 Address: DF:A9:FF:F6:B1:1A (OUI DF-A9-FF)
        Count: 1
< ACL Data TX: Handle 2415 flags 0x00 dlen 21             #146 [hci1] 11.409307
      SMP: Pairing Confirm (0x03) len 16
        Confim value: 2482b3224d9a8f150e98badc236887f2
> HCI Event: Number of Completed Packets (0x13) plen 5    #147 [hci1] 11.576997
        Num handles: 1
        Handle: 2415 Address: DF:A9:FF:F6:B1:1A (OUI DF-A9-FF)
        Count: 1
        #146: len 21 (1 Kb/s)
        Latency: 167 msec (86-172 msec ~167 msec)
> ACL Data RX: Handle 2415 flags 0x02 dlen 21             #148 [hci1] 11.577405
      SMP: Pairing Random (0x04) len 16
        Random value: ac8c3ad4b8b42ea80000000000000000
< HCI Command: Host Number of Com.. (0x03|0x0035) plen 5  #149 [hci1] 11.589794
        Num handles: 1
        Handle: 2415 Address: DF:A9:FF:F6:B1:1A (OUI DF-A9-FF)
        Count: 1
< ACL Data TX: Handle 2415 flags 0x00 dlen 21             #150 [hci1] 11.589967
      SMP: Pairing Random (0x04) len 16
        Random value: c629a3a987d808e808655d558dfc1155
> HCI Event: Number of Completed Packets (0x13) plen 5    #151 [hci1] 11.751777
        Num handles: 1
        Handle: 2415 Address: DF:A9:FF:F6:B1:1A (OUI DF-A9-FF)
        Count: 1
        #150: len 21 (1 Kb/s)
        Latency: 161 msec (86-172 msec ~164 msec)
> ACL Data RX: Handle 2415 flags 0x02 dlen 21             #152 [hci1] 11.839787
      SMP: Pairing Confirm (0x03) len 16
        Confim value: 1aa1b0b228e24c31024836b5bd46c856
< HCI Command: Host Number of Com.. (0x03|0x0035) plen 5  #153 [hci1] 11.849589
        Num handles: 1
        Handle: 2415 Address: DF:A9:FF:F6:B1:1A (OUI DF-A9-FF)
        Count: 1
< ACL Data TX: Handle 2415 flags 0x00 dlen 21             #154 [hci1] 11.849756
      SMP: Pairing Confirm (0x03) len 16
        Confim value: 71111dabd92c1b9ed7c657d609b9d2cd
> HCI Event: Number of Completed Packets (0x13) plen 5    #155 [hci1] 12.014574
        Num handles: 1
        Handle: 2415 Address: DF:A9:FF:F6:B1:1A (OUI DF-A9-FF)
        Count: 1
        #154: len 21 (1 Kb/s)
        Latency: 164 msec (86-172 msec ~164 msec)
> ACL Data RX: Handle 2415 flags 0x02 dlen 21             #156 [hci1] 12.014963
      SMP: Pairing Random (0x04) len 16
        Random value: 98f0f3b4ad624ea30000000000000000
< HCI Command: Host Number of Com.. (0x03|0x0035) plen 5  #157 [hci1] 12.029812
        Num handles: 1
        Handle: 2415 Address: DF:A9:FF:F6:B1:1A (OUI DF-A9-FF)
        Count: 1
< ACL Data TX: Handle 2415 flags 0x00 dlen 21             #158 [hci1] 12.029890
      SMP: Pairing Random (0x04) len 16
        Random value: 92f20f6ad8f13724432c7fd6001c45ff
> HCI Event: Number of Completed Packets (0x13) plen 5    #159 [hci1] 12.189343
        Num handles: 1
        Handle: 2415 Address: DF:A9:FF:F6:B1:1A (OUI DF-A9-FF)
        Count: 1
        #158: len 21 (1 Kb/s)
        Latency: 159 msec (86-172 msec ~162 msec)
> ACL Data RX: Handle 2415 flags 0x02 dlen 21             #160 [hci1] 12.277169
      SMP: Pairing Confirm (0x03) len 16
        Confim value: baa1a308d5f7dea476369579eb708b50
< HCI Command: Host Number of Com.. (0x03|0x0035) plen 5  #161 [hci1] 12.289587
        Num handles: 1
        Handle: 2415 Address: DF:A9:FF:F6:B1:1A (OUI DF-A9-FF)
        Count: 1
< ACL Data TX: Handle 2415 flags 0x00 dlen 21             #162 [hci1] 12.289765
      SMP: Pairing Confirm (0x03) len 16
        Confim value: de8b72d954b3c9d68af5493a278a6da7
> HCI Event: Number of Completed Packets (0x13) plen 5    #163 [hci1] 12.451981
        Num handles: 1
        Handle: 2415 Address: DF:A9:FF:F6:B1:1A (OUI DF-A9-FF)
        Count: 1
        #162: len 21 (1 Kb/s)
        Latency: 162 msec (86-172 msec ~162 msec)
> ACL Data RX: Handle 2415 flags 0x02 dlen 21             #164 [hci1] 12.452321
      SMP: Pairing Random (0x04) len 16
        Random value: 885ac5914d106c720000000000000000
< HCI Command: Host Number of Com.. (0x03|0x0035) plen 5  #165 [hci1] 12.469690
        Num handles: 1
        Handle: 2415 Address: DF:A9:FF:F6:B1:1A (OUI DF-A9-FF)
        Count: 1
< ACL Data TX: Handle 2415 flags 0x00 dlen 21             #166 [hci1] 12.469847
      SMP: Pairing Random (0x04) len 16
        Random value: 23ac32ebbb5e14c8a6b9622f296d277f
> HCI Event: Number of Completed Packets (0x13) plen 5    #167 [hci1] 12.626829
        Num handles: 1
        Handle: 2415 Address: DF:A9:FF:F6:B1:1A (OUI DF-A9-FF)
        Count: 1
        #166: len 21 (1 Kb/s)
        Latency: 156 msec (86-172 msec ~159 msec)
> ACL Data RX: Handle 2415 flags 0x02 dlen 21             #168 [hci1] 12.714700
      SMP: Pairing Confirm (0x03) len 16
        Confim value: cea2b70cb00b085b587e27819d4e17fd
< HCI Command: Host Number of Com.. (0x03|0x0035) plen 5  #169 [hci1] 12.729228
        Num handles: 1
        Handle: 2415 Address: DF:A9:FF:F6:B1:1A (OUI DF-A9-FF)
        Count: 1
< ACL Data TX: Handle 2415 flags 0x00 dlen 21             #170 [hci1] 12.729286
      SMP: Pairing Confirm (0x03) len 16
        Confim value: 1e8163e739822d85e199557e94ad4fd1
> HCI Event: Number of Completed Packets (0x13) plen 5    #171 [hci1] 12.889580
        Num handles: 1
        Handle: 2415 Address: DF:A9:FF:F6:B1:1A (OUI DF-A9-FF)
        Count: 1
        #170: len 21 (1 Kb/s)
        Latency: 160 msec (86-172 msec ~159 msec)
> ACL Data RX: Handle 2415 flags 0x02 dlen 21             #172 [hci1] 12.889902
      SMP: Pairing Random (0x04) len 16
        Random value: c8fda31d98197f740000000000000000
< HCI Command: Host Number of Com.. (0x03|0x0035) plen 5  #173 [hci1] 12.909900
        Num handles: 1
        Handle: 2415 Address: DF:A9:FF:F6:B1:1A (OUI DF-A9-FF)
        Count: 1
< ACL Data TX: Handle 2415 flags 0x00 dlen 21             #174 [hci1] 12.910074
      SMP: Pairing Random (0x04) len 16
        Random value: 297efe85e67448a15f56bd27e3a3cf1d
> HCI Event: Number of Completed Packets (0x13) plen 5    #175 [hci1] 13.064263
        Num handles: 1
        Handle: 2415 Address: DF:A9:FF:F6:B1:1A (OUI DF-A9-FF)
        Count: 1
        #174: len 21 (1 Kb/s)
        Latency: 154 msec (86-172 msec ~157 msec)
> ACL Data RX: Handle 2415 flags 0x02 dlen 21             #176 [hci1] 13.152076
      SMP: Pairing Confirm (0x03) len 16
        Confim value: da6d17cc99c21fbbdbcf88af7762da17
< HCI Command: Host Number of Com.. (0x03|0x0035) plen 5  #177 [hci1] 13.169328
        Num handles: 1
        Handle: 2415 Address: DF:A9:FF:F6:B1:1A (OUI DF-A9-FF)
        Count: 1
< ACL Data TX: Handle 2415 flags 0x00 dlen 21             #178 [hci1] 13.169458
      SMP: Pairing Confirm (0x03) len 16
        Confim value: 2653ee02c3791ed050fbc5444d4e549d
> HCI Event: Number of Completed Packets (0x13) plen 5    #179 [hci1] 13.326947
        Num handles: 1
        Handle: 2415 Address: DF:A9:FF:F6:B1:1A (OUI DF-A9-FF)
        Count: 1
        #178: len 21 (1 Kb/s)
        Latency: 157 msec (86-172 msec ~157 msec)
> ACL Data RX: Handle 2415 flags 0x02 dlen 21             #180 [hci1] 13.327292
      SMP: Pairing Random (0x04) len 16
        Random value: 1c40962614af341a0000000000000000
< HCI Command: Host Number of Com.. (0x03|0x0035) plen 5  #181 [hci1] 13.329823
        Num handles: 1
        Handle: 2415 Address: DF:A9:FF:F6:B1:1A (OUI DF-A9-FF)
        Count: 1
< ACL Data TX: Handle 2415 flags 0x00 dlen 21             #182 [hci1] 13.329956
      SMP: Pairing Random (0x04) len 16
        Random value: 25a9493fd3ce4faf02be7293595bb7c6
> HCI Event: Number of Completed Packets (0x13) plen 5    #183 [hci1] 13.501769
        Num handles: 1
        Handle: 2415 Address: DF:A9:FF:F6:B1:1A (OUI DF-A9-FF)
        Count: 1
        #182: len 21 (0 Kb/s)
        Latency: 171 msec (86-172 msec ~164 msec)
> ACL Data RX: Handle 2415 flags 0x02 dlen 21             #184 [hci1] 13.589620
      SMP: Pairing Confirm (0x03) len 16
        Confim value: e6c758adffdf0890ebaf25cbabfa8ae1
< HCI Command: Host Number of Com.. (0x03|0x0035) plen 5  #185 [hci1] 13.609232
        Num handles: 1
        Handle: 2415 Address: DF:A9:FF:F6:B1:1A (OUI DF-A9-FF)
        Count: 1
< ACL Data TX: Handle 2415 flags 0x00 dlen 21             #186 [hci1] 13.609301
      SMP: Pairing Confirm (0x03) len 16
        Confim value: b8bf4902bc86ab240ae389f300fb4f1d
> HCI Event: Number of Completed Packets (0x13) plen 5    #187 [hci1] 13.764426
        Num handles: 1
        Handle: 2415 Address: DF:A9:FF:F6:B1:1A (OUI DF-A9-FF)
        Count: 1
        #186: len 21 (1 Kb/s)
        Latency: 155 msec (86-172 msec ~159 msec)
> ACL Data RX: Handle 2415 flags 0x02 dlen 21             #188 [hci1] 13.764867
      SMP: Pairing Random (0x04) len 16
        Random value: c31d6c1d32dc6f1b0000000000000000
< HCI Command: Host Number of Com.. (0x03|0x0035) plen 5  #189 [hci1] 13.769826
        Num handles: 1
        Handle: 2415 Address: DF:A9:FF:F6:B1:1A (OUI DF-A9-FF)
        Count: 1
< ACL Data TX: Handle 2415 flags 0x00 dlen 21             #190 [hci1] 13.770020
      SMP: Pairing Random (0x04) len 16
        Random value: 58f6b41f855a6f6c3560debd84e2affc
> HCI Event: Number of Completed Packets (0x13) plen 5    #191 [hci1] 13.939259
        Num handles: 1
        Handle: 2415 Address: DF:A9:FF:F6:B1:1A (OUI DF-A9-FF)
        Count: 1
        #190: len 21 (0 Kb/s)
        Latency: 169 msec (86-172 msec ~164 msec)
> ACL Data RX: Handle 2415 flags 0x02 dlen 21             #192 [hci1] 14.027163
      SMP: Pairing Confirm (0x03) len 16
        Confim value: 7bea3dd48b4b43aa2465abb545363382
< HCI Command: Host Number of Com.. (0x03|0x0035) plen 5  #193 [hci1] 14.029600
        Num handles: 1
        Handle: 2415 Address: DF:A9:FF:F6:B1:1A (OUI DF-A9-FF)
        Count: 1
< ACL Data TX: Handle 2415 flags 0x00 dlen 21             #194 [hci1] 14.029714
      SMP: Pairing Confirm (0x03) len 16
        Confim value: f13fb33ecb5f4cc9578e9c9da6c27b61
> HCI Event: Number of Completed Packets (0x13) plen 5    #195 [hci1] 14.201955
        Num handles: 1
        Handle: 2415 Address: DF:A9:FF:F6:B1:1A (OUI DF-A9-FF)
        Count: 1
        #194: len 21 (0 Kb/s)
        Latency: 172 msec (86-172 msec ~168 msec)
> ACL Data RX: Handle 2415 flags 0x02 dlen 21             #196 [hci1] 14.202282
      SMP: Pairing Random (0x04) len 16
        Random value: c0bff51b36781bc40000000000000000
< HCI Command: Host Number of Com.. (0x03|0x0035) plen 5  #197 [hci1] 14.209140
        Num handles: 1
        Handle: 2415 Address: DF:A9:FF:F6:B1:1A (OUI DF-A9-FF)
        Count: 1
< ACL Data TX: Handle 2415 flags 0x00 dlen 21             #198 [hci1] 14.209148
      SMP: Pairing Random (0x04) len 16
        Random value: b67e7216d5bf664139eda2b542549666
> HCI Event: Number of Completed Packets (0x13) plen 5    #199 [hci1] 14.376810
        Num handles: 1
        Handle: 2415 Address: DF:A9:FF:F6:B1:1A (OUI DF-A9-FF)
        Count: 1
        #198: len 21 (1 Kb/s)
        Latency: 167 msec (86-172 msec ~168 msec)
> ACL Data RX: Handle 2415 flags 0x02 dlen 21             #200 [hci1] 14.464650
      SMP: Pairing Confirm (0x03) len 16
        Confim value: 57b7bdece8881216acf576b5f93bc40e
< HCI Command: Host Number of Com.. (0x03|0x0035) plen 5  #201 [hci1] 14.469166
        Num handles: 1
        Handle: 2415 Address: DF:A9:FF:F6:B1:1A (OUI DF-A9-FF)
        Count: 1
< ACL Data TX: Handle 2415 flags 0x00 dlen 21             #202 [hci1] 14.469254
      SMP: Pairing Confirm (0x03) len 16
        Confim value: da23ee767dc8b31eed834764299d00a1
> HCI Event: Number of Completed Packets (0x13) plen 5    #203 [hci1] 14.639514
        Num handles: 1
        Handle: 2415 Address: DF:A9:FF:F6:B1:1A (OUI DF-A9-FF)
        Count: 1
        #202: len 21 (0 Kb/s)
        Latency: 170 msec (86-172 msec ~169 msec)
> ACL Data RX: Handle 2415 flags 0x02 dlen 21             #204 [hci1] 14.639723
      SMP: Pairing Random (0x04) len 16
        Random value: d8bd65dc4a472c980000000000000000
< HCI Command: Host Number of Com.. (0x03|0x0035) plen 5  #205 [hci1] 14.649867
        Num handles: 1
        Handle: 2415 Address: DF:A9:FF:F6:B1:1A (OUI DF-A9-FF)
        Count: 1
< ACL Data TX: Handle 2415 flags 0x00 dlen 21             #206 [hci1] 14.650009
      SMP: Pairing Random (0x04) len 16
        Random value: ed17f76500c95219dd01e09d1e63f87b
> HCI Event: Number of Completed Packets (0x13) plen 5    #207 [hci1] 14.814256
        Num handles: 1
        Handle: 2415 Address: DF:A9:FF:F6:B1:1A (OUI DF-A9-FF)
        Count: 1
        #206: len 21 (1 Kb/s)
        Latency: 164 msec (86-172 msec ~166 msec)
> ACL Data RX: Handle 2415 flags 0x02 dlen 21             #208 [hci1] 14.902104
      SMP: Pairing Confirm (0x03) len 16
        Confim value: d1bf3cde844a606623afc87dbbfbe087
< HCI Command: Host Number of Com.. (0x03|0x0035) plen 5  #209 [hci1] 14.909260
        Num handles: 1
        Handle: 2415 Address: DF:A9:FF:F6:B1:1A (OUI DF-A9-FF)
        Count: 1
< ACL Data TX: Handle 2415 flags 0x00 dlen 21             #210 [hci1] 14.909357
      SMP: Pairing Confirm (0x03) len 16
        Confim value: e42dee5b589c467045f2e3f309d5d589
> HCI Event: Number of Completed Packets (0x13) plen 5    #211 [hci1] 15.076999
        Num handles: 1
        Handle: 2415 Address: DF:A9:FF:F6:B1:1A (OUI DF-A9-FF)
        Count: 1
        #210: len 21 (1 Kb/s)
        Latency: 167 msec (86-172 msec ~167 msec)
> ACL Data RX: Handle 2415 flags 0x02 dlen 21             #212 [hci1] 15.077255
      SMP: Pairing Random (0x04) len 16
        Random value: c4aeb2213b562df10000000000000000
< HCI Command: Host Number of Com.. (0x03|0x0035) plen 5  #213 [hci1] 15.089948
        Num handles: 1
        Handle: 2415 Address: DF:A9:FF:F6:B1:1A (OUI DF-A9-FF)
        Count: 1
< ACL Data TX: Handle 2415 flags 0x00 dlen 21             #214 [hci1] 15.090071
      SMP: Pairing Random (0x04) len 16
        Random value: 81d35d47e1f6006d79c974bd9d9e1ee3
> HCI Event: Number of Completed Packets (0x13) plen 5    #215 [hci1] 15.251740
        Num handles: 1
        Handle: 2415 Address: DF:A9:FF:F6:B1:1A (OUI DF-A9-FF)
        Count: 1
        #214: len 21 (1 Kb/s)
        Latency: 161 msec (86-172 msec ~164 msec)
> ACL Data RX: Handle 2415 flags 0x02 dlen 21             #216 [hci1] 15.339670
      SMP: Pairing Confirm (0x03) len 16
        Confim value: 4b743586ccd46effe0c42fbbcb6fbb97
< HCI Command: Host Number of Com.. (0x03|0x0035) plen 5  #217 [hci1] 15.349576
        Num handles: 1
        Handle: 2415 Address: DF:A9:FF:F6:B1:1A (OUI DF-A9-FF)
        Count: 1
< ACL Data TX: Handle 2415 flags 0x00 dlen 21             #218 [hci1] 15.349660
      SMP: Pairing Confirm (0x03) len 16
        Confim value: d8260ba357338768e7a04c118cc45db1
> HCI Event: Number of Completed Packets (0x13) plen 5    #219 [hci1] 15.514393
        Num handles: 1
        Handle: 2415 Address: DF:A9:FF:F6:B1:1A (OUI DF-A9-FF)
        Count: 1
        #218: len 21 (1 Kb/s)
        Latency: 164 msec (86-172 msec ~164 msec)
> ACL Data RX: Handle 2415 flags 0x02 dlen 21             #220 [hci1] 15.514800
      SMP: Pairing Random (0x04) len 16
        Random value: 39a2950db69c0d290000000000000000
< HCI Command: Host Number of Com.. (0x03|0x0035) plen 5  #221 [hci1] 15.529878
        Num handles: 1
        Handle: 2415 Address: DF:A9:FF:F6:B1:1A (OUI DF-A9-FF)
        Count: 1
< ACL Data TX: Handle 2415 flags 0x00 dlen 21             #222 [hci1] 15.530051
      SMP: Pairing Random (0x04) len 16
        Random value: e7f7e0c2476823e41736a7e381bafb7c
> HCI Event: Number of Completed Packets (0x13) plen 5    #223 [hci1] 15.689162
        Num handles: 1
        Handle: 2415 Address: DF:A9:FF:F6:B1:1A (OUI DF-A9-FF)
        Count: 1
        #222: len 21 (1 Kb/s)
        Latency: 159 msec (86-172 msec ~161 msec)
> ACL Data RX: Handle 2415 flags 0x02 dlen 21             #224 [hci1] 15.777035
      SMP: Pairing Confirm (0x03) len 16
        Confim value: 63d46fb0d114f960c5d174be2b6f35b6
< HCI Command: Host Number of Com.. (0x03|0x0035) plen 5  #225 [hci1] 15.789548
        Num handles: 1
        Handle: 2415 Address: DF:A9:FF:F6:B1:1A (OUI DF-A9-FF)
        Count: 1
< ACL Data TX: Handle 2415 flags 0x00 dlen 21             #226 [hci1] 15.789694
      SMP: Pairing Confirm (0x03) len 16
        Confim value: 2dda0b29d74c91a79cf9c2612f80f4d4
> HCI Event: Number of Completed Packets (0x13) plen 5    #227 [hci1] 15.951867
        Num handles: 1
        Handle: 2415 Address: DF:A9:FF:F6:B1:1A (OUI DF-A9-FF)
        Count: 1
        #226: len 21 (1 Kb/s)
        Latency: 162 msec (86-172 msec ~162 msec)
> ACL Data RX: Handle 2415 flags 0x02 dlen 21             #228 [hci1] 15.952280
      SMP: Pairing Random (0x04) len 16
        Random value: 1381725e2aa7a6050000000000000000
