Bluetooth monitor ver 5.72
= Note: Linux version 6.14.0-36-generic (x86_64)                       0.715946
= Note: Bluetooth subsystem version 2.22                               0.715948
= New Index: 00:00:00:00:00:00 (Primary,UART,hci1)              [hci1] 0.715949
= New Index: 48:5F:99:8E:E0:64 (Primary,USB,hci0)               [hci0] 0.715949
= Open Index: 00:00:00:00:00:00                                 [hci1] 0.829742
= Index Info: 00:00:00:00:00:00 (Nordic Semiconductor ASA)      [hci1] 0.829756
@ USER Open: main (privileged) version 2.22            {0x0001} [hci1] 0.829764
< HCI Command: Reset (0x03|0x0003) plen 0                    #1 [hci1] 0.830997
> HCI Event: Command Complete (0x0e) plen 4                  #2 [hci1] 0.831488
      Reset (0x03|0x0003) ncmd 1
        Status: Success (0x00)
< HCI Command: Read Local Supported... (0x04|0x0003) plen 0  #3 [hci1] 0.849457
> HCI Event: Command Complete (0x0e) plen 12                 #4 [hci1] 0.850004
      Read Local Supported Features (0x04|0x0003) ncmd 1
        Status: Success (0x00)
        Features: 0x00 0x00 0x00 0x00 0x60 0x00 0x00 0x00
          BR/EDR Not Supported
          LE Supported (Controller)
< HCI Command: Read Local Version In.. (0x04|0x0001) plen 0  #5 [hci1] 0.869165
> HCI Event: Command Complete (0x0e) plen 12                 #6 [hci1] 0.869766
      Read Local Version Information (0x04|0x0001) ncmd 1
        Status: Success (0x00)
        HCI version: Reserved (0x0f) - Revision 12393 (0x3069)
        LMP version: Reserved (0x0f) - Subversion 12393 (0x3069)
        Manufacturer: Nordic Semiconductor ASA (89)
< HCI Command: Read Local Supported... (0x04|0x0002) plen 0  #7 [hci1] 0.889107
> HCI Event: Command Complete (0x0e) plen 68                 #8 [hci1] 0.890152
      Read Local Supported Commands (0x04|0x0002) ncmd 1
        Status: Success (0x00)
        Commands: 119 entries
          Disconnect (Octet 0 - Bit 5)
          Read Remote Version Information (Octet 2 - Bit 7)
          Set Event Mask (Octet 5 - Bit 6)
          Reset (Octet 5 - Bit 7)
          Read Connection Accept Timeout (Octet 7 - Bit 2)
          Write Connection Accept Timeout (Octet 7 - Bit 3)
          Read Transmit Power Level (Octet 10 - Bit 2)
          Set Controller To Host Flow Control (Octet 10 - Bit 5)
          Host Buffer Size (Octet 10 - Bit 6)
          Host Number of Completed Packets (Octet 10 - Bit 7)
          Read Local Version Information (Octet 14 - Bit 3)
          Read Local Supported Features (Octet 14 - Bit 5)
          Read BD ADDR (Octet 15 - Bit 1)
          Read RSSI (Octet 15 - Bit 5)
          Set Event Mask Page 2 (Octet 22 - Bit 2)
          LE Set Event Mask (Octet 25 - Bit 0)
          LE Read Buffer Size (Octet 25 - Bit 1)
          LE Read Local Supported Features (Octet 25 - Bit 2)
          LE Set Random Address (Octet 25 - Bit 4)
          LE Set Advertising Parameters (Octet 25 - Bit 5)
          LE Read Advertising Channel TX Power (Octet 25 - Bit 6)
          LE Set Advertising Data (Octet 25 - Bit 7)
          LE Set Scan Response Data (Octet 26 - Bit 0)
          LE Set Advertise Enable (Octet 26 - Bit 1)
          LE Set Scan Parameters (Octet 26 - Bit 2)
          LE Set Scan Enable (Octet 26 - Bit 3)
          LE Create Connection (Octet 26 - Bit 4)
          LE Create Connection Cancel (Octet 26 - Bit 5)
          LE Read Accept List Size (Octet 26 - Bit 6)
          LE Clear Accept List (Octet 26 - Bit 7)
          LE Add Device To Accept List (Octet 27 - Bit 0)
          LE Remove Device From Accept List (Octet 27 - Bit 1)
          LE Connection Update (Octet 27 - Bit 2)
          LE Set Host Channel Classification (Octet 27 - Bit 3)
          LE Read Channel Map (Octet 27 - Bit 4)
          LE Read Remote Used Features (Octet 27 - Bit 5)
          LE Encrypt (Octet 27 - Bit 6)
          LE Rand (Octet 27 - Bit 7)
          LE Start Encryption (Octet 28 - Bit 0)
          LE Long Term Key Request Reply (Octet 28 - Bit 1)
          LE Long Term Key Request Neg Reply (Octet 28 - Bit 2)
          LE Read Supported States (Octet 28 - Bit 3)
          LE Receiver Test (Octet 28 - Bit 4)
          LE Transmitter Test (Octet 28 - Bit 5)
          LE Test End (Octet 28 - Bit 6)
          Read Authenticated Payload Timeout (Octet 32 - Bit 4)
          Write Authenticated Payload Timeout (Octet 32 - Bit 5)
          LE Set Data Length (Octet 33 - Bit 6)
          LE Read Suggested Default Data Length (Octet 33 - Bit 7)
          LE Write Suggested Default Data Length (Octet 34 - Bit 0)
          LE Add Device To Resolving List (Octet 34 - Bit 3)
          LE Remove Device From Resolving List (Octet 34 - Bit 4)
          LE Clear Resolving List (Octet 34 - Bit 5)
          LE Read Resolving List Size (Octet 34 - Bit 6)
          LE Set Address Resolution Enable (Octet 35 - Bit 1)
          LE Set Resolvable Private Address Timeout (Octet 35 - Bit 2)
          LE Read Maximum Data Length (Octet 35 - Bit 3)
          LE Read PHY (Octet 35 - Bit 4)
          LE Set Default PHY (Octet 35 - Bit 5)
          LE Set PHY (Octet 35 - Bit 6)
          LE Enhanced Receiver Test (Octet 35 - Bit 7)
          LE Enhanced Transmitter Test (Octet 36 - Bit 0)
          LE Set Advertising Set Random Address (Octet 36 - Bit 1)
          LE Set Extended Advertising Parameters (Octet 36 - Bit 2)
          LE Set Extended Advertising Data (Octet 36 - Bit 3)
          LE Set Extended Scan Response Data (Octet 36 - Bit 4)
          LE Set Extended Advertising Enable (Octet 36 - Bit 5)
          LE Read Maximum Advertising Data Length (Octet 36 - Bit 6)
          LE Read Number of Supported Advertising Sets (Octet 36 - Bit 7)
          LE Remove Advertising Set (Octet 37 - Bit 0)
          LE Clear Advertising Sets (Octet 37 - Bit 1)
          LE Set Periodic Advertising Parameters (Octet 37 - Bit 2)
          LE Set Periodic Advertising Data (Octet 37 - Bit 3)
          LE Set Periodic Advertising Enable (Octet 37 - Bit 4)
          LE Set Extended Scan Parameters (Octet 37 - Bit 5)
          LE Set Extended Scan Enable (Octet 37 - Bit 6)
          LE Extended Create Connection (Octet 37 - Bit 7)
          LE Periodic Advertising Create Sync (Octet 38 - Bit 0)
          LE Periodic Advertising Create Sync Cancel (Octet 38 - Bit 1)
          LE Periodic Advertising Terminate Sync (Octet 38 - Bit 2)
          LE Add Device To Periodic Advertiser List (Octet 38 - Bit 3)
          LE Remove Device From Periodic Advertiser List (Octet 38 - Bit 4)
          LE Clear Periodic Advertiser List (Octet 38 - Bit 5)
          LE Read Periodic Advertiser List Size (Octet 38 - Bit 6)
          LE Read Transmit Power (Octet 38 - Bit 7)
          LE Read RF Path Compensation (Octet 39 - Bit 0)
          LE Write RF Path Compensation (Octet 39 - Bit 1)
          LE Set Privacy Mode (Octet 39 - Bit 2)
          LE Periodic Advertising Receive Enable (Octet 40 - Bit 5)
          LE Periodic Advertising Sync Transfer (Octet 40 - Bit 6)
          LE Periodic Advertising Set Info Transfer (Octet 40 - Bit 7)
          LE Periodic Advertising Sync Transfer Parameters (Octet 41 - Bit 0)
          LE Set Default Periodic Advertisng Sync Transfer Parameters (Octet 41 - Bit 1)
          LE Read Buffer v2 (Octet 41 - Bit 5)
          LE Read ISO TX Sync (Octet 41 - Bit 6)
          LE Set Connected Isochronous Group Parameters (Octet 41 - Bit 7)
          LE Set Connected Isochronous Group Parameters Test (Octet 42 - Bit 0)
          LE Create Connected Isochronous Stream (Octet 42 - Bit 1)
          LE Remove Connected Isochronous Group (Octet 42 - Bit 2)
          LE Accept Connected Isochronous Stream Request (Octet 42 - Bit 3)
          LE Reject Connected Isochronous Stream Request (Octet 42 - Bit 4)
          LE Create Broadcast Isochronous Group (Octet 42 - Bit 5)
          LE Create Broadcast Isochronous Group Test (Octet 42 - Bit 6)
          LE Terminate Broadcast Isochronous Group (Octet 42 - Bit 7)
          LE Broadcast Isochronous Group Create Sync (Octet 43 - Bit 0)
          LE Broadcast Isochronous Group Terminate Sync (Octet 43 - Bit 1)
          LE Request Peer SCA (Octet 43 - Bit 2)
          LE Setup Isochronous Data Path (Octet 43 - Bit 3)
          LE Remove Isochronous Data Path (Octet 43 - Bit 4)
          LE Isochronous Transmit Test (Octet 43 - Bit 5)
          LE Isochronous Receive Test (Octet 43 - Bit 6)
          LE Isochronous Read Test Counters (Octet 43 - Bit 7)
          LE Isochronous Read Test Counters (Octet 44 - Bit 0)
          LE Set Host Feature (Octet 44 - Bit 1)
          Octet 44 - Bit 2 
          Octet 45 - Bit 6 
          Octet 46 - Bit 0 
          Octet 46 - Bit 1 
          Octet 46 - Bit 2 
< HCI Command: Host Buffer Size (0x03|0x0033) plen 7         #9 [hci1] 0.909074
        ACL MTU: 255  ACL max packet: 16
        SCO MTU: 0    SCO max packet: 0
> HCI Event: Command Complete (0x0e) plen 4                 #10 [hci1] 0.909613
      Host Buffer Size (0x03|0x0033) ncmd 1
        Status: Success (0x00)
< HCI Command: Set Controller To Ho.. (0x03|0x0031) plen 1  #11 [hci1] 0.929099
        Flow control: ACL Data Packets (0x01)
> HCI Event: Command Complete (0x0e) plen 4                 #12 [hci1] 0.929526
      Set Controller To Host Flow Control (0x03|0x0031) ncmd 1
        Status: Success (0x00)
< HCI Command: LE Read Local Suppor.. (0x08|0x0003) plen 0  #13 [hci1] 0.949109
> HCI Event: Command Complete (0x0e) plen 12                #14 [hci1] 0.949608
      LE Read Local Supported Features (0x08|0x0003) ncmd 1
        Status: Success (0x00)
        Features: 0xfd 0x79 0x00 0xf7 0x30 0x01 0x00 0x00
          LE Encryption
          Extended Reject Indication
          Peripheral-initiated Features Exchange
          LE Ping
          LE Data Packet Length Extension
          LL Privacy
          Extended Scanner Filter Policies
          LE 2M PHY
          LE Coded PHY
          LE Extended Advertising
          LE Periodic Advertising
          Channel Selection Algorithm #2
          Periodic Advertising Sync Transfer - Sender
          Periodic Advertising Sync Transfer - Recipient
          Sleep Clock Accuracy Updates
          Connected Isochronous Stream - Central
          Connected Isochronous Stream - Peripheral
          Isochronous Broadcaster
          Synchronized Receiver
          Periodic Advertising ADI support
          Connection Subrating
          Unknown features (0x0000010000000000)
< HCI Command: LE Set Host Feature (0x08|0x0074) plen 2     #15 [hci1] 0.969083
        Bit Number: 32
          Connected Isochronous Stream (Host Support)
        Bit Value: 1
> HCI Event: Command Complete (0x0e) plen 4                 #16 [hci1] 0.969508
      LE Set Host Feature (0x08|0x0074) ncmd 1
        Status: Success (0x00)
< HCI Command: LE Read Buffer v2 (0x08|0x0060) plen 0       #17 [hci1] 0.989095
> HCI Event: Command Complete (0x0e) plen 10                #18 [hci1] 0.989619
      LE Read Buffer v2 (0x08|0x0060) ncmd 1
        Status: Success (0x00)
        ACL MTU: 27
        ACL max packet: 3
        ISO MTU: 318
        ISO max packet: 3
< HCI Command: LE Read Maximum Adve.. (0x08|0x003a) plen 0  #19 [hci1] 1.009134
> HCI Event: Command Complete (0x0e) plen 6                 #20 [hci1] 1.009515
      LE Read Maximum Advertising Data Length (0x08|0x003a) ncmd 1
        Status: Success (0x00)
        Max length: 1650
< HCI Command: LE Read Supported St.. (0x08|0x001c) plen 0  #21 [hci1] 1.029106
> HCI Event: Command Complete (0x0e) plen 12                #22 [hci1] 1.029595
      LE Read Supported States (0x08|0x001c) ncmd 1
        Status: Success (0x00)
        States: 0x000003ff3e0306ff
          Non-connectable Advertising State
          Scannable Advertising State
          Connectable Advertising State
          High Duty Cycle Directed Advertising State
          Passive Scanning State
          Active Scanning State
          Initiating State
            and Connection State (Central Role)
          Connection State (Peripheral Role)
          Scannable Advertising State
            and Passive Scanning State
          Connectable Advertising State
            and Passive Scanning State
          Non-connectable Advertising State
            and Initiating State
          Scannable Advertising State
            and Initiating State
          Active Scanning State
            and Connection State (Central Role)
          Passive Scanning State
            and Connection State (Peripheral Role)
          Active Scanning State
            and Connection State (Peripheral Role)
          Initiating State
            and Connection State (Central Role)
            and Central Role & Central Role
          Low Duty Cycle Directed Advertising State
          Connectable Advertising State
            and Initiating State
            and Central Role & Peripheral Role
          High Duty Cycle Directed Advertising State
            and Initiating State
            and Central Role & Peripheral Role
          Low Duty Cycle Directed Advertising State
            and Initiating State
            and Central Role & Peripheral Role
          Connectable Advertising State
            and Connection State (Central Role)
            and Central Role & Peripheral Role
          High Duty Cycle Directed Advertising State
            and Connection State (Central Role)
            and Central Role & Peripheral Role
          Low Duty Cycle Directed Advertising State
            and Connection State (Central Role)
            and Central Role & Peripheral Role
          Connectable Advertising State
            and Connection State (Peripheral Role)
            and Central Role & Peripheral Role
          High Duty Cycle Directed Advertising State
            and Connection State (Peripheral Role)
            and Peripheral Role & Peripheral Role
          Low Duty Cycle Directed Advertising State
            and Connection State (Peripheral Role)
            and Peripheral Role & Peripheral Role
          Initiating State
            and Connection State (Peripheral Role)
            and Central Role & Peripheral Role
< HCI Command: LE Read Maximum Data.. (0x08|0x002f) plen 0  #23 [hci1] 1.049101
> HCI Event: Command Complete (0x0e) plen 12                #24 [hci1] 1.049611
      LE Read Maximum Data Length (0x08|0x002f) ncmd 1
        Status: Success (0x00)
        Max TX octets: 251
        Max TX time: 2704
        Max RX octets: 251
        Max RX time: 2704
< HCI Command: LE Write Suggested D.. (0x08|0x0024) plen 4  #25 [hci1] 1.069082
        TX octets: 251
        TX time: 2704
> HCI Event: Command Complete (0x0e) plen 4                 #26 [hci1] 1.069589
      LE Write Suggested Default Data Length (0x08|0x0024) ncmd 1
        Status: Success (0x00)
< HCI Command: LE Read Resolving Li.. (0x08|0x002a) plen 0  #27 [hci1] 1.089107
> HCI Event: Command Complete (0x0e) plen 5                 #28 [hci1] 1.089514
      LE Read Resolving List Size (0x08|0x002a) ncmd 1
        Status: Success (0x00)
        Size: 8
< HCI Command: LE Set Event Mask (0x08|0x0001) plen 8       #29 [hci1] 1.109089
        Mask: 0x000002023f87fa5e
          LE Advertising Report
          LE Connection Update Complete
          LE Read Remote Used Features Complete
          LE Long Term Key Request
          LE Data Length Change
          LE Enhanced Connection Complete
          LE PHY Update Complete
          LE Extended Advertising Report
          LE Periodic Advertising Sync Established
          LE Periodic Advertising Report
          LE Periodic Advertising Sync Lost
          LE Extended Scan Timeout
          LE Extended Advertising Set Terminated
          LE Scan Request Received
          LE Periodic Advertising Sync Transfer Rvc
          LE CIS Established
          LE CIS Request
          LE Create BIG Complete
          LE Terminate BIG Complete
          LE BIG Sync Estabilished Complete
          LE BIG Sync Lost
          LE BIG Info Advertising Report
          Unknown mask (0x0000020000000000)
> HCI Event: Command Complete (0x0e) plen 4                 #30 [hci1] 1.109584
      LE Set Event Mask (0x08|0x0001) ncmd 1
        Status: Success (0x00)
< HCI Command: Set Event Mask (0x03|0x0001) plen 8          #31 [hci1] 1.129104
        Mask: 0x2000800002008890
          Disconnection Complete
          Encryption Change
          Read Remote Version Information Complete
          Hardware Error
          Data Buffer Overflow
          Encryption Key Refresh Complete
          LE Meta
> HCI Event: Command Complete (0x0e) plen 4                 #32 [hci1] 1.129655
      Set Event Mask (0x03|0x0001) ncmd 1
        Status: Success (0x00)
< HCI Command: Read BD ADDR (0x04|0x0009) plen 0            #33 [hci1] 1.149105
> HCI Event: Command Complete (0x0e) plen 10                #34 [hci1] 1.149523
      Read BD ADDR (0x04|0x0009) ncmd 1
        Status: Success (0x00)
        Address: 00:00:00:00:00:00 (OUI 00-00-00)
< HCI Command: LE Set Random Address (0x08|0x0005) plen 6   #35 [hci1] 1.169106
        Address: D5:B6:CC:31:DB:3B (Static)
> HCI Event: Command Complete (0x0e) plen 4                 #36 [hci1] 1.169578
      LE Set Random Address (0x08|0x0005) ncmd 1
        Status: Success (0x00)
< HCI Command: LE Set Extended Adv.. (0x08|0x0036) plen 25  #37 [hci1] 3.749121
        Handle: 0x00
        Properties: 0x0013
          Connectable
          Scannable
          Use legacy advertising PDUs: ADV_IND
        Min advertising interval: 100.000 msec (0x00a0)
        Max advertising interval: 150.000 msec (0x00f0)
        Channel map: 37, 38, 39 (0x07)
        Own address type: Random (0x01)
        Peer address type: Public (0x00)
        Peer address: 00:00:00:00:00:00 (OUI 00-00-00)
        Filter policy: Allow Scan Request from Any, Allow Connect Request from Any (0x00)
        TX power: Host has no preference (0x7f)
        Primary PHY: LE 1M (0x01)
        Secondary max skip: 0x00
        Secondary PHY: LE 1M (0x01)
        SID: 0x00
        Scan request notifications: Disabled (0x00)
> HCI Event: Command Complete (0x0e) plen 5                 #38 [hci1] 3.749919
      LE Set Extended Advertising Parameters (0x08|0x0036) ncmd 1
        Status: Success (0x00)
        TX power (selected): 0 dbm (0x00)
< HCI Command: LE Set Advertising S.. (0x08|0x0035) plen 7  #39 [hci1] 3.769108
        Advertising handle: 0x00
        Advertising random address: D5:B6:CC:31:DB:3B (Static)
> HCI Event: Command Complete (0x0e) plen 4                 #40 [hci1] 3.769602
      LE Set Advertising Set Random Address (0x08|0x0035) ncmd 1
        Status: Success (0x00)
< HCI Command: LE Set Extended Adv.. (0x08|0x0037) plen 22  #41 [hci1] 3.789122
        Handle: 0x00
        Operation: Complete extended advertising data (0x03)
        Fragment preference: Minimize fragmentation (0x01)
        Data length: 0x12
        Flags: 0x06
          LE General Discoverable Mode
          BR/EDR Not Supported
        Name (complete): Tester_F6B11A
> HCI Event: Command Complete (0x0e) plen 4                 #42 [hci1] 3.789882
      LE Set Extended Advertising Data (0x08|0x0037) ncmd 1
        Status: Success (0x00)
< HCI Command: LE Set Extended Scan.. (0x08|0x0038) plen 4  #43 [hci1] 3.809095
        Handle: 0x00
        Operation: Complete scan response data (0x03)
        Fragment preference: Minimize fragmentation (0x01)
        Data length: 0x00
> HCI Event: Command Complete (0x0e) plen 4                 #44 [hci1] 3.809605
      LE Set Extended Scan Response Data (0x08|0x0038) ncmd 1
        Status: Success (0x00)
< HCI Command: LE Set Extended Adve.. (0x08|0x0039) plen 6  #45 [hci1] 3.829111
        Extended advertising: Enabled (0x01)
        Number of sets: 1 (0x01)
        Entry 0
          Handle: 0x00
          Duration: 0 ms (0x00)
          Max ext adv events: 0
> HCI Event: Command Complete (0x0e) plen 4                 #46 [hci1] 3.829816
      LE Set Extended Advertising Enable (0x08|0x0039) ncmd 1
        Status: Success (0x00)
> HCI Event: LE Meta Event (0x3e) plen 31                   #47 [hci1] 3.945559
      LE Enhanced Connection Complete (0x0a)
        Status: Success (0x00)
        Handle: 1299
        Role: Peripheral (0x01)
        Peer address type: Public (0x00)
        Peer address: DF:A9:FF:F6:B1:1A (OUI DF-A9-FF)
        Local resolvable private address: 00:00:00:00:00:00 (Non-Resolvable)
        Peer resolvable private address: 00:00:00:00:00:00 (Non-Resolvable)
        Connection interval: 87.50 msec (0x0046)
        Connection latency: 0 (0x0000)
        Supervision timeout: 25120 msec (0x09d0)
        Central clock accuracy: 0x01
> HCI Event: LE Meta Event (0x3e) plen 6                    #48 [hci1] 3.945753
      LE Advertising Set Terminated (0x12)
        Status: Success (0x00)
        Handle: 0
        Connection handle: 1299
        Number of completed extended advertising events: 0
< HCI Command: LE Read Remote Used... (0x08|0x0016) plen 2  #49 [hci1] 3.950196
        Handle: 1299 Address: DF:A9:FF:F6:B1:1A (OUI DF-A9-FF)
< ACL Data TX: Handle 1299 flags 0x00 dlen 7                #50 [hci1] 3.950266
      ATT: Exchange MTU Request (0x02) len 2
        Client RX MTU: 251
> HCI Event: Command Status (0x0f) plen 4                   #51 [hci1] 3.950832
      LE Read Remote Used Features (0x08|0x0016) ncmd 1
        Status: Success (0x00)
> HCI Event: Number of Completed Packets (0x13) plen 5      #52 [hci1] 4.121616
        Num handles: 1
        Handle: 1299 Address: DF:A9:FF:F6:B1:1A (OUI DF-A9-FF)
        Count: 1
        #50: len 7 (0 Kb/s)
        Latency: 171 msec (171-171 msec ~171 msec)
> HCI Event: LE Meta Event (0x3e) plen 12                   #53 [hci1] 4.209502
      LE Read Remote Used Features (0x04)
        Status: Success (0x00)
        Handle: 1299 Address: DF:A9:FF:F6:B1:1A (OUI DF-A9-FF)
        Features: 0x2d 0x49 0x00 0xf7 0x67 0xd9 0x00 0x80
          LE Encryption
          Extended Reject Indication
          Peripheral-initiated Features Exchange
          LE Data Packet Length Extension
          LE 2M PHY
          LE Coded PHY
          Channel Selection Algorithm #2
          Periodic Advertising Sync Transfer - Sender
          Periodic Advertising Sync Transfer - Recipient
          Sleep Clock Accuracy Updates
          Connected Isochronous Stream - Central
          Connected Isochronous Stream - Peripheral
          Isochronous Broadcaster
          Synchronized Receiver
          Connected Isochronous Stream (Host Support)
          LE Power Control Request
          LE Power Control Request
          Connection Subrating
          Connection Subrating (Host Support)
          Unknown features (0x8000d90000000000)
> ACL Data RX: Handle 1299 flags 0x02 dlen 11               #54 [hci1] 6.659185
      SMP: Pairing Request (0x01) len 6
        IO capability: KeyboardDisplay (0x04)
        OOB data: Authentication data not present (0x00)
        Authentication requirement: Bonding, MITM, SC, No Keypresses (0x0d)
        Max encryption key size: 16
        Initiator key distribution: EncKey IdKey (0x03)
        Responder key distribution: EncKey IdKey Sign (0x07)
> ACL Data RX: Handle 1299 flags 0x02 dlen 7                #55 [hci1] 6.659674
      ATT: Exchange MTU Response (0x03) len 2
        Server RX MTU: 23
< HCI Command: Host Number of Compl.. (0x03|0x0035) plen 5  #56 [hci1] 6.669200
        Num handles: 1
        Handle: 1299 Address: DF:A9:FF:F6:B1:1A (OUI DF-A9-FF)
        Count: 1
< ACL Data TX: Handle 1299 flags 0x00 dlen 11               #57 [hci1] 6.669225
      SMP: Pairing Response (0x02) len 6
        IO capability: DisplayOnly (0x00)
        OOB data: Authentication data not present (0x00)
        Authentication requirement: Bonding, No MITM, SC, No Keypresses (0x09)
        Max encryption key size: 16
        Initiator key distribution: IdKey (0x02)
        Responder key distribution: <none> (0x00)
< HCI Command: Host Number of Compl.. (0x03|0x0035) plen 5  #58 [hci1] 6.669442
        Num handles: 1
        Handle: 1299 Address: DF:A9:FF:F6:B1:1A (OUI DF-A9-FF)
        Count: 1
> HCI Event: Number of Completed Packets (0x13) plen 5      #59 [hci1] 6.834260
        Num handles: 1
        Handle: 1299 Address: DF:A9:FF:F6:B1:1A (OUI DF-A9-FF)
        Count: 1
        #57: len 11 (0 Kb/s)
        Latency: 165 msec (165-171 msec ~168 msec)
> ACL Data RX: Handle 1299 flags 0x02 dlen 27               #60 [hci1] 6.834604
> ACL Data RX: Handle 1299 flags 0x01 dlen 27               #61 [hci1] 6.835134
> ACL Data RX: Handle 1299 flags 0x01 dlen 15               #62 [hci1] 6.835610
      SMP: Pairing Public Key (0x0c) len 64
        X: fa54987d4dcd9e7bfc96abe4e9bced6987a550ebfc1795cfdf3f042d0851e1c9
        Y: 6e2fcf911830ddbbba8eb8571a280c386620c68028f75b068b1185a369502010
< HCI Command: Host Number of Compl.. (0x03|0x0035) plen 5  #63 [hci1] 6.849446
        Num handles: 1
        Handle: 1299 Address: DF:A9:FF:F6:B1:1A (OUI DF-A9-FF)
        Count: 1
< HCI Command: Host Number of Compl.. (0x03|0x0035) plen 5  #64 [hci1] 6.849524
        Num handles: 1
        Handle: 1299 Address: DF:A9:FF:F6:B1:1A (OUI DF-A9-FF)
        Count: 1
< HCI Command: Host Number of Compl.. (0x03|0x0035) plen 5  #65 [hci1] 6.849653
        Num handles: 1
        Handle: 1299 Address: DF:A9:FF:F6:B1:1A (OUI DF-A9-FF)
        Count: 1
< ACL Data TX: Handle 1299 flags 0x00 dlen 27               #66 [hci1] 6.849774
< ACL Data TX: Handle 1299 flags 0x01 dlen 27               #67 [hci1] 6.849779
< ACL Data TX: Handle 1299 flags 0x01 dlen 15               #68 [hci1] 6.849779
      SMP: Pairing Public Key (0x0c) len 64
        X: 98308440221e2d910f0e54b71e7ec652857aa9b5a0dc65028824cc19db1226e9
        Y: 67a4816bcb62efb21701e31fdb27561a6217575fb007a8bbdabe7e28b6f68482
> HCI Event: Number of Completed Packets (0x13) plen 5      #69 [hci1] 6.922297
        Num handles: 1
        Handle: 1299 Address: DF:A9:FF:F6:B1:1A (OUI DF-A9-FF)
        Count: 1
        #66: len 27 (3 Kb/s)
        Latency: 72 msec (72-171 msec ~120 msec)
> HCI Event: Number of Completed Packets (0x13) plen 5      #70 [hci1] 6.922843
        Num handles: 1
        Handle: 1299 Address: DF:A9:FF:F6:B1:1A (OUI DF-A9-FF)
        Count: 1
        #67: len 27 (2 Kb/s)
        Latency: 73 msec (72-171 msec ~96 msec)
> HCI Event: Number of Completed Packets (0x13) plen 5      #71 [hci1] 7.009010
        Num handles: 1
        Handle: 1299 Address: DF:A9:FF:F6:B1:1A (OUI DF-A9-FF)
        Count: 1
        #68: len 15 (0 Kb/s)
        Latency: 159 msec (72-171 msec ~127 msec)
> ACL Data RX: Handle 1299 flags 0x02 dlen 21               #72 [hci1] 7.971870
      SMP: Pairing Confirm (0x03) len 16
        Confim value: bdd25896f53009988411c8fed557f9f2
< HCI Command: Host Number of Compl.. (0x03|0x0035) plen 5  #73 [hci1] 7.989664
        Num handles: 1
        Handle: 1299 Address: DF:A9:FF:F6:B1:1A (OUI DF-A9-FF)
        Count: 1
< ACL Data TX: Handle 1299 flags 0x00 dlen 21               #74 [hci1] 7.989744
      SMP: Pairing Confirm (0x03) len 16
        Confim value: 463de18cbee57ee5689e53e5f28c45eb
> HCI Event: Number of Completed Packets (0x13) plen 5      #75 [hci1] 8.146734
        Num handles: 1
        Handle: 1299 Address: DF:A9:FF:F6:B1:1A (OUI DF-A9-FF)
        Count: 1
        #74: len 21 (1 Kb/s)
        Latency: 156 msec (72-171 msec ~142 msec)
> ACL Data RX: Handle 1299 flags 0x02 dlen 21               #76 [hci1] 8.147109
      SMP: Pairing Random (0x04) len 16
        Random value: 2ec86a580be04dab0000000000000000
< HCI Command: Host Number of Compl.. (0x03|0x0035) plen 5  #77 [hci1] 8.150019
        Num handles: 1
        Handle: 1299 Address: DF:A9:FF:F6:B1:1A (OUI DF-A9-FF)
        Count: 1
< ACL Data TX: Handle 1299 flags 0x00 dlen 21               #78 [hci1] 8.150135
      SMP: Pairing Random (0x04) len 16
        Random value: 8e6108f966a694cbe26df70bb96773e6
> HCI Event: Number of Completed Packets (0x13) plen 5      #79 [hci1] 8.321511
        Num handles: 1
        Handle: 1299 Address: DF:A9:FF:F6:B1:1A (OUI DF-A9-FF)
        Count: 1
        #78: len 21 (0 Kb/s)
        Latency: 171 msec (72-171 msec ~156 msec)
> ACL Data RX: Handle 1299 flags 0x02 dlen 21               #80 [hci1] 8.409354
      SMP: Pairing Confirm (0x03) len 16
        Confim value: f7e51739bb298f3e00774ce01dcd4495
< HCI Command: Host Number of Compl.. (0x03|0x0035) plen 5  #81 [hci1] 8.429504
        Num handles: 1
        Handle: 1299 Address: DF:A9:FF:F6:B1:1A (OUI DF-A9-FF)
        Count: 1
< ACL Data TX: Handle 1299 flags 0x00 dlen 21               #82 [hci1] 8.429630
      SMP: Pairing Confirm (0x03) len 16
        Confim value: ba3c240bdaa02097bdf2963b28cfd966
> HCI Event: Number of Completed Packets (0x13) plen 5      #83 [hci1] 8.584316
        Num handles: 1
        Handle: 1299 Address: DF:A9:FF:F6:B1:1A (OUI DF-A9-FF)
        Count: 1
        #82: len 21 (1 Kb/s)
        Latency: 154 msec (72-171 msec ~155 msec)
> ACL Data RX: Handle 1299 flags 0x02 dlen 21               #84 [hci1] 8.584574
      SMP: Pairing Random (0x04) len 16
        Random value: c615475ae908260a0000000000000000
< HCI Command: Host Number of Compl.. (0x03|0x0035) plen 5  #85 [hci1] 8.590010
        Num handles: 1
        Handle: 1299 Address: DF:A9:FF:F6:B1:1A (OUI DF-A9-FF)
        Count: 1
< ACL Data TX: Handle 1299 flags 0x00 dlen 21               #86 [hci1] 8.590116
      SMP: Pairing Random (0x04) len 16
        Random value: 4d02679f89a05211af56d8b3da64d21e
> HCI Event: Number of Completed Packets (0x13) plen 5      #87 [hci1] 8.758998
        Num handles: 1
        Handle: 1299 Address: DF:A9:FF:F6:B1:1A (OUI DF-A9-FF)
        Count: 1
        #86: len 21 (1 Kb/s)
        Latency: 168 msec (72-171 msec ~162 msec)
> ACL Data RX: Handle 1299 flags 0x02 dlen 21               #88 [hci1] 8.846879
      SMP: Pairing Confirm (0x03) len 16
        Confim value: d8c79ef3c0ce9665768a88ad67e58ade
< HCI Command: Host Number of Compl.. (0x03|0x0035) plen 5  #89 [hci1] 8.849433
        Num handles: 1
        Handle: 1299 Address: DF:A9:FF:F6:B1:1A (OUI DF-A9-FF)
        Count: 1
< ACL Data TX: Handle 1299 flags 0x00 dlen 21               #90 [hci1] 8.849472
      SMP: Pairing Confirm (0x03) len 16
        Confim value: 8aabfa908e092a1f7f8ee1281086061b
> HCI Event: Number of Completed Packets (0x13) plen 5      #91 [hci1] 9.021694
        Num handles: 1
        Handle: 1299 Address: DF:A9:FF:F6:B1:1A (OUI DF-A9-FF)
        Count: 1
        #90: len 21 (0 Kb/s)
        Latency: 172 msec (72-172 msec ~167 msec)
> ACL Data RX: Handle 1299 flags 0x02 dlen 21               #92 [hci1] 9.022033
      SMP: Pairing Random (0x04) len 16
        Random value: 8bed25fb34becadf0000000000000000
< HCI Command: Host Number of Compl.. (0x03|0x0035) plen 5  #93 [hci1] 9.029545
        Num handles: 1
        Handle: 1299 Address: DF:A9:FF:F6:B1:1A (OUI DF-A9-FF)
        Count: 1
< ACL Data TX: Handle 1299 flags 0x00 dlen 21               #94 [hci1] 9.029573
      SMP: Pairing Random (0x04) len 16
        Random value: 5e8286bc235a02440d0c3424a2acf8fd
> HCI Event: Number of Completed Packets (0x13) plen 5      #95 [hci1] 9.196515
        Num handles: 1
        Handle: 1299 Address: DF:A9:FF:F6:B1:1A (OUI DF-A9-FF)
        Count: 1
        #94: len 21 (1 Kb/s)
        Latency: 166 msec (72-172 msec ~167 msec)
> ACL Data RX: Handle 1299 flags 0x02 dlen 21               #96 [hci1] 9.284386
      SMP: Pairing Confirm (0x03) len 16
        Confim value: c5928eff4c3b3f3b761c6395bc0b487a
< HCI Command: Host Number of Compl.. (0x03|0x0035) plen 5  #97 [hci1] 9.289442
        Num handles: 1
        Handle: 1299 Address: DF:A9:FF:F6:B1:1A (OUI DF-A9-FF)
        Count: 1
< ACL Data TX: Handle 1299 flags 0x00 dlen 21               #98 [hci1] 9.289538
      SMP: Pairing Confirm (0x03) len 16
        Confim value: e509119eccd8210d37b8a75ea614d4f9
> HCI Event: Number of Completed Packets (0x13) plen 5      #99 [hci1] 9.459190
        Num handles: 1
        Handle: 1299 Address: DF:A9:FF:F6:B1:1A (OUI DF-A9-FF)
        Count: 1
        #98: len 21 (0 Kb/s)
        Latency: 169 msec (72-172 msec ~168 msec)
> ACL Data RX: Handle 1299 flags 0x02 dlen 21              #100 [hci1] 9.459491
      SMP: Pairing Random (0x04) len 16
        Random value: 0c18ab0b741c65d10000000000000000
< HCI Command: Host Number of Comp.. (0x03|0x0035) plen 5  #101 [hci1] 9.470016
        Num handles: 1
        Handle: 1299 Address: DF:A9:FF:F6:B1:1A (OUI DF-A9-FF)
        Count: 1
< ACL Data TX: Handle 1299 flags 0x00 dlen 21              #102 [hci1] 9.470184
      SMP: Pairing Random (0x04) len 16
        Random value: 5c4a1bcadd27bd58e945097b00bad7ac
> HCI Event: Number of Completed Packets (0x13) plen 5     #103 [hci1] 9.634029
        Num handles: 1
        Handle: 1299 Address: DF:A9:FF:F6:B1:1A (OUI DF-A9-FF)
        Count: 1
        #102: len 21 (1 Kb/s)
        Latency: 163 msec (72-172 msec ~166 msec)
> ACL Data RX: Handle 1299 flags 0x02 dlen 21              #104 [hci1] 9.721845
      SMP: Pairing Confirm (0x03) len 16
        Confim value: 83c867f7cf88789a47096690d963c2f9
< HCI Command: Host Number of Comp.. (0x03|0x0035) plen 5  #105 [hci1] 9.729335
        Num handles: 1
        Handle: 1299 Address: DF:A9:FF:F6:B1:1A (OUI DF-A9-FF)
        Count: 1
< ACL Data TX: Handle 1299 flags 0x00 dlen 21              #106 [hci1] 9.729343
      SMP: Pairing Confirm (0x03) len 16
        Confim value: 7a979ecfe0f21f66f58a4ae929037981
> HCI Event: Number of Completed Packets (0x13) plen 5     #107 [hci1] 9.896727
        Num handles: 1
        Handle: 1299 Address: DF:A9:FF:F6:B1:1A (OUI DF-A9-FF)
        Count: 1
        #106: len 21 (1 Kb/s)
        Latency: 167 msec (72-172 msec ~166 msec)
> ACL Data RX: Handle 1299 flags 0x02 dlen 21              #108 [hci1] 9.897053
      SMP: Pairing Random (0x04) len 16
        Random value: 0523ebb60ec38fb40000000000000000
< HCI Command: Host Number of Comp.. (0x03|0x0035) plen 5  #109 [hci1] 9.909945
        Num handles: 1
        Handle: 1299 Address: DF:A9:FF:F6:B1:1A (OUI DF-A9-FF)
        Count: 1
< ACL Data TX: Handle 1299 flags 0x00 dlen 21              #110 [hci1] 9.910021
      SMP: Pairing Random (0x04) len 16
        Random value: 32527e6e64e79f33b2e374394db8ab2d
> HCI Event: Number of Completed Packets (0x13) plen 5    #111 [hci1] 10.071508
        Num handles: 1
        Handle: 1299 Address: DF:A9:FF:F6:B1:1A (OUI DF-A9-FF)
        Count: 1
        #110: len 21 (1 Kb/s)
        Latency: 161 msec (72-172 msec ~164 msec)
> ACL Data RX: Handle 1299 flags 0x02 dlen 21             #112 [hci1] 10.159392
      SMP: Pairing Confirm (0x03) len 16
        Confim value: d088a28efa7a8c0e083de4a45ab02bec
< HCI Command: Host Number of Com.. (0x03|0x0035) plen 5  #113 [hci1] 10.169884
        Num handles: 1
        Handle: 1299 Address: DF:A9:FF:F6:B1:1A (OUI DF-A9-FF)
        Count: 1
< ACL Data TX: Handle 1299 flags 0x00 dlen 21             #114 [hci1] 10.170079
      SMP: Pairing Confirm (0x03) len 16
        Confim value: cce75afe5de26ab08fd74a92cfb4ff28
> HCI Event: Number of Completed Packets (0x13) plen 5    #115 [hci1] 10.334238
        Num handles: 1
        Handle: 1299 Address: DF:A9:FF:F6:B1:1A (OUI DF-A9-FF)
        Count: 1
        #114: len 21 (1 Kb/s)
        Latency: 164 msec (72-172 msec ~164 msec)
> ACL Data RX: Handle 1299 flags 0x02 dlen 21             #116 [hci1] 10.334584
      SMP: Pairing Random (0x04) len 16
        Random value: 1089204ba81749010000000000000000
< HCI Command: Host Number of Com.. (0x03|0x0035) plen 5  #117 [hci1] 10.350118
        Num handles: 1
        Handle: 1299 Address: DF:A9:FF:F6:B1:1A (OUI DF-A9-FF)
        Count: 1
< ACL Data TX: Handle 1299 flags 0x00 dlen 21             #118 [hci1] 10.350343
      SMP: Pairing Random (0x04) len 16
        Random value: dddbdfe2838e9a8cc6964353c850fef7
> HCI Event: Number of Completed Packets (0x13) plen 5    #119 [hci1] 10.508973
        Num handles: 1
        Handle: 1299 Address: DF:A9:FF:F6:B1:1A (OUI DF-A9-FF)
        Count: 1
        #118: len 21 (1 Kb/s)
        Latency: 158 msec (72-172 msec ~161 msec)
> ACL Data RX: Handle 1299 flags 0x02 dlen 21             #120 [hci1] 10.596997
      SMP: Pairing Confirm (0x03) len 16
        Confim value: f9a3a43736c29f7b2d3023ac5d578830
< HCI Command: Host Number of Com.. (0x03|0x0035) plen 5  #121 [hci1] 10.609830
        Num handles: 1
        Handle: 1299 Address: DF:A9:FF:F6:B1:1A (OUI DF-A9-FF)
        Count: 1
< ACL Data TX: Handle 1299 flags 0x00 dlen 21             #122 [hci1] 10.610009
      SMP: Pairing Confirm (0x03) len 16
        Confim value: 9959883cfabea6697866215be78bf7a7
> HCI Event: Number of Completed Packets (0x13) plen 5    #123 [hci1] 10.771727
        Num handles: 1
        Handle: 1299 Address: DF:A9:FF:F6:B1:1A (OUI DF-A9-FF)
        Count: 1
        #122: len 21 (1 Kb/s)
        Latency: 161 msec (72-172 msec ~161 msec)
> ACL Data RX: Handle 1299 flags 0x02 dlen 21             #124 [hci1] 10.772042
      SMP: Pairing Random (0x04) len 16
        Random value: af9438ba14745b900000000000000000
< HCI Command: Host Number of Com.. (0x03|0x0035) plen 5  #125 [hci1] 10.790051
        Num handles: 1
        Handle: 1299 Address: DF:A9:FF:F6:B1:1A (OUI DF-A9-FF)
        Count: 1
< ACL Data TX: Handle 1299 flags 0x00 dlen 21             #126 [hci1] 10.790272
      SMP: Pairing Random (0x04) len 16
        Random value: eb9f1915536596b6fc3db1c86b2b1970
> HCI Event: Number of Completed Packets (0x13) plen 5    #127 [hci1] 10.946520
        Num handles: 1
        Handle: 1299 Address: DF:A9:FF:F6:B1:1A (OUI DF-A9-FF)
        Count: 1
        #126: len 21 (1 Kb/s)
        Latency: 156 msec (72-172 msec ~158 msec)
> ACL Data RX: Handle 1299 flags 0x02 dlen 21             #128 [hci1] 11.034451
      SMP: Pairing Confirm (0x03) len 16
        Confim value: 35390dba49eaadc70bf2a80451094c90
< HCI Command: Host Number of Com.. (0x03|0x0035) plen 5  #129 [hci1] 11.049337
        Num handles: 1
        Handle: 1299 Address: DF:A9:FF:F6:B1:1A (OUI DF-A9-FF)
        Count: 1
< ACL Data TX: Handle 1299 flags 0x00 dlen 21             #130 [hci1] 11.049390
      SMP: Pairing Confirm (0x03) len 16
        Confim value: 5a9786157d19b4da2c9ad22b936be077
> HCI Event: Number of Completed Packets (0x13) plen 5    #131 [hci1] 11.209228
        Num handles: 1
        Handle: 1299 Address: DF:A9:FF:F6:B1:1A (OUI DF-A9-FF)
        Count: 1
        #130: len 21 (1 Kb/s)
        Latency: 159 msec (72-172 msec ~159 msec)
> ACL Data RX: Handle 1299 flags 0x02 dlen 21             #132 [hci1] 11.209605
      SMP: Pairing Random (0x04) len 16
        Random value: 6195b67374fb84880000000000000000
< HCI Command: Host Number of Com.. (0x03|0x0035) plen 5  #133 [hci1] 11.229999
        Num handles: 1
        Handle: 1299 Address: DF:A9:FF:F6:B1:1A (OUI DF-A9-FF)
        Count: 1
< ACL Data TX: Handle 1299 flags 0x00 dlen 21             #134 [hci1] 11.230124
      SMP: Pairing Random (0x04) len 16
        Random value: 5c794dc9ad9f2c3f295ebd5ad5e1c3cf
> HCI Event: Number of Completed Packets (0x13) plen 5    #135 [hci1] 11.383955
        Num handles: 1
        Handle: 1299 Address: DF:A9:FF:F6:B1:1A (OUI DF-A9-FF)
        Count: 1
        #134: len 21 (1 Kb/s)
        Latency: 153 msec (72-172 msec ~156 msec)
> ACL Data RX: Handle 1299 flags 0x02 dlen 21             #136 [hci1] 11.471964
      SMP: Pairing Confirm (0x03) len 16
        Confim value: 2fbefd3a1a3344f981688a1571363ed1
< HCI Command: Host Number of Com.. (0x03|0x0035) plen 5  #137 [hci1] 11.489779
        Num handles: 1
        Handle: 1299 Address: DF:A9:FF:F6:B1:1A (OUI DF-A9-FF)
        Count: 1
< ACL Data TX: Handle 1299 flags 0x00 dlen 21             #138 [hci1] 11.489889
      SMP: Pairing Confirm (0x03) len 16
        Confim value: 257469648f7bcd794989d2f92036ba25
> HCI Event: Number of Completed Packets (0x13) plen 5    #139 [hci1] 11.646692
        Num handles: 1
        Handle: 1299 Address: DF:A9:FF:F6:B1:1A (OUI DF-A9-FF)
        Count: 1
        #138: len 21 (1 Kb/s)
        Latency: 156 msec (72-172 msec ~156 msec)
> ACL Data RX: Handle 1299 flags 0x02 dlen 21             #140 [hci1] 11.647024
      SMP: Pairing Random (0x04) len 16
        Random value: b2f4b0ac5a41694f0000000000000000
< HCI Command: Host Number of Com.. (0x03|0x0035) plen 5  #141 [hci1] 11.650003
        Num handles: 1
        Handle: 1299 Address: DF:A9:FF:F6:B1:1A (OUI DF-A9-FF)
        Count: 1
< ACL Data TX: Handle 1299 flags 0x00 dlen 21             #142 [hci1] 11.650085
      SMP: Pairing Random (0x04) len 16
        Random value: 5c2fff312cdf99c9491988e877355a9a
> HCI Event: Number of Completed Packets (0x13) plen 5    #143 [hci1] 11.821445
        Num handles: 1
        Handle: 1299 Address: DF:A9:FF:F6:B1:1A (OUI DF-A9-FF)
        Count: 1
        #142: len 21 (0 Kb/s)
        Latency: 171 msec (72-172 msec ~164 msec)
> ACL Data RX: Handle 1299 flags 0x02 dlen 21             #144 [hci1] 11.909391
      SMP: Pairing Confirm (0x03) len 16
        Confim value: ee6fa90eec5e45ba474fc3fd71ea0e13
< HCI Command: Host Number of Com.. (0x03|0x0035) plen 5  #145 [hci1] 11.929454
        Num handles: 1
        Handle: 1299 Address: DF:A9:FF:F6:B1:1A (OUI DF-A9-FF)
        Count: 1
< ACL Data TX: Handle 1299 flags 0x00 dlen 21             #146 [hci1] 11.929550
      SMP: Pairing Confirm (0x03) len 16
        Confim value: 301606436edeb21ab7dd8f40446887c3
> HCI Event: Number of Completed Packets (0x13) plen 5    #147 [hci1] 12.084190
        Num handles: 1
        Handle: 1299 Address: DF:A9:FF:F6:B1:1A (OUI DF-A9-FF)
        Count: 1
        #146: len 21 (1 Kb/s)
        Latency: 154 msec (72-172 msec ~159 msec)
> ACL Data RX: Handle 1299 flags 0x02 dlen 21             #148 [hci1] 12.084524
      SMP: Pairing Random (0x04) len 16
        Random value: d47e22e917e6122c0000000000000000
< HCI Command: Host Number of Com.. (0x03|0x0035) plen 5  #149 [hci1] 12.089790
        Num handles: 1
        Handle: 1299 Address: DF:A9:FF:F6:B1:1A (OUI DF-A9-FF)
        Count: 1
< ACL Data TX: Handle 1299 flags 0x00 dlen 21             #150 [hci1] 12.089894
      SMP: Pairing Random (0x04) len 16
        Random value: c629a3a987d808e808655d558dfc1155
> HCI Event: Number of Completed Packets (0x13) plen 5    #151 [hci1] 12.258961
        Num handles: 1
        Handle: 1299 Address: DF:A9:FF:F6:B1:1A (OUI DF-A9-FF)
        Count: 1
        #150: len 21 (0 Kb/s)
        Latency: 169 msec (72-172 msec ~164 msec)
> ACL Data RX: Handle 1299 flags 0x02 dlen 21             #152 [hci1] 12.346815
      SMP: Pairing Confirm (0x03) len 16
        Confim value: 350fb03fffcd436b6d3596f6968344f1
< HCI Command: Host Number of Com.. (0x03|0x0035) plen 5  #153 [hci1] 12.349778
        Num handles: 1
        Handle: 1299 Address: DF:A9:FF:F6:B1:1A (OUI DF-A9-FF)
        Count: 1
< ACL Data TX: Handle 1299 flags 0x00 dlen 21             #154 [hci1] 12.349942
      SMP: Pairing Confirm (0x03) len 16
        Confim value: aab3398007d70575add7fc65dce4bfcc
> HCI Event: Number of Completed Packets (0x13) plen 5    #155 [hci1] 12.521640
        Num handles: 1
        Handle: 1299 Address: DF:A9:FF:F6:B1:1A (OUI DF-A9-FF)
        Count: 1
        #154: len 21 (0 Kb/s)
        Latency: 171 msec (72-172 msec ~167 msec)
> ACL Data RX: Handle 1299 flags 0x02 dlen 21             #156 [hci1] 12.522024
      SMP: Pairing Random (0x04) len 16
        Random value: e78215d220b6601e0000000000000000
< HCI Command: Host Number of Com.. (0x03|0x0035) plen 5  #157 [hci1] 12.530079
        Num handles: 1
        Handle: 1299 Address: DF:A9:FF:F6:B1:1A (OUI DF-A9-FF)
        Count: 1
< ACL Data TX: Handle 1299 flags 0x00 dlen 21             #158 [hci1] 12.530253
      SMP: Pairing Random (0x04) len 16
        Random value: 92f20f6ad8f13724432c7fd6001c45ff
> HCI Event: Number of Completed Packets (0x13) plen 5    #159 [hci1] 12.696401
        Num handles: 1
        Handle: 1299 Address: DF:A9:FF:F6:B1:1A (OUI DF-A9-FF)
        Count: 1
        #158: len 21 (1 Kb/s)
        Latency: 166 msec (72-172 msec ~167 msec)
> ACL Data RX: Handle 1299 flags 0x02 dlen 21             #160 [hci1] 12.784335
      SMP: Pairing Confirm (0x03) len 16
        Confim value: b1c3e57cd736b0140edb85975153fc6d
< HCI Command: Host Number of Com.. (0x03|0x0035) plen 5  #161 [hci1] 12.789336
        Num handles: 1
        Handle: 1299 Address: DF:A9:FF:F6:B1:1A (OUI DF-A9-FF)
        Count: 1
< ACL Data TX: Handle 1299 flags 0x00 dlen 21             #162 [hci1] 12.789396
      SMP: Pairing Confirm (0x03) len 16
        Confim value: b18a6c9e10729c855cc40484817dc5c2
> HCI Event: Number of Completed Packets (0x13) plen 5    #163 [hci1] 12.959113
        Num handles: 1
        Handle: 1299 Address: DF:A9:FF:F6:B1:1A (OUI DF-A9-FF)
        Count: 1
        #162: len 21 (0 Kb/s)
        Latency: 169 msec (72-172 msec ~168 msec)
> ACL Data RX: Handle 1299 flags 0x02 dlen 21             #164 [hci1] 12.959508
      SMP: Pairing Random (0x04) len 16
        Random value: 926588d77a0accec0000000000000000
< HCI Command: Host Number of Com.. (0x03|0x0035) plen 5  #165 [hci1] 12.969624
        Num handles: 1
        Handle: 1299 Address: DF:A9:FF:F6:B1:1A (OUI DF-A9-FF)
        Count: 1
< ACL Data TX: Handle 1299 flags 0x00 dlen 21             #166 [hci1] 12.969676
      SMP: Pairing Random (0x04) len 16
        Random value: 23ac32ebbb5e14c8a6b9622f296d277f
> HCI Event: Number of Completed Packets (0x13) plen 5    #167 [hci1] 13.133882
        Num handles: 1
        Handle: 1299 Address: DF:A9:FF:F6:B1:1A (OUI DF-A9-FF)
        Count: 1
        #166: len 21 (1 Kb/s)
        Latency: 164 msec (72-172 msec ~166 msec)
> ACL Data RX: Handle 1299 flags 0x02 dlen 21             #168 [hci1] 13.221757
      SMP: Pairing Confirm (0x03) len 16
        Confim value: 8cd287ac55fcbe9c984aae9f250b3848
< HCI Command: Host Number of Com.. (0x03|0x0035) plen 5  #169 [hci1] 13.229638
        Num handles: 1
        Handle: 1299 Address: DF:A9:FF:F6:B1:1A (OUI DF-A9-FF)
        Count: 1
< ACL Data TX: Handle 1299 flags 0x00 dlen 21             #170 [hci1] 13.229792
      SMP: Pairing Confirm (0x03) len 16
        Confim value: f42fc75746ed503809b4261b7f20998a
> HCI Event: Number of Completed Packets (0x13) plen 5    #171 [hci1] 13.396778
        Num handles: 1
        Handle: 1299 Address: DF:A9:FF:F6:B1:1A (OUI DF-A9-FF)
        Count: 1
        #170: len 21 (1 Kb/s)
        Latency: 166 msec (72-172 msec ~166 msec)
> ACL Data RX: Handle 1299 flags 0x02 dlen 21             #172 [hci1] 13.397063
      SMP: Pairing Random (0x04) len 16
        Random value: 76bf4bdd7df9b8ed0000000000000000
< HCI Command: Host Number of Com.. (0x03|0x0035) plen 5  #173 [hci1] 13.410099
        Num handles: 1
        Handle: 1299 Address: DF:A9:FF:F6:B1:1A (OUI DF-A9-FF)
        Count: 1
< ACL Data TX: Handle 1299 flags 0x00 dlen 21             #174 [hci1] 13.410185
      SMP: Pairing Random (0x04) len 16
        Random value: 297efe85e67448a15f56bd27e3a3cf1d
> HCI Event: Number of Completed Packets (0x13) plen 5    #175 [hci1] 13.571451
        Num handles: 1
        Handle: 1299 Address: DF:A9:FF:F6:B1:1A (OUI DF-A9-FF)
        Count: 1
        #174: len 21 (1 Kb/s)
        Latency: 161 msec (72-172 msec ~163 msec)
> ACL Data RX: Handle 1299 flags 0x02 dlen 21             #176 [hci1] 13.659369
      SMP: Pairing Confirm (0x03) len 16
        Confim value: 6e235003c018fa731e31426399c941e7
< HCI Command: Host Number of Com.. (0x03|0x0035) plen 5  #177 [hci1] 13.669858
        Num handles: 1
        Handle: 1299 Address: DF:A9:FF:F6:B1:1A (OUI DF-A9-FF)
        Count: 1
< ACL Data TX: Handle 1299 flags 0x00 dlen 21             #178 [hci1] 13.669990
      SMP: Pairing Confirm (0x03) len 16
        Confim value: 935cf6433aefb76294878e58593c8138
> HCI Event: Number of Completed Packets (0x13) plen 5    #179 [hci1] 13.834158
        Num handles: 1
        Handle: 1299 Address: DF:A9:FF:F6:B1:1A (OUI DF-A9-FF)
        Count: 1
        #178: len 21 (1 Kb/s)
        Latency: 164 msec (72-172 msec ~164 msec)
> ACL Data RX: Handle 1299 flags 0x02 dlen 21             #180 [hci1] 13.834524
      SMP: Pairing Random (0x04) len 16
        Random value: 7d0c3218e1eea92b0000000000000000
< HCI Command: Host Number of Com.. (0x03|0x0035) plen 5  #181 [hci1] 13.850114
        Num handles: 1
        Handle: 1299 Address: DF:A9:FF:F6:B1:1A (OUI DF-A9-FF)
        Count: 1
< ACL Data TX: Handle 1299 flags 0x00 dlen 21             #182 [hci1] 13.850280
      SMP: Pairing Random (0x04) len 16
        Random value: 25a9493fd3ce4faf02be7293595bb7c6
> HCI Event: Number of Completed Packets (0x13) plen 5    #183 [hci1] 14.008954
        Num handles: 1
        Handle: 1299 Address: DF:A9:FF:F6:B1:1A (OUI DF-A9-FF)
        Count: 1
        #182: len 21 (1 Kb/s)
        Latency: 158 msec (72-172 msec ~161 msec)
> ACL Data RX: Handle 1299 flags 0x02 dlen 21             #184 [hci1] 14.096947
      SMP: Pairing Confirm (0x03) len 16
        Confim value: 8cfa8365ecb79f121fb4b1ed1967a17b
< HCI Command: Host Number of Com.. (0x03|0x0035) plen 5  #185 [hci1] 14.109756
        Num handles: 1
        Handle: 1299 Address: DF:A9:FF:F6:B1:1A (OUI DF-A9-FF)
        Count: 1
< ACL Data TX: Handle 1299 flags 0x00 dlen 21             #186 [hci1] 14.109833
      SMP: Pairing Confirm (0x03) len 16
        Confim value: 6be20787f07de31919c37b808a7dbb74
> HCI Event: Number of Completed Packets (0x13) plen 5    #187 [hci1] 14.271593
        Num handles: 1
        Handle: 1299 Address: DF:A9:FF:F6:B1:1A (OUI DF-A9-FF)
        Count: 1
        #186: len 21 (1 Kb/s)
        Latency: 161 msec (72-172 msec ~161 msec)
> ACL Data RX: Handle 1299 flags 0x02 dlen 21             #188 [hci1] 14.272060
      SMP: Pairing Random (0x04) len 16
        Random value: d0f61956c8106c200000000000000000
< HCI Command: Host Number of Com.. (0x03|0x0035) plen 5  #189 [hci1] 14.290070
        Num handles: 1
        Handle: 1299 Address: DF:A9:FF:F6:B1:1A (OUI DF-A9-FF)
        Count: 1
< ACL Data TX: Handle 1299 flags 0x00 dlen 21             #190 [hci1] 14.290226
      SMP: Pairing Random (0x04) len 16
        Random value: 58f6b41f855a6f6c3560debd84e2affc
> HCI Event: Number of Completed Packets (0x13) plen 5    #191 [hci1] 14.446419
        Num handles: 1
        Handle: 1299 Address: DF:A9:FF:F6:B1:1A (OUI DF-A9-FF)
        Count: 1
        #190: len 21 (1 Kb/s)
        Latency: 156 msec (72-172 msec ~158 msec)
> ACL Data RX: Handle 1299 flags 0x02 dlen 21             #192 [hci1] 14.534277
      SMP: Pairing Confirm (0x03) len 16
        Confim value: f66c9a3a6f565a08df097d6f2336c108
< HCI Command: Host Number of Com.. (0x03|0x0035) plen 5  #193 [hci1] 14.549579
        Num handles: 1
        Handle: 1299 Address: DF:A9:FF:F6:B1:1A (OUI DF-A9-FF)
        Count: 1
< ACL Data TX: Handle 1299 flags 0x00 dlen 21             #194 [hci1] 14.549682
      SMP: Pairing Confirm (0x03) len 16
        Confim value: 4587fe9502d4b4e08c3d4273bbc036fd
> HCI Event: Number of Completed Packets (0x13) plen 5    #195 [hci1] 14.709145
        Num handles: 1
        Handle: 1299 Address: DF:A9:FF:F6:B1:1A (OUI DF-A9-FF)
        Count: 1
        #194: len 21 (1 Kb/s)
        Latency: 159 msec (72-172 msec ~159 msec)
> ACL Data RX: Handle 1299 flags 0x02 dlen 21             #196 [hci1] 14.709477
      SMP: Pairing Random (0x04) len 16
        Random value: 79c50847d936d8ac0000000000000000
< HCI Command: Host Number of Com.. (0x03|0x0035) plen 5  #197 [hci1] 14.729901
        Num handles: 1
        Handle: 1299 Address: DF:A9:FF:F6:B1:1A (OUI DF-A9-FF)
        Count: 1
< ACL Data TX: Handle 1299 flags 0x00 dlen 21             #198 [hci1] 14.730102
      SMP: Pairing Random (0x04) len 16
        Random value: b67e7216d5bf664139eda2b542549666
> HCI Event: Number of Completed Packets (0x13) plen 5    #199 [hci1] 14.883928
        Num handles: 1
        Handle: 1299 Address: DF:A9:FF:F6:B1:1A (OUI DF-A9-FF)
        Count: 1
        #198: len 21 (1 Kb/s)
        Latency: 153 msec (72-172 msec ~156 msec)
> ACL Data RX: Handle 1299 flags 0x02 dlen 21             #200 [hci1] 14.971787
      SMP: Pairing Confirm (0x03) len 16
        Confim value: 4848e3873027f895f1c40140554254a6
< HCI Command: Host Number of Com.. (0x03|0x0035) plen 5  #201 [hci1] 14.989773
        Num handles: 1
        Handle: 1299 Address: DF:A9:FF:F6:B1:1A (OUI DF-A9-FF)
        Count: 1
< ACL Data TX: Handle 1299 flags 0x00 dlen 21             #202 [hci1] 14.989903
      SMP: Pairing Confirm (0x03) len 16
        Confim value: b8bf8e5168a643164f5162cebce1cb99
> HCI Event: Number of Completed Packets (0x13) plen 5    #203 [hci1] 15.146622
        Num handles: 1
        Handle: 1299 Address: DF:A9:FF:F6:B1:1A (OUI DF-A9-FF)
        Count: 1
        #202: len 21 (1 Kb/s)
        Latency: 156 msec (72-172 msec ~156 msec)
> ACL Data RX: Handle 1299 flags 0x02 dlen 21             #204 [hci1] 15.146986
      SMP: Pairing Random (0x04) len 16
        Random value: 8d58b3bb49f65cdf0000000000000000
< HCI Command: Host Number of Com.. (0x03|0x0035) plen 5  #205 [hci1] 15.150264
        Num handles: 1
        Handle: 1299 Address: DF:A9:FF:F6:B1:1A (OUI DF-A9-FF)
        Count: 1
< ACL Data TX: Handle 1299 flags 0x00 dlen 21             #206 [hci1] 15.150374
      SMP: Pairing Random (0x04) len 16
        Random value: ed17f76500c95219dd01e09d1e63f87b
> HCI Event: Number of Completed Packets (0x13) plen 5    #207 [hci1] 15.321479
        Num handles: 1
        Handle: 1299 Address: DF:A9:FF:F6:B1:1A (OUI DF-A9-FF)
        Count: 1
        #206: len 21 (0 Kb/s)
        Latency: 171 msec (72-172 msec ~163 msec)
> ACL Data RX: Handle 1299 flags 0x02 dlen 21             #208 [hci1] 15.409239
      SMP: Pairing Confirm (0x03) len 16
        Confim value: 5156c89466ff34df6d50b7bc424c343d
< HCI Command: Host Number of Com.. (0x03|0x0035) plen 5  #209 [hci1] 15.429855
        Num handles: 1
        Handle: 1299 Address: DF:A9:FF:F6:B1:1A (OUI DF-A9-FF)
        Count: 1
< ACL Data TX: Handle 1299 flags 0x00 dlen 21             #210 [hci1] 15.430011
      SMP: Pairing Confirm (0x03) len 16
        Confim value: 72e004bb0a549f9d14fdfdd1208dd0ae
> HCI Event: Number of Completed Packets (0x13) plen 5    #211 [hci1] 15.584159
        Num handles: 1
        Handle: 1299 Address: DF:A9:FF:F6:B1:1A (OUI DF-A9-FF)
        Count: 1
        #210: len 21 (1 Kb/s)
        Latency: 154 msec (72-172 msec ~159 msec)
> ACL Data RX: Handle 1299 flags 0x02 dlen 21             #212 [hci1] 15.584449
      SMP: Pairing Random (0x04) len 16
        Random value: de1d93c032d2ade70000000000000000
< HCI Command: Host Number of Com.. (0x03|0x0035) plen 5  #213 [hci1] 15.590092
        Num handles: 1
        Handle: 1299 Address: DF:A9:FF:F6:B1:1A (OUI DF-A9-FF)
        Count: 1
< ACL Data TX: Handle 1299 flags 0x00 dlen 21             #214 [hci1] 15.590264
      SMP: Pairing Random (0x04) len 16
        Random value: 81d35d47e1f6006d79c974bd9d9e1ee3
> HCI Event: Number of Completed Packets (0x13) plen 5    #215 [hci1] 15.758923
        Num handles: 1
        Handle: 1299 Address: DF:A9:FF:F6:B1:1A (OUI DF-A9-FF)
        Count: 1
        #214: len 21 (1 Kb/s)
        Latency: 168 msec (72-172 msec ~163 msec)
> ACL Data RX: Handle 1299 flags 0x02 dlen 21             #216 [hci1] 15.846873
      SMP: Pairing Confirm (0x03) len 16
        Confim value: 83d2d2e402faf46b48ed5ff1ffcfeb23
< HCI Command: Host Number of Com.. (0x03|0x0035) plen 5  #217 [hci1] 15.849847
        Num handles: 1
        Handle: 1299 Address: DF:A9:FF:F6:B1:1A (OUI DF-A9-FF)
        Count: 1
< ACL Data TX: Handle 1299 flags 0x00 dlen 21             #218 [hci1] 15.849868
      SMP: Pairing Confirm (0x03) len 16
        Confim value: 6b87dc4fe998e6ec12b6db86aad2334c
> HCI Event: Number of Completed Packets (0x13) plen 5    #219 [hci1] 16.021606
        Num handles: 1
        Handle: 1299 Address: DF:A9:FF:F6:B1:1A (OUI DF-A9-FF)
        Count: 1
        #218: len 21 (0 Kb/s)
        Latency: 171 msec (72-172 msec ~167 msec)
> ACL Data RX: Handle 1299 flags 0x02 dlen 21             #220 [hci1] 16.021944
      SMP: Pairing Random (0x04) len 16
        Random value: 02f33a5f4e2dc3160000000000000000
< HCI Command: Host Number of Com.. (0x03|0x0035) plen 5  #221 [hci1] 16.030211
        Num handles: 1
        Handle: 1299 Address: DF:A9:FF:F6:B1:1A (OUI DF-A9-FF)
        Count: 1
< ACL Data TX: Handle 1299 flags 0x00 dlen 21             #222 [hci1] 16.030366
      SMP: Pairing Random (0x04) len 16
        Random value: e7f7e0c2476823e41736a7e381bafb7c
> HCI Event: Number of Completed Packets (0x13) plen 5    #223 [hci1] 16.196405
        Num handles: 1
        Handle: 1299 Address: DF:A9:FF:F6:B1:1A (OUI DF-A9-FF)
        Count: 1
        #222: len 21 (1 Kb/s)
        Latency: 166 msec (72-172 msec ~166 msec)
> ACL Data RX: Handle 1299 flags 0x02 dlen 21             #224 [hci1] 16.284247
      SMP: Pairing Confirm (0x03) len 16
        Confim value: 6df55df18132dcf7892d218847b20bd7
< HCI Command: Host Number of Com.. (0x03|0x0035) plen 5  #225 [hci1] 16.289882
        Num handles: 1
        Handle: 1299 Address: DF:A9:FF:F6:B1:1A (OUI DF-A9-FF)
        Count: 1
< ACL Data TX: Handle 1299 flags 0x00 dlen 21             #226 [hci1] 16.290035
      SMP: Pairing Confirm (0x03) len 16
        Confim value: eedde3b408a38e3764f11e8611855e63
> HCI Event: Number of Completed Packets (0x13) plen 5    #227 [hci1] 16.459108
        Num handles: 1
        Handle: 1299 Address: DF:A9:FF:F6:B1:1A (OUI DF-A9-FF)
        Count: 1
        #226: len 21 (0 Kb/s)
        Latency: 169 msec (72-172 msec ~167 msec)
> ACL Data RX: Handle 1299 flags 0x02 dlen 21             #228 [hci1] 16.459436
      SMP: Pairing Random (0x04) len 16
        Random value: 3f2ea3a67b91fc830000000000000000
