Bluetooth monitor ver 5.72
= Note: Linux version 6.14.0-36-generic (x86_64)                       0.530897
= Note: Bluetooth subsystem version 2.22                               0.530899
= New Index: 00:00:00:00:00:00 (Primary,UART,hci2)              [hci2] 0.530901
= New Index: 00:00:00:00:00:00 (Primary,UART,hci1)              [hci1] 0.530901
= New Index: 48:5F:99:8E:E0:64 (Primary,USB,hci0)               [hci0] 0.530902
= Open Index: 00:00:00:00:00:00                                 [hci1] 0.554023
= Index Info: 00:00:00:00:00:00 (Nordic Semiconductor ASA)      [hci1] 0.554027
@ USER Open: main (privileged) version 2.22            {0x0001} [hci1] 0.554030
< HCI Command: Reset (0x03|0x0003) plen 0                    #1 [hci1] 0.554321
> HCI Event: Command Complete (0x0e) plen 4                  #2 [hci1] 0.554842
      Reset (0x03|0x0003) ncmd 1
        Status: Success (0x00)
< HCI Command: Read Local Supported... (0x04|0x0003) plen 0  #3 [hci1] 0.573987
> HCI Event: Command Complete (0x0e) plen 12                 #4 [hci1] 0.574497
      Read Local Supported Features (0x04|0x0003) ncmd 1
        Status: Success (0x00)
        Features: 0x00 0x00 0x00 0x00 0x60 0x00 0x00 0x00
          BR/EDR Not Supported
          LE Supported (Controller)
< HCI Command: Read Local Version In.. (0x04|0x0001) plen 0  #5 [hci1] 0.593986
> HCI Event: Command Complete (0x0e) plen 12                 #6 [hci1] 0.594580
      Read Local Version Information (0x04|0x0001) ncmd 1
        Status: Success (0x00)
        HCI version: Reserved (0x0f) - Revision 12393 (0x3069)
        LMP version: Reserved (0x0f) - Subversion 12393 (0x3069)
        Manufacturer: Nordic Semiconductor ASA (89)
< HCI Command: Read Local Supported... (0x04|0x0002) plen 0  #7 [hci1] 0.613978
> HCI Event: Command Complete (0x0e) plen 68                 #8 [hci1] 0.615042
      Read Local Supported Commands (0x04|0x0002) ncmd 1
        Status: Success (0x00)
        Commands: 119 entries
          Disconnect (Octet 0 - Bit 5)
          Read Remote Version Information (Octet 2 - Bit 7)
          Set Event Mask (Octet 5 - Bit 6)
          Reset (Octet 5 - Bit 7)
          Read Connection Accept Timeout (Octet 7 - Bit 2)
          Write Connection Accept Timeout (Octet 7 - Bit 3)
          Read Transmit Power Level (Octet 10 - Bit 2)
          Set Controller To Host Flow Control (Octet 10 - Bit 5)
          Host Buffer Size (Octet 10 - Bit 6)
          Host Number of Completed Packets (Octet 10 - Bit 7)
          Read Local Version Information (Octet 14 - Bit 3)
          Read Local Supported Features (Octet 14 - Bit 5)
          Read BD ADDR (Octet 15 - Bit 1)
          Read RSSI (Octet 15 - Bit 5)
          Set Event Mask Page 2 (Octet 22 - Bit 2)
          LE Set Event Mask (Octet 25 - Bit 0)
          LE Read Buffer Size (Octet 25 - Bit 1)
          LE Read Local Supported Features (Octet 25 - Bit 2)
          LE Set Random Address (Octet 25 - Bit 4)
          LE Set Advertising Parameters (Octet 25 - Bit 5)
          LE Read Advertising Channel TX Power (Octet 25 - Bit 6)
          LE Set Advertising Data (Octet 25 - Bit 7)
          LE Set Scan Response Data (Octet 26 - Bit 0)
          LE Set Advertise Enable (Octet 26 - Bit 1)
          LE Set Scan Parameters (Octet 26 - Bit 2)
          LE Set Scan Enable (Octet 26 - Bit 3)
          LE Create Connection (Octet 26 - Bit 4)
          LE Create Connection Cancel (Octet 26 - Bit 5)
          LE Read Accept List Size (Octet 26 - Bit 6)
          LE Clear Accept List (Octet 26 - Bit 7)
          LE Add Device To Accept List (Octet 27 - Bit 0)
          LE Remove Device From Accept List (Octet 27 - Bit 1)
          LE Connection Update (Octet 27 - Bit 2)
          LE Set Host Channel Classification (Octet 27 - Bit 3)
          LE Read Channel Map (Octet 27 - Bit 4)
          LE Read Remote Used Features (Octet 27 - Bit 5)
          LE Encrypt (Octet 27 - Bit 6)
          LE Rand (Octet 27 - Bit 7)
          LE Start Encryption (Octet 28 - Bit 0)
          LE Long Term Key Request Reply (Octet 28 - Bit 1)
          LE Long Term Key Request Neg Reply (Octet 28 - Bit 2)
          LE Read Supported States (Octet 28 - Bit 3)
          LE Receiver Test (Octet 28 - Bit 4)
          LE Transmitter Test (Octet 28 - Bit 5)
          LE Test End (Octet 28 - Bit 6)
          Read Authenticated Payload Timeout (Octet 32 - Bit 4)
          Write Authenticated Payload Timeout (Octet 32 - Bit 5)
          LE Set Data Length (Octet 33 - Bit 6)
          LE Read Suggested Default Data Length (Octet 33 - Bit 7)
          LE Write Suggested Default Data Length (Octet 34 - Bit 0)
          LE Add Device To Resolving List (Octet 34 - Bit 3)
          LE Remove Device From Resolving List (Octet 34 - Bit 4)
          LE Clear Resolving List (Octet 34 - Bit 5)
          LE Read Resolving List Size (Octet 34 - Bit 6)
          LE Set Address Resolution Enable (Octet 35 - Bit 1)
          LE Set Resolvable Private Address Timeout (Octet 35 - Bit 2)
          LE Read Maximum Data Length (Octet 35 - Bit 3)
          LE Read PHY (Octet 35 - Bit 4)
          LE Set Default PHY (Octet 35 - Bit 5)
          LE Set PHY (Octet 35 - Bit 6)
          LE Enhanced Receiver Test (Octet 35 - Bit 7)
          LE Enhanced Transmitter Test (Octet 36 - Bit 0)
          LE Set Advertising Set Random Address (Octet 36 - Bit 1)
          LE Set Extended Advertising Parameters (Octet 36 - Bit 2)
          LE Set Extended Advertising Data (Octet 36 - Bit 3)
          LE Set Extended Scan Response Data (Octet 36 - Bit 4)
          LE Set Extended Advertising Enable (Octet 36 - Bit 5)
          LE Read Maximum Advertising Data Length (Octet 36 - Bit 6)
          LE Read Number of Supported Advertising Sets (Octet 36 - Bit 7)
          LE Remove Advertising Set (Octet 37 - Bit 0)
          LE Clear Advertising Sets (Octet 37 - Bit 1)
          LE Set Periodic Advertising Parameters (Octet 37 - Bit 2)
          LE Set Periodic Advertising Data (Octet 37 - Bit 3)
          LE Set Periodic Advertising Enable (Octet 37 - Bit 4)
          LE Set Extended Scan Parameters (Octet 37 - Bit 5)
          LE Set Extended Scan Enable (Octet 37 - Bit 6)
          LE Extended Create Connection (Octet 37 - Bit 7)
          LE Periodic Advertising Create Sync (Octet 38 - Bit 0)
          LE Periodic Advertising Create Sync Cancel (Octet 38 - Bit 1)
          LE Periodic Advertising Terminate Sync (Octet 38 - Bit 2)
          LE Add Device To Periodic Advertiser List (Octet 38 - Bit 3)
          LE Remove Device From Periodic Advertiser List (Octet 38 - Bit 4)
          LE Clear Periodic Advertiser List (Octet 38 - Bit 5)
          LE Read Periodic Advertiser List Size (Octet 38 - Bit 6)
          LE Read Transmit Power (Octet 38 - Bit 7)
          LE Read RF Path Compensation (Octet 39 - Bit 0)
          LE Write RF Path Compensation (Octet 39 - Bit 1)
          LE Set Privacy Mode (Octet 39 - Bit 2)
          LE Periodic Advertising Receive Enable (Octet 40 - Bit 5)
          LE Periodic Advertising Sync Transfer (Octet 40 - Bit 6)
          LE Periodic Advertising Set Info Transfer (Octet 40 - Bit 7)
          LE Periodic Advertising Sync Transfer Parameters (Octet 41 - Bit 0)
          LE Set Default Periodic Advertisng Sync Transfer Parameters (Octet 41 - Bit 1)
          LE Read Buffer v2 (Octet 41 - Bit 5)
          LE Read ISO TX Sync (Octet 41 - Bit 6)
          LE Set Connected Isochronous Group Parameters (Octet 41 - Bit 7)
          LE Set Connected Isochronous Group Parameters Test (Octet 42 - Bit 0)
          LE Create Connected Isochronous Stream (Octet 42 - Bit 1)
          LE Remove Connected Isochronous Group (Octet 42 - Bit 2)
          LE Accept Connected Isochronous Stream Request (Octet 42 - Bit 3)
          LE Reject Connected Isochronous Stream Request (Octet 42 - Bit 4)
          LE Create Broadcast Isochronous Group (Octet 42 - Bit 5)
          LE Create Broadcast Isochronous Group Test (Octet 42 - Bit 6)
          LE Terminate Broadcast Isochronous Group (Octet 42 - Bit 7)
          LE Broadcast Isochronous Group Create Sync (Octet 43 - Bit 0)
          LE Broadcast Isochronous Group Terminate Sync (Octet 43 - Bit 1)
          LE Request Peer SCA (Octet 43 - Bit 2)
          LE Setup Isochronous Data Path (Octet 43 - Bit 3)
          LE Remove Isochronous Data Path (Octet 43 - Bit 4)
          LE Isochronous Transmit Test (Octet 43 - Bit 5)
          LE Isochronous Receive Test (Octet 43 - Bit 6)
          LE Isochronous Read Test Counters (Octet 43 - Bit 7)
          LE Isochronous Read Test Counters (Octet 44 - Bit 0)
          LE Set Host Feature (Octet 44 - Bit 1)
          Octet 44 - Bit 2 
          Octet 45 - Bit 6 
          Octet 46 - Bit 0 
          Octet 46 - Bit 1 
          Octet 46 - Bit 2 
< HCI Command: Host Buffer Size (0x03|0x0033) plen 7         #9 [hci1] 0.633993
        ACL MTU: 255  ACL max packet: 16
        SCO MTU: 0    SCO max packet: 0
> HCI Event: Command Complete (0x0e) plen 4                 #10 [hci1] 0.634493
      Host Buffer Size (0x03|0x0033) ncmd 1
        Status: Success (0x00)
< HCI Command: Set Controller To Ho.. (0x03|0x0031) plen 1  #11 [hci1] 0.653996
        Flow control: ACL Data Packets (0x01)
> HCI Event: Command Complete (0x0e) plen 4                 #12 [hci1] 0.654512
      Set Controller To Host Flow Control (0x03|0x0031) ncmd 1
        Status: Success (0x00)
< HCI Command: LE Read Local Suppor.. (0x08|0x0003) plen 0  #13 [hci1] 0.673986
> HCI Event: Command Complete (0x0e) plen 12                #14 [hci1] 0.674526
      LE Read Local Supported Features (0x08|0x0003) ncmd 1
        Status: Success (0x00)
        Features: 0xfd 0x79 0x00 0xf7 0x30 0x01 0x00 0x00
          LE Encryption
          Extended Reject Indication
          Peripheral-initiated Features Exchange
          LE Ping
          LE Data Packet Length Extension
          LL Privacy
          Extended Scanner Filter Policies
          LE 2M PHY
          LE Coded PHY
          LE Extended Advertising
          LE Periodic Advertising
          Channel Selection Algorithm #2
          Periodic Advertising Sync Transfer - Sender
          Periodic Advertising Sync Transfer - Recipient
          Sleep Clock Accuracy Updates
          Connected Isochronous Stream - Central
          Connected Isochronous Stream - Peripheral
          Isochronous Broadcaster
          Synchronized Receiver
          Periodic Advertising ADI support
          Connection Subrating
          Unknown features (0x0000010000000000)
< HCI Command: LE Set Host Feature (0x08|0x0074) plen 2     #15 [hci1] 0.693994
        Bit Number: 32
          Connected Isochronous Stream (Host Support)
        Bit Value: 1
> HCI Event: Command Complete (0x0e) plen 4                 #16 [hci1] 0.694452
      LE Set Host Feature (0x08|0x0074) ncmd 1
        Status: Success (0x00)
< HCI Command: LE Read Buffer v2 (0x08|0x0060) plen 0       #17 [hci1] 0.713996
> HCI Event: Command Complete (0x0e) plen 10                #18 [hci1] 0.714532
      LE Read Buffer v2 (0x08|0x0060) ncmd 1
        Status: Success (0x00)
        ACL MTU: 27
        ACL max packet: 3
        ISO MTU: 318
        ISO max packet: 3
< HCI Command: LE Read Maximum Adve.. (0x08|0x003a) plen 0  #19 [hci1] 0.734031
> HCI Event: Command Complete (0x0e) plen 6                 #20 [hci1] 0.734521
      LE Read Maximum Advertising Data Length (0x08|0x003a) ncmd 1
        Status: Success (0x00)
        Max length: 1650
< HCI Command: LE Read Supported St.. (0x08|0x001c) plen 0  #21 [hci1] 0.753960
> HCI Event: Command Complete (0x0e) plen 12                #22 [hci1] 0.754492
      LE Read Supported States (0x08|0x001c) ncmd 1
        Status: Success (0x00)
        States: 0x000003ff3e0306ff
          Non-connectable Advertising State
          Scannable Advertising State
          Connectable Advertising State
          High Duty Cycle Directed Advertising State
          Passive Scanning State
          Active Scanning State
          Initiating State
            and Connection State (Central Role)
          Connection State (Peripheral Role)
          Scannable Advertising State
            and Passive Scanning State
          Connectable Advertising State
            and Passive Scanning State
          Non-connectable Advertising State
            and Initiating State
          Scannable Advertising State
            and Initiating State
          Active Scanning State
            and Connection State (Central Role)
          Passive Scanning State
            and Connection State (Peripheral Role)
          Active Scanning State
            and Connection State (Peripheral Role)
          Initiating State
            and Connection State (Central Role)
            and Central Role & Central Role
          Low Duty Cycle Directed Advertising State
          Connectable Advertising State
            and Initiating State
            and Central Role & Peripheral Role
          High Duty Cycle Directed Advertising State
            and Initiating State
            and Central Role & Peripheral Role
          Low Duty Cycle Directed Advertising State
            and Initiating State
            and Central Role & Peripheral Role
          Connectable Advertising State
            and Connection State (Central Role)
            and Central Role & Peripheral Role
          High Duty Cycle Directed Advertising State
            and Connection State (Central Role)
            and Central Role & Peripheral Role
          Low Duty Cycle Directed Advertising State
            and Connection State (Central Role)
            and Central Role & Peripheral Role
          Connectable Advertising State
            and Connection State (Peripheral Role)
            and Central Role & Peripheral Role
          High Duty Cycle Directed Advertising State
            and Connection State (Peripheral Role)
            and Peripheral Role & Peripheral Role
          Low Duty Cycle Directed Advertising State
            and Connection State (Peripheral Role)
            and Peripheral Role & Peripheral Role
          Initiating State
            and Connection State (Peripheral Role)
            and Central Role & Peripheral Role
< HCI Command: LE Read Maximum Data.. (0x08|0x002f) plen 0  #23 [hci1] 0.773970
> HCI Event: Command Complete (0x0e) plen 12                #24 [hci1] 0.774521
      LE Read Maximum Data Length (0x08|0x002f) ncmd 1
        Status: Success (0x00)
        Max TX octets: 251
        Max TX time: 2704
        Max RX octets: 251
        Max RX time: 2704
< HCI Command: LE Write Suggested D.. (0x08|0x0024) plen 4  #25 [hci1] 0.793985
        TX octets: 251
        TX time: 2704
> HCI Event: Command Complete (0x0e) plen 4                 #26 [hci1] 0.794470
      LE Write Suggested Default Data Length (0x08|0x0024) ncmd 1
        Status: Success (0x00)
< HCI Command: LE Read Resolving Li.. (0x08|0x002a) plen 0  #27 [hci1] 0.813995
> HCI Event: Command Complete (0x0e) plen 5                 #28 [hci1] 0.814412
      LE Read Resolving List Size (0x08|0x002a) ncmd 1
        Status: Success (0x00)
        Size: 8
< HCI Command: LE Set Event Mask (0x08|0x0001) plen 8       #29 [hci1] 0.833991
        Mask: 0x000002023f87fa5e
          LE Advertising Report
          LE Connection Update Complete
          LE Read Remote Used Features Complete
          LE Long Term Key Request
          LE Data Length Change
          LE Enhanced Connection Complete
          LE PHY Update Complete
          LE Extended Advertising Report
          LE Periodic Advertising Sync Established
          LE Periodic Advertising Report
          LE Periodic Advertising Sync Lost
          LE Extended Scan Timeout
          LE Extended Advertising Set Terminated
          LE Scan Request Received
          LE Periodic Advertising Sync Transfer Rvc
          LE CIS Established
          LE CIS Request
          LE Create BIG Complete
          LE Terminate BIG Complete
          LE BIG Sync Estabilished Complete
          LE BIG Sync Lost
          LE BIG Info Advertising Report
          Unknown mask (0x0000020000000000)
> HCI Event: Command Complete (0x0e) plen 4                 #30 [hci1] 0.834550
      LE Set Event Mask (0x08|0x0001) ncmd 1
        Status: Success (0x00)
< HCI Command: Set Event Mask (0x03|0x0001) plen 8          #31 [hci1] 0.853984
        Mask: 0x2000800002008890
          Disconnection Complete
          Encryption Change
          Read Remote Version Information Complete
          Hardware Error
          Data Buffer Overflow
          Encryption Key Refresh Complete
          LE Meta
> HCI Event: Command Complete (0x0e) plen 4                 #32 [hci1] 0.854504
      Set Event Mask (0x03|0x0001) ncmd 1
        Status: Success (0x00)
< HCI Command: Read BD ADDR (0x04|0x0009) plen 0            #33 [hci1] 0.873993
> HCI Event: Command Complete (0x0e) plen 10                #34 [hci1] 0.874514
      Read BD ADDR (0x04|0x0009) ncmd 1
        Status: Success (0x00)
        Address: 00:00:00:00:00:00 (OUI 00-00-00)
< HCI Command: LE Set Random Address (0x08|0x0005) plen 6   #35 [hci1] 0.894018
        Address: D5:B6:CC:31:DB:3B (Static)
> HCI Event: Command Complete (0x0e) plen 4                 #36 [hci1] 0.894530
      LE Set Random Address (0x08|0x0005) ncmd 1
        Status: Success (0x00)
< HCI Command: LE Set Extended Adv.. (0x08|0x0036) plen 25  #37 [hci1] 5.184114
        Handle: 0x00
        Properties: 0x0013
          Connectable
          Scannable
          Use legacy advertising PDUs: ADV_IND
        Min advertising interval: 100.000 msec (0x00a0)
        Max advertising interval: 150.000 msec (0x00f0)
        Channel map: 37, 38, 39 (0x07)
        Own address type: Random (0x01)
        Peer address type: Public (0x00)
        Peer address: 00:00:00:00:00:00 (OUI 00-00-00)
        Filter policy: Allow Scan Request from Any, Allow Connect Request from Any (0x00)
        TX power: Host has no preference (0x7f)
        Primary PHY: LE 1M (0x01)
        Secondary max skip: 0x00
        Secondary PHY: LE 1M (0x01)
        SID: 0x00
        Scan request notifications: Disabled (0x00)
> HCI Event: Command Complete (0x0e) plen 5                 #38 [hci1] 5.184975
      LE Set Extended Advertising Parameters (0x08|0x0036) ncmd 1
        Status: Success (0x00)
        TX power (selected): 0 dbm (0x00)
< HCI Command: LE Set Advertising S.. (0x08|0x0035) plen 7  #39 [hci1] 5.194052
        Advertising handle: 0x00
        Advertising random address: D5:B6:CC:31:DB:3B (Static)
> HCI Event: Command Complete (0x0e) plen 4                 #40 [hci1] 5.194520
      LE Set Advertising Set Random Address (0x08|0x0035) ncmd 1
        Status: Success (0x00)
< HCI Command: LE Set Extended Adv.. (0x08|0x0037) plen 22  #41 [hci1] 5.214051
        Handle: 0x00
        Operation: Complete extended advertising data (0x03)
        Fragment preference: Minimize fragmentation (0x01)
        Data length: 0x12
        Flags: 0x06
          LE General Discoverable Mode
          BR/EDR Not Supported
        Name (complete): Tester_F6B11A
> HCI Event: Command Complete (0x0e) plen 4                 #42 [hci1] 5.214813
      LE Set Extended Advertising Data (0x08|0x0037) ncmd 1
        Status: Success (0x00)
< HCI Command: LE Set Extended Scan.. (0x08|0x0038) plen 4  #43 [hci1] 5.234033
        Handle: 0x00
        Operation: Complete scan response data (0x03)
        Fragment preference: Minimize fragmentation (0x01)
        Data length: 0x00
> HCI Event: Command Complete (0x0e) plen 4                 #44 [hci1] 5.234643
      LE Set Extended Scan Response Data (0x08|0x0038) ncmd 1
        Status: Success (0x00)
< HCI Command: LE Set Extended Adve.. (0x08|0x0039) plen 6  #45 [hci1] 5.254050
        Extended advertising: Enabled (0x01)
        Number of sets: 1 (0x01)
        Entry 0
          Handle: 0x00
          Duration: 0 ms (0x00)
          Max ext adv events: 0
> HCI Event: Command Complete (0x0e) plen 4                 #46 [hci1] 5.254636
      LE Set Extended Advertising Enable (0x08|0x0039) ncmd 1
        Status: Success (0x00)
> HCI Event: LE Meta Event (0x3e) plen 31                   #47 [hci1] 5.587317
      LE Enhanced Connection Complete (0x0a)
        Status: Success (0x00)
        Handle: 1767
        Role: Peripheral (0x01)
        Peer address type: Public (0x00)
        Peer address: DF:A9:FF:F6:B1:1A (OUI DF-A9-FF)
        Local resolvable private address: 00:00:00:00:00:00 (Non-Resolvable)
        Peer resolvable private address: 00:00:00:00:00:00 (Non-Resolvable)
        Connection interval: 87.50 msec (0x0046)
        Connection latency: 0 (0x0000)
        Supervision timeout: 20000 msec (0x07d0)
        Central clock accuracy: 0x01
> HCI Event: LE Meta Event (0x3e) plen 6                    #48 [hci1] 5.587355
      LE Advertising Set Terminated (0x12)
        Status: Success (0x00)
        Handle: 0
        Connection handle: 1767
        Number of completed extended advertising events: 0
< HCI Command: LE Read Remote Used... (0x08|0x0016) plen 2  #49 [hci1] 5.594467
        Handle: 1767 Address: DF:A9:FF:F6:B1:1A (OUI DF-A9-FF)
> HCI Event: Command Status (0x0f) plen 4                   #50 [hci1] 5.595065
      LE Read Remote Used Features (0x08|0x0016) ncmd 1
        Status: Success (0x00)
> HCI Event: LE Meta Event (0x3e) plen 12                   #51 [hci1] 5.851090
      LE Read Remote Used Features (0x04)
        Status: Success (0x00)
        Handle: 1767 Address: DF:A9:FF:F6:B1:1A (OUI DF-A9-FF)
        Features: 0x2d 0x49 0x00 0xf7 0x67 0xd9 0x00 0x80
          LE Encryption
          Extended Reject Indication
          Peripheral-initiated Features Exchange
          LE Data Packet Length Extension
          LE 2M PHY
          LE Coded PHY
          Channel Selection Algorithm #2
          Periodic Advertising Sync Transfer - Sender
          Periodic Advertising Sync Transfer - Recipient
          Sleep Clock Accuracy Updates
          Connected Isochronous Stream - Central
          Connected Isochronous Stream - Peripheral
          Isochronous Broadcaster
          Synchronized Receiver
          Connected Isochronous Stream (Host Support)
          LE Power Control Request
          LE Power Control Request
          Connection Subrating
          Connection Subrating (Host Support)
          Unknown features (0x8000d90000000000)
< ACL Data TX: Handle 1767 flags 0x00 dlen 16              #52 [hci1] 10.604315
      LE L2CAP: Connection Parameter Update Request (0x12) ident 1 len 8
        Min interval: 24
        Max interval: 40
        Peripheral latency: 0
        Timeout multiplier: 42
> HCI Event: Number of Completed Packets (0x13) plen 5     #53 [hci1] 10.750691
        Num handles: 1
        Handle: 1767 Address: DF:A9:FF:F6:B1:1A (OUI DF-A9-FF)
        Count: 1
        #52: len 16 (0 Kb/s)
        Latency: 146 msec (146-146 msec ~146 msec)
> ACL Data RX: Handle 1767 flags 0x02 dlen 10              #54 [hci1] 10.750891
      LE L2CAP: Connection Parameter Update Response (0x13) ident 1 len 2
        Result: Connection Parameters accepted (0x0000)
< HCI Command: Host Number of Comp.. (0x03|0x0035) plen 5  #55 [hci1] 10.754779
        Num handles: 1
        Handle: 1767 Address: DF:A9:FF:F6:B1:1A (OUI DF-A9-FF)
        Count: 1
> ACL Data RX: Handle 1767 flags 0x02 dlen 11              #56 [hci1] 13.463188
      SMP: Pairing Request (0x01) len 6
        IO capability: KeyboardDisplay (0x04)
        OOB data: Authentication data not present (0x00)
        Authentication requirement: Bonding, No MITM, SC, No Keypresses (0x09)
        Max encryption key size: 16
        Initiator key distribution: EncKey IdKey Sign (0x07)
        Responder key distribution: EncKey IdKey Sign (0x07)
< HCI Command: Host Number of Comp.. (0x03|0x0035) plen 5  #57 [hci1] 13.474301
        Num handles: 1
        Handle: 1767 Address: DF:A9:FF:F6:B1:1A (OUI DF-A9-FF)
        Count: 1
< ACL Data TX: Handle 1767 flags 0x00 dlen 11              #58 [hci1] 13.474346
      SMP: Pairing Response (0x02) len 6
        IO capability: NoInputNoOutput (0x03)
        OOB data: Authentication data not present (0x00)
        Authentication requirement: Bonding, No MITM, SC, No Keypresses (0x09)
        Max encryption key size: 16
        Initiator key distribution: IdKey (0x02)
        Responder key distribution: <none> (0x00)
> HCI Event: Number of Completed Packets (0x13) plen 5     #59 [hci1] 13.638237
        Num handles: 1
        Handle: 1767 Address: DF:A9:FF:F6:B1:1A (OUI DF-A9-FF)
        Count: 1
        #58: len 11 (0 Kb/s)
        Latency: 163 msec (146-163 msec ~155 msec)
> ACL Data RX: Handle 1767 flags 0x02 dlen 27              #60 [hci1] 13.638588
> ACL Data RX: Handle 1767 flags 0x01 dlen 27              #61 [hci1] 13.639084
> ACL Data RX: Handle 1767 flags 0x01 dlen 15              #62 [hci1] 13.639556
      SMP: Pairing Public Key (0x0c) len 64
        X: ce457b2aa58c234d20a7595a850a4754b58bb2cb0a69ebea1b6b952cf6b400c5
        Y: 94a3c5ba9c81dff810859b02c3fa04decf73ddad3b9da4d0a06b72b229758ceb
< HCI Command: Host Number of Comp.. (0x03|0x0035) plen 5  #63 [hci1] 13.654637
        Num handles: 1
        Handle: 1767 Address: DF:A9:FF:F6:B1:1A (OUI DF-A9-FF)
        Count: 1
< HCI Command: Host Number of Comp.. (0x03|0x0035) plen 5  #64 [hci1] 13.654803
        Num handles: 1
        Handle: 1767 Address: DF:A9:FF:F6:B1:1A (OUI DF-A9-FF)
        Count: 1
< HCI Command: Host Number of Comp.. (0x03|0x0035) plen 5  #65 [hci1] 13.655055
        Num handles: 1
        Handle: 1767 Address: DF:A9:FF:F6:B1:1A (OUI DF-A9-FF)
        Count: 1
< ACL Data TX: Handle 1767 flags 0x00 dlen 27              #66 [hci1] 13.655149
< ACL Data TX: Handle 1767 flags 0x01 dlen 27              #67 [hci1] 13.655157
< ACL Data TX: Handle 1767 flags 0x01 dlen 15              #68 [hci1] 13.655159
      SMP: Pairing Public Key (0x0c) len 64
        X: 98308440221e2d910f0e54b71e7ec652857aa9b5a0dc65028824cc19db1226e9
        Y: 67a4816bcb62efb21701e31fdb27561a6217575fb007a8bbdabe7e28b6f68482
> HCI Event: Number of Completed Packets (0x13) plen 5     #69 [hci1] 13.726099
        Num handles: 1
        Handle: 1767 Address: DF:A9:FF:F6:B1:1A (OUI DF-A9-FF)
        Count: 1
        #66: len 27 (3 Kb/s)
        Latency: 70 msec (70-163 msec ~113 msec)
> HCI Event: Number of Completed Packets (0x13) plen 5     #70 [hci1] 13.726788
        Num handles: 1
        Handle: 1767 Address: DF:A9:FF:F6:B1:1A (OUI DF-A9-FF)
        Count: 1
        #67: len 27 (3 Kb/s)
        Latency: 71 msec (70-163 msec ~92 msec)
< ACL Data TX: Handle 1767 flags 0x00 dlen 21              #71 [hci1] 13.734528
      SMP: Pairing Confirm (0x03) len 16
        Confim value: 3e82bf2e6e133db457beeaa37024c348
> HCI Event: Number of Completed Packets (0x13) plen 5     #72 [hci1] 13.813105
        Num handles: 1
        Handle: 1767 Address: DF:A9:FF:F6:B1:1A (OUI DF-A9-FF)
        Count: 1
        #68: len 15 (0 Kb/s)
        Latency: 157 msec (70-163 msec ~125 msec)
> HCI Event: Number of Completed Packets (0x13) plen 5     #73 [hci1] 13.900704
        Num handles: 1
        Handle: 1767 Address: DF:A9:FF:F6:B1:1A (OUI DF-A9-FF)
        Count: 1
        #71: len 21 (1 Kb/s)
        Latency: 166 msec (70-166 msec ~145 msec)
> ACL Data RX: Handle 1767 flags 0x02 dlen 21              #74 [hci1] 13.901019
      SMP: Pairing Random (0x04) len 16
        Random value: 6bad049fc848dea00000000000000000
< HCI Command: Host Number of Comp.. (0x03|0x0035) plen 5  #75 [hci1] 13.914368
        Num handles: 1
        Handle: 1767 Address: DF:A9:FF:F6:B1:1A (OUI DF-A9-FF)
        Count: 1
< ACL Data TX: Handle 1767 flags 0x00 dlen 21              #76 [hci1] 13.914400
      SMP: Pairing Random (0x04) len 16
        Random value: 8e6108f966a694cbe26df70bb96773e6
> HCI Event: Number of Completed Packets (0x13) plen 5     #77 [hci1] 14.075431
        Num handles: 1
        Handle: 1767 Address: DF:A9:FF:F6:B1:1A (OUI DF-A9-FF)
        Count: 1
        #76: len 21 (1 Kb/s)
        Latency: 161 msec (70-166 msec ~153 msec)
> ACL Data RX: Handle 1767 flags 0x02 dlen 21              #78 [hci1] 14.250843
      SMP: Pairing DHKey Check (0x0d) len 16
        E: b3316acb1c1e515b983202d81a37302a
< HCI Command: Host Number of Comp.. (0x03|0x0035) plen 5  #79 [hci1] 14.255033
        Num handles: 1
        Handle: 1767 Address: DF:A9:FF:F6:B1:1A (OUI DF-A9-FF)
        Count: 1
< ACL Data TX: Handle 1767 flags 0x00 dlen 21              #80 [hci1] 14.255085
      SMP: Pairing DHKey Check (0x0d) len 16
        E: 6b1348f6dcf55f73d4cb60b591b17251
> HCI Event: Number of Completed Packets (0x13) plen 5     #81 [hci1] 14.425500
        Num handles: 1
        Handle: 1767 Address: DF:A9:FF:F6:B1:1A (OUI DF-A9-FF)
        Count: 1
        #80: len 21 (0 Kb/s)
        Latency: 170 msec (70-170 msec ~161 msec)
> HCI Event: LE Meta Event (0x3e) plen 13                  #82 [hci1] 14.513591
      LE Long Term Key Request (0x05)
        Handle: 1767 Address: DF:A9:FF:F6:B1:1A (OUI DF-A9-FF)
        Random number: 0x0000000000000000
        Encrypted diversifier: 0x0000
< HCI Command: LE Long Term Key R.. (0x08|0x001a) plen 18  #83 [hci1] 14.514458
        Handle: 1767 Address: DF:A9:FF:F6:B1:1A (OUI DF-A9-FF)
        Long term key: b215d54050aeba2a4aa14ae4bbca96f3
> HCI Event: Command Complete (0x0e) plen 6                #84 [hci1] 14.515290
      LE Long Term Key Request Reply (0x08|0x001a) ncmd 1
        Status: Success (0x00)
        Handle: 1767 Address: DF:A9:FF:F6:B1:1A (OUI DF-A9-FF)
> HCI Event: Encryption Change (0x08) plen 4               #85 [hci1] 14.950743
        Status: Success (0x00)
        Handle: 1767 Address: DF:A9:FF:F6:B1:1A (OUI DF-A9-FF)
        Encryption: Enabled with AES-CCM (0x01)
> ACL Data RX: Handle 1767 flags 0x02 dlen 21              #86 [hci1] 15.038318
      SMP: Identity Information (0x08) len 16
        Identity resolving key: 28f32fd5458212ba2d42a4ced1f7e71d
< HCI Command: Host Number of Comp.. (0x03|0x0035) plen 5  #87 [hci1] 15.064829
        Num handles: 1
        Handle: 1767 Address: DF:A9:FF:F6:B1:1A (OUI DF-A9-FF)
        Count: 1
> ACL Data RX: Handle 1767 flags 0x02 dlen 12              #88 [hci1] 15.125665
      SMP: Identity Address Information (0x09) len 7
        Address: DF:A9:FF:F6:B1:1A (OUI DF-A9-FF)
> ACL Data RX: Handle 1767 flags 0x02 dlen 26              #89 [hci1] 15.126522
      LE L2CAP: Enhanced Credit Connection Request (0x17) ident 1 len 18
        PSM: 39 (0x0027)
        MTU: 64
        MPS: 64
        Credits: 5
        Source CID: 84
        Source CID: 83
        Source CID: 82
        Source CID: 81
        Source CID: 80
< HCI Command: LE Add Device To R.. (0x08|0x0027) plen 39  #90 [hci1] 15.134682
        Address type: Public (0x00)
        Address: DF:A9:FF:F6:B1:1A (OUI DF-A9-FF)
        Peer identity resolving key: 28f32fd5458212ba2d42a4ced1f7e71d
        Local identity resolving key: 00000000000000000000000000000000
> HCI Event: Command Complete (0x0e) plen 4                #91 [hci1] 15.135668
      LE Add Device To Resolving List (0x08|0x0027) ncmd 1
        Status: Success (0x00)
< HCI Command: LE Set Privacy Mode (0x08|0x004e) plen 8    #92 [hci1] 15.154348
        Peer Identity address type: Public (0x00)
        Peer Identity address: DF:A9:FF:F6:B1:1A (OUI DF-A9-FF)
        Privacy Mode: Use Device Privacy (0x01)
> HCI Event: Command Complete (0x0e) plen 4                #93 [hci1] 15.155060
      LE Set Privacy Mode (0x08|0x004e) ncmd 1
        Status: Success (0x00)
< HCI Command: LE Set Address Reso.. (0x08|0x002d) plen 1  #94 [hci1] 15.174415
        Address resolution: Enabled (0x01)
> HCI Event: Command Complete (0x0e) plen 4                #95 [hci1] 15.174867
      LE Set Address Resolution Enable (0x08|0x002d) ncmd 1
        Status: Success (0x00)
< HCI Command: Host Number of Comp.. (0x03|0x0035) plen 5  #96 [hci1] 15.194420
        Num handles: 1
        Handle: 1767 Address: DF:A9:FF:F6:B1:1A (OUI DF-A9-FF)
        Count: 1
< HCI Command: Host Number of Comp.. (0x03|0x0035) plen 5  #97 [hci1] 15.194784
        Num handles: 1
        Handle: 1767 Address: DF:A9:FF:F6:B1:1A (OUI DF-A9-FF)
        Count: 1
< ACL Data TX: Handle 1767 flags 0x00 dlen 26              #98 [hci1] 15.194860
      LE L2CAP: Enhanced Credit Connection Response (0x18) ident 1 len 18
        MTU: 249
        MPS: 251
        Credits: 1
        Result: Connection successful (0x0000)
        Destination CID: 64
        Destination CID: 65
        Destination CID: 66
        Destination CID: 67
        Destination CID: 68
> HCI Event: Number of Completed Packets (0x13) plen 5     #99 [hci1] 15.300444
        Num handles: 1
        Handle: 1767 Address: DF:A9:FF:F6:B1:1A (OUI DF-A9-FF)
        Count: 1
        #98: len 26 (1 Kb/s)
        Latency: 105 msec (70-170 msec ~133 msec)
< ACL Data TX: Handle 1767 flags 0x00 dlen 13             #100 [hci1] 17.614825
      Channel: 80 len 9 sdu 7 [PSM 39 mode Enhanced Credit (0x81)] {chan 4}
      ATT: Read By Type Request (0x08) len 6
        Handle range: 0x0001-0x01f3
        Attribute type: Characteristic (0x2803)
> HCI Event: Number of Completed Packets (0x13) plen 5    #101 [hci1] 17.750594
        Num handles: 1
        Handle: 1767 Address: DF:A9:FF:F6:B1:1A (OUI DF-A9-FF)
        Count: 1
        #100: len 13 (0 Kb/s)
        Latency: 135 msec (70-170 msec ~134 msec)
        Channel: 80 [PSM 39 mode Enhanced Credit (0x81)] {chan 4}
        Channel Latency: 135 msec (135-135 msec ~135 msec)
> ACL Data RX: Handle 1767 flags 0x02 dlen 15             #102 [hci1] 17.750965
      Channel: 68 len 11 sdu 9 [PSM 39 mode Enhanced Credit (0x81)] {chan 4}
      ATT: Read By Type Response (0x09) len 8
        Attribute data length: 7
        Attribute data list: 1 entry
        Handle: 0x0003
        Value: 0204000cb0
            Properties: 0x02
              Read (0x02)
            Value Handle: 0x0004
            Value UUID: Unknown (0xb00c)
< HCI Command: Host Number of Com.. (0x03|0x0035) plen 5  #103 [hci1] 17.754281
        Num handles: 1
        Handle: 1767 Address: DF:A9:FF:F6:B1:1A (OUI DF-A9-FF)
        Count: 1
< ACL Data TX: Handle 1767 flags 0x00 dlen 13             #104 [hci1] 17.754323
      Channel: 80 len 9 sdu 7 [PSM 39 mode Enhanced Credit (0x81)] {chan 4}
      ATT: Read By Type Request (0x08) len 6
        Handle range: 0x0004-0x01f3
        Attribute type: Characteristic (0x2803)
< ACL Data TX: Handle 1767 flags 0x00 dlen 12             #105 [hci1] 17.754375
      LE L2CAP: LE Flow Control Credit (0x16) ident 2 len 4
        Source CID: 68
        Credits: 1
> HCI Event: Number of Completed Packets (0x13) plen 5    #106 [hci1] 17.838483
        Num handles: 1
        Handle: 1767 Address: DF:A9:FF:F6:B1:1A (OUI DF-A9-FF)
        Count: 1
        #104: len 13 (1 Kb/s)
        Latency: 84 msec (70-170 msec ~109 msec)
        Channel: 80 [PSM 39 mode Enhanced Credit (0x81)] {chan 4}
        Channel Latency: 84 msec (84-135 msec ~109 msec)
> HCI Event: Number of Completed Packets (0x13) plen 5    #107 [hci1] 17.925681
        Num handles: 1
        Handle: 1767 Address: DF:A9:FF:F6:B1:1A (OUI DF-A9-FF)
        Count: 1
        #105: len 12 (0 Kb/s)
        Latency: 171 msec (70-171 msec ~140 msec)
        Channel: 80 [PSM 39 mode Enhanced Credit (0x81)] {chan 4}
        Channel Latency: 171 msec (84-171 msec ~140 msec)
> ACL Data RX: Handle 1767 flags 0x02 dlen 27             #108 [hci1] 17.926065
> ACL Data RX: Handle 1767 flags 0x01 dlen 2              #109 [hci1] 17.926180
      Channel: 68 len 25 sdu 23 [PSM 39 mode Enhanced Credit (0x81)] {chan 4}
      ATT: Read By Type Response (0x09) len 22
        Attribute data length: 21
        Attribute data list: 1 entry
        Handle: 0x0005
        Value: 020600efcdab8967452301000000000bb00000
            Properties: 0x02
              Read (0x02)
            Value Handle: 0x0006
            Value UUID: Vendor specific (0000b00b-0000-0000-0123-456789abcdef)
< HCI Command: Host Number of Com.. (0x03|0x0035) plen 5  #110 [hci1] 17.934335
        Num handles: 1
        Handle: 1767 Address: DF:A9:FF:F6:B1:1A (OUI DF-A9-FF)
        Count: 1
< HCI Command: Host Number of Com.. (0x03|0x0035) plen 5  #111 [hci1] 17.934355
        Num handles: 1
        Handle: 1767 Address: DF:A9:FF:F6:B1:1A (OUI DF-A9-FF)
        Count: 1
< ACL Data TX: Handle 1767 flags 0x00 dlen 13             #112 [hci1] 17.934370
      Channel: 80 len 9 sdu 7 [PSM 39 mode Enhanced Credit (0x81)] {chan 4}
      ATT: Read By Type Request (0x08) len 6
        Handle range: 0x0006-0x01f3
        Attribute type: Characteristic (0x2803)
< ACL Data TX: Handle 1767 flags 0x00 dlen 12             #113 [hci1] 17.934457
      LE L2CAP: LE Flow Control Credit (0x16) ident 3 len 4
        Source CID: 68
        Credits: 1
> HCI Event: Number of Completed Packets (0x13) plen 5    #114 [hci1] 18.013564
        Num handles: 1
        Handle: 1767 Address: DF:A9:FF:F6:B1:1A (OUI DF-A9-FF)
        Count: 1
        #112: len 13 (1 Kb/s)
        Latency: 79 msec (70-171 msec ~109 msec)
        Channel: 80 [PSM 39 mode Enhanced Credit (0x81)] {chan 4}
        Channel Latency: 79 msec (79-171 msec ~109 msec)
> HCI Event: Number of Completed Packets (0x13) plen 5    #115 [hci1] 18.100750
        Num handles: 1
        Handle: 1767 Address: DF:A9:FF:F6:B1:1A (OUI DF-A9-FF)
        Count: 1
        #113: len 12 (0 Kb/s)
        Latency: 166 msec (70-171 msec ~138 msec)
> ACL Data RX: Handle 1767 flags 0x02 dlen 27             #116 [hci1] 18.101028
> ACL Data RX: Handle 1767 flags 0x01 dlen 27             #117 [hci1] 18.101544
> ACL Data RX: Handle 1767 flags 0x01 dlen 10             #118 [hci1] 18.102113
      Channel: 68 len 60 sdu 58 [PSM 39 mode Enhanced Credit (0x81)] {chan 4}
      ATT: Read By Type Response (0x09) len 57
        Attribute data length: 7
        Attribute data list: 8 entries
        Handle: 0x0021
        Value: 202200052a
            Properties: 0x20
              Indicate (0x20)
            Value Handle: 0x0022
            Value UUID: Service Changed (0x2a05)
        Handle: 0x0024
        Value: 0a2500292b
            Properties: 0x0a
              Read (0x02)
              Write (0x08)
            Value Handle: 0x0025
            Value UUID: Client Supported Features (0x2b29)
        Handle: 0x0026
        Value: 0227003a2b
            Properties: 0x02
              Read (0x02)
            Value Handle: 0x0027
            Value UUID: Server Supported Features (0x2b3a)
        Handle: 0x0028
        Value: 0229002a2b
            Properties: 0x02
              Read (0x02)
            Value Handle: 0x0029
            Value UUID: Database Hash (0x2b2a)
        Handle: 0x0042
        Value: 02430001b0
            Properties: 0x02
              Read (0x02)
            Value Handle: 0x0043
            Value UUID: Unknown (0xb001)
        Handle: 0x0044
        Value: 0a450002b0
            Properties: 0x0a
              Read (0x02)
              Write (0x08)
            Value Handle: 0x0045
            Value UUID: Unknown (0xb002)
        Handle: 0x0046
        Value: 08470002b0
            Properties: 0x08
              Write (0x08)
            Value Handle: 0x0047
            Value UUID: Unknown (0xb002)
        Handle: 0x0048
        Value: 08490003b0
            Properties: 0x08
              Write (0x08)
            Value Handle: 0x0049
            Value UUID: Unknown (0xb003)
< HCI Command: Host Number of Com.. (0x03|0x0035) plen 5  #119 [hci1] 18.114340
        Num handles: 1
        Handle: 1767 Address: DF:A9:FF:F6:B1:1A (OUI DF-A9-FF)
        Count: 1
< HCI Command: Host Number of Com.. (0x03|0x0035) plen 5  #120 [hci1] 18.114348
        Num handles: 1
        Handle: 1767 Address: DF:A9:FF:F6:B1:1A (OUI DF-A9-FF)
        Count: 1
< HCI Command: Host Number of Com.. (0x03|0x0035) plen 5  #121 [hci1] 18.114362
        Num handles: 1
        Handle: 1767 Address: DF:A9:FF:F6:B1:1A (OUI DF-A9-FF)
        Count: 1
< ACL Data TX: Handle 1767 flags 0x00 dlen 13             #122 [hci1] 18.114384
      Channel: 80 len 9 sdu 7 [PSM 39 mode Enhanced Credit (0x81)] {chan 4}
      ATT: Read By Type Request (0x08) len 6
        Handle range: 0x0049-0x01f3
        Attribute type: Characteristic (0x2803)
< ACL Data TX: Handle 1767 flags 0x00 dlen 12             #123 [hci1] 18.114508
      LE L2CAP: LE Flow Control Credit (0x16) ident 4 len 4
        Source CID: 68
        Credits: 1
> HCI Event: Number of Completed Packets (0x13) plen 5    #124 [hci1] 18.188524
        Num handles: 1
        Handle: 1767 Address: DF:A9:FF:F6:B1:1A (OUI DF-A9-FF)
        Count: 1
        #122: len 13 (1 Kb/s)
        Latency: 74 msec (70-171 msec ~106 msec)
        Channel: 80 [PSM 39 mode Enhanced Credit (0x81)] {chan 4}
        Channel Latency: 74 msec (74-171 msec ~92 msec)
> HCI Event: Number of Completed Packets (0x13) plen 5    #125 [hci1] 18.275599
        Num handles: 1
        Handle: 1767 Address: DF:A9:FF:F6:B1:1A (OUI DF-A9-FF)
        Count: 1
        #123: len 12 (0 Kb/s)
        Latency: 161 msec (70-171 msec ~133 msec)
        Channel: 80 [PSM 39 mode Enhanced Credit (0x81)] {chan 4}
        Channel Latency: 161 msec (74-171 msec ~126 msec)
> ACL Data RX: Handle 1767 flags 0x02 dlen 12             #126 [hci1] 18.275764
      LE L2CAP: LE Flow Control Credit (0x16) ident 2 len 4
        Source CID: 80
        Credits: 10
> ACL Data RX: Handle 1767 flags 0x02 dlen 27             #127 [hci1] 18.276437
> ACL Data RX: Handle 1767 flags 0x01 dlen 27             #128 [hci1] 18.277229
> ACL Data RX: Handle 1767 flags 0x01 dlen 10             #129 [hci1] 18.277511
      Channel: 68 len 60 sdu 58 [PSM 39 mode Enhanced Credit (0x81)] {chan 4}
      ATT: Read By Type Response (0x09) len 57
        Attribute data length: 7
        Attribute data list: 8 entries
        Handle: 0x0061
        Value: 08620007b0
            Properties: 0x08
              Write (0x08)
            Value Handle: 0x0062
            Value UUID: Unknown (0xb007)
        Handle: 0x0081
        Value: 028200002a
            Properties: 0x02
              Read (0x02)
            Value Handle: 0x0082
            Value UUID: Device Name (0x2a00)
        Handle: 0x0083
        Value: 028400012a
            Properties: 0x02
              Read (0x02)
            Value Handle: 0x0084
            Value UUID: Appearance (0x2a01)
        Handle: 0x0085
        Value: 028600042a
            Properties: 0x02
              Read (0x02)
            Value Handle: 0x0086
            Value UUID: Peripheral Preferred Connection Parameters (0x2a04)
        Handle: 0x00a1
        Value: 3ea20006b0
            Properties: 0x3e
              Read (0x02)
              Write Without Response (0x04)
              Write (0x08)
              Notify (0x10)
              Indicate (0x20)
            Value Handle: 0x00a2
            Value UUID: Unknown (0xb006)
        Handle: 0x00c1
        Value: 0ac20004b0
            Properties: 0x0a
              Read (0x02)
              Write (0x08)
            Value Handle: 0x00c2
            Value UUID: Unknown (0xb004)
        Handle: 0x00c3
        Value: 0ac40004b0
            Properties: 0x0a
              Read (0x02)
              Write (0x08)
            Value Handle: 0x00c4
            Value UUID: Unknown (0xb004)
        Handle: 0x00c6
        Value: 00c70004b0
            Properties: 0x00
            Value Handle: 0x00c7
            Value UUID: Unknown (0xb004)
< HCI Command: Host Number of Com.. (0x03|0x0035) plen 5  #130 [hci1] 18.294315
        Num handles: 1
        Handle: 1767 Address: DF:A9:FF:F6:B1:1A (OUI DF-A9-FF)
        Count: 1
< HCI Command: Host Number of Com.. (0x03|0x0035) plen 5  #131 [hci1] 18.294337
        Num handles: 1
        Handle: 1767 Address: DF:A9:FF:F6:B1:1A (OUI DF-A9-FF)
        Count: 1
< HCI Command: Host Number of Com.. (0x03|0x0035) plen 5  #132 [hci1] 18.294355
        Num handles: 1
        Handle: 1767 Address: DF:A9:FF:F6:B1:1A (OUI DF-A9-FF)
        Count: 1
< HCI Command: Host Number of Com.. (0x03|0x0035) plen 5  #133 [hci1] 18.294370
        Num handles: 1
        Handle: 1767 Address: DF:A9:FF:F6:B1:1A (OUI DF-A9-FF)
        Count: 1
< ACL Data TX: Handle 1767 flags 0x00 dlen 13             #134 [hci1] 18.294682
      Channel: 80 len 9 sdu 7 [PSM 39 mode Enhanced Credit (0x81)] {chan 4}
      ATT: Read By Type Request (0x08) len 6
        Handle range: 0x00c7-0x01f3
        Attribute type: Characteristic (0x2803)
< ACL Data TX: Handle 1767 flags 0x00 dlen 12             #135 [hci1] 18.294779
      LE L2CAP: LE Flow Control Credit (0x16) ident 5 len 4
        Source CID: 68
        Credits: 1
> HCI Event: Number of Completed Packets (0x13) plen 5    #136 [hci1] 18.363506
        Num handles: 1
        Handle: 1767 Address: DF:A9:FF:F6:B1:1A (OUI DF-A9-FF)
        Count: 1
        #134: len 13 (1 Kb/s)
        Latency: 68 msec (68-171 msec ~101 msec)
> HCI Event: Number of Completed Packets (0x13) plen 5    #137 [hci1] 18.450768
        Num handles: 1
        Handle: 1767 Address: DF:A9:FF:F6:B1:1A (OUI DF-A9-FF)
        Count: 1
        #135: len 12 (0 Kb/s)
        Latency: 155 msec (68-171 msec ~128 msec)
        Channel: 80 [PSM 39 mode Enhanced Credit (0x81)] {chan 4}
        Channel Latency: 155 msec (74-171 msec ~141 msec)
> ACL Data RX: Handle 1767 flags 0x02 dlen 27             #138 [hci1] 18.451001
> ACL Data RX: Handle 1767 flags 0x01 dlen 2              #139 [hci1] 18.451088
      Channel: 68 len 25 sdu 23 [PSM 39 mode Enhanced Credit (0x81)] {chan 4}
      ATT: Read By Type Response (0x09) len 22
        Attribute data length: 7
        Attribute data list: 3 entries
        Handle: 0x00c9
        Value: 02ca0004b0
            Properties: 0x02
              Read (0x02)
            Value Handle: 0x00ca
            Value UUID: Unknown (0xb004)
        Handle: 0x00e1
        Value: 8ae20005b0
            Properties: 0x8a
              Read (0x02)
              Write (0x08)
            Unknown fields (0x80)
            Value Handle: 0x00e2
            Value UUID: Unknown (0xb005)
        Handle: 0x0101
        Value: 0a020108b0
            Properties: 0x0a
              Read (0x02)
              Write (0x08)
            Value Handle: 0x0102
            Value UUID: Unknown (0xb008)
< HCI Command: Host Number of Com.. (0x03|0x0035) plen 5  #140 [hci1] 18.454295
        Num handles: 1
        Handle: 1767 Address: DF:A9:FF:F6:B1:1A (OUI DF-A9-FF)
        Count: 1
< HCI Command: Host Number of Com.. (0x03|0x0035) plen 5  #141 [hci1] 18.454313
        Num handles: 1
        Handle: 1767 Address: DF:A9:FF:F6:B1:1A (OUI DF-A9-FF)
        Count: 1
< ACL Data TX: Handle 1767 flags 0x00 dlen 13             #142 [hci1] 18.454579
      Channel: 80 len 9 sdu 7 [PSM 39 mode Enhanced Credit (0x81)] {chan 4}
      ATT: Read By Type Request (0x08) len 6
        Handle range: 0x0102-0x01f3
        Attribute type: Characteristic (0x2803)
< ACL Data TX: Handle 1767 flags 0x00 dlen 12             #143 [hci1] 18.454584
      LE L2CAP: LE Flow Control Credit (0x16) ident 6 len 4
        Source CID: 68
        Credits: 1
> HCI Event: Number of Completed Packets (0x13) plen 5    #144 [hci1] 18.538526
        Num handles: 1
        Handle: 1767 Address: DF:A9:FF:F6:B1:1A (OUI DF-A9-FF)
        Count: 1
        #142: len 13 (1 Kb/s)
        Latency: 83 msec (68-171 msec ~106 msec)
        Channel: 80 [PSM 39 mode Enhanced Credit (0x81)] {chan 4}
        Channel Latency: 83 msec (74-171 msec ~112 msec)
> HCI Event: Number of Completed Packets (0x13) plen 5    #145 [hci1] 18.625633
        Num handles: 1
        Handle: 1767 Address: DF:A9:FF:F6:B1:1A (OUI DF-A9-FF)
        Count: 1
        #143: len 12 (0 Kb/s)
        Latency: 171 msec (68-171 msec ~138 msec)
> ACL Data RX: Handle 1767 flags 0x02 dlen 27             #146 [hci1] 18.626074
> ACL Data RX: Handle 1767 flags 0x01 dlen 2              #147 [hci1] 18.626190
      Channel: 68 len 25 sdu 23 [PSM 39 mode Enhanced Credit (0x81)] {chan 4}
      ATT: Read By Type Response (0x09) len 22
        Attribute data length: 21
        Attribute data list: 1 entry
        Handle: 0x0122
        Value: 8a2301efcdab89674523010000000009b00000
            Properties: 0x8a
              Read (0x02)
              Write (0x08)
            Unknown fields (0x80)
            Value Handle: 0x0123
            Value UUID: Vendor specific (0000b009-0000-0000-0123-456789abcdef)
< HCI Command: Host Number of Com.. (0x03|0x0035) plen 5  #148 [hci1] 18.634308
        Num handles: 1
        Handle: 1767 Address: DF:A9:FF:F6:B1:1A (OUI DF-A9-FF)
        Count: 1
< HCI Command: Host Number of Com.. (0x03|0x0035) plen 5  #149 [hci1] 18.634329
        Num handles: 1
        Handle: 1767 Address: DF:A9:FF:F6:B1:1A (OUI DF-A9-FF)
        Count: 1
< ACL Data TX: Handle 1767 flags 0x00 dlen 13             #150 [hci1] 18.634348
      Channel: 80 len 9 sdu 7 [PSM 39 mode Enhanced Credit (0x81)] {chan 4}
      ATT: Read By Type Request (0x08) len 6
        Handle range: 0x0123-0x01f3
        Attribute type: Characteristic (0x2803)
< ACL Data TX: Handle 1767 flags 0x00 dlen 12             #151 [hci1] 18.634376
      LE L2CAP: LE Flow Control Credit (0x16) ident 7 len 4
        Source CID: 68
        Credits: 1
> HCI Event: Number of Completed Packets (0x13) plen 5    #152 [hci1] 18.713464
        Num handles: 1
        Handle: 1767 Address: DF:A9:FF:F6:B1:1A (OUI DF-A9-FF)
        Count: 1
        #150: len 13 (1 Kb/s)
        Latency: 79 msec (68-171 msec ~108 msec)
        Channel: 80 [PSM 39 mode Enhanced Credit (0x81)] {chan 4}
        Channel Latency: 79 msec (74-171 msec ~95 msec)
> HCI Event: Number of Completed Packets (0x13) plen 5    #153 [hci1] 18.800785
        Num handles: 1
        Handle: 1767 Address: DF:A9:FF:F6:B1:1A (OUI DF-A9-FF)
        Count: 1
        #151: len 12 (0 Kb/s)
        Latency: 166 msec (68-171 msec ~137 msec)
        Channel: 80 [PSM 39 mode Enhanced Credit (0x81)] {chan 4}
        Channel Latency: 166 msec (74-171 msec ~131 msec)
> ACL Data RX: Handle 1767 flags 0x02 dlen 27             #154 [hci1] 18.801090
> ACL Data RX: Handle 1767 flags 0x01 dlen 27             #155 [hci1] 18.801543
> ACL Data RX: Handle 1767 flags 0x01 dlen 10             #156 [hci1] 18.801968
      Channel: 68 len 60 sdu 58 [PSM 39 mode Enhanced Credit (0x81)] {chan 4}
      ATT: Read By Type Response (0x09) len 57
        Attribute data length: 7
        Attribute data list: 8 entries
        Handle: 0x0141
        Value: 0242010eb0
            Properties: 0x02
              Read (0x02)
            Value Handle: 0x0142
            Value UUID: Unknown (0xb00e)
        Handle: 0x0144
        Value: 0a45010fb0
            Properties: 0x0a
              Read (0x02)
              Write (0x08)
            Value Handle: 0x0145
            Value UUID: Unknown (0xb00f)
        Handle: 0x0147
        Value: 0a480106b0
            Properties: 0x0a
              Read (0x02)
              Write (0x08)
            Value Handle: 0x0148
            Value UUID: Unknown (0xb006)
        Handle: 0x014a
        Value: 0a4b0107b0
            Properties: 0x0a
              Read (0x02)
              Write (0x08)
            Value Handle: 0x014b
            Value UUID: Unknown (0xb007)
        Handle: 0x014d
        Value: 024e0110b0
            Properties: 0x02
              Read (0x02)
            Value Handle: 0x014e
            Value UUID: Unknown (0xb010)
        Handle: 0x0150
        Value: 42510111b0
            Properties: 0x42
              Read (0x02)
              Authorize (0x40)
              Extended Properties (0x80)
            Value Handle: 0x0151
            Value UUID: Unknown (0xb011)
        Handle: 0x0152
        Value: 02530110b0
            Properties: 0x02
              Read (0x02)
            Value Handle: 0x0153
            Value UUID: Unknown (0xb010)
        Handle: 0x0155
        Value: 02560110b0
            Properties: 0x02
              Read (0x02)
            Value Handle: 0x0156
            Value UUID: Unknown (0xb010)
< HCI Command: Host Number of Com.. (0x03|0x0035) plen 5  #157 [hci1] 18.814327
        Num handles: 1
        Handle: 1767 Address: DF:A9:FF:F6:B1:1A (OUI DF-A9-FF)
        Count: 1
< HCI Command: Host Number of Com.. (0x03|0x0035) plen 5  #158 [hci1] 18.814348
        Num handles: 1
        Handle: 1767 Address: DF:A9:FF:F6:B1:1A (OUI DF-A9-FF)
        Count: 1
< HCI Command: Host Number of Com.. (0x03|0x0035) plen 5  #159 [hci1] 18.814370
        Num handles: 1
        Handle: 1767 Address: DF:A9:FF:F6:B1:1A (OUI DF-A9-FF)
        Count: 1
< ACL Data TX: Handle 1767 flags 0x00 dlen 13             #160 [hci1] 18.814455
      Channel: 80 len 9 sdu 7 [PSM 39 mode Enhanced Credit (0x81)] {chan 4}
      ATT: Read By Type Request (0x08) len 6
        Handle range: 0x0156-0x01f3
        Attribute type: Characteristic (0x2803)
< ACL Data TX: Handle 1767 flags 0x00 dlen 12             #161 [hci1] 18.814516
      LE L2CAP: LE Flow Control Credit (0x16) ident 8 len 4
        Source CID: 68
        Credits: 1
> HCI Event: Number of Completed Packets (0x13) plen 5    #162 [hci1] 18.888571
        Num handles: 1
        Handle: 1767 Address: DF:A9:FF:F6:B1:1A (OUI DF-A9-FF)
        Count: 1
        #160: len 13 (1 Kb/s)
        Latency: 74 msec (68-171 msec ~105 msec)
> HCI Event: Number of Completed Packets (0x13) plen 5    #163 [hci1] 18.975700
        Num handles: 1
        Handle: 1767 Address: DF:A9:FF:F6:B1:1A (OUI DF-A9-FF)
        Count: 1
        #161: len 12 (0 Kb/s)
        Latency: 161 msec (68-171 msec ~133 msec)
        Channel: 80 [PSM 39 mode Enhanced Credit (0x81)] {chan 4}
        Channel Latency: 161 msec (74-171 msec ~146 msec)
> ACL Data RX: Handle 1767 flags 0x02 dlen 27             #164 [hci1] 18.976090
> ACL Data RX: Handle 1767 flags 0x01 dlen 27             #165 [hci1] 18.976587
> ACL Data RX: Handle 1767 flags 0x01 dlen 10             #166 [hci1] 18.976929
      Channel: 68 len 60 sdu 58 [PSM 39 mode Enhanced Credit (0x81)] {chan 4}
      ATT: Read By Type Response (0x09) len 57
        Attribute data length: 7
        Attribute data list: 8 entries
        Handle: 0x0158
        Value: 02590110b0
            Properties: 0x02
              Read (0x02)
            Value Handle: 0x0159
            Value UUID: Unknown (0xb010)
        Handle: 0x015b
        Value: 025c0110b0
            Properties: 0x02
              Read (0x02)
            Value Handle: 0x015c
            Value UUID: Unknown (0xb010)
        Handle: 0x0171
        Value: 0272010ab0
            Properties: 0x02
              Read (0x02)
            Value Handle: 0x0172
            Value UUID: Unknown (0xb00a)
        Handle: 0x0173
        Value: 0a740102b0
            Properties: 0x0a
              Read (0x02)
              Write (0x08)
            Value Handle: 0x0174
            Value UUID: Unknown (0xb002)
        Handle: 0x0176
        Value: 0a770102b0
            Properties: 0x0a
              Read (0x02)
              Write (0x08)
            Value Handle: 0x0177
            Value UUID: Unknown (0xb002)
        Handle: 0x0179
        Value: 0a7a0102b0
            Properties: 0x0a
              Read (0x02)
              Write (0x08)
            Value Handle: 0x017a
            Value UUID: Unknown (0xb002)
        Handle: 0x017c
        Value: 0a7d0102b0
            Properties: 0x0a
              Read (0x02)
              Write (0x08)
            Value Handle: 0x017d
            Value UUID: Unknown (0xb002)
        Handle: 0x017f
        Value: 0a800102b0
            Properties: 0x0a
              Read (0x02)
              Write (0x08)
            Value Handle: 0x0180
            Value UUID: Unknown (0xb002)
< HCI Command: Host Number of Com.. (0x03|0x0035) plen 5  #167 [hci1] 18.994300
        Num handles: 1
        Handle: 1767 Address: DF:A9:FF:F6:B1:1A (OUI DF-A9-FF)
        Count: 1
< HCI Command: Host Number of Com.. (0x03|0x0035) plen 5  #168 [hci1] 18.994317
        Num handles: 1
        Handle: 1767 Address: DF:A9:FF:F6:B1:1A (OUI DF-A9-FF)
        Count: 1
< HCI Command: Host Number of Com.. (0x03|0x0035) plen 5  #169 [hci1] 18.994341
        Num handles: 1
        Handle: 1767 Address: DF:A9:FF:F6:B1:1A (OUI DF-A9-FF)
        Count: 1
< ACL Data TX: Handle 1767 flags 0x00 dlen 13             #170 [hci1] 18.994364
      Channel: 80 len 9 sdu 7 [PSM 39 mode Enhanced Credit (0x81)] {chan 4}
      ATT: Read By Type Request (0x08) len 6
        Handle range: 0x0180-0x01f3
        Attribute type: Characteristic (0x2803)
< ACL Data TX: Handle 1767 flags 0x00 dlen 12             #171 [hci1] 18.994387
      LE L2CAP: LE Flow Control Credit (0x16) ident 9 len 4
        Source CID: 68
        Credits: 1
> HCI Event: Number of Completed Packets (0x13) plen 5    #172 [hci1] 19.063519
        Num handles: 1
        Handle: 1767 Address: DF:A9:FF:F6:B1:1A (OUI DF-A9-FF)
        Count: 1
        #170: len 13 (1 Kb/s)
        Latency: 69 msec (68-171 msec ~101 msec)
        Channel: 80 [PSM 39 mode Enhanced Credit (0x81)] {chan 4}
        Channel Latency: 69 msec (69-171 msec ~107 msec)
> HCI Event: Number of Completed Packets (0x13) plen 5    #173 [hci1] 19.150786
        Num handles: 1
        Handle: 1767 Address: DF:A9:FF:F6:B1:1A (OUI DF-A9-FF)
        Count: 1
        #171: len 12 (0 Kb/s)
        Latency: 156 msec (68-171 msec ~128 msec)
> ACL Data RX: Handle 1767 flags 0x02 dlen 27             #174 [hci1] 19.151083
> ACL Data RX: Handle 1767 flags 0x01 dlen 27             #175 [hci1] 19.151504
> ACL Data RX: Handle 1767 flags 0x01 dlen 10             #176 [hci1] 19.151947
      Channel: 68 len 60 sdu 58 [PSM 39 mode Enhanced Credit (0x81)] {chan 4}
      ATT: Read By Type Response (0x09) len 57
        Attribute data length: 7
        Attribute data list: 8 entries
        Handle: 0x0182
        Value: 0a830102b0
            Properties: 0x0a
              Read (0x02)
              Write (0x08)
            Value Handle: 0x0183
            Value UUID: Unknown (0xb002)
        Handle: 0x0185
        Value: 0a860102b0
            Properties: 0x0a
              Read (0x02)
              Write (0x08)
            Value Handle: 0x0186
            Value UUID: Unknown (0xb002)
        Handle: 0x0188
        Value: 0a890102b0
            Properties: 0x0a
              Read (0x02)
              Write (0x08)
            Value Handle: 0x0189
            Value UUID: Unknown (0xb002)
        Handle: 0x018b
        Value: 0a8c0102b0
            Properties: 0x0a
              Read (0x02)
              Write (0x08)
            Value Handle: 0x018c
            Value UUID: Unknown (0xb002)
        Handle: 0x018e
        Value: 0a8f0104b0
            Properties: 0x0a
              Read (0x02)
              Write (0x08)
            Value Handle: 0x018f
            Value UUID: Unknown (0xb004)
        Handle: 0x0191
        Value: 0a920104b0
            Properties: 0x0a
              Read (0x02)
              Write (0x08)
            Value Handle: 0x0192
            Value UUID: Unknown (0xb004)
        Handle: 0x0194
        Value: 0a950104b0
            Properties: 0x0a
              Read (0x02)
              Write (0x08)
            Value Handle: 0x0195
            Value UUID: Unknown (0xb004)
        Handle: 0x0197
        Value: 0a980101b0
            Properties: 0x0a
              Read (0x02)
              Write (0x08)
            Value Handle: 0x0198
            Value UUID: Unknown (0xb001)
< HCI Command: Host Number of Com.. (0x03|0x0035) plen 5  #177 [hci1] 19.154258
        Num handles: 1
        Handle: 1767 Address: DF:A9:FF:F6:B1:1A (OUI DF-A9-FF)
        Count: 1
< HCI Command: Host Number of Com.. (0x03|0x0035) plen 5  #178 [hci1] 19.154300
        Num handles: 1
        Handle: 1767 Address: DF:A9:FF:F6:B1:1A (OUI DF-A9-FF)
        Count: 1
< HCI Command: Host Number of Com.. (0x03|0x0035) plen 5  #179 [hci1] 19.154314
        Num handles: 1
        Handle: 1767 Address: DF:A9:FF:F6:B1:1A (OUI DF-A9-FF)
        Count: 1
< ACL Data TX: Handle 1767 flags 0x00 dlen 13             #180 [hci1] 19.154374
      Channel: 80 len 9 sdu 7 [PSM 39 mode Enhanced Credit (0x81)] {chan 4}
      ATT: Read By Type Request (0x08) len 6
        Handle range: 0x0198-0x01f3
        Attribute type: Characteristic (0x2803)
< ACL Data TX: Handle 1767 flags 0x00 dlen 12             #181 [hci1] 19.154405
      LE L2CAP: LE Flow Control Credit (0x16) ident 10 len 4
        Source CID: 68
        Credits: 1
> HCI Event: Number of Completed Packets (0x13) plen 5    #182 [hci1] 19.238466
        Num handles: 1
        Handle: 1767 Address: DF:A9:FF:F6:B1:1A (OUI DF-A9-FF)
        Count: 1
        #180: len 13 (1 Kb/s)
        Latency: 84 msec (68-171 msec ~106 msec)
        Channel: 80 [PSM 39 mode Enhanced Credit (0x81)] {chan 4}
        Channel Latency: 84 msec (69-171 msec ~95 msec)
> HCI Event: Number of Completed Packets (0x13) plen 5    #183 [hci1] 19.325761
        Num handles: 1
        Handle: 1767 Address: DF:A9:FF:F6:B1:1A (OUI DF-A9-FF)
        Count: 1
        #181: len 12 (0 Kb/s)
        Latency: 171 msec (68-171 msec ~138 msec)
        Channel: 80 [PSM 39 mode Enhanced Credit (0x81)] {chan 4}
        Channel Latency: 171 msec (69-171 msec ~133 msec)
> ACL Data RX: Handle 1767 flags 0x02 dlen 27             #184 [hci1] 19.326086
> ACL Data RX: Handle 1767 flags 0x01 dlen 27             #185 [hci1] 19.326562
> ACL Data RX: Handle 1767 flags 0x01 dlen 10             #186 [hci1] 19.326961
      Channel: 68 len 60 sdu 58 [PSM 39 mode Enhanced Credit (0x81)] {chan 4}
      ATT: Read By Type Response (0x09) len 57
        Attribute data length: 7
        Attribute data list: 8 entries
        Handle: 0x019a
        Value: 0a9b0102b0
            Properties: 0x0a
              Read (0x02)
              Write (0x08)
            Value Handle: 0x019b
            Value UUID: Unknown (0xb002)
        Handle: 0x019d
        Value: 0a9e0102b0
            Properties: 0x0a
              Read (0x02)
              Write (0x08)
            Value Handle: 0x019e
            Value UUID: Unknown (0xb002)
        Handle: 0x01a0
        Value: 0aa10102b0
            Properties: 0x0a
              Read (0x02)
              Write (0x08)
            Value Handle: 0x01a1
            Value UUID: Unknown (0xb002)
        Handle: 0x01a3
        Value: 0aa40118b0
            Properties: 0x0a
              Read (0x02)
              Write (0x08)
            Value Handle: 0x01a4
            Value UUID: Unknown (0xb018)
        Handle: 0x01a6
        Value: 0aa70119b0
            Properties: 0x0a
              Read (0x02)
              Write (0x08)
            Value Handle: 0x01a7
            Value UUID: Unknown (0xb019)
        Handle: 0x01a9
        Value: 0aaa0120b0
            Properties: 0x0a
              Read (0x02)
              Write (0x08)
            Value Handle: 0x01aa
            Value UUID: Unknown (0xb020)
        Handle: 0x01ac
        Value: 0aad0101b0
            Properties: 0x0a
              Read (0x02)
              Write (0x08)
            Value Handle: 0x01ad
            Value UUID: Unknown (0xb001)
        Handle: 0x01af
        Value: 0ab00118b0
            Properties: 0x0a
              Read (0x02)
              Write (0x08)
            Value Handle: 0x01b0
            Value UUID: Unknown (0xb018)
< HCI Command: Host Number of Com.. (0x03|0x0035) plen 5  #187 [hci1] 19.334309
        Num handles: 1
        Handle: 1767 Address: DF:A9:FF:F6:B1:1A (OUI DF-A9-FF)
        Count: 1
< HCI Command: Host Number of Com.. (0x03|0x0035) plen 5  #188 [hci1] 19.334341
        Num handles: 1
        Handle: 1767 Address: DF:A9:FF:F6:B1:1A (OUI DF-A9-FF)
        Count: 1
< HCI Command: Host Number of Com.. (0x03|0x0035) plen 5  #189 [hci1] 19.334355
        Num handles: 1
        Handle: 1767 Address: DF:A9:FF:F6:B1:1A (OUI DF-A9-FF)
        Count: 1
< ACL Data TX: Handle 1767 flags 0x00 dlen 13             #190 [hci1] 19.334407
      Channel: 80 len 9 sdu 7 [PSM 39 mode Enhanced Credit (0x81)] {chan 4}
      ATT: Read By Type Request (0x08) len 6
        Handle range: 0x01b0-0x01f3
        Attribute type: Characteristic (0x2803)
< ACL Data TX: Handle 1767 flags 0x00 dlen 12             #191 [hci1] 19.334429
      LE L2CAP: LE Flow Control Credit (0x16) ident 11 len 4
        Source CID: 68
        Credits: 1
> HCI Event: Number of Completed Packets (0x13) plen 5    #192 [hci1] 19.413455
        Num handles: 1
        Handle: 1767 Address: DF:A9:FF:F6:B1:1A (OUI DF-A9-FF)
        Count: 1
        #190: len 13 (1 Kb/s)
        Latency: 79 msec (68-171 msec ~108 msec)
> HCI Event: Number of Completed Packets (0x13) plen 5    #193 [hci1] 19.500590
        Num handles: 1
        Handle: 1767 Address: DF:A9:FF:F6:B1:1A (OUI DF-A9-FF)
        Count: 1
        #191: len 12 (0 Kb/s)
        Latency: 166 msec (68-171 msec ~137 msec)
        Channel: 80 [PSM 39 mode Enhanced Credit (0x81)] {chan 4}
        Channel Latency: 166 msec (69-171 msec ~149 msec)
> ACL Data RX: Handle 1767 flags 0x02 dlen 15             #194 [hci1] 19.500995
      Channel: 68 len 11 sdu 9 [PSM 39 mode Enhanced Credit (0x81)] {chan 4}
      ATT: Read By Type Response (0x09) len 8
        Attribute data length: 7
        Attribute data list: 1 entry
        Handle: 0x01f1
        Value: 20f2011c2a
            Properties: 0x20
              Indicate (0x20)
            Value Handle: 0x01f2
            Value UUID: Temperature Measurement (0x2a1c)
< HCI Command: Host Number of Com.. (0x03|0x0035) plen 5  #195 [hci1] 19.514321
        Num handles: 1
        Handle: 1767 Address: DF:A9:FF:F6:B1:1A (OUI DF-A9-FF)
        Count: 1
< ACL Data TX: Handle 1767 flags 0x00 dlen 13             #196 [hci1] 19.514338
      Channel: 80 len 9 sdu 7 [PSM 39 mode Enhanced Credit (0x81)] {chan 4}
      ATT: Read By Type Request (0x08) len 6
        Handle range: 0x01f2-0x01f3
        Attribute type: Characteristic (0x2803)
< ACL Data TX: Handle 1767 flags 0x00 dlen 12             #197 [hci1] 19.514363
      LE L2CAP: LE Flow Control Credit (0x16) ident 12 len 4
        Source CID: 68
        Credits: 1
> HCI Event: Number of Completed Packets (0x13) plen 5    #198 [hci1] 19.588585
        Num handles: 1
        Handle: 1767 Address: DF:A9:FF:F6:B1:1A (OUI DF-A9-FF)
        Count: 1
        #196: len 13 (1 Kb/s)
        Latency: 74 msec (68-171 msec ~105 msec)
        Channel: 80 [PSM 39 mode Enhanced Credit (0x81)] {chan 4}
        Channel Latency: 74 msec (69-171 msec ~112 msec)
> HCI Event: Number of Completed Packets (0x13) plen 5    #199 [hci1] 19.675551
        Num handles: 1
        Handle: 1767 Address: DF:A9:FF:F6:B1:1A (OUI DF-A9-FF)
        Count: 1
        #197: len 12 (0 Kb/s)
        Latency: 161 msec (68-171 msec ~133 msec)
> ACL Data RX: Handle 1767 flags 0x02 dlen 11             #200 [hci1] 19.675892
      Channel: 68 len 7 sdu 5 [PSM 39 mode Enhanced Credit (0x81)] {chan 4}
      ATT: Error Response (0x01) len 4
        Read By Type Request (0x08)
        Handle: 0x01f2
        Error: Attribute Not Found (0x0a)
< HCI Command: Host Number of Com.. (0x03|0x0035) plen 5  #201 [hci1] 19.694399
        Num handles: 1
        Handle: 1767 Address: DF:A9:FF:F6:B1:1A (OUI DF-A9-FF)
        Count: 1
< ACL Data TX: Handle 1767 flags 0x00 dlen 11             #202 [hci1] 19.694415
      Channel: 80 len 7 sdu 5 [PSM 39 mode Enhanced Credit (0x81)] {chan 4}
      ATT: Write Request (0x12) len 4
        Handle: 0x01f3
          Data: 0200
< ACL Data TX: Handle 1767 flags 0x00 dlen 12             #203 [hci1] 19.694490
      LE L2CAP: LE Flow Control Credit (0x16) ident 13 len 4
        Source CID: 68
        Credits: 1
> HCI Event: Number of Completed Packets (0x13) plen 5    #204 [hci1] 19.763450
        Num handles: 1
        Handle: 1767 Address: DF:A9:FF:F6:B1:1A (OUI DF-A9-FF)
        Count: 1
        #202: len 11 (1 Kb/s)
        Latency: 69 msec (68-171 msec ~101 msec)
        Channel: 80 [PSM 39 mode Enhanced Credit (0x81)] {chan 4}
        Channel Latency: 69 msec (69-171 msec ~90 msec)
> HCI Event: Number of Completed Packets (0x13) plen 5    #205 [hci1] 19.850532
        Num handles: 1
        Handle: 1767 Address: DF:A9:FF:F6:B1:1A (OUI DF-A9-FF)
        Count: 1
        #203: len 12 (0 Kb/s)
        Latency: 156 msec (68-171 msec ~128 msec)
        Channel: 80 [PSM 39 mode Enhanced Credit (0x81)] {chan 4}
        Channel Latency: 156 msec (69-171 msec ~123 msec)
> ACL Data RX: Handle 1767 flags 0x02 dlen 7              #206 [hci1] 19.850860
      Channel: 68 len 3 sdu 1 [PSM 39 mode Enhanced Credit (0x81)] {chan 4}
      ATT: Write Response (0x13) len 0
< HCI Command: Host Number of Com.. (0x03|0x0035) plen 5  #207 [hci1] 19.854389
        Num handles: 1
        Handle: 1767 Address: DF:A9:FF:F6:B1:1A (OUI DF-A9-FF)
        Count: 1
< ACL Data TX: Handle 1767 flags 0x00 dlen 12             #208 [hci1] 19.854435
      LE L2CAP: LE Flow Control Credit (0x16) ident 14 len 4
        Source CID: 68
        Credits: 1
> HCI Event: Number of Completed Packets (0x13) plen 5    #209 [hci1] 20.025683
        Num handles: 1
        Handle: 1767 Address: DF:A9:FF:F6:B1:1A (OUI DF-A9-FF)
        Count: 1
        #208: len 12 (0 Kb/s)
        Latency: 171 msec (68-171 msec ~149 msec)
> ACL Data RX: Handle 1767 flags 0x02 dlen 14             #210 [hci1] 20.025779
      Channel: 68 len 10 sdu 8 [PSM 39 mode Enhanced Credit (0x81)] {chan 4}
      ATT: Handle Value Indication (0x1d) len 7
        Handle: 0x01f2
          Data: 01760100ff
< HCI Command: Host Number of Com.. (0x03|0x0035) plen 5  #211 [hci1] 20.034462
        Num handles: 1
        Handle: 1767 Address: DF:A9:FF:F6:B1:1A (OUI DF-A9-FF)
        Count: 1
< ACL Data TX: Handle 1767 flags 0x00 dlen 7              #212 [hci1] 20.034472
      Channel: 80 len 3 sdu 1 [PSM 39 mode Enhanced Credit (0x81)] {chan 4}
      ATT: Handle Value Confirmation (0x1e) len 0
< ACL Data TX: Handle 1767 flags 0x00 dlen 12             #213 [hci1] 20.034483
      LE L2CAP: LE Flow Control Credit (0x16) ident 15 len 4
        Source CID: 68
        Credits: 1
> HCI Event: Number of Completed Packets (0x13) plen 5    #214 [hci1] 20.113570
        Num handles: 1
        Handle: 1767 Address: DF:A9:FF:F6:B1:1A (OUI DF-A9-FF)
        Count: 1
        #212: len 7 (0 Kb/s)
        Latency: 79 msec (68-171 msec ~114 msec)
        Channel: 80 [PSM 39 mode Enhanced Credit (0x81)] {chan 4}
        Channel Latency: 79 msec (69-171 msec ~101 msec)
> HCI Event: Number of Completed Packets (0x13) plen 5    #215 [hci1] 20.200613
        Num handles: 1
        Handle: 1767 Address: DF:A9:FF:F6:B1:1A (OUI DF-A9-FF)
        Count: 1
        #213: len 12 (0 Kb/s)
        Latency: 166 msec (68-171 msec ~140 msec)
        Channel: 80 [PSM 39 mode Enhanced Credit (0x81)] {chan 4}
        Channel Latency: 166 msec (69-171 msec ~133 msec)
> ACL Data RX: Handle 1767 flags 0x02 dlen 12             #216 [hci1] 20.200813
      LE L2CAP: LE Flow Control Credit (0x16) ident 3 len 4
        Source CID: 80
        Credits: 10
< HCI Command: Host Number of Com.. (0x03|0x0035) plen 5  #217 [hci1] 20.214869
        Num handles: 1
        Handle: 1767 Address: DF:A9:FF:F6:B1:1A (OUI DF-A9-FF)
        Count: 1
> HCI Event: Disconnect Complete (0x05) plen 4            #218 [hci1] 21.338201
        Status: Success (0x00)
        Handle: 1767 Address: DF:A9:FF:F6:B1:1A (OUI DF-A9-FF)
        Reason: Remote User Terminated Connection (0x13)
< HCI Command: Reset (0x03|0x0003) plen 0                 #219 [hci1] 28.284248
> HCI Event: Command Complete (0x0e) plen 4               #220 [hci1] 28.284718
      Reset (0x03|0x0003) ncmd 1
        Status: Success (0x00)
@ USER Close: main                                    {0x0001} [hci1] 28.294196
= Close Index: 00:00:00:00:00:00                               [hci1] 28.294204
