Bluetooth monitor ver 5.72
= Note: Linux version 6.14.0-36-generic (x86_64)                       0.682193
= Note: Bluetooth subsystem version 2.22                               0.682196
= New Index: 00:00:00:00:00:00 (Primary,UART,hci1)              [hci1] 0.682196
= New Index: 48:5F:99:8E:E0:64 (Primary,USB,hci0)               [hci0] 0.682197
= Open Index: 00:00:00:00:00:00                                 [hci1] 0.796013
= Index Info: 00:00:00:00:00:00 (Nordic Semiconductor ASA)      [hci1] 0.796028
@ USER Open: main (privileged) version 2.22            {0x0001} [hci1] 0.796037
< HCI Command: Reset (0x03|0x0003) plen 0                    #1 [hci1] 0.797432
> HCI Event: Command Complete (0x0e) plen 4                  #2 [hci1] 0.797901
      Reset (0x03|0x0003) ncmd 1
        Status: Success (0x00)
< HCI Command: Read Local Supported... (0x04|0x0003) plen 0  #3 [hci1] 0.815791
> HCI Event: Command Complete (0x0e) plen 12                 #4 [hci1] 0.816443
      Read Local Supported Features (0x04|0x0003) ncmd 1
        Status: Success (0x00)
        Features: 0x00 0x00 0x00 0x00 0x60 0x00 0x00 0x00
          BR/EDR Not Supported
          LE Supported (Controller)
< HCI Command: Read Local Version In.. (0x04|0x0001) plen 0  #5 [hci1] 0.835455
> HCI Event: Command Complete (0x0e) plen 12                 #6 [hci1] 0.835934
      Read Local Version Information (0x04|0x0001) ncmd 1
        Status: Success (0x00)
        HCI version: Reserved (0x0f) - Revision 12393 (0x3069)
        LMP version: Reserved (0x0f) - Subversion 12393 (0x3069)
        Manufacturer: Nordic Semiconductor ASA (89)
< HCI Command: Read Local Supported... (0x04|0x0002) plen 0  #7 [hci1] 0.855376
> HCI Event: Command Complete (0x0e) plen 68                 #8 [hci1] 0.856520
      Read Local Supported Commands (0x04|0x0002) ncmd 1
        Status: Success (0x00)
        Commands: 119 entries
          Disconnect (Octet 0 - Bit 5)
          Read Remote Version Information (Octet 2 - Bit 7)
          Set Event Mask (Octet 5 - Bit 6)
          Reset (Octet 5 - Bit 7)
          Read Connection Accept Timeout (Octet 7 - Bit 2)
          Write Connection Accept Timeout (Octet 7 - Bit 3)
          Read Transmit Power Level (Octet 10 - Bit 2)
          Set Controller To Host Flow Control (Octet 10 - Bit 5)
          Host Buffer Size (Octet 10 - Bit 6)
          Host Number of Completed Packets (Octet 10 - Bit 7)
          Read Local Version Information (Octet 14 - Bit 3)
          Read Local Supported Features (Octet 14 - Bit 5)
          Read BD ADDR (Octet 15 - Bit 1)
          Read RSSI (Octet 15 - Bit 5)
          Set Event Mask Page 2 (Octet 22 - Bit 2)
          LE Set Event Mask (Octet 25 - Bit 0)
          LE Read Buffer Size (Octet 25 - Bit 1)
          LE Read Local Supported Features (Octet 25 - Bit 2)
          LE Set Random Address (Octet 25 - Bit 4)
          LE Set Advertising Parameters (Octet 25 - Bit 5)
          LE Read Advertising Channel TX Power (Octet 25 - Bit 6)
          LE Set Advertising Data (Octet 25 - Bit 7)
          LE Set Scan Response Data (Octet 26 - Bit 0)
          LE Set Advertise Enable (Octet 26 - Bit 1)
          LE Set Scan Parameters (Octet 26 - Bit 2)
          LE Set Scan Enable (Octet 26 - Bit 3)
          LE Create Connection (Octet 26 - Bit 4)
          LE Create Connection Cancel (Octet 26 - Bit 5)
          LE Read Accept List Size (Octet 26 - Bit 6)
          LE Clear Accept List (Octet 26 - Bit 7)
          LE Add Device To Accept List (Octet 27 - Bit 0)
          LE Remove Device From Accept List (Octet 27 - Bit 1)
          LE Connection Update (Octet 27 - Bit 2)
          LE Set Host Channel Classification (Octet 27 - Bit 3)
          LE Read Channel Map (Octet 27 - Bit 4)
          LE Read Remote Used Features (Octet 27 - Bit 5)
          LE Encrypt (Octet 27 - Bit 6)
          LE Rand (Octet 27 - Bit 7)
          LE Start Encryption (Octet 28 - Bit 0)
          LE Long Term Key Request Reply (Octet 28 - Bit 1)
          LE Long Term Key Request Neg Reply (Octet 28 - Bit 2)
          LE Read Supported States (Octet 28 - Bit 3)
          LE Receiver Test (Octet 28 - Bit 4)
          LE Transmitter Test (Octet 28 - Bit 5)
          LE Test End (Octet 28 - Bit 6)
          Read Authenticated Payload Timeout (Octet 32 - Bit 4)
          Write Authenticated Payload Timeout (Octet 32 - Bit 5)
          LE Set Data Length (Octet 33 - Bit 6)
          LE Read Suggested Default Data Length (Octet 33 - Bit 7)
          LE Write Suggested Default Data Length (Octet 34 - Bit 0)
          LE Add Device To Resolving List (Octet 34 - Bit 3)
          LE Remove Device From Resolving List (Octet 34 - Bit 4)
          LE Clear Resolving List (Octet 34 - Bit 5)
          LE Read Resolving List Size (Octet 34 - Bit 6)
          LE Set Address Resolution Enable (Octet 35 - Bit 1)
          LE Set Resolvable Private Address Timeout (Octet 35 - Bit 2)
          LE Read Maximum Data Length (Octet 35 - Bit 3)
          LE Read PHY (Octet 35 - Bit 4)
          LE Set Default PHY (Octet 35 - Bit 5)
          LE Set PHY (Octet 35 - Bit 6)
          LE Enhanced Receiver Test (Octet 35 - Bit 7)
          LE Enhanced Transmitter Test (Octet 36 - Bit 0)
          LE Set Advertising Set Random Address (Octet 36 - Bit 1)
          LE Set Extended Advertising Parameters (Octet 36 - Bit 2)
          LE Set Extended Advertising Data (Octet 36 - Bit 3)
          LE Set Extended Scan Response Data (Octet 36 - Bit 4)
          LE Set Extended Advertising Enable (Octet 36 - Bit 5)
          LE Read Maximum Advertising Data Length (Octet 36 - Bit 6)
          LE Read Number of Supported Advertising Sets (Octet 36 - Bit 7)
          LE Remove Advertising Set (Octet 37 - Bit 0)
          LE Clear Advertising Sets (Octet 37 - Bit 1)
          LE Set Periodic Advertising Parameters (Octet 37 - Bit 2)
          LE Set Periodic Advertising Data (Octet 37 - Bit 3)
          LE Set Periodic Advertising Enable (Octet 37 - Bit 4)
          LE Set Extended Scan Parameters (Octet 37 - Bit 5)
          LE Set Extended Scan Enable (Octet 37 - Bit 6)
          LE Extended Create Connection (Octet 37 - Bit 7)
          LE Periodic Advertising Create Sync (Octet 38 - Bit 0)
          LE Periodic Advertising Create Sync Cancel (Octet 38 - Bit 1)
          LE Periodic Advertising Terminate Sync (Octet 38 - Bit 2)
          LE Add Device To Periodic Advertiser List (Octet 38 - Bit 3)
          LE Remove Device From Periodic Advertiser List (Octet 38 - Bit 4)
          LE Clear Periodic Advertiser List (Octet 38 - Bit 5)
          LE Read Periodic Advertiser List Size (Octet 38 - Bit 6)
          LE Read Transmit Power (Octet 38 - Bit 7)
          LE Read RF Path Compensation (Octet 39 - Bit 0)
          LE Write RF Path Compensation (Octet 39 - Bit 1)
          LE Set Privacy Mode (Octet 39 - Bit 2)
          LE Periodic Advertising Receive Enable (Octet 40 - Bit 5)
          LE Periodic Advertising Sync Transfer (Octet 40 - Bit 6)
          LE Periodic Advertising Set Info Transfer (Octet 40 - Bit 7)
          LE Periodic Advertising Sync Transfer Parameters (Octet 41 - Bit 0)
          LE Set Default Periodic Advertisng Sync Transfer Parameters (Octet 41 - Bit 1)
          LE Read Buffer v2 (Octet 41 - Bit 5)
          LE Read ISO TX Sync (Octet 41 - Bit 6)
          LE Set Connected Isochronous Group Parameters (Octet 41 - Bit 7)
          LE Set Connected Isochronous Group Parameters Test (Octet 42 - Bit 0)
          LE Create Connected Isochronous Stream (Octet 42 - Bit 1)
          LE Remove Connected Isochronous Group (Octet 42 - Bit 2)
          LE Accept Connected Isochronous Stream Request (Octet 42 - Bit 3)
          LE Reject Connected Isochronous Stream Request (Octet 42 - Bit 4)
          LE Create Broadcast Isochronous Group (Octet 42 - Bit 5)
          LE Create Broadcast Isochronous Group Test (Octet 42 - Bit 6)
          LE Terminate Broadcast Isochronous Group (Octet 42 - Bit 7)
          LE Broadcast Isochronous Group Create Sync (Octet 43 - Bit 0)
          LE Broadcast Isochronous Group Terminate Sync (Octet 43 - Bit 1)
          LE Request Peer SCA (Octet 43 - Bit 2)
          LE Setup Isochronous Data Path (Octet 43 - Bit 3)
          LE Remove Isochronous Data Path (Octet 43 - Bit 4)
          LE Isochronous Transmit Test (Octet 43 - Bit 5)
          LE Isochronous Receive Test (Octet 43 - Bit 6)
          LE Isochronous Read Test Counters (Octet 43 - Bit 7)
          LE Isochronous Read Test Counters (Octet 44 - Bit 0)
          LE Set Host Feature (Octet 44 - Bit 1)
          Octet 44 - Bit 2 
          Octet 45 - Bit 6 
          Octet 46 - Bit 0 
          Octet 46 - Bit 1 
          Octet 46 - Bit 2 
< HCI Command: Host Buffer Size (0x03|0x0033) plen 7         #9 [hci1] 0.875393
        ACL MTU: 255  ACL max packet: 16
        SCO MTU: 0    SCO max packet: 0
> HCI Event: Command Complete (0x0e) plen 4                 #10 [hci1] 0.875866
      Host Buffer Size (0x03|0x0033) ncmd 1
        Status: Success (0x00)
< HCI Command: Set Controller To Ho.. (0x03|0x0031) plen 1  #11 [hci1] 0.895337
        Flow control: ACL Data Packets (0x01)
> HCI Event: Command Complete (0x0e) plen 4                 #12 [hci1] 0.895725
      Set Controller To Host Flow Control (0x03|0x0031) ncmd 1
        Status: Success (0x00)
< HCI Command: LE Read Local Suppor.. (0x08|0x0003) plen 0  #13 [hci1] 0.915354
> HCI Event: Command Complete (0x0e) plen 12                #14 [hci1] 0.915876
      LE Read Local Supported Features (0x08|0x0003) ncmd 1
        Status: Success (0x00)
        Features: 0xfd 0x79 0x00 0xf7 0x30 0x01 0x00 0x00
          LE Encryption
          Extended Reject Indication
          Peripheral-initiated Features Exchange
          LE Ping
          LE Data Packet Length Extension
          LL Privacy
          Extended Scanner Filter Policies
          LE 2M PHY
          LE Coded PHY
          LE Extended Advertising
          LE Periodic Advertising
          Channel Selection Algorithm #2
          Periodic Advertising Sync Transfer - Sender
          Periodic Advertising Sync Transfer - Recipient
          Sleep Clock Accuracy Updates
          Connected Isochronous Stream - Central
          Connected Isochronous Stream - Peripheral
          Isochronous Broadcaster
          Synchronized Receiver
          Periodic Advertising ADI support
          Connection Subrating
          Unknown features (0x0000010000000000)
< HCI Command: LE Set Host Feature (0x08|0x0074) plen 2     #15 [hci1] 0.935392
        Bit Number: 32
          Connected Isochronous Stream (Host Support)
        Bit Value: 1
> HCI Event: Command Complete (0x0e) plen 4                 #16 [hci1] 0.935883
      LE Set Host Feature (0x08|0x0074) ncmd 1
        Status: Success (0x00)
< HCI Command: LE Read Buffer v2 (0x08|0x0060) plen 0       #17 [hci1] 0.955358
> HCI Event: Command Complete (0x0e) plen 10                #18 [hci1] 0.955817
      LE Read Buffer v2 (0x08|0x0060) ncmd 1
        Status: Success (0x00)
        ACL MTU: 27
        ACL max packet: 3
        ISO MTU: 318
        ISO max packet: 3
< HCI Command: LE Read Maximum Adve.. (0x08|0x003a) plen 0  #19 [hci1] 0.975412
> HCI Event: Command Complete (0x0e) plen 6                 #20 [hci1] 0.975843
      LE Read Maximum Advertising Data Length (0x08|0x003a) ncmd 1
        Status: Success (0x00)
        Max length: 1650
< HCI Command: LE Read Supported St.. (0x08|0x001c) plen 0  #21 [hci1] 0.995345
> HCI Event: Command Complete (0x0e) plen 12                #22 [hci1] 0.995921
      LE Read Supported States (0x08|0x001c) ncmd 1
        Status: Success (0x00)
        States: 0x000003ff3e0306ff
          Non-connectable Advertising State
          Scannable Advertising State
          Connectable Advertising State
          High Duty Cycle Directed Advertising State
          Passive Scanning State
          Active Scanning State
          Initiating State
            and Connection State (Central Role)
          Connection State (Peripheral Role)
          Scannable Advertising State
            and Passive Scanning State
          Connectable Advertising State
            and Passive Scanning State
          Non-connectable Advertising State
            and Initiating State
          Scannable Advertising State
            and Initiating State
          Active Scanning State
            and Connection State (Central Role)
          Passive Scanning State
            and Connection State (Peripheral Role)
          Active Scanning State
            and Connection State (Peripheral Role)
          Initiating State
            and Connection State (Central Role)
            and Central Role & Central Role
          Low Duty Cycle Directed Advertising State
          Connectable Advertising State
            and Initiating State
            and Central Role & Peripheral Role
          High Duty Cycle Directed Advertising State
            and Initiating State
            and Central Role & Peripheral Role
          Low Duty Cycle Directed Advertising State
            and Initiating State
            and Central Role & Peripheral Role
          Connectable Advertising State
            and Connection State (Central Role)
            and Central Role & Peripheral Role
          High Duty Cycle Directed Advertising State
            and Connection State (Central Role)
            and Central Role & Peripheral Role
          Low Duty Cycle Directed Advertising State
            and Connection State (Central Role)
            and Central Role & Peripheral Role
          Connectable Advertising State
            and Connection State (Peripheral Role)
            and Central Role & Peripheral Role
          High Duty Cycle Directed Advertising State
            and Connection State (Peripheral Role)
            and Peripheral Role & Peripheral Role
          Low Duty Cycle Directed Advertising State
            and Connection State (Peripheral Role)
            and Peripheral Role & Peripheral Role
          Initiating State
            and Connection State (Peripheral Role)
            and Central Role & Peripheral Role
< HCI Command: LE Read Maximum Data.. (0x08|0x002f) plen 0  #23 [hci1] 1.015334
> HCI Event: Command Complete (0x0e) plen 12                #24 [hci1] 1.015895
      LE Read Maximum Data Length (0x08|0x002f) ncmd 1
        Status: Success (0x00)
        Max TX octets: 251
        Max TX time: 2704
        Max RX octets: 251
        Max RX time: 2704
< HCI Command: LE Write Suggested D.. (0x08|0x0024) plen 4  #25 [hci1] 1.035375
        TX octets: 251
        TX time: 2704
> HCI Event: Command Complete (0x0e) plen 4                 #26 [hci1] 1.035798
      LE Write Suggested Default Data Length (0x08|0x0024) ncmd 1
        Status: Success (0x00)
< HCI Command: LE Read Resolving Li.. (0x08|0x002a) plen 0  #27 [hci1] 1.055382
> HCI Event: Command Complete (0x0e) plen 5                 #28 [hci1] 1.055818
      LE Read Resolving List Size (0x08|0x002a) ncmd 1
        Status: Success (0x00)
        Size: 8
< HCI Command: LE Set Event Mask (0x08|0x0001) plen 8       #29 [hci1] 1.075427
        Mask: 0x000002023f87fa5e
          LE Advertising Report
          LE Connection Update Complete
          LE Read Remote Used Features Complete
          LE Long Term Key Request
          LE Data Length Change
          LE Enhanced Connection Complete
          LE PHY Update Complete
          LE Extended Advertising Report
          LE Periodic Advertising Sync Established
          LE Periodic Advertising Report
          LE Periodic Advertising Sync Lost
          LE Extended Scan Timeout
          LE Extended Advertising Set Terminated
          LE Scan Request Received
          LE Periodic Advertising Sync Transfer Rvc
          LE CIS Established
          LE CIS Request
          LE Create BIG Complete
          LE Terminate BIG Complete
          LE BIG Sync Estabilished Complete
          LE BIG Sync Lost
          LE BIG Info Advertising Report
          Unknown mask (0x0000020000000000)
> HCI Event: Command Complete (0x0e) plen 4                 #30 [hci1] 1.075967
      LE Set Event Mask (0x08|0x0001) ncmd 1
        Status: Success (0x00)
< HCI Command: Set Event Mask (0x03|0x0001) plen 8          #31 [hci1] 1.095373
        Mask: 0x2000800002008890
          Disconnection Complete
          Encryption Change
          Read Remote Version Information Complete
          Hardware Error
          Data Buffer Overflow
          Encryption Key Refresh Complete
          LE Meta
> HCI Event: Command Complete (0x0e) plen 4                 #32 [hci1] 1.095938
      Set Event Mask (0x03|0x0001) ncmd 1
        Status: Success (0x00)
< HCI Command: Read BD ADDR (0x04|0x0009) plen 0            #33 [hci1] 1.115372
> HCI Event: Command Complete (0x0e) plen 10                #34 [hci1] 1.115914
      Read BD ADDR (0x04|0x0009) ncmd 1
        Status: Success (0x00)
        Address: 00:00:00:00:00:00 (OUI 00-00-00)
< HCI Command: LE Set Random Address (0x08|0x0005) plen 6   #35 [hci1] 1.135418
        Address: D5:B6:CC:31:DB:3B (Static)
> HCI Event: Command Complete (0x0e) plen 4                 #36 [hci1] 1.135989
      LE Set Random Address (0x08|0x0005) ncmd 1
        Status: Success (0x00)
< HCI Command: LE Set Extended Adv.. (0x08|0x0036) plen 25  #37 [hci1] 3.715929
        Handle: 0x00
        Properties: 0x0013
          Connectable
          Scannable
          Use legacy advertising PDUs: ADV_IND
        Min advertising interval: 100.000 msec (0x00a0)
        Max advertising interval: 150.000 msec (0x00f0)
        Channel map: 37, 38, 39 (0x07)
        Own address type: Random (0x01)
        Peer address type: Public (0x00)
        Peer address: 00:00:00:00:00:00 (OUI 00-00-00)
        Filter policy: Allow Scan Request from Any, Allow Connect Request from Any (0x00)
        TX power: Host has no preference (0x7f)
        Primary PHY: LE 1M (0x01)
        Secondary max skip: 0x00
        Secondary PHY: LE 1M (0x01)
        SID: 0x00
        Scan request notifications: Disabled (0x00)
> HCI Event: Command Complete (0x0e) plen 5                 #38 [hci1] 3.716739
      LE Set Extended Advertising Parameters (0x08|0x0036) ncmd 1
        Status: Success (0x00)
        TX power (selected): 0 dbm (0x00)
< HCI Command: LE Set Advertising S.. (0x08|0x0035) plen 7  #39 [hci1] 3.735823
        Advertising handle: 0x00
        Advertising random address: D5:B6:CC:31:DB:3B (Static)
> HCI Event: Command Complete (0x0e) plen 4                 #40 [hci1] 3.736340
      LE Set Advertising Set Random Address (0x08|0x0035) ncmd 1
        Status: Success (0x00)
< HCI Command: LE Set Extended Adv.. (0x08|0x0037) plen 22  #41 [hci1] 3.755424
        Handle: 0x00
        Operation: Complete extended advertising data (0x03)
        Fragment preference: Minimize fragmentation (0x01)
        Data length: 0x12
        Flags: 0x06
          LE General Discoverable Mode
          BR/EDR Not Supported
        Name (complete): Tester_F6B11A
> HCI Event: Command Complete (0x0e) plen 4                 #42 [hci1] 3.756089
      LE Set Extended Advertising Data (0x08|0x0037) ncmd 1
        Status: Success (0x00)
< HCI Command: LE Set Extended Scan.. (0x08|0x0038) plen 4  #43 [hci1] 3.775385
        Handle: 0x00
        Operation: Complete scan response data (0x03)
        Fragment preference: Minimize fragmentation (0x01)
        Data length: 0x00
> HCI Event: Command Complete (0x0e) plen 4                 #44 [hci1] 3.775849
      LE Set Extended Scan Response Data (0x08|0x0038) ncmd 1
        Status: Success (0x00)
< HCI Command: LE Set Extended Adve.. (0x08|0x0039) plen 6  #45 [hci1] 3.795398
        Extended advertising: Enabled (0x01)
        Number of sets: 1 (0x01)
        Entry 0
          Handle: 0x00
          Duration: 0 ms (0x00)
          Max ext adv events: 0
> HCI Event: Command Complete (0x0e) plen 4                 #46 [hci1] 3.795940
      LE Set Extended Advertising Enable (0x08|0x0039) ncmd 1
        Status: Success (0x00)
> HCI Event: LE Meta Event (0x3e) plen 31                   #47 [hci1] 3.905708
      LE Enhanced Connection Complete (0x0a)
        Status: Success (0x00)
        Handle: 1515
        Role: Peripheral (0x01)
        Peer address type: Public (0x00)
        Peer address: DF:A9:FF:F6:B1:1A (OUI DF-A9-FF)
        Local resolvable private address: 00:00:00:00:00:00 (Non-Resolvable)
        Peer resolvable private address: 00:00:00:00:00:00 (Non-Resolvable)
        Connection interval: 87.50 msec (0x0046)
        Connection latency: 0 (0x0000)
        Supervision timeout: 25120 msec (0x09d0)
        Central clock accuracy: 0x01
> HCI Event: LE Meta Event (0x3e) plen 6                    #48 [hci1] 3.905854
      LE Advertising Set Terminated (0x12)
        Status: Success (0x00)
        Handle: 0
        Connection handle: 1515
        Number of completed extended advertising events: 0
< HCI Command: LE Read Remote Used... (0x08|0x0016) plen 2  #49 [hci1] 3.915831
        Handle: 1515 Address: DF:A9:FF:F6:B1:1A (OUI DF-A9-FF)
< ACL Data TX: Handle 1515 flags 0x00 dlen 7                #50 [hci1] 3.915842
      ATT: Exchange MTU Request (0x02) len 2
        Client RX MTU: 251
> HCI Event: Command Status (0x0f) plen 4                   #51 [hci1] 3.916350
      LE Read Remote Used Features (0x08|0x0016) ncmd 1
        Status: Success (0x00)
> HCI Event: Number of Completed Packets (0x13) plen 5      #52 [hci1] 4.081633
        Num handles: 1
        Handle: 1515 Address: DF:A9:FF:F6:B1:1A (OUI DF-A9-FF)
        Count: 1
        #50: len 7 (0 Kb/s)
        Latency: 165 msec (165-165 msec ~165 msec)
> HCI Event: LE Meta Event (0x3e) plen 12                   #53 [hci1] 4.169622
      LE Read Remote Used Features (0x04)
        Status: Success (0x00)
        Handle: 1515 Address: DF:A9:FF:F6:B1:1A (OUI DF-A9-FF)
        Features: 0x2d 0x49 0x00 0xf7 0x67 0xd8 0x00 0x00
          LE Encryption
          Extended Reject Indication
          Peripheral-initiated Features Exchange
          LE Data Packet Length Extension
          LE 2M PHY
          LE Coded PHY
          Channel Selection Algorithm #2
          Periodic Advertising Sync Transfer - Sender
          Periodic Advertising Sync Transfer - Recipient
          Sleep Clock Accuracy Updates
          Connected Isochronous Stream - Central
          Connected Isochronous Stream - Peripheral
          Isochronous Broadcaster
          Synchronized Receiver
          Connected Isochronous Stream (Host Support)
          LE Power Control Request
          LE Power Control Request
          Connection Subrating
          Connection Subrating (Host Support)
          Unknown features (0x0000d80000000000)
> ACL Data RX: Handle 1515 flags 0x02 dlen 11               #54 [hci1] 6.619262
      SMP: Pairing Request (0x01) len 6
        IO capability: KeyboardDisplay (0x04)
        OOB data: Authentication data not present (0x00)
        Authentication requirement: Bonding, MITM, SC, No Keypresses (0x0d)
        Max encryption key size: 16
        Initiator key distribution: EncKey IdKey (0x03)
        Responder key distribution: EncKey IdKey Sign (0x07)
> ACL Data RX: Handle 1515 flags 0x02 dlen 7                #55 [hci1] 6.619659
      ATT: Exchange MTU Response (0x03) len 2
        Server RX MTU: 23
< HCI Command: Host Number of Compl.. (0x03|0x0035) plen 5  #56 [hci1] 6.636009
        Num handles: 1
        Handle: 1515 Address: DF:A9:FF:F6:B1:1A (OUI DF-A9-FF)
        Count: 1
< ACL Data TX: Handle 1515 flags 0x00 dlen 11               #57 [hci1] 6.636118
      SMP: Pairing Response (0x02) len 6
        IO capability: DisplayOnly (0x00)
        OOB data: Authentication data not present (0x00)
        Authentication requirement: Bonding, No MITM, SC, No Keypresses (0x09)
        Max encryption key size: 16
        Initiator key distribution: IdKey (0x02)
        Responder key distribution: <none> (0x00)
< HCI Command: Host Number of Compl.. (0x03|0x0035) plen 5  #58 [hci1] 6.636806
        Num handles: 1
        Handle: 1515 Address: DF:A9:FF:F6:B1:1A (OUI DF-A9-FF)
        Count: 1
> HCI Event: Number of Completed Packets (0x13) plen 5      #59 [hci1] 6.794279
        Num handles: 1
        Handle: 1515 Address: DF:A9:FF:F6:B1:1A (OUI DF-A9-FF)
        Count: 1
        #57: len 11 (0 Kb/s)
        Latency: 158 msec (158-165 msec ~161 msec)
> ACL Data RX: Handle 1515 flags 0x02 dlen 27               #60 [hci1] 6.794653
> ACL Data RX: Handle 1515 flags 0x01 dlen 27               #61 [hci1] 6.795244
> ACL Data RX: Handle 1515 flags 0x01 dlen 15               #62 [hci1] 6.795608
      SMP: Pairing Public Key (0x0c) len 64
        X: b293a3409b9dec4882bc3e518ca17518e899629c7c2207879fce5211af3e6d6a
        Y: 7dd17c472973d40ccc0fe52144eed2438c2e1840ddf0be0a5f6a71e3d404989a
< HCI Command: Host Number of Compl.. (0x03|0x0035) plen 5  #63 [hci1] 6.796196
        Num handles: 1
        Handle: 1515 Address: DF:A9:FF:F6:B1:1A (OUI DF-A9-FF)
        Count: 1
< HCI Command: Host Number of Compl.. (0x03|0x0035) plen 5  #64 [hci1] 6.815858
        Num handles: 1
        Handle: 1515 Address: DF:A9:FF:F6:B1:1A (OUI DF-A9-FF)
        Count: 1
< HCI Command: Host Number of Compl.. (0x03|0x0035) plen 5  #65 [hci1] 6.816324
        Num handles: 1
        Handle: 1515 Address: DF:A9:FF:F6:B1:1A (OUI DF-A9-FF)
        Count: 1
< ACL Data TX: Handle 1515 flags 0x00 dlen 27               #66 [hci1] 6.816493
< ACL Data TX: Handle 1515 flags 0x01 dlen 27               #67 [hci1] 6.816507
< ACL Data TX: Handle 1515 flags 0x01 dlen 15               #68 [hci1] 6.816529
      SMP: Pairing Public Key (0x0c) len 64
        X: 98308440221e2d910f0e54b71e7ec652857aa9b5a0dc65028824cc19db1226e9
        Y: 67a4816bcb62efb21701e31fdb27561a6217575fb007a8bbdabe7e28b6f68482
> HCI Event: Number of Completed Packets (0x13) plen 5      #69 [hci1] 6.882155
        Num handles: 1
        Handle: 1515 Address: DF:A9:FF:F6:B1:1A (OUI DF-A9-FF)
        Count: 1
        #66: len 27 (3 Kb/s)
        Latency: 65 msec (65-165 msec ~113 msec)
> HCI Event: Number of Completed Packets (0x13) plen 5      #70 [hci1] 6.882829
        Num handles: 1
        Handle: 1515 Address: DF:A9:FF:F6:B1:1A (OUI DF-A9-FF)
        Count: 1
        #67: len 27 (3 Kb/s)
        Latency: 66 msec (65-165 msec ~90 msec)
> HCI Event: Number of Completed Packets (0x13) plen 5      #71 [hci1] 6.969082
        Num handles: 1
        Handle: 1515 Address: DF:A9:FF:F6:B1:1A (OUI DF-A9-FF)
        Count: 1
        #68: len 15 (0 Kb/s)
        Latency: 152 msec (65-165 msec ~121 msec)
> ACL Data RX: Handle 1515 flags 0x02 dlen 21               #72 [hci1] 7.931895
      SMP: Pairing Confirm (0x03) len 16
        Confim value: 21d505b4762f9d04913d2b6e744e2695
< HCI Command: Host Number of Compl.. (0x03|0x0035) plen 5  #73 [hci1] 7.935815
        Num handles: 1
        Handle: 1515 Address: DF:A9:FF:F6:B1:1A (OUI DF-A9-FF)
        Count: 1
< ACL Data TX: Handle 1515 flags 0x00 dlen 21               #74 [hci1] 7.935915
      SMP: Pairing Confirm (0x03) len 16
        Confim value: 08eafaa9f3d78ce020277900f6b69bf2
> HCI Event: Number of Completed Packets (0x13) plen 5      #75 [hci1] 8.106660
        Num handles: 1
        Handle: 1515 Address: DF:A9:FF:F6:B1:1A (OUI DF-A9-FF)
        Count: 1
        #74: len 21 (0 Kb/s)
        Latency: 170 msec (65-170 msec ~146 msec)
> ACL Data RX: Handle 1515 flags 0x02 dlen 21               #76 [hci1] 8.107027
      SMP: Pairing Random (0x04) len 16
        Random value: 5e8dc52eeb5c71dc0000000000000000
< HCI Command: Host Number of Compl.. (0x03|0x0035) plen 5  #77 [hci1] 8.116077
        Num handles: 1
        Handle: 1515 Address: DF:A9:FF:F6:B1:1A (OUI DF-A9-FF)
        Count: 1
< ACL Data TX: Handle 1515 flags 0x00 dlen 21               #78 [hci1] 8.116119
      SMP: Pairing Random (0x04) len 16
        Random value: 8e6108f966a694cbe26df70bb96773e6
> HCI Event: Number of Completed Packets (0x13) plen 5      #79 [hci1] 8.281556
        Num handles: 1
        Handle: 1515 Address: DF:A9:FF:F6:B1:1A (OUI DF-A9-FF)
        Count: 1
        #78: len 21 (1 Kb/s)
        Latency: 165 msec (65-170 msec ~155 msec)
> ACL Data RX: Handle 1515 flags 0x02 dlen 21               #80 [hci1] 8.369393
      SMP: Pairing Confirm (0x03) len 16
        Confim value: 797127465dde221de612fb4c45435c7f
< HCI Command: Host Number of Compl.. (0x03|0x0035) plen 5  #81 [hci1] 8.375658
        Num handles: 1
        Handle: 1515 Address: DF:A9:FF:F6:B1:1A (OUI DF-A9-FF)
        Count: 1
< ACL Data TX: Handle 1515 flags 0x00 dlen 21               #82 [hci1] 8.375738
      SMP: Pairing Confirm (0x03) len 16
        Confim value: 9ccf5de7a8a4717b1685b5aead6b38ed
> HCI Event: Number of Completed Packets (0x13) plen 5      #83 [hci1] 8.544243
        Num handles: 1
        Handle: 1515 Address: DF:A9:FF:F6:B1:1A (OUI DF-A9-FF)
        Count: 1
        #82: len 21 (1 Kb/s)
        Latency: 168 msec (65-170 msec ~162 msec)
> ACL Data RX: Handle 1515 flags 0x02 dlen 21               #84 [hci1] 8.544560
      SMP: Pairing Random (0x04) len 16
        Random value: d72c01125ae647140000000000000000
< HCI Command: Host Number of Compl.. (0x03|0x0035) plen 5  #85 [hci1] 8.556254
        Num handles: 1
        Handle: 1515 Address: DF:A9:FF:F6:B1:1A (OUI DF-A9-FF)
        Count: 1
< ACL Data TX: Handle 1515 flags 0x00 dlen 21               #86 [hci1] 8.556431
      SMP: Pairing Random (0x04) len 16
        Random value: 4d02679f89a05211af56d8b3da64d21e
> HCI Event: Number of Completed Packets (0x13) plen 5      #87 [hci1] 8.719033
        Num handles: 1
        Handle: 1515 Address: DF:A9:FF:F6:B1:1A (OUI DF-A9-FF)
        Count: 1
        #86: len 21 (1 Kb/s)
        Latency: 162 msec (65-170 msec ~162 msec)
> ACL Data RX: Handle 1515 flags 0x02 dlen 21               #88 [hci1] 8.806830
      SMP: Pairing Confirm (0x03) len 16
        Confim value: f953dc8aa6f7e5e0b30c58ac71ba419e
< HCI Command: Host Number of Compl.. (0x03|0x0035) plen 5  #89 [hci1] 8.817293
        Num handles: 1
        Handle: 1515 Address: DF:A9:FF:F6:B1:1A (OUI DF-A9-FF)
        Count: 1
< ACL Data TX: Handle 1515 flags 0x00 dlen 21               #90 [hci1] 8.817333
      SMP: Pairing Confirm (0x03) len 16
        Confim value: 9f2232eb23e3722494ae31bd84978795
> HCI Event: Number of Completed Packets (0x13) plen 5      #91 [hci1] 8.981671
        Num handles: 1
        Handle: 1515 Address: DF:A9:FF:F6:B1:1A (OUI DF-A9-FF)
        Count: 1
        #90: len 21 (1 Kb/s)
        Latency: 164 msec (65-170 msec ~163 msec)
> ACL Data RX: Handle 1515 flags 0x02 dlen 21               #92 [hci1] 8.982016
      SMP: Pairing Random (0x04) len 16
        Random value: 1094ac0b0ada379f0000000000000000
< HCI Command: Host Number of Compl.. (0x03|0x0035) plen 5  #93 [hci1] 8.995524
        Num handles: 1
        Handle: 1515 Address: DF:A9:FF:F6:B1:1A (OUI DF-A9-FF)
        Count: 1
< ACL Data TX: Handle 1515 flags 0x00 dlen 21               #94 [hci1] 8.995533
      SMP: Pairing Random (0x04) len 16
        Random value: 5e8286bc235a02440d0c3424a2acf8fd
> HCI Event: Number of Completed Packets (0x13) plen 5      #95 [hci1] 9.156467
        Num handles: 1
        Handle: 1515 Address: DF:A9:FF:F6:B1:1A (OUI DF-A9-FF)
        Count: 1
        #94: len 21 (1 Kb/s)
        Latency: 160 msec (65-170 msec ~162 msec)
> ACL Data RX: Handle 1515 flags 0x02 dlen 21               #96 [hci1] 9.244258
      SMP: Pairing Confirm (0x03) len 16
        Confim value: 187bef1e338c0b177a40e3738c2354af
< HCI Command: Host Number of Compl.. (0x03|0x0035) plen 5  #97 [hci1] 9.255558
        Num handles: 1
        Handle: 1515 Address: DF:A9:FF:F6:B1:1A (OUI DF-A9-FF)
        Count: 1
< ACL Data TX: Handle 1515 flags 0x00 dlen 21               #98 [hci1] 9.255722
      SMP: Pairing Confirm (0x03) len 16
        Confim value: 7f37783cdf00fc4bf1de08968723d2ab
> HCI Event: Number of Completed Packets (0x13) plen 5      #99 [hci1] 9.419090
        Num handles: 1
        Handle: 1515 Address: DF:A9:FF:F6:B1:1A (OUI DF-A9-FF)
        Count: 1
        #98: len 21 (1 Kb/s)
        Latency: 163 msec (65-170 msec ~162 msec)
> ACL Data RX: Handle 1515 flags 0x02 dlen 21              #100 [hci1] 9.419542
      SMP: Pairing Random (0x04) len 16
        Random value: 3074f0a5ab27cbf10000000000000000
< HCI Command: Host Number of Comp.. (0x03|0x0035) plen 5  #101 [hci1] 9.435534
        Num handles: 1
        Handle: 1515 Address: DF:A9:FF:F6:B1:1A (OUI DF-A9-FF)
        Count: 1
< ACL Data TX: Handle 1515 flags 0x00 dlen 21              #102 [hci1] 9.435701
      SMP: Pairing Random (0x04) len 16
        Random value: 5c4a1bcadd27bd58e945097b00bad7ac
> HCI Event: Number of Completed Packets (0x13) plen 5     #103 [hci1] 9.593939
        Num handles: 1
        Handle: 1515 Address: DF:A9:FF:F6:B1:1A (OUI DF-A9-FF)
        Count: 1
        #102: len 21 (1 Kb/s)
        Latency: 158 msec (65-170 msec ~160 msec)
> ACL Data RX: Handle 1515 flags 0x02 dlen 21              #104 [hci1] 9.681782
      SMP: Pairing Confirm (0x03) len 16
        Confim value: 5b42ef8cf06d4e959645c1a467c633a9
< HCI Command: Host Number of Comp.. (0x03|0x0035) plen 5  #105 [hci1] 9.695541
        Num handles: 1
        Handle: 1515 Address: DF:A9:FF:F6:B1:1A (OUI DF-A9-FF)
        Count: 1
< ACL Data TX: Handle 1515 flags 0x00 dlen 21              #106 [hci1] 9.695576
      SMP: Pairing Confirm (0x03) len 16
        Confim value: bdfcaff8936232924ed34d5f1ae37697
> HCI Event: Number of Completed Packets (0x13) plen 5     #107 [hci1] 9.856690
        Num handles: 1
        Handle: 1515 Address: DF:A9:FF:F6:B1:1A (OUI DF-A9-FF)
        Count: 1
        #106: len 21 (1 Kb/s)
        Latency: 161 msec (65-170 msec ~160 msec)
> ACL Data RX: Handle 1515 flags 0x02 dlen 21              #108 [hci1] 9.856956
      SMP: Pairing Random (0x04) len 16
        Random value: 9f2aaa261646aa090000000000000000
< HCI Command: Host Number of Comp.. (0x03|0x0035) plen 5  #109 [hci1] 9.875647
        Num handles: 1
        Handle: 1515 Address: DF:A9:FF:F6:B1:1A (OUI DF-A9-FF)
        Count: 1
< ACL Data TX: Handle 1515 flags 0x00 dlen 21              #110 [hci1] 9.875716
      SMP: Pairing Random (0x04) len 16
        Random value: 32527e6e64e79f33b2e374394db8ab2d
> HCI Event: Number of Completed Packets (0x13) plen 5    #111 [hci1] 10.031632
        Num handles: 1
        Handle: 1515 Address: DF:A9:FF:F6:B1:1A (OUI DF-A9-FF)
        Count: 1
        #110: len 21 (1 Kb/s)
        Latency: 155 msec (65-170 msec ~158 msec)
> ACL Data RX: Handle 1515 flags 0x02 dlen 21             #112 [hci1] 10.119292
      SMP: Pairing Confirm (0x03) len 16
        Confim value: 390f09afe3da57f1f138b22de9dd7426
< HCI Command: Host Number of Com.. (0x03|0x0035) plen 5  #113 [hci1] 10.135940
        Num handles: 1
        Handle: 1515 Address: DF:A9:FF:F6:B1:1A (OUI DF-A9-FF)
        Count: 1
< ACL Data TX: Handle 1515 flags 0x00 dlen 21             #114 [hci1] 10.136078
      SMP: Pairing Confirm (0x03) len 16
        Confim value: e8276fa57452a59e0530ce3503dd1146
> HCI Event: Number of Completed Packets (0x13) plen 5    #115 [hci1] 10.294160
        Num handles: 1
        Handle: 1515 Address: DF:A9:FF:F6:B1:1A (OUI DF-A9-FF)
        Count: 1
        #114: len 21 (1 Kb/s)
        Latency: 158 msec (65-170 msec ~158 msec)
> ACL Data RX: Handle 1515 flags 0x02 dlen 21             #116 [hci1] 10.294546
      SMP: Pairing Random (0x04) len 16
        Random value: cbd1778757e23a000000000000000000
< HCI Command: Host Number of Com.. (0x03|0x0035) plen 5  #117 [hci1] 10.296202
        Num handles: 1
        Handle: 1515 Address: DF:A9:FF:F6:B1:1A (OUI DF-A9-FF)
        Count: 1
< ACL Data TX: Handle 1515 flags 0x00 dlen 21             #118 [hci1] 10.296366
      SMP: Pairing Random (0x04) len 16
        Random value: dddbdfe2838e9a8cc6964353c850fef7
> HCI Event: Number of Completed Packets (0x13) plen 5    #119 [hci1] 10.468978
        Num handles: 1
        Handle: 1515 Address: DF:A9:FF:F6:B1:1A (OUI DF-A9-FF)
        Count: 1
        #118: len 21 (0 Kb/s)
        Latency: 172 msec (65-172 msec ~165 msec)
> ACL Data RX: Handle 1515 flags 0x02 dlen 21             #120 [hci1] 10.556801
      SMP: Pairing Confirm (0x03) len 16
        Confim value: 3bf6c37f72510baba78930d72d3f8469
< HCI Command: Host Number of Com.. (0x03|0x0035) plen 5  #121 [hci1] 10.576087
        Num handles: 1
        Handle: 1515 Address: DF:A9:FF:F6:B1:1A (OUI DF-A9-FF)
        Count: 1
< ACL Data TX: Handle 1515 flags 0x00 dlen 21             #122 [hci1] 10.576229
      SMP: Pairing Confirm (0x03) len 16
        Confim value: a85aeafb5f81c466cb6f440ca29e2582
> HCI Event: Number of Completed Packets (0x13) plen 5    #123 [hci1] 10.731626
        Num handles: 1
        Handle: 1515 Address: DF:A9:FF:F6:B1:1A (OUI DF-A9-FF)
        Count: 1
        #122: len 21 (1 Kb/s)
        Latency: 155 msec (65-172 msec ~160 msec)
> ACL Data RX: Handle 1515 flags 0x02 dlen 21             #124 [hci1] 10.731988
      SMP: Pairing Random (0x04) len 16
        Random value: c7ed0d6ddb13ffa30000000000000000
< HCI Command: Host Number of Com.. (0x03|0x0035) plen 5  #125 [hci1] 10.736300
        Num handles: 1
        Handle: 1515 Address: DF:A9:FF:F6:B1:1A (OUI DF-A9-FF)
        Count: 1
< ACL Data TX: Handle 1515 flags 0x00 dlen 21             #126 [hci1] 10.736449
      SMP: Pairing Random (0x04) len 16
        Random value: eb9f1915536596b6fc3db1c86b2b1970
> HCI Event: Number of Completed Packets (0x13) plen 5    #127 [hci1] 10.906357
        Num handles: 1
        Handle: 1515 Address: DF:A9:FF:F6:B1:1A (OUI DF-A9-FF)
        Count: 1
        #126: len 21 (0 Kb/s)
        Latency: 169 msec (65-172 msec ~165 msec)
> ACL Data RX: Handle 1515 flags 0x02 dlen 21             #128 [hci1] 10.994370
      SMP: Pairing Confirm (0x03) len 16
        Confim value: 722dd8fb98f03b1c16ab00a2d387e0f0
< HCI Command: Host Number of Com.. (0x03|0x0035) plen 5  #129 [hci1] 10.996001
        Num handles: 1
        Handle: 1515 Address: DF:A9:FF:F6:B1:1A (OUI DF-A9-FF)
        Count: 1
< ACL Data TX: Handle 1515 flags 0x00 dlen 21             #130 [hci1] 10.996160
      SMP: Pairing Confirm (0x03) len 16
        Confim value: bc2833d8e8eea2bcd4dd3d16d7d4b504
> HCI Event: Number of Completed Packets (0x13) plen 5    #131 [hci1] 11.169086
        Num handles: 1
        Handle: 1515 Address: DF:A9:FF:F6:B1:1A (OUI DF-A9-FF)
        Count: 1
        #130: len 21 (0 Kb/s)
        Latency: 172 msec (65-172 msec ~169 msec)
> ACL Data RX: Handle 1515 flags 0x02 dlen 21             #132 [hci1] 11.169484
      SMP: Pairing Random (0x04) len 16
        Random value: cff3b3e041d8d9d80000000000000000
< HCI Command: Host Number of Com.. (0x03|0x0035) plen 5  #133 [hci1] 11.176425
        Num handles: 1
        Handle: 1515 Address: DF:A9:FF:F6:B1:1A (OUI DF-A9-FF)
        Count: 1
< ACL Data TX: Handle 1515 flags 0x00 dlen 21             #134 [hci1] 11.176481
      SMP: Pairing Random (0x04) len 16
        Random value: 5c794dc9ad9f2c3f295ebd5ad5e1c3cf
> HCI Event: Number of Completed Packets (0x13) plen 5    #135 [hci1] 11.344059
        Num handles: 1
        Handle: 1515 Address: DF:A9:FF:F6:B1:1A (OUI DF-A9-FF)
        Count: 1
        #134: len 21 (1 Kb/s)
        Latency: 167 msec (65-172 msec ~168 msec)
> ACL Data RX: Handle 1515 flags 0x02 dlen 21             #136 [hci1] 11.431739
      SMP: Pairing Confirm (0x03) len 16
        Confim value: 5c5ce543aaab66e22b764e95c8bf3e6f
< HCI Command: Host Number of Com.. (0x03|0x0035) plen 5  #137 [hci1] 11.436054
        Num handles: 1
        Handle: 1515 Address: DF:A9:FF:F6:B1:1A (OUI DF-A9-FF)
        Count: 1
< ACL Data TX: Handle 1515 flags 0x00 dlen 21             #138 [hci1] 11.436142
      SMP: Pairing Confirm (0x03) len 16
        Confim value: a9f3a572a84aa21965d45f0d34d0379e
> HCI Event: Number of Completed Packets (0x13) plen 5    #139 [hci1] 11.606615
        Num handles: 1
        Handle: 1515 Address: DF:A9:FF:F6:B1:1A (OUI DF-A9-FF)
        Count: 1
        #138: len 21 (0 Kb/s)
        Latency: 170 msec (65-172 msec ~169 msec)
> ACL Data RX: Handle 1515 flags 0x02 dlen 21             #140 [hci1] 11.606954
      SMP: Pairing Random (0x04) len 16
        Random value: 93970fae6fc43e910000000000000000
< HCI Command: Host Number of Com.. (0x03|0x0035) plen 5  #141 [hci1] 11.616247
        Num handles: 1
        Handle: 1515 Address: DF:A9:FF:F6:B1:1A (OUI DF-A9-FF)
        Count: 1
< ACL Data TX: Handle 1515 flags 0x00 dlen 21             #142 [hci1] 11.616352
      SMP: Pairing Random (0x04) len 16
        Random value: 5c2fff312cdf99c9491988e877355a9a
> HCI Event: Number of Completed Packets (0x13) plen 5    #143 [hci1] 11.781353
        Num handles: 1
        Handle: 1515 Address: DF:A9:FF:F6:B1:1A (OUI DF-A9-FF)
        Count: 1
        #142: len 21 (1 Kb/s)
        Latency: 165 msec (65-172 msec ~167 msec)
> ACL Data RX: Handle 1515 flags 0x02 dlen 21             #144 [hci1] 11.869328
      SMP: Pairing Confirm (0x03) len 16
        Confim value: 8cb37c8278ff02eb375889eadcc79b7c
< HCI Command: Host Number of Com.. (0x03|0x0035) plen 5  #145 [hci1] 11.876039
        Num handles: 1
        Handle: 1515 Address: DF:A9:FF:F6:B1:1A (OUI DF-A9-FF)
        Count: 1
< ACL Data TX: Handle 1515 flags 0x00 dlen 21             #146 [hci1] 11.876138
      SMP: Pairing Confirm (0x03) len 16
        Confim value: 3d6bff910665109b738293756c10abfb
> HCI Event: Number of Completed Packets (0x13) plen 5    #147 [hci1] 12.044091
        Num handles: 1
        Handle: 1515 Address: DF:A9:FF:F6:B1:1A (OUI DF-A9-FF)
        Count: 1
        #146: len 21 (1 Kb/s)
        Latency: 167 msec (65-172 msec ~167 msec)
> ACL Data RX: Handle 1515 flags 0x02 dlen 21             #148 [hci1] 12.044500
      SMP: Pairing Random (0x04) len 16
        Random value: 7a3ea4635d7069bb0000000000000000
< HCI Command: Host Number of Com.. (0x03|0x0035) plen 5  #149 [hci1] 12.056269
        Num handles: 1
        Handle: 1515 Address: DF:A9:FF:F6:B1:1A (OUI DF-A9-FF)
        Count: 1
< ACL Data TX: Handle 1515 flags 0x00 dlen 21             #150 [hci1] 12.056356
      SMP: Pairing Random (0x04) len 16
        Random value: c629a3a987d808e808655d558dfc1155
> HCI Event: Number of Completed Packets (0x13) plen 5    #151 [hci1] 12.218892
        Num handles: 1
        Handle: 1515 Address: DF:A9:FF:F6:B1:1A (OUI DF-A9-FF)
        Count: 1
        #150: len 21 (1 Kb/s)
        Latency: 162 msec (65-172 msec ~165 msec)
> ACL Data RX: Handle 1515 flags 0x02 dlen 21             #152 [hci1] 12.306783
      SMP: Pairing Confirm (0x03) len 16
        Confim value: 95e60d31fc71391abfff68ab3a91eb88
< HCI Command: Host Number of Com.. (0x03|0x0035) plen 5  #153 [hci1] 12.316112
        Num handles: 1
        Handle: 1515 Address: DF:A9:FF:F6:B1:1A (OUI DF-A9-FF)
        Count: 1
< ACL Data TX: Handle 1515 flags 0x00 dlen 21             #154 [hci1] 12.316204
      SMP: Pairing Confirm (0x03) len 16
        Confim value: 34a87fe90c4926a51108e76162c5afbb
> HCI Event: Number of Completed Packets (0x13) plen 5    #155 [hci1] 12.481648
        Num handles: 1
        Handle: 1515 Address: DF:A9:FF:F6:B1:1A (OUI DF-A9-FF)
        Count: 1
        #154: len 21 (1 Kb/s)
        Latency: 165 msec (65-172 msec ~165 msec)
> ACL Data RX: Handle 1515 flags 0x02 dlen 21             #156 [hci1] 12.481944
      SMP: Pairing Random (0x04) len 16
        Random value: c34418eabd7cce2e0000000000000000
< HCI Command: Host Number of Com.. (0x03|0x0035) plen 5  #157 [hci1] 12.496364
        Num handles: 1
        Handle: 1515 Address: DF:A9:FF:F6:B1:1A (OUI DF-A9-FF)
        Count: 1
< ACL Data TX: Handle 1515 flags 0x00 dlen 21             #158 [hci1] 12.496481
      SMP: Pairing Random (0x04) len 16
        Random value: 92f20f6ad8f13724432c7fd6001c45ff
> HCI Event: Number of Completed Packets (0x13) plen 5    #159 [hci1] 12.656341
        Num handles: 1
        Handle: 1515 Address: DF:A9:FF:F6:B1:1A (OUI DF-A9-FF)
        Count: 1
        #158: len 21 (1 Kb/s)
        Latency: 159 msec (65-172 msec ~162 msec)
> ACL Data RX: Handle 1515 flags 0x02 dlen 21             #160 [hci1] 12.744234
      SMP: Pairing Confirm (0x03) len 16
        Confim value: 027b53f10786deadce53b8c43e936b9f
< HCI Command: Host Number of Com.. (0x03|0x0035) plen 5  #161 [hci1] 12.756070
        Num handles: 1
        Handle: 1515 Address: DF:A9:FF:F6:B1:1A (OUI DF-A9-FF)
        Count: 1
< ACL Data TX: Handle 1515 flags 0x00 dlen 21             #162 [hci1] 12.756167
      SMP: Pairing Confirm (0x03) len 16
        Confim value: 00aac93d60ac95293c56aff9ad25d946
> HCI Event: Number of Completed Packets (0x13) plen 5    #163 [hci1] 12.919047
        Num handles: 1
        Handle: 1515 Address: DF:A9:FF:F6:B1:1A (OUI DF-A9-FF)
        Count: 1
        #162: len 21 (1 Kb/s)
        Latency: 162 msec (65-172 msec ~162 msec)
> ACL Data RX: Handle 1515 flags 0x02 dlen 21             #164 [hci1] 12.919373
      SMP: Pairing Random (0x04) len 16
        Random value: 18d7a93ea8c51e540000000000000000
< HCI Command: Host Number of Com.. (0x03|0x0035) plen 5  #165 [hci1] 12.936311
        Num handles: 1
        Handle: 1515 Address: DF:A9:FF:F6:B1:1A (OUI DF-A9-FF)
        Count: 1
< ACL Data TX: Handle 1515 flags 0x00 dlen 21             #166 [hci1] 12.936445
      SMP: Pairing Random (0x04) len 16
        Random value: 23ac32ebbb5e14c8a6b9622f296d277f
> HCI Event: Number of Completed Packets (0x13) plen 5    #167 [hci1] 13.093858
        Num handles: 1
        Handle: 1515 Address: DF:A9:FF:F6:B1:1A (OUI DF-A9-FF)
        Count: 1
        #166: len 21 (1 Kb/s)
        Latency: 157 msec (65-172 msec ~160 msec)
> ACL Data RX: Handle 1515 flags 0x02 dlen 21             #168 [hci1] 13.181708
      SMP: Pairing Confirm (0x03) len 16
        Confim value: d54f342adfc42150cf64e3f6e0f10aa1
< HCI Command: Host Number of Com.. (0x03|0x0035) plen 5  #169 [hci1] 13.196039
        Num handles: 1
        Handle: 1515 Address: DF:A9:FF:F6:B1:1A (OUI DF-A9-FF)
        Count: 1
< ACL Data TX: Handle 1515 flags 0x00 dlen 21             #170 [hci1] 13.196163
      SMP: Pairing Confirm (0x03) len 16
        Confim value: b02df3ada18fb69d8e13e9d31b4111a8
> HCI Event: Number of Completed Packets (0x13) plen 5    #171 [hci1] 13.356582
        Num handles: 1
        Handle: 1515 Address: DF:A9:FF:F6:B1:1A (OUI DF-A9-FF)
        Count: 1
        #170: len 21 (1 Kb/s)
        Latency: 160 msec (65-172 msec ~160 msec)
> ACL Data RX: Handle 1515 flags 0x02 dlen 21             #172 [hci1] 13.356894
      SMP: Pairing Random (0x04) len 16
        Random value: 55da76851f6033c30000000000000000
< HCI Command: Host Number of Com.. (0x03|0x0035) plen 5  #173 [hci1] 13.375697
        Num handles: 1
        Handle: 1515 Address: DF:A9:FF:F6:B1:1A (OUI DF-A9-FF)
        Count: 1
< ACL Data TX: Handle 1515 flags 0x00 dlen 21             #174 [hci1] 13.375732
      SMP: Pairing Random (0x04) len 16
        Random value: 297efe85e67448a15f56bd27e3a3cf1d
> HCI Event: Number of Completed Packets (0x13) plen 5    #175 [hci1] 13.531337
        Num handles: 1
        Handle: 1515 Address: DF:A9:FF:F6:B1:1A (OUI DF-A9-FF)
        Count: 1
        #174: len 21 (1 Kb/s)
        Latency: 155 msec (65-172 msec ~157 msec)
> ACL Data RX: Handle 1515 flags 0x02 dlen 21             #176 [hci1] 13.619189
      SMP: Pairing Confirm (0x03) len 16
        Confim value: 39d57714f2b46f912a111c91de8bc29b
< HCI Command: Host Number of Com.. (0x03|0x0035) plen 5  #177 [hci1] 13.636061
        Num handles: 1
        Handle: 1515 Address: DF:A9:FF:F6:B1:1A (OUI DF-A9-FF)
        Count: 1
< ACL Data TX: Handle 1515 flags 0x00 dlen 21             #178 [hci1] 13.636258
      SMP: Pairing Confirm (0x03) len 16
        Confim value: 538dfcd3792f61a33bebe6e3a9a9df0c
> HCI Event: Number of Completed Packets (0x13) plen 5    #179 [hci1] 13.794040
        Num handles: 1
        Handle: 1515 Address: DF:A9:FF:F6:B1:1A (OUI DF-A9-FF)
        Count: 1
        #178: len 21 (1 Kb/s)
        Latency: 157 msec (65-172 msec ~157 msec)
> ACL Data RX: Handle 1515 flags 0x02 dlen 21             #180 [hci1] 13.794427
      SMP: Pairing Random (0x04) len 16
        Random value: f286adb3cac76d120000000000000000
< HCI Command: Host Number of Com.. (0x03|0x0035) plen 5  #181 [hci1] 13.795612
        Num handles: 1
        Handle: 1515 Address: DF:A9:FF:F6:B1:1A (OUI DF-A9-FF)
        Count: 1
< ACL Data TX: Handle 1515 flags 0x00 dlen 21             #182 [hci1] 13.795674
      SMP: Pairing Random (0x04) len 16
        Random value: 25a9493fd3ce4faf02be7293595bb7c6
> HCI Event: Number of Completed Packets (0x13) plen 5    #183 [hci1] 13.968810
        Num handles: 1
        Handle: 1515 Address: DF:A9:FF:F6:B1:1A (OUI DF-A9-FF)
        Count: 1
        #182: len 21 (0 Kb/s)
        Latency: 173 msec (65-173 msec ~165 msec)
> ACL Data RX: Handle 1515 flags 0x02 dlen 21             #184 [hci1] 14.056649
      SMP: Pairing Confirm (0x03) len 16
        Confim value: 03b4fb37c2391dc833ce7148280ba5f5
< HCI Command: Host Number of Com.. (0x03|0x0035) plen 5  #185 [hci1] 14.075565
        Num handles: 1
        Handle: 1515 Address: DF:A9:FF:F6:B1:1A (OUI DF-A9-FF)
        Count: 1
< ACL Data TX: Handle 1515 flags 0x00 dlen 21             #186 [hci1] 14.075641
      SMP: Pairing Confirm (0x03) len 16
        Confim value: a67a672e33b709d6b53fdbcf8df8baa8
> HCI Event: Number of Completed Packets (0x13) plen 5    #187 [hci1] 14.231554
        Num handles: 1
        Handle: 1515 Address: DF:A9:FF:F6:B1:1A (OUI DF-A9-FF)
        Count: 1
        #186: len 21 (1 Kb/s)
        Latency: 155 msec (65-173 msec ~160 msec)
> ACL Data RX: Handle 1515 flags 0x02 dlen 21             #188 [hci1] 14.231816
      SMP: Pairing Random (0x04) len 16
        Random value: 132cc92588e625c10000000000000000
< HCI Command: Host Number of Com.. (0x03|0x0035) plen 5  #189 [hci1] 14.235678
        Num handles: 1
        Handle: 1515 Address: DF:A9:FF:F6:B1:1A (OUI DF-A9-FF)
        Count: 1
< ACL Data TX: Handle 1515 flags 0x00 dlen 21             #190 [hci1] 14.235751
      SMP: Pairing Random (0x04) len 16
        Random value: 58f6b41f855a6f6c3560debd84e2affc
> HCI Event: Number of Completed Packets (0x13) plen 5    #191 [hci1] 14.406311
        Num handles: 1
        Handle: 1515 Address: DF:A9:FF:F6:B1:1A (OUI DF-A9-FF)
        Count: 1
        #190: len 21 (0 Kb/s)
        Latency: 170 msec (65-173 msec ~165 msec)
> ACL Data RX: Handle 1515 flags 0x02 dlen 21             #192 [hci1] 14.494248
      SMP: Pairing Confirm (0x03) len 16
        Confim value: 02e62aa4a12749daa695aeeb2948a2fc
< HCI Command: Host Number of Com.. (0x03|0x0035) plen 5  #193 [hci1] 14.495581
        Num handles: 1
        Handle: 1515 Address: DF:A9:FF:F6:B1:1A (OUI DF-A9-FF)
        Count: 1
< ACL Data TX: Handle 1515 flags 0x00 dlen 21             #194 [hci1] 14.495672
      SMP: Pairing Confirm (0x03) len 16
        Confim value: eca9d100a35357303b080bc8c211e380
> HCI Event: Number of Completed Packets (0x13) plen 5    #195 [hci1] 14.668979
        Num handles: 1
        Handle: 1515 Address: DF:A9:FF:F6:B1:1A (OUI DF-A9-FF)
        Count: 1
        #194: len 21 (0 Kb/s)
        Latency: 173 msec (65-173 msec ~169 msec)
> ACL Data RX: Handle 1515 flags 0x02 dlen 21             #196 [hci1] 14.669329
      SMP: Pairing Random (0x04) len 16
        Random value: 9fa7a0ae2db7a5540000000000000000
< HCI Command: Host Number of Com.. (0x03|0x0035) plen 5  #197 [hci1] 14.675738
        Num handles: 1
        Handle: 1515 Address: DF:A9:FF:F6:B1:1A (OUI DF-A9-FF)
        Count: 1
< ACL Data TX: Handle 1515 flags 0x00 dlen 21             #198 [hci1] 14.675823
      SMP: Pairing Random (0x04) len 16
        Random value: b67e7216d5bf664139eda2b542549666
> HCI Event: Number of Completed Packets (0x13) plen 5    #199 [hci1] 14.843878
        Num handles: 1
        Handle: 1515 Address: DF:A9:FF:F6:B1:1A (OUI DF-A9-FF)
        Count: 1
        #198: len 21 (1 Kb/s)
        Latency: 168 msec (65-173 msec ~168 msec)
> ACL Data RX: Handle 1515 flags 0x02 dlen 21             #200 [hci1] 14.931626
      SMP: Pairing Confirm (0x03) len 16
        Confim value: d44094a42cab5176818f08973e96c1e3
< HCI Command: Host Number of Com.. (0x03|0x0035) plen 5  #201 [hci1] 14.935566
        Num handles: 1
        Handle: 1515 Address: DF:A9:FF:F6:B1:1A (OUI DF-A9-FF)
        Count: 1
< ACL Data TX: Handle 1515 flags 0x00 dlen 21             #202 [hci1] 14.935632
      SMP: Pairing Confirm (0x03) len 16
        Confim value: 780d6aa7f5685e4a0aa57733fb7a23ea
> HCI Event: Number of Completed Packets (0x13) plen 5    #203 [hci1] 15.106451
        Num handles: 1
        Handle: 1515 Address: DF:A9:FF:F6:B1:1A (OUI DF-A9-FF)
        Count: 1
        #202: len 21 (0 Kb/s)
        Latency: 170 msec (65-173 msec ~169 msec)
> ACL Data RX: Handle 1515 flags 0x02 dlen 21             #204 [hci1] 15.106770
      SMP: Pairing Random (0x04) len 16
        Random value: d5bab35fc2855f4f0000000000000000
< HCI Command: Host Number of Com.. (0x03|0x0035) plen 5  #205 [hci1] 15.115716
        Num handles: 1
        Handle: 1515 Address: DF:A9:FF:F6:B1:1A (OUI DF-A9-FF)
        Count: 1
< ACL Data TX: Handle 1515 flags 0x00 dlen 21             #206 [hci1] 15.115725
      SMP: Pairing Random (0x04) len 16
        Random value: ed17f76500c95219dd01e09d1e63f87b
> HCI Event: Number of Completed Packets (0x13) plen 5    #207 [hci1] 15.281275
        Num handles: 1
        Handle: 1515 Address: DF:A9:FF:F6:B1:1A (OUI DF-A9-FF)
        Count: 1
        #206: len 21 (1 Kb/s)
        Latency: 165 msec (65-173 msec ~167 msec)
> ACL Data RX: Handle 1515 flags 0x02 dlen 21             #208 [hci1] 15.369076
      SMP: Pairing Confirm (0x03) len 16
        Confim value: 130529c195454e50ce722bbb5dc37717
< HCI Command: Host Number of Com.. (0x03|0x0035) plen 5  #209 [hci1] 15.375574
        Num handles: 1
        Handle: 1515 Address: DF:A9:FF:F6:B1:1A (OUI DF-A9-FF)
        Count: 1
< ACL Data TX: Handle 1515 flags 0x00 dlen 21             #210 [hci1] 15.375629
      SMP: Pairing Confirm (0x03) len 16
        Confim value: 6bb08ec7230d68fbf875bfa4f437c014
> HCI Event: Number of Completed Packets (0x13) plen 5    #211 [hci1] 15.543934
        Num handles: 1
        Handle: 1515 Address: DF:A9:FF:F6:B1:1A (OUI DF-A9-FF)
        Count: 1
        #210: len 21 (1 Kb/s)
        Latency: 168 msec (65-173 msec ~167 msec)
> ACL Data RX: Handle 1515 flags 0x02 dlen 21             #212 [hci1] 15.544412
      SMP: Pairing Random (0x04) len 16
        Random value: dc1b604de293ba690000000000000000
< HCI Command: Host Number of Com.. (0x03|0x0035) plen 5  #213 [hci1] 15.555691
        Num handles: 1
        Handle: 1515 Address: DF:A9:FF:F6:B1:1A (OUI DF-A9-FF)
        Count: 1
< ACL Data TX: Handle 1515 flags 0x00 dlen 21             #214 [hci1] 15.555766
      SMP: Pairing Random (0x04) len 16
        Random value: 81d35d47e1f6006d79c974bd9d9e1ee3
> HCI Event: Number of Completed Packets (0x13) plen 5    #215 [hci1] 15.718904
        Num handles: 1
        Handle: 1515 Address: DF:A9:FF:F6:B1:1A (OUI DF-A9-FF)
        Count: 1
        #214: len 21 (1 Kb/s)
        Latency: 163 msec (65-173 msec ~165 msec)
> ACL Data RX: Handle 1515 flags 0x02 dlen 21             #216 [hci1] 15.806580
      SMP: Pairing Confirm (0x03) len 16
        Confim value: f4184e9a87bd5238c195c447f041f5aa
< HCI Command: Host Number of Com.. (0x03|0x0035) plen 5  #217 [hci1] 15.815570
        Num handles: 1
        Handle: 1515 Address: DF:A9:FF:F6:B1:1A (OUI DF-A9-FF)
        Count: 1
< ACL Data TX: Handle 1515 flags 0x00 dlen 21             #218 [hci1] 15.815640
      SMP: Pairing Confirm (0x03) len 16
        Confim value: e8c560a0f84503a0d8b9e97820f65a5c
> HCI Event: Number of Completed Packets (0x13) plen 5    #219 [hci1] 15.981456
        Num handles: 1
        Handle: 1515 Address: DF:A9:FF:F6:B1:1A (OUI DF-A9-FF)
        Count: 1
        #218: len 21 (1 Kb/s)
        Latency: 165 msec (65-173 msec ~165 msec)
> ACL Data RX: Handle 1515 flags 0x02 dlen 21             #220 [hci1] 15.981806
      SMP: Pairing Random (0x04) len 16
        Random value: b7f5d22572b76f650000000000000000
< HCI Command: Host Number of Com.. (0x03|0x0035) plen 5  #221 [hci1] 15.996373
        Num handles: 1
        Handle: 1515 Address: DF:A9:FF:F6:B1:1A (OUI DF-A9-FF)
        Count: 1
< ACL Data TX: Handle 1515 flags 0x00 dlen 21             #222 [hci1] 15.996519
      SMP: Pairing Random (0x04) len 16
        Random value: e7f7e0c2476823e41736a7e381bafb7c
> HCI Event: Number of Completed Packets (0x13) plen 5    #223 [hci1] 16.156299
        Num handles: 1
        Handle: 1515 Address: DF:A9:FF:F6:B1:1A (OUI DF-A9-FF)
        Count: 1
        #222: len 21 (1 Kb/s)
        Latency: 159 msec (65-173 msec ~162 msec)
> ACL Data RX: Handle 1515 flags 0x02 dlen 21             #224 [hci1] 16.244144
      SMP: Pairing Confirm (0x03) len 16
        Confim value: d6dfcdbff75d20191a36cff720ec01f0
< HCI Command: Host Number of Com.. (0x03|0x0035) plen 5  #225 [hci1] 16.256075
        Num handles: 1
        Handle: 1515 Address: DF:A9:FF:F6:B1:1A (OUI DF-A9-FF)
        Count: 1
< ACL Data TX: Handle 1515 flags 0x00 dlen 21             #226 [hci1] 16.256162
      SMP: Pairing Confirm (0x03) len 16
        Confim value: 2ca4dd146e4da1df6b4240c70a0ad5a5
> HCI Event: Number of Completed Packets (0x13) plen 5    #227 [hci1] 16.418938
        Num handles: 1
        Handle: 1515 Address: DF:A9:FF:F6:B1:1A (OUI DF-A9-FF)
        Count: 1
        #226: len 21 (1 Kb/s)
        Latency: 162 msec (65-173 msec ~162 msec)
> ACL Data RX: Handle 1515 flags 0x02 dlen 21             #228 [hci1] 16.419307
      SMP: Pairing Random (0x04) len 16
        Random value: 5b745761297497b00000000000000000
