Bluetooth monitor ver 5.72
= Note: Linux version 6.14.0-36-generic (x86_64)                       0.026387
= Note: Bluetooth subsystem version 2.22                               0.026388
= New Index: 00:00:00:00:00:00 (Primary,UART,hci1)              [hci1] 0.026389
= New Index: 48:5F:99:8E:E0:64 (Primary,USB,hci0)               [hci0] 0.026390
= Open Index: 00:00:00:00:00:00                                 [hci1] 0.170082
= Index Info: 00:00:00:00:00:00 (Nordic Semiconductor ASA)      [hci1] 0.170097
@ USER Open: main (privileged) version 2.22            {0x0001} [hci1] 0.170106
< HCI Command: Reset (0x03|0x0003) plen 0                    #1 [hci1] 0.171420
> HCI Event: Command Complete (0x0e) plen 4                  #2 [hci1] 0.172005
      Reset (0x03|0x0003) ncmd 1
        Status: Success (0x00)
< HCI Command: Read Local Supported... (0x04|0x0003) plen 0  #3 [hci1] 0.189509
> HCI Event: Command Complete (0x0e) plen 12                 #4 [hci1] 0.189953
      Read Local Supported Features (0x04|0x0003) ncmd 1
        Status: Success (0x00)
        Features: 0x00 0x00 0x00 0x00 0x60 0x00 0x00 0x00
          BR/EDR Not Supported
          LE Supported (Controller)
< HCI Command: Read Local Version In.. (0x04|0x0001) plen 0  #5 [hci1] 0.209492
> HCI Event: Command Complete (0x0e) plen 12                 #6 [hci1] 0.210041
      Read Local Version Information (0x04|0x0001) ncmd 1
        Status: Success (0x00)
        HCI version: Reserved (0x0f) - Revision 12393 (0x3069)
        LMP version: Reserved (0x0f) - Subversion 12393 (0x3069)
        Manufacturer: Nordic Semiconductor ASA (89)
< HCI Command: Read Local Supported... (0x04|0x0002) plen 0  #7 [hci1] 0.229506
> HCI Event: Command Complete (0x0e) plen 68                 #8 [hci1] 0.230596
      Read Local Supported Commands (0x04|0x0002) ncmd 1
        Status: Success (0x00)
        Commands: 119 entries
          Disconnect (Octet 0 - Bit 5)
          Read Remote Version Information (Octet 2 - Bit 7)
          Set Event Mask (Octet 5 - Bit 6)
          Reset (Octet 5 - Bit 7)
          Read Connection Accept Timeout (Octet 7 - Bit 2)
          Write Connection Accept Timeout (Octet 7 - Bit 3)
          Read Transmit Power Level (Octet 10 - Bit 2)
          Set Controller To Host Flow Control (Octet 10 - Bit 5)
          Host Buffer Size (Octet 10 - Bit 6)
          Host Number of Completed Packets (Octet 10 - Bit 7)
          Read Local Version Information (Octet 14 - Bit 3)
          Read Local Supported Features (Octet 14 - Bit 5)
          Read BD ADDR (Octet 15 - Bit 1)
          Read RSSI (Octet 15 - Bit 5)
          Set Event Mask Page 2 (Octet 22 - Bit 2)
          LE Set Event Mask (Octet 25 - Bit 0)
          LE Read Buffer Size (Octet 25 - Bit 1)
          LE Read Local Supported Features (Octet 25 - Bit 2)
          LE Set Random Address (Octet 25 - Bit 4)
          LE Set Advertising Parameters (Octet 25 - Bit 5)
          LE Read Advertising Channel TX Power (Octet 25 - Bit 6)
          LE Set Advertising Data (Octet 25 - Bit 7)
          LE Set Scan Response Data (Octet 26 - Bit 0)
          LE Set Advertise Enable (Octet 26 - Bit 1)
          LE Set Scan Parameters (Octet 26 - Bit 2)
          LE Set Scan Enable (Octet 26 - Bit 3)
          LE Create Connection (Octet 26 - Bit 4)
          LE Create Connection Cancel (Octet 26 - Bit 5)
          LE Read Accept List Size (Octet 26 - Bit 6)
          LE Clear Accept List (Octet 26 - Bit 7)
          LE Add Device To Accept List (Octet 27 - Bit 0)
          LE Remove Device From Accept List (Octet 27 - Bit 1)
          LE Connection Update (Octet 27 - Bit 2)
          LE Set Host Channel Classification (Octet 27 - Bit 3)
          LE Read Channel Map (Octet 27 - Bit 4)
          LE Read Remote Used Features (Octet 27 - Bit 5)
          LE Encrypt (Octet 27 - Bit 6)
          LE Rand (Octet 27 - Bit 7)
          LE Start Encryption (Octet 28 - Bit 0)
          LE Long Term Key Request Reply (Octet 28 - Bit 1)
          LE Long Term Key Request Neg Reply (Octet 28 - Bit 2)
          LE Read Supported States (Octet 28 - Bit 3)
          LE Receiver Test (Octet 28 - Bit 4)
          LE Transmitter Test (Octet 28 - Bit 5)
          LE Test End (Octet 28 - Bit 6)
          Read Authenticated Payload Timeout (Octet 32 - Bit 4)
          Write Authenticated Payload Timeout (Octet 32 - Bit 5)
          LE Set Data Length (Octet 33 - Bit 6)
          LE Read Suggested Default Data Length (Octet 33 - Bit 7)
          LE Write Suggested Default Data Length (Octet 34 - Bit 0)
          LE Add Device To Resolving List (Octet 34 - Bit 3)
          LE Remove Device From Resolving List (Octet 34 - Bit 4)
          LE Clear Resolving List (Octet 34 - Bit 5)
          LE Read Resolving List Size (Octet 34 - Bit 6)
          LE Set Address Resolution Enable (Octet 35 - Bit 1)
          LE Set Resolvable Private Address Timeout (Octet 35 - Bit 2)
          LE Read Maximum Data Length (Octet 35 - Bit 3)
          LE Read PHY (Octet 35 - Bit 4)
          LE Set Default PHY (Octet 35 - Bit 5)
          LE Set PHY (Octet 35 - Bit 6)
          LE Enhanced Receiver Test (Octet 35 - Bit 7)
          LE Enhanced Transmitter Test (Octet 36 - Bit 0)
          LE Set Advertising Set Random Address (Octet 36 - Bit 1)
          LE Set Extended Advertising Parameters (Octet 36 - Bit 2)
          LE Set Extended Advertising Data (Octet 36 - Bit 3)
          LE Set Extended Scan Response Data (Octet 36 - Bit 4)
          LE Set Extended Advertising Enable (Octet 36 - Bit 5)
          LE Read Maximum Advertising Data Length (Octet 36 - Bit 6)
          LE Read Number of Supported Advertising Sets (Octet 36 - Bit 7)
          LE Remove Advertising Set (Octet 37 - Bit 0)
          LE Clear Advertising Sets (Octet 37 - Bit 1)
          LE Set Periodic Advertising Parameters (Octet 37 - Bit 2)
          LE Set Periodic Advertising Data (Octet 37 - Bit 3)
          LE Set Periodic Advertising Enable (Octet 37 - Bit 4)
          LE Set Extended Scan Parameters (Octet 37 - Bit 5)
          LE Set Extended Scan Enable (Octet 37 - Bit 6)
          LE Extended Create Connection (Octet 37 - Bit 7)
          LE Periodic Advertising Create Sync (Octet 38 - Bit 0)
          LE Periodic Advertising Create Sync Cancel (Octet 38 - Bit 1)
          LE Periodic Advertising Terminate Sync (Octet 38 - Bit 2)
          LE Add Device To Periodic Advertiser List (Octet 38 - Bit 3)
          LE Remove Device From Periodic Advertiser List (Octet 38 - Bit 4)
          LE Clear Periodic Advertiser List (Octet 38 - Bit 5)
          LE Read Periodic Advertiser List Size (Octet 38 - Bit 6)
          LE Read Transmit Power (Octet 38 - Bit 7)
          LE Read RF Path Compensation (Octet 39 - Bit 0)
          LE Write RF Path Compensation (Octet 39 - Bit 1)
          LE Set Privacy Mode (Octet 39 - Bit 2)
          LE Periodic Advertising Receive Enable (Octet 40 - Bit 5)
          LE Periodic Advertising Sync Transfer (Octet 40 - Bit 6)
          LE Periodic Advertising Set Info Transfer (Octet 40 - Bit 7)
          LE Periodic Advertising Sync Transfer Parameters (Octet 41 - Bit 0)
          LE Set Default Periodic Advertisng Sync Transfer Parameters (Octet 41 - Bit 1)
          LE Read Buffer v2 (Octet 41 - Bit 5)
          LE Read ISO TX Sync (Octet 41 - Bit 6)
          LE Set Connected Isochronous Group Parameters (Octet 41 - Bit 7)
          LE Set Connected Isochronous Group Parameters Test (Octet 42 - Bit 0)
          LE Create Connected Isochronous Stream (Octet 42 - Bit 1)
          LE Remove Connected Isochronous Group (Octet 42 - Bit 2)
          LE Accept Connected Isochronous Stream Request (Octet 42 - Bit 3)
          LE Reject Connected Isochronous Stream Request (Octet 42 - Bit 4)
          LE Create Broadcast Isochronous Group (Octet 42 - Bit 5)
          LE Create Broadcast Isochronous Group Test (Octet 42 - Bit 6)
          LE Terminate Broadcast Isochronous Group (Octet 42 - Bit 7)
          LE Broadcast Isochronous Group Create Sync (Octet 43 - Bit 0)
          LE Broadcast Isochronous Group Terminate Sync (Octet 43 - Bit 1)
          LE Request Peer SCA (Octet 43 - Bit 2)
          LE Setup Isochronous Data Path (Octet 43 - Bit 3)
          LE Remove Isochronous Data Path (Octet 43 - Bit 4)
          LE Isochronous Transmit Test (Octet 43 - Bit 5)
          LE Isochronous Receive Test (Octet 43 - Bit 6)
          LE Isochronous Read Test Counters (Octet 43 - Bit 7)
          LE Isochronous Read Test Counters (Octet 44 - Bit 0)
          LE Set Host Feature (Octet 44 - Bit 1)
          Octet 44 - Bit 2 
          Octet 45 - Bit 6 
          Octet 46 - Bit 0 
          Octet 46 - Bit 1 
          Octet 46 - Bit 2 
< HCI Command: Host Buffer Size (0x03|0x0033) plen 7         #9 [hci1] 0.249477
        ACL MTU: 255  ACL max packet: 16
        SCO MTU: 0    SCO max packet: 0
> HCI Event: Command Complete (0x0e) plen 4                 #10 [hci1] 0.249987
      Host Buffer Size (0x03|0x0033) ncmd 1
        Status: Success (0x00)
< HCI Command: Set Controller To Ho.. (0x03|0x0031) plen 1  #11 [hci1] 0.269419
        Flow control: ACL Data Packets (0x01)
> HCI Event: Command Complete (0x0e) plen 4                 #12 [hci1] 0.269867
      Set Controller To Host Flow Control (0x03|0x0031) ncmd 1
        Status: Success (0x00)
< HCI Command: LE Read Local Suppor.. (0x08|0x0003) plen 0  #13 [hci1] 0.289460
> HCI Event: Command Complete (0x0e) plen 12                #14 [hci1] 0.290005
      LE Read Local Supported Features (0x08|0x0003) ncmd 1
        Status: Success (0x00)
        Features: 0xfd 0x79 0x00 0xf7 0x30 0x01 0x00 0x00
          LE Encryption
          Extended Reject Indication
          Peripheral-initiated Features Exchange
          LE Ping
          LE Data Packet Length Extension
          LL Privacy
          Extended Scanner Filter Policies
          LE 2M PHY
          LE Coded PHY
          LE Extended Advertising
          LE Periodic Advertising
          Channel Selection Algorithm #2
          Periodic Advertising Sync Transfer - Sender
          Periodic Advertising Sync Transfer - Recipient
          Sleep Clock Accuracy Updates
          Connected Isochronous Stream - Central
          Connected Isochronous Stream - Peripheral
          Isochronous Broadcaster
          Synchronized Receiver
          Periodic Advertising ADI support
          Connection Subrating
          Unknown features (0x0000010000000000)
< HCI Command: LE Set Host Feature (0x08|0x0074) plen 2     #15 [hci1] 0.309488
        Bit Number: 32
          Connected Isochronous Stream (Host Support)
        Bit Value: 1
> HCI Event: Command Complete (0x0e) plen 4                 #16 [hci1] 0.309961
      LE Set Host Feature (0x08|0x0074) ncmd 1
        Status: Success (0x00)
< HCI Command: LE Read Buffer v2 (0x08|0x0060) plen 0       #17 [hci1] 0.329492
> HCI Event: Command Complete (0x0e) plen 10                #18 [hci1] 0.329929
      LE Read Buffer v2 (0x08|0x0060) ncmd 1
        Status: Success (0x00)
        ACL MTU: 27
        ACL max packet: 3
        ISO MTU: 318
        ISO max packet: 3
< HCI Command: LE Read Maximum Adve.. (0x08|0x003a) plen 0  #19 [hci1] 0.349505
> HCI Event: Command Complete (0x0e) plen 6                 #20 [hci1] 0.349967
      LE Read Maximum Advertising Data Length (0x08|0x003a) ncmd 1
        Status: Success (0x00)
        Max length: 1650
< HCI Command: LE Read Supported St.. (0x08|0x001c) plen 0  #21 [hci1] 0.369506
> HCI Event: Command Complete (0x0e) plen 12                #22 [hci1] 0.370019
      LE Read Supported States (0x08|0x001c) ncmd 1
        Status: Success (0x00)
        States: 0x000003ff3e0306ff
          Non-connectable Advertising State
          Scannable Advertising State
          Connectable Advertising State
          High Duty Cycle Directed Advertising State
          Passive Scanning State
          Active Scanning State
          Initiating State
            and Connection State (Central Role)
          Connection State (Peripheral Role)
          Scannable Advertising State
            and Passive Scanning State
          Connectable Advertising State
            and Passive Scanning State
          Non-connectable Advertising State
            and Initiating State
          Scannable Advertising State
            and Initiating State
          Active Scanning State
            and Connection State (Central Role)
          Passive Scanning State
            and Connection State (Peripheral Role)
          Active Scanning State
            and Connection State (Peripheral Role)
          Initiating State
            and Connection State (Central Role)
            and Central Role & Central Role
          Low Duty Cycle Directed Advertising State
          Connectable Advertising State
            and Initiating State
            and Central Role & Peripheral Role
          High Duty Cycle Directed Advertising State
            and Initiating State
            and Central Role & Peripheral Role
          Low Duty Cycle Directed Advertising State
            and Initiating State
            and Central Role & Peripheral Role
          Connectable Advertising State
            and Connection State (Central Role)
            and Central Role & Peripheral Role
          High Duty Cycle Directed Advertising State
            and Connection State (Central Role)
            and Central Role & Peripheral Role
          Low Duty Cycle Directed Advertising State
            and Connection State (Central Role)
            and Central Role & Peripheral Role
          Connectable Advertising State
            and Connection State (Peripheral Role)
            and Central Role & Peripheral Role
          High Duty Cycle Directed Advertising State
            and Connection State (Peripheral Role)
            and Peripheral Role & Peripheral Role
          Low Duty Cycle Directed Advertising State
            and Connection State (Peripheral Role)
            and Peripheral Role & Peripheral Role
          Initiating State
            and Connection State (Peripheral Role)
            and Central Role & Peripheral Role
< HCI Command: LE Read Maximum Data.. (0x08|0x002f) plen 0  #23 [hci1] 0.389514
> HCI Event: Command Complete (0x0e) plen 12                #24 [hci1] 0.390074
      LE Read Maximum Data Length (0x08|0x002f) ncmd 1
        Status: Success (0x00)
        Max TX octets: 251
        Max TX time: 2704
        Max RX octets: 251
        Max RX time: 2704
< HCI Command: LE Write Suggested D.. (0x08|0x0024) plen 4  #25 [hci1] 0.409468
        TX octets: 251
        TX time: 2704
> HCI Event: Command Complete (0x0e) plen 4                 #26 [hci1] 0.409944
      LE Write Suggested Default Data Length (0x08|0x0024) ncmd 1
        Status: Success (0x00)
< HCI Command: LE Read Resolving Li.. (0x08|0x002a) plen 0  #27 [hci1] 0.429435
> HCI Event: Command Complete (0x0e) plen 5                 #28 [hci1] 0.429865
      LE Read Resolving List Size (0x08|0x002a) ncmd 1
        Status: Success (0x00)
        Size: 8
< HCI Command: LE Set Host Feature (0x08|0x0074) plen 2     #29 [hci1] 0.449436
        Bit Number: 38
          Connection Subrating (Host Support)
        Bit Value: 1
> HCI Event: Command Complete (0x0e) plen 4                 #30 [hci1] 0.449967
      LE Set Host Feature (0x08|0x0074) ncmd 1
        Status: Success (0x00)
< HCI Command: LE Set Event Mask (0x08|0x0001) plen 8       #31 [hci1] 0.469463
        Mask: 0x000002063f87fa5e
          LE Advertising Report
          LE Connection Update Complete
          LE Read Remote Used Features Complete
          LE Long Term Key Request
          LE Data Length Change
          LE Enhanced Connection Complete
          LE PHY Update Complete
          LE Extended Advertising Report
          LE Periodic Advertising Sync Established
          LE Periodic Advertising Report
          LE Periodic Advertising Sync Lost
          LE Extended Scan Timeout
          LE Extended Advertising Set Terminated
          LE Scan Request Received
          LE Periodic Advertising Sync Transfer Rvc
          LE CIS Established
          LE CIS Request
          LE Create BIG Complete
          LE Terminate BIG Complete
          LE BIG Sync Estabilished Complete
          LE BIG Sync Lost
          LE BIG Info Advertising Report
          LE Subrate Change
          Unknown mask (0x0000020000000000)
> HCI Event: Command Complete (0x0e) plen 4                 #32 [hci1] 0.469954
      LE Set Event Mask (0x08|0x0001) ncmd 1
        Status: Success (0x00)
< HCI Command: Set Event Mask (0x03|0x0001) plen 8          #33 [hci1] 0.489486
        Mask: 0x2000800002008890
          Disconnection Complete
          Encryption Change
          Read Remote Version Information Complete
          Hardware Error
          Data Buffer Overflow
          Encryption Key Refresh Complete
          LE Meta
> HCI Event: Command Complete (0x0e) plen 4                 #34 [hci1] 0.490049
      Set Event Mask (0x03|0x0001) ncmd 1
        Status: Success (0x00)
< HCI Command: Read BD ADDR (0x04|0x0009) plen 0            #35 [hci1] 0.509493
> HCI Event: Command Complete (0x0e) plen 10                #36 [hci1] 0.510094
      Read BD ADDR (0x04|0x0009) ncmd 1
        Status: Success (0x00)
        Address: 00:00:00:00:00:00 (OUI 00-00-00)
< HCI Command: LE Set Random Address (0x08|0x0005) plen 6   #37 [hci1] 0.529439
        Address: D5:B6:CC:31:DB:3B (Static)
> HCI Event: Command Complete (0x0e) plen 4                 #38 [hci1] 0.529930
      LE Set Random Address (0x08|0x0005) ncmd 1
        Status: Success (0x00)
< HCI Command: LE Extended Create... (0x08|0x0043) plen 26  #39 [hci1] 3.229610
        Filter policy: Accept list is not used (0x00)
        Own address type: Random (0x01)
        Peer address type: Public (0x00)
        Peer address: DF:A9:FF:F6:B1:1A (OUI DF-A9-FF)
        Initiating PHYs: 0x01
        Entry 0: LE 1M
          Scan interval: 60.000 msec (0x0060)
          Scan window: 60.000 msec (0x0060)
          Min connection interval: 50.00 msec (0x0028)
          Max connection interval: 70.00 msec (0x0038)
          Connection latency: 0 (0x0000)
          Supervision timeout: 4000 msec (0x0190)
          Min connection length: 0.000 msec (0x0000)
          Max connection length: 0.000 msec (0x0000)
> HCI Event: Command Status (0x0f) plen 4                   #40 [hci1] 3.230536
      LE Extended Create Connection (0x08|0x0043) ncmd 1
        Status: Success (0x00)
> HCI Event: LE Meta Event (0x3e) plen 31                   #41 [hci1] 3.292567
      LE Enhanced Connection Complete (0x0a)
        Status: Success (0x00)
        Handle: 1944
        Role: Central (0x00)
        Peer address type: Public (0x00)
        Peer address: DF:A9:FF:F6:B1:1A (OUI DF-A9-FF)
        Local resolvable private address: 00:00:00:00:00:00 (Non-Resolvable)
        Peer resolvable private address: 00:00:00:00:00:00 (Non-Resolvable)
        Connection interval: 70.00 msec (0x0038)
        Connection latency: 0 (0x0000)
        Supervision timeout: 4000 msec (0x0190)
        Central clock accuracy: 0x00
< HCI Command: LE Read Remote Used... (0x08|0x0016) plen 2  #42 [hci1] 3.309728
        Handle: 1944 Address: DF:A9:FF:F6:B1:1A (OUI DF-A9-FF)
< ACL Data TX: Handle 1944 flags 0x00 dlen 7                #43 [hci1] 3.309756
      ATT: Exchange MTU Request (0x02) len 2
        Client RX MTU: 251
> HCI Event: Command Status (0x0f) plen 4                   #44 [hci1] 3.310236
      LE Read Remote Used Features (0x08|0x0016) ncmd 1
        Status: Success (0x00)
< HCI Command: LE Set PHY (0x08|0x0032) plen 7              #45 [hci1] 3.329686
        Handle: 1944 Address: DF:A9:FF:F6:B1:1A (OUI DF-A9-FF)
        All PHYs preference: 0x00
        TX PHYs preference: 0x02
          LE 2M
        RX PHYs preference: 0x02
          LE 2M
        PHY options preference: Reserved (0x0000)
> HCI Event: Command Status (0x0f) plen 4                   #46 [hci1] 3.330219
      LE Set PHY (0x08|0x0032) ncmd 1
        Status: Success (0x00)
> HCI Event: Number of Completed Packets (0x13) plen 5      #47 [hci1] 3.364883
        Num handles: 1
        Handle: 1944 Address: DF:A9:FF:F6:B1:1A (OUI DF-A9-FF)
        Count: 1
        #43: len 7 (1 Kb/s)
        Latency: 55 msec (55-55 msec ~55 msec)
> HCI Event: LE Meta Event (0x3e) plen 12                   #48 [hci1] 3.504978
      LE Read Remote Used Features (0x04)
        Status: Success (0x00)
        Handle: 1944 Address: DF:A9:FF:F6:B1:1A (OUI DF-A9-FF)
        Features: 0x2d 0x49 0x00 0xf7 0x67 0xd9 0x00 0x80
          LE Encryption
          Extended Reject Indication
          Peripheral-initiated Features Exchange
          LE Data Packet Length Extension
          LE 2M PHY
          LE Coded PHY
          Channel Selection Algorithm #2
          Periodic Advertising Sync Transfer - Sender
          Periodic Advertising Sync Transfer - Recipient
          Sleep Clock Accuracy Updates
          Connected Isochronous Stream - Central
          Connected Isochronous Stream - Peripheral
          Isochronous Broadcaster
          Synchronized Receiver
          Connected Isochronous Stream (Host Support)
          LE Power Control Request
          LE Power Control Request
          Connection Subrating
          Connection Subrating (Host Support)
          Unknown features (0x8000d90000000000)
> HCI Event: LE Meta Event (0x3e) plen 6                    #49 [hci1] 4.204274
      LE PHY Update Complete (0x0c)
        Status: Success (0x00)
        Handle: 1944 Address: DF:A9:FF:F6:B1:1A (OUI DF-A9-FF)
        TX PHY: LE 2M (0x02)
        RX PHY: LE 2M (0x02)
> ACL Data RX: Handle 1944 flags 0x02 dlen 6                #50 [hci1] 4.344657
      SMP: Security Request (0x0b) len 1
        Authentication requirement: Bonding, No MITM, SC, No Keypresses (0x09)
> ACL Data RX: Handle 1944 flags 0x02 dlen 7                #51 [hci1] 4.345180
      ATT: Exchange MTU Response (0x03) len 2
        Server RX MTU: 23
< HCI Command: Host Number of Compl.. (0x03|0x0035) plen 5  #52 [hci1] 4.349751
        Num handles: 1
        Handle: 1944 Address: DF:A9:FF:F6:B1:1A (OUI DF-A9-FF)
        Count: 1
< ACL Data TX: Handle 1944 flags 0x00 dlen 11               #53 [hci1] 4.349851
      SMP: Pairing Request (0x01) len 6
        IO capability: DisplayOnly (0x00)
        OOB data: Authentication data not present (0x00)
        Authentication requirement: Bonding, No MITM, SC, No Keypresses (0x09)
        Max encryption key size: 16
        Initiator key distribution: EncKey (0x01)
        Responder key distribution: EncKey IdKey (0x03)
< HCI Command: Host Number of Compl.. (0x03|0x0035) plen 5  #54 [hci1] 4.350147
        Num handles: 1
        Handle: 1944 Address: DF:A9:FF:F6:B1:1A (OUI DF-A9-FF)
        Count: 1
> HCI Event: Number of Completed Packets (0x13) plen 5      #55 [hci1] 4.414744
        Num handles: 1
        Handle: 1944 Address: DF:A9:FF:F6:B1:1A (OUI DF-A9-FF)
        Count: 1
        #53: len 11 (1 Kb/s)
        Latency: 64 msec (55-64 msec ~60 msec)
> ACL Data RX: Handle 1944 flags 0x02 dlen 11               #56 [hci1] 4.484862
      SMP: Pairing Response (0x02) len 6
        IO capability: KeyboardDisplay (0x04)
        OOB data: Authentication data not present (0x00)
        Authentication requirement: Bonding, No MITM, SC, No Keypresses (0x09)
        Max encryption key size: 16
        Initiator key distribution: EncKey (0x01)
        Responder key distribution: EncKey IdKey (0x03)
< HCI Command: Host Number of Compl.. (0x03|0x0035) plen 5  #57 [hci1] 4.490018
        Num handles: 1
        Handle: 1944 Address: DF:A9:FF:F6:B1:1A (OUI DF-A9-FF)
        Count: 1
< ACL Data TX: Handle 1944 flags 0x00 dlen 27               #58 [hci1] 4.490136
< ACL Data TX: Handle 1944 flags 0x01 dlen 27               #59 [hci1] 4.490155
< ACL Data TX: Handle 1944 flags 0x01 dlen 15               #60 [hci1] 4.490158
      SMP: Pairing Public Key (0x0c) len 64
        X: 98308440221e2d910f0e54b71e7ec652857aa9b5a0dc65028824cc19db1226e9
        Y: 67a4816bcb62efb21701e31fdb27561a6217575fb007a8bbdabe7e28b6f68482
> HCI Event: Number of Completed Packets (0x13) plen 5      #61 [hci1] 4.554766
        Num handles: 1
        Handle: 1944 Address: DF:A9:FF:F6:B1:1A (OUI DF-A9-FF)
        Count: 1
        #58: len 27 (3 Kb/s)
        Latency: 64 msec (55-64 msec ~62 msec)
> HCI Event: Number of Completed Packets (0x13) plen 5      #62 [hci1] 4.555243
        Num handles: 1
        Handle: 1944 Address: DF:A9:FF:F6:B1:1A (OUI DF-A9-FF)
        Count: 1
        #59: len 27 (3 Kb/s)
        Latency: 65 msec (55-65 msec ~63 msec)
> HCI Event: Number of Completed Packets (0x13) plen 5      #63 [hci1] 4.555723
        Num handles: 1
        Handle: 1944 Address: DF:A9:FF:F6:B1:1A (OUI DF-A9-FF)
        Count: 1
        #60: len 15 (1 Kb/s)
        Latency: 65 msec (55-65 msec ~64 msec)
> ACL Data RX: Handle 1944 flags 0x02 dlen 27               #64 [hci1] 4.624985
> ACL Data RX: Handle 1944 flags 0x01 dlen 27               #65 [hci1] 4.625427
> ACL Data RX: Handle 1944 flags 0x01 dlen 15               #66 [hci1] 4.625807
      SMP: Pairing Public Key (0x0c) len 64
        X: 4fb66dc406972c2f2ab6996d0879835fd6ba6e3808b868663ccf7634a1359bb0
        Y: d3f86d3fd19e15b1869da80464e6af4cf7525889213f09709f99a54a845c57cf
< HCI Command: Host Number of Compl.. (0x03|0x0035) plen 5  #67 [hci1] 4.629685
        Num handles: 1
        Handle: 1944 Address: DF:A9:FF:F6:B1:1A (OUI DF-A9-FF)
        Count: 1
< HCI Command: Host Number of Compl.. (0x03|0x0035) plen 5  #68 [hci1] 4.629819
        Num handles: 1
        Handle: 1944 Address: DF:A9:FF:F6:B1:1A (OUI DF-A9-FF)
        Count: 1
< HCI Command: Host Number of Compl.. (0x03|0x0035) plen 5  #69 [hci1] 4.629883
        Num handles: 1
        Handle: 1944 Address: DF:A9:FF:F6:B1:1A (OUI DF-A9-FF)
        Count: 1
> ACL Data RX: Handle 1944 flags 0x02 dlen 21               #70 [hci1] 4.695050
      SMP: Pairing Confirm (0x03) len 16
        Confim value: fa76e9291772482a78b4222a344cf37c
< HCI Command: Host Number of Compl.. (0x03|0x0035) plen 5  #71 [hci1] 4.709654
        Num handles: 1
        Handle: 1944 Address: DF:A9:FF:F6:B1:1A (OUI DF-A9-FF)
        Count: 1
< ACL Data TX: Handle 1944 flags 0x00 dlen 21               #72 [hci1] 4.709761
      SMP: Pairing Random (0x04) len 16
        Random value: 8e6108f966a694cbe26df70bb96773e6
> HCI Event: Number of Completed Packets (0x13) plen 5      #73 [hci1] 4.764748
        Num handles: 1
        Handle: 1944 Address: DF:A9:FF:F6:B1:1A (OUI DF-A9-FF)
        Count: 1
        #72: len 21 (3 Kb/s)
        Latency: 54 msec (54-65 msec ~59 msec)
> ACL Data RX: Handle 1944 flags 0x02 dlen 21               #74 [hci1] 4.835010
      SMP: Pairing Random (0x04) len 16
        Random value: acd707e583e55c1d0000000000000000
< HCI Command: Host Number of Compl.. (0x03|0x0035) plen 5  #75 [hci1] 4.849840
        Num handles: 1
        Handle: 1944 Address: DF:A9:FF:F6:B1:1A (OUI DF-A9-FF)
        Count: 1
< ACL Data TX: Handle 1944 flags 0x00 dlen 21               #76 [hci1] 4.849898
      SMP: Pairing DHKey Check (0x0d) len 16
        E: 8dee16dd2503e1e3c5eb3dbab1808808
> HCI Event: Number of Completed Packets (0x13) plen 5      #77 [hci1] 4.904751
        Num handles: 1
        Handle: 1944 Address: DF:A9:FF:F6:B1:1A (OUI DF-A9-FF)
        Count: 1
        #76: len 21 (3 Kb/s)
        Latency: 54 msec (54-65 msec ~57 msec)
> ACL Data RX: Handle 1944 flags 0x02 dlen 21               #78 [hci1] 5.185012
      SMP: Pairing DHKey Check (0x0d) len 16
        E: a6860b42c589880ec1cfc81e9896eb1e
< HCI Command: LE Start Encryption (0x08|0x0019) plen 28    #79 [hci1] 5.190178
        Handle: 1944 Address: DF:A9:FF:F6:B1:1A (OUI DF-A9-FF)
        Random number: 0x0000000000000000
        Encrypted diversifier: 0x0000
        Long term key: 38e7110031c6373341d6bce06a55201d
> HCI Event: Command Status (0x0f) plen 4                   #80 [hci1] 5.191066
      LE Start Encryption (0x08|0x0019) ncmd 1
        Status: Success (0x00)
< HCI Command: Host Number of Compl.. (0x03|0x0035) plen 5  #81 [hci1] 5.209774
        Num handles: 1
        Handle: 1944 Address: DF:A9:FF:F6:B1:1A (OUI DF-A9-FF)
        Count: 1
> HCI Event: Encryption Change (0x08) plen 4                #82 [hci1] 5.674674
        Status: Success (0x00)
        Handle: 1944 Address: DF:A9:FF:F6:B1:1A (OUI DF-A9-FF)
        Encryption: Enabled with AES-CCM (0x01)
> ACL Data RX: Handle 1944 flags 0x02 dlen 21               #83 [hci1] 5.744992
      SMP: Identity Information (0x08) len 16
        Identity resolving key: b341d5106e56095b1020d5b60769b048
< HCI Command: Host Number of Compl.. (0x03|0x0035) plen 5  #84 [hci1] 5.749636
        Num handles: 1
        Handle: 1944 Address: DF:A9:FF:F6:B1:1A (OUI DF-A9-FF)
        Count: 1
< ACL Data TX: Handle 1944 flags 0x00 dlen 13               #85 [hci1] 5.769835
      ATT: Find By Type Value Request (0x06) len 8
        Handle range: 0x0001-0xffff
        Attribute type: Primary Service (0x2800)
          UUID: Volume Control (0x1844)
> HCI Event: Number of Completed Packets (0x13) plen 5      #86 [hci1] 5.814777
        Num handles: 1
        Handle: 1944 Address: DF:A9:FF:F6:B1:1A (OUI DF-A9-FF)
        Count: 1
        #85: len 13 (2 Kb/s)
        Latency: 44 msec (44-65 msec ~51 msec)
> ACL Data RX: Handle 1944 flags 0x02 dlen 12               #87 [hci1] 5.885065
      SMP: Identity Address Information (0x09) len 7
        Address: DF:A9:FF:F6:B1:1A (OUI DF-A9-FF)
< HCI Command: LE Add Device To Re.. (0x08|0x0027) plen 39  #88 [hci1] 5.890127
        Address type: Public (0x00)
        Address: DF:A9:FF:F6:B1:1A (OUI DF-A9-FF)
        Peer identity resolving key: b341d5106e56095b1020d5b60769b048
        Local identity resolving key: 00000000000000000000000000000000
> HCI Event: Command Complete (0x0e) plen 4                 #89 [hci1] 5.891131
      LE Add Device To Resolving List (0x08|0x0027) ncmd 1
        Status: Success (0x00)
< HCI Command: LE Set Privacy Mode (0x08|0x004e) plen 8     #90 [hci1] 5.909776
        Peer Identity address type: Public (0x00)
        Peer Identity address: DF:A9:FF:F6:B1:1A (OUI DF-A9-FF)
        Privacy Mode: Use Device Privacy (0x01)
> HCI Event: Command Complete (0x0e) plen 4                 #91 [hci1] 5.910348
      LE Set Privacy Mode (0x08|0x004e) ncmd 1
        Status: Success (0x00)
< HCI Command: LE Set Address Resol.. (0x08|0x002d) plen 1  #92 [hci1] 5.929922
        Address resolution: Enabled (0x01)
> HCI Event: Command Complete (0x0e) plen 4                 #93 [hci1] 5.930359
      LE Set Address Resolution Enable (0x08|0x002d) ncmd 1
        Status: Success (0x00)
< HCI Command: Host Number of Compl.. (0x03|0x0035) plen 5  #94 [hci1] 5.949726
        Num handles: 1
        Handle: 1944 Address: DF:A9:FF:F6:B1:1A (OUI DF-A9-FF)
        Count: 1
> ACL Data RX: Handle 1944 flags 0x02 dlen 9                #95 [hci1] 5.954784
      ATT: Find By Type Value Response (0x07) len 4
        Handle range: 0x00d0-0x00da
< HCI Command: Host Number of Compl.. (0x03|0x0035) plen 5  #96 [hci1] 5.970116
        Num handles: 1
        Handle: 1944 Address: DF:A9:FF:F6:B1:1A (OUI DF-A9-FF)
        Count: 1
< ACL Data TX: Handle 1944 flags 0x00 dlen 11               #97 [hci1] 5.970205
      ATT: Read By Type Request (0x08) len 6
        Handle range: 0x00d1-0x00da
        Attribute type: Characteristic (0x2803)
> HCI Event: Number of Completed Packets (0x13) plen 5      #98 [hci1] 6.024743
        Num handles: 1
        Handle: 1944 Address: DF:A9:FF:F6:B1:1A (OUI DF-A9-FF)
        Count: 1
        #97: len 11 (1 Kb/s)
        Latency: 54 msec (44-65 msec ~52 msec)
> ACL Data RX: Handle 1944 flags 0x02 dlen 27               #99 [hci1] 6.095031
      ATT: Read By Type Response (0x09) len 22
        Attribute data length: 7
        Attribute data list: 3 entries
        Handle: 0x00d3
        Value: 12d4007d2b
            Properties: 0x12
              Read (0x02)
              Notify (0x10)
            Value Handle: 0x00d4
            Value UUID: Volume State (0x2b7d)
        Handle: 0x00d6
        Value: 12d7007f2b
            Properties: 0x12
              Read (0x02)
              Notify (0x10)
            Value Handle: 0x00d7
            Value UUID: Volume Flags (0x2b7f)
        Handle: 0x00d9
        Value: 08da007e2b
            Properties: 0x08
              Write (0x08)
            Value Handle: 0x00da
            Value UUID: Volume Control Point (0x2b7e)
< HCI Command: Host Number of Comp.. (0x03|0x0035) plen 5  #100 [hci1] 6.109695
        Num handles: 1
        Handle: 1944 Address: DF:A9:FF:F6:B1:1A (OUI DF-A9-FF)
        Count: 1
< ACL Data TX: Handle 1944 flags 0x00 dlen 9               #101 [hci1] 6.109725
      ATT: Find Information Request (0x04) len 4
        Handle range: 0x00d4-0x00da
> HCI Event: Number of Completed Packets (0x13) plen 5     #102 [hci1] 6.164733
        Num handles: 1
        Handle: 1944 Address: DF:A9:FF:F6:B1:1A (OUI DF-A9-FF)
        Count: 1
        #101: len 9 (1 Kb/s)
        Latency: 55 msec (44-65 msec ~53 msec)
> ACL Data RX: Handle 1944 flags 0x02 dlen 26              #103 [hci1] 6.234990
      ATT: Find Information Response (0x05) len 21
        Format: UUID-16 (0x01)
        Handle: 0x00d4
        UUID: Volume State (0x2b7d)
        Handle: 0x00d5
        UUID: Client Characteristic Configuration (0x2902)
        Handle: 0x00d6
        UUID: Characteristic (0x2803)
        Handle: 0x00d7
        UUID: Volume Flags (0x2b7f)
        Handle: 0x00d8
        UUID: Client Characteristic Configuration (0x2902)
< HCI Command: Host Number of Comp.. (0x03|0x0035) plen 5  #104 [hci1] 6.250082
        Num handles: 1
        Handle: 1944 Address: DF:A9:FF:F6:B1:1A (OUI DF-A9-FF)
        Count: 1
< ACL Data TX: Handle 1944 flags 0x00 dlen 9               #105 [hci1] 6.250182
      ATT: Find Information Request (0x04) len 4
        Handle range: 0x00d7-0x00da
> HCI Event: Number of Completed Packets (0x13) plen 5     #106 [hci1] 6.304763
        Num handles: 1
        Handle: 1944 Address: DF:A9:FF:F6:B1:1A (OUI DF-A9-FF)
        Count: 1
        #105: len 9 (1 Kb/s)
        Latency: 54 msec (44-65 msec ~54 msec)
> ACL Data RX: Handle 1944 flags 0x02 dlen 22              #107 [hci1] 6.374974
      ATT: Find Information Response (0x05) len 17
        Format: UUID-16 (0x01)
        Handle: 0x00d7
        UUID: Volume Flags (0x2b7f)
        Handle: 0x00d8
        UUID: Client Characteristic Configuration (0x2902)
        Handle: 0x00d9
        UUID: Characteristic (0x2803)
        Handle: 0x00da
        UUID: Volume Control Point (0x2b7e)
< HCI Command: Host Number of Comp.. (0x03|0x0035) plen 5  #108 [hci1] 6.389615
        Num handles: 1
        Handle: 1944 Address: DF:A9:FF:F6:B1:1A (OUI DF-A9-FF)
        Count: 1
< ACL Data TX: Handle 1944 flags 0x00 dlen 11              #109 [hci1] 6.389692
      ATT: Read By Type Request (0x08) len 6
        Handle range: 0x00da-0x00da
        Attribute type: Characteristic (0x2803)
> HCI Event: Number of Completed Packets (0x13) plen 5     #110 [hci1] 6.444781
        Num handles: 1
        Handle: 1944 Address: DF:A9:FF:F6:B1:1A (OUI DF-A9-FF)
        Count: 1
        #109: len 11 (1 Kb/s)
        Latency: 55 msec (44-65 msec ~54 msec)
> ACL Data RX: Handle 1944 flags 0x02 dlen 9               #111 [hci1] 6.514775
      ATT: Error Response (0x01) len 4
        Read By Type Request (0x08)
        Handle: 0x00da
        Error: Attribute Not Found (0x0a)
< HCI Command: Host Number of Comp.. (0x03|0x0035) plen 5  #112 [hci1] 6.530194
        Num handles: 1
        Handle: 1944 Address: DF:A9:FF:F6:B1:1A (OUI DF-A9-FF)
        Count: 1
< ACL Data TX: Handle 1944 flags 0x00 dlen 9               #113 [hci1] 6.530359
      ATT: Write Request (0x12) len 4
        Handle: 0x00d5
          Data: 0100
> HCI Event: Number of Completed Packets (0x13) plen 5     #114 [hci1] 6.584806
        Num handles: 1
        Handle: 1944 Address: DF:A9:FF:F6:B1:1A (OUI DF-A9-FF)
        Count: 1
        #113: len 9 (1 Kb/s)
        Latency: 54 msec (44-65 msec ~54 msec)
> ACL Data RX: Handle 1944 flags 0x02 dlen 5               #115 [hci1] 6.654685
      ATT: Write Response (0x13) len 0
< HCI Command: Host Number of Comp.. (0x03|0x0035) plen 5  #116 [hci1] 6.669683
        Num handles: 1
        Handle: 1944 Address: DF:A9:FF:F6:B1:1A (OUI DF-A9-FF)
        Count: 1
< ACL Data TX: Handle 1944 flags 0x00 dlen 9               #117 [hci1] 6.669757
      ATT: Write Request (0x12) len 4
        Handle: 0x00d8
          Data: 0100
> HCI Event: Number of Completed Packets (0x13) plen 5     #118 [hci1] 6.724713
        Num handles: 1
        Handle: 1944 Address: DF:A9:FF:F6:B1:1A (OUI DF-A9-FF)
        Count: 1
        #117: len 9 (1 Kb/s)
        Latency: 54 msec (44-65 msec ~54 msec)
> ACL Data RX: Handle 1944 flags 0x02 dlen 5               #119 [hci1] 6.794749
      ATT: Write Response (0x13) len 0
< HCI Command: Host Number of Comp.. (0x03|0x0035) plen 5  #120 [hci1] 6.810120
        Num handles: 1
        Handle: 1944 Address: DF:A9:FF:F6:B1:1A (OUI DF-A9-FF)
        Count: 1
< ACL Data TX: Handle 1944 flags 0x00 dlen 11              #121 [hci1] 6.810239
      ATT: Read By Type Request (0x08) len 6
        Handle range: 0x00d1-0x00da
        Attribute type: Include (0x2802)
> HCI Event: Number of Completed Packets (0x13) plen 5     #122 [hci1] 6.864725
        Num handles: 1
        Handle: 1944 Address: DF:A9:FF:F6:B1:1A (OUI DF-A9-FF)
        Count: 1
        #121: len 11 (1 Kb/s)
        Latency: 54 msec (44-65 msec ~54 msec)
> ACL Data RX: Handle 1944 flags 0x02 dlen 22              #123 [hci1] 6.934902
      ATT: Read By Type Response (0x09) len 17
        Attribute data length: 8
        Attribute data list: 2 entries
        Handle: 0x00d1
        Value: 10011f014318
        Handle: 0x00d2
        Value: f000fb004518
< HCI Command: Host Number of Comp.. (0x03|0x0035) plen 5  #124 [hci1] 6.950032
        Num handles: 1
        Handle: 1944 Address: DF:A9:FF:F6:B1:1A (OUI DF-A9-FF)
        Count: 1
< ACL Data TX: Handle 1944 flags 0x00 dlen 11              #125 [hci1] 6.950131
      ATT: Read By Type Request (0x08) len 6
        Handle range: 0x0110-0x011f
        Attribute type: Characteristic (0x2803)
> HCI Event: Number of Completed Packets (0x13) plen 5     #126 [hci1] 7.004688
        Num handles: 1
        Handle: 1944 Address: DF:A9:FF:F6:B1:1A (OUI DF-A9-FF)
        Count: 1
        #125: len 11 (1 Kb/s)
        Latency: 54 msec (44-65 msec ~54 msec)
> ACL Data RX: Handle 1944 flags 0x02 dlen 27              #127 [hci1] 7.075072
      ATT: Read By Type Response (0x09) len 22
        Attribute data length: 7
        Attribute data list: 3 entries
        Handle: 0x0111
        Value: 121201772b
            Properties: 0x12
              Read (0x02)
              Notify (0x10)
            Value Handle: 0x0112
            Value UUID: Audio Input State (0x2b77)
        Handle: 0x0114
        Value: 021501782b
            Properties: 0x02
              Read (0x02)
            Value Handle: 0x0115
            Value UUID: Gain Settings Attribute (0x2b78)
        Handle: 0x0116
        Value: 021701792b
            Properties: 0x02
              Read (0x02)
            Value Handle: 0x0117
            Value UUID: Audio Input Type (0x2b79)
< HCI Command: Host Number of Comp.. (0x03|0x0035) plen 5  #128 [hci1] 7.090128
        Num handles: 1
        Handle: 1944 Address: DF:A9:FF:F6:B1:1A (OUI DF-A9-FF)
        Count: 1
< ACL Data TX: Handle 1944 flags 0x00 dlen 9               #129 [hci1] 7.090251
      ATT: Write Request (0x12) len 4
        Handle: 0x0113
          Data: 0100
> HCI Event: Number of Completed Packets (0x13) plen 5     #130 [hci1] 7.144711
        Num handles: 1
        Handle: 1944 Address: DF:A9:FF:F6:B1:1A (OUI DF-A9-FF)
        Count: 1
        #129: len 9 (1 Kb/s)
        Latency: 54 msec (44-65 msec ~54 msec)
> ACL Data RX: Handle 1944 flags 0x02 dlen 5               #131 [hci1] 7.214715
      ATT: Write Response (0x13) len 0
< HCI Command: Host Number of Comp.. (0x03|0x0035) plen 5  #132 [hci1] 7.230077
        Num handles: 1
        Handle: 1944 Address: DF:A9:FF:F6:B1:1A (OUI DF-A9-FF)
        Count: 1
< ACL Data TX: Handle 1944 flags 0x00 dlen 11              #133 [hci1] 7.230204
      ATT: Read By Type Request (0x08) len 6
        Handle range: 0x0117-0x011f
        Attribute type: Characteristic (0x2803)
> HCI Event: Number of Completed Packets (0x13) plen 5     #134 [hci1] 7.284783
        Num handles: 1
        Handle: 1944 Address: DF:A9:FF:F6:B1:1A (OUI DF-A9-FF)
        Count: 1
        #133: len 11 (1 Kb/s)
        Latency: 54 msec (44-65 msec ~54 msec)
> ACL Data RX: Handle 1944 flags 0x02 dlen 27              #135 [hci1] 7.355021
      ATT: Read By Type Response (0x09) len 22
        Attribute data length: 7
        Attribute data list: 3 entries
        Handle: 0x0118
        Value: 1219017a2b
            Properties: 0x12
              Read (0x02)
              Notify (0x10)
            Value Handle: 0x0119
            Value UUID: Audio Input Status (0x2b7a)
        Handle: 0x011b
        Value: 081c017b2b
            Properties: 0x08
              Write (0x08)
            Value Handle: 0x011c
            Value UUID: Audio Input Control Point (0x2b7b)
        Handle: 0x011d
        Value: 161e017c2b
            Properties: 0x16
              Read (0x02)
              Write Without Response (0x04)
              Notify (0x10)
            Value Handle: 0x011e
            Value UUID: Audio Input Description (0x2b7c)
< HCI Command: Host Number of Comp.. (0x03|0x0035) plen 5  #136 [hci1] 7.370096
        Num handles: 1
        Handle: 1944 Address: DF:A9:FF:F6:B1:1A (OUI DF-A9-FF)
        Count: 1
< ACL Data TX: Handle 1944 flags 0x00 dlen 9               #137 [hci1] 7.370184
      ATT: Write Request (0x12) len 4
        Handle: 0x011a
          Data: 0100
> HCI Event: Number of Completed Packets (0x13) plen 5     #138 [hci1] 7.424698
        Num handles: 1
        Handle: 1944 Address: DF:A9:FF:F6:B1:1A (OUI DF-A9-FF)
        Count: 1
        #137: len 9 (1 Kb/s)
        Latency: 54 msec (44-65 msec ~54 msec)
> ACL Data RX: Handle 1944 flags 0x02 dlen 5               #139 [hci1] 7.494766
      ATT: Write Response (0x13) len 0
< HCI Command: Host Number of Comp.. (0x03|0x0035) plen 5  #140 [hci1] 7.509900
        Num handles: 1
        Handle: 1944 Address: DF:A9:FF:F6:B1:1A (OUI DF-A9-FF)
        Count: 1
< ACL Data TX: Handle 1944 flags 0x00 dlen 9               #141 [hci1] 7.509965
      ATT: Write Request (0x12) len 4
        Handle: 0x011f
          Data: 0100
> HCI Event: Number of Completed Packets (0x13) plen 5     #142 [hci1] 7.564700
        Num handles: 1
        Handle: 1944 Address: DF:A9:FF:F6:B1:1A (OUI DF-A9-FF)
        Count: 1
        #141: len 9 (1 Kb/s)
        Latency: 54 msec (44-65 msec ~54 msec)
> ACL Data RX: Handle 1944 flags 0x02 dlen 5               #143 [hci1] 7.634727
      ATT: Write Response (0x13) len 0
< HCI Command: Host Number of Comp.. (0x03|0x0035) plen 5  #144 [hci1] 7.650106
        Num handles: 1
        Handle: 1944 Address: DF:A9:FF:F6:B1:1A (OUI DF-A9-FF)
        Count: 1
< ACL Data TX: Handle 1944 flags 0x00 dlen 11              #145 [hci1] 7.650198
      ATT: Read By Type Request (0x08) len 6
        Handle range: 0x011e-0x011f
        Attribute type: Characteristic (0x2803)
> HCI Event: Number of Completed Packets (0x13) plen 5     #146 [hci1] 7.704732
        Num handles: 1
        Handle: 1944 Address: DF:A9:FF:F6:B1:1A (OUI DF-A9-FF)
        Count: 1
        #145: len 11 (1 Kb/s)
        Latency: 54 msec (44-65 msec ~54 msec)
> ACL Data RX: Handle 1944 flags 0x02 dlen 9               #147 [hci1] 7.774725
      ATT: Error Response (0x01) len 4
        Read By Type Request (0x08)
        Handle: 0x011e
        Error: Attribute Not Found (0x0a)
< HCI Command: Host Number of Comp.. (0x03|0x0035) plen 5  #148 [hci1] 7.790058
        Num handles: 1
        Handle: 1944 Address: DF:A9:FF:F6:B1:1A (OUI DF-A9-FF)
        Count: 1
< ACL Data TX: Handle 1944 flags 0x00 dlen 11              #149 [hci1] 7.790144
      ATT: Read By Type Request (0x08) len 6
        Handle range: 0x00d2-0x00da
        Attribute type: Include (0x2802)
> HCI Event: Number of Completed Packets (0x13) plen 5     #150 [hci1] 7.844703
        Num handles: 1
        Handle: 1944 Address: DF:A9:FF:F6:B1:1A (OUI DF-A9-FF)
        Count: 1
        #149: len 11 (1 Kb/s)
        Latency: 54 msec (44-65 msec ~54 msec)
> ACL Data RX: Handle 1944 flags 0x02 dlen 14              #151 [hci1] 7.914851
      ATT: Read By Type Response (0x09) len 9
        Attribute data length: 8
        Attribute data list: 1 entry
        Handle: 0x00d2
        Value: f000fb004518
< HCI Command: Host Number of Comp.. (0x03|0x0035) plen 5  #152 [hci1] 7.929902
        Num handles: 1
        Handle: 1944 Address: DF:A9:FF:F6:B1:1A (OUI DF-A9-FF)
        Count: 1
< ACL Data TX: Handle 1944 flags 0x00 dlen 11              #153 [hci1] 7.929956
      ATT: Read By Type Request (0x08) len 6
        Handle range: 0x00f0-0x00fb
        Attribute type: Characteristic (0x2803)
> HCI Event: Number of Completed Packets (0x13) plen 5     #154 [hci1] 7.984759
        Num handles: 1
        Handle: 1944 Address: DF:A9:FF:F6:B1:1A (OUI DF-A9-FF)
        Count: 1
        #153: len 11 (1 Kb/s)
        Latency: 54 msec (44-65 msec ~54 msec)
> ACL Data RX: Handle 1944 flags 0x02 dlen 27              #155 [hci1] 8.055048
      ATT: Read By Type Response (0x09) len 22
        Attribute data length: 7
        Attribute data list: 3 entries
        Handle: 0x00f1
        Value: 12f200802b
            Properties: 0x12
              Read (0x02)
              Notify (0x10)
            Value Handle: 0x00f2
            Value UUID: Offset State (0x2b80)
        Handle: 0x00f4
        Value: 16f500812b
            Properties: 0x16
              Read (0x02)
              Write Without Response (0x04)
              Notify (0x10)
            Value Handle: 0x00f5
            Value UUID: Audio Location (0x2b81)
        Handle: 0x00f7
        Value: 08f800822b
            Properties: 0x08
              Write (0x08)
            Value Handle: 0x00f8
            Value UUID: Volume Offset Control Point (0x2b82)
< HCI Command: Host Number of Comp.. (0x03|0x0035) plen 5  #156 [hci1] 8.070140
        Num handles: 1
        Handle: 1944 Address: DF:A9:FF:F6:B1:1A (OUI DF-A9-FF)
        Count: 1
< ACL Data TX: Handle 1944 flags 0x00 dlen 9               #157 [hci1] 8.070229
      ATT: Find Information Request (0x04) len 4
        Handle range: 0x00f2-0x00fb
> HCI Event: Number of Completed Packets (0x13) plen 5     #158 [hci1] 8.124686
        Num handles: 1
        Handle: 1944 Address: DF:A9:FF:F6:B1:1A (OUI DF-A9-FF)
        Count: 1
        #157: len 9 (1 Kb/s)
        Latency: 54 msec (44-65 msec ~54 msec)
> ACL Data RX: Handle 1944 flags 0x02 dlen 26              #159 [hci1] 8.194968
      ATT: Find Information Response (0x05) len 21
        Format: UUID-16 (0x01)
        Handle: 0x00f2
        UUID: Offset State (0x2b80)
        Handle: 0x00f3
        UUID: Client Characteristic Configuration (0x2902)
        Handle: 0x00f4
        UUID: Characteristic (0x2803)
        Handle: 0x00f5
        UUID: Audio Location (0x2b81)
        Handle: 0x00f6
        UUID: Client Characteristic Configuration (0x2902)
< HCI Command: Host Number of Comp.. (0x03|0x0035) plen 5  #160 [hci1] 8.210008
        Num handles: 1
        Handle: 1944 Address: DF:A9:FF:F6:B1:1A (OUI DF-A9-FF)
        Count: 1
< ACL Data TX: Handle 1944 flags 0x00 dlen 9               #161 [hci1] 8.210105
      ATT: Find Information Request (0x04) len 4
        Handle range: 0x00f5-0x00fb
> HCI Event: Number of Completed Packets (0x13) plen 5     #162 [hci1] 8.264661
        Num handles: 1
        Handle: 1944 Address: DF:A9:FF:F6:B1:1A (OUI DF-A9-FF)
        Count: 1
        #161: len 9 (1 Kb/s)
        Latency: 54 msec (44-65 msec ~54 msec)
> ACL Data RX: Handle 1944 flags 0x02 dlen 26              #163 [hci1] 8.334987
      ATT: Find Information Response (0x05) len 21
        Format: UUID-16 (0x01)
        Handle: 0x00f5
        UUID: Audio Location (0x2b81)
        Handle: 0x00f6
        UUID: Client Characteristic Configuration (0x2902)
        Handle: 0x00f7
        UUID: Characteristic (0x2803)
        Handle: 0x00f8
        UUID: Volume Offset Control Point (0x2b82)
        Handle: 0x00f9
        UUID: Characteristic (0x2803)
< HCI Command: Host Number of Comp.. (0x03|0x0035) plen 5  #164 [hci1] 8.349694
        Num handles: 1
        Handle: 1944 Address: DF:A9:FF:F6:B1:1A (OUI DF-A9-FF)
        Count: 1
< ACL Data TX: Handle 1944 flags 0x00 dlen 11              #165 [hci1] 8.349747
      ATT: Read By Type Request (0x08) len 6
        Handle range: 0x00f8-0x00fb
        Attribute type: Characteristic (0x2803)
> HCI Event: Number of Completed Packets (0x13) plen 5     #166 [hci1] 8.404701
        Num handles: 1
        Handle: 1944 Address: DF:A9:FF:F6:B1:1A (OUI DF-A9-FF)
        Count: 1
        #165: len 11 (1 Kb/s)
        Latency: 54 msec (44-65 msec ~54 msec)
> ACL Data RX: Handle 1944 flags 0x02 dlen 13              #167 [hci1] 8.474857
      ATT: Read By Type Response (0x09) len 8
        Attribute data length: 7
        Attribute data list: 1 entry
        Handle: 0x00f9
        Value: 16fa00832b
            Properties: 0x16
              Read (0x02)
              Write Without Response (0x04)
              Notify (0x10)
            Value Handle: 0x00fa
            Value UUID: Audio Output Description (0x2b83)
< HCI Command: Host Number of Comp.. (0x03|0x0035) plen 5  #168 [hci1] 8.490102
        Num handles: 1
        Handle: 1944 Address: DF:A9:FF:F6:B1:1A (OUI DF-A9-FF)
        Count: 1
< ACL Data TX: Handle 1944 flags 0x00 dlen 9               #169 [hci1] 8.490191
      ATT: Write Request (0x12) len 4
        Handle: 0x00f3
          Data: 0100
> HCI Event: Number of Completed Packets (0x13) plen 5     #170 [hci1] 8.544657
        Num handles: 1
        Handle: 1944 Address: DF:A9:FF:F6:B1:1A (OUI DF-A9-FF)
        Count: 1
        #169: len 9 (1 Kb/s)
        Latency: 54 msec (44-65 msec ~54 msec)
> ACL Data RX: Handle 1944 flags 0x02 dlen 5               #171 [hci1] 8.614727
      ATT: Write Response (0x13) len 0
< HCI Command: Host Number of Comp.. (0x03|0x0035) plen 5  #172 [hci1] 8.630051
        Num handles: 1
        Handle: 1944 Address: DF:A9:FF:F6:B1:1A (OUI DF-A9-FF)
        Count: 1
< ACL Data TX: Handle 1944 flags 0x00 dlen 9               #173 [hci1] 8.630135
      ATT: Write Request (0x12) len 4
        Handle: 0x00f6
          Data: 0100
> HCI Event: Number of Completed Packets (0x13) plen 5     #174 [hci1] 8.684629
        Num handles: 1
        Handle: 1944 Address: DF:A9:FF:F6:B1:1A (OUI DF-A9-FF)
        Count: 1
        #173: len 9 (1 Kb/s)
        Latency: 54 msec (44-65 msec ~54 msec)
> ACL Data RX: Handle 1944 flags 0x02 dlen 5               #175 [hci1] 8.754802
      ATT: Write Response (0x13) len 0
< HCI Command: Host Number of Comp.. (0x03|0x0035) plen 5  #176 [hci1] 8.769750
        Num handles: 1
        Handle: 1944 Address: DF:A9:FF:F6:B1:1A (OUI DF-A9-FF)
        Count: 1
< ACL Data TX: Handle 1944 flags 0x00 dlen 9               #177 [hci1] 8.769798
      ATT: Find Information Request (0x04) len 4
        Handle range: 0x00fa-0x00fb
> HCI Event: Number of Completed Packets (0x13) plen 5     #178 [hci1] 8.824654
        Num handles: 1
        Handle: 1944 Address: DF:A9:FF:F6:B1:1A (OUI DF-A9-FF)
        Count: 1
        #177: len 9 (1 Kb/s)
        Latency: 54 msec (44-65 msec ~54 msec)
> ACL Data RX: Handle 1944 flags 0x02 dlen 14              #179 [hci1] 8.894853
      ATT: Find Information Response (0x05) len 9
        Format: UUID-16 (0x01)
        Handle: 0x00fa
        UUID: Audio Output Description (0x2b83)
        Handle: 0x00fb
        UUID: Client Characteristic Configuration (0x2902)
< HCI Command: Host Number of Comp.. (0x03|0x0035) plen 5  #180 [hci1] 8.909956
        Num handles: 1
        Handle: 1944 Address: DF:A9:FF:F6:B1:1A (OUI DF-A9-FF)
        Count: 1
< ACL Data TX: Handle 1944 flags 0x00 dlen 11              #181 [hci1] 8.910058
      ATT: Read By Type Request (0x08) len 6
        Handle range: 0x00fa-0x00fb
        Attribute type: Characteristic (0x2803)
> HCI Event: Number of Completed Packets (0x13) plen 5     #182 [hci1] 8.964642
        Num handles: 1
        Handle: 1944 Address: DF:A9:FF:F6:B1:1A (OUI DF-A9-FF)
        Count: 1
        #181: len 11 (1 Kb/s)
        Latency: 54 msec (44-65 msec ~54 msec)
> ACL Data RX: Handle 1944 flags 0x02 dlen 9               #183 [hci1] 9.034728
      ATT: Error Response (0x01) len 4
        Read By Type Request (0x08)
        Handle: 0x00fa
        Error: Attribute Not Found (0x0a)
< HCI Command: Host Number of Comp.. (0x03|0x0035) plen 5  #184 [hci1] 9.050075
        Num handles: 1
        Handle: 1944 Address: DF:A9:FF:F6:B1:1A (OUI DF-A9-FF)
        Count: 1
< ACL Data TX: Handle 1944 flags 0x00 dlen 9               #185 [hci1] 9.050187
      ATT: Write Request (0x12) len 4
        Handle: 0x00fb
          Data: 0100
> HCI Event: Number of Completed Packets (0x13) plen 5     #186 [hci1] 9.104700
        Num handles: 1
        Handle: 1944 Address: DF:A9:FF:F6:B1:1A (OUI DF-A9-FF)
        Count: 1
        #185: len 9 (1 Kb/s)
        Latency: 54 msec (44-65 msec ~54 msec)
> ACL Data RX: Handle 1944 flags 0x02 dlen 5               #187 [hci1] 9.174710
      ATT: Write Response (0x13) len 0
< HCI Command: Host Number of Comp.. (0x03|0x0035) plen 5  #188 [hci1] 9.189681
        Num handles: 1
        Handle: 1944 Address: DF:A9:FF:F6:B1:1A (OUI DF-A9-FF)
        Count: 1
< ACL Data TX: Handle 1944 flags 0x00 dlen 11              #189 [hci1] 9.189715
      ATT: Read By Type Request (0x08) len 6
        Handle range: 0x00d3-0x00da
        Attribute type: Include (0x2802)
> HCI Event: Number of Completed Packets (0x13) plen 5     #190 [hci1] 9.244766
        Num handles: 1
        Handle: 1944 Address: DF:A9:FF:F6:B1:1A (OUI DF-A9-FF)
        Count: 1
        #189: len 11 (1 Kb/s)
        Latency: 55 msec (44-65 msec ~54 msec)
> ACL Data RX: Handle 1944 flags 0x02 dlen 9               #191 [hci1] 9.314729
      ATT: Error Response (0x01) len 4
        Read By Type Request (0x08)
        Handle: 0x00d3
        Error: Attribute Not Found (0x0a)
< HCI Command: Host Number of Comp.. (0x03|0x0035) plen 5  #192 [hci1] 9.330236
        Num handles: 1
        Handle: 1944 Address: DF:A9:FF:F6:B1:1A (OUI DF-A9-FF)
        Count: 1
< ACL Data TX: Handle 1944 flags 0x00 dlen 7              #193 [hci1] 11.419990
      ATT: Read Request (0x0a) len 2
        Handle: 0x0112
> HCI Event: Number of Completed Packets (0x13) plen 5    #194 [hci1] 11.484578
        Num handles: 1
        Handle: 1944 Address: DF:A9:FF:F6:B1:1A (OUI DF-A9-FF)
        Count: 1
        #193: len 7 (0 Kb/s)
        Latency: 64 msec (44-65 msec ~59 msec)
> ACL Data RX: Handle 1944 flags 0x02 dlen 9              #195 [hci1] 11.554691
      ATT: Read Response (0x0b) len 4
< HCI Command: Host Number of Com.. (0x03|0x0035) plen 5  #196 [hci1] 11.570473
        Num handles: 1
        Handle: 1944 Address: DF:A9:FF:F6:B1:1A (OUI DF-A9-FF)
        Count: 1
< ACL Data TX: Handle 1944 flags 0x00 dlen 10             #197 [hci1] 12.659708
      ATT: Write Request (0x12) len 5
        Handle: 0x011c
          Data: 010570
> HCI Event: Number of Completed Packets (0x13) plen 5    #198 [hci1] 12.674631
        Num handles: 1
        Handle: 1944 Address: DF:A9:FF:F6:B1:1A (OUI DF-A9-FF)
        Count: 1
        #197: len 10 (5 Kb/s)
        Latency: 14 msec (14-65 msec ~37 msec)
> ACL Data RX: Handle 1944 flags 0x02 dlen 9              #199 [hci1] 12.744713
      ATT: Error Response (0x01) len 4
        Write Request (0x12)
        Handle: 0x011c
        Error: Reserved (0x83)
< HCI Command: Host Number of Com.. (0x03|0x0035) plen 5  #200 [hci1] 12.750413
        Num handles: 1
        Handle: 1944 Address: DF:A9:FF:F6:B1:1A (OUI DF-A9-FF)
        Count: 1
< ACL Data TX: Handle 1944 flags 0x00 dlen 10             #201 [hci1] 13.790385
      ATT: Write Request (0x12) len 5
        Handle: 0x011c
          Data: 01058f
> HCI Event: Number of Completed Packets (0x13) plen 5    #202 [hci1] 13.794622
        Num handles: 1
        Handle: 1944 Address: DF:A9:FF:F6:B1:1A (OUI DF-A9-FF)
        Count: 1
        #201: len 10 (20 Kb/s)
        Latency: 4 msec (4-65 msec ~20 msec)
> ACL Data RX: Handle 1944 flags 0x02 dlen 9              #203 [hci1] 13.864707
      ATT: Error Response (0x01) len 4
        Write Request (0x12)
        Handle: 0x011c
        Error: Reserved (0x83)
< HCI Command: Host Number of Com.. (0x03|0x0035) plen 5  #204 [hci1] 13.870206
        Num handles: 1
        Handle: 1944 Address: DF:A9:FF:F6:B1:1A (OUI DF-A9-FF)
        Count: 1
< ACL Data TX: Handle 1944 flags 0x00 dlen 7              #205 [hci1] 14.920204
      ATT: Read Request (0x0a) len 2
        Handle: 0x0112
> HCI Event: Number of Completed Packets (0x13) plen 5    #206 [hci1] 14.984546
        Num handles: 1
        Handle: 1944 Address: DF:A9:FF:F6:B1:1A (OUI DF-A9-FF)
        Count: 1
        #205: len 7 (0 Kb/s)
        Latency: 64 msec (4-65 msec ~42 msec)
> ACL Data RX: Handle 1944 flags 0x02 dlen 9              #207 [hci1] 15.054552
      ATT: Read Response (0x0b) len 4
< HCI Command: Host Number of Com.. (0x03|0x0035) plen 5  #208 [hci1] 15.070318
        Num handles: 1
        Handle: 1944 Address: DF:A9:FF:F6:B1:1A (OUI DF-A9-FF)
        Count: 1
> HCI Event: Disconnect Complete (0x05) plen 4            #209 [hci1] 16.384219
        Status: Success (0x00)
        Handle: 1944 Address: DF:A9:FF:F6:B1:1A (OUI DF-A9-FF)
        Reason: Remote User Terminated Connection (0x13)
< HCI Command: Reset (0x03|0x0003) plen 0                 #210 [hci1] 22.419748
> HCI Event: Command Complete (0x0e) plen 4               #211 [hci1] 22.420205
      Reset (0x03|0x0003) ncmd 1
        Status: Success (0x00)
@ USER Close: main                                    {0x0001} [hci1] 22.429676
= Close Index: 00:00:00:00:00:00                               [hci1] 22.429683
