Bluetooth monitor ver 5.84
btmon[1289785]: = Note: Linux version 6.8.0-83-generic (x86_64)                                                          0.953016
btmon[1289785]: = Note: Bluetooth subsystem version 2.22                                                                 0.953017
= New Index: 00:00:00:00:00:00 (Primary,UART,hci0)                                                                       0.953018
= Open Index: 00:00:00:00:00:00                                                                                          1.457490
= Index Info: 00:00:00:00:00:00 (Nordic Semiconductor ASA)                                                               1.457498
zephyr.exe[1289787]: @ USER Open: main (privileged) version 2.22                                                {0x0001} 1.457500
zephyr.exe[1289787]: < HCI Command: Reset (0x03|0x0003) plen 0                                                        #1 1.457726
> HCI Event: Command Complete (0x0e) plen 4                                                                           #2 1.458201
      Reset (0x03|0x0003) ncmd 1
        Status: Success (0x00)
zephyr.exe[1289787]: < HCI Command: Read Local Supported Features (0x04|0x0003) plen 0                                #3 1.477468
> HCI Event: Command Complete (0x0e) plen 12                                                                          #4 1.477956
      Read Local Supported Features (0x04|0x0003) ncmd 1
        Status: Success (0x00)
        Features: 0x00 0x00 0x00 0x00 0x60 0x00 0x00 0x00
          BR/EDR Not Supported
          LE Supported (Controller)
zephyr.exe[1289787]: < HCI Command: Read Local Version Information (0x04|0x0001) plen 0                               #5 1.497494
> HCI Event: Command Complete (0x0e) plen 12                                                                          #6 1.497971
      Read Local Version Information (0x04|0x0001) ncmd 1
        Status: Success (0x00)
        HCI version: Reserved (0x0e) - Revision 12520 (0x30e8)
        LMP version: Reserved (0x0e) - Subversion 12520 (0x30e8)
        Manufacturer: Nordic Semiconductor ASA (89)
zephyr.exe[1289787]: < HCI Command: Read Local Supported Commands (0x04|0x0002) plen 0                                #7 1.517498
> HCI Event: Command Complete (0x0e) plen 68                                                                          #8 1.518531
      Read Local Supported Commands (0x04|0x0002) ncmd 1
        Status: Success (0x00)
        Commands: 119 entries
          Disconnect (Octet 0 - Bit 5)
          Read Remote Version Information (Octet 2 - Bit 7)
          Set Event Mask (Octet 5 - Bit 6)
          Reset (Octet 5 - Bit 7)
          Read Connection Accept Timeout (Octet 7 - Bit 2)
          Write Connection Accept Timeout (Octet 7 - Bit 3)
          Read Transmit Power Level (Octet 10 - Bit 2)
          Set Controller To Host Flow Control (Octet 10 - Bit 5)
          Host Buffer Size (Octet 10 - Bit 6)
          Host Number of Completed Packets (Octet 10 - Bit 7)
          Read Local Version Information (Octet 14 - Bit 3)
          Read Local Supported Features (Octet 14 - Bit 5)
          Read BD ADDR (Octet 15 - Bit 1)
          Read RSSI (Octet 15 - Bit 5)
          Set Event Mask Page 2 (Octet 22 - Bit 2)
          LE Set Event Mask (Octet 25 - Bit 0)
          LE Read Buffer Size (Octet 25 - Bit 1)
          LE Read Local Supported Features (Octet 25 - Bit 2)
          LE Set Random Address (Octet 25 - Bit 4)
          LE Set Advertising Parameters (Octet 25 - Bit 5)
          LE Read Advertising Channel TX Power (Octet 25 - Bit 6)
          LE Set Advertising Data (Octet 25 - Bit 7)
          LE Set Scan Response Data (Octet 26 - Bit 0)
          LE Set Advertise Enable (Octet 26 - Bit 1)
          LE Set Scan Parameters (Octet 26 - Bit 2)
          LE Set Scan Enable (Octet 26 - Bit 3)
          LE Create Connection (Octet 26 - Bit 4)
          LE Create Connection Cancel (Octet 26 - Bit 5)
          LE Read Accept List Size (Octet 26 - Bit 6)
          LE Clear Accept List (Octet 26 - Bit 7)
          LE Add Device To Accept List (Octet 27 - Bit 0)
          LE Remove Device From Accept List (Octet 27 - Bit 1)
          LE Connection Update (Octet 27 - Bit 2)
          LE Set Host Channel Classification (Octet 27 - Bit 3)
          LE Read Channel Map (Octet 27 - Bit 4)
          LE Read Remote Used Features (Octet 27 - Bit 5)
          LE Encrypt (Octet 27 - Bit 6)
          LE Rand (Octet 27 - Bit 7)
          LE Start Encryption (Octet 28 - Bit 0)
          LE Long Term Key Request Reply (Octet 28 - Bit 1)
          LE Long Term Key Request Neg Reply (Octet 28 - Bit 2)
          LE Read Supported States (Octet 28 - Bit 3)
          LE Receiver Test (Octet 28 - Bit 4)
          LE Transmitter Test (Octet 28 - Bit 5)
          LE Test End (Octet 28 - Bit 6)
          Read Authenticated Payload Timeout (Octet 32 - Bit 4)
          Write Authenticated Payload Timeout (Octet 32 - Bit 5)
          LE Set Data Length (Octet 33 - Bit 6)
          LE Read Suggested Default Data Length (Octet 33 - Bit 7)
          LE Write Suggested Default Data Length (Octet 34 - Bit 0)
          LE Add Device To Resolving List (Octet 34 - Bit 3)
          LE Remove Device From Resolving List (Octet 34 - Bit 4)
          LE Clear Resolving List (Octet 34 - Bit 5)
          LE Read Resolving List Size (Octet 34 - Bit 6)
          LE Set Address Resolution Enable (Octet 35 - Bit 1)
          LE Set Resolvable Private Address Timeout (Octet 35 - Bit 2)
          LE Read Maximum Data Length (Octet 35 - Bit 3)
          LE Read PHY (Octet 35 - Bit 4)
          LE Set Default PHY (Octet 35 - Bit 5)
          LE Set PHY (Octet 35 - Bit 6)
          LE Enhanced Receiver Test (Octet 35 - Bit 7)
          LE Enhanced Transmitter Test (Octet 36 - Bit 0)
          LE Set Advertising Set Random Address (Octet 36 - Bit 1)
          LE Set Extended Advertising Parameters (Octet 36 - Bit 2)
          LE Set Extended Advertising Data (Octet 36 - Bit 3)
          LE Set Extended Scan Response Data (Octet 36 - Bit 4)
          LE Set Extended Advertising Enable (Octet 36 - Bit 5)
          LE Read Maximum Advertising Data Length (Octet 36 - Bit 6)
          LE Read Number of Supported Advertising Sets (Octet 36 - Bit 7)
          LE Remove Advertising Set (Octet 37 - Bit 0)
          LE Clear Advertising Sets (Octet 37 - Bit 1)
          LE Set Periodic Advertising Parameters (Octet 37 - Bit 2)
          LE Set Periodic Advertising Data (Octet 37 - Bit 3)
          LE Set Periodic Advertising Enable (Octet 37 - Bit 4)
          LE Set Extended Scan Parameters (Octet 37 - Bit 5)
          LE Set Extended Scan Enable (Octet 37 - Bit 6)
          LE Extended Create Connection (Octet 37 - Bit 7)
          LE Periodic Advertising Create Sync (Octet 38 - Bit 0)
          LE Periodic Advertising Create Sync Cancel (Octet 38 - Bit 1)
          LE Periodic Advertising Terminate Sync (Octet 38 - Bit 2)
          LE Add Device To Periodic Advertiser List (Octet 38 - Bit 3)
          LE Remove Device From Periodic Advertiser List (Octet 38 - Bit 4)
          LE Clear Periodic Advertiser List (Octet 38 - Bit 5)
          LE Read Periodic Advertiser List Size (Octet 38 - Bit 6)
          LE Read Transmit Power (Octet 38 - Bit 7)
          LE Read RF Path Compensation (Octet 39 - Bit 0)
          LE Write RF Path Compensation (Octet 39 - Bit 1)
          LE Set Privacy Mode (Octet 39 - Bit 2)
          LE Periodic Advertising Receive Enable (Octet 40 - Bit 5)
          LE Periodic Advertising Sync Transfer (Octet 40 - Bit 6)
          LE Periodic Advertising Set Info Transfer (Octet 40 - Bit 7)
          LE Periodic Advertising Sync Transfer Parameters (Octet 41 - Bit 0)
          LE Set Default Periodic Advertisng Sync Transfer Parameters (Octet 41 - Bit 1)
          LE Read Buffer v2 (Octet 41 - Bit 5)
          LE Read ISO TX Sync (Octet 41 - Bit 6)
          LE Set Connected Isochronous Group Parameters (Octet 41 - Bit 7)
          LE Set Connected Isochronous Group Parameters Test (Octet 42 - Bit 0)
          LE Create Connected Isochronous Stream (Octet 42 - Bit 1)
          LE Remove Connected Isochronous Group (Octet 42 - Bit 2)
          LE Accept Connected Isochronous Stream Request (Octet 42 - Bit 3)
          LE Reject Connected Isochronous Stream Request (Octet 42 - Bit 4)
          LE Create Broadcast Isochronous Group (Octet 42 - Bit 5)
          LE Create Broadcast Isochronous Group Test (Octet 42 - Bit 6)
          LE Terminate Broadcast Isochronous Group (Octet 42 - Bit 7)
          LE Broadcast Isochronous Group Create Sync (Octet 43 - Bit 0)
          LE Broadcast Isochronous Group Terminate Sync (Octet 43 - Bit 1)
          LE Request Peer SCA (Octet 43 - Bit 2)
          LE Setup Isochronous Data Path (Octet 43 - Bit 3)
          LE Remove Isochronous Data Path (Octet 43 - Bit 4)
          LE Isochronous Transmit Test (Octet 43 - Bit 5)
          LE Isochronous Receive Test (Octet 43 - Bit 6)
          LE Isochronous Read Test Counters (Octet 43 - Bit 7)
          LE Isochronous Read Test Counters (Octet 44 - Bit 0)
          LE Set Host Feature (Octet 44 - Bit 1)
          LE Read ISO link quality (Octet 44 - Bit 2)
          Octet 45 - Bit 6 
          Octet 46 - Bit 0 
          Octet 46 - Bit 1 
          Octet 46 - Bit 2 
zephyr.exe[1289787]: < HCI Command: Host Buffer Size (0x03|0x0033) plen 7                                             #9 1.537497
        ACL MTU: 255  ACL max packet: 16
        SCO MTU: 0    SCO max packet: 0
> HCI Event: Command Complete (0x0e) plen 4                                                                          #10 1.537942
      Host Buffer Size (0x03|0x0033) ncmd 1
        Status: Success (0x00)
zephyr.exe[1289787]: < HCI Command: Set Controller To Host Flow Control (0x03|0x0031) plen 1                         #11 1.557501
        Flow control: ACL Data Packets (0x01)
> HCI Event: Command Complete (0x0e) plen 4                                                                          #12 1.557889
      Set Controller To Host Flow Control (0x03|0x0031) ncmd 1
        Status: Success (0x00)
zephyr.exe[1289787]: < HCI Command: LE Read Local Supported Features (0x08|0x0003) plen 0                            #13 1.577498
> HCI Event: Command Complete (0x0e) plen 12                                                                         #14 1.577963
      LE Read Local Supported Features (0x08|0x0003) ncmd 1
        Status: Success (0x00)
        Features: 0xfd 0x79 0x00 0xf7 0x30 0x01 0x00 0x00
          LE Encryption
          Extended Reject Indication
          Peripheral-initiated Features Exchange
          LE Ping
          LE Data Packet Length Extension
          LL Privacy
          Extended Scanner Filter Policies
          LE 2M PHY
          LE Coded PHY
          LE Extended Advertising
          LE Periodic Advertising
          Channel Selection Algorithm #2
          Periodic Advertising Sync Transfer - Sender
          Periodic Advertising Sync Transfer - Recipient
          Sleep Clock Accuracy Updates
          Connected Isochronous Stream - Central
          Connected Isochronous Stream - Peripheral
          Isochronous Broadcaster
          Synchronized Receiver
          Periodic Advertising ADI support
          Connection Subrating
          Unknown features (0x0000010000000000)
zephyr.exe[1289787]: < HCI Command: LE Set Host Feature (0x08|0x0074) plen 2                                         #15 1.597503
        Bit Number: 32
          Connected Isochronous Stream (Host Support)
        Bit Value: 1
> HCI Event: Command Complete (0x0e) plen 4                                                                          #16 1.597909
      LE Set Host Feature (0x08|0x0074) ncmd 1
        Status: Success (0x00)
zephyr.exe[1289787]: < HCI Command: LE Read Buffer v2 (0x08|0x0060) plen 0                                           #17 1.617500
> HCI Event: Command Complete (0x0e) plen 10                                                                         #18 1.617946
      LE Read Buffer v2 (0x08|0x0060) ncmd 1
        Status: Success (0x00)
        ACL MTU: 27
        ACL max packet: 3
        ISO MTU: 318
        ISO max packet: 3
zephyr.exe[1289787]: < HCI Command: LE Read Maximum Advertising Data Length (0x08|0x003a) plen 0                     #19 1.637511
> HCI Event: Command Complete (0x0e) plen 6                                                                          #20 1.637966
      LE Read Maximum Advertising Data Length (0x08|0x003a) ncmd 1
        Status: Success (0x00)
        Max length: 1650
zephyr.exe[1289787]: < HCI Command: LE Read Supported States (0x08|0x001c) plen 0                                    #21 1.657497
> HCI Event: Command Complete (0x0e) plen 12                                                                         #22 1.657942
      LE Read Supported States (0x08|0x001c) ncmd 1
        Status: Success (0x00)
        States: 0x000003ff3e0306ff
          Non-connectable Advertising State
          Scannable Advertising State
          Connectable Advertising State
          High Duty Cycle Directed Advertising State
          Passive Scanning State
          Active Scanning State
          Initiating State
            and Connection State (Central Role)
          Connection State (Peripheral Role)
          Scannable Advertising State
            and Passive Scanning State
          Connectable Advertising State
            and Passive Scanning State
          Non-connectable Advertising State
            and Initiating State
          Scannable Advertising State
            and Initiating State
          Active Scanning State
            and Connection State (Central Role)
          Passive Scanning State
            and Connection State (Peripheral Role)
          Active Scanning State
            and Connection State (Peripheral Role)
          Initiating State
            and Connection State (Central Role)
            and Central Role & Central Role
          Low Duty Cycle Directed Advertising State
          Connectable Advertising State
            and Initiating State
            and Central Role & Peripheral Role
          High Duty Cycle Directed Advertising State
            and Initiating State
            and Central Role & Peripheral Role
          Low Duty Cycle Directed Advertising State
            and Initiating State
            and Central Role & Peripheral Role
          Connectable Advertising State
            and Connection State (Central Role)
            and Central Role & Peripheral Role
          High Duty Cycle Directed Advertising State
            and Connection State (Central Role)
            and Central Role & Peripheral Role
          Low Duty Cycle Directed Advertising State
            and Connection State (Central Role)
            and Central Role & Peripheral Role
          Connectable Advertising State
            and Connection State (Peripheral Role)
            and Central Role & Peripheral Role
          High Duty Cycle Directed Advertising State
            and Connection State (Peripheral Role)
            and Peripheral Role & Peripheral Role
          Low Duty Cycle Directed Advertising State
            and Connection State (Peripheral Role)
            and Peripheral Role & Peripheral Role
          Initiating State
            and Connection State (Peripheral Role)
            and Central Role & Peripheral Role
zephyr.exe[1289787]: < HCI Command: LE Read Maximum Data Length (0x08|0x002f) plen 0                                 #23 1.677506
> HCI Event: Command Complete (0x0e) plen 12                                                                         #24 1.677968
      LE Read Maximum Data Length (0x08|0x002f) ncmd 1
        Status: Success (0x00)
        Max TX octets: 251
        Max TX time: 2704
        Max RX octets: 251
        Max RX time: 2704
zephyr.exe[1289787]: < HCI Command: LE Write Suggested Default Data Length (0x08|0x0024) plen 4                      #25 1.697497
        TX octets: 251
        TX time: 2704
> HCI Event: Command Complete (0x0e) plen 4                                                                          #26 1.697966
      LE Write Suggested Default Data Length (0x08|0x0024) ncmd 1
        Status: Success (0x00)
zephyr.exe[1289787]: < HCI Command: LE Read Resolving List Size (0x08|0x002a) plen 0                                 #27 1.717510
> HCI Event: Command Complete (0x0e) plen 5                                                                          #28 1.717966
      LE Read Resolving List Size (0x08|0x002a) ncmd 1
        Status: Success (0x00)
        Size: 8
zephyr.exe[1289787]: < HCI Command: LE Set Event Mask (0x08|0x0001) plen 8                                           #29 1.737502
        Mask: 0x000002023f87fa5e
          LE Advertising Report
          LE Connection Update Complete
          LE Read Remote Used Features Complete
          LE Long Term Key Request
          LE Data Length Change
          LE Enhanced Connection Complete
          LE PHY Update Complete
          LE Extended Advertising Report
          LE Periodic Advertising Sync Established
          LE Periodic Advertising Report
          LE Periodic Advertising Sync Lost
          LE Extended Scan Timeout
          LE Extended Advertising Set Terminated
          LE Scan Request Received
          LE Periodic Advertising Sync Transfer Rvc
          LE CIS Established
          LE CIS Request
          LE Create BIG Complete
          LE Terminate BIG Complete
          LE BIG Sync Established Complete
          LE BIG Sync Lost
          LE BIG Info Advertising Report
          Unknown mask (0x0000020000000000)
> HCI Event: Command Complete (0x0e) plen 4                                                                          #30 1.737983
      LE Set Event Mask (0x08|0x0001) ncmd 1
        Status: Success (0x00)
zephyr.exe[1289787]: < HCI Command: Set Event Mask (0x03|0x0001) plen 8                                              #31 1.757500
        Mask: 0x2000800002008890
          Disconnection Complete
          Encryption Change
          Read Remote Version Information Complete
          Hardware Error
          Data Buffer Overflow
          Encryption Key Refresh Complete
          LE Meta
> HCI Event: Command Complete (0x0e) plen 4                                                                          #32 1.757986
      Set Event Mask (0x03|0x0001) ncmd 1
        Status: Success (0x00)
zephyr.exe[1289787]: < HCI Command: Read BD ADDR (0x04|0x0009) plen 0                                                #33 1.777507
> HCI Event: Command Complete (0x0e) plen 10                                                                         #34 1.777954
      Read BD ADDR (0x04|0x0009) ncmd 1
        Status: Success (0x00)
        Address: 00:00:00:00:00:00 (OUI 00-00-00)
zephyr.exe[1289787]: < HCI Command: LE Set Random Address (0x08|0x0005) plen 6                                       #35 1.797509
        Address: D5:B6:CC:31:DB:3B (Static)
> HCI Event: Command Complete (0x0e) plen 4                                                                          #36 1.797987
      LE Set Random Address (0x08|0x0005) ncmd 1
        Status: Success (0x00)
zephyr.exe[1289787]: < HCI Command: LE Set Extended Advertising Parameters (0x08|0x0036) plen 25                     #37 5.787537
        Handle: 0x00
        Properties: 0x0013
          Connectable
          Scannable
          Use legacy advertising PDUs: ADV_IND
        Min advertising interval: 100.000 msec (0x00a0)
        Max advertising interval: 150.000 msec (0x00f0)
        Channel map: 37, 38, 39 (0x07)
        Own address type: Random (0x01)
        Peer address type: Public (0x00)
        Peer address: 00:00:00:00:00:00 (OUI 00-00-00)
        Filter policy: Allow Scan Request from Any, Allow Connect Request from Any (0x00)
        TX power: Host has no preference (0x7f)
        Primary PHY: LE 1M (0x01)
        Secondary max skip: 0x00
        Secondary PHY: LE 1M (0x01)
        SID: 0x00
        Scan request notifications: Disabled (0x00)
> HCI Event: Command Complete (0x0e) plen 5                                                                          #38 5.788307
      LE Set Extended Advertising Parameters (0x08|0x0036) ncmd 1
        Status: Success (0x00)
        TX power (selected): 0 dbm (0x00)
zephyr.exe[1289787]: < HCI Command: LE Set Advertising Set Random Address (0x08|0x0035) plen 7                       #39 5.797569
        Advertising handle: 0x00
        Advertising random address: D5:B6:CC:31:DB:3B (Static)
> HCI Event: Command Complete (0x0e) plen 4                                                                          #40 5.798184
      LE Set Advertising Set Random Address (0x08|0x0035) ncmd 1
        Status: Success (0x00)
zephyr.exe[1289787]: < HCI Command: LE Set Extended Advertising Data (0x08|0x0037) plen 22                           #41 5.817590
        Handle: 0x00
        Operation: Complete extended advertising data (0x03)
        Fragment preference: Minimize fragmentation (0x01)
        Data length: 0x12
        Flags: 0x04
          BR/EDR Not Supported
        Name (complete): Tester_2CB6EE
> HCI Event: Command Complete (0x0e) plen 4                                                                          #42 5.818325
      LE Set Extended Advertising Data (0x08|0x0037) ncmd 1
        Status: Success (0x00)
zephyr.exe[1289787]: < HCI Command: LE Set Extended Scan Response Data (0x08|0x0038) plen 4                          #43 5.837541
        Handle: 0x00
        Operation: Complete scan response data (0x03)
        Fragment preference: Minimize fragmentation (0x01)
        Data length: 0x00
> HCI Event: Command Complete (0x0e) plen 4                                                                          #44 5.838028
      LE Set Extended Scan Response Data (0x08|0x0038) ncmd 1
        Status: Success (0x00)
zephyr.exe[1289787]: < HCI Command: LE Set Extended Advertising Enable (0x08|0x0039) plen 6                          #45 5.857613
        Extended advertising: Enabled (0x01)
        Number of sets: 1 (0x01)
        Entry 0
          Handle: 0x00
          Duration: 0 ms (0x00)
          Max ext adv events: 0
> HCI Event: Command Complete (0x0e) plen 4                                                                          #46 5.858246
      LE Set Extended Advertising Enable (0x08|0x0039) ncmd 1
        Status: Success (0x00)
> HCI Event: LE Meta Event (0x3e) plen 31                                                                            #47 6.171518
      LE Enhanced Connection Complete (0x0a)
        Status: Success (0x00)
        Handle: 615
        Role: Peripheral (0x01)
        Peer address type: Public (0x00)
        Peer address: C0:07:E8:2C:B6:EE (OUI C0-07-E8)
        Local resolvable private address: 00:00:00:00:00:00 (Non-Resolvable)
        Peer resolvable private address: 00:00:00:00:00:00 (Non-Resolvable)
        Connection interval: 62.50 msec (0x0032)
        Connection latency: 0 (0x0000)
        Supervision timeout: 20000 msec (0x07d0)
        Central clock accuracy: 0x07
> HCI Event: LE Meta Event (0x3e) plen 6                                                                             #48 6.171672
      LE Advertising Set Terminated (0x12)
        Status: Success (0x00)
        Handle: 0
        Connection handle: 615
        Number of completed extended advertising events: 0
zephyr.exe[1289787]: < HCI Command: LE Read Remote Used Features (0x08|0x0016) plen 2                                #49 6.178293
        Handle: 615 Address: C0:07:E8:2C:B6:EE (OUI C0-07-E8)
> HCI Event: Command Status (0x0f) plen 4                                                                            #50 6.178714
      LE Read Remote Used Features (0x08|0x0016) ncmd 1
        Status: Success (0x00)
zephyr.exe[1289787]: < HCI Command: LE Set PHY (0x08|0x0032) plen 7                                                  #51 6.197626
        Handle: 615 Address: C0:07:E8:2C:B6:EE (OUI C0-07-E8)
        All PHYs preference: 0x00
        TX PHYs preference: 0x02
          LE 2M
        RX PHYs preference: 0x02
          LE 2M
        PHY options preference: Reserved (0x0000)
> HCI Event: Command Status (0x0f) plen 4                                                                            #52 6.198132
      LE Set PHY (0x08|0x0032) ncmd 1
        Status: Success (0x00)
> HCI Event: LE Meta Event (0x3e) plen 12                                                                            #53 6.360438
      LE Read Remote Used Features (0x04)
        Status: Success (0x00)
        Handle: 615 Address: C0:07:E8:2C:B6:EE (OUI C0-07-E8)
        Features: 0x2d 0x49 0x01 0xf7 0xef 0x39 0x00 0x80
          LE Encryption
          Extended Reject Indication
          Peripheral-initiated Features Exchange
          LE Data Packet Length Extension
          LE 2M PHY
          LE Coded PHY
          Channel Selection Algorithm #2
          Minimum Number of Used Channels Procedure
          Periodic Advertising Sync Transfer - Sender
          Periodic Advertising Sync Transfer - Recipient
          Sleep Clock Accuracy Updates
          Connected Isochronous Stream - Central
          Connected Isochronous Stream - Peripheral
          Isochronous Broadcaster
          Synchronized Receiver
          Connected Isochronous Stream (Host Support)
          LE Power Control Request
          LE Power Control Request
          LE Path Loss Monitoring
          Connection Subrating
          Connection Subrating (Host Support)
          Channel Classification
          Unknown features (0x8000390000000000)
> ACL Data RX: Handle 615 flags 0x02 dlen 11                                                                         #54 6.672740
      SMP: Pairing Request (0x01) len 6
        IO capability: KeyboardDisplay (0x04)
        OOB data: Authentication data not present (0x00)
        Authentication requirement: Bonding, No MITM, Legacy, No Keypresses (0x01)
        Max encryption key size: 16
        Initiator key distribution: Sign (0x04)
        Responder key distribution: Sign (0x04)
zephyr.exe[1289787]: < HCI Command: Host Number of Completed Packets (0x03|0x0035) plen 5                            #55 6.677722
        Num handles: 1
        Handle: 615 Address: C0:07:E8:2C:B6:EE (OUI C0-07-E8)
        Count: 1
zephyr.exe[1289787]: < ACL Data TX: Handle 615 [1/3] flags 0x00 dlen 11                                              #56 6.677747
      SMP: Pairing Response (0x02) len 6
        IO capability: KeyboardDisplay (0x04)
        OOB data: Authentication data not present (0x00)
        Authentication requirement: Bonding, No MITM, Legacy, No Keypresses (0x01)
        Max encryption key size: 16
        Initiator key distribution: Sign (0x04)
        Responder key distribution: Sign (0x04)
> HCI Event: Number of Completed Packets (0x13) plen 5                                                               #57 6.797724
        Num handles: 1
        Handle: 615 Address: C0:07:E8:2C:B6:EE (OUI C0-07-E8)
        Count: 1
        Buffers: 0/3
        #56: len 11 (0 Kb/s)
        Latency: 119 msec (119-119 msec ~119 msec)
> ACL Data RX: Handle 615 flags 0x02 dlen 21                                                                         #58 6.798009
      SMP: Pairing Confirm (0x03) len 16
        Confirm value[16]: 7d79de28bc3ae828c00497276e8dbec4
zephyr.exe[1289787]: < HCI Command: Host Number of Completed Packets (0x03|0x0035) plen 5                            #59 6.817781
        Num handles: 1
        Handle: 615 Address: C0:07:E8:2C:B6:EE (OUI C0-07-E8)
        Count: 1
zephyr.exe[1289787]: < ACL Data TX: Handle 615 [1/3] flags 0x00 dlen 21                                              #60 6.817847
      SMP: Pairing Confirm (0x03) len 16
        Confirm value[16]: d997ea0a79b2f3df76cac2da58f5f953
> HCI Event: LE Meta Event (0x3e) plen 6                                                                             #61 6.859705
      LE PHY Update Complete (0x0c)
        Status: Success (0x00)
        Handle: 615 Address: C0:07:E8:2C:B6:EE (OUI C0-07-E8)
        TX PHY: LE 2M (0x02)
        RX PHY: LE 2M (0x02)
> HCI Event: Number of Completed Packets (0x13) plen 5                                                               #62 6.922711
        Num handles: 1
        Handle: 615 Address: C0:07:E8:2C:B6:EE (OUI C0-07-E8)
        Count: 1
        Buffers: 0/3
        #60: len 21 (1 Kb/s)
        Latency: 104 msec (104-119 msec ~112 msec)
> ACL Data RX: Handle 615 flags 0x02 dlen 21                                                                         #63 6.922899
      SMP: Pairing Random (0x04) len 16
        Random value[16]: 99c4bf06eef8a809e8d9b78adf02b1d7
zephyr.exe[1289787]: < HCI Command: Host Number of Completed Packets (0x03|0x0035) plen 5                            #64 6.937748
        Num handles: 1
        Handle: 615 Address: C0:07:E8:2C:B6:EE (OUI C0-07-E8)
        Count: 1
zephyr.exe[1289787]: < ACL Data TX: Handle 615 [1/3] flags 0x00 dlen 21                                              #65 6.937817
      SMP: Pairing Random (0x04) len 16
        Random value[16]: 8e6108f966a694cbe26df70bb96773e6
> HCI Event: Number of Completed Packets (0x13) plen 5                                                               #66 7.047530
        Num handles: 1
        Handle: 615 Address: C0:07:E8:2C:B6:EE (OUI C0-07-E8)
        Count: 1
        Buffers: 0/3
        #65: len 21 (1 Kb/s)
        Latency: 109 msec (104-119 msec ~111 msec)
> HCI Event: LE Meta Event (0x3e) plen 13                                                                            #67 7.110487
      LE Long Term Key Request (0x05)
        Handle: 615 Address: C0:07:E8:2C:B6:EE (OUI C0-07-E8)
        Random number: 0x0000000000000000
        Encrypted diversifier: 0x0000
zephyr.exe[1289787]: < HCI Command: LE Long Term Key Request Reply (0x08|0x001a) plen 18                             #68 7.117692
        Handle: 615 Address: C0:07:E8:2C:B6:EE (OUI C0-07-E8)
        Long term key[16]: e589b1af18b5a232d0625b178e3e6a28
> HCI Event: Command Complete (0x0e) plen 6                                                                          #69 7.118324
      LE Long Term Key Request Reply (0x08|0x001a) ncmd 1
        Status: Success (0x00)
        Handle: 615 Address: C0:07:E8:2C:B6:EE (OUI C0-07-E8)
> HCI Event: Encryption Change (0x08) plen 4                                                                         #70 7.422732
        Status: Success (0x00)
        Handle: 615 Address: C0:07:E8:2C:B6:EE (OUI C0-07-E8)
        Encryption: Enabled with AES-CCM (0x01)
zephyr.exe[1289787]: < ACL Data TX: Handle 615 [1/3] flags 0x00 dlen 21                                              #71 7.547752
      SMP: Signing Information (0x0a) len 16
        Signature key[16]: 5da095555cc64d02679f89a05211af56
> HCI Event: Number of Completed Packets (0x13) plen 5                                                               #72 7.672580
        Num handles: 1
        Handle: 615 Address: C0:07:E8:2C:B6:EE (OUI C0-07-E8)
        Count: 1
        Buffers: 0/3
        #71: len 21 (1 Kb/s)
        Latency: 124 msec (104-124 msec ~117 msec)
> ACL Data RX: Handle 615 flags 0x02 dlen 21                                                                         #73 7.672949
      SMP: Signing Information (0x0a) len 16
        Signature key[16]: c082b451d18c2c688b1b585ce27964e3
zephyr.exe[1289787]: < HCI Command: Host Number of Completed Packets (0x03|0x0035) plen 5                            #74 7.677661
        Num handles: 1
        Handle: 615 Address: C0:07:E8:2C:B6:EE (OUI C0-07-E8)
        Count: 1
zephyr.exe[1289787]: < HCI Command: Disconnect (0x01|0x0006) plen 3                                                  #75 7.897681
        Handle: 615 Address: C0:07:E8:2C:B6:EE (OUI C0-07-E8)
        Reason: Remote User Terminated Connection (0x13)
> HCI Event: Command Status (0x0f) plen 4                                                                            #76 7.898207
      Disconnect (0x01|0x0006) ncmd 1
        Status: Success (0x00)
> HCI Event: Disconnect Complete (0x05) plen 4                                                                       #77 7.984998
        Status: Success (0x00)
        Handle: 615 Address: C0:07:E8:2C:B6:EE (OUI C0-07-E8)
        Reason: Connection Terminated By Local Host (0x16)
zephyr.exe[1289787]: < HCI Command: LE Set Extended Advertising Parameters (0x08|0x0036) plen 25                     #78 9.017662
        Handle: 0x00
        Properties: 0x0013
          Connectable
          Scannable
          Use legacy advertising PDUs: ADV_IND
        Min advertising interval: 100.000 msec (0x00a0)
        Max advertising interval: 150.000 msec (0x00f0)
        Channel map: 37, 38, 39 (0x07)
        Own address type: Random (0x01)
        Peer address type: Public (0x00)
        Peer address: 00:00:00:00:00:00 (OUI 00-00-00)
        Filter policy: Allow Scan Request from Any, Allow Connect Request from Any (0x00)
        TX power: Host has no preference (0x7f)
        Primary PHY: LE 1M (0x01)
        Secondary max skip: 0x00
        Secondary PHY: LE 1M (0x01)
        SID: 0x00
        Scan request notifications: Disabled (0x00)
> HCI Event: Command Complete (0x0e) plen 5                                                                          #79 9.018479
      LE Set Extended Advertising Parameters (0x08|0x0036) ncmd 1
        Status: Success (0x00)
        TX power (selected): 0 dbm (0x00)
zephyr.exe[1289787]: < HCI Command: LE Set Advertising Set Random Address (0x08|0x0035) plen 7                       #80 9.037632
        Advertising handle: 0x00
        Advertising random address: D5:B6:CC:31:DB:3B (Static)
> HCI Event: Command Complete (0x0e) plen 4                                                                          #81 9.038156
      LE Set Advertising Set Random Address (0x08|0x0035) ncmd 1
        Status: Success (0x00)
zephyr.exe[1289787]: < HCI Command: LE Set Extended Advertising Data (0x08|0x0037) plen 22                           #82 9.057628
        Handle: 0x00
        Operation: Complete extended advertising data (0x03)
        Fragment preference: Minimize fragmentation (0x01)
        Data length: 0x12
        Flags: 0x04
          BR/EDR Not Supported
        Name (complete): Tester_2CB6EE
> HCI Event: Command Complete (0x0e) plen 4                                                                          #83 9.058335
      LE Set Extended Advertising Data (0x08|0x0037) ncmd 1
        Status: Success (0x00)
zephyr.exe[1289787]: < HCI Command: LE Set Extended Scan Response Data (0x08|0x0038) plen 4                          #84 9.077623
        Handle: 0x00
        Operation: Complete scan response data (0x03)
        Fragment preference: Minimize fragmentation (0x01)
        Data length: 0x00
> HCI Event: Command Complete (0x0e) plen 4                                                                          #85 9.078018
      LE Set Extended Scan Response Data (0x08|0x0038) ncmd 1
        Status: Success (0x00)
zephyr.exe[1289787]: < HCI Command: LE Set Extended Advertising Enable (0x08|0x0039) plen 6                          #86 9.097631
        Extended advertising: Enabled (0x01)
        Number of sets: 1 (0x01)
        Entry 0
          Handle: 0x00
          Duration: 0 ms (0x00)
          Max ext adv events: 0
> HCI Event: Command Complete (0x0e) plen 4                                                                          #87 9.098124
      LE Set Extended Advertising Enable (0x08|0x0039) ncmd 1
        Status: Success (0x00)
> HCI Event: LE Meta Event (0x3e) plen 31                                                                            #88 9.216009
      LE Enhanced Connection Complete (0x0a)
        Status: Success (0x00)
        Handle: 633
        Role: Peripheral (0x01)
        Peer address type: Public (0x00)
        Peer address: C0:07:E8:2C:B6:EE (OUI C0-07-E8)
        Local resolvable private address: 00:00:00:00:00:00 (Non-Resolvable)
        Peer resolvable private address: 00:00:00:00:00:00 (Non-Resolvable)
        Connection interval: 62.50 msec (0x0032)
        Connection latency: 0 (0x0000)
        Supervision timeout: 20000 msec (0x07d0)
        Central clock accuracy: 0x07
> HCI Event: LE Meta Event (0x3e) plen 6                                                                             #89 9.216211
      LE Advertising Set Terminated (0x12)
        Status: Success (0x00)
        Handle: 0
        Connection handle: 633
        Number of completed extended advertising events: 0
zephyr.exe[1289787]: < HCI Command: LE Read Remote Used Features (0x08|0x0016) plen 2                                #90 9.217689
        Handle: 633 Address: C0:07:E8:2C:B6:EE (OUI C0-07-E8)
> HCI Event: Command Status (0x0f) plen 4                                                                            #91 9.218075
      LE Read Remote Used Features (0x08|0x0016) ncmd 1
        Status: Success (0x00)
zephyr.exe[1289787]: < HCI Command: LE Set PHY (0x08|0x0032) plen 7                                                  #92 9.237663
        Handle: 633 Address: C0:07:E8:2C:B6:EE (OUI C0-07-E8)
        All PHYs preference: 0x00
        TX PHYs preference: 0x02
          LE 2M
        RX PHYs preference: 0x02
          LE 2M
        PHY options preference: Reserved (0x0000)
> HCI Event: Command Status (0x0f) plen 4                                                                            #93 9.238234
      LE Set PHY (0x08|0x0032) ncmd 1
        Status: Success (0x00)
> HCI Event: LE Meta Event (0x3e) plen 12                                                                            #94 9.404974
      LE Read Remote Used Features (0x04)
        Status: Success (0x00)
        Handle: 633 Address: C0:07:E8:2C:B6:EE (OUI C0-07-E8)
        Features: 0x2d 0x49 0x01 0xf7 0xef 0x39 0x00 0x80
          LE Encryption
          Extended Reject Indication
          Peripheral-initiated Features Exchange
          LE Data Packet Length Extension
          LE 2M PHY
          LE Coded PHY
          Channel Selection Algorithm #2
          Minimum Number of Used Channels Procedure
          Periodic Advertising Sync Transfer - Sender
          Periodic Advertising Sync Transfer - Recipient
          Sleep Clock Accuracy Updates
          Connected Isochronous Stream - Central
          Connected Isochronous Stream - Peripheral
          Isochronous Broadcaster
          Synchronized Receiver
          Connected Isochronous Stream (Host Support)
          LE Power Control Request
          LE Power Control Request
          LE Path Loss Monitoring
          Connection Subrating
          Connection Subrating (Host Support)
          Channel Classification
          Unknown features (0x8000390000000000)
> ACL Data RX: Handle 633 flags 0x02 dlen 11                                                                         #95 9.717281
      ATT: Read By Group Type Request (0x10) len 6
        Handle range: 0x0001-0xffff
        Attribute group type: Primary Service (0x2800)
zephyr.exe[1289787]: < HCI Command: Host Number of Completed Packets (0x03|0x0035) plen 5                            #96 9.717688
        Num handles: 1
        Handle: 633 Address: C0:07:E8:2C:B6:EE (OUI C0-07-E8)
        Count: 1
zephyr.exe[1289787]: < ACL Data TX: Handle 633 [1/3] flags 0x00 dlen 24                                              #97 9.717695
      ATT: Read By Group Type Response (0x11) len 19
        Attribute data length: 6
        Attribute group list: 3 entries
        Handle range: 0x0001-0x000a
        UUID: Generic Attribute Profile (0x1801)
        Handle range: 0x000b-0x0011
        UUID: Generic Access Profile (0x1800)
        Handle range: 0x0012-0x0020
        UUID: Device Information (0x180a)
> HCI Event: Number of Completed Packets (0x13) plen 5                                                               #98 9.842161
        Num handles: 1
        Handle: 633 Address: C0:07:E8:2C:B6:EE (OUI C0-07-E8)
        Count: 1
        Buffers: 0/3
        #97: len 24 (1 Kb/s)
        Latency: 124 msec (124-124 msec ~124 msec)
> ACL Data RX: Handle 633 flags 0x02 dlen 11                                                                         #99 9.842407
      ATT: Read By Group Type Request (0x10) len 6
        Handle range: 0x0021-0xffff
        Attribute group type: Primary Service (0x2800)
zephyr.exe[1289787]: < HCI Command: Host Number of Completed Packets (0x03|0x0035) plen 5                           #100 9.857774
        Num handles: 1
        Handle: 633 Address: C0:07:E8:2C:B6:EE (OUI C0-07-E8)
        Count: 1
zephyr.exe[1289787]: < ACL Data TX: Handle 633 [1/3] flags 0x00 dlen 12                                             #101 9.857824
      ATT: Read By Group Type Response (0x11) len 7
        Attribute data length: 6
        Attribute group list: 1 entry
        Handle range: 0x0021-0x0029
        UUID: Unknown (0x51aa)
> HCI Event: LE Meta Event (0x3e) plen 6                                                                            #102 9.904257
      LE PHY Update Complete (0x0c)
        Status: Success (0x00)
        Handle: 633 Address: C0:07:E8:2C:B6:EE (OUI C0-07-E8)
        TX PHY: LE 2M (0x02)
        RX PHY: LE 2M (0x02)
> HCI Event: Number of Completed Packets (0x13) plen 5                                                              #103 9.967091
        Num handles: 1
        Handle: 633 Address: C0:07:E8:2C:B6:EE (OUI C0-07-E8)
        Count: 1
        Buffers: 0/3
        #101: len 12 (0 Kb/s)
        Latency: 109 msec (109-124 msec ~116 msec)
> ACL Data RX: Handle 633 flags 0x02 dlen 11                                                                        #104 9.967313
      ATT: Read By Group Type Request (0x10) len 6
        Handle range: 0x002a-0xffff
        Attribute group type: Primary Service (0x2800)
zephyr.exe[1289787]: < HCI Command: Host Number of Completed Packets (0x03|0x0035) plen 5                           #105 9.977776
        Num handles: 1
        Handle: 633 Address: C0:07:E8:2C:B6:EE (OUI C0-07-E8)
        Count: 1
zephyr.exe[1289787]: < ACL Data TX: Handle 633 [1/3] flags 0x00 dlen 9                                              #106 9.977797
      ATT: Error Response (0x01) len 4
        Read By Group Type Request (0x10)
        Handle: 0x002a
        Error: Attribute Not Found (0x0a)
> HCI Event: Number of Completed Packets (0x13) plen 5                                                             #107 10.092188
        Num handles: 1
        Handle: 633 Address: C0:07:E8:2C:B6:EE (OUI C0-07-E8)
        Count: 1
        Buffers: 0/3
        #106: len 9 (0 Kb/s)
        Latency: 114 msec (109-124 msec ~115 msec)
> ACL Data RX: Handle 633 flags 0x02 dlen 11                                                                       #108 10.092324
      ATT: Read By Type Request (0x08) len 6
        Handle range: 0x0001-0x000a
        Attribute type: Characteristic (0x2803)
zephyr.exe[1289787]: < HCI Command: Host Number of Completed Packets (0x03|0x0035) plen 5                          #109 10.097774
        Num handles: 1
        Handle: 633 Address: C0:07:E8:2C:B6:EE (OUI C0-07-E8)
        Count: 1
zephyr.exe[1289787]: < ACL Data TX: Handle 633 [1/3] flags 0x00 dlen 20                                            #110 10.097843
      ATT: Read By Type Response (0x09) len 15
        Attribute data length: 7
        Attribute data list: 2 entries
        Handle: 0x0002
        Value[5]: 200300052a
            Properties: 0x20
              Indicate (0x20)
            Value Handle: 0x0003
            Value UUID: Service Changed (0x2a05)
        Handle: 0x0005
        Value[5]: 0a0600292b
            Properties: 0x0a
              Read (0x02)
              Write (0x08)
            Value Handle: 0x0006
            Value UUID: Client Supported Features (0x2b29)
> HCI Event: Number of Completed Packets (0x13) plen 5                                                             #111 10.217040
        Num handles: 1
        Handle: 633 Address: C0:07:E8:2C:B6:EE (OUI C0-07-E8)
        Count: 1
        Buffers: 0/3
        #110: len 20 (1 Kb/s)
        Latency: 119 msec (109-124 msec ~117 msec)
> ACL Data RX: Handle 633 flags 0x02 dlen 11                                                                       #112 10.217307
      ATT: Read By Type Request (0x08) len 6
        Handle range: 0x0006-0x000a
        Attribute type: Characteristic (0x2803)
zephyr.exe[1289787]: < HCI Command: Host Number of Completed Packets (0x03|0x0035) plen 5                          #113 10.217700
        Num handles: 1
        Handle: 633 Address: C0:07:E8:2C:B6:EE (OUI C0-07-E8)
        Count: 1
zephyr.exe[1289787]: < ACL Data TX: Handle 633 [1/3] flags 0x00 dlen 20                                            #114 10.217719
      ATT: Read By Type Response (0x09) len 15
        Attribute data length: 7
        Attribute data list: 2 entries
        Handle: 0x0007
        Value[5]: 0208002a2b
            Properties: 0x02
              Read (0x02)
            Value Handle: 0x0008
            Value UUID: Database Hash (0x2b2a)
        Handle: 0x0009
        Value[5]: 020a003a2b
            Properties: 0x02
              Read (0x02)
            Value Handle: 0x000a
            Value UUID: Server Supported Features (0x2b3a)
> HCI Event: Number of Completed Packets (0x13) plen 5                                                             #115 10.342166
        Num handles: 1
        Handle: 633 Address: C0:07:E8:2C:B6:EE (OUI C0-07-E8)
        Count: 1
        Buffers: 0/3
        #114: len 20 (1 Kb/s)
        Latency: 124 msec (109-124 msec ~120 msec)
> ACL Data RX: Handle 633 flags 0x02 dlen 11                                                                       #116 10.342309
      ATT: Read By Type Request (0x08) len 6
        Handle range: 0x000a-0x000a
        Attribute type: Characteristic (0x2803)
zephyr.exe[1289787]: < HCI Command: Host Number of Completed Packets (0x03|0x0035) plen 5                          #117 10.357770
        Num handles: 1
        Handle: 633 Address: C0:07:E8:2C:B6:EE (OUI C0-07-E8)
        Count: 1
zephyr.exe[1289787]: < ACL Data TX: Handle 633 [1/3] flags 0x00 dlen 9                                             #118 10.357832
      ATT: Error Response (0x01) len 4
        Read By Type Request (0x08)
        Handle: 0x000a
        Error: Attribute Not Found (0x0a)
> HCI Event: Number of Completed Packets (0x13) plen 5                                                             #119 10.467083
        Num handles: 1
        Handle: 633 Address: C0:07:E8:2C:B6:EE (OUI C0-07-E8)
        Count: 1
        Buffers: 0/3
        #118: len 9 (0 Kb/s)
        Latency: 109 msec (109-124 msec ~115 msec)
> ACL Data RX: Handle 633 flags 0x02 dlen 9                                                                        #120 10.467290
      ATT: Find Information Request (0x04) len 4
        Handle range: 0x0004-0x0004
zephyr.exe[1289787]: < HCI Command: Host Number of Completed Packets (0x03|0x0035) plen 5                          #121 10.477788
        Num handles: 1
        Handle: 633 Address: C0:07:E8:2C:B6:EE (OUI C0-07-E8)
        Count: 1
zephyr.exe[1289787]: < ACL Data TX: Handle 633 [1/3] flags 0x00 dlen 10                                            #122 10.477796
      ATT: Find Information Response (0x05) len 5
        Format: UUID-16 (0x01)
        Handle: 0x0004
        UUID: Client Characteristic Configuration (0x2902)
> HCI Event: Number of Completed Packets (0x13) plen 5                                                             #123 10.592049
        Num handles: 1
        Handle: 633 Address: C0:07:E8:2C:B6:EE (OUI C0-07-E8)
        Count: 1
        Buffers: 0/3
        #122: len 10 (0 Kb/s)
        Latency: 114 msec (109-124 msec ~114 msec)
> ACL Data RX: Handle 633 flags 0x02 dlen 11                                                                       #124 10.592253
      ATT: Read By Type Request (0x08) len 6
        Handle range: 0x000b-0x0011
        Attribute type: Characteristic (0x2803)
zephyr.exe[1289787]: < HCI Command: Host Number of Completed Packets (0x03|0x0035) plen 5                          #125 10.597786
        Num handles: 1
        Handle: 633 Address: C0:07:E8:2C:B6:EE (OUI C0-07-E8)
        Count: 1
zephyr.exe[1289787]: < ACL Data TX: Handle 633 [1/3] flags 0x00 dlen 20                                            #126 10.597847
      ATT: Read By Type Response (0x09) len 15
        Attribute data length: 7
        Attribute data list: 2 entries
        Handle: 0x000c
        Value[5]: 0a0d00002a
            Properties: 0x0a
              Read (0x02)
              Write (0x08)
            Value Handle: 0x000d
            Value UUID: Device Name (0x2a00)
        Handle: 0x000e
        Value[5]: 0a0f00012a
            Properties: 0x0a
              Read (0x02)
              Write (0x08)
            Value Handle: 0x000f
            Value UUID: Appearance (0x2a01)
> HCI Event: Number of Completed Packets (0x13) plen 5                                                             #127 10.717090
        Num handles: 1
        Handle: 633 Address: C0:07:E8:2C:B6:EE (OUI C0-07-E8)
        Count: 1
        Buffers: 0/3
        #126: len 20 (1 Kb/s)
        Latency: 119 msec (109-124 msec ~116 msec)
> ACL Data RX: Handle 633 flags 0x02 dlen 11                                                                       #128 10.717281
      ATT: Read By Type Request (0x08) len 6
        Handle range: 0x000f-0x0011
        Attribute type: Characteristic (0x2803)
zephyr.exe[1289787]: < HCI Command: Host Number of Completed Packets (0x03|0x0035) plen 5                          #129 10.717681
        Num handles: 1
        Handle: 633 Address: C0:07:E8:2C:B6:EE (OUI C0-07-E8)
        Count: 1
zephyr.exe[1289787]: < ACL Data TX: Handle 633 [1/3] flags 0x00 dlen 13                                            #130 10.717743
      ATT: Read By Type Response (0x09) len 8
        Attribute data length: 7
        Attribute data list: 1 entry
        Handle: 0x0010
        Value[5]: 021100042a
            Properties: 0x02
              Read (0x02)
            Value Handle: 0x0011
            Value UUID: Peripheral Preferred Connection Parameters (0x2a04)
> HCI Event: Number of Completed Packets (0x13) plen 5                                                             #131 10.842101
        Num handles: 1
        Handle: 633 Address: C0:07:E8:2C:B6:EE (OUI C0-07-E8)
        Count: 1
        Buffers: 0/3
        #130: len 13 (0 Kb/s)
        Latency: 124 msec (109-124 msec ~120 msec)
> ACL Data RX: Handle 633 flags 0x02 dlen 11                                                                       #132 10.842248
      ATT: Read By Type Request (0x08) len 6
        Handle range: 0x0011-0x0011
        Attribute type: Characteristic (0x2803)
zephyr.exe[1289787]: < HCI Command: Host Number of Completed Packets (0x03|0x0035) plen 5                          #133 10.857679
        Num handles: 1
        Handle: 633 Address: C0:07:E8:2C:B6:EE (OUI C0-07-E8)
        Count: 1
zephyr.exe[1289787]: < ACL Data TX: Handle 633 [1/3] flags 0x00 dlen 9                                             #134 10.857703
      ATT: Error Response (0x01) len 4
        Read By Type Request (0x08)
        Handle: 0x0011
        Error: Attribute Not Found (0x0a)
> HCI Event: Number of Completed Packets (0x13) plen 5                                                             #135 10.967075
        Num handles: 1
        Handle: 633 Address: C0:07:E8:2C:B6:EE (OUI C0-07-E8)
        Count: 1
        Buffers: 0/3
        #134: len 9 (0 Kb/s)
        Latency: 109 msec (109-124 msec ~115 msec)
> ACL Data RX: Handle 633 flags 0x02 dlen 11                                                                       #136 10.967323
      ATT: Read By Type Request (0x08) len 6
        Handle range: 0x0012-0x0020
        Attribute type: Characteristic (0x2803)
zephyr.exe[1289787]: < HCI Command: Host Number of Completed Packets (0x03|0x0035) plen 5                          #137 10.977682
        Num handles: 1
        Handle: 633 Address: C0:07:E8:2C:B6:EE (OUI C0-07-E8)
        Count: 1
zephyr.exe[1289787]: < ACL Data TX: Handle 633 [1/3] flags 0x00 dlen 20                                            #138 10.977740
      ATT: Read By Type Response (0x09) len 15
        Attribute data length: 7
        Attribute data list: 2 entries
        Handle: 0x0013
        Value[5]: 021400242a
            Properties: 0x02
              Read (0x02)
            Value Handle: 0x0014
            Value UUID: Model Number String (0x2a24)
        Handle: 0x0015
        Value[5]: 021600292a
            Properties: 0x02
              Read (0x02)
            Value Handle: 0x0016
            Value UUID: Manufacturer Name String (0x2a29)
> HCI Event: Number of Completed Packets (0x13) plen 5                                                             #139 11.092160
        Num handles: 1
        Handle: 633 Address: C0:07:E8:2C:B6:EE (OUI C0-07-E8)
        Count: 1
        Buffers: 0/3
        #138: len 20 (1 Kb/s)
        Latency: 114 msec (109-124 msec ~114 msec)
> ACL Data RX: Handle 633 flags 0x02 dlen 11                                                                       #140 11.092314
      ATT: Read By Type Request (0x08) len 6
        Handle range: 0x0016-0x0020
        Attribute type: Characteristic (0x2803)
zephyr.exe[1289787]: < HCI Command: Host Number of Completed Packets (0x03|0x0035) plen 5                          #141 11.097722
        Num handles: 1
        Handle: 633 Address: C0:07:E8:2C:B6:EE (OUI C0-07-E8)
        Count: 1
zephyr.exe[1289787]: < ACL Data TX: Handle 633 [1/3] flags 0x00 dlen 20                                            #142 11.097767
      ATT: Read By Type Response (0x09) len 15
        Attribute data length: 7
        Attribute data list: 2 entries
        Handle: 0x0017
        Value[5]: 021800502a
            Properties: 0x02
              Read (0x02)
            Value Handle: 0x0018
            Value UUID: PnP ID (0x2a50)
        Handle: 0x0019
        Value[5]: 021a00252a
            Properties: 0x02
              Read (0x02)
            Value Handle: 0x001a
            Value UUID: Serial Number String (0x2a25)
> HCI Event: Number of Completed Packets (0x13) plen 5                                                             #143 11.217185
        Num handles: 1
        Handle: 633 Address: C0:07:E8:2C:B6:EE (OUI C0-07-E8)
        Count: 1
        Buffers: 0/3
        #142: len 20 (1 Kb/s)
        Latency: 119 msec (109-124 msec ~117 msec)
> ACL Data RX: Handle 633 flags 0x02 dlen 11                                                                       #144 11.217254
      ATT: Read By Type Request (0x08) len 6
        Handle range: 0x001a-0x0020
        Attribute type: Characteristic (0x2803)
zephyr.exe[1289787]: < HCI Command: Host Number of Completed Packets (0x03|0x0035) plen 5                          #145 11.217683
        Num handles: 1
        Handle: 633 Address: C0:07:E8:2C:B6:EE (OUI C0-07-E8)
        Count: 1
zephyr.exe[1289787]: < ACL Data TX: Handle 633 [1/3] flags 0x00 dlen 20                                            #146 11.217689
      ATT: Read By Type Response (0x09) len 15
        Attribute data length: 7
        Attribute data list: 2 entries
        Handle: 0x001b
        Value[5]: 021c00262a
            Properties: 0x02
              Read (0x02)
            Value Handle: 0x001c
            Value UUID: Firmware Revision String (0x2a26)
        Handle: 0x001d
        Value[5]: 021e00272a
            Properties: 0x02
              Read (0x02)
            Value Handle: 0x001e
            Value UUID: Hardware Revision String (0x2a27)
> HCI Event: Number of Completed Packets (0x13) plen 5                                                             #147 11.342157
        Num handles: 1
        Handle: 633 Address: C0:07:E8:2C:B6:EE (OUI C0-07-E8)
        Count: 1
        Buffers: 0/3
        #146: len 20 (1 Kb/s)
        Latency: 124 msec (109-124 msec ~120 msec)
> ACL Data RX: Handle 633 flags 0x02 dlen 11                                                                       #148 11.342296
      ATT: Read By Type Request (0x08) len 6
        Handle range: 0x001e-0x0020
        Attribute type: Characteristic (0x2803)
zephyr.exe[1289787]: < HCI Command: Host Number of Completed Packets (0x03|0x0035) plen 5                          #149 11.357694
        Num handles: 1
        Handle: 633 Address: C0:07:E8:2C:B6:EE (OUI C0-07-E8)
        Count: 1
zephyr.exe[1289787]: < ACL Data TX: Handle 633 [1/3] flags 0x00 dlen 13                                            #150 11.357711
      ATT: Read By Type Response (0x09) len 8
        Attribute data length: 7
        Attribute data list: 1 entry
        Handle: 0x001f
        Value[5]: 022000282a
            Properties: 0x02
              Read (0x02)
            Value Handle: 0x0020
            Value UUID: Software Revision String (0x2a28)
> HCI Event: Number of Completed Packets (0x13) plen 5                                                             #151 11.467099
        Num handles: 1
        Handle: 633 Address: C0:07:E8:2C:B6:EE (OUI C0-07-E8)
        Count: 1
        Buffers: 0/3
        #150: len 13 (0 Kb/s)
        Latency: 109 msec (109-124 msec ~115 msec)
> ACL Data RX: Handle 633 flags 0x02 dlen 11                                                                       #152 11.467297
      ATT: Read By Type Request (0x08) len 6
        Handle range: 0x0020-0x0020
        Attribute type: Characteristic (0x2803)
zephyr.exe[1289787]: < HCI Command: Host Number of Completed Packets (0x03|0x0035) plen 5                          #153 11.477799
        Num handles: 1
        Handle: 633 Address: C0:07:E8:2C:B6:EE (OUI C0-07-E8)
        Count: 1
zephyr.exe[1289787]: < ACL Data TX: Handle 633 [1/3] flags 0x00 dlen 9                                             #154 11.477869
      ATT: Error Response (0x01) len 4
        Read By Type Request (0x08)
        Handle: 0x0020
        Error: Attribute Not Found (0x0a)
> HCI Event: Number of Completed Packets (0x13) plen 5                                                             #155 11.592167
        Num handles: 1
        Handle: 633 Address: C0:07:E8:2C:B6:EE (OUI C0-07-E8)
        Count: 1
        Buffers: 0/3
        #154: len 9 (0 Kb/s)
        Latency: 114 msec (109-124 msec ~114 msec)
> ACL Data RX: Handle 633 flags 0x02 dlen 11                                                                       #156 11.592292
      ATT: Read By Type Request (0x08) len 6
        Handle range: 0x0021-0x0029
        Attribute type: Characteristic (0x2803)
zephyr.exe[1289787]: < HCI Command: Host Number of Completed Packets (0x03|0x0035) plen 5                          #157 11.597798
        Num handles: 1
        Handle: 633 Address: C0:07:E8:2C:B6:EE (OUI C0-07-E8)
        Count: 1
zephyr.exe[1289787]: < ACL Data TX: Handle 633 [1/3] flags 0x00 dlen 20                                            #158 11.597805
      ATT: Read By Type Response (0x09) len 15
        Attribute data length: 7
        Attribute data list: 2 entries
        Handle: 0x0022
        Value[5]: 022300aa52
            Properties: 0x02
              Read (0x02)
            Value Handle: 0x0023
            Value UUID: Unknown (0x52aa)
        Handle: 0x0024
        Value[5]: 022500aa53
            Properties: 0x02
              Read (0x02)
            Value Handle: 0x0025
            Value UUID: Unknown (0x53aa)
> HCI Event: Number of Completed Packets (0x13) plen 5                                                             #159 11.717212
        Num handles: 1
        Handle: 633 Address: C0:07:E8:2C:B6:EE (OUI C0-07-E8)
        Count: 1
        Buffers: 0/3
        #158: len 20 (1 Kb/s)
        Latency: 119 msec (109-124 msec ~117 msec)
> ACL Data RX: Handle 633 flags 0x02 dlen 11                                                                       #160 11.717342
      ATT: Read By Type Request (0x08) len 6
        Handle range: 0x0025-0x0029
        Attribute type: Characteristic (0x2803)
zephyr.exe[1289787]: < HCI Command: Host Number of Completed Packets (0x03|0x0035) plen 5                          #161 11.717596
        Num handles: 1
        Handle: 633 Address: C0:07:E8:2C:B6:EE (OUI C0-07-E8)
        Count: 1
zephyr.exe[1289787]: < ACL Data TX: Handle 633 [1/3] flags 0x00 dlen 20                                            #162 11.717603
      ATT: Read By Type Response (0x09) len 15
        Attribute data length: 7
        Attribute data list: 2 entries
        Handle: 0x0026
        Value[5]: 422700aa54
            Properties: 0x42
              Read (0x02)
              Authorize (0x40)
              Extended Properties (0x80)
            Value Handle: 0x0027
            Value UUID: Unknown (0x54aa)
        Handle: 0x0028
        Value[5]: 0a2900aa55
            Properties: 0x0a
              Read (0x02)
              Write (0x08)
            Value Handle: 0x0029
            Value UUID: Unknown (0x55aa)
> HCI Event: Number of Completed Packets (0x13) plen 