Bluetooth monitor ver 5.72
= Note: Linux version 6.14.0-36-generic (x86_64)                       0.648441
= Note: Bluetooth subsystem version 2.22                               0.648443
= New Index: 00:00:00:00:00:00 (Primary,UART,hci2)              [hci2] 0.648444
= New Index: 00:00:00:00:00:00 (Primary,UART,hci1)              [hci1] 0.648445
= New Index: 48:5F:99:8E:E0:64 (Primary,USB,hci0)               [hci0] 0.648445
= Open Index: 00:00:00:00:00:00                                 [hci1] 0.782086
= Index Info: 00:00:00:00:00:00 (Nordic Semiconductor ASA)      [hci1] 0.782101
@ USER Open: main (privileged) version 2.22            {0x0001} [hci1] 0.782109
< HCI Command: Reset (0x03|0x0003) plen 0                    #1 [hci1] 0.783163
> HCI Event: Command Complete (0x0e) plen 4                  #2 [hci1] 0.783845
      Reset (0x03|0x0003) ncmd 1
        Status: Success (0x00)
< HCI Command: Read Local Supported... (0x04|0x0003) plen 0  #3 [hci1] 0.801739
> HCI Event: Command Complete (0x0e) plen 12                 #4 [hci1] 0.802529
      Read Local Supported Features (0x04|0x0003) ncmd 1
        Status: Success (0x00)
        Features: 0x00 0x00 0x00 0x00 0x60 0x00 0x00 0x00
          BR/EDR Not Supported
          LE Supported (Controller)
< HCI Command: Read Local Version In.. (0x04|0x0001) plen 0  #5 [hci1] 0.821565
> HCI Event: Command Complete (0x0e) plen 12                 #6 [hci1] 0.822190
      Read Local Version Information (0x04|0x0001) ncmd 1
        Status: Success (0x00)
        HCI version: Reserved (0x0f) - Revision 12393 (0x3069)
        LMP version: Reserved (0x0f) - Subversion 12393 (0x3069)
        Manufacturer: Nordic Semiconductor ASA (89)
< HCI Command: Read Local Supported... (0x04|0x0002) plen 0  #7 [hci1] 0.841575
> HCI Event: Command Complete (0x0e) plen 68                 #8 [hci1] 0.842803
      Read Local Supported Commands (0x04|0x0002) ncmd 1
        Status: Success (0x00)
        Commands: 119 entries
          Disconnect (Octet 0 - Bit 5)
          Read Remote Version Information (Octet 2 - Bit 7)
          Set Event Mask (Octet 5 - Bit 6)
          Reset (Octet 5 - Bit 7)
          Read Connection Accept Timeout (Octet 7 - Bit 2)
          Write Connection Accept Timeout (Octet 7 - Bit 3)
          Read Transmit Power Level (Octet 10 - Bit 2)
          Set Controller To Host Flow Control (Octet 10 - Bit 5)
          Host Buffer Size (Octet 10 - Bit 6)
          Host Number of Completed Packets (Octet 10 - Bit 7)
          Read Local Version Information (Octet 14 - Bit 3)
          Read Local Supported Features (Octet 14 - Bit 5)
          Read BD ADDR (Octet 15 - Bit 1)
          Read RSSI (Octet 15 - Bit 5)
          Set Event Mask Page 2 (Octet 22 - Bit 2)
          LE Set Event Mask (Octet 25 - Bit 0)
          LE Read Buffer Size (Octet 25 - Bit 1)
          LE Read Local Supported Features (Octet 25 - Bit 2)
          LE Set Random Address (Octet 25 - Bit 4)
          LE Set Advertising Parameters (Octet 25 - Bit 5)
          LE Read Advertising Channel TX Power (Octet 25 - Bit 6)
          LE Set Advertising Data (Octet 25 - Bit 7)
          LE Set Scan Response Data (Octet 26 - Bit 0)
          LE Set Advertise Enable (Octet 26 - Bit 1)
          LE Set Scan Parameters (Octet 26 - Bit 2)
          LE Set Scan Enable (Octet 26 - Bit 3)
          LE Create Connection (Octet 26 - Bit 4)
          LE Create Connection Cancel (Octet 26 - Bit 5)
          LE Read Accept List Size (Octet 26 - Bit 6)
          LE Clear Accept List (Octet 26 - Bit 7)
          LE Add Device To Accept List (Octet 27 - Bit 0)
          LE Remove Device From Accept List (Octet 27 - Bit 1)
          LE Connection Update (Octet 27 - Bit 2)
          LE Set Host Channel Classification (Octet 27 - Bit 3)
          LE Read Channel Map (Octet 27 - Bit 4)
          LE Read Remote Used Features (Octet 27 - Bit 5)
          LE Encrypt (Octet 27 - Bit 6)
          LE Rand (Octet 27 - Bit 7)
          LE Start Encryption (Octet 28 - Bit 0)
          LE Long Term Key Request Reply (Octet 28 - Bit 1)
          LE Long Term Key Request Neg Reply (Octet 28 - Bit 2)
          LE Read Supported States (Octet 28 - Bit 3)
          LE Receiver Test (Octet 28 - Bit 4)
          LE Transmitter Test (Octet 28 - Bit 5)
          LE Test End (Octet 28 - Bit 6)
          Read Authenticated Payload Timeout (Octet 32 - Bit 4)
          Write Authenticated Payload Timeout (Octet 32 - Bit 5)
          LE Set Data Length (Octet 33 - Bit 6)
          LE Read Suggested Default Data Length (Octet 33 - Bit 7)
          LE Write Suggested Default Data Length (Octet 34 - Bit 0)
          LE Add Device To Resolving List (Octet 34 - Bit 3)
          LE Remove Device From Resolving List (Octet 34 - Bit 4)
          LE Clear Resolving List (Octet 34 - Bit 5)
          LE Read Resolving List Size (Octet 34 - Bit 6)
          LE Set Address Resolution Enable (Octet 35 - Bit 1)
          LE Set Resolvable Private Address Timeout (Octet 35 - Bit 2)
          LE Read Maximum Data Length (Octet 35 - Bit 3)
          LE Read PHY (Octet 35 - Bit 4)
          LE Set Default PHY (Octet 35 - Bit 5)
          LE Set PHY (Octet 35 - Bit 6)
          LE Enhanced Receiver Test (Octet 35 - Bit 7)
          LE Enhanced Transmitter Test (Octet 36 - Bit 0)
          LE Set Advertising Set Random Address (Octet 36 - Bit 1)
          LE Set Extended Advertising Parameters (Octet 36 - Bit 2)
          LE Set Extended Advertising Data (Octet 36 - Bit 3)
          LE Set Extended Scan Response Data (Octet 36 - Bit 4)
          LE Set Extended Advertising Enable (Octet 36 - Bit 5)
          LE Read Maximum Advertising Data Length (Octet 36 - Bit 6)
          LE Read Number of Supported Advertising Sets (Octet 36 - Bit 7)
          LE Remove Advertising Set (Octet 37 - Bit 0)
          LE Clear Advertising Sets (Octet 37 - Bit 1)
          LE Set Periodic Advertising Parameters (Octet 37 - Bit 2)
          LE Set Periodic Advertising Data (Octet 37 - Bit 3)
          LE Set Periodic Advertising Enable (Octet 37 - Bit 4)
          LE Set Extended Scan Parameters (Octet 37 - Bit 5)
          LE Set Extended Scan Enable (Octet 37 - Bit 6)
          LE Extended Create Connection (Octet 37 - Bit 7)
          LE Periodic Advertising Create Sync (Octet 38 - Bit 0)
          LE Periodic Advertising Create Sync Cancel (Octet 38 - Bit 1)
          LE Periodic Advertising Terminate Sync (Octet 38 - Bit 2)
          LE Add Device To Periodic Advertiser List (Octet 38 - Bit 3)
          LE Remove Device From Periodic Advertiser List (Octet 38 - Bit 4)
          LE Clear Periodic Advertiser List (Octet 38 - Bit 5)
          LE Read Periodic Advertiser List Size (Octet 38 - Bit 6)
          LE Read Transmit Power (Octet 38 - Bit 7)
          LE Read RF Path Compensation (Octet 39 - Bit 0)
          LE Write RF Path Compensation (Octet 39 - Bit 1)
          LE Set Privacy Mode (Octet 39 - Bit 2)
          LE Periodic Advertising Receive Enable (Octet 40 - Bit 5)
          LE Periodic Advertising Sync Transfer (Octet 40 - Bit 6)
          LE Periodic Advertising Set Info Transfer (Octet 40 - Bit 7)
          LE Periodic Advertising Sync Transfer Parameters (Octet 41 - Bit 0)
          LE Set Default Periodic Advertisng Sync Transfer Parameters (Octet 41 - Bit 1)
          LE Read Buffer v2 (Octet 41 - Bit 5)
          LE Read ISO TX Sync (Octet 41 - Bit 6)
          LE Set Connected Isochronous Group Parameters (Octet 41 - Bit 7)
          LE Set Connected Isochronous Group Parameters Test (Octet 42 - Bit 0)
          LE Create Connected Isochronous Stream (Octet 42 - Bit 1)
          LE Remove Connected Isochronous Group (Octet 42 - Bit 2)
          LE Accept Connected Isochronous Stream Request (Octet 42 - Bit 3)
          LE Reject Connected Isochronous Stream Request (Octet 42 - Bit 4)
          LE Create Broadcast Isochronous Group (Octet 42 - Bit 5)
          LE Create Broadcast Isochronous Group Test (Octet 42 - Bit 6)
          LE Terminate Broadcast Isochronous Group (Octet 42 - Bit 7)
          LE Broadcast Isochronous Group Create Sync (Octet 43 - Bit 0)
          LE Broadcast Isochronous Group Terminate Sync (Octet 43 - Bit 1)
          LE Request Peer SCA (Octet 43 - Bit 2)
          LE Setup Isochronous Data Path (Octet 43 - Bit 3)
          LE Remove Isochronous Data Path (Octet 43 - Bit 4)
          LE Isochronous Transmit Test (Octet 43 - Bit 5)
          LE Isochronous Receive Test (Octet 43 - Bit 6)
          LE Isochronous Read Test Counters (Octet 43 - Bit 7)
          LE Isochronous Read Test Counters (Octet 44 - Bit 0)
          LE Set Host Feature (Octet 44 - Bit 1)
          Octet 44 - Bit 2 
          Octet 45 - Bit 6 
          Octet 46 - Bit 0 
          Octet 46 - Bit 1 
          Octet 46 - Bit 2 
< HCI Command: Host Buffer Size (0x03|0x0033) plen 7         #9 [hci1] 0.861562
        ACL MTU: 255  ACL max packet: 16
        SCO MTU: 0    SCO max packet: 0
> HCI Event: Command Complete (0x0e) plen 4                 #10 [hci1] 0.862078
      Host Buffer Size (0x03|0x0033) ncmd 1
        Status: Success (0x00)
< HCI Command: Set Controller To Ho.. (0x03|0x0031) plen 1  #11 [hci1] 0.881580
        Flow control: ACL Data Packets (0x01)
> HCI Event: Command Complete (0x0e) plen 4                 #12 [hci1] 0.881999
      Set Controller To Host Flow Control (0x03|0x0031) ncmd 1
        Status: Success (0x00)
< HCI Command: LE Read Local Suppor.. (0x08|0x0003) plen 0  #13 [hci1] 0.901566
> HCI Event: Command Complete (0x0e) plen 12                #14 [hci1] 0.902103
      LE Read Local Supported Features (0x08|0x0003) ncmd 1
        Status: Success (0x00)
        Features: 0xfd 0x79 0x00 0xf7 0x30 0x01 0x00 0x00
          LE Encryption
          Extended Reject Indication
          Peripheral-initiated Features Exchange
          LE Ping
          LE Data Packet Length Extension
          LL Privacy
          Extended Scanner Filter Policies
          LE 2M PHY
          LE Coded PHY
          LE Extended Advertising
          LE Periodic Advertising
          Channel Selection Algorithm #2
          Periodic Advertising Sync Transfer - Sender
          Periodic Advertising Sync Transfer - Recipient
          Sleep Clock Accuracy Updates
          Connected Isochronous Stream - Central
          Connected Isochronous Stream - Peripheral
          Isochronous Broadcaster
          Synchronized Receiver
          Periodic Advertising ADI support
          Connection Subrating
          Unknown features (0x0000010000000000)
< HCI Command: LE Set Host Feature (0x08|0x0074) plen 2     #15 [hci1] 0.921573
        Bit Number: 32
          Connected Isochronous Stream (Host Support)
        Bit Value: 1
> HCI Event: Command Complete (0x0e) plen 4                 #16 [hci1] 0.922076
      LE Set Host Feature (0x08|0x0074) ncmd 1
        Status: Success (0x00)
< HCI Command: LE Read Buffer v2 (0x08|0x0060) plen 0       #17 [hci1] 0.941567
> HCI Event: Command Complete (0x0e) plen 10                #18 [hci1] 0.942080
      LE Read Buffer v2 (0x08|0x0060) ncmd 1
        Status: Success (0x00)
        ACL MTU: 27
        ACL max packet: 3
        ISO MTU: 318
        ISO max packet: 3
< HCI Command: LE Read Maximum Adve.. (0x08|0x003a) plen 0  #19 [hci1] 0.961611
> HCI Event: Command Complete (0x0e) plen 6                 #20 [hci1] 0.962118
      LE Read Maximum Advertising Data Length (0x08|0x003a) ncmd 1
        Status: Success (0x00)
        Max length: 1650
< HCI Command: LE Read Supported St.. (0x08|0x001c) plen 0  #21 [hci1] 0.981516
> HCI Event: Command Complete (0x0e) plen 12                #22 [hci1] 0.982089
      LE Read Supported States (0x08|0x001c) ncmd 1
        Status: Success (0x00)
        States: 0x000003ff3e0306ff
          Non-connectable Advertising State
          Scannable Advertising State
          Connectable Advertising State
          High Duty Cycle Directed Advertising State
          Passive Scanning State
          Active Scanning State
          Initiating State
            and Connection State (Central Role)
          Connection State (Peripheral Role)
          Scannable Advertising State
            and Passive Scanning State
          Connectable Advertising State
            and Passive Scanning State
          Non-connectable Advertising State
            and Initiating State
          Scannable Advertising State
            and Initiating State
          Active Scanning State
            and Connection State (Central Role)
          Passive Scanning State
            and Connection State (Peripheral Role)
          Active Scanning State
            and Connection State (Peripheral Role)
          Initiating State
            and Connection State (Central Role)
            and Central Role & Central Role
          Low Duty Cycle Directed Advertising State
          Connectable Advertising State
            and Initiating State
            and Central Role & Peripheral Role
          High Duty Cycle Directed Advertising State
            and Initiating State
            and Central Role & Peripheral Role
          Low Duty Cycle Directed Advertising State
            and Initiating State
            and Central Role & Peripheral Role
          Connectable Advertising State
            and Connection State (Central Role)
            and Central Role & Peripheral Role
          High Duty Cycle Directed Advertising State
            and Connection State (Central Role)
            and Central Role & Peripheral Role
          Low Duty Cycle Directed Advertising State
            and Connection State (Central Role)
            and Central Role & Peripheral Role
          Connectable Advertising State
            and Connection State (Peripheral Role)
            and Central Role & Peripheral Role
          High Duty Cycle Directed Advertising State
            and Connection State (Peripheral Role)
            and Peripheral Role & Peripheral Role
          Low Duty Cycle Directed Advertising State
            and Connection State (Peripheral Role)
            and Peripheral Role & Peripheral Role
          Initiating State
            and Connection State (Peripheral Role)
            and Central Role & Peripheral Role
< HCI Command: LE Read Maximum Data.. (0x08|0x002f) plen 0  #23 [hci1] 1.001524
> HCI Event: Command Complete (0x0e) plen 12                #24 [hci1] 1.002085
      LE Read Maximum Data Length (0x08|0x002f) ncmd 1
        Status: Success (0x00)
        Max TX octets: 251
        Max TX time: 2704
        Max RX octets: 251
        Max RX time: 2704
< HCI Command: LE Write Suggested D.. (0x08|0x0024) plen 4  #25 [hci1] 1.021562
        TX octets: 251
        TX time: 2704
> HCI Event: Command Complete (0x0e) plen 4                 #26 [hci1] 1.022117
      LE Write Suggested Default Data Length (0x08|0x0024) ncmd 1
        Status: Success (0x00)
< HCI Command: LE Read Resolving Li.. (0x08|0x002a) plen 0  #27 [hci1] 1.041600
> HCI Event: Command Complete (0x0e) plen 5                 #28 [hci1] 1.042071
      LE Read Resolving List Size (0x08|0x002a) ncmd 1
        Status: Success (0x00)
        Size: 8
< HCI Command: LE Set Host Feature (0x08|0x0074) plen 2     #29 [hci1] 1.061603
        Bit Number: 38
          Connection Subrating (Host Support)
        Bit Value: 1
> HCI Event: Command Complete (0x0e) plen 4                 #30 [hci1] 1.062078
      LE Set Host Feature (0x08|0x0074) ncmd 1
        Status: Success (0x00)
< HCI Command: LE Set Event Mask (0x08|0x0001) plen 8       #31 [hci1] 1.081521
        Mask: 0x000002063f87fa5e
          LE Advertising Report
          LE Connection Update Complete
          LE Read Remote Used Features Complete
          LE Long Term Key Request
          LE Data Length Change
          LE Enhanced Connection Complete
          LE PHY Update Complete
          LE Extended Advertising Report
          LE Periodic Advertising Sync Established
          LE Periodic Advertising Report
          LE Periodic Advertising Sync Lost
          LE Extended Scan Timeout
          LE Extended Advertising Set Terminated
          LE Scan Request Received
          LE Periodic Advertising Sync Transfer Rvc
          LE CIS Established
          LE CIS Request
          LE Create BIG Complete
          LE Terminate BIG Complete
          LE BIG Sync Estabilished Complete
          LE BIG Sync Lost
          LE BIG Info Advertising Report
          LE Subrate Change
          Unknown mask (0x0000020000000000)
> HCI Event: Command Complete (0x0e) plen 4                 #32 [hci1] 1.082119
      LE Set Event Mask (0x08|0x0001) ncmd 1
        Status: Success (0x00)
< HCI Command: Set Event Mask (0x03|0x0001) plen 8          #33 [hci1] 1.101563
        Mask: 0x2000800002008890
          Disconnection Complete
          Encryption Change
          Read Remote Version Information Complete
          Hardware Error
          Data Buffer Overflow
          Encryption Key Refresh Complete
          LE Meta
> HCI Event: Command Complete (0x0e) plen 4                 #34 [hci1] 1.102154
      Set Event Mask (0x03|0x0001) ncmd 1
        Status: Success (0x00)
< HCI Command: Read BD ADDR (0x04|0x0009) plen 0            #35 [hci1] 1.121566
> HCI Event: Command Complete (0x0e) plen 10                #36 [hci1] 1.122148
      Read BD ADDR (0x04|0x0009) ncmd 1
        Status: Success (0x00)
        Address: 00:00:00:00:00:00 (OUI 00-00-00)
< HCI Command: LE Set Random Address (0x08|0x0005) plen 6   #37 [hci1] 1.141533
        Address: D5:B6:CC:31:DB:3B (Static)
> HCI Event: Command Complete (0x0e) plen 4                 #38 [hci1] 1.142118
      LE Set Random Address (0x08|0x0005) ncmd 1
        Status: Success (0x00)
< HCI Command: LE Set Extended Adv.. (0x08|0x0036) plen 25  #39 [hci1] 5.444534
        Handle: 0x00
        Properties: 0x0013
          Connectable
          Scannable
          Use legacy advertising PDUs: ADV_IND
        Min advertising interval: 100.000 msec (0x00a0)
        Max advertising interval: 150.000 msec (0x00f0)
        Channel map: 37, 38, 39 (0x07)
        Own address type: Random (0x01)
        Peer address type: Public (0x00)
        Peer address: 00:00:00:00:00:00 (OUI 00-00-00)
        Filter policy: Allow Scan Request from Any, Allow Connect Request from Any (0x00)
        TX power: Host has no preference (0x7f)
        Primary PHY: LE 1M (0x01)
        Secondary max skip: 0x00
        Secondary PHY: LE 1M (0x01)
        SID: 0x00
        Scan request notifications: Disabled (0x00)
> HCI Event: Command Complete (0x0e) plen 5                 #40 [hci1] 5.445355
      LE Set Extended Advertising Parameters (0x08|0x0036) ncmd 1
        Status: Success (0x00)
        TX power (selected): 0 dbm (0x00)
< HCI Command: LE Set Advertising S.. (0x08|0x0035) plen 7  #41 [hci1] 5.461900
        Advertising handle: 0x00
        Advertising random address: D5:B6:CC:31:DB:3B (Static)
> HCI Event: Command Complete (0x0e) plen 4                 #42 [hci1] 5.462885
      LE Set Advertising Set Random Address (0x08|0x0035) ncmd 1
        Status: Success (0x00)
< HCI Command: LE Set Extended Adv.. (0x08|0x0037) plen 22  #43 [hci1] 5.481501
        Handle: 0x00
        Operation: Complete extended advertising data (0x03)
        Fragment preference: Minimize fragmentation (0x01)
        Data length: 0x12
        Flags: 0x06
          LE General Discoverable Mode
          BR/EDR Not Supported
        Name (complete): Tester_F6B11A
> HCI Event: Command Complete (0x0e) plen 4                 #44 [hci1] 5.482325
      LE Set Extended Advertising Data (0x08|0x0037) ncmd 1
        Status: Success (0x00)
< HCI Command: LE Set Extended Scan.. (0x08|0x0038) plen 4  #45 [hci1] 5.501626
        Handle: 0x00
        Operation: Complete scan response data (0x03)
        Fragment preference: Minimize fragmentation (0x01)
        Data length: 0x00
> HCI Event: Command Complete (0x0e) plen 4                 #46 [hci1] 5.502190
      LE Set Extended Scan Response Data (0x08|0x0038) ncmd 1
        Status: Success (0x00)
< HCI Command: LE Set Extended Adve.. (0x08|0x0039) plen 6  #47 [hci1] 5.530640
        Extended advertising: Enabled (0x01)
        Number of sets: 1 (0x01)
        Entry 0
          Handle: 0x00
          Duration: 0 ms (0x00)
          Max ext adv events: 0
> HCI Event: Command Complete (0x0e) plen 4                 #48 [hci1] 5.531235
      LE Set Extended Advertising Enable (0x08|0x0039) ncmd 1
        Status: Success (0x00)
> HCI Event: LE Meta Event (0x3e) plen 31                   #49 [hci1] 5.860612
      LE Enhanced Connection Complete (0x0a)
        Status: Success (0x00)
        Handle: 2433
        Role: Peripheral (0x01)
        Peer address type: Public (0x00)
        Peer address: DF:A9:FF:F6:B1:1A (OUI DF-A9-FF)
        Local resolvable private address: 00:00:00:00:00:00 (Non-Resolvable)
        Peer resolvable private address: 00:00:00:00:00:00 (Non-Resolvable)
        Connection interval: 87.50 msec (0x0046)
        Connection latency: 0 (0x0000)
        Supervision timeout: 20000 msec (0x07d0)
        Central clock accuracy: 0x01
> HCI Event: LE Meta Event (0x3e) plen 6                    #50 [hci1] 5.860663
      LE Advertising Set Terminated (0x12)
        Status: Success (0x00)
        Handle: 0
        Connection handle: 2433
        Number of completed extended advertising events: 0
< HCI Command: LE Read Remote Used... (0x08|0x0016) plen 2  #51 [hci1] 5.861796
        Handle: 2433 Address: DF:A9:FF:F6:B1:1A (OUI DF-A9-FF)
> HCI Event: Command Status (0x0f) plen 4                   #52 [hci1] 5.862232
      LE Read Remote Used Features (0x08|0x0016) ncmd 1
        Status: Success (0x00)
> HCI Event: LE Meta Event (0x3e) plen 12                   #53 [hci1] 6.124623
      LE Read Remote Used Features (0x04)
        Status: Success (0x00)
        Handle: 2433 Address: DF:A9:FF:F6:B1:1A (OUI DF-A9-FF)
        Features: 0x2d 0x49 0x00 0xf7 0x67 0xd9 0x00 0x80
          LE Encryption
          Extended Reject Indication
          Peripheral-initiated Features Exchange
          LE Data Packet Length Extension
          LE 2M PHY
          LE Coded PHY
          Channel Selection Algorithm #2
          Periodic Advertising Sync Transfer - Sender
          Periodic Advertising Sync Transfer - Recipient
          Sleep Clock Accuracy Updates
          Connected Isochronous Stream - Central
          Connected Isochronous Stream - Peripheral
          Isochronous Broadcaster
          Synchronized Receiver
          Connected Isochronous Stream (Host Support)
          LE Power Control Request
          LE Power Control Request
          Connection Subrating
          Connection Subrating (Host Support)
          Unknown features (0x8000d90000000000)
< ACL Data TX: Handle 2433 flags 0x00 dlen 16              #54 [hci1] 10.871978
      LE L2CAP: Connection Parameter Update Request (0x12) ident 1 len 8
        Min interval: 24
        Max interval: 40
        Peripheral latency: 0
        Timeout multiplier: 42
> HCI Event: Number of Completed Packets (0x13) plen 5     #55 [hci1] 11.024045
        Num handles: 1
        Handle: 2433 Address: DF:A9:FF:F6:B1:1A (OUI DF-A9-FF)
        Count: 1
        #54: len 16 (0 Kb/s)
        Latency: 152 msec (152-152 msec ~152 msec)
> ACL Data RX: Handle 2433 flags 0x02 dlen 10              #56 [hci1] 11.024311
      LE L2CAP: Connection Parameter Update Response (0x13) ident 1 len 2
        Result: Connection Parameters accepted (0x0000)
< HCI Command: Host Number of Comp.. (0x03|0x0035) plen 5  #57 [hci1] 11.041994
        Num handles: 1
        Handle: 2433 Address: DF:A9:FF:F6:B1:1A (OUI DF-A9-FF)
        Count: 1
> ACL Data RX: Handle 2433 flags 0x02 dlen 11              #58 [hci1] 13.561625
      SMP: Pairing Request (0x01) len 6
        IO capability: KeyboardDisplay (0x04)
        OOB data: Authentication data not present (0x00)
        Authentication requirement: Bonding, No MITM, SC, No Keypresses (0x09)
        Max encryption key size: 16
        Initiator key distribution: EncKey IdKey Sign (0x07)
        Responder key distribution: EncKey IdKey Sign (0x07)
< HCI Command: Host Number of Comp.. (0x03|0x0035) plen 5  #59 [hci1] 13.562304
        Num handles: 1
        Handle: 2433 Address: DF:A9:FF:F6:B1:1A (OUI DF-A9-FF)
        Count: 1
< ACL Data TX: Handle 2433 flags 0x00 dlen 11              #60 [hci1] 13.562379
      SMP: Pairing Response (0x02) len 6
        IO capability: NoInputNoOutput (0x03)
        OOB data: Authentication data not present (0x00)
        Authentication requirement: Bonding, No MITM, SC, No Keypresses (0x09)
        Max encryption key size: 16
        Initiator key distribution: IdKey (0x02)
        Responder key distribution: <none> (0x00)
> HCI Event: Number of Completed Packets (0x13) plen 5     #61 [hci1] 13.736687
        Num handles: 1
        Handle: 2433 Address: DF:A9:FF:F6:B1:1A (OUI DF-A9-FF)
        Count: 1
        #60: len 11 (0 Kb/s)
        Latency: 174 msec (152-174 msec ~163 msec)
> ACL Data RX: Handle 2433 flags 0x02 dlen 27              #62 [hci1] 13.736985
> ACL Data RX: Handle 2433 flags 0x01 dlen 27              #63 [hci1] 13.737592
> ACL Data RX: Handle 2433 flags 0x01 dlen 15              #64 [hci1] 13.738038
      SMP: Pairing Public Key (0x0c) len 64
        X: 5feefd608c84ebe3074d9771c31c116194814452c74af339c9b49f06d0bc6af8
        Y: b5991cec2a530c9c943beb8a24ce3536ebd33dfcabaefbd6342e55df70632f52
< HCI Command: Host Number of Comp.. (0x03|0x0035) plen 5  #65 [hci1] 13.742544
        Num handles: 1
        Handle: 2433 Address: DF:A9:FF:F6:B1:1A (OUI DF-A9-FF)
        Count: 1
< HCI Command: Host Number of Comp.. (0x03|0x0035) plen 5  #66 [hci1] 13.742739
        Num handles: 1
        Handle: 2433 Address: DF:A9:FF:F6:B1:1A (OUI DF-A9-FF)
        Count: 1
< HCI Command: Host Number of Comp.. (0x03|0x0035) plen 5  #67 [hci1] 13.743031
        Num handles: 1
        Handle: 2433 Address: DF:A9:FF:F6:B1:1A (OUI DF-A9-FF)
        Count: 1
< ACL Data TX: Handle 2433 flags 0x00 dlen 27              #68 [hci1] 13.743075
< ACL Data TX: Handle 2433 flags 0x01 dlen 27              #69 [hci1] 13.743147
< ACL Data TX: Handle 2433 flags 0x01 dlen 15              #70 [hci1] 13.743174
      SMP: Pairing Public Key (0x0c) len 64
        X: 98308440221e2d910f0e54b71e7ec652857aa9b5a0dc65028824cc19db1226e9
        Y: 67a4816bcb62efb21701e31fdb27561a6217575fb007a8bbdabe7e28b6f68482
> HCI Event: Number of Completed Packets (0x13) plen 5     #71 [hci1] 13.824616
        Num handles: 1
        Handle: 2433 Address: DF:A9:FF:F6:B1:1A (OUI DF-A9-FF)
        Count: 1
        #68: len 27 (2 Kb/s)
        Latency: 81 msec (81-174 msec ~122 msec)
> HCI Event: Number of Completed Packets (0x13) plen 5     #72 [hci1] 13.825253
        Num handles: 1
        Handle: 2433 Address: DF:A9:FF:F6:B1:1A (OUI DF-A9-FF)
        Count: 1
        #69: len 27 (2 Kb/s)
        Latency: 82 msec (81-174 msec ~102 msec)
< ACL Data TX: Handle 2433 flags 0x00 dlen 21              #73 [hci1] 13.841827
      SMP: Pairing Confirm (0x03) len 16
        Confim value: 48236844f42abb9c68497a1ed1209dc3
> HCI Event: Number of Completed Packets (0x13) plen 5     #74 [hci1] 13.911636
        Num handles: 1
        Handle: 2433 Address: DF:A9:FF:F6:B1:1A (OUI DF-A9-FF)
        Count: 1
        #70: len 15 (0 Kb/s)
        Latency: 168 msec (81-174 msec ~135 msec)
> HCI Event: Number of Completed Packets (0x13) plen 5     #75 [hci1] 13.999129
        Num handles: 1
        Handle: 2433 Address: DF:A9:FF:F6:B1:1A (OUI DF-A9-FF)
        Count: 1
        #73: len 21 (1 Kb/s)
        Latency: 157 msec (81-174 msec ~146 msec)
> ACL Data RX: Handle 2433 flags 0x02 dlen 21              #76 [hci1] 13.999572
      SMP: Pairing Random (0x04) len 16
        Random value: 46bca360de9a5a570000000000000000
< HCI Command: Host Number of Comp.. (0x03|0x0035) plen 5  #77 [hci1] 14.002379
        Num handles: 1
        Handle: 2433 Address: DF:A9:FF:F6:B1:1A (OUI DF-A9-FF)
        Count: 1
< ACL Data TX: Handle 2433 flags 0x00 dlen 21              #78 [hci1] 14.002465
      SMP: Pairing Random (0x04) len 16
        Random value: 8e6108f966a694cbe26df70bb96773e6
> HCI Event: Number of Completed Packets (0x13) plen 5     #79 [hci1] 14.173865
        Num handles: 1
        Handle: 2433 Address: DF:A9:FF:F6:B1:1A (OUI DF-A9-FF)
        Count: 1
        #78: len 21 (0 Kb/s)
        Latency: 171 msec (81-174 msec ~158 msec)
> ACL Data RX: Handle 2433 flags 0x02 dlen 21              #80 [hci1] 14.261706
      SMP: Pairing DHKey Check (0x0d) len 16
        E: d1d66e2609243e0ec471e0bda09f94a7
< HCI Command: Host Number of Comp.. (0x03|0x0035) plen 5  #81 [hci1] 14.282062
        Num handles: 1
        Handle: 2433 Address: DF:A9:FF:F6:B1:1A (OUI DF-A9-FF)
        Count: 1
< ACL Data TX: Handle 2433 flags 0x00 dlen 21              #82 [hci1] 14.282108
      SMP: Pairing DHKey Check (0x0d) len 16
        E: 3d12c25ab9c3f674d232a8f37f91e8e1
> HCI Event: Number of Completed Packets (0x13) plen 5     #83 [hci1] 14.436572
        Num handles: 1
        Handle: 2433 Address: DF:A9:FF:F6:B1:1A (OUI DF-A9-FF)
        Count: 1
        #82: len 21 (1 Kb/s)
        Latency: 154 msec (81-174 msec ~156 msec)
> HCI Event: LE Meta Event (0x3e) plen 13                  #84 [hci1] 14.524606
      LE Long Term Key Request (0x05)
        Handle: 2433 Address: DF:A9:FF:F6:B1:1A (OUI DF-A9-FF)
        Random number: 0x0000000000000000
        Encrypted diversifier: 0x0000
< HCI Command: LE Long Term Key R.. (0x08|0x001a) plen 18  #85 [hci1] 14.542063
        Handle: 2433 Address: DF:A9:FF:F6:B1:1A (OUI DF-A9-FF)
        Long term key: e2b63d2b1fef92da292e18e68bfd6c67
> HCI Event: Command Complete (0x0e) plen 6                #86 [hci1] 14.542844
      LE Long Term Key Request Reply (0x08|0x001a) ncmd 1
        Status: Success (0x00)
        Handle: 2433 Address: DF:A9:FF:F6:B1:1A (OUI DF-A9-FF)
> HCI Event: Encryption Change (0x08) plen 4               #87 [hci1] 14.961686
        Status: Success (0x00)
        Handle: 2433 Address: DF:A9:FF:F6:B1:1A (OUI DF-A9-FF)
        Encryption: Enabled with AES-CCM (0x01)
> ACL Data RX: Handle 2433 flags 0x02 dlen 21              #88 [hci1] 15.049364
      SMP: Identity Information (0x08) len 16
        Identity resolving key: 43636ff49982ed263e1bc301d618c261
< HCI Command: Host Number of Comp.. (0x03|0x0035) plen 5  #89 [hci1] 15.092358
        Num handles: 1
        Handle: 2433 Address: DF:A9:FF:F6:B1:1A (OUI DF-A9-FF)
        Count: 1
> ACL Data RX: Handle 2433 flags 0x02 dlen 12              #90 [hci1] 15.136732
      SMP: Identity Address Information (0x09) len 7
        Address: DF:A9:FF:F6:B1:1A (OUI DF-A9-FF)
> ACL Data RX: Handle 2433 flags 0x02 dlen 26              #91 [hci1] 15.137478
      LE L2CAP: Enhanced Credit Connection Request (0x17) ident 1 len 18
        PSM: 39 (0x0027)
        MTU: 64
        MPS: 64
        Credits: 5
        Source CID: 84
        Source CID: 83
        Source CID: 82
        Source CID: 81
        Source CID: 80
< HCI Command: LE Add Device To R.. (0x08|0x0027) plen 39  #92 [hci1] 15.142197
        Address type: Public (0x00)
        Address: DF:A9:FF:F6:B1:1A (OUI DF-A9-FF)
        Peer identity resolving key: 43636ff49982ed263e1bc301d618c261
        Local identity resolving key: 00000000000000000000000000000000
> HCI Event: Command Complete (0x0e) plen 4                #93 [hci1] 15.143159
      LE Add Device To Resolving List (0x08|0x0027) ncmd 1
        Status: Success (0x00)
< HCI Command: LE Set Privacy Mode (0x08|0x004e) plen 8    #94 [hci1] 15.162172
        Peer Identity address type: Public (0x00)
        Peer Identity address: DF:A9:FF:F6:B1:1A (OUI DF-A9-FF)
        Privacy Mode: Use Device Privacy (0x01)
> HCI Event: Command Complete (0x0e) plen 4                #95 [hci1] 15.162790
      LE Set Privacy Mode (0x08|0x004e) ncmd 1
        Status: Success (0x00)
< HCI Command: LE Set Address Reso.. (0x08|0x002d) plen 1  #96 [hci1] 15.182058
        Address resolution: Enabled (0x01)
> HCI Event: Command Complete (0x0e) plen 4                #97 [hci1] 15.182627
      LE Set Address Resolution Enable (0x08|0x002d) ncmd 1
        Status: Success (0x00)
< HCI Command: Host Number of Comp.. (0x03|0x0035) plen 5  #98 [hci1] 15.201999
        Num handles: 1
        Handle: 2433 Address: DF:A9:FF:F6:B1:1A (OUI DF-A9-FF)
        Count: 1
< HCI Command: Host Number of Comp.. (0x03|0x0035) plen 5  #99 [hci1] 15.202413
        Num handles: 1
        Handle: 2433 Address: DF:A9:FF:F6:B1:1A (OUI DF-A9-FF)
        Count: 1
< ACL Data TX: Handle 2433 flags 0x00 dlen 26             #100 [hci1] 15.202505
      LE L2CAP: Enhanced Credit Connection Response (0x18) ident 1 len 18
        MTU: 249
        MPS: 251
        Credits: 1
        Result: Connection successful (0x0000)
        Destination CID: 64
        Destination CID: 65
        Destination CID: 66
        Destination CID: 67
        Destination CID: 68
> HCI Event: Number of Completed Packets (0x13) plen 5    #101 [hci1] 15.311476
        Num handles: 1
        Handle: 2433 Address: DF:A9:FF:F6:B1:1A (OUI DF-A9-FF)
        Count: 1
        #100: len 26 (1 Kb/s)
        Latency: 108 msec (81-174 msec ~132 msec)
< ACL Data TX: Handle 2433 flags 0x00 dlen 13             #102 [hci1] 17.982147
      Channel: 80 len 9 sdu 7 [PSM 39 mode Enhanced Credit (0x81)] {chan 4}
      ATT: Read By Type Request (0x08) len 6
        Handle range: 0x0001-0xffff
        Attribute type: Include (0x2802)
> HCI Event: Number of Completed Packets (0x13) plen 5    #103 [hci1] 18.111543
        Num handles: 1
        Handle: 2433 Address: DF:A9:FF:F6:B1:1A (OUI DF-A9-FF)
        Count: 1
        #102: len 13 (0 Kb/s)
        Latency: 129 msec (81-174 msec ~131 msec)
        Channel: 80 [PSM 39 mode Enhanced Credit (0x81)] {chan 4}
        Channel Latency: 129 msec (129-129 msec ~129 msec)
> ACL Data RX: Handle 2433 flags 0x02 dlen 11             #104 [hci1] 18.111807
      Channel: 68 len 7 sdu 5 [PSM 39 mode Enhanced Credit (0x81)] {chan 4}
      ATT: Error Response (0x01) len 4
        Read By Type Request (0x08)
        Handle: 0x0001
        Error: Attribute Not Found (0x0a)
< HCI Command: Host Number of Com.. (0x03|0x0035) plen 5  #105 [hci1] 18.122001
        Num handles: 1
        Handle: 2433 Address: DF:A9:FF:F6:B1:1A (OUI DF-A9-FF)
        Count: 1
< ACL Data TX: Handle 2433 flags 0x00 dlen 12             #106 [hci1] 18.122088
      LE L2CAP: LE Flow Control Credit (0x16) ident 2 len 4
        Source CID: 68
        Credits: 1
> HCI Event: Number of Completed Packets (0x13) plen 5    #107 [hci1] 18.286423
        Num handles: 1
        Handle: 2433 Address: DF:A9:FF:F6:B1:1A (OUI DF-A9-FF)
        Count: 1
        #106: len 12 (0 Kb/s)
        Latency: 164 msec (81-174 msec ~147 msec)
        Channel: 80 [PSM 39 mode Enhanced Credit (0x81)] {chan 4}
        Channel Latency: 164 msec (129-164 msec ~146 msec)
> HCI Event: Disconnect Complete (0x05) plen 4            #108 [hci1] 20.561667
        Status: Success (0x00)
        Handle: 2433 Address: DF:A9:FF:F6:B1:1A (OUI DF-A9-FF)
        Reason: Remote User Terminated Connection (0x13)
< HCI Command: LE Set Extended A.. (0x08|0x0036) plen 25  #109 [hci1] 21.182068
        Handle: 0x00
        Properties: 0x0013
          Connectable
          Scannable
          Use legacy advertising PDUs: ADV_IND
        Min advertising interval: 100.000 msec (0x00a0)
        Max advertising interval: 150.000 msec (0x00f0)
        Channel map: 37, 38, 39 (0x07)
        Own address type: Random (0x01)
        Peer address type: Public (0x00)
        Peer address: 00:00:00:00:00:00 (OUI 00-00-00)
        Filter policy: Allow Scan Request from Any, Allow Connect Request from Any (0x00)
        TX power: Host has no preference (0x7f)
        Primary PHY: LE 1M (0x01)
        Secondary max skip: 0x00
        Secondary PHY: LE 1M (0x01)
        SID: 0x00
        Scan request notifications: Disabled (0x00)
> HCI Event: Command Complete (0x0e) plen 5               #110 [hci1] 21.182870
      LE Set Extended Advertising Parameters (0x08|0x0036) ncmd 1
        Status: Success (0x00)
        TX power (selected): 0 dbm (0x00)
< HCI Command: LE Set Advertising.. (0x08|0x0035) plen 7  #111 [hci1] 21.201829
        Advertising handle: 0x00
        Advertising random address: D5:B6:CC:31:DB:3B (Static)
> HCI Event: Command Complete (0x0e) plen 4               #112 [hci1] 21.202464
      LE Set Advertising Set Random Address (0x08|0x0035) ncmd 1
        Status: Success (0x00)
< HCI Command: LE Set Extended A.. (0x08|0x0037) plen 22  #113 [hci1] 21.221853
        Handle: 0x00
        Operation: Complete extended advertising data (0x03)
        Fragment preference: Minimize fragmentation (0x01)
        Data length: 0x12
        Flags: 0x06
          LE General Discoverable Mode
          BR/EDR Not Supported
        Name (complete): Tester_F6B11A
> HCI Event: Command Complete (0x0e) plen 4               #114 [hci1] 21.222644
      LE Set Extended Advertising Data (0x08|0x0037) ncmd 1
        Status: Success (0x00)
< HCI Command: LE Set Extended Sc.. (0x08|0x0038) plen 4  #115 [hci1] 21.241842
        Handle: 0x00
        Operation: Complete scan response data (0x03)
        Fragment preference: Minimize fragmentation (0x01)
        Data length: 0x00
> HCI Event: Command Complete (0x0e) plen 4               #116 [hci1] 21.242439
      LE Set Extended Scan Response Data (0x08|0x0038) ncmd 1
        Status: Success (0x00)
< HCI Command: LE Set Extended Ad.. (0x08|0x0039) plen 6  #117 [hci1] 21.261852
        Extended advertising: Enabled (0x01)
        Number of sets: 1 (0x01)
        Entry 0
          Handle: 0x00
          Duration: 0 ms (0x00)
          Max ext adv events: 0
> HCI Event: Command Complete (0x0e) plen 4               #118 [hci1] 21.262566
      LE Set Extended Advertising Enable (0x08|0x0039) ncmd 1
        Status: Success (0x00)
> HCI Event: LE Meta Event (0x3e) plen 31                 #119 [hci1] 22.000568
      LE Enhanced Connection Complete (0x0a)
        Status: Success (0x00)
        Handle: 2451
        Role: Peripheral (0x01)
        Peer address type: Public (0x00)
        Peer address: DF:A9:FF:F6:B1:1A (OUI DF-A9-FF)
        Local resolvable private address: 00:00:00:00:00:00 (Non-Resolvable)
        Peer resolvable private address: 00:00:00:00:00:00 (Non-Resolvable)
        Connection interval: 87.50 msec (0x0046)
        Connection latency: 0 (0x0000)
        Supervision timeout: 20000 msec (0x07d0)
        Central clock accuracy: 0x01
> HCI Event: LE Meta Event (0x3e) plen 6                  #120 [hci1] 22.000690
      LE Advertising Set Terminated (0x12)
        Status: Success (0x00)
        Handle: 0
        Connection handle: 2451
        Number of completed extended advertising events: 0
< HCI Command: LE Read Remote Use.. (0x08|0x0016) plen 2  #121 [hci1] 22.002650
        Handle: 2451 Address: DF:A9:FF:F6:B1:1A (OUI DF-A9-FF)
> HCI Event: Command Status (0x0f) plen 4                 #122 [hci1] 22.003210
      LE Read Remote Used Features (0x08|0x0016) ncmd 1
        Status: Success (0x00)
> HCI Event: LE Meta Event (0x3e) plen 12                 #123 [hci1] 22.264432
      LE Read Remote Used Features (0x04)
        Status: Success (0x00)
        Handle: 2451 Address: DF:A9:FF:F6:B1:1A (OUI DF-A9-FF)
        Features: 0x2d 0x49 0x00 0xf7 0x67 0xd9 0x00 0x80
          LE Encryption
          Extended Reject Indication
          Peripheral-initiated Features Exchange
          LE Data Packet Length Extension
          LE 2M PHY
          LE Coded PHY
          Channel Selection Algorithm #2
          Periodic Advertising Sync Transfer - Sender
          Periodic Advertising Sync Transfer - Recipient
          Sleep Clock Accuracy Updates
          Connected Isochronous Stream - Central
          Connected Isochronous Stream - Peripheral
          Isochronous Broadcaster
          Synchronized Receiver
          Connected Isochronous Stream (Host Support)
          LE Power Control Request
          LE Power Control Request
          Connection Subrating
          Connection Subrating (Host Support)
          Unknown features (0x8000d90000000000)
< ACL Data TX: Handle 2451 flags 0x00 dlen 16             #124 [hci1] 27.012190
      LE L2CAP: Connection Parameter Update Request (0x12) ident 3 len 8
        Min interval: 24
        Max interval: 40
        Peripheral latency: 0
        Timeout multiplier: 42
> HCI Event: Number of Completed Packets (0x13) plen 5    #125 [hci1] 27.164103
        Num handles: 1
        Handle: 2451 Address: DF:A9:FF:F6:B1:1A (OUI DF-A9-FF)
        Count: 1
        #124: len 16 (0 Kb/s)
        Latency: 151 msec (151-151 msec ~151 msec)
> ACL Data RX: Handle 2451 flags 0x02 dlen 10             #126 [hci1] 27.164225
      LE L2CAP: Connection Parameter Update Response (0x13) ident 3 len 2
        Result: Connection Parameters accepted (0x0000)
< HCI Command: Host Number of Com.. (0x03|0x0035) plen 5  #127 [hci1] 27.182681
        Num handles: 1
        Handle: 2451 Address: DF:A9:FF:F6:B1:1A (OUI DF-A9-FF)
        Count: 1
> HCI Event: LE Meta Event (0x3e) plen 13                 #128 [hci1] 30.051974
      LE Long Term Key Request (0x05)
        Handle: 2451 Address: DF:A9:FF:F6:B1:1A (OUI DF-A9-FF)
        Random number: 0x0000000000000000
        Encrypted diversifier: 0x0000
< HCI Command: LE Long Term Key... (0x08|0x001a) plen 18  #129 [hci1] 30.062275
        Handle: 2451 Address: DF:A9:FF:F6:B1:1A (OUI DF-A9-FF)
        Long term key: e2b63d2b1fef92da292e18e68bfd6c67
> HCI Event: Command Complete (0x0e) plen 6               #130 [hci1] 30.063014
      LE Long Term Key Request Reply (0x08|0x001a) ncmd 1
        Status: Success (0x00)
        Handle: 2451 Address: DF:A9:FF:F6:B1:1A (OUI DF-A9-FF)
> HCI Event: Encryption Change (0x08) plen 4              #131 [hci1] 30.489236
        Status: Success (0x00)
        Handle: 2451 Address: DF:A9:FF:F6:B1:1A (OUI DF-A9-FF)
        Encryption: Enabled with AES-CCM (0x01)
> ACL Data RX: Handle 2451 flags 0x02 dlen 26             #132 [hci1] 30.576824
      LE L2CAP: Enhanced Credit Connection Request (0x17) ident 2 len 18
        PSM: 39 (0x0027)
        MTU: 64
        MPS: 64
        Credits: 5
        Source CID: 84
        Source CID: 83
        Source CID: 82
        Source CID: 81
        Source CID: 80
< HCI Command: Host Number of Com.. (0x03|0x0035) plen 5  #133 [hci1] 30.582400
        Num handles: 1
        Handle: 2451 Address: DF:A9:FF:F6:B1:1A (OUI DF-A9-FF)
        Count: 1
< ACL Data TX: Handle 2451 flags 0x00 dlen 26             #134 [hci1] 30.582509
      LE L2CAP: Enhanced Credit Connection Response (0x18) ident 2 len 18
        MTU: 249
        MPS: 251
        Credits: 1
        Result: Connection successful (0x0000)
        Destination CID: 64
        Destination CID: 65
        Destination CID: 66
        Destination CID: 67
        Destination CID: 68
> HCI Event: Number of Completed Packets (0x13) plen 5    #135 [hci1] 30.751373
        Num handles: 1
        Handle: 2451 Address: DF:A9:FF:F6:B1:1A (OUI DF-A9-FF)
        Count: 1
        #134: len 26 (1 Kb/s)
        Latency: 168 msec (151-168 msec ~160 msec)
< ACL Data TX: Handle 2451 flags 0x00 dlen 13             #136 [hci1] 33.062819
      Channel: 80 len 9 sdu 7 [PSM 39 mode Enhanced Credit (0x81)] {chan 9}
      ATT: Read By Type Request (0x08) len 6
        Handle range: 0x0001-0xffff
        Attribute type: Include (0x2802)
> HCI Event: Number of Completed Packets (0x13) plen 5    #137 [hci1] 33.201635
        Num handles: 1
        Handle: 2451 Address: DF:A9:FF:F6:B1:1A (OUI DF-A9-FF)
        Count: 1
        #136: len 13 (0 Kb/s)
        Latency: 138 msec (138-168 msec ~149 msec)
        Channel: 80 [PSM 39 mode Enhanced Credit (0x81)] {chan 9}
        Channel Latency: 138 msec (138-138 msec ~138 msec)
> ACL Data RX: Handle 2451 flags 0x02 dlen 27             #138 [hci1] 33.201972
> ACL Data RX: Handle 2451 flags 0x01 dlen 5              #139 [hci1] 33.202065
      Channel: 68 len 28 sdu 26 [PSM 39 mode Enhanced Credit (0x81)] {chan 9}
      ATT: Read By Type Response (0x09) len 25
        Attribute data length: 8
        Attribute data list: 3 entries
        Handle: 0x0002
        Value: 000105010ba0
        Handle: 0x0041
        Value: 010006000da0
        Handle: 0x0121
        Value: 010006000da0
< HCI Command: Host Number of Com.. (0x03|0x0035) plen 5  #140 [hci1] 33.222025
        Num handles: 1
        Handle: 2451 Address: DF:A9:FF:F6:B1:1A (OUI DF-A9-FF)
        Count: 1
< HCI Command: Host Number of Com.. (0x03|0x0035) plen 5  #141 [hci1] 33.222096
        Num handles: 1
        Handle: 2451 Address: DF:A9:FF:F6:B1:1A (OUI DF-A9-FF)
        Count: 1
< ACL Data TX: Handle 2451 flags 0x00 dlen 13             #142 [hci1] 33.222141
      Channel: 80 len 9 sdu 7 [PSM 39 mode Enhanced Credit (0x81)] {chan 9}
      ATT: Read By Type Request (0x08) len 6
        Handle range: 0x0122-0xffff
        Attribute type: Include (0x2802)
< ACL Data TX: Handle 2451 flags 0x00 dlen 12             #143 [hci1] 33.222169
      LE L2CAP: LE Flow Control Credit (0x16) ident 4 len 4
        Source CID: 68
        Credits: 1
> HCI Event: Number of Completed Packets (0x13) plen 5    #144 [hci1] 33.289529
        Num handles: 1
        Handle: 2451 Address: DF:A9:FF:F6:B1:1A (OUI DF-A9-FF)
        Count: 1
        #142: len 13 (1 Kb/s)
        Latency: 67 msec (67-168 msec ~108 msec)
        Channel: 80 [PSM 39 mode Enhanced Credit (0x81)] {chan 9}
        Channel Latency: 67 msec (67-138 msec ~103 msec)
> HCI Event: Number of Completed Packets (0x13) plen 5    #145 [hci1] 33.376350
        Num handles: 1
        Handle: 2451 Address: DF:A9:FF:F6:B1:1A (OUI DF-A9-FF)
        Count: 1
        #143: len 12 (0 Kb/s)
        Latency: 154 msec (67-168 msec ~131 msec)
        Channel: 80 [PSM 39 mode Enhanced Credit (0x81)] {chan 9}
        Channel Latency: 154 msec (67-154 msec ~128 msec)
> ACL Data RX: Handle 2451 flags 0x02 dlen 11             #146 [hci1] 33.464113
      Channel: 68 len 7 sdu 5 [PSM 39 mode Enhanced Credit (0x81)] {chan 9}
      ATT: Error Response (0x01) len 4
        Read By Type Request (0x08)
        Handle: 0x0122
        Error: Attribute Not Found (0x0a)
< HCI Command: Host Number of Com.. (0x03|0x0035) plen 5  #147 [hci1] 33.482136
        Num handles: 1
        Handle: 2451 Address: DF:A9:FF:F6:B1:1A (OUI DF-A9-FF)
        Count: 1
< ACL Data TX: Handle 2451 flags 0x00 dlen 12             #148 [hci1] 33.482162
      LE L2CAP: LE Flow Control Credit (0x16) ident 5 len 4
        Source CID: 68
        Credits: 1
> HCI Event: Number of Completed Packets (0x13) plen 5    #149 [hci1] 33.638794
        Num handles: 1
        Handle: 2451 Address: DF:A9:FF:F6:B1:1A (OUI DF-A9-FF)
        Count: 1
        #148: len 12 (0 Kb/s)
        Latency: 156 msec (67-168 msec ~143 msec)
        Channel: 80 [PSM 39 mode Enhanced Credit (0x81)] {chan 9}
        Channel Latency: 156 msec (67-156 msec ~142 msec)
> HCI Event: Disconnect Complete (0x05) plen 4            #150 [hci1] 36.001683
        Status: Success (0x00)
        Handle: 2451 Address: DF:A9:FF:F6:B1:1A (OUI DF-A9-FF)
        Reason: Remote User Terminated Connection (0x13)
< HCI Command: LE Set Extended A.. (0x08|0x0036) plen 25  #151 [hci1] 36.542192
        Handle: 0x00
        Properties: 0x0013
          Connectable
          Scannable
          Use legacy advertising PDUs: ADV_IND
        Min advertising interval: 100.000 msec (0x00a0)
        Max advertising interval: 150.000 msec (0x00f0)
        Channel map: 37, 38, 39 (0x07)
        Own address type: Random (0x01)
        Peer address type: Public (0x00)
        Peer address: 00:00:00:00:00:00 (OUI 00-00-00)
        Filter policy: Allow Scan Request from Any, Allow Connect Request from Any (0x00)
        TX power: Host has no preference (0x7f)
        Primary PHY: LE 1M (0x01)
        Secondary max skip: 0x00
        Secondary PHY: LE 1M (0x01)
        SID: 0x00
        Scan request notifications: Disabled (0x00)
> HCI Event: Command Complete (0x0e) plen 5               #152 [hci1] 36.542955
      LE Set Extended Advertising Parameters (0x08|0x0036) ncmd 1
        Status: Success (0x00)
        TX power (selected): 0 dbm (0x00)
< HCI Command: LE Set Advertising.. (0x08|0x0035) plen 7  #153 [hci1] 36.562023
        Advertising handle: 0x00
        Advertising random address: D5:B6:CC:31:DB:3B (Static)
> HCI Event: Command Complete (0x0e) plen 4               #154 [hci1] 36.562506
      LE Set Advertising Set Random Address (0x08|0x0035) ncmd 1
        Status: Success (0x00)
< HCI Command: LE Set Extended A.. (0x08|0x0037) plen 22  #155 [hci1] 36.582061
        Handle: 0x00
        Operation: Complete extended advertising data (0x03)
        Fragment preference: Minimize fragmentation (0x01)
        Data length: 0x12
        Flags: 0x06
          LE General Discoverable Mode
          BR/EDR Not Supported
        Name (complete): Tester_F6B11A
> HCI Event: Command Complete (0x0e) plen 4               #156 [hci1] 36.582903
      LE Set Extended Advertising Data (0x08|0x0037) ncmd 1
        Status: Success (0x00)
< HCI Command: LE Set Extended Sc.. (0x08|0x0038) plen 4  #157 [hci1] 36.602053
        Handle: 0x00
        Operation: Complete scan response data (0x03)
        Fragment preference: Minimize fragmentation (0x01)
        Data length: 0x00
> HCI Event: Command Complete (0x0e) plen 4               #158 [hci1] 36.602605
      LE Set Extended Scan Response Data (0x08|0x0038) ncmd 1
        Status: Success (0x00)
< HCI Command: LE Set Extended Ad.. (0x08|0x0039) plen 6  #159 [hci1] 36.622048
        Extended advertising: Enabled (0x01)
        Number of sets: 1 (0x01)
        Entry 0
          Handle: 0x00
          Duration: 0 ms (0x00)
          Max ext adv events: 0
> HCI Event: Command Complete (0x0e) plen 4               #160 [hci1] 36.622790
      LE Set Extended Advertising Enable (0x08|0x0039) ncmd 1
        Status: Success (0x00)
> HCI Event: LE Meta Event (0x3e) plen 31                 #161 [hci1] 37.059412
      LE Enhanced Connection Complete (0x0a)
        Status: Success (0x00)
        Handle: 2469
        Role: Peripheral (0x01)
        Peer address type: Public (0x00)
        Peer address: DF:A9:FF:F6:B1:1A (OUI DF-A9-FF)
        Local resolvable private address: 00:00:00:00:00:00 (Non-Resolvable)
        Peer resolvable private address: 00:00:00:00:00:00 (Non-Resolvable)
        Connection interval: 87.50 msec (0x0046)
        Connection latency: 0 (0x0000)
        Supervision timeout: 20000 msec (0x07d0)
        Central clock accuracy: 0x01
> HCI Event: LE Meta Event (0x3e) plen 6                  #162 [hci1] 37.059415
      LE Advertising Set Terminated (0x12)
        Status: Success (0x00)
        Handle: 0
        Connection handle: 2469
        Number of completed extended advertising events: 0
< HCI Command: LE Read Remote Use.. (0x08|0x0016) plen 2  #163 [hci1] 37.062230
        Handle: 2469 Address: DF:A9:FF:F6:B1:1A (OUI DF-A9-FF)
> HCI Event: Command Status (0x0f) plen 4                 #164 [hci1] 37.062683
      LE Read Remote Used Features (0x08|0x0016) ncmd 1
        Status: Success (0x00)
> HCI Event: LE Meta Event (0x3e) plen 12                 #165 [hci1] 37.323186
      LE Read Remote Used Features (0x04)
        Status: Success (0x00)
        Handle: 2469 Address: DF:A9:FF:F6:B1:1A (OUI DF-A9-FF)
        Features: 0x2d 0x49 0x00 0xf7 0x67 0xd9 0x00 0x80
          LE Encryption
          Extended Reject Indication
          Peripheral-initiated Features Exchange
          LE Data Packet Length Extension
          LE 2M PHY
          LE Coded PHY
          Channel Selection Algorithm #2
          Periodic Advertising Sync Transfer - Sender
          Periodic Advertising Sync Transfer - Recipient
          Sleep Clock Accuracy Updates
          Connected Isochronous Stream - Central
          Connected Isochronous Stream - Peripheral
          Isochronous Broadcaster
          Synchronized Receiver
          Connected Isochronous Stream (Host Support)
          LE Power Control Request
          LE Power Control Request
          Connection Subrating
          Connection Subrating (Host Support)
          Unknown features (0x8000d90000000000)
< ACL Data TX: Handle 2469 flags 0x00 dlen 16             #166 [hci1] 42.072347
      LE L2CAP: Connection Parameter Update Request (0x12) ident 6 len 8
        Min interval: 24
        Max interval: 40
        Peripheral latency: 0
        Timeout multiplier: 42
> HCI Event: Number of Completed Packets (0x13) plen 5    #167 [hci1] 42.222782
        Num handles: 1
        Handle: 2469 Address: DF:A9:FF:F6:B1:1A (OUI DF-A9-FF)
        Count: 1
        #166: len 16 (0 Kb/s)
        Latency: 150 msec (150-150 msec ~150 msec)
> ACL Data RX: Handle 2469 flags 0x02 dlen 10             #168 [hci1] 42.223018
      LE L2CAP: Connection Parameter Update Response (0x13) ident 6 len 2
        Result: Connection Parameters accepted (0x0000)
< HCI Command: Host Number of Com.. (0x03|0x0035) plen 5  #169 [hci1] 42.242332
        Num handles: 1
        Handle: 2469 Address: DF:A9:FF:F6:B1:1A (OUI DF-A9-FF)
        Count: 1
> HCI Event: LE Meta Event (0x3e) plen 13                 #170 [hci1] 45.023417
      LE Long Term Key Request (0x05)
        Handle: 2469 Address: DF:A9:FF:F6:B1:1A (OUI DF-A9-FF)
        Random number: 0x0000000000000000
        Encrypted diversifier: 0x0000
< HCI Command: LE Long Term Key... (0x08|0x001a) plen 18  #171 [hci1] 45.042674
        Handle: 2469 Address: DF:A9:FF:F6:B1:1A (OUI DF-A9-FF)
        Long term key: e2b63d2b1fef92da292e18e68bfd6c67
> HCI Event: Command Complete (0x0e) plen 6               #172 [hci1] 45.043479
      LE Long Term Key Request Reply (0x08|0x001a) ncmd 1
        Status: Success (0x00)
        Handle: 2469 Address: DF:A9:FF:F6:B1:1A (OUI DF-A9-FF)
> HCI Event: Encryption Change (0x08) plen 4              #173 [hci1] 45.460560
        Status: Success (0x00)
        Handle: 2469 Address: DF:A9:FF:F6:B1:1A (OUI DF-A9-FF)
        Encryption: Enabled with AES-CCM (0x01)
> ACL Data RX: Handle 2469 flags 0x02 dlen 26             #174 [hci1] 45.548204
      LE L2CAP: Enhanced Credit Connection Request (0x17) ident 3 len 18
        PSM: 39 (0x0027)
        MTU: 64
        MPS: 64
        Credits: 5
        Source CID: 84
        Source CID: 83
        Source CID: 82
        Source CID: 81
        Source CID: 80
< HCI Command: Host Number of Com.. (0x03|0x0035) plen 5  #175 [hci1] 45.562662
        Num handles: 1
        Handle: 2469 Address: DF:A9:FF:F6:B1:1A (OUI DF-A9-FF)
        Count: 1
< ACL Data TX: Handle 2469 flags 0x00 dlen 26             #176 [hci1] 45.562737
      LE L2CAP: Enhanced Credit Connection Response (0x18) ident 3 len 18
        MTU: 249
        MPS: 251
        Credits: 1
        Result: Connection successful (0x0000)
        Destination CID: 64
        Destination CID: 65
        Destination CID: 66
        Destination CID: 67
        Destination CID: 68
> HCI Event: Number of Completed Packets (0x13) plen 5    #177 [hci1] 45.722590
        Num handles: 1
        Handle: 2469 Address: DF:A9:FF:F6:B1:1A (OUI DF-A9-FF)
        Count: 1
        #176: len 26 (1 Kb/s)
        Latency: 159 msec (150-159 msec ~155 msec)
< ACL Data TX: Handle 2469 flags 0x00 dlen 13             #178 [hci1] 48.122910
      Channel: 80 len 9 sdu 7 [PSM 39 mode Enhanced Credit (0x81)] {chan 14}
      ATT: Read By Type Request (0x08) len 6
        Handle range: 0x0001-0xffff
        Attribute type: Include (0x2802)
> HCI Event: Number of Completed Packets (0x13) plen 5    #179 [hci1] 48.260473
        Num handles: 1
        Handle: 2469 Address: DF:A9:FF:F6:B1:1A (OUI DF-A9-FF)
        Count: 1
        #178: len 13 (0 Kb/s)
        Latency: 137 msec (137-159 msec ~146 msec)
        Channel: 80 [PSM 39 mode Enhanced Credit (0x81)] {chan 14}
        Channel Latency: 137 msec (137-137 msec ~137 msec)
> ACL Data RX: Handle 2469 flags 0x02 dlen 27             #180 [hci1] 48.260842
> ACL Data RX: Handle 2469 flags 0x01 dlen 5              #181 [hci1] 48.260879
      Channel: 68 len 28 sdu 26 [PSM 39 mode Enhanced Credit (0x81)] {chan 14}
      ATT: Read By Type Response (0x09) len 25
        Attribute data length: 8
        Attribute data list: 3 entries
        Handle: 0x0051
        Value: 900095000da0
        Handle: 0x0091
        Value: 700072000ba0
        Handle: 0x00d1
        Value: 900095000da0
< HCI Command: Host Number of Com.. (0x03|0x0035) plen 5  #182 [hci1] 48.262165
        Num handles: 1
        Handle: 2469 Address: DF:A9:FF:F6:B1:1A (OUI DF-A9-FF)
        Count: 1
< HCI Command: Host Number of Com.. (0x03|0x0035) plen 5  #183 [hci1] 48.262234
        Num handles: 1
        Handle: 2469 Address: DF:A9:FF:F6:B1:1A (OUI DF-A9-FF)
        Count: 1
< ACL Data TX: Handle 2469 flags 0x00 dlen 13             #184 [hci1] 48.262252
      Channel: 80 len 9 sdu 7 [PSM 39 mode Enhanced Credit (0x81)] {chan 14}
      ATT: Read By Type Request (0x08) len 6
        Handle range: 0x00d2-0xffff
        Attribute type: Include (0x2802)
< ACL Data TX: Handle 2469 flags 0x00 dlen 12             #185 [hci1] 48.262370
      LE L2CAP: LE Flow Control Credit (0x16) ident 7 len 4
        Source CID: 68
        Credits: 1
> HCI Event: Number of Completed Packets (0x13) plen 5    #186 [hci1] 48.348211
        Num handles: 1
        Handle: 2469 Address: DF:A9:FF:F6:B1:1A (OUI DF-A9-FF)
        Count: 1
        #184: len 13 (1 Kb/s)
        Latency: 85 msec (85-159 msec ~116 msec)
        Channel: 80 [PSM 39 mode Enhanced Credit (0x81)] {chan 14}
        Channel Latency: 85 msec (85-137 msec ~111 msec)
> HCI Event: Number of Completed Packets (0x13) plen 5    #187 [hci1] 48.435394
        Num handles: 1
        Handle: 2469 Address: DF:A9:FF:F6:B1:1A (OUI DF-A9-FF)
        Count: 1
        #185: len 12 (0 Kb/s)
        Latency: 173 msec (85-173 msec ~144 msec)
        Channel: 80 [PSM 39 mode Enhanced Credit (0x81)] {chan 14}
        Channel Latency: 173 msec (85-173 msec ~142 msec)
> ACL Data RX: Handle 2469 flags 0x02 dlen 14             #188 [hci1] 48.435515
      Channel: 68 len 10 sdu 8 [PSM 39 mode Enhanced Credit (0x81)] {chan 14}
      ATT: Read By Type Response (0x09) len 7
        Attribute data length: 6
        Attribute data list: 1 entry
        Handle: 0x00d2
        Value: 50005600
< HCI Command: Host Number of Com.. (0x03|0x0035) plen 5  #189 [hci1] 48.442319
        Num handles: 1
        Handle: 2469 Address: DF:A9:FF:F6:B1:1A (OUI DF-A9-FF)
        Count: 1
< ACL Data TX: Handle 2469 flags 0x00 dlen 9              #190 [hci1] 48.442327
      Channel: 80 len 5 sdu 3 [PSM 39 mode Enhanced Credit (0x81)] {chan 14}
      ATT: Read Request (0x0a) len 2
        Handle: 0x0050
< ACL Data TX: Handle 2469 flags 0x00 dlen 12             #191 [hci1] 48.442442
      LE L2CAP: LE Flow Control Credit (0x16) ident 8 len 4
        Source CID: 68
        Credits: 1
> HCI Event: Number of Completed Packets (0x13) plen 5    #192 [hci1] 48.523184
        Num handles: 1
        Handle: 2469 Address: DF:A9:FF:F6:B1:1A (OUI DF-A9-FF)
        Count: 1
        #190: len 9 (0 Kb/s)
        Latency: 80 msec (80-173 msec ~112 msec)
        Channel: 80 [PSM 39 mode Enhanced Credit (0x81)] {chan 14}
        Channel Latency: 80 msec (80-173 msec ~111 msec)
> HCI Event: Number of Completed Packets (0x13) plen 5    #193 [hci1] 48.610473
        Num handles: 1
        Handle: 2469 Address: DF:A9:FF:F6:B1:1A (OUI DF-A9-FF)
        Count: 1
        #191: len 12 (0 Kb/s)
        Latency: 168 msec (80-173 msec ~140 msec)
> ACL Data RX: Handle 2469 flags 0x02 dlen 23             #194 [hci1] 48.610636
      Channel: 68 len 19 sdu 17 [PSM 39 mode Enhanced Credit (0x81)] {chan 14}
      ATT: Read Response (0x0b) len 16
< HCI Command: Host Number of Com.. (0x03|0x0035) plen 5  #195 [hci1] 48.622350
        Num handles: 1
        Handle: 2469 Address: DF:A9:FF:F6:B1:1A (OUI DF-A9-FF)
        Count: 1
< ACL Data TX: Handle 2469 flags 0x00 dlen 13             #196 [hci1] 48.622376
      Channel: 80 len 9 sdu 7 [PSM 39 mode Enhanced Credit (0x81)] {chan 14}
      ATT: Read By Type Request (0x08) len 6
        Handle range: 0x00d3-0xffff
        Attribute type: Include (0x2802)
< ACL Data TX: Handle 2469 flags 0x00 dlen 12             #197 [hci1] 48.622520
      LE L2CAP: LE Flow Control Credit (0x16) ident 9 len 4
        Source CID: 68
        Credits: 1
> HCI Event: Number of Completed Packets (0x13) plen 5    #198 [hci1] 48.698170
        Num handles: 1
        Handle: 2469 Address: DF:A9:FF:F6:B1:1A (OUI DF-A9-FF)
        Count: 1
        #196: len 13 (1 Kb/s)
        Latency: 75 msec (75-173 msec ~108 msec)
        Channel: 80 [PSM 39 mode Enhanced Credit (0x81)] {chan 14}
        Channel Latency: 75 msec (75-173 msec ~93 msec)
> HCI Event: Number of Completed Packets (0x13) plen 5    #199 [hci1] 48.785292
        Num handles: 1
        Handle: 2469 Address: DF:A9:FF:F6:B1:1A (OUI DF-A9-FF)
        Count: 1
        #197: len 12 (0 Kb/s)
        Latency: 162 msec (75-173 msec ~135 msec)
        Channel: 80 [PSM 39 mode Enhanced Credit (0x81)] {chan 14}
        Channel Latency: 162 msec (75-173 msec ~128 msec)
> ACL Data RX: Handle 2469 flags 0x02 dlen 12             #200 [hci1] 48.785531
      LE L2CAP: LE Flow Control Credit (0x16) ident 4 len 4
        Source CID: 80
        Credits: 10
< HCI Command: Host Number of Com.. (0x03|0x0035) plen 5  #201 [hci1] 48.802214
        Num handles: 1
        Handle: 2469 Address: DF:A9:FF:F6:B1:1A (OUI DF-A9-FF)
        Count: 1
> ACL Data RX: Handle 2469 flags 0x02 dlen 11             #202 [hci1] 48.872734
      Channel: 68 len 7 sdu 5 [PSM 39 mode Enhanced Credit (0x81)] {chan 14}
      ATT: Error Response (0x01) len 4
        Read By Type Request (0x08)
        Handle: 0x00d3
        Error: Attribute Not Found (0x0a)
< HCI Command: Host Number of Com.. (0x03|0x0035) plen 5  #203 [hci1] 48.882374
        Num handles: 1
        Handle: 2469 Address: DF:A9:FF:F6:B1:1A (OUI DF-A9-FF)
        Count: 1
< ACL Data TX: Handle 2469 flags 0x00 dlen 12             #204 [hci1] 48.882391
      LE L2CAP: LE Flow Control Credit (0x16) ident 10 len 4
        Source CID: 68
        Credits: 1
> HCI Event: Number of Completed Packets (0x13) plen 5    #205 [hci1] 49.047717
        Num handles: 1
        Handle: 2469 Address: DF:A9:FF:F6:B1:1A (OUI DF-A9-FF)
        Count: 1
        #204: len 12 (0 Kb/s)
        Latency: 165 msec (75-173 msec ~150 msec)
> HCI Event: Disconnect Complete (0x05) plen 4            #206 [hci1] 51.410400
        Status: Success (0x00)
        Handle: 2469 Address: DF:A9:FF:F6:B1:1A (OUI DF-A9-FF)
        Reason: Remote User Terminated Connection (0x13)
< HCI Command: LE Set Extended A.. (0x08|0x0036) plen 25  #207 [hci1] 51.982765
        Handle: 0x00
        Properties: 0x0013
          Connectable
          Scannable
          Use legacy advertising PDUs: ADV_IND
        Min advertising interval: 100.000 msec (0x00a0)
        Max advertising interval: 150.000 msec (0x00f0)
        Channel map: 37, 38, 39 (0x07)
        Own address type: Random (0x01)
        Peer address type: Public (0x00)
        Peer address: 00:00:00:00:00:00 (OUI 00-00-00)
        Filter policy: Allow Scan Request from Any, Allow Connect Request from Any (0x00)
        TX power: Host has no preference (0x7f)
        Primary PHY: LE 1M (0x01)
        Secondary max skip: 0x00
        Secondary PHY: LE 1M (0x01)
        SID: 0x00
        Scan request notifications: Disabled (0x00)
> HCI Event: Command Complete (0x0e) plen 5               #208 [hci1] 51.983588
      LE Set Extended Advertising Parameters (0x08|0x0036) ncmd 1
        Status: Success (0x00)
        TX power (selected): 0 dbm (0x00)
< HCI Command: LE Set Advertising.. (0x08|0x0035) plen 7  #209 [hci1] 52.002237
        Advertising handle: 0x00
        Advertising random address: D5:B6:CC:31:DB:3B (Static)
> HCI Event: Command Complete (0x0e) plen 4               #210 [hci1] 52.002845
      LE Set Advertising Set Random Address (0x08|0x0035) ncmd 1
        Status: Success (0x00)
< HCI Command: LE Set Extended A.. (0x08|0x0037) plen 22  #211 [hci1] 52.022222
        Handle: 0x00
        Operation: Complete extended advertising data (0x03)
        Fragment preference: Minimize fragmentation (0x01)
        Data length: 0x12
        Flags: 0x06
          LE General Discoverable Mode
          BR/EDR Not Supported
        Name (complete): Tester_F6B11A
> HCI Event: Command Complete (0x0e) plen 4               #212 [hci1] 52.023026
      LE Set Extended Advertising Data (0x08|0x0037) ncmd 1
        Status: Success (0x00)
< HCI Command: LE Set Extended Sc.. (0x08|0x0038) plen 4  #213 [hci1] 52.042227
        Handle: 0x00
        Operation: Complete scan response data (0x03)
        Fragment preference: Minimize fragmentation (0x01)
        Data length: 0x00
> HCI Event: Command Complete (0x0e) plen 4               #214 [hci1] 52.042805
      LE Set Extended Scan Response Data (0x08|0x0038) ncmd 1
        Status: Success (0x00)
< HCI Command: LE Set Extended Ad.. (0x08|0x0039) plen 6  #215 [hci1] 52.062202
        Extended advertising: Enabled (0x01)
        Number of sets: 1 (0x01)
        Entry 0
          Handle: 0x00
          Duration: 0 ms (0x00)
          Max ext adv events: 0
> HCI Event: Command Complete (0x0e) plen 4               #216 [hci1] 52.062905
      LE Set Extended Advertising Enable (0x08|0x0039) ncmd 1
        Status: Success (0x00)
> HCI Event: LE Meta Event (0x3e) plen 31                 #217 [hci1] 52.488391
      LE Enhanced Connection Complete (0x0a)
        Status: Success (0x00)
        Handle: 2487
        Role: Peripheral (0x01)
        Peer address type: Public (0x00)
        Peer address: DF:A9:FF:F6:B1:1A (OUI DF-A9-FF)
        Local resolvable private address: 00:00:00:00:00:00 (Non-Resolvable)
        Peer resolvable private address: 00:00:00:00:00:00 (Non-Resolvable)
        Connection interval: 87.50 msec (0x0046)
        Connection latency: 0 (0x0000)
        Supervision timeout: 20000 msec (0x07d0)
        Central clock accuracy: 0x01
> HCI Event: LE Meta Event (0x3e) plen 6                  #218 [hci1] 52.488400
      LE Advertising Set Terminated (0x12)
        Status: Success (0x00)
        Handle: 0
        Connection handle: 2487
        Number of completed extended advertising events: 0
< HCI Command: LE Read Remote Use.. (0x08|0x0016) plen 2  #219 [hci1] 52.503079
        Handle: 2487 Address: DF:A9:FF:F6:B1:1A (OUI DF-A9-FF)
> HCI Event: Command Status (0x0f) plen 4                 #220 [hci1] 52.503590
      LE Read Remote Used Features (0x08|0x0016) ncmd 1
        Status: Success (0x00)
> HCI Event: LE Meta Event (0x3e) plen 12                 #221 [hci1] 52.752171
      LE Read Remote Used Features (0x04)
        Status: Success (0x00)
        Handle: 2487 Address: DF:A9:FF:F6:B1:1A (OUI DF-A9-FF)
        Features: 0x2d 0x49 0x00 0xf7 0x67 0xd9 0x00 0x80
          LE Encryption
          Extended Reject Indication
          Peripheral-initiated Features Exchange
          LE Data Packet Length Extension
          LE 2M PHY
          LE Coded PHY
          Channel Selection Algorithm #2
          Periodic Advertising Sync Transfer - Sender
          Periodic Advertising Sync Transfer - Recipient
          Sleep Clock Accuracy Updates
          Connected Isochronous Stream - Central
          Connected Isochronous Stream - Peripheral
          Isochronous Broadcaster
          Synchronized Receiver
          Connected Isochronous Stream (Host Support)
          LE Power Control Request
          LE Power Control Request
          Connection Subrating
          Connection Subrating (Host Support)
          Unknown features (0x8000d90000000000)
< ACL Data TX: Handle 2487 flags 0x00 dlen 16             #222 [hci1] 57.512504
      LE L2CAP: Connection Parameter Update Request (0x12) ident 11 len 8
        Min interval: 24
        Max interval: 40
        Peripheral latency: 0
        Timeout multiplier: 42
> HCI Event: Number of Completed Packets (0x13) plen 5    #223 [hci1] 57.651834
        Num handles: 1
        Handle: 2487 Address: DF:A9:FF:F6:B1:1A (OUI DF-A9-FF)
        Count: 1
        #222: len 16 (0 Kb/s)
        Latency: 139 msec (139-139 msec ~139 msec)
> ACL Data RX: Handle 2487 flags 0x02 dlen 10             #224 [hci1] 57.652022
      LE L2CAP: Connection Parameter Update Response (0x13) ident 11 len 2
        Result: Connection Parameters accepted (0x0000)
< HCI Command: Host Number of Com.. (0x03|0x0035) plen 5  #225 [hci1] 57.662941
        Num handles: 1
        Handle: 2487 Address: DF:A9:FF:F6:B1:1A (OUI DF-A9-FF)
        Count: 1
> HCI Event: LE Meta Event (0x3e) plen 13                 #226 [hci1] 60.452231
      LE Long Term Key Request (0x05)
        Handle: 2487 Address: DF:A9:FF:F6:B1:1A (OUI DF-A9-FF)
        Random number: 0x0000000000000000
        Encrypted diversifier: 0x0000
< HCI Command: LE Long Term Key... (0x08|0x001a) plen 18  #227 [hci1] 60.462364
        Handle: 2487 Address: DF:A9:FF:F6:B1:1A (OUI DF-A9-FF)
        Long term key: e2b63d2b1fef92da292e18e68bfd6c67
> HCI Event: Command Complete (0x0e) plen 6               #228 [hci1] 60.463079
      LE Long Term Key Request Reply (0x08|0x001a) ncmd 1
        Status: Success (0x00)
        Handle: 2487 Address: DF:A9:FF:F6:B1:1A (OUI DF-A9-FF)
> HCI Event: Encryption Change (0x08) plen 4              #229 [hci1] 60.889395
        Status: Success (0x00)
        Handle: 2487 Address: DF:A9:FF:F6:B1:1A (OUI DF-A9-FF)
        Encryption: Enabled with AES-CCM (0x01)
> ACL Data RX: Handle 2487 flags 0x02 dlen 26             #230 [hci1] 60.977178
      LE L2CAP: Enhanced Credit Connection Request (0x17) ident 5 len 18
        PSM: 39 (0x0027)
        MTU: 64
        MPS: 64
        Credits: 5
        Source CID: 84
        Source CID: 83
        Source CID: 82
        Source CID: 81
        Source CID: 80
< HCI Command: Host Number of Com.. (0x03|0x0035) plen 5  #231 [hci1] 60.982826
        Num handles: 1
        Handle: 2487 Address: DF:A9:FF:F6:B1:1A (OUI DF-A9-FF)
        Count: 1
< ACL Data TX: Handle 2487 flags 0x00 dlen 26             #232 [hci1] 60.982926
      LE L2CAP: Enhanced Credit Connection Response (0x18) ident 5 len 18
        MTU: 249
        MPS: 251
        Credits: 1
        Result: Connection successful (0x0000)
        Destination CID: 64
        Destination CID: 65
        Destination CID: 66
        Destination CID: 67
        Destination CID: 68
> HCI Event: Number of Completed Packets (0x13) plen 5    #233 [hci1] 61.151691
        Num handles: 1
        Handle: 2487 Address: DF:A9:FF:F6:B1:1A (OUI DF-A9-FF)
        Count: 1
        #232: len 26 (1 Kb/s)
        Latency: 168 msec (139-168 msec ~154 msec)
< ACL Data TX: Handle 2487 flags 0x00 dlen 13             #234 [hci1] 63.563100
      Channel: 80 len 9 sdu 7 [PSM 39 mode Enhanced Credit (0x81)] {chan 19}
      ATT: Read By Type Request (0x08) len 6
        Handle range: 0x0001-0xffff
        Attribute type: Include (0x2802)
> HCI Event: Number of Completed Packets (0x13) plen 5    #235 [hci1] 63.689243
        Num handles: 1
        Handle: 2487 Address: DF:A9:FF:F6:B1:1A (OUI DF-A9-FF)
        Count: 1
        #234: len 13 (0 Kb/s)
        Latency: 126 msec (126-168 msec ~140 msec)
        Channel: 80 [PSM 39 mode Enhanced Credit (0x81)] {chan 19}
        Channel Latency: 126 msec (126-126 msec ~126 msec)
> ACL Data RX: Handle 2487 flags 0x02 dlen 14             #236 [hci1] 63.689620
      Channel: 68 len 10 sdu 8 [PSM 39 mode Enhanced Credit (0x81)] {chan 19}
      ATT: Read By Type Response (0x09) len 7
        Attribute data length: 6
        Attribute data list: 1 entry
        Handle: 0x0041
        Value: 00010501
< HCI Command: Host Number of Com.. (0x03|0x0035) plen 5  #237 [hci1] 63.702532
        Num handles: 1
        Handle: 2487 Address: DF:A9:FF:F6:B1:1A (OUI DF-A9-FF)
        Count: 1
< ACL Data TX: Handle 2487 flags 0x00 dlen 9              #238 [hci1] 63.702551
      Channel: 80 len 5 sdu 3 [PSM 39 mode Enhanced Credit (0x81)] {chan 19}
      ATT: Read Request (0x0a) len 2
        Handle: 0x0100
< ACL Data TX: Handle 2487 flags 0x00 dlen 12             #239 [hci1] 63.702712
      LE L2CAP: LE Flow Control Credit (0x16) ident 12 len 4
        Source CID: 68
        Credits: 1
> HCI Event: Number of Completed Packets (0x13) plen 5    #240 [hci1] 63.777165
        Num handles: 1
        Handle: 2487 Address: DF:A9:FF:F6:B1:1A (OUI DF-A9-FF)
        Count: 1
        #238: len 9 (0 Kb/s)
        Latency: 74 msec (74-168 msec ~107 msec)
        Channel: 80 [PSM 39 mode Enhanced Credit (0x81)] {chan 19}
        Channel Latency: 74 msec (74-126 msec ~100 msec)
> HCI Event: Number of Completed Packets (0x13) plen 5    #241 [hci1] 63.864386
        Num handles: 1
        Handle: 2487 Address: DF:A9:FF:F6:B1:1A (OUI DF-A9-FF)
        Count: 1
        #239: len 12 (0 Kb/s)
        Latency: 161 msec (74-168 msec ~134 msec)
        Channel: 80 [PSM 39 mode Enhanced Credit (0x81)] {chan 19}
        Channel Latency: 161 msec (74-161 msec ~131 msec)
> ACL Data RX: Handle 2487 flags 0x02 dlen 23             #242 [hci1] 63.864750
      Channel: 68 len 19 sdu 17 [PSM 39 mode Enhanced Credit (0x81)] {chan 19}
      ATT: Read Response (0x0b) len 16
< HCI Command: Host Number of Com.. (0x03|0x0035) plen 5  #243 [hci1] 63.882531
        Num handles: 1
        Handle: 2487 Address: DF:A9:FF:F6:B1:1A (OUI DF-A9-FF)
        Count: 1
< ACL Data TX: Handle 2487 flags 0x00 dlen 13             #244 [hci1] 63.882580
      Channel: 80 len 9 sdu 7 [PSM 39 mode Enhanced Credit (0x81)] {chan 19}
      ATT: Read By Type Request (0x08) len 6
        Handle range: 0x0042-0xffff
        Attribute type: Include (0x2802)
< ACL Data TX: Handle 2487 flags 0x00 dlen 12             #245 [hci1] 63.882717
      LE L2CAP: LE Flow Control Credit (0x16) ident 13 len 4
        Source CID: 68
        Credits: 1
> HCI Event: Number of Completed Packets (0x13) plen 5    #246 [hci1] 63.952209
        Num handles: 1
        Handle: 2487 Address: DF:A9:FF:F6:B1:1A (OUI DF-A9-FF)
        Count: 1
        #244: len 13 (1 Kb/s)
        Latency: 69 msec (69-168 msec ~102 msec)
        Channel: 80 [PSM 39 mode Enhanced Credit (0x81)] {chan 19}
        Channel Latency: 69 msec (69-161 msec ~100 msec)
> HCI Event: Number of Completed Packets (0x13) plen 5    #247 [hci1] 64.039218
        Num handles: 1
        Handle: 2487 Address: DF:A9:FF:F6:B1:1A (OUI DF-A9-FF)
        Count: 1
        #245: len 12 (0 Kb/s)
        Latency: 156 msec (69-168 msec ~129 msec)
> ACL Data RX: Handle 2487 flags 0x02 dlen 16             #248 [hci1] 64.039617
      Channel: 68 len 12 sdu 10 [PSM 39 mode Enhanced Credit (0x81)] {chan 19}
      ATT: Read By Type Response (0x09) len 9
        Attribute data length: 8
        Attribute data list: 1 entry
        Handle: 0x00e1
        Value: 400045000da0
< HCI Command: Host Number of Com.. (0x03|0x0035) plen 5  #249 [hci1] 64.042457
        Num handles: 1
        Handle: 2487 Address: DF:A9:FF:F6:B1:1A (OUI DF-A9-FF)
        Count: 1
< ACL Data TX: Handle 2487 flags 0x00 dlen 13             #250 [hci1] 64.042493
      Channel: 80 len 9 sdu 7 [PSM 39 mode Enhanced Credit (0x81)] {chan 19}
      ATT: Read By Type Request (0x08) len 6
        Handle range: 0x00e2-0xffff
        Attribute type: Include (0x2802)
< ACL Data TX: Handle 2487 flags 0x00 dlen 12             #251 [hci1] 64.042619
      LE L2CAP: LE Flow Control Credit (0x16) ident 14 len 4
        Source CID: 68
        Credits: 1
> HCI Event: Number of Completed Packets (0x13) plen 5    #252 [hci1] 64.127207
        Num handles: 1
        Handle: 2487 Address: DF:A9:FF:F6:B1:1A (OUI DF-A9-FF)
        Count: 1
        #250: len 13 (1 Kb/s)
        Latency: 84 msec (69-168 msec ~107 msec)
        Channel: 80 [PSM 39 mode Enhanced Credit (0x81)] {chan 19}
        Channel Latency: 84 msec (69-161 msec ~92 msec)
> HCI Event: Number of Completed Packets (0x13) plen 5    #253 [hci1] 64.214309
        Num handles: 1
        Handle: 2487 Address: DF:A9:FF:F6:B1:1A (OUI DF-A9-FF)
        Count: 1
        #251: len 12 (0 Kb/s)
        Latency: 171 msec (69-171 msec ~139 msec)
        Channel: 80 [PSM 39 mode Enhanced Credit (0x81)] {chan 19}
        Channel Latency: 171 msec (69-171 msec ~132 msec)
> ACL Data RX: Handle 2487 flags 0x02 dlen 12             #254 [hci1] 64.214508
      LE L2CAP: LE Flow Control Credit (0x16) ident 6 len 4
        Source CID: 80
        Credits: 10
> ACL Data RX: Handle 2487 flags 0x02 dlen 14             #255 [hci1] 64.214876
      Channel: 68 len 10 sdu 8 [PSM 39 mode Enhanced Credit (0x81)] {chan 19}
      ATT: Read By Type Response (0x09) len 7
        Attribute data length: 6
        Attribute data list: 1 entry
        Handle: 0x00e2
        Value: 00010501
< HCI Command: Host Number of Com.. (0x03|0x0035) plen 5  #256 [hci1] 64.222470
        Num handles: 1
        Handle: 2487 Address: DF:A9:FF:F6:B1:1A (OUI DF-A9-FF)
        Count: 1
< HCI Command: Host Number of Com.. (0x03|0x0035) plen 5  #257 [hci1] 64.222491
        Num handles: 1
        Handle: 2487 Address: DF:A9:FF:F6:B1:1A (OUI DF-A9-FF)
        Count: 1
< ACL Data TX: Handle 2487 flags 0x00 dlen 9              #258 [hci1] 64.222729
      Channel: 80 len 5 sdu 3 [PSM 39 mode Enhanced Credit (0x81)] {chan 19}
      ATT: Read Request (0x0a) len 2
        Handle: 0x0100
< ACL Data TX: Handle 2487 flags 0x00 dlen 12             #259 [hci1] 64.222843
      LE L2CAP: LE Flow Control Credit (0x16) ident 15 len 4
        Source CID: 68
        Credits: 1
> HCI Event: Number of Completed Packets (0x13) plen 5    #260 [hci1] 64.302182
        Num handles: 1
        Handle: 2487 Address: DF:A9:FF:F6:B1:1A (OUI DF-A9-FF)
        Count: 1
        #258: len 9 (0 Kb/s)
        Latency: 79 msec (69-171 msec ~109 msec)
> HCI Event: Number of Completed Packets (0x13) plen 5    #261 [hci1] 64.389418
        Num handles: 1
        Handle: 2487 Address: DF:A9:FF:F6:B1:1A (OUI DF-A9-FF)
        Count: 1
        #259: len 12 (0 Kb/s)
        Latency: 166 msec (69-171 msec ~137 msec)
        Channel: 80 [PSM 39 mode Enhanced Credit (0x81)] {chan 19}
        Channel Latency: 166 msec (69-171 msec ~149 msec)
> ACL Data RX: Handle 2487 flags 0x02 dlen 23             #262 [hci1] 64.389695
      Channel: 68 len 19 sdu 17 [PSM 39 mode Enhanced Credit (0x81)] {chan 19}
      ATT: Read Response (0x0b) len 16
< HCI Command: Host Number of Com.. (0x03|0x0035) plen 5  #263 [hci1] 64.402542
        Num handles: 1
        Handle: 2487 Address: DF:A9:FF:F6:B1:1A (OUI DF-A9-FF)
        Count: 1
< ACL Data TX: Handle 2487 flags 0x00 dlen 13             #264 [hci1] 64.402560
      Channel: 80 len 9 sdu 7 [PSM 39 mode Enhanced Credit (0x81)] {chan 19}
      ATT: Read By Type Request (0x08) len 6
        Handle range: 0x00e3-0xffff
        Attribute type: Include (0x2802)
< ACL Data TX: Handle 2487 flags 0x00 dlen 12             #265 [hci1] 64.402752
      LE L2CAP: LE Flow Control Credit (0x16) ident 16 len 4
        Source CID: 68
        Credits: 1
> HCI Event: Number of Completed Packets (0x13) plen 5    #266 [hci1] 64.477222
        Num handles: 1
        Handle: 2487 Address: DF:A9:FF:F6:B1:1A (OUI DF-A9-FF)
        Count: 1
        #264: len 13 (1 Kb/s)
        Latency: 74 msec (69-171 msec ~106 msec)
        Channel: 80 [PSM 39 mode Enhanced Credit (0x81)] {chan 19}
        Channel Latency: 74 msec (69-171 msec ~112 msec)
> HCI Event: Number of Completed Packets (0x13) plen 5    #267 [hci1] 64.564096
        Num handles: 1
        Handle: 2487 Address: DF:A9:FF:F6:B1:1A (OUI DF-A9-FF)
        Count: 1
        #265: len 12 (0 Kb/s)
        Latency: 161 msec (69-171 msec ~133 msec)
> ACL Data RX: Handle 2487 flags 0x02 dlen 11             #268 [hci1] 64.651848
      Channel: 68 len 7 sdu 5 [PSM 39 mode Enhanced Credit (0x81)] {chan 19}
      ATT: Error Response (0x01) len 4
        Read By Type Request (0x08)
        Handle: 0x00e3
        Error: Attribute Not Found (0x0a)
< HCI Command: Host Number of Com.. (0x03|0x0035) plen 5  #269 [hci1] 64.662540
        Num handles: 1
        Handle: 2487 Address: DF:A9:FF:F6:B1:1A (OUI DF-A9-FF)
        Count: 1
< ACL Data TX: Handle 2487 flags 0x00 dlen 12             #270 [hci1] 64.662547
      LE L2CAP: LE Flow Control Credit (0x16) ident 17 len 4
        Source CID: 68
        Credits: 1
> HCI Event: Number of Completed Packets (0x13) plen 5    #271 [hci1] 64.826598
        Num handles: 1
        Handle: 2487 Address: DF:A9:FF:F6:B1:1A (OUI DF-A9-FF)
        Count: 1
        #270: len 12 (0 Kb/s)
        Latency: 164 msec (69-171 msec ~148 msec)
        Channel: 80 [PSM 39 mode Enhanced Credit (0x81)] {chan 19}
        Channel Latency: 164 msec (69-171 msec ~138 msec)
> HCI Event: Disconnect Complete (0x05) plen 4            #272 [hci1] 67.101963
        Status: Success (0x00)
        Handle: 2487 Address: DF:A9:FF:F6:B1:1A (OUI DF-A9-FF)
        Reason: Remote User Terminated Connection (0x13)
< HCI Command: Reset (0x03|0x0003) plen 0                 #273 [hci1] 73.682592
> HCI Event: Command Complete (0x0e) plen 4               #274 [hci1] 73.683140
      Reset (0x03|0x0003) ncmd 1
        Status: Success (0x00)
@ USER Close: main                                    {0x0001} [hci1] 73.702446
= Close Index: 00:00:00:00:00:00                               [hci1] 73.702453
