Bluetooth monitor ver 5.72
btmon[1907047]: = Note: Linux version 6.14.0-36-generic (x86_64)                                                         0.313557
btmon[1907047]: = Note: Bluetooth subsystem version 2.22                                                                 0.313558
= New Index: 00:00:00:00:00:00 (Primary,UART,hci1)                                                                       0.313560
= New Index: 48:5F:99:8E:E0:64 (Primary,USB,hci0)                                                                        0.313561
= Open Index: 00:00:00:00:00:00                                                                                          0.827333
= Index Info: 00:00:00:00:00:00 (Nordic Semiconductor ASA)                                                               0.827339
zephyr.exe[1907049]: @ USER Open: main (privileged) version 2.22                                                {0x0001} 0.827342
zephyr.exe[1907049]: < HCI Command: Reset (0x03|0x0003) plen 0                                                        #1 0.827706
> HCI Event: Command Complete (0x0e) plen 4                                                                           #2 0.828257
      Reset (0x03|0x0003) ncmd 1
        Status: Success (0x00)
zephyr.exe[1907049]: < HCI Command: Read Local Supported Features (0x04|0x0003) plen 0                                #3 0.847288
> HCI Event: Command Complete (0x0e) plen 12                                                                          #4 0.847754
      Read Local Supported Features (0x04|0x0003) ncmd 1
        Status: Success (0x00)
        Features: 0x00 0x00 0x00 0x00 0x60 0x00 0x00 0x00
          BR/EDR Not Supported
          LE Supported (Controller)
zephyr.exe[1907049]: < HCI Command: Read Local Version Information (0x04|0x0001) plen 0                               #5 0.867343
> HCI Event: Command Complete (0x0e) plen 12                                                                          #6 0.867788
      Read Local Version Information (0x04|0x0001) ncmd 1
        Status: Success (0x00)
        HCI version: Reserved (0x0f) - Revision 12393 (0x3069)
        LMP version: Reserved (0x0f) - Subversion 12393 (0x3069)
        Manufacturer: Nordic Semiconductor ASA (89)
zephyr.exe[1907049]: < HCI Command: Read Local Supported Commands (0x04|0x0002) plen 0                                #7 0.887347
> HCI Event: Command Complete (0x0e) plen 68                                                                          #8 0.888394
      Read Local Supported Commands (0x04|0x0002) ncmd 1
        Status: Success (0x00)
        Commands: 119 entries
          Disconnect (Octet 0 - Bit 5)
          Read Remote Version Information (Octet 2 - Bit 7)
          Set Event Mask (Octet 5 - Bit 6)
          Reset (Octet 5 - Bit 7)
          Read Connection Accept Timeout (Octet 7 - Bit 2)
          Write Connection Accept Timeout (Octet 7 - Bit 3)
          Read Transmit Power Level (Octet 10 - Bit 2)
          Set Controller To Host Flow Control (Octet 10 - Bit 5)
          Host Buffer Size (Octet 10 - Bit 6)
          Host Number of Completed Packets (Octet 10 - Bit 7)
          Read Local Version Information (Octet 14 - Bit 3)
          Read Local Supported Features (Octet 14 - Bit 5)
          Read BD ADDR (Octet 15 - Bit 1)
          Read RSSI (Octet 15 - Bit 5)
          Set Event Mask Page 2 (Octet 22 - Bit 2)
          LE Set Event Mask (Octet 25 - Bit 0)
          LE Read Buffer Size (Octet 25 - Bit 1)
          LE Read Local Supported Features (Octet 25 - Bit 2)
          LE Set Random Address (Octet 25 - Bit 4)
          LE Set Advertising Parameters (Octet 25 - Bit 5)
          LE Read Advertising Channel TX Power (Octet 25 - Bit 6)
          LE Set Advertising Data (Octet 25 - Bit 7)
          LE Set Scan Response Data (Octet 26 - Bit 0)
          LE Set Advertise Enable (Octet 26 - Bit 1)
          LE Set Scan Parameters (Octet 26 - Bit 2)
          LE Set Scan Enable (Octet 26 - Bit 3)
          LE Create Connection (Octet 26 - Bit 4)
          LE Create Connection Cancel (Octet 26 - Bit 5)
          LE Read Accept List Size (Octet 26 - Bit 6)
          LE Clear Accept List (Octet 26 - Bit 7)
          LE Add Device To Accept List (Octet 27 - Bit 0)
          LE Remove Device From Accept List (Octet 27 - Bit 1)
          LE Connection Update (Octet 27 - Bit 2)
          LE Set Host Channel Classification (Octet 27 - Bit 3)
          LE Read Channel Map (Octet 27 - Bit 4)
          LE Read Remote Used Features (Octet 27 - Bit 5)
          LE Encrypt (Octet 27 - Bit 6)
          LE Rand (Octet 27 - Bit 7)
          LE Start Encryption (Octet 28 - Bit 0)
          LE Long Term Key Request Reply (Octet 28 - Bit 1)
          LE Long Term Key Request Neg Reply (Octet 28 - Bit 2)
          LE Read Supported States (Octet 28 - Bit 3)
          LE Receiver Test (Octet 28 - Bit 4)
          LE Transmitter Test (Octet 28 - Bit 5)
          LE Test End (Octet 28 - Bit 6)
          Read Authenticated Payload Timeout (Octet 32 - Bit 4)
          Write Authenticated Payload Timeout (Octet 32 - Bit 5)
          LE Set Data Length (Octet 33 - Bit 6)
          LE Read Suggested Default Data Length (Octet 33 - Bit 7)
          LE Write Suggested Default Data Length (Octet 34 - Bit 0)
          LE Add Device To Resolving List (Octet 34 - Bit 3)
          LE Remove Device From Resolving List (Octet 34 - Bit 4)
          LE Clear Resolving List (Octet 34 - Bit 5)
          LE Read Resolving List Size (Octet 34 - Bit 6)
          LE Set Address Resolution Enable (Octet 35 - Bit 1)
          LE Set Resolvable Private Address Timeout (Octet 35 - Bit 2)
          LE Read Maximum Data Length (Octet 35 - Bit 3)
          LE Read PHY (Octet 35 - Bit 4)
          LE Set Default PHY (Octet 35 - Bit 5)
          LE Set PHY (Octet 35 - Bit 6)
          LE Enhanced Receiver Test (Octet 35 - Bit 7)
          LE Enhanced Transmitter Test (Octet 36 - Bit 0)
          LE Set Advertising Set Random Address (Octet 36 - Bit 1)
          LE Set Extended Advertising Parameters (Octet 36 - Bit 2)
          LE Set Extended Advertising Data (Octet 36 - Bit 3)
          LE Set Extended Scan Response Data (Octet 36 - Bit 4)
          LE Set Extended Advertising Enable (Octet 36 - Bit 5)
          LE Read Maximum Advertising Data Length (Octet 36 - Bit 6)
          LE Read Number of Supported Advertising Sets (Octet 36 - Bit 7)
          LE Remove Advertising Set (Octet 37 - Bit 0)
          LE Clear Advertising Sets (Octet 37 - Bit 1)
          LE Set Periodic Advertising Parameters (Octet 37 - Bit 2)
          LE Set Periodic Advertising Data (Octet 37 - Bit 3)
          LE Set Periodic Advertising Enable (Octet 37 - Bit 4)
          LE Set Extended Scan Parameters (Octet 37 - Bit 5)
          LE Set Extended Scan Enable (Octet 37 - Bit 6)
          LE Extended Create Connection (Octet 37 - Bit 7)
          LE Periodic Advertising Create Sync (Octet 38 - Bit 0)
          LE Periodic Advertising Create Sync Cancel (Octet 38 - Bit 1)
          LE Periodic Advertising Terminate Sync (Octet 38 - Bit 2)
          LE Add Device To Periodic Advertiser List (Octet 38 - Bit 3)
          LE Remove Device From Periodic Advertiser List (Octet 38 - Bit 4)
          LE Clear Periodic Advertiser List (Octet 38 - Bit 5)
          LE Read Periodic Advertiser List Size (Octet 38 - Bit 6)
          LE Read Transmit Power (Octet 38 - Bit 7)
          LE Read RF Path Compensation (Octet 39 - Bit 0)
          LE Write RF Path Compensation (Octet 39 - Bit 1)
          LE Set Privacy Mode (Octet 39 - Bit 2)
          LE Periodic Advertising Receive Enable (Octet 40 - Bit 5)
          LE Periodic Advertising Sync Transfer (Octet 40 - Bit 6)
          LE Periodic Advertising Set Info Transfer (Octet 40 - Bit 7)
          LE Periodic Advertising Sync Transfer Parameters (Octet 41 - Bit 0)
          LE Set Default Periodic Advertisng Sync Transfer Parameters (Octet 41 - Bit 1)
          LE Read Buffer v2 (Octet 41 - Bit 5)
          LE Read ISO TX Sync (Octet 41 - Bit 6)
          LE Set Connected Isochronous Group Parameters (Octet 41 - Bit 7)
          LE Set Connected Isochronous Group Parameters Test (Octet 42 - Bit 0)
          LE Create Connected Isochronous Stream (Octet 42 - Bit 1)
          LE Remove Connected Isochronous Group (Octet 42 - Bit 2)
          LE Accept Connected Isochronous Stream Request (Octet 42 - Bit 3)
          LE Reject Connected Isochronous Stream Request (Octet 42 - Bit 4)
          LE Create Broadcast Isochronous Group (Octet 42 - Bit 5)
          LE Create Broadcast Isochronous Group Test (Octet 42 - Bit 6)
          LE Terminate Broadcast Isochronous Group (Octet 42 - Bit 7)
          LE Broadcast Isochronous Group Create Sync (Octet 43 - Bit 0)
          LE Broadcast Isochronous Group Terminate Sync (Octet 43 - Bit 1)
          LE Request Peer SCA (Octet 43 - Bit 2)
          LE Setup Isochronous Data Path (Octet 43 - Bit 3)
          LE Remove Isochronous Data Path (Octet 43 - Bit 4)
          LE Isochronous Transmit Test (Octet 43 - Bit 5)
          LE Isochronous Receive Test (Octet 43 - Bit 6)
          LE Isochronous Read Test Counters (Octet 43 - Bit 7)
          LE Isochronous Read Test Counters (Octet 44 - Bit 0)
          LE Set Host Feature (Octet 44 - Bit 1)
          Octet 44 - Bit 2 
          Octet 45 - Bit 6 
          Octet 46 - Bit 0 
          Octet 46 - Bit 1 
          Octet 46 - Bit 2 
zephyr.exe[1907049]: < HCI Command: Host Buffer Size (0x03|0x0033) plen 7                                             #9 0.907348
        ACL MTU: 255  ACL max packet: 16
        SCO MTU: 0    SCO max packet: 0
> HCI Event: Command Complete (0x0e) plen 4                                                                          #10 0.907835
      Host Buffer Size (0x03|0x0033) ncmd 1
        Status: Success (0x00)
zephyr.exe[1907049]: < HCI Command: Set Controller To Host Flow Control (0x03|0x0031) plen 1                         #11 0.927361
        Flow control: ACL Data Packets (0x01)
> HCI Event: Command Complete (0x0e) plen 4                                                                          #12 0.927842
      Set Controller To Host Flow Control (0x03|0x0031) ncmd 1
        Status: Success (0x00)
zephyr.exe[1907049]: < HCI Command: LE Read Local Supported Features (0x08|0x0003) plen 0                            #13 0.947340
> HCI Event: Command Complete (0x0e) plen 12                                                                         #14 0.947877
      LE Read Local Supported Features (0x08|0x0003) ncmd 1
        Status: Success (0x00)
        Features: 0xfd 0x79 0x00 0xf7 0x30 0x01 0x00 0x00
          LE Encryption
          Extended Reject Indication
          Peripheral-initiated Features Exchange
          LE Ping
          LE Data Packet Length Extension
          LL Privacy
          Extended Scanner Filter Policies
          LE 2M PHY
          LE Coded PHY
          LE Extended Advertising
          LE Periodic Advertising
          Channel Selection Algorithm #2
          Periodic Advertising Sync Transfer - Sender
          Periodic Advertising Sync Transfer - Recipient
          Sleep Clock Accuracy Updates
          Connected Isochronous Stream - Central
          Connected Isochronous Stream - Peripheral
          Isochronous Broadcaster
          Synchronized Receiver
          Periodic Advertising ADI support
          Connection Subrating
          Unknown features (0x0000010000000000)
zephyr.exe[1907049]: < HCI Command: LE Set Host Feature (0x08|0x0074) plen 2                                         #15 0.967327
        Bit Number: 32
          Connected Isochronous Stream (Host Support)
        Bit Value: 1
> HCI Event: Command Complete (0x0e) plen 4                                                                          #16 0.967777
      LE Set Host Feature (0x08|0x0074) ncmd 1
        Status: Success (0x00)
zephyr.exe[1907049]: < HCI Command: LE Read Buffer v2 (0x08|0x0060) plen 0                                           #17 0.987337
> HCI Event: Command Complete (0x0e) plen 10                                                                         #18 0.987878
      LE Read Buffer v2 (0x08|0x0060) ncmd 1
        Status: Success (0x00)
        ACL MTU: 27
        ACL max packet: 3
        ISO MTU: 318
        ISO max packet: 3
zephyr.exe[1907049]: < HCI Command: LE Read Maximum Advertising Data Length (0x08|0x003a) plen 0                     #19 1.007346
> HCI Event: Command Complete (0x0e) plen 6                                                                          #20 1.007850
      LE Read Maximum Advertising Data Length (0x08|0x003a) ncmd 1
        Status: Success (0x00)
        Max length: 1650
zephyr.exe[1907049]: < HCI Command: LE Read Supported States (0x08|0x001c) plen 0                                    #21 1.027319
> HCI Event: Command Complete (0x0e) plen 12                                                                         #22 1.027761
      LE Read Supported States (0x08|0x001c) ncmd 1
        Status: Success (0x00)
        States: 0x000003ff3e0306ff
          Non-connectable Advertising State
          Scannable Advertising State
          Connectable Advertising State
          High Duty Cycle Directed Advertising State
          Passive Scanning State
          Active Scanning State
          Initiating State
            and Connection State (Central Role)
          Connection State (Peripheral Role)
          Scannable Advertising State
            and Passive Scanning State
          Connectable Advertising State
            and Passive Scanning State
          Non-connectable Advertising State
            and Initiating State
          Scannable Advertising State
            and Initiating State
          Active Scanning State
            and Connection State (Central Role)
          Passive Scanning State
            and Connection State (Peripheral Role)
          Active Scanning State
            and Connection State (Peripheral Role)
          Initiating State
            and Connection State (Central Role)
            and Central Role & Central Role
          Low Duty Cycle Directed Advertising State
          Connectable Advertising State
            and Initiating State
            and Central Role & Peripheral Role
          High Duty Cycle Directed Advertising State
            and Initiating State
            and Central Role & Peripheral Role
          Low Duty Cycle Directed Advertising State
            and Initiating State
            and Central Role & Peripheral Role
          Connectable Advertising State
            and Connection State (Central Role)
            and Central Role & Peripheral Role
          High Duty Cycle Directed Advertising State
            and Connection State (Central Role)
            and Central Role & Peripheral Role
          Low Duty Cycle Directed Advertising State
            and Connection State (Central Role)
            and Central Role & Peripheral Role
          Connectable Advertising State
            and Connection State (Peripheral Role)
            and Central Role & Peripheral Role
          High Duty Cycle Directed Advertising State
            and Connection State (Peripheral Role)
            and Peripheral Role & Peripheral Role
          Low Duty Cycle Directed Advertising State
            and Connection State (Peripheral Role)
            and Peripheral Role & Peripheral Role
          Initiating State
            and Connection State (Peripheral Role)
            and Central Role & Peripheral Role
zephyr.exe[1907049]: < HCI Command: LE Read Maximum Data Length (0x08|0x002f) plen 0                                 #23 1.047284
> HCI Event: Command Complete (0x0e) plen 12                                                                         #24 1.047768
      LE Read Maximum Data Length (0x08|0x002f) ncmd 1
        Status: Success (0x00)
        Max TX octets: 251
        Max TX time: 2704
        Max RX octets: 251
        Max RX time: 2704
zephyr.exe[1907049]: < HCI Command: LE Write Suggested Default Data Length (0x08|0x0024) plen 4                      #25 1.067337
        TX octets: 251
        TX time: 2704
> HCI Event: Command Complete (0x0e) plen 4                                                                          #26 1.067746
      LE Write Suggested Default Data Length (0x08|0x0024) ncmd 1
        Status: Success (0x00)
zephyr.exe[1907049]: < HCI Command: LE Read Resolving List Size (0x08|0x002a) plen 0                                 #27 1.087352
> HCI Event: Command Complete (0x0e) plen 5                                                                          #28 1.087781
      LE Read Resolving List Size (0x08|0x002a) ncmd 1
        Status: Success (0x00)
        Size: 8
zephyr.exe[1907049]: < HCI Command: LE Set Event Mask (0x08|0x0001) plen 8                                           #29 1.107329
        Mask: 0x000002023f87fa5e
          LE Advertising Report
          LE Connection Update Complete
          LE Read Remote Used Features Complete
          LE Long Term Key Request
          LE Data Length Change
          LE Enhanced Connection Complete
          LE PHY Update Complete
          LE Extended Advertising Report
          LE Periodic Advertising Sync Established
          LE Periodic Advertising Report
          LE Periodic Advertising Sync Lost
          LE Extended Scan Timeout
          LE Extended Advertising Set Terminated
          LE Scan Request Received
          LE Periodic Advertising Sync Transfer Rvc
          LE CIS Established
          LE CIS Request
          LE Create BIG Complete
          LE Terminate BIG Complete
          LE BIG Sync Estabilished Complete
          LE BIG Sync Lost
          LE BIG Info Advertising Report
          Unknown mask (0x0000020000000000)
> HCI Event: Command Complete (0x0e) plen 4                                                                          #30 1.107814
      LE Set Event Mask (0x08|0x0001) ncmd 1
        Status: Success (0x00)
zephyr.exe[1907049]: < HCI Command: Set Event Mask (0x03|0x0001) plen 8                                              #31 1.127181
        Mask: 0x2000800002008890
          Disconnection Complete
          Encryption Change
          Read Remote Version Information Complete
          Hardware Error
          Data Buffer Overflow
          Encryption Key Refresh Complete
          LE Meta
> HCI Event: Command Complete (0x0e) plen 4                                                                          #32 1.127762
      Set Event Mask (0x03|0x0001) ncmd 1
        Status: Success (0x00)
zephyr.exe[1907049]: < HCI Command: Read BD ADDR (0x04|0x0009) plen 0                                                #33 1.147283
> HCI Event: Command Complete (0x0e) plen 10                                                                         #34 1.147754
      Read BD ADDR (0x04|0x0009) ncmd 1
        Status: Success (0x00)
        Address: 00:00:00:00:00:00 (OUI 00-00-00)
zephyr.exe[1907049]: < HCI Command: LE Set Random Address (0x08|0x0005) plen 6                                       #35 1.167359
        Address: D5:B6:CC:31:DB:3B (Static)
> HCI Event: Command Complete (0x0e) plen 4                                                                          #36 1.167842
      LE Set Random Address (0x08|0x0005) ncmd 1
        Status: Success (0x00)
zephyr.exe[1907049]: < HCI Command: LE Set Extended Advertising Parameters (0x08|0x0036) plen 25                     #37 5.217412
        Handle: 0x00
        Properties: 0x0013
          Connectable
          Scannable
          Use legacy advertising PDUs: ADV_IND
        Min advertising interval: 100.000 msec (0x00a0)
        Max advertising interval: 150.000 msec (0x00f0)
        Channel map: 37, 38, 39 (0x07)
        Own address type: Random (0x01)
        Peer address type: Public (0x00)
        Peer address: 00:00:00:00:00:00 (OUI 00-00-00)
        Filter policy: Allow Scan Request from Any, Allow Connect Request from Any (0x00)
        TX power: Host has no preference (0x7f)
        Primary PHY: LE 1M (0x01)
        Secondary max skip: 0x00
        Secondary PHY: LE 1M (0x01)
        SID: 0x00
        Scan request notifications: Disabled (0x00)
> HCI Event: Command Complete (0x0e) plen 5                                                                          #38 5.218283
      LE Set Extended Advertising Parameters (0x08|0x0036) ncmd 1
        Status: Success (0x00)
        TX power (selected): 0 dbm (0x00)
zephyr.exe[1907049]: < HCI Command: LE Set Advertising Set Random Address (0x08|0x0035) plen 7                       #39 5.227387
        Advertising handle: 0x00
        Advertising random address: D5:B6:CC:31:DB:3B (Static)
> HCI Event: Command Complete (0x0e) plen 4                                                                          #40 5.227939
      LE Set Advertising Set Random Address (0x08|0x0035) ncmd 1
        Status: Success (0x00)
zephyr.exe[1907049]: < HCI Command: LE Set Extended Advertising Data (0x08|0x0037) plen 22                           #41 5.247408
        Handle: 0x00
        Operation: Complete extended advertising data (0x03)
        Fragment preference: Minimize fragmentation (0x01)
        Data length: 0x12
        Flags: 0x04
          BR/EDR Not Supported
        Name (complete): Tester_F6B11A
> HCI Event: Command Complete (0x0e) plen 4                                                                          #42 5.248099
      LE Set Extended Advertising Data (0x08|0x0037) ncmd 1
        Status: Success (0x00)
zephyr.exe[1907049]: < HCI Command: LE Set Extended Scan Response Data (0x08|0x0038) plen 4                          #43 5.267337
        Handle: 0x00
        Operation: Complete scan response data (0x03)
        Fragment preference: Minimize fragmentation (0x01)
        Data length: 0x00
> HCI Event: Command Complete (0x0e) plen 4                                                                          #44 5.267947
      LE Set Extended Scan Response Data (0x08|0x0038) ncmd 1
        Status: Success (0x00)
zephyr.exe[1907049]: < HCI Command: LE Set Extended Advertising Enable (0x08|0x0039) plen 6                          #45 5.287390
        Extended advertising: Enabled (0x01)
        Number of sets: 1 (0x01)
        Entry 0
          Handle: 0x00
          Duration: 0 ms (0x00)
          Max ext adv events: 0
> HCI Event: Command Complete (0x0e) plen 4                                                                          #46 5.287997
      LE Set Extended Advertising Enable (0x08|0x0039) ncmd 1
        Status: Success (0x00)
> HCI Event: LE Meta Event (0x3e) plen 31                                                                            #47 5.401057
      LE Enhanced Connection Complete (0x0a)
        Status: Success (0x00)
        Handle: 435
        Role: Peripheral (0x01)
        Peer address type: Public (0x00)
        Peer address: DF:A9:FF:F6:B1:1A (OUI DF-A9-FF)
        Local resolvable private address: 00:00:00:00:00:00 (Non-Resolvable)
        Peer resolvable private address: 00:00:00:00:00:00 (Non-Resolvable)
        Connection interval: 87.50 msec (0x0046)
        Connection latency: 0 (0x0000)
        Supervision timeout: 20000 msec (0x07d0)
        Central clock accuracy: 0x01
> HCI Event: LE Meta Event (0x3e) plen 6                                                                             #48 5.401207
      LE Advertising Set Terminated (0x12)
        Status: Success (0x00)
        Handle: 0
        Connection handle: 435
        Number of completed extended advertising events: 0
zephyr.exe[1907049]: < HCI Command: LE Read Remote Used Features (0x08|0x0016) plen 2                                #49 5.407821
        Handle: 435 Address: DF:A9:FF:F6:B1:1A (OUI DF-A9-FF)
> HCI Event: Command Status (0x0f) plen 4                                                                            #50 5.408303
      LE Read Remote Used Features (0x08|0x0016) ncmd 1
        Status: Success (0x00)
> HCI Event: LE Meta Event (0x3e) plen 12                                                                            #51 5.664937
      LE Read Remote Used Features (0x04)
        Status: Success (0x00)
        Handle: 435 Address: DF:A9:FF:F6:B1:1A (OUI DF-A9-FF)
        Features: 0x2d 0x49 0x00 0xf7 0x67 0xd8 0x00 0x00
          LE Encryption
          Extended Reject Indication
          Peripheral-initiated Features Exchange
          LE Data Packet Length Extension
          LE 2M PHY
          LE Coded PHY
          Channel Selection Algorithm #2
          Periodic Advertising Sync Transfer - Sender
          Periodic Advertising Sync Transfer - Recipient
          Sleep Clock Accuracy Updates
          Connected Isochronous Stream - Central
          Connected Isochronous Stream - Peripheral
          Isochronous Broadcaster
          Synchronized Receiver
          Connected Isochronous Stream (Host Support)
          LE Power Control Request
          LE Power Control Request
          Connection Subrating
          Connection Subrating (Host Support)
          Unknown features (0x0000d80000000000)
zephyr.exe[1907049]: < ACL Data TX: Handle 435 flags 0x00 dlen 16                                                   #52 10.417730
      LE L2CAP: Connection Parameter Update Request (0x12) ident 1 len 8
        Min interval: 24
        Max interval: 40
        Peripheral latency: 0
        Timeout multiplier: 42
> HCI Event: Number of Completed Packets (0x13) plen 5                                                              #53 10.564439
        Num handles: 1
        Handle: 435 Address: DF:A9:FF:F6:B1:1A (OUI DF-A9-FF)
        Count: 1
        #52: len 16 (0 Kb/s)
        Latency: 146 msec (146-146 msec ~146 msec)
> ACL Data RX: Handle 435 flags 0x02 dlen 10                                                                        #54 10.564835
      LE L2CAP: Connection Parameter Update Response (0x13) ident 1 len 2
        Result: Connection Parameters accepted (0x0000)
zephyr.exe[1907049]: < HCI Command: Host Number of Completed Packets (0x03|0x0035) plen 5                           #55 10.568130
        Num handles: 1
        Handle: 435 Address: DF:A9:FF:F6:B1:1A (OUI DF-A9-FF)
        Count: 1
> ACL Data RX: Handle 435 flags 0x02 dlen 11                                                                        #56 66.125359
      SMP: Pairing Request (0x01) len 6
        IO capability: KeyboardDisplay (0x04)
        OOB data: Authentication data not present (0x00)
        Authentication requirement: Bonding, No MITM, SC, No Keypresses (0x09)
        Max encryption key size: 16
        Initiator key distribution: EncKey IdKey Sign LinkKey (0x0f)
        Responder key distribution: EncKey IdKey Sign LinkKey (0x0f)
zephyr.exe[1907049]: < HCI Command: Host Number of Completed Packets (0x03|0x0035) plen 5                           #57 66.128648
        Num handles: 1
        Handle: 435 Address: DF:A9:FF:F6:B1:1A (OUI DF-A9-FF)
        Count: 1
zephyr.exe[1907049]: < ACL Data TX: Handle 435 flags 0x00 dlen 11                                                   #58 66.128861
      SMP: Pairing Response (0x02) len 6
        IO capability: KeyboardDisplay (0x04)
        OOB data: Authentication data not present (0x00)
        Authentication requirement: Bonding, No MITM, SC, No Keypresses (0x09)
        Max encryption key size: 16
        Initiator key distribution: IdKey (0x02)
        Responder key distribution: <none> (0x00)
> HCI Event: Number of Completed Packets (0x13) plen 5                                                              #59 66.300414
        Num handles: 1
        Handle: 435 Address: DF:A9:FF:F6:B1:1A (OUI DF-A9-FF)
        Count: 1
        #58: len 11 (0 Kb/s)
        Latency: 171 msec (146-171 msec ~159 msec)
> ACL Data RX: Handle 435 flags 0x02 dlen 27                                                                        #60 66.300805
> ACL Data RX: Handle 435 flags 0x01 dlen 27                                                                        #61 66.301252
> ACL Data RX: Handle 435 flags 0x01 dlen 15                                                                        #62 66.301614
      SMP: Pairing Public Key (0x0c) len 64
        X: 6f8c4e1d5e96b79dc48efa8a36f9ec1311f270e527f3fe35ca2f1d9310617be1
        Y: e0670b614077b82fa3d8f7a9da50f696d4873807471d0206dd2de57ae5ec3f7e
zephyr.exe[1907049]: < HCI Command: Host Number of Completed Packets (0x03|0x0035) plen 5                           #63 66.309072
        Num handles: 1
        Handle: 435 Address: DF:A9:FF:F6:B1:1A (OUI DF-A9-FF)
        Count: 1
zephyr.exe[1907049]: < HCI Command: Host Number of Completed Packets (0x03|0x0035) plen 5                           #64 66.309309
        Num handles: 1
        Handle: 435 Address: DF:A9:FF:F6:B1:1A (OUI DF-A9-FF)
        Count: 1
zephyr.exe[1907049]: < HCI Command: Host Number of Completed Packets (0x03|0x0035) plen 5                           #65 66.309590
        Num handles: 1
        Handle: 435 Address: DF:A9:FF:F6:B1:1A (OUI DF-A9-FF)
        Count: 1
zephyr.exe[1907049]: < ACL Data TX: Handle 435 flags 0x00 dlen 27                                                   #66 66.309847
zephyr.exe[1907049]: < ACL Data TX: Handle 435 flags 0x01 dlen 27                                                   #67 66.309865
zephyr.exe[1907049]: < ACL Data TX: Handle 435 flags 0x01 dlen 15                                                   #68 66.309869
      SMP: Pairing Public Key (0x0c) len 64
        X: 98308440221e2d910f0e54b71e7ec652857aa9b5a0dc65028824cc19db1226e9
        Y: 67a4816bcb62efb21701e31fdb27561a6217575fb007a8bbdabe7e28b6f68482
> HCI Event: Number of Completed Packets (0x13) plen 5                                                              #69 66.388383
        Num handles: 1
        Handle: 435 Address: DF:A9:FF:F6:B1:1A (OUI DF-A9-FF)
        Count: 1
        #66: len 27 (2 Kb/s)
        Latency: 78 msec (78-171 msec ~118 msec)
> HCI Event: Number of Completed Packets (0x13) plen 5                                                              #70 66.388925
        Num handles: 1
        Handle: 435 Address: DF:A9:FF:F6:B1:1A (OUI DF-A9-FF)
        Count: 1
        #67: len 27 (2 Kb/s)
        Latency: 79 msec (78-171 msec ~98 msec)
zephyr.exe[1907049]: < ACL Data TX: Handle 435 flags 0x00 dlen 21                                                   #71 66.408488
      SMP: Pairing Confirm (0x03) len 16
        Confim value: 073cc552abb84d32a3702c4a2b269a73
> HCI Event: Number of Completed Packets (0x13) plen 5                                                              #72 66.475066
        Num handles: 1
        Handle: 435 Address: DF:A9:FF:F6:B1:1A (OUI DF-A9-FF)
        Count: 1
        #68: len 15 (0 Kb/s)
        Latency: 165 msec (78-171 msec ~132 msec)
> HCI Event: Number of Completed Packets (0x13) plen 5                                                              #73 66.562909
        Num handles: 1
        Handle: 435 Address: DF:A9:FF:F6:B1:1A (OUI DF-A9-FF)
        Count: 1
        #71: len 21 (1 Kb/s)
        Latency: 154 msec (78-171 msec ~143 msec)
> ACL Data RX: Handle 435 flags 0x02 dlen 21                                                                        #74 66.563086
      SMP: Pairing Random (0x04) len 16
        Random value: 20b793150b5326450d2a7481d5cf5a23
zephyr.exe[1907049]: < HCI Command: Host Number of Completed Packets (0x03|0x0035) plen 5                           #75 66.568840
        Num handles: 1
        Handle: 435 Address: DF:A9:FF:F6:B1:1A (OUI DF-A9-FF)
        Count: 1
zephyr.exe[1907049]: < ACL Data TX: Handle 435 flags 0x00 dlen 21                                                   #76 66.568949
      SMP: Pairing Random (0x04) len 16
        Random value: 8e6108f966a694cbe26df70bb96773e6
> HCI Event: Number of Completed Packets (0x13) plen 5                                                              #77 66.737732
        Num handles: 1
        Handle: 435 Address: DF:A9:FF:F6:B1:1A (OUI DF-A9-FF)
        Count: 1
        #76: len 21 (1 Kb/s)
        Latency: 168 msec (78-171 msec ~156 msec)
> ACL Data RX: Handle 435 flags 0x02 dlen 21                                                                        #78 66.738085
      SMP: Pairing DHKey Check (0x0d) len 16
        E: 068cc106a9fc63c8993ba14a0eec2a96
zephyr.exe[1907049]: < HCI Command: Host Number of Completed Packets (0x03|0x0035) plen 5                           #79 66.749263
        Num handles: 1
        Handle: 435 Address: DF:A9:FF:F6:B1:1A (OUI DF-A9-FF)
        Count: 1
zephyr.exe[1907049]: < ACL Data TX: Handle 435 flags 0x00 dlen 21                                                   #80 66.749385
      SMP: Pairing DHKey Check (0x0d) len 16
        E: 177e49cba07b009c4e09831b0c7e5460
> HCI Event: Number of Completed Packets (0x13) plen 5                                                              #81 66.912634
        Num handles: 1
        Handle: 435 Address: DF:A9:FF:F6:B1:1A (OUI DF-A9-FF)
        Count: 1
        #80: len 21 (1 Kb/s)
        Latency: 163 msec (78-171 msec ~159 msec)
> HCI Event: LE Meta Event (0x3e) plen 13                                                                           #82 67.000636
      LE Long Term Key Request (0x05)
        Handle: 435 Address: DF:A9:FF:F6:B1:1A (OUI DF-A9-FF)
        Random number: 0x0000000000000000
        Encrypted diversifier: 0x0000
zephyr.exe[1907049]: < HCI Command: LE Long Term Key Request Reply (0x08|0x001a) plen 18                            #83 67.008513
        Handle: 435 Address: DF:A9:FF:F6:B1:1A (OUI DF-A9-FF)
        Long term key: d73e6db34daaaf745f9b2c9d7786ac97
> HCI Event: Command Complete (0x0e) plen 6                                                                         #84 67.009361
      LE Long Term Key Request Reply (0x08|0x001a) ncmd 1
        Status: Success (0x00)
        Handle: 435 Address: DF:A9:FF:F6:B1:1A (OUI DF-A9-FF)
> HCI Event: Encryption Change (0x08) plen 4                                                                        #85 67.437897
        Status: Success (0x00)
        Handle: 435 Address: DF:A9:FF:F6:B1:1A (OUI DF-A9-FF)
        Encryption: Enabled with AES-CCM (0x01)
> ACL Data RX: Handle 435 flags 0x02 dlen 21                                                                        #86 67.525454
      SMP: Identity Information (0x08) len 16
        Identity resolving key: 6cf0d45ffcfbbc186cdd142739e03843
zephyr.exe[1907049]: < HCI Command: Host Number of Completed Packets (0x03|0x0035) plen 5                           #87 67.558160
        Num handles: 1
        Handle: 435 Address: DF:A9:FF:F6:B1:1A (OUI DF-A9-FF)
        Count: 1
> ACL Data RX: Handle 435 flags 0x02 dlen 12                                                                        #88 67.612756
      SMP: Identity Address Information (0x09) len 7
        Address: DF:A9:FF:F6:B1:1A (OUI DF-A9-FF)
zephyr.exe[1907049]: < HCI Command: LE Add Device To Resolving List (0x08|0x0027) plen 39                           #89 67.628398
        Address type: Public (0x00)
        Address: DF:A9:FF:F6:B1:1A (OUI DF-A9-FF)
        Peer identity resolving key: 6cf0d45ffcfbbc186cdd142739e03843
        Local identity resolving key: 00000000000000000000000000000000
> HCI Event: Command Complete (0x0e) plen 4                                                                         #90 67.629372
      LE Add Device To Resolving List (0x08|0x0027) ncmd 1
        Status: Success (0x00)
zephyr.exe[1907049]: < HCI Command: LE Set Privacy Mode (0x08|0x004e) plen 8                                        #91 67.648244
        Peer Identity address type: Public (0x00)
        Peer Identity address: DF:A9:FF:F6:B1:1A (OUI DF-A9-FF)
        Privacy Mode: Use Device Privacy (0x01)
> HCI Event: Command Complete (0x0e) plen 4                                                                         #92 67.648807
      LE Set Privacy Mode (0x08|0x004e) ncmd 1
        Status: Success (0x00)
zephyr.exe[1907049]: < HCI Command: LE Set Address Resolution Enable (0x08|0x002d) plen 1                           #93 67.668497
        Address resolution: Enabled (0x01)
> HCI Event: Command Complete (0x0e) plen 4                                                                         #94 67.668989
      LE Set Address Resolution Enable (0x08|0x002d) ncmd 1
        Status: Success (0x00)
zephyr.exe[1907049]: < HCI Command: Host Number of Completed Packets (0x03|0x0035) plen 5                           #95 67.688437
        Num handles: 1
        Handle: 435 Address: DF:A9:FF:F6:B1:1A (OUI DF-A9-FF)
        Count: 1
> HCI Event: Disconnect Complete (0x05) plen 4                                                                      #96 68.662841
        Status: Success (0x00)
        Handle: 435 Address: DF:A9:FF:F6:B1:1A (OUI DF-A9-FF)
        Reason: Remote User Terminated Connection (0x13)
zephyr.exe[1907049]: < HCI Command: LE Set Extended Advertising Parameters (0x08|0x0036) plen 25                    #97 69.348164
        Handle: 0x00
        Properties: 0x0013
          Connectable
          Scannable
          Use legacy advertising PDUs: ADV_IND
        Min advertising interval: 100.000 msec (0x00a0)
        Max advertising interval: 150.000 msec (0x00f0)
        Channel map: 37, 38, 39 (0x07)
        Own address type: Random (0x01)
        Peer address type: Public (0x00)
        Peer address: 00:00:00:00:00:00 (OUI 00-00-00)
        Filter policy: Allow Scan Request from Any, Allow Connect Request from Any (0x00)
        TX power: Host has no preference (0x7f)
        Primary PHY: LE 1M (0x01)
        Secondary max skip: 0x00
        Secondary PHY: LE 1M (0x01)
        SID: 0x00
        Scan request notifications: Disabled (0x00)
> HCI Event: Command Complete (0x0e) plen 5                                                                         #98 69.348887
      LE Set Extended Advertising Parameters (0x08|0x0036) ncmd 1
        Status: Success (0x00)
        TX power (selected): 0 dbm (0x00)
zephyr.exe[1907049]: < HCI Command: LE Set Advertising Set Random Address (0x08|0x0035) plen 7                      #99 69.368118
        Advertising handle: 0x00
        Advertising random address: D5:B6:CC:31:DB:3B (Static)
> HCI Event: Command Complete (0x0e) plen 4                                                                        #100 69.368639
      LE Set Advertising Set Random Address (0x08|0x0035) ncmd 1
        Status: Success (0x00)
zephyr.exe[1907049]: < HCI Command: LE Set Extended Advertising Data (0x08|0x0037) plen 22                         #101 69.388122
        Handle: 0x00
        Operation: Complete extended advertising data (0x03)
        Fragment preference: Minimize fragmentation (0x01)
        Data length: 0x12
        Flags: 0x04
          BR/EDR Not Supported
        Name (complete): Tester_F6B11A
> HCI Event: Command Complete (0x0e) plen 4                                                                        #102 69.388880
      LE Set Extended Advertising Data (0x08|0x0037) ncmd 1
        Status: Success (0x00)
zephyr.exe[1907049]: < HCI Command: LE Set Extended Scan Response Data (0x08|0x0038) plen 4                        #103 69.408112
        Handle: 0x00
        Operation: Complete scan response data (0x03)
        Fragment preference: Minimize fragmentation (0x01)
        Data length: 0x00
> HCI Event: Command Complete (0x0e) plen 4                                                                        #104 69.408618
      LE Set Extended Scan Response Data (0x08|0x0038) ncmd 1
        Status: Success (0x00)
zephyr.exe[1907049]: < HCI Command: LE Set Extended Advertising Enable (0x08|0x0039) plen 6                        #105 69.428127
        Extended advertising: Enabled (0x01)
        Number of sets: 1 (0x01)
        Entry 0
          Handle: 0x00
          Duration: 0 ms (0x00)
          Max ext adv events: 0
> HCI Event: Command Complete (0x0e) plen 4                                                                        #106 69.428692
      LE Set Extended Advertising Enable (0x08|0x0039) ncmd 1
        Status: Success (0x00)
> HCI Event: LE Meta Event (0x3e) plen 31                                                                          #107 69.743478
      LE Enhanced Connection Complete (0x0a)
        Status: Success (0x00)
        Handle: 453
        Role: Peripheral (0x01)
        Peer address type: Public (0x00)
        Peer address: DF:A9:FF:F6:B1:1A (OUI DF-A9-FF)
        Local resolvable private address: 00:00:00:00:00:00 (Non-Resolvable)
        Peer resolvable private address: 00:00:00:00:00:00 (Non-Resolvable)
        Connection interval: 87.50 msec (0x0046)
        Connection latency: 0 (0x0000)
        Supervision timeout: 20000 msec (0x07d0)
        Central clock accuracy: 0x01
> HCI Event: LE Meta Event (0x3e) plen 6                                                                           #108 69.743567
      LE Advertising Set Terminated (0x12)
        Status: Success (0x00)
        Handle: 0
        Connection handle: 453
        Number of completed extended advertising events: 0
zephyr.exe[1907049]: < HCI Command: LE Read Remote Used Features (0x08|0x0016) plen 2                              #109 69.748498
        Handle: 453 Address: DF:A9:FF:F6:B1:1A (OUI DF-A9-FF)
> HCI Event: Command Status (0x0f) plen 4                                                                          #110 69.748966
      LE Read Remote Used Features (0x08|0x0016) ncmd 1
        Status: Success (0x00)
> HCI Event: LE Meta Event (0x3e) plen 12                                                                          #111 70.007427
      LE Read Remote Used Features (0x04)
        Status: Success (0x00)
        Handle: 453 Address: DF:A9:FF:F6:B1:1A (OUI DF-A9-FF)
        Features: 0x2d 0x49 0x00 0xf7 0x67 0xd8 0x00 0x00
          LE Encryption
          Extended Reject Indication
          Peripheral-initiated Features Exchange
          LE Data Packet Length Extension
          LE 2M PHY
          LE Coded PHY
          Channel Selection Algorithm #2
          Periodic Advertising Sync Transfer - Sender
          Periodic Advertising Sync Transfer - Recipient
          Sleep Clock Accuracy Updates
          Connected Isochronous Stream - Central
          Connected Isochronous Stream - Peripheral
          Isochronous Broadcaster
          Synchronized Receiver
          Connected Isochronous Stream (Host Support)
          LE Power Control Request
          LE Power Control Request
          Connection Subrating
          Connection Subrating (Host Support)
          Unknown features (0x0000d80000000000)
zephyr.exe[1907049]: < ACL Data TX: Handle 453 flags 0x00 dlen 7                                                   #112 70.468724
      ATT: Read Request (0x0a) len 2
        Handle: 0x0007
> HCI Event: Number of Completed Packets (0x13) plen 5                                                             #113 70.619517
        Num handles: 1
        Handle: 453 Address: DF:A9:FF:F6:B1:1A (OUI DF-A9-FF)
        Count: 1
        #112: len 7 (0 Kb/s)
        Latency: 150 msec (150-150 msec ~150 msec)
> ACL Data RX: Handle 453 flags 0x02 dlen 9                                                                        #114 70.619739
      ATT: Error Response (0x01) len 4
        Read Request (0x0a)
        Handle: 0x0007
        Error: Insufficient Authentication (0x05)
> ACL Data RX: Handle 453 flags 0x02 dlen 11                                                                       #115 70.620048
      SMP: Pairing Request (0x01) len 6
        IO capability: KeyboardDisplay (0x04)
        OOB data: Authentication data not present (0x00)
        Authentication requirement: Bonding, No MITM, SC, No Keypresses (0x09)
        Max encryption key size: 16
        Initiator key distribution: EncKey IdKey Sign LinkKey (0x0f)
        Responder key distribution: EncKey IdKey Sign LinkKey (0x0f)
zephyr.exe[1907049]: < HCI Command: Host Number of Completed Packets (0x03|0x0035) plen 5                          #116 70.628210
        Num handles: 1
        Handle: 453 Address: DF:A9:FF:F6:B1:1A (OUI DF-A9-FF)
        Count: 1
zephyr.exe[1907049]: < HCI Command: Host Number of Completed Packets (0x03|0x0035) plen 5                          #117 70.628422
        Num handles: 1
        Handle: 453 Address: DF:A9:FF:F6:B1:1A (OUI DF-A9-FF)
        Count: 1
zephyr.exe[1907049]: < ACL Data TX: Handle 453 flags 0x00 dlen 11                                                  #118 70.628446
      SMP: Pairing Response (0x02) len 6
        IO capability: KeyboardDisplay (0x04)
        OOB data: Authentication data not present (0x00)
        Authentication requirement: Bonding, No MITM, SC, No Keypresses (0x09)
        Max encryption key size: 16
        Initiator key distribution: IdKey (0x02)
        Responder key distribution: <none> (0x00)
> HCI Event: Number of Completed Packets (0x13) plen 5                                                             #119 70.794803
        Num handles: 1
        Handle: 453 Address: DF:A9:FF:F6:B1:1A (OUI DF-A9-FF)
        Count: 1
        #118: len 11 (0 Kb/s)
        Latency: 166 msec (150-166 msec ~158 msec)
> ACL Data RX: Handle 453 flags 0x02 dlen 27                                                                       #120 70.795095
> ACL Data RX: Handle 453 flags 0x01 dlen 27                                                                       #121 70.795525
> ACL Data RX: Handle 453 flags 0x01 dlen 15                                                                       #122 70.796026
      SMP: Pairing Public Key (0x0c) len 64
        X: b120c76eba36d45e0fa29d3e37c19988ad64f376832f104ab9c250599b904c86
        Y: 700230433a454bd5788542a7b4b358541d2d58952fc28378916562bb1217ed95
zephyr.exe[1907049]: < HCI Command: Host Number of Completed Packets (0x03|0x0035) plen 5                          #123 70.809123
        Num handles: 1
        Handle: 453 Address: DF:A9:FF:F6:B1:1A (OUI DF-A9-FF)
        Count: 1
zephyr.exe[1907049]: < HCI Command: Host Number of Completed Packets (0x03|0x0035) plen 5                          #124 70.809386
        Num handles: 1
        Handle: 453 Address: DF:A9:FF:F6:B1:1A (OUI DF-A9-FF)
        Count: 1
zephyr.exe[1907049]: < HCI Command: Host Number of Completed Packets (0x03|0x0035) plen 5                          #125 70.809628
        Num handles: 1
        Handle: 453 Address: DF:A9:FF:F6:B1:1A (OUI DF-A9-FF)
        Count: 1
zephyr.exe[1907049]: < ACL Data TX: Handle 453 flags 0x00 dlen 27                                                  #126 70.809813
zephyr.exe[1907049]: < ACL Data TX: Handle 453 flags 0x01 dlen 27                                                  #127 70.809832
zephyr.exe[1907049]: < ACL Data TX: Handle 453 flags 0x01 dlen 15                                                  #128 70.809836
      SMP: Pairing Public Key (0x0c) len 64
        X: 98308440221e2d910f0e54b71e7ec652857aa9b5a0dc65028824cc19db1226e9
        Y: 67a4816bcb62efb21701e31fdb27561a6217575fb007a8bbdabe7e28b6f68482
> HCI Event: Number of Completed Packets (0x13) plen 5                                                             #129 70.882589
        Num handles: 1
        Handle: 453 Address: DF:A9:FF:F6:B1:1A (OUI DF-A9-FF)
        Count: 1
        #126: len 27 (3 Kb/s)
        Latency: 72 msec (72-166 msec ~115 msec)
> HCI Event: Number of Completed Packets (0x13) plen 5                                                             #130 70.883317
        Num handles: 1
        Handle: 453 Address: DF:A9:FF:F6:B1:1A (OUI DF-A9-FF)
        Count: 1
        #127: len 27 (2 Kb/s)
        Latency: 73 msec (72-166 msec ~94 msec)
zephyr.exe[1907049]: < ACL Data TX: Handle 453 flags 0x00 dlen 21                                                  #131 70.888189
      SMP: Pairing Confirm (0x03) len 16
        Confim value: 80e6b5f9ba7240b7763fbd1fa5534d7c
> HCI Event: Number of Completed Packets (0x13) plen 5                                                             #132 70.969433
        Num handles: 1
        Handle: 453 Address: DF:A9:FF:F6:B1:1A (OUI DF-A9-FF)
        Count: 1
        #128: len 15 (0 Kb/s)
        Latency: 159 msec (72-166 msec ~127 msec)
> HCI Event: Number of Completed Packets (0x13) plen 5                                                             #133 71.057144
        Num handles: 1
        Handle: 453 Address: DF:A9:FF:F6:B1:1A (OUI DF-A9-FF)
        Count: 1
        #131: len 21 (1 Kb/s)
        Latency: 168 msec (72-168 msec ~148 msec)
> ACL Data RX: Handle 453 flags 0x02 dlen 21                                                                       #134 71.057593
      SMP: Pairing Random (0x04) len 16
        Random value: f881cfc75b4276c93f4dc01e4da5d173
zephyr.exe[1907049]: < HCI Command: Host Number of Completed Packets (0x03|0x0035) plen 5                          #135 71.068641
        Num handles: 1
        Handle: 453 Address: DF:A9:FF:F6:B1:1A (OUI DF-A9-FF)
        Count: 1
zephyr.exe[1907049]: < ACL Data TX: Handle 453 flags 0x00 dlen 21                                                  #136 71.068711
      SMP: Pairing Random (0x04) len 16
        Random value: 5da095555cc64d02679f89a05211af56
> HCI Event: Number of Completed Packets (0x13) plen 5                                                             #137 71.232211
        Num handles: 1
        Handle: 453 Address: DF:A9:FF:F6:B1:1A (OUI DF-A9-FF)
        Count: 1
        #136: len 21 (1 Kb/s)
        Latency: 163 msec (72-168 msec ~155 msec)
> ACL Data RX: Handle 453 flags 0x02 dlen 21                                                                       #138 71.232474
      SMP: Pairing DHKey Check (0x0d) len 16
        E: e61be948d45c6a041718d263e707e87d
zephyr.exe[1907049]: < HCI Command: Host Number of Completed Packets (0x03|0x0035) plen 5                          #139 71.249157
        Num handles: 1
        Handle: 453 Address: DF:A9:FF:F6:B1:1A (OUI DF-A9-FF)
        Count: 1
zephyr.exe[1907049]: < ACL Data TX: Handle 453 flags 0x00 dlen 21                                                  #140 71.249282
      SMP: Pairing DHKey Check (0x0d) len 16
        E: 14129ee5fd64f0918f81111634094354
> HCI Event: Number of Completed Packets (0x13) plen 5                                                             #141 71.406939
        Num handles: 1
        Handle: 453 Address: DF:A9:FF:F6:B1:1A (OUI DF-A9-FF)
        Count: 1
        #140: len 21 (1 Kb/s)
        Latency: 157 msec (72-168 msec ~156 msec)
> HCI Event: LE Meta Event (0x3e) plen 13                                                                          #142 71.495052
      LE Long Term Key Request (0x05)
        Handle: 453 Address: DF:A9:FF:F6:B1:1A (OUI DF-A9-FF)
        Random number: 0x0000000000000000
        Encrypted diversifier: 0x0000
zephyr.exe[1907049]: < HCI Command: LE Long Term Key Request Reply (0x08|0x001a) plen 18                           #143 71.508532
        Handle: 453 Address: DF:A9:FF:F6:B1:1A (OUI DF-A9-FF)
        Long term key: e5c7e92df1cc7e2115d9f7d76865c2cd
> HCI Event: Command Complete (0x0e) plen 6                                                                        #144 71.509232
      LE Long Term Key Request Reply (0x08|0x001a) ncmd 1
        Status: Success (0x00)
        Handle: 453 Address: DF:A9:FF:F6:B1:1A (OUI DF-A9-FF)
> HCI Event: Encryption Change (0x08) plen 4                                                                       #145 71.932291
        Status: Success (0x00)
        Handle: 453 Address: DF:A9:FF:F6:B1:1A (OUI DF-A9-FF)
        Encryption: Enabled with AES-CCM (0x01)
zephyr.exe[1907049]: < HCI Command: LE Set Address Resolution Enable (0x08|0x002d) plen 1                          #146 71.948161
        Address resolution: Disabled (0x00)
> HCI Event: Command Complete (0x0e) plen 4                                                                        #147 71.948675
      LE Set Address Resolution Enable (0x08|0x002d) ncmd 1
        Status: Success (0x00)
zephyr.exe[1907049]: < HCI Command: LE Remove Device From Resolving List (0x08|0x0028) plen 7                      #148 71.968203
        Address type: Public (0x00)
        Address: DF:A9:FF:F6:B1:1A (OUI DF-A9-FF)
> HCI Event: Command Complete (0x0e) plen 4                                                                        #149 71.968848
      LE Remove Device From Resolving List (0x08|0x0028) ncmd 1
        Status: Success (0x00)
> ACL Data RX: Handle 453 flags 0x02 dlen 21                                                                       #150 72.019854
      SMP: Identity Information (0x08) len 16
        Identity resolving key: 6cf0d45ffcfbbc186cdd142739e03843
zephyr.exe[1907049]: < HCI Command: Host Number of Completed Packets (0x03|0x0035) plen 5                          #151 72.098405
        Num handles: 1
        Handle: 453 Address: DF:A9:FF:F6:B1:1A (OUI DF-A9-FF)
        Count: 1
> ACL Data RX: Handle 453 flags 0x02 dlen 12                                                                       #152 72.107150
      SMP: Identity Addre