Bluetooth monitor ver 5.72
= Note: Linux version 6.14.0-36-generic (x86_64)                       0.692755
= Note: Bluetooth subsystem version 2.22                               0.692757
= New Index: 00:00:00:00:00:00 (Primary,UART,hci1)              [hci1] 0.692758
= New Index: 48:5F:99:8E:E0:64 (Primary,USB,hci0)               [hci0] 0.692759
= Open Index: 00:00:00:00:00:00                                 [hci1] 1.206795
= Index Info: 00:00:00:00:00:00 (Nordic Semiconductor ASA)      [hci1] 1.206805
@ USER Open: main (privileged) version 2.22            {0x0001} [hci1] 1.206811
< HCI Command: Reset (0x03|0x0003) plen 0                    #1 [hci1] 1.207773
> HCI Event: Command Complete (0x0e) plen 4                  #2 [hci1] 1.208257
      Reset (0x03|0x0003) ncmd 1
        Status: Success (0x00)
< HCI Command: Read Local Supported... (0x04|0x0003) plen 0  #3 [hci1] 1.226637
> HCI Event: Command Complete (0x0e) plen 12                 #4 [hci1] 1.227247
      Read Local Supported Features (0x04|0x0003) ncmd 1
        Status: Success (0x00)
        Features: 0x00 0x00 0x00 0x00 0x60 0x00 0x00 0x00
          BR/EDR Not Supported
          LE Supported (Controller)
< HCI Command: Read Local Version In.. (0x04|0x0001) plen 0  #5 [hci1] 1.246463
> HCI Event: Command Complete (0x0e) plen 12                 #6 [hci1] 1.247088
      Read Local Version Information (0x04|0x0001) ncmd 1
        Status: Success (0x00)
        HCI version: Reserved (0x0f) - Revision 12393 (0x3069)
        LMP version: Reserved (0x0f) - Subversion 12393 (0x3069)
        Manufacturer: Nordic Semiconductor ASA (89)
< HCI Command: Read Local Supported... (0x04|0x0002) plen 0  #7 [hci1] 1.266410
> HCI Event: Command Complete (0x0e) plen 68                 #8 [hci1] 1.267445
      Read Local Supported Commands (0x04|0x0002) ncmd 1
        Status: Success (0x00)
        Commands: 119 entries
          Disconnect (Octet 0 - Bit 5)
          Read Remote Version Information (Octet 2 - Bit 7)
          Set Event Mask (Octet 5 - Bit 6)
          Reset (Octet 5 - Bit 7)
          Read Connection Accept Timeout (Octet 7 - Bit 2)
          Write Connection Accept Timeout (Octet 7 - Bit 3)
          Read Transmit Power Level (Octet 10 - Bit 2)
          Set Controller To Host Flow Control (Octet 10 - Bit 5)
          Host Buffer Size (Octet 10 - Bit 6)
          Host Number of Completed Packets (Octet 10 - Bit 7)
          Read Local Version Information (Octet 14 - Bit 3)
          Read Local Supported Features (Octet 14 - Bit 5)
          Read BD ADDR (Octet 15 - Bit 1)
          Read RSSI (Octet 15 - Bit 5)
          Set Event Mask Page 2 (Octet 22 - Bit 2)
          LE Set Event Mask (Octet 25 - Bit 0)
          LE Read Buffer Size (Octet 25 - Bit 1)
          LE Read Local Supported Features (Octet 25 - Bit 2)
          LE Set Random Address (Octet 25 - Bit 4)
          LE Set Advertising Parameters (Octet 25 - Bit 5)
          LE Read Advertising Channel TX Power (Octet 25 - Bit 6)
          LE Set Advertising Data (Octet 25 - Bit 7)
          LE Set Scan Response Data (Octet 26 - Bit 0)
          LE Set Advertise Enable (Octet 26 - Bit 1)
          LE Set Scan Parameters (Octet 26 - Bit 2)
          LE Set Scan Enable (Octet 26 - Bit 3)
          LE Create Connection (Octet 26 - Bit 4)
          LE Create Connection Cancel (Octet 26 - Bit 5)
          LE Read Accept List Size (Octet 26 - Bit 6)
          LE Clear Accept List (Octet 26 - Bit 7)
          LE Add Device To Accept List (Octet 27 - Bit 0)
          LE Remove Device From Accept List (Octet 27 - Bit 1)
          LE Connection Update (Octet 27 - Bit 2)
          LE Set Host Channel Classification (Octet 27 - Bit 3)
          LE Read Channel Map (Octet 27 - Bit 4)
          LE Read Remote Used Features (Octet 27 - Bit 5)
          LE Encrypt (Octet 27 - Bit 6)
          LE Rand (Octet 27 - Bit 7)
          LE Start Encryption (Octet 28 - Bit 0)
          LE Long Term Key Request Reply (Octet 28 - Bit 1)
          LE Long Term Key Request Neg Reply (Octet 28 - Bit 2)
          LE Read Supported States (Octet 28 - Bit 3)
          LE Receiver Test (Octet 28 - Bit 4)
          LE Transmitter Test (Octet 28 - Bit 5)
          LE Test End (Octet 28 - Bit 6)
          Read Authenticated Payload Timeout (Octet 32 - Bit 4)
          Write Authenticated Payload Timeout (Octet 32 - Bit 5)
          LE Set Data Length (Octet 33 - Bit 6)
          LE Read Suggested Default Data Length (Octet 33 - Bit 7)
          LE Write Suggested Default Data Length (Octet 34 - Bit 0)
          LE Add Device To Resolving List (Octet 34 - Bit 3)
          LE Remove Device From Resolving List (Octet 34 - Bit 4)
          LE Clear Resolving List (Octet 34 - Bit 5)
          LE Read Resolving List Size (Octet 34 - Bit 6)
          LE Set Address Resolution Enable (Octet 35 - Bit 1)
          LE Set Resolvable Private Address Timeout (Octet 35 - Bit 2)
          LE Read Maximum Data Length (Octet 35 - Bit 3)
          LE Read PHY (Octet 35 - Bit 4)
          LE Set Default PHY (Octet 35 - Bit 5)
          LE Set PHY (Octet 35 - Bit 6)
          LE Enhanced Receiver Test (Octet 35 - Bit 7)
          LE Enhanced Transmitter Test (Octet 36 - Bit 0)
          LE Set Advertising Set Random Address (Octet 36 - Bit 1)
          LE Set Extended Advertising Parameters (Octet 36 - Bit 2)
          LE Set Extended Advertising Data (Octet 36 - Bit 3)
          LE Set Extended Scan Response Data (Octet 36 - Bit 4)
          LE Set Extended Advertising Enable (Octet 36 - Bit 5)
          LE Read Maximum Advertising Data Length (Octet 36 - Bit 6)
          LE Read Number of Supported Advertising Sets (Octet 36 - Bit 7)
          LE Remove Advertising Set (Octet 37 - Bit 0)
          LE Clear Advertising Sets (Octet 37 - Bit 1)
          LE Set Periodic Advertising Parameters (Octet 37 - Bit 2)
          LE Set Periodic Advertising Data (Octet 37 - Bit 3)
          LE Set Periodic Advertising Enable (Octet 37 - Bit 4)
          LE Set Extended Scan Parameters (Octet 37 - Bit 5)
          LE Set Extended Scan Enable (Octet 37 - Bit 6)
          LE Extended Create Connection (Octet 37 - Bit 7)
          LE Periodic Advertising Create Sync (Octet 38 - Bit 0)
          LE Periodic Advertising Create Sync Cancel (Octet 38 - Bit 1)
          LE Periodic Advertising Terminate Sync (Octet 38 - Bit 2)
          LE Add Device To Periodic Advertiser List (Octet 38 - Bit 3)
          LE Remove Device From Periodic Advertiser List (Octet 38 - Bit 4)
          LE Clear Periodic Advertiser List (Octet 38 - Bit 5)
          LE Read Periodic Advertiser List Size (Octet 38 - Bit 6)
          LE Read Transmit Power (Octet 38 - Bit 7)
          LE Read RF Path Compensation (Octet 39 - Bit 0)
          LE Write RF Path Compensation (Octet 39 - Bit 1)
          LE Set Privacy Mode (Octet 39 - Bit 2)
          LE Periodic Advertising Receive Enable (Octet 40 - Bit 5)
          LE Periodic Advertising Sync Transfer (Octet 40 - Bit 6)
          LE Periodic Advertising Set Info Transfer (Octet 40 - Bit 7)
          LE Periodic Advertising Sync Transfer Parameters (Octet 41 - Bit 0)
          LE Set Default Periodic Advertisng Sync Transfer Parameters (Octet 41 - Bit 1)
          LE Read Buffer v2 (Octet 41 - Bit 5)
          LE Read ISO TX Sync (Octet 41 - Bit 6)
          LE Set Connected Isochronous Group Parameters (Octet 41 - Bit 7)
          LE Set Connected Isochronous Group Parameters Test (Octet 42 - Bit 0)
          LE Create Connected Isochronous Stream (Octet 42 - Bit 1)
          LE Remove Connected Isochronous Group (Octet 42 - Bit 2)
          LE Accept Connected Isochronous Stream Request (Octet 42 - Bit 3)
          LE Reject Connected Isochronous Stream Request (Octet 42 - Bit 4)
          LE Create Broadcast Isochronous Group (Octet 42 - Bit 5)
          LE Create Broadcast Isochronous Group Test (Octet 42 - Bit 6)
          LE Terminate Broadcast Isochronous Group (Octet 42 - Bit 7)
          LE Broadcast Isochronous Group Create Sync (Octet 43 - Bit 0)
          LE Broadcast Isochronous Group Terminate Sync (Octet 43 - Bit 1)
          LE Request Peer SCA (Octet 43 - Bit 2)
          LE Setup Isochronous Data Path (Octet 43 - Bit 3)
          LE Remove Isochronous Data Path (Octet 43 - Bit 4)
          LE Isochronous Transmit Test (Octet 43 - Bit 5)
          LE Isochronous Receive Test (Octet 43 - Bit 6)
          LE Isochronous Read Test Counters (Octet 43 - Bit 7)
          LE Isochronous Read Test Counters (Octet 44 - Bit 0)
          LE Set Host Feature (Octet 44 - Bit 1)
          Octet 44 - Bit 2 
          Octet 45 - Bit 6 
          Octet 46 - Bit 0 
          Octet 46 - Bit 1 
          Octet 46 - Bit 2 
< HCI Command: Host Buffer Size (0x03|0x0033) plen 7         #9 [hci1] 1.286383
        ACL MTU: 255  ACL max packet: 16
        SCO MTU: 0    SCO max packet: 0
> HCI Event: Command Complete (0x0e) plen 4                 #10 [hci1] 1.286970
      Host Buffer Size (0x03|0x0033) ncmd 1
        Status: Success (0x00)
< HCI Command: Set Controller To Ho.. (0x03|0x0031) plen 1  #11 [hci1] 1.306378
        Flow control: ACL Data Packets (0x01)
> HCI Event: Command Complete (0x0e) plen 4                 #12 [hci1] 1.306857
      Set Controller To Host Flow Control (0x03|0x0031) ncmd 1
        Status: Success (0x00)
< HCI Command: LE Read Local Suppor.. (0x08|0x0003) plen 0  #13 [hci1] 1.326375
> HCI Event: Command Complete (0x0e) plen 12                #14 [hci1] 1.326906
      LE Read Local Supported Features (0x08|0x0003) ncmd 1
        Status: Success (0x00)
        Features: 0xfd 0x79 0x00 0xf7 0x30 0x01 0x00 0x00
          LE Encryption
          Extended Reject Indication
          Peripheral-initiated Features Exchange
          LE Ping
          LE Data Packet Length Extension
          LL Privacy
          Extended Scanner Filter Policies
          LE 2M PHY
          LE Coded PHY
          LE Extended Advertising
          LE Periodic Advertising
          Channel Selection Algorithm #2
          Periodic Advertising Sync Transfer - Sender
          Periodic Advertising Sync Transfer - Recipient
          Sleep Clock Accuracy Updates
          Connected Isochronous Stream - Central
          Connected Isochronous Stream - Peripheral
          Isochronous Broadcaster
          Synchronized Receiver
          Periodic Advertising ADI support
          Connection Subrating
          Unknown features (0x0000010000000000)
< HCI Command: LE Set Host Feature (0x08|0x0074) plen 2     #15 [hci1] 1.346360
        Bit Number: 32
          Connected Isochronous Stream (Host Support)
        Bit Value: 1
> HCI Event: Command Complete (0x0e) plen 4                 #16 [hci1] 1.346851
      LE Set Host Feature (0x08|0x0074) ncmd 1
        Status: Success (0x00)
< HCI Command: LE Read Buffer v2 (0x08|0x0060) plen 0       #17 [hci1] 1.366380
> HCI Event: Command Complete (0x0e) plen 10                #18 [hci1] 1.366864
      LE Read Buffer v2 (0x08|0x0060) ncmd 1
        Status: Success (0x00)
        ACL MTU: 27
        ACL max packet: 3
        ISO MTU: 318
        ISO max packet: 3
< HCI Command: LE Read Maximum Adve.. (0x08|0x003a) plen 0  #19 [hci1] 1.386408
> HCI Event: Command Complete (0x0e) plen 6                 #20 [hci1] 1.386845
      LE Read Maximum Advertising Data Length (0x08|0x003a) ncmd 1
        Status: Success (0x00)
        Max length: 1650
< HCI Command: LE Read Supported St.. (0x08|0x001c) plen 0  #21 [hci1] 1.406382
> HCI Event: Command Complete (0x0e) plen 12                #22 [hci1] 1.406943
      LE Read Supported States (0x08|0x001c) ncmd 1
        Status: Success (0x00)
        States: 0x000003ff3e0306ff
          Non-connectable Advertising State
          Scannable Advertising State
          Connectable Advertising State
          High Duty Cycle Directed Advertising State
          Passive Scanning State
          Active Scanning State
          Initiating State
            and Connection State (Central Role)
          Connection State (Peripheral Role)
          Scannable Advertising State
            and Passive Scanning State
          Connectable Advertising State
            and Passive Scanning State
          Non-connectable Advertising State
            and Initiating State
          Scannable Advertising State
            and Initiating State
          Active Scanning State
            and Connection State (Central Role)
          Passive Scanning State
            and Connection State (Peripheral Role)
          Active Scanning State
            and Connection State (Peripheral Role)
          Initiating State
            and Connection State (Central Role)
            and Central Role & Central Role
          Low Duty Cycle Directed Advertising State
          Connectable Advertising State
            and Initiating State
            and Central Role & Peripheral Role
          High Duty Cycle Directed Advertising State
            and Initiating State
            and Central Role & Peripheral Role
          Low Duty Cycle Directed Advertising State
            and Initiating State
            and Central Role & Peripheral Role
          Connectable Advertising State
            and Connection State (Central Role)
            and Central Role & Peripheral Role
          High Duty Cycle Directed Advertising State
            and Connection State (Central Role)
            and Central Role & Peripheral Role
          Low Duty Cycle Directed Advertising State
            and Connection State (Central Role)
            and Central Role & Peripheral Role
          Connectable Advertising State
            and Connection State (Peripheral Role)
            and Central Role & Peripheral Role
          High Duty Cycle Directed Advertising State
            and Connection State (Peripheral Role)
            and Peripheral Role & Peripheral Role
          Low Duty Cycle Directed Advertising State
            and Connection State (Peripheral Role)
            and Peripheral Role & Peripheral Role
          Initiating State
            and Connection State (Peripheral Role)
            and Central Role & Peripheral Role
< HCI Command: LE Read Maximum Data.. (0x08|0x002f) plen 0  #23 [hci1] 1.426369
> HCI Event: Command Complete (0x0e) plen 12                #24 [hci1] 1.426934
      LE Read Maximum Data Length (0x08|0x002f) ncmd 1
        Status: Success (0x00)
        Max TX octets: 251
        Max TX time: 2704
        Max RX octets: 251
        Max RX time: 2704
< HCI Command: LE Write Suggested D.. (0x08|0x0024) plen 4  #25 [hci1] 1.446381
        TX octets: 251
        TX time: 2704
> HCI Event: Command Complete (0x0e) plen 4                 #26 [hci1] 1.446833
      LE Write Suggested Default Data Length (0x08|0x0024) ncmd 1
        Status: Success (0x00)
< HCI Command: LE Read Resolving Li.. (0x08|0x002a) plen 0  #27 [hci1] 1.466389
> HCI Event: Command Complete (0x0e) plen 5                 #28 [hci1] 1.466872
      LE Read Resolving List Size (0x08|0x002a) ncmd 1
        Status: Success (0x00)
        Size: 8
< HCI Command: LE Set Event Mask (0x08|0x0001) plen 8       #29 [hci1] 1.486379
        Mask: 0x000002023f87fa5e
          LE Advertising Report
          LE Connection Update Complete
          LE Read Remote Used Features Complete
          LE Long Term Key Request
          LE Data Length Change
          LE Enhanced Connection Complete
          LE PHY Update Complete
          LE Extended Advertising Report
          LE Periodic Advertising Sync Established
          LE Periodic Advertising Report
          LE Periodic Advertising Sync Lost
          LE Extended Scan Timeout
          LE Extended Advertising Set Terminated
          LE Scan Request Received
          LE Periodic Advertising Sync Transfer Rvc
          LE CIS Established
          LE CIS Request
          LE Create BIG Complete
          LE Terminate BIG Complete
          LE BIG Sync Estabilished Complete
          LE BIG Sync Lost
          LE BIG Info Advertising Report
          Unknown mask (0x0000020000000000)
> HCI Event: Command Complete (0x0e) plen 4                 #30 [hci1] 1.486863
      LE Set Event Mask (0x08|0x0001) ncmd 1
        Status: Success (0x00)
< HCI Command: Set Event Mask (0x03|0x0001) plen 8          #31 [hci1] 1.506351
        Mask: 0x2000800002008890
          Disconnection Complete
          Encryption Change
          Read Remote Version Information Complete
          Hardware Error
          Data Buffer Overflow
          Encryption Key Refresh Complete
          LE Meta
> HCI Event: Command Complete (0x0e) plen 4                 #32 [hci1] 1.506861
      Set Event Mask (0x03|0x0001) ncmd 1
        Status: Success (0x00)
< HCI Command: Read BD ADDR (0x04|0x0009) plen 0            #33 [hci1] 1.526386
> HCI Event: Command Complete (0x0e) plen 10                #34 [hci1] 1.526944
      Read BD ADDR (0x04|0x0009) ncmd 1
        Status: Success (0x00)
        Address: 00:00:00:00:00:00 (OUI 00-00-00)
< HCI Command: LE Set Random Address (0x08|0x0005) plen 6   #35 [hci1] 1.546427
        Address: D5:B6:CC:31:DB:3B (Static)
> HCI Event: Command Complete (0x0e) plen 4                 #36 [hci1] 1.547019
      LE Set Random Address (0x08|0x0005) ncmd 1
        Status: Success (0x00)
< HCI Command: LE Set Extended Adv.. (0x08|0x0036) plen 25  #37 [hci1] 4.016438
        Handle: 0x00
        Properties: 0x0013
          Connectable
          Scannable
          Use legacy advertising PDUs: ADV_IND
        Min advertising interval: 100.000 msec (0x00a0)
        Max advertising interval: 150.000 msec (0x00f0)
        Channel map: 37, 38, 39 (0x07)
        Own address type: Random (0x01)
        Peer address type: Public (0x00)
        Peer address: 00:00:00:00:00:00 (OUI 00-00-00)
        Filter policy: Allow Scan Request from Any, Allow Connect Request from Any (0x00)
        TX power: Host has no preference (0x7f)
        Primary PHY: LE 1M (0x01)
        Secondary max skip: 0x00
        Secondary PHY: LE 1M (0x01)
        SID: 0x00
        Scan request notifications: Disabled (0x00)
> HCI Event: Command Complete (0x0e) plen 5                 #38 [hci1] 4.017227
      LE Set Extended Advertising Parameters (0x08|0x0036) ncmd 1
        Status: Success (0x00)
        TX power (selected): 0 dbm (0x00)
< HCI Command: LE Set Advertising S.. (0x08|0x0035) plen 7  #39 [hci1] 4.026392
        Advertising handle: 0x00
        Advertising random address: D5:B6:CC:31:DB:3B (Static)
> HCI Event: Command Complete (0x0e) plen 4                 #40 [hci1] 4.026864
      LE Set Advertising Set Random Address (0x08|0x0035) ncmd 1
        Status: Success (0x00)
< HCI Command: LE Set Extended Adv.. (0x08|0x0037) plen 22  #41 [hci1] 4.046397
        Handle: 0x00
        Operation: Complete extended advertising data (0x03)
        Fragment preference: Minimize fragmentation (0x01)
        Data length: 0x12
        Flags: 0x06
          LE General Discoverable Mode
          BR/EDR Not Supported
        Name (complete): Tester_F6B11A
> HCI Event: Command Complete (0x0e) plen 4                 #42 [hci1] 4.047213
      LE Set Extended Advertising Data (0x08|0x0037) ncmd 1
        Status: Success (0x00)
< HCI Command: LE Set Extended Scan.. (0x08|0x0038) plen 4  #43 [hci1] 4.066381
        Handle: 0x00
        Operation: Complete scan response data (0x03)
        Fragment preference: Minimize fragmentation (0x01)
        Data length: 0x00
> HCI Event: Command Complete (0x0e) plen 4                 #44 [hci1] 4.066978
      LE Set Extended Scan Response Data (0x08|0x0038) ncmd 1
        Status: Success (0x00)
< HCI Command: LE Set Extended Adve.. (0x08|0x0039) plen 6  #45 [hci1] 4.086420
        Extended advertising: Enabled (0x01)
        Number of sets: 1 (0x01)
        Entry 0
          Handle: 0x00
          Duration: 0 ms (0x00)
          Max ext adv events: 0
> HCI Event: Command Complete (0x0e) plen 4                 #46 [hci1] 4.087110
      LE Set Extended Advertising Enable (0x08|0x0039) ncmd 1
        Status: Success (0x00)
> HCI Event: LE Meta Event (0x3e) plen 31                   #47 [hci1] 4.406426
      LE Enhanced Connection Complete (0x0a)
        Status: Success (0x00)
        Handle: 1479
        Role: Peripheral (0x01)
        Peer address type: Public (0x00)
        Peer address: DF:A9:FF:F6:B1:1A (OUI DF-A9-FF)
        Local resolvable private address: 00:00:00:00:00:00 (Non-Resolvable)
        Peer resolvable private address: 00:00:00:00:00:00 (Non-Resolvable)
        Connection interval: 87.50 msec (0x0046)
        Connection latency: 0 (0x0000)
        Supervision timeout: 25120 msec (0x09d0)
        Central clock accuracy: 0x01
> HCI Event: LE Meta Event (0x3e) plen 6                    #48 [hci1] 4.406464
      LE Advertising Set Terminated (0x12)
        Status: Success (0x00)
        Handle: 0
        Connection handle: 1479
        Number of completed extended advertising events: 0
< HCI Command: LE Read Remote Used... (0x08|0x0016) plen 2  #49 [hci1] 4.426979
        Handle: 1479 Address: DF:A9:FF:F6:B1:1A (OUI DF-A9-FF)
< ACL Data TX: Handle 1479 flags 0x00 dlen 7                #50 [hci1] 4.426994
      ATT: Exchange MTU Request (0x02) len 2
        Client RX MTU: 251
> HCI Event: Command Status (0x0f) plen 4                   #51 [hci1] 4.427578
      LE Read Remote Used Features (0x08|0x0016) ncmd 1
        Status: Success (0x00)
> HCI Event: Number of Completed Packets (0x13) plen 5      #52 [hci1] 4.582358
        Num handles: 1
        Handle: 1479 Address: DF:A9:FF:F6:B1:1A (OUI DF-A9-FF)
        Count: 1
        #50: len 7 (0 Kb/s)
        Latency: 155 msec (155-155 msec ~155 msec)
> HCI Event: LE Meta Event (0x3e) plen 12                   #53 [hci1] 4.670191
      LE Read Remote Used Features (0x04)
        Status: Success (0x00)
        Handle: 1479 Address: DF:A9:FF:F6:B1:1A (OUI DF-A9-FF)
        Features: 0x2d 0x49 0x00 0xf7 0x67 0xd8 0x00 0x00
          LE Encryption
          Extended Reject Indication
          Peripheral-initiated Features Exchange
          LE Data Packet Length Extension
          LE 2M PHY
          LE Coded PHY
          Channel Selection Algorithm #2
          Periodic Advertising Sync Transfer - Sender
          Periodic Advertising Sync Transfer - Recipient
          Sleep Clock Accuracy Updates
          Connected Isochronous Stream - Central
          Connected Isochronous Stream - Peripheral
          Isochronous Broadcaster
          Synchronized Receiver
          Connected Isochronous Stream (Host Support)
          LE Power Control Request
          LE Power Control Request
          Connection Subrating
          Connection Subrating (Host Support)
          Unknown features (0x0000d80000000000)
> ACL Data RX: Handle 1479 flags 0x02 dlen 11               #54 [hci1] 7.119994
      SMP: Pairing Request (0x01) len 6
        IO capability: KeyboardDisplay (0x04)
        OOB data: Authentication data not present (0x00)
        Authentication requirement: Bonding, MITM, SC, No Keypresses (0x0d)
        Max encryption key size: 16
        Initiator key distribution: EncKey IdKey (0x03)
        Responder key distribution: EncKey IdKey Sign (0x07)
> ACL Data RX: Handle 1479 flags 0x02 dlen 7                #55 [hci1] 7.120326
      ATT: Exchange MTU Response (0x03) len 2
        Server RX MTU: 23
< HCI Command: Host Number of Compl.. (0x03|0x0035) plen 5  #56 [hci1] 7.126896
        Num handles: 1
        Handle: 1479 Address: DF:A9:FF:F6:B1:1A (OUI DF-A9-FF)
        Count: 1
< ACL Data TX: Handle 1479 flags 0x00 dlen 11               #57 [hci1] 7.127076
      SMP: Pairing Response (0x02) len 6
        IO capability: DisplayOnly (0x00)
        OOB data: Authentication data not present (0x00)
        Authentication requirement: Bonding, No MITM, SC, No Keypresses (0x09)
        Max encryption key size: 16
        Initiator key distribution: IdKey (0x02)
        Responder key distribution: <none> (0x00)
< HCI Command: Host Number of Compl.. (0x03|0x0035) plen 5  #58 [hci1] 7.127308
        Num handles: 1
        Handle: 1479 Address: DF:A9:FF:F6:B1:1A (OUI DF-A9-FF)
        Count: 1
> HCI Event: Number of Completed Packets (0x13) plen 5      #59 [hci1] 7.295046
        Num handles: 1
        Handle: 1479 Address: DF:A9:FF:F6:B1:1A (OUI DF-A9-FF)
        Count: 1
        #57: len 11 (0 Kb/s)
        Latency: 167 msec (155-167 msec ~161 msec)
> ACL Data RX: Handle 1479 flags 0x02 dlen 27               #60 [hci1] 7.295332
> ACL Data RX: Handle 1479 flags 0x01 dlen 27               #61 [hci1] 7.295815
> ACL Data RX: Handle 1479 flags 0x01 dlen 15               #62 [hci1] 7.296215
      SMP: Pairing Public Key (0x0c) len 64
        X: c45541bdf381f6881244b0685d6c08f2e0b807052178b85ec9c348432dc5b472
        Y: 31ed1f73f947d0347c5ae1d92c5c96a962e816a14ee9664473af2f979ed7f050
< HCI Command: Host Number of Compl.. (0x03|0x0035) plen 5  #63 [hci1] 7.306723
        Num handles: 1
        Handle: 1479 Address: DF:A9:FF:F6:B1:1A (OUI DF-A9-FF)
        Count: 1
< HCI Command: Host Number of Compl.. (0x03|0x0035) plen 5  #64 [hci1] 7.306767
        Num handles: 1
        Handle: 1479 Address: DF:A9:FF:F6:B1:1A (OUI DF-A9-FF)
        Count: 1
< HCI Command: Host Number of Compl.. (0x03|0x0035) plen 5  #65 [hci1] 7.306934
        Num handles: 1
        Handle: 1479 Address: DF:A9:FF:F6:B1:1A (OUI DF-A9-FF)
        Count: 1
< ACL Data TX: Handle 1479 flags 0x00 dlen 27               #66 [hci1] 7.307021
< ACL Data TX: Handle 1479 flags 0x01 dlen 27               #67 [hci1] 7.307029
< ACL Data TX: Handle 1479 flags 0x01 dlen 15               #68 [hci1] 7.307031
      SMP: Pairing Public Key (0x0c) len 64
        X: 98308440221e2d910f0e54b71e7ec652857aa9b5a0dc65028824cc19db1226e9
        Y: 67a4816bcb62efb21701e31fdb27561a6217575fb007a8bbdabe7e28b6f68482
> HCI Event: Number of Completed Packets (0x13) plen 5      #69 [hci1] 7.382837
        Num handles: 1
        Handle: 1479 Address: DF:A9:FF:F6:B1:1A (OUI DF-A9-FF)
        Count: 1
        #66: len 27 (2 Kb/s)
        Latency: 75 msec (75-167 msec ~118 msec)
> HCI Event: Number of Completed Packets (0x13) plen 5      #70 [hci1] 7.383504
        Num handles: 1
        Handle: 1479 Address: DF:A9:FF:F6:B1:1A (OUI DF-A9-FF)
        Count: 1
        #67: len 27 (2 Kb/s)
        Latency: 76 msec (75-167 msec ~97 msec)
> HCI Event: Number of Completed Packets (0x13) plen 5      #71 [hci1] 7.469799
        Num handles: 1
        Handle: 1479 Address: DF:A9:FF:F6:B1:1A (OUI DF-A9-FF)
        Count: 1
        #68: len 15 (0 Kb/s)
        Latency: 162 msec (75-167 msec ~130 msec)
> ACL Data RX: Handle 1479 flags 0x02 dlen 21               #72 [hci1] 8.257476
      SMP: Pairing Confirm (0x03) len 16
        Confim value: 6fdd5fa210a4c5e63ea1ea9c2cc64471
< HCI Command: Host Number of Compl.. (0x03|0x0035) plen 5  #73 [hci1] 8.266509
        Num handles: 1
        Handle: 1479 Address: DF:A9:FF:F6:B1:1A (OUI DF-A9-FF)
        Count: 1
< ACL Data TX: Handle 1479 flags 0x00 dlen 21               #74 [hci1] 8.266540
      SMP: Pairing Confirm (0x03) len 16
        Confim value: 9d3a0da7356b27c77521d434d1939465
> HCI Event: Number of Completed Packets (0x13) plen 5      #75 [hci1] 8.432327
        Num handles: 1
        Handle: 1479 Address: DF:A9:FF:F6:B1:1A (OUI DF-A9-FF)
        Count: 1
        #74: len 21 (1 Kb/s)
        Latency: 165 msec (75-167 msec ~147 msec)
> ACL Data RX: Handle 1479 flags 0x02 dlen 21               #76 [hci1] 8.432686
      SMP: Pairing Random (0x04) len 16
        Random value: 0282202fa00c812d0000000000000000
< HCI Command: Host Number of Compl.. (0x03|0x0035) plen 5  #77 [hci1] 8.448386
        Num handles: 1
        Handle: 1479 Address: DF:A9:FF:F6:B1:1A (OUI DF-A9-FF)
        Count: 1
< ACL Data TX: Handle 1479 flags 0x00 dlen 21               #78 [hci1] 8.448408
      SMP: Pairing Random (0x04) len 16
        Random value: 8e6108f966a694cbe26df70bb96773e6
> HCI Event: Number of Completed Packets (0x13) plen 5      #79 [hci1] 8.607228
        Num handles: 1
        Handle: 1479 Address: DF:A9:FF:F6:B1:1A (OUI DF-A9-FF)
        Count: 1
        #78: len 21 (1 Kb/s)
        Latency: 158 msec (75-167 msec ~153 msec)
> ACL Data RX: Handle 1479 flags 0x02 dlen 21               #80 [hci1] 8.694944
      SMP: Pairing Confirm (0x03) len 16
        Confim value: f2f3ed852e2a8fb0578d07a71be21460
< HCI Command: Host Number of Compl.. (0x03|0x0035) plen 5  #81 [hci1] 8.706660
        Num handles: 1
        Handle: 1479 Address: DF:A9:FF:F6:B1:1A (OUI DF-A9-FF)
        Count: 1
< ACL Data TX: Handle 1479 flags 0x00 dlen 21               #82 [hci1] 8.706810
      SMP: Pairing Confirm (0x03) len 16
        Confim value: 338fd1a703f212f61b397038646eae30
> HCI Event: Number of Completed Packets (0x13) plen 5      #83 [hci1] 8.869971
        Num handles: 1
        Handle: 1479 Address: DF:A9:FF:F6:B1:1A (OUI DF-A9-FF)
        Count: 1
        #82: len 21 (1 Kb/s)
        Latency: 163 msec (75-167 msec ~158 msec)
> ACL Data RX: Handle 1479 flags 0x02 dlen 21               #84 [hci1] 8.870161
      SMP: Pairing Random (0x04) len 16
        Random value: 11cf434bc75b3b5e0000000000000000
< HCI Command: Host Number of Compl.. (0x03|0x0035) plen 5  #85 [hci1] 8.887183
        Num handles: 1
        Handle: 1479 Address: DF:A9:FF:F6:B1:1A (OUI DF-A9-FF)
        Count: 1
< ACL Data TX: Handle 1479 flags 0x00 dlen 21               #86 [hci1] 8.887269
      SMP: Pairing Random (0x04) len 16
        Random value: 4d02679f89a05211af56d8b3da64d21e
> HCI Event: Number of Completed Packets (0x13) plen 5      #87 [hci1] 9.044632
        Num handles: 1
        Handle: 1479 Address: DF:A9:FF:F6:B1:1A (OUI DF-A9-FF)
        Count: 1
        #86: len 21 (1 Kb/s)
        Latency: 157 msec (75-167 msec ~157 msec)
> ACL Data RX: Handle 1479 flags 0x02 dlen 21               #88 [hci1] 9.132497
      SMP: Pairing Confirm (0x03) len 16
        Confim value: af68acf759736db207504bc08df6ee85
< HCI Command: Host Number of Compl.. (0x03|0x0035) plen 5  #89 [hci1] 9.146655
        Num handles: 1
        Handle: 1479 Address: DF:A9:FF:F6:B1:1A (OUI DF-A9-FF)
        Count: 1
< ACL Data TX: Handle 1479 flags 0x00 dlen 21               #90 [hci1] 9.146759
      SMP: Pairing Confirm (0x03) len 16
        Confim value: f054e17ddb25fee6ae0ed96130cf7f0f
> HCI Event: Number of Completed Packets (0x13) plen 5      #91 [hci1] 9.307325
        Num handles: 1
        Handle: 1479 Address: DF:A9:FF:F6:B1:1A (OUI DF-A9-FF)
        Count: 1
        #90: len 21 (1 Kb/s)
        Latency: 160 msec (75-167 msec ~159 msec)
> ACL Data RX: Handle 1479 flags 0x02 dlen 21               #92 [hci1] 9.307685
      SMP: Pairing Random (0x04) len 16
        Random value: 452cf2ae23c37fae0000000000000000
< HCI Command: Host Number of Compl.. (0x03|0x0035) plen 5  #93 [hci1] 9.326724
        Num handles: 1
        Handle: 1479 Address: DF:A9:FF:F6:B1:1A (OUI DF-A9-FF)
        Count: 1
< ACL Data TX: Handle 1479 flags 0x00 dlen 21               #94 [hci1] 9.326830
      SMP: Pairing Random (0x04) len 16
        Random value: 5e8286bc235a02440d0c3424a2acf8fd
> HCI Event: Number of Completed Packets (0x13) plen 5      #95 [hci1] 9.482060
        Num handles: 1
        Handle: 1479 Address: DF:A9:FF:F6:B1:1A (OUI DF-A9-FF)
        Count: 1
        #94: len 21 (1 Kb/s)
        Latency: 155 msec (75-167 msec ~157 msec)
> ACL Data RX: Handle 1479 flags 0x02 dlen 21               #96 [hci1] 9.569911
      SMP: Pairing Confirm (0x03) len 16
        Confim value: dff349eed6bff4244eb1321493e4a8b7
< HCI Command: Host Number of Compl.. (0x03|0x0035) plen 5  #97 [hci1] 9.586485
        Num handles: 1
        Handle: 1479 Address: DF:A9:FF:F6:B1:1A (OUI DF-A9-FF)
        Count: 1
< ACL Data TX: Handle 1479 flags 0x00 dlen 21               #98 [hci1] 9.586588
      SMP: Pairing Confirm (0x03) len 16
        Confim value: 86b23e2a95e46a9fc0fe9c7398bf3b82
> HCI Event: Number of Completed Packets (0x13) plen 5      #99 [hci1] 9.744772
        Num handles: 1
        Handle: 1479 Address: DF:A9:FF:F6:B1:1A (OUI DF-A9-FF)
        Count: 1
        #98: len 21 (1 Kb/s)
        Latency: 158 msec (75-167 msec ~157 msec)
> ACL Data RX: Handle 1479 flags 0x02 dlen 21              #100 [hci1] 9.745160
      SMP: Pairing Random (0x04) len 16
        Random value: 7beb3c01f0b283e20000000000000000
< HCI Command: Host Number of Comp.. (0x03|0x0035) plen 5  #101 [hci1] 9.746839
        Num handles: 1
        Handle: 1479 Address: DF:A9:FF:F6:B1:1A (OUI DF-A9-FF)
        Count: 1
< ACL Data TX: Handle 1479 flags 0x00 dlen 21              #102 [hci1] 9.746886
      SMP: Pairing Random (0x04) len 16
        Random value: 5c4a1bcadd27bd58e945097b00bad7ac
> HCI Event: Number of Completed Packets (0x13) plen 5     #103 [hci1] 9.919593
        Num handles: 1
        Handle: 1479 Address: DF:A9:FF:F6:B1:1A (OUI DF-A9-FF)
        Count: 1
        #102: len 21 (0 Kb/s)
        Latency: 172 msec (75-172 msec ~165 msec)
> ACL Data RX: Handle 1479 flags 0x02 dlen 21             #104 [hci1] 10.007493
      SMP: Pairing Confirm (0x03) len 16
        Confim value: df6e22f7d03c8159d121465fcac41cf5
< HCI Command: Host Number of Com.. (0x03|0x0035) plen 5  #105 [hci1] 10.027007
        Num handles: 1
        Handle: 1479 Address: DF:A9:FF:F6:B1:1A (OUI DF-A9-FF)
        Count: 1
< ACL Data TX: Handle 1479 flags 0x00 dlen 21             #106 [hci1] 10.027255
      SMP: Pairing Confirm (0x03) len 16
        Confim value: 5d547f5d9c6d8305c22ef1a910a6fb98
> HCI Event: Number of Completed Packets (0x13) plen 5    #107 [hci1] 10.182393
        Num handles: 1
        Handle: 1479 Address: DF:A9:FF:F6:B1:1A (OUI DF-A9-FF)
        Count: 1
        #106: len 21 (1 Kb/s)
        Latency: 155 msec (75-172 msec ~160 msec)
> ACL Data RX: Handle 1479 flags 0x02 dlen 21             #108 [hci1] 10.182670
      SMP: Pairing Random (0x04) len 16
        Random value: 44d941126144e8dc0000000000000000
< HCI Command: Host Number of Com.. (0x03|0x0035) plen 5  #109 [hci1] 10.186821
        Num handles: 1
        Handle: 1479 Address: DF:A9:FF:F6:B1:1A (OUI DF-A9-FF)
        Count: 1
< ACL Data TX: Handle 1479 flags 0x00 dlen 21             #110 [hci1] 10.186866
      SMP: Pairing Random (0x04) len 16
        Random value: 32527e6e64e79f33b2e374394db8ab2d
> HCI Event: Number of Completed Packets (0x13) plen 5    #111 [hci1] 10.357145
        Num handles: 1
        Handle: 1479 Address: DF:A9:FF:F6:B1:1A (OUI DF-A9-FF)
        Count: 1
        #110: len 21 (0 Kb/s)
        Latency: 170 msec (75-172 msec ~165 msec)
> ACL Data RX: Handle 1479 flags 0x02 dlen 21             #112 [hci1] 10.445022
      SMP: Pairing Confirm (0x03) len 16
        Confim value: 2aa66c8364de05e7c33f4d97f7d253f6
< HCI Command: Host Number of Com.. (0x03|0x0035) plen 5  #113 [hci1] 10.446921
        Num handles: 1
        Handle: 1479 Address: DF:A9:FF:F6:B1:1A (OUI DF-A9-FF)
        Count: 1
< ACL Data TX: Handle 1479 flags 0x00 dlen 21             #114 [hci1] 10.447109
      SMP: Pairing Confirm (0x03) len 16
        Confim value: ea0b7a6d4458f106a20651933125e4e9
> HCI Event: Number of Completed Packets (0x13) plen 5    #115 [hci1] 10.619955
        Num handles: 1
        Handle: 1479 Address: DF:A9:FF:F6:B1:1A (OUI DF-A9-FF)
        Count: 1
        #114: len 21 (0 Kb/s)
        Latency: 172 msec (75-172 msec ~169 msec)
> ACL Data RX: Handle 1479 flags 0x02 dlen 21             #116 [hci1] 10.620162
      SMP: Pairing Random (0x04) len 16
        Random value: ceda5d5c780f76420000000000000000
< HCI Command: Host Number of Com.. (0x03|0x0035) plen 5  #117 [hci1] 10.626772
        Num handles: 1
        Handle: 1479 Address: DF:A9:FF:F6:B1:1A (OUI DF-A9-FF)
        Count: 1
< ACL Data TX: Handle 1479 flags 0x00 dlen 21             #118 [hci1] 10.626804
      SMP: Pairing Random (0x04) len 16
        Random value: dddbdfe2838e9a8cc6964353c850fef7
> HCI Event: Number of Completed Packets (0x13) plen 5    #119 [hci1] 10.794579
        Num handles: 1
        Handle: 1479 Address: DF:A9:FF:F6:B1:1A (OUI DF-A9-FF)
        Count: 1
        #118: len 21 (1 Kb/s)
        Latency: 167 msec (75-172 msec ~168 msec)
> ACL Data RX: Handle 1479 flags 0x02 dlen 21             #120 [hci1] 10.882459
      SMP: Pairing Confirm (0x03) len 16
        Confim value: 08fbfb25188318075a1a9018ee5059f1
< HCI Command: Host Number of Com.. (0x03|0x0035) plen 5  #121 [hci1] 10.886971
        Num handles: 1
        Handle: 1479 Address: DF:A9:FF:F6:B1:1A (OUI DF-A9-FF)
        Count: 1
< ACL Data TX: Handle 1479 flags 0x00 dlen 21             #122 [hci1] 10.887185
      SMP: Pairing Confirm (0x03) len 16
        Confim value: 9ecd913503508c68d45105ce9080a955
> HCI Event: Number of Completed Packets (0x13) plen 5    #123 [hci1] 11.057274
        Num handles: 1
        Handle: 1479 Address: DF:A9:FF:F6:B1:1A (OUI DF-A9-FF)
        Count: 1
        #122: len 21 (0 Kb/s)
        Latency: 170 msec (75-172 msec ~169 msec)
> ACL Data RX: Handle 1479 flags 0x02 dlen 21             #124 [hci1] 11.057631
      SMP: Pairing Random (0x04) len 16
        Random value: 2533d70987d23c820000000000000000
< HCI Command: Host Number of Com.. (0x03|0x0035) plen 5  #125 [hci1] 11.066943
        Num handles: 1
        Handle: 1479 Address: DF:A9:FF:F6:B1:1A (OUI DF-A9-FF)
        Count: 1
< ACL Data TX: Handle 1479 flags 0x00 dlen 21             #126 [hci1] 11.067078
      SMP: Pairing Random (0x04) len 16
        Random value: eb9f1915536596b6fc3db1c86b2b1970
> HCI Event: Number of Completed Packets (0x13) plen 5    #127 [hci1] 11.232124
        Num handles: 1
        Handle: 1479 Address: DF:A9:FF:F6:B1:1A (OUI DF-A9-FF)
        Count: 1
        #126: len 21 (1 Kb/s)
        Latency: 165 msec (75-172 msec ~167 msec)
> ACL Data RX: Handle 1479 flags 0x02 dlen 21             #128 [hci1] 11.320078
      SMP: Pairing Confirm (0x03) len 16
        Confim value: 781fec0c60a263af25f2037b77bbf4d3
< HCI Command: Host Number of Com.. (0x03|0x0035) plen 5  #129 [hci1] 11.326735
        Num handles: 1
        Handle: 1479 Address: DF:A9:FF:F6:B1:1A (OUI DF-A9-FF)
        Count: 1
< ACL Data TX: Handle 1479 flags 0x00 dlen 21             #130 [hci1] 11.326877
      SMP: Pairing Confirm (0x03) len 16
        Confim value: 0ea3e71d196179cccd717b8485ca40ef
> HCI Event: Number of Completed Packets (0x13) plen 5    #131 [hci1] 11.494767
        Num handles: 1
        Handle: 1479 Address: DF:A9:FF:F6:B1:1A (OUI DF-A9-FF)
        Count: 1
        #130: len 21 (1 Kb/s)
        Latency: 167 msec (75-172 msec ~167 msec)
> ACL Data RX: Handle 1479 flags 0x02 dlen 21             #132 [hci1] 11.495027
      SMP: Pairing Random (0x04) len 16
        Random value: 6ea5e8197452a8730000000000000000
< HCI Command: Host Number of Com.. (0x03|0x0035) plen 5  #133 [hci1] 11.507079
        Num handles: 1
        Handle: 1479 Address: DF:A9:FF:F6:B1:1A (OUI DF-A9-FF)
        Count: 1
< ACL Data TX: Handle 1479 flags 0x00 dlen 21             #134 [hci1] 11.507146
      SMP: Pairing Random (0x04) len 16
        Random value: 5c794dc9ad9f2c3f295ebd5ad5e1c3cf
> HCI Event: Number of Completed Packets (0x13) plen 5    #135 [hci1] 11.669521
        Num handles: 1
        Handle: 1479 Address: DF:A9:FF:F6:B1:1A (OUI DF-A9-FF)
        Count: 1
        #134: len 21 (1 Kb/s)
        Latency: 162 msec (75-172 msec ~164 msec)
> ACL Data RX: Handle 1479 flags 0x02 dlen 21             #136 [hci1] 11.757381
      SMP: Pairing Confirm (0x03) len 16
        Confim value: a8c02635d635102cbf34ab7f7c104e82
< HCI Command: Host Number of Com.. (0x03|0x0035) plen 5  #137 [hci1] 11.766984
        Num handles: 1
        Handle: 1479 Address: DF:A9:FF:F6:B1:1A (OUI DF-A9-FF)
        Count: 1
< ACL Data TX: Handle 1479 flags 0x00 dlen 21             #138 [hci1] 11.767176
      SMP: Pairing Confirm (0x03) len 16
        Confim value: ad5b23b07b1070aa264ab53fb886b873
> HCI Event: Number of Completed Packets (0x13) plen 5    #139 [hci1] 11.932323
        Num handles: 1
        Handle: 1479 Address: DF:A9:FF:F6:B1:1A (OUI DF-A9-FF)
        Count: 1
        #138: len 21 (1 Kb/s)
        Latency: 165 msec (75-172 msec ~165 msec)
> ACL Data RX: Handle 1479 flags 0x02 dlen 21             #140 [hci1] 11.932580
      SMP: Pairing Random (0x04) len 16
        Random value: f5fd7b4cb2d221570000000000000000
< HCI Command: Host Number of Com.. (0x03|0x0035) plen 5  #141 [hci1] 11.947129
        Num handles: 1
        Handle: 1479 Address: DF:A9:FF:F6:B1:1A (OUI DF-A9-FF)
        Count: 1
< ACL Data TX: Handle 1479 flags 0x00 dlen 21             #142 [hci1] 11.947222
      SMP: Pairing Random (0x04) len 16
        Random value: 5c2fff312cdf99c9491988e877355a9a
> HCI Event: Number of Completed Packets (0x13) plen 5    #143 [hci1] 12.107007
        Num handles: 1
        Handle: 1479 Address: DF:A9:FF:F6:B1:1A (OUI DF-A9-FF)
        Count: 1
        #142: len 21 (1 Kb/s)
        Latency: 159 msec (75-172 msec ~162 msec)
> ACL Data RX: Handle 1479 flags 0x02 dlen 21             #144 [hci1] 12.194979
      SMP: Pairing Confirm (0x03) len 16
        Confim value: e430beee43043cea92f26e2dbe8f814a
< HCI Command: Host Number of Com.. (0x03|0x0035) plen 5  #145 [hci1] 12.207025
        Num handles: 1
        Handle: 1479 Address: DF:A9:FF:F6:B1:1A (OUI DF-A9-FF)
        Count: 1
< ACL Data TX: Handle 1479 flags 0x00 dlen 21             #146 [hci1] 12.207210
      SMP: Pairing Confirm (0x03) len 16
        Confim value: 9d3ab81f0bf22507be195d3b73400023
> HCI Event: Number of Completed Packets (0x13) plen 5    #147 [hci1] 12.369670
        Num handles: 1
        Handle: 1479 Address: DF:A9:FF:F6:B1:1A (OUI DF-A9-FF)
        Count: 1
        #146: len 21 (1 Kb/s)
        Latency: 162 msec (75-172 msec ~162 msec)
> ACL Data RX: Handle 1479 flags 0x02 dlen 21             #148 [hci1] 12.370195
      SMP: Pairing Random (0x04) len 16
        Random value: 377692979dd84d680000000000000000
< HCI Command: Host Number of Com.. (0x03|0x0035) plen 5  #149 [hci1] 12.386974
        Num handles: 1
        Handle: 1479 Address: DF:A9:FF:F6:B1:1A (OUI DF-A9-FF)
        Count: 1
< ACL Data TX: Handle 1479 flags 0x00 dlen 21             #150 [hci1] 12.386994
      SMP: Pairing Random (0x04) len 16
        Random value: c629a3a987d808e808655d558dfc1155
> HCI Event: Number of Completed Packets (0x13) plen 5    #151 [hci1] 12.544531
        Num handles: 1
        Handle: 1479 Address: DF:A9:FF:F6:B1:1A (OUI DF-A9-FF)
        Count: 1
        #150: len 21 (1 Kb/s)
        Latency: 157 msec (75-172 msec ~159 msec)
> ACL Data RX: Handle 1479 flags 0x02 dlen 21             #152 [hci1] 12.632359
      SMP: Pairing Confirm (0x03) len 16
        Confim value: 261243fc2ace79fd92cde3c5582e8079
< HCI Command: Host Number of Com.. (0x03|0x0035) plen 5  #153 [hci1] 12.646641
        Num handles: 1
        Handle: 1479 Address: DF:A9:FF:F6:B1:1A (OUI DF-A9-FF)
        Count: 1
< ACL Data TX: Handle 1479 flags 0x00 dlen 21             #154 [hci1] 12.646748
      SMP: Pairing Confirm (0x03) len 16
        Confim value: 61537eccb70df8b3231ec88f73c3a899
> HCI Event: Number of Completed Packets (0x13) plen 5    #155 [hci1] 12.807200
        Num handles: 1
        Handle: 1479 Address: DF:A9:FF:F6:B1:1A (OUI DF-A9-FF)
        Count: 1
        #154: len 21 (1 Kb/s)
        Latency: 160 msec (75-172 msec ~160 msec)
> ACL Data RX: Handle 1479 flags 0x02 dlen 21             #156 [hci1] 12.807593
      SMP: Pairing Random (0x04) len 16
        Random value: 40f78651828ccbd10000000000000000
< HCI Command: Host Number of Com.. (0x03|0x0035) plen 5  #157 [hci1] 12.826882
        Num handles: 1
        Handle: 1479 Address: DF:A9:FF:F6:B1:1A (OUI DF-A9-FF)
        Count: 1
< ACL Data TX: Handle 1479 flags 0x00 dlen 21             #158 [hci1] 12.827001
      SMP: Pairing Random (0x04) len 16
        Random value: 92f20f6ad8f13724432c7fd6001c45ff
> HCI Event: Number of Completed Packets (0x13) plen 5    #159 [hci1] 12.982064
        Num handles: 1
        Handle: 1479 Address: DF:A9:FF:F6:B1:1A (OUI DF-A9-FF)
        Count: 1
        #158: len 21 (1 Kb/s)
        Latency: 155 msec (75-172 msec ~157 msec)
> ACL Data RX: Handle 1479 flags 0x02 dlen 21             #160 [hci1] 13.069929
      SMP: Pairing Confirm (0x03) len 16
        Confim value: adf9532512e876b1d2be51de09a7ee3b
< HCI Command: Host Number of Com.. (0x03|0x0035) plen 5  #161 [hci1] 13.087079
        Num handles: 1
        Handle: 1479 Address: DF:A9:FF:F6:B1:1A (OUI DF-A9-FF)
        Count: 1
< ACL Data TX: Handle 1479 flags 0x00 dlen 21             #162 [hci1] 13.087279
      SMP: Pairing Confirm (0x03) len 16
        Confim value: e2746d646f79a7133751f98ac3b054a5
> HCI Event: Number of Completed Packets (0x13) plen 5    #163 [hci1] 13.244701
        Num handles: 1
        Handle: 1479 Address: DF:A9:FF:F6:B1:1A (OUI DF-A9-FF)
        Count: 1
        #162: len 21 (1 Kb/s)
        Latency: 157 msec (75-172 msec ~157 msec)
> ACL Data RX: Handle 1479 flags 0x02 dlen 21             #164 [hci1] 13.245081
      SMP: Pairing Random (0x04) len 16
        Random value: 7a25b0b387517ef50000000000000000
< HCI Command: Host Number of Com.. (0x03|0x0035) plen 5  #165 [hci1] 13.246785
        Num handles: 1
        Handle: 1479 Address: DF:A9:FF:F6:B1:1A (OUI DF-A9-FF)
        Count: 1
< ACL Data TX: Handle 1479 flags 0x00 dlen 21             #166 [hci1] 13.246792
      SMP: Pairing Random (0x04) len 16
        Random value: 23ac32ebbb5e14c8a6b9622f296d277f
> HCI Event: Number of Completed Packets (0x13) plen 5    #167 [hci1] 13.419500
        Num handles: 1
        Handle: 1479 Address: DF:A9:FF:F6:B1:1A (OUI DF-A9-FF)
        Count: 1
        #166: len 21 (0 Kb/s)
        Latency: 172 msec (75-172 msec ~165 msec)
> ACL Data RX: Handle 1479 flags 0x02 dlen 21             #168 [hci1] 13.507314
      SMP: Pairing Confirm (0x03) len 16
        Confim value: e15f8b2986adf6b4371872e947a91955
< HCI Command: Host Number of Com.. (0x03|0x0035) plen 5  #169 [hci1] 13.526896
        Num handles: 1
        Handle: 1479 Address: DF:A9:FF:F6:B1:1A (OUI DF-A9-FF)
        Count: 1
< ACL Data TX: Handle 1479 flags 0x00 dlen 21             #170 [hci1] 13.527051
      SMP: Pairing Confirm (0x03) len 16
        Confim value: b37448abe6557071242253eca62185c6
> HCI Event: Number of Completed Packets (0x13) plen 5    #171 [hci1] 13.682246
        Num handles: 1
        Handle: 1479 Address: DF:A9:FF:F6:B1:1A (OUI DF-A9-FF)
        Count: 1
        #170: len 21 (1 Kb/s)
        Latency: 155 msec (75-172 msec ~160 msec)
> ACL Data RX: Handle 1479 flags 0x02 dlen 21             #172 [hci1] 13.682585
      SMP: Pairing Random (0x04) len 16
        Random value: 44ee8509cffd4c900000000000000000
< HCI Command: Host Number of Com.. (0x03|0x0035) plen 5  #173 [hci1] 13.686713
        Num handles: 1
        Handle: 1479 Address: DF:A9:FF:F6:B1:1A (OUI DF-A9-FF)
        Count: 1
< ACL Data TX: Handle 1479 flags 0x00 dlen 21             #174 [hci1] 13.686742
      SMP: Pairing Random (0x04) len 16
        Random value: 297efe85e67448a15f56bd27e3a3cf1d
> HCI Event: Number of Completed Packets (0x13) plen 5    #175 [hci1] 13.857088
        Num handles: 1
        Handle: 1479 Address: DF:A9:FF:F6:B1:1A (OUI DF-A9-FF)
        Count: 1
        #174: len 21 (0 Kb/s)
        Latency: 170 msec (75-172 msec ~165 msec)
> ACL Data RX: Handle 1479 flags 0x02 dlen 21             #176 [hci1] 13.944815
      SMP: Pairing Confirm (0x03) len 16
        Confim value: 1656400f5fd6ea77e41b41ccf31419ee
< HCI Command: Host Number of Com.. (0x03|0x0035) plen 5  #177 [hci1] 13.947016
        Num handles: 1
        Handle: 1479 Address: DF:A9:FF:F6:B1:1A (OUI DF-A9-FF)
        Count: 1
< ACL Data TX: Handle 1479 flags 0x00 dlen 21             #178 [hci1] 13.947170
      SMP: Pairing Confirm (0x03) len 16
        Confim value: efa1d68360bdfb34c0e83ea046e894fb
> HCI Event: Number of Completed Packets (0x13) plen 5    #179 [hci1] 14.119644
        Num handles: 1
        Handle: 1479 Address: DF:A9:FF:F6:B1:1A (OUI DF-A9-FF)
        Count: 1
        #178: len 21 (0 Kb/s)
        Latency: 172 msec (75-172 msec ~168 msec)
> ACL Data RX: Handle 1479 flags 0x02 dlen 21             #180 [hci1] 14.120027
      SMP: Pairing Random (0x04) len 16
        Random value: c276ddcbd8dc45650000000000000000
< HCI Command: Host Number of Com.. (0x03|0x0035) plen 5  #181 [hci1] 14.127068
        Num handles: 1
        Handle: 1479 Address: DF:A9:FF:F6:B1:1A (OUI DF-A9-FF)
        Count: 1
< ACL Data TX: Handle 1479 flags 0x00 dlen 21             #182 [hci1] 14.127160
      SMP: Pairing Random (0x04) len 16
        Random value: 25a9493fd3ce4faf02be7293595bb7c6
> HCI Event: Number of Completed Packets (0x13) plen 5    #183 [hci1] 14.294534
        Num handles: 1
        Handle: 1479 Address: DF:A9:FF:F6:B1:1A (OUI DF-A9-FF)
        Count: 1
        #182: len 21 (1 Kb/s)
        Latency: 167 msec (75-172 msec ~168 msec)
> ACL Data RX: Handle 1479 flags 0x02 dlen 21             #184 [hci1] 14.382356
      SMP: Pairing Confirm (0x03) len 16
        Confim value: 9e1916a25a70d1f9192a42a06fae810e
< HCI Command: Host Number of Com.. (0x03|0x0035) plen 5  #185 [hci1] 14.386777
        Num handles: 1
        Handle: 1479 Address: DF:A9:FF:F6:B1:1A (OUI DF-A9-FF)
        Count: 1
< ACL Data TX: Handle 1479 flags 0x00 dlen 21             #186 [hci1] 14.386890
      SMP: Pairing Confirm (0x03) len 16
        Confim value: 82817f993e2793c28fa44591d6f09c89
> HCI Event: Number of Completed Packets (0x13) plen 5    #187 [hci1] 14.557199
        Num handles: 1
        Handle: 1479 Address: DF:A9:FF:F6:B1:1A (OUI DF-A9-FF)
        Count: 1
        #186: len 21 (0 Kb/s)
        Latency: 170 msec (75-172 msec ~169 msec)
> ACL Data RX: Handle 1479 flags 0x02 dlen 21             #188 [hci1] 14.557797
      SMP: Pairing Random (0x04) len 16
        Random value: eb2e2482615fb93e0000000000000000
< HCI Command: Host Number of Com.. (0x03|0x0035) plen 5  #189 [hci1] 14.567283
        Num handles: 1
        Handle: 1479 Address: DF:A9:FF:F6:B1:1A (OUI DF-A9-FF)
        Count: 1
< ACL Data TX: Handle 1479 flags 0x00 dlen 21             #190 [hci1] 14.567394
      SMP: Pairing Random (0x04) len 16
        Random value: 58f6b41f855a6f6c3560debd84e2affc
> HCI Event: Number of Completed Packets (0x13) plen 5    #191 [hci1] 14.731944
        Num handles: 1
        Handle: 1479 Address: DF:A9:FF:F6:B1:1A (OUI DF-A9-FF)
        Count: 1
        #190: len 21 (1 Kb/s)
        Latency: 164 msec (75-172 msec ~166 msec)
> ACL Data RX: Handle 1479 flags 0x02 dlen 21             #192 [hci1] 14.819864
      SMP: Pairing Confirm (0x03) len 16
        Confim value: 29d65882eac6bbf73ce1c48a7c7de1ae
< HCI Command: Host Number of Com.. (0x03|0x0035) plen 5  #193 [hci1] 14.826765
        Num handles: 1
        Handle: 1479 Address: DF:A9:FF:F6:B1:1A (OUI DF-A9-FF)
        Count: 1
< ACL Data TX: Handle 1479 flags 0x00 dlen 21             #194 [hci1] 14.826837
      SMP: Pairing Confirm (0x03) len 16
        Confim value: 938c947a8593263e1b5297783ae757ff
> HCI Event: Number of Completed Packets (0x13) plen 5    #195 [hci1] 14.994616
        Num handles: 1
        Handle: 1479 Address: DF:A9:FF:F6:B1:1A (OUI DF-A9-FF)
        Count: 1
        #194: len 21 (1 Kb/s)
        Latency: 167 msec (75-172 msec ~167 msec)
> ACL Data RX: Handle 1479 flags 0x02 dlen 21             #196 [hci1] 14.994993
      SMP: Pairing Random (0x04) len 16
        Random value: c4536e4bd5214c3b0000000000000000
< HCI Command: Host Number of Com.. (0x03|0x0035) plen 5  #197 [hci1] 15.007348
        Num handles: 1
        Handle: 1479 Address: DF:A9:FF:F6:B1:1A (OUI DF-A9-FF)
        Count: 1
< ACL Data TX: Handle 1479 flags 0x00 dlen 21             #198 [hci1] 15.007471
      SMP: Pairing Random (0x04) len 16
        Random value: b67e7216d5bf664139eda2b542549666
> HCI Event: Number of Completed Packets (0x13) plen 5    #199 [hci1] 15.169513
        Num handles: 1
        Handle: 1479 Address: DF:A9:FF:F6:B1:1A (OUI DF-A9-FF)
        Count: 1
        #198: len 21 (1 Kb/s)
        Latency: 162 msec (75-172 msec ~164 msec)
> ACL Data RX: Handle 1479 flags 0x02 dlen 21             #200 [hci1] 15.257291
      SMP: Pairing Confirm (0x03) len 16
        Confim value: 4130b1925724da48abe96b5c1c334e8c
< HCI Command: Host Number of Com.. (0x03|0x0035) plen 5  #201 [hci1] 15.266726
        Num handles: 1
        Handle: 1479 Address: DF:A9:FF:F6:B1:1A (OUI DF-A9-FF)
        Count: 1
< ACL Data TX: Handle 1479 flags 0x00 dlen 21             #202 [hci1] 15.266876
      SMP: Pairing Confirm (0x03) len 16
        Confim value: c39e39c1875285eda9851ff96b09fac6
> HCI Event: Number of Completed Packets (0x13) plen 5    #203 [hci1] 15.432110
        Num handles: 1
        Handle: 1479 Address: DF:A9:FF:F6:B1:1A (OUI DF-A9-FF)
        Count: 1
        #202: len 21 (1 Kb/s)
        Latency: 165 msec (75-172 msec ~164 msec)
> ACL Data RX: Handle 1479 flags 0x02 dlen 21             #204 [hci1] 15.432508
      SMP: Pairing Random (0x04) len 16
        Random value: 2d809e02356c2e840000000000000000
< HCI Command: Host Number of Com.. (0x03|0x0035) plen 5  #205 [hci1] 15.447288
        Num handles: 1
        Handle: 1479 Address: DF:A9:FF:F6:B1:1A (OUI DF-A9-FF)
        Count: 1
< ACL Data TX: Handle 1479 flags 0x00 dlen 21             #206 [hci1] 15.447366
      SMP: Pairing Random (0x04) len 16
        Random value: ed17f76500c95219dd01e09d1e63f87b
> HCI Event: Number of Completed Packets (0x13) plen 5    #207 [hci1] 15.606931
        Num handles: 1
        Handle: 1479 Address: DF:A9:FF:F6:B1:1A (OUI DF-A9-FF)
        Count: 1
        #206: len 21 (1 Kb/s)
        Latency: 159 msec (75-172 msec ~162 msec)
> ACL Data RX: Handle 1479 flags 0x02 dlen 21             #208 [hci1] 15.694799
      SMP: Pairing Confirm (0x03) len 16
        Confim value: ffed953d0f56c80050ada8717ddd3298
< HCI Command: Host Number of Com.. (0x03|0x0035) plen 5  #209 [hci1] 15.706821
        Num handles: 1
        Handle: 1479 Address: DF:A9:FF:F6:B1:1A (OUI DF-A9-FF)
        Count: 1
< ACL Data TX: Handle 1479 flags 0x00 dlen 21             #210 [hci1] 15.706915
      SMP: Pairing Confirm (0x03) len 16
        Confim value: 1347732874d68d5c5f382de07ad703ce
> HCI Event: Number of Completed Packets (0x13) plen 5    #211 [hci1] 15.869626
        Num handles: 1
        Handle: 1479 Address: DF:A9:FF:F6:B1:1A (OUI DF-A9-FF)
        Count: 1
        #210: len 21 (1 Kb/s)
        Latency: 162 msec (75-172 msec ~162 msec)
> ACL Data RX: Handle 1479 flags 0x02 dlen 21             #212 [hci1] 15.869969
      SMP: Pairing Random (0x04) len 16
        Random value: 943bc5be5b20a2980000000000000000
< HCI Command: Host Number of Com.. (0x03|0x0035) plen 5  #213 [hci1] 15.886912
        Num handles: 1
        Handle: 1479 Address: DF:A9:FF:F6:B1:1A (OUI DF-A9-FF)
        Count: 1
< ACL Data TX: Handle 1479 flags 0x00 dlen 21             #214 [hci1] 15.887004
      SMP: Pairing Random (0x04) len 16
        Random value: 81d35d47e1f6006d79c974bd9d9e1ee3
> HCI Event: Number of Completed Packets (0x13) plen 5    #215 [hci1] 16.044434
        Num handles: 1
        Handle: 1479 Address: DF:A9:FF:F6:B1:1A (OUI DF-A9-FF)
        Count: 1
        #214: len 21 (1 Kb/s)
        Latency: 157 msec (75-172 msec ~159 msec)
> ACL Data RX: Handle 1479 flags 0x02 dlen 21             #216 [hci1] 16.132331
      SMP: Pairing Confirm (0x03) len 16
        Confim value: 3fbd6358379082615da0b706bc9f3773
< HCI Command: Host Number of Com.. (0x03|0x0035) plen 5  #217 [hci1] 16.146856
        Num handles: 1
        Handle: 1479 Address: DF:A9:FF:F6:B1:1A (OUI DF-A9-FF)
        Count: 1
< ACL Data TX: Handle 1479 flags 0x00 dlen 21             #218 [hci1] 16.146989
      SMP: Pairing Confirm (0x03) len 16
        Confim value: 68bfae1c6a2dfe3eab1db59ed6c59525
> HCI Event: Number of Completed Packets (0x13) plen 5    #219 [hci1] 16.307265
        Num handles: 1
        Handle: 1479 Address: DF:A9:FF:F6:B1:1A (OUI DF-A9-FF)
        Count: 1
        #218: len 21 (1 Kb/s)
        Latency: 160 msec (75-172 msec ~160 msec)
> ACL Data RX: Handle 1479 flags 0x02 dlen 21             #220 [hci1] 16.307406
      SMP: Pairing Random (0x04) len 16
        Random value: e338e8fdddf5ae7e0000000000000000
< HCI Command: Host Number of Com.. (0x03|0x0035) plen 5  #221 [hci1] 16.327291
        Num handles: 1
        Handle: 1479 Address: DF:A9:FF:F6:B1:1A (OUI DF-A9-FF)
        Count: 1
< ACL Data TX: Handle 1479 flags 0x00 dlen 21             #222 [hci1] 16.327366
      SMP: Pairing Random (0x04) len 16
        Random value: e7f7e0c2476823e41736a7e381bafb7c
> HCI Event: Number of Completed Packets (0x13) plen 5    #223 [hci1] 16.481951
        Num handles: 1
        Handle: 1479 Address: DF:A9:FF:F6:B1:1A (OUI DF-A9-FF)
        Count: 1
        #222: len 21 (1 Kb/s)
        Latency: 154 msec (75-172 msec ~157 msec)
> ACL Data RX: Handle 1479 flags 0x02 dlen 21             #224 [hci1] 16.569744
      SMP: Pairing Confirm (0x03) len 16
        Confim value: 572a8e1f644edf58d896edc4c1ffa1e4
< HCI Command: Host Number of Com.. (0x03|0x0035) plen 5  #225 [hci1] 16.586726
        Num handles: 1
        Handle: 1479 Address: DF:A9:FF:F6:B1:1A (OUI DF-A9-FF)
        Count: 1
< ACL Data TX: Handle 1479 flags 0x00 dlen 21             #226 [hci1] 16.586866
      SMP: Pairing Confirm (0x03) len 16
        Confim value: 01202ef635d9572e6ec912a9fc21b43c
> HCI Event: Number of Completed Packets (0x13) plen 5    #227 [hci1] 16.744631
        Num handles: 1
        Handle: 1479 Address: DF:A9:FF:F6:B1:1A (OUI DF-A9-FF)
        Count: 1
        #226: len 21 (1 Kb/s)
        Latency: 157 msec (75-172 msec ~157 msec)
> ACL Data RX: Handle 1479 flags 0x02 dlen 21             #228 [hci1] 16.744952
      SMP: Pairing Random (0x04) len 16
        Random value: f9310832e086f66e0000000000000000
