Bluetooth monitor ver 5.84
btmon[1480490]: = Note: Linux version 6.8.0-83-generic (x86_64)                                                          0.841667
btmon[1480490]: = Note: Bluetooth subsystem version 2.22                                                                 0.841669
= New Index: 00:00:00:00:00:00 (Primary,UART,hci0)                                                                       0.841670
= Open Index: 00:00:00:00:00:00                                                                                          1.349133
= Index Info: 00:00:00:00:00:00 (Nordic Semiconductor ASA)                                                               1.349137
zephyr.exe[1480492]: @ USER Open: main (privileged) version 2.22                                                {0x0001} 1.349152
zephyr.exe[1480492]: < HCI Command: Reset (0x03|0x0003) plen 0                                                        #1 1.349408
> HCI Event: Command Complete (0x0e) plen 4                                                                           #2 1.349836
      Reset (0x03|0x0003) ncmd 1
        Status: Success (0x00)
zephyr.exe[1480492]: < HCI Command: Read Local Supported Features (0x04|0x0003) plen 0                                #3 1.369032
> HCI Event: Command Complete (0x0e) plen 12                                                                          #4 1.370049
      Read Local Supported Features (0x04|0x0003) ncmd 1
        Status: Success (0x00)
        Features: 0x00 0x00 0x00 0x00 0x60 0x00 0x00 0x00
          BR/EDR Not Supported
          LE Supported (Controller)
zephyr.exe[1480492]: < HCI Command: Read Local Version Information (0x04|0x0001) plen 0                               #5 1.389012
> HCI Event: Command Complete (0x0e) plen 12                                                                          #6 1.389533
      Read Local Version Information (0x04|0x0001) ncmd 1
        Status: Success (0x00)
        HCI version: Reserved (0x0e) - Revision 12520 (0x30e8)
        LMP version: Reserved (0x0e) - Subversion 12520 (0x30e8)
        Manufacturer: Nordic Semiconductor ASA (89)
zephyr.exe[1480492]: < HCI Command: Read Local Supported Commands (0x04|0x0002) plen 0                                #7 1.409013
> HCI Event: Command Complete (0x0e) plen 68                                                                          #8 1.410308
      Read Local Supported Commands (0x04|0x0002) ncmd 1
        Status: Success (0x00)
        Commands: 119 entries
          Disconnect (Octet 0 - Bit 5)
          Read Remote Version Information (Octet 2 - Bit 7)
          Set Event Mask (Octet 5 - Bit 6)
          Reset (Octet 5 - Bit 7)
          Read Connection Accept Timeout (Octet 7 - Bit 2)
          Write Connection Accept Timeout (Octet 7 - Bit 3)
          Read Transmit Power Level (Octet 10 - Bit 2)
          Set Controller To Host Flow Control (Octet 10 - Bit 5)
          Host Buffer Size (Octet 10 - Bit 6)
          Host Number of Completed Packets (Octet 10 - Bit 7)
          Read Local Version Information (Octet 14 - Bit 3)
          Read Local Supported Features (Octet 14 - Bit 5)
          Read BD ADDR (Octet 15 - Bit 1)
          Read RSSI (Octet 15 - Bit 5)
          Set Event Mask Page 2 (Octet 22 - Bit 2)
          LE Set Event Mask (Octet 25 - Bit 0)
          LE Read Buffer Size (Octet 25 - Bit 1)
          LE Read Local Supported Features (Octet 25 - Bit 2)
          LE Set Random Address (Octet 25 - Bit 4)
          LE Set Advertising Parameters (Octet 25 - Bit 5)
          LE Read Advertising Channel TX Power (Octet 25 - Bit 6)
          LE Set Advertising Data (Octet 25 - Bit 7)
          LE Set Scan Response Data (Octet 26 - Bit 0)
          LE Set Advertise Enable (Octet 26 - Bit 1)
          LE Set Scan Parameters (Octet 26 - Bit 2)
          LE Set Scan Enable (Octet 26 - Bit 3)
          LE Create Connection (Octet 26 - Bit 4)
          LE Create Connection Cancel (Octet 26 - Bit 5)
          LE Read Accept List Size (Octet 26 - Bit 6)
          LE Clear Accept List (Octet 26 - Bit 7)
          LE Add Device To Accept List (Octet 27 - Bit 0)
          LE Remove Device From Accept List (Octet 27 - Bit 1)
          LE Connection Update (Octet 27 - Bit 2)
          LE Set Host Channel Classification (Octet 27 - Bit 3)
          LE Read Channel Map (Octet 27 - Bit 4)
          LE Read Remote Used Features (Octet 27 - Bit 5)
          LE Encrypt (Octet 27 - Bit 6)
          LE Rand (Octet 27 - Bit 7)
          LE Start Encryption (Octet 28 - Bit 0)
          LE Long Term Key Request Reply (Octet 28 - Bit 1)
          LE Long Term Key Request Neg Reply (Octet 28 - Bit 2)
          LE Read Supported States (Octet 28 - Bit 3)
          LE Receiver Test (Octet 28 - Bit 4)
          LE Transmitter Test (Octet 28 - Bit 5)
          LE Test End (Octet 28 - Bit 6)
          Read Authenticated Payload Timeout (Octet 32 - Bit 4)
          Write Authenticated Payload Timeout (Octet 32 - Bit 5)
          LE Set Data Length (Octet 33 - Bit 6)
          LE Read Suggested Default Data Length (Octet 33 - Bit 7)
          LE Write Suggested Default Data Length (Octet 34 - Bit 0)
          LE Add Device To Resolving List (Octet 34 - Bit 3)
          LE Remove Device From Resolving List (Octet 34 - Bit 4)
          LE Clear Resolving List (Octet 34 - Bit 5)
          LE Read Resolving List Size (Octet 34 - Bit 6)
          LE Set Address Resolution Enable (Octet 35 - Bit 1)
          LE Set Resolvable Private Address Timeout (Octet 35 - Bit 2)
          LE Read Maximum Data Length (Octet 35 - Bit 3)
          LE Read PHY (Octet 35 - Bit 4)
          LE Set Default PHY (Octet 35 - Bit 5)
          LE Set PHY (Octet 35 - Bit 6)
          LE Enhanced Receiver Test (Octet 35 - Bit 7)
          LE Enhanced Transmitter Test (Octet 36 - Bit 0)
          LE Set Advertising Set Random Address (Octet 36 - Bit 1)
          LE Set Extended Advertising Parameters (Octet 36 - Bit 2)
          LE Set Extended Advertising Data (Octet 36 - Bit 3)
          LE Set Extended Scan Response Data (Octet 36 - Bit 4)
          LE Set Extended Advertising Enable (Octet 36 - Bit 5)
          LE Read Maximum Advertising Data Length (Octet 36 - Bit 6)
          LE Read Number of Supported Advertising Sets (Octet 36 - Bit 7)
          LE Remove Advertising Set (Octet 37 - Bit 0)
          LE Clear Advertising Sets (Octet 37 - Bit 1)
          LE Set Periodic Advertising Parameters (Octet 37 - Bit 2)
          LE Set Periodic Advertising Data (Octet 37 - Bit 3)
          LE Set Periodic Advertising Enable (Octet 37 - Bit 4)
          LE Set Extended Scan Parameters (Octet 37 - Bit 5)
          LE Set Extended Scan Enable (Octet 37 - Bit 6)
          LE Extended Create Connection (Octet 37 - Bit 7)
          LE Periodic Advertising Create Sync (Octet 38 - Bit 0)
          LE Periodic Advertising Create Sync Cancel (Octet 38 - Bit 1)
          LE Periodic Advertising Terminate Sync (Octet 38 - Bit 2)
          LE Add Device To Periodic Advertiser List (Octet 38 - Bit 3)
          LE Remove Device From Periodic Advertiser List (Octet 38 - Bit 4)
          LE Clear Periodic Advertiser List (Octet 38 - Bit 5)
          LE Read Periodic Advertiser List Size (Octet 38 - Bit 6)
          LE Read Transmit Power (Octet 38 - Bit 7)
          LE Read RF Path Compensation (Octet 39 - Bit 0)
          LE Write RF Path Compensation (Octet 39 - Bit 1)
          LE Set Privacy Mode (Octet 39 - Bit 2)
          LE Periodic Advertising Receive Enable (Octet 40 - Bit 5)
          LE Periodic Advertising Sync Transfer (Octet 40 - Bit 6)
          LE Periodic Advertising Set Info Transfer (Octet 40 - Bit 7)
          LE Periodic Advertising Sync Transfer Parameters (Octet 41 - Bit 0)
          LE Set Default Periodic Advertisng Sync Transfer Parameters (Octet 41 - Bit 1)
          LE Read Buffer v2 (Octet 41 - Bit 5)
          LE Read ISO TX Sync (Octet 41 - Bit 6)
          LE Set Connected Isochronous Group Parameters (Octet 41 - Bit 7)
          LE Set Connected Isochronous Group Parameters Test (Octet 42 - Bit 0)
          LE Create Connected Isochronous Stream (Octet 42 - Bit 1)
          LE Remove Connected Isochronous Group (Octet 42 - Bit 2)
          LE Accept Connected Isochronous Stream Request (Octet 42 - Bit 3)
          LE Reject Connected Isochronous Stream Request (Octet 42 - Bit 4)
          LE Create Broadcast Isochronous Group (Octet 42 - Bit 5)
          LE Create Broadcast Isochronous Group Test (Octet 42 - Bit 6)
          LE Terminate Broadcast Isochronous Group (Octet 42 - Bit 7)
          LE Broadcast Isochronous Group Create Sync (Octet 43 - Bit 0)
          LE Broadcast Isochronous Group Terminate Sync (Octet 43 - Bit 1)
          LE Request Peer SCA (Octet 43 - Bit 2)
          LE Setup Isochronous Data Path (Octet 43 - Bit 3)
          LE Remove Isochronous Data Path (Octet 43 - Bit 4)
          LE Isochronous Transmit Test (Octet 43 - Bit 5)
          LE Isochronous Receive Test (Octet 43 - Bit 6)
          LE Isochronous Read Test Counters (Octet 43 - Bit 7)
          LE Isochronous Read Test Counters (Octet 44 - Bit 0)
          LE Set Host Feature (Octet 44 - Bit 1)
          LE Read ISO link quality (Octet 44 - Bit 2)
          Octet 45 - Bit 6 
          Octet 46 - Bit 0 
          Octet 46 - Bit 1 
          Octet 46 - Bit 2 
zephyr.exe[1480492]: < HCI Command: Host Buffer Size (0x03|0x0033) plen 7                                             #9 1.429018
        ACL MTU: 255  ACL max packet: 16
        SCO MTU: 0    SCO max packet: 0
> HCI Event: Command Complete (0x0e) plen 4                                                                          #10 1.429861
      Host Buffer Size (0x03|0x0033) ncmd 1
        Status: Success (0x00)
zephyr.exe[1480492]: < HCI Command: Set Controller To Host Flow Control (0x03|0x0031) plen 1                         #11 1.449018
        Flow control: ACL Data Packets (0x01)
> HCI Event: Command Complete (0x0e) plen 4                                                                          #12 1.449856
      Set Controller To Host Flow Control (0x03|0x0031) ncmd 1
        Status: Success (0x00)
zephyr.exe[1480492]: < HCI Command: LE Read Local Supported Features (0x08|0x0003) plen 0                            #13 1.468986
> HCI Event: Command Complete (0x0e) plen 12                                                                         #14 1.469829
      LE Read Local Supported Features (0x08|0x0003) ncmd 1
        Status: Success (0x00)
        Features: 0xfd 0x79 0x00 0xf7 0x30 0x01 0x00 0x00
          LE Encryption
          Extended Reject Indication
          Peripheral-initiated Features Exchange
          LE Ping
          LE Data Packet Length Extension
          LL Privacy
          Extended Scanner Filter Policies
          LE 2M PHY
          LE Coded PHY
          LE Extended Advertising
          LE Periodic Advertising
          Channel Selection Algorithm #2
          Periodic Advertising Sync Transfer - Sender
          Periodic Advertising Sync Transfer - Recipient
          Sleep Clock Accuracy Updates
          Connected Isochronous Stream - Central
          Connected Isochronous Stream - Peripheral
          Isochronous Broadcaster
          Synchronized Receiver
          Periodic Advertising ADI support
          Connection Subrating
          Unknown features (0x0000010000000000)
zephyr.exe[1480492]: < HCI Command: LE Set Host Feature (0x08|0x0074) plen 2                                         #15 1.489026
        Bit Number: 32
          Connected Isochronous Stream (Host Support)
        Bit Value: 1
> HCI Event: Command Complete (0x0e) plen 4                                                                          #16 1.489609
      LE Set Host Feature (0x08|0x0074) ncmd 1
        Status: Success (0x00)
zephyr.exe[1480492]: < HCI Command: LE Read Buffer v2 (0x08|0x0060) plen 0                                           #17 1.509014
> HCI Event: Command Complete (0x0e) plen 10                                                                         #18 1.509650
      LE Read Buffer v2 (0x08|0x0060) ncmd 1
        Status: Success (0x00)
        ACL MTU: 27
        ACL max packet: 3
        ISO MTU: 318
        ISO max packet: 3
zephyr.exe[1480492]: < HCI Command: LE Read Maximum Advertising Data Length (0x08|0x003a) plen 0                     #19 1.529039
> HCI Event: Command Complete (0x0e) plen 6                                                                          #20 1.529742
      LE Read Maximum Advertising Data Length (0x08|0x003a) ncmd 1
        Status: Success (0x00)
        Max length: 1650
zephyr.exe[1480492]: < HCI Command: LE Read Supported States (0x08|0x001c) plen 0                                    #21 1.549004
> HCI Event: Command Complete (0x0e) plen 12                                                                         #22 1.549860
      LE Read Supported States (0x08|0x001c) ncmd 1
        Status: Success (0x00)
        States: 0x000003ff3e0306ff
          Non-connectable Advertising State
          Scannable Advertising State
          Connectable Advertising State
          High Duty Cycle Directed Advertising State
          Passive Scanning State
          Active Scanning State
          Initiating State
            and Connection State (Central Role)
          Connection State (Peripheral Role)
          Scannable Advertising State
            and Passive Scanning State
          Connectable Advertising State
            and Passive Scanning State
          Non-connectable Advertising State
            and Initiating State
          Scannable Advertising State
            and Initiating State
          Active Scanning State
            and Connection State (Central Role)
          Passive Scanning State
            and Connection State (Peripheral Role)
          Active Scanning State
            and Connection State (Peripheral Role)
          Initiating State
            and Connection State (Central Role)
            and Central Role & Central Role
          Low Duty Cycle Directed Advertising State
          Connectable Advertising State
            and Initiating State
            and Central Role & Peripheral Role
          High Duty Cycle Directed Advertising State
            and Initiating State
            and Central Role & Peripheral Role
          Low Duty Cycle Directed Advertising State
            and Initiating State
            and Central Role & Peripheral Role
          Connectable Advertising State
            and Connection State (Central Role)
            and Central Role & Peripheral Role
          High Duty Cycle Directed Advertising State
            and Connection State (Central Role)
            and Central Role & Peripheral Role
          Low Duty Cycle Directed Advertising State
            and Connection State (Central Role)
            and Central Role & Peripheral Role
          Connectable Advertising State
            and Connection State (Peripheral Role)
            and Central Role & Peripheral Role
          High Duty Cycle Directed Advertising State
            and Connection State (Peripheral Role)
            and Peripheral Role & Peripheral Role
          Low Duty Cycle Directed Advertising State
            and Connection State (Peripheral Role)
            and Peripheral Role & Peripheral Role
          Initiating State
            and Connection State (Peripheral Role)
            and Central Role & Peripheral Role
zephyr.exe[1480492]: < HCI Command: LE Read Maximum Data Length (0x08|0x002f) plen 0                                 #23 1.569024
> HCI Event: Command Complete (0x0e) plen 12                                                                         #24 1.569612
      LE Read Maximum Data Length (0x08|0x002f) ncmd 1
        Status: Success (0x00)
        Max TX octets: 251
        Max TX time: 2704
        Max RX octets: 251
        Max RX time: 2704
zephyr.exe[1480492]: < HCI Command: LE Write Suggested Default Data Length (0x08|0x0024) plen 4                      #25 1.589011
        TX octets: 251
        TX time: 2704
> HCI Event: Command Complete (0x0e) plen 4                                                                          #26 1.589516
      LE Write Suggested Default Data Length (0x08|0x0024) ncmd 1
        Status: Success (0x00)
zephyr.exe[1480492]: < HCI Command: LE Set Resolvable Private Address Timeout (0x08|0x002e) plen 2                   #27 1.609013
        Timeout: 30 seconds
> HCI Event: Command Complete (0x0e) plen 4                                                                          #28 1.609565
      LE Set Resolvable Private Address Timeout (0x08|0x002e) ncmd 1
        Status: Success (0x00)
zephyr.exe[1480492]: < HCI Command: LE Read Resolving List Size (0x08|0x002a) plen 0                                 #29 1.628995
> HCI Event: Command Complete (0x0e) plen 5                                                                          #30 1.629548
      LE Read Resolving List Size (0x08|0x002a) ncmd 1
        Status: Success (0x00)
        Size: 8
zephyr.exe[1480492]: < HCI Command: LE Set Event Mask (0x08|0x0001) plen 8                                           #31 1.648996
        Mask: 0x000002023f87fa5e
          LE Advertising Report
          LE Connection Update Complete
          LE Read Remote Used Features Complete
          LE Long Term Key Request
          LE Data Length Change
          LE Enhanced Connection Complete
          LE PHY Update Complete
          LE Extended Advertising Report
          LE Periodic Advertising Sync Established
          LE Periodic Advertising Report
          LE Periodic Advertising Sync Lost
          LE Extended Scan Timeout
          LE Extended Advertising Set Terminated
          LE Scan Request Received
          LE Periodic Advertising Sync Transfer Rvc
          LE CIS Established
          LE CIS Request
          LE Create BIG Complete
          LE Terminate BIG Complete
          LE BIG Sync Established Complete
          LE BIG Sync Lost
          LE BIG Info Advertising Report
          Unknown mask (0x0000020000000000)
> HCI Event: Command Complete (0x0e) plen 4                                                                          #32 1.649640
      LE Set Event Mask (0x08|0x0001) ncmd 1
        Status: Success (0x00)
zephyr.exe[1480492]: < HCI Command: Set Event Mask (0x03|0x0001) plen 8                                              #33 1.668997
        Mask: 0x2000800002008890
          Disconnection Complete
          Encryption Change
          Read Remote Version Information Complete
          Hardware Error
          Data Buffer Overflow
          Encryption Key Refresh Complete
          LE Meta
> HCI Event: Command Complete (0x0e) plen 4                                                                          #34 1.669615
      Set Event Mask (0x03|0x0001) ncmd 1
        Status: Success (0x00)
zephyr.exe[1480492]: < HCI Command: Read BD ADDR (0x04|0x0009) plen 0                                                #35 1.688994
> HCI Event: Command Complete (0x0e) plen 10                                                                         #36 1.690533
      Read BD ADDR (0x04|0x0009) ncmd 1
        Status: Success (0x00)
        Address: 00:00:00:00:00:00 (OUI 00-00-00)
zephyr.exe[1480492]: < HCI Command: LE Set Random Address (0x08|0x0005) plen 6                                       #37 1.708993
        Address: D5:B6:CC:31:DB:3B (Static)
> HCI Event: Command Complete (0x0e) plen 4                                                                          #38 1.709669
      LE Set Random Address (0x08|0x0005) ncmd 1
        Status: Success (0x00)
zephyr.exe[1480492]: < HCI Command: LE Set Random Address (0x08|0x0005) plen 6                                       #39 1.799023
        Address: 48:61:8E:DB:C6:F9 (Resolvable)
> HCI Event: Command Complete (0x0e) plen 4                                                                          #40 1.799580
      LE Set Random Address (0x08|0x0005) ncmd 1
        Status: Success (0x00)
zephyr.exe[1480492]: < HCI Command: LE Set Extended Advertising Parameters (0x08|0x0036) plen 25                     #41 5.769078
        Handle: 0x00
        Properties: 0x0013
          Connectable
          Scannable
          Use legacy advertising PDUs: ADV_IND
        Min advertising interval: 100.000 msec (0x00a0)
        Max advertising interval: 150.000 msec (0x00f0)
        Channel map: 37, 38, 39 (0x07)
        Own address type: Random (0x01)
        Peer address type: Public (0x00)
        Peer address: 00:00:00:00:00:00 (OUI 00-00-00)
        Filter policy: Allow Scan Request from Any, Allow Connect Request from Any (0x00)
        TX power: Host has no preference (0x7f)
        Primary PHY: LE 1M (0x01)
        Secondary max skip: 0x00
        Secondary PHY: LE 1M (0x01)
        SID: 0x00
        Scan request notifications: Disabled (0x00)
> HCI Event: Command Complete (0x0e) plen 5                                                                          #42 5.770016
      LE Set Extended Advertising Parameters (0x08|0x0036) ncmd 1
        Status: Success (0x00)
        TX power (selected): 0 dbm (0x00)
zephyr.exe[1480492]: < HCI Command: LE Set Advertising Set Random Address (0x08|0x0035) plen 7                       #43 5.789040
        Advertising handle: 0x00
        Advertising random address: 48:61:8E:DB:C6:F9 (Resolvable)
> HCI Event: Command Complete (0x0e) plen 4                                                                          #44 5.789768
      LE Set Advertising Set Random Address (0x08|0x0035) ncmd 1
        Status: Success (0x00)
zephyr.exe[1480492]: < HCI Command: LE Set Extended Advertising Data (0x08|0x0037) plen 22                           #45 5.809042
        Handle: 0x00
        Operation: Complete extended advertising data (0x03)
        Fragment preference: Minimize fragmentation (0x01)
        Data length: 0x12
        Flags: 0x04
          BR/EDR Not Supported
        Name (complete): Tester_F6B11A
> HCI Event: Command Complete (0x0e) plen 4                                                                          #46 5.810195
      LE Set Extended Advertising Data (0x08|0x0037) ncmd 1
        Status: Success (0x00)
zephyr.exe[1480492]: < HCI Command: LE Set Extended Scan Response Data (0x08|0x0038) plen 4                          #47 5.829030
        Handle: 0x00
        Operation: Complete scan response data (0x03)
        Fragment preference: Minimize fragmentation (0x01)
        Data length: 0x00
> HCI Event: Command Complete (0x0e) plen 4                                                                          #48 5.829841
      LE Set Extended Scan Response Data (0x08|0x0038) ncmd 1
        Status: Success (0x00)
zephyr.exe[1480492]: < HCI Command: LE Set Extended Advertising Enable (0x08|0x0039) plen 6                          #49 5.849032
        Extended advertising: Enabled (0x01)
        Number of sets: 1 (0x01)
        Entry 0
          Handle: 0x00
          Duration: 0 ms (0x00)
          Max ext adv events: 0
> HCI Event: Command Complete (0x0e) plen 4                                                                          #50 5.850224
      LE Set Extended Advertising Enable (0x08|0x0039) ncmd 1
        Status: Success (0x00)
> HCI Event: LE Meta Event (0x3e) plen 31                                                                            #51 6.069171
      LE Enhanced Connection Complete (0x0a)
        Status: Success (0x00)
        Handle: 1875
        Role: Peripheral (0x01)
        Peer address type: Public (0x00)
        Peer address: DF:A9:FF:F6:B1:1A (OUI DF-A9-FF)
        Local resolvable private address: 00:00:00:00:00:00 (Non-Resolvable)
        Peer resolvable private address: 00:00:00:00:00:00 (Non-Resolvable)
        Connection interval: 87.50 msec (0x0046)
        Connection latency: 0 (0x0000)
        Supervision timeout: 25120 msec (0x09d0)
        Central clock accuracy: 0x01
> HCI Event: LE Meta Event (0x3e) plen 6                                                                             #52 6.069289
      LE Advertising Set Terminated (0x12)
        Status: Success (0x00)
        Handle: 0
        Connection handle: 1875
        Number of completed extended advertising events: 0
zephyr.exe[1480492]: < HCI Command: LE Read Remote Used Features (0x08|0x0016) plen 2                                #53 6.089244
        Handle: 1875 Address: DF:A9:FF:F6:B1:1A (OUI DF-A9-FF)
> HCI Event: Command Status (0x0f) plen 4                                                                            #54 6.089878
      LE Read Remote Used Features (0x08|0x0016) ncmd 1
        Status: Success (0x00)
> HCI Event: LE Meta Event (0x3e) plen 12                                                                            #55 6.333391
      LE Read Remote Used Features (0x04)
        Status: Success (0x00)
        Handle: 1875 Address: DF:A9:FF:F6:B1:1A (OUI DF-A9-FF)
        Features: 0x2d 0x49 0x00 0xf7 0x67 0xd8 0x00 0x00
          LE Encryption
          Extended Reject Indication
          Peripheral-initiated Features Exchange
          LE Data Packet Length Extension
          LE 2M PHY
          LE Coded PHY
          Channel Selection Algorithm #2
          Periodic Advertising Sync Transfer - Sender
          Periodic Advertising Sync Transfer - Recipient
          Sleep Clock Accuracy Updates
          Connected Isochronous Stream - Central
          Connected Isochronous Stream - Peripheral
          Isochronous Broadcaster
          Synchronized Receiver
          Connected Isochronous Stream (Host Support)
          LE Power Control Request
          LE Power Control Request
          Connection Subrating
          Connection Subrating (Host Support)
          Unknown features (0x0000d80000000000)
> ACL Data RX: Handle 1875 flags 0x02 dlen 11                                                                        #56 8.783014
      SMP: Pairing Request (0x01) len 6
        IO capability: KeyboardDisplay (0x04)
        OOB data: Authentication data not present (0x00)
        Authentication requirement: Bonding, No MITM, SC, No Keypresses (0x09)
        Max encryption key size: 16
        Initiator key distribution: EncKey IdKey (0x03)
        Responder key distribution: EncKey IdKey Sign (0x07)
zephyr.exe[1480492]: < HCI Command: Host Number of Completed Packets (0x03|0x0035) plen 5                            #57 8.789228
        Num handles: 1
        Handle: 1875 Address: DF:A9:FF:F6:B1:1A (OUI DF-A9-FF)
        Count: 1
zephyr.exe[1480492]: < ACL Data TX: Handle 1875 [1/3] flags 0x00 dlen 11                                             #58 8.789256
      SMP: Pairing Response (0x02) len 6
        IO capability: KeyboardDisplay (0x04)
        OOB data: Authentication data not present (0x00)
        Authentication requirement: Bonding, No MITM, SC, No Keypresses (0x09)
        Max encryption key size: 16
        Initiator key distribution: IdKey (0x02)
        Responder key distribution: IdKey Sign (0x06)
> HCI Event: Number of Completed Packets (0x13) plen 5                                                               #59 8.958368
        Num handles: 1
        Handle: 1875 Address: DF:A9:FF:F6:B1:1A (OUI DF-A9-FF)
        Count: 1
        Buffers: 0/3
        #58: len 11 (0 Kb/s)
        Latency: 169 msec (169-169 msec ~169 msec)
> ACL Data RX: Handle 1875 flags 0x02 dlen 27                                                                        #60 8.958371
> ACL Data RX: Handle 1875 flags 0x01 dlen 27                                                                        #61 8.959310
> ACL Data RX: Handle 1875 flags 0x01 dlen 15                                                                        #62 8.959454
      SMP: Pairing Public Key (0x0c) len 64
        X[32]: 64bd254a926074802a2c88bb60eab50cb5443a1d08be0843422222177e40bfe5
        Y[32]: fec5c19d424e967649fb53ddbe4d8ada46819bcb3c79da23ed5915fa2e722034
zephyr.exe[1480492]: < HCI Command: Host Number of Completed Packets (0x03|0x0035) plen 5                            #63 8.969261
        Num handles: 1
        Handle: 1875 Address: DF:A9:FF:F6:B1:1A (OUI DF-A9-FF)
        Count: 1
zephyr.exe[1480492]: < HCI Command: Host Number of Completed Packets (0x03|0x0035) plen 5                            #64 8.969267
        Num handles: 1
        Handle: 1875 Address: DF:A9:FF:F6:B1:1A (OUI DF-A9-FF)
        Count: 1
zephyr.exe[1480492]: < HCI Command: Host Number of Completed Packets (0x03|0x0035) plen 5                            #65 8.969341
        Num handles: 1
        Handle: 1875 Address: DF:A9:FF:F6:B1:1A (OUI DF-A9-FF)
        Count: 1
zephyr.exe[1480492]: < ACL Data TX: Handle 1875 [1/3] flags 0x00 dlen 27                                             #66 8.969345
zephyr.exe[1480492]: < ACL Data TX: Handle 1875 flags 0x01 dlen 27                                                   #67 8.969345
zephyr.exe[1480492]: < ACL Data TX: Handle 1875 flags 0x01 dlen 15                                                   #68 8.969346
      SMP: Pairing Public Key (0x0c) len 64
        X[32]: 68f6ada634ce84d11617383d57f070fe3445c38b33b569efa5eb771a0dc8aea5
        Y[32]: 83c407aaa8337331fdc418e55085d75e6c1c6e5d42f8bf9c18fb5a2a7d4f31aa
> HCI Event: Number of Completed Packets (0x13) plen 5                                                               #69 9.045862
        Num handles: 1
        Handle: 1875 Address: DF:A9:FF:F6:B1:1A (OUI DF-A9-FF)
        Count: 1
        Buffers: 0/3
        #66: len 27 (2 Kb/s)
        Latency: 76 msec (76-169 msec ~122 msec)
> HCI Event: Number of Completed Packets (0x13) plen 5                                                               #70 9.046525
        Num handles: 1
        Handle: 1875 Address: DF:A9:FF:F6:B1:1A (OUI DF-A9-FF)
        Count: 1
        Buffers: underflow/3
        #67: len 27 (2 Kb/s)
        Latency: 77 msec (76-169 msec ~99 msec)
zephyr.exe[1480492]: < ACL Data TX: Handle 1875 [1/3] flags 0x00 dlen 21                                             #71 9.049055
      SMP: Pairing Confirm (0x03) len 16
        Confirm value[16]: 6b7a2c27f8044674c7688d58cdf55196
> HCI Event: Number of Completed Packets (0x13) plen 5                                                               #72 9.133002
        Num handles: 1
        Handle: 1875 Address: DF:A9:FF:F6:B1:1A (OUI DF-A9-FF)
        Count: 1
        Buffers: 0/3
        #68: len 15 (0 Kb/s)
        Latency: 163 msec (76-169 msec ~131 msec)
> HCI Event: Number of Completed Packets (0x13) plen 5                                                               #73 9.220365
        Num handles: 1
        Handle: 1875 Address: DF:A9:FF:F6:B1:1A (OUI DF-A9-FF)
        Count: 1
        Buffers: underflow/3
        #71: len 21 (0 Kb/s)
        Latency: 171 msec (76-171 msec ~151 msec)
> ACL Data RX: Handle 1875 flags 0x02 dlen 21                                                                        #74 9.221127
      SMP: Pairing Random (0x04) len 16
        Random value[16]: 55a2aff232ebe9380000000000000000
zephyr.exe[1480492]: < HCI Command: Host Number of Completed Packets (0x03|0x0035) plen 5                            #75 9.229070
        Num handles: 1
        Handle: 1875 Address: DF:A9:FF:F6:B1:1A (OUI DF-A9-FF)
        Count: 1
zephyr.exe[1480492]: < ACL Data TX: Handle 1875 [1/3] flags 0x00 dlen 21                                             #76 9.229141
      SMP: Pairing Random (0x04) len 16
        Random value[16]: 555cc64d02679f89a05211af56d8b3da
> HCI Event: Number of Completed Packets (0x13) plen 5                                                               #77 9.395220
        Num handles: 1
        Handle: 1875 Address: DF:A9:FF:F6:B1:1A (OUI DF-A9-FF)
        Count: 1
        Buffers: 0/3
        #76: len 21 (1 Kb/s)
        Latency: 166 msec (76-171 msec ~158 msec)
> ACL Data RX: Handle 1875 flags 0x02 dlen 21                                                                        #78 9.571049
      SMP: Pairing DHKey Check (0x0d) len 16
        E[16]: c0f7c9e8168f692d477082d6f1818900
zephyr.exe[1480492]: < HCI Command: Host Number of Completed Packets (0x03|0x0035) plen 5                            #79 9.589168
        Num handles: 1
        Handle: 1875 Address: DF:A9:FF:F6:B1:1A (OUI DF-A9-FF)
        Count: 1
zephyr.exe[1480492]: < ACL Data TX: Handle 1875 [1/3] flags 0x00 dlen 21                                             #80 9.589190
      SMP: Pairing DHKey Check (0x0d) len 16
        E[16]: 0cf1c1c94b741d1ba58a2be749f4e079
> HCI Event: Number of Completed Packets (0x13) plen 5                                                               #81 9.745577
        Num handles: 1
        Handle: 1875 Address: DF:A9:FF:F6:B1:1A (OUI DF-A9-FF)
        Count: 1
        Buffers: 0/3
        #80: len 21 (1 Kb/s)
        Latency: 156 msec (76-171 msec ~157 msec)
> HCI Event: LE Meta Event (0x3e) plen 13                                                                            #82 9.833391
      LE Long Term Key Request (0x05)
        Handle: 1875 Address: DF:A9:FF:F6:B1:1A (OUI DF-A9-FF)
        Random number: 0x0000000000000000
        Encrypted diversifier: 0x0000
zephyr.exe[1480492]: < HCI Command: LE Long Term Key Request Reply (0x08|0x001a) plen 18                             #83 9.849171
        Handle: 1875 Address: DF:A9:FF:F6:B1:1A (OUI DF-A9-FF)
        Long term key[16]: 20b4bd8aa93100f5ed3ab68bb71ae265
> HCI Event: Command Complete (0x0e) plen 6                                                                          #84 9.850024
      LE Long Term Key Request Reply (0x08|0x001a) ncmd 1
        Status: Success (0x00)
        Handle: 1875 Address: DF:A9:FF:F6:B1:1A (OUI DF-A9-FF)
> HCI Event: Encryption Change (0x08) plen 4                                                                        #85 10.270598
        Status: Success (0x00)
        Handle: 1875 Address: DF:A9:FF:F6:B1:1A (OUI DF-A9-FF)
        Encryption: Enabled with AES-CCM (0x01)
zephyr.exe[1480492]: < ACL Data TX: Handle 1875 [1/3] flags 0x00 dlen 21                                            #86 10.399144
      SMP: Identity Information (0x08) len 16
        Identity resolving key[16]: 08aad2e1be87e47b88aeb19de6889efb
zephyr.exe[1480492]: < ACL Data TX: Handle 1875 [2/3] flags 0x00 dlen 12                                            #87 10.399152
      SMP: Identity Address Information (0x09) len 7
        Address: D5:B6:CC:31:DB:3B (Static)
zephyr.exe[1480492]: < ACL Data TX: Handle 1875 [3/3] flags 0x00 dlen 21                                            #88 10.399153
      SMP: Signing Information (0x0a) len 16
        Signature key[16]: 1ec8845e8286bc235a02440d0c3424a2
> HCI Event: Number of Completed Packets (0x13) plen 5                                                              #89 10.445938
        Num handles: 1
        Handle: 1875 Address: DF:A9:FF:F6:B1:1A (OUI DF-A9-FF)
        Count: 1
        Buffers: 2/3
        #86: len 21 (3 Kb/s)
        Latency: 46 msec (46-171 msec ~102 msec)
> HCI Event: Number of Completed Packets (0x13) plen 5                                                              #90 10.446266
        Num handles: 1
        Handle: 1875 Address: DF:A9:FF:F6:B1:1A (OUI DF-A9-FF)
        Count: 1
        Buffers: 1/3
        #87: len 12 (2 Kb/s)
        Latency: 47 msec (46-171 msec ~74 msec)
> HCI Event: Number of Completed Packets (0x13) plen 5                                                              #91 10.532962
        Num handles: 1
        Handle: 1875 Address: DF:A9:FF:F6:B1:1A (OUI DF-A9-FF)
        Count: 1
        Buffers: 0/3
        #88: len 21 (1 Kb/s)
        Latency: 133 msec (46-171 msec ~104 msec)
> ACL Data RX: Handle 1875 flags 0x02 dlen 21                                                                       #92 10.533306
      SMP: Identity Information (0x08) len 16
        Identity resolving key[16]: 1c0deab6deae8f6d06902156acb79d4a
> ACL Data RX: Handle 1875 flags 0x02 dlen 12                                                                       #93 10.533757
      SMP: Identity Address Information (0x09) len 7
        Address: DF:A9:FF:F6:B1:1A (OUI DF-A9-FF)
zephyr.exe[1480492]: < HCI Command: Host Number of Completed Packets (0x03|0x0035) plen 5                           #94 10.549257
        Num handles: 1
        Handle: 1875 Address: DF:A9:FF:F6:B1:1A (OUI DF-A9-FF)
        Count: 1
zephyr.exe[1480492]: < HCI Command: LE Add Device To Resolving List (0x08|0x0027) plen 39                           #95 10.549405
        Address type: Public (0x00)
        Address: DF:A9:FF:F6:B1:1A (OUI DF-A9-FF)
        Peer identity resolving key[16]: 1c0deab6deae8f6d06902156acb79d4a
        Local identity resolving key[16]: 08aad2e1be87e47b88aeb19de6889efb
> HCI Event: Command Complete (0x0e) plen 4                                                                         #96 10.550783
      LE Add Device To Resolving List (0x08|0x0027) ncmd 1
        Status: Success (0x00)
zephyr.exe[1480492]: < HCI Command: LE Set Privacy Mode (0x08|0x004e) plen 8                                        #97 10.569138
        Peer Identity address type: Public (0x00)
        Peer Identity address: DF:A9:FF:F6:B1:1A (OUI DF-A9-FF)
        Privacy Mode: Use Device Privacy (0x01)
> HCI Event: Command Complete (0x0e) plen 4                                                                         #98 10.570007
      LE Set Privacy Mode (0x08|0x004e) ncmd 1
        Status: Success (0x00)
zephyr.exe[1480492]: < HCI Command: LE Set Address Resolution Enable (0x08|0x002d) plen 1                           #99 10.589203
        Address resolution: Enabled (0x01)
> HCI Event: Command Complete (0x0e) plen 4                                                                        #100 10.589940
      LE Set Address Resolution Enable (0x08|0x002d) ncmd 1
        Status: Success (0x00)
zephyr.exe[1480492]: < HCI Command: Host Number of Completed Packets (0x03|0x0035) plen 5                          #101 10.609180
        Num handles: 1
        Handle: 1875 Address: DF:A9:FF:F6:B1:1A (OUI DF-A9-FF)
        Count: 1
zephyr.exe[1480492]: < ACL Data TX: Handle 1875 [1/3] flags 0x00 dlen 11                                           #102 10.609214
      ATT: Read By Type Request (0x08) len 6
        Handle range: 0x0001-0xffff
        Attribute type: Central Address Resolution (0x2aa6)
> HCI Event: Number of Completed Packets (0x13) plen 5                                                             #103 10.708184
        Num handles: 1
        Handle: 1875 Address: DF:A9:FF:F6:B1:1A (OUI DF-A9-FF)
        Count: 1
        Buffers: 0/3
        #102: len 11 (0 Kb/s)
        Latency: 98 msec (46-171 msec ~101 msec)
> ACL Data RX: Handle 1875 flags 0x02 dlen 9                                                                       #104 10.795345
      ATT: Read By Type Response (0x09) len 4
        Attribute data length: 3
        Attribute data list: 1 entry
        Handle: 0x000f
        Value[1]: 01
zephyr.exe[1480492]: < HCI Command: Host Number of Completed Packets (0x03|0x0035) plen 5                          #105 10.809219
        Num handles: 1
        Handle: 1875 Address: DF:A9:FF:F6:B1:1A (OUI DF-A9-FF)
        Count: 1
> HCI Event: Disconnect Complete (0x05) plen 4                                                                     #106 11.057885
        Status: Success (0x00)
        Handle: 1875 Address: DF:A9:FF:F6:B1:1A (OUI DF-A9-FF)
        Reason: Remote User Terminated Connection (0x13)
zephyr.exe[1480492]: < HCI Command: LE Clear Accept List (0x08|0x0010) plen 0                                      #107 11.919068
> HCI Event: Command Complete (0x0e) plen 4                                                                        #108 11.919810
      LE Clear Accept List (0x08|0x0010) ncmd 1
        Status: Success (0x00)
zephyr.exe[1480492]: < HCI Command: LE Add Device To Accept List (0x08|0x0011) plen 7                              #109 11.929043
        Address type: Public (0x00)
        Address: E0:A9:FF:F6:B1:1A (OUI E0-A9-FF)
> HCI Event: Command Complete (0x0e) plen 4                                                                        #110 11.929985
      LE Add Device To Accept List (0x08|0x0011) ncmd 1
        Status: Success (0x00)
zephyr.exe[1480492]: < HCI Command: LE Set Extended Advertising Parameters (0x08|0x0036) plen 25                   #111 11.989188
        Handle: 0x00
        Properties: 0x0012
          Scannable
          Use legacy advertising PDUs: ADV_SCAN_IND
        Min advertising interval: 100.000 msec (0x00a0)
        Max advertising interval: 150.000 msec (0x00f0)
        Channel map: 37, 38, 39 (0x07)
        Own address type: Random (0x01)
        Peer address type: Public (0x00)
        Peer address: 00:00:00:00:00:00 (OUI 00-00-00)
        Filter policy: Allow Scan Request from Accept List Only, Allow Connect Request from Any (0x01)
        TX power: Host has no preference (0x7f)
        Primary PHY: LE 1M (0x01)
        Secondary max skip: 0x00
        Secondary PHY: LE 1M (0x01)
        SID: 0x00
        Scan request notifications: Disabled (0x00)
> HCI Event: Command Complete (0x0e) plen 5                                                                        #112 11.990024
      LE Set Extended Advertising Parameters (0x08|0x0036) ncmd 1
        Status: Success (0x00)
        TX power (selected): 0 dbm (0x00)
zephyr.exe[1480492]: < HCI Command: LE Set Advertising Set Random Address (0x08|0x0035) plen 7                     #113 12.009065
        Advertising handle: 0x00
        Advertising random address: 48:61:8E:DB:C6:F9 (Resolvable)
          Identity type: Random (0x01)
          Identity: D5:B6:CC:31:DB:3B (Static)
> HCI Event: Command Complete (0x0e) plen 4                                                                        #114 12.009643
      LE Set Advertising Set Random Address (0x08|0x0035) ncmd 1
        Status: Success (0x00)
zephyr.exe[1480492]: < HCI Command: LE Set Extended Advertising Data (0x08|0x0037) plen 22                         #115 12.029054
        Handle: 0x00
        Operation: Complete extended advertising data (0x03)
        Fragment preference: Minimize fragmentation (0x01)
        Data length: 0x12
        Flags: 0x04
          BR/EDR Not Supported
        Name (complete): Tester_F6B11A
> HCI Event: Command Complete (0x0e) plen 4                                                                        #116 12.030174
      LE Set Extended Advertising Data (0x08|0x0037) ncmd 1
        Status: Success (0x00)
zephyr.exe[1480492]: < HCI Command: LE Set Extended Scan Response Data (0x08|0x0038) plen 8                        #117 12.049044
        Handle: 0x00
        Operation: Complete scan response data (0x03)
        Fragment preference: Minimize fragmentation (0x01)
        Data length: 0x04
        Company: not assigned (52651)
          Data[0]: 
> HCI Event: Command Complete (0x0e) plen 4                                                                        #118 12.049966
      LE Set Extended Scan Response Data (0x08|0x0038) ncmd 1
        Status: Success (0x00)
zephyr.exe[1480492]: < HCI Command: LE Set Extended Advertising Enable (0x08|0x0039) plen 6                        #119 12.069059
        Extended advertising: Enabled (0x01)
        Number of sets: 1 (0x01)
        Entry 0
          Handle: 0x00
          Duration: 0 ms (0x00)
          Max ext adv events: 0
> HCI Event: Command Complete (0x0e) plen 4                                                                        #120 12.069836
      LE Set Extended Advertising Enable (0x08|0x0039) ncmd 1
        Status: Success (0x00)
zephyr.exe[1480492]: < HCI Command: LE Set Extended Advertising Enable (0x08|0x0039) plen 6                        #121 13.149079
        Extended advertising: Disabled (0x00)
        Number of sets: 1 (0x01)
        Entry 0
          Handle: 0x00
          Duration: 0 ms (0x00)
          Max ext adv events: 0
> HCI Event: Command Complete (0x0e) plen 4                                                                        #122 13.150407
      LE Set Extended Advertising Enable (0x08|0x0039) ncmd 1
        Status: Success (0x00)
zephyr.exe[1480492]: < HCI Command: LE Set Extended Advertising Parameters (0x08|0x0036) plen 25                   #123 13.179074
        Handle: 0x00
        Properties: 0x0012
          Scannable
          Use legacy advertising PDUs: ADV_SCAN_IND
        Min advertising interval: 100.000 msec (0x00a0)
        Max advertising interval: 150.000 msec (0x00f0)
        Channel map: 37, 38, 39 (0x07)
        Own address type: Random (0x01)
        Peer address type: Public (0x00)
        Peer address: 00:00:00:00:00:00 (OUI 00-00-00)
        Filter policy: Allow Scan Request from Accept List Only, Allow Connect Request from Any (0x01)
        TX power: Host has no preference (0x7f)
        Primary PHY: LE 1M (0x01)
        Secondary max skip: 0x00
        Secondary PHY: LE 1M (0x01)
        SID: 0x00
        Scan request notifications: Disabled (0x00)
> HCI Event: Command Complete (0x0e) plen 5                                                                        #124 13.180206
      LE Set Extended Advertising Parameters (0x08|0x0036) ncmd 1
        Status: Success (0x00)
        TX power (selected): 0 dbm (0x00)
zephyr.exe[1480492]: < HCI Command: LE Set Advertising Set Random Address (0x08|0x0035) plen 7                     #125 13.189017
        Advertising handle: 0x00
        Advertising random address: 48:61:8E:DB:C6:F9 (Resolvable)
          Identity type: Random (0x01)
          Identity: D5:B6:CC:31:DB:3B (Static)
> HCI Event: Command Complete (0x0e) plen 4                                                                        #126 13.189696
      LE Set Advertising Set Random Address (0x08|0x0035) ncmd 1
        Status: Success (0x00)
zephyr.exe[1480492]: < HCI Command: LE Set Extended Advertising Data (0x08|0x0037) plen 22                         #127 13.209016
        Handle: 0x00
        Operation: Complete extended advertising data (0x03)
        Fragment preference: Minimize fragmentation (0x01)
        Data length: 0x12
        Flags: 0x04
          BR/EDR Not Supported
        Name (complete): Tester_F6B11A
> HCI Event: Command Complete (0x0e) plen 4                                                                        #128 13.210002
      LE Set Extended Advertising Data (0x08|0x0037) ncmd 1
        Status: Success (0x00)
zephyr.exe[1480492]: < HCI Command: LE Set Extended Scan Response Data (0x08|0x0038) plen 8                        #129 13.229042
        Handle: 0x00
        Operation: Complete scan response data (0x03)
        Fragment preference: Minimize fragmentation (0x01)
        Data length: 0x04
        Company: not assigned (52651)
          Data[0]: 
> HCI Event: Command Complete (0x0e) plen 4                                                                        #130 13.229645
      LE Set Extended Scan Response Data (0x08|0x0038) ncmd 1
        Status: Success (0x00)
zephyr.exe[1480492]: < HCI Command: LE Set Extended Advertising Enable (0x08|0x0039) plen 6                        #131 13.249029
        Extended advertising: Enabled (0x01)
        Number of sets: 1 (0x01)
        Entry 0
          Handle: 0x00
          Duration: 0 ms (0x00)
          Max ext adv events: 0
> HCI Event: Command Complete (0x0e) plen 4                                                                        #132 13.249565
      LE Set Extended Advertising Enable (0x08|0x0039) ncmd 1
        Status: Success (0x00)
zephyr.exe[1480492]: < HCI Command: LE Set Extended Advertising Enable (0x08|0x0039) plen 6                        #133 15.319071
        Extended advertising: Disabled (0x00)
        Number of sets: 1 (0x01)
        Entry 0
          Handle: 0x00
          Duration: 0 ms (0x00)
          Max ext adv events: 0
> HCI Event: Command Complete (0x0e) plen 4                                                                        #134 15.319758
      LE Set Extended Advertising Enable (0x08|0x0039) ncmd 1
        Status: Success (0x00)
zephyr.exe[1480492]: < HCI Command: LE Clear Accept List (0x08|0x0010) plen 0                                      #135 15.389170
> HCI Event: Command Complete (0x0e) plen 4                                                                        #136 15.390056
      LE Clear Accept List (0x08|0x0010) ncmd 1
        Status: Success (0x00)
zephyr.exe[1480492]: < HCI Command: LE Add Device To Accept List (0x08|0x0011) plen 7                              #137 15.409068
        Address type: Public (0x00)
        Address: DF:A9:FF:F6:B1:1A (OUI DF-A9-FF)
> HCI Event: Command Complete (0x0e) plen 4                                                                        #138 15.409704
      LE Add Device To Accept List (0x08|0x0011) ncmd 1
        Status: Success (0x00)
zephyr.exe[1480492]: < HCI Command: LE Set Extended Advertising Parameters (0x08|0x0036) plen 25                   #139 15.469201
