Bluetooth monitor ver 5.72
= Note: Linux version 6.14.0-36-generic (x86_64)                       0.610665
= Note: Bluetooth subsystem version 2.22                               0.610667
= New Index: 00:00:00:00:00:00 (Primary,UART,hci1)              [hci1] 0.610668
= New Index: 48:5F:99:8E:E0:64 (Primary,USB,hci0)               [hci0] 0.610668
= Open Index: 00:00:00:00:00:00                                 [hci1] 0.733828
= Index Info: 00:00:00:00:00:00 (Nordic Semiconductor ASA)      [hci1] 0.733833
@ USER Open: main (privileged) version 2.22            {0x0001} [hci1] 0.733835
< HCI Command: Reset (0x03|0x0003) plen 0                    #1 [hci1] 0.734190
> HCI Event: Command Complete (0x0e) plen 4                  #2 [hci1] 0.734716
      Reset (0x03|0x0003) ncmd 1
        Status: Success (0x00)
< HCI Command: Read Local Supported... (0x04|0x0003) plen 0  #3 [hci1] 0.753854
> HCI Event: Command Complete (0x0e) plen 12                 #4 [hci1] 0.754432
      Read Local Supported Features (0x04|0x0003) ncmd 1
        Status: Success (0x00)
        Features: 0x00 0x00 0x00 0x00 0x60 0x00 0x00 0x00
          BR/EDR Not Supported
          LE Supported (Controller)
< HCI Command: Read Local Version In.. (0x04|0x0001) plen 0  #5 [hci1] 0.773833
> HCI Event: Command Complete (0x0e) plen 12                 #6 [hci1] 0.774366
      Read Local Version Information (0x04|0x0001) ncmd 1
        Status: Success (0x00)
        HCI version: Reserved (0x0f) - Revision 12393 (0x3069)
        LMP version: Reserved (0x0f) - Subversion 12393 (0x3069)
        Manufacturer: Nordic Semiconductor ASA (89)
< HCI Command: Read Local Supported... (0x04|0x0002) plen 0  #7 [hci1] 0.793852
> HCI Event: Command Complete (0x0e) plen 68                 #8 [hci1] 0.794902
      Read Local Supported Commands (0x04|0x0002) ncmd 1
        Status: Success (0x00)
        Commands: 119 entries
          Disconnect (Octet 0 - Bit 5)
          Read Remote Version Information (Octet 2 - Bit 7)
          Set Event Mask (Octet 5 - Bit 6)
          Reset (Octet 5 - Bit 7)
          Read Connection Accept Timeout (Octet 7 - Bit 2)
          Write Connection Accept Timeout (Octet 7 - Bit 3)
          Read Transmit Power Level (Octet 10 - Bit 2)
          Set Controller To Host Flow Control (Octet 10 - Bit 5)
          Host Buffer Size (Octet 10 - Bit 6)
          Host Number of Completed Packets (Octet 10 - Bit 7)
          Read Local Version Information (Octet 14 - Bit 3)
          Read Local Supported Features (Octet 14 - Bit 5)
          Read BD ADDR (Octet 15 - Bit 1)
          Read RSSI (Octet 15 - Bit 5)
          Set Event Mask Page 2 (Octet 22 - Bit 2)
          LE Set Event Mask (Octet 25 - Bit 0)
          LE Read Buffer Size (Octet 25 - Bit 1)
          LE Read Local Supported Features (Octet 25 - Bit 2)
          LE Set Random Address (Octet 25 - Bit 4)
          LE Set Advertising Parameters (Octet 25 - Bit 5)
          LE Read Advertising Channel TX Power (Octet 25 - Bit 6)
          LE Set Advertising Data (Octet 25 - Bit 7)
          LE Set Scan Response Data (Octet 26 - Bit 0)
          LE Set Advertise Enable (Octet 26 - Bit 1)
          LE Set Scan Parameters (Octet 26 - Bit 2)
          LE Set Scan Enable (Octet 26 - Bit 3)
          LE Create Connection (Octet 26 - Bit 4)
          LE Create Connection Cancel (Octet 26 - Bit 5)
          LE Read Accept List Size (Octet 26 - Bit 6)
          LE Clear Accept List (Octet 26 - Bit 7)
          LE Add Device To Accept List (Octet 27 - Bit 0)
          LE Remove Device From Accept List (Octet 27 - Bit 1)
          LE Connection Update (Octet 27 - Bit 2)
          LE Set Host Channel Classification (Octet 27 - Bit 3)
          LE Read Channel Map (Octet 27 - Bit 4)
          LE Read Remote Used Features (Octet 27 - Bit 5)
          LE Encrypt (Octet 27 - Bit 6)
          LE Rand (Octet 27 - Bit 7)
          LE Start Encryption (Octet 28 - Bit 0)
          LE Long Term Key Request Reply (Octet 28 - Bit 1)
          LE Long Term Key Request Neg Reply (Octet 28 - Bit 2)
          LE Read Supported States (Octet 28 - Bit 3)
          LE Receiver Test (Octet 28 - Bit 4)
          LE Transmitter Test (Octet 28 - Bit 5)
          LE Test End (Octet 28 - Bit 6)
          Read Authenticated Payload Timeout (Octet 32 - Bit 4)
          Write Authenticated Payload Timeout (Octet 32 - Bit 5)
          LE Set Data Length (Octet 33 - Bit 6)
          LE Read Suggested Default Data Length (Octet 33 - Bit 7)
          LE Write Suggested Default Data Length (Octet 34 - Bit 0)
          LE Add Device To Resolving List (Octet 34 - Bit 3)
          LE Remove Device From Resolving List (Octet 34 - Bit 4)
          LE Clear Resolving List (Octet 34 - Bit 5)
          LE Read Resolving List Size (Octet 34 - Bit 6)
          LE Set Address Resolution Enable (Octet 35 - Bit 1)
          LE Set Resolvable Private Address Timeout (Octet 35 - Bit 2)
          LE Read Maximum Data Length (Octet 35 - Bit 3)
          LE Read PHY (Octet 35 - Bit 4)
          LE Set Default PHY (Octet 35 - Bit 5)
          LE Set PHY (Octet 35 - Bit 6)
          LE Enhanced Receiver Test (Octet 35 - Bit 7)
          LE Enhanced Transmitter Test (Octet 36 - Bit 0)
          LE Set Advertising Set Random Address (Octet 36 - Bit 1)
          LE Set Extended Advertising Parameters (Octet 36 - Bit 2)
          LE Set Extended Advertising Data (Octet 36 - Bit 3)
          LE Set Extended Scan Response Data (Octet 36 - Bit 4)
          LE Set Extended Advertising Enable (Octet 36 - Bit 5)
          LE Read Maximum Advertising Data Length (Octet 36 - Bit 6)
          LE Read Number of Supported Advertising Sets (Octet 36 - Bit 7)
          LE Remove Advertising Set (Octet 37 - Bit 0)
          LE Clear Advertising Sets (Octet 37 - Bit 1)
          LE Set Periodic Advertising Parameters (Octet 37 - Bit 2)
          LE Set Periodic Advertising Data (Octet 37 - Bit 3)
          LE Set Periodic Advertising Enable (Octet 37 - Bit 4)
          LE Set Extended Scan Parameters (Octet 37 - Bit 5)
          LE Set Extended Scan Enable (Octet 37 - Bit 6)
          LE Extended Create Connection (Octet 37 - Bit 7)
          LE Periodic Advertising Create Sync (Octet 38 - Bit 0)
          LE Periodic Advertising Create Sync Cancel (Octet 38 - Bit 1)
          LE Periodic Advertising Terminate Sync (Octet 38 - Bit 2)
          LE Add Device To Periodic Advertiser List (Octet 38 - Bit 3)
          LE Remove Device From Periodic Advertiser List (Octet 38 - Bit 4)
          LE Clear Periodic Advertiser List (Octet 38 - Bit 5)
          LE Read Periodic Advertiser List Size (Octet 38 - Bit 6)
          LE Read Transmit Power (Octet 38 - Bit 7)
          LE Read RF Path Compensation (Octet 39 - Bit 0)
          LE Write RF Path Compensation (Octet 39 - Bit 1)
          LE Set Privacy Mode (Octet 39 - Bit 2)
          LE Periodic Advertising Receive Enable (Octet 40 - Bit 5)
          LE Periodic Advertising Sync Transfer (Octet 40 - Bit 6)
          LE Periodic Advertising Set Info Transfer (Octet 40 - Bit 7)
          LE Periodic Advertising Sync Transfer Parameters (Octet 41 - Bit 0)
          LE Set Default Periodic Advertisng Sync Transfer Parameters (Octet 41 - Bit 1)
          LE Read Buffer v2 (Octet 41 - Bit 5)
          LE Read ISO TX Sync (Octet 41 - Bit 6)
          LE Set Connected Isochronous Group Parameters (Octet 41 - Bit 7)
          LE Set Connected Isochronous Group Parameters Test (Octet 42 - Bit 0)
          LE Create Connected Isochronous Stream (Octet 42 - Bit 1)
          LE Remove Connected Isochronous Group (Octet 42 - Bit 2)
          LE Accept Connected Isochronous Stream Request (Octet 42 - Bit 3)
          LE Reject Connected Isochronous Stream Request (Octet 42 - Bit 4)
          LE Create Broadcast Isochronous Group (Octet 42 - Bit 5)
          LE Create Broadcast Isochronous Group Test (Octet 42 - Bit 6)
          LE Terminate Broadcast Isochronous Group (Octet 42 - Bit 7)
          LE Broadcast Isochronous Group Create Sync (Octet 43 - Bit 0)
          LE Broadcast Isochronous Group Terminate Sync (Octet 43 - Bit 1)
          LE Request Peer SCA (Octet 43 - Bit 2)
          LE Setup Isochronous Data Path (Octet 43 - Bit 3)
          LE Remove Isochronous Data Path (Octet 43 - Bit 4)
          LE Isochronous Transmit Test (Octet 43 - Bit 5)
          LE Isochronous Receive Test (Octet 43 - Bit 6)
          LE Isochronous Read Test Counters (Octet 43 - Bit 7)
          LE Isochronous Read Test Counters (Octet 44 - Bit 0)
          LE Set Host Feature (Octet 44 - Bit 1)
          Octet 44 - Bit 2 
          Octet 45 - Bit 6 
          Octet 46 - Bit 0 
          Octet 46 - Bit 1 
          Octet 46 - Bit 2 
< HCI Command: Host Buffer Size (0x03|0x0033) plen 7         #9 [hci1] 0.813819
        ACL MTU: 255  ACL max packet: 16
        SCO MTU: 0    SCO max packet: 0
> HCI Event: Command Complete (0x0e) plen 4                 #10 [hci1] 0.814409
      Host Buffer Size (0x03|0x0033) ncmd 1
        Status: Success (0x00)
< HCI Command: Set Controller To Ho.. (0x03|0x0031) plen 1  #11 [hci1] 0.833812
        Flow control: ACL Data Packets (0x01)
> HCI Event: Command Complete (0x0e) plen 4                 #12 [hci1] 0.834239
      Set Controller To Host Flow Control (0x03|0x0031) ncmd 1
        Status: Success (0x00)
< HCI Command: LE Read Local Suppor.. (0x08|0x0003) plen 0  #13 [hci1] 0.853834
> HCI Event: Command Complete (0x0e) plen 12                #14 [hci1] 0.854328
      LE Read Local Supported Features (0x08|0x0003) ncmd 1
        Status: Success (0x00)
        Features: 0xfd 0x79 0x00 0xf7 0x30 0x01 0x00 0x00
          LE Encryption
          Extended Reject Indication
          Peripheral-initiated Features Exchange
          LE Ping
          LE Data Packet Length Extension
          LL Privacy
          Extended Scanner Filter Policies
          LE 2M PHY
          LE Coded PHY
          LE Extended Advertising
          LE Periodic Advertising
          Channel Selection Algorithm #2
          Periodic Advertising Sync Transfer - Sender
          Periodic Advertising Sync Transfer - Recipient
          Sleep Clock Accuracy Updates
          Connected Isochronous Stream - Central
          Connected Isochronous Stream - Peripheral
          Isochronous Broadcaster
          Synchronized Receiver
          Periodic Advertising ADI support
          Connection Subrating
          Unknown features (0x0000010000000000)
< HCI Command: LE Set Host Feature (0x08|0x0074) plen 2     #15 [hci1] 0.873838
        Bit Number: 32
          Connected Isochronous Stream (Host Support)
        Bit Value: 1
> HCI Event: Command Complete (0x0e) plen 4                 #16 [hci1] 0.874267
      LE Set Host Feature (0x08|0x0074) ncmd 1
        Status: Success (0x00)
< HCI Command: LE Read Buffer v2 (0x08|0x0060) plen 0       #17 [hci1] 0.893812
> HCI Event: Command Complete (0x0e) plen 10                #18 [hci1] 0.894273
      LE Read Buffer v2 (0x08|0x0060) ncmd 1
        Status: Success (0x00)
        ACL MTU: 27
        ACL max packet: 3
        ISO MTU: 318
        ISO max packet: 3
< HCI Command: LE Read Maximum Adve.. (0x08|0x003a) plen 0  #19 [hci1] 0.913877
> HCI Event: Command Complete (0x0e) plen 6                 #20 [hci1] 0.914369
      LE Read Maximum Advertising Data Length (0x08|0x003a) ncmd 1
        Status: Success (0x00)
        Max length: 1650
< HCI Command: LE Read Supported St.. (0x08|0x001c) plen 0  #21 [hci1] 0.933842
> HCI Event: Command Complete (0x0e) plen 12                #22 [hci1] 0.934379
      LE Read Supported States (0x08|0x001c) ncmd 1
        Status: Success (0x00)
        States: 0x000003ff3e0306ff
          Non-connectable Advertising State
          Scannable Advertising State
          Connectable Advertising State
          High Duty Cycle Directed Advertising State
          Passive Scanning State
          Active Scanning State
          Initiating State
            and Connection State (Central Role)
          Connection State (Peripheral Role)
          Scannable Advertising State
            and Passive Scanning State
          Connectable Advertising State
            and Passive Scanning State
          Non-connectable Advertising State
            and Initiating State
          Scannable Advertising State
            and Initiating State
          Active Scanning State
            and Connection State (Central Role)
          Passive Scanning State
            and Connection State (Peripheral Role)
          Active Scanning State
            and Connection State (Peripheral Role)
          Initiating State
            and Connection State (Central Role)
            and Central Role & Central Role
          Low Duty Cycle Directed Advertising State
          Connectable Advertising State
            and Initiating State
            and Central Role & Peripheral Role
          High Duty Cycle Directed Advertising State
            and Initiating State
            and Central Role & Peripheral Role
          Low Duty Cycle Directed Advertising State
            and Initiating State
            and Central Role & Peripheral Role
          Connectable Advertising State
            and Connection State (Central Role)
            and Central Role & Peripheral Role
          High Duty Cycle Directed Advertising State
            and Connection State (Central Role)
            and Central Role & Peripheral Role
          Low Duty Cycle Directed Advertising State
            and Connection State (Central Role)
            and Central Role & Peripheral Role
          Connectable Advertising State
            and Connection State (Peripheral Role)
            and Central Role & Peripheral Role
          High Duty Cycle Directed Advertising State
            and Connection State (Peripheral Role)
            and Peripheral Role & Peripheral Role
          Low Duty Cycle Directed Advertising State
            and Connection State (Peripheral Role)
            and Peripheral Role & Peripheral Role
          Initiating State
            and Connection State (Peripheral Role)
            and Central Role & Peripheral Role
< HCI Command: LE Read Maximum Data.. (0x08|0x002f) plen 0  #23 [hci1] 0.953846
> HCI Event: Command Complete (0x0e) plen 12                #24 [hci1] 0.954367
      LE Read Maximum Data Length (0x08|0x002f) ncmd 1
        Status: Success (0x00)
        Max TX octets: 251
        Max TX time: 2704
        Max RX octets: 251
        Max RX time: 2704
< HCI Command: LE Write Suggested D.. (0x08|0x0024) plen 4  #25 [hci1] 0.973815
        TX octets: 251
        TX time: 2704
> HCI Event: Command Complete (0x0e) plen 4                 #26 [hci1] 0.974392
      LE Write Suggested Default Data Length (0x08|0x0024) ncmd 1
        Status: Success (0x00)
< HCI Command: LE Read Resolving Li.. (0x08|0x002a) plen 0  #27 [hci1] 0.993838
> HCI Event: Command Complete (0x0e) plen 5                 #28 [hci1] 0.994377
      LE Read Resolving List Size (0x08|0x002a) ncmd 1
        Status: Success (0x00)
        Size: 8
< HCI Command: LE Set Host Feature (0x08|0x0074) plen 2     #29 [hci1] 1.013841
        Bit Number: 38
          Connection Subrating (Host Support)
        Bit Value: 1
> HCI Event: Command Complete (0x0e) plen 4                 #30 [hci1] 1.014352
      LE Set Host Feature (0x08|0x0074) ncmd 1
        Status: Success (0x00)
< HCI Command: LE Set Event Mask (0x08|0x0001) plen 8       #31 [hci1] 1.033835
        Mask: 0x000002063f87fa5e
          LE Advertising Report
          LE Connection Update Complete
          LE Read Remote Used Features Complete
          LE Long Term Key Request
          LE Data Length Change
          LE Enhanced Connection Complete
          LE PHY Update Complete
          LE Extended Advertising Report
          LE Periodic Advertising Sync Established
          LE Periodic Advertising Report
          LE Periodic Advertising Sync Lost
          LE Extended Scan Timeout
          LE Extended Advertising Set Terminated
          LE Scan Request Received
          LE Periodic Advertising Sync Transfer Rvc
          LE CIS Established
          LE CIS Request
          LE Create BIG Complete
          LE Terminate BIG Complete
          LE BIG Sync Estabilished Complete
          LE BIG Sync Lost
          LE BIG Info Advertising Report
          LE Subrate Change
          Unknown mask (0x0000020000000000)
> HCI Event: Command Complete (0x0e) plen 4                 #32 [hci1] 1.034341
      LE Set Event Mask (0x08|0x0001) ncmd 1
        Status: Success (0x00)
< HCI Command: Set Event Mask (0x03|0x0001) plen 8          #33 [hci1] 1.053831
        Mask: 0x2000800002008890
          Disconnection Complete
          Encryption Change
          Read Remote Version Information Complete
          Hardware Error
          Data Buffer Overflow
          Encryption Key Refresh Complete
          LE Meta
> HCI Event: Command Complete (0x0e) plen 4                 #34 [hci1] 1.054419
      Set Event Mask (0x03|0x0001) ncmd 1
        Status: Success (0x00)
< HCI Command: Read BD ADDR (0x04|0x0009) plen 0            #35 [hci1] 1.073840
> HCI Event: Command Complete (0x0e) plen 10                #36 [hci1] 1.074292
      Read BD ADDR (0x04|0x0009) ncmd 1
        Status: Success (0x00)
        Address: 00:00:00:00:00:00 (OUI 00-00-00)
< HCI Command: LE Set Random Address (0x08|0x0005) plen 6   #37 [hci1] 1.093840
        Address: D5:B6:CC:31:DB:3B (Static)
> HCI Event: Command Complete (0x0e) plen 4                 #38 [hci1] 1.094433
      LE Set Random Address (0x08|0x0005) ncmd 1
        Status: Success (0x00)
< HCI Command: LE Set Extended Adv.. (0x08|0x0036) plen 25  #39 [hci1] 3.294420
        Handle: 0x00
        Properties: 0x0013
          Connectable
          Scannable
          Use legacy advertising PDUs: ADV_IND
        Min advertising interval: 100.000 msec (0x00a0)
        Max advertising interval: 150.000 msec (0x00f0)
        Channel map: 37, 38, 39 (0x07)
        Own address type: Random (0x01)
        Peer address type: Public (0x00)
        Peer address: 00:00:00:00:00:00 (OUI 00-00-00)
        Filter policy: Allow Scan Request from Any, Allow Connect Request from Any (0x00)
        TX power: Host has no preference (0x7f)
        Primary PHY: LE 1M (0x01)
        Secondary max skip: 0x00
        Secondary PHY: LE 1M (0x01)
        SID: 0x00
        Scan request notifications: Disabled (0x00)
> HCI Event: Command Complete (0x0e) plen 5                 #40 [hci1] 3.295217
      LE Set Extended Advertising Parameters (0x08|0x0036) ncmd 1
        Status: Success (0x00)
        TX power (selected): 0 dbm (0x00)
< HCI Command: LE Set Advertising S.. (0x08|0x0035) plen 7  #41 [hci1] 3.314000
        Advertising handle: 0x00
        Advertising random address: D5:B6:CC:31:DB:3B (Static)
> HCI Event: Command Complete (0x0e) plen 4                 #42 [hci1] 3.314544
      LE Set Advertising Set Random Address (0x08|0x0035) ncmd 1
        Status: Success (0x00)
< HCI Command: LE Set Extended Adv.. (0x08|0x0037) plen 22  #43 [hci1] 3.333920
        Handle: 0x00
        Operation: Complete extended advertising data (0x03)
        Fragment preference: Minimize fragmentation (0x01)
        Data length: 0x12
        Flags: 0x04
          BR/EDR Not Supported
        Name (complete): Tester_F6B11A
> HCI Event: Command Complete (0x0e) plen 4                 #44 [hci1] 3.334660
      LE Set Extended Advertising Data (0x08|0x0037) ncmd 1
        Status: Success (0x00)
< HCI Command: LE Set Extended Scan.. (0x08|0x0038) plen 4  #45 [hci1] 3.353882
        Handle: 0x00
        Operation: Complete scan response data (0x03)
        Fragment preference: Minimize fragmentation (0x01)
        Data length: 0x00
> HCI Event: Command Complete (0x0e) plen 4                 #46 [hci1] 3.354401
      LE Set Extended Scan Response Data (0x08|0x0038) ncmd 1
        Status: Success (0x00)
< HCI Command: LE Set Extended Adve.. (0x08|0x0039) plen 6  #47 [hci1] 3.373881
        Extended advertising: Enabled (0x01)
        Number of sets: 1 (0x01)
        Entry 0
          Handle: 0x00
          Duration: 0 ms (0x00)
          Max ext adv events: 0
> HCI Event: Command Complete (0x0e) plen 4                 #48 [hci1] 3.374432
      LE Set Extended Advertising Enable (0x08|0x0039) ncmd 1
        Status: Success (0x00)
> HCI Event: LE Meta Event (0x3e) plen 31                   #49 [hci1] 3.692646
      LE Enhanced Connection Complete (0x0a)
        Status: Success (0x00)
        Handle: 3423
        Role: Peripheral (0x01)
        Peer address type: Public (0x00)
        Peer address: DF:A9:FF:F6:B1:1A (OUI DF-A9-FF)
        Local resolvable private address: 00:00:00:00:00:00 (Non-Resolvable)
        Peer resolvable private address: 00:00:00:00:00:00 (Non-Resolvable)
        Connection interval: 87.50 msec (0x0046)
        Connection latency: 0 (0x0000)
        Supervision timeout: 20000 msec (0x07d0)
        Central clock accuracy: 0x01
> HCI Event: LE Meta Event (0x3e) plen 6                    #50 [hci1] 3.692648
      LE Advertising Set Terminated (0x12)
        Status: Success (0x00)
        Handle: 0
        Connection handle: 3423
        Number of completed extended advertising events: 0
< HCI Command: LE Read Remote Used... (0x08|0x0016) plen 2  #51 [hci1] 3.693921
        Handle: 3423 Address: DF:A9:FF:F6:B1:1A (OUI DF-A9-FF)
> HCI Event: Command Status (0x0f) plen 4                   #52 [hci1] 3.694313
      LE Read Remote Used Features (0x08|0x0016) ncmd 1
        Status: Success (0x00)
> HCI Event: LE Meta Event (0x3e) plen 12                   #53 [hci1] 3.956519
      LE Read Remote Used Features (0x04)
        Status: Success (0x00)
        Handle: 3423 Address: DF:A9:FF:F6:B1:1A (OUI DF-A9-FF)
        Features: 0x2d 0x49 0x00 0xf7 0x67 0xd9 0x00 0x80
          LE Encryption
          Extended Reject Indication
          Peripheral-initiated Features Exchange
          LE Data Packet Length Extension
          LE 2M PHY
          LE Coded PHY
          Channel Selection Algorithm #2
          Periodic Advertising Sync Transfer - Sender
          Periodic Advertising Sync Transfer - Recipient
          Sleep Clock Accuracy Updates
          Connected Isochronous Stream - Central
          Connected Isochronous Stream - Peripheral
          Isochronous Broadcaster
          Synchronized Receiver
          Connected Isochronous Stream (Host Support)
          LE Power Control Request
          LE Power Control Request
          Connection Subrating
          Connection Subrating (Host Support)
          Unknown features (0x8000d90000000000)
> ACL Data RX: Handle 3423 flags 0x02 dlen 11               #54 [hci1] 6.493696
      ATT: Read By Group Type Request (0x10) len 6
        Handle range: 0x0001-0xffff
        Attribute group type: Primary Service (0x2800)
< HCI Command: Host Number of Compl.. (0x03|0x0035) plen 5  #55 [hci1] 6.494342
        Num handles: 1
        Handle: 3423 Address: DF:A9:FF:F6:B1:1A (OUI DF-A9-FF)
        Count: 1
< ACL Data TX: Handle 3423 flags 0x00 dlen 24               #56 [hci1] 6.494523
      ATT: Read By Group Type Response (0x11) len 19
        Attribute data length: 6
        Attribute group list: 3 entries
        Handle range: 0x0001-0x000a
        UUID: Generic Attribute Profile (0x1801)
        Handle range: 0x000b-0x0011
        UUID: Generic Access Profile (0x1800)
        Handle range: 0x0012-0x0026
        UUID: Device Information (0x180a)
> HCI Event: Number of Completed Packets (0x13) plen 5      #57 [hci1] 6.668722
        Num handles: 1
        Handle: 3423 Address: DF:A9:FF:F6:B1:1A (OUI DF-A9-FF)
        Count: 1
        #56: len 24 (1 Kb/s)
        Latency: 174 msec (174-174 msec ~174 msec)
> ACL Data RX: Handle 3423 flags 0x02 dlen 11               #58 [hci1] 6.668930
      ATT: Read By Group Type Request (0x10) len 6
        Handle range: 0x0027-0xffff
        Attribute group type: Primary Service (0x2800)
< HCI Command: Host Number of Compl.. (0x03|0x0035) plen 5  #59 [hci1] 6.674581
        Num handles: 1
        Handle: 3423 Address: DF:A9:FF:F6:B1:1A (OUI DF-A9-FF)
        Count: 1
< ACL Data TX: Handle 3423 flags 0x00 dlen 9                #60 [hci1] 6.674751
      ATT: Error Response (0x01) len 4
        Read By Group Type Request (0x10)
        Handle: 0x0027
        Error: Attribute Not Found (0x0a)
> HCI Event: Number of Completed Packets (0x13) plen 5      #61 [hci1] 6.843746
        Num handles: 1
        Handle: 3423 Address: DF:A9:FF:F6:B1:1A (OUI DF-A9-FF)
        Count: 1
        #60: len 9 (0 Kb/s)
        Latency: 168 msec (168-174 msec ~171 msec)
> ACL Data RX: Handle 3423 flags 0x02 dlen 13               #62 [hci1] 6.843934
      ATT: Find By Type Value Request (0x06) len 8
        Handle range: 0x0001-0xffff
        Attribute type: Primary Service (0x2800)
          UUID: Device Information (0x180a)
< HCI Command: Host Number of Compl.. (0x03|0x0035) plen 5  #63 [hci1] 6.854339
        Num handles: 1
        Handle: 3423 Address: DF:A9:FF:F6:B1:1A (OUI DF-A9-FF)
        Count: 1
< ACL Data TX: Handle 3423 flags 0x00 dlen 9                #64 [hci1] 6.854467
      ATT: Find By Type Value Response (0x07) len 4
        Handle range: 0x0012-0x0026
> HCI Event: Number of Completed Packets (0x13) plen 5      #65 [hci1] 7.018700
        Num handles: 1
        Handle: 3423 Address: DF:A9:FF:F6:B1:1A (OUI DF-A9-FF)
        Count: 1
        #64: len 9 (0 Kb/s)
        Latency: 164 msec (164-174 msec ~167 msec)
> ACL Data RX: Handle 3423 flags 0x02 dlen 13               #66 [hci1] 7.018872
      ATT: Find By Type Value Request (0x06) len 8
        Handle range: 0x0027-0xffff
        Attribute type: Primary Service (0x2800)
          UUID: Device Information (0x180a)
< HCI Command: Host Number of Compl.. (0x03|0x0035) plen 5  #67 [hci1] 7.034678
        Num handles: 1
        Handle: 3423 Address: DF:A9:FF:F6:B1:1A (OUI DF-A9-FF)
        Count: 1
< ACL Data TX: Handle 3423 flags 0x00 dlen 9                #68 [hci1] 7.034942
      ATT: Error Response (0x01) len 4
        Find By Type Value Request (0x06)
        Handle: 0x0027
        Error: Attribute Not Found (0x0a)
> HCI Event: Number of Completed Packets (0x13) plen 5      #69 [hci1] 7.193660
        Num handles: 1
        Handle: 3423 Address: DF:A9:FF:F6:B1:1A (OUI DF-A9-FF)
        Count: 1
        #68: len 9 (0 Kb/s)
        Latency: 158 msec (158-174 msec ~163 msec)
> ACL Data RX: Handle 3423 flags 0x02 dlen 11               #70 [hci1] 7.193852
      ATT: Read By Type Request (0x08) len 6
        Handle range: 0x0012-0x0026
        Attribute type: Characteristic (0x2803)
< HCI Command: Host Number of Compl.. (0x03|0x0035) plen 5  #71 [hci1] 7.194456
        Num handles: 1
        Handle: 3423 Address: DF:A9:FF:F6:B1:1A (OUI DF-A9-FF)
        Count: 1
< ACL Data TX: Handle 3423 flags 0x00 dlen 20               #72 [hci1] 7.194556
      ATT: Read By Type Response (0x09) len 15
        Attribute data length: 7
        Attribute data list: 2 entries
        Handle: 0x0013
        Value: 021400242a
            Properties: 0x02
              Read (0x02)
            Value Handle: 0x0014
            Value UUID: Model Number String (0x2a24)
        Handle: 0x0015
        Value: 021600292a
            Properties: 0x02
              Read (0x02)
            Value Handle: 0x0016
            Value UUID: Manufacturer Name String (0x2a29)
> HCI Event: Number of Completed Packets (0x13) plen 5      #73 [hci1] 7.368630
        Num handles: 1
        Handle: 3423 Address: DF:A9:FF:F6:B1:1A (OUI DF-A9-FF)
        Count: 1
        #72: len 20 (0 Kb/s)
        Latency: 174 msec (158-174 msec ~168 msec)
> ACL Data RX: Handle 3423 flags 0x02 dlen 11               #74 [hci1] 7.368846
      ATT: Read By Type Request (0x08) len 6
        Handle range: 0x0016-0x0026
        Attribute type: Characteristic (0x2803)
< HCI Command: Host Number of Compl.. (0x03|0x0035) plen 5  #75 [hci1] 7.374199
        Num handles: 1
        Handle: 3423 Address: DF:A9:FF:F6:B1:1A (OUI DF-A9-FF)
        Count: 1
< ACL Data TX: Handle 3423 flags 0x00 dlen 20               #76 [hci1] 7.374208
      ATT: Read By Type Response (0x09) len 15
        Attribute data length: 7
        Attribute data list: 2 entries
        Handle: 0x0017
        Value: 021800502a
            Properties: 0x02
              Read (0x02)
            Value Handle: 0x0018
            Value UUID: PnP ID (0x2a50)
        Handle: 0x0019
        Value: 021a00252a
            Properties: 0x02
              Read (0x02)
            Value Handle: 0x001a
            Value UUID: Serial Number String (0x2a25)
> HCI Event: Number of Completed Packets (0x13) plen 5      #77 [hci1] 7.543595
        Num handles: 1
        Handle: 3423 Address: DF:A9:FF:F6:B1:1A (OUI DF-A9-FF)
        Count: 1
        #76: len 20 (0 Kb/s)
        Latency: 169 msec (158-174 msec ~169 msec)
> ACL Data RX: Handle 3423 flags 0x02 dlen 11               #78 [hci1] 7.543961
      ATT: Read By Type Request (0x08) len 6
        Handle range: 0x001a-0x0026
        Attribute type: Characteristic (0x2803)
< HCI Command: Host Number of Compl.. (0x03|0x0035) plen 5  #79 [hci1] 7.554708
        Num handles: 1
        Handle: 3423 Address: DF:A9:FF:F6:B1:1A (OUI DF-A9-FF)
        Count: 1
< ACL Data TX: Handle 3423 flags 0x00 dlen 20               #80 [hci1] 7.554732
      ATT: Read By Type Response (0x09) len 15
        Attribute data length: 7
        Attribute data list: 2 entries
        Handle: 0x001b
        Value: 021c00262a
            Properties: 0x02
              Read (0x02)
            Value Handle: 0x001c
            Value UUID: Firmware Revision String (0x2a26)
        Handle: 0x001d
        Value: 021e00272a
            Properties: 0x02
              Read (0x02)
            Value Handle: 0x001e
            Value UUID: Hardware Revision String (0x2a27)
> HCI Event: Number of Completed Packets (0x13) plen 5      #81 [hci1] 7.718638
        Num handles: 1
        Handle: 3423 Address: DF:A9:FF:F6:B1:1A (OUI DF-A9-FF)
        Count: 1
        #80: len 20 (0 Kb/s)
        Latency: 163 msec (158-174 msec ~166 msec)
> ACL Data RX: Handle 3423 flags 0x02 dlen 11               #82 [hci1] 7.718901
      ATT: Read By Type Request (0x08) len 6
        Handle range: 0x001e-0x0026
        Attribute type: Characteristic (0x2803)
< HCI Command: Host Number of Compl.. (0x03|0x0035) plen 5  #83 [hci1] 7.734669
        Num handles: 1
        Handle: 3423 Address: DF:A9:FF:F6:B1:1A (OUI DF-A9-FF)
        Count: 1
< ACL Data TX: Handle 3423 flags 0x00 dlen 20               #84 [hci1] 7.734753
      ATT: Read By Type Response (0x09) len 15
        Attribute data length: 7
        Attribute data list: 2 entries
        Handle: 0x001f
        Value: 022000282a
            Properties: 0x02
              Read (0x02)
            Value Handle: 0x0020
            Value UUID: Software Revision String (0x2a28)
        Handle: 0x0021
        Value: 022200ff2b
            Properties: 0x02
              Read (0x02)
            Value Handle: 0x0022
            Value UUID: Unknown (0x2bff)
> HCI Event: Number of Completed Packets (0x13) plen 5      #85 [hci1] 7.893681
        Num handles: 1
        Handle: 3423 Address: DF:A9:FF:F6:B1:1A (OUI DF-A9-FF)
        Count: 1
        #84: len 20 (1 Kb/s)
        Latency: 158 msec (158-174 msec ~162 msec)
> ACL Data RX: Handle 3423 flags 0x02 dlen 11               #86 [hci1] 7.893855
      ATT: Read By Type Request (0x08) len 6
        Handle range: 0x0022-0x0026
        Attribute type: Characteristic (0x2803)
< HCI Command: Host Number of Compl.. (0x03|0x0035) plen 5  #87 [hci1] 7.894348
        Num handles: 1
        Handle: 3423 Address: DF:A9:FF:F6:B1:1A (OUI DF-A9-FF)
        Count: 1
< ACL Data TX: Handle 3423 flags 0x00 dlen 20               #88 [hci1] 7.894433
      ATT: Read By Type Response (0x09) len 15
        Attribute data length: 7
        Attribute data list: 2 entries
        Handle: 0x0023
        Value: 022400232a
            Properties: 0x02
              Read (0x02)
            Value Handle: 0x0024
            Value UUID: System ID (0x2a23)
        Handle: 0x0025
        Value: 0226002a2a
            Properties: 0x02
              Read (0x02)
            Value Handle: 0x0026
            Value UUID: IEEE 11073-20601 Regulatory Cert. Data List (0x2a2a)
> HCI Event: Number of Completed Packets (0x13) plen 5      #89 [hci1] 8.068755
        Num handles: 1
        Handle: 3423 Address: DF:A9:FF:F6:B1:1A (OUI DF-A9-FF)
        Count: 1
        #88: len 20 (0 Kb/s)
        Latency: 174 msec (158-174 msec ~168 msec)
> ACL Data RX: Handle 3423 flags 0x02 dlen 11               #90 [hci1] 8.068839
      ATT: Read By Type Request (0x08) len 6
        Handle range: 0x0026-0x0026
        Attribute type: Characteristic (0x2803)
< HCI Command: Host Number of Compl.. (0x03|0x0035) plen 5  #91 [hci1] 8.074568
        Num handles: 1
        Handle: 3423 Address: DF:A9:FF:F6:B1:1A (OUI DF-A9-FF)
        Count: 1
< ACL Data TX: Handle 3423 flags 0x00 dlen 9                #92 [hci1] 8.074862
      ATT: Error Response (0x01) len 4
        Read By Type Request (0x08)
        Handle: 0x0026
        Error: Attribute Not Found (0x0a)
> HCI Event: Number of Completed Packets (0x13) plen 5      #93 [hci1] 8.243669
        Num handles: 1
        Handle: 3423 Address: DF:A9:FF:F6:B1:1A (OUI DF-A9-FF)
        Count: 1
        #92: len 9 (0 Kb/s)
        Latency: 168 msec (158-174 msec ~168 msec)
> ACL Data RX: Handle 3423 flags 0x02 dlen 13               #94 [hci1] 8.243868
      ATT: Find By Type Value Request (0x06) len 8
        Handle range: 0x0001-0xffff
        Attribute type: Primary Service (0x2800)
          UUID: Device Information (0x180a)
< HCI Command: Host Number of Compl.. (0x03|0x0035) plen 5  #95 [hci1] 8.254716
        Num handles: 1
        Handle: 3423 Address: DF:A9:FF:F6:B1:1A (OUI DF-A9-FF)
        Count: 1
< ACL Data TX: Handle 3423 flags 0x00 dlen 9                #96 [hci1] 8.254832
      ATT: Find By Type Value Response (0x07) len 4
        Handle range: 0x0012-0x0026
> HCI Event: Number of Completed Packets (0x13) plen 5      #97 [hci1] 8.418637
        Num handles: 1
        Handle: 3423 Address: DF:A9:FF:F6:B1:1A (OUI DF-A9-FF)
        Count: 1
        #96: len 9 (0 Kb/s)
        Latency: 163 msec (158-174 msec ~166 msec)
> ACL Data RX: Handle 3423 flags 0x02 dlen 13               #98 [hci1] 8.418948
      ATT: Find By Type Value Request (0x06) len 8
        Handle range: 0x0027-0xffff
        Attribute type: Primary Service (0x2800)
          UUID: Device Information (0x180a)
< HCI Command: Host Number of Compl.. (0x03|0x0035) plen 5  #99 [hci1] 8.434700
        Num handles: 1
        Handle: 3423 Address: DF:A9:FF:F6:B1:1A (OUI DF-A9-FF)
        Count: 1
< ACL Data TX: Handle 3423 flags 0x00 dlen 9               #100 [hci1] 8.434953
      ATT: Error Response (0x01) len 4
        Find By Type Value Request (0x06)
        Handle: 0x0027
        Error: Attribute Not Found (0x0a)
> HCI Event: Number of Completed Packets (0x13) plen 5     #101 [hci1] 8.593591
        Num handles: 1
        Handle: 3423 Address: DF:A9:FF:F6:B1:1A (OUI DF-A9-FF)
        Count: 1
        #100: len 9 (0 Kb/s)
        Latency: 158 msec (158-174 msec ~162 msec)
> ACL Data RX: Handle 3423 flags 0x02 dlen 11              #102 [hci1] 8.594055
      ATT: Read By Type Request (0x08) len 6
        Handle range: 0x0012-0x0026
        Attribute type: Characteristic (0x2803)
< HCI Command: Host Number of Comp.. (0x03|0x0035) plen 5  #103 [hci1] 8.614340
        Num handles: 1
        Handle: 3423 Address: DF:A9:FF:F6:B1:1A (OUI DF-A9-FF)
        Count: 1
< ACL Data TX: Handle 3423 flags 0x00 dlen 20              #104 [hci1] 8.614393
      ATT: Read By Type Response (0x09) len 15
        Attribute data length: 7
        Attribute data list: 2 entries
        Handle: 0x0013
        Value: 021400242a
            Properties: 0x02
              Read (0x02)
            Value Handle: 0x0014
            Value UUID: Model Number String (0x2a24)
        Handle: 0x0015
        Value: 021600292a
            Properties: 0x02
              Read (0x02)
            Value Handle: 0x0016
            Value UUID: Manufacturer Name String (0x2a29)
< ACL Data TX: Handle 3423 flags 0x00 dlen 16              #105 [hci1] 8.704144
      LE L2CAP: Connection Parameter Update Request (0x12) ident 1 len 8
        Min interval: 24
        Max interval: 40
        Peripheral latency: 0
        Timeout multiplier: 42
> HCI Event: Number of Completed Packets (0x13) plen 5     #106 [hci1] 8.768644
        Num handles: 1
        Handle: 3423 Address: DF:A9:FF:F6:B1:1A (OUI DF-A9-FF)
        Count: 1
        #104: len 20 (1 Kb/s)
        Latency: 154 msec (154-174 msec ~158 msec)
> ACL Data RX: Handle 3423 flags 0x02 dlen 11              #107 [hci1] 8.768781
      ATT: Read By Type Request (0x08) len 6
        Handle range: 0x0016-0x0026
        Attribute type: Characteristic (0x2803)
< HCI Command: Host Number of Comp.. (0x03|0x0035) plen 5  #108 [hci1] 8.774716
        Num handles: 1
        Handle: 3423 Address: DF:A9:FF:F6:B1:1A (OUI DF-A9-FF)
        Count: 1
< ACL Data TX: Handle 3423 flags 0x00 dlen 20              #109 [hci1] 8.774869
      ATT: Read By Type Response (0x09) len 15
        Attribute data length: 7
        Attribute data list: 2 entries
        Handle: 0x0017
        Value: 021800502a
            Properties: 0x02
              Read (0x02)
            Value Handle: 0x0018
            Value UUID: PnP ID (0x2a50)
        Handle: 0x0019
        Value: 021a00252a
            Properties: 0x02
              Read (0x02)
            Value Handle: 0x001a
            Value UUID: Serial Number String (0x2a25)
> HCI Event: Number of Completed Packets (0x13) plen 5     #110 [hci1] 8.856109
        Num handles: 1
        Handle: 3423 Address: DF:A9:FF:F6:B1:1A (OUI DF-A9-FF)
        Count: 1
        #105: len 16 (0 Kb/s)
        Latency: 151 msec (151-174 msec ~155 msec)
> ACL Data RX: Handle 3423 flags 0x02 dlen 10              #111 [hci1] 8.856236
      LE L2CAP: Connection Parameter Update Response (0x13) ident 1 len 2
        Result: Connection Parameters accepted (0x0000)
< HCI Command: Host Number of Comp.. (0x03|0x0035) plen 5  #112 [hci1] 8.874334
        Num handles: 1
        Handle: 3423 Address: DF:A9:FF:F6:B1:1A (OUI DF-A9-FF)
        Count: 1
> HCI Event: Number of Completed Packets (0x13) plen 5     #113 [hci1] 8.943565
        Num handles: 1
        Handle: 3423 Address: DF:A9:FF:F6:B1:1A (OUI DF-A9-FF)
        Count: 1
        #109: len 20 (0 Kb/s)
        Latency: 168 msec (151-174 msec ~161 msec)
> ACL Data RX: Handle 3423 flags 0x02 dlen 11              #114 [hci1] 8.943950
      ATT: Read By Type Request (0x08) len 6
        Handle range: 0x001a-0x0026
        Attribute type: Characteristic (0x2803)
< HCI Command: Host Number of Comp.. (0x03|0x0035) plen 5  #115 [hci1] 8.954183
        Num handles: 1
        Handle: 3423 Address: DF:A9:FF:F6:B1:1A (OUI DF-A9-FF)
        Count: 1
< ACL Data TX: Handle 3423 flags 0x00 dlen 20              #116 [hci1] 8.954205
      ATT: Read By Type Response (0x09) len 15
        Attribute data length: 7
        Attribute data list: 2 entries
        Handle: 0x001b
        Value: 021c00262a
            Properties: 0x02
              Read (0x02)
            Value Handle: 0x001c
            Value UUID: Firmware Revision String (0x2a26)
        Handle: 0x001d
        Value: 021e00272a
            Properties: 0x02
              Read (0x02)
            Value Handle: 0x001e
            Value UUID: Hardware Revision String (0x2a27)
> HCI Event: Number of Completed Packets (0x13) plen 5     #117 [hci1] 9.118608
        Num handles: 1
        Handle: 3423 Address: DF:A9:FF:F6:B1:1A (OUI DF-A9-FF)
        Count: 1
        #116: len 20 (0 Kb/s)
        Latency: 164 msec (151-174 msec ~163 msec)
> ACL Data RX: Handle 3423 flags 0x02 dlen 11              #118 [hci1] 9.118897
      ATT: Read By Type Request (0x08) len 6
        Handle range: 0x001e-0x0026
        Attribute type: Characteristic (0x2803)
< HCI Command: Host Number of Comp.. (0x03|0x0035) plen 5  #119 [hci1] 9.134546
        Num handles: 1
        Handle: 3423 Address: DF:A9:FF:F6:B1:1A (OUI DF-A9-FF)
        Count: 1
< ACL Data TX: Handle 3423 flags 0x00 dlen 20              #120 [hci1] 9.134667
      ATT: Read By Type Response (0x09) len 15
        Attribute data length: 7
        Attribute data list: 2 entries
        Handle: 0x001f
        Value: 022000282a
            Properties: 0x02
              Read (0x02)
            Value Handle: 0x0020
            Value UUID: Software Revision String (0x2a28)
        Handle: 0x0021
        Value: 022200ff2b
            Properties: 0x02
              Read (0x02)
            Value Handle: 0x0022
            Value UUID: Unknown (0x2bff)
> HCI Event: Number of Completed Packets (0x13) plen 5     #121 [hci1] 9.293646
        Num handles: 1
        Handle: 3423 Address: DF:A9:FF:F6:B1:1A (OUI DF-A9-FF)
        Count: 1
        #120: len 20 (1 Kb/s)
        Latency: 158 msec (151-174 msec ~161 msec)
> ACL Data RX: Handle 3423 flags 0x02 dlen 11              #122 [hci1] 9.293945
      ATT: Read By Type Request (0x08) len 6
        Handle range: 0x0022-0x0026
        Attribute type: Characteristic (0x2803)
< HCI Command: Host Number of Comp.. (0x03|0x0035) plen 5  #123 [hci1] 9.314411
        Num handles: 1
        Handle: 3423 Address: DF:A9:FF:F6:B1:1A (OUI DF-A9-FF)
        Count: 1
< ACL Data TX: Handle 3423 flags 0x00 dlen 20              #124 [hci1] 9.314442
      ATT: Read By Type Response (0x09) len 15
        Attribute data length: 7
        Attribute data list: 2 entries
        Handle: 0x0023
        Value: 022400232a
            Properties: 0x02
              Read (0x02)
            Value Handle: 0x0024
            Value UUID: System ID (0x2a23)
        Handle: 0x0025
        Value: 0226002a2a
            Properties: 0x02
              Read (0x02)
            Value Handle: 0x0026
            Value UUID: IEEE 11073-20601 Regulatory Cert. Data List (0x2a2a)
> HCI Event: Number of Completed Packets (0x13) plen 5     #125 [hci1] 9.468637
        Num handles: 1
        Handle: 3423 Address: DF:A9:FF:F6:B1:1A (OUI DF-A9-FF)
        Count: 1
        #124: len 20 (1 Kb/s)
        Latency: 154 msec (151-174 msec ~157 msec)
> ACL Data RX: Handle 3423 flags 0x02 dlen 11              #126 [hci1] 9.468841
      ATT: Read By Type Request (0x08) len 6
        Handle range: 0x0026-0x0026
        Attribute type: Characteristic (0x2803)
< HCI Command: Host Number of Comp.. (0x03|0x0035) plen 5  #127 [hci1] 9.474215
        Num handles: 1
        Handle: 3423 Address: DF:A9:FF:F6:B1:1A (OUI DF-A9-FF)
        Count: 1
< ACL Data TX: Handle 3423 flags 0x00 dlen 9               #128 [hci1] 9.474263
      ATT: Error Response (0x01) len 4
        Read By Type Request (0x08)
        Handle: 0x0026
        Error: Attribute Not Found (0x0a)
> HCI Event: Number of Completed Packets (0x13) plen 5     #129 [hci1] 9.643583
        Num handles: 1
        Handle: 3423 Address: DF:A9:FF:F6:B1:1A (OUI DF-A9-FF)
        Count: 1
        #128: len 9 (0 Kb/s)
        Latency: 169 msec (151-174 msec ~163 msec)
> ACL Data RX: Handle 3423 flags 0x02 dlen 7               #130 [hci1] 9.643894
      ATT: Read Request (0x0a) len 2
        Handle: 0x0016 Type: Manufacturer Name String (0x2a29)
< HCI Command: Host Number of Comp.. (0x03|0x0035) plen 5  #131 [hci1] 9.654274
        Num handles: 1
        Handle: 3423 Address: DF:A9:FF:F6:B1:1A (OUI DF-A9-FF)
        Count: 1
< ACL Data TX: Handle 3423 flags 0x00 dlen 17              #132 [hci1] 9.654381
      ATT: Read Response (0x0b) len 12
> HCI Event: Number of Completed Packets (0x13) plen 5     #133 [hci1] 9.818618
        Num handles: 1
        Handle: 3423 Address: DF:A9:FF:F6:B1:1A (OUI DF-A9-FF)
        Count: 1
        #132: len 17 (0 Kb/s)
        Latency: 164 msec (151-174 msec ~163 msec)
> ACL Data RX: Handle 3423 flags 0x02 dlen 7               #134 [hci1] 9.818773
      ATT: Read Request (0x0a) len 2
        Handle: 0x0014 Type: Model Number String (0x2a24)
< HCI Command: Host Number of Comp.. (0x03|0x0035) plen 5  #135 [hci1] 9.834587
        Num handles: 1
        Handle: 3423 Address: DF:A9:FF:F6:B1:1A (OUI DF-A9-FF)
        Count: 1
< ACL Data TX: Handle 3423 flags 0x00 dlen 11              #136 [hci1] 9.834703
      ATT: Read Response (0x0b) len 6
> HCI Event: Number of Completed Packets (0x13) plen 5     #137 [hci1] 9.993580
        Num handles: 1
        Handle: 3423 Address: DF:A9:FF:F6:B1:1A (OUI DF-A9-FF)
        Count: 1
        #136: len 11 (0 Kb/s)
        Latency: 158 msec (151-174 msec ~161 msec)
> ACL Data RX: Handle 3423 flags 0x02 dlen 7               #138 [hci1] 9.993775
      ATT: Read Request (0x0a) len 2
        Handle: 0x001a Type: Serial Number String (0x2a25)
< HCI Command: Host Number of Comp.. (0x03|0x0035) plen 5  #139 [hci1] 9.994309
        Num handles: 1
        Handle: 3423 Address: DF:A9:FF:F6:B1:1A (OUI DF-A9-FF)
        Count: 1
< ACL Data TX: Handle 3423 flags 0x00 dlen 5               #140 [hci1] 9.994398
      ATT: Read Response (0x0b) len 0
> HCI Event: Number of Completed Packets (0x13) plen 5    #141 [hci1] 10.168550
        Num handles: 1
        Handle: 3423 Address: DF:A9:FF:F6:B1:1A (OUI DF-A9-FF)
        Count: 1
        #140: len 5 (0 Kb/s)
        Latency: 174 msec (151-174 msec ~167 msec)
> ACL Data RX: Handle 3423 flags 0x02 dlen 7              #142 [hci1] 10.168734
      ATT: Read Request (0x0a) len 2
        Handle: 0x001e Type: Hardware Revision String (0x2a27)
< HCI Command: Host Number of Com.. (0x03|0x0035) plen 5  #143 [hci1] 10.174343
        Num handles: 1
        Handle: 3423 Address: DF:A9:FF:F6:B1:1A (OUI DF-A9-FF)
        Count: 1
< ACL Data TX: Handle 3423 flags 0x00 dlen 5              #144 [hci1] 10.174457
      ATT: Read Response (0x0b) len 0
> HCI Event: Number of Completed Packets (0x13) plen 5    #145 [hci1] 10.343653
        Num handles: 1
        Handle: 3423 Address: DF:A9:FF:F6:B1:1A (OUI DF-A9-FF)
        Count: 1
        #144: len 5 (0 Kb/s)
        Latency: 169 msec (151-174 msec ~168 msec)
> ACL Data RX: Handle 3423 flags 0x02 dlen 7              #146 [hci1] 10.343768
      ATT: Read Request (0x0a) len 2
        Handle: 0x001c Type: Firmware Revision String (0x2a26)
< HCI Command: Host Number of Com.. (0x03|0x0035) plen 5  #147 [hci1] 10.354651
        Num handles: 1
        Handle: 3423 Address: DF:A9:FF:F6:B1:1A (OUI DF-A9-FF)
        Count: 1
< ACL Data TX: Handle 3423 flags 0x00 dlen 12             #148 [hci1] 10.354763
      ATT: Read Response (0x0b) len 7
> HCI Event: Number of Completed Packets (0x13) plen 5    #149 [hci1] 10.518574
        Num handles: 1
        Handle: 3423 Address: DF:A9:FF:F6:B1:1A (OUI DF-A9-FF)
        Count: 1
        #148: len 12 (0 Kb/s)
        Latency: 163 msec (151-174 msec ~166 msec)
> ACL Data RX: Handle 3423 flags 0x02 dlen 7              #150 [hci1] 10.518770
      ATT: Read Request (0x0a) len 2
        Handle: 0x0020 Type: Software Revision String (0x2a28)
< HCI Command: Host Number of Com.. (0x03|0x0035) plen 5  #151 [hci1] 10.534261
        Num handles: 1
        Handle: 3423 Address: DF:A9:FF:F6:B1:1A (OUI DF-A9-FF)
        Count: 1
< ACL Data TX: Handle 3423 flags 0x00 dlen 5              #152 [hci1] 10.534299
      ATT: Read Response (0x0b) len 0
> HCI Event: Number of Completed Packets (0x13) plen 5    #153 [hci1] 10.693517
        Num handles: 1
        Handle: 3423 Address: DF:A9:FF:F6:B1:1A (OUI DF-A9-FF)
        Count: 1
        #152: len 5 (0 Kb/s)
        Latency: 159 msec (151-174 msec ~162 msec)
> ACL Data RX: Handle 3423 flags 0x02 dlen 7              #154 [hci1] 10.693769
      ATT: Read Request (0x0a) len 2
        Handle: 0x0024 Type: System ID (0x2a23)
< HCI Command: Host Number of Com.. (0x03|0x0035) plen 5  #155 [hci1] 10.694287
        Num handles: 1
        Handle: 3423 Address: DF:A9:FF:F6:B1:1A (OUI DF-A9-FF)
        Count: 1
< ACL Data TX: Handle 3423 flags 0x00 dlen 13             #156 [hci1] 10.694333
      ATT: Read Response (0x0b) len 8
> HCI Event: Number of Completed Packets (0x13) plen 5    #157 [hci1] 10.868606
        Num handles: 1
        Handle: 3423 Address: DF:A9:FF:F6:B1:1A (OUI DF-A9-FF)
        Count: 1
        #156: len 13 (0 Kb/s)
        Latency: 174 msec (151-174 msec ~168 msec)
> ACL Data RX: Handle 3423 flags 0x02 dlen 7              #158 [hci1] 10.868754
      ATT: Read Request (0x0a) len 2
        Handle: 0x0026 Type: IEEE 11073-20601 Regulatory Cert. Data List (0x2a2a)
< HCI Command: Host Number of Com.. (0x03|0x0035) plen 5  #159 [hci1] 10.874622
        Num handles: 1
        Handle: 3423 Address: DF:A9:FF:F6:B1:1A (OUI DF-A9-FF)
        Count: 1
< ACL Data TX: Handle 3423 flags 0x00 dlen 5              #160 [hci1] 10.874706
      ATT: Read Response (0x0b) len 0
> HCI Event: Number of Completed Packets (0x13) plen 5    #161 [hci1] 11.043505
        Num handles: 1
        Handle: 3423 Address: DF:A9:FF:F6:B1:1A (OUI DF-A9-FF)
        Count: 1
        #160: len 5 (0 Kb/s)
        Latency: 168 msec (151-174 msec ~168 msec)
> ACL Data RX: Handle 3423 flags 0x02 dlen 7              #162 [hci1] 11.043811
      ATT: Read Request (0x0a) len 2
        Handle: 0x0018 Type: PnP ID (0x2a50)
< HCI Command: Host Number of Com.. (0x03|0x0035) plen 5  #163 [hci1] 11.054597
        Num handles: 1
        Handle: 3423 Address: DF:A9:FF:F6:B1:1A (OUI DF-A9-FF)
        Count: 1
< ACL Data TX: Handle 3423 flags 0x00 dlen 12             #164 [hci1] 11.054721
      ATT: Read Response (0x0b) len 7
> HCI Event: Number of Completed Packets (0x13) plen 5    #165 [hci1] 11.218525
        Num handles: 1
        Handle: 3423 Address: DF:A9:FF:F6:B1:1A (OUI DF-A9-FF)
        Count: 1
        #164: len 12 (0 Kb/s)
        Latency: 163 msec (151-174 msec ~166 msec)
> ACL Data RX: Handle 3423 flags 0x02 dlen 7              #166 [hci1] 11.218737
      ATT: Read Request (0x0a) len 2
        Handle: 0x0022 Type: Unknown (0x2bff)
< HCI Command: Host Number of Com.. (0x03|0x0035) plen 5  #167 [hci1] 11.234425
        Num handles: 1
        Handle: 3423 Address: DF:A9:FF:F6:B1:1A (OUI DF-A9-FF)
        Count: 1
< ACL Data TX: Handle 3423 flags 0x00 dlen 6              #168 [hci1] 11.234513
      ATT: Read Response (0x0b) len 1
> HCI Event: Number of Completed Packets (0x13) plen 5    #169 [hci1] 11.393434
        Num handles: 1
        Handle: 3423 Address: DF:A9:FF:F6:B1:1A (OUI DF-A9-FF)
        Count: 1
        #168: len 6 (0 Kb/s)
        Latency: 158 msec (151-174 msec ~162 msec)
> HCI Event: Disconnect Complete (0x05) plen 4            #170 [hci1] 12.793720
        Status: Success (0x00)
        Handle: 3423 Address: DF:A9:FF:F6:B1:1A (OUI DF-A9-FF)
        Reason: Remote User Terminated Connection (0x13)
< HCI Command: Reset (0x03|0x0003) plen 0                 #171 [hci1] 19.454459
> HCI Event: Command Complete (0x0e) plen 4               #172 [hci1] 19.455063
      Reset (0x03|0x0003) ncmd 1
        Status: Success (0x00)
@ USER Close: main                                    {0x0001} [hci1] 19.474053
= Close Index: 00:00:00:00:00:00                               [hci1] 19.474065
