Bluetooth monitor ver 5.72
btmon[1035143]: = Note: Linux version 6.14.0-36-generic (x86_64)                                                         0.328475
btmon[1035143]: = Note: Bluetooth subsystem version 2.22                                                                 0.328476
= New Index: 00:00:00:00:00:00 (Primary,UART,hci1)                                                                       0.328477
= New Index: 48:5F:99:8E:E0:64 (Primary,USB,hci0)                                                                        0.328478
= Open Index: 00:00:00:00:00:00                                                                                          0.841762
= Index Info: 00:00:00:00:00:00 (Nordic Semiconductor ASA)                                                               0.841771
zephyr.exe[1035145]: @ USER Open: main (privileged) version 2.22                                                {0x0001} 0.841774
zephyr.exe[1035145]: < HCI Command: Reset (0x03|0x0003) plen 0                                                        #1 0.842084
> HCI Event: Command Complete (0x0e) plen 4                                                                           #2 0.842602
      Reset (0x03|0x0003) ncmd 1
        Status: Success (0x00)
zephyr.exe[1035145]: < HCI Command: Read Local Supported Features (0x04|0x0003) plen 0                                #3 0.861796
> HCI Event: Command Complete (0x0e) plen 12                                                                          #4 0.862257
      Read Local Supported Features (0x04|0x0003) ncmd 1
        Status: Success (0x00)
        Features: 0x00 0x00 0x00 0x00 0x60 0x00 0x00 0x00
          BR/EDR Not Supported
          LE Supported (Controller)
zephyr.exe[1035145]: < HCI Command: Read Local Version Information (0x04|0x0001) plen 0                               #5 0.881784
> HCI Event: Command Complete (0x0e) plen 12                                                                          #6 0.882314
      Read Local Version Information (0x04|0x0001) ncmd 1
        Status: Success (0x00)
        HCI version: Reserved (0x0e) - Revision 12520 (0x30e8)
        LMP version: Reserved (0x0e) - Subversion 12520 (0x30e8)
        Manufacturer: Nordic Semiconductor ASA (89)
zephyr.exe[1035145]: < HCI Command: Read Local Supported Commands (0x04|0x0002) plen 0                                #7 0.901817
> HCI Event: Command Complete (0x0e) plen 68                                                                          #8 0.902934
      Read Local Supported Commands (0x04|0x0002) ncmd 1
        Status: Success (0x00)
        Commands: 119 entries
          Disconnect (Octet 0 - Bit 5)
          Read Remote Version Information (Octet 2 - Bit 7)
          Set Event Mask (Octet 5 - Bit 6)
          Reset (Octet 5 - Bit 7)
          Read Connection Accept Timeout (Octet 7 - Bit 2)
          Write Connection Accept Timeout (Octet 7 - Bit 3)
          Read Transmit Power Level (Octet 10 - Bit 2)
          Set Controller To Host Flow Control (Octet 10 - Bit 5)
          Host Buffer Size (Octet 10 - Bit 6)
          Host Number of Completed Packets (Octet 10 - Bit 7)
          Read Local Version Information (Octet 14 - Bit 3)
          Read Local Supported Features (Octet 14 - Bit 5)
          Read BD ADDR (Octet 15 - Bit 1)
          Read RSSI (Octet 15 - Bit 5)
          Set Event Mask Page 2 (Octet 22 - Bit 2)
          LE Set Event Mask (Octet 25 - Bit 0)
          LE Read Buffer Size (Octet 25 - Bit 1)
          LE Read Local Supported Features (Octet 25 - Bit 2)
          LE Set Random Address (Octet 25 - Bit 4)
          LE Set Advertising Parameters (Octet 25 - Bit 5)
          LE Read Advertising Channel TX Power (Octet 25 - Bit 6)
          LE Set Advertising Data (Octet 25 - Bit 7)
          LE Set Scan Response Data (Octet 26 - Bit 0)
          LE Set Advertise Enable (Octet 26 - Bit 1)
          LE Set Scan Parameters (Octet 26 - Bit 2)
          LE Set Scan Enable (Octet 26 - Bit 3)
          LE Create Connection (Octet 26 - Bit 4)
          LE Create Connection Cancel (Octet 26 - Bit 5)
          LE Read Accept List Size (Octet 26 - Bit 6)
          LE Clear Accept List (Octet 26 - Bit 7)
          LE Add Device To Accept List (Octet 27 - Bit 0)
          LE Remove Device From Accept List (Octet 27 - Bit 1)
          LE Connection Update (Octet 27 - Bit 2)
          LE Set Host Channel Classification (Octet 27 - Bit 3)
          LE Read Channel Map (Octet 27 - Bit 4)
          LE Read Remote Used Features (Octet 27 - Bit 5)
          LE Encrypt (Octet 27 - Bit 6)
          LE Rand (Octet 27 - Bit 7)
          LE Start Encryption (Octet 28 - Bit 0)
          LE Long Term Key Request Reply (Octet 28 - Bit 1)
          LE Long Term Key Request Neg Reply (Octet 28 - Bit 2)
          LE Read Supported States (Octet 28 - Bit 3)
          LE Receiver Test (Octet 28 - Bit 4)
          LE Transmitter Test (Octet 28 - Bit 5)
          LE Test End (Octet 28 - Bit 6)
          Read Authenticated Payload Timeout (Octet 32 - Bit 4)
          Write Authenticated Payload Timeout (Octet 32 - Bit 5)
          LE Set Data Length (Octet 33 - Bit 6)
          LE Read Suggested Default Data Length (Octet 33 - Bit 7)
          LE Write Suggested Default Data Length (Octet 34 - Bit 0)
          LE Add Device To Resolving List (Octet 34 - Bit 3)
          LE Remove Device From Resolving List (Octet 34 - Bit 4)
          LE Clear Resolving List (Octet 34 - Bit 5)
          LE Read Resolving List Size (Octet 34 - Bit 6)
          LE Set Address Resolution Enable (Octet 35 - Bit 1)
          LE Set Resolvable Private Address Timeout (Octet 35 - Bit 2)
          LE Read Maximum Data Length (Octet 35 - Bit 3)
          LE Read PHY (Octet 35 - Bit 4)
          LE Set Default PHY (Octet 35 - Bit 5)
          LE Set PHY (Octet 35 - Bit 6)
          LE Enhanced Receiver Test (Octet 35 - Bit 7)
          LE Enhanced Transmitter Test (Octet 36 - Bit 0)
          LE Set Advertising Set Random Address (Octet 36 - Bit 1)
          LE Set Extended Advertising Parameters (Octet 36 - Bit 2)
          LE Set Extended Advertising Data (Octet 36 - Bit 3)
          LE Set Extended Scan Response Data (Octet 36 - Bit 4)
          LE Set Extended Advertising Enable (Octet 36 - Bit 5)
          LE Read Maximum Advertising Data Length (Octet 36 - Bit 6)
          LE Read Number of Supported Advertising Sets (Octet 36 - Bit 7)
          LE Remove Advertising Set (Octet 37 - Bit 0)
          LE Clear Advertising Sets (Octet 37 - Bit 1)
          LE Set Periodic Advertising Parameters (Octet 37 - Bit 2)
          LE Set Periodic Advertising Data (Octet 37 - Bit 3)
          LE Set Periodic Advertising Enable (Octet 37 - Bit 4)
          LE Set Extended Scan Parameters (Octet 37 - Bit 5)
          LE Set Extended Scan Enable (Octet 37 - Bit 6)
          LE Extended Create Connection (Octet 37 - Bit 7)
          LE Periodic Advertising Create Sync (Octet 38 - Bit 0)
          LE Periodic Advertising Create Sync Cancel (Octet 38 - Bit 1)
          LE Periodic Advertising Terminate Sync (Octet 38 - Bit 2)
          LE Add Device To Periodic Advertiser List (Octet 38 - Bit 3)
          LE Remove Device From Periodic Advertiser List (Octet 38 - Bit 4)
          LE Clear Periodic Advertiser List (Octet 38 - Bit 5)
          LE Read Periodic Advertiser List Size (Octet 38 - Bit 6)
          LE Read Transmit Power (Octet 38 - Bit 7)
          LE Read RF Path Compensation (Octet 39 - Bit 0)
          LE Write RF Path Compensation (Octet 39 - Bit 1)
          LE Set Privacy Mode (Octet 39 - Bit 2)
          LE Periodic Advertising Receive Enable (Octet 40 - Bit 5)
          LE Periodic Advertising Sync Transfer (Octet 40 - Bit 6)
          LE Periodic Advertising Set Info Transfer (Octet 40 - Bit 7)
          LE Periodic Advertising Sync Transfer Parameters (Octet 41 - Bit 0)
          LE Set Default Periodic Advertisng Sync Transfer Parameters (Octet 41 - Bit 1)
          LE Read Buffer v2 (Octet 41 - Bit 5)
          LE Read ISO TX Sync (Octet 41 - Bit 6)
          LE Set Connected Isochronous Group Parameters (Octet 41 - Bit 7)
          LE Set Connected Isochronous Group Parameters Test (Octet 42 - Bit 0)
          LE Create Connected Isochronous Stream (Octet 42 - Bit 1)
          LE Remove Connected Isochronous Group (Octet 42 - Bit 2)
          LE Accept Connected Isochronous Stream Request (Octet 42 - Bit 3)
          LE Reject Connected Isochronous Stream Request (Octet 42 - Bit 4)
          LE Create Broadcast Isochronous Group (Octet 42 - Bit 5)
          LE Create Broadcast Isochronous Group Test (Octet 42 - Bit 6)
          LE Terminate Broadcast Isochronous Group (Octet 42 - Bit 7)
          LE Broadcast Isochronous Group Create Sync (Octet 43 - Bit 0)
          LE Broadcast Isochronous Group Terminate Sync (Octet 43 - Bit 1)
          LE Request Peer SCA (Octet 43 - Bit 2)
          LE Setup Isochronous Data Path (Octet 43 - Bit 3)
          LE Remove Isochronous Data Path (Octet 43 - Bit 4)
          LE Isochronous Transmit Test (Octet 43 - Bit 5)
          LE Isochronous Receive Test (Octet 43 - Bit 6)
          LE Isochronous Read Test Counters (Octet 43 - Bit 7)
          LE Isochronous Read Test Counters (Octet 44 - Bit 0)
          LE Set Host Feature (Octet 44 - Bit 1)
          Octet 44 - Bit 2 
          Octet 45 - Bit 6 
          Octet 46 - Bit 0 
          Octet 46 - Bit 1 
          Octet 46 - Bit 2 
zephyr.exe[1035145]: < HCI Command: Host Buffer Size (0x03|0x0033) plen 7                                             #9 0.921795
        ACL MTU: 255  ACL max packet: 16
        SCO MTU: 0    SCO max packet: 0
> HCI Event: Command Complete (0x0e) plen 4                                                                          #10 0.922293
      Host Buffer Size (0x03|0x0033) ncmd 1
        Status: Success (0x00)
zephyr.exe[1035145]: < HCI Command: Set Controller To Host Flow Control (0x03|0x0031) plen 1                         #11 0.941794
        Flow control: ACL Data Packets (0x01)
> HCI Event: Command Complete (0x0e) plen 4                                                                          #12 0.942250
      Set Controller To Host Flow Control (0x03|0x0031) ncmd 1
        Status: Success (0x00)
zephyr.exe[1035145]: < HCI Command: LE Read Local Supported Features (0x08|0x0003) plen 0                            #13 0.961759
> HCI Event: Command Complete (0x0e) plen 12                                                                         #14 0.962261
      LE Read Local Supported Features (0x08|0x0003) ncmd 1
        Status: Success (0x00)
        Features: 0xfd 0x79 0x00 0xf7 0x30 0x01 0x00 0x00
          LE Encryption
          Extended Reject Indication
          Peripheral-initiated Features Exchange
          LE Ping
          LE Data Packet Length Extension
          LL Privacy
          Extended Scanner Filter Policies
          LE 2M PHY
          LE Coded PHY
          LE Extended Advertising
          LE Periodic Advertising
          Channel Selection Algorithm #2
          Periodic Advertising Sync Transfer - Sender
          Periodic Advertising Sync Transfer - Recipient
          Sleep Clock Accuracy Updates
          Connected Isochronous Stream - Central
          Connected Isochronous Stream - Peripheral
          Isochronous Broadcaster
          Synchronized Receiver
          Periodic Advertising ADI support
          Connection Subrating
          Unknown features (0x0000010000000000)
zephyr.exe[1035145]: < HCI Command: LE Set Host Feature (0x08|0x0074) plen 2                                         #15 0.981791
        Bit Number: 32
          Connected Isochronous Stream (Host Support)
        Bit Value: 1
> HCI Event: Command Complete (0x0e) plen 4                                                                          #16 0.982244
      LE Set Host Feature (0x08|0x0074) ncmd 1
        Status: Success (0x00)
zephyr.exe[1035145]: < HCI Command: LE Read Buffer v2 (0x08|0x0060) plen 0                                           #17 1.001905
> HCI Event: Command Complete (0x0e) plen 10                                                                         #18 1.002367
      LE Read Buffer v2 (0x08|0x0060) ncmd 1
        Status: Success (0x00)
        ACL MTU: 27
        ACL max packet: 3
        ISO MTU: 318
        ISO max packet: 3
zephyr.exe[1035145]: < HCI Command: LE Read Maximum Advertising Data Length (0x08|0x003a) plen 0                     #19 1.021813
> HCI Event: Command Complete (0x0e) plen 6                                                                          #20 1.022252
      LE Read Maximum Advertising Data Length (0x08|0x003a) ncmd 1
        Status: Success (0x00)
        Max length: 1650
zephyr.exe[1035145]: < HCI Command: LE Read Supported States (0x08|0x001c) plen 0                                    #21 1.041799
> HCI Event: Command Complete (0x0e) plen 12                                                                         #22 1.042346
      LE Read Supported States (0x08|0x001c) ncmd 1
        Status: Success (0x00)
        States: 0x000003ff3e0306ff
          Non-connectable Advertising State
          Scannable Advertising State
          Connectable Advertising State
          High Duty Cycle Directed Advertising State
          Passive Scanning State
          Active Scanning State
          Initiating State
            and Connection State (Central Role)
          Connection State (Peripheral Role)
          Scannable Advertising State
            and Passive Scanning State
          Connectable Advertising State
            and Passive Scanning State
          Non-connectable Advertising State
            and Initiating State
          Scannable Advertising State
            and Initiating State
          Active Scanning State
            and Connection State (Central Role)
          Passive Scanning State
            and Connection State (Peripheral Role)
          Active Scanning State
            and Connection State (Peripheral Role)
          Initiating State
            and Connection State (Central Role)
            and Central Role & Central Role
          Low Duty Cycle Directed Advertising State
          Connectable Advertising State
            and Initiating State
            and Central Role & Peripheral Role
          High Duty Cycle Directed Advertising State
            and Initiating State
            and Central Role & Peripheral Role
          Low Duty Cycle Directed Advertising State
            and Initiating State
            and Central Role & Peripheral Role
          Connectable Advertising State
            and Connection State (Central Role)
            and Central Role & Peripheral Role
          High Duty Cycle Directed Advertising State
            and Connection State (Central Role)
            and Central Role & Peripheral Role
          Low Duty Cycle Directed Advertising State
            and Connection State (Central Role)
            and Central Role & Peripheral Role
          Connectable Advertising State
            and Connection State (Peripheral Role)
            and Central Role & Peripheral Role
          High Duty Cycle Directed Advertising State
            and Connection State (Peripheral Role)
            and Peripheral Role & Peripheral Role
          Low Duty Cycle Directed Advertising State
            and Connection State (Peripheral Role)
            and Peripheral Role & Peripheral Role
          Initiating State
            and Connection State (Peripheral Role)
            and Central Role & Peripheral Role
zephyr.exe[1035145]: < HCI Command: LE Read Maximum Data Length (0x08|0x002f) plen 0                                 #23 1.061762
> HCI Event: Command Complete (0x0e) plen 12                                                                         #24 1.062272
      LE Read Maximum Data Length (0x08|0x002f) ncmd 1
        Status: Success (0x00)
        Max TX octets: 251
        Max TX time: 2704
        Max RX octets: 251
        Max RX time: 2704
zephyr.exe[1035145]: < HCI Command: LE Write Suggested Default Data Length (0x08|0x0024) plen 4                      #25 1.081764
        TX octets: 251
        TX time: 2704
> HCI Event: Command Complete (0x0e) plen 4                                                                          #26 1.082207
      LE Write Suggested Default Data Length (0x08|0x0024) ncmd 1
        Status: Success (0x00)
zephyr.exe[1035145]: < HCI Command: LE Read Resolving List Size (0x08|0x002a) plen 0                                 #27 1.101800
> HCI Event: Command Complete (0x0e) plen 5                                                                          #28 1.102236
      LE Read Resolving List Size (0x08|0x002a) ncmd 1
        Status: Success (0x00)
        Size: 8
zephyr.exe[1035145]: < HCI Command: LE Set Event Mask (0x08|0x0001) plen 8                                           #29 1.121786
        Mask: 0x000002023f87fa5e
          LE Advertising Report
          LE Connection Update Complete
          LE Read Remote Used Features Complete
          LE Long Term Key Request
          LE Data Length Change
          LE Enhanced Connection Complete
          LE PHY Update Complete
          LE Extended Advertising Report
          LE Periodic Advertising Sync Established
          LE Periodic Advertising Report
          LE Periodic Advertising Sync Lost
          LE Extended Scan Timeout
          LE Extended Advertising Set Terminated
          LE Scan Request Received
          LE Periodic Advertising Sync Transfer Rvc
          LE CIS Established
          LE CIS Request
          LE Create BIG Complete
          LE Terminate BIG Complete
          LE BIG Sync Estabilished Complete
          LE BIG Sync Lost
          LE BIG Info Advertising Report
          Unknown mask (0x0000020000000000)
> HCI Event: Command Complete (0x0e) plen 4                                                                          #30 1.122273
      LE Set Event Mask (0x08|0x0001) ncmd 1
        Status: Success (0x00)
zephyr.exe[1035145]: < HCI Command: Set Event Mask (0x03|0x0001) plen 8                                              #31 1.141798
        Mask: 0x2000800002008890
          Disconnection Complete
          Encryption Change
          Read Remote Version Information Complete
          Hardware Error
          Data Buffer Overflow
          Encryption Key Refresh Complete
          LE Meta
> HCI Event: Command Complete (0x0e) plen 4                                                                          #32 1.142302
      Set Event Mask (0x03|0x0001) ncmd 1
        Status: Success (0x00)
zephyr.exe[1035145]: < HCI Command: Read BD ADDR (0x04|0x0009) plen 0                                                #33 1.161775
> HCI Event: Command Complete (0x0e) plen 10                                                                         #34 1.162253
      Read BD ADDR (0x04|0x0009) ncmd 1
        Status: Success (0x00)
        Address: 00:00:00:00:00:00 (OUI 00-00-00)
zephyr.exe[1035145]: < HCI Command: LE Set Random Address (0x08|0x0005) plen 6                                       #35 1.181812
        Address: D5:B6:CC:31:DB:3B (Static)
> HCI Event: Command Complete (0x0e) plen 4                                                                          #36 1.182380
      LE Set Random Address (0x08|0x0005) ncmd 1
        Status: Success (0x00)
zephyr.exe[1035145]: < HCI Command: LE Extended Create Connection (0x08|0x0043) plen 26                              #37 3.361861
        Filter policy: Accept list is not used (0x00)
        Own address type: Random (0x01)
        Peer address type: Public (0x00)
        Peer address: DF:A9:FF:F6:B1:1A (OUI DF-A9-FF)
        Initiating PHYs: 0x01
        Entry 0: LE 1M
          Scan interval: 60.000 msec (0x0060)
          Scan window: 60.000 msec (0x0060)
          Min connection interval: 30.00 msec (0x0018)
          Max connection interval: 50.00 msec (0x0028)
          Connection latency: 0 (0x0000)
          Supervision timeout: 4000 msec (0x0190)
          Min connection length: 0.000 msec (0x0000)
          Max connection length: 0.000 msec (0x0000)
> HCI Event: Command Status (0x0f) plen 4                                                                            #38 3.362751
      LE Extended Create Connection (0x08|0x0043) ncmd 1
        Status: Success (0x00)
> HCI Event: LE Meta Event (0x3e) plen 31                                                                            #39 3.439140
      LE Enhanced Connection Complete (0x0a)
        Status: Success (0x00)
        Handle: 162
        Role: Central (0x00)
        Peer address type: Public (0x00)
        Peer address: DF:A9:FF:F6:B1:1A (OUI DF-A9-FF)
        Local resolvable private address: 00:00:00:00:00:00 (Non-Resolvable)
        Peer resolvable private address: 00:00:00:00:00:00 (Non-Resolvable)
        Connection interval: 50.00 msec (0x0028)
        Connection latency: 0 (0x0000)
        Supervision timeout: 4000 msec (0x0190)
        Central clock accuracy: 0x00
zephyr.exe[1035145]: < HCI Command: LE Read Remote Used Features (0x08|0x0016) plen 2                                #40 3.441932
        Handle: 162 Address: DF:A9:FF:F6:B1:1A (OUI DF-A9-FF)
> HCI Event: Command Status (0x0f) plen 4                                                                            #41 3.442332
      LE Read Remote Used Features (0x08|0x0016) ncmd 1
        Status: Success (0x00)
zephyr.exe[1035145]: < HCI Command: LE Set PHY (0x08|0x0032) plen 7                                                  #42 3.461801
        Handle: 162 Address: DF:A9:FF:F6:B1:1A (OUI DF-A9-FF)
        All PHYs preference: 0x00
        TX PHYs preference: 0x02
          LE 2M
        RX PHYs preference: 0x02
          LE 2M
        PHY options preference: Reserved (0x0000)
> HCI Event: Command Status (0x0f) plen 4                                                                            #43 3.462423
      LE Set PHY (0x08|0x0032) ncmd 1
        Status: Success (0x00)
> HCI Event: LE Meta Event (0x3e) plen 12                                                                            #44 3.590611
      LE Read Remote Used Features (0x04)
        Status: Success (0x00)
        Handle: 162 Address: DF:A9:FF:F6:B1:1A (OUI DF-A9-FF)
        Features: 0x2d 0x49 0x00 0xf7 0x67 0xd8 0x00 0x00
          LE Encryption
          Extended Reject Indication
          Peripheral-initiated Features Exchange
          LE Data Packet Length Extension
          LE 2M PHY
          LE Coded PHY
          Channel Selection Algorithm #2
          Periodic Advertising Sync Transfer - Sender
          Periodic Advertising Sync Transfer - Recipient
          Sleep Clock Accuracy Updates
          Connected Isochronous Stream - Central
          Connected Isochronous Stream - Peripheral
          Isochronous Broadcaster
          Synchronized Receiver
          Connected Isochronous Stream (Host Support)
          LE Power Control Request
          LE Power Control Request
          Connection Subrating
          Connection Subrating (Host Support)
          Unknown features (0x0000d80000000000)
> HCI Event: LE Meta Event (0x3e) plen 6                                                                             #45 4.089823
      LE PHY Update Complete (0x0c)
        Status: Success (0x00)
        Handle: 162 Address: DF:A9:FF:F6:B1:1A (OUI DF-A9-FF)
        TX PHY: LE 2M (0x02)
        RX PHY: LE 2M (0x02)
zephyr.exe[1035145]: < ACL Data TX: Handle 162 flags 0x00 dlen 11                                                    #46 4.531754
      SMP: Pairing Request (0x01) len 6
        IO capability: NoInputNoOutput (0x03)
        OOB data: Authentication data not present (0x00)
        Authentication requirement: No bonding, No MITM, SC, No Keypresses (0x08)
        Max encryption key size: 16
        Initiator key distribution: <none> (0x00)
        Responder key distribution: <none> (0x00)
> HCI Event: Number of Completed Packets (0x13) plen 5                                                               #47 4.540387
        Num handles: 1
        Handle: 162 Address: DF:A9:FF:F6:B1:1A (OUI DF-A9-FF)
        Count: 1
        #46: len 11 (11 Kb/s)
        Latency: 8 msec (8-8 msec ~8 msec)
> ACL Data RX: Handle 162 flags 0x02 dlen 11                                                                         #48 4.590423
      SMP: Pairing Response (0x02) len 6
        IO capability: DisplayYesNo (0x01)
        OOB data: Authentication data not present (0x00)
        Authentication requirement: No bonding, No MITM, SC, No Keypresses (0x08)
        Max encryption key size: 16
        Initiator key distribution: <none> (0x00)
        Responder key distribution: <none> (0x00)
zephyr.exe[1035145]: < HCI Command: Host Number of Completed Packets (0x03|0x0035) plen 5                            #49 4.601909
        Num handles: 1
        Handle: 162 Address: DF:A9:FF:F6:B1:1A (OUI DF-A9-FF)
        Count: 1
zephyr.exe[1035145]: < ACL Data TX: Handle 162 flags 0x00 dlen 27                                                    #50 4.602021
zephyr.exe[1035145]: < ACL Data TX: Handle 162 flags 0x01 dlen 27                                                    #51 4.602024
zephyr.exe[1035145]: < ACL Data TX: Handle 162 flags 0x01 dlen 15                                                    #52 4.602024
      SMP: Pairing Public Key (0x0c) len 64
        X: 98308440221e2d910f0e54b71e7ec652857aa9b5a0dc65028824cc19db1226e9
        Y: 67a4816bcb62efb21701e31fdb27561a6217575fb007a8bbdabe7e28b6f68482
> HCI Event: Number of Completed Packets (0x13) plen 5                                                               #53 4.640335
        Num handles: 1
        Handle: 162 Address: DF:A9:FF:F6:B1:1A (OUI DF-A9-FF)
        Count: 1
        #50: len 27 (5 Kb/s)
        Latency: 38 msec (8-38 msec ~23 msec)
> HCI Event: Number of Completed Packets (0x13) plen 5                                                               #54 4.640864
        Num handles: 1
        Handle: 162 Address: DF:A9:FF:F6:B1:1A (OUI DF-A9-FF)
        Count: 1
        #51: len 27 (5 Kb/s)
        Latency: 38 msec (8-38 msec ~31 msec)
> HCI Event: Number of Completed Packets (0x13) plen 5                                                               #55 4.641292
        Num handles: 1
        Handle: 162 Address: DF:A9:FF:F6:B1:1A (OUI DF-A9-FF)
        Count: 1
        #52: len 15 (3 Kb/s)
        Latency: 39 msec (8-39 msec ~35 msec)
> ACL Data RX: Handle 162 flags 0x02 dlen 27                                                                         #56 4.690617
> ACL Data RX: Handle 162 flags 0x01 dlen 27                                                                         #57 4.691030
> ACL Data RX: Handle 162 flags 0x01 dlen 15                                                                         #58 4.691589
      SMP: Pairing Public Key (0x0c) len 64
        X: 8eae50eb1d858193980aeffa33c0b7282b39b07780cb6f89d6885c29f83ad93e
        Y: 869e4187be6f18779692ca9ad152e610da341f0a7f1482166db8a1c0078610f0
zephyr.exe[1035145]: < HCI Command: Host Number of Completed Packets (0x03|0x0035) plen 5                            #59 4.701971
        Num handles: 1
        Handle: 162 Address: DF:A9:FF:F6:B1:1A (OUI DF-A9-FF)
        Count: 1
zephyr.exe[1035145]: < HCI Command: Host Number of Completed Packets (0x03|0x0035) plen 5                            #60 4.702071
        Num handles: 1
        Handle: 162 Address: DF:A9:FF:F6:B1:1A (OUI DF-A9-FF)
        Count: 1
zephyr.exe[1035145]: < HCI Command: Host Number of Completed Packets (0x03|0x0035) plen 5                            #61 4.702098
        Num handles: 1
        Handle: 162 Address: DF:A9:FF:F6:B1:1A (OUI DF-A9-FF)
        Count: 1
> ACL Data RX: Handle 162 flags 0x02 dlen 21                                                                         #62 4.790589
      SMP: Pairing Confirm (0x03) len 16
        Confim value: e4baa496710b88b9b9cf4aac27aded42
zephyr.exe[1035145]: < HCI Command: Host Number of Completed Packets (0x03|0x0035) plen 5                            #63 4.801885
        Num handles: 1
        Handle: 162 Address: DF:A9:FF:F6:B1:1A (OUI DF-A9-FF)
        Count: 1
zephyr.exe[1035145]: < ACL Data TX: Handle 162 flags 0x00 dlen 21                                                    #64 4.801923
      SMP: Pairing Random (0x04) len 16
        Random value: 8e6108f966a694cbe26df70bb96773e6
> HCI Event: Number of Completed Packets (0x13) plen 5                                                               #65 4.840360
        Num handles: 1
        Handle: 162 Address: DF:A9:FF:F6:B1:1A (OUI DF-A9-FF)
        Count: 1
        #64: len 21 (4 Kb/s)
        Latency: 38 msec (8-39 msec ~36 msec)
> ACL Data RX: Handle 162 flags 0x02 dlen 21                                                                         #66 5.090457
      SMP: Pairing Random (0x04) len 16
        Random value: ca8a2bacbf2668c06a55f672c1005650
zephyr.exe[1035145]: < HCI Command: Host Number of Completed Packets (0x03|0x0035) plen 5                            #67 5.102110
        Num handles: 1
        Handle: 162 Address: DF:A9:FF:F6:B1:1A (OUI DF-A9-FF)
        Count: 1
zephyr.exe[1035145]: < ACL Data TX: Handle 162 flags 0x00 dlen 21                                                    #68 5.102204
      SMP: Pairing DHKey Check (0x0d) len 16
        E: 353eb45d5b7fed8c092e3d58cc228819
> HCI Event: Number of Completed Packets (0x13) plen 5                                                               #69 5.140294
        Num handles: 1
        Handle: 162 Address: DF:A9:FF:F6:B1:1A (OUI DF-A9-FF)
        Count: 1
        #68: len 21 (4 Kb/s)
        Latency: 38 msec (8-39 msec ~37 msec)
> ACL Data RX: Handle 162 flags 0x02 dlen 21                                                                         #70 5.190619
      SMP: Pairing DHKey Check (0x0d) len 16
        E: aad9107c75b632cc02ad60d5d69ae92a
zephyr.exe[1035145]: < HCI Command: LE Start Encryption (0x08|0x0019) plen 28                                        #71 5.202015
        Handle: 162 Address: DF:A9:FF:F6:B1:1A (OUI DF-A9-FF)
        Random number: 0x0000000000000000
        Encrypted diversifier: 0x0000
        Long term key: 4eeee8013440758ab8842b1c1bab3b85
> HCI Event: Command Status (0x0f) plen 4                                                                            #72 5.202906
      LE Start Encryption (0x08|0x0019) ncmd 1
        Status: Success (0x00)
zephyr.exe[1035145]: < HCI Command: Host Number of Completed Packets (0x03|0x0035) plen 5                            #73 5.221771
        Num handles: 1
        Handle: 162 Address: DF:A9:FF:F6:B1:1A (OUI DF-A9-FF)
        Count: 1
> HCI Event: Encryption Change (0x08) plen 4                                                                         #74 5.540299
        Status: Success (0x00)
        Handle: 162 Address: DF:A9:FF:F6:B1:1A (OUI DF-A9-FF)
        Encryption: Enabled with AES-CCM (0x01)
zephyr.exe[1035145]: < HCI Command: Disconnect (0x01|0x0006) plen 3                                                  #75 5.571820
        Handle: 162 Address: DF:A9:FF:F6:B1:1A (OUI DF-A9-FF)
        Reason: Remote User Terminated Connection (0x13)
> HCI Event: Command Status (0x0f) plen 4                                                                            #76 5.572231
      Disconnect (0x01|0x0006) ncmd 1
        Status: Success (0x00)
> HCI Event: Disconnect Complete (0x05) plen 4                                                                       #77 5.640289
        Status: Success (0x00)
        Handle: 162 Address: DF:A9:FF:F6:B1:1A (OUI DF-A9-FF)
        Reason: Connection Terminated By Local Host (0x16)
zephyr.exe[1035145]: < HCI Command: LE Extended Create Connection (0x08|0x0043) plen 26                              #78 6.851856
        Filter policy: Accept list is not used (0x00)
        Own address type: Random (0x01)
        Peer address type: Public (0x00)
        Peer address: DF:A9:FF:F6:B1:1A (OUI DF-A9-FF)
        Initiating PHYs: 0x01
        Entry 0: LE 1M
          Scan interval: 60.000 msec (0x0060)
          Scan window: 60.000 msec (0x0060)
          Min connection interval: 30.00 msec (0x0018)
          Max connection interval: 50.00 msec (0x0028)
          Connection latency: 0 (0x0000)
          Supervision timeout: 4000 msec (0x0190)
          Min connection length: 0.000 msec (0x0000)
          Max connection length: 0.000 msec (0x0000)
> HCI Event: Command Status (0x0f) plen 4                                                                            #79 6.852746
      LE Extended Create Connection (0x08|0x0043) ncmd 1
        Status: Success (0x00)
> HCI Event: LE Meta Event (0x3e) plen 31                                                                            #80 6.943807
      LE Enhanced Connection Complete (0x0a)
        Status: Success (0x00)
        Handle: 180
        Role: Central (0x00)
        Peer address type: Public (0x00)
        Peer address: DF:A9:FF:F6:B1:1A (OUI DF-A9-FF)
        Local resolvable private address: 00:00:00:00:00:00 (Non-Resolvable)
        Peer resolvable private address: 00:00:00:00:00:00 (Non-Resolvable)
        Connection interval: 50.00 msec (0x0028)
        Connection latency: 0 (0x0000)
        Supervision timeout: 4000 msec (0x0190)
        Central clock accuracy: 0x00
zephyr.exe[1035145]: < HCI Command: LE Read Remote Used Features (0x08|0x0016) plen 2                                #81 6.961927
        Handle: 180 Address: DF:A9:FF:F6:B1:1A (OUI DF-A9-FF)
> HCI Event: Command Status (0x0f) plen 4                                                                            #82 6.962302
      LE Read Remote Used Features (0x08|0x0016) ncmd 1
        Status: Success (0x00)
zephyr.exe[1035145]: < HCI Command: LE Set PHY (0x08|0x0032) plen 7                                                  #83 6.981760
        Handle: 180 Address: DF:A9:FF:F6:B1:1A (OUI DF-A9-FF)
        All PHYs preference: 0x00
        TX PHYs preference: 0x02
          LE 2M
        RX PHYs preference: 0x02
          LE 2M
        PHY options preference: Reserved (0x0000)
> HCI Event: Command Status (0x0f) plen 4                                                                            #84 6.982306
      LE Set PHY (0x08|0x0032) ncmd 1
        Status: Success (0x00)
> HCI Event: LE Meta Event (0x3e) plen 12                                                                            #85 7.095196
      LE Read Remote Used Features (0x04)
        Status: Success (0x00)
        Handle: 180 Address: DF:A9:FF:F6:B1:1A (OUI DF-A9-FF)
        Features: 0x2d 0x49 0x00 0xf7 0x67 0xd8 0x00 0x00
          LE Encryption
          Extended Reject Indication
          Peripheral-initiated Features Exchange
          LE Data Packet Length Extension
          LE 2M PHY
          LE Coded PHY
          Channel Selection Algorithm #2
          Periodic Advertising Sync Transfer - Sender
          Periodic Advertising Sync Transfer - Recipient
          Sleep Clock Accuracy Updates
          Connected Isochronous Stream - Central
          Connected Isochronous Stream - Peripheral
          Isochronous Broadcaster
          Synchronized Receiver
          Connected Isochronous Stream (Host Support)
          LE Power Control Request
          LE Power Control Request
          Connection Subrating
          Connection Subrating (Host Support)
          Unknown features (0x0000d80000000000)
> HCI Event: LE Meta Event (0x3e) plen 6                                                                             #86 7.594613
      LE PHY Update Complete (0x0c)
        Status: Success (0x00)
        Handle: 180 Address: DF:A9:FF:F6:B1:1A (OUI DF-A9-FF)
        TX PHY: LE 2M (0x02)
        RX PHY: LE 2M (0x02)
zephyr.exe[1035145]: < ACL Data TX: Handle 180 flags 0x00 dlen 11                                                    #87 7.991961
      SMP: Pairing Request (0x01) len 6
        IO capability: NoInputNoOutput (0x03)
        OOB data: Authentication data not present (0x00)
        Authentication requirement: No bonding, No MITM, SC, No Keypresses (0x08)
        Max encryption key size: 16
        Initiator key distribution: <none> (0x00)
        Responder key distribution: <none> (0x00)
> HCI Event: Number of Completed Packets (0x13) plen 5                                                               #88 7.995111
        Num handles: 1
        Handle: 180 Address: DF:A9:FF:F6:B1:1A (OUI DF-A9-FF)
        Count: 1
        #87: len 11 (29 Kb/s)
        Latency: 3 msec (3-3 msec ~3 msec)
> ACL Data RX: Handle 180 flags 0x02 dlen 11                                                                         #89 8.045168
      SMP: Pairing Response (0x02) len 6
        IO capability: DisplayYesNo (0x01)
        OOB data: Authentication data not present (0x00)
        Authentication requirement: No bonding, No MITM, SC, No Keypresses (0x08)
        Max encryption key size: 16
        Initiator key distribution: <none> (0x00)
        Responder key distribution: <none> (0x00)
zephyr.exe[1035145]: < HCI Command: Host Number of Completed Packets (0x03|0x0035) plen 5                            #90 8.061921
        Num handles: 1
        Handle: 180 Address: DF:A9:FF:F6:B1:1A (OUI DF-A9-FF)
        Count: 1
zephyr.exe[1035145]: < ACL Data TX: Handle 180 flags 0x00 dlen 27                                                    #91 8.062017
zephyr.exe[1035145]: < ACL Data TX: Handle 180 flags 0x01 dlen 27                                                    #92 8.062021
zephyr.exe[1035145]: < ACL Data TX: Handle 180 flags 0x01 dlen 15                                                    #93 8.062021
      SMP: Pairing Public Key (0x0c) len 64
        X: 98308440221e2d910f0e54b71e7ec652857aa9b5a0dc65028824cc19db1226e9
        Y: 67a4816bcb62efb21701e31fdb27561a6217575fb007a8bbdabe7e28b6f68482
> HCI Event: Number of Completed Packets (0x13) plen 5                                                               #94 8.095045
        Num handles: 1
        Handle: 180 Address: DF:A9:FF:F6:B1:1A (OUI DF-A9-FF)
        Count: 1
        #91: len 27 (6 Kb/s)
        Latency: 33 msec (3-33 msec ~18 msec)
> HCI Event: Number of Completed Packets (0x13) plen 5                                                               #95 8.095630
        Num handles: 1
        Handle: 180 Address: DF:A9:FF:F6:B1:1A (OUI DF-A9-FF)
        Count: 1
        #92: len 27 (6 Kb/s)
        Latency: 33 msec (3-33 msec ~25 msec)
> HCI Event: Number of Completed Packets (0x13) plen 5                                                               #96 8.095953
        Num handles: 1
        Handle: 180 Address: DF:A9:FF:F6:B1:1A (OUI DF-A9-FF)
        Count: 1
        #93: len 15 (3 Kb/s)
        Latency: 33 msec (3-33 msec ~29 msec)
> ACL Data RX: Handle 180 flags 0x02 dlen 27                                                                         #97 8.145249
> ACL Data RX: Handle 180 flags 0x01 dlen 27                                                                         #98 8.145846
> ACL Data RX: Handle 180 flags 0x01 dlen 15                                                                         #99 8.146085
      SMP: Pairing Public Key (0x0c) len 64
        X: e1dd0488c173ca193bb3c90f3845ef1d53c4be781134faf7bb74e7b71f4282d0
        Y: dabfe491eef4cc823057584424b5e28516e5262f7c01f6d56027dfeb724eb670
zephyr.exe[1035145]: < HCI Command: Host Number of Completed Packets (0x03|0x0035) plen 5                           #100 8.162000
        Num handles: 1
        Handle: 180 Address: DF:A9:FF:F6:B1:1A (OUI DF-A9-FF)
        Count: 1
zephyr.exe[1035145]: < HCI Command: Host Number of Completed Packets (0x03|0x0035) plen 5                           #101 8.162069
        Num handles: 1
        Handle: 180 Address: DF:A9:FF:F6:B1:1A (OUI DF-A9-FF)
        Count: 1
zephyr.exe[1035145]: < HCI Command: Host Number of Completed Packets (0x03|0x0035) plen 5                           #102 8.162088
        Num handles: 1
        Handle: 180 Address: DF:A9:FF:F6:B1:1A (OUI DF-A9-FF)
        Count: 1
> ACL Data RX: Handle 180 flags 0x02 dlen 21                                                                        #103 8.245185
      SMP: Pairing Confirm (0x03) len 16
        Confim value: adaba79226ce439666acd4af4fac233d
zephyr.exe[1035145]: < HCI Command: Host Number of Completed Packets (0x03|0x0035) plen 5                           #104 8.261927
        Num handles: 1
        Handle: 180 Address: DF:A9:FF:F6:B1:1A (OUI DF-A9-FF)
        Count: 1
zephyr.exe[1035145]: < ACL Data TX: Handle 180 flags 0x00 dlen 21                                                   #105 8.262032
      SMP: Pairing Random (0x04) len 16
        Random value: 5da095555cc64d02679f89a05211af56
> HCI Event: Number of Completed Packets (0x13) plen 5                                                              #106 8.294964
        Num handles: 1
        Handle: 180 Address: DF:A9:FF:F6:B1:1A (OUI DF-A9-FF)
        Count: 1
        #105: len 21 (5 Kb/s)
        Latency: 32 msec (3-33 msec ~31 msec)
> ACL Data RX: Handle 180 flags 0x02 dlen 21                                                                        #107 8.545147
      SMP: Pairing Random (0x04) len 16
        Random value: a57a242b399434a518ebf74b37bdd20c
zephyr.exe[1035145]: < HCI Command: Host Number of Completed Packets (0x03|0x0035) plen 5                           #108 8.561953
        Num handles: 1
        Handle: 180 Address: DF:A9:FF:F6:B1:1A (OUI DF-A9-FF)
        Count: 1
zephyr.exe[1035145]: < ACL Data TX: Handle 180 flags 0x00 dlen 21                                                   #109 8.561991
      SMP: Pairing DHKey Check (0x0d) len 16
        E: 5ea0c8580f60a71133f44c941d4e8e2b
> HCI Event: Number of Completed Packets (0x13) plen 5                                                              #110 8.595000
        Num handles: 1
        Handle: 180 Address: DF:A9:FF:F6:B1:1A (OUI DF-A9-FF)
        Count: 1
        #109: len 21 (5 Kb/s)
        Latency: 33 msec (3-33 msec ~32 msec)
> ACL Data RX: Handle 180 flags 0x02 dlen 21                                                                        #111 8.645242
      SMP: Pairing DHKey Check (0x0d) len 16
        E: 22e2a86e57d1a663ce64974781484796
zephyr.exe[1035145]: < HCI Command: LE Start Encryption (0x08|0x0019) plen 28                                       #112 8.662039
        Handle: 180 Address: DF:A9:FF:F6:B1:1A (OUI DF-A9-FF)
        Random number: 0x0000000000000000
        Encrypted diversifier: 0x0000
        Long term key: 58d430979226ecbe312f53675be248ca
> HCI Event: Command Status (0x0f) plen 4                                                                           #113 8.662870
      LE Start Encryption (0x08|0x0019) ncmd 1
        Status: Success (0x00)
zephyr.exe[1035145]: < HCI Command: Host Number of Completed Packets (0x03|0x0035) plen 5                           #114 8.681831
        Num handles: 1
        Handle: 180 Address: DF:A9:FF:F6:B1:1A (OUI DF-A9-FF)
        Count: 1
> HCI Event: Encryption Change (0x08) plen 4                                                                        #115 8.994897
        Status: Success (0x00)
        Handle: 180 Address: DF:A9:FF:F6:B1:1A (OUI DF-A9-FF)
        Encryption: Enabled with AES-CCM (0x01)
zephyr.exe[1035145]: < HCI Command: Disconnect (0x01|0x0006) plen 3                                                 #116 9.041820
        Handle: 180 Address: DF:A9:FF:F6:B1:1A (OUI DF-A9-FF)
        Reason: Remote User Terminated Connection (0x13)
> HCI Event: Command Status (0x0f) plen 4                                                                           #117 9.042258
      Disconnect (0x01|0x0006) ncmd 1
        Status: Success (0x00)
> HCI Event: Disconnect Complete (0x05) plen 4                                                                      #118 9.094958
        Status: Success (0x00)
        Handle: 180 Address: DF:A9:FF:F6:B1:1A (OUI DF-A9-FF)
        Reason: Connection Terminated By Local Host (0x16)
zephyr.exe[1035145]: < HCI Command: LE Extended Create Connection (0x08|0x0043) plen 26                            #119 10.231886
        Filter policy: Accept list is not used (0x00)
        Own address type: Random (0x01)
        Peer address type: Public (0x00)
        Peer address: DF:A9:FF:F6:B1:1A (OUI DF-A9-FF)
        Initiating PHYs: 0x01
        Entry 0: LE 1M
          Scan interval: 60.000 msec (0x0060)
          Scan window: 60.000 msec (0x0060)
          Min connection interval: 30.00 msec (0x0018)
          Max connection interval: 50.00 msec (0x0028)
          Connection latency: 0 (0x0000)
          Supervision timeout: 4000 msec (0x0190)
          Min connection length: 0.000 msec (0x0000)
          Max connection length: 0.000 msec (0x0000)
> HCI Event: Command Status (0x0f) plen 4                                                                          #120 10.232848
      LE Extended Create Connection (0x08|0x0043) ncmd 1
        Status: Success (0x00)
> HCI Event: LE Meta Event (0x3e) plen 31                                                                          #121 10.404771
      LE Enhanced Connection Complete (0x0a)
        Status: Success (0x00)
        Handle: 198
        Role: Central (0x00)
        Peer address type: Public (0x00)
        Peer address: DF:A9:FF:F6:B1:1A (OUI DF-A9-FF)
        Local resolvable private address: 00:00:00:00:00:00 (Non-Resolvable)
        Peer resolvable private address: 00:00:00:00:00:00 (Non-Resolvable)
        Connection interval: 50.00 msec (0x0028)
        Connection latency: 0 (0x0000)
        Supervision timeout: 4000 msec (0x0190)
        Central clock accuracy: 0x00
zephyr.exe[1035145]: < HCI Command: LE Read Remote Used Features (0x08|0x0016) plen 2                              #122 10.421912
        Handle: 198 Address: DF:A9:FF:F6:B1:1A (OUI DF-A9-FF)
> HCI Event: Command Status (0x0f) plen 4                                                                          #123 10.422399
      LE Read Remote Used Features (0x08|0x0016) ncmd 1
        Status: Success (0x00)
zephyr.exe[1035145]: < HCI Command: LE Set PHY (0x08|0x0032) plen 7                                                #124 10.441882
        Handle: 198 Address: DF:A9:FF:F6:B1:1A (OUI DF-A9-FF)
        All PHYs preference: 0x00
        TX PHYs preference: 0x02
          LE 2M
        RX PHYs preference: 0x02
          LE 2M
        PHY options preference: Reserved (0x0000)
> HCI Event: Command Status (0x0f) plen 4                                                                          #125 10.442504
      LE Set PHY (0x08|0x0032) ncmd 1
        Status: Success (0x00)
> HCI Event: LE Meta Event (0x3e) plen 12                                                                          #126 10.556160
      LE Read Remote Used Features (0x04)
        Status: Success (0x00)
        Handle: 198 Address: DF:A9:FF:F6:B1:1A (OUI DF-A9-FF)
        Features: 0x2d 0x49 0x00 0xf7 0x67 0xd8 0x00 0x00
          LE Encryption
          Extended Reject Indication
          Peripheral-initiated Features Exchange
          LE Data Packet Length Extension
          LE 2M PHY
          LE Coded PHY
          Channel Selection Algorithm #2
          Periodic Advertising Sync Transfer - Sender
          Periodic Advertising Sync Transfer - Recipient
          Sleep Clock Accuracy Updates
          Connected Isochronous Stream - Central
          Connected Isochronous Stream - Peripheral
          Isochronous Broadcaster
          Synchronized Receiver
          Connected Isochronous Stream (Host Support)
          LE Power Control Request
          LE Power Control Request
          Connection Subrating
          Connection Subrating (Host Support)
          Unknown features (0x0000d80000000000)
> HCI Event: LE Meta Event (0x3e) plen 6                                                                           #127 11.055503
      LE PHY Update Complete (0x0c)
        Status: Success (0x00)
        Handle: 198 Address: DF:A9:FF:F6:B1:1A (OUI DF-A9-FF)
        TX PHY: LE 2M (0x02)
        RX PHY: LE 2M (0x02)
zephyr.exe[1035145]: < ACL Data TX: Handle 198 flags 0x00 dlen 11                                                  #128 11.502393
      SMP: Pairing Request (0x01) len 6
        IO capability: NoInputNoOutput (0x03)
        OOB data: Authentication data not present (0x00)
        Authentication requirement: No bonding, No MITM, SC, No Keypresses (0x08)
        Max encryption key size: 16
        Initiator key distribution: <none> (0x00)
        Responder key distribution: <none> (0x00)
> HCI Event: Number of Completed Packets (0x13) plen 5                                                             #129 11.506013
        Num handles: 1
        Handle: 198 Address: DF:A9:FF:F6:B1:1A (OUI DF-A9-FF)
        Count: 1
        #128: len 11 (29 Kb/s)
        Latency: 3 msec (3-3 msec ~3 msec)
> ACL Data RX: Handle 198 flags 0x02 dlen 11                                