Bluetooth monitor ver 5.72
= Note: Linux version 6.14.0-36-generic (x86_64)                       0.268349
= Note: Bluetooth subsystem version 2.22                               0.268351
= New Index: 00:00:00:00:00:00 (Primary,UART,hci2)              [hci2] 0.268352
= New Index: 00:00:00:00:00:00 (Primary,UART,hci1)              [hci1] 0.268353
= New Index: 48:5F:99:8E:E0:64 (Primary,USB,hci0)               [hci0] 0.268353
= Open Index: 00:00:00:00:00:00                                 [hci1] 0.382094
= Index Info: 00:00:00:00:00:00 (Nordic Semiconductor ASA)      [hci1] 0.382108
@ USER Open: main (privileged) version 2.22            {0x0001} [hci1] 0.382117
< HCI Command: Reset (0x03|0x0003) plen 0                    #1 [hci1] 0.383258
> HCI Event: Command Complete (0x0e) plen 4                  #2 [hci1] 0.383877
      Reset (0x03|0x0003) ncmd 1
        Status: Success (0x00)
< HCI Command: Read Local Supported... (0x04|0x0003) plen 0  #3 [hci1] 0.401937
> HCI Event: Command Complete (0x0e) plen 12                 #4 [hci1] 0.402545
      Read Local Supported Features (0x04|0x0003) ncmd 1
        Status: Success (0x00)
        Features: 0x00 0x00 0x00 0x00 0x60 0x00 0x00 0x00
          BR/EDR Not Supported
          LE Supported (Controller)
< HCI Command: Read Local Version In.. (0x04|0x0001) plen 0  #5 [hci1] 0.421651
> HCI Event: Command Complete (0x0e) plen 12                 #6 [hci1] 0.422160
      Read Local Version Information (0x04|0x0001) ncmd 1
        Status: Success (0x00)
        HCI version: Reserved (0x0f) - Revision 12393 (0x3069)
        LMP version: Reserved (0x0f) - Subversion 12393 (0x3069)
        Manufacturer: Nordic Semiconductor ASA (89)
< HCI Command: Read Local Supported... (0x04|0x0002) plen 0  #7 [hci1] 0.441505
> HCI Event: Command Complete (0x0e) plen 68                 #8 [hci1] 0.442631
      Read Local Supported Commands (0x04|0x0002) ncmd 1
        Status: Success (0x00)
        Commands: 119 entries
          Disconnect (Octet 0 - Bit 5)
          Read Remote Version Information (Octet 2 - Bit 7)
          Set Event Mask (Octet 5 - Bit 6)
          Reset (Octet 5 - Bit 7)
          Read Connection Accept Timeout (Octet 7 - Bit 2)
          Write Connection Accept Timeout (Octet 7 - Bit 3)
          Read Transmit Power Level (Octet 10 - Bit 2)
          Set Controller To Host Flow Control (Octet 10 - Bit 5)
          Host Buffer Size (Octet 10 - Bit 6)
          Host Number of Completed Packets (Octet 10 - Bit 7)
          Read Local Version Information (Octet 14 - Bit 3)
          Read Local Supported Features (Octet 14 - Bit 5)
          Read BD ADDR (Octet 15 - Bit 1)
          Read RSSI (Octet 15 - Bit 5)
          Set Event Mask Page 2 (Octet 22 - Bit 2)
          LE Set Event Mask (Octet 25 - Bit 0)
          LE Read Buffer Size (Octet 25 - Bit 1)
          LE Read Local Supported Features (Octet 25 - Bit 2)
          LE Set Random Address (Octet 25 - Bit 4)
          LE Set Advertising Parameters (Octet 25 - Bit 5)
          LE Read Advertising Channel TX Power (Octet 25 - Bit 6)
          LE Set Advertising Data (Octet 25 - Bit 7)
          LE Set Scan Response Data (Octet 26 - Bit 0)
          LE Set Advertise Enable (Octet 26 - Bit 1)
          LE Set Scan Parameters (Octet 26 - Bit 2)
          LE Set Scan Enable (Octet 26 - Bit 3)
          LE Create Connection (Octet 26 - Bit 4)
          LE Create Connection Cancel (Octet 26 - Bit 5)
          LE Read Accept List Size (Octet 26 - Bit 6)
          LE Clear Accept List (Octet 26 - Bit 7)
          LE Add Device To Accept List (Octet 27 - Bit 0)
          LE Remove Device From Accept List (Octet 27 - Bit 1)
          LE Connection Update (Octet 27 - Bit 2)
          LE Set Host Channel Classification (Octet 27 - Bit 3)
          LE Read Channel Map (Octet 27 - Bit 4)
          LE Read Remote Used Features (Octet 27 - Bit 5)
          LE Encrypt (Octet 27 - Bit 6)
          LE Rand (Octet 27 - Bit 7)
          LE Start Encryption (Octet 28 - Bit 0)
          LE Long Term Key Request Reply (Octet 28 - Bit 1)
          LE Long Term Key Request Neg Reply (Octet 28 - Bit 2)
          LE Read Supported States (Octet 28 - Bit 3)
          LE Receiver Test (Octet 28 - Bit 4)
          LE Transmitter Test (Octet 28 - Bit 5)
          LE Test End (Octet 28 - Bit 6)
          Read Authenticated Payload Timeout (Octet 32 - Bit 4)
          Write Authenticated Payload Timeout (Octet 32 - Bit 5)
          LE Set Data Length (Octet 33 - Bit 6)
          LE Read Suggested Default Data Length (Octet 33 - Bit 7)
          LE Write Suggested Default Data Length (Octet 34 - Bit 0)
          LE Add Device To Resolving List (Octet 34 - Bit 3)
          LE Remove Device From Resolving List (Octet 34 - Bit 4)
          LE Clear Resolving List (Octet 34 - Bit 5)
          LE Read Resolving List Size (Octet 34 - Bit 6)
          LE Set Address Resolution Enable (Octet 35 - Bit 1)
          LE Set Resolvable Private Address Timeout (Octet 35 - Bit 2)
          LE Read Maximum Data Length (Octet 35 - Bit 3)
          LE Read PHY (Octet 35 - Bit 4)
          LE Set Default PHY (Octet 35 - Bit 5)
          LE Set PHY (Octet 35 - Bit 6)
          LE Enhanced Receiver Test (Octet 35 - Bit 7)
          LE Enhanced Transmitter Test (Octet 36 - Bit 0)
          LE Set Advertising Set Random Address (Octet 36 - Bit 1)
          LE Set Extended Advertising Parameters (Octet 36 - Bit 2)
          LE Set Extended Advertising Data (Octet 36 - Bit 3)
          LE Set Extended Scan Response Data (Octet 36 - Bit 4)
          LE Set Extended Advertising Enable (Octet 36 - Bit 5)
          LE Read Maximum Advertising Data Length (Octet 36 - Bit 6)
          LE Read Number of Supported Advertising Sets (Octet 36 - Bit 7)
          LE Remove Advertising Set (Octet 37 - Bit 0)
          LE Clear Advertising Sets (Octet 37 - Bit 1)
          LE Set Periodic Advertising Parameters (Octet 37 - Bit 2)
          LE Set Periodic Advertising Data (Octet 37 - Bit 3)
          LE Set Periodic Advertising Enable (Octet 37 - Bit 4)
          LE Set Extended Scan Parameters (Octet 37 - Bit 5)
          LE Set Extended Scan Enable (Octet 37 - Bit 6)
          LE Extended Create Connection (Octet 37 - Bit 7)
          LE Periodic Advertising Create Sync (Octet 38 - Bit 0)
          LE Periodic Advertising Create Sync Cancel (Octet 38 - Bit 1)
          LE Periodic Advertising Terminate Sync (Octet 38 - Bit 2)
          LE Add Device To Periodic Advertiser List (Octet 38 - Bit 3)
          LE Remove Device From Periodic Advertiser List (Octet 38 - Bit 4)
          LE Clear Periodic Advertiser List (Octet 38 - Bit 5)
          LE Read Periodic Advertiser List Size (Octet 38 - Bit 6)
          LE Read Transmit Power (Octet 38 - Bit 7)
          LE Read RF Path Compensation (Octet 39 - Bit 0)
          LE Write RF Path Compensation (Octet 39 - Bit 1)
          LE Set Privacy Mode (Octet 39 - Bit 2)
          LE Periodic Advertising Receive Enable (Octet 40 - Bit 5)
          LE Periodic Advertising Sync Transfer (Octet 40 - Bit 6)
          LE Periodic Advertising Set Info Transfer (Octet 40 - Bit 7)
          LE Periodic Advertising Sync Transfer Parameters (Octet 41 - Bit 0)
          LE Set Default Periodic Advertisng Sync Transfer Parameters (Octet 41 - Bit 1)
          LE Read Buffer v2 (Octet 41 - Bit 5)
          LE Read ISO TX Sync (Octet 41 - Bit 6)
          LE Set Connected Isochronous Group Parameters (Octet 41 - Bit 7)
          LE Set Connected Isochronous Group Parameters Test (Octet 42 - Bit 0)
          LE Create Connected Isochronous Stream (Octet 42 - Bit 1)
          LE Remove Connected Isochronous Group (Octet 42 - Bit 2)
          LE Accept Connected Isochronous Stream Request (Octet 42 - Bit 3)
          LE Reject Connected Isochronous Stream Request (Octet 42 - Bit 4)
          LE Create Broadcast Isochronous Group (Octet 42 - Bit 5)
          LE Create Broadcast Isochronous Group Test (Octet 42 - Bit 6)
          LE Terminate Broadcast Isochronous Group (Octet 42 - Bit 7)
          LE Broadcast Isochronous Group Create Sync (Octet 43 - Bit 0)
          LE Broadcast Isochronous Group Terminate Sync (Octet 43 - Bit 1)
          LE Request Peer SCA (Octet 43 - Bit 2)
          LE Setup Isochronous Data Path (Octet 43 - Bit 3)
          LE Remove Isochronous Data Path (Octet 43 - Bit 4)
          LE Isochronous Transmit Test (Octet 43 - Bit 5)
          LE Isochronous Receive Test (Octet 43 - Bit 6)
          LE Isochronous Read Test Counters (Octet 43 - Bit 7)
          LE Isochronous Read Test Counters (Octet 44 - Bit 0)
          LE Set Host Feature (Octet 44 - Bit 1)
          Octet 44 - Bit 2 
          Octet 45 - Bit 6 
          Octet 46 - Bit 0 
          Octet 46 - Bit 1 
          Octet 46 - Bit 2 
< HCI Command: Host Buffer Size (0x03|0x0033) plen 7         #9 [hci1] 0.461516
        ACL MTU: 255  ACL max packet: 16
        SCO MTU: 0    SCO max packet: 0
> HCI Event: Command Complete (0x0e) plen 4                 #10 [hci1] 0.462023
      Host Buffer Size (0x03|0x0033) ncmd 1
        Status: Success (0x00)
< HCI Command: Set Controller To Ho.. (0x03|0x0031) plen 1  #11 [hci1] 0.481530
        Flow control: ACL Data Packets (0x01)
> HCI Event: Command Complete (0x0e) plen 4                 #12 [hci1] 0.482033
      Set Controller To Host Flow Control (0x03|0x0031) ncmd 1
        Status: Success (0x00)
< HCI Command: LE Read Local Suppor.. (0x08|0x0003) plen 0  #13 [hci1] 0.501546
> HCI Event: Command Complete (0x0e) plen 12                #14 [hci1] 0.502031
      LE Read Local Supported Features (0x08|0x0003) ncmd 1
        Status: Success (0x00)
        Features: 0xfd 0x79 0x00 0xf7 0x30 0x01 0x00 0x00
          LE Encryption
          Extended Reject Indication
          Peripheral-initiated Features Exchange
          LE Ping
          LE Data Packet Length Extension
          LL Privacy
          Extended Scanner Filter Policies
          LE 2M PHY
          LE Coded PHY
          LE Extended Advertising
          LE Periodic Advertising
          Channel Selection Algorithm #2
          Periodic Advertising Sync Transfer - Sender
          Periodic Advertising Sync Transfer - Recipient
          Sleep Clock Accuracy Updates
          Connected Isochronous Stream - Central
          Connected Isochronous Stream - Peripheral
          Isochronous Broadcaster
          Synchronized Receiver
          Periodic Advertising ADI support
          Connection Subrating
          Unknown features (0x0000010000000000)
< HCI Command: LE Set Host Feature (0x08|0x0074) plen 2     #15 [hci1] 0.521514
        Bit Number: 32
          Connected Isochronous Stream (Host Support)
        Bit Value: 1
> HCI Event: Command Complete (0x0e) plen 4                 #16 [hci1] 0.521952
      LE Set Host Feature (0x08|0x0074) ncmd 1
        Status: Success (0x00)
< HCI Command: LE Read Buffer v2 (0x08|0x0060) plen 0       #17 [hci1] 0.541549
> HCI Event: Command Complete (0x0e) plen 10                #18 [hci1] 0.542044
      LE Read Buffer v2 (0x08|0x0060) ncmd 1
        Status: Success (0x00)
        ACL MTU: 27
        ACL max packet: 3
        ISO MTU: 318
        ISO max packet: 3
< HCI Command: LE Read Maximum Adve.. (0x08|0x003a) plen 0  #19 [hci1] 0.561560
> HCI Event: Command Complete (0x0e) plen 6                 #20 [hci1] 0.562086
      LE Read Maximum Advertising Data Length (0x08|0x003a) ncmd 1
        Status: Success (0x00)
        Max length: 1650
< HCI Command: LE Read Supported St.. (0x08|0x001c) plen 0  #21 [hci1] 0.581420
> HCI Event: Command Complete (0x0e) plen 12                #22 [hci1] 0.582027
      LE Read Supported States (0x08|0x001c) ncmd 1
        Status: Success (0x00)
        States: 0x000003ff3e0306ff
          Non-connectable Advertising State
          Scannable Advertising State
          Connectable Advertising State
          High Duty Cycle Directed Advertising State
          Passive Scanning State
          Active Scanning State
          Initiating State
            and Connection State (Central Role)
          Connection State (Peripheral Role)
          Scannable Advertising State
            and Passive Scanning State
          Connectable Advertising State
            and Passive Scanning State
          Non-connectable Advertising State
            and Initiating State
          Scannable Advertising State
            and Initiating State
          Active Scanning State
            and Connection State (Central Role)
          Passive Scanning State
            and Connection State (Peripheral Role)
          Active Scanning State
            and Connection State (Peripheral Role)
          Initiating State
            and Connection State (Central Role)
            and Central Role & Central Role
          Low Duty Cycle Directed Advertising State
          Connectable Advertising State
            and Initiating State
            and Central Role & Peripheral Role
          High Duty Cycle Directed Advertising State
            and Initiating State
            and Central Role & Peripheral Role
          Low Duty Cycle Directed Advertising State
            and Initiating State
            and Central Role & Peripheral Role
          Connectable Advertising State
            and Connection State (Central Role)
            and Central Role & Peripheral Role
          High Duty Cycle Directed Advertising State
            and Connection State (Central Role)
            and Central Role & Peripheral Role
          Low Duty Cycle Directed Advertising State
            and Connection State (Central Role)
            and Central Role & Peripheral Role
          Connectable Advertising State
            and Connection State (Peripheral Role)
            and Central Role & Peripheral Role
          High Duty Cycle Directed Advertising State
            and Connection State (Peripheral Role)
            and Peripheral Role & Peripheral Role
          Low Duty Cycle Directed Advertising State
            and Connection State (Peripheral Role)
            and Peripheral Role & Peripheral Role
          Initiating State
            and Connection State (Peripheral Role)
            and Central Role & Peripheral Role
< HCI Command: LE Read Maximum Data.. (0x08|0x002f) plen 0  #23 [hci1] 0.601506
> HCI Event: Command Complete (0x0e) plen 12                #24 [hci1] 0.602095
      LE Read Maximum Data Length (0x08|0x002f) ncmd 1
        Status: Success (0x00)
        Max TX octets: 251
        Max TX time: 2704
        Max RX octets: 251
        Max RX time: 2704
< HCI Command: LE Write Suggested D.. (0x08|0x0024) plen 4  #25 [hci1] 0.621511
        TX octets: 251
        TX time: 2704
> HCI Event: Command Complete (0x0e) plen 4                 #26 [hci1] 0.621950
      LE Write Suggested Default Data Length (0x08|0x0024) ncmd 1
        Status: Success (0x00)
< HCI Command: LE Read Resolving Li.. (0x08|0x002a) plen 0  #27 [hci1] 0.641510
> HCI Event: Command Complete (0x0e) plen 5                 #28 [hci1] 0.641968
      LE Read Resolving List Size (0x08|0x002a) ncmd 1
        Status: Success (0x00)
        Size: 8
< HCI Command: LE Set Event Mask (0x08|0x0001) plen 8       #29 [hci1] 0.661529
        Mask: 0x000002023f87fa5e
          LE Advertising Report
          LE Connection Update Complete
          LE Read Remote Used Features Complete
          LE Long Term Key Request
          LE Data Length Change
          LE Enhanced Connection Complete
          LE PHY Update Complete
          LE Extended Advertising Report
          LE Periodic Advertising Sync Established
          LE Periodic Advertising Report
          LE Periodic Advertising Sync Lost
          LE Extended Scan Timeout
          LE Extended Advertising Set Terminated
          LE Scan Request Received
          LE Periodic Advertising Sync Transfer Rvc
          LE CIS Established
          LE CIS Request
          LE Create BIG Complete
          LE Terminate BIG Complete
          LE BIG Sync Estabilished Complete
          LE BIG Sync Lost
          LE BIG Info Advertising Report
          Unknown mask (0x0000020000000000)
> HCI Event: Command Complete (0x0e) plen 4                 #30 [hci1] 0.662183
      LE Set Event Mask (0x08|0x0001) ncmd 1
        Status: Success (0x00)
< HCI Command: Set Event Mask (0x03|0x0001) plen 8          #31 [hci1] 0.681493
        Mask: 0x2000800002008890
          Disconnection Complete
          Encryption Change
          Read Remote Version Information Complete
          Hardware Error
          Data Buffer Overflow
          Encryption Key Refresh Complete
          LE Meta
> HCI Event: Command Complete (0x0e) plen 4                 #32 [hci1] 0.682039
      Set Event Mask (0x03|0x0001) ncmd 1
        Status: Success (0x00)
< HCI Command: Read BD ADDR (0x04|0x0009) plen 0            #33 [hci1] 0.701491
> HCI Event: Command Complete (0x0e) plen 10                #34 [hci1] 0.702129
      Read BD ADDR (0x04|0x0009) ncmd 1
        Status: Success (0x00)
        Address: 00:00:00:00:00:00 (OUI 00-00-00)
< HCI Command: LE Set Random Address (0x08|0x0005) plen 6   #35 [hci1] 0.721536
        Address: D5:B6:CC:31:DB:3B (Static)
> HCI Event: Command Complete (0x0e) plen 4                 #36 [hci1] 0.722091
      LE Set Random Address (0x08|0x0005) ncmd 1
        Status: Success (0x00)
< HCI Command: LE Extended Create... (0x08|0x0043) plen 26  #37 [hci1] 5.621659
        Filter policy: Accept list is not used (0x00)
        Own address type: Random (0x01)
        Peer address type: Public (0x00)
        Peer address: DF:A9:FF:F6:B1:1A (OUI DF-A9-FF)
        Initiating PHYs: 0x01
        Entry 0: LE 1M
          Scan interval: 60.000 msec (0x0060)
          Scan window: 60.000 msec (0x0060)
          Min connection interval: 30.00 msec (0x0018)
          Max connection interval: 50.00 msec (0x0028)
          Connection latency: 0 (0x0000)
          Supervision timeout: 4000 msec (0x0190)
          Min connection length: 0.000 msec (0x0000)
          Max connection length: 0.000 msec (0x0000)
> HCI Event: Command Status (0x0f) plen 4                   #38 [hci1] 5.622648
      LE Extended Create Connection (0x08|0x0043) ncmd 1
        Status: Success (0x00)
> HCI Event: LE Meta Event (0x3e) plen 31                   #39 [hci1] 5.721403
      LE Enhanced Connection Complete (0x0a)
        Status: Success (0x00)
        Handle: 3366
        Role: Central (0x00)
        Peer address type: Public (0x00)
        Peer address: DF:A9:FF:F6:B1:1A (OUI DF-A9-FF)
        Local resolvable private address: 00:00:00:00:00:00 (Non-Resolvable)
        Peer resolvable private address: 00:00:00:00:00:00 (Non-Resolvable)
        Connection interval: 50.00 msec (0x0028)
        Connection latency: 0 (0x0000)
        Supervision timeout: 4000 msec (0x0190)
        Central clock accuracy: 0x00
< HCI Command: LE Read Remote Used... (0x08|0x0016) plen 2  #40 [hci1] 5.722071
        Handle: 3366 Address: DF:A9:FF:F6:B1:1A (OUI DF-A9-FF)
> HCI Event: Command Status (0x0f) plen 4                   #41 [hci1] 5.722700
      LE Read Remote Used Features (0x08|0x0016) ncmd 1
        Status: Success (0x00)
< HCI Command: LE Set PHY (0x08|0x0032) plen 7              #42 [hci1] 5.741731
        Handle: 3366 Address: DF:A9:FF:F6:B1:1A (OUI DF-A9-FF)
        All PHYs preference: 0x00
        TX PHYs preference: 0x02
          LE 2M
        RX PHYs preference: 0x02
          LE 2M
        PHY options preference: Reserved (0x0000)
> HCI Event: Command Status (0x0f) plen 4                   #43 [hci1] 5.742335
      LE Set PHY (0x08|0x0032) ncmd 1
        Status: Success (0x00)
> HCI Event: LE Meta Event (0x3e) plen 12                   #44 [hci1] 5.822960
      LE Read Remote Used Features (0x04)
        Status: Success (0x00)
        Handle: 3366 Address: DF:A9:FF:F6:B1:1A (OUI DF-A9-FF)
        Features: 0x2d 0x49 0x00 0xf7 0x67 0xd9 0x00 0x80
          LE Encryption
          Extended Reject Indication
          Peripheral-initiated Features Exchange
          LE Data Packet Length Extension
          LE 2M PHY
          LE Coded PHY
          Channel Selection Algorithm #2
          Periodic Advertising Sync Transfer - Sender
          Periodic Advertising Sync Transfer - Recipient
          Sleep Clock Accuracy Updates
          Connected Isochronous Stream - Central
          Connected Isochronous Stream - Peripheral
          Isochronous Broadcaster
          Synchronized Receiver
          Connected Isochronous Stream (Host Support)
          LE Power Control Request
          LE Power Control Request
          Connection Subrating
          Connection Subrating (Host Support)
          Unknown features (0x8000d90000000000)
> HCI Event: LE Meta Event (0x3e) plen 6                    #45 [hci1] 6.322178
      LE PHY Update Complete (0x0c)
        Status: Success (0x00)
        Handle: 3366 Address: DF:A9:FF:F6:B1:1A (OUI DF-A9-FF)
        TX PHY: LE 2M (0x02)
        RX PHY: LE 2M (0x02)
< ACL Data TX: Handle 3366 flags 0x00 dlen 11               #46 [hci1] 6.652466
      SMP: Pairing Request (0x01) len 6
        IO capability: KeyboardDisplay (0x04)
        OOB data: Authentication data not present (0x00)
        Authentication requirement: Bonding, No MITM, SC, No Keypresses (0x09)
        Max encryption key size: 16
        Initiator key distribution: EncKey (0x01)
        Responder key distribution: EncKey IdKey (0x03)
> HCI Event: Number of Completed Packets (0x13) plen 5      #47 [hci1] 6.672642
        Num handles: 1
        Handle: 3366 Address: DF:A9:FF:F6:B1:1A (OUI DF-A9-FF)
        Count: 1
        #46: len 11 (4 Kb/s)
        Latency: 20 msec (20-20 msec ~20 msec)
> ACL Data RX: Handle 3366 flags 0x02 dlen 11               #48 [hci1] 6.722813
      SMP: Pairing Response (0x02) len 6
        IO capability: KeyboardDisplay (0x04)
        OOB data: Authentication data not present (0x00)
        Authentication requirement: Bonding, MITM, Legacy, No Keypresses (0x05)
        Max encryption key size: 16
        Initiator key distribution: EncKey (0x01)
        Responder key distribution: EncKey IdKey (0x03)
< HCI Command: Host Number of Compl.. (0x03|0x0035) plen 5  #49 [hci1] 6.741833
        Num handles: 1
        Handle: 3366 Address: DF:A9:FF:F6:B1:1A (OUI DF-A9-FF)
        Count: 1
< ACL Data TX: Handle 3366 flags 0x00 dlen 21               #50 [hci1] 6.741851
      SMP: Pairing Confirm (0x03) len 16
        Confim value: 899f43e5cf969dc71fdcbdb97900e7c9
> HCI Event: Number of Completed Packets (0x13) plen 5      #51 [hci1] 6.772632
        Num handles: 1
        Handle: 3366 Address: DF:A9:FF:F6:B1:1A (OUI DF-A9-FF)
        Count: 1
        #50: len 21 (5 Kb/s)
        Latency: 30 msec (20-30 msec ~25 msec)
> ACL Data RX: Handle 3366 flags 0x02 dlen 21               #52 [hci1] 7.722869
      SMP: Pairing Confirm (0x03) len 16
        Confim value: f4d2dd7a0641c0b92f70562e6ef66c5a
< HCI Command: Host Number of Compl.. (0x03|0x0035) plen 5  #53 [hci1] 7.741781
        Num handles: 1
        Handle: 3366 Address: DF:A9:FF:F6:B1:1A (OUI DF-A9-FF)
        Count: 1
< ACL Data TX: Handle 3366 flags 0x00 dlen 21               #54 [hci1] 7.741814
      SMP: Pairing Random (0x04) len 16
        Random value: 8e6108f966a694cbe26df70bb96773e6
> HCI Event: Number of Completed Packets (0x13) plen 5      #55 [hci1] 7.772636
        Num handles: 1
        Handle: 3366 Address: DF:A9:FF:F6:B1:1A (OUI DF-A9-FF)
        Count: 1
        #54: len 21 (5 Kb/s)
        Latency: 30 msec (20-30 msec ~28 msec)
> ACL Data RX: Handle 3366 flags 0x02 dlen 21               #56 [hci1] 7.822820
      SMP: Pairing Random (0x04) len 16
        Random value: 4b1c665bd35609bf0000000000000000
< HCI Command: LE Start Encryption (0x08|0x0019) plen 28    #57 [hci1] 7.842256
        Handle: 3366 Address: DF:A9:FF:F6:B1:1A (OUI DF-A9-FF)
        Random number: 0x0000000000000000
        Encrypted diversifier: 0x0000
        Long term key: 7a6ce6ad98c92c61798cda7f708df864
> HCI Event: Command Status (0x0f) plen 4                   #58 [hci1] 7.843224
      LE Start Encryption (0x08|0x0019) ncmd 1
        Status: Success (0x00)
< HCI Command: Host Number of Compl.. (0x03|0x0035) plen 5  #59 [hci1] 7.861890
        Num handles: 1
        Handle: 3366 Address: DF:A9:FF:F6:B1:1A (OUI DF-A9-FF)
        Count: 1
> HCI Event: Encryption Change (0x08) plen 4                #60 [hci1] 8.172581
        Status: Success (0x00)
        Handle: 3366 Address: DF:A9:FF:F6:B1:1A (OUI DF-A9-FF)
        Encryption: Enabled with AES-CCM (0x01)
> ACL Data RX: Handle 3366 flags 0x02 dlen 21               #61 [hci1] 8.222952
      SMP: Encryption Information (0x06) len 16
        Long term key: 31b7f53c1471dd7babefd96b74086f44
< HCI Command: Host Number of Compl.. (0x03|0x0035) plen 5  #62 [hci1] 8.241929
        Num handles: 1
        Handle: 3366 Address: DF:A9:FF:F6:B1:1A (OUI DF-A9-FF)
        Count: 1
> ACL Data RX: Handle 3366 flags 0x02 dlen 15               #63 [hci1] 8.272711
      SMP: Central Identification (0x07) len 10
        EDIV: 0x5d92
        Rand: 0x0f0c97d90ae45657
> ACL Data RX: Handle 3366 flags 0x02 dlen 21               #64 [hci1] 8.273243
      SMP: Identity Information (0x08) len 16
        Identity resolving key: 5360b9e1c05185dee2dc4c90f65fc661
< HCI Command: Host Number of Compl.. (0x03|0x0035) plen 5  #65 [hci1] 8.281745
        Num handles: 1
        Handle: 3366 Address: DF:A9:FF:F6:B1:1A (OUI DF-A9-FF)
        Count: 1
< HCI Command: Host Number of Compl.. (0x03|0x0035) plen 5  #66 [hci1] 8.281849
        Num handles: 1
        Handle: 3366 Address: DF:A9:FF:F6:B1:1A (OUI DF-A9-FF)
        Count: 1
> ACL Data RX: Handle 3366 flags 0x02 dlen 12               #67 [hci1] 8.322720
      SMP: Identity Address Information (0x09) len 7
        Address: DF:A9:FF:F6:B1:1A (OUI DF-A9-FF)
< HCI Command: LE Add Device To Re.. (0x08|0x0027) plen 39  #68 [hci1] 8.341824
        Address type: Public (0x00)
        Address: DF:A9:FF:F6:B1:1A (OUI DF-A9-FF)
        Peer identity resolving key: 5360b9e1c05185dee2dc4c90f65fc661
        Local identity resolving key: 00000000000000000000000000000000
> HCI Event: Command Complete (0x0e) plen 4                 #69 [hci1] 8.342908
      LE Add Device To Resolving List (0x08|0x0027) ncmd 1
        Status: Success (0x00)
< HCI Command: LE Set Privacy Mode (0x08|0x004e) plen 8     #70 [hci1] 8.361650
        Peer Identity address type: Public (0x00)
        Peer Identity address: DF:A9:FF:F6:B1:1A (OUI DF-A9-FF)
        Privacy Mode: Use Device Privacy (0x01)
> HCI Event: Command Complete (0x0e) plen 4                 #71 [hci1] 8.362231
      LE Set Privacy Mode (0x08|0x004e) ncmd 1
        Status: Success (0x00)
< HCI Command: LE Set Address Resol.. (0x08|0x002d) plen 1  #72 [hci1] 8.381806
        Address resolution: Enabled (0x01)
> HCI Event: Command Complete (0x0e) plen 4                 #73 [hci1] 8.382363
      LE Set Address Resolution Enable (0x08|0x002d) ncmd 1
        Status: Success (0x00)
< HCI Command: Host Number of Compl.. (0x03|0x0035) plen 5  #74 [hci1] 8.401727
        Num handles: 1
        Handle: 3366 Address: DF:A9:FF:F6:B1:1A (OUI DF-A9-FF)
        Count: 1
< ACL Data TX: Handle 3366 flags 0x00 dlen 21               #75 [hci1] 8.401795
      SMP: Encryption Information (0x06) len 16
        Long term key: 4d02679f89a05211af56d8b3da64d21e
< ACL Data TX: Handle 3366 flags 0x00 dlen 15               #76 [hci1] 8.401799
      SMP: Central Identification (0x07) len 10
        EDIV: 0x4402
        Rand: 0x5a23bc86825e84c8
> HCI Event: Number of Completed Packets (0x13) plen 5      #77 [hci1] 8.422619
        Num handles: 1
        Handle: 3366 Address: DF:A9:FF:F6:B1:1A (OUI DF-A9-FF)
        Count: 1
        #75: len 21 (8 Kb/s)
        Latency: 20 msec (20-30 msec ~24 msec)
> HCI Event: Number of Completed Packets (0x13) plen 5      #78 [hci1] 8.423064
        Num handles: 1
        Handle: 3366 Address: DF:A9:FF:F6:B1:1A (OUI DF-A9-FF)
        Count: 1
        #76: len 15 (5 Kb/s)
        Latency: 21 msec (20-30 msec ~22 msec)
< ACL Data TX: Handle 3366 flags 0x00 dlen 11              #79 [hci1] 10.682410
      ATT: Read By Type Request (0x08) len 6
        Handle range: 0x0001-0x000d
        Attribute type: Characteristic (0x2803)
> HCI Event: Number of Completed Packets (0x13) plen 5     #80 [hci1] 10.722625
        Num handles: 1
        Handle: 3366 Address: DF:A9:FF:F6:B1:1A (OUI DF-A9-FF)
        Count: 1
        #79: len 11 (2 Kb/s)
        Latency: 40 msec (20-40 msec ~31 msec)
> ACL Data RX: Handle 3366 flags 0x02 dlen 27              #81 [hci1] 10.772875
      ATT: Read By Type Response (0x09) len 22
        Attribute data length: 7
        Attribute data list: 3 entries
        Handle: 0x0002
        Value: 0a0300002a
            Properties: 0x0a
              Read (0x02)
              Write (0x08)
            Value Handle: 0x0003
            Value UUID: Device Name (0x2a00)
        Handle: 0x0004
        Value: 0a0500012a
            Properties: 0x0a
              Read (0x02)
              Write (0x08)
            Value Handle: 0x0005
            Value UUID: Appearance (0x2a01)
        Handle: 0x0006
        Value: 4e07000945
            Properties: 0x4e
              Read (0x02)
              Write Without Response (0x04)
              Write (0x08)
              Authorize (0x40)
              Extended Properties (0x80)
            Value Handle: 0x0007
            Value UUID: Unknown (0x4509)
< HCI Command: Host Number of Comp.. (0x03|0x0035) plen 5  #82 [hci1] 10.781743
        Num handles: 1
        Handle: 3366 Address: DF:A9:FF:F6:B1:1A (OUI DF-A9-FF)
        Count: 1
< ACL Data TX: Handle 3366 flags 0x00 dlen 11              #83 [hci1] 10.781819
      ATT: Read By Type Request (0x08) len 6
        Handle range: 0x0007-0x000d
        Attribute type: Characteristic (0x2803)
> HCI Event: Number of Completed Packets (0x13) plen 5     #84 [hci1] 10.822588
        Num handles: 1
        Handle: 3366 Address: DF:A9:FF:F6:B1:1A (OUI DF-A9-FF)
        Count: 1
        #83: len 11 (2 Kb/s)
        Latency: 40 msec (20-40 msec ~36 msec)
> ACL Data RX: Handle 3366 flags 0x02 dlen 20              #85 [hci1] 10.872721
      ATT: Read By Type Response (0x09) len 15
        Attribute data length: 7
        Attribute data list: 2 entries
        Handle: 0x0008
        Value: 020900042a
            Properties: 0x02
              Read (0x02)
            Value Handle: 0x0009
            Value UUID: Peripheral Preferred Connection Parameters (0x2a04)
        Handle: 0x000a
        Value: 320b00192a
            Properties: 0x32
              Read (0x02)
              Notify (0x10)
              Indicate (0x20)
            Value Handle: 0x000b
            Value UUID: Battery Level (0x2a19)
< HCI Command: Host Number of Comp.. (0x03|0x0035) plen 5  #86 [hci1] 10.881822
        Num handles: 1
        Handle: 3366 Address: DF:A9:FF:F6:B1:1A (OUI DF-A9-FF)
        Count: 1
< ACL Data TX: Handle 3366 flags 0x00 dlen 11              #87 [hci1] 10.881841
      ATT: Read By Type Request (0x08) len 6
        Handle range: 0x000b-0x000d
        Attribute type: Characteristic (0x2803)
> HCI Event: Number of Completed Packets (0x13) plen 5     #88 [hci1] 10.922755
        Num handles: 1
        Handle: 3366 Address: DF:A9:FF:F6:B1:1A (OUI DF-A9-FF)
        Count: 1
        #87: len 11 (2 Kb/s)
        Latency: 40 msec (20-40 msec ~38 msec)
> ACL Data RX: Handle 3366 flags 0x02 dlen 9               #89 [hci1] 10.972679
      ATT: Error Response (0x01) len 4
        Read By Type Request (0x08)
        Handle: 0x000b
        Error: Attribute Not Found (0x0a)
< HCI Command: Host Number of Comp.. (0x03|0x0035) plen 5  #90 [hci1] 10.981792
        Num handles: 1
        Handle: 3366 Address: DF:A9:FF:F6:B1:1A (OUI DF-A9-FF)
        Count: 1
< ACL Data TX: Handle 3366 flags 0x00 dlen 9               #91 [hci1] 10.981843
      ATT: Write Request (0x12) len 4
        Handle: 0x000d
          Data: 0100
> HCI Event: Number of Completed Packets (0x13) plen 5     #92 [hci1] 11.022631
        Num handles: 1
        Handle: 3366 Address: DF:A9:FF:F6:B1:1A (OUI DF-A9-FF)
        Count: 1
        #91: len 9 (1 Kb/s)
        Latency: 40 msec (20-40 msec ~39 msec)
> ACL Data RX: Handle 3366 flags 0x02 dlen 5               #93 [hci1] 11.072638
      ATT: Write Response (0x13) len 0
< HCI Command: Host Number of Comp.. (0x03|0x0035) plen 5  #94 [hci1] 11.082311
        Num handles: 1
        Handle: 3366 Address: DF:A9:FF:F6:B1:1A (OUI DF-A9-FF)
        Count: 1
> HCI Event: Disconnect Complete (0x05) plen 4             #95 [hci1] 12.272300
        Status: Success (0x00)
        Handle: 3366 Address: DF:A9:FF:F6:B1:1A (OUI DF-A9-FF)
        Reason: Remote User Terminated Connection (0x13)
< HCI Command: LE Extended Create.. (0x08|0x0043) plen 26  #96 [hci1] 13.001732
        Filter policy: Accept list is not used (0x00)
        Own address type: Random (0x01)
        Peer address type: Public (0x00)
        Peer address: DF:A9:FF:F6:B1:1A (OUI DF-A9-FF)
        Initiating PHYs: 0x01
        Entry 0: LE 1M
          Scan interval: 60.000 msec (0x0060)
          Scan window: 60.000 msec (0x0060)
          Min connection interval: 30.00 msec (0x0018)
          Max connection interval: 50.00 msec (0x0028)
          Connection latency: 0 (0x0000)
          Supervision timeout: 4000 msec (0x0190)
          Min connection length: 0.000 msec (0x0000)
          Max connection length: 0.000 msec (0x0000)
> HCI Event: Command Status (0x0f) plen 4                  #97 [hci1] 13.002712
      LE Extended Create Connection (0x08|0x0043) ncmd 1
        Status: Success (0x00)
> HCI Event: LE Meta Event (0x3e) plen 31                  #98 [hci1] 13.020018
      LE Enhanced Connection Complete (0x0a)
        Status: Success (0x00)
        Handle: 3384
        Role: Central (0x00)
        Peer address type: Public (0x00)
        Peer address: DF:A9:FF:F6:B1:1A (OUI DF-A9-FF)
        Local resolvable private address: 00:00:00:00:00:00 (Non-Resolvable)
        Peer resolvable private address: 00:00:00:00:00:00 (Non-Resolvable)
        Connection interval: 50.00 msec (0x0028)
        Connection latency: 0 (0x0000)
        Supervision timeout: 4000 msec (0x0190)
        Central clock accuracy: 0x00
< HCI Command: LE Read Remote Used.. (0x08|0x0016) plen 2  #99 [hci1] 13.021961
        Handle: 3384 Address: DF:A9:FF:F6:B1:1A (OUI DF-A9-FF)
> HCI Event: Command Status (0x0f) plen 4                 #100 [hci1] 13.022400
      LE Read Remote Used Features (0x08|0x0016) ncmd 1
        Status: Success (0x00)
< HCI Command: LE Set PHY (0x08|0x0032) plen 7            #101 [hci1] 13.041756
        Handle: 3384 Address: DF:A9:FF:F6:B1:1A (OUI DF-A9-FF)
        All PHYs preference: 0x00
        TX PHYs preference: 0x02
          LE 2M
        RX PHYs preference: 0x02
          LE 2M
        PHY options preference: Reserved (0x0000)
> HCI Event: Command Status (0x0f) plen 4                 #102 [hci1] 13.042285
      LE Set PHY (0x08|0x0032) ncmd 1
        Status: Success (0x00)
> ACL Data RX: Handle 3384 flags 0x02 dlen 8              #103 [hci1] 13.071658
      ATT: Handle Value Notification (0x1b) len 3
        Handle: 0x000b
          Data: 63
< HCI Command: Host Number of Com.. (0x03|0x0035) plen 5  #104 [hci1] 13.081732
        Num handles: 1
        Handle: 3384 Address: DF:A9:FF:F6:B1:1A (OUI DF-A9-FF)
        Count: 1
> HCI Event: LE Meta Event (0x3e) plen 12                 #105 [hci1] 13.171557
      LE Read Remote Used Features (0x04)
        Status: Success (0x00)
        Handle: 3384 Address: DF:A9:FF:F6:B1:1A (OUI DF-A9-FF)
        Features: 0x2d 0x49 0x00 0xf7 0x67 0xd9 0x00 0x80
          LE Encryption
          Extended Reject Indication
          Peripheral-initiated Features Exchange
          LE Data Packet Length Extension
          LE 2M PHY
          LE Coded PHY
          Channel Selection Algorithm #2
          Periodic Advertising Sync Transfer - Sender
          Periodic Advertising Sync Transfer - Recipient
          Sleep Clock Accuracy Updates
          Connected Isochronous Stream - Central
          Connected Isochronous Stream - Peripheral
          Isochronous Broadcaster
          Synchronized Receiver
          Connected Isochronous Stream (Host Support)
          LE Power Control Request
          LE Power Control Request
          Connection Subrating
          Connection Subrating (Host Support)
          Unknown features (0x8000d90000000000)
> HCI Event: LE Meta Event (0x3e) plen 6                  #106 [hci1] 13.670872
      LE PHY Update Complete (0x0c)
        Status: Success (0x00)
        Handle: 3384 Address: DF:A9:FF:F6:B1:1A (OUI DF-A9-FF)
        TX PHY: LE 2M (0x02)
        RX PHY: LE 2M (0x02)
> ACL Data RX: Handle 3384 flags 0x02 dlen 6              #107 [hci1] 19.171213
      SMP: Security Request (0x0b) len 1
        Authentication requirement: Bonding, MITM, Legacy, No Keypresses (0x05)
< HCI Command: Host Number of Com.. (0x03|0x0035) plen 5  #108 [hci1] 19.182098
        Num handles: 1
        Handle: 3384 Address: DF:A9:FF:F6:B1:1A (OUI DF-A9-FF)
        Count: 1
< ACL Data TX: Handle 3384 flags 0x00 dlen 11             #109 [hci1] 19.182210
      SMP: Pairing Request (0x01) len 6
        IO capability: KeyboardDisplay (0x04)
        OOB data: Authentication data not present (0x00)
        Authentication requirement: Bonding, No MITM, SC, No Keypresses (0x09)
        Max encryption key size: 16
        Initiator key distribution: EncKey (0x01)
        Responder key distribution: EncKey IdKey (0x03)
> HCI Event: Number of Completed Packets (0x13) plen 5    #110 [hci1] 19.221222
        Num handles: 1
        Handle: 3384 Address: DF:A9:FF:F6:B1:1A (OUI DF-A9-FF)
        Count: 1
        #109: len 11 (2 Kb/s)
        Latency: 39 msec (39-39 msec ~39 msec)
> ACL Data RX: Handle 3384 flags 0x02 dlen 11             #111 [hci1] 19.271374
      SMP: Pairing Response (0x02) len 6
        IO capability: KeyboardDisplay (0x04)
        OOB data: Authentication data not present (0x00)
        Authentication requirement: Bonding, MITM, Legacy, No Keypresses (0x05)
        Max encryption key size: 16
        Initiator key distribution: EncKey (0x01)
        Responder key distribution: EncKey IdKey (0x03)
< HCI Command: Host Number of Com.. (0x03|0x0035) plen 5  #112 [hci1] 19.282111
        Num handles: 1
        Handle: 3384 Address: DF:A9:FF:F6:B1:1A (OUI DF-A9-FF)
        Count: 1
< ACL Data TX: Handle 3384 flags 0x00 dlen 21             #113 [hci1] 19.282191
      SMP: Pairing Confirm (0x03) len 16
        Confim value: f612aa5263736d2d66038066cc806209
> HCI Event: Number of Completed Packets (0x13) plen 5    #114 [hci1] 19.321295
        Num handles: 1
        Handle: 3384 Address: DF:A9:FF:F6:B1:1A (OUI DF-A9-FF)
        Count: 1
        #113: len 21 (4 Kb/s)
        Latency: 39 msec (39-39 msec ~39 msec)
> ACL Data RX: Handle 3384 flags 0x02 dlen 21             #115 [hci1] 21.171437
      SMP: Pairing Confirm (0x03) len 16
        Confim value: dc1b0ff6306d6c3f7fb5c9cb0b1b1861
< HCI Command: Host Number of Com.. (0x03|0x0035) plen 5  #116 [hci1] 21.182093
        Num handles: 1
        Handle: 3384 Address: DF:A9:FF:F6:B1:1A (OUI DF-A9-FF)
        Count: 1
< ACL Data TX: Handle 3384 flags 0x00 dlen 21             #117 [hci1] 21.182147
      SMP: Pairing Random (0x04) len 16
        Random value: 0c3424a2acf8fd71a45c4a1bcadd27bd
> HCI Event: Number of Completed Packets (0x13) plen 5    #118 [hci1] 21.221184
        Num handles: 1
        Handle: 3384 Address: DF:A9:FF:F6:B1:1A (OUI DF-A9-FF)
        Count: 1
        #117: len 21 (4 Kb/s)
        Latency: 39 msec (39-39 msec ~39 msec)
> ACL Data RX: Handle 3384 flags 0x02 dlen 21             #119 [hci1] 21.271443
      SMP: Pairing Random (0x04) len 16
        Random value: dc60e8ea6f6da0320000000000000000
< HCI Command: LE Start Encryption (0x08|0x0019) plen 28  #120 [hci1] 21.281977
        Handle: 3384 Address: DF:A9:FF:F6:B1:1A (OUI DF-A9-FF)
        Random number: 0x0000000000000000
        Encrypted diversifier: 0x0000
        Long term key: 960094258d94f2d7c661a115e736d311
> HCI Event: Command Status (0x0f) plen 4                 #121 [hci1] 21.283105
      LE Start Encryption (0x08|0x0019) ncmd 1
        Status: Success (0x00)
< HCI Command: Host Number of Com.. (0x03|0x0035) plen 5  #122 [hci1] 21.301790
        Num handles: 1
        Handle: 3384 Address: DF:A9:FF:F6:B1:1A (OUI DF-A9-FF)
        Count: 1
> HCI Event: Encryption Change (0x08) plen 4              #123 [hci1] 21.621120
        Status: Success (0x00)
        Handle: 3384 Address: DF:A9:FF:F6:B1:1A (OUI DF-A9-FF)
        Encryption: Enabled with AES-CCM (0x01)
< HCI Command: LE Set Address Res.. (0x08|0x002d) plen 1  #124 [hci1] 21.621807
        Address resolution: Disabled (0x00)
> HCI Event: Command Complete (0x0e) plen 4               #125 [hci1] 21.622345
      LE Set Address Resolution Enable (0x08|0x002d) ncmd 1
        Status: Success (0x00)
< HCI Command: LE Remove Device F.. (0x08|0x0028) plen 7  #126 [hci1] 21.641816
        Address type: Public (0x00)
        Address: DF:A9:FF:F6:B1:1A (OUI DF-A9-FF)
> HCI Event: Command Complete (0x0e) plen 4               #127 [hci1] 21.642483
      LE Remove Device From Resolving List (0x08|0x0028) ncmd 1
        Status: Success (0x00)
> ACL Data RX: Handle 3384 flags 0x02 dlen 21             #128 [hci1] 21.671369
      SMP: Encryption Information (0x06) len 16
        Long term key: f15e350a70bfbac3a53c33ca8406dfe8
< HCI Command: Host Number of Com.. (0x03|0x0035) plen 5  #129 [hci1] 21.682160
        Num handles: 1
        Handle: 3384 Address: DF:A9:FF:F6:B1:1A (OUI DF-A9-FF)
        Count: 1
> ACL Data RX: Handle 3384 flags 0x02 dlen 15             #130 [hci1] 21.721281
      SMP: Central Identification (0x07) len 10
        EDIV: 0x29ee
        Rand: 0x1bb1f5dc9fc55ffd
> ACL Data RX: Handle 3384 flags 0x02 dlen 21             #131 [hci1] 21.721869
      SMP: Identity Information (0x08) len 16
        Identity resolving key: 5360b9e1c05185dee2dc4c90f65fc661
< HCI Command: Host Number of Com.. (0x03|0x0035) plen 5  #132 [hci1] 21.722202
        Num handles: 1
        Handle: 3384 Address: DF:A9:FF:F6:B1:1A (OUI DF-A9-FF)
        Count: 1
< HCI Command: Host Number of Com.. (0x03|0x0035) plen 5  #133 [hci1] 21.741991
        Num handles: 1
        Handle: 3384 Address: DF:A9:FF:F6:B1:1A (OUI DF-A9-FF)
        Count: 1
> ACL Data RX: Handle 3384 flags 0x02 dlen 12             #134 [hci1] 21.771271
      SMP: Identity Address Information (0x09) len 7
        Address: DF:A9:FF:F6:B1:1A (OUI DF-A9-FF)
< HCI Command: LE Add Device To... (0x08|0x0027) plen 39  #135 [hci1] 21.781944
        Address type: Public (0x00)
        Address: DF:A9:FF:F6:B1:1A (OUI DF-A9-FF)
        Peer identity resolving key: 5360b9e1c05185dee2dc4c90f65fc661
        Local identity resolving key: 00000000000000000000000000000000
> HCI Event: Command Complete (0x0e) plen 4               #136 [hci1] 21.782939
      LE Add Device To Resolving List (0x08|0x0027) ncmd 1
        Status: Success (0x00)
< HCI Command: LE Set Privacy Mode (0x08|0x004e) plen 8   #137 [hci1] 21.801838
        Peer Identity address type: Public (0x00)
        Peer Identity address: DF:A9:FF:F6:B1:1A (OUI DF-A9-FF)
        Privacy Mode: Use Device Privacy (0x01)
> HCI Event: Command Complete (0x0e) plen 4               #138 [hci1] 21.802406
      LE Set Privacy Mode (0x08|0x004e) ncmd 1
        Status: Success (0x00)
< HCI Command: LE Set Address Res.. (0x08|0x002d) plen 1  #139 [hci1] 21.821988
        Address resolution: Enabled (0x01)
> HCI Event: Command Complete (0x0e) plen 4               #140 [hci1] 21.822476
      LE Set Address Resolution Enable (0x08|0x002d) ncmd 1
        Status: Success (0x00)
< HCI Command: Host Number of Com.. (0x03|0x0035) plen 5  #141 [hci1] 21.842094
        Num handles: 1
        Handle: 3384 Address: DF:A9:FF:F6:B1:1A (OUI DF-A9-FF)
        Count: 1
< ACL Data TX: Handle 3384 flags 0x00 dlen 21             #142 [hci1] 21.842204
      SMP: Encryption Information (0x06) len 16
        Long term key: aca1ba32527e6e64e79f33b2e374394d
< ACL Data TX: Handle 3384 flags 0x00 dlen 15             #143 [hci1] 21.842255
      SMP: Central Identification (0x07) len 10
        EDIV: 0x83e2
        Rand: 0xdfdbddba952dabb8
> HCI Event: Number of Completed Packets (0x13) plen 5    #144 [hci1] 21.871104
        Num handles: 1
        Handle: 3384 Address: DF:A9:FF:F6:B1:1A (OUI DF-A9-FF)
        Count: 1
        #142: len 21 (6 Kb/s)
        Latency: 28 msec (28-39 msec ~33 msec)
> HCI Event: Number of Completed Packets (0x13) plen 5    #145 [hci1] 21.871679
        Num handles: 1
        Handle: 3384 Address: DF:A9:FF:F6:B1:1A (OUI DF-A9-FF)
        Count: 1
        #143: len 15 (4 Kb/s)
        Latency: 29 msec (28-39 msec ~31 msec)
> ACL Data RX: Handle 3384 flags 0x02 dlen 8              #146 [hci1] 21.921288
      ATT: Handle Value Notification (0x1b) len 3
        Handle: 0x000b
          Data: 62
< HCI Command: Host Number of Com.. (0x03|0x0035) plen 5  #147 [hci1] 21.922240
        Num handles: 1
        Handle: 3384 Address: DF:A9:FF:F6:B1:1A (OUI DF-A9-FF)
        Count: 1
> HCI Event: Disconnect Complete (0x05) plen 4            #148 [hci1] 22.470865
        Status: Success (0x00)
        Handle: 3384 Address: DF:A9:FF:F6:B1:1A (OUI DF-A9-FF)
        Reason: Remote User Terminated Connection (0x13)
< HCI Command: Reset (0x03|0x0003) plen 0                 #149 [hci1] 28.431889
> HCI Event: Command Complete (0x0e) plen 4               #150 [hci1] 28.432368
      Reset (0x03|0x0003) ncmd 1
        Status: Success (0x00)
@ USER Close: main                                    {0x0001} [hci1] 28.441822
= Close Index: 00:00:00:00:00:00                               [hci1] 28.441829
