Bluetooth monitor ver 5.72
btmon[1943794]: = Note: Linux version 6.14.0-36-generic (x86_64)                                                         0.450907
btmon[1943794]: = Note: Bluetooth subsystem version 2.22                                                                 0.450909
= New Index: 00:00:00:00:00:00 (Primary,UART,hci1)                                                                       0.450910
= New Index: 48:5F:99:8E:E0:64 (Primary,USB,hci0)                                                                        0.450910
= Open Index: 00:00:00:00:00:00                                                                                          0.965007
= Index Info: 00:00:00:00:00:00 (Nordic Semiconductor ASA)                                                               0.965023
zephyr.exe[1943796]: @ USER Open: main (privileged) version 2.22                                                {0x0001} 0.965033
zephyr.exe[1943796]: < HCI Command: Reset (0x03|0x0003) plen 0                                                        #1 0.966223
> HCI Event: Command Complete (0x0e) plen 4                                                                           #2 0.966884
      Reset (0x03|0x0003) ncmd 1
        Status: Success (0x00)
zephyr.exe[1943796]: < HCI Command: Read Local Supported Features (0x04|0x0003) plen 0                                #3 0.984854
> HCI Event: Command Complete (0x0e) plen 12                                                                          #4 0.985359
      Read Local Supported Features (0x04|0x0003) ncmd 1
        Status: Success (0x00)
        Features: 0x00 0x00 0x00 0x00 0x60 0x00 0x00 0x00
          BR/EDR Not Supported
          LE Supported (Controller)
zephyr.exe[1943796]: < HCI Command: Read Local Version Information (0x04|0x0001) plen 0                               #5 1.004530
> HCI Event: Command Complete (0x0e) plen 12                                                                          #6 1.005032
      Read Local Version Information (0x04|0x0001) ncmd 1
        Status: Success (0x00)
        HCI version: Reserved (0x0f) - Revision 12393 (0x3069)
        LMP version: Reserved (0x0f) - Subversion 12393 (0x3069)
        Manufacturer: Nordic Semiconductor ASA (89)
zephyr.exe[1943796]: < HCI Command: Read Local Supported Commands (0x04|0x0002) plen 0                                #7 1.024453
> HCI Event: Command Complete (0x0e) plen 68                                                                          #8 1.025684
      Read Local Supported Commands (0x04|0x0002) ncmd 1
        Status: Success (0x00)
        Commands: 119 entries
          Disconnect (Octet 0 - Bit 5)
          Read Remote Version Information (Octet 2 - Bit 7)
          Set Event Mask (Octet 5 - Bit 6)
          Reset (Octet 5 - Bit 7)
          Read Connection Accept Timeout (Octet 7 - Bit 2)
          Write Connection Accept Timeout (Octet 7 - Bit 3)
          Read Transmit Power Level (Octet 10 - Bit 2)
          Set Controller To Host Flow Control (Octet 10 - Bit 5)
          Host Buffer Size (Octet 10 - Bit 6)
          Host Number of Completed Packets (Octet 10 - Bit 7)
          Read Local Version Information (Octet 14 - Bit 3)
          Read Local Supported Features (Octet 14 - Bit 5)
          Read BD ADDR (Octet 15 - Bit 1)
          Read RSSI (Octet 15 - Bit 5)
          Set Event Mask Page 2 (Octet 22 - Bit 2)
          LE Set Event Mask (Octet 25 - Bit 0)
          LE Read Buffer Size (Octet 25 - Bit 1)
          LE Read Local Supported Features (Octet 25 - Bit 2)
          LE Set Random Address (Octet 25 - Bit 4)
          LE Set Advertising Parameters (Octet 25 - Bit 5)
          LE Read Advertising Channel TX Power (Octet 25 - Bit 6)
          LE Set Advertising Data (Octet 25 - Bit 7)
          LE Set Scan Response Data (Octet 26 - Bit 0)
          LE Set Advertise Enable (Octet 26 - Bit 1)
          LE Set Scan Parameters (Octet 26 - Bit 2)
          LE Set Scan Enable (Octet 26 - Bit 3)
          LE Create Connection (Octet 26 - Bit 4)
          LE Create Connection Cancel (Octet 26 - Bit 5)
          LE Read Accept List Size (Octet 26 - Bit 6)
          LE Clear Accept List (Octet 26 - Bit 7)
          LE Add Device To Accept List (Octet 27 - Bit 0)
          LE Remove Device From Accept List (Octet 27 - Bit 1)
          LE Connection Update (Octet 27 - Bit 2)
          LE Set Host Channel Classification (Octet 27 - Bit 3)
          LE Read Channel Map (Octet 27 - Bit 4)
          LE Read Remote Used Features (Octet 27 - Bit 5)
          LE Encrypt (Octet 27 - Bit 6)
          LE Rand (Octet 27 - Bit 7)
          LE Start Encryption (Octet 28 - Bit 0)
          LE Long Term Key Request Reply (Octet 28 - Bit 1)
          LE Long Term Key Request Neg Reply (Octet 28 - Bit 2)
          LE Read Supported States (Octet 28 - Bit 3)
          LE Receiver Test (Octet 28 - Bit 4)
          LE Transmitter Test (Octet 28 - Bit 5)
          LE Test End (Octet 28 - Bit 6)
          Read Authenticated Payload Timeout (Octet 32 - Bit 4)
          Write Authenticated Payload Timeout (Octet 32 - Bit 5)
          LE Set Data Length (Octet 33 - Bit 6)
          LE Read Suggested Default Data Length (Octet 33 - Bit 7)
          LE Write Suggested Default Data Length (Octet 34 - Bit 0)
          LE Add Device To Resolving List (Octet 34 - Bit 3)
          LE Remove Device From Resolving List (Octet 34 - Bit 4)
          LE Clear Resolving List (Octet 34 - Bit 5)
          LE Read Resolving List Size (Octet 34 - Bit 6)
          LE Set Address Resolution Enable (Octet 35 - Bit 1)
          LE Set Resolvable Private Address Timeout (Octet 35 - Bit 2)
          LE Read Maximum Data Length (Octet 35 - Bit 3)
          LE Read PHY (Octet 35 - Bit 4)
          LE Set Default PHY (Octet 35 - Bit 5)
          LE Set PHY (Octet 35 - Bit 6)
          LE Enhanced Receiver Test (Octet 35 - Bit 7)
          LE Enhanced Transmitter Test (Octet 36 - Bit 0)
          LE Set Advertising Set Random Address (Octet 36 - Bit 1)
          LE Set Extended Advertising Parameters (Octet 36 - Bit 2)
          LE Set Extended Advertising Data (Octet 36 - Bit 3)
          LE Set Extended Scan Response Data (Octet 36 - Bit 4)
          LE Set Extended Advertising Enable (Octet 36 - Bit 5)
          LE Read Maximum Advertising Data Length (Octet 36 - Bit 6)
          LE Read Number of Supported Advertising Sets (Octet 36 - Bit 7)
          LE Remove Advertising Set (Octet 37 - Bit 0)
          LE Clear Advertising Sets (Octet 37 - Bit 1)
          LE Set Periodic Advertising Parameters (Octet 37 - Bit 2)
          LE Set Periodic Advertising Data (Octet 37 - Bit 3)
          LE Set Periodic Advertising Enable (Octet 37 - Bit 4)
          LE Set Extended Scan Parameters (Octet 37 - Bit 5)
          LE Set Extended Scan Enable (Octet 37 - Bit 6)
          LE Extended Create Connection (Octet 37 - Bit 7)
          LE Periodic Advertising Create Sync (Octet 38 - Bit 0)
          LE Periodic Advertising Create Sync Cancel (Octet 38 - Bit 1)
          LE Periodic Advertising Terminate Sync (Octet 38 - Bit 2)
          LE Add Device To Periodic Advertiser List (Octet 38 - Bit 3)
          LE Remove Device From Periodic Advertiser List (Octet 38 - Bit 4)
          LE Clear Periodic Advertiser List (Octet 38 - Bit 5)
          LE Read Periodic Advertiser List Size (Octet 38 - Bit 6)
          LE Read Transmit Power (Octet 38 - Bit 7)
          LE Read RF Path Compensation (Octet 39 - Bit 0)
          LE Write RF Path Compensation (Octet 39 - Bit 1)
          LE Set Privacy Mode (Octet 39 - Bit 2)
          LE Periodic Advertising Receive Enable (Octet 40 - Bit 5)
          LE Periodic Advertising Sync Transfer (Octet 40 - Bit 6)
          LE Periodic Advertising Set Info Transfer (Octet 40 - Bit 7)
          LE Periodic Advertising Sync Transfer Parameters (Octet 41 - Bit 0)
          LE Set Default Periodic Advertisng Sync Transfer Parameters (Octet 41 - Bit 1)
          LE Read Buffer v2 (Octet 41 - Bit 5)
          LE Read ISO TX Sync (Octet 41 - Bit 6)
          LE Set Connected Isochronous Group Parameters (Octet 41 - Bit 7)
          LE Set Connected Isochronous Group Parameters Test (Octet 42 - Bit 0)
          LE Create Connected Isochronous Stream (Octet 42 - Bit 1)
          LE Remove Connected Isochronous Group (Octet 42 - Bit 2)
          LE Accept Connected Isochronous Stream Request (Octet 42 - Bit 3)
          LE Reject Connected Isochronous Stream Request (Octet 42 - Bit 4)
          LE Create Broadcast Isochronous Group (Octet 42 - Bit 5)
          LE Create Broadcast Isochronous Group Test (Octet 42 - Bit 6)
          LE Terminate Broadcast Isochronous Group (Octet 42 - Bit 7)
          LE Broadcast Isochronous Group Create Sync (Octet 43 - Bit 0)
          LE Broadcast Isochronous Group Terminate Sync (Octet 43 - Bit 1)
          LE Request Peer SCA (Octet 43 - Bit 2)
          LE Setup Isochronous Data Path (Octet 43 - Bit 3)
          LE Remove Isochronous Data Path (Octet 43 - Bit 4)
          LE Isochronous Transmit Test (Octet 43 - Bit 5)
          LE Isochronous Receive Test (Octet 43 - Bit 6)
          LE Isochronous Read Test Counters (Octet 43 - Bit 7)
          LE Isochronous Read Test Counters (Octet 44 - Bit 0)
          LE Set Host Feature (Octet 44 - Bit 1)
          Octet 44 - Bit 2 
          Octet 45 - Bit 6 
          Octet 46 - Bit 0 
          Octet 46 - Bit 1 
          Octet 46 - Bit 2 
zephyr.exe[1943796]: < HCI Command: Host Buffer Size (0x03|0x0033) plen 7                                             #9 1.044443
        ACL MTU: 255  ACL max packet: 16
        SCO MTU: 0    SCO max packet: 0
> HCI Event: Command Complete (0x0e) plen 4                                                                          #10 1.045038
      Host Buffer Size (0x03|0x0033) ncmd 1
        Status: Success (0x00)
zephyr.exe[1943796]: < HCI Command: Set Controller To Host Flow Control (0x03|0x0031) plen 1                         #11 1.064419
        Flow control: ACL Data Packets (0x01)
> HCI Event: Command Complete (0x0e) plen 4                                                                          #12 1.064849
      Set Controller To Host Flow Control (0x03|0x0031) ncmd 1
        Status: Success (0x00)
zephyr.exe[1943796]: < HCI Command: LE Read Local Supported Features (0x08|0x0003) plen 0                            #13 1.084468
> HCI Event: Command Complete (0x0e) plen 12                                                                         #14 1.085045
      LE Read Local Supported Features (0x08|0x0003) ncmd 1
        Status: Success (0x00)
        Features: 0xfd 0x79 0x00 0xf7 0x30 0x01 0x00 0x00
          LE Encryption
          Extended Reject Indication
          Peripheral-initiated Features Exchange
          LE Ping
          LE Data Packet Length Extension
          LL Privacy
          Extended Scanner Filter Policies
          LE 2M PHY
          LE Coded PHY
          LE Extended Advertising
          LE Periodic Advertising
          Channel Selection Algorithm #2
          Periodic Advertising Sync Transfer - Sender
          Periodic Advertising Sync Transfer - Recipient
          Sleep Clock Accuracy Updates
          Connected Isochronous Stream - Central
          Connected Isochronous Stream - Peripheral
          Isochronous Broadcaster
          Synchronized Receiver
          Periodic Advertising ADI support
          Connection Subrating
          Unknown features (0x0000010000000000)
zephyr.exe[1943796]: < HCI Command: LE Set Host Feature (0x08|0x0074) plen 2                                         #15 1.104468
        Bit Number: 32
          Connected Isochronous Stream (Host Support)
        Bit Value: 1
> HCI Event: Command Complete (0x0e) plen 4                                                                          #16 1.105005
      LE Set Host Feature (0x08|0x0074) ncmd 1
        Status: Success (0x00)
zephyr.exe[1943796]: < HCI Command: LE Read Buffer v2 (0x08|0x0060) plen 0                                           #17 1.124443
> HCI Event: Command Complete (0x0e) plen 10                                                                         #18 1.124920
      LE Read Buffer v2 (0x08|0x0060) ncmd 1
        Status: Success (0x00)
        ACL MTU: 27
        ACL max packet: 3
        ISO MTU: 318
        ISO max packet: 3
zephyr.exe[1943796]: < HCI Command: LE Read Maximum Advertising Data Length (0x08|0x003a) plen 0                     #19 1.144469
> HCI Event: Command Complete (0x0e) plen 6                                                                          #20 1.145059
      LE Read Maximum Advertising Data Length (0x08|0x003a) ncmd 1
        Status: Success (0x00)
        Max length: 1650
zephyr.exe[1943796]: < HCI Command: LE Read Supported States (0x08|0x001c) plen 0                                    #21 1.164400
> HCI Event: Command Complete (0x0e) plen 12                                                                         #22 1.165003
      LE Read Supported States (0x08|0x001c) ncmd 1
        Status: Success (0x00)
        States: 0x000003ff3e0306ff
          Non-connectable Advertising State
          Scannable Advertising State
          Connectable Advertising State
          High Duty Cycle Directed Advertising State
          Passive Scanning State
          Active Scanning State
          Initiating State
            and Connection State (Central Role)
          Connection State (Peripheral Role)
          Scannable Advertising State
            and Passive Scanning State
          Connectable Advertising State
            and Passive Scanning State
          Non-connectable Advertising State
            and Initiating State
          Scannable Advertising State
            and Initiating State
          Active Scanning State
            and Connection State (Central Role)
          Passive Scanning State
            and Connection State (Peripheral Role)
          Active Scanning State
            and Connection State (Peripheral Role)
          Initiating State
            and Connection State (Central Role)
            and Central Role & Central Role
          Low Duty Cycle Directed Advertising State
          Connectable Advertising State
            and Initiating State
            and Central Role & Peripheral Role
          High Duty Cycle Directed Advertising State
            and Initiating State
            and Central Role & Peripheral Role
          Low Duty Cycle Directed Advertising State
            and Initiating State
            and Central Role & Peripheral Role
          Connectable Advertising State
            and Connection State (Central Role)
            and Central Role & Peripheral Role
          High Duty Cycle Directed Advertising State
            and Connection State (Central Role)
            and Central Role & Peripheral Role
          Low Duty Cycle Directed Advertising State
            and Connection State (Central Role)
            and Central Role & Peripheral Role
          Connectable Advertising State
            and Connection State (Peripheral Role)
            and Central Role & Peripheral Role
          High Duty Cycle Directed Advertising State
            and Connection State (Peripheral Role)
            and Peripheral Role & Peripheral Role
          Low Duty Cycle Directed Advertising State
            and Connection State (Peripheral Role)
            and Peripheral Role & Peripheral Role
          Initiating State
            and Connection State (Peripheral Role)
            and Central Role & Peripheral Role
zephyr.exe[1943796]: < HCI Command: LE Read Maximum Data Length (0x08|0x002f) plen 0                                 #23 1.184429
> HCI Event: Command Complete (0x0e) plen 12                                                                         #24 1.185069
      LE Read Maximum Data Length (0x08|0x002f) ncmd 1
        Status: Success (0x00)
        Max TX octets: 251
        Max TX time: 2704
        Max RX octets: 251
        Max RX time: 2704
zephyr.exe[1943796]: < HCI Command: LE Write Suggested Default Data Length (0x08|0x0024) plen 4                      #25 1.204450
        TX octets: 251
        TX time: 2704
> HCI Event: Command Complete (0x0e) plen 4                                                                          #26 1.205019
      LE Write Suggested Default Data Length (0x08|0x0024) ncmd 1
        Status: Success (0x00)
zephyr.exe[1943796]: < HCI Command: LE Set Resolvable Private Address Timeout (0x08|0x002e) plen 2                   #27 1.224465
        Timeout: 30 seconds
> HCI Event: Command Complete (0x0e) plen 4                                                                          #28 1.224956
      LE Set Resolvable Private Address Timeout (0x08|0x002e) ncmd 1
        Status: Success (0x00)
zephyr.exe[1943796]: < HCI Command: LE Read Resolving List Size (0x08|0x002a) plen 0                                 #29 1.244435
> HCI Event: Command Complete (0x0e) plen 5                                                                          #30 1.244953
      LE Read Resolving List Size (0x08|0x002a) ncmd 1
        Status: Success (0x00)
        Size: 8
zephyr.exe[1943796]: < HCI Command: LE Set Event Mask (0x08|0x0001) plen 8                                           #31 1.264416
        Mask: 0x000002023f87fa5e
          LE Advertising Report
          LE Connection Update Complete
          LE Read Remote Used Features Complete
          LE Long Term Key Request
          LE Data Length Change
          LE Enhanced Connection Complete
          LE PHY Update Complete
          LE Extended Advertising Report
          LE Periodic Advertising Sync Established
          LE Periodic Advertising Report
          LE Periodic Advertising Sync Lost
          LE Extended Scan Timeout
          LE Extended Advertising Set Terminated
          LE Scan Request Received
          LE Periodic Advertising Sync Transfer Rvc
          LE CIS Established
          LE CIS Request
          LE Create BIG Complete
          LE Terminate BIG Complete
          LE BIG Sync Estabilished Complete
          LE BIG Sync Lost
          LE BIG Info Advertising Report
          Unknown mask (0x0000020000000000)
> HCI Event: Command Complete (0x0e) plen 4                                                                          #32 1.265056
      LE Set Event Mask (0x08|0x0001) ncmd 1
        Status: Success (0x00)
zephyr.exe[1943796]: < HCI Command: Set Event Mask (0x03|0x0001) plen 8                                              #33 1.284441
        Mask: 0x2000800002008890
          Disconnection Complete
          Encryption Change
          Read Remote Version Information Complete
          Hardware Error
          Data Buffer Overflow
          Encryption Key Refresh Complete
          LE Meta
> HCI Event: Command Complete (0x0e) plen 4                                                                          #34 1.284988
      Set Event Mask (0x03|0x0001) ncmd 1
        Status: Success (0x00)
zephyr.exe[1943796]: < HCI Command: Read BD ADDR (0x04|0x0009) plen 0                                                #35 1.304453
> HCI Event: Command Complete (0x0e) plen 10                                                                         #36 1.304921
      Read BD ADDR (0x04|0x0009) ncmd 1
        Status: Success (0x00)
        Address: 00:00:00:00:00:00 (OUI 00-00-00)
zephyr.exe[1943796]: < HCI Command: LE Set Random Address (0x08|0x0005) plen 6                                       #37 1.324459
        Address: D5:B6:CC:31:DB:3B (Static)
> HCI Event: Command Complete (0x0e) plen 4                                                                          #38 1.324972
      LE Set Random Address (0x08|0x0005) ncmd 1
        Status: Success (0x00)
zephyr.exe[1943796]: < HCI Command: LE Set Random Address (0x08|0x0005) plen 6                                       #39 1.464615
        Address: 48:61:8E:DB:C6:F9 (Resolvable)
> HCI Event: Command Complete (0x0e) plen 4                                                                          #40 1.465060
      LE Set Random Address (0x08|0x0005) ncmd 1
        Status: Success (0x00)
zephyr.exe[1943796]: < HCI Command: LE Extended Create Connection (0x08|0x0043) plen 26                              #41 5.374435
        Filter policy: Accept list is not used (0x00)
        Own address type: Random (0x03)
        Peer address type: Random (0x01)
        Peer address: 72:DC:90:8B:B5:53 (Resolvable)
        Initiating PHYs: 0x01
        Entry 0: LE 1M
          Scan interval: 60.000 msec (0x0060)
          Scan window: 60.000 msec (0x0060)
          Min connection interval: 30.00 msec (0x0018)
          Max connection interval: 50.00 msec (0x0028)
          Connection latency: 0 (0x0000)
          Supervision timeout: 4000 msec (0x0190)
          Min connection length: 0.000 msec (0x0000)
          Max connection length: 0.000 msec (0x0000)
> HCI Event: Command Status (0x0f) plen 4                                                                            #42 5.375301
      LE Extended Create Connection (0x08|0x0043) ncmd 1
        Status: Success (0x00)
> HCI Event: LE Meta Event (0x3e) plen 31                                                                            #43 5.407122
      LE Enhanced Connection Complete (0x0a)
        Status: Success (0x00)
        Handle: 810
        Role: Central (0x00)
        Peer address type: Random (0x01)
        Peer address: 72:DC:90:8B:B5:53 (Resolvable)
        Local resolvable private address: 48:61:8E:DB:C6:F9 (Resolvable)
        Peer resolvable private address: 00:00:00:00:00:00 (Non-Resolvable)
        Connection interval: 50.00 msec (0x0028)
        Connection latency: 0 (0x0000)
        Supervision timeout: 4000 msec (0x0190)
        Central clock accuracy: 0x00
zephyr.exe[1943796]: < HCI Command: LE Read Remote Used Features (0x08|0x0016) plen 2                                #44 5.424745
        Handle: 810 Address: 72:DC:90:8B:B5:53 (Resolvable)
> HCI Event: Command Status (0x0f) plen 4                                                                            #45 5.425269
      LE Read Remote Used Features (0x08|0x0016) ncmd 1
        Status: Success (0x00)
zephyr.exe[1943796]: < HCI Command: LE Set PHY (0x08|0x0032) plen 7                                                  #46 5.444508
        Handle: 810 Address: 72:DC:90:8B:B5:53 (Resolvable)
        All PHYs preference: 0x00
        TX PHYs preference: 0x02
          LE 2M
        RX PHYs preference: 0x02
          LE 2M
        PHY options preference: Reserved (0x0000)
> HCI Event: Command Status (0x0f) plen 4                                                                            #47 5.445078
      LE Set PHY (0x08|0x0032) ncmd 1
        Status: Success (0x00)
> HCI Event: LE Meta Event (0x3e) plen 12                                                                            #48 5.558680
      LE Read Remote Used Features (0x04)
        Status: Success (0x00)
        Handle: 810 Address: 72:DC:90:8B:B5:53 (Resolvable)
        Features: 0x2d 0x49 0x00 0xf7 0x67 0xd8 0x00 0x00
          LE Encryption
          Extended Reject Indication
          Peripheral-initiated Features Exchange
          LE Data Packet Length Extension
          LE 2M PHY
          LE Coded PHY
          Channel Selection Algorithm #2
          Periodic Advertising Sync Transfer - Sender
          Periodic Advertising Sync Transfer - Recipient
          Sleep Clock Accuracy Updates
          Connected Isochronous Stream - Central
          Connected Isochronous Stream - Peripheral
          Isochronous Broadcaster
          Synchronized Receiver
          Connected Isochronous Stream (Host Support)
          LE Power Control Request
          LE Power Control Request
          Connection Subrating
          Connection Subrating (Host Support)
          Unknown features (0x0000d80000000000)
> HCI Event: LE Meta Event (0x3e) plen 6                                                                             #49 6.057931
      LE PHY Update Complete (0x0c)
        Status: Success (0x00)
        Handle: 810 Address: 72:DC:90:8B:B5:53 (Resolvable)
        TX PHY: LE 2M (0x02)
        RX PHY: LE 2M (0x02)
zephyr.exe[1943796]: < ACL Data TX: Handle 810 flags 0x00 dlen 11                                                    #50 6.404554
      SMP: Pairing Request (0x01) len 6
        IO capability: KeyboardDisplay (0x04)
        OOB data: Authentication data not present (0x00)
        Authentication requirement: Bonding, No MITM, SC, No Keypresses (0x09)
        Max encryption key size: 16
        Initiator key distribution: EncKey IdKey (0x03)
        Responder key distribution: EncKey IdKey (0x03)
> HCI Event: Number of Completed Packets (0x13) plen 5                                                               #51 6.408446
        Num handles: 1
        Handle: 810 Address: 72:DC:90:8B:B5:53 (Resolvable)
        Count: 1
        #50: len 11 (29 Kb/s)
        Latency: 3 msec (3-3 msec ~3 msec)
> ACL Data RX: Handle 810 flags 0x02 dlen 11                                                                         #52 6.458685
      SMP: Pairing Response (0x02) len 6
        IO capability: KeyboardDisplay (0x04)
        OOB data: Authentication data not present (0x00)
        Authentication requirement: Bonding, No MITM, SC, No Keypresses (0x09)
        Max encryption key size: 16
        Initiator key distribution: EncKey IdKey (0x03)
        Responder key distribution: EncKey IdKey (0x03)
zephyr.exe[1943796]: < HCI Command: Host Number of Completed Packets (0x03|0x0035) plen 5                            #53 6.464487
        Num handles: 1
        Handle: 810 Address: 72:DC:90:8B:B5:53 (Resolvable)
        Count: 1
zephyr.exe[1943796]: < ACL Data TX: Handle 810 flags 0x00 dlen 27                                                    #54 6.464495
zephyr.exe[1943796]: < ACL Data TX: Handle 810 flags 0x01 dlen 27                                                    #55 6.464496
zephyr.exe[1943796]: < ACL Data TX: Handle 810 flags 0x01 dlen 15                                                    #56 6.464497
      SMP: Pairing Public Key (0x0c) len 64
        X: 68f6ada634ce84d11617383d57f070fe3445c38b33b569efa5eb771a0dc8aea5
        Y: 83c407aaa8337331fdc418e55085d75e6c1c6e5d42f8bf9c18fb5a2a7d4f31aa
> HCI Event: Number of Completed Packets (0x13) plen 5                                                               #57 6.508469
        Num handles: 1
        Handle: 810 Address: 72:DC:90:8B:B5:53 (Resolvable)
        Count: 1
        #54: len 27 (5 Kb/s)
        Latency: 43 msec (3-43 msec ~23 msec)
> HCI Event: Number of Completed Packets (0x13) plen 5                                                               #58 6.508899
        Num handles: 1
        Handle: 810 Address: 72:DC:90:8B:B5:53 (Resolvable)
        Count: 1
        #55: len 27 (4 Kb/s)
        Latency: 44 msec (3-44 msec ~34 msec)
> HCI Event: Number of Completed Packets (0x13) plen 5                                                               #59 6.509343
        Num handles: 1
        Handle: 810 Address: 72:DC:90:8B:B5:53 (Resolvable)
        Count: 1
        #56: len 15 (2 Kb/s)
        Latency: 44 msec (3-44 msec ~39 msec)
> ACL Data RX: Handle 810 flags 0x02 dlen 27                                                                         #60 6.558667
> ACL Data RX: Handle 810 flags 0x01 dlen 27                                                                         #61 6.559125
> ACL Data RX: Handle 810 flags 0x01 dlen 15                                                                         #62 6.559488
      SMP: Pairing Public Key (0x0c) len 64
        X: 9af83deafb4d9f79727d19ead2c0ac0e1d7db97192d9870109fa6f6e7d8c54c8
        Y: 9336ef742089b90d17a658d82b1e2c1a113af33eb5a423dcdd272db62604b3df
zephyr.exe[1943796]: < HCI Command: Host Number of Completed Packets (0x03|0x0035) plen 5                            #63 6.564602
        Num handles: 1
        Handle: 810 Address: 72:DC:90:8B:B5:53 (Resolvable)
        Count: 1
zephyr.exe[1943796]: < HCI Command: Host Number of Completed Packets (0x03|0x0035) plen 5                            #64 6.564729
        Num handles: 1
        Handle: 810 Address: 72:DC:90:8B:B5:53 (Resolvable)
        Count: 1
zephyr.exe[1943796]: < HCI Command: Host Number of Completed Packets (0x03|0x0035) plen 5                            #65 6.564812
        Num handles: 1
        Handle: 810 Address: 72:DC:90:8B:B5:53 (Resolvable)
        Count: 1
> ACL Data RX: Handle 810 flags 0x02 dlen 21                                                                         #66 6.608685
      SMP: Pairing Confirm (0x03) len 16
        Confim value: 7ca5e7aa2b92409ab223dfc1c0555b13
zephyr.exe[1943796]: < HCI Command: Host Number of Completed Packets (0x03|0x0035) plen 5                            #67 6.624507
        Num handles: 1
        Handle: 810 Address: 72:DC:90:8B:B5:53 (Resolvable)
        Count: 1
zephyr.exe[1943796]: < ACL Data TX: Handle 810 flags 0x00 dlen 21                                                    #68 6.624593
      SMP: Pairing Random (0x04) len 16
        Random value: 555cc64d02679f89a05211af56d8b3da
> HCI Event: Number of Completed Packets (0x13) plen 5                                                               #69 6.658419
        Num handles: 1
        Handle: 810 Address: 72:DC:90:8B:B5:53 (Resolvable)
        Count: 1
        #68: len 21 (5 Kb/s)
        Latency: 33 msec (3-44 msec ~36 msec)
> ACL Data RX: Handle 810 flags 0x02 dlen 21                                                                         #70 6.708624
      SMP: Pairing Random (0x04) len 16
        Random value: 5bc8ae18611d6dd10000000000000000
zephyr.exe[1943796]: < HCI Command: Host Number of Completed Packets (0x03|0x0035) plen 5                            #71 6.724741
        Num handles: 1
        Handle: 810 Address: 72:DC:90:8B:B5:53 (Resolvable)
        Count: 1
zephyr.exe[1943796]: < ACL Data TX: Handle 810 flags 0x00 dlen 21                                                    #72 6.724845
      SMP: Pairing DHKey Check (0x0d) len 16
        E: fa63c9866143b20a1e3841745595a42e
> HCI Event: Number of Completed Packets (0x13) plen 5                                                               #73 6.758342
        Num handles: 1
        Handle: 810 Address: 72:DC:90:8B:B5:53 (Resolvable)
        Count: 1
        #72: len 21 (5 Kb/s)
        Latency: 33 msec (3-44 msec ~35 msec)
> ACL Data RX: Handle 810 flags 0x02 dlen 21                                                                         #74 6.958755
      SMP: Pairing DHKey Check (0x0d) len 16
        E: 18e63584adc42c83d3bffef2700533a3
zephyr.exe[1943796]: < HCI Command: LE Start Encryption (0x08|0x0019) plen 28                                        #75 6.964726
        Handle: 810 Address: 72:DC:90:8B:B5:53 (Resolvable)
        Random number: 0x0000000000000000
        Encrypted diversifier: 0x0000
        Long term key: 49d6a9b87b23269d80104ac3ab1d77f7
> HCI Event: Command Status (0x0f) plen 4                                                                            #76 6.965572
      LE Start Encryption (0x08|0x0019) ncmd 1
        Status: Success (0x00)
zephyr.exe[1943796]: < HCI Command: Host Number of Completed Packets (0x03|0x0035) plen 5                            #77 6.984447
        Num handles: 1
        Handle: 810 Address: 72:DC:90:8B:B5:53 (Resolvable)
        Count: 1
> HCI Event: Encryption Change (0x08) plen 4                                                                         #78 7.308307
        Status: Success (0x00)
        Handle: 810 Address: 72:DC:90:8B:B5:53 (Resolvable)
        Encryption: Enabled with AES-CCM (0x01)
> ACL Data RX: Handle 810 flags 0x02 dlen 21                                                                         #79 7.358641
      SMP: Identity Information (0x08) len 16
        Identity resolving key: d278f98b9b44727fb5de0938890ab2d8
zephyr.exe[1943796]: < HCI Command: Host Number of Completed Packets (0x03|0x0035) plen 5                            #80 7.364825
        Num handles: 1
        Handle: 810 Address: 72:DC:90:8B:B5:53 (Resolvable)
          Identity type: Public (0x00)
          Identity: 00:00:00:00:00:00 (OUI 00-00-00)
        Count: 1
> ACL Data RX: Handle 810 flags 0x02 dlen 12                                                                         #81 7.408676
      SMP: Identity Address Information (0x09) len 7
        Address: DF:A9:FF:F6:B1:1A (OUI DF-A9-FF)
zephyr.exe[1943796]: < HCI Command: LE Add Device To Resolving List (0x08|0x0027) plen 39                            #82 7.424812
        Address type: Public (0x00)
        Address: DF:A9:FF:F6:B1:1A (OUI DF-A9-FF)
        Peer identity resolving key: d278f98b9b44727fb5de0938890ab2d8
        Local identity resolving key: 08aad2e1be87e47b88aeb19de6889efb
> HCI Event: Command Complete (0x0e) plen 4                                                                          #83 7.425743
      LE Add Device To Resolving List (0x08|0x0027) ncmd 1
        Status: Success (0x00)
zephyr.exe[1943796]: < HCI Command: LE Set Privacy Mode (0x08|0x004e) plen 8                                         #84 7.444555
        Peer Identity address type: Public (0x00)
        Peer Identity address: DF:A9:FF:F6:B1:1A (OUI DF-A9-FF)
        Privacy Mode: Use Device Privacy (0x01)
> HCI Event: Command Complete (0x0e) plen 4                                                                          #85 7.445107
      LE Set Privacy Mode (0x08|0x004e) ncmd 1
        Status: Success (0x00)
zephyr.exe[1943796]: < HCI Command: LE Set Address Resolution Enable (0x08|0x002d) plen 1                            #86 7.464574
        Address resolution: Enabled (0x01)
> HCI Event: Command Complete (0x0e) plen 4                                                                          #87 7.465041
      LE Set Address Resolution Enable (0x08|0x002d) ncmd 1
        Status: Success (0x00)
zephyr.exe[1943796]: < HCI Command: Host Number of Completed Packets (0x03|0x0035) plen 5                            #88 7.484578
        Num handles: 1
        Handle: 810 Address: 72:DC:90:8B:B5:53 (Resolvable)
          Identity type: Public (0x00)
          Identity: DF:A9:FF:F6:B1:1A (OUI DF-A9-FF)
        Count: 1
zephyr.exe[1943796]: < ACL Data TX: Handle 810 flags 0x00 dlen 21                                                    #89 7.484652
      SMP: Identity Information (0x08) len 16
        Identity resolving key: 08aad2e1be87e47b88aeb19de6889efb
zephyr.exe[1943796]: < ACL Data TX: Handle 810 flags 0x00 dlen 12                                                    #90 7.484663
      SMP: Identity Address Information (0x09) len 7
        Address: D5:B6:CC:31:DB:3B (Static)
> HCI Event: Number of Completed Packets (0x13) plen 5                                                               #91 7.508365
        Num handles: 1
        Handle: 810 Address: 72:DC:90:8B:B5:53 (Resolvable)
          Identity type: Public (0x00)
          Identity: DF:A9:FF:F6:B1:1A (OUI DF-A9-FF)
        Count: 1
        #89: len 21 (7 Kb/s)
        Latency: 23 msec (3-44 msec ~29 msec)
> HCI Event: Number of Completed Packets (0x13) plen 5                                                               #92 7.508888
        Num handles: 1
        Handle: 810 Address: 72:DC:90:8B:B5:53 (Resolvable)
          Identity type: Public (0x00)
          Identity: DF:A9:FF:F6:B1:1A (OUI DF-A9-FF)
        Count: 1
        #90: len 12 (4 Kb/s)
        Latency: 24 msec (3-44 msec ~26 msec)
zephyr.exe[1943796]: < ACL Data TX: Handle 810 flags 0x00 dlen 11                                                    #93 7.524898
      ATT: Read By Type Request (0x08) len 6
        Handle range: 0x0001-0xffff
        Attribute type: Central Address Resolution (0x2aa6)
> HCI Event: Number of Completed Packets (0x13) plen 5                                                               #94 7.558410
        Num handles: 1
        Handle: 810 Address: 72:DC:90:8B:B5:53 (Resolvable)
          Identity type: Public (0x00)
          Identity: DF:A9:FF:F6:B1:1A (OUI DF-A9-FF)
        Count: 1
        #93: len 11 (2 Kb/s)
        Latency: 33 msec (3-44 msec ~30 msec)
> ACL Data RX: Handle 810 flags 0x02 dlen 9                                                                          #95 7.608441
      ATT: Read By Type Response (0x09) len 4
        Attribute data length: 3
        Attribute data list: 1 entry
        Handle: 0x000f
        Value: 01
zephyr.exe[1943796]: < HCI Command: Host Number of Completed Packets (0x03|0x0035) plen 5                            #96 7.624971
        Num handles: 1
        Handle: 810 Address: 72:DC:90:8B:B5:53 (Resolvable)
          Identity type: Public (0x00)
          Identity: DF:A9:FF:F6:B1:1A (OUI DF-A9-FF)
        Count: 1
> HCI Event: Disconnect Complete (0x05) plen 4                                                                      #97 10.508038
        Status: Success (0x00)
        Handle: 810 Address: 72:DC:90:8B:B5:53 (Resolvable)
          Identity type: Public (0x00)
          Identity: DF:A9:FF:F6:B1:1A (OUI DF-A9-FF)
        Reason: Remote User Terminated Connection (0x13)
zephyr.exe[1943796]: < HCI Command: LE Extended Create Connection (0x08|0x0043) plen 26                             #98 11.424671
        Filter policy: Accept list is not used (0x00)
        Own address type: Random (0x03)
        Peer address type: Public (0x00)
        Peer address: DF:A9:FF:F6:B1:1A (OUI DF-A9-FF)
        Initiating PHYs: 0x01
        Entry 0: LE 1M
          Scan interval: 60.000 msec (0x0060)
          Scan window: 60.000 msec (0x0060)
          Min connection interval: 30.00 msec (0x0018)
          Max connection interval: 50.00 msec (0x0028)
          Connection latency: 0 (0x0000)
          Supervision timeout: 4000 msec (0x0190)
          Min connection length: 0.000 msec (0x0000)
          Max connection length: 0.000 msec (0x0000)
> HCI Event: Command Status (0x0f) plen 4                                                                           #99 11.425693
      LE Extended Create Connection (0x08|0x0043) ncmd 1
        Status: Success (0x00)
> HCI Event: LE Meta Event (0x3e) plen 31                                                                          #100 11.529145
      LE Enhanced Connection Complete (0x0a)
        Status: Success (0x00)
        Handle: 828
        Role: Central (0x00)
        Peer address type: Resolved Public (0x02)
        Peer address: DF:A9:FF:F6:B1:1A (OUI DF-A9-FF)
        Local resolvable private address: 40:55:F1:5B:83:AD (Resolvable)
          Identity type: Random (0x01)
          Identity: D5:B6:CC:31:DB:3B (Static)
        Peer resolvable private address: 46:87:3A:B2:8D:96 (Resolvable)
          Identity type: Public (0x00)
          Identity: DF:A9:FF:F6:B1:1A (OUI DF-A9-FF)
        Connection interval: 50.00 msec (0x0028)
        Connection latency: 0 (0x0000)
        Supervision timeout: 4000 msec (0x0190)
        Central clock accuracy: 0x00
zephyr.exe[1943796]: < HCI Command: LE Read Remote Used Features (0x08|0x0016) plen 2                              #101 11.544978
        Handle: 828 Address: DF:A9:FF:F6:B1:1A (OUI DF-A9-FF)
> HCI Event: Command Status (0x0f) plen 4                                                                          #102 11.545386
      LE Read Remote Used Features (0x08|0x0016) ncmd 1
        Status: Success (0x00)
zephyr.exe[1943796]: < HCI Command: LE Set PHY (0x08|0x0032) plen 7                                                #103 11.564875
        Handle: 828 Address: DF:A9:FF:F6:B1:1A (OUI DF-A9-FF)
        All PHYs preference: 0x00
        TX PHYs preference: 0x02
          LE 2M
        RX PHYs preference: 0x02
          LE 2M
        PHY options preference: Reserved (0x0000)
> HCI Event: Command Status (0x0f) plen 4                                                                          #104 11.565508
      LE Set PHY (0x08|0x0032) ncmd 1
        Status: Success (0x00)
> HCI Event: LE Meta Event (0x3e) plen 12                                                                          #105 11.680642
      LE Read Remote Used Features (0x04)
        Status: Success (0x00)
        Handle: 828 Address: DF:A9:FF:F6:B1:1A (OUI DF-A9-FF)
        Features: 0x2d 0x49 0x00 0xf7 0x67 0xd8 0x00 0x00
          LE Encryption
          Extended Reject Indication
          Peripheral-initiated Features Exchange
          LE Data Packet Length Extension
          LE 2M PHY
          LE Coded PHY
          Channel Selection Algorithm #2
          Periodic Advertising Sync Transfer - Sender
          Periodic Advertising Sync Transfer - Recipient
          Sleep Clock Accuracy Updates
          Connected Isochronous Stream - Central
          Connected Isoch