Bluetooth monitor ver 5.72
= Note: Linux version 6.14.0-36-generic (x86_64)                       0.146188
= Note: Bluetooth subsystem version 2.22                               0.146190
= New Index: 00:00:00:00:00:00 (Primary,UART,hci1)              [hci1] 0.146191
= New Index: 48:5F:99:8E:E0:64 (Primary,USB,hci0)               [hci0] 0.146192
= Open Index: 00:00:00:00:00:00                                 [hci1] 0.660039
= Index Info: 00:00:00:00:00:00 (Nordic Semiconductor ASA)      [hci1] 0.660056
@ USER Open: main (privileged) version 2.22            {0x0001} [hci1] 0.660066
< HCI Command: Reset (0x03|0x0003) plen 0                    #1 [hci1] 0.661377
> HCI Event: Command Complete (0x0e) plen 4                  #2 [hci1] 0.661900
      Reset (0x03|0x0003) ncmd 1
        Status: Success (0x00)
< HCI Command: Read Local Supported... (0x04|0x0003) plen 0  #3 [hci1] 0.679441
> HCI Event: Command Complete (0x0e) plen 12                 #4 [hci1] 0.679907
      Read Local Supported Features (0x04|0x0003) ncmd 1
        Status: Success (0x00)
        Features: 0x00 0x00 0x00 0x00 0x60 0x00 0x00 0x00
          BR/EDR Not Supported
          LE Supported (Controller)
< HCI Command: Read Local Version In.. (0x04|0x0001) plen 0  #5 [hci1] 0.699471
> HCI Event: Command Complete (0x0e) plen 12                 #6 [hci1] 0.700026
      Read Local Version Information (0x04|0x0001) ncmd 1
        Status: Success (0x00)
        HCI version: Reserved (0x0f) - Revision 12393 (0x3069)
        LMP version: Reserved (0x0f) - Subversion 12393 (0x3069)
        Manufacturer: Nordic Semiconductor ASA (89)
< HCI Command: Read Local Supported... (0x04|0x0002) plen 0  #7 [hci1] 0.719450
> HCI Event: Command Complete (0x0e) plen 68                 #8 [hci1] 0.720489
      Read Local Supported Commands (0x04|0x0002) ncmd 1
        Status: Success (0x00)
        Commands: 119 entries
          Disconnect (Octet 0 - Bit 5)
          Read Remote Version Information (Octet 2 - Bit 7)
          Set Event Mask (Octet 5 - Bit 6)
          Reset (Octet 5 - Bit 7)
          Read Connection Accept Timeout (Octet 7 - Bit 2)
          Write Connection Accept Timeout (Octet 7 - Bit 3)
          Read Transmit Power Level (Octet 10 - Bit 2)
          Set Controller To Host Flow Control (Octet 10 - Bit 5)
          Host Buffer Size (Octet 10 - Bit 6)
          Host Number of Completed Packets (Octet 10 - Bit 7)
          Read Local Version Information (Octet 14 - Bit 3)
          Read Local Supported Features (Octet 14 - Bit 5)
          Read BD ADDR (Octet 15 - Bit 1)
          Read RSSI (Octet 15 - Bit 5)
          Set Event Mask Page 2 (Octet 22 - Bit 2)
          LE Set Event Mask (Octet 25 - Bit 0)
          LE Read Buffer Size (Octet 25 - Bit 1)
          LE Read Local Supported Features (Octet 25 - Bit 2)
          LE Set Random Address (Octet 25 - Bit 4)
          LE Set Advertising Parameters (Octet 25 - Bit 5)
          LE Read Advertising Channel TX Power (Octet 25 - Bit 6)
          LE Set Advertising Data (Octet 25 - Bit 7)
          LE Set Scan Response Data (Octet 26 - Bit 0)
          LE Set Advertise Enable (Octet 26 - Bit 1)
          LE Set Scan Parameters (Octet 26 - Bit 2)
          LE Set Scan Enable (Octet 26 - Bit 3)
          LE Create Connection (Octet 26 - Bit 4)
          LE Create Connection Cancel (Octet 26 - Bit 5)
          LE Read Accept List Size (Octet 26 - Bit 6)
          LE Clear Accept List (Octet 26 - Bit 7)
          LE Add Device To Accept List (Octet 27 - Bit 0)
          LE Remove Device From Accept List (Octet 27 - Bit 1)
          LE Connection Update (Octet 27 - Bit 2)
          LE Set Host Channel Classification (Octet 27 - Bit 3)
          LE Read Channel Map (Octet 27 - Bit 4)
          LE Read Remote Used Features (Octet 27 - Bit 5)
          LE Encrypt (Octet 27 - Bit 6)
          LE Rand (Octet 27 - Bit 7)
          LE Start Encryption (Octet 28 - Bit 0)
          LE Long Term Key Request Reply (Octet 28 - Bit 1)
          LE Long Term Key Request Neg Reply (Octet 28 - Bit 2)
          LE Read Supported States (Octet 28 - Bit 3)
          LE Receiver Test (Octet 28 - Bit 4)
          LE Transmitter Test (Octet 28 - Bit 5)
          LE Test End (Octet 28 - Bit 6)
          Read Authenticated Payload Timeout (Octet 32 - Bit 4)
          Write Authenticated Payload Timeout (Octet 32 - Bit 5)
          LE Set Data Length (Octet 33 - Bit 6)
          LE Read Suggested Default Data Length (Octet 33 - Bit 7)
          LE Write Suggested Default Data Length (Octet 34 - Bit 0)
          LE Add Device To Resolving List (Octet 34 - Bit 3)
          LE Remove Device From Resolving List (Octet 34 - Bit 4)
          LE Clear Resolving List (Octet 34 - Bit 5)
          LE Read Resolving List Size (Octet 34 - Bit 6)
          LE Set Address Resolution Enable (Octet 35 - Bit 1)
          LE Set Resolvable Private Address Timeout (Octet 35 - Bit 2)
          LE Read Maximum Data Length (Octet 35 - Bit 3)
          LE Read PHY (Octet 35 - Bit 4)
          LE Set Default PHY (Octet 35 - Bit 5)
          LE Set PHY (Octet 35 - Bit 6)
          LE Enhanced Receiver Test (Octet 35 - Bit 7)
          LE Enhanced Transmitter Test (Octet 36 - Bit 0)
          LE Set Advertising Set Random Address (Octet 36 - Bit 1)
          LE Set Extended Advertising Parameters (Octet 36 - Bit 2)
          LE Set Extended Advertising Data (Octet 36 - Bit 3)
          LE Set Extended Scan Response Data (Octet 36 - Bit 4)
          LE Set Extended Advertising Enable (Octet 36 - Bit 5)
          LE Read Maximum Advertising Data Length (Octet 36 - Bit 6)
          LE Read Number of Supported Advertising Sets (Octet 36 - Bit 7)
          LE Remove Advertising Set (Octet 37 - Bit 0)
          LE Clear Advertising Sets (Octet 37 - Bit 1)
          LE Set Periodic Advertising Parameters (Octet 37 - Bit 2)
          LE Set Periodic Advertising Data (Octet 37 - Bit 3)
          LE Set Periodic Advertising Enable (Octet 37 - Bit 4)
          LE Set Extended Scan Parameters (Octet 37 - Bit 5)
          LE Set Extended Scan Enable (Octet 37 - Bit 6)
          LE Extended Create Connection (Octet 37 - Bit 7)
          LE Periodic Advertising Create Sync (Octet 38 - Bit 0)
          LE Periodic Advertising Create Sync Cancel (Octet 38 - Bit 1)
          LE Periodic Advertising Terminate Sync (Octet 38 - Bit 2)
          LE Add Device To Periodic Advertiser List (Octet 38 - Bit 3)
          LE Remove Device From Periodic Advertiser List (Octet 38 - Bit 4)
          LE Clear Periodic Advertiser List (Octet 38 - Bit 5)
          LE Read Periodic Advertiser List Size (Octet 38 - Bit 6)
          LE Read Transmit Power (Octet 38 - Bit 7)
          LE Read RF Path Compensation (Octet 39 - Bit 0)
          LE Write RF Path Compensation (Octet 39 - Bit 1)
          LE Set Privacy Mode (Octet 39 - Bit 2)
          LE Periodic Advertising Receive Enable (Octet 40 - Bit 5)
          LE Periodic Advertising Sync Transfer (Octet 40 - Bit 6)
          LE Periodic Advertising Set Info Transfer (Octet 40 - Bit 7)
          LE Periodic Advertising Sync Transfer Parameters (Octet 41 - Bit 0)
          LE Set Default Periodic Advertisng Sync Transfer Parameters (Octet 41 - Bit 1)
          LE Read Buffer v2 (Octet 41 - Bit 5)
          LE Read ISO TX Sync (Octet 41 - Bit 6)
          LE Set Connected Isochronous Group Parameters (Octet 41 - Bit 7)
          LE Set Connected Isochronous Group Parameters Test (Octet 42 - Bit 0)
          LE Create Connected Isochronous Stream (Octet 42 - Bit 1)
          LE Remove Connected Isochronous Group (Octet 42 - Bit 2)
          LE Accept Connected Isochronous Stream Request (Octet 42 - Bit 3)
          LE Reject Connected Isochronous Stream Request (Octet 42 - Bit 4)
          LE Create Broadcast Isochronous Group (Octet 42 - Bit 5)
          LE Create Broadcast Isochronous Group Test (Octet 42 - Bit 6)
          LE Terminate Broadcast Isochronous Group (Octet 42 - Bit 7)
          LE Broadcast Isochronous Group Create Sync (Octet 43 - Bit 0)
          LE Broadcast Isochronous Group Terminate Sync (Octet 43 - Bit 1)
          LE Request Peer SCA (Octet 43 - Bit 2)
          LE Setup Isochronous Data Path (Octet 43 - Bit 3)
          LE Remove Isochronous Data Path (Octet 43 - Bit 4)
          LE Isochronous Transmit Test (Octet 43 - Bit 5)
          LE Isochronous Receive Test (Octet 43 - Bit 6)
          LE Isochronous Read Test Counters (Octet 43 - Bit 7)
          LE Isochronous Read Test Counters (Octet 44 - Bit 0)
          LE Set Host Feature (Octet 44 - Bit 1)
          Octet 44 - Bit 2 
          Octet 45 - Bit 6 
          Octet 46 - Bit 0 
          Octet 46 - Bit 1 
          Octet 46 - Bit 2 
< HCI Command: Host Buffer Size (0x03|0x0033) plen 7         #9 [hci1] 0.739453
        ACL MTU: 255  ACL max packet: 16
        SCO MTU: 0    SCO max packet: 0
> HCI Event: Command Complete (0x0e) plen 4                 #10 [hci1] 0.739937
      Host Buffer Size (0x03|0x0033) ncmd 1
        Status: Success (0x00)
< HCI Command: Set Controller To Ho.. (0x03|0x0031) plen 1  #11 [hci1] 0.759492
        Flow control: ACL Data Packets (0x01)
> HCI Event: Command Complete (0x0e) plen 4                 #12 [hci1] 0.759984
      Set Controller To Host Flow Control (0x03|0x0031) ncmd 1
        Status: Success (0x00)
< HCI Command: LE Read Local Suppor.. (0x08|0x0003) plen 0  #13 [hci1] 0.779440
> HCI Event: Command Complete (0x0e) plen 12                #14 [hci1] 0.779936
      LE Read Local Supported Features (0x08|0x0003) ncmd 1
        Status: Success (0x00)
        Features: 0xfd 0x79 0x00 0xf7 0x30 0x01 0x00 0x00
          LE Encryption
          Extended Reject Indication
          Peripheral-initiated Features Exchange
          LE Ping
          LE Data Packet Length Extension
          LL Privacy
          Extended Scanner Filter Policies
          LE 2M PHY
          LE Coded PHY
          LE Extended Advertising
          LE Periodic Advertising
          Channel Selection Algorithm #2
          Periodic Advertising Sync Transfer - Sender
          Periodic Advertising Sync Transfer - Recipient
          Sleep Clock Accuracy Updates
          Connected Isochronous Stream - Central
          Connected Isochronous Stream - Peripheral
          Isochronous Broadcaster
          Synchronized Receiver
          Periodic Advertising ADI support
          Connection Subrating
          Unknown features (0x0000010000000000)
< HCI Command: LE Set Host Feature (0x08|0x0074) plen 2     #15 [hci1] 0.799480
        Bit Number: 32
          Connected Isochronous Stream (Host Support)
        Bit Value: 1
> HCI Event: Command Complete (0x0e) plen 4                 #16 [hci1] 0.799898
      LE Set Host Feature (0x08|0x0074) ncmd 1
        Status: Success (0x00)
< HCI Command: LE Read Buffer v2 (0x08|0x0060) plen 0       #17 [hci1] 0.819453
> HCI Event: Command Complete (0x0e) plen 10                #18 [hci1] 0.819883
      LE Read Buffer v2 (0x08|0x0060) ncmd 1
        Status: Success (0x00)
        ACL MTU: 27
        ACL max packet: 3
        ISO MTU: 318
        ISO max packet: 3
< HCI Command: LE Read Maximum Adve.. (0x08|0x003a) plen 0  #19 [hci1] 0.839507
> HCI Event: Command Complete (0x0e) plen 6                 #20 [hci1] 0.839903
      LE Read Maximum Advertising Data Length (0x08|0x003a) ncmd 1
        Status: Success (0x00)
        Max length: 1650
< HCI Command: LE Read Supported St.. (0x08|0x001c) plen 0  #21 [hci1] 0.859449
> HCI Event: Command Complete (0x0e) plen 12                #22 [hci1] 0.859949
      LE Read Supported States (0x08|0x001c) ncmd 1
        Status: Success (0x00)
        States: 0x000003ff3e0306ff
          Non-connectable Advertising State
          Scannable Advertising State
          Connectable Advertising State
          High Duty Cycle Directed Advertising State
          Passive Scanning State
          Active Scanning State
          Initiating State
            and Connection State (Central Role)
          Connection State (Peripheral Role)
          Scannable Advertising State
            and Passive Scanning State
          Connectable Advertising State
            and Passive Scanning State
          Non-connectable Advertising State
            and Initiating State
          Scannable Advertising State
            and Initiating State
          Active Scanning State
            and Connection State (Central Role)
          Passive Scanning State
            and Connection State (Peripheral Role)
          Active Scanning State
            and Connection State (Peripheral Role)
          Initiating State
            and Connection State (Central Role)
            and Central Role & Central Role
          Low Duty Cycle Directed Advertising State
          Connectable Advertising State
            and Initiating State
            and Central Role & Peripheral Role
          High Duty Cycle Directed Advertising State
            and Initiating State
            and Central Role & Peripheral Role
          Low Duty Cycle Directed Advertising State
            and Initiating State
            and Central Role & Peripheral Role
          Connectable Advertising State
            and Connection State (Central Role)
            and Central Role & Peripheral Role
          High Duty Cycle Directed Advertising State
            and Connection State (Central Role)
            and Central Role & Peripheral Role
          Low Duty Cycle Directed Advertising State
            and Connection State (Central Role)
            and Central Role & Peripheral Role
          Connectable Advertising State
            and Connection State (Peripheral Role)
            and Central Role & Peripheral Role
          High Duty Cycle Directed Advertising State
            and Connection State (Peripheral Role)
            and Peripheral Role & Peripheral Role
          Low Duty Cycle Directed Advertising State
            and Connection State (Peripheral Role)
            and Peripheral Role & Peripheral Role
          Initiating State
            and Connection State (Peripheral Role)
            and Central Role & Peripheral Role
< HCI Command: LE Read Maximum Data.. (0x08|0x002f) plen 0  #23 [hci1] 0.879492
> HCI Event: Command Complete (0x0e) plen 12                #24 [hci1] 0.879938
      LE Read Maximum Data Length (0x08|0x002f) ncmd 1
        Status: Success (0x00)
        Max TX octets: 251
        Max TX time: 2704
        Max RX octets: 251
        Max RX time: 2704
< HCI Command: LE Write Suggested D.. (0x08|0x0024) plen 4  #25 [hci1] 0.899448
        TX octets: 251
        TX time: 2704
> HCI Event: Command Complete (0x0e) plen 4                 #26 [hci1] 0.899888
      LE Write Suggested Default Data Length (0x08|0x0024) ncmd 1
        Status: Success (0x00)
< HCI Command: LE Read Resolving Li.. (0x08|0x002a) plen 0  #27 [hci1] 0.919509
> HCI Event: Command Complete (0x0e) plen 5                 #28 [hci1] 0.920005
      LE Read Resolving List Size (0x08|0x002a) ncmd 1
        Status: Success (0x00)
        Size: 8
< HCI Command: LE Set Event Mask (0x08|0x0001) plen 8       #29 [hci1] 0.939481
        Mask: 0x000002023f87fa5e
          LE Advertising Report
          LE Connection Update Complete
          LE Read Remote Used Features Complete
          LE Long Term Key Request
          LE Data Length Change
          LE Enhanced Connection Complete
          LE PHY Update Complete
          LE Extended Advertising Report
          LE Periodic Advertising Sync Established
          LE Periodic Advertising Report
          LE Periodic Advertising Sync Lost
          LE Extended Scan Timeout
          LE Extended Advertising Set Terminated
          LE Scan Request Received
          LE Periodic Advertising Sync Transfer Rvc
          LE CIS Established
          LE CIS Request
          LE Create BIG Complete
          LE Terminate BIG Complete
          LE BIG Sync Estabilished Complete
          LE BIG Sync Lost
          LE BIG Info Advertising Report
          Unknown mask (0x0000020000000000)
> HCI Event: Command Complete (0x0e) plen 4                 #30 [hci1] 0.940011
      LE Set Event Mask (0x08|0x0001) ncmd 1
        Status: Success (0x00)
< HCI Command: Set Event Mask (0x03|0x0001) plen 8          #31 [hci1] 0.959464
        Mask: 0x2000800002008890
          Disconnection Complete
          Encryption Change
          Read Remote Version Information Complete
          Hardware Error
          Data Buffer Overflow
          Encryption Key Refresh Complete
          LE Meta
> HCI Event: Command Complete (0x0e) plen 4                 #32 [hci1] 0.960012
      Set Event Mask (0x03|0x0001) ncmd 1
        Status: Success (0x00)
< HCI Command: Read BD ADDR (0x04|0x0009) plen 0            #33 [hci1] 0.979458
> HCI Event: Command Complete (0x0e) plen 10                #34 [hci1] 0.979900
      Read BD ADDR (0x04|0x0009) ncmd 1
        Status: Success (0x00)
        Address: 00:00:00:00:00:00 (OUI 00-00-00)
< HCI Command: LE Set Random Address (0x08|0x0005) plen 6   #35 [hci1] 0.999498
        Address: D5:B6:CC:31:DB:3B (Static)
> HCI Event: Command Complete (0x0e) plen 4                 #36 [hci1] 0.999963
      LE Set Random Address (0x08|0x0005) ncmd 1
        Status: Success (0x00)
< HCI Command: LE Set Extended Adv.. (0x08|0x0036) plen 25  #37 [hci1] 3.349531
        Handle: 0x00
        Properties: 0x0013
          Connectable
          Scannable
          Use legacy advertising PDUs: ADV_IND
        Min advertising interval: 100.000 msec (0x00a0)
        Max advertising interval: 150.000 msec (0x00f0)
        Channel map: 37, 38, 39 (0x07)
        Own address type: Random (0x01)
        Peer address type: Public (0x00)
        Peer address: 00:00:00:00:00:00 (OUI 00-00-00)
        Filter policy: Allow Scan Request from Any, Allow Connect Request from Any (0x00)
        TX power: Host has no preference (0x7f)
        Primary PHY: LE 1M (0x01)
        Secondary max skip: 0x00
        Secondary PHY: LE 1M (0x01)
        SID: 0x00
        Scan request notifications: Disabled (0x00)
> HCI Event: Command Complete (0x0e) plen 5                 #38 [hci1] 3.350364
      LE Set Extended Advertising Parameters (0x08|0x0036) ncmd 1
        Status: Success (0x00)
        TX power (selected): 0 dbm (0x00)
< HCI Command: LE Set Advertising S.. (0x08|0x0035) plen 7  #39 [hci1] 3.359502
        Advertising handle: 0x00
        Advertising random address: D5:B6:CC:31:DB:3B (Static)
> HCI Event: Command Complete (0x0e) plen 4                 #40 [hci1] 3.359999
      LE Set Advertising Set Random Address (0x08|0x0035) ncmd 1
        Status: Success (0x00)
< HCI Command: LE Set Extended Adv.. (0x08|0x0037) plen 22  #41 [hci1] 3.379487
        Handle: 0x00
        Operation: Complete extended advertising data (0x03)
        Fragment preference: Minimize fragmentation (0x01)
        Data length: 0x12
        Flags: 0x06
          LE General Discoverable Mode
          BR/EDR Not Supported
        Name (complete): Tester_F6B11A
> HCI Event: Command Complete (0x0e) plen 4                 #42 [hci1] 3.380224
      LE Set Extended Advertising Data (0x08|0x0037) ncmd 1
        Status: Success (0x00)
< HCI Command: LE Set Extended Scan.. (0x08|0x0038) plen 4  #43 [hci1] 3.399448
        Handle: 0x00
        Operation: Complete scan response data (0x03)
        Fragment preference: Minimize fragmentation (0x01)
        Data length: 0x00
> HCI Event: Command Complete (0x0e) plen 4                 #44 [hci1] 3.399909
      LE Set Extended Scan Response Data (0x08|0x0038) ncmd 1
        Status: Success (0x00)
< HCI Command: LE Set Extended Adve.. (0x08|0x0039) plen 6  #45 [hci1] 3.419536
        Extended advertising: Enabled (0x01)
        Number of sets: 1 (0x01)
        Entry 0
          Handle: 0x00
          Duration: 0 ms (0x00)
          Max ext adv events: 0
> HCI Event: Command Complete (0x0e) plen 4                 #46 [hci1] 3.420182
      LE Set Extended Advertising Enable (0x08|0x0039) ncmd 1
        Status: Success (0x00)
> HCI Event: LE Meta Event (0x3e) plen 31                   #47 [hci1] 4.259488
      LE Enhanced Connection Complete (0x0a)
        Status: Success (0x00)
        Handle: 111
        Role: Peripheral (0x01)
        Peer address type: Public (0x00)
        Peer address: DF:A9:FF:F6:B1:1A (OUI DF-A9-FF)
        Local resolvable private address: 00:00:00:00:00:00 (Non-Resolvable)
        Peer resolvable private address: 00:00:00:00:00:00 (Non-Resolvable)
        Connection interval: 87.50 msec (0x0046)
        Connection latency: 0 (0x0000)
        Supervision timeout: 25120 msec (0x09d0)
        Central clock accuracy: 0x01
> HCI Event: LE Meta Event (0x3e) plen 6                    #48 [hci1] 4.259634
      LE Advertising Set Terminated (0x12)
        Status: Success (0x00)
        Handle: 0
        Connection handle: 111
        Number of completed extended advertising events: 0
< HCI Command: LE Read Remote Used... (0x08|0x0016) plen 2  #49 [hci1] 4.280413
        Handle: 111 Address: DF:A9:FF:F6:B1:1A (OUI DF-A9-FF)
< ACL Data TX: Handle 111 flags 0x00 dlen 7                 #50 [hci1] 4.280439
      ATT: Exchange MTU Request (0x02) len 2
        Client RX MTU: 251
> HCI Event: Command Status (0x0f) plen 4                   #51 [hci1] 4.281003
      LE Read Remote Used Features (0x08|0x0016) ncmd 1
        Status: Success (0x00)
> HCI Event: Number of Completed Packets (0x13) plen 5      #52 [hci1] 4.435514
        Num handles: 1
        Handle: 111 Address: DF:A9:FF:F6:B1:1A (OUI DF-A9-FF)
        Count: 1
        #50: len 7 (0 Kb/s)
        Latency: 155 msec (155-155 msec ~155 msec)
> HCI Event: LE Meta Event (0x3e) plen 12                   #53 [hci1] 4.523508
      LE Read Remote Used Features (0x04)
        Status: Success (0x00)
        Handle: 111 Address: DF:A9:FF:F6:B1:1A (OUI DF-A9-FF)
        Features: 0x2d 0x49 0x00 0xf7 0x67 0xd8 0x00 0x00
          LE Encryption
          Extended Reject Indication
          Peripheral-initiated Features Exchange
          LE Data Packet Length Extension
          LE 2M PHY
          LE Coded PHY
          Channel Selection Algorithm #2
          Periodic Advertising Sync Transfer - Sender
          Periodic Advertising Sync Transfer - Recipient
          Sleep Clock Accuracy Updates
          Connected Isochronous Stream - Central
          Connected Isochronous Stream - Peripheral
          Isochronous Broadcaster
          Synchronized Receiver
          Connected Isochronous Stream (Host Support)
          LE Power Control Request
          LE Power Control Request
          Connection Subrating
          Connection Subrating (Host Support)
          Unknown features (0x0000d80000000000)
> ACL Data RX: Handle 111 flags 0x02 dlen 11                #54 [hci1] 6.973071
      SMP: Pairing Request (0x01) len 6
        IO capability: KeyboardDisplay (0x04)
        OOB data: Authentication data not present (0x00)
        Authentication requirement: Bonding, MITM, SC, No Keypresses (0x0d)
        Max encryption key size: 16
        Initiator key distribution: EncKey IdKey (0x03)
        Responder key distribution: EncKey IdKey Sign (0x07)
> ACL Data RX: Handle 111 flags 0x02 dlen 7                 #55 [hci1] 6.973517
      ATT: Exchange MTU Response (0x03) len 2
        Server RX MTU: 23
< HCI Command: Host Number of Compl.. (0x03|0x0035) plen 5  #56 [hci1] 6.980032
        Num handles: 1
        Handle: 111 Address: DF:A9:FF:F6:B1:1A (OUI DF-A9-FF)
        Count: 1
< ACL Data TX: Handle 111 flags 0x00 dlen 11                #57 [hci1] 6.980254
      SMP: Pairing Response (0x02) len 6
        IO capability: DisplayOnly (0x00)
        OOB data: Authentication data not present (0x00)
        Authentication requirement: Bonding, No MITM, SC, No Keypresses (0x09)
        Max encryption key size: 16
        Initiator key distribution: IdKey (0x02)
        Responder key distribution: <none> (0x00)
< HCI Command: Host Number of Compl.. (0x03|0x0035) plen 5  #58 [hci1] 6.980326
        Num handles: 1
        Handle: 111 Address: DF:A9:FF:F6:B1:1A (OUI DF-A9-FF)
        Count: 1
> HCI Event: Number of Completed Packets (0x13) plen 5      #59 [hci1] 7.148265
        Num handles: 1
        Handle: 111 Address: DF:A9:FF:F6:B1:1A (OUI DF-A9-FF)
        Count: 1
        #57: len 11 (0 Kb/s)
        Latency: 168 msec (155-168 msec ~161 msec)
> ACL Data RX: Handle 111 flags 0x02 dlen 27                #60 [hci1] 7.148393
> ACL Data RX: Handle 111 flags 0x01 dlen 27                #61 [hci1] 7.149031
> ACL Data RX: Handle 111 flags 0x01 dlen 15                #62 [hci1] 7.149466
      SMP: Pairing Public Key (0x0c) len 64
        X: 7587fbd7c482d3774e4cce1d685046e19217b89f296540c12a04c5de7c03df5c
        Y: ec3a9da7de7503c98dd0151436c129073da9928c7599cfd866c4f8ab69440e6c
< HCI Command: Host Number of Compl.. (0x03|0x0035) plen 5  #63 [hci1] 7.160382
        Num handles: 1
        Handle: 111 Address: DF:A9:FF:F6:B1:1A (OUI DF-A9-FF)
        Count: 1
< HCI Command: Host Number of Compl.. (0x03|0x0035) plen 5  #64 [hci1] 7.160587
        Num handles: 1
        Handle: 111 Address: DF:A9:FF:F6:B1:1A (OUI DF-A9-FF)
        Count: 1
< HCI Command: Host Number of Compl.. (0x03|0x0035) plen 5  #65 [hci1] 7.160910
        Num handles: 1
        Handle: 111 Address: DF:A9:FF:F6:B1:1A (OUI DF-A9-FF)
        Count: 1
< ACL Data TX: Handle 111 flags 0x00 dlen 27                #66 [hci1] 7.161111
< ACL Data TX: Handle 111 flags 0x01 dlen 27                #67 [hci1] 7.161130
< ACL Data TX: Handle 111 flags 0x01 dlen 15                #68 [hci1] 7.161133
      SMP: Pairing Public Key (0x0c) len 64
        X: 98308440221e2d910f0e54b71e7ec652857aa9b5a0dc65028824cc19db1226e9
        Y: 67a4816bcb62efb21701e31fdb27561a6217575fb007a8bbdabe7e28b6f68482
> HCI Event: Number of Completed Packets (0x13) plen 5      #69 [hci1] 7.235968
        Num handles: 1
        Handle: 111 Address: DF:A9:FF:F6:B1:1A (OUI DF-A9-FF)
        Count: 1
        #66: len 27 (2 Kb/s)
        Latency: 74 msec (74-168 msec ~118 msec)
> HCI Event: Number of Completed Packets (0x13) plen 5      #70 [hci1] 7.236734
        Num handles: 1
        Handle: 111 Address: DF:A9:FF:F6:B1:1A (OUI DF-A9-FF)
        Count: 1
        #67: len 27 (2 Kb/s)
        Latency: 75 msec (74-168 msec ~96 msec)
> HCI Event: Number of Completed Packets (0x13) plen 5      #71 [hci1] 7.322916
        Num handles: 1
        Handle: 111 Address: DF:A9:FF:F6:B1:1A (OUI DF-A9-FF)
        Count: 1
        #68: len 15 (0 Kb/s)
        Latency: 161 msec (74-168 msec ~129 msec)
> ACL Data RX: Handle 111 flags 0x02 dlen 21                #72 [hci1] 7.585674
      SMP: Pairing Confirm (0x03) len 16
        Confim value: e25782bfa21146e8de4821aee4a749f4
< HCI Command: Host Number of Compl.. (0x03|0x0035) plen 5  #73 [hci1] 7.600047
        Num handles: 1
        Handle: 111 Address: DF:A9:FF:F6:B1:1A (OUI DF-A9-FF)
        Count: 1
< ACL Data TX: Handle 111 flags 0x00 dlen 21                #74 [hci1] 7.600243
      SMP: Pairing Confirm (0x03) len 16
        Confim value: 14b9de29d1135165a5672adc160003fb
> HCI Event: Number of Completed Packets (0x13) plen 5      #75 [hci1] 7.760596
        Num handles: 1
        Handle: 111 Address: DF:A9:FF:F6:B1:1A (OUI DF-A9-FF)
        Count: 1
        #74: len 21 (1 Kb/s)
        Latency: 160 msec (74-168 msec ~144 msec)
> ACL Data RX: Handle 111 flags 0x02 dlen 21                #76 [hci1] 7.760934
      SMP: Pairing Random (0x04) len 16
        Random value: 386f9c80b61946a90000000000000000
< HCI Command: Host Number of Compl.. (0x03|0x0035) plen 5  #77 [hci1] 7.780306
        Num handles: 1
        Handle: 111 Address: DF:A9:FF:F6:B1:1A (OUI DF-A9-FF)
        Count: 1
< ACL Data TX: Handle 111 flags 0x00 dlen 21                #78 [hci1] 7.780420
      SMP: Pairing Random (0x04) len 16
        Random value: 8e6108f966a694cbe26df70bb96773e6
> HCI Event: Number of Completed Packets (0x13) plen 5      #79 [hci1] 7.935310
        Num handles: 1
        Handle: 111 Address: DF:A9:FF:F6:B1:1A (OUI DF-A9-FF)
        Count: 1
        #78: len 21 (1 Kb/s)
        Latency: 154 msec (74-168 msec ~149 msec)
> ACL Data RX: Handle 111 flags 0x02 dlen 21                #80 [hci1] 8.023159
      SMP: Pairing Confirm (0x03) len 16
        Confim value: 4c930cb713e1a02f074a17914a173930
< HCI Command: Host Number of Compl.. (0x03|0x0035) plen 5  #81 [hci1] 8.040111
        Num handles: 1
        Handle: 111 Address: DF:A9:FF:F6:B1:1A (OUI DF-A9-FF)
        Count: 1
< ACL Data TX: Handle 111 flags 0x00 dlen 21                #82 [hci1] 8.040284
      SMP: Pairing Confirm (0x03) len 16
        Confim value: a03ad898ffd837d069b7de5062adb3f8
> HCI Event: Number of Completed Packets (0x13) plen 5      #83 [hci1] 8.198026
        Num handles: 1
        Handle: 111 Address: DF:A9:FF:F6:B1:1A (OUI DF-A9-FF)
        Count: 1
        #82: len 21 (1 Kb/s)
        Latency: 157 msec (74-168 msec ~153 msec)
> ACL Data RX: Handle 111 flags 0x02 dlen 21                #84 [hci1] 8.198354
      SMP: Pairing Random (0x04) len 16
        Random value: 3d8684c967aee2060000000000000000
< HCI Command: Host Number of Compl.. (0x03|0x0035) plen 5  #85 [hci1] 8.200222
        Num handles: 1
        Handle: 111 Address: DF:A9:FF:F6:B1:1A (OUI DF-A9-FF)
        Count: 1
< ACL Data TX: Handle 111 flags 0x00 dlen 21                #86 [hci1] 8.200313
      SMP: Pairing Random (0x04) len 16
        Random value: 4d02679f89a05211af56d8b3da64d21e
> HCI Event: Number of Completed Packets (0x13) plen 5      #87 [hci1] 8.372811
        Num handles: 1
        Handle: 111 Address: DF:A9:FF:F6:B1:1A (OUI DF-A9-FF)
        Count: 1
        #86: len 21 (0 Kb/s)
        Latency: 172 msec (74-172 msec ~163 msec)
> ACL Data RX: Handle 111 flags 0x02 dlen 21                #88 [hci1] 8.460664
      SMP: Pairing Confirm (0x03) len 16
        Confim value: b6fd66a31145a9a02fcaf2308bb72409
< HCI Command: Host Number of Compl.. (0x03|0x0035) plen 5  #89 [hci1] 8.479831
        Num handles: 1
        Handle: 111 Address: DF:A9:FF:F6:B1:1A (OUI DF-A9-FF)
        Count: 1
< ACL Data TX: Handle 111 flags 0x00 dlen 21                #90 [hci1] 8.479979
      SMP: Pairing Confirm (0x03) len 16
        Confim value: feaa468c41d1c20671895764e0d9e31a
> HCI Event: Number of Completed Packets (0x13) plen 5      #91 [hci1] 8.635444
        Num handles: 1
        Handle: 111 Address: DF:A9:FF:F6:B1:1A (OUI DF-A9-FF)
        Count: 1
        #90: len 21 (1 Kb/s)
        Latency: 155 msec (74-172 msec ~159 msec)
> ACL Data RX: Handle 111 flags 0x02 dlen 21                #92 [hci1] 8.635879
      SMP: Pairing Random (0x04) len 16
        Random value: e11497ad57c545900000000000000000
< HCI Command: Host Number of Compl.. (0x03|0x0035) plen 5  #93 [hci1] 8.640218
        Num handles: 1
        Handle: 111 Address: DF:A9:FF:F6:B1:1A (OUI DF-A9-FF)
        Count: 1
< ACL Data TX: Handle 111 flags 0x00 dlen 21                #94 [hci1] 8.640338
      SMP: Pairing Random (0x04) len 16
        Random value: 5e8286bc235a02440d0c3424a2acf8fd
> HCI Event: Number of Completed Packets (0x13) plen 5      #95 [hci1] 8.810429
        Num handles: 1
        Handle: 111 Address: DF:A9:FF:F6:B1:1A (OUI DF-A9-FF)
        Count: 1
        #94: len 21 (0 Kb/s)
        Latency: 170 msec (74-172 msec ~164 msec)
> ACL Data RX: Handle 111 flags 0x02 dlen 21                #96 [hci1] 8.898184
      SMP: Pairing Confirm (0x03) len 16
        Confim value: 8f8288585d9dcee4949f1d71929690ff
< HCI Command: Host Number of Compl.. (0x03|0x0035) plen 5  #97 [hci1] 8.899956
        Num handles: 1
        Handle: 111 Address: DF:A9:FF:F6:B1:1A (OUI DF-A9-FF)
        Count: 1
< ACL Data TX: Handle 111 flags 0x00 dlen 21                #98 [hci1] 8.900100
      SMP: Pairing Confirm (0x03) len 16
        Confim value: 7b56909315a34cba3afa01c728fb6063
> HCI Event: Number of Completed Packets (0x13) plen 5      #99 [hci1] 9.072989
        Num handles: 1
        Handle: 111 Address: DF:A9:FF:F6:B1:1A (OUI DF-A9-FF)
        Count: 1
        #98: len 21 (0 Kb/s)
        Latency: 172 msec (74-172 msec ~168 msec)
> ACL Data RX: Handle 111 flags 0x02 dlen 21               #100 [hci1] 9.073379
      SMP: Pairing Random (0x04) len 16
        Random value: b6e197d0789305030000000000000000
< HCI Command: Host Number of Comp.. (0x03|0x0035) plen 5  #101 [hci1] 9.080073
        Num handles: 1
        Handle: 111 Address: DF:A9:FF:F6:B1:1A (OUI DF-A9-FF)
        Count: 1
< ACL Data TX: Handle 111 flags 0x00 dlen 21               #102 [hci1] 9.080096
      SMP: Pairing Random (0x04) len 16
        Random value: 5c4a1bcadd27bd58e945097b00bad7ac
> HCI Event: Number of Completed Packets (0x13) plen 5     #103 [hci1] 9.247803
        Num handles: 1
        Handle: 111 Address: DF:A9:FF:F6:B1:1A (OUI DF-A9-FF)
        Count: 1
        #102: len 21 (1 Kb/s)
        Latency: 167 msec (74-172 msec ~168 msec)
> ACL Data RX: Handle 111 flags 0x02 dlen 21               #104 [hci1] 9.335675
      SMP: Pairing Confirm (0x03) len 16
        Confim value: f171f171122517f6518731221a9cbc53
< HCI Command: Host Number of Comp.. (0x03|0x0035) plen 5  #105 [hci1] 9.339814
        Num handles: 1
        Handle: 111 Address: DF:A9:FF:F6:B1:1A (OUI DF-A9-FF)
        Count: 1
< ACL Data TX: Handle 111 flags 0x00 dlen 21               #106 [hci1] 9.339958
      SMP: Pairing Confirm (0x03) len 16
        Confim value: aede6b6b9b83804edc28671b62ed6034
> HCI Event: Number of Completed Packets (0x13) plen 5     #107 [hci1] 9.510581
        Num handles: 1
        Handle: 111 Address: DF:A9:FF:F6:B1:1A (OUI DF-A9-FF)
        Count: 1
        #106: len 21 (0 Kb/s)
        Latency: 170 msec (74-172 msec ~169 msec)
> ACL Data RX: Handle 111 flags 0x02 dlen 21               #108 [hci1] 9.510850
      SMP: Pairing Random (0x04) len 16
        Random value: ad3bb120fd4e2edf0000000000000000
< HCI Command: Host Number of Comp.. (0x03|0x0035) plen 5  #109 [hci1] 9.520183
        Num handles: 1
        Handle: 111 Address: DF:A9:FF:F6:B1:1A (OUI DF-A9-FF)
        Count: 1
< ACL Data TX: Handle 111 flags 0x00 dlen 21               #110 [hci1] 9.520259
      SMP: Pairing Random (0x04) len 16
        Random value: 32527e6e64e79f33b2e374394db8ab2d
> HCI Event: Number of Completed Packets (0x13) plen 5     #111 [hci1] 9.685416
        Num handles: 1
        Handle: 111 Address: DF:A9:FF:F6:B1:1A (OUI DF-A9-FF)
        Count: 1
        #110: len 21 (1 Kb/s)
        Latency: 165 msec (74-172 msec ~167 msec)
> ACL Data RX: Handle 111 flags 0x02 dlen 21               #112 [hci1] 9.773174
      SMP: Pairing Confirm (0x03) len 16
        Confim value: 050ec90e1c0dfad1f3384683ae97df0a
< HCI Command: Host Number of Comp.. (0x03|0x0035) plen 5  #113 [hci1] 9.779779
        Num handles: 1
        Handle: 111 Address: DF:A9:FF:F6:B1:1A (OUI DF-A9-FF)
        Count: 1
< ACL Data TX: Handle 111 flags 0x00 dlen 21               #114 [hci1] 9.779918
      SMP: Pairing Confirm (0x03) len 16
        Confim value: f42e2ed74d19c0a4ee9adcf85a67c524
> HCI Event: Number of Completed Packets (0x13) plen 5     #115 [hci1] 9.948033
        Num handles: 1
        Handle: 111 Address: DF:A9:FF:F6:B1:1A (OUI DF-A9-FF)
        Count: 1
        #114: len 21 (1 Kb/s)
        Latency: 168 msec (74-172 msec ~167 msec)
> ACL Data RX: Handle 111 flags 0x02 dlen 21               #116 [hci1] 9.948379
      SMP: Pairing Random (0x04) len 16
        Random value: cf7790cd3bc6c7290000000000000000
< HCI Command: Host Number of Comp.. (0x03|0x0035) plen 5  #117 [hci1] 9.960264
        Num handles: 1
        Handle: 111 Address: DF:A9:FF:F6:B1:1A (OUI DF-A9-FF)
        Count: 1
< ACL Data TX: Handle 111 flags 0x00 dlen 21               #118 [hci1] 9.960334
      SMP: Pairing Random (0x04) len 16
        Random value: dddbdfe2838e9a8cc6964353c850fef7
> HCI Event: Number of Completed Packets (0x13) plen 5    #119 [hci1] 10.122722
        Num handles: 1
        Handle: 111 Address: DF:A9:FF:F6:B1:1A (OUI DF-A9-FF)
        Count: 1
        #118: len 21 (1 Kb/s)
        Latency: 162 msec (74-172 msec ~165 msec)
> ACL Data RX: Handle 111 flags 0x02 dlen 21              #120 [hci1] 10.210657
      SMP: Pairing Confirm (0x03) len 16
        Confim value: 2a602e6a97e26543158996b9e1e98b26
< HCI Command: Host Number of Com.. (0x03|0x0035) plen 5  #121 [hci1] 10.220176
        Num handles: 1
        Handle: 111 Address: DF:A9:FF:F6:B1:1A (OUI DF-A9-FF)
        Count: 1
< ACL Data TX: Handle 111 flags 0x00 dlen 21              #122 [hci1] 10.220435
      SMP: Pairing Confirm (0x03) len 16
        Confim value: e113444cb7e2fb6736884389c7ef5010
> HCI Event: Number of Completed Packets (0x13) plen 5    #123 [hci1] 10.385441
        Num handles: 1
        Handle: 111 Address: DF:A9:FF:F6:B1:1A (OUI DF-A9-FF)
        Count: 1
        #122: len 21 (1 Kb/s)
        Latency: 165 msec (74-172 msec ~165 msec)
> ACL Data RX: Handle 111 flags 0x02 dlen 21              #124 [hci1] 10.385773
      SMP: Pairing Random (0x04) len 16
        Random value: 867c182fbeee79b60000000000000000
< HCI Command: Host Number of Com.. (0x03|0x0035) plen 5  #125 [hci1] 10.400356
        Num handles: 1
        Handle: 111 Address: DF:A9:FF:F6:B1:1A (OUI DF-A9-FF)
        Count: 1
< ACL Data TX: Handle 111 flags 0x00 dlen 21              #126 [hci1] 10.400432
      SMP: Pairing Random (0x04) len 16
        Random value: eb9f1915536596b6fc3db1c86b2b1970
> HCI Event: Number of Completed Packets (0x13) plen 5    #127 [hci1] 10.560282
        Num handles: 1
        Handle: 111 Address: DF:A9:FF:F6:B1:1A (OUI DF-A9-FF)
        Count: 1
        #126: len 21 (1 Kb/s)
        Latency: 159 msec (74-172 msec ~162 msec)
> ACL Data RX: Handle 111 flags 0x02 dlen 21              #128 [hci1] 10.648072
      SMP: Pairing Confirm (0x03) len 16
        Confim value: bd1db75ffc6abc0bb0bc5afe9b62873f
< HCI Command: Host Number of Com.. (0x03|0x0035) plen 5  #129 [hci1] 10.659996
        Num handles: 1
        Handle: 111 Address: DF:A9:FF:F6:B1:1A (OUI DF-A9-FF)
        Count: 1
< ACL Data TX: Handle 111 flags 0x00 dlen 21              #130 [hci1] 10.660161
      SMP: Pairing Confirm (0x03) len 16
        Confim value: 9dc03e50b248ecd7bae0259760b792af
> HCI Event: Number of Completed Packets (0x13) plen 5    #131 [hci1] 10.823071
        Num handles: 1
        Handle: 111 Address: DF:A9:FF:F6:B1:1A (OUI DF-A9-FF)
        Count: 1
        #130: len 21 (1 Kb/s)
        Latency: 162 msec (74-172 msec ~162 msec)
> ACL Data RX: Handle 111 flags 0x02 dlen 21              #132 [hci1] 10.823431
      SMP: Pairing Random (0x04) len 16
        Random value: 966b9a896b324b870000000000000000
< HCI Command: Host Number of Com.. (0x03|0x0035) plen 5  #133 [hci1] 10.840275
        Num handles: 1
        Handle: 111 Address: DF:A9:FF:F6:B1:1A (OUI DF-A9-FF)
        Count: 1
< ACL Data TX: Handle 111 flags 0x00 dlen 21              #134 [hci1] 10.840366
      SMP: Pairing Random (0x04) len 16
        Random value: 5c794dc9ad9f2c3f295ebd5ad5e1c3cf
> HCI Event: Number of Completed Packets (0x13) plen 5    #135 [hci1] 10.997695
        Num handles: 1
        Handle: 111 Address: DF:A9:FF:F6:B1:1A (OUI DF-A9-FF)
        Count: 1
        #134: len 21 (1 Kb/s)
        Latency: 157 msec (74-172 msec ~160 msec)
> ACL Data RX: Handle 111 flags 0x02 dlen 21              #136 [hci1] 11.085600
      SMP: Pairing Confirm (0x03) len 16
        Confim value: 10935f272936281923de1d0b2eb548f2
< HCI Command: Host Number of Com.. (0x03|0x0035) plen 5  #137 [hci1] 11.100071
        Num handles: 1
        Handle: 111 Address: DF:A9:FF:F6:B1:1A (OUI DF-A9-FF)
        Count: 1
< ACL Data TX: Handle 111 flags 0x00 dlen 21              #138 [hci1] 11.100230
      SMP: Pairing Confirm (0x03) len 16
        Confim value: c3df3b6e388e79b0cee0c8ec606def74
> HCI Event: Number of Completed Packets (0x13) plen 5    #139 [hci1] 11.260393
        Num handles: 1
        Handle: 111 Address: DF:A9:FF:F6:B1:1A (OUI DF-A9-FF)
        Count: 1
        #138: len 21 (1 Kb/s)
        Latency: 160 msec (74-172 msec ~160 msec)
> ACL Data RX: Handle 111 flags 0x02 dlen 21              #140 [hci1] 11.260776
      SMP: Pairing Random (0x04) len 16
        Random value: a5c25603a542d2400000000000000000
< HCI Command: Host Number of Com.. (0x03|0x0035) plen 5  #141 [hci1] 11.280474
        Num handles: 1
        Handle: 111 Address: DF:A9:FF:F6:B1:1A (OUI DF-A9-FF)
        Count: 1
< ACL Data TX: Handle 111 flags 0x00 dlen 21              #142 [hci1] 11.280569
      SMP: Pairing Random (0x04) len 16
        Random value: 5c2fff312cdf99c9491988e877355a9a
> HCI Event: Number of Completed Packets (0x13) plen 5    #143 [hci1] 11.435171
        Num handles: 1
        Handle: 111 Address: DF:A9:FF:F6:B1:1A (OUI DF-A9-FF)
        Count: 1
        #142: len 21 (1 Kb/s)
        Latency: 154 msec (74-172 msec ~157 msec)
> ACL Data RX: Handle 111 flags 0x02 dlen 21              #144 [hci1] 11.523041
      SMP: Pairing Confirm (0x03) len 16
        Confim value: 3b062885954a94a85646d89c2f4e7c3b
< HCI Command: Host Number of Com.. (0x03|0x0035) plen 5  #145 [hci1] 11.539895
        Num handles: 1
        Handle: 111 Address: DF:A9:FF:F6:B1:1A (OUI DF-A9-FF)
        Count: 1
< ACL Data TX: Handle 111 flags 0x00 dlen 21              #146 [hci1] 11.540042
      SMP: Pairing Confirm (0x03) len 16
        Confim value: 1e141417f6875fb43a7db6d784c571ad
> HCI Event: Number of Completed Packets (0x13) plen 5    #147 [hci1] 11.697888
        Num handles: 1
        Handle: 111 Address: DF:A9:FF:F6:B1:1A (OUI DF-A9-FF)
        Count: 1
        #146: len 21 (1 Kb/s)
        Latency: 157 msec (74-172 msec ~157 msec)
> ACL Data RX: Handle 111 flags 0x02 dlen 21              #148 [hci1] 11.698246
      SMP: Pairing Random (0x04) len 16
        Random value: 66e82af03241a64f0000000000000000
< HCI Command: Host Number of Com.. (0x03|0x0035) plen 5  #149 [hci1] 11.700219
        Num handles: 1
        Handle: 111 Address: DF:A9:FF:F6:B1:1A (OUI DF-A9-FF)
        Count: 1
< ACL Data TX: Handle 111 flags 0x00 dlen 21              #150 [hci1] 11.700307
      SMP: Pairing Random (0x04) len 16
        Random value: c629a3a987d808e808655d558dfc1155
> HCI Event: Number of Completed Packets (0x13) plen 5    #151 [hci1] 11.872676
        Num handles: 1
        Handle: 111 Address: DF:A9:FF:F6:B1:1A (OUI DF-A9-FF)
        Count: 1
        #150: len 21 (0 Kb/s)
        Latency: 172 msec (74-172 msec ~164 msec)
> ACL Data RX: Handle 111 flags 0x02 dlen 21              #152 [hci1] 11.960661
      SMP: Pairing Confirm (0x03) len 16
        Confim value: 43dcc197b91026a638efae5b1afcd937
< HCI Command: Host Number of Com.. (0x03|0x0035) plen 5  #153 [hci1] 11.979988
        Num handles: 1
        Handle: 111 Address: DF:A9:FF:F6:B1:1A (OUI DF-A9-FF)
        Count: 1
< ACL Data TX: Handle 111 flags 0x00 dlen 21              #154 [hci1] 11.980213
      SMP: Pairing Confirm (0x03) len 16
        Confim value: f4d89d96ebe2b426e428dbace9f2e159
> HCI Event: Number of Completed Packets (0x13) plen 5    #155 [hci1] 12.135411
        Num handles: 1
        Handle: 111 Address: DF:A9:FF:F6:B1:1A (OUI DF-A9-FF)
        Count: 1
        #154: len 21 (1 Kb/s)
        Latency: 155 msec (74-172 msec ~160 msec)
> ACL Data RX: Handle 111 flags 0x02 dlen 21              #156 [hci1] 12.135826
      SMP: Pairing Random (0x04) len 16
        Random value: c6e4f67d3014f90b0000000000000000
< HCI Command: Host Number of Com.. (0x03|0x0035) plen 5  #157 [hci1] 12.140230
        Num handles: 1
        Handle: 111 Address: DF:A9:FF:F6:B1:1A (OUI DF-A9-FF)
        Count: 1
< ACL Data TX: Handle 111 flags 0x00 dlen 21              #158 [hci1] 12.140336
      SMP: Pairing Random (0x04) len 16
        Random value: 92f20f6ad8f13724432c7fd6001c45ff
> HCI Event: Number of Completed Packets (0x13) plen 5    #159 [hci1] 12.310231
        Num handles: 1
        Handle: 111 Address: DF:A9:FF:F6:B1:1A (OUI DF-A9-FF)
        Count: 1
        #158: len 21 (0 Kb/s)
        Latency: 169 msec (74-172 msec ~164 msec)
> ACL Data RX: Handle 111 flags 0x02 dlen 21              #160 [hci1] 12.398082
      SMP: Pairing Confirm (0x03) len 16
        Confim value: 3fee0a05a50f7a9921e1fcaf96e80c2e
< HCI Command: Host Number of Com.. (0x03|0x0035) plen 5  #161 [hci1] 12.399856
        Num handles: 1
        Handle: 111 Address: DF:A9:FF:F6:B1:1A (OUI DF-A9-FF)
        Count: 1
< ACL Data TX: Handle 111 flags 0x00 dlen 21              #162 [hci1] 12.399982
      SMP: Pairing Confirm (0x03) len 16
        Confim value: 586eba0aa7ddb046f76c1756d623ae03
> HCI Event: Number of Completed Packets (0x13) plen 5    #163 [hci1] 12.572841
        Num handles: 1
        Handle: 111 Address: DF:A9:FF:F6:B1:1A (OUI DF-A9-FF)
        Count: 1
        #162: len 21 (0 Kb/s)
        Latency: 172 msec (74-172 msec ~168 msec)
> ACL Data RX: Handle 111 flags 0x02 dlen 21              #164 [hci1] 12.573195
      SMP: Pairing Random (0x04) len 16
        Random value: 71fa624a0dcec3dd0000000000000000
< HCI Command: Host Number of Com.. (0x03|0x0035) plen 5  #165 [hci1] 12.580306
        Num handles: 1
        Handle: 111 Address: DF:A9:FF:F6:B1:1A (OUI DF-A9-FF)
        Count: 1
< ACL Data TX: Handle 111 flags 0x00 dlen 21              #166 [hci1] 12.580507
      SMP: Pairing Random (0x04) len 16
        Random value: 23ac32ebbb5e14c8a6b9622f296d277f
> HCI Event: Number of Completed Packets (0x13) plen 5    #167 [hci1] 12.747812
        Num handles: 1
        Handle: 111 Address: DF:A9:FF:F6:B1:1A (OUI DF-A9-FF)
        Count: 1
        #166: len 21 (1 Kb/s)
        Latency: 167 msec (74-172 msec ~168 msec)
> ACL Data RX: Handle 111 flags 0x02 dlen 21              #168 [hci1] 12.835637
      SMP: Pairing Confirm (0x03) len 16
        Confim value: 50c08b582c0dfbd706464d909b9f5c6c
< HCI Command: Host Number of Com.. (0x03|0x0035) plen 5  #169 [hci1] 12.840091
        Num handles: 1
        Handle: 111 Address: DF:A9:FF:F6:B1:1A (OUI DF-A9-FF)
        Count: 1
< ACL Data TX: Handle 111 flags 0x00 dlen 21              #170 [hci1] 12.840283
      SMP: Pairing Confirm (0x03) len 16
        Confim value: 181aae6f4096901ffe432a006b33bbb1
> HCI Event: Number of Completed Packets (0x13) plen 5    #171 [hci1] 13.010473
        Num handles: 1
        Handle: 111 Address: DF:A9:FF:F6:B1:1A (OUI DF-A9-FF)
        Count: 1
        #170: len 21 (0 Kb/s)
        Latency: 170 msec (74-172 msec ~169 msec)
> ACL Data RX: Handle 111 flags 0x02 dlen 21              #172 [hci1] 13.010652
      SMP: Pairing Random (0x04) len 16
        Random value: eafb9dfe47ce81fd0000000000000000
< HCI Command: Host Number of Com.. (0x03|0x0035) plen 5  #173 [hci1] 13.020278
        Num handles: 1
        Handle: 111 Address: DF:A9:FF:F6:B1:1A (OUI DF-A9-FF)
        Count: 1
< ACL Data TX: Handle 111 flags 0x00 dlen 21              #174 [hci1] 13.020412
      SMP: Pairing Random (0x04) len 16
        Random value: 297efe85e67448a15f56bd27e3a3cf1d
> HCI Event: Number of Completed Packets (0x13) plen 5    #175 [hci1] 13.185209
        Num handles: 1
        Handle: 111 Address: DF:A9:FF:F6:B1:1A (OUI DF-A9-FF)
        Count: 1
        #174: len 21 (1 Kb/s)
        Latency: 164 msec (74-172 msec ~166 msec)
> ACL Data RX: Handle 111 flags 0x02 dlen 21              #176 [hci1] 13.273032
      SMP: Pairing Confirm (0x03) len 16
        Confim value: 34857fa411b535574fc50eb36bc14c7f
< HCI Command: Host Number of Com.. (0x03|0x0035) plen 5  #177 [hci1] 13.279932
        Num handles: 1
        Handle: 111 Address: DF:A9:FF:F6:B1:1A (OUI DF-A9-FF)
        Count: 1
< ACL Data TX: Handle 111 flags 0x00 dlen 21              #178 [hci1] 13.280093
      SMP: Pairing Confirm (0x03) len 16
        Confim value: c5a84b5193f705a8252587ea1f9481c3
> HCI Event: Number of Completed Packets (0x13) plen 5    #179 [hci1] 13.447832
        Num handles: 1
        Handle: 111 Address: DF:A9:FF:F6:B1:1A (OUI DF-A9-FF)
        Count: 1
        #178: len 21 (1 Kb/s)
        Latency: 167 msec (74-172 msec ~167 msec)
> ACL Data RX: Handle 111 flags 0x02 dlen 21              #180 [hci1] 13.448235
      SMP: Pairing Random (0x04) len 16
        Random value: c686f2ae001e83770000000000000000
< HCI Command: Host Number of Com.. (0x03|0x0035) plen 5  #181 [hci1] 13.460336
        Num handles: 1
        Handle: 111 Address: DF:A9:FF:F6:B1:1A (OUI DF-A9-FF)
        Count: 1
< ACL Data TX: Handle 111 flags 0x00 dlen 21              #182 [hci1] 13.460437
      SMP: Pairing Random (0x04) len 16
        Random value: 25a9493fd3ce4faf02be7293595bb7c6
> HCI Event: Number of Completed Packets (0x13) plen 5    #183 [hci1] 13.622647
        Num handles: 1
        Handle: 111 Address: DF:A9:FF:F6:B1:1A (OUI DF-A9-FF)
        Count: 1
        #182: len 21 (1 Kb/s)
        Latency: 162 msec (74-172 msec ~164 msec)
> ACL Data RX: Handle 111 flags 0x02 dlen 21              #184 [hci1] 13.710558
      SMP: Pairing Confirm (0x03) len 16
        Confim value: 4489aa20eac66b99b85464c93c127d1d
< HCI Command: Host Number of Com.. (0x03|0x0035) plen 5  #185 [hci1] 13.720121
        Num handles: 1
        Handle: 111 Address: DF:A9:FF:F6:B1:1A (OUI DF-A9-FF)
        Count: 1
< ACL Data TX: Handle 111 flags 0x00 dlen 21              #186 [hci1] 13.720290
      SMP: Pairing Confirm (0x03) len 16
        Confim value: b91ed2b76a2d17c5e275eac3566a1147
> HCI Event: Number of Completed Packets (0x13) plen 5    #187 [hci1] 13.885409
        Num handles: 1
        Handle: 111 Address: DF:A9:FF:F6:B1:1A (OUI DF-A9-FF)
        Count: 1
        #186: len 21 (1 Kb/s)
        Latency: 165 msec (74-172 msec ~164 msec)
> ACL Data RX: Handle 111 flags 0x02 dlen 21              #188 [hci1] 13.885661
      SMP: Pairing Random (0x04) len 16
        Random value: d7f7cef8e8fa57370000000000000000
< HCI Command: Host Number of Com.. (0x03|0x0035) plen 5  #189 [hci1] 13.899952
        Num handles: 1
        Handle: 111 Address: DF:A9:FF:F6:B1:1A (OUI DF-A9-FF)
        Count: 1
< ACL Data TX: Handle 111 flags 0x00 dlen 21              #190 [hci1] 13.900038
      SMP: Pairing Random (0x04) len 16
        Random value: 58f6b41f855a6f6c3560debd84e2affc
> HCI Event: Number of Completed Packets (0x13) plen 5    #191 [hci1] 14.060134
        Num handles: 1
        Handle: 111 Address: DF:A9:FF:F6:B1:1A (OUI DF-A9-FF)
        Count: 1
        #190: len 21 (1 Kb/s)
        Latency: 160 msec (74-172 msec ~162 msec)
> ACL Data RX: Handle 111 flags 0x02 dlen 21              #192 [hci1] 14.147989
      SMP: Pairing Confirm (0x03) len 16
        Confim value: f071b64d8a9cb36a0ec0ae1850a417d1
< HCI Command: Host Number of Com.. (0x03|0x0035) plen 5  #193 [hci1] 14.159832
        Num handles: 1
        Handle: 111 Address: DF:A9:FF:F6:B1:1A (OUI DF-A9-FF)
        Count: 1
< ACL Data TX: Handle 111 flags 0x00 dlen 21              #194 [hci1] 14.159976
      SMP: Pairing Confirm (0x03) len 16
        Confim value: 1fc350cdf879e7956a86913694414732
> HCI Event: Number of Completed Packets (0x13) plen 5    #195 [hci1] 14.322807
        Num handles: 1
        Handle: 111 Address: DF:A9:FF:F6:B1:1A (OUI DF-A9-FF)
        Count: 1
        #194: len 21 (1 Kb/s)
        Latency: 162 msec (74-172 msec ~162 msec)
> ACL Data RX: Handle 111 flags 0x02 dlen 21              #196 [hci1] 14.323158
      SMP: Pairing Random (0x04) len 16
        Random value: e102d0f3ddabeb940000000000000000
< HCI Command: Host Number of Com.. (0x03|0x0035) plen 5  #197 [hci1] 14.340385
        Num handles: 1
        Handle: 111 Address: DF:A9:FF:F6:B1:1A (OUI DF-A9-FF)
        Count: 1
< ACL Data TX: Handle 111 flags 0x00 dlen 21              #198 [hci1] 14.340553
      SMP: Pairing Random (0x04) len 16
        Random value: b67e7216d5bf664139eda2b542549666
> HCI Event: Number of Completed Packets (0x13) plen 5    #199 [hci1] 14.497733
        Num handles: 1
        Handle: 111 Address: DF:A9:FF:F6:B1:1A (OUI DF-A9-FF)
        Count: 1
        #198: len 21 (1 Kb/s)
        Latency: 157 msec (74-172 msec ~159 msec)
> ACL Data RX: Handle 111 flags 0x02 dlen 21              #200 [hci1] 14.585554
      SMP: Pairing Confirm (0x03) len 16
        Confim value: f1b2e001a57f6cc20aecb6f9553c9eb2
< HCI Command: Host Number of Com.. (0x03|0x0035) plen 5  #201 [hci1] 14.599837
        Num handles: 1
        Handle: 111 Address: DF:A9:FF:F6:B1:1A (OUI DF-A9-FF)
        Count: 1
< ACL Data TX: Handle 111 flags 0x00 dlen 21              #202 [hci1] 14.599969
      SMP: Pairing Confirm (0x03) len 16
        Confim value: 37ec5afa6112c2278478008f2cdf7262
> HCI Event: Number of Completed Packets (0x13) plen 5    #203 [hci1] 14.760450
        Num handles: 1
        Handle: 111 Address: DF:A9:FF:F6:B1:1A (OUI DF-A9-FF)
        Count: 1
        #202: len 21 (1 Kb/s)
        Latency: 160 msec (74-172 msec ~160 msec)
> ACL Data RX: Handle 111 flags 0x02 dlen 21              #204 [hci1] 14.760673
      SMP: Pairing Random (0x04) len 16
        Random value: 72467e0497ddc2520000000000000000
< HCI Command: Host Number of Com.. (0x03|0x0035) plen 5  #205 [hci1] 14.780246
        Num handles: 1
        Handle: 111 Address: DF:A9:FF:F6:B1:1A (OUI DF-A9-FF)
        Count: 1
< ACL Data TX: Handle 111 flags 0x00 dlen 21              #206 [hci1] 14.780331
      SMP: Pairing Random (0x04) len 16
        Random value: ed17f76500c95219dd01e09d1e63f87b
> HCI Event: Number of Completed Packets (0x13) plen 5    #207 [hci1] 14.935106
        Num handles: 1
        Handle: 111 Address: DF:A9:FF:F6:B1:1A (OUI DF-A9-FF)
        Count: 1
        #206: len 21 (1 Kb/s)
        Latency: 154 msec (74-172 msec ~157 msec)
> ACL Data RX: Handle 111 flags 0x02 dlen 21              #208 [hci1] 15.022984
      SMP: Pairing Confirm (0x03) len 16
        Confim value: a276a27d3d1873d499ce8ecb5c25fc93
< HCI Command: Host Number of Com.. (0x03|0x0035) plen 5  #209 [hci1] 15.040141
        Num handles: 1
        Handle: 111 Address: DF:A9:FF:F6:B1:1A (OUI DF-A9-FF)
        Count: 1
< ACL Data TX: Handle 111 flags 0x00 dlen 21              #210 [hci1] 15.040336
      SMP: Pairing Confirm (0x03) len 16
        Confim value: dba0e621f1093a13cce1b860c394398e
> HCI Event: Number of Completed Packets (0x13) plen 5    #211 [hci1] 15.197820
        Num handles: 1
        Handle: 111 Address: DF:A9:FF:F6:B1:1A (OUI DF-A9-FF)
        Count: 1
        #210: len 21 (1 Kb/s)
        Latency: 157 msec (74-172 msec ~157 msec)
> ACL Data RX: Handle 111 flags 0x02 dlen 21              #212 [hci1] 15.198122
      SMP: Pairing Random (0x04) len 16
        Random value: 9c158060e2803dcc0000000000000000
< HCI Command: Host Number of Com.. (0x03|0x0035) plen 5  #213 [hci1] 15.200003
        Num handles: 1
        Handle: 111 Address: DF:A9:FF:F6:B1:1A (OUI DF-A9-FF)
        Count: 1
< ACL Data TX: Handle 111 flags 0x00 dlen 21              #214 [hci1] 15.200119
      SMP: Pairing Random (0x04) len 16
        Random value: 81d35d47e1f6006d79c974bd9d9e1ee3
> HCI Event: Number of Completed Packets (0x13) plen 5    #215 [hci1] 15.372598
        Num handles: 1
        Handle: 111 Address: DF:A9:FF:F6:B1:1A (OUI DF-A9-FF)
        Count: 1
        #214: len 21 (0 Kb/s)
        Latency: 172 msec (74-172 msec ~164 msec)
> ACL Data RX: Handle 111 flags 0x02 dlen 21              #216 [hci1] 15.460416
      SMP: Pairing Confirm (0x03) len 16
        Confim value: cb6128b4a1e6f3229109c13ed7de8882
< HCI Command: Host Number of Com.. (0x03|0x0035) plen 5  #217 [hci1] 15.480178
        Num handles: 1
        Handle: 111 Address: DF:A9:FF:F6:B1:1A (OUI DF-A9-FF)
        Count: 1
< ACL Data TX: Handle 111 flags 0x00 dlen 21              #218 [hci1] 15.480354
      SMP: Pairing Confirm (0x03) len 16
        Confim value: 2c423cb81b54736c51d843d1ffdeb80a
> HCI Event: Number of Completed Packets (0x13) plen 5    #219 [hci1] 15.635333
        Num handles: 1
        Handle: 111 Address: DF:A9:FF:F6:B1:1A (OUI DF-A9-FF)
        Count: 1
        #218: len 21 (1 Kb/s)
        Latency: 154 msec (74-172 msec ~159 msec)
> ACL Data RX: Handle 111 flags 0x02 dlen 21              #220 [hci1] 15.635607
      SMP: Pairing Random (0x04) len 16
        Random value: fad929bb7d55c6e10000000000000000
< HCI Command: Host Number of Com.. (0x03|0x0035) plen 5  #221 [hci1] 15.640330
        Num handles: 1
        Handle: 111 Address: DF:A9:FF:F6:B1:1A (OUI DF-A9-FF)
        Count: 1
< ACL Data TX: Handle 111 flags 0x00 dlen 21              #222 [hci1] 15.640493
      SMP: Pairing Random (0x04) len 16
        Random value: e7f7e0c2476823e41736a7e381bafb7c
> HCI Event: Number of Completed Packets (0x13) plen 5    #223 [hci1] 15.810088
        Num handles: 1
        Handle: 111 Address: DF:A9:FF:F6:B1:1A (OUI DF-A9-FF)
        Count: 1
        #222: len 21 (0 Kb/s)
        Latency: 169 msec (74-172 msec ~164 msec)
> ACL Data RX: Handle 111 flags 0x02 dlen 21              #224 [hci1] 15.897907
      SMP: Pairing Confirm (0x03) len 16
        Confim value: 4d622de66b627eb6ff7e0c454b18449f
< HCI Command: Host Number of Com.. (0x03|0x0035) plen 5  #225 [hci1] 15.899816
        Num handles: 1
        Handle: 111 Address: DF:A9:FF:F6:B1:1A (OUI DF-A9-FF)
        Count: 1
< ACL Data TX: Handle 111 flags 0x00 dlen 21              #226 [hci1] 15.899976
      SMP: Pairing Confirm (0x03) len 16
        Confim value: fe505c5a1a79c324c5691dfa9de91058
> HCI Event: Number of Completed Packets (0x13) plen 5    #227 [hci1] 16.072756
        Num handles: 1
        Handle: 111 Address: DF:A9:FF:F6:B1:1A (OUI DF-A9-FF)
        Count: 1
        #226: len 21 (0 Kb/s)
        Latency: 172 msec (74-172 msec ~168 msec)
> ACL Data RX: Handle 111 flags 0x02 dlen 21              #228 [hci1] 16.073091
      SMP: Pairing Random (0x04) len 16
        Random value: 7d31bef38f8a1c4e0000000000000000
< HCI Command: Host Number of Com.. (0x03|0x0035) plen 5  #229 [hci1] 16.080362
        Num handles: 1
        Handle: 111 Address: DF:A9:FF:F6:B1:1A (OUI DF-A9-FF)
        Count: 1
