Bluetooth monitor ver 5.72
= Note: Linux version 7.0.0-31-generic (x86_64)                        0.504860
= Note: Bluetooth subsystem version 2.22                               0.504862
= New Index: 00:00:00:00:00:00 (Primary,UART,hci2)              [hci2] 0.504864
= New Index: 00:00:00:00:00:00 (Primary,UART,hci1)              [hci1] 0.504865
= New Index: 48:5F:99:8E:E0:64 (Primary,USB,hci0)               [hci0] 0.504865
= Open Index: 00:00:00:00:00:00                                 [hci1] 0.648417
= Index Info: 00:00:00:00:00:00 (Nordic Semiconductor ASA)      [hci1] 0.648421
@ USER Open: main (privileged) version 2.22            {0x0001} [hci1] 0.648425
< HCI Command: Reset (0x03|0x0003) plen 0                    #1 [hci1] 0.648788
> HCI Event: Command Complete (0x0e) plen 4                  #2 [hci1] 0.649370
      Reset (0x03|0x0003) ncmd 1
        Status: Success (0x00)
< HCI Command: Read Local Supported... (0x04|0x0003) plen 0  #3 [hci1] 0.668429
> HCI Event: Command Complete (0x0e) plen 12                 #4 [hci1] 0.668909
      Read Local Supported Features (0x04|0x0003) ncmd 1
        Status: Success (0x00)
        Features: 0x00 0x00 0x00 0x00 0x60 0x00 0x00 0x00
          BR/EDR Not Supported
          LE Supported (Controller)
< HCI Command: Read Local Version In.. (0x04|0x0001) plen 0  #5 [hci1] 0.688459
> HCI Event: Command Complete (0x0e) plen 12                 #6 [hci1] 0.688994
      Read Local Version Information (0x04|0x0001) ncmd 1
        Status: Success (0x00)
        HCI version: Reserved (0x11) - Revision 12345 (0x3039)
        LMP version: Reserved (0x11) - Subversion 12345 (0x3039)
        Manufacturer: Nordic Semiconductor ASA (89)
< HCI Command: Read Local Supported... (0x04|0x0002) plen 0  #7 [hci1] 0.708406
> HCI Event: Command Complete (0x0e) plen 68                 #8 [hci1] 0.709472
      Read Local Supported Commands (0x04|0x0002) ncmd 1
        Status: Success (0x00)
        Commands: 115 entries
          Disconnect (Octet 0 - Bit 5)
          Read Remote Version Information (Octet 2 - Bit 7)
          Set Event Mask (Octet 5 - Bit 6)
          Reset (Octet 5 - Bit 7)
          Read Connection Accept Timeout (Octet 7 - Bit 2)
          Write Connection Accept Timeout (Octet 7 - Bit 3)
          Read Transmit Power Level (Octet 10 - Bit 2)
          Set Controller To Host Flow Control (Octet 10 - Bit 5)
          Host Buffer Size (Octet 10 - Bit 6)
          Host Number of Completed Packets (Octet 10 - Bit 7)
          Read Local Version Information (Octet 14 - Bit 3)
          Read Local Supported Features (Octet 14 - Bit 5)
          Read BD ADDR (Octet 15 - Bit 1)
          Read RSSI (Octet 15 - Bit 5)
          Set Event Mask Page 2 (Octet 22 - Bit 2)
          LE Set Event Mask (Octet 25 - Bit 0)
          LE Read Buffer Size (Octet 25 - Bit 1)
          LE Read Local Supported Features (Octet 25 - Bit 2)
          LE Set Random Address (Octet 25 - Bit 4)
          LE Set Advertising Parameters (Octet 25 - Bit 5)
          LE Read Advertising Channel TX Power (Octet 25 - Bit 6)
          LE Set Advertising Data (Octet 25 - Bit 7)
          LE Set Scan Response Data (Octet 26 - Bit 0)
          LE Set Advertise Enable (Octet 26 - Bit 1)
          LE Set Scan Parameters (Octet 26 - Bit 2)
          LE Set Scan Enable (Octet 26 - Bit 3)
          LE Create Connection (Octet 26 - Bit 4)
          LE Create Connection Cancel (Octet 26 - Bit 5)
          LE Read Accept List Size (Octet 26 - Bit 6)
          LE Clear Accept List (Octet 26 - Bit 7)
          LE Add Device To Accept List (Octet 27 - Bit 0)
          LE Remove Device From Accept List (Octet 27 - Bit 1)
          LE Connection Update (Octet 27 - Bit 2)
          LE Set Host Channel Classification (Octet 27 - Bit 3)
          LE Read Channel Map (Octet 27 - Bit 4)
          LE Read Remote Used Features (Octet 27 - Bit 5)
          LE Encrypt (Octet 27 - Bit 6)
          LE Rand (Octet 27 - Bit 7)
          LE Start Encryption (Octet 28 - Bit 0)
          LE Long Term Key Request Reply (Octet 28 - Bit 1)
          LE Long Term Key Request Neg Reply (Octet 28 - Bit 2)
          LE Read Supported States (Octet 28 - Bit 3)
          Read Authenticated Payload Timeout (Octet 32 - Bit 4)
          Write Authenticated Payload Timeout (Octet 32 - Bit 5)
          LE Set Data Length (Octet 33 - Bit 6)
          LE Read Suggested Default Data Length (Octet 33 - Bit 7)
          LE Write Suggested Default Data Length (Octet 34 - Bit 0)
          LE Add Device To Resolving List (Octet 34 - Bit 3)
          LE Remove Device From Resolving List (Octet 34 - Bit 4)
          LE Clear Resolving List (Octet 34 - Bit 5)
          LE Read Resolving List Size (Octet 34 - Bit 6)
          LE Set Address Resolution Enable (Octet 35 - Bit 1)
          LE Set Resolvable Private Address Timeout (Octet 35 - Bit 2)
          LE Read Maximum Data Length (Octet 35 - Bit 3)
          LE Read PHY (Octet 35 - Bit 4)
          LE Set Default PHY (Octet 35 - Bit 5)
          LE Set PHY (Octet 35 - Bit 6)
          LE Set Advertising Set Random Address (Octet 36 - Bit 1)
          LE Set Extended Advertising Parameters (Octet 36 - Bit 2)
          LE Set Extended Advertising Data (Octet 36 - Bit 3)
          LE Set Extended Scan Response Data (Octet 36 - Bit 4)
          LE Set Extended Advertising Enable (Octet 36 - Bit 5)
          LE Read Maximum Advertising Data Length (Octet 36 - Bit 6)
          LE Read Number of Supported Advertising Sets (Octet 36 - Bit 7)
          LE Remove Advertising Set (Octet 37 - Bit 0)
          LE Clear Advertising Sets (Octet 37 - Bit 1)
          LE Set Periodic Advertising Parameters (Octet 37 - Bit 2)
          LE Set Periodic Advertising Data (Octet 37 - Bit 3)
          LE Set Periodic Advertising Enable (Octet 37 - Bit 4)
          LE Set Extended Scan Parameters (Octet 37 - Bit 5)
          LE Set Extended Scan Enable (Octet 37 - Bit 6)
          LE Extended Create Connection (Octet 37 - Bit 7)
          LE Periodic Advertising Create Sync (Octet 38 - Bit 0)
          LE Periodic Advertising Create Sync Cancel (Octet 38 - Bit 1)
          LE Periodic Advertising Terminate Sync (Octet 38 - Bit 2)
          LE Add Device To Periodic Advertiser List (Octet 38 - Bit 3)
          LE Remove Device From Periodic Advertiser List (Octet 38 - Bit 4)
          LE Clear Periodic Advertiser List (Octet 38 - Bit 5)
          LE Read Periodic Advertiser List Size (Octet 38 - Bit 6)
          LE Read Transmit Power (Octet 38 - Bit 7)
          LE Read RF Path Compensation (Octet 39 - Bit 0)
          LE Write RF Path Compensation (Octet 39 - Bit 1)
          LE Set Privacy Mode (Octet 39 - Bit 2)
          LE Periodic Advertising Receive Enable (Octet 40 - Bit 5)
          LE Periodic Advertising Sync Transfer (Octet 40 - Bit 6)
          LE Periodic Advertising Set Info Transfer (Octet 40 - Bit 7)
          LE Periodic Advertising Sync Transfer Parameters (Octet 41 - Bit 0)
          LE Set Default Periodic Advertisng Sync Transfer Parameters (Octet 41 - Bit 1)
          LE Read Buffer v2 (Octet 41 - Bit 5)
          LE Read ISO TX Sync (Octet 41 - Bit 6)
          LE Set Connected Isochronous Group Parameters (Octet 41 - Bit 7)
          LE Set Connected Isochronous Group Parameters Test (Octet 42 - Bit 0)
          LE Create Connected Isochronous Stream (Octet 42 - Bit 1)
          LE Remove Connected Isochronous Group (Octet 42 - Bit 2)
          LE Accept Connected Isochronous Stream Request (Octet 42 - Bit 3)
          LE Reject Connected Isochronous Stream Request (Octet 42 - Bit 4)
          LE Create Broadcast Isochronous Group (Octet 42 - Bit 5)
          LE Create Broadcast Isochronous Group Test (Octet 42 - Bit 6)
          LE Terminate Broadcast Isochronous Group (Octet 42 - Bit 7)
          LE Broadcast Isochronous Group Create Sync (Octet 43 - Bit 0)
          LE Broadcast Isochronous Group Terminate Sync (Octet 43 - Bit 1)
          LE Request Peer SCA (Octet 43 - Bit 2)
          LE Setup Isochronous Data Path (Octet 43 - Bit 3)
          LE Remove Isochronous Data Path (Octet 43 - Bit 4)
          LE Isochronous Transmit Test (Octet 43 - Bit 5)
          LE Isochronous Receive Test (Octet 43 - Bit 6)
          LE Isochronous Read Test Counters (Octet 43 - Bit 7)
          LE Isochronous Read Test Counters (Octet 44 - Bit 0)
          LE Set Host Feature (Octet 44 - Bit 1)
          Octet 44 - Bit 2 
          Octet 45 - Bit 6 
          Octet 46 - Bit 0 
          Octet 46 - Bit 1 
          Octet 46 - Bit 2 
          Octet 47 - Bit 4 
< HCI Command: Host Buffer Size (0x03|0x0033) plen 7         #9 [hci1] 0.728440
        ACL MTU: 255  ACL max packet: 16
        SCO MTU: 0    SCO max packet: 0
> HCI Event: Command Complete (0x0e) plen 4                 #10 [hci1] 0.728988
      Host Buffer Size (0x03|0x0033) ncmd 1
        Status: Success (0x00)
< HCI Command: Set Controller To Ho.. (0x03|0x0031) plen 1  #11 [hci1] 0.748389
        Flow control: ACL Data Packets (0x01)
> HCI Event: Command Complete (0x0e) plen 4                 #12 [hci1] 0.748758
      Set Controller To Host Flow Control (0x03|0x0031) ncmd 1
        Status: Success (0x00)
< HCI Command: LE Read Local Suppor.. (0x08|0x0003) plen 0  #13 [hci1] 0.768381
> HCI Event: Command Complete (0x0e) plen 12                #14 [hci1] 0.768924
      LE Read Local Supported Features (0x08|0x0003) ncmd 1
        Status: Success (0x00)
        Features: 0xfd 0x79 0x00 0xf7 0x30 0x01 0x00 0x00
          LE Encryption
          Extended Reject Indication
          Peripheral-initiated Features Exchange
          LE Ping
          LE Data Packet Length Extension
          LL Privacy
          Extended Scanner Filter Policies
          LE 2M PHY
          LE Coded PHY
          LE Extended Advertising
          LE Periodic Advertising
          Channel Selection Algorithm #2
          Periodic Advertising Sync Transfer - Sender
          Periodic Advertising Sync Transfer - Recipient
          Sleep Clock Accuracy Updates
          Connected Isochronous Stream - Central
          Connected Isochronous Stream - Peripheral
          Isochronous Broadcaster
          Synchronized Receiver
          Periodic Advertising ADI support
          Connection Subrating
          Unknown features (0x0000010000000000)
< HCI Command: LE Set Host Feature (0x08|0x0074) plen 2     #15 [hci1] 0.788397
        Bit Number: 32
          Connected Isochronous Stream (Host Support)
        Bit Value: 1
> HCI Event: Command Complete (0x0e) plen 4                 #16 [hci1] 0.788861
      LE Set Host Feature (0x08|0x0074) ncmd 1
        Status: Success (0x00)
< HCI Command: LE Read Buffer v2 (0x08|0x0060) plen 0       #17 [hci1] 0.808376
> HCI Event: Command Complete (0x0e) plen 10                #18 [hci1] 0.808901
      LE Read Buffer v2 (0x08|0x0060) ncmd 1
        Status: Success (0x00)
        ACL MTU: 27
        ACL max packet: 3
        ISO MTU: 318
        ISO max packet: 3
< HCI Command: LE Read Maximum Adve.. (0x08|0x003a) plen 0  #19 [hci1] 0.828501
> HCI Event: Command Complete (0x0e) plen 6                 #20 [hci1] 0.828981
      LE Read Maximum Advertising Data Length (0x08|0x003a) ncmd 1
        Status: Success (0x00)
        Max length: 1650
< HCI Command: LE Read Supported St.. (0x08|0x001c) plen 0  #21 [hci1] 0.848464
> HCI Event: Command Complete (0x0e) plen 12                #22 [hci1] 0.849050
      LE Read Supported States (0x08|0x001c) ncmd 1
        Status: Success (0x00)
        States: 0x000003ff3e0306ff
          Non-connectable Advertising State
          Scannable Advertising State
          Connectable Advertising State
          High Duty Cycle Directed Advertising State
          Passive Scanning State
          Active Scanning State
          Initiating State
            and Connection State (Central Role)
          Connection State (Peripheral Role)
          Scannable Advertising State
            and Passive Scanning State
          Connectable Advertising State
            and Passive Scanning State
          Non-connectable Advertising State
            and Initiating State
          Scannable Advertising State
            and Initiating State
          Active Scanning State
            and Connection State (Central Role)
          Passive Scanning State
            and Connection State (Peripheral Role)
          Active Scanning State
            and Connection State (Peripheral Role)
          Initiating State
            and Connection State (Central Role)
            and Central Role & Central Role
          Low Duty Cycle Directed Advertising State
          Connectable Advertising State
            and Initiating State
            and Central Role & Peripheral Role
          High Duty Cycle Directed Advertising State
            and Initiating State
            and Central Role & Peripheral Role
          Low Duty Cycle Directed Advertising State
            and Initiating State
            and Central Role & Peripheral Role
          Connectable Advertising State
            and Connection State (Central Role)
            and Central Role & Peripheral Role
          High Duty Cycle Directed Advertising State
            and Connection State (Central Role)
            and Central Role & Peripheral Role
          Low Duty Cycle Directed Advertising State
            and Connection State (Central Role)
            and Central Role & Peripheral Role
          Connectable Advertising State
            and Connection State (Peripheral Role)
            and Central Role & Peripheral Role
          High Duty Cycle Directed Advertising State
            and Connection State (Peripheral Role)
            and Peripheral Role & Peripheral Role
          Low Duty Cycle Directed Advertising State
            and Connection State (Peripheral Role)
            and Peripheral Role & Peripheral Role
          Initiating State
            and Connection State (Peripheral Role)
            and Central Role & Peripheral Role
< HCI Command: LE Read Maximum Data.. (0x08|0x002f) plen 0  #23 [hci1] 0.868468
> HCI Event: Command Complete (0x0e) plen 12                #24 [hci1] 0.868953
      LE Read Maximum Data Length (0x08|0x002f) ncmd 1
        Status: Success (0x00)
        Max TX octets: 251
        Max TX time: 2704
        Max RX octets: 251
        Max RX time: 2704
< HCI Command: LE Write Suggested D.. (0x08|0x0024) plen 4  #25 [hci1] 0.888460
        TX octets: 251
        TX time: 2704
> HCI Event: Command Complete (0x0e) plen 4                 #26 [hci1] 0.888874
      LE Write Suggested Default Data Length (0x08|0x0024) ncmd 1
        Status: Success (0x00)
< HCI Command: LE Read Resolving Li.. (0x08|0x002a) plen 0  #27 [hci1] 0.908353
> HCI Event: Command Complete (0x0e) plen 5                 #28 [hci1] 0.908786
      LE Read Resolving List Size (0x08|0x002a) ncmd 1
        Status: Success (0x00)
        Size: 8
< HCI Command: LE Set Host Feature (0x08|0x0074) plen 2     #29 [hci1] 0.928364
        Bit Number: 38
          Connection Subrating (Host Support)
        Bit Value: 1
> HCI Event: Command Complete (0x0e) plen 4                 #30 [hci1] 0.928864
      LE Set Host Feature (0x08|0x0074) ncmd 1
        Status: Success (0x00)
< HCI Command: LE Set Event Mask (0x08|0x0001) plen 8       #31 [hci1] 0.948399
        Mask: 0x000002063f87fa5e
          LE Advertising Report
          LE Connection Update Complete
          LE Read Remote Used Features Complete
          LE Long Term Key Request
          LE Data Length Change
          LE Enhanced Connection Complete
          LE PHY Update Complete
          LE Extended Advertising Report
          LE Periodic Advertising Sync Established
          LE Periodic Advertising Report
          LE Periodic Advertising Sync Lost
          LE Extended Scan Timeout
          LE Extended Advertising Set Terminated
          LE Scan Request Received
          LE Periodic Advertising Sync Transfer Rvc
          LE CIS Established
          LE CIS Request
          LE Create BIG Complete
          LE Terminate BIG Complete
          LE BIG Sync Estabilished Complete
          LE BIG Sync Lost
          LE BIG Info Advertising Report
          LE Subrate Change
          Unknown mask (0x0000020000000000)
> HCI Event: Command Complete (0x0e) plen 4                 #32 [hci1] 0.948988
      LE Set Event Mask (0x08|0x0001) ncmd 1
        Status: Success (0x00)
< HCI Command: Set Event Mask (0x03|0x0001) plen 8          #33 [hci1] 0.968390
        Mask: 0x2000800002008890
          Disconnection Complete
          Encryption Change
          Read Remote Version Information Complete
          Hardware Error
          Data Buffer Overflow
          Encryption Key Refresh Complete
          LE Meta
> HCI Event: Command Complete (0x0e) plen 4                 #34 [hci1] 0.968903
      Set Event Mask (0x03|0x0001) ncmd 1
        Status: Success (0x00)
< HCI Command: Read BD ADDR (0x04|0x0009) plen 0            #35 [hci1] 0.988470
> HCI Event: Command Complete (0x0e) plen 10                #36 [hci1] 0.988966
      Read BD ADDR (0x04|0x0009) ncmd 1
        Status: Success (0x00)
        Address: 00:00:00:00:00:00 (OUI 00-00-00)
< HCI Command: LE Set Random Address (0x08|0x0005) plen 6   #37 [hci1] 1.008471
        Address: D5:B6:CC:31:DB:3B (Static)
> HCI Event: Command Complete (0x0e) plen 4                 #38 [hci1] 1.009050
      LE Set Random Address (0x08|0x0005) ncmd 1
        Status: Success (0x00)
< HCI Command: LE Extended Create... (0x08|0x0043) plen 26  #39 [hci1] 3.168521
        Filter policy: Accept list is not used (0x00)
        Own address type: Random (0x01)
        Peer address type: Public (0x00)
        Peer address: DF:A9:FF:F6:B1:1A (OUI DF-A9-FF)
        Initiating PHYs: 0x01
        Entry 0: LE 1M
          Scan interval: 60.000 msec (0x0060)
          Scan window: 60.000 msec (0x0060)
          Min connection interval: 30.00 msec (0x0018)
          Max connection interval: 50.00 msec (0x0028)
          Connection latency: 0 (0x0000)
          Supervision timeout: 4000 msec (0x0190)
          Min connection length: 0.000 msec (0x0000)
          Max connection length: 0.000 msec (0x0000)
> HCI Event: Command Status (0x0f) plen 4                   #40 [hci1] 3.169449
      LE Extended Create Connection (0x08|0x0043) ncmd 1
        Status: Success (0x00)
> HCI Event: LE Meta Event (0x3e) plen 31                   #41 [hci1] 3.234258
      LE Enhanced Connection Complete (0x0a)
        Status: Success (0x00)
        Handle: 2268
        Role: Central (0x00)
        Peer address type: Public (0x00)
        Peer address: DF:A9:FF:F6:B1:1A (OUI DF-A9-FF)
        Local resolvable private address: 00:00:00:00:00:00 (Non-Resolvable)
        Peer resolvable private address: 00:00:00:00:00:00 (Non-Resolvable)
        Connection interval: 50.00 msec (0x0028)
        Connection latency: 0 (0x0000)
        Supervision timeout: 4000 msec (0x0190)
        Central clock accuracy: 0x00
< HCI Command: LE Read Remote Used... (0x08|0x0016) plen 2  #42 [hci1] 3.248704
        Handle: 2268 Address: DF:A9:FF:F6:B1:1A (OUI DF-A9-FF)
> HCI Event: Command Status (0x0f) plen 4                   #43 [hci1] 3.249161
      LE Read Remote Used Features (0x08|0x0016) ncmd 1
        Status: Success (0x00)
< HCI Command: LE Set PHY (0x08|0x0032) plen 7              #44 [hci1] 3.268596
        Handle: 2268 Address: DF:A9:FF:F6:B1:1A (OUI DF-A9-FF)
        All PHYs preference: 0x00
        TX PHYs preference: 0x02
          LE 2M
        RX PHYs preference: 0x02
          LE 2M
        PHY options preference: Reserved (0x0000)
> HCI Event: Command Status (0x0f) plen 4                   #45 [hci1] 3.269126
      LE Set PHY (0x08|0x0032) ncmd 1
        Status: Success (0x00)
> HCI Event: LE Meta Event (0x3e) plen 12                   #46 [hci1] 3.385749
      LE Read Remote Used Features (0x04)
        Status: Success (0x00)
        Handle: 2268 Address: DF:A9:FF:F6:B1:1A (OUI DF-A9-FF)
        Features: 0x2d 0x49 0x00 0xf7 0x67 0xd9 0x00 0x80
          LE Encryption
          Extended Reject Indication
          Peripheral-initiated Features Exchange
          LE Data Packet Length Extension
          LE 2M PHY
          LE Coded PHY
          Channel Selection Algorithm #2
          Periodic Advertising Sync Transfer - Sender
          Periodic Advertising Sync Transfer - Recipient
          Sleep Clock Accuracy Updates
          Connected Isochronous Stream - Central
          Connected Isochronous Stream - Peripheral
          Isochronous Broadcaster
          Synchronized Receiver
          Connected Isochronous Stream (Host Support)
          LE Power Control Request
          LE Power Control Request
          Connection Subrating
          Connection Subrating (Host Support)
          Unknown features (0x8000d90000000000)
> HCI Event: LE Meta Event (0x3e) plen 6                    #47 [hci1] 3.885098
      LE PHY Update Complete (0x0c)
        Status: Success (0x00)
        Handle: 2268 Address: DF:A9:FF:F6:B1:1A (OUI DF-A9-FF)
        TX PHY: LE 2M (0x02)
        RX PHY: LE 2M (0x02)
< ACL Data TX: Handle 2268 flags 0x00 dlen 11               #48 [hci1] 4.308888
      SMP: Pairing Request (0x01) len 6
        IO capability: KeyboardDisplay (0x04)
        OOB data: Authentication data not present (0x00)
        Authentication requirement: No bonding, No MITM, SC, No Keypresses (0x08)
        Max encryption key size: 16
        Initiator key distribution: <none> (0x00)
        Responder key distribution: <none> (0x00)
> HCI Event: Number of Completed Packets (0x13) plen 5      #49 [hci1] 4.335470
        Num handles: 1
        Handle: 2268 Address: DF:A9:FF:F6:B1:1A (OUI DF-A9-FF)
        Count: 1
        #48: len 11 (3 Kb/s)
        Latency: 26 msec (26-26 msec ~26 msec)
> ACL Data RX: Handle 2268 flags 0x02 dlen 11               #50 [hci1] 4.385590
      SMP: Pairing Response (0x02) len 6
        IO capability: KeyboardOnly (0x02)
        OOB data: Authentication data not present (0x00)
        Authentication requirement: Bonding, MITM, SC, No Keypresses (0xcd)
        Max encryption key size: 16
        Initiator key distribution: <none> (0x00)
        Responder key distribution: <none> (0x00)
< HCI Command: Host Number of Compl.. (0x03|0x0035) plen 5  #51 [hci1] 4.388662
        Num handles: 1
        Handle: 2268 Address: DF:A9:FF:F6:B1:1A (OUI DF-A9-FF)
        Count: 1
< ACL Data TX: Handle 2268 flags 0x00 dlen 27               #52 [hci1] 4.388701
< ACL Data TX: Handle 2268 flags 0x01 dlen 27               #53 [hci1] 4.388713
< ACL Data TX: Handle 2268 flags 0x01 dlen 15               #54 [hci1] 4.388715
      SMP: Pairing Public Key (0x0c) len 64
        X: 98308440221e2d910f0e54b71e7ec652857aa9b5a0dc65028824cc19db1226e9
        Y: 67a4816bcb62efb21701e31fdb27561a6217575fb007a8bbdabe7e28b6f68482
> HCI Event: Number of Completed Packets (0x13) plen 5      #55 [hci1] 4.435623
        Num handles: 1
        Handle: 2268 Address: DF:A9:FF:F6:B1:1A (OUI DF-A9-FF)
        Count: 1
        #52: len 27 (4 Kb/s)
        Latency: 46 msec (26-46 msec ~36 msec)
> HCI Event: Number of Completed Packets (0x13) plen 5      #56 [hci1] 4.436173
        Num handles: 1
        Handle: 2268 Address: DF:A9:FF:F6:B1:1A (OUI DF-A9-FF)
        Count: 1
        #53: len 27 (4 Kb/s)
        Latency: 47 msec (26-47 msec ~42 msec)
> HCI Event: Number of Completed Packets (0x13) plen 5      #57 [hci1] 4.436468
        Num handles: 1
        Handle: 2268 Address: DF:A9:FF:F6:B1:1A (OUI DF-A9-FF)
        Count: 1
        #54: len 15 (2 Kb/s)
        Latency: 47 msec (26-47 msec ~44 msec)
> ACL Data RX: Handle 2268 flags 0x02 dlen 27               #58 [hci1] 4.485764
> ACL Data RX: Handle 2268 flags 0x01 dlen 27               #59 [hci1] 4.486324
> ACL Data RX: Handle 2268 flags 0x01 dlen 15               #60 [hci1] 4.486630
      SMP: Pairing Public Key (0x0c) len 64
        X: 2372225e013b635ec6b34b444b94390ae1e4c27de2656d0bb5243412b98fd68c
        Y: 6a6e2a5de1b7a305fc1c4838eaea461fb37f6385147db86c9158307c3a94b0d4
< HCI Command: Host Number of Compl.. (0x03|0x0035) plen 5  #61 [hci1] 4.488686
        Num handles: 1
        Handle: 2268 Address: DF:A9:FF:F6:B1:1A (OUI DF-A9-FF)
        Count: 1
< HCI Command: Host Number of Compl.. (0x03|0x0035) plen 5  #62 [hci1] 4.488774
        Num handles: 1
        Handle: 2268 Address: DF:A9:FF:F6:B1:1A (OUI DF-A9-FF)
        Count: 1
< HCI Command: Host Number of Compl.. (0x03|0x0035) plen 5  #63 [hci1] 4.488981
        Num handles: 1
        Handle: 2268 Address: DF:A9:FF:F6:B1:1A (OUI DF-A9-FF)
        Count: 1
< ACL Data TX: Handle 2268 flags 0x00 dlen 21               #64 [hci1] 4.489060
      SMP: Pairing Confirm (0x03) len 16
        Confim value: 46c4d6ff311c4cea77895f4623171b7a
> HCI Event: Number of Completed Packets (0x13) plen 5      #65 [hci1] 4.535530
        Num handles: 1
        Handle: 2268 Address: DF:A9:FF:F6:B1:1A (OUI DF-A9-FF)
        Count: 1
        #64: len 21 (3 Kb/s)
        Latency: 46 msec (26-47 msec ~45 msec)
> ACL Data RX: Handle 2268 flags 0x02 dlen 21               #66 [hci1] 5.385893
      SMP: Pairing Confirm (0x03) len 16
        Confim value: f2616e668dae7bd9f3eb202469efb2e9
< HCI Command: Host Number of Compl.. (0x03|0x0035) plen 5  #67 [hci1] 5.388969
        Num handles: 1
        Handle: 2268 Address: DF:A9:FF:F6:B1:1A (OUI DF-A9-FF)
        Count: 1
< ACL Data TX: Handle 2268 flags 0x00 dlen 21               #68 [hci1] 5.389141
      SMP: Pairing Random (0x04) len 16
        Random value: 8e6108f966a694cbe26df70bb96773e6
> HCI Event: Number of Completed Packets (0x13) plen 5      #69 [hci1] 5.435583
        Num handles: 1
        Handle: 2268 Address: DF:A9:FF:F6:B1:1A (OUI DF-A9-FF)
        Count: 1
        #68: len 21 (3 Kb/s)
        Latency: 46 msec (26-47 msec ~46 msec)
> ACL Data RX: Handle 2268 flags 0x02 dlen 21               #70 [hci1] 5.685696
      SMP: Pairing Random (0x04) len 16
        Random value: 62c72e2cfacbaf53706fa306942727de
< HCI Command: Host Number of Compl.. (0x03|0x0035) plen 5  #71 [hci1] 5.689299
        Num handles: 1
        Handle: 2268 Address: DF:A9:FF:F6:B1:1A (OUI DF-A9-FF)
        Count: 1
< ACL Data TX: Handle 2268 flags 0x00 dlen 21               #72 [hci1] 5.689395
      SMP: Pairing Confirm (0x03) len 16
        Confim value: 882803609980825175dc6d894409ca1c
> HCI Event: Number of Completed Packets (0x13) plen 5      #73 [hci1] 5.735540
        Num handles: 1
        Handle: 2268 Address: DF:A9:FF:F6:B1:1A (OUI DF-A9-FF)
        Count: 1
        #72: len 21 (3 Kb/s)
        Latency: 46 msec (26-47 msec ~46 msec)
> ACL Data RX: Handle 2268 flags 0x02 dlen 21               #74 [hci1] 5.785734
      SMP: Pairing Confirm (0x03) len 16
        Confim value: a1bec0891ec7be7427964f1e0f22305c
< HCI Command: Host Number of Compl.. (0x03|0x0035) plen 5  #75 [hci1] 5.789112
        Num handles: 1
        Handle: 2268 Address: DF:A9:FF:F6:B1:1A (OUI DF-A9-FF)
        Count: 1
< ACL Data TX: Handle 2268 flags 0x00 dlen 21               #76 [hci1] 5.789219
      SMP: Pairing Random (0x04) len 16
        Random value: 4d02679f89a05211af56d8b3da64d21e
> HCI Event: Number of Completed Packets (0x13) plen 5      #77 [hci1] 5.835615
        Num handles: 1
        Handle: 2268 Address: DF:A9:FF:F6:B1:1A (OUI DF-A9-FF)
        Count: 1
        #76: len 21 (3 Kb/s)
        Latency: 46 msec (26-47 msec ~46 msec)
> ACL Data RX: Handle 2268 flags 0x02 dlen 21               #78 [hci1] 6.085737
      SMP: Pairing Random (0x04) len 16
        Random value: 44459f5108c947152186c3a2ea236b30
< HCI Command: Host Number of Compl.. (0x03|0x0035) plen 5  #79 [hci1] 6.088690
        Num handles: 1
        Handle: 2268 Address: DF:A9:FF:F6:B1:1A (OUI DF-A9-FF)
        Count: 1
< ACL Data TX: Handle 2268 flags 0x00 dlen 21               #80 [hci1] 6.088720
      SMP: Pairing Confirm (0x03) len 16
        Confim value: 259a7926bdc20abc0760b4fd2b437ffa
> HCI Event: Number of Completed Packets (0x13) plen 5      #81 [hci1] 6.135471
        Num handles: 1
        Handle: 2268 Address: DF:A9:FF:F6:B1:1A (OUI DF-A9-FF)
        Count: 1
        #80: len 21 (3 Kb/s)
        Latency: 46 msec (26-47 msec ~46 msec)
> ACL Data RX: Handle 2268 flags 0x02 dlen 21               #82 [hci1] 6.185766
      SMP: Pairing Confirm (0x03) len 16
        Confim value: e1ba440cc72c465b09ae44319435a397
< HCI Command: Host Number of Compl.. (0x03|0x0035) plen 5  #83 [hci1] 6.189026
        Num handles: 1
        Handle: 2268 Address: DF:A9:FF:F6:B1:1A (OUI DF-A9-FF)
        Count: 1
< ACL Data TX: Handle 2268 flags 0x00 dlen 21               #84 [hci1] 6.189131
      SMP: Pairing Random (0x04) len 16
        Random value: 5e8286bc235a02440d0c3424a2acf8fd
> HCI Event: Number of Completed Packets (0x13) plen 5      #85 [hci1] 6.235682
        Num handles: 1
        Handle: 2268 Address: DF:A9:FF:F6:B1:1A (OUI DF-A9-FF)
        Count: 1
        #84: len 21 (3 Kb/s)
        Latency: 46 msec (26-47 msec ~46 msec)
> ACL Data RX: Handle 2268 flags 0x02 dlen 21               #86 [hci1] 6.485627
      SMP: Pairing Random (0x04) len 16
        Random value: 78f8154ca30afdfe7d2eb11c6965b387
< HCI Command: Host Number of Compl.. (0x03|0x0035) plen 5  #87 [hci1] 6.488899
        Num handles: 1
        Handle: 2268 Address: DF:A9:FF:F6:B1:1A (OUI DF-A9-FF)
        Count: 1
< ACL Data TX: Handle 2268 flags 0x00 dlen 21               #88 [hci1] 6.488998
      SMP: Pairing Confirm (0x03) len 16
        Confim value: 7cdae5c4a612e1f3c6d39305a92a3bd2
> HCI Event: Number of Completed Packets (0x13) plen 5      #89 [hci1] 6.535554
        Num handles: 1
        Handle: 2268 Address: DF:A9:FF:F6:B1:1A (OUI DF-A9-FF)
        Count: 1
        #88: len 21 (3 Kb/s)
        Latency: 46 msec (26-47 msec ~46 msec)
> ACL Data RX: Handle 2268 flags 0x02 dlen 21               #90 [hci1] 6.585717
      SMP: Pairing Confirm (0x03) len 16
        Confim value: e972dc5fecbe12c22c23943ba8f74a32
< HCI Command: Host Number of Compl.. (0x03|0x0035) plen 5  #91 [hci1] 6.588668
        Num handles: 1
        Handle: 2268 Address: DF:A9:FF:F6:B1:1A (OUI DF-A9-FF)
        Count: 1
< ACL Data TX: Handle 2268 flags 0x00 dlen 21               #92 [hci1] 6.588676
      SMP: Pairing Random (0x04) len 16
        Random value: 5c4a1bcadd27bd58e945097b00bad7ac
> HCI Event: Number of Completed Packets (0x13) plen 5      #93 [hci1] 6.635602
        Num handles: 1
        Handle: 2268 Address: DF:A9:FF:F6:B1:1A (OUI DF-A9-FF)
        Count: 1
        #92: len 21 (3 Kb/s)
        Latency: 46 msec (26-47 msec ~46 msec)
> ACL Data RX: Handle 2268 flags 0x02 dlen 21               #94 [hci1] 6.885669
      SMP: Pairing Random (0x04) len 16
        Random value: 5152e01122506949ffed69f34187ada0
< HCI Command: Host Number of Compl.. (0x03|0x0035) plen 5  #95 [hci1] 6.888964
        Num handles: 1
        Handle: 2268 Address: DF:A9:FF:F6:B1:1A (OUI DF-A9-FF)
        Count: 1
< ACL Data TX: Handle 2268 flags 0x00 dlen 21               #96 [hci1] 6.889039
      SMP: Pairing Confirm (0x03) len 16
        Confim value: eb122b6b113f99641e914adb8d01079c
> HCI Event: Number of Completed Packets (0x13) plen 5      #97 [hci1] 6.935561
        Num handles: 1
        Handle: 2268 Address: DF:A9:FF:F6:B1:1A (OUI DF-A9-FF)
        Count: 1
        #96: len 21 (3 Kb/s)
        Latency: 46 msec (26-47 msec ~46 msec)
> ACL Data RX: Handle 2268 flags 0x02 dlen 21               #98 [hci1] 6.985643
      SMP: Pairing Confirm (0x03) len 16
        Confim value: 5840f37add99fc5384fa9c47c533e423
< HCI Command: Host Number of Compl.. (0x03|0x0035) plen 5  #99 [hci1] 6.988657
        Num handles: 1
        Handle: 2268 Address: DF:A9:FF:F6:B1:1A (OUI DF-A9-FF)
        Count: 1
< ACL Data TX: Handle 2268 flags 0x00 dlen 21              #100 [hci1] 6.988694
      SMP: Pairing Random (0x04) len 16
        Random value: 32527e6e64e79f33b2e374394db8ab2d
> HCI Event: Number of Completed Packets (0x13) plen 5     #101 [hci1] 7.035536
        Num handles: 1
        Handle: 2268 Address: DF:A9:FF:F6:B1:1A (OUI DF-A9-FF)
        Count: 1
        #100: len 21 (3 Kb/s)
        Latency: 46 msec (26-47 msec ~46 msec)
> ACL Data RX: Handle 2268 flags 0x02 dlen 21              #102 [hci1] 7.285758
      SMP: Pairing Random (0x04) len 16
        Random value: d21b65411cacf9bf45891f7f7598fee5
< HCI Command: Host Number of Comp.. (0x03|0x0035) plen 5  #103 [hci1] 7.289141
        Num handles: 1
        Handle: 2268 Address: DF:A9:FF:F6:B1:1A (OUI DF-A9-FF)
        Count: 1
< ACL Data TX: Handle 2268 flags 0x00 dlen 21              #104 [hci1] 7.289253
      SMP: Pairing Confirm (0x03) len 16
        Confim value: c440db55e9690fe9d54344fa7138d95b
> HCI Event: Number of Completed Packets (0x13) plen 5     #105 [hci1] 7.335592
        Num handles: 1
        Handle: 2268 Address: DF:A9:FF:F6:B1:1A (OUI DF-A9-FF)
        Count: 1
        #104: len 21 (3 Kb/s)
        Latency: 46 msec (26-47 msec ~46 msec)
> ACL Data RX: Handle 2268 flags 0x02 dlen 21              #106 [hci1] 7.385700
      SMP: Pairing Confirm (0x03) len 16
        Confim value: 529aeb980a89ffb98ad3f2c642c8cf8c
< HCI Command: Host Number of Comp.. (0x03|0x0035) plen 5  #107 [hci1] 7.389088
        Num handles: 1
        Handle: 2268 Address: DF:A9:FF:F6:B1:1A (OUI DF-A9-FF)
        Count: 1
< ACL Data TX: Handle 2268 flags 0x00 dlen 21              #108 [hci1] 7.389230
      SMP: Pairing Random (0x04) len 16
        Random value: dddbdfe2838e9a8cc6964353c850fef7
> HCI Event: Number of Completed Packets (0x13) plen 5     #109 [hci1] 7.435475
        Num handles: 1
        Handle: 2268 Address: DF:A9:FF:F6:B1:1A (OUI DF-A9-FF)
        Count: 1
        #108: len 21 (3 Kb/s)
        Latency: 46 msec (26-47 msec ~46 msec)
> ACL Data RX: Handle 2268 flags 0x02 dlen 21              #110 [hci1] 7.685797
      SMP: Pairing Random (0x04) len 16
        Random value: b95c31fc2597c1a7608a4d22224afaf0
< HCI Command: Host Number of Comp.. (0x03|0x0035) plen 5  #111 [hci1] 7.688768
        Num handles: 1
        Handle: 2268 Address: DF:A9:FF:F6:B1:1A (OUI DF-A9-FF)
        Count: 1
< ACL Data TX: Handle 2268 flags 0x00 dlen 21              #112 [hci1] 7.688811
      SMP: Pairing Confirm (0x03) len 16
        Confim value: 4755fbefc5ba9b8ba39528a0f0fe3732
> HCI Event: Number of Completed Packets (0x13) plen 5     #113 [hci1] 7.735498
        Num handles: 1
        Handle: 2268 Address: DF:A9:FF:F6:B1:1A (OUI DF-A9-FF)
        Count: 1
        #112: len 21 (3 Kb/s)
        Latency: 46 msec (26-47 msec ~46 msec)
> ACL Data RX: Handle 2268 flags 0x02 dlen 21              #114 [hci1] 7.785653
      SMP: Pairing Confirm (0x03) len 16
        Confim value: 3278656a590fa193cc26761463d32909
< HCI Command: Host Number of Comp.. (0x03|0x0035) plen 5  #115 [hci1] 7.788975
        Num handles: 1
        Handle: 2268 Address: DF:A9:FF:F6:B1:1A (OUI DF-A9-FF)
        Count: 1
< ACL Data TX: Handle 2268 flags 0x00 dlen 21              #116 [hci1] 7.789115
      SMP: Pairing Random (0x04) len 16
        Random value: eb9f1915536596b6fc3db1c86b2b1970
> HCI Event: Number of Completed Packets (0x13) plen 5     #117 [hci1] 7.835503
        Num handles: 1
        Handle: 2268 Address: DF:A9:FF:F6:B1:1A (OUI DF-A9-FF)
        Count: 1
        #116: len 21 (3 Kb/s)
        Latency: 46 msec (26-47 msec ~46 msec)
> ACL Data RX: Handle 2268 flags 0x02 dlen 21              #118 [hci1] 8.085627
      SMP: Pairing Random (0x04) len 16
        Random value: ad5bac6b83ed1a983123492ff176036b
< HCI Command: Host Number of Comp.. (0x03|0x0035) plen 5  #119 [hci1] 8.089192
        Num handles: 1
        Handle: 2268 Address: DF:A9:FF:F6:B1:1A (OUI DF-A9-FF)
        Count: 1
< ACL Data TX: Handle 2268 flags 0x00 dlen 21              #120 [hci1] 8.089314
      SMP: Pairing Confirm (0x03) len 16
        Confim value: 89d048ab7182ffc9e66433788931bc8f
> HCI Event: Number of Completed Packets (0x13) plen 5     #121 [hci1] 8.135502
        Num handles: 1
        Handle: 2268 Address: DF:A9:FF:F6:B1:1A (OUI DF-A9-FF)
        Count: 1
        #120: len 21 (3 Kb/s)
        Latency: 46 msec (26-47 msec ~46 msec)
> ACL Data RX: Handle 2268 flags 0x02 dlen 21              #122 [hci1] 8.185643
      SMP: Pairing Confirm (0x03) len 16
        Confim value: 8865c3b556e01b0be5334975a4986149
< HCI Command: Host Number of Comp.. (0x03|0x0035) plen 5  #123 [hci1] 8.188757
        Num handles: 1
        Handle: 2268 Address: DF:A9:FF:F6:B1:1A (OUI DF-A9-FF)
        Count: 1
< ACL Data TX: Handle 2268 flags 0x00 dlen 21              #124 [hci1] 8.188891
      SMP: Pairing Random (0x04) len 16
        Random value: 5c794dc9ad9f2c3f295ebd5ad5e1c3cf
> HCI Event: Number of Completed Packets (0x13) plen 5     #125 [hci1] 8.235532
        Num handles: 1
        Handle: 2268 Address: DF:A9:FF:F6:B1:1A (OUI DF-A9-FF)
        Count: 1
        #124: len 21 (3 Kb/s)
        Latency: 46 msec (26-47 msec ~46 msec)
> ACL Data RX: Handle 2268 flags 0x02 dlen 21              #126 [hci1] 8.485731
      SMP: Pairing Random (0x04) len 16
        Random value: 3afb4b52e7410a066158e1734b334542
< HCI Command: Host Number of Comp.. (0x03|0x0035) plen 5  #127 [hci1] 8.488783
        Num handles: 1
        Handle: 2268 Address: DF:A9:FF:F6:B1:1A (OUI DF-A9-FF)
        Count: 1
< ACL Data TX: Handle 2268 flags 0x00 dlen 21              #128 [hci1] 8.488865
      SMP: Pairing Confirm (0x03) len 16
        Confim value: 81eff3690ffaecc0969c16fa83f359cf
> HCI Event: Number of Completed Packets (0x13) plen 5     #129 [hci1] 8.535505
        Num handles: 1
        Handle: 2268 Address: DF:A9:FF:F6:B1:1A (OUI DF-A9-FF)
        Count: 1
        #128: len 21 (3 Kb/s)
        Latency: 46 msec (26-47 msec ~46 msec)
> ACL Data RX: Handle 2268 flags 0x02 dlen 21              #130 [hci1] 8.585715
      SMP: Pairing Confirm (0x03) len 16
        Confim value: 22aa409abbaab6cbfc91611430226c9c
< HCI Command: Host Number of Comp.. (0x03|0x0035) plen 5  #131 [hci1] 8.588811
        Num handles: 1
        Handle: 2268 Address: DF:A9:FF:F6:B1:1A (OUI DF-A9-FF)
        Count: 1
< ACL Data TX: Handle 2268 flags 0x00 dlen 21              #132 [hci1] 8.588868
      SMP: Pairing Random (0x04) len 16
        Random value: 5c2fff312cdf99c9491988e877355a9a
> HCI Event: Number of Completed Packets (0x13) plen 5     #133 [hci1] 8.635557
        Num handles: 1
        Handle: 2268 Address: DF:A9:FF:F6:B1:1A (OUI DF-A9-FF)
        Count: 1
        #132: len 21 (3 Kb/s)
        Latency: 46 msec (26-47 msec ~46 msec)
> ACL Data RX: Handle 2268 flags 0x02 dlen 21              #134 [hci1] 8.885638
      SMP: Pairing Random (0x04) len 16
        Random value: fc61b132f99478888ccd1ebc3653e29c
< HCI Command: Host Number of Comp.. (0x03|0x0035) plen 5  #135 [hci1] 8.889186
        Num handles: 1
        Handle: 2268 Address: DF:A9:FF:F6:B1:1A (OUI DF-A9-FF)
        Count: 1
< ACL Data TX: Handle 2268 flags 0x00 dlen 21              #136 [hci1] 8.889276
      SMP: Pairing Confirm (0x03) len 16
        Confim value: 5de58a145a61c3572b15ed2c3ad96601
> HCI Event: Number of Completed Packets (0x13) plen 5     #137 [hci1] 8.935575
        Num handles: 1
        Handle: 2268 Address: DF:A9:FF:F6:B1:1A (OUI DF-A9-FF)
        Count: 1
        #136: len 21 (3 Kb/s)
        Latency: 46 msec (26-47 msec ~46 msec)
> ACL Data RX: Handle 2268 flags 0x02 dlen 21              #138 [hci1] 8.985673
      SMP: Pairing Confirm (0x03) len 16
        Confim value: 19692c9a4666b494f2fb3c0b292e2bce
< HCI Command: Host Number of Comp.. (0x03|0x0035) plen 5  #139 [hci1] 8.988698
        Num handles: 1
        Handle: 2268 Address: DF:A9:FF:F6:B1:1A (OUI DF-A9-FF)
        Count: 1
< ACL Data TX: Handle 2268 flags 0x00 dlen 21              #140 [hci1] 8.988785
      SMP: Pairing Random (0x04) len 16
        Random value: c629a3a987d808e808655d558dfc1155
> HCI Event: Number of Completed Packets (0x13) plen 5     #141 [hci1] 9.035577
        Num handles: 1
        Handle: 2268 Address: DF:A9:FF:F6:B1:1A (OUI DF-A9-FF)
        Count: 1
        #140: len 21 (3 Kb/s)
        Latency: 46 msec (26-47 msec ~46 msec)
> ACL Data RX: Handle 2268 flags 0x02 dlen 21              #142 [hci1] 9.285626
      SMP: Pairing Random (0x04) len 16
        Random value: b410de17b041f0b62d301aca0b79c334
< HCI Command: Host Number of Comp.. (0x03|0x0035) plen 5  #143 [hci1] 9.289185
        Num handles: 1
        Handle: 2268 Address: DF:A9:FF:F6:B1:1A (OUI DF-A9-FF)
        Count: 1
< ACL Data TX: Handle 2268 flags 0x00 dlen 21              #144 [hci1] 9.289370
      SMP: Pairing Confirm (0x03) len 16
        Confim value: 4cecca73f1bb126444ae2d378f32e7d8
> HCI Event: Number of Completed Packets (0x13) plen 5     #145 [hci1] 9.335425
        Num handles: 1
        Handle: 2268 Address: DF:A9:FF:F6:B1:1A (OUI DF-A9-FF)
        Count: 1
        #144: len 21 (3 Kb/s)
        Latency: 46 msec (26-47 msec ~46 msec)
> ACL Data RX: Handle 2268 flags 0x02 dlen 21              #146 [hci1] 9.385563
      SMP: Pairing Confirm (0x03) len 16
        Confim value: a786092a82399c03d34113e5a664b41b
< HCI Command: Host Number of Comp.. (0x03|0x0035) plen 5  #147 [hci1] 9.389049
        Num handles: 1
        Handle: 2268 Address: DF:A9:FF:F6:B1:1A (OUI DF-A9-FF)
        Count: 1
< ACL Data TX: Handle 2268 flags 0x00 dlen 21              #148 [hci1] 9.389207
      SMP: Pairing Random (0x04) len 16
        Random value: 92f20f6ad8f13724432c7fd6001c45ff
> HCI Event: Number of Completed Packets (0x13) plen 5     #149 [hci1] 9.435573
        Num handles: 1
        Handle: 2268 Address: DF:A9:FF:F6:B1:1A (OUI DF-A9-FF)
        Count: 1
        #148: len 21 (3 Kb/s)
        Latency: 46 msec (26-47 msec ~46 msec)
> ACL Data RX: Handle 2268 flags 0x02 dlen 21              #150 [hci1] 9.685619
      SMP: Pairing Random (0x04) len 16
        Random value: e70f552e62e4a9b1395bc2a060889f78
< HCI Command: Host Number of Comp.. (0x03|0x0035) plen 5  #151 [hci1] 9.688753
        Num handles: 1
        Handle: 2268 Address: DF:A9:FF:F6:B1:1A (OUI DF-A9-FF)
        Count: 1
< ACL Data TX: Handle 2268 flags 0x00 dlen 21              #152 [hci1] 9.688796
      SMP: Pairing Confirm (0x03) len 16
        Confim value: 48d40091261cf0a071ec6143a2ef4d6b
> HCI Event: Number of Completed Packets (0x13) plen 5     #153 [hci1] 9.735437
        Num handles: 1
        Handle: 2268 Address: DF:A9:FF:F6:B1:1A (OUI DF-A9-FF)
        Count: 1
        #152: len 21 (3 Kb/s)
        Latency: 46 msec (26-47 msec ~46 msec)
> ACL Data RX: Handle 2268 flags 0x02 dlen 21              #154 [hci1] 9.785747
      SMP: Pairing Confirm (0x03) len 16
        Confim value: 488deba32bf0bf396ae1d290df854552
< HCI Command: Host Number of Comp.. (0x03|0x0035) plen 5  #155 [hci1] 9.789105
        Num handles: 1
        Handle: 2268 Address: DF:A9:FF:F6:B1:1A (OUI DF-A9-FF)
        Count: 1
< ACL Data TX: Handle 2268 flags 0x00 dlen 21              #156 [hci1] 9.789180
      SMP: Pairing Random (0x04) len 16
        Random value: 23ac32ebbb5e14c8a6b9622f296d277f
> HCI Event: Number of Completed Packets (0x13) plen 5     #157 [hci1] 9.835409
        Num handles: 1
        Handle: 2268 Address: DF:A9:FF:F6:B1:1A (OUI DF-A9-FF)
        Count: 1
        #156: len 21 (3 Kb/s)
        Latency: 46 msec (26-47 msec ~46 msec)
> ACL Data RX: Handle 2268 flags 0x02 dlen 21             #158 [hci1] 10.085688
      SMP: Pairing Random (0x04) len 16
        Random value: 9784b72b9b1c05efe777962749fbe7af
< HCI Command: Host Number of Com.. (0x03|0x0035) plen 5  #159 [hci1] 10.088767
        Num handles: 1
        Handle: 2268 Address: DF:A9:FF:F6:B1:1A (OUI DF-A9-FF)
        Count: 1
< ACL Data TX: Handle 2268 flags 0x00 dlen 21             #160 [hci1] 10.088845
      SMP: Pairing Confirm (0x03) len 16
        Confim value: 01d50a9c39808c85e5be47eda5990943
> HCI Event: Number of Completed Packets (0x13) plen 5    #161 [hci1] 10.135487
        Num handles: 1
        Handle: 2268 Address: DF:A9:FF:F6:B1:1A (OUI DF-A9-FF)
        Count: 1
        #160: len 21 (3 Kb/s)
        Latency: 46 msec (26-47 msec ~46 msec)
> ACL Data RX: Handle 2268 flags 0x02 dlen 21             #162 [hci1] 10.185580
      SMP: Pairing Confirm (0x03) len 16
        Confim value: 070a9031dcb76af8a7310a0f3ec99b4b
< HCI Command: Host Number of Com.. (0x03|0x0035) plen 5  #163 [hci1] 10.188747
        Num handles: 1
        Handle: 2268 Address: DF:A9:FF:F6:B1:1A (OUI DF-A9-FF)
        Count: 1
< ACL Data TX: Handle 2268 flags 0x00 dlen 21             #164 [hci1] 10.188831
      SMP: Pairing Random (0x04) len 16
        Random value: 297efe85e67448a15f56bd27e3a3cf1d
> HCI Event: Number of Completed Packets (0x13) plen 5    #165 [hci1] 10.235443
        Num handles: 1
        Handle: 2268 Address: DF:A9:FF:F6:B1:1A (OUI DF-A9-FF)
        Count: 1
        #164: len 21 (3 Kb/s)
        Latency: 46 msec (26-47 msec ~46 msec)
> ACL Data RX: Handle 2268 flags 0x02 dlen 21             #166 [hci1] 10.485800
      SMP: Pairing Random (0x04) len 16
        Random value: deac66ae774cae4c90e77c4dd96ca8f1
< HCI Command: Host Number of Com.. (0x03|0x0035) plen 5  #167 [hci1] 10.489162
        Num handles: 1
        Handle: 2268 Address: DF:A9:FF:F6:B1:1A (OUI DF-A9-FF)
        Count: 1
< ACL Data TX: Handle 2268 flags 0x00 dlen 21             #168 [hci1] 10.489321
      SMP: Pairing Confirm (0x03) len 16
        Confim value: ad4df2218d19fcf3b026c405e1a3ea78
> HCI Event: Number of Completed Packets (0x13) plen 5    #169 [hci1] 10.535395
        Num handles: 1
        Handle: 2268 Address: DF:A9:FF:F6:B1:1A (OUI DF-A9-FF)
        Count: 1
        #168: len 21 (3 Kb/s)
        Latency: 46 msec (26-47 msec ~46 msec)
> ACL Data RX: Handle 2268 flags 0x02 dlen 21             #170 [hci1] 10.585528
      SMP: Pairing Confirm (0x03) len 16
        Confim value: f19d150d2845606cd0cb635a6965631d
< HCI Command: Host Number of Com.. (0x03|0x0035) plen 5  #171 [hci1] 10.588707
        Num handles: 1
        Handle: 2268 Address: DF:A9:FF:F6:B1:1A (OUI DF-A9-FF)
        Count: 1
< ACL Data TX: Handle 2268 flags 0x00 dlen 21             #172 [hci1] 10.588798
      SMP: Pairing Random (0x04) len 16
        Random value: 25a9493fd3ce4faf02be7293595bb7c6
> HCI Event: Number of Completed Packets (0x13) plen 5    #173 [hci1] 10.635485
        Num handles: 1
        Handle: 2268 Address: DF:A9:FF:F6:B1:1A (OUI DF-A9-FF)
        Count: 1
        #172: len 21 (3 Kb/s)
        Latency: 46 msec (26-47 msec ~46 msec)
> ACL Data RX: Handle 2268 flags 0x02 dlen 21             #174 [hci1] 10.885546
      SMP: Pairing Random (0x04) len 16
        Random value: cec45ece3cf80c475565f85ac710e816
< HCI Command: Host Number of Com.. (0x03|0x0035) plen 5  #175 [hci1] 10.889195
        Num handles: 1
        Handle: 2268 Address: DF:A9:FF:F6:B1:1A (OUI DF-A9-FF)
        Count: 1
< ACL Data TX: Handle 2268 flags 0x00 dlen 21             #176 [hci1] 10.889283
      SMP: Pairing Confirm (0x03) len 16
        Confim value: 102d2ced71658a13bbbb116791e65e17
> HCI Event: Number of Completed Packets (0x13) plen 5    #177 [hci1] 10.935373
        Num handles: 1
        Handle: 2268 Address: DF:A9:FF:F6:B1:1A (OUI DF-A9-FF)
        Count: 1
        #176: len 21 (3 Kb/s)
        Latency: 46 msec (26-47 msec ~46 msec)
> ACL Data RX: Handle 2268 flags 0x02 dlen 21             #178 [hci1] 10.985579
      SMP: Pairing Confirm (0x03) len 16
        Confim value: 1851bf308f3f10973bfe22a160910e56
< HCI Command: Host Number of Com.. (0x03|0x0035) plen 5  #179 [hci1] 10.989039
        Num handles: 1
        Handle: 2268 Address: DF:A9:FF:F6:B1:1A (OUI DF-A9-FF)
        Count: 1
< ACL Data TX: Handle 2268 flags 0x00 dlen 21             #180 [hci1] 10.989153
      SMP: Pairing Random (0x04) len 16
        Random value: 58f6b41f855a6f6c3560debd84e2affc
> HCI Event: Number of Completed Packets (0x13) plen 5    #181 [hci1] 11.035410
        Num handles: 1
        Handle: 2268 Address: DF:A9:FF:F6:B1:1A (OUI DF-A9-FF)
        Count: 1
        #180: len 21 (3 Kb/s)
        Latency: 46 msec (26-47 msec ~46 msec)
> ACL Data RX: Handle 2268 flags 0x02 dlen 21             #182 [hci1] 11.285659
      SMP: Pairing Random (0x04) len 16
        Random value: 6f3f853ff4e42b8a72733a34a05f9e7c
< HCI Command: Host Number of Com.. (0x03|0x0035) plen 5  #183 [hci1] 11.288754
        Num handles: 1
        Handle: 2268 Address: DF:A9:FF:F6:B1:1A (OUI DF-A9-FF)
        Count: 1
< ACL Data TX: Handle 2268 flags 0x00 dlen 21             #184 [hci1] 11.288848
      SMP: Pairing Confirm (0x03) len 16
        Confim value: 3522f9677524af0771113e07996f2604
> HCI Event: Number of Completed Packets (0x13) plen 5    #185 [hci1] 11.335534
        Num handles: 1
        Handle: 2268 Address: DF:A9:FF:F6:B1:1A (OUI DF-A9-FF)
        Count: 1
        #184: len 21 (3 Kb/s)
        Latency: 46 msec (26-47 msec ~46 msec)
> ACL Data RX: Handle 2268 flags 0x02 dlen 21             #186 [hci1] 11.385527
      SMP: Pairing Confirm (0x03) len 16
        Confim value: 653ce4102b648e2396cbb381b2c26d08
< HCI Command: Host Number of Com.. (0x03|0x0035) plen 5  #187 [hci1] 11.389065
        Num handles: 1
        Handle: 2268 Address: DF:A9:FF:F6:B1:1A (OUI DF-A9-FF)
        Count: 1
< ACL Data TX: Handle 2268 flags 0x00 dlen 21             #188 [hci1] 11.389226
      SMP: Pairing Random (0x04) len 16
        Random value: b67e7216d5bf664139eda2b542549666
> HCI Event: Number of Completed Packets (0x13) plen 5    #189 [hci1] 11.435414
        Num handles: 1
        Handle: 2268 Address: DF:A9:FF:F6:B1:1A (OUI DF-A9-FF)
        Count: 1
        #188: len 21 (3 Kb/s)
        Latency: 46 msec (26-47 msec ~46 msec)
> ACL Data RX: Handle 2268 flags 0x02 dlen 21             #190 [hci1] 11.685609
      SMP: Pairing Random (0x04) len 16
        Random value: 32bcbb0394c20c3500897a6b9a46062b
< HCI Command: Host Number of Com.. (0x03|0x0035) plen 5  #191 [hci1] 11.688777
        Num handles: 1
        Handle: 2268 Address: DF:A9:FF:F6:B1:1A (OUI DF-A9-FF)
        Count: 1
< ACL Data TX: Handle 2268 flags 0x00 dlen 21             #192 [hci1] 11.688812
      SMP: Pairing Confirm (0x03) len 16
        Confim value: 263119e0ebb430e692da6b5f22e60e7c
> HCI Event: Number of Completed Packets (0x13) plen 5    #193 [hci1] 11.735435
        Num handles: 1
        Handle: 2268 Address: DF:A9:FF:F6:B1:1A (OUI DF-A9-FF)
        Count: 1
        #192: len 21 (3 Kb/s)
        Latency: 46 msec (26-47 msec ~46 msec)
> ACL Data RX: Handle 2268 flags 0x02 dlen 21             #194 [hci1] 11.785725
      SMP: Pairing Confirm (0x03) len 16
        Confim value: dadf6cd0325d32af21342e22637a0273
< HCI Command: Host Number of Com.. (0x03|0x0035) plen 5  #195 [hci1] 11.788989
        Num handles: 1
        Handle: 2268 Address: DF:A9:FF:F6:B1:1A (OUI DF-A9-FF)
        Count: 1
< ACL Data TX: Handle 2268 flags 0x00 dlen 21             #196 [hci1] 11.789036
      SMP: Pairing Random (0x04) len 16
        Random value: ed17f76500c95219dd01e09d1e63f87b
> HCI Event: Number of Completed Packets (0x13) plen 5    #197 [hci1] 11.835323
        Num handles: 1
        Handle: 2268 Address: DF:A9:FF:F6:B1:1A (OUI DF-A9-FF)
        Count: 1
        #196: len 21 (3 Kb/s)
        Latency: 46 msec (26-47 msec ~46 msec)
> ACL Data RX: Handle 2268 flags 0x02 dlen 21             #198 [hci1] 12.085560
      SMP: Pairing Random (0x04) len 16
        Random value: 59dfdd2d766862eee23949f2ac19fa18
< HCI Command: Host Number of Com.. (0x03|0x0035) plen 5  #199 [hci1] 12.088767
        Num handles: 1
        Handle: 2268 Address: DF:A9:FF:F6:B1:1A (OUI DF-A9-FF)
        Count: 1
< ACL Data TX: Handle 2268 flags 0x00 dlen 21             #200 [hci1] 12.088799
      SMP: Pairing Confirm (0x03) len 16
        Confim value: a587239be828579608bd911e0693bfde
> HCI Event: Number of Completed Packets (0x13) plen 5    #201 [hci1] 12.135463
        Num handles: 1
        Handle: 2268 Address: DF:A9:FF:F6:B1:1A (OUI DF-A9-FF)
        Count: 1
        #200: len 21 (3 Kb/s)
        Latency: 46 msec (26-47 msec ~46 msec)
> ACL Data RX: Handle 2268 flags 0x02 dlen 21             #202 [hci1] 12.185565
      SMP: Pairing Confirm (0x03) len 16
        Confim value: 4489e62ebb6ed6f641ec33abae4c8c2a
< HCI Command: Host Number of Com.. (0x03|0x0035) plen 5  #203 [hci1] 12.188877
        Num handles: 1
        Handle: 2268 Address: DF:A9:FF:F6:B1:1A (OUI DF-A9-FF)
        Count: 1
< ACL Data TX: Handle 2268 flags 0x00 dlen 21             #204 [hci1] 12.188892
      SMP: Pairing Random (0x04) len 16
        Random value: 81d35d47e1f6006d79c974bd9d9e1ee3
> HCI Event: Number of Completed Packets (0x13) plen 5    #205 [hci1] 12.235594
        Num handles: 1
        Handle: 2268 Address: DF:A9:FF:F6:B1:1A (OUI DF-A9-FF)
        Count: 1
        #204: len 21 (3 Kb/s)
        Latency: 46 msec (26-47 msec ~46 msec)
> ACL Data RX: Handle 2268 flags 0x02 dlen 21             #206 [hci1] 12.485584
      SMP: Pairing Random (0x04) len 16
        Random value: 68ec4830b192a296345a92888492d22a
< HCI Command: Host Number of Com.. (0x03|0x0035) plen 5  #207 [hci1] 12.489245
        Num handles: 1
        Handle: 2268 Address: DF:A9:FF:F6:B1:1A (OUI DF-A9-FF)
        Count: 1
< ACL Data TX: Handle 2268 flags 0x00 dlen 21             #208 [hci1] 12.489344
      SMP: Pairing Confirm (0x03) len 16
        Confim value: 11a2ed849e0d27803253ff4688c46b80
> HCI Event: Number of Completed Packets (0x13) plen 5    #209 [hci1] 12.535422
        Num handles: 1
        Handle: 2268 Address: DF:A9:FF:F6:B1:1A (OUI DF-A9-FF)
        Count: 1
        #208: len 21 (3 Kb/s)
        Latency: 46 msec (26-47 msec ~46 msec)
> ACL Data RX: Handle 2268 flags 0x02 dlen 21             #210 [hci1] 12.585583
      SMP: Pairing Confirm (0x03) len 16
        Confim value: 431c557ccc258cea1e64fd0136d9b117
< HCI Command: Host Number of Com.. (0x03|0x0035) plen 5  #211 [hci1] 12.588771
        Num handles: 1
        Handle: 2268 Address: DF:A9:FF:F6:B1:1A (OUI DF-A9-FF)
        Count: 1
< ACL Data TX: Handle 2268 flags 0x00 dlen 21             #212 [hci1] 12.588801
      SMP: Pairing Random (0x04) len 16
        Random value: e7f7e0c2476823e41736a7e381bafb7c
> HCI Event: Number of Completed Packets (0x13) plen 5    #213 [hci1] 12.635535
        Num handles: 1
        Handle: 2268 Address: DF:A9:FF:F6:B1:1A (OUI DF-A9-FF)
        Count: 1
        #212: len 21 (3 Kb/s)
        Latency: 46 msec (26-47 msec ~46 msec)
> ACL Data RX: Handle 2268 flags 0x02 dlen 21             #214 [hci1] 12.885667
      SMP: Pairing Random (0x04) len 16
        Random value: 6ac4b9929280f45eef8bf5ac4341cbba
< HCI Command: Host Number of Com.. (0x03|0x0035) plen 5  #215 [hci1] 12.889034
        Num handles: 1
        Handle: 2268 Address: DF:A9:FF:F6:B1:1A (OUI DF-A9-FF)
        Count: 1
< ACL Data TX: Handle 2268 flags 0x00 dlen 21             #216 [hci1] 12.889096
      SMP: Pairing Confirm (0x03) len 16
        Confim value: 2373c96a02edbbcb0dda5c34e463dd9b
> HCI Event: Number of Completed Packets (0x13) plen 5    #217 [hci1] 12.935504
        Num handles: 1
        Handle: 2268 Address: DF:A9:FF:F6:B1:1A (OUI DF-A9-FF)
        Count: 1
        #216: len 21 (3 Kb/s)
        Latency: 46 msec (26-47 msec ~46 msec)
> ACL Data RX: Handle 2268 flags 0x02 dlen 21             #218 [hci1] 12.985620
      SMP: Pairing Confirm (0x03) len 16
        Confim value: 949b1c8c94af0d2059e41dc2c83426aa
< HCI Command: Host Number of Com.. (0x03|0x0035) plen 5  #219 [hci1] 12.989071
        Num handles: 1
        Handle: 2268 Address: DF:A9:FF:F6:B1:1A (OUI DF-A9-FF)
        Count: 1
< ACL Data TX: Handle 2268 flags 0x00 dlen 21             #220 [hci1] 12.989217
      SMP: Pairing Random (0x04) len 16
        Random value: fc8b40d9b0b09bc4296bf8753a8f6e1f
> HCI Event: Number of Completed Packets (0x13) plen 5    #221 [hci1] 13.035419
        Num handles: 1
        Handle: 2268 Address: DF:A9:FF:F6:B1:1A (OUI DF-A9-FF)
        Count: 1
        #220: len 21 (3 Kb/s)
        Latency: 46 msec (26-47 msec ~46 msec)
> ACL Data RX: Handle 2268 flags 0x02 dlen 21             #222 [hci1] 13.285583
      SMP: Pairing Random (0x04) len 16
        Random value: 15265afb65b6c96a58c7dd018d100ecc
< HCI Command: Host Number of Com.. (0x03|0x0035) plen 5  #223 [hci1] 13.289585
        Num handles: 1
        Handle: 2268 Address: DF:A9:FF:F6:B1:1A (OUI DF-A9-FF)
        Count: 1
< ACL Data TX: Handle 2268 flags 0x00 dlen 21             #224 [hci1] 13.289661
      SMP: Pairing DHKey Check (0x0d) len 16
        E: 2a0c08680edf2a66b93df59be5cea71b
> HCI Event: Number of Completed Packets (0x13) plen 5    #225 [hci1] 13.335325
        Num handles: 1
        Handle: 2268 Address: DF:A9:FF:F6:B1:1A (OUI DF-A9-FF)
        Count: 1
        #224: len 21 (3 Kb/s)
        Latency: 45 msec (26-47 msec ~46 msec)
> ACL Data RX: Handle 2268 flags 0x02 dlen 21             #226 [hci1] 13.385637
      SMP: Pairing DHKey Check (0x0d) len 16
        E: d37b96475647177de276dbac84ed42ec
< HCI Command: LE Start Encryption (0x08|0x0019) plen 28  #227 [hci1] 13.388770
        Handle: 2268 Address: DF:A9:FF:F6:B1:1A (OUI DF-A9-FF)
        Random number: 0x0000000000000000
        Encrypted diversifier: 0x0000
        Long term key: 477c51c717f7862a83c7f44b6de1b09d
> HCI Event: Command Status (0x0f) plen 4                 #228 [hci1] 13.389721
      LE Start Encryption (0x08|0x0019) ncmd 1
        Status: Success (0x00)
< HCI Command: Host Number of Com.. (0x03|0x0035) plen 5  #229 [hci1] 13.408671
        Num handles: 1
        Handle: 2268 Address: DF:A9:FF:F6:B1:1A (OUI DF-A9-FF)
        Count: 1
> HCI Event: Encryption Change (0x08) plen 4              #230 [hci1] 13.735315
        Status: Success (0x00)
        Handle: 2268 Address: DF:A9:FF:F6:B1:1A (OUI DF-A9-FF)
        Encryption: Enabled with AES-CCM (0x01)
< HCI Command: Disconnect (0x01|0x0006) plen 3            #231 [hci1] 14.338803
        Handle: 2268 Address: DF:A9:FF:F6:B1:1A (OUI DF-A9-FF)
        Reason: Remote User Terminated Connection (0x13)
> HCI Event: Command Status (0x0f) plen 4                 #232 [hci1] 14.339361
      Disconnect (0x01|0x0006) ncmd 1
        Status: Success (0x00)
> HCI Event: Disconnect Complete (0x05) plen 4            #233 [hci1] 14.435230
        Status: Success (0x00)
        Handle: 2268 Address: DF:A9:FF:F6:B1:1A (OUI DF-A9-FF)
        Reason: Connection Terminated By Local Host (0x16)
< HCI Command: Reset (0x03|0x0003) plen 0                 #234 [hci1] 20.058667
> HCI Event: Command Complete (0x0e) plen 4               #235 [hci1] 20.059252
      Reset (0x03|0x0003) ncmd 1
        Status: Success (0x00)
@ USER Close: main                                    {0x0001} [hci1] 20.068582
= Close Index: 00:00:00:00:00:00                               [hci1] 20.072483
