Bluetooth monitor ver 5.84
btmon[1921772]: = Note: Linux version 6.8.0-83-generic (x86_64)                                                          0.333984
btmon[1921772]: = Note: Bluetooth subsystem version 2.22                                                                 0.333985
= New Index: 00:00:00:00:00:00 (Primary,UART,hci0)                                                                       0.333986
= Open Index: 00:00:00:00:00:00                                                                                          0.841223
= Index Info: 00:00:00:00:00:00 (Nordic Semiconductor ASA)                                                               0.841365
zephyr.exe[1921774]: @ USER Open: main (privileged) version 2.22                                                {0x0001} 0.841388
zephyr.exe[1921774]: < HCI Command: Reset (0x03|0x0003) plen 0                                                        #1 0.841553
> HCI Event: Command Complete (0x0e) plen 4                                                                           #2 0.842050
      Reset (0x03|0x0003) ncmd 1
        Status: Success (0x00)
zephyr.exe[1921774]: < HCI Command: Read Local Supported Features (0x04|0x0003) plen 0                                #3 0.858151
> HCI Event: Command Complete (0x0e) plen 12                                                                          #4 0.859452
      Read Local Supported Features (0x04|0x0003) ncmd 1
        Status: Success (0x00)
        Features: 0x00 0x00 0x00 0x00 0x60 0x00 0x00 0x00
          BR/EDR Not Supported
          LE Supported (Controller)
zephyr.exe[1921774]: < HCI Command: Read Local Version Information (0x04|0x0001) plen 0                               #5 0.878183
> HCI Event: Command Complete (0x0e) plen 12                                                                          #6 0.879568
      Read Local Version Information (0x04|0x0001) ncmd 1
        Status: Success (0x00)
        HCI version: Reserved (0x0e) - Revision 12520 (0x30e8)
        LMP version: Reserved (0x0e) - Subversion 12520 (0x30e8)
        Manufacturer: Nordic Semiconductor ASA (89)
zephyr.exe[1921774]: < HCI Command: Read Local Supported Commands (0x04|0x0002) plen 0                                #7 0.898144
> HCI Event: Command Complete (0x0e) plen 68                                                                          #8 0.900158
      Read Local Supported Commands (0x04|0x0002) ncmd 1
        Status: Success (0x00)
        Commands: 119 entries
          Disconnect (Octet 0 - Bit 5)
          Read Remote Version Information (Octet 2 - Bit 7)
          Set Event Mask (Octet 5 - Bit 6)
          Reset (Octet 5 - Bit 7)
          Read Connection Accept Timeout (Octet 7 - Bit 2)
          Write Connection Accept Timeout (Octet 7 - Bit 3)
          Read Transmit Power Level (Octet 10 - Bit 2)
          Set Controller To Host Flow Control (Octet 10 - Bit 5)
          Host Buffer Size (Octet 10 - Bit 6)
          Host Number of Completed Packets (Octet 10 - Bit 7)
          Read Local Version Information (Octet 14 - Bit 3)
          Read Local Supported Features (Octet 14 - Bit 5)
          Read BD ADDR (Octet 15 - Bit 1)
          Read RSSI (Octet 15 - Bit 5)
          Set Event Mask Page 2 (Octet 22 - Bit 2)
          LE Set Event Mask (Octet 25 - Bit 0)
          LE Read Buffer Size (Octet 25 - Bit 1)
          LE Read Local Supported Features (Octet 25 - Bit 2)
          LE Set Random Address (Octet 25 - Bit 4)
          LE Set Advertising Parameters (Octet 25 - Bit 5)
          LE Read Advertising Channel TX Power (Octet 25 - Bit 6)
          LE Set Advertising Data (Octet 25 - Bit 7)
          LE Set Scan Response Data (Octet 26 - Bit 0)
          LE Set Advertise Enable (Octet 26 - Bit 1)
          LE Set Scan Parameters (Octet 26 - Bit 2)
          LE Set Scan Enable (Octet 26 - Bit 3)
          LE Create Connection (Octet 26 - Bit 4)
          LE Create Connection Cancel (Octet 26 - Bit 5)
          LE Read Accept List Size (Octet 26 - Bit 6)
          LE Clear Accept List (Octet 26 - Bit 7)
          LE Add Device To Accept List (Octet 27 - Bit 0)
          LE Remove Device From Accept List (Octet 27 - Bit 1)
          LE Connection Update (Octet 27 - Bit 2)
          LE Set Host Channel Classification (Octet 27 - Bit 3)
          LE Read Channel Map (Octet 27 - Bit 4)
          LE Read Remote Used Features (Octet 27 - Bit 5)
          LE Encrypt (Octet 27 - Bit 6)
          LE Rand (Octet 27 - Bit 7)
          LE Start Encryption (Octet 28 - Bit 0)
          LE Long Term Key Request Reply (Octet 28 - Bit 1)
          LE Long Term Key Request Neg Reply (Octet 28 - Bit 2)
          LE Read Supported States (Octet 28 - Bit 3)
          LE Receiver Test (Octet 28 - Bit 4)
          LE Transmitter Test (Octet 28 - Bit 5)
          LE Test End (Octet 28 - Bit 6)
          Read Authenticated Payload Timeout (Octet 32 - Bit 4)
          Write Authenticated Payload Timeout (Octet 32 - Bit 5)
          LE Set Data Length (Octet 33 - Bit 6)
          LE Read Suggested Default Data Length (Octet 33 - Bit 7)
          LE Write Suggested Default Data Length (Octet 34 - Bit 0)
          LE Add Device To Resolving List (Octet 34 - Bit 3)
          LE Remove Device From Resolving List (Octet 34 - Bit 4)
          LE Clear Resolving List (Octet 34 - Bit 5)
          LE Read Resolving List Size (Octet 34 - Bit 6)
          LE Set Address Resolution Enable (Octet 35 - Bit 1)
          LE Set Resolvable Private Address Timeout (Octet 35 - Bit 2)
          LE Read Maximum Data Length (Octet 35 - Bit 3)
          LE Read PHY (Octet 35 - Bit 4)
          LE Set Default PHY (Octet 35 - Bit 5)
          LE Set PHY (Octet 35 - Bit 6)
          LE Enhanced Receiver Test (Octet 35 - Bit 7)
          LE Enhanced Transmitter Test (Octet 36 - Bit 0)
          LE Set Advertising Set Random Address (Octet 36 - Bit 1)
          LE Set Extended Advertising Parameters (Octet 36 - Bit 2)
          LE Set Extended Advertising Data (Octet 36 - Bit 3)
          LE Set Extended Scan Response Data (Octet 36 - Bit 4)
          LE Set Extended Advertising Enable (Octet 36 - Bit 5)
          LE Read Maximum Advertising Data Length (Octet 36 - Bit 6)
          LE Read Number of Supported Advertising Sets (Octet 36 - Bit 7)
          LE Remove Advertising Set (Octet 37 - Bit 0)
          LE Clear Advertising Sets (Octet 37 - Bit 1)
          LE Set Periodic Advertising Parameters (Octet 37 - Bit 2)
          LE Set Periodic Advertising Data (Octet 37 - Bit 3)
          LE Set Periodic Advertising Enable (Octet 37 - Bit 4)
          LE Set Extended Scan Parameters (Octet 37 - Bit 5)
          LE Set Extended Scan Enable (Octet 37 - Bit 6)
          LE Extended Create Connection (Octet 37 - Bit 7)
          LE Periodic Advertising Create Sync (Octet 38 - Bit 0)
          LE Periodic Advertising Create Sync Cancel (Octet 38 - Bit 1)
          LE Periodic Advertising Terminate Sync (Octet 38 - Bit 2)
          LE Add Device To Periodic Advertiser List (Octet 38 - Bit 3)
          LE Remove Device From Periodic Advertiser List (Octet 38 - Bit 4)
          LE Clear Periodic Advertiser List (Octet 38 - Bit 5)
          LE Read Periodic Advertiser List Size (Octet 38 - Bit 6)
          LE Read Transmit Power (Octet 38 - Bit 7)
          LE Read RF Path Compensation (Octet 39 - Bit 0)
          LE Write RF Path Compensation (Octet 39 - Bit 1)
          LE Set Privacy Mode (Octet 39 - Bit 2)
          LE Periodic Advertising Receive Enable (Octet 40 - Bit 5)
          LE Periodic Advertising Sync Transfer (Octet 40 - Bit 6)
          LE Periodic Advertising Set Info Transfer (Octet 40 - Bit 7)
          LE Periodic Advertising Sync Transfer Parameters (Octet 41 - Bit 0)
          LE Set Default Periodic Advertisng Sync Transfer Parameters (Octet 41 - Bit 1)
          LE Read Buffer v2 (Octet 41 - Bit 5)
          LE Read ISO TX Sync (Octet 41 - Bit 6)
          LE Set Connected Isochronous Group Parameters (Octet 41 - Bit 7)
          LE Set Connected Isochronous Group Parameters Test (Octet 42 - Bit 0)
          LE Create Connected Isochronous Stream (Octet 42 - Bit 1)
          LE Remove Connected Isochronous Group (Octet 42 - Bit 2)
          LE Accept Connected Isochronous Stream Request (Octet 42 - Bit 3)
          LE Reject Connected Isochronous Stream Request (Octet 42 - Bit 4)
          LE Create Broadcast Isochronous Group (Octet 42 - Bit 5)
          LE Create Broadcast Isochronous Group Test (Octet 42 - Bit 6)
          LE Terminate Broadcast Isochronous Group (Octet 42 - Bit 7)
          LE Broadcast Isochronous Group Create Sync (Octet 43 - Bit 0)
          LE Broadcast Isochronous Group Terminate Sync (Octet 43 - Bit 1)
          LE Request Peer SCA (Octet 43 - Bit 2)
          LE Setup Isochronous Data Path (Octet 43 - Bit 3)
          LE Remove Isochronous Data Path (Octet 43 - Bit 4)
          LE Isochronous Transmit Test (Octet 43 - Bit 5)
          LE Isochronous Receive Test (Octet 43 - Bit 6)
          LE Isochronous Read Test Counters (Octet 43 - Bit 7)
          LE Isochronous Read Test Counters (Octet 44 - Bit 0)
          LE Set Host Feature (Octet 44 - Bit 1)
          LE Read ISO link quality (Octet 44 - Bit 2)
          Octet 45 - Bit 6 
          Octet 46 - Bit 0 
          Octet 46 - Bit 1 
          Octet 46 - Bit 2 
zephyr.exe[1921774]: < HCI Command: Host Buffer Size (0x03|0x0033) plen 7                                             #9 0.918145
        ACL MTU: 255  ACL max packet: 16
        SCO MTU: 0    SCO max packet: 0
> HCI Event: Command Complete (0x0e) plen 4                                                                          #10 0.919022
      Host Buffer Size (0x03|0x0033) ncmd 1
        Status: Success (0x00)
zephyr.exe[1921774]: < HCI Command: Set Controller To Host Flow Control (0x03|0x0031) plen 1                         #11 0.938166
        Flow control: ACL Data Packets (0x01)
> HCI Event: Command Complete (0x0e) plen 4                                                                          #12 0.939322
      Set Controller To Host Flow Control (0x03|0x0031) ncmd 1
        Status: Success (0x00)
zephyr.exe[1921774]: < HCI Command: LE Read Local Supported Features (0x08|0x0003) plen 0                            #13 0.958141
> HCI Event: Command Complete (0x0e) plen 12                                                                         #14 0.959425
      LE Read Local Supported Features (0x08|0x0003) ncmd 1
        Status: Success (0x00)
        Features: 0xfd 0x79 0x00 0xf7 0x30 0x01 0x00 0x00
          LE Encryption
          Extended Reject Indication
          Peripheral-initiated Features Exchange
          LE Ping
          LE Data Packet Length Extension
          LL Privacy
          Extended Scanner Filter Policies
          LE 2M PHY
          LE Coded PHY
          LE Extended Advertising
          LE Periodic Advertising
          Channel Selection Algorithm #2
          Periodic Advertising Sync Transfer - Sender
          Periodic Advertising Sync Transfer - Recipient
          Sleep Clock Accuracy Updates
          Connected Isochronous Stream - Central
          Connected Isochronous Stream - Peripheral
          Isochronous Broadcaster
          Synchronized Receiver
          Periodic Advertising ADI support
          Connection Subrating
          Unknown features (0x0000010000000000)
zephyr.exe[1921774]: < HCI Command: LE Set Host Feature (0x08|0x0074) plen 2                                         #15 0.978176
        Bit Number: 32
          Connected Isochronous Stream (Host Support)
        Bit Value: 1
> HCI Event: Command Complete (0x0e) plen 4                                                                          #16 0.979380
      LE Set Host Feature (0x08|0x0074) ncmd 1
        Status: Success (0x00)
zephyr.exe[1921774]: < HCI Command: LE Read Buffer v2 (0x08|0x0060) plen 0                                           #17 0.998139
> HCI Event: Command Complete (0x0e) plen 10                                                                         #18 0.999801
      LE Read Buffer v2 (0x08|0x0060) ncmd 1
        Status: Success (0x00)
        ACL MTU: 27
        ACL max packet: 3
        ISO MTU: 318
        ISO max packet: 3
zephyr.exe[1921774]: < HCI Command: LE Read Maximum Advertising Data Length (0x08|0x003a) plen 0                     #19 1.018172
> HCI Event: Command Complete (0x0e) plen 6                                                                          #20 1.019647
      LE Read Maximum Advertising Data Length (0x08|0x003a) ncmd 1
        Status: Success (0x00)
        Max length: 1650
zephyr.exe[1921774]: < HCI Command: LE Read Supported States (0x08|0x001c) plen 0                                    #21 1.038139
> HCI Event: Command Complete (0x0e) plen 12                                                                         #22 1.039317
      LE Read Supported States (0x08|0x001c) ncmd 1
        Status: Success (0x00)
        States: 0x000003ff3e0306ff
          Non-connectable Advertising State
          Scannable Advertising State
          Connectable Advertising State
          High Duty Cycle Directed Advertising State
          Passive Scanning State
          Active Scanning State
          Initiating State
            and Connection State (Central Role)
          Connection State (Peripheral Role)
          Scannable Advertising State
            and Passive Scanning State
          Connectable Advertising State
            and Passive Scanning State
          Non-connectable Advertising State
            and Initiating State
          Scannable Advertising State
            and Initiating State
          Active Scanning State
            and Connection State (Central Role)
          Passive Scanning State
            and Connection State (Peripheral Role)
          Active Scanning State
            and Connection State (Peripheral Role)
          Initiating State
            and Connection State (Central Role)
            and Central Role & Central Role
          Low Duty Cycle Directed Advertising State
          Connectable Advertising State
            and Initiating State
            and Central Role & Peripheral Role
          High Duty Cycle Directed Advertising State
            and Initiating State
            and Central Role & Peripheral Role
          Low Duty Cycle Directed Advertising State
            and Initiating State
            and Central Role & Peripheral Role
          Connectable Advertising State
            and Connection State (Central Role)
            and Central Role & Peripheral Role
          High Duty Cycle Directed Advertising State
            and Connection State (Central Role)
            and Central Role & Peripheral Role
          Low Duty Cycle Directed Advertising State
            and Connection State (Central Role)
            and Central Role & Peripheral Role
          Connectable Advertising State
            and Connection State (Peripheral Role)
            and Central Role & Peripheral Role
          High Duty Cycle Directed Advertising State
            and Connection State (Peripheral Role)
            and Peripheral Role & Peripheral Role
          Low Duty Cycle Directed Advertising State
            and Connection State (Peripheral Role)
            and Peripheral Role & Peripheral Role
          Initiating State
            and Connection State (Peripheral Role)
            and Central Role & Peripheral Role
zephyr.exe[1921774]: < HCI Command: LE Read Maximum Data Length (0x08|0x002f) plen 0                                 #23 1.058297
> HCI Event: Command Complete (0x0e) plen 12                                                                         #24 1.059586
      LE Read Maximum Data Length (0x08|0x002f) ncmd 1
        Status: Success (0x00)
        Max TX octets: 251
        Max TX time: 2704
        Max RX octets: 251
        Max RX time: 2704
zephyr.exe[1921774]: < HCI Command: LE Write Suggested Default Data Length (0x08|0x0024) plen 4                      #25 1.078332
        TX octets: 251
        TX time: 2704
> HCI Event: Command Complete (0x0e) plen 4                                                                          #26 1.079245
      LE Write Suggested Default Data Length (0x08|0x0024) ncmd 1
        Status: Success (0x00)
zephyr.exe[1921774]: < HCI Command: LE Read Resolving List Size (0x08|0x002a) plen 0                                 #27 1.098279
> HCI Event: Command Complete (0x0e) plen 5                                                                          #28 1.099431
      LE Read Resolving List Size (0x08|0x002a) ncmd 1
        Status: Success (0x00)
        Size: 8
zephyr.exe[1921774]: < HCI Command: LE Set Event Mask (0x08|0x0001) plen 8                                           #29 1.118316
        Mask: 0x000002023f87fa5e
          LE Advertising Report
          LE Connection Update Complete
          LE Read Remote Used Features Complete
          LE Long Term Key Request
          LE Data Length Change
          LE Enhanced Connection Complete
          LE PHY Update Complete
          LE Extended Advertising Report
          LE Periodic Advertising Sync Established
          LE Periodic Advertising Report
          LE Periodic Advertising Sync Lost
          LE Extended Scan Timeout
          LE Extended Advertising Set Terminated
          LE Scan Request Received
          LE Periodic Advertising Sync Transfer Rvc
          LE CIS Established
          LE CIS Request
          LE Create BIG Complete
          LE Terminate BIG Complete
          LE BIG Sync Established Complete
          LE BIG Sync Lost
          LE BIG Info Advertising Report
          Unknown mask (0x0000020000000000)
> HCI Event: Command Complete (0x0e) plen 4                                                                          #30 1.119485
      LE Set Event Mask (0x08|0x0001) ncmd 1
        Status: Success (0x00)
zephyr.exe[1921774]: < HCI Command: Set Event Mask (0x03|0x0001) plen 8                                              #31 1.138328
        Mask: 0x2000800002008890
          Disconnection Complete
          Encryption Change
          Read Remote Version Information Complete
          Hardware Error
          Data Buffer Overflow
          Encryption Key Refresh Complete
          LE Meta
> HCI Event: Command Complete (0x0e) plen 4                                                                          #32 1.139487
      Set Event Mask (0x03|0x0001) ncmd 1
        Status: Success (0x00)
zephyr.exe[1921774]: < HCI Command: Read BD ADDR (0x04|0x0009) plen 0                                                #33 1.158339
> HCI Event: Command Complete (0x0e) plen 10                                                                         #34 1.159707
      Read BD ADDR (0x04|0x0009) ncmd 1
        Status: Success (0x00)
        Address: 00:00:00:00:00:00 (OUI 00-00-00)
zephyr.exe[1921774]: < HCI Command: LE Set Random Address (0x08|0x0005) plen 6                                       #35 1.178303
        Address: D5:B6:CC:31:DB:3B (Static)
> HCI Event: Command Complete (0x0e) plen 4                                                                          #36 1.179931
      LE Set Random Address (0x08|0x0005) ncmd 1
        Status: Success (0x00)
zephyr.exe[1921774]: < HCI Command: LE Set Extended Advertising Parameters (0x08|0x0036) plen 25                     #37 6.458355
        Handle: 0x00
        Properties: 0x0013
          Connectable
          Scannable
          Use legacy advertising PDUs: ADV_IND
        Min advertising interval: 100.000 msec (0x00a0)
        Max advertising interval: 150.000 msec (0x00f0)
        Channel map: 37, 38, 39 (0x07)
        Own address type: Random (0x01)
        Peer address type: Public (0x00)
        Peer address: 00:00:00:00:00:00 (OUI 00-00-00)
        Filter policy: Allow Scan Request from Any, Allow Connect Request from Any (0x00)
        TX power: Host has no preference (0x7f)
        Primary PHY: LE 1M (0x01)
        Secondary max skip: 0x00
        Secondary PHY: LE 1M (0x01)
        SID: 0x00
        Scan request notifications: Disabled (0x00)
> HCI Event: Command Complete (0x0e) plen 5                                                                          #38 6.459993
      LE Set Extended Advertising Parameters (0x08|0x0036) ncmd 1
        Status: Success (0x00)
        TX power (selected): 0 dbm (0x00)
zephyr.exe[1921774]: < HCI Command: LE Set Advertising Set Random Address (0x08|0x0035) plen 7                       #39 6.478336
        Advertising handle: 0x00
        Advertising random address: D5:B6:CC:31:DB:3B (Static)
> HCI Event: Command Complete (0x0e) plen 4                                                                          #40 6.478934
      LE Set Advertising Set Random Address (0x08|0x0035) ncmd 1
        Status: Success (0x00)
zephyr.exe[1921774]: < HCI Command: LE Set Extended Advertising Data (0x08|0x0037) plen 22                           #41 6.498272
        Handle: 0x00
        Operation: Complete extended advertising data (0x03)
        Fragment preference: Minimize fragmentation (0x01)
        Data length: 0x12
        Flags: 0x06
          LE General Discoverable Mode
          BR/EDR Not Supported
        Name (complete): Tester_2CB6EE
> HCI Event: Command Complete (0x0e) plen 4                                                                          #42 6.499544
      LE Set Extended Advertising Data (0x08|0x0037) ncmd 1
        Status: Success (0x00)
zephyr.exe[1921774]: < HCI Command: LE Set Extended Scan Response Data (0x08|0x0038) plen 4                          #43 6.518333
        Handle: 0x00
        Operation: Complete scan response data (0x03)
        Fragment preference: Minimize fragmentation (0x01)
        Data length: 0x00
> HCI Event: Command Complete (0x0e) plen 4                                                                          #44 6.519378
      LE Set Extended Scan Response Data (0x08|0x0038) ncmd 1
        Status: Success (0x00)
zephyr.exe[1921774]: < HCI Command: LE Set Extended Advertising Enable (0x08|0x0039) plen 6                          #45 6.538340
        Extended advertising: Enabled (0x01)
        Number of sets: 1 (0x01)
        Entry 0
          Handle: 0x00
          Duration: 0 ms (0x00)
          Max ext adv events: 0
> HCI Event: Command Complete (0x0e) plen 4                                                                          #46 6.539291
      LE Set Extended Advertising Enable (0x08|0x0039) ncmd 1
        Status: Success (0x00)
> HCI Event: LE Meta Event (0x3e) plen 31                                                                            #47 7.070016
      LE Enhanced Connection Complete (0x0a)
        Status: Success (0x00)
        Handle: 453
        Role: Peripheral (0x01)
        Peer address type: Public (0x00)
        Peer address: C0:07:E8:2C:B6:EE (OUI C0-07-E8)
        Local resolvable private address: 00:00:00:00:00:00 (Non-Resolvable)
        Peer resolvable private address: 00:00:00:00:00:00 (Non-Resolvable)
        Connection interval: 62.50 msec (0x0032)
        Connection latency: 0 (0x0000)
        Supervision timeout: 20000 msec (0x07d0)
        Central clock accuracy: 0x07
> HCI Event: LE Meta Event (0x3e) plen 6                                                                             #48 7.070305
      LE Advertising Set Terminated (0x12)
        Status: Success (0x00)
        Handle: 0
        Connection handle: 453
        Number of completed extended advertising events: 0
zephyr.exe[1921774]: < HCI Command: LE Read Remote Used Features (0x08|0x0016) plen 2                                #49 7.078399
        Handle: 453 Address: C0:07:E8:2C:B6:EE (OUI C0-07-E8)
> HCI Event: Command Status (0x0f) plen 4                                                                            #50 7.079229
      LE Read Remote Used Features (0x08|0x0016) ncmd 1
        Status: Success (0x00)
zephyr.exe[1921774]: < HCI Command: LE Set PHY (0x08|0x0032) plen 7                                                  #51 7.098291
        Handle: 453 Address: C0:07:E8:2C:B6:EE (OUI C0-07-E8)
        All PHYs preference: 0x00
        TX PHYs preference: 0x02
          LE 2M
        RX PHYs preference: 0x02
          LE 2M
        PHY options preference: Reserved (0x0000)
> HCI Event: Command Status (0x0f) plen 4                                                                            #52 7.098923
      LE Set PHY (0x08|0x0032) ncmd 1
        Status: Success (0x00)
> HCI Event: LE Meta Event (0x3e) plen 12                                                                            #53 7.258900
      LE Read Remote Used Features (0x04)
        Status: Success (0x00)
        Handle: 453 Address: C0:07:E8:2C:B6:EE (OUI C0-07-E8)
        Features: 0x2d 0x49 0x01 0xf7 0xef 0x39 0x00 0x80
          LE Encryption
          Extended Reject Indication
          Peripheral-initiated Features Exchange
          LE Data Packet Length Extension
          LE 2M PHY
          LE Coded PHY
          Channel Selection Algorithm #2
          Minimum Number of Used Channels Procedure
          Periodic Advertising Sync Transfer - Sender
          Periodic Advertising Sync Transfer - Recipient
          Sleep Clock Accuracy Updates
          Connected Isochronous Stream - Central
          Connected Isochronous Stream - Peripheral
          Isochronous Broadcaster
          Synchronized Receiver
          Connected Isochronous Stream (Host Support)
          LE Power Control Request
          LE Power Control Request
          LE Path Loss Monitoring
          Connection Subrating
          Connection Subrating (Host Support)
          Channel Classification
          Unknown features (0x8000390000000000)
> HCI Event: LE Meta Event (0x3e) plen 6                                                                             #54 7.758194
      LE PHY Update Complete (0x0c)
        Status: Success (0x00)
        Handle: 453 Address: C0:07:E8:2C:B6:EE (OUI C0-07-E8)
        TX PHY: LE 2M (0x02)
        RX PHY: LE 2M (0x02)
zephyr.exe[1921774]: < ACL Data TX: Handle 453 [1/3] flags 0x00 dlen 16                                             #55 12.088690
      LE L2CAP: Connection Parameter Update Request (0x12) ident 1 len 8
        Min interval: 24
        Max interval: 40
        Peripheral latency: 0
        Timeout multiplier: 42
> HCI Event: Number of Completed Packets (0x13) plen 5                                                              #56 12.196223
        Num handles: 1
        Handle: 453 Address: C0:07:E8:2C:B6:EE (OUI C0-07-E8)
        Count: 1
        Buffers: 0/3
        #55: len 16 (1 Kb/s)
        Latency: 107 msec (107-107 msec ~107 msec)
> ACL Data RX: Handle 453 flags 0x02 dlen 10                                                                        #57 12.196366
      LE L2CAP: Connection Parameter Update Response (0x13) ident 1 len 2
        Result: Connection Parameters accepted (0x0000)
zephyr.exe[1921774]: < HCI Command: Host Number of Completed Packets (0x03|0x0035) plen 5                           #58 12.198493
        Num handles: 1
        Handle: 453 Address: C0:07:E8:2C:B6:EE (OUI C0-07-E8)
        Count: 1
> ACL Data RX: Handle 453 flags 0x02 dlen 11                                                                        #59 14.758638
      SMP: Pairing Request (0x01) len 6
        IO capability: KeyboardDisplay (0x04)
        OOB data: Authentication data not present (0x00)
        Authentication requirement: Bonding, No MITM, Legacy, No Keypresses (0x01)
        Max encryption key size: 16
        Initiator key distribution: EncKey IdKey Sign (0x07)
        Responder key distribution: EncKey IdKey Sign (0x07)
zephyr.exe[1921774]: < HCI Command: Host Number of Completed Packets (0x03|0x0035) plen 5                           #60 14.778503
        Num handles: 1
        Handle: 453 Address: C0:07:E8:2C:B6:EE (OUI C0-07-E8)
        Count: 1
zephyr.exe[1921774]: < ACL Data TX: Handle 453 [1/3] flags 0x00 dlen 11                                             #61 14.778915
      SMP: Pairing Response (0x02) len 6
        IO capability: NoInputNoOutput (0x03)
        OOB data: Authentication data not present (0x00)
        Authentication requirement: Bonding, No MITM, Legacy, No Keypresses (0x01)
        Max encryption key size: 16
        Initiator key distribution: EncKey IdKey Sign (0x07)
        Responder key distribution: EncKey Sign (0x05)
> HCI Event: Number of Completed Packets (0x13) plen 5                                                              #62 14.883644
        Num handles: 1
        Handle: 453 Address: C0:07:E8:2C:B6:EE (OUI C0-07-E8)
        Count: 1
        Buffers: 0/3
        #61: len 11 (0 Kb/s)
        Latency: 104 msec (104-107 msec ~106 msec)
> ACL Data RX: Handle 453 flags 0x02 dlen 21                                                                        #63 14.883942
      SMP: Pairing Confirm (0x03) len 16
        Confirm value[16]: 9d1148e7cf00ac34c2c93c272439da5a
zephyr.exe[1921774]: < HCI Command: Host Number of Completed Packets (0x03|0x0035) plen 5                           #64 14.898527
        Num handles: 1
        Handle: 453 Address: C0:07:E8:2C:B6:EE (OUI C0-07-E8)
        Count: 1
zephyr.exe[1921774]: < ACL Data TX: Handle 453 [1/3] flags 0x00 dlen 21                                             #65 14.898660
      SMP: Pairing Confirm (0x03) len 16
        Confirm value[16]: 9cc011b59f9603478615e2e41424d094
> HCI Event: Number of Completed Packets (0x13) plen 5                                                              #66 15.008653
        Num handles: 1
        Handle: 453 Address: C0:07:E8:2C:B6:EE (OUI C0-07-E8)
        Count: 1
        Buffers: 0/3
        #65: len 21 (1 Kb/s)
        Latency: 109 msec (104-109 msec ~108 msec)
> ACL Data RX: Handle 453 flags 0x02 dlen 21                                                                        #67 15.008945
      SMP: Pairing Random (0x04) len 16
        Random value[16]: 514dd2180e6016ce0000000000000000
zephyr.exe[1921774]: < HCI Command: Host Number of Completed Packets (0x03|0x0035) plen 5                           #68 15.018482
        Num handles: 1
        Handle: 453 Address: C0:07:E8:2C:B6:EE (OUI C0-07-E8)
        Count: 1
zephyr.exe[1921774]: < ACL Data TX: Handle 453 [1/3] flags 0x00 dlen 21                                             #69 15.018723
      SMP: Pairing Random (0x04) len 16
        Random value[16]: 8e6108f966a694cbe26df70bb96773e6
> HCI Event: Number of Completed Packets (0x13) plen 5                                                              #70 15.133496
        Num handles: 1
        Handle: 453 Address: C0:07:E8:2C:B6:EE (OUI C0-07-E8)
        Count: 1
        Buffers: 0/3
        #69: len 21 (1 Kb/s)
        Latency: 114 msec (104-114 msec ~111 msec)
> HCI Event: LE Meta Event (0x3e) plen 13                                                                           #71 15.196497
      LE Long Term Key Request (0x05)
        Handle: 453 Address: C0:07:E8:2C:B6:EE (OUI C0-07-E8)
        Random number: 0x0000000000000000
        Encrypted diversifier: 0x0000
zephyr.exe[1921774]: < HCI Command: LE Long Term Key Request Reply (0x08|0x001a) plen 18                            #72 15.198454
        Handle: 453 Address: C0:07:E8:2C:B6:EE (OUI C0-07-E8)
        Long term key[16]: 755ef4baf695e62c7612db91be9c5a4c
> HCI Event: Command Complete (0x0e) plen 6                                                                         #73 15.199429
      LE Long Term Key Request Reply (0x08|0x001a) ncmd 1
        Status: Success (0x00)
        Handle: 453 Address: C0:07:E8:2C:B6:EE (OUI C0-07-E8)
> HCI Event: Encryption Change (0x08) plen 4                                                                        #74 15.508731
        Status: Success (0x00)
        Handle: 453 Address: C0:07:E8:2C:B6:EE (OUI C0-07-E8)
        Encryption: Enabled with AES-CCM (0x01)
zephyr.exe[1921774]: < ACL Data TX: Handle 453 [1/3] flags 0x00 dlen 21                                             #75 15.628480
      SMP: Encryption Information (0x06) len 16
        Long term key[16]: 5da095555cc64d02679f89a05211af56
zephyr.exe[1921774]: < ACL Data TX: Handle 453 [2/3] flags 0x00 dlen 15                                             #76 15.628770
      SMP: Central Identification (0x07) len 10
        EDIV: 0x825e
        Rand: 0x84c81ed264dab3d8
zephyr.exe[1921774]: < ACL Data TX: Handle 453 [3/3] flags 0x00 dlen 21                                             #77 15.628908
      SMP: Signing Information (0x0a) len 16
        Signature key[16]: bc235a02440d0c3424a2acf8fd71a45c
> HCI Event: Number of Completed Packets (0x13) plen 5                                                              #78 15.633931
        Num handles: 1
        Handle: 453 Address: C0:07:E8:2C:B6:EE (OUI C0-07-E8)
        Count: 1
        Buffers: 2/3
        #75: len 21 (33 Kb/s)
        Latency: 5 msec (5-114 msec ~58 msec)
> HCI Event: Number of Completed Packets (0x13) plen 5                                                              #79 15.634410
        Num handles: 1
        Handle: 453 Address: C0:07:E8:2C:B6:EE (OUI C0-07-E8)
        Count: 1
        Buffers: 1/3
        #76: len 15 (24 Kb/s)
        Latency: 5 msec (5-114 msec ~32 msec)
> HCI Event: Number of Completed Packets (0x13) plen 5                                                              #80 15.696218
        Num handles: 1
        Handle: 453 Address: C0:07:E8:2C:B6:EE (OUI C0-07-E8)
        Count: 1
        Buffers: 0/3
        #77: len 21 (2 Kb/s)
        Latency: 67 msec (5-114 msec ~49 msec)
> ACL Data RX: Handle 453 flags 0x02 dlen 21                                                                        #81 15.696447
      SMP: Encryption Information (0x06) len 16
        Long term key[16]: 6622c21769b1927335f02aea515edf10
> ACL Data RX: Handle 453 flags 0x02 dlen 15                                                                        #82 15.696746
      SMP: Central Identification (0x07) len 10
        EDIV: 0x5a98
        Rand: 0xf4868ef3147c514f
> ACL Data RX: Handle 453 flags 0x02 dlen 21                                                                        #83 15.697231
      SMP: Identity Information (0x08) len 16
        Identity resolving key[16]: 17c5edd044ff364b1507edfac7f75273
zephyr.exe[1921774]: < HCI Command: Host Number of Completed Packets (0x03|0x0035) plen 5                           #84 15.698376
        Num handles: 1
        Handle: 453 Address: C0:07:E8:2C:B6:EE (OUI C0-07-E8)
        Count: 1
zephyr.exe[1921774]: < HCI Command: Host Number of Completed Packets (0x03|0x0035) plen 5                           #85 15.698733
        Num handles: 1
        Handle: 453 Address: C0:07:E8:2C:B6:EE (OUI C0-07-E8)
        Count: 1
zephyr.exe[1921774]: < HCI Command: Host Number of Completed Packets (0x03|0x0035) plen 5                           #86 15.698873
        Num handles: 1
        Handle: 453 Address: C0:07:E8:2C:B6:EE (OUI C0-07-E8)
        Count: 1
> ACL Data RX: Handle 453 flags 0x02 dlen 12                                                                        #87 15.699877
      SMP: Identity Address Information (0x09) len 7
        Address: C0:07:E8:2C:B6:EE (OUI C0-07-E8)
zephyr.exe[1921774]: < HCI Command: LE Add Device To Resolving List (0x08|0x0027) plen 39                           #88 15.718477
        Address type: Public (0x00)
        Address: C0:07:E8:2C:B6:EE (OUI C0-07-E8)
        Peer identity resolving key[16]: 17c5edd044ff364b1507edfac7f75273
        Local identity resolving key[16]: 00000000000000000000000000000000
> HCI Event: Command Complete (0x0e) plen 4                                                                         #89 15.719898
      LE Add Device To Resolving List (0x08|0x0027) ncmd 1
        Status: Success (0x00)
zephyr.exe[1921774]: < HCI Command: LE Set Privacy Mode (0x08|0x004e) plen 8                                        #90 15.739101
        Peer Identity address type: Public (0x00)
        Peer Identity address: C0:07:E8:2C:B6:EE (OUI C0-07-E8)
        Privacy Mode: Use Device Privacy (0x01)
> HCI Event: Command Complete (0x0e) plen 4                                                                         #91 15.742089
      LE Set Privacy Mode (0x08|0x004e) ncmd 1
        Status: Success (0x00)
> ACL Data RX: Handle 453 flags 0x02 dlen 21                                                                        #92 15.758779
      SMP: Signing Information (0x0a) len 16
        Signature key[16]: a5b9339821cca7732344ff65a113fa80
> ACL Data RX: Handle 453 flags 0x02 dlen 26                                                                        #93 15.759306
      LE L2CAP: Enhanced Credit Connection Request (0x17) ident 1 len 18
        PSM: 39 (0x0027)
        MTU: 64
        MPS: 64
        Credits: 5
        Source CID: 84
        Source CID: 83
        Source CID: 82
        Source CID: 81
        Source CID: 80
zephyr.exe[1921774]: < HCI Command: LE Set Address Resolution Enable (0x08|0x002d) plen 1                           #94 15.760107
        Address resolution: Enabled (0x01)
> HCI Event: Command Complete (0x0e) plen 4                                                                         #95 15.761287
      LE Set Address Resolution Enable (0x08|0x002d) ncmd 1
        Status: Success (0x00)
zephyr.exe[1921774]: < HCI Command: Host Number of Completed Packets (0x03|0x0035) plen 5                           #96 15.778329
        Num handles: 1
        Handle: 453 Address: C0:07:E8:2C:B6:EE (OUI C0-07-E8)
        Count: 1
zephyr.exe[1921774]: < HCI Command: Host Number of Completed Packets (0x03|0x0035) plen 5                           #97 15.779938
        Num handles: 1
        Handle: 453 Address: C0:07:E8:2C:B6:EE (OUI C0-07-E8)
        Count: 1
zephyr.exe[1921774]: < HCI Command: Host Number of Completed Packets (0x03|0x0035) plen 5                           #98 15.781277
        Num handles: 1
        Handle: 453 Address: C0:07:E8:2C:B6:EE (OUI C0-07-E8)
        Count: 1
zephyr.exe[1921774]: < ACL Data TX: Handle 453 [1/3] flags 0x00 dlen 26                                             #99 15.782539
      LE L2CAP: Enhanced Credit Connection Response (0x18) ident 1 len 18
        MTU: 249
        MPS: 251
        Credits: 1
        Result: Connection successful (0x0000)
        Destination CID: 64
        Destination CID: 65
        Destination CID: 66
        Destination CID: 67
        Destination CID: 68
> HCI Event: Number of Completed Packets (0x13) plen 5                                                             #100 15.883526
        Num handles: 1
        Handle: 453 Address: C0:07:E8:2C:B6:EE (OUI C0-07-E8)
        Count: 1
        Buffers: 0/3
        #99: len 26 (2 Kb/s)
        Latency: 100 msec (5-114 msec ~75 msec)
zephyr.exe[1921774]: < ACL Data TX: Handle 453 [1/3] flags 0x00 dlen 13                                            #101 18.158476
      Channel: 80 len 9 sdu 7 [PSM 39 mode Enhanced Credit (0x81)] {chan 4}
      ATT: Read By Type Request (0x08) len 6
        Handle range: 0x0001-0x01f3
        Attribute type: Characteristic (0x2803)
> HCI Event: Number of Completed Packets (0x13) plen 5                                                             #102 18.258691
        Num handles: 1
        Handle: 453 Address: C0:07:E8:2C:B6:EE (OUI C0-07-E8)
        Count: 1
        Buffers: 0/3
        #101: len 13 (1 Kb/s)
        Latency: 100 msec (5-114 msec ~87 msec)
        Channel: 80 [PSM 39 mode Enhanced Credit (0x81)] {chan 4}
        Channel Latency: 100 msec (100-100 msec ~100 msec)
> ACL Data RX: Handle 453 flags 0x02 dlen 15                                                                       #103 18.259001
      Channel: 68 len 11 sdu 9 [PSM 39 mode Enhanced Credit (0x81)] {chan 4}
      ATT: Read By Type Response (0x09) len 8
        Attribute data length: 7
        Attribute data list: 1 entry
        Handle: 0x0003
        Value[5]: 0204000cb0
            Properties: 0x02
              Read (0x02)
            Value Handle: 0x0004
            Value UUID: Unknown (0xb00c)
zephyr.exe[1921774]: < HCI Command: Host Number of Completed Packets (0x03|0x0035) plen 5                          #104 18.278570
        Num handles: 1
        Handle: 453 Address: C0:07:E8:2C:B6:EE (OUI C0-07-E8)
        Count: 1
zephyr.exe[1921774]: < ACL Data TX: Handle 453 [1/3] flags 0x00 dlen 13                                            #105 18.279108
      Channel: 80 len 9 sdu 7 [PSM 39 mode Enhanced Credit (0x81)] {chan 4}
      ATT: Read By Type Request (0x08) len 6
        Handle range: 0x0004-0x01f3
        Attribute type: Characteristic (0x2803)
zephyr.exe[1921774]: < ACL Data TX: Handle 453 [2/3] flags 0x00 dlen 12                                            #106 18.279574
      LE L2CAP: LE Flow Control Credit (0x16) ident 2 len 4
        Source CID: 68
        Credits: 1
> HCI Event: Number of Completed Packets (0x13) plen 5                                                             #107 18.321524
        Num handles: 1
        Handle: 453 Address: C0:07:E8:2C:B6:EE (OUI C0-07-E8)
        Count: 1
        Buffers: 1/3
        #105: len 13 (2 Kb/s)
        Latency: 42 msec (5-114 msec ~65 msec)
        Channel: 80 [PSM 39 mode Enhanced Credit (0x81)] {chan 4}
        Channel Latency: 42 msec (42-100 msec ~71 msec)
> HCI Event: Number of Completed Packets (0x13) plen 5                                                             #108 18.383721
        Num handles: 1
        Handle: 453 Address: C0:07:E8:2C:B6:EE (OUI C0-07-E8)
        Count: 1
        Buffers: 0/3
        #106: len 12 (0 Kb/s)
        Latency: 104 msec (5-114 msec ~84 msec)
        Channel: 80 [PSM 39 mode Enhanced Credit (0x81)] {chan 4}
        Channel Latency: 104 msec (42-104 msec ~87 msec)
> ACL Data RX: Handle 453 flags 0x02 dlen 27                                                                       #109 18.383989
> ACL Data RX: Handle 453 flags 0x01 dlen 2                                                                        #110 18.384064
      Channel: 68 len 25 sdu 23 [PSM 39 mode Enhanced Credit (0x81)] {chan 4}
      ATT: Read By Type Response (0x09) len 22
        Attribute data length: 21
        Attribute data list: 1 entry
        Handle: 0x0005
        Value[19]: 020600efcdab8967452301000000000bb00000
            Properties: 0x02
              Read (0x02)
            Value Handle: 0x0006
            Value UUID: Vendor specific (0000b00b-0000-0000-0123-456789abcdef)
zephyr.exe[1921774]: < HCI Command: Host Number of Completed Packets (0x03|0x0035) plen 5                          #111 18.398647
        Num handles: 1
        Handle: 453 Address: C0:07:E8:2C:B6:EE (OUI C0-07-E8)
        Count: 1
zephyr.exe[1921774]: < HCI Command: Host Number of Completed Packets (0x03|0x0035) plen 5                          #112 18.400243
        Num handles: 1
        Handle: 453 Address: C0:07:E8:2C:B6:EE (OUI C0-07-E8)
        Count: 1
zephyr.exe[1921774]: < ACL Data TX: Handle 453 [1/3] flags 0x00 dlen 13                                            #113 18.401275
      Channel: 80 len 9 sdu 7 [PSM 39 mode Enhanced Credit (0x81)] {chan 4}
      ATT: Read By Type Request (0x08) len 6
        Handle range: 0x0006-0x01f3
        Attribute type: Characteristic (0x2803)
zephyr.exe[1921774]: < ACL Data TX: Handle 453 [2/3] flags 0x00 dlen 12                                            #114 18.402206
      LE L2CAP: LE Flow Control Credit (0x16) ident 3 len 4
        Source CID: 68
        Credits: 1
> HCI Event: Number of Completed Packets (0x13) plen 5                                                             #115 18.446475
        Num handles: 1
        Handle: 453 Address: C0:07:E8:2C:B6:EE (OUI C0-07-E8)
        Count: 1
        Buffers: 1/3
        #113: len 13 (2 Kb/s)
        Latency: 45 msec (5-114 msec ~64 msec)
        Channel: 80 [PSM 39 mode Enhanced Credit (0x81)] {chan 4}
        Channel Latency: 45 msec (42-104 msec ~66 msec)
> HCI Event: Number of Completed Packets (0x13) plen 5                                                             #116 18.508642
        Num handles: 1
        Handle: 453 Address: C0:07:E8:2C:B6:EE (OUI C0-07-E8)
        Count: 1
        Buffers: 0/3
        #114: len 12 (0 Kb/s)
        Latency: 106 msec (5-114 msec ~85 msec)
> ACL Data RX: Handle 453 flags 0x02 dlen 27                                                                       #117 18.509197
> ACL Data RX: Handle 453 flags 0x01 dlen 27                                                                       #118 18.509473
> ACL Data RX: Handle 453 flags 0x01 dlen 10                                                                       #119 18.509681
      Channel: 68 len 60 sdu 58 [PSM 39 mode Enhanced Credit (0x81)] {chan 4}
      ATT: Read By Type Response (0x09) len 57
        Attribute data length: 7
        Attribute data list: 8 entries
        Handle: 0x0021
        Value[5]: 202200052a
            Properties: 0x20
              Indicate (0x20)
            Value Handle: 0x0022
            Value UUID: Service Changed (0x2a05)
        Handle: 0x0024
        Value[5]: 0a2500292b
            Properties: 0x0a
              Read (0x02)
              Write (0x08)
            Value Handle: 0x0025
            Value UUID: Client Supported Features (0x2b29)
        Handle: 0x0026
        Value[5]: 0227003a2b
            Properties: 0x02
              Read (0x02)
            Value Handle: 0x0027
            Value UUID: Server Supported Features (0x2b3a)
        Handle: 0x0028
        Value[5]: 0229002a2b
            Properties: 0x02
              Read (0x02)
            Value Handle: 0x0029
            Value UUID: Database Hash (0x2b2a)
        Handle: 0x0042
        Value[5]: 02430001b0
            Properties: 0x02
              Read (0x02)
            Value Handle: 0x0043
            Value UUID: Unknown (0xb001)
        Handle: 0x0044
        Value[5]: 0a450002b0
            Properties: 0x0a
              Read (0x02)
              Write (0x08)
            Value Handle: 0x0045
            Value UUID: Unknown (0xb002)
        Handle: 0x0046
        Value[5]: 08470002b0
            Properties: 0x08
              Write (0x08)
            Value Handle: 0x0047
            Value UUID: Unknown (0xb002)
        Handle: 0x0048
        Value[5]: 08490003b0
            Properties: 0x08
              Write (0x08)
            Value Handle: 0x0049
            Value UUID: Unknown (0xb003)
zephyr.exe[1921774]: < HCI Command: Host Number of Completed Packets (0x03|0x0035) plen 5                          #120 18.518621
        Num handles: 1
        Handle: 453 Address: C0:07:E8:2C:B6:EE (OUI C0-07-E8)
        Count: 1
zephyr.exe[1921774]: < HCI Command: Host Number of Completed Packets (0x03|0x0035) plen 5                          #121 18.518857
        Num handles: 1
        Handle: 453 Address: C0:07:E8:2C:B6:EE (OUI C0-07-E8)
        Count: 1
zephyr.exe[1921774]: < HCI Command: Host Number of Completed Packets (0x03|0x0035) plen 5                          #122 18.519022
        Num handles: 1
        Handle: 453 Address: C0:07:E8:2C:B6:EE (OUI C0-07-E8)
        Count: 1
zephyr.exe[1921774]: < ACL Data TX: Handle 453 [1/3] flags 0x00 dlen 13                                            #123 18.519104
      Channel: 80 len 9 sdu 7 [PSM 39 mode Enhanced Credit (0x81)] {chan 4}
      ATT: Read By Type Request (0x08) len 6
        Handle range: 0x0049-0x01f3
        Attribute type: Characteristic (0x2803)
zephyr.exe[1921774]: < ACL Data TX: Handle 453 [2/3] flags 0x00 dlen 12                                            #124 18.519137
      LE L2CAP: LE Flow Control Credit (0x16) ident 4 len 4
        Source CID: 68
        Credits: 1
> HCI Event: Number of Completed Packets (0x13) plen 5                                                             #125 18.571485
        Num handles: 1
        Handle: 453 Address: C0:07:E8:2C:B6:EE (OUI C0-07-E8)
        Count: 1
        Buffers: 1/3
        #123: len 13 (2 Kb/s)
        Latency: 52 msec (5-114 msec ~69 msec)
        Channel: 80 [PSM 39 mode Enhanced Credit (0x81)] {chan 4}
        Channel Latency: 52 msec (42-104 msec ~59 msec)
> HCI Event: Number of Completed Packets (0x13) plen 5                                                             #126 18.633719
        Num handles: 1
        Handle: 453 Address: C0:07:E8:2C:B6:EE (OUI C0-07-E8)
        Count: 1
        Buffers: 0/3
        #124: len 12 (0 Kb/s)
        Latency: 114 msec (5-114 msec ~91 msec)
        Channel: 80 [PSM 39 mode Enhanced Credit (0x81)] {chan 4}
        Channel Latency: 114 msec (42-114 msec ~87 msec)
> ACL Data RX: Handle 453 flags 0x02 dlen 12                                                                       #127 18.633858
      LE L2CAP: LE Flow Control Credit (0x16) ident 2 len 4
        Source CID: 80
        Credits: 10
> ACL Data RX: Handle 453 flags 0x02 dlen 27                                                                       #128 18.634382
> ACL Data RX: Handle 453 flags 0x01 dlen 27                                                                       #129 18.634840
zephyr.exe[1921774]: < HCI Command: Host Number of Completed Packets (0x03|0x0035) plen 5                          #130 18.638455
        Num handles: 1
        Handle: 453 Address: C0:07:E8:2C:B6:EE (OUI C0-07-E8)
        Count: 1
zephyr.exe[1921774]: < HCI Command: Host Number of Completed Packets (0x03|0x0035) plen 5                          #131 18.638579
        Num handles: 1
        Handle: 453 Address: C0:07:E8:2C:B6:EE (OUI C0-07-E8)
        Count: 1
> ACL Data RX: Handle 453 flags 0x01 dlen 10                                                                       #132 18.639380
      Channel: 68 len 60 sdu 58 [PSM 39 mode Enhanced Credit (0x81)] {chan 4}
      ATT: Read By Type Response (0x09) len 57
        Attribute data length: 7
        Attribute data list: 8 entries
        Handle: 0x0061
        Value[5]: 08620007b0
            Properties: 0x08
              Write (0x08)
            Value Handle: 0x0062
            Value UUID: Unknown (0xb007)
        Handle: 0x0081
        Value[5]: 028200002a
            Properties: 0x02
              Read (0x02)
            Value Handle: 0x0082
            Value UUID: Device Name (0x2a00)
        Handle: 0x0083
        Value[5]: 028400012a
            Properties: 0x02
              Read (0x02)
            Value Handle: 0x0084
            Value UUID: Appearance (0x2a01)
        Handle: 0x0085
        Value[5]: 028600042a
            Properties: 0x02
              Read (0x02)
            Value Handle: 0x0086
            Value UUID: Peripheral Preferred Connection Parameters (0x2a04)
        Handle: 0x00a1
        Value[5]: 3ea20006b0
            Properties: 0x3e
              Read (0x02)
              Write Without Response (0x04)
              Write (0x08)
              Notify (0x10)
              Indicate (0x20)
            Value Handle: 0x00a2
            Value UUID: Unknown (0xb006)
        Handle: 0x00c1
        Value[5]: 0ac20004b0
            Properties: 0x0a
              Read (0x02)
              Write (0x08)
            Value Handle: 0x00c2
            Value UUID: Unknown (0xb004)
        Handle: 0x00c3
        Value[5]: 0ac40004b0
            Properties: 0x0a
              Read (0x02)
              Write (0x08)
            Value Handle: 0x00c4
            Value UUID: Unknown (0xb004)
        Handle: 0x00c6
        Value[5]: 00c70004b0
            Properties: 0x00
            Value Handle: 0x00c7
            Value UUID: Unknown (0xb004)
zephyr.exe[1921774]: < HCI Command: Host Number of Completed Packets (0x03|0x0035) plen 5                          #133 18.658527
        Num handles: 1
        Handle: 453 Address: C0:07:E8:2C:B6:EE (OUI C0-07-E8)
        Count: 1
zephyr.exe[1921774]: < HCI Command: Host Number of Completed Packets (0x03|0x0035) plen 5                          #134 18.658637
        Num handles: 1
        Handle: 453 Address: C0:07:E8:2C:B6:EE (OUI C0-07-E8)
        Count: 1
zephyr.exe[1921774]: < ACL Data TX: Handle 453 [1/3] flags 0x00 dlen 13                                            #135 18.658660
      Channel: 80 len 9 sdu 7 [PSM 39 mode Enhanced Credit (0x81)] {chan 4}
      ATT: Read By Type Request (0x08) len 6
        Handle range: 0x00c7-0x01f3
        Attribute type: Characteristic (0x2803)
zephyr.exe[1921774]: < ACL Data TX: Handle 453 [2/3] flags 0x00 dlen 12                                            #136 18.659040
      LE L2CAP: LE Flow Control Credit (0x16) ident 5 len 4
        Source CID: 68
        Credits: 1
> HCI Event: Number of Completed Packets (0x13) plen 5                                                             #137 18.696417
        Num handles: 1
        Handle: 453 Address: C0:07:E8:2C:B6:EE (OUI C0-07-E8)
        Count: 1
        Buffers: 1/3
        #135: len 13 (2 Kb/s)
        Latency: 37 msec (5-114 msec ~64 msec)
> HCI Event: Number of Completed Packets (0x13) plen 5                                                             #138 18.758711
        Num handles: 1
        Handle: 453 Address: C0:07:E8:2C:B6:EE (OUI C0-07-E8)
        Count: 1
        Buffers: 0/3
        #136: len 12 (0 Kb/s)
        Latency: 99 msec (5-114 msec ~82 msec)
        Channel: 80 [PSM 39 mode Enhanced Credit (0x81)] {chan 4}
        Channel Latency: 99 msec (42-114 msec ~93 msec)
> ACL Data RX: Handle 453 flags 0x02 dlen 27                                                                       #139 18.758995
> ACL Data RX: Handle 453 flags 0x01 dlen 2                                                                        #140 18.759056
      Channel: 68 len 25 sdu 23 [PSM 39 mode Enhanced Credit (0x81)] {chan 4}
      ATT: Read By Type Response (0x09) len 22
        Attribute data length: 7
        Attribute data list: 3 entries
        Handle: 0x00c9
        Value[5]: 02ca0004b0
            Properties: 0x02
              Read (0x02)
            Value Handle: 0x00ca
            Value UUID: Unknown (0xb004)
        Handle: 0x00e1
        Value[5]: 8ae20005b0
            Properties: 0x8a
              Read (0x02)
              Write (0x08)
            Unknown fields (0x80)
            Value Handle: 0x00e2
            Value UUID: Unknown (0xb005)
        Handle: 0x0101
        Value[5]: 0a020108b0
            Properties: 0x0a
              Read (0x02)
              Write (0x08)
            Value Handle: 0x0102
            Value UUID: Unknown (0xb008)
zephyr.exe[1921774]: < HCI Command: Host Number of Completed Packets (0x03|0x0035) plen 5                          #141 18.778662
        Num handles: 1
        Handle: 453 Address: C0:07:E8:2C:B6:EE (OUI C0-07-E8)
        Count: 1
zephyr.exe[1921774]: < HCI Command: Host Number of Completed Packets (0x03|0x0035) plen 5                          #142 18.778839
        Num handles: 1
        Handle: 453 Address: C0:07:E8:2C:B6:EE (OUI C0-07-E8)
        Count: 1
zephyr.exe[1921774]: < ACL Data TX: Handle 453 [1/3] flags 0x00 dlen 13                                            #143 18.778874
      Channel: 80 len 9 sdu 7 [PSM 39 mode Enhanced Credit (0x81)] {chan 4}
      ATT: Read By Type Request (0x08) len 6
        Handle range: 0x0102-0x01f3
        Attribute type: Characteristic (0x2803)
zephyr.exe[1921774]: < ACL Data TX: Handle 453 [2/3] flags 0x00 dlen 12                                            #144 18.778890
      LE L2CAP: LE Flow Control Credit (0x16) ident 6 len 4
        Source CID: 68
        Credits: 1
> HCI Event: Number of Completed Packets (0x13) plen 5                                                             #145 18.821486
        Num handles: 1
        Handle: 453 Address: C0:07:E8:2C:B6:EE (OUI C0-07-E8)
        Count: 1
        Buffers: 1/3
        #143: len 13 (2 Kb/s)
        Latency: 42 msec (5-114 msec ~62 msec)
        Channel: 80 [PSM 39 mode Enhanced Credit (0x81)] {chan 4}
        Channel Latency: 42 msec (42-114 msec ~67 msec)
> HCI Event: Number of Completed Packets (0x13) plen 5                                                             #146 18.883731
        Num handles: 1
        Handle: 453 Address: C0:07:E8:2C:B6:EE (OUI C0-07-E8)
        Count: 1
        Buffers: 0/3
        #144: len 12 (0 Kb/s)
        Latency: 104 msec (5-114 msec ~83 msec)
> ACL Data RX: Handle 453 flags 0x02 dlen 27                                                                       #147 18.883997
> ACL Data RX: Handle 453 flags 0x01 dlen 2                                                                        #148 18.884118
      Channel: 68 len 25 sdu 23 [PSM 39 mode Enhanced Credit (0x81)] {chan 4}
      ATT: Read By Type Response (0x09) len 22
        Attribute data length: 21
        Attribute data list: 1 entry
        Handle: 0x0122
        Value[19]: 8a2301efcdab89674523010000000009b00000
            Properties: 0x8a
              Read (0x02)
              Write (0x08)
            Unknown fields (0x80)
            Value Handle: 0x0123
            Value UUID: Vendor specific (0000b009-0000-0000-0123-456789abcdef)
zephyr.exe[1921774]: < HCI Command: Host Number of Completed Packets (0x03|0x0035) plen 5                          #149 18.898629
        Num handles: 1
        Handle: 453 Address: C0:07:E8:2C:B6:EE (OUI C0-07-E8)
        Count: 1
zephyr.exe[1921774]: < HCI Command: Host Number of Completed Packets (0x03|0x0035) plen 5                          #150 18.898729
        Num handles: 1
        Handle: 453 Address: C0:07:E8:2C:B6:EE (OUI C0-07-E8)
        Count: 1
zephyr.exe[1921774]: < ACL Data TX: Handle 453 [1/3] flags 0x00 dlen 13                                            #151 18.898748
      Channel: 80 len 9 sdu 7 [PSM 39 mode Enhanced Credit (0x81)] {chan 4}
      ATT: Read By Type Request (0x08) len 6
        Handle range: 0x0123-0x01f3
        Attribute type: Characteristic (0x2803)
zephyr.exe[1921774]: < ACL Data TX: Handle 453 [2/3] flags 0x00 dlen 12                                            #152 18.898764
      LE L2CAP: LE Flow Control Credit (0x16) ident 7 len 4
        Source CID: 68
        Credits: 1
> HCI Event: Number of Completed Packets (0x13) plen 5                                                             #153 18.946513
        Num handles: 1
        Handle: 453 Address: C0:07:E8:2C:B6:EE (OUI C0-07-E8)
        Count: 1
        Buffers: 1/3
        #151: len 13 (2 Kb/s)
        Latency: 47 msec (5-114 msec ~65 msec)
        Channel: 80 [PSM 39 mode Enhanced Credit (0x81)] {chan 4}
        Channel Latency: 47 msec (42-114 msec ~57 msec)
> HCI Event: Number of Completed Packets (0x13) plen 5                                                             #154 19.008732
        Num handles: 1
        Handle: 453 Address: C0:07:E8:2C:B6:EE (OUI C0-07-E8)
        Count: 1
        Buffers: 0/3
        #152: len 12 (0 Kb/s)
        Latency: 109 msec (5-114 msec ~87 msec)
        Channel: 80 [PSM 39 mode Enhanced Credit (0x81)] {chan 4}
        Channel Latency: 109 msec (42-114 msec ~83 msec)
> ACL Data RX: Handle 453 flags 0x02 dlen 27                                                                       #155 19.009035
> ACL Data RX: Handle 453 flags 0x01 dlen 27                                                                       #156 19.009384
> ACL Data RX: Handle 453 flags 0x01 dlen 10                                                                       #157 19.009690
      Channel: 68 len 60 sdu 58 [PSM 39 mode Enhanced Credit (0x81)] {chan 4}
      ATT: Read By Type Response (0x09) len 57
        Attribute data length: 7
        Attribute data list: 8 entries
        Handle: 0x0141
        Value[5]: 0242010eb0
            Properties: 0x02
              Read (0x02)
            Value Handle: 0x0142
            Value UUID: Unknown (0xb00e)
        Handle: 0x0144
        Value[5]: 0a45010fb0
            Properties: 0x0a
              Read (0x02)
              Write (0x08)
            Value Handle: 0x0145
            Value UUID: Unknown (0xb00f)
        Handle: 0x0147
        Value[5]: 0a480106b0
            Properties: 0x0a
              Read (0x02)
              Write (0x08)
            Value Handle: 0x0148
            Value UUID: Unknown (0xb006)
        Handle: 0x014a
        Value[5]: 0a4b0107b0
            Properties: 0x0a
              Read (0x02)
              Write (0x08)
            Value Handle: 0x014b
            Value UUID: Unknown (0xb007)
        Handle: 0x014d
        Value[5]: 024e0110b0
            Properties: 0x02
              Read (0x02)
            Value Handle: 0x014e
            Value UUID: Unknown (0xb010)
        Handle: 0x0150
        Value[5]: 42510111b0
            Properties: 0x42
              Read (0x02)
              Authorize (0x40)
              Extended Properties (0x80)
            Value Handle: 0x0151
            Value UUID: Unknown (0xb011)
        Handle: 0x0152
        Value[5]: 02530110b0
            Properties: 0x02
              Read (0x02)
            Value Handle: 0x0153
            Value UUID: Unknown (0xb010)
        Handle: 0x0155
        Value[5]: 02560110b0
            Properties: 0x02
              Read (0x02)
            Value Handle: 0x0156
            Value UUID: Unknown (0xb010)
zephyr.exe[1921774]: < HCI Command: Host Number of Completed Packets (0x03|0x0035) plen 5                          #158 19.018625
        Num handles: 1
        Handle: 453 Address: C0:07:E8:2C:B6:EE (OUI C0-07-E8)
        Count: 1
zephyr.exe[1921774]: < HCI Command: Host Number of Completed Packets (0x03|0x0035) plen 5                          #159 19.019212
        Num handles: 1
        Handle: 453 Address: C0:07:E8:2C:B6:EE (OUI C0-07-E8)
        Count: 1
zephyr.exe[1921774]: < HCI Command: Host Number of Completed Packets (0x03|0x0035) plen 5                          #160 19.019399
        Num handles: 1
        Handle: 453 Address: C0:07:E8:2C:B6:EE (OUI C0-07-E8)
        Count: 1
zephyr.exe[1921774]: < ACL Data TX: Handle 453 [1/3] flags 0x00 dlen 13                                            #161 19.019530
      Channel: 80 len 9 sdu 7 [PSM 39 mode Enhanced Credit (0x81)] {chan 4}
      ATT: Read By Type Request (0x08) len 6
        Handle range: 0x0156-0x01f3
        Attribute type: Characteristic (0x2803)
zephyr.exe[1921774]: < ACL Data TX: Handle 453 [2/3] flags 0x00 dlen 12                                            #162 19.019565
      LE L2CAP: LE Flow Control Credit (0x16) ident 8 len 4
        Source CID: 68
        Credits: 1
> HCI Event: Number of Completed Packets (0x13) plen 5                                                             #163 19.071423
        Num handles: 1
        Handle: 453 Address: C0:07:E8:2C:B6:EE (OUI C0-07-E8)
        Count: 1
        Buffers: 1/3
        #161: len 13 (2 Kb/s)
        Latency: 51 msec (5-114 msec ~69 msec)
> HCI Event: Number of Completed Packets (0x13) plen 5                                                             #164 19.133699
        Num handles: 1
        Handle: 453 Address: C0:07:E8:2C:B6:EE (OUI C0-07-E8)
        Count: 1
        Buffers: 0/3
        #162: len 12 (0 Kb/s)
        Latency: 114 msec (5-114 msec ~91 msec)
        Channel: 80 [PSM 39 mode Enhanced Credit (0x81)] {chan 4}
        Channel Latency: 114 msec (42-114 msec ~99 msec)
> ACL Data RX: Handle 453 flags 0x02 dlen 27                                                                       #165 19.133974
> ACL Data RX: Handle 453 flags 0x01 dlen 27                                                                       #166 19.134469
> ACL Data RX: Handle 453 flags 0x01 dlen 10                                                                       #167 19.134681
      Channel: 68 len 60 sdu 58 [PSM 39 mode Enhanced Credit (0x81)] {chan 4}
      ATT: Read By Type Response (0x09) len 57
        Attribute data length: 7
        Attribute data list: 8 entries
        Handle: 0x0158
        Value[5]: 02590110b0
            Properties: 0x02
              Read (0x02)
            Value Handle: 0x0159
            Value UUID: Unknown (0xb010)
        Handle: 0x015b
        Value[5]: 025c0110b0
            Properties: 0x02
              Read (0x02)
            Value Handle: 0x015c
            Value UUID: Unknown (0xb010)
        Handle: 0x0171
        Value[5]: 0272010ab0
            Properties: 0x02
              Read (0x02)
            Value Handle: 0x0172
            Value UUID: Unknown (0xb00a)
        Handle: 0x0173
        Value[5]: 0a740102b0
            Properties: 0x0a
              Read (0x02)
              Write (0x08)
            Value Handle: 0x0174
            Value UUID: Unknown (0xb002)
        Handle: 0x0176
        Value[5]: 0a770102b0
            Properties: 0x0a
              Read (0x02)
              Write (0x08)
            Value Handle: 0x0177
            Value UUID: Unknown (0xb002)
        Handle: 0x0179
        Value[5]: 0a7a0102b0
            Properties: 0x0a
              Read (0x02)
              Write (0x08)
            Value Handle: 0x017a
            Value UUID: Unknown (0xb002)
        Handle: 0x017c
        Value[5]: 0a7d0102b0
            Properties: 0x0a
              Read (0x02)
              Write (0x08)
            Value Handle: 0x017d
            Value UUID: Unknown (0xb002)
        Handle: 0x017f
        Value[5]: 0a800102b0
            Properties: 0x0a
              Read (0x02)
              Write (0x08)
            Value Handle: 0x0180
            Value UUID: Unknown (0xb002)
zephyr.exe[1921774]: < HCI Command: Host Number of Completed Packets (0x03|0x0035) plen 5                          #168 19.138626
        Num handles: 1
        Handle: 453 Address: C0:07:E8:2C:B6:EE (OUI C0-07-E8)
        Count: 1
zephyr.exe[1921774]: < HCI Command: Host Number of Completed Packets (0x03|0x0035) plen 5                          #169 19.138756
        Num handles: 1
        Handle: 453 Address: C0:07:E8:2C:B6:EE (OUI C0-07-E8)
        Count: 1
zephyr.exe[1921774]: < HCI Command: Host Number of Completed Packets (0x03|0x0035) plen 5                          #170 19.138781
        Num handles: 1
        Handle: 453 Address: C0:07:E8:2C:B6:EE (OUI C0-07-E8)
        Count: 1
zephyr.exe[1921774]: < ACL Data TX: Handle 453 [1/3] flags 0x00 dlen 13                                            #171 19.138797
      Channel: 80 len 9 sdu 7 [PSM 39 mode Enhanced Credit (0x81)] {chan 4}
      ATT: Read By Type Request (0x08) len 6
        Handle range: 0x0180-0x01f3
        Attribute type: Characteristic (0x2803)
zephyr.exe[1921774]: < ACL Data TX: Handle 453 [2/3] flags 0x00 dlen 12                                            #172 19.138811
      LE L2CAP: LE Flow Control Credit (0x16) ident 9 len 4
        Source CID: 68
        Credits: 1
> HCI Event: Number of Completed Packets (0x13) plen 5                                                             #173 19.196486
        Num handles: 1
        Handle: 453 Address: C0:07:E8:2C:B6:EE (OUI C0-07-E8)
        Count: 1
        Buffers: 1/3
        #171: len 13 (1 Kb/s)
        Latency: 57 msec (5-114 msec ~74 msec)
        Channel: 80 [PSM 39 mode Enhanced Credit (0x81)] {chan 4}
        Channel Latency: 57 msec (42-114 msec ~78 msec)
> HCI Event: Number of Completed Packets (0x13) plen 5                                                             #174 19.258736
        Num handles: 1
        Handle: 453 Address: C0:07:E8:2C:B6:EE (OUI C0-07-E8)
        Count: 1
        Buffers: 0/3
        #172: len 12 (0 Kb/s)
        Latency: 119 msec (5-119 msec ~97 msec)
> ACL Data RX: Handle 453 flags 0x02 dlen 27                                                                       #175 19.259018
> ACL Data RX: Handle 453 flags 0x01 dlen 27                                                                       #176 19.259410
> ACL Data RX: Handle 453 flags 0x01 dlen 10                                                                       #177 19.259640
      Channel: 68 len 60 sdu 58 [PSM 39 mode Enhanced Credit (0x81)] {chan 4}
      ATT: Read By Type Response (0x09) len 57
        Attribute data length: 7
        Attribute data list: 8 entries
        Handle: 0x0182
        Value[5]: 0a830102b0
            Properties: 0x0a
              Read (0x02)
              Write (0x08)
            Value Handle: 0x0183
            Value UUID: Unknown (0xb002)
        Handle: 0x0185
        Value[5]: 0a860102b0
            Properties: 0x0a
              Read (0x02)
              Write (0x08)
            Value Handle: 0x0186
            Value UUID: Unknown (0xb002)
        Handle: 0x0188
        Value[5]: 0a890102b0
            Properties: 0x0a
              Read (0x02)
              Write (0x08)
            Value Handle: 0x0189
            Value UUID: Unknown (0xb002)
        Handle: 0x018b
        Value[5]: 0a8c0102b0
            Properties: 0x0a
              Read (0x02)
              Write (0x08)
            Value Handle: 0x018c
            Value UUID: Unknown (0xb002)
        Handle: 0x018e
        Value[5]: 0a8f0104b0
            Properties: 0x0a
              Read (0x02)
              Write (0x08)
            Value Handle: 0x018f
            Value UUID: Unknown (0xb004)
        Handle: 0x0191
        Value[5]: 0a920104b0
            Properties: 0x0a
              Read (0x02)
              Write (0x08)
            Value Handle: 0x0192
            Value UUID: Unknown (0xb004)
        Handle: 0x0194
        Value[5]: 0a950104b0
            Properties: 0x0a
              Read (0x02)
              Write (0x08)
            Value Handle: 0x0195
            Value UUID: Unknown (0xb004)
        Handle: 0x0197
        Value[5]: 0a980101b0
            Properties: 0x0a
              Read (0x02)
              Write (0x08)
            Value Handle: 0x0198
            Value UUID: Unknown (0xb001)
zephyr.exe[1921774]: < HCI Command: Host Number of Completed Packets (0x03|0x0035) plen 5                          #178 19.278651
        Num handles: 1
        Handle: 453 Address: C0:07:E8:2C:B6:EE (OUI C0-07-E8)
        Count: 1
zephyr.exe[1921774]: < HCI Command: Host Number of Completed Packets (0x03|0x0035) plen 5                          #179 19.278775
        Num handles: 1
        Handle: 453 Address: C0:07:E8:2C:B6:EE (OUI C0-07-E8)
        Count: 1
zephyr.exe[1921774]: < HCI Command: Host Number of Completed Packets (0x03|0x0035) plen 5                          #180 19.278798
        Num handles: 1
        Handle: 453 Address: C0:07:E8:2C:B6:EE (OUI C0-07-E8)
        Count: 1
zephyr.exe[1921774]: < ACL Data TX: Handle 453 [1/3] flags 0x00 dlen 13                                            #181 19.279481
      Channel: 80 len 9 sdu 7 [PSM 39 mode Enhanced Credit (0x81)] {chan 4}
      ATT: Read By Type Request (0x08) len 6
        Handle range: 0x0198-0x01f3
        Attribute type: Characteristic (0x2803)
zephyr.exe[1921774]: < ACL Data TX: Handle 453 [2/3] flags 0x00 dlen 12                                            #182 19.279553
      LE L2CAP: LE Flow Control Credit (0x16) ident 10 len 4
        Source CID: 68
        Credits: 1
> HCI Event: Number of Completed Packets (0x13) plen 5                                                             #183 19.321519
        Num handles: 1
        Handle: 453 Address: C0:07:E8:2C:B6:EE (OUI C0-07-E8)
        Count: 1
        Buffers: 1/3
        #181: len 13 (2 Kb/s)
        Latency: 42 msec (5-119 msec ~69 msec)
        Channel: 80 [PSM 39 mode Enhanced Credit (0x81)] {chan 4}
        Channel Latency: 42 msec (42-114 msec ~60 msec)
> HCI Event: Number of Completed Packets (0x13) plen 5                                                             #184 19.383802
        Num handles: 1
        Handle: 453 Address: C0:07:E8:2C:B6:EE (OUI C0-07-E8)
        Count: 1
        Buffers: 0/3
        #182: len 12 (0 Kb/s)
        Latency: 104 msec (5-119 msec ~86 msec)
        Channel: 80 [PSM 39 mode Enhanced Credit (0x81)] {chan 4}
        Channel Latency: 104 msec (42-114 msec ~82 msec)
> ACL Data RX: Handle 453 flags 0x02 dlen 27                                                                       #185 19.384015
> ACL Data RX: Handle 453 flags 0x01 dlen 27                                                                       #186 19.384442
> ACL Data RX: Handle 453 flags 0x01 dlen 10                                                                       #187 19.384683
      Channel: 68 len 60 sdu 58 [PSM 39 mode Enhanced Credit (0x81)] {chan 4}
      ATT: Read By Type Response (0x09) len 57
        Attribute data length: 7
        Attribute data list: 8 entries
        Handle: 0x019a
        Value[5]: 0a9b0102b0
            Properties: 0x0a
              Read (0x02)
              Write (0x08)
            Value Handle: 0x019b
            Value UUID: Unknown (0xb002)
        Handle: 0x019d
        Value[5]: 0a9e0102b0
            Properties: 0x0a
              Read (0x02)
              Write (0x08)
            Value Handle: 0x019e
            Value UUID: Unknown (0xb002)
        Handle: 0x01a0
        Value[5]: 0aa10102b0
            Properties: 0x0a
              Read (0x02)
              Write (0x08)
            Value Handle: 0x01a1
            Value UUID: Unknown (0xb002)
        Handle: 0x01a3
        Value[5]: 0aa40118b0
            Properties: 0x0a
              Read (0x02)
              Write (0x08)
            Value Handle: 0x01a4
            Value UUID: Unknown (0xb018)
        Handle: 0x01a6
        Value[5]: 0aa70119b0
            Properties: 0x0a
              Read (0x02)
              Write (0x08)
            Value Handle: 0x01a7
            Value UUID: Unknown (0xb019)
        Handle: 0x01a9
        Value[5]: 0aaa0120b0
            Properties: 0x0a
              Read (0x02)
              Write (0x08)
            Value Handle: 0x01aa
            Value UUID: Unknown (0xb020)
        Handle: 0x01ac
        Value[5]: 0aad0101b0
            Properties: 0x0a
              Read (0x02)
              Write (0x08)
            Value Handle: 0x01ad
            Value UUID: Unknown (0xb001)
        Handle: 0x01af
        Value[5]: 0ab00118b0
            Properties: 0x0a
              Read (0x02)
              Write (0x08)
            Value Handle: 0x01b0
            Value UUID: Unknown (0xb018)
zephyr.exe[1921774]: < HCI Command: Host Number of Completed Packets (0x03|0x0035) plen 5                          #188 19.398650
        Num handles: 1
        Handle: 453 Address: C0:07:E8:2C:B6:EE (OUI C0-07-E8)
        Count: 1
zephyr.exe[1921774]: < HCI Command: Host Number of Completed Packets (0x03|0x0035) plen 5                          #189 19.399438
        Num handles: 1
        Handle: 453 Address: C0:07:E8:2C:B6:EE (OUI C0-07-E8)
        Count: 1
zephyr.exe[1921774]: < HCI Command: Host Number of Completed Packets (0x03|0x0035) plen 5                          #190 19.400017
        Num handles: 1
        Handle: 453 Address: C0:07:E8:2C:B6:EE (OUI C0-07-E8)
        Count: 1
zephyr.exe[1921774]: < ACL Data TX: Handle 453 [1/3] flags 0x00 dlen 13                                            #191 19.400649
      Channel: 80 len 9 sdu 7 [PSM 39 mode Enhanced Credit (0x81)] {chan 4}
      ATT: Read By Type Request (0x08) len 6
        Handle range: 0x01b0-0x01f3
        Attribute type: Characteristic (0x2803)
zephyr.exe[1921774]: < ACL Data TX: Handle 453 [2/3] flags 0x00 dlen 12                                            #192 19.401296
      LE L2CAP: LE Flow Control Credit (0x16) ident 11 len 4
        Source CID: 68
        Credits: 1
> HCI Event: Number of Completed Packets (0x13) plen 5                                                             #193 19.446439
        Num handles: 1
        Handle: 453 Address: C0:07:E8:2C:B6:EE (OUI C0-07-E8)
        Count: 1
        Buffers: 1/3
        #191: len 13 (2 Kb/s)
        Latency: 45 msec (5-119 msec ~66 msec)
> HCI Event: Number of Completed Packets (0x13) plen 5                                                             #194 19.508606
        Num handles: 1
        Handle: 453 Address: C0:07:E8:2C:B6:EE (OUI C0-07-E8)
        Count: 1
        Buffers: 0/3
        #192: len 12 (0 Kb/s)
        Latency: 107 msec (5-119 msec ~86 msec)
        Channel: 80 [PSM 39 mode Enhanced Credit (0x81)] {chan 4}
        Channel Latency: 107 msec (42-114 msec ~94 msec)
> ACL Data RX: Handle 453 flags 0x02 dlen 15                                                                       #195 19.508896
      Channel: 68 len 11 sdu 9 [PSM 39 mode Enhanced Credit (0x81)] {chan 4}
      ATT: Read By Type Response (0x09) len 8
        Attribute data length: 7
        Attribute data list: 1 entry
        Handle: 0x01f1
        Value[5]: 20f2011c2a
            Properties: 0x20
              Indicate (0x20)
            Value Handle: 0x01f2
            Value UUID: Temperature Measurement (0x2a1c)
zephyr.exe[1921774]: < HCI Command: Host Number of Completed Packets (0x03|0x0035) plen 5                          #196 19.518559
        Num handles: 1
        Handle: 453 Address: C0:07:E8:2C:B6:EE (OUI C0-07-E8)
        Count: 1
zephyr.exe[1921774]: < ACL Data TX: Handle 453 [1/3] flags 0x00 dlen 13                                            #197 19.519356
      Channel: 80 len 9 sdu 7 [PSM 39 mode Enhanced Credit (0x81)] {chan 4}
      ATT: Read By Type Request (0x08) len 6
        Handle range: 0x01f2-0x01f3
        Attribute type: Characteristic (0x2803)
zephyr.exe[1921774]: < ACL Data TX: Handle 453 [2/3] flags 0x00 dlen 12                                            #198 19.520251
      LE L2CAP: LE Flow Control Credit (0x16) ident 12 len 4
        Source CID: 68
        Credits: 1
> HCI Event: Number of Completed Packets (0x13) plen 5                                                             #199 19.571470
        Num handles: 1
   