Bluetooth monitor ver 5.72
= Note: Linux version 6.14.0-36-generic (x86_64)                       0.551662
= Note: Bluetooth subsystem version 2.22                               0.551664
= New Index: 00:00:00:00:00:00 (Primary,UART,hci1)              [hci1] 0.551665
= New Index: 48:5F:99:8E:E0:64 (Primary,USB,hci0)               [hci0] 0.551666
= Open Index: 00:00:00:00:00:00                                 [hci1] 0.665440
= Index Info: 00:00:00:00:00:00 (Nordic Semiconductor ASA)      [hci1] 0.665461
@ USER Open: main (privileged) version 2.22            {0x0001} [hci1] 0.665471
< HCI Command: Reset (0x03|0x0003) plen 0                    #1 [hci1] 0.666800
> HCI Event: Command Complete (0x0e) plen 4                  #2 [hci1] 0.667311
      Reset (0x03|0x0003) ncmd 1
        Status: Success (0x00)
< HCI Command: Read Local Supported... (0x04|0x0003) plen 0  #3 [hci1] 0.685150
> HCI Event: Command Complete (0x0e) plen 12                 #4 [hci1] 0.685746
      Read Local Supported Features (0x04|0x0003) ncmd 1
        Status: Success (0x00)
        Features: 0x00 0x00 0x00 0x00 0x60 0x00 0x00 0x00
          BR/EDR Not Supported
          LE Supported (Controller)
< HCI Command: Read Local Version In.. (0x04|0x0001) plen 0  #5 [hci1] 0.704875
> HCI Event: Command Complete (0x0e) plen 12                 #6 [hci1] 0.705329
      Read Local Version Information (0x04|0x0001) ncmd 1
        Status: Success (0x00)
        HCI version: Reserved (0x0f) - Revision 12393 (0x3069)
        LMP version: Reserved (0x0f) - Subversion 12393 (0x3069)
        Manufacturer: Nordic Semiconductor ASA (89)
< HCI Command: Read Local Supported... (0x04|0x0002) plen 0  #7 [hci1] 0.724835
> HCI Event: Command Complete (0x0e) plen 68                 #8 [hci1] 0.725896
      Read Local Supported Commands (0x04|0x0002) ncmd 1
        Status: Success (0x00)
        Commands: 119 entries
          Disconnect (Octet 0 - Bit 5)
          Read Remote Version Information (Octet 2 - Bit 7)
          Set Event Mask (Octet 5 - Bit 6)
          Reset (Octet 5 - Bit 7)
          Read Connection Accept Timeout (Octet 7 - Bit 2)
          Write Connection Accept Timeout (Octet 7 - Bit 3)
          Read Transmit Power Level (Octet 10 - Bit 2)
          Set Controller To Host Flow Control (Octet 10 - Bit 5)
          Host Buffer Size (Octet 10 - Bit 6)
          Host Number of Completed Packets (Octet 10 - Bit 7)
          Read Local Version Information (Octet 14 - Bit 3)
          Read Local Supported Features (Octet 14 - Bit 5)
          Read BD ADDR (Octet 15 - Bit 1)
          Read RSSI (Octet 15 - Bit 5)
          Set Event Mask Page 2 (Octet 22 - Bit 2)
          LE Set Event Mask (Octet 25 - Bit 0)
          LE Read Buffer Size (Octet 25 - Bit 1)
          LE Read Local Supported Features (Octet 25 - Bit 2)
          LE Set Random Address (Octet 25 - Bit 4)
          LE Set Advertising Parameters (Octet 25 - Bit 5)
          LE Read Advertising Channel TX Power (Octet 25 - Bit 6)
          LE Set Advertising Data (Octet 25 - Bit 7)
          LE Set Scan Response Data (Octet 26 - Bit 0)
          LE Set Advertise Enable (Octet 26 - Bit 1)
          LE Set Scan Parameters (Octet 26 - Bit 2)
          LE Set Scan Enable (Octet 26 - Bit 3)
          LE Create Connection (Octet 26 - Bit 4)
          LE Create Connection Cancel (Octet 26 - Bit 5)
          LE Read Accept List Size (Octet 26 - Bit 6)
          LE Clear Accept List (Octet 26 - Bit 7)
          LE Add Device To Accept List (Octet 27 - Bit 0)
          LE Remove Device From Accept List (Octet 27 - Bit 1)
          LE Connection Update (Octet 27 - Bit 2)
          LE Set Host Channel Classification (Octet 27 - Bit 3)
          LE Read Channel Map (Octet 27 - Bit 4)
          LE Read Remote Used Features (Octet 27 - Bit 5)
          LE Encrypt (Octet 27 - Bit 6)
          LE Rand (Octet 27 - Bit 7)
          LE Start Encryption (Octet 28 - Bit 0)
          LE Long Term Key Request Reply (Octet 28 - Bit 1)
          LE Long Term Key Request Neg Reply (Octet 28 - Bit 2)
          LE Read Supported States (Octet 28 - Bit 3)
          LE Receiver Test (Octet 28 - Bit 4)
          LE Transmitter Test (Octet 28 - Bit 5)
          LE Test End (Octet 28 - Bit 6)
          Read Authenticated Payload Timeout (Octet 32 - Bit 4)
          Write Authenticated Payload Timeout (Octet 32 - Bit 5)
          LE Set Data Length (Octet 33 - Bit 6)
          LE Read Suggested Default Data Length (Octet 33 - Bit 7)
          LE Write Suggested Default Data Length (Octet 34 - Bit 0)
          LE Add Device To Resolving List (Octet 34 - Bit 3)
          LE Remove Device From Resolving List (Octet 34 - Bit 4)
          LE Clear Resolving List (Octet 34 - Bit 5)
          LE Read Resolving List Size (Octet 34 - Bit 6)
          LE Set Address Resolution Enable (Octet 35 - Bit 1)
          LE Set Resolvable Private Address Timeout (Octet 35 - Bit 2)
          LE Read Maximum Data Length (Octet 35 - Bit 3)
          LE Read PHY (Octet 35 - Bit 4)
          LE Set Default PHY (Octet 35 - Bit 5)
          LE Set PHY (Octet 35 - Bit 6)
          LE Enhanced Receiver Test (Octet 35 - Bit 7)
          LE Enhanced Transmitter Test (Octet 36 - Bit 0)
          LE Set Advertising Set Random Address (Octet 36 - Bit 1)
          LE Set Extended Advertising Parameters (Octet 36 - Bit 2)
          LE Set Extended Advertising Data (Octet 36 - Bit 3)
          LE Set Extended Scan Response Data (Octet 36 - Bit 4)
          LE Set Extended Advertising Enable (Octet 36 - Bit 5)
          LE Read Maximum Advertising Data Length (Octet 36 - Bit 6)
          LE Read Number of Supported Advertising Sets (Octet 36 - Bit 7)
          LE Remove Advertising Set (Octet 37 - Bit 0)
          LE Clear Advertising Sets (Octet 37 - Bit 1)
          LE Set Periodic Advertising Parameters (Octet 37 - Bit 2)
          LE Set Periodic Advertising Data (Octet 37 - Bit 3)
          LE Set Periodic Advertising Enable (Octet 37 - Bit 4)
          LE Set Extended Scan Parameters (Octet 37 - Bit 5)
          LE Set Extended Scan Enable (Octet 37 - Bit 6)
          LE Extended Create Connection (Octet 37 - Bit 7)
          LE Periodic Advertising Create Sync (Octet 38 - Bit 0)
          LE Periodic Advertising Create Sync Cancel (Octet 38 - Bit 1)
          LE Periodic Advertising Terminate Sync (Octet 38 - Bit 2)
          LE Add Device To Periodic Advertiser List (Octet 38 - Bit 3)
          LE Remove Device From Periodic Advertiser List (Octet 38 - Bit 4)
          LE Clear Periodic Advertiser List (Octet 38 - Bit 5)
          LE Read Periodic Advertiser List Size (Octet 38 - Bit 6)
          LE Read Transmit Power (Octet 38 - Bit 7)
          LE Read RF Path Compensation (Octet 39 - Bit 0)
          LE Write RF Path Compensation (Octet 39 - Bit 1)
          LE Set Privacy Mode (Octet 39 - Bit 2)
          LE Periodic Advertising Receive Enable (Octet 40 - Bit 5)
          LE Periodic Advertising Sync Transfer (Octet 40 - Bit 6)
          LE Periodic Advertising Set Info Transfer (Octet 40 - Bit 7)
          LE Periodic Advertising Sync Transfer Parameters (Octet 41 - Bit 0)
          LE Set Default Periodic Advertisng Sync Transfer Parameters (Octet 41 - Bit 1)
          LE Read Buffer v2 (Octet 41 - Bit 5)
          LE Read ISO TX Sync (Octet 41 - Bit 6)
          LE Set Connected Isochronous Group Parameters (Octet 41 - Bit 7)
          LE Set Connected Isochronous Group Parameters Test (Octet 42 - Bit 0)
          LE Create Connected Isochronous Stream (Octet 42 - Bit 1)
          LE Remove Connected Isochronous Group (Octet 42 - Bit 2)
          LE Accept Connected Isochronous Stream Request (Octet 42 - Bit 3)
          LE Reject Connected Isochronous Stream Request (Octet 42 - Bit 4)
          LE Create Broadcast Isochronous Group (Octet 42 - Bit 5)
          LE Create Broadcast Isochronous Group Test (Octet 42 - Bit 6)
          LE Terminate Broadcast Isochronous Group (Octet 42 - Bit 7)
          LE Broadcast Isochronous Group Create Sync (Octet 43 - Bit 0)
          LE Broadcast Isochronous Group Terminate Sync (Octet 43 - Bit 1)
          LE Request Peer SCA (Octet 43 - Bit 2)
          LE Setup Isochronous Data Path (Octet 43 - Bit 3)
          LE Remove Isochronous Data Path (Octet 43 - Bit 4)
          LE Isochronous Transmit Test (Octet 43 - Bit 5)
          LE Isochronous Receive Test (Octet 43 - Bit 6)
          LE Isochronous Read Test Counters (Octet 43 - Bit 7)
          LE Isochronous Read Test Counters (Octet 44 - Bit 0)
          LE Set Host Feature (Octet 44 - Bit 1)
          Octet 44 - Bit 2 
          Octet 45 - Bit 6 
          Octet 46 - Bit 0 
          Octet 46 - Bit 1 
          Octet 46 - Bit 2 
< HCI Command: Host Buffer Size (0x03|0x0033) plen 7         #9 [hci1] 0.744830
        ACL MTU: 255  ACL max packet: 16
        SCO MTU: 0    SCO max packet: 0
> HCI Event: Command Complete (0x0e) plen 4                 #10 [hci1] 0.745306
      Host Buffer Size (0x03|0x0033) ncmd 1
        Status: Success (0x00)
< HCI Command: Set Controller To Ho.. (0x03|0x0031) plen 1  #11 [hci1] 0.764791
        Flow control: ACL Data Packets (0x01)
> HCI Event: Command Complete (0x0e) plen 4                 #12 [hci1] 0.765192
      Set Controller To Host Flow Control (0x03|0x0031) ncmd 1
        Status: Success (0x00)
< HCI Command: LE Read Local Suppor.. (0x08|0x0003) plen 0  #13 [hci1] 0.784790
> HCI Event: Command Complete (0x0e) plen 12                #14 [hci1] 0.785248
      LE Read Local Supported Features (0x08|0x0003) ncmd 1
        Status: Success (0x00)
        Features: 0xfd 0x79 0x00 0xf7 0x30 0x01 0x00 0x00
          LE Encryption
          Extended Reject Indication
          Peripheral-initiated Features Exchange
          LE Ping
          LE Data Packet Length Extension
          LL Privacy
          Extended Scanner Filter Policies
          LE 2M PHY
          LE Coded PHY
          LE Extended Advertising
          LE Periodic Advertising
          Channel Selection Algorithm #2
          Periodic Advertising Sync Transfer - Sender
          Periodic Advertising Sync Transfer - Recipient
          Sleep Clock Accuracy Updates
          Connected Isochronous Stream - Central
          Connected Isochronous Stream - Peripheral
          Isochronous Broadcaster
          Synchronized Receiver
          Periodic Advertising ADI support
          Connection Subrating
          Unknown features (0x0000010000000000)
< HCI Command: LE Set Host Feature (0x08|0x0074) plen 2     #15 [hci1] 0.804817
        Bit Number: 32
          Connected Isochronous Stream (Host Support)
        Bit Value: 1
> HCI Event: Command Complete (0x0e) plen 4                 #16 [hci1] 0.805248
      LE Set Host Feature (0x08|0x0074) ncmd 1
        Status: Success (0x00)
< HCI Command: LE Read Buffer v2 (0x08|0x0060) plen 0       #17 [hci1] 0.824786
> HCI Event: Command Complete (0x0e) plen 10                #18 [hci1] 0.825268
      LE Read Buffer v2 (0x08|0x0060) ncmd 1
        Status: Success (0x00)
        ACL MTU: 27
        ACL max packet: 3
        ISO MTU: 318
        ISO max packet: 3
< HCI Command: LE Read Maximum Adve.. (0x08|0x003a) plen 0  #19 [hci1] 0.844823
> HCI Event: Command Complete (0x0e) plen 6                 #20 [hci1] 0.845243
      LE Read Maximum Advertising Data Length (0x08|0x003a) ncmd 1
        Status: Success (0x00)
        Max length: 1650
< HCI Command: LE Read Supported St.. (0x08|0x001c) plen 0  #21 [hci1] 0.864827
> HCI Event: Command Complete (0x0e) plen 12                #22 [hci1] 0.865321
      LE Read Supported States (0x08|0x001c) ncmd 1
        Status: Success (0x00)
        States: 0x000003ff3e0306ff
          Non-connectable Advertising State
          Scannable Advertising State
          Connectable Advertising State
          High Duty Cycle Directed Advertising State
          Passive Scanning State
          Active Scanning State
          Initiating State
            and Connection State (Central Role)
          Connection State (Peripheral Role)
          Scannable Advertising State
            and Passive Scanning State
          Connectable Advertising State
            and Passive Scanning State
          Non-connectable Advertising State
            and Initiating State
          Scannable Advertising State
            and Initiating State
          Active Scanning State
            and Connection State (Central Role)
          Passive Scanning State
            and Connection State (Peripheral Role)
          Active Scanning State
            and Connection State (Peripheral Role)
          Initiating State
            and Connection State (Central Role)
            and Central Role & Central Role
          Low Duty Cycle Directed Advertising State
          Connectable Advertising State
            and Initiating State
            and Central Role & Peripheral Role
          High Duty Cycle Directed Advertising State
            and Initiating State
            and Central Role & Peripheral Role
          Low Duty Cycle Directed Advertising State
            and Initiating State
            and Central Role & Peripheral Role
          Connectable Advertising State
            and Connection State (Central Role)
            and Central Role & Peripheral Role
          High Duty Cycle Directed Advertising State
            and Connection State (Central Role)
            and Central Role & Peripheral Role
          Low Duty Cycle Directed Advertising State
            and Connection State (Central Role)
            and Central Role & Peripheral Role
          Connectable Advertising State
            and Connection State (Peripheral Role)
            and Central Role & Peripheral Role
          High Duty Cycle Directed Advertising State
            and Connection State (Peripheral Role)
            and Peripheral Role & Peripheral Role
          Low Duty Cycle Directed Advertising State
            and Connection State (Peripheral Role)
            and Peripheral Role & Peripheral Role
          Initiating State
            and Connection State (Peripheral Role)
            and Central Role & Peripheral Role
< HCI Command: LE Read Maximum Data.. (0x08|0x002f) plen 0  #23 [hci1] 0.884810
> HCI Event: Command Complete (0x0e) plen 12                #24 [hci1] 0.885254
      LE Read Maximum Data Length (0x08|0x002f) ncmd 1
        Status: Success (0x00)
        Max TX octets: 251
        Max TX time: 2704
        Max RX octets: 251
        Max RX time: 2704
< HCI Command: LE Write Suggested D.. (0x08|0x0024) plen 4  #25 [hci1] 0.904735
        TX octets: 251
        TX time: 2704
> HCI Event: Command Complete (0x0e) plen 4                 #26 [hci1] 0.905182
      LE Write Suggested Default Data Length (0x08|0x0024) ncmd 1
        Status: Success (0x00)
< HCI Command: LE Read Resolving Li.. (0x08|0x002a) plen 0  #27 [hci1] 0.924836
> HCI Event: Command Complete (0x0e) plen 5                 #28 [hci1] 0.925246
      LE Read Resolving List Size (0x08|0x002a) ncmd 1
        Status: Success (0x00)
        Size: 8
< HCI Command: LE Set Event Mask (0x08|0x0001) plen 8       #29 [hci1] 0.944790
        Mask: 0x000002023f87fa5e
          LE Advertising Report
          LE Connection Update Complete
          LE Read Remote Used Features Complete
          LE Long Term Key Request
          LE Data Length Change
          LE Enhanced Connection Complete
          LE PHY Update Complete
          LE Extended Advertising Report
          LE Periodic Advertising Sync Established
          LE Periodic Advertising Report
          LE Periodic Advertising Sync Lost
          LE Extended Scan Timeout
          LE Extended Advertising Set Terminated
          LE Scan Request Received
          LE Periodic Advertising Sync Transfer Rvc
          LE CIS Established
          LE CIS Request
          LE Create BIG Complete
          LE Terminate BIG Complete
          LE BIG Sync Estabilished Complete
          LE BIG Sync Lost
          LE BIG Info Advertising Report
          Unknown mask (0x0000020000000000)
> HCI Event: Command Complete (0x0e) plen 4                 #30 [hci1] 0.945315
      LE Set Event Mask (0x08|0x0001) ncmd 1
        Status: Success (0x00)
< HCI Command: Set Event Mask (0x03|0x0001) plen 8          #31 [hci1] 0.964801
        Mask: 0x2000800002008890
          Disconnection Complete
          Encryption Change
          Read Remote Version Information Complete
          Hardware Error
          Data Buffer Overflow
          Encryption Key Refresh Complete
          LE Meta
> HCI Event: Command Complete (0x0e) plen 4                 #32 [hci1] 0.965334
      Set Event Mask (0x03|0x0001) ncmd 1
        Status: Success (0x00)
< HCI Command: Read BD ADDR (0x04|0x0009) plen 0            #33 [hci1] 0.984831
> HCI Event: Command Complete (0x0e) plen 10                #34 [hci1] 0.985352
      Read BD ADDR (0x04|0x0009) ncmd 1
        Status: Success (0x00)
        Address: 00:00:00:00:00:00 (OUI 00-00-00)
< HCI Command: LE Set Random Address (0x08|0x0005) plen 6   #35 [hci1] 1.004798
        Address: D5:B6:CC:31:DB:3B (Static)
> HCI Event: Command Complete (0x0e) plen 4                 #36 [hci1] 1.005272
      LE Set Random Address (0x08|0x0005) ncmd 1
        Status: Success (0x00)
< HCI Command: LE Set Extended Adv.. (0x08|0x0036) plen 25  #37 [hci1] 3.575245
        Handle: 0x00
        Properties: 0x0013
          Connectable
          Scannable
          Use legacy advertising PDUs: ADV_IND
        Min advertising interval: 100.000 msec (0x00a0)
        Max advertising interval: 150.000 msec (0x00f0)
        Channel map: 37, 38, 39 (0x07)
        Own address type: Random (0x01)
        Peer address type: Public (0x00)
        Peer address: 00:00:00:00:00:00 (OUI 00-00-00)
        Filter policy: Allow Scan Request from Any, Allow Connect Request from Any (0x00)
        TX power: Host has no preference (0x7f)
        Primary PHY: LE 1M (0x01)
        Secondary max skip: 0x00
        Secondary PHY: LE 1M (0x01)
        SID: 0x00
        Scan request notifications: Disabled (0x00)
> HCI Event: Command Complete (0x0e) plen 5                 #38 [hci1] 3.576041
      LE Set Extended Advertising Parameters (0x08|0x0036) ncmd 1
        Status: Success (0x00)
        TX power (selected): 0 dbm (0x00)
< HCI Command: LE Set Advertising S.. (0x08|0x0035) plen 7  #39 [hci1] 3.585207
        Advertising handle: 0x00
        Advertising random address: D5:B6:CC:31:DB:3B (Static)
> HCI Event: Command Complete (0x0e) plen 4                 #40 [hci1] 3.585719
      LE Set Advertising Set Random Address (0x08|0x0035) ncmd 1
        Status: Success (0x00)
< HCI Command: LE Set Extended Adv.. (0x08|0x0037) plen 22  #41 [hci1] 3.604965
        Handle: 0x00
        Operation: Complete extended advertising data (0x03)
        Fragment preference: Minimize fragmentation (0x01)
        Data length: 0x12
        Flags: 0x06
          LE General Discoverable Mode
          BR/EDR Not Supported
        Name (complete): Tester_F6B11A
> HCI Event: Command Complete (0x0e) plen 4                 #42 [hci1] 3.605724
      LE Set Extended Advertising Data (0x08|0x0037) ncmd 1
        Status: Success (0x00)
< HCI Command: LE Set Extended Scan.. (0x08|0x0038) plen 4  #43 [hci1] 3.624875
        Handle: 0x00
        Operation: Complete scan response data (0x03)
        Fragment preference: Minimize fragmentation (0x01)
        Data length: 0x00
> HCI Event: Command Complete (0x0e) plen 4                 #44 [hci1] 3.625326
      LE Set Extended Scan Response Data (0x08|0x0038) ncmd 1
        Status: Success (0x00)
< HCI Command: LE Set Extended Adve.. (0x08|0x0039) plen 6  #45 [hci1] 3.644861
        Extended advertising: Enabled (0x01)
        Number of sets: 1 (0x01)
        Entry 0
          Handle: 0x00
          Duration: 0 ms (0x00)
          Max ext adv events: 0
> HCI Event: Command Complete (0x0e) plen 4                 #46 [hci1] 3.645498
      LE Set Extended Advertising Enable (0x08|0x0039) ncmd 1
        Status: Success (0x00)
> HCI Event: LE Meta Event (0x3e) plen 31                   #47 [hci1] 3.750214
      LE Enhanced Connection Complete (0x0a)
        Status: Success (0x00)
        Handle: 3657
        Role: Peripheral (0x01)
        Peer address type: Public (0x00)
        Peer address: DF:A9:FF:F6:B1:1A (OUI DF-A9-FF)
        Local resolvable private address: 00:00:00:00:00:00 (Non-Resolvable)
        Peer resolvable private address: 00:00:00:00:00:00 (Non-Resolvable)
        Connection interval: 150.00 msec (0x0078)
        Connection latency: 0 (0x0000)
        Supervision timeout: 25120 msec (0x09d0)
        Central clock accuracy: 0x01
> HCI Event: LE Meta Event (0x3e) plen 6                    #48 [hci1] 3.750242
      LE Advertising Set Terminated (0x12)
        Status: Success (0x00)
        Handle: 0
        Connection handle: 3657
        Number of completed extended advertising events: 0
< HCI Command: LE Read Remote Used... (0x08|0x0016) plen 2  #49 [hci1] 3.765898
        Handle: 3657 Address: DF:A9:FF:F6:B1:1A (OUI DF-A9-FF)
< ACL Data TX: Handle 3657 flags 0x00 dlen 7                #50 [hci1] 3.765926
      ATT: Exchange MTU Request (0x02) len 2
        Client RX MTU: 251
> HCI Event: Command Status (0x0f) plen 4                   #51 [hci1] 3.766459
      LE Read Remote Used Features (0x08|0x0016) ncmd 1
        Status: Success (0x00)
> HCI Event: Number of Completed Packets (0x13) plen 5      #52 [hci1] 4.051237
        Num handles: 1
        Handle: 3657 Address: DF:A9:FF:F6:B1:1A (OUI DF-A9-FF)
        Count: 1
        #50: len 7 (0 Kb/s)
        Latency: 285 msec (285-285 msec ~285 msec)
> HCI Event: LE Meta Event (0x3e) plen 12                   #53 [hci1] 4.201542
      LE Read Remote Used Features (0x04)
        Status: Success (0x00)
        Handle: 3657 Address: DF:A9:FF:F6:B1:1A (OUI DF-A9-FF)
        Features: 0x2d 0x49 0x00 0xf7 0x67 0xd9 0x00 0x80
          LE Encryption
          Extended Reject Indication
          Peripheral-initiated Features Exchange
          LE Data Packet Length Extension
          LE 2M PHY
          LE Coded PHY
          Channel Selection Algorithm #2
          Periodic Advertising Sync Transfer - Sender
          Periodic Advertising Sync Transfer - Recipient
          Sleep Clock Accuracy Updates
          Connected Isochronous Stream - Central
          Connected Isochronous Stream - Peripheral
          Isochronous Broadcaster
          Synchronized Receiver
          Connected Isochronous Stream (Host Support)
          LE Power Control Request
          LE Power Control Request
          Connection Subrating
          Connection Subrating (Host Support)
          Unknown features (0x8000d90000000000)
> ACL Data RX: Handle 3657 flags 0x02 dlen 7                #54 [hci1] 4.951282
      ATT: Exchange MTU Request (0x02) len 2
        Client RX MTU: 49
> ACL Data RX: Handle 3657 flags 0x02 dlen 7                #55 [hci1] 4.951693
      ATT: Exchange MTU Response (0x03) len 2
        Server RX MTU: 49
< HCI Command: Host Number of Compl.. (0x03|0x0035) plen 5  #56 [hci1] 4.965360
        Num handles: 1
        Handle: 3657 Address: DF:A9:FF:F6:B1:1A (OUI DF-A9-FF)
        Count: 1
< ACL Data TX: Handle 3657 flags 0x00 dlen 7                #57 [hci1] 4.965456
      ATT: Exchange MTU Response (0x03) len 2
        Server RX MTU: 251
< HCI Command: Host Number of Compl.. (0x03|0x0035) plen 5  #58 [hci1] 4.965723
        Num handles: 1
        Handle: 3657 Address: DF:A9:FF:F6:B1:1A (OUI DF-A9-FF)
        Count: 1
> HCI Event: Number of Completed Packets (0x13) plen 5      #59 [hci1] 5.251113
        Num handles: 1
        Handle: 3657 Address: DF:A9:FF:F6:B1:1A (OUI DF-A9-FF)
        Count: 1
        #57: len 7 (0 Kb/s)
        Latency: 285 msec (285-285 msec ~285 msec)
> ACL Data RX: Handle 3657 flags 0x02 dlen 11               #60 [hci1] 7.201246
      SMP: Pairing Request (0x01) len 6
        IO capability: KeyboardDisplay (0x04)
        OOB data: Authentication data not present (0x00)
        Authentication requirement: Bonding, No MITM, SC, No Keypresses (0x09)
        Max encryption key size: 16
        Initiator key distribution: EncKey IdKey Sign (0x07)
        Responder key distribution: EncKey IdKey Sign (0x07)
< HCI Command: Host Number of Compl.. (0x03|0x0035) plen 5  #61 [hci1] 7.205130
        Num handles: 1
        Handle: 3657 Address: DF:A9:FF:F6:B1:1A (OUI DF-A9-FF)
        Count: 1
< ACL Data TX: Handle 3657 flags 0x00 dlen 11               #62 [hci1] 7.205184
      SMP: Pairing Response (0x02) len 6
        IO capability: NoInputNoOutput (0x03)
        OOB data: Authentication data not present (0x00)
        Authentication requirement: Bonding, No MITM, SC, No Keypresses (0x09)
        Max encryption key size: 16
        Initiator key distribution: IdKey (0x02)
        Responder key distribution: <none> (0x00)
> HCI Event: Number of Completed Packets (0x13) plen 5      #63 [hci1] 7.501365
        Num handles: 1
        Handle: 3657 Address: DF:A9:FF:F6:B1:1A (OUI DF-A9-FF)
        Count: 1
        #62: len 11 (0 Kb/s)
        Latency: 296 msec (285-296 msec ~290 msec)
> ACL Data RX: Handle 3657 flags 0x02 dlen 27               #64 [hci1] 7.501702
> ACL Data RX: Handle 3657 flags 0x01 dlen 27               #65 [hci1] 7.502134
> ACL Data RX: Handle 3657 flags 0x01 dlen 15               #66 [hci1] 7.502648
      SMP: Pairing Public Key (0x0c) len 64
        X: 2eb2b3166925183ee639a28e54ca877f6ac9a4e2a5809c1dbafc427e1d76fda6
        Y: 426a713505d0b89bae042b9b4babdaf30a733587768c718a2498ae8faca084cf
< HCI Command: Host Number of Compl.. (0x03|0x0035) plen 5  #67 [hci1] 7.505596
        Num handles: 1
        Handle: 3657 Address: DF:A9:FF:F6:B1:1A (OUI DF-A9-FF)
        Count: 1
< HCI Command: Host Number of Compl.. (0x03|0x0035) plen 5  #68 [hci1] 7.505828
        Num handles: 1
        Handle: 3657 Address: DF:A9:FF:F6:B1:1A (OUI DF-A9-FF)
        Count: 1
< HCI Command: Host Number of Compl.. (0x03|0x0035) plen 5  #69 [hci1] 7.506137
        Num handles: 1
        Handle: 3657 Address: DF:A9:FF:F6:B1:1A (OUI DF-A9-FF)
        Count: 1
< ACL Data TX: Handle 3657 flags 0x00 dlen 27               #70 [hci1] 7.506203
< ACL Data TX: Handle 3657 flags 0x01 dlen 27               #71 [hci1] 7.506212
< ACL Data TX: Handle 3657 flags 0x01 dlen 15               #72 [hci1] 7.506242
      SMP: Pairing Public Key (0x0c) len 64
        X: 98308440221e2d910f0e54b71e7ec652857aa9b5a0dc65028824cc19db1226e9
        Y: 67a4816bcb62efb21701e31fdb27561a6217575fb007a8bbdabe7e28b6f68482
> HCI Event: Number of Completed Packets (0x13) plen 5      #73 [hci1] 7.651829
        Num handles: 1
        Handle: 3657 Address: DF:A9:FF:F6:B1:1A (OUI DF-A9-FF)
        Count: 1
        #70: len 27 (1 Kb/s)
        Latency: 145 msec (145-296 msec ~218 msec)
> HCI Event: Number of Completed Packets (0x13) plen 5      #74 [hci1] 7.652402
        Num handles: 1
        Handle: 3657 Address: DF:A9:FF:F6:B1:1A (OUI DF-A9-FF)
        Count: 1
        #71: len 27 (1 Kb/s)
        Latency: 146 msec (145-296 msec ~182 msec)
< ACL Data TX: Handle 3657 flags 0x00 dlen 21               #75 [hci1] 7.665258
      SMP: Pairing Confirm (0x03) len 16
        Confim value: f40d8681760b457573d1c967c1dd8840
> HCI Event: Number of Completed Packets (0x13) plen 5      #76 [hci1] 7.801047
        Num handles: 1
        Handle: 3657 Address: DF:A9:FF:F6:B1:1A (OUI DF-A9-FF)
        Count: 1
        #72: len 15 (0 Kb/s)
        Latency: 294 msec (145-296 msec ~238 msec)
> HCI Event: Number of Completed Packets (0x13) plen 5      #77 [hci1] 7.951273
        Num handles: 1
        Handle: 3657 Address: DF:A9:FF:F6:B1:1A (OUI DF-A9-FF)
        Count: 1
        #75: len 21 (0 Kb/s)
        Latency: 286 msec (145-296 msec ~262 msec)
> ACL Data RX: Handle 3657 flags 0x02 dlen 21               #78 [hci1] 7.951592
      SMP: Pairing Random (0x04) len 16
        Random value: 366d05d7b01e8ccd0000000000000000
< HCI Command: Host Number of Compl.. (0x03|0x0035) plen 5  #79 [hci1] 7.965470
        Num handles: 1
        Handle: 3657 Address: DF:A9:FF:F6:B1:1A (OUI DF-A9-FF)
        Count: 1
< ACL Data TX: Handle 3657 flags 0x00 dlen 21               #80 [hci1] 7.965620
      SMP: Pairing Random (0x04) len 16
        Random value: 8e6108f966a694cbe26df70bb96773e6
> HCI Event: Number of Completed Packets (0x13) plen 5      #81 [hci1] 8.251036
        Num handles: 1
        Handle: 3657 Address: DF:A9:FF:F6:B1:1A (OUI DF-A9-FF)
        Count: 1
        #80: len 21 (0 Kb/s)
        Latency: 285 msec (145-296 msec ~273 msec)
> ACL Data RX: Handle 3657 flags 0x02 dlen 21               #82 [hci1] 8.401417
      SMP: Pairing DHKey Check (0x0d) len 16
        E: 52860b4df44ba0352a3ea0ed2de7d30d
< HCI Command: Host Number of Compl.. (0x03|0x0035) plen 5  #83 [hci1] 8.405823
        Num handles: 1
        Handle: 3657 Address: DF:A9:FF:F6:B1:1A (OUI DF-A9-FF)
        Count: 1
< ACL Data TX: Handle 3657 flags 0x00 dlen 21               #84 [hci1] 8.405948
      SMP: Pairing DHKey Check (0x0d) len 16
        E: 1e8eef3b96f7a3b3a797106f75449274
> HCI Event: Number of Completed Packets (0x13) plen 5      #85 [hci1] 8.701092
        Num handles: 1
        Handle: 3657 Address: DF:A9:FF:F6:B1:1A (OUI DF-A9-FF)
        Count: 1
        #84: len 21 (0 Kb/s)
        Latency: 295 msec (145-296 msec ~284 msec)
> HCI Event: LE Meta Event (0x3e) plen 13                   #86 [hci1] 8.851738
      LE Long Term Key Request (0x05)
        Handle: 3657 Address: DF:A9:FF:F6:B1:1A (OUI DF-A9-FF)
        Random number: 0x0000000000000000
        Encrypted diversifier: 0x0000
< HCI Command: LE Long Term Key Re.. (0x08|0x001a) plen 18  #87 [hci1] 8.865181
        Handle: 3657 Address: DF:A9:FF:F6:B1:1A (OUI DF-A9-FF)
        Long term key: e077b53e1bac69cb0a007c4ee5bed11f
> HCI Event: Command Complete (0x0e) plen 6                 #88 [hci1] 8.865937
      LE Long Term Key Request Reply (0x08|0x001a) ncmd 1
        Status: Success (0x00)
        Handle: 3657 Address: DF:A9:FF:F6:B1:1A (OUI DF-A9-FF)
> HCI Event: Encryption Change (0x08) plen 4                #89 [hci1] 9.601389
        Status: Success (0x00)
        Handle: 3657 Address: DF:A9:FF:F6:B1:1A (OUI DF-A9-FF)
        Encryption: Enabled with AES-CCM (0x01)
> ACL Data RX: Handle 3657 flags 0x02 dlen 21               #90 [hci1] 9.751475
      SMP: Identity Information (0x08) len 16
        Identity resolving key: 4e63f5fc20bdb88552fcba7db344e439
< HCI Command: Host Number of Compl.. (0x03|0x0035) plen 5  #91 [hci1] 9.765361
        Num handles: 1
        Handle: 3657 Address: DF:A9:FF:F6:B1:1A (OUI DF-A9-FF)
        Count: 1
> ACL Data RX: Handle 3657 flags 0x02 dlen 12              #92 [hci1] 10.051262
      SMP: Identity Address Information (0x09) len 7
        Address: DF:A9:FF:F6:B1:1A (OUI DF-A9-FF)
< HCI Command: LE Add Device To R.. (0x08|0x0027) plen 39  #93 [hci1] 10.065583
        Address type: Public (0x00)
        Address: DF:A9:FF:F6:B1:1A (OUI DF-A9-FF)
        Peer identity resolving key: 4e63f5fc20bdb88552fcba7db344e439
        Local identity resolving key: 00000000000000000000000000000000
> HCI Event: Command Complete (0x0e) plen 4                #94 [hci1] 10.066642
      LE Add Device To Resolving List (0x08|0x0027) ncmd 1
        Status: Success (0x00)
< HCI Command: LE Set Privacy Mode (0x08|0x004e) plen 8    #95 [hci1] 10.085270
        Peer Identity address type: Public (0x00)
        Peer Identity address: DF:A9:FF:F6:B1:1A (OUI DF-A9-FF)
        Privacy Mode: Use Device Privacy (0x01)
> HCI Event: Command Complete (0x0e) plen 4                #96 [hci1] 10.085827
      LE Set Privacy Mode (0x08|0x004e) ncmd 1
        Status: Success (0x00)
< HCI Command: LE Set Address Reso.. (0x08|0x002d) plen 1  #97 [hci1] 10.105270
        Address resolution: Enabled (0x01)
> HCI Event: Command Complete (0x0e) plen 4                #98 [hci1] 10.105692
      LE Set Address Resolution Enable (0x08|0x002d) ncmd 1
        Status: Success (0x00)
< HCI Command: Host Number of Comp.. (0x03|0x0035) plen 5  #99 [hci1] 10.125166
        Num handles: 1
        Handle: 3657 Address: DF:A9:FF:F6:B1:1A (OUI DF-A9-FF)
        Count: 1
> ACL Data RX: Handle 3657 flags 0x02 dlen 13             #100 [hci1] 10.201349
      ATT: Find By Type Value Request (0x06) len 8
        Handle range: 0x0001-0xffff
        Attribute type: Primary Service (0x2800)
          UUID: Hearing Aid (0x1854)
< HCI Command: Host Number of Com.. (0x03|0x0035) plen 5  #101 [hci1] 10.205416
        Num handles: 1
        Handle: 3657 Address: DF:A9:FF:F6:B1:1A (OUI DF-A9-FF)
        Count: 1
< ACL Data TX: Handle 3657 flags 0x00 dlen 9              #102 [hci1] 10.205527
      ATT: Find By Type Value Response (0x07) len 4
        Handle range: 0x002a-0x0032
> HCI Event: Number of Completed Packets (0x13) plen 5    #103 [hci1] 10.501224
        Num handles: 1
        Handle: 3657 Address: DF:A9:FF:F6:B1:1A (OUI DF-A9-FF)
        Count: 1
        #102: len 9 (0 Kb/s)
        Latency: 295 msec (145-296 msec ~290 msec)
> ACL Data RX: Handle 3657 flags 0x02 dlen 13             #104 [hci1] 10.501429
      ATT: Find By Type Value Request (0x06) len 8
        Handle range: 0x0033-0xffff
        Attribute type: Primary Service (0x2800)
          UUID: Hearing Aid (0x1854)
< HCI Command: Host Number of Com.. (0x03|0x0035) plen 5  #105 [hci1] 10.505571
        Num handles: 1
        Handle: 3657 Address: DF:A9:FF:F6:B1:1A (OUI DF-A9-FF)
        Count: 1
< ACL Data TX: Handle 3657 flags 0x00 dlen 9              #106 [hci1] 10.505833
      ATT: Error Response (0x01) len 4
        Find By Type Value Request (0x06)
        Handle: 0x0033
        Error: Attribute Not Found (0x0a)
> HCI Event: Number of Completed Packets (0x13) plen 5    #107 [hci1] 10.801268
        Num handles: 1
        Handle: 3657 Address: DF:A9:FF:F6:B1:1A (OUI DF-A9-FF)
        Count: 1
        #106: len 9 (0 Kb/s)
        Latency: 295 msec (145-296 msec ~292 msec)
> ACL Data RX: Handle 3657 flags 0x02 dlen 11             #108 [hci1] 10.801384
      ATT: Read By Type Request (0x08) len 6
        Handle range: 0x002a-0x0032
        Attribute type: Characteristic (0x2803)
< HCI Command: Host Number of Com.. (0x03|0x0035) plen 5  #109 [hci1] 10.805546
        Num handles: 1
        Handle: 3657 Address: DF:A9:FF:F6:B1:1A (OUI DF-A9-FF)
        Count: 1
< ACL Data TX: Handle 3657 flags 0x00 dlen 27             #110 [hci1] 10.805619
      ATT: Read By Type Response (0x09) len 22
        Attribute data length: 7
        Attribute data list: 3 entries
        Handle: 0x002b
        Value: 022c00da2b
            Properties: 0x02
              Read (0x02)
            Value Handle: 0x002c
            Value UUID: Hearing Aid Features (0x2bda)
        Handle: 0x002d
        Value: 282e00db2b
            Properties: 0x28
              Write (0x08)
              Indicate (0x20)
            Value Handle: 0x002e
            Value UUID: Hearing Aid Preset Control Point (0x2bdb)
        Handle: 0x0030
        Value: 123100dc2b
            Properties: 0x12
              Read (0x02)
              Notify (0x10)
            Value Handle: 0x0031
            Value UUID: Active Preset Index (0x2bdc)
> HCI Event: Number of Completed Packets (0x13) plen 5    #111 [hci1] 11.101168
        Num handles: 1
        Handle: 3657 Address: DF:A9:FF:F6:B1:1A (OUI DF-A9-FF)
        Count: 1
        #110: len 27 (0 Kb/s)
        Latency: 295 msec (145-296 msec ~294 msec)
> ACL Data RX: Handle 3657 flags 0x02 dlen 11             #112 [hci1] 11.101542
      ATT: Read By Type Request (0x08) len 6
        Handle range: 0x0031-0x0032
        Attribute type: Characteristic (0x2803)
< HCI Command: Host Number of Com.. (0x03|0x0035) plen 5  #113 [hci1] 11.105573
        Num handles: 1
        Handle: 3657 Address: DF:A9:FF:F6:B1:1A (OUI DF-A9-FF)
        Count: 1
< ACL Data TX: Handle 3657 flags 0x00 dlen 9              #114 [hci1] 11.105717
      ATT: Error Response (0x01) len 4
        Read By Type Request (0x08)
        Handle: 0x0031
        Error: Attribute Not Found (0x0a)
> HCI Event: Number of Completed Packets (0x13) plen 5    #115 [hci1] 11.401108
        Num handles: 1
        Handle: 3657 Address: DF:A9:FF:F6:B1:1A (OUI DF-A9-FF)
        Count: 1
        #114: len 9 (0 Kb/s)
        Latency: 295 msec (145-296 msec ~294 msec)
> ACL Data RX: Handle 3657 flags 0x02 dlen 9              #116 [hci1] 11.401446
      ATT: Find Information Request (0x04) len 4
        Handle range: 0x002f-0x002f
< HCI Command: Host Number of Com.. (0x03|0x0035) plen 5  #117 [hci1] 11.404965
        Num handles: 1
        Handle: 3657 Address: DF:A9:FF:F6:B1:1A (OUI DF-A9-FF)
        Count: 1
< ACL Data TX: Handle 3657 flags 0x00 dlen 10             #118 [hci1] 11.404988
      ATT: Find Information Response (0x05) len 5
        Format: UUID-16 (0x01)
        Handle: 0x002f
        UUID: Client Characteristic Configuration (0x2902)
> HCI Event: Number of Completed Packets (0x13) plen 5    #119 [hci1] 11.701139
        Num handles: 1
        Handle: 3657 Address: DF:A9:FF:F6:B1:1A (OUI DF-A9-FF)
        Count: 1
        #118: len 10 (0 Kb/s)
        Latency: 296 msec (145-296 msec ~295 msec)
> ACL Data RX: Handle 3657 flags 0x02 dlen 9              #120 [hci1] 11.701451
      ATT: Find Information Request (0x04) len 4
        Handle range: 0x0032-0x0032
< HCI Command: Host Number of Com.. (0x03|0x0035) plen 5  #121 [hci1] 11.704879
        Num handles: 1
        Handle: 3657 Address: DF:A9:FF:F6:B1:1A (OUI DF-A9-FF)
        Count: 1
< ACL Data TX: Handle 3657 flags 0x00 dlen 10             #122 [hci1] 11.704890
      ATT: Find Information Response (0x05) len 5
        Format: UUID-16 (0x01)
        Handle: 0x0032
        UUID: Client Characteristic Configuration (0x2902)
> HCI Event: Number of Completed Packets (0x13) plen 5    #123 [hci1] 12.001101
        Num handles: 1
        Handle: 3657 Address: DF:A9:FF:F6:B1:1A (OUI DF-A9-FF)
        Count: 1
        #122: len 10 (0 Kb/s)
        Latency: 296 msec (145-296 msec ~295 msec)
> ACL Data RX: Handle 3657 flags 0x02 dlen 9              #124 [hci1] 12.001333
      ATT: Write Request (0x12) len 4
        Handle: 0x002f
          Data: 0000
< HCI Command: Host Number of Com.. (0x03|0x0035) plen 5  #125 [hci1] 12.005115
        Num handles: 1
        Handle: 3657 Address: DF:A9:FF:F6:B1:1A (OUI DF-A9-FF)
        Count: 1
< ACL Data TX: Handle 3657 flags 0x00 dlen 5              #126 [hci1] 12.005153
      ATT: Write Response (0x13) len 0
> HCI Event: Number of Completed Packets (0x13) plen 5    #127 [hci1] 12.301148
        Num handles: 1
        Handle: 3657 Address: DF:A9:FF:F6:B1:1A (OUI DF-A9-FF)
        Count: 1
        #126: len 5 (0 Kb/s)
        Latency: 295 msec (145-296 msec ~295 msec)
> ACL Data RX: Handle 3657 flags 0x02 dlen 9              #128 [hci1] 12.301368
      ATT: Write Request (0x12) len 4
        Handle: 0x002f
          Data: 0200
< HCI Command: Host Number of Com.. (0x03|0x0035) plen 5  #129 [hci1] 12.305731
        Num handles: 1
        Handle: 3657 Address: DF:A9:FF:F6:B1:1A (OUI DF-A9-FF)
        Count: 1
< ACL Data TX: Handle 3657 flags 0x00 dlen 5              #130 [hci1] 12.305839
      ATT: Write Response (0x13) len 0
> HCI Event: Number of Completed Packets (0x13) plen 5    #131 [hci1] 12.601139
        Num handles: 1
        Handle: 3657 Address: DF:A9:FF:F6:B1:1A (OUI DF-A9-FF)
        Count: 1
        #130: len 5 (0 Kb/s)
        Latency: 295 msec (145-296 msec ~295 msec)
> ACL Data RX: Handle 3657 flags 0x02 dlen 9              #132 [hci1] 12.601339
      ATT: Write Request (0x12) len 4
        Handle: 0x0032
          Data: 0000
< HCI Command: Host Number of Com.. (0x03|0x0035) plen 5  #133 [hci1] 12.605563
        Num handles: 1
        Handle: 3657 Address: DF:A9:FF:F6:B1:1A (OUI DF-A9-FF)
        Count: 1
< ACL Data TX: Handle 3657 flags 0x00 dlen 5              #134 [hci1] 12.605668
      ATT: Write Response (0x13) len 0
> HCI Event: Number of Completed Packets (0x13) plen 5    #135 [hci1] 12.901123
        Num handles: 1
        Handle: 3657 Address: DF:A9:FF:F6:B1:1A (OUI DF-A9-FF)
        Count: 1
        #134: len 5 (0 Kb/s)
        Latency: 295 msec (145-296 msec ~295 msec)
> ACL Data RX: Handle 3657 flags 0x02 dlen 9              #136 [hci1] 12.901322
      ATT: Write Request (0x12) len 4
        Handle: 0x0032
          Data: 0100
< HCI Command: Host Number of Com.. (0x03|0x0035) plen 5  #137 [hci1] 12.905659
        Num handles: 1
        Handle: 3657 Address: DF:A9:FF:F6:B1:1A (OUI DF-A9-FF)
        Count: 1
< ACL Data TX: Handle 3657 flags 0x00 dlen 5              #138 [hci1] 12.905822
      ATT: Write Response (0x13) len 0
> HCI Event: Number of Completed Packets (0x13) plen 5    #139 [hci1] 13.201119
        Num handles: 1
        Handle: 3657 Address: DF:A9:FF:F6:B1:1A (OUI DF-A9-FF)
        Count: 1
        #138: len 5 (0 Kb/s)
        Latency: 295 msec (145-296 msec ~295 msec)
> ACL Data RX: Handle 3657 flags 0x02 dlen 7              #140 [hci1] 13.201344
      ATT: Read Request (0x0a) len 2
        Handle: 0x002c
< HCI Command: Host Number of Com.. (0x03|0x0035) plen 5  #141 [hci1] 13.205591
        Num handles: 1
        Handle: 3657 Address: DF:A9:FF:F6:B1:1A (OUI DF-A9-FF)
        Count: 1
< ACL Data TX: Handle 3657 flags 0x00 dlen 6              #142 [hci1] 13.205678
      ATT: Read Response (0x0b) len 1
> HCI Event: Number of Completed Packets (0x13) plen 5    #143 [hci1] 13.500989
        Num handles: 1
        Handle: 3657 Address: DF:A9:FF:F6:B1:1A (OUI DF-A9-FF)
        Count: 1
        #142: len 6 (0 Kb/s)
        Latency: 295 msec (145-296 msec ~295 msec)
> HCI Event: Disconnect Complete (0x05) plen 4            #144 [hci1] 13.651269
        Status: Success (0x00)
        Handle: 3657 Address: DF:A9:FF:F6:B1:1A (OUI DF-A9-FF)
        Reason: Remote User Terminated Connection (0x13)
< HCI Command: LE Set Extended A.. (0x08|0x0036) plen 25  #145 [hci1] 16.945682
        Handle: 0x00
        Properties: 0x0013
          Connectable
          Scannable
          Use legacy advertising PDUs: ADV_IND
        Min advertising interval: 100.000 msec (0x00a0)
        Max advertising interval: 150.000 msec (0x00f0)
        Channel map: 37, 38, 39 (0x07)
        Own address type: Random (0x01)
        Peer address type: Public (0x00)
        Peer address: 00:00:00:00:00:00 (OUI 00-00-00)
        Filter policy: Allow Scan Request from Any, Allow Connect Request from Any (0x00)
        TX power: Host has no preference (0x7f)
        Primary PHY: LE 1M (0x01)
        Secondary max skip: 0x00
        Secondary PHY: LE 1M (0x01)
        SID: 0x00
        Scan request notifications: Disabled (0x00)
> HCI Event: Command Complete (0x0e) plen 5               #146 [hci1] 16.946540
      LE Set Extended Advertising Parameters (0x08|0x0036) ncmd 1
        Status: Success (0x00)
        TX power (selected): 0 dbm (0x00)
< HCI Command: LE Set Advertising.. (0x08|0x0035) plen 7  #147 [hci1] 16.965030
        Advertising handle: 0x00
        Advertising random address: D5:B6:CC:31:DB:3B (Static)
> HCI Event: Command Complete (0x0e) plen 4               #148 [hci1] 16.965499
      LE Set Advertising Set Random Address (0x08|0x0035) ncmd 1
        Status: Success (0x00)
< HCI Command: LE Set Extended A.. (0x08|0x0037) plen 22  #149 [hci1] 16.985024
        Handle: 0x00
        Operation: Complete extended advertising data (0x03)
        Fragment preference: Minimize fragmentation (0x01)
        Data length: 0x12
        Flags: 0x06
          LE General Discoverable Mode
          BR/EDR Not Supported
        Name (complete): Tester_F6B11A
> HCI Event: Command Complete (0x0e) plen 4               #150 [hci1] 16.985725
      LE Set Extended Advertising Data (0x08|0x0037) ncmd 1
        Status: Success (0x00)
< HCI Command: LE Set Extended Sc.. (0x08|0x0038) plen 4  #151 [hci1] 17.005043
        Handle: 0x00
        Operation: Complete scan response data (0x03)
        Fragment preference: Minimize fragmentation (0x01)
        Data length: 0x00
> HCI Event: Command Complete (0x0e) plen 4               #152 [hci1] 17.005538
      LE Set Extended Scan Response Data (0x08|0x0038) ncmd 1
        Status: Success (0x00)
< HCI Command: LE Set Extended Ad.. (0x08|0x0039) plen 6  #153 [hci1] 17.025045
        Extended advertising: Enabled (0x01)
        Number of sets: 1 (0x01)
        Entry 0
          Handle: 0x00
          Duration: 0 ms (0x00)
          Max ext adv events: 0
> HCI Event: Command Complete (0x0e) plen 4               #154 [hci1] 17.025638
      LE Set Extended Advertising Enable (0x08|0x0039) ncmd 1
        Status: Success (0x00)
> HCI Event: LE Meta Event (0x3e) plen 31                 #155 [hci1] 17.143212
      LE Enhanced Connection Complete (0x0a)
        Status: Success (0x00)
        Handle: 3675
        Role: Peripheral (0x01)
        Peer address type: Public (0x00)
        Peer address: DF:A9:FF:F6:B1:1A (OUI DF-A9-FF)
        Local resolvable private address: 00:00:00:00:00:00 (Non-Resolvable)
        Peer resolvable private address: 00:00:00:00:00:00 (Non-Resolvable)
        Connection interval: 87.50 msec (0x0046)
        Connection latency: 0 (0x0000)
        Supervision timeout: 25120 msec (0x09d0)
        Central clock accuracy: 0x01
> HCI Event: LE Meta Event (0x3e) plen 6                  #156 [hci1] 17.143279
      LE Advertising Set Terminated (0x12)
        Status: Success (0x00)
        Handle: 0
        Connection handle: 3675
        Number of completed extended advertising events: 0
< HCI Command: LE Read Remote Use.. (0x08|0x0016) plen 2  #157 [hci1] 17.145975
        Handle: 3675 Address: DF:A9:FF:F6:B1:1A (OUI DF-A9-FF)
< ACL Data TX: Handle 3675 flags 0x00 dlen 6              #158 [hci1] 17.145997
      SMP: Security Request (0x0b) len 1
        Authentication requirement: Bonding, No MITM, SC, No Keypresses (0x09)
< ACL Data TX: Handle 3675 flags 0x00 dlen 7              #159 [hci1] 17.146001
      ATT: Exchange MTU Request (0x02) len 2
        Client RX MTU: 251
> HCI Event: Command Status (0x0f) plen 4                 #160 [hci1] 17.146553
      LE Read Remote Used Features (0x08|0x0016) ncmd 1
        Status: Success (0x00)
> HCI Event: Number of Completed Packets (0x13) plen 5    #161 [hci1] 17.232129
        Num handles: 1
        Handle: 3675 Address: DF:A9:FF:F6:B1:1A (OUI DF-A9-FF)
        Count: 1
        #158: len 6 (0 Kb/s)
        Latency: 86 msec (86-86 msec ~86 msec)
> HCI Event: Number of Completed Packets (0x13) plen 5    #162 [hci1] 17.319284
        Num handles: 1
        Handle: 3675 Address: DF:A9:FF:F6:B1:1A (OUI DF-A9-FF)
        Count: 1
        #159: len 7 (0 Kb/s)
        Latency: 173 msec (86-173 msec ~129 msec)
> HCI Event: LE Meta Event (0x3e) plen 12                 #163 [hci1] 17.407139
      LE Read Remote Used Features (0x04)
        Status: Success (0x00)
        Handle: 3675 Address: DF:A9:FF:F6:B1:1A (OUI DF-A9-FF)
        Features: 0x2d 0x49 0x00 0xf7 0x67 0xd9 0x00 0x80
          LE Encryption
          Extended Reject Indication
          Peripheral-initiated Features Exchange
          LE Data Packet Length Extension
          LE 2M PHY
          LE Coded PHY
          Channel Selection Algorithm #2
          Periodic Advertising Sync Transfer - Sender
          Periodic Advertising Sync Transfer - Recipient
          Sleep Clock Accuracy Updates
          Connected Isochronous Stream - Central
          Connected Isochronous Stream - Peripheral
          Isochronous Broadcaster
          Synchronized Receiver
          Connected Isochronous Stream (Host Support)
          LE Power Control Request
          LE Power Control Request
          Connection Subrating
          Connection Subrating (Host Support)
          Unknown features (0x8000d90000000000)
> ACL Data RX: Handle 3675 flags 0x02 dlen 7              #164 [hci1] 17.844219
      ATT: Exchange MTU Request (0x02) len 2
        Client RX MTU: 49
> ACL Data RX: Handle 3675 flags 0x02 dlen 7              #165 [hci1] 17.844662
      ATT: Exchange MTU Response (0x03) len 2
        Server RX MTU: 49
< HCI Command: Host Number of Com.. (0x03|0x0035) plen 5  #166 [hci1] 17.845163
        Num handles: 1
        Handle: 3675 Address: DF:A9:FF:F6:B1:1A (OUI DF-A9-FF)
        Count: 1
< ACL Data TX: Handle 3675 flags 0x00 dlen 7              #167 [hci1] 17.845212
      ATT: Exchange MTU Response (0x03) len 2
        Server RX MTU: 251
< HCI Command: Host Number of Com.. (0x03|0x0035) plen 5  #168 [hci1] 17.845397
        Num handles: 1
        Handle: 3675 Address: DF:A9:FF:F6:B1:1A (OUI DF-A9-FF)
        Count: 1
> HCI Event: LE Meta Event (0x3e) plen 13                 #169 [hci1] 17.932252
      LE Long Term Key Request (0x05)
        Handle: 3675 Address: DF:A9:FF:F6:B1:1A (OUI DF-A9-FF)
        Random number: 0x0000000000000000
        Encrypted diversifier: 0x0000
< HCI Command: LE Long Term Key... (0x08|0x001a) plen 18  #170 [hci1] 17.945288
        Handle: 3675 Address: DF:A9:FF:F6:B1:1A (OUI DF-A9-FF)
        Long term key: e077b53e1bac69cb0a007c4ee5bed11f
> HCI Event: Command Complete (0x0e) plen 6               #171 [hci1] 17.946002
      LE Long Term Key Request Reply (0x08|0x001a) ncmd 1
        Status: Success (0x00)
        Handle: 3675 Address: DF:A9:FF:F6:B1:1A (OUI DF-A9-FF)
> HCI Event: Number of Completed Packets (0x13) plen 5    #172 [hci1] 18.019185
        Num handles: 1
        Handle: 3675 Address: DF:A9:FF:F6:B1:1A (OUI DF-A9-FF)
        Count: 1
        #167: len 7 (0 Kb/s)
        Latency: 173 msec (86-173 msec ~151 msec)
> HCI Event: Encryption Change (0x08) plen 4              #173 [hci1] 18.369410
        Status: Success (0x00)
        Handle: 3675 Address: DF:A9:FF:F6:B1:1A (OUI DF-A9-FF)
        Encryption: Enabled with AES-CCM (0x01)
< ACL Data TX: Handle 3675 flags 0x00 dlen 21             #174 [hci1] 18.386142
      ATT: Handle Value Indication (0x1d) len 16
        Handle: 0x002e
          Data: 03000000010352414e444f4d5f31
< ACL Data TX: Handle 3675 flags 0x00 dlen 8              #175 [hci1] 18.386358
      ATT: Handle Value Notification (0x1b) len 3
        Handle: 0x0031
          Data: 08
> HCI Event: Number of Completed Packets (0x13) plen 5    #176 [hci1] 18.544251
        Num handles: 1
        Handle: 3675 Address: DF:A9:FF:F6:B1:1A (OUI DF-A9-FF)
        Count: 1
        #174: len 21 (1 Kb/s)
        Latency: 158 msec (86-173 msec ~154 msec)
> ACL Data RX: Handle 3675 flags 0x02 dlen 5              #177 [hci1] 18.544349
      ATT: Handle Value Confirmation (0x1e) len 0
< HCI Command: Host Number of Com.. (0x03|0x0035) plen 5  #178 [hci1] 18.545848
        Num handles: 1
        Handle: 3675 Address: DF:A9:FF:F6:B1:1A (OUI DF-A9-FF)
        Count: 1
< ACL Data TX: Handle 3675 flags 0x00 dlen 26             #179 [hci1] 18.545941
      ATT: Handle Value Indication (0x1d) len 21
        Handle: 0x002e
          Data: 0300000102034e6577204e616d65204974656d
> HCI Event: Number of Completed Packets (0x13) plen 5    #180 [hci1] 18.631685
        Num handles: 1
        Handle: 3675 Address: DF:A9:FF:F6:B1:1A (OUI DF-A9-FF)
        Count: 1
        #175: len 8 (0 Kb/s)
        Latency: 245 msec (86-245 msec ~200 msec)
> HCI Event: Number of Completed Packets (0x13) plen 5    #181 [hci1] 18.719236
        Num handles: 1
        Handle: 3675 Address: DF:A9:FF:F6:B1:1A (OUI DF-A9-FF)
        Count: 1
        #179: len 26 (1 Kb/s)
        Latency: 173 msec (86-245 msec ~186 msec)
> ACL Data RX: Handle 3675 flags 0x02 dlen 5              #182 [hci1] 18.719465
      ATT: Handle Value Confirmation (0x1e) len 0
< HCI Command: Host Number of Com.. (0x03|0x0035) plen 5  #183 [hci1] 18.725781
        Num handles: 1
        Handle: 3675 Address: DF:A9:FF:F6:B1:1A (OUI DF-A9-FF)
        Count: 1
< ACL Data TX: Handle 3675 flags 0x00 dlen 21             #184 [hci1] 18.725885
      ATT: Handle Value Indication (0x1d) len 16
        Handle: 0x002e
          Data: 0300000203005052455345545f33
> HCI Event: Number of Completed Packets (0x13) plen 5    #185 [hci1] 18.894265
        Num handles: 1
        Handle: 3675 Address: DF:A9:FF:F6:B1:1A (OUI DF-A9-FF)
        Count: 1
        #184: len 21 (1 Kb/s)
        Latency: 168 msec (86-245 msec ~177 msec)
> ACL Data RX: Handle 3675 flags 0x02 dlen 5              #186 [hci1] 18.894521
      ATT: Handle Value Confirmation (0x1e) len 0
< HCI Command: Host Number of Com.. (0x03|0x0035) plen 5  #187 [hci1] 18.905569
        Num handles: 1
        Handle: 3675 Address: DF:A9:FF:F6:B1:1A (OUI DF-A9-FF)
        Count: 1
< ACL Data TX: Handle 3675 flags 0x00 dlen 21             #188 [hci1] 18.905595
      ATT: Handle Value Indication (0x1d) len 16
        Handle: 0x002e
          Data: 0300000306035052455345545f36
> HCI Event: Number of Completed Packets (0x13) plen 5    #189 [hci1] 19.069235
        Num handles: 1
        Handle: 3675 Address: DF:A9:FF:F6:B1:1A (OUI DF-A9-FF)
        Count: 1
        #188: len 21 (1 Kb/s)
        Latency: 163 msec (86-245 msec ~170 msec)
> ACL Data RX: Handle 3675 flags 0x02 dlen 5              #190 [hci1] 19.069366
      ATT: Handle Value Confirmation (0x1e) len 0
< HCI Command: Host Number of Com.. (0x03|0x0035) plen 5  #191 [hci1] 19.085731
        Num handles: 1
        Handle: 3675 Address: DF:A9:FF:F6:B1:1A (OUI DF-A9-FF)
        Count: 1
< ACL Data TX: Handle 3675 flags 0x00 dlen 21             #192 [hci1] 19.085858
      ATT: Handle Value Indication (0x1d) len 16
        Handle: 0x002e
          Data: 0300010608035052455345545f38
> HCI Event: Number of Completed Packets (0x13) plen 5    #193 [hci1] 19.244271
        Num handles: 1
        Handle: 3675 Address: DF:A9:FF:F6:B1:1A (OUI DF-A9-FF)
        Count: 1
        #192: len 21 (1 Kb/s)
        Latency: 158 msec (86-245 msec ~164 msec)
> ACL Data RX: Handle 3675 flags 0x02 dlen 5              #194 [hci1] 19.244417
      ATT: Handle Value Confirmation (0x1e) len 0
< HCI Command: Host Number of Com.. (0x03|0x0035) plen 5  #195 [hci1] 19.245709
        Num handles: 1
        Handle: 3675 Address: DF:A9:FF:F6:B1:1A (OUI DF-A9-FF)
        Count: 1
> HCI Event: Disconnect Complete (0x05) plen 4            #196 [hci1] 20.644404
        Status: Success (0x00)
        Handle: 3675 Address: DF:A9:FF:F6:B1:1A (OUI DF-A9-FF)
        Reason: Remote User Terminated Connection (0x13)
< HCI Command: Reset (0x03|0x0003) plen 0                 #197 [hci1] 24.365567
> HCI Event: Command Complete (0x0e) plen 4               #198 [hci1] 24.366075
      Reset (0x03|0x0003) ncmd 1
        Status: Success (0x00)
@ USER Close: main                                    {0x0001} [hci1] 24.385163
= Close Index: 00:00:00:00:00:00                               [hci1] 24.385186
