Bluetooth monitor ver 5.72
= Note: Linux version 6.14.0-36-generic (x86_64)                       0.694593
= Note: Bluetooth subsystem version 2.22                               0.694595
= New Index: 00:00:00:00:00:00 (Primary,UART,hci1)              [hci1] 0.694596
= New Index: 48:5F:99:8E:E0:64 (Primary,USB,hci0)               [hci0] 0.694596
= Open Index: 00:00:00:00:00:00                                 [hci1] 0.808476
= Index Info: 00:00:00:00:00:00 (Nordic Semiconductor ASA)      [hci1] 0.808491
@ USER Open: main (privileged) version 2.22            {0x0001} [hci1] 0.808501
< HCI Command: Reset (0x03|0x0003) plen 0                    #1 [hci1] 0.809783
> HCI Event: Command Complete (0x0e) plen 4                  #2 [hci1] 0.810320
      Reset (0x03|0x0003) ncmd 1
        Status: Success (0x00)
< HCI Command: Read Local Supported... (0x04|0x0003) plen 0  #3 [hci1] 0.828263
> HCI Event: Command Complete (0x0e) plen 12                 #4 [hci1] 0.828744
      Read Local Supported Features (0x04|0x0003) ncmd 1
        Status: Success (0x00)
        Features: 0x00 0x00 0x00 0x00 0x60 0x00 0x00 0x00
          BR/EDR Not Supported
          LE Supported (Controller)
< HCI Command: Read Local Version In.. (0x04|0x0001) plen 0  #5 [hci1] 0.847883
> HCI Event: Command Complete (0x0e) plen 12                 #6 [hci1] 0.848394
      Read Local Version Information (0x04|0x0001) ncmd 1
        Status: Success (0x00)
        HCI version: Reserved (0x0f) - Revision 12393 (0x3069)
        LMP version: Reserved (0x0f) - Subversion 12393 (0x3069)
        Manufacturer: Nordic Semiconductor ASA (89)
< HCI Command: Read Local Supported... (0x04|0x0002) plen 0  #7 [hci1] 0.867835
> HCI Event: Command Complete (0x0e) plen 68                 #8 [hci1] 0.868893
      Read Local Supported Commands (0x04|0x0002) ncmd 1
        Status: Success (0x00)
        Commands: 119 entries
          Disconnect (Octet 0 - Bit 5)
          Read Remote Version Information (Octet 2 - Bit 7)
          Set Event Mask (Octet 5 - Bit 6)
          Reset (Octet 5 - Bit 7)
          Read Connection Accept Timeout (Octet 7 - Bit 2)
          Write Connection Accept Timeout (Octet 7 - Bit 3)
          Read Transmit Power Level (Octet 10 - Bit 2)
          Set Controller To Host Flow Control (Octet 10 - Bit 5)
          Host Buffer Size (Octet 10 - Bit 6)
          Host Number of Completed Packets (Octet 10 - Bit 7)
          Read Local Version Information (Octet 14 - Bit 3)
          Read Local Supported Features (Octet 14 - Bit 5)
          Read BD ADDR (Octet 15 - Bit 1)
          Read RSSI (Octet 15 - Bit 5)
          Set Event Mask Page 2 (Octet 22 - Bit 2)
          LE Set Event Mask (Octet 25 - Bit 0)
          LE Read Buffer Size (Octet 25 - Bit 1)
          LE Read Local Supported Features (Octet 25 - Bit 2)
          LE Set Random Address (Octet 25 - Bit 4)
          LE Set Advertising Parameters (Octet 25 - Bit 5)
          LE Read Advertising Channel TX Power (Octet 25 - Bit 6)
          LE Set Advertising Data (Octet 25 - Bit 7)
          LE Set Scan Response Data (Octet 26 - Bit 0)
          LE Set Advertise Enable (Octet 26 - Bit 1)
          LE Set Scan Parameters (Octet 26 - Bit 2)
          LE Set Scan Enable (Octet 26 - Bit 3)
          LE Create Connection (Octet 26 - Bit 4)
          LE Create Connection Cancel (Octet 26 - Bit 5)
          LE Read Accept List Size (Octet 26 - Bit 6)
          LE Clear Accept List (Octet 26 - Bit 7)
          LE Add Device To Accept List (Octet 27 - Bit 0)
          LE Remove Device From Accept List (Octet 27 - Bit 1)
          LE Connection Update (Octet 27 - Bit 2)
          LE Set Host Channel Classification (Octet 27 - Bit 3)
          LE Read Channel Map (Octet 27 - Bit 4)
          LE Read Remote Used Features (Octet 27 - Bit 5)
          LE Encrypt (Octet 27 - Bit 6)
          LE Rand (Octet 27 - Bit 7)
          LE Start Encryption (Octet 28 - Bit 0)
          LE Long Term Key Request Reply (Octet 28 - Bit 1)
          LE Long Term Key Request Neg Reply (Octet 28 - Bit 2)
          LE Read Supported States (Octet 28 - Bit 3)
          LE Receiver Test (Octet 28 - Bit 4)
          LE Transmitter Test (Octet 28 - Bit 5)
          LE Test End (Octet 28 - Bit 6)
          Read Authenticated Payload Timeout (Octet 32 - Bit 4)
          Write Authenticated Payload Timeout (Octet 32 - Bit 5)
          LE Set Data Length (Octet 33 - Bit 6)
          LE Read Suggested Default Data Length (Octet 33 - Bit 7)
          LE Write Suggested Default Data Length (Octet 34 - Bit 0)
          LE Add Device To Resolving List (Octet 34 - Bit 3)
          LE Remove Device From Resolving List (Octet 34 - Bit 4)
          LE Clear Resolving List (Octet 34 - Bit 5)
          LE Read Resolving List Size (Octet 34 - Bit 6)
          LE Set Address Resolution Enable (Octet 35 - Bit 1)
          LE Set Resolvable Private Address Timeout (Octet 35 - Bit 2)
          LE Read Maximum Data Length (Octet 35 - Bit 3)
          LE Read PHY (Octet 35 - Bit 4)
          LE Set Default PHY (Octet 35 - Bit 5)
          LE Set PHY (Octet 35 - Bit 6)
          LE Enhanced Receiver Test (Octet 35 - Bit 7)
          LE Enhanced Transmitter Test (Octet 36 - Bit 0)
          LE Set Advertising Set Random Address (Octet 36 - Bit 1)
          LE Set Extended Advertising Parameters (Octet 36 - Bit 2)
          LE Set Extended Advertising Data (Octet 36 - Bit 3)
          LE Set Extended Scan Response Data (Octet 36 - Bit 4)
          LE Set Extended Advertising Enable (Octet 36 - Bit 5)
          LE Read Maximum Advertising Data Length (Octet 36 - Bit 6)
          LE Read Number of Supported Advertising Sets (Octet 36 - Bit 7)
          LE Remove Advertising Set (Octet 37 - Bit 0)
          LE Clear Advertising Sets (Octet 37 - Bit 1)
          LE Set Periodic Advertising Parameters (Octet 37 - Bit 2)
          LE Set Periodic Advertising Data (Octet 37 - Bit 3)
          LE Set Periodic Advertising Enable (Octet 37 - Bit 4)
          LE Set Extended Scan Parameters (Octet 37 - Bit 5)
          LE Set Extended Scan Enable (Octet 37 - Bit 6)
          LE Extended Create Connection (Octet 37 - Bit 7)
          LE Periodic Advertising Create Sync (Octet 38 - Bit 0)
          LE Periodic Advertising Create Sync Cancel (Octet 38 - Bit 1)
          LE Periodic Advertising Terminate Sync (Octet 38 - Bit 2)
          LE Add Device To Periodic Advertiser List (Octet 38 - Bit 3)
          LE Remove Device From Periodic Advertiser List (Octet 38 - Bit 4)
          LE Clear Periodic Advertiser List (Octet 38 - Bit 5)
          LE Read Periodic Advertiser List Size (Octet 38 - Bit 6)
          LE Read Transmit Power (Octet 38 - Bit 7)
          LE Read RF Path Compensation (Octet 39 - Bit 0)
          LE Write RF Path Compensation (Octet 39 - Bit 1)
          LE Set Privacy Mode (Octet 39 - Bit 2)
          LE Periodic Advertising Receive Enable (Octet 40 - Bit 5)
          LE Periodic Advertising Sync Transfer (Octet 40 - Bit 6)
          LE Periodic Advertising Set Info Transfer (Octet 40 - Bit 7)
          LE Periodic Advertising Sync Transfer Parameters (Octet 41 - Bit 0)
          LE Set Default Periodic Advertisng Sync Transfer Parameters (Octet 41 - Bit 1)
          LE Read Buffer v2 (Octet 41 - Bit 5)
          LE Read ISO TX Sync (Octet 41 - Bit 6)
          LE Set Connected Isochronous Group Parameters (Octet 41 - Bit 7)
          LE Set Connected Isochronous Group Parameters Test (Octet 42 - Bit 0)
          LE Create Connected Isochronous Stream (Octet 42 - Bit 1)
          LE Remove Connected Isochronous Group (Octet 42 - Bit 2)
          LE Accept Connected Isochronous Stream Request (Octet 42 - Bit 3)
          LE Reject Connected Isochronous Stream Request (Octet 42 - Bit 4)
          LE Create Broadcast Isochronous Group (Octet 42 - Bit 5)
          LE Create Broadcast Isochronous Group Test (Octet 42 - Bit 6)
          LE Terminate Broadcast Isochronous Group (Octet 42 - Bit 7)
          LE Broadcast Isochronous Group Create Sync (Octet 43 - Bit 0)
          LE Broadcast Isochronous Group Terminate Sync (Octet 43 - Bit 1)
          LE Request Peer SCA (Octet 43 - Bit 2)
          LE Setup Isochronous Data Path (Octet 43 - Bit 3)
          LE Remove Isochronous Data Path (Octet 43 - Bit 4)
          LE Isochronous Transmit Test (Octet 43 - Bit 5)
          LE Isochronous Receive Test (Octet 43 - Bit 6)
          LE Isochronous Read Test Counters (Octet 43 - Bit 7)
          LE Isochronous Read Test Counters (Octet 44 - Bit 0)
          LE Set Host Feature (Octet 44 - Bit 1)
          Octet 44 - Bit 2 
          Octet 45 - Bit 6 
          Octet 46 - Bit 0 
          Octet 46 - Bit 1 
          Octet 46 - Bit 2 
< HCI Command: Host Buffer Size (0x03|0x0033) plen 7         #9 [hci1] 0.887824
        ACL MTU: 255  ACL max packet: 16
        SCO MTU: 0    SCO max packet: 0
> HCI Event: Command Complete (0x0e) plen 4                 #10 [hci1] 0.888282
      Host Buffer Size (0x03|0x0033) ncmd 1
        Status: Success (0x00)
< HCI Command: Set Controller To Ho.. (0x03|0x0031) plen 1  #11 [hci1] 0.907826
        Flow control: ACL Data Packets (0x01)
> HCI Event: Command Complete (0x0e) plen 4                 #12 [hci1] 0.908251
      Set Controller To Host Flow Control (0x03|0x0031) ncmd 1
        Status: Success (0x00)
< HCI Command: LE Read Local Suppor.. (0x08|0x0003) plen 0  #13 [hci1] 0.927801
> HCI Event: Command Complete (0x0e) plen 12                #14 [hci1] 0.928278
      LE Read Local Supported Features (0x08|0x0003) ncmd 1
        Status: Success (0x00)
        Features: 0xfd 0x79 0x00 0xf7 0x30 0x01 0x00 0x00
          LE Encryption
          Extended Reject Indication
          Peripheral-initiated Features Exchange
          LE Ping
          LE Data Packet Length Extension
          LL Privacy
          Extended Scanner Filter Policies
          LE 2M PHY
          LE Coded PHY
          LE Extended Advertising
          LE Periodic Advertising
          Channel Selection Algorithm #2
          Periodic Advertising Sync Transfer - Sender
          Periodic Advertising Sync Transfer - Recipient
          Sleep Clock Accuracy Updates
          Connected Isochronous Stream - Central
          Connected Isochronous Stream - Peripheral
          Isochronous Broadcaster
          Synchronized Receiver
          Periodic Advertising ADI support
          Connection Subrating
          Unknown features (0x0000010000000000)
< HCI Command: LE Set Host Feature (0x08|0x0074) plen 2     #15 [hci1] 0.947864
        Bit Number: 32
          Connected Isochronous Stream (Host Support)
        Bit Value: 1
> HCI Event: Command Complete (0x0e) plen 4                 #16 [hci1] 0.948226
      LE Set Host Feature (0x08|0x0074) ncmd 1
        Status: Success (0x00)
< HCI Command: LE Read Buffer v2 (0x08|0x0060) plen 0       #17 [hci1] 0.967786
> HCI Event: Command Complete (0x0e) plen 10                #18 [hci1] 0.968273
      LE Read Buffer v2 (0x08|0x0060) ncmd 1
        Status: Success (0x00)
        ACL MTU: 27
        ACL max packet: 3
        ISO MTU: 318
        ISO max packet: 3
< HCI Command: LE Read Maximum Adve.. (0x08|0x003a) plen 0  #19 [hci1] 0.987870
> HCI Event: Command Complete (0x0e) plen 6                 #20 [hci1] 0.988307
      LE Read Maximum Advertising Data Length (0x08|0x003a) ncmd 1
        Status: Success (0x00)
        Max length: 1650
< HCI Command: LE Read Supported St.. (0x08|0x001c) plen 0  #21 [hci1] 1.007771
> HCI Event: Command Complete (0x0e) plen 12                #22 [hci1] 1.008348
      LE Read Supported States (0x08|0x001c) ncmd 1
        Status: Success (0x00)
        States: 0x000003ff3e0306ff
          Non-connectable Advertising State
          Scannable Advertising State
          Connectable Advertising State
          High Duty Cycle Directed Advertising State
          Passive Scanning State
          Active Scanning State
          Initiating State
            and Connection State (Central Role)
          Connection State (Peripheral Role)
          Scannable Advertising State
            and Passive Scanning State
          Connectable Advertising State
            and Passive Scanning State
          Non-connectable Advertising State
            and Initiating State
          Scannable Advertising State
            and Initiating State
          Active Scanning State
            and Connection State (Central Role)
          Passive Scanning State
            and Connection State (Peripheral Role)
          Active Scanning State
            and Connection State (Peripheral Role)
          Initiating State
            and Connection State (Central Role)
            and Central Role & Central Role
          Low Duty Cycle Directed Advertising State
          Connectable Advertising State
            and Initiating State
            and Central Role & Peripheral Role
          High Duty Cycle Directed Advertising State
            and Initiating State
            and Central Role & Peripheral Role
          Low Duty Cycle Directed Advertising State
            and Initiating State
            and Central Role & Peripheral Role
          Connectable Advertising State
            and Connection State (Central Role)
            and Central Role & Peripheral Role
          High Duty Cycle Directed Advertising State
            and Connection State (Central Role)
            and Central Role & Peripheral Role
          Low Duty Cycle Directed Advertising State
            and Connection State (Central Role)
            and Central Role & Peripheral Role
          Connectable Advertising State
            and Connection State (Peripheral Role)
            and Central Role & Peripheral Role
          High Duty Cycle Directed Advertising State
            and Connection State (Peripheral Role)
            and Peripheral Role & Peripheral Role
          Low Duty Cycle Directed Advertising State
            and Connection State (Peripheral Role)
            and Peripheral Role & Peripheral Role
          Initiating State
            and Connection State (Peripheral Role)
            and Central Role & Peripheral Role
< HCI Command: LE Read Maximum Data.. (0x08|0x002f) plen 0  #23 [hci1] 1.027801
> HCI Event: Command Complete (0x0e) plen 12                #24 [hci1] 1.028393
      LE Read Maximum Data Length (0x08|0x002f) ncmd 1
        Status: Success (0x00)
        Max TX octets: 251
        Max TX time: 2704
        Max RX octets: 251
        Max RX time: 2704
< HCI Command: LE Write Suggested D.. (0x08|0x0024) plen 4  #25 [hci1] 1.047841
        TX octets: 251
        TX time: 2704
> HCI Event: Command Complete (0x0e) plen 4                 #26 [hci1] 1.048335
      LE Write Suggested Default Data Length (0x08|0x0024) ncmd 1
        Status: Success (0x00)
< HCI Command: LE Read Resolving Li.. (0x08|0x002a) plen 0  #27 [hci1] 1.067831
> HCI Event: Command Complete (0x0e) plen 5                 #28 [hci1] 1.068194
      LE Read Resolving List Size (0x08|0x002a) ncmd 1
        Status: Success (0x00)
        Size: 8
< HCI Command: LE Set Event Mask (0x08|0x0001) plen 8       #29 [hci1] 1.087827
        Mask: 0x000002023f87fa5e
          LE Advertising Report
          LE Connection Update Complete
          LE Read Remote Used Features Complete
          LE Long Term Key Request
          LE Data Length Change
          LE Enhanced Connection Complete
          LE PHY Update Complete
          LE Extended Advertising Report
          LE Periodic Advertising Sync Established
          LE Periodic Advertising Report
          LE Periodic Advertising Sync Lost
          LE Extended Scan Timeout
          LE Extended Advertising Set Terminated
          LE Scan Request Received
          LE Periodic Advertising Sync Transfer Rvc
          LE CIS Established
          LE CIS Request
          LE Create BIG Complete
          LE Terminate BIG Complete
          LE BIG Sync Estabilished Complete
          LE BIG Sync Lost
          LE BIG Info Advertising Report
          Unknown mask (0x0000020000000000)
> HCI Event: Command Complete (0x0e) plen 4                 #30 [hci1] 1.088398
      LE Set Event Mask (0x08|0x0001) ncmd 1
        Status: Success (0x00)
< HCI Command: Set Event Mask (0x03|0x0001) plen 8          #31 [hci1] 1.107829
        Mask: 0x2000800002008890
          Disconnection Complete
          Encryption Change
          Read Remote Version Information Complete
          Hardware Error
          Data Buffer Overflow
          Encryption Key Refresh Complete
          LE Meta
> HCI Event: Command Complete (0x0e) plen 4                 #32 [hci1] 1.108370
      Set Event Mask (0x03|0x0001) ncmd 1
        Status: Success (0x00)
< HCI Command: Read BD ADDR (0x04|0x0009) plen 0            #33 [hci1] 1.127799
> HCI Event: Command Complete (0x0e) plen 10                #34 [hci1] 1.128290
      Read BD ADDR (0x04|0x0009) ncmd 1
        Status: Success (0x00)
        Address: 00:00:00:00:00:00 (OUI 00-00-00)
< HCI Command: LE Set Random Address (0x08|0x0005) plen 6   #35 [hci1] 1.147819
        Address: D5:B6:CC:31:DB:3B (Static)
> HCI Event: Command Complete (0x0e) plen 4                 #36 [hci1] 1.148339
      LE Set Random Address (0x08|0x0005) ncmd 1
        Status: Success (0x00)
< HCI Command: LE Set Extended Adv.. (0x08|0x0036) plen 25  #37 [hci1] 3.708543
        Handle: 0x00
        Properties: 0x0013
          Connectable
          Scannable
          Use legacy advertising PDUs: ADV_IND
        Min advertising interval: 100.000 msec (0x00a0)
        Max advertising interval: 150.000 msec (0x00f0)
        Channel map: 37, 38, 39 (0x07)
        Own address type: Random (0x01)
        Peer address type: Public (0x00)
        Peer address: 00:00:00:00:00:00 (OUI 00-00-00)
        Filter policy: Allow Scan Request from Any, Allow Connect Request from Any (0x00)
        TX power: Host has no preference (0x7f)
        Primary PHY: LE 1M (0x01)
        Secondary max skip: 0x00
        Secondary PHY: LE 1M (0x01)
        SID: 0x00
        Scan request notifications: Disabled (0x00)
> HCI Event: Command Complete (0x0e) plen 5                 #38 [hci1] 3.709355
      LE Set Extended Advertising Parameters (0x08|0x0036) ncmd 1
        Status: Success (0x00)
        TX power (selected): 0 dbm (0x00)
< HCI Command: LE Set Advertising S.. (0x08|0x0035) plen 7  #39 [hci1] 3.728087
        Advertising handle: 0x00
        Advertising random address: D5:B6:CC:31:DB:3B (Static)
> HCI Event: Command Complete (0x0e) plen 4                 #40 [hci1] 3.728601
      LE Set Advertising Set Random Address (0x08|0x0035) ncmd 1
        Status: Success (0x00)
< HCI Command: LE Set Extended Adv.. (0x08|0x0037) plen 22  #41 [hci1] 3.747919
        Handle: 0x00
        Operation: Complete extended advertising data (0x03)
        Fragment preference: Minimize fragmentation (0x01)
        Data length: 0x12
        Flags: 0x06
          LE General Discoverable Mode
          BR/EDR Not Supported
        Name (complete): Tester_F6B11A
> HCI Event: Command Complete (0x0e) plen 4                 #42 [hci1] 3.748667
      LE Set Extended Advertising Data (0x08|0x0037) ncmd 1
        Status: Success (0x00)
< HCI Command: LE Set Extended Scan.. (0x08|0x0038) plen 4  #43 [hci1] 3.767853
        Handle: 0x00
        Operation: Complete scan response data (0x03)
        Fragment preference: Minimize fragmentation (0x01)
        Data length: 0x00
> HCI Event: Command Complete (0x0e) plen 4                 #44 [hci1] 3.768298
      LE Set Extended Scan Response Data (0x08|0x0038) ncmd 1
        Status: Success (0x00)
< HCI Command: LE Set Extended Adve.. (0x08|0x0039) plen 6  #45 [hci1] 3.787863
        Extended advertising: Enabled (0x01)
        Number of sets: 1 (0x01)
        Entry 0
          Handle: 0x00
          Duration: 0 ms (0x00)
          Max ext adv events: 0
> HCI Event: Command Complete (0x0e) plen 4                 #46 [hci1] 3.788418
      LE Set Extended Advertising Enable (0x08|0x0039) ncmd 1
        Status: Success (0x00)
> HCI Event: LE Meta Event (0x3e) plen 31                   #47 [hci1] 3.897524
      LE Enhanced Connection Complete (0x0a)
        Status: Success (0x00)
        Handle: 3009
        Role: Peripheral (0x01)
        Peer address type: Public (0x00)
        Peer address: DF:A9:FF:F6:B1:1A (OUI DF-A9-FF)
        Local resolvable private address: 00:00:00:00:00:00 (Non-Resolvable)
        Peer resolvable private address: 00:00:00:00:00:00 (Non-Resolvable)
        Connection interval: 87.50 msec (0x0046)
        Connection latency: 0 (0x0000)
        Supervision timeout: 25120 msec (0x09d0)
        Central clock accuracy: 0x01
> HCI Event: LE Meta Event (0x3e) plen 6                    #48 [hci1] 3.897569
      LE Advertising Set Terminated (0x12)
        Status: Success (0x00)
        Handle: 0
        Connection handle: 3009
        Number of completed extended advertising events: 0
< HCI Command: LE Read Remote Used... (0x08|0x0016) plen 2  #49 [hci1] 3.909198
        Handle: 3009 Address: DF:A9:FF:F6:B1:1A (OUI DF-A9-FF)
< ACL Data TX: Handle 3009 flags 0x00 dlen 7                #50 [hci1] 3.909230
      ATT: Exchange MTU Request (0x02) len 2
        Client RX MTU: 251
> HCI Event: Command Status (0x0f) plen 4                   #51 [hci1] 3.909768
      LE Read Remote Used Features (0x08|0x0016) ncmd 1
        Status: Success (0x00)
> HCI Event: Number of Completed Packets (0x13) plen 5      #52 [hci1] 4.073503
        Num handles: 1
        Handle: 3009 Address: DF:A9:FF:F6:B1:1A (OUI DF-A9-FF)
        Count: 1
        #50: len 7 (0 Kb/s)
        Latency: 164 msec (164-164 msec ~164 msec)
> HCI Event: LE Meta Event (0x3e) plen 12                   #53 [hci1] 4.161410
      LE Read Remote Used Features (0x04)
        Status: Success (0x00)
        Handle: 3009 Address: DF:A9:FF:F6:B1:1A (OUI DF-A9-FF)
        Features: 0x2d 0x49 0x00 0xf7 0x67 0xd8 0x00 0x00
          LE Encryption
          Extended Reject Indication
          Peripheral-initiated Features Exchange
          LE Data Packet Length Extension
          LE 2M PHY
          LE Coded PHY
          Channel Selection Algorithm #2
          Periodic Advertising Sync Transfer - Sender
          Periodic Advertising Sync Transfer - Recipient
          Sleep Clock Accuracy Updates
          Connected Isochronous Stream - Central
          Connected Isochronous Stream - Peripheral
          Isochronous Broadcaster
          Synchronized Receiver
          Connected Isochronous Stream (Host Support)
          LE Power Control Request
          LE Power Control Request
          Connection Subrating
          Connection Subrating (Host Support)
          Unknown features (0x0000d80000000000)
> ACL Data RX: Handle 3009 flags 0x02 dlen 11               #54 [hci1] 6.611079
      SMP: Pairing Request (0x01) len 6
        IO capability: KeyboardDisplay (0x04)
        OOB data: Authentication data not present (0x00)
        Authentication requirement: Bonding, MITM, SC, No Keypresses (0x0d)
        Max encryption key size: 16
        Initiator key distribution: EncKey IdKey (0x03)
        Responder key distribution: EncKey IdKey Sign (0x07)
> ACL Data RX: Handle 3009 flags 0x02 dlen 7                #55 [hci1] 6.611562
      ATT: Exchange MTU Response (0x03) len 2
        Server RX MTU: 23
< HCI Command: Host Number of Compl.. (0x03|0x0035) plen 5  #56 [hci1] 6.628153
        Num handles: 1
        Handle: 3009 Address: DF:A9:FF:F6:B1:1A (OUI DF-A9-FF)
        Count: 1
< ACL Data TX: Handle 3009 flags 0x00 dlen 11               #57 [hci1] 6.628251
      SMP: Pairing Response (0x02) len 6
        IO capability: DisplayOnly (0x00)
        OOB data: Authentication data not present (0x00)
        Authentication requirement: Bonding, No MITM, SC, No Keypresses (0x09)
        Max encryption key size: 16
        Initiator key distribution: IdKey (0x02)
        Responder key distribution: <none> (0x00)
< HCI Command: Host Number of Compl.. (0x03|0x0035) plen 5  #58 [hci1] 6.628370
        Num handles: 1
        Handle: 3009 Address: DF:A9:FF:F6:B1:1A (OUI DF-A9-FF)
        Count: 1
> HCI Event: Number of Completed Packets (0x13) plen 5      #59 [hci1] 6.786141
        Num handles: 1
        Handle: 3009 Address: DF:A9:FF:F6:B1:1A (OUI DF-A9-FF)
        Count: 1
        #57: len 11 (0 Kb/s)
        Latency: 157 msec (157-164 msec ~161 msec)
> ACL Data RX: Handle 3009 flags 0x02 dlen 27               #60 [hci1] 6.786504
> ACL Data RX: Handle 3009 flags 0x01 dlen 27               #61 [hci1] 6.786978
> ACL Data RX: Handle 3009 flags 0x01 dlen 15               #62 [hci1] 6.787433
      SMP: Pairing Public Key (0x0c) len 64
        X: 8f7eb0ca4d624a1baadf907f935289f3a1e5ebb97a4ecc2fd35f2c660b72810e
        Y: a157380287d050daafb4d893f5e7fa33c53a3b5dda23ee9ea5ed875e94be5092
< HCI Command: Host Number of Compl.. (0x03|0x0035) plen 5  #63 [hci1] 6.788349
        Num handles: 1
        Handle: 3009 Address: DF:A9:FF:F6:B1:1A (OUI DF-A9-FF)
        Count: 1
< HCI Command: Host Number of Compl.. (0x03|0x0035) plen 5  #64 [hci1] 6.788521
        Num handles: 1
        Handle: 3009 Address: DF:A9:FF:F6:B1:1A (OUI DF-A9-FF)
        Count: 1
< HCI Command: Host Number of Compl.. (0x03|0x0035) plen 5  #65 [hci1] 6.788824
        Num handles: 1
        Handle: 3009 Address: DF:A9:FF:F6:B1:1A (OUI DF-A9-FF)
        Count: 1
< ACL Data TX: Handle 3009 flags 0x00 dlen 27               #66 [hci1] 6.788871
< ACL Data TX: Handle 3009 flags 0x01 dlen 27               #67 [hci1] 6.788883
< ACL Data TX: Handle 3009 flags 0x01 dlen 15               #68 [hci1] 6.788908
      SMP: Pairing Public Key (0x0c) len 64
        X: 98308440221e2d910f0e54b71e7ec652857aa9b5a0dc65028824cc19db1226e9
        Y: 67a4816bcb62efb21701e31fdb27561a6217575fb007a8bbdabe7e28b6f68482
> HCI Event: Number of Completed Packets (0x13) plen 5      #69 [hci1] 6.873994
        Num handles: 1
        Handle: 3009 Address: DF:A9:FF:F6:B1:1A (OUI DF-A9-FF)
        Count: 1
        #66: len 27 (2 Kb/s)
        Latency: 85 msec (85-164 msec ~123 msec)
> HCI Event: Number of Completed Packets (0x13) plen 5      #70 [hci1] 6.874747
        Num handles: 1
        Handle: 3009 Address: DF:A9:FF:F6:B1:1A (OUI DF-A9-FF)
        Count: 1
        #67: len 27 (2 Kb/s)
        Latency: 85 msec (85-164 msec ~104 msec)
> HCI Event: Number of Completed Packets (0x13) plen 5      #71 [hci1] 6.961005
        Num handles: 1
        Handle: 3009 Address: DF:A9:FF:F6:B1:1A (OUI DF-A9-FF)
        Count: 1
        #68: len 15 (0 Kb/s)
        Latency: 172 msec (85-172 msec ~138 msec)
> ACL Data RX: Handle 3009 flags 0x02 dlen 21               #72 [hci1] 7.923782
      SMP: Pairing Confirm (0x03) len 16
        Confim value: 914a2474c5fc65b4721606233ef3396f
< HCI Command: Host Number of Compl.. (0x03|0x0035) plen 5  #73 [hci1] 7.928800
        Num handles: 1
        Handle: 3009 Address: DF:A9:FF:F6:B1:1A (OUI DF-A9-FF)
        Count: 1
< ACL Data TX: Handle 3009 flags 0x00 dlen 21               #74 [hci1] 7.928963
      SMP: Pairing Confirm (0x03) len 16
        Confim value: fe08aaf10efe98c78298fcca8ecb596c
> HCI Event: Number of Completed Packets (0x13) plen 5      #75 [hci1] 8.098572
        Num handles: 1
        Handle: 3009 Address: DF:A9:FF:F6:B1:1A (OUI DF-A9-FF)
        Count: 1
        #74: len 21 (0 Kb/s)
        Latency: 169 msec (85-172 msec ~153 msec)
> ACL Data RX: Handle 3009 flags 0x02 dlen 21               #76 [hci1] 8.098877
      SMP: Pairing Random (0x04) len 16
        Random value: 2e4b230d5e1f0de30000000000000000
< HCI Command: Host Number of Compl.. (0x03|0x0035) plen 5  #77 [hci1] 8.108775
        Num handles: 1
        Handle: 3009 Address: DF:A9:FF:F6:B1:1A (OUI DF-A9-FF)
        Count: 1
< ACL Data TX: Handle 3009 flags 0x00 dlen 21               #78 [hci1] 8.108867
      SMP: Pairing Random (0x04) len 16
        Random value: 8e6108f966a694cbe26df70bb96773e6
> HCI Event: Number of Completed Packets (0x13) plen 5      #79 [hci1] 8.273378
        Num handles: 1
        Handle: 3009 Address: DF:A9:FF:F6:B1:1A (OUI DF-A9-FF)
        Count: 1
        #78: len 21 (1 Kb/s)
        Latency: 164 msec (85-172 msec ~159 msec)
> ACL Data RX: Handle 3009 flags 0x02 dlen 21               #80 [hci1] 8.361181
      SMP: Pairing Confirm (0x03) len 16
        Confim value: 88b2891cb365dac2cabaf7e98f4bd0ae
< HCI Command: Host Number of Compl.. (0x03|0x0035) plen 5  #81 [hci1] 8.368320
        Num handles: 1
        Handle: 3009 Address: DF:A9:FF:F6:B1:1A (OUI DF-A9-FF)
        Count: 1
< ACL Data TX: Handle 3009 flags 0x00 dlen 21               #82 [hci1] 8.368352
      SMP: Pairing Confirm (0x03) len 16
        Confim value: b03b00488d59f547e9a5c09214d91555
> HCI Event: Number of Completed Packets (0x13) plen 5      #83 [hci1] 8.536011
        Num handles: 1
        Handle: 3009 Address: DF:A9:FF:F6:B1:1A (OUI DF-A9-FF)
        Count: 1
        #82: len 21 (1 Kb/s)
        Latency: 167 msec (85-172 msec ~163 msec)
> ACL Data RX: Handle 3009 flags 0x02 dlen 21               #84 [hci1] 8.536427
      SMP: Pairing Random (0x04) len 16
        Random value: ee7aaa69da2219320000000000000000
< HCI Command: Host Number of Compl.. (0x03|0x0035) plen 5  #85 [hci1] 8.548763
        Num handles: 1
        Handle: 3009 Address: DF:A9:FF:F6:B1:1A (OUI DF-A9-FF)
        Count: 1
< ACL Data TX: Handle 3009 flags 0x00 dlen 21               #86 [hci1] 8.548913
      SMP: Pairing Random (0x04) len 16
        Random value: 4d02679f89a05211af56d8b3da64d21e
> HCI Event: Number of Completed Packets (0x13) plen 5      #87 [hci1] 8.710836
        Num handles: 1
        Handle: 3009 Address: DF:A9:FF:F6:B1:1A (OUI DF-A9-FF)
        Count: 1
        #86: len 21 (1 Kb/s)
        Latency: 161 msec (85-172 msec ~162 msec)
> ACL Data RX: Handle 3009 flags 0x02 dlen 21               #88 [hci1] 8.798602
      SMP: Pairing Confirm (0x03) len 16
        Confim value: d1dcc223c7965a8139f1a91aeb44393d
< HCI Command: Host Number of Compl.. (0x03|0x0035) plen 5  #89 [hci1] 8.808044
        Num handles: 1
        Handle: 3009 Address: DF:A9:FF:F6:B1:1A (OUI DF-A9-FF)
        Count: 1
< ACL Data TX: Handle 3009 flags 0x00 dlen 21               #90 [hci1] 8.808084
      SMP: Pairing Confirm (0x03) len 16
        Confim value: 72e05fdb85fb529695f0a8156bdf7294
> HCI Event: Number of Completed Packets (0x13) plen 5      #91 [hci1] 8.973482
        Num handles: 1
        Handle: 3009 Address: DF:A9:FF:F6:B1:1A (OUI DF-A9-FF)
        Count: 1
        #90: len 21 (1 Kb/s)
        Latency: 165 msec (85-172 msec ~164 msec)
> ACL Data RX: Handle 3009 flags 0x02 dlen 21               #92 [hci1] 8.973873
      SMP: Pairing Random (0x04) len 16
        Random value: dd65efa10cffb45c0000000000000000
< HCI Command: Host Number of Compl.. (0x03|0x0035) plen 5  #93 [hci1] 8.988903
        Num handles: 1
        Handle: 3009 Address: DF:A9:FF:F6:B1:1A (OUI DF-A9-FF)
        Count: 1
< ACL Data TX: Handle 3009 flags 0x00 dlen 21               #94 [hci1] 8.988992
      SMP: Pairing Random (0x04) len 16
        Random value: 5e8286bc235a02440d0c3424a2acf8fd
> HCI Event: Number of Completed Packets (0x13) plen 5      #95 [hci1] 9.148281
        Num handles: 1
        Handle: 3009 Address: DF:A9:FF:F6:B1:1A (OUI DF-A9-FF)
        Count: 1
        #94: len 21 (1 Kb/s)
        Latency: 159 msec (85-172 msec ~161 msec)
> ACL Data RX: Handle 3009 flags 0x02 dlen 21               #96 [hci1] 9.236254
      SMP: Pairing Confirm (0x03) len 16
        Confim value: 60f4cf144c1a22bb5560b375a9de8825
< HCI Command: Host Number of Compl.. (0x03|0x0035) plen 5  #97 [hci1] 9.248506
        Num handles: 1
        Handle: 3009 Address: DF:A9:FF:F6:B1:1A (OUI DF-A9-FF)
        Count: 1
< ACL Data TX: Handle 3009 flags 0x00 dlen 21               #98 [hci1] 9.248621
      SMP: Pairing Confirm (0x03) len 16
        Confim value: 0a5f72f914f5d24b894a2c9805d28ba3
> HCI Event: Number of Completed Packets (0x13) plen 5      #99 [hci1] 9.411068
        Num handles: 1
        Handle: 3009 Address: DF:A9:FF:F6:B1:1A (OUI DF-A9-FF)
        Count: 1
        #98: len 21 (1 Kb/s)
        Latency: 162 msec (85-172 msec ~162 msec)
> ACL Data RX: Handle 3009 flags 0x02 dlen 21              #100 [hci1] 9.411346
      SMP: Pairing Random (0x04) len 16
        Random value: 44e8eb0f382ff61d0000000000000000
< HCI Command: Host Number of Comp.. (0x03|0x0035) plen 5  #101 [hci1] 9.428874
        Num handles: 1
        Handle: 3009 Address: DF:A9:FF:F6:B1:1A (OUI DF-A9-FF)
        Count: 1
< ACL Data TX: Handle 3009 flags 0x00 dlen 21              #102 [hci1] 9.429110
      SMP: Pairing Random (0x04) len 16
        Random value: 5c4a1bcadd27bd58e945097b00bad7ac
> HCI Event: Number of Completed Packets (0x13) plen 5     #103 [hci1] 9.585787
        Num handles: 1
        Handle: 3009 Address: DF:A9:FF:F6:B1:1A (OUI DF-A9-FF)
        Count: 1
        #102: len 21 (1 Kb/s)
        Latency: 156 msec (85-172 msec ~159 msec)
> ACL Data RX: Handle 3009 flags 0x02 dlen 21              #104 [hci1] 9.673671
      SMP: Pairing Confirm (0x03) len 16
        Confim value: 0a0fbcebca209239cc73b95894e4d889
< HCI Command: Host Number of Comp.. (0x03|0x0035) plen 5  #105 [hci1] 9.688591
        Num handles: 1
        Handle: 3009 Address: DF:A9:FF:F6:B1:1A (OUI DF-A9-FF)
        Count: 1
< ACL Data TX: Handle 3009 flags 0x00 dlen 21              #106 [hci1] 9.688740
      SMP: Pairing Confirm (0x03) len 16
        Confim value: 3db521b24fc4bc35b6123a281315c664
> HCI Event: Number of Completed Packets (0x13) plen 5     #107 [hci1] 9.848447
        Num handles: 1
        Handle: 3009 Address: DF:A9:FF:F6:B1:1A (OUI DF-A9-FF)
        Count: 1
        #106: len 21 (1 Kb/s)
        Latency: 159 msec (85-172 msec ~159 msec)
> ACL Data RX: Handle 3009 flags 0x02 dlen 21              #108 [hci1] 9.848806
      SMP: Pairing Random (0x04) len 16
        Random value: 6dbe3617fdf125310000000000000000
< HCI Command: Host Number of Comp.. (0x03|0x0035) plen 5  #109 [hci1] 9.867899
        Num handles: 1
        Handle: 3009 Address: DF:A9:FF:F6:B1:1A (OUI DF-A9-FF)
        Count: 1
< ACL Data TX: Handle 3009 flags 0x00 dlen 21              #110 [hci1] 9.867937
      SMP: Pairing Random (0x04) len 16
        Random value: 32527e6e64e79f33b2e374394db8ab2d
> HCI Event: Number of Completed Packets (0x13) plen 5    #111 [hci1] 10.023316
        Num handles: 1
        Handle: 3009 Address: DF:A9:FF:F6:B1:1A (OUI DF-A9-FF)
        Count: 1
        #110: len 21 (1 Kb/s)
        Latency: 155 msec (85-172 msec ~157 msec)
> ACL Data RX: Handle 3009 flags 0x02 dlen 21             #112 [hci1] 10.111100
      SMP: Pairing Confirm (0x03) len 16
        Confim value: e71343e89b334fde63e835d4fb658170
< HCI Command: Host Number of Com.. (0x03|0x0035) plen 5  #113 [hci1] 10.128040
        Num handles: 1
        Handle: 3009 Address: DF:A9:FF:F6:B1:1A (OUI DF-A9-FF)
        Count: 1
< ACL Data TX: Handle 3009 flags 0x00 dlen 21             #114 [hci1] 10.128084
      SMP: Pairing Confirm (0x03) len 16
        Confim value: 3dbbf65f10780bd82e864f6b0105632e
> HCI Event: Number of Completed Packets (0x13) plen 5    #115 [hci1] 10.285919
        Num handles: 1
        Handle: 3009 Address: DF:A9:FF:F6:B1:1A (OUI DF-A9-FF)
        Count: 1
        #114: len 21 (1 Kb/s)
        Latency: 157 msec (85-172 msec ~157 msec)
> ACL Data RX: Handle 3009 flags 0x02 dlen 21             #116 [hci1] 10.286309
      SMP: Pairing Random (0x04) len 16
        Random value: f799e80c86f499a20000000000000000
< HCI Command: Host Number of Com.. (0x03|0x0035) plen 5  #117 [hci1] 10.288131
        Num handles: 1
        Handle: 3009 Address: DF:A9:FF:F6:B1:1A (OUI DF-A9-FF)
        Count: 1
< ACL Data TX: Handle 3009 flags 0x00 dlen 21             #118 [hci1] 10.288148
      SMP: Pairing Random (0x04) len 16
        Random value: dddbdfe2838e9a8cc6964353c850fef7
> HCI Event: Number of Completed Packets (0x13) plen 5    #119 [hci1] 10.461034
        Num handles: 1
        Handle: 3009 Address: DF:A9:FF:F6:B1:1A (OUI DF-A9-FF)
        Count: 1
        #118: len 21 (0 Kb/s)
        Latency: 172 msec (85-172 msec ~165 msec)
> ACL Data RX: Handle 3009 flags 0x02 dlen 21             #120 [hci1] 10.461292
      SMP: Pairing Confirm (0x03) len 16
        Confim value: 264f9a85473a5ef0423e3674318c9c64
< HCI Command: Host Number of Com.. (0x03|0x0035) plen 5  #121 [hci1] 10.468127
        Num handles: 1
        Handle: 3009 Address: DF:A9:FF:F6:B1:1A (OUI DF-A9-FF)
        Count: 1
< ACL Data TX: Handle 3009 flags 0x00 dlen 21             #122 [hci1] 10.468166
      SMP: Pairing Confirm (0x03) len 16
        Confim value: 3581d87eeac23acfc5ce2e48adc17dd5
> HCI Event: Number of Completed Packets (0x13) plen 5    #123 [hci1] 10.636030
        Num handles: 1
        Handle: 3009 Address: DF:A9:FF:F6:B1:1A (OUI DF-A9-FF)
        Count: 1
        #122: len 21 (1 Kb/s)
        Latency: 167 msec (85-172 msec ~166 msec)
> ACL Data RX: Handle 3009 flags 0x02 dlen 21             #124 [hci1] 10.636299
      SMP: Pairing Random (0x04) len 16
        Random value: 3afd9dd0841cca900000000000000000
< HCI Command: Host Number of Com.. (0x03|0x0035) plen 5  #125 [hci1] 10.648778
        Num handles: 1
        Handle: 3009 Address: DF:A9:FF:F6:B1:1A (OUI DF-A9-FF)
        Count: 1
< ACL Data TX: Handle 3009 flags 0x00 dlen 21             #126 [hci1] 10.648941
      SMP: Pairing Random (0x04) len 16
        Random value: eb9f1915536596b6fc3db1c86b2b1970
> HCI Event: Number of Completed Packets (0x13) plen 5    #127 [hci1] 10.810779
        Num handles: 1
        Handle: 3009 Address: DF:A9:FF:F6:B1:1A (OUI DF-A9-FF)
        Count: 1
        #126: len 21 (1 Kb/s)
        Latency: 161 msec (85-172 msec ~164 msec)
> ACL Data RX: Handle 3009 flags 0x02 dlen 21             #128 [hci1] 10.898663
      SMP: Pairing Confirm (0x03) len 16
        Confim value: 5df368769afc20d01b0c0e6cf45d322e
< HCI Command: Host Number of Com.. (0x03|0x0035) plen 5  #129 [hci1] 10.908161
        Num handles: 1
        Handle: 3009 Address: DF:A9:FF:F6:B1:1A (OUI DF-A9-FF)
        Count: 1
< ACL Data TX: Handle 3009 flags 0x00 dlen 21             #130 [hci1] 10.908283
      SMP: Pairing Confirm (0x03) len 16
        Confim value: 99cb4ae3b96e73a9472484d18b104d33
> HCI Event: Number of Completed Packets (0x13) plen 5    #131 [hci1] 11.073561
        Num handles: 1
        Handle: 3009 Address: DF:A9:FF:F6:B1:1A (OUI DF-A9-FF)
        Count: 1
        #130: len 21 (1 Kb/s)
        Latency: 165 msec (85-172 msec ~164 msec)
> ACL Data RX: Handle 3009 flags 0x02 dlen 21             #132 [hci1] 11.073809
      SMP: Pairing Random (0x04) len 16
        Random value: 5f5f1ed94929d86d0000000000000000
< HCI Command: Host Number of Com.. (0x03|0x0035) plen 5  #133 [hci1] 11.088797
        Num handles: 1
        Handle: 3009 Address: DF:A9:FF:F6:B1:1A (OUI DF-A9-FF)
        Count: 1
< ACL Data TX: Handle 3009 flags 0x00 dlen 21             #134 [hci1] 11.088917
      SMP: Pairing Random (0x04) len 16
        Random value: 5c794dc9ad9f2c3f295ebd5ad5e1c3cf
> HCI Event: Number of Completed Packets (0x13) plen 5    #135 [hci1] 11.248170
        Num handles: 1
        Handle: 3009 Address: DF:A9:FF:F6:B1:1A (OUI DF-A9-FF)
        Count: 1
        #134: len 21 (1 Kb/s)
        Latency: 159 msec (85-172 msec ~161 msec)
> ACL Data RX: Handle 3009 flags 0x02 dlen 21             #136 [hci1] 11.336074
      SMP: Pairing Confirm (0x03) len 16
        Confim value: 274d197835f4c5b6158f8549ea319f64
< HCI Command: Host Number of Com.. (0x03|0x0035) plen 5  #137 [hci1] 11.348401
        Num handles: 1
        Handle: 3009 Address: DF:A9:FF:F6:B1:1A (OUI DF-A9-FF)
        Count: 1
< ACL Data TX: Handle 3009 flags 0x00 dlen 21             #138 [hci1] 11.348468
      SMP: Pairing Confirm (0x03) len 16
        Confim value: 4636b21edef5c2b842a179706606b338
> HCI Event: Number of Completed Packets (0x13) plen 5    #139 [hci1] 11.510911
        Num handles: 1
        Handle: 3009 Address: DF:A9:FF:F6:B1:1A (OUI DF-A9-FF)
        Count: 1
        #138: len 21 (1 Kb/s)
        Latency: 162 msec (85-172 msec ~162 msec)
> ACL Data RX: Handle 3009 flags 0x02 dlen 21             #140 [hci1] 11.511339
      SMP: Pairing Random (0x04) len 16
        Random value: eb1d4204bc2a0beb0000000000000000
< HCI Command: Host Number of Com.. (0x03|0x0035) plen 5  #141 [hci1] 11.528697
        Num handles: 1
        Handle: 3009 Address: DF:A9:FF:F6:B1:1A (OUI DF-A9-FF)
        Count: 1
< ACL Data TX: Handle 3009 flags 0x00 dlen 21             #142 [hci1] 11.528907
      SMP: Pairing Random (0x04) len 16
        Random value: 5c2fff312cdf99c9491988e877355a9a
> HCI Event: Number of Completed Packets (0x13) plen 5    #143 [hci1] 11.685748
        Num handles: 1
        Handle: 3009 Address: DF:A9:FF:F6:B1:1A (OUI DF-A9-FF)
        Count: 1
        #142: len 21 (1 Kb/s)
        Latency: 156 msec (85-172 msec ~159 msec)
> ACL Data RX: Handle 3009 flags 0x02 dlen 21             #144 [hci1] 11.773784
      SMP: Pairing Confirm (0x03) len 16
        Confim value: d9cc11e99f114ff94474f7828669e670
< HCI Command: Host Number of Com.. (0x03|0x0035) plen 5  #145 [hci1] 11.788630
        Num handles: 1
        Handle: 3009 Address: DF:A9:FF:F6:B1:1A (OUI DF-A9-FF)
        Count: 1
< ACL Data TX: Handle 3009 flags 0x00 dlen 21             #146 [hci1] 11.788849
      SMP: Pairing Confirm (0x03) len 16
        Confim value: e5993e87a25585229b10d0038cc5e745
> HCI Event: Number of Completed Packets (0x13) plen 5    #147 [hci1] 11.948437
        Num handles: 1
        Handle: 3009 Address: DF:A9:FF:F6:B1:1A (OUI DF-A9-FF)
        Count: 1
        #146: len 21 (1 Kb/s)
        Latency: 159 msec (85-172 msec ~159 msec)
> ACL Data RX: Handle 3009 flags 0x02 dlen 21             #148 [hci1] 11.948780
      SMP: Pairing Random (0x04) len 16
        Random value: 435ae514cb70ea590000000000000000
< HCI Command: Host Number of Com.. (0x03|0x0035) plen 5  #149 [hci1] 11.968760
        Num handles: 1
        Handle: 3009 Address: DF:A9:FF:F6:B1:1A (OUI DF-A9-FF)
        Count: 1
< ACL Data TX: Handle 3009 flags 0x00 dlen 21             #150 [hci1] 11.968984
      SMP: Pairing Random (0x04) len 16
        Random value: c629a3a987d808e808655d558dfc1155
> HCI Event: Number of Completed Packets (0x13) plen 5    #151 [hci1] 12.123233
        Num handles: 1
        Handle: 3009 Address: DF:A9:FF:F6:B1:1A (OUI DF-A9-FF)
        Count: 1
        #150: len 21 (1 Kb/s)
        Latency: 154 msec (85-172 msec ~156 msec)
> ACL Data RX: Handle 3009 flags 0x02 dlen 21             #152 [hci1] 12.211146
      SMP: Pairing Confirm (0x03) len 16
        Confim value: 9e3c031223d95820cce7272244dd6f6e
< HCI Command: Host Number of Com.. (0x03|0x0035) plen 5  #153 [hci1] 12.228510
        Num handles: 1
        Handle: 3009 Address: DF:A9:FF:F6:B1:1A (OUI DF-A9-FF)
        Count: 1
< ACL Data TX: Handle 3009 flags 0x00 dlen 21             #154 [hci1] 12.228683
      SMP: Pairing Confirm (0x03) len 16
        Confim value: 08cf6404c6083988c1300c081f4f2bab
> HCI Event: Number of Completed Packets (0x13) plen 5    #155 [hci1] 12.385866
        Num handles: 1
        Handle: 3009 Address: DF:A9:FF:F6:B1:1A (OUI DF-A9-FF)
        Count: 1
        #154: len 21 (1 Kb/s)
        Latency: 157 msec (85-172 msec ~157 msec)
> ACL Data RX: Handle 3009 flags 0x02 dlen 21             #156 [hci1] 12.386226
      SMP: Pairing Random (0x04) len 16
        Random value: 5dc86901b7f717f20000000000000000
< HCI Command: Host Number of Com.. (0x03|0x0035) plen 5  #157 [hci1] 12.388598
        Num handles: 1
        Handle: 3009 Address: DF:A9:FF:F6:B1:1A (OUI DF-A9-FF)
        Count: 1
< ACL Data TX: Handle 3009 flags 0x00 dlen 21             #158 [hci1] 12.388720
      SMP: Pairing Random (0x04) len 16
        Random value: 92f20f6ad8f13724432c7fd6001c45ff
> HCI Event: Number of Completed Packets (0x13) plen 5    #159 [hci1] 12.560670
        Num handles: 1
        Handle: 3009 Address: DF:A9:FF:F6:B1:1A (OUI DF-A9-FF)
        Count: 1
        #158: len 21 (0 Kb/s)
        Latency: 171 msec (85-172 msec ~164 msec)
> ACL Data RX: Handle 3009 flags 0x02 dlen 21             #160 [hci1] 12.648571
      SMP: Pairing Confirm (0x03) len 16
        Confim value: 7a75cd8b30cc0bf9e417d14652b94555
< HCI Command: Host Number of Com.. (0x03|0x0035) plen 5  #161 [hci1] 12.668531
        Num handles: 1
        Handle: 3009 Address: DF:A9:FF:F6:B1:1A (OUI DF-A9-FF)
        Count: 1
< ACL Data TX: Handle 3009 flags 0x00 dlen 21             #162 [hci1] 12.668636
      SMP: Pairing Confirm (0x03) len 16
        Confim value: adc8d0492bd4d46cc3a962e50b9e2ea5
> HCI Event: Number of Completed Packets (0x13) plen 5    #163 [hci1] 12.823383
        Num handles: 1
        Handle: 3009 Address: DF:A9:FF:F6:B1:1A (OUI DF-A9-FF)
        Count: 1
        #162: len 21 (1 Kb/s)
        Latency: 154 msec (85-172 msec ~159 msec)
> ACL Data RX: Handle 3009 flags 0x02 dlen 21             #164 [hci1] 12.823753
      SMP: Pairing Random (0x04) len 16
        Random value: 93b53b6fb47240890000000000000000
< HCI Command: Host Number of Com.. (0x03|0x0035) plen 5  #165 [hci1] 12.828847
        Num handles: 1
        Handle: 3009 Address: DF:A9:FF:F6:B1:1A (OUI DF-A9-FF)
        Count: 1
< ACL Data TX: Handle 3009 flags 0x00 dlen 21             #166 [hci1] 12.828964
      SMP: Pairing Random (0x04) len 16
        Random value: 23ac32ebbb5e14c8a6b9622f296d277f
> HCI Event: Number of Completed Packets (0x13) plen 5    #167 [hci1] 12.998149
        Num handles: 1
        Handle: 3009 Address: DF:A9:FF:F6:B1:1A (OUI DF-A9-FF)
        Count: 1
        #166: len 21 (0 Kb/s)
        Latency: 169 msec (85-172 msec ~164 msec)
> ACL Data RX: Handle 3009 flags 0x02 dlen 21             #168 [hci1] 13.086046
      SMP: Pairing Confirm (0x03) len 16
        Confim value: f3aa46241e0262d722d3b5e3e1879086
< HCI Command: Host Number of Com.. (0x03|0x0035) plen 5  #169 [hci1] 13.088107
        Num handles: 1
        Handle: 3009 Address: DF:A9:FF:F6:B1:1A (OUI DF-A9-FF)
        Count: 1
< ACL Data TX: Handle 3009 flags 0x00 dlen 21             #170 [hci1] 13.088149
      SMP: Pairing Confirm (0x03) len 16
        Confim value: 6b48002ec488d15e328b2e2493fca0ef
> HCI Event: Number of Completed Packets (0x13) plen 5    #171 [hci1] 13.260918
        Num handles: 1
        Handle: 3009 Address: DF:A9:FF:F6:B1:1A (OUI DF-A9-FF)
        Count: 1
        #170: len 21 (0 Kb/s)
        Latency: 172 msec (85-172 msec ~168 msec)
> ACL Data RX: Handle 3009 flags 0x02 dlen 21             #172 [hci1] 13.261265
      SMP: Pairing Random (0x04) len 16
        Random value: 8f0c1d09aef56ffc0000000000000000
< HCI Command: Host Number of Com.. (0x03|0x0035) plen 5  #173 [hci1] 13.268839
        Num handles: 1
        Handle: 3009 Address: DF:A9:FF:F6:B1:1A (OUI DF-A9-FF)
        Count: 1
< ACL Data TX: Handle 3009 flags 0x00 dlen 21             #174 [hci1] 13.268968
      SMP: Pairing Random (0x04) len 16
        Random value: 297efe85e67448a15f56bd27e3a3cf1d
> HCI Event: Number of Completed Packets (0x13) plen 5    #175 [hci1] 13.435731
        Num handles: 1
        Handle: 3009 Address: DF:A9:FF:F6:B1:1A (OUI DF-A9-FF)
        Count: 1
        #174: len 21 (1 Kb/s)
        Latency: 166 msec (85-172 msec ~167 msec)
> ACL Data RX: Handle 3009 flags 0x02 dlen 21             #176 [hci1] 13.523480
      SMP: Pairing Confirm (0x03) len 16
        Confim value: 415fec2af7e41567bf76dbe7f3122e92
< HCI Command: Host Number of Com.. (0x03|0x0035) plen 5  #177 [hci1] 13.528324
        Num handles: 1
        Handle: 3009 Address: DF:A9:FF:F6:B1:1A (OUI DF-A9-FF)
        Count: 1
< ACL Data TX: Handle 3009 flags 0x00 dlen 21             #178 [hci1] 13.528454
      SMP: Pairing Confirm (0x03) len 16
        Confim value: aff133643fcdd4a11c57adf79b945add
> HCI Event: Number of Completed Packets (0x13) plen 5    #179 [hci1] 13.698329
        Num handles: 1
        Handle: 3009 Address: DF:A9:FF:F6:B1:1A (OUI DF-A9-FF)
        Count: 1
        #178: len 21 (0 Kb/s)
        Latency: 169 msec (85-172 msec ~168 msec)
> ACL Data RX: Handle 3009 flags 0x02 dlen 21             #180 [hci1] 13.698657
      SMP: Pairing Random (0x04) len 16
        Random value: 7968c43a17d5df4d0000000000000000
< HCI Command: Host Number of Com.. (0x03|0x0035) plen 5  #181 [hci1] 13.708803
        Num handles: 1
        Handle: 3009 Address: DF:A9:FF:F6:B1:1A (OUI DF-A9-FF)
        Count: 1
< ACL Data TX: Handle 3009 flags 0x00 dlen 21             #182 [hci1] 13.708949
      SMP: Pairing Random (0x04) len 16
        Random value: 25a9493fd3ce4faf02be7293595bb7c6
> HCI Event: Number of Completed Packets (0x13) plen 5    #183 [hci1] 13.873203
        Num handles: 1
        Handle: 3009 Address: DF:A9:FF:F6:B1:1A (OUI DF-A9-FF)
        Count: 1
        #182: len 21 (1 Kb/s)
        Latency: 164 msec (85-172 msec ~166 msec)
> ACL Data RX: Handle 3009 flags 0x02 dlen 21             #184 [hci1] 13.961012
      SMP: Pairing Confirm (0x03) len 16
        Confim value: 2e230d84171f2cb0f860076731f797b0
< HCI Command: Host Number of Com.. (0x03|0x0035) plen 5  #185 [hci1] 13.968629
        Num handles: 1
        Handle: 3009 Address: DF:A9:FF:F6:B1:1A (OUI DF-A9-FF)
        Count: 1
< ACL Data TX: Handle 3009 flags 0x00 dlen 21             #186 [hci1] 13.968784
      SMP: Pairing Confirm (0x03) len 16
        Confim value: 6b20bbe9ef305e10848c623263e80621
> HCI Event: Number of Completed Packets (0x13) plen 5    #187 [hci1] 14.135833
        Num handles: 1
        Handle: 3009 Address: DF:A9:FF:F6:B1:1A (OUI DF-A9-FF)
        Count: 1
        #186: len 21 (1 Kb/s)
        Latency: 167 msec (85-172 msec ~166 msec)
> ACL Data RX: Handle 3009 flags 0x02 dlen 21             #188 [hci1] 14.136228
      SMP: Pairing Random (0x04) len 16
        Random value: 0f8ead0d3cffc45a0000000000000000
< HCI Command: Host Number of Com.. (0x03|0x0035) plen 5  #189 [hci1] 14.148817
        Num handles: 1
        Handle: 3009 Address: DF:A9:FF:F6:B1:1A (OUI DF-A9-FF)
        Count: 1
< ACL Data TX: Handle 3009 flags 0x00 dlen 21             #190 [hci1] 14.148988
      SMP: Pairing Random (0x04) len 16
        Random value: 58f6b41f855a6f6c3560debd84e2affc
> HCI Event: Number of Completed Packets (0x13) plen 5    #191 [hci1] 14.310676
        Num handles: 1
        Handle: 3009 Address: DF:A9:FF:F6:B1:1A (OUI DF-A9-FF)
        Count: 1
        #190: len 21 (1 Kb/s)
        Latency: 161 msec (85-172 msec ~164 msec)
> ACL Data RX: Handle 3009 flags 0x02 dlen 21             #192 [hci1] 14.398696
      SMP: Pairing Confirm (0x03) len 16
        Confim value: e889fed0e73dda42b732a77bb536195d
< HCI Command: Host Number of Com.. (0x03|0x0035) plen 5  #193 [hci1] 14.408429
        Num handles: 1
        Handle: 3009 Address: DF:A9:FF:F6:B1:1A (OUI DF-A9-FF)
        Count: 1
< ACL Data TX: Handle 3009 flags 0x00 dlen 21             #194 [hci1] 14.408529
      SMP: Pairing Confirm (0x03) len 16
        Confim value: 5796b705e8766966e3e35f170f460c3f
> HCI Event: Number of Completed Packets (0x13) plen 5    #195 [hci1] 14.573308
        Num handles: 1
        Handle: 3009 Address: DF:A9:FF:F6:B1:1A (OUI DF-A9-FF)
        Count: 1
        #194: len 21 (1 Kb/s)
        Latency: 164 msec (85-172 msec ~164 msec)
> ACL Data RX: Handle 3009 flags 0x02 dlen 21             #196 [hci1] 14.573713
      SMP: Pairing Random (0x04) len 16
        Random value: 6f5538b01c1ec0f40000000000000000
< HCI Command: Host Number of Com.. (0x03|0x0035) plen 5  #197 [hci1] 14.588883
        Num handles: 1
        Handle: 3009 Address: DF:A9:FF:F6:B1:1A (OUI DF-A9-FF)
        Count: 1
< ACL Data TX: Handle 3009 flags 0x00 dlen 21             #198 [hci1] 14.589028
      SMP: Pairing Random (0x04) len 16
        Random value: b67e7216d5bf664139eda2b542549666
> HCI Event: Number of Completed Packets (0x13) plen 5    #199 [hci1] 14.748089
        Num handles: 1
        Handle: 3009 Address: DF:A9:FF:F6:B1:1A (OUI DF-A9-FF)
        Count: 1
        #198: len 21 (1 Kb/s)
        Latency: 159 msec (85-172 msec ~161 msec)
> ACL Data RX: Handle 3009 flags 0x02 dlen 21             #200 [hci1] 14.836045
      SMP: Pairing Confirm (0x03) len 16
        Confim value: 924910e7efaff94ef51ace5da219bbb7
< HCI Command: Host Number of Com.. (0x03|0x0035) plen 5  #201 [hci1] 14.848679
        Num handles: 1
        Handle: 3009 Address: DF:A9:FF:F6:B1:1A (OUI DF-A9-FF)
        Count: 1
< ACL Data TX: Handle 3009 flags 0x00 dlen 21             #202 [hci1] 14.848842
      SMP: Pairing Confirm (0x03) len 16
        Confim value: 81b0673d7acc84bb0060f0bb112a9b4f
> HCI Event: Number of Completed Packets (0x13) plen 5    #203 [hci1] 15.010810
        Num handles: 1
        Handle: 3009 Address: DF:A9:FF:F6:B1:1A (OUI DF-A9-FF)
        Count: 1
        #202: len 21 (1 Kb/s)
        Latency: 161 msec (85-172 msec ~161 msec)
> ACL Data RX: Handle 3009 flags 0x02 dlen 21             #204 [hci1] 15.011166
      SMP: Pairing Random (0x04) len 16
        Random value: 245519715992d9450000000000000000
< HCI Command: Host Number of Com.. (0x03|0x0035) plen 5  #205 [hci1] 15.028877
        Num handles: 1
        Handle: 3009 Address: DF:A9:FF:F6:B1:1A (OUI DF-A9-FF)
        Count: 1
< ACL Data TX: Handle 3009 flags 0x00 dlen 21             #206 [hci1] 15.029012
      SMP: Pairing Random (0x04) len 16
        Random value: ed17f76500c95219dd01e09d1e63f87b
> HCI Event: Number of Completed Packets (0x13) plen 5    #207 [hci1] 15.185662
        Num handles: 1
        Handle: 3009 Address: DF:A9:FF:F6:B1:1A (OUI DF-A9-FF)
        Count: 1
        #206: len 21 (1 Kb/s)
        Latency: 156 msec (85-172 msec ~159 msec)
> ACL Data RX: Handle 3009 flags 0x02 dlen 21             #208 [hci1] 15.273504
      SMP: Pairing Confirm (0x03) len 16
        Confim value: d65e941002b6d9c7c2c786e56ad8633e
< HCI Command: Host Number of Com.. (0x03|0x0035) plen 5  #209 [hci1] 15.288685
        Num handles: 1
        Handle: 3009 Address: DF:A9:FF:F6:B1:1A (OUI DF-A9-FF)
        Count: 1
< ACL Data TX: Handle 3009 flags 0x00 dlen 21             #210 [hci1] 15.288842
      SMP: Pairing Confirm (0x03) len 16
        Confim value: ea7426c93392af1e0c0e58f94195dcd4
> HCI Event: Number of Completed Packets (0x13) plen 5    #211 [hci1] 15.448348
        Num handles: 1
        Handle: 3009 Address: DF:A9:FF:F6:B1:1A (OUI DF-A9-FF)
        Count: 1
        #210: len 21 (1 Kb/s)
        Latency: 159 msec (85-172 msec ~159 msec)
> ACL Data RX: Handle 3009 flags 0x02 dlen 21             #212 [hci1] 15.448678
      SMP: Pairing Random (0x04) len 16
        Random value: 701b95f4d682ca950000000000000000
< HCI Command: Host Number of Com.. (0x03|0x0035) plen 5  #213 [hci1] 15.468947
        Num handles: 1
        Handle: 3009 Address: DF:A9:FF:F6:B1:1A (OUI DF-A9-FF)
        Count: 1
< ACL Data TX: Handle 3009 flags 0x00 dlen 21             #214 [hci1] 15.469086
      SMP: Pairing Random (0x04) len 16
        Random value: 81d35d47e1f6006d79c974bd9d9e1ee3
> HCI Event: Number of Completed Packets (0x13) plen 5    #215 [hci1] 15.623078
        Num handles: 1
        Handle: 3009 Address: DF:A9:FF:F6:B1:1A (OUI DF-A9-FF)
        Count: 1
        #214: len 21 (1 Kb/s)
        Latency: 153 msec (85-172 msec ~156 msec)
> ACL Data RX: Handle 3009 flags 0x02 dlen 21             #216 [hci1] 15.710953
      SMP: Pairing Confirm (0x03) len 16
        Confim value: 49306db8c8002d0e21c7d47fcb662509
< HCI Command: Host Number of Com.. (0x03|0x0035) plen 5  #217 [hci1] 15.728482
        Num handles: 1
        Handle: 3009 Address: DF:A9:FF:F6:B1:1A (OUI DF-A9-FF)
        Count: 1
< ACL Data TX: Handle 3009 flags 0x00 dlen 21             #218 [hci1] 15.728577
      SMP: Pairing Confirm (0x03) len 16
        Confim value: 355e00ff1139a0f534c19b56d1cf0694
> HCI Event: Number of Completed Packets (0x13) plen 5    #219 [hci1] 15.885725
        Num handles: 1
        Handle: 3009 Address: DF:A9:FF:F6:B1:1A (OUI DF-A9-FF)
        Count: 1
        #218: len 21 (1 Kb/s)
        Latency: 157 msec (85-172 msec ~156 msec)
> ACL Data RX: Handle 3009 flags 0x02 dlen 21             #220 [hci1] 15.886119
      SMP: Pairing Random (0x04) len 16
        Random value: 58db3a480c2d95ba0000000000000000
< HCI Command: Host Number of Com.. (0x03|0x0035) plen 5  #221 [hci1] 15.888752
        Num handles: 1
        Handle: 3009 Address: DF:A9:FF:F6:B1:1A (OUI DF-A9-FF)
        Count: 1
< ACL Data TX: Handle 3009 flags 0x00 dlen 21             #222 [hci1] 15.888970
      SMP: Pairing Random (0x04) len 16
        Random value: e7f7e0c2476823e41736a7e381bafb7c
> HCI Event: Number of Completed Packets (0x13) plen 5    #223 [hci1] 16.060533
        Num handles: 1
        Handle: 3009 Address: DF:A9:FF:F6:B1:1A (OUI DF-A9-FF)
        Count: 1
        #222: len 21 (0 Kb/s)
        Latency: 171 msec (85-172 msec ~164 msec)
> ACL Data RX: Handle 3009 flags 0x02 dlen 21             #224 [hci1] 16.148443
      SMP: Pairing Confirm (0x03) len 16
        Confim value: e86496ff17b785b12007d5e6fbe5d8a3
< HCI Command: Host Number of Com.. (0x03|0x0035) plen 5  #225 [hci1] 16.168476
        Num handles: 1
        Handle: 3009 Address: DF:A9:FF:F6:B1:1A (OUI DF-A9-FF)
        Count: 1
< ACL Data TX: Handle 3009 flags 0x00 dlen 21             #226 [hci1] 16.168545
      SMP: Pairing Confirm (0x03) len 16
        Confim value: d360b8c3a52c66a55c90840a99e47bb4
> HCI Event: Number of Completed Packets (0x13) plen 5    #227 [hci1] 16.323239
        Num handles: 1
        Handle: 3009 Address: DF:A9:FF:F6:B1:1A (OUI DF-A9-FF)
        Count: 1
        #226: len 21 (1 Kb/s)
        Latency: 154 msec (85-172 msec ~159 msec)
> ACL Data RX: Handle 3009 flags 0x02 dlen 21             #228 [hci1] 16.323668
      SMP: Pairing Random (0x04) len 16
        Random value: fcf42e2af7d48d420000000000000000
