Bluetooth monitor ver 5.72
= Note: Linux version 7.0.0-31-generic (x86_64)                        0.699330
= Note: Bluetooth subsystem version 2.22                               0.699332
= New Index: 00:00:00:00:00:00 (Primary,UART,hci2)              [hci2] 0.699333
= New Index: 00:00:00:00:00:00 (Primary,UART,hci1)              [hci1] 0.699334
= New Index: 48:5F:99:8E:E0:64 (Primary,USB,hci0)               [hci0] 0.699334
= Open Index: 00:00:00:00:00:00                                 [hci1] 0.842566
= Index Info: 00:00:00:00:00:00 (Nordic Semiconductor ASA)      [hci1] 0.842573
@ USER Open: main (privileged) version 2.22            {0x0001} [hci1] 0.842578
< HCI Command: Reset (0x03|0x0003) plen 0                    #1 [hci1] 0.843103
> HCI Event: Command Complete (0x0e) plen 4                  #2 [hci1] 0.843643
      Reset (0x03|0x0003) ncmd 1
        Status: Success (0x00)
< HCI Command: Read Local Supported... (0x04|0x0003) plen 0  #3 [hci1] 0.862516
> HCI Event: Command Complete (0x0e) plen 12                 #4 [hci1] 0.863095
      Read Local Supported Features (0x04|0x0003) ncmd 1
        Status: Success (0x00)
        Features: 0x00 0x00 0x00 0x00 0x60 0x00 0x00 0x00
          BR/EDR Not Supported
          LE Supported (Controller)
< HCI Command: Read Local Version In.. (0x04|0x0001) plen 0  #5 [hci1] 0.882494
> HCI Event: Command Complete (0x0e) plen 12                 #6 [hci1] 0.883061
      Read Local Version Information (0x04|0x0001) ncmd 1
        Status: Success (0x00)
        HCI version: Reserved (0x11) - Revision 12345 (0x3039)
        LMP version: Reserved (0x11) - Subversion 12345 (0x3039)
        Manufacturer: Nordic Semiconductor ASA (89)
< HCI Command: Read Local Supported... (0x04|0x0002) plen 0  #7 [hci1] 0.902487
> HCI Event: Command Complete (0x0e) plen 68                 #8 [hci1] 0.903705
      Read Local Supported Commands (0x04|0x0002) ncmd 1
        Status: Success (0x00)
        Commands: 115 entries
          Disconnect (Octet 0 - Bit 5)
          Read Remote Version Information (Octet 2 - Bit 7)
          Set Event Mask (Octet 5 - Bit 6)
          Reset (Octet 5 - Bit 7)
          Read Connection Accept Timeout (Octet 7 - Bit 2)
          Write Connection Accept Timeout (Octet 7 - Bit 3)
          Read Transmit Power Level (Octet 10 - Bit 2)
          Set Controller To Host Flow Control (Octet 10 - Bit 5)
          Host Buffer Size (Octet 10 - Bit 6)
          Host Number of Completed Packets (Octet 10 - Bit 7)
          Read Local Version Information (Octet 14 - Bit 3)
          Read Local Supported Features (Octet 14 - Bit 5)
          Read BD ADDR (Octet 15 - Bit 1)
          Read RSSI (Octet 15 - Bit 5)
          Set Event Mask Page 2 (Octet 22 - Bit 2)
          LE Set Event Mask (Octet 25 - Bit 0)
          LE Read Buffer Size (Octet 25 - Bit 1)
          LE Read Local Supported Features (Octet 25 - Bit 2)
          LE Set Random Address (Octet 25 - Bit 4)
          LE Set Advertising Parameters (Octet 25 - Bit 5)
          LE Read Advertising Channel TX Power (Octet 25 - Bit 6)
          LE Set Advertising Data (Octet 25 - Bit 7)
          LE Set Scan Response Data (Octet 26 - Bit 0)
          LE Set Advertise Enable (Octet 26 - Bit 1)
          LE Set Scan Parameters (Octet 26 - Bit 2)
          LE Set Scan Enable (Octet 26 - Bit 3)
          LE Create Connection (Octet 26 - Bit 4)
          LE Create Connection Cancel (Octet 26 - Bit 5)
          LE Read Accept List Size (Octet 26 - Bit 6)
          LE Clear Accept List (Octet 26 - Bit 7)
          LE Add Device To Accept List (Octet 27 - Bit 0)
          LE Remove Device From Accept List (Octet 27 - Bit 1)
          LE Connection Update (Octet 27 - Bit 2)
          LE Set Host Channel Classification (Octet 27 - Bit 3)
          LE Read Channel Map (Octet 27 - Bit 4)
          LE Read Remote Used Features (Octet 27 - Bit 5)
          LE Encrypt (Octet 27 - Bit 6)
          LE Rand (Octet 27 - Bit 7)
          LE Start Encryption (Octet 28 - Bit 0)
          LE Long Term Key Request Reply (Octet 28 - Bit 1)
          LE Long Term Key Request Neg Reply (Octet 28 - Bit 2)
          LE Read Supported States (Octet 28 - Bit 3)
          Read Authenticated Payload Timeout (Octet 32 - Bit 4)
          Write Authenticated Payload Timeout (Octet 32 - Bit 5)
          LE Set Data Length (Octet 33 - Bit 6)
          LE Read Suggested Default Data Length (Octet 33 - Bit 7)
          LE Write Suggested Default Data Length (Octet 34 - Bit 0)
          LE Add Device To Resolving List (Octet 34 - Bit 3)
          LE Remove Device From Resolving List (Octet 34 - Bit 4)
          LE Clear Resolving List (Octet 34 - Bit 5)
          LE Read Resolving List Size (Octet 34 - Bit 6)
          LE Set Address Resolution Enable (Octet 35 - Bit 1)
          LE Set Resolvable Private Address Timeout (Octet 35 - Bit 2)
          LE Read Maximum Data Length (Octet 35 - Bit 3)
          LE Read PHY (Octet 35 - Bit 4)
          LE Set Default PHY (Octet 35 - Bit 5)
          LE Set PHY (Octet 35 - Bit 6)
          LE Set Advertising Set Random Address (Octet 36 - Bit 1)
          LE Set Extended Advertising Parameters (Octet 36 - Bit 2)
          LE Set Extended Advertising Data (Octet 36 - Bit 3)
          LE Set Extended Scan Response Data (Octet 36 - Bit 4)
          LE Set Extended Advertising Enable (Octet 36 - Bit 5)
          LE Read Maximum Advertising Data Length (Octet 36 - Bit 6)
          LE Read Number of Supported Advertising Sets (Octet 36 - Bit 7)
          LE Remove Advertising Set (Octet 37 - Bit 0)
          LE Clear Advertising Sets (Octet 37 - Bit 1)
          LE Set Periodic Advertising Parameters (Octet 37 - Bit 2)
          LE Set Periodic Advertising Data (Octet 37 - Bit 3)
          LE Set Periodic Advertising Enable (Octet 37 - Bit 4)
          LE Set Extended Scan Parameters (Octet 37 - Bit 5)
          LE Set Extended Scan Enable (Octet 37 - Bit 6)
          LE Extended Create Connection (Octet 37 - Bit 7)
          LE Periodic Advertising Create Sync (Octet 38 - Bit 0)
          LE Periodic Advertising Create Sync Cancel (Octet 38 - Bit 1)
          LE Periodic Advertising Terminate Sync (Octet 38 - Bit 2)
          LE Add Device To Periodic Advertiser List (Octet 38 - Bit 3)
          LE Remove Device From Periodic Advertiser List (Octet 38 - Bit 4)
          LE Clear Periodic Advertiser List (Octet 38 - Bit 5)
          LE Read Periodic Advertiser List Size (Octet 38 - Bit 6)
          LE Read Transmit Power (Octet 38 - Bit 7)
          LE Read RF Path Compensation (Octet 39 - Bit 0)
          LE Write RF Path Compensation (Octet 39 - Bit 1)
          LE Set Privacy Mode (Octet 39 - Bit 2)
          LE Periodic Advertising Receive Enable (Octet 40 - Bit 5)
          LE Periodic Advertising Sync Transfer (Octet 40 - Bit 6)
          LE Periodic Advertising Set Info Transfer (Octet 40 - Bit 7)
          LE Periodic Advertising Sync Transfer Parameters (Octet 41 - Bit 0)
          LE Set Default Periodic Advertisng Sync Transfer Parameters (Octet 41 - Bit 1)
          LE Read Buffer v2 (Octet 41 - Bit 5)
          LE Read ISO TX Sync (Octet 41 - Bit 6)
          LE Set Connected Isochronous Group Parameters (Octet 41 - Bit 7)
          LE Set Connected Isochronous Group Parameters Test (Octet 42 - Bit 0)
          LE Create Connected Isochronous Stream (Octet 42 - Bit 1)
          LE Remove Connected Isochronous Group (Octet 42 - Bit 2)
          LE Accept Connected Isochronous Stream Request (Octet 42 - Bit 3)
          LE Reject Connected Isochronous Stream Request (Octet 42 - Bit 4)
          LE Create Broadcast Isochronous Group (Octet 42 - Bit 5)
          LE Create Broadcast Isochronous Group Test (Octet 42 - Bit 6)
          LE Terminate Broadcast Isochronous Group (Octet 42 - Bit 7)
          LE Broadcast Isochronous Group Create Sync (Octet 43 - Bit 0)
          LE Broadcast Isochronous Group Terminate Sync (Octet 43 - Bit 1)
          LE Request Peer SCA (Octet 43 - Bit 2)
          LE Setup Isochronous Data Path (Octet 43 - Bit 3)
          LE Remove Isochronous Data Path (Octet 43 - Bit 4)
          LE Isochronous Transmit Test (Octet 43 - Bit 5)
          LE Isochronous Receive Test (Octet 43 - Bit 6)
          LE Isochronous Read Test Counters (Octet 43 - Bit 7)
          LE Isochronous Read Test Counters (Octet 44 - Bit 0)
          LE Set Host Feature (Octet 44 - Bit 1)
          Octet 44 - Bit 2 
          Octet 45 - Bit 6 
          Octet 46 - Bit 0 
          Octet 46 - Bit 1 
          Octet 46 - Bit 2 
          Octet 47 - Bit 4 
< HCI Command: Host Buffer Size (0x03|0x0033) plen 7         #9 [hci1] 0.922493
        ACL MTU: 255  ACL max packet: 16
        SCO MTU: 0    SCO max packet: 0
> HCI Event: Command Complete (0x0e) plen 4                 #10 [hci1] 0.923069
      Host Buffer Size (0x03|0x0033) ncmd 1
        Status: Success (0x00)
< HCI Command: Set Controller To Ho.. (0x03|0x0031) plen 1  #11 [hci1] 0.942458
        Flow control: ACL Data Packets (0x01)
> HCI Event: Command Complete (0x0e) plen 4                 #12 [hci1] 0.942925
      Set Controller To Host Flow Control (0x03|0x0031) ncmd 1
        Status: Success (0x00)
< HCI Command: LE Read Local Suppor.. (0x08|0x0003) plen 0  #13 [hci1] 0.962490
> HCI Event: Command Complete (0x0e) plen 12                #14 [hci1] 0.963094
      LE Read Local Supported Features (0x08|0x0003) ncmd 1
        Status: Success (0x00)
        Features: 0xfd 0x79 0x00 0xf7 0x30 0x01 0x00 0x00
          LE Encryption
          Extended Reject Indication
          Peripheral-initiated Features Exchange
          LE Ping
          LE Data Packet Length Extension
          LL Privacy
          Extended Scanner Filter Policies
          LE 2M PHY
          LE Coded PHY
          LE Extended Advertising
          LE Periodic Advertising
          Channel Selection Algorithm #2
          Periodic Advertising Sync Transfer - Sender
          Periodic Advertising Sync Transfer - Recipient
          Sleep Clock Accuracy Updates
          Connected Isochronous Stream - Central
          Connected Isochronous Stream - Peripheral
          Isochronous Broadcaster
          Synchronized Receiver
          Periodic Advertising ADI support
          Connection Subrating
          Unknown features (0x0000010000000000)
< HCI Command: LE Set Host Feature (0x08|0x0074) plen 2     #15 [hci1] 0.982469
        Bit Number: 32
          Connected Isochronous Stream (Host Support)
        Bit Value: 1
> HCI Event: Command Complete (0x0e) plen 4                 #16 [hci1] 0.982993
      LE Set Host Feature (0x08|0x0074) ncmd 1
        Status: Success (0x00)
< HCI Command: LE Read Buffer v2 (0x08|0x0060) plen 0       #17 [hci1] 1.002471
> HCI Event: Command Complete (0x0e) plen 10                #18 [hci1] 1.003110
      LE Read Buffer v2 (0x08|0x0060) ncmd 1
        Status: Success (0x00)
        ACL MTU: 27
        ACL max packet: 3
        ISO MTU: 318
        ISO max packet: 3
< HCI Command: LE Read Maximum Adve.. (0x08|0x003a) plen 0  #19 [hci1] 1.022535
> HCI Event: Command Complete (0x0e) plen 6                 #20 [hci1] 1.023110
      LE Read Maximum Advertising Data Length (0x08|0x003a) ncmd 1
        Status: Success (0x00)
        Max length: 1650
< HCI Command: LE Read Supported St.. (0x08|0x001c) plen 0  #21 [hci1] 1.042489
> HCI Event: Command Complete (0x0e) plen 12                #22 [hci1] 1.043032
      LE Read Supported States (0x08|0x001c) ncmd 1
        Status: Success (0x00)
        States: 0x000003ff3e0306ff
          Non-connectable Advertising State
          Scannable Advertising State
          Connectable Advertising State
          High Duty Cycle Directed Advertising State
          Passive Scanning State
          Active Scanning State
          Initiating State
            and Connection State (Central Role)
          Connection State (Peripheral Role)
          Scannable Advertising State
            and Passive Scanning State
          Connectable Advertising State
            and Passive Scanning State
          Non-connectable Advertising State
            and Initiating State
          Scannable Advertising State
            and Initiating State
          Active Scanning State
            and Connection State (Central Role)
          Passive Scanning State
            and Connection State (Peripheral Role)
          Active Scanning State
            and Connection State (Peripheral Role)
          Initiating State
            and Connection State (Central Role)
            and Central Role & Central Role
          Low Duty Cycle Directed Advertising State
          Connectable Advertising State
            and Initiating State
            and Central Role & Peripheral Role
          High Duty Cycle Directed Advertising State
            and Initiating State
            and Central Role & Peripheral Role
          Low Duty Cycle Directed Advertising State
            and Initiating State
            and Central Role & Peripheral Role
          Connectable Advertising State
            and Connection State (Central Role)
            and Central Role & Peripheral Role
          High Duty Cycle Directed Advertising State
            and Connection State (Central Role)
            and Central Role & Peripheral Role
          Low Duty Cycle Directed Advertising State
            and Connection State (Central Role)
            and Central Role & Peripheral Role
          Connectable Advertising State
            and Connection State (Peripheral Role)
            and Central Role & Peripheral Role
          High Duty Cycle Directed Advertising State
            and Connection State (Peripheral Role)
            and Peripheral Role & Peripheral Role
          Low Duty Cycle Directed Advertising State
            and Connection State (Peripheral Role)
            and Peripheral Role & Peripheral Role
          Initiating State
            and Connection State (Peripheral Role)
            and Central Role & Peripheral Role
< HCI Command: LE Read Maximum Data.. (0x08|0x002f) plen 0  #23 [hci1] 1.062482
> HCI Event: Command Complete (0x0e) plen 12                #24 [hci1] 1.063133
      LE Read Maximum Data Length (0x08|0x002f) ncmd 1
        Status: Success (0x00)
        Max TX octets: 251
        Max TX time: 2704
        Max RX octets: 251
        Max RX time: 2704
< HCI Command: LE Write Suggested D.. (0x08|0x0024) plen 4  #25 [hci1] 1.082497
        TX octets: 251
        TX time: 2704
> HCI Event: Command Complete (0x0e) plen 4                 #26 [hci1] 1.083081
      LE Write Suggested Default Data Length (0x08|0x0024) ncmd 1
        Status: Success (0x00)
< HCI Command: LE Set Resolvable Pr.. (0x08|0x002e) plen 2  #27 [hci1] 1.102492
        Timeout: 30 seconds
> HCI Event: Command Complete (0x0e) plen 4                 #28 [hci1] 1.102985
      LE Set Resolvable Private Address Timeout (0x08|0x002e) ncmd 1
        Status: Success (0x00)
< HCI Command: LE Read Resolving Li.. (0x08|0x002a) plen 0  #29 [hci1] 1.122482
> HCI Event: Command Complete (0x0e) plen 5                 #30 [hci1] 1.123110
      LE Read Resolving List Size (0x08|0x002a) ncmd 1
        Status: Success (0x00)
        Size: 8
< HCI Command: LE Set Host Feature (0x08|0x0074) plen 2     #31 [hci1] 1.142452
        Bit Number: 38
          Connection Subrating (Host Support)
        Bit Value: 1
> HCI Event: Command Complete (0x0e) plen 4                 #32 [hci1] 1.142935
      LE Set Host Feature (0x08|0x0074) ncmd 1
        Status: Success (0x00)
< HCI Command: LE Set Event Mask (0x08|0x0001) plen 8       #33 [hci1] 1.162489
        Mask: 0x000002063f87fa5e
          LE Advertising Report
          LE Connection Update Complete
          LE Read Remote Used Features Complete
          LE Long Term Key Request
          LE Data Length Change
          LE Enhanced Connection Complete
          LE PHY Update Complete
          LE Extended Advertising Report
          LE Periodic Advertising Sync Established
          LE Periodic Advertising Report
          LE Periodic Advertising Sync Lost
          LE Extended Scan Timeout
          LE Extended Advertising Set Terminated
          LE Scan Request Received
          LE Periodic Advertising Sync Transfer Rvc
          LE CIS Established
          LE CIS Request
          LE Create BIG Complete
          LE Terminate BIG Complete
          LE BIG Sync Estabilished Complete
          LE BIG Sync Lost
          LE BIG Info Advertising Report
          LE Subrate Change
          Unknown mask (0x0000020000000000)
> HCI Event: Command Complete (0x0e) plen 4                 #34 [hci1] 1.163083
      LE Set Event Mask (0x08|0x0001) ncmd 1
        Status: Success (0x00)
< HCI Command: Set Event Mask (0x03|0x0001) plen 8          #35 [hci1] 1.182520
        Mask: 0x2000800002008890
          Disconnection Complete
          Encryption Change
          Read Remote Version Information Complete
          Hardware Error
          Data Buffer Overflow
          Encryption Key Refresh Complete
          LE Meta
> HCI Event: Command Complete (0x0e) plen 4                 #36 [hci1] 1.183208
      Set Event Mask (0x03|0x0001) ncmd 1
        Status: Success (0x00)
< HCI Command: Read BD ADDR (0x04|0x0009) plen 0            #37 [hci1] 1.202400
> HCI Event: Command Complete (0x0e) plen 10                #38 [hci1] 1.202983
      Read BD ADDR (0x04|0x0009) ncmd 1
        Status: Success (0x00)
        Address: 00:00:00:00:00:00 (OUI 00-00-00)
< HCI Command: LE Set Random Address (0x08|0x0005) plen 6   #39 [hci1] 1.222539
        Address: D5:B6:CC:31:DB:3B (Static)
> HCI Event: Command Complete (0x0e) plen 4                 #40 [hci1] 1.222994
      LE Set Random Address (0x08|0x0005) ncmd 1
        Status: Success (0x00)
< HCI Command: LE Set Random Address (0x08|0x0005) plen 6   #41 [hci1] 1.292544
        Address: 48:61:8E:DB:C6:F9 (Resolvable)
> HCI Event: Command Complete (0x0e) plen 4                 #42 [hci1] 1.293185
      LE Set Random Address (0x08|0x0005) ncmd 1
        Status: Success (0x00)
< HCI Command: LE Set Extended Adv.. (0x08|0x0036) plen 25  #43 [hci1] 3.942545
        Handle: 0x00
        Properties: 0x0013
          Connectable
          Scannable
          Use legacy advertising PDUs: ADV_IND
        Min advertising interval: 100.000 msec (0x00a0)
        Max advertising interval: 150.000 msec (0x00f0)
        Channel map: 37, 38, 39 (0x07)
        Own address type: Random (0x01)
        Peer address type: Public (0x00)
        Peer address: 00:00:00:00:00:00 (OUI 00-00-00)
        Filter policy: Allow Scan Request from Any, Allow Connect Request from Any (0x00)
        TX power: Host has no preference (0x7f)
        Primary PHY: LE 1M (0x01)
        Secondary max skip: 0x00
        Secondary PHY: LE 1M (0x01)
        SID: 0x00
        Scan request notifications: Disabled (0x00)
> HCI Event: Command Complete (0x0e) plen 5                 #44 [hci1] 3.943384
      LE Set Extended Advertising Parameters (0x08|0x0036) ncmd 1
        Status: Success (0x00)
        TX power (selected): 0 dbm (0x00)
< HCI Command: LE Set Advertising S.. (0x08|0x0035) plen 7  #45 [hci1] 3.962513
        Advertising handle: 0x00
        Advertising random address: 48:61:8E:DB:C6:F9 (Resolvable)
> HCI Event: Command Complete (0x0e) plen 4                 #46 [hci1] 3.963107
      LE Set Advertising Set Random Address (0x08|0x0035) ncmd 1
        Status: Success (0x00)
< HCI Command: LE Set Extended Adv.. (0x08|0x0037) plen 22  #47 [hci1] 3.982530
        Handle: 0x00
        Operation: Complete extended advertising data (0x03)
        Fragment preference: Minimize fragmentation (0x01)
        Data length: 0x12
        Flags: 0x04
          BR/EDR Not Supported
        Name (complete): Tester_F6B11A
> HCI Event: Command Complete (0x0e) plen 4                 #48 [hci1] 3.983265
      LE Set Extended Advertising Data (0x08|0x0037) ncmd 1
        Status: Success (0x00)
< HCI Command: LE Set Extended Scan.. (0x08|0x0038) plen 4  #49 [hci1] 4.002530
        Handle: 0x00
        Operation: Complete scan response data (0x03)
        Fragment preference: Minimize fragmentation (0x01)
        Data length: 0x00
> HCI Event: Command Complete (0x0e) plen 4                 #50 [hci1] 4.003109
      LE Set Extended Scan Response Data (0x08|0x0038) ncmd 1
        Status: Success (0x00)
< HCI Command: LE Set Extended Adve.. (0x08|0x0039) plen 6  #51 [hci1] 4.022548
        Extended advertising: Enabled (0x01)
        Number of sets: 1 (0x01)
        Entry 0
          Handle: 0x00
          Duration: 0 ms (0x00)
          Max ext adv events: 0
> HCI Event: Command Complete (0x0e) plen 4                 #52 [hci1] 4.023170
      LE Set Extended Advertising Enable (0x08|0x0039) ncmd 1
        Status: Success (0x00)
> HCI Event: LE Meta Event (0x3e) plen 31                   #53 [hci1] 4.138090
      LE Enhanced Connection Complete (0x0a)
        Status: Success (0x00)
        Handle: 2829
        Role: Peripheral (0x01)
        Peer address type: Public (0x00)
        Peer address: DF:A9:FF:F6:B1:1A (OUI DF-A9-FF)
        Local resolvable private address: 00:00:00:00:00:00 (Non-Resolvable)
        Peer resolvable private address: 00:00:00:00:00:00 (Non-Resolvable)
        Connection interval: 87.50 msec (0x0046)
        Connection latency: 0 (0x0000)
        Supervision timeout: 25120 msec (0x09d0)
        Central clock accuracy: 0x01
> HCI Event: LE Meta Event (0x3e) plen 6                    #54 [hci1] 4.138217
      LE Advertising Set Terminated (0x12)
        Status: Success (0x00)
        Handle: 0
        Connection handle: 2829
        Number of completed extended advertising events: 0
< HCI Command: LE Read Remote Used... (0x08|0x0016) plen 2  #55 [hci1] 4.142627
        Handle: 2829 Address: DF:A9:FF:F6:B1:1A (OUI DF-A9-FF)
> HCI Event: Command Status (0x0f) plen 4                   #56 [hci1] 4.143200
      LE Read Remote Used Features (0x08|0x0016) ncmd 1
        Status: Success (0x00)
> HCI Event: LE Meta Event (0x3e) plen 12                   #57 [hci1] 4.402159
      LE Read Remote Used Features (0x04)
        Status: Success (0x00)
        Handle: 2829 Address: DF:A9:FF:F6:B1:1A (OUI DF-A9-FF)
        Features: 0x2d 0x49 0x00 0xf7 0x67 0xd9 0x00 0x80
          LE Encryption
          Extended Reject Indication
          Peripheral-initiated Features Exchange
          LE Data Packet Length Extension
          LE 2M PHY
          LE Coded PHY
          Channel Selection Algorithm #2
          Periodic Advertising Sync Transfer - Sender
          Periodic Advertising Sync Transfer - Recipient
          Sleep Clock Accuracy Updates
          Connected Isochronous Stream - Central
          Connected Isochronous Stream - Peripheral
          Isochronous Broadcaster
          Synchronized Receiver
          Connected Isochronous Stream (Host Support)
          LE Power Control Request
          LE Power Control Request
          Connection Subrating
          Connection Subrating (Host Support)
          Unknown features (0x8000d90000000000)
> ACL Data RX: Handle 2829 flags 0x02 dlen 11               #58 [hci1] 6.851821
      SMP: Pairing Request (0x01) len 6
        IO capability: KeyboardDisplay (0x04)
        OOB data: Authentication data not present (0x00)
        Authentication requirement: Bonding, No MITM, SC, No Keypresses (0x09)
        Max encryption key size: 16
        Initiator key distribution: EncKey IdKey (0x03)
        Responder key distribution: EncKey IdKey Sign (0x07)
< HCI Command: Host Number of Compl.. (0x03|0x0035) plen 5  #59 [hci1] 6.862883
        Num handles: 1
        Handle: 2829 Address: DF:A9:FF:F6:B1:1A (OUI DF-A9-FF)
        Count: 1
< ACL Data TX: Handle 2829 flags 0x00 dlen 11               #60 [hci1] 6.862973
      SMP: Pairing Response (0x02) len 6
        IO capability: KeyboardDisplay (0x04)
        OOB data: Authentication data not present (0x00)
        Authentication requirement: Bonding, No MITM, SC, No Keypresses (0x09)
        Max encryption key size: 16
        Initiator key distribution: IdKey (0x02)
        Responder key distribution: IdKey (0x02)
> HCI Event: Number of Completed Packets (0x13) plen 5      #61 [hci1] 7.026815
        Num handles: 1
        Handle: 2829 Address: DF:A9:FF:F6:B1:1A (OUI DF-A9-FF)
        Count: 1
        #60: len 11 (0 Kb/s)
        Latency: 163 msec (163-163 msec ~163 msec)
> ACL Data RX: Handle 2829 flags 0x02 dlen 27               #62 [hci1] 7.027137
> ACL Data RX: Handle 2829 flags 0x01 dlen 27               #63 [hci1] 7.027802
> ACL Data RX: Handle 2829 flags 0x01 dlen 15               #64 [hci1] 7.028171
      SMP: Pairing Public Key (0x0c) len 64
        X: af19ae0029c30ebf5dedff2ce80f81f08f14e7af679db8ce3b891df0b5507e3b
        Y: df9afc7dd1db32b620f369864074690fcbf16d08108953d270007734e7872f9b
< HCI Command: Host Number of Compl.. (0x03|0x0035) plen 5  #65 [hci1] 7.043397
        Num handles: 1
        Handle: 2829 Address: DF:A9:FF:F6:B1:1A (OUI DF-A9-FF)
        Count: 1
< HCI Command: Host Number of Compl.. (0x03|0x0035) plen 5  #66 [hci1] 7.043465
        Num handles: 1
        Handle: 2829 Address: DF:A9:FF:F6:B1:1A (OUI DF-A9-FF)
        Count: 1
< HCI Command: Host Number of Compl.. (0x03|0x0035) plen 5  #67 [hci1] 7.043771
        Num handles: 1
        Handle: 2829 Address: DF:A9:FF:F6:B1:1A (OUI DF-A9-FF)
        Count: 1
< ACL Data TX: Handle 2829 flags 0x00 dlen 27               #68 [hci1] 7.043869
< ACL Data TX: Handle 2829 flags 0x01 dlen 27               #69 [hci1] 7.043895
< ACL Data TX: Handle 2829 flags 0x01 dlen 15               #70 [hci1] 7.043916
      SMP: Pairing Public Key (0x0c) len 64
        X: 68f6ada634ce84d11617383d57f070fe3445c38b33b569efa5eb771a0dc8aea5
        Y: 83c407aaa8337331fdc418e55085d75e6c1c6e5d42f8bf9c18fb5a2a7d4f31aa
> HCI Event: Number of Completed Packets (0x13) plen 5      #71 [hci1] 7.114745
        Num handles: 1
        Handle: 2829 Address: DF:A9:FF:F6:B1:1A (OUI DF-A9-FF)
        Count: 1
        #68: len 27 (3 Kb/s)
        Latency: 70 msec (70-163 msec ~117 msec)
> HCI Event: Number of Completed Packets (0x13) plen 5      #72 [hci1] 7.115528
        Num handles: 1
        Handle: 2829 Address: DF:A9:FF:F6:B1:1A (OUI DF-A9-FF)
        Count: 1
        #69: len 27 (3 Kb/s)
        Latency: 71 msec (70-163 msec ~94 msec)
< ACL Data TX: Handle 2829 flags 0x00 dlen 21               #73 [hci1] 7.122733
      SMP: Pairing Confirm (0x03) len 16
        Confim value: 7bd75fd5ca4ef4102efeb1cb2b848f9a
> HCI Event: Number of Completed Packets (0x13) plen 5      #74 [hci1] 7.201632
        Num handles: 1
        Handle: 2829 Address: DF:A9:FF:F6:B1:1A (OUI DF-A9-FF)
        Count: 1
        #70: len 15 (0 Kb/s)
        Latency: 157 msec (70-163 msec ~126 msec)
> HCI Event: Number of Completed Packets (0x13) plen 5      #75 [hci1] 7.289352
        Num handles: 1
        Handle: 2829 Address: DF:A9:FF:F6:B1:1A (OUI DF-A9-FF)
        Count: 1
        #73: len 21 (1 Kb/s)
        Latency: 166 msec (70-166 msec ~146 msec)
> ACL Data RX: Handle 2829 flags 0x02 dlen 21               #76 [hci1] 7.289613
      SMP: Pairing Random (0x04) len 16
        Random value: 3fb47c4ea92188460000000000000000
< HCI Command: Host Number of Compl.. (0x03|0x0035) plen 5  #77 [hci1] 7.302806
        Num handles: 1
        Handle: 2829 Address: DF:A9:FF:F6:B1:1A (OUI DF-A9-FF)
        Count: 1
< ACL Data TX: Handle 2829 flags 0x00 dlen 21               #78 [hci1] 7.302842
      SMP: Pairing Random (0x04) len 16
        Random value: 555cc64d02679f89a05211af56d8b3da
> HCI Event: Number of Completed Packets (0x13) plen 5      #79 [hci1] 7.464013
        Num handles: 1
        Handle: 2829 Address: DF:A9:FF:F6:B1:1A (OUI DF-A9-FF)
        Count: 1
        #78: len 21 (1 Kb/s)
        Latency: 161 msec (70-166 msec ~153 msec)
> ACL Data RX: Handle 2829 flags 0x02 dlen 21               #80 [hci1] 7.552023
      SMP: Pairing DHKey Check (0x0d) len 16
        E: 3ffc773f7563a891639890774c1dad39
< HCI Command: Host Number of Compl.. (0x03|0x0035) plen 5  #81 [hci1] 7.562792
        Num handles: 1
        Handle: 2829 Address: DF:A9:FF:F6:B1:1A (OUI DF-A9-FF)
        Count: 1
< ACL Data TX: Handle 2829 flags 0x00 dlen 21               #82 [hci1] 7.562824
      SMP: Pairing DHKey Check (0x0d) len 16
        E: e85bbd7a85ca8deaf9a859f237b527a3
> HCI Event: Number of Completed Packets (0x13) plen 5      #83 [hci1] 7.726717
        Num handles: 1
        Handle: 2829 Address: DF:A9:FF:F6:B1:1A (OUI DF-A9-FF)
        Count: 1
        #82: len 21 (1 Kb/s)
        Latency: 163 msec (70-166 msec ~158 msec)
> HCI Event: LE Meta Event (0x3e) plen 13                   #84 [hci1] 7.814599
      LE Long Term Key Request (0x05)
        Handle: 2829 Address: DF:A9:FF:F6:B1:1A (OUI DF-A9-FF)
        Random number: 0x0000000000000000
        Encrypted diversifier: 0x0000
< HCI Command: LE Long Term Key Re.. (0x08|0x001a) plen 18  #85 [hci1] 7.822659
        Handle: 2829 Address: DF:A9:FF:F6:B1:1A (OUI DF-A9-FF)
        Long term key: 9a86d1849d2145fe434abeefc0a840a1
> HCI Event: Command Complete (0x0e) plen 6                 #86 [hci1] 7.823281
      LE Long Term Key Request Reply (0x08|0x001a) ncmd 1
        Status: Success (0x00)
        Handle: 2829 Address: DF:A9:FF:F6:B1:1A (OUI DF-A9-FF)
> HCI Event: Encryption Change (0x08) plen 4                #87 [hci1] 8.251867
        Status: Success (0x00)
        Handle: 2829 Address: DF:A9:FF:F6:B1:1A (OUI DF-A9-FF)
        Encryption: Enabled with AES-CCM (0x01)
< ACL Data TX: Handle 2829 flags 0x00 dlen 21               #88 [hci1] 8.372679
      SMP: Identity Information (0x08) len 16
        Identity resolving key: 08aad2e1be87e47b88aeb19de6889efb
< ACL Data TX: Handle 2829 flags 0x00 dlen 12               #89 [hci1] 8.372705
      SMP: Identity Address Information (0x09) len 7
        Address: D5:B6:CC:31:DB:3B (Static)
> HCI Event: Number of Completed Packets (0x13) plen 5      #90 [hci1] 8.427223
        Num handles: 1
        Handle: 2829 Address: DF:A9:FF:F6:B1:1A (OUI DF-A9-FF)
        Count: 1
        #88: len 21 (3 Kb/s)
        Latency: 54 msec (54-166 msec ~106 msec)
> HCI Event: Number of Completed Packets (0x13) plen 5      #91 [hci1] 8.514242
        Num handles: 1
        Handle: 2829 Address: DF:A9:FF:F6:B1:1A (OUI DF-A9-FF)
        Count: 1
        #89: len 12 (0 Kb/s)
        Latency: 141 msec (54-166 msec ~124 msec)
> ACL Data RX: Handle 2829 flags 0x02 dlen 21               #92 [hci1] 8.514633
      SMP: Identity Information (0x08) len 16
        Identity resolving key: 35ffadb0f4eca9b73089258a21b9c844
> ACL Data RX: Handle 2829 flags 0x02 dlen 12               #93 [hci1] 8.514890
      SMP: Identity Address Information (0x09) len 7
        Address: DF:A9:FF:F6:B1:1A (OUI DF-A9-FF)
< HCI Command: Host Number of Compl.. (0x03|0x0035) plen 5  #94 [hci1] 8.522845
        Num handles: 1
        Handle: 2829 Address: DF:A9:FF:F6:B1:1A (OUI DF-A9-FF)
        Count: 1
< HCI Command: LE Add Device To Re.. (0x08|0x0027) plen 39  #95 [hci1] 8.522878
        Address type: Public (0x00)
        Address: DF:A9:FF:F6:B1:1A (OUI DF-A9-FF)
        Peer identity resolving key: 35ffadb0f4eca9b73089258a21b9c844
        Local identity resolving key: 08aad2e1be87e47b88aeb19de6889efb
> HCI Event: Command Complete (0x0e) plen 4                 #96 [hci1] 8.523863
      LE Add Device To Resolving List (0x08|0x0027) ncmd 1
        Status: Success (0x00)
< HCI Command: LE Set Privacy Mode (0x08|0x004e) plen 8     #97 [hci1] 8.542661
        Peer Identity address type: Public (0x00)
        Peer Identity address: DF:A9:FF:F6:B1:1A (OUI DF-A9-FF)
        Privacy Mode: Use Device Privacy (0x01)
> HCI Event: Command Complete (0x0e) plen 4                 #98 [hci1] 8.543117
      LE Set Privacy Mode (0x08|0x004e) ncmd 1
        Status: Success (0x00)
< HCI Command: LE Set Address Resol.. (0x08|0x002d) plen 1  #99 [hci1] 8.562731
        Address resolution: Enabled (0x01)
> HCI Event: Command Complete (0x0e) plen 4                #100 [hci1] 8.563275
      LE Set Address Resolution Enable (0x08|0x002d) ncmd 1
        Status: Success (0x00)
< HCI Command: Host Number of Comp.. (0x03|0x0035) plen 5  #101 [hci1] 8.582575
        Num handles: 1
        Handle: 2829 Address: DF:A9:FF:F6:B1:1A (OUI DF-A9-FF)
        Count: 1
< ACL Data TX: Handle 2829 flags 0x00 dlen 11              #102 [hci1] 8.582623
      ATT: Read By Type Request (0x08) len 6
        Handle range: 0x0001-0xffff
        Attribute type: Central Address Resolution (0x2aa6)
> HCI Event: Number of Completed Packets (0x13) plen 5     #103 [hci1] 8.689144
        Num handles: 1
        Handle: 2829 Address: DF:A9:FF:F6:B1:1A (OUI DF-A9-FF)
        Count: 1
        #102: len 11 (0 Kb/s)
        Latency: 106 msec (54-166 msec ~115 msec)
> ACL Data RX: Handle 2829 flags 0x02 dlen 9               #104 [hci1] 8.776794
      ATT: Read By Type Response (0x09) len 4
        Attribute data length: 3
        Attribute data list: 1 entry
        Handle: 0x000f
        Value: 01
< HCI Command: Host Number of Comp.. (0x03|0x0035) plen 5  #105 [hci1] 8.782754
        Num handles: 1
        Handle: 2829 Address: DF:A9:FF:F6:B1:1A (OUI DF-A9-FF)
        Count: 1
< ACL Data TX: Handle 2829 flags 0x00 dlen 16              #106 [hci1] 9.152906
      LE L2CAP: Connection Parameter Update Request (0x12) ident 1 len 8
        Min interval: 24
        Max interval: 40
        Peripheral latency: 0
        Timeout multiplier: 42
> HCI Event: Number of Completed Packets (0x13) plen 5     #107 [hci1] 9.214486
        Num handles: 1
        Handle: 2829 Address: DF:A9:FF:F6:B1:1A (OUI DF-A9-FF)
        Count: 1
        #106: len 16 (2 Kb/s)
        Latency: 61 msec (54-166 msec ~88 msec)
> HCI Event: Disconnect Complete (0x05) plen 4             #108 [hci1] 9.214576
        Status: Success (0x00)
        Handle: 2829 Address: DF:A9:FF:F6:B1:1A (OUI DF-A9-FF)
        Reason: Remote User Terminated Connection (0x13)
< HCI Command: LE Clear Accept List (0x08|0x0010) plen 0  #109 [hci1] 10.102626
> HCI Event: Command Complete (0x0e) plen 4               #110 [hci1] 10.103166
      LE Clear Accept List (0x08|0x0010) ncmd 1
        Status: Success (0x00)
< HCI Command: LE Add Device To A.. (0x08|0x0011) plen 7  #111 [hci1] 10.122586
        Address type: Public (0x00)
        Address: E0:A9:FF:F6:B1:1A (OUI E0-A9-FF)
> HCI Event: Command Complete (0x0e) plen 4               #112 [hci1] 10.123169
      LE Add Device To Accept List (0x08|0x0011) ncmd 1
        Status: Success (0x00)
< HCI Command: LE Set Extended A.. (0x08|0x0036) plen 25  #113 [hci1] 10.192654
        Handle: 0x00
        Properties: 0x0012
          Scannable
          Use legacy advertising PDUs: ADV_SCAN_IND
        Min advertising interval: 100.000 msec (0x00a0)
        Max advertising interval: 150.000 msec (0x00f0)
        Channel map: 37, 38, 39 (0x07)
        Own address type: Random (0x01)
        Peer address type: Public (0x00)
        Peer address: 00:00:00:00:00:00 (OUI 00-00-00)
        Filter policy: Allow Scan Request from Accept List Only, Allow Connect Request from Any (0x01)
        TX power: Host has no preference (0x7f)
        Primary PHY: LE 1M (0x01)
        Secondary max skip: 0x00
        Secondary PHY: LE 1M (0x01)
        SID: 0x00
        Scan request notifications: Disabled (0x00)
> HCI Event: Command Complete (0x0e) plen 5               #114 [hci1] 10.193542
      LE Set Extended Advertising Parameters (0x08|0x0036) ncmd 1
        Status: Success (0x00)
        TX power (selected): 0 dbm (0x00)
< HCI Command: LE Set Advertising.. (0x08|0x0035) plen 7  #115 [hci1] 10.202601
        Advertising handle: 0x00
        Advertising random address: 48:61:8E:DB:C6:F9 (Resolvable)
          Identity type: Random (0x01)
          Identity: D5:B6:CC:31:DB:3B (Static)
> HCI Event: Command Complete (0x0e) plen 4               #116 [hci1] 10.203250
      LE Set Advertising Set Random Address (0x08|0x0035) ncmd 1
        Status: Success (0x00)
< HCI Command: LE Set Extended A.. (0x08|0x0037) plen 22  #117 [hci1] 10.222637
        Handle: 0x00
        Operation: Complete extended advertising data (0x03)
        Fragment preference: Minimize fragmentation (0x01)
        Data length: 0x12
        Flags: 0x04
          BR/EDR Not Supported
        Name (complete): Tester_F6B11A
> HCI Event: Command Complete (0x0e) plen 4               #118 [hci1] 10.223347
      LE Set Extended Advertising Data (0x08|0x0037) ncmd 1
        Status: Success (0x00)
< HCI Command: LE Set Extended Sc.. (0x08|0x0038) plen 8  #119 [hci1] 10.242655
        Handle: 0x00
        Operation: Complete scan response data (0x03)
        Fragment preference: Minimize fragmentation (0x01)
        Data length: 0x04
        Company: not assigned (52651)
          Data: 
> HCI Event: Command Complete (0x0e) plen 4               #120 [hci1] 10.243228
      LE Set Extended Scan Response Data (0x08|0x0038) ncmd 1
        Status: Success (0x00)
< HCI Command: LE Set Extended Ad.. (0x08|0x0039) plen 6  #121 [hci1] 10.262682
        Extended advertising: Enabled (0x01)
        Number of sets: 1 (0x01)
        Entry 0
          Handle: 0x00
          Duration: 0 ms (0x00)
          Max ext adv events: 0
> HCI Event: Command Complete (0x0e) plen 4               #122 [hci1] 10.263168
      LE Set Extended Advertising Enable (0x08|0x0039) ncmd 1
        Status: Success (0x00)
< HCI Command: LE Set Extended Ad.. (0x08|0x0039) plen 6  #123 [hci1] 11.312671
        Extended advertising: Disabled (0x00)
        Number of sets: 1 (0x01)
        Entry 0
          Handle: 0x00
          Duration: 0 ms (0x00)
          Max ext adv events: 0
> HCI Event: Command Complete (0x0e) plen 4               #124 [hci1] 11.313279
      LE Set Extended Advertising Enable (0x08|0x0039) ncmd 1
        Status: Success (0x00)
< HCI Command: LE Set Extended A.. (0x08|0x0036) plen 25  #125 [hci1] 11.332577
        Handle: 0x00
        Properties: 0x0012
          Scannable
          Use legacy advertising PDUs: ADV_SCAN_IND
        Min advertising interval: 100.000 msec (0x00a0)
        Max advertising interval: 150.000 msec (0x00f0)
        Channel map: 37, 38, 39 (0x07)
        Own address type: Random (0x01)
        Peer address type: Public (0x00)
        Peer address: 00:00:00:00:00:00 (OUI 00-00-00)
        Filter policy: Allow Scan Request from Accept List Only, Allow Connect Request from Any (0x01)
        TX power: Host has no preference (0x7f)
        Primary PHY: LE 1M (0x01)
        Secondary max skip: 0x00
        Secondary PHY: LE 1M (0x01)
        SID: 0x00
        Scan request notifications: Disabled (0x00)
> HCI Event: Command Complete (0x0e) plen 5               #126 [hci1] 11.333345
      LE Set Extended Advertising Parameters (0x08|0x0036) ncmd 1
        Status: Success (0x00)
        TX power (selected): 0 dbm (0x00)
< HCI Command: LE Set Advertising.. (0x08|0x0035) plen 7  #127 [hci1] 11.342590
        Advertising handle: 0x00
        Advertising random address: 48:61:8E:DB:C6:F9 (Resolvable)
          Identity type: Random (0x01)
          Identity: D5:B6:CC:31:DB:3B (Static)
> HCI Event: Command Complete (0x0e) plen 4               #128 [hci1] 11.343169
      LE Set Advertising Set Random Address (0x08|0x0035) ncmd 1
        Status: Success (0x00)
< HCI Command: LE Set Extended A.. (0x08|0x0037) plen 22  #129 [hci1] 11.362658
        Handle: 0x00
        Operation: Complete extended advertising data (0x03)
        Fragment preference: Minimize fragmentation (0x01)
        Data length: 0x12
        Flags: 0x04
          BR/EDR Not Supported
        Name (complete): Tester_F6B11A
> HCI Event: Command Complete (0x0e) plen 4               #130 [hci1] 11.363417
      LE Set Extended Advertising Data (0x08|0x0037) ncmd 1
        Status: Success (0x00)
< HCI Command: LE Set Extended Sc.. (0x08|0x0038) plen 8  #131 [hci1] 11.382584
        Handle: 0x00
        Operation: Complete scan response data (0x03)
        Fragment preference: Minimize fragmentation (0x01)
        Data length: 0x04
        Company: not assigned (52651)
          Data: 
> HCI Event: Command Complete (0x0e) plen 4               #132 [hci1] 11.383200
      LE Set Extended Scan Response Data (0x08|0x0038) ncmd 1
        Status: Success (0x00)
< HCI Command: LE Set Extended Ad.. (0x08|0x0039) plen 6  #133 [hci1] 11.402613
        Extended advertising: Enabled (0x01)
        Number of sets: 1 (0x01)
        Entry 0
          Handle: 0x00
          Duration: 0 ms (0x00)
          Max ext adv events: 0
> HCI Event: Command Complete (0x0e) plen 4               #134 [hci1] 11.403185
      LE Set Extended Advertising Enable (0x08|0x0039) ncmd 1
        Status: Success (0x00)
< HCI Command: LE Set Extended Ad.. (0x08|0x0039) plen 6  #135 [hci1] 13.452640
        Extended advertising: Disabled (0x00)
        Number of sets: 1 (0x01)
        Entry 0
          Handle: 0x00
          Duration: 0 ms (0x00)
          Max ext adv events: 0
> HCI Event: Command Complete (0x0e) plen 4               #136 [hci1] 13.453187
      LE Set Extended Advertising Enable (0x08|0x0039) ncmd 1
        Status: Success (0x00)
< HCI Command: LE Clear Accept List (0x08|0x0010) plen 0  #137 [hci1] 13.472618
> HCI Event: Command Complete (0x0e) plen 4               #138 [hci1] 13.473234
      LE Clear Accept List (0x08|0x0010) ncmd 1
        Status: Success (0x00)
< HCI Command: LE Add Device To A.. (0x08|0x0011) plen 7  #139 [hci1] 13.482638
        Address type: Public (0x00)
        Address: DF:A9:FF:F6:B1:1A (OUI DF-A9-FF)
> HCI Event: Command Complete (0x0e) plen 4               #140 [hci1] 13.483239
      LE Add Device To Accept List (0x08|0x0011) ncmd 1
        Status: Success (0x00)
< HCI Command: LE Set Extended A.. (0x08|0x0036) plen 25  #141 [hci1] 13.532680
        Handle: 0x00
        Properties: 0x0012
          Scannable
          Use legacy advertising PDUs: ADV_SCAN_IND
        Min advertising interval: 100.000 msec (0x00a0)
        Max advertising interval: 150.000 msec (0x00f0)
        Channel map: 37, 38, 39 (0x07)
        Own address type: Random (0x01)
        Peer address type: Public (0x00)
        Peer address: 00:00:00:00:00:00 (OUI 00-00-00)
        Filter policy: Allow Scan Request from Accept List Only, Allow Connect Request from Any (0x01)
        TX power: Host has no preference (0x7f)
        Primary PHY: LE 1M (0x01)
        Secondary max skip: 0x00
        Secondary PHY: LE 1M (0x01)
        SID: 0x00
        Scan request notifications: Disabled (0x00)
> HCI Event: Command Complete (0x0e) plen 5               #142 [hci1] 13.533577
      LE Set Extended Advertising Parameters (0x08|0x0036) ncmd 1
        Status: Success (0x00)
        TX power (selected): 0 dbm (0x00)
< HCI Command: LE Set Advertising.. (0x08|0x0035) plen 7  #143 [hci1] 13.542694
        Advertising handle: 0x00
        Advertising random address: 48:61:8E:DB:C6:F9 (Resolvable)
          Identity type: Random (0x01)
          Identity: D5:B6:CC:31:DB:3B (Static)
> HCI Event: Command Complete (0x0e) plen 4               #144 [hci1] 13.543264
      LE Set Advertising Set Random Address (0x08|0x0035) ncmd 1
        Status: Success (0x00)
< HCI Command: LE Set Extended A.. (0x08|0x0037) plen 22  #145 [hci1] 13.562693
        Handle: 0x00
        Operation: Complete extended advertising data (0x03)
        Fragment preference: Minimize fragmentation (0x01)
        Data length: 0x12
        Flags: 0x04
          BR/EDR Not Supported
        Name (complete): Tester_F6B11A
> HCI Event: Command Complete (0x0e) plen 4               #146 [hci1] 13.563364
      LE Set Extended Advertising Data (0x08|0x0037) ncmd 1
        Status: Success (0x00)
< HCI Command: LE Set Extended Sc.. (0x08|0x0038) plen 8  #147 [hci1] 13.582580
        Handle: 0x00
        Operation: Complete scan response data (0x03)
        Fragment preference: Minimize fragmentation (0x01)
        Data length: 0x04
        Company: not assigned (52651)
          Data: 
> HCI Event: Command Complete (0x0e) plen 4               #148 [hci1] 13.583260
      LE Set Extended Scan Response Data (0x08|0x0038) ncmd 1
        Status: Success (0x00)
< HCI Command: LE Set Extended Ad.. (0x08|0x0039) plen 6  #149 [hci1] 13.602631
        Extended advertising: Enabled (0x01)
        Number of sets: 1 (0x01)
        Entry 0
          Handle: 0x00
          Duration: 0 ms (0x00)
          Max ext adv events: 0
> HCI Event: Command Complete (0x0e) plen 4               #150 [hci1] 13.603212
      LE Set Extended Advertising Enable (0x08|0x0039) ncmd 1
        Status: Success (0x00)
< HCI Command: LE Set Extended Ad.. (0x08|0x0039) plen 6  #151 [hci1] 14.643001
        Extended advertising: Disabled (0x00)
        Number of sets: 1 (0x01)
        Entry 0
          Handle: 0x00
          Duration: 0 ms (0x00)
          Max ext adv events: 0
> HCI Event: Command Complete (0x0e) plen 4               #152 [hci1] 14.643687
      LE Set Extended Advertising Enable (0x08|0x0039) ncmd 1
        Status: Success (0x00)
< HCI Command: LE Set Extended A.. (0x08|0x0036) plen 25  #153 [hci1] 14.692634
        Handle: 0x00
        Properties: 0x0012
          Scannable
          Use legacy advertising PDUs: ADV_SCAN_IND
        Min advertising interval: 100.000 msec (0x00a0)
        Max advertising interval: 150.000 msec (0x00f0)
        Channel map: 37, 38, 39 (0x07)
        Own address type: Random (0x01)
        Peer address type: Public (0x00)
        Peer address: 00:00:00:00:00:00 (OUI 00-00-00)
        Filter policy: Allow Scan Request from Accept List Only, Allow Connect Request from Any (0x01)
        TX power: Host has no preference (0x7f)
        Primary PHY: LE 1M (0x01)
        Secondary max skip: 0x00
        Secondary PHY: LE 1M (0x01)
        SID: 0x00
        Scan request notifications: Disabled (0x00)
> HCI Event: Command Complete (0x0e) plen 5               #154 [hci1] 14.693451
      LE Set Extended Advertising Parameters (0x08|0x0036) ncmd 1
        Status: Success (0x00)
        TX power (selected): 0 dbm (0x00)
< HCI Command: LE Set Advertising.. (0x08|0x0035) plen 7  #155 [hci1] 14.702731
        Advertising handle: 0x00
        Advertising random address: 48:61:8E:DB:C6:F9 (Resolvable)
          Identity type: Random (0x01)
          Identity: D5:B6:CC:31:DB:3B (Static)
> HCI Event: Command Complete (0x0e) plen 4               #156 [hci1] 14.703269
      LE Set Advertising Set Random Address (0x08|0x0035) ncmd 1
        Status: Success (0x00)
< HCI Command: LE Set Extended A.. (0x08|0x0037) plen 22  #157 [hci1] 14.722676
        Handle: 0x00
        Operation: Complete extended advertising data (0x03)
        Fragment preference: Minimize fragmentation (0x01)
        Data length: 0x12
        Flags: 0x04
          BR/EDR Not Supported
        Name (complete): Tester_F6B11A
> HCI Event: Command Complete (0x0e) plen 4               #158 [hci1] 14.723456
      LE Set Extended Advertising Data (0x08|0x0037) ncmd 1
        Status: Success (0x00)
< HCI Command: LE Set Extended Sc.. (0x08|0x0038) plen 8  #159 [hci1] 14.742643
        Handle: 0x00
        Operation: Complete scan response data (0x03)
        Fragment preference: Minimize fragmentation (0x01)
        Data length: 0x04
        Company: not assigned (52651)
          Data: 
> HCI Event: Command Complete (0x0e) plen 4               #160 [hci1] 14.743244
      LE Set Extended Scan Response Data (0x08|0x0038) ncmd 1
        Status: Success (0x00)
< HCI Command: LE Set Extended Ad.. (0x08|0x0039) plen 6  #161 [hci1] 14.762642
        Extended advertising: Enabled (0x01)
        Number of sets: 1 (0x01)
        Entry 0
          Handle: 0x00
          Duration: 0 ms (0x00)
          Max ext adv events: 0
> HCI Event: Command Complete (0x0e) plen 4               #162 [hci1] 14.763203
      LE Set Extended Advertising Enable (0x08|0x0039) ncmd 1
        Status: Success (0x00)
< HCI Command: Reset (0x03|0x0003) plen 0                 #163 [hci1] 19.642709
> HCI Event: Command Complete (0x0e) plen 4               #164 [hci1] 19.643250
      Reset (0x03|0x0003) ncmd 1
        Status: Success (0x00)
@ USER Close: main                                    {0x0001} [hci1] 19.662665
= Close Index: 00:00:00:00:00:00                               [hci1] 19.666470
