Bluetooth monitor ver 5.72
= Note: Linux version 6.14.0-36-generic (x86_64)                       0.428997
= Note: Bluetooth subsystem version 2.22                               0.428999
= New Index: 00:00:00:00:00:00 (Primary,UART,hci1)              [hci1] 0.429000
= New Index: 48:5F:99:8E:E0:64 (Primary,USB,hci0)               [hci0] 0.429000
= Open Index: 00:00:00:00:00:00                                 [hci1] 0.942348
= Index Info: 00:00:00:00:00:00 (Nordic Semiconductor ASA)      [hci1] 0.942353
@ USER Open: main (privileged) version 2.22            {0x0001} [hci1] 0.942355
< HCI Command: Reset (0x03|0x0003) plen 0                    #1 [hci1] 0.942720
> HCI Event: Command Complete (0x0e) plen 4                  #2 [hci1] 0.943179
      Reset (0x03|0x0003) ncmd 1
        Status: Success (0x00)
< HCI Command: Read Local Supported... (0x04|0x0003) plen 0  #3 [hci1] 0.962312
> HCI Event: Command Complete (0x0e) plen 12                 #4 [hci1] 0.962811
      Read Local Supported Features (0x04|0x0003) ncmd 1
        Status: Success (0x00)
        Features: 0x00 0x00 0x00 0x00 0x60 0x00 0x00 0x00
          BR/EDR Not Supported
          LE Supported (Controller)
< HCI Command: Read Local Version In.. (0x04|0x0001) plen 0  #5 [hci1] 0.982284
> HCI Event: Command Complete (0x0e) plen 12                 #6 [hci1] 0.982712
      Read Local Version Information (0x04|0x0001) ncmd 1
        Status: Success (0x00)
        HCI version: Reserved (0x0f) - Revision 12393 (0x3069)
        LMP version: Reserved (0x0f) - Subversion 12393 (0x3069)
        Manufacturer: Nordic Semiconductor ASA (89)
< HCI Command: Read Local Supported... (0x04|0x0002) plen 0  #7 [hci1] 1.002210
> HCI Event: Command Complete (0x0e) plen 68                 #8 [hci1] 1.003258
      Read Local Supported Commands (0x04|0x0002) ncmd 1
        Status: Success (0x00)
        Commands: 119 entries
          Disconnect (Octet 0 - Bit 5)
          Read Remote Version Information (Octet 2 - Bit 7)
          Set Event Mask (Octet 5 - Bit 6)
          Reset (Octet 5 - Bit 7)
          Read Connection Accept Timeout (Octet 7 - Bit 2)
          Write Connection Accept Timeout (Octet 7 - Bit 3)
          Read Transmit Power Level (Octet 10 - Bit 2)
          Set Controller To Host Flow Control (Octet 10 - Bit 5)
          Host Buffer Size (Octet 10 - Bit 6)
          Host Number of Completed Packets (Octet 10 - Bit 7)
          Read Local Version Information (Octet 14 - Bit 3)
          Read Local Supported Features (Octet 14 - Bit 5)
          Read BD ADDR (Octet 15 - Bit 1)
          Read RSSI (Octet 15 - Bit 5)
          Set Event Mask Page 2 (Octet 22 - Bit 2)
          LE Set Event Mask (Octet 25 - Bit 0)
          LE Read Buffer Size (Octet 25 - Bit 1)
          LE Read Local Supported Features (Octet 25 - Bit 2)
          LE Set Random Address (Octet 25 - Bit 4)
          LE Set Advertising Parameters (Octet 25 - Bit 5)
          LE Read Advertising Channel TX Power (Octet 25 - Bit 6)
          LE Set Advertising Data (Octet 25 - Bit 7)
          LE Set Scan Response Data (Octet 26 - Bit 0)
          LE Set Advertise Enable (Octet 26 - Bit 1)
          LE Set Scan Parameters (Octet 26 - Bit 2)
          LE Set Scan Enable (Octet 26 - Bit 3)
          LE Create Connection (Octet 26 - Bit 4)
          LE Create Connection Cancel (Octet 26 - Bit 5)
          LE Read Accept List Size (Octet 26 - Bit 6)
          LE Clear Accept List (Octet 26 - Bit 7)
          LE Add Device To Accept List (Octet 27 - Bit 0)
          LE Remove Device From Accept List (Octet 27 - Bit 1)
          LE Connection Update (Octet 27 - Bit 2)
          LE Set Host Channel Classification (Octet 27 - Bit 3)
          LE Read Channel Map (Octet 27 - Bit 4)
          LE Read Remote Used Features (Octet 27 - Bit 5)
          LE Encrypt (Octet 27 - Bit 6)
          LE Rand (Octet 27 - Bit 7)
          LE Start Encryption (Octet 28 - Bit 0)
          LE Long Term Key Request Reply (Octet 28 - Bit 1)
          LE Long Term Key Request Neg Reply (Octet 28 - Bit 2)
          LE Read Supported States (Octet 28 - Bit 3)
          LE Receiver Test (Octet 28 - Bit 4)
          LE Transmitter Test (Octet 28 - Bit 5)
          LE Test End (Octet 28 - Bit 6)
          Read Authenticated Payload Timeout (Octet 32 - Bit 4)
          Write Authenticated Payload Timeout (Octet 32 - Bit 5)
          LE Set Data Length (Octet 33 - Bit 6)
          LE Read Suggested Default Data Length (Octet 33 - Bit 7)
          LE Write Suggested Default Data Length (Octet 34 - Bit 0)
          LE Add Device To Resolving List (Octet 34 - Bit 3)
          LE Remove Device From Resolving List (Octet 34 - Bit 4)
          LE Clear Resolving List (Octet 34 - Bit 5)
          LE Read Resolving List Size (Octet 34 - Bit 6)
          LE Set Address Resolution Enable (Octet 35 - Bit 1)
          LE Set Resolvable Private Address Timeout (Octet 35 - Bit 2)
          LE Read Maximum Data Length (Octet 35 - Bit 3)
          LE Read PHY (Octet 35 - Bit 4)
          LE Set Default PHY (Octet 35 - Bit 5)
          LE Set PHY (Octet 35 - Bit 6)
          LE Enhanced Receiver Test (Octet 35 - Bit 7)
          LE Enhanced Transmitter Test (Octet 36 - Bit 0)
          LE Set Advertising Set Random Address (Octet 36 - Bit 1)
          LE Set Extended Advertising Parameters (Octet 36 - Bit 2)
          LE Set Extended Advertising Data (Octet 36 - Bit 3)
          LE Set Extended Scan Response Data (Octet 36 - Bit 4)
          LE Set Extended Advertising Enable (Octet 36 - Bit 5)
          LE Read Maximum Advertising Data Length (Octet 36 - Bit 6)
          LE Read Number of Supported Advertising Sets (Octet 36 - Bit 7)
          LE Remove Advertising Set (Octet 37 - Bit 0)
          LE Clear Advertising Sets (Octet 37 - Bit 1)
          LE Set Periodic Advertising Parameters (Octet 37 - Bit 2)
          LE Set Periodic Advertising Data (Octet 37 - Bit 3)
          LE Set Periodic Advertising Enable (Octet 37 - Bit 4)
          LE Set Extended Scan Parameters (Octet 37 - Bit 5)
          LE Set Extended Scan Enable (Octet 37 - Bit 6)
          LE Extended Create Connection (Octet 37 - Bit 7)
          LE Periodic Advertising Create Sync (Octet 38 - Bit 0)
          LE Periodic Advertising Create Sync Cancel (Octet 38 - Bit 1)
          LE Periodic Advertising Terminate Sync (Octet 38 - Bit 2)
          LE Add Device To Periodic Advertiser List (Octet 38 - Bit 3)
          LE Remove Device From Periodic Advertiser List (Octet 38 - Bit 4)
          LE Clear Periodic Advertiser List (Octet 38 - Bit 5)
          LE Read Periodic Advertiser List Size (Octet 38 - Bit 6)
          LE Read Transmit Power (Octet 38 - Bit 7)
          LE Read RF Path Compensation (Octet 39 - Bit 0)
          LE Write RF Path Compensation (Octet 39 - Bit 1)
          LE Set Privacy Mode (Octet 39 - Bit 2)
          LE Periodic Advertising Receive Enable (Octet 40 - Bit 5)
          LE Periodic Advertising Sync Transfer (Octet 40 - Bit 6)
          LE Periodic Advertising Set Info Transfer (Octet 40 - Bit 7)
          LE Periodic Advertising Sync Transfer Parameters (Octet 41 - Bit 0)
          LE Set Default Periodic Advertisng Sync Transfer Parameters (Octet 41 - Bit 1)
          LE Read Buffer v2 (Octet 41 - Bit 5)
          LE Read ISO TX Sync (Octet 41 - Bit 6)
          LE Set Connected Isochronous Group Parameters (Octet 41 - Bit 7)
          LE Set Connected Isochronous Group Parameters Test (Octet 42 - Bit 0)
          LE Create Connected Isochronous Stream (Octet 42 - Bit 1)
          LE Remove Connected Isochronous Group (Octet 42 - Bit 2)
          LE Accept Connected Isochronous Stream Request (Octet 42 - Bit 3)
          LE Reject Connected Isochronous Stream Request (Octet 42 - Bit 4)
          LE Create Broadcast Isochronous Group (Octet 42 - Bit 5)
          LE Create Broadcast Isochronous Group Test (Octet 42 - Bit 6)
          LE Terminate Broadcast Isochronous Group (Octet 42 - Bit 7)
          LE Broadcast Isochronous Group Create Sync (Octet 43 - Bit 0)
          LE Broadcast Isochronous Group Terminate Sync (Octet 43 - Bit 1)
          LE Request Peer SCA (Octet 43 - Bit 2)
          LE Setup Isochronous Data Path (Octet 43 - Bit 3)
          LE Remove Isochronous Data Path (Octet 43 - Bit 4)
          LE Isochronous Transmit Test (Octet 43 - Bit 5)
          LE Isochronous Receive Test (Octet 43 - Bit 6)
          LE Isochronous Read Test Counters (Octet 43 - Bit 7)
          LE Isochronous Read Test Counters (Octet 44 - Bit 0)
          LE Set Host Feature (Octet 44 - Bit 1)
          Octet 44 - Bit 2 
          Octet 45 - Bit 6 
          Octet 46 - Bit 0 
          Octet 46 - Bit 1 
          Octet 46 - Bit 2 
< HCI Command: Host Buffer Size (0x03|0x0033) plen 7         #9 [hci1] 1.022278
        ACL MTU: 255  ACL max packet: 16
        SCO MTU: 0    SCO max packet: 0
> HCI Event: Command Complete (0x0e) plen 4                 #10 [hci1] 1.022736
      Host Buffer Size (0x03|0x0033) ncmd 1
        Status: Success (0x00)
< HCI Command: Set Controller To Ho.. (0x03|0x0031) plen 1  #11 [hci1] 1.042337
        Flow control: ACL Data Packets (0x01)
> HCI Event: Command Complete (0x0e) plen 4                 #12 [hci1] 1.042733
      Set Controller To Host Flow Control (0x03|0x0031) ncmd 1
        Status: Success (0x00)
< HCI Command: LE Read Local Suppor.. (0x08|0x0003) plen 0  #13 [hci1] 1.062297
> HCI Event: Command Complete (0x0e) plen 12                #14 [hci1] 1.062831
      LE Read Local Supported Features (0x08|0x0003) ncmd 1
        Status: Success (0x00)
        Features: 0xfd 0x79 0x00 0xf7 0x30 0x01 0x00 0x00
          LE Encryption
          Extended Reject Indication
          Peripheral-initiated Features Exchange
          LE Ping
          LE Data Packet Length Extension
          LL Privacy
          Extended Scanner Filter Policies
          LE 2M PHY
          LE Coded PHY
          LE Extended Advertising
          LE Periodic Advertising
          Channel Selection Algorithm #2
          Periodic Advertising Sync Transfer - Sender
          Periodic Advertising Sync Transfer - Recipient
          Sleep Clock Accuracy Updates
          Connected Isochronous Stream - Central
          Connected Isochronous Stream - Peripheral
          Isochronous Broadcaster
          Synchronized Receiver
          Periodic Advertising ADI support
          Connection Subrating
          Unknown features (0x0000010000000000)
< HCI Command: LE Set Host Feature (0x08|0x0074) plen 2     #15 [hci1] 1.082310
        Bit Number: 32
          Connected Isochronous Stream (Host Support)
        Bit Value: 1
> HCI Event: Command Complete (0x0e) plen 4                 #16 [hci1] 1.082803
      LE Set Host Feature (0x08|0x0074) ncmd 1
        Status: Success (0x00)
< HCI Command: LE Read Buffer v2 (0x08|0x0060) plen 0       #17 [hci1] 1.102248
> HCI Event: Command Complete (0x0e) plen 10                #18 [hci1] 1.102710
      LE Read Buffer v2 (0x08|0x0060) ncmd 1
        Status: Success (0x00)
        ACL MTU: 27
        ACL max packet: 3
        ISO MTU: 318
        ISO max packet: 3
< HCI Command: LE Read Maximum Adve.. (0x08|0x003a) plen 0  #19 [hci1] 1.122327
> HCI Event: Command Complete (0x0e) plen 6                 #20 [hci1] 1.122734
      LE Read Maximum Advertising Data Length (0x08|0x003a) ncmd 1
        Status: Success (0x00)
        Max length: 1650
< HCI Command: LE Read Supported St.. (0x08|0x001c) plen 0  #21 [hci1] 1.142309
> HCI Event: Command Complete (0x0e) plen 12                #22 [hci1] 1.142868
      LE Read Supported States (0x08|0x001c) ncmd 1
        Status: Success (0x00)
        States: 0x000003ff3e0306ff
          Non-connectable Advertising State
          Scannable Advertising State
          Connectable Advertising State
          High Duty Cycle Directed Advertising State
          Passive Scanning State
          Active Scanning State
          Initiating State
            and Connection State (Central Role)
          Connection State (Peripheral Role)
          Scannable Advertising State
            and Passive Scanning State
          Connectable Advertising State
            and Passive Scanning State
          Non-connectable Advertising State
            and Initiating State
          Scannable Advertising State
            and Initiating State
          Active Scanning State
            and Connection State (Central Role)
          Passive Scanning State
            and Connection State (Peripheral Role)
          Active Scanning State
            and Connection State (Peripheral Role)
          Initiating State
            and Connection State (Central Role)
            and Central Role & Central Role
          Low Duty Cycle Directed Advertising State
          Connectable Advertising State
            and Initiating State
            and Central Role & Peripheral Role
          High Duty Cycle Directed Advertising State
            and Initiating State
            and Central Role & Peripheral Role
          Low Duty Cycle Directed Advertising State
            and Initiating State
            and Central Role & Peripheral Role
          Connectable Advertising State
            and Connection State (Central Role)
            and Central Role & Peripheral Role
          High Duty Cycle Directed Advertising State
            and Connection State (Central Role)
            and Central Role & Peripheral Role
          Low Duty Cycle Directed Advertising State
            and Connection State (Central Role)
            and Central Role & Peripheral Role
          Connectable Advertising State
            and Connection State (Peripheral Role)
            and Central Role & Peripheral Role
          High Duty Cycle Directed Advertising State
            and Connection State (Peripheral Role)
            and Peripheral Role & Peripheral Role
          Low Duty Cycle Directed Advertising State
            and Connection State (Peripheral Role)
            and Peripheral Role & Peripheral Role
          Initiating State
            and Connection State (Peripheral Role)
            and Central Role & Peripheral Role
< HCI Command: LE Read Maximum Data.. (0x08|0x002f) plen 0  #23 [hci1] 1.162268
> HCI Event: Command Complete (0x0e) plen 12                #24 [hci1] 1.162838
      LE Read Maximum Data Length (0x08|0x002f) ncmd 1
        Status: Success (0x00)
        Max TX octets: 251
        Max TX time: 2704
        Max RX octets: 251
        Max RX time: 2704
< HCI Command: LE Write Suggested D.. (0x08|0x0024) plen 4  #25 [hci1] 1.182301
        TX octets: 251
        TX time: 2704
> HCI Event: Command Complete (0x0e) plen 4                 #26 [hci1] 1.182750
      LE Write Suggested Default Data Length (0x08|0x0024) ncmd 1
        Status: Success (0x00)
< HCI Command: LE Read Resolving Li.. (0x08|0x002a) plen 0  #27 [hci1] 1.202321
> HCI Event: Command Complete (0x0e) plen 5                 #28 [hci1] 1.202894
      LE Read Resolving List Size (0x08|0x002a) ncmd 1
        Status: Success (0x00)
        Size: 8
< HCI Command: LE Set Event Mask (0x08|0x0001) plen 8       #29 [hci1] 1.222318
        Mask: 0x000002023f87fa5e
          LE Advertising Report
          LE Connection Update Complete
          LE Read Remote Used Features Complete
          LE Long Term Key Request
          LE Data Length Change
          LE Enhanced Connection Complete
          LE PHY Update Complete
          LE Extended Advertising Report
          LE Periodic Advertising Sync Established
          LE Periodic Advertising Report
          LE Periodic Advertising Sync Lost
          LE Extended Scan Timeout
          LE Extended Advertising Set Terminated
          LE Scan Request Received
          LE Periodic Advertising Sync Transfer Rvc
          LE CIS Established
          LE CIS Request
          LE Create BIG Complete
          LE Terminate BIG Complete
          LE BIG Sync Estabilished Complete
          LE BIG Sync Lost
          LE BIG Info Advertising Report
          Unknown mask (0x0000020000000000)
> HCI Event: Command Complete (0x0e) plen 4                 #30 [hci1] 1.222865
      LE Set Event Mask (0x08|0x0001) ncmd 1
        Status: Success (0x00)
< HCI Command: Set Event Mask (0x03|0x0001) plen 8          #31 [hci1] 1.242310
        Mask: 0x2000800002008890
          Disconnection Complete
          Encryption Change
          Read Remote Version Information Complete
          Hardware Error
          Data Buffer Overflow
          Encryption Key Refresh Complete
          LE Meta
> HCI Event: Command Complete (0x0e) plen 4                 #32 [hci1] 1.242841
      Set Event Mask (0x03|0x0001) ncmd 1
        Status: Success (0x00)
< HCI Command: Read BD ADDR (0x04|0x0009) plen 0            #33 [hci1] 1.262298
> HCI Event: Command Complete (0x0e) plen 10                #34 [hci1] 1.262753
      Read BD ADDR (0x04|0x0009) ncmd 1
        Status: Success (0x00)
        Address: 00:00:00:00:00:00 (OUI 00-00-00)
< HCI Command: LE Set Random Address (0x08|0x0005) plen 6   #35 [hci1] 1.282303
        Address: D5:B6:CC:31:DB:3B (Static)
> HCI Event: Command Complete (0x0e) plen 4                 #36 [hci1] 1.282847
      LE Set Random Address (0x08|0x0005) ncmd 1
        Status: Success (0x00)
< HCI Command: LE Set Extended Adv.. (0x08|0x0036) plen 25  #37 [hci1] 3.912808
        Handle: 0x00
        Properties: 0x0013
          Connectable
          Scannable
          Use legacy advertising PDUs: ADV_IND
        Min advertising interval: 100.000 msec (0x00a0)
        Max advertising interval: 150.000 msec (0x00f0)
        Channel map: 37, 38, 39 (0x07)
        Own address type: Random (0x01)
        Peer address type: Public (0x00)
        Peer address: 00:00:00:00:00:00 (OUI 00-00-00)
        Filter policy: Allow Scan Request from Any, Allow Connect Request from Any (0x00)
        TX power: Host has no preference (0x7f)
        Primary PHY: LE 1M (0x01)
        Secondary max skip: 0x00
        Secondary PHY: LE 1M (0x01)
        SID: 0x00
        Scan request notifications: Disabled (0x00)
> HCI Event: Command Complete (0x0e) plen 5                 #38 [hci1] 3.913713
      LE Set Extended Advertising Parameters (0x08|0x0036) ncmd 1
        Status: Success (0x00)
        TX power (selected): 0 dbm (0x00)
< HCI Command: LE Set Advertising S.. (0x08|0x0035) plen 7  #39 [hci1] 3.922774
        Advertising handle: 0x00
        Advertising random address: D5:B6:CC:31:DB:3B (Static)
> HCI Event: Command Complete (0x0e) plen 4                 #40 [hci1] 3.923319
      LE Set Advertising Set Random Address (0x08|0x0035) ncmd 1
        Status: Success (0x00)
< HCI Command: LE Set Extended Adv.. (0x08|0x0037) plen 22  #41 [hci1] 3.942468
        Handle: 0x00
        Operation: Complete extended advertising data (0x03)
        Fragment preference: Minimize fragmentation (0x01)
        Data length: 0x12
        Flags: 0x06
          LE General Discoverable Mode
          BR/EDR Not Supported
        Name (complete): Tester_F6B11A
> HCI Event: Command Complete (0x0e) plen 4                 #42 [hci1] 3.943242
      LE Set Extended Advertising Data (0x08|0x0037) ncmd 1
        Status: Success (0x00)
< HCI Command: LE Set Extended Scan.. (0x08|0x0038) plen 4  #43 [hci1] 3.962313
        Handle: 0x00
        Operation: Complete scan response data (0x03)
        Fragment preference: Minimize fragmentation (0x01)
        Data length: 0x00
> HCI Event: Command Complete (0x0e) plen 4                 #44 [hci1] 3.962864
      LE Set Extended Scan Response Data (0x08|0x0038) ncmd 1
        Status: Success (0x00)
< HCI Command: LE Set Extended Adve.. (0x08|0x0039) plen 6  #45 [hci1] 3.982294
        Extended advertising: Enabled (0x01)
        Number of sets: 1 (0x01)
        Entry 0
          Handle: 0x00
          Duration: 0 ms (0x00)
          Max ext adv events: 0
> HCI Event: Command Complete (0x0e) plen 4                 #46 [hci1] 3.982892
      LE Set Extended Advertising Enable (0x08|0x0039) ncmd 1
        Status: Success (0x00)
> HCI Event: LE Meta Event (0x3e) plen 31                   #47 [hci1] 4.099118
      LE Enhanced Connection Complete (0x0a)
        Status: Success (0x00)
        Handle: 345
        Role: Peripheral (0x01)
        Peer address type: Public (0x00)
        Peer address: DF:A9:FF:F6:B1:1A (OUI DF-A9-FF)
        Local resolvable private address: 00:00:00:00:00:00 (Non-Resolvable)
        Peer resolvable private address: 00:00:00:00:00:00 (Non-Resolvable)
        Connection interval: 87.50 msec (0x0046)
        Connection latency: 0 (0x0000)
        Supervision timeout: 25120 msec (0x09d0)
        Central clock accuracy: 0x01
> HCI Event: LE Meta Event (0x3e) plen 6                    #48 [hci1] 4.099270
      LE Advertising Set Terminated (0x12)
        Status: Success (0x00)
        Handle: 0
        Connection handle: 345
        Number of completed extended advertising events: 0
< HCI Command: LE Read Remote Used... (0x08|0x0016) plen 2  #49 [hci1] 4.103365
        Handle: 345 Address: DF:A9:FF:F6:B1:1A (OUI DF-A9-FF)
< ACL Data TX: Handle 345 flags 0x00 dlen 7                 #50 [hci1] 4.103392
      ATT: Exchange MTU Request (0x02) len 2
        Client RX MTU: 251
> HCI Event: Command Status (0x0f) plen 4                   #51 [hci1] 4.103947
      LE Read Remote Used Features (0x08|0x0016) ncmd 1
        Status: Success (0x00)
> HCI Event: Number of Completed Packets (0x13) plen 5      #52 [hci1] 4.275093
        Num handles: 1
        Handle: 345 Address: DF:A9:FF:F6:B1:1A (OUI DF-A9-FF)
        Count: 1
        #50: len 7 (0 Kb/s)
        Latency: 171 msec (171-171 msec ~171 msec)
> HCI Event: LE Meta Event (0x3e) plen 12                   #53 [hci1] 4.363039
      LE Read Remote Used Features (0x04)
        Status: Success (0x00)
        Handle: 345 Address: DF:A9:FF:F6:B1:1A (OUI DF-A9-FF)
        Features: 0x2d 0x49 0x00 0xf7 0x67 0xd8 0x00 0x00
          LE Encryption
          Extended Reject Indication
          Peripheral-initiated Features Exchange
          LE Data Packet Length Extension
          LE 2M PHY
          LE Coded PHY
          Channel Selection Algorithm #2
          Periodic Advertising Sync Transfer - Sender
          Periodic Advertising Sync Transfer - Recipient
          Sleep Clock Accuracy Updates
          Connected Isochronous Stream - Central
          Connected Isochronous Stream - Peripheral
          Isochronous Broadcaster
          Synchronized Receiver
          Connected Isochronous Stream (Host Support)
          LE Power Control Request
          LE Power Control Request
          Connection Subrating
          Connection Subrating (Host Support)
          Unknown features (0x0000d80000000000)
> ACL Data RX: Handle 345 flags 0x02 dlen 11                #54 [hci1] 6.812631
      SMP: Pairing Request (0x01) len 6
        IO capability: KeyboardDisplay (0x04)
        OOB data: Authentication data not present (0x00)
        Authentication requirement: Bonding, MITM, SC, No Keypresses (0x0d)
        Max encryption key size: 16
        Initiator key distribution: EncKey IdKey (0x03)
        Responder key distribution: EncKey IdKey Sign (0x07)
< HCI Command: Host Number of Compl.. (0x03|0x0035) plen 5  #55 [hci1] 6.822988
        Num handles: 1
        Handle: 345 Address: DF:A9:FF:F6:B1:1A (OUI DF-A9-FF)
        Count: 1
< ACL Data TX: Handle 345 flags 0x00 dlen 11                #56 [hci1] 6.823240
      SMP: Pairing Response (0x02) len 6
        IO capability: DisplayOnly (0x00)
        OOB data: Authentication data not present (0x00)
        Authentication requirement: Bonding, No MITM, SC, No Keypresses (0x09)
        Max encryption key size: 16
        Initiator key distribution: IdKey (0x02)
        Responder key distribution: <none> (0x00)
> ACL Data RX: Handle 345 flags 0x02 dlen 7                 #57 [hci1] 6.900058
      ATT: Exchange MTU Response (0x03) len 2
        Server RX MTU: 23
< HCI Command: Host Number of Compl.. (0x03|0x0035) plen 5  #58 [hci1] 6.902784
        Num handles: 1
        Handle: 345 Address: DF:A9:FF:F6:B1:1A (OUI DF-A9-FF)
        Count: 1
> HCI Event: Number of Completed Packets (0x13) plen 5      #59 [hci1] 6.987714
        Num handles: 1
        Handle: 345 Address: DF:A9:FF:F6:B1:1A (OUI DF-A9-FF)
        Count: 1
        #56: len 11 (0 Kb/s)
        Latency: 164 msec (164-171 msec ~168 msec)
> ACL Data RX: Handle 345 flags 0x02 dlen 27                #60 [hci1] 6.987969
> ACL Data RX: Handle 345 flags 0x01 dlen 27                #61 [hci1] 6.988612
> ACL Data RX: Handle 345 flags 0x01 dlen 15                #62 [hci1] 6.988965
      SMP: Pairing Public Key (0x0c) len 64
        X: 44e32bc7b2b441714cc9393eba68d51cc982a9253da19cf5ae3f8844b462776d
        Y: 545caa946f76759760253739139ac0d851bf3633b0b1f2fda4096724522cb018
< HCI Command: Host Number of Compl.. (0x03|0x0035) plen 5  #63 [hci1] 7.002349
        Num handles: 1
        Handle: 345 Address: DF:A9:FF:F6:B1:1A (OUI DF-A9-FF)
        Count: 1
< HCI Command: Host Number of Compl.. (0x03|0x0035) plen 5  #64 [hci1] 7.002692
        Num handles: 1
        Handle: 345 Address: DF:A9:FF:F6:B1:1A (OUI DF-A9-FF)
        Count: 1
< HCI Command: Host Number of Compl.. (0x03|0x0035) plen 5  #65 [hci1] 7.002820
        Num handles: 1
        Handle: 345 Address: DF:A9:FF:F6:B1:1A (OUI DF-A9-FF)
        Count: 1
< ACL Data TX: Handle 345 flags 0x00 dlen 27                #66 [hci1] 7.003233
< ACL Data TX: Handle 345 flags 0x01 dlen 27                #67 [hci1] 7.003242
< ACL Data TX: Handle 345 flags 0x01 dlen 15                #68 [hci1] 7.003254
      SMP: Pairing Public Key (0x0c) len 64
        X: 98308440221e2d910f0e54b71e7ec652857aa9b5a0dc65028824cc19db1226e9
        Y: 67a4816bcb62efb21701e31fdb27561a6217575fb007a8bbdabe7e28b6f68482
> HCI Event: Number of Completed Packets (0x13) plen 5      #69 [hci1] 7.075643
        Num handles: 1
        Handle: 345 Address: DF:A9:FF:F6:B1:1A (OUI DF-A9-FF)
        Count: 1
        #66: len 27 (3 Kb/s)
        Latency: 72 msec (72-171 msec ~120 msec)
> HCI Event: Number of Completed Packets (0x13) plen 5      #70 [hci1] 7.076266
        Num handles: 1
        Handle: 345 Address: DF:A9:FF:F6:B1:1A (OUI DF-A9-FF)
        Count: 1
        #67: len 27 (2 Kb/s)
        Latency: 73 msec (72-171 msec ~96 msec)
> HCI Event: Number of Completed Packets (0x13) plen 5      #71 [hci1] 7.162487
        Num handles: 1
        Handle: 345 Address: DF:A9:FF:F6:B1:1A (OUI DF-A9-FF)
        Count: 1
        #68: len 15 (0 Kb/s)
        Latency: 159 msec (72-171 msec ~127 msec)
> ACL Data RX: Handle 345 flags 0x02 dlen 21                #72 [hci1] 8.125321
      SMP: Pairing Confirm (0x03) len 16
        Confim value: 58b5f5430186f784e74c513104067ee4
< HCI Command: Host Number of Compl.. (0x03|0x0035) plen 5  #73 [hci1] 8.142719
        Num handles: 1
        Handle: 345 Address: DF:A9:FF:F6:B1:1A (OUI DF-A9-FF)
        Count: 1
< ACL Data TX: Handle 345 flags 0x00 dlen 21                #74 [hci1] 8.142865
      SMP: Pairing Confirm (0x03) len 16
        Confim value: 4a1071569a1bd28d7b4e7c7b1714f14a
> HCI Event: Number of Completed Packets (0x13) plen 5      #75 [hci1] 8.300144
        Num handles: 1
        Handle: 345 Address: DF:A9:FF:F6:B1:1A (OUI DF-A9-FF)
        Count: 1
        #74: len 21 (1 Kb/s)
        Latency: 157 msec (72-171 msec ~142 msec)
> ACL Data RX: Handle 345 flags 0x02 dlen 21                #76 [hci1] 8.300476
      SMP: Pairing Random (0x04) len 16
        Random value: 0b1fda8f18aa7cd20000000000000000
< HCI Command: Host Number of Compl.. (0x03|0x0035) plen 5  #77 [hci1] 8.303098
        Num handles: 1
        Handle: 345 Address: DF:A9:FF:F6:B1:1A (OUI DF-A9-FF)
        Count: 1
< ACL Data TX: Handle 345 flags 0x00 dlen 21                #78 [hci1] 8.303239
      SMP: Pairing Random (0x04) len 16
        Random value: 8e6108f966a694cbe26df70bb96773e6
> HCI Event: Number of Completed Packets (0x13) plen 5      #79 [hci1] 8.474924
        Num handles: 1
        Handle: 345 Address: DF:A9:FF:F6:B1:1A (OUI DF-A9-FF)
        Count: 1
        #78: len 21 (0 Kb/s)
        Latency: 171 msec (72-171 msec ~157 msec)
> ACL Data RX: Handle 345 flags 0x02 dlen 21                #80 [hci1] 8.562847
      SMP: Pairing Confirm (0x03) len 16
        Confim value: 2aa605e401437862df9ed0fab1cadc33
< HCI Command: Host Number of Compl.. (0x03|0x0035) plen 5  #81 [hci1] 8.582962
        Num handles: 1
        Handle: 345 Address: DF:A9:FF:F6:B1:1A (OUI DF-A9-FF)
        Count: 1
< ACL Data TX: Handle 345 flags 0x00 dlen 21                #82 [hci1] 8.583161
      SMP: Pairing Confirm (0x03) len 16
        Confim value: abeaddbe68cd0974e817c3624f643209
> HCI Event: Number of Completed Packets (0x13) plen 5      #83 [hci1] 8.737631
        Num handles: 1
        Handle: 345 Address: DF:A9:FF:F6:B1:1A (OUI DF-A9-FF)
        Count: 1
        #82: len 21 (1 Kb/s)
        Latency: 154 msec (72-171 msec ~155 msec)
> ACL Data RX: Handle 345 flags 0x02 dlen 21                #84 [hci1] 8.737973
      SMP: Pairing Random (0x04) len 16
        Random value: 64c6534da574991d0000000000000000
< HCI Command: Host Number of Compl.. (0x03|0x0035) plen 5  #85 [hci1] 8.743074
        Num handles: 1
        Handle: 345 Address: DF:A9:FF:F6:B1:1A (OUI DF-A9-FF)
        Count: 1
< ACL Data TX: Handle 345 flags 0x00 dlen 21                #86 [hci1] 8.743200
      SMP: Pairing Random (0x04) len 16
        Random value: 4d02679f89a05211af56d8b3da64d21e
> HCI Event: Number of Completed Packets (0x13) plen 5      #87 [hci1] 8.912312
        Num handles: 1
        Handle: 345 Address: DF:A9:FF:F6:B1:1A (OUI DF-A9-FF)
        Count: 1
        #86: len 21 (0 Kb/s)
        Latency: 169 msec (72-171 msec ~162 msec)
> ACL Data RX: Handle 345 flags 0x02 dlen 21                #88 [hci1] 9.000350
      SMP: Pairing Confirm (0x03) len 16
        Confim value: 3f203e539ac905c738c4506d7d3485c5
< HCI Command: Host Number of Compl.. (0x03|0x0035) plen 5  #89 [hci1] 9.002748
        Num handles: 1
        Handle: 345 Address: DF:A9:FF:F6:B1:1A (OUI DF-A9-FF)
        Count: 1
< ACL Data TX: Handle 345 flags 0x00 dlen 21                #90 [hci1] 9.002868
      SMP: Pairing Confirm (0x03) len 16
        Confim value: d8a6a3a3f228fb613db2950040d8f7bd
> HCI Event: Number of Completed Packets (0x13) plen 5      #91 [hci1] 9.175029
        Num handles: 1
        Handle: 345 Address: DF:A9:FF:F6:B1:1A (OUI DF-A9-FF)
        Count: 1
        #90: len 21 (0 Kb/s)
        Latency: 172 msec (72-172 msec ~167 msec)
> ACL Data RX: Handle 345 flags 0x02 dlen 21                #92 [hci1] 9.175455
      SMP: Pairing Random (0x04) len 16
        Random value: a3b0188f95de7d5d0000000000000000
< HCI Command: Host Number of Compl.. (0x03|0x0035) plen 5  #93 [hci1] 9.183201
        Num handles: 1
        Handle: 345 Address: DF:A9:FF:F6:B1:1A (OUI DF-A9-FF)
        Count: 1
< ACL Data TX: Handle 345 flags 0x00 dlen 21                #94 [hci1] 9.183312
      SMP: Pairing Random (0x04) len 16
        Random value: 5e8286bc235a02440d0c3424a2acf8fd
> HCI Event: Number of Completed Packets (0x13) plen 5      #95 [hci1] 9.349888
        Num handles: 1
        Handle: 345 Address: DF:A9:FF:F6:B1:1A (OUI DF-A9-FF)
        Count: 1
        #94: len 21 (1 Kb/s)
        Latency: 166 msec (72-172 msec ~166 msec)
> ACL Data RX: Handle 345 flags 0x02 dlen 21                #96 [hci1] 9.437739
      SMP: Pairing Confirm (0x03) len 16
        Confim value: 62e82a7b027991e4d26e3f96e5bd986c
< HCI Command: Host Number of Compl.. (0x03|0x0035) plen 5  #97 [hci1] 9.442980
        Num handles: 1
        Handle: 345 Address: DF:A9:FF:F6:B1:1A (OUI DF-A9-FF)
        Count: 1
< ACL Data TX: Handle 345 flags 0x00 dlen 21                #98 [hci1] 9.443223
      SMP: Pairing Confirm (0x03) len 16
        Confim value: 90d792d803c9112d117bcc6ed96b13a8
> HCI Event: Number of Completed Packets (0x13) plen 5      #99 [hci1] 9.612636
        Num handles: 1
        Handle: 345 Address: DF:A9:FF:F6:B1:1A (OUI DF-A9-FF)
        Count: 1
        #98: len 21 (0 Kb/s)
        Latency: 169 msec (72-172 msec ~168 msec)
> ACL Data RX: Handle 345 flags 0x02 dlen 21               #100 [hci1] 9.612897
      SMP: Pairing Random (0x04) len 16
        Random value: 7c7d29925328e3640000000000000000
< HCI Command: Host Number of Comp.. (0x03|0x0035) plen 5  #101 [hci1] 9.623260
        Num handles: 1
        Handle: 345 Address: DF:A9:FF:F6:B1:1A (OUI DF-A9-FF)
        Count: 1
< ACL Data TX: Handle 345 flags 0x00 dlen 21               #102 [hci1] 9.623407
      SMP: Pairing Random (0x04) len 16
        Random value: 5c4a1bcadd27bd58e945097b00bad7ac
> HCI Event: Number of Completed Packets (0x13) plen 5     #103 [hci1] 9.787385
        Num handles: 1
        Handle: 345 Address: DF:A9:FF:F6:B1:1A (OUI DF-A9-FF)
        Count: 1
        #102: len 21 (1 Kb/s)
        Latency: 163 msec (72-172 msec ~166 msec)
> ACL Data RX: Handle 345 flags 0x02 dlen 21               #104 [hci1] 9.875160
      SMP: Pairing Confirm (0x03) len 16
        Confim value: 2e8ef4b8ae3312c0dc166a47cfb233c6
< HCI Command: Host Number of Comp.. (0x03|0x0035) plen 5  #105 [hci1] 9.883014
        Num handles: 1
        Handle: 345 Address: DF:A9:FF:F6:B1:1A (OUI DF-A9-FF)
        Count: 1
< ACL Data TX: Handle 345 flags 0x00 dlen 21               #106 [hci1] 9.883284
      SMP: Pairing Confirm (0x03) len 16
        Confim value: 67b7df0152ee7fac14c62fa8310aaff1
> HCI Event: Number of Completed Packets (0x13) plen 5    #107 [hci1] 10.050023
        Num handles: 1
        Handle: 345 Address: DF:A9:FF:F6:B1:1A (OUI DF-A9-FF)
        Count: 1
        #106: len 21 (1 Kb/s)
        Latency: 166 msec (72-172 msec ~166 msec)
> ACL Data RX: Handle 345 flags 0x02 dlen 21              #108 [hci1] 10.050400
      SMP: Pairing Random (0x04) len 16
        Random value: 3ceb4c7e287c76e20000000000000000
< HCI Command: Host Number of Com.. (0x03|0x0035) plen 5  #109 [hci1] 10.062988
        Num handles: 1
        Handle: 345 Address: DF:A9:FF:F6:B1:1A (OUI DF-A9-FF)
        Count: 1
< ACL Data TX: Handle 345 flags 0x00 dlen 21              #110 [hci1] 10.063062
      SMP: Pairing Random (0x04) len 16
        Random value: 32527e6e64e79f33b2e374394db8ab2d
> HCI Event: Number of Completed Packets (0x13) plen 5    #111 [hci1] 10.224772
        Num handles: 1
        Handle: 345 Address: DF:A9:FF:F6:B1:1A (OUI DF-A9-FF)
        Count: 1
        #110: len 21 (1 Kb/s)
        Latency: 161 msec (72-172 msec ~164 msec)
> ACL Data RX: Handle 345 flags 0x02 dlen 21              #112 [hci1] 10.312690
      SMP: Pairing Confirm (0x03) len 16
        Confim value: 38bae1e987aa146fa2ebe0be2be8b713
< HCI Command: Host Number of Com.. (0x03|0x0035) plen 5  #113 [hci1] 10.322977
        Num handles: 1
        Handle: 345 Address: DF:A9:FF:F6:B1:1A (OUI DF-A9-FF)
        Count: 1
< ACL Data TX: Handle 345 flags 0x00 dlen 21              #114 [hci1] 10.323162
      SMP: Pairing Confirm (0x03) len 16
        Confim value: 5fefee142a0b03f9eb6872037ad32d4a
> HCI Event: Number of Completed Packets (0x13) plen 5    #115 [hci1] 10.487506
        Num handles: 1
        Handle: 345 Address: DF:A9:FF:F6:B1:1A (OUI DF-A9-FF)
        Count: 1
        #114: len 21 (1 Kb/s)
        Latency: 164 msec (72-172 msec ~164 msec)
> ACL Data RX: Handle 345 flags 0x02 dlen 21              #116 [hci1] 10.487860
      SMP: Pairing Random (0x04) len 16
        Random value: 276b8c00749bd0ed0000000000000000
< HCI Command: Host Number of Com.. (0x03|0x0035) plen 5  #117 [hci1] 10.503107
        Num handles: 1
        Handle: 345 Address: DF:A9:FF:F6:B1:1A (OUI DF-A9-FF)
        Count: 1
< ACL Data TX: Handle 345 flags 0x00 dlen 21              #118 [hci1] 10.503156
      SMP: Pairing Random (0x04) len 16
        Random value: dddbdfe2838e9a8cc6964353c850fef7
> HCI Event: Number of Completed Packets (0x13) plen 5    #119 [hci1] 10.662298
        Num handles: 1
        Handle: 345 Address: DF:A9:FF:F6:B1:1A (OUI DF-A9-FF)
        Count: 1
        #118: len 21 (1 Kb/s)
        Latency: 159 msec (72-172 msec ~161 msec)
> ACL Data RX: Handle 345 flags 0x02 dlen 21              #120 [hci1] 10.750164
      SMP: Pairing Confirm (0x03) len 16
        Confim value: 251153fd18315458ff4e0e16eb209ee9
< HCI Command: Host Number of Com.. (0x03|0x0035) plen 5  #121 [hci1] 10.762959
        Num handles: 1
        Handle: 345 Address: DF:A9:FF:F6:B1:1A (OUI DF-A9-FF)
        Count: 1
< ACL Data TX: Handle 345 flags 0x00 dlen 21              #122 [hci1] 10.763136
      SMP: Pairing Confirm (0x03) len 16
        Confim value: e6881ad3aa8759e3c0eab92468b2684f
> HCI Event: Number of Completed Packets (0x13) plen 5    #123 [hci1] 10.925052
        Num handles: 1
        Handle: 345 Address: DF:A9:FF:F6:B1:1A (OUI DF-A9-FF)
        Count: 1
        #122: len 21 (1 Kb/s)
        Latency: 161 msec (72-172 msec ~161 msec)
> ACL Data RX: Handle 345 flags 0x02 dlen 21              #124 [hci1] 10.925373
      SMP: Pairing Random (0x04) len 16
        Random value: 50ea77a4150044dd0000000000000000
< HCI Command: Host Number of Com.. (0x03|0x0035) plen 5  #125 [hci1] 10.943154
        Num handles: 1
        Handle: 345 Address: DF:A9:FF:F6:B1:1A (OUI DF-A9-FF)
        Count: 1
< ACL Data TX: Handle 345 flags 0x00 dlen 21              #126 [hci1] 10.943252
      SMP: Pairing Random (0x04) len 16
        Random value: eb9f1915536596b6fc3db1c86b2b1970
> HCI Event: Number of Completed Packets (0x13) plen 5    #127 [hci1] 11.099868
        Num handles: 1
        Handle: 345 Address: DF:A9:FF:F6:B1:1A (OUI DF-A9-FF)
        Count: 1
        #126: len 21 (1 Kb/s)
        Latency: 156 msec (72-172 msec ~159 msec)
> ACL Data RX: Handle 345 flags 0x02 dlen 21              #128 [hci1] 11.187772
      SMP: Pairing Confirm (0x03) len 16
        Confim value: 4b54a69518f0d0eb1465a525084dac96
< HCI Command: Host Number of Com.. (0x03|0x0035) plen 5  #129 [hci1] 11.202927
        Num handles: 1
        Handle: 345 Address: DF:A9:FF:F6:B1:1A (OUI DF-A9-FF)
        Count: 1
< ACL Data TX: Handle 345 flags 0x00 dlen 21              #130 [hci1] 11.203146
      SMP: Pairing Confirm (0x03) len 16
        Confim value: 34eee1b9509a22ef5517897c581cd6eb
> HCI Event: Number of Completed Packets (0x13) plen 5    #131 [hci1] 11.362496
        Num handles: 1
        Handle: 345 Address: DF:A9:FF:F6:B1:1A (OUI DF-A9-FF)
        Count: 1
        #130: len 21 (1 Kb/s)
        Latency: 159 msec (72-172 msec ~159 msec)
> ACL Data RX: Handle 345 flags 0x02 dlen 21              #132 [hci1] 11.362782
      SMP: Pairing Random (0x04) len 16
        Random value: 3f605903e3716db90000000000000000
< HCI Command: Host Number of Com.. (0x03|0x0035) plen 5  #133 [hci1] 11.383224
        Num handles: 1
        Handle: 345 Address: DF:A9:FF:F6:B1:1A (OUI DF-A9-FF)
        Count: 1
< ACL Data TX: Handle 345 flags 0x00 dlen 21              #134 [hci1] 11.383357
      SMP: Pairing Random (0x04) len 16
        Random value: 5c794dc9ad9f2c3f295ebd5ad5e1c3cf
> HCI Event: Number of Completed Packets (0x13) plen 5    #135 [hci1] 11.537270
        Num handles: 1
        Handle: 345 Address: DF:A9:FF:F6:B1:1A (OUI DF-A9-FF)
        Count: 1
        #134: len 21 (1 Kb/s)
        Latency: 153 msec (72-172 msec ~156 msec)
> ACL Data RX: Handle 345 flags 0x02 dlen 21              #136 [hci1] 11.625093
      SMP: Pairing Confirm (0x03) len 16
        Confim value: 6dbc4fce364614687a1c261580810ad3
< HCI Command: Host Number of Com.. (0x03|0x0035) plen 5  #137 [hci1] 11.642638
        Num handles: 1
        Handle: 345 Address: DF:A9:FF:F6:B1:1A (OUI DF-A9-FF)
        Count: 1
< ACL Data TX: Handle 345 flags 0x00 dlen 21              #138 [hci1] 11.642789
      SMP: Pairing Confirm (0x03) len 16
        Confim value: 4f840112e6ef4fc4ed8ebb6655ec3659
> HCI Event: Number of Completed Packets (0x13) plen 5    #139 [hci1] 11.799959
        Num handles: 1
        Handle: 345 Address: DF:A9:FF:F6:B1:1A (OUI DF-A9-FF)
        Count: 1
        #138: len 21 (1 Kb/s)
        Latency: 157 msec (72-172 msec ~156 msec)
> ACL Data RX: Handle 345 flags 0x02 dlen 21              #140 [hci1] 11.800304
      SMP: Pairing Random (0x04) len 16
        Random value: e402be36a9b012250000000000000000
< HCI Command: Host Number of Com.. (0x03|0x0035) plen 5  #141 [hci1] 11.803234
        Num handles: 1
        Handle: 345 Address: DF:A9:FF:F6:B1:1A (OUI DF-A9-FF)
        Count: 1
< ACL Data TX: Handle 345 flags 0x00 dlen 21              #142 [hci1] 11.803332
      SMP: Pairing Random (0x04) len 16
        Random value: 5c2fff312cdf99c9491988e877355a9a
> HCI Event: Number of Completed Packets (0x13) plen 5    #143 [hci1] 11.974759
        Num handles: 1
        Handle: 345 Address: DF:A9:FF:F6:B1:1A (OUI DF-A9-FF)
        Count: 1
        #142: len 21 (0 Kb/s)
        Latency: 171 msec (72-172 msec ~164 msec)
> ACL Data RX: Handle 345 flags 0x02 dlen 21              #144 [hci1] 12.062666
      SMP: Pairing Confirm (0x03) len 16
        Confim value: cb9cca63bd0b3744d6e151135dc0c6da
< HCI Command: Host Number of Com.. (0x03|0x0035) plen 5  #145 [hci1] 12.082966
        Num handles: 1
        Handle: 345 Address: DF:A9:FF:F6:B1:1A (OUI DF-A9-FF)
        Count: 1
< ACL Data TX: Handle 345 flags 0x00 dlen 21              #146 [hci1] 12.083139
      SMP: Pairing Confirm (0x03) len 16
        Confim value: 239a44a9556b2f871fb82a57663ce20a
> HCI Event: Number of Completed Packets (0x13) plen 5    #147 [hci1] 12.237506
        Num handles: 1
        Handle: 345 Address: DF:A9:FF:F6:B1:1A (OUI DF-A9-FF)
        Count: 1
        #146: len 21 (1 Kb/s)
        Latency: 154 msec (72-172 msec ~159 msec)
> ACL Data RX: Handle 345 flags 0x02 dlen 21              #148 [hci1] 12.237818
      SMP: Pairing Random (0x04) len 16
        Random value: 191ed2cf229637d60000000000000000
< HCI Command: Host Number of Com.. (0x03|0x0035) plen 5  #149 [hci1] 12.243202
        Num handles: 1
        Handle: 345 Address: DF:A9:FF:F6:B1:1A (OUI DF-A9-FF)
        Count: 1
< ACL Data TX: Handle 345 flags 0x00 dlen 21              #150 [hci1] 12.243292
      SMP: Pairing Random (0x04) len 16
        Random value: c629a3a987d808e808655d558dfc1155
> HCI Event: Number of Completed Packets (0x13) plen 5    #151 [hci1] 12.412242
        Num handles: 1
        Handle: 345 Address: DF:A9:FF:F6:B1:1A (OUI DF-A9-FF)
        Count: 1
        #150: len 21 (1 Kb/s)
        Latency: 168 msec (72-172 msec ~164 msec)
> ACL Data RX: Handle 345 flags 0x02 dlen 21              #152 [hci1] 12.500105
      SMP: Pairing Confirm (0x03) len 16
        Confim value: 4793325504f00a06597872a2982031bf
< HCI Command: Host Number of Com.. (0x03|0x0035) plen 5  #153 [hci1] 12.502849
        Num handles: 1
        Handle: 345 Address: DF:A9:FF:F6:B1:1A (OUI DF-A9-FF)
        Count: 1
< ACL Data TX: Handle 345 flags 0x00 dlen 21              #154 [hci1] 12.503061
      SMP: Pairing Confirm (0x03) len 16
        Confim value: 30832278a452d5d0577ebba6a0453b8d
> HCI Event: Number of Completed Packets (0x13) plen 5    #155 [hci1] 12.674956
        Num handles: 1
        Handle: 345 Address: DF:A9:FF:F6:B1:1A (OUI DF-A9-FF)
        Count: 1
        #154: len 21 (0 Kb/s)
        Latency: 171 msec (72-172 msec ~168 msec)
> ACL Data RX: Handle 345 flags 0x02 dlen 21              #156 [hci1] 12.675297
      SMP: Pairing Random (0x04) len 16
        Random value: 6810eeb8650432570000000000000000
< HCI Command: Host Number of Com.. (0x03|0x0035) plen 5  #157 [hci1] 12.683267
        Num handles: 1
        Handle: 345 Address: DF:A9:FF:F6:B1:1A (OUI DF-A9-FF)
        Count: 1
< ACL Data TX: Handle 345 flags 0x00 dlen 21              #158 [hci1] 12.683447
      SMP: Pairing Random (0x04) len 16
        Random value: 92f20f6ad8f13724432c7fd6001c45ff
> HCI Event: Number of Completed Packets (0x13) plen 5    #159 [hci1] 12.849718
        Num handles: 1
        Handle: 345 Address: DF:A9:FF:F6:B1:1A (OUI DF-A9-FF)
        Count: 1
        #158: len 21 (1 Kb/s)
        Latency: 166 msec (72-172 msec ~167 msec)
> ACL Data RX: Handle 345 flags 0x02 dlen 21              #160 [hci1] 12.937614
      SMP: Pairing Confirm (0x03) len 16
        Confim value: 3d784b7b43108313cff170a169a7ac37
< HCI Command: Host Number of Com.. (0x03|0x0035) plen 5  #161 [hci1] 12.942968
        Num handles: 1
        Handle: 345 Address: DF:A9:FF:F6:B1:1A (OUI DF-A9-FF)
        Count: 1
< ACL Data TX: Handle 345 flags 0x00 dlen 21              #162 [hci1] 12.943262
      SMP: Pairing Confirm (0x03) len 16
        Confim value: 06aa3bd81e338e25707e8ffcd9efe43c
> HCI Event: Number of Completed Packets (0x13) plen 5    #163 [hci1] 13.112413
        Num handles: 1
        Handle: 345 Address: DF:A9:FF:F6:B1:1A (OUI DF-A9-FF)
        Count: 1
        #162: len 21 (0 Kb/s)
        Latency: 169 msec (72-172 msec ~168 msec)
> ACL Data RX: Handle 345 flags 0x02 dlen 21              #164 [hci1] 13.112819
      SMP: Pairing Random (0x04) len 16
        Random value: dd75653731cd125f0000000000000000
< HCI Command: Host Number of Com.. (0x03|0x0035) plen 5  #165 [hci1] 13.122927
        Num handles: 1
        Handle: 345 Address: DF:A9:FF:F6:B1:1A (OUI DF-A9-FF)
        Count: 1
< ACL Data TX: Handle 345 flags 0x00 dlen 21              #166 [hci1] 13.122983
      SMP: Pairing Random (0x04) len 16
        Random value: 23ac32ebbb5e14c8a6b9622f296d277f
> HCI Event: Number of Completed Packets (0x13) plen 5    #167 [hci1] 13.287225
        Num handles: 1
        Handle: 345 Address: DF:A9:FF:F6:B1:1A (OUI DF-A9-FF)
        Count: 1
        #166: len 21 (1 Kb/s)
        Latency: 164 msec (72-172 msec ~166 msec)
> ACL Data RX: Handle 345 flags 0x02 dlen 21              #168 [hci1] 13.375128
      SMP: Pairing Confirm (0x03) len 16
        Confim value: 6645933a6fc412f986e91764115dc830
< HCI Command: Host Number of Com.. (0x03|0x0035) plen 5  #169 [hci1] 13.382945
        Num handles: 1
        Handle: 345 Address: DF:A9:FF:F6:B1:1A (OUI DF-A9-FF)
        Count: 1
< ACL Data TX: Handle 345 flags 0x00 dlen 21              #170 [hci1] 13.383191
      SMP: Pairing Confirm (0x03) len 16
        Confim value: 413c148f977638e6e5be6d9b5dca0ae4
> HCI Event: Number of Completed Packets (0x13) plen 5    #171 [hci1] 13.549926
        Num handles: 1
        Handle: 345 Address: DF:A9:FF:F6:B1:1A (OUI DF-A9-FF)
        Count: 1
        #170: len 21 (1 Kb/s)
        Latency: 166 msec (72-172 msec ~166 msec)
> ACL Data RX: Handle 345 flags 0x02 dlen 21              #172 [hci1] 13.550224
      SMP: Pairing Random (0x04) len 16
        Random value: 2e3ac4dcc5bd360e0000000000000000
< HCI Command: Host Number of Com.. (0x03|0x0035) plen 5  #173 [hci1] 13.563234
        Num handles: 1
        Handle: 345 Address: DF:A9:FF:F6:B1:1A (OUI DF-A9-FF)
        Count: 1
< ACL Data TX: Handle 345 flags 0x00 dlen 21              #174 [hci1] 13.563320
      SMP: Pairing Random (0x04) len 16
        Random value: 297efe85e67448a15f56bd27e3a3cf1d
> HCI Event: Number of Completed Packets (0x13) plen 5    #175 [hci1] 13.724756
        Num handles: 1
        Handle: 345 Address: DF:A9:FF:F6:B1:1A (OUI DF-A9-FF)
        Count: 1
        #174: len 21 (1 Kb/s)
        Latency: 161 msec (72-172 msec ~163 msec)
> ACL Data RX: Handle 345 flags 0x02 dlen 21              #176 [hci1] 13.812517
      SMP: Pairing Confirm (0x03) len 16
        Confim value: 5a3d65c59a557c88bc8ebe3800d62ce9
< HCI Command: Host Number of Com.. (0x03|0x0035) plen 5  #177 [hci1] 13.822822
        Num handles: 1
        Handle: 345 Address: DF:A9:FF:F6:B1:1A (OUI DF-A9-FF)
        Count: 1
< ACL Data TX: Handle 345 flags 0x00 dlen 21              #178 [hci1] 13.823095
      SMP: Pairing Confirm (0x03) len 16
        Confim value: bffd79b8aade4b91eaf946d2f082aeb8
> HCI Event: Number of Completed Packets (0x13) plen 5    #179 [hci1] 13.987452
        Num handles: 1
        Handle: 345 Address: DF:A9:FF:F6:B1:1A (OUI DF-A9-FF)
        Count: 1
        #178: len 21 (1 Kb/s)
        Latency: 164 msec (72-172 msec ~164 msec)
> ACL Data RX: Handle 345 flags 0x02 dlen 21              #180 [hci1] 13.987710
      SMP: Pairing Random (0x04) len 16
        Random value: 95f77eabb56954120000000000000000
< HCI Command: Host Number of Com.. (0x03|0x0035) plen 5  #181 [hci1] 14.003268
        Num handles: 1
        Handle: 345 Address: DF:A9:FF:F6:B1:1A (OUI DF-A9-FF)
        Count: 1
< ACL Data TX: Handle 345 flags 0x00 dlen 21              #182 [hci1] 14.003380
      SMP: Pairing Random (0x04) len 16
        Random value: 25a9493fd3ce4faf02be7293595bb7c6
> HCI Event: Number of Completed Packets (0x13) plen 5    #183 [hci1] 14.162233
        Num handles: 1
        Handle: 345 Address: DF:A9:FF:F6:B1:1A (OUI DF-A9-FF)
        Count: 1
        #182: len 21 (1 Kb/s)
        Latency: 158 msec (72-172 msec ~161 msec)
> ACL Data RX: Handle 345 flags 0x02 dlen 21              #184 [hci1] 14.250123
      SMP: Pairing Confirm (0x03) len 16
        Confim value: 09c7b0f7768a4a44f100a302cd75ae70
< HCI Command: Host Number of Com.. (0x03|0x0035) plen 5  #185 [hci1] 14.262986
        Num handles: 1
        Handle: 345 Address: DF:A9:FF:F6:B1:1A (OUI DF-A9-FF)
        Count: 1
< ACL Data TX: Handle 345 flags 0x00 dlen 21              #186 [hci1] 14.263204
      SMP: Pairing Confirm (0x03) len 16
        Confim value: efab80eb08bbc5c6fcd8645d6ca3725c
> HCI Event: Number of Completed Packets (0x13) plen 5    #187 [hci1] 14.424922
        Num handles: 1
        Handle: 345 Address: DF:A9:FF:F6:B1:1A (OUI DF-A9-FF)
        Count: 1
        #186: len 21 (1 Kb/s)
        Latency: 161 msec (72-172 msec ~161 msec)
> ACL Data RX: Handle 345 flags 0x02 dlen 21              #188 [hci1] 14.425300
      SMP: Pairing Random (0x04) len 16
        Random value: fb75a11f1dca59e80000000000000000
< HCI Command: Host Number of Com.. (0x03|0x0035) plen 5  #189 [hci1] 14.443199
        Num handles: 1
        Handle: 345 Address: DF:A9:FF:F6:B1:1A (OUI DF-A9-FF)
        Count: 1
< ACL Data TX: Handle 345 flags 0x00 dlen 21              #190 [hci1] 14.443346
      SMP: Pairing Random (0x04) len 16
        Random value: 58f6b41f855a6f6c3560debd84e2affc
> HCI Event: Number of Completed Packets (0x13) plen 5    #191 [hci1] 14.599687
        Num handles: 1
        Handle: 345 Address: DF:A9:FF:F6:B1:1A (OUI DF-A9-FF)
        Count: 1
        #190: len 21 (1 Kb/s)
        Latency: 156 msec (72-172 msec ~158 msec)
> ACL Data RX: Handle 345 flags 0x02 dlen 21              #192 [hci1] 14.687552
      SMP: Pairing Confirm (0x03) len 16
        Confim value: 93576860012d45dbf3e8382873cfb088
< HCI Command: Host Number of Com.. (0x03|0x0035) plen 5  #193 [hci1] 14.702968
        Num handles: 1
        Handle: 345 Address: DF:A9:FF:F6:B1:1A (OUI DF-A9-FF)
        Count: 1
< ACL Data TX: Handle 345 flags 0x00 dlen 21              #194 [hci1] 14.703275
      SMP: Pairing Confirm (0x03) len 16
        Confim value: 610af49e5809b078c082e1a3ab0f5c15
> HCI Event: Number of Completed Packets (0x13) plen 5    #195 [hci1] 14.862367
        Num handles: 1
        Handle: 345 Address: DF:A9:FF:F6:B1:1A (OUI DF-A9-FF)
        Count: 1
        #194: len 21 (1 Kb/s)
        Latency: 159 msec (72-172 msec ~159 msec)
> ACL Data RX: Handle 345 flags 0x02 dlen 21              #196 [hci1] 14.862698
      SMP: Pairing Random (0x04) len 16
        Random value: 7e3d855b3e9e2a2f0000000000000000
< HCI Command: Host Number of Com.. (0x03|0x0035) plen 5  #197 [hci1] 14.883210
        Num handles: 1
        Handle: 345 Address: DF:A9:FF:F6:B1:1A (OUI DF-A9-FF)
        Count: 1
< ACL Data TX: Handle 345 flags 0x00 dlen 21              #198 [hci1] 14.883417
      SMP: Pairing Random (0x04) len 16
        Random value: b67e7216d5bf664139eda2b542549666
> HCI Event: Number of Completed Packets (0x13) plen 5    #199 [hci1] 15.037176
        Num handles: 1
        Handle: 345 Address: DF:A9:FF:F6:B1:1A (OUI DF-A9-FF)
        Count: 1
        #198: len 21 (1 Kb/s)
        Latency: 153 msec (72-172 msec ~156 msec)
> ACL Data RX: Handle 345 flags 0x02 dlen 21              #200 [hci1] 15.125096
      SMP: Pairing Confirm (0x03) len 16
        Confim value: df1e9b6215f23a4a010bf472a626b987
< HCI Command: Host Number of Com.. (0x03|0x0035) plen 5  #201 [hci1] 15.143033
        Num handles: 1
        Handle: 345 Address: DF:A9:FF:F6:B1:1A (OUI DF-A9-FF)
        Count: 1
< ACL Data TX: Handle 345 flags 0x00 dlen 21              #202 [hci1] 15.143328
      SMP: Pairing Confirm (0x03) len 16
        Confim value: 81e424d0ceb11357c3e59366800da485
> HCI Event: Number of Completed Packets (0x13) plen 5    #203 [hci1] 15.299929
        Num handles: 1
        Handle: 345 Address: DF:A9:FF:F6:B1:1A (OUI DF-A9-FF)
        Count: 1
        #202: len 21 (1 Kb/s)
        Latency: 156 msec (72-172 msec ~156 msec)
> ACL Data RX: Handle 345 flags 0x02 dlen 21              #204 [hci1] 15.300204
      SMP: Pairing Random (0x04) len 16
        Random value: 02b13de46bffec110000000000000000
< HCI Command: Host Number of Com.. (0x03|0x0035) plen 5  #205 [hci1] 15.303256
        Num handles: 1
        Handle: 345 Address: DF:A9:FF:F6:B1:1A (OUI DF-A9-FF)
        Count: 1
< ACL Data TX: Handle 345 flags 0x00 dlen 21              #206 [hci1] 15.303392
      SMP: Pairing Random (0x04) len 16
        Random value: ed17f76500c95219dd01e09d1e63f87b
> HCI Event: Number of Completed Packets (0x13) plen 5    #207 [hci1] 15.474631
        Num handles: 1
        Handle: 345 Address: DF:A9:FF:F6:B1:1A (OUI DF-A9-FF)
        Count: 1
        #206: len 21 (0 Kb/s)
        Latency: 171 msec (72-172 msec ~163 msec)
> ACL Data RX: Handle 345 flags 0x02 dlen 21              #208 [hci1] 15.562507
      SMP: Pairing Confirm (0x03) len 16
        Confim value: 7badce670591366c0deb19fc9e8ea5f3
< HCI Command: Host Number of Com.. (0x03|0x0035) plen 5  #209 [hci1] 15.583064
        Num handles: 1
        Handle: 345 Address: DF:A9:FF:F6:B1:1A (OUI DF-A9-FF)
        Count: 1
< ACL Data TX: Handle 345 flags 0x00 dlen 21              #210 [hci1] 15.583320
      SMP: Pairing Confirm (0x03) len 16
        Confim value: 9a77c0a90d420215d9300fa286a04183
> HCI Event: Number of Completed Packets (0x13) plen 5    #211 [hci1] 15.737337
        Num handles: 1
        Handle: 345 Address: DF:A9:FF:F6:B1:1A (OUI DF-A9-FF)
        Count: 1
        #210: len 21 (1 Kb/s)
        Latency: 154 msec (72-172 msec ~158 msec)
> ACL Data RX: Handle 345 flags 0x02 dlen 21              #212 [hci1] 15.737787
      SMP: Pairing Random (0x04) len 16
        Random value: 687672441ffb824f0000000000000000
< HCI Command: Host Number of Com.. (0x03|0x0035) plen 5  #213 [hci1] 15.743363
        Num handles: 1
        Handle: 345 Address: DF:A9:FF:F6:B1:1A (OUI DF-A9-FF)
        Count: 1
< ACL Data TX: Handle 345 flags 0x00 dlen 21              #214 [hci1] 15.743462
      SMP: Pairing Random (0x04) len 16
        Random value: 81d35d47e1f6006d79c974bd9d9e1ee3
> HCI Event: Number of Completed Packets (0x13) plen 5    #215 [hci1] 15.912240
        Num handles: 1
        Handle: 345 Address: DF:A9:FF:F6:B1:1A (OUI DF-A9-FF)
        Count: 1
        #214: len 21 (1 Kb/s)
        Latency: 168 msec (72-172 msec ~163 msec)
> ACL Data RX: Handle 345 flags 0x02 dlen 21              #216 [hci1] 15.999968
      SMP: Pairing Confirm (0x03) len 16
        Confim value: c39ceb1e953a9f5a7121ed4c52caa53f
< HCI Command: Host Number of Com.. (0x03|0x0035) plen 5  #217 [hci1] 16.002702
        Num handles: 1
        Handle: 345 Address: DF:A9:FF:F6:B1:1A (OUI DF-A9-FF)
        Count: 1
< ACL Data TX: Handle 345 flags 0x00 dlen 21              #218 [hci1] 16.002831
      SMP: Pairing Confirm (0x03) len 16
        Confim value: 06b6af426bf3644270aac408d10f947f
> HCI Event: Number of Completed Packets (0x13) plen 5    #219 [hci1] 16.174798
        Num handles: 1
        Handle: 345 Address: DF:A9:FF:F6:B1:1A (OUI DF-A9-FF)
        Count: 1
        #218: len 21 (0 Kb/s)
        Latency: 171 msec (72-172 msec ~167 msec)
> ACL Data RX: Handle 345 flags 0x02 dlen 21              #220 [hci1] 16.175127
      SMP: Pairing Random (0x04) len 16
        Random value: 4112ade7573cd1620000000000000000
< HCI Command: Host Number of Com.. (0x03|0x0035) plen 5  #221 [hci1] 16.183248
        Num handles: 1
        Handle: 345 Address: DF:A9:FF:F6:B1:1A (OUI DF-A9-FF)
        Count: 1
< ACL Data TX: Handle 345 flags 0x00 dlen 21              #222 [hci1] 16.183333
      SMP: Pairing Random (0x04) len 16
        Random value: e7f7e0c2476823e41736a7e381bafb7c
> HCI Event: Number of Completed Packets (0x13) plen 5    #223 [hci1] 16.349559
        Num handles: 1
        Handle: 345 Address: DF:A9:FF:F6:B1:1A (OUI DF-A9-FF)
        Count: 1
        #222: len 21 (1 Kb/s)
        Latency: 166 msec (72-172 msec ~167 msec)
> ACL Data RX: Handle 345 flags 0x02 dlen 21              #224 [hci1] 16.437438
      SMP: Pairing Confirm (0x03) len 16
        Confim value: f19ca0a38d9d514cdb5d2d6731ca34b9
< HCI Command: Host Number of Com.. (0x03|0x0035) plen 5  #225 [hci1] 16.443048
        Num handles: 1
        Handle: 345 Address: DF:A9:FF:F6:B1:1A (OUI DF-A9-FF)
        Count: 1
< ACL Data TX: Handle 345 flags 0x00 dlen 21              #226 [hci1] 16.443275
      SMP: Pairing Confirm (0x03) len 16
        Confim value: 486b93ccfa056fa506086460a8af1933
> HCI Event: Number of Completed Packets (0x13) plen 5    #227 [hci1] 16.612349
        Num handles: 1
        Handle: 345 Address: DF:A9:FF:F6:B1:1A (OUI DF-A9-FF)
        Count: 1
        #226: len 21 (0 Kb/s)
        Latency: 169 msec (72-172 msec ~168 msec)
> ACL Data RX: Handle 345 flags 0x02 dlen 21              #228 [hci1] 16.612727
      SMP: Pairing Random (0x04) len 16
        Random value: 96eff837b93223080000000000000000
< HCI Command: Host Number of Com.. (0x03|0x0035) plen 5  #229 [hci1] 16.623305
        Num handles: 1
        Handle: 345 Address: DF:A9:FF:F6:B1:1A (OUI DF-A9-FF)
        Count: 1
