Bluetooth monitor ver 5.84
btmon[1707942]: = Note: Linux version 6.8.0-83-generic (x86_64)                                                          0.381459
btmon[1707942]: = Note: Bluetooth subsystem version 2.22                                                                 0.381460
= New Index: 00:00:00:00:00:00 (Primary,UART,hci0)                                                                       0.381461
= Open Index: 00:00:00:00:00:00                                                                                          0.885808
= Index Info: 00:00:00:00:00:00 (Nordic Semiconductor ASA)                                                               0.885974
zephyr.exe[1707944]: @ USER Open: main (privileged) version 2.22                                                {0x0001} 0.886018
zephyr.exe[1707944]: < HCI Command: Reset (0x03|0x0003) plen 0                                                        #1 0.886698
> HCI Event: Command Complete (0x0e) plen 4                                                                           #2 0.887468
      Reset (0x03|0x0003) ncmd 1
        Status: Success (0x00)
zephyr.exe[1707944]: < HCI Command: Read Local Supported Features (0x04|0x0003) plen 0                                #3 0.905813
> HCI Event: Command Complete (0x0e) plen 12                                                                          #4 0.906654
      Read Local Supported Features (0x04|0x0003) ncmd 1
        Status: Success (0x00)
        Features: 0x00 0x00 0x00 0x00 0x60 0x00 0x00 0x00
          BR/EDR Not Supported
          LE Supported (Controller)
zephyr.exe[1707944]: < HCI Command: Read Local Version Information (0x04|0x0001) plen 0                               #5 0.925802
> HCI Event: Command Complete (0x0e) plen 12                                                                          #6 0.926782
      Read Local Version Information (0x04|0x0001) ncmd 1
        Status: Success (0x00)
        HCI version: Reserved (0x0e) - Revision 12520 (0x30e8)
        LMP version: Reserved (0x0e) - Subversion 12520 (0x30e8)
        Manufacturer: Nordic Semiconductor ASA (89)
zephyr.exe[1707944]: < HCI Command: Read Local Supported Commands (0x04|0x0002) plen 0                                #7 0.945801
> HCI Event: Command Complete (0x0e) plen 68                                                                          #8 0.947065
      Read Local Supported Commands (0x04|0x0002) ncmd 1
        Status: Success (0x00)
        Commands: 119 entries
          Disconnect (Octet 0 - Bit 5)
          Read Remote Version Information (Octet 2 - Bit 7)
          Set Event Mask (Octet 5 - Bit 6)
          Reset (Octet 5 - Bit 7)
          Read Connection Accept Timeout (Octet 7 - Bit 2)
          Write Connection Accept Timeout (Octet 7 - Bit 3)
          Read Transmit Power Level (Octet 10 - Bit 2)
          Set Controller To Host Flow Control (Octet 10 - Bit 5)
          Host Buffer Size (Octet 10 - Bit 6)
          Host Number of Completed Packets (Octet 10 - Bit 7)
          Read Local Version Information (Octet 14 - Bit 3)
          Read Local Supported Features (Octet 14 - Bit 5)
          Read BD ADDR (Octet 15 - Bit 1)
          Read RSSI (Octet 15 - Bit 5)
          Set Event Mask Page 2 (Octet 22 - Bit 2)
          LE Set Event Mask (Octet 25 - Bit 0)
          LE Read Buffer Size (Octet 25 - Bit 1)
          LE Read Local Supported Features (Octet 25 - Bit 2)
          LE Set Random Address (Octet 25 - Bit 4)
          LE Set Advertising Parameters (Octet 25 - Bit 5)
          LE Read Advertising Channel TX Power (Octet 25 - Bit 6)
          LE Set Advertising Data (Octet 25 - Bit 7)
          LE Set Scan Response Data (Octet 26 - Bit 0)
          LE Set Advertise Enable (Octet 26 - Bit 1)
          LE Set Scan Parameters (Octet 26 - Bit 2)
          LE Set Scan Enable (Octet 26 - Bit 3)
          LE Create Connection (Octet 26 - Bit 4)
          LE Create Connection Cancel (Octet 26 - Bit 5)
          LE Read Accept List Size (Octet 26 - Bit 6)
          LE Clear Accept List (Octet 26 - Bit 7)
          LE Add Device To Accept List (Octet 27 - Bit 0)
          LE Remove Device From Accept List (Octet 27 - Bit 1)
          LE Connection Update (Octet 27 - Bit 2)
          LE Set Host Channel Classification (Octet 27 - Bit 3)
          LE Read Channel Map (Octet 27 - Bit 4)
          LE Read Remote Used Features (Octet 27 - Bit 5)
          LE Encrypt (Octet 27 - Bit 6)
          LE Rand (Octet 27 - Bit 7)
          LE Start Encryption (Octet 28 - Bit 0)
          LE Long Term Key Request Reply (Octet 28 - Bit 1)
          LE Long Term Key Request Neg Reply (Octet 28 - Bit 2)
          LE Read Supported States (Octet 28 - Bit 3)
          LE Receiver Test (Octet 28 - Bit 4)
          LE Transmitter Test (Octet 28 - Bit 5)
          LE Test End (Octet 28 - Bit 6)
          Read Authenticated Payload Timeout (Octet 32 - Bit 4)
          Write Authenticated Payload Timeout (Octet 32 - Bit 5)
          LE Set Data Length (Octet 33 - Bit 6)
          LE Read Suggested Default Data Length (Octet 33 - Bit 7)
          LE Write Suggested Default Data Length (Octet 34 - Bit 0)
          LE Add Device To Resolving List (Octet 34 - Bit 3)
          LE Remove Device From Resolving List (Octet 34 - Bit 4)
          LE Clear Resolving List (Octet 34 - Bit 5)
          LE Read Resolving List Size (Octet 34 - Bit 6)
          LE Set Address Resolution Enable (Octet 35 - Bit 1)
          LE Set Resolvable Private Address Timeout (Octet 35 - Bit 2)
          LE Read Maximum Data Length (Octet 35 - Bit 3)
          LE Read PHY (Octet 35 - Bit 4)
          LE Set Default PHY (Octet 35 - Bit 5)
          LE Set PHY (Octet 35 - Bit 6)
          LE Enhanced Receiver Test (Octet 35 - Bit 7)
          LE Enhanced Transmitter Test (Octet 36 - Bit 0)
          LE Set Advertising Set Random Address (Octet 36 - Bit 1)
          LE Set Extended Advertising Parameters (Octet 36 - Bit 2)
          LE Set Extended Advertising Data (Octet 36 - Bit 3)
          LE Set Extended Scan Response Data (Octet 36 - Bit 4)
          LE Set Extended Advertising Enable (Octet 36 - Bit 5)
          LE Read Maximum Advertising Data Length (Octet 36 - Bit 6)
          LE Read Number of Supported Advertising Sets (Octet 36 - Bit 7)
          LE Remove Advertising Set (Octet 37 - Bit 0)
          LE Clear Advertising Sets (Octet 37 - Bit 1)
          LE Set Periodic Advertising Parameters (Octet 37 - Bit 2)
          LE Set Periodic Advertising Data (Octet 37 - Bit 3)
          LE Set Periodic Advertising Enable (Octet 37 - Bit 4)
          LE Set Extended Scan Parameters (Octet 37 - Bit 5)
          LE Set Extended Scan Enable (Octet 37 - Bit 6)
          LE Extended Create Connection (Octet 37 - Bit 7)
          LE Periodic Advertising Create Sync (Octet 38 - Bit 0)
          LE Periodic Advertising Create Sync Cancel (Octet 38 - Bit 1)
          LE Periodic Advertising Terminate Sync (Octet 38 - Bit 2)
          LE Add Device To Periodic Advertiser List (Octet 38 - Bit 3)
          LE Remove Device From Periodic Advertiser List (Octet 38 - Bit 4)
          LE Clear Periodic Advertiser List (Octet 38 - Bit 5)
          LE Read Periodic Advertiser List Size (Octet 38 - Bit 6)
          LE Read Transmit Power (Octet 38 - Bit 7)
          LE Read RF Path Compensation (Octet 39 - Bit 0)
          LE Write RF Path Compensation (Octet 39 - Bit 1)
          LE Set Privacy Mode (Octet 39 - Bit 2)
          LE Periodic Advertising Receive Enable (Octet 40 - Bit 5)
          LE Periodic Advertising Sync Transfer (Octet 40 - Bit 6)
          LE Periodic Advertising Set Info Transfer (Octet 40 - Bit 7)
          LE Periodic Advertising Sync Transfer Parameters (Octet 41 - Bit 0)
          LE Set Default Periodic Advertisng Sync Transfer Parameters (Octet 41 - Bit 1)
          LE Read Buffer v2 (Octet 41 - Bit 5)
          LE Read ISO TX Sync (Octet 41 - Bit 6)
          LE Set Connected Isochronous Group Parameters (Octet 41 - Bit 7)
          LE Set Connected Isochronous Group Parameters Test (Octet 42 - Bit 0)
          LE Create Connected Isochronous Stream (Octet 42 - Bit 1)
          LE Remove Connected Isochronous Group (Octet 42 - Bit 2)
          LE Accept Connected Isochronous Stream Request (Octet 42 - Bit 3)
          LE Reject Connected Isochronous Stream Request (Octet 42 - Bit 4)
          LE Create Broadcast Isochronous Group (Octet 42 - Bit 5)
          LE Create Broadcast Isochronous Group Test (Octet 42 - Bit 6)
          LE Terminate Broadcast Isochronous Group (Octet 42 - Bit 7)
          LE Broadcast Isochronous Group Create Sync (Octet 43 - Bit 0)
          LE Broadcast Isochronous Group Terminate Sync (Octet 43 - Bit 1)
          LE Request Peer SCA (Octet 43 - Bit 2)
          LE Setup Isochronous Data Path (Octet 43 - Bit 3)
          LE Remove Isochronous Data Path (Octet 43 - Bit 4)
          LE Isochronous Transmit Test (Octet 43 - Bit 5)
          LE Isochronous Receive Test (Octet 43 - Bit 6)
          LE Isochronous Read Test Counters (Octet 43 - Bit 7)
          LE Isochronous Read Test Counters (Octet 44 - Bit 0)
          LE Set Host Feature (Octet 44 - Bit 1)
          LE Read ISO link quality (Octet 44 - Bit 2)
          Octet 45 - Bit 6 
          Octet 46 - Bit 0 
          Octet 46 - Bit 1 
          Octet 46 - Bit 2 
zephyr.exe[1707944]: < HCI Command: Host Buffer Size (0x03|0x0033) plen 7                                             #9 0.965806
        ACL MTU: 255  ACL max packet: 16
        SCO MTU: 0    SCO max packet: 0
> HCI Event: Command Complete (0x0e) plen 4                                                                          #10 0.966553
      Host Buffer Size (0x03|0x0033) ncmd 1
        Status: Success (0x00)
zephyr.exe[1707944]: < HCI Command: Set Controller To Host Flow Control (0x03|0x0031) plen 1                         #11 0.985798
        Flow control: ACL Data Packets (0x01)
> HCI Event: Command Complete (0x0e) plen 4                                                                          #12 0.986361
      Set Controller To Host Flow Control (0x03|0x0031) ncmd 1
        Status: Success (0x00)
zephyr.exe[1707944]: < HCI Command: LE Read Local Supported Features (0x08|0x0003) plen 0                            #13 1.005810
> HCI Event: Command Complete (0x0e) plen 12                                                                         #14 1.006650
      LE Read Local Supported Features (0x08|0x0003) ncmd 1
        Status: Success (0x00)
        Features: 0xfd 0x79 0x00 0xf7 0x30 0x01 0x00 0x00
          LE Encryption
          Extended Reject Indication
          Peripheral-initiated Features Exchange
          LE Ping
          LE Data Packet Length Extension
          LL Privacy
          Extended Scanner Filter Policies
          LE 2M PHY
          LE Coded PHY
          LE Extended Advertising
          LE Periodic Advertising
          Channel Selection Algorithm #2
          Periodic Advertising Sync Transfer - Sender
          Periodic Advertising Sync Transfer - Recipient
          Sleep Clock Accuracy Updates
          Connected Isochronous Stream - Central
          Connected Isochronous Stream - Peripheral
          Isochronous Broadcaster
          Synchronized Receiver
          Periodic Advertising ADI support
          Connection Subrating
          Unknown features (0x0000010000000000)
zephyr.exe[1707944]: < HCI Command: LE Set Host Feature (0x08|0x0074) plen 2                                         #15 1.025804
        Bit Number: 32
          Connected Isochronous Stream (Host Support)
        Bit Value: 1
> HCI Event: Command Complete (0x0e) plen 4                                                                          #16 1.026426
      LE Set Host Feature (0x08|0x0074) ncmd 1
        Status: Success (0x00)
zephyr.exe[1707944]: < HCI Command: LE Read Buffer v2 (0x08|0x0060) plen 0                                           #17 1.045804
> HCI Event: Command Complete (0x0e) plen 10                                                                         #18 1.046453
      LE Read Buffer v2 (0x08|0x0060) ncmd 1
        Status: Success (0x00)
        ACL MTU: 27
        ACL max packet: 3
        ISO MTU: 318
        ISO max packet: 3
zephyr.exe[1707944]: < HCI Command: LE Read Maximum Advertising Data Length (0x08|0x003a) plen 0                     #19 1.065828
> HCI Event: Command Complete (0x0e) plen 6                                                                          #20 1.066515
      LE Read Maximum Advertising Data Length (0x08|0x003a) ncmd 1
        Status: Success (0x00)
        Max length: 1650
zephyr.exe[1707944]: < HCI Command: LE Read Supported States (0x08|0x001c) plen 0                                    #21 1.085757
> HCI Event: Command Complete (0x0e) plen 12                                                                         #22 1.086646
      LE Read Supported States (0x08|0x001c) ncmd 1
        Status: Success (0x00)
        States: 0x000003ff3e0306ff
          Non-connectable Advertising State
          Scannable Advertising State
          Connectable Advertising State
          High Duty Cycle Directed Advertising State
          Passive Scanning State
          Active Scanning State
          Initiating State
            and Connection State (Central Role)
          Connection State (Peripheral Role)
          Scannable Advertising State
            and Passive Scanning State
          Connectable Advertising State
            and Passive Scanning State
          Non-connectable Advertising State
            and Initiating State
          Scannable Advertising State
            and Initiating State
          Active Scanning State
            and Connection State (Central Role)
          Passive Scanning State
            and Connection State (Peripheral Role)
          Active Scanning State
            and Connection State (Peripheral Role)
          Initiating State
            and Connection State (Central Role)
            and Central Role & Central Role
          Low Duty Cycle Directed Advertising State
          Connectable Advertising State
            and Initiating State
            and Central Role & Peripheral Role
          High Duty Cycle Directed Advertising State
            and Initiating State
            and Central Role & Peripheral Role
          Low Duty Cycle Directed Advertising State
            and Initiating State
            and Central Role & Peripheral Role
          Connectable Advertising State
            and Connection State (Central Role)
            and Central Role & Peripheral Role
          High Duty Cycle Directed Advertising State
            and Connection State (Central Role)
            and Central Role & Peripheral Role
          Low Duty Cycle Directed Advertising State
            and Connection State (Central Role)
            and Central Role & Peripheral Role
          Connectable Advertising State
            and Connection State (Peripheral Role)
            and Central Role & Peripheral Role
          High Duty Cycle Directed Advertising State
            and Connection State (Peripheral Role)
            and Peripheral Role & Peripheral Role
          Low Duty Cycle Directed Advertising State
            and Connection State (Peripheral Role)
            and Peripheral Role & Peripheral Role
          Initiating State
            and Connection State (Peripheral Role)
            and Central Role & Peripheral Role
zephyr.exe[1707944]: < HCI Command: LE Read Maximum Data Length (0x08|0x002f) plen 0                                 #23 1.105807
> HCI Event: Command Complete (0x0e) plen 12                                                                         #24 1.106762
      LE Read Maximum Data Length (0x08|0x002f) ncmd 1
        Status: Success (0x00)
        Max TX octets: 251
        Max TX time: 2704
        Max RX octets: 251
        Max RX time: 2704
zephyr.exe[1707944]: < HCI Command: LE Write Suggested Default Data Length (0x08|0x0024) plen 4                      #25 1.125811
        TX octets: 251
        TX time: 2704
> HCI Event: Command Complete (0x0e) plen 4                                                                          #26 1.126574
      LE Write Suggested Default Data Length (0x08|0x0024) ncmd 1
        Status: Success (0x00)
zephyr.exe[1707944]: < HCI Command: LE Read Resolving List Size (0x08|0x002a) plen 0                                 #27 1.145811
> HCI Event: Command Complete (0x0e) plen 5                                                                          #28 1.146427
      LE Read Resolving List Size (0x08|0x002a) ncmd 1
        Status: Success (0x00)
        Size: 8
zephyr.exe[1707944]: < HCI Command: LE Set Event Mask (0x08|0x0001) plen 8                                           #29 1.165805
        Mask: 0x000002023f87fa5e
          LE Advertising Report
          LE Connection Update Complete
          LE Read Remote Used Features Complete
          LE Long Term Key Request
          LE Data Length Change
          LE Enhanced Connection Complete
          LE PHY Update Complete
          LE Extended Advertising Report
          LE Periodic Advertising Sync Established
          LE Periodic Advertising Report
          LE Periodic Advertising Sync Lost
          LE Extended Scan Timeout
          LE Extended Advertising Set Terminated
          LE Scan Request Received
          LE Periodic Advertising Sync Transfer Rvc
          LE CIS Established
          LE CIS Request
          LE Create BIG Complete
          LE Terminate BIG Complete
          LE BIG Sync Established Complete
          LE BIG Sync Lost
          LE BIG Info Advertising Report
          Unknown mask (0x0000020000000000)
> HCI Event: Command Complete (0x0e) plen 4                                                                          #30 1.167410
      LE Set Event Mask (0x08|0x0001) ncmd 1
        Status: Success (0x00)
zephyr.exe[1707944]: < HCI Command: Set Event Mask (0x03|0x0001) plen 8                                              #31 1.185812
        Mask: 0x2000800002008890
          Disconnection Complete
          Encryption Change
          Read Remote Version Information Complete
          Hardware Error
          Data Buffer Overflow
          Encryption Key Refresh Complete
          LE Meta
> HCI Event: Command Complete (0x0e) plen 4                                                                          #32 1.186959
      Set Event Mask (0x03|0x0001) ncmd 1
        Status: Success (0x00)
zephyr.exe[1707944]: < HCI Command: Read BD ADDR (0x04|0x0009) plen 0                                                #33 1.205809
> HCI Event: Command Complete (0x0e) plen 10                                                                         #34 1.207298
      Read BD ADDR (0x04|0x0009) ncmd 1
        Status: Success (0x00)
        Address: 00:00:00:00:00:00 (OUI 00-00-00)
zephyr.exe[1707944]: < HCI Command: LE Set Random Address (0x08|0x0005) plen 6                                       #35 1.225815
        Address: D5:B6:CC:31:DB:3B (Static)
> HCI Event: Command Complete (0x0e) plen 4                                                                          #36 1.226657
      LE Set Random Address (0x08|0x0005) ncmd 1
        Status: Success (0x00)
zephyr.exe[1707944]: < HCI Command: LE Extended Create Connection (0x08|0x0043) plen 26                              #37 4.895836
        Filter policy: Accept list is not used (0x00)
        Own address type: Random (0x01)
        Peer address type: Public (0x00)
        Peer address: C0:07:E8:2C:B6:EE (OUI C0-07-E8)
        Initiating PHYs: 0x01
        Entry 0: LE 1M
          Scan interval: 60.000 msec (0x0060)
          Scan window: 60.000 msec (0x0060)
          Min connection interval: 50.00 msec (0x0028)
          Max connection interval: 70.00 msec (0x0038)
          Connection latency: 0 (0x0000)
          Supervision timeout: 4000 msec (0x0190)
          Min connection length: 0.000 msec (0x0000)
          Max connection length: 0.000 msec (0x0000)
> HCI Event: Command Status (0x0f) plen 4                                                                            #38 4.897223
      LE Extended Create Connection (0x08|0x0043) ncmd 1
        Status: Success (0x00)
> HCI Event: LE Meta Event (0x3e) plen 31                                                                            #39 4.921801
      LE Enhanced Connection Complete (0x0a)
        Status: Success (0x00)
        Handle: 18
        Role: Central (0x00)
        Peer address type: Public (0x00)
        Peer address: C0:07:E8:2C:B6:EE (OUI C0-07-E8)
        Local resolvable private address: 00:00:00:00:00:00 (Non-Resolvable)
        Peer resolvable private address: 00:00:00:00:00:00 (Non-Resolvable)
        Connection interval: 70.00 msec (0x0038)
        Connection latency: 0 (0x0000)
        Supervision timeout: 4000 msec (0x0190)
        Central clock accuracy: 0x00
zephyr.exe[1707944]: < HCI Command: LE Read Remote Used Features (0x08|0x0016) plen 2                                #40 4.925930
        Handle: 18 Address: C0:07:E8:2C:B6:EE (OUI C0-07-E8)
> HCI Event: Command Status (0x0f) plen 4                                                                            #41 4.926668
      LE Read Remote Used Features (0x08|0x0016) ncmd 1
        Status: Success (0x00)
zephyr.exe[1707944]: < HCI Command: LE Set PHY (0x08|0x0032) plen 7                                                  #42 4.945808
        Handle: 18 Address: C0:07:E8:2C:B6:EE (OUI C0-07-E8)
        All PHYs preference: 0x00
        TX PHYs preference: 0x02
          LE 2M
        RX PHYs preference: 0x02
          LE 2M
        PHY options preference: Reserved (0x0000)
> HCI Event: Command Status (0x0f) plen 4                                                                            #43 4.946798
      LE Set PHY (0x08|0x0032) ncmd 1
        Status: Success (0x00)
zephyr.exe[1707944]: < ACL Data TX: Handle 18 [1/3] flags 0x00 dlen 7                                                #44 4.965811
      ATT: Exchange MTU Request (0x02) len 2
        Client RX MTU: 251
> HCI Event: Number of Completed Packets (0x13) plen 5                                                               #45 4.994084
        Num handles: 1
        Handle: 18 Address: C0:07:E8:2C:B6:EE (OUI C0-07-E8)
        Count: 1
        Buffers: 0/3
        #44: len 7 (2 Kb/s)
        Latency: 28 msec (28-28 msec ~28 msec)
> HCI Event: LE Meta Event (0x3e) plen 12                                                                            #46 5.134190
      LE Read Remote Used Features (0x04)
        Status: Success (0x00)
        Handle: 18 Address: C0:07:E8:2C:B6:EE (OUI C0-07-E8)
        Features: 0x2d 0x49 0x01 0xf7 0xef 0x39 0x00 0x80
          LE Encryption
          Extended Reject Indication
          Peripheral-initiated Features Exchange
          LE Data Packet Length Extension
          LE 2M PHY
          LE Coded PHY
          Channel Selection Algorithm #2
          Minimum Number of Used Channels Procedure
          Periodic Advertising Sync Transfer - Sender
          Periodic Advertising Sync Transfer - Recipient
          Sleep Clock Accuracy Updates
          Connected Isochronous Stream - Central
          Connected Isochronous Stream - Peripheral
          Isochronous Broadcaster
          Synchronized Receiver
          Connected Isochronous Stream (Host Support)
          LE Power Control Request
          LE Power Control Request
          LE Path Loss Monitoring
          Connection Subrating
          Connection Subrating (Host Support)
          Channel Classification
          Unknown features (0x8000390000000000)
> HCI Event: LE Meta Event (0x3e) plen 6                                                                             #47 5.763527
      LE PHY Update Complete (0x0c)
        Status: Success (0x00)
        Handle: 18 Address: C0:07:E8:2C:B6:EE (OUI C0-07-E8)
        TX PHY: LE 2M (0x02)
        RX PHY: LE 2M (0x02)
> ACL Data RX: Handle 18 flags 0x02 dlen 6                                                                           #48 5.973944
      SMP: Security Request (0x0b) len 1
        Authentication requirement: Bonding, No MITM, SC, No Keypresses (0x09)
> ACL Data RX: Handle 18 flags 0x02 dlen 7                                                                           #49 5.974366
      ATT: Exchange MTU Response (0x03) len 2
        Server RX MTU: 64
zephyr.exe[1707944]: < HCI Command: Host Number of Completed Packets (0x03|0x0035) plen 5                            #50 5.985900
        Num handles: 1
        Handle: 18 Address: C0:07:E8:2C:B6:EE (OUI C0-07-E8)
        Count: 1
zephyr.exe[1707944]: < ACL Data TX: Handle 18 [1/3] flags 0x00 dlen 11                                               #51 5.986025
      SMP: Pairing Request (0x01) len 6
        IO capability: NoInputNoOutput (0x03)
        OOB data: Authentication data not present (0x00)
        Authentication requirement: Bonding, No MITM, SC, No Keypresses (0x09)
        Max encryption key size: 16
        Initiator key distribution: EncKey Sign (0x05)
        Responder key distribution: EncKey IdKey Sign (0x07)
zephyr.exe[1707944]: < HCI Command: Host Number of Completed Packets (0x03|0x0035) plen 5                            #52 5.986042
        Num handles: 1
        Handle: 18 Address: C0:07:E8:2C:B6:EE (OUI C0-07-E8)
        Count: 1
> HCI Event: Number of Completed Packets (0x13) plen 5                                                               #53 6.043940
        Num handles: 1
        Handle: 18 Address: C0:07:E8:2C:B6:EE (OUI C0-07-E8)
        Count: 1
        Buffers: 0/3
        #51: len 11 (1 Kb/s)
        Latency: 57 msec (28-57 msec ~43 msec)
> ACL Data RX: Handle 18 flags 0x02 dlen 11                                                                          #54 6.113982
      SMP: Pairing Response (0x02) len 6
        IO capability: KeyboardDisplay (0x04)
        OOB data: Authentication data not present (0x00)
        Authentication requirement: Bonding, No MITM, SC, No Keypresses (0x09)
        Max encryption key size: 16
        Initiator key distribution: EncKey Sign (0x05)
        Responder key distribution: EncKey IdKey (0x03)
zephyr.exe[1707944]: < HCI Command: Host Number of Completed Packets (0x03|0x0035) plen 5                            #55 6.125904
        Num handles: 1
        Handle: 18 Address: C0:07:E8:2C:B6:EE (OUI C0-07-E8)
        Count: 1
zephyr.exe[1707944]: < ACL Data TX: Handle 18 [1/3] flags 0x00 dlen 27                                               #56 6.125994
zephyr.exe[1707944]: < ACL Data TX: Handle 18 flags 0x01 dlen 27                                                     #57 6.126011
zephyr.exe[1707944]: < ACL Data TX: Handle 18 flags 0x01 dlen 15                                                     #58 6.126026
      SMP: Pairing Public Key (0x0c) len 64
        X[32]: 98308440221e2d910f0e54b71e7ec652857aa9b5a0dc65028824cc19db1226e9
        Y[32]: 67a4816bcb62efb21701e31fdb27561a6217575fb007a8bbdabe7e28b6f68482
> HCI Event: Number of Completed Packets (0x13) plen 5                                                               #59 6.183915
        Num handles: 1
        Handle: 18 Address: C0:07:E8:2C:B6:EE (OUI C0-07-E8)
        Count: 1
        Buffers: 0/3
        #56: len 27 (3 Kb/s)
        Latency: 57 msec (28-57 msec ~50 msec)
> HCI Event: Number of Completed Packets (0x13) plen 5                                                               #60 6.184430
        Num handles: 1
        Handle: 18 Address: C0:07:E8:2C:B6:EE (OUI C0-07-E8)
        Count: 1
        Buffers: underflow/3
        #57: len 27 (3 Kb/s)
        Latency: 58 msec (28-58 msec ~54 msec)
> HCI Event: Number of Completed Packets (0x13) plen 5                                                               #61 6.184914
        Num handles: 1
        Handle: 18 Address: C0:07:E8:2C:B6:EE (OUI C0-07-E8)
        Count: 1
        Buffers: underflow/3
        #58: len 15 (2 Kb/s)
        Latency: 58 msec (28-58 msec ~56 msec)
> ACL Data RX: Handle 18 flags 0x02 dlen 27                                                                          #62 6.254251
> ACL Data RX: Handle 18 flags 0x01 dlen 27                                                                          #63 6.254654
> ACL Data RX: Handle 18 flags 0x01 dlen 15                                                                          #64 6.254937
      SMP: Pairing Public Key (0x0c) len 64
        X[32]: eb63664aacb9dcd3941fe66c9e451425623c509c3d71c2637a902d0ab9b9277e
        Y[32]: 37e6fad235608bd62df29ce487317308af16cf0f770ec1ae408b55baed828996
zephyr.exe[1707944]: < HCI Command: Host Number of Completed Packets (0x03|0x0035) plen 5                            #65 6.265996
        Num handles: 1
        Handle: 18 Address: C0:07:E8:2C:B6:EE (OUI C0-07-E8)
        Count: 1
zephyr.exe[1707944]: < HCI Command: Host Number of Completed Packets (0x03|0x0035) plen 5                            #66 6.266099
        Num handles: 1
        Handle: 18 Address: C0:07:E8:2C:B6:EE (OUI C0-07-E8)
        Count: 1
zephyr.exe[1707944]: < HCI Command: Host Number of Completed Packets (0x03|0x0035) plen 5                            #67 6.266114
        Num handles: 1
        Handle: 18 Address: C0:07:E8:2C:B6:EE (OUI C0-07-E8)
        Count: 1
> ACL Data RX: Handle 18 flags 0x02 dlen 21                                                                          #68 6.267256
      SMP: Pairing Confirm (0x03) len 16
        Confirm value[16]: 1ffa21154f9256d90cbd2375d2c4dfa7
zephyr.exe[1707944]: < HCI Command: Host Number of Completed Packets (0x03|0x0035) plen 5                            #69 6.285859
        Num handles: 1
        Handle: 18 Address: C0:07:E8:2C:B6:EE (OUI C0-07-E8)
        Count: 1
zephyr.exe[1707944]: < ACL Data TX: Handle 18 [1/3] flags 0x00 dlen 21                                               #70 6.286013
      SMP: Pairing Random (0x04) len 16
        Random value[16]: 8e6108f966a694cbe26df70bb96773e6
> HCI Event: Number of Completed Packets (0x13) plen 5                                                               #71 6.323943
        Num handles: 1
        Handle: 18 Address: C0:07:E8:2C:B6:EE (OUI C0-07-E8)
        Count: 1
        Buffers: 0/3
        #70: len 21 (4 Kb/s)
        Latency: 37 msec (28-58 msec ~47 msec)
> ACL Data RX: Handle 18 flags 0x02 dlen 21                                                                          #72 6.394156
      SMP: Pairing Random (0x04) len 16
        Random value[16]: a6ef5074515b59d90000000000000000
zephyr.exe[1707944]: < HCI Command: Host Number of Completed Packets (0x03|0x0035) plen 5                            #73 6.405915
        Num handles: 1
        Handle: 18 Address: C0:07:E8:2C:B6:EE (OUI C0-07-E8)
        Count: 1
zephyr.exe[1707944]: < ACL Data TX: Handle 18 [1/3] flags 0x00 dlen 21                                               #74 6.406396
      SMP: Pairing DHKey Check (0x0d) len 16
        E[16]: 2255eea93a82ead800d1191e3b2289eb
> HCI Event: Number of Completed Packets (0x13) plen 5                                                               #75 6.463918
        Num handles: 1
        Handle: 18 Address: C0:07:E8:2C:B6:EE (OUI C0-07-E8)
        Count: 1
        Buffers: 0/3
        #74: len 21 (2 Kb/s)
        Latency: 57 msec (28-58 msec ~52 msec)
> ACL Data RX: Handle 18 flags 0x02 dlen 21                                                                          #76 6.604161
      SMP: Pairing DHKey Check (0x0d) len 16
        E[16]: 02d701f1e13d957e3cd3ebef36a9ec53
zephyr.exe[1707944]: < HCI Command: LE Start Encryption (0x08|0x0019) plen 28                                        #77 6.605944
        Handle: 18 Address: C0:07:E8:2C:B6:EE (OUI C0-07-E8)
        Random number: 0x0000000000000000
        Encrypted diversifier: 0x0000
        Long term key[16]: 15e530e1ac275d44d2c06b27c36c6ed0
> HCI Event: Command Status (0x0f) plen 4                                                                            #78 6.607837
      LE Start Encryption (0x08|0x0019) ncmd 1
        Status: Success (0x00)
zephyr.exe[1707944]: < HCI Command: Host Number of Completed Packets (0x03|0x0035) plen 5                            #79 6.625826
        Num handles: 1
        Handle: 18 Address: C0:07:E8:2C:B6:EE (OUI C0-07-E8)
        Count: 1
> HCI Event: Encryption Change (0x08) plen 4                                                                         #80 7.023896
        Status: Success (0x00)
        Handle: 18 Address: C0:07:E8:2C:B6:EE (OUI C0-07-E8)
        Encryption: Enabled with AES-CCM (0x01)
> ACL Data RX: Handle 18 flags 0x02 dlen 21                                                                          #81 7.094150
      SMP: Identity Information (0x08) len 16
        Identity resolving key[16]: 3d626300799078261f97b8a710a623dc
zephyr.exe[1707944]: < HCI Command: Host Number of Completed Packets (0x03|0x0035) plen 5                            #82 7.105909
        Num handles: 1
        Handle: 18 Address: C0:07:E8:2C:B6:EE (OUI C0-07-E8)
        Count: 1
> ACL Data RX: Handle 18 flags 0x02 dlen 12                                                                          #83 7.163966
      SMP: Identity Address Information (0x09) len 7
        Address: C0:07:E8:2C:B6:EE (OUI C0-07-E8)
zephyr.exe[1707944]: < HCI Command: LE Add Device To Resolving List (0x08|0x0027) plen 39                            #84 7.165936
        Address type: Public (0x00)
        Address: C0:07:E8:2C:B6:EE (OUI C0-07-E8)
        Peer identity resolving key[16]: 3d626300799078261f97b8a710a623dc
        Local identity resolving key[16]: 00000000000000000000000000000000
> HCI Event: Command Complete (0x0e) plen 4                                                                          #85 7.167012
      LE Add Device To Resolving List (0x08|0x0027) ncmd 1
        Status: Success (0x00)
zephyr.exe[1707944]: < HCI Command: LE Set Privacy Mode (0x08|0x004e) plen 8                                         #86 7.185956
        Peer Identity address type: Public (0x00)
        Peer Identity address: C0:07:E8:2C:B6:EE (OUI C0-07-E8)
        Privacy Mode: Use Device Privacy (0x01)
> HCI Event: Command Complete (0x0e) plen 4                                                                          #87 7.186571
      LE Set Privacy Mode (0x08|0x004e) ncmd 1
        Status: Success (0x00)
zephyr.exe[1707944]: < HCI Command: LE Set Address Resolution Enable (0x08|0x002d) plen 1                            #88 7.205846
        Address resolution: Enabled (0x01)
> HCI Event: Command Complete (0x0e) plen 4                                                                          #89 7.206323
      LE Set Address Resolution Enable (0x08|0x002d) ncmd 1
        Status: Success (0x00)
zephyr.exe[1707944]: < HCI Command: Host Number of Completed Packets (0x03|0x0035) plen 5                            #90 7.225807
        Num handles: 1
        Handle: 18 Address: C0:07:E8:2C:B6:EE (OUI C0-07-E8)
        Count: 1
zephyr.exe[1707944]: < ACL Data TX: Handle 18 [1/3] flags 0x00 dlen 21                                               #91 7.225891
      SMP: Signing Information (0x0a) len 16
        Signature key[16]: 5da095555cc64d02679f89a05211af56
> HCI Event: Number of Completed Packets (0x13) plen 5                                                               #92 7.233982
        Num handles: 1
        Handle: 18 Address: C0:07:E8:2C:B6:EE (OUI C0-07-E8)
        Count: 1
        Buffers: 0/3
        #91: len 21 (21 Kb/s)
        Latency: 8 msec (8-58 msec ~30 msec)
zephyr.exe[1707944]: < ACL Data TX: Handle 18 [1/3] flags 0x00 dlen 11                                               #93 8.185947
      ATT: Read By Type Request (0x08) len 6
        Handle range: 0x0001-0xffff
        Attribute type: Characteristic (0x2803)
> HCI Event: Number of Completed Packets (0x13) plen 5                                                               #94 8.213886
        Num handles: 1
        Handle: 18 Address: C0:07:E8:2C:B6:EE (OUI C0-07-E8)
        Count: 1
        Buffers: 0/3
        #93: len 11 (3 Kb/s)
        Latency: 27 msec (8-58 msec ~29 msec)
> ACL Data RX: Handle 18 flags 0x02 dlen 27                                                                          #95 8.284153
> ACL Data RX: Handle 18 flags 0x01 dlen 27                                                                          #96 8.284638
> ACL Data RX: Handle 18 flags 0x01 dlen 8                                                                           #97 8.284945
      ATT: Read By Type Response (0x09) len 57
        Attribute data length: 7
        Attribute data list: 8 entries
        Handle: 0x0002
        Value[5]: 0a0300002a
            Properties: 0x0a
              Read (0x02)
              Write (0x08)
            Value Handle: 0x0003
            Value UUID: Device Name (0x2a00)
        Handle: 0x0004
        Value[5]: 0a0500012a
            Properties: 0x0a
              Read (0x02)
              Write (0x08)
            Value Handle: 0x0005
            Value UUID: Appearance (0x2a01)
        Handle: 0x0006
        Value[5]: 4e07000945
            Properties: 0x4e
              Read (0x02)
              Write Without Response (0x04)
              Write (0x08)
              Authorize (0x40)
              Extended Properties (0x80)
            Value Handle: 0x0007
            Value UUID: Unknown (0x4509)
        Handle: 0x0008
        Value[5]: 020900042a
            Properties: 0x02
              Read (0x02)
            Value Handle: 0x0009
            Value UUID: Peripheral Preferred Connection Parameters (0x2a04)
        Handle: 0x000a
        Value[5]: 320b00192a
            Properties: 0x32
              Read (0x02)
              Notify (0x10)
              Indicate (0x20)
            Value Handle: 0x000b
            Value UUID: Battery Level (0x2a19)
        Handle: 0x000e
        Value[5]: 020f00a62a
            Properties: 0x02
              Read (0x02)
            Value Handle: 0x000f
            Value UUID: Central Address Resolution (0x2aa6)
        Handle: 0x0041
        Value[5]: 204200052a
            Properties: 0x20
              Indicate (0x20)
            Value Handle: 0x0042
            Value UUID: Service Changed (0x2a05)
        Handle: 0x0044
        Value[5]: 0a4500292b
            Properties: 0x0a
              Read (0x02)
              Write (0x08)
            Value Handle: 0x0045
            Value UUID: Client Supported Features (0x2b29)
zephyr.exe[1707944]: < HCI Command: Host Number of Completed Packets (0x03|0x0035) plen 5                            #98 8.304418
        Num handles: 1
        Handle: 18 Address: C0:07:E8:2C:B6:EE (OUI C0-07-E8)
        Count: 1
zephyr.exe[1707944]: < HCI Command: Host Number of Completed Packets (0x03|0x0035) plen 5                            #99 8.304548
        Num handles: 1
        Handle: 18 Address: C0:07:E8:2C:B6:EE (OUI C0-07-E8)
        Count: 1
zephyr.exe[1707944]: < HCI Command: Host Number of Completed Packets (0x03|0x0035) plen 5                           #100 8.304575
        Num handles: 1
        Handle: 18 Address: C0:07:E8:2C:B6:EE (OUI C0-07-E8)
        Count: 1
zephyr.exe[1707944]: < ACL Data TX: Handle 18 [1/3] flags 0x00 dlen 11                                              #101 8.304590
      ATT: Read By Type Request (0x08) len 6
        Handle range: 0x0045-0xffff
        Attribute type: Characteristic (0x2803)
> HCI Event: Number of Completed Packets (0x13) plen 5                                                              #102 8.355084
        Num handles: 1
        Handle: 18 Address: C0:07:E8:2C:B6:EE (OUI C0-07-E8)
        Count: 1
        Buffers: 0/3
        #101: len 11 (1 Kb/s)
        Latency: 50 msec (8-58 msec ~39 msec)
> ACL Data RX: Handle 18 flags 0x02 dlen 27                                                                         #103 8.424082
> ACL Data RX: Handle 18 flags 0x01 dlen 27                                                                         #104 8.424648
> ACL Data RX: Handle 18 flags 0x01 dlen 8                                                                          #105 8.424931
      ATT: Read By Type Response (0x09) len 57
        Attribute data length: 7
        Attribute data list: 8 entries
        Handle: 0x0046
        Value[5]: 0247003a2b
            Properties: 0x02
              Read (0x02)
            Value Handle: 0x0047
            Value UUID: Server Supported Features (0x2b3a)
        Handle: 0x0081
        Value[5]: 0282000945
            Properties: 0x02
              Read (0x02)
            Value Handle: 0x0082
            Value UUID: Unknown (0x4509)
        Handle: 0x0083
        Value[5]: 028400232a
            Properties: 0x02
              Read (0x02)
            Value Handle: 0x0084
            Value UUID: System ID (0x2a23)
        Handle: 0x0085
        Value[5]: 028600242a
            Properties: 0x02
              Read (0x02)
            Value Handle: 0x0086
            Value UUID: Model Number String (0x2a24)
        Handle: 0x0087
        Value[5]: 028800252a
            Properties: 0x02
              Read (0x02)
            Value Handle: 0x0088
            Value UUID: Serial Number String (0x2a25)
        Handle: 0x0089
        Value[5]: 028a00262a
            Properties: 0x02
              Read (0x02)
            Value Handle: 0x008a
            Value UUID: Firmware Revision String (0x2a26)
        Handle: 0x008b
        Value[5]: 028c00272a
            Properties: 0x02
              Read (0x02)
            Value Handle: 0x008c
            Value UUID: Hardware Revision String (0x2a27)
        Handle: 0x008d
        Value[5]: 028e00282a
            Properties: 0x02
              Read (0x02)
            Value Handle: 0x008e
            Value UUID: Software Revision String (0x2a28)
zephyr.exe[1707944]: < HCI Command: Host Number of Completed Packets (0x03|0x0035) plen 5                           #106 8.431181
        Num handles: 1
        Handle: 18 Address: C0:07:E8:2C:B6:EE (OUI C0-07-E8)
        Count: 1
zephyr.exe[1707944]: < HCI Command: Host Number of Completed Packets (0x03|0x0035) plen 5                           #107 8.434082
        Num handles: 1
        Handle: 18 Address: C0:07:E8:2C:B6:EE (OUI C0-07-E8)
        Count: 1
zephyr.exe[1707944]: < HCI Command: Host Number of Completed Packets (0x03|0x0035) plen 5                           #108 8.434262
        Num handles: 1
        Handle: 18 Address: C0:07:E8:2C:B6:EE (OUI C0-07-E8)
        Count: 1
zephyr.exe[1707944]: < ACL Data TX: Handle 18 [1/3] flags 0x00 dlen 11                                              #109 8.434407
      ATT: Read By Type Request (0x08) len 6
        Handle range: 0x008e-0xffff
        Attribute type: Characteristic (0x2803)
> HCI Event: Number of Completed Packets (0x13) plen 5                                                              #110 8.498086
        Num handles: 1
        Handle: 18 Address: C0:07:E8:2C:B6:EE (OUI C0-07-E8)
        Count: 1
        Buffers: 0/3
        #109: len 11 (1 Kb/s)
        Latency: 63 msec (8-63 msec ~51 msec)
> ACL Data RX: Handle 18 flags 0x02 dlen 27                                                                         #111 8.564111
> ACL Data RX: Handle 18 flags 0x01 dlen 27                                                                         #112 8.564609
> ACL Data RX: Handle 18 flags 0x01 dlen 8                                                                          #113 8.564973
      ATT: Read By Type Response (0x09) len 57
        Attribute data length: 7
        Attribute data list: 8 entries
        Handle: 0x008f
        Value[5]: 029000292a
            Properties: 0x02
              Read (0x02)
            Value Handle: 0x0090
            Value UUID: Manufacturer Name String (0x2a29)
        Handle: 0x0091
        Value[5]: 0292002a2a
            Properties: 0x02
              Read (0x02)
            Value Handle: 0x0092
            Value UUID: IEEE 11073-20601 Regulatory Cert. Data List (0x2a2a)
        Handle: 0x0093
        Value[5]: 029400502a
            Properties: 0x02
              Read (0x02)
            Value Handle: 0x0094
            Value UUID: PnP ID (0x2a50)
        Handle: 0x0095
        Value[5]: 0296002234
            Properties: 0x02
              Read (0x02)
            Value Handle: 0x0096
            Value UUID: Unknown (0x3422)
        Handle: 0x0098
        Value[5]: 029900ff2b
            Properties: 0x02
              Read (0x02)
            Value Handle: 0x0099
            Value UUID: Unknown (0x2bff)
        Handle: 0x00d1
        Value[5]: 38d200db2b
            Properties: 0x38
              Write (0x08)
              Notify (0x10)
              Indicate (0x20)
            Value Handle: 0x00d2
            Value UUID: Hearing Aid Preset Control Point (0x2bdb)
        Handle: 0x00d4
        Value[5]: 12d500da2b
            Properties: 0x12
              Read (0x02)
              Notify (0x10)
            Value Handle: 0x00d5
            Value UUID: Hearing Aid Features (0x2bda)
        Handle: 0x00d7
        Value[5]: 12d800dc2b
            Properties: 0x12
              Read (0x02)
              Notify (0x10)
            Value Handle: 0x00d8
            Value UUID: Active Preset Index (0x2bdc)
zephyr.exe[1707944]: < HCI Command: Host Number of Completed Packets (0x03|0x0035) plen 5                           #114 8.565719
        Num handles: 1
        Handle: 18 Address: C0:07:E8:2C:B6:EE (OUI C0-07-E8)
        Count: 1
zephyr.exe[1707944]: < HCI Command: Host Number of Completed Packets (0x03|0x0035) plen 5                           #115 8.565799
        Num handles: 1
        Handle: 18 Address: C0:07:E8:2C:B6:EE (OUI C0-07-E8)
        Count: 1
zephyr.exe[1707944]: < HCI Command: Host Number of Completed Packets (0x03|0x0035) plen 5                           #116 8.565858
        Num handles: 1
        Handle: 18 Address: C0:07:E8:2C:B6:EE (OUI C0-07-E8)
        Count: 1
zephyr.exe[1707944]: < ACL Data TX: Handle 18 [1/3] flags 0x00 dlen 9                                               #117 8.565940
      ATT: Find Information Request (0x04) len 4
        Handle range: 0x00d5-0xffff
> HCI Event: Number of Completed Packets (0x13) plen 5                                                              #118 8.639246
        Num handles: 1
        Handle: 18 Address: C0:07:E8:2C:B6:EE (OUI C0-07-E8)
        Count: 1
        Buffers: 0/3
        #117: len 9 (0 Kb/s)
        Latency: 73 msec (8-73 msec ~62 msec)
> ACL Data RX: Handle 18 flags 0x02 dlen 27                                                                         #119 8.704179
> ACL Data RX: Handle 18 flags 0x01 dlen 27                                                                         #120 8.704604
> ACL Data RX: Handle 18 flags 0x01 dlen 12                                                                         #121 8.704960
      ATT: Find Information Response (0x05) len 61
        Format: UUID-16 (0x01)
        Handle: 0x00d5
        UUID: Hearing Aid Features (0x2bda)
        Handle: 0x00d6
        UUID: Client Characteristic Configuration (0x2902)
        Handle: 0x00d7
        UUID: Characteristic (0x2803)
        Handle: 0x00d8
        UUID: Active Preset Index (0x2bdc)
        Handle: 0x00d9
        UUID: Client Characteristic Configuration (0x2902)
        Handle: 0x0110
        UUID: Primary Service (0x2800)
        Handle: 0x0111
        UUID: Characteristic (0x2803)
        Handle: 0x0112
        UUID: Sink PAC (0x2bc9)
        Handle: 0x0113
        UUID: Client Characteristic Configuration (0x2902)
        Handle: 0x0114
        UUID: Characteristic (0x2803)
        Handle: 0x0115
        UUID: Sink Audio Locations (0x2bca)
        Handle: 0x0116
        UUID: Client Characteristic Configuration (0x2902)
        Handle: 0x0117
        UUID: Characteristic (0x2803)
        Handle: 0x0118
        UUID: Source PAC (0x2bcb)
        Handle: 0x0119
        UUID: Client Characteristic Configuration (0x2902)
zephyr.exe[1707944]: < HCI Command: Host Number of Completed Packets (0x03|0x0035) plen 5                           #122 8.707646
        Num handles: 1
        Handle: 18 Address: C0:07:E8:2C:B6:EE (OUI C0-07-E8)
        Count: 1
zephyr.exe[1707944]: < HCI Command: Host Number of Completed Packets (0x03|0x0035) plen 5                           #123 8.708806
        Num handles: 1
        Handle: 18 Address: C0:07:E8:2C:B6:EE (OUI C0-07-E8)
        Count: 1
zephyr.exe[1707944]: < HCI Command: Host Number of Completed Packets (0x03|0x0035) plen 5                           #124 8.709870
        Num handles: 1
        Handle: 18 Address: C0:07:E8:2C:B6:EE (OUI C0-07-E8)
        Count: 1
zephyr.exe[1707944]: < ACL Data TX: Handle 18 [1/3] flags 0x00 dlen 9                                               #125 8.711069
      ATT: Write Request (0x12) len 4
        Handle: 0x00d6
          Data[2]: 0100
> HCI Event: Number of Completed Packets (0x13) plen 5                                                              #126 8.773845
        Num handles: 1
        Handle: 18 Address: C0:07:E8:2C:B6:EE (OUI C0-07-E8)
        Count: 1
        Buffers: 0/3
        #125: len 9 (1 Kb/s)
        Latency: 62 msec (8-73 msec ~62 msec)
> ACL Data RX: Handle 18 flags 0x02 dlen 5                                                                          #127 8.843846
      ATT: Write Response (0x13) len 0
zephyr.exe[1707944]: < HCI Command: Host Number of Completed Packets (0x03|0x0035) plen 5                           #128 8.845987
        Num handles: 1
        Handle: 18 Address: C0:07:E8:2C:B6:EE (OUI C0-07-E8)
        Count: 1
zephyr.exe[1707944]: < ACL Data TX: Handle 18 [1/3] flags 0x00 dlen 7                                               #129 8.847546
      ATT: Read Request (0x0a) len 2
        Handle: 0x00d5
> HCI Event: Number of Completed Packets (0x13) plen 5                                                              #130 8.913852
        Num handles: 1
        Handle: 18 Address: C0:07:E8:2C:B6:EE (OUI C0-07-E8)
        Count: 1
        Buffers: 0/3
        #129: len 7 (0 Kb/s)
        Latency: 66 msec (8-73 msec ~64 msec)
> ACL Data RX: Handle 18 flags 0x02 dlen 6                                                                          #131 8.983868
      ATT: Read Response (0x0b) len 1
        Value[1]: 1f
zephyr.exe[1707944]: < HCI Command: Host Number of Completed Packets (0x03|0x0035) plen 5                           #132 8.986226
        Num handles: 1
        Handle: 18 Address: C0:07:E8:2C:B6:EE (OUI C0-07-E8)
        Count: 1
zephyr.exe[1707944]: < ACL Data TX: Handle 18 [1/3] flags 0x00 dlen 11                                              #133 8.989086
      ATT: Read By Type Request (0x08) len 6
        Handle range: 0x0001-0xffff
        Attribute type: Characteristic (0x2803)
> HCI Event: Number of Completed Packets (0x13) plen 5                                                              #134 9.053907
        Num handles: 1
        Handle: 18 Address: C0:07:E8:2C:B6:EE (OUI C0-07-E8)
        Count: 1
        Buffers: 0/3
        #133: len 11 (1 Kb/s)
        Latency: 64 msec (8-73 msec ~64 msec)
> ACL Data RX: Handle 18 flags 0x02 dlen 27                                                                         #135 9.124151
> ACL Data RX: Handle 18 flags 0x01 dlen 27                                                                         #136 9.124635
> ACL Data RX: Handle 18 flags 0x01 dlen 8                                                                          #137 9.124910
      ATT: Read By Type Response (0x09) len 57
        Attribute data length: 7
        Attribute data list: 8 entries
        Handle: 0x0002
        Value[5]: 0a0300002a
            Properties: 0x0a
              Read (0x02)
              Write (0x08)
            Value Handle: 0x0003
            Value UUID: Device Name (0x2a00)
        Handle: 0x0004
        Value[5]: 0a0500012a
            Properties: 0x0a
              Read (0x02)
              Write (0x08)
            Value Handle: 0x0005
            Value UUID: Appearance (0x2a01)
        Handle: 0x0006
        Value[5]: 4e07000945
            Properties: 0x4e
              Read (0x02)
              Write Without Response (0x04)
              Write (0x08)
              Authorize (0x40)
              Extended Properties (0x80)
            Value Handle: 0x0007
            Value UUID: Unknown (0x4509)
        Handle: 0x0008
        Value[5]: 020900042a
            Properties: 0x02
              Read (0x02)
            Value Handle: 0x0009
            Value UUID: Peripheral Preferred Connection Parameters (0x2a04)
        Handle: 0x000a
        Value[5]: 320b00192a
            Properties: 0x32
              Read (0x02)
              Notify (0x10)
              Indicate (0x20)
            Value Handle: 0x000b
            Value UUID: Battery Level (0x2a19)
        Handle: 0x000e
        Value[5]: 020f00a62a
            Properties: 0x02
              Read (0x02)
            Value Handle: 0x000f
            Value UUID: Central Address Resolution (0x2aa6)
        Handle: 0x0041
        Value[5]: 204200052a
            Properties: 0x20
              Indicate (0x20)
            Value Handle: 0x0042
            Value UUID: Service Changed (0x2a05)
        Handle: 0x0044
        Value[5]: 0a4500292b
            Properties: 0x0a
              Read (0x02)
              Write (0x08)
            Value Handle: 0x0045
            Value UUID: Client Supported Features (0x2b29)
zephyr.exe[1707944]: < HCI Command: Host Number of Completed Packets (0x03|0x0035) plen 5                           #138 9.134172
        Num handles: 1
        Handle: 18 Address: C0:07:E8:2C:B6:EE (OUI C0-07-E8)
        Count: 1
zephyr.exe[1707944]: < HCI Command: Host Number of Completed Packets (0x03|0x0035) plen 5                           #139 9.135207
        Num handles: 1
        Handle: 18 Address: C0:07:E8:2C:B6:EE (OUI C0-07-E8)
        Count: 1
zephyr.exe[1707944]: < HCI Command: Host Number of Completed Packets (0x03|0x0035) plen 5                           #140 9.136888
        Num handles: 1
        Handle: 18 Address: C0:07:E8:2C:B6:EE (OUI C0-07-E8)
        Count: 1
zephyr.exe[1707944]: < ACL Data TX: Handle 18 [1/3] flags 0x00 dlen 11                                              #141 9.138007
      ATT: Read By Type Request (0x08) len 6
        Handle range: 0x0045-0xffff
        Attribute type: Characteristic (0x2803)
> HCI Event: Number of Completed Packets (0x13) plen 5                                                              #142 9.196118
        Num handles: 1
        Handle: 18 Address: C0:07:E8:2C:B6:EE (OUI C0-07-E8)
        Count: 1
        Buffers: 0/3
        #141: len 11 (1 Kb/s)
        Latency: 58 msec (8-73 msec ~61 msec)
> ACL Data RX: Handle 18 flags 0x02 dlen 27                                                                         #143 9.264061
> ACL Data RX: Handle 18 flags 0x01 dlen 27                                                                         #144 9.264595
> ACL Data RX: Handle 18 flags 0x01 dlen 8                                                                          #145 9.264942
      ATT: Read By Type Response (0x09) len 57
        Attribute data length: 7
        Attribute data list: 8 entries
        Handle: 0x0046
        Value[5]: 0247003a2b
            Properties: 0x02
              Read (0x02)
            Value Handle: 0x0047
            Value UUID: Server Supported Features (0x2b3a)
        Handle: 0x0081
        Value[5]: 0282000945
            Properties: 0x02
              Read (0x02)
            Value Handle: 0x0082
            Value UUID: Unknown (0x4509)
        Handle: 0x0083
        Value[5]: 028400232a
            Properties: 0x02
              Read (0x02)
            Value Handle: 0x0084
            Value UUID: System ID (0x2a23)
        Handle: 0x0085
        Value[5]: 028600242a
            Properties: 0x02
              Read (0x02)
            Value Handle: 0x0086
            Value UUID: Model Number String (0x2a24)
        Handle: 0x0087
        Value[5]: 028800252a
            Properties: 0x02
              Read (0x02)
            Value Handle: 0x0088
            Value UUID: Serial Number String (0x2a25)
        Handle: 0x0089
        Value[5]: 028a00262a
            Properties: 0x02
              Read (0x02)
            Value Handle: 0x008a
            Value UUID: Firmware Revision String (0x2a26)
        Handle: 0x008b
        Value[5]: 028c00272a
            Properties: 0x02
              Read (0x02)
            Value Handle: 0x008c
            Value UUID: Hardware Revision String (0x2a27)
        Handle: 0x008d
        Value[5]: 028e00282a
            Properties: 0x02
              Read (0x02)
            Value Handle: 0x008e
            Value UUID: Software Revision String (0x2a28)
zephyr.exe[1707944]: < HCI Command: Host Number of Completed Packets (0x03|0x0035) plen 5                           #146 9.280080
        Num handles: 1
        Handle: 18 Address: C0:07:E8:2C:B6:EE (OUI C0-07-E8)
        Count: 1
zephyr.exe[1707944]: < HCI Command: Host Number of Completed Packets (0x03|0x0035) plen 5                           #147 9.280968
        Num handles: 1
        Handle: 18 Address: C0:07:E8:2C:B6:EE (OUI C0-07-E8)
        Count: 1
zephyr.exe[1707944]: < HCI Command: Host Number of Completed Packets (0x03|0x0035) plen 5                           #148 9.281898
        Num handles: 1
        Handle: 18 Address: C0:07:E8:2C:B6:EE (OUI C0-07-E8)
        Count: 1
zephyr.exe[1707944]: < ACL Data TX: Handle 18 [1/3] flags 0x00 dlen 11                                              #149 9.282581
      ATT: Read By Type Request (0x08) len 6
        Handle range: 0x008e-0xffff
        Attribute type: Characteristic (0x2803)
> HCI Event: Number of Completed Packets (0x13) plen 5                                                              #150 9.403825
        Num handles: 1
        Handle: 18 Address: C0:07:E8:2C:B6:EE (OUI C0-07-E8)
        Count: 1
        Buffers: 0/3
        #149: len 11 (0 Kb/s)
        Latency: 121 msec (8-121 msec ~91 msec)
> ACL Data RX: Handle 18 flags 0x02 dlen 27                                                                         #151 9.474161
> ACL Data RX: Handle 18 flags 0x01 dlen 27                                                                         #152 9.474627
> ACL Data RX: Handle 18 flags 0x01 dlen 8                                                                          #153 9.474909
      ATT: Read By Type Response (0x09) len 57
        Attribute data length: 7
        Attribute data list: 8 entries
        Handle: 0x008f
        Value[5]: 029000292a
            Properties: 0x02
              Read (0x02)
            Value Handle: 0x0090
            Value UUID: Manufacturer Name String (0x2a29)
        Handle: 0x0091
        Value[5]: 0292002a2a
            Properties: 0x02
              Read (0x02)
            Value Handle: 0x0092
            Value UUID: IEEE 11073-20601 Regulatory Cert. Data List (0x2a2a)
        Handle: 0x0093
        Value[5]: 029400502a
            Properties: 0x02
              Read (0x02)
            Value Handle: 0x0094
            Value UUID: PnP ID (0x2a50)
        Handle: 0x0095
        Value[5]: 0296002234
            Properties: 0x02
              Read (0x02)
            Value Handle: 0x0096
            Value UUID: Unknown (0x3422)
        Handle: 0x0098
        Value[5]: 029900ff2b
            Properties: 0x02
              Read (0x02)
            Value Handle: 0x0099
            Value UUID: Unknown (0x2bff)
        Handle: 0x00d1
        Value[5]: 38d200db2b
            Properties: 0x38
              Write (0x08)
              Notify (0x10)
              Indicate (0x20)
            Value Handle: 0x00d2
            Value UUID: Hearing Aid Preset Control Point (0x2bdb)
        Handle: 0x00d4
        Value[5]: 12d500da2b
            Properties: 0x12
              Read (0x02)
              Notify (0x10)
            Value Handle: 0x00d5
            Value UUID: Hearing Aid Features (0x2bda)
        Handle: 0x00d7
        Value[5]: 12d800dc2b
            Properties: 0x12
              Read (0x02)
              Notify (0x10)
            Value Handle: 0x00d8
            Value UUID: Active Preset Index (0x2bdc)
zephyr.exe[1707944]: < HCI Command: Host Number of Completed Packets (0x03|0x0035) plen 5                           #154 9.485734
        Num handles: 1
        Handle: 18 Address: C0:07:E8:2C:B6:EE (OUI C0-07-E8)
        Count: 1
zephyr.exe[1707944]: < HCI Command: Host Number of Completed Packets (0x03|0x0035) plen 5                           #155 9.487163
        Num handles: 1
        Handle: 18 Address: C0:07:E8:2C:B6:EE (OUI C0-07-E8)
        Count: 1
zephyr.exe[1707944]: < HCI Command: Host Number of Completed Packets (0x03|0x0035) plen 5                           #156 9.488462
        Num handles: 1
        Handle: 18 Address: C0:07:E8:2C:B6:EE (OUI C0-07-E8)
        Count: 1
zephyr.exe[1707944]: < ACL Data TX: Handle 18 [1/3] flags 0x00 dlen 9                                               #157 9.489539
      ATT: Find Information Request (0x04) len 4
        Handle range: 0x00d2-0xffff
> HCI Event: Number of Completed Packets (0x13) plen 5                                                              #158 9.545273
        Num handles: 1
        Handle: 18 Address: C0:07:E8:2C:B6:EE (OUI C0-07-E8)
        Count: 1
        Buffers: 0/3
        #157: len 9 (1 Kb/s)
        Latency: 55 msec (8-121 msec ~73 msec)
> ACL Data RX: Handle 18 flags 0x02 dlen 27                                                                         #159 9.614112
> ACL Data RX: Handle 18 flags 0x01 dlen 27                                                                         #160 9.614578
> ACL Data RX: Handle 18 flags 0x01 dlen 12                                                                         #161 9.614946
      ATT: Find Information Response (0x05) len 61
        Format: UUID-16 (0x01)
        Handle: 0x00d2
        UUID: Hearing Aid Preset Control Point (0x2bdb)
        Handle: 0x00d3
        UUID: Client Characteristic Configuration (0x2902)
        Handle: 0x00d4
        UUID: Characteristic (0x2803)
        Handle: 0x00d5
        UUID: Hearing Aid Features (0x2bda)
        Handle: 0x00d6
        UUID: Client Characteristic Configuration (0x2902)
        Handle: 0x00d7
        UUID: Characteristic (0x2803)
        Handle: 0x00d8
        UUID: Active Preset Index (0x2bdc)
        Handle: 0x00d9
        UUID: Client Characteristic Configuration (0x2902)
        Handle: 0x0110
        UUID: Primary Service (0x2800)
        Handle: 0x0111
        UUID: Characteristic (0x2803)
        Handle: 0x0112
        UUID: Sink PAC (0x2bc9)
        Handle: 0x0113
        UUID: Client Characteristic Configuration (0x2902)
        Handle: 0x0114
        UUID: Characteristic (0x2803)
        Handle: 0x0115
        UUID: Sink Audio Locations (0x2bca)
        Handle: 0x0116
        UUID: Client Characteristic Configuration (0x2902)
zephyr.exe[1707944]: < HCI Command: Host Number of Completed Packets (0x03|0x0035) plen 5                           #162 9.625729
        Num handles: 1
        Handle: 18 Address: C0:07:E8:2C:B6:EE (OUI C0-07-E8)
        Count: 1
zephyr.exe[1707944]: < HCI Command: Host Number of Completed Packets (0x03|0x0035) plen 5                           #163 9.627526
        Num handles: 1
        Handle: 18 Address: C0:07:E8:2C:B6:EE (OUI C0-07-E8)
        Count: 1
zephyr.exe[1707944]: < HCI Command: Host Number of Completed Packets (0x03|0x0035) plen 5                           #164 9.628632
        Num handles: 1
        Handle: 18 Address: C0:07:E8:2C:B6:EE (OUI C0-07-E8)
        Count: 1
zephyr.exe[1707944]: < ACL Data TX: Handle 18 [1/3] flags 0x00 dlen 9                                               #165 9.629543
      ATT: Write Request (0x12) len 4
        Handle: 0x00d3
          Data[2]: 0300
> HCI Event: Number of Completed Packets (0x13) plen 5                                                              #166 9.683845
        Num handles: 1
        Handle: 18 Address: C0:07:E8:2C:B6:EE (OUI C0-07-E8)
        Count: 1
        Buffers: 0/3
        #165: len 9 (1 Kb/s)
        Latency: 54 msec (8-121 msec ~63 msec)
> ACL Data RX: Handle 18 flags 0x02 dlen 5                                                                          #167 9.753843
      ATT: Write Response (0x13) len 0
zephyr.exe[1707944]: < HCI Command: Host Number of Completed Packets (0x03|0x0035) plen 5                           #168 9.769083
        Num handles: 1
        Handle: 18 Address: C0:07:E8:2C:B6:EE (OUI C0-07-E8)
        Count: 1
zephyr.exe[1707944]: < ACL Data TX: Handle 18 [1/3] flags 0x00 dlen 11                                              #169 9.769622
      ATT: Read By Type Request (0x08) len 6
        Handle range: 0x0001-0xffff
        Attribute type: Active Preset Index (0x2bdc)
> HCI Event: Number of Completed Packets (0x13) plen 5                                                              #170 9.823842
        Num handles: 1
        Handle: 18 Address: C0:07:E8:2C:B6:EE (OUI C0-07-E8)
        Count: 1
        Buffers: 0/3
        #169: len 11 (1 Kb/s)
        Latency: 54 msec (8-121 msec ~59 msec)
> ACL Data RX: Handle 18 flags 0x02 dlen 9                                            