Bluetooth monitor ver 5.72
btmon[327041]: = Note: Linux version 6.14.0-36-generic (x86_64)                                                          0.310268
btmon[327041]: = Note: Bluetooth subsystem version 2.22                                                                  0.310271
= New Index: 00:00:00:00:00:00 (Primary,UART,hci1)                                                                       0.310272
= New Index: 48:5F:99:8E:E0:64 (Primary,USB,hci0)                                                                        0.310273
= Open Index: 00:00:00:00:00:00                                                                                          0.324420
= Index Info: 00:00:00:00:00:00 (Nordic Semiconductor ASA)                                                               0.324424
zephyr.exe[327043]: @ USER Open: main (privileged) version 2.22                                                 {0x0001} 0.324427
zephyr.exe[327043]: < HCI Command: Reset (0x03|0x0003) plen 0                                                         #1 0.324776
> HCI Event: Command Complete (0x0e) plen 4                                                                           #2 0.325289
      Reset (0x03|0x0003) ncmd 1
        Status: Success (0x00)
zephyr.exe[327043]: < HCI Command: Read Local Supported Features (0x04|0x0003) plen 0                                 #3 0.344369
> HCI Event: Command Complete (0x0e) plen 12                                                                          #4 0.345056
      Read Local Supported Features (0x04|0x0003) ncmd 1
        Status: Success (0x00)
        Features: 0x00 0x00 0x00 0x00 0x60 0x00 0x00 0x00
          BR/EDR Not Supported
          LE Supported (Controller)
zephyr.exe[327043]: < HCI Command: Read Local Version Information (0x04|0x0001) plen 0                                #5 0.364309
> HCI Event: Command Complete (0x0e) plen 12                                                                          #6 0.364751
      Read Local Version Information (0x04|0x0001) ncmd 1
        Status: Success (0x00)
        HCI version: Reserved (0x0e) - Revision 12520 (0x30e8)
        LMP version: Reserved (0x0e) - Subversion 12520 (0x30e8)
        Manufacturer: Nordic Semiconductor ASA (89)
zephyr.exe[327043]: < HCI Command: Read Local Supported Commands (0x04|0x0002) plen 0                                 #7 0.384326
> HCI Event: Command Complete (0x0e) plen 68                                                                          #8 0.385389
      Read Local Supported Commands (0x04|0x0002) ncmd 1
        Status: Success (0x00)
        Commands: 119 entries
          Disconnect (Octet 0 - Bit 5)
          Read Remote Version Information (Octet 2 - Bit 7)
          Set Event Mask (Octet 5 - Bit 6)
          Reset (Octet 5 - Bit 7)
          Read Connection Accept Timeout (Octet 7 - Bit 2)
          Write Connection Accept Timeout (Octet 7 - Bit 3)
          Read Transmit Power Level (Octet 10 - Bit 2)
          Set Controller To Host Flow Control (Octet 10 - Bit 5)
          Host Buffer Size (Octet 10 - Bit 6)
          Host Number of Completed Packets (Octet 10 - Bit 7)
          Read Local Version Information (Octet 14 - Bit 3)
          Read Local Supported Features (Octet 14 - Bit 5)
          Read BD ADDR (Octet 15 - Bit 1)
          Read RSSI (Octet 15 - Bit 5)
          Set Event Mask Page 2 (Octet 22 - Bit 2)
          LE Set Event Mask (Octet 25 - Bit 0)
          LE Read Buffer Size (Octet 25 - Bit 1)
          LE Read Local Supported Features (Octet 25 - Bit 2)
          LE Set Random Address (Octet 25 - Bit 4)
          LE Set Advertising Parameters (Octet 25 - Bit 5)
          LE Read Advertising Channel TX Power (Octet 25 - Bit 6)
          LE Set Advertising Data (Octet 25 - Bit 7)
          LE Set Scan Response Data (Octet 26 - Bit 0)
          LE Set Advertise Enable (Octet 26 - Bit 1)
          LE Set Scan Parameters (Octet 26 - Bit 2)
          LE Set Scan Enable (Octet 26 - Bit 3)
          LE Create Connection (Octet 26 - Bit 4)
          LE Create Connection Cancel (Octet 26 - Bit 5)
          LE Read Accept List Size (Octet 26 - Bit 6)
          LE Clear Accept List (Octet 26 - Bit 7)
          LE Add Device To Accept List (Octet 27 - Bit 0)
          LE Remove Device From Accept List (Octet 27 - Bit 1)
          LE Connection Update (Octet 27 - Bit 2)
          LE Set Host Channel Classification (Octet 27 - Bit 3)
          LE Read Channel Map (Octet 27 - Bit 4)
          LE Read Remote Used Features (Octet 27 - Bit 5)
          LE Encrypt (Octet 27 - Bit 6)
          LE Rand (Octet 27 - Bit 7)
          LE Start Encryption (Octet 28 - Bit 0)
          LE Long Term Key Request Reply (Octet 28 - Bit 1)
          LE Long Term Key Request Neg Reply (Octet 28 - Bit 2)
          LE Read Supported States (Octet 28 - Bit 3)
          LE Receiver Test (Octet 28 - Bit 4)
          LE Transmitter Test (Octet 28 - Bit 5)
          LE Test End (Octet 28 - Bit 6)
          Read Authenticated Payload Timeout (Octet 32 - Bit 4)
          Write Authenticated Payload Timeout (Octet 32 - Bit 5)
          LE Set Data Length (Octet 33 - Bit 6)
          LE Read Suggested Default Data Length (Octet 33 - Bit 7)
          LE Write Suggested Default Data Length (Octet 34 - Bit 0)
          LE Add Device To Resolving List (Octet 34 - Bit 3)
          LE Remove Device From Resolving List (Octet 34 - Bit 4)
          LE Clear Resolving List (Octet 34 - Bit 5)
          LE Read Resolving List Size (Octet 34 - Bit 6)
          LE Set Address Resolution Enable (Octet 35 - Bit 1)
          LE Set Resolvable Private Address Timeout (Octet 35 - Bit 2)
          LE Read Maximum Data Length (Octet 35 - Bit 3)
          LE Read PHY (Octet 35 - Bit 4)
          LE Set Default PHY (Octet 35 - Bit 5)
          LE Set PHY (Octet 35 - Bit 6)
          LE Enhanced Receiver Test (Octet 35 - Bit 7)
          LE Enhanced Transmitter Test (Octet 36 - Bit 0)
          LE Set Advertising Set Random Address (Octet 36 - Bit 1)
          LE Set Extended Advertising Parameters (Octet 36 - Bit 2)
          LE Set Extended Advertising Data (Octet 36 - Bit 3)
          LE Set Extended Scan Response Data (Octet 36 - Bit 4)
          LE Set Extended Advertising Enable (Octet 36 - Bit 5)
          LE Read Maximum Advertising Data Length (Octet 36 - Bit 6)
          LE Read Number of Supported Advertising Sets (Octet 36 - Bit 7)
          LE Remove Advertising Set (Octet 37 - Bit 0)
          LE Clear Advertising Sets (Octet 37 - Bit 1)
          LE Set Periodic Advertising Parameters (Octet 37 - Bit 2)
          LE Set Periodic Advertising Data (Octet 37 - Bit 3)
          LE Set Periodic Advertising Enable (Octet 37 - Bit 4)
          LE Set Extended Scan Parameters (Octet 37 - Bit 5)
          LE Set Extended Scan Enable (Octet 37 - Bit 6)
          LE Extended Create Connection (Octet 37 - Bit 7)
          LE Periodic Advertising Create Sync (Octet 38 - Bit 0)
          LE Periodic Advertising Create Sync Cancel (Octet 38 - Bit 1)
          LE Periodic Advertising Terminate Sync (Octet 38 - Bit 2)
          LE Add Device To Periodic Advertiser List (Octet 38 - Bit 3)
          LE Remove Device From Periodic Advertiser List (Octet 38 - Bit 4)
          LE Clear Periodic Advertiser List (Octet 38 - Bit 5)
          LE Read Periodic Advertiser List Size (Octet 38 - Bit 6)
          LE Read Transmit Power (Octet 38 - Bit 7)
          LE Read RF Path Compensation (Octet 39 - Bit 0)
          LE Write RF Path Compensation (Octet 39 - Bit 1)
          LE Set Privacy Mode (Octet 39 - Bit 2)
          LE Periodic Advertising Receive Enable (Octet 40 - Bit 5)
          LE Periodic Advertising Sync Transfer (Octet 40 - Bit 6)
          LE Periodic Advertising Set Info Transfer (Octet 40 - Bit 7)
          LE Periodic Advertising Sync Transfer Parameters (Octet 41 - Bit 0)
          LE Set Default Periodic Advertisng Sync Transfer Parameters (Octet 41 - Bit 1)
          LE Read Buffer v2 (Octet 41 - Bit 5)
          LE Read ISO TX Sync (Octet 41 - Bit 6)
          LE Set Connected Isochronous Group Parameters (Octet 41 - Bit 7)
          LE Set Connected Isochronous Group Parameters Test (Octet 42 - Bit 0)
          LE Create Connected Isochronous Stream (Octet 42 - Bit 1)
          LE Remove Connected Isochronous Group (Octet 42 - Bit 2)
          LE Accept Connected Isochronous Stream Request (Octet 42 - Bit 3)
          LE Reject Connected Isochronous Stream Request (Octet 42 - Bit 4)
          LE Create Broadcast Isochronous Group (Octet 42 - Bit 5)
          LE Create Broadcast Isochronous Group Test (Octet 42 - Bit 6)
          LE Terminate Broadcast Isochronous Group (Octet 42 - Bit 7)
          LE Broadcast Isochronous Group Create Sync (Octet 43 - Bit 0)
          LE Broadcast Isochronous Group Terminate Sync (Octet 43 - Bit 1)
          LE Request Peer SCA (Octet 43 - Bit 2)
          LE Setup Isochronous Data Path (Octet 43 - Bit 3)
          LE Remove Isochronous Data Path (Octet 43 - Bit 4)
          LE Isochronous Transmit Test (Octet 43 - Bit 5)
          LE Isochronous Receive Test (Octet 43 - Bit 6)
          LE Isochronous Read Test Counters (Octet 43 - Bit 7)
          LE Isochronous Read Test Counters (Octet 44 - Bit 0)
          LE Set Host Feature (Octet 44 - Bit 1)
          Octet 44 - Bit 2 
          Octet 45 - Bit 6 
          Octet 46 - Bit 0 
          Octet 46 - Bit 1 
          Octet 46 - Bit 2 
zephyr.exe[327043]: < HCI Command: Host Buffer Size (0x03|0x0033) plen 7                                              #9 0.404314
        ACL MTU: 255  ACL max packet: 16
        SCO MTU: 0    SCO max packet: 0
> HCI Event: Command Complete (0x0e) plen 4                                                                          #10 0.404859
      Host Buffer Size (0x03|0x0033) ncmd 1
        Status: Success (0x00)
zephyr.exe[327043]: < HCI Command: Set Controller To Host Flow Control (0x03|0x0031) plen 1                          #11 0.424295
        Flow control: ACL Data Packets (0x01)
> HCI Event: Command Complete (0x0e) plen 4                                                                          #12 0.424650
      Set Controller To Host Flow Control (0x03|0x0031) ncmd 1
        Status: Success (0x00)
zephyr.exe[327043]: < HCI Command: LE Read Local Supported Features (0x08|0x0003) plen 0                             #13 0.444313
> HCI Event: Command Complete (0x0e) plen 12                                                                         #14 0.444833
      LE Read Local Supported Features (0x08|0x0003) ncmd 1
        Status: Success (0x00)
        Features: 0xfd 0x79 0x00 0xf7 0x30 0x01 0x00 0x00
          LE Encryption
          Extended Reject Indication
          Peripheral-initiated Features Exchange
          LE Ping
          LE Data Packet Length Extension
          LL Privacy
          Extended Scanner Filter Policies
          LE 2M PHY
          LE Coded PHY
          LE Extended Advertising
          LE Periodic Advertising
          Channel Selection Algorithm #2
          Periodic Advertising Sync Transfer - Sender
          Periodic Advertising Sync Transfer - Recipient
          Sleep Clock Accuracy Updates
          Connected Isochronous Stream - Central
          Connected Isochronous Stream - Peripheral
          Isochronous Broadcaster
          Synchronized Receiver
          Periodic Advertising ADI support
          Connection Subrating
          Unknown features (0x0000010000000000)
zephyr.exe[327043]: < HCI Command: LE Set Host Feature (0x08|0x0074) plen 2                                          #15 0.464330
        Bit Number: 32
          Connected Isochronous Stream (Host Support)
        Bit Value: 1
> HCI Event: Command Complete (0x0e) plen 4                                                                          #16 0.464732
      LE Set Host Feature (0x08|0x0074) ncmd 1
        Status: Success (0x00)
zephyr.exe[327043]: < HCI Command: LE Read Buffer v2 (0x08|0x0060) plen 0                                            #17 0.484375
> HCI Event: Command Complete (0x0e) plen 10                                                                         #18 0.484787
      LE Read Buffer v2 (0x08|0x0060) ncmd 1
        Status: Success (0x00)
        ACL MTU: 27
        ACL max packet: 3
        ISO MTU: 318
        ISO max packet: 3
zephyr.exe[327043]: < HCI Command: LE Read Maximum Advertising Data Length (0x08|0x003a) plen 0                      #19 0.504401
> HCI Event: Command Complete (0x0e) plen 6                                                                          #20 0.504856
      LE Read Maximum Advertising Data Length (0x08|0x003a) ncmd 1
        Status: Success (0x00)
        Max length: 1650
zephyr.exe[327043]: < HCI Command: LE Read Supported States (0x08|0x001c) plen 0                                     #21 0.524348
> HCI Event: Command Complete (0x0e) plen 12                                                                         #22 0.524878
      LE Read Supported States (0x08|0x001c) ncmd 1
        Status: Success (0x00)
        States: 0x000003ff3e0306ff
          Non-connectable Advertising State
          Scannable Advertising State
          Connectable Advertising State
          High Duty Cycle Directed Advertising State
          Passive Scanning State
          Active Scanning State
          Initiating State
            and Connection State (Central Role)
          Connection State (Peripheral Role)
          Scannable Advertising State
            and Passive Scanning State
          Connectable Advertising State
            and Passive Scanning State
          Non-connectable Advertising State
            and Initiating State
          Scannable Advertising State
            and Initiating State
          Active Scanning State
            and Connection State (Central Role)
          Passive Scanning State
            and Connection State (Peripheral Role)
          Active Scanning State
            and Connection State (Peripheral Role)
          Initiating State
            and Connection State (Central Role)
            and Central Role & Central Role
          Low Duty Cycle Directed Advertising State
          Connectable Advertising State
            and Initiating State
            and Central Role & Peripheral Role
          High Duty Cycle Directed Advertising State
            and Initiating State
            and Central Role & Peripheral Role
          Low Duty Cycle Directed Advertising State
            and Initiating State
            and Central Role & Peripheral Role
          Connectable Advertising State
            and Connection State (Central Role)
            and Central Role & Peripheral Role
          High Duty Cycle Directed Advertising State
            and Connection State (Central Role)
            and Central Role & Peripheral Role
          Low Duty Cycle Directed Advertising State
            and Connection State (Central Role)
            and Central Role & Peripheral Role
          Connectable Advertising State
            and Connection State (Peripheral Role)
            and Central Role & Peripheral Role
          High Duty Cycle Directed Advertising State
            and Connection State (Peripheral Role)
            and Peripheral Role & Peripheral Role
          Low Duty Cycle Directed Advertising State
            and Connection State (Peripheral Role)
            and Peripheral Role & Peripheral Role
          Initiating State
            and Connection State (Peripheral Role)
            and Central Role & Peripheral Role
zephyr.exe[327043]: < HCI Command: LE Read Maximum Data Length (0x08|0x002f) plen 0                                  #23 0.544341
> HCI Event: Command Complete (0x0e) plen 12                                                                         #24 0.544880
      LE Read Maximum Data Length (0x08|0x002f) ncmd 1
        Status: Success (0x00)
        Max TX octets: 251
        Max TX time: 2704
        Max RX octets: 251
        Max RX time: 2704
zephyr.exe[327043]: < HCI Command: LE Write Suggested Default Data Length (0x08|0x0024) plen 4                       #25 0.564367
        TX octets: 251
        TX time: 2704
> HCI Event: Command Complete (0x0e) plen 4                                                                          #26 0.564804
      LE Write Suggested Default Data Length (0x08|0x0024) ncmd 1
        Status: Success (0x00)
zephyr.exe[327043]: < HCI Command: LE Read Resolving List Size (0x08|0x002a) plen 0                                  #27 0.584368
> HCI Event: Command Complete (0x0e) plen 5                                                                          #28 0.584955
      LE Read Resolving List Size (0x08|0x002a) ncmd 1
        Status: Success (0x00)
        Size: 8
zephyr.exe[327043]: < HCI Command: LE Set Event Mask (0x08|0x0001) plen 8                                            #29 0.604346
        Mask: 0x000002023f87fa5e
          LE Advertising Report
          LE Connection Update Complete
          LE Read Remote Used Features Complete
          LE Long Term Key Request
          LE Data Length Change
          LE Enhanced Connection Complete
          LE PHY Update Complete
          LE Extended Advertising Report
          LE Periodic Advertising Sync Established
          LE Periodic Advertising Report
          LE Periodic Advertising Sync Lost
          LE Extended Scan Timeout
          LE Extended Advertising Set Terminated
          LE Scan Request Received
          LE Periodic Advertising Sync Transfer Rvc
          LE CIS Established
          LE CIS Request
          LE Create BIG Complete
          LE Terminate BIG Complete
          LE BIG Sync Estabilished Complete
          LE BIG Sync Lost
          LE BIG Info Advertising Report
          Unknown mask (0x0000020000000000)
> HCI Event: Command Complete (0x0e) plen 4                                                                          #30 0.604820
      LE Set Event Mask (0x08|0x0001) ncmd 1
        Status: Success (0x00)
zephyr.exe[327043]: < HCI Command: Set Event Mask (0x03|0x0001) plen 8                                               #31 0.624343
        Mask: 0x2000800002008890
          Disconnection Complete
          Encryption Change
          Read Remote Version Information Complete
          Hardware Error
          Data Buffer Overflow
          Encryption Key Refresh Complete
          LE Meta
> HCI Event: Command Complete (0x0e) plen 4                                                                          #32 0.624885
      Set Event Mask (0x03|0x0001) ncmd 1
        Status: Success (0x00)
zephyr.exe[327043]: < HCI Command: Read BD ADDR (0x04|0x0009) plen 0                                                 #33 0.644363
> HCI Event: Command Complete (0x0e) plen 10                                                                         #34 0.644878
      Read BD ADDR (0x04|0x0009) ncmd 1
        Status: Success (0x00)
        Address: 00:00:00:00:00:00 (OUI 00-00-00)
zephyr.exe[327043]: < HCI Command: LE Set Random Address (0x08|0x0005) plen 6                                        #35 0.664353
        Address: D5:B6:CC:31:DB:3B (Static)
> HCI Event: Command Complete (0x0e) plen 4                                                                          #36 0.664813
      LE Set Random Address (0x08|0x0005) ncmd 1
        Status: Success (0x00)
zephyr.exe[327043]: < HCI Command: LE Set Extended Advertising Parameters (0x08|0x0036) plen 25                      #37 2.874412
        Handle: 0x00
        Properties: 0x0013
          Connectable
          Scannable
          Use legacy advertising PDUs: ADV_IND
        Min advertising interval: 100.000 msec (0x00a0)
        Max advertising interval: 150.000 msec (0x00f0)
        Channel map: 37, 38, 39 (0x07)
        Own address type: Random (0x01)
        Peer address type: Public (0x00)
        Peer address: 00:00:00:00:00:00 (OUI 00-00-00)
        Filter policy: Allow Scan Request from Any, Allow Connect Request from Any (0x00)
        TX power: Host has no preference (0x7f)
        Primary PHY: LE 1M (0x01)
        Secondary max skip: 0x00
        Secondary PHY: LE 1M (0x01)
        SID: 0x00
        Scan request notifications: Disabled (0x00)
> HCI Event: Command Complete (0x0e) plen 5                                                                          #38 2.875169
      LE Set Extended Advertising Parameters (0x08|0x0036) ncmd 1
        Status: Success (0x00)
        TX power (selected): 0 dbm (0x00)
zephyr.exe[327043]: < HCI Command: LE Set Advertising Set Random Address (0x08|0x0035) plen 7                        #39 2.884383
        Advertising handle: 0x00
        Advertising random address: D5:B6:CC:31:DB:3B (Static)
> HCI Event: Command Complete (0x0e) plen 4                                                                          #40 2.884868
      LE Set Advertising Set Random Address (0x08|0x0035) ncmd 1
        Status: Success (0x00)
zephyr.exe[327043]: < HCI Command: LE Set Extended Advertising Data (0x08|0x0037) plen 22                            #41 2.904461
        Handle: 0x00
        Operation: Complete extended advertising data (0x03)
        Fragment preference: Minimize fragmentation (0x01)
        Data length: 0x12
        Flags: 0x06
          LE General Discoverable Mode
          BR/EDR Not Supported
        Name (complete): Tester_F6B11A
> HCI Event: Command Complete (0x0e) plen 4                                                                          #42 2.905169
      LE Set Extended Advertising Data (0x08|0x0037) ncmd 1
        Status: Success (0x00)
zephyr.exe[327043]: < HCI Command: LE Set Extended Scan Response Data (0x08|0x0038) plen 4                           #43 2.924348
        Handle: 0x00
        Operation: Complete scan response data (0x03)
        Fragment preference: Minimize fragmentation (0x01)
        Data length: 0x00
> HCI Event: Command Complete (0x0e) plen 4                                                                          #44 2.924851
      LE Set Extended Scan Response Data (0x08|0x0038) ncmd 1
        Status: Success (0x00)
zephyr.exe[327043]: < HCI Command: LE Set Extended Advertising Enable (0x08|0x0039) plen 6                           #45 2.944372
        Extended advertising: Enabled (0x01)
        Number of sets: 1 (0x01)
        Entry 0
          Handle: 0x00
          Duration: 0 ms (0x00)
          Max ext adv events: 0
> HCI Event: Command Complete (0x0e) plen 4                                                                          #46 2.944978
      LE Set Extended Advertising Enable (0x08|0x0039) ncmd 1
        Status: Success (0x00)
> HCI Event: LE Meta Event (0x3e) plen 31                                                                            #47 3.468832
      LE Enhanced Connection Complete (0x0a)
        Status: Success (0x00)
        Handle: 471
        Role: Peripheral (0x01)
        Peer address type: Public (0x00)
        Peer address: DF:A9:FF:F6:B1:1A (OUI DF-A9-FF)
        Local resolvable private address: 00:00:00:00:00:00 (Non-Resolvable)
        Peer resolvable private address: 00:00:00:00:00:00 (Non-Resolvable)
        Connection interval: 87.50 msec (0x0046)
        Connection latency: 0 (0x0000)
        Supervision timeout: 20000 msec (0x07d0)
        Central clock accuracy: 0x01
> HCI Event: LE Meta Event (0x3e) plen 6                                                                             #48 3.468990
      LE Advertising Set Terminated (0x12)
        Status: Success (0x00)
        Handle: 0
        Connection handle: 471
        Number of completed extended advertising events: 0
zephyr.exe[327043]: < HCI Command: LE Read Remote Used Features (0x08|0x0016) plen 2                                 #49 3.484673
        Handle: 471 Address: DF:A9:FF:F6:B1:1A (OUI DF-A9-FF)
> HCI Event: Command Status (0x0f) plen 4                                                                            #50 3.485199
      LE Read Remote Used Features (0x08|0x0016) ncmd 1
        Status: Success (0x00)
> HCI Event: LE Meta Event (0x3e) plen 12                                                                            #51 3.732730
      LE Read Remote Used Features (0x04)
        Status: Success (0x00)
        Handle: 471 Address: DF:A9:FF:F6:B1:1A (OUI DF-A9-FF)
        Features: 0x2d 0x49 0x00 0xf7 0x67 0xd8 0x00 0x00
          LE Encryption
          Extended Reject Indication
          Peripheral-initiated Features Exchange
          LE Data Packet Length Extension
          LE 2M PHY
          LE Coded PHY
          Channel Selection Algorithm #2
          Periodic Advertising Sync Transfer - Sender
          Periodic Advertising Sync Transfer - Recipient
          Sleep Clock Accuracy Updates
          Connected Isochronous Stream - Central
          Connected Isochronous Stream - Peripheral
          Isochronous Broadcaster
          Synchronized Receiver
          Connected Isochronous Stream (Host Support)
          LE Power Control Request
          LE Power Control Request
          Connection Subrating
          Connection Subrating (Host Support)
          Unknown features (0x0000d80000000000)
> ACL Data RX: Handle 471 flags 0x02 dlen 11                                                                         #52 4.170010
      SMP: Pairing Request (0x01) len 6
        IO capability: KeyboardOnly (0x02)
        OOB data: Authentication data not present (0x00)
        Authentication requirement: No bonding, MITM, SC, No Keypresses (0xcc)
        Max encryption key size: 16
        Initiator key distribution: <none> (0x00)
        Responder key distribution: <none> (0x00)
zephyr.exe[327043]: < HCI Command: Host Number of Completed Packets (0x03|0x0035) plen 5                             #53 4.184727
        Num handles: 1
        Handle: 471 Address: DF:A9:FF:F6:B1:1A (OUI DF-A9-FF)
        Count: 1
zephyr.exe[327043]: < ACL Data TX: Handle 471 flags 0x00 dlen 11                                                     #54 4.184889
      SMP: Pairing Response (0x02) len 6
        IO capability: DisplayOnly (0x00)
        OOB data: Authentication data not present (0x00)
        Authentication requirement: Bonding, No MITM, SC, No Keypresses (0x09)
        Max encryption key size: 16
        Initiator key distribution: <none> (0x00)
        Responder key distribution: <none> (0x00)
> HCI Event: Number of Completed Packets (0x13) plen 5                                                               #55 4.345009
        Num handles: 1
        Handle: 471 Address: DF:A9:FF:F6:B1:1A (OUI DF-A9-FF)
        Count: 1
        #54: len 11 (0 Kb/s)
        Latency: 160 msec (160-160 msec ~160 msec)
> ACL Data RX: Handle 471 flags 0x02 dlen 27                                                                         #56 4.345485
> ACL Data RX: Handle 471 flags 0x01 dlen 27                                                                         #57 4.345962
> ACL Data RX: Handle 471 flags 0x01 dlen 15                                                                         #58 4.346379
      SMP: Pairing Public Key (0x0c) len 64
        X: 00a416a0ab9d52602346e3acdad81b745bc2d59f4d056636b8d2120953e707bd
        Y: 1ceff6f39cb2724493a89f45c7527f6545f16743b147ebc3d81f12d2366a0a54
zephyr.exe[327043]: < HCI Command: Host Number of Completed Packets (0x03|0x0035) plen 5                             #59 4.364334
        Num handles: 1
        Handle: 471 Address: DF:A9:FF:F6:B1:1A (OUI DF-A9-FF)
        Count: 1
zephyr.exe[327043]: < HCI Command: Host Number of Completed Packets (0x03|0x0035) plen 5                             #60 4.364484
        Num handles: 1
        Handle: 471 Address: DF:A9:FF:F6:B1:1A (OUI DF-A9-FF)
        Count: 1
zephyr.exe[327043]: < HCI Command: Host Number of Completed Packets (0x03|0x0035) plen 5                             #61 4.364586
        Num handles: 1
        Handle: 471 Address: DF:A9:FF:F6:B1:1A (OUI DF-A9-FF)
        Count: 1
zephyr.exe[327043]: < ACL Data TX: Handle 471 flags 0x00 dlen 27                                                     #62 4.364598
zephyr.exe[327043]: < ACL Data TX: Handle 471 flags 0x01 dlen 27                                                     #63 4.364604
zephyr.exe[327043]: < ACL Data TX: Handle 471 flags 0x01 dlen 15                                                     #64 4.364609
      SMP: Pairing Public Key (0x0c) len 64
        X: 98308440221e2d910f0e54b71e7ec652857aa9b5a0dc65028824cc19db1226e9
        Y: 67a4816bcb62efb21701e31fdb27561a6217575fb007a8bbdabe7e28b6f68482
> HCI Event: Number of Completed Packets (0x13) plen 5                                                               #65 4.432985
        Num handles: 1
        Handle: 471 Address: DF:A9:FF:F6:B1:1A (OUI DF-A9-FF)
        Count: 1
        #62: len 27 (3 Kb/s)
        Latency: 68 msec (68-160 msec ~114 msec)
> HCI Event: Number of Completed Packets (0x13) plen 5                                                               #66 4.433625
        Num handles: 1
        Handle: 471 Address: DF:A9:FF:F6:B1:1A (OUI DF-A9-FF)
        Count: 1
        #63: len 27 (3 Kb/s)
        Latency: 69 msec (68-160 msec ~91 msec)
> HCI Event: Number of Completed Packets (0x13) plen 5                                                               #67 4.519850
        Num handles: 1
        Handle: 471 Address: DF:A9:FF:F6:B1:1A (OUI DF-A9-FF)
        Count: 1
        #64: len 15 (0 Kb/s)
        Latency: 155 msec (68-160 msec ~123 msec)
> ACL Data RX: Handle 471 flags 0x02 dlen 21                                                                         #68 5.045133
      SMP: Pairing Confirm (0x03) len 16
        Confim value: 6ee32f834fde08df0d56cdffda0a83ae
zephyr.exe[327043]: < HCI Command: Host Number of Completed Packets (0x03|0x0035) plen 5                             #69 5.064622
        Num handles: 1
        Handle: 471 Address: DF:A9:FF:F6:B1:1A (OUI DF-A9-FF)
        Count: 1
zephyr.exe[327043]: < ACL Data TX: Handle 471 flags 0x00 dlen 21                                                     #70 5.064742
      SMP: Pairing Confirm (0x03) len 16
        Confim value: 5e4bc03d2a56e69c6371586be403fa43
> HCI Event: Number of Completed Packets (0x13) plen 5                                                               #71 5.220033
        Num handles: 1
        Handle: 471 Address: DF:A9:FF:F6:B1:1A (OUI DF-A9-FF)
        Count: 1
        #70: len 21 (1 Kb/s)
        Latency: 155 msec (68-160 msec ~139 msec)
> ACL Data RX: Handle 471 flags 0x02 dlen 21                                                                         #72 5.220364
      SMP: Pairing Random (0x04) len 16
        Random value: aa6634df3579d913f95b423b923e5999
zephyr.exe[327043]: < HCI Command: Host Number of Completed Packets (0x03|0x0035) plen 5                             #73 5.225133
        Num handles: 1
        Handle: 471 Address: DF:A9:FF:F6:B1:1A (OUI DF-A9-FF)
        Count: 1
zephyr.exe[327043]: < ACL Data TX: Handle 471 flags 0x00 dlen 21                                                     #74 5.225244
      SMP: Pairing Random (0x04) len 16
        Random value: 8e6108f966a694cbe26df70bb96773e6
> HCI Event: Number of Completed Packets (0x13) plen 5                                                               #75 5.395087
        Num handles: 1
        Handle: 471 Address: DF:A9:FF:F6:B1:1A (OUI DF-A9-FF)
        Count: 1
        #74: len 21 (0 Kb/s)
        Latency: 169 msec (68-169 msec ~154 msec)
> ACL Data RX: Handle 471 flags 0x02 dlen 21                                                                         #76 5.395316
      SMP: Pairing Confirm (0x03) len 16
        Confim value: 438860a995523577fdc58591ee55a2f0
zephyr.exe[327043]: < HCI Command: Host Number of Completed Packets (0x03|0x0035) plen 5                             #77 5.404640
        Num handles: 1
        Handle: 471 Address: DF:A9:FF:F6:B1:1A (OUI DF-A9-FF)
        Count: 1
zephyr.exe[327043]: < ACL Data TX: Handle 471 flags 0x00 dlen 21                                                     #78 5.404656
      SMP: Pairing Confirm (0x03) len 16
        Confim value: a289659d1c8e65f6afac922a342406e9
> HCI Event: Number of Completed Packets (0x13) plen 5                                                               #79 5.570058
        Num handles: 1
        Handle: 471 Address: DF:A9:FF:F6:B1:1A (OUI DF-A9-FF)
        Count: 1
        #78: len 21 (1 Kb/s)
        Latency: 165 msec (68-169 msec ~160 msec)
> ACL Data RX: Handle 471 flags 0x02 dlen 21                                                                         #80 5.570338
      SMP: Pairing Random (0x04) len 16
        Random value: 2fd686f11f859a1f69b9f67f34cb7804
zephyr.exe[327043]: < HCI Command: Host Number of Completed Packets (0x03|0x0035) plen 5                             #81 5.584949
        Num handles: 1
        Handle: 471 Address: DF:A9:FF:F6:B1:1A (OUI DF-A9-FF)
        Count: 1
zephyr.exe[327043]: < ACL Data TX: Handle 471 flags 0x00 dlen 21                                                     #82 5.585013
      SMP: Pairing Random (0x04) len 16
        Random value: 4d02679f89a05211af56d8b3da64d21e
> HCI Event: Number of Completed Packets (0x13) plen 5                                                               #83 5.744917
        Num handles: 1
        Handle: 471 Address: DF:A9:FF:F6:B1:1A (OUI DF-A9-FF)
        Count: 1
        #82: len 21 (1 Kb/s)
        Latency: 159 msec (68-169 msec ~159 msec)
> ACL Data RX: Handle 471 flags 0x02 dlen 21                                                                         #84 5.745273
      SMP: Pairing Confirm (0x03) len 16
        Confim value: bebfb7d2db08c62dc5dff2c90914e0f0
zephyr.exe[327043]: < HCI Command: Host Number of Completed Packets (0x03|0x0035) plen 5                             #85 5.765177
        Num handles: 1
        Handle: 471 Address: DF:A9:FF:F6:B1:1A (OUI DF-A9-FF)
        Count: 1
zephyr.exe[327043]: < ACL Data TX: Handle 471 flags 0x00 dlen 21                                                     #86 5.765290
      SMP: Pairing Confirm (0x03) len 16
        Confim value: c450828c5f0de0b354d8ca7dfa444576
> HCI Event: Number of Completed Packets (0x13) plen 5                                                               #87 5.920041
        Num handles: 1
        Handle: 471 Address: DF:A9:FF:F6:B1:1A (OUI DF-A9-FF)
        Count: 1
        #86: len 21 (1 Kb/s)
        Latency: 154 msec (68-169 msec ~157 msec)
> ACL Data RX: Handle 471 flags 0x02 dlen 21                                                                         #88 5.920388
      SMP: Pairing Random (0x04) len 16
        Random value: 2f4c70d7340824982683772f78fcfafc
zephyr.exe[327043]: < HCI Command: Host Number of Completed Packets (0x03|0x0035) plen 5                             #89 5.925136
        Num handles: 1
        Handle: 471 Address: DF:A9:FF:F6:B1:1A (OUI DF-A9-FF)
        Count: 1
zephyr.exe[327043]: < ACL Data TX: Handle 471 flags 0x00 dlen 21                                                     #90 5.925286
      SMP: Pairing Random (0x04) len 16
        Random value: 5e8286bc235a02440d0c3424a2acf8fd
> HCI Event: Number of Completed Packets (0x13) plen 5                                                               #91 6.094961
        Num handles: 1
        Handle: 471 Address: DF:A9:FF:F6:B1:1A (OUI DF-A9-FF)
        Count: 1
        #90: len 21 (0 Kb/s)
        Latency: 169 msec (68-169 msec ~163 msec)
> ACL Data RX: Handle 471 flags 0x02 dlen 21                                                                         #92 6.095297
      SMP: Pairing Confirm (0x03) len 16
        Confim value: 47a097aaf2c4cf47d9beeecd5d58f37a
zephyr.exe[327043]: < HCI Command: Host Number of Completed Packets (0x03|0x0035) plen 5                             #93 6.104856
        Num handles: 1
        Handle: 471 Address: DF:A9:FF:F6:B1:1A (OUI DF-A9-FF)
        Count: 1
zephyr.exe[327043]: < ACL Data TX: Handle 471 flags 0x00 dlen 21                                                     #94 6.104971
      SMP: Pairing Confirm (0x03) len 16
        Confim value: 4bacc8128755a7bb21f7b83f56075aa1
> HCI Event: Number of Completed Packets (0x13) plen 5                                                               #95 6.270034
        Num handles: 1
        Handle: 471 Address: DF:A9:FF:F6:B1:1A (OUI DF-A9-FF)
        Count: 1
        #94: len 21 (1 Kb/s)
        Latency: 165 msec (68-169 msec ~164 msec)
> ACL Data RX: Handle 471 flags 0x02 dlen 21                                                                         #96 6.270309
      SMP: Pairing Random (0x04) len 16
        Random value: 7d2e7b0bf3d82eec5fffada93d87f9d1
zephyr.exe[327043]: < HCI Command: Host Number of Completed Packets (0x03|0x0035) plen 5                             #97 6.285113
        Num handles: 1
        Handle: 471 Address: DF:A9:FF:F6:B1:1A (OUI DF-A9-FF)
        Count: 1
zephyr.exe[327043]: < ACL Data TX: Handle 471 flags 0x00 dlen 21                                                     #98 6.285245
      SMP: Pairing Random (0x04) len 16
        Random value: 5c4a1bcadd27bd58e945097b00bad7ac
> HCI Event: Number of Completed Packets (0x13) plen 5                                                               #99 6.444921
        Num handles: 1
        Handle: 471 Address: DF:A9:FF:F6:B1:1A (OUI DF-A9-FF)
        Count: 1
        #98: len 21 (1 Kb/s)
        Latency: 159 msec (68-169 msec ~161 msec)
> ACL Data RX: Handle 471 flags 0x02 dlen 21                                                                        #100 6.445403
      SMP: Pairing Confirm (0x03) len 16
        Confim value: 9f8cd251912e2087b2a89a772c6fc61f
zephyr.exe[327043]: < HCI Command: Host Number of Completed Packets (0x03|0x0035) plen 5                            #101 6.465199
        Num handles: 1
        Handle: 471 Address: DF:A9:FF:F6:B1:1A (OUI DF-A9-FF)
        Count: 1
zephyr.exe[327043]: < ACL Data TX: Handle 471 flags 0x00 dlen 21                                                    #102 6.465290
      SMP: Pairing Confirm (0x03) len 16
        Confim value: 27909b336527e7c8f9666faad186680d
> HCI Event: Number of Completed Packets (0x13) plen 5                                                              #103 6.619963
        Num handles: 1
        Handle: 471 Address: DF:A9:FF:F6:B1:1A (OUI DF-A9-FF)
        Count: 1
        #102: len 21 (1 Kb/s)
        Latency: 154 msec (68-169 msec ~158 msec)
> ACL Data RX: Handle 471 flags 0x02 dlen 21                                                                        #104 6.620404
      SMP: Pairing Random (0x04) len 16
        Random value: 2820714c1e0ab3c685b0c088a661ce0f
zephyr.exe[327043]: < HCI Command: Host Number of Completed Packets (0x03|0x0035) plen 5                            #105 6.624720
        Num handles: 1
        Handle: 471 Address: DF:A9:FF:F6:B1:1A (OUI DF-A9-FF)
        Count: 1
zephyr.exe[327043]: < ACL Data TX: Handle 471 flags 0x00 dlen 21                                                    #106 6.624846
      SMP: Pairing Random (0x04) len 16
        Random value: 32527e6e64e79f33b2e374394db8ab2d
> HCI Event: Number of Completed Packets (0x13) plen 5                                                              #107 6.794978
        Num handles: 1
        Handle: 471 Address: DF:A9:FF:F6:B1:1A (OUI DF-A9-FF)
        Count: 1
        #106: len 21 (0 Kb/s)
        Latency: 170 msec (68-170 msec ~164 msec)
> ACL Data RX: Handle 471 flags 0x02 dlen 21                                                                        #108 6.795373
      SMP: Pairing Confirm (0x03) len 16
        Confim value: 2711ecdec31de00e0df04f84ae4724ac
zephyr.exe[327043]: < HCI Command: Host Number of Completed Packets (0x03|0x0035) plen 5                            #109 6.805120
        Num handles: 1
        Handle: 471 Address: DF:A9:FF:F6:B1:1A (OUI DF-A9-FF)
        Count: 1
zephyr.exe[327043]: < ACL Data TX: Handle 471 flags 0x00 dlen 21                                                    #110 6.805250
      SMP: Pairing Confirm (0x03) len 16
        Confim value: 26e31b3e302bebb6fea86fda7e613aff
> HCI Event: Number of Completed Packets (0x13) plen 5                                                              #111 6.970022
        Num handles: 1
        Handle: 471 Address: DF:A9:FF:F6:B1:1A (OUI DF-A9-FF)
        Count: 1
        #110: len 21 (1 Kb/s)
        Latency: 164 msec (68-170 msec ~164 msec)
> ACL Data RX: Handle 471 flags 0x02 dlen 21                                                                        #112 6.970470
      SMP: Pairing Random (0x04) len 16
        Random value: 83095b97b6f2ec154a5d1baa14bf1182
zephyr.exe[327043]: < HCI Command: Host Number of Completed Packets (0x03|0x0035) plen 5                            #113 6.985106
        Num handles: 1
        Handle: 471 Address: DF:A9:FF:F6:B1:1A (OUI DF-A9-FF)
        Count: 1
zephyr.exe[327043]: < ACL Data TX: Handle 471 flags 0x00 dlen 21                                                    #114 6.985204
      SMP: Pairing Random (0x04) len 16
        Random value: dddbdfe2838e9a8cc6964353c850fef7
> HCI Event: Number of Completed Packets (0x13) plen 5                                                              #115 7.144903
        Num handles: 1
        Handle: 471 Address: DF:A9:FF:F6:B1:1A (OUI DF-A9-FF)
        Count: 1
        #114: len 21 (1 Kb/s)
        Latency: 159 msec (68-170 msec ~162 msec)
> ACL Data RX: Handle 471 flags 0x02 dlen 21                                                                        #116 7.145265
      SMP: Pairing Confirm (0x03) len 16
        Confim value: 8953f50be5baa224ba3bc48eadb133d9
zephyr.exe[327043]: < HCI Command: Host Number of Completed Packets (0x03|0x0035) plen 5                            #117 7.164781
        Num handles: 1
        Handle: 471 Address: DF:A9:FF:F6:B1:1A (OUI DF-A9-FF)
        Count: 1
zephyr.exe[327043]: < ACL Data TX: Handle 471 flags 0x00 dlen 21                                                    #118 7.164834
      SMP: Pairing Confirm (0x03) len 16
        Confim value: f8e9c2389fa8f98b80e2502f440140d2
> HCI Event: Number of Completed Packets (0x13) plen 5                                                              #119 7.319948
        Num handles: 1
        Handle: 471 Address: DF:A9:FF:F6:B1:1A (OUI DF-A9-FF)
        Count: 1
        #118: len 21 (1 Kb/s)
        Latency: 155 msec (68-170 msec ~158 msec)
> ACL Data RX: Handle 471 flags 0x02 dlen 21                                                                        #120 7.320208
      SMP: Pairing Random (0x04) len 16
        Random value: 1e0b8128fb2550069f0a652c26169c38
zephyr.exe[327043]: < HCI Command: Host Number of Completed Packets (0x03|0x0035) plen 5                            #121 7.325222
        Num handles: 1
        Handle: 471 Address: DF:A9:FF:F6:B1:1A (OUI DF-A9-FF)
        Count: 1
zephyr.exe[327043]: < ACL Data TX: Handle 471 flags 0x00 dlen 21                                                    #122 7.325281
      SMP: Pairing Random (0x04) len 16
        Random value: eb9f1915536596b6fc3db1c86b2b1970
> HCI Event: Number of Completed Packets (0x13) plen 5                                                              #123 7.494842
        Num handles: 1
        Handle: 471 Address: DF:A9:FF:F6:B1:1A (OUI DF-A9-FF)
        Count: 1
        #122: len 21 (0 Kb/s)
        Latency: 169 msec (68-170 msec ~164 msec)
> ACL Data RX: Handle 471 flags 0x02 dlen 21                                                                        #124 7.495319
      SMP: Pairing Confirm (0x03) len 16
        Confim value: 475adbb1be375668d8b6e50d86068b50
zephyr.exe[327043]: < HCI Command: Host Number of Completed Packets (0x03|0x0035) plen 5                            #125 7.504606
        Num handles: 1
        Handle: 471 Address: DF:A9:FF:F6:B1:1A (OUI DF-A9-FF)
        Count: 1
zephyr.exe[327043]: < ACL Data TX: Handle 471 flags 0x00 dlen 21                                                    #126 7.504651
      SMP: Pairing Confirm (0x03) len 16
        Confim value: ea1cb2f7ecb148aa11b7b3d88a59ee5e
> HCI Event: Number of Completed Packets (0x13) plen 5                                                              #127 7.670005
        Num handles: 1
        Handle: 471 Address: DF:A9:FF:F6:B1:1A (OUI DF-A9-FF)
        Count: 1
        #126: len 21 (1 Kb/s)
        Latency: 165 msec (68-170 msec ~164 msec)
> ACL Data RX: Handle 471 flags 0x02 dlen 21                                                                        #128 7.670319
      SMP: Pairing Random (0x04) len 16
        Random value: ca8e6c7d70789904b4fc886cbf1b887e
zephyr.exe[327043]: < HCI Command: Host Number of Completed Packets (0x03|0x0035) plen 5                            #129 7.684608
        Num handles: 1
        Handle: 471 Address: DF:A9:FF:F6:B1:1A (OUI DF-A9-FF)
        Count: 1
zephyr.exe[327043]: < ACL Data TX: Handle 471 flags 0x00 dlen 21                                                    #130 7.684670
      SMP: Pairing Random (0x04) len 16
        Random value: 5c794dc9ad9f2c3f295ebd5ad5e1c3cf
> HCI Event: Number of Completed Packets (0x13) plen 5                                                              #131 7.844935
        Num handles: 1
        Handle: 471 Address: DF:A9:FF:F6:B1:1A (OUI DF-A9-FF)
        Count: 1
        #130: len 21 (1 Kb/s)
        Latency: 160 msec (68-170 msec ~162 msec)
> ACL Data RX: Handle 471 flags 0x02 dlen 21                                                                        #132 7.845306
      SMP: Pairing Confirm (0x03) len 16
        Confim value: 5702d24cb56aa6e7f9c43e7f888bbd7e
zephyr.exe[327043]: < HCI Command: Host Number of Completed Packets (0x03|0x0035) plen 5                            #133 7.865233
        Num handles: 1
        Handle: 471 Address: DF:A9:FF:F6:B1:1A (OUI DF-A9-FF)
        Count: 1
zephyr.exe[327043]: < ACL Data TX: Handle 471 flags 0x00 dlen 21                                                    #134 7.865414
      SMP: Pairing Confirm (0x03) len 16
        Confim value: 7bf4d297bf7a32bfcc1929150ba8fe6a
> HCI Event: Number of Completed Packets (0x13) plen 5                                                              #135 8.020005
        Num handles: 1
        Handle: 471 Address: DF:A9:FF:F6:B1:1A (OUI DF-A9-FF)
        Count: 1
        #134: len 21 (1 Kb/s)
        Latency: 154 msec (68-170 msec ~158 msec)
> ACL Data RX: Handle 471 flags 0x02 dlen 21                                                                        #136 8.020242
      SMP: Pairing Random (0x04) len 16
        Random value: 9835e652d401c1befbb8ae0500c22ee0
zephyr.exe[327043]: < HCI Command: Host Number of Completed Packets (0x03|0x0035) plen 5                            #137 8.025120
        Num handles: 1
        Handle: 471 Address: DF:A9:FF:F6:B1:1A (OUI DF-A9-FF)
        Count: 1
zephyr.exe[327043]: < ACL Data TX: Handle 471 flags 0x00 dlen 21                                                    #138 8.025294
      SMP: Pairing Random (0x04) len 16
        Random value: 5c2fff312cdf99c9491988e877355a9a
> HCI Event: Number of Completed Packets (0x13) plen 5                                                              #139 8.194855
        Num handles: 1
        Handle: 471 Address: DF:A9:FF:F6:B1:1A (OUI DF-A9-FF)
        Count: 1
        #138: len 21 (0 Kb/s)
        Latency: 169 msec (68-170 msec ~164 msec)
> ACL Data RX: Handle 471 flags 0x02 dlen 21                                                                        #140 8.195275
      SMP: Pairing Confirm (0x03) len 16
        Confim value: af1588c1f413fd1f14da8b42e4fdbfc4
zephyr.exe[327043]: < HCI Command: Host Number of Completed Packets (0x03|0x0035) plen 5                            #141 8.205306
        Num handles: 1
        Handle: 471 Address: DF:A9:FF:F6:B1:1A (OUI DF-A9-FF)
        Count: 1
zephyr.exe[327043]: < ACL Data TX: Handle 471 flags 0x00 dlen 21                                                    #142 8.205419
      SMP: Pairing Confirm (0x03) len 16
        Confim value: 8dadd9fa6248f09e366b0f4796a32458
> HCI Event: Number of Completed Packets (0x13) plen 5                                                              #143 8.369951
        Num handles: 1
        Handle: 471 Address: DF:A9:FF:F6:B1:1A (OUI DF-A9-FF)
        Count: 1
        #142: len 21 (1 Kb/s)
        Latency: 164 msec (68-170 msec ~164 msec)
> ACL Data RX: Handle 471 flags 0x02 dlen 21                                                                        #144 8.370233
      SMP: Pairing Random (0x04) len 16
        Random value: d9e6f7a52915002024033ed54842262d
zephyr.exe[327043]: < HCI Command: Host Number of Completed Packets (0x03|0x0035) plen 5                            #145 8.385137
        Num handles: 1
        Handle: 471 Address: DF:A9:FF:F6:B1:1A (OUI DF-A9-FF)
        Count: 1
zephyr.exe[327043]: < ACL Data TX: Handle 471 flags 0x00 dlen 21                                                    #146 8.385257
      SMP: Pairing Random (0x04) len 16
        Random value: c629a3a987d808e808655d558dfc1155
zephyr.exe[327043]: < ACL Data TX: Handle 471 flags 0x00 dlen 16                                                    #147 8.494562
      LE L2CAP: Connection Parameter Update Request (0x12) ident 1 len 8
        Min interval: 24
        Max interval: 40
        Peripheral latency: 0
        Timeout multiplier: 42
> HCI Event: Number of Completed Packets (0x13) plen 5                                                              #148 8.544862
        Num handles: 1
        Handle: 471 Address: DF:A9:FF:F6:B1:1A (OUI DF-A9-FF)
        Count: 1
        #146: len 21 (1 Kb/s)
        Latency: 159 msec (68-170 msec ~161 msec)
> ACL Data RX: Handle 471 flags 0x02 dlen 21                                                                        #149 8.545124
      SMP: Pairing Confirm (0x03) len 16
        Confim value: 3d4ea63228abaf02f0f1379d5dcb35f3
zephyr.exe[327043]: < HCI Command: Host Number of Completed Packets (0x03|0x0035) plen 5                            #150 8.565219
        Num handles: 1
        Handle: 471 Address: DF:A9:FF:F6:B1:1A (OUI DF-A9-FF)
        Count: 1
zephyr.exe[327043]: < ACL Data TX: Handle 471 flags 0x00 dlen 21                                                    #151 8.565292
      SMP: Pairing Confirm (0x03) len 16
        Confim value: 345c7df037feb594270a6208b17c7184
> HCI Event: Number of Completed Packets (0x13) plen 5                                                              #152 8.632273
        Num handles: 1
        Handle: 471 Address: DF:A9:FF:F6:B1:1A (OUI DF-A9-FF)
        Count: 1
        #147: len 16 (0 Kb/s)
        Latency: 137 msec (68-170 msec ~149 msec)
> ACL Data RX: Handle 471 flags 0x02 dlen 10                                                                        #153 8.632481
      LE L2CAP: Connection Parameter Update Response (0x13) ident 1 len 2
        Result: Connection Parameters accepted (0x0000)
zephyr.exe[327043]: < HCI Command: Host Number of Completed Packets (0x03|0x0035) plen 5                            #154 8.645142
        Num handles: 1
        Handle: 471 Address: DF:A9:FF:F6:B1:1A (OUI DF-A9-FF)
        Count: 1
> HCI Event: Number of Completed Packets (0x13) plen 5                                                              #155 8.719855
        Num handles: 1
        Handle: 471 Address: DF:A9:FF:F6:B1:1A (OUI DF-A9-FF)
        Count: 1
        #151: len 21 (1 Kb/s)
        Latency: 154 msec (68-170 msec ~152 msec)
> ACL Data RX: Handle 471 flags 0x02 dlen 21                                                                        #156 8.720181
      SMP: Pairing Random (0x04) len 16
        Random value: 1ec5e8b2b047cf5821e3e2fa3a0e4a70
zephyr.exe[327043]: < HCI Command: Host Number of Completed Packets (0x03|0x0035) plen 5                            #157 8.724872
        Num handles: 1
        Handle: 471 Address: DF:A9:FF:F6:B1:1A (OUI DF-A9-FF)
        Count: 1
zephyr.exe[327043]: < ACL Data TX: Handle 471 flags 0x00 dlen 21                                                    #158 8.724931
      SMP: Pairing Random (0x04) len 16
        Random value: 92f20f6ad8f13724432c7fd6001c45ff
> HCI Event: Number of Completed Packets (0x13) plen 5                                                              #159 8.895087
        Num handles: 1
        Handle: 471 Address: DF:A9:FF:F6:B1:1A (OUI DF-A9-FF)
        Count: 1
        #158: len 21 (0 Kb/s)
        Latency: 170 msec (68-170 msec ~161 msec)
> ACL Data RX: Handle 471 flags 0x02 dlen 21                                                                        #160 8.895231
      SMP: Pairing Confirm (0x03) len 16
        Confim value: 7614e8949d63a2233ebbb3a1471a4312
zephyr.exe[327043]: < HCI Command: Host Number of Completed Packets (0x03|0x0035) plen 5                            #161 8.904592
        Num handles: 1
        Handle: 471 Address: DF:A9:FF:F6:B1:1A (OUI DF-A9-FF)
        Count: 1
zephyr.exe[327043]: < ACL Data TX: Handle 471 flags 0x00 dlen 21                                                    #162 8.904668
      SMP: Pairing Confirm (0x03) len 16
        Confim value: 16a5ae58c8dc1977161c088dae43639f
> HCI Event: Number of Completed Packets (0x13) plen 5                                                              #163 9.069863
        Num handles: 1
        Handle: 471 Address: DF:A9:FF:F6:B1:1A (OUI DF-A9-FF)
        Count: 1
        #162: len 21 (1 Kb/s)
        Latency: 165 msec (68-170 msec ~163 msec)
> ACL Data RX: Handle 471 flags 0x02 dlen 21                                                                        #164 9.070225
      SMP: Pairing Random (0x04) len 16
        Random value: 383843f7ea6fe8d1239b84cfb6ddb2f7
zephyr.exe[327043]: < HCI Command: Host Number of Completed Packets (0x03|0x0035) plen 5                            #165 9.085168
        Num handles: 1
        Handle: 471 Address: DF:A9:FF:F6:B1:1A (OUI DF-A9-FF)
        Count: 1
zephyr.exe[327043]: < ACL Data TX: Handle 471 flags 0x00 dlen 21                                                    #166 9.085266
      SMP: Pairing Random (0x04) len 16
        Random value: 23ac32ebbb5e14c8a6b9622f296d277f
> HCI Event: Number of Completed Packets (0x13) plen 5                                                              #167 9.244936
        Num handles: 1
        Handle: 471 Address: DF:A9:FF:F6:B1:1A (OUI DF-A9-FF)
        Count: 1
        #166: len 21 (1 Kb/s)
        Latency: 159 msec (68-170 msec ~161 msec)
> ACL Data RX: Handle 471 flags 0x02 dlen 21                                                                        #168 9.245216
      SMP: Pairing Confirm (0x03) len 16
        Confim value: 3ea3196e93b18e08bab059680b70737c
zephyr.exe[327043]: < HCI Command: Host Number of Completed Packets (0x03|0x0035) plen 5                            #169 9.264853
        Num handles: 1
        Handle: 471 Address: DF:A9:FF:F6:B1:1A (OUI DF-A9-FF)
        Count: 1
zephyr.exe[327043]: < ACL Data TX: Handle 471 flags 0x00 dlen 21                                                    #170 9.264960
      SMP: Pairing Confirm (0x03) len 16
        Confim value: 42ba80e0d568aff66b079fb4b8fc543e
> HCI Event: Number of Completed Packets (0x13) plen 5                                                              #171 9.419857
        Num handles: 1
        Handle: 471 Address: DF:A9:FF:F6:B1:1A (OUI DF-A9-FF)
        Count: 1
        #170: len 21 (1 Kb/s)
        Latency: 154 msec (68-170 msec ~158 msec)
> ACL Data RX: Handle 471 flags 0x02 dlen 21                                                                        #172 9.420266
      SMP: Pairing Random (0x04) len 16
        Random value: 38e4d130989f423a9ab24bf2dea2b94e
zephyr.exe[327043]: < HCI Command: Host Number of Completed Packets (0x03|0x0035) plen 5                            #173 9.425066
        Num handles: 1
        Handle: 471 Address: DF:A9:FF:F6:B1:1A (OUI DF-A9-FF)
        Count: 1
zephyr.exe[327043]: < ACL Data TX: Handle 471 flags 0x00 dlen 21                                                    #174 9.425178
      SMP: Pairing Random (0x04) len 16
        Random value: 297efe85e67448a15f56bd27e3a3cf1d
> HCI Event: Number of Completed Packets (0x13) plen 5                                                              #175 9.594902
        Num handles: 1
        Handle: 471 Address: DF:A9:FF:F6:B1:1A (OUI DF-A9-FF)
        Count: 1
        #174: len 21 (0 Kb/s)
        Latency: 169 msec (68-170 msec ~163 msec)
> ACL Data RX: Handle 471 flags 0x02 dlen 21                                                                        #176 9.595149
      SMP: Pairing Confirm (0x03) len 16
        Confim value: 5d6d51d9a6496be35aaae734d211d8c5
zephyr.exe[327043]: < HCI Command: Host Number of Completed Packets (0x03|0x0035) plen 5                            #177 9.605216
        Num handles: 1
        Handle: 471 Address: DF:A9:FF:F6:B1:1A (OUI DF-A9-FF)
        Count: 1
zephyr.exe[327043]: < ACL Data TX: Handle 471 flags 0x00 dlen 21                                                    #178 9.605312
      SMP: Pairing Confirm (0x03) len 16
        Confim value: 369ff88d0b8e3fedc76568405766a99f
> HCI Event: Number of Completed Packets (0x13) plen 5                                                              #179 9.769893
        Num handles: 1
        Handle: 471 Address: DF:A9:FF:F6:B1:1A (OUI DF-A9-FF)
        Count: 1
        #178: len 21 (1 Kb/s)
        Latency: 164 msec (68-170 msec ~164 msec)
> ACL Data RX: Handle 471 flags 0x02 dlen 21                                                                        #180 9.770173
      SMP: Pairing Random (0x04) len 16
        Random value: 70ad9a5bba2e187f38eca1411293f644
zephyr.exe[327043]: < HCI Command: Host Number of Completed Packets (0x03|0x0035) plen 5                            #181 9.785018
        Num handles: 1
        Handle: 471 Address: DF:A9:FF:F6:B1:1A (OUI DF-A9-FF)
        Count: 1
zephyr.exe[327043]: < ACL Data TX: Handle 471 flags 0x00 dlen 21                                                    #182 9.785127
      SMP: Pairing Random (0x04) len 16
        Random value: 25a9493fd3ce4faf02be7293595bb7c6
> HCI Event: Number of Completed Packets (0x13) plen 5                                                              #183 9.944931
        Num handles: 1
        Handle: 471 Address: DF:A9:FF:F6:B1:1A (OUI DF-A9-FF)
        Count: 1
        #182: len 21 (1 Kb/s)
        Latency: 159 msec (68-170 msec ~162 msec)
> ACL Data RX: Handle 471 flags 0x02 dlen 21                                                                        #184 9.945167
      SMP: Pairing Confirm (0x03) len 16
        Confim value: 0169fd08c1c0dbbef74bc6380e50295a
zephyr.exe[327043]: < HCI Command: Host Number of Completed Packets (0x03|0x0035) plen 5                            #185 9.965248
        Num handles: 1
        Handle: 471 Address: DF:A9:FF:F6:B1:1A (OUI DF-A9-FF)
        Count: 1
zephyr.exe[327043]: < ACL Data TX: Handle 471 flags 0x00 dlen 21                                                    #186 9.965351
      SMP: Pairing Confirm (0x03) len 16
        Confim value: 2f38770e9f0d068d0b138e98b40fa039
> HCI Event: Number of Completed Packets (0x13) plen 5                                                             #187 10.119841
        Num handles: 1
        Handle: 471 Address: DF:A9:FF:F6:B1:1A (OUI DF-A9-FF)
        Count: 1
        #186: len 21 (1 Kb/s)
        Latency: 154 msec (68-170 msec ~158 msec)
> ACL Data RX: Handle 471 flags 0x02 dlen 21                                                                       #188 10.120270
      SMP: Pairing Random (0x04) len 16
        Random value: 6fb9e7b493b0e2ceed4e2fd7f32542e4
zephyr.exe[327043]: < HCI Command: Host Number of Completed Packets (0x03|0x0035) plen 5                           #189 10.125158
        Num handles: 1
        Handle: 471 Address: DF:A9:FF:F6:B1:1A (OUI DF-A9-FF)
        Count: 1
zephyr.exe[327043]: < ACL Data TX: Handle 471 flags 0x00 dlen 21                                                   #190 10.125279
      SMP: Pairing Random (0x04) len 16
        Random value: 58f6b41f855a6f6c3560debd84e2affc
> HCI Event: Number of Completed Packets (0x13) plen 5                                                             #191 10.294945
        Num handles: 1
        Handle: 471 Address: DF:A9:FF:F6:B1:1A (OUI DF-A9-FF)
        Count: 1
        #190: len 21 (0 Kb/s)
        Latency: 169 msec (68-170 msec ~163 msec)
> ACL Data RX: Handle 471 flags 0x02 dlen 21                                                                       #192 10.295166
      SMP: Pairing Confirm (0x03) len 16
        Confim value: 5e44b36b0841f1acc1670aba25b14d0c
zephyr.exe[327043]: < HCI Command: Host Number of Completed Packets (0x03|0x0035) plen 5                           #193 10.305144
        Num handles: 1
        Handle: 471 Address: DF:A9:FF:F6:B1:1A (OUI DF-A9-FF)
        Count: 1
zephyr.exe[327043]: < ACL Data TX: Handle 471 flags 0x00 dlen 21                                                   #194 10.305258
      SMP: Pairing Confirm (0x03) len 16
        Confim value: 396a1907963ab99391c11ef96acc99fd
> HCI Event: Number of Completed Packets (0x13) plen 5                                                             #195 10.469880
        Num handles: 1
        Handle: 471 Address: DF:A9:FF:F6:B1:1A (OUI DF-A9-FF)
        Count: 1
        #194: len 21 (1 Kb/s)
        Latency: 164 msec (68-170 msec ~164 msec)
> ACL Data RX: Handle 471 flags 0x02 dlen 21                                                                       #196 10.470217
      SMP: Pairing Random (0x04) len 16
        Random value: 086d42b9a2fb5992eb1dde12630db87c
zephyr.exe[327043]: < HCI Command: Host Number of Completed Packets (0x03|0x0035) plen 5                           #197 10.485313
        Num handles: 1
        Handle: 471 Address: DF:A9:FF:F6:B1:1A (OUI DF-A9-FF)
        Count: 1
zephyr.exe[327043]: < ACL Data TX: Handle 471 flags 0x00 dlen 21                                                   #198 10.485420
      SMP: Pairing Random (0x04) len 16
        Random value: b67e7216d5bf664139eda2b542549666
> HCI Event: Number of Completed Packets (0x13) plen 5                                                             #199 10.644802
        Num handles: 1
        Handle: 471 Address: DF:A9:FF:F6:B1:1A (OUI DF-A9-FF)
        Count: 1
        #198: len 21 (1 Kb/s)
        Latency: 159 msec (68-170 msec ~161 msec)
> ACL Data RX: Handle 471 flags 0x02 dlen 21                                                                       #200 10.645173
      SMP: Pairing Confirm (0x03) len 16
        Confim value: eb69db083cbb90afd9a2692adc9c84b8
zephyr.exe[327043]: < HCI Command: Host Number of Completed Packets (0x03|0x0035) plen 5                           #201 10.665281
        Num handles: 1
        Handle: 471 Address: DF:A9:FF:F6:B1:1A (OUI DF-A9-FF)
        Count: 1
zephyr.exe[327043]: < ACL Data TX: Handle 471 flags 0x00 dlen 21                                                   #202 10.665339
      SMP: Pairing Confirm (0x03) len 16
        Confim value: ec58c00c0c16a5b8ad62e8a7b387c319
> HCI Event: Number of Completed Packets (0x13) plen 5                                                             #203 10.819946
        Num handles: 1
        Handle: 471 Address: DF:A9:FF:F6:B1:1A (OUI DF-A9-FF)
        Count: 1
        #202: len 21 (1 Kb/s)
        Latency: 154 msec (68-170 msec ~158 msec)
> ACL Data RX: Handle 471 flags 0x02 dlen 21                                                                       #204 10.820154
      SMP: Pairing Random (0x04) len 16
        Random value: 4a6d7426a923777aa2ded7908240af99
zephyr.exe[327043]: < HCI Command: Host Number of Completed Packets (0x03|0x0035) plen 5                           #205 10.825223
        Num handles: 1
        Handle: 471 Address: DF:A9:FF:F6:B1:1A (OUI DF-A9-FF)
        Count: 1
zephyr.exe[327043]: < ACL Data TX: Handle 471 flags 0x00 dlen 21                                                   #206 10.825382
      SMP: Pairing Random (0x04) len 16
        Random value: ed17f76500c95219dd01e09d1e63f87b
> HCI Event: Number of Completed Packets (0x13) plen 5                                                             #207 10.994823
        Num handles: 1
        Handle: 471 Address: DF:A9:FF:F6:B1:1A (OUI DF-A9-FF)
        Count: 1
        #206: len 21 (0 Kb/s)
        Latency: 169 msec (68-170 msec ~163 msec)
> ACL Data RX: Handle 471 flags 0x02 dlen 21                                                                       #208 10.996195
      SMP: Pairing Confirm (0x03) len 16
        Confim value: d3a3a1668ed9844b17876d8fd8235797
zephyr.exe[327043]: < HCI Command: Host Number of Completed Packets (0x03|0x0035) plen 5                           #209 11.005310
        Num handles: 1
        Handle: 471 Address: DF:A9:FF:F6:B1:1A (OUI DF-A9-FF)
        Count: 1
zephyr.exe[327043]: < ACL Data TX: Handle 471 flags 0x00 dlen 21                                                   #210 11.005463
      SMP: Pairing Confirm (0x03) len 16
        Confim value: 2f70b34060f93f7057d277504785d974
> HCI Event: Number of Completed Packets (0x13) plen 5                                                             #211 11.169858
        Num handles: 1
        Handle: 471 Address: DF:A9:FF:F6:B1:1A (OUI DF-A9-FF)
        Count: 1
        #210: len 21 (1 Kb/s)
        Latency: 164 msec (68-170 msec ~164 msec)
> ACL