Bluetooth monitor ver 5.72
= Note: Linux version 6.14.0-36-generic (x86_64)                       0.596070
= Note: Bluetooth subsystem version 2.22                               0.596072
= New Index: 00:00:00:00:00:00 (Primary,UART,hci1)              [hci1] 0.596073
= New Index: 48:5F:99:8E:E0:64 (Primary,USB,hci0)               [hci0] 0.596074
= Open Index: 00:00:00:00:00:00                                 [hci1] 1.109899
= Index Info: 00:00:00:00:00:00 (Nordic Semiconductor ASA)      [hci1] 1.109924
@ USER Open: main (privileged) version 2.22            {0x0001} [hci1] 1.109934
< HCI Command: Reset (0x03|0x0003) plen 0                    #1 [hci1] 1.111601
> HCI Event: Command Complete (0x0e) plen 4                  #2 [hci1] 1.112138
      Reset (0x03|0x0003) ncmd 1
        Status: Success (0x00)
< HCI Command: Read Local Supported... (0x04|0x0003) plen 0  #3 [hci1] 1.129559
> HCI Event: Command Complete (0x0e) plen 12                 #4 [hci1] 1.130119
      Read Local Supported Features (0x04|0x0003) ncmd 1
        Status: Success (0x00)
        Features: 0x00 0x00 0x00 0x00 0x60 0x00 0x00 0x00
          BR/EDR Not Supported
          LE Supported (Controller)
< HCI Command: Read Local Version In.. (0x04|0x0001) plen 0  #5 [hci1] 1.149411
> HCI Event: Command Complete (0x0e) plen 12                 #6 [hci1] 1.149917
      Read Local Version Information (0x04|0x0001) ncmd 1
        Status: Success (0x00)
        HCI version: Reserved (0x0f) - Revision 12393 (0x3069)
        LMP version: Reserved (0x0f) - Subversion 12393 (0x3069)
        Manufacturer: Nordic Semiconductor ASA (89)
< HCI Command: Read Local Supported... (0x04|0x0002) plen 0  #7 [hci1] 1.169298
> HCI Event: Command Complete (0x0e) plen 68                 #8 [hci1] 1.170368
      Read Local Supported Commands (0x04|0x0002) ncmd 1
        Status: Success (0x00)
        Commands: 119 entries
          Disconnect (Octet 0 - Bit 5)
          Read Remote Version Information (Octet 2 - Bit 7)
          Set Event Mask (Octet 5 - Bit 6)
          Reset (Octet 5 - Bit 7)
          Read Connection Accept Timeout (Octet 7 - Bit 2)
          Write Connection Accept Timeout (Octet 7 - Bit 3)
          Read Transmit Power Level (Octet 10 - Bit 2)
          Set Controller To Host Flow Control (Octet 10 - Bit 5)
          Host Buffer Size (Octet 10 - Bit 6)
          Host Number of Completed Packets (Octet 10 - Bit 7)
          Read Local Version Information (Octet 14 - Bit 3)
          Read Local Supported Features (Octet 14 - Bit 5)
          Read BD ADDR (Octet 15 - Bit 1)
          Read RSSI (Octet 15 - Bit 5)
          Set Event Mask Page 2 (Octet 22 - Bit 2)
          LE Set Event Mask (Octet 25 - Bit 0)
          LE Read Buffer Size (Octet 25 - Bit 1)
          LE Read Local Supported Features (Octet 25 - Bit 2)
          LE Set Random Address (Octet 25 - Bit 4)
          LE Set Advertising Parameters (Octet 25 - Bit 5)
          LE Read Advertising Channel TX Power (Octet 25 - Bit 6)
          LE Set Advertising Data (Octet 25 - Bit 7)
          LE Set Scan Response Data (Octet 26 - Bit 0)
          LE Set Advertise Enable (Octet 26 - Bit 1)
          LE Set Scan Parameters (Octet 26 - Bit 2)
          LE Set Scan Enable (Octet 26 - Bit 3)
          LE Create Connection (Octet 26 - Bit 4)
          LE Create Connection Cancel (Octet 26 - Bit 5)
          LE Read Accept List Size (Octet 26 - Bit 6)
          LE Clear Accept List (Octet 26 - Bit 7)
          LE Add Device To Accept List (Octet 27 - Bit 0)
          LE Remove Device From Accept List (Octet 27 - Bit 1)
          LE Connection Update (Octet 27 - Bit 2)
          LE Set Host Channel Classification (Octet 27 - Bit 3)
          LE Read Channel Map (Octet 27 - Bit 4)
          LE Read Remote Used Features (Octet 27 - Bit 5)
          LE Encrypt (Octet 27 - Bit 6)
          LE Rand (Octet 27 - Bit 7)
          LE Start Encryption (Octet 28 - Bit 0)
          LE Long Term Key Request Reply (Octet 28 - Bit 1)
          LE Long Term Key Request Neg Reply (Octet 28 - Bit 2)
          LE Read Supported States (Octet 28 - Bit 3)
          LE Receiver Test (Octet 28 - Bit 4)
          LE Transmitter Test (Octet 28 - Bit 5)
          LE Test End (Octet 28 - Bit 6)
          Read Authenticated Payload Timeout (Octet 32 - Bit 4)
          Write Authenticated Payload Timeout (Octet 32 - Bit 5)
          LE Set Data Length (Octet 33 - Bit 6)
          LE Read Suggested Default Data Length (Octet 33 - Bit 7)
          LE Write Suggested Default Data Length (Octet 34 - Bit 0)
          LE Add Device To Resolving List (Octet 34 - Bit 3)
          LE Remove Device From Resolving List (Octet 34 - Bit 4)
          LE Clear Resolving List (Octet 34 - Bit 5)
          LE Read Resolving List Size (Octet 34 - Bit 6)
          LE Set Address Resolution Enable (Octet 35 - Bit 1)
          LE Set Resolvable Private Address Timeout (Octet 35 - Bit 2)
          LE Read Maximum Data Length (Octet 35 - Bit 3)
          LE Read PHY (Octet 35 - Bit 4)
          LE Set Default PHY (Octet 35 - Bit 5)
          LE Set PHY (Octet 35 - Bit 6)
          LE Enhanced Receiver Test (Octet 35 - Bit 7)
          LE Enhanced Transmitter Test (Octet 36 - Bit 0)
          LE Set Advertising Set Random Address (Octet 36 - Bit 1)
          LE Set Extended Advertising Parameters (Octet 36 - Bit 2)
          LE Set Extended Advertising Data (Octet 36 - Bit 3)
          LE Set Extended Scan Response Data (Octet 36 - Bit 4)
          LE Set Extended Advertising Enable (Octet 36 - Bit 5)
          LE Read Maximum Advertising Data Length (Octet 36 - Bit 6)
          LE Read Number of Supported Advertising Sets (Octet 36 - Bit 7)
          LE Remove Advertising Set (Octet 37 - Bit 0)
          LE Clear Advertising Sets (Octet 37 - Bit 1)
          LE Set Periodic Advertising Parameters (Octet 37 - Bit 2)
          LE Set Periodic Advertising Data (Octet 37 - Bit 3)
          LE Set Periodic Advertising Enable (Octet 37 - Bit 4)
          LE Set Extended Scan Parameters (Octet 37 - Bit 5)
          LE Set Extended Scan Enable (Octet 37 - Bit 6)
          LE Extended Create Connection (Octet 37 - Bit 7)
          LE Periodic Advertising Create Sync (Octet 38 - Bit 0)
          LE Periodic Advertising Create Sync Cancel (Octet 38 - Bit 1)
          LE Periodic Advertising Terminate Sync (Octet 38 - Bit 2)
          LE Add Device To Periodic Advertiser List (Octet 38 - Bit 3)
          LE Remove Device From Periodic Advertiser List (Octet 38 - Bit 4)
          LE Clear Periodic Advertiser List (Octet 38 - Bit 5)
          LE Read Periodic Advertiser List Size (Octet 38 - Bit 6)
          LE Read Transmit Power (Octet 38 - Bit 7)
          LE Read RF Path Compensation (Octet 39 - Bit 0)
          LE Write RF Path Compensation (Octet 39 - Bit 1)
          LE Set Privacy Mode (Octet 39 - Bit 2)
          LE Periodic Advertising Receive Enable (Octet 40 - Bit 5)
          LE Periodic Advertising Sync Transfer (Octet 40 - Bit 6)
          LE Periodic Advertising Set Info Transfer (Octet 40 - Bit 7)
          LE Periodic Advertising Sync Transfer Parameters (Octet 41 - Bit 0)
          LE Set Default Periodic Advertisng Sync Transfer Parameters (Octet 41 - Bit 1)
          LE Read Buffer v2 (Octet 41 - Bit 5)
          LE Read ISO TX Sync (Octet 41 - Bit 6)
          LE Set Connected Isochronous Group Parameters (Octet 41 - Bit 7)
          LE Set Connected Isochronous Group Parameters Test (Octet 42 - Bit 0)
          LE Create Connected Isochronous Stream (Octet 42 - Bit 1)
          LE Remove Connected Isochronous Group (Octet 42 - Bit 2)
          LE Accept Connected Isochronous Stream Request (Octet 42 - Bit 3)
          LE Reject Connected Isochronous Stream Request (Octet 42 - Bit 4)
          LE Create Broadcast Isochronous Group (Octet 42 - Bit 5)
          LE Create Broadcast Isochronous Group Test (Octet 42 - Bit 6)
          LE Terminate Broadcast Isochronous Group (Octet 42 - Bit 7)
          LE Broadcast Isochronous Group Create Sync (Octet 43 - Bit 0)
          LE Broadcast Isochronous Group Terminate Sync (Octet 43 - Bit 1)
          LE Request Peer SCA (Octet 43 - Bit 2)
          LE Setup Isochronous Data Path (Octet 43 - Bit 3)
          LE Remove Isochronous Data Path (Octet 43 - Bit 4)
          LE Isochronous Transmit Test (Octet 43 - Bit 5)
          LE Isochronous Receive Test (Octet 43 - Bit 6)
          LE Isochronous Read Test Counters (Octet 43 - Bit 7)
          LE Isochronous Read Test Counters (Octet 44 - Bit 0)
          LE Set Host Feature (Octet 44 - Bit 1)
          Octet 44 - Bit 2 
          Octet 45 - Bit 6 
          Octet 46 - Bit 0 
          Octet 46 - Bit 1 
          Octet 46 - Bit 2 
< HCI Command: Host Buffer Size (0x03|0x0033) plen 7         #9 [hci1] 1.189325
        ACL MTU: 255  ACL max packet: 16
        SCO MTU: 0    SCO max packet: 0
> HCI Event: Command Complete (0x0e) plen 4                 #10 [hci1] 1.189835
      Host Buffer Size (0x03|0x0033) ncmd 1
        Status: Success (0x00)
< HCI Command: Set Controller To Ho.. (0x03|0x0031) plen 1  #11 [hci1] 1.209317
        Flow control: ACL Data Packets (0x01)
> HCI Event: Command Complete (0x0e) plen 4                 #12 [hci1] 1.209760
      Set Controller To Host Flow Control (0x03|0x0031) ncmd 1
        Status: Success (0x00)
< HCI Command: LE Read Local Suppor.. (0x08|0x0003) plen 0  #13 [hci1] 1.229326
> HCI Event: Command Complete (0x0e) plen 12                #14 [hci1] 1.229814
      LE Read Local Supported Features (0x08|0x0003) ncmd 1
        Status: Success (0x00)
        Features: 0xfd 0x79 0x00 0xf7 0x30 0x01 0x00 0x00
          LE Encryption
          Extended Reject Indication
          Peripheral-initiated Features Exchange
          LE Ping
          LE Data Packet Length Extension
          LL Privacy
          Extended Scanner Filter Policies
          LE 2M PHY
          LE Coded PHY
          LE Extended Advertising
          LE Periodic Advertising
          Channel Selection Algorithm #2
          Periodic Advertising Sync Transfer - Sender
          Periodic Advertising Sync Transfer - Recipient
          Sleep Clock Accuracy Updates
          Connected Isochronous Stream - Central
          Connected Isochronous Stream - Peripheral
          Isochronous Broadcaster
          Synchronized Receiver
          Periodic Advertising ADI support
          Connection Subrating
          Unknown features (0x0000010000000000)
< HCI Command: LE Set Host Feature (0x08|0x0074) plen 2     #15 [hci1] 1.249307
        Bit Number: 32
          Connected Isochronous Stream (Host Support)
        Bit Value: 1
> HCI Event: Command Complete (0x0e) plen 4                 #16 [hci1] 1.249795
      LE Set Host Feature (0x08|0x0074) ncmd 1
        Status: Success (0x00)
< HCI Command: LE Read Buffer v2 (0x08|0x0060) plen 0       #17 [hci1] 1.269287
> HCI Event: Command Complete (0x0e) plen 10                #18 [hci1] 1.269786
      LE Read Buffer v2 (0x08|0x0060) ncmd 1
        Status: Success (0x00)
        ACL MTU: 27
        ACL max packet: 3
        ISO MTU: 318
        ISO max packet: 3
< HCI Command: LE Read Maximum Adve.. (0x08|0x003a) plen 0  #19 [hci1] 1.289322
> HCI Event: Command Complete (0x0e) plen 6                 #20 [hci1] 1.289809
      LE Read Maximum Advertising Data Length (0x08|0x003a) ncmd 1
        Status: Success (0x00)
        Max length: 1650
< HCI Command: LE Read Supported St.. (0x08|0x001c) plen 0  #21 [hci1] 1.309284
> HCI Event: Command Complete (0x0e) plen 12                #22 [hci1] 1.309750
      LE Read Supported States (0x08|0x001c) ncmd 1
        Status: Success (0x00)
        States: 0x000003ff3e0306ff
          Non-connectable Advertising State
          Scannable Advertising State
          Connectable Advertising State
          High Duty Cycle Directed Advertising State
          Passive Scanning State
          Active Scanning State
          Initiating State
            and Connection State (Central Role)
          Connection State (Peripheral Role)
          Scannable Advertising State
            and Passive Scanning State
          Connectable Advertising State
            and Passive Scanning State
          Non-connectable Advertising State
            and Initiating State
          Scannable Advertising State
            and Initiating State
          Active Scanning State
            and Connection State (Central Role)
          Passive Scanning State
            and Connection State (Peripheral Role)
          Active Scanning State
            and Connection State (Peripheral Role)
          Initiating State
            and Connection State (Central Role)
            and Central Role & Central Role
          Low Duty Cycle Directed Advertising State
          Connectable Advertising State
            and Initiating State
            and Central Role & Peripheral Role
          High Duty Cycle Directed Advertising State
            and Initiating State
            and Central Role & Peripheral Role
          Low Duty Cycle Directed Advertising State
            and Initiating State
            and Central Role & Peripheral Role
          Connectable Advertising State
            and Connection State (Central Role)
            and Central Role & Peripheral Role
          High Duty Cycle Directed Advertising State
            and Connection State (Central Role)
            and Central Role & Peripheral Role
          Low Duty Cycle Directed Advertising State
            and Connection State (Central Role)
            and Central Role & Peripheral Role
          Connectable Advertising State
            and Connection State (Peripheral Role)
            and Central Role & Peripheral Role
          High Duty Cycle Directed Advertising State
            and Connection State (Peripheral Role)
            and Peripheral Role & Peripheral Role
          Low Duty Cycle Directed Advertising State
            and Connection State (Peripheral Role)
            and Peripheral Role & Peripheral Role
          Initiating State
            and Connection State (Peripheral Role)
            and Central Role & Peripheral Role
< HCI Command: LE Read Maximum Data.. (0x08|0x002f) plen 0  #23 [hci1] 1.329290
> HCI Event: Command Complete (0x0e) plen 12                #24 [hci1] 1.329864
      LE Read Maximum Data Length (0x08|0x002f) ncmd 1
        Status: Success (0x00)
        Max TX octets: 251
        Max TX time: 2704
        Max RX octets: 251
        Max RX time: 2704
< HCI Command: LE Write Suggested D.. (0x08|0x0024) plen 4  #25 [hci1] 1.349297
        TX octets: 251
        TX time: 2704
> HCI Event: Command Complete (0x0e) plen 4                 #26 [hci1] 1.349734
      LE Write Suggested Default Data Length (0x08|0x0024) ncmd 1
        Status: Success (0x00)
< HCI Command: LE Read Resolving Li.. (0x08|0x002a) plen 0  #27 [hci1] 1.369301
> HCI Event: Command Complete (0x0e) plen 5                 #28 [hci1] 1.369664
      LE Read Resolving List Size (0x08|0x002a) ncmd 1
        Status: Success (0x00)
        Size: 8
< HCI Command: LE Set Event Mask (0x08|0x0001) plen 8       #29 [hci1] 1.389277
        Mask: 0x000002023f87fa5e
          LE Advertising Report
          LE Connection Update Complete
          LE Read Remote Used Features Complete
          LE Long Term Key Request
          LE Data Length Change
          LE Enhanced Connection Complete
          LE PHY Update Complete
          LE Extended Advertising Report
          LE Periodic Advertising Sync Established
          LE Periodic Advertising Report
          LE Periodic Advertising Sync Lost
          LE Extended Scan Timeout
          LE Extended Advertising Set Terminated
          LE Scan Request Received
          LE Periodic Advertising Sync Transfer Rvc
          LE CIS Established
          LE CIS Request
          LE Create BIG Complete
          LE Terminate BIG Complete
          LE BIG Sync Estabilished Complete
          LE BIG Sync Lost
          LE BIG Info Advertising Report
          Unknown mask (0x0000020000000000)
> HCI Event: Command Complete (0x0e) plen 4                 #30 [hci1] 1.389748
      LE Set Event Mask (0x08|0x0001) ncmd 1
        Status: Success (0x00)
< HCI Command: Set Event Mask (0x03|0x0001) plen 8          #31 [hci1] 1.409281
        Mask: 0x2000800002008890
          Disconnection Complete
          Encryption Change
          Read Remote Version Information Complete
          Hardware Error
          Data Buffer Overflow
          Encryption Key Refresh Complete
          LE Meta
> HCI Event: Command Complete (0x0e) plen 4                 #32 [hci1] 1.409854
      Set Event Mask (0x03|0x0001) ncmd 1
        Status: Success (0x00)
< HCI Command: Read BD ADDR (0x04|0x0009) plen 0            #33 [hci1] 1.429227
> HCI Event: Command Complete (0x0e) plen 10                #34 [hci1] 1.429785
      Read BD ADDR (0x04|0x0009) ncmd 1
        Status: Success (0x00)
        Address: 00:00:00:00:00:00 (OUI 00-00-00)
< HCI Command: LE Set Random Address (0x08|0x0005) plen 6   #35 [hci1] 1.449278
        Address: D5:B6:CC:31:DB:3B (Static)
> HCI Event: Command Complete (0x0e) plen 4                 #36 [hci1] 1.449758
      LE Set Random Address (0x08|0x0005) ncmd 1
        Status: Success (0x00)
< HCI Command: LE Set Extended Adv.. (0x08|0x0036) plen 25  #37 [hci1] 7.019358
        Handle: 0x00
        Properties: 0x0013
          Connectable
          Scannable
          Use legacy advertising PDUs: ADV_IND
        Min advertising interval: 100.000 msec (0x00a0)
        Max advertising interval: 150.000 msec (0x00f0)
        Channel map: 37, 38, 39 (0x07)
        Own address type: Random (0x01)
        Peer address type: Public (0x00)
        Peer address: 00:00:00:00:00:00 (OUI 00-00-00)
        Filter policy: Allow Scan Request from Any, Allow Connect Request from Any (0x00)
        TX power: Host has no preference (0x7f)
        Primary PHY: LE 1M (0x01)
        Secondary max skip: 0x00
        Secondary PHY: LE 1M (0x01)
        SID: 0x00
        Scan request notifications: Disabled (0x00)
> HCI Event: Command Complete (0x0e) plen 5                 #38 [hci1] 7.020216
      LE Set Extended Advertising Parameters (0x08|0x0036) ncmd 1
        Status: Success (0x00)
        TX power (selected): 0 dbm (0x00)
< HCI Command: LE Set Advertising S.. (0x08|0x0035) plen 7  #39 [hci1] 7.029368
        Advertising handle: 0x00
        Advertising random address: D5:B6:CC:31:DB:3B (Static)
> HCI Event: Command Complete (0x0e) plen 4                 #40 [hci1] 7.029921
      LE Set Advertising Set Random Address (0x08|0x0035) ncmd 1
        Status: Success (0x00)
< HCI Command: LE Set Extended Adv.. (0x08|0x0037) plen 22  #41 [hci1] 7.049345
        Handle: 0x00
        Operation: Complete extended advertising data (0x03)
        Fragment preference: Minimize fragmentation (0x01)
        Data length: 0x12
        Flags: 0x06
          LE General Discoverable Mode
          BR/EDR Not Supported
        Name (complete): Tester_F6B11A
> HCI Event: Command Complete (0x0e) plen 4                 #42 [hci1] 7.050054
      LE Set Extended Advertising Data (0x08|0x0037) ncmd 1
        Status: Success (0x00)
< HCI Command: LE Set Extended Scan.. (0x08|0x0038) plen 4  #43 [hci1] 7.069353
        Handle: 0x00
        Operation: Complete scan response data (0x03)
        Fragment preference: Minimize fragmentation (0x01)
        Data length: 0x00
> HCI Event: Command Complete (0x0e) plen 4                 #44 [hci1] 7.069859
      LE Set Extended Scan Response Data (0x08|0x0038) ncmd 1
        Status: Success (0x00)
< HCI Command: LE Set Extended Adve.. (0x08|0x0039) plen 6  #45 [hci1] 7.089349
        Extended advertising: Enabled (0x01)
        Number of sets: 1 (0x01)
        Entry 0
          Handle: 0x00
          Duration: 0 ms (0x00)
          Max ext adv events: 0
> HCI Event: Command Complete (0x0e) plen 4                 #46 [hci1] 7.089964
      LE Set Extended Advertising Enable (0x08|0x0039) ncmd 1
        Status: Success (0x00)
> HCI Event: LE Meta Event (0x3e) plen 31                   #47 [hci1] 7.202767
      LE Enhanced Connection Complete (0x0a)
        Status: Success (0x00)
        Handle: 381
        Role: Peripheral (0x01)
        Peer address type: Public (0x00)
        Peer address: DF:A9:FF:F6:B1:1A (OUI DF-A9-FF)
        Local resolvable private address: 00:00:00:00:00:00 (Non-Resolvable)
        Peer resolvable private address: 00:00:00:00:00:00 (Non-Resolvable)
        Connection interval: 87.50 msec (0x0046)
        Connection latency: 0 (0x0000)
        Supervision timeout: 25120 msec (0x09d0)
        Central clock accuracy: 0x01
> HCI Event: LE Meta Event (0x3e) plen 6                    #48 [hci1] 7.202824
      LE Advertising Set Terminated (0x12)
        Status: Success (0x00)
        Handle: 0
        Connection handle: 381
        Number of completed extended advertising events: 0
< HCI Command: LE Read Remote Used... (0x08|0x0016) plen 2  #49 [hci1] 7.210409
        Handle: 381 Address: DF:A9:FF:F6:B1:1A (OUI DF-A9-FF)
< ACL Data TX: Handle 381 flags 0x00 dlen 7                 #50 [hci1] 7.210497
      ATT: Exchange MTU Request (0x02) len 2
        Client RX MTU: 251
> HCI Event: Command Status (0x0f) plen 4                   #51 [hci1] 7.210891
      LE Read Remote Used Features (0x08|0x0016) ncmd 1
        Status: Success (0x00)
> HCI Event: Number of Completed Packets (0x13) plen 5      #52 [hci1] 7.378656
        Num handles: 1
        Handle: 381 Address: DF:A9:FF:F6:B1:1A (OUI DF-A9-FF)
        Count: 1
        #50: len 7 (0 Kb/s)
        Latency: 168 msec (168-168 msec ~168 msec)
> HCI Event: LE Meta Event (0x3e) plen 12                   #53 [hci1] 7.466547
      LE Read Remote Used Features (0x04)
        Status: Success (0x00)
        Handle: 381 Address: DF:A9:FF:F6:B1:1A (OUI DF-A9-FF)
        Features: 0x2d 0x49 0x00 0xf7 0x67 0xd8 0x00 0x00
          LE Encryption
          Extended Reject Indication
          Peripheral-initiated Features Exchange
          LE Data Packet Length Extension
          LE 2M PHY
          LE Coded PHY
          Channel Selection Algorithm #2
          Periodic Advertising Sync Transfer - Sender
          Periodic Advertising Sync Transfer - Recipient
          Sleep Clock Accuracy Updates
          Connected Isochronous Stream - Central
          Connected Isochronous Stream - Peripheral
          Isochronous Broadcaster
          Synchronized Receiver
          Connected Isochronous Stream (Host Support)
          LE Power Control Request
          LE Power Control Request
          Connection Subrating
          Connection Subrating (Host Support)
          Unknown features (0x0000d80000000000)
> ACL Data RX: Handle 381 flags 0x02 dlen 11                #54 [hci1] 9.916279
      SMP: Pairing Request (0x01) len 6
        IO capability: KeyboardDisplay (0x04)
        OOB data: Authentication data not present (0x00)
        Authentication requirement: Bonding, MITM, SC, No Keypresses (0x0d)
        Max encryption key size: 16
        Initiator key distribution: EncKey IdKey (0x03)
        Responder key distribution: EncKey IdKey Sign (0x07)
> ACL Data RX: Handle 381 flags 0x02 dlen 7                 #55 [hci1] 9.916751
      ATT: Exchange MTU Response (0x03) len 2
        Server RX MTU: 23
< HCI Command: Host Number of Compl.. (0x03|0x0035) plen 5  #56 [hci1] 9.929616
        Num handles: 1
        Handle: 381 Address: DF:A9:FF:F6:B1:1A (OUI DF-A9-FF)
        Count: 1
< ACL Data TX: Handle 381 flags 0x00 dlen 11                #57 [hci1] 9.929779
      SMP: Pairing Response (0x02) len 6
        IO capability: DisplayOnly (0x00)
        OOB data: Authentication data not present (0x00)
        Authentication requirement: Bonding, No MITM, SC, No Keypresses (0x09)
        Max encryption key size: 16
        Initiator key distribution: IdKey (0x02)
        Responder key distribution: <none> (0x00)
< HCI Command: Host Number of Compl.. (0x03|0x0035) plen 5  #58 [hci1] 9.929936
        Num handles: 1
        Handle: 381 Address: DF:A9:FF:F6:B1:1A (OUI DF-A9-FF)
        Count: 1
> HCI Event: Number of Completed Packets (0x13) plen 5     #59 [hci1] 10.091411
        Num handles: 1
        Handle: 381 Address: DF:A9:FF:F6:B1:1A (OUI DF-A9-FF)
        Count: 1
        #57: len 11 (0 Kb/s)
        Latency: 161 msec (161-168 msec ~164 msec)
> ACL Data RX: Handle 381 flags 0x02 dlen 27               #60 [hci1] 10.091725
> ACL Data RX: Handle 381 flags 0x01 dlen 27               #61 [hci1] 10.092221
> ACL Data RX: Handle 381 flags 0x01 dlen 15               #62 [hci1] 10.092651
      SMP: Pairing Public Key (0x0c) len 64
        X: 91eb60e5fda196d432454c7c328822457a2b1add8001facb8d0b9021c7382e04
        Y: 3a6978c6388f11502b95b48ffcb877e8fe9f9d6bed722ece5b5a31d37618ca13
< HCI Command: Host Number of Comp.. (0x03|0x0035) plen 5  #63 [hci1] 10.110477
        Num handles: 1
        Handle: 381 Address: DF:A9:FF:F6:B1:1A (OUI DF-A9-FF)
        Count: 1
< HCI Command: Host Number of Comp.. (0x03|0x0035) plen 5  #64 [hci1] 10.110602
        Num handles: 1
        Handle: 381 Address: DF:A9:FF:F6:B1:1A (OUI DF-A9-FF)
        Count: 1
< HCI Command: Host Number of Comp.. (0x03|0x0035) plen 5  #65 [hci1] 10.111003
        Num handles: 1
        Handle: 381 Address: DF:A9:FF:F6:B1:1A (OUI DF-A9-FF)
        Count: 1
< ACL Data TX: Handle 381 flags 0x00 dlen 27               #66 [hci1] 10.111122
< ACL Data TX: Handle 381 flags 0x01 dlen 27               #67 [hci1] 10.111133
< ACL Data TX: Handle 381 flags 0x01 dlen 15               #68 [hci1] 10.111161
      SMP: Pairing Public Key (0x0c) len 64
        X: 98308440221e2d910f0e54b71e7ec652857aa9b5a0dc65028824cc19db1226e9
        Y: 67a4816bcb62efb21701e31fdb27561a6217575fb007a8bbdabe7e28b6f68482
> HCI Event: Number of Completed Packets (0x13) plen 5     #69 [hci1] 10.179233
        Num handles: 1
        Handle: 381 Address: DF:A9:FF:F6:B1:1A (OUI DF-A9-FF)
        Count: 1
        #66: len 27 (3 Kb/s)
        Latency: 68 msec (68-168 msec ~116 msec)
> HCI Event: Number of Completed Packets (0x13) plen 5     #70 [hci1] 10.179931
        Num handles: 1
        Handle: 381 Address: DF:A9:FF:F6:B1:1A (OUI DF-A9-FF)
        Count: 1
        #67: len 27 (3 Kb/s)
        Latency: 68 msec (68-168 msec ~92 msec)
> HCI Event: Number of Completed Packets (0x13) plen 5     #71 [hci1] 10.266189
        Num handles: 1
        Handle: 381 Address: DF:A9:FF:F6:B1:1A (OUI DF-A9-FF)
        Count: 1
        #68: len 15 (0 Kb/s)
        Latency: 155 msec (68-168 msec ~123 msec)
> ACL Data RX: Handle 381 flags 0x02 dlen 21               #72 [hci1] 11.228929
      SMP: Pairing Confirm (0x03) len 16
        Confim value: 023b0f705aa3e9a13e889ef1663f31a8
< HCI Command: Host Number of Comp.. (0x03|0x0035) plen 5  #73 [hci1] 11.229460
        Num handles: 1
        Handle: 381 Address: DF:A9:FF:F6:B1:1A (OUI DF-A9-FF)
        Count: 1
< ACL Data TX: Handle 381 flags 0x00 dlen 21               #74 [hci1] 11.229556
      SMP: Pairing Confirm (0x03) len 16
        Confim value: 1148d2ede11d40bfd93eae8457a40285
> HCI Event: Number of Completed Packets (0x13) plen 5     #75 [hci1] 11.403741
        Num handles: 1
        Handle: 381 Address: DF:A9:FF:F6:B1:1A (OUI DF-A9-FF)
        Count: 1
        #74: len 21 (0 Kb/s)
        Latency: 174 msec (68-174 msec ~149 msec)
> ACL Data RX: Handle 381 flags 0x02 dlen 21               #76 [hci1] 11.404111
      SMP: Pairing Random (0x04) len 16
        Random value: 6851f40af588a7320000000000000000
< HCI Command: Host Number of Comp.. (0x03|0x0035) plen 5  #77 [hci1] 11.410434
        Num handles: 1
        Handle: 381 Address: DF:A9:FF:F6:B1:1A (OUI DF-A9-FF)
        Count: 1
< ACL Data TX: Handle 381 flags 0x00 dlen 21               #78 [hci1] 11.410611
      SMP: Pairing Random (0x04) len 16
        Random value: 8e6108f966a694cbe26df70bb96773e6
> HCI Event: Number of Completed Packets (0x13) plen 5     #79 [hci1] 11.578595
        Num handles: 1
        Handle: 381 Address: DF:A9:FF:F6:B1:1A (OUI DF-A9-FF)
        Count: 1
        #78: len 21 (1 Kb/s)
        Latency: 167 msec (68-174 msec ~158 msec)
> ACL Data RX: Handle 381 flags 0x02 dlen 21               #80 [hci1] 11.666414
      SMP: Pairing Confirm (0x03) len 16
        Confim value: e87281f87a96eaa070ddc71a02facbd9
< HCI Command: Host Number of Comp.. (0x03|0x0035) plen 5  #81 [hci1] 11.669977
        Num handles: 1
        Handle: 381 Address: DF:A9:FF:F6:B1:1A (OUI DF-A9-FF)
        Count: 1
< ACL Data TX: Handle 381 flags 0x00 dlen 21               #82 [hci1] 11.670206
      SMP: Pairing Confirm (0x03) len 16
        Confim value: d0046c51444bae9d5836018bf21d6ac2
> HCI Event: Number of Completed Packets (0x13) plen 5     #83 [hci1] 11.841220
        Num handles: 1
        Handle: 381 Address: DF:A9:FF:F6:B1:1A (OUI DF-A9-FF)
        Count: 1
        #82: len 21 (0 Kb/s)
        Latency: 171 msec (68-174 msec ~164 msec)
> ACL Data RX: Handle 381 flags 0x02 dlen 21               #84 [hci1] 11.841610
      SMP: Pairing Random (0x04) len 16
        Random value: 08ad51af5391ff500000000000000000
< HCI Command: Host Number of Comp.. (0x03|0x0035) plen 5  #85 [hci1] 11.850264
        Num handles: 1
        Handle: 381 Address: DF:A9:FF:F6:B1:1A (OUI DF-A9-FF)
        Count: 1
< ACL Data TX: Handle 381 flags 0x00 dlen 21               #86 [hci1] 11.850428
      SMP: Pairing Random (0x04) len 16
        Random value: 4d02679f89a05211af56d8b3da64d21e
> HCI Event: Number of Completed Packets (0x13) plen 5     #87 [hci1] 12.015976
        Num handles: 1
        Handle: 381 Address: DF:A9:FF:F6:B1:1A (OUI DF-A9-FF)
        Count: 1
        #86: len 21 (1 Kb/s)
        Latency: 165 msec (68-174 msec ~165 msec)
> ACL Data RX: Handle 381 flags 0x02 dlen 21               #88 [hci1] 12.103897
      SMP: Pairing Confirm (0x03) len 16
        Confim value: 64943689a250be5b95f249c19e808b1c
< HCI Command: Host Number of Comp.. (0x03|0x0035) plen 5  #89 [hci1] 12.110154
        Num handles: 1
        Handle: 381 Address: DF:A9:FF:F6:B1:1A (OUI DF-A9-FF)
        Count: 1
< ACL Data TX: Handle 381 flags 0x00 dlen 21               #90 [hci1] 12.110437
      SMP: Pairing Confirm (0x03) len 16
        Confim value: d0550e09da9b0e4d356cea14dd92cbf6
> HCI Event: Number of Completed Packets (0x13) plen 5     #91 [hci1] 12.278710
        Num handles: 1
        Handle: 381 Address: DF:A9:FF:F6:B1:1A (OUI DF-A9-FF)
        Count: 1
        #90: len 21 (1 Kb/s)
        Latency: 168 msec (68-174 msec ~166 msec)
> ACL Data RX: Handle 381 flags 0x02 dlen 21               #92 [hci1] 12.279049
      SMP: Pairing Random (0x04) len 16
        Random value: 6a44d1be41a9f1c70000000000000000
< HCI Command: Host Number of Comp.. (0x03|0x0035) plen 5  #93 [hci1] 12.290291
        Num handles: 1
        Handle: 381 Address: DF:A9:FF:F6:B1:1A (OUI DF-A9-FF)
        Count: 1
< ACL Data TX: Handle 381 flags 0x00 dlen 21               #94 [hci1] 12.290406
      SMP: Pairing Random (0x04) len 16
        Random value: 5e8286bc235a02440d0c3424a2acf8fd
> HCI Event: Number of Completed Packets (0x13) plen 5     #95 [hci1] 12.453468
        Num handles: 1
        Handle: 381 Address: DF:A9:FF:F6:B1:1A (OUI DF-A9-FF)
        Count: 1
        #94: len 21 (1 Kb/s)
        Latency: 163 msec (68-174 msec ~164 msec)
> ACL Data RX: Handle 381 flags 0x02 dlen 21               #96 [hci1] 12.541331
      SMP: Pairing Confirm (0x03) len 16
        Confim value: 0392d6be7ba3655b29f52b247a17b50c
< HCI Command: Host Number of Comp.. (0x03|0x0035) plen 5  #97 [hci1] 12.549927
        Num handles: 1
        Handle: 381 Address: DF:A9:FF:F6:B1:1A (OUI DF-A9-FF)
        Count: 1
< ACL Data TX: Handle 381 flags 0x00 dlen 21               #98 [hci1] 12.550088
      SMP: Pairing Confirm (0x03) len 16
        Confim value: 624fc2ff3bb7775a8e97e4e9a39ba4db
> HCI Event: Number of Completed Packets (0x13) plen 5     #99 [hci1] 12.716198
        Num handles: 1
        Handle: 381 Address: DF:A9:FF:F6:B1:1A (OUI DF-A9-FF)
        Count: 1
        #98: len 21 (1 Kb/s)
        Latency: 166 msec (68-174 msec ~165 msec)
> ACL Data RX: Handle 381 flags 0x02 dlen 21              #100 [hci1] 12.716526
      SMP: Pairing Random (0x04) len 16
        Random value: 9921846b9d6c72cf0000000000000000
< HCI Command: Host Number of Com.. (0x03|0x0035) plen 5  #101 [hci1] 12.729660
        Num handles: 1
        Handle: 381 Address: DF:A9:FF:F6:B1:1A (OUI DF-A9-FF)
        Count: 1
< ACL Data TX: Handle 381 flags 0x00 dlen 21              #102 [hci1] 12.729745
      SMP: Pairing Random (0x04) len 16
        Random value: 5c4a1bcadd27bd58e945097b00bad7ac
> HCI Event: Number of Completed Packets (0x13) plen 5    #103 [hci1] 12.891034
        Num handles: 1
        Handle: 381 Address: DF:A9:FF:F6:B1:1A (OUI DF-A9-FF)
        Count: 1
        #102: len 21 (1 Kb/s)
        Latency: 161 msec (68-174 msec ~163 msec)
> ACL Data RX: Handle 381 flags 0x02 dlen 21              #104 [hci1] 12.978833
      SMP: Pairing Confirm (0x03) len 16
        Confim value: 9d9851328a9a46be2574c737482e306d
< HCI Command: Host Number of Com.. (0x03|0x0035) plen 5  #105 [hci1] 12.989752
        Num handles: 1
        Handle: 381 Address: DF:A9:FF:F6:B1:1A (OUI DF-A9-FF)
        Count: 1
< ACL Data TX: Handle 381 flags 0x00 dlen 21              #106 [hci1] 12.989927
      SMP: Pairing Confirm (0x03) len 16
        Confim value: d4d54769e72f841dc0039be9db59d81d
> HCI Event: Number of Completed Packets (0x13) plen 5    #107 [hci1] 13.153688
        Num handles: 1
        Handle: 381 Address: DF:A9:FF:F6:B1:1A (OUI DF-A9-FF)
        Count: 1
        #106: len 21 (1 Kb/s)
        Latency: 163 msec (68-174 msec ~163 msec)
> ACL Data RX: Handle 381 flags 0x02 dlen 21              #108 [hci1] 13.154044
      SMP: Pairing Random (0x04) len 16
        Random value: b84bfab1d458ae7a0000000000000000
< HCI Command: Host Number of Com.. (0x03|0x0035) plen 5  #109 [hci1] 13.170431
        Num handles: 1
        Handle: 381 Address: DF:A9:FF:F6:B1:1A (OUI DF-A9-FF)
        Count: 1
< ACL Data TX: Handle 381 flags 0x00 dlen 21              #110 [hci1] 13.170609
      SMP: Pairing Random (0x04) len 16
        Random value: 32527e6e64e79f33b2e374394db8ab2d
> HCI Event: Number of Completed Packets (0x13) plen 5    #111 [hci1] 13.328526
        Num handles: 1
        Handle: 381 Address: DF:A9:FF:F6:B1:1A (OUI DF-A9-FF)
        Count: 1
        #110: len 21 (1 Kb/s)
        Latency: 157 msec (68-174 msec ~160 msec)
> ACL Data RX: Handle 381 flags 0x02 dlen 21              #112 [hci1] 13.416336
      SMP: Pairing Confirm (0x03) len 16
        Confim value: 763e8e72150a00dd4b12445b094411d1
< HCI Command: Host Number of Com.. (0x03|0x0035) plen 5  #113 [hci1] 13.429602
        Num handles: 1
        Handle: 381 Address: DF:A9:FF:F6:B1:1A (OUI DF-A9-FF)
        Count: 1
< ACL Data TX: Handle 381 flags 0x00 dlen 21              #114 [hci1] 13.429730
      SMP: Pairing Confirm (0x03) len 16
        Confim value: 9dd5a5f8a1abcc675ec7ff1ae1e5d364
> HCI Event: Number of Completed Packets (0x13) plen 5    #115 [hci1] 13.591205
        Num handles: 1
        Handle: 381 Address: DF:A9:FF:F6:B1:1A (OUI DF-A9-FF)
        Count: 1
        #114: len 21 (1 Kb/s)
        Latency: 161 msec (68-174 msec ~161 msec)
> ACL Data RX: Handle 381 flags 0x02 dlen 21              #116 [hci1] 13.591461
      SMP: Pairing Random (0x04) len 16
        Random value: 871d9d1b318109c30000000000000000
< HCI Command: Host Number of Com.. (0x03|0x0035) plen 5  #117 [hci1] 13.609767
        Num handles: 1
        Handle: 381 Address: DF:A9:FF:F6:B1:1A (OUI DF-A9-FF)
        Count: 1
< ACL Data TX: Handle 381 flags 0x00 dlen 21              #118 [hci1] 13.609862
      SMP: Pairing Random (0x04) len 16
        Random value: dddbdfe2838e9a8cc6964353c850fef7
> HCI Event: Number of Completed Packets (0x13) plen 5    #119 [hci1] 13.766025
        Num handles: 1
        Handle: 381 Address: DF:A9:FF:F6:B1:1A (OUI DF-A9-FF)
        Count: 1
        #118: len 21 (1 Kb/s)
        Latency: 156 msec (68-174 msec ~158 msec)
> ACL Data RX: Handle 381 flags 0x02 dlen 21              #120 [hci1] 13.853831
      SMP: Pairing Confirm (0x03) len 16
        Confim value: 5edb57e0da14bb65ef89a152962449bf
< HCI Command: Host Number of Com.. (0x03|0x0035) plen 5  #121 [hci1] 13.870091
        Num handles: 1
        Handle: 381 Address: DF:A9:FF:F6:B1:1A (OUI DF-A9-FF)
        Count: 1
< ACL Data TX: Handle 381 flags 0x00 dlen 21              #122 [hci1] 13.870298
      SMP: Pairing Confirm (0x03) len 16
        Confim value: 9e55f5c367452cafd2465c73c4907137
> HCI Event: Number of Completed Packets (0x13) plen 5    #123 [hci1] 14.028720
        Num handles: 1
        Handle: 381 Address: DF:A9:FF:F6:B1:1A (OUI DF-A9-FF)
        Count: 1
        #122: len 21 (1 Kb/s)
        Latency: 158 msec (68-174 msec ~158 msec)
> ACL Data RX: Handle 381 flags 0x02 dlen 21              #124 [hci1] 14.028971
      SMP: Pairing Random (0x04) len 16
        Random value: 5f0357f8f4543b9d0000000000000000
< HCI Command: Host Number of Com.. (0x03|0x0035) plen 5  #125 [hci1] 14.030243
        Num handles: 1
        Handle: 381 Address: DF:A9:FF:F6:B1:1A (OUI DF-A9-FF)
        Count: 1
< ACL Data TX: Handle 381 flags 0x00 dlen 21              #126 [hci1] 14.030298
      SMP: Pairing Random (0x04) len 16
        Random value: eb9f1915536596b6fc3db1c86b2b1970
> HCI Event: Number of Completed Packets (0x13) plen 5    #127 [hci1] 14.203415
        Num handles: 1
        Handle: 381 Address: DF:A9:FF:F6:B1:1A (OUI DF-A9-FF)
        Count: 1
        #126: len 21 (0 Kb/s)
        Latency: 173 msec (68-174 msec ~165 msec)
> ACL Data RX: Handle 381 flags 0x02 dlen 21              #128 [hci1] 14.291297
      SMP: Pairing Confirm (0x03) len 16
        Confim value: 70fbfa1684fe38914aed9bc8474ac1ac
< HCI Command: Host Number of Com.. (0x03|0x0035) plen 5  #129 [hci1] 14.309992
        Num handles: 1
        Handle: 381 Address: DF:A9:FF:F6:B1:1A (OUI DF-A9-FF)
        Count: 1
< ACL Data TX: Handle 381 flags 0x00 dlen 21              #130 [hci1] 14.310167
      SMP: Pairing Confirm (0x03) len 16
        Confim value: a8accd274a40b40d8a3cefea978f25f9
> HCI Event: Number of Completed Packets (0x13) plen 5    #131 [hci1] 14.466122
        Num handles: 1
        Handle: 381 Address: DF:A9:FF:F6:B1:1A (OUI DF-A9-FF)
        Count: 1
        #130: len 21 (1 Kb/s)
        Latency: 155 msec (68-174 msec ~160 msec)
> ACL Data RX: Handle 381 flags 0x02 dlen 21              #132 [hci1] 14.466724
      SMP: Pairing Random (0x04) len 16
        Random value: 01cf0678fdba37960000000000000000
< HCI Command: Host Number of Com.. (0x03|0x0035) plen 5  #133 [hci1] 14.470361
        Num handles: 1
        Handle: 381 Address: DF:A9:FF:F6:B1:1A (OUI DF-A9-FF)
        Count: 1
< ACL Data TX: Handle 381 flags 0x00 dlen 21              #134 [hci1] 14.470500
      SMP: Pairing Random (0x04) len 16
        Random value: 5c794dc9ad9f2c3f295ebd5ad5e1c3cf
> HCI Event: Number of Completed Packets (0x13) plen 5    #135 [hci1] 14.641001
        Num handles: 1
        Handle: 381 Address: DF:A9:FF:F6:B1:1A (OUI DF-A9-FF)
        Count: 1
        #134: len 21 (0 Kb/s)
        Latency: 170 msec (68-174 msec ~165 msec)
> ACL Data RX: Handle 381 flags 0x02 dlen 21              #136 [hci1] 14.728893
      SMP: Pairing Confirm (0x03) len 16
        Confim value: 2656b693b1f4aeea01da413a9d0e453e
< HCI Command: Host Number of Com.. (0x03|0x0035) plen 5  #137 [hci1] 14.729676
        Num handles: 1
        Handle: 381 Address: DF:A9:FF:F6:B1:1A (OUI DF-A9-FF)
        Count: 1
< ACL Data TX: Handle 381 flags 0x00 dlen 21              #138 [hci1] 14.729853
      SMP: Pairing Confirm (0x03) len 16
        Confim value: baae0aa96fd9285197731a31fd0db647
> HCI Event: Number of Completed Packets (0x13) plen 5    #139 [hci1] 14.903636
        Num handles: 1
        Handle: 381 Address: DF:A9:FF:F6:B1:1A (OUI DF-A9-FF)
        Count: 1
        #138: len 21 (0 Kb/s)
        Latency: 173 msec (68-174 msec ~169 msec)
> ACL Data RX: Handle 381 flags 0x02 dlen 21              #140 [hci1] 14.904020
      SMP: Pairing Random (0x04) len 16
        Random value: 7099a6241d074e420000000000000000
< HCI Command: Host Number of Com.. (0x03|0x0035) plen 5  #141 [hci1] 14.910334
        Num handles: 1
        Handle: 381 Address: DF:A9:FF:F6:B1:1A (OUI DF-A9-FF)
        Count: 1
< ACL Data TX: Handle 381 flags 0x00 dlen 21              #142 [hci1] 14.910429
      SMP: Pairing Random (0x04) len 16
        Random value: 5c2fff312cdf99c9491988e877355a9a
> HCI Event: Number of Completed Packets (0x13) plen 5    #143 [hci1] 15.078410
        Num handles: 1
        Handle: 381 Address: DF:A9:FF:F6:B1:1A (OUI DF-A9-FF)
        Count: 1
        #142: len 21 (1 Kb/s)
        Latency: 167 msec (68-174 msec ~168 msec)
> ACL Data RX: Handle 381 flags 0x02 dlen 21              #144 [hci1] 15.166280
      SMP: Pairing Confirm (0x03) len 16
        Confim value: 7033059ddc12d652ce4a18dfed0311c5
< HCI Command: Host Number of Com.. (0x03|0x0035) plen 5  #145 [hci1] 15.169894
        Num handles: 1
        Handle: 381 Address: DF:A9:FF:F6:B1:1A (OUI DF-A9-FF)
        Count: 1
< ACL Data TX: Handle 381 flags 0x00 dlen 21              #146 [hci1] 15.170055
      SMP: Pairing Confirm (0x03) len 16
        Confim value: ed8c25e20e0e358a354f47ab1d8dc893
> HCI Event: Number of Completed Packets (0x13) plen 5    #147 [hci1] 15.341142
        Num handles: 1
        Handle: 381 Address: DF:A9:FF:F6:B1:1A (OUI DF-A9-FF)
        Count: 1
        #146: len 21 (0 Kb/s)
        Latency: 171 msec (68-174 msec ~169 msec)
> ACL Data RX: Handle 381 flags 0x02 dlen 21              #148 [hci1] 15.341444
      SMP: Pairing Random (0x04) len 16
        Random value: 9905fa7fdd4f90180000000000000000
< HCI Command: Host Number of Com.. (0x03|0x0035) plen 5  #149 [hci1] 15.350320
        Num handles: 1
        Handle: 381 Address: DF:A9:FF:F6:B1:1A (OUI DF-A9-FF)
        Count: 1
< ACL Data TX: Handle 381 flags 0x00 dlen 21              #150 [hci1] 15.350485
      SMP: Pairing Random (0x04) len 16
        Random value: c629a3a987d808e808655d558dfc1155
> HCI Event: Number of Completed Packets (0x13) plen 5    #151 [hci1] 15.515926
        Num handles: 1
        Handle: 381 Address: DF:A9:FF:F6:B1:1A (OUI DF-A9-FF)
        Count: 1
        #150: len 21 (1 Kb/s)
        Latency: 165 msec (68-174 msec ~167 msec)
> ACL Data RX: Handle 381 flags 0x02 dlen 21              #152 [hci1] 15.603699
      SMP: Pairing Confirm (0x03) len 16
        Confim value: ac6d7c02250549c9d1ee4e7f3bf44270
< HCI Command: Host Number of Com.. (0x03|0x0035) plen 5  #153 [hci1] 15.610133
        Num handles: 1
        Handle: 381 Address: DF:A9:FF:F6:B1:1A (OUI DF-A9-FF)
        Count: 1
< ACL Data TX: Handle 381 flags 0x00 dlen 21              #154 [hci1] 15.610295
      SMP: Pairing Confirm (0x03) len 16
        Confim value: 0e35e13054b0e983c09f4dc6fbdb637b
> HCI Event: Number of Completed Packets (0x13) plen 5    #155 [hci1] 15.778628
        Num handles: 1
        Handle: 381 Address: DF:A9:FF:F6:B1:1A (OUI DF-A9-FF)
        Count: 1
        #154: len 21 (1 Kb/s)
        Latency: 168 msec (68-174 msec ~168 msec)
> ACL Data RX: Handle 381 flags 0x02 dlen 21              #156 [hci1] 15.779019
      SMP: Pairing Random (0x04) len 16
        Random value: 883db2bbf8d5b8c00000000000000000
< HCI Command: Host Number of Com.. (0x03|0x0035) plen 5  #157 [hci1] 15.790369
        Num handles: 1
        Handle: 381 Address: DF:A9:FF:F6:B1:1A (OUI DF-A9-FF)
        Count: 1
< ACL Data TX: Handle 381 flags 0x00 dlen 21              #158 [hci1] 15.790564
      SMP: Pairing Random (0x04) len 16
        Random value: 92f20f6ad8f13724432c7fd6001c45ff
> HCI Event: Number of Completed Packets (0x13) plen 5    #159 [hci1] 15.953389
        Num handles: 1
        Handle: 381 Address: DF:A9:FF:F6:B1:1A (OUI DF-A9-FF)
        Count: 1
        #158: len 21 (1 Kb/s)
        Latency: 162 msec (68-174 msec ~165 msec)
> ACL Data RX: Handle 381 flags 0x02 dlen 21              #160 [hci1] 16.041253
      SMP: Pairing Confirm (0x03) len 16
        Confim value: 6d9e9d6e1c3e8bcdcc5aaf04c30389e1
< HCI Command: Host Number of Com.. (0x03|0x0035) plen 5  #161 [hci1] 16.050128
        Num handles: 1
        Handle: 381 Address: DF:A9:FF:F6:B1:1A (OUI DF-A9-FF)
        Count: 1
< ACL Data TX: Handle 381 flags 0x00 dlen 21              #162 [hci1] 16.050381
      SMP: Pairing Confirm (0x03) len 16
        Confim value: 3c4c4cc2e4ff1e4d4525935e5face789
> HCI Event: Number of Completed Packets (0x13) plen 5    #163 [hci1] 16.216076
        Num handles: 1
        Handle: 381 Address: DF:A9:FF:F6:B1:1A (OUI DF-A9-FF)
        Count: 1
        #162: len 21 (1 Kb/s)
        Latency: 165 msec (68-174 msec ~165 msec)
> ACL Data RX: Handle 381 flags 0x02 dlen 21              #164 [hci1] 16.216428
      SMP: Pairing Random (0x04) len 16
        Random value: c3bf630d33f2ee320000000000000000
< HCI Command: Host Number of Com.. (0x03|0x0035) plen 5  #165 [hci1] 16.230387
        Num handles: 1
        Handle: 381 Address: DF:A9:FF:F6:B1:1A (OUI DF-A9-FF)
        Count: 1
< ACL Data TX: Handle 381 flags 0x00 dlen 21              #166 [hci1] 16.230495
      SMP: Pairing Random (0x04) len 16
        Random value: 23ac32ebbb5e14c8a6b9622f296d277f
> HCI Event: Number of Completed Packets (0x13) plen 5    #167 [hci1] 16.390966
        Num handles: 1
        Handle: 381 Address: DF:A9:FF:F6:B1:1A (OUI DF-A9-FF)
        Count: 1
        #166: len 21 (1 Kb/s)
        Latency: 160 msec (68-174 msec ~163 msec)
> ACL Data RX: Handle 381 flags 0x02 dlen 21              #168 [hci1] 16.478719
      SMP: Pairing Confirm (0x03) len 16
        Confim value: 3c5c5b3f35c4b860a3a1f3278f17ce3d
< HCI Command: Host Number of Com.. (0x03|0x0035) plen 5  #169 [hci1] 16.489668
        Num handles: 1
        Handle: 381 Address: DF:A9:FF:F6:B1:1A (OUI DF-A9-FF)
        Count: 1
< ACL Data TX: Handle 381 flags 0x00 dlen 21              #170 [hci1] 16.489793
      SMP: Pairing Confirm (0x03) len 16
        Confim value: d0b1e6c12f70613fb2ded03ab9f0d014
> HCI Event: Number of Completed Packets (0x13) plen 5    #171 [hci1] 16.653585
        Num handles: 1
        Handle: 381 Address: DF:A9:FF:F6:B1:1A (OUI DF-A9-FF)
        Count: 1
        #170: len 21 (1 Kb/s)
        Latency: 163 msec (68-174 msec ~163 msec)
> ACL Data RX: Handle 381 flags 0x02 dlen 21              #172 [hci1] 16.654037
      SMP: Pairing Random (0x04) len 16
        Random value: 3087c42d616e1e5c0000000000000000
< HCI Command: Host Number of Com.. (0x03|0x0035) plen 5  #173 [hci1] 16.670322
        Num handles: 1
        Handle: 381 Address: DF:A9:FF:F6:B1:1A (OUI DF-A9-FF)
        Count: 1
< ACL Data TX: Handle 381 flags 0x00 dlen 21              #174 [hci1] 16.670422
      SMP: Pairing Random (0x04) len 16
        Random value: 297efe85e67448a15f56bd27e3a3cf1d
> HCI Event: Number of Completed Packets (0x13) plen 5    #175 [hci1] 16.828314
        Num handles: 1
        Handle: 381 Address: DF:A9:FF:F6:B1:1A (OUI DF-A9-FF)
        Count: 1
        #174: len 21 (1 Kb/s)
        Latency: 157 msec (68-174 msec ~160 msec)
> ACL Data RX: Handle 381 flags 0x02 dlen 21              #176 [hci1] 16.916248
      SMP: Pairing Confirm (0x03) len 16
        Confim value: 91c6fb8dca68fd073f9b040184ee5f16
< HCI Command: Host Number of Com.. (0x03|0x0035) plen 5  #177 [hci1] 16.930222
        Num handles: 1
        Handle: 381 Address: DF:A9:FF:F6:B1:1A (OUI DF-A9-FF)
        Count: 1
< ACL Data TX: Handle 381 flags 0x00 dlen 21              #178 [hci1] 16.930489
      SMP: Pairing Confirm (0x03) len 16
        Confim value: c4b76539242c8c3d36357738c01e92b5
> HCI Event: Number of Completed Packets (0x13) plen 5    #179 [hci1] 17.091091
        Num handles: 1
        Handle: 381 Address: DF:A9:FF:F6:B1:1A (OUI DF-A9-FF)
        Count: 1
        #178: len 21 (1 Kb/s)
        Latency: 160 msec (68-174 msec ~160 msec)
> ACL Data RX: Handle 381 flags 0x02 dlen 21              #180 [hci1] 17.091433
      SMP: Pairing Random (0x04) len 16
        Random value: d87823f1e159a7e90000000000000000
< HCI Command: Host Number of Com.. (0x03|0x0035) plen 5  #181 [hci1] 17.110438
        Num handles: 1
        Handle: 381 Address: DF:A9:FF:F6:B1:1A (OUI DF-A9-FF)
        Count: 1
< ACL Data TX: Handle 381 flags 0x00 dlen 21              #182 [hci1] 17.110569
      SMP: Pairing Random (0x04) len 16
        Random value: 25a9493fd3ce4faf02be7293595bb7c6
> HCI Event: Number of Completed Packets (0x13) plen 5    #183 [hci1] 17.265851
        Num handles: 1
        Handle: 381 Address: DF:A9:FF:F6:B1:1A (OUI DF-A9-FF)
        Count: 1
        #182: len 21 (1 Kb/s)
        Latency: 155 msec (68-174 msec ~157 msec)
> ACL Data RX: Handle 381 flags 0x02 dlen 21              #184 [hci1] 17.353655
      SMP: Pairing Confirm (0x03) len 16
        Confim value: bcc3ebb49b8465d794af4084791bfdd8
< HCI Command: Host Number of Com.. (0x03|0x0035) plen 5  #185 [hci1] 17.370124
        Num handles: 1
        Handle: 381 Address: DF:A9:FF:F6:B1:1A (OUI DF-A9-FF)
        Count: 1
< ACL Data TX: Handle 381 flags 0x00 dlen 21              #186 [hci1] 17.370329
      SMP: Pairing Confirm (0x03) len 16
        Confim value: 37eec92e99acfa324bc76ee8f30d8ecc
> HCI Event: Number of Completed Packets (0x13) plen 5    #187 [hci1] 17.528629
        Num handles: 1
        Handle: 381 Address: DF:A9:FF:F6:B1:1A (OUI DF-A9-FF)
        Count: 1
        #186: len 21 (1 Kb/s)
        Latency: 158 msec (68-174 msec ~158 msec)
> ACL Data RX: Handle 381 flags 0x02 dlen 21              #188 [hci1] 17.529035
      SMP: Pairing Random (0x04) len 16
        Random value: 0286659e4082b5080000000000000000
< HCI Command: Host Number of Com.. (0x03|0x0035) plen 5  #189 [hci1] 17.530146
        Num handles: 1
        Handle: 381 Address: DF:A9:FF:F6:B1:1A (OUI DF-A9-FF)
        Count: 1
< ACL Data TX: Handle 381 flags 0x00 dlen 21              #190 [hci1] 17.530246
      SMP: Pairing Random (0x04) len 16
        Random value: 58f6b41f855a6f6c3560debd84e2affc
> HCI Event: Number of Completed Packets (0x13) plen 5    #191 [hci1] 17.703331
        Num handles: 1
        Handle: 381 Address: DF:A9:FF:F6:B1:1A (OUI DF-A9-FF)
        Count: 1
        #190: len 21 (0 Kb/s)
        Latency: 173 msec (68-174 msec ~165 msec)
> ACL Data RX: Handle 381 flags 0x02 dlen 21              #192 [hci1] 17.791206
      SMP: Pairing Confirm (0x03) len 16
        Confim value: 95e37e00d3e667d0b1c5558245dadad7
< HCI Command: Host Number of Com.. (0x03|0x0035) plen 5  #193 [hci1] 17.809907
        Num handles: 1
        Handle: 381 Address: DF:A9:FF:F6:B1:1A (OUI DF-A9-FF)
        Count: 1
< ACL Data TX: Handle 381 flags 0x00 dlen 21              #194 [hci1] 17.810099
      SMP: Pairing Confirm (0x03) len 16
        Confim value: 42728c6509d58293f474ffe574f60c45
> HCI Event: Number of Completed Packets (0x13) plen 5    #195 [hci1] 17.966041
        Num handles: 1
        Handle: 381 Address: DF:A9:FF:F6:B1:1A (OUI DF-A9-FF)
        Count: 1
        #194: len 21 (1 Kb/s)
        Latency: 155 msec (68-174 msec ~160 msec)
> ACL Data RX: Handle 381 flags 0x02 dlen 21              #196 [hci1] 17.966384
      SMP: Pairing Random (0x04) len 16
        Random value: 69e02ec7a99fc0140000000000000000
< HCI Command: Host Number of Com.. (0x03|0x0035) plen 5  #197 [hci1] 17.970394
        Num handles: 1
        Handle: 381 Address: DF:A9:FF:F6:B1:1A (OUI DF-A9-FF)
        Count: 1
< ACL Data TX: Handle 381 flags 0x00 dlen 21              #198 [hci1] 17.970567
      SMP: Pairing Random (0x04) len 16
        Random value: b67e7216d5bf664139eda2b542549666
> HCI Event: Number of Completed Packets (0x13) plen 5    #199 [hci1] 18.140976
        Num handles: 1
        Handle: 381 Address: DF:A9:FF:F6:B1:1A (OUI DF-A9-FF)
        Count: 1
        #198: len 21 (0 Kb/s)
        Latency: 170 msec (68-174 msec ~165 msec)
> ACL Data RX: Handle 381 flags 0x02 dlen 21              #200 [hci1] 18.228688
      SMP: Pairing Confirm (0x03) len 16
        Confim value: e732e854631123eb33b1a4094a6cb28b
< HCI Command: Host Number of Com.. (0x03|0x0035) plen 5  #201 [hci1] 18.229581
        Num handles: 1
        Handle: 381 Address: DF:A9:FF:F6:B1:1A (OUI DF-A9-FF)
        Count: 1
< ACL Data TX: Handle 381 flags 0x00 dlen 21              #202 [hci1] 18.229587
      SMP: Pairing Confirm (0x03) len 16
        Confim value: d57496e60ec69c7449c066db4b77f935
> HCI Event: Number of Completed Packets (0x13) plen 5    #203 [hci1] 18.403508
        Num handles: 1
        Handle: 381 Address: DF:A9:FF:F6:B1:1A (OUI DF-A9-FF)
        Count: 1
        #202: len 21 (0 Kb/s)
        Latency: 173 msec (68-174 msec ~169 msec)
> ACL Data RX: Handle 381 flags 0x02 dlen 21              #204 [hci1] 18.403910
      SMP: Pairing Random (0x04) len 16
        Random value: 7ed608b9e67dfed00000000000000000
< HCI Command: Host Number of Com.. (0x03|0x0035) plen 5  #205 [hci1] 18.410479
        Num handles: 1
        Handle: 381 Address: DF:A9:FF:F6:B1:1A (OUI DF-A9-FF)
        Count: 1
< ACL Data TX: Handle 381 flags 0x00 dlen 21              #206 [hci1] 18.410665
      SMP: Pairing Random (0x04) len 16
        Random value: ed17f76500c95219dd01e09d1e63f87b
> HCI Event: Number of Completed Packets (0x13) plen 5    #207 [hci1] 18.578280
        Num handles: 1
        Handle: 381 Address: DF:A9:FF:F6:B1:1A (OUI DF-A9-FF)
        Count: 1
        #206: len 21 (1 Kb/s)
        Latency: 167 msec (68-174 msec ~168 msec)
> ACL Data RX: Handle 381 flags 0x02 dlen 21              #208 [hci1] 18.666139
      SMP: Pairing Confirm (0x03) len 16
        Confim value: 78ef6b43faabce60ee05c6615dff67a4
< HCI Command: Host Number of Com.. (0x03|0x0035) plen 5  #209 [hci1] 18.670155
        Num handles: 1
        Handle: 381 Address: DF:A9:FF:F6:B1:1A (OUI DF-A9-FF)
        Count: 1
< ACL Data TX: Handle 381 flags 0x00 dlen 21              #210 [hci1] 18.670323
      SMP: Pairing Confirm (0x03) len 16
        Confim value: a9b5f27b9af3940b329eea7d3d390ece
> HCI Event: Number of Completed Packets (0x13) plen 5    #211 [hci1] 18.841057
        Num handles: 1
        Handle: 381 Address: DF:A9:FF:F6:B1:1A (OUI DF-A9-FF)
        Count: 1
        #210: len 21 (0 Kb/s)
        Latency: 170 msec (68-174 msec ~169 msec)
> ACL Data RX: Handle 381 flags 0x02 dlen 21              #212 [hci1] 18.841359
      SMP: Pairing Random (0x04) len 16
        Random value: 31f70a825fe649010000000000000000
< HCI Command: Host Number of Com.. (0x03|0x0035) plen 5  #213 [hci1] 18.850526
        Num handles: 1
        Handle: 381 Address: DF:A9:FF:F6:B1:1A (OUI DF-A9-FF)
        Count: 1
< ACL Data TX: Handle 381 flags 0x00 dlen 21              #214 [hci1] 18.850672
      SMP: Pairing Random (0x04) len 16
        Random value: 81d35d47e1f6006d79c974bd9d9e1ee3
> HCI Event: Number of Completed Packets (0x13) plen 5    #215 [hci1] 19.015854
        Num handles: 1
        Handle: 381 Address: DF:A9:FF:F6:B1:1A (OUI DF-A9-FF)
        Count: 1
        #214: len 21 (1 Kb/s)
        Latency: 165 msec (68-174 msec ~167 msec)
> ACL Data RX: Handle 381 flags 0x02 dlen 21              #216 [hci1] 19.103722
      SMP: Pairing Confirm (0x03) len 16
        Confim value: 5512dd8faaaa4fe2d227f0dce67a8bc6
< HCI Command: Host Number of Com.. (0x03|0x0035) plen 5  #217 [hci1] 19.109912
        Num handles: 1
        Handle: 381 Address: DF:A9:FF:F6:B1:1A (OUI DF-A9-FF)
        Count: 1
< ACL Data TX: Handle 381 flags 0x00 dlen 21              #218 [hci1] 19.110060
      SMP: Pairing Confirm (0x03) len 16
        Confim value: 917e27ca011c58c9a58d418f44a9fdc7
> HCI Event: Number of Completed Packets (0x13) plen 5    #219 [hci1] 19.278511
        Num handles: 1
        Handle: 381 Address: DF:A9:FF:F6:B1:1A (OUI DF-A9-FF)
        Count: 1
        #218: len 21 (1 Kb/s)
        Latency: 168 msec (68-174 msec ~167 msec)
> ACL Data RX: Handle 381 flags 0x02 dlen 21              #220 [hci1] 19.278831
      SMP: Pairing Random (0x04) len 16
        Random value: 492d09401fdc189c0000000000000000
< HCI Command: Host Number of Com.. (0x03|0x0035) plen 5  #221 [hci1] 19.290296
        Num handles: 1
        Handle: 381 Address: DF:A9:FF:F6:B1:1A (OUI DF-A9-FF)
        Count: 1
< ACL Data TX: Handle 381 flags 0x00 dlen 21              #222 [hci1] 19.290467
      SMP: Pairing Random (0x04) len 16
        Random value: e7f7e0c2476823e41736a7e381bafb7c
> HCI Event: Number of Completed Packets (0x13) plen 5    #223 [hci1] 19.453314
        Num handles: 1
        Handle: 381 Address: DF:A9:FF:F6:B1:1A (OUI DF-A9-FF)
        Count: 1
        #222: len 21 (1 Kb/s)
        Latency: 162 msec (68-174 msec ~165 msec)
> ACL Data RX: Handle 381 flags 0x02 dlen 21              #224 [hci1] 19.541150
      SMP: Pairing Confirm (0x03) len 16
        Confim value: be66ee29739da3439c4d1b987b191af4
< HCI Command: Host Number of Com.. (0x03|0x0035) plen 5  #225 [hci1] 19.549770
        Num handles: 1
        Handle: 381 Address: DF:A9:FF:F6:B1:1A (OUI DF-A9-FF)
        Count: 1
< ACL Data TX: Handle 381 flags 0x00 dlen 21              #226 [hci1] 19.549922
      SMP: Pairing Confirm (0x03) len 16
        Confim value: aef2f3f58538f65cdc45f6978640b9d2
> HCI Event: Number of Completed Packets (0x13) plen 5    #227 [hci1] 19.715962
        Num handles: 1
        Handle: 381 Address: DF:A9:FF:F6:B1:1A (OUI DF-A9-FF)
        Count: 1
        #226: len 21 (1 Kb/s)
        Latency: 166 msec (68-174 msec ~165 msec)
> ACL Data RX: Handle 381 flags 0x02 dlen 21              #228 [hci1] 19.716331
      SMP: Pairing Random (0x04) len 16
        Random value: 4fe4039e6b8241000000000000000000
< HCI Command: Host Number of Com.. (0x03|0x0035) plen 5  #229 [hci1] 19.730374
        Num handles: 1
        Handle: 381 Address: DF:A9:FF:F6:B1:1A (OUI DF-A9-FF)
        Count: 1
