Bluetooth monitor ver 5.72
= Note: Linux version 6.14.0-36-generic (x86_64)                       0.015915
= Note: Bluetooth subsystem version 2.22                               0.015917
= New Index: 00:00:00:00:00:00 (Primary,UART,hci1)              [hci1] 0.015917
= New Index: 48:5F:99:8E:E0:64 (Primary,USB,hci0)               [hci0] 0.015918
= Open Index: 00:00:00:00:00:00                                 [hci1] 0.529722
= Index Info: 00:00:00:00:00:00 (Nordic Semiconductor ASA)      [hci1] 0.529738
@ USER Open: main (privileged) version 2.22            {0x0001} [hci1] 0.529746
< HCI Command: Reset (0x03|0x0003) plen 0                    #1 [hci1] 0.530948
> HCI Event: Command Complete (0x0e) plen 4                  #2 [hci1] 0.531457
      Reset (0x03|0x0003) ncmd 1
        Status: Success (0x00)
< HCI Command: Read Local Supported... (0x04|0x0003) plen 0  #3 [hci1] 0.549116
> HCI Event: Command Complete (0x0e) plen 12                 #4 [hci1] 0.549570
      Read Local Supported Features (0x04|0x0003) ncmd 1
        Status: Success (0x00)
        Features: 0x00 0x00 0x00 0x00 0x60 0x00 0x00 0x00
          BR/EDR Not Supported
          LE Supported (Controller)
< HCI Command: Read Local Version In.. (0x04|0x0001) plen 0  #5 [hci1] 0.569116
> HCI Event: Command Complete (0x0e) plen 12                 #6 [hci1] 0.569643
      Read Local Version Information (0x04|0x0001) ncmd 1
        Status: Success (0x00)
        HCI version: Reserved (0x0f) - Revision 12393 (0x3069)
        LMP version: Reserved (0x0f) - Subversion 12393 (0x3069)
        Manufacturer: Nordic Semiconductor ASA (89)
< HCI Command: Read Local Supported... (0x04|0x0002) plen 0  #7 [hci1] 0.589116
> HCI Event: Command Complete (0x0e) plen 68                 #8 [hci1] 0.590163
      Read Local Supported Commands (0x04|0x0002) ncmd 1
        Status: Success (0x00)
        Commands: 119 entries
          Disconnect (Octet 0 - Bit 5)
          Read Remote Version Information (Octet 2 - Bit 7)
          Set Event Mask (Octet 5 - Bit 6)
          Reset (Octet 5 - Bit 7)
          Read Connection Accept Timeout (Octet 7 - Bit 2)
          Write Connection Accept Timeout (Octet 7 - Bit 3)
          Read Transmit Power Level (Octet 10 - Bit 2)
          Set Controller To Host Flow Control (Octet 10 - Bit 5)
          Host Buffer Size (Octet 10 - Bit 6)
          Host Number of Completed Packets (Octet 10 - Bit 7)
          Read Local Version Information (Octet 14 - Bit 3)
          Read Local Supported Features (Octet 14 - Bit 5)
          Read BD ADDR (Octet 15 - Bit 1)
          Read RSSI (Octet 15 - Bit 5)
          Set Event Mask Page 2 (Octet 22 - Bit 2)
          LE Set Event Mask (Octet 25 - Bit 0)
          LE Read Buffer Size (Octet 25 - Bit 1)
          LE Read Local Supported Features (Octet 25 - Bit 2)
          LE Set Random Address (Octet 25 - Bit 4)
          LE Set Advertising Parameters (Octet 25 - Bit 5)
          LE Read Advertising Channel TX Power (Octet 25 - Bit 6)
          LE Set Advertising Data (Octet 25 - Bit 7)
          LE Set Scan Response Data (Octet 26 - Bit 0)
          LE Set Advertise Enable (Octet 26 - Bit 1)
          LE Set Scan Parameters (Octet 26 - Bit 2)
          LE Set Scan Enable (Octet 26 - Bit 3)
          LE Create Connection (Octet 26 - Bit 4)
          LE Create Connection Cancel (Octet 26 - Bit 5)
          LE Read Accept List Size (Octet 26 - Bit 6)
          LE Clear Accept List (Octet 26 - Bit 7)
          LE Add Device To Accept List (Octet 27 - Bit 0)
          LE Remove Device From Accept List (Octet 27 - Bit 1)
          LE Connection Update (Octet 27 - Bit 2)
          LE Set Host Channel Classification (Octet 27 - Bit 3)
          LE Read Channel Map (Octet 27 - Bit 4)
          LE Read Remote Used Features (Octet 27 - Bit 5)
          LE Encrypt (Octet 27 - Bit 6)
          LE Rand (Octet 27 - Bit 7)
          LE Start Encryption (Octet 28 - Bit 0)
          LE Long Term Key Request Reply (Octet 28 - Bit 1)
          LE Long Term Key Request Neg Reply (Octet 28 - Bit 2)
          LE Read Supported States (Octet 28 - Bit 3)
          LE Receiver Test (Octet 28 - Bit 4)
          LE Transmitter Test (Octet 28 - Bit 5)
          LE Test End (Octet 28 - Bit 6)
          Read Authenticated Payload Timeout (Octet 32 - Bit 4)
          Write Authenticated Payload Timeout (Octet 32 - Bit 5)
          LE Set Data Length (Octet 33 - Bit 6)
          LE Read Suggested Default Data Length (Octet 33 - Bit 7)
          LE Write Suggested Default Data Length (Octet 34 - Bit 0)
          LE Add Device To Resolving List (Octet 34 - Bit 3)
          LE Remove Device From Resolving List (Octet 34 - Bit 4)
          LE Clear Resolving List (Octet 34 - Bit 5)
          LE Read Resolving List Size (Octet 34 - Bit 6)
          LE Set Address Resolution Enable (Octet 35 - Bit 1)
          LE Set Resolvable Private Address Timeout (Octet 35 - Bit 2)
          LE Read Maximum Data Length (Octet 35 - Bit 3)
          LE Read PHY (Octet 35 - Bit 4)
          LE Set Default PHY (Octet 35 - Bit 5)
          LE Set PHY (Octet 35 - Bit 6)
          LE Enhanced Receiver Test (Octet 35 - Bit 7)
          LE Enhanced Transmitter Test (Octet 36 - Bit 0)
          LE Set Advertising Set Random Address (Octet 36 - Bit 1)
          LE Set Extended Advertising Parameters (Octet 36 - Bit 2)
          LE Set Extended Advertising Data (Octet 36 - Bit 3)
          LE Set Extended Scan Response Data (Octet 36 - Bit 4)
          LE Set Extended Advertising Enable (Octet 36 - Bit 5)
          LE Read Maximum Advertising Data Length (Octet 36 - Bit 6)
          LE Read Number of Supported Advertising Sets (Octet 36 - Bit 7)
          LE Remove Advertising Set (Octet 37 - Bit 0)
          LE Clear Advertising Sets (Octet 37 - Bit 1)
          LE Set Periodic Advertising Parameters (Octet 37 - Bit 2)
          LE Set Periodic Advertising Data (Octet 37 - Bit 3)
          LE Set Periodic Advertising Enable (Octet 37 - Bit 4)
          LE Set Extended Scan Parameters (Octet 37 - Bit 5)
          LE Set Extended Scan Enable (Octet 37 - Bit 6)
          LE Extended Create Connection (Octet 37 - Bit 7)
          LE Periodic Advertising Create Sync (Octet 38 - Bit 0)
          LE Periodic Advertising Create Sync Cancel (Octet 38 - Bit 1)
          LE Periodic Advertising Terminate Sync (Octet 38 - Bit 2)
          LE Add Device To Periodic Advertiser List (Octet 38 - Bit 3)
          LE Remove Device From Periodic Advertiser List (Octet 38 - Bit 4)
          LE Clear Periodic Advertiser List (Octet 38 - Bit 5)
          LE Read Periodic Advertiser List Size (Octet 38 - Bit 6)
          LE Read Transmit Power (Octet 38 - Bit 7)
          LE Read RF Path Compensation (Octet 39 - Bit 0)
          LE Write RF Path Compensation (Octet 39 - Bit 1)
          LE Set Privacy Mode (Octet 39 - Bit 2)
          LE Periodic Advertising Receive Enable (Octet 40 - Bit 5)
          LE Periodic Advertising Sync Transfer (Octet 40 - Bit 6)
          LE Periodic Advertising Set Info Transfer (Octet 40 - Bit 7)
          LE Periodic Advertising Sync Transfer Parameters (Octet 41 - Bit 0)
          LE Set Default Periodic Advertisng Sync Transfer Parameters (Octet 41 - Bit 1)
          LE Read Buffer v2 (Octet 41 - Bit 5)
          LE Read ISO TX Sync (Octet 41 - Bit 6)
          LE Set Connected Isochronous Group Parameters (Octet 41 - Bit 7)
          LE Set Connected Isochronous Group Parameters Test (Octet 42 - Bit 0)
          LE Create Connected Isochronous Stream (Octet 42 - Bit 1)
          LE Remove Connected Isochronous Group (Octet 42 - Bit 2)
          LE Accept Connected Isochronous Stream Request (Octet 42 - Bit 3)
          LE Reject Connected Isochronous Stream Request (Octet 42 - Bit 4)
          LE Create Broadcast Isochronous Group (Octet 42 - Bit 5)
          LE Create Broadcast Isochronous Group Test (Octet 42 - Bit 6)
          LE Terminate Broadcast Isochronous Group (Octet 42 - Bit 7)
          LE Broadcast Isochronous Group Create Sync (Octet 43 - Bit 0)
          LE Broadcast Isochronous Group Terminate Sync (Octet 43 - Bit 1)
          LE Request Peer SCA (Octet 43 - Bit 2)
          LE Setup Isochronous Data Path (Octet 43 - Bit 3)
          LE Remove Isochronous Data Path (Octet 43 - Bit 4)
          LE Isochronous Transmit Test (Octet 43 - Bit 5)
          LE Isochronous Receive Test (Octet 43 - Bit 6)
          LE Isochronous Read Test Counters (Octet 43 - Bit 7)
          LE Isochronous Read Test Counters (Octet 44 - Bit 0)
          LE Set Host Feature (Octet 44 - Bit 1)
          Octet 44 - Bit 2 
          Octet 45 - Bit 6 
          Octet 46 - Bit 0 
          Octet 46 - Bit 1 
          Octet 46 - Bit 2 
< HCI Command: Host Buffer Size (0x03|0x0033) plen 7         #9 [hci1] 0.609119
        ACL MTU: 255  ACL max packet: 16
        SCO MTU: 0    SCO max packet: 0
> HCI Event: Command Complete (0x0e) plen 4                 #10 [hci1] 0.609699
      Host Buffer Size (0x03|0x0033) ncmd 1
        Status: Success (0x00)
< HCI Command: Set Controller To Ho.. (0x03|0x0031) plen 1  #11 [hci1] 0.629117
        Flow control: ACL Data Packets (0x01)
> HCI Event: Command Complete (0x0e) plen 4                 #12 [hci1] 0.629558
      Set Controller To Host Flow Control (0x03|0x0031) ncmd 1
        Status: Success (0x00)
< HCI Command: LE Read Local Suppor.. (0x08|0x0003) plen 0  #13 [hci1] 0.649108
> HCI Event: Command Complete (0x0e) plen 12                #14 [hci1] 0.649700
      LE Read Local Supported Features (0x08|0x0003) ncmd 1
        Status: Success (0x00)
        Features: 0xfd 0x79 0x00 0xf7 0x30 0x01 0x00 0x00
          LE Encryption
          Extended Reject Indication
          Peripheral-initiated Features Exchange
          LE Ping
          LE Data Packet Length Extension
          LL Privacy
          Extended Scanner Filter Policies
          LE 2M PHY
          LE Coded PHY
          LE Extended Advertising
          LE Periodic Advertising
          Channel Selection Algorithm #2
          Periodic Advertising Sync Transfer - Sender
          Periodic Advertising Sync Transfer - Recipient
          Sleep Clock Accuracy Updates
          Connected Isochronous Stream - Central
          Connected Isochronous Stream - Peripheral
          Isochronous Broadcaster
          Synchronized Receiver
          Periodic Advertising ADI support
          Connection Subrating
          Unknown features (0x0000010000000000)
< HCI Command: LE Set Host Feature (0x08|0x0074) plen 2     #15 [hci1] 0.669129
        Bit Number: 32
          Connected Isochronous Stream (Host Support)
        Bit Value: 1
> HCI Event: Command Complete (0x0e) plen 4                 #16 [hci1] 0.669532
      LE Set Host Feature (0x08|0x0074) ncmd 1
        Status: Success (0x00)
< HCI Command: LE Read Buffer v2 (0x08|0x0060) plen 0       #17 [hci1] 0.689105
> HCI Event: Command Complete (0x0e) plen 10                #18 [hci1] 0.689679
      LE Read Buffer v2 (0x08|0x0060) ncmd 1
        Status: Success (0x00)
        ACL MTU: 27
        ACL max packet: 3
        ISO MTU: 318
        ISO max packet: 3
< HCI Command: LE Read Maximum Adve.. (0x08|0x003a) plen 0  #19 [hci1] 0.709136
> HCI Event: Command Complete (0x0e) plen 6                 #20 [hci1] 0.709623
      LE Read Maximum Advertising Data Length (0x08|0x003a) ncmd 1
        Status: Success (0x00)
        Max length: 1650
< HCI Command: LE Read Supported St.. (0x08|0x001c) plen 0  #21 [hci1] 0.729121
> HCI Event: Command Complete (0x0e) plen 12                #22 [hci1] 0.729647
      LE Read Supported States (0x08|0x001c) ncmd 1
        Status: Success (0x00)
        States: 0x000003ff3e0306ff
          Non-connectable Advertising State
          Scannable Advertising State
          Connectable Advertising State
          High Duty Cycle Directed Advertising State
          Passive Scanning State
          Active Scanning State
          Initiating State
            and Connection State (Central Role)
          Connection State (Peripheral Role)
          Scannable Advertising State
            and Passive Scanning State
          Connectable Advertising State
            and Passive Scanning State
          Non-connectable Advertising State
            and Initiating State
          Scannable Advertising State
            and Initiating State
          Active Scanning State
            and Connection State (Central Role)
          Passive Scanning State
            and Connection State (Peripheral Role)
          Active Scanning State
            and Connection State (Peripheral Role)
          Initiating State
            and Connection State (Central Role)
            and Central Role & Central Role
          Low Duty Cycle Directed Advertising State
          Connectable Advertising State
            and Initiating State
            and Central Role & Peripheral Role
          High Duty Cycle Directed Advertising State
            and Initiating State
            and Central Role & Peripheral Role
          Low Duty Cycle Directed Advertising State
            and Initiating State
            and Central Role & Peripheral Role
          Connectable Advertising State
            and Connection State (Central Role)
            and Central Role & Peripheral Role
          High Duty Cycle Directed Advertising State
            and Connection State (Central Role)
            and Central Role & Peripheral Role
          Low Duty Cycle Directed Advertising State
            and Connection State (Central Role)
            and Central Role & Peripheral Role
          Connectable Advertising State
            and Connection State (Peripheral Role)
            and Central Role & Peripheral Role
          High Duty Cycle Directed Advertising State
            and Connection State (Peripheral Role)
            and Peripheral Role & Peripheral Role
          Low Duty Cycle Directed Advertising State
            and Connection State (Peripheral Role)
            and Peripheral Role & Peripheral Role
          Initiating State
            and Connection State (Peripheral Role)
            and Central Role & Peripheral Role
< HCI Command: LE Read Maximum Data.. (0x08|0x002f) plen 0  #23 [hci1] 0.749120
> HCI Event: Command Complete (0x0e) plen 12                #24 [hci1] 0.749629
      LE Read Maximum Data Length (0x08|0x002f) ncmd 1
        Status: Success (0x00)
        Max TX octets: 251
        Max TX time: 2704
        Max RX octets: 251
        Max RX time: 2704
< HCI Command: LE Write Suggested D.. (0x08|0x0024) plen 4  #25 [hci1] 0.769149
        TX octets: 251
        TX time: 2704
> HCI Event: Command Complete (0x0e) plen 4                 #26 [hci1] 0.769690
      LE Write Suggested Default Data Length (0x08|0x0024) ncmd 1
        Status: Success (0x00)
< HCI Command: LE Read Resolving Li.. (0x08|0x002a) plen 0  #27 [hci1] 0.789101
> HCI Event: Command Complete (0x0e) plen 5                 #28 [hci1] 0.789479
      LE Read Resolving List Size (0x08|0x002a) ncmd 1
        Status: Success (0x00)
        Size: 8
< HCI Command: LE Set Event Mask (0x08|0x0001) plen 8       #29 [hci1] 0.809120
        Mask: 0x000002023f87fa5e
          LE Advertising Report
          LE Connection Update Complete
          LE Read Remote Used Features Complete
          LE Long Term Key Request
          LE Data Length Change
          LE Enhanced Connection Complete
          LE PHY Update Complete
          LE Extended Advertising Report
          LE Periodic Advertising Sync Established
          LE Periodic Advertising Report
          LE Periodic Advertising Sync Lost
          LE Extended Scan Timeout
          LE Extended Advertising Set Terminated
          LE Scan Request Received
          LE Periodic Advertising Sync Transfer Rvc
          LE CIS Established
          LE CIS Request
          LE Create BIG Complete
          LE Terminate BIG Complete
          LE BIG Sync Estabilished Complete
          LE BIG Sync Lost
          LE BIG Info Advertising Report
          Unknown mask (0x0000020000000000)
> HCI Event: Command Complete (0x0e) plen 4                 #30 [hci1] 0.809705
      LE Set Event Mask (0x08|0x0001) ncmd 1
        Status: Success (0x00)
< HCI Command: Set Event Mask (0x03|0x0001) plen 8          #31 [hci1] 0.829118
        Mask: 0x2000800002008890
          Disconnection Complete
          Encryption Change
          Read Remote Version Information Complete
          Hardware Error
          Data Buffer Overflow
          Encryption Key Refresh Complete
          LE Meta
> HCI Event: Command Complete (0x0e) plen 4                 #32 [hci1] 0.829704
      Set Event Mask (0x03|0x0001) ncmd 1
        Status: Success (0x00)
< HCI Command: Read BD ADDR (0x04|0x0009) plen 0            #33 [hci1] 0.849130
> HCI Event: Command Complete (0x0e) plen 10                #34 [hci1] 0.849668
      Read BD ADDR (0x04|0x0009) ncmd 1
        Status: Success (0x00)
        Address: 00:00:00:00:00:00 (OUI 00-00-00)
< HCI Command: LE Set Random Address (0x08|0x0005) plen 6   #35 [hci1] 0.869135
        Address: D5:B6:CC:31:DB:3B (Static)
> HCI Event: Command Complete (0x0e) plen 4                 #36 [hci1] 0.869674
      LE Set Random Address (0x08|0x0005) ncmd 1
        Status: Success (0x00)
< HCI Command: LE Set Extended Adv.. (0x08|0x0036) plen 25  #37 [hci1] 3.449221
        Handle: 0x00
        Properties: 0x0013
          Connectable
          Scannable
          Use legacy advertising PDUs: ADV_IND
        Min advertising interval: 100.000 msec (0x00a0)
        Max advertising interval: 150.000 msec (0x00f0)
        Channel map: 37, 38, 39 (0x07)
        Own address type: Random (0x01)
        Peer address type: Public (0x00)
        Peer address: 00:00:00:00:00:00 (OUI 00-00-00)
        Filter policy: Allow Scan Request from Any, Allow Connect Request from Any (0x00)
        TX power: Host has no preference (0x7f)
        Primary PHY: LE 1M (0x01)
        Secondary max skip: 0x00
        Secondary PHY: LE 1M (0x01)
        SID: 0x00
        Scan request notifications: Disabled (0x00)
> HCI Event: Command Complete (0x0e) plen 5                 #38 [hci1] 3.450013
      LE Set Extended Advertising Parameters (0x08|0x0036) ncmd 1
        Status: Success (0x00)
        TX power (selected): 0 dbm (0x00)
< HCI Command: LE Set Advertising S.. (0x08|0x0035) plen 7  #39 [hci1] 3.469155
        Advertising handle: 0x00
        Advertising random address: D5:B6:CC:31:DB:3B (Static)
> HCI Event: Command Complete (0x0e) plen 4                 #40 [hci1] 3.469690
      LE Set Advertising Set Random Address (0x08|0x0035) ncmd 1
        Status: Success (0x00)
< HCI Command: LE Set Extended Adv.. (0x08|0x0037) plen 22  #41 [hci1] 3.489156
        Handle: 0x00
        Operation: Complete extended advertising data (0x03)
        Fragment preference: Minimize fragmentation (0x01)
        Data length: 0x12
        Flags: 0x06
          LE General Discoverable Mode
          BR/EDR Not Supported
        Name (complete): Tester_F6B11A
> HCI Event: Command Complete (0x0e) plen 4                 #42 [hci1] 3.489831
      LE Set Extended Advertising Data (0x08|0x0037) ncmd 1
        Status: Success (0x00)
< HCI Command: LE Set Extended Scan.. (0x08|0x0038) plen 4  #43 [hci1] 3.509145
        Handle: 0x00
        Operation: Complete scan response data (0x03)
        Fragment preference: Minimize fragmentation (0x01)
        Data length: 0x00
> HCI Event: Command Complete (0x0e) plen 4                 #44 [hci1] 3.509692
      LE Set Extended Scan Response Data (0x08|0x0038) ncmd 1
        Status: Success (0x00)
< HCI Command: LE Set Extended Adve.. (0x08|0x0039) plen 6  #45 [hci1] 3.529202
        Extended advertising: Enabled (0x01)
        Number of sets: 1 (0x01)
        Entry 0
          Handle: 0x00
          Duration: 0 ms (0x00)
          Max ext adv events: 0
> HCI Event: Command Complete (0x0e) plen 4                 #46 [hci1] 3.529833
      LE Set Extended Advertising Enable (0x08|0x0039) ncmd 1
        Status: Success (0x00)
> HCI Event: LE Meta Event (0x3e) plen 31                   #47 [hci1] 4.589993
      LE Enhanced Connection Complete (0x0a)
        Status: Success (0x00)
        Handle: 399
        Role: Peripheral (0x01)
        Peer address type: Public (0x00)
        Peer address: DF:A9:FF:F6:B1:1A (OUI DF-A9-FF)
        Local resolvable private address: 00:00:00:00:00:00 (Non-Resolvable)
        Peer resolvable private address: 00:00:00:00:00:00 (Non-Resolvable)
        Connection interval: 87.50 msec (0x0046)
        Connection latency: 0 (0x0000)
        Supervision timeout: 25120 msec (0x09d0)
        Central clock accuracy: 0x01
> HCI Event: LE Meta Event (0x3e) plen 6                    #48 [hci1] 4.590045
      LE Advertising Set Terminated (0x12)
        Status: Success (0x00)
        Handle: 0
        Connection handle: 399
        Number of completed extended advertising events: 0
< HCI Command: LE Read Remote Used... (0x08|0x0016) plen 2  #49 [hci1] 4.610248
        Handle: 399 Address: DF:A9:FF:F6:B1:1A (OUI DF-A9-FF)
< ACL Data TX: Handle 399 flags 0x00 dlen 7                 #50 [hci1] 4.610272
      ATT: Exchange MTU Request (0x02) len 2
        Client RX MTU: 251
> HCI Event: Command Status (0x0f) plen 4                   #51 [hci1] 4.610861
      LE Read Remote Used Features (0x08|0x0016) ncmd 1
        Status: Success (0x00)
> HCI Event: Number of Completed Packets (0x13) plen 5      #52 [hci1] 4.765913
        Num handles: 1
        Handle: 399 Address: DF:A9:FF:F6:B1:1A (OUI DF-A9-FF)
        Count: 1
        #50: len 7 (0 Kb/s)
        Latency: 155 msec (155-155 msec ~155 msec)
> HCI Event: LE Meta Event (0x3e) plen 12                   #53 [hci1] 4.853944
      LE Read Remote Used Features (0x04)
        Status: Success (0x00)
        Handle: 399 Address: DF:A9:FF:F6:B1:1A (OUI DF-A9-FF)
        Features: 0x2d 0x49 0x00 0xf7 0x67 0xd8 0x00 0x00
          LE Encryption
          Extended Reject Indication
          Peripheral-initiated Features Exchange
          LE Data Packet Length Extension
          LE 2M PHY
          LE Coded PHY
          Channel Selection Algorithm #2
          Periodic Advertising Sync Transfer - Sender
          Periodic Advertising Sync Transfer - Recipient
          Sleep Clock Accuracy Updates
          Connected Isochronous Stream - Central
          Connected Isochronous Stream - Peripheral
          Isochronous Broadcaster
          Synchronized Receiver
          Connected Isochronous Stream (Host Support)
          LE Power Control Request
          LE Power Control Request
          Connection Subrating
          Connection Subrating (Host Support)
          Unknown features (0x0000d80000000000)
> ACL Data RX: Handle 399 flags 0x02 dlen 11                #54 [hci1] 7.303509
      SMP: Pairing Request (0x01) len 6
        IO capability: KeyboardDisplay (0x04)
        OOB data: Authentication data not present (0x00)
        Authentication requirement: Bonding, MITM, SC, No Keypresses (0x0d)
        Max encryption key size: 16
        Initiator key distribution: EncKey IdKey (0x03)
        Responder key distribution: EncKey IdKey Sign (0x07)
< HCI Command: Host Number of Compl.. (0x03|0x0035) plen 5  #55 [hci1] 7.309727
        Num handles: 1
        Handle: 399 Address: DF:A9:FF:F6:B1:1A (OUI DF-A9-FF)
        Count: 1
< ACL Data TX: Handle 399 flags 0x00 dlen 11                #56 [hci1] 7.309961
      SMP: Pairing Response (0x02) len 6
        IO capability: DisplayOnly (0x00)
        OOB data: Authentication data not present (0x00)
        Authentication requirement: Bonding, No MITM, SC, No Keypresses (0x09)
        Max encryption key size: 16
        Initiator key distribution: IdKey (0x02)
        Responder key distribution: <none> (0x00)
> ACL Data RX: Handle 399 flags 0x02 dlen 7                 #57 [hci1] 7.390999
      ATT: Exchange MTU Response (0x03) len 2
        Server RX MTU: 23
< HCI Command: Host Number of Compl.. (0x03|0x0035) plen 5  #58 [hci1] 7.409665
        Num handles: 1
        Handle: 399 Address: DF:A9:FF:F6:B1:1A (OUI DF-A9-FF)
        Count: 1
> HCI Event: Number of Completed Packets (0x13) plen 5      #59 [hci1] 7.478816
        Num handles: 1
        Handle: 399 Address: DF:A9:FF:F6:B1:1A (OUI DF-A9-FF)
        Count: 1
        #56: len 11 (0 Kb/s)
        Latency: 168 msec (155-168 msec ~162 msec)
> ACL Data RX: Handle 399 flags 0x02 dlen 27                #60 [hci1] 7.478961
> ACL Data RX: Handle 399 flags 0x01 dlen 27                #61 [hci1] 7.479565
> ACL Data RX: Handle 399 flags 0x01 dlen 15                #62 [hci1] 7.479900
      SMP: Pairing Public Key (0x0c) len 64
        X: 04fbc65f87048acce6528f1c691db4e2a241f1afbb16a71de310585044333f5a
        Y: 33334030e8e269ac86ec37c2f71071a2bc6900605ab156163bd45ee7afd1c3bf
< HCI Command: Host Number of Compl.. (0x03|0x0035) plen 5  #63 [hci1] 7.490113
        Num handles: 1
        Handle: 399 Address: DF:A9:FF:F6:B1:1A (OUI DF-A9-FF)
        Count: 1
< HCI Command: Host Number of Compl.. (0x03|0x0035) plen 5  #64 [hci1] 7.490315
        Num handles: 1
        Handle: 399 Address: DF:A9:FF:F6:B1:1A (OUI DF-A9-FF)
        Count: 1
< HCI Command: Host Number of Compl.. (0x03|0x0035) plen 5  #65 [hci1] 7.490891
        Num handles: 1
        Handle: 399 Address: DF:A9:FF:F6:B1:1A (OUI DF-A9-FF)
        Count: 1
< ACL Data TX: Handle 399 flags 0x00 dlen 27                #66 [hci1] 7.490942
< ACL Data TX: Handle 399 flags 0x01 dlen 27                #67 [hci1] 7.490980
< ACL Data TX: Handle 399 flags 0x01 dlen 15                #68 [hci1] 7.491079
      SMP: Pairing Public Key (0x0c) len 64
        X: 98308440221e2d910f0e54b71e7ec652857aa9b5a0dc65028824cc19db1226e9
        Y: 67a4816bcb62efb21701e31fdb27561a6217575fb007a8bbdabe7e28b6f68482
> HCI Event: Number of Completed Packets (0x13) plen 5      #69 [hci1] 7.566455
        Num handles: 1
        Handle: 399 Address: DF:A9:FF:F6:B1:1A (OUI DF-A9-FF)
        Count: 1
        #66: len 27 (2 Kb/s)
        Latency: 75 msec (75-168 msec ~118 msec)
> HCI Event: Number of Completed Packets (0x13) plen 5      #70 [hci1] 7.567177
        Num handles: 1
        Handle: 399 Address: DF:A9:FF:F6:B1:1A (OUI DF-A9-FF)
        Count: 1
        #67: len 27 (2 Kb/s)
        Latency: 76 msec (75-168 msec ~97 msec)
> HCI Event: Number of Completed Packets (0x13) plen 5      #71 [hci1] 7.653306
        Num handles: 1
        Handle: 399 Address: DF:A9:FF:F6:B1:1A (OUI DF-A9-FF)
        Count: 1
        #68: len 15 (0 Kb/s)
        Latency: 162 msec (75-168 msec ~129 msec)
> ACL Data RX: Handle 399 flags 0x02 dlen 21                #72 [hci1] 8.703660
      SMP: Pairing Confirm (0x03) len 16
        Confim value: 1029c768d1f004f5979042f0fca5e47f
< HCI Command: Host Number of Compl.. (0x03|0x0035) plen 5  #73 [hci1] 8.709894
        Num handles: 1
        Handle: 399 Address: DF:A9:FF:F6:B1:1A (OUI DF-A9-FF)
        Count: 1
< ACL Data TX: Handle 399 flags 0x00 dlen 21                #74 [hci1] 8.710139
      SMP: Pairing Confirm (0x03) len 16
        Confim value: c578ae6051f2051e15b0773d7af7d486
> HCI Event: Number of Completed Packets (0x13) plen 5      #75 [hci1] 8.878560
        Num handles: 1
        Handle: 399 Address: DF:A9:FF:F6:B1:1A (OUI DF-A9-FF)
        Count: 1
        #74: len 21 (1 Kb/s)
        Latency: 168 msec (75-168 msec ~149 msec)
> ACL Data RX: Handle 399 flags 0x02 dlen 21                #76 [hci1] 8.878885
      SMP: Pairing Random (0x04) len 16
        Random value: fcad417e7da239ac0000000000000000
< HCI Command: Host Number of Compl.. (0x03|0x0035) plen 5  #77 [hci1] 8.889994
        Num handles: 1
        Handle: 399 Address: DF:A9:FF:F6:B1:1A (OUI DF-A9-FF)
        Count: 1
< ACL Data TX: Handle 399 flags 0x00 dlen 21                #78 [hci1] 8.890073
      SMP: Pairing Random (0x04) len 16
        Random value: 8e6108f966a694cbe26df70bb96773e6
> HCI Event: Number of Completed Packets (0x13) plen 5      #79 [hci1] 9.053329
        Num handles: 1
        Handle: 399 Address: DF:A9:FF:F6:B1:1A (OUI DF-A9-FF)
        Count: 1
        #78: len 21 (1 Kb/s)
        Latency: 163 msec (75-168 msec ~156 msec)
> ACL Data RX: Handle 399 flags 0x02 dlen 21                #80 [hci1] 9.141227
      SMP: Pairing Confirm (0x03) len 16
        Confim value: 93535222d8a9134a1ad82c25ef590e68
< HCI Command: Host Number of Compl.. (0x03|0x0035) plen 5  #81 [hci1] 9.149680
        Num handles: 1
        Handle: 399 Address: DF:A9:FF:F6:B1:1A (OUI DF-A9-FF)
        Count: 1
< ACL Data TX: Handle 399 flags 0x00 dlen 21                #82 [hci1] 9.149874
      SMP: Pairing Confirm (0x03) len 16
        Confim value: 25b251ad8d04561c5c03ee5a7d366862
> HCI Event: Number of Completed Packets (0x13) plen 5      #83 [hci1] 9.315966
        Num handles: 1
        Handle: 399 Address: DF:A9:FF:F6:B1:1A (OUI DF-A9-FF)
        Count: 1
        #82: len 21 (1 Kb/s)
        Latency: 166 msec (75-168 msec ~161 msec)
> ACL Data RX: Handle 399 flags 0x02 dlen 21                #84 [hci1] 9.316363
      SMP: Pairing Random (0x04) len 16
        Random value: 7f5114bc98cc5ac20000000000000000
< HCI Command: Host Number of Compl.. (0x03|0x0035) plen 5  #85 [hci1] 9.329991
        Num handles: 1
        Handle: 399 Address: DF:A9:FF:F6:B1:1A (OUI DF-A9-FF)
        Count: 1
< ACL Data TX: Handle 399 flags 0x00 dlen 21                #86 [hci1] 9.330043
      SMP: Pairing Random (0x04) len 16
        Random value: 4d02679f89a05211af56d8b3da64d21e
> HCI Event: Number of Completed Packets (0x13) plen 5      #87 [hci1] 9.490784
        Num handles: 1
        Handle: 399 Address: DF:A9:FF:F6:B1:1A (OUI DF-A9-FF)
        Count: 1
        #86: len 21 (1 Kb/s)
        Latency: 160 msec (75-168 msec ~160 msec)
> ACL Data RX: Handle 399 flags 0x02 dlen 21                #88 [hci1] 9.578675
      SMP: Pairing Confirm (0x03) len 16
        Confim value: f3505e60f34e046927329e5ffbe8bd8b
< HCI Command: Host Number of Compl.. (0x03|0x0035) plen 5  #89 [hci1] 9.589781
        Num handles: 1
        Handle: 399 Address: DF:A9:FF:F6:B1:1A (OUI DF-A9-FF)
        Count: 1
< ACL Data TX: Handle 399 flags 0x00 dlen 21                #90 [hci1] 9.589966
      SMP: Pairing Confirm (0x03) len 16
        Confim value: 174c1b6efdedf4acb0a1fe10797dfd7c
> HCI Event: Number of Completed Packets (0x13) plen 5      #91 [hci1] 9.753487
        Num handles: 1
        Handle: 399 Address: DF:A9:FF:F6:B1:1A (OUI DF-A9-FF)
        Count: 1
        #90: len 21 (1 Kb/s)
        Latency: 163 msec (75-168 msec ~162 msec)
> ACL Data RX: Handle 399 flags 0x02 dlen 21                #92 [hci1] 9.753828
      SMP: Pairing Random (0x04) len 16
        Random value: 568c79311f9bfa750000000000000000
< HCI Command: Host Number of Compl.. (0x03|0x0035) plen 5  #93 [hci1] 9.769579
        Num handles: 1
        Handle: 399 Address: DF:A9:FF:F6:B1:1A (OUI DF-A9-FF)
        Count: 1
< ACL Data TX: Handle 399 flags 0x00 dlen 21                #94 [hci1] 9.769687
      SMP: Pairing Random (0x04) len 16
        Random value: 5e8286bc235a02440d0c3424a2acf8fd
> HCI Event: Number of Completed Packets (0x13) plen 5      #95 [hci1] 9.928291
        Num handles: 1
        Handle: 399 Address: DF:A9:FF:F6:B1:1A (OUI DF-A9-FF)
        Count: 1
        #94: len 21 (1 Kb/s)
        Latency: 158 msec (75-168 msec ~160 msec)
> ACL Data RX: Handle 399 flags 0x02 dlen 21               #96 [hci1] 10.016126
      SMP: Pairing Confirm (0x03) len 16
        Confim value: ecd7de5567bd983d17811c4415304fb2
< HCI Command: Host Number of Comp.. (0x03|0x0035) plen 5  #97 [hci1] 10.029754
        Num handles: 1
        Handle: 399 Address: DF:A9:FF:F6:B1:1A (OUI DF-A9-FF)
        Count: 1
< ACL Data TX: Handle 399 flags 0x00 dlen 21               #98 [hci1] 10.029955
      SMP: Pairing Confirm (0x03) len 16
        Confim value: fd30874f83f68984ca00ace44b07531f
> HCI Event: Number of Completed Packets (0x13) plen 5     #99 [hci1] 10.190967
        Num handles: 1
        Handle: 399 Address: DF:A9:FF:F6:B1:1A (OUI DF-A9-FF)
        Count: 1
        #98: len 21 (1 Kb/s)
        Latency: 161 msec (75-168 msec ~160 msec)
> ACL Data RX: Handle 399 flags 0x02 dlen 21              #100 [hci1] 10.191226
      SMP: Pairing Random (0x04) len 16
        Random value: cf4ac26dfe6a6b7c0000000000000000
< HCI Command: Host Number of Com.. (0x03|0x0035) plen 5  #101 [hci1] 10.209857
        Num handles: 1
        Handle: 399 Address: DF:A9:FF:F6:B1:1A (OUI DF-A9-FF)
        Count: 1
< ACL Data TX: Handle 399 flags 0x00 dlen 21              #102 [hci1] 10.210012
      SMP: Pairing Random (0x04) len 16
        Random value: 5c4a1bcadd27bd58e945097b00bad7ac
> HCI Event: Number of Completed Packets (0x13) plen 5    #103 [hci1] 10.365856
        Num handles: 1
        Handle: 399 Address: DF:A9:FF:F6:B1:1A (OUI DF-A9-FF)
        Count: 1
        #102: len 21 (1 Kb/s)
        Latency: 155 msec (75-168 msec ~158 msec)
> ACL Data RX: Handle 399 flags 0x02 dlen 21              #104 [hci1] 10.453579
      SMP: Pairing Confirm (0x03) len 16
        Confim value: 57446013a88a14c66b528e6dce63c7eb
< HCI Command: Host Number of Com.. (0x03|0x0035) plen 5  #105 [hci1] 10.469763
        Num handles: 1
        Handle: 399 Address: DF:A9:FF:F6:B1:1A (OUI DF-A9-FF)
        Count: 1
< ACL Data TX: Handle 399 flags 0x00 dlen 21              #106 [hci1] 10.469956
      SMP: Pairing Confirm (0x03) len 16
        Confim value: 3814701a5179c77c5aa7aa764c0d809e
> HCI Event: Number of Completed Packets (0x13) plen 5    #107 [hci1] 10.628492
        Num handles: 1
        Handle: 399 Address: DF:A9:FF:F6:B1:1A (OUI DF-A9-FF)
        Count: 1
        #106: len 21 (1 Kb/s)
        Latency: 158 msec (75-168 msec ~158 msec)
> ACL Data RX: Handle 399 flags 0x02 dlen 21              #108 [hci1] 10.628779
      SMP: Pairing Random (0x04) len 16
        Random value: 8e660ccc5f278cd80000000000000000
< HCI Command: Host Number of Com.. (0x03|0x0035) plen 5  #109 [hci1] 10.629791
        Num handles: 1
        Handle: 399 Address: DF:A9:FF:F6:B1:1A (OUI DF-A9-FF)
        Count: 1
< ACL Data TX: Handle 399 flags 0x00 dlen 21              #110 [hci1] 10.629889
      SMP: Pairing Random (0x04) len 16
        Random value: 32527e6e64e79f33b2e374394db8ab2d
> HCI Event: Number of Completed Packets (0x13) plen 5    #111 [hci1] 10.803194
        Num handles: 1
        Handle: 399 Address: DF:A9:FF:F6:B1:1A (OUI DF-A9-FF)
        Count: 1
        #110: len 21 (0 Kb/s)
        Latency: 173 msec (75-173 msec ~165 msec)
> ACL Data RX: Handle 399 flags 0x02 dlen 21              #112 [hci1] 10.891083
      SMP: Pairing Confirm (0x03) len 16
        Confim value: aa750bfc348dc0209470ef14cd5f2545
< HCI Command: Host Number of Com.. (0x03|0x0035) plen 5  #113 [hci1] 10.909320
        Num handles: 1
        Handle: 399 Address: DF:A9:FF:F6:B1:1A (OUI DF-A9-FF)
        Count: 1
< ACL Data TX: Handle 399 flags 0x00 dlen 21              #114 [hci1] 10.909354
      SMP: Pairing Confirm (0x03) len 16
        Confim value: 62051b8a26aaa3086fa50c55f4d7d167
> HCI Event: Number of Completed Packets (0x13) plen 5    #115 [hci1] 11.065906
        Num handles: 1
        Handle: 399 Address: DF:A9:FF:F6:B1:1A (OUI DF-A9-FF)
        Count: 1
        #114: len 21 (1 Kb/s)
        Latency: 156 msec (75-173 msec ~161 msec)
> ACL Data RX: Handle 399 flags 0x02 dlen 21              #116 [hci1] 11.066279
      SMP: Pairing Random (0x04) len 16
        Random value: e13c9e30065c53b30000000000000000
< HCI Command: Host Number of Com.. (0x03|0x0035) plen 5  #117 [hci1] 11.069965
        Num handles: 1
        Handle: 399 Address: DF:A9:FF:F6:B1:1A (OUI DF-A9-FF)
        Count: 1
< ACL Data TX: Handle 399 flags 0x00 dlen 21              #118 [hci1] 11.070114
      SMP: Pairing Random (0x04) len 16
        Random value: dddbdfe2838e9a8cc6964353c850fef7
> HCI Event: Number of Completed Packets (0x13) plen 5    #119 [hci1] 11.240813
        Num handles: 1
        Handle: 399 Address: DF:A9:FF:F6:B1:1A (OUI DF-A9-FF)
        Count: 1
        #118: len 21 (0 Kb/s)
        Latency: 170 msec (75-173 msec ~165 msec)
> ACL Data RX: Handle 399 flags 0x02 dlen 21              #120 [hci1] 11.328609
      SMP: Pairing Confirm (0x03) len 16
        Confim value: 0149aa567e9201448cd8f02cceaf2878
< HCI Command: Host Number of Com.. (0x03|0x0035) plen 5  #121 [hci1] 11.329691
        Num handles: 1
        Handle: 399 Address: DF:A9:FF:F6:B1:1A (OUI DF-A9-FF)
        Count: 1
< ACL Data TX: Handle 399 flags 0x00 dlen 21              #122 [hci1] 11.329907
      SMP: Pairing Confirm (0x03) len 16
        Confim value: 7be4bff0c6dd794e1347ef737d26f90c
> HCI Event: Number of Completed Packets (0x13) plen 5    #123 [hci1] 11.503408
        Num handles: 1
        Handle: 399 Address: DF:A9:FF:F6:B1:1A (OUI DF-A9-FF)
        Count: 1
        #122: len 21 (0 Kb/s)
        Latency: 173 msec (75-173 msec ~169 msec)
> ACL Data RX: Handle 399 flags 0x02 dlen 21              #124 [hci1] 11.503845
      SMP: Pairing Random (0x04) len 16
        Random value: 63645d56eb8848900000000000000000
< HCI Command: Host Number of Com.. (0x03|0x0035) plen 5  #125 [hci1] 11.509960
        Num handles: 1
        Handle: 399 Address: DF:A9:FF:F6:B1:1A (OUI DF-A9-FF)
        Count: 1
< ACL Data TX: Handle 399 flags 0x00 dlen 21              #126 [hci1] 11.510069
      SMP: Pairing Random (0x04) len 16
        Random value: eb9f1915536596b6fc3db1c86b2b1970
> HCI Event: Number of Completed Packets (0x13) plen 5    #127 [hci1] 11.678176
        Num handles: 1
        Handle: 399 Address: DF:A9:FF:F6:B1:1A (OUI DF-A9-FF)
        Count: 1
        #126: len 21 (1 Kb/s)
        Latency: 168 msec (75-173 msec ~168 msec)
> ACL Data RX: Handle 399 flags 0x02 dlen 21              #128 [hci1] 11.766036
      SMP: Pairing Confirm (0x03) len 16
        Confim value: 11b59d2d47706b35f58b6b5b7876c07a
< HCI Command: Host Number of Com.. (0x03|0x0035) plen 5  #129 [hci1] 11.769326
        Num handles: 1
        Handle: 399 Address: DF:A9:FF:F6:B1:1A (OUI DF-A9-FF)
        Count: 1
< ACL Data TX: Handle 399 flags 0x00 dlen 21              #130 [hci1] 11.769363
      SMP: Pairing Confirm (0x03) len 16
        Confim value: e696334f2736bc2c9b0bc96f9d5801a7
> HCI Event: Number of Completed Packets (0x13) plen 5    #131 [hci1] 11.940874
        Num handles: 1
        Handle: 399 Address: DF:A9:FF:F6:B1:1A (OUI DF-A9-FF)
        Count: 1
        #130: len 21 (0 Kb/s)
        Latency: 171 msec (75-173 msec ~170 msec)
> ACL Data RX: Handle 399 flags 0x02 dlen 21              #132 [hci1] 11.941226
      SMP: Pairing Random (0x04) len 16
        Random value: 0674fd04c61ca76c0000000000000000
< HCI Command: Host Number of Com.. (0x03|0x0035) plen 5  #133 [hci1] 11.949958
        Num handles: 1
        Handle: 399 Address: DF:A9:FF:F6:B1:1A (OUI DF-A9-FF)
        Count: 1
< ACL Data TX: Handle 399 flags 0x00 dlen 21              #134 [hci1] 11.950042
      SMP: Pairing Random (0x04) len 16
        Random value: 5c794dc9ad9f2c3f295ebd5ad5e1c3cf
> HCI Event: Number of Completed Packets (0x13) plen 5    #135 [hci1] 12.115727
        Num handles: 1
        Handle: 399 Address: DF:A9:FF:F6:B1:1A (OUI DF-A9-FF)
        Count: 1
        #134: len 21 (1 Kb/s)
        Latency: 165 msec (75-173 msec ~167 msec)
> ACL Data RX: Handle 399 flags 0x02 dlen 21              #136 [hci1] 12.203628
      SMP: Pairing Confirm (0x03) len 16
        Confim value: 07838fcce4b01187c76e2d4194c0107b
< HCI Command: Host Number of Com.. (0x03|0x0035) plen 5  #137 [hci1] 12.209766
        Num handles: 1
        Handle: 399 Address: DF:A9:FF:F6:B1:1A (OUI DF-A9-FF)
        Count: 1
< ACL Data TX: Handle 399 flags 0x00 dlen 21              #138 [hci1] 12.209976
      SMP: Pairing Confirm (0x03) len 16
        Confim value: 944e40344081072a65cd75eb46e15290
> HCI Event: Number of Completed Packets (0x13) plen 5    #139 [hci1] 12.378520
        Num handles: 1
        Handle: 399 Address: DF:A9:FF:F6:B1:1A (OUI DF-A9-FF)
        Count: 1
        #138: len 21 (1 Kb/s)
        Latency: 168 msec (75-173 msec ~168 msec)
> ACL Data RX: Handle 399 flags 0x02 dlen 21              #140 [hci1] 12.378766
      SMP: Pairing Random (0x04) len 16
        Random value: 4271f6c28595ddeb0000000000000000
< HCI Command: Host Number of Com.. (0x03|0x0035) plen 5  #141 [hci1] 12.389914
        Num handles: 1
        Handle: 399 Address: DF:A9:FF:F6:B1:1A (OUI DF-A9-FF)
        Count: 1
< ACL Data TX: Handle 399 flags 0x00 dlen 21              #142 [hci1] 12.389965
      SMP: Pairing Random (0x04) len 16
        Random value: 5c2fff312cdf99c9491988e877355a9a
> HCI Event: Number of Completed Packets (0x13) plen 5    #143 [hci1] 12.553217
        Num handles: 1
        Handle: 399 Address: DF:A9:FF:F6:B1:1A (OUI DF-A9-FF)
        Count: 1
        #142: len 21 (1 Kb/s)
        Latency: 163 msec (75-173 msec ~165 msec)
> ACL Data RX: Handle 399 flags 0x02 dlen 21              #144 [hci1] 12.641155
      SMP: Pairing Confirm (0x03) len 16
        Confim value: 5c2ceb65879d0ca514d6096a84c177b2
< HCI Command: Host Number of Com.. (0x03|0x0035) plen 5  #145 [hci1] 12.649436
        Num handles: 1
        Handle: 399 Address: DF:A9:FF:F6:B1:1A (OUI DF-A9-FF)
        Count: 1
< ACL Data TX: Handle 399 flags 0x00 dlen 21              #146 [hci1] 12.649581
      SMP: Pairing Confirm (0x03) len 16
        Confim value: e399458d604039c992d11bca6350e820
> HCI Event: Number of Completed Packets (0x13) plen 5    #147 [hci1] 12.816017
        Num handles: 1
        Handle: 399 Address: DF:A9:FF:F6:B1:1A (OUI DF-A9-FF)
        Count: 1
        #146: len 21 (1 Kb/s)
        Latency: 166 msec (75-173 msec ~166 msec)
> ACL Data RX: Handle 399 flags 0x02 dlen 21              #148 [hci1] 12.816170
      SMP: Pairing Random (0x04) len 16
        Random value: f08d3355b3d88da70000000000000000
< HCI Command: Host Number of Com.. (0x03|0x0035) plen 5  #149 [hci1] 12.830076
        Num handles: 1
        Handle: 399 Address: DF:A9:FF:F6:B1:1A (OUI DF-A9-FF)
        Count: 1
< ACL Data TX: Handle 399 flags 0x00 dlen 21              #150 [hci1] 12.830168
      SMP: Pairing Random (0x04) len 16
        Random value: c629a3a987d808e808655d558dfc1155
> HCI Event: Number of Completed Packets (0x13) plen 5    #151 [hci1] 12.990677
        Num handles: 1
        Handle: 399 Address: DF:A9:FF:F6:B1:1A (OUI DF-A9-FF)
        Count: 1
        #150: len 21 (1 Kb/s)
        Latency: 160 msec (75-173 msec ~163 msec)
> ACL Data RX: Handle 399 flags 0x02 dlen 21              #152 [hci1] 13.078537
      SMP: Pairing Confirm (0x03) len 16
        Confim value: 0a678573e90dc76be6b0bca7203ed565
< HCI Command: Host Number of Com.. (0x03|0x0035) plen 5  #153 [hci1] 13.089779
        Num handles: 1
        Handle: 399 Address: DF:A9:FF:F6:B1:1A (OUI DF-A9-FF)
        Count: 1
< ACL Data TX: Handle 399 flags 0x00 dlen 21              #154 [hci1] 13.089950
      SMP: Pairing Confirm (0x03) len 16
        Confim value: 56375ce99addc3857e6c04b946ef010a
> HCI Event: Number of Completed Packets (0x13) plen 5    #155 [hci1] 13.253495
        Num handles: 1
        Handle: 399 Address: DF:A9:FF:F6:B1:1A (OUI DF-A9-FF)
        Count: 1
        #154: len 21 (1 Kb/s)
        Latency: 163 msec (75-173 msec ~163 msec)
> ACL Data RX: Handle 399 flags 0x02 dlen 21              #156 [hci1] 13.253675
      SMP: Pairing Random (0x04) len 16
        Random value: 46e393359186b8870000000000000000
< HCI Command: Host Number of Com.. (0x03|0x0035) plen 5  #157 [hci1] 13.270012
        Num handles: 1
        Handle: 399 Address: DF:A9:FF:F6:B1:1A (OUI DF-A9-FF)
        Count: 1
< ACL Data TX: Handle 399 flags 0x00 dlen 21              #158 [hci1] 13.270164
      SMP: Pairing Random (0x04) len 16
        Random value: 92f20f6ad8f13724432c7fd6001c45ff
> HCI Event: Number of Completed Packets (0x13) plen 5    #159 [hci1] 13.428233
        Num handles: 1
        Handle: 399 Address: DF:A9:FF:F6:B1:1A (OUI DF-A9-FF)
        Count: 1
        #158: len 21 (1 Kb/s)
        Latency: 158 msec (75-173 msec ~160 msec)
> ACL Data RX: Handle 399 flags 0x02 dlen 21              #160 [hci1] 13.516014
      SMP: Pairing Confirm (0x03) len 16
        Confim value: 1697112bffa725792d17d4fff6a5dd90
< HCI Command: Host Number of Com.. (0x03|0x0035) plen 5  #161 [hci1] 13.529541
        Num handles: 1
        Handle: 399 Address: DF:A9:FF:F6:B1:1A (OUI DF-A9-FF)
        Count: 1
< ACL Data TX: Handle 399 flags 0x00 dlen 21              #162 [hci1] 13.529708
      SMP: Pairing Confirm (0x03) len 16
        Confim value: 90a64b8c1402f082afdd7c05508e3f2c
> HCI Event: Number of Completed Packets (0x13) plen 5    #163 [hci1] 13.690858
        Num handles: 1
        Handle: 399 Address: DF:A9:FF:F6:B1:1A (OUI DF-A9-FF)
        Count: 1
        #162: len 21 (1 Kb/s)
        Latency: 161 msec (75-173 msec ~160 msec)
> ACL Data RX: Handle 399 flags 0x02 dlen 21              #164 [hci1] 13.691218
      SMP: Pairing Random (0x04) len 16
        Random value: 890ae22c9a5523320000000000000000
< HCI Command: Host Number of Com.. (0x03|0x0035) plen 5  #165 [hci1] 13.709987
        Num handles: 1
        Handle: 399 Address: DF:A9:FF:F6:B1:1A (OUI DF-A9-FF)
        Count: 1
< ACL Data TX: Handle 399 flags 0x00 dlen 21              #166 [hci1] 13.710099
      SMP: Pairing Random (0x04) len 16
        Random value: 23ac32ebbb5e14c8a6b9622f296d277f
> HCI Event: Number of Completed Packets (0x13) plen 5    #167 [hci1] 13.865712
        Num handles: 1
        Handle: 399 Address: DF:A9:FF:F6:B1:1A (OUI DF-A9-FF)
        Count: 1
        #166: len 21 (1 Kb/s)
        Latency: 155 msec (75-173 msec ~158 msec)
> ACL Data RX: Handle 399 flags 0x02 dlen 21              #168 [hci1] 13.953531
      SMP: Pairing Confirm (0x03) len 16
        Confim value: c7fd4650a7640e42dc4a49175a29821e
< HCI Command: Host Number of Com.. (0x03|0x0035) plen 5  #169 [hci1] 13.969732
        Num handles: 1
        Handle: 399 Address: DF:A9:FF:F6:B1:1A (OUI DF-A9-FF)
        Count: 1
< ACL Data TX: Handle 399 flags 0x00 dlen 21              #170 [hci1] 13.969934
      SMP: Pairing Confirm (0x03) len 16
        Confim value: 4a18ee28a9445dd5d2767e9d78f09086
> HCI Event: Number of Completed Packets (0x13) plen 5    #171 [hci1] 14.128294
        Num handles: 1
        Handle: 399 Address: DF:A9:FF:F6:B1:1A (OUI DF-A9-FF)
        Count: 1
        #170: len 21 (1 Kb/s)
        Latency: 158 msec (75-173 msec ~158 msec)
> ACL Data RX: Handle 399 flags 0x02 dlen 21              #172 [hci1] 14.128678
      SMP: Pairing Random (0x04) len 16
        Random value: 86941670f868ec8e0000000000000000
< HCI Command: Host Number of Com.. (0x03|0x0035) plen 5  #173 [hci1] 14.129955
        Num handles: 1
        Handle: 399 Address: DF:A9:FF:F6:B1:1A (OUI DF-A9-FF)
        Count: 1
< ACL Data TX: Handle 399 flags 0x00 dlen 21              #174 [hci1] 14.130033
      SMP: Pairing Random (0x04) len 16
        Random value: 297efe85e67448a15f56bd27e3a3cf1d
> HCI Event: Number of Completed Packets (0x13) plen 5    #175 [hci1] 14.303163
        Num handles: 1
        Handle: 399 Address: DF:A9:FF:F6:B1:1A (OUI DF-A9-FF)
        Count: 1
        #174: len 21 (0 Kb/s)
        Latency: 173 msec (75-173 msec ~165 msec)
> ACL Data RX: Handle 399 flags 0x02 dlen 21              #176 [hci1] 14.390976
      SMP: Pairing Confirm (0x03) len 16
        Confim value: 3966c433804cf7e4d180fee0ed5e2e93
< HCI Command: Host Number of Com.. (0x03|0x0035) plen 5  #177 [hci1] 14.409767
        Num handles: 1
        Handle: 399 Address: DF:A9:FF:F6:B1:1A (OUI DF-A9-FF)
        Count: 1
< ACL Data TX: Handle 399 flags 0x00 dlen 21              #178 [hci1] 14.409876
      SMP: Pairing Confirm (0x03) len 16
        Confim value: b675d8b896a272d2c198e5d949eecdf9
> HCI Event: Number of Completed Packets (0x13) plen 5    #179 [hci1] 14.565911
        Num handles: 1
        Handle: 399 Address: DF:A9:FF:F6:B1:1A (OUI DF-A9-FF)
        Count: 1
        #178: len 21 (1 Kb/s)
        Latency: 156 msec (75-173 msec ~160 msec)
> ACL Data RX: Handle 399 flags 0x02 dlen 21              #180 [hci1] 14.566164
      SMP: Pairing Random (0x04) len 16
        Random value: 18283bd343382dd60000000000000000
< HCI Command: Host Number of Com.. (0x03|0x0035) plen 5  #181 [hci1] 14.569976
        Num handles: 1
        Handle: 399 Address: DF:A9:FF:F6:B1:1A (OUI DF-A9-FF)
        Count: 1
< ACL Data TX: Handle 399 flags 0x00 dlen 21              #182 [hci1] 14.570062
      SMP: Pairing Random (0x04) len 16
        Random value: 25a9493fd3ce4faf02be7293595bb7c6
> HCI Event: Number of Completed Packets (0x13) plen 5    #183 [hci1] 14.740619
        Num handles: 1
        Handle: 399 Address: DF:A9:FF:F6:B1:1A (OUI DF-A9-FF)
        Count: 1
        #182: len 21 (0 Kb/s)
        Latency: 170 msec (75-173 msec ~165 msec)
> ACL Data RX: Handle 399 flags 0x02 dlen 21              #184 [hci1] 14.828434
      SMP: Pairing Confirm (0x03) len 16
        Confim value: fc977c34f7a33120523b826f8418b545
< HCI Command: Host Number of Com.. (0x03|0x0035) plen 5  #185 [hci1] 14.829711
        Num handles: 1
        Handle: 399 Address: DF:A9:FF:F6:B1:1A (OUI DF-A9-FF)
        Count: 1
< ACL Data TX: Handle 399 flags 0x00 dlen 21              #186 [hci1] 14.829844
      SMP: Pairing Confirm (0x03) len 16
        Confim value: 1276a0f82c25fc88a016064aec67c7a0
> HCI Event: Number of Completed Packets (0x13) plen 5    #187 [hci1] 15.003359
        Num handles: 1
        Handle: 399 Address: DF:A9:FF:F6:B1:1A (OUI DF-A9-FF)
        Count: 1
        #186: len 21 (0 Kb/s)
        Latency: 173 msec (75-173 msec ~169 msec)
> ACL Data RX: Handle 399 flags 0x02 dlen 21              #188 [hci1] 15.003658
      SMP: Pairing Random (0x04) len 16
        Random value: 51076b80e8197ac40000000000000000
< HCI Command: Host Number of Com.. (0x03|0x0035) plen 5  #189 [hci1] 15.010053
        Num handles: 1
        Handle: 399 Address: DF:A9:FF:F6:B1:1A (OUI DF-A9-FF)
        Count: 1
< ACL Data TX: Handle 399 flags 0x00 dlen 21              #190 [hci1] 15.010178
      SMP: Pairing Random (0x04) len 16
        Random value: 58f6b41f855a6f6c3560debd84e2affc
> HCI Event: Number of Completed Packets (0x13) plen 5    #191 [hci1] 15.178139
        Num handles: 1
        Handle: 399 Address: DF:A9:FF:F6:B1:1A (OUI DF-A9-FF)
        Count: 1
        #190: len 21 (1 Kb/s)
        Latency: 167 msec (75-173 msec ~168 msec)
> ACL Data RX: Handle 399 flags 0x02 dlen 21              #192 [hci1] 15.265990
      SMP: Pairing Confirm (0x03) len 16
        Confim value: 3865994d94581831470529a0ac4d20bb
< HCI Command: Host Number of Com.. (0x03|0x0035) plen 5  #193 [hci1] 15.269692
        Num handles: 1
        Handle: 399 Address: DF:A9:FF:F6:B1:1A (OUI DF-A9-FF)
        Count: 1
< ACL Data TX: Handle 399 flags 0x00 dlen 21              #194 [hci1] 15.269864
      SMP: Pairing Confirm (0x03) len 16
        Confim value: 33a9d430a67fd49803136283d2a012c7
> HCI Event: Number of Completed Packets (0x13) plen 5    #195 [hci1] 15.440775
        Num handles: 1
        Handle: 399 Address: DF:A9:FF:F6:B1:1A (OUI DF-A9-FF)
        Count: 1
        #194: len 21 (0 Kb/s)
        Latency: 170 msec (75-173 msec ~169 msec)
> ACL Data RX: Handle 399 flags 0x02 dlen 21              #196 [hci1] 15.441203
      SMP: Pairing Random (0x04) len 16
        Random value: 2eebe4c516b37a9e0000000000000000
< HCI Command: Host Number of Com.. (0x03|0x0035) plen 5  #197 [hci1] 15.450032
        Num handles: 1
        Handle: 399 Address: DF:A9:FF:F6:B1:1A (OUI DF-A9-FF)
        Count: 1
< ACL Data TX: Handle 399 flags 0x00 dlen 21              #198 [hci1] 15.450126
      SMP: Pairing Random (0x04) len 16
        Random value: b67e7216d5bf664139eda2b542549666
> HCI Event: Number of Completed Packets (0x13) plen 5    #199 [hci1] 15.615577
        Num handles: 1
        Handle: 399 Address: DF:A9:FF:F6:B1:1A (OUI DF-A9-FF)
        Count: 1
        #198: len 21 (1 Kb/s)
        Latency: 165 msec (75-173 msec ~167 msec)
> ACL Data RX: Handle 399 flags 0x02 dlen 21              #200 [hci1] 15.703373
      SMP: Pairing Confirm (0x03) len 16
        Confim value: 5172dbd7f14f0d4b8f4ceea6aed16251
< HCI Command: Host Number of Com.. (0x03|0x0035) plen 5  #201 [hci1] 15.709401
        Num handles: 1
        Handle: 399 Address: DF:A9:FF:F6:B1:1A (OUI DF-A9-FF)
        Count: 1
< ACL Data TX: Handle 399 flags 0x00 dlen 21              #202 [hci1] 15.709553
      SMP: Pairing Confirm (0x03) len 16
        Confim value: 104d82efa84c8fcbd929386f203462e8
> HCI Event: Number of Completed Packets (0x13) plen 5    #203 [hci1] 15.878276
        Num handles: 1
        Handle: 399 Address: DF:A9:FF:F6:B1:1A (OUI DF-A9-FF)
        Count: 1
        #202: len 21 (1 Kb/s)
        Latency: 168 msec (75-173 msec ~168 msec)
> ACL Data RX: Handle 399 flags 0x02 dlen 21              #204 [hci1] 15.878661
      SMP: Pairing Random (0x04) len 16
        Random value: 3e421b170bfb4c190000000000000000
< HCI Command: Host Number of Com.. (0x03|0x0035) plen 5  #205 [hci1] 15.889885
        Num handles: 1
        Handle: 399 Address: DF:A9:FF:F6:B1:1A (OUI DF-A9-FF)
        Count: 1
< ACL Data TX: Handle 399 flags 0x00 dlen 21              #206 [hci1] 15.889983
      SMP: Pairing Random (0x04) len 16
        Random value: ed17f76500c95219dd01e09d1e63f87b
> HCI Event: Number of Completed Packets (0x13) plen 5    #207 [hci1] 16.053162
        Num handles: 1
        Handle: 399 Address: DF:A9:FF:F6:B1:1A (OUI DF-A9-FF)
        Count: 1
        #206: len 21 (1 Kb/s)
        Latency: 163 msec (75-173 msec ~165 msec)
> ACL Data RX: Handle 399 flags 0x02 dlen 21              #208 [hci1] 16.141095
      SMP: Pairing Confirm (0x03) len 16
        Confim value: 1dec8f7a9879a430e6dc8a863c5cf706
< HCI Command: Host Number of Com.. (0x03|0x0035) plen 5  #209 [hci1] 16.149813
        Num handles: 1
        Handle: 399 Address: DF:A9:FF:F6:B1:1A (OUI DF-A9-FF)
        Count: 1
< ACL Data TX: Handle 399 flags 0x00 dlen 21              #210 [hci1] 16.150014
      SMP: Pairing Confirm (0x03) len 16
        Confim value: 3e0f22249210df5203d2f4ff9c0cf0ed
> HCI Event: Number of Completed Packets (0x13) plen 5    #211 [hci1] 16.315912
        Num handles: 1
        Handle: 399 Address: DF:A9:FF:F6:B1:1A (OUI DF-A9-FF)
        Count: 1
        #210: len 21 (1 Kb/s)
        Latency: 165 msec (75-173 msec ~165 msec)
> ACL Data RX: Handle 399 flags 0x02 dlen 21              #212 [hci1] 16.316094
      SMP: Pairing Random (0x04) len 16
        Random value: 466ff08e7e9c34d20000000000000000
< HCI Command: Host Number of Com.. (0x03|0x0035) plen 5  #213 [hci1] 16.329933
        Num handles: 1
        Handle: 399 Address: DF:A9:FF:F6:B1:1A (OUI DF-A9-FF)
        Count: 1
< ACL Data TX: Handle 399 flags 0x00 dlen 21              #214 [hci1] 16.330010
      SMP: Pairing Random (0x04) len 16
        Random value: 81d35d47e1f6006d79c974bd9d9e1ee3
> HCI Event: Number of Completed Packets (0x13) plen 5    #215 [hci1] 16.490639
        Num handles: 1
        Handle: 399 Address: DF:A9:FF:F6:B1:1A (OUI DF-A9-FF)
        Count: 1
        #214: len 21 (1 Kb/s)
        Latency: 160 msec (75-173 msec ~163 msec)
> ACL Data RX: Handle 399 flags 0x02 dlen 21              #216 [hci1] 16.578488
      SMP: Pairing Confirm (0x03) len 16
        Confim value: 8bce47cc047d6ed97a67fd72f5463eca
< HCI Command: Host Number of Com.. (0x03|0x0035) plen 5  #217 [hci1] 16.589683
        Num handles: 1
        Handle: 399 Address: DF:A9:FF:F6:B1:1A (OUI DF-A9-FF)
        Count: 1
< ACL Data TX: Handle 399 flags 0x00 dlen 21              #218 [hci1] 16.589865
      SMP: Pairing Confirm (0x03) len 16
        Confim value: cd5718797cec5c4330e8da4753208d24
> HCI Event: Number of Completed Packets (0x13) plen 5    #219 [hci1] 16.753250
        Num handles: 1
        Handle: 399 Address: DF:A9:FF:F6:B1:1A (OUI DF-A9-FF)
        Count: 1
        #218: len 21 (1 Kb/s)
        Latency: 163 msec (75-173 msec ~163 msec)
> ACL Data RX: Handle 399 flags 0x02 dlen 21              #220 [hci1] 16.753600
      SMP: Pairing Random (0x04) len 16
        Random value: 6ca657205583edde0000000000000000
< HCI Command: Host Number of Com.. (0x03|0x0035) plen 5  #221 [hci1] 16.769898
        Num handles: 1
        Handle: 399 Address: DF:A9:FF:F6:B1:1A (OUI DF-A9-FF)
        Count: 1
< ACL Data TX: Handle 399 flags 0x00 dlen 21              #222 [hci1] 16.770068
      SMP: Pairing Random (0x04) len 16
        Random value: e7f7e0c2476823e41736a7e381bafb7c
> HCI Event: Number of Completed Packets (0x13) plen 5    #223 [hci1] 16.928092
        Num handles: 1
        Handle: 399 Address: DF:A9:FF:F6:B1:1A (OUI DF-A9-FF)
        Count: 1
        #222: len 21 (1 Kb/s)
        Latency: 158 msec (75-173 msec ~160 msec)
> ACL Data RX: Handle 399 flags 0x02 dlen 21              #224 [hci1] 17.015929
      SMP: Pairing Confirm (0x03) len 16
        Confim value: 225a3c534ea4114ec31451a22dcc2e95
< HCI Command: Host Number of Com.. (0x03|0x0035) plen 5  #225 [hci1] 17.029460
        Num handles: 1
        Handle: 399 Address: DF:A9:FF:F6:B1:1A (OUI DF-A9-FF)
        Count: 1
< ACL Data TX: Handle 399 flags 0x00 dlen 21              #226 [hci1] 17.029613
      SMP: Pairing Confirm (0x03) len 16
        Confim value: 4eec095b474417da49a080fb89dbd9af
> HCI Event: Number of Completed Packets (0x13) plen 5    #227 [hci1] 17.190735
        Num handles: 1
        Handle: 399 Address: DF:A9:FF:F6:B1:1A (OUI DF-A9-FF)
        Count: 1
        #226: len 21 (1 Kb/s)
        Latency: 161 msec (75-173 msec ~160 msec)
> ACL Data RX: Handle 399 flags 0x02 dlen 21              #228 [hci1] 17.191137
      SMP: Pairing Random (0x04) len 16
        Random value: bbd8cfbe1fe9e36d0000000000000000
< HCI Command: Host Number of Com.. (0x03|0x0035) plen 5  #229 [hci1] 17.209609
        Num handles: 1
        Handle: 399 Address: DF:A9:FF:F6:B1:1A (OUI DF-A9-FF)
        Count: 1
