Bluetooth monitor ver 5.72
= Note: Linux version 6.14.0-36-generic (x86_64)                       0.083398
= Note: Bluetooth subsystem version 2.22                               0.083401
= New Index: 00:00:00:00:00:00 (Primary,UART,hci1)              [hci1] 0.083402
= New Index: 48:5F:99:8E:E0:64 (Primary,USB,hci0)               [hci0] 0.083402
= Open Index: 00:00:00:00:00:00                                 [hci1] 0.597288
= Index Info: 00:00:00:00:00:00 (Nordic Semiconductor ASA)      [hci1] 0.597308
@ USER Open: main (privileged) version 2.22            {0x0001} [hci1] 0.597316
< HCI Command: Reset (0x03|0x0003) plen 0                    #1 [hci1] 0.598643
> HCI Event: Command Complete (0x0e) plen 4                  #2 [hci1] 0.599248
      Reset (0x03|0x0003) ncmd 1
        Status: Success (0x00)
< HCI Command: Read Local Supported... (0x04|0x0003) plen 0  #3 [hci1] 0.616692
> HCI Event: Command Complete (0x0e) plen 12                 #4 [hci1] 0.617221
      Read Local Supported Features (0x04|0x0003) ncmd 1
        Status: Success (0x00)
        Features: 0x00 0x00 0x00 0x00 0x60 0x00 0x00 0x00
          BR/EDR Not Supported
          LE Supported (Controller)
< HCI Command: Read Local Version In.. (0x04|0x0001) plen 0  #5 [hci1] 0.636691
> HCI Event: Command Complete (0x0e) plen 12                 #6 [hci1] 0.637225
      Read Local Version Information (0x04|0x0001) ncmd 1
        Status: Success (0x00)
        HCI version: Reserved (0x0f) - Revision 12393 (0x3069)
        LMP version: Reserved (0x0f) - Subversion 12393 (0x3069)
        Manufacturer: Nordic Semiconductor ASA (89)
< HCI Command: Read Local Supported... (0x04|0x0002) plen 0  #7 [hci1] 0.656689
> HCI Event: Command Complete (0x0e) plen 68                 #8 [hci1] 0.657742
      Read Local Supported Commands (0x04|0x0002) ncmd 1
        Status: Success (0x00)
        Commands: 119 entries
          Disconnect (Octet 0 - Bit 5)
          Read Remote Version Information (Octet 2 - Bit 7)
          Set Event Mask (Octet 5 - Bit 6)
          Reset (Octet 5 - Bit 7)
          Read Connection Accept Timeout (Octet 7 - Bit 2)
          Write Connection Accept Timeout (Octet 7 - Bit 3)
          Read Transmit Power Level (Octet 10 - Bit 2)
          Set Controller To Host Flow Control (Octet 10 - Bit 5)
          Host Buffer Size (Octet 10 - Bit 6)
          Host Number of Completed Packets (Octet 10 - Bit 7)
          Read Local Version Information (Octet 14 - Bit 3)
          Read Local Supported Features (Octet 14 - Bit 5)
          Read BD ADDR (Octet 15 - Bit 1)
          Read RSSI (Octet 15 - Bit 5)
          Set Event Mask Page 2 (Octet 22 - Bit 2)
          LE Set Event Mask (Octet 25 - Bit 0)
          LE Read Buffer Size (Octet 25 - Bit 1)
          LE Read Local Supported Features (Octet 25 - Bit 2)
          LE Set Random Address (Octet 25 - Bit 4)
          LE Set Advertising Parameters (Octet 25 - Bit 5)
          LE Read Advertising Channel TX Power (Octet 25 - Bit 6)
          LE Set Advertising Data (Octet 25 - Bit 7)
          LE Set Scan Response Data (Octet 26 - Bit 0)
          LE Set Advertise Enable (Octet 26 - Bit 1)
          LE Set Scan Parameters (Octet 26 - Bit 2)
          LE Set Scan Enable (Octet 26 - Bit 3)
          LE Create Connection (Octet 26 - Bit 4)
          LE Create Connection Cancel (Octet 26 - Bit 5)
          LE Read Accept List Size (Octet 26 - Bit 6)
          LE Clear Accept List (Octet 26 - Bit 7)
          LE Add Device To Accept List (Octet 27 - Bit 0)
          LE Remove Device From Accept List (Octet 27 - Bit 1)
          LE Connection Update (Octet 27 - Bit 2)
          LE Set Host Channel Classification (Octet 27 - Bit 3)
          LE Read Channel Map (Octet 27 - Bit 4)
          LE Read Remote Used Features (Octet 27 - Bit 5)
          LE Encrypt (Octet 27 - Bit 6)
          LE Rand (Octet 27 - Bit 7)
          LE Start Encryption (Octet 28 - Bit 0)
          LE Long Term Key Request Reply (Octet 28 - Bit 1)
          LE Long Term Key Request Neg Reply (Octet 28 - Bit 2)
          LE Read Supported States (Octet 28 - Bit 3)
          LE Receiver Test (Octet 28 - Bit 4)
          LE Transmitter Test (Octet 28 - Bit 5)
          LE Test End (Octet 28 - Bit 6)
          Read Authenticated Payload Timeout (Octet 32 - Bit 4)
          Write Authenticated Payload Timeout (Octet 32 - Bit 5)
          LE Set Data Length (Octet 33 - Bit 6)
          LE Read Suggested Default Data Length (Octet 33 - Bit 7)
          LE Write Suggested Default Data Length (Octet 34 - Bit 0)
          LE Add Device To Resolving List (Octet 34 - Bit 3)
          LE Remove Device From Resolving List (Octet 34 - Bit 4)
          LE Clear Resolving List (Octet 34 - Bit 5)
          LE Read Resolving List Size (Octet 34 - Bit 6)
          LE Set Address Resolution Enable (Octet 35 - Bit 1)
          LE Set Resolvable Private Address Timeout (Octet 35 - Bit 2)
          LE Read Maximum Data Length (Octet 35 - Bit 3)
          LE Read PHY (Octet 35 - Bit 4)
          LE Set Default PHY (Octet 35 - Bit 5)
          LE Set PHY (Octet 35 - Bit 6)
          LE Enhanced Receiver Test (Octet 35 - Bit 7)
          LE Enhanced Transmitter Test (Octet 36 - Bit 0)
          LE Set Advertising Set Random Address (Octet 36 - Bit 1)
          LE Set Extended Advertising Parameters (Octet 36 - Bit 2)
          LE Set Extended Advertising Data (Octet 36 - Bit 3)
          LE Set Extended Scan Response Data (Octet 36 - Bit 4)
          LE Set Extended Advertising Enable (Octet 36 - Bit 5)
          LE Read Maximum Advertising Data Length (Octet 36 - Bit 6)
          LE Read Number of Supported Advertising Sets (Octet 36 - Bit 7)
          LE Remove Advertising Set (Octet 37 - Bit 0)
          LE Clear Advertising Sets (Octet 37 - Bit 1)
          LE Set Periodic Advertising Parameters (Octet 37 - Bit 2)
          LE Set Periodic Advertising Data (Octet 37 - Bit 3)
          LE Set Periodic Advertising Enable (Octet 37 - Bit 4)
          LE Set Extended Scan Parameters (Octet 37 - Bit 5)
          LE Set Extended Scan Enable (Octet 37 - Bit 6)
          LE Extended Create Connection (Octet 37 - Bit 7)
          LE Periodic Advertising Create Sync (Octet 38 - Bit 0)
          LE Periodic Advertising Create Sync Cancel (Octet 38 - Bit 1)
          LE Periodic Advertising Terminate Sync (Octet 38 - Bit 2)
          LE Add Device To Periodic Advertiser List (Octet 38 - Bit 3)
          LE Remove Device From Periodic Advertiser List (Octet 38 - Bit 4)
          LE Clear Periodic Advertiser List (Octet 38 - Bit 5)
          LE Read Periodic Advertiser List Size (Octet 38 - Bit 6)
          LE Read Transmit Power (Octet 38 - Bit 7)
          LE Read RF Path Compensation (Octet 39 - Bit 0)
          LE Write RF Path Compensation (Octet 39 - Bit 1)
          LE Set Privacy Mode (Octet 39 - Bit 2)
          LE Periodic Advertising Receive Enable (Octet 40 - Bit 5)
          LE Periodic Advertising Sync Transfer (Octet 40 - Bit 6)
          LE Periodic Advertising Set Info Transfer (Octet 40 - Bit 7)
          LE Periodic Advertising Sync Transfer Parameters (Octet 41 - Bit 0)
          LE Set Default Periodic Advertisng Sync Transfer Parameters (Octet 41 - Bit 1)
          LE Read Buffer v2 (Octet 41 - Bit 5)
          LE Read ISO TX Sync (Octet 41 - Bit 6)
          LE Set Connected Isochronous Group Parameters (Octet 41 - Bit 7)
          LE Set Connected Isochronous Group Parameters Test (Octet 42 - Bit 0)
          LE Create Connected Isochronous Stream (Octet 42 - Bit 1)
          LE Remove Connected Isochronous Group (Octet 42 - Bit 2)
          LE Accept Connected Isochronous Stream Request (Octet 42 - Bit 3)
          LE Reject Connected Isochronous Stream Request (Octet 42 - Bit 4)
          LE Create Broadcast Isochronous Group (Octet 42 - Bit 5)
          LE Create Broadcast Isochronous Group Test (Octet 42 - Bit 6)
          LE Terminate Broadcast Isochronous Group (Octet 42 - Bit 7)
          LE Broadcast Isochronous Group Create Sync (Octet 43 - Bit 0)
          LE Broadcast Isochronous Group Terminate Sync (Octet 43 - Bit 1)
          LE Request Peer SCA (Octet 43 - Bit 2)
          LE Setup Isochronous Data Path (Octet 43 - Bit 3)
          LE Remove Isochronous Data Path (Octet 43 - Bit 4)
          LE Isochronous Transmit Test (Octet 43 - Bit 5)
          LE Isochronous Receive Test (Octet 43 - Bit 6)
          LE Isochronous Read Test Counters (Octet 43 - Bit 7)
          LE Isochronous Read Test Counters (Octet 44 - Bit 0)
          LE Set Host Feature (Octet 44 - Bit 1)
          Octet 44 - Bit 2 
          Octet 45 - Bit 6 
          Octet 46 - Bit 0 
          Octet 46 - Bit 1 
          Octet 46 - Bit 2 
< HCI Command: Host Buffer Size (0x03|0x0033) plen 7         #9 [hci1] 0.676723
        ACL MTU: 255  ACL max packet: 16
        SCO MTU: 0    SCO max packet: 0
> HCI Event: Command Complete (0x0e) plen 4                 #10 [hci1] 0.677223
      Host Buffer Size (0x03|0x0033) ncmd 1
        Status: Success (0x00)
< HCI Command: Set Controller To Ho.. (0x03|0x0031) plen 1  #11 [hci1] 0.696659
        Flow control: ACL Data Packets (0x01)
> HCI Event: Command Complete (0x0e) plen 4                 #12 [hci1] 0.697154
      Set Controller To Host Flow Control (0x03|0x0031) ncmd 1
        Status: Success (0x00)
< HCI Command: LE Read Local Suppor.. (0x08|0x0003) plen 0  #13 [hci1] 0.716695
> HCI Event: Command Complete (0x0e) plen 12                #14 [hci1] 0.717129
      LE Read Local Supported Features (0x08|0x0003) ncmd 1
        Status: Success (0x00)
        Features: 0xfd 0x79 0x00 0xf7 0x30 0x01 0x00 0x00
          LE Encryption
          Extended Reject Indication
          Peripheral-initiated Features Exchange
          LE Ping
          LE Data Packet Length Extension
          LL Privacy
          Extended Scanner Filter Policies
          LE 2M PHY
          LE Coded PHY
          LE Extended Advertising
          LE Periodic Advertising
          Channel Selection Algorithm #2
          Periodic Advertising Sync Transfer - Sender
          Periodic Advertising Sync Transfer - Recipient
          Sleep Clock Accuracy Updates
          Connected Isochronous Stream - Central
          Connected Isochronous Stream - Peripheral
          Isochronous Broadcaster
          Synchronized Receiver
          Periodic Advertising ADI support
          Connection Subrating
          Unknown features (0x0000010000000000)
< HCI Command: LE Set Host Feature (0x08|0x0074) plen 2     #15 [hci1] 0.736714
        Bit Number: 32
          Connected Isochronous Stream (Host Support)
        Bit Value: 1
> HCI Event: Command Complete (0x0e) plen 4                 #16 [hci1] 0.737198
      LE Set Host Feature (0x08|0x0074) ncmd 1
        Status: Success (0x00)
< HCI Command: LE Read Buffer v2 (0x08|0x0060) plen 0       #17 [hci1] 0.756663
> HCI Event: Command Complete (0x0e) plen 10                #18 [hci1] 0.757204
      LE Read Buffer v2 (0x08|0x0060) ncmd 1
        Status: Success (0x00)
        ACL MTU: 27
        ACL max packet: 3
        ISO MTU: 318
        ISO max packet: 3
< HCI Command: LE Read Maximum Adve.. (0x08|0x003a) plen 0  #19 [hci1] 0.776737
> HCI Event: Command Complete (0x0e) plen 6                 #20 [hci1] 0.777167
      LE Read Maximum Advertising Data Length (0x08|0x003a) ncmd 1
        Status: Success (0x00)
        Max length: 1650
< HCI Command: LE Read Supported St.. (0x08|0x001c) plen 0  #21 [hci1] 0.796683
> HCI Event: Command Complete (0x0e) plen 12                #22 [hci1] 0.797183
      LE Read Supported States (0x08|0x001c) ncmd 1
        Status: Success (0x00)
        States: 0x000003ff3e0306ff
          Non-connectable Advertising State
          Scannable Advertising State
          Connectable Advertising State
          High Duty Cycle Directed Advertising State
          Passive Scanning State
          Active Scanning State
          Initiating State
            and Connection State (Central Role)
          Connection State (Peripheral Role)
          Scannable Advertising State
            and Passive Scanning State
          Connectable Advertising State
            and Passive Scanning State
          Non-connectable Advertising State
            and Initiating State
          Scannable Advertising State
            and Initiating State
          Active Scanning State
            and Connection State (Central Role)
          Passive Scanning State
            and Connection State (Peripheral Role)
          Active Scanning State
            and Connection State (Peripheral Role)
          Initiating State
            and Connection State (Central Role)
            and Central Role & Central Role
          Low Duty Cycle Directed Advertising State
          Connectable Advertising State
            and Initiating State
            and Central Role & Peripheral Role
          High Duty Cycle Directed Advertising State
            and Initiating State
            and Central Role & Peripheral Role
          Low Duty Cycle Directed Advertising State
            and Initiating State
            and Central Role & Peripheral Role
          Connectable Advertising State
            and Connection State (Central Role)
            and Central Role & Peripheral Role
          High Duty Cycle Directed Advertising State
            and Connection State (Central Role)
            and Central Role & Peripheral Role
          Low Duty Cycle Directed Advertising State
            and Connection State (Central Role)
            and Central Role & Peripheral Role
          Connectable Advertising State
            and Connection State (Peripheral Role)
            and Central Role & Peripheral Role
          High Duty Cycle Directed Advertising State
            and Connection State (Peripheral Role)
            and Peripheral Role & Peripheral Role
          Low Duty Cycle Directed Advertising State
            and Connection State (Peripheral Role)
            and Peripheral Role & Peripheral Role
          Initiating State
            and Connection State (Peripheral Role)
            and Central Role & Peripheral Role
< HCI Command: LE Read Maximum Data.. (0x08|0x002f) plen 0  #23 [hci1] 0.816679
> HCI Event: Command Complete (0x0e) plen 12                #24 [hci1] 0.817244
      LE Read Maximum Data Length (0x08|0x002f) ncmd 1
        Status: Success (0x00)
        Max TX octets: 251
        Max TX time: 2704
        Max RX octets: 251
        Max RX time: 2704
< HCI Command: LE Write Suggested D.. (0x08|0x0024) plen 4  #25 [hci1] 0.836682
        TX octets: 251
        TX time: 2704
> HCI Event: Command Complete (0x0e) plen 4                 #26 [hci1] 0.837152
      LE Write Suggested Default Data Length (0x08|0x0024) ncmd 1
        Status: Success (0x00)
< HCI Command: LE Read Resolving Li.. (0x08|0x002a) plen 0  #27 [hci1] 0.856705
> HCI Event: Command Complete (0x0e) plen 5                 #28 [hci1] 0.857106
      LE Read Resolving List Size (0x08|0x002a) ncmd 1
        Status: Success (0x00)
        Size: 8
< HCI Command: LE Set Event Mask (0x08|0x0001) plen 8       #29 [hci1] 0.876682
        Mask: 0x000002023f87fa5e
          LE Advertising Report
          LE Connection Update Complete
          LE Read Remote Used Features Complete
          LE Long Term Key Request
          LE Data Length Change
          LE Enhanced Connection Complete
          LE PHY Update Complete
          LE Extended Advertising Report
          LE Periodic Advertising Sync Established
          LE Periodic Advertising Report
          LE Periodic Advertising Sync Lost
          LE Extended Scan Timeout
          LE Extended Advertising Set Terminated
          LE Scan Request Received
          LE Periodic Advertising Sync Transfer Rvc
          LE CIS Established
          LE CIS Request
          LE Create BIG Complete
          LE Terminate BIG Complete
          LE BIG Sync Estabilished Complete
          LE BIG Sync Lost
          LE BIG Info Advertising Report
          Unknown mask (0x0000020000000000)
> HCI Event: Command Complete (0x0e) plen 4                 #30 [hci1] 0.877297
      LE Set Event Mask (0x08|0x0001) ncmd 1
        Status: Success (0x00)
< HCI Command: Set Event Mask (0x03|0x0001) plen 8          #31 [hci1] 0.896715
        Mask: 0x2000800002008890
          Disconnection Complete
          Encryption Change
          Read Remote Version Information Complete
          Hardware Error
          Data Buffer Overflow
          Encryption Key Refresh Complete
          LE Meta
> HCI Event: Command Complete (0x0e) plen 4                 #32 [hci1] 0.897192
      Set Event Mask (0x03|0x0001) ncmd 1
        Status: Success (0x00)
< HCI Command: Read BD ADDR (0x04|0x0009) plen 0            #33 [hci1] 0.916693
> HCI Event: Command Complete (0x0e) plen 10                #34 [hci1] 0.917176
      Read BD ADDR (0x04|0x0009) ncmd 1
        Status: Success (0x00)
        Address: 00:00:00:00:00:00 (OUI 00-00-00)
< HCI Command: LE Set Random Address (0x08|0x0005) plen 6   #35 [hci1] 0.936710
        Address: D5:B6:CC:31:DB:3B (Static)
> HCI Event: Command Complete (0x0e) plen 4                 #36 [hci1] 0.937235
      LE Set Random Address (0x08|0x0005) ncmd 1
        Status: Success (0x00)
< HCI Command: LE Set Extended Adv.. (0x08|0x0036) plen 25  #37 [hci1] 3.427056
        Handle: 0x00
        Properties: 0x0013
          Connectable
          Scannable
          Use legacy advertising PDUs: ADV_IND
        Min advertising interval: 100.000 msec (0x00a0)
        Max advertising interval: 150.000 msec (0x00f0)
        Channel map: 37, 38, 39 (0x07)
        Own address type: Random (0x01)
        Peer address type: Public (0x00)
        Peer address: 00:00:00:00:00:00 (OUI 00-00-00)
        Filter policy: Allow Scan Request from Any, Allow Connect Request from Any (0x00)
        TX power: Host has no preference (0x7f)
        Primary PHY: LE 1M (0x01)
        Secondary max skip: 0x00
        Secondary PHY: LE 1M (0x01)
        SID: 0x00
        Scan request notifications: Disabled (0x00)
> HCI Event: Command Complete (0x0e) plen 5                 #38 [hci1] 3.427859
      LE Set Extended Advertising Parameters (0x08|0x0036) ncmd 1
        Status: Success (0x00)
        TX power (selected): 0 dbm (0x00)
< HCI Command: LE Set Advertising S.. (0x08|0x0035) plen 7  #39 [hci1] 3.436771
        Advertising handle: 0x00
        Advertising random address: D5:B6:CC:31:DB:3B (Static)
> HCI Event: Command Complete (0x0e) plen 4                 #40 [hci1] 3.437344
      LE Set Advertising Set Random Address (0x08|0x0035) ncmd 1
        Status: Success (0x00)
< HCI Command: LE Set Extended Adv.. (0x08|0x0037) plen 22  #41 [hci1] 3.456740
        Handle: 0x00
        Operation: Complete extended advertising data (0x03)
        Fragment preference: Minimize fragmentation (0x01)
        Data length: 0x12
        Flags: 0x06
          LE General Discoverable Mode
          BR/EDR Not Supported
        Name (complete): Tester_F6B11A
> HCI Event: Command Complete (0x0e) plen 4                 #42 [hci1] 3.457443
      LE Set Extended Advertising Data (0x08|0x0037) ncmd 1
        Status: Success (0x00)
< HCI Command: LE Set Extended Scan.. (0x08|0x0038) plen 4  #43 [hci1] 3.476701
        Handle: 0x00
        Operation: Complete scan response data (0x03)
        Fragment preference: Minimize fragmentation (0x01)
        Data length: 0x00
> HCI Event: Command Complete (0x0e) plen 4                 #44 [hci1] 3.477234
      LE Set Extended Scan Response Data (0x08|0x0038) ncmd 1
        Status: Success (0x00)
< HCI Command: LE Set Extended Adve.. (0x08|0x0039) plen 6  #45 [hci1] 3.496665
        Extended advertising: Enabled (0x01)
        Number of sets: 1 (0x01)
        Entry 0
          Handle: 0x00
          Duration: 0 ms (0x00)
          Max ext adv events: 0
> HCI Event: Command Complete (0x0e) plen 4                 #46 [hci1] 3.497286
      LE Set Extended Advertising Enable (0x08|0x0039) ncmd 1
        Status: Success (0x00)
> HCI Event: LE Meta Event (0x3e) plen 31                   #47 [hci1] 3.615377
      LE Enhanced Connection Complete (0x0a)
        Status: Success (0x00)
        Handle: 21
        Role: Peripheral (0x01)
        Peer address type: Public (0x00)
        Peer address: DF:A9:FF:F6:B1:1A (OUI DF-A9-FF)
        Local resolvable private address: 00:00:00:00:00:00 (Non-Resolvable)
        Peer resolvable private address: 00:00:00:00:00:00 (Non-Resolvable)
        Connection interval: 87.50 msec (0x0046)
        Connection latency: 0 (0x0000)
        Supervision timeout: 25120 msec (0x09d0)
        Central clock accuracy: 0x01
> HCI Event: LE Meta Event (0x3e) plen 6                    #48 [hci1] 3.615501
      LE Advertising Set Terminated (0x12)
        Status: Success (0x00)
        Handle: 0
        Connection handle: 21
        Number of completed extended advertising events: 0
< HCI Command: LE Read Remote Used... (0x08|0x0016) plen 2  #49 [hci1] 3.617721
        Handle: 21 Address: DF:A9:FF:F6:B1:1A (OUI DF-A9-FF)
< ACL Data TX: Handle 21 flags 0x00 dlen 7                  #50 [hci1] 3.617744
      ATT: Exchange MTU Request (0x02) len 2
        Client RX MTU: 251
> HCI Event: Command Status (0x0f) plen 4                   #51 [hci1] 3.618299
      LE Read Remote Used Features (0x08|0x0016) ncmd 1
        Status: Success (0x00)
> HCI Event: Number of Completed Packets (0x13) plen 5      #52 [hci1] 3.791415
        Num handles: 1
        Handle: 21 Address: DF:A9:FF:F6:B1:1A (OUI DF-A9-FF)
        Count: 1
        #50: len 7 (0 Kb/s)
        Latency: 173 msec (173-173 msec ~173 msec)
> HCI Event: LE Meta Event (0x3e) plen 12                   #53 [hci1] 3.879269
      LE Read Remote Used Features (0x04)
        Status: Success (0x00)
        Handle: 21 Address: DF:A9:FF:F6:B1:1A (OUI DF-A9-FF)
        Features: 0x2d 0x49 0x00 0xf7 0x67 0xd8 0x00 0x00
          LE Encryption
          Extended Reject Indication
          Peripheral-initiated Features Exchange
          LE Data Packet Length Extension
          LE 2M PHY
          LE Coded PHY
          Channel Selection Algorithm #2
          Periodic Advertising Sync Transfer - Sender
          Periodic Advertising Sync Transfer - Recipient
          Sleep Clock Accuracy Updates
          Connected Isochronous Stream - Central
          Connected Isochronous Stream - Peripheral
          Isochronous Broadcaster
          Synchronized Receiver
          Connected Isochronous Stream (Host Support)
          LE Power Control Request
          LE Power Control Request
          Connection Subrating
          Connection Subrating (Host Support)
          Unknown features (0x0000d80000000000)
> ACL Data RX: Handle 21 flags 0x02 dlen 11                 #54 [hci1] 6.328944
      SMP: Pairing Request (0x01) len 6
        IO capability: KeyboardDisplay (0x04)
        OOB data: Authentication data not present (0x00)
        Authentication requirement: Bonding, MITM, SC, No Keypresses (0x0d)
        Max encryption key size: 16
        Initiator key distribution: EncKey IdKey (0x03)
        Responder key distribution: EncKey IdKey Sign (0x07)
> ACL Data RX: Handle 21 flags 0x02 dlen 7                  #55 [hci1] 6.329334
      ATT: Exchange MTU Response (0x03) len 2
        Server RX MTU: 23
< HCI Command: Host Number of Compl.. (0x03|0x0035) plen 5  #56 [hci1] 6.337208
        Num handles: 1
        Handle: 21 Address: DF:A9:FF:F6:B1:1A (OUI DF-A9-FF)
        Count: 1
< ACL Data TX: Handle 21 flags 0x00 dlen 11                 #57 [hci1] 6.337342
      SMP: Pairing Response (0x02) len 6
        IO capability: DisplayOnly (0x00)
        OOB data: Authentication data not present (0x00)
        Authentication requirement: Bonding, No MITM, SC, No Keypresses (0x09)
        Max encryption key size: 16
        Initiator key distribution: IdKey (0x02)
        Responder key distribution: <none> (0x00)
< HCI Command: Host Number of Compl.. (0x03|0x0035) plen 5  #58 [hci1] 6.337545
        Num handles: 1
        Handle: 21 Address: DF:A9:FF:F6:B1:1A (OUI DF-A9-FF)
        Count: 1
> HCI Event: Number of Completed Packets (0x13) plen 5      #59 [hci1] 6.504075
        Num handles: 1
        Handle: 21 Address: DF:A9:FF:F6:B1:1A (OUI DF-A9-FF)
        Count: 1
        #57: len 11 (0 Kb/s)
        Latency: 166 msec (166-173 msec ~170 msec)
> ACL Data RX: Handle 21 flags 0x02 dlen 27                 #60 [hci1] 6.504337
> ACL Data RX: Handle 21 flags 0x01 dlen 27                 #61 [hci1] 6.504864
> ACL Data RX: Handle 21 flags 0x01 dlen 15                 #62 [hci1] 6.505367
      SMP: Pairing Public Key (0x0c) len 64
        X: 45538dee8fe6fc5f66f0bcf139b5c36907a8ef9dba0121cd19b7c15c48cd261c
        Y: 55b9f077a8693976fc411b5b284086b4a7ca013ad76abe951dcfaa5cbe19a0ac
< HCI Command: Host Number of Compl.. (0x03|0x0035) plen 5  #63 [hci1] 6.517627
        Num handles: 1
        Handle: 21 Address: DF:A9:FF:F6:B1:1A (OUI DF-A9-FF)
        Count: 1
< HCI Command: Host Number of Compl.. (0x03|0x0035) plen 5  #64 [hci1] 6.518173
        Num handles: 1
        Handle: 21 Address: DF:A9:FF:F6:B1:1A (OUI DF-A9-FF)
        Count: 1
< HCI Command: Host Number of Compl.. (0x03|0x0035) plen 5  #65 [hci1] 6.518561
        Num handles: 1
        Handle: 21 Address: DF:A9:FF:F6:B1:1A (OUI DF-A9-FF)
        Count: 1
< ACL Data TX: Handle 21 flags 0x00 dlen 27                 #66 [hci1] 6.518729
< ACL Data TX: Handle 21 flags 0x01 dlen 27                 #67 [hci1] 6.518737
< ACL Data TX: Handle 21 flags 0x01 dlen 15                 #68 [hci1] 6.518740
      SMP: Pairing Public Key (0x0c) len 64
        X: 98308440221e2d910f0e54b71e7ec652857aa9b5a0dc65028824cc19db1226e9
        Y: 67a4816bcb62efb21701e31fdb27561a6217575fb007a8bbdabe7e28b6f68482
> HCI Event: Number of Completed Packets (0x13) plen 5      #69 [hci1] 6.591869
        Num handles: 1
        Handle: 21 Address: DF:A9:FF:F6:B1:1A (OUI DF-A9-FF)
        Count: 1
        #66: len 27 (2 Kb/s)
        Latency: 73 msec (73-173 msec ~121 msec)
> HCI Event: Number of Completed Packets (0x13) plen 5      #70 [hci1] 6.592531
        Num handles: 1
        Handle: 21 Address: DF:A9:FF:F6:B1:1A (OUI DF-A9-FF)
        Count: 1
        #67: len 27 (2 Kb/s)
        Latency: 73 msec (73-173 msec ~97 msec)
> HCI Event: Number of Completed Packets (0x13) plen 5      #71 [hci1] 6.678766
        Num handles: 1
        Handle: 21 Address: DF:A9:FF:F6:B1:1A (OUI DF-A9-FF)
        Count: 1
        #68: len 15 (0 Kb/s)
        Latency: 160 msec (73-173 msec ~128 msec)
> ACL Data RX: Handle 21 flags 0x02 dlen 21                 #72 [hci1] 7.641718
      SMP: Pairing Confirm (0x03) len 16
        Confim value: faa6cbc24e220d36953178a9679166d8
< HCI Command: Host Number of Compl.. (0x03|0x0035) plen 5  #73 [hci1] 7.657240
        Num handles: 1
        Handle: 21 Address: DF:A9:FF:F6:B1:1A (OUI DF-A9-FF)
        Count: 1
< ACL Data TX: Handle 21 flags 0x00 dlen 21                 #74 [hci1] 7.657418
      SMP: Pairing Confirm (0x03) len 16
        Confim value: 06d8958acef1b39fd80bae13ae7398cc
> HCI Event: Number of Completed Packets (0x13) plen 5      #75 [hci1] 7.816519
        Num handles: 1
        Handle: 21 Address: DF:A9:FF:F6:B1:1A (OUI DF-A9-FF)
        Count: 1
        #74: len 21 (1 Kb/s)
        Latency: 159 msec (73-173 msec ~143 msec)
> ACL Data RX: Handle 21 flags 0x02 dlen 21                 #76 [hci1] 7.816754
      SMP: Pairing Random (0x04) len 16
        Random value: f9f8fb727d5538330000000000000000
< HCI Command: Host Number of Compl.. (0x03|0x0035) plen 5  #77 [hci1] 7.817362
        Num handles: 1
        Handle: 21 Address: DF:A9:FF:F6:B1:1A (OUI DF-A9-FF)
        Count: 1
< ACL Data TX: Handle 21 flags 0x00 dlen 21                 #78 [hci1] 7.817459
      SMP: Pairing Random (0x04) len 16
        Random value: 8e6108f966a694cbe26df70bb96773e6
> HCI Event: Number of Completed Packets (0x13) plen 5      #79 [hci1] 7.991170
        Num handles: 1
        Handle: 21 Address: DF:A9:FF:F6:B1:1A (OUI DF-A9-FF)
        Count: 1
        #78: len 21 (0 Kb/s)
        Latency: 173 msec (73-173 msec ~158 msec)
> ACL Data RX: Handle 21 flags 0x02 dlen 21                 #80 [hci1] 8.079180
      SMP: Pairing Confirm (0x03) len 16
        Confim value: ed2d3e2515b3f4552e399847af127ea7
< HCI Command: Host Number of Compl.. (0x03|0x0035) plen 5  #81 [hci1] 8.097339
        Num handles: 1
        Handle: 21 Address: DF:A9:FF:F6:B1:1A (OUI DF-A9-FF)
        Count: 1
< ACL Data TX: Handle 21 flags 0x00 dlen 21                 #82 [hci1] 8.097567
      SMP: Pairing Confirm (0x03) len 16
        Confim value: 3db1162bcd924f30d6bee23a97bb4a80
> HCI Event: Number of Completed Packets (0x13) plen 5      #83 [hci1] 8.254032
        Num handles: 1
        Handle: 21 Address: DF:A9:FF:F6:B1:1A (OUI DF-A9-FF)
        Count: 1
        #82: len 21 (1 Kb/s)
        Latency: 156 msec (73-173 msec ~157 msec)
> ACL Data RX: Handle 21 flags 0x02 dlen 21                 #84 [hci1] 8.254344
      SMP: Pairing Random (0x04) len 16
        Random value: 014b6d36b2927b1b0000000000000000
< HCI Command: Host Number of Compl.. (0x03|0x0035) plen 5  #85 [hci1] 8.257498
        Num handles: 1
        Handle: 21 Address: DF:A9:FF:F6:B1:1A (OUI DF-A9-FF)
        Count: 1
< ACL Data TX: Handle 21 flags 0x00 dlen 21                 #86 [hci1] 8.257649
      SMP: Pairing Random (0x04) len 16
        Random value: 4d02679f89a05211af56d8b3da64d21e
> HCI Event: Number of Completed Packets (0x13) plen 5      #87 [hci1] 8.428711
        Num handles: 1
        Handle: 21 Address: DF:A9:FF:F6:B1:1A (OUI DF-A9-FF)
        Count: 1
        #86: len 21 (0 Kb/s)
        Latency: 171 msec (73-173 msec ~164 msec)
> ACL Data RX: Handle 21 flags 0x02 dlen 21                 #88 [hci1] 8.516576
      SMP: Pairing Confirm (0x03) len 16
        Confim value: 880820f0ae03a0d00d34c59306f28565
< HCI Command: Host Number of Compl.. (0x03|0x0035) plen 5  #89 [hci1] 8.517131
        Num handles: 1
        Handle: 21 Address: DF:A9:FF:F6:B1:1A (OUI DF-A9-FF)
        Count: 1
< ACL Data TX: Handle 21 flags 0x00 dlen 21                 #90 [hci1] 8.517270
      SMP: Pairing Confirm (0x03) len 16
        Confim value: 9a37764ae8f2001114228680626732bb
> HCI Event: Number of Completed Packets (0x13) plen 5      #91 [hci1] 8.691440
        Num handles: 1
        Handle: 21 Address: DF:A9:FF:F6:B1:1A (OUI DF-A9-FF)
        Count: 1
        #90: len 21 (0 Kb/s)
        Latency: 174 msec (73-174 msec ~169 msec)
> ACL Data RX: Handle 21 flags 0x02 dlen 21                 #92 [hci1] 8.691692
      SMP: Pairing Random (0x04) len 16
        Random value: e0e862b5c1b7e5480000000000000000
< HCI Command: Host Number of Compl.. (0x03|0x0035) plen 5  #93 [hci1] 8.697391
        Num handles: 1
        Handle: 21 Address: DF:A9:FF:F6:B1:1A (OUI DF-A9-FF)
        Count: 1
< ACL Data TX: Handle 21 flags 0x00 dlen 21                 #94 [hci1] 8.697563
      SMP: Pairing Random (0x04) len 16
        Random value: 5e8286bc235a02440d0c3424a2acf8fd
> HCI Event: Number of Completed Packets (0x13) plen 5      #95 [hci1] 8.866191
        Num handles: 1
        Handle: 21 Address: DF:A9:FF:F6:B1:1A (OUI DF-A9-FF)
        Count: 1
        #94: len 21 (1 Kb/s)
        Latency: 168 msec (73-174 msec ~168 msec)
> ACL Data RX: Handle 21 flags 0x02 dlen 21                 #96 [hci1] 8.954054
      SMP: Pairing Confirm (0x03) len 16
        Confim value: 13102ba5a5e3dee4b7ba7ab5bac3d056
< HCI Command: Host Number of Compl.. (0x03|0x0035) plen 5  #97 [hci1] 8.957218
        Num handles: 1
        Handle: 21 Address: DF:A9:FF:F6:B1:1A (OUI DF-A9-FF)
        Count: 1
< ACL Data TX: Handle 21 flags 0x00 dlen 21                 #98 [hci1] 8.957373
      SMP: Pairing Confirm (0x03) len 16
        Confim value: 527b879d01590afeaaca9c02d151e1b3
> HCI Event: Number of Completed Packets (0x13) plen 5      #99 [hci1] 9.128961
        Num handles: 1
        Handle: 21 Address: DF:A9:FF:F6:B1:1A (OUI DF-A9-FF)
        Count: 1
        #98: len 21 (0 Kb/s)
        Latency: 171 msec (73-174 msec ~170 msec)
> ACL Data RX: Handle 21 flags 0x02 dlen 21                #100 [hci1] 9.129173
      SMP: Pairing Random (0x04) len 16
        Random value: ac530310e92e962f0000000000000000
< HCI Command: Host Number of Comp.. (0x03|0x0035) plen 5  #101 [hci1] 9.137418
        Num handles: 1
        Handle: 21 Address: DF:A9:FF:F6:B1:1A (OUI DF-A9-FF)
        Count: 1
< ACL Data TX: Handle 21 flags 0x00 dlen 21                #102 [hci1] 9.137539
      SMP: Pairing Random (0x04) len 16
        Random value: 5c4a1bcadd27bd58e945097b00bad7ac
> HCI Event: Number of Completed Packets (0x13) plen 5     #103 [hci1] 9.303723
        Num handles: 1
        Handle: 21 Address: DF:A9:FF:F6:B1:1A (OUI DF-A9-FF)
        Count: 1
        #102: len 21 (1 Kb/s)
        Latency: 166 msec (73-174 msec ~168 msec)
> ACL Data RX: Handle 21 flags 0x02 dlen 21                #104 [hci1] 9.391483
      SMP: Pairing Confirm (0x03) len 16
        Confim value: ec4b60fc2f21ac9aab0d79f85d949317
< HCI Command: Host Number of Comp.. (0x03|0x0035) plen 5  #105 [hci1] 9.397245
        Num handles: 1
        Handle: 21 Address: DF:A9:FF:F6:B1:1A (OUI DF-A9-FF)
        Count: 1
< ACL Data TX: Handle 21 flags 0x00 dlen 21                #106 [hci1] 9.397412
      SMP: Pairing Confirm (0x03) len 16
        Confim value: 86166a54e2406542366763bd2dc1087d
> HCI Event: Number of Completed Packets (0x13) plen 5     #107 [hci1] 9.566342
        Num handles: 1
        Handle: 21 Address: DF:A9:FF:F6:B1:1A (OUI DF-A9-FF)
        Count: 1
        #106: len 21 (1 Kb/s)
        Latency: 168 msec (73-174 msec ~168 msec)
> ACL Data RX: Handle 21 flags 0x02 dlen 21                #108 [hci1] 9.566706
      SMP: Pairing Random (0x04) len 16
        Random value: d902a25caa423c5c0000000000000000
< HCI Command: Host Number of Comp.. (0x03|0x0035) plen 5  #109 [hci1] 9.577264
        Num handles: 1
        Handle: 21 Address: DF:A9:FF:F6:B1:1A (OUI DF-A9-FF)
        Count: 1
< ACL Data TX: Handle 21 flags 0x00 dlen 21                #110 [hci1] 9.577316
      SMP: Pairing Random (0x04) len 16
        Random value: 32527e6e64e79f33b2e374394db8ab2d
> HCI Event: Number of Completed Packets (0x13) plen 5     #111 [hci1] 9.741093
        Num handles: 1
        Handle: 21 Address: DF:A9:FF:F6:B1:1A (OUI DF-A9-FF)
        Count: 1
        #110: len 21 (1 Kb/s)
        Latency: 163 msec (73-174 msec ~166 msec)
> ACL Data RX: Handle 21 flags 0x02 dlen 21                #112 [hci1] 9.828975
      SMP: Pairing Confirm (0x03) len 16
        Confim value: 462191aa614b240291a20917c5015027
< HCI Command: Host Number of Comp.. (0x03|0x0035) plen 5  #113 [hci1] 9.837192
        Num handles: 1
        Handle: 21 Address: DF:A9:FF:F6:B1:1A (OUI DF-A9-FF)
        Count: 1
< ACL Data TX: Handle 21 flags 0x00 dlen 21                #114 [hci1] 9.837350
      SMP: Pairing Confirm (0x03) len 16
        Confim value: 1c8d7927d9571fd62a8f2adfcb399e43
> HCI Event: Number of Completed Packets (0x13) plen 5    #115 [hci1] 10.003953
        Num handles: 1
        Handle: 21 Address: DF:A9:FF:F6:B1:1A (OUI DF-A9-FF)
        Count: 1
        #114: len 21 (1 Kb/s)
        Latency: 166 msec (73-174 msec ~166 msec)
> ACL Data RX: Handle 21 flags 0x02 dlen 21               #116 [hci1] 10.004188
      SMP: Pairing Random (0x04) len 16
        Random value: 11dde201290265670000000000000000
< HCI Command: Host Number of Com.. (0x03|0x0035) plen 5  #117 [hci1] 10.017495
        Num handles: 1
        Handle: 21 Address: DF:A9:FF:F6:B1:1A (OUI DF-A9-FF)
        Count: 1
< ACL Data TX: Handle 21 flags 0x00 dlen 21               #118 [hci1] 10.017644
      SMP: Pairing Random (0x04) len 16
        Random value: dddbdfe2838e9a8cc6964353c850fef7
> HCI Event: Number of Completed Packets (0x13) plen 5    #119 [hci1] 10.178685
        Num handles: 1
        Handle: 21 Address: DF:A9:FF:F6:B1:1A (OUI DF-A9-FF)
        Count: 1
        #118: len 21 (1 Kb/s)
        Latency: 161 msec (73-174 msec ~163 msec)
> ACL Data RX: Handle 21 flags 0x02 dlen 21               #120 [hci1] 10.266591
      SMP: Pairing Confirm (0x03) len 16
        Confim value: fd848a8136fcab04c4607773e9649a25
< HCI Command: Host Number of Com.. (0x03|0x0035) plen 5  #121 [hci1] 10.277163
        Num handles: 1
        Handle: 21 Address: DF:A9:FF:F6:B1:1A (OUI DF-A9-FF)
        Count: 1
< ACL Data TX: Handle 21 flags 0x00 dlen 21               #122 [hci1] 10.277335
      SMP: Pairing Confirm (0x03) len 16
        Confim value: 90ead0d0b7f684b60cf0ecc2d8460572
> HCI Event: Number of Completed Packets (0x13) plen 5    #123 [hci1] 10.441358
        Num handles: 1
        Handle: 21 Address: DF:A9:FF:F6:B1:1A (OUI DF-A9-FF)
        Count: 1
        #122: len 21 (1 Kb/s)
        Latency: 164 msec (73-174 msec ~163 msec)
> ACL Data RX: Handle 21 flags 0x02 dlen 21               #124 [hci1] 10.441759
      SMP: Pairing Random (0x04) len 16
        Random value: 20d9d4b059e1a44c0000000000000000
< HCI Command: Host Number of Com.. (0x03|0x0035) plen 5  #125 [hci1] 10.457474
        Num handles: 1
        Handle: 21 Address: DF:A9:FF:F6:B1:1A (OUI DF-A9-FF)
        Count: 1
< ACL Data TX: Handle 21 flags 0x00 dlen 21               #126 [hci1] 10.457628
      SMP: Pairing Random (0x04) len 16
        Random value: eb9f1915536596b6fc3db1c86b2b1970
> HCI Event: Number of Completed Packets (0x13) plen 5    #127 [hci1] 10.616117
        Num handles: 1
        Handle: 21 Address: DF:A9:FF:F6:B1:1A (OUI DF-A9-FF)
        Count: 1
        #126: len 21 (1 Kb/s)
        Latency: 158 msec (73-174 msec ~161 msec)
> ACL Data RX: Handle 21 flags 0x02 dlen 21               #128 [hci1] 10.704021
      SMP: Pairing Confirm (0x03) len 16
        Confim value: 2c1fb9dbbadc8d9d58754fb15100814a
< HCI Command: Host Number of Com.. (0x03|0x0035) plen 5  #129 [hci1] 10.717286
        Num handles: 1
        Handle: 21 Address: DF:A9:FF:F6:B1:1A (OUI DF-A9-FF)
        Count: 1
< ACL Data TX: Handle 21 flags 0x00 dlen 21               #130 [hci1] 10.717496
      SMP: Pairing Confirm (0x03) len 16
        Confim value: e1f46bd2fab16ff6fa767d4749413614
> HCI Event: Number of Completed Packets (0x13) plen 5    #131 [hci1] 10.878838
        Num handles: 1
        Handle: 21 Address: DF:A9:FF:F6:B1:1A (OUI DF-A9-FF)
        Count: 1
        #130: len 21 (1 Kb/s)
        Latency: 161 msec (73-174 msec ~161 msec)
> ACL Data RX: Handle 21 flags 0x02 dlen 21               #132 [hci1] 10.879180
      SMP: Pairing Random (0x04) len 16
        Random value: 7a512d3b2630467a0000000000000000
< HCI Command: Host Number of Com.. (0x03|0x0035) plen 5  #133 [hci1] 10.897239
        Num handles: 1
        Handle: 21 Address: DF:A9:FF:F6:B1:1A (OUI DF-A9-FF)
        Count: 1
< ACL Data TX: Handle 21 flags 0x00 dlen 21               #134 [hci1] 10.897326
      SMP: Pairing Random (0x04) len 16
        Random value: 5c794dc9ad9f2c3f295ebd5ad5e1c3cf
> HCI Event: Number of Completed Packets (0x13) plen 5    #135 [hci1] 11.053647
        Num handles: 1
        Handle: 21 Address: DF:A9:FF:F6:B1:1A (OUI DF-A9-FF)
        Count: 1
        #134: len 21 (1 Kb/s)
        Latency: 156 msec (73-174 msec ~158 msec)
> ACL Data RX: Handle 21 flags 0x02 dlen 21               #136 [hci1] 11.141419
      SMP: Pairing Confirm (0x03) len 16
        Confim value: e0c958a2e26233406445c666df53a9b4
< HCI Command: Host Number of Com.. (0x03|0x0035) plen 5  #137 [hci1] 11.157279
        Num handles: 1
        Handle: 21 Address: DF:A9:FF:F6:B1:1A (OUI DF-A9-FF)
        Count: 1
< ACL Data TX: Handle 21 flags 0x00 dlen 21               #138 [hci1] 11.157472
      SMP: Pairing Confirm (0x03) len 16
        Confim value: 56fa90db3702472168ef96475503e012
> HCI Event: Number of Completed Packets (0x13) plen 5    #139 [hci1] 11.316354
        Num handles: 1
        Handle: 21 Address: DF:A9:FF:F6:B1:1A (OUI DF-A9-FF)
        Count: 1
        #138: len 21 (1 Kb/s)
        Latency: 158 msec (73-174 msec ~158 msec)
> ACL Data RX: Handle 21 flags 0x02 dlen 21               #140 [hci1] 11.316590
      SMP: Pairing Random (0x04) len 16
        Random value: fa567520fbb34efa0000000000000000
< HCI Command: Host Number of Com.. (0x03|0x0035) plen 5  #141 [hci1] 11.317489
        Num handles: 1
        Handle: 21 Address: DF:A9:FF:F6:B1:1A (OUI DF-A9-FF)
        Count: 1
< ACL Data TX: Handle 21 flags 0x00 dlen 21               #142 [hci1] 11.317667
      SMP: Pairing Random (0x04) len 16
        Random value: 5c2fff312cdf99c9491988e877355a9a
> HCI Event: Number of Completed Packets (0x13) plen 5    #143 [hci1] 11.491131
        Num handles: 1
        Handle: 21 Address: DF:A9:FF:F6:B1:1A (OUI DF-A9-FF)
        Count: 1
        #142: len 21 (0 Kb/s)
        Latency: 173 msec (73-174 msec ~166 msec)
> ACL Data RX: Handle 21 flags 0x02 dlen 21               #144 [hci1] 11.578986
      SMP: Pairing Confirm (0x03) len 16
        Confim value: 913ad92d09da42c460b6165802dd6a06
< HCI Command: Host Number of Com.. (0x03|0x0035) plen 5  #145 [hci1] 11.596994
        Num handles: 1
        Handle: 21 Address: DF:A9:FF:F6:B1:1A (OUI DF-A9-FF)
        Count: 1
< ACL Data TX: Handle 21 flags 0x00 dlen 21               #146 [hci1] 11.597144
      SMP: Pairing Confirm (0x03) len 16
        Confim value: 4a924f6726d8b2e1db4c44e6ba43b497
> HCI Event: Number of Completed Packets (0x13) plen 5    #147 [hci1] 11.753811
        Num handles: 1
        Handle: 21 Address: DF:A9:FF:F6:B1:1A (OUI DF-A9-FF)
        Count: 1
        #146: len 21 (1 Kb/s)
        Latency: 156 msec (73-174 msec ~161 msec)
> ACL Data RX: Handle 21 flags 0x02 dlen 21               #148 [hci1] 11.754089
      SMP: Pairing Random (0x04) len 16
        Random value: 2f04a9b7fe68b7f80000000000000000
< HCI Command: Host Number of Com.. (0x03|0x0035) plen 5  #149 [hci1] 11.757437
        Num handles: 1
        Handle: 21 Address: DF:A9:FF:F6:B1:1A (OUI DF-A9-FF)
        Count: 1
< ACL Data TX: Handle 21 flags 0x00 dlen 21               #150 [hci1] 11.757547
      SMP: Pairing Random (0x04) len 16
        Random value: c629a3a987d808e808655d558dfc1155
> HCI Event: Number of Completed Packets (0x13) plen 5    #151 [hci1] 11.928623
        Num handles: 1
        Handle: 21 Address: DF:A9:FF:F6:B1:1A (OUI DF-A9-FF)
        Count: 1
        #150: len 21 (0 Kb/s)
        Latency: 171 msec (73-174 msec ~166 msec)
> ACL Data RX: Handle 21 flags 0x02 dlen 21               #152 [hci1] 12.016437
      SMP: Pairing Confirm (0x03) len 16
        Confim value: 743d4ae5c655ce95697e56ea0e96b355
< HCI Command: Host Number of Com.. (0x03|0x0035) plen 5  #153 [hci1] 12.017307
        Num handles: 1
        Handle: 21 Address: DF:A9:FF:F6:B1:1A (OUI DF-A9-FF)
        Count: 1
< ACL Data TX: Handle 21 flags 0x00 dlen 21               #154 [hci1] 12.017484
      SMP: Pairing Confirm (0x03) len 16
        Confim value: e0a8d86452054b661118184c413275e5
> HCI Event: Number of Completed Packets (0x13) plen 5    #155 [hci1] 12.191265
        Num handles: 1
        Handle: 21 Address: DF:A9:FF:F6:B1:1A (OUI DF-A9-FF)
        Count: 1
        #154: len 21 (0 Kb/s)
        Latency: 173 msec (73-174 msec ~170 msec)
> ACL Data RX: Handle 21 flags 0x02 dlen 21               #156 [hci1] 12.191714
      SMP: Pairing Random (0x04) len 16
        Random value: 9ea2c8176a526b9f0000000000000000
< HCI Command: Host Number of Com.. (0x03|0x0035) plen 5  #157 [hci1] 12.197467
        Num handles: 1
        Handle: 21 Address: DF:A9:FF:F6:B1:1A (OUI DF-A9-FF)
        Count: 1
< ACL Data TX: Handle 21 flags 0x00 dlen 21               #158 [hci1] 12.197611
      SMP: Pairing Random (0x04) len 16
        Random value: 92f20f6ad8f13724432c7fd6001c45ff
> HCI Event: Number of Completed Packets (0x13) plen 5    #159 [hci1] 12.366062
        Num handles: 1
        Handle: 21 Address: DF:A9:FF:F6:B1:1A (OUI DF-A9-FF)
        Count: 1
        #158: len 21 (1 Kb/s)
        Latency: 168 msec (73-174 msec ~169 msec)
> ACL Data RX: Handle 21 flags 0x02 dlen 21               #160 [hci1] 12.453910
      SMP: Pairing Confirm (0x03) len 16
        Confim value: fe9c8b7ede99116f52e96787b0a700ec
< HCI Command: Host Number of Com.. (0x03|0x0035) plen 5  #161 [hci1] 12.457005
        Num handles: 1
        Handle: 21 Address: DF:A9:FF:F6:B1:1A (OUI DF-A9-FF)
        Count: 1
< ACL Data TX: Handle 21 flags 0x00 dlen 21               #162 [hci1] 12.457128
      SMP: Pairing Confirm (0x03) len 16
        Confim value: b1ab2c608f92867a6a2769353c7db1d3
> HCI Event: Number of Completed Packets (0x13) plen 5    #163 [hci1] 12.628764
        Num handles: 1
        Handle: 21 Address: DF:A9:FF:F6:B1:1A (OUI DF-A9-FF)
        Count: 1
        #162: len 21 (0 Kb/s)
        Latency: 171 msec (73-174 msec ~170 msec)
> ACL Data RX: Handle 21 flags 0x02 dlen 21               #164 [hci1] 12.629206
      SMP: Pairing Random (0x04) len 16
        Random value: de812c1c3d3fe1c30000000000000000
< HCI Command: Host Number of Com.. (0x03|0x0035) plen 5  #165 [hci1] 12.637395
        Num handles: 1
        Handle: 21 Address: DF:A9:FF:F6:B1:1A (OUI DF-A9-FF)
        Count: 1
< ACL Data TX: Handle 21 flags 0x00 dlen 21               #166 [hci1] 12.637497
      SMP: Pairing Random (0x04) len 16
        Random value: 23ac32ebbb5e14c8a6b9622f296d277f
> HCI Event: Number of Completed Packets (0x13) plen 5    #167 [hci1] 12.803511
        Num handles: 1
        Handle: 21 Address: DF:A9:FF:F6:B1:1A (OUI DF-A9-FF)
        Count: 1
        #166: len 21 (1 Kb/s)
        Latency: 166 msec (73-174 msec ~168 msec)
> ACL Data RX: Handle 21 flags 0x02 dlen 21               #168 [hci1] 12.891361
      SMP: Pairing Confirm (0x03) len 16
        Confim value: b619030842e4d13e2c53269f0de821fc
< HCI Command: Host Number of Com.. (0x03|0x0035) plen 5  #169 [hci1] 12.896962
        Num handles: 1
        Handle: 21 Address: DF:A9:FF:F6:B1:1A (OUI DF-A9-FF)
        Count: 1
< ACL Data TX: Handle 21 flags 0x00 dlen 21               #170 [hci1] 12.897095
      SMP: Pairing Confirm (0x03) len 16
        Confim value: d3e980aee9daa00da80c5cda7615b166
> HCI Event: Number of Completed Packets (0x13) plen 5    #171 [hci1] 13.066245
        Num handles: 1
        Handle: 21 Address: DF:A9:FF:F6:B1:1A (OUI DF-A9-FF)
        Count: 1
        #170: len 21 (0 Kb/s)
        Latency: 169 msec (73-174 msec ~168 msec)
> ACL Data RX: Handle 21 flags 0x02 dlen 21               #172 [hci1] 13.066658
      SMP: Pairing Random (0x04) len 16
        Random value: 61a72889f28d052a0000000000000000
< HCI Command: Host Number of Com.. (0x03|0x0035) plen 5  #173 [hci1] 13.077516
        Num handles: 1
        Handle: 21 Address: DF:A9:FF:F6:B1:1A (OUI DF-A9-FF)
        Count: 1
< ACL Data TX: Handle 21 flags 0x00 dlen 21               #174 [hci1] 13.077599
      SMP: Pairing Random (0x04) len 16
        Random value: 297efe85e67448a15f56bd27e3a3cf1d
> HCI Event: Number of Completed Packets (0x13) plen 5    #175 [hci1] 13.241021
        Num handles: 1
        Handle: 21 Address: DF:A9:FF:F6:B1:1A (OUI DF-A9-FF)
        Count: 1
        #174: len 21 (1 Kb/s)
        Latency: 163 msec (73-174 msec ~166 msec)
> ACL Data RX: Handle 21 flags 0x02 dlen 21               #176 [hci1] 13.328902
      SMP: Pairing Confirm (0x03) len 16
        Confim value: 606b24f41124f8d08b4ee28db2f1eb39
< HCI Command: Host Number of Com.. (0x03|0x0035) plen 5  #177 [hci1] 13.337233
        Num handles: 1
        Handle: 21 Address: DF:A9:FF:F6:B1:1A (OUI DF-A9-FF)
        Count: 1
< ACL Data TX: Handle 21 flags 0x00 dlen 21               #178 [hci1] 13.337356
      SMP: Pairing Confirm (0x03) len 16
        Confim value: 4be287ef1ebeedc4608eab5ab60cf30a
> HCI Event: Number of Completed Packets (0x13) plen 5    #179 [hci1] 13.503815
        Num handles: 1
        Handle: 21 Address: DF:A9:FF:F6:B1:1A (OUI DF-A9-FF)
        Count: 1
        #178: len 21 (1 Kb/s)
        Latency: 166 msec (73-174 msec ~166 msec)
> ACL Data RX: Handle 21 flags 0x02 dlen 21               #180 [hci1] 13.504101
      SMP: Pairing Random (0x04) len 16
        Random value: 1556887451b954f50000000000000000
< HCI Command: Host Number of Com.. (0x03|0x0035) plen 5  #181 [hci1] 13.517596
        Num handles: 1
        Handle: 21 Address: DF:A9:FF:F6:B1:1A (OUI DF-A9-FF)
        Count: 1
< ACL Data TX: Handle 21 flags 0x00 dlen 21               #182 [hci1] 13.517689
      SMP: Pairing Random (0x04) len 16
        Random value: 25a9493fd3ce4faf02be7293595bb7c6
> HCI Event: Number of Completed Packets (0x13) plen 5    #183 [hci1] 13.678593
        Num handles: 1
        Handle: 21 Address: DF:A9:FF:F6:B1:1A (OUI DF-A9-FF)
        Count: 1
        #182: len 21 (1 Kb/s)
        Latency: 160 msec (73-174 msec ~163 msec)
> ACL Data RX: Handle 21 flags 0x02 dlen 21               #184 [hci1] 13.766396
      SMP: Pairing Confirm (0x03) len 16
        Confim value: ad909ae65bab8174f0f9c00da275da7d
< HCI Command: Host Number of Com.. (0x03|0x0035) plen 5  #185 [hci1] 13.777319
        Num handles: 1
        Handle: 21 Address: DF:A9:FF:F6:B1:1A (OUI DF-A9-FF)
        Count: 1
< ACL Data TX: Handle 21 flags 0x00 dlen 21               #186 [hci1] 13.777558
      SMP: Pairing Confirm (0x03) len 16
        Confim value: 93995483a58fb16f861e2ac815a477f4
> HCI Event: Number of Completed Packets (0x13) plen 5    #187 [hci1] 13.941257
        Num handles: 1
        Handle: 21 Address: DF:A9:FF:F6:B1:1A (OUI DF-A9-FF)
        Count: 1
        #186: len 21 (1 Kb/s)
        Latency: 163 msec (73-174 msec ~163 msec)
> ACL Data RX: Handle 21 flags 0x02 dlen 21               #188 [hci1] 13.941551
      SMP: Pairing Random (0x04) len 16
        Random value: 7138b2e1e58c42f60000000000000000
< HCI Command: Host Number of Com.. (0x03|0x0035) plen 5  #189 [hci1] 13.957557
        Num handles: 1
        Handle: 21 Address: DF:A9:FF:F6:B1:1A (OUI DF-A9-FF)
        Count: 1
< ACL Data TX: Handle 21 flags 0x00 dlen 21               #190 [hci1] 13.957707
      SMP: Pairing Random (0x04) len 16
        Random value: 58f6b41f855a6f6c3560debd84e2affc
> HCI Event: Number of Completed Packets (0x13) plen 5    #191 [hci1] 14.116010
        Num handles: 1
        Handle: 21 Address: DF:A9:FF:F6:B1:1A (OUI DF-A9-FF)
        Count: 1
        #190: len 21 (1 Kb/s)
        Latency: 158 msec (73-174 msec ~160 msec)
> ACL Data RX: Handle 21 flags 0x02 dlen 21               #192 [hci1] 14.203937
      SMP: Pairing Confirm (0x03) len 16
        Confim value: 8066b3b77937a30a47f4351a35798e6c
< HCI Command: Host Number of Com.. (0x03|0x0035) plen 5  #193 [hci1] 14.217329
        Num handles: 1
        Handle: 21 Address: DF:A9:FF:F6:B1:1A (OUI DF-A9-FF)
        Count: 1
< ACL Data TX: Handle 21 flags 0x00 dlen 21               #194 [hci1] 14.217555
      SMP: Pairing Confirm (0x03) len 16
        Confim value: 44fc8518bcdab41adb48719c36f188c8
> HCI Event: Number of Completed Packets (0x13) plen 5    #195 [hci1] 14.378891
        Num handles: 1
        Handle: 21 Address: DF:A9:FF:F6:B1:1A (OUI DF-A9-FF)
        Count: 1
        #194: len 21 (1 Kb/s)
        Latency: 161 msec (73-174 msec ~161 msec)
> ACL Data RX: Handle 21 flags 0x02 dlen 21               #196 [hci1] 14.379037
      SMP: Pairing Random (0x04) len 16
        Random value: ac9ce6ce8a1cb7560000000000000000
< HCI Command: Host Number of Com.. (0x03|0x0035) plen 5  #197 [hci1] 14.397596
        Num handles: 1
        Handle: 21 Address: DF:A9:FF:F6:B1:1A (OUI DF-A9-FF)
        Count: 1
< ACL Data TX: Handle 21 flags 0x00 dlen 21               #198 [hci1] 14.397697
      SMP: Pairing Random (0x04) len 16
        Random value: b67e7216d5bf664139eda2b542549666
> HCI Event: Number of Completed Packets (0x13) plen 5    #199 [hci1] 14.553476
        Num handles: 1
        Handle: 21 Address: DF:A9:FF:F6:B1:1A (OUI DF-A9-FF)
        Count: 1
        #198: len 21 (1 Kb/s)
        Latency: 155 msec (73-174 msec ~158 msec)
> ACL Data RX: Handle 21 flags 0x02 dlen 21               #200 [hci1] 14.641399
      SMP: Pairing Confirm (0x03) len 16
        Confim value: b4c020f60420d068bf47a264312e37b9
< HCI Command: Host Number of Com.. (0x03|0x0035) plen 5  #201 [hci1] 14.657438
        Num handles: 1
        Handle: 21 Address: DF:A9:FF:F6:B1:1A (OUI DF-A9-FF)
        Count: 1
< ACL Data TX: Handle 21 flags 0x00 dlen 21               #202 [hci1] 14.657672
      SMP: Pairing Confirm (0x03) len 16
        Confim value: dc0c684e2f5269c4ea7f1ea0e8eac1bc
> HCI Event: Number of Completed Packets (0x13) plen 5    #203 [hci1] 14.816237
        Num handles: 1
        Handle: 21 Address: DF:A9:FF:F6:B1:1A (OUI DF-A9-FF)
        Count: 1
        #202: len 21 (1 Kb/s)
        Latency: 158 msec (73-174 msec ~158 msec)
> ACL Data RX: Handle 21 flags 0x02 dlen 21               #204 [hci1] 14.816518
      SMP: Pairing Random (0x04) len 16
        Random value: baad0c3ab2fba5c40000000000000000
< HCI Command: Host Number of Com.. (0x03|0x0035) plen 5  #205 [hci1] 14.817483
        Num handles: 1
        Handle: 21 Address: DF:A9:FF:F6:B1:1A (OUI DF-A9-FF)
        Count: 1
< ACL Data TX: Handle 21 flags 0x00 dlen 21               #206 [hci1] 14.817577
      SMP: Pairing Random (0x04) len 16
        Random value: ed17f76500c95219dd01e09d1e63f87b
> HCI Event: Number of Completed Packets (0x13) plen 5    #207 [hci1] 14.990971
        Num handles: 1
        Handle: 21 Address: DF:A9:FF:F6:B1:1A (OUI DF-A9-FF)
        Count: 1
        #206: len 21 (0 Kb/s)
        Latency: 173 msec (73-174 msec ~165 msec)
> ACL Data RX: Handle 21 flags 0x02 dlen 21               #208 [hci1] 15.078940
      SMP: Pairing Confirm (0x03) len 16
        Confim value: 4781e491979c57d1900ac61bb0530155
< HCI Command: Host Number of Com.. (0x03|0x0035) plen 5  #209 [hci1] 15.097364
        Num handles: 1
        Handle: 21 Address: DF:A9:FF:F6:B1:1A (OUI DF-A9-FF)
        Count: 1
< ACL Data TX: Handle 21 flags 0x00 dlen 21               #210 [hci1] 15.097566
      SMP: Pairing Confirm (0x03) len 16
        Confim value: ec0765c46837f486db06ae6f28bf718f
> HCI Event: Number of Completed Packets (0x13) plen 5    #211 [hci1] 15.253781
        Num handles: 1
        Handle: 21 Address: DF:A9:FF:F6:B1:1A (OUI DF-A9-FF)
        Count: 1
        #210: len 21 (1 Kb/s)
        Latency: 156 msec (73-174 msec ~161 msec)
> ACL Data RX: Handle 21 flags 0x02 dlen 21               #212 [hci1] 15.254153
      SMP: Pairing Random (0x04) len 16
        Random value: 62b6b62fe43589800000000000000000
< HCI Command: Host Number of Com.. (0x03|0x0035) plen 5  #213 [hci1] 15.257493
        Num handles: 1
        Handle: 21 Address: DF:A9:FF:F6:B1:1A (OUI DF-A9-FF)
        Count: 1
< ACL Data TX: Handle 21 flags 0x00 dlen 21               #214 [hci1] 15.257590
      SMP: Pairing Random (0x04) len 16
        Random value: 81d35d47e1f6006d79c974bd9d9e1ee3
> HCI Event: Number of Completed Packets (0x13) plen 5    #215 [hci1] 15.428409
        Num handles: 1
        Handle: 21 Address: DF:A9:FF:F6:B1:1A (OUI DF-A9-FF)
        Count: 1
        #214: len 21 (0 Kb/s)
        Latency: 170 msec (73-174 msec ~165 msec)
> ACL Data RX: Handle 21 flags 0x02 dlen 21               #216 [hci1] 15.516322
      SMP: Pairing Confirm (0x03) len 16
        Confim value: 554992ad790cd28e498d32a5f931b4de
< HCI Command: Host Number of Com.. (0x03|0x0035) plen 5  #217 [hci1] 15.517032
        Num handles: 1
        Handle: 21 Address: DF:A9:FF:F6:B1:1A (OUI DF-A9-FF)
        Count: 1
< ACL Data TX: Handle 21 flags 0x00 dlen 21               #218 [hci1] 15.517147
      SMP: Pairing Confirm (0x03) len 16
        Confim value: 32bc869b137f5eb94a193d1eff86c850
> HCI Event: Number of Completed Packets (0x13) plen 5    #219 [hci1] 15.691260
        Num handles: 1
        Handle: 21 Address: DF:A9:FF:F6:B1:1A (OUI DF-A9-FF)
        Count: 1
        #218: len 21 (0 Kb/s)
        Latency: 174 msec (73-174 msec ~170 msec)
> ACL Data RX: Handle 21 flags 0x02 dlen 21               #220 [hci1] 15.691562
      SMP: Pairing Random (0x04) len 16
        Random value: 74e7c91246d6575c0000000000000000
< HCI Command: Host Number of Com.. (0x03|0x0035) plen 5  #221 [hci1] 15.697584
        Num handles: 1
        Handle: 21 Address: DF:A9:FF:F6:B1:1A (OUI DF-A9-FF)
        Count: 1
< ACL Data TX: Handle 21 flags 0x00 dlen 21               #222 [hci1] 15.697683
      SMP: Pairing Random (0x04) len 16
        Random value: e7f7e0c2476823e41736a7e381bafb7c
> HCI Event: Number of Completed Packets (0x13) plen 5    #223 [hci1] 15.865929
        Num handles: 1
        Handle: 21 Address: DF:A9:FF:F6:B1:1A (OUI DF-A9-FF)
        Count: 1
        #222: len 21 (1 Kb/s)
        Latency: 168 msec (73-174 msec ~169 msec)
> ACL Data RX: Handle 21 flags 0x02 dlen 21               #224 [hci1] 15.953826
      SMP: Pairing Confirm (0x03) len 16
        Confim value: 9882ffeb744426727673d0790694ab44
< HCI Command: Host Number of Com.. (0x03|0x0035) plen 5  #225 [hci1] 15.957193
        Num handles: 1
        Handle: 21 Address: DF:A9:FF:F6:B1:1A (OUI DF-A9-FF)
        Count: 1
< ACL Data TX: Handle 21 flags 0x00 dlen 21               #226 [hci1] 15.957365
      SMP: Pairing Confirm (0x03) len 16
        Confim value: 5ff02814ac92e7b74810131085bb3e6f
> HCI Event: Number of Completed Packets (0x13) plen 5    #227 [hci1] 16.128757
        Num handles: 1
        Handle: 21 Address: DF:A9:FF:F6:B1:1A (OUI DF-A9-FF)
        Count: 1
        #226: len 21 (0 Kb/s)
        Latency: 171 msec (73-174 msec ~170 msec)
> ACL Data RX: Handle 21 flags 0x02 dlen 21               #228 [hci1] 16.128957
      SMP: Pairing Random (0x04) len 16
        Random value: c716f4240c71218e0000000000000000
< HCI Command: Host Number of Com.. (0x03|0x0035) plen 5  #229 [hci1] 16.137547
        Num handles: 1
        Handle: 21 Address: DF:A9:FF:F6:B1:1A (OUI DF-A9-FF)
        Count: 1
