Bluetooth monitor ver 5.72
= Note: Linux version 6.14.0-36-generic (x86_64)                       0.766530
= Note: Bluetooth subsystem version 2.22                               0.766532
= New Index: 00:00:00:00:00:00 (Primary,UART,hci1)              [hci1] 0.766533
= New Index: 48:5F:99:8E:E0:64 (Primary,USB,hci0)               [hci0] 0.766533
= Open Index: 00:00:00:00:00:00                                 [hci1] 1.280419
= Index Info: 00:00:00:00:00:00 (Nordic Semiconductor ASA)      [hci1] 1.280432
@ USER Open: main (privileged) version 2.22            {0x0001} [hci1] 1.280441
< HCI Command: Reset (0x03|0x0003) plen 0                    #1 [hci1] 1.281728
> HCI Event: Command Complete (0x0e) plen 4                  #2 [hci1] 1.282196
      Reset (0x03|0x0003) ncmd 1
        Status: Success (0x00)
< HCI Command: Read Local Supported... (0x04|0x0003) plen 0  #3 [hci1] 1.299657
> HCI Event: Command Complete (0x0e) plen 12                 #4 [hci1] 1.300128
      Read Local Supported Features (0x04|0x0003) ncmd 1
        Status: Success (0x00)
        Features: 0x00 0x00 0x00 0x00 0x60 0x00 0x00 0x00
          BR/EDR Not Supported
          LE Supported (Controller)
< HCI Command: Read Local Version In.. (0x04|0x0001) plen 0  #5 [hci1] 1.319630
> HCI Event: Command Complete (0x0e) plen 12                 #6 [hci1] 1.320125
      Read Local Version Information (0x04|0x0001) ncmd 1
        Status: Success (0x00)
        HCI version: Reserved (0x0f) - Revision 12393 (0x3069)
        LMP version: Reserved (0x0f) - Subversion 12393 (0x3069)
        Manufacturer: Nordic Semiconductor ASA (89)
< HCI Command: Read Local Supported... (0x04|0x0002) plen 0  #7 [hci1] 1.339648
> HCI Event: Command Complete (0x0e) plen 68                 #8 [hci1] 1.340763
      Read Local Supported Commands (0x04|0x0002) ncmd 1
        Status: Success (0x00)
        Commands: 119 entries
          Disconnect (Octet 0 - Bit 5)
          Read Remote Version Information (Octet 2 - Bit 7)
          Set Event Mask (Octet 5 - Bit 6)
          Reset (Octet 5 - Bit 7)
          Read Connection Accept Timeout (Octet 7 - Bit 2)
          Write Connection Accept Timeout (Octet 7 - Bit 3)
          Read Transmit Power Level (Octet 10 - Bit 2)
          Set Controller To Host Flow Control (Octet 10 - Bit 5)
          Host Buffer Size (Octet 10 - Bit 6)
          Host Number of Completed Packets (Octet 10 - Bit 7)
          Read Local Version Information (Octet 14 - Bit 3)
          Read Local Supported Features (Octet 14 - Bit 5)
          Read BD ADDR (Octet 15 - Bit 1)
          Read RSSI (Octet 15 - Bit 5)
          Set Event Mask Page 2 (Octet 22 - Bit 2)
          LE Set Event Mask (Octet 25 - Bit 0)
          LE Read Buffer Size (Octet 25 - Bit 1)
          LE Read Local Supported Features (Octet 25 - Bit 2)
          LE Set Random Address (Octet 25 - Bit 4)
          LE Set Advertising Parameters (Octet 25 - Bit 5)
          LE Read Advertising Channel TX Power (Octet 25 - Bit 6)
          LE Set Advertising Data (Octet 25 - Bit 7)
          LE Set Scan Response Data (Octet 26 - Bit 0)
          LE Set Advertise Enable (Octet 26 - Bit 1)
          LE Set Scan Parameters (Octet 26 - Bit 2)
          LE Set Scan Enable (Octet 26 - Bit 3)
          LE Create Connection (Octet 26 - Bit 4)
          LE Create Connection Cancel (Octet 26 - Bit 5)
          LE Read Accept List Size (Octet 26 - Bit 6)
          LE Clear Accept List (Octet 26 - Bit 7)
          LE Add Device To Accept List (Octet 27 - Bit 0)
          LE Remove Device From Accept List (Octet 27 - Bit 1)
          LE Connection Update (Octet 27 - Bit 2)
          LE Set Host Channel Classification (Octet 27 - Bit 3)
          LE Read Channel Map (Octet 27 - Bit 4)
          LE Read Remote Used Features (Octet 27 - Bit 5)
          LE Encrypt (Octet 27 - Bit 6)
          LE Rand (Octet 27 - Bit 7)
          LE Start Encryption (Octet 28 - Bit 0)
          LE Long Term Key Request Reply (Octet 28 - Bit 1)
          LE Long Term Key Request Neg Reply (Octet 28 - Bit 2)
          LE Read Supported States (Octet 28 - Bit 3)
          LE Receiver Test (Octet 28 - Bit 4)
          LE Transmitter Test (Octet 28 - Bit 5)
          LE Test End (Octet 28 - Bit 6)
          Read Authenticated Payload Timeout (Octet 32 - Bit 4)
          Write Authenticated Payload Timeout (Octet 32 - Bit 5)
          LE Set Data Length (Octet 33 - Bit 6)
          LE Read Suggested Default Data Length (Octet 33 - Bit 7)
          LE Write Suggested Default Data Length (Octet 34 - Bit 0)
          LE Add Device To Resolving List (Octet 34 - Bit 3)
          LE Remove Device From Resolving List (Octet 34 - Bit 4)
          LE Clear Resolving List (Octet 34 - Bit 5)
          LE Read Resolving List Size (Octet 34 - Bit 6)
          LE Set Address Resolution Enable (Octet 35 - Bit 1)
          LE Set Resolvable Private Address Timeout (Octet 35 - Bit 2)
          LE Read Maximum Data Length (Octet 35 - Bit 3)
          LE Read PHY (Octet 35 - Bit 4)
          LE Set Default PHY (Octet 35 - Bit 5)
          LE Set PHY (Octet 35 - Bit 6)
          LE Enhanced Receiver Test (Octet 35 - Bit 7)
          LE Enhanced Transmitter Test (Octet 36 - Bit 0)
          LE Set Advertising Set Random Address (Octet 36 - Bit 1)
          LE Set Extended Advertising Parameters (Octet 36 - Bit 2)
          LE Set Extended Advertising Data (Octet 36 - Bit 3)
          LE Set Extended Scan Response Data (Octet 36 - Bit 4)
          LE Set Extended Advertising Enable (Octet 36 - Bit 5)
          LE Read Maximum Advertising Data Length (Octet 36 - Bit 6)
          LE Read Number of Supported Advertising Sets (Octet 36 - Bit 7)
          LE Remove Advertising Set (Octet 37 - Bit 0)
          LE Clear Advertising Sets (Octet 37 - Bit 1)
          LE Set Periodic Advertising Parameters (Octet 37 - Bit 2)
          LE Set Periodic Advertising Data (Octet 37 - Bit 3)
          LE Set Periodic Advertising Enable (Octet 37 - Bit 4)
          LE Set Extended Scan Parameters (Octet 37 - Bit 5)
          LE Set Extended Scan Enable (Octet 37 - Bit 6)
          LE Extended Create Connection (Octet 37 - Bit 7)
          LE Periodic Advertising Create Sync (Octet 38 - Bit 0)
          LE Periodic Advertising Create Sync Cancel (Octet 38 - Bit 1)
          LE Periodic Advertising Terminate Sync (Octet 38 - Bit 2)
          LE Add Device To Periodic Advertiser List (Octet 38 - Bit 3)
          LE Remove Device From Periodic Advertiser List (Octet 38 - Bit 4)
          LE Clear Periodic Advertiser List (Octet 38 - Bit 5)
          LE Read Periodic Advertiser List Size (Octet 38 - Bit 6)
          LE Read Transmit Power (Octet 38 - Bit 7)
          LE Read RF Path Compensation (Octet 39 - Bit 0)
          LE Write RF Path Compensation (Octet 39 - Bit 1)
          LE Set Privacy Mode (Octet 39 - Bit 2)
          LE Periodic Advertising Receive Enable (Octet 40 - Bit 5)
          LE Periodic Advertising Sync Transfer (Octet 40 - Bit 6)
          LE Periodic Advertising Set Info Transfer (Octet 40 - Bit 7)
          LE Periodic Advertising Sync Transfer Parameters (Octet 41 - Bit 0)
          LE Set Default Periodic Advertisng Sync Transfer Parameters (Octet 41 - Bit 1)
          LE Read Buffer v2 (Octet 41 - Bit 5)
          LE Read ISO TX Sync (Octet 41 - Bit 6)
          LE Set Connected Isochronous Group Parameters (Octet 41 - Bit 7)
          LE Set Connected Isochronous Group Parameters Test (Octet 42 - Bit 0)
          LE Create Connected Isochronous Stream (Octet 42 - Bit 1)
          LE Remove Connected Isochronous Group (Octet 42 - Bit 2)
          LE Accept Connected Isochronous Stream Request (Octet 42 - Bit 3)
          LE Reject Connected Isochronous Stream Request (Octet 42 - Bit 4)
          LE Create Broadcast Isochronous Group (Octet 42 - Bit 5)
          LE Create Broadcast Isochronous Group Test (Octet 42 - Bit 6)
          LE Terminate Broadcast Isochronous Group (Octet 42 - Bit 7)
          LE Broadcast Isochronous Group Create Sync (Octet 43 - Bit 0)
          LE Broadcast Isochronous Group Terminate Sync (Octet 43 - Bit 1)
          LE Request Peer SCA (Octet 43 - Bit 2)
          LE Setup Isochronous Data Path (Octet 43 - Bit 3)
          LE Remove Isochronous Data Path (Octet 43 - Bit 4)
          LE Isochronous Transmit Test (Octet 43 - Bit 5)
          LE Isochronous Receive Test (Octet 43 - Bit 6)
          LE Isochronous Read Test Counters (Octet 43 - Bit 7)
          LE Isochronous Read Test Counters (Octet 44 - Bit 0)
          LE Set Host Feature (Octet 44 - Bit 1)
          Octet 44 - Bit 2 
          Octet 45 - Bit 6 
          Octet 46 - Bit 0 
          Octet 46 - Bit 1 
          Octet 46 - Bit 2 
< HCI Command: Host Buffer Size (0x03|0x0033) plen 7         #9 [hci1] 1.359633
        ACL MTU: 255  ACL max packet: 16
        SCO MTU: 0    SCO max packet: 0
> HCI Event: Command Complete (0x0e) plen 4                 #10 [hci1] 1.360072
      Host Buffer Size (0x03|0x0033) ncmd 1
        Status: Success (0x00)
< HCI Command: Set Controller To Ho.. (0x03|0x0031) plen 1  #11 [hci1] 1.379608
        Flow control: ACL Data Packets (0x01)
> HCI Event: Command Complete (0x0e) plen 4                 #12 [hci1] 1.380031
      Set Controller To Host Flow Control (0x03|0x0031) ncmd 1
        Status: Success (0x00)
< HCI Command: LE Read Local Suppor.. (0x08|0x0003) plen 0  #13 [hci1] 1.399617
> HCI Event: Command Complete (0x0e) plen 12                #14 [hci1] 1.400071
      LE Read Local Supported Features (0x08|0x0003) ncmd 1
        Status: Success (0x00)
        Features: 0xfd 0x79 0x00 0xf7 0x30 0x01 0x00 0x00
          LE Encryption
          Extended Reject Indication
          Peripheral-initiated Features Exchange
          LE Ping
          LE Data Packet Length Extension
          LL Privacy
          Extended Scanner Filter Policies
          LE 2M PHY
          LE Coded PHY
          LE Extended Advertising
          LE Periodic Advertising
          Channel Selection Algorithm #2
          Periodic Advertising Sync Transfer - Sender
          Periodic Advertising Sync Transfer - Recipient
          Sleep Clock Accuracy Updates
          Connected Isochronous Stream - Central
          Connected Isochronous Stream - Peripheral
          Isochronous Broadcaster
          Synchronized Receiver
          Periodic Advertising ADI support
          Connection Subrating
          Unknown features (0x0000010000000000)
< HCI Command: LE Set Host Feature (0x08|0x0074) plen 2     #15 [hci1] 1.419673
        Bit Number: 32
          Connected Isochronous Stream (Host Support)
        Bit Value: 1
> HCI Event: Command Complete (0x0e) plen 4                 #16 [hci1] 1.420067
      LE Set Host Feature (0x08|0x0074) ncmd 1
        Status: Success (0x00)
< HCI Command: LE Read Buffer v2 (0x08|0x0060) plen 0       #17 [hci1] 1.439643
> HCI Event: Command Complete (0x0e) plen 10                #18 [hci1] 1.440112
      LE Read Buffer v2 (0x08|0x0060) ncmd 1
        Status: Success (0x00)
        ACL MTU: 27
        ACL max packet: 3
        ISO MTU: 318
        ISO max packet: 3
< HCI Command: LE Read Maximum Adve.. (0x08|0x003a) plen 0  #19 [hci1] 1.459669
> HCI Event: Command Complete (0x0e) plen 6                 #20 [hci1] 1.460106
      LE Read Maximum Advertising Data Length (0x08|0x003a) ncmd 1
        Status: Success (0x00)
        Max length: 1650
< HCI Command: LE Read Supported St.. (0x08|0x001c) plen 0  #21 [hci1] 1.479642
> HCI Event: Command Complete (0x0e) plen 12                #22 [hci1] 1.480102
      LE Read Supported States (0x08|0x001c) ncmd 1
        Status: Success (0x00)
        States: 0x000003ff3e0306ff
          Non-connectable Advertising State
          Scannable Advertising State
          Connectable Advertising State
          High Duty Cycle Directed Advertising State
          Passive Scanning State
          Active Scanning State
          Initiating State
            and Connection State (Central Role)
          Connection State (Peripheral Role)
          Scannable Advertising State
            and Passive Scanning State
          Connectable Advertising State
            and Passive Scanning State
          Non-connectable Advertising State
            and Initiating State
          Scannable Advertising State
            and Initiating State
          Active Scanning State
            and Connection State (Central Role)
          Passive Scanning State
            and Connection State (Peripheral Role)
          Active Scanning State
            and Connection State (Peripheral Role)
          Initiating State
            and Connection State (Central Role)
            and Central Role & Central Role
          Low Duty Cycle Directed Advertising State
          Connectable Advertising State
            and Initiating State
            and Central Role & Peripheral Role
          High Duty Cycle Directed Advertising State
            and Initiating State
            and Central Role & Peripheral Role
          Low Duty Cycle Directed Advertising State
            and Initiating State
            and Central Role & Peripheral Role
          Connectable Advertising State
            and Connection State (Central Role)
            and Central Role & Peripheral Role
          High Duty Cycle Directed Advertising State
            and Connection State (Central Role)
            and Central Role & Peripheral Role
          Low Duty Cycle Directed Advertising State
            and Connection State (Central Role)
            and Central Role & Peripheral Role
          Connectable Advertising State
            and Connection State (Peripheral Role)
            and Central Role & Peripheral Role
          High Duty Cycle Directed Advertising State
            and Connection State (Peripheral Role)
            and Peripheral Role & Peripheral Role
          Low Duty Cycle Directed Advertising State
            and Connection State (Peripheral Role)
            and Peripheral Role & Peripheral Role
          Initiating State
            and Connection State (Peripheral Role)
            and Central Role & Peripheral Role
< HCI Command: LE Read Maximum Data.. (0x08|0x002f) plen 0  #23 [hci1] 1.499619
> HCI Event: Command Complete (0x0e) plen 12                #24 [hci1] 1.500072
      LE Read Maximum Data Length (0x08|0x002f) ncmd 1
        Status: Success (0x00)
        Max TX octets: 251
        Max TX time: 2704
        Max RX octets: 251
        Max RX time: 2704
< HCI Command: LE Write Suggested D.. (0x08|0x0024) plen 4  #25 [hci1] 1.519645
        TX octets: 251
        TX time: 2704
> HCI Event: Command Complete (0x0e) plen 4                 #26 [hci1] 1.520116
      LE Write Suggested Default Data Length (0x08|0x0024) ncmd 1
        Status: Success (0x00)
< HCI Command: LE Read Resolving Li.. (0x08|0x002a) plen 0  #27 [hci1] 1.539588
> HCI Event: Command Complete (0x0e) plen 5                 #28 [hci1] 1.540019
      LE Read Resolving List Size (0x08|0x002a) ncmd 1
        Status: Success (0x00)
        Size: 8
< HCI Command: LE Set Event Mask (0x08|0x0001) plen 8       #29 [hci1] 1.559622
        Mask: 0x000002023f87fa5e
          LE Advertising Report
          LE Connection Update Complete
          LE Read Remote Used Features Complete
          LE Long Term Key Request
          LE Data Length Change
          LE Enhanced Connection Complete
          LE PHY Update Complete
          LE Extended Advertising Report
          LE Periodic Advertising Sync Established
          LE Periodic Advertising Report
          LE Periodic Advertising Sync Lost
          LE Extended Scan Timeout
          LE Extended Advertising Set Terminated
          LE Scan Request Received
          LE Periodic Advertising Sync Transfer Rvc
          LE CIS Established
          LE CIS Request
          LE Create BIG Complete
          LE Terminate BIG Complete
          LE BIG Sync Estabilished Complete
          LE BIG Sync Lost
          LE BIG Info Advertising Report
          Unknown mask (0x0000020000000000)
> HCI Event: Command Complete (0x0e) plen 4                 #30 [hci1] 1.560105
      LE Set Event Mask (0x08|0x0001) ncmd 1
        Status: Success (0x00)
< HCI Command: Set Event Mask (0x03|0x0001) plen 8          #31 [hci1] 1.579643
        Mask: 0x2000800002008890
          Disconnection Complete
          Encryption Change
          Read Remote Version Information Complete
          Hardware Error
          Data Buffer Overflow
          Encryption Key Refresh Complete
          LE Meta
> HCI Event: Command Complete (0x0e) plen 4                 #32 [hci1] 1.580150
      Set Event Mask (0x03|0x0001) ncmd 1
        Status: Success (0x00)
< HCI Command: Read BD ADDR (0x04|0x0009) plen 0            #33 [hci1] 1.599644
> HCI Event: Command Complete (0x0e) plen 10                #34 [hci1] 1.600099
      Read BD ADDR (0x04|0x0009) ncmd 1
        Status: Success (0x00)
        Address: 00:00:00:00:00:00 (OUI 00-00-00)
< HCI Command: LE Set Random Address (0x08|0x0005) plen 6   #35 [hci1] 1.619690
        Address: D5:B6:CC:31:DB:3B (Static)
> HCI Event: Command Complete (0x0e) plen 4                 #36 [hci1] 1.620266
      LE Set Random Address (0x08|0x0005) ncmd 1
        Status: Success (0x00)
< HCI Command: LE Set Extended Adv.. (0x08|0x0036) plen 25  #37 [hci1] 4.099785
        Handle: 0x00
        Properties: 0x0013
          Connectable
          Scannable
          Use legacy advertising PDUs: ADV_IND
        Min advertising interval: 100.000 msec (0x00a0)
        Max advertising interval: 150.000 msec (0x00f0)
        Channel map: 37, 38, 39 (0x07)
        Own address type: Random (0x01)
        Peer address type: Public (0x00)
        Peer address: 00:00:00:00:00:00 (OUI 00-00-00)
        Filter policy: Allow Scan Request from Any, Allow Connect Request from Any (0x00)
        TX power: Host has no preference (0x7f)
        Primary PHY: LE 1M (0x01)
        Secondary max skip: 0x00
        Secondary PHY: LE 1M (0x01)
        SID: 0x00
        Scan request notifications: Disabled (0x00)
> HCI Event: Command Complete (0x0e) plen 5                 #38 [hci1] 4.100720
      LE Set Extended Advertising Parameters (0x08|0x0036) ncmd 1
        Status: Success (0x00)
        TX power (selected): 0 dbm (0x00)
< HCI Command: LE Set Advertising S.. (0x08|0x0035) plen 7  #39 [hci1] 4.119689
        Advertising handle: 0x00
        Advertising random address: D5:B6:CC:31:DB:3B (Static)
> HCI Event: Command Complete (0x0e) plen 4                 #40 [hci1] 4.120136
      LE Set Advertising Set Random Address (0x08|0x0035) ncmd 1
        Status: Success (0x00)
< HCI Command: LE Set Extended Adv.. (0x08|0x0037) plen 22  #41 [hci1] 4.139689
        Handle: 0x00
        Operation: Complete extended advertising data (0x03)
        Fragment preference: Minimize fragmentation (0x01)
        Data length: 0x12
        Flags: 0x06
          LE General Discoverable Mode
          BR/EDR Not Supported
        Name (complete): Tester_F6B11A
> HCI Event: Command Complete (0x0e) plen 4                 #42 [hci1] 4.140343
      LE Set Extended Advertising Data (0x08|0x0037) ncmd 1
        Status: Success (0x00)
< HCI Command: LE Set Extended Scan.. (0x08|0x0038) plen 4  #43 [hci1] 4.159695
        Handle: 0x00
        Operation: Complete scan response data (0x03)
        Fragment preference: Minimize fragmentation (0x01)
        Data length: 0x00
> HCI Event: Command Complete (0x0e) plen 4                 #44 [hci1] 4.160174
      LE Set Extended Scan Response Data (0x08|0x0038) ncmd 1
        Status: Success (0x00)
< HCI Command: LE Set Extended Adve.. (0x08|0x0039) plen 6  #45 [hci1] 4.179704
        Extended advertising: Enabled (0x01)
        Number of sets: 1 (0x01)
        Entry 0
          Handle: 0x00
          Duration: 0 ms (0x00)
          Max ext adv events: 0
> HCI Event: Command Complete (0x0e) plen 4                 #46 [hci1] 4.180261
      LE Set Extended Advertising Enable (0x08|0x0039) ncmd 1
        Status: Success (0x00)
> HCI Event: LE Meta Event (0x3e) plen 31                   #47 [hci1] 4.288599
      LE Enhanced Connection Complete (0x0a)
        Status: Success (0x00)
        Handle: 1173
        Role: Peripheral (0x01)
        Peer address type: Public (0x00)
        Peer address: DF:A9:FF:F6:B1:1A (OUI DF-A9-FF)
        Local resolvable private address: 00:00:00:00:00:00 (Non-Resolvable)
        Peer resolvable private address: 00:00:00:00:00:00 (Non-Resolvable)
        Connection interval: 87.50 msec (0x0046)
        Connection latency: 0 (0x0000)
        Supervision timeout: 25120 msec (0x09d0)
        Central clock accuracy: 0x01
> HCI Event: LE Meta Event (0x3e) plen 6                    #48 [hci1] 4.288671
      LE Advertising Set Terminated (0x12)
        Status: Success (0x00)
        Handle: 0
        Connection handle: 1173
        Number of completed extended advertising events: 0
< HCI Command: LE Read Remote Used... (0x08|0x0016) plen 2  #49 [hci1] 4.299940
        Handle: 1173 Address: DF:A9:FF:F6:B1:1A (OUI DF-A9-FF)
< ACL Data TX: Handle 1173 flags 0x00 dlen 7                #50 [hci1] 4.300100
      ATT: Exchange MTU Request (0x02) len 2
        Client RX MTU: 251
> HCI Event: Command Status (0x0f) plen 4                   #51 [hci1] 4.300350
      LE Read Remote Used Features (0x08|0x0016) ncmd 1
        Status: Success (0x00)
> HCI Event: Number of Completed Packets (0x13) plen 5      #52 [hci1] 4.464639
        Num handles: 1
        Handle: 1173 Address: DF:A9:FF:F6:B1:1A (OUI DF-A9-FF)
        Count: 1
        #50: len 7 (0 Kb/s)
        Latency: 164 msec (164-164 msec ~164 msec)
> HCI Event: LE Meta Event (0x3e) plen 12                   #53 [hci1] 4.552534
      LE Read Remote Used Features (0x04)
        Status: Success (0x00)
        Handle: 1173 Address: DF:A9:FF:F6:B1:1A (OUI DF-A9-FF)
        Features: 0x2d 0x49 0x00 0xf7 0x67 0xd8 0x00 0x00
          LE Encryption
          Extended Reject Indication
          Peripheral-initiated Features Exchange
          LE Data Packet Length Extension
          LE 2M PHY
          LE Coded PHY
          Channel Selection Algorithm #2
          Periodic Advertising Sync Transfer - Sender
          Periodic Advertising Sync Transfer - Recipient
          Sleep Clock Accuracy Updates
          Connected Isochronous Stream - Central
          Connected Isochronous Stream - Peripheral
          Isochronous Broadcaster
          Synchronized Receiver
          Connected Isochronous Stream (Host Support)
          LE Power Control Request
          LE Power Control Request
          Connection Subrating
          Connection Subrating (Host Support)
          Unknown features (0x0000d80000000000)
> ACL Data RX: Handle 1173 flags 0x02 dlen 11               #54 [hci1] 7.002141
      SMP: Pairing Request (0x01) len 6
        IO capability: KeyboardDisplay (0x04)
        OOB data: Authentication data not present (0x00)
        Authentication requirement: Bonding, MITM, SC, No Keypresses (0x0d)
        Max encryption key size: 16
        Initiator key distribution: EncKey IdKey (0x03)
        Responder key distribution: EncKey IdKey Sign (0x07)
> ACL Data RX: Handle 1173 flags 0x02 dlen 7                #55 [hci1] 7.002634
      ATT: Exchange MTU Response (0x03) len 2
        Server RX MTU: 23
< HCI Command: Host Number of Compl.. (0x03|0x0035) plen 5  #56 [hci1] 7.020312
        Num handles: 1
        Handle: 1173 Address: DF:A9:FF:F6:B1:1A (OUI DF-A9-FF)
        Count: 1
< ACL Data TX: Handle 1173 flags 0x00 dlen 11               #57 [hci1] 7.020513
      SMP: Pairing Response (0x02) len 6
        IO capability: DisplayOnly (0x00)
        OOB data: Authentication data not present (0x00)
        Authentication requirement: Bonding, No MITM, SC, No Keypresses (0x09)
        Max encryption key size: 16
        Initiator key distribution: IdKey (0x02)
        Responder key distribution: <none> (0x00)
< HCI Command: Host Number of Compl.. (0x03|0x0035) plen 5  #58 [hci1] 7.020680
        Num handles: 1
        Handle: 1173 Address: DF:A9:FF:F6:B1:1A (OUI DF-A9-FF)
        Count: 1
> HCI Event: Number of Completed Packets (0x13) plen 5      #59 [hci1] 7.177325
        Num handles: 1
        Handle: 1173 Address: DF:A9:FF:F6:B1:1A (OUI DF-A9-FF)
        Count: 1
        #57: len 11 (0 Kb/s)
        Latency: 156 msec (156-164 msec ~160 msec)
> ACL Data RX: Handle 1173 flags 0x02 dlen 27               #60 [hci1] 7.177573
> ACL Data RX: Handle 1173 flags 0x01 dlen 27               #61 [hci1] 7.178077
> ACL Data RX: Handle 1173 flags 0x01 dlen 15               #62 [hci1] 7.178605
      SMP: Pairing Public Key (0x0c) len 64
        X: b70750500161c22089ae984721af43616c440fef8ac24356885454e0619e426e
        Y: a65a50fe4d1ad53779147c2b082c3bd43de1567d3fbfc9eab0219b7b5ee2ba8f
< HCI Command: Host Number of Compl.. (0x03|0x0035) plen 5  #63 [hci1] 7.180363
        Num handles: 1
        Handle: 1173 Address: DF:A9:FF:F6:B1:1A (OUI DF-A9-FF)
        Count: 1
< HCI Command: Host Number of Compl.. (0x03|0x0035) plen 5  #64 [hci1] 7.180571
        Num handles: 1
        Handle: 1173 Address: DF:A9:FF:F6:B1:1A (OUI DF-A9-FF)
        Count: 1
< HCI Command: Host Number of Compl.. (0x03|0x0035) plen 5  #65 [hci1] 7.180895
        Num handles: 1
        Handle: 1173 Address: DF:A9:FF:F6:B1:1A (OUI DF-A9-FF)
        Count: 1
< ACL Data TX: Handle 1173 flags 0x00 dlen 27               #66 [hci1] 7.181053
< ACL Data TX: Handle 1173 flags 0x01 dlen 27               #67 [hci1] 7.181089
< ACL Data TX: Handle 1173 flags 0x01 dlen 15               #68 [hci1] 7.181104
      SMP: Pairing Public Key (0x0c) len 64
        X: 98308440221e2d910f0e54b71e7ec652857aa9b5a0dc65028824cc19db1226e9
        Y: 67a4816bcb62efb21701e31fdb27561a6217575fb007a8bbdabe7e28b6f68482
> HCI Event: Number of Completed Packets (0x13) plen 5      #69 [hci1] 7.265079
        Num handles: 1
        Handle: 1173 Address: DF:A9:FF:F6:B1:1A (OUI DF-A9-FF)
        Count: 1
        #66: len 27 (2 Kb/s)
        Latency: 84 msec (84-164 msec ~122 msec)
> HCI Event: Number of Completed Packets (0x13) plen 5      #70 [hci1] 7.265756
        Num handles: 1
        Handle: 1173 Address: DF:A9:FF:F6:B1:1A (OUI DF-A9-FF)
        Count: 1
        #67: len 27 (2 Kb/s)
        Latency: 84 msec (84-164 msec ~103 msec)
> HCI Event: Number of Completed Packets (0x13) plen 5      #71 [hci1] 7.352034
        Num handles: 1
        Handle: 1173 Address: DF:A9:FF:F6:B1:1A (OUI DF-A9-FF)
        Count: 1
        #68: len 15 (0 Kb/s)
        Latency: 170 msec (84-170 msec ~137 msec)
> ACL Data RX: Handle 1173 flags 0x02 dlen 21               #72 [hci1] 8.402364
      SMP: Pairing Confirm (0x03) len 16
        Confim value: 8cdb31b1b1ffa856dfc66b669d5ee0d7
< HCI Command: Host Number of Compl.. (0x03|0x0035) plen 5  #73 [hci1] 8.420517
        Num handles: 1
        Handle: 1173 Address: DF:A9:FF:F6:B1:1A (OUI DF-A9-FF)
        Count: 1
< ACL Data TX: Handle 1173 flags 0x00 dlen 21               #74 [hci1] 8.420719
      SMP: Pairing Confirm (0x03) len 16
        Confim value: 0f7d80aabc646cae2ae3e2ce48cf5b05
> HCI Event: Number of Completed Packets (0x13) plen 5      #75 [hci1] 8.577161
        Num handles: 1
        Handle: 1173 Address: DF:A9:FF:F6:B1:1A (OUI DF-A9-FF)
        Count: 1
        #74: len 21 (1 Kb/s)
        Latency: 156 msec (84-170 msec ~146 msec)
> ACL Data RX: Handle 1173 flags 0x02 dlen 21               #76 [hci1] 8.577487
      SMP: Pairing Random (0x04) len 16
        Random value: 9b14eea4789bbca60000000000000000
< HCI Command: Host Number of Compl.. (0x03|0x0035) plen 5  #77 [hci1] 8.580672
        Num handles: 1
        Handle: 1173 Address: DF:A9:FF:F6:B1:1A (OUI DF-A9-FF)
        Count: 1
< ACL Data TX: Handle 1173 flags 0x00 dlen 21               #78 [hci1] 8.580887
      SMP: Pairing Random (0x04) len 16
        Random value: 8e6108f966a694cbe26df70bb96773e6
> HCI Event: Number of Completed Packets (0x13) plen 5      #79 [hci1] 8.751930
        Num handles: 1
        Handle: 1173 Address: DF:A9:FF:F6:B1:1A (OUI DF-A9-FF)
        Count: 1
        #78: len 21 (0 Kb/s)
        Latency: 171 msec (84-171 msec ~158 msec)
> ACL Data RX: Handle 1173 flags 0x02 dlen 21               #80 [hci1] 8.839804
      SMP: Pairing Confirm (0x03) len 16
        Confim value: aa20ceda3ce779626533dd6c3755cc8d
< HCI Command: Host Number of Compl.. (0x03|0x0035) plen 5  #81 [hci1] 8.860378
        Num handles: 1
        Handle: 1173 Address: DF:A9:FF:F6:B1:1A (OUI DF-A9-FF)
        Count: 1
< ACL Data TX: Handle 1173 flags 0x00 dlen 21               #82 [hci1] 8.860563
      SMP: Pairing Confirm (0x03) len 16
        Confim value: b250eb31d3b263e07d09249822ee1b29
> HCI Event: Number of Completed Packets (0x13) plen 5      #83 [hci1] 9.014699
        Num handles: 1
        Handle: 1173 Address: DF:A9:FF:F6:B1:1A (OUI DF-A9-FF)
        Count: 1
        #82: len 21 (1 Kb/s)
        Latency: 154 msec (84-171 msec ~156 msec)
> ACL Data RX: Handle 1173 flags 0x02 dlen 21               #84 [hci1] 9.014920
      SMP: Pairing Random (0x04) len 16
        Random value: 85ef230acf729b320000000000000000
< HCI Command: Host Number of Compl.. (0x03|0x0035) plen 5  #85 [hci1] 9.019968
        Num handles: 1
        Handle: 1173 Address: DF:A9:FF:F6:B1:1A (OUI DF-A9-FF)
        Count: 1
< ACL Data TX: Handle 1173 flags 0x00 dlen 21               #86 [hci1] 9.019992
      SMP: Pairing Random (0x04) len 16
        Random value: 4d02679f89a05211af56d8b3da64d21e
> HCI Event: Number of Completed Packets (0x13) plen 5      #87 [hci1] 9.189360
        Num handles: 1
        Handle: 1173 Address: DF:A9:FF:F6:B1:1A (OUI DF-A9-FF)
        Count: 1
        #86: len 21 (0 Kb/s)
        Latency: 169 msec (84-171 msec ~162 msec)
> ACL Data RX: Handle 1173 flags 0x02 dlen 21               #88 [hci1] 9.277308
      SMP: Pairing Confirm (0x03) len 16
        Confim value: eb6b8c09307a15688ba1c78d9b07c946
< HCI Command: Host Number of Compl.. (0x03|0x0035) plen 5  #89 [hci1] 9.280049
        Num handles: 1
        Handle: 1173 Address: DF:A9:FF:F6:B1:1A (OUI DF-A9-FF)
        Count: 1
< ACL Data TX: Handle 1173 flags 0x00 dlen 21               #90 [hci1] 9.280170
      SMP: Pairing Confirm (0x03) len 16
        Confim value: d76f3d3ce849d106215d4b7d21034735
> HCI Event: Number of Completed Packets (0x13) plen 5      #91 [hci1] 9.452112
        Num handles: 1
        Handle: 1173 Address: DF:A9:FF:F6:B1:1A (OUI DF-A9-FF)
        Count: 1
        #90: len 21 (0 Kb/s)
        Latency: 171 msec (84-171 msec ~167 msec)
> ACL Data RX: Handle 1173 flags 0x02 dlen 21               #92 [hci1] 9.452357
      SMP: Pairing Random (0x04) len 16
        Random value: 5f4c5eefb5e87fed0000000000000000
< HCI Command: Host Number of Compl.. (0x03|0x0035) plen 5  #93 [hci1] 9.460701
        Num handles: 1
        Handle: 1173 Address: DF:A9:FF:F6:B1:1A (OUI DF-A9-FF)
        Count: 1
< ACL Data TX: Handle 1173 flags 0x00 dlen 21               #94 [hci1] 9.460864
      SMP: Pairing Random (0x04) len 16
        Random value: 5e8286bc235a02440d0c3424a2acf8fd
> HCI Event: Number of Completed Packets (0x13) plen 5      #95 [hci1] 9.626877
        Num handles: 1
        Handle: 1173 Address: DF:A9:FF:F6:B1:1A (OUI DF-A9-FF)
        Count: 1
        #94: len 21 (1 Kb/s)
        Latency: 166 msec (84-171 msec ~166 msec)
> ACL Data RX: Handle 1173 flags 0x02 dlen 21               #96 [hci1] 9.714728
      SMP: Pairing Confirm (0x03) len 16
        Confim value: cf0eed3b190fbd0ed33a6ec487398056
< HCI Command: Host Number of Compl.. (0x03|0x0035) plen 5  #97 [hci1] 9.720318
        Num handles: 1
        Handle: 1173 Address: DF:A9:FF:F6:B1:1A (OUI DF-A9-FF)
        Count: 1
< ACL Data TX: Handle 1173 flags 0x00 dlen 21               #98 [hci1] 9.720794
      SMP: Pairing Confirm (0x03) len 16
        Confim value: 05ddcf953b81c4a96d8a4577ba5ea066
> HCI Event: Number of Completed Packets (0x13) plen 5      #99 [hci1] 9.889704
        Num handles: 1
        Handle: 1173 Address: DF:A9:FF:F6:B1:1A (OUI DF-A9-FF)
        Count: 1
        #98: len 21 (1 Kb/s)
        Latency: 168 msec (84-171 msec ~167 msec)
> ACL Data RX: Handle 1173 flags 0x02 dlen 21              #100 [hci1] 9.889867
      SMP: Pairing Random (0x04) len 16
        Random value: 507152fb883dc1ff0000000000000000
< HCI Command: Host Number of Comp.. (0x03|0x0035) plen 5  #101 [hci1] 9.900119
        Num handles: 1
        Handle: 1173 Address: DF:A9:FF:F6:B1:1A (OUI DF-A9-FF)
        Count: 1
< ACL Data TX: Handle 1173 flags 0x00 dlen 21              #102 [hci1] 9.900167
      SMP: Pairing Random (0x04) len 16
        Random value: 5c4a1bcadd27bd58e945097b00bad7ac
> HCI Event: Number of Completed Packets (0x13) plen 5    #103 [hci1] 10.064354
        Num handles: 1
        Handle: 1173 Address: DF:A9:FF:F6:B1:1A (OUI DF-A9-FF)
        Count: 1
        #102: len 21 (1 Kb/s)
        Latency: 164 msec (84-171 msec ~166 msec)
> ACL Data RX: Handle 1173 flags 0x02 dlen 21             #104 [hci1] 10.152304
      SMP: Pairing Confirm (0x03) len 16
        Confim value: 05eae6aaf6d2d037c91011fc0cc667a7
< HCI Command: Host Number of Com.. (0x03|0x0035) plen 5  #105 [hci1] 10.160427
        Num handles: 1
        Handle: 1173 Address: DF:A9:FF:F6:B1:1A (OUI DF-A9-FF)
        Count: 1
< ACL Data TX: Handle 1173 flags 0x00 dlen 21             #106 [hci1] 10.160668
      SMP: Pairing Confirm (0x03) len 16
        Confim value: 3eca986453c98d5633c0a2a1e454bdc2
> HCI Event: Number of Completed Packets (0x13) plen 5    #107 [hci1] 10.327033
        Num handles: 1
        Handle: 1173 Address: DF:A9:FF:F6:B1:1A (OUI DF-A9-FF)
        Count: 1
        #106: len 21 (1 Kb/s)
        Latency: 166 msec (84-171 msec ~166 msec)
> ACL Data RX: Handle 1173 flags 0x02 dlen 21             #108 [hci1] 10.327538
      SMP: Pairing Random (0x04) len 16
        Random value: 924b83bbed5885390000000000000000
< HCI Command: Host Number of Com.. (0x03|0x0035) plen 5  #109 [hci1] 10.340259
        Num handles: 1
        Handle: 1173 Address: DF:A9:FF:F6:B1:1A (OUI DF-A9-FF)
        Count: 1
< ACL Data TX: Handle 1173 flags 0x00 dlen 21             #110 [hci1] 10.340309
      SMP: Pairing Random (0x04) len 16
        Random value: 32527e6e64e79f33b2e374394db8ab2d
> HCI Event: Number of Completed Packets (0x13) plen 5    #111 [hci1] 10.501884
        Num handles: 1
        Handle: 1173 Address: DF:A9:FF:F6:B1:1A (OUI DF-A9-FF)
        Count: 1
        #110: len 21 (1 Kb/s)
        Latency: 161 msec (84-171 msec ~163 msec)
> ACL Data RX: Handle 1173 flags 0x02 dlen 21             #112 [hci1] 10.589702
      SMP: Pairing Confirm (0x03) len 16
        Confim value: 9af26f0a5624b87c2e22ada78a201763
< HCI Command: Host Number of Com.. (0x03|0x0035) plen 5  #113 [hci1] 10.600336
        Num handles: 1
        Handle: 1173 Address: DF:A9:FF:F6:B1:1A (OUI DF-A9-FF)
        Count: 1
< ACL Data TX: Handle 1173 flags 0x00 dlen 21             #114 [hci1] 10.600606
      SMP: Pairing Confirm (0x03) len 16
        Confim value: 09a0b5c5f01151db5de74c7ed79c4306
> HCI Event: Number of Completed Packets (0x13) plen 5    #115 [hci1] 10.764657
        Num handles: 1
        Handle: 1173 Address: DF:A9:FF:F6:B1:1A (OUI DF-A9-FF)
        Count: 1
        #114: len 21 (1 Kb/s)
        Latency: 164 msec (84-171 msec ~163 msec)
> ACL Data RX: Handle 1173 flags 0x02 dlen 21             #116 [hci1] 10.764987
      SMP: Pairing Random (0x04) len 16
        Random value: 6ace8d102c1d8e560000000000000000
< HCI Command: Host Number of Com.. (0x03|0x0035) plen 5  #117 [hci1] 10.780563
        Num handles: 1
        Handle: 1173 Address: DF:A9:FF:F6:B1:1A (OUI DF-A9-FF)
        Count: 1
< ACL Data TX: Handle 1173 flags 0x00 dlen 21             #118 [hci1] 10.780689
      SMP: Pairing Random (0x04) len 16
        Random value: dddbdfe2838e9a8cc6964353c850fef7
> HCI Event: Number of Completed Packets (0x13) plen 5    #119 [hci1] 10.939425
        Num handles: 1
        Handle: 1173 Address: DF:A9:FF:F6:B1:1A (OUI DF-A9-FF)
        Count: 1
        #118: len 21 (1 Kb/s)
        Latency: 158 msec (84-171 msec ~161 msec)
> ACL Data RX: Handle 1173 flags 0x02 dlen 21             #120 [hci1] 11.027257
      SMP: Pairing Confirm (0x03) len 16
        Confim value: ea37dc9c3c333ce34fbf6091b73d675d
< HCI Command: Host Number of Com.. (0x03|0x0035) plen 5  #121 [hci1] 11.039859
        Num handles: 1
        Handle: 1173 Address: DF:A9:FF:F6:B1:1A (OUI DF-A9-FF)
        Count: 1
< ACL Data TX: Handle 1173 flags 0x00 dlen 21             #122 [hci1] 11.039935
      SMP: Pairing Confirm (0x03) len 16
        Confim value: 7cdc1003795ea72f1b39547950c89a79
> HCI Event: Number of Completed Packets (0x13) plen 5    #123 [hci1] 11.202034
        Num handles: 1
        Handle: 1173 Address: DF:A9:FF:F6:B1:1A (OUI DF-A9-FF)
        Count: 1
        #122: len 21 (1 Kb/s)
        Latency: 162 msec (84-171 msec ~161 msec)
> ACL Data RX: Handle 1173 flags 0x02 dlen 21             #124 [hci1] 11.202414
      SMP: Pairing Random (0x04) len 16
        Random value: 2f9077a2a32750880000000000000000
< HCI Command: Host Number of Com.. (0x03|0x0035) plen 5  #125 [hci1] 11.220696
        Num handles: 1
        Handle: 1173 Address: DF:A9:FF:F6:B1:1A (OUI DF-A9-FF)
        Count: 1
< ACL Data TX: Handle 1173 flags 0x00 dlen 21             #126 [hci1] 11.220808
      SMP: Pairing Random (0x04) len 16
        Random value: eb9f1915536596b6fc3db1c86b2b1970
> HCI Event: Number of Completed Packets (0x13) plen 5    #127 [hci1] 11.376805
        Num handles: 1
        Handle: 1173 Address: DF:A9:FF:F6:B1:1A (OUI DF-A9-FF)
        Count: 1
        #126: len 21 (1 Kb/s)
        Latency: 155 msec (84-171 msec ~158 msec)
> ACL Data RX: Handle 1173 flags 0x02 dlen 21             #128 [hci1] 11.464738
      SMP: Pairing Confirm (0x03) len 16
        Confim value: 89dc9c2179e8096c99aabb3cb897a96a
< HCI Command: Host Number of Com.. (0x03|0x0035) plen 5  #129 [hci1] 11.480082
        Num handles: 1
        Handle: 1173 Address: DF:A9:FF:F6:B1:1A (OUI DF-A9-FF)
        Count: 1
< ACL Data TX: Handle 1173 flags 0x00 dlen 21             #130 [hci1] 11.480246
      SMP: Pairing Confirm (0x03) len 16
        Confim value: db3fc21425a50730a6bb6773245979d6
> HCI Event: Number of Completed Packets (0x13) plen 5    #131 [hci1] 11.639702
        Num handles: 1
        Handle: 1173 Address: DF:A9:FF:F6:B1:1A (OUI DF-A9-FF)
        Count: 1
        #130: len 21 (1 Kb/s)
        Latency: 159 msec (84-171 msec ~159 msec)
> ACL Data RX: Handle 1173 flags 0x02 dlen 21             #132 [hci1] 11.639957
      SMP: Pairing Random (0x04) len 16
        Random value: e64b93e39c79c5930000000000000000
< HCI Command: Host Number of Com.. (0x03|0x0035) plen 5  #133 [hci1] 11.660469
        Num handles: 1
        Handle: 1173 Address: DF:A9:FF:F6:B1:1A (OUI DF-A9-FF)
        Count: 1
< ACL Data TX: Handle 1173 flags 0x00 dlen 21             #134 [hci1] 11.660774
      SMP: Pairing Random (0x04) len 16
        Random value: 5c794dc9ad9f2c3f295ebd5ad5e1c3cf
> HCI Event: Number of Completed Packets (0x13) plen 5    #135 [hci1] 11.814273
        Num handles: 1
        Handle: 1173 Address: DF:A9:FF:F6:B1:1A (OUI DF-A9-FF)
        Count: 1
        #134: len 21 (1 Kb/s)
        Latency: 153 msec (84-171 msec ~156 msec)
> ACL Data RX: Handle 1173 flags 0x02 dlen 21             #136 [hci1] 11.902135
      SMP: Pairing Confirm (0x03) len 16
        Confim value: 48d3ea4533c0374fd210e5ac3809de26
< HCI Command: Host Number of Com.. (0x03|0x0035) plen 5  #137 [hci1] 11.919917
        Num handles: 1
        Handle: 1173 Address: DF:A9:FF:F6:B1:1A (OUI DF-A9-FF)
        Count: 1
< ACL Data TX: Handle 1173 flags 0x00 dlen 21             #138 [hci1] 11.920055
      SMP: Pairing Confirm (0x03) len 16
        Confim value: 6c6eede497108125e859d2928e748b6f
> HCI Event: Number of Completed Packets (0x13) plen 5    #139 [hci1] 12.076988
        Num handles: 1
        Handle: 1173 Address: DF:A9:FF:F6:B1:1A (OUI DF-A9-FF)
        Count: 1
        #138: len 21 (1 Kb/s)
        Latency: 156 msec (84-171 msec ~156 msec)
> ACL Data RX: Handle 1173 flags 0x02 dlen 21             #140 [hci1] 12.077366
      SMP: Pairing Random (0x04) len 16
        Random value: 0db609aa82f699550000000000000000
< HCI Command: Host Number of Com.. (0x03|0x0035) plen 5  #141 [hci1] 12.079999
        Num handles: 1
        Handle: 1173 Address: DF:A9:FF:F6:B1:1A (OUI DF-A9-FF)
        Count: 1
< ACL Data TX: Handle 1173 flags 0x00 dlen 21             #142 [hci1] 12.080032
      SMP: Pairing Random (0x04) len 16
        Random value: 5c2fff312cdf99c9491988e877355a9a
> HCI Event: Number of Completed Packets (0x13) plen 5    #143 [hci1] 12.251762
        Num handles: 1
        Handle: 1173 Address: DF:A9:FF:F6:B1:1A (OUI DF-A9-FF)
        Count: 1
        #142: len 21 (0 Kb/s)
        Latency: 171 msec (84-171 msec ~164 msec)
> ACL Data RX: Handle 1173 flags 0x02 dlen 21             #144 [hci1] 12.339690
      SMP: Pairing Confirm (0x03) len 16
        Confim value: 98562d36cf1fa1dfe8600a0ac5a49aa1
< HCI Command: Host Number of Com.. (0x03|0x0035) plen 5  #145 [hci1] 12.359991
        Num handles: 1
        Handle: 1173 Address: DF:A9:FF:F6:B1:1A (OUI DF-A9-FF)
        Count: 1
< ACL Data TX: Handle 1173 flags 0x00 dlen 21             #146 [hci1] 12.360091
      SMP: Pairing Confirm (0x03) len 16
        Confim value: 359c92b93ddc77bcaf5b54cbcc819374
> HCI Event: Number of Completed Packets (0x13) plen 5    #147 [hci1] 12.514571
        Num handles: 1
        Handle: 1173 Address: DF:A9:FF:F6:B1:1A (OUI DF-A9-FF)
        Count: 1
        #146: len 21 (1 Kb/s)
        Latency: 154 msec (84-171 msec ~159 msec)
> ACL Data RX: Handle 1173 flags 0x02 dlen 21             #148 [hci1] 12.514806
      SMP: Pairing Random (0x04) len 16
        Random value: 6f8aab9d5fc632620000000000000000
< HCI Command: Host Number of Com.. (0x03|0x0035) plen 5  #149 [hci1] 12.519843
        Num handles: 1
        Handle: 1173 Address: DF:A9:FF:F6:B1:1A (OUI DF-A9-FF)
        Count: 1
< ACL Data TX: Handle 1173 flags 0x00 dlen 21             #150 [hci1] 12.519937
      SMP: Pairing Random (0x04) len 16
        Random value: c629a3a987d808e808655d558dfc1155
> HCI Event: Number of Completed Packets (0x13) plen 5    #151 [hci1] 12.689260
        Num handles: 1
        Handle: 1173 Address: DF:A9:FF:F6:B1:1A (OUI DF-A9-FF)
        Count: 1
        #150: len 21 (0 Kb/s)
        Latency: 169 msec (84-171 msec ~164 msec)
> ACL Data RX: Handle 1173 flags 0x02 dlen 21             #152 [hci1] 12.777096
      SMP: Pairing Confirm (0x03) len 16
        Confim value: 38b69114aa4e9ab475707c205016ae48
< HCI Command: Host Number of Com.. (0x03|0x0035) plen 5  #153 [hci1] 12.779894
        Num handles: 1
        Handle: 1173 Address: DF:A9:FF:F6:B1:1A (OUI DF-A9-FF)
        Count: 1
< ACL Data TX: Handle 1173 flags 0x00 dlen 21             #154 [hci1] 12.779965
      SMP: Pairing Confirm (0x03) len 16
        Confim value: b294579399b1bd7f8da613158d4bb37a
> HCI Event: Number of Completed Packets (0x13) plen 5    #155 [hci1] 12.952010
        Num handles: 1
        Handle: 1173 Address: DF:A9:FF:F6:B1:1A (OUI DF-A9-FF)
        Count: 1
        #154: len 21 (0 Kb/s)
        Latency: 172 msec (84-172 msec ~168 msec)
> ACL Data RX: Handle 1173 flags 0x02 dlen 21             #156 [hci1] 12.952324
      SMP: Pairing Random (0x04) len 16
        Random value: 788dbba13cad9f050000000000000000
< HCI Command: Host Number of Com.. (0x03|0x0035) plen 5  #157 [hci1] 12.959920
        Num handles: 1
        Handle: 1173 Address: DF:A9:FF:F6:B1:1A (OUI DF-A9-FF)
        Count: 1
< ACL Data TX: Handle 1173 flags 0x00 dlen 21             #158 [hci1] 12.959952
      SMP: Pairing Random (0x04) len 16
        Random value: 92f20f6ad8f13724432c7fd6001c45ff
> HCI Event: Number of Completed Packets (0x13) plen 5    #159 [hci1] 13.126839
        Num handles: 1
        Handle: 1173 Address: DF:A9:FF:F6:B1:1A (OUI DF-A9-FF)
        Count: 1
        #158: len 21 (1 Kb/s)
        Latency: 166 msec (84-172 msec ~167 msec)
> ACL Data RX: Handle 1173 flags 0x02 dlen 21             #160 [hci1] 13.214660
      SMP: Pairing Confirm (0x03) len 16
        Confim value: 6089fc9ee4c470130fe3d13cae24f85c
< HCI Command: Host Number of Com.. (0x03|0x0035) plen 5  #161 [hci1] 13.220224
        Num handles: 1
        Handle: 1173 Address: DF:A9:FF:F6:B1:1A (OUI DF-A9-FF)
        Count: 1
< ACL Data TX: Handle 1173 flags 0x00 dlen 21             #162 [hci1] 13.220349
      SMP: Pairing Confirm (0x03) len 16
        Confim value: 296021472b9dac4ff8f1e0d4e3f5b3c2
> HCI Event: Number of Completed Packets (0x13) plen 5    #163 [hci1] 13.389431
        Num handles: 1
        Handle: 1173 Address: DF:A9:FF:F6:B1:1A (OUI DF-A9-FF)
        Count: 1
        #162: len 21 (0 Kb/s)
        Latency: 169 msec (84-172 msec ~168 msec)
> ACL Data RX: Handle 1173 flags 0x02 dlen 21             #164 [hci1] 13.389757
      SMP: Pairing Random (0x04) len 16
        Random value: 609d26d95b937c830000000000000000
< HCI Command: Host Number of Com.. (0x03|0x0035) plen 5  #165 [hci1] 13.400085
        Num handles: 1
        Handle: 1173 Address: DF:A9:FF:F6:B1:1A (OUI DF-A9-FF)
        Count: 1
< ACL Data TX: Handle 1173 flags 0x00 dlen 21             #166 [hci1] 13.400131
      SMP: Pairing Random (0x04) len 16
        Random value: 23ac32ebbb5e14c8a6b9622f296d277f
> HCI Event: Number of Completed Packets (0x13) plen 5    #167 [hci1] 13.564257
        Num handles: 1
        Handle: 1173 Address: DF:A9:FF:F6:B1:1A (OUI DF-A9-FF)
        Count: 1
        #166: len 21 (1 Kb/s)
        Latency: 164 msec (84-172 msec ~166 msec)
> ACL Data RX: Handle 1173 flags 0x02 dlen 21             #168 [hci1] 13.652080
      SMP: Pairing Confirm (0x03) len 16
        Confim value: af31cad7fda0e330b31d4e68d5f2a107
< HCI Command: Host Number of Com.. (0x03|0x0035) plen 5  #169 [hci1] 13.660811
        Num handles: 1
        Handle: 1173 Address: DF:A9:FF:F6:B1:1A (OUI DF-A9-FF)
        Count: 1
< ACL Data TX: Handle 1173 flags 0x00 dlen 21             #170 [hci1] 13.661071
      SMP: Pairing Confirm (0x03) len 16
        Confim value: 74a6adedfa678e17689efd7e42aaddb8
> HCI Event: Number of Completed Packets (0x13) plen 5    #171 [hci1] 13.826939
        Num handles: 1
        Handle: 1173 Address: DF:A9:FF:F6:B1:1A (OUI DF-A9-FF)
        Count: 1
        #170: len 21 (1 Kb/s)
        Latency: 165 msec (84-172 msec ~166 msec)
> ACL Data RX: Handle 1173 flags 0x02 dlen 21             #172 [hci1] 13.827375
      SMP: Pairing Random (0x04) len 16
        Random value: 9c11281242d12eb50000000000000000
< HCI Command: Host Number of Com.. (0x03|0x0035) plen 5  #173 [hci1] 13.840721
        Num handles: 1
        Handle: 1173 Address: DF:A9:FF:F6:B1:1A (OUI DF-A9-FF)
        Count: 1
< ACL Data TX: Handle 1173 flags 0x00 dlen 21             #174 [hci1] 13.840860
      SMP: Pairing Random (0x04) len 16
        Random value: 297efe85e67448a15f56bd27e3a3cf1d
> HCI Event: Number of Completed Packets (0x13) plen 5    #175 [hci1] 14.001788
        Num handles: 1
        Handle: 1173 Address: DF:A9:FF:F6:B1:1A (OUI DF-A9-FF)
        Count: 1
        #174: len 21 (1 Kb/s)
        Latency: 160 msec (84-172 msec ~163 msec)
> ACL Data RX: Handle 1173 flags 0x02 dlen 21             #176 [hci1] 14.089566
      SMP: Pairing Confirm (0x03) len 16
        Confim value: cb089cc11a446a771c9884b22df23cbe
< HCI Command: Host Number of Com.. (0x03|0x0035) plen 5  #177 [hci1] 14.099910
        Num handles: 1
        Handle: 1173 Address: DF:A9:FF:F6:B1:1A (OUI DF-A9-FF)
        Count: 1
< ACL Data TX: Handle 1173 flags 0x00 dlen 21             #178 [hci1] 14.100011
      SMP: Pairing Confirm (0x03) len 16
        Confim value: 7954e4d51960a00905b77f78bc2626df
> HCI Event: Number of Completed Packets (0x13) plen 5    #179 [hci1] 14.264529
        Num handles: 1
        Handle: 1173 Address: DF:A9:FF:F6:B1:1A (OUI DF-A9-FF)
        Count: 1
        #178: len 21 (1 Kb/s)
        Latency: 164 msec (84-172 msec ~164 msec)
> ACL Data RX: Handle 1173 flags 0x02 dlen 21             #180 [hci1] 14.264859
      SMP: Pairing Random (0x04) len 16
        Random value: 046639fc7435d9e60000000000000000
< HCI Command: Host Number of Com.. (0x03|0x0035) plen 5  #181 [hci1] 14.280701
        Num handles: 1
        Handle: 1173 Address: DF:A9:FF:F6:B1:1A (OUI DF-A9-FF)
        Count: 1
< ACL Data TX: Handle 1173 flags 0x00 dlen 21             #182 [hci1] 14.280884
      SMP: Pairing Random (0x04) len 16
        Random value: 25a9493fd3ce4faf02be7293595bb7c6
> HCI Event: Number of Completed Packets (0x13) plen 5    #183 [hci1] 14.439249
        Num handles: 1
        Handle: 1173 Address: DF:A9:FF:F6:B1:1A (OUI DF-A9-FF)
        Count: 1
        #182: len 21 (1 Kb/s)
        Latency: 158 msec (84-172 msec ~161 msec)
> ACL Data RX: Handle 1173 flags 0x02 dlen 21             #184 [hci1] 14.527096
      SMP: Pairing Confirm (0x03) len 16
        Confim value: 0600286b9c4af24efa949a86690d1cda
< HCI Command: Host Number of Com.. (0x03|0x0035) plen 5  #185 [hci1] 14.540352
        Num handles: 1
        Handle: 1173 Address: DF:A9:FF:F6:B1:1A (OUI DF-A9-FF)
        Count: 1
< ACL Data TX: Handle 1173 flags 0x00 dlen 21             #186 [hci1] 14.540550
      SMP: Pairing Confirm (0x03) len 16
        Confim value: 8220dc93dab3127a0b3adddaa7bf6966
> HCI Event: Number of Completed Packets (0x13) plen 5    #187 [hci1] 14.701912
        Num handles: 1
        Handle: 1173 Address: DF:A9:FF:F6:B1:1A (OUI DF-A9-FF)
        Count: 1
        #186: len 21 (1 Kb/s)
        Latency: 161 msec (84-172 msec ~161 msec)
> ACL Data RX: Handle 1173 flags 0x02 dlen 21             #188 [hci1] 14.702301
      SMP: Pairing Random (0x04) len 16
        Random value: 11bb844cc79ab9a20000000000000000
< HCI Command: Host Number of Com.. (0x03|0x0035) plen 5  #189 [hci1] 14.720716
        Num handles: 1
        Handle: 1173 Address: DF:A9:FF:F6:B1:1A (OUI DF-A9-FF)
        Count: 1
< ACL Data TX: Handle 1173 flags 0x00 dlen 21             #190 [hci1] 14.720850
      SMP: Pairing Random (0x04) len 16
        Random value: 58f6b41f855a6f6c3560debd84e2affc
> HCI Event: Number of Completed Packets (0x13) plen 5    #191 [hci1] 14.876754
        Num handles: 1
        Handle: 1173 Address: DF:A9:FF:F6:B1:1A (OUI DF-A9-FF)
        Count: 1
        #190: len 21 (1 Kb/s)
        Latency: 155 msec (84-172 msec ~158 msec)
> ACL Data RX: Handle 1173 flags 0x02 dlen 21             #192 [hci1] 14.964601
      SMP: Pairing Confirm (0x03) len 16
        Confim value: eeed774a416cadcbac97ecfec126bbca
< HCI Command: Host Number of Com.. (0x03|0x0035) plen 5  #193 [hci1] 14.980155
        Num handles: 1
        Handle: 1173 Address: DF:A9:FF:F6:B1:1A (OUI DF-A9-FF)
        Count: 1
< ACL Data TX: Handle 1173 flags 0x00 dlen 21             #194 [hci1] 14.980354
      SMP: Pairing Confirm (0x03) len 16
        Confim value: f039389c28b6a465b5f1ab6ec44b2856
> HCI Event: Number of Completed Packets (0x13) plen 5    #195 [hci1] 15.139439
        Num handles: 1
        Handle: 1173 Address: DF:A9:FF:F6:B1:1A (OUI DF-A9-FF)
        Count: 1
        #194: len 21 (1 Kb/s)
        Latency: 159 msec (84-172 msec ~158 msec)
> ACL Data RX: Handle 1173 flags 0x02 dlen 21             #196 [hci1] 15.139764
      SMP: Pairing Random (0x04) len 16
        Random value: 68df313266f321f20000000000000000
< HCI Command: Host Number of Com.. (0x03|0x0035) plen 5  #197 [hci1] 15.159999
        Num handles: 1
        Handle: 1173 Address: DF:A9:FF:F6:B1:1A (OUI DF-A9-FF)
        Count: 1
< ACL Data TX: Handle 1173 flags 0x00 dlen 21             #198 [hci1] 15.160091
      SMP: Pairing Random (0x04) len 16
        Random value: b67e7216d5bf664139eda2b542549666
> HCI Event: Number of Completed Packets (0x13) plen 5    #199 [hci1] 15.314179
        Num handles: 1
        Handle: 1173 Address: DF:A9:FF:F6:B1:1A (OUI DF-A9-FF)
        Count: 1
        #198: len 21 (1 Kb/s)
        Latency: 154 msec (84-172 msec ~156 msec)
> ACL Data RX: Handle 1173 flags 0x02 dlen 21             #200 [hci1] 15.402055
      SMP: Pairing Confirm (0x03) len 16
        Confim value: c5a2db0f031404b8837fb65c5b0e9220
< HCI Command: Host Number of Com.. (0x03|0x0035) plen 5  #201 [hci1] 15.420467
        Num handles: 1
        Handle: 1173 Address: DF:A9:FF:F6:B1:1A (OUI DF-A9-FF)
        Count: 1
< ACL Data TX: Handle 1173 flags 0x00 dlen 21             #202 [hci1] 15.420700
      SMP: Pairing Confirm (0x03) len 16
        Confim value: 3a2adf734ab6a79c745a981105cdae37
> HCI Event: Number of Completed Packets (0x13) plen 5    #203 [hci1] 15.576871
        Num handles: 1
        Handle: 1173 Address: DF:A9:FF:F6:B1:1A (OUI DF-A9-FF)
        Count: 1
        #202: len 21 (1 Kb/s)
        Latency: 156 msec (84-172 msec ~156 msec)
> ACL Data RX: Handle 1173 flags 0x02 dlen 21             #204 [hci1] 15.577226
      SMP: Pairing Random (0x04) len 16
        Random value: fd78aea569362c4a0000000000000000
< HCI Command: Host Number of Com.. (0x03|0x0035) plen 5  #205 [hci1] 15.580353
        Num handles: 1
        Handle: 1173 Address: DF:A9:FF:F6:B1:1A (OUI DF-A9-FF)
        Count: 1
< ACL Data TX: Handle 1173 flags 0x00 dlen 21             #206 [hci1] 15.580489
      SMP: Pairing Random (0x04) len 16
        Random value: ed17f76500c95219dd01e09d1e63f87b
> HCI Event: Number of Completed Packets (0x13) plen 5    #207 [hci1] 15.751736
        Num handles: 1
        Handle: 1173 Address: DF:A9:FF:F6:B1:1A (OUI DF-A9-FF)
        Count: 1
        #206: len 21 (0 Kb/s)
        Latency: 171 msec (84-172 msec ~163 msec)
> ACL Data RX: Handle 1173 flags 0x02 dlen 21             #208 [hci1] 15.839502
      SMP: Pairing Confirm (0x03) len 16
        Confim value: 528d185dbc8db08a767f3f3b2ca90cf0
< HCI Command: Host Number of Com.. (0x03|0x0035) plen 5  #209 [hci1] 15.840093
        Num handles: 1
        Handle: 1173 Address: DF:A9:FF:F6:B1:1A (OUI DF-A9-FF)
        Count: 1
< ACL Data TX: Handle 1173 flags 0x00 dlen 21             #210 [hci1] 15.840371
      SMP: Pairing Confirm (0x03) len 16
        Confim value: b43703e290d4beab9ba25ce0d0f69b2a
> HCI Event: Number of Completed Packets (0x13) plen 5    #211 [hci1] 16.014351
        Num handles: 1
        Handle: 1173 Address: DF:A9:FF:F6:B1:1A (OUI DF-A9-FF)
        Count: 1
        #210: len 21 (0 Kb/s)
        Latency: 173 msec (84-173 msec ~168 msec)
> ACL Data RX: Handle 1173 flags 0x02 dlen 21             #212 [hci1] 16.014753
      SMP: Pairing Random (0x04) len 16
        Random value: 33ff6df3d1a63f410000000000000000
< HCI Command: Host Number of Com.. (0x03|0x0035) plen 5  #213 [hci1] 16.020080
        Num handles: 1
        Handle: 1173 Address: DF:A9:FF:F6:B1:1A (OUI DF-A9-FF)
        Count: 1
< ACL Data TX: Handle 1173 flags 0x00 dlen 21             #214 [hci1] 16.020121
      SMP: Pairing Random (0x04) len 16
        Random value: 81d35d47e1f6006d79c974bd9d9e1ee3
> HCI Event: Number of Completed Packets (0x13) plen 5    #215 [hci1] 16.189235
        Num handles: 1
        Handle: 1173 Address: DF:A9:FF:F6:B1:1A (OUI DF-A9-FF)
        Count: 1
        #214: len 21 (0 Kb/s)
        Latency: 169 msec (84-173 msec ~168 msec)
> ACL Data RX: Handle 1173 flags 0x02 dlen 21             #216 [hci1] 16.277064
      SMP: Pairing Confirm (0x03) len 16
        Confim value: 2b56444386ff31fc3ac0758a19ddb962
< HCI Command: Host Number of Com.. (0x03|0x0035) plen 5  #217 [hci1] 16.280461
        Num handles: 1
        Handle: 1173 Address: DF:A9:FF:F6:B1:1A (OUI DF-A9-FF)
        Count: 1
< ACL Data TX: Handle 1173 flags 0x00 dlen 21             #218 [hci1] 16.280693
      SMP: Pairing Confirm (0x03) len 16
        Confim value: 68d2222dd78688b4e6f865c0599a81b6
> HCI Event: Number of Completed Packets (0x13) plen 5    #219 [hci1] 16.451836
        Num handles: 1
        Handle: 1173 Address: DF:A9:FF:F6:B1:1A (OUI DF-A9-FF)
        Count: 1
        #218: len 21 (0 Kb/s)
        Latency: 171 msec (84-173 msec ~170 msec)
> ACL Data RX: Handle 1173 flags 0x02 dlen 21             #220 [hci1] 16.452215
      SMP: Pairing Random (0x04) len 16
        Random value: 1d8b1e8d674f7e050000000000000000
< HCI Command: Host Number of Com.. (0x03|0x0035) plen 5  #221 [hci1] 16.460548
        Num handles: 1
        Handle: 1173 Address: DF:A9:FF:F6:B1:1A (OUI DF-A9-FF)
        Count: 1
< ACL Data TX: Handle 1173 flags 0x00 dlen 21             #222 [hci1] 16.460705
      SMP: Pairing Random (0x04) len 16
        Random value: e7f7e0c2476823e41736a7e381bafb7c
> HCI Event: Number of Completed Packets (0x13) plen 5    #223 [hci1] 16.626644
        Num handles: 1
        Handle: 1173 Address: DF:A9:FF:F6:B1:1A (OUI DF-A9-FF)
        Count: 1
        #222: len 21 (1 Kb/s)
        Latency: 165 msec (84-173 msec ~168 msec)
> ACL Data RX: Handle 1173 flags 0x02 dlen 21             #224 [hci1] 16.714515
      SMP: Pairing Confirm (0x03) len 16
        Confim value: d7aca41f782a9c66b69938e8b05e40f8
< HCI Command: Host Number of Com.. (0x03|0x0035) plen 5  #225 [hci1] 16.720533
        Num handles: 1
        Handle: 1173 Address: DF:A9:FF:F6:B1:1A (OUI DF-A9-FF)
        Count: 1
< ACL Data TX: Handle 1173 flags 0x00 dlen 21             #226 [hci1] 16.720720
      SMP: Pairing Confirm (0x03) len 16
        Confim value: cf42f550f06096fed80e9c0458c9e5a7
> HCI Event: Number of Completed Packets (0x13) plen 5    #227 [hci1] 16.889342
        Num handles: 1
        Handle: 1173 Address: DF:A9:FF:F6:B1:1A (OUI DF-A9-FF)
        Count: 1
        #226: len 21 (1 Kb/s)
        Latency: 168 msec (84-173 msec ~168 msec)
> ACL Data RX: Handle 1173 flags 0x02 dlen 21             #228 [hci1] 16.889845
      SMP: Pairing Random (0x04) len 16
        Random value: dcfa7b64b21793610000000000000000
