Bluetooth monitor ver 5.72
= Note: Linux version 6.14.0-36-generic (x86_64)                       0.915510
= Note: Bluetooth subsystem version 2.22                               0.915512
= New Index: 00:00:00:00:00:00 (Primary,UART,hci1)              [hci1] 0.915513
= New Index: 48:5F:99:8E:E0:64 (Primary,USB,hci0)               [hci0] 0.915513
= Open Index: 00:00:00:00:00:00                                 [hci1] 1.029231
= Index Info: 00:00:00:00:00:00 (Nordic Semiconductor ASA)      [hci1] 1.029248
@ USER Open: main (privileged) version 2.22            {0x0001} [hci1] 1.029259
< HCI Command: Reset (0x03|0x0003) plen 0                    #1 [hci1] 1.030656
> HCI Event: Command Complete (0x0e) plen 4                  #2 [hci1] 1.031156
      Reset (0x03|0x0003) ncmd 1
        Status: Success (0x00)
< HCI Command: Read Local Supported... (0x04|0x0003) plen 0  #3 [hci1] 1.049116
> HCI Event: Command Complete (0x0e) plen 12                 #4 [hci1] 1.049693
      Read Local Supported Features (0x04|0x0003) ncmd 1
        Status: Success (0x00)
        Features: 0x00 0x00 0x00 0x00 0x60 0x00 0x00 0x00
          BR/EDR Not Supported
          LE Supported (Controller)
< HCI Command: Read Local Version In.. (0x04|0x0001) plen 0  #5 [hci1] 1.068766
> HCI Event: Command Complete (0x0e) plen 12                 #6 [hci1] 1.069238
      Read Local Version Information (0x04|0x0001) ncmd 1
        Status: Success (0x00)
        HCI version: Reserved (0x0f) - Revision 12393 (0x3069)
        LMP version: Reserved (0x0f) - Subversion 12393 (0x3069)
        Manufacturer: Nordic Semiconductor ASA (89)
< HCI Command: Read Local Supported... (0x04|0x0002) plen 0  #7 [hci1] 1.088646
> HCI Event: Command Complete (0x0e) plen 68                 #8 [hci1] 1.089735
      Read Local Supported Commands (0x04|0x0002) ncmd 1
        Status: Success (0x00)
        Commands: 119 entries
          Disconnect (Octet 0 - Bit 5)
          Read Remote Version Information (Octet 2 - Bit 7)
          Set Event Mask (Octet 5 - Bit 6)
          Reset (Octet 5 - Bit 7)
          Read Connection Accept Timeout (Octet 7 - Bit 2)
          Write Connection Accept Timeout (Octet 7 - Bit 3)
          Read Transmit Power Level (Octet 10 - Bit 2)
          Set Controller To Host Flow Control (Octet 10 - Bit 5)
          Host Buffer Size (Octet 10 - Bit 6)
          Host Number of Completed Packets (Octet 10 - Bit 7)
          Read Local Version Information (Octet 14 - Bit 3)
          Read Local Supported Features (Octet 14 - Bit 5)
          Read BD ADDR (Octet 15 - Bit 1)
          Read RSSI (Octet 15 - Bit 5)
          Set Event Mask Page 2 (Octet 22 - Bit 2)
          LE Set Event Mask (Octet 25 - Bit 0)
          LE Read Buffer Size (Octet 25 - Bit 1)
          LE Read Local Supported Features (Octet 25 - Bit 2)
          LE Set Random Address (Octet 25 - Bit 4)
          LE Set Advertising Parameters (Octet 25 - Bit 5)
          LE Read Advertising Channel TX Power (Octet 25 - Bit 6)
          LE Set Advertising Data (Octet 25 - Bit 7)
          LE Set Scan Response Data (Octet 26 - Bit 0)
          LE Set Advertise Enable (Octet 26 - Bit 1)
          LE Set Scan Parameters (Octet 26 - Bit 2)
          LE Set Scan Enable (Octet 26 - Bit 3)
          LE Create Connection (Octet 26 - Bit 4)
          LE Create Connection Cancel (Octet 26 - Bit 5)
          LE Read Accept List Size (Octet 26 - Bit 6)
          LE Clear Accept List (Octet 26 - Bit 7)
          LE Add Device To Accept List (Octet 27 - Bit 0)
          LE Remove Device From Accept List (Octet 27 - Bit 1)
          LE Connection Update (Octet 27 - Bit 2)
          LE Set Host Channel Classification (Octet 27 - Bit 3)
          LE Read Channel Map (Octet 27 - Bit 4)
          LE Read Remote Used Features (Octet 27 - Bit 5)
          LE Encrypt (Octet 27 - Bit 6)
          LE Rand (Octet 27 - Bit 7)
          LE Start Encryption (Octet 28 - Bit 0)
          LE Long Term Key Request Reply (Octet 28 - Bit 1)
          LE Long Term Key Request Neg Reply (Octet 28 - Bit 2)
          LE Read Supported States (Octet 28 - Bit 3)
          LE Receiver Test (Octet 28 - Bit 4)
          LE Transmitter Test (Octet 28 - Bit 5)
          LE Test End (Octet 28 - Bit 6)
          Read Authenticated Payload Timeout (Octet 32 - Bit 4)
          Write Authenticated Payload Timeout (Octet 32 - Bit 5)
          LE Set Data Length (Octet 33 - Bit 6)
          LE Read Suggested Default Data Length (Octet 33 - Bit 7)
          LE Write Suggested Default Data Length (Octet 34 - Bit 0)
          LE Add Device To Resolving List (Octet 34 - Bit 3)
          LE Remove Device From Resolving List (Octet 34 - Bit 4)
          LE Clear Resolving List (Octet 34 - Bit 5)
          LE Read Resolving List Size (Octet 34 - Bit 6)
          LE Set Address Resolution Enable (Octet 35 - Bit 1)
          LE Set Resolvable Private Address Timeout (Octet 35 - Bit 2)
          LE Read Maximum Data Length (Octet 35 - Bit 3)
          LE Read PHY (Octet 35 - Bit 4)
          LE Set Default PHY (Octet 35 - Bit 5)
          LE Set PHY (Octet 35 - Bit 6)
          LE Enhanced Receiver Test (Octet 35 - Bit 7)
          LE Enhanced Transmitter Test (Octet 36 - Bit 0)
          LE Set Advertising Set Random Address (Octet 36 - Bit 1)
          LE Set Extended Advertising Parameters (Octet 36 - Bit 2)
          LE Set Extended Advertising Data (Octet 36 - Bit 3)
          LE Set Extended Scan Response Data (Octet 36 - Bit 4)
          LE Set Extended Advertising Enable (Octet 36 - Bit 5)
          LE Read Maximum Advertising Data Length (Octet 36 - Bit 6)
          LE Read Number of Supported Advertising Sets (Octet 36 - Bit 7)
          LE Remove Advertising Set (Octet 37 - Bit 0)
          LE Clear Advertising Sets (Octet 37 - Bit 1)
          LE Set Periodic Advertising Parameters (Octet 37 - Bit 2)
          LE Set Periodic Advertising Data (Octet 37 - Bit 3)
          LE Set Periodic Advertising Enable (Octet 37 - Bit 4)
          LE Set Extended Scan Parameters (Octet 37 - Bit 5)
          LE Set Extended Scan Enable (Octet 37 - Bit 6)
          LE Extended Create Connection (Octet 37 - Bit 7)
          LE Periodic Advertising Create Sync (Octet 38 - Bit 0)
          LE Periodic Advertising Create Sync Cancel (Octet 38 - Bit 1)
          LE Periodic Advertising Terminate Sync (Octet 38 - Bit 2)
          LE Add Device To Periodic Advertiser List (Octet 38 - Bit 3)
          LE Remove Device From Periodic Advertiser List (Octet 38 - Bit 4)
          LE Clear Periodic Advertiser List (Octet 38 - Bit 5)
          LE Read Periodic Advertiser List Size (Octet 38 - Bit 6)
          LE Read Transmit Power (Octet 38 - Bit 7)
          LE Read RF Path Compensation (Octet 39 - Bit 0)
          LE Write RF Path Compensation (Octet 39 - Bit 1)
          LE Set Privacy Mode (Octet 39 - Bit 2)
          LE Periodic Advertising Receive Enable (Octet 40 - Bit 5)
          LE Periodic Advertising Sync Transfer (Octet 40 - Bit 6)
          LE Periodic Advertising Set Info Transfer (Octet 40 - Bit 7)
          LE Periodic Advertising Sync Transfer Parameters (Octet 41 - Bit 0)
          LE Set Default Periodic Advertisng Sync Transfer Parameters (Octet 41 - Bit 1)
          LE Read Buffer v2 (Octet 41 - Bit 5)
          LE Read ISO TX Sync (Octet 41 - Bit 6)
          LE Set Connected Isochronous Group Parameters (Octet 41 - Bit 7)
          LE Set Connected Isochronous Group Parameters Test (Octet 42 - Bit 0)
          LE Create Connected Isochronous Stream (Octet 42 - Bit 1)
          LE Remove Connected Isochronous Group (Octet 42 - Bit 2)
          LE Accept Connected Isochronous Stream Request (Octet 42 - Bit 3)
          LE Reject Connected Isochronous Stream Request (Octet 42 - Bit 4)
          LE Create Broadcast Isochronous Group (Octet 42 - Bit 5)
          LE Create Broadcast Isochronous Group Test (Octet 42 - Bit 6)
          LE Terminate Broadcast Isochronous Group (Octet 42 - Bit 7)
          LE Broadcast Isochronous Group Create Sync (Octet 43 - Bit 0)
          LE Broadcast Isochronous Group Terminate Sync (Octet 43 - Bit 1)
          LE Request Peer SCA (Octet 43 - Bit 2)
          LE Setup Isochronous Data Path (Octet 43 - Bit 3)
          LE Remove Isochronous Data Path (Octet 43 - Bit 4)
          LE Isochronous Transmit Test (Octet 43 - Bit 5)
          LE Isochronous Receive Test (Octet 43 - Bit 6)
          LE Isochronous Read Test Counters (Octet 43 - Bit 7)
          LE Isochronous Read Test Counters (Octet 44 - Bit 0)
          LE Set Host Feature (Octet 44 - Bit 1)
          Octet 44 - Bit 2 
          Octet 45 - Bit 6 
          Octet 46 - Bit 0 
          Octet 46 - Bit 1 
          Octet 46 - Bit 2 
< HCI Command: Host Buffer Size (0x03|0x0033) plen 7         #9 [hci1] 1.108638
        ACL MTU: 255  ACL max packet: 16
        SCO MTU: 0    SCO max packet: 0
> HCI Event: Command Complete (0x0e) plen 4                 #10 [hci1] 1.109123
      Host Buffer Size (0x03|0x0033) ncmd 1
        Status: Success (0x00)
< HCI Command: Set Controller To Ho.. (0x03|0x0031) plen 1  #11 [hci1] 1.128638
        Flow control: ACL Data Packets (0x01)
> HCI Event: Command Complete (0x0e) plen 4                 #12 [hci1] 1.129075
      Set Controller To Host Flow Control (0x03|0x0031) ncmd 1
        Status: Success (0x00)
< HCI Command: LE Read Local Suppor.. (0x08|0x0003) plen 0  #13 [hci1] 1.148662
> HCI Event: Command Complete (0x0e) plen 12                #14 [hci1] 1.149121
      LE Read Local Supported Features (0x08|0x0003) ncmd 1
        Status: Success (0x00)
        Features: 0xfd 0x79 0x00 0xf7 0x30 0x01 0x00 0x00
          LE Encryption
          Extended Reject Indication
          Peripheral-initiated Features Exchange
          LE Ping
          LE Data Packet Length Extension
          LL Privacy
          Extended Scanner Filter Policies
          LE 2M PHY
          LE Coded PHY
          LE Extended Advertising
          LE Periodic Advertising
          Channel Selection Algorithm #2
          Periodic Advertising Sync Transfer - Sender
          Periodic Advertising Sync Transfer - Recipient
          Sleep Clock Accuracy Updates
          Connected Isochronous Stream - Central
          Connected Isochronous Stream - Peripheral
          Isochronous Broadcaster
          Synchronized Receiver
          Periodic Advertising ADI support
          Connection Subrating
          Unknown features (0x0000010000000000)
< HCI Command: LE Set Host Feature (0x08|0x0074) plen 2     #15 [hci1] 1.168652
        Bit Number: 32
          Connected Isochronous Stream (Host Support)
        Bit Value: 1
> HCI Event: Command Complete (0x0e) plen 4                 #16 [hci1] 1.169143
      LE Set Host Feature (0x08|0x0074) ncmd 1
        Status: Success (0x00)
< HCI Command: LE Read Buffer v2 (0x08|0x0060) plen 0       #17 [hci1] 1.188681
> HCI Event: Command Complete (0x0e) plen 10                #18 [hci1] 1.189216
      LE Read Buffer v2 (0x08|0x0060) ncmd 1
        Status: Success (0x00)
        ACL MTU: 27
        ACL max packet: 3
        ISO MTU: 318
        ISO max packet: 3
< HCI Command: LE Read Maximum Adve.. (0x08|0x003a) plen 0  #19 [hci1] 1.208698
> HCI Event: Command Complete (0x0e) plen 6                 #20 [hci1] 1.209163
      LE Read Maximum Advertising Data Length (0x08|0x003a) ncmd 1
        Status: Success (0x00)
        Max length: 1650
< HCI Command: LE Read Supported St.. (0x08|0x001c) plen 0  #21 [hci1] 1.228650
> HCI Event: Command Complete (0x0e) plen 12                #22 [hci1] 1.229179
      LE Read Supported States (0x08|0x001c) ncmd 1
        Status: Success (0x00)
        States: 0x000003ff3e0306ff
          Non-connectable Advertising State
          Scannable Advertising State
          Connectable Advertising State
          High Duty Cycle Directed Advertising State
          Passive Scanning State
          Active Scanning State
          Initiating State
            and Connection State (Central Role)
          Connection State (Peripheral Role)
          Scannable Advertising State
            and Passive Scanning State
          Connectable Advertising State
            and Passive Scanning State
          Non-connectable Advertising State
            and Initiating State
          Scannable Advertising State
            and Initiating State
          Active Scanning State
            and Connection State (Central Role)
          Passive Scanning State
            and Connection State (Peripheral Role)
          Active Scanning State
            and Connection State (Peripheral Role)
          Initiating State
            and Connection State (Central Role)
            and Central Role & Central Role
          Low Duty Cycle Directed Advertising State
          Connectable Advertising State
            and Initiating State
            and Central Role & Peripheral Role
          High Duty Cycle Directed Advertising State
            and Initiating State
            and Central Role & Peripheral Role
          Low Duty Cycle Directed Advertising State
            and Initiating State
            and Central Role & Peripheral Role
          Connectable Advertising State
            and Connection State (Central Role)
            and Central Role & Peripheral Role
          High Duty Cycle Directed Advertising State
            and Connection State (Central Role)
            and Central Role & Peripheral Role
          Low Duty Cycle Directed Advertising State
            and Connection State (Central Role)
            and Central Role & Peripheral Role
          Connectable Advertising State
            and Connection State (Peripheral Role)
            and Central Role & Peripheral Role
          High Duty Cycle Directed Advertising State
            and Connection State (Peripheral Role)
            and Peripheral Role & Peripheral Role
          Low Duty Cycle Directed Advertising State
            and Connection State (Peripheral Role)
            and Peripheral Role & Peripheral Role
          Initiating State
            and Connection State (Peripheral Role)
            and Central Role & Peripheral Role
< HCI Command: LE Read Maximum Data.. (0x08|0x002f) plen 0  #23 [hci1] 1.248596
> HCI Event: Command Complete (0x0e) plen 12                #24 [hci1] 1.249151
      LE Read Maximum Data Length (0x08|0x002f) ncmd 1
        Status: Success (0x00)
        Max TX octets: 251
        Max TX time: 2704
        Max RX octets: 251
        Max RX time: 2704
< HCI Command: LE Write Suggested D.. (0x08|0x0024) plen 4  #25 [hci1] 1.268640
        TX octets: 251
        TX time: 2704
> HCI Event: Command Complete (0x0e) plen 4                 #26 [hci1] 1.269093
      LE Write Suggested Default Data Length (0x08|0x0024) ncmd 1
        Status: Success (0x00)
< HCI Command: LE Read Resolving Li.. (0x08|0x002a) plen 0  #27 [hci1] 1.288610
> HCI Event: Command Complete (0x0e) plen 5                 #28 [hci1] 1.289012
      LE Read Resolving List Size (0x08|0x002a) ncmd 1
        Status: Success (0x00)
        Size: 8
< HCI Command: LE Set Event Mask (0x08|0x0001) plen 8       #29 [hci1] 1.308653
        Mask: 0x000002023f87fa5e
          LE Advertising Report
          LE Connection Update Complete
          LE Read Remote Used Features Complete
          LE Long Term Key Request
          LE Data Length Change
          LE Enhanced Connection Complete
          LE PHY Update Complete
          LE Extended Advertising Report
          LE Periodic Advertising Sync Established
          LE Periodic Advertising Report
          LE Periodic Advertising Sync Lost
          LE Extended Scan Timeout
          LE Extended Advertising Set Terminated
          LE Scan Request Received
          LE Periodic Advertising Sync Transfer Rvc
          LE CIS Established
          LE CIS Request
          LE Create BIG Complete
          LE Terminate BIG Complete
          LE BIG Sync Estabilished Complete
          LE BIG Sync Lost
          LE BIG Info Advertising Report
          Unknown mask (0x0000020000000000)
> HCI Event: Command Complete (0x0e) plen 4                 #30 [hci1] 1.309170
      LE Set Event Mask (0x08|0x0001) ncmd 1
        Status: Success (0x00)
< HCI Command: Set Event Mask (0x03|0x0001) plen 8          #31 [hci1] 1.328661
        Mask: 0x2000800002008890
          Disconnection Complete
          Encryption Change
          Read Remote Version Information Complete
          Hardware Error
          Data Buffer Overflow
          Encryption Key Refresh Complete
          LE Meta
> HCI Event: Command Complete (0x0e) plen 4                 #32 [hci1] 1.329129
      Set Event Mask (0x03|0x0001) ncmd 1
        Status: Success (0x00)
< HCI Command: Read BD ADDR (0x04|0x0009) plen 0            #33 [hci1] 1.348658
> HCI Event: Command Complete (0x0e) plen 10                #34 [hci1] 1.349131
      Read BD ADDR (0x04|0x0009) ncmd 1
        Status: Success (0x00)
        Address: 00:00:00:00:00:00 (OUI 00-00-00)
< HCI Command: LE Set Random Address (0x08|0x0005) plen 6   #35 [hci1] 1.368664
        Address: D5:B6:CC:31:DB:3B (Static)
> HCI Event: Command Complete (0x0e) plen 4                 #36 [hci1] 1.369131
      LE Set Random Address (0x08|0x0005) ncmd 1
        Status: Success (0x00)
< HCI Command: LE Set Extended Adv.. (0x08|0x0036) plen 25  #37 [hci1] 3.928724
        Handle: 0x00
        Properties: 0x0013
          Connectable
          Scannable
          Use legacy advertising PDUs: ADV_IND
        Min advertising interval: 100.000 msec (0x00a0)
        Max advertising interval: 150.000 msec (0x00f0)
        Channel map: 37, 38, 39 (0x07)
        Own address type: Random (0x01)
        Peer address type: Public (0x00)
        Peer address: 00:00:00:00:00:00 (OUI 00-00-00)
        Filter policy: Allow Scan Request from Any, Allow Connect Request from Any (0x00)
        TX power: Host has no preference (0x7f)
        Primary PHY: LE 1M (0x01)
        Secondary max skip: 0x00
        Secondary PHY: LE 1M (0x01)
        SID: 0x00
        Scan request notifications: Disabled (0x00)
> HCI Event: Command Complete (0x0e) plen 5                 #38 [hci1] 3.929511
      LE Set Extended Advertising Parameters (0x08|0x0036) ncmd 1
        Status: Success (0x00)
        TX power (selected): 0 dbm (0x00)
< HCI Command: LE Set Advertising S.. (0x08|0x0035) plen 7  #39 [hci1] 3.948663
        Advertising handle: 0x00
        Advertising random address: D5:B6:CC:31:DB:3B (Static)
> HCI Event: Command Complete (0x0e) plen 4                 #40 [hci1] 3.949215
      LE Set Advertising Set Random Address (0x08|0x0035) ncmd 1
        Status: Success (0x00)
< HCI Command: LE Set Extended Adv.. (0x08|0x0037) plen 22  #41 [hci1] 3.968615
        Handle: 0x00
        Operation: Complete extended advertising data (0x03)
        Fragment preference: Minimize fragmentation (0x01)
        Data length: 0x12
        Flags: 0x06
          LE General Discoverable Mode
          BR/EDR Not Supported
        Name (complete): Tester_F6B11A
> HCI Event: Command Complete (0x0e) plen 4                 #42 [hci1] 3.969312
      LE Set Extended Advertising Data (0x08|0x0037) ncmd 1
        Status: Success (0x00)
< HCI Command: LE Set Extended Scan.. (0x08|0x0038) plen 4  #43 [hci1] 3.988564
        Handle: 0x00
        Operation: Complete scan response data (0x03)
        Fragment preference: Minimize fragmentation (0x01)
        Data length: 0x00
> HCI Event: Command Complete (0x0e) plen 4                 #44 [hci1] 3.989130
      LE Set Extended Scan Response Data (0x08|0x0038) ncmd 1
        Status: Success (0x00)
< HCI Command: LE Set Extended Adve.. (0x08|0x0039) plen 6  #45 [hci1] 4.008662
        Extended advertising: Enabled (0x01)
        Number of sets: 1 (0x01)
        Entry 0
          Handle: 0x00
          Duration: 0 ms (0x00)
          Max ext adv events: 0
> HCI Event: Command Complete (0x0e) plen 4                 #46 [hci1] 4.009252
      LE Set Extended Advertising Enable (0x08|0x0039) ncmd 1
        Status: Success (0x00)
> HCI Event: LE Meta Event (0x3e) plen 31                   #47 [hci1] 4.127256
      LE Enhanced Connection Complete (0x0a)
        Status: Success (0x00)
        Handle: 2361
        Role: Peripheral (0x01)
        Peer address type: Public (0x00)
        Peer address: DF:A9:FF:F6:B1:1A (OUI DF-A9-FF)
        Local resolvable private address: 00:00:00:00:00:00 (Non-Resolvable)
        Peer resolvable private address: 00:00:00:00:00:00 (Non-Resolvable)
        Connection interval: 87.50 msec (0x0046)
        Connection latency: 0 (0x0000)
        Supervision timeout: 25120 msec (0x09d0)
        Central clock accuracy: 0x01
> HCI Event: LE Meta Event (0x3e) plen 6                    #48 [hci1] 4.127456
      LE Advertising Set Terminated (0x12)
        Status: Success (0x00)
        Handle: 0
        Connection handle: 2361
        Number of completed extended advertising events: 0
< HCI Command: LE Read Remote Used... (0x08|0x0016) plen 2  #49 [hci1] 4.129746
        Handle: 2361 Address: DF:A9:FF:F6:B1:1A (OUI DF-A9-FF)
< ACL Data TX: Handle 2361 flags 0x00 dlen 7                #50 [hci1] 4.129771
      ATT: Exchange MTU Request (0x02) len 2
        Client RX MTU: 251
> HCI Event: Command Status (0x0f) plen 4                   #51 [hci1] 4.130356
      LE Read Remote Used Features (0x08|0x0016) ncmd 1
        Status: Success (0x00)
> HCI Event: Number of Completed Packets (0x13) plen 5      #52 [hci1] 4.303322
        Num handles: 1
        Handle: 2361 Address: DF:A9:FF:F6:B1:1A (OUI DF-A9-FF)
        Count: 1
        #50: len 7 (0 Kb/s)
        Latency: 173 msec (173-173 msec ~173 msec)
> HCI Event: LE Meta Event (0x3e) plen 12                   #53 [hci1] 4.391143
      LE Read Remote Used Features (0x04)
        Status: Success (0x00)
        Handle: 2361 Address: DF:A9:FF:F6:B1:1A (OUI DF-A9-FF)
        Features: 0x2d 0x49 0x00 0xf7 0x67 0xd9 0x00 0x80
          LE Encryption
          Extended Reject Indication
          Peripheral-initiated Features Exchange
          LE Data Packet Length Extension
          LE 2M PHY
          LE Coded PHY
          Channel Selection Algorithm #2
          Periodic Advertising Sync Transfer - Sender
          Periodic Advertising Sync Transfer - Recipient
          Sleep Clock Accuracy Updates
          Connected Isochronous Stream - Central
          Connected Isochronous Stream - Peripheral
          Isochronous Broadcaster
          Synchronized Receiver
          Connected Isochronous Stream (Host Support)
          LE Power Control Request
          LE Power Control Request
          Connection Subrating
          Connection Subrating (Host Support)
          Unknown features (0x8000d90000000000)
> ACL Data RX: Handle 2361 flags 0x02 dlen 11               #54 [hci1] 6.840968
      SMP: Pairing Request (0x01) len 6
        IO capability: KeyboardDisplay (0x04)
        OOB data: Authentication data not present (0x00)
        Authentication requirement: Bonding, MITM, SC, No Keypresses (0x0d)
        Max encryption key size: 16
        Initiator key distribution: EncKey IdKey (0x03)
        Responder key distribution: EncKey IdKey Sign (0x07)
> ACL Data RX: Handle 2361 flags 0x02 dlen 7                #55 [hci1] 6.841411
      ATT: Exchange MTU Response (0x03) len 2
        Server RX MTU: 23
< HCI Command: Host Number of Compl.. (0x03|0x0035) plen 5  #56 [hci1] 6.849222
        Num handles: 1
        Handle: 2361 Address: DF:A9:FF:F6:B1:1A (OUI DF-A9-FF)
        Count: 1
< ACL Data TX: Handle 2361 flags 0x00 dlen 11               #57 [hci1] 6.849339
      SMP: Pairing Response (0x02) len 6
        IO capability: DisplayOnly (0x00)
        OOB data: Authentication data not present (0x00)
        Authentication requirement: Bonding, No MITM, SC, No Keypresses (0x09)
        Max encryption key size: 16
        Initiator key distribution: IdKey (0x02)
        Responder key distribution: <none> (0x00)
< HCI Command: Host Number of Compl.. (0x03|0x0035) plen 5  #58 [hci1] 6.849761
        Num handles: 1
        Handle: 2361 Address: DF:A9:FF:F6:B1:1A (OUI DF-A9-FF)
        Count: 1
> HCI Event: Number of Completed Packets (0x13) plen 5      #59 [hci1] 7.015958
        Num handles: 1
        Handle: 2361 Address: DF:A9:FF:F6:B1:1A (OUI DF-A9-FF)
        Count: 1
        #57: len 11 (0 Kb/s)
        Latency: 166 msec (166-173 msec ~170 msec)
> ACL Data RX: Handle 2361 flags 0x02 dlen 27               #60 [hci1] 7.016323
> ACL Data RX: Handle 2361 flags 0x01 dlen 27               #61 [hci1] 7.016821
> ACL Data RX: Handle 2361 flags 0x01 dlen 15               #62 [hci1] 7.017301
      SMP: Pairing Public Key (0x0c) len 64
        X: e4cd7f53222b989b98a8c7d0a3ad7c8a6a4db1919cfdf6ece76adc7e2ce74147
        Y: f6569e61834e4881fab6beb77cd2b9a909a967e61452950b04ae1e90c74252a3
< HCI Command: Host Number of Compl.. (0x03|0x0035) plen 5  #63 [hci1] 7.029462
        Num handles: 1
        Handle: 2361 Address: DF:A9:FF:F6:B1:1A (OUI DF-A9-FF)
        Count: 1
< HCI Command: Host Number of Compl.. (0x03|0x0035) plen 5  #64 [hci1] 7.029699
        Num handles: 1
        Handle: 2361 Address: DF:A9:FF:F6:B1:1A (OUI DF-A9-FF)
        Count: 1
< HCI Command: Host Number of Compl.. (0x03|0x0035) plen 5  #65 [hci1] 7.030152
        Num handles: 1
        Handle: 2361 Address: DF:A9:FF:F6:B1:1A (OUI DF-A9-FF)
        Count: 1
< ACL Data TX: Handle 2361 flags 0x00 dlen 27               #66 [hci1] 7.030331
< ACL Data TX: Handle 2361 flags 0x01 dlen 27               #67 [hci1] 7.030348
< ACL Data TX: Handle 2361 flags 0x01 dlen 15               #68 [hci1] 7.030352
      SMP: Pairing Public Key (0x0c) len 64
        X: 98308440221e2d910f0e54b71e7ec652857aa9b5a0dc65028824cc19db1226e9
        Y: 67a4816bcb62efb21701e31fdb27561a6217575fb007a8bbdabe7e28b6f68482
> HCI Event: Number of Completed Packets (0x13) plen 5      #69 [hci1] 7.103886
        Num handles: 1
        Handle: 2361 Address: DF:A9:FF:F6:B1:1A (OUI DF-A9-FF)
        Count: 1
        #66: len 27 (2 Kb/s)
        Latency: 73 msec (73-173 msec ~121 msec)
> HCI Event: Number of Completed Packets (0x13) plen 5      #70 [hci1] 7.104621
        Num handles: 1
        Handle: 2361 Address: DF:A9:FF:F6:B1:1A (OUI DF-A9-FF)
        Count: 1
        #67: len 27 (2 Kb/s)
        Latency: 74 msec (73-173 msec ~98 msec)
> HCI Event: Number of Completed Packets (0x13) plen 5      #71 [hci1] 7.190671
        Num handles: 1
        Handle: 2361 Address: DF:A9:FF:F6:B1:1A (OUI DF-A9-FF)
        Count: 1
        #68: len 15 (0 Kb/s)
        Latency: 160 msec (73-173 msec ~129 msec)
> ACL Data RX: Handle 2361 flags 0x02 dlen 21               #72 [hci1] 8.153711
      SMP: Pairing Confirm (0x03) len 16
        Confim value: 7e830055084fdc889a5240a693557b2b
< HCI Command: Host Number of Compl.. (0x03|0x0035) plen 5  #73 [hci1] 8.169499
        Num handles: 1
        Handle: 2361 Address: DF:A9:FF:F6:B1:1A (OUI DF-A9-FF)
        Count: 1
< ACL Data TX: Handle 2361 flags 0x00 dlen 21               #74 [hci1] 8.169660
      SMP: Pairing Confirm (0x03) len 16
        Confim value: 24bd7cf7e9b5d5d9e9ba0e2867422a0f
> HCI Event: Number of Completed Packets (0x13) plen 5      #75 [hci1] 8.328364
        Num handles: 1
        Handle: 2361 Address: DF:A9:FF:F6:B1:1A (OUI DF-A9-FF)
        Count: 1
        #74: len 21 (1 Kb/s)
        Latency: 158 msec (73-173 msec ~143 msec)
> ACL Data RX: Handle 2361 flags 0x02 dlen 21               #76 [hci1] 8.328747
      SMP: Pairing Random (0x04) len 16
        Random value: 7a5a74c465dcb1190000000000000000
< HCI Command: Host Number of Compl.. (0x03|0x0035) plen 5  #77 [hci1] 8.349470
        Num handles: 1
        Handle: 2361 Address: DF:A9:FF:F6:B1:1A (OUI DF-A9-FF)
        Count: 1
< ACL Data TX: Handle 2361 flags 0x00 dlen 21               #78 [hci1] 8.349685
      SMP: Pairing Random (0x04) len 16
        Random value: 8e6108f966a694cbe26df70bb96773e6
> HCI Event: Number of Completed Packets (0x13) plen 5      #79 [hci1] 8.503181
        Num handles: 1
        Handle: 2361 Address: DF:A9:FF:F6:B1:1A (OUI DF-A9-FF)
        Count: 1
        #78: len 21 (1 Kb/s)
        Latency: 153 msec (73-173 msec ~148 msec)
> ACL Data RX: Handle 2361 flags 0x02 dlen 21               #80 [hci1] 8.591146
      SMP: Pairing Confirm (0x03) len 16
        Confim value: 8eb6ec08d82dc4dbdfdcd2ee685a49e0
< HCI Command: Host Number of Compl.. (0x03|0x0035) plen 5  #81 [hci1] 8.609301
        Num handles: 1
        Handle: 2361 Address: DF:A9:FF:F6:B1:1A (OUI DF-A9-FF)
        Count: 1
< ACL Data TX: Handle 2361 flags 0x00 dlen 21               #82 [hci1] 8.609423
      SMP: Pairing Confirm (0x03) len 16
        Confim value: 7f14d7a1ad0485a38e9b51e97d8906c9
> HCI Event: Number of Completed Packets (0x13) plen 5      #83 [hci1] 8.765995
        Num handles: 1
        Handle: 2361 Address: DF:A9:FF:F6:B1:1A (OUI DF-A9-FF)
        Count: 1
        #82: len 21 (1 Kb/s)
        Latency: 156 msec (73-173 msec ~152 msec)
> ACL Data RX: Handle 2361 flags 0x02 dlen 21               #84 [hci1] 8.766252
      SMP: Pairing Random (0x04) len 16
        Random value: 492da2232c764f310000000000000000
< HCI Command: Host Number of Compl.. (0x03|0x0035) plen 5  #85 [hci1] 8.769569
        Num handles: 1
        Handle: 2361 Address: DF:A9:FF:F6:B1:1A (OUI DF-A9-FF)
        Count: 1
< ACL Data TX: Handle 2361 flags 0x00 dlen 21               #86 [hci1] 8.769772
      SMP: Pairing Random (0x04) len 16
        Random value: 4d02679f89a05211af56d8b3da64d21e
> HCI Event: Number of Completed Packets (0x13) plen 5      #87 [hci1] 8.940631
        Num handles: 1
        Handle: 2361 Address: DF:A9:FF:F6:B1:1A (OUI DF-A9-FF)
        Count: 1
        #86: len 21 (0 Kb/s)
        Latency: 170 msec (73-173 msec ~161 msec)
> ACL Data RX: Handle 2361 flags 0x02 dlen 21               #88 [hci1] 9.028525
      SMP: Pairing Confirm (0x03) len 16
        Confim value: 23836dfdb7b87ef6df4f3fb0b863eff4
< HCI Command: Host Number of Compl.. (0x03|0x0035) plen 5  #89 [hci1] 9.028988
        Num handles: 1
        Handle: 2361 Address: DF:A9:FF:F6:B1:1A (OUI DF-A9-FF)
        Count: 1
< ACL Data TX: Handle 2361 flags 0x00 dlen 21               #90 [hci1] 9.029081
      SMP: Pairing Confirm (0x03) len 16
        Confim value: 30ee224400f87be9d5b419292d39669e
> HCI Event: Number of Completed Packets (0x13) plen 5      #91 [hci1] 9.203445
        Num handles: 1
        Handle: 2361 Address: DF:A9:FF:F6:B1:1A (OUI DF-A9-FF)
        Count: 1
        #90: len 21 (0 Kb/s)
        Latency: 174 msec (73-174 msec ~168 msec)
> ACL Data RX: Handle 2361 flags 0x02 dlen 21               #92 [hci1] 9.203717
      SMP: Pairing Random (0x04) len 16
        Random value: b08bb5d579551b4e0000000000000000
< HCI Command: Host Number of Compl.. (0x03|0x0035) plen 5  #93 [hci1] 9.209455
        Num handles: 1
        Handle: 2361 Address: DF:A9:FF:F6:B1:1A (OUI DF-A9-FF)
        Count: 1
< ACL Data TX: Handle 2361 flags 0x00 dlen 21               #94 [hci1] 9.209590
      SMP: Pairing Random (0x04) len 16
        Random value: 5e8286bc235a02440d0c3424a2acf8fd
> HCI Event: Number of Completed Packets (0x13) plen 5      #95 [hci1] 9.378219
        Num handles: 1
        Handle: 2361 Address: DF:A9:FF:F6:B1:1A (OUI DF-A9-FF)
        Count: 1
        #94: len 21 (1 Kb/s)
        Latency: 168 msec (73-174 msec ~168 msec)
> ACL Data RX: Handle 2361 flags 0x02 dlen 21               #96 [hci1] 9.466107
      SMP: Pairing Confirm (0x03) len 16
        Confim value: 81c6caa039a3461f62e6668f20523011
< HCI Command: Host Number of Compl.. (0x03|0x0035) plen 5  #97 [hci1] 9.468922
        Num handles: 1
        Handle: 2361 Address: DF:A9:FF:F6:B1:1A (OUI DF-A9-FF)
        Count: 1
< ACL Data TX: Handle 2361 flags 0x00 dlen 21               #98 [hci1] 9.468978
      SMP: Pairing Confirm (0x03) len 16
        Confim value: d70395b7efa8faa3508ffbaae1f4b51b
> HCI Event: Number of Completed Packets (0x13) plen 5      #99 [hci1] 9.640902
        Num handles: 1
        Handle: 2361 Address: DF:A9:FF:F6:B1:1A (OUI DF-A9-FF)
        Count: 1
        #98: len 21 (0 Kb/s)
        Latency: 171 msec (73-174 msec ~170 msec)
> ACL Data RX: Handle 2361 flags 0x02 dlen 21              #100 [hci1] 9.641194
      SMP: Pairing Random (0x04) len 16
        Random value: 07d66af7be3c0e1a0000000000000000
< HCI Command: Host Number of Comp.. (0x03|0x0035) plen 5  #101 [hci1] 9.649682
        Num handles: 1
        Handle: 2361 Address: DF:A9:FF:F6:B1:1A (OUI DF-A9-FF)
        Count: 1
< ACL Data TX: Handle 2361 flags 0x00 dlen 21              #102 [hci1] 9.649871
      SMP: Pairing Random (0x04) len 16
        Random value: 5c4a1bcadd27bd58e945097b00bad7ac
> HCI Event: Number of Completed Packets (0x13) plen 5     #103 [hci1] 9.815784
        Num handles: 1
        Handle: 2361 Address: DF:A9:FF:F6:B1:1A (OUI DF-A9-FF)
        Count: 1
        #102: len 21 (1 Kb/s)
        Latency: 165 msec (73-174 msec ~168 msec)
> ACL Data RX: Handle 2361 flags 0x02 dlen 21              #104 [hci1] 9.903581
      SMP: Pairing Confirm (0x03) len 16
        Confim value: 72f058e714c539904a4ba491523d3984
< HCI Command: Host Number of Comp.. (0x03|0x0035) plen 5  #105 [hci1] 9.909282
        Num handles: 1
        Handle: 2361 Address: DF:A9:FF:F6:B1:1A (OUI DF-A9-FF)
        Count: 1
< ACL Data TX: Handle 2361 flags 0x00 dlen 21              #106 [hci1] 9.909463
      SMP: Pairing Confirm (0x03) len 16
        Confim value: 28297b2aa5633a434a552ac32b81f1dc
> HCI Event: Number of Completed Packets (0x13) plen 5    #107 [hci1] 10.078354
        Num handles: 1
        Handle: 2361 Address: DF:A9:FF:F6:B1:1A (OUI DF-A9-FF)
        Count: 1
        #106: len 21 (1 Kb/s)
        Latency: 168 msec (73-174 msec ~168 msec)
> ACL Data RX: Handle 2361 flags 0x02 dlen 21             #108 [hci1] 10.078698
      SMP: Pairing Random (0x04) len 16
        Random value: c83522789d0055d10000000000000000
< HCI Command: Host Number of Com.. (0x03|0x0035) plen 5  #109 [hci1] 10.089631
        Num handles: 1
        Handle: 2361 Address: DF:A9:FF:F6:B1:1A (OUI DF-A9-FF)
        Count: 1
< ACL Data TX: Handle 2361 flags 0x00 dlen 21             #110 [hci1] 10.089734
      SMP: Pairing Random (0x04) len 16
        Random value: 32527e6e64e79f33b2e374394db8ab2d
> HCI Event: Number of Completed Packets (0x13) plen 5    #111 [hci1] 10.253138
        Num handles: 1
        Handle: 2361 Address: DF:A9:FF:F6:B1:1A (OUI DF-A9-FF)
        Count: 1
        #110: len 21 (1 Kb/s)
        Latency: 163 msec (73-174 msec ~165 msec)
> ACL Data RX: Handle 2361 flags 0x02 dlen 21             #112 [hci1] 10.341083
      SMP: Pairing Confirm (0x03) len 16
        Confim value: 04fab47a1691964c74bd06f7cba99548
< HCI Command: Host Number of Com.. (0x03|0x0035) plen 5  #113 [hci1] 10.348770
        Num handles: 1
        Handle: 2361 Address: DF:A9:FF:F6:B1:1A (OUI DF-A9-FF)
        Count: 1
< ACL Data TX: Handle 2361 flags 0x00 dlen 21             #114 [hci1] 10.348841
      SMP: Pairing Confirm (0x03) len 16
        Confim value: 6a83b0b8da93ac34781aa4bc84f74309
> HCI Event: Number of Completed Packets (0x13) plen 5    #115 [hci1] 10.515952
        Num handles: 1
        Handle: 2361 Address: DF:A9:FF:F6:B1:1A (OUI DF-A9-FF)
        Count: 1
        #114: len 21 (1 Kb/s)
        Latency: 167 msec (73-174 msec ~166 msec)
> ACL Data RX: Handle 2361 flags 0x02 dlen 21             #116 [hci1] 10.516162
      SMP: Pairing Random (0x04) len 16
        Random value: 73cfd80e68ba55190000000000000000
< HCI Command: Host Number of Com.. (0x03|0x0035) plen 5  #117 [hci1] 10.529584
        Num handles: 1
        Handle: 2361 Address: DF:A9:FF:F6:B1:1A (OUI DF-A9-FF)
        Count: 1
< ACL Data TX: Handle 2361 flags 0x00 dlen 21             #118 [hci1] 10.529749
      SMP: Pairing Random (0x04) len 16
        Random value: dddbdfe2838e9a8cc6964353c850fef7
> HCI Event: Number of Completed Packets (0x13) plen 5    #119 [hci1] 10.690647
        Num handles: 1
        Handle: 2361 Address: DF:A9:FF:F6:B1:1A (OUI DF-A9-FF)
        Count: 1
        #118: len 21 (1 Kb/s)
        Latency: 160 msec (73-174 msec ~163 msec)
> ACL Data RX: Handle 2361 flags 0x02 dlen 21             #120 [hci1] 10.778498
      SMP: Pairing Confirm (0x03) len 16
        Confim value: 0db2d745f3bdbac42a55e91cd54459cb
< HCI Command: Host Number of Com.. (0x03|0x0035) plen 5  #121 [hci1] 10.789295
        Num handles: 1
        Handle: 2361 Address: DF:A9:FF:F6:B1:1A (OUI DF-A9-FF)
        Count: 1
< ACL Data TX: Handle 2361 flags 0x00 dlen 21             #122 [hci1] 10.789422
      SMP: Pairing Confirm (0x03) len 16
        Confim value: 5a6f803c8bf660d837c72cd6f0f9fc08
> HCI Event: Number of Completed Packets (0x13) plen 5    #123 [hci1] 10.953452
        Num handles: 1
        Handle: 2361 Address: DF:A9:FF:F6:B1:1A (OUI DF-A9-FF)
        Count: 1
        #122: len 21 (1 Kb/s)
        Latency: 164 msec (73-174 msec ~163 msec)
> ACL Data RX: Handle 2361 flags 0x02 dlen 21             #124 [hci1] 10.953658
      SMP: Pairing Random (0x04) len 16
        Random value: 35da0de89e9ab2c40000000000000000
< HCI Command: Host Number of Com.. (0x03|0x0035) plen 5  #125 [hci1] 10.969709
        Num handles: 1
        Handle: 2361 Address: DF:A9:FF:F6:B1:1A (OUI DF-A9-FF)
        Count: 1
< ACL Data TX: Handle 2361 flags 0x00 dlen 21             #126 [hci1] 10.969897
      SMP: Pairing Random (0x04) len 16
        Random value: eb9f1915536596b6fc3db1c86b2b1970
> HCI Event: Number of Completed Packets (0x13) plen 5    #127 [hci1] 11.128116
        Num handles: 1
        Handle: 2361 Address: DF:A9:FF:F6:B1:1A (OUI DF-A9-FF)
        Count: 1
        #126: len 21 (1 Kb/s)
        Latency: 158 msec (73-174 msec ~161 msec)
> ACL Data RX: Handle 2361 flags 0x02 dlen 21             #128 [hci1] 11.216085
      SMP: Pairing Confirm (0x03) len 16
        Confim value: 7ac53f3a688a117fc1141a6d46a485bd
< HCI Command: Host Number of Com.. (0x03|0x0035) plen 5  #129 [hci1] 11.228969
        Num handles: 1
        Handle: 2361 Address: DF:A9:FF:F6:B1:1A (OUI DF-A9-FF)
        Count: 1
< ACL Data TX: Handle 2361 flags 0x00 dlen 21             #130 [hci1] 11.229027
      SMP: Pairing Confirm (0x03) len 16
        Confim value: 983419d00f8e5811a3e94d0912880e9f
> HCI Event: Number of Completed Packets (0x13) plen 5    #131 [hci1] 11.390862
        Num handles: 1
        Handle: 2361 Address: DF:A9:FF:F6:B1:1A (OUI DF-A9-FF)
        Count: 1
        #130: len 21 (1 Kb/s)
        Latency: 161 msec (73-174 msec ~161 msec)
> ACL Data RX: Handle 2361 flags 0x02 dlen 21             #132 [hci1] 11.391178
      SMP: Pairing Random (0x04) len 16
        Random value: 767e088aae29ae210000000000000000
< HCI Command: Host Number of Com.. (0x03|0x0035) plen 5  #133 [hci1] 11.409392
        Num handles: 1
        Handle: 2361 Address: DF:A9:FF:F6:B1:1A (OUI DF-A9-FF)
        Count: 1
< ACL Data TX: Handle 2361 flags 0x00 dlen 21             #134 [hci1] 11.409514
      SMP: Pairing Random (0x04) len 16
        Random value: 5c794dc9ad9f2c3f295ebd5ad5e1c3cf
> HCI Event: Number of Completed Packets (0x13) plen 5    #135 [hci1] 11.565585
        Num handles: 1
        Handle: 2361 Address: DF:A9:FF:F6:B1:1A (OUI DF-A9-FF)
        Count: 1
        #134: len 21 (1 Kb/s)
        Latency: 156 msec (73-174 msec ~158 msec)
> ACL Data RX: Handle 2361 flags 0x02 dlen 21             #136 [hci1] 11.653502
      SMP: Pairing Confirm (0x03) len 16
        Confim value: a55edd90898db3958a85c60cddb396fa
< HCI Command: Host Number of Com.. (0x03|0x0035) plen 5  #137 [hci1] 11.669293
        Num handles: 1
        Handle: 2361 Address: DF:A9:FF:F6:B1:1A (OUI DF-A9-FF)
        Count: 1
< ACL Data TX: Handle 2361 flags 0x00 dlen 21             #138 [hci1] 11.669370
      SMP: Pairing Confirm (0x03) len 16
        Confim value: 038a6a1b6848a31e148c5b3ca199e240
> HCI Event: Number of Completed Packets (0x13) plen 5    #139 [hci1] 11.828342
        Num handles: 1
        Handle: 2361 Address: DF:A9:FF:F6:B1:1A (OUI DF-A9-FF)
        Count: 1
        #138: len 21 (1 Kb/s)
        Latency: 158 msec (73-174 msec ~158 msec)
> ACL Data RX: Handle 2361 flags 0x02 dlen 21             #140 [hci1] 11.828745
      SMP: Pairing Random (0x04) len 16
        Random value: 7d6a3b5ca4d3b4150000000000000000
< HCI Command: Host Number of Com.. (0x03|0x0035) plen 5  #141 [hci1] 11.829512
        Num handles: 1
        Handle: 2361 Address: DF:A9:FF:F6:B1:1A (OUI DF-A9-FF)
        Count: 1
< ACL Data TX: Handle 2361 flags 0x00 dlen 21             #142 [hci1] 11.829658
      SMP: Pairing Random (0x04) len 16
        Random value: 5c2fff312cdf99c9491988e877355a9a
> HCI Event: Number of Completed Packets (0x13) plen 5    #143 [hci1] 12.003107
        Num handles: 1
        Handle: 2361 Address: DF:A9:FF:F6:B1:1A (OUI DF-A9-FF)
        Count: 1
        #142: len 21 (0 Kb/s)
        Latency: 173 msec (73-174 msec ~166 msec)
> ACL Data RX: Handle 2361 flags 0x02 dlen 21             #144 [hci1] 12.090960
      SMP: Pairing Confirm (0x03) len 16
        Confim value: 19b3c0fd6989c3559adaa9b3028a3f90
< HCI Command: Host Number of Com.. (0x03|0x0035) plen 5  #145 [hci1] 12.108866
        Num handles: 1
        Handle: 2361 Address: DF:A9:FF:F6:B1:1A (OUI DF-A9-FF)
        Count: 1
< ACL Data TX: Handle 2361 flags 0x00 dlen 21             #146 [hci1] 12.108941
      SMP: Pairing Confirm (0x03) len 16
        Confim value: dea4069d8a32f409ab029bbfbf1a526e
> HCI Event: Number of Completed Packets (0x13) plen 5    #147 [hci1] 12.265893
        Num handles: 1
        Handle: 2361 Address: DF:A9:FF:F6:B1:1A (OUI DF-A9-FF)
        Count: 1
        #146: len 21 (1 Kb/s)
        Latency: 156 msec (73-174 msec ~161 msec)
> ACL Data RX: Handle 2361 flags 0x02 dlen 21             #148 [hci1] 12.266244
      SMP: Pairing Random (0x04) len 16
        Random value: 4a89a3b01fd595090000000000000000
< HCI Command: Host Number of Com.. (0x03|0x0035) plen 5  #149 [hci1] 12.269581
        Num handles: 1
        Handle: 2361 Address: DF:A9:FF:F6:B1:1A (OUI DF-A9-FF)
        Count: 1
< ACL Data TX: Handle 2361 flags 0x00 dlen 21             #150 [hci1] 12.269725
      SMP: Pairing Random (0x04) len 16
        Random value: c629a3a987d808e808655d558dfc1155
> HCI Event: Number of Completed Packets (0x13) plen 5    #151 [hci1] 12.440608
        Num handles: 1
        Handle: 2361 Address: DF:A9:FF:F6:B1:1A (OUI DF-A9-FF)
        Count: 1
        #150: len 21 (0 Kb/s)
        Latency: 170 msec (73-174 msec ~166 msec)
> ACL Data RX: Handle 2361 flags 0x02 dlen 21             #152 [hci1] 12.528398
      SMP: Pairing Confirm (0x03) len 16
        Confim value: 788811d6e73681cddc3b5a3f1d02ac3b
< HCI Command: Host Number of Com.. (0x03|0x0035) plen 5  #153 [hci1] 12.529348
        Num handles: 1
        Handle: 2361 Address: DF:A9:FF:F6:B1:1A (OUI DF-A9-FF)
        Count: 1
< ACL Data TX: Handle 2361 flags 0x00 dlen 21             #154 [hci1] 12.529533
      SMP: Pairing Confirm (0x03) len 16
        Confim value: 51e90f3e7d78bbb0ad51f816cba58b31
> HCI Event: Number of Completed Packets (0x13) plen 5    #155 [hci1] 12.703318
        Num handles: 1
        Handle: 2361 Address: DF:A9:FF:F6:B1:1A (OUI DF-A9-FF)
        Count: 1
        #154: len 21 (0 Kb/s)
        Latency: 173 msec (73-174 msec ~170 msec)
> ACL Data RX: Handle 2361 flags 0x02 dlen 21             #156 [hci1] 12.703685
      SMP: Pairing Random (0x04) len 16
        Random value: 9ba61d3244262d430000000000000000
< HCI Command: Host Number of Com.. (0x03|0x0035) plen 5  #157 [hci1] 12.709684
        Num handles: 1
        Handle: 2361 Address: DF:A9:FF:F6:B1:1A (OUI DF-A9-FF)
        Count: 1
< ACL Data TX: Handle 2361 flags 0x00 dlen 21             #158 [hci1] 12.709821
      SMP: Pairing Random (0x04) len 16
        Random value: 92f20f6ad8f13724432c7fd6001c45ff
> HCI Event: Number of Completed Packets (0x13) plen 5    #159 [hci1] 12.878142
        Num handles: 1
        Handle: 2361 Address: DF:A9:FF:F6:B1:1A (OUI DF-A9-FF)
        Count: 1
        #158: len 21 (1 Kb/s)
        Latency: 168 msec (73-174 msec ~169 msec)
> ACL Data RX: Handle 2361 flags 0x02 dlen 21             #160 [hci1] 12.966013
      SMP: Pairing Confirm (0x03) len 16
        Confim value: 6e1d4a6aade34dd39af80204a8b025f1
< HCI Command: Host Number of Com.. (0x03|0x0035) plen 5  #161 [hci1] 12.969047
        Num handles: 1
        Handle: 2361 Address: DF:A9:FF:F6:B1:1A (OUI DF-A9-FF)
        Count: 1
< ACL Data TX: Handle 2361 flags 0x00 dlen 21             #162 [hci1] 12.969151
      SMP: Pairing Confirm (0x03) len 16
        Confim value: bed6ad79fb851d7607cfc3bfaf3b96a3
> HCI Event: Number of Completed Packets (0x13) plen 5    #163 [hci1] 13.140812
        Num handles: 1
        Handle: 2361 Address: DF:A9:FF:F6:B1:1A (OUI DF-A9-FF)
        Count: 1
        #162: len 21 (0 Kb/s)
        Latency: 171 msec (73-174 msec ~170 msec)
> ACL Data RX: Handle 2361 flags 0x02 dlen 21             #164 [hci1] 13.141158
      SMP: Pairing Random (0x04) len 16
        Random value: 1b4d4e89f19dd56f0000000000000000
< HCI Command: Host Number of Com.. (0x03|0x0035) plen 5  #165 [hci1] 13.149597
        Num handles: 1
        Handle: 2361 Address: DF:A9:FF:F6:B1:1A (OUI DF-A9-FF)
        Count: 1
< ACL Data TX: Handle 2361 flags 0x00 dlen 21             #166 [hci1] 13.149784
      SMP: Pairing Random (0x04) len 16
        Random value: 23ac32ebbb5e14c8a6b9622f296d277f
> HCI Event: Number of Completed Packets (0x13) plen 5    #167 [hci1] 13.315566
        Num handles: 1
        Handle: 2361 Address: DF:A9:FF:F6:B1:1A (OUI DF-A9-FF)
        Count: 1
        #166: len 21 (1 Kb/s)
        Latency: 165 msec (73-174 msec ~168 msec)
> ACL Data RX: Handle 2361 flags 0x02 dlen 21             #168 [hci1] 13.403459
      SMP: Pairing Confirm (0x03) len 16
        Confim value: a8a43045e17c192d144a9aa5af562ab9
< HCI Command: Host Number of Com.. (0x03|0x0035) plen 5  #169 [hci1] 13.409007
        Num handles: 1
        Handle: 2361 Address: DF:A9:FF:F6:B1:1A (OUI DF-A9-FF)
        Count: 1
< ACL Data TX: Handle 2361 flags 0x00 dlen 21             #170 [hci1] 13.409061
      SMP: Pairing Confirm (0x03) len 16
        Confim value: 741e031a2e0c5e4c1ce7d820ed9bb628
> HCI Event: Number of Completed Packets (0x13) plen 5    #171 [hci1] 13.578386
        Num handles: 1
        Handle: 2361 Address: DF:A9:FF:F6:B1:1A (OUI DF-A9-FF)
        Count: 1
        #170: len 21 (0 Kb/s)
        Latency: 169 msec (73-174 msec ~168 msec)
> ACL Data RX: Handle 2361 flags 0x02 dlen 21             #172 [hci1] 13.578641
      SMP: Pairing Random (0x04) len 16
        Random value: 3895631b5a87b4c40000000000000000
< HCI Command: Host Number of Com.. (0x03|0x0035) plen 5  #173 [hci1] 13.589565
        Num handles: 1
        Handle: 2361 Address: DF:A9:FF:F6:B1:1A (OUI DF-A9-FF)
        Count: 1
< ACL Data TX: Handle 2361 flags 0x00 dlen 21             #174 [hci1] 13.589645
      SMP: Pairing Random (0x04) len 16
        Random value: 297efe85e67448a15f56bd27e3a3cf1d
> HCI Event: Number of Completed Packets (0x13) plen 5    #175 [hci1] 13.753121
        Num handles: 1
        Handle: 2361 Address: DF:A9:FF:F6:B1:1A (OUI DF-A9-FF)
        Count: 1
        #174: len 21 (1 Kb/s)
        Latency: 163 msec (73-174 msec ~166 msec)
> ACL Data RX: Handle 2361 flags 0x02 dlen 21             #176 [hci1] 13.841015
      SMP: Pairing Confirm (0x03) len 16
        Confim value: c7292c61fb4c38db4946db728cd3c1a0
< HCI Command: Host Number of Com.. (0x03|0x0035) plen 5  #177 [hci1] 13.849339
        Num handles: 1
        Handle: 2361 Address: DF:A9:FF:F6:B1:1A (OUI DF-A9-FF)
        Count: 1
< ACL Data TX: Handle 2361 flags 0x00 dlen 21             #178 [hci1] 13.849536
      SMP: Pairing Confirm (0x03) len 16
        Confim value: 4e824474a9a285700d567ef3db6ac236
> HCI Event: Number of Completed Packets (0x13) plen 5    #179 [hci1] 14.015863
        Num handles: 1
        Handle: 2361 Address: DF:A9:FF:F6:B1:1A (OUI DF-A9-FF)
        Count: 1
        #178: len 21 (1 Kb/s)
        Latency: 166 msec (73-174 msec ~166 msec)
> ACL Data RX: Handle 2361 flags 0x02 dlen 21             #180 [hci1] 14.016149
      SMP: Pairing Random (0x04) len 16
        Random value: 903c91c9c9f6d3f60000000000000000
< HCI Command: Host Number of Com.. (0x03|0x0035) plen 5  #181 [hci1] 14.029523
        Num handles: 1
        Handle: 2361 Address: DF:A9:FF:F6:B1:1A (OUI DF-A9-FF)
        Count: 1
< ACL Data TX: Handle 2361 flags 0x00 dlen 21             #182 [hci1] 14.029714
      SMP: Pairing Random (0x04) len 16
        Random value: 25a9493fd3ce4faf02be7293595bb7c6
> HCI Event: Number of Completed Packets (0x13) plen 5    #183 [hci1] 14.190628
        Num handles: 1
        Handle: 2361 Address: DF:A9:FF:F6:B1:1A (OUI DF-A9-FF)
        Count: 1
        #182: len 21 (1 Kb/s)
        Latency: 160 msec (73-174 msec ~163 msec)
> ACL Data RX: Handle 2361 flags 0x02 dlen 21             #184 [hci1] 14.278451
      SMP: Pairing Confirm (0x03) len 16
        Confim value: 7ea460aecced077fa774c371987acd8a
< HCI Command: Host Number of Com.. (0x03|0x0035) plen 5  #185 [hci1] 14.289390
        Num handles: 1
        Handle: 2361 Address: DF:A9:FF:F6:B1:1A (OUI DF-A9-FF)
        Count: 1
< ACL Data TX: Handle 2361 flags 0x00 dlen 21             #186 [hci1] 14.289540
      SMP: Pairing Confirm (0x03) len 16
        Confim value: fffa0e934a1331c61eedfea9a212258c
> HCI Event: Number of Completed Packets (0x13) plen 5    #187 [hci1] 14.453316
        Num handles: 1
        Handle: 2361 Address: DF:A9:FF:F6:B1:1A (OUI DF-A9-FF)
        Count: 1
        #186: len 21 (1 Kb/s)
        Latency: 163 msec (73-174 msec ~163 msec)
> ACL Data RX: Handle 2361 flags 0x02 dlen 21             #188 [hci1] 14.453583
      SMP: Pairing Random (0x04) len 16
        Random value: f655f5be2e1f628c0000000000000000
< HCI Command: Host Number of Com.. (0x03|0x0035) plen 5  #189 [hci1] 14.469673
        Num handles: 1
        Handle: 2361 Address: DF:A9:FF:F6:B1:1A (OUI DF-A9-FF)
        Count: 1
< ACL Data TX: Handle 2361 flags 0x00 dlen 21             #190 [hci1] 14.469839
      SMP: Pairing Random (0x04) len 16
        Random value: 58f6b41f855a6f6c3560debd84e2affc
> HCI Event: Number of Completed Packets (0x13) plen 5    #191 [hci1] 14.628077
        Num handles: 1
        Handle: 2361 Address: DF:A9:FF:F6:B1:1A (OUI DF-A9-FF)
        Count: 1
        #190: len 21 (1 Kb/s)
        Latency: 158 msec (73-174 msec ~160 msec)
> ACL Data RX: Handle 2361 flags 0x02 dlen 21             #192 [hci1] 14.716041
      SMP: Pairing Confirm (0x03) len 16
        Confim value: 6b03eccb3547440f5799950c043785f2
< HCI Command: Host Number of Com.. (0x03|0x0035) plen 5  #193 [hci1] 14.728910
        Num handles: 1
        Handle: 2361 Address: DF:A9:FF:F6:B1:1A (OUI DF-A9-FF)
        Count: 1
< ACL Data TX: Handle 2361 flags 0x00 dlen 21             #194 [hci1] 14.729000
      SMP: Pairing Confirm (0x03) len 16
        Confim value: b2df6d2663e786873f1cb5216f0a103a
> HCI Event: Number of Completed Packets (0x13) plen 5    #195 [hci1] 14.890779
        Num handles: 1
        Handle: 2361 Address: DF:A9:FF:F6:B1:1A (OUI DF-A9-FF)
        Count: 1
        #194: len 21 (1 Kb/s)
        Latency: 161 msec (73-174 msec ~161 msec)
> ACL Data RX: Handle 2361 flags 0x02 dlen 21             #196 [hci1] 14.891129
      SMP: Pairing Random (0x04) len 16
        Random value: d1f253b2e4dfc6120000000000000000
< HCI Command: Host Number of Com.. (0x03|0x0035) plen 5  #197 [hci1] 14.909461
        Num handles: 1
        Handle: 2361 Address: DF:A9:FF:F6:B1:1A (OUI DF-A9-FF)
        Count: 1
< ACL Data TX: Handle 2361 flags 0x00 dlen 21             #198 [hci1] 14.909652
      SMP: Pairing Random (0x04) len 16
        Random value: b67e7216d5bf664139eda2b542549666
> HCI Event: Number of Completed Packets (0x13) plen 5    #199 [hci1] 15.065567
        Num handles: 1
        Handle: 2361 Address: DF:A9:FF:F6:B1:1A (OUI DF-A9-FF)
        Count: 1
        #198: len 21 (1 Kb/s)
        Latency: 155 msec (73-174 msec ~158 msec)
> ACL Data RX: Handle 2361 flags 0x02 dlen 21             #200 [hci1] 15.153545
      SMP: Pairing Confirm (0x03) len 16
        Confim value: 7dd88e800710f6d71f59e0cfbb5429c2
< HCI Command: Host Number of Com.. (0x03|0x0035) plen 5  #201 [hci1] 15.169052
        Num handles: 1
        Handle: 2361 Address: DF:A9:FF:F6:B1:1A (OUI DF-A9-FF)
        Count: 1
< ACL Data TX: Handle 2361 flags 0x00 dlen 21             #202 [hci1] 15.169155
      SMP: Pairing Confirm (0x03) len 16
        Confim value: 8ead76949a595af933770cdbcf454f12
> HCI Event: Number of Completed Packets (0x13) plen 5    #203 [hci1] 15.328228
        Num handles: 1
        Handle: 2361 Address: DF:A9:FF:F6:B1:1A (OUI DF-A9-FF)
        Count: 1
        #202: len 21 (1 Kb/s)
        Latency: 159 msec (73-174 msec ~158 msec)
> ACL Data RX: Handle 2361 flags 0x02 dlen 21             #204 [hci1] 15.328606
      SMP: Pairing Random (0x04) len 16
        Random value: 01538ede23ad229e0000000000000000
< HCI Command: Host Number of Com.. (0x03|0x0035) plen 5  #205 [hci1] 15.329657
        Num handles: 1
        Handle: 2361 Address: DF:A9:FF:F6:B1:1A (OUI DF-A9-FF)
        Count: 1
< ACL Data TX: Handle 2361 flags 0x00 dlen 21             #206 [hci1] 15.329811
      SMP: Pairing Random (0x04) len 16
        Random value: ed17f76500c95219dd01e09d1e63f87b
> HCI Event: Number of Completed Packets (0x13) plen 5    #207 [hci1] 15.503062
        Num handles: 1
        Handle: 2361 Address: DF:A9:FF:F6:B1:1A (OUI DF-A9-FF)
        Count: 1
        #206: len 21 (0 Kb/s)
        Latency: 173 msec (73-174 msec ~166 msec)
> ACL Data RX: Handle 2361 flags 0x02 dlen 21             #208 [hci1] 15.590939
      SMP: Pairing Confirm (0x03) len 16
        Confim value: 04196b53d4ccb9af05b48cc776bd55c7
< HCI Command: Host Number of Com.. (0x03|0x0035) plen 5  #209 [hci1] 15.609409
        Num handles: 1
        Handle: 2361 Address: DF:A9:FF:F6:B1:1A (OUI DF-A9-FF)
        Count: 1
< ACL Data TX: Handle 2361 flags 0x00 dlen 21             #210 [hci1] 15.609556
      SMP: Pairing Confirm (0x03) len 16
        Confim value: 256e38ec450859a1cff232a6efce519c
> HCI Event: Number of Completed Packets (0x13) plen 5    #211 [hci1] 15.765787
        Num handles: 1
        Handle: 2361 Address: DF:A9:FF:F6:B1:1A (OUI DF-A9-FF)
        Count: 1
        #210: len 21 (1 Kb/s)
        Latency: 156 msec (73-174 msec ~161 msec)
> ACL Data RX: Handle 2361 flags 0x02 dlen 21             #212 [hci1] 15.766098
      SMP: Pairing Random (0x04) len 16
        Random value: d841679b1c5527660000000000000000
< HCI Command: Host Number of Com.. (0x03|0x0035) plen 5  #213 [hci1] 15.769609
        Num handles: 1
        Handle: 2361 Address: DF:A9:FF:F6:B1:1A (OUI DF-A9-FF)
        Count: 1
< ACL Data TX: Handle 2361 flags 0x00 dlen 21             #214 [hci1] 15.769773
      SMP: Pairing Random (0x04) len 16
        Random value: 81d35d47e1f6006d79c974bd9d9e1ee3
> HCI Event: Number of Completed Packets (0x13) plen 5    #215 [hci1] 15.940580
        Num handles: 1
        Handle: 2361 Address: DF:A9:FF:F6:B1:1A (OUI DF-A9-FF)
        Count: 1
        #214: len 21 (0 Kb/s)
        Latency: 170 msec (73-174 msec ~165 msec)
> ACL Data RX: Handle 2361 flags 0x02 dlen 21             #216 [hci1] 16.028495
      SMP: Pairing Confirm (0x03) len 16
        Confim value: d0e7c752975e2404c4398fcee813d929
< HCI Command: Host Number of Com.. (0x03|0x0035) plen 5  #217 [hci1] 16.029341
        Num handles: 1
        Handle: 2361 Address: DF:A9:FF:F6:B1:1A (OUI DF-A9-FF)
        Count: 1
< ACL Data TX: Handle 2361 flags 0x00 dlen 21             #218 [hci1] 16.029526
      SMP: Pairing Confirm (0x03) len 16
        Confim value: 4ca50b02dfb30e740e3c525f5b2717fb
> HCI Event: Number of Completed Packets (0x13) plen 5    #219 [hci1] 16.203214
        Num handles: 1
        Handle: 2361 Address: DF:A9:FF:F6:B1:1A (OUI DF-A9-FF)
        Count: 1
        #218: len 21 (0 Kb/s)
        Latency: 173 msec (73-174 msec ~169 msec)
> ACL Data RX: Handle 2361 flags 0x02 dlen 21             #220 [hci1] 16.203571
      SMP: Pairing Random (0x04) len 16
        Random value: 1ff1e76f3148d52c0000000000000000
< HCI Command: Host Number of Com.. (0x03|0x0035) plen 5  #221 [hci1] 16.209216
        Num handles: 1
        Handle: 2361 Address: DF:A9:FF:F6:B1:1A (OUI DF-A9-FF)
        Count: 1
< ACL Data TX: Handle 2361 flags 0x00 dlen 21             #222 [hci1] 16.209269
      SMP: Pairing Random (0x04) len 16
        Random value: e7f7e0c2476823e41736a7e381bafb7c
> HCI Event: Number of Completed Packets (0x13) plen 5    #223 [hci1] 16.378066
        Num handles: 1
        Handle: 2361 Address: DF:A9:FF:F6:B1:1A (OUI DF-A9-FF)
        Count: 1
        #222: len 21 (1 Kb/s)
        Latency: 168 msec (73-174 msec ~169 msec)
> ACL Data RX: Handle 2361 flags 0x02 dlen 21             #224 [hci1] 16.465888
      SMP: Pairing Confirm (0x03) len 16
        Confim value: c42e4dbbec0e78ecb58f4bf3c59ec731
< HCI Command: Host Number of Com.. (0x03|0x0035) plen 5  #225 [hci1] 16.468938
        Num handles: 1
        Handle: 2361 Address: DF:A9:FF:F6:B1:1A (OUI DF-A9-FF)
        Count: 1
< ACL Data TX: Handle 2361 flags 0x00 dlen 21             #226 [hci1] 16.469022
      SMP: Pairing Confirm (0x03) len 16
        Confim value: b9da6e91f628f0c0ad4d8c98c06ee9e5
> HCI Event: Number of Completed Packets (0x13) plen 5    #227 [hci1] 16.640768
        Num handles: 1
        Handle: 2361 Address: DF:A9:FF:F6:B1:1A (OUI DF-A9-FF)
        Count: 1
        #226: len 21 (0 Kb/s)
        Latency: 171 msec (73-174 msec ~170 msec)
> ACL Data RX: Handle 2361 flags 0x02 dlen 21             #228 [hci1] 16.641122
      SMP: Pairing Random (0x04) len 16
        Random value: be1b4202f6834f330000000000000000
