Bluetooth monitor ver 5.72
= Note: Linux version 6.14.0-36-generic (x86_64)                       0.528397
= Note: Bluetooth subsystem version 2.22                               0.528399
= New Index: 00:00:00:00:00:00 (Primary,UART,hci1)              [hci1] 0.528399
= New Index: 48:5F:99:8E:E0:64 (Primary,USB,hci0)               [hci0] 0.528400
= Open Index: 00:00:00:00:00:00                                 [hci1] 0.642064
= Index Info: 00:00:00:00:00:00 (Nordic Semiconductor ASA)      [hci1] 0.642085
@ USER Open: main (privileged) version 2.22            {0x0001} [hci1] 0.642095
< HCI Command: Reset (0x03|0x0003) plen 0                    #1 [hci1] 0.643365
> HCI Event: Command Complete (0x0e) plen 4                  #2 [hci1] 0.643921
      Reset (0x03|0x0003) ncmd 1
        Status: Success (0x00)
< HCI Command: Read Local Supported... (0x04|0x0003) plen 0  #3 [hci1] 0.661937
> HCI Event: Command Complete (0x0e) plen 12                 #4 [hci1] 0.662496
      Read Local Supported Features (0x04|0x0003) ncmd 1
        Status: Success (0x00)
        Features: 0x00 0x00 0x00 0x00 0x60 0x00 0x00 0x00
          BR/EDR Not Supported
          LE Supported (Controller)
< HCI Command: Read Local Version In.. (0x04|0x0001) plen 0  #5 [hci1] 0.681622
> HCI Event: Command Complete (0x0e) plen 12                 #6 [hci1] 0.682070
      Read Local Version Information (0x04|0x0001) ncmd 1
        Status: Success (0x00)
        HCI version: Reserved (0x0f) - Revision 12393 (0x3069)
        LMP version: Reserved (0x0f) - Subversion 12393 (0x3069)
        Manufacturer: Nordic Semiconductor ASA (89)
< HCI Command: Read Local Supported... (0x04|0x0002) plen 0  #7 [hci1] 0.701487
> HCI Event: Command Complete (0x0e) plen 68                 #8 [hci1] 0.702587
      Read Local Supported Commands (0x04|0x0002) ncmd 1
        Status: Success (0x00)
        Commands: 119 entries
          Disconnect (Octet 0 - Bit 5)
          Read Remote Version Information (Octet 2 - Bit 7)
          Set Event Mask (Octet 5 - Bit 6)
          Reset (Octet 5 - Bit 7)
          Read Connection Accept Timeout (Octet 7 - Bit 2)
          Write Connection Accept Timeout (Octet 7 - Bit 3)
          Read Transmit Power Level (Octet 10 - Bit 2)
          Set Controller To Host Flow Control (Octet 10 - Bit 5)
          Host Buffer Size (Octet 10 - Bit 6)
          Host Number of Completed Packets (Octet 10 - Bit 7)
          Read Local Version Information (Octet 14 - Bit 3)
          Read Local Supported Features (Octet 14 - Bit 5)
          Read BD ADDR (Octet 15 - Bit 1)
          Read RSSI (Octet 15 - Bit 5)
          Set Event Mask Page 2 (Octet 22 - Bit 2)
          LE Set Event Mask (Octet 25 - Bit 0)
          LE Read Buffer Size (Octet 25 - Bit 1)
          LE Read Local Supported Features (Octet 25 - Bit 2)
          LE Set Random Address (Octet 25 - Bit 4)
          LE Set Advertising Parameters (Octet 25 - Bit 5)
          LE Read Advertising Channel TX Power (Octet 25 - Bit 6)
          LE Set Advertising Data (Octet 25 - Bit 7)
          LE Set Scan Response Data (Octet 26 - Bit 0)
          LE Set Advertise Enable (Octet 26 - Bit 1)
          LE Set Scan Parameters (Octet 26 - Bit 2)
          LE Set Scan Enable (Octet 26 - Bit 3)
          LE Create Connection (Octet 26 - Bit 4)
          LE Create Connection Cancel (Octet 26 - Bit 5)
          LE Read Accept List Size (Octet 26 - Bit 6)
          LE Clear Accept List (Octet 26 - Bit 7)
          LE Add Device To Accept List (Octet 27 - Bit 0)
          LE Remove Device From Accept List (Octet 27 - Bit 1)
          LE Connection Update (Octet 27 - Bit 2)
          LE Set Host Channel Classification (Octet 27 - Bit 3)
          LE Read Channel Map (Octet 27 - Bit 4)
          LE Read Remote Used Features (Octet 27 - Bit 5)
          LE Encrypt (Octet 27 - Bit 6)
          LE Rand (Octet 27 - Bit 7)
          LE Start Encryption (Octet 28 - Bit 0)
          LE Long Term Key Request Reply (Octet 28 - Bit 1)
          LE Long Term Key Request Neg Reply (Octet 28 - Bit 2)
          LE Read Supported States (Octet 28 - Bit 3)
          LE Receiver Test (Octet 28 - Bit 4)
          LE Transmitter Test (Octet 28 - Bit 5)
          LE Test End (Octet 28 - Bit 6)
          Read Authenticated Payload Timeout (Octet 32 - Bit 4)
          Write Authenticated Payload Timeout (Octet 32 - Bit 5)
          LE Set Data Length (Octet 33 - Bit 6)
          LE Read Suggested Default Data Length (Octet 33 - Bit 7)
          LE Write Suggested Default Data Length (Octet 34 - Bit 0)
          LE Add Device To Resolving List (Octet 34 - Bit 3)
          LE Remove Device From Resolving List (Octet 34 - Bit 4)
          LE Clear Resolving List (Octet 34 - Bit 5)
          LE Read Resolving List Size (Octet 34 - Bit 6)
          LE Set Address Resolution Enable (Octet 35 - Bit 1)
          LE Set Resolvable Private Address Timeout (Octet 35 - Bit 2)
          LE Read Maximum Data Length (Octet 35 - Bit 3)
          LE Read PHY (Octet 35 - Bit 4)
          LE Set Default PHY (Octet 35 - Bit 5)
          LE Set PHY (Octet 35 - Bit 6)
          LE Enhanced Receiver Test (Octet 35 - Bit 7)
          LE Enhanced Transmitter Test (Octet 36 - Bit 0)
          LE Set Advertising Set Random Address (Octet 36 - Bit 1)
          LE Set Extended Advertising Parameters (Octet 36 - Bit 2)
          LE Set Extended Advertising Data (Octet 36 - Bit 3)
          LE Set Extended Scan Response Data (Octet 36 - Bit 4)
          LE Set Extended Advertising Enable (Octet 36 - Bit 5)
          LE Read Maximum Advertising Data Length (Octet 36 - Bit 6)
          LE Read Number of Supported Advertising Sets (Octet 36 - Bit 7)
          LE Remove Advertising Set (Octet 37 - Bit 0)
          LE Clear Advertising Sets (Octet 37 - Bit 1)
          LE Set Periodic Advertising Parameters (Octet 37 - Bit 2)
          LE Set Periodic Advertising Data (Octet 37 - Bit 3)
          LE Set Periodic Advertising Enable (Octet 37 - Bit 4)
          LE Set Extended Scan Parameters (Octet 37 - Bit 5)
          LE Set Extended Scan Enable (Octet 37 - Bit 6)
          LE Extended Create Connection (Octet 37 - Bit 7)
          LE Periodic Advertising Create Sync (Octet 38 - Bit 0)
          LE Periodic Advertising Create Sync Cancel (Octet 38 - Bit 1)
          LE Periodic Advertising Terminate Sync (Octet 38 - Bit 2)
          LE Add Device To Periodic Advertiser List (Octet 38 - Bit 3)
          LE Remove Device From Periodic Advertiser List (Octet 38 - Bit 4)
          LE Clear Periodic Advertiser List (Octet 38 - Bit 5)
          LE Read Periodic Advertiser List Size (Octet 38 - Bit 6)
          LE Read Transmit Power (Octet 38 - Bit 7)
          LE Read RF Path Compensation (Octet 39 - Bit 0)
          LE Write RF Path Compensation (Octet 39 - Bit 1)
          LE Set Privacy Mode (Octet 39 - Bit 2)
          LE Periodic Advertising Receive Enable (Octet 40 - Bit 5)
          LE Periodic Advertising Sync Transfer (Octet 40 - Bit 6)
          LE Periodic Advertising Set Info Transfer (Octet 40 - Bit 7)
          LE Periodic Advertising Sync Transfer Parameters (Octet 41 - Bit 0)
          LE Set Default Periodic Advertisng Sync Transfer Parameters (Octet 41 - Bit 1)
          LE Read Buffer v2 (Octet 41 - Bit 5)
          LE Read ISO TX Sync (Octet 41 - Bit 6)
          LE Set Connected Isochronous Group Parameters (Octet 41 - Bit 7)
          LE Set Connected Isochronous Group Parameters Test (Octet 42 - Bit 0)
          LE Create Connected Isochronous Stream (Octet 42 - Bit 1)
          LE Remove Connected Isochronous Group (Octet 42 - Bit 2)
          LE Accept Connected Isochronous Stream Request (Octet 42 - Bit 3)
          LE Reject Connected Isochronous Stream Request (Octet 42 - Bit 4)
          LE Create Broadcast Isochronous Group (Octet 42 - Bit 5)
          LE Create Broadcast Isochronous Group Test (Octet 42 - Bit 6)
          LE Terminate Broadcast Isochronous Group (Octet 42 - Bit 7)
          LE Broadcast Isochronous Group Create Sync (Octet 43 - Bit 0)
          LE Broadcast Isochronous Group Terminate Sync (Octet 43 - Bit 1)
          LE Request Peer SCA (Octet 43 - Bit 2)
          LE Setup Isochronous Data Path (Octet 43 - Bit 3)
          LE Remove Isochronous Data Path (Octet 43 - Bit 4)
          LE Isochronous Transmit Test (Octet 43 - Bit 5)
          LE Isochronous Receive Test (Octet 43 - Bit 6)
          LE Isochronous Read Test Counters (Octet 43 - Bit 7)
          LE Isochronous Read Test Counters (Octet 44 - Bit 0)
          LE Set Host Feature (Octet 44 - Bit 1)
          Octet 44 - Bit 2 
          Octet 45 - Bit 6 
          Octet 46 - Bit 0 
          Octet 46 - Bit 1 
          Octet 46 - Bit 2 
< HCI Command: Host Buffer Size (0x03|0x0033) plen 7         #9 [hci1] 0.721520
        ACL MTU: 255  ACL max packet: 16
        SCO MTU: 0    SCO max packet: 0
> HCI Event: Command Complete (0x0e) plen 4                 #10 [hci1] 0.722047
      Host Buffer Size (0x03|0x0033) ncmd 1
        Status: Success (0x00)
< HCI Command: Set Controller To Ho.. (0x03|0x0031) plen 1  #11 [hci1] 0.741505
        Flow control: ACL Data Packets (0x01)
> HCI Event: Command Complete (0x0e) plen 4                 #12 [hci1] 0.741915
      Set Controller To Host Flow Control (0x03|0x0031) ncmd 1
        Status: Success (0x00)
< HCI Command: LE Read Local Suppor.. (0x08|0x0003) plen 0  #13 [hci1] 0.761548
> HCI Event: Command Complete (0x0e) plen 12                #14 [hci1] 0.762056
      LE Read Local Supported Features (0x08|0x0003) ncmd 1
        Status: Success (0x00)
        Features: 0xfd 0x79 0x00 0xf7 0x30 0x01 0x00 0x00
          LE Encryption
          Extended Reject Indication
          Peripheral-initiated Features Exchange
          LE Ping
          LE Data Packet Length Extension
          LL Privacy
          Extended Scanner Filter Policies
          LE 2M PHY
          LE Coded PHY
          LE Extended Advertising
          LE Periodic Advertising
          Channel Selection Algorithm #2
          Periodic Advertising Sync Transfer - Sender
          Periodic Advertising Sync Transfer - Recipient
          Sleep Clock Accuracy Updates
          Connected Isochronous Stream - Central
          Connected Isochronous Stream - Peripheral
          Isochronous Broadcaster
          Synchronized Receiver
          Periodic Advertising ADI support
          Connection Subrating
          Unknown features (0x0000010000000000)
< HCI Command: LE Set Host Feature (0x08|0x0074) plen 2     #15 [hci1] 0.781561
        Bit Number: 32
          Connected Isochronous Stream (Host Support)
        Bit Value: 1
> HCI Event: Command Complete (0x0e) plen 4                 #16 [hci1] 0.782000
      LE Set Host Feature (0x08|0x0074) ncmd 1
        Status: Success (0x00)
< HCI Command: LE Read Buffer v2 (0x08|0x0060) plen 0       #17 [hci1] 0.801529
> HCI Event: Command Complete (0x0e) plen 10                #18 [hci1] 0.801973
      LE Read Buffer v2 (0x08|0x0060) ncmd 1
        Status: Success (0x00)
        ACL MTU: 27
        ACL max packet: 3
        ISO MTU: 318
        ISO max packet: 3
< HCI Command: LE Read Maximum Adve.. (0x08|0x003a) plen 0  #19 [hci1] 0.821560
> HCI Event: Command Complete (0x0e) plen 6                 #20 [hci1] 0.821999
      LE Read Maximum Advertising Data Length (0x08|0x003a) ncmd 1
        Status: Success (0x00)
        Max length: 1650
< HCI Command: LE Read Supported St.. (0x08|0x001c) plen 0  #21 [hci1] 0.841526
> HCI Event: Command Complete (0x0e) plen 12                #22 [hci1] 0.841973
      LE Read Supported States (0x08|0x001c) ncmd 1
        Status: Success (0x00)
        States: 0x000003ff3e0306ff
          Non-connectable Advertising State
          Scannable Advertising State
          Connectable Advertising State
          High Duty Cycle Directed Advertising State
          Passive Scanning State
          Active Scanning State
          Initiating State
            and Connection State (Central Role)
          Connection State (Peripheral Role)
          Scannable Advertising State
            and Passive Scanning State
          Connectable Advertising State
            and Passive Scanning State
          Non-connectable Advertising State
            and Initiating State
          Scannable Advertising State
            and Initiating State
          Active Scanning State
            and Connection State (Central Role)
          Passive Scanning State
            and Connection State (Peripheral Role)
          Active Scanning State
            and Connection State (Peripheral Role)
          Initiating State
            and Connection State (Central Role)
            and Central Role & Central Role
          Low Duty Cycle Directed Advertising State
          Connectable Advertising State
            and Initiating State
            and Central Role & Peripheral Role
          High Duty Cycle Directed Advertising State
            and Initiating State
            and Central Role & Peripheral Role
          Low Duty Cycle Directed Advertising State
            and Initiating State
            and Central Role & Peripheral Role
          Connectable Advertising State
            and Connection State (Central Role)
            and Central Role & Peripheral Role
          High Duty Cycle Directed Advertising State
            and Connection State (Central Role)
            and Central Role & Peripheral Role
          Low Duty Cycle Directed Advertising State
            and Connection State (Central Role)
            and Central Role & Peripheral Role
          Connectable Advertising State
            and Connection State (Peripheral Role)
            and Central Role & Peripheral Role
          High Duty Cycle Directed Advertising State
            and Connection State (Peripheral Role)
            and Peripheral Role & Peripheral Role
          Low Duty Cycle Directed Advertising State
            and Connection State (Peripheral Role)
            and Peripheral Role & Peripheral Role
          Initiating State
            and Connection State (Peripheral Role)
            and Central Role & Peripheral Role
< HCI Command: LE Read Maximum Data.. (0x08|0x002f) plen 0  #23 [hci1] 0.861532
> HCI Event: Command Complete (0x0e) plen 12                #24 [hci1] 0.862062
      LE Read Maximum Data Length (0x08|0x002f) ncmd 1
        Status: Success (0x00)
        Max TX octets: 251
        Max TX time: 2704
        Max RX octets: 251
        Max RX time: 2704
< HCI Command: LE Write Suggested D.. (0x08|0x0024) plen 4  #25 [hci1] 0.881534
        TX octets: 251
        TX time: 2704
> HCI Event: Command Complete (0x0e) plen 4                 #26 [hci1] 0.881974
      LE Write Suggested Default Data Length (0x08|0x0024) ncmd 1
        Status: Success (0x00)
< HCI Command: LE Read Resolving Li.. (0x08|0x002a) plen 0  #27 [hci1] 0.901559
> HCI Event: Command Complete (0x0e) plen 5                 #28 [hci1] 0.902005
      LE Read Resolving List Size (0x08|0x002a) ncmd 1
        Status: Success (0x00)
        Size: 8
< HCI Command: LE Set Event Mask (0x08|0x0001) plen 8       #29 [hci1] 0.921535
        Mask: 0x000002023f87fa5e
          LE Advertising Report
          LE Connection Update Complete
          LE Read Remote Used Features Complete
          LE Long Term Key Request
          LE Data Length Change
          LE Enhanced Connection Complete
          LE PHY Update Complete
          LE Extended Advertising Report
          LE Periodic Advertising Sync Established
          LE Periodic Advertising Report
          LE Periodic Advertising Sync Lost
          LE Extended Scan Timeout
          LE Extended Advertising Set Terminated
          LE Scan Request Received
          LE Periodic Advertising Sync Transfer Rvc
          LE CIS Established
          LE CIS Request
          LE Create BIG Complete
          LE Terminate BIG Complete
          LE BIG Sync Estabilished Complete
          LE BIG Sync Lost
          LE BIG Info Advertising Report
          Unknown mask (0x0000020000000000)
> HCI Event: Command Complete (0x0e) plen 4                 #30 [hci1] 0.922026
      LE Set Event Mask (0x08|0x0001) ncmd 1
        Status: Success (0x00)
< HCI Command: Set Event Mask (0x03|0x0001) plen 8          #31 [hci1] 0.941535
        Mask: 0x2000800002008890
          Disconnection Complete
          Encryption Change
          Read Remote Version Information Complete
          Hardware Error
          Data Buffer Overflow
          Encryption Key Refresh Complete
          LE Meta
> HCI Event: Command Complete (0x0e) plen 4                 #32 [hci1] 0.942044
      Set Event Mask (0x03|0x0001) ncmd 1
        Status: Success (0x00)
< HCI Command: Read BD ADDR (0x04|0x0009) plen 0            #33 [hci1] 0.961531
> HCI Event: Command Complete (0x0e) plen 10                #34 [hci1] 0.962015
      Read BD ADDR (0x04|0x0009) ncmd 1
        Status: Success (0x00)
        Address: 00:00:00:00:00:00 (OUI 00-00-00)
< HCI Command: LE Set Random Address (0x08|0x0005) plen 6   #35 [hci1] 0.981549
        Address: D5:B6:CC:31:DB:3B (Static)
> HCI Event: Command Complete (0x0e) plen 4                 #36 [hci1] 0.982086
      LE Set Random Address (0x08|0x0005) ncmd 1
        Status: Success (0x00)
< HCI Command: LE Set Extended Adv.. (0x08|0x0036) plen 25  #37 [hci1] 3.512025
        Handle: 0x00
        Properties: 0x0013
          Connectable
          Scannable
          Use legacy advertising PDUs: ADV_IND
        Min advertising interval: 100.000 msec (0x00a0)
        Max advertising interval: 150.000 msec (0x00f0)
        Channel map: 37, 38, 39 (0x07)
        Own address type: Random (0x01)
        Peer address type: Public (0x00)
        Peer address: 00:00:00:00:00:00 (OUI 00-00-00)
        Filter policy: Allow Scan Request from Any, Allow Connect Request from Any (0x00)
        TX power: Host has no preference (0x7f)
        Primary PHY: LE 1M (0x01)
        Secondary max skip: 0x00
        Secondary PHY: LE 1M (0x01)
        SID: 0x00
        Scan request notifications: Disabled (0x00)
> HCI Event: Command Complete (0x0e) plen 5                 #38 [hci1] 3.512854
      LE Set Extended Advertising Parameters (0x08|0x0036) ncmd 1
        Status: Success (0x00)
        TX power (selected): 0 dbm (0x00)
< HCI Command: LE Set Advertising S.. (0x08|0x0035) plen 7  #39 [hci1] 3.521889
        Advertising handle: 0x00
        Advertising random address: D5:B6:CC:31:DB:3B (Static)
> HCI Event: Command Complete (0x0e) plen 4                 #40 [hci1] 3.522406
      LE Set Advertising Set Random Address (0x08|0x0035) ncmd 1
        Status: Success (0x00)
< HCI Command: LE Set Extended Adv.. (0x08|0x0037) plen 22  #41 [hci1] 3.541652
        Handle: 0x00
        Operation: Complete extended advertising data (0x03)
        Fragment preference: Minimize fragmentation (0x01)
        Data length: 0x12
        Flags: 0x06
          LE General Discoverable Mode
          BR/EDR Not Supported
        Name (complete): Tester_F6B11A
> HCI Event: Command Complete (0x0e) plen 4                 #42 [hci1] 3.542318
      LE Set Extended Advertising Data (0x08|0x0037) ncmd 1
        Status: Success (0x00)
< HCI Command: LE Set Extended Scan.. (0x08|0x0038) plen 4  #43 [hci1] 3.561581
        Handle: 0x00
        Operation: Complete scan response data (0x03)
        Fragment preference: Minimize fragmentation (0x01)
        Data length: 0x00
> HCI Event: Command Complete (0x0e) plen 4                 #44 [hci1] 3.562044
      LE Set Extended Scan Response Data (0x08|0x0038) ncmd 1
        Status: Success (0x00)
< HCI Command: LE Set Extended Adve.. (0x08|0x0039) plen 6  #45 [hci1] 3.581560
        Extended advertising: Enabled (0x01)
        Number of sets: 1 (0x01)
        Entry 0
          Handle: 0x00
          Duration: 0 ms (0x00)
          Max ext adv events: 0
> HCI Event: Command Complete (0x0e) plen 4                 #46 [hci1] 3.582073
      LE Set Extended Advertising Enable (0x08|0x0039) ncmd 1
        Status: Success (0x00)
> HCI Event: LE Meta Event (0x3e) plen 31                   #47 [hci1] 3.793977
      LE Enhanced Connection Complete (0x0a)
        Status: Success (0x00)
        Handle: 3459
        Role: Peripheral (0x01)
        Peer address type: Public (0x00)
        Peer address: DF:A9:FF:F6:B1:1A (OUI DF-A9-FF)
        Local resolvable private address: 00:00:00:00:00:00 (Non-Resolvable)
        Peer resolvable private address: 00:00:00:00:00:00 (Non-Resolvable)
        Connection interval: 87.50 msec (0x0046)
        Connection latency: 0 (0x0000)
        Supervision timeout: 25120 msec (0x09d0)
        Central clock accuracy: 0x01
> HCI Event: LE Meta Event (0x3e) plen 6                    #48 [hci1] 3.794054
      LE Advertising Set Terminated (0x12)
        Status: Success (0x00)
        Handle: 0
        Connection handle: 3459
        Number of completed extended advertising events: 0
< HCI Command: LE Read Remote Used... (0x08|0x0016) plen 2  #49 [hci1] 3.802540
        Handle: 3459 Address: DF:A9:FF:F6:B1:1A (OUI DF-A9-FF)
< ACL Data TX: Handle 3459 flags 0x00 dlen 7                #50 [hci1] 3.802576
      ATT: Exchange MTU Request (0x02) len 2
        Client RX MTU: 251
> HCI Event: Command Status (0x0f) plen 4                   #51 [hci1] 3.803012
      LE Read Remote Used Features (0x08|0x0016) ncmd 1
        Status: Success (0x00)
> HCI Event: Number of Completed Packets (0x13) plen 5      #52 [hci1] 3.969952
        Num handles: 1
        Handle: 3459 Address: DF:A9:FF:F6:B1:1A (OUI DF-A9-FF)
        Count: 1
        #50: len 7 (0 Kb/s)
        Latency: 167 msec (167-167 msec ~167 msec)
> HCI Event: LE Meta Event (0x3e) plen 12                   #53 [hci1] 4.057922
      LE Read Remote Used Features (0x04)
        Status: Success (0x00)
        Handle: 3459 Address: DF:A9:FF:F6:B1:1A (OUI DF-A9-FF)
        Features: 0x2d 0x49 0x00 0xf7 0x67 0xd9 0x00 0x80
          LE Encryption
          Extended Reject Indication
          Peripheral-initiated Features Exchange
          LE Data Packet Length Extension
          LE 2M PHY
          LE Coded PHY
          Channel Selection Algorithm #2
          Periodic Advertising Sync Transfer - Sender
          Periodic Advertising Sync Transfer - Recipient
          Sleep Clock Accuracy Updates
          Connected Isochronous Stream - Central
          Connected Isochronous Stream - Peripheral
          Isochronous Broadcaster
          Synchronized Receiver
          Connected Isochronous Stream (Host Support)
          LE Power Control Request
          LE Power Control Request
          Connection Subrating
          Connection Subrating (Host Support)
          Unknown features (0x8000d90000000000)
> ACL Data RX: Handle 3459 flags 0x02 dlen 11               #54 [hci1] 6.507528
      SMP: Pairing Request (0x01) len 6
        IO capability: KeyboardDisplay (0x04)
        OOB data: Authentication data not present (0x00)
        Authentication requirement: Bonding, MITM, SC, No Keypresses (0x0d)
        Max encryption key size: 16
        Initiator key distribution: EncKey IdKey (0x03)
        Responder key distribution: EncKey IdKey Sign (0x07)
> ACL Data RX: Handle 3459 flags 0x02 dlen 7                #55 [hci1] 6.507991
      ATT: Exchange MTU Response (0x03) len 2
        Server RX MTU: 23
< HCI Command: Host Number of Compl.. (0x03|0x0035) plen 5  #56 [hci1] 6.522096
        Num handles: 1
        Handle: 3459 Address: DF:A9:FF:F6:B1:1A (OUI DF-A9-FF)
        Count: 1
< ACL Data TX: Handle 3459 flags 0x00 dlen 11               #57 [hci1] 6.522179
      SMP: Pairing Response (0x02) len 6
        IO capability: DisplayOnly (0x00)
        OOB data: Authentication data not present (0x00)
        Authentication requirement: Bonding, No MITM, SC, No Keypresses (0x09)
        Max encryption key size: 16
        Initiator key distribution: IdKey (0x02)
        Responder key distribution: <none> (0x00)
< HCI Command: Host Number of Compl.. (0x03|0x0035) plen 5  #58 [hci1] 6.522445
        Num handles: 1
        Handle: 3459 Address: DF:A9:FF:F6:B1:1A (OUI DF-A9-FF)
        Count: 1
> HCI Event: Number of Completed Packets (0x13) plen 5      #59 [hci1] 6.682659
        Num handles: 1
        Handle: 3459 Address: DF:A9:FF:F6:B1:1A (OUI DF-A9-FF)
        Count: 1
        #57: len 11 (0 Kb/s)
        Latency: 160 msec (160-167 msec ~163 msec)
> ACL Data RX: Handle 3459 flags 0x02 dlen 27               #60 [hci1] 6.682977
> ACL Data RX: Handle 3459 flags 0x01 dlen 27               #61 [hci1] 6.683521
> ACL Data RX: Handle 3459 flags 0x01 dlen 15               #62 [hci1] 6.683985
      SMP: Pairing Public Key (0x0c) len 64
        X: fc1385f1448e997df3d7433cac789ad8437651ce2ae23862aab2b6f08e0f141c
        Y: b3df4ae193c49a6a49313a5843dd7117f9fe7d46bd652304829f747cb5a482f7
< HCI Command: Host Number of Compl.. (0x03|0x0035) plen 5  #63 [hci1] 6.702259
        Num handles: 1
        Handle: 3459 Address: DF:A9:FF:F6:B1:1A (OUI DF-A9-FF)
        Count: 1
< HCI Command: Host Number of Compl.. (0x03|0x0035) plen 5  #64 [hci1] 6.702517
        Num handles: 1
        Handle: 3459 Address: DF:A9:FF:F6:B1:1A (OUI DF-A9-FF)
        Count: 1
< HCI Command: Host Number of Compl.. (0x03|0x0035) plen 5  #65 [hci1] 6.702849
        Num handles: 1
        Handle: 3459 Address: DF:A9:FF:F6:B1:1A (OUI DF-A9-FF)
        Count: 1
< ACL Data TX: Handle 3459 flags 0x00 dlen 27               #66 [hci1] 6.702956
< ACL Data TX: Handle 3459 flags 0x01 dlen 27               #67 [hci1] 6.702974
< ACL Data TX: Handle 3459 flags 0x01 dlen 15               #68 [hci1] 6.702977
      SMP: Pairing Public Key (0x0c) len 64
        X: 98308440221e2d910f0e54b71e7ec652857aa9b5a0dc65028824cc19db1226e9
        Y: 67a4816bcb62efb21701e31fdb27561a6217575fb007a8bbdabe7e28b6f68482
> HCI Event: Number of Completed Packets (0x13) plen 5      #69 [hci1] 6.770528
        Num handles: 1
        Handle: 3459 Address: DF:A9:FF:F6:B1:1A (OUI DF-A9-FF)
        Count: 1
        #66: len 27 (3 Kb/s)
        Latency: 67 msec (67-167 msec ~115 msec)
> HCI Event: Number of Completed Packets (0x13) plen 5      #70 [hci1] 6.771182
        Num handles: 1
        Handle: 3459 Address: DF:A9:FF:F6:B1:1A (OUI DF-A9-FF)
        Count: 1
        #67: len 27 (3 Kb/s)
        Latency: 68 msec (67-167 msec ~91 msec)
> HCI Event: Number of Completed Packets (0x13) plen 5      #71 [hci1] 6.857423
        Num handles: 1
        Handle: 3459 Address: DF:A9:FF:F6:B1:1A (OUI DF-A9-FF)
        Count: 1
        #68: len 15 (0 Kb/s)
        Latency: 154 msec (67-167 msec ~123 msec)
> ACL Data RX: Handle 3459 flags 0x02 dlen 21               #72 [hci1] 7.732701
      SMP: Pairing Confirm (0x03) len 16
        Confim value: 021c0aa6da2a2ab37e88f4dfebab2085
< HCI Command: Host Number of Compl.. (0x03|0x0035) plen 5  #73 [hci1] 7.742165
        Num handles: 1
        Handle: 3459 Address: DF:A9:FF:F6:B1:1A (OUI DF-A9-FF)
        Count: 1
< ACL Data TX: Handle 3459 flags 0x00 dlen 21               #74 [hci1] 7.742320
      SMP: Pairing Confirm (0x03) len 16
        Confim value: 4a2721ba81309c93224b37ffb87d679a
> HCI Event: Number of Completed Packets (0x13) plen 5      #75 [hci1] 7.907618
        Num handles: 1
        Handle: 3459 Address: DF:A9:FF:F6:B1:1A (OUI DF-A9-FF)
        Count: 1
        #74: len 21 (1 Kb/s)
        Latency: 165 msec (67-167 msec ~144 msec)
> ACL Data RX: Handle 3459 flags 0x02 dlen 21               #76 [hci1] 7.907913
      SMP: Pairing Random (0x04) len 16
        Random value: 8827d201a612b3ba0000000000000000
< HCI Command: Host Number of Compl.. (0x03|0x0035) plen 5  #77 [hci1] 7.922342
        Num handles: 1
        Handle: 3459 Address: DF:A9:FF:F6:B1:1A (OUI DF-A9-FF)
        Count: 1
< ACL Data TX: Handle 3459 flags 0x00 dlen 21               #78 [hci1] 7.922430
      SMP: Pairing Random (0x04) len 16
        Random value: 8e6108f966a694cbe26df70bb96773e6
> HCI Event: Number of Completed Packets (0x13) plen 5      #79 [hci1] 8.082328
        Num handles: 1
        Handle: 3459 Address: DF:A9:FF:F6:B1:1A (OUI DF-A9-FF)
        Count: 1
        #78: len 21 (1 Kb/s)
        Latency: 159 msec (67-167 msec ~152 msec)
> ACL Data RX: Handle 3459 flags 0x02 dlen 21               #80 [hci1] 8.170204
      SMP: Pairing Confirm (0x03) len 16
        Confim value: badc0b9dd7589665ee6f2ddff3b32ae4
< HCI Command: Host Number of Compl.. (0x03|0x0035) plen 5  #81 [hci1] 8.182127
        Num handles: 1
        Handle: 3459 Address: DF:A9:FF:F6:B1:1A (OUI DF-A9-FF)
        Count: 1
< ACL Data TX: Handle 3459 flags 0x00 dlen 21               #82 [hci1] 8.182200
      SMP: Pairing Confirm (0x03) len 16
        Confim value: 4f3bf9629af81cce52c784edde6a0de4
> HCI Event: Number of Completed Packets (0x13) plen 5      #83 [hci1] 8.345090
        Num handles: 1
        Handle: 3459 Address: DF:A9:FF:F6:B1:1A (OUI DF-A9-FF)
        Count: 1
        #82: len 21 (1 Kb/s)
        Latency: 162 msec (67-167 msec ~157 msec)
> ACL Data RX: Handle 3459 flags 0x02 dlen 21               #84 [hci1] 8.345391
      SMP: Pairing Random (0x04) len 16
        Random value: 25ae244d85bd1ce10000000000000000
< HCI Command: Host Number of Compl.. (0x03|0x0035) plen 5  #85 [hci1] 8.362246
        Num handles: 1
        Handle: 3459 Address: DF:A9:FF:F6:B1:1A (OUI DF-A9-FF)
        Count: 1
< ACL Data TX: Handle 3459 flags 0x00 dlen 21               #86 [hci1] 8.362352
      SMP: Pairing Random (0x04) len 16
        Random value: 4d02679f89a05211af56d8b3da64d21e
> HCI Event: Number of Completed Packets (0x13) plen 5      #87 [hci1] 8.519941
        Num handles: 1
        Handle: 3459 Address: DF:A9:FF:F6:B1:1A (OUI DF-A9-FF)
        Count: 1
        #86: len 21 (1 Kb/s)
        Latency: 157 msec (67-167 msec ~157 msec)
> ACL Data RX: Handle 3459 flags 0x02 dlen 21               #88 [hci1] 8.607767
      SMP: Pairing Confirm (0x03) len 16
        Confim value: 5222aa46c82be25ef2ea976e6d388fe8
< HCI Command: Host Number of Compl.. (0x03|0x0035) plen 5  #89 [hci1] 8.622084
        Num handles: 1
        Handle: 3459 Address: DF:A9:FF:F6:B1:1A (OUI DF-A9-FF)
        Count: 1
< ACL Data TX: Handle 3459 flags 0x00 dlen 21               #90 [hci1] 8.622154
      SMP: Pairing Confirm (0x03) len 16
        Confim value: e18b7b06ac8cf9055d0b6d1496e6ac26
> HCI Event: Number of Completed Packets (0x13) plen 5      #91 [hci1] 8.782526
        Num handles: 1
        Handle: 3459 Address: DF:A9:FF:F6:B1:1A (OUI DF-A9-FF)
        Count: 1
        #90: len 21 (1 Kb/s)
        Latency: 160 msec (67-167 msec ~158 msec)
> ACL Data RX: Handle 3459 flags 0x02 dlen 21               #92 [hci1] 8.782863
      SMP: Pairing Random (0x04) len 16
        Random value: 5f36e0d95386d8cf0000000000000000
< HCI Command: Host Number of Compl.. (0x03|0x0035) plen 5  #93 [hci1] 8.802163
        Num handles: 1
        Handle: 3459 Address: DF:A9:FF:F6:B1:1A (OUI DF-A9-FF)
        Count: 1
< ACL Data TX: Handle 3459 flags 0x00 dlen 21               #94 [hci1] 8.802215
      SMP: Pairing Random (0x04) len 16
        Random value: 5e8286bc235a02440d0c3424a2acf8fd
> HCI Event: Number of Completed Packets (0x13) plen 5      #95 [hci1] 8.957346
        Num handles: 1
        Handle: 3459 Address: DF:A9:FF:F6:B1:1A (OUI DF-A9-FF)
        Count: 1
        #94: len 21 (1 Kb/s)
        Latency: 155 msec (67-167 msec ~157 msec)
> ACL Data RX: Handle 3459 flags 0x02 dlen 21               #96 [hci1] 9.045287
      SMP: Pairing Confirm (0x03) len 16
        Confim value: 6ffb0c42e2b116b6aeecca8c9952f8b0
< HCI Command: Host Number of Compl.. (0x03|0x0035) plen 5  #97 [hci1] 9.062120
        Num handles: 1
        Handle: 3459 Address: DF:A9:FF:F6:B1:1A (OUI DF-A9-FF)
        Count: 1
< ACL Data TX: Handle 3459 flags 0x00 dlen 21               #98 [hci1] 9.062212
      SMP: Pairing Confirm (0x03) len 16
        Confim value: 00aaebc69aa57d773e7a768856445e31
> HCI Event: Number of Completed Packets (0x13) plen 5      #99 [hci1] 9.220046
        Num handles: 1
        Handle: 3459 Address: DF:A9:FF:F6:B1:1A (OUI DF-A9-FF)
        Count: 1
        #98: len 21 (1 Kb/s)
        Latency: 157 msec (67-167 msec ~157 msec)
> ACL Data RX: Handle 3459 flags 0x02 dlen 21              #100 [hci1] 9.220424
      SMP: Pairing Random (0x04) len 16
        Random value: c5255da5e928e5390000000000000000
< HCI Command: Host Number of Comp.. (0x03|0x0035) plen 5  #101 [hci1] 9.222490
        Num handles: 1
        Handle: 3459 Address: DF:A9:FF:F6:B1:1A (OUI DF-A9-FF)
        Count: 1
< ACL Data TX: Handle 3459 flags 0x00 dlen 21              #102 [hci1] 9.222577
      SMP: Pairing Random (0x04) len 16
        Random value: 5c4a1bcadd27bd58e945097b00bad7ac
> HCI Event: Number of Completed Packets (0x13) plen 5     #103 [hci1] 9.394908
        Num handles: 1
        Handle: 3459 Address: DF:A9:FF:F6:B1:1A (OUI DF-A9-FF)
        Count: 1
        #102: len 21 (0 Kb/s)
        Latency: 172 msec (67-172 msec ~164 msec)
> ACL Data RX: Handle 3459 flags 0x02 dlen 21              #104 [hci1] 9.482761
      SMP: Pairing Confirm (0x03) len 16
        Confim value: a1f2cf0a931c784b975ea5ce2165c384
< HCI Command: Host Number of Comp.. (0x03|0x0035) plen 5  #105 [hci1] 9.502043
        Num handles: 1
        Handle: 3459 Address: DF:A9:FF:F6:B1:1A (OUI DF-A9-FF)
        Count: 1
< ACL Data TX: Handle 3459 flags 0x00 dlen 21              #106 [hci1] 9.502126
      SMP: Pairing Confirm (0x03) len 16
        Confim value: 7c605047dc4d499179aa502d3f28bd35
> HCI Event: Number of Completed Packets (0x13) plen 5     #107 [hci1] 9.657565
        Num handles: 1
        Handle: 3459 Address: DF:A9:FF:F6:B1:1A (OUI DF-A9-FF)
        Count: 1
        #106: len 21 (1 Kb/s)
        Latency: 155 msec (67-172 msec ~160 msec)
> ACL Data RX: Handle 3459 flags 0x02 dlen 21              #108 [hci1] 9.657887
      SMP: Pairing Random (0x04) len 16
        Random value: f7aeaee9beaad5a20000000000000000
< HCI Command: Host Number of Comp.. (0x03|0x0035) plen 5  #109 [hci1] 9.662392
        Num handles: 1
        Handle: 3459 Address: DF:A9:FF:F6:B1:1A (OUI DF-A9-FF)
        Count: 1
< ACL Data TX: Handle 3459 flags 0x00 dlen 21              #110 [hci1] 9.662471
      SMP: Pairing Random (0x04) len 16
        Random value: 32527e6e64e79f33b2e374394db8ab2d
> HCI Event: Number of Completed Packets (0x13) plen 5     #111 [hci1] 9.832282
        Num handles: 1
        Handle: 3459 Address: DF:A9:FF:F6:B1:1A (OUI DF-A9-FF)
        Count: 1
        #110: len 21 (0 Kb/s)
        Latency: 169 msec (67-172 msec ~164 msec)
> ACL Data RX: Handle 3459 flags 0x02 dlen 21              #112 [hci1] 9.920191
      SMP: Pairing Confirm (0x03) len 16
        Confim value: 80f52b72366a26bd4bf9bb4cdf67582d
< HCI Command: Host Number of Comp.. (0x03|0x0035) plen 5  #113 [hci1] 9.922144
        Num handles: 1
        Handle: 3459 Address: DF:A9:FF:F6:B1:1A (OUI DF-A9-FF)
        Count: 1
< ACL Data TX: Handle 3459 flags 0x00 dlen 21              #114 [hci1] 9.922265
      SMP: Pairing Confirm (0x03) len 16
        Confim value: 76f46cd72220ac95e20a3336a1207b11
> HCI Event: Number of Completed Packets (0x13) plen 5    #115 [hci1] 10.095183
        Num handles: 1
        Handle: 3459 Address: DF:A9:FF:F6:B1:1A (OUI DF-A9-FF)
        Count: 1
        #114: len 21 (0 Kb/s)
        Latency: 172 msec (67-172 msec ~168 msec)
> ACL Data RX: Handle 3459 flags 0x02 dlen 21             #116 [hci1] 10.095362
      SMP: Pairing Random (0x04) len 16
        Random value: 23df72efdd2b5d4f0000000000000000
< HCI Command: Host Number of Com.. (0x03|0x0035) plen 5  #117 [hci1] 10.102328
        Num handles: 1
        Handle: 3459 Address: DF:A9:FF:F6:B1:1A (OUI DF-A9-FF)
        Count: 1
< ACL Data TX: Handle 3459 flags 0x00 dlen 21             #118 [hci1] 10.102429
      SMP: Pairing Random (0x04) len 16
        Random value: dddbdfe2838e9a8cc6964353c850fef7
> HCI Event: Number of Completed Packets (0x13) plen 5    #119 [hci1] 10.269820
        Num handles: 1
        Handle: 3459 Address: DF:A9:FF:F6:B1:1A (OUI DF-A9-FF)
        Count: 1
        #118: len 21 (1 Kb/s)
        Latency: 167 msec (67-172 msec ~168 msec)
> ACL Data RX: Handle 3459 flags 0x02 dlen 21             #120 [hci1] 10.357731
      SMP: Pairing Confirm (0x03) len 16
        Confim value: 730f0769d8adb389726cb0cde8ad45a6
< HCI Command: Host Number of Com.. (0x03|0x0035) plen 5  #121 [hci1] 10.362115
        Num handles: 1
        Handle: 3459 Address: DF:A9:FF:F6:B1:1A (OUI DF-A9-FF)
        Count: 1
< ACL Data TX: Handle 3459 flags 0x00 dlen 21             #122 [hci1] 10.362243
      SMP: Pairing Confirm (0x03) len 16
        Confim value: 9a8670cb7e811e89fff2373ce6d93f59
> HCI Event: Number of Completed Packets (0x13) plen 5    #123 [hci1] 10.532557
        Num handles: 1
        Handle: 3459 Address: DF:A9:FF:F6:B1:1A (OUI DF-A9-FF)
        Count: 1
        #122: len 21 (0 Kb/s)
        Latency: 170 msec (67-172 msec ~169 msec)
> ACL Data RX: Handle 3459 flags 0x02 dlen 21             #124 [hci1] 10.532901
      SMP: Pairing Random (0x04) len 16
        Random value: dd04f5d1522f90460000000000000000
< HCI Command: Host Number of Com.. (0x03|0x0035) plen 5  #125 [hci1] 10.542303
        Num handles: 1
        Handle: 3459 Address: DF:A9:FF:F6:B1:1A (OUI DF-A9-FF)
        Count: 1
< ACL Data TX: Handle 3459 flags 0x00 dlen 21             #126 [hci1] 10.542354
      SMP: Pairing Random (0x04) len 16
        Random value: eb9f1915536596b6fc3db1c86b2b1970
> HCI Event: Number of Completed Packets (0x13) plen 5    #127 [hci1] 10.707347
        Num handles: 1
        Handle: 3459 Address: DF:A9:FF:F6:B1:1A (OUI DF-A9-FF)
        Count: 1
        #126: len 21 (1 Kb/s)
        Latency: 164 msec (67-172 msec ~167 msec)
> ACL Data RX: Handle 3459 flags 0x02 dlen 21             #128 [hci1] 10.795210
      SMP: Pairing Confirm (0x03) len 16
        Confim value: 8696e747c48c8b604d1be3c111d50ddb
< HCI Command: Host Number of Com.. (0x03|0x0035) plen 5  #129 [hci1] 10.802167
        Num handles: 1
        Handle: 3459 Address: DF:A9:FF:F6:B1:1A (OUI DF-A9-FF)
        Count: 1
< ACL Data TX: Handle 3459 flags 0x00 dlen 21             #130 [hci1] 10.802308
      SMP: Pairing Confirm (0x03) len 16
        Confim value: 1529ef9b5e7dc8f72c70bd1abee677f5
> HCI Event: Number of Completed Packets (0x13) plen 5    #131 [hci1] 10.969996
        Num handles: 1
        Handle: 3459 Address: DF:A9:FF:F6:B1:1A (OUI DF-A9-FF)
        Count: 1
        #130: len 21 (1 Kb/s)
        Latency: 167 msec (67-172 msec ~167 msec)
> ACL Data RX: Handle 3459 flags 0x02 dlen 21             #132 [hci1] 10.970353
      SMP: Pairing Random (0x04) len 16
        Random value: 048987d8a2bdc0300000000000000000
< HCI Command: Host Number of Com.. (0x03|0x0035) plen 5  #133 [hci1] 10.982347
        Num handles: 1
        Handle: 3459 Address: DF:A9:FF:F6:B1:1A (OUI DF-A9-FF)
        Count: 1
< ACL Data TX: Handle 3459 flags 0x00 dlen 21             #134 [hci1] 10.982409
      SMP: Pairing Random (0x04) len 16
        Random value: 5c794dc9ad9f2c3f295ebd5ad5e1c3cf
> HCI Event: Number of Completed Packets (0x13) plen 5    #135 [hci1] 11.144763
        Num handles: 1
        Handle: 3459 Address: DF:A9:FF:F6:B1:1A (OUI DF-A9-FF)
        Count: 1
        #134: len 21 (1 Kb/s)
        Latency: 162 msec (67-172 msec ~164 msec)
> ACL Data RX: Handle 3459 flags 0x02 dlen 21             #136 [hci1] 11.232683
      SMP: Pairing Confirm (0x03) len 16
        Confim value: 2281863daf311fd63790df7597d2d76f
< HCI Command: Host Number of Com.. (0x03|0x0035) plen 5  #137 [hci1] 11.242008
        Num handles: 1
        Handle: 3459 Address: DF:A9:FF:F6:B1:1A (OUI DF-A9-FF)
        Count: 1
< ACL Data TX: Handle 3459 flags 0x00 dlen 21             #138 [hci1] 11.242056
      SMP: Pairing Confirm (0x03) len 16
        Confim value: f0b339cb88b89830d55c690488696fec
> HCI Event: Number of Completed Packets (0x13) plen 5    #139 [hci1] 11.407621
        Num handles: 1
        Handle: 3459 Address: DF:A9:FF:F6:B1:1A (OUI DF-A9-FF)
        Count: 1
        #138: len 21 (1 Kb/s)
        Latency: 165 msec (67-172 msec ~165 msec)
> ACL Data RX: Handle 3459 flags 0x02 dlen 21             #140 [hci1] 11.407871
      SMP: Pairing Random (0x04) len 16
        Random value: 9f577658d317b0790000000000000000
< HCI Command: Host Number of Com.. (0x03|0x0035) plen 5  #141 [hci1] 11.422155
        Num handles: 1
        Handle: 3459 Address: DF:A9:FF:F6:B1:1A (OUI DF-A9-FF)
        Count: 1
< ACL Data TX: Handle 3459 flags 0x00 dlen 21             #142 [hci1] 11.422177
      SMP: Pairing Random (0x04) len 16
        Random value: 5c2fff312cdf99c9491988e877355a9a
> HCI Event: Number of Completed Packets (0x13) plen 5    #143 [hci1] 11.582333
        Num handles: 1
        Handle: 3459 Address: DF:A9:FF:F6:B1:1A (OUI DF-A9-FF)
        Count: 1
        #142: len 21 (1 Kb/s)
        Latency: 160 msec (67-172 msec ~162 msec)
> ACL Data RX: Handle 3459 flags 0x02 dlen 21             #144 [hci1] 11.670186
      SMP: Pairing Confirm (0x03) len 16
        Confim value: 84041aff1f405052892af0c95f7b3433
< HCI Command: Host Number of Com.. (0x03|0x0035) plen 5  #145 [hci1] 11.681957
        Num handles: 1
        Handle: 3459 Address: DF:A9:FF:F6:B1:1A (OUI DF-A9-FF)
        Count: 1
< ACL Data TX: Handle 3459 flags 0x00 dlen 21             #146 [hci1] 11.682001
      SMP: Pairing Confirm (0x03) len 16
        Confim value: d9845d353b017165b35fbbbfa66d1f8c
> HCI Event: Number of Completed Packets (0x13) plen 5    #147 [hci1] 11.844989
        Num handles: 1
        Handle: 3459 Address: DF:A9:FF:F6:B1:1A (OUI DF-A9-FF)
        Count: 1
        #146: len 21 (1 Kb/s)
        Latency: 162 msec (67-172 msec ~162 msec)
> ACL Data RX: Handle 3459 flags 0x02 dlen 21             #148 [hci1] 11.845353
      SMP: Pairing Random (0x04) len 16
        Random value: 9e432015a9f30b330000000000000000
< HCI Command: Host Number of Com.. (0x03|0x0035) plen 5  #149 [hci1] 11.862394
        Num handles: 1
        Handle: 3459 Address: DF:A9:FF:F6:B1:1A (OUI DF-A9-FF)
        Count: 1
< ACL Data TX: Handle 3459 flags 0x00 dlen 21             #150 [hci1] 11.862576
      SMP: Pairing Random (0x04) len 16
        Random value: c629a3a987d808e808655d558dfc1155
> HCI Event: Number of Completed Packets (0x13) plen 5    #151 [hci1] 12.019799
        Num handles: 1
        Handle: 3459 Address: DF:A9:FF:F6:B1:1A (OUI DF-A9-FF)
        Count: 1
        #150: len 21 (1 Kb/s)
        Latency: 157 msec (67-172 msec ~160 msec)
> ACL Data RX: Handle 3459 flags 0x02 dlen 21             #152 [hci1] 12.107737
      SMP: Pairing Confirm (0x03) len 16
        Confim value: 68a6614a142dad325793d2b9ce04233c
< HCI Command: Host Number of Com.. (0x03|0x0035) plen 5  #153 [hci1] 12.122137
        Num handles: 1
        Handle: 3459 Address: DF:A9:FF:F6:B1:1A (OUI DF-A9-FF)
        Count: 1
< ACL Data TX: Handle 3459 flags 0x00 dlen 21             #154 [hci1] 12.122220
      SMP: Pairing Confirm (0x03) len 16
        Confim value: fc3df77f1bda75418e6c5f43376a6dbc
> HCI Event: Number of Completed Packets (0x13) plen 5    #155 [hci1] 12.282500
        Num handles: 1
        Handle: 3459 Address: DF:A9:FF:F6:B1:1A (OUI DF-A9-FF)
        Count: 1
        #154: len 21 (1 Kb/s)
        Latency: 160 msec (67-172 msec ~160 msec)
> ACL Data RX: Handle 3459 flags 0x02 dlen 21             #156 [hci1] 12.282901
      SMP: Pairing Random (0x04) len 16
        Random value: 96ecf6208daec7480000000000000000
< HCI Command: Host Number of Com.. (0x03|0x0035) plen 5  #157 [hci1] 12.302135
        Num handles: 1
        Handle: 3459 Address: DF:A9:FF:F6:B1:1A (OUI DF-A9-FF)
        Count: 1
< ACL Data TX: Handle 3459 flags 0x00 dlen 21             #158 [hci1] 12.302224
      SMP: Pairing Random (0x04) len 16
        Random value: 92f20f6ad8f13724432c7fd6001c45ff
> HCI Event: Number of Completed Packets (0x13) plen 5    #159 [hci1] 12.457306
        Num handles: 1
        Handle: 3459 Address: DF:A9:FF:F6:B1:1A (OUI DF-A9-FF)
        Count: 1
        #158: len 21 (1 Kb/s)
        Latency: 155 msec (67-172 msec ~157 msec)
> ACL Data RX: Handle 3459 flags 0x02 dlen 21             #160 [hci1] 12.545182
      SMP: Pairing Confirm (0x03) len 16
        Confim value: 7bada8192cb027f9d82e561d46ffb7f8
< HCI Command: Host Number of Com.. (0x03|0x0035) plen 5  #161 [hci1] 12.562202
        Num handles: 1
        Handle: 3459 Address: DF:A9:FF:F6:B1:1A (OUI DF-A9-FF)
        Count: 1
< ACL Data TX: Handle 3459 flags 0x00 dlen 21             #162 [hci1] 12.562311
      SMP: Pairing Confirm (0x03) len 16
        Confim value: 58e473dc1e7e71dc3c8d69d64f9bb01f
> HCI Event: Number of Completed Packets (0x13) plen 5    #163 [hci1] 12.719966
        Num handles: 1
        Handle: 3459 Address: DF:A9:FF:F6:B1:1A (OUI DF-A9-FF)
        Count: 1
        #162: len 21 (1 Kb/s)
        Latency: 157 msec (67-172 msec ~157 msec)
> ACL Data RX: Handle 3459 flags 0x02 dlen 21             #164 [hci1] 12.720303
      SMP: Pairing Random (0x04) len 16
        Random value: d4f2ef3fc83be6b90000000000000000
< HCI Command: Host Number of Com.. (0x03|0x0035) plen 5  #165 [hci1] 12.722344
        Num handles: 1
        Handle: 3459 Address: DF:A9:FF:F6:B1:1A (OUI DF-A9-FF)
        Count: 1
< ACL Data TX: Handle 3459 flags 0x00 dlen 21             #166 [hci1] 12.722444
      SMP: Pairing Random (0x04) len 16
        Random value: 23ac32ebbb5e14c8a6b9622f296d277f
> HCI Event: Number of Completed Packets (0x13) plen 5    #167 [hci1] 12.894811
        Num handles: 1
        Handle: 3459 Address: DF:A9:FF:F6:B1:1A (OUI DF-A9-FF)
        Count: 1
        #166: len 21 (0 Kb/s)
        Latency: 172 msec (67-172 msec ~165 msec)
> ACL Data RX: Handle 3459 flags 0x02 dlen 21             #168 [hci1] 12.982691
      SMP: Pairing Confirm (0x03) len 16
        Confim value: b7cede135d1a37a72dd4339f9a6b8333
< HCI Command: Host Number of Com.. (0x03|0x0035) plen 5  #169 [hci1] 13.002116
        Num handles: 1
        Handle: 3459 Address: DF:A9:FF:F6:B1:1A (OUI DF-A9-FF)
        Count: 1
< ACL Data TX: Handle 3459 flags 0x00 dlen 21             #170 [hci1] 13.002174
      SMP: Pairing Confirm (0x03) len 16
        Confim value: 7117e2736e9b993455cfc6b5afa6cdb9
> HCI Event: Number of Completed Packets (0x13) plen 5    #171 [hci1] 13.157504
        Num handles: 1
        Handle: 3459 Address: DF:A9:FF:F6:B1:1A (OUI DF-A9-FF)
        Count: 1
        #170: len 21 (1 Kb/s)
        Latency: 155 msec (67-172 msec ~160 msec)
> ACL Data RX: Handle 3459 flags 0x02 dlen 21             #172 [hci1] 13.157871
      SMP: Pairing Random (0x04) len 16
        Random value: a1411664017df18b0000000000000000
< HCI Command: Host Number of Com.. (0x03|0x0035) plen 5  #173 [hci1] 13.162347
        Num handles: 1
        Handle: 3459 Address: DF:A9:FF:F6:B1:1A (OUI DF-A9-FF)
        Count: 1
< ACL Data TX: Handle 3459 flags 0x00 dlen 21             #174 [hci1] 13.162416
      SMP: Pairing Random (0x04) len 16
        Random value: 297efe85e67448a15f56bd27e3a3cf1d
> HCI Event: Number of Completed Packets (0x13) plen 5    #175 [hci1] 13.332267
        Num handles: 1
        Handle: 3459 Address: DF:A9:FF:F6:B1:1A (OUI DF-A9-FF)
        Count: 1
        #174: len 21 (0 Kb/s)
        Latency: 169 msec (67-172 msec ~165 msec)
> ACL Data RX: Handle 3459 flags 0x02 dlen 21             #176 [hci1] 13.420239
      SMP: Pairing Confirm (0x03) len 16
        Confim value: 5966bcaf56f996f7aee9bce842008473
< HCI Command: Host Number of Com.. (0x03|0x0035) plen 5  #177 [hci1] 13.422103
        Num handles: 1
        Handle: 3459 Address: DF:A9:FF:F6:B1:1A (OUI DF-A9-FF)
        Count: 1
< ACL Data TX: Handle 3459 flags 0x00 dlen 21             #178 [hci1] 13.422193
      SMP: Pairing Confirm (0x03) len 16
        Confim value: 052eed447fe741f6df89cf925c114005
> HCI Event: Number of Completed Packets (0x13) plen 5    #179 [hci1] 13.595025
        Num handles: 1
        Handle: 3459 Address: DF:A9:FF:F6:B1:1A (OUI DF-A9-FF)
        Count: 1
        #178: len 21 (0 Kb/s)
        Latency: 172 msec (67-172 msec ~168 msec)
> ACL Data RX: Handle 3459 flags 0x02 dlen 21             #180 [hci1] 13.595298
      SMP: Pairing Random (0x04) len 16
        Random value: 05e6b9bc317f0c580000000000000000
< HCI Command: Host Number of Com.. (0x03|0x0035) plen 5  #181 [hci1] 13.602363
        Num handles: 1
        Handle: 3459 Address: DF:A9:FF:F6:B1:1A (OUI DF-A9-FF)
        Count: 1
< ACL Data TX: Handle 3459 flags 0x00 dlen 21             #182 [hci1] 13.602475
      SMP: Pairing Random (0x04) len 16
        Random value: 25a9493fd3ce4faf02be7293595bb7c6
> HCI Event: Number of Completed Packets (0x13) plen 5    #183 [hci1] 13.769846
        Num handles: 1
        Handle: 3459 Address: DF:A9:FF:F6:B1:1A (OUI DF-A9-FF)
        Count: 1
        #182: len 21 (1 Kb/s)
        Latency: 167 msec (67-172 msec ~168 msec)
> ACL Data RX: Handle 3459 flags 0x02 dlen 21             #184 [hci1] 13.857600
      SMP: Pairing Confirm (0x03) len 16
        Confim value: ced3775619f2fceeee365f10593b391b
< HCI Command: Host Number of Com.. (0x03|0x0035) plen 5  #185 [hci1] 13.862170
        Num handles: 1
        Handle: 3459 Address: DF:A9:FF:F6:B1:1A (OUI DF-A9-FF)
        Count: 1
< ACL Data TX: Handle 3459 flags 0x00 dlen 21             #186 [hci1] 13.862245
      SMP: Pairing Confirm (0x03) len 16
        Confim value: f302ef8b24e6ce0f0ec7909d50c3fc01
> HCI Event: Number of Completed Packets (0x13) plen 5    #187 [hci1] 14.032464
        Num handles: 1
        Handle: 3459 Address: DF:A9:FF:F6:B1:1A (OUI DF-A9-FF)
        Count: 1
        #186: len 21 (0 Kb/s)
        Latency: 170 msec (67-172 msec ~169 msec)
> ACL Data RX: Handle 3459 flags 0x02 dlen 21             #188 [hci1] 14.032799
      SMP: Pairing Random (0x04) len 16
        Random value: e88d627017e146030000000000000000
< HCI Command: Host Number of Com.. (0x03|0x0035) plen 5  #189 [hci1] 14.042399
        Num handles: 1
        Handle: 3459 Address: DF:A9:FF:F6:B1:1A (OUI DF-A9-FF)
        Count: 1
< ACL Data TX: Handle 3459 flags 0x00 dlen 21             #190 [hci1] 14.042485
      SMP: Pairing Random (0x04) len 16
        Random value: 58f6b41f855a6f6c3560debd84e2affc
> HCI Event: Number of Completed Packets (0x13) plen 5    #191 [hci1] 14.207261
        Num handles: 1
        Handle: 3459 Address: DF:A9:FF:F6:B1:1A (OUI DF-A9-FF)
        Count: 1
        #190: len 21 (1 Kb/s)
        Latency: 164 msec (67-172 msec ~166 msec)
> ACL Data RX: Handle 3459 flags 0x02 dlen 21             #192 [hci1] 14.295150
      SMP: Pairing Confirm (0x03) len 16
        Confim value: 216039276ea27238dec6c53e1cbbec8f
< HCI Command: Host Number of Com.. (0x03|0x0035) plen 5  #193 [hci1] 14.302006
        Num handles: 1
        Handle: 3459 Address: DF:A9:FF:F6:B1:1A (OUI DF-A9-FF)
        Count: 1
< ACL Data TX: Handle 3459 flags 0x00 dlen 21             #194 [hci1] 14.302059
      SMP: Pairing Confirm (0x03) len 16
        Confim value: 30509d79e89eb25f966ceb06aa41bacb
> HCI Event: Number of Completed Packets (0x13) plen 5    #195 [hci1] 14.469937
        Num handles: 1
        Handle: 3459 Address: DF:A9:FF:F6:B1:1A (OUI DF-A9-FF)
        Count: 1
        #194: len 21 (1 Kb/s)
        Latency: 167 msec (67-172 msec ~167 msec)
> ACL Data RX: Handle 3459 flags 0x02 dlen 21             #196 [hci1] 14.470308
      SMP: Pairing Random (0x04) len 16
        Random value: 12d05baeed2ecf6f0000000000000000
< HCI Command: Host Number of Com.. (0x03|0x0035) plen 5  #197 [hci1] 14.482414
        Num handles: 1
        Handle: 3459 Address: DF:A9:FF:F6:B1:1A (OUI DF-A9-FF)
        Count: 1
< ACL Data TX: Handle 3459 flags 0x00 dlen 21             #198 [hci1] 14.482555
      SMP: Pairing Random (0x04) len 16
        Random value: b67e7216d5bf664139eda2b542549666
> HCI Event: Number of Completed Packets (0x13) plen 5    #199 [hci1] 14.644801
        Num handles: 1
        Handle: 3459 Address: DF:A9:FF:F6:B1:1A (OUI DF-A9-FF)
        Count: 1
        #198: len 21 (1 Kb/s)
        Latency: 162 msec (67-172 msec ~164 msec)
> ACL Data RX: Handle 3459 flags 0x02 dlen 21             #200 [hci1] 14.732728
      SMP: Pairing Confirm (0x03) len 16
        Confim value: 22782d6ca26cda4a1a0e469933017a35
< HCI Command: Host Number of Com.. (0x03|0x0035) plen 5  #201 [hci1] 14.742143
        Num handles: 1
        Handle: 3459 Address: DF:A9:FF:F6:B1:1A (OUI DF-A9-FF)
        Count: 1
< ACL Data TX: Handle 3459 flags 0x00 dlen 21             #202 [hci1] 14.742299
      SMP: Pairing Confirm (0x03) len 16
        Confim value: 99c10a6bc65d25843ef57e0bf01098fd
> HCI Event: Number of Completed Packets (0x13) plen 5    #203 [hci1] 14.907428
        Num handles: 1
        Handle: 3459 Address: DF:A9:FF:F6:B1:1A (OUI DF-A9-FF)
        Count: 1
        #202: len 21 (1 Kb/s)
        Latency: 165 msec (67-172 msec ~164 msec)
> ACL Data RX: Handle 3459 flags 0x02 dlen 21             #204 [hci1] 14.907780
      SMP: Pairing Random (0x04) len 16
        Random value: baf287ff3394de4c0000000000000000
< HCI Command: Host Number of Com.. (0x03|0x0035) plen 5  #205 [hci1] 14.921791
        Num handles: 1
        Handle: 3459 Address: DF:A9:FF:F6:B1:1A (OUI DF-A9-FF)
        Count: 1
< ACL Data TX: Handle 3459 flags 0x00 dlen 21             #206 [hci1] 14.921818
      SMP: Pairing Random (0x04) len 16
        Random value: ed17f76500c95219dd01e09d1e63f87b
> HCI Event: Number of Completed Packets (0x13) plen 5    #207 [hci1] 15.082288
        Num handles: 1
        Handle: 3459 Address: DF:A9:FF:F6:B1:1A (OUI DF-A9-FF)
        Count: 1
        #206: len 21 (1 Kb/s)
        Latency: 160 msec (67-172 msec ~162 msec)
> ACL Data RX: Handle 3459 flags 0x02 dlen 21             #208 [hci1] 15.170071
      SMP: Pairing Confirm (0x03) len 16
        Confim value: df2a0d703314a2c3436a86d03cd6e3e7
< HCI Command: Host Number of Com.. (0x03|0x0035) plen 5  #209 [hci1] 15.182205
        Num handles: 1
        Handle: 3459 Address: DF:A9:FF:F6:B1:1A (OUI DF-A9-FF)
        Count: 1
< ACL Data TX: Handle 3459 flags 0x00 dlen 21             #210 [hci1] 15.182311
      SMP: Pairing Confirm (0x03) len 16
        Confim value: 658a57c38e107e9f07c5807da73484cf
> HCI Event: Number of Completed Packets (0x13) plen 5    #211 [hci1] 15.344975
        Num handles: 1
        Handle: 3459 Address: DF:A9:FF:F6:B1:1A (OUI DF-A9-FF)
        Count: 1
        #210: len 21 (1 Kb/s)
        Latency: 162 msec (67-172 msec ~162 msec)
> ACL Data RX: Handle 3459 flags 0x02 dlen 21             #212 [hci1] 15.345345
      SMP: Pairing Random (0x04) len 16
        Random value: 9641f0a4598e7aae0000000000000000
< HCI Command: Host Number of Com.. (0x03|0x0035) plen 5  #213 [hci1] 15.362421
        Num handles: 1
        Handle: 3459 Address: DF:A9:FF:F6:B1:1A (OUI DF-A9-FF)
        Count: 1
< ACL Data TX: Handle 3459 flags 0x00 dlen 21             #214 [hci1] 15.362572
      SMP: Pairing Random (0x04) len 16
        Random value: 81d35d47e1f6006d79c974bd9d9e1ee3
> HCI Event: Number of Completed Packets (0x13) plen 5    #215 [hci1] 15.519732
        Num handles: 1
        Handle: 3459 Address: DF:A9:FF:F6:B1:1A (OUI DF-A9-FF)
        Count: 1
        #214: len 21 (1 Kb/s)
        Latency: 157 msec (67-172 msec ~159 msec)
> ACL Data RX: Handle 3459 flags 0x02 dlen 21             #216 [hci1] 15.607659
      SMP: Pairing Confirm (0x03) len 16
        Confim value: 3615f626266833b6f62eec71d4e09b13
< HCI Command: Host Number of Com.. (0x03|0x0035) plen 5  #217 [hci1] 15.622173
        Num handles: 1
        Handle: 3459 Address: DF:A9:FF:F6:B1:1A (OUI DF-A9-FF)
        Count: 1
< ACL Data TX: Handle 3459 flags 0x00 dlen 21             #218 [hci1] 15.622326
      SMP: Pairing Confirm (0x03) len 16
        Confim value: 4b586579caa9c7a272e8361cb3fb1a3d
> HCI Event: Number of Completed Packets (0x13) plen 5    #219 [hci1] 15.782443
        Num handles: 1
        Handle: 3459 Address: DF:A9:FF:F6:B1:1A (OUI DF-A9-FF)
        Count: 1
        #218: len 21 (1 Kb/s)
        Latency: 160 msec (67-172 msec ~160 msec)
> ACL Data RX: Handle 3459 flags 0x02 dlen 21             #220 [hci1] 15.782801
      SMP: Pairing Random (0x04) len 16
        Random value: 7ac07dfee0a2ddb30000000000000000
< HCI Command: Host Number of Com.. (0x03|0x0035) plen 5  #221 [hci1] 15.802077
        Num handles: 1
        Handle: 3459 Address: DF:A9:FF:F6:B1:1A (OUI DF-A9-FF)
        Count: 1
< ACL Data TX: Handle 3459 flags 0x00 dlen 21             #222 [hci1] 15.802125
      SMP: Pairing Random (0x04) len 16
        Random value: e7f7e0c2476823e41736a7e381bafb7c
> HCI Event: Number of Completed Packets (0x13) plen 5    #223 [hci1] 15.957269
        Num handles: 1
        Handle: 3459 Address: DF:A9:FF:F6:B1:1A (OUI DF-A9-FF)
        Count: 1
        #222: len 21 (1 Kb/s)
        Latency: 155 msec (67-172 msec ~157 msec)
> ACL Data RX: Handle 3459 flags 0x02 dlen 21             #224 [hci1] 16.045140
      SMP: Pairing Confirm (0x03) len 16
        Confim value: 9648f4c1f0bdce0f6100ac0e7675a3a0
< HCI Command: Host Number of Com.. (0x03|0x0035) plen 5  #225 [hci1] 16.061951
        Num handles: 1
        Handle: 3459 Address: DF:A9:FF:F6:B1:1A (OUI DF-A9-FF)
        Count: 1
< ACL Data TX: Handle 3459 flags 0x00 dlen 21             #226 [hci1] 16.062008
      SMP: Pairing Confirm (0x03) len 16
        Confim value: 331ea2888a0fbfdebbea92bc636f254a
> HCI Event: Number of Completed Packets (0x13) plen 5    #227 [hci1] 16.219948
        Num handles: 1
        Handle: 3459 Address: DF:A9:FF:F6:B1:1A (OUI DF-A9-FF)
        Count: 1
        #226: len 21 (1 Kb/s)
        Latency: 157 msec (67-172 msec ~157 msec)
> ACL Data RX: Handle 3459 flags 0x02 dlen 21             #228 [hci1] 16.220306
      SMP: Pairing Random (0x04) len 16
        Random value: f0545b6fe4f1732e0000000000000000
< HCI Command: Host Number of Com.. (0x03|0x0035) plen 5  #229 [hci1] 16.222422
        Num handles: 1
        Handle: 3459 Address: DF:A9:FF:F6:B1:1A (OUI DF-A9-FF)
        Count: 1
< ACL Data TX: Handle 3459 flags 0x00 dlen 21             #230 [hci1] 16.222531
      SMP: Pairing Random (0x04) len 16
        Random value: fc8b40d9b0b09bc4296bf8753a8f6e1f
> HCI Event: Number of Completed Packets (0x13) plen 5    #231 [hci1] 16.394759
        Num handles: 1
        Handle: 3459 Address: DF:A9:FF:F6:B1:1A (OUI DF-A9-FF)
        Count: 1
        #230: len 21 (0 Kb/s)
        Latency: 172 msec (67-172 msec ~164 msec)
> ACL Data RX: Handle 3459 flags 0x02 dlen 21             #232 [hci1] 16.570171
      SMP: Pairing DHKey Check (0x0d) len 16
        E: 585b8c7cc74bb630b88d41caaffd1830
< HCI Command: Host Number of Com.. (0x03|0x0035) plen 5  #233 [hci1] 16.582705
        Num handles: 1
        Handle: 3459 Address: DF:A9:FF:F6:B1:1A (OUI DF-A9-FF)
        Count: 1
< ACL Data TX: Handle 3459 flags 0x00 dlen 21             #234 [hci1] 16.582789
      SMP: Pairing DHKey Check (0x0d) len 16
        E: 053233513f66de70afac960374f5d514
> HCI Event: Number of Completed Packets (0x13) plen 5    #235 [hci1] 16.744776
        Num handles: 1
        Handle: 3459 Address: DF:A9:FF:F6:B1:1A (OUI DF-A9-FF)
        Count: 1
        #234: len 21 (1 Kb/s)
        Latency: 161 msec (67-172 msec ~163 msec)
> HCI Event: LE Meta Event (0x3e) plen 13                 #236 [hci1] 16.832929
      LE Long Term Key Request (0x05)
        Handle: 3459 Address: DF:A9:FF:F6:B1:1A (OUI DF-A9-FF)
        Random number: 0x0000000000000000
        Encrypted diversifier: 0x0000
< HCI Command: LE Long Term Key... (0x08|0x001a) plen 18  #237 [hci1] 16.842006
        Handle: 3459 Address: DF:A9:FF:F6:B1:1A (OUI DF-A9-FF)
        Long term key: 070a5a60f49737b06b4d18f0af3cac94
> HCI Event: Command Complete (0x0e) plen 6               #238 [hci1] 16.842790
      LE Long Term Key Request Reply (0x08|0x001a) ncmd 1
        Status: Success (0x00)
        Handle: 3459 Address: DF:A9:FF:F6:B1:1A (OUI DF-A9-FF)
> HCI Event: Encryption Change (0x08) plen 4              #239 [hci1] 17.270139
        Status: Success (0x00)
        Handle: 3459 Address: DF:A9:FF:F6:B1:1A (OUI DF-A9-FF)
        Encryption: Enabled with AES-CCM (0x01)
> ACL Data RX: Handle 3459 flags 0x02 dlen 21             #240 [hci1] 17.357658
      SMP: Identity Information (0x08) len 16
        Identity resolving key: 6a189f01e74763071f014d42c9316f06
< HCI Command: Host Number of Com.. (0x03|0x0035) plen 5  #241 [hci1] 17.392487
        Num handles: 1
        Handle: 3459 Address: DF:A9:FF:F6:B1:1A (OUI DF-A9-FF)
        Count: 1
> ACL Data RX: Handle 3459 flags 0x02 dlen 12             #242 [hci1] 17.532452
      SMP: Identity Address Information (0x09) len 7
        Address: DF:A9:FF:F6:B1:1A (OUI DF-A9-FF)
< HCI Command: LE Add Device To... (0x08|0x0027) plen 39  #243 [hci1] 17.542227
        Address type: Public (0x00)
        Address: DF:A9:FF:F6:B1:1A (OUI DF-A9-FF)
        Peer identity resolving key: 6a189f01e74763071f014d42c9316f06
        Local identity resolving key: 00000000000000000000000000000000
> HCI Event: Command Complete (0x0e) plen 4               #244 [hci1] 17.543203
      LE Add Device To Resolving List (0x08|0x0027) ncmd 1
        Status: Success (0x00)
< HCI Command: LE Set Privacy Mode (0x08|0x004e) plen 8   #245 [hci1] 17.562025
        Peer Identity address type: Public (0x00)
        Peer Identity address: DF:A9:FF:F6:B1:1A (OUI DF-A9-FF)
        Privacy Mode: Use Device Privacy (0x01)
> HCI Event: Command Complete (0x0e) plen 4               #246 [hci1] 17.562514
      LE Set Privacy Mode (0x08|0x004e) ncmd 1
        Status: Success (0x00)
< HCI Command: LE Set Address Res.. (0x08|0x002d) plen 1  #247 [hci1] 17.582103
        Address resolution: Enabled (0x01)
> HCI Event: Command Complete (0x0e) plen 4               #248 [hci1] 17.582552
      LE Set Address Resolution Enable (0x08|0x002d) ncmd 1
        Status: Success (0x00)
< HCI Command: Host Number of Com.. (0x03|0x0035) plen 5  #249 [hci1] 17.601986
        Num handles: 1
        Handle: 3459 Address: DF:A9:FF:F6:B1:1A (OUI DF-A9-FF)
        Count: 1
> ACL Data RX: Handle 3459 flags 0x02 dlen 13             #250 [hci1] 17.619987
      ATT: Find By Type Value Request (0x06) len 8
        Handle range: 0x0001-0xffff
        Attribute type: Primary Service (0x2800)
          UUID: Generic Telephony Bearer (0x184c)
< HCI Command: Host Number of Com.. (0x03|0x0035) plen 5  #251 [hci1] 17.622326
        Num handles: 1
        Handle: 3459 Address: DF:A9:FF:F6:B1:1A (OUI DF-A9-FF)
        Count: 1
< ACL Data TX: Handle 3459 flags 0x00 dlen 9              #252 [hci1] 17.622437
      ATT: Find By Type Value Response (0x07) len 4
        Handle range: 0x0024-0x0050
> HCI Event: Number of Completed Packets (0x13) plen 5    #253 [hci1] 17.794919
        Num handles: 1
        Handle: 3459 Address: DF:A9:FF:F6:B1:1A (OUI DF-A9-FF)
        Count: 1
        #252: len 9 (0 Kb/s)
        Latency: 172 msec (67-172 msec ~167 msec)
> ACL Data RX: Handle 3459 flags 0x02 dlen 13             #254 [hci1] 17.795158
      ATT: Find By Type Value Request (0x06) len 8
        Handle range: 0x0051-0xffff
        Attribute type: Primary Service (0x2800)
          UUID: Generic Telephony Bearer (0x184c)
< HCI Command: Host Number of Com.. (0x03|0x0035) plen 5  #255 [hci1] 17.801915
        Num handles: 1
        Handle: 3459 Address: DF:A9:FF:F6:B1:1A (OUI DF-A9-FF)
        Count: 1
< ACL Data TX: Handle 3459 flags 0x00 dlen 9              #256 [hci1] 17.802015
      ATT: Error Response (0x01) len 4
        Find By Type Value Request (0x06)
        Handle: 0x0051
        Error: Attribute Not Found (0x0a)
> HCI Event: Number of Completed Packets (0x13) plen 5    #257 [hci1] 17.969869
        Num handles: 1
        Handle: 3459 Address: DF:A9:FF:F6:B1:1A (OUI DF-A9-FF)
        Count: 1
        #256: len 9 (0 Kb/s)
        Latency: 167 msec (67-172 msec ~167 msec)
> ACL Data RX: Handle 3459 flags 0x02 dlen 11             #258 [hci1] 17.970153
      ATT: Read By Type Request (0x08) len 6
        Handle range: 0x0024-0x0050
        Attribute type: Characteristic (0x2803)
< HCI Command: Host Number of Com.. (0x03|0x0035) plen 5  #259 [hci1] 17.982306
        Num handles: 1
        Handle: 3459 Address: DF:A9:FF:F6:B1:1A (OUI DF-A9-FF)
        Count: 1
< ACL Data TX: Handle 3459 flags 0x00 dlen 20             #260 [hci1] 17.982396
      ATT: Read By Type Response (0x09) len 15
        Attribute data length: 7
        Attribute data list: 2 entries
        Handle: 0x0025
        Value: 122600b32b
            Properties: 0x12
              Read (0x02)
              Notify (0x10)
            Value Handle: 0x0026
            Value UUID: Bearer Provider Name (0x2bb3)
        Handle: 0x0028
        Value: 022900b42b
            Properties: 0x02
              Read (0x02)
            Value Handle: 0x0029
            Value UUID: Bearer UCI (0x2bb4)
> HCI Event: Number of Completed Packets (0x13) plen 5    #261 [hci1] 18.145016
        Num handles: 1
        Handle: 3459 Address: DF:A9:FF:F6:B1:1A (OUI DF-A9-FF)
        Count: 1
        #260: len 20 (0 Kb/s)
        Latency: 162 msec (67-172 msec ~165 msec)
> ACL Data RX: Handle 3459 flags 0x02 dlen 11             #262 [hci1] 18.145219
      ATT: Read By Type Request (0x08) len 6
        Handle range: 0x0029-0x0050
        Attribute type: Characteristic (0x2803)
< HCI Command: Host Number of Com.. (0x03|0x0035) plen 5  #263 [hci1] 18.162393
        Num handles: 1
        Handle: 3459 Address: DF:A9:FF:F6:B1:1A (OUI DF-A9-FF)
        Count: 1
< ACL Data TX: Handle 3459 flags 0x00 dlen 20             #264 [hci1] 18.162564
      ATT: Read By Type Response (0x09) len 15
        Attribute data length: 7
        Attribute data list: 2 entries
        Handle: 0x002a
        Value: 122b00b52b
            Properties: 0x12
              Read (0x02)
              Notify (0x10)
            Value Handle: 0x002b
            Value UUID: Bearer Technology (0x2bb5)
        Handle: 0x002d
        Value: 122e00b62b
            Properties: 0x12
              Read (0x02)
              Notify (0x10)
            Value Handle: 0x002e
            Value UUID: Bearer URI Schemes Supported List (0x2bb6)
> HCI Event: Number of Completed Packets (0x13) plen 5    #265 [hci1] 18.319869
        Num handles: 1
        Handle: 3459 Address: DF:A9:FF:F6:B1:1A (OUI DF-A9-FF)
        Count: 1
        #264: len 20 (1 Kb/s)
        Latency: 157 msec (67-172 msec ~161 msec)
> ACL Data RX: Handle 3459 flags 0x02 dlen 11             #266 [hci1] 18.320160
      ATT: Read By Type Request (0x08) len 6
        Handle range: 0x002e-0x0050
        Attribute type: Characteristic (0x2803)
< HCI Command: Host Number of Com.. (0x03|0x0035) plen 5  #267 [hci1] 18.322390
        Num handles: 1
        Handle: 3459 Address: DF:A9:FF:F6:B1:1A (OUI DF-A9-FF)
        Count: 1
< ACL Data TX: Handle 3459 flags 0x00 dlen 20             #268 [hci1] 18.322459
      ATT: Read By Type Response (0x09) len 15
        Attribute data length: 7
        Attribute data list: 2 entries
        Handle: 0x0030
        Value: 123100b72b
            Properties: 0x12
              Read (0x02)
              Notify (0x10)
            Value Handle: 0x0031
            Value UUID: Bearer Signal Strength (0x2bb7)
        Handle: 0x0033
        Value: 0e3400b82b
            Properties: 0x0e
              Read (0x02)
              Write Without Response (0x04)
              Write (0x08)
            Value Handle: 0x0034
            Value UUID: Bearer Signal Strength Reporting Interval (0x2bb8)
> HCI Event: Number of Completed Packets (0x13) plen 5    #269 [hci1] 18.494822
        Num handles: 1
        Handle: 3459 Address: DF:A9:FF:F6:B1:1A (OUI DF-A9-FF)
        Count: 1
        #268: len 20 (0 Kb/s)
        Latency: 172 msec (67-172 msec ~166 msec)
> ACL Data RX: Handle 3459 flags 0x02 dlen 11             #270 [hci1] 18.495077
      ATT: Read By Type Request (0x08) len 6
        Handle range: 0x0034-0x0050
        Attribute type: Characteristic (0x2803)
< HCI Command: Host Number of Com.. (0x03|0x0035) plen 5  #271 [hci1] 18.502337
        Num handles: 1
        Handle: 3459 Address: DF:A9:FF:F6:B1:1A (OUI DF-A9-FF)
        Count: 1
< ACL Data TX: Handle 3459 flags 0x00 dlen 20             #272 [hci1] 18.502432
      ATT: Read By Type Response (0x09) len 15
        Attribute data length: 7
        Attribute data list: 2 entries
        Handle: 0x0035
        Value: 123600b92b
            Properties: 0x12
              Read (0x02)
              Notify (0x10)
            Value Handle: 0x0036
            Value UUID: Bearer List Current Calls (0x2bb9)
        Handle: 0x0038
        Value: 023900ba2b
            Properties: 0x02
              Read (0x02)
            Value Handle: 0x0039
            Value UUID: Content Control ID (0x2bba)
> HCI Event: Number of Completed Packets (0x13) plen 5    #273 [hci1] 18.669939
        Num handles: 1
        Handle: 3459 Address: DF:A9:FF:F6:B1:1A (OUI DF-A9-FF)
        Count: 1
        #272: len 20 (0 Kb/s)
        Latency: 167 msec (67-172 msec ~167 msec)
> ACL Data RX: Handle 3459 flags 0x02 dlen 11             #274 [hci1] 18.670162
      ATT: Read By Type Request (0x08) len 6
        Handle range: 0x0039-0x0050
        Attribute type: Characteristic (0x2803)
< HCI Command: Host Number of Com.. (0x03|0x0035) plen 5  #275 [hci1] 18.682341
        Num handles: 1
        Handle: 3459 Address: DF:A9:FF:F6:B1:1A (OUI DF-A9-FF)
        Count: 1
< ACL Data TX: Handle 3459 flags 0x00 dlen 20             #276 [hci1] 18.682443
      ATT: Read By Type Response (0x09) len 15
        Attribute data length: 7
        Attribute data list: 2 entries
        Handle: 0x003a
        Value: 123b00bb2b
            Properties: 0x12
              Read (0x02)
              Notify (0x10)
            Value Handle: 0x003b
            Value UUID: Status Flags (0x2bbb)
        Handle: 0x003d
        Value: 123e00bc2b
            Properties: 0x12
              Read (0x02)
              Notify (0x10)
            Value Handle: 0x003e
            Value UUID: Incoming Call Target Bearer URI (0x2bbc)
> HCI Event: Number of Completed Packets (0x13) plen 5    #277 [hci1] 18.844956
        Num handles: 1
        Handle: 3459 Address: DF:A9:FF:F6:B1:1A (OUI DF-A9-FF)
        Count: 1
        #276: len 20 (0 Kb/s)
        Latency: 162 msec (67-172 msec ~164 msec)
> ACL Data RX: Handle 3459 flags 0x02 dlen 11             #278 [hci1] 18.845225
      ATT: Read By Type Request (0x08) len 6
        Handle range: 0x003e-0x0050
        Attribute type: Characteristic (0x2803)
< HCI Command: Host Number of Com.. (0x03|0x0035) plen 5  #279 [hci1] 18.862413
        Num handles: 1
        Handle: 3459 Address: DF:A9:FF:F6:B1:1A (OUI DF-A9-FF)
        Count: 1
< ACL Data TX: Handle 3459 flags 0x00 dlen 20             #280 [hci1] 18.862498
      ATT: Read By Type Response (0x09) len 15
        Attribute data length: 7
        Attribute data list: 2 entries
        Handle: 0x0040
        Value: 124100bd2b
            Properties: 0x12
              Read (0x02)
              Notify (0x10)
            Value Handle: 0x0041
            Value UUID: Call State (0x2bbd)
        Handle: 0x0043
        Value: 1c4400be2b
            Properties: 0x1c
              Write Without Response (0x04)
              Write (0x08)
              Notify (0x10)
            Value Handle: 0x0044
            Value UUID: Call Control Point (0x2bbe)
> HCI Event: Number of Completed Packets (0x13) plen 5    #281 [hci1] 19.019939
        Num handles: 1
        Handle: 3459 Address: DF:A9:FF:F6:B1:1A (OUI DF-A9-FF)
        Count: 1
        #280: len 20 (1 Kb/s)
        Latency: 157 msec (67-172 msec ~161 msec)
> ACL Data RX: Handle 3459 flags 0x02 dlen 11             #282 [hci1] 19.020072
      ATT: Read By Type Request (0x08) len 6
        Handle range: 0x0044-0x0050
        Attribute type: Characteristic (0x2803)
< HCI Command: Host Number of Com.. (0x03|0x0035) plen 5  #283 [hci1] 19.022320
        Num handles: 1
        Handle: 3459 Address: DF:A9:FF:F6:B1:1A (OUI DF-A9-FF)
        Count: 1
< ACL Data TX: Handle 3459 flags 0x00 dlen 20             #284 [hci1] 19.022443
      ATT: Read By Type Response (0x09) len 15
        Attribute data length: 7
        Attribute data list: 2 entries
        Handle: 0x0046
        Value: 024700bf2b
            Properties: 0x02
              Read (0x02)
            Value Handle: 0x0047
            Value UUID: Call Control Point Optional Opcodes (0x2bbf)
        Handle: 0x0048
        Value: 104900c02b
            Properties: 0x10
              Notify (0x10)
            Value Handle: 0x0049
            Value UUID: Termination Reason (0x2bc0)
> HCI Event: Number of Completed Packets (0x13) plen 5    #285 [hci1] 19.194923
        Num handles: 1
        Handle: 3459 Address: DF:A9:FF:F6:B1:1A (OUI DF-A9-FF)
        Count: 1
        #284: len 20 (0 Kb/s)
        Latency: 172 msec (67-172 msec ~166 msec)
> ACL Data RX: Handle 3459 flags 0x02 dlen 11             #286 [hci1] 19.195111
      ATT: Read By Type Request (0x08) len 6
        Handle range: 0x0049-0x0050
        Attribute type: Characteristic (0x2803)
< HCI Command: Host Number of Com.. (0x03|0x0035) plen 5  #287 [hci1] 19.202404
        Num handles: 1
        Handle: 3459 Address: DF:A9:FF:F6:B1:1A (OUI DF-A9-FF)
        Count: 1
< ACL Data TX: Handle 3459 flags 0x00 dlen 20             #288 [hci1] 19.202546
      ATT: Read By Type Response (0x09) len 15
        Attribute data length: 7
        Attribute data list: 2 entries
        Handle: 0x004b
        Value: 124c00c12b
            Properties: 0x12
              Read (0x02)
              Notify (0x10)
            Value Handle: 0x004c
            Value UUID: Incoming Call (0x2bc1)
        Handle: 0x004e
        Value: 124f00c22b
            Properties: 0x12
              Read (0x02)
              Notify (0x10)
            Value Handle: 0x004f
            Value UUID: Call Friendly Name (0x2bc2)
> HCI Event: Number of Completed Packets (0x13) plen 5    #289 [hci1] 19.369815
        Num handles: 1
        Handle: 3459 Address: DF:A9:FF:F6:B1:1A (OUI DF-A9-FF)
        Count: 1
        #288: len 20 (0 Kb/s)
        Latency: 167 msec (67-172 msec ~167 msec)
> ACL Data RX: Handle 3459 flags 0x02 dlen 11             #290 [hci1] 19.370097
      ATT: Read By Type Request (0x08) len 6
        Handle range: 0x004f-0x0050
        Attribute type: Characteristic (0x2803)
< HCI Command: Host Number of Com.. (0x03|0x0035) plen 5  #291 [hci1] 19.382322
        Num handles: 1
        Handle: 3459 Address: DF:A9:FF:F6:B1:1A (OUI DF-A9-FF)
        Count: 1
< ACL Data TX: Handle 3459 flags 0x00 dlen 9              #292 [hci1] 19.382571
      ATT: Error Response (0x01) len 4
        Read By Type Request (0x08)
        Handle: 0x004f
        Error: Attribute Not Found (0x0a)
> HCI Event: Number of Completed Packets (0x13) plen 5    #293 [hci1] 19.544862
        Num handles: 1
        Handle: 3459 Address: DF:A9:FF:F6:B1:1A (OUI DF-A9-FF)
        Count: 1
        #292: len 9 (0 Kb/s)
        Latency: 162 msec (67-172 msec ~164 msec)
> ACL Data RX: Handle 3459 flags 0x02 dlen 9              #294 [hci1] 19.545101
      ATT: Find Information Request (0x04) len 4
        Handle range: 0x0027-0x0027
< HCI Command: Host Number of Com.. (0x03|0x0035) plen 5  #295 [hci1] 19.562211
        Num handles: 1
        Handle: 3459 Address: DF:A9:FF:F6:B1:1A (OUI DF-A9-FF)
        Count: 1
< ACL Data TX: Handle 3459 flags 0x00 dlen 10             #296 [hci1] 19.562304
      ATT: Find Information Response (0x05) len 5
        Format: UUID-16 (0x01)
        Handle: 0x0027
        UUID: Client Characteristic Configuration (0x2902)
> HCI Event: Number of Completed Packets (0x13) plen 5    #297 [hci1] 19.719818
        Num handles: 1
        Handle: 3459 Address: DF:A9:FF:F6:B1:1A (OUI DF-A9-FF)
        Count: 1
        #296: len 10 (0 Kb/s)
        Latency: 157 msec (67-172 msec ~161 msec)
> ACL Data RX: Handle 3459 flags 0x02 dlen 9              #298 [hci1] 19.720042
      ATT: Find Information Request (0x04) len 4
        Handle range: 0x002c-0x002c
< HCI Command: Host Number of Com.. (0x03|0x0035) plen 5  #299 [hci1] 19.722293
        Num handles: 1
        Handle: 3459 Address: DF:A9:FF:F6:B1:1A (OUI DF-A9-FF)
        Count: 1
< ACL Data TX: Handle 3459 flags 0x00 dlen 10             #300 [hci1] 19.722358
      ATT: Find Information Response (0x05) len 5
        Format: UUID-16 (0x01)
        Handle: 0x002c
        UUID: Client Characteristic Configuration (0x2902)
> HCI Event: Number of Completed Packets (0x13) plen 5    #301 [hci1] 19.894871
        Num handles: 1
        Handle: 3459 Address: DF:A9:FF:F6:B1:1A (OUI DF-A9-FF)
        Count: 1
        #300: len 10 (0 Kb/s)
        Latency: 172 msec (67-172 msec ~166 msec)
> ACL Data RX: Handle 3459 flags 0x02 dlen 9              #302 [hci1] 19.895107
      ATT: Find Information Request (0x04) len 4
        Handle range: 0x002f-0x002f
< HCI Command: Host Number of Com.. (0x03|0x0035) plen 5  #303 [hci1] 19.902279
        Num handles: 1
        Handle: 3459 Address: DF:A9:FF:F6:B1:1A (OUI DF-A9-FF)
        Count: 1
< ACL Data TX: Handle 3459 flags 0x00 dlen 10             #304 [hci1] 19.902477
      ATT: Find Information Response (0x05) len 5
        Format: UUID-16 (0x01)
        Handle: 0x002f
        UUID: Client Characteristic Configuration (0x2902)
> HCI Event: Number of Completed Packets (0x13) plen 5    #305 [hci1] 20.069951
        Num handles: 1
        Handle: 3459 Address: DF:A9:FF:F6:B1:1A (OUI DF-A9-FF)
        Count: 1
        #304: len 10 (0 Kb/s)
        Latency: 167 msec (67-172 msec ~167 msec)
> ACL Data RX: Handle 3459 flags 0x02 dlen 9              #306 [hci1] 20.070039
      ATT: Find Information Request (0x04) len 4
        Handle range: 0x0032-0x0032
< HCI Command: Host Number of Com.. (0x03|0x0035) plen 5  #307 [hci1] 20.082274
        Num handles: 1
        Handle: 3459 Address: DF:A9:FF:F6:B1:1A (OUI DF-A9-FF)
        Count: 1
< ACL Data TX: Handle 3459 flags 0x00 dlen 10             #308 [hci1] 20.082299
      ATT: Find Information Response (0x05) len 5
        Format: UUID-16 (0x01)
        Handle: 0x0032
        UUID: Client Characteristic Configuration (0x2902)
> HCI Event: Number of Completed Packets (0x13) plen 5    #309 [hci1] 20.244850
        Num handles: 1
        Handle: 3459 Address: DF:A9:FF:F6:B1:1A (OUI DF-A9-FF)
        Count: 1
        #308: len 10 (0 Kb/s)
        Latency: 162 msec (67-172 msec ~164 msec)
> ACL Data RX: Handle 3459 flags 0x02 dlen 9              #310 [hci1] 20.245104
      ATT: Find Information Request (0x04) len 4
        Handle range: 0x0037-0x0037
< HCI Command: Host Number of Com.. (0x03|0x0035) plen 5  #311 [hci1] 20.262301
        Num handles: 1
        Handle: 3459 Address: DF:A9:FF:F6:B1:1A (OUI DF-A9-FF)
        Count: 1
< ACL Data TX: Handle 3459 flags 0x00 dlen 10             #312 [hci1] 20.262411
      ATT: Find Information Response (0x05) len 5
        Format: UUID-16 (0x01)
        Handle: 0x0037
        UUID: Client Characteristic Configuration (0x2902)
> HCI Event: Number of Completed Packets (0x13) plen 5    #313 [hci1] 20.419839
        Num handles: 1
        Handle: 3459 Address: DF:A9:FF:F6:B1:1A (OUI DF-A9-FF)
        Count: 1
        #312: len 10 (0 Kb/s)
        Latency: 157 msec (67-172 msec ~161 msec)
> ACL Data RX: Handle 3459 flags 0x02 dlen 9              #314 [hci1] 20.420007
      ATT: Find Information Request (0x04) len 4
        Handle range: 0x003c-0x003c
< HCI Command: Host Number of Com.. (0x03|0x0035) plen 5  #315 [hci1] 20.422400
        Num handles: 1
        Handle: 3459 Address: DF:A9:FF:F6:B1:1A (OUI DF-A9-FF)
        Count: 1
< ACL Data TX: Handle 3459 flags 0x00 dlen 10             #316 [hci1] 20.422452
      ATT: Find Information Response (0x05) len 5
        Format: UUID-16 (0x01)
        Handle: 0x003c
        UUID: Client Characteristic Configuration (0x2902)
> HCI Event: Number of Completed Packets (0x13) plen 5    #317 [hci1] 20.594842
        Num handles: 1
        Handle: 3459 Address: DF:A9:FF:F6:B1:1A (OUI DF-A9-FF)
        Count: 1
        #316: len 10 (0 Kb/s)
        Latency: 172 msec (67-172 msec ~166 msec)
> ACL Data RX: Handle 3459 flags 0x02 dlen 9              #318 [hci1] 20.595040
      ATT: Find Information Request (0x04) len 4
        Handle range: 0x003f-0x003f
< HCI Command: Host Number of Com.. (0x03|0x0035) plen 5  #319 [hci1] 20.602310
        Num handles: 1
        Handle: 3459 Address: DF:A9:FF:F6:B1:1A (OUI DF-A9-FF)
        Count: 1
< ACL Data TX: Handle 3459 flags 0x00 dlen 10             #320 [hci1] 20.602367
      ATT: Find Information Response (0x05) len 5
        Format: UUID-16 (0x01)
        Handle: 0x003f
        UUID: Client Characteristic Configuration (0x2902)
> HCI Event: Number of Completed Packets (0x13) plen 5    #321 [hci1] 20.769815
        Num handles: 1
        Handle: 3459 Address: DF:A9:FF:F6:B1:1A (OUI DF-A9-FF)
        Count: 1
        #320: len 10 (0 Kb/s)
        Latency: 167 msec (67-172 msec ~167 msec)
> ACL Data RX: Handle 3459 flags 0x02 dlen 9              #322 [hci1] 20.770086
      ATT: Find Information Request (0x04) len 4
        Handle range: 0x0042-0x0042
< HCI Command: Host Number of Com.. (0x03|0x0035) plen 5  #323 [hci1] 20.782382
        Num handles: 1
        Handle: 3459 Address: DF:A9:FF:F6:B1:1A (OUI DF-A9-FF)
        Count: 1
< ACL Data TX: Handle 3459 flags 0x00 dlen 10             #324 [hci1] 20.782463
      ATT: Find Information Response (0x05) len 5
        Format: UUID-16 (0x01)
        Handle: 0x0042
        UUID: Client Characteristic Configuration (0x2902)
> HCI Event: Number of Completed Packets (0x13) plen 5    #325 [hci1] 20.944837
        Num handles: 1
        Handle: 3459 Address: DF:A9:FF:F6:B1:1A (OUI DF-A9-FF)
        Count: 1
        #324: len 10 (0 Kb/s)
        Latency: 162 msec (67-172 msec ~164 msec)
> ACL Data RX: Handle 3459 flags 0x02 dlen 9              #326 [hci1] 20.945057
      ATT: Find Information Request (0x04) len 4
        Handle range: 0x0045-0x0045
< HCI Command: Host Number of Com.. (0x03|0x0035) plen 5  #327 [hci1] 20.962393
        Num handles: 1
        Handle: 3459 Address: DF:A9:FF:F6:B1:1A (OUI DF-A9-FF)
        Count: 1
< ACL Data TX: Handle 3459 flags 0x00 dlen 10             #328 [hci1] 20.962508
      ATT: Find Information Response (0x05) len 5
        Format: UUID-16 (0x01)
        Handle: 0x0045
        UUID: Client Characteristic Configuration (0x2902)
> HCI Event: Number of Completed Packets (0x13) plen 5    #329 [hci1] 21.119803
        Num handles: 1
        Handle: 3459 Address: DF:A9:FF:F6:B1:1A (OUI DF-A9-FF)
        Count: 1
        #328: len 10 (0 Kb/s)
        Latency: 157 msec (67-172 msec ~161 msec)
> ACL Data RX: Handle 3459 flags 0x02 dlen 9              #330 [hci1] 21.120040
      ATT: Find Information Request (0x04) len 4
        Handle range: 0x004a-0x004a
< HCI Command: Host Number of Com.. (0x03|0x0035) plen 5  #331 [hci1] 21.121915
        Num handles: 1
        Handle: 3459 Address: DF:A9:FF:F6:B1:1A (OUI DF-A9-FF)
        Count: 1
< ACL Data TX: Handle 3459 flags 0x00 dlen 10             #332 [hci1] 21.121936
      ATT: Find Information Response (0x05) len 5
        Format: UUID-16 (0x01)
        Handle: 0x004a
        UUID: Client Characteristic Configuration (0x2902)
> HCI Event: Number of Completed Packets (0x13) plen 5    #333 [hci1] 21.294818
        Num handles: 1
        Handle: 3459 Address: DF:A9:FF:F6:B1:1A (OUI DF-A9-FF)
        Count: 1
        #332: len 10 (0 Kb/s)
        Latency: 172 msec (67-172 msec ~166 msec)
> ACL Data RX: Handle 3459 flags 0x02 dlen 9              #334 [hci1] 21.295081
      ATT: Find Information Request (0x04) len 4
        Handle range: 0x004d-0x004d
< HCI Command: Host Number of Com.. (0x03|0x0035) plen 5  #335 [hci1] 21.302420
        Num handles: 1
        Handle: 3459 Address: DF:A9:FF:F6:B1:1A (OUI DF-A9-FF)
        Count: 1
< ACL Data TX: Handle 3459 flags 0x00 dlen 10             #336 [hci1] 21.302538
      ATT: Find Information Response (0x05) len 5
        Format: UUID-16 (0x01)
        Handle: 0x004d
        UUID: Client Characteristic Configuration (0x2902)
> HCI Event: Number of Completed Packets (0x13) plen 5    #337 [hci1] 21.469847
        Num handles: 1
        Handle: 3459 Address: DF:A9:FF:F6:B1:1A (OUI DF-A9-FF)
        Count: 1
        #336: len 10 (0 Kb/s)
        Latency: 167 msec (67-172 msec ~167 msec)
> ACL Data RX: Handle 3459 flags 0x02 dlen 9              #338 [hci1] 21.470005
      ATT: Find Information Request (0x04) len 4
        Handle range: 0x0050-0x0050
< HCI Command: Host Number of Com.. (0x03|0x0035) plen 5  #339 [hci1] 21.482443
        Num handles: 1
        Handle: 3459 Address: DF:A9:FF:F6:B1:1A (OUI DF-A9-FF)
        Count: 1
< ACL Data TX: Handle 3459 flags 0x00 dlen 10             #340 [hci1] 21.482527
      ATT: Find Information Response (0x05) len 5
        Format: UUID-16 (0x01)
        Handle: 0x0050
        UUID: Client Characteristic Configuration (0x2902)
> HCI Event: Number of Completed Packets (0x13) plen 5    #341 [hci1] 21.644772
        Num handles: 1
        Handle: 3459 Address: DF:A9:FF:F6:B1:1A (OUI DF-A9-FF)
        Count: 1
        #340: len 10 (0 Kb/s)
        Latency: 162 msec (67-172 msec ~164 msec)
> ACL Data RX: Handle 3459 flags 0x02 dlen 9              #342 [hci1] 21.645078
      ATT: Write Request (0x12) len 4
        Handle: 0x0042
          Data: 0000
< HCI Command: Host Number of Com.. (0x03|0x0035) plen 5  #343 [hci1] 21.662303
        Num handles: 1
        Handle: 3459 Address: DF:A9:FF:F6:B1:1A (OUI DF-A9-FF)
        Count: 1
< ACL Data TX: Handle 3459 flags 0x00 dlen 5              #344 [hci1] 21.662455
      ATT: Write Response (0x13) len 0
> HCI Event: Number of Completed Packets (0x13) plen 5    #345 [hci1] 21.819783
        Num handles: 1
        Handle: 3459 Address: DF:A9:FF:F6:B1:1A (OUI DF-A9-FF)
        Count: 1
        #344: len 5 (0 Kb/s)
        Latency: 157 msec (67-172 msec ~161 msec)
> ACL Data RX: Handle 3459 flags 0x02 dlen 9              #346 [hci1] 21.820056
      ATT: Write Request (0x12) len 4
        Handle: 0x0042
          Data: 0100
< HCI Command: Host Number of Com.. (0x03|0x0035) plen 5  #347 [hci1] 21.822394
        Num handles: 1
        Handle: 3459 Address: DF:A9:FF:F6:B1:1A (OUI DF-A9-FF)
        Count: 1
< ACL Data TX: Handle 3459 flags 0x00 dlen 5              #348 [hci1] 21.822539
      ATT: Write Response (0x13) len 0
> HCI Event: Number of Completed Packets (0x13) plen 5    #349 [hci1] 21.994883
        Num handles: 1
        Handle: 3459 Address: DF:A9:FF:F6:B1:1A (OUI DF-A9-FF)
        Count: 1
        #348: len 5 (0 Kb/s)
        Latency: 172 msec (67-172 msec ~166 msec)
> ACL Data RX: Handle 3459 flags 0x02 dlen 9              #350 [hci1] 21.995032
      ATT: Write Request (0x12) len 4
        Handle: 0x004d
          Data: 0000
< HCI Command: Host Number of Com.. (0x03|0x0035) plen 5  #351 [hci1] 22.002329
        Num handles: 1
        Handle: 3459 Address: DF:A9:FF:F6:B1:1A (OUI DF-A9-FF)
        Count: 1
< ACL Data TX: Handle 3459 flags 0x00 dlen 5              #352 [hci1] 22.002463
      ATT: Write Response (0x13) len 0
> HCI Event: Number of Completed Packets (0x13) plen 5    #353 [hci1] 22.169912
        Num handles: 1
        Handle: 3459 Address: DF:A9:FF:F6:B1:1A (OUI DF-A9-FF)
        Count: 1
        #352: len 5 (0 Kb/s)
        Latency: 167 msec (67-172 msec ~167 msec)
> ACL Data RX: Handle 3459 flags 0x02 dlen 9              #354 [hci1] 22.170031
      ATT: Write Request (0x12) len 4
        Handle: 0x004d
          Data: 0100
< HCI Command: Host Number of Com.. (0x03|0x0035) plen 5  #355 [hci1] 22.182361
        Num handles: 1
        Handle: 3459 Address: DF:A9:FF:F6:B1:1A (OUI DF-A9-FF)
        Count: 1
< ACL Data TX: Handle 3459 flags 0x00 dlen 5              #356 [hci1] 22.182431
      ATT: Write Response (0x13) len 0
> HCI Event: Number of Completed Packets (0x13) plen 5    #357 [hci1] 22.344795
        Num handles: 1
        Handle: 3459 Address: DF:A9:FF:F6:B1:1A (OUI DF-A9-FF)
        Count: 1
        #356: len 5 (0 Kb/s)
        Latency: 162 msec (67-172 msec ~164 msec)
> ACL Data RX: Handle 3459 flags 0x02 dlen 9              #358 [hci1] 22.344992
      ATT: Write Request (0x12) len 4
        Handle: 0x004a
          Data: 0000
< HCI Command: Host Number of Com.. (0x03|0x0035) plen 5  #359 [hci1] 22.362369
        Num handles: 1
        Handle: 3459 Address: DF:A9:FF:F6:B1:1A (OUI DF-A9-FF)
        Count: 1
< ACL Data TX: Handle 3459 flags 0x00 dlen 5              #360 [hci1] 22.362454
      ATT: Write Response (0x13) len 0
> HCI Event: Number of Completed Packets (0x13) plen 5    #361 [hci1] 22.519797
        Num handles: 1
        Handle: 3459 Address: DF:A9:FF:F6:B1:1A (OUI DF-A9-FF)
        Count: 1
        #360: len 5 (0 Kb/s)
        Latency: 157 msec (67-172 msec ~161 msec)
> ACL Data RX: Handle 3459 flags 0x02 dlen 9              #362 [hci1] 22.520001
      ATT: Write Request (0x12) len 4
        Handle: 0x004a
          Data: 0100
< HCI Command: Host Number of Com.. (0x03|0x0035) plen 5  #363 [hci1] 22.522353
        Num handles: 1
        Handle: 3459 Address: DF:A9:FF:F6:B1:1A (OUI DF-A9-FF)
        Count: 1
< ACL Data TX: Handle 3459 flags 0x00 dlen 5              #364 [hci1] 22.522522
      ATT: Write Response (0x13) len 0
> HCI Event: Number of Completed Packets (0x13) plen 5    #365 [hci1] 22.694808
        Num handles: 1
        Handle: 3459 Address: DF:A9:FF:F6:B1:1A (OUI DF-A9-FF)
        Count: 1
        #364: len 5 (0 Kb/s)
        Latency: 172 msec (67-172 msec ~166 msec)
> ACL Data RX: Handle 3459 flags 0x02 dlen 9              #366 [hci1] 22.694975
      ATT: Write Request (0x12) len 4
        Handle: 0x0045
          Data: 0000
< HCI Command: Host Number of Com.. (0x03|0x0035) plen 5  #367 [hci1] 22.702414
        Num handles: 1
        Handle: 3459 Address: DF:A9:FF:F6:B1:1A (OUI DF-A9-FF)
        Count: 1
< ACL Data TX: Handle 3459 flags 0x00 dlen 5              #368 [hci1] 22.702471
      ATT: Write Response (0x13) len 0
> HCI Event: Number of Completed Packets (0x13) plen 5    #369 [hci1] 22.869816
        Num handles: 1
        Handle: 3459 Address: DF:A9:FF:F6:B1:1A (OUI DF-A9-FF)
        Count: 1
        #368: len 5 (0 Kb/s)
        Latency: 167 msec (67-172 msec ~167 msec)
> ACL Data RX: Handle 3459 flags 0x02 dlen 9              #370 [hci1] 22.870120
      ATT: Write Request (0x12) len 4
        Handle: 0x0045
          Data: 0100
< HCI Command: Host Number of Com.. (0x03|0x0035) plen 5  #371 [hci1] 22.882368
        Num handles: 1
        Handle: 3459 Address: DF:A9:FF:F6:B1:1A (OUI DF-A9-FF)
        Count: 1
< ACL Data TX: Handle 3459 flags 0x00 dlen 5              #372 [hci1] 22.882495
      ATT: Write Response (0x13) len 0
> HCI Event: Number of Completed Packets (0x13) plen 5    #373 [hci1] 23.044899
        Num handles: 1
        Handle: 3459 Address: DF:A9:FF:F6:B1:1A (OUI DF-A9-FF)
        Count: 1
        #372: len 5 (0 Kb/s)
        Latency: 162 msec (67-172 msec ~164 msec)
> ACL Data RX: Handle 3459 flags 0x02 dlen 9              #374 [hci1] 23.045071
      ATT: Write Request (0x12) len 4
        Handle: 0x003f
          Data: 0000
< HCI Command: Host Number of Com.. (0x03|0x0035) plen 5  #375 [hci1] 23.062089
        Num handles: 1
        Handle: 3459 Address: DF:A9:FF:F6:B1:1A (OUI DF-A9-FF)
        Count: 1
< ACL Data TX: Handle 3459 flags 0x00 dlen 5              #376 [hci1] 23.062138
      ATT: Write Response (0x13) len 0
> HCI Event: Number of Completed Packets (0x13) plen 5    #377 [hci1] 23.219808
        Num handles: 1
        Handle: 3459 Address: DF:A9:FF:F6:B1:1A (OUI DF-A9-FF)
        Count: 1
        #376: len 5 (0 Kb/s)
        Latency: 157 msec (67-172 msec ~161 msec)
> ACL Data RX: Handle 3459 flags 0x02 dlen 9              #378 [hci1] 23.220046
      ATT: Write Request (0x12) len 4
        Handle: 0x003f
          Data: 0100
< HCI Command: Host Number of Com.. (0x03|0x0035) plen 5  #379 [hci1] 23.222329
        Num handles: 1
        Handle: 3459 Address: DF:A9:FF:F6:B1:1A (OUI DF-A9-FF)
        Count: 1
< ACL Data TX: Handle 3459 flags 0x00 dlen 5              #380 [hci1] 23.222394
      ATT: Write Response (0x13) len 0
> HCI Event: Number of Completed Packets (0x13) plen 5    #381 [hci1] 23.394844
        Num handles: 1
        Handle: 3459 Address: DF:A9:FF:F6:B1:1A (OUI DF-A9-FF)
        Count: 1
        #380: len 5 (0 Kb/s)
        Latency: 172 msec (67-172 msec ~166 msec)
> ACL Data RX: Handle 3459 flags 0x02 dlen 9              #382 [hci1] 23.395070
      ATT: Write Request (0x12) len 4
        Handle: 0x0050
          Data: 0000
< HCI Command: Host Number of Com.. (0x03|0x0035) plen 5  #383 [hci1] 23.402396
        Num handles: 1
        Handle: 3459 Address: DF:A9:FF:F6:B1:1A (OUI DF-A9-FF)
        Count: 1
< ACL Data TX: Handle 3459 flags 0x00 dlen 5              #384 [hci1] 23.402418
      ATT: Write Response (0x13) len 0
> HCI Event: Number of Completed Packets (0x13) plen 5    #385 [hci1] 23.569836
        Num handles: 1
        Handle: 3459 Address: DF:A9:FF:F6:B1:1A (OUI DF-A9-FF)
        Count: 1
        #384: len 5 (0 Kb/s)
        Latency: 167 msec (67-172 msec ~167 msec)
> ACL Data RX: Handle 3459 flags 0x02 dlen 9              #386 [hci1] 23.570104
      ATT: Write Request (0x12) len 4
        Handle: 0x0050
          Data: 0100
< HCI Command: Host Number of Com.. (0x03|0x0035) plen 5  #387 [hci1] 23.582364
        Num handles: 1
        Handle: 3459 Address: DF:A9:FF:F6:B1:1A (OUI DF-A9-FF)
        Count: 1
< ACL Data TX: Handle 3459 flags 0x00 dlen 5              #388 [hci1] 23.582531
      ATT: Write Response (0x13) len 0
> HCI Event: Number of Completed Packets (0x13) plen 5    #389 [hci1] 23.744811
        Num handles: 1
        Handle: 3459 Address: DF:A9:FF:F6:B1:1A (OUI DF-A9-FF)
        Count: 1
        #388: len 5 (0 Kb/s)
        Latency: 162 msec (67-172 msec ~164 msec)
> ACL Data RX: Handle 3459 flags 0x02 dlen 9              #390 [hci1] 23.745092
      ATT: Write Request (0x12) len 4
        Handle: 0x0032
          Data: 0000
< HCI Command: Host Number of Com.. (0x03|0x0035) plen 5  #391 [hci1] 23.762489
        Num handles: 1
        Handle: 3459 Address: DF:A9:FF:F6:B1:1A (OUI DF-A9-FF)
        Count: 1
< ACL Data TX: Handle 3459 flags 0x00 dlen 5              #392 [hci1] 23.762614
      ATT: Write Response (0x13) len 0
> HCI Event: Number of Completed Packets (0x13) plen 5    #393 [hci1] 23.919900
        Num handles: 1
        Handle: 3459 Address: DF:A9:FF:F6:B1:1A (OUI DF-A9-FF)
        Count: 1
        #392: len 5 (0 Kb/s)
        Latency: 157 msec (67-172 msec ~160 msec)
> ACL Data RX: Handle 3459 flags 0x02 dlen 9              #394 [hci1] 23.920016
      ATT: Write Request (0x12) len 4
        Handle: 0x0032
          Data: 0100
< HCI Command: Host Number of Com.. (0x03|0x0035) plen 5  #395 [hci1] 23.922544
        Num handles: 1
        Handle: 3459 Address: DF:A9:FF:F6:B1:1A (OUI DF-A9-FF)
        Count: 1
< ACL Data TX: Handle 3459 flags 0x00 dlen 5              #396 [hci1] 23.922593
      ATT: Write Response (0x13) len 0
> HCI Event: Number of Completed Packets (0x13) plen 5    #397 [hci1] 24.094799
        Num handles: 1
        Handle: 3459 Address: DF:A9:FF:F6:B1:1A (OUI DF-A9-FF)
        Count: 1
        #396: len 5 (0 Kb/s)
        Latency: 172 msec (67-172 msec ~166 msec)
> ACL Data RX: Handle 3459 flags 0x02 dlen 7              #398 [hci1] 24.095105
      ATT: Read Request (0x0a) len 2
        Handle: 0x003b
< HCI Command: Host Number of Com.. (0x03|0x0035) plen 5  #399 [hci1] 24.102364
        Num handles: 1
        Handle: 3459 Address: DF:A9:FF:F6:B1:1A (OUI DF-A9-FF)
        Count: 1
< ACL Data TX: Handle 3459 flags 0x00 dlen 7              #400 [hci1] 24.102514
      ATT: Read Response (0x0b) len 2
> HCI Event: Number of Completed Packets (0x13) plen 5    #401 [hci1] 24.269840
        Num handles: 1
        Handle: 3459 Address: DF:A9:FF:F6:B1:1A (OUI DF-A9-FF)
        Count: 1
        #400: len 7 (0 Kb/s)
        Latency: 167 msec (67-172 msec ~166 msec)
> ACL Data RX: Handle 3459 flags 0x02 dlen 7              #402 [hci1] 24.269992
      ATT: Read Request (0x0a) len 2
        Handle: 0x0047
< HCI Command: Host Number of Com.. (0x03|0x0035) plen 5  #403 [hci1] 24.282556
        Num handles: 1
        Handle: 3459 Address: DF:A9:FF:F6:B1:1A (OUI DF-A9-FF)
        Count: 1
< ACL Data TX: Handle 3459 flags 0x00 dlen 7              #404 [hci1] 24.282606
      ATT: Read Response (0x0b) len 2
> HCI Event: Number of Completed Packets (0x13) plen 5    #405 [hci1] 24.444880
        Num handles: 1
        Handle: 3459 Address: DF:A9:FF:F6:B1:1A (OUI DF-A9-FF)
        Count: 1
        #404: len 7 (0 Kb/s)
        Latency: 162 msec (67-172 msec ~164 msec)
> ACL Data RX: Handle 3459 flags 0x02 dlen 8              #406 [hci1] 24.445039
      ATT: Write Request (0x12) len 3
        Handle: 0x0034
          Data: 0a
< HCI Command: Host Number of Com.. (0x03|0x0035) plen 5  #407 [hci1] 24.462407
        Num handles: 1
        Handle: 3459 Address: DF:A9:FF:F6:B1:1A (OUI DF-A9-FF)
        Count: 1
< ACL Data TX: Handle 3459 flags 0x00 dlen 5              #408 [hci1] 24.462458
      ATT: Write Response (0x13) len 0
> HCI Event: Number of Completed Packets (0x13) plen 5    #409 [hci1] 24.619668
        Num handles: 1
        Handle: 3459 Address: DF:A9:FF:F6:B1:1A (OUI DF-A9-FF)
        Count: 1
        #408: len 5 (0 Kb/s)
        Latency: 157 msec (67-172 msec ~160 msec)
< ACL Data TX: Handle 3459 flags 0x00 dlen 8              #410 [hci1] 24.642686
      ATT: Handle Value Notification (0x1b) len 3
        Handle: 0x0031
          Data: 0a
> HCI Event: Number of Completed Packets (0x13) plen 5    #411 [hci1] 24.794794
        Num handles: 1
        Handle: 3459 Address: DF:A9:FF:F6:B1:1A (OUI DF-A9-FF)
        Count: 1
        #410: len 8 (0 Kb/s)
        Latency: 152 msec (67-172 msec ~156 msec)
< ACL Data TX: Handle 3459 flags 0x00 dlen 8              #412 [hci1] 34.652223
      ATT: Handle Value Notification (0x1b) len 3
        Handle: 0x0031
          Data: 07
> HCI Event: Number of Completed Packets (0x13) plen 5    #413 [hci1] 34.769473
        Num handles: 1
        Handle: 3459 Address: DF:A9:FF:F6:B1:1A (OUI DF-A9-FF)
        Count: 1
        #412: len 8 (0 Kb/s)
        Latency: 117 msec (67-172 msec ~136 msec)
< ACL Data TX: Handle 3459 flags 0x00 dlen 8              #414 [hci1] 44.662456
      ATT: Handle Value Notification (0x1b) len 3
        Handle: 0x0031
          Data: 0a
> HCI Event: Number of Completed Packets (0x13) plen 5    #415 [hci1] 44.831978
        Num handles: 1
        Handle: 3459 Address: DF:A9:FF:F6:B1:1A (OUI DF-A9-FF)
        Count: 1
        #414: len 8 (0 Kb/s)
        Latency: 169 msec (67-172 msec ~153 msec)
> HCI Event: Disconnect Complete (0x05) plen 4            #416 [hci1] 46.232101
        Status: Success (0x00)
        Handle: 3459 Address: DF:A9:FF:F6:B1:1A (OUI DF-A9-FF)
        Reason: Remote User Terminated Connection (0x13)
< HCI Command: Reset (0x03|0x0003) plen 0                 #417 [hci1] 51.072111
> HCI Event: Command Complete (0x0e) plen 4               #418 [hci1] 51.072586
      Reset (0x03|0x0003) ncmd 1
        Status: Success (0x00)
@ USER Close: main                                    {0x0001} [hci1] 51.082047
= Close Index: 00:00:00:00:00:00                               [hci1] 51.082055
