Bluetooth monitor ver 5.72
= Note: Linux version 6.14.0-36-generic (x86_64)                       0.133667
= Note: Bluetooth subsystem version 2.22                               0.133669
= New Index: 00:00:00:00:00:00 (Primary,UART,hci1)              [hci1] 0.133670
= New Index: 48:5F:99:8E:E0:64 (Primary,USB,hci0)               [hci0] 0.133671
= Open Index: 00:00:00:00:00:00                                 [hci1] 0.646991
= Index Info: 00:00:00:00:00:00 (Nordic Semiconductor ASA)      [hci1] 0.646998
@ USER Open: main (privileged) version 2.22            {0x0001} [hci1] 0.647003
< HCI Command: Reset (0x03|0x0003) plen 0                    #1 [hci1] 0.647485
> HCI Event: Command Complete (0x0e) plen 4                  #2 [hci1] 0.647997
      Reset (0x03|0x0003) ncmd 1
        Status: Success (0x00)
< HCI Command: Read Local Supported... (0x04|0x0003) plen 0  #3 [hci1] 0.667021
> HCI Event: Command Complete (0x0e) plen 12                 #4 [hci1] 0.667556
      Read Local Supported Features (0x04|0x0003) ncmd 1
        Status: Success (0x00)
        Features: 0x00 0x00 0x00 0x00 0x60 0x00 0x00 0x00
          BR/EDR Not Supported
          LE Supported (Controller)
< HCI Command: Read Local Version In.. (0x04|0x0001) plen 0  #5 [hci1] 0.686777
> HCI Event: Command Complete (0x0e) plen 12                 #6 [hci1] 0.687264
      Read Local Version Information (0x04|0x0001) ncmd 1
        Status: Success (0x00)
        HCI version: Reserved (0x0f) - Revision 12393 (0x3069)
        LMP version: Reserved (0x0f) - Subversion 12393 (0x3069)
        Manufacturer: Nordic Semiconductor ASA (89)
< HCI Command: Read Local Supported... (0x04|0x0002) plen 0  #7 [hci1] 0.706917
> HCI Event: Command Complete (0x0e) plen 68                 #8 [hci1] 0.707962
      Read Local Supported Commands (0x04|0x0002) ncmd 1
        Status: Success (0x00)
        Commands: 119 entries
          Disconnect (Octet 0 - Bit 5)
          Read Remote Version Information (Octet 2 - Bit 7)
          Set Event Mask (Octet 5 - Bit 6)
          Reset (Octet 5 - Bit 7)
          Read Connection Accept Timeout (Octet 7 - Bit 2)
          Write Connection Accept Timeout (Octet 7 - Bit 3)
          Read Transmit Power Level (Octet 10 - Bit 2)
          Set Controller To Host Flow Control (Octet 10 - Bit 5)
          Host Buffer Size (Octet 10 - Bit 6)
          Host Number of Completed Packets (Octet 10 - Bit 7)
          Read Local Version Information (Octet 14 - Bit 3)
          Read Local Supported Features (Octet 14 - Bit 5)
          Read BD ADDR (Octet 15 - Bit 1)
          Read RSSI (Octet 15 - Bit 5)
          Set Event Mask Page 2 (Octet 22 - Bit 2)
          LE Set Event Mask (Octet 25 - Bit 0)
          LE Read Buffer Size (Octet 25 - Bit 1)
          LE Read Local Supported Features (Octet 25 - Bit 2)
          LE Set Random Address (Octet 25 - Bit 4)
          LE Set Advertising Parameters (Octet 25 - Bit 5)
          LE Read Advertising Channel TX Power (Octet 25 - Bit 6)
          LE Set Advertising Data (Octet 25 - Bit 7)
          LE Set Scan Response Data (Octet 26 - Bit 0)
          LE Set Advertise Enable (Octet 26 - Bit 1)
          LE Set Scan Parameters (Octet 26 - Bit 2)
          LE Set Scan Enable (Octet 26 - Bit 3)
          LE Create Connection (Octet 26 - Bit 4)
          LE Create Connection Cancel (Octet 26 - Bit 5)
          LE Read Accept List Size (Octet 26 - Bit 6)
          LE Clear Accept List (Octet 26 - Bit 7)
          LE Add Device To Accept List (Octet 27 - Bit 0)
          LE Remove Device From Accept List (Octet 27 - Bit 1)
          LE Connection Update (Octet 27 - Bit 2)
          LE Set Host Channel Classification (Octet 27 - Bit 3)
          LE Read Channel Map (Octet 27 - Bit 4)
          LE Read Remote Used Features (Octet 27 - Bit 5)
          LE Encrypt (Octet 27 - Bit 6)
          LE Rand (Octet 27 - Bit 7)
          LE Start Encryption (Octet 28 - Bit 0)
          LE Long Term Key Request Reply (Octet 28 - Bit 1)
          LE Long Term Key Request Neg Reply (Octet 28 - Bit 2)
          LE Read Supported States (Octet 28 - Bit 3)
          LE Receiver Test (Octet 28 - Bit 4)
          LE Transmitter Test (Octet 28 - Bit 5)
          LE Test End (Octet 28 - Bit 6)
          Read Authenticated Payload Timeout (Octet 32 - Bit 4)
          Write Authenticated Payload Timeout (Octet 32 - Bit 5)
          LE Set Data Length (Octet 33 - Bit 6)
          LE Read Suggested Default Data Length (Octet 33 - Bit 7)
          LE Write Suggested Default Data Length (Octet 34 - Bit 0)
          LE Add Device To Resolving List (Octet 34 - Bit 3)
          LE Remove Device From Resolving List (Octet 34 - Bit 4)
          LE Clear Resolving List (Octet 34 - Bit 5)
          LE Read Resolving List Size (Octet 34 - Bit 6)
          LE Set Address Resolution Enable (Octet 35 - Bit 1)
          LE Set Resolvable Private Address Timeout (Octet 35 - Bit 2)
          LE Read Maximum Data Length (Octet 35 - Bit 3)
          LE Read PHY (Octet 35 - Bit 4)
          LE Set Default PHY (Octet 35 - Bit 5)
          LE Set PHY (Octet 35 - Bit 6)
          LE Enhanced Receiver Test (Octet 35 - Bit 7)
          LE Enhanced Transmitter Test (Octet 36 - Bit 0)
          LE Set Advertising Set Random Address (Octet 36 - Bit 1)
          LE Set Extended Advertising Parameters (Octet 36 - Bit 2)
          LE Set Extended Advertising Data (Octet 36 - Bit 3)
          LE Set Extended Scan Response Data (Octet 36 - Bit 4)
          LE Set Extended Advertising Enable (Octet 36 - Bit 5)
          LE Read Maximum Advertising Data Length (Octet 36 - Bit 6)
          LE Read Number of Supported Advertising Sets (Octet 36 - Bit 7)
          LE Remove Advertising Set (Octet 37 - Bit 0)
          LE Clear Advertising Sets (Octet 37 - Bit 1)
          LE Set Periodic Advertising Parameters (Octet 37 - Bit 2)
          LE Set Periodic Advertising Data (Octet 37 - Bit 3)
          LE Set Periodic Advertising Enable (Octet 37 - Bit 4)
          LE Set Extended Scan Parameters (Octet 37 - Bit 5)
          LE Set Extended Scan Enable (Octet 37 - Bit 6)
          LE Extended Create Connection (Octet 37 - Bit 7)
          LE Periodic Advertising Create Sync (Octet 38 - Bit 0)
          LE Periodic Advertising Create Sync Cancel (Octet 38 - Bit 1)
          LE Periodic Advertising Terminate Sync (Octet 38 - Bit 2)
          LE Add Device To Periodic Advertiser List (Octet 38 - Bit 3)
          LE Remove Device From Periodic Advertiser List (Octet 38 - Bit 4)
          LE Clear Periodic Advertiser List (Octet 38 - Bit 5)
          LE Read Periodic Advertiser List Size (Octet 38 - Bit 6)
          LE Read Transmit Power (Octet 38 - Bit 7)
          LE Read RF Path Compensation (Octet 39 - Bit 0)
          LE Write RF Path Compensation (Octet 39 - Bit 1)
          LE Set Privacy Mode (Octet 39 - Bit 2)
          LE Periodic Advertising Receive Enable (Octet 40 - Bit 5)
          LE Periodic Advertising Sync Transfer (Octet 40 - Bit 6)
          LE Periodic Advertising Set Info Transfer (Octet 40 - Bit 7)
          LE Periodic Advertising Sync Transfer Parameters (Octet 41 - Bit 0)
          LE Set Default Periodic Advertisng Sync Transfer Parameters (Octet 41 - Bit 1)
          LE Read Buffer v2 (Octet 41 - Bit 5)
          LE Read ISO TX Sync (Octet 41 - Bit 6)
          LE Set Connected Isochronous Group Parameters (Octet 41 - Bit 7)
          LE Set Connected Isochronous Group Parameters Test (Octet 42 - Bit 0)
          LE Create Connected Isochronous Stream (Octet 42 - Bit 1)
          LE Remove Connected Isochronous Group (Octet 42 - Bit 2)
          LE Accept Connected Isochronous Stream Request (Octet 42 - Bit 3)
          LE Reject Connected Isochronous Stream Request (Octet 42 - Bit 4)
          LE Create Broadcast Isochronous Group (Octet 42 - Bit 5)
          LE Create Broadcast Isochronous Group Test (Octet 42 - Bit 6)
          LE Terminate Broadcast Isochronous Group (Octet 42 - Bit 7)
          LE Broadcast Isochronous Group Create Sync (Octet 43 - Bit 0)
          LE Broadcast Isochronous Group Terminate Sync (Octet 43 - Bit 1)
          LE Request Peer SCA (Octet 43 - Bit 2)
          LE Setup Isochronous Data Path (Octet 43 - Bit 3)
          LE Remove Isochronous Data Path (Octet 43 - Bit 4)
          LE Isochronous Transmit Test (Octet 43 - Bit 5)
          LE Isochronous Receive Test (Octet 43 - Bit 6)
          LE Isochronous Read Test Counters (Octet 43 - Bit 7)
          LE Isochronous Read Test Counters (Octet 44 - Bit 0)
          LE Set Host Feature (Octet 44 - Bit 1)
          Octet 44 - Bit 2 
          Octet 45 - Bit 6 
          Octet 46 - Bit 0 
          Octet 46 - Bit 1 
          Octet 46 - Bit 2 
< HCI Command: Host Buffer Size (0x03|0x0033) plen 7         #9 [hci1] 0.726925
        ACL MTU: 255  ACL max packet: 16
        SCO MTU: 0    SCO max packet: 0
> HCI Event: Command Complete (0x0e) plen 4                 #10 [hci1] 0.727426
      Host Buffer Size (0x03|0x0033) ncmd 1
        Status: Success (0x00)
< HCI Command: Set Controller To Ho.. (0x03|0x0031) plen 1  #11 [hci1] 0.746916
        Flow control: ACL Data Packets (0x01)
> HCI Event: Command Complete (0x0e) plen 4                 #12 [hci1] 0.747342
      Set Controller To Host Flow Control (0x03|0x0031) ncmd 1
        Status: Success (0x00)
< HCI Command: LE Read Local Suppor.. (0x08|0x0003) plen 0  #13 [hci1] 0.766911
> HCI Event: Command Complete (0x0e) plen 12                #14 [hci1] 0.767437
      LE Read Local Supported Features (0x08|0x0003) ncmd 1
        Status: Success (0x00)
        Features: 0xfd 0x79 0x00 0xf7 0x30 0x01 0x00 0x00
          LE Encryption
          Extended Reject Indication
          Peripheral-initiated Features Exchange
          LE Ping
          LE Data Packet Length Extension
          LL Privacy
          Extended Scanner Filter Policies
          LE 2M PHY
          LE Coded PHY
          LE Extended Advertising
          LE Periodic Advertising
          Channel Selection Algorithm #2
          Periodic Advertising Sync Transfer - Sender
          Periodic Advertising Sync Transfer - Recipient
          Sleep Clock Accuracy Updates
          Connected Isochronous Stream - Central
          Connected Isochronous Stream - Peripheral
          Isochronous Broadcaster
          Synchronized Receiver
          Periodic Advertising ADI support
          Connection Subrating
          Unknown features (0x0000010000000000)
< HCI Command: LE Set Host Feature (0x08|0x0074) plen 2     #15 [hci1] 0.786936
        Bit Number: 32
          Connected Isochronous Stream (Host Support)
        Bit Value: 1
> HCI Event: Command Complete (0x0e) plen 4                 #16 [hci1] 0.787357
      LE Set Host Feature (0x08|0x0074) ncmd 1
        Status: Success (0x00)
< HCI Command: LE Read Buffer v2 (0x08|0x0060) plen 0       #17 [hci1] 0.806925
> HCI Event: Command Complete (0x0e) plen 10                #18 [hci1] 0.807344
      LE Read Buffer v2 (0x08|0x0060) ncmd 1
        Status: Success (0x00)
        ACL MTU: 27
        ACL max packet: 3
        ISO MTU: 318
        ISO max packet: 3
< HCI Command: LE Read Maximum Adve.. (0x08|0x003a) plen 0  #19 [hci1] 0.826953
> HCI Event: Command Complete (0x0e) plen 6                 #20 [hci1] 0.827359
      LE Read Maximum Advertising Data Length (0x08|0x003a) ncmd 1
        Status: Success (0x00)
        Max length: 1650
< HCI Command: LE Read Supported St.. (0x08|0x001c) plen 0  #21 [hci1] 0.846899
> HCI Event: Command Complete (0x0e) plen 12                #22 [hci1] 0.847358
      LE Read Supported States (0x08|0x001c) ncmd 1
        Status: Success (0x00)
        States: 0x000003ff3e0306ff
          Non-connectable Advertising State
          Scannable Advertising State
          Connectable Advertising State
          High Duty Cycle Directed Advertising State
          Passive Scanning State
          Active Scanning State
          Initiating State
            and Connection State (Central Role)
          Connection State (Peripheral Role)
          Scannable Advertising State
            and Passive Scanning State
          Connectable Advertising State
            and Passive Scanning State
          Non-connectable Advertising State
            and Initiating State
          Scannable Advertising State
            and Initiating State
          Active Scanning State
            and Connection State (Central Role)
          Passive Scanning State
            and Connection State (Peripheral Role)
          Active Scanning State
            and Connection State (Peripheral Role)
          Initiating State
            and Connection State (Central Role)
            and Central Role & Central Role
          Low Duty Cycle Directed Advertising State
          Connectable Advertising State
            and Initiating State
            and Central Role & Peripheral Role
          High Duty Cycle Directed Advertising State
            and Initiating State
            and Central Role & Peripheral Role
          Low Duty Cycle Directed Advertising State
            and Initiating State
            and Central Role & Peripheral Role
          Connectable Advertising State
            and Connection State (Central Role)
            and Central Role & Peripheral Role
          High Duty Cycle Directed Advertising State
            and Connection State (Central Role)
            and Central Role & Peripheral Role
          Low Duty Cycle Directed Advertising State
            and Connection State (Central Role)
            and Central Role & Peripheral Role
          Connectable Advertising State
            and Connection State (Peripheral Role)
            and Central Role & Peripheral Role
          High Duty Cycle Directed Advertising State
            and Connection State (Peripheral Role)
            and Peripheral Role & Peripheral Role
          Low Duty Cycle Directed Advertising State
            and Connection State (Peripheral Role)
            and Peripheral Role & Peripheral Role
          Initiating State
            and Connection State (Peripheral Role)
            and Central Role & Peripheral Role
< HCI Command: LE Read Maximum Data.. (0x08|0x002f) plen 0  #23 [hci1] 0.866926
> HCI Event: Command Complete (0x0e) plen 12                #24 [hci1] 0.867376
      LE Read Maximum Data Length (0x08|0x002f) ncmd 1
        Status: Success (0x00)
        Max TX octets: 251
        Max TX time: 2704
        Max RX octets: 251
        Max RX time: 2704
< HCI Command: LE Write Suggested D.. (0x08|0x0024) plen 4  #25 [hci1] 0.886924
        TX octets: 251
        TX time: 2704
> HCI Event: Command Complete (0x0e) plen 4                 #26 [hci1] 0.887387
      LE Write Suggested Default Data Length (0x08|0x0024) ncmd 1
        Status: Success (0x00)
< HCI Command: LE Read Resolving Li.. (0x08|0x002a) plen 0  #27 [hci1] 0.906947
> HCI Event: Command Complete (0x0e) plen 5                 #28 [hci1] 0.907361
      LE Read Resolving List Size (0x08|0x002a) ncmd 1
        Status: Success (0x00)
        Size: 8
< HCI Command: LE Set Event Mask (0x08|0x0001) plen 8       #29 [hci1] 0.926920
        Mask: 0x000002023f87fa5e
          LE Advertising Report
          LE Connection Update Complete
          LE Read Remote Used Features Complete
          LE Long Term Key Request
          LE Data Length Change
          LE Enhanced Connection Complete
          LE PHY Update Complete
          LE Extended Advertising Report
          LE Periodic Advertising Sync Established
          LE Periodic Advertising Report
          LE Periodic Advertising Sync Lost
          LE Extended Scan Timeout
          LE Extended Advertising Set Terminated
          LE Scan Request Received
          LE Periodic Advertising Sync Transfer Rvc
          LE CIS Established
          LE CIS Request
          LE Create BIG Complete
          LE Terminate BIG Complete
          LE BIG Sync Estabilished Complete
          LE BIG Sync Lost
          LE BIG Info Advertising Report
          Unknown mask (0x0000020000000000)
> HCI Event: Command Complete (0x0e) plen 4                 #30 [hci1] 0.927491
      LE Set Event Mask (0x08|0x0001) ncmd 1
        Status: Success (0x00)
< HCI Command: Set Event Mask (0x03|0x0001) plen 8          #31 [hci1] 0.946931
        Mask: 0x2000800002008890
          Disconnection Complete
          Encryption Change
          Read Remote Version Information Complete
          Hardware Error
          Data Buffer Overflow
          Encryption Key Refresh Complete
          LE Meta
> HCI Event: Command Complete (0x0e) plen 4                 #32 [hci1] 0.947420
      Set Event Mask (0x03|0x0001) ncmd 1
        Status: Success (0x00)
< HCI Command: Read BD ADDR (0x04|0x0009) plen 0            #33 [hci1] 0.966926
> HCI Event: Command Complete (0x0e) plen 10                #34 [hci1] 0.967381
      Read BD ADDR (0x04|0x0009) ncmd 1
        Status: Success (0x00)
        Address: 00:00:00:00:00:00 (OUI 00-00-00)
< HCI Command: LE Set Random Address (0x08|0x0005) plen 6   #35 [hci1] 0.986937
        Address: D5:B6:CC:31:DB:3B (Static)
> HCI Event: Command Complete (0x0e) plen 4                 #36 [hci1] 0.987495
      LE Set Random Address (0x08|0x0005) ncmd 1
        Status: Success (0x00)
< HCI Command: LE Set Random Address (0x08|0x0005) plen 6   #37 [hci1] 4.646895
        Address: 26:66:F9:08:61:8E (Non-Resolvable)
> HCI Event: Command Complete (0x0e) plen 4                 #38 [hci1] 4.647380
      LE Set Random Address (0x08|0x0005) ncmd 1
        Status: Success (0x00)
< HCI Command: LE Set Extended Scan.. (0x08|0x0041) plen 8  #39 [hci1] 4.666807
        Own address type: Random (0x01)
        Filter policy: Accept all advertisement (0x00)
        PHYs: 0x01
        Entry 0: LE 1M
          Type: Active (0x01)
          Interval: 60.000 msec (0x0060)
          Window: 30.000 msec (0x0030)
> HCI Event: Command Complete (0x0e) plen 4                 #40 [hci1] 4.667337
      LE Set Extended Scan Parameters (0x08|0x0041) ncmd 1
        Status: Success (0x00)
< HCI Command: LE Set Extended Scan.. (0x08|0x0042) plen 6  #41 [hci1] 4.686817
        Extended scan: Enabled (0x01)
        Filter duplicates: Enabled (0x01)
        Duration: 0 msec (0x0000)
        Period: 0.00 sec (0x0000)
> HCI Event: Command Complete (0x0e) plen 4                 #42 [hci1] 4.687405
      LE Set Extended Scan Enable (0x08|0x0042) ncmd 1
        Status: Success (0x00)
> HCI Event: LE Meta Event (0x3e) plen 57                   #43 [hci1] 4.693757
      LE Extended Advertising Report (0x0d)
        Num reports: 1
        Entry 0
          Event type: 0x0010
            Props: 0x0010
              Use legacy advertising PDUs
            Data status: [0;32mComplete[0m
          Legacy PDU Type: ADV_NONCONN_IND (0x0010)
          Address type: Random (0x01)
          Address: 39:71:82:82:45:1E (Non-Resolvable)
          Primary PHY: LE 1M
          Secondary PHY: No packets
          SID: no ADI field (0xff)
          TX power: 127 dBm
          RSSI: -90 dBm (0xa6)
          Periodic advertising interval: 0.00 msec (0x0000)
          Direct address type: Reserved (0xff)
          Direct address: 00-00-00-00-00-00
          Data length: 0x1f
        1e ff 06 00 01 0f 20 22 56 75 1e 13 9d 03 5c 87  ...... "Vu....\.
        e0 3d d0 6c d3 fd b0 45 5f 62 e3 f6 43 03 e4     .=.l...E_b..C.. 
        Company: Microsoft (6)
          Data: 010f202256751e139d035c87e03dd06cd3fdb0455f62e3f64303e4
> HCI Event: LE Meta Event (0x3e) plen 38                   #44 [hci1] 4.768966
      LE Extended Advertising Report (0x0d)
        Num reports: 1
        Entry 0
          Event type: 0x0012
            Props: 0x0012
              Scannable
              Use legacy advertising PDUs
            Data status: [0;32mComplete[0m
          Legacy PDU Type: ADV_SCAN_IND (0x0012)
          Address type: Random (0x01)
          Address: 4F:20:12:A2:DC:25 (Resolvable)
          Primary PHY: LE 1M
          Secondary PHY: No packets
          SID: no ADI field (0xff)
          TX power: 127 dBm
          RSSI: -88 dBm (0xa8)
          Periodic advertising interval: 0.00 msec (0x0000)
          Direct address type: Reserved (0xff)
          Direct address: 00-00-00-00-00-00
          Data length: 0x0c
        0b ff 4c 00 09 06 03 00 0a 03 07 11              ..L.........    
        Company: Apple, Inc. (76)
          Type: Apple TV (9)
          Data: 03000a030711
> HCI Event: LE Meta Event (0x3e) plen 26                   #45 [hci1] 4.769469
      LE Extended Advertising Report (0x0d)
        Num reports: 1
        Entry 0
          Event type: 0x001a
            Props: 0x001a
              Scannable
              Scan response
              Use legacy advertising PDUs
            Data status: [0;32mComplete[0m
          Legacy PDU Type: SCAN_RSP to an ADV_IND (0x001a)
          Address type: Random (0x01)
          Address: 4F:20:12:A2:DC:25 (Resolvable)
          Primary PHY: LE 1M
          Secondary PHY: No packets
          SID: no ADI field (0xff)
          TX power: 127 dBm
          RSSI: -89 dBm (0xa7)
          Periodic advertising interval: 0.00 msec (0x0000)
          Direct address type: Reserved (0xff)
          Direct address: 00-00-00-00-00-00
          Data length: 0x00
> HCI Event: LE Meta Event (0x3e) plen 55                   #46 [hci1] 4.773142
      LE Extended Advertising Report (0x0d)
        Num reports: 1
        Entry 0
          Event type: 0x0010
            Props: 0x0010
              Use legacy advertising PDUs
            Data status: [0;32mComplete[0m
          Legacy PDU Type: ADV_NONCONN_IND (0x0010)
          Address type: Random (0x01)
          Address: 16:00:D2:EA:AC:D4 (Non-Resolvable)
          Primary PHY: LE 1M
          Secondary PHY: No packets
          SID: no ADI field (0xff)
          TX power: 127 dBm
          RSSI: -81 dBm (0xaf)
          Periodic advertising interval: 0.00 msec (0x0000)
          Direct address type: Reserved (0xff)
          Direct address: 00-00-00-00-00-00
          Data length: 0x1d
        1c ff 06 00 01 09 21 0a 4d e0 8a 52 d2 d4 4c 41  ......!.M..R..LA
        50 54 4f 50 2d 45 35 32 45 4f 44 32 49           PTOP-E52EOD2I   
        Company: Microsoft (6)
          Data: 0109210a4de08a52d2d44c4150544f502d453532454f443249
> HCI Event: LE Meta Event (0x3e) plen 54                   #47 [hci1] 4.775853
      LE Extended Advertising Report (0x0d)
        Num reports: 1
        Entry 0
          Event type: 0x0010
            Props: 0x0010
              Use legacy advertising PDUs
            Data status: [0;32mComplete[0m
          Legacy PDU Type: ADV_NONCONN_IND (0x0010)
          Address type: Public (0x00)
          Address: A4:30:7A:95:74:FB (Samsung Electronics Co.,Ltd)
          Primary PHY: LE 1M
          Secondary PHY: No packets
          SID: no ADI field (0xff)
          TX power: 127 dBm
          RSSI: -89 dBm (0xa7)
          Periodic advertising interval: 0.00 msec (0x0000)
          Direct address type: Reserved (0xff)
          Direct address: 00-00-00-00-00-00
          Data length: 0x1c
        1b ff 75 00 42 04 01 80 6e a4 30 7a 95 74 fb a6  ..u.B...n.0z.t..
        30 7a 95 74 fa 01 d8 41 c5 d9 00 00              0z.t...A....    
        Company: Samsung Electronics Co. Ltd. (117)
          Data: 420401806ea4307a9574fba6307a9574fa01d841c5d90000
> HCI Event: LE Meta Event (0x3e) plen 55                   #48 [hci1] 4.873261
      LE Extended Advertising Report (0x0d)
        Num reports: 1
        Entry 0
          Event type: 0x0010
            Props: 0x0010
              Use legacy advertising PDUs
            Data status: [0;32mComplete[0m
          Legacy PDU Type: ADV_NONCONN_IND (0x0010)
          Address type: Random (0x01)
          Address: 16:00:D2:EA:AC:D4 (Non-Resolvable)
          Primary PHY: LE 1M
          Secondary PHY: No packets
          SID: no ADI field (0xff)
          TX power: 127 dBm
          RSSI: -89 dBm (0xa7)
          Periodic advertising interval: 0.00 msec (0x0000)
          Direct address type: Reserved (0xff)
          Direct address: 00-00-00-00-00-00
          Data length: 0x1d
        1c ff 06 00 01 09 21 0a 4d e0 8a 52 d2 d4 4c 41  ......!.M..R..LA
        50 54 4f 50 2d 45 35 32 45 4f 44 32 49           PTOP-E52EOD2I   
        Company: Microsoft (6)
          Data: 0109210a4de08a52d2d44c4150544f502d453532454f443249
> HCI Event: LE Meta Event (0x3e) plen 57                   #49 [hci1] 4.943107
      LE Extended Advertising Report (0x0d)
        Num reports: 1
        Entry 0
          Event type: 0x0013
            Props: 0x0013
              Connectable
              Scannable
              Use legacy advertising PDUs
            Data status: [0;32mComplete[0m
          Legacy PDU Type: ADV_IND (0x0013)
          Address type: Random (0x01)
          Address: F3:4B:0E:78:72:2A (Static)
          Primary PHY: LE 1M
          Secondary PHY: No packets
          SID: no ADI field (0xff)
          TX power: 127 dBm
          RSSI: -87 dBm (0xa9)
          Periodic advertising interval: 0.00 msec (0x0000)
          Direct address type: Reserved (0xff)
          Direct address: 00-00-00-00-00-00
          Data length: 0x1f
        02 01 06 1b ff 99 04 05 10 4d 2a ba c0 dd 04 08  .........M*.....
        00 58 00 04 ae f6 5d 07 b0 f3 4b 0e 78 72 2a     .X....]...K.xr* 
        Flags: 0x06
          LE General Discoverable Mode
          BR/EDR Not Supported
        Company: Ruuvi Innovations Ltd. (1177)
          Data: 05104d2abac0dd040800580004aef65d07b0f34b0e78722a
> HCI Event: LE Meta Event (0x3e) plen 56                   #50 [hci1] 4.943944
      LE Extended Advertising Report (0x0d)
        Num reports: 1
        Entry 0
          Event type: 0x001b
            Props: 0x001b
              Connectable
              Scannable
              Scan response
              Use legacy advertising PDUs
            Data status: [0;32mComplete[0m
          Legacy PDU Type: SCAN_RSP to an ADV_SCAN_IND (0x001b)
          Address type: Random (0x01)
          Address: F3:4B:0E:78:72:2A (Static)
          Primary PHY: LE 1M
          Secondary PHY: No packets
          SID: no ADI field (0xff)
          TX power: 127 dBm
          RSSI: -86 dBm (0xaa)
          Periodic advertising interval: 0.00 msec (0x0000)
          Direct address type: Reserved (0xff)
          Direct address: 00-00-00-00-00-00
          Data length: 0x1e
        11 07 9e ca dc 24 0e e5 a9 e0 93 f3 a3 b5 01 00  .....$..........
        40 6e 0b 09 52 75 75 76 69 20 37 32 32 41        @n..Ruuvi 722A  
        128-bit Service UUIDs (complete): 1 entry
          Nordic UART Service
        Name (complete): Ruuvi 722A
> HCI Event: LE Meta Event (0x3e) plen 54                   #51 [hci1] 4.958118
      LE Extended Advertising Report (0x0d)
        Num reports: 1
        Entry 0
          Event type: 0x0010
            Props: 0x0010
              Use legacy advertising PDUs
            Data status: [0;32mComplete[0m
          Legacy PDU Type: ADV_NONCONN_IND (0x0010)
          Address type: Public (0x00)
          Address: A4:30:7A:95:74:FB (Samsung Electronics Co.,Ltd)
          Primary PHY: LE 1M
          Secondary PHY: No packets
          SID: no ADI field (0xff)
          TX power: 127 dBm
          RSSI: -89 dBm (0xa7)
          Periodic advertising interval: 0.00 msec (0x0000)
          Direct address type: Reserved (0xff)
          Direct address: 00-00-00-00-00-00
          Data length: 0x1c
        1b ff 75 00 42 04 01 80 6e a4 30 7a 95 74 fb a6  ..u.B...n.0z.t..
        30 7a 95 74 fa 01 d8 41 c5 d9 00 00              0z.t...A....    
        Company: Samsung Electronics Co. Ltd. (117)
          Data: 420401806ea4307a9574fba6307a9574fa01d841c5d90000
> HCI Event: LE Meta Event (0x3e) plen 26                   #52 [hci1] 5.007940
      LE Extended Advertising Report (0x0d)
        Num reports: 1
        Entry 0
          Event type: 0x0010
            Props: 0x0010
              Use legacy advertising PDUs
            Data status: [0;32mComplete[0m
          Legacy PDU Type: ADV_NONCONN_IND (0x0010)
          Address type: Public (0x00)
          Address: 90:CD:B6:41:AD:52 (Hon Hai Precision Ind. Co.,Ltd.)
          Primary PHY: LE 1M
          Secondary PHY: No packets
          SID: no ADI field (0xff)
          TX power: 127 dBm
          RSSI: -85 dBm (0xab)
          Periodic advertising interval: 0.00 msec (0x0000)
          Direct address type: Reserved (0xff)
          Direct address: 00-00-00-00-00-00
          Data length: 0x00
> HCI Event: LE Meta Event (0x3e) plen 57                   #53 [hci1] 5.015637
      LE Extended Advertising Report (0x0d)
        Num reports: 1
        Entry 0
          Event type: 0x0010
            Props: 0x0010
              Use legacy advertising PDUs
            Data status: [0;32mComplete[0m
          Legacy PDU Type: ADV_NONCONN_IND (0x0010)
          Address type: Random (0x01)
          Address: 39:71:82:82:45:1E (Non-Resolvable)
          Primary PHY: LE 1M
          Secondary PHY: No packets
          SID: no ADI field (0xff)
          TX power: 127 dBm
          RSSI: -94 dBm (0xa2)
          Periodic advertising interval: 0.00 msec (0x0000)
          Direct address type: Reserved (0xff)
          Direct address: 00-00-00-00-00-00
          Data length: 0x1f
        1e ff 06 00 01 0f 20 22 56 75 1e 13 9d 03 5c 87  ...... "Vu....\.
        e0 3d d0 6c d3 fd b0 45 5f 62 e3 f6 43 03 e4     .=.l...E_b..C.. 
        Company: Microsoft (6)
          Data: 010f202256751e139d035c87e03dd06cd3fdb0455f62e3f64303e4
> HCI Event: LE Meta Event (0x3e) plen 29                   #54 [hci1] 5.061334
      LE Extended Advertising Report (0x0d)
        Num reports: 1
        Entry 0
          Event type: 0x0013
            Props: 0x0013
              Connectable
              Scannable
              Use legacy advertising PDUs
            Data status: [0;32mComplete[0m
          Legacy PDU Type: ADV_IND (0x0013)
          Address type: Random (0x01)
          Address: 6D:10:FC:16:36:5E (Resolvable)
          Primary PHY: LE 1M
          Secondary PHY: No packets
          SID: no ADI field (0xff)
          TX power: 127 dBm
          RSSI: -92 dBm (0xa4)
          Periodic advertising interval: 0.00 msec (0x0000)
          Direct address type: Reserved (0xff)
          Direct address: 00-00-00-00-00-00
          Data length: 0x03
        02 01 06                                         ...             
        Flags: 0x06
          LE General Discoverable Mode
          BR/EDR Not Supported
> HCI Event: LE Meta Event (0x3e) plen 57                   #55 [hci1] 5.075243
      LE Extended Advertising Report (0x0d)
        Num reports: 1
        Entry 0
          Event type: 0x0010
            Props: 0x0010
              Use legacy advertising PDUs
            Data status: [0;32mComplete[0m
          Legacy PDU Type: ADV_NONCONN_IND (0x0010)
          Address type: Random (0x01)
          Address: 02:AB:36:96:79:F2 (Non-Resolvable)
          Primary PHY: LE 1M
          Secondary PHY: No packets
          SID: no ADI field (0xff)
          TX power: 127 dBm
          RSSI: -92 dBm (0xa4)
          Periodic advertising interval: 0.00 msec (0x0000)
          Direct address type: Reserved (0xff)
          Direct address: 00-00-00-00-00-00
          Data length: 0x1f
        1e ff 06 00 01 09 20 22 49 be 28 71 21 e4 38 42  ...... "I.(q!.8B
        df b7 b3 50 7e 51 ec 69 de 6b a3 5e 11 2c d7     ...P~Q.i.k.^.,. 
        Company: Microsoft (6)
          Data: 0109202249be287121e43842dfb7b3507e51ec69de6ba35e112cd7
> HCI Event: LE Meta Event (0x3e) plen 54                   #56 [hci1] 5.118047
      LE Extended Advertising Report (0x0d)
        Num reports: 1
        Entry 0
          Event type: 0x0010
            Props: 0x0010
              Use legacy advertising PDUs
            Data status: [0;32mComplete[0m
          Legacy PDU Type: ADV_NONCONN_IND (0x0010)
          Address type: Public (0x00)
          Address: A4:30:7A:95:74:FB (Samsung Electronics Co.,Ltd)
          Primary PHY: LE 1M
          Secondary PHY: No packets
          SID: no ADI field (0xff)
          TX power: 127 dBm
          RSSI: -89 dBm (0xa7)
          Periodic advertising interval: 0.00 msec (0x0000)
          Direct address type: Reserved (0xff)
          Direct address: 00-00-00-00-00-00
          Data length: 0x1c
        1b ff 75 00 42 04 01 80 6e a4 30 7a 95 74 fb a6  ..u.B...n.0z.t..
        30 7a 95 74 fa 01 d8 41 c5 d9 00 00              0z.t...A....    
        Company: Samsung Electronics Co. Ltd. (117)
          Data: 420401806ea4307a9574fba6307a9574fa01d841c5d90000
> HCI Event: LE Meta Event (0x3e) plen 57                   #57 [hci1] 5.126322
      LE Extended Advertising Report (0x0d)
        Num reports: 1
        Entry 0
          Event type: 0x0010
            Props: 0x0010
              Use legacy advertising PDUs
            Data status: [0;32mComplete[0m
          Legacy PDU Type: ADV_NONCONN_IND (0x0010)
          Address type: Random (0x01)
          Address: 39:71:82:82:45:1E (Non-Resolvable)
          Primary PHY: LE 1M
          Secondary PHY: No packets
          SID: no ADI field (0xff)
          TX power: 127 dBm
          RSSI: -88 dBm (0xa8)
          Periodic advertising interval: 0.00 msec (0x0000)
          Direct address type: Reserved (0xff)
          Direct address: 00-00-00-00-00-00
          Data length: 0x1f
        1e ff 06 00 01 0f 20 22 56 75 1e 13 9d 03 5c 87  ...... "Vu....\.
        e0 3d d0 6c d3 fd b0 45 5f 62 e3 f6 43 03 e4     .=.l...E_b..C.. 
        Company: Microsoft (6)
          Data: 010f202256751e139d035c87e03dd06cd3fdb0455f62e3f64303e4
> HCI Event: LE Meta Event (0x3e) plen 57                   #58 [hci1] 5.175800
      LE Extended Advertising Report (0x0d)
        Num reports: 1
        Entry 0
          Event type: 0x0010
            Props: 0x0010
              Use legacy advertising PDUs
            Data status: [0;32mComplete[0m
          Legacy PDU Type: ADV_NONCONN_IND (0x0010)
          Address type: Random (0x01)
          Address: 02:AB:36:96:79:F2 (Non-Resolvable)
          Primary PHY: LE 1M
          Secondary PHY: No packets
          SID: no ADI field (0xff)
          TX power: 127 dBm
          RSSI: -91 dBm (0xa5)
          Periodic advertising interval: 0.00 msec (0x0000)
          Direct address type: Reserved (0xff)
          Direct address: 00-00-00-00-00-00
          Data length: 0x1f
        1e ff 06 00 01 09 20 22 49 be 28 71 21 e4 38 42  ...... "I.(q!.8B
        df b7 b3 50 7e 51 ec 69 de 6b a3 5e 11 2c d7     ...P~Q.i.k.^.,. 
        Company: Microsoft (6)
          Data: 0109202249be287121e43842dfb7b3507e51ec69de6ba35e112cd7
> HCI Event: LE Meta Event (0x3e) plen 38                   #59 [hci1] 5.178884
      LE Extended Advertising Report (0x0d)
        Num reports: 1
        Entry 0
          Event type: 0x0012
            Props: 0x0012
              Scannable
              Use legacy advertising PDUs
            Data status: [0;32mComplete[0m
          Legacy PDU Type: ADV_SCAN_IND (0x0012)
          Address type: Random (0x01)
          Address: 4F:20:12:A2:DC:25 (Resolvable)
          Primary PHY: LE 1M
          Secondary PHY: No packets
          SID: no ADI field (0xff)
          TX power: 127 dBm
          RSSI: -92 dBm (0xa4)
          Periodic advertising interval: 0.00 msec (0x0000)
          Direct address type: Reserved (0xff)
          Direct address: 00-00-00-00-00-00
          Data length: 0x0c
        0b ff 4c 00 09 06 03 00 0a 03 07 11              ..L.........    
        Company: Apple, Inc. (76)
          Type: Apple TV (9)
          Data: 03000a030711
> HCI Event: LE Meta Event (0x3e) plen 55                   #60 [hci1] 5.185844
      LE Extended Advertising Report (0x0d)
        Num reports: 1
        Entry 0
          Event type: 0x0010
            Props: 0x0010
              Use legacy advertising PDUs
            Data status: [0;32mComplete[0m
          Legacy PDU Type: ADV_NONCONN_IND (0x0010)
          Address type: Random (0x01)
          Address: 16:00:D2:EA:AC:D4 (Non-Resolvable)
          Primary PHY: LE 1M
          Secondary PHY: No packets
          SID: no ADI field (0xff)
          TX power: 127 dBm
          RSSI: -87 dBm (0xa9)
          Periodic advertising interval: 0.00 msec (0x0000)
          Direct address type: Reserved (0xff)
          Direct address: 00-00-00-00-00-00
          Data length: 0x1d
        1c ff 06 00 01 09 21 0a 4d e0 8a 52 d2 d4 4c 41  ......!.M..R..LA
        50 54 4f 50 2d 45 35 32 45 4f 44 32 49           PTOP-E52EOD2I   
        Company: Microsoft (6)
          Data: 0109210a4de08a52d2d44c4150544f502d453532454f443249
> HCI Event: LE Meta Event (0x3e) plen 57                   #61 [hci1] 5.186896
      LE Extended Advertising Report (0x0d)
        Num reports: 1
        Entry 0
          Event type: 0x0013
            Props: 0x0013
              Connectable
              Scannable
              Use legacy advertising PDUs
            Data status: [0;32mComplete[0m
          Legacy PDU Type: ADV_IND (0x0013)
          Address type: Random (0x01)
          Address: D4:70:55:10:84:95 (Static)
          Primary PHY: LE 1M
          Secondary PHY: No packets
          SID: no ADI field (0xff)
          TX power: 127 dBm
          RSSI: -86 dBm (0xaa)
          Periodic advertising interval: 0.00 msec (0x0000)
          Direct address type: Reserved (0xff)
          Direct address: 00-00-00-00-00-00
          Data length: 0x1f
        02 01 06 1b ff 99 04 05 10 51 29 f7 c0 e2 ff dc  .........Q).....
        04 18 00 34 af 56 c7 07 88 d4 70 55 10 84 95     ...4.V....pU... 
        Flags: 0x06
          LE General Discoverable Mode
          BR/EDR Not Supported
        Company: Ruuvi Innovations Ltd. (1177)
          Data: 05105129f7c0e2ffdc04180034af56c70788d47055108495
> HCI Event: LE Meta Event (0x3e) plen 56                   #62 [hci1] 5.187682
      LE Extended Advertising Report (0x0d)
        Num reports: 1
        Entry 0
          Event type: 0x001b
            Props: 0x001b
              Connectable
              Scannable
              Scan response
              Use legacy advertising PDUs
            Data status: [0;32mComplete[0m
          Legacy PDU Type: SCAN_RSP to an ADV_SCAN_IND (0x001b)
          Address type: Random (0x01)
          Address: D4:70:55:10:84:95 (Static)
          Primary PHY: LE 1M
          Secondary PHY: No packets
          SID: no ADI field (0xff)
          TX power: 127 dBm
          RSSI: -87 dBm (0xa9)
          Periodic advertising interval: 0.00 msec (0x0000)
          Direct address type: Reserved (0xff)
          Direct address: 00-00-00-00-00-00
          Data length: 0x1e
        11 07 9e ca dc 24 0e e5 a9 e0 93 f3 a3 b5 01 00  .....$..........
        40 6e 0b 09 52 75 75 76 69 20 38 34 39 35        @n..Ruuvi 8495  
        128-bit Service UUIDs (complete): 1 entry
          Nordic UART Service
        Name (complete): Ruuvi 8495
> HCI Event: LE Meta Event (0x3e) plen 55                   #63 [hci1] 5.295129
      LE Extended Advertising Report (0x0d)
        Num reports: 1
        Entry 0
          Event type: 0x0010
            Props: 0x0010
              Use legacy advertising PDUs
            Data status: [0;32mComplete[0m
          Legacy PDU Type: ADV_NONCONN_IND (0x0010)
          Address type: Random (0x01)
          Address: 16:00:D2:EA:AC:D4 (Non-Resolvable)
          Primary PHY: LE 1M
          Secondary PHY: No packets
          SID: no ADI field (0xff)
          TX power: 127 dBm
          RSSI: -81 dBm (0xaf)
          Periodic advertising interval: 0.00 msec (0x0000)
          Direct address type: Reserved (0xff)
          Direct address: 00-00-00-00-00-00
          Data length: 0x1d
        1c ff 06 00 01 09 21 0a 4d e0 8a 52 d2 d4 4c 41  ......!.M..R..LA
        50 54 4f 50 2d 45 35 32 45 4f 44 32 49           PTOP-E52EOD2I   
        Company: Microsoft (6)
          Data: 0109210a4de08a52d2d44c4150544f502d453532454f443249
> HCI Event: LE Meta Event (0x3e) plen 38                   #64 [hci1] 5.315254
      LE Extended Advertising Report (0x0d)
        Num reports: 1
        Entry 0
          Event type: 0x0012
            Props: 0x0012
              Scannable
              Use legacy advertising PDUs
            Data status: [0;32mComplete[0m
          Legacy PDU Type: ADV_SCAN_IND (0x0012)
          Address type: Random (0x01)
          Address: 4F:20:12:A2:DC:25 (Resolvable)
          Primary PHY: LE 1M
          Secondary PHY: No packets
          SID: no ADI field (0xff)
          TX power: 127 dBm
          RSSI: -90 dBm (0xa6)
          Periodic advertising interval: 0.00 msec (0x0000)
          Direct address type: Reserved (0xff)
          Direct address: 00-00-00-00-00-00
          Data length: 0x0c
        0b ff 4c 00 09 06 03 00 0a 03 07 11              ..L.........    
        Company: Apple, Inc. (76)
          Type: Apple TV (9)
          Data: 03000a030711
> HCI Event: LE Meta Event (0x3e) plen 26                   #65 [hci1] 5.315758
      LE Extended Advertising Report (0x0d)
        Num reports: 1
        Entry 0
          Event type: 0x001a
            Props: 0x001a
              Scannable
              Scan response
              Use legacy advertising PDUs
            Data status: [0;32mComplete[0m
          Legacy PDU Type: SCAN_RSP to an ADV_IND (0x001a)
          Address type: Random (0x01)
          Address: 4F:20:12:A2:DC:25 (Resolvable)
          Primary PHY: LE 1M
          Secondary PHY: No packets
          SID: no ADI field (0xff)
          TX power: 127 dBm
          RSSI: -89 dBm (0xa7)
          Periodic advertising interval: 0.00 msec (0x0000)
          Direct address type: Reserved (0xff)
          Direct address: 00-00-00-00-00-00
          Data length: 0x00
> HCI Event: LE Meta Event (0x3e) plen 47                   #66 [hci1] 5.423705
      LE Extended Advertising Report (0x0d)
        Num reports: 1
        Entry 0
          Event type: 0x0013
            Props: 0x0013
              Connectable
              Scannable
              Use legacy advertising PDUs
            Data status: [0;32mComplete[0m
          Legacy PDU Type: ADV_IND (0x0013)
          Address type: Public (0x00)
          Address: A4:C1:38:8F:2F:B5 (Telink Semiconductor (Taipei) Co. Ltd.)
          Primary PHY: LE 1M
          Secondary PHY: No packets
          SID: no ADI field (0xff)
          TX power: 127 dBm
          RSSI: -82 dBm (0xae)
          Periodic advertising interval: 0.00 msec (0x0000)
          Direct address type: Reserved (0xff)
          Direct address: 00-00-00-00-00-00
          Data length: 0x15
        02 01 06 11 16 95 fe 30 58 5b 05 01 b5 2f 8f 38  .......0X[.../.8
        c1 a4 28 01 00                                   ..(..           
        Flags: 0x06
          LE General Discoverable Mode
          BR/EDR Not Supported
        Service Data: Xiaomi Inc. (0xfe95)
          Data: 30585b0501b52f8f38c1a4280100
> HCI Event: LE Meta Event (0x3e) plen 38                   #67 [hci1] 5.424299
      LE Extended Advertising Report (0x0d)
        Num reports: 1
        Entry 0
          Event type: 0x001b
            Props: 0x001b
              Connectable
              Scannable
              Scan response
              Use legacy advertising PDUs
            Data status: [0;32mComplete[0m
          Legacy PDU Type: SCAN_RSP to an ADV_SCAN_IND (0x001b)
          Address type: Public (0x00)
          Address: A4:C1:38:8F:2F:B5 (Telink Semiconductor (Taipei) Co. Ltd.)
          Primary PHY: LE 1M
          Secondary PHY: No packets
          SID: no ADI field (0xff)
          TX power: 127 dBm
          RSSI: -81 dBm (0xaf)
          Periodic advertising interval: 0.00 msec (0x0000)
          Direct address type: Reserved (0xff)
          Direct address: 00-00-00-00-00-00
          Data length: 0x0c
        0b 09 4c 59 57 53 44 30 33 4d 4d 43              ..LYWSD03MMC    
        Name (complete): LYWSD03MMC
> HCI Event: LE Meta Event (0x3e) plen 57                   #68 [hci1] 5.431209
      LE Extended Advertising Report (0x0d)
        Num reports: 1
        Entry 0
          Event type: 0x0010
            Props: 0x0010
              Use legacy advertising PDUs
            Data status: [0;32mComplete[0m
          Legacy PDU Type: ADV_NONCONN_IND (0x0010)
          Address type: Random (0x01)
          Address: 39:71:82:82:45:1E (Non-Resolvable)
          Primary PHY: LE 1M
          Secondary PHY: No packets
          SID: no ADI field (0xff)
          TX power: 127 dBm
          RSSI: -91 dBm (0xa5)
          Periodic advertising interval: 0.00 msec (0x0000)
          Direct address type: Reserved (0xff)
          Direct address: 00-00-00-00-00-00
          Data length: 0x1f
        1e ff 06 00 01 0f 20 22 56 75 1e 13 9d 03 5c 87  ...... "Vu....\.
        e0 3d d0 6c d3 fd b0 45 5f 62 e3 f6 43 03 e4     .=.l...E_b..C.. 
        Company: Microsoft (6)
          Data: 010f202256751e139d035c87e03dd06cd3fdb0455f62e3f64303e4
> HCI Event: LE Meta Event (0x3e) plen 55                   #69 [hci1] 5.498935
      LE Extended Advertising Report (0x0d)
        Num reports: 1
        Entry 0
          Event type: 0x0010
            Props: 0x0010
              Use legacy advertising PDUs
            Data status: [0;32mComplete[0m
          Legacy PDU Type: ADV_NONCONN_IND (0x0010)
          Address type: Random (0x01)
          Address: 16:00:D2:EA:AC:D4 (Non-Resolvable)
          Primary PHY: LE 1M
          Secondary PHY: No packets
          SID: no ADI field (0xff)
          TX power: 127 dBm
          RSSI: -81 dBm (0xaf)
          Periodic advertising interval: 0.00 msec (0x0000)
          Direct address type: Reserved (0xff)
          Direct address: 00-00-00-00-00-00
          Data length: 0x1d
        1c ff 06 00 01 09 21 0a 4d e0 8a 52 d2 d4 4c 41  ......!.M..R..LA
        50 54 4f 50 2d 45 35 32 45 4f 44 32 49           PTOP-E52EOD2I   
        Company: Microsoft (6)
          Data: 0109210a4de08a52d2d44c4150544f502d453532454f443249
> HCI Event: LE Meta Event (0x3e) plen 57                   #70 [hci1] 5.538137
      LE Extended Advertising Report (0x0d)
        Num reports: 1
        Entry 0
          Event type: 0x0010
            Props: 0x0010
              Use legacy advertising PDUs
            Data status: [0;32mComplete[0m
          Legacy PDU Type: ADV_NONCONN_IND (0x0010)
          Address type: Random (0x01)
          Address: 39:71:82:82:45:1E (Non-Resolvable)
          Primary PHY: LE 1M
          Secondary PHY: No packets
          SID: no ADI field (0xff)
          TX power: 127 dBm
          RSSI: -93 dBm (0xa3)
          Periodic advertising interval: 0.00 msec (0x0000)
          Direct address type: Reserved (0xff)
          Direct address: 00-00-00-00-00-00
          Data length: 0x1f
        1e ff 06 00 01 0f 20 22 56 75 1e 13 9d 03 5c 87  ...... "Vu....\.
        e0 3d d0 6c d3 fd b0 45 5f 62 e3 f6 43 03 e4     .=.l...E_b..C.. 
        Company: Microsoft (6)
          Data: 010f202256751e139d035c87e03dd06cd3fdb0455f62e3f64303e4
> HCI Event: LE Meta Event (0x3e) plen 57                   #71 [hci1] 5.590807
      LE Extended Advertising Report (0x0d)
        Num reports: 1
        Entry 0
          Event type: 0x0010
            Props: 0x0010
              Use legacy advertising PDUs
            Data status: [0;32mComplete[0m
          Legacy PDU Type: ADV_NONCONN_IND (0x0010)
          Address type: Random (0x01)
          Address: 02:AB:36:96:79:F2 (Non-Resolvable)
          Primary PHY: LE 1M
          Secondary PHY: No packets
          SID: no ADI field (0xff)
          TX power: 127 dBm
          RSSI: -93 dBm (0xa3)
          Periodic advertising interval: 0.00 msec (0x0000)
          Direct address type: Reserved (0xff)
          Direct address: 00-00-00-00-00-00
          Data length: 0x1f
        1e ff 06 00 01 09 20 22 49 be 28 71 21 e4 38 42  ...... "I.(q!.8B
        df b7 b3 50 7e 51 ec 69 de 6b a3 5e 11 2c d7     ...P~Q.i.k.^.,. 
        Company: Microsoft (6)
          Data: 0109202249be287121e43842dfb7b3507e51ec69de6ba35e112cd7
> HCI Event: LE Meta Event (0x3e) plen 55                   #72 [hci1] 5.598339
      LE Extended Advertising Report (0x0d)
        Num reports: 1
        Entry 0
          Event type: 0x0010
            Props: 0x0010
              Use legacy advertising PDUs
            Data status: [0;32mComplete[0m
          Legacy PDU Type: ADV_NONCONN_IND (0x0010)
          Address type: Random (0x01)
          Address: 16:00:D2:EA:AC:D4 (Non-Resolvable)
          Primary PHY: LE 1M
          Secondary PHY: No packets
          SID: no ADI field (0xff)
          TX power: 127 dBm
          RSSI: -89 dBm (0xa7)
          Periodic advertising interval: 0.00 msec (0x0000)
          Direct address type: Reserved (0xff)
          Direct address: 00-00-00-00-00-00
          Data length: 0x1d
        1c ff 06 00 01 09 21 0a 4d e0 8a 52 d2 d4 4c 41  ......!.M..R..LA
        50 54 4f 50 2d 45 35 32 45 4f 44 32 49           PTOP-E52EOD2I   
        Company: Microsoft (6)
          Data: 0109210a4de08a52d2d44c4150544f502d453532454f443249
> HCI Event: LE Meta Event (0x3e) plen 54                   #73 [hci1] 5.718112
      LE Extended Advertising Report (0x0d)
        Num reports: 1
        Entry 0
          Event type: 0x0010
            Props: 0x0010
              Use legacy advertising PDUs
            Data status: [0;32mComplete[0m
          Legacy PDU Type: ADV_NONCONN_IND (0x0010)
          Address type: Public (0x00)
          Address: A4:30:7A:95:74:FB (Samsung Electronics Co.,Ltd)
          Primary PHY: LE 1M
          Secondary PHY: No packets
          SID: no ADI field (0xff)
          TX power: 127 dBm
          RSSI: -89 dBm (0xa7)
          Periodic advertising interval: 0.00 msec (0x0000)
          Direct address type: Reserved (0xff)
          Direct address: 00-00-00-00-00-00
          Data length: 0x1c
        1b ff 75 00 42 04 01 80 6e a4 30 7a 95 74 fb a6  ..u.B...n.0z.t..
        30 7a 95 74 fa 01 d8 41 c5 d9 00 00              0z.t...A....    
        Company: Samsung Electronics Co. Ltd. (117)
          Data: 420401806ea4307a9574fba6307a9574fa01d841c5d90000
> HCI Event: LE Meta Event (0x3e) plen 38                   #74 [hci1] 5.730349
      LE Extended Advertising Report (0x0d)
        Num reports: 1
        Entry 0
          Event type: 0x0012
            Props: 0x0012
              Scannable
              Use legacy advertising PDUs
            Data status: [0;32mComplete[0m
          Legacy PDU Type: ADV_SCAN_IND (0x0012)
          Address type: Random (0x01)
          Address: 4F:20:12:A2:DC:25 (Resolvable)
          Primary PHY: LE 1M
          Secondary PHY: No packets
          SID: no ADI field (0xff)
          TX power: 127 dBm
          RSSI: -89 dBm (0xa7)
          Periodic advertising interval: 0.00 msec (0x0000)
          Direct address type: Reserved (0xff)
          Direct address: 00-00-00-00-00-00
          Data length: 0x0c
        0b ff 4c 00 09 06 03 00 0a 03 07 11              ..L.........    
        Company: Apple, Inc. (76)
          Type: Apple TV (9)
          Data: 03000a030711
> HCI Event: LE Meta Event (0x3e) plen 26                   #75 [hci1] 5.730699
      LE Extended Advertising Report (0x0d)
        Num reports: 1
        Entry 0
          Event type: 0x001a
            Props: 0x001a
              Scannable
              Scan response
              Use legacy advertising PDUs
            Data status: [0;32mComplete[0m
          Legacy PDU Type: SCAN_RSP to an ADV_IND (0x001a)
          Address type: Random (0x01)
          Address: 4F:20:12:A2:DC:25 (Resolvable)
          Primary PHY: LE 1M
          Secondary PHY: No packets
          SID: no ADI field (0xff)
          TX power: 127 dBm
          RSSI: -89 dBm (0xa7)
          Periodic advertising interval: 0.00 msec (0x0000)
          Direct address type: Reserved (0xff)
          Direct address: 00-00-00-00-00-00
          Data length: 0x00
> HCI Event: LE Meta Event (0x3e) plen 57                   #76 [hci1] 5.793410
      LE Extended Advertising Report (0x0d)
        Num reports: 1
        Entry 0
          Event type: 0x0010
            Props: 0x0010
              Use legacy advertising PDUs
            Data status: [0;32mComplete[0m
          Legacy PDU Type: ADV_NONCONN_IND (0x0010)
          Address type: Random (0x01)
          Address: 02:AB:36:96:79:F2 (Non-Resolvable)
          Primary PHY: LE 1M
          Secondary PHY: No packets
          SID: no ADI field (0xff)
          TX power: 127 dBm
          RSSI: -92 dBm (0xa4)
          Periodic advertising interval: 0.00 msec (0x0000)
          Direct address type: Reserved (0xff)
          Direct address: 00-00-00-00-00-00
          Data length: 0x1f
        1e ff 06 00 01 09 20 22 49 be 28 71 21 e4 38 42  ...... "I.(q!.8B
        df b7 b3 50 7e 51 ec 69 de 6b a3 5e 11 2c d7     ...P~Q.i.k.^.,. 
        Company: Microsoft (6)
          Data: 0109202249be287121e43842dfb7b3507e51ec69de6ba35e112cd7
> HCI Event: LE Meta Event (0x3e) plen 57                   #77 [hci1] 5.848688
      LE Extended Advertising Report (0x0d)
        Num reports: 1
        Entry 0
          Event type: 0x0010
            Props: 0x0010
              Use legacy advertising PDUs
            Data status: [0;32mComplete[0m
          Legacy PDU Type: ADV_NONCONN_IND (0x0010)
          Address type: Random (0x01)
          Address: 39:71:82:82:45:1E (Non-Resolvable)
          Primary PHY: LE 1M
          Secondary PHY: No packets
          SID: no ADI field (0xff)
          TX power: 127 dBm
          RSSI: -90 dBm (0xa6)
          Periodic advertising interval: 0.00 msec (0x0000)
          Direct address type: Reserved (0xff)
          Direct address: 00-00-00-00-00-00
          Data length: 0x1f
        1e ff 06 00 01 0f 20 22 56 75 1e 13 9d 03 5c 87  ...... "Vu....\.
        e0 3d d0 6c d3 fd b0 45 5f 62 e3 f6 43 03 e4     .=.l...E_b..C.. 
        Company: Microsoft (6)
          Data: 010f202256751e139d035c87e03dd06cd3fdb0455f62e3f64303e4
> HCI Event: LE Meta Event (0x3e) plen 54                   #78 [hci1] 5.857741
      LE Extended Advertising Report (0x0d)
        Num reports: 1
        Entry 0
          Event type: 0x0010
            Props: 0x0010
              Use legacy advertising PDUs
            Data status: [0;32mComplete[0m
          Legacy PDU Type: ADV_NONCONN_IND (0x0010)
          Address type: Public (0x00)
          Address: A4:30:7A:95:74:FB (Samsung Electronics Co.,Ltd)
          Primary PHY: LE 1M
          Secondary PHY: No packets
          SID: no ADI field (0xff)
          TX power: 127 dBm
          RSSI: -86 dBm (0xaa)
          Periodic advertising interval: 0.00 msec (0x0000)
          Direct address type: Reserved (0xff)
          Direct address: 00-00-00-00-00-00
          Data length: 0x1c
        1b ff 75 00 42 04 01 80 6e a4 30 7a 95 74 fb a6  ..u.B...n.0z.t..
        30 7a 95 74 fa 01 d8 41 c5 d9 00 00              0z.t...A....    
        Company: Samsung Electronics Co. Ltd. (117)
          Data: 420401806ea4307a9574fba6307a9574fa01d841c5d90000
> HCI Event: LE Meta Event (0x3e) plen 55                   #79 [hci1] 5.915665
      LE Extended Advertising Report (0x0d)
        Num reports: 1
        Entry 0
          Event type: 0x0010
            Props: 0x0010
              Use legacy advertising PDUs
            Data status: [0;32mComplete[0m
          Legacy PDU Type: ADV_NONCONN_IND (0x0010)
          Address type: Random (0x01)
          Address: 16:00:D2:EA:AC:D4 (Non-Resolvable)
          Primary PHY: LE 1M
          Secondary PHY: No packets
          SID: no ADI field (0xff)
          TX power: 127 dBm
          RSSI: -81 dBm (0xaf)
          Periodic advertising interval: 0.00 msec (0x0000)
          Direct address type: Reserved (0xff)
          Direct address: 00-00-00-00-00-00
          Data length: 0x1d
        1c ff 06 00 01 09 21 0a 4d e0 8a 52 d2 d4 4c 41  ......!.M..R..LA
        50 54 4f 50 2d 45 35 32 45 4f 44 32 49           PTOP-E52EOD2I   
        Company: Microsoft (6)
          Data: 0109210a4de08a52d2d44c4150544f502d453532454f443249
> HCI Event: LE Meta Event (0x3e) plen 51                   #80 [hci1] 6.010623
      LE Extended Advertising Report (0x0d)
        Num reports: 1
        Entry 0
          Event type: 0x0013
            Props: 0x0013
              Connectable
              Scannable
              Use legacy advertising PDUs
            Data status: [0;32mComplete[0m
          Legacy PDU Type: ADV_IND (0x0013)
          Address type: Public (0x00)
          Address: F0:18:98:96:04:94 (Apple, Inc.)
          Primary PHY: LE 1M
          Secondary PHY: No packets
          SID: no ADI field (0xff)
          TX power: 127 dBm
          RSSI: -90 dBm (0xa6)
          Periodic advertising interval: 0.00 msec (0x0000)
          Direct address type: Reserved (0xff)
          Direct address: 00-00-00-00-00-00
          Data length: 0x19
        02 01 06 11 07 00 00 00 00 00 00 00 00 00 00 00  ................
        00 00 01 31 5a 03 09 7a 6d                       ...1Z..zm       
        Flags: 0x06
          LE General Discoverable Mode
          BR/EDR Not Supported
        128-bit Service UUIDs (complete): 1 entry
          Vendor specific
        Name (complete): zm
> HCI Event: LE Meta Event (0x3e) plen 55                   #81 [hci1] 6.016525
      LE Extended Advertising Report (0x0d)
        Num reports: 1
        Entry 0
          Event type: 0x0010
            Props: 0x0010
              Use legacy advertising PDUs
            Data status: [0;32mComplete[0m
          Legacy PDU Type: ADV_NONCONN_IND (0x0010)
          Address type: Random (0x01)
          Address: 16:00:D2:EA:AC:D4 (Non-Resolvable)
          Primary PHY: LE 1M
          Secondary PHY: No packets
          SID: no ADI field (0xff)
          TX power: 127 dBm
          RSSI: -89 dBm (0xa7)
          Periodic advertising interval: 0.00 msec (0x0000)
          Direct address type: Reserved (0xff)
          Direct address: 00-00-00-00-00-00
          Data length: 0x1d
        1c ff 06 00 01 09 21 0a 4d e0 8a 52 d2 d4 4c 41  ......!.M..R..LA
        50 54 4f 50 2d 45 35 32 45 4f 44 32 49           PTOP-E52EOD2I   
        Company: Microsoft (6)
          Data: 0109210a4de08a52d2d44c4150544f502d453532454f443249
> HCI Event: LE Meta Event (0x3e) plen 38                   #82 [hci1] 6.136539
      LE Extended Advertising Report (0x0d)
        Num reports: 1
        Entry 0
          Event type: 0x0012
            Props: 0x0012
              Scannable
              Use legacy advertising PDUs
            Data status: [0;32mComplete[0m
          Legacy PDU Type: ADV_SCAN_IND (0x0012)
          Address type: Random (0x01)
          Address: 4F:20:12:A2:DC:25 (Resolvable)
          Primary PHY: LE 1M
          Secondary PHY: No packets
          SID: no ADI field (0xff)
          TX power: 127 dBm
          RSSI: -89 dBm (0xa7)
          Periodic advertising interval: 0.00 msec (0x0000)
          Direct address type: Reserved (0xff)
          Direct address: 00-00-00-00-00-00
          Data length: 0x0c
        0b ff 4c 00 09 06 03 00 0a 03 07 11              ..L.........    
        Company: Apple, Inc. (76)
          Type: Apple TV (9)
          Data: 03000a030711
> HCI Event: LE Meta Event (0x3e) plen 26                   #83 [hci1] 6.136955
      LE Extended Advertising Report (0x0d)
        Num reports: 1
        Entry 0
          Event type: 0x001a
            Props: 0x001a
              Scannable
              Scan response
              Use legacy advertising PDUs
            Data status: [0;32mComplete[0m
          Legacy PDU Type: SCAN_RSP to an ADV_IND (0x001a)
          Address type: Random (0x01)
          Address: 4F:20:12:A2:DC:25 (Resolvable)
          Primary PHY: LE 1M
          Secondary PHY: No packets
          SID: no ADI field (0xff)
          TX power: 127 dBm
          RSSI: -89 dBm (0xa7)
          Periodic advertising interval: 0.00 msec (0x0000)
          Direct address type: Reserved (0xff)
          Direct address: 00-00-00-00-00-00
          Data length: 0x00
> HCI Event: LE Meta Event (0x3e) plen 51                   #84 [hci1] 6.194867
      LE Extended Advertising Report (0x0d)
        Num reports: 1
        Entry 0
          Event type: 0x0013
            Props: 0x0013
              Connectable
              Scannable
              Use legacy advertising PDUs
            Data status: [0;32mComplete[0m
          Legacy PDU Type: ADV_IND (0x0013)
          Address type: Public (0x00)
          Address: F0:18:98:96:04:94 (Apple, Inc.)
          Primary PHY: LE 1M
          Secondary PHY: No packets
          SID: no ADI field (0xff)
          TX power: 127 dBm
          RSSI: -96 dBm (0xa0)
          Periodic advertising interval: 0.00 msec (0x0000)
          Direct address type: Reserved (0xff)
          Direct address: 00-00-00-00-00-00
          Data length: 0x19
        02 01 06 11 07 00 00 00 00 00 00 00 00 00 00 00  ................
        00 00 01 31 5a 03 09 7a 6d                       ...1Z..zm       
        Flags: 0x06
          LE General Discoverable Mode
          BR/EDR Not Supported
        128-bit Service UUIDs (complete): 1 entry
          Vendor specific
        Name (complete): zm
> HCI Event: LE Meta Event (0x3e) plen 54                   #85 [hci1] 6.196965
      LE Extended Advertising Report (0x0d)
        Num reports: 1
        Entry 0
          Event type: 0x0010
            Props: 0x0010
              Use legacy advertising PDUs
            Data status: [0;32mComplete[0m
          Legacy PDU Type: ADV_NONCONN_IND (0x0010)
          Address type: Public (0x00)
          Address: A4:30:7A:95:74:FB (Samsung Electronics Co.,Ltd)
          Primary PHY: LE 1M
          Secondary PHY: No packets
          SID: no ADI field (0xff)
          TX power: 127 dBm
          RSSI: -93 dBm (0xa3)
          Periodic advertising interval: 0.00 msec (0x0000)
          Direct address type: Reserved (0xff)
          Direct address: 00-00-00-00-00-00
          Data length: 0x1c
        1b ff 75 00 42 04 01 80 6e a4 30 7a 95 74 fb a6  ..u.B...n.0z.t..
        30 7a 95 74 fa 01 d8 41 c5 d9 00 00              0z.t...A....    
        Company: Samsung Electronics Co. Ltd. (117)
          Data: 420401806ea4307a9574fba6307a9574fa01d841c5d90000
> HCI Event: LE Meta Event (0x3e) plen 57                   #86 [hci1] 6.216443
      LE Extended Advertising Report (0x0d)
        Num reports: 1
        Entry 0
          Event type: 0x0013
            Props: 0x0013
              Connectable
              Scannable
              Use legacy advertising PDUs
            Data status: [0;32mComplete[0m
          Legacy PDU Type: ADV_IND (0x0013)
          Address type: Random (0x01)
          Address: F3:4B:0E:78:72:2A (Static)
          Primary PHY: LE 1M
          Secondary PHY: No packets
          SID: no ADI field (0xff)
          TX power: 127 dBm
          RSSI: -92 dBm (0xa4)
          Periodic advertising interval: 0.00 msec (0x0000)
          Direct address type: Reserved (0xff)
          Direct address: 00-00-00-00-00-00
          Data length: 0x1f
        02 01 06 1b ff 99 04 05 10 4c 2a ba c0 e0 04 0c  .........L*.....
        00 60 ff fc ae f6 5d 07 b1 f3 4b 0e 78 72 2a     .`....]...K.xr* 
        Flags: 0x06
          LE General Discoverable Mode
          BR/EDR Not Supported
        Company: Ruuvi Innovations Ltd. (1177)
          Data: 05104c2abac0e0040c0060fffcaef65d07b1f34b0e78722a
> HCI Event: LE Meta Event (0x3e) plen 57                   #87 [hci1] 6.276163
      LE Extended Advertising Report (0x0d)
        Num reports: 1
        Entry 0
          Event type: 0x0010
            Props: 0x0010
              Use legacy advertising PDUs
            Data status: [0;32mComplete[0m
          Legacy PDU Type: ADV_NONCONN_IND (0x0010)
          Address type: Random (0x01)
          Address: 39:71:82:82:45:1E (Non-Resolvable)
          Primary PHY: LE 1M
          Secondary PHY: No packets
          SID: no ADI field (0xff)
          TX power: 127 dBm
          RSSI: -91 dBm (0xa5)
          Periodic advertising interval: 0.00 msec (0x0000)
          Direct address type: Reserved (0xff)
          Direct address: 00-00-00-00-00-00
          Data length: 0x1f
        1e ff 06 00 01 0f 20 22 56 75 1e 13 9d 03 5c 87  ...... "Vu....\.
        e0 3d d0 6c d3 fd b0 45 5f 62 e3 f6 43 03 e4     .=.l...E_b..C.. 
        Company: Microsoft (6)
          Data: 010f202256751e139d035c87e03dd06cd3fdb0455f62e3f64303e4
> HCI Event: LE Meta Event (0x3e) plen 54                   #88 [hci1] 6.318091
      LE Extended Advertising Report (0x0d)
        Num reports: 1
        Entry 0
          Event type: 0x0010
            Props: 0x0010
              Use legacy advertising PDUs
            Data status: [0;32mComplete[0m
          Legacy PDU Type: ADV_NONCONN_IND (0x0010)
          Address type: Public (0x00)
          Address: A4:30:7A:95:74:FB (Samsung Electronics Co.,Ltd)
          Primary PHY: LE 1M
          Secondary PHY: No packets
          SID: no ADI field (0xff)
          TX power: 127 dBm
          RSSI: -89 dBm (0xa7)
          Periodic advertising interval: 0.00 msec (0x0000)
          Direct address type: Reserved (0xff)
          Direct address: 00-00-00-00-00-00
          Data length: 0x1c
        1b ff 75 00 42 04 01 80 6e a4 30 7a 95 74 fb a6  ..u.B...n.0z.t..
        30 7a 95 74 fa 01 d8 41 c5 d9 00 00              0z.t...A....    
        Company: Samsung Electronics Co. Ltd. (117)
          Data: 420401806ea4307a9574fba6307a9574fa01d841c5d90000
