Bluetooth monitor ver 5.72
= Note: Linux version 6.14.0-36-generic (x86_64)                       0.159983
= Note: Bluetooth subsystem version 2.22                               0.159985
= New Index: 00:00:00:00:00:00 (Primary,UART,hci1)              [hci1] 0.159986
= New Index: 48:5F:99:8E:E0:64 (Primary,USB,hci0)               [hci0] 0.159987
= Open Index: 00:00:00:00:00:00                                 [hci1] 0.673745
= Index Info: 00:00:00:00:00:00 (Nordic Semiconductor ASA)      [hci1] 0.673759
@ USER Open: main (privileged) version 2.22            {0x0001} [hci1] 0.673768
< HCI Command: Reset (0x03|0x0003) plen 0                    #1 [hci1] 0.675041
> HCI Event: Command Complete (0x0e) plen 4                  #2 [hci1] 0.675588
      Reset (0x03|0x0003) ncmd 1
        Status: Success (0x00)
< HCI Command: Read Local Supported... (0x04|0x0003) plen 0  #3 [hci1] 0.693399
> HCI Event: Command Complete (0x0e) plen 12                 #4 [hci1] 0.694044
      Read Local Supported Features (0x04|0x0003) ncmd 1
        Status: Success (0x00)
        Features: 0x00 0x00 0x00 0x00 0x60 0x00 0x00 0x00
          BR/EDR Not Supported
          LE Supported (Controller)
< HCI Command: Read Local Version In.. (0x04|0x0001) plen 0  #5 [hci1] 0.713257
> HCI Event: Command Complete (0x0e) plen 12                 #6 [hci1] 0.713677
      Read Local Version Information (0x04|0x0001) ncmd 1
        Status: Success (0x00)
        HCI version: Reserved (0x0f) - Revision 12393 (0x3069)
        LMP version: Reserved (0x0f) - Subversion 12393 (0x3069)
        Manufacturer: Nordic Semiconductor ASA (89)
< HCI Command: Read Local Supported... (0x04|0x0002) plen 0  #7 [hci1] 0.733210
> HCI Event: Command Complete (0x0e) plen 68                 #8 [hci1] 0.734237
      Read Local Supported Commands (0x04|0x0002) ncmd 1
        Status: Success (0x00)
        Commands: 119 entries
          Disconnect (Octet 0 - Bit 5)
          Read Remote Version Information (Octet 2 - Bit 7)
          Set Event Mask (Octet 5 - Bit 6)
          Reset (Octet 5 - Bit 7)
          Read Connection Accept Timeout (Octet 7 - Bit 2)
          Write Connection Accept Timeout (Octet 7 - Bit 3)
          Read Transmit Power Level (Octet 10 - Bit 2)
          Set Controller To Host Flow Control (Octet 10 - Bit 5)
          Host Buffer Size (Octet 10 - Bit 6)
          Host Number of Completed Packets (Octet 10 - Bit 7)
          Read Local Version Information (Octet 14 - Bit 3)
          Read Local Supported Features (Octet 14 - Bit 5)
          Read BD ADDR (Octet 15 - Bit 1)
          Read RSSI (Octet 15 - Bit 5)
          Set Event Mask Page 2 (Octet 22 - Bit 2)
          LE Set Event Mask (Octet 25 - Bit 0)
          LE Read Buffer Size (Octet 25 - Bit 1)
          LE Read Local Supported Features (Octet 25 - Bit 2)
          LE Set Random Address (Octet 25 - Bit 4)
          LE Set Advertising Parameters (Octet 25 - Bit 5)
          LE Read Advertising Channel TX Power (Octet 25 - Bit 6)
          LE Set Advertising Data (Octet 25 - Bit 7)
          LE Set Scan Response Data (Octet 26 - Bit 0)
          LE Set Advertise Enable (Octet 26 - Bit 1)
          LE Set Scan Parameters (Octet 26 - Bit 2)
          LE Set Scan Enable (Octet 26 - Bit 3)
          LE Create Connection (Octet 26 - Bit 4)
          LE Create Connection Cancel (Octet 26 - Bit 5)
          LE Read Accept List Size (Octet 26 - Bit 6)
          LE Clear Accept List (Octet 26 - Bit 7)
          LE Add Device To Accept List (Octet 27 - Bit 0)
          LE Remove Device From Accept List (Octet 27 - Bit 1)
          LE Connection Update (Octet 27 - Bit 2)
          LE Set Host Channel Classification (Octet 27 - Bit 3)
          LE Read Channel Map (Octet 27 - Bit 4)
          LE Read Remote Used Features (Octet 27 - Bit 5)
          LE Encrypt (Octet 27 - Bit 6)
          LE Rand (Octet 27 - Bit 7)
          LE Start Encryption (Octet 28 - Bit 0)
          LE Long Term Key Request Reply (Octet 28 - Bit 1)
          LE Long Term Key Request Neg Reply (Octet 28 - Bit 2)
          LE Read Supported States (Octet 28 - Bit 3)
          LE Receiver Test (Octet 28 - Bit 4)
          LE Transmitter Test (Octet 28 - Bit 5)
          LE Test End (Octet 28 - Bit 6)
          Read Authenticated Payload Timeout (Octet 32 - Bit 4)
          Write Authenticated Payload Timeout (Octet 32 - Bit 5)
          LE Set Data Length (Octet 33 - Bit 6)
          LE Read Suggested Default Data Length (Octet 33 - Bit 7)
          LE Write Suggested Default Data Length (Octet 34 - Bit 0)
          LE Add Device To Resolving List (Octet 34 - Bit 3)
          LE Remove Device From Resolving List (Octet 34 - Bit 4)
          LE Clear Resolving List (Octet 34 - Bit 5)
          LE Read Resolving List Size (Octet 34 - Bit 6)
          LE Set Address Resolution Enable (Octet 35 - Bit 1)
          LE Set Resolvable Private Address Timeout (Octet 35 - Bit 2)
          LE Read Maximum Data Length (Octet 35 - Bit 3)
          LE Read PHY (Octet 35 - Bit 4)
          LE Set Default PHY (Octet 35 - Bit 5)
          LE Set PHY (Octet 35 - Bit 6)
          LE Enhanced Receiver Test (Octet 35 - Bit 7)
          LE Enhanced Transmitter Test (Octet 36 - Bit 0)
          LE Set Advertising Set Random Address (Octet 36 - Bit 1)
          LE Set Extended Advertising Parameters (Octet 36 - Bit 2)
          LE Set Extended Advertising Data (Octet 36 - Bit 3)
          LE Set Extended Scan Response Data (Octet 36 - Bit 4)
          LE Set Extended Advertising Enable (Octet 36 - Bit 5)
          LE Read Maximum Advertising Data Length (Octet 36 - Bit 6)
          LE Read Number of Supported Advertising Sets (Octet 36 - Bit 7)
          LE Remove Advertising Set (Octet 37 - Bit 0)
          LE Clear Advertising Sets (Octet 37 - Bit 1)
          LE Set Periodic Advertising Parameters (Octet 37 - Bit 2)
          LE Set Periodic Advertising Data (Octet 37 - Bit 3)
          LE Set Periodic Advertising Enable (Octet 37 - Bit 4)
          LE Set Extended Scan Parameters (Octet 37 - Bit 5)
          LE Set Extended Scan Enable (Octet 37 - Bit 6)
          LE Extended Create Connection (Octet 37 - Bit 7)
          LE Periodic Advertising Create Sync (Octet 38 - Bit 0)
          LE Periodic Advertising Create Sync Cancel (Octet 38 - Bit 1)
          LE Periodic Advertising Terminate Sync (Octet 38 - Bit 2)
          LE Add Device To Periodic Advertiser List (Octet 38 - Bit 3)
          LE Remove Device From Periodic Advertiser List (Octet 38 - Bit 4)
          LE Clear Periodic Advertiser List (Octet 38 - Bit 5)
          LE Read Periodic Advertiser List Size (Octet 38 - Bit 6)
          LE Read Transmit Power (Octet 38 - Bit 7)
          LE Read RF Path Compensation (Octet 39 - Bit 0)
          LE Write RF Path Compensation (Octet 39 - Bit 1)
          LE Set Privacy Mode (Octet 39 - Bit 2)
          LE Periodic Advertising Receive Enable (Octet 40 - Bit 5)
          LE Periodic Advertising Sync Transfer (Octet 40 - Bit 6)
          LE Periodic Advertising Set Info Transfer (Octet 40 - Bit 7)
          LE Periodic Advertising Sync Transfer Parameters (Octet 41 - Bit 0)
          LE Set Default Periodic Advertisng Sync Transfer Parameters (Octet 41 - Bit 1)
          LE Read Buffer v2 (Octet 41 - Bit 5)
          LE Read ISO TX Sync (Octet 41 - Bit 6)
          LE Set Connected Isochronous Group Parameters (Octet 41 - Bit 7)
          LE Set Connected Isochronous Group Parameters Test (Octet 42 - Bit 0)
          LE Create Connected Isochronous Stream (Octet 42 - Bit 1)
          LE Remove Connected Isochronous Group (Octet 42 - Bit 2)
          LE Accept Connected Isochronous Stream Request (Octet 42 - Bit 3)
          LE Reject Connected Isochronous Stream Request (Octet 42 - Bit 4)
          LE Create Broadcast Isochronous Group (Octet 42 - Bit 5)
          LE Create Broadcast Isochronous Group Test (Octet 42 - Bit 6)
          LE Terminate Broadcast Isochronous Group (Octet 42 - Bit 7)
          LE Broadcast Isochronous Group Create Sync (Octet 43 - Bit 0)
          LE Broadcast Isochronous Group Terminate Sync (Octet 43 - Bit 1)
          LE Request Peer SCA (Octet 43 - Bit 2)
          LE Setup Isochronous Data Path (Octet 43 - Bit 3)
          LE Remove Isochronous Data Path (Octet 43 - Bit 4)
          LE Isochronous Transmit Test (Octet 43 - Bit 5)
          LE Isochronous Receive Test (Octet 43 - Bit 6)
          LE Isochronous Read Test Counters (Octet 43 - Bit 7)
          LE Isochronous Read Test Counters (Octet 44 - Bit 0)
          LE Set Host Feature (Octet 44 - Bit 1)
          Octet 44 - Bit 2 
          Octet 45 - Bit 6 
          Octet 46 - Bit 0 
          Octet 46 - Bit 1 
          Octet 46 - Bit 2 
< HCI Command: Host Buffer Size (0x03|0x0033) plen 7         #9 [hci1] 0.753223
        ACL MTU: 255  ACL max packet: 16
        SCO MTU: 0    SCO max packet: 0
> HCI Event: Command Complete (0x0e) plen 4                 #10 [hci1] 0.753750
      Host Buffer Size (0x03|0x0033) ncmd 1
        Status: Success (0x00)
< HCI Command: Set Controller To Ho.. (0x03|0x0031) plen 1  #11 [hci1] 0.773240
        Flow control: ACL Data Packets (0x01)
> HCI Event: Command Complete (0x0e) plen 4                 #12 [hci1] 0.773712
      Set Controller To Host Flow Control (0x03|0x0031) ncmd 1
        Status: Success (0x00)
< HCI Command: LE Read Local Suppor.. (0x08|0x0003) plen 0  #13 [hci1] 0.793210
> HCI Event: Command Complete (0x0e) plen 12                #14 [hci1] 0.793679
      LE Read Local Supported Features (0x08|0x0003) ncmd 1
        Status: Success (0x00)
        Features: 0xfd 0x79 0x00 0xf7 0x30 0x01 0x00 0x00
          LE Encryption
          Extended Reject Indication
          Peripheral-initiated Features Exchange
          LE Ping
          LE Data Packet Length Extension
          LL Privacy
          Extended Scanner Filter Policies
          LE 2M PHY
          LE Coded PHY
          LE Extended Advertising
          LE Periodic Advertising
          Channel Selection Algorithm #2
          Periodic Advertising Sync Transfer - Sender
          Periodic Advertising Sync Transfer - Recipient
          Sleep Clock Accuracy Updates
          Connected Isochronous Stream - Central
          Connected Isochronous Stream - Peripheral
          Isochronous Broadcaster
          Synchronized Receiver
          Periodic Advertising ADI support
          Connection Subrating
          Unknown features (0x0000010000000000)
< HCI Command: LE Set Host Feature (0x08|0x0074) plen 2     #15 [hci1] 0.813193
        Bit Number: 32
          Connected Isochronous Stream (Host Support)
        Bit Value: 1
> HCI Event: Command Complete (0x0e) plen 4                 #16 [hci1] 0.813580
      LE Set Host Feature (0x08|0x0074) ncmd 1
        Status: Success (0x00)
< HCI Command: LE Read Buffer v2 (0x08|0x0060) plen 0       #17 [hci1] 0.833194
> HCI Event: Command Complete (0x0e) plen 10                #18 [hci1] 0.833705
      LE Read Buffer v2 (0x08|0x0060) ncmd 1
        Status: Success (0x00)
        ACL MTU: 27
        ACL max packet: 3
        ISO MTU: 318
        ISO max packet: 3
< HCI Command: LE Read Maximum Adve.. (0x08|0x003a) plen 0  #19 [hci1] 0.853248
> HCI Event: Command Complete (0x0e) plen 6                 #20 [hci1] 0.853660
      LE Read Maximum Advertising Data Length (0x08|0x003a) ncmd 1
        Status: Success (0x00)
        Max length: 1650
< HCI Command: LE Read Supported St.. (0x08|0x001c) plen 0  #21 [hci1] 0.873216
> HCI Event: Command Complete (0x0e) plen 12                #22 [hci1] 0.873763
      LE Read Supported States (0x08|0x001c) ncmd 1
        Status: Success (0x00)
        States: 0x000003ff3e0306ff
          Non-connectable Advertising State
          Scannable Advertising State
          Connectable Advertising State
          High Duty Cycle Directed Advertising State
          Passive Scanning State
          Active Scanning State
          Initiating State
            and Connection State (Central Role)
          Connection State (Peripheral Role)
          Scannable Advertising State
            and Passive Scanning State
          Connectable Advertising State
            and Passive Scanning State
          Non-connectable Advertising State
            and Initiating State
          Scannable Advertising State
            and Initiating State
          Active Scanning State
            and Connection State (Central Role)
          Passive Scanning State
            and Connection State (Peripheral Role)
          Active Scanning State
            and Connection State (Peripheral Role)
          Initiating State
            and Connection State (Central Role)
            and Central Role & Central Role
          Low Duty Cycle Directed Advertising State
          Connectable Advertising State
            and Initiating State
            and Central Role & Peripheral Role
          High Duty Cycle Directed Advertising State
            and Initiating State
            and Central Role & Peripheral Role
          Low Duty Cycle Directed Advertising State
            and Initiating State
            and Central Role & Peripheral Role
          Connectable Advertising State
            and Connection State (Central Role)
            and Central Role & Peripheral Role
          High Duty Cycle Directed Advertising State
            and Connection State (Central Role)
            and Central Role & Peripheral Role
          Low Duty Cycle Directed Advertising State
            and Connection State (Central Role)
            and Central Role & Peripheral Role
          Connectable Advertising State
            and Connection State (Peripheral Role)
            and Central Role & Peripheral Role
          High Duty Cycle Directed Advertising State
            and Connection State (Peripheral Role)
            and Peripheral Role & Peripheral Role
          Low Duty Cycle Directed Advertising State
            and Connection State (Peripheral Role)
            and Peripheral Role & Peripheral Role
          Initiating State
            and Connection State (Peripheral Role)
            and Central Role & Peripheral Role
< HCI Command: LE Read Maximum Data.. (0x08|0x002f) plen 0  #23 [hci1] 0.893211
> HCI Event: Command Complete (0x0e) plen 12                #24 [hci1] 0.893716
      LE Read Maximum Data Length (0x08|0x002f) ncmd 1
        Status: Success (0x00)
        Max TX octets: 251
        Max TX time: 2704
        Max RX octets: 251
        Max RX time: 2704
< HCI Command: LE Write Suggested D.. (0x08|0x0024) plen 4  #25 [hci1] 0.913204
        TX octets: 251
        TX time: 2704
> HCI Event: Command Complete (0x0e) plen 4                 #26 [hci1] 0.913640
      LE Write Suggested Default Data Length (0x08|0x0024) ncmd 1
        Status: Success (0x00)
< HCI Command: LE Read Resolving Li.. (0x08|0x002a) plen 0  #27 [hci1] 0.933227
> HCI Event: Command Complete (0x0e) plen 5                 #28 [hci1] 0.933636
      LE Read Resolving List Size (0x08|0x002a) ncmd 1
        Status: Success (0x00)
        Size: 8
< HCI Command: LE Set Event Mask (0x08|0x0001) plen 8       #29 [hci1] 0.953216
        Mask: 0x000002023f87fa5e
          LE Advertising Report
          LE Connection Update Complete
          LE Read Remote Used Features Complete
          LE Long Term Key Request
          LE Data Length Change
          LE Enhanced Connection Complete
          LE PHY Update Complete
          LE Extended Advertising Report
          LE Periodic Advertising Sync Established
          LE Periodic Advertising Report
          LE Periodic Advertising Sync Lost
          LE Extended Scan Timeout
          LE Extended Advertising Set Terminated
          LE Scan Request Received
          LE Periodic Advertising Sync Transfer Rvc
          LE CIS Established
          LE CIS Request
          LE Create BIG Complete
          LE Terminate BIG Complete
          LE BIG Sync Estabilished Complete
          LE BIG Sync Lost
          LE BIG Info Advertising Report
          Unknown mask (0x0000020000000000)
> HCI Event: Command Complete (0x0e) plen 4                 #30 [hci1] 0.953793
      LE Set Event Mask (0x08|0x0001) ncmd 1
        Status: Success (0x00)
< HCI Command: Set Event Mask (0x03|0x0001) plen 8          #31 [hci1] 0.973216
        Mask: 0x2000800002008890
          Disconnection Complete
          Encryption Change
          Read Remote Version Information Complete
          Hardware Error
          Data Buffer Overflow
          Encryption Key Refresh Complete
          LE Meta
> HCI Event: Command Complete (0x0e) plen 4                 #32 [hci1] 0.973835
      Set Event Mask (0x03|0x0001) ncmd 1
        Status: Success (0x00)
< HCI Command: Read BD ADDR (0x04|0x0009) plen 0            #33 [hci1] 0.993227
> HCI Event: Command Complete (0x0e) plen 10                #34 [hci1] 0.993804
      Read BD ADDR (0x04|0x0009) ncmd 1
        Status: Success (0x00)
        Address: 00:00:00:00:00:00 (OUI 00-00-00)
< HCI Command: LE Set Random Address (0x08|0x0005) plen 6   #35 [hci1] 1.013295
        Address: D5:B6:CC:31:DB:3B (Static)
> HCI Event: Command Complete (0x0e) plen 4                 #36 [hci1] 1.013897
      LE Set Random Address (0x08|0x0005) ncmd 1
        Status: Success (0x00)
< HCI Command: LE Set Extended Adv.. (0x08|0x0036) plen 25  #37 [hci1] 3.533806
        Handle: 0x00
        Properties: 0x0013
          Connectable
          Scannable
          Use legacy advertising PDUs: ADV_IND
        Min advertising interval: 100.000 msec (0x00a0)
        Max advertising interval: 150.000 msec (0x00f0)
        Channel map: 37, 38, 39 (0x07)
        Own address type: Random (0x01)
        Peer address type: Public (0x00)
        Peer address: 00:00:00:00:00:00 (OUI 00-00-00)
        Filter policy: Allow Scan Request from Any, Allow Connect Request from Any (0x00)
        TX power: Host has no preference (0x7f)
        Primary PHY: LE 1M (0x01)
        Secondary max skip: 0x00
        Secondary PHY: LE 1M (0x01)
        SID: 0x00
        Scan request notifications: Disabled (0x00)
> HCI Event: Command Complete (0x0e) plen 5                 #38 [hci1] 3.534678
      LE Set Extended Advertising Parameters (0x08|0x0036) ncmd 1
        Status: Success (0x00)
        TX power (selected): 0 dbm (0x00)
< HCI Command: LE Set Advertising S.. (0x08|0x0035) plen 7  #39 [hci1] 3.553210
        Advertising handle: 0x00
        Advertising random address: D5:B6:CC:31:DB:3B (Static)
> HCI Event: Command Complete (0x0e) plen 4                 #40 [hci1] 3.553801
      LE Set Advertising Set Random Address (0x08|0x0035) ncmd 1
        Status: Success (0x00)
< HCI Command: LE Set Extended Adv.. (0x08|0x0037) plen 22  #41 [hci1] 3.573221
        Handle: 0x00
        Operation: Complete extended advertising data (0x03)
        Fragment preference: Minimize fragmentation (0x01)
        Data length: 0x12
        Flags: 0x06
          LE General Discoverable Mode
          BR/EDR Not Supported
        Name (complete): Tester_F6B11A
> HCI Event: Command Complete (0x0e) plen 4                 #42 [hci1] 3.574005
      LE Set Extended Advertising Data (0x08|0x0037) ncmd 1
        Status: Success (0x00)
< HCI Command: LE Set Extended Scan.. (0x08|0x0038) plen 4  #43 [hci1] 3.593205
        Handle: 0x00
        Operation: Complete scan response data (0x03)
        Fragment preference: Minimize fragmentation (0x01)
        Data length: 0x00
> HCI Event: Command Complete (0x0e) plen 4                 #44 [hci1] 3.593667
      LE Set Extended Scan Response Data (0x08|0x0038) ncmd 1
        Status: Success (0x00)
< HCI Command: LE Set Extended Adve.. (0x08|0x0039) plen 6  #45 [hci1] 3.613302
        Extended advertising: Enabled (0x01)
        Number of sets: 1 (0x01)
        Entry 0
          Handle: 0x00
          Duration: 0 ms (0x00)
          Max ext adv events: 0
> HCI Event: Command Complete (0x0e) plen 4                 #46 [hci1] 3.614014
      LE Set Extended Advertising Enable (0x08|0x0039) ncmd 1
        Status: Success (0x00)
> HCI Event: LE Meta Event (0x3e) plen 31                   #47 [hci1] 4.253021
      LE Enhanced Connection Complete (0x0a)
        Status: Success (0x00)
        Handle: 381
        Role: Peripheral (0x01)
        Peer address type: Public (0x00)
        Peer address: DF:A9:FF:F6:B1:1A (OUI DF-A9-FF)
        Local resolvable private address: 00:00:00:00:00:00 (Non-Resolvable)
        Peer resolvable private address: 00:00:00:00:00:00 (Non-Resolvable)
        Connection interval: 87.50 msec (0x0046)
        Connection latency: 0 (0x0000)
        Supervision timeout: 25120 msec (0x09d0)
        Central clock accuracy: 0x01
> HCI Event: LE Meta Event (0x3e) plen 6                    #48 [hci1] 4.253061
      LE Advertising Set Terminated (0x12)
        Status: Success (0x00)
        Handle: 0
        Connection handle: 381
        Number of completed extended advertising events: 0
< HCI Command: LE Read Remote Used... (0x08|0x0016) plen 2  #49 [hci1] 4.254319
        Handle: 381 Address: DF:A9:FF:F6:B1:1A (OUI DF-A9-FF)
< ACL Data TX: Handle 381 flags 0x00 dlen 7                 #50 [hci1] 4.254358
      ATT: Exchange MTU Request (0x02) len 2
        Client RX MTU: 251
> HCI Event: Command Status (0x0f) plen 4                   #51 [hci1] 4.254931
      LE Read Remote Used Features (0x08|0x0016) ncmd 1
        Status: Success (0x00)
> HCI Event: Number of Completed Packets (0x13) plen 5      #52 [hci1] 4.429040
        Num handles: 1
        Handle: 381 Address: DF:A9:FF:F6:B1:1A (OUI DF-A9-FF)
        Count: 1
        #50: len 7 (0 Kb/s)
        Latency: 174 msec (174-174 msec ~174 msec)
> HCI Event: LE Meta Event (0x3e) plen 12                   #53 [hci1] 4.517041
      LE Read Remote Used Features (0x04)
        Status: Success (0x00)
        Handle: 381 Address: DF:A9:FF:F6:B1:1A (OUI DF-A9-FF)
        Features: 0x2d 0x49 0x00 0xf7 0x67 0xd8 0x00 0x00
          LE Encryption
          Extended Reject Indication
          Peripheral-initiated Features Exchange
          LE Data Packet Length Extension
          LE 2M PHY
          LE Coded PHY
          Channel Selection Algorithm #2
          Periodic Advertising Sync Transfer - Sender
          Periodic Advertising Sync Transfer - Recipient
          Sleep Clock Accuracy Updates
          Connected Isochronous Stream - Central
          Connected Isochronous Stream - Peripheral
          Isochronous Broadcaster
          Synchronized Receiver
          Connected Isochronous Stream (Host Support)
          LE Power Control Request
          LE Power Control Request
          Connection Subrating
          Connection Subrating (Host Support)
          Unknown features (0x0000d80000000000)
> ACL Data RX: Handle 381 flags 0x02 dlen 11                #54 [hci1] 6.966546
      SMP: Pairing Request (0x01) len 6
        IO capability: KeyboardDisplay (0x04)
        OOB data: Authentication data not present (0x00)
        Authentication requirement: Bonding, MITM, SC, No Keypresses (0x0d)
        Max encryption key size: 16
        Initiator key distribution: EncKey IdKey (0x03)
        Responder key distribution: EncKey IdKey Sign (0x07)
> ACL Data RX: Handle 381 flags 0x02 dlen 7                 #55 [hci1] 6.967014
      ATT: Exchange MTU Response (0x03) len 2
        Server RX MTU: 23
< HCI Command: Host Number of Compl.. (0x03|0x0035) plen 5  #56 [hci1] 6.973805
        Num handles: 1
        Handle: 381 Address: DF:A9:FF:F6:B1:1A (OUI DF-A9-FF)
        Count: 1
< ACL Data TX: Handle 381 flags 0x00 dlen 11                #57 [hci1] 6.974018
      SMP: Pairing Response (0x02) len 6
        IO capability: DisplayOnly (0x00)
        OOB data: Authentication data not present (0x00)
        Authentication requirement: Bonding, No MITM, SC, No Keypresses (0x09)
        Max encryption key size: 16
        Initiator key distribution: IdKey (0x02)
        Responder key distribution: <none> (0x00)
< HCI Command: Host Number of Compl.. (0x03|0x0035) plen 5  #58 [hci1] 6.974224
        Num handles: 1
        Handle: 381 Address: DF:A9:FF:F6:B1:1A (OUI DF-A9-FF)
        Count: 1
> HCI Event: Number of Completed Packets (0x13) plen 5      #59 [hci1] 7.141683
        Num handles: 1
        Handle: 381 Address: DF:A9:FF:F6:B1:1A (OUI DF-A9-FF)
        Count: 1
        #57: len 11 (0 Kb/s)
        Latency: 167 msec (167-174 msec ~171 msec)
> ACL Data RX: Handle 381 flags 0x02 dlen 27                #60 [hci1] 7.141982
> ACL Data RX: Handle 381 flags 0x01 dlen 27                #61 [hci1] 7.142514
> ACL Data RX: Handle 381 flags 0x01 dlen 15                #62 [hci1] 7.142984
      SMP: Pairing Public Key (0x0c) len 64
        X: 8f732fa2d0fdc6ce6bd45b0c6bbe8b3bd22fb0e07c85ede6c83f2e3a6bf7b1cc
        Y: dbf95b829a3e046c13e34270e3f81f73a3f487e949ff2dd5c14ee76579d0526b
< HCI Command: Host Number of Compl.. (0x03|0x0035) plen 5  #63 [hci1] 7.154246
        Num handles: 1
        Handle: 381 Address: DF:A9:FF:F6:B1:1A (OUI DF-A9-FF)
        Count: 1
< HCI Command: Host Number of Compl.. (0x03|0x0035) plen 5  #64 [hci1] 7.154434
        Num handles: 1
        Handle: 381 Address: DF:A9:FF:F6:B1:1A (OUI DF-A9-FF)
        Count: 1
< HCI Command: Host Number of Compl.. (0x03|0x0035) plen 5  #65 [hci1] 7.154762
        Num handles: 1
        Handle: 381 Address: DF:A9:FF:F6:B1:1A (OUI DF-A9-FF)
        Count: 1
< ACL Data TX: Handle 381 flags 0x00 dlen 27                #66 [hci1] 7.154892
< ACL Data TX: Handle 381 flags 0x01 dlen 27                #67 [hci1] 7.154917
< ACL Data TX: Handle 381 flags 0x01 dlen 15                #68 [hci1] 7.154923
      SMP: Pairing Public Key (0x0c) len 64
        X: 98308440221e2d910f0e54b71e7ec652857aa9b5a0dc65028824cc19db1226e9
        Y: 67a4816bcb62efb21701e31fdb27561a6217575fb007a8bbdabe7e28b6f68482
> HCI Event: Number of Completed Packets (0x13) plen 5      #69 [hci1] 7.229511
        Num handles: 1
        Handle: 381 Address: DF:A9:FF:F6:B1:1A (OUI DF-A9-FF)
        Count: 1
        #66: len 27 (2 Kb/s)
        Latency: 74 msec (74-174 msec ~122 msec)
> HCI Event: Number of Completed Packets (0x13) plen 5      #70 [hci1] 7.230262
        Num handles: 1
        Handle: 381 Address: DF:A9:FF:F6:B1:1A (OUI DF-A9-FF)
        Count: 1
        #67: len 27 (2 Kb/s)
        Latency: 75 msec (74-174 msec ~99 msec)
> HCI Event: Number of Completed Packets (0x13) plen 5      #71 [hci1] 7.316335
        Num handles: 1
        Handle: 381 Address: DF:A9:FF:F6:B1:1A (OUI DF-A9-FF)
        Count: 1
        #68: len 15 (0 Kb/s)
        Latency: 161 msec (74-174 msec ~130 msec)
> ACL Data RX: Handle 381 flags 0x02 dlen 21                #72 [hci1] 7.754271
      SMP: Pairing Confirm (0x03) len 16
        Confim value: f74e202508ce772c2fa68366d42a109d
< HCI Command: Host Number of Compl.. (0x03|0x0035) plen 5  #73 [hci1] 7.773853
        Num handles: 1
        Handle: 381 Address: DF:A9:FF:F6:B1:1A (OUI DF-A9-FF)
        Count: 1
< ACL Data TX: Handle 381 flags 0x00 dlen 21                #74 [hci1] 7.774061
      SMP: Pairing Confirm (0x03) len 16
        Confim value: 6ff4d48f10f7f50ffee3d45734ca7003
> HCI Event: Number of Completed Packets (0x13) plen 5      #75 [hci1] 7.929058
        Num handles: 1
        Handle: 381 Address: DF:A9:FF:F6:B1:1A (OUI DF-A9-FF)
        Count: 1
        #74: len 21 (1 Kb/s)
        Latency: 154 msec (74-174 msec ~142 msec)
> ACL Data RX: Handle 381 flags 0x02 dlen 21                #76 [hci1] 7.929397
      SMP: Pairing Random (0x04) len 16
        Random value: 7f22b2562dd1db2e0000000000000000
< HCI Command: Host Number of Compl.. (0x03|0x0035) plen 5  #77 [hci1] 7.934059
        Num handles: 1
        Handle: 381 Address: DF:A9:FF:F6:B1:1A (OUI DF-A9-FF)
        Count: 1
< ACL Data TX: Handle 381 flags 0x00 dlen 21                #78 [hci1] 7.934145
      SMP: Pairing Random (0x04) len 16
        Random value: 8e6108f966a694cbe26df70bb96773e6
> HCI Event: Number of Completed Packets (0x13) plen 5      #79 [hci1] 8.103847
        Num handles: 1
        Handle: 381 Address: DF:A9:FF:F6:B1:1A (OUI DF-A9-FF)
        Count: 1
        #78: len 21 (0 Kb/s)
        Latency: 169 msec (74-174 msec ~156 msec)
> ACL Data RX: Handle 381 flags 0x02 dlen 21                #80 [hci1] 8.191684
      SMP: Pairing Confirm (0x03) len 16
        Confim value: 7e063e935ee4960491543e5ac68390dc
< HCI Command: Host Number of Compl.. (0x03|0x0035) plen 5  #81 [hci1] 8.193338
        Num handles: 1
        Handle: 381 Address: DF:A9:FF:F6:B1:1A (OUI DF-A9-FF)
        Count: 1
< ACL Data TX: Handle 381 flags 0x00 dlen 21                #82 [hci1] 8.193405
      SMP: Pairing Confirm (0x03) len 16
        Confim value: e6064d91efe7421091bf3f7be566514a
> HCI Event: Number of Completed Packets (0x13) plen 5      #83 [hci1] 8.366727
        Num handles: 1
        Handle: 381 Address: DF:A9:FF:F6:B1:1A (OUI DF-A9-FF)
        Count: 1
        #82: len 21 (0 Kb/s)
        Latency: 173 msec (74-174 msec ~164 msec)
> ACL Data RX: Handle 381 flags 0x02 dlen 21                #84 [hci1] 8.367038
      SMP: Pairing Random (0x04) len 16
        Random value: 5671d7142e51b66c0000000000000000
< HCI Command: Host Number of Compl.. (0x03|0x0035) plen 5  #85 [hci1] 8.373995
        Num handles: 1
        Handle: 381 Address: DF:A9:FF:F6:B1:1A (OUI DF-A9-FF)
        Count: 1
< ACL Data TX: Handle 381 flags 0x00 dlen 21                #86 [hci1] 8.374120
      SMP: Pairing Random (0x04) len 16
        Random value: 4d02679f89a05211af56d8b3da64d21e
> HCI Event: Number of Completed Packets (0x13) plen 5      #87 [hci1] 8.541350
        Num handles: 1
        Handle: 381 Address: DF:A9:FF:F6:B1:1A (OUI DF-A9-FF)
        Count: 1
        #86: len 21 (1 Kb/s)
        Latency: 167 msec (74-174 msec ~165 msec)
> ACL Data RX: Handle 381 flags 0x02 dlen 21                #88 [hci1] 8.629235
      SMP: Pairing Confirm (0x03) len 16
        Confim value: 9fa6331624df4e078fedbcd690607346
< HCI Command: Host Number of Compl.. (0x03|0x0035) plen 5  #89 [hci1] 8.633812
        Num handles: 1
        Handle: 381 Address: DF:A9:FF:F6:B1:1A (OUI DF-A9-FF)
        Count: 1
< ACL Data TX: Handle 381 flags 0x00 dlen 21                #90 [hci1] 8.634024
      SMP: Pairing Confirm (0x03) len 16
        Confim value: 6b532e9f8de40cfad05608d9953e48c5
> HCI Event: Number of Completed Packets (0x13) plen 5      #91 [hci1] 8.804078
        Num handles: 1
        Handle: 381 Address: DF:A9:FF:F6:B1:1A (OUI DF-A9-FF)
        Count: 1
        #90: len 21 (0 Kb/s)
        Latency: 170 msec (74-174 msec ~168 msec)
> ACL Data RX: Handle 381 flags 0x02 dlen 21                #92 [hci1] 8.804314
      SMP: Pairing Random (0x04) len 16
        Random value: 3be7a71565324d420000000000000000
< HCI Command: Host Number of Compl.. (0x03|0x0035) plen 5  #93 [hci1] 8.814021
        Num handles: 1
        Handle: 381 Address: DF:A9:FF:F6:B1:1A (OUI DF-A9-FF)
        Count: 1
< ACL Data TX: Handle 381 flags 0x00 dlen 21                #94 [hci1] 8.814209
      SMP: Pairing Random (0x04) len 16
        Random value: 5e8286bc235a02440d0c3424a2acf8fd
> HCI Event: Number of Completed Packets (0x13) plen 5      #95 [hci1] 8.978826
        Num handles: 1
        Handle: 381 Address: DF:A9:FF:F6:B1:1A (OUI DF-A9-FF)
        Count: 1
        #94: len 21 (1 Kb/s)
        Latency: 164 msec (74-174 msec ~166 msec)
> ACL Data RX: Handle 381 flags 0x02 dlen 21                #96 [hci1] 9.066653
      SMP: Pairing Confirm (0x03) len 16
        Confim value: 944ced76b542aa3083e03f8994912fcf
< HCI Command: Host Number of Compl.. (0x03|0x0035) plen 5  #97 [hci1] 9.073894
        Num handles: 1
        Handle: 381 Address: DF:A9:FF:F6:B1:1A (OUI DF-A9-FF)
        Count: 1
< ACL Data TX: Handle 381 flags 0x00 dlen 21                #98 [hci1] 9.074163
      SMP: Pairing Confirm (0x03) len 16
        Confim value: 966dd8e1fb2e7a4aee18392b148afb81
> HCI Event: Number of Completed Packets (0x13) plen 5      #99 [hci1] 9.241564
        Num handles: 1
        Handle: 381 Address: DF:A9:FF:F6:B1:1A (OUI DF-A9-FF)
        Count: 1
        #98: len 21 (1 Kb/s)
        Latency: 167 msec (74-174 msec ~166 msec)
> ACL Data RX: Handle 381 flags 0x02 dlen 21               #100 [hci1] 9.241968
      SMP: Pairing Random (0x04) len 16
        Random value: 6ba3effbe67c551a0000000000000000
< HCI Command: Host Number of Comp.. (0x03|0x0035) plen 5  #101 [hci1] 9.253892
        Num handles: 1
        Handle: 381 Address: DF:A9:FF:F6:B1:1A (OUI DF-A9-FF)
        Count: 1
< ACL Data TX: Handle 381 flags 0x00 dlen 21               #102 [hci1] 9.253970
      SMP: Pairing Random (0x04) len 16
        Random value: 5c4a1bcadd27bd58e945097b00bad7ac
> HCI Event: Number of Completed Packets (0x13) plen 5     #103 [hci1] 9.416392
        Num handles: 1
        Handle: 381 Address: DF:A9:FF:F6:B1:1A (OUI DF-A9-FF)
        Count: 1
        #102: len 21 (1 Kb/s)
        Latency: 162 msec (74-174 msec ~164 msec)
> ACL Data RX: Handle 381 flags 0x02 dlen 21               #104 [hci1] 9.504242
      SMP: Pairing Confirm (0x03) len 16
        Confim value: 07729485c63806c10843e29e4f70733f
< HCI Command: Host Number of Comp.. (0x03|0x0035) plen 5  #105 [hci1] 9.513759
        Num handles: 1
        Handle: 381 Address: DF:A9:FF:F6:B1:1A (OUI DF-A9-FF)
        Count: 1
< ACL Data TX: Handle 381 flags 0x00 dlen 21               #106 [hci1] 9.513983
      SMP: Pairing Confirm (0x03) len 16
        Confim value: 23e502578a7ad5a04d5cb8ed9a517660
> HCI Event: Number of Completed Packets (0x13) plen 5     #107 [hci1] 9.679066
        Num handles: 1
        Handle: 381 Address: DF:A9:FF:F6:B1:1A (OUI DF-A9-FF)
        Count: 1
        #106: len 21 (1 Kb/s)
        Latency: 165 msec (74-174 msec ~164 msec)
> ACL Data RX: Handle 381 flags 0x02 dlen 21               #108 [hci1] 9.679299
      SMP: Pairing Random (0x04) len 16
        Random value: 1397d1c5f38e162b0000000000000000
< HCI Command: Host Number of Comp.. (0x03|0x0035) plen 5  #109 [hci1] 9.694070
        Num handles: 1
        Handle: 381 Address: DF:A9:FF:F6:B1:1A (OUI DF-A9-FF)
        Count: 1
< ACL Data TX: Handle 381 flags 0x00 dlen 21               #110 [hci1] 9.694225
      SMP: Pairing Random (0x04) len 16
        Random value: 32527e6e64e79f33b2e374394db8ab2d
> HCI Event: Number of Completed Packets (0x13) plen 5     #111 [hci1] 9.853740
        Num handles: 1
        Handle: 381 Address: DF:A9:FF:F6:B1:1A (OUI DF-A9-FF)
        Count: 1
        #110: len 21 (1 Kb/s)
        Latency: 159 msec (74-174 msec ~162 msec)
> ACL Data RX: Handle 381 flags 0x02 dlen 21               #112 [hci1] 9.941709
      SMP: Pairing Confirm (0x03) len 16
        Confim value: abc50245bd7a007dd9917082c228762f
< HCI Command: Host Number of Comp.. (0x03|0x0035) plen 5  #113 [hci1] 9.953808
        Num handles: 1
        Handle: 381 Address: DF:A9:FF:F6:B1:1A (OUI DF-A9-FF)
        Count: 1
< ACL Data TX: Handle 381 flags 0x00 dlen 21               #114 [hci1] 9.954014
      SMP: Pairing Confirm (0x03) len 16
        Confim value: 3c5a2a9c55c144b7d09eaaf8524e5e74
> HCI Event: Number of Completed Packets (0x13) plen 5    #115 [hci1] 10.116433
        Num handles: 1
        Handle: 381 Address: DF:A9:FF:F6:B1:1A (OUI DF-A9-FF)
        Count: 1
        #114: len 21 (1 Kb/s)
        Latency: 162 msec (74-174 msec ~162 msec)
> ACL Data RX: Handle 381 flags 0x02 dlen 21              #116 [hci1] 10.116784
      SMP: Pairing Random (0x04) len 16
        Random value: 8644e4d936a7c1990000000000000000
< HCI Command: Host Number of Com.. (0x03|0x0035) plen 5  #117 [hci1] 10.133349
        Num handles: 1
        Handle: 381 Address: DF:A9:FF:F6:B1:1A (OUI DF-A9-FF)
        Count: 1
< ACL Data TX: Handle 381 flags 0x00 dlen 21              #118 [hci1] 10.133376
      SMP: Pairing Random (0x04) len 16
        Random value: dddbdfe2838e9a8cc6964353c850fef7
> HCI Event: Number of Completed Packets (0x13) plen 5    #119 [hci1] 10.291270
        Num handles: 1
        Handle: 381 Address: DF:A9:FF:F6:B1:1A (OUI DF-A9-FF)
        Count: 1
        #118: len 21 (1 Kb/s)
        Latency: 157 msec (74-174 msec ~160 msec)
> ACL Data RX: Handle 381 flags 0x02 dlen 21              #120 [hci1] 10.379066
      SMP: Pairing Confirm (0x03) len 16
        Confim value: 3b984e473ff7fb6d66f2f19d4806a528
< HCI Command: Host Number of Com.. (0x03|0x0035) plen 5  #121 [hci1] 10.393253
        Num handles: 1
        Handle: 381 Address: DF:A9:FF:F6:B1:1A (OUI DF-A9-FF)
        Count: 1
< ACL Data TX: Handle 381 flags 0x00 dlen 21              #122 [hci1] 10.393280
      SMP: Pairing Confirm (0x03) len 16
        Confim value: a23304a128965f0a8b4328f470b1e679
> HCI Event: Number of Completed Packets (0x13) plen 5    #123 [hci1] 10.554009
        Num handles: 1
        Handle: 381 Address: DF:A9:FF:F6:B1:1A (OUI DF-A9-FF)
        Count: 1
        #122: len 21 (1 Kb/s)
        Latency: 160 msec (74-174 msec ~160 msec)
> ACL Data RX: Handle 381 flags 0x02 dlen 21              #124 [hci1] 10.554238
      SMP: Pairing Random (0x04) len 16
        Random value: 1f7f66a2a4f5aba30000000000000000
< HCI Command: Host Number of Com.. (0x03|0x0035) plen 5  #125 [hci1] 10.573424
        Num handles: 1
        Handle: 381 Address: DF:A9:FF:F6:B1:1A (OUI DF-A9-FF)
        Count: 1
< ACL Data TX: Handle 381 flags 0x00 dlen 21              #126 [hci1] 10.573481
      SMP: Pairing Random (0x04) len 16
        Random value: eb9f1915536596b6fc3db1c86b2b1970
> HCI Event: Number of Completed Packets (0x13) plen 5    #127 [hci1] 10.728852
        Num handles: 1
        Handle: 381 Address: DF:A9:FF:F6:B1:1A (OUI DF-A9-FF)
        Count: 1
        #126: len 21 (1 Kb/s)
        Latency: 155 msec (74-174 msec ~157 msec)
> ACL Data RX: Handle 381 flags 0x02 dlen 21              #128 [hci1] 10.816733
      SMP: Pairing Confirm (0x03) len 16
        Confim value: 75701c2e764dd4b3d783d972688e3152
< HCI Command: Host Number of Com.. (0x03|0x0035) plen 5  #129 [hci1] 10.833580
        Num handles: 1
        Handle: 381 Address: DF:A9:FF:F6:B1:1A (OUI DF-A9-FF)
        Count: 1
< ACL Data TX: Handle 381 flags 0x00 dlen 21              #130 [hci1] 10.833708
      SMP: Pairing Confirm (0x03) len 16
        Confim value: 307126bb260caa0d144260c4dba88ebf
> HCI Event: Number of Completed Packets (0x13) plen 5    #131 [hci1] 10.991504
        Num handles: 1
        Handle: 381 Address: DF:A9:FF:F6:B1:1A (OUI DF-A9-FF)
        Count: 1
        #130: len 21 (1 Kb/s)
        Latency: 157 msec (74-174 msec ~157 msec)
> ACL Data RX: Handle 381 flags 0x02 dlen 21              #132 [hci1] 10.991868
      SMP: Pairing Random (0x04) len 16
        Random value: d815d599b6aefcff0000000000000000
< HCI Command: Host Number of Com.. (0x03|0x0035) plen 5  #133 [hci1] 10.994063
        Num handles: 1
        Handle: 381 Address: DF:A9:FF:F6:B1:1A (OUI DF-A9-FF)
        Count: 1
< ACL Data TX: Handle 381 flags 0x00 dlen 21              #134 [hci1] 10.994176
      SMP: Pairing Random (0x04) len 16
        Random value: 5c794dc9ad9f2c3f295ebd5ad5e1c3cf
> HCI Event: Number of Completed Packets (0x13) plen 5    #135 [hci1] 11.166207
        Num handles: 1
        Handle: 381 Address: DF:A9:FF:F6:B1:1A (OUI DF-A9-FF)
        Count: 1
        #134: len 21 (0 Kb/s)
        Latency: 172 msec (74-174 msec ~164 msec)
> ACL Data RX: Handle 381 flags 0x02 dlen 21              #136 [hci1] 11.254175
      SMP: Pairing Confirm (0x03) len 16
        Confim value: f1bbd40fd1f716d7b24059a430b22bb4
< HCI Command: Host Number of Com.. (0x03|0x0035) plen 5  #137 [hci1] 11.273741
        Num handles: 1
        Handle: 381 Address: DF:A9:FF:F6:B1:1A (OUI DF-A9-FF)
        Count: 1
< ACL Data TX: Handle 381 flags 0x00 dlen 21              #138 [hci1] 11.274000
      SMP: Pairing Confirm (0x03) len 16
        Confim value: 336db6c927b37a507729e97ca7a76df1
> HCI Event: Number of Completed Packets (0x13) plen 5    #139 [hci1] 11.428948
        Num handles: 1
        Handle: 381 Address: DF:A9:FF:F6:B1:1A (OUI DF-A9-FF)
        Count: 1
        #138: len 21 (1 Kb/s)
        Latency: 154 msec (74-174 msec ~159 msec)
> ACL Data RX: Handle 381 flags 0x02 dlen 21              #140 [hci1] 11.429395
      SMP: Pairing Random (0x04) len 16
        Random value: afc1d6ed72b40da70000000000000000
< HCI Command: Host Number of Com.. (0x03|0x0035) plen 5  #141 [hci1] 11.433911
        Num handles: 1
        Handle: 381 Address: DF:A9:FF:F6:B1:1A (OUI DF-A9-FF)
        Count: 1
< ACL Data TX: Handle 381 flags 0x00 dlen 21              #142 [hci1] 11.434065
      SMP: Pairing Random (0x04) len 16
        Random value: 5c2fff312cdf99c9491988e877355a9a
> HCI Event: Number of Completed Packets (0x13) plen 5    #143 [hci1] 11.603800
        Num handles: 1
        Handle: 381 Address: DF:A9:FF:F6:B1:1A (OUI DF-A9-FF)
        Count: 1
        #142: len 21 (0 Kb/s)
        Latency: 169 msec (74-174 msec ~164 msec)
> ACL Data RX: Handle 381 flags 0x02 dlen 21              #144 [hci1] 11.691755
      SMP: Pairing Confirm (0x03) len 16
        Confim value: 375694f2c2aae703a9e92e1eb830fbfb
< HCI Command: Host Number of Com.. (0x03|0x0035) plen 5  #145 [hci1] 11.693762
        Num handles: 1
        Handle: 381 Address: DF:A9:FF:F6:B1:1A (OUI DF-A9-FF)
        Count: 1
< ACL Data TX: Handle 381 flags 0x00 dlen 21              #146 [hci1] 11.693946
      SMP: Pairing Confirm (0x03) len 16
        Confim value: c46e3b3f7fc71ac93201e2a2effcba59
> HCI Event: Number of Completed Packets (0x13) plen 5    #147 [hci1] 11.866412
        Num handles: 1
        Handle: 381 Address: DF:A9:FF:F6:B1:1A (OUI DF-A9-FF)
        Count: 1
        #146: len 21 (0 Kb/s)
        Latency: 172 msec (74-174 msec ~168 msec)
> ACL Data RX: Handle 381 flags 0x02 dlen 21              #148 [hci1] 11.866723
      SMP: Pairing Random (0x04) len 16
        Random value: bd861107e2a826c90000000000000000
< HCI Command: Host Number of Com.. (0x03|0x0035) plen 5  #149 [hci1] 11.873997
        Num handles: 1
        Handle: 381 Address: DF:A9:FF:F6:B1:1A (OUI DF-A9-FF)
        Count: 1
< ACL Data TX: Handle 381 flags 0x00 dlen 21              #150 [hci1] 11.874151
      SMP: Pairing Random (0x04) len 16
        Random value: c629a3a987d808e808655d558dfc1155
> HCI Event: Number of Completed Packets (0x13) plen 5    #151 [hci1] 12.041173
        Num handles: 1
        Handle: 381 Address: DF:A9:FF:F6:B1:1A (OUI DF-A9-FF)
        Count: 1
        #150: len 21 (1 Kb/s)
        Latency: 167 msec (74-174 msec ~167 msec)
> ACL Data RX: Handle 381 flags 0x02 dlen 21              #152 [hci1] 12.129092
      SMP: Pairing Confirm (0x03) len 16
        Confim value: 7c73fe82cbbdc9ac178f427c4f936f24
< HCI Command: Host Number of Com.. (0x03|0x0035) plen 5  #153 [hci1] 12.133555
        Num handles: 1
        Handle: 381 Address: DF:A9:FF:F6:B1:1A (OUI DF-A9-FF)
        Count: 1
< ACL Data TX: Handle 381 flags 0x00 dlen 21              #154 [hci1] 12.133691
      SMP: Pairing Confirm (0x03) len 16
        Confim value: afe763a6c2638d9a2381de5838962565
> HCI Event: Number of Completed Packets (0x13) plen 5    #155 [hci1] 12.303991
        Num handles: 1
        Handle: 381 Address: DF:A9:FF:F6:B1:1A (OUI DF-A9-FF)
        Count: 1
        #154: len 21 (0 Kb/s)
        Latency: 170 msec (74-174 msec ~169 msec)
> ACL Data RX: Handle 381 flags 0x02 dlen 21              #156 [hci1] 12.304288
      SMP: Pairing Random (0x04) len 16
        Random value: 4cda19813608cc640000000000000000
< HCI Command: Host Number of Com.. (0x03|0x0035) plen 5  #157 [hci1] 12.313982
        Num handles: 1
        Handle: 381 Address: DF:A9:FF:F6:B1:1A (OUI DF-A9-FF)
        Count: 1
< ACL Data TX: Handle 381 flags 0x00 dlen 21              #158 [hci1] 12.314151
      SMP: Pairing Random (0x04) len 16
        Random value: 92f20f6ad8f13724432c7fd6001c45ff
> HCI Event: Number of Completed Packets (0x13) plen 5    #159 [hci1] 12.478695
        Num handles: 1
        Handle: 381 Address: DF:A9:FF:F6:B1:1A (OUI DF-A9-FF)
        Count: 1
        #158: len 21 (1 Kb/s)
        Latency: 164 msec (74-174 msec ~166 msec)
> ACL Data RX: Handle 381 flags 0x02 dlen 21              #160 [hci1] 12.566568
      SMP: Pairing Confirm (0x03) len 16
        Confim value: c14c412e18fd95dd31a3afa5a66f2d3e
< HCI Command: Host Number of Com.. (0x03|0x0035) plen 5  #161 [hci1] 12.573755
        Num handles: 1
        Handle: 381 Address: DF:A9:FF:F6:B1:1A (OUI DF-A9-FF)
        Count: 1
< ACL Data TX: Handle 381 flags 0x00 dlen 21              #162 [hci1] 12.573936
      SMP: Pairing Confirm (0x03) len 16
        Confim value: 7a0503fa1475ce48c926b64da327913f
> HCI Event: Number of Completed Packets (0x13) plen 5    #163 [hci1] 12.741543
        Num handles: 1
        Handle: 381 Address: DF:A9:FF:F6:B1:1A (OUI DF-A9-FF)
        Count: 1
        #162: len 21 (1 Kb/s)
        Latency: 167 msec (74-174 msec ~167 msec)
> ACL Data RX: Handle 381 flags 0x02 dlen 21              #164 [hci1] 12.741681
      SMP: Pairing Random (0x04) len 16
        Random value: 3a2f57b9618251960000000000000000
< HCI Command: Host Number of Com.. (0x03|0x0035) plen 5  #165 [hci1] 12.754046
        Num handles: 1
        Handle: 381 Address: DF:A9:FF:F6:B1:1A (OUI DF-A9-FF)
        Count: 1
< ACL Data TX: Handle 381 flags 0x00 dlen 21              #166 [hci1] 12.754163
      SMP: Pairing Random (0x04) len 16
        Random value: 23ac32ebbb5e14c8a6b9622f296d277f
> HCI Event: Number of Completed Packets (0x13) plen 5    #167 [hci1] 12.916237
        Num handles: 1
        Handle: 381 Address: DF:A9:FF:F6:B1:1A (OUI DF-A9-FF)
        Count: 1
        #166: len 21 (1 Kb/s)
        Latency: 162 msec (74-174 msec ~164 msec)
> ACL Data RX: Handle 381 flags 0x02 dlen 21              #168 [hci1] 13.004114
      SMP: Pairing Confirm (0x03) len 16
        Confim value: dfd3c57804f2b39d2357dc0d0f34ae9e
< HCI Command: Host Number of Com.. (0x03|0x0035) plen 5  #169 [hci1] 13.013763
        Num handles: 1
        Handle: 381 Address: DF:A9:FF:F6:B1:1A (OUI DF-A9-FF)
        Count: 1
< ACL Data TX: Handle 381 flags 0x00 dlen 21              #170 [hci1] 13.013967
      SMP: Pairing Confirm (0x03) len 16
        Confim value: 72821d3c70bedf87ef8d28b6e6b69ac6
> HCI Event: Number of Completed Packets (0x13) plen 5    #171 [hci1] 13.178941
        Num handles: 1
        Handle: 381 Address: DF:A9:FF:F6:B1:1A (OUI DF-A9-FF)
        Count: 1
        #170: len 21 (1 Kb/s)
        Latency: 164 msec (74-174 msec ~164 msec)
> ACL Data RX: Handle 381 flags 0x02 dlen 21              #172 [hci1] 13.179216
      SMP: Pairing Random (0x04) len 16
        Random value: 0f9c6327d7c1e4540000000000000000
< HCI Command: Host Number of Com.. (0x03|0x0035) plen 5  #173 [hci1] 13.193480
        Num handles: 1
        Handle: 381 Address: DF:A9:FF:F6:B1:1A (OUI DF-A9-FF)
        Count: 1
< ACL Data TX: Handle 381 flags 0x00 dlen 21              #174 [hci1] 13.193511
      SMP: Pairing Random (0x04) len 16
        Random value: 297efe85e67448a15f56bd27e3a3cf1d
> HCI Event: Number of Completed Packets (0x13) plen 5    #175 [hci1] 13.353780
        Num handles: 1
        Handle: 381 Address: DF:A9:FF:F6:B1:1A (OUI DF-A9-FF)
        Count: 1
        #174: len 21 (1 Kb/s)
        Latency: 160 msec (74-174 msec ~162 msec)
> ACL Data RX: Handle 381 flags 0x02 dlen 21              #176 [hci1] 13.441523
      SMP: Pairing Confirm (0x03) len 16
        Confim value: 04c7ce3031bb996b5613345b116335f6
< HCI Command: Host Number of Com.. (0x03|0x0035) plen 5  #177 [hci1] 13.453641
        Num handles: 1
        Handle: 381 Address: DF:A9:FF:F6:B1:1A (OUI DF-A9-FF)
        Count: 1
< ACL Data TX: Handle 381 flags 0x00 dlen 21              #178 [hci1] 13.453776
      SMP: Pairing Confirm (0x03) len 16
        Confim value: ee693d2ec8ecabe2822ae1337ff00c4a
> HCI Event: Number of Completed Packets (0x13) plen 5    #179 [hci1] 13.616326
        Num handles: 1
        Handle: 381 Address: DF:A9:FF:F6:B1:1A (OUI DF-A9-FF)
        Count: 1
        #178: len 21 (1 Kb/s)
        Latency: 162 msec (74-174 msec ~162 msec)
> ACL Data RX: Handle 381 flags 0x02 dlen 21              #180 [hci1] 13.616641
      SMP: Pairing Random (0x04) len 16
        Random value: 636916e4e5cfcbaf0000000000000000
< HCI Command: Host Number of Com.. (0x03|0x0035) plen 5  #181 [hci1] 13.634052
        Num handles: 1
        Handle: 381 Address: DF:A9:FF:F6:B1:1A (OUI DF-A9-FF)
        Count: 1
< ACL Data TX: Handle 381 flags 0x00 dlen 21              #182 [hci1] 13.634170
      SMP: Pairing Random (0x04) len 16
        Random value: 25a9493fd3ce4faf02be7293595bb7c6
> HCI Event: Number of Completed Packets (0x13) plen 5    #183 [hci1] 13.791217
        Num handles: 1
        Handle: 381 Address: DF:A9:FF:F6:B1:1A (OUI DF-A9-FF)
        Count: 1
        #182: len 21 (1 Kb/s)
        Latency: 157 msec (74-174 msec ~159 msec)
> ACL Data RX: Handle 381 flags 0x02 dlen 21              #184 [hci1] 13.879031
      SMP: Pairing Confirm (0x03) len 16
        Confim value: f611b7495ebe8d40cff0d522b7977f07
< HCI Command: Host Number of Com.. (0x03|0x0035) plen 5  #185 [hci1] 13.893858
        Num handles: 1
        Handle: 381 Address: DF:A9:FF:F6:B1:1A (OUI DF-A9-FF)
        Count: 1
< ACL Data TX: Handle 381 flags 0x00 dlen 21              #186 [hci1] 13.894078
      SMP: Pairing Confirm (0x03) len 16
        Confim value: 4cae50e4254e113f4e5538f25248b9ea
> HCI Event: Number of Completed Packets (0x13) plen 5    #187 [hci1] 14.053939
        Num handles: 1
        Handle: 381 Address: DF:A9:FF:F6:B1:1A (OUI DF-A9-FF)
        Count: 1
        #186: len 21 (1 Kb/s)
        Latency: 159 msec (74-174 msec ~159 msec)
> ACL Data RX: Handle 381 flags 0x02 dlen 21              #188 [hci1] 14.054197
      SMP: Pairing Random (0x04) len 16
        Random value: 8e8755b7c5039d270000000000000000
< HCI Command: Host Number of Com.. (0x03|0x0035) plen 5  #189 [hci1] 14.074127
        Num handles: 1
        Handle: 381 Address: DF:A9:FF:F6:B1:1A (OUI DF-A9-FF)
        Count: 1
< ACL Data TX: Handle 381 flags 0x00 dlen 21              #190 [hci1] 14.074243
      SMP: Pairing Random (0x04) len 16
        Random value: 58f6b41f855a6f6c3560debd84e2affc
> HCI Event: Number of Completed Packets (0x13) plen 5    #191 [hci1] 14.228708
        Num handles: 1
        Handle: 381 Address: DF:A9:FF:F6:B1:1A (OUI DF-A9-FF)
        Count: 1
        #190: len 21 (1 Kb/s)
        Latency: 154 msec (74-174 msec ~157 msec)
> ACL Data RX: Handle 381 flags 0x02 dlen 21              #192 [hci1] 14.316541
      SMP: Pairing Confirm (0x03) len 16
        Confim value: 832213b287e0a30bf5b7146971416a05
< HCI Command: Host Number of Com.. (0x03|0x0035) plen 5  #193 [hci1] 14.333880
        Num handles: 1
        Handle: 381 Address: DF:A9:FF:F6:B1:1A (OUI DF-A9-FF)
        Count: 1
< ACL Data TX: Handle 381 flags 0x00 dlen 21              #194 [hci1] 14.334022
      SMP: Pairing Confirm (0x03) len 16
        Confim value: 0a2df7ad705c7ce0f927af447fabedab
> HCI Event: Number of Completed Packets (0x13) plen 5    #195 [hci1] 14.491435
        Num handles: 1
        Handle: 381 Address: DF:A9:FF:F6:B1:1A (OUI DF-A9-FF)
        Count: 1
        #194: len 21 (1 Kb/s)
        Latency: 157 msec (74-174 msec ~157 msec)
> ACL Data RX: Handle 381 flags 0x02 dlen 21              #196 [hci1] 14.491699
      SMP: Pairing Random (0x04) len 16
        Random value: 37b6a9ab365ec44b0000000000000000
< HCI Command: Host Number of Com.. (0x03|0x0035) plen 5  #197 [hci1] 14.494069
        Num handles: 1
        Handle: 381 Address: DF:A9:FF:F6:B1:1A (OUI DF-A9-FF)
        Count: 1
< ACL Data TX: Handle 381 flags 0x00 dlen 21              #198 [hci1] 14.494156
      SMP: Pairing Random (0x04) len 16
        Random value: b67e7216d5bf664139eda2b542549666
> HCI Event: Number of Completed Packets (0x13) plen 5    #199 [hci1] 14.666159
        Num handles: 1
        Handle: 381 Address: DF:A9:FF:F6:B1:1A (OUI DF-A9-FF)
        Count: 1
        #198: len 21 (0 Kb/s)
        Latency: 172 msec (74-174 msec ~164 msec)
> ACL Data RX: Handle 381 flags 0x02 dlen 21              #200 [hci1] 14.754146
      SMP: Pairing Confirm (0x03) len 16
        Confim value: 7fe40871f62f6e5c996ccd9c701b7e9b
< HCI Command: Host Number of Com.. (0x03|0x0035) plen 5  #201 [hci1] 14.773526
        Num handles: 1
        Handle: 381 Address: DF:A9:FF:F6:B1:1A (OUI DF-A9-FF)
        Count: 1
< ACL Data TX: Handle 381 flags 0x00 dlen 21              #202 [hci1] 14.773650
      SMP: Pairing Confirm (0x03) len 16
        Confim value: 83c5eeb9a7c3a205f137980abb006cd4
> HCI Event: Number of Completed Packets (0x13) plen 5    #203 [hci1] 14.928952
        Num handles: 1
        Handle: 381 Address: DF:A9:FF:F6:B1:1A (OUI DF-A9-FF)
        Count: 1
        #202: len 21 (1 Kb/s)
        Latency: 155 msec (74-174 msec ~159 msec)
> ACL Data RX: Handle 381 flags 0x02 dlen 21              #204 [hci1] 14.929179
      SMP: Pairing Random (0x04) len 16
        Random value: ad77fc695eb53edc0000000000000000
< HCI Command: Host Number of Com.. (0x03|0x0035) plen 5  #205 [hci1] 14.934065
        Num handles: 1
        Handle: 381 Address: DF:A9:FF:F6:B1:1A (OUI DF-A9-FF)
        Count: 1
< ACL Data TX: Handle 381 flags 0x00 dlen 21              #206 [hci1] 14.934136
      SMP: Pairing Random (0x04) len 16
        Random value: ed17f76500c95219dd01e09d1e63f87b
> HCI Event: Number of Completed Packets (0x13) plen 5    #207 [hci1] 15.103602
        Num handles: 1
        Handle: 381 Address: DF:A9:FF:F6:B1:1A (OUI DF-A9-FF)
        Count: 1
        #206: len 21 (0 Kb/s)
        Latency: 169 msec (74-174 msec ~164 msec)
> ACL Data RX: Handle 381 flags 0x02 dlen 21              #208 [hci1] 15.191516
      SMP: Pairing Confirm (0x03) len 16
        Confim value: 506669a528880712a509b623b7cc5334
< HCI Command: Host Number of Com.. (0x03|0x0035) plen 5  #209 [hci1] 15.193517
        Num handles: 1
        Handle: 381 Address: DF:A9:FF:F6:B1:1A (OUI DF-A9-FF)
        Count: 1
< ACL Data TX: Handle 381 flags 0x00 dlen 21              #210 [hci1] 15.193665
      SMP: Pairing Confirm (0x03) len 16
        Confim value: 994389150067e244c0f81cb4dbe54058
> HCI Event: Number of Completed Packets (0x13) plen 5    #211 [hci1] 15.366502
        Num handles: 1
        Handle: 381 Address: DF:A9:FF:F6:B1:1A (OUI DF-A9-FF)
        Count: 1
        #210: len 21 (0 Kb/s)
        Latency: 172 msec (74-174 msec ~168 msec)
> ACL Data RX: Handle 381 flags 0x02 dlen 21              #212 [hci1] 15.366635
      SMP: Pairing Random (0x04) len 16
        Random value: 9211167d9dc583050000000000000000
< HCI Command: Host Number of Com.. (0x03|0x0035) plen 5  #213 [hci1] 15.374019
        Num handles: 1
        Handle: 381 Address: DF:A9:FF:F6:B1:1A (OUI DF-A9-FF)
        Count: 1
< ACL Data TX: Handle 381 flags 0x00 dlen 21              #214 [hci1] 15.374094
      SMP: Pairing Random (0x04) len 16
        Random value: 81d35d47e1f6006d79c974bd9d9e1ee3
> HCI Event: Number of Completed Packets (0x13) plen 5    #215 [hci1] 15.541146
        Num handles: 1
        Handle: 381 Address: DF:A9:FF:F6:B1:1A (OUI DF-A9-FF)
        Count: 1
        #214: len 21 (1 Kb/s)
        Latency: 167 msec (74-174 msec ~167 msec)
> ACL Data RX: Handle 381 flags 0x02 dlen 21              #216 [hci1] 15.629003
      SMP: Pairing Confirm (0x03) len 16
        Confim value: 8ac4e37bcf53c6e45714a403e621865b
< HCI Command: Host Number of Com.. (0x03|0x0035) plen 5  #217 [hci1] 15.633403
        Num handles: 1
        Handle: 381 Address: DF:A9:FF:F6:B1:1A (OUI DF-A9-FF)
        Count: 1
< ACL Data TX: Handle 381 flags 0x00 dlen 21              #218 [hci1] 15.633523
      SMP: Pairing Confirm (0x03) len 16
        Confim value: 8d9eb749aafb44050c6f6b070dd44579
> HCI Event: Number of Completed Packets (0x13) plen 5    #219 [hci1] 15.803788
        Num handles: 1
        Handle: 381 Address: DF:A9:FF:F6:B1:1A (OUI DF-A9-FF)
        Count: 1
        #218: len 21 (0 Kb/s)
        Latency: 170 msec (74-174 msec ~169 msec)
> ACL Data RX: Handle 381 flags 0x02 dlen 21              #220 [hci1] 15.804130
      SMP: Pairing Random (0x04) len 16
        Random value: 0d86cabdefb618c00000000000000000
< HCI Command: Host Number of Com.. (0x03|0x0035) plen 5  #221 [hci1] 15.813504
        Num handles: 1
        Handle: 381 Address: DF:A9:FF:F6:B1:1A (OUI DF-A9-FF)
        Count: 1
< ACL Data TX: Handle 381 flags 0x00 dlen 21              #222 [hci1] 15.813548
      SMP: Pairing Random (0x04) len 16
        Random value: e7f7e0c2476823e41736a7e381bafb7c
> HCI Event: Number of Completed Packets (0x13) plen 5    #223 [hci1] 15.978614
        Num handles: 1
        Handle: 381 Address: DF:A9:FF:F6:B1:1A (OUI DF-A9-FF)
        Count: 1
        #222: len 21 (1 Kb/s)
        Latency: 165 msec (74-174 msec ~167 msec)
> ACL Data RX: Handle 381 flags 0x02 dlen 21              #224 [hci1] 16.066524
      SMP: Pairing Confirm (0x03) len 16
        Confim value: 1d91b6a87490d8f3b8f56d7cd3f27310
< HCI Command: Host Number of Com.. (0x03|0x0035) plen 5  #225 [hci1] 16.073935
        Num handles: 1
        Handle: 381 Address: DF:A9:FF:F6:B1:1A (OUI DF-A9-FF)
        Count: 1
< ACL Data TX: Handle 381 flags 0x00 dlen 21              #226 [hci1] 16.074138
      SMP: Pairing Confirm (0x03) len 16
        Confim value: 7fba87f8668077a3d6f11f1860e9aab7
> HCI Event: Number of Completed Packets (0x13) plen 5    #227 [hci1] 16.241220
        Num handles: 1
        Handle: 381 Address: DF:A9:FF:F6:B1:1A (OUI DF-A9-FF)
        Count: 1
        #226: len 21 (1 Kb/s)
        Latency: 167 msec (74-174 msec ~167 msec)
> ACL Data RX: Handle 381 flags 0x02 dlen 21              #228 [hci1] 16.241608
      SMP: Pairing Random (0x04) len 16
        Random value: 7cd72ee8371a22ad0000000000000000
< HCI Command: Host Number of Com.. (0x03|0x0035) plen 5  #229 [hci1] 16.254070
        Num handles: 1
        Handle: 381 Address: DF:A9:FF:F6:B1:1A (OUI DF-A9-FF)
        Count: 1
