Bluetooth monitor ver 5.72
= Note: Linux version 6.14.0-36-generic (x86_64)                       0.127268
= Note: Bluetooth subsystem version 2.22                               0.127269
= New Index: 00:00:00:00:00:00 (Primary,UART,hci2)              [hci2] 0.127270
= New Index: 00:00:00:00:00:00 (Primary,UART,hci1)              [hci1] 0.127271
= New Index: 48:5F:99:8E:E0:64 (Primary,USB,hci0)               [hci0] 0.127272
= Open Index: 00:00:00:00:00:00                                 [hci1] 0.150488
= Index Info: 00:00:00:00:00:00 (Nordic Semiconductor ASA)      [hci1] 0.150492
@ USER Open: main (privileged) version 2.22            {0x0001} [hci1] 0.150494
< HCI Command: Reset (0x03|0x0003) plen 0                    #1 [hci1] 0.150874
> HCI Event: Command Complete (0x0e) plen 4                  #2 [hci1] 0.151382
      Reset (0x03|0x0003) ncmd 1
        Status: Success (0x00)
< HCI Command: Read Local Supported... (0x04|0x0003) plen 0  #3 [hci1] 0.170432
> HCI Event: Command Complete (0x0e) plen 12                 #4 [hci1] 0.170957
      Read Local Supported Features (0x04|0x0003) ncmd 1
        Status: Success (0x00)
        Features: 0x00 0x00 0x00 0x00 0x60 0x00 0x00 0x00
          BR/EDR Not Supported
          LE Supported (Controller)
< HCI Command: Read Local Version In.. (0x04|0x0001) plen 0  #5 [hci1] 0.190427
> HCI Event: Command Complete (0x0e) plen 12                 #6 [hci1] 0.190979
      Read Local Version Information (0x04|0x0001) ncmd 1
        Status: Success (0x00)
        HCI version: Reserved (0x0f) - Revision 12393 (0x3069)
        LMP version: Reserved (0x0f) - Subversion 12393 (0x3069)
        Manufacturer: Nordic Semiconductor ASA (89)
< HCI Command: Read Local Supported... (0x04|0x0002) plen 0  #7 [hci1] 0.210439
> HCI Event: Command Complete (0x0e) plen 68                 #8 [hci1] 0.211579
      Read Local Supported Commands (0x04|0x0002) ncmd 1
        Status: Success (0x00)
        Commands: 119 entries
          Disconnect (Octet 0 - Bit 5)
          Read Remote Version Information (Octet 2 - Bit 7)
          Set Event Mask (Octet 5 - Bit 6)
          Reset (Octet 5 - Bit 7)
          Read Connection Accept Timeout (Octet 7 - Bit 2)
          Write Connection Accept Timeout (Octet 7 - Bit 3)
          Read Transmit Power Level (Octet 10 - Bit 2)
          Set Controller To Host Flow Control (Octet 10 - Bit 5)
          Host Buffer Size (Octet 10 - Bit 6)
          Host Number of Completed Packets (Octet 10 - Bit 7)
          Read Local Version Information (Octet 14 - Bit 3)
          Read Local Supported Features (Octet 14 - Bit 5)
          Read BD ADDR (Octet 15 - Bit 1)
          Read RSSI (Octet 15 - Bit 5)
          Set Event Mask Page 2 (Octet 22 - Bit 2)
          LE Set Event Mask (Octet 25 - Bit 0)
          LE Read Buffer Size (Octet 25 - Bit 1)
          LE Read Local Supported Features (Octet 25 - Bit 2)
          LE Set Random Address (Octet 25 - Bit 4)
          LE Set Advertising Parameters (Octet 25 - Bit 5)
          LE Read Advertising Channel TX Power (Octet 25 - Bit 6)
          LE Set Advertising Data (Octet 25 - Bit 7)
          LE Set Scan Response Data (Octet 26 - Bit 0)
          LE Set Advertise Enable (Octet 26 - Bit 1)
          LE Set Scan Parameters (Octet 26 - Bit 2)
          LE Set Scan Enable (Octet 26 - Bit 3)
          LE Create Connection (Octet 26 - Bit 4)
          LE Create Connection Cancel (Octet 26 - Bit 5)
          LE Read Accept List Size (Octet 26 - Bit 6)
          LE Clear Accept List (Octet 26 - Bit 7)
          LE Add Device To Accept List (Octet 27 - Bit 0)
          LE Remove Device From Accept List (Octet 27 - Bit 1)
          LE Connection Update (Octet 27 - Bit 2)
          LE Set Host Channel Classification (Octet 27 - Bit 3)
          LE Read Channel Map (Octet 27 - Bit 4)
          LE Read Remote Used Features (Octet 27 - Bit 5)
          LE Encrypt (Octet 27 - Bit 6)
          LE Rand (Octet 27 - Bit 7)
          LE Start Encryption (Octet 28 - Bit 0)
          LE Long Term Key Request Reply (Octet 28 - Bit 1)
          LE Long Term Key Request Neg Reply (Octet 28 - Bit 2)
          LE Read Supported States (Octet 28 - Bit 3)
          LE Receiver Test (Octet 28 - Bit 4)
          LE Transmitter Test (Octet 28 - Bit 5)
          LE Test End (Octet 28 - Bit 6)
          Read Authenticated Payload Timeout (Octet 32 - Bit 4)
          Write Authenticated Payload Timeout (Octet 32 - Bit 5)
          LE Set Data Length (Octet 33 - Bit 6)
          LE Read Suggested Default Data Length (Octet 33 - Bit 7)
          LE Write Suggested Default Data Length (Octet 34 - Bit 0)
          LE Add Device To Resolving List (Octet 34 - Bit 3)
          LE Remove Device From Resolving List (Octet 34 - Bit 4)
          LE Clear Resolving List (Octet 34 - Bit 5)
          LE Read Resolving List Size (Octet 34 - Bit 6)
          LE Set Address Resolution Enable (Octet 35 - Bit 1)
          LE Set Resolvable Private Address Timeout (Octet 35 - Bit 2)
          LE Read Maximum Data Length (Octet 35 - Bit 3)
          LE Read PHY (Octet 35 - Bit 4)
          LE Set Default PHY (Octet 35 - Bit 5)
          LE Set PHY (Octet 35 - Bit 6)
          LE Enhanced Receiver Test (Octet 35 - Bit 7)
          LE Enhanced Transmitter Test (Octet 36 - Bit 0)
          LE Set Advertising Set Random Address (Octet 36 - Bit 1)
          LE Set Extended Advertising Parameters (Octet 36 - Bit 2)
          LE Set Extended Advertising Data (Octet 36 - Bit 3)
          LE Set Extended Scan Response Data (Octet 36 - Bit 4)
          LE Set Extended Advertising Enable (Octet 36 - Bit 5)
          LE Read Maximum Advertising Data Length (Octet 36 - Bit 6)
          LE Read Number of Supported Advertising Sets (Octet 36 - Bit 7)
          LE Remove Advertising Set (Octet 37 - Bit 0)
          LE Clear Advertising Sets (Octet 37 - Bit 1)
          LE Set Periodic Advertising Parameters (Octet 37 - Bit 2)
          LE Set Periodic Advertising Data (Octet 37 - Bit 3)
          LE Set Periodic Advertising Enable (Octet 37 - Bit 4)
          LE Set Extended Scan Parameters (Octet 37 - Bit 5)
          LE Set Extended Scan Enable (Octet 37 - Bit 6)
          LE Extended Create Connection (Octet 37 - Bit 7)
          LE Periodic Advertising Create Sync (Octet 38 - Bit 0)
          LE Periodic Advertising Create Sync Cancel (Octet 38 - Bit 1)
          LE Periodic Advertising Terminate Sync (Octet 38 - Bit 2)
          LE Add Device To Periodic Advertiser List (Octet 38 - Bit 3)
          LE Remove Device From Periodic Advertiser List (Octet 38 - Bit 4)
          LE Clear Periodic Advertiser List (Octet 38 - Bit 5)
          LE Read Periodic Advertiser List Size (Octet 38 - Bit 6)
          LE Read Transmit Power (Octet 38 - Bit 7)
          LE Read RF Path Compensation (Octet 39 - Bit 0)
          LE Write RF Path Compensation (Octet 39 - Bit 1)
          LE Set Privacy Mode (Octet 39 - Bit 2)
          LE Periodic Advertising Receive Enable (Octet 40 - Bit 5)
          LE Periodic Advertising Sync Transfer (Octet 40 - Bit 6)
          LE Periodic Advertising Set Info Transfer (Octet 40 - Bit 7)
          LE Periodic Advertising Sync Transfer Parameters (Octet 41 - Bit 0)
          LE Set Default Periodic Advertisng Sync Transfer Parameters (Octet 41 - Bit 1)
          LE Read Buffer v2 (Octet 41 - Bit 5)
          LE Read ISO TX Sync (Octet 41 - Bit 6)
          LE Set Connected Isochronous Group Parameters (Octet 41 - Bit 7)
          LE Set Connected Isochronous Group Parameters Test (Octet 42 - Bit 0)
          LE Create Connected Isochronous Stream (Octet 42 - Bit 1)
          LE Remove Connected Isochronous Group (Octet 42 - Bit 2)
          LE Accept Connected Isochronous Stream Request (Octet 42 - Bit 3)
          LE Reject Connected Isochronous Stream Request (Octet 42 - Bit 4)
          LE Create Broadcast Isochronous Group (Octet 42 - Bit 5)
          LE Create Broadcast Isochronous Group Test (Octet 42 - Bit 6)
          LE Terminate Broadcast Isochronous Group (Octet 42 - Bit 7)
          LE Broadcast Isochronous Group Create Sync (Octet 43 - Bit 0)
          LE Broadcast Isochronous Group Terminate Sync (Octet 43 - Bit 1)
          LE Request Peer SCA (Octet 43 - Bit 2)
          LE Setup Isochronous Data Path (Octet 43 - Bit 3)
          LE Remove Isochronous Data Path (Octet 43 - Bit 4)
          LE Isochronous Transmit Test (Octet 43 - Bit 5)
          LE Isochronous Receive Test (Octet 43 - Bit 6)
          LE Isochronous Read Test Counters (Octet 43 - Bit 7)
          LE Isochronous Read Test Counters (Octet 44 - Bit 0)
          LE Set Host Feature (Octet 44 - Bit 1)
          Octet 44 - Bit 2 
          Octet 45 - Bit 6 
          Octet 46 - Bit 0 
          Octet 46 - Bit 1 
          Octet 46 - Bit 2 
< HCI Command: Host Buffer Size (0x03|0x0033) plen 7         #9 [hci1] 0.230458
        ACL MTU: 255  ACL max packet: 16
        SCO MTU: 0    SCO max packet: 0
> HCI Event: Command Complete (0x0e) plen 4                 #10 [hci1] 0.230965
      Host Buffer Size (0x03|0x0033) ncmd 1
        Status: Success (0x00)
< HCI Command: Set Controller To Ho.. (0x03|0x0031) plen 1  #11 [hci1] 0.250458
        Flow control: ACL Data Packets (0x01)
> HCI Event: Command Complete (0x0e) plen 4                 #12 [hci1] 0.250938
      Set Controller To Host Flow Control (0x03|0x0031) ncmd 1
        Status: Success (0x00)
< HCI Command: LE Read Local Suppor.. (0x08|0x0003) plen 0  #13 [hci1] 0.270456
> HCI Event: Command Complete (0x0e) plen 12                #14 [hci1] 0.271043
      LE Read Local Supported Features (0x08|0x0003) ncmd 1
        Status: Success (0x00)
        Features: 0xfd 0x79 0x00 0xf7 0x30 0x01 0x00 0x00
          LE Encryption
          Extended Reject Indication
          Peripheral-initiated Features Exchange
          LE Ping
          LE Data Packet Length Extension
          LL Privacy
          Extended Scanner Filter Policies
          LE 2M PHY
          LE Coded PHY
          LE Extended Advertising
          LE Periodic Advertising
          Channel Selection Algorithm #2
          Periodic Advertising Sync Transfer - Sender
          Periodic Advertising Sync Transfer - Recipient
          Sleep Clock Accuracy Updates
          Connected Isochronous Stream - Central
          Connected Isochronous Stream - Peripheral
          Isochronous Broadcaster
          Synchronized Receiver
          Periodic Advertising ADI support
          Connection Subrating
          Unknown features (0x0000010000000000)
< HCI Command: LE Set Host Feature (0x08|0x0074) plen 2     #15 [hci1] 0.290440
        Bit Number: 32
          Connected Isochronous Stream (Host Support)
        Bit Value: 1
> HCI Event: Command Complete (0x0e) plen 4                 #16 [hci1] 0.291029
      LE Set Host Feature (0x08|0x0074) ncmd 1
        Status: Success (0x00)
< HCI Command: LE Read Buffer v2 (0x08|0x0060) plen 0       #17 [hci1] 0.310460
> HCI Event: Command Complete (0x0e) plen 10                #18 [hci1] 0.310943
      LE Read Buffer v2 (0x08|0x0060) ncmd 1
        Status: Success (0x00)
        ACL MTU: 27
        ACL max packet: 3
        ISO MTU: 318
        ISO max packet: 3
< HCI Command: LE Read Maximum Adve.. (0x08|0x003a) plen 0  #19 [hci1] 0.330492
> HCI Event: Command Complete (0x0e) plen 6                 #20 [hci1] 0.331049
      LE Read Maximum Advertising Data Length (0x08|0x003a) ncmd 1
        Status: Success (0x00)
        Max length: 1650
< HCI Command: LE Read Supported St.. (0x08|0x001c) plen 0  #21 [hci1] 0.350432
> HCI Event: Command Complete (0x0e) plen 12                #22 [hci1] 0.350990
      LE Read Supported States (0x08|0x001c) ncmd 1
        Status: Success (0x00)
        States: 0x000003ff3e0306ff
          Non-connectable Advertising State
          Scannable Advertising State
          Connectable Advertising State
          High Duty Cycle Directed Advertising State
          Passive Scanning State
          Active Scanning State
          Initiating State
            and Connection State (Central Role)
          Connection State (Peripheral Role)
          Scannable Advertising State
            and Passive Scanning State
          Connectable Advertising State
            and Passive Scanning State
          Non-connectable Advertising State
            and Initiating State
          Scannable Advertising State
            and Initiating State
          Active Scanning State
            and Connection State (Central Role)
          Passive Scanning State
            and Connection State (Peripheral Role)
          Active Scanning State
            and Connection State (Peripheral Role)
          Initiating State
            and Connection State (Central Role)
            and Central Role & Central Role
          Low Duty Cycle Directed Advertising State
          Connectable Advertising State
            and Initiating State
            and Central Role & Peripheral Role
          High Duty Cycle Directed Advertising State
            and Initiating State
            and Central Role & Peripheral Role
          Low Duty Cycle Directed Advertising State
            and Initiating State
            and Central Role & Peripheral Role
          Connectable Advertising State
            and Connection State (Central Role)
            and Central Role & Peripheral Role
          High Duty Cycle Directed Advertising State
            and Connection State (Central Role)
            and Central Role & Peripheral Role
          Low Duty Cycle Directed Advertising State
            and Connection State (Central Role)
            and Central Role & Peripheral Role
          Connectable Advertising State
            and Connection State (Peripheral Role)
            and Central Role & Peripheral Role
          High Duty Cycle Directed Advertising State
            and Connection State (Peripheral Role)
            and Peripheral Role & Peripheral Role
          Low Duty Cycle Directed Advertising State
            and Connection State (Peripheral Role)
            and Peripheral Role & Peripheral Role
          Initiating State
            and Connection State (Peripheral Role)
            and Central Role & Peripheral Role
< HCI Command: LE Read Maximum Data.. (0x08|0x002f) plen 0  #23 [hci1] 0.370439
> HCI Event: Command Complete (0x0e) plen 12                #24 [hci1] 0.370922
      LE Read Maximum Data Length (0x08|0x002f) ncmd 1
        Status: Success (0x00)
        Max TX octets: 251
        Max TX time: 2704
        Max RX octets: 251
        Max RX time: 2704
< HCI Command: LE Write Suggested D.. (0x08|0x0024) plen 4  #25 [hci1] 0.390450
        TX octets: 251
        TX time: 2704
> HCI Event: Command Complete (0x0e) plen 4                 #26 [hci1] 0.390956
      LE Write Suggested Default Data Length (0x08|0x0024) ncmd 1
        Status: Success (0x00)
< HCI Command: LE Read Resolving Li.. (0x08|0x002a) plen 0  #27 [hci1] 0.410485
> HCI Event: Command Complete (0x0e) plen 5                 #28 [hci1] 0.410971
      LE Read Resolving List Size (0x08|0x002a) ncmd 1
        Status: Success (0x00)
        Size: 8
< HCI Command: LE Set Event Mask (0x08|0x0001) plen 8       #29 [hci1] 0.430464
        Mask: 0x000002023f87fa5e
          LE Advertising Report
          LE Connection Update Complete
          LE Read Remote Used Features Complete
          LE Long Term Key Request
          LE Data Length Change
          LE Enhanced Connection Complete
          LE PHY Update Complete
          LE Extended Advertising Report
          LE Periodic Advertising Sync Established
          LE Periodic Advertising Report
          LE Periodic Advertising Sync Lost
          LE Extended Scan Timeout
          LE Extended Advertising Set Terminated
          LE Scan Request Received
          LE Periodic Advertising Sync Transfer Rvc
          LE CIS Established
          LE CIS Request
          LE Create BIG Complete
          LE Terminate BIG Complete
          LE BIG Sync Estabilished Complete
          LE BIG Sync Lost
          LE BIG Info Advertising Report
          Unknown mask (0x0000020000000000)
> HCI Event: Command Complete (0x0e) plen 4                 #30 [hci1] 0.431051
      LE Set Event Mask (0x08|0x0001) ncmd 1
        Status: Success (0x00)
< HCI Command: Set Event Mask (0x03|0x0001) plen 8          #31 [hci1] 0.450461
        Mask: 0x2000800002008890
          Disconnection Complete
          Encryption Change
          Read Remote Version Information Complete
          Hardware Error
          Data Buffer Overflow
          Encryption Key Refresh Complete
          LE Meta
> HCI Event: Command Complete (0x0e) plen 4                 #32 [hci1] 0.450992
      Set Event Mask (0x03|0x0001) ncmd 1
        Status: Success (0x00)
< HCI Command: Read BD ADDR (0x04|0x0009) plen 0            #33 [hci1] 0.470472
> HCI Event: Command Complete (0x0e) plen 10                #34 [hci1] 0.471066
      Read BD ADDR (0x04|0x0009) ncmd 1
        Status: Success (0x00)
        Address: 00:00:00:00:00:00 (OUI 00-00-00)
< HCI Command: LE Set Random Address (0x08|0x0005) plen 6   #35 [hci1] 0.490463
        Address: D5:B6:CC:31:DB:3B (Static)
> HCI Event: Command Complete (0x0e) plen 4                 #36 [hci1] 0.491064
      LE Set Random Address (0x08|0x0005) ncmd 1
        Status: Success (0x00)
< HCI Command: LE Extended Create... (0x08|0x0043) plen 26  #37 [hci1] 2.710581
        Filter policy: Accept list is not used (0x00)
        Own address type: Random (0x01)
        Peer address type: Public (0x00)
        Peer address: DF:A9:FF:F6:B1:1A (OUI DF-A9-FF)
        Initiating PHYs: 0x01
        Entry 0: LE 1M
          Scan interval: 60.000 msec (0x0060)
          Scan window: 60.000 msec (0x0060)
          Min connection interval: 30.00 msec (0x0018)
          Max connection interval: 50.00 msec (0x0028)
          Connection latency: 0 (0x0000)
          Supervision timeout: 4000 msec (0x0190)
          Min connection length: 0.000 msec (0x0000)
          Max connection length: 0.000 msec (0x0000)
> HCI Event: Command Status (0x0f) plen 4                   #38 [hci1] 2.711510
      LE Extended Create Connection (0x08|0x0043) ncmd 1
        Status: Success (0x00)
> HCI Event: LE Meta Event (0x3e) plen 31                   #39 [hci1] 2.775869
      LE Enhanced Connection Complete (0x0a)
        Status: Success (0x00)
        Handle: 3060
        Role: Central (0x00)
        Peer address type: Public (0x00)
        Peer address: DF:A9:FF:F6:B1:1A (OUI DF-A9-FF)
        Local resolvable private address: 00:00:00:00:00:00 (Non-Resolvable)
        Peer resolvable private address: 00:00:00:00:00:00 (Non-Resolvable)
        Connection interval: 50.00 msec (0x0028)
        Connection latency: 0 (0x0000)
        Supervision timeout: 4000 msec (0x0190)
        Central clock accuracy: 0x00
< HCI Command: LE Read Remote Used... (0x08|0x0016) plen 2  #40 [hci1] 2.790707
        Handle: 3060 Address: DF:A9:FF:F6:B1:1A (OUI DF-A9-FF)
> HCI Event: Command Status (0x0f) plen 4                   #41 [hci1] 2.791164
      LE Read Remote Used Features (0x08|0x0016) ncmd 1
        Status: Success (0x00)
< HCI Command: LE Set PHY (0x08|0x0032) plen 7              #42 [hci1] 2.810686
        Handle: 3060 Address: DF:A9:FF:F6:B1:1A (OUI DF-A9-FF)
        All PHYs preference: 0x00
        TX PHYs preference: 0x02
          LE 2M
        RX PHYs preference: 0x02
          LE 2M
        PHY options preference: Reserved (0x0000)
> HCI Event: Command Status (0x0f) plen 4                   #43 [hci1] 2.811319
      LE Set PHY (0x08|0x0032) ncmd 1
        Status: Success (0x00)
> ACL Data RX: Handle 3060 flags 0x02 dlen 6                #44 [hci1] 2.827234
      SMP: Security Request (0x0b) len 1
        Authentication requirement: No bonding, MITM, SC, No Keypresses (0x0c)
< HCI Command: Host Number of Compl.. (0x03|0x0035) plen 5  #45 [hci1] 2.830790
        Num handles: 1
        Handle: 3060 Address: DF:A9:FF:F6:B1:1A (OUI DF-A9-FF)
        Count: 1
< ACL Data TX: Handle 3060 flags 0x00 dlen 11               #46 [hci1] 2.830823
      SMP: Pairing Request (0x01) len 6
        IO capability: DisplayOnly (0x00)
        OOB data: Authentication data not present (0x00)
        Authentication requirement: Bonding, No MITM, SC, No Keypresses (0x09)
        Max encryption key size: 16
        Initiator key distribution: EncKey (0x01)
        Responder key distribution: EncKey IdKey (0x03)
> HCI Event: Number of Completed Packets (0x13) plen 5      #47 [hci1] 2.927308
        Num handles: 1
        Handle: 3060 Address: DF:A9:FF:F6:B1:1A (OUI DF-A9-FF)
        Count: 1
        #46: len 11 (0 Kb/s)
        Latency: 96 msec (96-96 msec ~96 msec)
> HCI Event: LE Meta Event (0x3e) plen 12                   #48 [hci1] 2.927463
      LE Read Remote Used Features (0x04)
        Status: Success (0x00)
        Handle: 3060 Address: DF:A9:FF:F6:B1:1A (OUI DF-A9-FF)
        Features: 0x2d 0x49 0x00 0xf7 0x67 0xd9 0x00 0x80
          LE Encryption
          Extended Reject Indication
          Peripheral-initiated Features Exchange
          LE Data Packet Length Extension
          LE 2M PHY
          LE Coded PHY
          Channel Selection Algorithm #2
          Periodic Advertising Sync Transfer - Sender
          Periodic Advertising Sync Transfer - Recipient
          Sleep Clock Accuracy Updates
          Connected Isochronous Stream - Central
          Connected Isochronous Stream - Peripheral
          Isochronous Broadcaster
          Synchronized Receiver
          Connected Isochronous Stream (Host Support)
          LE Power Control Request
          LE Power Control Request
          Connection Subrating
          Connection Subrating (Host Support)
          Unknown features (0x8000d90000000000)
> ACL Data RX: Handle 3060 flags 0x02 dlen 11               #49 [hci1] 2.977235
      SMP: Pairing Response (0x02) len 6
        IO capability: KeyboardDisplay (0x04)
        OOB data: Authentication data not present (0x00)
        Authentication requirement: No bonding, MITM, SC, No Keypresses (0x0c)
        Max encryption key size: 16
        Initiator key distribution: <none> (0x00)
        Responder key distribution: <none> (0x00)
< HCI Command: Host Number of Compl.. (0x03|0x0035) plen 5  #50 [hci1] 2.990653
        Num handles: 1
        Handle: 3060 Address: DF:A9:FF:F6:B1:1A (OUI DF-A9-FF)
        Count: 1
< ACL Data TX: Handle 3060 flags 0x00 dlen 27               #51 [hci1] 2.990674
< ACL Data TX: Handle 3060 flags 0x01 dlen 27               #52 [hci1] 2.990675
< ACL Data TX: Handle 3060 flags 0x01 dlen 15               #53 [hci1] 2.990681
      SMP: Pairing Public Key (0x0c) len 64
        X: 98308440221e2d910f0e54b71e7ec652857aa9b5a0dc65028824cc19db1226e9
        Y: 67a4816bcb62efb21701e31fdb27561a6217575fb007a8bbdabe7e28b6f68482
> HCI Event: Number of Completed Packets (0x13) plen 5      #54 [hci1] 3.027274
        Num handles: 1
        Handle: 3060 Address: DF:A9:FF:F6:B1:1A (OUI DF-A9-FF)
        Count: 1
        #51: len 27 (6 Kb/s)
        Latency: 36 msec (36-96 msec ~66 msec)
> HCI Event: Number of Completed Packets (0x13) plen 5      #55 [hci1] 3.077471
        Num handles: 1
        Handle: 3060 Address: DF:A9:FF:F6:B1:1A (OUI DF-A9-FF)
        Count: 1
        #52: len 27 (2 Kb/s)
        Latency: 86 msec (36-96 msec ~76 msec)
> HCI Event: Number of Completed Packets (0x13) plen 5      #56 [hci1] 3.177384
        Num handles: 1
        Handle: 3060 Address: DF:A9:FF:F6:B1:1A (OUI DF-A9-FF)
        Count: 1
        #53: len 15 (0 Kb/s)
        Latency: 186 msec (36-186 msec ~131 msec)
> ACL Data RX: Handle 3060 flags 0x02 dlen 27               #57 [hci1] 3.227536
> ACL Data RX: Handle 3060 flags 0x01 dlen 27               #58 [hci1] 3.228158
> ACL Data RX: Handle 3060 flags 0x01 dlen 15               #59 [hci1] 3.228750
      SMP: Pairing Public Key (0x0c) len 64
        X: 27d9df684d688c5690e3a09890202d507df98083887a414fe7664b4e882d5d54
        Y: 1f325155bc27a9c35f7c2a864c0e7b018d8bf9d2afb148b8acef2f1e8c819b0b
< HCI Command: Host Number of Compl.. (0x03|0x0035) plen 5  #60 [hci1] 3.231078
        Num handles: 1
        Handle: 3060 Address: DF:A9:FF:F6:B1:1A (OUI DF-A9-FF)
        Count: 1
< HCI Command: Host Number of Compl.. (0x03|0x0035) plen 5  #61 [hci1] 3.231294
        Num handles: 1
        Handle: 3060 Address: DF:A9:FF:F6:B1:1A (OUI DF-A9-FF)
        Count: 1
< HCI Command: Host Number of Compl.. (0x03|0x0035) plen 5  #62 [hci1] 3.231850
        Num handles: 1
        Handle: 3060 Address: DF:A9:FF:F6:B1:1A (OUI DF-A9-FF)
        Count: 1
< ACL Data TX: Handle 3060 flags 0x00 dlen 21               #63 [hci1] 3.231961
      SMP: Pairing Confirm (0x03) len 16
        Confim value: 1ac8671f71e4034f10bd68b1f5f5df2a
> HCI Event: Number of Completed Packets (0x13) plen 5      #64 [hci1] 3.277328
        Num handles: 1
        Handle: 3060 Address: DF:A9:FF:F6:B1:1A (OUI DF-A9-FF)
        Count: 1
        #63: len 21 (3 Kb/s)
        Latency: 45 msec (36-186 msec ~88 msec)
> HCI Event: LE Meta Event (0x3e) plen 6                    #65 [hci1] 3.426692
      LE PHY Update Complete (0x0c)
        Status: Success (0x00)
        Handle: 3060 Address: DF:A9:FF:F6:B1:1A (OUI DF-A9-FF)
        TX PHY: LE 2M (0x02)
        RX PHY: LE 2M (0x02)
> ACL Data RX: Handle 3060 flags 0x02 dlen 21               #66 [hci1] 3.877273
      SMP: Pairing Confirm (0x03) len 16
        Confim value: 4a74f33f3addbce97f22bc022f7b0437
< HCI Command: Host Number of Compl.. (0x03|0x0035) plen 5  #67 [hci1] 3.890669
        Num handles: 1
        Handle: 3060 Address: DF:A9:FF:F6:B1:1A (OUI DF-A9-FF)
        Count: 1
< ACL Data TX: Handle 3060 flags 0x00 dlen 21               #68 [hci1] 3.890699
      SMP: Pairing Random (0x04) len 16
        Random value: 8e6108f966a694cbe26df70bb96773e6
> HCI Event: Number of Completed Packets (0x13) plen 5      #69 [hci1] 3.927052
        Num handles: 1
        Handle: 3060 Address: DF:A9:FF:F6:B1:1A (OUI DF-A9-FF)
        Count: 1
        #68: len 21 (4 Kb/s)
        Latency: 36 msec (36-186 msec ~62 msec)
> ACL Data RX: Handle 3060 flags 0x02 dlen 21               #70 [hci1] 4.177332
      SMP: Pairing Random (0x04) len 16
        Random value: 8bce5c1bb8a74d3e46763a2ddb7fc700
< HCI Command: Host Number of Compl.. (0x03|0x0035) plen 5  #71 [hci1] 4.190775
        Num handles: 1
        Handle: 3060 Address: DF:A9:FF:F6:B1:1A (OUI DF-A9-FF)
        Count: 1
< ACL Data TX: Handle 3060 flags 0x00 dlen 21               #72 [hci1] 4.190827
      SMP: Pairing Confirm (0x03) len 16
        Confim value: 53e7f035101ff6c702847d93bab93717
> HCI Event: Number of Completed Packets (0x13) plen 5      #73 [hci1] 4.227161
        Num handles: 1
        Handle: 3060 Address: DF:A9:FF:F6:B1:1A (OUI DF-A9-FF)
        Count: 1
        #72: len 21 (4 Kb/s)
        Latency: 36 msec (36-186 msec ~49 msec)
> ACL Data RX: Handle 3060 flags 0x02 dlen 21               #74 [hci1] 4.277267
      SMP: Pairing Confirm (0x03) len 16
        Confim value: 87dc9ebc78ae5b29cd74a6959809c233
< HCI Command: Host Number of Compl.. (0x03|0x0035) plen 5  #75 [hci1] 4.290821
        Num handles: 1
        Handle: 3060 Address: DF:A9:FF:F6:B1:1A (OUI DF-A9-FF)
        Count: 1
< ACL Data TX: Handle 3060 flags 0x00 dlen 21               #76 [hci1] 4.290872
      SMP: Pairing Random (0x04) len 16
        Random value: 4d02679f89a05211af56d8b3da64d21e
> HCI Event: Number of Completed Packets (0x13) plen 5      #77 [hci1] 4.327120
        Num handles: 1
        Handle: 3060 Address: DF:A9:FF:F6:B1:1A (OUI DF-A9-FF)
        Count: 1
        #76: len 21 (4 Kb/s)
        Latency: 36 msec (36-186 msec ~42 msec)
> ACL Data RX: Handle 3060 flags 0x02 dlen 21               #78 [hci1] 4.527304
      SMP: Pairing Random (0x04) len 16
        Random value: 62e336f9b7735407bf9df6c742f0a907
< HCI Command: Host Number of Compl.. (0x03|0x0035) plen 5  #79 [hci1] 4.530790
        Num handles: 1
        Handle: 3060 Address: DF:A9:FF:F6:B1:1A (OUI DF-A9-FF)
        Count: 1
< ACL Data TX: Handle 3060 flags 0x00 dlen 21               #80 [hci1] 4.530839
      SMP: Pairing Confirm (0x03) len 16
        Confim value: 854063f327b4faff9c09a152f27880c6
> HCI Event: Number of Completed Packets (0x13) plen 5      #81 [hci1] 4.577134
        Num handles: 1
        Handle: 3060 Address: DF:A9:FF:F6:B1:1A (OUI DF-A9-FF)
        Count: 1
        #80: len 21 (3 Kb/s)
        Latency: 46 msec (36-186 msec ~44 msec)
> ACL Data RX: Handle 3060 flags 0x02 dlen 21               #82 [hci1] 4.627340
      SMP: Pairing Confirm (0x03) len 16
        Confim value: 00006e08d9fe53c8fa9a573a4b9bfec8
< HCI Command: Host Number of Compl.. (0x03|0x0035) plen 5  #83 [hci1] 4.631007
        Num handles: 1
        Handle: 3060 Address: DF:A9:FF:F6:B1:1A (OUI DF-A9-FF)
        Count: 1
< ACL Data TX: Handle 3060 flags 0x00 dlen 21               #84 [hci1] 4.631218
      SMP: Pairing Random (0x04) len 16
        Random value: 5e8286bc235a02440d0c3424a2acf8fd
> HCI Event: Number of Completed Packets (0x13) plen 5      #85 [hci1] 4.677107
        Num handles: 1
        Handle: 3060 Address: DF:A9:FF:F6:B1:1A (OUI DF-A9-FF)
        Count: 1
        #84: len 21 (3 Kb/s)
        Latency: 45 msec (36-186 msec ~45 msec)
> ACL Data RX: Handle 3060 flags 0x02 dlen 21               #86 [hci1] 4.927337
      SMP: Pairing Random (0x04) len 16
        Random value: 66591f6d88bd0b8557d4880b7738c93f
< HCI Command: Host Number of Compl.. (0x03|0x0035) plen 5  #87 [hci1] 4.930696
        Num handles: 1
        Handle: 3060 Address: DF:A9:FF:F6:B1:1A (OUI DF-A9-FF)
        Count: 1
< ACL Data TX: Handle 3060 flags 0x00 dlen 21               #88 [hci1] 4.930745
      SMP: Pairing Confirm (0x03) len 16
        Confim value: 64c2b5f4a6235981b2dfa2ea06904461
> HCI Event: Number of Completed Packets (0x13) plen 5      #89 [hci1] 4.977123
        Num handles: 1
        Handle: 3060 Address: DF:A9:FF:F6:B1:1A (OUI DF-A9-FF)
        Count: 1
        #88: len 21 (3 Kb/s)
        Latency: 46 msec (36-186 msec ~45 msec)
> ACL Data RX: Handle 3060 flags 0x02 dlen 21               #90 [hci1] 5.027243
      SMP: Pairing Confirm (0x03) len 16
        Confim value: 398242905381bb1ac8e1184cf829cf09
< HCI Command: Host Number of Compl.. (0x03|0x0035) plen 5  #91 [hci1] 5.030773
        Num handles: 1
        Handle: 3060 Address: DF:A9:FF:F6:B1:1A (OUI DF-A9-FF)
        Count: 1
< ACL Data TX: Handle 3060 flags 0x00 dlen 21               #92 [hci1] 5.030822
      SMP: Pairing Random (0x04) len 16
        Random value: 5c4a1bcadd27bd58e945097b00bad7ac
> HCI Event: Number of Completed Packets (0x13) plen 5      #93 [hci1] 5.077101
        Num handles: 1
        Handle: 3060 Address: DF:A9:FF:F6:B1:1A (OUI DF-A9-FF)
        Count: 1
        #92: len 21 (3 Kb/s)
        Latency: 46 msec (36-186 msec ~46 msec)
> ACL Data RX: Handle 3060 flags 0x02 dlen 21               #94 [hci1] 5.327311
      SMP: Pairing Random (0x04) len 16
        Random value: 6441be3feb4887b1ba8d732115761c01
< HCI Command: Host Number of Compl.. (0x03|0x0035) plen 5  #95 [hci1] 5.331215
        Num handles: 1
        Handle: 3060 Address: DF:A9:FF:F6:B1:1A (OUI DF-A9-FF)
        Count: 1
< ACL Data TX: Handle 3060 flags 0x00 dlen 21               #96 [hci1] 5.331392
      SMP: Pairing Confirm (0x03) len 16
        Confim value: f83433e20fe66c23aa793c57d8edd65b
> HCI Event: Number of Completed Packets (0x13) plen 5      #97 [hci1] 5.377152
        Num handles: 1
        Handle: 3060 Address: DF:A9:FF:F6:B1:1A (OUI DF-A9-FF)
        Count: 1
        #96: len 21 (3 Kb/s)
        Latency: 45 msec (36-186 msec ~45 msec)
> ACL Data RX: Handle 3060 flags 0x02 dlen 21               #98 [hci1] 5.427359
      SMP: Pairing Confirm (0x03) len 16
        Confim value: 924f6b715286573ab4c6425ae4c82e48
< HCI Command: Host Number of Compl.. (0x03|0x0035) plen 5  #99 [hci1] 5.430730
        Num handles: 1
        Handle: 3060 Address: DF:A9:FF:F6:B1:1A (OUI DF-A9-FF)
        Count: 1
< ACL Data TX: Handle 3060 flags 0x00 dlen 21              #100 [hci1] 5.430777
      SMP: Pairing Random (0x04) len 16
        Random value: 32527e6e64e79f33b2e374394db8ab2d
> HCI Event: Number of Completed Packets (0x13) plen 5     #101 [hci1] 5.477062
        Num handles: 1
        Handle: 3060 Address: DF:A9:FF:F6:B1:1A (OUI DF-A9-FF)
        Count: 1
        #100: len 21 (3 Kb/s)
        Latency: 46 msec (36-186 msec ~46 msec)
> ACL Data RX: Handle 3060 flags 0x02 dlen 21              #102 [hci1] 5.727231
      SMP: Pairing Random (0x04) len 16
        Random value: 68edf678db131dc4d6797e71fb0dd7e5
< HCI Command: Host Number of Comp.. (0x03|0x0035) plen 5  #103 [hci1] 5.731157
        Num handles: 1
        Handle: 3060 Address: DF:A9:FF:F6:B1:1A (OUI DF-A9-FF)
        Count: 1
< ACL Data TX: Handle 3060 flags 0x00 dlen 21              #104 [hci1] 5.731248
      SMP: Pairing Confirm (0x03) len 16
        Confim value: 358219d92f5c05f8c6f1f1ab7aab66a4
> HCI Event: Number of Completed Packets (0x13) plen 5     #105 [hci1] 5.777161
        Num handles: 1
        Handle: 3060 Address: DF:A9:FF:F6:B1:1A (OUI DF-A9-FF)
        Count: 1
        #104: len 21 (3 Kb/s)
        Latency: 45 msec (36-186 msec ~46 msec)
> ACL Data RX: Handle 3060 flags 0x02 dlen 21              #106 [hci1] 5.827198
      SMP: Pairing Confirm (0x03) len 16
        Confim value: 0a8d2d1f8f602e6f0ce50cb14a2fae10
< HCI Command: Host Number of Comp.. (0x03|0x0035) plen 5  #107 [hci1] 5.831015
        Num handles: 1
        Handle: 3060 Address: DF:A9:FF:F6:B1:1A (OUI DF-A9-FF)
        Count: 1
< ACL Data TX: Handle 3060 flags 0x00 dlen 21              #108 [hci1] 5.831170
      SMP: Pairing Random (0x04) len 16
        Random value: dddbdfe2838e9a8cc6964353c850fef7
> HCI Event: Number of Completed Packets (0x13) plen 5     #109 [hci1] 5.877023
        Num handles: 1
        Handle: 3060 Address: DF:A9:FF:F6:B1:1A (OUI DF-A9-FF)
        Count: 1
        #108: len 21 (3 Kb/s)
        Latency: 45 msec (36-186 msec ~45 msec)
> ACL Data RX: Handle 3060 flags 0x02 dlen 21              #110 [hci1] 6.127211
      SMP: Pairing Random (0x04) len 16
        Random value: c0ecec6295616337d688aca6449d6fc6
< HCI Command: Host Number of Comp.. (0x03|0x0035) plen 5  #111 [hci1] 6.131052
        Num handles: 1
        Handle: 3060 Address: DF:A9:FF:F6:B1:1A (OUI DF-A9-FF)
        Count: 1
< ACL Data TX: Handle 3060 flags 0x00 dlen 21              #112 [hci1] 6.131251
      SMP: Pairing Confirm (0x03) len 16
        Confim value: b6d830e4e586464f2b9f97f597910036
> HCI Event: Number of Completed Packets (0x13) plen 5     #113 [hci1] 6.177160
        Num handles: 1
        Handle: 3060 Address: DF:A9:FF:F6:B1:1A (OUI DF-A9-FF)
        Count: 1
        #112: len 21 (3 Kb/s)
        Latency: 45 msec (36-186 msec ~45 msec)
> ACL Data RX: Handle 3060 flags 0x02 dlen 21              #114 [hci1] 6.227280
      SMP: Pairing Confirm (0x03) len 16
        Confim value: 2919dbd31790220b75260adef7ebe333
< HCI Command: Host Number of Comp.. (0x03|0x0035) plen 5  #115 [hci1] 6.231061
        Num handles: 1
        Handle: 3060 Address: DF:A9:FF:F6:B1:1A (OUI DF-A9-FF)
        Count: 1
< ACL Data TX: Handle 3060 flags 0x00 dlen 21              #116 [hci1] 6.231167
      SMP: Pairing Random (0x04) len 16
        Random value: eb9f1915536596b6fc3db1c86b2b1970
> HCI Event: Number of Completed Packets (0x13) plen 5     #117 [hci1] 6.277179
        Num handles: 1
        Handle: 3060 Address: DF:A9:FF:F6:B1:1A (OUI DF-A9-FF)
        Count: 1
        #116: len 21 (3 Kb/s)
        Latency: 46 msec (36-186 msec ~45 msec)
> ACL Data RX: Handle 3060 flags 0x02 dlen 21              #118 [hci1] 6.527223
      SMP: Pairing Random (0x04) len 16
        Random value: f911078597b12ec429ec44a74f0898ba
< HCI Command: Host Number of Comp.. (0x03|0x0035) plen 5  #119 [hci1] 6.530839
        Num handles: 1
        Handle: 3060 Address: DF:A9:FF:F6:B1:1A (OUI DF-A9-FF)
        Count: 1
< ACL Data TX: Handle 3060 flags 0x00 dlen 21              #120 [hci1] 6.530886
      SMP: Pairing Confirm (0x03) len 16
        Confim value: 3ec9a3b280cabc3e4046470c7bf93027
> HCI Event: Number of Completed Packets (0x13) plen 5     #121 [hci1] 6.577089
        Num handles: 1
        Handle: 3060 Address: DF:A9:FF:F6:B1:1A (OUI DF-A9-FF)
        Count: 1
        #120: len 21 (3 Kb/s)
        Latency: 46 msec (36-186 msec ~46 msec)
> ACL Data RX: Handle 3060 flags 0x02 dlen 21              #122 [hci1] 6.627347
      SMP: Pairing Confirm (0x03) len 16
        Confim value: 6baab40937f50336f8f57a1bbfa6e9a1
< HCI Command: Host Number of Comp.. (0x03|0x0035) plen 5  #123 [hci1] 6.630554
        Num handles: 1
        Handle: 3060 Address: DF:A9:FF:F6:B1:1A (OUI DF-A9-FF)
        Count: 1
< ACL Data TX: Handle 3060 flags 0x00 dlen 21              #124 [hci1] 6.630621
      SMP: Pairing Random (0x04) len 16
        Random value: 5c794dc9ad9f2c3f295ebd5ad5e1c3cf
> HCI Event: Number of Completed Packets (0x13) plen 5     #125 [hci1] 6.677074
        Num handles: 1
        Handle: 3060 Address: DF:A9:FF:F6:B1:1A (OUI DF-A9-FF)
        Count: 1
        #124: len 21 (3 Kb/s)
        Latency: 46 msec (36-186 msec ~46 msec)
> ACL Data RX: Handle 3060 flags 0x02 dlen 21              #126 [hci1] 6.927274
      SMP: Pairing Random (0x04) len 16
        Random value: e06be9ab9ec592637b15ca9fb86e491d
< HCI Command: Host Number of Comp.. (0x03|0x0035) plen 5  #127 [hci1] 6.931159
        Num handles: 1
        Handle: 3060 Address: DF:A9:FF:F6:B1:1A (OUI DF-A9-FF)
        Count: 1
< ACL Data TX: Handle 3060 flags 0x00 dlen 21              #128 [hci1] 6.931216
      SMP: Pairing Confirm (0x03) len 16
        Confim value: 9b5e8b26eaaef361195f605139100895
> HCI Event: Number of Completed Packets (0x13) plen 5     #129 [hci1] 6.977072
        Num handles: 1
        Handle: 3060 Address: DF:A9:FF:F6:B1:1A (OUI DF-A9-FF)
        Count: 1
        #128: len 21 (3 Kb/s)
        Latency: 45 msec (36-186 msec ~46 msec)
> ACL Data RX: Handle 3060 flags 0x02 dlen 21              #130 [hci1] 7.027331
      SMP: Pairing Confirm (0x03) len 16
        Confim value: 78d56b707dc9adc211a5e3b53d81f965
< HCI Command: Host Number of Comp.. (0x03|0x0035) plen 5  #131 [hci1] 7.030697
        Num handles: 1
        Handle: 3060 Address: DF:A9:FF:F6:B1:1A (OUI DF-A9-FF)
        Count: 1
< ACL Data TX: Handle 3060 flags 0x00 dlen 21              #132 [hci1] 7.030782
      SMP: Pairing Random (0x04) len 16
        Random value: 5c2fff312cdf99c9491988e877355a9a
> HCI Event: Number of Completed Packets (0x13) plen 5     #133 [hci1] 7.077157
        Num handles: 1
        Handle: 3060 Address: DF:A9:FF:F6:B1:1A (OUI DF-A9-FF)
        Count: 1
        #132: len 21 (3 Kb/s)
        Latency: 46 msec (36-186 msec ~46 msec)
> ACL Data RX: Handle 3060 flags 0x02 dlen 21              #134 [hci1] 7.327289
      SMP: Pairing Random (0x04) len 16
        Random value: 814d7adca69de44dbab503f55b30b586
< HCI Command: Host Number of Comp.. (0x03|0x0035) plen 5  #135 [hci1] 7.331126
        Num handles: 1
        Handle: 3060 Address: DF:A9:FF:F6:B1:1A (OUI DF-A9-FF)
        Count: 1
< ACL Data TX: Handle 3060 flags 0x00 dlen 21              #136 [hci1] 7.331211
      SMP: Pairing Confirm (0x03) len 16
        Confim value: d5f23f533d7b6dedefa4636fa2e8ad71
> HCI Event: Number of Completed Packets (0x13) plen 5     #137 [hci1] 7.377044
        Num handles: 1
        Handle: 3060 Address: DF:A9:FF:F6:B1:1A (OUI DF-A9-FF)
        Count: 1
        #136: len 21 (3 Kb/s)
        Latency: 45 msec (36-186 msec ~46 msec)
> ACL Data RX: Handle 3060 flags 0x02 dlen 21              #138 [hci1] 7.427422
      SMP: Pairing Confirm (0x03) len 16
        Confim value: f302e7bab046be3d8d0240d92bdded00
< HCI Command: Host Number of Comp.. (0x03|0x0035) plen 5  #139 [hci1] 7.431004
        Num handles: 1
        Handle: 3060 Address: DF:A9:FF:F6:B1:1A (OUI DF-A9-FF)
        Count: 1
< ACL Data TX: Handle 3060 flags 0x00 dlen 21              #140 [hci1] 7.431079
      SMP: Pairing Random (0x04) len 16
        Random value: c629a3a987d808e808655d558dfc1155
> HCI Event: Number of Completed Packets (0x13) plen 5     #141 [hci1] 7.477018
        Num handles: 1
        Handle: 3060 Address: DF:A9:FF:F6:B1:1A (OUI DF-A9-FF)
        Count: 1
        #140: len 21 (3 Kb/s)
        Latency: 45 msec (36-186 msec ~45 msec)
> ACL Data RX: Handle 3060 flags 0x02 dlen 21              #142 [hci1] 7.727297
      SMP: Pairing Random (0x04) len 16
        Random value: 2a46dd62ec7cb9fb11bdf45357ef52cf
< HCI Command: Host Number of Comp.. (0x03|0x0035) plen 5  #143 [hci1] 7.731115
        Num handles: 1
        Handle: 3060 Address: DF:A9:FF:F6:B1:1A (OUI DF-A9-FF)
        Count: 1
< ACL Data TX: Handle 3060 flags 0x00 dlen 21              #144 [hci1] 7.731284
      SMP: Pairing Confirm (0x03) len 16
        Confim value: 3194020bcc45f8fedf3d495e85f62ea2
> HCI Event: Number of Completed Packets (0x13) plen 5     #145 [hci1] 7.776994
        Num handles: 1
        Handle: 3060 Address: DF:A9:FF:F6:B1:1A (OUI DF-A9-FF)
        Count: 1
        #144: len 21 (3 Kb/s)
        Latency: 45 msec (36-186 msec ~45 msec)
> ACL Data RX: Handle 3060 flags 0x02 dlen 21              #146 [hci1] 7.827225
      SMP: Pairing Confirm (0x03) len 16
        Confim value: bb56d4e2aebbbb19e896345db3168a99
< HCI Command: Host Number of Comp.. (0x03|0x0035) plen 5  #147 [hci1] 7.831091
        Num handles: 1
        Handle: 3060 Address: DF:A9:FF:F6:B1:1A (OUI DF-A9-FF)
        Count: 1
< ACL Data TX: Handle 3060 flags 0x00 dlen 21              #148 [hci1] 7.831171
      SMP: Pairing Random (0x04) len 16
        Random value: 92f20f6ad8f13724432c7fd6001c45ff
> HCI Event: Number of Completed Packets (0x13) plen 5     #149 [hci1] 7.877037
        Num handles: 1
        Handle: 3060 Address: DF:A9:FF:F6:B1:1A (OUI DF-A9-FF)
        Count: 1
        #148: len 21 (3 Kb/s)
        Latency: 45 msec (36-186 msec ~45 msec)
> ACL Data RX: Handle 3060 flags 0x02 dlen 21              #150 [hci1] 8.127260
      SMP: Pairing Random (0x04) len 16
        Random value: 682978c5eee1e727ef5de3a3088dd511
< HCI Command: Host Number of Comp.. (0x03|0x0035) plen 5  #151 [hci1] 8.131156
        Num handles: 1
        Handle: 3060 Address: DF:A9:FF:F6:B1:1A (OUI DF-A9-FF)
        Count: 1
< ACL Data TX: Handle 3060 flags 0x00 dlen 21              #152 [hci1] 8.131263
      SMP: Pairing Confirm (0x03) len 16
        Confim value: d041842871efce8f004280d5ca47e393
> HCI Event: Number of Completed Packets (0x13) plen 5     #153 [hci1] 8.177029
        Num handles: 1
        Handle: 3060 Address: DF:A9:FF:F6:B1:1A (OUI DF-A9-FF)
        Count: 1
        #152: len 21 (3 Kb/s)
        Latency: 45 msec (36-186 msec ~45 msec)
> ACL Data RX: Handle 3060 flags 0x02 dlen 21              #154 [hci1] 8.227224
      SMP: Pairing Confirm (0x03) len 16
        Confim value: 348d12f47b4fc3052f37cfb72bdbbed6
< HCI Command: Host Number of Comp.. (0x03|0x0035) plen 5  #155 [hci1] 8.230954
        Num handles: 1
        Handle: 3060 Address: DF:A9:FF:F6:B1:1A (OUI DF-A9-FF)
        Count: 1
< ACL Data TX: Handle 3060 flags 0x00 dlen 21              #156 [hci1] 8.231070
      SMP: Pairing Random (0x04) len 16
        Random value: 23ac32ebbb5e14c8a6b9622f296d277f
> HCI Event: Number of Completed Packets (0x13) plen 5     #157 [hci1] 8.276970
        Num handles: 1
        Handle: 3060 Address: DF:A9:FF:F6:B1:1A (OUI DF-A9-FF)
        Count: 1
        #156: len 21 (3 Kb/s)
        Latency: 45 msec (36-186 msec ~45 msec)
> ACL Data RX: Handle 3060 flags 0x02 dlen 21              #158 [hci1] 8.527205
      SMP: Pairing Random (0x04) len 16
        Random value: 0806f0cf698f83c80007530c0a2a33a5
< HCI Command: Host Number of Comp.. (0x03|0x0035) plen 5  #159 [hci1] 8.530804
        Num handles: 1
        Handle: 3060 Address: DF:A9:FF:F6:B1:1A (OUI DF-A9-FF)
        Count: 1
< ACL Data TX: Handle 3060 flags 0x00 dlen 21              #160 [hci1] 8.530855
      SMP: Pairing Confirm (0x03) len 16
        Confim value: 69700af7354817fe8df373de464ccc91
> HCI Event: Number of Completed Packets (0x13) plen 5     #161 [hci1] 8.577087
        Num handles: 1
        Handle: 3060 Address: DF:A9:FF:F6:B1:1A (OUI DF-A9-FF)
        Count: 1
        #160: len 21 (3 Kb/s)
        Latency: 46 msec (36-186 msec ~46 msec)
> ACL Data RX: Handle 3060 flags 0x02 dlen 21              #162 [hci1] 8.627175
      SMP: Pairing Confirm (0x03) len 16
        Confim value: dfce7353c5b96a5ff5393d19b316a811
< HCI Command: Host Number of Comp.. (0x03|0x0035) plen 5  #163 [hci1] 8.631041
        Num handles: 1
        Handle: 3060 Address: DF:A9:FF:F6:B1:1A (OUI DF-A9-FF)
        Count: 1
< ACL Data TX: Handle 3060 flags 0x00 dlen 21              #164 [hci1] 8.631192
      SMP: Pairing Random (0x04) len 16
        Random value: 297efe85e67448a15f56bd27e3a3cf1d
> HCI Event: Number of Completed Packets (0x13) plen 5     #165 [hci1] 8.677058
        Num handles: 1
        Handle: 3060 Address: DF:A9:FF:F6:B1:1A (OUI DF-A9-FF)
        Count: 1
        #164: len 21 (3 Kb/s)
        Latency: 45 msec (36-186 msec ~45 msec)
> ACL Data RX: Handle 3060 flags 0x02 dlen 21              #166 [hci1] 8.927186
      SMP: Pairing Random (0x04) len 16
        Random value: 162e29885985e019326b0bf83c28a123
< HCI Command: Host Number of Comp.. (0x03|0x0035) plen 5  #167 [hci1] 8.931147
        Num handles: 1
        Handle: 3060 Address: DF:A9:FF:F6:B1:1A (OUI DF-A9-FF)
        Count: 1
< ACL Data TX: Handle 3060 flags 0x00 dlen 21              #168 [hci1] 8.931272
      SMP: Pairing Confirm (0x03) len 16
        Confim value: 868858fd18b30c8f6bd842991f61e01b
> HCI Event: Number of Completed Packets (0x13) plen 5     #169 [hci1] 8.977013
        Num handles: 1
        Handle: 3060 Address: DF:A9:FF:F6:B1:1A (OUI DF-A9-FF)
        Count: 1
        #168: len 21 (3 Kb/s)
        Latency: 45 msec (36-186 msec ~45 msec)
> ACL Data RX: Handle 3060 flags 0x02 dlen 21              #170 [hci1] 9.027165
      SMP: Pairing Confirm (0x03) len 16
        Confim value: 209dbc4b57ac7f1cd030499bcbaba718
< HCI Command: Host Number of Comp.. (0x03|0x0035) plen 5  #171 [hci1] 9.030867
        Num handles: 1
        Handle: 3060 Address: DF:A9:FF:F6:B1:1A (OUI DF-A9-FF)
        Count: 1
< ACL Data TX: Handle 3060 flags 0x00 dlen 21              #172 [hci1] 9.030934
      SMP: Pairing Random (0x04) len 16
        Random value: 25a9493fd3ce4faf02be7293595bb7c6
> HCI Event: Number of Completed Packets (0x13) plen 5     #173 [hci1] 9.076999
        Num handles: 1
        Handle: 3060 Address: DF:A9:FF:F6:B1:1A (OUI DF-A9-FF)
        Count: 1
        #172: len 21 (3 Kb/s)
        Latency: 46 msec (36-186 msec ~45 msec)
> ACL Data RX: Handle 3060 flags 0x02 dlen 21              #174 [hci1] 9.327256
      SMP: Pairing Random (0x04) len 16
        Random value: e1324839fb059592b17b0f10ba279464
< HCI Command: Host Number of Comp.. (0x03|0x0035) plen 5  #175 [hci1] 9.331005
        Num handles: 1
        Handle: 3060 Address: DF:A9:FF:F6:B1:1A (OUI DF-A9-FF)
        Count: 1
< ACL Data TX: Handle 3060 flags 0x00 dlen 21              #176 [hci1] 9.331079
      SMP: Pairing Confirm (0x03) len 16
        Confim value: f83eefc265f15e88ac78f2a099b325d8
> HCI Event: Number of Completed Packets (0x13) plen 5     #177 [hci1] 9.377104
        Num handles: 1
        Handle: 3060 Address: DF:A9:FF:F6:B1:1A (OUI DF-A9-FF)
        Count: 1
        #176: len 21 (3 Kb/s)
        Latency: 46 msec (36-186 msec ~45 msec)
> ACL Data RX: Handle 3060 flags 0x02 dlen 21              #178 [hci1] 9.427220
      SMP: Pairing Confirm (0x03) len 16
        Confim value: ad6d03bec58f279186205b60757bc7f2
< HCI Command: Host Number of Comp.. (0x03|0x0035) plen 5  #179 [hci1] 9.430979
        Num handles: 1
        Handle: 3060 Address: DF:A9:FF:F6:B1:1A (OUI DF-A9-FF)
        Count: 1
< ACL Data TX: Handle 3060 flags 0x00 dlen 21              #180 [hci1] 9.431079
      SMP: Pairing Random (0x04) len 16
        Random value: 58f6b41f855a6f6c3560debd84e2affc
> HCI Event: Number of Completed Packets (0x13) plen 5     #181 [hci1] 9.477144
        Num handles: 1
        Handle: 3060 Address: DF:A9:FF:F6:B1:1A (OUI DF-A9-FF)
        Count: 1
        #180: len 21 (3 Kb/s)
        Latency: 46 msec (36-186 msec ~46 msec)
> ACL Data RX: Handle 3060 flags 0x02 dlen 21              #182 [hci1] 9.727129
      SMP: Pairing Random (0x04) len 16
        Random value: f4e3b46cce8f77ecea67a43de008c183
< HCI Command: Host Number of Comp.. (0x03|0x0035) plen 5  #183 [hci1] 9.731135
        Num handles: 1
        Handle: 3060 Address: DF:A9:FF:F6:B1:1A (OUI DF-A9-FF)
        Count: 1
< ACL Data TX: Handle 3060 flags 0x00 dlen 21              #184 [hci1] 9.731251
      SMP: Pairing Confirm (0x03) len 16
        Confim value: 02e6603c81cab9b21664ae76cd25e94a
> HCI Event: Number of Completed Packets (0x13) plen 5     #185 [hci1] 9.777061
        Num handles: 1
        Handle: 3060 Address: DF:A9:FF:F6:B1:1A (OUI DF-A9-FF)
        Count: 1
        #184: len 21 (3 Kb/s)
        Latency: 45 msec (36-186 msec ~45 msec)
> ACL Data RX: Handle 3060 flags 0x02 dlen 21              #186 [hci1] 9.827150
      SMP: Pairing Confirm (0x03) len 16
        Confim value: 741b20c64902effb6284f65b2818f7fe
< HCI Command: Host Number of Comp.. (0x03|0x0035) plen 5  #187 [hci1] 9.830688
        Num handles: 1
        Handle: 3060 Address: DF:A9:FF:F6:B1:1A (OUI DF-A9-FF)
        Count: 1
< ACL Data TX: Handle 3060 flags 0x00 dlen 21              #188 [hci1] 9.830734
      SMP: Pairing Random (0x04) len 16
        Random value: b67e7216d5bf664139eda2b542549666
> HCI Event: Number of Completed Packets (0x13) plen 5     #189 [hci1] 9.876963
        Num handles: 1
        Handle: 3060 Address: DF:A9:FF:F6:B1:1A (OUI DF-A9-FF)
        Count: 1
        #188: len 21 (3 Kb/s)
        Latency: 46 msec (36-186 msec ~46 msec)
> ACL Data RX: Handle 3060 flags 0x02 dlen 21             #190 [hci1] 10.127206
      SMP: Pairing Random (0x04) len 16
        Random value: 1c5210ea8ce69a218aa14fa94ded1cd7
< HCI Command: Host Number of Com.. (0x03|0x0035) plen 5  #191 [hci1] 10.130895
        Num handles: 1
        Handle: 3060 Address: DF:A9:FF:F6:B1:1A (OUI DF-A9-FF)
        Count: 1
< ACL Data TX: Handle 3060 flags 0x00 dlen 21             #192 [hci1] 10.130938
      SMP: Pairing Confirm (0x03) len 16
        Confim value: cc322a54a4bee034c29ea55b8814c809
> HCI Event: Number of Completed Packets (0x13) plen 5    #193 [hci1] 10.177054
        Num handles: 1
        Handle: 3060 Address: DF:A9:FF:F6:B1:1A (OUI DF-A9-FF)
        Count: 1
        #192: len 21 (3 Kb/s)
        Latency: 46 msec (36-186 msec ~46 msec)
> ACL Data RX: Handle 3060 flags 0x02 dlen 21             #194 [hci1] 10.227155
      SMP: Pairing Confirm (0x03) len 16
        Confim value: 5d4e27f072193f95cb02ec1518098f99
< HCI Command: Host Number of Com.. (0x03|0x0035) plen 5  #195 [hci1] 10.230707
        Num handles: 1
        Handle: 3060 Address: DF:A9:FF:F6:B1:1A (OUI DF-A9-FF)
        Count: 1
< ACL Data TX: Handle 3060 flags 0x00 dlen 21             #196 [hci1] 10.230746
      SMP: Pairing Random (0x04) len 16
        Random value: ed17f76500c95219dd01e09d1e63f87b
> HCI Event: Number of Completed Packets (0x13) plen 5    #197 [hci1] 10.276983
        Num handles: 1
        Handle: 3060 Address: DF:A9:FF:F6:B1:1A (OUI DF-A9-FF)
        Count: 1
        #196: len 21 (3 Kb/s)
        Latency: 46 msec (36-186 msec ~46 msec)
> ACL Data RX: Handle 3060 flags 0x02 dlen 21             #198 [hci1] 10.527257
      SMP: Pairing Random (0x04) len 16
        Random value: 68d041ba340953687edad5bbdd35dcfa
< HCI Command: Host Number of Com.. (0x03|0x0035) plen 5  #199 [hci1] 10.531215
        Num handles: 1
        Handle: 3060 Address: DF:A9:FF:F6:B1:1A (OUI DF-A9-FF)
        Count: 1
< ACL Data TX: Handle 3060 flags 0x00 dlen 21             #200 [hci1] 10.531336
      SMP: Pairing Confirm (0x03) len 16
        Confim value: aed261980fcd36253b6c393412444a0b
> HCI Event: Number of Completed Packets (0x13) plen 5    #201 [hci1] 10.577063
        Num handles: 1
        Handle: 3060 Address: DF:A9:FF:F6:B1:1A (OUI DF-A9-FF)
        Count: 1
        #200: len 21 (3 Kb/s)
        Latency: 45 msec (36-186 msec ~45 msec)
> ACL Data RX: Handle 3060 flags 0x02 dlen 21             #202 [hci1] 10.627101
      SMP: Pairing Confirm (0x03) len 16
        Confim value: f1c0ab598a3fd34f9c8dee96546e44d8
< HCI Command: Host Number of Com.. (0x03|0x0035) plen 5  #203 [hci1] 10.630685
        Num handles: 1
        Handle: 3060 Address: DF:A9:FF:F6:B1:1A (OUI DF-A9-FF)
        Count: 1
< ACL Data TX: Handle 3060 flags 0x00 dlen 21             #204 [hci1] 10.630728
      SMP: Pairing Random (0x04) len 16
        Random value: 81d35d47e1f6006d79c974bd9d9e1ee3
> HCI Event: Number of Completed Packets (0x13) plen 5    #205 [hci1] 10.676921
        Num handles: 1
        Handle: 3060 Address: DF:A9:FF:F6:B1:1A (OUI DF-A9-FF)
        Count: 1
        #204: len 21 (3 Kb/s)
        Latency: 46 msec (36-186 msec ~46 msec)
> ACL Data RX: Handle 3060 flags 0x02 dlen 21             #206 [hci1] 10.927115
      SMP: Pairing Random (0x04) len 16
        Random value: 23ef6e28033a383cf4023b1cad8474c5
< HCI Command: Host Number of Com.. (0x03|0x0035) plen 5  #207 [hci1] 10.931180
        Num handles: 1
        Handle: 3060 Address: DF:A9:FF:F6:B1:1A (OUI DF-A9-FF)
        Count: 1
< ACL Data TX: Handle 3060 flags 0x00 dlen 21             #208 [hci1] 10.931305
      SMP: Pairing Confirm (0x03) len 16
        Confim value: a9c13b2c50218e75f75f366b45e25bbf
> HCI Event: Number of Completed Packets (0x13) plen 5    #209 [hci1] 10.977040
        Num handles: 1
        Handle: 3060 Address: DF:A9:FF:F6:B1:1A (OUI DF-A9-FF)
        Count: 1
        #208: len 21 (3 Kb/s)
        Latency: 45 msec (36-186 msec ~45 msec)
> ACL Data RX: Handle 3060 flags 0x02 dlen 21             #210 [hci1] 11.027144
      SMP: Pairing Confirm (0x03) len 16
        Confim value: 4dafaad3768ff89f59f4beaf75f63fff
< HCI Command: Host Number of Com.. (0x03|0x0035) plen 5  #211 [hci1] 11.031059
        Num handles: 1
        Handle: 3060 Address: DF:A9:FF:F6:B1:1A (OUI DF-A9-FF)
        Count: 1
< ACL Data TX: Handle 3060 flags 0x00 dlen 21             #212 [hci1] 11.031232
      SMP: Pairing Random (0x04) len 16
        Random value: e7f7e0c2476823e41736a7e381bafb7c
> HCI Event: Number of Completed Packets (0x13) plen 5    #213 [hci1] 11.077036
        Num handles: 1
        Handle: 3060 Address: DF:A9:FF:F6:B1:1A (OUI DF-A9-FF)
        Count: 1
        #212: len 21 (3 Kb/s)
        Latency: 45 msec (36-186 msec ~45 msec)
> ACL Data RX: Handle 3060 flags 0x02 dlen 21             #214 [hci1] 11.327287
      SMP: Pairing Random (0x04) len 16
        Random value: db7efabb75fa1d55584bc7b719b89a50
< HCI Command: Host Number of Com.. (0x03|0x0035) plen 5  #215 [hci1] 11.331194
        Num handles: 1
        Handle: 3060 Address: DF:A9:FF:F6:B1:1A (OUI DF-A9-FF)
        Count: 1
< ACL Data TX: Handle 3060 flags 0x00 dlen 21             #216 [hci1] 11.331317
      SMP: Pairing Confirm (0x03) len 16
        Confim value: 6f338353b3e0eaa8ed2282d3137d9ba6
> HCI Event: Number of Completed Packets (0x13) plen 5    #217 [hci1] 11.377002
        Num handles: 1
        Handle: 3060 Address: DF:A9:FF:F6:B1:1A (OUI DF-A9-FF)
        Count: 1
        #216: len 21 (3 Kb/s)
        Latency: 45 msec (36-186 msec ~45 msec)
> ACL Data RX: Handle 3060 flags 0x02 dlen 21             #218 [hci1] 11.427248
      SMP: Pairing Confirm (0x03) len 16
        Confim value: 7ef9461f640854912b9052be674d7661
< HCI Command: Host Number of Com.. (0x03|0x0035) plen 5  #219 [hci1] 11.431041
        Num handles: 1
        Handle: 3060 Address: DF:A9:FF:F6:B1:1A (OUI DF-A9-FF)
        Count: 1
< ACL Data TX: Handle 3060 flags 0x00 dlen 21             #220 [hci1] 11.431170
      SMP: Pairing Random (0x04) len 16
        Random value: fc8b40d9b0b09bc4296bf8753a8f6e1f
> HCI Event: Number of Completed Packets (0x13) plen 5    #221 [hci1] 11.477104
        Num handles: 1
        Handle: 3060 Address: DF:A9:FF:F6:B1:1A (OUI DF-A9-FF)
        Count: 1
        #220: len 21 (3 Kb/s)
        Latency: 45 msec (36-186 msec ~45 msec)
> ACL Data RX: Handle 3060 flags 0x02 dlen 21             #222 [hci1] 11.727215
      SMP: Pairing Random (0x04) len 16
        Random value: 5d908a3c480a17ad5825fdb4c0f444f5
< HCI Command: Host Number of Com.. (0x03|0x0035) plen 5  #223 [hci1] 11.731038
        Num handles: 1
        Handle: 3060 Address: DF:A9:FF:F6:B1:1A (OUI DF-A9-FF)
        Count: 1
< ACL Data TX: Handle 3060 flags 0x00 dlen 21             #224 [hci1] 11.731133
      SMP: Pairing DHKey Check (0x0d) len 16
        E: 28ecf7858d279d30a33c8677ca99a653
> HCI Event: Number of Completed Packets (0x13) plen 5    #225 [hci1] 11.777002
        Num handles: 1
        Handle: 3060 Address: DF:A9:FF:F6:B1:1A (OUI DF-A9-FF)
        Count: 1
        #224: len 21 (3 Kb/s)
        Latency: 45 msec (36-186 msec ~45 msec)
> ACL Data RX: Handle 3060 flags 0x02 dlen 21             #226 [hci1] 11.827241
      SMP: Pairing DHKey Check (0x0d) len 16
        E: b98ba61cd6dd92b84e7710f75d6b3b02
< HCI Command: LE Start Encryption (0x08|0x0019) plen 28  #227 [hci1] 11.831298
        Handle: 3060 Address: DF:A9:FF:F6:B1:1A (OUI DF-A9-FF)
        Random number: 0x0000000000000000
        Encrypted diversifier: 0x0000
        Long term key: 1e7145148bf856502ee5934c8918fe16
> HCI Event: Command Status (0x0f) plen 4                 #228 [hci1] 11.832259
      LE Start Encryption (0x08|0x0019) ncmd 1
        Status: Success (0x00)
< HCI Command: Host Number of Com.. (0x03|0x0035) plen 5  #229 [hci1] 11.850809
        Num handles: 1
        Handle: 3060 Address: DF:A9:FF:F6:B1:1A (OUI DF-A9-FF)
        Count: 1
> HCI Event: Encryption Change (0x08) plen 4              #230 [hci1] 12.176805
        Status: Success (0x00)
        Handle: 3060 Address: DF:A9:FF:F6:B1:1A (OUI DF-A9-FF)
        Encryption: Enabled with AES-CCM (0x01)
< HCI Command: Disconnect (0x01|0x0006) plen 3            #231 [hci1] 12.861000
        Handle: 3060 Address: DF:A9:FF:F6:B1:1A (OUI DF-A9-FF)
        Reason: Remote User Terminated Connection (0x13)
> HCI Event: Command Status (0x0f) plen 4                 #232 [hci1] 12.861575
      Disconnect (0x01|0x0006) ncmd 1
        Status: Success (0x00)
> HCI Event: Disconnect Complete (0x05) plen 4            #233 [hci1] 12.926836
        Status: Success (0x00)
        Handle: 3060 Address: DF:A9:FF:F6:B1:1A (OUI DF-A9-FF)
        Reason: Connection Terminated By Local Host (0x16)
< HCI Command: Reset (0x03|0x0003) plen 0                 #234 [hci1] 18.840608
> HCI Event: Command Complete (0x0e) plen 4               #235 [hci1] 18.841204
      Reset (0x03|0x0003) ncmd 1
        Status: Success (0x00)
@ USER Close: main                                    {0x0001} [hci1] 18.850568
= Close Index: 00:00:00:00:00:00                               [hci1] 18.850575
