Bluetooth monitor ver 5.72
= Note: Linux version 6.14.0-36-generic (x86_64)                       0.035954
= Note: Bluetooth subsystem version 2.22                               0.035957
= New Index: 00:00:00:00:00:00 (Primary,UART,hci1)              [hci1] 0.035958
= New Index: 48:5F:99:8E:E0:64 (Primary,USB,hci0)               [hci0] 0.035958
= Open Index: 00:00:00:00:00:00                                 [hci1] 0.151342
= Index Info: 00:00:00:00:00:00 (Nordic Semiconductor ASA)      [hci1] 0.151362
@ USER Open: main (privileged) version 2.22            {0x0001} [hci1] 0.151371
< HCI Command: Reset (0x03|0x0003) plen 0                    #1 [hci1] 0.152674
> HCI Event: Command Complete (0x0e) plen 4                  #2 [hci1] 0.153255
      Reset (0x03|0x0003) ncmd 1
        Status: Success (0x00)
< HCI Command: Read Local Supported... (0x04|0x0003) plen 0  #3 [hci1] 0.171136
> HCI Event: Command Complete (0x0e) plen 12                 #4 [hci1] 0.171657
      Read Local Supported Features (0x04|0x0003) ncmd 1
        Status: Success (0x00)
        Features: 0x00 0x00 0x00 0x00 0x60 0x00 0x00 0x00
          BR/EDR Not Supported
          LE Supported (Controller)
< HCI Command: Read Local Version In.. (0x04|0x0001) plen 0  #5 [hci1] 0.190772
> HCI Event: Command Complete (0x0e) plen 12                 #6 [hci1] 0.191249
      Read Local Version Information (0x04|0x0001) ncmd 1
        Status: Success (0x00)
        HCI version: Reserved (0x0f) - Revision 12393 (0x3069)
        LMP version: Reserved (0x0f) - Subversion 12393 (0x3069)
        Manufacturer: Nordic Semiconductor ASA (89)
< HCI Command: Read Local Supported... (0x04|0x0002) plen 0  #7 [hci1] 0.210718
> HCI Event: Command Complete (0x0e) plen 68                 #8 [hci1] 0.211752
      Read Local Supported Commands (0x04|0x0002) ncmd 1
        Status: Success (0x00)
        Commands: 119 entries
          Disconnect (Octet 0 - Bit 5)
          Read Remote Version Information (Octet 2 - Bit 7)
          Set Event Mask (Octet 5 - Bit 6)
          Reset (Octet 5 - Bit 7)
          Read Connection Accept Timeout (Octet 7 - Bit 2)
          Write Connection Accept Timeout (Octet 7 - Bit 3)
          Read Transmit Power Level (Octet 10 - Bit 2)
          Set Controller To Host Flow Control (Octet 10 - Bit 5)
          Host Buffer Size (Octet 10 - Bit 6)
          Host Number of Completed Packets (Octet 10 - Bit 7)
          Read Local Version Information (Octet 14 - Bit 3)
          Read Local Supported Features (Octet 14 - Bit 5)
          Read BD ADDR (Octet 15 - Bit 1)
          Read RSSI (Octet 15 - Bit 5)
          Set Event Mask Page 2 (Octet 22 - Bit 2)
          LE Set Event Mask (Octet 25 - Bit 0)
          LE Read Buffer Size (Octet 25 - Bit 1)
          LE Read Local Supported Features (Octet 25 - Bit 2)
          LE Set Random Address (Octet 25 - Bit 4)
          LE Set Advertising Parameters (Octet 25 - Bit 5)
          LE Read Advertising Channel TX Power (Octet 25 - Bit 6)
          LE Set Advertising Data (Octet 25 - Bit 7)
          LE Set Scan Response Data (Octet 26 - Bit 0)
          LE Set Advertise Enable (Octet 26 - Bit 1)
          LE Set Scan Parameters (Octet 26 - Bit 2)
          LE Set Scan Enable (Octet 26 - Bit 3)
          LE Create Connection (Octet 26 - Bit 4)
          LE Create Connection Cancel (Octet 26 - Bit 5)
          LE Read Accept List Size (Octet 26 - Bit 6)
          LE Clear Accept List (Octet 26 - Bit 7)
          LE Add Device To Accept List (Octet 27 - Bit 0)
          LE Remove Device From Accept List (Octet 27 - Bit 1)
          LE Connection Update (Octet 27 - Bit 2)
          LE Set Host Channel Classification (Octet 27 - Bit 3)
          LE Read Channel Map (Octet 27 - Bit 4)
          LE Read Remote Used Features (Octet 27 - Bit 5)
          LE Encrypt (Octet 27 - Bit 6)
          LE Rand (Octet 27 - Bit 7)
          LE Start Encryption (Octet 28 - Bit 0)
          LE Long Term Key Request Reply (Octet 28 - Bit 1)
          LE Long Term Key Request Neg Reply (Octet 28 - Bit 2)
          LE Read Supported States (Octet 28 - Bit 3)
          LE Receiver Test (Octet 28 - Bit 4)
          LE Transmitter Test (Octet 28 - Bit 5)
          LE Test End (Octet 28 - Bit 6)
          Read Authenticated Payload Timeout (Octet 32 - Bit 4)
          Write Authenticated Payload Timeout (Octet 32 - Bit 5)
          LE Set Data Length (Octet 33 - Bit 6)
          LE Read Suggested Default Data Length (Octet 33 - Bit 7)
          LE Write Suggested Default Data Length (Octet 34 - Bit 0)
          LE Add Device To Resolving List (Octet 34 - Bit 3)
          LE Remove Device From Resolving List (Octet 34 - Bit 4)
          LE Clear Resolving List (Octet 34 - Bit 5)
          LE Read Resolving List Size (Octet 34 - Bit 6)
          LE Set Address Resolution Enable (Octet 35 - Bit 1)
          LE Set Resolvable Private Address Timeout (Octet 35 - Bit 2)
          LE Read Maximum Data Length (Octet 35 - Bit 3)
          LE Read PHY (Octet 35 - Bit 4)
          LE Set Default PHY (Octet 35 - Bit 5)
          LE Set PHY (Octet 35 - Bit 6)
          LE Enhanced Receiver Test (Octet 35 - Bit 7)
          LE Enhanced Transmitter Test (Octet 36 - Bit 0)
          LE Set Advertising Set Random Address (Octet 36 - Bit 1)
          LE Set Extended Advertising Parameters (Octet 36 - Bit 2)
          LE Set Extended Advertising Data (Octet 36 - Bit 3)
          LE Set Extended Scan Response Data (Octet 36 - Bit 4)
          LE Set Extended Advertising Enable (Octet 36 - Bit 5)
          LE Read Maximum Advertising Data Length (Octet 36 - Bit 6)
          LE Read Number of Supported Advertising Sets (Octet 36 - Bit 7)
          LE Remove Advertising Set (Octet 37 - Bit 0)
          LE Clear Advertising Sets (Octet 37 - Bit 1)
          LE Set Periodic Advertising Parameters (Octet 37 - Bit 2)
          LE Set Periodic Advertising Data (Octet 37 - Bit 3)
          LE Set Periodic Advertising Enable (Octet 37 - Bit 4)
          LE Set Extended Scan Parameters (Octet 37 - Bit 5)
          LE Set Extended Scan Enable (Octet 37 - Bit 6)
          LE Extended Create Connection (Octet 37 - Bit 7)
          LE Periodic Advertising Create Sync (Octet 38 - Bit 0)
          LE Periodic Advertising Create Sync Cancel (Octet 38 - Bit 1)
          LE Periodic Advertising Terminate Sync (Octet 38 - Bit 2)
          LE Add Device To Periodic Advertiser List (Octet 38 - Bit 3)
          LE Remove Device From Periodic Advertiser List (Octet 38 - Bit 4)
          LE Clear Periodic Advertiser List (Octet 38 - Bit 5)
          LE Read Periodic Advertiser List Size (Octet 38 - Bit 6)
          LE Read Transmit Power (Octet 38 - Bit 7)
          LE Read RF Path Compensation (Octet 39 - Bit 0)
          LE Write RF Path Compensation (Octet 39 - Bit 1)
          LE Set Privacy Mode (Octet 39 - Bit 2)
          LE Periodic Advertising Receive Enable (Octet 40 - Bit 5)
          LE Periodic Advertising Sync Transfer (Octet 40 - Bit 6)
          LE Periodic Advertising Set Info Transfer (Octet 40 - Bit 7)
          LE Periodic Advertising Sync Transfer Parameters (Octet 41 - Bit 0)
          LE Set Default Periodic Advertisng Sync Transfer Parameters (Octet 41 - Bit 1)
          LE Read Buffer v2 (Octet 41 - Bit 5)
          LE Read ISO TX Sync (Octet 41 - Bit 6)
          LE Set Connected Isochronous Group Parameters (Octet 41 - Bit 7)
          LE Set Connected Isochronous Group Parameters Test (Octet 42 - Bit 0)
          LE Create Connected Isochronous Stream (Octet 42 - Bit 1)
          LE Remove Connected Isochronous Group (Octet 42 - Bit 2)
          LE Accept Connected Isochronous Stream Request (Octet 42 - Bit 3)
          LE Reject Connected Isochronous Stream Request (Octet 42 - Bit 4)
          LE Create Broadcast Isochronous Group (Octet 42 - Bit 5)
          LE Create Broadcast Isochronous Group Test (Octet 42 - Bit 6)
          LE Terminate Broadcast Isochronous Group (Octet 42 - Bit 7)
          LE Broadcast Isochronous Group Create Sync (Octet 43 - Bit 0)
          LE Broadcast Isochronous Group Terminate Sync (Octet 43 - Bit 1)
          LE Request Peer SCA (Octet 43 - Bit 2)
          LE Setup Isochronous Data Path (Octet 43 - Bit 3)
          LE Remove Isochronous Data Path (Octet 43 - Bit 4)
          LE Isochronous Transmit Test (Octet 43 - Bit 5)
          LE Isochronous Receive Test (Octet 43 - Bit 6)
          LE Isochronous Read Test Counters (Octet 43 - Bit 7)
          LE Isochronous Read Test Counters (Octet 44 - Bit 0)
          LE Set Host Feature (Octet 44 - Bit 1)
          Octet 44 - Bit 2 
          Octet 45 - Bit 6 
          Octet 46 - Bit 0 
          Octet 46 - Bit 1 
          Octet 46 - Bit 2 
< HCI Command: Host Buffer Size (0x03|0x0033) plen 7         #9 [hci1] 0.230657
        ACL MTU: 255  ACL max packet: 16
        SCO MTU: 0    SCO max packet: 0
> HCI Event: Command Complete (0x0e) plen 4                 #10 [hci1] 0.231224
      Host Buffer Size (0x03|0x0033) ncmd 1
        Status: Success (0x00)
< HCI Command: Set Controller To Ho.. (0x03|0x0031) plen 1  #11 [hci1] 0.250706
        Flow control: ACL Data Packets (0x01)
> HCI Event: Command Complete (0x0e) plen 4                 #12 [hci1] 0.251161
      Set Controller To Host Flow Control (0x03|0x0031) ncmd 1
        Status: Success (0x00)
< HCI Command: LE Read Local Suppor.. (0x08|0x0003) plen 0  #13 [hci1] 0.270715
> HCI Event: Command Complete (0x0e) plen 12                #14 [hci1] 0.271238
      LE Read Local Supported Features (0x08|0x0003) ncmd 1
        Status: Success (0x00)
        Features: 0xfd 0x79 0x00 0xf7 0x30 0x01 0x00 0x00
          LE Encryption
          Extended Reject Indication
          Peripheral-initiated Features Exchange
          LE Ping
          LE Data Packet Length Extension
          LL Privacy
          Extended Scanner Filter Policies
          LE 2M PHY
          LE Coded PHY
          LE Extended Advertising
          LE Periodic Advertising
          Channel Selection Algorithm #2
          Periodic Advertising Sync Transfer - Sender
          Periodic Advertising Sync Transfer - Recipient
          Sleep Clock Accuracy Updates
          Connected Isochronous Stream - Central
          Connected Isochronous Stream - Peripheral
          Isochronous Broadcaster
          Synchronized Receiver
          Periodic Advertising ADI support
          Connection Subrating
          Unknown features (0x0000010000000000)
< HCI Command: LE Set Host Feature (0x08|0x0074) plen 2     #15 [hci1] 0.290747
        Bit Number: 32
          Connected Isochronous Stream (Host Support)
        Bit Value: 1
> HCI Event: Command Complete (0x0e) plen 4                 #16 [hci1] 0.291234
      LE Set Host Feature (0x08|0x0074) ncmd 1
        Status: Success (0x00)
< HCI Command: LE Read Buffer v2 (0x08|0x0060) plen 0       #17 [hci1] 0.310714
> HCI Event: Command Complete (0x0e) plen 10                #18 [hci1] 0.311226
      LE Read Buffer v2 (0x08|0x0060) ncmd 1
        Status: Success (0x00)
        ACL MTU: 27
        ACL max packet: 3
        ISO MTU: 318
        ISO max packet: 3
< HCI Command: LE Read Maximum Adve.. (0x08|0x003a) plen 0  #19 [hci1] 0.330772
> HCI Event: Command Complete (0x0e) plen 6                 #20 [hci1] 0.331243
      LE Read Maximum Advertising Data Length (0x08|0x003a) ncmd 1
        Status: Success (0x00)
        Max length: 1650
< HCI Command: LE Read Supported St.. (0x08|0x001c) plen 0  #21 [hci1] 0.350721
> HCI Event: Command Complete (0x0e) plen 12                #22 [hci1] 0.351233
      LE Read Supported States (0x08|0x001c) ncmd 1
        Status: Success (0x00)
        States: 0x000003ff3e0306ff
          Non-connectable Advertising State
          Scannable Advertising State
          Connectable Advertising State
          High Duty Cycle Directed Advertising State
          Passive Scanning State
          Active Scanning State
          Initiating State
            and Connection State (Central Role)
          Connection State (Peripheral Role)
          Scannable Advertising State
            and Passive Scanning State
          Connectable Advertising State
            and Passive Scanning State
          Non-connectable Advertising State
            and Initiating State
          Scannable Advertising State
            and Initiating State
          Active Scanning State
            and Connection State (Central Role)
          Passive Scanning State
            and Connection State (Peripheral Role)
          Active Scanning State
            and Connection State (Peripheral Role)
          Initiating State
            and Connection State (Central Role)
            and Central Role & Central Role
          Low Duty Cycle Directed Advertising State
          Connectable Advertising State
            and Initiating State
            and Central Role & Peripheral Role
          High Duty Cycle Directed Advertising State
            and Initiating State
            and Central Role & Peripheral Role
          Low Duty Cycle Directed Advertising State
            and Initiating State
            and Central Role & Peripheral Role
          Connectable Advertising State
            and Connection State (Central Role)
            and Central Role & Peripheral Role
          High Duty Cycle Directed Advertising State
            and Connection State (Central Role)
            and Central Role & Peripheral Role
          Low Duty Cycle Directed Advertising State
            and Connection State (Central Role)
            and Central Role & Peripheral Role
          Connectable Advertising State
            and Connection State (Peripheral Role)
            and Central Role & Peripheral Role
          High Duty Cycle Directed Advertising State
            and Connection State (Peripheral Role)
            and Peripheral Role & Peripheral Role
          Low Duty Cycle Directed Advertising State
            and Connection State (Peripheral Role)
            and Peripheral Role & Peripheral Role
          Initiating State
            and Connection State (Peripheral Role)
            and Central Role & Peripheral Role
< HCI Command: LE Read Maximum Data.. (0x08|0x002f) plen 0  #23 [hci1] 0.370744
> HCI Event: Command Complete (0x0e) plen 12                #24 [hci1] 0.371214
      LE Read Maximum Data Length (0x08|0x002f) ncmd 1
        Status: Success (0x00)
        Max TX octets: 251
        Max TX time: 2704
        Max RX octets: 251
        Max RX time: 2704
< HCI Command: LE Write Suggested D.. (0x08|0x0024) plen 4  #25 [hci1] 0.390712
        TX octets: 251
        TX time: 2704
> HCI Event: Command Complete (0x0e) plen 4                 #26 [hci1] 0.391203
      LE Write Suggested Default Data Length (0x08|0x0024) ncmd 1
        Status: Success (0x00)
< HCI Command: LE Read Resolving Li.. (0x08|0x002a) plen 0  #27 [hci1] 0.410765
> HCI Event: Command Complete (0x0e) plen 5                 #28 [hci1] 0.411211
      LE Read Resolving List Size (0x08|0x002a) ncmd 1
        Status: Success (0x00)
        Size: 8
< HCI Command: LE Set Event Mask (0x08|0x0001) plen 8       #29 [hci1] 0.430747
        Mask: 0x000002023f87fa5e
          LE Advertising Report
          LE Connection Update Complete
          LE Read Remote Used Features Complete
          LE Long Term Key Request
          LE Data Length Change
          LE Enhanced Connection Complete
          LE PHY Update Complete
          LE Extended Advertising Report
          LE Periodic Advertising Sync Established
          LE Periodic Advertising Report
          LE Periodic Advertising Sync Lost
          LE Extended Scan Timeout
          LE Extended Advertising Set Terminated
          LE Scan Request Received
          LE Periodic Advertising Sync Transfer Rvc
          LE CIS Established
          LE CIS Request
          LE Create BIG Complete
          LE Terminate BIG Complete
          LE BIG Sync Estabilished Complete
          LE BIG Sync Lost
          LE BIG Info Advertising Report
          Unknown mask (0x0000020000000000)
> HCI Event: Command Complete (0x0e) plen 4                 #30 [hci1] 0.431229
      LE Set Event Mask (0x08|0x0001) ncmd 1
        Status: Success (0x00)
< HCI Command: Set Event Mask (0x03|0x0001) plen 8          #31 [hci1] 0.450744
        Mask: 0x2000800002008890
          Disconnection Complete
          Encryption Change
          Read Remote Version Information Complete
          Hardware Error
          Data Buffer Overflow
          Encryption Key Refresh Complete
          LE Meta
> HCI Event: Command Complete (0x0e) plen 4                 #32 [hci1] 0.451304
      Set Event Mask (0x03|0x0001) ncmd 1
        Status: Success (0x00)
< HCI Command: Read BD ADDR (0x04|0x0009) plen 0            #33 [hci1] 0.470708
> HCI Event: Command Complete (0x0e) plen 10                #34 [hci1] 0.471200
      Read BD ADDR (0x04|0x0009) ncmd 1
        Status: Success (0x00)
        Address: 00:00:00:00:00:00 (OUI 00-00-00)
< HCI Command: LE Set Random Address (0x08|0x0005) plen 6   #35 [hci1] 0.490707
        Address: D5:B6:CC:31:DB:3B (Static)
> HCI Event: Command Complete (0x0e) plen 4                 #36 [hci1] 0.491221
      LE Set Random Address (0x08|0x0005) ncmd 1
        Status: Success (0x00)
< HCI Command: LE Set Extended Adv.. (0x08|0x0036) plen 25  #37 [hci1] 3.091397
        Handle: 0x00
        Properties: 0x0013
          Connectable
          Scannable
          Use legacy advertising PDUs: ADV_IND
        Min advertising interval: 100.000 msec (0x00a0)
        Max advertising interval: 150.000 msec (0x00f0)
        Channel map: 37, 38, 39 (0x07)
        Own address type: Random (0x01)
        Peer address type: Public (0x00)
        Peer address: 00:00:00:00:00:00 (OUI 00-00-00)
        Filter policy: Allow Scan Request from Any, Allow Connect Request from Any (0x00)
        TX power: Host has no preference (0x7f)
        Primary PHY: LE 1M (0x01)
        Secondary max skip: 0x00
        Secondary PHY: LE 1M (0x01)
        SID: 0x00
        Scan request notifications: Disabled (0x00)
> HCI Event: Command Complete (0x0e) plen 5                 #38 [hci1] 3.092205
      LE Set Extended Advertising Parameters (0x08|0x0036) ncmd 1
        Status: Success (0x00)
        TX power (selected): 0 dbm (0x00)
< HCI Command: LE Set Advertising S.. (0x08|0x0035) plen 7  #39 [hci1] 3.110747
        Advertising handle: 0x00
        Advertising random address: D5:B6:CC:31:DB:3B (Static)
> HCI Event: Command Complete (0x0e) plen 4                 #40 [hci1] 3.111283
      LE Set Advertising Set Random Address (0x08|0x0035) ncmd 1
        Status: Success (0x00)
< HCI Command: LE Set Extended Adv.. (0x08|0x0037) plen 22  #41 [hci1] 3.130757
        Handle: 0x00
        Operation: Complete extended advertising data (0x03)
        Fragment preference: Minimize fragmentation (0x01)
        Data length: 0x12
        Flags: 0x06
          LE General Discoverable Mode
          BR/EDR Not Supported
        Name (complete): Tester_F6B11A
> HCI Event: Command Complete (0x0e) plen 4                 #42 [hci1] 3.131374
      LE Set Extended Advertising Data (0x08|0x0037) ncmd 1
        Status: Success (0x00)
< HCI Command: LE Set Extended Scan.. (0x08|0x0038) plen 4  #43 [hci1] 3.150754
        Handle: 0x00
        Operation: Complete scan response data (0x03)
        Fragment preference: Minimize fragmentation (0x01)
        Data length: 0x00
> HCI Event: Command Complete (0x0e) plen 4                 #44 [hci1] 3.151193
      LE Set Extended Scan Response Data (0x08|0x0038) ncmd 1
        Status: Success (0x00)
< HCI Command: LE Set Extended Adve.. (0x08|0x0039) plen 6  #45 [hci1] 3.170726
        Extended advertising: Enabled (0x01)
        Number of sets: 1 (0x01)
        Entry 0
          Handle: 0x00
          Duration: 0 ms (0x00)
          Max ext adv events: 0
> HCI Event: Command Complete (0x0e) plen 4                 #46 [hci1] 3.171261
      LE Set Extended Advertising Enable (0x08|0x0039) ncmd 1
        Status: Success (0x00)
> HCI Event: LE Meta Event (0x3e) plen 31                   #47 [hci1] 3.277321
      LE Enhanced Connection Complete (0x0a)
        Status: Success (0x00)
        Handle: 2631
        Role: Peripheral (0x01)
        Peer address type: Public (0x00)
        Peer address: DF:A9:FF:F6:B1:1A (OUI DF-A9-FF)
        Local resolvable private address: 00:00:00:00:00:00 (Non-Resolvable)
        Peer resolvable private address: 00:00:00:00:00:00 (Non-Resolvable)
        Connection interval: 87.50 msec (0x0046)
        Connection latency: 0 (0x0000)
        Supervision timeout: 25120 msec (0x09d0)
        Central clock accuracy: 0x01
> HCI Event: LE Meta Event (0x3e) plen 6                    #48 [hci1] 3.277412
      LE Advertising Set Terminated (0x12)
        Status: Success (0x00)
        Handle: 0
        Connection handle: 2631
        Number of completed extended advertising events: 0
< HCI Command: LE Read Remote Used... (0x08|0x0016) plen 2  #49 [hci1] 3.291276
        Handle: 2631 Address: DF:A9:FF:F6:B1:1A (OUI DF-A9-FF)
< ACL Data TX: Handle 2631 flags 0x00 dlen 7                #50 [hci1] 3.291290
      ATT: Exchange MTU Request (0x02) len 2
        Client RX MTU: 251
> HCI Event: Command Status (0x0f) plen 4                   #51 [hci1] 3.291761
      LE Read Remote Used Features (0x08|0x0016) ncmd 1
        Status: Success (0x00)
> HCI Event: Number of Completed Packets (0x13) plen 5      #52 [hci1] 3.453313
        Num handles: 1
        Handle: 2631 Address: DF:A9:FF:F6:B1:1A (OUI DF-A9-FF)
        Count: 1
        #50: len 7 (0 Kb/s)
        Latency: 162 msec (162-162 msec ~162 msec)
> HCI Event: LE Meta Event (0x3e) plen 12                   #53 [hci1] 3.541298
      LE Read Remote Used Features (0x04)
        Status: Success (0x00)
        Handle: 2631 Address: DF:A9:FF:F6:B1:1A (OUI DF-A9-FF)
        Features: 0x2d 0x49 0x00 0xf7 0x67 0xd9 0x00 0x80
          LE Encryption
          Extended Reject Indication
          Peripheral-initiated Features Exchange
          LE Data Packet Length Extension
          LE 2M PHY
          LE Coded PHY
          Channel Selection Algorithm #2
          Periodic Advertising Sync Transfer - Sender
          Periodic Advertising Sync Transfer - Recipient
          Sleep Clock Accuracy Updates
          Connected Isochronous Stream - Central
          Connected Isochronous Stream - Peripheral
          Isochronous Broadcaster
          Synchronized Receiver
          Connected Isochronous Stream (Host Support)
          LE Power Control Request
          LE Power Control Request
          Connection Subrating
          Connection Subrating (Host Support)
          Unknown features (0x8000d90000000000)
> ACL Data RX: Handle 2631 flags 0x02 dlen 11               #54 [hci1] 5.990861
      SMP: Pairing Request (0x01) len 6
        IO capability: KeyboardDisplay (0x04)
        OOB data: Authentication data not present (0x00)
        Authentication requirement: Bonding, No MITM, SC, No Keypresses (0x09)
        Max encryption key size: 16
        Initiator key distribution: EncKey IdKey (0x03)
        Responder key distribution: EncKey IdKey Sign (0x07)
> ACL Data RX: Handle 2631 flags 0x02 dlen 7                #55 [hci1] 5.991414
      ATT: Exchange MTU Response (0x03) len 2
        Server RX MTU: 23
< HCI Command: Host Number of Compl.. (0x03|0x0035) plen 5  #56 [hci1] 6.011284
        Num handles: 1
        Handle: 2631 Address: DF:A9:FF:F6:B1:1A (OUI DF-A9-FF)
        Count: 1
< ACL Data TX: Handle 2631 flags 0x00 dlen 11               #57 [hci1] 6.011442
      SMP: Pairing Response (0x02) len 6
        IO capability: NoInputNoOutput (0x03)
        OOB data: Authentication data not present (0x00)
        Authentication requirement: Bonding, No MITM, SC, No Keypresses (0x09)
        Max encryption key size: 16
        Initiator key distribution: IdKey (0x02)
        Responder key distribution: <none> (0x00)
< HCI Command: Host Number of Compl.. (0x03|0x0035) plen 5  #58 [hci1] 6.011818
        Num handles: 1
        Handle: 2631 Address: DF:A9:FF:F6:B1:1A (OUI DF-A9-FF)
        Count: 1
> HCI Event: Number of Completed Packets (0x13) plen 5      #59 [hci1] 6.166024
        Num handles: 1
        Handle: 2631 Address: DF:A9:FF:F6:B1:1A (OUI DF-A9-FF)
        Count: 1
        #57: len 11 (0 Kb/s)
        Latency: 154 msec (154-162 msec ~158 msec)
> ACL Data RX: Handle 2631 flags 0x02 dlen 27               #60 [hci1] 6.166298
> ACL Data RX: Handle 2631 flags 0x01 dlen 27               #61 [hci1] 6.166836
> ACL Data RX: Handle 2631 flags 0x01 dlen 15               #62 [hci1] 6.167300
      SMP: Pairing Public Key (0x0c) len 64
        X: a798c740121df6babdf04d689b4aa1b344a44927892bbf55c99e6beb586f5a14
        Y: 9aaf88cf7c6453ac7095d61464009d443435dbc8682623f6ccac08a2a24c4a35
< HCI Command: Host Number of Compl.. (0x03|0x0035) plen 5  #63 [hci1] 6.171223
        Num handles: 1
        Handle: 2631 Address: DF:A9:FF:F6:B1:1A (OUI DF-A9-FF)
        Count: 1
< HCI Command: Host Number of Compl.. (0x03|0x0035) plen 5  #64 [hci1] 6.171250
        Num handles: 1
        Handle: 2631 Address: DF:A9:FF:F6:B1:1A (OUI DF-A9-FF)
        Count: 1
< HCI Command: Host Number of Compl.. (0x03|0x0035) plen 5  #65 [hci1] 6.171436
        Num handles: 1
        Handle: 2631 Address: DF:A9:FF:F6:B1:1A (OUI DF-A9-FF)
        Count: 1
< ACL Data TX: Handle 2631 flags 0x00 dlen 27               #66 [hci1] 6.171445
< ACL Data TX: Handle 2631 flags 0x01 dlen 27               #67 [hci1] 6.171462
< ACL Data TX: Handle 2631 flags 0x01 dlen 15               #68 [hci1] 6.171471
      SMP: Pairing Public Key (0x0c) len 64
        X: 98308440221e2d910f0e54b71e7ec652857aa9b5a0dc65028824cc19db1226e9
        Y: 67a4816bcb62efb21701e31fdb27561a6217575fb007a8bbdabe7e28b6f68482
> HCI Event: Number of Completed Packets (0x13) plen 5      #69 [hci1] 6.253831
        Num handles: 1
        Handle: 2631 Address: DF:A9:FF:F6:B1:1A (OUI DF-A9-FF)
        Count: 1
        #66: len 27 (2 Kb/s)
        Latency: 82 msec (82-162 msec ~120 msec)
> HCI Event: Number of Completed Packets (0x13) plen 5      #70 [hci1] 6.254540
        Num handles: 1
        Handle: 2631 Address: DF:A9:FF:F6:B1:1A (OUI DF-A9-FF)
        Count: 1
        #67: len 27 (2 Kb/s)
        Latency: 83 msec (82-162 msec ~101 msec)
< ACL Data TX: Handle 2631 flags 0x00 dlen 21               #71 [hci1] 6.271149
      SMP: Pairing Confirm (0x03) len 16
        Confim value: d00a67d5a5adfddb386f2ae35b4a9436
> HCI Event: Number of Completed Packets (0x13) plen 5      #72 [hci1] 6.340689
        Num handles: 1
        Handle: 2631 Address: DF:A9:FF:F6:B1:1A (OUI DF-A9-FF)
        Count: 1
        #68: len 15 (0 Kb/s)
        Latency: 169 msec (82-169 msec ~135 msec)
> HCI Event: Number of Completed Packets (0x13) plen 5      #73 [hci1] 6.428545
        Num handles: 1
        Handle: 2631 Address: DF:A9:FF:F6:B1:1A (OUI DF-A9-FF)
        Count: 1
        #71: len 21 (1 Kb/s)
        Latency: 157 msec (82-169 msec ~146 msec)
> ACL Data RX: Handle 2631 flags 0x02 dlen 21               #74 [hci1] 6.428766
      SMP: Pairing Random (0x04) len 16
        Random value: ea707a59ac5081ba0000000000000000
< HCI Command: Host Number of Compl.. (0x03|0x0035) plen 5  #75 [hci1] 6.431394
        Num handles: 1
        Handle: 2631 Address: DF:A9:FF:F6:B1:1A (OUI DF-A9-FF)
        Count: 1
< ACL Data TX: Handle 2631 flags 0x00 dlen 21               #76 [hci1] 6.431497
      SMP: Pairing Random (0x04) len 16
        Random value: 8e6108f966a694cbe26df70bb96773e6
> HCI Event: Number of Completed Packets (0x13) plen 5      #77 [hci1] 6.603193
        Num handles: 1
        Handle: 2631 Address: DF:A9:FF:F6:B1:1A (OUI DF-A9-FF)
        Count: 1
        #76: len 21 (0 Kb/s)
        Latency: 171 msec (82-171 msec ~159 msec)
> ACL Data RX: Handle 2631 flags 0x02 dlen 21               #78 [hci1] 6.778592
      SMP: Pairing DHKey Check (0x0d) len 16
        E: 7b8854270d5989bbd457369ef815c872
< HCI Command: Host Number of Compl.. (0x03|0x0035) plen 5  #79 [hci1] 6.791642
        Num handles: 1
        Handle: 2631 Address: DF:A9:FF:F6:B1:1A (OUI DF-A9-FF)
        Count: 1
< ACL Data TX: Handle 2631 flags 0x00 dlen 21               #80 [hci1] 6.791722
      SMP: Pairing DHKey Check (0x0d) len 16
        E: e65c702d4a388fe3ee00bd87d5d84d75
> HCI Event: Number of Completed Packets (0x13) plen 5      #81 [hci1] 6.953209
        Num handles: 1
        Handle: 2631 Address: DF:A9:FF:F6:B1:1A (OUI DF-A9-FF)
        Count: 1
        #80: len 21 (1 Kb/s)
        Latency: 161 msec (82-171 msec ~160 msec)
> HCI Event: LE Meta Event (0x3e) plen 13                   #82 [hci1] 7.041357
      LE Long Term Key Request (0x05)
        Handle: 2631 Address: DF:A9:FF:F6:B1:1A (OUI DF-A9-FF)
        Random number: 0x0000000000000000
        Encrypted diversifier: 0x0000
< HCI Command: LE Long Term Key Re.. (0x08|0x001a) plen 18  #83 [hci1] 7.051141
        Handle: 2631 Address: DF:A9:FF:F6:B1:1A (OUI DF-A9-FF)
        Long term key: 20bdd17f5451b8a4695863537426189b
> HCI Event: Command Complete (0x0e) plen 6                 #84 [hci1] 7.051818
      LE Long Term Key Request Reply (0x08|0x001a) ncmd 1
        Status: Success (0x00)
        Handle: 2631 Address: DF:A9:FF:F6:B1:1A (OUI DF-A9-FF)
> HCI Event: Encryption Change (0x08) plen 4                #85 [hci1] 7.478632
        Status: Success (0x00)
        Handle: 2631 Address: DF:A9:FF:F6:B1:1A (OUI DF-A9-FF)
        Encryption: Enabled with AES-CCM (0x01)
> ACL Data RX: Handle 2631 flags 0x02 dlen 21               #86 [hci1] 7.566124
      SMP: Identity Information (0x08) len 16
        Identity resolving key: 3d54e7d58a9cbf7c43a73f5bced0a6c0
< HCI Command: Host Number of Compl.. (0x03|0x0035) plen 5  #87 [hci1] 7.601604
        Num handles: 1
        Handle: 2631 Address: DF:A9:FF:F6:B1:1A (OUI DF-A9-FF)
        Count: 1
> ACL Data RX: Handle 2631 flags 0x02 dlen 12               #88 [hci1] 7.740944
      SMP: Identity Address Information (0x09) len 7
        Address: DF:A9:FF:F6:B1:1A (OUI DF-A9-FF)
< HCI Command: LE Add Device To Re.. (0x08|0x0027) plen 39  #89 [hci1] 7.751350
        Address type: Public (0x00)
        Address: DF:A9:FF:F6:B1:1A (OUI DF-A9-FF)
        Peer identity resolving key: 3d54e7d58a9cbf7c43a73f5bced0a6c0
        Local identity resolving key: 00000000000000000000000000000000
> HCI Event: Command Complete (0x0e) plen 4                 #90 [hci1] 7.752333
      LE Add Device To Resolving List (0x08|0x0027) ncmd 1
        Status: Success (0x00)
< HCI Command: LE Set Privacy Mode (0x08|0x004e) plen 8     #91 [hci1] 7.771145
        Peer Identity address type: Public (0x00)
        Peer Identity address: DF:A9:FF:F6:B1:1A (OUI DF-A9-FF)
        Privacy Mode: Use Device Privacy (0x01)
> HCI Event: Command Complete (0x0e) plen 4                 #92 [hci1] 7.771657
      LE Set Privacy Mode (0x08|0x004e) ncmd 1
        Status: Success (0x00)
< HCI Command: LE Set Address Resol.. (0x08|0x002d) plen 1  #93 [hci1] 7.791160
        Address resolution: Enabled (0x01)
> HCI Event: Command Complete (0x0e) plen 4                 #94 [hci1] 7.791662
      LE Set Address Resolution Enable (0x08|0x002d) ncmd 1
        Status: Success (0x00)
< HCI Command: Host Number of Compl.. (0x03|0x0035) plen 5  #95 [hci1] 7.811083
        Num handles: 1
        Handle: 2631 Address: DF:A9:FF:F6:B1:1A (OUI DF-A9-FF)
        Count: 1
> ACL Data RX: Handle 2631 flags 0x02 dlen 11               #96 [hci1] 7.915943
      ATT: Read By Group Type Request (0x10) len 6
        Handle range: 0x0001-0xffff
        Attribute group type: Primary Service (0x2800)
< HCI Command: Host Number of Compl.. (0x03|0x0035) plen 5  #97 [hci1] 7.931388
        Num handles: 1
        Handle: 2631 Address: DF:A9:FF:F6:B1:1A (OUI DF-A9-FF)
        Count: 1
< ACL Data TX: Handle 2631 flags 0x00 dlen 24               #98 [hci1] 7.931478
      ATT: Read By Group Type Response (0x11) len 19
        Attribute data length: 6
        Attribute group list: 3 entries
        Handle range: 0x0001-0x000a
        UUID: Generic Attribute Profile (0x1801)
        Handle range: 0x000b-0x0011
        UUID: Generic Access Profile (0x1800)
        Handle range: 0x0012-0x0020
        UUID: Device Information (0x180a)
> HCI Event: Number of Completed Packets (0x13) plen 5      #99 [hci1] 8.090785
        Num handles: 1
        Handle: 2631 Address: DF:A9:FF:F6:B1:1A (OUI DF-A9-FF)
        Count: 1
        #98: len 24 (1 Kb/s)
        Latency: 159 msec (82-171 msec ~159 msec)
> ACL Data RX: Handle 2631 flags 0x02 dlen 11              #100 [hci1] 8.091133
      ATT: Read By Group Type Request (0x10) len 6
        Handle range: 0x0021-0xffff
        Attribute group type: Primary Service (0x2800)
< HCI Command: Host Number of Comp.. (0x03|0x0035) plen 5  #101 [hci1] 8.111533
        Num handles: 1
        Handle: 2631 Address: DF:A9:FF:F6:B1:1A (OUI DF-A9-FF)
        Count: 1
< ACL Data TX: Handle 2631 flags 0x00 dlen 18              #102 [hci1] 8.111617
      ATT: Read By Group Type Response (0x11) len 13
        Attribute data length: 6
        Attribute group list: 2 entries
        Handle range: 0x0021-0x0023
        UUID: Immediate Alert (0x1802)
        Handle range: 0x005c-0x0068
        UUID: Volume Control (0x1844)
> HCI Event: Number of Completed Packets (0x13) plen 5     #103 [hci1] 8.265871
        Num handles: 1
        Handle: 2631 Address: DF:A9:FF:F6:B1:1A (OUI DF-A9-FF)
        Count: 1
        #102: len 18 (0 Kb/s)
        Latency: 154 msec (82-171 msec ~157 msec)
> ACL Data RX: Handle 2631 flags 0x02 dlen 11              #104 [hci1] 8.266167
      ATT: Read By Group Type Request (0x10) len 6
        Handle range: 0x0069-0xffff
        Attribute group type: Primary Service (0x2800)
< HCI Command: Host Number of Comp.. (0x03|0x0035) plen 5  #105 [hci1] 8.271472
        Num handles: 1
        Handle: 2631 Address: DF:A9:FF:F6:B1:1A (OUI DF-A9-FF)
        Count: 1
< ACL Data TX: Handle 2631 flags 0x00 dlen 9               #106 [hci1] 8.271645
      ATT: Error Response (0x01) len 4
        Read By Group Type Request (0x10)
        Handle: 0x0069
        Error: Attribute Not Found (0x0a)
> HCI Event: Number of Completed Packets (0x13) plen 5     #107 [hci1] 8.440829
        Num handles: 1
        Handle: 2631 Address: DF:A9:FF:F6:B1:1A (OUI DF-A9-FF)
        Count: 1
        #106: len 9 (0 Kb/s)
        Latency: 169 msec (82-171 msec ~163 msec)
> ACL Data RX: Handle 2631 flags 0x02 dlen 11              #108 [hci1] 8.441140
      ATT: Read By Type Request (0x08) len 6
        Handle range: 0x0001-0x000a
        Attribute type: Include (0x2802)
< HCI Command: Host Number of Comp.. (0x03|0x0035) plen 5  #109 [hci1] 8.451416
        Num handles: 1
        Handle: 2631 Address: DF:A9:FF:F6:B1:1A (OUI DF-A9-FF)
        Count: 1
< ACL Data TX: Handle 2631 flags 0x00 dlen 9               #110 [hci1] 8.451628
      ATT: Error Response (0x01) len 4
        Read By Type Request (0x08)
        Handle: 0x0001
        Error: Attribute Not Found (0x0a)
> HCI Event: Number of Completed Packets (0x13) plen 5     #111 [hci1] 8.615858
        Num handles: 1
        Handle: 2631 Address: DF:A9:FF:F6:B1:1A (OUI DF-A9-FF)
        Count: 1
        #110: len 9 (0 Kb/s)
        Latency: 164 msec (82-171 msec ~163 msec)
> ACL Data RX: Handle 2631 flags 0x02 dlen 11              #112 [hci1] 8.616164
      ATT: Read By Type Request (0x08) len 6
        Handle range: 0x000b-0x0011
        Attribute type: Include (0x2802)
< HCI Command: Host Number of Comp.. (0x03|0x0035) plen 5  #113 [hci1] 8.631503
        Num handles: 1
        Handle: 2631 Address: DF:A9:FF:F6:B1:1A (OUI DF-A9-FF)
        Count: 1
< ACL Data TX: Handle 2631 flags 0x00 dlen 9               #114 [hci1] 8.631665
      ATT: Error Response (0x01) len 4
        Read By Type Request (0x08)
        Handle: 0x000b
        Error: Attribute Not Found (0x0a)
> HCI Event: Number of Completed Packets (0x13) plen 5     #115 [hci1] 8.790851
        Num handles: 1
        Handle: 2631 Address: DF:A9:FF:F6:B1:1A (OUI DF-A9-FF)
        Count: 1
        #114: len 9 (0 Kb/s)
        Latency: 159 msec (82-171 msec ~161 msec)
> ACL Data RX: Handle 2631 flags 0x02 dlen 11              #116 [hci1] 8.791099
      ATT: Read By Type Request (0x08) len 6
        Handle range: 0x0012-0x0020
        Attribute type: Include (0x2802)
< HCI Command: Host Number of Comp.. (0x03|0x0035) plen 5  #117 [hci1] 8.811559
        Num handles: 1
        Handle: 2631 Address: DF:A9:FF:F6:B1:1A (OUI DF-A9-FF)
        Count: 1
< ACL Data TX: Handle 2631 flags 0x00 dlen 9               #118 [hci1] 8.811730
      ATT: Error Response (0x01) len 4
        Read By Type Request (0x08)
        Handle: 0x0012
        Error: Attribute Not Found (0x0a)
> HCI Event: Number of Completed Packets (0x13) plen 5     #119 [hci1] 8.965854
        Num handles: 1
        Handle: 2631 Address: DF:A9:FF:F6:B1:1A (OUI DF-A9-FF)
        Count: 1
        #118: len 9 (0 Kb/s)
        Latency: 154 msec (82-171 msec ~157 msec)
> ACL Data RX: Handle 2631 flags 0x02 dlen 11              #120 [hci1] 8.966138
      ATT: Read By Type Request (0x08) len 6
        Handle range: 0x0021-0x0023
        Attribute type: Include (0x2802)
< HCI Command: Host Number of Comp.. (0x03|0x0035) plen 5  #121 [hci1] 8.971421
        Num handles: 1
        Handle: 2631 Address: DF:A9:FF:F6:B1:1A (OUI DF-A9-FF)
        Count: 1
< ACL Data TX: Handle 2631 flags 0x00 dlen 9               #122 [hci1] 8.971512
      ATT: Error Response (0x01) len 4
        Read By Type Request (0x08)
        Handle: 0x0021
        Error: Attribute Not Found (0x0a)
> HCI Event: Number of Completed Packets (0x13) plen 5     #123 [hci1] 9.140947
        Num handles: 1
        Handle: 2631 Address: DF:A9:FF:F6:B1:1A (OUI DF-A9-FF)
        Count: 1
        #122: len 9 (0 Kb/s)
        Latency: 169 msec (82-171 msec ~163 msec)
> ACL Data RX: Handle 2631 flags 0x02 dlen 11              #124 [hci1] 9.141154
      ATT: Read By Type Request (0x08) len 6
        Handle range: 0x005c-0x0068
        Attribute type: Include (0x2802)
< HCI Command: Host Number of Comp.. (0x03|0x0035) plen 5  #125 [hci1] 9.151422
        Num handles: 1
        Handle: 2631 Address: DF:A9:FF:F6:B1:1A (OUI DF-A9-FF)
        Count: 1
< ACL Data TX: Handle 2631 flags 0x00 dlen 22              #126 [hci1] 9.151526
      ATT: Read By Type Response (0x09) len 17
        Attribute data length: 8
        Attribute data list: 2 entries
        Handle: 0x005d
        Value: 24002f004518
        Handle: 0x005e
        Value: 30003b004518
> HCI Event: Number of Completed Packets (0x13) plen 5     #127 [hci1] 9.315888
        Num handles: 1
        Handle: 2631 Address: DF:A9:FF:F6:B1:1A (OUI DF-A9-FF)
        Count: 1
        #126: len 22 (1 Kb/s)
        Latency: 164 msec (82-171 msec ~163 msec)
> ACL Data RX: Handle 2631 flags 0x02 dlen 11              #128 [hci1] 9.316165
      ATT: Read By Type Request (0x08) len 6
        Handle range: 0x005f-0x0068
        Attribute type: Include (0x2802)
< HCI Command: Host Number of Comp.. (0x03|0x0035) plen 5  #129 [hci1] 9.331466
        Num handles: 1
        Handle: 2631 Address: DF:A9:FF:F6:B1:1A (OUI DF-A9-FF)
        Count: 1
< ACL Data TX: Handle 2631 flags 0x00 dlen 22              #130 [hci1] 9.331581
      ATT: Read By Type Response (0x09) len 17
        Attribute data length: 8
        Attribute data list: 2 entries
        Handle: 0x005f
        Value: 3c004b004318
        Handle: 0x0060
        Value: 4c005b004318
> HCI Event: Number of Completed Packets (0x13) plen 5     #131 [hci1] 9.490817
        Num handles: 1
        Handle: 2631 Address: DF:A9:FF:F6:B1:1A (OUI DF-A9-FF)
        Count: 1
        #130: len 22 (1 Kb/s)
        Latency: 159 msec (82-171 msec ~161 msec)
> ACL Data RX: Handle 2631 flags 0x02 dlen 11              #132 [hci1] 9.491094
      ATT: Read By Type Request (0x08) len 6
        Handle range: 0x0061-0x0068
        Attribute type: Include (0x2802)
< HCI Command: Host Number of Comp.. (0x03|0x0035) plen 5  #133 [hci1] 9.511395
        Num handles: 1
        Handle: 2631 Address: DF:A9:FF:F6:B1:1A (OUI DF-A9-FF)
        Count: 1
< ACL Data TX: Handle 2631 flags 0x00 dlen 9               #134 [hci1] 9.511624
      ATT: Error Response (0x01) len 4
        Read By Type Request (0x08)
        Handle: 0x0061
        Error: Attribute Not Found (0x0a)
> HCI Event: Number of Completed Packets (0x13) plen 5     #135 [hci1] 9.665894
        Num handles: 1
        Handle: 2631 Address: DF:A9:FF:F6:B1:1A (OUI DF-A9-FF)
        Count: 1
        #134: len 9 (0 Kb/s)
        Latency: 154 msec (82-171 msec ~157 msec)
> ACL Data RX: Handle 2631 flags 0x02 dlen 11              #136 [hci1] 9.666171
      ATT: Read By Type Request (0x08) len 6
        Handle range: 0x0024-0x002f
        Attribute type: Characteristic (0x2803)
< HCI Command: Host Number of Comp.. (0x03|0x0035) plen 5  #137 [hci1] 9.671388
        Num handles: 1
        Handle: 2631 Address: DF:A9:FF:F6:B1:1A (OUI DF-A9-FF)
        Count: 1
< ACL Data TX: Handle 2631 flags 0x00 dlen 20              #138 [hci1] 9.671505
      ATT: Read By Type Response (0x09) len 15
        Attribute data length: 7
        Attribute data list: 2 entries
        Handle: 0x0025
        Value: 122600802b
            Properties: 0x12
              Read (0x02)
              Notify (0x10)
            Value Handle: 0x0026
            Value UUID: Offset State (0x2b80)
        Handle: 0x0028
        Value: 162900812b
            Properties: 0x16
              Read (0x02)
              Write Without Response (0x04)
              Notify (0x10)
            Value Handle: 0x0029
            Value UUID: Audio Location (0x2b81)
> HCI Event: Number of Completed Packets (0x13) plen 5     #139 [hci1] 9.840815
        Num handles: 1
        Handle: 2631 Address: DF:A9:FF:F6:B1:1A (OUI DF-A9-FF)
        Count: 1
        #138: len 20 (0 Kb/s)
        Latency: 169 msec (82-171 msec ~163 msec)
> ACL Data RX: Handle 2631 flags 0x02 dlen 11              #140 [hci1] 9.841190
      ATT: Read By Type Request (0x08) len 6
        Handle range: 0x0029-0x002f
        Attribute type: Characteristic (0x2803)
< HCI Command: Host Number of Comp.. (0x03|0x0035) plen 5  #141 [hci1] 9.851356
        Num handles: 1
        Handle: 2631 Address: DF:A9:FF:F6:B1:1A (OUI DF-A9-FF)
        Count: 1
< ACL Data TX: Handle 2631 flags 0x00 dlen 20              #142 [hci1] 9.851449
      ATT: Read By Type Response (0x09) len 15
        Attribute data length: 7
        Attribute data list: 2 entries
        Handle: 0x002b
        Value: 082c00822b
            Properties: 0x08
              Write (0x08)
            Value Handle: 0x002c
            Value UUID: Volume Offset Control Point (0x2b82)
        Handle: 0x002d
        Value: 162e00832b
            Properties: 0x16
              Read (0x02)
              Write Without Response (0x04)
              Notify (0x10)
            Value Handle: 0x002e
            Value UUID: Audio Output Description (0x2b83)
> HCI Event: Number of Completed Packets (0x13) plen 5    #143 [hci1] 10.015858
        Num handles: 1
        Handle: 2631 Address: DF:A9:FF:F6:B1:1A (OUI DF-A9-FF)
        Count: 1
        #142: len 20 (0 Kb/s)
        Latency: 164 msec (82-171 msec ~164 msec)
> ACL Data RX: Handle 2631 flags 0x02 dlen 11             #144 [hci1] 10.016074
      ATT: Read By Type Request (0x08) len 6
        Handle range: 0x002e-0x002f
        Attribute type: Characteristic (0x2803)
< HCI Command: Host Number of Com.. (0x03|0x0035) plen 5  #145 [hci1] 10.031472
        Num handles: 1
        Handle: 2631 Address: DF:A9:FF:F6:B1:1A (OUI DF-A9-FF)
        Count: 1
< ACL Data TX: Handle 2631 flags 0x00 dlen 9              #146 [hci1] 10.031697
      ATT: Error Response (0x01) len 4
        Read By Type Request (0x08)
        Handle: 0x002e
        Error: Attribute Not Found (0x0a)
> HCI Event: Number of Completed Packets (0x13) plen 5    #147 [hci1] 10.190916
        Num handles: 1
        Handle: 2631 Address: DF:A9:FF:F6:B1:1A (OUI DF-A9-FF)
        Count: 1
        #146: len 9 (0 Kb/s)
        Latency: 159 msec (82-171 msec ~161 msec)
> ACL Data RX: Handle 2631 flags 0x02 dlen 13             #148 [hci1] 10.191125
      ATT: Find By Type Value Request (0x06) len 8
        Handle range: 0x0001-0xffff
        Attribute type: Primary Service (0x2800)
          UUID: Volume Offset Control (0x1845)
< HCI Command: Host Number of Com.. (0x03|0x0035) plen 5  #149 [hci1] 10.211640
        Num handles: 1
        Handle: 2631 Address: DF:A9:FF:F6:B1:1A (OUI DF-A9-FF)
        Count: 1
< ACL Data TX: Handle 2631 flags 0x00 dlen 9              #150 [hci1] 10.211877
      ATT: Error Response (0x01) len 4
        Find By Type Value Request (0x06)
        Handle: 0x0001
        Error: Attribute Not Found (0x0a)
> HCI Event: Number of Completed Packets (0x13) plen 5    #151 [hci1] 10.365817
        Num handles: 1
        Handle: 2631 Address: DF:A9:FF:F6:B1:1A (OUI DF-A9-FF)
        Count: 1
        #150: len 9 (0 Kb/s)
        Latency: 153 msec (82-171 msec ~157 msec)
> ACL Data RX: Handle 2631 flags 0x02 dlen 11             #152 [hci1] 10.366070
      ATT: Read By Type Request (0x08) len 6
        Handle range: 0x0001-0xffff
        Attribute type: Include (0x2802)
< HCI Command: Host Number of Com.. (0x03|0x0035) plen 5  #153 [hci1] 10.371514
        Num handles: 1
        Handle: 2631 Address: DF:A9:FF:F6:B1:1A (OUI DF-A9-FF)
        Count: 1
< ACL Data TX: Handle 2631 flags 0x00 dlen 22             #154 [hci1] 10.371588
      ATT: Read By Type Response (0x09) len 17
        Attribute data length: 8
        Attribute data list: 2 entries
        Handle: 0x005d
        Value: 24002f004518
        Handle: 0x005e
        Value: 30003b004518
> HCI Event: Number of Completed Packets (0x13) plen 5    #155 [hci1] 10.540831
        Num handles: 1
        Handle: 2631 Address: DF:A9:FF:F6:B1:1A (OUI DF-A9-FF)
        Count: 1
        #154: len 22 (1 Kb/s)
        Latency: 169 msec (82-171 msec ~163 msec)
> ACL Data RX: Handle 2631 flags 0x02 dlen 11             #156 [hci1] 10.541145
      ATT: Read By Type Request (0x08) len 6
        Handle range: 0x005f-0xffff
        Attribute type: Include (0x2802)
< HCI Command: Host Number of Com.. (0x03|0x0035) plen 5  #157 [hci1] 10.551488
        Num handles: 1
        Handle: 2631 Address: DF:A9:FF:F6:B1:1A (OUI DF-A9-FF)
        Count: 1
< ACL Data TX: Handle 2631 flags 0x00 dlen 22             #158 [hci1] 10.551512
      ATT: Read By Type Response (0x09) len 17
        Attribute data length: 8
        Attribute data list: 2 entries
        Handle: 0x005f
        Value: 3c004b004318
        Handle: 0x0060
        Value: 4c005b004318
> HCI Event: Number of Completed Packets (0x13) plen 5    #159 [hci1] 10.715867
        Num handles: 1
        Handle: 2631 Address: DF:A9:FF:F6:B1:1A (OUI DF-A9-FF)
        Count: 1
        #158: len 22 (1 Kb/s)
        Latency: 164 msec (82-171 msec ~163 msec)
> ACL Data RX: Handle 2631 flags 0x02 dlen 11             #160 [hci1] 10.716108
      ATT: Read By Type Request (0x08) len 6
        Handle range: 0x0061-0xffff
        Attribute type: Include (0x2802)
< HCI Command: Host Number of Com.. (0x03|0x0035) plen 5  #161 [hci1] 10.731471
        Num handles: 1
        Handle: 2631 Address: DF:A9:FF:F6:B1:1A (OUI DF-A9-FF)
        Count: 1
< ACL Data TX: Handle 2631 flags 0x00 dlen 9              #162 [hci1] 10.731709
      ATT: Error Response (0x01) len 4
        Read By Type Request (0x08)
        Handle: 0x0061
        Error: Attribute Not Found (0x0a)
> HCI Event: Number of Completed Packets (0x13) plen 5    #163 [hci1] 10.890818
        Num handles: 1
        Handle: 2631 Address: DF:A9:FF:F6:B1:1A (OUI DF-A9-FF)
        Count: 1
        #162: len 9 (0 Kb/s)
        Latency: 159 msec (82-171 msec ~161 msec)
> ACL Data RX: Handle 2631 flags 0x02 dlen 11             #164 [hci1] 10.891104
      ATT: Read By Type Request (0x08) len 6
        Handle range: 0x0024-0x002f
        Attribute type: Characteristic (0x2803)
< HCI Command: Host Number of Com.. (0x03|0x0035) plen 5  #165 [hci1] 10.911485
        Num handles: 1
        Handle: 2631 Address: DF:A9:FF:F6:B1:1A (OUI DF-A9-FF)
        Count: 1
< ACL Data TX: Handle 2631 flags 0x00 dlen 20             #166 [hci1] 10.911507
      ATT: Read By Type Response (0x09) len 15
        Attribute data length: 7
        Attribute data list: 2 entries
        Handle: 0x0025
        Value: 122600802b
            Properties: 0x12
              Read (0x02)
              Notify (0x10)
            Value Handle: 0x0026
            Value UUID: Offset State (0x2b80)
        Handle: 0x0028
        Value: 162900812b
            Properties: 0x16
              Read (0x02)
              Write Without Response (0x04)
              Notify (0x10)
            Value Handle: 0x0029
            Value UUID: Audio Location (0x2b81)
> HCI Event: Number of Completed Packets (0x13) plen 5    #167 [hci1] 11.065908
        Num handles: 1
        Handle: 2631 Address: DF:A9:FF:F6:B1:1A (OUI DF-A9-FF)
        Count: 1
        #166: len 20 (1 Kb/s)
        Latency: 154 msec (82-171 msec ~157 msec)
> ACL Data RX: Handle 2631 flags 0x02 dlen 11             #168 [hci1] 11.066113
      ATT: Read By Type Request (0x08) len 6
        Handle range: 0x0029-0x002f
        Attribute type: Characteristic (0x2803)
< HCI Command: Host Number of Com.. (0x03|0x0035) plen 5  #169 [hci1] 11.071579
        Num handles: 1
        Handle: 2631 Address: DF:A9:FF:F6:B1:1A (OUI DF-A9-FF)
        Count: 1
< ACL Data TX: Handle 2631 flags 0x00 dlen 20             #170 [hci1] 11.071717
      ATT: Read By Type Response (0x09) len 15
        Attribute data length: 7
        Attribute data list: 2 entries
        Handle: 0x002b
        Value: 082c00822b
            Properties: 0x08
              Write (0x08)
            Value Handle: 0x002c
            Value UUID: Volume Offset Control Point (0x2b82)
        Handle: 0x002d
        Value: 162e00832b
            Properties: 0x16
              Read (0x02)
              Write Without Response (0x04)
              Notify (0x10)
            Value Handle: 0x002e
            Value UUID: Audio Output Description (0x2b83)
> HCI Event: Number of Completed Packets (0x13) plen 5    #171 [hci1] 11.240929
        Num handles: 1
        Handle: 2631 Address: DF:A9:FF:F6:B1:1A (OUI DF-A9-FF)
        Count: 1
        #170: len 20 (0 Kb/s)
        Latency: 169 msec (82-171 msec ~163 msec)
> ACL Data RX: Handle 2631 flags 0x02 dlen 11             #172 [hci1] 11.241095
      ATT: Read By Type Request (0x08) len 6
        Handle range: 0x002e-0x002f
        Attribute type: Characteristic (0x2803)
< HCI Command: Host Number of Com.. (0x03|0x0035) plen 5  #173 [hci1] 11.251503
        Num handles: 1
        Handle: 2631 Address: DF:A9:FF:F6:B1:1A (OUI DF-A9-FF)
        Count: 1
< ACL Data TX: Handle 2631 flags 0x00 dlen 9              #174 [hci1] 11.251579
      ATT: Error Response (0x01) len 4
        Read By Type Request (0x08)
        Handle: 0x002e
        Error: Attribute Not Found (0x0a)
> HCI Event: Number of Completed Packets (0x13) plen 5    #175 [hci1] 11.415789
        Num handles: 1
        Handle: 2631 Address: DF:A9:FF:F6:B1:1A (OUI DF-A9-FF)
        Count: 1
        #174: len 9 (0 Kb/s)
        Latency: 164 msec (82-171 msec ~163 msec)
> ACL Data RX: Handle 2631 flags 0x02 dlen 9              #176 [hci1] 11.416064
      ATT: Find Information Request (0x04) len 4
        Handle range: 0x0027-0x0027
< HCI Command: Host Number of Com.. (0x03|0x0035) plen 5  #177 [hci1] 11.431414
        Num handles: 1
        Handle: 2631 Address: DF:A9:FF:F6:B1:1A (OUI DF-A9-FF)
        Count: 1
< ACL Data TX: Handle 2631 flags 0x00 dlen 10             #178 [hci1] 11.431488
      ATT: Find Information Response (0x05) len 5
        Format: UUID-16 (0x01)
        Handle: 0x0027
        UUID: Client Characteristic Configuration (0x2902)
> HCI Event: Number of Completed Packets (0x13) plen 5    #179 [hci1] 11.590791
        Num handles: 1
        Handle: 2631 Address: DF:A9:FF:F6:B1:1A (OUI DF-A9-FF)
        Count: 1
        #178: len 10 (0 Kb/s)
        Latency: 159 msec (82-171 msec ~161 msec)
> ACL Data RX: Handle 2631 flags 0x02 dlen 9              #180 [hci1] 11.591076
      ATT: Find Information Request (0x04) len 4
        Handle range: 0x002a-0x002a
< HCI Command: Host Number of Com.. (0x03|0x0035) plen 5  #181 [hci1] 11.611299
        Num handles: 1
        Handle: 2631 Address: DF:A9:FF:F6:B1:1A (OUI DF-A9-FF)
        Count: 1
< ACL Data TX: Handle 2631 flags 0x00 dlen 10             #182 [hci1] 11.611388
      ATT: Find Information Response (0x05) len 5
        Format: UUID-16 (0x01)
        Handle: 0x002a
        UUID: Client Characteristic Configuration (0x2902)
> HCI Event: Number of Completed Packets (0x13) plen 5    #183 [hci1] 11.765864
        Num handles: 1
        Handle: 2631 Address: DF:A9:FF:F6:B1:1A (OUI DF-A9-FF)
        Count: 1
        #182: len 10 (0 Kb/s)
        Latency: 154 msec (82-171 msec ~158 msec)
> ACL Data RX: Handle 2631 flags 0x02 dlen 9              #184 [hci1] 11.766085
      ATT: Find Information Request (0x04) len 4
        Handle range: 0x002f-0x002f
< HCI Command: Host Number of Com.. (0x03|0x0035) plen 5  #185 [hci1] 11.771522
        Num handles: 1
        Handle: 2631 Address: DF:A9:FF:F6:B1:1A (OUI DF-A9-FF)
        Count: 1
< ACL Data TX: Handle 2631 flags 0x00 dlen 10             #186 [hci1] 11.771621
      ATT: Find Information Response (0x05) len 5
        Format: UUID-16 (0x01)
        Handle: 0x002f
        UUID: Client Characteristic Configuration (0x2902)
> HCI Event: Number of Completed Packets (0x13) plen 5    #187 [hci1] 11.940796
        Num handles: 1
        Handle: 2631 Address: DF:A9:FF:F6:B1:1A (OUI DF-A9-FF)
        Count: 1
        #186: len 10 (0 Kb/s)
        Latency: 169 msec (82-171 msec ~163 msec)
> ACL Data RX: Handle 2631 flags 0x02 dlen 11             #188 [hci1] 11.941094
      ATT: Read By Type Request (0x08) len 6
        Handle range: 0x0030-0x003b
        Attribute type: Characteristic (0x2803)
< HCI Command: Host Number of Com.. (0x03|0x0035) plen 5  #189 [hci1] 11.951445
        Num handles: 1
        Handle: 2631 Address: DF:A9:FF:F6:B1:1A (OUI DF-A9-FF)
        Count: 1
< ACL Data TX: Handle 2631 flags 0x00 dlen 20             #190 [hci1] 11.951528
      ATT: Read By Type Response (0x09) len 15
        Attribute data length: 7
        Attribute data list: 2 entries
        Handle: 0x0031
        Value: 123200802b
            Properties: 0x12
              Read (0x02)
              Notify (0x10)
            Value Handle: 0x0032
            Value UUID: Offset State (0x2b80)
        Handle: 0x0034
        Value: 163500812b
            Properties: 0x16
              Read (0x02)
              Write Without Response (0x04)
              Notify (0x10)
            Value Handle: 0x0035
            Value UUID: Audio Location (0x2b81)
> HCI Event: Number of Completed Packets (0x13) plen 5    #191 [hci1] 12.115846
        Num handles: 1
        Handle: 2631 Address: DF:A9:FF:F6:B1:1A (OUI DF-A9-FF)
        Count: 1
        #190: len 20 (0 Kb/s)
        Latency: 164 msec (82-171 msec ~163 msec)
> ACL Data RX: Handle 2631 flags 0x02 dlen 11             #192 [hci1] 12.116022
      ATT: Read By Type Request (0x08) len 6
        Handle range: 0x0035-0x003b
        Attribute type: Characteristic (0x2803)
< HCI Command: Host Number of Com.. (0x03|0x0035) plen 5  #193 [hci1] 12.131565
        Num handles: 1
        Handle: 2631 Address: DF:A9:FF:F6:B1:1A (OUI DF-A9-FF)
        Count: 1
< ACL Data TX: Handle 2631 flags 0x00 dlen 20             #194 [hci1] 12.131647
      ATT: Read By Type Response (0x09) len 15
        Attribute data length: 7
        Attribute data list: 2 entries
        Handle: 0x0037
        Value: 083800822b
            Properties: 0x08
              Write (0x08)
            Value Handle: 0x0038
            Value UUID: Volume Offset Control Point (0x2b82)
        Handle: 0x0039
        Value: 163a00832b
            Properties: 0x16
              Read (0x02)
              Write Without Response (0x04)
              Notify (0x10)
            Value Handle: 0x003a
            Value UUID: Audio Output Description (0x2b83)
> HCI Event: Number of Completed Packets (0x13) plen 5    #195 [hci1] 12.290772
        Num handles: 1
        Handle: 2631 Address: DF:A9:FF:F6:B1:1A (OUI DF-A9-FF)
        Count: 1
        #194: len 20 (1 Kb/s)
        Latency: 159 msec (82-171 msec ~161 msec)
> ACL Data RX: Handle 2631 flags 0x02 dlen 11             #196 [hci1] 12.291006
      ATT: Read By Type Request (0x08) len 6
        Handle range: 0x003a-0x003b
        Attribute type: Characteristic (0x2803)
< HCI Command: Host Number of Com.. (0x03|0x0035) plen 5  #197 [hci1] 12.311298
        Num handles: 1
        Handle: 2631 Address: DF:A9:FF:F6:B1:1A (OUI DF-A9-FF)
        Count: 1
< ACL Data TX: Handle 2631 flags 0x00 dlen 9              #198 [hci1] 12.311521
      ATT: Error Response (0x01) len 4
        Read By Type Request (0x08)
        Handle: 0x003a
        Error: Attribute Not Found (0x0a)
> HCI Event: Number of Completed Packets (0x13) plen 5    #199 [hci1] 12.465828
        Num handles: 1
        Handle: 2631 Address: DF:A9:FF:F6:B1:1A (OUI DF-A9-FF)
        Count: 1
        #198: len 9 (0 Kb/s)
        Latency: 154 msec (82-171 msec ~157 msec)
> ACL Data RX: Handle 2631 flags 0x02 dlen 9              #200 [hci1] 12.466087
      ATT: Find Information Request (0x04) len 4
        Handle range: 0x0033-0x0033
< HCI Command: Host Number of Com.. (0x03|0x0035) plen 5  #201 [hci1] 12.471433
        Num handles: 1
        Handle: 2631 Address: DF:A9:FF:F6:B1:1A (OUI DF-A9-FF)
        Count: 1
< ACL Data TX: Handle 2631 flags 0x00 dlen 10             #202 [hci1] 12.471538
      ATT: Find Information Response (0x05) len 5
        Format: UUID-16 (0x01)
        Handle: 0x0033
        UUID: Client Characteristic Configuration (0x2902)
> HCI Event: Number of Completed Packets (0x13) plen 5    #203 [hci1] 12.640799
        Num handles: 1
        Handle: 2631 Address: DF:A9:FF:F6:B1:1A (OUI DF-A9-FF)
        Count: 1
        #202: len 10 (0 Kb/s)
        Latency: 169 msec (82-171 msec ~163 msec)
> ACL Data RX: Handle 2631 flags 0x02 dlen 9              #204 [hci1] 12.641018
      ATT: Find Information Request (0x04) len 4
        Handle range: 0x0036-0x0036
< HCI Command: Host Number of Com.. (0x03|0x0035) plen 5  #205 [hci1] 12.651498
        Num handles: 1
        Handle: 2631 Address: DF:A9:FF:F6:B1:1A (OUI DF-A9-FF)
        Count: 1
< ACL Data TX: Handle 2631 flags 0x00 dlen 10             #206 [hci1] 12.651637
      ATT: Find Information Response (0x05) len 5
        Format: UUID-16 (0x01)
        Handle: 0x0036
        UUID: Client Characteristic Configuration (0x2902)
> HCI Event: Number of Completed Packets (0x13) plen 5    #207 [hci1] 12.815799
        Num handles: 1
        Handle: 2631 Address: DF:A9:FF:F6:B1:1A (OUI DF-A9-FF)
        Count: 1
        #206: len 10 (0 Kb/s)
        Latency: 164 msec (82-171 msec ~163 msec)
> ACL Data RX: Handle 2631 flags 0x02 dlen 9              #208 [hci1] 12.815990
      ATT: Find Information Request (0x04) len 4
        Handle range: 0x003b-0x003b
< HCI Command: Host Number of Com.. (0x03|0x0035) plen 5  #209 [hci1] 12.831489
        Num handles: 1
        Handle: 2631 Address: DF:A9:FF:F6:B1:1A (OUI DF-A9-FF)
        Count: 1
< ACL Data TX: Handle 2631 flags 0x00 dlen 10             #210 [hci1] 12.831582
      ATT: Find Information Response (0x05) len 5
        Format: UUID-16 (0x01)
        Handle: 0x003b
        UUID: Client Characteristic Configuration (0x2902)
> HCI Event: Number of Completed Packets (0x13) plen 5    #211 [hci1] 12.990778
        Num handles: 1
        Handle: 2631 Address: DF:A9:FF:F6:B1:1A (OUI DF-A9-FF)
        Count: 1
        #210: len 10 (0 Kb/s)
        Latency: 159 msec (82-171 msec ~161 msec)
> ACL Data RX: Handle 2631 flags 0x02 dlen 7              #212 [hci1] 12.991007
      ATT: Read Request (0x0a) len 2
        Handle: 0x0027
< HCI Command: Host Number of Com.. (0x03|0x0035) plen 5  #213 [hci1] 13.011076
        Num handles: 1
        Handle: 2631 Address: DF:A9:FF:F6:B1:1A (OUI DF-A9-FF)
        Count: 1
< ACL Data TX: Handle 2631 flags 0x00 dlen 7              #214 [hci1] 13.011159
      ATT: Read Response (0x0b) len 2
> HCI Event: Number of Completed Packets (0x13) plen 5    #215 [hci1] 13.165808
        Num handles: 1
        Handle: 2631 Address: DF:A9:FF:F6:B1:1A (OUI DF-A9-FF)
        Count: 1
        #214: len 7 (0 Kb/s)
        Latency: 154 msec (82-171 msec ~158 msec)
> ACL Data RX: Handle 2631 flags 0x02 dlen 7              #216 [hci1] 13.165898
      ATT: Read Request (0x0a) len 2
        Handle: 0x0026
< HCI Command: Host Number of Com.. (0x03|0x0035) plen 5  #217 [hci1] 13.171512
        Num handles: 1
        Handle: 2631 Address: DF:A9:FF:F6:B1:1A (OUI DF-A9-FF)
        Count: 1
< ACL Data TX: Handle 2631 flags 0x00 dlen 8              #218 [hci1] 13.171651
      ATT: Read Response (0x0b) len 3
> HCI Event: Number of Completed Packets (0x13) plen 5    #219 [hci1] 13.340815
        Num handles: 1
        Handle: 2631 Address: DF:A9:FF:F6:B1:1A (OUI DF-A9-FF)
        Count: 1
        #218: len 8 (0 Kb/s)
        Latency: 169 msec (82-171 msec ~163 msec)
> ACL Data RX: Handle 2631 flags 0x02 dlen 7              #220 [hci1] 13.340937
      ATT: Read Request (0x0a) len 2
        Handle: 0x0027
< HCI Command: Host Number of Com.. (0x03|0x0035) plen 5  #221 [hci1] 13.351462
        Num handles: 1
        Handle: 2631 Address: DF:A9:FF:F6:B1:1A (OUI DF-A9-FF)
        Count: 1
< ACL Data TX: Handle 2631 flags 0x00 dlen 7              #222 [hci1] 13.351510
      ATT: Read Response (0x0b) len 2
> HCI Event: Number of Completed Packets (0x13) plen 5    #223 [hci1] 13.515759
        Num handles: 1
        Handle: 2631 Address: DF:A9:FF:F6:B1:1A (OUI DF-A9-FF)
        Count: 1
        #222: len 7 (0 Kb/s)
        Latency: 164 msec (82-171 msec ~163 msec)
> ACL Data RX: Handle 2631 flags 0x02 dlen 7              #224 [hci1] 13.515925
      ATT: Read Request (0x0a) len 2
        Handle: 0x0032
< HCI Command: Host Number of Com.. (0x03|0x0035) plen 5  #225 [hci1] 13.531455
        Num handles: 1
        Handle: 2631 Address: DF:A9:FF:F6:B1:1A (OUI DF-A9-FF)
        Count: 1
< ACL Data TX: Handle 2631 flags 0x00 dlen 8              #226 [hci1] 13.531547
      ATT: Read Response (0x0b) len 3
> HCI Event: Number of Completed Packets (0x13) plen 5    #227 [hci1] 13.690715
        Num handles: 1
        Handle: 2631 Address: DF:A9:FF:F6:B1:1A (OUI DF-A9-FF)
        Count: 1
        #226: len 8 (0 Kb/s)
        Latency: 159 msec (82-171 msec ~161 msec)
> ACL Data RX: Handle 2631 flags 0x02 dlen 7              #228 [hci1] 13.690969
      ATT: Read Request (0x0a) len 2
        Handle: 0x002a
< HCI Command: Host Number of Com.. (0x03|0x0035) plen 5  #229 [hci1] 13.711316
        Num handles: 1
        Handle: 2631 Address: DF:A9:FF:F6:B1:1A (OUI DF-A9-FF)
        Count: 1
< ACL Data TX: Handle 2631 flags 0x00 dlen 7              #230 [hci1] 13.711452
      ATT: Read Response (0x0b) len 2
> HCI Event: Number of Completed Packets (0x13) plen 5    #231 [hci1] 13.865744
        Num handles: 1
        Handle: 2631 Address: DF:A9:FF:F6:B1:1A (OUI DF-A9-FF)
        Count: 1
        #230: len 7 (0 Kb/s)
        Latency: 154 msec (82-171 msec ~157 msec)
> ACL Data RX: Handle 2631 flags 0x02 dlen 7              #232 [hci1] 13.866022
      ATT: Read Request (0x0a) len 2
        Handle: 0x0029
< HCI Command: Host Number of Com.. (0x03|0x0035) plen 5  #233 [hci1] 13.871478
        Num handles: 1
        Handle: 2631 Address: DF:A9:FF:F6:B1:1A (OUI DF-A9-FF)
        Count: 1
< ACL Data TX: Handle 2631 flags 0x00 dlen 9              #234 [hci1] 13.871656
      ATT: Read Response (0x0b) len 4
> HCI Event: Number of Completed Packets (0x13) plen 5    #235 [hci1] 14.040800
        Num handles: 1
        Handle: 2631 Address: DF:A9:FF:F6:B1:1A (OUI DF-A9-FF)
        Count: 1
        #234: len 9 (0 Kb/s)
        Latency: 169 msec (82-171 msec ~163 msec)
> ACL Data RX: Handle 2631 flags 0x02 dlen 11             #236 [hci1] 14.040949
      ATT: Write Command (0x52) len 6
        Handle: 0x0029
          Data: 00000000
> ACL Data RX: Handle 2631 flags 0x02 dlen 7              #237 [hci1] 14.041264
      ATT: Read Request (0x0a) len 2
        Handle: 0x002a
< HCI Command: Host Number of Com.. (0x03|0x0035) plen 5  #238 [hci1] 14.051482
        Num handles: 1
        Handle: 2631 Address: DF:A9:FF:F6:B1:1A (OUI DF-A9-FF)
        Count: 1
< HCI Command: Host Number of Com.. (0x03|0x0035) plen 5  #239 [hci1] 14.051749
        Num handles: 1
        Handle: 2631 Address: DF:A9:FF:F6:B1:1A (OUI DF-A9-FF)
        Count: 1
< ACL Data TX: Handle 2631 flags 0x00 dlen 7              #240 [hci1] 14.051845
      ATT: Read Response (0x0b) len 2
> HCI Event: Number of Completed Packets (0x13) plen 5    #241 [hci1] 14.215748
        Num handles: 1
        Handle: 2631 Address: DF:A9:FF:F6:B1:1A (OUI DF-A9-FF)
        Count: 1
        #240: len 7 (0 Kb/s)
        Latency: 163 msec (82-171 msec ~163 msec)
> ACL Data RX: Handle 2631 flags 0x02 dlen 7              #242 [hci1] 14.215958
      ATT: Read Request (0x0a) len 2
        Handle: 0x0035
< HCI Command: Host Number of Com.. (0x03|0x0035) plen 5  #243 [hci1] 14.231546
        Num handles: 1
        Handle: 2631 Address: DF:A9:FF:F6:B1:1A (OUI DF-A9-FF)
        Count: 1
< ACL Data TX: Handle 2631 flags 0x00 dlen 9              #244 [hci1] 14.231602
      ATT: Read Response (0x0b) len 4
> HCI Event: Number of Completed Packets (0x13) plen 5    #245 [hci1] 14.390746
        Num handles: 1
        Handle: 2631 Address: DF:A9:FF:F6:B1:1A (OUI DF-A9-FF)
        Count: 1
        #244: len 9 (0 Kb/s)
        Latency: 159 msec (82-171 msec ~161 msec)
> ACL Data RX: Handle 2631 flags 0x02 dlen 11             #246 [hci1] 14.390901
      ATT: Write Command (0x52) len 6
        Handle: 0x0035
          Data: 00000000
> ACL Data RX: Handle 2631 flags 0x02 dlen 7              #247 [hci1] 14.391276
      ATT: Read Request (0x0a) len 2
        Handle: 0x002f
< HCI Command: Host Number of Com.. (0x03|0x0035) plen 5  #248 [hci1] 14.411085
        Num handles: 1
        Handle: 2631 Address: DF:A9:FF:F6:B1:1A (OUI DF-A9-FF)
        Count: 1
< HCI Command: Host Number of Com.. (0x03|0x0035) plen 5  #249 [hci1] 14.411266
        Num handles: 1
        Handle: 2631 Address: DF:A9:FF:F6:B1:1A (OUI DF-A9-FF)
        Count: 1
< ACL Data TX: Handle 2631 flags 0x00 dlen 7              #250 [hci1] 14.411321
      ATT: Read Response (0x0b) len 2
> HCI Event: Number of Completed Packets (0x13) plen 5    #251 [hci1] 14.565741
        Num handles: 1
        Handle: 2631 Address: DF:A9:FF:F6:B1:1A (OUI DF-A9-FF)
        Count: 1
        #250: len 7 (0 Kb/s)
        Latency: 154 msec (82-171 msec ~157 msec)
> ACL Data RX: Handle 2631 flags 0x02 dlen 7              #252 [hci1] 14.565980
      ATT: Read Request (0x0a) len 2
        Handle: 0x002f
< HCI Command: Host Number of Com.. (0x03|0x0035) plen 5  #253 [hci1] 14.571562
        Num handles: 1
        Handle: 2631 Address: DF:A9:FF:F6:B1:1A (OUI DF-A9-FF)
        Count: 1
< ACL Data TX: Handle 2631 flags 0x00 dlen 7              #254 [hci1] 14.571629
      ATT: Read Response (0x0b) len 2
> HCI Event: Number of Completed Packets (0x13) plen 5    #255 [hci1] 14.740591
        Num handles: 1
        Handle: 2631 Address: DF:A9:FF:F6:B1:1A (OUI DF-A9-FF)
        Count: 1
        #254: len 7 (0 Kb/s)
        Latency: 168 msec (82-171 msec ~163 msec)
> HCI Event: Disconnect Complete (0x05) plen 4            #256 [hci1] 16.140899
        Status: Success (0x00)
        Handle: 2631 Address: DF:A9:FF:F6:B1:1A (OUI DF-A9-FF)
        Reason: Remote User Terminated Connection (0x13)
< HCI Command: Reset (0x03|0x0003) plen 0                 #257 [hci1] 20.360989
> HCI Event: Command Complete (0x0e) plen 4               #258 [hci1] 20.361484
      Reset (0x03|0x0003) ncmd 1
        Status: Success (0x00)
@ USER Close: main                                    {0x0001} [hci1] 20.370904
= Close Index: 00:00:00:00:00:00                               [hci1] 20.370912
