Bluetooth monitor ver 5.72
= Note: Linux version 6.14.0-36-generic (x86_64)                       0.994932
= Note: Bluetooth subsystem version 2.22                               0.994934
= New Index: 00:00:00:00:00:00 (Primary,UART,hci2)              [hci2] 0.994935
= New Index: 00:00:00:00:00:00 (Primary,UART,hci1)              [hci1] 0.994936
= New Index: 48:5F:99:8E:E0:64 (Primary,USB,hci0)               [hci0] 0.994936
= Open Index: 00:00:00:00:00:00                                 [hci1] 1.158110
= Index Info: 00:00:00:00:00:00 (Nordic Semiconductor ASA)      [hci1] 1.158117
@ USER Open: main (privileged) version 2.22            {0x0001} [hci1] 1.158120
< HCI Command: Reset (0x03|0x0003) plen 0                    #1 [hci1] 1.158578
> HCI Event: Command Complete (0x0e) plen 4                  #2 [hci1] 1.159085
      Reset (0x03|0x0003) ncmd 1
        Status: Success (0x00)
< HCI Command: Read Local Supported... (0x04|0x0003) plen 0  #3 [hci1] 1.178053
> HCI Event: Command Complete (0x0e) plen 12                 #4 [hci1] 1.178569
      Read Local Supported Features (0x04|0x0003) ncmd 1
        Status: Success (0x00)
        Features: 0x00 0x00 0x00 0x00 0x60 0x00 0x00 0x00
          BR/EDR Not Supported
          LE Supported (Controller)
< HCI Command: Read Local Version In.. (0x04|0x0001) plen 0  #5 [hci1] 1.198103
> HCI Event: Command Complete (0x0e) plen 12                 #6 [hci1] 1.198654
      Read Local Version Information (0x04|0x0001) ncmd 1
        Status: Success (0x00)
        HCI version: Reserved (0x0f) - Revision 12393 (0x3069)
        LMP version: Reserved (0x0f) - Subversion 12393 (0x3069)
        Manufacturer: Nordic Semiconductor ASA (89)
< HCI Command: Read Local Supported... (0x04|0x0002) plen 0  #7 [hci1] 1.218087
> HCI Event: Command Complete (0x0e) plen 68                 #8 [hci1] 1.219174
      Read Local Supported Commands (0x04|0x0002) ncmd 1
        Status: Success (0x00)
        Commands: 119 entries
          Disconnect (Octet 0 - Bit 5)
          Read Remote Version Information (Octet 2 - Bit 7)
          Set Event Mask (Octet 5 - Bit 6)
          Reset (Octet 5 - Bit 7)
          Read Connection Accept Timeout (Octet 7 - Bit 2)
          Write Connection Accept Timeout (Octet 7 - Bit 3)
          Read Transmit Power Level (Octet 10 - Bit 2)
          Set Controller To Host Flow Control (Octet 10 - Bit 5)
          Host Buffer Size (Octet 10 - Bit 6)
          Host Number of Completed Packets (Octet 10 - Bit 7)
          Read Local Version Information (Octet 14 - Bit 3)
          Read Local Supported Features (Octet 14 - Bit 5)
          Read BD ADDR (Octet 15 - Bit 1)
          Read RSSI (Octet 15 - Bit 5)
          Set Event Mask Page 2 (Octet 22 - Bit 2)
          LE Set Event Mask (Octet 25 - Bit 0)
          LE Read Buffer Size (Octet 25 - Bit 1)
          LE Read Local Supported Features (Octet 25 - Bit 2)
          LE Set Random Address (Octet 25 - Bit 4)
          LE Set Advertising Parameters (Octet 25 - Bit 5)
          LE Read Advertising Channel TX Power (Octet 25 - Bit 6)
          LE Set Advertising Data (Octet 25 - Bit 7)
          LE Set Scan Response Data (Octet 26 - Bit 0)
          LE Set Advertise Enable (Octet 26 - Bit 1)
          LE Set Scan Parameters (Octet 26 - Bit 2)
          LE Set Scan Enable (Octet 26 - Bit 3)
          LE Create Connection (Octet 26 - Bit 4)
          LE Create Connection Cancel (Octet 26 - Bit 5)
          LE Read Accept List Size (Octet 26 - Bit 6)
          LE Clear Accept List (Octet 26 - Bit 7)
          LE Add Device To Accept List (Octet 27 - Bit 0)
          LE Remove Device From Accept List (Octet 27 - Bit 1)
          LE Connection Update (Octet 27 - Bit 2)
          LE Set Host Channel Classification (Octet 27 - Bit 3)
          LE Read Channel Map (Octet 27 - Bit 4)
          LE Read Remote Used Features (Octet 27 - Bit 5)
          LE Encrypt (Octet 27 - Bit 6)
          LE Rand (Octet 27 - Bit 7)
          LE Start Encryption (Octet 28 - Bit 0)
          LE Long Term Key Request Reply (Octet 28 - Bit 1)
          LE Long Term Key Request Neg Reply (Octet 28 - Bit 2)
          LE Read Supported States (Octet 28 - Bit 3)
          LE Receiver Test (Octet 28 - Bit 4)
          LE Transmitter Test (Octet 28 - Bit 5)
          LE Test End (Octet 28 - Bit 6)
          Read Authenticated Payload Timeout (Octet 32 - Bit 4)
          Write Authenticated Payload Timeout (Octet 32 - Bit 5)
          LE Set Data Length (Octet 33 - Bit 6)
          LE Read Suggested Default Data Length (Octet 33 - Bit 7)
          LE Write Suggested Default Data Length (Octet 34 - Bit 0)
          LE Add Device To Resolving List (Octet 34 - Bit 3)
          LE Remove Device From Resolving List (Octet 34 - Bit 4)
          LE Clear Resolving List (Octet 34 - Bit 5)
          LE Read Resolving List Size (Octet 34 - Bit 6)
          LE Set Address Resolution Enable (Octet 35 - Bit 1)
          LE Set Resolvable Private Address Timeout (Octet 35 - Bit 2)
          LE Read Maximum Data Length (Octet 35 - Bit 3)
          LE Read PHY (Octet 35 - Bit 4)
          LE Set Default PHY (Octet 35 - Bit 5)
          LE Set PHY (Octet 35 - Bit 6)
          LE Enhanced Receiver Test (Octet 35 - Bit 7)
          LE Enhanced Transmitter Test (Octet 36 - Bit 0)
          LE Set Advertising Set Random Address (Octet 36 - Bit 1)
          LE Set Extended Advertising Parameters (Octet 36 - Bit 2)
          LE Set Extended Advertising Data (Octet 36 - Bit 3)
          LE Set Extended Scan Response Data (Octet 36 - Bit 4)
          LE Set Extended Advertising Enable (Octet 36 - Bit 5)
          LE Read Maximum Advertising Data Length (Octet 36 - Bit 6)
          LE Read Number of Supported Advertising Sets (Octet 36 - Bit 7)
          LE Remove Advertising Set (Octet 37 - Bit 0)
          LE Clear Advertising Sets (Octet 37 - Bit 1)
          LE Set Periodic Advertising Parameters (Octet 37 - Bit 2)
          LE Set Periodic Advertising Data (Octet 37 - Bit 3)
          LE Set Periodic Advertising Enable (Octet 37 - Bit 4)
          LE Set Extended Scan Parameters (Octet 37 - Bit 5)
          LE Set Extended Scan Enable (Octet 37 - Bit 6)
          LE Extended Create Connection (Octet 37 - Bit 7)
          LE Periodic Advertising Create Sync (Octet 38 - Bit 0)
          LE Periodic Advertising Create Sync Cancel (Octet 38 - Bit 1)
          LE Periodic Advertising Terminate Sync (Octet 38 - Bit 2)
          LE Add Device To Periodic Advertiser List (Octet 38 - Bit 3)
          LE Remove Device From Periodic Advertiser List (Octet 38 - Bit 4)
          LE Clear Periodic Advertiser List (Octet 38 - Bit 5)
          LE Read Periodic Advertiser List Size (Octet 38 - Bit 6)
          LE Read Transmit Power (Octet 38 - Bit 7)
          LE Read RF Path Compensation (Octet 39 - Bit 0)
          LE Write RF Path Compensation (Octet 39 - Bit 1)
          LE Set Privacy Mode (Octet 39 - Bit 2)
          LE Periodic Advertising Receive Enable (Octet 40 - Bit 5)
          LE Periodic Advertising Sync Transfer (Octet 40 - Bit 6)
          LE Periodic Advertising Set Info Transfer (Octet 40 - Bit 7)
          LE Periodic Advertising Sync Transfer Parameters (Octet 41 - Bit 0)
          LE Set Default Periodic Advertisng Sync Transfer Parameters (Octet 41 - Bit 1)
          LE Read Buffer v2 (Octet 41 - Bit 5)
          LE Read ISO TX Sync (Octet 41 - Bit 6)
          LE Set Connected Isochronous Group Parameters (Octet 41 - Bit 7)
          LE Set Connected Isochronous Group Parameters Test (Octet 42 - Bit 0)
          LE Create Connected Isochronous Stream (Octet 42 - Bit 1)
          LE Remove Connected Isochronous Group (Octet 42 - Bit 2)
          LE Accept Connected Isochronous Stream Request (Octet 42 - Bit 3)
          LE Reject Connected Isochronous Stream Request (Octet 42 - Bit 4)
          LE Create Broadcast Isochronous Group (Octet 42 - Bit 5)
          LE Create Broadcast Isochronous Group Test (Octet 42 - Bit 6)
          LE Terminate Broadcast Isochronous Group (Octet 42 - Bit 7)
          LE Broadcast Isochronous Group Create Sync (Octet 43 - Bit 0)
          LE Broadcast Isochronous Group Terminate Sync (Octet 43 - Bit 1)
          LE Request Peer SCA (Octet 43 - Bit 2)
          LE Setup Isochronous Data Path (Octet 43 - Bit 3)
          LE Remove Isochronous Data Path (Octet 43 - Bit 4)
          LE Isochronous Transmit Test (Octet 43 - Bit 5)
          LE Isochronous Receive Test (Octet 43 - Bit 6)
          LE Isochronous Read Test Counters (Octet 43 - Bit 7)
          LE Isochronous Read Test Counters (Octet 44 - Bit 0)
          LE Set Host Feature (Octet 44 - Bit 1)
          Octet 44 - Bit 2 
          Octet 45 - Bit 6 
          Octet 46 - Bit 0 
          Octet 46 - Bit 1 
          Octet 46 - Bit 2 
< HCI Command: Host Buffer Size (0x03|0x0033) plen 7         #9 [hci1] 1.238101
        ACL MTU: 255  ACL max packet: 16
        SCO MTU: 0    SCO max packet: 0
> HCI Event: Command Complete (0x0e) plen 4                 #10 [hci1] 1.238597
      Host Buffer Size (0x03|0x0033) ncmd 1
        Status: Success (0x00)
< HCI Command: Set Controller To Ho.. (0x03|0x0031) plen 1  #11 [hci1] 1.258094
        Flow control: ACL Data Packets (0x01)
> HCI Event: Command Complete (0x0e) plen 4                 #12 [hci1] 1.258558
      Set Controller To Host Flow Control (0x03|0x0031) ncmd 1
        Status: Success (0x00)
< HCI Command: LE Read Local Suppor.. (0x08|0x0003) plen 0  #13 [hci1] 1.278098
> HCI Event: Command Complete (0x0e) plen 12                #14 [hci1] 1.278687
      LE Read Local Supported Features (0x08|0x0003) ncmd 1
        Status: Success (0x00)
        Features: 0xfd 0x79 0x00 0xf7 0x30 0x01 0x00 0x00
          LE Encryption
          Extended Reject Indication
          Peripheral-initiated Features Exchange
          LE Ping
          LE Data Packet Length Extension
          LL Privacy
          Extended Scanner Filter Policies
          LE 2M PHY
          LE Coded PHY
          LE Extended Advertising
          LE Periodic Advertising
          Channel Selection Algorithm #2
          Periodic Advertising Sync Transfer - Sender
          Periodic Advertising Sync Transfer - Recipient
          Sleep Clock Accuracy Updates
          Connected Isochronous Stream - Central
          Connected Isochronous Stream - Peripheral
          Isochronous Broadcaster
          Synchronized Receiver
          Periodic Advertising ADI support
          Connection Subrating
          Unknown features (0x0000010000000000)
< HCI Command: LE Set Host Feature (0x08|0x0074) plen 2     #15 [hci1] 1.298129
        Bit Number: 32
          Connected Isochronous Stream (Host Support)
        Bit Value: 1
> HCI Event: Command Complete (0x0e) plen 4                 #16 [hci1] 1.298672
      LE Set Host Feature (0x08|0x0074) ncmd 1
        Status: Success (0x00)
< HCI Command: LE Read Buffer v2 (0x08|0x0060) plen 0       #17 [hci1] 1.318094
> HCI Event: Command Complete (0x0e) plen 10                #18 [hci1] 1.318595
      LE Read Buffer v2 (0x08|0x0060) ncmd 1
        Status: Success (0x00)
        ACL MTU: 27
        ACL max packet: 3
        ISO MTU: 318
        ISO max packet: 3
< HCI Command: LE Read Maximum Adve.. (0x08|0x003a) plen 0  #19 [hci1] 1.338133
> HCI Event: Command Complete (0x0e) plen 6                 #20 [hci1] 1.338541
      LE Read Maximum Advertising Data Length (0x08|0x003a) ncmd 1
        Status: Success (0x00)
        Max length: 1650
< HCI Command: LE Read Supported St.. (0x08|0x001c) plen 0  #21 [hci1] 1.358086
> HCI Event: Command Complete (0x0e) plen 12                #22 [hci1] 1.358615
      LE Read Supported States (0x08|0x001c) ncmd 1
        Status: Success (0x00)
        States: 0x000003ff3e0306ff
          Non-connectable Advertising State
          Scannable Advertising State
          Connectable Advertising State
          High Duty Cycle Directed Advertising State
          Passive Scanning State
          Active Scanning State
          Initiating State
            and Connection State (Central Role)
          Connection State (Peripheral Role)
          Scannable Advertising State
            and Passive Scanning State
          Connectable Advertising State
            and Passive Scanning State
          Non-connectable Advertising State
            and Initiating State
          Scannable Advertising State
            and Initiating State
          Active Scanning State
            and Connection State (Central Role)
          Passive Scanning State
            and Connection State (Peripheral Role)
          Active Scanning State
            and Connection State (Peripheral Role)
          Initiating State
            and Connection State (Central Role)
            and Central Role & Central Role
          Low Duty Cycle Directed Advertising State
          Connectable Advertising State
            and Initiating State
            and Central Role & Peripheral Role
          High Duty Cycle Directed Advertising State
            and Initiating State
            and Central Role & Peripheral Role
          Low Duty Cycle Directed Advertising State
            and Initiating State
            and Central Role & Peripheral Role
          Connectable Advertising State
            and Connection State (Central Role)
            and Central Role & Peripheral Role
          High Duty Cycle Directed Advertising State
            and Connection State (Central Role)
            and Central Role & Peripheral Role
          Low Duty Cycle Directed Advertising State
            and Connection State (Central Role)
            and Central Role & Peripheral Role
          Connectable Advertising State
            and Connection State (Peripheral Role)
            and Central Role & Peripheral Role
          High Duty Cycle Directed Advertising State
            and Connection State (Peripheral Role)
            and Peripheral Role & Peripheral Role
          Low Duty Cycle Directed Advertising State
            and Connection State (Peripheral Role)
            and Peripheral Role & Peripheral Role
          Initiating State
            and Connection State (Peripheral Role)
            and Central Role & Peripheral Role
< HCI Command: LE Read Maximum Data.. (0x08|0x002f) plen 0  #23 [hci1] 1.378132
> HCI Event: Command Complete (0x0e) plen 12                #24 [hci1] 1.378677
      LE Read Maximum Data Length (0x08|0x002f) ncmd 1
        Status: Success (0x00)
        Max TX octets: 251
        Max TX time: 2704
        Max RX octets: 251
        Max RX time: 2704
< HCI Command: LE Write Suggested D.. (0x08|0x0024) plen 4  #25 [hci1] 1.398126
        TX octets: 251
        TX time: 2704
> HCI Event: Command Complete (0x0e) plen 4                 #26 [hci1] 1.398671
      LE Write Suggested Default Data Length (0x08|0x0024) ncmd 1
        Status: Success (0x00)
< HCI Command: LE Read Resolving Li.. (0x08|0x002a) plen 0  #27 [hci1] 1.418096
> HCI Event: Command Complete (0x0e) plen 5                 #28 [hci1] 1.418558
      LE Read Resolving List Size (0x08|0x002a) ncmd 1
        Status: Success (0x00)
        Size: 8
< HCI Command: LE Set Event Mask (0x08|0x0001) plen 8       #29 [hci1] 1.438053
        Mask: 0x000002023f87fa5e
          LE Advertising Report
          LE Connection Update Complete
          LE Read Remote Used Features Complete
          LE Long Term Key Request
          LE Data Length Change
          LE Enhanced Connection Complete
          LE PHY Update Complete
          LE Extended Advertising Report
          LE Periodic Advertising Sync Established
          LE Periodic Advertising Report
          LE Periodic Advertising Sync Lost
          LE Extended Scan Timeout
          LE Extended Advertising Set Terminated
          LE Scan Request Received
          LE Periodic Advertising Sync Transfer Rvc
          LE CIS Established
          LE CIS Request
          LE Create BIG Complete
          LE Terminate BIG Complete
          LE BIG Sync Estabilished Complete
          LE BIG Sync Lost
          LE BIG Info Advertising Report
          Unknown mask (0x0000020000000000)
> HCI Event: Command Complete (0x0e) plen 4                 #30 [hci1] 1.438590
      LE Set Event Mask (0x08|0x0001) ncmd 1
        Status: Success (0x00)
< HCI Command: Set Event Mask (0x03|0x0001) plen 8          #31 [hci1] 1.458117
        Mask: 0x2000800002008890
          Disconnection Complete
          Encryption Change
          Read Remote Version Information Complete
          Hardware Error
          Data Buffer Overflow
          Encryption Key Refresh Complete
          LE Meta
> HCI Event: Command Complete (0x0e) plen 4                 #32 [hci1] 1.458736
      Set Event Mask (0x03|0x0001) ncmd 1
        Status: Success (0x00)
< HCI Command: Read BD ADDR (0x04|0x0009) plen 0            #33 [hci1] 1.478103
> HCI Event: Command Complete (0x0e) plen 10                #34 [hci1] 1.478697
      Read BD ADDR (0x04|0x0009) ncmd 1
        Status: Success (0x00)
        Address: 00:00:00:00:00:00 (OUI 00-00-00)
< HCI Command: LE Set Random Address (0x08|0x0005) plen 6   #35 [hci1] 1.498109
        Address: D5:B6:CC:31:DB:3B (Static)
> HCI Event: Command Complete (0x0e) plen 4                 #36 [hci1] 1.498689
      LE Set Random Address (0x08|0x0005) ncmd 1
        Status: Success (0x00)
< HCI Command: LE Extended Create... (0x08|0x0043) plen 26  #37 [hci1] 3.738556
        Filter policy: Accept list is not used (0x00)
        Own address type: Random (0x01)
        Peer address type: Public (0x00)
        Peer address: DF:A9:FF:F6:B1:1A (OUI DF-A9-FF)
        Initiating PHYs: 0x01
        Entry 0: LE 1M
          Scan interval: 60.000 msec (0x0060)
          Scan window: 60.000 msec (0x0060)
          Min connection interval: 30.00 msec (0x0018)
          Max connection interval: 50.00 msec (0x0028)
          Connection latency: 0 (0x0000)
          Supervision timeout: 4000 msec (0x0190)
          Min connection length: 0.000 msec (0x0000)
          Max connection length: 0.000 msec (0x0000)
> HCI Event: Command Status (0x0f) plen 4                   #38 [hci1] 3.739660
      LE Extended Create Connection (0x08|0x0043) ncmd 1
        Status: Success (0x00)
> HCI Event: LE Meta Event (0x3e) plen 31                   #39 [hci1] 3.800026
      LE Enhanced Connection Complete (0x0a)
        Status: Success (0x00)
        Handle: 2340
        Role: Central (0x00)
        Peer address type: Public (0x00)
        Peer address: DF:A9:FF:F6:B1:1A (OUI DF-A9-FF)
        Local resolvable private address: 00:00:00:00:00:00 (Non-Resolvable)
        Peer resolvable private address: 00:00:00:00:00:00 (Non-Resolvable)
        Connection interval: 50.00 msec (0x0028)
        Connection latency: 0 (0x0000)
        Supervision timeout: 4000 msec (0x0190)
        Central clock accuracy: 0x00
< HCI Command: LE Read Remote Used... (0x08|0x0016) plen 2  #40 [hci1] 3.818287
        Handle: 2340 Address: DF:A9:FF:F6:B1:1A (OUI DF-A9-FF)
> HCI Event: Command Status (0x0f) plen 4                   #41 [hci1] 3.818825
      LE Read Remote Used Features (0x08|0x0016) ncmd 1
        Status: Success (0x00)
< HCI Command: LE Set PHY (0x08|0x0032) plen 7              #42 [hci1] 3.838257
        Handle: 2340 Address: DF:A9:FF:F6:B1:1A (OUI DF-A9-FF)
        All PHYs preference: 0x00
        TX PHYs preference: 0x02
          LE 2M
        RX PHYs preference: 0x02
          LE 2M
        PHY options preference: Reserved (0x0000)
> HCI Event: Command Status (0x0f) plen 4                   #43 [hci1] 3.838784
      LE Set PHY (0x08|0x0032) ncmd 1
        Status: Success (0x00)
> HCI Event: LE Meta Event (0x3e) plen 12                   #44 [hci1] 3.951358
      LE Read Remote Used Features (0x04)
        Status: Success (0x00)
        Handle: 2340 Address: DF:A9:FF:F6:B1:1A (OUI DF-A9-FF)
        Features: 0x2d 0x49 0x00 0xf7 0x67 0xd9 0x00 0x80
          LE Encryption
          Extended Reject Indication
          Peripheral-initiated Features Exchange
          LE Data Packet Length Extension
          LE 2M PHY
          LE Coded PHY
          Channel Selection Algorithm #2
          Periodic Advertising Sync Transfer - Sender
          Periodic Advertising Sync Transfer - Recipient
          Sleep Clock Accuracy Updates
          Connected Isochronous Stream - Central
          Connected Isochronous Stream - Peripheral
          Isochronous Broadcaster
          Synchronized Receiver
          Connected Isochronous Stream (Host Support)
          LE Power Control Request
          LE Power Control Request
          Connection Subrating
          Connection Subrating (Host Support)
          Unknown features (0x8000d90000000000)
> HCI Event: LE Meta Event (0x3e) plen 6                    #45 [hci1] 4.450916
      LE PHY Update Complete (0x0c)
        Status: Success (0x00)
        Handle: 2340 Address: DF:A9:FF:F6:B1:1A (OUI DF-A9-FF)
        TX PHY: LE 2M (0x02)
        RX PHY: LE 2M (0x02)
< ACL Data TX: Handle 2340 flags 0x00 dlen 11               #46 [hci1] 4.878205
      SMP: Pairing Request (0x01) len 6
        IO capability: KeyboardDisplay (0x04)
        OOB data: Authentication data not present (0x00)
        Authentication requirement: No bonding, No MITM, SC, No Keypresses (0x08)
        Max encryption key size: 16
        Initiator key distribution: <none> (0x00)
        Responder key distribution: <none> (0x00)
> HCI Event: Number of Completed Packets (0x13) plen 5      #47 [hci1] 4.901226
        Num handles: 1
        Handle: 2340 Address: DF:A9:FF:F6:B1:1A (OUI DF-A9-FF)
        Count: 1
        #46: len 11 (3 Kb/s)
        Latency: 23 msec (23-23 msec ~23 msec)
> ACL Data RX: Handle 2340 flags 0x02 dlen 11               #48 [hci1] 4.951288
      SMP: Pairing Response (0x02) len 6
        IO capability: KeyboardOnly (0x02)
        OOB data: Authentication data not present (0x00)
        Authentication requirement: Bonding, MITM, SC, No Keypresses (0xcd)
        Max encryption key size: 16
        Initiator key distribution: <none> (0x00)
        Responder key distribution: <none> (0x00)
< HCI Command: Host Number of Compl.. (0x03|0x0035) plen 5  #49 [hci1] 4.958449
        Num handles: 1
        Handle: 2340 Address: DF:A9:FF:F6:B1:1A (OUI DF-A9-FF)
        Count: 1
< ACL Data TX: Handle 2340 flags 0x00 dlen 27               #50 [hci1] 4.958507
< ACL Data TX: Handle 2340 flags 0x01 dlen 27               #51 [hci1] 4.958528
< ACL Data TX: Handle 2340 flags 0x01 dlen 15               #52 [hci1] 4.958584
      SMP: Pairing Public Key (0x0c) len 64
        X: 98308440221e2d910f0e54b71e7ec652857aa9b5a0dc65028824cc19db1226e9
        Y: 67a4816bcb62efb21701e31fdb27561a6217575fb007a8bbdabe7e28b6f68482
> HCI Event: Number of Completed Packets (0x13) plen 5      #53 [hci1] 5.001175
        Num handles: 1
        Handle: 2340 Address: DF:A9:FF:F6:B1:1A (OUI DF-A9-FF)
        Count: 1
        #50: len 27 (5 Kb/s)
        Latency: 42 msec (23-42 msec ~32 msec)
> HCI Event: Number of Completed Packets (0x13) plen 5      #54 [hci1] 5.001641
        Num handles: 1
        Handle: 2340 Address: DF:A9:FF:F6:B1:1A (OUI DF-A9-FF)
        Count: 1
        #51: len 27 (5 Kb/s)
        Latency: 43 msec (23-43 msec ~37 msec)
> HCI Event: Number of Completed Packets (0x13) plen 5      #55 [hci1] 5.002181
        Num handles: 1
        Handle: 2340 Address: DF:A9:FF:F6:B1:1A (OUI DF-A9-FF)
        Count: 1
        #52: len 15 (2 Kb/s)
        Latency: 43 msec (23-43 msec ~40 msec)
> ACL Data RX: Handle 2340 flags 0x02 dlen 27               #56 [hci1] 5.051450
> ACL Data RX: Handle 2340 flags 0x01 dlen 27               #57 [hci1] 5.051877
> ACL Data RX: Handle 2340 flags 0x01 dlen 15               #58 [hci1] 5.052343
      SMP: Pairing Public Key (0x0c) len 64
        X: 7ef7e7da3364919311781f9a907e94c9507edd730b7578b314f31c5bdc69e210
        Y: 6ad52e7959fc10b77429eaec49033293f6adff2713939411d2fcda462c754a5c
< HCI Command: Host Number of Compl.. (0x03|0x0035) plen 5  #59 [hci1] 5.058326
        Num handles: 1
        Handle: 2340 Address: DF:A9:FF:F6:B1:1A (OUI DF-A9-FF)
        Count: 1
< HCI Command: Host Number of Compl.. (0x03|0x0035) plen 5  #60 [hci1] 5.058478
        Num handles: 1
        Handle: 2340 Address: DF:A9:FF:F6:B1:1A (OUI DF-A9-FF)
        Count: 1
< HCI Command: Host Number of Compl.. (0x03|0x0035) plen 5  #61 [hci1] 5.058719
        Num handles: 1
        Handle: 2340 Address: DF:A9:FF:F6:B1:1A (OUI DF-A9-FF)
        Count: 1
< ACL Data TX: Handle 2340 flags 0x00 dlen 21               #62 [hci1] 5.058835
      SMP: Pairing Confirm (0x03) len 16
        Confim value: 3cb321124c87e3523211c32c8e641a4b
> HCI Event: Number of Completed Packets (0x13) plen 5      #63 [hci1] 5.101280
        Num handles: 1
        Handle: 2340 Address: DF:A9:FF:F6:B1:1A (OUI DF-A9-FF)
        Count: 1
        #62: len 21 (4 Kb/s)
        Latency: 42 msec (23-43 msec ~41 msec)
> ACL Data RX: Handle 2340 flags 0x02 dlen 21               #64 [hci1] 5.951470
      SMP: Pairing Confirm (0x03) len 16
        Confim value: cf699a4adf3f12c75eb48fe6f05272e9
< HCI Command: Host Number of Compl.. (0x03|0x0035) plen 5  #65 [hci1] 5.958576
        Num handles: 1
        Handle: 2340 Address: DF:A9:FF:F6:B1:1A (OUI DF-A9-FF)
        Count: 1
< ACL Data TX: Handle 2340 flags 0x00 dlen 21               #66 [hci1] 5.958736
      SMP: Pairing Random (0x04) len 16
        Random value: 8e6108f966a694cbe26df70bb96773e6
> HCI Event: Number of Completed Packets (0x13) plen 5      #67 [hci1] 6.001206
        Num handles: 1
        Handle: 2340 Address: DF:A9:FF:F6:B1:1A (OUI DF-A9-FF)
        Count: 1
        #66: len 21 (4 Kb/s)
        Latency: 42 msec (23-43 msec ~42 msec)
> ACL Data RX: Handle 2340 flags 0x02 dlen 21               #68 [hci1] 6.251400
      SMP: Pairing Random (0x04) len 16
        Random value: 35db3a2efea657fd2767189adbd5f448
< HCI Command: Host Number of Compl.. (0x03|0x0035) plen 5  #69 [hci1] 6.258861
        Num handles: 1
        Handle: 2340 Address: DF:A9:FF:F6:B1:1A (OUI DF-A9-FF)
        Count: 1
< ACL Data TX: Handle 2340 flags 0x00 dlen 21               #70 [hci1] 6.259019
      SMP: Pairing Confirm (0x03) len 16
        Confim value: f3efdb3fd0111a73735a5a597854b035
> HCI Event: Number of Completed Packets (0x13) plen 5      #71 [hci1] 6.301165
        Num handles: 1
        Handle: 2340 Address: DF:A9:FF:F6:B1:1A (OUI DF-A9-FF)
        Count: 1
        #70: len 21 (4 Kb/s)
        Latency: 42 msec (23-43 msec ~42 msec)
> ACL Data RX: Handle 2340 flags 0x02 dlen 21               #72 [hci1] 6.351417
      SMP: Pairing Confirm (0x03) len 16
        Confim value: 9ede8a02c9ca8adb47a137d07cbf7bf4
< HCI Command: Host Number of Compl.. (0x03|0x0035) plen 5  #73 [hci1] 6.358670
        Num handles: 1
        Handle: 2340 Address: DF:A9:FF:F6:B1:1A (OUI DF-A9-FF)
        Count: 1
< ACL Data TX: Handle 2340 flags 0x00 dlen 21               #74 [hci1] 6.358740
      SMP: Pairing Random (0x04) len 16
        Random value: 4d02679f89a05211af56d8b3da64d21e
> HCI Event: Number of Completed Packets (0x13) plen 5      #75 [hci1] 6.401213
        Num handles: 1
        Handle: 2340 Address: DF:A9:FF:F6:B1:1A (OUI DF-A9-FF)
        Count: 1
        #74: len 21 (4 Kb/s)
        Latency: 42 msec (23-43 msec ~42 msec)
> ACL Data RX: Handle 2340 flags 0x02 dlen 21               #76 [hci1] 6.651398
      SMP: Pairing Random (0x04) len 16
        Random value: ba856b6844b1df79f6904e0f55339440
< HCI Command: Host Number of Compl.. (0x03|0x0035) plen 5  #77 [hci1] 6.658819
        Num handles: 1
        Handle: 2340 Address: DF:A9:FF:F6:B1:1A (OUI DF-A9-FF)
        Count: 1
< ACL Data TX: Handle 2340 flags 0x00 dlen 21               #78 [hci1] 6.658917
      SMP: Pairing Confirm (0x03) len 16
        Confim value: 00238bbf99e81c2a0aa26dcda412dc89
> HCI Event: Number of Completed Packets (0x13) plen 5      #79 [hci1] 6.701181
        Num handles: 1
        Handle: 2340 Address: DF:A9:FF:F6:B1:1A (OUI DF-A9-FF)
        Count: 1
        #78: len 21 (4 Kb/s)
        Latency: 42 msec (23-43 msec ~42 msec)
> ACL Data RX: Handle 2340 flags 0x02 dlen 21               #80 [hci1] 6.751362
      SMP: Pairing Confirm (0x03) len 16
        Confim value: 7c5f04f5acd32ebbd5023cf7825174c1
< HCI Command: Host Number of Compl.. (0x03|0x0035) plen 5  #81 [hci1] 6.758604
        Num handles: 1
        Handle: 2340 Address: DF:A9:FF:F6:B1:1A (OUI DF-A9-FF)
        Count: 1
< ACL Data TX: Handle 2340 flags 0x00 dlen 21               #82 [hci1] 6.758705
      SMP: Pairing Random (0x04) len 16
        Random value: 5e8286bc235a02440d0c3424a2acf8fd
> HCI Event: Number of Completed Packets (0x13) plen 5      #83 [hci1] 6.801199
        Num handles: 1
        Handle: 2340 Address: DF:A9:FF:F6:B1:1A (OUI DF-A9-FF)
        Count: 1
        #82: len 21 (4 Kb/s)
        Latency: 42 msec (23-43 msec ~42 msec)
> ACL Data RX: Handle 2340 flags 0x02 dlen 21               #84 [hci1] 7.051357
      SMP: Pairing Random (0x04) len 16
        Random value: 7228f4f4da8600e828cd07ff4e511557
< HCI Command: Host Number of Compl.. (0x03|0x0035) plen 5  #85 [hci1] 7.058742
        Num handles: 1
        Handle: 2340 Address: DF:A9:FF:F6:B1:1A (OUI DF-A9-FF)
        Count: 1
< ACL Data TX: Handle 2340 flags 0x00 dlen 21               #86 [hci1] 7.058865
      SMP: Pairing Confirm (0x03) len 16
        Confim value: f8e0581ddadb3d90b7547c5c750cb5a4
> HCI Event: Number of Completed Packets (0x13) plen 5      #87 [hci1] 7.101222
        Num handles: 1
        Handle: 2340 Address: DF:A9:FF:F6:B1:1A (OUI DF-A9-FF)
        Count: 1
        #86: len 21 (4 Kb/s)
        Latency: 42 msec (23-43 msec ~42 msec)
> ACL Data RX: Handle 2340 flags 0x02 dlen 21               #88 [hci1] 7.151456
      SMP: Pairing Confirm (0x03) len 16
        Confim value: d4a55fd1a1326e88fcd20eca5da16082
< HCI Command: Host Number of Compl.. (0x03|0x0035) plen 5  #89 [hci1] 7.158699
        Num handles: 1
        Handle: 2340 Address: DF:A9:FF:F6:B1:1A (OUI DF-A9-FF)
        Count: 1
< ACL Data TX: Handle 2340 flags 0x00 dlen 21               #90 [hci1] 7.158804
      SMP: Pairing Random (0x04) len 16
        Random value: 5c4a1bcadd27bd58e945097b00bad7ac
> HCI Event: Number of Completed Packets (0x13) plen 5      #91 [hci1] 7.201197
        Num handles: 1
        Handle: 2340 Address: DF:A9:FF:F6:B1:1A (OUI DF-A9-FF)
        Count: 1
        #90: len 21 (4 Kb/s)
        Latency: 42 msec (23-43 msec ~42 msec)
> ACL Data RX: Handle 2340 flags 0x02 dlen 21               #92 [hci1] 7.451419
      SMP: Pairing Random (0x04) len 16
        Random value: e1ad915d1486f94b873849862aeaa27d
< HCI Command: Host Number of Compl.. (0x03|0x0035) plen 5  #93 [hci1] 7.458467
        Num handles: 1
        Handle: 2340 Address: DF:A9:FF:F6:B1:1A (OUI DF-A9-FF)
        Count: 1
< ACL Data TX: Handle 2340 flags 0x00 dlen 21               #94 [hci1] 7.458512
      SMP: Pairing Confirm (0x03) len 16
        Confim value: faa6e09a2eb0da937e12bf9e74ebf9c7
> HCI Event: Number of Completed Packets (0x13) plen 5      #95 [hci1] 7.501328
        Num handles: 1
        Handle: 2340 Address: DF:A9:FF:F6:B1:1A (OUI DF-A9-FF)
        Count: 1
        #94: len 21 (4 Kb/s)
        Latency: 42 msec (23-43 msec ~42 msec)
> ACL Data RX: Handle 2340 flags 0x02 dlen 21               #96 [hci1] 7.551475
      SMP: Pairing Confirm (0x03) len 16
        Confim value: f7211e13106e2e83c31ec02087741076
< HCI Command: Host Number of Compl.. (0x03|0x0035) plen 5  #97 [hci1] 7.558712
        Num handles: 1
        Handle: 2340 Address: DF:A9:FF:F6:B1:1A (OUI DF-A9-FF)
        Count: 1
< ACL Data TX: Handle 2340 flags 0x00 dlen 21               #98 [hci1] 7.558824
      SMP: Pairing Random (0x04) len 16
        Random value: 32527e6e64e79f33b2e374394db8ab2d
> HCI Event: Number of Completed Packets (0x13) plen 5      #99 [hci1] 7.601235
        Num handles: 1
        Handle: 2340 Address: DF:A9:FF:F6:B1:1A (OUI DF-A9-FF)
        Count: 1
        #98: len 21 (4 Kb/s)
        Latency: 42 msec (23-43 msec ~42 msec)
> ACL Data RX: Handle 2340 flags 0x02 dlen 21              #100 [hci1] 7.851363
      SMP: Pairing Random (0x04) len 16
        Random value: 540384c2c538cb2becd91bf33a73f838
< HCI Command: Host Number of Comp.. (0x03|0x0035) plen 5  #101 [hci1] 7.858820
        Num handles: 1
        Handle: 2340 Address: DF:A9:FF:F6:B1:1A (OUI DF-A9-FF)
        Count: 1
< ACL Data TX: Handle 2340 flags 0x00 dlen 21              #102 [hci1] 7.859000
      SMP: Pairing Confirm (0x03) len 16
        Confim value: 7c96ba4a439b6be7c4f861bd8acaa211
> HCI Event: Number of Completed Packets (0x13) plen 5     #103 [hci1] 7.901356
        Num handles: 1
        Handle: 2340 Address: DF:A9:FF:F6:B1:1A (OUI DF-A9-FF)
        Count: 1
        #102: len 21 (4 Kb/s)
        Latency: 42 msec (23-43 msec ~42 msec)
> ACL Data RX: Handle 2340 flags 0x02 dlen 21              #104 [hci1] 7.951351
      SMP: Pairing Confirm (0x03) len 16
        Confim value: a368b18138ee203ab070bf74458fa202
< HCI Command: Host Number of Comp.. (0x03|0x0035) plen 5  #105 [hci1] 7.958169
        Num handles: 1
        Handle: 2340 Address: DF:A9:FF:F6:B1:1A (OUI DF-A9-FF)
        Count: 1
< ACL Data TX: Handle 2340 flags 0x00 dlen 21              #106 [hci1] 7.958210
      SMP: Pairing Random (0x04) len 16
        Random value: dddbdfe2838e9a8cc6964353c850fef7
> HCI Event: Number of Completed Packets (0x13) plen 5     #107 [hci1] 8.001216
        Num handles: 1
        Handle: 2340 Address: DF:A9:FF:F6:B1:1A (OUI DF-A9-FF)
        Count: 1
        #106: len 21 (3 Kb/s)
        Latency: 43 msec (23-43 msec ~42 msec)
> ACL Data RX: Handle 2340 flags 0x02 dlen 21              #108 [hci1] 8.251401
      SMP: Pairing Random (0x04) len 16
        Random value: 620ac9c0bdb6d82cf4e0cb9e63d3fbd3
< HCI Command: Host Number of Comp.. (0x03|0x0035) plen 5  #109 [hci1] 8.258735
        Num handles: 1
        Handle: 2340 Address: DF:A9:FF:F6:B1:1A (OUI DF-A9-FF)
        Count: 1
< ACL Data TX: Handle 2340 flags 0x00 dlen 21              #110 [hci1] 8.258843
      SMP: Pairing Confirm (0x03) len 16
        Confim value: 34dec1f890f50b91ad5e2a07358aa854
> HCI Event: Number of Completed Packets (0x13) plen 5     #111 [hci1] 8.301221
        Num handles: 1
        Handle: 2340 Address: DF:A9:FF:F6:B1:1A (OUI DF-A9-FF)
        Count: 1
        #110: len 21 (4 Kb/s)
        Latency: 42 msec (23-43 msec ~42 msec)
> ACL Data RX: Handle 2340 flags 0x02 dlen 21              #112 [hci1] 8.351353
      SMP: Pairing Confirm (0x03) len 16
        Confim value: bd981cf277f99236f92b482047b5ecca
< HCI Command: Host Number of Comp.. (0x03|0x0035) plen 5  #113 [hci1] 8.358416
        Num handles: 1
        Handle: 2340 Address: DF:A9:FF:F6:B1:1A (OUI DF-A9-FF)
        Count: 1
< ACL Data TX: Handle 2340 flags 0x00 dlen 21              #114 [hci1] 8.358459
      SMP: Pairing Random (0x04) len 16
        Random value: eb9f1915536596b6fc3db1c86b2b1970
> HCI Event: Number of Completed Packets (0x13) plen 5     #115 [hci1] 8.401183
        Num handles: 1
        Handle: 2340 Address: DF:A9:FF:F6:B1:1A (OUI DF-A9-FF)
        Count: 1
        #114: len 21 (4 Kb/s)
        Latency: 42 msec (23-43 msec ~42 msec)
> ACL Data RX: Handle 2340 flags 0x02 dlen 21              #116 [hci1] 8.651436
      SMP: Pairing Random (0x04) len 16
        Random value: 0851bdeeafd633685088e862618b2d1e
< HCI Command: Host Number of Comp.. (0x03|0x0035) plen 5  #117 [hci1] 8.658869
        Num handles: 1
        Handle: 2340 Address: DF:A9:FF:F6:B1:1A (OUI DF-A9-FF)
        Count: 1
< ACL Data TX: Handle 2340 flags 0x00 dlen 21              #118 [hci1] 8.658989
      SMP: Pairing Confirm (0x03) len 16
        Confim value: 9f5bcbcae5618ed118d3d8834f674448
> HCI Event: Number of Completed Packets (0x13) plen 5     #119 [hci1] 8.701139
        Num handles: 1
        Handle: 2340 Address: DF:A9:FF:F6:B1:1A (OUI DF-A9-FF)
        Count: 1
        #118: len 21 (4 Kb/s)
        Latency: 42 msec (23-43 msec ~42 msec)
> ACL Data RX: Handle 2340 flags 0x02 dlen 21              #120 [hci1] 8.751240
      SMP: Pairing Confirm (0x03) len 16
        Confim value: 1b0287b9eb934ea9c757c08611b8f6cc
< HCI Command: Host Number of Comp.. (0x03|0x0035) plen 5  #121 [hci1] 8.758603
        Num handles: 1
        Handle: 2340 Address: DF:A9:FF:F6:B1:1A (OUI DF-A9-FF)
        Count: 1
< ACL Data TX: Handle 2340 flags 0x00 dlen 21              #122 [hci1] 8.758702
      SMP: Pairing Random (0x04) len 16
        Random value: 5c794dc9ad9f2c3f295ebd5ad5e1c3cf
> HCI Event: Number of Completed Packets (0x13) plen 5     #123 [hci1] 8.801198
        Num handles: 1
        Handle: 2340 Address: DF:A9:FF:F6:B1:1A (OUI DF-A9-FF)
        Count: 1
        #122: len 21 (4 Kb/s)
        Latency: 42 msec (23-43 msec ~42 msec)
> ACL Data RX: Handle 2340 flags 0x02 dlen 21              #124 [hci1] 9.051325
      SMP: Pairing Random (0x04) len 16
        Random value: b102f0ec6abede5a51e90c7c37dc7e26
< HCI Command: Host Number of Comp.. (0x03|0x0035) plen 5  #125 [hci1] 9.058616
        Num handles: 1
        Handle: 2340 Address: DF:A9:FF:F6:B1:1A (OUI DF-A9-FF)
        Count: 1
< ACL Data TX: Handle 2340 flags 0x00 dlen 21              #126 [hci1] 9.058735
      SMP: Pairing Confirm (0x03) len 16
        Confim value: cb31e533d8c51ba66c739139cb25785a
> HCI Event: Number of Completed Packets (0x13) plen 5     #127 [hci1] 9.101215
        Num handles: 1
        Handle: 2340 Address: DF:A9:FF:F6:B1:1A (OUI DF-A9-FF)
        Count: 1
        #126: len 21 (4 Kb/s)
        Latency: 42 msec (23-43 msec ~42 msec)
> ACL Data RX: Handle 2340 flags 0x02 dlen 21              #128 [hci1] 9.151439
      SMP: Pairing Confirm (0x03) len 16
        Confim value: f4e7cdb14c9d8e75eb74803538389f89
< HCI Command: Host Number of Comp.. (0x03|0x0035) plen 5  #129 [hci1] 9.158681
        Num handles: 1
        Handle: 2340 Address: DF:A9:FF:F6:B1:1A (OUI DF-A9-FF)
        Count: 1
< ACL Data TX: Handle 2340 flags 0x00 dlen 21              #130 [hci1] 9.158791
      SMP: Pairing Random (0x04) len 16
        Random value: 5c2fff312cdf99c9491988e877355a9a
> HCI Event: Number of Completed Packets (0x13) plen 5     #131 [hci1] 9.201192
        Num handles: 1
        Handle: 2340 Address: DF:A9:FF:F6:B1:1A (OUI DF-A9-FF)
        Count: 1
        #130: len 21 (4 Kb/s)
        Latency: 42 msec (23-43 msec ~42 msec)
> ACL Data RX: Handle 2340 flags 0x02 dlen 21              #132 [hci1] 9.451321
      SMP: Pairing Random (0x04) len 16
        Random value: a849e5446166f6676bd9ea51774ae5d8
< HCI Command: Host Number of Comp.. (0x03|0x0035) plen 5  #133 [hci1] 9.458448
        Num handles: 1
        Handle: 2340 Address: DF:A9:FF:F6:B1:1A (OUI DF-A9-FF)
        Count: 1
< ACL Data TX: Handle 2340 flags 0x00 dlen 21              #134 [hci1] 9.458543
      SMP: Pairing Confirm (0x03) len 16
        Confim value: 8cc37d14aa24597bde4ecda18f180156
> HCI Event: Number of Completed Packets (0x13) plen 5     #135 [hci1] 9.501194
        Num handles: 1
        Handle: 2340 Address: DF:A9:FF:F6:B1:1A (OUI DF-A9-FF)
        Count: 1
        #134: len 21 (4 Kb/s)
        Latency: 42 msec (23-43 msec ~42 msec)
> ACL Data RX: Handle 2340 flags 0x02 dlen 21              #136 [hci1] 9.551256
      SMP: Pairing Confirm (0x03) len 16
        Confim value: beffceed4e2c0756df06043cda13a1a7
< HCI Command: Host Number of Comp.. (0x03|0x0035) plen 5  #137 [hci1] 9.558425
        Num handles: 1
        Handle: 2340 Address: DF:A9:FF:F6:B1:1A (OUI DF-A9-FF)
        Count: 1
< ACL Data TX: Handle 2340 flags 0x00 dlen 21              #138 [hci1] 9.558469
      SMP: Pairing Random (0x04) len 16
        Random value: c629a3a987d808e808655d558dfc1155
> HCI Event: Number of Completed Packets (0x13) plen 5     #139 [hci1] 9.601187
        Num handles: 1
        Handle: 2340 Address: DF:A9:FF:F6:B1:1A (OUI DF-A9-FF)
        Count: 1
        #138: len 21 (4 Kb/s)
        Latency: 42 msec (23-43 msec ~42 msec)
> ACL Data RX: Handle 2340 flags 0x02 dlen 21              #140 [hci1] 9.851226
      SMP: Pairing Random (0x04) len 16
        Random value: 005aac4846409004a3ea6397fb187e20
< HCI Command: Host Number of Comp.. (0x03|0x0035) plen 5  #141 [hci1] 9.858847
        Num handles: 1
        Handle: 2340 Address: DF:A9:FF:F6:B1:1A (OUI DF-A9-FF)
        Count: 1
< ACL Data TX: Handle 2340 flags 0x00 dlen 21              #142 [hci1] 9.858988
      SMP: Pairing Confirm (0x03) len 16
        Confim value: 37a1952e46867314c8741a01f6ea3d7a
> HCI Event: Number of Completed Packets (0x13) plen 5     #143 [hci1] 9.901172
        Num handles: 1
        Handle: 2340 Address: DF:A9:FF:F6:B1:1A (OUI DF-A9-FF)
        Count: 1
        #142: len 21 (4 Kb/s)
        Latency: 42 msec (23-43 msec ~42 msec)
> ACL Data RX: Handle 2340 flags 0x02 dlen 21              #144 [hci1] 9.951316
      SMP: Pairing Confirm (0x03) len 16
        Confim value: ac67a864d7dbac8c6e1c81a27adba116
< HCI Command: Host Number of Comp.. (0x03|0x0035) plen 5  #145 [hci1] 9.958389
        Num handles: 1
        Handle: 2340 Address: DF:A9:FF:F6:B1:1A (OUI DF-A9-FF)
        Count: 1
< ACL Data TX: Handle 2340 flags 0x00 dlen 21              #146 [hci1] 9.958438
      SMP: Pairing Random (0x04) len 16
        Random value: 92f20f6ad8f13724432c7fd6001c45ff
> HCI Event: Number of Completed Packets (0x13) plen 5    #147 [hci1] 10.001185
        Num handles: 1
        Handle: 2340 Address: DF:A9:FF:F6:B1:1A (OUI DF-A9-FF)
        Count: 1
        #146: len 21 (4 Kb/s)
        Latency: 42 msec (23-43 msec ~42 msec)
> ACL Data RX: Handle 2340 flags 0x02 dlen 21             #148 [hci1] 10.251281
      SMP: Pairing Random (0x04) len 16
        Random value: 9cbf85f6d88eac6fd90814fdfe1ac85d
< HCI Command: Host Number of Com.. (0x03|0x0035) plen 5  #149 [hci1] 10.258841
        Num handles: 1
        Handle: 2340 Address: DF:A9:FF:F6:B1:1A (OUI DF-A9-FF)
        Count: 1
< ACL Data TX: Handle 2340 flags 0x00 dlen 21             #150 [hci1] 10.258941
      SMP: Pairing Confirm (0x03) len 16
        Confim value: 99cceffcdc9ff3a686e5dceb08efd4ab
> HCI Event: Number of Completed Packets (0x13) plen 5    #151 [hci1] 10.301169
        Num handles: 1
        Handle: 2340 Address: DF:A9:FF:F6:B1:1A (OUI DF-A9-FF)
        Count: 1
        #150: len 21 (4 Kb/s)
        Latency: 42 msec (23-43 msec ~42 msec)
> ACL Data RX: Handle 2340 flags 0x02 dlen 21             #152 [hci1] 10.351341
      SMP: Pairing Confirm (0x03) len 16
        Confim value: e14a44d6b65c010c54129bc7d0bb7cf3
< HCI Command: Host Number of Com.. (0x03|0x0035) plen 5  #153 [hci1] 10.358567
        Num handles: 1
        Handle: 2340 Address: DF:A9:FF:F6:B1:1A (OUI DF-A9-FF)
        Count: 1
< ACL Data TX: Handle 2340 flags 0x00 dlen 21             #154 [hci1] 10.358660
      SMP: Pairing Random (0x04) len 16
        Random value: 23ac32ebbb5e14c8a6b9622f296d277f
> HCI Event: Number of Completed Packets (0x13) plen 5    #155 [hci1] 10.401126
        Num handles: 1
        Handle: 2340 Address: DF:A9:FF:F6:B1:1A (OUI DF-A9-FF)
        Count: 1
        #154: len 21 (4 Kb/s)
        Latency: 42 msec (23-43 msec ~42 msec)
> ACL Data RX: Handle 2340 flags 0x02 dlen 21             #156 [hci1] 10.651424
      SMP: Pairing Random (0x04) len 16
        Random value: 8e48a728b6f5faf83cb8ee0d6fdd17a5
< HCI Command: Host Number of Com.. (0x03|0x0035) plen 5  #157 [hci1] 10.658767
        Num handles: 1
        Handle: 2340 Address: DF:A9:FF:F6:B1:1A (OUI DF-A9-FF)
        Count: 1
< ACL Data TX: Handle 2340 flags 0x00 dlen 21             #158 [hci1] 10.658790
      SMP: Pairing Confirm (0x03) len 16
        Confim value: e3a8c09bef6a35dabe973b278a2028a7
> HCI Event: Number of Completed Packets (0x13) plen 5    #159 [hci1] 10.701282
        Num handles: 1
        Handle: 2340 Address: DF:A9:FF:F6:B1:1A (OUI DF-A9-FF)
        Count: 1
        #158: len 21 (4 Kb/s)
        Latency: 42 msec (23-43 msec ~42 msec)
> ACL Data RX: Handle 2340 flags 0x02 dlen 21             #160 [hci1] 10.751282
      SMP: Pairing Confirm (0x03) len 16
        Confim value: 7d0634c928be112065113b6629c901a3
< HCI Command: Host Number of Com.. (0x03|0x0035) plen 5  #161 [hci1] 10.758722
        Num handles: 1
        Handle: 2340 Address: DF:A9:FF:F6:B1:1A (OUI DF-A9-FF)
        Count: 1
< ACL Data TX: Handle 2340 flags 0x00 dlen 21             #162 [hci1] 10.758846
      SMP: Pairing Random (0x04) len 16
        Random value: 297efe85e67448a15f56bd27e3a3cf1d
> HCI Event: Number of Completed Packets (0x13) plen 5    #163 [hci1] 10.801204
        Num handles: 1
        Handle: 2340 Address: DF:A9:FF:F6:B1:1A (OUI DF-A9-FF)
        Count: 1
        #162: len 21 (4 Kb/s)
        Latency: 42 msec (23-43 msec ~42 msec)
> ACL Data RX: Handle 2340 flags 0x02 dlen 21             #164 [hci1] 11.051169
      SMP: Pairing Random (0x04) len 16
        Random value: b11cf5a95beda122310bf24af2115a17
< HCI Command: Host Number of Com.. (0x03|0x0035) plen 5  #165 [hci1] 11.058902
        Num handles: 1
        Handle: 2340 Address: DF:A9:FF:F6:B1:1A (OUI DF-A9-FF)
        Count: 1
< ACL Data TX: Handle 2340 flags 0x00 dlen 21             #166 [hci1] 11.059012
      SMP: Pairing Confirm (0x03) len 16
        Confim value: d7db4c63657d03e73b95c6da10daaac6
> HCI Event: Number of Completed Packets (0x13) plen 5    #167 [hci1] 11.101163
        Num handles: 1
        Handle: 2340 Address: DF:A9:FF:F6:B1:1A (OUI DF-A9-FF)
        Count: 1
        #166: len 21 (4 Kb/s)
        Latency: 42 msec (23-43 msec ~42 msec)
> ACL Data RX: Handle 2340 flags 0x02 dlen 21             #168 [hci1] 11.151154
      SMP: Pairing Confirm (0x03) len 16
        Confim value: 753e46d7ebf8da0d5a468235fb048516
< HCI Command: Host Number of Com.. (0x03|0x0035) plen 5  #169 [hci1] 11.158316
        Num handles: 1
        Handle: 2340 Address: DF:A9:FF:F6:B1:1A (OUI DF-A9-FF)
        Count: 1
< ACL Data TX: Handle 2340 flags 0x00 dlen 21             #170 [hci1] 11.158326
      SMP: Pairing Random (0x04) len 16
        Random value: 25a9493fd3ce4faf02be7293595bb7c6
> HCI Event: Number of Completed Packets (0x13) plen 5    #171 [hci1] 11.201031
        Num handles: 1
        Handle: 2340 Address: DF:A9:FF:F6:B1:1A (OUI DF-A9-FF)
        Count: 1
        #170: len 21 (4 Kb/s)
        Latency: 42 msec (23-43 msec ~42 msec)
> ACL Data RX: Handle 2340 flags 0x02 dlen 21             #172 [hci1] 11.451189
      SMP: Pairing Random (0x04) len 16
        Random value: f0c533022bd4a84fcc377d28ccbc37c7
< HCI Command: Host Number of Com.. (0x03|0x0035) plen 5  #173 [hci1] 11.458765
        Num handles: 1
        Handle: 2340 Address: DF:A9:FF:F6:B1:1A (OUI DF-A9-FF)
        Count: 1
< ACL Data TX: Handle 2340 flags 0x00 dlen 21             #174 [hci1] 11.458887
      SMP: Pairing Confirm (0x03) len 16
        Confim value: 6663d8b3188de2af304beae45dd6e1e9
> HCI Event: Number of Completed Packets (0x13) plen 5    #175 [hci1] 11.501022
        Num handles: 1
        Handle: 2340 Address: DF:A9:FF:F6:B1:1A (OUI DF-A9-FF)
        Count: 1
        #174: len 21 (4 Kb/s)
        Latency: 42 msec (23-43 msec ~42 msec)
> ACL Data RX: Handle 2340 flags 0x02 dlen 21             #176 [hci1] 11.551389
      SMP: Pairing Confirm (0x03) len 16
        Confim value: b78baf6d01a8c0839fc22217fb6b9cdd
< HCI Command: Host Number of Com.. (0x03|0x0035) plen 5  #177 [hci1] 11.558779
        Num handles: 1
        Handle: 2340 Address: DF:A9:FF:F6:B1:1A (OUI DF-A9-FF)
        Count: 1
< ACL Data TX: Handle 2340 flags 0x00 dlen 21             #178 [hci1] 11.558904
      SMP: Pairing Random (0x04) len 16
        Random value: 58f6b41f855a6f6c3560debd84e2affc
> HCI Event: Number of Completed Packets (0x13) plen 5    #179 [hci1] 11.601113
        Num handles: 1
        Handle: 2340 Address: DF:A9:FF:F6:B1:1A (OUI DF-A9-FF)
        Count: 1
        #178: len 21 (4 Kb/s)
        Latency: 42 msec (23-43 msec ~42 msec)
> ACL Data RX: Handle 2340 flags 0x02 dlen 21             #180 [hci1] 11.851178
      SMP: Pairing Random (0x04) len 16
        Random value: ab62accaef30dedfd8b69b499320d7a4
< HCI Command: Host Number of Com.. (0x03|0x0035) plen 5  #181 [hci1] 11.858794
        Num handles: 1
        Handle: 2340 Address: DF:A9:FF:F6:B1:1A (OUI DF-A9-FF)
        Count: 1
< ACL Data TX: Handle 2340 flags 0x00 dlen 21             #182 [hci1] 11.858912
      SMP: Pairing Confirm (0x03) len 16
        Confim value: 2afd6ff25110a6b67523536e45e9ff5b
> HCI Event: Number of Completed Packets (0x13) plen 5    #183 [hci1] 11.901025
        Num handles: 1
        Handle: 2340 Address: DF:A9:FF:F6:B1:1A (OUI DF-A9-FF)
        Count: 1
        #182: len 21 (4 Kb/s)
        Latency: 42 msec (23-43 msec ~42 msec)
> ACL Data RX: Handle 2340 flags 0x02 dlen 21             #184 [hci1] 11.951317
      SMP: Pairing Confirm (0x03) len 16
        Confim value: 0acbea45466e5b890a447a71b1ee5c8a
< HCI Command: Host Number of Com.. (0x03|0x0035) plen 5  #185 [hci1] 11.958737
        Num handles: 1
        Handle: 2340 Address: DF:A9:FF:F6:B1:1A (OUI DF-A9-FF)
        Count: 1
< ACL Data TX: Handle 2340 flags 0x00 dlen 21             #186 [hci1] 11.958864
      SMP: Pairing Random (0x04) len 16
        Random value: b67e7216d5bf664139eda2b542549666
> HCI Event: Number of Completed Packets (0x13) plen 5    #187 [hci1] 12.001079
        Num handles: 1
        Handle: 2340 Address: DF:A9:FF:F6:B1:1A (OUI DF-A9-FF)
        Count: 1
        #186: len 21 (4 Kb/s)
        Latency: 42 msec (23-43 msec ~42 msec)
> ACL Data RX: Handle 2340 flags 0x02 dlen 21             #188 [hci1] 12.251194
      SMP: Pairing Random (0x04) len 16
        Random value: 2520628aac1ef07e9163365d6e5b22be
< HCI Command: Host Number of Com.. (0x03|0x0035) plen 5  #189 [hci1] 12.258829
        Num handles: 1
        Handle: 2340 Address: DF:A9:FF:F6:B1:1A (OUI DF-A9-FF)
        Count: 1
< ACL Data TX: Handle 2340 flags 0x00 dlen 21             #190 [hci1] 12.258998
      SMP: Pairing Confirm (0x03) len 16
        Confim value: c9fa07b71fe076771f16df7844fec22f
> HCI Event: Number of Completed Packets (0x13) plen 5    #191 [hci1] 12.301107
        Num handles: 1
        Handle: 2340 Address: DF:A9:FF:F6:B1:1A (OUI DF-A9-FF)
        Count: 1
        #190: len 21 (4 Kb/s)
        Latency: 42 msec (23-43 msec ~42 msec)
> ACL Data RX: Handle 2340 flags 0x02 dlen 21             #192 [hci1] 12.351237
      SMP: Pairing Confirm (0x03) len 16
        Confim value: 78049d5166c64a7d80634a6d2539d07a
< HCI Command: Host Number of Com.. (0x03|0x0035) plen 5  #193 [hci1] 12.358578
        Num handles: 1
        Handle: 2340 Address: DF:A9:FF:F6:B1:1A (OUI DF-A9-FF)
        Count: 1
< ACL Data TX: Handle 2340 flags 0x00 dlen 21             #194 [hci1] 12.358704
      SMP: Pairing Random (0x04) len 16
        Random value: ed17f76500c95219dd01e09d1e63f87b
> HCI Event: Number of Completed Packets (0x13) plen 5    #195 [hci1] 12.401050
        Num handles: 1
        Handle: 2340 Address: DF:A9:FF:F6:B1:1A (OUI DF-A9-FF)
        Count: 1
        #194: len 21 (4 Kb/s)
        Latency: 42 msec (23-43 msec ~42 msec)
> ACL Data RX: Handle 2340 flags 0x02 dlen 21             #196 [hci1] 12.651228
      SMP: Pairing Random (0x04) len 16
        Random value: 2fc42e6278761dcbed264a9f0b7079af
< HCI Command: Host Number of Com.. (0x03|0x0035) plen 5  #197 [hci1] 12.658921
        Num handles: 1
        Handle: 2340 Address: DF:A9:FF:F6:B1:1A (OUI DF-A9-FF)
        Count: 1
< ACL Data TX: Handle 2340 flags 0x00 dlen 21             #198 [hci1] 12.658954
      SMP: Pairing Confirm (0x03) len 16
        Confim value: f0ed591d585833978babfa1b46883132
> HCI Event: Number of Completed Packets (0x13) plen 5    #199 [hci1] 12.701111
        Num handles: 1
        Handle: 2340 Address: DF:A9:FF:F6:B1:1A (OUI DF-A9-FF)
        Count: 1
        #198: len 21 (4 Kb/s)
        Latency: 42 msec (23-43 msec ~42 msec)
> ACL Data RX: Handle 2340 flags 0x02 dlen 21             #200 [hci1] 12.751271
      SMP: Pairing Confirm (0x03) len 16
        Confim value: 85012865ba0b17a179362223be92fecd
< HCI Command: Host Number of Com.. (0x03|0x0035) plen 5  #201 [hci1] 12.758782
        Num handles: 1
        Handle: 2340 Address: DF:A9:FF:F6:B1:1A (OUI DF-A9-FF)
        Count: 1
< ACL Data TX: Handle 2340 flags 0x00 dlen 21             #202 [hci1] 12.758890
      SMP: Pairing Random (0x04) len 16
        Random value: 81d35d47e1f6006d79c974bd9d9e1ee3
> HCI Event: Number of Completed Packets (0x13) plen 5    #203 [hci1] 12.801118
        Num handles: 1
        Handle: 2340 Address: DF:A9:FF:F6:B1:1A (OUI DF-A9-FF)
        Count: 1
        #202: len 21 (4 Kb/s)
        Latency: 42 msec (23-43 msec ~42 msec)
> ACL Data RX: Handle 2340 flags 0x02 dlen 21             #204 [hci1] 13.051245
      SMP: Pairing Random (0x04) len 16
        Random value: 6fd7e484359bd0eb05fe8a725e4c7905
< HCI Command: Host Number of Com.. (0x03|0x0035) plen 5  #205 [hci1] 13.058863
        Num handles: 1
        Handle: 2340 Address: DF:A9:FF:F6:B1:1A (OUI DF-A9-FF)
        Count: 1
< ACL Data TX: Handle 2340 flags 0x00 dlen 21             #206 [hci1] 13.058925
      SMP: Pairing Confirm (0x03) len 16
        Confim value: f91a4747fc12b8b8044143d3654c3cfe
> HCI Event: Number of Completed Packets (0x13) plen 5    #207 [hci1] 13.101117
        Num handles: 1
        Handle: 2340 Address: DF:A9:FF:F6:B1:1A (OUI DF-A9-FF)
        Count: 1
        #206: len 21 (4 Kb/s)
        Latency: 42 msec (23-43 msec ~42 msec)
> ACL Data RX: Handle 2340 flags 0x02 dlen 21             #208 [hci1] 13.151207
      SMP: Pairing Confirm (0x03) len 16
        Confim value: 7e00fd01019a783ab3b8149a4cea32e2
< HCI Command: Host Number of Com.. (0x03|0x0035) plen 5  #209 [hci1] 13.158505
        Num handles: 1
        Handle: 2340 Address: DF:A9:FF:F6:B1:1A (OUI DF-A9-FF)
        Count: 1
< ACL Data TX: Handle 2340 flags 0x00 dlen 21             #210 [hci1] 13.158616
      SMP: Pairing Random (0x04) len 16
        Random value: e7f7e0c2476823e41736a7e381bafb7c
> HCI Event: Number of Completed Packets (0x13) plen 5    #211 [hci1] 13.201069
        Num handles: 1
        Handle: 2340 Address: DF:A9:FF:F6:B1:1A (OUI DF-A9-FF)
        Count: 1
        #210: len 21 (4 Kb/s)
        Latency: 42 msec (23-43 msec ~42 msec)
> ACL Data RX: Handle 2340 flags 0x02 dlen 21             #212 [hci1] 13.451239
      SMP: Pairing Random (0x04) len 16
        Random value: 6d27353f9f036f8544ae48292b768d77
< HCI Command: Host Number of Com.. (0x03|0x0035) plen 5  #213 [hci1] 13.458857
        Num handles: 1
        Handle: 2340 Address: DF:A9:FF:F6:B1:1A (OUI DF-A9-FF)
        Count: 1
< ACL Data TX: Handle 2340 flags 0x00 dlen 21             #214 [hci1] 13.458962
      SMP: Pairing Confirm (0x03) len 16
        Confim value: cd6f17b06e20bc776c255bd49927d4de
> HCI Event: Number of Completed Packets (0x13) plen 5    #215 [hci1] 13.501192
        Num handles: 1
        Handle: 2340 Address: DF:A9:FF:F6:B1:1A (OUI DF-A9-FF)
        Count: 1
        #214: len 21 (4 Kb/s)
        Latency: 42 msec (23-43 msec ~42 msec)
> ACL Data RX: Handle 2340 flags 0x02 dlen 21             #216 [hci1] 13.551189
      SMP: Pairing Confirm (0x03) len 16
        Confim value: 0ccfb4cd7bae0b365291b28a71a09111
< HCI Command: Host Number of Com.. (0x03|0x0035) plen 5  #217 [hci1] 13.558423
        Num handles: 1
        Handle: 2340 Address: DF:A9:FF:F6:B1:1A (OUI DF-A9-FF)
        Count: 1
< ACL Data TX: Handle 2340 flags 0x00 dlen 21             #218 [hci1] 13.558457
      SMP: Pairing Random (0x04) len 16
        Random value: fc8b40d9b0b09bc4296bf8753a8f6e1f
> HCI Event: Number of Completed Packets (0x13) plen 5    #219 [hci1] 13.600987
        Num handles: 1
        Handle: 2340 Address: DF:A9:FF:F6:B1:1A (OUI DF-A9-FF)
        Count: 1
        #218: len 21 (4 Kb/s)
        Latency: 42 msec (23-43 msec ~42 msec)
> ACL Data RX: Handle 2340 flags 0x02 dlen 21             #220 [hci1] 13.851327
      SMP: Pairing Random (0x04) len 16
        Random value: c3781f3f45be07b229e5a1cf4005e784
< HCI Command: Host Number of Com.. (0x03|0x0035) plen 5  #221 [hci1] 13.859079
        Num handles: 1
        Handle: 2340 Address: DF:A9:FF:F6:B1:1A (OUI DF-A9-FF)
        Count: 1
< ACL Data TX: Handle 2340 flags 0x00 dlen 21             #222 [hci1] 13.859191
      SMP: Pairing DHKey Check (0x0d) len 16
        E: 083620f15a998f2dfbc3fe5487dabf03
> HCI Event: Number of Completed Packets (0x13) plen 5    #223 [hci1] 13.901042
        Num handles: 1
        Handle: 2340 Address: DF:A9:FF:F6:B1:1A (OUI DF-A9-FF)
        Count: 1
        #222: len 21 (4 Kb/s)
        Latency: 41 msec (23-43 msec ~42 msec)
> ACL Data RX: Handle 2340 flags 0x02 dlen 21             #224 [hci1] 13.951215
      SMP: Pairing DHKey Check (0x0d) len 16
        E: 9084ac1c6fbb385dd6f40c3e85a41dea
< HCI Command: LE Start Encryption (0x08|0x0019) plen 28  #225 [hci1] 13.958702
        Handle: 2340 Address: DF:A9:FF:F6:B1:1A (OUI DF-A9-FF)
        Random number: 0x0000000000000000
        Encrypted diversifier: 0x0000
        Long term key: 22b4203c337354c9e3c8f0a4ac12f4be
> HCI Event: Command Status (0x0f) plen 4                 #226 [hci1] 13.959623
      LE Start Encryption (0x08|0x0019) ncmd 1
        Status: Success (0x00)
< HCI Command: Host Number of Com.. (0x03|0x0035) plen 5  #227 [hci1] 13.978492
        Num handles: 1
        Handle: 2340 Address: DF:A9:FF:F6:B1:1A (OUI DF-A9-FF)
        Count: 1
> HCI Event: Encryption Change (0x08) plen 4              #228 [hci1] 14.300968
        Status: Success (0x00)
        Handle: 2340 Address: DF:A9:FF:F6:B1:1A (OUI DF-A9-FF)
        Encryption: Enabled with AES-CCM (0x01)
< HCI Command: Disconnect (0x01|0x0006) plen 3            #229 [hci1] 14.898820
        Handle: 2340 Address: DF:A9:FF:F6:B1:1A (OUI DF-A9-FF)
        Reason: Remote User Terminated Connection (0x13)
> HCI Event: Command Status (0x0f) plen 4                 #230 [hci1] 14.899365
      Disconnect (0x01|0x0006) ncmd 1
        Status: Success (0x00)
> HCI Event: Disconnect Complete (0x05) plen 4            #231 [hci1] 14.951132
        Status: Success (0x00)
        Handle: 2340 Address: DF:A9:FF:F6:B1:1A (OUI DF-A9-FF)
        Reason: Connection Terminated By Local Host (0x16)
< HCI Command: Reset (0x03|0x0003) plen 0                 #232 [hci1] 20.848317
> HCI Event: Command Complete (0x0e) plen 4               #233 [hci1] 20.848822
      Reset (0x03|0x0003) ncmd 1
        Status: Success (0x00)
@ USER Close: main                                    {0x0001} [hci1] 20.858293
= Close Index: 00:00:00:00:00:00                               [hci1] 20.858304
