Bluetooth monitor ver 5.72
= Note: Linux version 6.14.0-36-generic (x86_64)                       0.311827
= Note: Bluetooth subsystem version 2.22                               0.311829
= New Index: 00:00:00:00:00:00 (Primary,UART,hci1)              [hci1] 0.311830
= New Index: 48:5F:99:8E:E0:64 (Primary,USB,hci0)               [hci0] 0.311830
= Open Index: 00:00:00:00:00:00                                 [hci1] 0.425590
= Index Info: 00:00:00:00:00:00 (Nordic Semiconductor ASA)      [hci1] 0.425604
@ USER Open: main (privileged) version 2.22            {0x0001} [hci1] 0.425613
< HCI Command: Reset (0x03|0x0003) plen 0                    #1 [hci1] 0.426907
> HCI Event: Command Complete (0x0e) plen 4                  #2 [hci1] 0.427407
      Reset (0x03|0x0003) ncmd 1
        Status: Success (0x00)
< HCI Command: Read Local Supported... (0x04|0x0003) plen 0  #3 [hci1] 0.445346
> HCI Event: Command Complete (0x0e) plen 12                 #4 [hci1] 0.445921
      Read Local Supported Features (0x04|0x0003) ncmd 1
        Status: Success (0x00)
        Features: 0x00 0x00 0x00 0x00 0x60 0x00 0x00 0x00
          BR/EDR Not Supported
          LE Supported (Controller)
< HCI Command: Read Local Version In.. (0x04|0x0001) plen 0  #5 [hci1] 0.465093
> HCI Event: Command Complete (0x0e) plen 12                 #6 [hci1] 0.465627
      Read Local Version Information (0x04|0x0001) ncmd 1
        Status: Success (0x00)
        HCI version: Reserved (0x0f) - Revision 12393 (0x3069)
        LMP version: Reserved (0x0f) - Subversion 12393 (0x3069)
        Manufacturer: Nordic Semiconductor ASA (89)
< HCI Command: Read Local Supported... (0x04|0x0002) plen 0  #7 [hci1] 0.484979
> HCI Event: Command Complete (0x0e) plen 68                 #8 [hci1] 0.486029
      Read Local Supported Commands (0x04|0x0002) ncmd 1
        Status: Success (0x00)
        Commands: 119 entries
          Disconnect (Octet 0 - Bit 5)
          Read Remote Version Information (Octet 2 - Bit 7)
          Set Event Mask (Octet 5 - Bit 6)
          Reset (Octet 5 - Bit 7)
          Read Connection Accept Timeout (Octet 7 - Bit 2)
          Write Connection Accept Timeout (Octet 7 - Bit 3)
          Read Transmit Power Level (Octet 10 - Bit 2)
          Set Controller To Host Flow Control (Octet 10 - Bit 5)
          Host Buffer Size (Octet 10 - Bit 6)
          Host Number of Completed Packets (Octet 10 - Bit 7)
          Read Local Version Information (Octet 14 - Bit 3)
          Read Local Supported Features (Octet 14 - Bit 5)
          Read BD ADDR (Octet 15 - Bit 1)
          Read RSSI (Octet 15 - Bit 5)
          Set Event Mask Page 2 (Octet 22 - Bit 2)
          LE Set Event Mask (Octet 25 - Bit 0)
          LE Read Buffer Size (Octet 25 - Bit 1)
          LE Read Local Supported Features (Octet 25 - Bit 2)
          LE Set Random Address (Octet 25 - Bit 4)
          LE Set Advertising Parameters (Octet 25 - Bit 5)
          LE Read Advertising Channel TX Power (Octet 25 - Bit 6)
          LE Set Advertising Data (Octet 25 - Bit 7)
          LE Set Scan Response Data (Octet 26 - Bit 0)
          LE Set Advertise Enable (Octet 26 - Bit 1)
          LE Set Scan Parameters (Octet 26 - Bit 2)
          LE Set Scan Enable (Octet 26 - Bit 3)
          LE Create Connection (Octet 26 - Bit 4)
          LE Create Connection Cancel (Octet 26 - Bit 5)
          LE Read Accept List Size (Octet 26 - Bit 6)
          LE Clear Accept List (Octet 26 - Bit 7)
          LE Add Device To Accept List (Octet 27 - Bit 0)
          LE Remove Device From Accept List (Octet 27 - Bit 1)
          LE Connection Update (Octet 27 - Bit 2)
          LE Set Host Channel Classification (Octet 27 - Bit 3)
          LE Read Channel Map (Octet 27 - Bit 4)
          LE Read Remote Used Features (Octet 27 - Bit 5)
          LE Encrypt (Octet 27 - Bit 6)
          LE Rand (Octet 27 - Bit 7)
          LE Start Encryption (Octet 28 - Bit 0)
          LE Long Term Key Request Reply (Octet 28 - Bit 1)
          LE Long Term Key Request Neg Reply (Octet 28 - Bit 2)
          LE Read Supported States (Octet 28 - Bit 3)
          LE Receiver Test (Octet 28 - Bit 4)
          LE Transmitter Test (Octet 28 - Bit 5)
          LE Test End (Octet 28 - Bit 6)
          Read Authenticated Payload Timeout (Octet 32 - Bit 4)
          Write Authenticated Payload Timeout (Octet 32 - Bit 5)
          LE Set Data Length (Octet 33 - Bit 6)
          LE Read Suggested Default Data Length (Octet 33 - Bit 7)
          LE Write Suggested Default Data Length (Octet 34 - Bit 0)
          LE Add Device To Resolving List (Octet 34 - Bit 3)
          LE Remove Device From Resolving List (Octet 34 - Bit 4)
          LE Clear Resolving List (Octet 34 - Bit 5)
          LE Read Resolving List Size (Octet 34 - Bit 6)
          LE Set Address Resolution Enable (Octet 35 - Bit 1)
          LE Set Resolvable Private Address Timeout (Octet 35 - Bit 2)
          LE Read Maximum Data Length (Octet 35 - Bit 3)
          LE Read PHY (Octet 35 - Bit 4)
          LE Set Default PHY (Octet 35 - Bit 5)
          LE Set PHY (Octet 35 - Bit 6)
          LE Enhanced Receiver Test (Octet 35 - Bit 7)
          LE Enhanced Transmitter Test (Octet 36 - Bit 0)
          LE Set Advertising Set Random Address (Octet 36 - Bit 1)
          LE Set Extended Advertising Parameters (Octet 36 - Bit 2)
          LE Set Extended Advertising Data (Octet 36 - Bit 3)
          LE Set Extended Scan Response Data (Octet 36 - Bit 4)
          LE Set Extended Advertising Enable (Octet 36 - Bit 5)
          LE Read Maximum Advertising Data Length (Octet 36 - Bit 6)
          LE Read Number of Supported Advertising Sets (Octet 36 - Bit 7)
          LE Remove Advertising Set (Octet 37 - Bit 0)
          LE Clear Advertising Sets (Octet 37 - Bit 1)
          LE Set Periodic Advertising Parameters (Octet 37 - Bit 2)
          LE Set Periodic Advertising Data (Octet 37 - Bit 3)
          LE Set Periodic Advertising Enable (Octet 37 - Bit 4)
          LE Set Extended Scan Parameters (Octet 37 - Bit 5)
          LE Set Extended Scan Enable (Octet 37 - Bit 6)
          LE Extended Create Connection (Octet 37 - Bit 7)
          LE Periodic Advertising Create Sync (Octet 38 - Bit 0)
          LE Periodic Advertising Create Sync Cancel (Octet 38 - Bit 1)
          LE Periodic Advertising Terminate Sync (Octet 38 - Bit 2)
          LE Add Device To Periodic Advertiser List (Octet 38 - Bit 3)
          LE Remove Device From Periodic Advertiser List (Octet 38 - Bit 4)
          LE Clear Periodic Advertiser List (Octet 38 - Bit 5)
          LE Read Periodic Advertiser List Size (Octet 38 - Bit 6)
          LE Read Transmit Power (Octet 38 - Bit 7)
          LE Read RF Path Compensation (Octet 39 - Bit 0)
          LE Write RF Path Compensation (Octet 39 - Bit 1)
          LE Set Privacy Mode (Octet 39 - Bit 2)
          LE Periodic Advertising Receive Enable (Octet 40 - Bit 5)
          LE Periodic Advertising Sync Transfer (Octet 40 - Bit 6)
          LE Periodic Advertising Set Info Transfer (Octet 40 - Bit 7)
          LE Periodic Advertising Sync Transfer Parameters (Octet 41 - Bit 0)
          LE Set Default Periodic Advertisng Sync Transfer Parameters (Octet 41 - Bit 1)
          LE Read Buffer v2 (Octet 41 - Bit 5)
          LE Read ISO TX Sync (Octet 41 - Bit 6)
          LE Set Connected Isochronous Group Parameters (Octet 41 - Bit 7)
          LE Set Connected Isochronous Group Parameters Test (Octet 42 - Bit 0)
          LE Create Connected Isochronous Stream (Octet 42 - Bit 1)
          LE Remove Connected Isochronous Group (Octet 42 - Bit 2)
          LE Accept Connected Isochronous Stream Request (Octet 42 - Bit 3)
          LE Reject Connected Isochronous Stream Request (Octet 42 - Bit 4)
          LE Create Broadcast Isochronous Group (Octet 42 - Bit 5)
          LE Create Broadcast Isochronous Group Test (Octet 42 - Bit 6)
          LE Terminate Broadcast Isochronous Group (Octet 42 - Bit 7)
          LE Broadcast Isochronous Group Create Sync (Octet 43 - Bit 0)
          LE Broadcast Isochronous Group Terminate Sync (Octet 43 - Bit 1)
          LE Request Peer SCA (Octet 43 - Bit 2)
          LE Setup Isochronous Data Path (Octet 43 - Bit 3)
          LE Remove Isochronous Data Path (Octet 43 - Bit 4)
          LE Isochronous Transmit Test (Octet 43 - Bit 5)
          LE Isochronous Receive Test (Octet 43 - Bit 6)
          LE Isochronous Read Test Counters (Octet 43 - Bit 7)
          LE Isochronous Read Test Counters (Octet 44 - Bit 0)
          LE Set Host Feature (Octet 44 - Bit 1)
          Octet 44 - Bit 2 
          Octet 45 - Bit 6 
          Octet 46 - Bit 0 
          Octet 46 - Bit 1 
          Octet 46 - Bit 2 
< HCI Command: Host Buffer Size (0x03|0x0033) plen 7         #9 [hci1] 0.504968
        ACL MTU: 255  ACL max packet: 16
        SCO MTU: 0    SCO max packet: 0
> HCI Event: Command Complete (0x0e) plen 4                 #10 [hci1] 0.505443
      Host Buffer Size (0x03|0x0033) ncmd 1
        Status: Success (0x00)
< HCI Command: Set Controller To Ho.. (0x03|0x0031) plen 1  #11 [hci1] 0.524967
        Flow control: ACL Data Packets (0x01)
> HCI Event: Command Complete (0x0e) plen 4                 #12 [hci1] 0.525392
      Set Controller To Host Flow Control (0x03|0x0031) ncmd 1
        Status: Success (0x00)
< HCI Command: LE Read Local Suppor.. (0x08|0x0003) plen 0  #13 [hci1] 0.544944
> HCI Event: Command Complete (0x0e) plen 12                #14 [hci1] 0.545385
      LE Read Local Supported Features (0x08|0x0003) ncmd 1
        Status: Success (0x00)
        Features: 0xfd 0x79 0x00 0xf7 0x30 0x01 0x00 0x00
          LE Encryption
          Extended Reject Indication
          Peripheral-initiated Features Exchange
          LE Ping
          LE Data Packet Length Extension
          LL Privacy
          Extended Scanner Filter Policies
          LE 2M PHY
          LE Coded PHY
          LE Extended Advertising
          LE Periodic Advertising
          Channel Selection Algorithm #2
          Periodic Advertising Sync Transfer - Sender
          Periodic Advertising Sync Transfer - Recipient
          Sleep Clock Accuracy Updates
          Connected Isochronous Stream - Central
          Connected Isochronous Stream - Peripheral
          Isochronous Broadcaster
          Synchronized Receiver
          Periodic Advertising ADI support
          Connection Subrating
          Unknown features (0x0000010000000000)
< HCI Command: LE Set Host Feature (0x08|0x0074) plen 2     #15 [hci1] 0.564958
        Bit Number: 32
          Connected Isochronous Stream (Host Support)
        Bit Value: 1
> HCI Event: Command Complete (0x0e) plen 4                 #16 [hci1] 0.565338
      LE Set Host Feature (0x08|0x0074) ncmd 1
        Status: Success (0x00)
< HCI Command: LE Read Buffer v2 (0x08|0x0060) plen 0       #17 [hci1] 0.584969
> HCI Event: Command Complete (0x0e) plen 10                #18 [hci1] 0.585401
      LE Read Buffer v2 (0x08|0x0060) ncmd 1
        Status: Success (0x00)
        ACL MTU: 27
        ACL max packet: 3
        ISO MTU: 318
        ISO max packet: 3
< HCI Command: LE Read Maximum Adve.. (0x08|0x003a) plen 0  #19 [hci1] 0.604970
> HCI Event: Command Complete (0x0e) plen 6                 #20 [hci1] 0.605358
      LE Read Maximum Advertising Data Length (0x08|0x003a) ncmd 1
        Status: Success (0x00)
        Max length: 1650
< HCI Command: LE Read Supported St.. (0x08|0x001c) plen 0  #21 [hci1] 0.624967
> HCI Event: Command Complete (0x0e) plen 12                #22 [hci1] 0.625470
      LE Read Supported States (0x08|0x001c) ncmd 1
        Status: Success (0x00)
        States: 0x000003ff3e0306ff
          Non-connectable Advertising State
          Scannable Advertising State
          Connectable Advertising State
          High Duty Cycle Directed Advertising State
          Passive Scanning State
          Active Scanning State
          Initiating State
            and Connection State (Central Role)
          Connection State (Peripheral Role)
          Scannable Advertising State
            and Passive Scanning State
          Connectable Advertising State
            and Passive Scanning State
          Non-connectable Advertising State
            and Initiating State
          Scannable Advertising State
            and Initiating State
          Active Scanning State
            and Connection State (Central Role)
          Passive Scanning State
            and Connection State (Peripheral Role)
          Active Scanning State
            and Connection State (Peripheral Role)
          Initiating State
            and Connection State (Central Role)
            and Central Role & Central Role
          Low Duty Cycle Directed Advertising State
          Connectable Advertising State
            and Initiating State
            and Central Role & Peripheral Role
          High Duty Cycle Directed Advertising State
            and Initiating State
            and Central Role & Peripheral Role
          Low Duty Cycle Directed Advertising State
            and Initiating State
            and Central Role & Peripheral Role
          Connectable Advertising State
            and Connection State (Central Role)
            and Central Role & Peripheral Role
          High Duty Cycle Directed Advertising State
            and Connection State (Central Role)
            and Central Role & Peripheral Role
          Low Duty Cycle Directed Advertising State
            and Connection State (Central Role)
            and Central Role & Peripheral Role
          Connectable Advertising State
            and Connection State (Peripheral Role)
            and Central Role & Peripheral Role
          High Duty Cycle Directed Advertising State
            and Connection State (Peripheral Role)
            and Peripheral Role & Peripheral Role
          Low Duty Cycle Directed Advertising State
            and Connection State (Peripheral Role)
            and Peripheral Role & Peripheral Role
          Initiating State
            and Connection State (Peripheral Role)
            and Central Role & Peripheral Role
< HCI Command: LE Read Maximum Data.. (0x08|0x002f) plen 0  #23 [hci1] 0.644962
> HCI Event: Command Complete (0x0e) plen 12                #24 [hci1] 0.645489
      LE Read Maximum Data Length (0x08|0x002f) ncmd 1
        Status: Success (0x00)
        Max TX octets: 251
        Max TX time: 2704
        Max RX octets: 251
        Max RX time: 2704
< HCI Command: LE Write Suggested D.. (0x08|0x0024) plen 4  #25 [hci1] 0.664966
        TX octets: 251
        TX time: 2704
> HCI Event: Command Complete (0x0e) plen 4                 #26 [hci1] 0.665401
      LE Write Suggested Default Data Length (0x08|0x0024) ncmd 1
        Status: Success (0x00)
< HCI Command: LE Read Resolving Li.. (0x08|0x002a) plen 0  #27 [hci1] 0.684964
> HCI Event: Command Complete (0x0e) plen 5                 #28 [hci1] 0.685400
      LE Read Resolving List Size (0x08|0x002a) ncmd 1
        Status: Success (0x00)
        Size: 8
< HCI Command: LE Set Event Mask (0x08|0x0001) plen 8       #29 [hci1] 0.704960
        Mask: 0x000002023f87fa5e
          LE Advertising Report
          LE Connection Update Complete
          LE Read Remote Used Features Complete
          LE Long Term Key Request
          LE Data Length Change
          LE Enhanced Connection Complete
          LE PHY Update Complete
          LE Extended Advertising Report
          LE Periodic Advertising Sync Established
          LE Periodic Advertising Report
          LE Periodic Advertising Sync Lost
          LE Extended Scan Timeout
          LE Extended Advertising Set Terminated
          LE Scan Request Received
          LE Periodic Advertising Sync Transfer Rvc
          LE CIS Established
          LE CIS Request
          LE Create BIG Complete
          LE Terminate BIG Complete
          LE BIG Sync Estabilished Complete
          LE BIG Sync Lost
          LE BIG Info Advertising Report
          Unknown mask (0x0000020000000000)
> HCI Event: Command Complete (0x0e) plen 4                 #30 [hci1] 0.705522
      LE Set Event Mask (0x08|0x0001) ncmd 1
        Status: Success (0x00)
< HCI Command: Set Event Mask (0x03|0x0001) plen 8          #31 [hci1] 0.724971
        Mask: 0x2000800002008890
          Disconnection Complete
          Encryption Change
          Read Remote Version Information Complete
          Hardware Error
          Data Buffer Overflow
          Encryption Key Refresh Complete
          LE Meta
> HCI Event: Command Complete (0x0e) plen 4                 #32 [hci1] 0.725494
      Set Event Mask (0x03|0x0001) ncmd 1
        Status: Success (0x00)
< HCI Command: Read BD ADDR (0x04|0x0009) plen 0            #33 [hci1] 0.744982
> HCI Event: Command Complete (0x0e) plen 10                #34 [hci1] 0.745419
      Read BD ADDR (0x04|0x0009) ncmd 1
        Status: Success (0x00)
        Address: 00:00:00:00:00:00 (OUI 00-00-00)
< HCI Command: LE Set Random Address (0x08|0x0005) plen 6   #35 [hci1] 0.764966
        Address: D5:B6:CC:31:DB:3B (Static)
> HCI Event: Command Complete (0x0e) plen 4                 #36 [hci1] 0.765529
      LE Set Random Address (0x08|0x0005) ncmd 1
        Status: Success (0x00)
< HCI Command: LE Set Extended Adv.. (0x08|0x0036) plen 25  #37 [hci1] 3.325626
        Handle: 0x00
        Properties: 0x0013
          Connectable
          Scannable
          Use legacy advertising PDUs: ADV_IND
        Min advertising interval: 100.000 msec (0x00a0)
        Max advertising interval: 150.000 msec (0x00f0)
        Channel map: 37, 38, 39 (0x07)
        Own address type: Random (0x01)
        Peer address type: Public (0x00)
        Peer address: 00:00:00:00:00:00 (OUI 00-00-00)
        Filter policy: Allow Scan Request from Any, Allow Connect Request from Any (0x00)
        TX power: Host has no preference (0x7f)
        Primary PHY: LE 1M (0x01)
        Secondary max skip: 0x00
        Secondary PHY: LE 1M (0x01)
        SID: 0x00
        Scan request notifications: Disabled (0x00)
> HCI Event: Command Complete (0x0e) plen 5                 #38 [hci1] 3.326415
      LE Set Extended Advertising Parameters (0x08|0x0036) ncmd 1
        Status: Success (0x00)
        TX power (selected): 0 dbm (0x00)
< HCI Command: LE Set Advertising S.. (0x08|0x0035) plen 7  #39 [hci1] 3.344986
        Advertising handle: 0x00
        Advertising random address: D5:B6:CC:31:DB:3B (Static)
> HCI Event: Command Complete (0x0e) plen 4                 #40 [hci1] 3.345478
      LE Set Advertising Set Random Address (0x08|0x0035) ncmd 1
        Status: Success (0x00)
< HCI Command: LE Set Extended Adv.. (0x08|0x0037) plen 22  #41 [hci1] 3.364985
        Handle: 0x00
        Operation: Complete extended advertising data (0x03)
        Fragment preference: Minimize fragmentation (0x01)
        Data length: 0x12
        Flags: 0x06
          LE General Discoverable Mode
          BR/EDR Not Supported
        Name (complete): Tester_F6B11A
> HCI Event: Command Complete (0x0e) plen 4                 #42 [hci1] 3.365687
      LE Set Extended Advertising Data (0x08|0x0037) ncmd 1
        Status: Success (0x00)
< HCI Command: LE Set Extended Scan.. (0x08|0x0038) plen 4  #43 [hci1] 3.384983
        Handle: 0x00
        Operation: Complete scan response data (0x03)
        Fragment preference: Minimize fragmentation (0x01)
        Data length: 0x00
> HCI Event: Command Complete (0x0e) plen 4                 #44 [hci1] 3.385435
      LE Set Extended Scan Response Data (0x08|0x0038) ncmd 1
        Status: Success (0x00)
< HCI Command: LE Set Extended Adve.. (0x08|0x0039) plen 6  #45 [hci1] 3.404990
        Extended advertising: Enabled (0x01)
        Number of sets: 1 (0x01)
        Entry 0
          Handle: 0x00
          Duration: 0 ms (0x00)
          Max ext adv events: 0
> HCI Event: Command Complete (0x0e) plen 4                 #46 [hci1] 3.405621
      LE Set Extended Advertising Enable (0x08|0x0039) ncmd 1
        Status: Success (0x00)
> HCI Event: LE Meta Event (0x3e) plen 31                   #47 [hci1] 3.517671
      LE Enhanced Connection Complete (0x0a)
        Status: Success (0x00)
        Handle: 2595
        Role: Peripheral (0x01)
        Peer address type: Public (0x00)
        Peer address: DF:A9:FF:F6:B1:1A (OUI DF-A9-FF)
        Local resolvable private address: 00:00:00:00:00:00 (Non-Resolvable)
        Peer resolvable private address: 00:00:00:00:00:00 (Non-Resolvable)
        Connection interval: 87.50 msec (0x0046)
        Connection latency: 0 (0x0000)
        Supervision timeout: 25120 msec (0x09d0)
        Central clock accuracy: 0x01
> HCI Event: LE Meta Event (0x3e) plen 6                    #48 [hci1] 3.517714
      LE Advertising Set Terminated (0x12)
        Status: Success (0x00)
        Handle: 0
        Connection handle: 2595
        Number of completed extended advertising events: 0
< HCI Command: LE Read Remote Used... (0x08|0x0016) plen 2  #49 [hci1] 3.526117
        Handle: 2595 Address: DF:A9:FF:F6:B1:1A (OUI DF-A9-FF)
< ACL Data TX: Handle 2595 flags 0x00 dlen 7                #50 [hci1] 3.526187
      ATT: Exchange MTU Request (0x02) len 2
        Client RX MTU: 251
> HCI Event: Command Status (0x0f) plen 4                   #51 [hci1] 3.526605
      LE Read Remote Used Features (0x08|0x0016) ncmd 1
        Status: Success (0x00)
> HCI Event: Number of Completed Packets (0x13) plen 5      #52 [hci1] 3.693674
        Num handles: 1
        Handle: 2595 Address: DF:A9:FF:F6:B1:1A (OUI DF-A9-FF)
        Count: 1
        #50: len 7 (0 Kb/s)
        Latency: 167 msec (167-167 msec ~167 msec)
> HCI Event: LE Meta Event (0x3e) plen 12                   #53 [hci1] 3.781522
      LE Read Remote Used Features (0x04)
        Status: Success (0x00)
        Handle: 2595 Address: DF:A9:FF:F6:B1:1A (OUI DF-A9-FF)
        Features: 0x2d 0x49 0x00 0xf7 0x67 0xd9 0x00 0x80
          LE Encryption
          Extended Reject Indication
          Peripheral-initiated Features Exchange
          LE Data Packet Length Extension
          LE 2M PHY
          LE Coded PHY
          Channel Selection Algorithm #2
          Periodic Advertising Sync Transfer - Sender
          Periodic Advertising Sync Transfer - Recipient
          Sleep Clock Accuracy Updates
          Connected Isochronous Stream - Central
          Connected Isochronous Stream - Peripheral
          Isochronous Broadcaster
          Synchronized Receiver
          Connected Isochronous Stream (Host Support)
          LE Power Control Request
          LE Power Control Request
          Connection Subrating
          Connection Subrating (Host Support)
          Unknown features (0x8000d90000000000)
> ACL Data RX: Handle 2595 flags 0x02 dlen 11               #54 [hci1] 6.231232
      SMP: Pairing Request (0x01) len 6
        IO capability: KeyboardDisplay (0x04)
        OOB data: Authentication data not present (0x00)
        Authentication requirement: Bonding, MITM, SC, No Keypresses (0x0d)
        Max encryption key size: 16
        Initiator key distribution: EncKey IdKey (0x03)
        Responder key distribution: EncKey IdKey Sign (0x07)
> ACL Data RX: Handle 2595 flags 0x02 dlen 7                #55 [hci1] 6.231724
      ATT: Exchange MTU Response (0x03) len 2
        Server RX MTU: 23
< HCI Command: Host Number of Compl.. (0x03|0x0035) plen 5  #56 [hci1] 6.245471
        Num handles: 1
        Handle: 2595 Address: DF:A9:FF:F6:B1:1A (OUI DF-A9-FF)
        Count: 1
< ACL Data TX: Handle 2595 flags 0x00 dlen 11               #57 [hci1] 6.245603
      SMP: Pairing Response (0x02) len 6
        IO capability: DisplayOnly (0x00)
        OOB data: Authentication data not present (0x00)
        Authentication requirement: Bonding, No MITM, SC, No Keypresses (0x09)
        Max encryption key size: 16
        Initiator key distribution: IdKey (0x02)
        Responder key distribution: <none> (0x00)
< HCI Command: Host Number of Compl.. (0x03|0x0035) plen 5  #58 [hci1] 6.245877
        Num handles: 1
        Handle: 2595 Address: DF:A9:FF:F6:B1:1A (OUI DF-A9-FF)
        Count: 1
> HCI Event: Number of Completed Packets (0x13) plen 5      #59 [hci1] 6.406336
        Num handles: 1
        Handle: 2595 Address: DF:A9:FF:F6:B1:1A (OUI DF-A9-FF)
        Count: 1
        #57: len 11 (0 Kb/s)
        Latency: 160 msec (160-167 msec ~164 msec)
> ACL Data RX: Handle 2595 flags 0x02 dlen 27               #60 [hci1] 6.406647
> ACL Data RX: Handle 2595 flags 0x01 dlen 27               #61 [hci1] 6.407154
> ACL Data RX: Handle 2595 flags 0x01 dlen 15               #62 [hci1] 6.407576
      SMP: Pairing Public Key (0x0c) len 64
        X: 3d289b35e99a368327f79650682a15f1ee5546468ca83dda308ee6ad40b20923
        Y: b20df18364d032ac77b0fa31f47082efbfcb44534bd4289eb944ab350e9d0497
< HCI Command: Host Number of Compl.. (0x03|0x0035) plen 5  #63 [hci1] 6.425919
        Num handles: 1
        Handle: 2595 Address: DF:A9:FF:F6:B1:1A (OUI DF-A9-FF)
        Count: 1
< HCI Command: Host Number of Compl.. (0x03|0x0035) plen 5  #64 [hci1] 6.426208
        Num handles: 1
        Handle: 2595 Address: DF:A9:FF:F6:B1:1A (OUI DF-A9-FF)
        Count: 1
< HCI Command: Host Number of Compl.. (0x03|0x0035) plen 5  #65 [hci1] 6.426648
        Num handles: 1
        Handle: 2595 Address: DF:A9:FF:F6:B1:1A (OUI DF-A9-FF)
        Count: 1
< ACL Data TX: Handle 2595 flags 0x00 dlen 27               #66 [hci1] 6.426849
< ACL Data TX: Handle 2595 flags 0x01 dlen 27               #67 [hci1] 6.426868
< ACL Data TX: Handle 2595 flags 0x01 dlen 15               #68 [hci1] 6.426897
      SMP: Pairing Public Key (0x0c) len 64
        X: 98308440221e2d910f0e54b71e7ec652857aa9b5a0dc65028824cc19db1226e9
        Y: 67a4816bcb62efb21701e31fdb27561a6217575fb007a8bbdabe7e28b6f68482
> HCI Event: Number of Completed Packets (0x13) plen 5      #69 [hci1] 6.494241
        Num handles: 1
        Handle: 2595 Address: DF:A9:FF:F6:B1:1A (OUI DF-A9-FF)
        Count: 1
        #66: len 27 (3 Kb/s)
        Latency: 67 msec (67-167 msec ~115 msec)
> HCI Event: Number of Completed Packets (0x13) plen 5      #70 [hci1] 6.494875
        Num handles: 1
        Handle: 2595 Address: DF:A9:FF:F6:B1:1A (OUI DF-A9-FF)
        Count: 1
        #67: len 27 (3 Kb/s)
        Latency: 68 msec (67-167 msec ~91 msec)
> HCI Event: Number of Completed Packets (0x13) plen 5      #71 [hci1] 6.581118
        Num handles: 1
        Handle: 2595 Address: DF:A9:FF:F6:B1:1A (OUI DF-A9-FF)
        Count: 1
        #68: len 15 (0 Kb/s)
        Latency: 154 msec (67-167 msec ~123 msec)
> ACL Data RX: Handle 2595 flags 0x02 dlen 21               #72 [hci1] 7.543989
      SMP: Pairing Confirm (0x03) len 16
        Confim value: 6c07f2fe15c9fd6d16d94fd2edc87098
< HCI Command: Host Number of Compl.. (0x03|0x0035) plen 5  #73 [hci1] 7.545326
        Num handles: 1
        Handle: 2595 Address: DF:A9:FF:F6:B1:1A (OUI DF-A9-FF)
        Count: 1
< ACL Data TX: Handle 2595 flags 0x00 dlen 21               #74 [hci1] 7.545384
      SMP: Pairing Confirm (0x03) len 16
        Confim value: d1e1aade2c2b387112e8d70f2c9c2abf
> HCI Event: Number of Completed Packets (0x13) plen 5      #75 [hci1] 7.718939
        Num handles: 1
        Handle: 2595 Address: DF:A9:FF:F6:B1:1A (OUI DF-A9-FF)
        Count: 1
        #74: len 21 (0 Kb/s)
        Latency: 173 msec (67-173 msec ~148 msec)
> ACL Data RX: Handle 2595 flags 0x02 dlen 21               #76 [hci1] 7.719041
      SMP: Pairing Random (0x04) len 16
        Random value: 327055379a8243a00000000000000000
< HCI Command: Host Number of Compl.. (0x03|0x0035) plen 5  #77 [hci1] 7.725375
        Num handles: 1
        Handle: 2595 Address: DF:A9:FF:F6:B1:1A (OUI DF-A9-FF)
        Count: 1
< ACL Data TX: Handle 2595 flags 0x00 dlen 21               #78 [hci1] 7.725469
      SMP: Pairing Random (0x04) len 16
        Random value: 8e6108f966a694cbe26df70bb96773e6
> HCI Event: Number of Completed Packets (0x13) plen 5      #79 [hci1] 7.893522
        Num handles: 1
        Handle: 2595 Address: DF:A9:FF:F6:B1:1A (OUI DF-A9-FF)
        Count: 1
        #78: len 21 (1 Kb/s)
        Latency: 168 msec (67-173 msec ~158 msec)
> ACL Data RX: Handle 2595 flags 0x02 dlen 21               #80 [hci1] 7.981392
      SMP: Pairing Confirm (0x03) len 16
        Confim value: b3e470beb4bf007c8ec6f1329af2a1f7
< HCI Command: Host Number of Compl.. (0x03|0x0035) plen 5  #81 [hci1] 7.985282
        Num handles: 1
        Handle: 2595 Address: DF:A9:FF:F6:B1:1A (OUI DF-A9-FF)
        Count: 1
< ACL Data TX: Handle 2595 flags 0x00 dlen 21               #82 [hci1] 7.985387
      SMP: Pairing Confirm (0x03) len 16
        Confim value: a5a19e7b3eb58891dd077d81d063dddd
> HCI Event: Number of Completed Packets (0x13) plen 5      #83 [hci1] 8.156282
        Num handles: 1
        Handle: 2595 Address: DF:A9:FF:F6:B1:1A (OUI DF-A9-FF)
        Count: 1
        #82: len 21 (0 Kb/s)
        Latency: 170 msec (67-173 msec ~164 msec)
> ACL Data RX: Handle 2595 flags 0x02 dlen 21               #84 [hci1] 8.156568
      SMP: Pairing Random (0x04) len 16
        Random value: bd8658b8b853564f0000000000000000
< HCI Command: Host Number of Compl.. (0x03|0x0035) plen 5  #85 [hci1] 8.165817
        Num handles: 1
        Handle: 2595 Address: DF:A9:FF:F6:B1:1A (OUI DF-A9-FF)
        Count: 1
< ACL Data TX: Handle 2595 flags 0x00 dlen 21               #86 [hci1] 8.165982
      SMP: Pairing Random (0x04) len 16
        Random value: 4d02679f89a05211af56d8b3da64d21e
> HCI Event: Number of Completed Packets (0x13) plen 5      #87 [hci1] 8.331005
        Num handles: 1
        Handle: 2595 Address: DF:A9:FF:F6:B1:1A (OUI DF-A9-FF)
        Count: 1
        #86: len 21 (1 Kb/s)
        Latency: 165 msec (67-173 msec ~164 msec)
> ACL Data RX: Handle 2595 flags 0x02 dlen 21               #88 [hci1] 8.418935
      SMP: Pairing Confirm (0x03) len 16
        Confim value: 8ee53c26b9442fbf78aa3a7739d62c92
< HCI Command: Host Number of Compl.. (0x03|0x0035) plen 5  #89 [hci1] 8.425276
        Num handles: 1
        Handle: 2595 Address: DF:A9:FF:F6:B1:1A (OUI DF-A9-FF)
        Count: 1
< ACL Data TX: Handle 2595 flags 0x00 dlen 21               #90 [hci1] 8.425374
      SMP: Pairing Confirm (0x03) len 16
        Confim value: 02fca3ab3cc5eebbbf8413c616dfa0dd
> HCI Event: Number of Completed Packets (0x13) plen 5      #91 [hci1] 8.593750
        Num handles: 1
        Handle: 2595 Address: DF:A9:FF:F6:B1:1A (OUI DF-A9-FF)
        Count: 1
        #90: len 21 (1 Kb/s)
        Latency: 168 msec (67-173 msec ~166 msec)
> ACL Data RX: Handle 2595 flags 0x02 dlen 21               #92 [hci1] 8.594106
      SMP: Pairing Random (0x04) len 16
        Random value: 0d14b1b61dceddc50000000000000000
< HCI Command: Host Number of Compl.. (0x03|0x0035) plen 5  #93 [hci1] 8.605937
        Num handles: 1
        Handle: 2595 Address: DF:A9:FF:F6:B1:1A (OUI DF-A9-FF)
        Count: 1
< ACL Data TX: Handle 2595 flags 0x00 dlen 21               #94 [hci1] 8.606091
      SMP: Pairing Random (0x04) len 16
        Random value: 5e8286bc235a02440d0c3424a2acf8fd
> HCI Event: Number of Completed Packets (0x13) plen 5      #95 [hci1] 8.768587
        Num handles: 1
        Handle: 2595 Address: DF:A9:FF:F6:B1:1A (OUI DF-A9-FF)
        Count: 1
        #94: len 21 (1 Kb/s)
        Latency: 162 msec (67-173 msec ~164 msec)
> ACL Data RX: Handle 2595 flags 0x02 dlen 21               #96 [hci1] 8.856449
      SMP: Pairing Confirm (0x03) len 16
        Confim value: 922c6adf22ecb3df651fec497895966d
< HCI Command: Host Number of Compl.. (0x03|0x0035) plen 5  #97 [hci1] 8.865083
        Num handles: 1
        Handle: 2595 Address: DF:A9:FF:F6:B1:1A (OUI DF-A9-FF)
        Count: 1
< ACL Data TX: Handle 2595 flags 0x00 dlen 21               #98 [hci1] 8.865125
      SMP: Pairing Confirm (0x03) len 16
        Confim value: 8c2f62e80d34c1e1c877978cf66f401b
> HCI Event: Number of Completed Packets (0x13) plen 5      #99 [hci1] 9.031340
        Num handles: 1
        Handle: 2595 Address: DF:A9:FF:F6:B1:1A (OUI DF-A9-FF)
        Count: 1
        #98: len 21 (1 Kb/s)
        Latency: 166 msec (67-173 msec ~165 msec)
> ACL Data RX: Handle 2595 flags 0x02 dlen 21              #100 [hci1] 9.031597
      SMP: Pairing Random (0x04) len 16
        Random value: 5c5d646a2c88398b0000000000000000
< HCI Command: Host Number of Comp.. (0x03|0x0035) plen 5  #101 [hci1] 9.045175
        Num handles: 1
        Handle: 2595 Address: DF:A9:FF:F6:B1:1A (OUI DF-A9-FF)
        Count: 1
< ACL Data TX: Handle 2595 flags 0x00 dlen 21              #102 [hci1] 9.045249
      SMP: Pairing Random (0x04) len 16
        Random value: 5c4a1bcadd27bd58e945097b00bad7ac
> HCI Event: Number of Completed Packets (0x13) plen 5     #103 [hci1] 9.205997
        Num handles: 1
        Handle: 2595 Address: DF:A9:FF:F6:B1:1A (OUI DF-A9-FF)
        Count: 1
        #102: len 21 (1 Kb/s)
        Latency: 160 msec (67-173 msec ~163 msec)
> ACL Data RX: Handle 2595 flags 0x02 dlen 21              #104 [hci1] 9.293915
      SMP: Pairing Confirm (0x03) len 16
        Confim value: 917b3a72e43702c2df141afd06cd78ef
< HCI Command: Host Number of Comp.. (0x03|0x0035) plen 5  #105 [hci1] 9.305569
        Num handles: 1
        Handle: 2595 Address: DF:A9:FF:F6:B1:1A (OUI DF-A9-FF)
        Count: 1
< ACL Data TX: Handle 2595 flags 0x00 dlen 21              #106 [hci1] 9.305703
      SMP: Pairing Confirm (0x03) len 16
        Confim value: b5e01f4b294839714ab3bf7c552d2631
> HCI Event: Number of Completed Packets (0x13) plen 5     #107 [hci1] 9.468727
        Num handles: 1
        Handle: 2595 Address: DF:A9:FF:F6:B1:1A (OUI DF-A9-FF)
        Count: 1
        #106: len 21 (1 Kb/s)
        Latency: 163 msec (67-173 msec ~163 msec)
> ACL Data RX: Handle 2595 flags 0x02 dlen 21              #108 [hci1] 9.469084
      SMP: Pairing Random (0x04) len 16
        Random value: 5384a59dd64e69b70000000000000000
< HCI Command: Host Number of Comp.. (0x03|0x0035) plen 5  #109 [hci1] 9.485924
        Num handles: 1
        Handle: 2595 Address: DF:A9:FF:F6:B1:1A (OUI DF-A9-FF)
        Count: 1
< ACL Data TX: Handle 2595 flags 0x00 dlen 21              #110 [hci1] 9.486078
      SMP: Pairing Random (0x04) len 16
        Random value: 32527e6e64e79f33b2e374394db8ab2d
> HCI Event: Number of Completed Packets (0x13) plen 5     #111 [hci1] 9.643586
        Num handles: 1
        Handle: 2595 Address: DF:A9:FF:F6:B1:1A (OUI DF-A9-FF)
        Count: 1
        #110: len 21 (1 Kb/s)
        Latency: 157 msec (67-173 msec ~160 msec)
> ACL Data RX: Handle 2595 flags 0x02 dlen 21              #112 [hci1] 9.731331
      SMP: Pairing Confirm (0x03) len 16
        Confim value: 4011bf87eb86afc80cf2dfa23f257e65
< HCI Command: Host Number of Comp.. (0x03|0x0035) plen 5  #113 [hci1] 9.745687
        Num handles: 1
        Handle: 2595 Address: DF:A9:FF:F6:B1:1A (OUI DF-A9-FF)
        Count: 1
< ACL Data TX: Handle 2595 flags 0x00 dlen 21              #114 [hci1] 9.745845
      SMP: Pairing Confirm (0x03) len 16
        Confim value: 23d7fe572164d270a6e8069f61e77be2
> HCI Event: Number of Completed Packets (0x13) plen 5     #115 [hci1] 9.906153
        Num handles: 1
        Handle: 2595 Address: DF:A9:FF:F6:B1:1A (OUI DF-A9-FF)
        Count: 1
        #114: len 21 (1 Kb/s)
        Latency: 160 msec (67-173 msec ~160 msec)
> ACL Data RX: Handle 2595 flags 0x02 dlen 21              #116 [hci1] 9.906620
      SMP: Pairing Random (0x04) len 16
        Random value: 941b9b5c3c76ab5e0000000000000000
< HCI Command: Host Number of Comp.. (0x03|0x0035) plen 5  #117 [hci1] 9.925481
        Num handles: 1
        Handle: 2595 Address: DF:A9:FF:F6:B1:1A (OUI DF-A9-FF)
        Count: 1
< ACL Data TX: Handle 2595 flags 0x00 dlen 21              #118 [hci1] 9.925597
      SMP: Pairing Random (0x04) len 16
        Random value: dddbdfe2838e9a8cc6964353c850fef7
> HCI Event: Number of Completed Packets (0x13) plen 5    #119 [hci1] 10.080958
        Num handles: 1
        Handle: 2595 Address: DF:A9:FF:F6:B1:1A (OUI DF-A9-FF)
        Count: 1
        #118: len 21 (1 Kb/s)
        Latency: 155 msec (67-173 msec ~157 msec)
> ACL Data RX: Handle 2595 flags 0x02 dlen 21             #120 [hci1] 10.168963
      SMP: Pairing Confirm (0x03) len 16
        Confim value: 492c0b348b072abc4df590d03d0ce066
< HCI Command: Host Number of Com.. (0x03|0x0035) plen 5  #121 [hci1] 10.185599
        Num handles: 1
        Handle: 2595 Address: DF:A9:FF:F6:B1:1A (OUI DF-A9-FF)
        Count: 1
< ACL Data TX: Handle 2595 flags 0x00 dlen 21             #122 [hci1] 10.185677
      SMP: Pairing Confirm (0x03) len 16
        Confim value: 90144d54144adf7db31cd9b088efdd48
> HCI Event: Number of Completed Packets (0x13) plen 5    #123 [hci1] 10.343702
        Num handles: 1
        Handle: 2595 Address: DF:A9:FF:F6:B1:1A (OUI DF-A9-FF)
        Count: 1
        #122: len 21 (1 Kb/s)
        Latency: 158 msec (67-173 msec ~157 msec)
> ACL Data RX: Handle 2595 flags 0x02 dlen 21             #124 [hci1] 10.344117
      SMP: Pairing Random (0x04) len 16
        Random value: 81fe7763c0a0b0930000000000000000
< HCI Command: Host Number of Com.. (0x03|0x0035) plen 5  #125 [hci1] 10.345795
        Num handles: 1
        Handle: 2595 Address: DF:A9:FF:F6:B1:1A (OUI DF-A9-FF)
        Count: 1
< ACL Data TX: Handle 2595 flags 0x00 dlen 21             #126 [hci1] 10.345950
      SMP: Pairing Random (0x04) len 16
        Random value: eb9f1915536596b6fc3db1c86b2b1970
> HCI Event: Number of Completed Packets (0x13) plen 5    #127 [hci1] 10.518446
        Num handles: 1
        Handle: 2595 Address: DF:A9:FF:F6:B1:1A (OUI DF-A9-FF)
        Count: 1
        #126: len 21 (0 Kb/s)
        Latency: 172 msec (67-173 msec ~165 msec)
> ACL Data RX: Handle 2595 flags 0x02 dlen 21             #128 [hci1] 10.606331
      SMP: Pairing Confirm (0x03) len 16
        Confim value: 4687dd27d58d5ab4b03491045a98e4bb
< HCI Command: Host Number of Com.. (0x03|0x0035) plen 5  #129 [hci1] 10.625676
        Num handles: 1
        Handle: 2595 Address: DF:A9:FF:F6:B1:1A (OUI DF-A9-FF)
        Count: 1
< ACL Data TX: Handle 2595 flags 0x00 dlen 21             #130 [hci1] 10.625828
      SMP: Pairing Confirm (0x03) len 16
        Confim value: 661506647803b9f3d16ccd29b7106bcc
> HCI Event: Number of Completed Packets (0x13) plen 5    #131 [hci1] 10.781190
        Num handles: 1
        Handle: 2595 Address: DF:A9:FF:F6:B1:1A (OUI DF-A9-FF)
        Count: 1
        #130: len 21 (1 Kb/s)
        Latency: 155 msec (67-173 msec ~160 msec)
> ACL Data RX: Handle 2595 flags 0x02 dlen 21             #132 [hci1] 10.781682
      SMP: Pairing Random (0x04) len 16
        Random value: 0d48536ccc73995c0000000000000000
< HCI Command: Host Number of Com.. (0x03|0x0035) plen 5  #133 [hci1] 10.785870
        Num handles: 1
        Handle: 2595 Address: DF:A9:FF:F6:B1:1A (OUI DF-A9-FF)
        Count: 1
< ACL Data TX: Handle 2595 flags 0x00 dlen 21             #134 [hci1] 10.785975
      SMP: Pairing Random (0x04) len 16
        Random value: 5c794dc9ad9f2c3f295ebd5ad5e1c3cf
> HCI Event: Number of Completed Packets (0x13) plen 5    #135 [hci1] 10.955914
        Num handles: 1
        Handle: 2595 Address: DF:A9:FF:F6:B1:1A (OUI DF-A9-FF)
        Count: 1
        #134: len 21 (0 Kb/s)
        Latency: 169 msec (67-173 msec ~165 msec)
> ACL Data RX: Handle 2595 flags 0x02 dlen 21             #136 [hci1] 11.043968
      SMP: Pairing Confirm (0x03) len 16
        Confim value: 1fadab214a88eb66c3daabf6bb83efcc
< HCI Command: Host Number of Com.. (0x03|0x0035) plen 5  #137 [hci1] 11.045311
        Num handles: 1
        Handle: 2595 Address: DF:A9:FF:F6:B1:1A (OUI DF-A9-FF)
        Count: 1
< ACL Data TX: Handle 2595 flags 0x00 dlen 21             #138 [hci1] 11.045413
      SMP: Pairing Confirm (0x03) len 16
        Confim value: 1865acfceccc201c39af394d6ec47b8b
> HCI Event: Number of Completed Packets (0x13) plen 5    #139 [hci1] 11.218752
        Num handles: 1
        Handle: 2595 Address: DF:A9:FF:F6:B1:1A (OUI DF-A9-FF)
        Count: 1
        #138: len 21 (0 Kb/s)
        Latency: 173 msec (67-173 msec ~169 msec)
> ACL Data RX: Handle 2595 flags 0x02 dlen 21             #140 [hci1] 11.218993
      SMP: Pairing Random (0x04) len 16
        Random value: 614f1977d95391bb0000000000000000
< HCI Command: Host Number of Com.. (0x03|0x0035) plen 5  #141 [hci1] 11.225923
        Num handles: 1
        Handle: 2595 Address: DF:A9:FF:F6:B1:1A (OUI DF-A9-FF)
        Count: 1
< ACL Data TX: Handle 2595 flags 0x00 dlen 21             #142 [hci1] 11.226054
      SMP: Pairing Random (0x04) len 16
        Random value: 5c2fff312cdf99c9491988e877355a9a
> HCI Event: Number of Completed Packets (0x13) plen 5    #143 [hci1] 11.393496
        Num handles: 1
        Handle: 2595 Address: DF:A9:FF:F6:B1:1A (OUI DF-A9-FF)
        Count: 1
        #142: len 21 (1 Kb/s)
        Latency: 167 msec (67-173 msec ~168 msec)
> ACL Data RX: Handle 2595 flags 0x02 dlen 21             #144 [hci1] 11.481352
      SMP: Pairing Confirm (0x03) len 16
        Confim value: a85b7d2bec0eb4154632bc3e6da5a482
< HCI Command: Host Number of Com.. (0x03|0x0035) plen 5  #145 [hci1] 11.485226
        Num handles: 1
        Handle: 2595 Address: DF:A9:FF:F6:B1:1A (OUI DF-A9-FF)
        Count: 1
< ACL Data TX: Handle 2595 flags 0x00 dlen 21             #146 [hci1] 11.485262
      SMP: Pairing Confirm (0x03) len 16
        Confim value: 1a3534000c8f8a421a3c16a05f0c0689
> HCI Event: Number of Completed Packets (0x13) plen 5    #147 [hci1] 11.656166
        Num handles: 1
        Handle: 2595 Address: DF:A9:FF:F6:B1:1A (OUI DF-A9-FF)
        Count: 1
        #146: len 21 (0 Kb/s)
        Latency: 170 msec (67-173 msec ~169 msec)
> ACL Data RX: Handle 2595 flags 0x02 dlen 21             #148 [hci1] 11.656474
      SMP: Pairing Random (0x04) len 16
        Random value: e957338a0505f23c0000000000000000
< HCI Command: Host Number of Com.. (0x03|0x0035) plen 5  #149 [hci1] 11.665886
        Num handles: 1
        Handle: 2595 Address: DF:A9:FF:F6:B1:1A (OUI DF-A9-FF)
        Count: 1
< ACL Data TX: Handle 2595 flags 0x00 dlen 21             #150 [hci1] 11.666061
      SMP: Pairing Random (0x04) len 16
        Random value: c629a3a987d808e808655d558dfc1155
> HCI Event: Number of Completed Packets (0x13) plen 5    #151 [hci1] 11.831014
        Num handles: 1
        Handle: 2595 Address: DF:A9:FF:F6:B1:1A (OUI DF-A9-FF)
        Count: 1
        #150: len 21 (1 Kb/s)
        Latency: 164 msec (67-173 msec ~167 msec)
> ACL Data RX: Handle 2595 flags 0x02 dlen 21             #152 [hci1] 11.918969
      SMP: Pairing Confirm (0x03) len 16
        Confim value: 24d89fbb50af6d1f065acc6f7425b96b
< HCI Command: Host Number of Com.. (0x03|0x0035) plen 5  #153 [hci1] 11.925678
        Num handles: 1
        Handle: 2595 Address: DF:A9:FF:F6:B1:1A (OUI DF-A9-FF)
        Count: 1
< ACL Data TX: Handle 2595 flags 0x00 dlen 21             #154 [hci1] 11.925832
      SMP: Pairing Confirm (0x03) len 16
        Confim value: c9592351f1c331e95a125bb34383c1ea
> HCI Event: Number of Completed Packets (0x13) plen 5    #155 [hci1] 12.093683
        Num handles: 1
        Handle: 2595 Address: DF:A9:FF:F6:B1:1A (OUI DF-A9-FF)
        Count: 1
        #154: len 21 (1 Kb/s)
        Latency: 167 msec (67-173 msec ~167 msec)
> ACL Data RX: Handle 2595 flags 0x02 dlen 21             #156 [hci1] 12.094005
      SMP: Pairing Random (0x04) len 16
        Random value: 063d9676cf3cffbb0000000000000000
< HCI Command: Host Number of Com.. (0x03|0x0035) plen 5  #157 [hci1] 12.105263
        Num handles: 1
        Handle: 2595 Address: DF:A9:FF:F6:B1:1A (OUI DF-A9-FF)
        Count: 1
< ACL Data TX: Handle 2595 flags 0x00 dlen 21             #158 [hci1] 12.105330
      SMP: Pairing Random (0x04) len 16
        Random value: 92f20f6ad8f13724432c7fd6001c45ff
> HCI Event: Number of Completed Packets (0x13) plen 5    #159 [hci1] 12.268624
        Num handles: 1
        Handle: 2595 Address: DF:A9:FF:F6:B1:1A (OUI DF-A9-FF)
        Count: 1
        #158: len 21 (1 Kb/s)
        Latency: 163 msec (67-173 msec ~165 msec)
> ACL Data RX: Handle 2595 flags 0x02 dlen 21             #160 [hci1] 12.356373
      SMP: Pairing Confirm (0x03) len 16
        Confim value: d0667ccc33136b7b9d7ad411d35c6de8
< HCI Command: Host Number of Com.. (0x03|0x0035) plen 5  #161 [hci1] 12.365614
        Num handles: 1
        Handle: 2595 Address: DF:A9:FF:F6:B1:1A (OUI DF-A9-FF)
        Count: 1
< ACL Data TX: Handle 2595 flags 0x00 dlen 21             #162 [hci1] 12.365706
      SMP: Pairing Confirm (0x03) len 16
        Confim value: 69359429a2e76248d3c3a1ca41db1260
> HCI Event: Number of Completed Packets (0x13) plen 5    #163 [hci1] 12.531145
        Num handles: 1
        Handle: 2595 Address: DF:A9:FF:F6:B1:1A (OUI DF-A9-FF)
        Count: 1
        #162: len 21 (1 Kb/s)
        Latency: 165 msec (67-173 msec ~165 msec)
> ACL Data RX: Handle 2595 flags 0x02 dlen 21             #164 [hci1] 12.531550
      SMP: Pairing Random (0x04) len 16
        Random value: 08df8fd19c030f2a0000000000000000
< HCI Command: Host Number of Com.. (0x03|0x0035) plen 5  #165 [hci1] 12.545862
        Num handles: 1
        Handle: 2595 Address: DF:A9:FF:F6:B1:1A (OUI DF-A9-FF)
        Count: 1
< ACL Data TX: Handle 2595 flags 0x00 dlen 21             #166 [hci1] 12.546017
      SMP: Pairing Random (0x04) len 16
        Random value: 23ac32ebbb5e14c8a6b9622f296d277f
> HCI Event: Number of Completed Packets (0x13) plen 5    #167 [hci1] 12.705924
        Num handles: 1
        Handle: 2595 Address: DF:A9:FF:F6:B1:1A (OUI DF-A9-FF)
        Count: 1
        #166: len 21 (1 Kb/s)
        Latency: 159 msec (67-173 msec ~162 msec)
> ACL Data RX: Handle 2595 flags 0x02 dlen 21             #168 [hci1] 12.793809
      SMP: Pairing Confirm (0x03) len 16
        Confim value: f7d138114646702985b5b2c180c49957
< HCI Command: Host Number of Com.. (0x03|0x0035) plen 5  #169 [hci1] 12.805663
        Num handles: 1
        Handle: 2595 Address: DF:A9:FF:F6:B1:1A (OUI DF-A9-FF)
        Count: 1
< ACL Data TX: Handle 2595 flags 0x00 dlen 21             #170 [hci1] 12.805770
      SMP: Pairing Confirm (0x03) len 16
        Confim value: e791f0eaa62740e345ddeb1645de4a8d
> HCI Event: Number of Completed Packets (0x13) plen 5    #171 [hci1] 12.968636
        Num handles: 1
        Handle: 2595 Address: DF:A9:FF:F6:B1:1A (OUI DF-A9-FF)
        Count: 1
        #170: len 21 (1 Kb/s)
        Latency: 162 msec (67-173 msec ~162 msec)
> ACL Data RX: Handle 2595 flags 0x02 dlen 21             #172 [hci1] 12.968971
      SMP: Pairing Random (0x04) len 16
        Random value: 261443dd006a887e0000000000000000
< HCI Command: Host Number of Com.. (0x03|0x0035) plen 5  #173 [hci1] 12.986018
        Num handles: 1
        Handle: 2595 Address: DF:A9:FF:F6:B1:1A (OUI DF-A9-FF)
        Count: 1
< ACL Data TX: Handle 2595 flags 0x00 dlen 21             #174 [hci1] 12.986163
      SMP: Pairing Random (0x04) len 16
        Random value: 297efe85e67448a15f56bd27e3a3cf1d
> HCI Event: Number of Completed Packets (0x13) plen 5    #175 [hci1] 13.143378
        Num handles: 1
        Handle: 2595 Address: DF:A9:FF:F6:B1:1A (OUI DF-A9-FF)
        Count: 1
        #174: len 21 (1 Kb/s)
        Latency: 157 msec (67-173 msec ~159 msec)
> ACL Data RX: Handle 2595 flags 0x02 dlen 21             #176 [hci1] 13.231314
      SMP: Pairing Confirm (0x03) len 16
        Confim value: f14c775479ff01c1feb13f622497fed8
< HCI Command: Host Number of Com.. (0x03|0x0035) plen 5  #177 [hci1] 13.245641
        Num handles: 1
        Handle: 2595 Address: DF:A9:FF:F6:B1:1A (OUI DF-A9-FF)
        Count: 1
< ACL Data TX: Handle 2595 flags 0x00 dlen 21             #178 [hci1] 13.245805
      SMP: Pairing Confirm (0x03) len 16
        Confim value: c1f3188b27e813ba3f56f01fdf5a2496
> HCI Event: Number of Completed Packets (0x13) plen 5    #179 [hci1] 13.406110
        Num handles: 1
        Handle: 2595 Address: DF:A9:FF:F6:B1:1A (OUI DF-A9-FF)
        Count: 1
        #178: len 21 (1 Kb/s)
        Latency: 160 msec (67-173 msec ~160 msec)
> ACL Data RX: Handle 2595 flags 0x02 dlen 21             #180 [hci1] 13.406614
      SMP: Pairing Random (0x04) len 16
        Random value: 76defb2c35d226d70000000000000000
< HCI Command: Host Number of Com.. (0x03|0x0035) plen 5  #181 [hci1] 13.425603
        Num handles: 1
        Handle: 2595 Address: DF:A9:FF:F6:B1:1A (OUI DF-A9-FF)
        Count: 1
< ACL Data TX: Handle 2595 flags 0x00 dlen 21             #182 [hci1] 13.425742
      SMP: Pairing Random (0x04) len 16
        Random value: 25a9493fd3ce4faf02be7293595bb7c6
> HCI Event: Number of Completed Packets (0x13) plen 5    #183 [hci1] 13.580995
        Num handles: 1
        Handle: 2595 Address: DF:A9:FF:F6:B1:1A (OUI DF-A9-FF)
        Count: 1
        #182: len 21 (1 Kb/s)
        Latency: 155 msec (67-173 msec ~157 msec)
> ACL Data RX: Handle 2595 flags 0x02 dlen 21             #184 [hci1] 13.668801
      SMP: Pairing Confirm (0x03) len 16
        Confim value: a2b2ccca0abd7ce831afaf9d60823a11
< HCI Command: Host Number of Com.. (0x03|0x0035) plen 5  #185 [hci1] 13.685785
        Num handles: 1
        Handle: 2595 Address: DF:A9:FF:F6:B1:1A (OUI DF-A9-FF)
        Count: 1
< ACL Data TX: Handle 2595 flags 0x00 dlen 21             #186 [hci1] 13.685915
      SMP: Pairing Confirm (0x03) len 16
        Confim value: 884de09f50b6b95d687d68fb69b00b91
> HCI Event: Number of Completed Packets (0x13) plen 5    #187 [hci1] 13.843642
        Num handles: 1
        Handle: 2595 Address: DF:A9:FF:F6:B1:1A (OUI DF-A9-FF)
        Count: 1
        #186: len 21 (1 Kb/s)
        Latency: 157 msec (67-173 msec ~157 msec)
> ACL Data RX: Handle 2595 flags 0x02 dlen 21             #188 [hci1] 13.843971
      SMP: Pairing Random (0x04) len 16
        Random value: 77ddc1d735a665280000000000000000
< HCI Command: Host Number of Com.. (0x03|0x0035) plen 5  #189 [hci1] 13.845878
        Num handles: 1
        Handle: 2595 Address: DF:A9:FF:F6:B1:1A (OUI DF-A9-FF)
        Count: 1
< ACL Data TX: Handle 2595 flags 0x00 dlen 21             #190 [hci1] 13.846023
      SMP: Pairing Random (0x04) len 16
        Random value: 58f6b41f855a6f6c3560debd84e2affc
> HCI Event: Number of Completed Packets (0x13) plen 5    #191 [hci1] 14.018468
        Num handles: 1
        Handle: 2595 Address: DF:A9:FF:F6:B1:1A (OUI DF-A9-FF)
        Count: 1
        #190: len 21 (0 Kb/s)
        Latency: 172 msec (67-173 msec ~165 msec)
> ACL Data RX: Handle 2595 flags 0x02 dlen 21             #192 [hci1] 14.106274
      SMP: Pairing Confirm (0x03) len 16
        Confim value: dbe0b2ff220c83286bd41f4d3247047a
< HCI Command: Host Number of Com.. (0x03|0x0035) plen 5  #193 [hci1] 14.125253
        Num handles: 1
        Handle: 2595 Address: DF:A9:FF:F6:B1:1A (OUI DF-A9-FF)
        Count: 1
< ACL Data TX: Handle 2595 flags 0x00 dlen 21             #194 [hci1] 14.125277
      SMP: Pairing Confirm (0x03) len 16
        Confim value: 9766a3c72d577d7437d16d0e1c3a6d8f
> HCI Event: Number of Completed Packets (0x13) plen 5    #195 [hci1] 14.281123
        Num handles: 1
        Handle: 2595 Address: DF:A9:FF:F6:B1:1A (OUI DF-A9-FF)
        Count: 1
        #194: len 21 (1 Kb/s)
        Latency: 155 msec (67-173 msec ~160 msec)
> ACL Data RX: Handle 2595 flags 0x02 dlen 21             #196 [hci1] 14.281402
      SMP: Pairing Random (0x04) len 16
        Random value: caa92bda60bd324b0000000000000000
< HCI Command: Host Number of Com.. (0x03|0x0035) plen 5  #197 [hci1] 14.285886
        Num handles: 1
        Handle: 2595 Address: DF:A9:FF:F6:B1:1A (OUI DF-A9-FF)
        Count: 1
< ACL Data TX: Handle 2595 flags 0x00 dlen 21             #198 [hci1] 14.286012
      SMP: Pairing Random (0x04) len 16
        Random value: b67e7216d5bf664139eda2b542549666
> HCI Event: Number of Completed Packets (0x13) plen 5    #199 [hci1] 14.455936
        Num handles: 1
        Handle: 2595 Address: DF:A9:FF:F6:B1:1A (OUI DF-A9-FF)
        Count: 1
        #198: len 21 (0 Kb/s)
        Latency: 169 msec (67-173 msec ~165 msec)
> ACL Data RX: Handle 2595 flags 0x02 dlen 21             #200 [hci1] 14.543775
      SMP: Pairing Confirm (0x03) len 16
        Confim value: 0ba853979dd88980370e57f4f4a03f21
< HCI Command: Host Number of Com.. (0x03|0x0035) plen 5  #201 [hci1] 14.545285
        Num handles: 1
        Handle: 2595 Address: DF:A9:FF:F6:B1:1A (OUI DF-A9-FF)
        Count: 1
< ACL Data TX: Handle 2595 flags 0x00 dlen 21             #202 [hci1] 14.545374
      SMP: Pairing Confirm (0x03) len 16
        Confim value: cfe0ef9d69c483647464aadd7a818039
> HCI Event: Number of Completed Packets (0x13) plen 5    #203 [hci1] 14.718690
        Num handles: 1
        Handle: 2595 Address: DF:A9:FF:F6:B1:1A (OUI DF-A9-FF)
        Count: 1
        #202: len 21 (0 Kb/s)
        Latency: 173 msec (67-173 msec ~169 msec)
> ACL Data RX: Handle 2595 flags 0x02 dlen 21             #204 [hci1] 14.718940
      SMP: Pairing Random (0x04) len 16
        Random value: 24237c38aff249a30000000000000000
< HCI Command: Host Number of Com.. (0x03|0x0035) plen 5  #205 [hci1] 14.725357
        Num handles: 1
        Handle: 2595 Address: DF:A9:FF:F6:B1:1A (OUI DF-A9-FF)
        Count: 1
< ACL Data TX: Handle 2595 flags 0x00 dlen 21             #206 [hci1] 14.725443
      SMP: Pairing Random (0x04) len 16
        Random value: ed17f76500c95219dd01e09d1e63f87b
> HCI Event: Number of Completed Packets (0x13) plen 5    #207 [hci1] 14.893466
        Num handles: 1
        Handle: 2595 Address: DF:A9:FF:F6:B1:1A (OUI DF-A9-FF)
        Count: 1
        #206: len 21 (1 Kb/s)
        Latency: 168 msec (67-173 msec ~168 msec)
> ACL Data RX: Handle 2595 flags 0x02 dlen 21             #208 [hci1] 14.981291
      SMP: Pairing Confirm (0x03) len 16
        Confim value: cada94e84d63adec031a859d5dde0c71
< HCI Command: Host Number of Com.. (0x03|0x0035) plen 5  #209 [hci1] 14.985314
        Num handles: 1
        Handle: 2595 Address: DF:A9:FF:F6:B1:1A (OUI DF-A9-FF)
        Count: 1
< ACL Data TX: Handle 2595 flags 0x00 dlen 21             #210 [hci1] 14.985410
      SMP: Pairing Confirm (0x03) len 16
        Confim value: 150ae4fbf3581fab26e300f73d6ce0f2
> HCI Event: Number of Completed Packets (0x13) plen 5    #211 [hci1] 15.156095
        Num handles: 1
        Handle: 2595 Address: DF:A9:FF:F6:B1:1A (OUI DF-A9-FF)
        Count: 1
        #210: len 21 (0 Kb/s)
        Latency: 170 msec (67-173 msec ~169 msec)
> ACL Data RX: Handle 2595 flags 0x02 dlen 21             #212 [hci1] 15.156432
      SMP: Pairing Random (0x04) len 16
        Random value: fec06bb4233298320000000000000000
< HCI Command: Host Number of Com.. (0x03|0x0035) plen 5  #213 [hci1] 15.166034
        Num handles: 1
        Handle: 2595 Address: DF:A9:FF:F6:B1:1A (OUI DF-A9-FF)
        Count: 1
< ACL Data TX: Handle 2595 flags 0x00 dlen 21             #214 [hci1] 15.166185
      SMP: Pairing Random (0x04) len 16
        Random value: 81d35d47e1f6006d79c974bd9d9e1ee3
> HCI Event: Number of Completed Packets (0x13) plen 5    #215 [hci1] 15.331018
        Num handles: 1
        Handle: 2595 Address: DF:A9:FF:F6:B1:1A (OUI DF-A9-FF)
        Count: 1
        #214: len 21 (1 Kb/s)
        Latency: 164 msec (67-173 msec ~167 msec)
> ACL Data RX: Handle 2595 flags 0x02 dlen 21             #216 [hci1] 15.418776
      SMP: Pairing Confirm (0x03) len 16
        Confim value: eed0858e5bf49bf86fb5e1a3a54b29f0
< HCI Command: Host Number of Com.. (0x03|0x0035) plen 5  #217 [hci1] 15.425593
        Num handles: 1
        Handle: 2595 Address: DF:A9:FF:F6:B1:1A (OUI DF-A9-FF)
        Count: 1
< ACL Data TX: Handle 2595 flags 0x00 dlen 21             #218 [hci1] 15.425741
      SMP: Pairing Confirm (0x03) len 16
        Confim value: 43de6575a4d688df3ba67469fed2aa62
> HCI Event: Number of Completed Packets (0x13) plen 5    #219 [hci1] 15.593644
        Num handles: 1
        Handle: 2595 Address: DF:A9:FF:F6:B1:1A (OUI DF-A9-FF)
        Count: 1
        #218: len 21 (1 Kb/s)
        Latency: 167 msec (67-173 msec ~167 msec)
> ACL Data RX: Handle 2595 flags 0x02 dlen 21             #220 [hci1] 15.593922
      SMP: Pairing Random (0x04) len 16
        Random value: b1e354b100a2f36e0000000000000000
< HCI Command: Host Number of Com.. (0x03|0x0035) plen 5  #221 [hci1] 15.605941
        Num handles: 1
        Handle: 2595 Address: DF:A9:FF:F6:B1:1A (OUI DF-A9-FF)
        Count: 1
< ACL Data TX: Handle 2595 flags 0x00 dlen 21             #222 [hci1] 15.606035
      SMP: Pairing Random (0x04) len 16
        Random value: e7f7e0c2476823e41736a7e381bafb7c
> HCI Event: Number of Completed Packets (0x13) plen 5    #223 [hci1] 15.768411
        Num handles: 1
        Handle: 2595 Address: DF:A9:FF:F6:B1:1A (OUI DF-A9-FF)
        Count: 1
        #222: len 21 (1 Kb/s)
        Latency: 162 msec (67-173 msec ~164 msec)
> ACL Data RX: Handle 2595 flags 0x02 dlen 21             #224 [hci1] 15.856314
      SMP: Pairing Confirm (0x03) len 16
        Confim value: f327e3ebe87ff78d37eca2a26d23215e
< HCI Command: Host Number of Com.. (0x03|0x0035) plen 5  #225 [hci1] 15.865317
        Num handles: 1
        Handle: 2595 Address: DF:A9:FF:F6:B1:1A (OUI DF-A9-FF)
        Count: 1
< ACL Data TX: Handle 2595 flags 0x00 dlen 21             #226 [hci1] 15.865410
      SMP: Pairing Confirm (0x03) len 16
        Confim value: eceaed8d9fa786dd40bdbc254c38e688
> HCI Event: Number of Completed Packets (0x13) plen 5    #227 [hci1] 16.031089
        Num handles: 1
        Handle: 2595 Address: DF:A9:FF:F6:B1:1A (OUI DF-A9-FF)
        Count: 1
        #226: len 21 (1 Kb/s)
        Latency: 165 msec (67-173 msec ~165 msec)
> ACL Data RX: Handle 2595 flags 0x02 dlen 21             #228 [hci1] 16.031533
      SMP: Pairing Random (0x04) len 16
        Random value: 1b85ae96cf31762f0000000000000000
