Bluetooth monitor ver 5.84
btmon[1688907]: = Note: Linux version 6.8.0-83-generic (x86_64)                                                          0.798183
btmon[1688907]: = Note: Bluetooth subsystem version 2.22                                                                 0.798185
= New Index: 00:00:00:00:00:00 (Primary,UART,hci0)                                                                       0.798186
= Open Index: 00:00:00:00:00:00                                                                                          0.801683
= Index Info: 00:00:00:00:00:00 (Nordic Semiconductor ASA)                                                               0.801845
zephyr.exe[1688909]: @ USER Open: main (privileged) version 2.22                                                {0x0001} 0.801889
zephyr.exe[1688909]: < HCI Command: Reset (0x03|0x0003) plen 0                                                        #1 0.802949
> HCI Event: Command Complete (0x0e) plen 4                                                                           #2 0.804205
      Reset (0x03|0x0003) ncmd 1
        Status: Success (0x00)
zephyr.exe[1688909]: < HCI Command: Read Local Supported Features (0x04|0x0003) plen 0                                #3 0.821728
> HCI Event: Command Complete (0x0e) plen 12                                                                          #4 0.823070
      Read Local Supported Features (0x04|0x0003) ncmd 1
        Status: Success (0x00)
        Features: 0x00 0x00 0x00 0x00 0x60 0x00 0x00 0x00
          BR/EDR Not Supported
          LE Supported (Controller)
zephyr.exe[1688909]: < HCI Command: Read Local Version Information (0x04|0x0001) plen 0                               #5 0.841734
> HCI Event: Command Complete (0x0e) plen 12                                                                          #6 0.843263
      Read Local Version Information (0x04|0x0001) ncmd 1
        Status: Success (0x00)
        HCI version: Reserved (0x0e) - Revision 12520 (0x30e8)
        LMP version: Reserved (0x0e) - Subversion 12520 (0x30e8)
        Manufacturer: Nordic Semiconductor ASA (89)
zephyr.exe[1688909]: < HCI Command: Read Local Supported Commands (0x04|0x0002) plen 0                                #7 0.861700
> HCI Event: Command Complete (0x0e) plen 68                                                                          #8 0.862997
      Read Local Supported Commands (0x04|0x0002) ncmd 1
        Status: Success (0x00)
        Commands: 119 entries
          Disconnect (Octet 0 - Bit 5)
          Read Remote Version Information (Octet 2 - Bit 7)
          Set Event Mask (Octet 5 - Bit 6)
          Reset (Octet 5 - Bit 7)
          Read Connection Accept Timeout (Octet 7 - Bit 2)
          Write Connection Accept Timeout (Octet 7 - Bit 3)
          Read Transmit Power Level (Octet 10 - Bit 2)
          Set Controller To Host Flow Control (Octet 10 - Bit 5)
          Host Buffer Size (Octet 10 - Bit 6)
          Host Number of Completed Packets (Octet 10 - Bit 7)
          Read Local Version Information (Octet 14 - Bit 3)
          Read Local Supported Features (Octet 14 - Bit 5)
          Read BD ADDR (Octet 15 - Bit 1)
          Read RSSI (Octet 15 - Bit 5)
          Set Event Mask Page 2 (Octet 22 - Bit 2)
          LE Set Event Mask (Octet 25 - Bit 0)
          LE Read Buffer Size (Octet 25 - Bit 1)
          LE Read Local Supported Features (Octet 25 - Bit 2)
          LE Set Random Address (Octet 25 - Bit 4)
          LE Set Advertising Parameters (Octet 25 - Bit 5)
          LE Read Advertising Channel TX Power (Octet 25 - Bit 6)
          LE Set Advertising Data (Octet 25 - Bit 7)
          LE Set Scan Response Data (Octet 26 - Bit 0)
          LE Set Advertise Enable (Octet 26 - Bit 1)
          LE Set Scan Parameters (Octet 26 - Bit 2)
          LE Set Scan Enable (Octet 26 - Bit 3)
          LE Create Connection (Octet 26 - Bit 4)
          LE Create Connection Cancel (Octet 26 - Bit 5)
          LE Read Accept List Size (Octet 26 - Bit 6)
          LE Clear Accept List (Octet 26 - Bit 7)
          LE Add Device To Accept List (Octet 27 - Bit 0)
          LE Remove Device From Accept List (Octet 27 - Bit 1)
          LE Connection Update (Octet 27 - Bit 2)
          LE Set Host Channel Classification (Octet 27 - Bit 3)
          LE Read Channel Map (Octet 27 - Bit 4)
          LE Read Remote Used Features (Octet 27 - Bit 5)
          LE Encrypt (Octet 27 - Bit 6)
          LE Rand (Octet 27 - Bit 7)
          LE Start Encryption (Octet 28 - Bit 0)
          LE Long Term Key Request Reply (Octet 28 - Bit 1)
          LE Long Term Key Request Neg Reply (Octet 28 - Bit 2)
          LE Read Supported States (Octet 28 - Bit 3)
          LE Receiver Test (Octet 28 - Bit 4)
          LE Transmitter Test (Octet 28 - Bit 5)
          LE Test End (Octet 28 - Bit 6)
          Read Authenticated Payload Timeout (Octet 32 - Bit 4)
          Write Authenticated Payload Timeout (Octet 32 - Bit 5)
          LE Set Data Length (Octet 33 - Bit 6)
          LE Read Suggested Default Data Length (Octet 33 - Bit 7)
          LE Write Suggested Default Data Length (Octet 34 - Bit 0)
          LE Add Device To Resolving List (Octet 34 - Bit 3)
          LE Remove Device From Resolving List (Octet 34 - Bit 4)
          LE Clear Resolving List (Octet 34 - Bit 5)
          LE Read Resolving List Size (Octet 34 - Bit 6)
          LE Set Address Resolution Enable (Octet 35 - Bit 1)
          LE Set Resolvable Private Address Timeout (Octet 35 - Bit 2)
          LE Read Maximum Data Length (Octet 35 - Bit 3)
          LE Read PHY (Octet 35 - Bit 4)
          LE Set Default PHY (Octet 35 - Bit 5)
          LE Set PHY (Octet 35 - Bit 6)
          LE Enhanced Receiver Test (Octet 35 - Bit 7)
          LE Enhanced Transmitter Test (Octet 36 - Bit 0)
          LE Set Advertising Set Random Address (Octet 36 - Bit 1)
          LE Set Extended Advertising Parameters (Octet 36 - Bit 2)
          LE Set Extended Advertising Data (Octet 36 - Bit 3)
          LE Set Extended Scan Response Data (Octet 36 - Bit 4)
          LE Set Extended Advertising Enable (Octet 36 - Bit 5)
          LE Read Maximum Advertising Data Length (Octet 36 - Bit 6)
          LE Read Number of Supported Advertising Sets (Octet 36 - Bit 7)
          LE Remove Advertising Set (Octet 37 - Bit 0)
          LE Clear Advertising Sets (Octet 37 - Bit 1)
          LE Set Periodic Advertising Parameters (Octet 37 - Bit 2)
          LE Set Periodic Advertising Data (Octet 37 - Bit 3)
          LE Set Periodic Advertising Enable (Octet 37 - Bit 4)
          LE Set Extended Scan Parameters (Octet 37 - Bit 5)
          LE Set Extended Scan Enable (Octet 37 - Bit 6)
          LE Extended Create Connection (Octet 37 - Bit 7)
          LE Periodic Advertising Create Sync (Octet 38 - Bit 0)
          LE Periodic Advertising Create Sync Cancel (Octet 38 - Bit 1)
          LE Periodic Advertising Terminate Sync (Octet 38 - Bit 2)
          LE Add Device To Periodic Advertiser List (Octet 38 - Bit 3)
          LE Remove Device From Periodic Advertiser List (Octet 38 - Bit 4)
          LE Clear Periodic Advertiser List (Octet 38 - Bit 5)
          LE Read Periodic Advertiser List Size (Octet 38 - Bit 6)
          LE Read Transmit Power (Octet 38 - Bit 7)
          LE Read RF Path Compensation (Octet 39 - Bit 0)
          LE Write RF Path Compensation (Octet 39 - Bit 1)
          LE Set Privacy Mode (Octet 39 - Bit 2)
          LE Periodic Advertising Receive Enable (Octet 40 - Bit 5)
          LE Periodic Advertising Sync Transfer (Octet 40 - Bit 6)
          LE Periodic Advertising Set Info Transfer (Octet 40 - Bit 7)
          LE Periodic Advertising Sync Transfer Parameters (Octet 41 - Bit 0)
          LE Set Default Periodic Advertisng Sync Transfer Parameters (Octet 41 - Bit 1)
          LE Read Buffer v2 (Octet 41 - Bit 5)
          LE Read ISO TX Sync (Octet 41 - Bit 6)
          LE Set Connected Isochronous Group Parameters (Octet 41 - Bit 7)
          LE Set Connected Isochronous Group Parameters Test (Octet 42 - Bit 0)
          LE Create Connected Isochronous Stream (Octet 42 - Bit 1)
          LE Remove Connected Isochronous Group (Octet 42 - Bit 2)
          LE Accept Connected Isochronous Stream Request (Octet 42 - Bit 3)
          LE Reject Connected Isochronous Stream Request (Octet 42 - Bit 4)
          LE Create Broadcast Isochronous Group (Octet 42 - Bit 5)
          LE Create Broadcast Isochronous Group Test (Octet 42 - Bit 6)
          LE Terminate Broadcast Isochronous Group (Octet 42 - Bit 7)
          LE Broadcast Isochronous Group Create Sync (Octet 43 - Bit 0)
          LE Broadcast Isochronous Group Terminate Sync (Octet 43 - Bit 1)
          LE Request Peer SCA (Octet 43 - Bit 2)
          LE Setup Isochronous Data Path (Octet 43 - Bit 3)
          LE Remove Isochronous Data Path (Octet 43 - Bit 4)
          LE Isochronous Transmit Test (Octet 43 - Bit 5)
          LE Isochronous Receive Test (Octet 43 - Bit 6)
          LE Isochronous Read Test Counters (Octet 43 - Bit 7)
          LE Isochronous Read Test Counters (Octet 44 - Bit 0)
          LE Set Host Feature (Octet 44 - Bit 1)
          LE Read ISO link quality (Octet 44 - Bit 2)
          Octet 45 - Bit 6 
          Octet 46 - Bit 0 
          Octet 46 - Bit 1 
          Octet 46 - Bit 2 
zephyr.exe[1688909]: < HCI Command: Host Buffer Size (0x03|0x0033) plen 7                                             #9 0.881725
        ACL MTU: 255  ACL max packet: 16
        SCO MTU: 0    SCO max packet: 0
> HCI Event: Command Complete (0x0e) plen 4                                                                          #10 0.882513
      Host Buffer Size (0x03|0x0033) ncmd 1
        Status: Success (0x00)
zephyr.exe[1688909]: < HCI Command: Set Controller To Host Flow Control (0x03|0x0031) plen 1                         #11 0.901723
        Flow control: ACL Data Packets (0x01)
> HCI Event: Command Complete (0x0e) plen 4                                                                          #12 0.902454
      Set Controller To Host Flow Control (0x03|0x0031) ncmd 1
        Status: Success (0x00)
zephyr.exe[1688909]: < HCI Command: LE Read Local Supported Features (0x08|0x0003) plen 0                            #13 0.921721
> HCI Event: Command Complete (0x0e) plen 12                                                                         #14 0.922529
      LE Read Local Supported Features (0x08|0x0003) ncmd 1
        Status: Success (0x00)
        Features: 0xfd 0x79 0x00 0xf7 0x30 0x01 0x00 0x00
          LE Encryption
          Extended Reject Indication
          Peripheral-initiated Features Exchange
          LE Ping
          LE Data Packet Length Extension
          LL Privacy
          Extended Scanner Filter Policies
          LE 2M PHY
          LE Coded PHY
          LE Extended Advertising
          LE Periodic Advertising
          Channel Selection Algorithm #2
          Periodic Advertising Sync Transfer - Sender
          Periodic Advertising Sync Transfer - Recipient
          Sleep Clock Accuracy Updates
          Connected Isochronous Stream - Central
          Connected Isochronous Stream - Peripheral
          Isochronous Broadcaster
          Synchronized Receiver
          Periodic Advertising ADI support
          Connection Subrating
          Unknown features (0x0000010000000000)
zephyr.exe[1688909]: < HCI Command: LE Set Host Feature (0x08|0x0074) plen 2                                         #15 0.941715
        Bit Number: 32
          Connected Isochronous Stream (Host Support)
        Bit Value: 1
> HCI Event: Command Complete (0x0e) plen 4                                                                          #16 0.942404
      LE Set Host Feature (0x08|0x0074) ncmd 1
        Status: Success (0x00)
zephyr.exe[1688909]: < HCI Command: LE Read Buffer v2 (0x08|0x0060) plen 0                                           #17 0.961736
> HCI Event: Command Complete (0x0e) plen 10                                                                         #18 0.962520
      LE Read Buffer v2 (0x08|0x0060) ncmd 1
        Status: Success (0x00)
        ACL MTU: 27
        ACL max packet: 3
        ISO MTU: 318
        ISO max packet: 3
zephyr.exe[1688909]: < HCI Command: LE Read Maximum Advertising Data Length (0x08|0x003a) plen 0                     #19 0.981753
> HCI Event: Command Complete (0x0e) plen 6                                                                          #20 0.982617
      LE Read Maximum Advertising Data Length (0x08|0x003a) ncmd 1
        Status: Success (0x00)
        Max length: 1650
zephyr.exe[1688909]: < HCI Command: LE Read Supported States (0x08|0x001c) plen 0                                    #21 1.001722
> HCI Event: Command Complete (0x0e) plen 12                                                                         #22 1.002422
      LE Read Supported States (0x08|0x001c) ncmd 1
        Status: Success (0x00)
        States: 0x000003ff3e0306ff
          Non-connectable Advertising State
          Scannable Advertising State
          Connectable Advertising State
          High Duty Cycle Directed Advertising State
          Passive Scanning State
          Active Scanning State
          Initiating State
            and Connection State (Central Role)
          Connection State (Peripheral Role)
          Scannable Advertising State
            and Passive Scanning State
          Connectable Advertising State
            and Passive Scanning State
          Non-connectable Advertising State
            and Initiating State
          Scannable Advertising State
            and Initiating State
          Active Scanning State
            and Connection State (Central Role)
          Passive Scanning State
            and Connection State (Peripheral Role)
          Active Scanning State
            and Connection State (Peripheral Role)
          Initiating State
            and Connection State (Central Role)
            and Central Role & Central Role
          Low Duty Cycle Directed Advertising State
          Connectable Advertising State
            and Initiating State
            and Central Role & Peripheral Role
          High Duty Cycle Directed Advertising State
            and Initiating State
            and Central Role & Peripheral Role
          Low Duty Cycle Directed Advertising State
            and Initiating State
            and Central Role & Peripheral Role
          Connectable Advertising State
            and Connection State (Central Role)
            and Central Role & Peripheral Role
          High Duty Cycle Directed Advertising State
            and Connection State (Central Role)
            and Central Role & Peripheral Role
          Low Duty Cycle Directed Advertising State
            and Connection State (Central Role)
            and Central Role & Peripheral Role
          Connectable Advertising State
            and Connection State (Peripheral Role)
            and Central Role & Peripheral Role
          High Duty Cycle Directed Advertising State
            and Connection State (Peripheral Role)
            and Peripheral Role & Peripheral Role
          Low Duty Cycle Directed Advertising State
            and Connection State (Peripheral Role)
            and Peripheral Role & Peripheral Role
          Initiating State
            and Connection State (Peripheral Role)
            and Central Role & Peripheral Role
zephyr.exe[1688909]: < HCI Command: LE Read Maximum Data Length (0x08|0x002f) plen 0                                 #23 1.021722
> HCI Event: Command Complete (0x0e) plen 12                                                                         #24 1.022445
      LE Read Maximum Data Length (0x08|0x002f) ncmd 1
        Status: Success (0x00)
        Max TX octets: 251
        Max TX time: 2704
        Max RX octets: 251
        Max RX time: 2704
zephyr.exe[1688909]: < HCI Command: LE Write Suggested Default Data Length (0x08|0x0024) plen 4                      #25 1.041745
        TX octets: 251
        TX time: 2704
> HCI Event: Command Complete (0x0e) plen 4                                                                          #26 1.042343
      LE Write Suggested Default Data Length (0x08|0x0024) ncmd 1
        Status: Success (0x00)
zephyr.exe[1688909]: < HCI Command: LE Read Resolving List Size (0x08|0x002a) plen 0                                 #27 1.061735
> HCI Event: Command Complete (0x0e) plen 5                                                                          #28 1.062336
      LE Read Resolving List Size (0x08|0x002a) ncmd 1
        Status: Success (0x00)
        Size: 8
zephyr.exe[1688909]: < HCI Command: LE Set Event Mask (0x08|0x0001) plen 8                                           #29 1.081728
        Mask: 0x000002023f87fa5e
          LE Advertising Report
          LE Connection Update Complete
          LE Read Remote Used Features Complete
          LE Long Term Key Request
          LE Data Length Change
          LE Enhanced Connection Complete
          LE PHY Update Complete
          LE Extended Advertising Report
          LE Periodic Advertising Sync Established
          LE Periodic Advertising Report
          LE Periodic Advertising Sync Lost
          LE Extended Scan Timeout
          LE Extended Advertising Set Terminated
          LE Scan Request Received
          LE Periodic Advertising Sync Transfer Rvc
          LE CIS Established
          LE CIS Request
          LE Create BIG Complete
          LE Terminate BIG Complete
          LE BIG Sync Established Complete
          LE BIG Sync Lost
          LE BIG Info Advertising Report
          Unknown mask (0x0000020000000000)
> HCI Event: Command Complete (0x0e) plen 4                                                                          #30 1.082475
      LE Set Event Mask (0x08|0x0001) ncmd 1
        Status: Success (0x00)
zephyr.exe[1688909]: < HCI Command: Set Event Mask (0x03|0x0001) plen 8                                              #31 1.101609
        Mask: 0x2000800002008890
          Disconnection Complete
          Encryption Change
          Read Remote Version Information Complete
          Hardware Error
          Data Buffer Overflow
          Encryption Key Refresh Complete
          LE Meta
> HCI Event: Command Complete (0x0e) plen 4                                                                          #32 1.102297
      Set Event Mask (0x03|0x0001) ncmd 1
        Status: Success (0x00)
zephyr.exe[1688909]: < HCI Command: Read BD ADDR (0x04|0x0009) plen 0                                                #33 1.121722
> HCI Event: Command Complete (0x0e) plen 10                                                                         #34 1.122381
      Read BD ADDR (0x04|0x0009) ncmd 1
        Status: Success (0x00)
        Address: 00:00:00:00:00:00 (OUI 00-00-00)
zephyr.exe[1688909]: < HCI Command: LE Set Random Address (0x08|0x0005) plen 6                                       #35 1.141715
        Address: D5:B6:CC:31:DB:3B (Static)
> HCI Event: Command Complete (0x0e) plen 4                                                                          #36 1.142369
      LE Set Random Address (0x08|0x0005) ncmd 1
        Status: Success (0x00)
zephyr.exe[1688909]: < HCI Command: LE Set Extended Advertising Parameters (0x08|0x0036) plen 25                     #37 3.541792
        Handle: 0x00
        Properties: 0x0013
          Connectable
          Scannable
          Use legacy advertising PDUs: ADV_IND
        Min advertising interval: 100.000 msec (0x00a0)
        Max advertising interval: 150.000 msec (0x00f0)
        Channel map: 37, 38, 39 (0x07)
        Own address type: Random (0x01)
        Peer address type: Public (0x00)
        Peer address: 00:00:00:00:00:00 (OUI 00-00-00)
        Filter policy: Allow Scan Request from Any, Allow Connect Request from Any (0x00)
        TX power: Host has no preference (0x7f)
        Primary PHY: LE 1M (0x01)
        Secondary max skip: 0x00
        Secondary PHY: LE 1M (0x01)
        SID: 0x00
        Scan request notifications: Disabled (0x00)
> HCI Event: Command Complete (0x0e) plen 5                                                                          #38 3.543206
      LE Set Extended Advertising Parameters (0x08|0x0036) ncmd 1
        Status: Success (0x00)
        TX power (selected): 0 dbm (0x00)
zephyr.exe[1688909]: < HCI Command: LE Set Advertising Set Random Address (0x08|0x0035) plen 7                       #39 3.561758
        Advertising handle: 0x00
        Advertising random address: D5:B6:CC:31:DB:3B (Static)
> HCI Event: Command Complete (0x0e) plen 4                                                                          #40 3.562521
      LE Set Advertising Set Random Address (0x08|0x0035) ncmd 1
        Status: Success (0x00)
zephyr.exe[1688909]: < HCI Command: LE Set Extended Advertising Data (0x08|0x0037) plen 22                           #41 3.581699
        Handle: 0x00
        Operation: Complete extended advertising data (0x03)
        Fragment preference: Minimize fragmentation (0x01)
        Data length: 0x12
        Flags: 0x06
          LE General Discoverable Mode
          BR/EDR Not Supported
        Name (complete): Tester_2CB6EE
> HCI Event: Command Complete (0x0e) plen 4                                                                          #42 3.582677
      LE Set Extended Advertising Data (0x08|0x0037) ncmd 1
        Status: Success (0x00)
zephyr.exe[1688909]: < HCI Command: LE Set Extended Scan Response Data (0x08|0x0038) plen 4                          #43 3.601759
        Handle: 0x00
        Operation: Complete scan response data (0x03)
        Fragment preference: Minimize fragmentation (0x01)
        Data length: 0x00
> HCI Event: Command Complete (0x0e) plen 4                                                                          #44 3.602417
      LE Set Extended Scan Response Data (0x08|0x0038) ncmd 1
        Status: Success (0x00)
zephyr.exe[1688909]: < HCI Command: LE Set Extended Advertising Enable (0x08|0x0039) plen 6                          #45 3.621767
        Extended advertising: Enabled (0x01)
        Number of sets: 1 (0x01)
        Entry 0
          Handle: 0x00
          Duration: 0 ms (0x00)
          Max ext adv events: 0
> HCI Event: Command Complete (0x0e) plen 4                                                                          #46 3.622571
      LE Set Extended Advertising Enable (0x08|0x0039) ncmd 1
        Status: Success (0x00)
> HCI Event: LE Meta Event (0x3e) plen 31                                                                            #47 3.735109
      LE Enhanced Connection Complete (0x0a)
        Status: Success (0x00)
        Handle: 723
        Role: Peripheral (0x01)
        Peer address type: Public (0x00)
        Peer address: C0:07:E8:2C:B6:EE (OUI C0-07-E8)
        Local resolvable private address: 00:00:00:00:00:00 (Non-Resolvable)
        Peer resolvable private address: 00:00:00:00:00:00 (Non-Resolvable)
        Connection interval: 62.50 msec (0x0032)
        Connection latency: 0 (0x0000)
        Supervision timeout: 25120 msec (0x09d0)
        Central clock accuracy: 0x07
> HCI Event: LE Meta Event (0x3e) plen 6                                                                             #48 3.735608
      LE Advertising Set Terminated (0x12)
        Status: Success (0x00)
        Handle: 0
        Connection handle: 723
        Number of completed extended advertising events: 0
zephyr.exe[1688909]: < HCI Command: LE Read Remote Used Features (0x08|0x0016) plen 2                                #49 3.741901
        Handle: 723 Address: C0:07:E8:2C:B6:EE (OUI C0-07-E8)
> HCI Event: Command Status (0x0f) plen 4                                                                            #50 3.742568
      LE Read Remote Used Features (0x08|0x0016) ncmd 1
        Status: Success (0x00)
zephyr.exe[1688909]: < HCI Command: LE Set PHY (0x08|0x0032) plen 7                                                  #51 3.761812
        Handle: 723 Address: C0:07:E8:2C:B6:EE (OUI C0-07-E8)
        All PHYs preference: 0x00
        TX PHYs preference: 0x02
          LE 2M
        RX PHYs preference: 0x02
          LE 2M
        PHY options preference: Reserved (0x0000)
> HCI Event: Command Status (0x0f) plen 4                                                                            #52 3.762572
      LE Set PHY (0x08|0x0032) ncmd 1
        Status: Success (0x00)
zephyr.exe[1688909]: < ACL Data TX: Handle 723 [1/3] flags 0x00 dlen 7                                               #53 3.781764
      ATT: Exchange MTU Request (0x02) len 2
        Client RX MTU: 251
> HCI Event: Number of Completed Packets (0x13) plen 5                                                               #54 3.861135
        Num handles: 1
        Handle: 723 Address: C0:07:E8:2C:B6:EE (OUI C0-07-E8)
        Count: 1
        Buffers: 0/3
        #53: len 7 (0 Kb/s)
        Latency: 79 msec (79-79 msec ~79 msec)
> HCI Event: LE Meta Event (0x3e) plen 12                                                                            #55 3.924060
      LE Read Remote Used Features (0x04)
        Status: Success (0x00)
        Handle: 723 Address: C0:07:E8:2C:B6:EE (OUI C0-07-E8)
        Features: 0x2d 0x49 0x01 0xf7 0xef 0x39 0x00 0x80
          LE Encryption
          Extended Reject Indication
          Peripheral-initiated Features Exchange
          LE Data Packet Length Extension
          LE 2M PHY
          LE Coded PHY
          Channel Selection Algorithm #2
          Minimum Number of Used Channels Procedure
          Periodic Advertising Sync Transfer - Sender
          Periodic Advertising Sync Transfer - Recipient
          Sleep Clock Accuracy Updates
          Connected Isochronous Stream - Central
          Connected Isochronous Stream - Peripheral
          Isochronous Broadcaster
          Synchronized Receiver
          Connected Isochronous Stream (Host Support)
          LE Power Control Request
          LE Power Control Request
          LE Path Loss Monitoring
          Connection Subrating
          Connection Subrating (Host Support)
          Channel Classification
          Unknown features (0x8000390000000000)
> HCI Event: LE Meta Event (0x3e) plen 6                                                                             #56 4.423318
      LE PHY Update Complete (0x0c)
        Status: Success (0x00)
        Handle: 723 Address: C0:07:E8:2C:B6:EE (OUI C0-07-E8)
        TX PHY: LE 2M (0x02)
        RX PHY: LE 2M (0x02)
> ACL Data RX: Handle 723 flags 0x02 dlen 11                                                                         #57 6.236233
      SMP: Pairing Request (0x01) len 6
        IO capability: KeyboardDisplay (0x04)
        OOB data: Authentication data not present (0x00)
        Authentication requirement: Bonding, No MITM, SC, No Keypresses (0x09)
        Max encryption key size: 16
        Initiator key distribution: EncKey IdKey (0x03)
        Responder key distribution: EncKey IdKey Sign (0x07)
> ACL Data RX: Handle 723 flags 0x02 dlen 7                                                                          #58 6.236571
      ATT: Exchange MTU Response (0x03) len 2
        Server RX MTU: 23
zephyr.exe[1688909]: < HCI Command: Host Number of Completed Packets (0x03|0x0035) plen 5                            #59 6.241811
        Num handles: 1
        Handle: 723 Address: C0:07:E8:2C:B6:EE (OUI C0-07-E8)
        Count: 1
zephyr.exe[1688909]: < ACL Data TX: Handle 723 [1/3] flags 0x00 dlen 11                                              #60 6.241926
      SMP: Pairing Response (0x02) len 6
        IO capability: NoInputNoOutput (0x03)
        OOB data: Authentication data not present (0x00)
        Authentication requirement: Bonding, No MITM, SC, No Keypresses (0x09)
        Max encryption key size: 16
        Initiator key distribution: IdKey (0x02)
        Responder key distribution: Sign (0x04)
zephyr.exe[1688909]: < HCI Command: Host Number of Completed Packets (0x03|0x0035) plen 5                            #61 6.241944
        Num handles: 1
        Handle: 723 Address: C0:07:E8:2C:B6:EE (OUI C0-07-E8)
        Count: 1
> HCI Event: Number of Completed Packets (0x13) plen 5                                                               #62 6.361216
        Num handles: 1
        Handle: 723 Address: C0:07:E8:2C:B6:EE (OUI C0-07-E8)
        Count: 1
        Buffers: 0/3
        #60: len 11 (0 Kb/s)
        Latency: 119 msec (79-119 msec ~99 msec)
> ACL Data RX: Handle 723 flags 0x02 dlen 27                                                                         #63 6.361591
> ACL Data RX: Handle 723 flags 0x01 dlen 27                                                                         #64 6.361914
> ACL Data RX: Handle 723 flags 0x01 dlen 15                                                                         #65 6.362331
      SMP: Pairing Public Key (0x0c) len 64
        X[32]: a863ca53b10ea8631deea6c79cf66771d5d32af889576f2ef9342a4a04973170
        Y[32]: e873985b8c66b022b1aa42c6fda148a704a806a117be49e9c55bf02588553879
zephyr.exe[1688909]: < HCI Command: Host Number of Completed Packets (0x03|0x0035) plen 5                            #66 6.381835
        Num handles: 1
        Handle: 723 Address: C0:07:E8:2C:B6:EE (OUI C0-07-E8)
        Count: 1
zephyr.exe[1688909]: < HCI Command: Host Number of Completed Packets (0x03|0x0035) plen 5                            #67 6.382001
        Num handles: 1
        Handle: 723 Address: C0:07:E8:2C:B6:EE (OUI C0-07-E8)
        Count: 1
zephyr.exe[1688909]: < HCI Command: Host Number of Completed Packets (0x03|0x0035) plen 5                            #68 6.382546
        Num handles: 1
        Handle: 723 Address: C0:07:E8:2C:B6:EE (OUI C0-07-E8)
        Count: 1
zephyr.exe[1688909]: < ACL Data TX: Handle 723 [1/3] flags 0x00 dlen 27                                              #69 6.382611
zephyr.exe[1688909]: < ACL Data TX: Handle 723 flags 0x01 dlen 27                                                    #70 6.382628
zephyr.exe[1688909]: < ACL Data TX: Handle 723 flags 0x01 dlen 15                                                    #71 6.382643
      SMP: Pairing Public Key (0x0c) len 64
        X[32]: 98308440221e2d910f0e54b71e7ec652857aa9b5a0dc65028824cc19db1226e9
        Y[32]: 67a4816bcb62efb21701e31fdb27561a6217575fb007a8bbdabe7e28b6f68482
> HCI Event: Number of Completed Packets (0x13) plen 5                                                               #72 6.424039
        Num handles: 1
        Handle: 723 Address: C0:07:E8:2C:B6:EE (OUI C0-07-E8)
        Count: 1
        Buffers: 0/3
        #69: len 27 (5 Kb/s)
        Latency: 41 msec (41-119 msec ~70 msec)
> HCI Event: Number of Completed Packets (0x13) plen 5                                                               #73 6.424591
        Num handles: 1
        Handle: 723 Address: C0:07:E8:2C:B6:EE (OUI C0-07-E8)
        Count: 1
        Buffers: underflow/3
        #70: len 27 (5 Kb/s)
        Latency: 41 msec (41-119 msec ~56 msec)
zephyr.exe[1688909]: < ACL Data TX: Handle 723 [1/3] flags 0x00 dlen 21                                              #74 6.441840
      SMP: Pairing Confirm (0x03) len 16
        Confirm value[16]: 0cced42c35d62b80ceddc974d46722c2
> HCI Event: Number of Completed Packets (0x13) plen 5                                                               #75 6.486127
        Num handles: 1
        Handle: 723 Address: C0:07:E8:2C:B6:EE (OUI C0-07-E8)
        Count: 1
        Buffers: 0/3
        #71: len 15 (1 Kb/s)
        Latency: 103 msec (41-119 msec ~79 msec)
> HCI Event: Number of Completed Packets (0x13) plen 5                                                               #76 6.548737
        Num handles: 1
        Handle: 723 Address: C0:07:E8:2C:B6:EE (OUI C0-07-E8)
        Count: 1
        Buffers: underflow/3
        #74: len 21 (1 Kb/s)
        Latency: 106 msec (41-119 msec ~93 msec)
> ACL Data RX: Handle 723 flags 0x02 dlen 21                                                                         #77 6.549009
      SMP: Pairing Random (0x04) len 16
        Random value[16]: 46cee0a1d9aa94440000000000000000
zephyr.exe[1688909]: < HCI Command: Host Number of Completed Packets (0x03|0x0035) plen 5                            #78 6.561864
        Num handles: 1
        Handle: 723 Address: C0:07:E8:2C:B6:EE (OUI C0-07-E8)
        Count: 1
zephyr.exe[1688909]: < ACL Data TX: Handle 723 [1/3] flags 0x00 dlen 21                                              #79 6.562020
      SMP: Pairing Random (0x04) len 16
        Random value[16]: 8e6108f966a694cbe26df70bb96773e6
> HCI Event: Number of Completed Packets (0x13) plen 5                                                               #80 6.673663
        Num handles: 1
        Handle: 723 Address: C0:07:E8:2C:B6:EE (OUI C0-07-E8)
        Count: 1
        Buffers: 0/3
        #79: len 21 (1 Kb/s)
        Latency: 111 msec (41-119 msec ~102 msec)
> ACL Data RX: Handle 723 flags 0x02 dlen 21                                                                         #81 6.736408
      SMP: Pairing DHKey Check (0x0d) len 16
        E[16]: 707ebebf1bebdaebc2c7610000cbc242
zephyr.exe[1688909]: < HCI Command: Host Number of Completed Packets (0x03|0x0035) plen 5                            #82 6.741832
        Num handles: 1
        Handle: 723 Address: C0:07:E8:2C:B6:EE (OUI C0-07-E8)
        Count: 1
zephyr.exe[1688909]: < ACL Data TX: Handle 723 [1/3] flags 0x00 dlen 21                                              #83 6.742169
      SMP: Pairing DHKey Check (0x0d) len 16
        E[16]: 43e089dd46992c843d93e98785b3bffb
> HCI Event: Number of Completed Packets (0x13) plen 5                                                               #84 6.861124
        Num handles: 1
        Handle: 723 Address: C0:07:E8:2C:B6:EE (OUI C0-07-E8)
        Count: 1
        Buffers: 0/3
        #83: len 21 (1 Kb/s)
        Latency: 118 msec (41-119 msec ~110 msec)
> HCI Event: LE Meta Event (0x3e) plen 13                                                                            #85 6.924082
      LE Long Term Key Request (0x05)
        Handle: 723 Address: C0:07:E8:2C:B6:EE (OUI C0-07-E8)
        Random number: 0x0000000000000000
        Encrypted diversifier: 0x0000
zephyr.exe[1688909]: < HCI Command: LE Long Term Key Request Reply (0x08|0x001a) plen 18                             #86 6.941876
        Handle: 723 Address: C0:07:E8:2C:B6:EE (OUI C0-07-E8)
        Long term key[16]: ced7cd21ea37dfe0053ab1f5b678dde5
> HCI Event: Command Complete (0x0e) plen 6                                                                          #87 6.942772
      LE Long Term Key Request Reply (0x08|0x001a) ncmd 1
        Status: Success (0x00)
        Handle: 723 Address: C0:07:E8:2C:B6:EE (OUI C0-07-E8)
> HCI Event: Encryption Change (0x08) plen 4                                                                         #88 7.236369
        Status: Success (0x00)
        Handle: 723 Address: C0:07:E8:2C:B6:EE (OUI C0-07-E8)
        Encryption: Enabled with AES-CCM (0x01)
zephyr.exe[1688909]: < ACL Data TX: Handle 723 [1/3] flags 0x00 dlen 21                                              #89 7.351882
      SMP: Signing Information (0x0a) len 16
        Signature key[16]: 5da095555cc64d02679f89a05211af56
> HCI Event: Number of Completed Packets (0x13) plen 5                                                               #90 7.423762
        Num handles: 1
        Handle: 723 Address: C0:07:E8:2C:B6:EE (OUI C0-07-E8)
        Count: 1
        Buffers: 0/3
        #89: len 21 (2 Kb/s)
        Latency: 71 msec (41-119 msec ~91 msec)
> ACL Data RX: Handle 723 flags 0x02 dlen 21                                                                         #91 7.424037
      SMP: Identity Information (0x08) len 16
        Identity resolving key[16]: 8b13f510e5a59a4df37292890a0780f4
> ACL Data RX: Handle 723 flags 0x02 dlen 12                                                                         #92 7.424243
      SMP: Identity Address Information (0x09) len 7
        Address: C0:07:E8:2C:B6:EE (OUI C0-07-E8)
zephyr.exe[1688909]: < HCI Command: Host Number of Completed Packets (0x03|0x0035) plen 5                            #93 7.441940
        Num handles: 1
        Handle: 723 Address: C0:07:E8:2C:B6:EE (OUI C0-07-E8)
        Count: 1
zephyr.exe[1688909]: < HCI Command: LE Add Device To Resolving List (0x08|0x0027) plen 39                            #94 7.442537
        Address type: Public (0x00)
        Address: C0:07:E8:2C:B6:EE (OUI C0-07-E8)
        Peer identity resolving key[16]: 8b13f510e5a59a4df37292890a0780f4
        Local identity resolving key[16]: 00000000000000000000000000000000
> HCI Event: Command Complete (0x0e) plen 4                                                                          #95 7.443736
      LE Add Device To Resolving List (0x08|0x0027) ncmd 1
        Status: Success (0x00)
zephyr.exe[1688909]: < HCI Command: LE Set Privacy Mode (0x08|0x004e) plen 8                                         #96 7.461873
        Peer Identity address type: Public (0x00)
        Peer Identity address: C0:07:E8:2C:B6:EE (OUI C0-07-E8)
        Privacy Mode: Use Device Privacy (0x01)
> HCI Event: Command Complete (0x0e) plen 4                                                                          #97 7.463177
      LE Set Privacy Mode (0x08|0x004e) ncmd 1
        Status: Success (0x00)
zephyr.exe[1688909]: < HCI Command: LE Set Address Resolution Enable (0x08|0x002d) plen 1                            #98 7.481877
        Address resolution: Enabled (0x01)
> HCI Event: Command Complete (0x0e) plen 4                                                                          #99 7.482667
      LE Set Address Resolution Enable (0x08|0x002d) ncmd 1
        Status: Success (0x00)
zephyr.exe[1688909]: < HCI Command: Host Number of Completed Packets (0x03|0x0035) plen 5                           #100 7.501848
        Num handles: 1
        Handle: 723 Address: C0:07:E8:2C:B6:EE (OUI C0-07-E8)
        Count: 1
zephyr.exe[1688909]: < ACL Data TX: Handle 723 [1/3] flags 0x00 dlen 13                                             #101 7.691819
      ATT: Find By Type Value Request (0x06) len 8
        Handle range: 0x0001-0xffff
        Attribute type: Primary Service (0x2800)
          UUID: Generic Telephony Bearer (0x184c)
> HCI Event: Number of Completed Packets (0x13) plen 5                                                              #102 7.798695
        Num handles: 1
        Handle: 723 Address: C0:07:E8:2C:B6:EE (OUI C0-07-E8)
        Count: 1
        Buffers: 0/3
        #101: len 13 (0 Kb/s)
        Latency: 106 msec (41-119 msec ~99 msec)
> ACL Data RX: Handle 723 flags 0x02 dlen 9                                                                         #103 7.799346
      ATT: Find By Type Value Response (0x07) len 4
        Handle range: 0x0110-0x013c
zephyr.exe[1688909]: < HCI Command: Host Number of Completed Packets (0x03|0x0035) plen 5                           #104 7.801940
        Num handles: 1
        Handle: 723 Address: C0:07:E8:2C:B6:EE (OUI C0-07-E8)
        Count: 1
zephyr.exe[1688909]: < ACL Data TX: Handle 723 [1/3] flags 0x00 dlen 13                                             #105 7.802065
      ATT: Find By Type Value Request (0x06) len 8
        Handle range: 0x0001-0xffff
        Attribute type: Primary Service (0x2800)
          UUID: Telephony Bearer (0x184b)
> HCI Event: Number of Completed Packets (0x13) plen 5                                                              #106 7.923696
        Num handles: 1
        Handle: 723 Address: C0:07:E8:2C:B6:EE (OUI C0-07-E8)
        Count: 1
        Buffers: 0/3
        #105: len 13 (0 Kb/s)
        Latency: 121 msec (41-121 msec ~110 msec)
> ACL Data RX: Handle 723 flags 0x02 dlen 9                                                                         #107 7.923924
      ATT: Find By Type Value Response (0x07) len 4
        Handle range: 0x00d0-0x00fc
zephyr.exe[1688909]: < HCI Command: Host Number of Completed Packets (0x03|0x0035) plen 5                           #108 7.941948
        Num handles: 1
        Handle: 723 Address: C0:07:E8:2C:B6:EE (OUI C0-07-E8)
        Count: 1
zephyr.exe[1688909]: < ACL Data TX: Handle 723 [1/3] flags 0x00 dlen 11                                             #109 7.942089
      ATT: Read By Type Request (0x08) len 6
        Handle range: 0x0111-0x013c
        Attribute type: Characteristic (0x2803)
> HCI Event: Number of Completed Packets (0x13) plen 5                                                              #110 8.048849
        Num handles: 1
        Handle: 723 Address: C0:07:E8:2C:B6:EE (OUI C0-07-E8)
        Count: 1
        Buffers: 0/3
        #109: len 11 (0 Kb/s)
        Latency: 106 msec (41-121 msec ~108 msec)
> ACL Data RX: Handle 723 flags 0x02 dlen 27                                                                        #111 8.049135
      ATT: Read By Type Response (0x09) len 22
        Attribute data length: 7
        Attribute data list: 3 entries
        Handle: 0x0111
        Value[5]: 121201b32b
            Properties: 0x12
              Read (0x02)
              Notify (0x10)
            Value Handle: 0x0112
            Value UUID: Bearer Provider Name (0x2bb3)
        Handle: 0x0114
        Value[5]: 021501b42b
            Properties: 0x02
              Read (0x02)
            Value Handle: 0x0115
            Value UUID: Bearer UCI (0x2bb4)
        Handle: 0x0116
        Value[5]: 121701b52b
            Properties: 0x12
              Read (0x02)
              Notify (0x10)
            Value Handle: 0x0117
            Value UUID: Bearer Technology (0x2bb5)
zephyr.exe[1688909]: < HCI Command: Host Number of Completed Packets (0x03|0x0035) plen 5                           #112 8.067142
        Num handles: 1
        Handle: 723 Address: C0:07:E8:2C:B6:EE (OUI C0-07-E8)
        Count: 1
zephyr.exe[1688909]: < ACL Data TX: Handle 723 [1/3] flags 0x00 dlen 9                                              #113 8.067269
      ATT: Find Information Request (0x04) len 4
        Handle range: 0x0112-0x013c
> HCI Event: Number of Completed Packets (0x13) plen 5                                                              #114 8.173808
        Num handles: 1
        Handle: 723 Address: C0:07:E8:2C:B6:EE (OUI C0-07-E8)
        Count: 1
        Buffers: 0/3
        #113: len 9 (0 Kb/s)
        Latency: 106 msec (41-121 msec ~107 msec)
> ACL Data RX: Handle 723 flags 0x02 dlen 26                                                                        #115 8.174239
      ATT: Find Information Response (0x05) len 21
        Format: UUID-16 (0x01)
        Handle: 0x0112
        UUID: Bearer Provider Name (0x2bb3)
        Handle: 0x0113
        UUID: Client Characteristic Configuration (0x2902)
        Handle: 0x0114
        UUID: Characteristic (0x2803)
        Handle: 0x0115
        UUID: Bearer UCI (0x2bb4)
        Handle: 0x0116
        UUID: Characteristic (0x2803)
zephyr.exe[1688909]: < HCI Command: Host Number of Completed Packets (0x03|0x0035) plen 5                           #116 8.182115
        Num handles: 1
        Handle: 723 Address: C0:07:E8:2C:B6:EE (OUI C0-07-E8)
        Count: 1
zephyr.exe[1688909]: < ACL Data TX: Handle 723 [1/3] flags 0x00 dlen 9                                              #117 8.182690
      ATT: Find Information Request (0x04) len 4
        Handle range: 0x0117-0x013c
> HCI Event: Number of Completed Packets (0x13) plen 5                                                              #118 8.298815
        Num handles: 1
        Handle: 723 Address: C0:07:E8:2C:B6:EE (OUI C0-07-E8)
        Count: 1
        Buffers: 0/3
        #117: len 9 (0 Kb/s)
        Latency: 116 msec (41-121 msec ~111 msec)
> ACL Data RX: Handle 723 flags 0x02 dlen 26                                                                        #119 8.299131
      ATT: Find Information Response (0x05) len 21
        Format: UUID-16 (0x01)
        Handle: 0x0117
        UUID: Bearer Technology (0x2bb5)
        Handle: 0x0118
        UUID: Client Characteristic Configuration (0x2902)
        Handle: 0x0119
        UUID: Characteristic (0x2803)
        Handle: 0x011a
        UUID: Bearer URI Schemes Supported List (0x2bb6)
        Handle: 0x011b
        UUID: Client Characteristic Configuration (0x2902)
zephyr.exe[1688909]: < HCI Command: Host Number of Completed Packets (0x03|0x0035) plen 5                           #120 8.305166
        Num handles: 1
        Handle: 723 Address: C0:07:E8:2C:B6:EE (OUI C0-07-E8)
        Count: 1
zephyr.exe[1688909]: < ACL Data TX: Handle 723 [1/3] flags 0x00 dlen 11                                             #121 8.305508
      ATT: Read By Type Request (0x08) len 6
        Handle range: 0x0117-0x013c
        Attribute type: Characteristic (0x2803)
> HCI Event: Number of Completed Packets (0x13) plen 5                                                              #122 8.423794
        Num handles: 1
        Handle: 723 Address: C0:07:E8:2C:B6:EE (OUI C0-07-E8)
        Count: 1
        Buffers: 0/3
        #121: len 11 (0 Kb/s)
        Latency: 118 msec (41-121 msec ~115 msec)
> ACL Data RX: Handle 723 flags 0x02 dlen 27                                                                        #123 8.424114
      ATT: Read By Type Response (0x09) len 22
        Attribute data length: 7
        Attribute data list: 3 entries
        Handle: 0x0119
        Value[5]: 121a01b62b
            Properties: 0x12
              Read (0x02)
              Notify (0x10)
            Value Handle: 0x011a
            Value UUID: Bearer URI Schemes Supported List (0x2bb6)
        Handle: 0x011c
        Value[5]: 121d01b72b
            Properties: 0x12
              Read (0x02)
              Notify (0x10)
            Value Handle: 0x011d
            Value UUID: Bearer Signal Strength (0x2bb7)
        Handle: 0x011f
        Value[5]: 0e2001b82b
            Properties: 0x0e
              Read (0x02)
              Write Without Response (0x04)
              Write (0x08)
            Value Handle: 0x0120
            Value UUID: Bearer Signal Strength Reporting Interval (0x2bb8)
zephyr.exe[1688909]: < HCI Command: Host Number of Completed Packets (0x03|0x0035) plen 5                           #124 8.441658
        Num handles: 1
        Handle: 723 Address: C0:07:E8:2C:B6:EE (OUI C0-07-E8)
        Count: 1
zephyr.exe[1688909]: < ACL Data TX: Handle 723 [1/3] flags 0x00 dlen 9                                              #125 8.442413
      ATT: Write Request (0x12) len 4
        Handle: 0x0113
          Data[2]: 0100
> HCI Event: Number of Completed Packets (0x13) plen 5                                                              #126 8.548752
        Num handles: 1
        Handle: 723 Address: C0:07:E8:2C:B6:EE (OUI C0-07-E8)
        Count: 1
        Buffers: 0/3
        #125: len 9 (0 Kb/s)
        Latency: 106 msec (41-121 msec ~110 msec)
> ACL Data RX: Handle 723 flags 0x02 dlen 5                                                                         #127 8.548856
      ATT: Write Response (0x13) len 0
zephyr.exe[1688909]: < HCI Command: Host Number of Completed Packets (0x03|0x0035) plen 5                           #128 8.561938
        Num handles: 1
        Handle: 723 Address: C0:07:E8:2C:B6:EE (OUI C0-07-E8)
        Count: 1
zephyr.exe[1688909]: < ACL Data TX: Handle 723 [1/3] flags 0x00 dlen 9                                              #129 8.562559
      ATT: Write Request (0x12) len 4
        Handle: 0x0118
          Data[2]: 0100
> HCI Event: Number of Completed Packets (0x13) plen 5                                                              #130 8.673788
        Num handles: 1
        Handle: 723 Address: C0:07:E8:2C:B6:EE (OUI C0-07-E8)
        Count: 1
        Buffers: 0/3
        #129: len 9 (0 Kb/s)
        Latency: 111 msec (41-121 msec ~110 msec)
> ACL Data RX: Handle 723 flags 0x02 dlen 5                                                                         #131 8.673834
      ATT: Write Response (0x13) len 0
zephyr.exe[1688909]: < HCI Command: Host Number of Completed Packets (0x03|0x0035) plen 5                           #132 8.681946
        Num handles: 1
        Handle: 723 Address: C0:07:E8:2C:B6:EE (OUI C0-07-E8)
        Count: 1
zephyr.exe[1688909]: < ACL Data TX: Handle 723 [1/3] flags 0x00 dlen 9                                              #133 8.682566
      ATT: Find Information Request (0x04) len 4
        Handle range: 0x011d-0x013c
> HCI Event: Number of Completed Packets (0x13) plen 5                                                              #134 8.798808
        Num handles: 1
        Handle: 723 Address: C0:07:E8:2C:B6:EE (OUI C0-07-E8)
        Count: 1
        Buffers: 0/3
        #133: len 9 (0 Kb/s)
        Latency: 116 msec (41-121 msec ~113 msec)
> ACL Data RX: Handle 723 flags 0x02 dlen 26                                                                        #135 8.799198
      ATT: Find Information Response (0x05) len 21
        Format: UUID-16 (0x01)
        Handle: 0x011d
        UUID: Bearer Signal Strength (0x2bb7)
        Handle: 0x011e
        UUID: Client Characteristic Configuration (0x2902)
        Handle: 0x011f
        UUID: Characteristic (0x2803)
        Handle: 0x0120
        UUID: Bearer Signal Strength Reporting Interval (0x2bb8)
        Handle: 0x0121
        UUID: Characteristic (0x2803)
zephyr.exe[1688909]: < HCI Command: Host Number of Completed Packets (0x03|0x0035) plen 5                           #136 8.811133
        Num handles: 1
        Handle: 723 Address: C0:07:E8:2C:B6:EE (OUI C0-07-E8)
        Count: 1
zephyr.exe[1688909]: < ACL Data TX: Handle 723 [1/3] flags 0x00 dlen 11                                             #137 8.811781
      ATT: Read By Type Request (0x08) len 6
        Handle range: 0x0120-0x013c
        Attribute type: Characteristic (0x2803)
> HCI Event: Number of Completed Packets (0x13) plen 5                                                              #138 8.923796
        Num handles: 1
        Handle: 723 Address: C0:07:E8:2C:B6:EE (OUI C0-07-E8)
        Count: 1
        Buffers: 0/3
        #137: len 11 (0 Kb/s)
        Latency: 112 msec (41-121 msec ~112 msec)
> ACL Data RX: Handle 723 flags 0x02 dlen 27                                                                        #139 8.924176
      ATT: Read By Type Response (0x09) len 22
        Attribute data length: 7
        Attribute data list: 3 entries
        Handle: 0x0121
        Value[5]: 122201b92b
            Properties: 0x12
              Read (0x02)
              Notify (0x10)
            Value Handle: 0x0122
            Value UUID: Bearer List Current Calls (0x2bb9)
        Handle: 0x0124
        Value[5]: 022501ba2b
            Properties: 0x02
              Read (0x02)
            Value Handle: 0x0125
            Value UUID: Content Control ID (0x2bba)
        Handle: 0x0126
        Value[5]: 122701bc2b
            Properties: 0x12
              Read (0x02)
              Notify (0x10)
            Value Handle: 0x0127
            Value UUID: Incoming Call Target Bearer URI (0x2bbc)
zephyr.exe[1688909]: < HCI Command: Host Number of Completed Packets (0x03|0x0035) plen 5                           #140 8.941655
        Num handles: 1
        Handle: 723 Address: C0:07:E8:2C:B6:EE (OUI C0-07-E8)
        Count: 1
zephyr.exe[1688909]: < ACL Data TX: Handle 723 [1/3] flags 0x00 dlen 9                                              #141 8.943070
      ATT: Write Request (0x12) len 4
        Handle: 0x011e
          Data[2]: 0100
> HCI Event: Number of Completed Packets (0x13) plen 5                                                              #142 9.048691
        Num handles: 1
        Handle: 723 Address: C0:07:E8:2C:B6:EE (OUI C0-07-E8)
        Count: 1
        Buffers: 0/3
        #141: len 9 (0 Kb/s)
        Latency: 105 msec (41-121 msec ~109 msec)
> ACL Data RX: Handle 723 flags 0x02 dlen 5                                                                         #143 9.048992
      ATT: Write Response (0x13) len 0
zephyr.exe[1688909]: < HCI Command: Host Number of Completed Packets (0x03|0x0035) plen 5                           #144 9.061948
        Num handles: 1
        Handle: 723 Address: C0:07:E8:2C:B6:EE (OUI C0-07-E8)
        Count: 1
zephyr.exe[1688909]: < ACL Data TX: Handle 723 [1/3] flags 0x00 dlen 9                                              #145 9.062523
      ATT: Find Information Request (0x04) len 4
        Handle range: 0x0122-0x013c
> HCI Event: Number of Completed Packets (0x13) plen 5                                                              #146 9.173846
        Num handles: 1
        Handle: 723 Address: C0:07:E8:2C:B6:EE (OUI C0-07-E8)
        Count: 1
        Buffers: 0/3
        #145: len 9 (0 Kb/s)
        Latency: 111 msec (41-121 msec ~110 msec)
> ACL Data RX: Handle 723 flags 0x02 dlen 26                                                                        #147 9.174147
      ATT: Find Information Response (0x05) len 21
        Format: UUID-16 (0x01)
        Handle: 0x0122
        UUID: Bearer List Current Calls (0x2bb9)
        Handle: 0x0123
        UUID: Client Characteristic Configuration (0x2902)
        Handle: 0x0124
        UUID: Characteristic (0x2803)
        Handle: 0x0125
        UUID: Content Control ID (0x2bba)
        Handle: 0x0126
        UUID: Characteristic (0x2803)
zephyr.exe[1688909]: < HCI Command: Host Number of Completed Packets (0x03|0x0035) plen 5                           #148 9.181658
        Num handles: 1
        Handle: 723 Address: C0:07:E8:2C:B6:EE (OUI C0-07-E8)
        Count: 1
zephyr.exe[1688909]: < ACL Data TX: Handle 723 [1/3] flags 0x00 dlen 9                                              #149 9.181776
      ATT: Find Information Request (0x04) len 4
        Handle range: 0x0127-0x013c
> HCI Event: Number of Completed Packets (0x13) plen 5                                                              #150 9.298766
        Num handles: 1
        Handle: 723 Address: C0:07:E8:2C:B6:EE (OUI C0-07-E8)
        Count: 1
        Buffers: 0/3
        #149: len 9 (0 Kb/s)
        Latency: 116 msec (41-121 msec ~113 msec)
> ACL Data RX: Handle 723 flags 0x02 dlen 26                                                                        #151 9.299136
      ATT: Find Information Response (0x05) len 21
        Format: UUID-16 (0x01)
        Handle: 0x0127
        UUID: Incoming Call Target Bearer URI (0x2bbc)
        Handle: 0x0128
        UUID: Client Characteristic Configuration (0x2902)
        Handle: 0x0129
        UUID: Characteristic (0x2803)
        Handle: 0x012a
        UUID: Status Flags (0x2bbb)
        Handle: 0x012b
        UUID: Client Characteristic Configuration (0x2902)
zephyr.exe[1688909]: < HCI Command: Host Number of Completed Packets (0x03|0x0035) plen 5                           #152 9.311111
        Num handles: 1
        Handle: 723 Address: C0:07:E8:2C:B6:EE (OUI C0-07-E8)
        Count: 1
zephyr.exe[1688909]: < ACL Data TX: Handle 723 [1/3] flags 0x00 dlen 11                                             #153 9.313083
      ATT: Read By Type Request (0x08) len 6
        Handle range: 0x0127-0x013c
        Attribute type: Characteristic (0x2803)
> HCI Event: Number of Completed Packets (0x13) plen 5                                                              #154 9.423847
        Num handles: 1
        Handle: 723 Address: C0:07:E8:2C:B6:EE (OUI C0-07-E8)
        Count: 1
        Buffers: 0/3
        #153: len 11 (0 Kb/s)
        Latency: 110 msec (41-121 msec ~112 msec)
> ACL Data RX: Handle 723 flags 0x02 dlen 27                                                                        #155 9.424133
      ATT: Read By Type Response (0x09) len 22
        Attribute data length: 7
        Attribute data list: 3 entries
        Handle: 0x0129
        Value[5]: 122a01bb2b
            Properties: 0x12
              Read (0x02)
              Notify (0x10)
            Value Handle: 0x012a
            Value UUID: Status Flags (0x2bbb)
        Handle: 0x012c
        Value[5]: 122d01bd2b
            Properties: 0x12
              Read (0x02)
              Notify (0x10)
            Value Handle: 0x012d
            Value UUID: Call State (0x2bbd)
        Handle: 0x012f
        Value[5]: 1c3001be2b
            Properties: 0x1c
              Write Without Response (0x04)
              Write (0x08)
              Notify (0x10)
            Value Handle: 0x0130
            Value UUID: Call Control Point (0x2bbe)
zephyr.exe[1688909]: < HCI Command: Host Number of Completed Packets (0x03|0x0035) plen 5                           #156 9.441666
        Num handles: 1
        Handle: 723 Address: C0:07:E8:2C:B6:EE (OUI C0-07-E8)
        Count: 1
zephyr.exe[1688909]: < ACL Data TX: Handle 723 [1/3] flags 0x00 dlen 9                                              #157 9.445063
      ATT: Write Request (0x12) len 4
        Handle: 0x0123
          Data[2]: 0100
> HCI Event: Number of Completed Packets (0x13) plen 5                                                              #158 9.548723
        Num handles: 1
        Handle: 723 Address: C0:07:E8:2C:B6:EE (OUI C0-07-E8)
        Count: 1
        Buffers: 0/3
        #157: len 9 (0 Kb/s)
        Latency: 103 msec (41-121 msec ~107 msec)
> ACL Data RX: Handle 723 flags 0x02 dlen 5                                                                         #159 9.549264
      ATT: Write Response (0x13) len 0
zephyr.exe[1688909]: < HCI Command: Host Number of Completed Packets (0x03|0x0035) plen 5                           #160 9.561970
        Num handles: 1
        Handle: 723 Address: C0:07:E8:2C:B6:EE (OUI C0-07-E8)
        Count: 1
zephyr.exe[1688909]: < ACL Data TX: Handle 723 [1/3] flags 0x00 dlen 9                                              #161 9.562660
      ATT: Write Request (0x12) len 4
        Handle: 0x0128
          Data[2]: 0100
> HCI Event: Number of Completed Packets (0x13) plen 5                                                              #162 9.673678
        Num handles: 1
        Handle: 723 Address: C0:07:E8:2C:B6:EE (OUI C0-07-E8)
        Count: 1
        Buffers: 0/3
        #161: len 9 (0 Kb/s)
        Latency: 111 msec (41-121 msec ~109 msec)
> ACL Data RX: Handle 723 flags 0x02 dlen 5                                                                         #163 9.674090
      ATT: Write Response (0x13) len 0
zephyr.exe[1688909]: < HCI Command: Host Number of Completed Packets (0x03|0x0035) plen 5                           #164 9.681957
        Num handles: 1
        Handle: 723 Address: C0:07:E8:2C:B6:EE (OUI C0-07-E8)
        Count: 1
zephyr.exe[1688909]: < ACL Data TX: Handle 723 [1/3] flags 0x00 dlen 9                                              #165 9.682555
      ATT: Find Information Request (0x04) len 4
        Handle range: 0x012a-0x013c
> HCI Event: Number of Completed Packets (0x13) plen 5                                                              #166 9.798830
        Num handles: 1
        Handle: 723 Address: C0:07:E8:2C:B6:EE (OUI C0-07-E8)
        Count: 1
        Buffers: 0/3
        #165: len 9 (0 Kb/s)
        Latency: 116 msec (41-121 msec ~112 msec)
> ACL Data RX: Handle 723 flags 0x02 dlen 26                                                                        #167 9.799298
      ATT: Find Information Response (0x05) len 21
        Format: UUID-16 (0x01)
        Handle: 0x012a
        UUID: Status Flags (0x2bbb)
        Handle: 0x012b
        UUID: Client Characteristic Configuration (0x2902)
        Handle: 0x012c
        UUID: Characteristic (0x2803)
        Handle: 0x012d
        UUID: Call State (0x2bbd)
        Handle: 0x012e
        UUID: Client Characteristic Configuration (0x2902)
zephyr.exe[1688909]: < HCI Command: Host Number of Completed Packets (0x03|0x0035) plen 5                           #168 9.806770
        Num handles: 1
        Handle: 723 Address: C0:07:E8:2C:B6:EE (OUI C0-07-E8)
        Count: 1
zephyr.exe[1688909]: < ACL Data TX: Handle 723 [1/3] flags 0x00 dlen 9                                              #169 9.810138
      ATT: Find Information Request (0x04) len 4
        Handle range: 0x012d-0x013c
> HCI Event: Number of Completed Packets (0x13) plen 5                                                              #170 9.923778
        Num handles: 1
        Handle: 723 Address: C0:07:E8:2C:B6:EE (OUI C0-07-E8)
        Count: 1
        Buffers: 0/3
        #169: len 9 (0 Kb/s)
        Latency: 113 msec (41-121 msec ~113 msec)
> ACL Data RX: Handle 723 flags 0x02 dlen 26                                                                        #171 9.924173
      ATT: Find Information Response (0x05) len 21
        Format: UUID-16 (0x01)
        Handle: 0x012d
        UUID: Call State (0x2bbd)
        Handle: 0x012e
        UUID: Client Characteristic Configuration (0x2902)
        Handle: 0x012f
        UUID: Characteristic (0x2803)
        Handle: 0x0130
        UUID: Call Control Point (0x2bbe)
        Handle: 0x0131
        UUID: Client Characteristic Configuration (0x2902)
zephyr.exe[1688909]: < HCI Command: Host Number of Completed Packets (0x03|0x0035) plen 5                           #172 9.941663
        Num handles: 1
        Handle: 723 Address: C0:07:E8:2C:B6:EE (OUI C0-07-E8)
        Count: 1
zephyr.exe[1688909]: < ACL Data TX: Handle 723 [1/3] flags 0x00 dlen 9                                              #173 9.943030
      ATT: Find Information Request (0x04) len 4
        Handle range: 0x0130-0x013c
> HCI Event: Number of Completed Packets (0x13) plen 5                                                             #174 10.048911
        Num handles: 1
        Handle: 723 Address: C0:07:E8:2C:B6:EE (OUI C0-07-E8)
        Count: 1
        Buffers: 0/3
        #173: len 9 (0 Kb/s)
        Latency: 105 msec (41-121 msec ~109 msec)
> ACL Data RX: Handle 723 flags 0x02 dlen 26                                                                       #175 10.049189
      ATT: Find Information Response (0x05) len 21
        Format: UUID-16 (0x01)
        Handle: 0x0130
        UUID: Call Control Point (0x2bbe)
        Handle: 0x0131
        UUID: Client Characteristic Configuration (0x2902)
        Handle: 0x0132
        UUID: Characteristic (0x2803)
        Handle: 0x0133
        UUID: Termination Reason (0x2bc0)
        Handle: 0x0134
        UUID: Client Characteristic Configuration (0x2902)
zephyr.exe[1688909]: < HCI Command: Host Number of Completed Packets (0x03|0x0035) plen 5                          #176 10.061692
        Num handles: 1
        Handle: 723 Address: C0:07:E8:2C:B6:EE (OUI C0-07-E8)
        Count: 1
zephyr.exe[1688909]: < ACL Data TX: Handle 723 [1/3] flags 0x00 dlen 11                                            #177 10.063272
      ATT: Read By Type Request (0x08) len 6
        Handle range: 0x0130-0x013c
        Attribute type: Characteristic (0x2803)
> HCI Event: Number of Completed Packets (0x13) plen 5                                                             #178 10.173853
        Num handles: 1
        Handle: 723 Address: C0:07:E8:2C:B6:EE (OUI C0-07-E8)
        Count: 1
        Buffers: 0/3
        #177: len 11 (0 Kb/s)
        Latency: 110 msec (41-121 msec ~110 msec)
> ACL Data RX: Handle 723 flags 0x02 dlen 27                                                                       #179 10.174249
      ATT: Read By Type Response (0x09) len 22
        Attribute data length: 7
        Attribute data list: 3 entries
        Handle: 0x0132
        Value[5]: 103301c02b
            Properties: 0x10
              Notify (0x10)
            Value Handle: 0x0133
            Value UUID: Termination Reason (0x2bc0)
        Handle: 0x0135
        Value[5]: 123601c12b
            Properties: 0x12
              Read (0x02)
              Notify (0x10)
            Value Handle: 0x0136
            Value UUID: Incoming Call (0x2bc1)
        Handle: 0x0138
        Value[5]: 123901c22b
            Properties: 0x12
              Read (0x02)
              Notify (0x10)
            Value Handle: 0x0139
            Value UUID: Call Friendly Name (0x2bc2)
zephyr.exe[1688909]: < HCI Command: Host Number of Completed Packets (0x03|0x0035) plen 5                          #180 10.183170
        Num handles: 1
        Handle: 723 Address: C0:07:E8:2C:B6:EE (OUI C0-07-E8)
        Count: 1
zephyr.exe[1688909]: < ACL Data TX: Handle 723 [1/3] flags 0x00 dlen 9                                             #181 10.185086
      ATT: Write Request (0x12) len 4
        Handle: 0x012b
          Data[2]: 0100
> HCI Event: Number of Completed Packets (0x13) plen 5                                                             #182 10.298701
        Num handles: 1
        Handle: 723 Address: C0:07:E8:2C:B6:EE (OUI C0-07-E8)
        Count: 1
        Buffers: 0/3
        #181: len 9 (0 Kb/s)
        Latency: 113 msec (41-121 msec ~111 msec)
> ACL Data RX: Handle 723 flags 0x02 dlen 5                                                                        #183 10.298946
      ATT: Write Response (0x13) len 0
zephyr.exe[1688909]: < HCI Command: Host Number of Completed Packets (0x03|0x0035) plen 5                          #184 10.301958
        Num handles: 1
        Handle: 723 Address: C0:07:E8:2C:B6:EE (OUI C0-07-E8)
        Count: 1
zephyr.exe[1688909]: < ACL Data TX: Handle 723 [1/3] flags 0x00 dlen 9                                             #185 10.302148
      ATT: Write Request (0x12) len 4
        Handle: 0x012e
          Data[2]: 0100
> HCI Event: Number of Completed Packets (0x13) plen 5                                                             #186 10.423798
        Num handles: 1
        Handle: 723 Address: C0:07:E8:2C:B6:EE (OUI C0-07-E8)
        Count: 1
        Buffers: 0/3
        #185: len 9 (0 Kb/s)
        Latency: 121 msec (41-121 msec ~116 msec)
> ACL Data RX: Handle 723 flags 0x02 dlen 5                                                                        #187 10.423876
      ATT: Write Response (0x13) len 0
zephyr.exe[1688909]: < HCI Command: Host Number of Completed Packets (0x03|0x0035) plen 5                          #188 10.441964
        Num handles: 1
        Handle: 723 Address: C0:07:E8:2C:B6:EE (OUI C0-07-E8)
        Count: 1
zephyr.exe[1688909]: < ACL Data TX: Handle 723 [1/3] flags 0x00 dlen 9                                             #189 10.442465
      ATT: Write Request (0x12) len 4
        Handle: 0x0131
          Data[2]: 0100
> HCI Event: Number of Completed Packets (0x13) plen 5                                                             #190 10.548774
        Num handles: 1
        Handle: 723 Address: C0:07:E8:2C:B6:EE (OUI C0-07-E8)
        Count: 1
        Buffers: 0/3
        #189: len 9 (0 Kb/s)
        Latency: 106 msec (41-121 msec ~111 msec)
> ACL Data RX: Handle 723 flags 0x02 dlen 5                                                                        #191 10.548942
      ATT: Write Response (0x13) len 0
zephyr.exe[1688909]: < HCI Command: Host Number of Completed Packets (0x03|0x0035) plen 5                          #192 10.561877
        Num handles: 1
        Handle: 723 Address: C0:07:E8:2C:B6:EE (OUI C0-07-E8)
        Count: 1
zephyr.exe[1688909]: < ACL Data TX: Handle 723 [1/3] flags 0x00 dlen 9                                             #193 10.562127
      ATT: Find Information Request (0x04) len 4
        Handle range: 0x0133-0x013c
> HCI Event: Number of Completed Packets (0x13) plen 5                                                             #194 10.673796
        Num handles: 1
        Handle: 723 Address: C0:07:E8:2C:B6:EE (OUI C0-07-E8)
        Count: 1
        Buffers: 0/3
        #193: len 9 (0 Kb/s)
        Latency: 111 msec (41-121 msec ~111 msec)
> ACL Data RX: Handle 723 flags 0x02 dlen 26                                                                       #195 10.674298
      ATT: Find Information Response (0x05) len 21
        Format: UUID-16 (0x01)
        Handle: 0x0133
        UUID: Termination Reason (0x2bc0)
        Handle: 0x0134
        UUID: Client Characteristic Configuration (0x2902)
        Handle: 0x0135
        UUID: Characteristic (0x2803)
        Handle: 0x0136
        UUID: Incoming Call (0x2bc1)
        Handle: 0x0137
        UUID: Client Characteristic Configuration (0x2902)
zephyr.exe[1688909]: < HCI Command: Host Number of Completed Packets (0x03|0x0035) plen 5                          #196 10.686205
        Num handles: 1
        Handle: 723 Address: C0:07:E8:2C:B6:EE (OUI C0-07-E8)
        Count: 1
zephyr.exe[1688909]: < ACL Data TX: Handle 723 [1/3] flags 0x00 dlen 9                                             #197 10.686415
      ATT: Find Information Request (0x04) len 4
        Handle range: 0x0136-0x013c
> HCI Event: Number of Completed Packets (0x13) plen 5                                                             #198 10.798832
        Num handles: 1
        Handle: 723 Address: C0:07:E8:2C:B6:EE (OUI C0-07-E8)
        Count: 1
        Buffers: 0/3
        #197: len 9 (0 Kb/s)
        Latency: 112 msec (41-121 msec ~112 msec)
> ACL Data RX: Handle 723 flags 0x02 dlen 26                                                                       #199 10.799263
      ATT: Find Information Response (0x05) len 21
        Format: UUID-16 (0x01)
        Handle: 0x0136
        UUID: Incoming Call (0x2bc1)
        Handle: 0x0137
        UUID: Client Characteristic Configuration (0x2902)
        Handle: 0x0138
        UUID: Characteristic (0x2803)
        Handle: 0x0139
        UUID: Call Friendly Name (0x2bc2)
        Handle: 0x013a
        UUID: Client Characteristic Configuration (0x2902)
zephyr.exe[1688909]: < HCI Command: Host Number of Completed Packets (0x03|0x0035) plen 5                          #200 10.805328
        Num handles: 1
        Handle: 723 Address: C0:07:E8:2C:B6:EE (OUI C0-07-E8)
        Count: 1
zephyr.exe[1688909]: < ACL Data TX: Handle 723 [1/3] flags 0x00 dlen 9                                             #201 10.806471
      ATT: Find Information Request (0x04) len 4
        Handle range: 0x0139-0x013c
> HCI Event: Number of Completed Packets (0x13) plen 5                                                             #202 10.923746
        Num handles: 1
        Handle: 723 Address: C0:07:E8:2C:B6:EE (OUI C0-07-E8)
        Count: 1
        Buffers: 0/3
        #201: len 9 (0 Kb/s)
        Latency: 117 msec (41-121 msec ~114 msec)
> ACL Data RX: Handle 723 flags 0x02 dlen 22                                                                       #203 10.924174
      ATT: Find Information Response (0x05) len 17
        Format: UUID-16 (0x01)
        Handle: 0x0139
        UUID: Call Friendly Name (0x2bc2)
        Handle: 0x013a
        UUID: Client Characteristic Configuration (0x2902)
        Handle: 0x013b
        UUID: Characteristic (0x2803)
        Handle: 0x013c
        UUID: Call Control Point Optional Opcodes (0x2bbf)
zephyr.exe[1688909]: < HCI Command: Host Number of Completed Packets (0x03|0x0035) plen 5                          #204 10.941675
        Num handles: 1
        Handle: 723 Address: C0:07:E8:2C:B6:EE (OUI C0-07-E8)
        Count: 1
zephyr.exe[1688909]: < ACL Data TX: Handle 723 [1/3] flags 0x00 dlen 11                                            #205 10.941988
      ATT: Read By Type Request (0x08) len 6
        Handle range: 0x0139-0x013c
        Attribute type: Characteristic (0x2803)
> HCI Event: Number of Completed Packets (0x13) plen 5                                                             #206 11.048812
        Num handles: 1
        Handle: 723 Address: C0:07:E8:2C:B6:EE (OUI C0-07-E8)
        Count: 1
        Buffers: 0/3
        #205: len 11 (0 Kb/s)
        Latency: 106 msec (41-121 msec ~110 msec)
> ACL Data RX: Handle 723 flags 0x02 dlen 13                                                                       #207 11.049224
      ATT: Read By Type Response (0x09) len 8
        Attribute data length: 7
        Attribute data list: 1 entry
        Handle: 0x013b
        Value[5]: 023c01bf2b
            Properties: 0x02
              Read (0x02)
            Value Handle: 0x013c
            Value UUID: Call Control Point Optional Opcodes (0x2bbf)
zephyr.exe[1688909]: < HCI Command: Host Number of Completed Packets (0x03|0x0035) plen 5                          #208 11.061704
        Num handles: 1
        Handle: 723 Address: C0:07:E8:2C:B6:EE (OUI C0-07-E8)
        Count: 1
zephyr.exe[1688909]: < ACL Data TX: Handle 723 [1/3] flags 0x00 dlen 9                                             #209 11.062772
      ATT: Write Request (0x12) len 4
        Handle: 0x0134
          Data[2]: 0100
> HCI Event: Number of Completed Packets (0x13) plen 5                                                             #210 11.173730
        Num handles: 1
        Handle: 723 Address: C0:07:E8:2C:B6:EE (OUI C0-07-E8)
        Count: 1
        Buffers: 0/3
        #209: len 9 (0 Kb/s)
        Latency: 110 msec (41-121 msec ~110 msec)
> ACL Data RX: Handle 723 flags 0x02 dlen 5                                                                        #211 11.173847
      ATT: Write Response (0x13) len 0
zephyr.exe[1688909]: < HCI Command: Host Number of Completed Packets (0x03|0x0035) plen 5                          #212 11.181976
        Num handles: 1
        Handle: 723 Address: C0:07:E8:2C:B6:EE (OUI C0-07-E8)
        Count: 1
zephyr.exe[1688909]: < ACL Data TX: Handle 723 [1/3] flags 0x00 dlen 9                                             #213 11.182570
      ATT: Write Request (0x12) len 4
        Handle: 0x0137
          Data[2]: 0100
> HCI Event: Number of Completed Packets (0x13) plen 5                                                             #214 11.298733
        Num handles: 1
        Handle: 723 Address: C0:07:E8:2C:B6:EE (OUI C0-07-E8)
        Count: 1
        Buffers: 0/3
        #213: len 9 (0 Kb/s)
        Latency: 116 msec (41-121 msec ~113 msec)
> ACL Data RX: Handle 723 flags 0x02 dlen 5                                                                        #215 11.298983
      ATT: Write Response (0x13) len 0
zephyr.exe[1688909]: < HCI Command: Host Number of Completed Packets (0x03|0x0035) plen 5                          #216 11.301674
        Num handles: 1
        Handle: 723 Address: C0:07:E8:2C:B6:EE (OUI C0-07-E8)
        Count: 1
zephyr.exe[1688909]: < ACL Data TX: Handle 723 [1/3] flags 0x00 dlen 9                                             #217 11.301698
      ATT: Write Request (0x12) len 4
        Handle: 0x013a
          Data[2]: 0100
> HCI Event: Number of Completed Packets (0x13) plen 5                                                             #218 11.423744
        Num handles: 1
        Handle: 723 Address: C0:07:E8:2C:B6:EE (OUI C0-07-E8)
        Count: 1
        Buffers: 0/3
        #217: len 9 (0 Kb/s)
        Latency: 122 msec (41-122 msec ~117 msec)
> ACL Data RX: Handle 723 flags 0x02 dlen 5                                                                        #219 11.424013
      ATT: Write Response (0x13) len 0
zephyr.exe[1688909]: < HCI Command: Host Number of Completed Packets (0x03|0x0035) plen 5                          #220 11.441987
        Num handles: 1
        Handle: 723 Address: C0:07:E8:2C:B6:EE (OUI C0-07-E8)
        Count: 1
zephyr.exe[1688909]: < ACL Data TX: Handle 723 [1/3] flags 0x00 dlen 11                                            #221 11.442658
      ATT: Read By Type Request (0x08) len 6
        Handle range: 0x013c-0x013c
        Attribute type: Characteristic (0x2803)
> HCI Event: Number of Completed Packets (0x13) plen 5                                                             #222 11.548788
        Num handles: 1
        Handle: 723 Address: C0:07:E8:2C:B6:EE (OUI C0-07-E8)
        Count: 1
        Buffers: 0/3
        #221: len 11 (0 Kb/s)
        Latency: 106 msec (41-122 msec ~111 msec)
> ACL Data RX: Handle 723 flags 0x02 dlen 9                                                                        #223 11.549191
      ATT: Error Response (0x01) len 4
        Read By Type Request (0x08)
        Handle: 0x013c
        Error: Attribute Not Found (0x0a)
zephyr.exe[1688909]: < HCI Command: Host Number of Completed Packets (0x03|0x0035) plen 5                          #224 11.561986
        Num handles: 1
        Handle: 723 Address: C0:07:E8:2C:B6:EE (OUI C0-07-E8)
        Count: 1
zephyr.exe[1688909]: < ACL Data TX: Handle 723 [1/3] flags 0x00 dlen 7                                             #225 11.562544
      ATT: Read Request (0x0a) len 2
        Handle: 0x0125
> HCI Event: Number of Completed Packets (0x13) plen 5                                                             #226 11.673740
        Num handles: 1
        Handle: 723 Address: C0:07:E8:2C:B6:EE (OUI C0-07-E8)
        Count: 1
        Buffers: 0/3
        #225: len 7 (0 Kb/s)
        Latency: 111 msec (41-122 msec ~111 msec)
> ACL Data RX: Handle 723 flags 0x02 dlen 6                                                                        #227 11.674060
      ATT: Read Response (0x0b) len 1
        Value[1]: 02
zephyr.exe[1688909]: < HCI Command: Host Number of Completed Packets (0x03|0x0035) plen 5                          #228 11.681979
        Num handles: 1
        Handle: 723 Address: C0:07:E8:2C:B6:EE (OUI C0-07-E8)
        Count: 1
zephyr.exe[1688909]: < ACL Data TX: Handle 723 [1/3] flags 0x00 dlen 11                                            #229 11.682585
      ATT: Read By Type Request (0x08) len 6
        Handle range: 0x00d1-0x00fc
        Attribute type: Characteristic (0x2803)
> HCI Event: Number of Completed Packets (0x13) plen 5                                                             #230 11.798831
        Num handles: 1
        Handle: 723 Address: C0:07:E8:2C:B6:EE (OUI C0-07-E8)
        Count: 1
        Buffers: 0/3
        #229: len 11 (0 Kb/s)
        Latency: 116 msec (41-122 msec ~113 msec)
> ACL Data RX: Handle 723 flags 0x02 dlen 27                                                                       #231 11.799188
      ATT: Read By Type Response (0x09) len 22
        Attribute data length: 7
        Attribute data list: 3 entries
        Handle: 0x00d1
        Value[5]: 12d200b32b
            Properties: 0x12
              Read (0x02)
              Notify (0x10)
            Value Handle: 0x00d2
            Value UUID: Bearer Provider Name (0x2bb3)
        Handle: 0x00d4
        Value[5]: 02d500b42b
            Properties: 0x02
              Read (0x02)
            Value Handle: 0x00d5
            Value UUID: Bearer UCI (0x2bb4)
        Handle: 0x00d6
        Value[5]: 12d700b52b
            Properties: 0x12
              Read (0x02)
              Notify (0x10)
            Value Handle: 0x00d7
            Value UUID: Bearer Technology (0x2bb5)
zephyr.exe[1688909]: < HCI Command: Host Number of Completed Packets (0x03|0x0035) plen 5                          #232 11.811406
        Num handles: 1
        Handle: 723 Address: C0:07:E8:2C:B6:EE (OUI C0-07-E8)
        Count: 1
zephyr.exe[1688909]: < ACL Data TX: Handle 723 [1/3] flags 0x00 dlen 9                                             #233 11.812209
      ATT: Find Information Request (0x04) len 4
        Handle range: 0x00d2-0x00fc
> HCI Event: Number of Completed Packets (0x13) plen 5                                                             #234 11.923827
        Num handles: 1
        Handle: 723 Address: C0:07:E8:2C:B6:EE (OUI C0-07-E8)
        Count: 1
        Buffers: 0/3
        #233: len 9 (0 Kb/s)
        Latency: 111 msec (41-122 msec ~112 msec)
> ACL Data RX: Handle 723 flags 0x02 dlen 26                                                                       #235 11.924104
      ATT: Find Information Response (0x05) len 21
        Format: UUID-16 (0x01)
        Handle: 0x00d2
        UUID: Bearer Provider Name (0x2bb3)
        Handle: 0x00d3
        UUID: Client Characteristic Configuration (0x2902)
        Handle: 0x00d4
        UUID: Characteristic (0x2803)
        Handle: 0x00d5
        UUID: Bearer UCI (0x2bb4)
        Handle: 0x00d6
        UUID: Characteristic (0x2803)
zephyr.exe[1688909]: < HCI Command: Host Number of Completed Packets (0x03|0x0035) plen 5                          #236 11.941689
        Num handles: 1
        Handle: 723 Address: C0:07:E8:2C:B6:EE (OUI C0-07-E8)
        Count: 1
zephyr.exe[1688909]: < ACL Data TX: Handle 723 [1/3] flags 0x00 dlen 9                                             #237 11.942882
      ATT: Find Information Request (0x04) len 4
        Handle range: 0x00d7-0x00fc
> HCI Event: Number of Completed Packets (0x13) plen 5                                                             #238 12.048791
        Num handles: 1
        Handle: 723 Address: C0:07:E8:2C:B6:EE (OUI C0-07-E8)
        Count: 1
        Buffers: 0/3
        #237: len 9 (0 Kb/s)
        Latency: 105 msec (41-122 msec ~109 msec)
> ACL Data RX: Handle 723 flags 0x02 dlen 26                                                                       #239 12.049292
      ATT: Find Information Response (0x05) len 21
        Format: UUID-16 (0x01)
        Handle: 0x00d7
        UUID: Bearer Technology (0x2bb5)
        Handle: 0x00d8
        UUID: Client Characteristic Configuration (0x2902)
        Handle: 0x00d9
        UUID: Characteristic (0x2803)
        Handle: 0x00da
        UUID: Bearer URI Schemes Supported List (0x2bb6)
        Handle: 0x00db
        UUID: Client Characteristic Configuration (0x2902)
zephyr.exe[1688909]: < HCI Command: Host Number of Completed Packets (0x03|0x0035) plen 5                          #240 12.061693
        Num handles: 1
        Handle: 723 Address: C0:07:E8:2C:B6:EE (OUI C0-07-E8)
        Count: 1
zephyr.exe[1688909]: < ACL Data TX: Handle 723 [1/3] flags 0x00 dlen 11                                            #241 12.063522
      ATT: Read By Type Request (0x08) len 6
        Handle range: 0x00d7-0x00fc
        Attribute type: Characteristic (0x2803)
> HCI Event: Number of Completed Packets (0x13) plen 5                                                             #242 12.173857
        Num handles: 1
        Handle: 723 Address: C0:07:E8:2C:B6:EE (OUI C0-07-E8)
        Count: 1
        Buffers: 0/3
        #241: len 11 (0 Kb/s)
        Latency: 110 msec (41-122 msec ~109 msec)
> ACL Data RX: Handle 723 flags 0x02 dlen 27                                                                       #243 12.174154
      ATT: Read By Type Response (0x09) len 22
        Attribute data length: 7
        Attribute data list: 3 entries
        Handle: 0x00d9
        Value[5]: 12da00b62b
            Properties: 0x12
              Read (0x02)
              Notify (0x10)
            Value Handle: 0x00da
            Value UUID: Bearer URI Schemes Supported List (0x2bb6)
        Handle: 0x00dc
        Value[5]: 12dd00b72b
            Properties: 0x12
              Read (0x02)
              Notify (0x10)
            Value Handle: 0x00dd
            Value UUID: Bearer Signal Strength (0x2bb7)
        Handle: 0x00df
        Value[5]: 0ee000b82b
            Properties: 0x0e
              Read (0x02)
              Write Without Response (0x04)
              Write (0x08)
            Value Handle: 0x00e0
            Value UUID: Bearer Signal Strength Reporting Interval (0x2bb8)
zephyr.exe[1688909]: < HCI Command: Host Number of Completed Packets (0x03|0x0035) plen 5                          #244 12.193084
        Num handles: 1
        Handle: 723 Address: C0:07:E8:2C:B6:EE (OUI C0-07-E8)
        Count: 1
zephyr.exe[1688909]: < ACL Data TX: Handle 723 [1/3] flags 0x00 dlen 9                                             #245 12.193197
      ATT: Write Request (0x12) len 4
        Handle: 0x00d3
          Data[2]: 0100
> HCI Event: Number of Completed Packets (0x13) plen 5                                                             #246 12.298694
        Num handles: 1
        Handle: 723 Address: C0:07:E8:2C:B6:EE (OUI C0-07-E8)
        Count: 1
        Buffers: 0/3
        #245: len 9 (0 Kb/s)
        Latency: 105 msec (41-122 msec ~107 msec)
> ACL Data RX: Handle 723 flags 0x02 dlen 5                                                                        #247 12.298886
      ATT: Write Response (0x13) len 0
zephyr.exe[1688909]: < HCI Command: Host Number of Completed Packets (0x03|0x0035) plen 5                          #248 12.301703
        Num handles: 1
        Handle: 723 Address: C0:07:E8:2C:B6:EE (OUI C0-07-E8)
        Count: 1
zephyr.exe[1688909]: < ACL Data TX: Handle 723 [1/3] flags 0x00 dlen 9                                             #249 12.303207
      ATT: Write Request (0x12) len 4
        Handle: 0x00d8
          Data[2]: 0100
> HCI Event: Number of Completed Packets (0x13) plen 5                                                             #250 12.423734
        Num handles: 1
        Handle: 723 Address: C0:07:E8:2C:B6:EE (OUI C0-07-E8)
        Count: 1
        Buffers: 0/3
        #249: len 9 (0 Kb/s)
        Latency: 120 msec (41-122 msec ~114 msec)
> ACL Data RX: Handle 723 flags 0x02 dlen 5                                                                        #251 12.423937
      ATT: Write Response (0x13) len 0
zephyr.exe[1688909]: < HCI Command: Host Number of Completed Packets (0x03|0x0035) plen 5                          #252 12.441756
        Num handles: 1
        Handle: 723 Address: C0:07:E8:2C:B6:EE (OUI C0-07-E8)
        Count: 1
zephyr.exe[1688909]: < ACL Data TX: Handle 723 [1/3] flags 0x00 dlen 9                                             #253 12.443173
      ATT: Find Information Request (0x04) len 4
        Handle range: 0x00dd-0x00fc
> HCI Event: Number of Completed Packets (0x13) plen 5                                                             #254 12.548840
        Num handles: 1
        Handle: 723 Address: C0:07:E8:2C:B6:EE (OUI C0-07-E8)
        Count: 1
        Buffers: 0/3
        #253: len 9 (0 Kb/s)
        Latency: 105 msec (41-122 msec ~109 msec)
> ACL Data RX: Handle 723 flags 0x02 dlen 26                                                                       #255 12.549374
      ATT: Find Information Response (0x05) len 21
        Format: UUID-16 (0x01)
        Handle: 0x00dd
        UUID: Bearer Signal Strength (0x2bb7)
        Handle: 0x00de
        UUID: Client Characteristic Configuration (0x2902)
        Handle: 0x00df
        UUID: Characteristic (0x2803)
        Handle: 0x00e0
        UUID: Bearer Signal Strength Reporting Interval (0x2bb8)
        Handle: 0x00e1
        UUID: Characteristic (0x2803)
zephyr.exe[1688909]: < HCI Command: Host Number of Completed Packets (0x03|0x0035) plen 5                          #256 12.561699
        Num handles: 1
        Handle: 723 Address: C0:07:E8:2C:B6:EE (OUI C0-07-E8)
        Count: 1
zephyr.exe[1688909]: < ACL Data TX: Handle 723 [1/3] flags 0x00 dlen 11                                            #257 12.562999
      ATT: Read By Type Request (0x08) len 6
        Handle range: 0x00e0-0x00fc
        Attribute type: Characteristic (0x2803)
> HCI Event: Number of Completed Packets (0x13) plen 5                                                             #258 12.673888
        Num handles: 1
        Handle: 723 Address: C0:07:E8:2C:B6:EE (OUI C0-07-E8)
        Count: 1
        Buffers: 0/3
        #257: len 11 (0 Kb/s)
        Latency: 110 msec (41-122 msec ~110 msec)
> ACL Data RX: Handle 723 flags 0x02 dlen 27                                                                       #259 12.674231
      ATT: Read By Type Response (0x09) len 22
        Attribute data length: 7
        Attribute data list: 3 entries
        Handle: 0x00e1
        Value[5]: 12e200b92b
            Properties: 0x12
              Read (0x02)
              Notify (0x10)
            Value Handle: 0x00e2
            Value UUID: Bearer List Current Calls (0x2bb9)
        Handle: 0x00e4
        Value[5]: 02e500ba2b
            Properties: 0x02
              Read (0x02)
            Value Handle: 0x00e5
            Value UUID: Content Control ID (0x2bba)
        Handle: 0x00e6
        Value[5]: 12e700bc2b
            Properties: 0x12
              Read (0x02)
              Notify (0x10)
            Value Handle: 0x00e7
            Value UUID: Incoming Call Target Bearer URI (0x2bbc)
zephyr.exe[1688909]: < HCI Command: Host Number of Completed Packets (0x03|0x0035) plen 5                          #260 12.681708
        Num handles: 1
        Handle: 723 Address: C0:07:E8:2C:B6:EE (OUI C0-07-E8)
        Count: 1
zephyr.exe[1688909]: < ACL Data TX: Handle 723 [1/3] flags 0x00 dlen 9                                             #261 12.682971
      ATT: Write Request (0x12) len 4
        Handle: 0x00de
          Data[2]: 0100
> HCI Event: Number of Completed Packets (0x13) plen 5                                                             #262 12.798727
        Num handles: 1
        Handle: 723 Address: C0:07:E8:2C:B6:EE (OUI C0-07-E8)
        Count: 1
        Buffers: 0/3
        #261: len 9 (0 Kb/s)
        Latency: 115 msec (41-122 msec ~113 msec)
> ACL Data RX: Handle 723 flags 0x02 dlen 5                                                                        #263 12.798911
      ATT: Write Response (0x13) len 0
zephyr.exe[1688909]: < HCI Command: Host Number of Completed Packets (0x03|0x0035) plen 5                          #264 12.801920
        Num handles: 1
        Handle: 723 Address: C0:07:E8:2C:B6:EE (OUI C0-07-E8)
        Count: 1
zephyr.exe[1688909]: < ACL Data TX: Handle 723 [1/3] flags 0x00 dlen 9                                             #265 12.802711
      ATT: Find Information Request (0x04) len 4
        Handle range: 0x00e2-0x00fc
> HCI Event: Number of Completed Packets (0x13) plen 5                                                             #266 12.923823
        Num handles: 1
        Handle: 723 Address: C0:07:E8:2C:B6:EE (OUI C0-07-E8)
        Count: 1
        Buffers: 0/3
        #265: len 9 (0 Kb/s)
        Latency: 121 msec (41-122 msec ~117 msec)
> ACL Data RX: Handle 723 flags 0x02 dlen 26                                                                       #267 12.924358
      ATT: Find Information Response (0x05) len 21
        Format: UUID-16 (0x01)
        Handle: 0x00e2
        UUID: Bearer List Current Calls (0x2bb9)
        Handle: 0x00e3
        UUID: Client Characteristic Configuration (0x2902)
        Handle: 0x00e4
        UUID: Characteristic (0x2803)
        Handle: 0x00e5
        UUID: Content Control ID (0x2bba)
        Handle: 0x00e6
        UUID: Characteristic (0x2803)
zephyr.exe[1688909]: < HCI Command: Host Number of Completed Packets (0x03|0x0035) plen 5                          #268 12.941706
        Num handles: 1
        Handle: 723 Address: C0:07:E8:2C:B6:EE (OUI C0-07-E8)
        Count: 1
zephyr.exe[1688909]: < ACL Data TX: Handle 723 [1/3] flags 0x00 dlen 9                                             #269 12.942275
      ATT: Find Information Request (0x04) len 4
        Handle range: 0x00e7-0x00fc
> HCI Event: Number of Completed Packets (0x13) plen 5                                                             #270 13.048848
        Num handles: 1
        Handle: 723 Address: C0:07:E8:2C:B6:EE (OUI C0-07-E8)
        Count: 1
        Buffers: 0/3
        #269: len 9 (0 Kb/s)
        Latency: 106 msec (41-122 msec ~111 msec)
> ACL Data RX: Handle 723 flags 0x02 dlen 26                                                                       #271 13.049281
      ATT: Find Information Response (0x05) len 21
        Format: UUID-16 (0x01)
        Handle: 0x00e7
        UUID: Incoming Call Target Bearer URI (0x2bbc)
        Handle: 0x00e8
        UUID: Client Characteristic Configuration (0x2902)
        Handle: 0x00e9
        UUID: Characteristic (0x2803)
        Handle: 0x00ea
        UUID: Status Flags (0x2bbb)
        Handle: 0x00eb
        UUID: Client Characteristic Configuration (0x2902)
zephyr.exe[1688909]: < HCI Command: Host Number of Completed Packets (0x03|0x0035) plen 5                          #272 13.061699
        Num handles: 1
        Handle: 723 Address: C0:07:E8:2C:B6:EE (OUI C0-07-E8)
        Count: 1
zephyr.exe[1688909]: < ACL Data TX: Handle 723 [1/3] flags 0x00 dlen 11                                            #273 13.061908
      ATT: Read By Type Request (0x08) len 6
        Handle range: 0x00e7-0x00fc
        Attribute type: Characteristic (0x2803)
> HCI Event: Number of Completed Packets (0x13) plen 5                                                             #274 13.173835
        Num handles: 1
        Handle: 723 Address: C0:07:E8:2C:B6:EE (OUI C0-07-E8)
        Count: 1
        Buffers: 0/3
        #273: len 11 (0 Kb/s)
        Latency: 111 msec (41-122 msec ~111 msec)
> ACL Data RX: Handle 723 flags 0x02 dlen 27                                                                       #275 13.174234
      ATT: Read By Type Response (0x09) len 22
        Attribute data length: 7
        Attribute data list: 3 entries
        Handle: 0x00e9
        Value[5]: 12ea00bb2b
            Properties: 0x12
              Read (0x02)
              Notify (0x10)
            Value Handle: 0x00ea
            Value UUID: Status Flags (0x2bbb)
        Handle: 0x00ec
        Value[5]: 12ed00bd2b
            Properties: 0x12
              Read (0x02)
              Notify (0x10)
            Value Handle: 0x00ed
            Value UUID: Call State (0x2bbd)
        Handle: 0x00ef
        Value[5]: 1cf000be2b
            Properties: 0x1c
              Write Without Response (0x04)
              Write (0x08)
              Notify (0x10)
            Value Handle: 0x00f0
            Value UUID: Call Control Point (0x2bbe)
zephyr.exe[1688909]: < HCI Command: Host Number of Completed Packets (0x03|0x0035) plen 5                          #276 13.191268
        Num handles: 1
        Handle: 723 Address: C0:07:E8:2C:B6:EE (OUI C0-07-E8)
        Count: 1
zephyr.exe[1688909]: < ACL Data TX: Handle 723 [1/3] flags 0x00 dlen 9                                             #277 13.192012
      ATT: Write Request (0x12) len 4
        Handle: 0x00e3
          Data[2]: 0100
> HCI Event: Number of Completed Packets (0x13) plen 5                                                             #278 13.298774
        Num handles: 1
        Handle: 723 Address: C0:07:E8:2C:B6:EE (OUI C0-07-E8)
        Count: 1
        Buffers: 0/3
        #277: len 9 (0 Kb/s)
        Latency: 106 msec (41-122 msec ~109 msec)
> ACL Data RX: Handle 723 flags 0x02 dlen 5                                                                        #279 13.298981
      ATT: Write Response (0x13) len 0
zephyr.exe[1688909]: < HCI Command: Host Number of Completed Packets (0x03|0x0035) plen 5                          #280 13.301876
        Num handles: 1
        Handle: 723 Address: C0:07:E8:2C:B6:EE (OUI C0-07-E8)
        Count: 1
zephyr.exe[1688909]: < ACL Data TX: Handle 723 [1/3] flags 0x00 dlen 9                                             #281 13.302469
      ATT: Write Request (0x12) len 4
        Handle: 0x00e8
          Data[2]: 0100
> HCI Event: Number of Completed Packets (0x13) plen 5                                                             #282 13.423721
        Num handles: 1
        Handle: 723 Address: C0:07:E8:2C:B6:EE (OUI C0-07-E8)
        Count: 1
        Buffers: 0/3
        #281: len 9 (0 Kb/s)
        Latency: 121 msec (41-122 msec ~115 msec)
> ACL Data RX: Handle 723 flags 0x02 dlen 5                                                                        #283 13.423985
      ATT: Write Response (0x13) len 0
zephyr.exe[1688909]: < HCI Command: Host Number of Completed Packets (0x03|0x0035) plen 5                          #284 13.442010
        Num handles: 1
        Handle: 723 Address: C0:07:E8:2C:B6:EE (OUI C0-07-E8)
        Count: 1
zephyr.exe[1688909]: < ACL Data TX: Handle 723 [1/3] flags 0x00 dlen 9                                             #285 13.442688
      ATT: Find Information Request (0x04) len 4
        Handle range: 0x00ea-0x00fc
> HCI Event: Number of Completed Packets (0x13) plen 5                                                             #286 13.548846
        Num handles: 1
        Handle: 723 Address: C0:07:E8:2C:B6:EE (OUI C0-07-E8)
        Count: 1
        Buffers: 0/3
        #285: len 9 (0 Kb/s)
        Latency: 106 msec (41-122 msec ~110 msec)
> ACL Data RX: Handle 723 flags 0x02 dlen 26                                                                       #287 13.549149
      ATT: Find Information Response (0x05) len 21
        Format: UUID-16 (0x01)
        Handle: 0x00ea
        UUID: Status Flags (0x2bbb)
        Handle: 0x00eb
        UUID: Client Characteristic Configuration (0x2902)
        Handle: 0x00ec
        UUID: Characteristic (0x2803)
        Handle: 0x00ed
        UUID: Call State (0x2bbd)
        Handle: 0x00ee
        UUID: Client Characteristic Configuration (0x2902)
zephyr.exe[1688909]: < HCI Command: Host Number of Completed Packets (0x03|0x0035) plen 5                          #288 13.562242
        Num handles: 1
        Handle: 723 Address: C0:07:E8:2C:B6:EE (OUI C0-07-E8)
        Count: 1
zephyr.exe[1688909]: < ACL Data TX: Handle 723 [1/3] flags 0x00 dlen 9                                             #289 13.563433
      ATT: Find Information Request (0x04) len 4
        Handle range: 0x00ed-0x00fc
> HCI Event: Number of Completed Packets (0x13) plen 5                                                             #290 13.673838
        Num handles: 1
        Handle: 723 Address: C0:07:E8:2C:B6:EE (OUI C0-07-E8)
        Count: 1
        Buffers: 0/3
        #289: len 9 (0 Kb/s)
        Latency: 110 msec (41-122 msec ~110 msec)
> ACL Data RX: Handle 723 flags 0x02 dlen 26                                                                       #291 13.674147
      ATT: Find Information Response (0x05) len 21
        Format: UUID-16 (0x01)
        Handle: 0x00ed
        UUID: Call State (0x2bbd)
        Handle: 0x00ee
        UUID: Client Characteristic Configurati