Bluetooth monitor ver 5.72
= Note: Linux version 6.14.0-36-generic (x86_64)                       0.491654
= Note: Bluetooth subsystem version 2.22                               0.491656
= New Index: 00:00:00:00:00:00 (Primary,UART,hci1)              [hci1] 0.491657
= New Index: 48:5F:99:8E:E0:64 (Primary,USB,hci0)               [hci0] 0.491657
= Open Index: 00:00:00:00:00:00                                 [hci1] 1.005594
= Index Info: 00:00:00:00:00:00 (Nordic Semiconductor ASA)      [hci1] 1.005611
@ USER Open: main (privileged) version 2.22            {0x0001} [hci1] 1.005620
< HCI Command: Reset (0x03|0x0003) plen 0                    #1 [hci1] 1.006868
> HCI Event: Command Complete (0x0e) plen 4                  #2 [hci1] 1.007473
      Reset (0x03|0x0003) ncmd 1
        Status: Success (0x00)
< HCI Command: Read Local Supported... (0x04|0x0003) plen 0  #3 [hci1] 1.025470
> HCI Event: Command Complete (0x0e) plen 12                 #4 [hci1] 1.025991
      Read Local Supported Features (0x04|0x0003) ncmd 1
        Status: Success (0x00)
        Features: 0x00 0x00 0x00 0x00 0x60 0x00 0x00 0x00
          BR/EDR Not Supported
          LE Supported (Controller)
< HCI Command: Read Local Version In.. (0x04|0x0001) plen 0  #5 [hci1] 1.045095
> HCI Event: Command Complete (0x0e) plen 12                 #6 [hci1] 1.045626
      Read Local Version Information (0x04|0x0001) ncmd 1
        Status: Success (0x00)
        HCI version: Reserved (0x0f) - Revision 12393 (0x3069)
        LMP version: Reserved (0x0f) - Subversion 12393 (0x3069)
        Manufacturer: Nordic Semiconductor ASA (89)
< HCI Command: Read Local Supported... (0x04|0x0002) plen 0  #7 [hci1] 1.065035
> HCI Event: Command Complete (0x0e) plen 68                 #8 [hci1] 1.066104
      Read Local Supported Commands (0x04|0x0002) ncmd 1
        Status: Success (0x00)
        Commands: 119 entries
          Disconnect (Octet 0 - Bit 5)
          Read Remote Version Information (Octet 2 - Bit 7)
          Set Event Mask (Octet 5 - Bit 6)
          Reset (Octet 5 - Bit 7)
          Read Connection Accept Timeout (Octet 7 - Bit 2)
          Write Connection Accept Timeout (Octet 7 - Bit 3)
          Read Transmit Power Level (Octet 10 - Bit 2)
          Set Controller To Host Flow Control (Octet 10 - Bit 5)
          Host Buffer Size (Octet 10 - Bit 6)
          Host Number of Completed Packets (Octet 10 - Bit 7)
          Read Local Version Information (Octet 14 - Bit 3)
          Read Local Supported Features (Octet 14 - Bit 5)
          Read BD ADDR (Octet 15 - Bit 1)
          Read RSSI (Octet 15 - Bit 5)
          Set Event Mask Page 2 (Octet 22 - Bit 2)
          LE Set Event Mask (Octet 25 - Bit 0)
          LE Read Buffer Size (Octet 25 - Bit 1)
          LE Read Local Supported Features (Octet 25 - Bit 2)
          LE Set Random Address (Octet 25 - Bit 4)
          LE Set Advertising Parameters (Octet 25 - Bit 5)
          LE Read Advertising Channel TX Power (Octet 25 - Bit 6)
          LE Set Advertising Data (Octet 25 - Bit 7)
          LE Set Scan Response Data (Octet 26 - Bit 0)
          LE Set Advertise Enable (Octet 26 - Bit 1)
          LE Set Scan Parameters (Octet 26 - Bit 2)
          LE Set Scan Enable (Octet 26 - Bit 3)
          LE Create Connection (Octet 26 - Bit 4)
          LE Create Connection Cancel (Octet 26 - Bit 5)
          LE Read Accept List Size (Octet 26 - Bit 6)
          LE Clear Accept List (Octet 26 - Bit 7)
          LE Add Device To Accept List (Octet 27 - Bit 0)
          LE Remove Device From Accept List (Octet 27 - Bit 1)
          LE Connection Update (Octet 27 - Bit 2)
          LE Set Host Channel Classification (Octet 27 - Bit 3)
          LE Read Channel Map (Octet 27 - Bit 4)
          LE Read Remote Used Features (Octet 27 - Bit 5)
          LE Encrypt (Octet 27 - Bit 6)
          LE Rand (Octet 27 - Bit 7)
          LE Start Encryption (Octet 28 - Bit 0)
          LE Long Term Key Request Reply (Octet 28 - Bit 1)
          LE Long Term Key Request Neg Reply (Octet 28 - Bit 2)
          LE Read Supported States (Octet 28 - Bit 3)
          LE Receiver Test (Octet 28 - Bit 4)
          LE Transmitter Test (Octet 28 - Bit 5)
          LE Test End (Octet 28 - Bit 6)
          Read Authenticated Payload Timeout (Octet 32 - Bit 4)
          Write Authenticated Payload Timeout (Octet 32 - Bit 5)
          LE Set Data Length (Octet 33 - Bit 6)
          LE Read Suggested Default Data Length (Octet 33 - Bit 7)
          LE Write Suggested Default Data Length (Octet 34 - Bit 0)
          LE Add Device To Resolving List (Octet 34 - Bit 3)
          LE Remove Device From Resolving List (Octet 34 - Bit 4)
          LE Clear Resolving List (Octet 34 - Bit 5)
          LE Read Resolving List Size (Octet 34 - Bit 6)
          LE Set Address Resolution Enable (Octet 35 - Bit 1)
          LE Set Resolvable Private Address Timeout (Octet 35 - Bit 2)
          LE Read Maximum Data Length (Octet 35 - Bit 3)
          LE Read PHY (Octet 35 - Bit 4)
          LE Set Default PHY (Octet 35 - Bit 5)
          LE Set PHY (Octet 35 - Bit 6)
          LE Enhanced Receiver Test (Octet 35 - Bit 7)
          LE Enhanced Transmitter Test (Octet 36 - Bit 0)
          LE Set Advertising Set Random Address (Octet 36 - Bit 1)
          LE Set Extended Advertising Parameters (Octet 36 - Bit 2)
          LE Set Extended Advertising Data (Octet 36 - Bit 3)
          LE Set Extended Scan Response Data (Octet 36 - Bit 4)
          LE Set Extended Advertising Enable (Octet 36 - Bit 5)
          LE Read Maximum Advertising Data Length (Octet 36 - Bit 6)
          LE Read Number of Supported Advertising Sets (Octet 36 - Bit 7)
          LE Remove Advertising Set (Octet 37 - Bit 0)
          LE Clear Advertising Sets (Octet 37 - Bit 1)
          LE Set Periodic Advertising Parameters (Octet 37 - Bit 2)
          LE Set Periodic Advertising Data (Octet 37 - Bit 3)
          LE Set Periodic Advertising Enable (Octet 37 - Bit 4)
          LE Set Extended Scan Parameters (Octet 37 - Bit 5)
          LE Set Extended Scan Enable (Octet 37 - Bit 6)
          LE Extended Create Connection (Octet 37 - Bit 7)
          LE Periodic Advertising Create Sync (Octet 38 - Bit 0)
          LE Periodic Advertising Create Sync Cancel (Octet 38 - Bit 1)
          LE Periodic Advertising Terminate Sync (Octet 38 - Bit 2)
          LE Add Device To Periodic Advertiser List (Octet 38 - Bit 3)
          LE Remove Device From Periodic Advertiser List (Octet 38 - Bit 4)
          LE Clear Periodic Advertiser List (Octet 38 - Bit 5)
          LE Read Periodic Advertiser List Size (Octet 38 - Bit 6)
          LE Read Transmit Power (Octet 38 - Bit 7)
          LE Read RF Path Compensation (Octet 39 - Bit 0)
          LE Write RF Path Compensation (Octet 39 - Bit 1)
          LE Set Privacy Mode (Octet 39 - Bit 2)
          LE Periodic Advertising Receive Enable (Octet 40 - Bit 5)
          LE Periodic Advertising Sync Transfer (Octet 40 - Bit 6)
          LE Periodic Advertising Set Info Transfer (Octet 40 - Bit 7)
          LE Periodic Advertising Sync Transfer Parameters (Octet 41 - Bit 0)
          LE Set Default Periodic Advertisng Sync Transfer Parameters (Octet 41 - Bit 1)
          LE Read Buffer v2 (Octet 41 - Bit 5)
          LE Read ISO TX Sync (Octet 41 - Bit 6)
          LE Set Connected Isochronous Group Parameters (Octet 41 - Bit 7)
          LE Set Connected Isochronous Group Parameters Test (Octet 42 - Bit 0)
          LE Create Connected Isochronous Stream (Octet 42 - Bit 1)
          LE Remove Connected Isochronous Group (Octet 42 - Bit 2)
          LE Accept Connected Isochronous Stream Request (Octet 42 - Bit 3)
          LE Reject Connected Isochronous Stream Request (Octet 42 - Bit 4)
          LE Create Broadcast Isochronous Group (Octet 42 - Bit 5)
          LE Create Broadcast Isochronous Group Test (Octet 42 - Bit 6)
          LE Terminate Broadcast Isochronous Group (Octet 42 - Bit 7)
          LE Broadcast Isochronous Group Create Sync (Octet 43 - Bit 0)
          LE Broadcast Isochronous Group Terminate Sync (Octet 43 - Bit 1)
          LE Request Peer SCA (Octet 43 - Bit 2)
          LE Setup Isochronous Data Path (Octet 43 - Bit 3)
          LE Remove Isochronous Data Path (Octet 43 - Bit 4)
          LE Isochronous Transmit Test (Octet 43 - Bit 5)
          LE Isochronous Receive Test (Octet 43 - Bit 6)
          LE Isochronous Read Test Counters (Octet 43 - Bit 7)
          LE Isochronous Read Test Counters (Octet 44 - Bit 0)
          LE Set Host Feature (Octet 44 - Bit 1)
          Octet 44 - Bit 2 
          Octet 45 - Bit 6 
          Octet 46 - Bit 0 
          Octet 46 - Bit 1 
          Octet 46 - Bit 2 
< HCI Command: Host Buffer Size (0x03|0x0033) plen 7         #9 [hci1] 1.085026
        ACL MTU: 255  ACL max packet: 16
        SCO MTU: 0    SCO max packet: 0
> HCI Event: Command Complete (0x0e) plen 4                 #10 [hci1] 1.085584
      Host Buffer Size (0x03|0x0033) ncmd 1
        Status: Success (0x00)
< HCI Command: Set Controller To Ho.. (0x03|0x0031) plen 1  #11 [hci1] 1.105036
        Flow control: ACL Data Packets (0x01)
> HCI Event: Command Complete (0x0e) plen 4                 #12 [hci1] 1.105522
      Set Controller To Host Flow Control (0x03|0x0031) ncmd 1
        Status: Success (0x00)
< HCI Command: LE Read Local Suppor.. (0x08|0x0003) plen 0  #13 [hci1] 1.125029
> HCI Event: Command Complete (0x0e) plen 12                #14 [hci1] 1.125508
      LE Read Local Supported Features (0x08|0x0003) ncmd 1
        Status: Success (0x00)
        Features: 0xfd 0x79 0x00 0xf7 0x30 0x01 0x00 0x00
          LE Encryption
          Extended Reject Indication
          Peripheral-initiated Features Exchange
          LE Ping
          LE Data Packet Length Extension
          LL Privacy
          Extended Scanner Filter Policies
          LE 2M PHY
          LE Coded PHY
          LE Extended Advertising
          LE Periodic Advertising
          Channel Selection Algorithm #2
          Periodic Advertising Sync Transfer - Sender
          Periodic Advertising Sync Transfer - Recipient
          Sleep Clock Accuracy Updates
          Connected Isochronous Stream - Central
          Connected Isochronous Stream - Peripheral
          Isochronous Broadcaster
          Synchronized Receiver
          Periodic Advertising ADI support
          Connection Subrating
          Unknown features (0x0000010000000000)
< HCI Command: LE Set Host Feature (0x08|0x0074) plen 2     #15 [hci1] 1.145040
        Bit Number: 32
          Connected Isochronous Stream (Host Support)
        Bit Value: 1
> HCI Event: Command Complete (0x0e) plen 4                 #16 [hci1] 1.145485
      LE Set Host Feature (0x08|0x0074) ncmd 1
        Status: Success (0x00)
< HCI Command: LE Read Buffer v2 (0x08|0x0060) plen 0       #17 [hci1] 1.165025
> HCI Event: Command Complete (0x0e) plen 10                #18 [hci1] 1.165481
      LE Read Buffer v2 (0x08|0x0060) ncmd 1
        Status: Success (0x00)
        ACL MTU: 27
        ACL max packet: 3
        ISO MTU: 318
        ISO max packet: 3
< HCI Command: LE Read Maximum Adve.. (0x08|0x003a) plen 0  #19 [hci1] 1.185055
> HCI Event: Command Complete (0x0e) plen 6                 #20 [hci1] 1.185506
      LE Read Maximum Advertising Data Length (0x08|0x003a) ncmd 1
        Status: Success (0x00)
        Max length: 1650
< HCI Command: LE Read Supported St.. (0x08|0x001c) plen 0  #21 [hci1] 1.205102
> HCI Event: Command Complete (0x0e) plen 12                #22 [hci1] 1.205674
      LE Read Supported States (0x08|0x001c) ncmd 1
        Status: Success (0x00)
        States: 0x000003ff3e0306ff
          Non-connectable Advertising State
          Scannable Advertising State
          Connectable Advertising State
          High Duty Cycle Directed Advertising State
          Passive Scanning State
          Active Scanning State
          Initiating State
            and Connection State (Central Role)
          Connection State (Peripheral Role)
          Scannable Advertising State
            and Passive Scanning State
          Connectable Advertising State
            and Passive Scanning State
          Non-connectable Advertising State
            and Initiating State
          Scannable Advertising State
            and Initiating State
          Active Scanning State
            and Connection State (Central Role)
          Passive Scanning State
            and Connection State (Peripheral Role)
          Active Scanning State
            and Connection State (Peripheral Role)
          Initiating State
            and Connection State (Central Role)
            and Central Role & Central Role
          Low Duty Cycle Directed Advertising State
          Connectable Advertising State
            and Initiating State
            and Central Role & Peripheral Role
          High Duty Cycle Directed Advertising State
            and Initiating State
            and Central Role & Peripheral Role
          Low Duty Cycle Directed Advertising State
            and Initiating State
            and Central Role & Peripheral Role
          Connectable Advertising State
            and Connection State (Central Role)
            and Central Role & Peripheral Role
          High Duty Cycle Directed Advertising State
            and Connection State (Central Role)
            and Central Role & Peripheral Role
          Low Duty Cycle Directed Advertising State
            and Connection State (Central Role)
            and Central Role & Peripheral Role
          Connectable Advertising State
            and Connection State (Peripheral Role)
            and Central Role & Peripheral Role
          High Duty Cycle Directed Advertising State
            and Connection State (Peripheral Role)
            and Peripheral Role & Peripheral Role
          Low Duty Cycle Directed Advertising State
            and Connection State (Peripheral Role)
            and Peripheral Role & Peripheral Role
          Initiating State
            and Connection State (Peripheral Role)
            and Central Role & Peripheral Role
< HCI Command: LE Read Maximum Data.. (0x08|0x002f) plen 0  #23 [hci1] 1.225019
> HCI Event: Command Complete (0x0e) plen 12                #24 [hci1] 1.225511
      LE Read Maximum Data Length (0x08|0x002f) ncmd 1
        Status: Success (0x00)
        Max TX octets: 251
        Max TX time: 2704
        Max RX octets: 251
        Max RX time: 2704
< HCI Command: LE Write Suggested D.. (0x08|0x0024) plen 4  #25 [hci1] 1.245036
        TX octets: 251
        TX time: 2704
> HCI Event: Command Complete (0x0e) plen 4                 #26 [hci1] 1.245491
      LE Write Suggested Default Data Length (0x08|0x0024) ncmd 1
        Status: Success (0x00)
< HCI Command: LE Read Resolving Li.. (0x08|0x002a) plen 0  #27 [hci1] 1.265041
> HCI Event: Command Complete (0x0e) plen 5                 #28 [hci1] 1.265500
      LE Read Resolving List Size (0x08|0x002a) ncmd 1
        Status: Success (0x00)
        Size: 8
< HCI Command: LE Set Event Mask (0x08|0x0001) plen 8       #29 [hci1] 1.285021
        Mask: 0x000002023f87fa5e
          LE Advertising Report
          LE Connection Update Complete
          LE Read Remote Used Features Complete
          LE Long Term Key Request
          LE Data Length Change
          LE Enhanced Connection Complete
          LE PHY Update Complete
          LE Extended Advertising Report
          LE Periodic Advertising Sync Established
          LE Periodic Advertising Report
          LE Periodic Advertising Sync Lost
          LE Extended Scan Timeout
          LE Extended Advertising Set Terminated
          LE Scan Request Received
          LE Periodic Advertising Sync Transfer Rvc
          LE CIS Established
          LE CIS Request
          LE Create BIG Complete
          LE Terminate BIG Complete
          LE BIG Sync Estabilished Complete
          LE BIG Sync Lost
          LE BIG Info Advertising Report
          Unknown mask (0x0000020000000000)
> HCI Event: Command Complete (0x0e) plen 4                 #30 [hci1] 1.285621
      LE Set Event Mask (0x08|0x0001) ncmd 1
        Status: Success (0x00)
< HCI Command: Set Event Mask (0x03|0x0001) plen 8          #31 [hci1] 1.305039
        Mask: 0x2000800002008890
          Disconnection Complete
          Encryption Change
          Read Remote Version Information Complete
          Hardware Error
          Data Buffer Overflow
          Encryption Key Refresh Complete
          LE Meta
> HCI Event: Command Complete (0x0e) plen 4                 #32 [hci1] 1.305577
      Set Event Mask (0x03|0x0001) ncmd 1
        Status: Success (0x00)
< HCI Command: Read BD ADDR (0x04|0x0009) plen 0            #33 [hci1] 1.325027
> HCI Event: Command Complete (0x0e) plen 10                #34 [hci1] 1.325511
      Read BD ADDR (0x04|0x0009) ncmd 1
        Status: Success (0x00)
        Address: 00:00:00:00:00:00 (OUI 00-00-00)
< HCI Command: LE Set Random Address (0x08|0x0005) plen 6   #35 [hci1] 1.345039
        Address: D5:B6:CC:31:DB:3B (Static)
> HCI Event: Command Complete (0x0e) plen 4                 #36 [hci1] 1.345578
      LE Set Random Address (0x08|0x0005) ncmd 1
        Status: Success (0x00)
< HCI Command: LE Set Extended Adv.. (0x08|0x0036) plen 25  #37 [hci1] 6.775096
        Handle: 0x00
        Properties: 0x0013
          Connectable
          Scannable
          Use legacy advertising PDUs: ADV_IND
        Min advertising interval: 100.000 msec (0x00a0)
        Max advertising interval: 150.000 msec (0x00f0)
        Channel map: 37, 38, 39 (0x07)
        Own address type: Random (0x01)
        Peer address type: Public (0x00)
        Peer address: 00:00:00:00:00:00 (OUI 00-00-00)
        Filter policy: Allow Scan Request from Any, Allow Connect Request from Any (0x00)
        TX power: Host has no preference (0x7f)
        Primary PHY: LE 1M (0x01)
        Secondary max skip: 0x00
        Secondary PHY: LE 1M (0x01)
        SID: 0x00
        Scan request notifications: Disabled (0x00)
> HCI Event: Command Complete (0x0e) plen 5                 #38 [hci1] 6.775860
      LE Set Extended Advertising Parameters (0x08|0x0036) ncmd 1
        Status: Success (0x00)
        TX power (selected): 0 dbm (0x00)
< HCI Command: LE Set Advertising S.. (0x08|0x0035) plen 7  #39 [hci1] 6.785096
        Advertising handle: 0x00
        Advertising random address: D5:B6:CC:31:DB:3B (Static)
> HCI Event: Command Complete (0x0e) plen 4                 #40 [hci1] 6.785593
      LE Set Advertising Set Random Address (0x08|0x0035) ncmd 1
        Status: Success (0x00)
< HCI Command: LE Set Extended Adv.. (0x08|0x0037) plen 22  #41 [hci1] 6.805085
        Handle: 0x00
        Operation: Complete extended advertising data (0x03)
        Fragment preference: Minimize fragmentation (0x01)
        Data length: 0x12
        Flags: 0x06
          LE General Discoverable Mode
          BR/EDR Not Supported
        Name (complete): Tester_F6B11A
> HCI Event: Command Complete (0x0e) plen 4                 #42 [hci1] 6.805811
      LE Set Extended Advertising Data (0x08|0x0037) ncmd 1
        Status: Success (0x00)
< HCI Command: LE Set Extended Scan.. (0x08|0x0038) plen 4  #43 [hci1] 6.825080
        Handle: 0x00
        Operation: Complete scan response data (0x03)
        Fragment preference: Minimize fragmentation (0x01)
        Data length: 0x00
> HCI Event: Command Complete (0x0e) plen 4                 #44 [hci1] 6.825605
      LE Set Extended Scan Response Data (0x08|0x0038) ncmd 1
        Status: Success (0x00)
< HCI Command: LE Set Extended Adve.. (0x08|0x0039) plen 6  #45 [hci1] 6.845092
        Extended advertising: Enabled (0x01)
        Number of sets: 1 (0x01)
        Entry 0
          Handle: 0x00
          Duration: 0 ms (0x00)
          Max ext adv events: 0
> HCI Event: Command Complete (0x0e) plen 4                 #46 [hci1] 6.845797
      LE Set Extended Advertising Enable (0x08|0x0039) ncmd 1
        Status: Success (0x00)
> HCI Event: LE Meta Event (0x3e) plen 31                   #47 [hci1] 6.963949
      LE Enhanced Connection Complete (0x0a)
        Status: Success (0x00)
        Handle: 3
        Role: Peripheral (0x01)
        Peer address type: Public (0x00)
        Peer address: DF:A9:FF:F6:B1:1A (OUI DF-A9-FF)
        Local resolvable private address: 00:00:00:00:00:00 (Non-Resolvable)
        Peer resolvable private address: 00:00:00:00:00:00 (Non-Resolvable)
        Connection interval: 87.50 msec (0x0046)
        Connection latency: 0 (0x0000)
        Supervision timeout: 25120 msec (0x09d0)
        Central clock accuracy: 0x01
> HCI Event: LE Meta Event (0x3e) plen 6                    #48 [hci1] 6.964092
      LE Advertising Set Terminated (0x12)
        Status: Success (0x00)
        Handle: 0
        Connection handle: 3
        Number of completed extended advertising events: 0
< HCI Command: LE Read Remote Used... (0x08|0x0016) plen 2  #49 [hci1] 6.966129
        Handle: 3 Address: DF:A9:FF:F6:B1:1A (OUI DF-A9-FF)
< ACL Data TX: Handle 3 flags 0x00 dlen 7                   #50 [hci1] 6.966336
      ATT: Exchange MTU Request (0x02) len 2
        Client RX MTU: 251
> HCI Event: Command Status (0x0f) plen 4                   #51 [hci1] 6.966613
      LE Read Remote Used Features (0x08|0x0016) ncmd 1
        Status: Success (0x00)
> HCI Event: Number of Completed Packets (0x13) plen 5      #52 [hci1] 7.139949
        Num handles: 1
        Handle: 3 Address: DF:A9:FF:F6:B1:1A (OUI DF-A9-FF)
        Count: 1
        #50: len 7 (0 Kb/s)
        Latency: 173 msec (173-173 msec ~173 msec)
> HCI Event: LE Meta Event (0x3e) plen 12                   #53 [hci1] 7.227920
      LE Read Remote Used Features (0x04)
        Status: Success (0x00)
        Handle: 3 Address: DF:A9:FF:F6:B1:1A (OUI DF-A9-FF)
        Features: 0x2d 0x49 0x00 0xf7 0x67 0xd8 0x00 0x00
          LE Encryption
          Extended Reject Indication
          Peripheral-initiated Features Exchange
          LE Data Packet Length Extension
          LE 2M PHY
          LE Coded PHY
          Channel Selection Algorithm #2
          Periodic Advertising Sync Transfer - Sender
          Periodic Advertising Sync Transfer - Recipient
          Sleep Clock Accuracy Updates
          Connected Isochronous Stream - Central
          Connected Isochronous Stream - Peripheral
          Isochronous Broadcaster
          Synchronized Receiver
          Connected Isochronous Stream (Host Support)
          LE Power Control Request
          LE Power Control Request
          Connection Subrating
          Connection Subrating (Host Support)
          Unknown features (0x0000d80000000000)
> ACL Data RX: Handle 3 flags 0x02 dlen 11                  #54 [hci1] 9.677538
      SMP: Pairing Request (0x01) len 6
        IO capability: KeyboardDisplay (0x04)
        OOB data: Authentication data not present (0x00)
        Authentication requirement: Bonding, MITM, SC, No Keypresses (0x0d)
        Max encryption key size: 16
        Initiator key distribution: EncKey IdKey (0x03)
        Responder key distribution: EncKey IdKey Sign (0x07)
< HCI Command: Host Number of Compl.. (0x03|0x0035) plen 5  #55 [hci1] 9.685745
        Num handles: 1
        Handle: 3 Address: DF:A9:FF:F6:B1:1A (OUI DF-A9-FF)
        Count: 1
< ACL Data TX: Handle 3 flags 0x00 dlen 11                  #56 [hci1] 9.685961
      SMP: Pairing Response (0x02) len 6
        IO capability: DisplayOnly (0x00)
        OOB data: Authentication data not present (0x00)
        Authentication requirement: Bonding, No MITM, SC, No Keypresses (0x09)
        Max encryption key size: 16
        Initiator key distribution: IdKey (0x02)
        Responder key distribution: <none> (0x00)
> ACL Data RX: Handle 3 flags 0x02 dlen 7                   #57 [hci1] 9.764982
      ATT: Exchange MTU Response (0x03) len 2
        Server RX MTU: 23
< HCI Command: Host Number of Compl.. (0x03|0x0035) plen 5  #58 [hci1] 9.765309
        Num handles: 1
        Handle: 3 Address: DF:A9:FF:F6:B1:1A (OUI DF-A9-FF)
        Count: 1
> HCI Event: Number of Completed Packets (0x13) plen 5      #59 [hci1] 9.852763
        Num handles: 1
        Handle: 3 Address: DF:A9:FF:F6:B1:1A (OUI DF-A9-FF)
        Count: 1
        #56: len 11 (0 Kb/s)
        Latency: 166 msec (166-173 msec ~170 msec)
> ACL Data RX: Handle 3 flags 0x02 dlen 27                  #60 [hci1] 9.852965
> ACL Data RX: Handle 3 flags 0x01 dlen 27                  #61 [hci1] 9.853547
> ACL Data RX: Handle 3 flags 0x01 dlen 15                  #62 [hci1] 9.853898
      SMP: Pairing Public Key (0x0c) len 64
        X: b777d9c723878bc49cdf2c2c9e2903a4b03cf1431404a824fb2278ff2fbb969e
        Y: bb572831929b9d8034755a04f15f1b17dd5c1ba498821d230bf3dbfc0c971539
< HCI Command: Host Number of Compl.. (0x03|0x0035) plen 5  #63 [hci1] 9.866159
        Num handles: 1
        Handle: 3 Address: DF:A9:FF:F6:B1:1A (OUI DF-A9-FF)
        Count: 1
< HCI Command: Host Number of Compl.. (0x03|0x0035) plen 5  #64 [hci1] 9.866460
        Num handles: 1
        Handle: 3 Address: DF:A9:FF:F6:B1:1A (OUI DF-A9-FF)
        Count: 1
< HCI Command: Host Number of Compl.. (0x03|0x0035) plen 5  #65 [hci1] 9.866900
        Num handles: 1
        Handle: 3 Address: DF:A9:FF:F6:B1:1A (OUI DF-A9-FF)
        Count: 1
< ACL Data TX: Handle 3 flags 0x00 dlen 27                  #66 [hci1] 9.867157
< ACL Data TX: Handle 3 flags 0x01 dlen 27                  #67 [hci1] 9.867166
< ACL Data TX: Handle 3 flags 0x01 dlen 15                  #68 [hci1] 9.867253
      SMP: Pairing Public Key (0x0c) len 64
        X: 98308440221e2d910f0e54b71e7ec652857aa9b5a0dc65028824cc19db1226e9
        Y: 67a4816bcb62efb21701e31fdb27561a6217575fb007a8bbdabe7e28b6f68482
> HCI Event: Number of Completed Packets (0x13) plen 5      #69 [hci1] 9.940537
        Num handles: 1
        Handle: 3 Address: DF:A9:FF:F6:B1:1A (OUI DF-A9-FF)
        Count: 1
        #66: len 27 (2 Kb/s)
        Latency: 73 msec (73-173 msec ~121 msec)
> HCI Event: Number of Completed Packets (0x13) plen 5      #70 [hci1] 9.941162
        Num handles: 1
        Handle: 3 Address: DF:A9:FF:F6:B1:1A (OUI DF-A9-FF)
        Count: 1
        #67: len 27 (2 Kb/s)
        Latency: 73 msec (73-173 msec ~97 msec)
> HCI Event: Number of Completed Packets (0x13) plen 5     #71 [hci1] 10.027475
        Num handles: 1
        Handle: 3 Address: DF:A9:FF:F6:B1:1A (OUI DF-A9-FF)
        Count: 1
        #68: len 15 (0 Kb/s)
        Latency: 160 msec (73-173 msec ~129 msec)
> ACL Data RX: Handle 3 flags 0x02 dlen 21                 #72 [hci1] 10.990105
      SMP: Pairing Confirm (0x03) len 16
        Confim value: 8f3ac2d8792ddbd32b6285f21648bfa6
< HCI Command: Host Number of Comp.. (0x03|0x0035) plen 5  #73 [hci1] 11.005627
        Num handles: 1
        Handle: 3 Address: DF:A9:FF:F6:B1:1A (OUI DF-A9-FF)
        Count: 1
< ACL Data TX: Handle 3 flags 0x00 dlen 21                 #74 [hci1] 11.005775
      SMP: Pairing Confirm (0x03) len 16
        Confim value: 5271db5629f2ff7e0207849003d5ee74
> HCI Event: Number of Completed Packets (0x13) plen 5     #75 [hci1] 11.165011
        Num handles: 1
        Handle: 3 Address: DF:A9:FF:F6:B1:1A (OUI DF-A9-FF)
        Count: 1
        #74: len 21 (1 Kb/s)
        Latency: 159 msec (73-173 msec ~144 msec)
> ACL Data RX: Handle 3 flags 0x02 dlen 21                 #76 [hci1] 11.165340
      SMP: Pairing Random (0x04) len 16
        Random value: 8ee546c9ef3fed140000000000000000
< HCI Command: Host Number of Comp.. (0x03|0x0035) plen 5  #77 [hci1] 11.185836
        Num handles: 1
        Handle: 3 Address: DF:A9:FF:F6:B1:1A (OUI DF-A9-FF)
        Count: 1
< ACL Data TX: Handle 3 flags 0x00 dlen 21                 #78 [hci1] 11.186089
      SMP: Pairing Random (0x04) len 16
        Random value: 8e6108f966a694cbe26df70bb96773e6
> HCI Event: Number of Completed Packets (0x13) plen 5     #79 [hci1] 11.339857
        Num handles: 1
        Handle: 3 Address: DF:A9:FF:F6:B1:1A (OUI DF-A9-FF)
        Count: 1
        #78: len 21 (1 Kb/s)
        Latency: 153 msec (73-173 msec ~148 msec)
> ACL Data RX: Handle 3 flags 0x02 dlen 21                 #80 [hci1] 11.427732
      SMP: Pairing Confirm (0x03) len 16
        Confim value: 4de71ef1f763ac146fbd34ef116694c3
< HCI Command: Host Number of Comp.. (0x03|0x0035) plen 5  #81 [hci1] 11.445771
        Num handles: 1
        Handle: 3 Address: DF:A9:FF:F6:B1:1A (OUI DF-A9-FF)
        Count: 1
< ACL Data TX: Handle 3 flags 0x00 dlen 21                 #82 [hci1] 11.445952
      SMP: Pairing Confirm (0x03) len 16
        Confim value: 9cd7a471a90030a9696b021fb7af2b60
> HCI Event: Number of Completed Packets (0x13) plen 5     #83 [hci1] 11.602566
        Num handles: 1
        Handle: 3 Address: DF:A9:FF:F6:B1:1A (OUI DF-A9-FF)
        Count: 1
        #82: len 21 (1 Kb/s)
        Latency: 156 msec (73-173 msec ~152 msec)
> ACL Data RX: Handle 3 flags 0x02 dlen 21                 #84 [hci1] 11.602841
      SMP: Pairing Random (0x04) len 16
        Random value: e984a42d77b2cdfa0000000000000000
< HCI Command: Host Number of Comp.. (0x03|0x0035) plen 5  #85 [hci1] 11.605749
        Num handles: 1
        Handle: 3 Address: DF:A9:FF:F6:B1:1A (OUI DF-A9-FF)
        Count: 1
< ACL Data TX: Handle 3 flags 0x00 dlen 21                 #86 [hci1] 11.605867
      SMP: Pairing Random (0x04) len 16
        Random value: 4d02679f89a05211af56d8b3da64d21e
> HCI Event: Number of Completed Packets (0x13) plen 5     #87 [hci1] 11.777330
        Num handles: 1
        Handle: 3 Address: DF:A9:FF:F6:B1:1A (OUI DF-A9-FF)
        Count: 1
        #86: len 21 (0 Kb/s)
        Latency: 171 msec (73-173 msec ~162 msec)
> ACL Data RX: Handle 3 flags 0x02 dlen 21                 #88 [hci1] 11.865139
      SMP: Pairing Confirm (0x03) len 16
        Confim value: 918953afbbf41da44c7f1acbffe4c5ef
< HCI Command: Host Number of Comp.. (0x03|0x0035) plen 5  #89 [hci1] 11.885725
        Num handles: 1
        Handle: 3 Address: DF:A9:FF:F6:B1:1A (OUI DF-A9-FF)
        Count: 1
< ACL Data TX: Handle 3 flags 0x00 dlen 21                 #90 [hci1] 11.885912
      SMP: Pairing Confirm (0x03) len 16
        Confim value: c27decfdea193006316cc29d42017716
> HCI Event: Number of Completed Packets (0x13) plen 5     #91 [hci1] 12.040055
        Num handles: 1
        Handle: 3 Address: DF:A9:FF:F6:B1:1A (OUI DF-A9-FF)
        Count: 1
        #90: len 21 (1 Kb/s)
        Latency: 154 msec (73-173 msec ~158 msec)
> ACL Data RX: Handle 3 flags 0x02 dlen 21                 #92 [hci1] 12.040359
      SMP: Pairing Random (0x04) len 16
        Random value: 8aaf7d76b6fda7d40000000000000000
< HCI Command: Host Number of Comp.. (0x03|0x0035) plen 5  #93 [hci1] 12.046045
        Num handles: 1
        Handle: 3 Address: DF:A9:FF:F6:B1:1A (OUI DF-A9-FF)
        Count: 1
< ACL Data TX: Handle 3 flags 0x00 dlen 21                 #94 [hci1] 12.046131
      SMP: Pairing Random (0x04) len 16
        Random value: 5e8286bc235a02440d0c3424a2acf8fd
> HCI Event: Number of Completed Packets (0x13) plen 5     #95 [hci1] 12.214775
        Num handles: 1
        Handle: 3 Address: DF:A9:FF:F6:B1:1A (OUI DF-A9-FF)
        Count: 1
        #94: len 21 (1 Kb/s)
        Latency: 168 msec (73-173 msec ~163 msec)
> ACL Data RX: Handle 3 flags 0x02 dlen 21                 #96 [hci1] 12.302653
      SMP: Pairing Confirm (0x03) len 16
        Confim value: def119d958555d9448ad168062a6410b
< HCI Command: Host Number of Comp.. (0x03|0x0035) plen 5  #97 [hci1] 12.305503
        Num handles: 1
        Handle: 3 Address: DF:A9:FF:F6:B1:1A (OUI DF-A9-FF)
        Count: 1
< ACL Data TX: Handle 3 flags 0x00 dlen 21                 #98 [hci1] 12.305658
      SMP: Pairing Confirm (0x03) len 16
        Confim value: d62e70f5fc47af794d0cc3d5b720ccee
> HCI Event: Number of Completed Packets (0x13) plen 5     #99 [hci1] 12.477613
        Num handles: 1
        Handle: 3 Address: DF:A9:FF:F6:B1:1A (OUI DF-A9-FF)
        Count: 1
        #98: len 21 (0 Kb/s)
        Latency: 171 msec (73-173 msec ~167 msec)
> ACL Data RX: Handle 3 flags 0x02 dlen 21                #100 [hci1] 12.477953
      SMP: Pairing Random (0x04) len 16
        Random value: cfe87fd8949ccfc50000000000000000
< HCI Command: Host Number of Com.. (0x03|0x0035) plen 5  #101 [hci1] 12.486068
        Num handles: 1
        Handle: 3 Address: DF:A9:FF:F6:B1:1A (OUI DF-A9-FF)
        Count: 1
< ACL Data TX: Handle 3 flags 0x00 dlen 21                #102 [hci1] 12.486155
      SMP: Pairing Random (0x04) len 16
        Random value: 5c4a1bcadd27bd58e945097b00bad7ac
> HCI Event: Number of Completed Packets (0x13) plen 5    #103 [hci1] 12.652401
        Num handles: 1
        Handle: 3 Address: DF:A9:FF:F6:B1:1A (OUI DF-A9-FF)
        Count: 1
        #102: len 21 (1 Kb/s)
        Latency: 166 msec (73-173 msec ~166 msec)
> ACL Data RX: Handle 3 flags 0x02 dlen 21                #104 [hci1] 12.740168
      SMP: Pairing Confirm (0x03) len 16
        Confim value: 1f02628efa7b0d3db901970a8e4ff55f
< HCI Command: Host Number of Com.. (0x03|0x0035) plen 5  #105 [hci1] 12.745802
        Num handles: 1
        Handle: 3 Address: DF:A9:FF:F6:B1:1A (OUI DF-A9-FF)
        Count: 1
< ACL Data TX: Handle 3 flags 0x00 dlen 21                #106 [hci1] 12.746070
      SMP: Pairing Confirm (0x03) len 16
        Confim value: 66cf65d0512e5d6b917671c09610371d
> HCI Event: Number of Completed Packets (0x13) plen 5    #107 [hci1] 12.914953
        Num handles: 1
        Handle: 3 Address: DF:A9:FF:F6:B1:1A (OUI DF-A9-FF)
        Count: 1
        #106: len 21 (1 Kb/s)
        Latency: 168 msec (73-173 msec ~167 msec)
> ACL Data RX: Handle 3 flags 0x02 dlen 21                #108 [hci1] 12.915271
      SMP: Pairing Random (0x04) len 16
        Random value: bc0c87626355aa770000000000000000
< HCI Command: Host Number of Com.. (0x03|0x0035) plen 5  #109 [hci1] 12.925963
        Num handles: 1
        Handle: 3 Address: DF:A9:FF:F6:B1:1A (OUI DF-A9-FF)
        Count: 1
< ACL Data TX: Handle 3 flags 0x00 dlen 21                #110 [hci1] 12.926073
      SMP: Pairing Random (0x04) len 16
        Random value: 32527e6e64e79f33b2e374394db8ab2d
> HCI Event: Number of Completed Packets (0x13) plen 5    #111 [hci1] 13.089729
        Num handles: 1
        Handle: 3 Address: DF:A9:FF:F6:B1:1A (OUI DF-A9-FF)
        Count: 1
        #110: len 21 (1 Kb/s)
        Latency: 163 msec (73-173 msec ~165 msec)
> ACL Data RX: Handle 3 flags 0x02 dlen 21                #112 [hci1] 13.177680
      SMP: Pairing Confirm (0x03) len 16
        Confim value: 80f8dc90bda78452e72a4bbcd0d11e30
< HCI Command: Host Number of Com.. (0x03|0x0035) plen 5  #113 [hci1] 13.185705
        Num handles: 1
        Handle: 3 Address: DF:A9:FF:F6:B1:1A (OUI DF-A9-FF)
        Count: 1
< ACL Data TX: Handle 3 flags 0x00 dlen 21                #114 [hci1] 13.185929
      SMP: Pairing Confirm (0x03) len 16
        Confim value: 8fc75a796fd625c1dbe377e6c5c0d058
> HCI Event: Number of Completed Packets (0x13) plen 5    #115 [hci1] 13.352537
        Num handles: 1
        Handle: 3 Address: DF:A9:FF:F6:B1:1A (OUI DF-A9-FF)
        Count: 1
        #114: len 21 (1 Kb/s)
        Latency: 166 msec (73-173 msec ~166 msec)
> ACL Data RX: Handle 3 flags 0x02 dlen 21                #116 [hci1] 13.352853
      SMP: Pairing Random (0x04) len 16
        Random value: 53f86082b5b469460000000000000000
< HCI Command: Host Number of Com.. (0x03|0x0035) plen 5  #117 [hci1] 13.366022
        Num handles: 1
        Handle: 3 Address: DF:A9:FF:F6:B1:1A (OUI DF-A9-FF)
        Count: 1
< ACL Data TX: Handle 3 flags 0x00 dlen 21                #118 [hci1] 13.366125
      SMP: Pairing Random (0x04) len 16
        Random value: dddbdfe2838e9a8cc6964353c850fef7
> HCI Event: Number of Completed Packets (0x13) plen 5    #119 [hci1] 13.527170
        Num handles: 1
        Handle: 3 Address: DF:A9:FF:F6:B1:1A (OUI DF-A9-FF)
        Count: 1
        #118: len 21 (1 Kb/s)
        Latency: 161 msec (73-173 msec ~163 msec)
> ACL Data RX: Handle 3 flags 0x02 dlen 21                #120 [hci1] 13.615161
      SMP: Pairing Confirm (0x03) len 16
        Confim value: c5ccd2c43c5ba986a99ee5d57db66f4f
< HCI Command: Host Number of Com.. (0x03|0x0035) plen 5  #121 [hci1] 13.625776
        Num handles: 1
        Handle: 3 Address: DF:A9:FF:F6:B1:1A (OUI DF-A9-FF)
        Count: 1
< ACL Data TX: Handle 3 flags 0x00 dlen 21                #122 [hci1] 13.625992
      SMP: Pairing Confirm (0x03) len 16
        Confim value: 305d1f8fa5308edacc705f7298f28157
> HCI Event: Number of Completed Packets (0x13) plen 5    #123 [hci1] 13.789958
        Num handles: 1
        Handle: 3 Address: DF:A9:FF:F6:B1:1A (OUI DF-A9-FF)
        Count: 1
        #122: len 21 (1 Kb/s)
        Latency: 163 msec (73-173 msec ~163 msec)
> ACL Data RX: Handle 3 flags 0x02 dlen 21                #124 [hci1] 13.790308
      SMP: Pairing Random (0x04) len 16
        Random value: f10d97316962030f0000000000000000
< HCI Command: Host Number of Com.. (0x03|0x0035) plen 5  #125 [hci1] 13.806027
        Num handles: 1
        Handle: 3 Address: DF:A9:FF:F6:B1:1A (OUI DF-A9-FF)
        Count: 1
< ACL Data TX: Handle 3 flags 0x00 dlen 21                #126 [hci1] 13.806126
      SMP: Pairing Random (0x04) len 16
        Random value: eb9f1915536596b6fc3db1c86b2b1970
> HCI Event: Number of Completed Packets (0x13) plen 5    #127 [hci1] 13.964706
        Num handles: 1
        Handle: 3 Address: DF:A9:FF:F6:B1:1A (OUI DF-A9-FF)
        Count: 1
        #126: len 21 (1 Kb/s)
        Latency: 158 msec (73-173 msec ~161 msec)
> ACL Data RX: Handle 3 flags 0x02 dlen 21                #128 [hci1] 14.052589
      SMP: Pairing Confirm (0x03) len 16
        Confim value: 7916c3e7d8d31131b298b64b6f3de479
< HCI Command: Host Number of Com.. (0x03|0x0035) plen 5  #129 [hci1] 14.065739
        Num handles: 1
        Handle: 3 Address: DF:A9:FF:F6:B1:1A (OUI DF-A9-FF)
        Count: 1
< ACL Data TX: Handle 3 flags 0x00 dlen 21                #130 [hci1] 14.065934
      SMP: Pairing Confirm (0x03) len 16
        Confim value: 529c72c10ed3488228109534a7e94571
> HCI Event: Number of Completed Packets (0x13) plen 5    #131 [hci1] 14.227471
        Num handles: 1
        Handle: 3 Address: DF:A9:FF:F6:B1:1A (OUI DF-A9-FF)
        Count: 1
        #130: len 21 (1 Kb/s)
        Latency: 161 msec (73-173 msec ~161 msec)
> ACL Data RX: Handle 3 flags 0x02 dlen 21                #132 [hci1] 14.227786
      SMP: Pairing Random (0x04) len 16
        Random value: 7a2fccd2fbbe59490000000000000000
< HCI Command: Host Number of Com.. (0x03|0x0035) plen 5  #133 [hci1] 14.246051
        Num handles: 1
        Handle: 3 Address: DF:A9:FF:F6:B1:1A (OUI DF-A9-FF)
        Count: 1
< ACL Data TX: Handle 3 flags 0x00 dlen 21                #134 [hci1] 14.246186
      SMP: Pairing Random (0x04) len 16
        Random value: 5c794dc9ad9f2c3f295ebd5ad5e1c3cf
> HCI Event: Number of Completed Packets (0x13) plen 5    #135 [hci1] 14.402247
        Num handles: 1
        Handle: 3 Address: DF:A9:FF:F6:B1:1A (OUI DF-A9-FF)
        Count: 1
        #134: len 21 (1 Kb/s)
        Latency: 156 msec (73-173 msec ~158 msec)
> ACL Data RX: Handle 3 flags 0x02 dlen 21                #136 [hci1] 14.490062
      SMP: Pairing Confirm (0x03) len 16
        Confim value: abf9818fe67ab322647b2fca8e69d405
< HCI Command: Host Number of Com.. (0x03|0x0035) plen 5  #137 [hci1] 14.505739
        Num handles: 1
        Handle: 3 Address: DF:A9:FF:F6:B1:1A (OUI DF-A9-FF)
        Count: 1
< ACL Data TX: Handle 3 flags 0x00 dlen 21                #138 [hci1] 14.506004
      SMP: Pairing Confirm (0x03) len 16
        Confim value: d7e8690f6612444281bf82b59e15a154
> HCI Event: Number of Completed Packets (0x13) plen 5    #139 [hci1] 14.664891
        Num handles: 1
        Handle: 3 Address: DF:A9:FF:F6:B1:1A (OUI DF-A9-FF)
        Count: 1
        #138: len 21 (1 Kb/s)
        Latency: 158 msec (73-173 msec ~158 msec)
> ACL Data RX: Handle 3 flags 0x02 dlen 21                #140 [hci1] 14.665298
      SMP: Pairing Random (0x04) len 16
        Random value: ae1e16843e3a656c0000000000000000
< HCI Command: Host Number of Com.. (0x03|0x0035) plen 5  #141 [hci1] 14.666141
        Num handles: 1
        Handle: 3 Address: DF:A9:FF:F6:B1:1A (OUI DF-A9-FF)
        Count: 1
< ACL Data TX: Handle 3 flags 0x00 dlen 21                #142 [hci1] 14.666298
      SMP: Pairing Random (0x04) len 16
        Random value: 5c2fff312cdf99c9491988e877355a9a
> HCI Event: Number of Completed Packets (0x13) plen 5    #143 [hci1] 14.839711
        Num handles: 1
        Handle: 3 Address: DF:A9:FF:F6:B1:1A (OUI DF-A9-FF)
        Count: 1
        #142: len 21 (0 Kb/s)
        Latency: 173 msec (73-173 msec ~166 msec)
> ACL Data RX: Handle 3 flags 0x02 dlen 21                #144 [hci1] 14.927643
      SMP: Pairing Confirm (0x03) len 16
        Confim value: ea7db6f3be80c5a39141a266d7dd6cc8
< HCI Command: Host Number of Com.. (0x03|0x0035) plen 5  #145 [hci1] 14.945503
        Num handles: 1
        Handle: 3 Address: DF:A9:FF:F6:B1:1A (OUI DF-A9-FF)
        Count: 1
< ACL Data TX: Handle 3 flags 0x00 dlen 21                #146 [hci1] 14.945643
      SMP: Pairing Confirm (0x03) len 16
        Confim value: 0e772fe54ac05b0e653c36e4fb9f1f62
> HCI Event: Number of Completed Packets (0x13) plen 5    #147 [hci1] 15.102391
        Num handles: 1
        Handle: 3 Address: DF:A9:FF:F6:B1:1A (OUI DF-A9-FF)
        Count: 1
        #146: len 21 (1 Kb/s)
        Latency: 156 msec (73-173 msec ~161 msec)
> ACL Data RX: Handle 3 flags 0x02 dlen 21                #148 [hci1] 15.102765
      SMP: Pairing Random (0x04) len 16
        Random value: 2317f5347a2c930e0000000000000000
< HCI Command: Host Number of Com.. (0x03|0x0035) plen 5  #149 [hci1] 15.106020
        Num handles: 1
        Handle: 3 Address: DF:A9:FF:F6:B1:1A (OUI DF-A9-FF)
        Count: 1
< ACL Data TX: Handle 3 flags 0x00 dlen 21                #150 [hci1] 15.106126
      SMP: Pairing Random (0x04) len 16
        Random value: c629a3a987d808e808655d558dfc1155
> HCI Event: Number of Completed Packets (0x13) plen 5    #151 [hci1] 15.277139
        Num handles: 1
        Handle: 3 Address: DF:A9:FF:F6:B1:1A (OUI DF-A9-FF)
        Count: 1
        #150: len 21 (0 Kb/s)
        Latency: 171 msec (73-173 msec ~166 msec)
> ACL Data RX: Handle 3 flags 0x02 dlen 21                #152 [hci1] 15.365096
      SMP: Pairing Confirm (0x03) len 16
        Confim value: dad510a626deb9bee1426c794100448c
< HCI Command: Host Number of Com.. (0x03|0x0035) plen 5  #153 [hci1] 15.365731
        Num handles: 1
        Handle: 3 Address: DF:A9:FF:F6:B1:1A (OUI DF-A9-FF)
        Count: 1
< ACL Data TX: Handle 3 flags 0x00 dlen 21                #154 [hci1] 15.365941
      SMP: Pairing Confirm (0x03) len 16
        Confim value: ce9c04a3596df272e10ca06c421ab0b4
> HCI Event: Number of Completed Packets (0x13) plen 5    #155 [hci1] 15.539955
        Num handles: 1
        Handle: 3 Address: DF:A9:FF:F6:B1:1A (OUI DF-A9-FF)
        Count: 1
        #154: len 21 (0 Kb/s)
        Latency: 174 msec (73-174 msec ~170 msec)
> ACL Data RX: Handle 3 flags 0x02 dlen 21                #156 [hci1] 15.540235
      SMP: Pairing Random (0x04) len 16
        Random value: 670a48909e8590c10000000000000000
< HCI Command: Host Number of Com.. (0x03|0x0035) plen 5  #157 [hci1] 15.546089
        Num handles: 1
        Handle: 3 Address: DF:A9:FF:F6:B1:1A (OUI DF-A9-FF)
        Count: 1
< ACL Data TX: Handle 3 flags 0x00 dlen 21                #158 [hci1] 15.546246
      SMP: Pairing Random (0x04) len 16
        Random value: 92f20f6ad8f13724432c7fd6001c45ff
> HCI Event: Number of Completed Packets (0x13) plen 5    #159 [hci1] 15.714715
        Num handles: 1
        Handle: 3 Address: DF:A9:FF:F6:B1:1A (OUI DF-A9-FF)
        Count: 1
        #158: len 21 (1 Kb/s)
        Latency: 168 msec (73-174 msec ~169 msec)
> ACL Data RX: Handle 3 flags 0x02 dlen 21                #160 [hci1] 15.802620
      SMP: Pairing Confirm (0x03) len 16
        Confim value: e2e955261bfcfc05da68953a3893421b
< HCI Command: Host Number of Com.. (0x03|0x0035) plen 5  #161 [hci1] 15.805827
        Num handles: 1
        Handle: 3 Address: DF:A9:FF:F6:B1:1A (OUI DF-A9-FF)
        Count: 1
< ACL Data TX: Handle 3 flags 0x00 dlen 21                #162 [hci1] 15.805987
      SMP: Pairing Confirm (0x03) len 16
        Confim value: bc34882f17275c6a8610e5bfd3c92fa7
> HCI Event: Number of Completed Packets (0x13) plen 5    #163 [hci1] 15.977387
        Num handles: 1
        Handle: 3 Address: DF:A9:FF:F6:B1:1A (OUI DF-A9-FF)
        Count: 1
        #162: len 21 (0 Kb/s)
        Latency: 171 msec (73-174 msec ~170 msec)
> ACL Data RX: Handle 3 flags 0x02 dlen 21                #164 [hci1] 15.977745
      SMP: Pairing Random (0x04) len 16
        Random value: 9a84d950b96a148f0000000000000000
< HCI Command: Host Number of Com.. (0x03|0x0035) plen 5  #165 [hci1] 15.986010
        Num handles: 1
        Handle: 3 Address: DF:A9:FF:F6:B1:1A (OUI DF-A9-FF)
        Count: 1
< ACL Data TX: Handle 3 flags 0x00 dlen 21                #166 [hci1] 15.986130
      SMP: Pairing Random (0x04) len 16
        Random value: 23ac32ebbb5e14c8a6b9622f296d277f
> HCI Event: Number of Completed Packets (0x13) plen 5    #167 [hci1] 16.152180
        Num handles: 1
        Handle: 3 Address: DF:A9:FF:F6:B1:1A (OUI DF-A9-FF)
        Count: 1
        #166: len 21 (1 Kb/s)
        Latency: 166 msec (73-174 msec ~168 msec)
> ACL Data RX: Handle 3 flags 0x02 dlen 21                #168 [hci1] 16.240021
      SMP: Pairing Confirm (0x03) len 16
        Confim value: c6175379acb8f94410052dd966d2d6ae
< HCI Command: Host Number of Com.. (0x03|0x0035) plen 5  #169 [hci1] 16.245788
        Num handles: 1
        Handle: 3 Address: DF:A9:FF:F6:B1:1A (OUI DF-A9-FF)
        Count: 1
< ACL Data TX: Handle 3 flags 0x00 dlen 21                #170 [hci1] 16.246007
      SMP: Pairing Confirm (0x03) len 16
        Confim value: ee4675e45247fb5a362000dfc57adba6
> HCI Event: Number of Completed Packets (0x13) plen 5    #171 [hci1] 16.414836
        Num handles: 1
        Handle: 3 Address: DF:A9:FF:F6:B1:1A (OUI DF-A9-FF)
        Count: 1
        #170: len 21 (1 Kb/s)
        Latency: 168 msec (73-174 msec ~168 msec)
> ACL Data RX: Handle 3 flags 0x02 dlen 21                #172 [hci1] 16.415268
      SMP: Pairing Random (0x04) len 16
        Random value: 8d2a91003200dd740000000000000000
< HCI Command: Host Number of Com.. (0x03|0x0035) plen 5  #173 [hci1] 16.426056
        Num handles: 1
        Handle: 3 Address: DF:A9:FF:F6:B1:1A (OUI DF-A9-FF)
        Count: 1
< ACL Data TX: Handle 3 flags 0x00 dlen 21                #174 [hci1] 16.426219
      SMP: Pairing Random (0x04) len 16
        Random value: 297efe85e67448a15f56bd27e3a3cf1d
> HCI Event: Number of Completed Packets (0x13) plen 5    #175 [hci1] 16.589688
        Num handles: 1
        Handle: 3 Address: DF:A9:FF:F6:B1:1A (OUI DF-A9-FF)
        Count: 1
        #174: len 21 (1 Kb/s)
        Latency: 163 msec (73-174 msec ~165 msec)
> ACL Data RX: Handle 3 flags 0x02 dlen 21                #176 [hci1] 16.677628
      SMP: Pairing Confirm (0x03) len 16
        Confim value: bc53ff2c9cee33a758c94e4c1a38d436
< HCI Command: Host Number of Com.. (0x03|0x0035) plen 5  #177 [hci1] 16.685840
        Num handles: 1
        Handle: 3 Address: DF:A9:FF:F6:B1:1A (OUI DF-A9-FF)
        Count: 1
< ACL Data TX: Handle 3 flags 0x00 dlen 21                #178 [hci1] 16.686108
      SMP: Pairing Confirm (0x03) len 16
        Confim value: e6dffd0d33736bd5e1962a66f8611212
> HCI Event: Number of Completed Packets (0x13) plen 5    #179 [hci1] 16.852357
        Num handles: 1
        Handle: 3 Address: DF:A9:FF:F6:B1:1A (OUI DF-A9-FF)
        Count: 1
        #178: len 21 (1 Kb/s)
        Latency: 166 msec (73-174 msec ~166 msec)
> ACL Data RX: Handle 3 flags 0x02 dlen 21                #180 [hci1] 16.852683
      SMP: Pairing Random (0x04) len 16
        Random value: 5bbf63181048b0bf0000000000000000
< HCI Command: Host Number of Com.. (0x03|0x0035) plen 5  #181 [hci1] 16.866095
        Num handles: 1
        Handle: 3 Address: DF:A9:FF:F6:B1:1A (OUI DF-A9-FF)
        Count: 1
< ACL Data TX: Handle 3 flags 0x00 dlen 21                #182 [hci1] 16.866277
      SMP: Pairing Random (0x04) len 16
        Random value: 25a9493fd3ce4faf02be7293595bb7c6
> HCI Event: Number of Completed Packets (0x13) plen 5    #183 [hci1] 17.027154
        Num handles: 1
        Handle: 3 Address: DF:A9:FF:F6:B1:1A (OUI DF-A9-FF)
        Count: 1
        #182: len 21 (1 Kb/s)
        Latency: 160 msec (73-174 msec ~163 msec)
> ACL Data RX: Handle 3 flags 0x02 dlen 21                #184 [hci1] 17.114995
      SMP: Pairing Confirm (0x03) len 16
        Confim value: e76deefefb85ad7a06627d00ba970fc6
< HCI Command: Host Number of Com.. (0x03|0x0035) plen 5  #185 [hci1] 17.125841
        Num handles: 1
        Handle: 3 Address: DF:A9:FF:F6:B1:1A (OUI DF-A9-FF)
        Count: 1
< ACL Data TX: Handle 3 flags 0x00 dlen 21                #186 [hci1] 17.126032
      SMP: Pairing Confirm (0x03) len 16
        Confim value: 82dcfca054f125a51812323e8e115dfe
> HCI Event: Number of Completed Packets (0x13) plen 5    #187 [hci1] 17.289827
        Num handles: 1
        Handle: 3 Address: DF:A9:FF:F6:B1:1A (OUI DF-A9-FF)
        Count: 1
        #186: len 21 (1 Kb/s)
        Latency: 163 msec (73-174 msec ~163 msec)
> ACL Data RX: Handle 3 flags 0x02 dlen 21                #188 [hci1] 17.290146
      SMP: Pairing Random (0x04) len 16
        Random value: 1cfdeefcd1c6f0ab0000000000000000
< HCI Command: Host Number of Com.. (0x03|0x0035) plen 5  #189 [hci1] 17.306090
        Num handles: 1
        Handle: 3 Address: DF:A9:FF:F6:B1:1A (OUI DF-A9-FF)
        Count: 1
< ACL Data TX: Handle 3 flags 0x00 dlen 21                #190 [hci1] 17.306255
      SMP: Pairing Random (0x04) len 16
        Random value: 58f6b41f855a6f6c3560debd84e2affc
> HCI Event: Number of Completed Packets (0x13) plen 5    #191 [hci1] 17.464557
        Num handles: 1
        Handle: 3 Address: DF:A9:FF:F6:B1:1A (OUI DF-A9-FF)
        Count: 1
        #190: len 21 (1 Kb/s)
        Latency: 158 msec (73-174 msec ~160 msec)
> ACL Data RX: Handle 3 flags 0x02 dlen 21                #192 [hci1] 17.552526
      SMP: Pairing Confirm (0x03) len 16
        Confim value: 39b88f570ff4d477efe949d20ead3f43
< HCI Command: Host Number of Com.. (0x03|0x0035) plen 5  #193 [hci1] 17.565963
        Num handles: 1
        Handle: 3 Address: DF:A9:FF:F6:B1:1A (OUI DF-A9-FF)
        Count: 1
< ACL Data TX: Handle 3 flags 0x00 dlen 21                #194 [hci1] 17.566254
      SMP: Pairing Confirm (0x03) len 16
        Confim value: bb93b656fd3f2d1d148b718eabf1de48
> HCI Event: Number of Completed Packets (0x13) plen 5    #195 [hci1] 17.727260
        Num handles: 1
        Handle: 3 Address: DF:A9:FF:F6:B1:1A (OUI DF-A9-FF)
        Count: 1
        #194: len 21 (1 Kb/s)
        Latency: 161 msec (73-174 msec ~160 msec)
> ACL Data RX: Handle 3 flags 0x02 dlen 21                #196 [hci1] 17.727680
      SMP: Pairing Random (0x04) len 16
        Random value: f2e2e2f8ba55fd6f0000000000000000
< HCI Command: Host Number of Com.. (0x03|0x0035) plen 5  #197 [hci1] 17.746252
        Num handles: 1
        Handle: 3 Address: DF:A9:FF:F6:B1:1A (OUI DF-A9-FF)
        Count: 1
< ACL Data TX: Handle 3 flags 0x00 dlen 21                #198 [hci1] 17.746444
      SMP: Pairing Random (0x04) len 16
        Random value: b67e7216d5bf664139eda2b542549666
> HCI Event: Number of Completed Packets (0x13) plen 5    #199 [hci1] 17.902061
        Num handles: 1
        Handle: 3 Address: DF:A9:FF:F6:B1:1A (OUI DF-A9-FF)
        Count: 1
        #198: len 21 (1 Kb/s)
        Latency: 155 msec (73-174 msec ~158 msec)
> ACL Data RX: Handle 3 flags 0x02 dlen 21                #200 [hci1] 17.989914
      SMP: Pairing Confirm (0x03) len 16
        Confim value: 2fed6b111efbe8e5168eba7cd3574024
< HCI Command: Host Number of Com.. (0x03|0x0035) plen 5  #201 [hci1] 18.005858
        Num handles: 1
        Handle: 3 Address: DF:A9:FF:F6:B1:1A (OUI DF-A9-FF)
        Count: 1
< ACL Data TX: Handle 3 flags 0x00 dlen 21                #202 [hci1] 18.006092
      SMP: Pairing Confirm (0x03) len 16
        Confim value: 66390a309473bb04a16c4a20205799dc
> HCI Event: Number of Completed Packets (0x13) plen 5    #203 [hci1] 18.164900
        Num handles: 1
        Handle: 3 Address: DF:A9:FF:F6:B1:1A (OUI DF-A9-FF)
        Count: 1
        #202: len 21 (1 Kb/s)
        Latency: 158 msec (73-174 msec ~158 msec)
> ACL Data RX: Handle 3 flags 0x02 dlen 21                #204 [hci1] 18.165150
      SMP: Pairing Random (0x04) len 16
        Random value: e9b1844bedcdfc0e0000000000000000
< HCI Command: Host Number of Com.. (0x03|0x0035) plen 5  #205 [hci1] 18.166066
        Num handles: 1
        Handle: 3 Address: DF:A9:FF:F6:B1:1A (OUI DF-A9-FF)
        Count: 1
< ACL Data TX: Handle 3 flags 0x00 dlen 21                #206 [hci1] 18.166188
      SMP: Pairing Random (0x04) len 16
        Random value: ed17f76500c95219dd01e09d1e63f87b
> HCI Event: Number of Completed Packets (0x13) plen 5    #207 [hci1] 18.339713
        Num handles: 1
        Handle: 3 Address: DF:A9:FF:F6:B1:1A (OUI DF-A9-FF)
        Count: 1
        #206: len 21 (0 Kb/s)
        Latency: 173 msec (73-174 msec ~166 msec)
> ACL Data RX: Handle 3 flags 0x02 dlen 21                #208 [hci1] 18.427500
      SMP: Pairing Confirm (0x03) len 16
        Confim value: 056158809bb70da1d7b1309896d1307b
< HCI Command: Host Number of Com.. (0x03|0x0035) plen 5  #209 [hci1] 18.445858
        Num handles: 1
        Handle: 3 Address: DF:A9:FF:F6:B1:1A (OUI DF-A9-FF)
        Count: 1
< ACL Data TX: Handle 3 flags 0x00 dlen 21                #210 [hci1] 18.446075
      SMP: Pairing Confirm (0x03) len 16
        Confim value: 2c67cc5ecaeef9b4da41591f91b62ac5
> HCI Event: Number of Completed Packets (0x13) plen 5    #211 [hci1] 18.602410
        Num handles: 1
        Handle: 3 Address: DF:A9:FF:F6:B1:1A (OUI DF-A9-FF)
        Count: 1
        #210: len 21 (1 Kb/s)
        Latency: 156 msec (73-174 msec ~161 msec)
> ACL Data RX: Handle 3 flags 0x02 dlen 21                #212 [hci1] 18.602616
      SMP: Pairing Random (0x04) len 16
        Random value: 5a32b957de4ef4b80000000000000000
< HCI Command: Host Number of Com.. (0x03|0x0035) plen 5  #213 [hci1] 18.606102
        Num handles: 1
        Handle: 3 Address: DF:A9:FF:F6:B1:1A (OUI DF-A9-FF)
        Count: 1
< ACL Data TX: Handle 3 flags 0x00 dlen 21                #214 [hci1] 18.606265
      SMP: Pairing Random (0x04) len 16
        Random value: 81d35d47e1f6006d79c974bd9d9e1ee3
> HCI Event: Number of Completed Packets (0x13) plen 5    #215 [hci1] 18.777179
        Num handles: 1
        Handle: 3 Address: DF:A9:FF:F6:B1:1A (OUI DF-A9-FF)
        Count: 1
        #214: len 21 (0 Kb/s)
        Latency: 170 msec (73-174 msec ~166 msec)
> ACL Data RX: Handle 3 flags 0x02 dlen 21                #216 [hci1] 18.864884
      SMP: Pairing Confirm (0x03) len 16
        Confim value: 60271fad141864aff889b01c4fc1a682
< HCI Command: Host Number of Com.. (0x03|0x0035) plen 5  #217 [hci1] 18.865582
        Num handles: 1
        Handle: 3 Address: DF:A9:FF:F6:B1:1A (OUI DF-A9-FF)
        Count: 1
< ACL Data TX: Handle 3 flags 0x00 dlen 21                #218 [hci1] 18.865699
      SMP: Pairing Confirm (0x03) len 16
        Confim value: 6689a5d527e0ba9e7592ec92707fd176
> HCI Event: Number of Completed Packets (0x13) plen 5    #219 [hci1] 19.039810
        Num handles: 1
        Handle: 3 Address: DF:A9:FF:F6:B1:1A (OUI DF-A9-FF)
        Count: 1
        #218: len 21 (0 Kb/s)
        Latency: 174 msec (73-174 msec ~170 msec)
> ACL Data RX: Handle 3 flags 0x02 dlen 21                #220 [hci1] 19.040182
      SMP: Pairing Random (0x04) len 16
        Random value: 49a3a065cb5678d00000000000000000
< HCI Command: Host Number of Com.. (0x03|0x0035) plen 5  #221 [hci1] 19.046109
        Num handles: 1
        Handle: 3 Address: DF:A9:FF:F6:B1:1A (OUI DF-A9-FF)
        Count: 1
< ACL Data TX: Handle 3 flags 0x00 dlen 21                #222 [hci1] 19.046244
      SMP: Pairing Random (0x04) len 16
        Random value: e7f7e0c2476823e41736a7e381bafb7c
> HCI Event: Number of Completed Packets (0x13) plen 5    #223 [hci1] 19.214608
        Num handles: 1
        Handle: 3 Address: DF:A9:FF:F6:B1:1A (OUI DF-A9-FF)
        Count: 1
        #222: len 21 (1 Kb/s)
        Latency: 168 msec (73-174 msec ~169 msec)
> ACL Data RX: Handle 3 flags 0x02 dlen 21                #224 [hci1] 19.302362
      SMP: Pairing Confirm (0x03) len 16
        Confim value: 18b63a837a671104c0032c8b65939f92
< HCI Command: Host Number of Com.. (0x03|0x0035) plen 5  #225 [hci1] 19.305567
        Num handles: 1
        Handle: 3 Address: DF:A9:FF:F6:B1:1A (OUI DF-A9-FF)
        Count: 1
< ACL Data TX: Handle 3 flags 0x00 dlen 21                #226 [hci1] 19.305710
      SMP: Pairing Confirm (0x03) len 16
        Confim value: 7ba12cafc03052586cd6f82a1bf953e3
> HCI Event: Number of Completed Packets (0x13) plen 5    #227 [hci1] 19.477244
        Num handles: 1
        Handle: 3 Address: DF:A9:FF:F6:B1:1A (OUI DF-A9-FF)
        Count: 1
        #226: len 21 (0 Kb/s)
        Latency: 171 msec (73-174 msec ~170 msec)
> ACL Data RX: Handle 3 flags 0x02 dlen 21                #228 [hci1] 19.477632
      SMP: Pairing Random (0x04) len 16
        Random value: 87ae995a8fea9fea0000000000000000
< HCI Command: Host Number of Com.. (0x03|0x0035) plen 5  #229 [hci1] 19.485950
        Num handles: 1
        Handle: 3 Address: DF:A9:FF:F6:B1:1A (OUI DF-A9-FF)
        Count: 1
< ACL Data TX: Handle 3 flags 0x00 dlen 21                #230 [hci1] 19.486000
      SMP: Pairing Random (0x04) len 16
        Random value: fc8b40d9b0b09bc4296bf8753a8f6e1f
