Bluetooth monitor ver 5.72
= Note: Linux version 6.14.0-36-generic (x86_64)                       0.174335
= Note: Bluetooth subsystem version 2.22                               0.174338
= New Index: 00:00:00:00:00:00 (Primary,UART,hci1)              [hci1] 0.174339
= New Index: 48:5F:99:8E:E0:64 (Primary,USB,hci0)               [hci0] 0.174339
= Open Index: 00:00:00:00:00:00                                 [hci1] 0.289752
= Index Info: 00:00:00:00:00:00 (Nordic Semiconductor ASA)      [hci1] 0.289770
@ USER Open: main (privileged) version 2.22            {0x0001} [hci1] 0.289779
< HCI Command: Reset (0x03|0x0003) plen 0                    #1 [hci1] 0.291515
> HCI Event: Command Complete (0x0e) plen 4                  #2 [hci1] 0.291965
      Reset (0x03|0x0003) ncmd 1
        Status: Success (0x00)
< HCI Command: Read Local Supported... (0x04|0x0003) plen 0  #3 [hci1] 0.307462
> HCI Event: Command Complete (0x0e) plen 12                 #4 [hci1] 0.308001
      Read Local Supported Features (0x04|0x0003) ncmd 1
        Status: Success (0x00)
        Features: 0x00 0x00 0x00 0x00 0x60 0x00 0x00 0x00
          BR/EDR Not Supported
          LE Supported (Controller)
< HCI Command: Read Local Version In.. (0x04|0x0001) plen 0  #5 [hci1] 0.327451
> HCI Event: Command Complete (0x0e) plen 12                 #6 [hci1] 0.327992
      Read Local Version Information (0x04|0x0001) ncmd 1
        Status: Success (0x00)
        HCI version: Reserved (0x0f) - Revision 12393 (0x3069)
        LMP version: Reserved (0x0f) - Subversion 12393 (0x3069)
        Manufacturer: Nordic Semiconductor ASA (89)
< HCI Command: Read Local Supported... (0x04|0x0002) plen 0  #7 [hci1] 0.347410
> HCI Event: Command Complete (0x0e) plen 68                 #8 [hci1] 0.348455
      Read Local Supported Commands (0x04|0x0002) ncmd 1
        Status: Success (0x00)
        Commands: 119 entries
          Disconnect (Octet 0 - Bit 5)
          Read Remote Version Information (Octet 2 - Bit 7)
          Set Event Mask (Octet 5 - Bit 6)
          Reset (Octet 5 - Bit 7)
          Read Connection Accept Timeout (Octet 7 - Bit 2)
          Write Connection Accept Timeout (Octet 7 - Bit 3)
          Read Transmit Power Level (Octet 10 - Bit 2)
          Set Controller To Host Flow Control (Octet 10 - Bit 5)
          Host Buffer Size (Octet 10 - Bit 6)
          Host Number of Completed Packets (Octet 10 - Bit 7)
          Read Local Version Information (Octet 14 - Bit 3)
          Read Local Supported Features (Octet 14 - Bit 5)
          Read BD ADDR (Octet 15 - Bit 1)
          Read RSSI (Octet 15 - Bit 5)
          Set Event Mask Page 2 (Octet 22 - Bit 2)
          LE Set Event Mask (Octet 25 - Bit 0)
          LE Read Buffer Size (Octet 25 - Bit 1)
          LE Read Local Supported Features (Octet 25 - Bit 2)
          LE Set Random Address (Octet 25 - Bit 4)
          LE Set Advertising Parameters (Octet 25 - Bit 5)
          LE Read Advertising Channel TX Power (Octet 25 - Bit 6)
          LE Set Advertising Data (Octet 25 - Bit 7)
          LE Set Scan Response Data (Octet 26 - Bit 0)
          LE Set Advertise Enable (Octet 26 - Bit 1)
          LE Set Scan Parameters (Octet 26 - Bit 2)
          LE Set Scan Enable (Octet 26 - Bit 3)
          LE Create Connection (Octet 26 - Bit 4)
          LE Create Connection Cancel (Octet 26 - Bit 5)
          LE Read Accept List Size (Octet 26 - Bit 6)
          LE Clear Accept List (Octet 26 - Bit 7)
          LE Add Device To Accept List (Octet 27 - Bit 0)
          LE Remove Device From Accept List (Octet 27 - Bit 1)
          LE Connection Update (Octet 27 - Bit 2)
          LE Set Host Channel Classification (Octet 27 - Bit 3)
          LE Read Channel Map (Octet 27 - Bit 4)
          LE Read Remote Used Features (Octet 27 - Bit 5)
          LE Encrypt (Octet 27 - Bit 6)
          LE Rand (Octet 27 - Bit 7)
          LE Start Encryption (Octet 28 - Bit 0)
          LE Long Term Key Request Reply (Octet 28 - Bit 1)
          LE Long Term Key Request Neg Reply (Octet 28 - Bit 2)
          LE Read Supported States (Octet 28 - Bit 3)
          LE Receiver Test (Octet 28 - Bit 4)
          LE Transmitter Test (Octet 28 - Bit 5)
          LE Test End (Octet 28 - Bit 6)
          Read Authenticated Payload Timeout (Octet 32 - Bit 4)
          Write Authenticated Payload Timeout (Octet 32 - Bit 5)
          LE Set Data Length (Octet 33 - Bit 6)
          LE Read Suggested Default Data Length (Octet 33 - Bit 7)
          LE Write Suggested Default Data Length (Octet 34 - Bit 0)
          LE Add Device To Resolving List (Octet 34 - Bit 3)
          LE Remove Device From Resolving List (Octet 34 - Bit 4)
          LE Clear Resolving List (Octet 34 - Bit 5)
          LE Read Resolving List Size (Octet 34 - Bit 6)
          LE Set Address Resolution Enable (Octet 35 - Bit 1)
          LE Set Resolvable Private Address Timeout (Octet 35 - Bit 2)
          LE Read Maximum Data Length (Octet 35 - Bit 3)
          LE Read PHY (Octet 35 - Bit 4)
          LE Set Default PHY (Octet 35 - Bit 5)
          LE Set PHY (Octet 35 - Bit 6)
          LE Enhanced Receiver Test (Octet 35 - Bit 7)
          LE Enhanced Transmitter Test (Octet 36 - Bit 0)
          LE Set Advertising Set Random Address (Octet 36 - Bit 1)
          LE Set Extended Advertising Parameters (Octet 36 - Bit 2)
          LE Set Extended Advertising Data (Octet 36 - Bit 3)
          LE Set Extended Scan Response Data (Octet 36 - Bit 4)
          LE Set Extended Advertising Enable (Octet 36 - Bit 5)
          LE Read Maximum Advertising Data Length (Octet 36 - Bit 6)
          LE Read Number of Supported Advertising Sets (Octet 36 - Bit 7)
          LE Remove Advertising Set (Octet 37 - Bit 0)
          LE Clear Advertising Sets (Octet 37 - Bit 1)
          LE Set Periodic Advertising Parameters (Octet 37 - Bit 2)
          LE Set Periodic Advertising Data (Octet 37 - Bit 3)
          LE Set Periodic Advertising Enable (Octet 37 - Bit 4)
          LE Set Extended Scan Parameters (Octet 37 - Bit 5)
          LE Set Extended Scan Enable (Octet 37 - Bit 6)
          LE Extended Create Connection (Octet 37 - Bit 7)
          LE Periodic Advertising Create Sync (Octet 38 - Bit 0)
          LE Periodic Advertising Create Sync Cancel (Octet 38 - Bit 1)
          LE Periodic Advertising Terminate Sync (Octet 38 - Bit 2)
          LE Add Device To Periodic Advertiser List (Octet 38 - Bit 3)
          LE Remove Device From Periodic Advertiser List (Octet 38 - Bit 4)
          LE Clear Periodic Advertiser List (Octet 38 - Bit 5)
          LE Read Periodic Advertiser List Size (Octet 38 - Bit 6)
          LE Read Transmit Power (Octet 38 - Bit 7)
          LE Read RF Path Compensation (Octet 39 - Bit 0)
          LE Write RF Path Compensation (Octet 39 - Bit 1)
          LE Set Privacy Mode (Octet 39 - Bit 2)
          LE Periodic Advertising Receive Enable (Octet 40 - Bit 5)
          LE Periodic Advertising Sync Transfer (Octet 40 - Bit 6)
          LE Periodic Advertising Set Info Transfer (Octet 40 - Bit 7)
          LE Periodic Advertising Sync Transfer Parameters (Octet 41 - Bit 0)
          LE Set Default Periodic Advertisng Sync Transfer Parameters (Octet 41 - Bit 1)
          LE Read Buffer v2 (Octet 41 - Bit 5)
          LE Read ISO TX Sync (Octet 41 - Bit 6)
          LE Set Connected Isochronous Group Parameters (Octet 41 - Bit 7)
          LE Set Connected Isochronous Group Parameters Test (Octet 42 - Bit 0)
          LE Create Connected Isochronous Stream (Octet 42 - Bit 1)
          LE Remove Connected Isochronous Group (Octet 42 - Bit 2)
          LE Accept Connected Isochronous Stream Request (Octet 42 - Bit 3)
          LE Reject Connected Isochronous Stream Request (Octet 42 - Bit 4)
          LE Create Broadcast Isochronous Group (Octet 42 - Bit 5)
          LE Create Broadcast Isochronous Group Test (Octet 42 - Bit 6)
          LE Terminate Broadcast Isochronous Group (Octet 42 - Bit 7)
          LE Broadcast Isochronous Group Create Sync (Octet 43 - Bit 0)
          LE Broadcast Isochronous Group Terminate Sync (Octet 43 - Bit 1)
          LE Request Peer SCA (Octet 43 - Bit 2)
          LE Setup Isochronous Data Path (Octet 43 - Bit 3)
          LE Remove Isochronous Data Path (Octet 43 - Bit 4)
          LE Isochronous Transmit Test (Octet 43 - Bit 5)
          LE Isochronous Receive Test (Octet 43 - Bit 6)
          LE Isochronous Read Test Counters (Octet 43 - Bit 7)
          LE Isochronous Read Test Counters (Octet 44 - Bit 0)
          LE Set Host Feature (Octet 44 - Bit 1)
          Octet 44 - Bit 2 
          Octet 45 - Bit 6 
          Octet 46 - Bit 0 
          Octet 46 - Bit 1 
          Octet 46 - Bit 2 
< HCI Command: Host Buffer Size (0x03|0x0033) plen 7         #9 [hci1] 0.367449
        ACL MTU: 255  ACL max packet: 16
        SCO MTU: 0    SCO max packet: 0
> HCI Event: Command Complete (0x0e) plen 4                 #10 [hci1] 0.367977
      Host Buffer Size (0x03|0x0033) ncmd 1
        Status: Success (0x00)
< HCI Command: Set Controller To Ho.. (0x03|0x0031) plen 1  #11 [hci1] 0.387442
        Flow control: ACL Data Packets (0x01)
> HCI Event: Command Complete (0x0e) plen 4                 #12 [hci1] 0.387841
      Set Controller To Host Flow Control (0x03|0x0031) ncmd 1
        Status: Success (0x00)
< HCI Command: LE Read Local Suppor.. (0x08|0x0003) plen 0  #13 [hci1] 0.407440
> HCI Event: Command Complete (0x0e) plen 12                #14 [hci1] 0.408063
      LE Read Local Supported Features (0x08|0x0003) ncmd 1
        Status: Success (0x00)
        Features: 0xfd 0x79 0x00 0xf7 0x30 0x01 0x00 0x00
          LE Encryption
          Extended Reject Indication
          Peripheral-initiated Features Exchange
          LE Ping
          LE Data Packet Length Extension
          LL Privacy
          Extended Scanner Filter Policies
          LE 2M PHY
          LE Coded PHY
          LE Extended Advertising
          LE Periodic Advertising
          Channel Selection Algorithm #2
          Periodic Advertising Sync Transfer - Sender
          Periodic Advertising Sync Transfer - Recipient
          Sleep Clock Accuracy Updates
          Connected Isochronous Stream - Central
          Connected Isochronous Stream - Peripheral
          Isochronous Broadcaster
          Synchronized Receiver
          Periodic Advertising ADI support
          Connection Subrating
          Unknown features (0x0000010000000000)
< HCI Command: LE Set Host Feature (0x08|0x0074) plen 2     #15 [hci1] 0.427423
        Bit Number: 32
          Connected Isochronous Stream (Host Support)
        Bit Value: 1
> HCI Event: Command Complete (0x0e) plen 4                 #16 [hci1] 0.427792
      LE Set Host Feature (0x08|0x0074) ncmd 1
        Status: Success (0x00)
< HCI Command: LE Read Buffer v2 (0x08|0x0060) plen 0       #17 [hci1] 0.447453
> HCI Event: Command Complete (0x0e) plen 10                #18 [hci1] 0.448009
      LE Read Buffer v2 (0x08|0x0060) ncmd 1
        Status: Success (0x00)
        ACL MTU: 27
        ACL max packet: 3
        ISO MTU: 318
        ISO max packet: 3
< HCI Command: LE Read Maximum Adve.. (0x08|0x003a) plen 0  #19 [hci1] 0.467514
> HCI Event: Command Complete (0x0e) plen 6                 #20 [hci1] 0.467968
      LE Read Maximum Advertising Data Length (0x08|0x003a) ncmd 1
        Status: Success (0x00)
        Max length: 1650
< HCI Command: LE Read Supported St.. (0x08|0x001c) plen 0  #21 [hci1] 0.487440
> HCI Event: Command Complete (0x0e) plen 12                #22 [hci1] 0.487956
      LE Read Supported States (0x08|0x001c) ncmd 1
        Status: Success (0x00)
        States: 0x000003ff3e0306ff
          Non-connectable Advertising State
          Scannable Advertising State
          Connectable Advertising State
          High Duty Cycle Directed Advertising State
          Passive Scanning State
          Active Scanning State
          Initiating State
            and Connection State (Central Role)
          Connection State (Peripheral Role)
          Scannable Advertising State
            and Passive Scanning State
          Connectable Advertising State
            and Passive Scanning State
          Non-connectable Advertising State
            and Initiating State
          Scannable Advertising State
            and Initiating State
          Active Scanning State
            and Connection State (Central Role)
          Passive Scanning State
            and Connection State (Peripheral Role)
          Active Scanning State
            and Connection State (Peripheral Role)
          Initiating State
            and Connection State (Central Role)
            and Central Role & Central Role
          Low Duty Cycle Directed Advertising State
          Connectable Advertising State
            and Initiating State
            and Central Role & Peripheral Role
          High Duty Cycle Directed Advertising State
            and Initiating State
            and Central Role & Peripheral Role
          Low Duty Cycle Directed Advertising State
            and Initiating State
            and Central Role & Peripheral Role
          Connectable Advertising State
            and Connection State (Central Role)
            and Central Role & Peripheral Role
          High Duty Cycle Directed Advertising State
            and Connection State (Central Role)
            and Central Role & Peripheral Role
          Low Duty Cycle Directed Advertising State
            and Connection State (Central Role)
            and Central Role & Peripheral Role
          Connectable Advertising State
            and Connection State (Peripheral Role)
            and Central Role & Peripheral Role
          High Duty Cycle Directed Advertising State
            and Connection State (Peripheral Role)
            and Peripheral Role & Peripheral Role
          Low Duty Cycle Directed Advertising State
            and Connection State (Peripheral Role)
            and Peripheral Role & Peripheral Role
          Initiating State
            and Connection State (Peripheral Role)
            and Central Role & Peripheral Role
< HCI Command: LE Read Maximum Data.. (0x08|0x002f) plen 0  #23 [hci1] 0.507435
> HCI Event: Command Complete (0x0e) plen 12                #24 [hci1] 0.507978
      LE Read Maximum Data Length (0x08|0x002f) ncmd 1
        Status: Success (0x00)
        Max TX octets: 251
        Max TX time: 2704
        Max RX octets: 251
        Max RX time: 2704
< HCI Command: LE Write Suggested D.. (0x08|0x0024) plen 4  #25 [hci1] 0.527477
        TX octets: 251
        TX time: 2704
> HCI Event: Command Complete (0x0e) plen 4                 #26 [hci1] 0.527939
      LE Write Suggested Default Data Length (0x08|0x0024) ncmd 1
        Status: Success (0x00)
< HCI Command: LE Read Resolving Li.. (0x08|0x002a) plen 0  #27 [hci1] 0.547410
> HCI Event: Command Complete (0x0e) plen 5                 #28 [hci1] 0.547846
      LE Read Resolving List Size (0x08|0x002a) ncmd 1
        Status: Success (0x00)
        Size: 8
< HCI Command: LE Set Event Mask (0x08|0x0001) plen 8       #29 [hci1] 0.567443
        Mask: 0x000002023f87fa5e
          LE Advertising Report
          LE Connection Update Complete
          LE Read Remote Used Features Complete
          LE Long Term Key Request
          LE Data Length Change
          LE Enhanced Connection Complete
          LE PHY Update Complete
          LE Extended Advertising Report
          LE Periodic Advertising Sync Established
          LE Periodic Advertising Report
          LE Periodic Advertising Sync Lost
          LE Extended Scan Timeout
          LE Extended Advertising Set Terminated
          LE Scan Request Received
          LE Periodic Advertising Sync Transfer Rvc
          LE CIS Established
          LE CIS Request
          LE Create BIG Complete
          LE Terminate BIG Complete
          LE BIG Sync Estabilished Complete
          LE BIG Sync Lost
          LE BIG Info Advertising Report
          Unknown mask (0x0000020000000000)
> HCI Event: Command Complete (0x0e) plen 4                 #30 [hci1] 0.567986
      LE Set Event Mask (0x08|0x0001) ncmd 1
        Status: Success (0x00)
< HCI Command: Set Event Mask (0x03|0x0001) plen 8          #31 [hci1] 0.587517
        Mask: 0x2000800002008890
          Disconnection Complete
          Encryption Change
          Read Remote Version Information Complete
          Hardware Error
          Data Buffer Overflow
          Encryption Key Refresh Complete
          LE Meta
> HCI Event: Command Complete (0x0e) plen 4                 #32 [hci1] 0.588075
      Set Event Mask (0x03|0x0001) ncmd 1
        Status: Success (0x00)
< HCI Command: Read BD ADDR (0x04|0x0009) plen 0            #33 [hci1] 0.607455
> HCI Event: Command Complete (0x0e) plen 10                #34 [hci1] 0.608010
      Read BD ADDR (0x04|0x0009) ncmd 1
        Status: Success (0x00)
        Address: 00:00:00:00:00:00 (OUI 00-00-00)
< HCI Command: LE Set Random Address (0x08|0x0005) plen 6   #35 [hci1] 0.627426
        Address: D5:B6:CC:31:DB:3B (Static)
> HCI Event: Command Complete (0x0e) plen 4                 #36 [hci1] 0.627905
      LE Set Random Address (0x08|0x0005) ncmd 1
        Status: Success (0x00)
< HCI Command: LE Set Extended Adv.. (0x08|0x0036) plen 25  #37 [hci1] 3.157995
        Handle: 0x00
        Properties: 0x0013
          Connectable
          Scannable
          Use legacy advertising PDUs: ADV_IND
        Min advertising interval: 100.000 msec (0x00a0)
        Max advertising interval: 150.000 msec (0x00f0)
        Channel map: 37, 38, 39 (0x07)
        Own address type: Random (0x01)
        Peer address type: Public (0x00)
        Peer address: 00:00:00:00:00:00 (OUI 00-00-00)
        Filter policy: Allow Scan Request from Any, Allow Connect Request from Any (0x00)
        TX power: Host has no preference (0x7f)
        Primary PHY: LE 1M (0x01)
        Secondary max skip: 0x00
        Secondary PHY: LE 1M (0x01)
        SID: 0x00
        Scan request notifications: Disabled (0x00)
> HCI Event: Command Complete (0x0e) plen 5                 #38 [hci1] 3.158822
      LE Set Extended Advertising Parameters (0x08|0x0036) ncmd 1
        Status: Success (0x00)
        TX power (selected): 0 dbm (0x00)
< HCI Command: LE Set Advertising S.. (0x08|0x0035) plen 7  #39 [hci1] 3.167906
        Advertising handle: 0x00
        Advertising random address: D5:B6:CC:31:DB:3B (Static)
> HCI Event: Command Complete (0x0e) plen 4                 #40 [hci1] 3.168437
      LE Set Advertising Set Random Address (0x08|0x0035) ncmd 1
        Status: Success (0x00)
< HCI Command: LE Set Extended Adv.. (0x08|0x0037) plen 22  #41 [hci1] 3.187680
        Handle: 0x00
        Operation: Complete extended advertising data (0x03)
        Fragment preference: Minimize fragmentation (0x01)
        Data length: 0x12
        Flags: 0x06
          LE General Discoverable Mode
          BR/EDR Not Supported
        Name (complete): Tester_F6B11A
> HCI Event: Command Complete (0x0e) plen 4                 #42 [hci1] 3.188402
      LE Set Extended Advertising Data (0x08|0x0037) ncmd 1
        Status: Success (0x00)
< HCI Command: LE Set Extended Scan.. (0x08|0x0038) plen 4  #43 [hci1] 3.207577
        Handle: 0x00
        Operation: Complete scan response data (0x03)
        Fragment preference: Minimize fragmentation (0x01)
        Data length: 0x00
> HCI Event: Command Complete (0x0e) plen 4                 #44 [hci1] 3.208122
      LE Set Extended Scan Response Data (0x08|0x0038) ncmd 1
        Status: Success (0x00)
< HCI Command: LE Set Extended Adve.. (0x08|0x0039) plen 6  #45 [hci1] 3.227524
        Extended advertising: Enabled (0x01)
        Number of sets: 1 (0x01)
        Entry 0
          Handle: 0x00
          Duration: 0 ms (0x00)
          Max ext adv events: 0
> HCI Event: Command Complete (0x0e) plen 4                 #46 [hci1] 3.228080
      LE Set Extended Advertising Enable (0x08|0x0039) ncmd 1
        Status: Success (0x00)
> HCI Event: LE Meta Event (0x3e) plen 31                   #47 [hci1] 3.347636
      LE Enhanced Connection Complete (0x0a)
        Status: Success (0x00)
        Handle: 1947
        Role: Peripheral (0x01)
        Peer address type: Public (0x00)
        Peer address: DF:A9:FF:F6:B1:1A (OUI DF-A9-FF)
        Local resolvable private address: 00:00:00:00:00:00 (Non-Resolvable)
        Peer resolvable private address: 00:00:00:00:00:00 (Non-Resolvable)
        Connection interval: 87.50 msec (0x0046)
        Connection latency: 0 (0x0000)
        Supervision timeout: 25120 msec (0x09d0)
        Central clock accuracy: 0x01
> HCI Event: LE Meta Event (0x3e) plen 6                    #48 [hci1] 3.347652
      LE Advertising Set Terminated (0x12)
        Status: Success (0x00)
        Handle: 0
        Connection handle: 1947
        Number of completed extended advertising events: 0
< HCI Command: LE Read Remote Used... (0x08|0x0016) plen 2  #49 [hci1] 3.368636
        Handle: 1947 Address: DF:A9:FF:F6:B1:1A (OUI DF-A9-FF)
< ACL Data TX: Handle 1947 flags 0x00 dlen 7                #50 [hci1] 3.368662
      ATT: Exchange MTU Request (0x02) len 2
        Client RX MTU: 251
> HCI Event: Command Status (0x0f) plen 4                   #51 [hci1] 3.369192
      LE Read Remote Used Features (0x08|0x0016) ncmd 1
        Status: Success (0x00)
> HCI Event: Number of Completed Packets (0x13) plen 5      #52 [hci1] 3.523552
        Num handles: 1
        Handle: 1947 Address: DF:A9:FF:F6:B1:1A (OUI DF-A9-FF)
        Count: 1
        #50: len 7 (0 Kb/s)
        Latency: 154 msec (154-154 msec ~154 msec)
> HCI Event: LE Meta Event (0x3e) plen 12                   #53 [hci1] 3.611444
      LE Read Remote Used Features (0x04)
        Status: Success (0x00)
        Handle: 1947 Address: DF:A9:FF:F6:B1:1A (OUI DF-A9-FF)
        Features: 0x2d 0x49 0x00 0xf7 0x67 0xd8 0x00 0x00
          LE Encryption
          Extended Reject Indication
          Peripheral-initiated Features Exchange
          LE Data Packet Length Extension
          LE 2M PHY
          LE Coded PHY
          Channel Selection Algorithm #2
          Periodic Advertising Sync Transfer - Sender
          Periodic Advertising Sync Transfer - Recipient
          Sleep Clock Accuracy Updates
          Connected Isochronous Stream - Central
          Connected Isochronous Stream - Peripheral
          Isochronous Broadcaster
          Synchronized Receiver
          Connected Isochronous Stream (Host Support)
          LE Power Control Request
          LE Power Control Request
          Connection Subrating
          Connection Subrating (Host Support)
          Unknown features (0x0000d80000000000)
> ACL Data RX: Handle 1947 flags 0x02 dlen 11               #54 [hci1] 6.061064
      SMP: Pairing Request (0x01) len 6
        IO capability: KeyboardDisplay (0x04)
        OOB data: Authentication data not present (0x00)
        Authentication requirement: Bonding, MITM, SC, No Keypresses (0x0d)
        Max encryption key size: 16
        Initiator key distribution: EncKey IdKey (0x03)
        Responder key distribution: EncKey IdKey Sign (0x07)
> ACL Data RX: Handle 1947 flags 0x02 dlen 7                #55 [hci1] 6.061550
      ATT: Exchange MTU Response (0x03) len 2
        Server RX MTU: 23
< HCI Command: Host Number of Compl.. (0x03|0x0035) plen 5  #56 [hci1] 6.067932
        Num handles: 1
        Handle: 1947 Address: DF:A9:FF:F6:B1:1A (OUI DF-A9-FF)
        Count: 1
< ACL Data TX: Handle 1947 flags 0x00 dlen 11               #57 [hci1] 6.068031
      SMP: Pairing Response (0x02) len 6
        IO capability: DisplayOnly (0x00)
        OOB data: Authentication data not present (0x00)
        Authentication requirement: Bonding, No MITM, SC, No Keypresses (0x09)
        Max encryption key size: 16
        Initiator key distribution: IdKey (0x02)
        Responder key distribution: <none> (0x00)
< HCI Command: Host Number of Compl.. (0x03|0x0035) plen 5  #58 [hci1] 6.068293
        Num handles: 1
        Handle: 1947 Address: DF:A9:FF:F6:B1:1A (OUI DF-A9-FF)
        Count: 1
> HCI Event: Number of Completed Packets (0x13) plen 5      #59 [hci1] 6.236294
        Num handles: 1
        Handle: 1947 Address: DF:A9:FF:F6:B1:1A (OUI DF-A9-FF)
        Count: 1
        #57: len 11 (0 Kb/s)
        Latency: 168 msec (154-168 msec ~161 msec)
> ACL Data RX: Handle 1947 flags 0x02 dlen 27               #60 [hci1] 6.236580
> ACL Data RX: Handle 1947 flags 0x01 dlen 27               #61 [hci1] 6.237028
> ACL Data RX: Handle 1947 flags 0x01 dlen 15               #62 [hci1] 6.237484
      SMP: Pairing Public Key (0x0c) len 64
        X: e7e3a66f91083ad36c0fa076d048762ab23fe6f3c106738de7770f88fcd4752a
        Y: d4b8b211a0dd4432ca5fac865240666fbc2296ac7aa99df756044a68e51c42a0
< HCI Command: Host Number of Compl.. (0x03|0x0035) plen 5  #63 [hci1] 6.248667
        Num handles: 1
        Handle: 1947 Address: DF:A9:FF:F6:B1:1A (OUI DF-A9-FF)
        Count: 1
< HCI Command: Host Number of Compl.. (0x03|0x0035) plen 5  #64 [hci1] 6.248984
        Num handles: 1
        Handle: 1947 Address: DF:A9:FF:F6:B1:1A (OUI DF-A9-FF)
        Count: 1
< HCI Command: Host Number of Compl.. (0x03|0x0035) plen 5  #65 [hci1] 6.249441
        Num handles: 1
        Handle: 1947 Address: DF:A9:FF:F6:B1:1A (OUI DF-A9-FF)
        Count: 1
< ACL Data TX: Handle 1947 flags 0x00 dlen 27               #66 [hci1] 6.249519
< ACL Data TX: Handle 1947 flags 0x01 dlen 27               #67 [hci1] 6.249585
< ACL Data TX: Handle 1947 flags 0x01 dlen 15               #68 [hci1] 6.249597
      SMP: Pairing Public Key (0x0c) len 64
        X: 98308440221e2d910f0e54b71e7ec652857aa9b5a0dc65028824cc19db1226e9
        Y: 67a4816bcb62efb21701e31fdb27561a6217575fb007a8bbdabe7e28b6f68482
> HCI Event: Number of Completed Packets (0x13) plen 5      #69 [hci1] 6.324100
        Num handles: 1
        Handle: 1947 Address: DF:A9:FF:F6:B1:1A (OUI DF-A9-FF)
        Count: 1
        #66: len 27 (2 Kb/s)
        Latency: 74 msec (74-168 msec ~118 msec)
> HCI Event: Number of Completed Packets (0x13) plen 5      #70 [hci1] 6.324724
        Num handles: 1
        Handle: 1947 Address: DF:A9:FF:F6:B1:1A (OUI DF-A9-FF)
        Count: 1
        #67: len 27 (2 Kb/s)
        Latency: 75 msec (74-168 msec ~96 msec)
> HCI Event: Number of Completed Packets (0x13) plen 5      #71 [hci1] 6.410971
        Num handles: 1
        Handle: 1947 Address: DF:A9:FF:F6:B1:1A (OUI DF-A9-FF)
        Count: 1
        #68: len 15 (0 Kb/s)
        Latency: 161 msec (74-168 msec ~128 msec)
> ACL Data RX: Handle 1947 flags 0x02 dlen 21               #72 [hci1] 7.373885
      SMP: Pairing Confirm (0x03) len 16
        Confim value: e09359e4164b92864fa7aa30784061a9
< HCI Command: Host Number of Compl.. (0x03|0x0035) plen 5  #73 [hci1] 7.387775
        Num handles: 1
        Handle: 1947 Address: DF:A9:FF:F6:B1:1A (OUI DF-A9-FF)
        Count: 1
< ACL Data TX: Handle 1947 flags 0x00 dlen 21               #74 [hci1] 7.387783
      SMP: Pairing Confirm (0x03) len 16
        Confim value: a7b06be1eeae99c8abcecd072164d7e1
> HCI Event: Number of Completed Packets (0x13) plen 5      #75 [hci1] 7.548605
        Num handles: 1
        Handle: 1947 Address: DF:A9:FF:F6:B1:1A (OUI DF-A9-FF)
        Count: 1
        #74: len 21 (1 Kb/s)
        Latency: 160 msec (74-168 msec ~144 msec)
> ACL Data RX: Handle 1947 flags 0x02 dlen 21               #76 [hci1] 7.548944
      SMP: Pairing Random (0x04) len 16
        Random value: 90fd193b050da0490000000000000000
< HCI Command: Host Number of Compl.. (0x03|0x0035) plen 5  #77 [hci1] 7.568579
        Num handles: 1
        Handle: 1947 Address: DF:A9:FF:F6:B1:1A (OUI DF-A9-FF)
        Count: 1
< ACL Data TX: Handle 1947 flags 0x00 dlen 21               #78 [hci1] 7.568736
      SMP: Pairing Random (0x04) len 16
        Random value: 8e6108f966a694cbe26df70bb96773e6
> HCI Event: Number of Completed Packets (0x13) plen 5      #79 [hci1] 7.723386
        Num handles: 1
        Handle: 1947 Address: DF:A9:FF:F6:B1:1A (OUI DF-A9-FF)
        Count: 1
        #78: len 21 (1 Kb/s)
        Latency: 154 msec (74-168 msec ~149 msec)
> ACL Data RX: Handle 1947 flags 0x02 dlen 21               #80 [hci1] 7.811286
      SMP: Pairing Confirm (0x03) len 16
        Confim value: 2d523d6288e447f64792f6e07840a921
< HCI Command: Host Number of Compl.. (0x03|0x0035) plen 5  #81 [hci1] 7.828223
        Num handles: 1
        Handle: 1947 Address: DF:A9:FF:F6:B1:1A (OUI DF-A9-FF)
        Count: 1
< ACL Data TX: Handle 1947 flags 0x00 dlen 21               #82 [hci1] 7.828404
      SMP: Pairing Confirm (0x03) len 16
        Confim value: c30f1ff9204ae83600fdce9abd075a58
> HCI Event: Number of Completed Packets (0x13) plen 5      #83 [hci1] 7.986096
        Num handles: 1
        Handle: 1947 Address: DF:A9:FF:F6:B1:1A (OUI DF-A9-FF)
        Count: 1
        #82: len 21 (1 Kb/s)
        Latency: 157 msec (74-168 msec ~153 msec)
> ACL Data RX: Handle 1947 flags 0x02 dlen 21               #84 [hci1] 7.986418
      SMP: Pairing Random (0x04) len 16
        Random value: de231c98db8f8a100000000000000000
< HCI Command: Host Number of Compl.. (0x03|0x0035) plen 5  #85 [hci1] 7.988267
        Num handles: 1
        Handle: 1947 Address: DF:A9:FF:F6:B1:1A (OUI DF-A9-FF)
        Count: 1
< ACL Data TX: Handle 1947 flags 0x00 dlen 21               #86 [hci1] 7.988387
      SMP: Pairing Random (0x04) len 16
        Random value: 4d02679f89a05211af56d8b3da64d21e
> HCI Event: Number of Completed Packets (0x13) plen 5      #87 [hci1] 8.160907
        Num handles: 1
        Handle: 1947 Address: DF:A9:FF:F6:B1:1A (OUI DF-A9-FF)
        Count: 1
        #86: len 21 (0 Kb/s)
        Latency: 172 msec (74-172 msec ~163 msec)
> ACL Data RX: Handle 1947 flags 0x02 dlen 21               #88 [hci1] 8.248683
      SMP: Pairing Confirm (0x03) len 16
        Confim value: 3c245f9ae36e24bc149bd32764742d0a
< HCI Command: Host Number of Compl.. (0x03|0x0035) plen 5  #89 [hci1] 8.267784
        Num handles: 1
        Handle: 1947 Address: DF:A9:FF:F6:B1:1A (OUI DF-A9-FF)
        Count: 1
< ACL Data TX: Handle 1947 flags 0x00 dlen 21               #90 [hci1] 8.267870
      SMP: Pairing Confirm (0x03) len 16
        Confim value: bcd458276b5cf831fb4fb8be04ba612b
> HCI Event: Number of Completed Packets (0x13) plen 5      #91 [hci1] 8.423565
        Num handles: 1
        Handle: 1947 Address: DF:A9:FF:F6:B1:1A (OUI DF-A9-FF)
        Count: 1
        #90: len 21 (1 Kb/s)
        Latency: 155 msec (74-172 msec ~159 msec)
> ACL Data RX: Handle 1947 flags 0x02 dlen 21               #92 [hci1] 8.423928
      SMP: Pairing Random (0x04) len 16
        Random value: 583d6e22544c81690000000000000000
< HCI Command: Host Number of Compl.. (0x03|0x0035) plen 5  #93 [hci1] 8.428420
        Num handles: 1
        Handle: 1947 Address: DF:A9:FF:F6:B1:1A (OUI DF-A9-FF)
        Count: 1
< ACL Data TX: Handle 1947 flags 0x00 dlen 21               #94 [hci1] 8.428571
      SMP: Pairing Random (0x04) len 16
        Random value: 5e8286bc235a02440d0c3424a2acf8fd
> HCI Event: Number of Completed Packets (0x13) plen 5      #95 [hci1] 8.598350
        Num handles: 1
        Handle: 1947 Address: DF:A9:FF:F6:B1:1A (OUI DF-A9-FF)
        Count: 1
        #94: len 21 (0 Kb/s)
        Latency: 169 msec (74-172 msec ~164 msec)
> ACL Data RX: Handle 1947 flags 0x02 dlen 21               #96 [hci1] 8.686181
      SMP: Pairing Confirm (0x03) len 16
        Confim value: ac52b5f2755b1e4b9971fb76018883ca
< HCI Command: Host Number of Compl.. (0x03|0x0035) plen 5  #97 [hci1] 8.687903
        Num handles: 1
        Handle: 1947 Address: DF:A9:FF:F6:B1:1A (OUI DF-A9-FF)
        Count: 1
< ACL Data TX: Handle 1947 flags 0x00 dlen 21               #98 [hci1] 8.687993
      SMP: Pairing Confirm (0x03) len 16
        Confim value: b10ad801b1efbcc4d7efdca9ac22c2ad
> HCI Event: Number of Completed Packets (0x13) plen 5      #99 [hci1] 8.861079
        Num handles: 1
        Handle: 1947 Address: DF:A9:FF:F6:B1:1A (OUI DF-A9-FF)
        Count: 1
        #98: len 21 (0 Kb/s)
        Latency: 173 msec (74-173 msec ~168 msec)
> ACL Data RX: Handle 1947 flags 0x02 dlen 21              #100 [hci1] 8.861402
      SMP: Pairing Random (0x04) len 16
        Random value: c9991c6c6d5e67950000000000000000
< HCI Command: Host Number of Comp.. (0x03|0x0035) plen 5  #101 [hci1] 8.868453
        Num handles: 1
        Handle: 1947 Address: DF:A9:FF:F6:B1:1A (OUI DF-A9-FF)
        Count: 1
< ACL Data TX: Handle 1947 flags 0x00 dlen 21              #102 [hci1] 8.868670
      SMP: Pairing Random (0x04) len 16
        Random value: 5c4a1bcadd27bd58e945097b00bad7ac
> HCI Event: Number of Completed Packets (0x13) plen 5     #103 [hci1] 9.035897
        Num handles: 1
        Handle: 1947 Address: DF:A9:FF:F6:B1:1A (OUI DF-A9-FF)
        Count: 1
        #102: len 21 (1 Kb/s)
        Latency: 167 msec (74-173 msec ~168 msec)
> ACL Data RX: Handle 1947 flags 0x02 dlen 21              #104 [hci1] 9.123735
      SMP: Pairing Confirm (0x03) len 16
        Confim value: b892eb16a572240ca954828c7dc3d6c4
< HCI Command: Host Number of Comp.. (0x03|0x0035) plen 5  #105 [hci1] 9.128192
        Num handles: 1
        Handle: 1947 Address: DF:A9:FF:F6:B1:1A (OUI DF-A9-FF)
        Count: 1
< ACL Data TX: Handle 1947 flags 0x00 dlen 21              #106 [hci1] 9.128356
      SMP: Pairing Confirm (0x03) len 16
        Confim value: 47459da305e4d697dcc8ea5134649c51
> HCI Event: Number of Completed Packets (0x13) plen 5     #107 [hci1] 9.298645
        Num handles: 1
        Handle: 1947 Address: DF:A9:FF:F6:B1:1A (OUI DF-A9-FF)
        Count: 1
        #106: len 21 (0 Kb/s)
        Latency: 170 msec (74-173 msec ~169 msec)
> ACL Data RX: Handle 1947 flags 0x02 dlen 21              #108 [hci1] 9.298992
      SMP: Pairing Random (0x04) len 16
        Random value: d05d324cf399bf900000000000000000
< HCI Command: Host Number of Comp.. (0x03|0x0035) plen 5  #109 [hci1] 9.308453
        Num handles: 1
        Handle: 1947 Address: DF:A9:FF:F6:B1:1A (OUI DF-A9-FF)
        Count: 1
< ACL Data TX: Handle 1947 flags 0x00 dlen 21              #110 [hci1] 9.308636
      SMP: Pairing Random (0x04) len 16
        Random value: 32527e6e64e79f33b2e374394db8ab2d
> HCI Event: Number of Completed Packets (0x13) plen 5     #111 [hci1] 9.473370
        Num handles: 1
        Handle: 1947 Address: DF:A9:FF:F6:B1:1A (OUI DF-A9-FF)
        Count: 1
        #110: len 21 (1 Kb/s)
        Latency: 164 msec (74-173 msec ~166 msec)
> ACL Data RX: Handle 1947 flags 0x02 dlen 21              #112 [hci1] 9.561141
      SMP: Pairing Confirm (0x03) len 16
        Confim value: 6c1b07dd6077b6464e708e38d7953e21
< HCI Command: Host Number of Comp.. (0x03|0x0035) plen 5  #113 [hci1] 9.568039
        Num handles: 1
        Handle: 1947 Address: DF:A9:FF:F6:B1:1A (OUI DF-A9-FF)
        Count: 1
< ACL Data TX: Handle 1947 flags 0x00 dlen 21              #114 [hci1] 9.568195
      SMP: Pairing Confirm (0x03) len 16
        Confim value: 59c715d728fcbee593083f441414c63a
> HCI Event: Number of Completed Packets (0x13) plen 5     #115 [hci1] 9.735975
        Num handles: 1
        Handle: 1947 Address: DF:A9:FF:F6:B1:1A (OUI DF-A9-FF)
        Count: 1
        #114: len 21 (1 Kb/s)
        Latency: 167 msec (74-173 msec ~167 msec)
> ACL Data RX: Handle 1947 flags 0x02 dlen 21              #116 [hci1] 9.736382
      SMP: Pairing Random (0x04) len 16
        Random value: 09607f5bfc51242b0000000000000000
< HCI Command: Host Number of Comp.. (0x03|0x0035) plen 5  #117 [hci1] 9.748423
        Num handles: 1
        Handle: 1947 Address: DF:A9:FF:F6:B1:1A (OUI DF-A9-FF)
        Count: 1
< ACL Data TX: Handle 1947 flags 0x00 dlen 21              #118 [hci1] 9.748623
      SMP: Pairing Random (0x04) len 16
        Random value: dddbdfe2838e9a8cc6964353c850fef7
> HCI Event: Number of Completed Packets (0x13) plen 5     #119 [hci1] 9.910826
        Num handles: 1
        Handle: 1947 Address: DF:A9:FF:F6:B1:1A (OUI DF-A9-FF)
        Count: 1
        #118: len 21 (1 Kb/s)
        Latency: 162 msec (74-173 msec ~164 msec)
> ACL Data RX: Handle 1947 flags 0x02 dlen 21              #120 [hci1] 9.998665
      SMP: Pairing Confirm (0x03) len 16
        Confim value: 3a8813e804eadc9e848f4cc0f12cb589
< HCI Command: Host Number of Com.. (0x03|0x0035) plen 5  #121 [hci1] 10.008342
        Num handles: 1
        Handle: 1947 Address: DF:A9:FF:F6:B1:1A (OUI DF-A9-FF)
        Count: 1
< ACL Data TX: Handle 1947 flags 0x00 dlen 21             #122 [hci1] 10.008479
      SMP: Pairing Confirm (0x03) len 16
        Confim value: 572ebf160ae5c18722d264904a0151ae
> HCI Event: Number of Completed Packets (0x13) plen 5    #123 [hci1] 10.173475
        Num handles: 1
        Handle: 1947 Address: DF:A9:FF:F6:B1:1A (OUI DF-A9-FF)
        Count: 1
        #122: len 21 (1 Kb/s)
        Latency: 164 msec (74-173 msec ~164 msec)
> ACL Data RX: Handle 1947 flags 0x02 dlen 21             #124 [hci1] 10.174000
      SMP: Pairing Random (0x04) len 16
        Random value: c7958321ea1a0d950000000000000000
< HCI Command: Host Number of Com.. (0x03|0x0035) plen 5  #125 [hci1] 10.188303
        Num handles: 1
        Handle: 1947 Address: DF:A9:FF:F6:B1:1A (OUI DF-A9-FF)
        Count: 1
< ACL Data TX: Handle 1947 flags 0x00 dlen 21             #126 [hci1] 10.188448
      SMP: Pairing Random (0x04) len 16
        Random value: eb9f1915536596b6fc3db1c86b2b1970
> HCI Event: Number of Completed Packets (0x13) plen 5    #127 [hci1] 10.348327
        Num handles: 1
        Handle: 1947 Address: DF:A9:FF:F6:B1:1A (OUI DF-A9-FF)
        Count: 1
        #126: len 21 (1 Kb/s)
        Latency: 159 msec (74-173 msec ~162 msec)
> ACL Data RX: Handle 1947 flags 0x02 dlen 21             #128 [hci1] 10.436149
      SMP: Pairing Confirm (0x03) len 16
        Confim value: 85e38ac2f52de5a2e59ba1a2e0cc4dbe
< HCI Command: Host Number of Com.. (0x03|0x0035) plen 5  #129 [hci1] 10.447903
        Num handles: 1
        Handle: 1947 Address: DF:A9:FF:F6:B1:1A (OUI DF-A9-FF)
        Count: 1
< ACL Data TX: Handle 1947 flags 0x00 dlen 21             #130 [hci1] 10.448004
      SMP: Pairing Confirm (0x03) len 16
        Confim value: 378781c8f9f5d85f042a3821d2c260ae
> HCI Event: Number of Completed Packets (0x13) plen 5    #131 [hci1] 10.610977
        Num handles: 1
        Handle: 1947 Address: DF:A9:FF:F6:B1:1A (OUI DF-A9-FF)
        Count: 1
        #130: len 21 (1 Kb/s)
        Latency: 162 msec (74-173 msec ~162 msec)
> ACL Data RX: Handle 1947 flags 0x02 dlen 21             #132 [hci1] 10.611371
      SMP: Pairing Random (0x04) len 16
        Random value: 202d93dc48b0e0580000000000000000
< HCI Command: Host Number of Com.. (0x03|0x0035) plen 5  #133 [hci1] 10.628405
        Num handles: 1
        Handle: 1947 Address: DF:A9:FF:F6:B1:1A (OUI DF-A9-FF)
        Count: 1
< ACL Data TX: Handle 1947 flags 0x00 dlen 21             #134 [hci1] 10.628532
      SMP: Pairing Random (0x04) len 16
        Random value: 5c794dc9ad9f2c3f295ebd5ad5e1c3cf
> HCI Event: Number of Completed Packets (0x13) plen 5    #135 [hci1] 10.785813
        Num handles: 1
        Handle: 1947 Address: DF:A9:FF:F6:B1:1A (OUI DF-A9-FF)
        Count: 1
        #134: len 21 (1 Kb/s)
        Latency: 157 msec (74-173 msec ~159 msec)
> ACL Data RX: Handle 1947 flags 0x02 dlen 21             #136 [hci1] 10.873633
      SMP: Pairing Confirm (0x03) len 16
        Confim value: c74a3c951de6ada868ef66ddc45a7f22
< HCI Command: Host Number of Com.. (0x03|0x0035) plen 5  #137 [hci1] 10.888345
        Num handles: 1
        Handle: 1947 Address: DF:A9:FF:F6:B1:1A (OUI DF-A9-FF)
        Count: 1
< ACL Data TX: Handle 1947 flags 0x00 dlen 21             #138 [hci1] 10.888561
      SMP: Pairing Confirm (0x03) len 16
        Confim value: 79b484b12c3c9c4ee98d469ff5a7a8b8
> HCI Event: Number of Completed Packets (0x13) plen 5    #139 [hci1] 11.048454
        Num handles: 1
        Handle: 1947 Address: DF:A9:FF:F6:B1:1A (OUI DF-A9-FF)
        Count: 1
        #138: len 21 (1 Kb/s)
        Latency: 159 msec (74-173 msec ~159 msec)
> ACL Data RX: Handle 1947 flags 0x02 dlen 21             #140 [hci1] 11.048786
      SMP: Pairing Random (0x04) len 16
        Random value: 7068f643aaf25e130000000000000000
< HCI Command: Host Number of Com.. (0x03|0x0035) plen 5  #141 [hci1] 11.068516
        Num handles: 1
        Handle: 1947 Address: DF:A9:FF:F6:B1:1A (OUI DF-A9-FF)
        Count: 1
< ACL Data TX: Handle 1947 flags 0x00 dlen 21             #142 [hci1] 11.068738
      SMP: Pairing Random (0x04) len 16
        Random value: 5c2fff312cdf99c9491988e877355a9a
> HCI Event: Number of Completed Packets (0x13) plen 5    #143 [hci1] 11.223289
        Num handles: 1
        Handle: 1947 Address: DF:A9:FF:F6:B1:1A (OUI DF-A9-FF)
        Count: 1
        #142: len 21 (1 Kb/s)
        Latency: 154 msec (74-173 msec ~157 msec)
> ACL Data RX: Handle 1947 flags 0x02 dlen 21             #144 [hci1] 11.311114
      SMP: Pairing Confirm (0x03) len 16
        Confim value: e14dad962184f41a453794970ffdffeb
< HCI Command: Host Number of Com.. (0x03|0x0035) plen 5  #145 [hci1] 11.328260
        Num handles: 1
        Handle: 1947 Address: DF:A9:FF:F6:B1:1A (OUI DF-A9-FF)
        Count: 1
< ACL Data TX: Handle 1947 flags 0x00 dlen 21             #146 [hci1] 11.328422
      SMP: Pairing Confirm (0x03) len 16
        Confim value: df0b25e67cca85b0aa3ea062c59646b2
> HCI Event: Number of Completed Packets (0x13) plen 5    #147 [hci1] 11.486039
        Num handles: 1
        Handle: 1947 Address: DF:A9:FF:F6:B1:1A (OUI DF-A9-FF)
        Count: 1
        #146: len 21 (1 Kb/s)
        Latency: 157 msec (74-173 msec ~157 msec)
> ACL Data RX: Handle 1947 flags 0x02 dlen 21             #148 [hci1] 11.486235
      SMP: Pairing Random (0x04) len 16
        Random value: b81197fed9146ce60000000000000000
< HCI Command: Host Number of Com.. (0x03|0x0035) plen 5  #149 [hci1] 11.488441
        Num handles: 1
        Handle: 1947 Address: DF:A9:FF:F6:B1:1A (OUI DF-A9-FF)
        Count: 1
< ACL Data TX: Handle 1947 flags 0x00 dlen 21             #150 [hci1] 11.488561
      SMP: Pairing Random (0x04) len 16
        Random value: c629a3a987d808e808655d558dfc1155
> HCI Event: Number of Completed Packets (0x13) plen 5    #151 [hci1] 11.660794
        Num handles: 1
        Handle: 1947 Address: DF:A9:FF:F6:B1:1A (OUI DF-A9-FF)
        Count: 1
        #150: len 21 (0 Kb/s)
        Latency: 172 msec (74-173 msec ~164 msec)
> ACL Data RX: Handle 1947 flags 0x02 dlen 21             #152 [hci1] 11.748630
      SMP: Pairing Confirm (0x03) len 16
        Confim value: 9d2cab2b9f2de34d9c3dc925ed80c8a8
< HCI Command: Host Number of Com.. (0x03|0x0035) plen 5  #153 [hci1] 11.768191
        Num handles: 1
        Handle: 1947 Address: DF:A9:FF:F6:B1:1A (OUI DF-A9-FF)
        Count: 1
< ACL Data TX: Handle 1947 flags 0x00 dlen 21             #154 [hci1] 11.768279
      SMP: Pairing Confirm (0x03) len 16
        Confim value: 907a75d3ed825cf26a6962d80251cc33
> HCI Event: Number of Completed Packets (0x13) plen 5    #155 [hci1] 11.923498
        Num handles: 1
        Handle: 1947 Address: DF:A9:FF:F6:B1:1A (OUI DF-A9-FF)
        Count: 1
        #154: len 21 (1 Kb/s)
        Latency: 155 msec (74-173 msec ~160 msec)
> ACL Data RX: Handle 1947 flags 0x02 dlen 21             #156 [hci1] 11.923788
      SMP: Pairing Random (0x04) len 16
        Random value: d7160d64829df7330000000000000000
< HCI Command: Host Number of Com.. (0x03|0x0035) plen 5  #157 [hci1] 11.928533
        Num handles: 1
        Handle: 1947 Address: DF:A9:FF:F6:B1:1A (OUI DF-A9-FF)
        Count: 1
< ACL Data TX: Handle 1947 flags 0x00 dlen 21             #158 [hci1] 11.928633
      SMP: Pairing Random (0x04) len 16
        Random value: 92f20f6ad8f13724432c7fd6001c45ff
> HCI Event: Number of Completed Packets (0x13) plen 5    #159 [hci1] 12.098242
        Num handles: 1
        Handle: 1947 Address: DF:A9:FF:F6:B1:1A (OUI DF-A9-FF)
        Count: 1
        #158: len 21 (0 Kb/s)
        Latency: 169 msec (74-173 msec ~164 msec)
> ACL Data RX: Handle 1947 flags 0x02 dlen 21             #160 [hci1] 12.186080
      SMP: Pairing Confirm (0x03) len 16
        Confim value: cd243e01160830b8ef11979c6f6e3894
< HCI Command: Host Number of Com.. (0x03|0x0035) plen 5  #161 [hci1] 12.187853
        Num handles: 1
        Handle: 1947 Address: DF:A9:FF:F6:B1:1A (OUI DF-A9-FF)
        Count: 1
< ACL Data TX: Handle 1947 flags 0x00 dlen 21             #162 [hci1] 12.187911
      SMP: Pairing Confirm (0x03) len 16
        Confim value: 4d8fe8dcefc51886c7e12f81a127dfff
> HCI Event: Number of Completed Packets (0x13) plen 5    #163 [hci1] 12.360976
        Num handles: 1
        Handle: 1947 Address: DF:A9:FF:F6:B1:1A (OUI DF-A9-FF)
        Count: 1
        #162: len 21 (0 Kb/s)
        Latency: 173 msec (74-173 msec ~168 msec)
> ACL Data RX: Handle 1947 flags 0x02 dlen 21             #164 [hci1] 12.361240
      SMP: Pairing Random (0x04) len 16
        Random value: 45dbfa61ea4640eb0000000000000000
< HCI Command: Host Number of Com.. (0x03|0x0035) plen 5  #165 [hci1] 12.367743
        Num handles: 1
        Handle: 1947 Address: DF:A9:FF:F6:B1:1A (OUI DF-A9-FF)
        Count: 1
< ACL Data TX: Handle 1947 flags 0x00 dlen 21             #166 [hci1] 12.367837
      SMP: Pairing Random (0x04) len 16
        Random value: 23ac32ebbb5e14c8a6b9622f296d277f
> HCI Event: Number of Completed Packets (0x13) plen 5    #167 [hci1] 12.535680
        Num handles: 1
        Handle: 1947 Address: DF:A9:FF:F6:B1:1A (OUI DF-A9-FF)
        Count: 1
        #166: len 21 (1 Kb/s)
        Latency: 167 msec (74-173 msec ~168 msec)
> ACL Data RX: Handle 1947 flags 0x02 dlen 21             #168 [hci1] 12.623589
      SMP: Pairing Confirm (0x03) len 16
        Confim value: c9f5267284b2f876f32a5ce29c1dd692
< HCI Command: Host Number of Com.. (0x03|0x0035) plen 5  #169 [hci1] 12.628217
        Num handles: 1
        Handle: 1947 Address: DF:A9:FF:F6:B1:1A (OUI DF-A9-FF)
        Count: 1
< ACL Data TX: Handle 1947 flags 0x00 dlen 21             #170 [hci1] 12.628315
      SMP: Pairing Confirm (0x03) len 16
        Confim value: 13e9c45a38db83cab757c31a22f8b4f6
> HCI Event: Number of Completed Packets (0x13) plen 5    #171 [hci1] 12.798406
        Num handles: 1
        Handle: 1947 Address: DF:A9:FF:F6:B1:1A (OUI DF-A9-FF)
        Count: 1
        #170: len 21 (0 Kb/s)
        Latency: 170 msec (74-173 msec ~169 msec)
> ACL Data RX: Handle 1947 flags 0x02 dlen 21             #172 [hci1] 12.798751
      SMP: Pairing Random (0x04) len 16
        Random value: 51f2248b410d21400000000000000000
< HCI Command: Host Number of Com.. (0x03|0x0035) plen 5  #173 [hci1] 12.808428
        Num handles: 1
        Handle: 1947 Address: DF:A9:FF:F6:B1:1A (OUI DF-A9-FF)
        Count: 1
< ACL Data TX: Handle 1947 flags 0x00 dlen 21             #174 [hci1] 12.808527
      SMP: Pairing Random (0x04) len 16
        Random value: 297efe85e67448a15f56bd27e3a3cf1d
> HCI Event: Number of Completed Packets (0x13) plen 5    #175 [hci1] 12.973253
        Num handles: 1
        Handle: 1947 Address: DF:A9:FF:F6:B1:1A (OUI DF-A9-FF)
        Count: 1
        #174: len 21 (1 Kb/s)
        Latency: 164 msec (74-173 msec ~166 msec)
> ACL Data RX: Handle 1947 flags 0x02 dlen 21             #176 [hci1] 13.061053
      SMP: Pairing Confirm (0x03) len 16
        Confim value: 61b6deac161e998630b07720e1fbbd35
< HCI Command: Host Number of Com.. (0x03|0x0035) plen 5  #177 [hci1] 13.068238
        Num handles: 1
        Handle: 1947 Address: DF:A9:FF:F6:B1:1A (OUI DF-A9-FF)
        Count: 1
< ACL Data TX: Handle 1947 flags 0x00 dlen 21             #178 [hci1] 13.068449
      SMP: Pairing Confirm (0x03) len 16
        Confim value: d1b20805d65ecbe94aace4428ace92b8
> HCI Event: Number of Completed Packets (0x13) plen 5    #179 [hci1] 13.235901
        Num handles: 1
        Handle: 1947 Address: DF:A9:FF:F6:B1:1A (OUI DF-A9-FF)
        Count: 1
        #178: len 21 (1 Kb/s)
        Latency: 167 msec (74-173 msec ~167 msec)
> ACL Data RX: Handle 1947 flags 0x02 dlen 21             #180 [hci1] 13.236218
      SMP: Pairing Random (0x04) len 16
        Random value: 915bb836c45953560000000000000000
< HCI Command: Host Number of Com.. (0x03|0x0035) plen 5  #181 [hci1] 13.247988
        Num handles: 1
        Handle: 1947 Address: DF:A9:FF:F6:B1:1A (OUI DF-A9-FF)
        Count: 1
< ACL Data TX: Handle 1947 flags 0x00 dlen 21             #182 [hci1] 13.248031
      SMP: Pairing Random (0x04) len 16
        Random value: 25a9493fd3ce4faf02be7293595bb7c6
> HCI Event: Number of Completed Packets (0x13) plen 5    #183 [hci1] 13.410709
        Num handles: 1
        Handle: 1947 Address: DF:A9:FF:F6:B1:1A (OUI DF-A9-FF)
        Count: 1
        #182: len 21 (1 Kb/s)
        Latency: 162 msec (74-173 msec ~164 msec)
> ACL Data RX: Handle 1947 flags 0x02 dlen 21             #184 [hci1] 13.498642
      SMP: Pairing Confirm (0x03) len 16
        Confim value: 4045ed1f694f24606e9ed4ea421774da
< HCI Command: Host Number of Com.. (0x03|0x0035) plen 5  #185 [hci1] 13.508345
        Num handles: 1
        Handle: 1947 Address: DF:A9:FF:F6:B1:1A (OUI DF-A9-FF)
        Count: 1
< ACL Data TX: Handle 1947 flags 0x00 dlen 21             #186 [hci1] 13.508426
      SMP: Pairing Confirm (0x03) len 16
        Confim value: f31be1cf65267030751fd4e932d34d26
> HCI Event: Number of Completed Packets (0x13) plen 5    #187 [hci1] 13.673484
        Num handles: 1
        Handle: 1947 Address: DF:A9:FF:F6:B1:1A (OUI DF-A9-FF)
        Count: 1
        #186: len 21 (1 Kb/s)
        Latency: 165 msec (74-173 msec ~165 msec)
> ACL Data RX: Handle 1947 flags 0x02 dlen 21             #188 [hci1] 13.673730
      SMP: Pairing Random (0x04) len 16
        Random value: 2bfd2d3b717a38f40000000000000000
< HCI Command: Host Number of Com.. (0x03|0x0035) plen 5  #189 [hci1] 13.688520
        Num handles: 1
        Handle: 1947 Address: DF:A9:FF:F6:B1:1A (OUI DF-A9-FF)
        Count: 1
< ACL Data TX: Handle 1947 flags 0x00 dlen 21             #190 [hci1] 13.688674
      SMP: Pairing Random (0x04) len 16
        Random value: 58f6b41f855a6f6c3560debd84e2affc
> HCI Event: Number of Completed Packets (0x13) plen 5    #191 [hci1] 13.848267
        Num handles: 1
        Handle: 1947 Address: DF:A9:FF:F6:B1:1A (OUI DF-A9-FF)
        Count: 1
        #190: len 21 (1 Kb/s)
        Latency: 159 msec (74-173 msec ~162 msec)
> ACL Data RX: Handle 1947 flags 0x02 dlen 21             #192 [hci1] 13.936020
      SMP: Pairing Confirm (0x03) len 16
        Confim value: bf90bc8b217e8569dd7b788bdde7179e
< HCI Command: Host Number of Com.. (0x03|0x0035) plen 5  #193 [hci1] 13.948370
        Num handles: 1
        Handle: 1947 Address: DF:A9:FF:F6:B1:1A (OUI DF-A9-FF)
        Count: 1
< ACL Data TX: Handle 1947 flags 0x00 dlen 21             #194 [hci1] 13.948513
      SMP: Pairing Confirm (0x03) len 16
        Confim value: a30a7587685bd3e5447bac003e3cbb63
> HCI Event: Number of Completed Packets (0x13) plen 5    #195 [hci1] 14.111038
        Num handles: 1
        Handle: 1947 Address: DF:A9:FF:F6:B1:1A (OUI DF-A9-FF)
        Count: 1
        #194: len 21 (1 Kb/s)
        Latency: 162 msec (74-173 msec ~162 msec)
> ACL Data RX: Handle 1947 flags 0x02 dlen 21             #196 [hci1] 14.111237
      SMP: Pairing Random (0x04) len 16
        Random value: 1a375396c84d398d0000000000000000
< HCI Command: Host Number of Com.. (0x03|0x0035) plen 5  #197 [hci1] 14.127848
        Num handles: 1
        Handle: 1947 Address: DF:A9:FF:F6:B1:1A (OUI DF-A9-FF)
        Count: 1
< ACL Data TX: Handle 1947 flags 0x00 dlen 21             #198 [hci1] 14.127911
      SMP: Pairing Random (0x04) len 16
        Random value: b67e7216d5bf664139eda2b542549666
> HCI Event: Number of Completed Packets (0x13) plen 5    #199 [hci1] 14.285710
        Num handles: 1
        Handle: 1947 Address: DF:A9:FF:F6:B1:1A (OUI DF-A9-FF)
        Count: 1
        #198: len 21 (1 Kb/s)
        Latency: 157 msec (74-173 msec ~160 msec)
> ACL Data RX: Handle 1947 flags 0x02 dlen 21             #200 [hci1] 14.373484
      SMP: Pairing Confirm (0x03) len 16
        Confim value: 2d4f774e1113f562f9500cb8234a18cc
< HCI Command: Host Number of Com.. (0x03|0x0035) plen 5  #201 [hci1] 14.387787
        Num handles: 1
        Handle: 1947 Address: DF:A9:FF:F6:B1:1A (OUI DF-A9-FF)
        Count: 1
< ACL Data TX: Handle 1947 flags 0x00 dlen 21             #202 [hci1] 14.387869
      SMP: Pairing Confirm (0x03) len 16
        Confim value: 3c13841fcb2a87de0bf4b29f4f86c8bf
> HCI Event: Number of Completed Packets (0x13) plen 5    #203 [hci1] 14.548399
        Num handles: 1
        Handle: 1947 Address: DF:A9:FF:F6:B1:1A (OUI DF-A9-FF)
        Count: 1
        #202: len 21 (1 Kb/s)
        Latency: 160 msec (74-173 msec ~160 msec)
> ACL Data RX: Handle 1947 flags 0x02 dlen 21             #204 [hci1] 14.548700
      SMP: Pairing Random (0x04) len 16
        Random value: f05d53965a4fa4b80000000000000000
< HCI Command: Host Number of Com.. (0x03|0x0035) plen 5  #205 [hci1] 14.568541
        Num handles: 1
        Handle: 1947 Address: DF:A9:FF:F6:B1:1A (OUI DF-A9-FF)
        Count: 1
< ACL Data TX: Handle 1947 flags 0x00 dlen 21             #206 [hci1] 14.568722
      SMP: Pairing Random (0x04) len 16
        Random value: ed17f76500c95219dd01e09d1e63f87b
> HCI Event: Number of Completed Packets (0x13) plen 5    #207 [hci1] 14.723171
        Num handles: 1
        Handle: 1947 Address: DF:A9:FF:F6:B1:1A (OUI DF-A9-FF)
        Count: 1
        #206: len 21 (1 Kb/s)
        Latency: 154 msec (74-173 msec ~157 msec)
> ACL Data RX: Handle 1947 flags 0x02 dlen 21             #208 [hci1] 14.810993
      SMP: Pairing Confirm (0x03) len 16
        Confim value: 8ed49638d881bdeff70d5b61a8261cdf
< HCI Command: Host Number of Com.. (0x03|0x0035) plen 5  #209 [hci1] 14.828304
        Num handles: 1
        Handle: 1947 Address: DF:A9:FF:F6:B1:1A (OUI DF-A9-FF)
        Count: 1
< ACL Data TX: Handle 1947 flags 0x00 dlen 21             #210 [hci1] 14.828458
      SMP: Pairing Confirm (0x03) len 16
        Confim value: ea608a6c93df6c5a5254584f24863ef6
> HCI Event: Number of Completed Packets (0x13) plen 5    #211 [hci1] 14.985823
        Num handles: 1
        Handle: 1947 Address: DF:A9:FF:F6:B1:1A (OUI DF-A9-FF)
        Count: 1
        #210: len 21 (1 Kb/s)
        Latency: 157 msec (74-173 msec ~157 msec)
> ACL Data RX: Handle 1947 flags 0x02 dlen 21             #212 [hci1] 14.986241
      SMP: Pairing Random (0x04) len 16
        Random value: bebedd674b74c5720000000000000000
< HCI Command: Host Number of Com.. (0x03|0x0035) plen 5  #213 [hci1] 14.988373
        Num handles: 1
        Handle: 1947 Address: DF:A9:FF:F6:B1:1A (OUI DF-A9-FF)
        Count: 1
< ACL Data TX: Handle 1947 flags 0x00 dlen 21             #214 [hci1] 14.988569
      SMP: Pairing Random (0x04) len 16
        Random value: 81d35d47e1f6006d79c974bd9d9e1ee3
> HCI Event: Number of Completed Packets (0x13) plen 5    #215 [hci1] 15.160710
        Num handles: 1
        Handle: 1947 Address: DF:A9:FF:F6:B1:1A (OUI DF-A9-FF)
        Count: 1
        #214: len 21 (0 Kb/s)
        Latency: 172 msec (74-173 msec ~164 msec)
> ACL Data RX: Handle 1947 flags 0x02 dlen 21             #216 [hci1] 15.248562
      SMP: Pairing Confirm (0x03) len 16
        Confim value: 7154d6267575790ebfb63a202b806a06
< HCI Command: Host Number of Com.. (0x03|0x0035) plen 5  #217 [hci1] 15.268010
        Num handles: 1
        Handle: 1947 Address: DF:A9:FF:F6:B1:1A (OUI DF-A9-FF)
        Count: 1
< ACL Data TX: Handle 1947 flags 0x00 dlen 21             #218 [hci1] 15.268059
      SMP: Pairing Confirm (0x03) len 16
        Confim value: a1b9d4c15fa4f998d8c10fab57fa28ea
> HCI Event: Number of Completed Packets (0x13) plen 5    #219 [hci1] 15.423330
        Num handles: 1
        Handle: 1947 Address: DF:A9:FF:F6:B1:1A (OUI DF-A9-FF)
        Count: 1
        #218: len 21 (1 Kb/s)
        Latency: 155 msec (74-173 msec ~160 msec)
> ACL Data RX: Handle 1947 flags 0x02 dlen 21             #220 [hci1] 15.423660
      SMP: Pairing Random (0x04) len 16
        Random value: 7d91c54132a17b030000000000000000
< HCI Command: Host Number of Com.. (0x03|0x0035) plen 5  #221 [hci1] 15.428505
        Num handles: 1
        Handle: 1947 Address: DF:A9:FF:F6:B1:1A (OUI DF-A9-FF)
        Count: 1
< ACL Data TX: Handle 1947 flags 0x00 dlen 21             #222 [hci1] 15.428672
      SMP: Pairing Random (0x04) len 16
        Random value: e7f7e0c2476823e41736a7e381bafb7c
> HCI Event: Number of Completed Packets (0x13) plen 5    #223 [hci1] 15.598118
        Num handles: 1
        Handle: 1947 Address: DF:A9:FF:F6:B1:1A (OUI DF-A9-FF)
        Count: 1
        #222: len 21 (0 Kb/s)
        Latency: 169 msec (74-173 msec ~164 msec)
> ACL Data RX: Handle 1947 flags 0x02 dlen 21             #224 [hci1] 15.686040
      SMP: Pairing Confirm (0x03) len 16
        Confim value: b43e2435c9240ce4edbb62ff9942a71e
< HCI Command: Host Number of Com.. (0x03|0x0035) plen 5  #225 [hci1] 15.688369
        Num handles: 1
        Handle: 1947 Address: DF:A9:FF:F6:B1:1A (OUI DF-A9-FF)
        Count: 1
< ACL Data TX: Handle 1947 flags 0x00 dlen 21             #226 [hci1] 15.688492
      SMP: Pairing Confirm (0x03) len 16
        Confim value: c7d21d2455617a51cbd51f83449dc6a8
> HCI Event: Number of Completed Packets (0x13) plen 5    #227 [hci1] 15.860857
        Num handles: 1
        Handle: 1947 Address: DF:A9:FF:F6:B1:1A (OUI DF-A9-FF)
        Count: 1
        #226: len 21 (0 Kb/s)
        Latency: 172 msec (74-173 msec ~168 msec)
> ACL Data RX: Handle 1947 flags 0x02 dlen 21             #228 [hci1] 15.861148
      SMP: Pairing Random (0x04) len 16
        Random value: 30716bab2be789fe0000000000000000
