Bluetooth monitor ver 5.72
= Note: Linux version 6.14.0-36-generic (x86_64)                       0.440766
= Note: Bluetooth subsystem version 2.22                               0.440768
= New Index: 00:00:00:00:00:00 (Primary,UART,hci1)              [hci1] 0.440769
= New Index: 48:5F:99:8E:E0:64 (Primary,USB,hci0)               [hci0] 0.440769
= Open Index: 00:00:00:00:00:00                                 [hci1] 0.954551
= Index Info: 00:00:00:00:00:00 (Nordic Semiconductor ASA)      [hci1] 0.954564
@ USER Open: main (privileged) version 2.22            {0x0001} [hci1] 0.954572
< HCI Command: Reset (0x03|0x0003) plen 0                    #1 [hci1] 0.955854
> HCI Event: Command Complete (0x0e) plen 4                  #2 [hci1] 0.956455
      Reset (0x03|0x0003) ncmd 1
        Status: Success (0x00)
< HCI Command: Read Local Supported... (0x04|0x0003) plen 0  #3 [hci1] 0.974387
> HCI Event: Command Complete (0x0e) plen 12                 #4 [hci1] 0.974948
      Read Local Supported Features (0x04|0x0003) ncmd 1
        Status: Success (0x00)
        Features: 0x00 0x00 0x00 0x00 0x60 0x00 0x00 0x00
          BR/EDR Not Supported
          LE Supported (Controller)
< HCI Command: Read Local Version In.. (0x04|0x0001) plen 0  #5 [hci1] 0.994048
> HCI Event: Command Complete (0x0e) plen 12                 #6 [hci1] 0.994521
      Read Local Version Information (0x04|0x0001) ncmd 1
        Status: Success (0x00)
        HCI version: Reserved (0x0f) - Revision 12393 (0x3069)
        LMP version: Reserved (0x0f) - Subversion 12393 (0x3069)
        Manufacturer: Nordic Semiconductor ASA (89)
< HCI Command: Read Local Supported... (0x04|0x0002) plen 0  #7 [hci1] 1.013987
> HCI Event: Command Complete (0x0e) plen 68                 #8 [hci1] 1.015026
      Read Local Supported Commands (0x04|0x0002) ncmd 1
        Status: Success (0x00)
        Commands: 119 entries
          Disconnect (Octet 0 - Bit 5)
          Read Remote Version Information (Octet 2 - Bit 7)
          Set Event Mask (Octet 5 - Bit 6)
          Reset (Octet 5 - Bit 7)
          Read Connection Accept Timeout (Octet 7 - Bit 2)
          Write Connection Accept Timeout (Octet 7 - Bit 3)
          Read Transmit Power Level (Octet 10 - Bit 2)
          Set Controller To Host Flow Control (Octet 10 - Bit 5)
          Host Buffer Size (Octet 10 - Bit 6)
          Host Number of Completed Packets (Octet 10 - Bit 7)
          Read Local Version Information (Octet 14 - Bit 3)
          Read Local Supported Features (Octet 14 - Bit 5)
          Read BD ADDR (Octet 15 - Bit 1)
          Read RSSI (Octet 15 - Bit 5)
          Set Event Mask Page 2 (Octet 22 - Bit 2)
          LE Set Event Mask (Octet 25 - Bit 0)
          LE Read Buffer Size (Octet 25 - Bit 1)
          LE Read Local Supported Features (Octet 25 - Bit 2)
          LE Set Random Address (Octet 25 - Bit 4)
          LE Set Advertising Parameters (Octet 25 - Bit 5)
          LE Read Advertising Channel TX Power (Octet 25 - Bit 6)
          LE Set Advertising Data (Octet 25 - Bit 7)
          LE Set Scan Response Data (Octet 26 - Bit 0)
          LE Set Advertise Enable (Octet 26 - Bit 1)
          LE Set Scan Parameters (Octet 26 - Bit 2)
          LE Set Scan Enable (Octet 26 - Bit 3)
          LE Create Connection (Octet 26 - Bit 4)
          LE Create Connection Cancel (Octet 26 - Bit 5)
          LE Read Accept List Size (Octet 26 - Bit 6)
          LE Clear Accept List (Octet 26 - Bit 7)
          LE Add Device To Accept List (Octet 27 - Bit 0)
          LE Remove Device From Accept List (Octet 27 - Bit 1)
          LE Connection Update (Octet 27 - Bit 2)
          LE Set Host Channel Classification (Octet 27 - Bit 3)
          LE Read Channel Map (Octet 27 - Bit 4)
          LE Read Remote Used Features (Octet 27 - Bit 5)
          LE Encrypt (Octet 27 - Bit 6)
          LE Rand (Octet 27 - Bit 7)
          LE Start Encryption (Octet 28 - Bit 0)
          LE Long Term Key Request Reply (Octet 28 - Bit 1)
          LE Long Term Key Request Neg Reply (Octet 28 - Bit 2)
          LE Read Supported States (Octet 28 - Bit 3)
          LE Receiver Test (Octet 28 - Bit 4)
          LE Transmitter Test (Octet 28 - Bit 5)
          LE Test End (Octet 28 - Bit 6)
          Read Authenticated Payload Timeout (Octet 32 - Bit 4)
          Write Authenticated Payload Timeout (Octet 32 - Bit 5)
          LE Set Data Length (Octet 33 - Bit 6)
          LE Read Suggested Default Data Length (Octet 33 - Bit 7)
          LE Write Suggested Default Data Length (Octet 34 - Bit 0)
          LE Add Device To Resolving List (Octet 34 - Bit 3)
          LE Remove Device From Resolving List (Octet 34 - Bit 4)
          LE Clear Resolving List (Octet 34 - Bit 5)
          LE Read Resolving List Size (Octet 34 - Bit 6)
          LE Set Address Resolution Enable (Octet 35 - Bit 1)
          LE Set Resolvable Private Address Timeout (Octet 35 - Bit 2)
          LE Read Maximum Data Length (Octet 35 - Bit 3)
          LE Read PHY (Octet 35 - Bit 4)
          LE Set Default PHY (Octet 35 - Bit 5)
          LE Set PHY (Octet 35 - Bit 6)
          LE Enhanced Receiver Test (Octet 35 - Bit 7)
          LE Enhanced Transmitter Test (Octet 36 - Bit 0)
          LE Set Advertising Set Random Address (Octet 36 - Bit 1)
          LE Set Extended Advertising Parameters (Octet 36 - Bit 2)
          LE Set Extended Advertising Data (Octet 36 - Bit 3)
          LE Set Extended Scan Response Data (Octet 36 - Bit 4)
          LE Set Extended Advertising Enable (Octet 36 - Bit 5)
          LE Read Maximum Advertising Data Length (Octet 36 - Bit 6)
          LE Read Number of Supported Advertising Sets (Octet 36 - Bit 7)
          LE Remove Advertising Set (Octet 37 - Bit 0)
          LE Clear Advertising Sets (Octet 37 - Bit 1)
          LE Set Periodic Advertising Parameters (Octet 37 - Bit 2)
          LE Set Periodic Advertising Data (Octet 37 - Bit 3)
          LE Set Periodic Advertising Enable (Octet 37 - Bit 4)
          LE Set Extended Scan Parameters (Octet 37 - Bit 5)
          LE Set Extended Scan Enable (Octet 37 - Bit 6)
          LE Extended Create Connection (Octet 37 - Bit 7)
          LE Periodic Advertising Create Sync (Octet 38 - Bit 0)
          LE Periodic Advertising Create Sync Cancel (Octet 38 - Bit 1)
          LE Periodic Advertising Terminate Sync (Octet 38 - Bit 2)
          LE Add Device To Periodic Advertiser List (Octet 38 - Bit 3)
          LE Remove Device From Periodic Advertiser List (Octet 38 - Bit 4)
          LE Clear Periodic Advertiser List (Octet 38 - Bit 5)
          LE Read Periodic Advertiser List Size (Octet 38 - Bit 6)
          LE Read Transmit Power (Octet 38 - Bit 7)
          LE Read RF Path Compensation (Octet 39 - Bit 0)
          LE Write RF Path Compensation (Octet 39 - Bit 1)
          LE Set Privacy Mode (Octet 39 - Bit 2)
          LE Periodic Advertising Receive Enable (Octet 40 - Bit 5)
          LE Periodic Advertising Sync Transfer (Octet 40 - Bit 6)
          LE Periodic Advertising Set Info Transfer (Octet 40 - Bit 7)
          LE Periodic Advertising Sync Transfer Parameters (Octet 41 - Bit 0)
          LE Set Default Periodic Advertisng Sync Transfer Parameters (Octet 41 - Bit 1)
          LE Read Buffer v2 (Octet 41 - Bit 5)
          LE Read ISO TX Sync (Octet 41 - Bit 6)
          LE Set Connected Isochronous Group Parameters (Octet 41 - Bit 7)
          LE Set Connected Isochronous Group Parameters Test (Octet 42 - Bit 0)
          LE Create Connected Isochronous Stream (Octet 42 - Bit 1)
          LE Remove Connected Isochronous Group (Octet 42 - Bit 2)
          LE Accept Connected Isochronous Stream Request (Octet 42 - Bit 3)
          LE Reject Connected Isochronous Stream Request (Octet 42 - Bit 4)
          LE Create Broadcast Isochronous Group (Octet 42 - Bit 5)
          LE Create Broadcast Isochronous Group Test (Octet 42 - Bit 6)
          LE Terminate Broadcast Isochronous Group (Octet 42 - Bit 7)
          LE Broadcast Isochronous Group Create Sync (Octet 43 - Bit 0)
          LE Broadcast Isochronous Group Terminate Sync (Octet 43 - Bit 1)
          LE Request Peer SCA (Octet 43 - Bit 2)
          LE Setup Isochronous Data Path (Octet 43 - Bit 3)
          LE Remove Isochronous Data Path (Octet 43 - Bit 4)
          LE Isochronous Transmit Test (Octet 43 - Bit 5)
          LE Isochronous Receive Test (Octet 43 - Bit 6)
          LE Isochronous Read Test Counters (Octet 43 - Bit 7)
          LE Isochronous Read Test Counters (Octet 44 - Bit 0)
          LE Set Host Feature (Octet 44 - Bit 1)
          Octet 44 - Bit 2 
          Octet 45 - Bit 6 
          Octet 46 - Bit 0 
          Octet 46 - Bit 1 
          Octet 46 - Bit 2 
< HCI Command: Host Buffer Size (0x03|0x0033) plen 7         #9 [hci1] 1.033984
        ACL MTU: 255  ACL max packet: 16
        SCO MTU: 0    SCO max packet: 0
> HCI Event: Command Complete (0x0e) plen 4                 #10 [hci1] 1.034456
      Host Buffer Size (0x03|0x0033) ncmd 1
        Status: Success (0x00)
< HCI Command: Set Controller To Ho.. (0x03|0x0031) plen 1  #11 [hci1] 1.053992
        Flow control: ACL Data Packets (0x01)
> HCI Event: Command Complete (0x0e) plen 4                 #12 [hci1] 1.054362
      Set Controller To Host Flow Control (0x03|0x0031) ncmd 1
        Status: Success (0x00)
< HCI Command: LE Read Local Suppor.. (0x08|0x0003) plen 0  #13 [hci1] 1.073983
> HCI Event: Command Complete (0x0e) plen 12                #14 [hci1] 1.074430
      LE Read Local Supported Features (0x08|0x0003) ncmd 1
        Status: Success (0x00)
        Features: 0xfd 0x79 0x00 0xf7 0x30 0x01 0x00 0x00
          LE Encryption
          Extended Reject Indication
          Peripheral-initiated Features Exchange
          LE Ping
          LE Data Packet Length Extension
          LL Privacy
          Extended Scanner Filter Policies
          LE 2M PHY
          LE Coded PHY
          LE Extended Advertising
          LE Periodic Advertising
          Channel Selection Algorithm #2
          Periodic Advertising Sync Transfer - Sender
          Periodic Advertising Sync Transfer - Recipient
          Sleep Clock Accuracy Updates
          Connected Isochronous Stream - Central
          Connected Isochronous Stream - Peripheral
          Isochronous Broadcaster
          Synchronized Receiver
          Periodic Advertising ADI support
          Connection Subrating
          Unknown features (0x0000010000000000)
< HCI Command: LE Set Host Feature (0x08|0x0074) plen 2     #15 [hci1] 1.094002
        Bit Number: 32
          Connected Isochronous Stream (Host Support)
        Bit Value: 1
> HCI Event: Command Complete (0x0e) plen 4                 #16 [hci1] 1.094457
      LE Set Host Feature (0x08|0x0074) ncmd 1
        Status: Success (0x00)
< HCI Command: LE Read Buffer v2 (0x08|0x0060) plen 0       #17 [hci1] 1.114029
> HCI Event: Command Complete (0x0e) plen 10                #18 [hci1] 1.114543
      LE Read Buffer v2 (0x08|0x0060) ncmd 1
        Status: Success (0x00)
        ACL MTU: 27
        ACL max packet: 3
        ISO MTU: 318
        ISO max packet: 3
< HCI Command: LE Read Maximum Adve.. (0x08|0x003a) plen 0  #19 [hci1] 1.134019
> HCI Event: Command Complete (0x0e) plen 6                 #20 [hci1] 1.134405
      LE Read Maximum Advertising Data Length (0x08|0x003a) ncmd 1
        Status: Success (0x00)
        Max length: 1650
< HCI Command: LE Read Supported St.. (0x08|0x001c) plen 0  #21 [hci1] 1.153986
> HCI Event: Command Complete (0x0e) plen 12                #22 [hci1] 1.154433
      LE Read Supported States (0x08|0x001c) ncmd 1
        Status: Success (0x00)
        States: 0x000003ff3e0306ff
          Non-connectable Advertising State
          Scannable Advertising State
          Connectable Advertising State
          High Duty Cycle Directed Advertising State
          Passive Scanning State
          Active Scanning State
          Initiating State
            and Connection State (Central Role)
          Connection State (Peripheral Role)
          Scannable Advertising State
            and Passive Scanning State
          Connectable Advertising State
            and Passive Scanning State
          Non-connectable Advertising State
            and Initiating State
          Scannable Advertising State
            and Initiating State
          Active Scanning State
            and Connection State (Central Role)
          Passive Scanning State
            and Connection State (Peripheral Role)
          Active Scanning State
            and Connection State (Peripheral Role)
          Initiating State
            and Connection State (Central Role)
            and Central Role & Central Role
          Low Duty Cycle Directed Advertising State
          Connectable Advertising State
            and Initiating State
            and Central Role & Peripheral Role
          High Duty Cycle Directed Advertising State
            and Initiating State
            and Central Role & Peripheral Role
          Low Duty Cycle Directed Advertising State
            and Initiating State
            and Central Role & Peripheral Role
          Connectable Advertising State
            and Connection State (Central Role)
            and Central Role & Peripheral Role
          High Duty Cycle Directed Advertising State
            and Connection State (Central Role)
            and Central Role & Peripheral Role
          Low Duty Cycle Directed Advertising State
            and Connection State (Central Role)
            and Central Role & Peripheral Role
          Connectable Advertising State
            and Connection State (Peripheral Role)
            and Central Role & Peripheral Role
          High Duty Cycle Directed Advertising State
            and Connection State (Peripheral Role)
            and Peripheral Role & Peripheral Role
          Low Duty Cycle Directed Advertising State
            and Connection State (Peripheral Role)
            and Peripheral Role & Peripheral Role
          Initiating State
            and Connection State (Peripheral Role)
            and Central Role & Peripheral Role
< HCI Command: LE Read Maximum Data.. (0x08|0x002f) plen 0  #23 [hci1] 1.173891
> HCI Event: Command Complete (0x0e) plen 12                #24 [hci1] 1.174348
      LE Read Maximum Data Length (0x08|0x002f) ncmd 1
        Status: Success (0x00)
        Max TX octets: 251
        Max TX time: 2704
        Max RX octets: 251
        Max RX time: 2704
< HCI Command: LE Write Suggested D.. (0x08|0x0024) plen 4  #25 [hci1] 1.193990
        TX octets: 251
        TX time: 2704
> HCI Event: Command Complete (0x0e) plen 4                 #26 [hci1] 1.194472
      LE Write Suggested Default Data Length (0x08|0x0024) ncmd 1
        Status: Success (0x00)
< HCI Command: LE Read Resolving Li.. (0x08|0x002a) plen 0  #27 [hci1] 1.213996
> HCI Event: Command Complete (0x0e) plen 5                 #28 [hci1] 1.214388
      LE Read Resolving List Size (0x08|0x002a) ncmd 1
        Status: Success (0x00)
        Size: 8
< HCI Command: LE Set Event Mask (0x08|0x0001) plen 8       #29 [hci1] 1.233982
        Mask: 0x000002023f87fa5e
          LE Advertising Report
          LE Connection Update Complete
          LE Read Remote Used Features Complete
          LE Long Term Key Request
          LE Data Length Change
          LE Enhanced Connection Complete
          LE PHY Update Complete
          LE Extended Advertising Report
          LE Periodic Advertising Sync Established
          LE Periodic Advertising Report
          LE Periodic Advertising Sync Lost
          LE Extended Scan Timeout
          LE Extended Advertising Set Terminated
          LE Scan Request Received
          LE Periodic Advertising Sync Transfer Rvc
          LE CIS Established
          LE CIS Request
          LE Create BIG Complete
          LE Terminate BIG Complete
          LE BIG Sync Estabilished Complete
          LE BIG Sync Lost
          LE BIG Info Advertising Report
          Unknown mask (0x0000020000000000)
> HCI Event: Command Complete (0x0e) plen 4                 #30 [hci1] 1.234475
      LE Set Event Mask (0x08|0x0001) ncmd 1
        Status: Success (0x00)
< HCI Command: Set Event Mask (0x03|0x0001) plen 8          #31 [hci1] 1.253979
        Mask: 0x2000800002008890
          Disconnection Complete
          Encryption Change
          Read Remote Version Information Complete
          Hardware Error
          Data Buffer Overflow
          Encryption Key Refresh Complete
          LE Meta
> HCI Event: Command Complete (0x0e) plen 4                 #32 [hci1] 1.254479
      Set Event Mask (0x03|0x0001) ncmd 1
        Status: Success (0x00)
< HCI Command: Read BD ADDR (0x04|0x0009) plen 0            #33 [hci1] 1.273971
> HCI Event: Command Complete (0x0e) plen 10                #34 [hci1] 1.274451
      Read BD ADDR (0x04|0x0009) ncmd 1
        Status: Success (0x00)
        Address: 00:00:00:00:00:00 (OUI 00-00-00)
< HCI Command: LE Set Random Address (0x08|0x0005) plen 6   #35 [hci1] 1.293999
        Address: D5:B6:CC:31:DB:3B (Static)
> HCI Event: Command Complete (0x0e) plen 4                 #36 [hci1] 1.294504
      LE Set Random Address (0x08|0x0005) ncmd 1
        Status: Success (0x00)
< HCI Command: LE Set Extended Adv.. (0x08|0x0036) plen 25  #37 [hci1] 3.894107
        Handle: 0x00
        Properties: 0x0013
          Connectable
          Scannable
          Use legacy advertising PDUs: ADV_IND
        Min advertising interval: 100.000 msec (0x00a0)
        Max advertising interval: 150.000 msec (0x00f0)
        Channel map: 37, 38, 39 (0x07)
        Own address type: Random (0x01)
        Peer address type: Public (0x00)
        Peer address: 00:00:00:00:00:00 (OUI 00-00-00)
        Filter policy: Allow Scan Request from Any, Allow Connect Request from Any (0x00)
        TX power: Host has no preference (0x7f)
        Primary PHY: LE 1M (0x01)
        Secondary max skip: 0x00
        Secondary PHY: LE 1M (0x01)
        SID: 0x00
        Scan request notifications: Disabled (0x00)
> HCI Event: Command Complete (0x0e) plen 5                 #38 [hci1] 3.894957
      LE Set Extended Advertising Parameters (0x08|0x0036) ncmd 1
        Status: Success (0x00)
        TX power (selected): 0 dbm (0x00)
< HCI Command: LE Set Advertising S.. (0x08|0x0035) plen 7  #39 [hci1] 3.914050
        Advertising handle: 0x00
        Advertising random address: D5:B6:CC:31:DB:3B (Static)
> HCI Event: Command Complete (0x0e) plen 4                 #40 [hci1] 3.914505
      LE Set Advertising Set Random Address (0x08|0x0035) ncmd 1
        Status: Success (0x00)
< HCI Command: LE Set Extended Adv.. (0x08|0x0037) plen 22  #41 [hci1] 3.934057
        Handle: 0x00
        Operation: Complete extended advertising data (0x03)
        Fragment preference: Minimize fragmentation (0x01)
        Data length: 0x12
        Flags: 0x06
          LE General Discoverable Mode
          BR/EDR Not Supported
        Name (complete): Tester_F6B11A
> HCI Event: Command Complete (0x0e) plen 4                 #42 [hci1] 3.934713
      LE Set Extended Advertising Data (0x08|0x0037) ncmd 1
        Status: Success (0x00)
< HCI Command: LE Set Extended Scan.. (0x08|0x0038) plen 4  #43 [hci1] 3.954044
        Handle: 0x00
        Operation: Complete scan response data (0x03)
        Fragment preference: Minimize fragmentation (0x01)
        Data length: 0x00
> HCI Event: Command Complete (0x0e) plen 4                 #44 [hci1] 3.954579
      LE Set Extended Scan Response Data (0x08|0x0038) ncmd 1
        Status: Success (0x00)
< HCI Command: LE Set Extended Adve.. (0x08|0x0039) plen 6  #45 [hci1] 3.974053
        Extended advertising: Enabled (0x01)
        Number of sets: 1 (0x01)
        Entry 0
          Handle: 0x00
          Duration: 0 ms (0x00)
          Max ext adv events: 0
> HCI Event: Command Complete (0x0e) plen 4                 #46 [hci1] 3.974655
      LE Set Extended Advertising Enable (0x08|0x0039) ncmd 1
        Status: Success (0x00)
> HCI Event: LE Meta Event (0x3e) plen 31                   #47 [hci1] 4.086250
      LE Enhanced Connection Complete (0x0a)
        Status: Success (0x00)
        Handle: 3297
        Role: Peripheral (0x01)
        Peer address type: Public (0x00)
        Peer address: DF:A9:FF:F6:B1:1A (OUI DF-A9-FF)
        Local resolvable private address: 00:00:00:00:00:00 (Non-Resolvable)
        Peer resolvable private address: 00:00:00:00:00:00 (Non-Resolvable)
        Connection interval: 87.50 msec (0x0046)
        Connection latency: 0 (0x0000)
        Supervision timeout: 25120 msec (0x09d0)
        Central clock accuracy: 0x01
> HCI Event: LE Meta Event (0x3e) plen 6                    #48 [hci1] 4.086406
      LE Advertising Set Terminated (0x12)
        Status: Success (0x00)
        Handle: 0
        Connection handle: 3297
        Number of completed extended advertising events: 0
< HCI Command: LE Read Remote Used... (0x08|0x0016) plen 2  #49 [hci1] 4.094933
        Handle: 3297 Address: DF:A9:FF:F6:B1:1A (OUI DF-A9-FF)
< ACL Data TX: Handle 3297 flags 0x00 dlen 7                #50 [hci1] 4.094950
      ATT: Exchange MTU Request (0x02) len 2
        Client RX MTU: 251
> HCI Event: Command Status (0x0f) plen 4                   #51 [hci1] 4.095503
      LE Read Remote Used Features (0x08|0x0016) ncmd 1
        Status: Success (0x00)
> HCI Event: Number of Completed Packets (0x13) plen 5      #52 [hci1] 4.262275
        Num handles: 1
        Handle: 3297 Address: DF:A9:FF:F6:B1:1A (OUI DF-A9-FF)
        Count: 1
        #50: len 7 (0 Kb/s)
        Latency: 167 msec (167-167 msec ~167 msec)
> HCI Event: LE Meta Event (0x3e) plen 12                   #53 [hci1] 4.350106
      LE Read Remote Used Features (0x04)
        Status: Success (0x00)
        Handle: 3297 Address: DF:A9:FF:F6:B1:1A (OUI DF-A9-FF)
        Features: 0x2d 0x49 0x00 0xf7 0x67 0xd8 0x00 0x00
          LE Encryption
          Extended Reject Indication
          Peripheral-initiated Features Exchange
          LE Data Packet Length Extension
          LE 2M PHY
          LE Coded PHY
          Channel Selection Algorithm #2
          Periodic Advertising Sync Transfer - Sender
          Periodic Advertising Sync Transfer - Recipient
          Sleep Clock Accuracy Updates
          Connected Isochronous Stream - Central
          Connected Isochronous Stream - Peripheral
          Isochronous Broadcaster
          Synchronized Receiver
          Connected Isochronous Stream (Host Support)
          LE Power Control Request
          LE Power Control Request
          Connection Subrating
          Connection Subrating (Host Support)
          Unknown features (0x0000d80000000000)
> ACL Data RX: Handle 3297 flags 0x02 dlen 11               #54 [hci1] 6.799913
      SMP: Pairing Request (0x01) len 6
        IO capability: KeyboardDisplay (0x04)
        OOB data: Authentication data not present (0x00)
        Authentication requirement: Bonding, MITM, SC, No Keypresses (0x0d)
        Max encryption key size: 16
        Initiator key distribution: EncKey IdKey (0x03)
        Responder key distribution: EncKey IdKey Sign (0x07)
> ACL Data RX: Handle 3297 flags 0x02 dlen 7                #55 [hci1] 6.800220
      ATT: Exchange MTU Response (0x03) len 2
        Server RX MTU: 23
< HCI Command: Host Number of Compl.. (0x03|0x0035) plen 5  #56 [hci1] 6.814744
        Num handles: 1
        Handle: 3297 Address: DF:A9:FF:F6:B1:1A (OUI DF-A9-FF)
        Count: 1
< ACL Data TX: Handle 3297 flags 0x00 dlen 11               #57 [hci1] 6.814971
      SMP: Pairing Response (0x02) len 6
        IO capability: DisplayOnly (0x00)
        OOB data: Authentication data not present (0x00)
        Authentication requirement: Bonding, No MITM, SC, No Keypresses (0x09)
        Max encryption key size: 16
        Initiator key distribution: IdKey (0x02)
        Responder key distribution: <none> (0x00)
< HCI Command: Host Number of Compl.. (0x03|0x0035) plen 5  #58 [hci1] 6.815162
        Num handles: 1
        Handle: 3297 Address: DF:A9:FF:F6:B1:1A (OUI DF-A9-FF)
        Count: 1
> HCI Event: Number of Completed Packets (0x13) plen 5      #59 [hci1] 6.974898
        Num handles: 1
        Handle: 3297 Address: DF:A9:FF:F6:B1:1A (OUI DF-A9-FF)
        Count: 1
        #57: len 11 (0 Kb/s)
        Latency: 159 msec (159-167 msec ~163 msec)
> ACL Data RX: Handle 3297 flags 0x02 dlen 27               #60 [hci1] 6.975206
> ACL Data RX: Handle 3297 flags 0x01 dlen 27               #61 [hci1] 6.975724
> ACL Data RX: Handle 3297 flags 0x01 dlen 15               #62 [hci1] 6.976154
      SMP: Pairing Public Key (0x0c) len 64
        X: b1e5c663c15aba0ee2267b046486b63f4919286e748d87ce6e10ecac3f4b0606
        Y: 9ebf9e364f0fb5c19bf251bca584318d9852318164a4332721650bf79f4e334b
< HCI Command: Host Number of Compl.. (0x03|0x0035) plen 5  #63 [hci1] 6.994441
        Num handles: 1
        Handle: 3297 Address: DF:A9:FF:F6:B1:1A (OUI DF-A9-FF)
        Count: 1
< HCI Command: Host Number of Compl.. (0x03|0x0035) plen 5  #64 [hci1] 6.994565
        Num handles: 1
        Handle: 3297 Address: DF:A9:FF:F6:B1:1A (OUI DF-A9-FF)
        Count: 1
< HCI Command: Host Number of Compl.. (0x03|0x0035) plen 5  #65 [hci1] 6.994701
        Num handles: 1
        Handle: 3297 Address: DF:A9:FF:F6:B1:1A (OUI DF-A9-FF)
        Count: 1
< ACL Data TX: Handle 3297 flags 0x00 dlen 27               #66 [hci1] 6.994791
< ACL Data TX: Handle 3297 flags 0x01 dlen 27               #67 [hci1] 6.994803
< ACL Data TX: Handle 3297 flags 0x01 dlen 15               #68 [hci1] 6.994816
      SMP: Pairing Public Key (0x0c) len 64
        X: 98308440221e2d910f0e54b71e7ec652857aa9b5a0dc65028824cc19db1226e9
        Y: 67a4816bcb62efb21701e31fdb27561a6217575fb007a8bbdabe7e28b6f68482
> HCI Event: Number of Completed Packets (0x13) plen 5      #69 [hci1] 7.062751
        Num handles: 1
        Handle: 3297 Address: DF:A9:FF:F6:B1:1A (OUI DF-A9-FF)
        Count: 1
        #66: len 27 (3 Kb/s)
        Latency: 67 msec (67-167 msec ~115 msec)
> HCI Event: Number of Completed Packets (0x13) plen 5      #70 [hci1] 7.063466
        Num handles: 1
        Handle: 3297 Address: DF:A9:FF:F6:B1:1A (OUI DF-A9-FF)
        Count: 1
        #67: len 27 (3 Kb/s)
        Latency: 68 msec (67-167 msec ~92 msec)
> HCI Event: Number of Completed Packets (0x13) plen 5      #71 [hci1] 7.149726
        Num handles: 1
        Handle: 3297 Address: DF:A9:FF:F6:B1:1A (OUI DF-A9-FF)
        Count: 1
        #68: len 15 (0 Kb/s)
        Latency: 154 msec (67-167 msec ~123 msec)
> ACL Data RX: Handle 3297 flags 0x02 dlen 21               #72 [hci1] 8.112444
      SMP: Pairing Confirm (0x03) len 16
        Confim value: be203c0ec760be2d48cce9a494d65479
< HCI Command: Host Number of Compl.. (0x03|0x0035) plen 5  #73 [hci1] 8.114312
        Num handles: 1
        Handle: 3297 Address: DF:A9:FF:F6:B1:1A (OUI DF-A9-FF)
        Count: 1
< ACL Data TX: Handle 3297 flags 0x00 dlen 21               #74 [hci1] 8.114461
      SMP: Pairing Confirm (0x03) len 16
        Confim value: 053992b664c3af7c2f90a3ddfd137bb9
> HCI Event: Number of Completed Packets (0x13) plen 5      #75 [hci1] 8.287360
        Num handles: 1
        Handle: 3297 Address: DF:A9:FF:F6:B1:1A (OUI DF-A9-FF)
        Count: 1
        #74: len 21 (0 Kb/s)
        Latency: 172 msec (67-172 msec ~148 msec)
> ACL Data RX: Handle 3297 flags 0x02 dlen 21               #76 [hci1] 8.287641
      SMP: Pairing Random (0x04) len 16
        Random value: 720964fdc57b85560000000000000000
< HCI Command: Host Number of Compl.. (0x03|0x0035) plen 5  #77 [hci1] 8.294356
        Num handles: 1
        Handle: 3297 Address: DF:A9:FF:F6:B1:1A (OUI DF-A9-FF)
        Count: 1
< ACL Data TX: Handle 3297 flags 0x00 dlen 21               #78 [hci1] 8.294423
      SMP: Pairing Random (0x04) len 16
        Random value: 8e6108f966a694cbe26df70bb96773e6
> HCI Event: Number of Completed Packets (0x13) plen 5      #79 [hci1] 8.462046
        Num handles: 1
        Handle: 3297 Address: DF:A9:FF:F6:B1:1A (OUI DF-A9-FF)
        Count: 1
        #78: len 21 (1 Kb/s)
        Latency: 167 msec (67-172 msec ~157 msec)
> ACL Data RX: Handle 3297 flags 0x02 dlen 21               #80 [hci1] 8.549946
      SMP: Pairing Confirm (0x03) len 16
        Confim value: 4522b9616efc998a42f050aa0dd6d132
< HCI Command: Host Number of Compl.. (0x03|0x0035) plen 5  #81 [hci1] 8.554691
        Num handles: 1
        Handle: 3297 Address: DF:A9:FF:F6:B1:1A (OUI DF-A9-FF)
        Count: 1
< ACL Data TX: Handle 3297 flags 0x00 dlen 21               #82 [hci1] 8.555011
      SMP: Pairing Confirm (0x03) len 16
        Confim value: e89071b810dadfa5bed54b4e5c7ff53a
> HCI Event: Number of Completed Packets (0x13) plen 5      #83 [hci1] 8.724789
        Num handles: 1
        Handle: 3297 Address: DF:A9:FF:F6:B1:1A (OUI DF-A9-FF)
        Count: 1
        #82: len 21 (0 Kb/s)
        Latency: 169 msec (67-172 msec ~163 msec)
> ACL Data RX: Handle 3297 flags 0x02 dlen 21               #84 [hci1] 8.725099
      SMP: Pairing Random (0x04) len 16
        Random value: 19bf14603c44fb880000000000000000
< HCI Command: Host Number of Compl.. (0x03|0x0035) plen 5  #85 [hci1] 8.734681
        Num handles: 1
        Handle: 3297 Address: DF:A9:FF:F6:B1:1A (OUI DF-A9-FF)
        Count: 1
< ACL Data TX: Handle 3297 flags 0x00 dlen 21               #86 [hci1] 8.734753
      SMP: Pairing Random (0x04) len 16
        Random value: 4d02679f89a05211af56d8b3da64d21e
> HCI Event: Number of Completed Packets (0x13) plen 5      #87 [hci1] 8.899583
        Num handles: 1
        Handle: 3297 Address: DF:A9:FF:F6:B1:1A (OUI DF-A9-FF)
        Count: 1
        #86: len 21 (1 Kb/s)
        Latency: 164 msec (67-172 msec ~164 msec)
> ACL Data RX: Handle 3297 flags 0x02 dlen 21               #88 [hci1] 8.987421
      SMP: Pairing Confirm (0x03) len 16
        Confim value: bd60a02765e63e958258afb11c22e6ae
< HCI Command: Host Number of Compl.. (0x03|0x0035) plen 5  #89 [hci1] 8.994686
        Num handles: 1
        Handle: 3297 Address: DF:A9:FF:F6:B1:1A (OUI DF-A9-FF)
        Count: 1
< ACL Data TX: Handle 3297 flags 0x00 dlen 21               #90 [hci1] 8.994849
      SMP: Pairing Confirm (0x03) len 16
        Confim value: 3cc871f85b8dfe03dbcedb1a3be2232b
> HCI Event: Number of Completed Packets (0x13) plen 5      #91 [hci1] 9.162367
        Num handles: 1
        Handle: 3297 Address: DF:A9:FF:F6:B1:1A (OUI DF-A9-FF)
        Count: 1
        #90: len 21 (1 Kb/s)
        Latency: 167 msec (67-172 msec ~165 msec)
> ACL Data RX: Handle 3297 flags 0x02 dlen 21               #92 [hci1] 9.162623
      SMP: Pairing Random (0x04) len 16
        Random value: 380ac6dc851e18cc0000000000000000
< HCI Command: Host Number of Compl.. (0x03|0x0035) plen 5  #93 [hci1] 9.175024
        Num handles: 1
        Handle: 3297 Address: DF:A9:FF:F6:B1:1A (OUI DF-A9-FF)
        Count: 1
< ACL Data TX: Handle 3297 flags 0x00 dlen 21               #94 [hci1] 9.175109
      SMP: Pairing Random (0x04) len 16
        Random value: 5e8286bc235a02440d0c3424a2acf8fd
> HCI Event: Number of Completed Packets (0x13) plen 5      #95 [hci1] 9.337053
        Num handles: 1
        Handle: 3297 Address: DF:A9:FF:F6:B1:1A (OUI DF-A9-FF)
        Count: 1
        #94: len 21 (1 Kb/s)
        Latency: 161 msec (67-172 msec ~163 msec)
> ACL Data RX: Handle 3297 flags 0x02 dlen 21               #96 [hci1] 9.424892
      SMP: Pairing Confirm (0x03) len 16
        Confim value: 141086cba629d5bc87114001102c4ced
< HCI Command: Host Number of Compl.. (0x03|0x0035) plen 5  #97 [hci1] 9.434470
        Num handles: 1
        Handle: 3297 Address: DF:A9:FF:F6:B1:1A (OUI DF-A9-FF)
        Count: 1
< ACL Data TX: Handle 3297 flags 0x00 dlen 21               #98 [hci1] 9.434503
      SMP: Pairing Confirm (0x03) len 16
        Confim value: 50500eb01a262fa0319ca26527e5cdca
> HCI Event: Number of Completed Packets (0x13) plen 5      #99 [hci1] 9.599724
        Num handles: 1
        Handle: 3297 Address: DF:A9:FF:F6:B1:1A (OUI DF-A9-FF)
        Count: 1
        #98: len 21 (1 Kb/s)
        Latency: 165 msec (67-172 msec ~164 msec)
> ACL Data RX: Handle 3297 flags 0x02 dlen 21              #100 [hci1] 9.600104
      SMP: Pairing Random (0x04) len 16
        Random value: ea75855182315a4f0000000000000000
< HCI Command: Host Number of Comp.. (0x03|0x0035) plen 5  #101 [hci1] 9.614260
        Num handles: 1
        Handle: 3297 Address: DF:A9:FF:F6:B1:1A (OUI DF-A9-FF)
        Count: 1
< ACL Data TX: Handle 3297 flags 0x00 dlen 21              #102 [hci1] 9.614312
      SMP: Pairing Random (0x04) len 16
        Random value: 5c4a1bcadd27bd58e945097b00bad7ac
> HCI Event: Number of Completed Packets (0x13) plen 5     #103 [hci1] 9.774532
        Num handles: 1
        Handle: 3297 Address: DF:A9:FF:F6:B1:1A (OUI DF-A9-FF)
        Count: 1
        #102: len 21 (1 Kb/s)
        Latency: 160 msec (67-172 msec ~162 msec)
> ACL Data RX: Handle 3297 flags 0x02 dlen 21              #104 [hci1] 9.862449
      SMP: Pairing Confirm (0x03) len 16
        Confim value: ce79b2a913f744a8b235ebf7c50c58bf
< HCI Command: Host Number of Comp.. (0x03|0x0035) plen 5  #105 [hci1] 9.874112
        Num handles: 1
        Handle: 3297 Address: DF:A9:FF:F6:B1:1A (OUI DF-A9-FF)
        Count: 1
< ACL Data TX: Handle 3297 flags 0x00 dlen 21              #106 [hci1] 9.874304
      SMP: Pairing Confirm (0x03) len 16
        Confim value: 64ed531778bc638380d4e187f3d9a678
> HCI Event: Number of Completed Packets (0x13) plen 5    #107 [hci1] 10.037222
        Num handles: 1
        Handle: 3297 Address: DF:A9:FF:F6:B1:1A (OUI DF-A9-FF)
        Count: 1
        #106: len 21 (1 Kb/s)
        Latency: 162 msec (67-172 msec ~162 msec)
> ACL Data RX: Handle 3297 flags 0x02 dlen 21             #108 [hci1] 10.037509
      SMP: Pairing Random (0x04) len 16
        Random value: a3aebbd69f649bc00000000000000000
< HCI Command: Host Number of Com.. (0x03|0x0035) plen 5  #109 [hci1] 10.054916
        Num handles: 1
        Handle: 3297 Address: DF:A9:FF:F6:B1:1A (OUI DF-A9-FF)
        Count: 1
< ACL Data TX: Handle 3297 flags 0x00 dlen 21             #110 [hci1] 10.055050
      SMP: Pairing Random (0x04) len 16
        Random value: 32527e6e64e79f33b2e374394db8ab2d
> HCI Event: Number of Completed Packets (0x13) plen 5    #111 [hci1] 10.211973
        Num handles: 1
        Handle: 3297 Address: DF:A9:FF:F6:B1:1A (OUI DF-A9-FF)
        Count: 1
        #110: len 21 (1 Kb/s)
        Latency: 156 msec (67-172 msec ~159 msec)
> ACL Data RX: Handle 3297 flags 0x02 dlen 21             #112 [hci1] 10.299938
      SMP: Pairing Confirm (0x03) len 16
        Confim value: d74a3723b449feb791425657b4a0c67b
< HCI Command: Host Number of Com.. (0x03|0x0035) plen 5  #113 [hci1] 10.314402
        Num handles: 1
        Handle: 3297 Address: DF:A9:FF:F6:B1:1A (OUI DF-A9-FF)
        Count: 1
< ACL Data TX: Handle 3297 flags 0x00 dlen 21             #114 [hci1] 10.314594
      SMP: Pairing Confirm (0x03) len 16
        Confim value: 20d56d03d6af2526644363e81be182a3
> HCI Event: Number of Completed Packets (0x13) plen 5    #115 [hci1] 10.474778
        Num handles: 1
        Handle: 3297 Address: DF:A9:FF:F6:B1:1A (OUI DF-A9-FF)
        Count: 1
        #114: len 21 (1 Kb/s)
        Latency: 160 msec (67-172 msec ~159 msec)
> ACL Data RX: Handle 3297 flags 0x02 dlen 21             #116 [hci1] 10.475062
      SMP: Pairing Random (0x04) len 16
        Random value: 2be926163ac7427f0000000000000000
< HCI Command: Host Number of Com.. (0x03|0x0035) plen 5  #117 [hci1] 10.494631
        Num handles: 1
        Handle: 3297 Address: DF:A9:FF:F6:B1:1A (OUI DF-A9-FF)
        Count: 1
< ACL Data TX: Handle 3297 flags 0x00 dlen 21             #118 [hci1] 10.494739
      SMP: Pairing Random (0x04) len 16
        Random value: dddbdfe2838e9a8cc6964353c850fef7
> HCI Event: Number of Completed Packets (0x13) plen 5    #119 [hci1] 10.649506
        Num handles: 1
        Handle: 3297 Address: DF:A9:FF:F6:B1:1A (OUI DF-A9-FF)
        Count: 1
        #118: len 21 (1 Kb/s)
        Latency: 154 msec (67-172 msec ~157 msec)
> ACL Data RX: Handle 3297 flags 0x02 dlen 21             #120 [hci1] 10.737353
      SMP: Pairing Confirm (0x03) len 16
        Confim value: 90529791336584966e42e8a1d554780c
< HCI Command: Host Number of Com.. (0x03|0x0035) plen 5  #121 [hci1] 10.754477
        Num handles: 1
        Handle: 3297 Address: DF:A9:FF:F6:B1:1A (OUI DF-A9-FF)
        Count: 1
< ACL Data TX: Handle 3297 flags 0x00 dlen 21             #122 [hci1] 10.754702
      SMP: Pairing Confirm (0x03) len 16
        Confim value: f6f3f0473c2d030c1f957631f0e60763
> HCI Event: Number of Completed Packets (0x13) plen 5    #123 [hci1] 10.912194
        Num handles: 1
        Handle: 3297 Address: DF:A9:FF:F6:B1:1A (OUI DF-A9-FF)
        Count: 1
        #122: len 21 (1 Kb/s)
        Latency: 157 msec (67-172 msec ~157 msec)
> ACL Data RX: Handle 3297 flags 0x02 dlen 21             #124 [hci1] 10.912495
      SMP: Pairing Random (0x04) len 16
        Random value: 1411e9a9cc9185420000000000000000
< HCI Command: Host Number of Com.. (0x03|0x0035) plen 5  #125 [hci1] 10.914782
        Num handles: 1
        Handle: 3297 Address: DF:A9:FF:F6:B1:1A (OUI DF-A9-FF)
        Count: 1
< ACL Data TX: Handle 3297 flags 0x00 dlen 21             #126 [hci1] 10.914917
      SMP: Pairing Random (0x04) len 16
        Random value: eb9f1915536596b6fc3db1c86b2b1970
> HCI Event: Number of Completed Packets (0x13) plen 5    #127 [hci1] 11.086999
        Num handles: 1
        Handle: 3297 Address: DF:A9:FF:F6:B1:1A (OUI DF-A9-FF)
        Count: 1
        #126: len 21 (0 Kb/s)
        Latency: 172 msec (67-172 msec ~164 msec)
> ACL Data RX: Handle 3297 flags 0x02 dlen 21             #128 [hci1] 11.174909
      SMP: Pairing Confirm (0x03) len 16
        Confim value: 55e747faca2d93bef00cdc0c41c49b16
< HCI Command: Host Number of Com.. (0x03|0x0035) plen 5  #129 [hci1] 11.194672
        Num handles: 1
        Handle: 3297 Address: DF:A9:FF:F6:B1:1A (OUI DF-A9-FF)
        Count: 1
< ACL Data TX: Handle 3297 flags 0x00 dlen 21             #130 [hci1] 11.194877
      SMP: Pairing Confirm (0x03) len 16
        Confim value: 0c0211cb627e632a868f5654955e40b8
> HCI Event: Number of Completed Packets (0x13) plen 5    #131 [hci1] 11.349724
        Num handles: 1
        Handle: 3297 Address: DF:A9:FF:F6:B1:1A (OUI DF-A9-FF)
        Count: 1
        #130: len 21 (1 Kb/s)
        Latency: 154 msec (67-172 msec ~159 msec)
> ACL Data RX: Handle 3297 flags 0x02 dlen 21             #132 [hci1] 11.349984
      SMP: Pairing Random (0x04) len 16
        Random value: 7f29f08ff76fc8ac0000000000000000
< HCI Command: Host Number of Com.. (0x03|0x0035) plen 5  #133 [hci1] 11.354434
        Num handles: 1
        Handle: 3297 Address: DF:A9:FF:F6:B1:1A (OUI DF-A9-FF)
        Count: 1
< ACL Data TX: Handle 3297 flags 0x00 dlen 21             #134 [hci1] 11.354498
      SMP: Pairing Random (0x04) len 16
        Random value: 5c794dc9ad9f2c3f295ebd5ad5e1c3cf
> HCI Event: Number of Completed Packets (0x13) plen 5    #135 [hci1] 11.524477
        Num handles: 1
        Handle: 3297 Address: DF:A9:FF:F6:B1:1A (OUI DF-A9-FF)
        Count: 1
        #134: len 21 (0 Kb/s)
        Latency: 169 msec (67-172 msec ~164 msec)
> ACL Data RX: Handle 3297 flags 0x02 dlen 21             #136 [hci1] 11.612378
      SMP: Pairing Confirm (0x03) len 16
        Confim value: 983a496d74047aab3871d84f9cc8c361
< HCI Command: Host Number of Com.. (0x03|0x0035) plen 5  #137 [hci1] 11.614696
        Num handles: 1
        Handle: 3297 Address: DF:A9:FF:F6:B1:1A (OUI DF-A9-FF)
        Count: 1
< ACL Data TX: Handle 3297 flags 0x00 dlen 21             #138 [hci1] 11.614871
      SMP: Pairing Confirm (0x03) len 16
        Confim value: 5f98cf5ddfc96eebd3db61edc181d99e
> HCI Event: Number of Completed Packets (0x13) plen 5    #139 [hci1] 11.787167
        Num handles: 1
        Handle: 3297 Address: DF:A9:FF:F6:B1:1A (OUI DF-A9-FF)
        Count: 1
        #138: len 21 (0 Kb/s)
        Latency: 172 msec (67-172 msec ~168 msec)
> ACL Data RX: Handle 3297 flags 0x02 dlen 21             #140 [hci1] 11.787562
      SMP: Pairing Random (0x04) len 16
        Random value: 881c97059c18633c0000000000000000
< HCI Command: Host Number of Com.. (0x03|0x0035) plen 5  #141 [hci1] 11.794281
        Num handles: 1
        Handle: 3297 Address: DF:A9:FF:F6:B1:1A (OUI DF-A9-FF)
        Count: 1
< ACL Data TX: Handle 3297 flags 0x00 dlen 21             #142 [hci1] 11.794359
      SMP: Pairing Random (0x04) len 16
        Random value: 5c2fff312cdf99c9491988e877355a9a
> HCI Event: Number of Completed Packets (0x13) plen 5    #143 [hci1] 11.962017
        Num handles: 1
        Handle: 3297 Address: DF:A9:FF:F6:B1:1A (OUI DF-A9-FF)
        Count: 1
        #142: len 21 (1 Kb/s)
        Latency: 167 msec (67-172 msec ~168 msec)
> ACL Data RX: Handle 3297 flags 0x02 dlen 21             #144 [hci1] 12.049829
      SMP: Pairing Confirm (0x03) len 16
        Confim value: f86a9615b78b815eec60ee7b512893bb
< HCI Command: Host Number of Com.. (0x03|0x0035) plen 5  #145 [hci1] 12.054325
        Num handles: 1
        Handle: 3297 Address: DF:A9:FF:F6:B1:1A (OUI DF-A9-FF)
        Count: 1
< ACL Data TX: Handle 3297 flags 0x00 dlen 21             #146 [hci1] 12.054447
      SMP: Pairing Confirm (0x03) len 16
        Confim value: 37fd80cb379beaa1cc240009a40ebdcc
> HCI Event: Number of Completed Packets (0x13) plen 5    #147 [hci1] 12.224660
        Num handles: 1
        Handle: 3297 Address: DF:A9:FF:F6:B1:1A (OUI DF-A9-FF)
        Count: 1
        #146: len 21 (0 Kb/s)
        Latency: 170 msec (67-172 msec ~169 msec)
> ACL Data RX: Handle 3297 flags 0x02 dlen 21             #148 [hci1] 12.225023
      SMP: Pairing Random (0x04) len 16
        Random value: ac411ff387be90aa0000000000000000
< HCI Command: Host Number of Com.. (0x03|0x0035) plen 5  #149 [hci1] 12.234882
        Num handles: 1
        Handle: 3297 Address: DF:A9:FF:F6:B1:1A (OUI DF-A9-FF)
        Count: 1
< ACL Data TX: Handle 3297 flags 0x00 dlen 21             #150 [hci1] 12.235002
      SMP: Pairing Random (0x04) len 16
        Random value: c629a3a987d808e808655d558dfc1155
> HCI Event: Number of Completed Packets (0x13) plen 5    #151 [hci1] 12.399460
        Num handles: 1
        Handle: 3297 Address: DF:A9:FF:F6:B1:1A (OUI DF-A9-FF)
        Count: 1
        #150: len 21 (1 Kb/s)
        Latency: 164 msec (67-172 msec ~166 msec)
> ACL Data RX: Handle 3297 flags 0x02 dlen 21             #152 [hci1] 12.487284
      SMP: Pairing Confirm (0x03) len 16
        Confim value: 95a7aa27b8c76e4c21a352dfd90fe970
< HCI Command: Host Number of Com.. (0x03|0x0035) plen 5  #153 [hci1] 12.494522
        Num handles: 1
        Handle: 3297 Address: DF:A9:FF:F6:B1:1A (OUI DF-A9-FF)
        Count: 1
< ACL Data TX: Handle 3297 flags 0x00 dlen 21             #154 [hci1] 12.494701
      SMP: Pairing Confirm (0x03) len 16
        Confim value: 905be37a3135fc46637ad7bc5a59e944
> HCI Event: Number of Completed Packets (0x13) plen 5    #155 [hci1] 12.662152
        Num handles: 1
        Handle: 3297 Address: DF:A9:FF:F6:B1:1A (OUI DF-A9-FF)
        Count: 1
        #154: len 21 (1 Kb/s)
        Latency: 167 msec (67-172 msec ~167 msec)
> ACL Data RX: Handle 3297 flags 0x02 dlen 21             #156 [hci1] 12.662449
      SMP: Pairing Random (0x04) len 16
        Random value: 5f38c8bf17e929d40000000000000000
< HCI Command: Host Number of Com.. (0x03|0x0035) plen 5  #157 [hci1] 12.674582
        Num handles: 1
        Handle: 3297 Address: DF:A9:FF:F6:B1:1A (OUI DF-A9-FF)
        Count: 1
< ACL Data TX: Handle 3297 flags 0x00 dlen 21             #158 [hci1] 12.674680
      SMP: Pairing Random (0x04) len 16
        Random value: 92f20f6ad8f13724432c7fd6001c45ff
> HCI Event: Number of Completed Packets (0x13) plen 5    #159 [hci1] 12.836948
        Num handles: 1
        Handle: 3297 Address: DF:A9:FF:F6:B1:1A (OUI DF-A9-FF)
        Count: 1
        #158: len 21 (1 Kb/s)
        Latency: 162 msec (67-172 msec ~164 msec)
> ACL Data RX: Handle 3297 flags 0x02 dlen 21             #160 [hci1] 12.924744
      SMP: Pairing Confirm (0x03) len 16
        Confim value: 0fa7c4ecf2ea2a2e0887dfd5e27cb5bb
< HCI Command: Host Number of Com.. (0x03|0x0035) plen 5  #161 [hci1] 12.934745
        Num handles: 1
        Handle: 3297 Address: DF:A9:FF:F6:B1:1A (OUI DF-A9-FF)
        Count: 1
< ACL Data TX: Handle 3297 flags 0x00 dlen 21             #162 [hci1] 12.934979
      SMP: Pairing Confirm (0x03) len 16
        Confim value: 40048614396e9c4b845dea118a79ab2c
> HCI Event: Number of Completed Packets (0x13) plen 5    #163 [hci1] 13.099574
        Num handles: 1
        Handle: 3297 Address: DF:A9:FF:F6:B1:1A (OUI DF-A9-FF)
        Count: 1
        #162: len 21 (1 Kb/s)
        Latency: 164 msec (67-172 msec ~164 msec)
> ACL Data RX: Handle 3297 flags 0x02 dlen 21             #164 [hci1] 13.100032
      SMP: Pairing Random (0x04) len 16
        Random value: 8dfb22ee3b4a1be20000000000000000
< HCI Command: Host Number of Com.. (0x03|0x0035) plen 5  #165 [hci1] 13.114665
        Num handles: 1
        Handle: 3297 Address: DF:A9:FF:F6:B1:1A (OUI DF-A9-FF)
        Count: 1
< ACL Data TX: Handle 3297 flags 0x00 dlen 21             #166 [hci1] 13.114725
      SMP: Pairing Random (0x04) len 16
        Random value: 23ac32ebbb5e14c8a6b9622f296d277f
> HCI Event: Number of Completed Packets (0x13) plen 5    #167 [hci1] 13.274398
        Num handles: 1
        Handle: 3297 Address: DF:A9:FF:F6:B1:1A (OUI DF-A9-FF)
        Count: 1
        #166: len 21 (1 Kb/s)
        Latency: 159 msec (67-172 msec ~162 msec)
> ACL Data RX: Handle 3297 flags 0x02 dlen 21             #168 [hci1] 13.362281
      SMP: Pairing Confirm (0x03) len 16
        Confim value: d32b27ac478daf0414e97e9d4fd9f00b
< HCI Command: Host Number of Com.. (0x03|0x0035) plen 5  #169 [hci1] 13.374769
        Num handles: 1
        Handle: 3297 Address: DF:A9:FF:F6:B1:1A (OUI DF-A9-FF)
        Count: 1
< ACL Data TX: Handle 3297 flags 0x00 dlen 21             #170 [hci1] 13.375008
      SMP: Pairing Confirm (0x03) len 16
        Confim value: 078a255036d883b4bad50ef9af60ed02
> HCI Event: Number of Completed Packets (0x13) plen 5    #171 [hci1] 13.537126
        Num handles: 1
        Handle: 3297 Address: DF:A9:FF:F6:B1:1A (OUI DF-A9-FF)
        Count: 1
        #170: len 21 (1 Kb/s)
        Latency: 162 msec (67-172 msec ~162 msec)
> ACL Data RX: Handle 3297 flags 0x02 dlen 21             #172 [hci1] 13.537454
      SMP: Pairing Random (0x04) len 16
        Random value: 1582a40da723da4b0000000000000000
< HCI Command: Host Number of Com.. (0x03|0x0035) plen 5  #173 [hci1] 13.554372
        Num handles: 1
        Handle: 3297 Address: DF:A9:FF:F6:B1:1A (OUI DF-A9-FF)
        Count: 1
< ACL Data TX: Handle 3297 flags 0x00 dlen 21             #174 [hci1] 13.554437
      SMP: Pairing Random (0x04) len 16
        Random value: 297efe85e67448a15f56bd27e3a3cf1d
> HCI Event: Number of Completed Packets (0x13) plen 5    #175 [hci1] 13.711917
        Num handles: 1
        Handle: 3297 Address: DF:A9:FF:F6:B1:1A (OUI DF-A9-FF)
        Count: 1
        #174: len 21 (1 Kb/s)
        Latency: 157 msec (67-172 msec ~159 msec)
> ACL Data RX: Handle 3297 flags 0x02 dlen 21             #176 [hci1] 13.799901
      SMP: Pairing Confirm (0x03) len 16
        Confim value: 86a4ce38dae22d36e1e1d37c77b58f8e
< HCI Command: Host Number of Com.. (0x03|0x0035) plen 5  #177 [hci1] 13.814295
        Num handles: 1
        Handle: 3297 Address: DF:A9:FF:F6:B1:1A (OUI DF-A9-FF)
        Count: 1
< ACL Data TX: Handle 3297 flags 0x00 dlen 21             #178 [hci1] 13.814354
      SMP: Pairing Confirm (0x03) len 16
        Confim value: b416850e4ca9b123acfb5be9a663a5ad
> HCI Event: Number of Completed Packets (0x13) plen 5    #179 [hci1] 13.974575
        Num handles: 1
        Handle: 3297 Address: DF:A9:FF:F6:B1:1A (OUI DF-A9-FF)
        Count: 1
        #178: len 21 (1 Kb/s)
        Latency: 160 msec (67-172 msec ~160 msec)
> ACL Data RX: Handle 3297 flags 0x02 dlen 21             #180 [hci1] 13.975023
      SMP: Pairing Random (0x04) len 16
        Random value: 8ac8433c24bbcffe0000000000000000
< HCI Command: Host Number of Com.. (0x03|0x0035) plen 5  #181 [hci1] 13.994526
        Num handles: 1
        Handle: 3297 Address: DF:A9:FF:F6:B1:1A (OUI DF-A9-FF)
        Count: 1
< ACL Data TX: Handle 3297 flags 0x00 dlen 21             #182 [hci1] 13.994575
      SMP: Pairing Random (0x04) len 16
        Random value: 25a9493fd3ce4faf02be7293595bb7c6
> HCI Event: Number of Completed Packets (0x13) plen 5    #183 [hci1] 14.149393
        Num handles: 1
        Handle: 3297 Address: DF:A9:FF:F6:B1:1A (OUI DF-A9-FF)
        Count: 1
        #182: len 21 (1 Kb/s)
        Latency: 154 msec (67-172 msec ~157 msec)
> ACL Data RX: Handle 3297 flags 0x02 dlen 21             #184 [hci1] 14.237246
      SMP: Pairing Confirm (0x03) len 16
        Confim value: 992f11fbb1aac27a2792165be81d7fa4
< HCI Command: Host Number of Com.. (0x03|0x0035) plen 5  #185 [hci1] 14.254756
        Num handles: 1
        Handle: 3297 Address: DF:A9:FF:F6:B1:1A (OUI DF-A9-FF)
        Count: 1
< ACL Data TX: Handle 3297 flags 0x00 dlen 21             #186 [hci1] 14.254877
      SMP: Pairing Confirm (0x03) len 16
        Confim value: ca954b46a56eddbd6912860c494cdac5
> HCI Event: Number of Completed Packets (0x13) plen 5    #187 [hci1] 14.412039
        Num handles: 1
        Handle: 3297 Address: DF:A9:FF:F6:B1:1A (OUI DF-A9-FF)
        Count: 1
        #186: len 21 (1 Kb/s)
        Latency: 157 msec (67-172 msec ~157 msec)
> ACL Data RX: Handle 3297 flags 0x02 dlen 21             #188 [hci1] 14.412409
      SMP: Pairing Random (0x04) len 16
        Random value: d3cd63121a2249f50000000000000000
< HCI Command: Host Number of Com.. (0x03|0x0035) plen 5  #189 [hci1] 14.414658
        Num handles: 1
        Handle: 3297 Address: DF:A9:FF:F6:B1:1A (OUI DF-A9-FF)
        Count: 1
< ACL Data TX: Handle 3297 flags 0x00 dlen 21             #190 [hci1] 14.414787
      SMP: Pairing Random (0x04) len 16
        Random value: 58f6b41f855a6f6c3560debd84e2affc
> HCI Event: Number of Completed Packets (0x13) plen 5    #191 [hci1] 14.586909
        Num handles: 1
        Handle: 3297 Address: DF:A9:FF:F6:B1:1A (OUI DF-A9-FF)
        Count: 1
        #190: len 21 (0 Kb/s)
        Latency: 172 msec (67-172 msec ~164 msec)
> ACL Data RX: Handle 3297 flags 0x02 dlen 21             #192 [hci1] 14.674703
      SMP: Pairing Confirm (0x03) len 16
        Confim value: 1f62e0b54093823afbdf647d6a4105fe
< HCI Command: Host Number of Com.. (0x03|0x0035) plen 5  #193 [hci1] 14.694717
        Num handles: 1
        Handle: 3297 Address: DF:A9:FF:F6:B1:1A (OUI DF-A9-FF)
        Count: 1
< ACL Data TX: Handle 3297 flags 0x00 dlen 21             #194 [hci1] 14.694977
      SMP: Pairing Confirm (0x03) len 16
        Confim value: a26d1d4a78706e942d33adde85f335ec
> HCI Event: Number of Completed Packets (0x13) plen 5    #195 [hci1] 14.849583
        Num handles: 1
        Handle: 3297 Address: DF:A9:FF:F6:B1:1A (OUI DF-A9-FF)
        Count: 1
        #194: len 21 (1 Kb/s)
        Latency: 154 msec (67-172 msec ~159 msec)
> ACL Data RX: Handle 3297 flags 0x02 dlen 21             #196 [hci1] 14.849874
      SMP: Pairing Random (0x04) len 16
        Random value: 769c08b13d2ea23e0000000000000000
< HCI Command: Host Number of Com.. (0x03|0x0035) plen 5  #197 [hci1] 14.854402
        Num handles: 1
        Handle: 3297 Address: DF:A9:FF:F6:B1:1A (OUI DF-A9-FF)
        Count: 1
< ACL Data TX: Handle 3297 flags 0x00 dlen 21             #198 [hci1] 14.854485
      SMP: Pairing Random (0x04) len 16
        Random value: b67e7216d5bf664139eda2b542549666
> HCI Event: Number of Completed Packets (0x13) plen 5    #199 [hci1] 15.024362
        Num handles: 1
        Handle: 3297 Address: DF:A9:FF:F6:B1:1A (OUI DF-A9-FF)
        Count: 1
        #198: len 21 (0 Kb/s)
        Latency: 169 msec (67-172 msec ~164 msec)
> ACL Data RX: Handle 3297 flags 0x02 dlen 21             #200 [hci1] 15.112263
      SMP: Pairing Confirm (0x03) len 16
        Confim value: 3b9414c286b0594c9275309615f8e3c4
< HCI Command: Host Number of Com.. (0x03|0x0035) plen 5  #201 [hci1] 15.114737
        Num handles: 1
        Handle: 3297 Address: DF:A9:FF:F6:B1:1A (OUI DF-A9-FF)
        Count: 1
< ACL Data TX: Handle 3297 flags 0x00 dlen 21             #202 [hci1] 15.114983
      SMP: Pairing Confirm (0x03) len 16
        Confim value: ab6e3c36945bb3384ed68fb0c5611a69
> HCI Event: Number of Completed Packets (0x13) plen 5    #203 [hci1] 15.287093
        Num handles: 1
        Handle: 3297 Address: DF:A9:FF:F6:B1:1A (OUI DF-A9-FF)
        Count: 1
        #202: len 21 (0 Kb/s)
        Latency: 172 msec (67-172 msec ~168 msec)
> ACL Data RX: Handle 3297 flags 0x02 dlen 21             #204 [hci1] 15.287404
      SMP: Pairing Random (0x04) len 16
        Random value: 5d0a1ce4cc64300d0000000000000000
< HCI Command: Host Number of Com.. (0x03|0x0035) plen 5  #205 [hci1] 15.294813
        Num handles: 1
        Handle: 3297 Address: DF:A9:FF:F6:B1:1A (OUI DF-A9-FF)
        Count: 1
< ACL Data TX: Handle 3297 flags 0x00 dlen 21             #206 [hci1] 15.294891
      SMP: Pairing Random (0x04) len 16
        Random value: ed17f76500c95219dd01e09d1e63f87b
> HCI Event: Number of Completed Packets (0x13) plen 5    #207 [hci1] 15.462143
        Num handles: 1
        Handle: 3297 Address: DF:A9:FF:F6:B1:1A (OUI DF-A9-FF)
        Count: 1
        #206: len 21 (1 Kb/s)
        Latency: 167 msec (67-172 msec ~167 msec)
> ACL Data RX: Handle 3297 flags 0x02 dlen 21             #208 [hci1] 15.462410
      SMP: Pairing Confirm (0x03) len 16
        Confim value: 3af4c9b022c96b612acba6c4eea8dc91
< HCI Command: Host Number of Com.. (0x03|0x0035) plen 5  #209 [hci1] 15.474285
        Num handles: 1
        Handle: 3297 Address: DF:A9:FF:F6:B1:1A (OUI DF-A9-FF)
        Count: 1
< ACL Data TX: Handle 3297 flags 0x00 dlen 21             #210 [hci1] 15.474304
      SMP: Pairing Confirm (0x03) len 16
        Confim value: 553418442fea33d4a3ffecebf8fca911
> HCI Event: Number of Completed Packets (0x13) plen 5    #211 [hci1] 15.637055
        Num handles: 1
        Handle: 3297 Address: DF:A9:FF:F6:B1:1A (OUI DF-A9-FF)
        Count: 1
        #210: len 21 (1 Kb/s)
        Latency: 162 msec (67-172 msec ~165 msec)
> ACL Data RX: Handle 3297 flags 0x02 dlen 21             #212 [hci1] 15.637353
      SMP: Pairing Random (0x04) len 16
        Random value: fee5731d6dfa36430000000000000000
< HCI Command: Host Number of Com.. (0x03|0x0035) plen 5  #213 [hci1] 15.654851
        Num handles: 1
        Handle: 3297 Address: DF:A9:FF:F6:B1:1A (OUI DF-A9-FF)
        Count: 1
< ACL Data TX: Handle 3297 flags 0x00 dlen 21             #214 [hci1] 15.654973
      SMP: Pairing Random (0x04) len 16
        Random value: 81d35d47e1f6006d79c974bd9d9e1ee3
> HCI Event: Number of Completed Packets (0x13) plen 5    #215 [hci1] 15.811904
        Num handles: 1
        Handle: 3297 Address: DF:A9:FF:F6:B1:1A (OUI DF-A9-FF)
        Count: 1
        #214: len 21 (1 Kb/s)
        Latency: 156 msec (67-172 msec ~161 msec)
> ACL Data RX: Handle 3297 flags 0x02 dlen 21             #216 [hci1] 15.899695
      SMP: Pairing Confirm (0x03) len 16
        Confim value: e2702153c22799903296183bc192766f
< HCI Command: Host Number of Com.. (0x03|0x0035) plen 5  #217 [hci1] 15.914446
        Num handles: 1
        Handle: 3297 Address: DF:A9:FF:F6:B1:1A (OUI DF-A9-FF)
        Count: 1
< ACL Data TX: Handle 3297 flags 0x00 dlen 21             #218 [hci1] 15.914550
      SMP: Pairing Confirm (0x03) len 16
        Confim value: 1f8005ad512451e65b0c345b8503ae54
> HCI Event: Number of Completed Packets (0x13) plen 5    #219 [hci1] 16.074532
        Num handles: 1
        Handle: 3297 Address: DF:A9:FF:F6:B1:1A (OUI DF-A9-FF)
        Count: 1
        #218: len 21 (1 Kb/s)
        Latency: 159 msec (67-172 msec ~160 msec)
> ACL Data RX: Handle 3297 flags 0x02 dlen 21             #220 [hci1] 16.074940
      SMP: Pairing Random (0x04) len 16
        Random value: cba5bc107001588b0000000000000000
< HCI Command: Host Number of Com.. (0x03|0x0035) plen 5  #221 [hci1] 16.094807
        Num handles: 1
        Handle: 3297 Address: DF:A9:FF:F6:B1:1A (OUI DF-A9-FF)
        Count: 1
< ACL Data TX: Handle 3297 flags 0x00 dlen 21             #222 [hci1] 16.094876
      SMP: Pairing Random (0x04) len 16
        Random value: e7f7e0c2476823e41736a7e381bafb7c
> HCI Event: Number of Completed Packets (0x13) plen 5    #223 [hci1] 16.249367
        Num handles: 1
        Handle: 3297 Address: DF:A9:FF:F6:B1:1A (OUI DF-A9-FF)
        Count: 1
        #222: len 21 (1 Kb/s)
        Latency: 154 msec (67-172 msec ~157 msec)
> ACL Data RX: Handle 3297 flags 0x02 dlen 21             #224 [hci1] 16.337140
      SMP: Pairing Confirm (0x03) len 16
        Confim value: ebae4ad1aa3a3a069beb86074a8ecd60
< HCI Command: Host Number of Com.. (0x03|0x0035) plen 5  #225 [hci1] 16.354442
        Num handles: 1
        Handle: 3297 Address: DF:A9:FF:F6:B1:1A (OUI DF-A9-FF)
        Count: 1
< ACL Data TX: Handle 3297 flags 0x00 dlen 21             #226 [hci1] 16.354550
      SMP: Pairing Confirm (0x03) len 16
        Confim value: ca160193858002fbbdc12daa093b82a1
> HCI Event: Number of Completed Packets (0x13) plen 5    #227 [hci1] 16.512046
        Num handles: 1
        Handle: 3297 Address: DF:A9:FF:F6:B1:1A (OUI DF-A9-FF)
        Count: 1
        #226: len 21 (1 Kb/s)
        Latency: 157 msec (67-172 msec ~157 msec)
> ACL Data RX: Handle 3297 flags 0x02 dlen 21             #228 [hci1] 16.512408
      SMP: Pairing Random (0x04) len 16
        Random value: 3793bc2805b7323d0000000000000000
