Bluetooth monitor ver 5.72
= Note: Linux version 6.14.0-36-generic (x86_64)                       0.656432
= Note: Bluetooth subsystem version 2.22                               0.656434
= New Index: 00:00:00:00:00:00 (Primary,UART,hci1)              [hci1] 0.656435
= New Index: 48:5F:99:8E:E0:64 (Primary,USB,hci0)               [hci0] 0.656436
= Open Index: 00:00:00:00:00:00                                 [hci1] 1.170295
= Index Info: 00:00:00:00:00:00 (Nordic Semiconductor ASA)      [hci1] 1.170309
@ USER Open: main (privileged) version 2.22            {0x0001} [hci1] 1.170318
< HCI Command: Reset (0x03|0x0003) plen 0                    #1 [hci1] 1.171596
> HCI Event: Command Complete (0x0e) plen 4                  #2 [hci1] 1.172146
      Reset (0x03|0x0003) ncmd 1
        Status: Success (0x00)
< HCI Command: Read Local Supported... (0x04|0x0003) plen 0  #3 [hci1] 1.189997
> HCI Event: Command Complete (0x0e) plen 12                 #4 [hci1] 1.190578
      Read Local Supported Features (0x04|0x0003) ncmd 1
        Status: Success (0x00)
        Features: 0x00 0x00 0x00 0x00 0x60 0x00 0x00 0x00
          BR/EDR Not Supported
          LE Supported (Controller)
< HCI Command: Read Local Version In.. (0x04|0x0001) plen 0  #5 [hci1] 1.209817
> HCI Event: Command Complete (0x0e) plen 12                 #6 [hci1] 1.210345
      Read Local Version Information (0x04|0x0001) ncmd 1
        Status: Success (0x00)
        HCI version: Reserved (0x0f) - Revision 12393 (0x3069)
        LMP version: Reserved (0x0f) - Subversion 12393 (0x3069)
        Manufacturer: Nordic Semiconductor ASA (89)
< HCI Command: Read Local Supported... (0x04|0x0002) plen 0  #7 [hci1] 1.229719
> HCI Event: Command Complete (0x0e) plen 68                 #8 [hci1] 1.230778
      Read Local Supported Commands (0x04|0x0002) ncmd 1
        Status: Success (0x00)
        Commands: 119 entries
          Disconnect (Octet 0 - Bit 5)
          Read Remote Version Information (Octet 2 - Bit 7)
          Set Event Mask (Octet 5 - Bit 6)
          Reset (Octet 5 - Bit 7)
          Read Connection Accept Timeout (Octet 7 - Bit 2)
          Write Connection Accept Timeout (Octet 7 - Bit 3)
          Read Transmit Power Level (Octet 10 - Bit 2)
          Set Controller To Host Flow Control (Octet 10 - Bit 5)
          Host Buffer Size (Octet 10 - Bit 6)
          Host Number of Completed Packets (Octet 10 - Bit 7)
          Read Local Version Information (Octet 14 - Bit 3)
          Read Local Supported Features (Octet 14 - Bit 5)
          Read BD ADDR (Octet 15 - Bit 1)
          Read RSSI (Octet 15 - Bit 5)
          Set Event Mask Page 2 (Octet 22 - Bit 2)
          LE Set Event Mask (Octet 25 - Bit 0)
          LE Read Buffer Size (Octet 25 - Bit 1)
          LE Read Local Supported Features (Octet 25 - Bit 2)
          LE Set Random Address (Octet 25 - Bit 4)
          LE Set Advertising Parameters (Octet 25 - Bit 5)
          LE Read Advertising Channel TX Power (Octet 25 - Bit 6)
          LE Set Advertising Data (Octet 25 - Bit 7)
          LE Set Scan Response Data (Octet 26 - Bit 0)
          LE Set Advertise Enable (Octet 26 - Bit 1)
          LE Set Scan Parameters (Octet 26 - Bit 2)
          LE Set Scan Enable (Octet 26 - Bit 3)
          LE Create Connection (Octet 26 - Bit 4)
          LE Create Connection Cancel (Octet 26 - Bit 5)
          LE Read Accept List Size (Octet 26 - Bit 6)
          LE Clear Accept List (Octet 26 - Bit 7)
          LE Add Device To Accept List (Octet 27 - Bit 0)
          LE Remove Device From Accept List (Octet 27 - Bit 1)
          LE Connection Update (Octet 27 - Bit 2)
          LE Set Host Channel Classification (Octet 27 - Bit 3)
          LE Read Channel Map (Octet 27 - Bit 4)
          LE Read Remote Used Features (Octet 27 - Bit 5)
          LE Encrypt (Octet 27 - Bit 6)
          LE Rand (Octet 27 - Bit 7)
          LE Start Encryption (Octet 28 - Bit 0)
          LE Long Term Key Request Reply (Octet 28 - Bit 1)
          LE Long Term Key Request Neg Reply (Octet 28 - Bit 2)
          LE Read Supported States (Octet 28 - Bit 3)
          LE Receiver Test (Octet 28 - Bit 4)
          LE Transmitter Test (Octet 28 - Bit 5)
          LE Test End (Octet 28 - Bit 6)
          Read Authenticated Payload Timeout (Octet 32 - Bit 4)
          Write Authenticated Payload Timeout (Octet 32 - Bit 5)
          LE Set Data Length (Octet 33 - Bit 6)
          LE Read Suggested Default Data Length (Octet 33 - Bit 7)
          LE Write Suggested Default Data Length (Octet 34 - Bit 0)
          LE Add Device To Resolving List (Octet 34 - Bit 3)
          LE Remove Device From Resolving List (Octet 34 - Bit 4)
          LE Clear Resolving List (Octet 34 - Bit 5)
          LE Read Resolving List Size (Octet 34 - Bit 6)
          LE Set Address Resolution Enable (Octet 35 - Bit 1)
          LE Set Resolvable Private Address Timeout (Octet 35 - Bit 2)
          LE Read Maximum Data Length (Octet 35 - Bit 3)
          LE Read PHY (Octet 35 - Bit 4)
          LE Set Default PHY (Octet 35 - Bit 5)
          LE Set PHY (Octet 35 - Bit 6)
          LE Enhanced Receiver Test (Octet 35 - Bit 7)
          LE Enhanced Transmitter Test (Octet 36 - Bit 0)
          LE Set Advertising Set Random Address (Octet 36 - Bit 1)
          LE Set Extended Advertising Parameters (Octet 36 - Bit 2)
          LE Set Extended Advertising Data (Octet 36 - Bit 3)
          LE Set Extended Scan Response Data (Octet 36 - Bit 4)
          LE Set Extended Advertising Enable (Octet 36 - Bit 5)
          LE Read Maximum Advertising Data Length (Octet 36 - Bit 6)
          LE Read Number of Supported Advertising Sets (Octet 36 - Bit 7)
          LE Remove Advertising Set (Octet 37 - Bit 0)
          LE Clear Advertising Sets (Octet 37 - Bit 1)
          LE Set Periodic Advertising Parameters (Octet 37 - Bit 2)
          LE Set Periodic Advertising Data (Octet 37 - Bit 3)
          LE Set Periodic Advertising Enable (Octet 37 - Bit 4)
          LE Set Extended Scan Parameters (Octet 37 - Bit 5)
          LE Set Extended Scan Enable (Octet 37 - Bit 6)
          LE Extended Create Connection (Octet 37 - Bit 7)
          LE Periodic Advertising Create Sync (Octet 38 - Bit 0)
          LE Periodic Advertising Create Sync Cancel (Octet 38 - Bit 1)
          LE Periodic Advertising Terminate Sync (Octet 38 - Bit 2)
          LE Add Device To Periodic Advertiser List (Octet 38 - Bit 3)
          LE Remove Device From Periodic Advertiser List (Octet 38 - Bit 4)
          LE Clear Periodic Advertiser List (Octet 38 - Bit 5)
          LE Read Periodic Advertiser List Size (Octet 38 - Bit 6)
          LE Read Transmit Power (Octet 38 - Bit 7)
          LE Read RF Path Compensation (Octet 39 - Bit 0)
          LE Write RF Path Compensation (Octet 39 - Bit 1)
          LE Set Privacy Mode (Octet 39 - Bit 2)
          LE Periodic Advertising Receive Enable (Octet 40 - Bit 5)
          LE Periodic Advertising Sync Transfer (Octet 40 - Bit 6)
          LE Periodic Advertising Set Info Transfer (Octet 40 - Bit 7)
          LE Periodic Advertising Sync Transfer Parameters (Octet 41 - Bit 0)
          LE Set Default Periodic Advertisng Sync Transfer Parameters (Octet 41 - Bit 1)
          LE Read Buffer v2 (Octet 41 - Bit 5)
          LE Read ISO TX Sync (Octet 41 - Bit 6)
          LE Set Connected Isochronous Group Parameters (Octet 41 - Bit 7)
          LE Set Connected Isochronous Group Parameters Test (Octet 42 - Bit 0)
          LE Create Connected Isochronous Stream (Octet 42 - Bit 1)
          LE Remove Connected Isochronous Group (Octet 42 - Bit 2)
          LE Accept Connected Isochronous Stream Request (Octet 42 - Bit 3)
          LE Reject Connected Isochronous Stream Request (Octet 42 - Bit 4)
          LE Create Broadcast Isochronous Group (Octet 42 - Bit 5)
          LE Create Broadcast Isochronous Group Test (Octet 42 - Bit 6)
          LE Terminate Broadcast Isochronous Group (Octet 42 - Bit 7)
          LE Broadcast Isochronous Group Create Sync (Octet 43 - Bit 0)
          LE Broadcast Isochronous Group Terminate Sync (Octet 43 - Bit 1)
          LE Request Peer SCA (Octet 43 - Bit 2)
          LE Setup Isochronous Data Path (Octet 43 - Bit 3)
          LE Remove Isochronous Data Path (Octet 43 - Bit 4)
          LE Isochronous Transmit Test (Octet 43 - Bit 5)
          LE Isochronous Receive Test (Octet 43 - Bit 6)
          LE Isochronous Read Test Counters (Octet 43 - Bit 7)
          LE Isochronous Read Test Counters (Octet 44 - Bit 0)
          LE Set Host Feature (Octet 44 - Bit 1)
          Octet 44 - Bit 2 
          Octet 45 - Bit 6 
          Octet 46 - Bit 0 
          Octet 46 - Bit 1 
          Octet 46 - Bit 2 
< HCI Command: Host Buffer Size (0x03|0x0033) plen 7         #9 [hci1] 1.249736
        ACL MTU: 255  ACL max packet: 16
        SCO MTU: 0    SCO max packet: 0
> HCI Event: Command Complete (0x0e) plen 4                 #10 [hci1] 1.250262
      Host Buffer Size (0x03|0x0033) ncmd 1
        Status: Success (0x00)
< HCI Command: Set Controller To Ho.. (0x03|0x0031) plen 1  #11 [hci1] 1.269737
        Flow control: ACL Data Packets (0x01)
> HCI Event: Command Complete (0x0e) plen 4                 #12 [hci1] 1.270207
      Set Controller To Host Flow Control (0x03|0x0031) ncmd 1
        Status: Success (0x00)
< HCI Command: LE Read Local Suppor.. (0x08|0x0003) plen 0  #13 [hci1] 1.289725
> HCI Event: Command Complete (0x0e) plen 12                #14 [hci1] 1.290245
      LE Read Local Supported Features (0x08|0x0003) ncmd 1
        Status: Success (0x00)
        Features: 0xfd 0x79 0x00 0xf7 0x30 0x01 0x00 0x00
          LE Encryption
          Extended Reject Indication
          Peripheral-initiated Features Exchange
          LE Ping
          LE Data Packet Length Extension
          LL Privacy
          Extended Scanner Filter Policies
          LE 2M PHY
          LE Coded PHY
          LE Extended Advertising
          LE Periodic Advertising
          Channel Selection Algorithm #2
          Periodic Advertising Sync Transfer - Sender
          Periodic Advertising Sync Transfer - Recipient
          Sleep Clock Accuracy Updates
          Connected Isochronous Stream - Central
          Connected Isochronous Stream - Peripheral
          Isochronous Broadcaster
          Synchronized Receiver
          Periodic Advertising ADI support
          Connection Subrating
          Unknown features (0x0000010000000000)
< HCI Command: LE Set Host Feature (0x08|0x0074) plen 2     #15 [hci1] 1.309742
        Bit Number: 32
          Connected Isochronous Stream (Host Support)
        Bit Value: 1
> HCI Event: Command Complete (0x0e) plen 4                 #16 [hci1] 1.310175
      LE Set Host Feature (0x08|0x0074) ncmd 1
        Status: Success (0x00)
< HCI Command: LE Read Buffer v2 (0x08|0x0060) plen 0       #17 [hci1] 1.329729
> HCI Event: Command Complete (0x0e) plen 10                #18 [hci1] 1.330221
      LE Read Buffer v2 (0x08|0x0060) ncmd 1
        Status: Success (0x00)
        ACL MTU: 27
        ACL max packet: 3
        ISO MTU: 318
        ISO max packet: 3
< HCI Command: LE Read Maximum Adve.. (0x08|0x003a) plen 0  #19 [hci1] 1.349788
> HCI Event: Command Complete (0x0e) plen 6                 #20 [hci1] 1.350242
      LE Read Maximum Advertising Data Length (0x08|0x003a) ncmd 1
        Status: Success (0x00)
        Max length: 1650
< HCI Command: LE Read Supported St.. (0x08|0x001c) plen 0  #21 [hci1] 1.369785
> HCI Event: Command Complete (0x0e) plen 12                #22 [hci1] 1.370335
      LE Read Supported States (0x08|0x001c) ncmd 1
        Status: Success (0x00)
        States: 0x000003ff3e0306ff
          Non-connectable Advertising State
          Scannable Advertising State
          Connectable Advertising State
          High Duty Cycle Directed Advertising State
          Passive Scanning State
          Active Scanning State
          Initiating State
            and Connection State (Central Role)
          Connection State (Peripheral Role)
          Scannable Advertising State
            and Passive Scanning State
          Connectable Advertising State
            and Passive Scanning State
          Non-connectable Advertising State
            and Initiating State
          Scannable Advertising State
            and Initiating State
          Active Scanning State
            and Connection State (Central Role)
          Passive Scanning State
            and Connection State (Peripheral Role)
          Active Scanning State
            and Connection State (Peripheral Role)
          Initiating State
            and Connection State (Central Role)
            and Central Role & Central Role
          Low Duty Cycle Directed Advertising State
          Connectable Advertising State
            and Initiating State
            and Central Role & Peripheral Role
          High Duty Cycle Directed Advertising State
            and Initiating State
            and Central Role & Peripheral Role
          Low Duty Cycle Directed Advertising State
            and Initiating State
            and Central Role & Peripheral Role
          Connectable Advertising State
            and Connection State (Central Role)
            and Central Role & Peripheral Role
          High Duty Cycle Directed Advertising State
            and Connection State (Central Role)
            and Central Role & Peripheral Role
          Low Duty Cycle Directed Advertising State
            and Connection State (Central Role)
            and Central Role & Peripheral Role
          Connectable Advertising State
            and Connection State (Peripheral Role)
            and Central Role & Peripheral Role
          High Duty Cycle Directed Advertising State
            and Connection State (Peripheral Role)
            and Peripheral Role & Peripheral Role
          Low Duty Cycle Directed Advertising State
            and Connection State (Peripheral Role)
            and Peripheral Role & Peripheral Role
          Initiating State
            and Connection State (Peripheral Role)
            and Central Role & Peripheral Role
< HCI Command: LE Read Maximum Data.. (0x08|0x002f) plen 0  #23 [hci1] 1.389745
> HCI Event: Command Complete (0x0e) plen 12                #24 [hci1] 1.390316
      LE Read Maximum Data Length (0x08|0x002f) ncmd 1
        Status: Success (0x00)
        Max TX octets: 251
        Max TX time: 2704
        Max RX octets: 251
        Max RX time: 2704
< HCI Command: LE Write Suggested D.. (0x08|0x0024) plen 4  #25 [hci1] 1.409747
        TX octets: 251
        TX time: 2704
> HCI Event: Command Complete (0x0e) plen 4                 #26 [hci1] 1.410256
      LE Write Suggested Default Data Length (0x08|0x0024) ncmd 1
        Status: Success (0x00)
< HCI Command: LE Read Resolving Li.. (0x08|0x002a) plen 0  #27 [hci1] 1.429751
> HCI Event: Command Complete (0x0e) plen 5                 #28 [hci1] 1.430342
      LE Read Resolving List Size (0x08|0x002a) ncmd 1
        Status: Success (0x00)
        Size: 8
< HCI Command: LE Set Event Mask (0x08|0x0001) plen 8       #29 [hci1] 1.449732
        Mask: 0x000002023f87fa5e
          LE Advertising Report
          LE Connection Update Complete
          LE Read Remote Used Features Complete
          LE Long Term Key Request
          LE Data Length Change
          LE Enhanced Connection Complete
          LE PHY Update Complete
          LE Extended Advertising Report
          LE Periodic Advertising Sync Established
          LE Periodic Advertising Report
          LE Periodic Advertising Sync Lost
          LE Extended Scan Timeout
          LE Extended Advertising Set Terminated
          LE Scan Request Received
          LE Periodic Advertising Sync Transfer Rvc
          LE CIS Established
          LE CIS Request
          LE Create BIG Complete
          LE Terminate BIG Complete
          LE BIG Sync Estabilished Complete
          LE BIG Sync Lost
          LE BIG Info Advertising Report
          Unknown mask (0x0000020000000000)
> HCI Event: Command Complete (0x0e) plen 4                 #30 [hci1] 1.450252
      LE Set Event Mask (0x08|0x0001) ncmd 1
        Status: Success (0x00)
< HCI Command: Set Event Mask (0x03|0x0001) plen 8          #31 [hci1] 1.469749
        Mask: 0x2000800002008890
          Disconnection Complete
          Encryption Change
          Read Remote Version Information Complete
          Hardware Error
          Data Buffer Overflow
          Encryption Key Refresh Complete
          LE Meta
> HCI Event: Command Complete (0x0e) plen 4                 #32 [hci1] 1.470340
      Set Event Mask (0x03|0x0001) ncmd 1
        Status: Success (0x00)
< HCI Command: Read BD ADDR (0x04|0x0009) plen 0            #33 [hci1] 1.489751
> HCI Event: Command Complete (0x0e) plen 10                #34 [hci1] 1.490233
      Read BD ADDR (0x04|0x0009) ncmd 1
        Status: Success (0x00)
        Address: 00:00:00:00:00:00 (OUI 00-00-00)
< HCI Command: LE Set Random Address (0x08|0x0005) plen 6   #35 [hci1] 1.509713
        Address: D5:B6:CC:31:DB:3B (Static)
> HCI Event: Command Complete (0x0e) plen 4                 #36 [hci1] 1.510170
      LE Set Random Address (0x08|0x0005) ncmd 1
        Status: Success (0x00)
< HCI Command: LE Set Extended Adv.. (0x08|0x0036) plen 25  #37 [hci1] 4.069940
        Handle: 0x00
        Properties: 0x0010
          Use legacy advertising PDUs: ADV_NONCONN_IND
        Min advertising interval: 20.000 msec (0x0020)
        Max advertising interval: 20.000 msec (0x0020)
        Channel map: 37, 38, 39 (0x07)
        Own address type: Random (0x01)
        Peer address type: Public (0x00)
        Peer address: 00:00:00:00:00:00 (OUI 00-00-00)
        Filter policy: Allow Scan Request from Any, Allow Connect Request from Any (0x00)
        TX power: Host has no preference (0x7f)
        Primary PHY: LE 1M (0x01)
        Secondary max skip: 0x00
        Secondary PHY: LE 1M (0x01)
        SID: 0x00
        Scan request notifications: Disabled (0x00)
> HCI Event: Command Complete (0x0e) plen 5                 #38 [hci1] 4.070745
      LE Set Extended Advertising Parameters (0x08|0x0036) ncmd 1
        Status: Success (0x00)
        TX power (selected): 0 dbm (0x00)
< HCI Command: LE Set Advertising S.. (0x08|0x0035) plen 7  #39 [hci1] 4.089836
        Advertising handle: 0x00
        Advertising random address: 24:34:0C:0D:44:02 (Non-Resolvable)
> HCI Event: Command Complete (0x0e) plen 4                 #40 [hci1] 4.090327
      LE Set Advertising Set Random Address (0x08|0x0035) ncmd 1
        Status: Success (0x00)
< HCI Command: LE Set Random Address (0x08|0x0005) plen 6   #41 [hci1] 4.109816
        Address: 24:71:FD:F8:AC:A2 (Non-Resolvable)
> HCI Event: Command Complete (0x0e) plen 4                 #42 [hci1] 4.110360
      LE Set Random Address (0x08|0x0005) ncmd 1
        Status: Success (0x00)
< HCI Command: LE Set Extended Scan.. (0x08|0x0041) plen 8  #43 [hci1] 4.129766
        Own address type: Random (0x01)
        Filter policy: Accept all advertisement (0x00)
        PHYs: 0x01
        Entry 0: LE 1M
          Type: Passive (0x00)
          Interval: 30.000 msec (0x0030)
          Window: 30.000 msec (0x0030)
> HCI Event: Command Complete (0x0e) plen 4                 #44 [hci1] 4.130377
      LE Set Extended Scan Parameters (0x08|0x0041) ncmd 1
        Status: Success (0x00)
< HCI Command: LE Set Extended Scan.. (0x08|0x0042) plen 6  #45 [hci1] 4.149798
        Extended scan: Enabled (0x01)
        Filter duplicates: Disabled (0x00)
        Duration: 0 msec (0x0000)
        Period: 0.00 sec (0x0000)
> HCI Event: Command Complete (0x0e) plen 4                 #46 [hci1] 4.150319
      LE Set Extended Scan Enable (0x08|0x0042) ncmd 1
        Status: Success (0x00)
< HCI Command: LE Set Advertising S.. (0x08|0x0035) plen 7  #47 [hci1] 4.170001
        Advertising handle: 0x00
        Advertising random address: D5:B6:CC:31:DB:3B (Static)
> HCI Event: Command Complete (0x0e) plen 4                 #48 [hci1] 4.170470
      LE Set Advertising Set Random Address (0x08|0x0035) ncmd 1
        Status: Success (0x00)
> HCI Event: LE Meta Event (0x3e) plen 54                   #49 [hci1] 4.175743
      LE Extended Advertising Report (0x0d)
        Num reports: 1
        Entry 0
          Event type: 0x0010
            Props: 0x0010
              Use legacy advertising PDUs
            Data status: [0;32mComplete[0m
          Legacy PDU Type: ADV_NONCONN_IND (0x0010)
          Address type: Public (0x00)
          Address: A4:30:7A:95:74:FB (Samsung Electronics Co.,Ltd)
          Primary PHY: LE 1M
          Secondary PHY: No packets
          SID: no ADI field (0xff)
          TX power: 127 dBm
          RSSI: -80 dBm (0xb0)
          Periodic advertising interval: 0.00 msec (0x0000)
          Direct address type: Reserved (0xff)
          Direct address: 00-00-00-00-00-00
          Data length: 0x1c
        1b ff 75 00 42 04 01 80 6e a4 30 7a 95 74 fb a6  ..u.B...n.0z.t..
        30 7a 95 74 fa 01 d8 41 c5 d9 00 00              0z.t...A....    
        Company: Samsung Electronics Co. Ltd. (117)
          Data: 420401806ea4307a9574fba6307a9574fa01d841c5d90000
> HCI Event: LE Meta Event (0x3e) plen 44                   #50 [hci1] 4.179157
      LE Extended Advertising Report (0x0d)
        Num reports: 1
        Entry 0
          Event type: 0x0013
            Props: 0x0013
              Connectable
              Scannable
              Use legacy advertising PDUs
            Data status: [0;32mComplete[0m
          Legacy PDU Type: ADV_IND (0x0013)
          Address type: Random (0x01)
          Address: 47:74:85:BE:EC:3A (Resolvable)
          Primary PHY: LE 1M
          Secondary PHY: No packets
          SID: no ADI field (0xff)
          TX power: 127 dBm
          RSSI: -86 dBm (0xaa)
          Periodic advertising interval: 0.00 msec (0x0000)
          Direct address type: Reserved (0xff)
          Direct address: 00-00-00-00-00-00
          Data length: 0x12
        02 01 1a 02 0a 08 0b ff 4c 00 10 06 3f 1a dd 89  ........L...?...
        4a 4a                                            JJ              
        Flags: 0x1a
          LE General Discoverable Mode
          Simultaneous LE and BR/EDR (Controller)
          Simultaneous LE and BR/EDR (Host)
        TX power: 8 dBm
        Company: Apple, Inc. (76)
          Type: Unknown (16)
          Data: 3f1add894a4a
< HCI Command: LE Set Extended Adv.. (0x08|0x0036) plen 25  #51 [hci1] 4.189937
        Handle: 0x00
        Properties: 0x0013
          Connectable
          Scannable
          Use legacy advertising PDUs: ADV_IND
        Min advertising interval: 100.000 msec (0x00a0)
        Max advertising interval: 150.000 msec (0x00f0)
        Channel map: 37, 38, 39 (0x07)
        Own address type: Random (0x01)
        Peer address type: Public (0x00)
        Peer address: 00:00:00:00:00:00 (OUI 00-00-00)
        Filter policy: Allow Scan Request from Any, Allow Connect Request from Any (0x00)
        TX power: Host has no preference (0x7f)
        Primary PHY: LE 1M (0x01)
        Secondary max skip: 0x00
        Secondary PHY: LE 1M (0x01)
        SID: 0x00
        Scan request notifications: Disabled (0x00)
> HCI Event: Command Complete (0x0e) plen 5                 #52 [hci1] 4.190661
      LE Set Extended Advertising Parameters (0x08|0x0036) ncmd 1
        Status: Success (0x00)
        TX power (selected): 0 dbm (0x00)
< HCI Command: LE Set Extended Adv.. (0x08|0x0037) plen 33  #53 [hci1] 4.209794
        Handle: 0x00
        Operation: Complete extended advertising data (0x03)
        Fragment preference: Minimize fragmentation (0x01)
        Data length: 0x1d
        Flags: 0x06
          LE General Discoverable Mode
          BR/EDR Not Supported
        16-bit Service UUIDs (complete): 1 entry
          Mesh Provisioning (0x1827)
        Service Data: Mesh Provisioning (0x1827)
          Data: 554f624fde8947ec824341da4b8dfa3f0000
> HCI Event: Command Complete (0x0e) plen 4                 #54 [hci1] 4.210596
      LE Set Extended Advertising Data (0x08|0x0037) ncmd 1
        Status: Success (0x00)
> HCI Event: LE Meta Event (0x3e) plen 72                   #55 [hci1] 4.219741
      LE Extended Advertising Report (0x0d)
        Num reports: 1
        Entry 0
          Event type: 0x0000
            Props: 0x0000
            Data status: [0;32mComplete[0m
          Address type: Random (0x01)
          Address: EC:98:83:EA:36:AB (Static)
          Primary PHY: LE 1M
          Secondary PHY: LE 2M
          SID: 0x0c
          TX power: 127 dBm
          RSSI: -92 dBm (0xa4)
          Periodic advertising interval: 106.25 msec (0x0055)
          Direct address type: Reserved (0xff)
          Direct address: 00-00-00-00-00-00
          Data length: 0x2e
        06 16 52 18 c0 de c0 05 16 56 18 04 00 0d 30 4e  ..R......V....0N
        69 6d 42 4c 45 20 61 75 64 69 6f 0e 09 41 70 61  imBLE audio..Apa
        63 68 65 20 4e 69 6d 42 4c 45 03 19 80 08        che NimBLE....  
        Service Data: Broadcast Audio Announcement (0x1852)
        Broadcast ID: 12639936 (0xc0dec0)
        Service Data: Public Broadcast Announcement (0x1856)
          Data: 0400
        Unknown EIR field 0x30: 4e696d424c4520617564696f
        Name (complete): Apache NimBLE
        Appearance: Undefined (0x0880)
> HCI Event: LE Meta Event (0x3e) plen 55                   #56 [hci1] 4.221770
      LE Extended Advertising Report (0x0d)
        Num reports: 1
        Entry 0
          Event type: 0x0010
            Props: 0x0010
              Use legacy advertising PDUs
            Data status: [0;32mComplete[0m
          Legacy PDU Type: ADV_NONCONN_IND (0x0010)
          Address type: Random (0x01)
          Address: 12:33:8E:64:80:4D (Non-Resolvable)
          Primary PHY: LE 1M
          Secondary PHY: No packets
          SID: no ADI field (0xff)
          TX power: 127 dBm
          RSSI: -92 dBm (0xa4)
          Periodic advertising interval: 0.00 msec (0x0000)
          Direct address type: Reserved (0xff)
          Direct address: 00-00-00-00-00-00
          Data length: 0x1d
        1c ff 06 00 01 09 21 0a 4d e0 8a 52 d2 d4 4c 41  ......!.M..R..LA
        50 54 4f 50 2d 45 35 32 45 4f 44 32 49           PTOP-E52EOD2I   
        Company: Microsoft (6)
          Data: 0109210a4de08a52d2d44c4150544f502d453532454f443249
< HCI Command: LE Set Extended Sca.. (0x08|0x0038) plen 20  #57 [hci1] 4.229877
        Handle: 0x00
        Operation: Complete scan response data (0x03)
        Fragment preference: Minimize fragmentation (0x01)
        Data length: 0x10
        Unknown EIR field 0x24: 546573746572
        Name (complete): Tester
> HCI Event: Command Complete (0x0e) plen 4                 #58 [hci1] 4.230634
      LE Set Extended Scan Response Data (0x08|0x0038) ncmd 1
        Status: Success (0x00)
> HCI Event: LE Meta Event (0x3e) plen 38                   #59 [hci1] 4.235289
      LE Extended Advertising Report (0x0d)
        Num reports: 1
        Entry 0
          Event type: 0x0012
            Props: 0x0012
              Scannable
              Use legacy advertising PDUs
            Data status: [0;32mComplete[0m
          Legacy PDU Type: ADV_SCAN_IND (0x0012)
          Address type: Random (0x01)
          Address: 5A:FA:3A:9A:ED:67 (Resolvable)
          Primary PHY: LE 1M
          Secondary PHY: No packets
          SID: no ADI field (0xff)
          TX power: 127 dBm
          RSSI: -95 dBm (0xa1)
          Periodic advertising interval: 0.00 msec (0x0000)
          Direct address type: Reserved (0xff)
          Direct address: 00-00-00-00-00-00
          Data length: 0x0c
        0b ff 4c 00 09 06 03 00 0a 03 07 12              ..L.........    
        Company: Apple, Inc. (76)
          Type: Apple TV (9)
          Data: 03000a030712
> HCI Event: LE Meta Event (0x3e) plen 47                   #60 [hci1] 4.238382
      LE Extended Advertising Report (0x0d)
        Num reports: 1
        Entry 0
          Event type: 0x0013
            Props: 0x0013
              Connectable
              Scannable
              Use legacy advertising PDUs
            Data status: [0;32mComplete[0m
          Legacy PDU Type: ADV_IND (0x0013)
          Address type: Random (0x01)
          Address: 48:6A:78:71:D7:36 (Resolvable)
          Primary PHY: LE 1M
          Secondary PHY: No packets
          SID: no ADI field (0xff)
          TX power: 127 dBm
          RSSI: -94 dBm (0xa2)
          Periodic advertising interval: 0.00 msec (0x0000)
          Direct address type: Reserved (0xff)
          Direct address: 00-00-00-00-00-00
          Data length: 0x15
        02 0a ff 11 16 2c fe 10 40 18 00 05 e8 21 77 3c  .....,..@....!w<
        46 07 8f 96 96                                   F....           
        TX power: -1 dBm
        Service Data: Google (0xfe2c)
          Data: 1040180005e821773c46078f9696
< HCI Command: LE Set Extended Adve.. (0x08|0x0039) plen 6  #61 [hci1] 4.249838
        Extended advertising: Enabled (0x01)
        Number of sets: 1 (0x01)
        Entry 0
          Handle: 0x00
          Duration: 60000 ms (0x1770)
          Max ext adv events: 0
> HCI Event: LE Meta Event (0x3e) plen 55                   #62 [hci1] 4.250643
      LE Extended Advertising Report (0x0d)
        Num reports: 1
        Entry 0
          Event type: 0x0013
            Props: 0x0013
              Connectable
              Scannable
              Use legacy advertising PDUs
            Data status: [0;32mComplete[0m
          Legacy PDU Type: ADV_IND (0x0013)
          Address type: Random (0x01)
          Address: 14:1E:D7:DA:47:C0 (Non-Resolvable)
          Primary PHY: LE 1M
          Secondary PHY: No packets
          SID: no ADI field (0xff)
          TX power: 127 dBm
          RSSI: -89 dBm (0xa7)
          Periodic advertising interval: 0.00 msec (0x0000)
          Direct address type: Reserved (0xff)
          Direct address: 00-00-00-00-00-00
          Data length: 0x1d
        02 01 02 19 16 f1 fc 04 a6 4e 2e 6c d9 2c 53 47  .........N.l.,SG
        08 35 af 66 2a de 52 65 f5 f1 5d 53 8b           .5.f*.Re..]S.   
        Flags: 0x02
          LE General Discoverable Mode
        Service Data: Unknown (0xfcf1)
          Data: 04a64e2e6cd92c53470835af662ade5265f5f15d538b
> HCI Event: Command Complete (0x0e) plen 4                 #63 [hci1] 4.250645
      LE Set Extended Advertising Enable (0x08|0x0039) ncmd 1
        Status: Success (0x00)
> HCI Event: LE Meta Event (0x3e) plen 54                   #64 [hci1] 4.258608
      LE Extended Advertising Report (0x0d)
        Num reports: 1
        Entry 0
          Event type: 0x0013
            Props: 0x0013
              Connectable
              Scannable
              Use legacy advertising PDUs
            Data status: [0;32mComplete[0m
          Legacy PDU Type: ADV_IND (0x0013)
          Address type: Random (0x01)
          Address: 48:6A:78:71:D7:36 (Resolvable)
          Primary PHY: LE 1M
          Secondary PHY: No packets
          SID: no ADI field (0xff)
          TX power: 127 dBm
          RSSI: -92 dBm (0xa4)
          Periodic advertising interval: 0.00 msec (0x0000)
          Direct address type: Reserved (0xff)
          Direct address: 00-00-00-00-00-00
          Data length: 0x1c
        03 02 82 fd 17 ff 2d 01 04 00 02 02 b0 31 0b 01  ......-......1..
        d6 7f c1 47 33 00 02 00 33 23 00 00              ...G3...3#..    
        16-bit Service UUIDs (partial): 1 entry
          Sony Corporation (0xfd82)
        Company: Sony Corporation (301)
          Data: 04000202b0310b01d67fc1473300020033230000
< HCI Command: LE Set Extended Adve.. (0x08|0x0039) plen 6  #65 [hci1] 4.269840
        Extended advertising: Disabled (0x00)
        Number of sets: 1 (0x01)
        Entry 0
          Handle: 0x00
          Duration: 0 ms (0x00)
          Max ext adv events: 0
> HCI Event: LE Meta Event (0x3e) plen 54                   #66 [hci1] 4.270461
      LE Extended Advertising Report (0x0d)
        Num reports: 1
        Entry 0
          Event type: 0x0013
            Props: 0x0013
              Connectable
              Scannable
              Use legacy advertising PDUs
            Data status: [0;32mComplete[0m
          Legacy PDU Type: ADV_IND (0x0013)
          Address type: Random (0x01)
          Address: 38:F8:93:B3:86:05 (Non-Resolvable)
          Primary PHY: LE 1M
          Secondary PHY: No packets
          SID: no ADI field (0xff)
          TX power: 127 dBm
          RSSI: -90 dBm (0xa6)
          Periodic advertising interval: 0.00 msec (0x0000)
          Direct address type: Reserved (0xff)
          Direct address: 00-00-00-00-00-00
          Data length: 0x1c
        02 01 02 18 16 f1 fc 04 b9 27 e2 2d 62 7c 59 57  .........'.-b|YW
        56 9e 80 43 0b df 04 4c 49 d2 e5 67              V..C...LI..g    
        Flags: 0x02
          LE General Discoverable Mode
        Service Data: Unknown (0xfcf1)
          Data: 04b927e22d627c5957569e80430bdf044c49d2e567
> HCI Event: Command Complete (0x0e) plen 4                 #67 [hci1] 4.270548
      LE Set Extended Advertising Enable (0x08|0x0039) ncmd 1
        Status: Success (0x00)
> HCI Event: LE Meta Event (0x3e) plen 57                   #68 [hci1] 4.285836
      LE Extended Advertising Report (0x0d)
        Num reports: 1
        Entry 0
          Event type: 0x0010
            Props: 0x0010
              Use legacy advertising PDUs
            Data status: [0;32mComplete[0m
          Legacy PDU Type: ADV_NONCONN_IND (0x0010)
          Address type: Random (0x01)
          Address: 2D:4A:6D:96:8F:7B (Non-Resolvable)
          Primary PHY: LE 1M
          Secondary PHY: No packets
          SID: no ADI field (0xff)
          TX power: 127 dBm
          RSSI: -95 dBm (0xa1)
          Periodic advertising interval: 0.00 msec (0x0000)
          Direct address type: Reserved (0xff)
          Direct address: 00-00-00-00-00-00
          Data length: 0x1f
        1e ff 06 00 01 0f 20 22 13 0c 6f b1 6f 06 e1 df  ...... "..o.o...
        cc 66 dc e3 3c 31 8d 7a 96 b7 73 97 fc bc 06     .f..<1.z..s.... 
        Company: Microsoft (6)
          Data: 010f2022130c6fb16f06e1dfcc66dce33c318d7a96b77397fcbc06
< HCI Command: LE Set Advertising S.. (0x08|0x0035) plen 7  #69 [hci1] 4.289838
        Advertising handle: 0x00
        Advertising random address: 27:DD:CA:1B:4A:5C (Non-Resolvable)
> HCI Event: Command Complete (0x0e) plen 4                 #70 [hci1] 4.290413
      LE Set Advertising Set Random Address (0x08|0x0035) ncmd 1
        Status: Success (0x00)
> HCI Event: LE Meta Event (0x3e) plen 54                   #71 [hci1] 4.306032
      LE Extended Advertising Report (0x0d)
        Num reports: 1
        Entry 0
          Event type: 0x0010
            Props: 0x0010
              Use legacy advertising PDUs
            Data status: [0;32mComplete[0m
          Legacy PDU Type: ADV_NONCONN_IND (0x0010)
          Address type: Public (0x00)
          Address: A4:30:7A:95:74:FB (Samsung Electronics Co.,Ltd)
          Primary PHY: LE 1M
          Secondary PHY: No packets
          SID: no ADI field (0xff)
          TX power: 127 dBm
          RSSI: -90 dBm (0xa6)
          Periodic advertising interval: 0.00 msec (0x0000)
          Direct address type: Reserved (0xff)
          Direct address: 00-00-00-00-00-00
          Data length: 0x1c
        1b ff 75 00 42 04 01 80 6e a4 30 7a 95 74 fb a6  ..u.B...n.0z.t..
        30 7a 95 74 fa 01 d8 41 c5 d9 00 00              0z.t...A....    
        Company: Samsung Electronics Co. Ltd. (117)
          Data: 420401806ea4307a9574fba6307a9574fa01d841c5d90000
< HCI Command: LE Set Extended Adv.. (0x08|0x0036) plen 25  #72 [hci1] 4.309843
        Handle: 0x00
        Properties: 0x0010
          Use legacy advertising PDUs: ADV_NONCONN_IND
        Min advertising interval: 20.000 msec (0x0020)
        Max advertising interval: 20.000 msec (0x0020)
        Channel map: 37, 38, 39 (0x07)
        Own address type: Random (0x01)
        Peer address type: Public (0x00)
        Peer address: 00:00:00:00:00:00 (OUI 00-00-00)
        Filter policy: Allow Scan Request from Any, Allow Connect Request from Any (0x00)
        TX power: Host has no preference (0x7f)
        Primary PHY: LE 1M (0x01)
        Secondary max skip: 0x00
        Secondary PHY: LE 1M (0x01)
        SID: 0x00
        Scan request notifications: Disabled (0x00)
> HCI Event: Command Complete (0x0e) plen 5                 #73 [hci1] 4.310678
      LE Set Extended Advertising Parameters (0x08|0x0036) ncmd 1
        Status: Success (0x00)
        TX power (selected): 0 dbm (0x00)
> HCI Event: LE Meta Event (0x3e) plen 55                   #74 [hci1] 4.323679
      LE Extended Advertising Report (0x0d)
        Num reports: 1
        Entry 0
          Event type: 0x0010
            Props: 0x0010
              Use legacy advertising PDUs
            Data status: [0;32mComplete[0m
          Legacy PDU Type: ADV_NONCONN_IND (0x0010)
          Address type: Random (0x01)
          Address: 12:33:8E:64:80:4D (Non-Resolvable)
          Primary PHY: LE 1M
          Secondary PHY: No packets
          SID: no ADI field (0xff)
          TX power: 127 dBm
          RSSI: -92 dBm (0xa4)
          Periodic advertising interval: 0.00 msec (0x0000)
          Direct address type: Reserved (0xff)
          Direct address: 00-00-00-00-00-00
          Data length: 0x1d
        1c ff 06 00 01 09 21 0a 4d e0 8a 52 d2 d4 4c 41  ......!.M..R..LA
        50 54 4f 50 2d 45 35 32 45 4f 44 32 49           PTOP-E52EOD2I   
        Company: Microsoft (6)
          Data: 0109210a4de08a52d2d44c4150544f502d453532454f443249
< HCI Command: LE Set Extended Adv.. (0x08|0x0037) plen 29  #75 [hci1] 4.329839
        Handle: 0x00
        Operation: Complete extended advertising data (0x03)
        Fragment preference: Minimize fragmentation (0x01)
        Data length: 0x19
        Mesh Beacon: 00554f624fde8947ec824341da4b8dfa3f0002a30a8708
          Unprovisioned Device Beacon (0x00)
          Device UUID: 554f624fde8947ec824341da4b8dfa3f
          OOB Information: 0x0002
            Electronic / URI
          URI Hash: 0xa30a8708
> HCI Event: Command Complete (0x0e) plen 4                 #76 [hci1] 4.330679
      LE Set Extended Advertising Data (0x08|0x0037) ncmd 1
        Status: Success (0x00)
< HCI Command: LE Set Extended Adve.. (0x08|0x0039) plen 6  #77 [hci1] 4.349772
        Extended advertising: Enabled (0x01)
        Number of sets: 1 (0x01)
        Entry 0
          Handle: 0x00
          Duration: 0 ms (0x00)
          Max ext adv events: 3
> HCI Event: Command Complete (0x0e) plen 4                 #78 [hci1] 4.350247
      LE Set Extended Advertising Enable (0x08|0x0039) ncmd 1
        Status: Success (0x00)
> HCI Event: LE Meta Event (0x3e) plen 72                   #79 [hci1] 4.374989
      LE Extended Advertising Report (0x0d)
        Num reports: 1
        Entry 0
          Event type: 0x0000
            Props: 0x0000
            Data status: [0;32mComplete[0m
          Address type: Random (0x01)
          Address: EC:98:83:EA:36:AB (Static)
          Primary PHY: LE 1M
          Secondary PHY: LE 2M
          SID: 0x0c
          TX power: 127 dBm
          RSSI: -91 dBm (0xa5)
          Periodic advertising interval: 106.25 msec (0x0055)
          Direct address type: Reserved (0xff)
          Direct address: 00-00-00-00-00-00
          Data length: 0x2e
        06 16 52 18 c0 de c0 05 16 56 18 04 00 0d 30 4e  ..R......V....0N
        69 6d 42 4c 45 20 61 75 64 69 6f 0e 09 41 70 61  imBLE audio..Apa
        63 68 65 20 4e 69 6d 42 4c 45 03 19 80 08        che NimBLE....  
        Service Data: Broadcast Audio Announcement (0x1852)
        Broadcast ID: 12639936 (0xc0dec0)
        Service Data: Public Broadcast Announcement (0x1856)
          Data: 0400
        Unknown EIR field 0x30: 4e696d424c4520617564696f
        Name (complete): Apache NimBLE
        Appearance: Undefined (0x0880)
> HCI Event: LE Meta Event (0x3e) plen 57                   #80 [hci1] 4.384304
      LE Extended Advertising Report (0x0d)
        Num reports: 1
        Entry 0
          Event type: 0x0013
            Props: 0x0013
              Connectable
              Scannable
              Use legacy advertising PDUs
            Data status: [0;32mComplete[0m
          Legacy PDU Type: ADV_IND (0x0013)
          Address type: Random (0x01)
          Address: D4:70:55:10:84:95 (Static)
          Primary PHY: LE 1M
          Secondary PHY: No packets
          SID: no ADI field (0xff)
          TX power: 127 dBm
          RSSI: -74 dBm (0xb6)
          Periodic advertising interval: 0.00 msec (0x0000)
          Direct address type: Reserved (0xff)
          Direct address: 00-00-00-00-00-00
          Data length: 0x1f
        02 01 06 1b ff 99 04 05 12 95 36 a3 c1 e5 ff dc  ..........6.....
        04 18 00 40 ad 96 07 38 e1 d4 70 55 10 84 95     ...@...8..pU... 
        Flags: 0x06
          LE General Discoverable Mode
          BR/EDR Not Supported
        Company: Ruuvi Innovations Ltd. (1177)
          Data: 05129536a3c1e5ffdc04180040ad960738e1d47055108495
> HCI Event: LE Meta Event (0x3e) plen 54                   #81 [hci1] 4.384786
      LE Extended Advertising Report (0x0d)
        Num reports: 1
        Entry 0
          Event type: 0x0013
            Props: 0x0013
              Connectable
              Scannable
              Use legacy advertising PDUs
            Data status: [0;32mComplete[0m
          Legacy PDU Type: ADV_IND (0x0013)
          Address type: Random (0x01)
          Address: 09:A0:F8:7E:1E:9C (Non-Resolvable)
          Primary PHY: LE 1M
          Secondary PHY: No packets
          SID: no ADI field (0xff)
          TX power: 127 dBm
          RSSI: -94 dBm (0xa2)
          Periodic advertising interval: 0.00 msec (0x0000)
          Direct address type: Reserved (0xff)
          Direct address: 00-00-00-00-00-00
          Data length: 0x1c
        02 01 02 18 16 f1 fc 04 b0 7b 38 ea 2f 51 a3 c0  .........{8./Q..
        5c f5 52 f6 c7 a4 ae 64 4f b9 1f ee              \.R....dO...    
        Flags: 0x02
          LE General Discoverable Mode
        Service Data: Unknown (0xfcf1)
          Data: 04b07b38ea2f51a3c05cf552f6c7a4ae644fb91fee
> HCI Event: LE Meta Event (0x3e) plen 43                   #82 [hci1] 4.389622
      LE Extended Advertising Report (0x0d)
        Num reports: 1
        Entry 0
          Event type: 0x0013
            Props: 0x0013
              Connectable
              Scannable
              Use legacy advertising PDUs
            Data status: [0;32mComplete[0m
          Legacy PDU Type: ADV_IND (0x0013)
          Address type: Random (0x01)
          Address: 70:DD:20:66:97:CD (Resolvable)
          Primary PHY: LE 1M
          Secondary PHY: No packets
          SID: no ADI field (0xff)
          TX power: 127 dBm
          RSSI: -88 dBm (0xa8)
          Periodic advertising interval: 0.00 msec (0x0000)
          Direct address type: Reserved (0xff)
          Direct address: 00-00-00-00-00-00
          Data length: 0x11
        02 01 1a 02 0a 0c 0a ff 4c 00 10 05 31 1c a7 dd  ........L...1...
        e3                                               .               
        Flags: 0x1a
          LE General Discoverable Mode
          Simultaneous LE and BR/EDR (Controller)
          Simultaneous LE and BR/EDR (Host)
        TX power: 12 dBm
        Company: Apple, Inc. (76)
          Type: Unknown (16)
          Data: 311ca7dde3
> HCI Event: LE Meta Event (0x3e) plen 57                   #83 [hci1] 4.392833
      LE Extended Advertising Report (0x0d)
        Num reports: 1
        Entry 0
          Event type: 0x0010
            Props: 0x0010
              Use legacy advertising PDUs
            Data status: [0;32mComplete[0m
          Legacy PDU Type: ADV_NONCONN_IND (0x0010)
          Address type: Random (0x01)
          Address: 2D:4A:6D:96:8F:7B (Non-Resolvable)
          Primary PHY: LE 1M
          Secondary PHY: No packets
          SID: no ADI field (0xff)
          TX power: 127 dBm
          RSSI: -75 dBm (0xb5)
          Periodic advertising interval: 0.00 msec (0x0000)
          Direct address type: Reserved (0xff)
          Direct address: 00-00-00-00-00-00
          Data length: 0x1f
        1e ff 06 00 01 0f 20 22 13 0c 6f b1 6f 06 e1 df  ...... "..o.o...
        cc 66 dc e3 3c 31 8d 7a 96 b7 73 97 fc bc 06     .f..<1.z..s.... 
        Company: Microsoft (6)
          Data: 010f2022130c6fb16f06e1dfcc66dce33c318d7a96b77397fcbc06
> HCI Event: LE Meta Event (0x3e) plen 6                    #84 [hci1] 4.405453
      LE Advertising Set Terminated (0x12)
        Status: Limit Reached (0x43)
        Handle: 0
        Connection handle: 65535
        Number of completed extended advertising events: 3
< HCI Command: LE Set Extended Adv.. (0x08|0x0037) plen 12  #85 [hci1] 4.410022
        Handle: 0x00
        Operation: Complete extended advertising data (0x03)
        Fragment preference: Minimize fragmentation (0x01)
        Data length: 0x08
        Unknown EIR field 0x24: 546573746572
> HCI Event: Command Complete (0x0e) plen 4                 #86 [hci1] 4.410730
      LE Set Extended Advertising Data (0x08|0x0037) ncmd 1
        Status: Success (0x00)
> HCI Event: LE Meta Event (0x3e) plen 55                   #87 [hci1] 4.429139
      LE Extended Advertising Report (0x0d)
        Num reports: 1
        Entry 0
          Event type: 0x0010
            Props: 0x0010
              Use legacy advertising PDUs
            Data status: [0;32mComplete[0m
          Legacy PDU Type: ADV_NONCONN_IND (0x0010)
          Address type: Random (0x01)
          Address: 12:33:8E:64:80:4D (Non-Resolvable)
          Primary PHY: LE 1M
          Secondary PHY: No packets
          SID: no ADI field (0xff)
          TX power: 127 dBm
          RSSI: -86 dBm (0xaa)
          Periodic advertising interval: 0.00 msec (0x0000)
          Direct address type: Reserved (0xff)
          Direct address: 00-00-00-00-00-00
          Data length: 0x1d
        1c ff 06 00 01 09 21 0a 4d e0 8a 52 d2 d4 4c 41  ......!.M..R..LA
        50 54 4f 50 2d 45 35 32 45 4f 44 32 49           PTOP-E52EOD2I   
        Company: Microsoft (6)
          Data: 0109210a4de08a52d2d44c4150544f502d453532454f443249
< HCI Command: LE Set Advertising S.. (0x08|0x0035) plen 7  #88 [hci1] 4.429808
        Advertising handle: 0x00
        Advertising random address: 3B:09:45:E9:58:BD (Non-Resolvable)
> HCI Event: Command Complete (0x0e) plen 4                 #89 [hci1] 4.430315
      LE Set Advertising Set Random Address (0x08|0x0035) ncmd 1
        Status: Success (0x00)
< HCI Command: LE Set Extended Adve.. (0x08|0x0039) plen 6  #90 [hci1] 4.449787
        Extended advertising: Enabled (0x01)
        Number of sets: 1 (0x01)
        Entry 0
          Handle: 0x00
          Duration: 0 ms (0x00)
          Max ext adv events: 3
> HCI Event: Command Complete (0x0e) plen 4                 #91 [hci1] 4.450339
      LE Set Extended Advertising Enable (0x08|0x0039) ncmd 1
        Status: Success (0x00)
> HCI Event: LE Meta Event (0x3e) plen 72                   #92 [hci1] 4.454922
      LE Extended Advertising Report (0x0d)
        Num reports: 1
        Entry 0
          Event type: 0x0000
            Props: 0x0000
            Data status: [0;32mComplete[0m
          Address type: Random (0x01)
          Address: EC:98:83:EA:36:AB (Static)
          Primary PHY: LE 1M
          Secondary PHY: LE 2M
          SID: 0x0c
          TX power: 127 dBm
          RSSI: -92 dBm (0xa4)
          Periodic advertising interval: 106.25 msec (0x0055)
          Direct address type: Reserved (0xff)
          Direct address: 00-00-00-00-00-00
          Data length: 0x2e
        06 16 52 18 c0 de c0 05 16 56 18 04 00 0d 30 4e  ..R......V....0N
        69 6d 42 4c 45 20 61 75 64 69 6f 0e 09 41 70 61  imBLE audio..Apa
        63 68 65 20 4e 69 6d 42 4c 45 03 19 80 08        che NimBLE....  
        Service Data: Broadcast Audio Announcement (0x1852)
        Broadcast ID: 12639936 (0xc0dec0)
        Service Data: Public Broadcast Announcement (0x1856)
          Data: 0400
        Unknown EIR field 0x30: 4e696d424c4520617564696f
        Name (complete): Apache NimBLE
        Appearance: Undefined (0x0880)
> HCI Event: LE Meta Event (0x3e) plen 54                   #93 [hci1] 4.461496
      LE Extended Advertising Report (0x0d)
        Num reports: 1
        Entry 0
          Event type: 0x0010
            Props: 0x0010
              Use legacy advertising PDUs
            Data status: [0;32mComplete[0m
          Legacy PDU Type: ADV_NONCONN_IND (0x0010)
          Address type: Public (0x00)
          Address: A4:30:7A:95:74:FB (Samsung Electronics Co.,Ltd)
          Primary PHY: LE 1M
          Secondary PHY: No packets
          SID: no ADI field (0xff)
          TX power: 127 dBm
          RSSI: -90 dBm (0xa6)
          Periodic advertising interval: 0.00 msec (0x0000)
          Direct address type: Reserved (0xff)
          Direct address: 00-00-00-00-00-00
          Data length: 0x1c
        1b ff 75 00 42 04 01 80 6e a4 30 7a 95 74 fb a6  ..u.B...n.0z.t..
        30 7a 95 74 fa 01 d8 41 c5 d9 00 00              0z.t...A....    
        Company: Samsung Electronics Co. Ltd. (117)
          Data: 420401806ea4307a9574fba6307a9574fa01d841c5d90000
> HCI Event: LE Meta Event (0x3e) plen 57                   #94 [hci1] 4.493539
      LE Extended Advertising Report (0x0d)
        Num reports: 1
        Entry 0
          Event type: 0x0010
            Props: 0x0010
              Use legacy advertising PDUs
            Data status: [0;32mComplete[0m
          Legacy PDU Type: ADV_NONCONN_IND (0x0010)
          Address type: Random (0x01)
          Address: 2D:4A:6D:96:8F:7B (Non-Resolvable)
          Primary PHY: LE 1M
          Secondary PHY: No packets
          SID: no ADI field (0xff)
          TX power: 127 dBm
          RSSI: -76 dBm (0xb4)
          Periodic advertising interval: 0.00 msec (0x0000)
          Direct address type: Reserved (0xff)
          Direct address: 00-00-00-00-00-00
          Data length: 0x1f
        1e ff 06 00 01 0f 20 22 13 0c 6f b1 6f 06 e1 df  ...... "..o.o...
        cc 66 dc e3 3c 31 8d 7a 96 b7 73 97 fc bc 06     .f..<1.z..s.... 
        Company: Microsoft (6)
          Data: 010f2022130c6fb16f06e1dfcc66dce33c318d7a96b77397fcbc06
> HCI Event: LE Meta Event (0x3e) plen 6                    #95 [hci1] 4.515868
      LE Advertising Set Terminated (0x12)
        Status: Limit Reached (0x43)
        Handle: 0
        Connection handle: 65535
        Number of completed extended advertising events: 3
> HCI Event: LE Meta Event (0x3e) plen 38                   #96 [hci1] 4.517247
      LE Extended Advertising Report (0x0d)
        Num reports: 1
        Entry 0
          Event type: 0x0012
            Props: 0x0012
              Scannable
              Use legacy advertising PDUs
            Data status: [0;32mComplete[0m
          Legacy PDU Type: ADV_SCAN_IND (0x0012)
          Address type: Random (0x01)
          Address: 5A:FA:3A:9A:ED:67 (Resolvable)
          Primary PHY: LE 1M
          Secondary PHY: No packets
          SID: no ADI field (0xff)
          TX power: 127 dBm
          RSSI: -90 dBm (0xa6)
          Periodic advertising interval: 0.00 msec (0x0000)
          Direct address type: Reserved (0xff)
          Direct address: 00-00-00-00-00-00
          Data length: 0x0c
        0b ff 4c 00 09 06 03 00 0a 03 07 12              ..L.........    
        Company: Apple, Inc. (76)
          Type: Apple TV (9)
          Data: 03000a030712
< HCI Command: LE Set Advertising S.. (0x08|0x0035) plen 7  #97 [hci1] 4.530135
        Advertising handle: 0x00
        Advertising random address: D5:B6:CC:31:DB:3B (Static)
> HCI Event: Command Complete (0x0e) plen 4                 #98 [hci1] 4.530681
      LE Set Advertising Set Random Address (0x08|0x0035) ncmd 1
        Status: Success (0x00)
> HCI Event: LE Meta Event (0x3e) plen 55                   #99 [hci1] 4.537444
      LE Extended Advertising Report (0x0d)
        Num reports: 1
        Entry 0
          Event type: 0x0010
            Props: 0x0010
              Use legacy advertising PDUs
            Data status: [0;32mComplete[0m
          Legacy PDU Type: ADV_NONCONN_IND (0x0010)
          Address type: Random (0x01)
          Address: 12:33:8E:64:80:4D (Non-Resolvable)
          Primary PHY: LE 1M
          Secondary PHY: No packets
          SID: no ADI field (0xff)
          TX power: 127 dBm
          RSSI: -84 dBm (0xac)
          Periodic advertising interval: 0.00 msec (0x0000)
          Direct address type: Reserved (0xff)
          Direct address: 00-00-00-00-00-00
          Data length: 0x1d
        1c ff 06 00 01 09 21 0a 4d e0 8a 52 d2 d4 4c 41  ......!.M..R..LA
        50 54 4f 50 2d 45 35 32 45 4f 44 32 49           PTOP-E52EOD2I   
        Company: Microsoft (6)
          Data: 0109210a4de08a52d2d44c4150544f502d453532454f443249
> HCI Event: LE Meta Event (0x3e) plen 55                  #100 [hci1] 4.539366
      LE Extended Advertising Report (0x0d)
        Num reports: 1
        Entry 0
          Event type: 0x0013
            Props: 0x0013
              Connectable
              Scannable
              Use legacy advertising PDUs
            Data status: [0;32mComplete[0m
          Legacy PDU Type: ADV_IND (0x0013)
          Address type: Random (0x01)
          Address: 14:1E:D7:DA:47:C0 (Non-Resolvable)
          Primary PHY: LE 1M
          Secondary PHY: No packets
          SID: no ADI field (0xff)
          TX power: 127 dBm
          RSSI: -90 dBm (0xa6)
          Periodic advertising interval: 0.00 msec (0x0000)
          Direct address type: Reserved (0xff)
          Direct address: 00-00-00-00-00-00
          Data length: 0x1d
        02 01 02 19 16 f1 fc 04 a6 4e 2e 6c d9 2c 53 47  .........N.l.,SG
        08 35 af 66 2a de 52 65 f5 f1 5d 53 8b           .5.f*.Re..]S.   
        Flags: 0x02
          LE General Discoverable Mode
        Service Data: Unknown (0xfcf1)
          Data: 04a64e2e6cd92c53470835af662ade5265f5f15d538b
< HCI Command: LE Set Extended Ad.. (0x08|0x0036) plen 25  #101 [hci1] 4.550275
        Handle: 0x00
        Properties: 0x0013
          Connectable
          Scannable
          Use legacy advertising PDUs: ADV_IND
        Min advertising interval: 1000.000 msec (0x0640)
        Max advertising interval: 1200.000 msec (0x0780)
        Channel map: 37, 38, 39 (0x07)
        Own address type: Random (0x01)
        Peer address type: Public (0x00)
        Peer address: 00:00:00:00:00:00 (OUI 00-00-00)
        Filter policy: Allow Scan Request from Any, Allow Connect Request from Any (0x00)
        TX power: Host has no preference (0x7f)
        Primary PHY: LE 1M (0x01)
        Secondary max skip: 0x00
        Secondary PHY: LE 1M (0x01)
        SID: 0x00
        Scan request notifications: Disabled (0x00)
> HCI Event: Command Complete (0x0e) plen 5                #102 [hci1] 4.551135
      LE Set Extended Advertising Parameters (0x08|0x0036) ncmd 1
        Status: Success (0x00)
        TX power (selected): 0 dbm (0x00)
< HCI Command: LE Set Extended Ad.. (0x08|0x0037) plen 24  #103 [hci1] 4.570121
        Handle: 0x00
        Operation: Complete extended advertising data (0x03)
        Fragment preference: Minimize fragmentation (0x01)
        Data length: 0x14
        Flags: 0x06
          LE General Discoverable Mode
          BR/EDR Not Supported
        16-bit Service UUIDs (complete): 1 entry
          Mesh Proxy (0x1828)
        Service Data: Mesh Proxy (0x1828)
          Data: 00c7005d732329eadf
> HCI Event: Command Complete (0x0e) plen 4                #104 [hci1] 4.570889
      LE Set Extended Advertising Data (0x08|0x0037) ncmd 1
        Status: Success (0x00)
< HCI Command: LE Set Extended Sca.. (0x08|0x0038) plen 4  #105 [hci1] 4.589996
        Handle: 0x00
        Operation: Complete scan response data (0x03)
        Fragment preference: Minimize fragmentation (0x01)
        Data length: 0x00
> HCI Event: Command Complete (0x0e) plen 4                #106 [hci1] 4.590504
      LE Set Extended Scan Response Data (0x08|0x0038) ncmd 1
        Status: Success (0x00)
> HCI Event: LE Meta Event (0x3e) plen 57                  #107 [hci1] 4.601703
      LE Extended Advertising Report (0x0d)
        Num reports: 1
        Entry 0
          Event type: 0x0010
            Props: 0x0010
              Use legacy advertising PDUs
            Data status: [0;32mComplete[0m
          Legacy PDU Type: ADV_NONCONN_IND (0x0010)
          Address type: Random (0x01)
          Address: 2D:4A:6D:96:8F:7B (Non-Resolvable)
          Primary PHY: LE 1M
          Secondary PHY: No packets
          SID: no ADI field (0xff)
          TX power: 127 dBm
          RSSI: -76 dBm (0xb4)
          Periodic advertising interval: 0.00 msec (0x0000)
          Direct address type: Reserved (0xff)
          Direct address: 00-00-00-00-00-00
          Data length: 0x1f
        1e ff 06 00 01 0f 20 22 13 0c 6f b1 6f 06 e1 df  ...... "..o.o...
        cc 66 dc e3 3c 31 8d 7a 96 b7 73 97 fc bc 06     .f..<1.z..s.... 
        Company: Microsoft (6)
          Data: 010f2022130c6fb16f06e1dfcc66dce33c318d7a96b77397fcbc06
> HCI Event: LE Meta Event (0x3e) plen 56                  #108 [hci1] 4.607749
      LE Extended Advertising Report (0x0d)
        Num reports: 1
        Entry 0
          Event type: 0x0013
            Props: 0x0013
              Connectable
              Scannable
              Use legacy advertising PDUs
            Data status: [0;32mComplete[0m
          Legacy PDU Type: ADV_IND (0x0013)
          Address type: Random (0x01)
          Address: 6C:C7:3E:3E:17:C3 (Resolvable)
          Primary PHY: LE 1M
          Secondary PHY: No packets
          SID: no ADI field (0xff)
          TX power: 127 dBm
          RSSI: -90 dBm (0xa6)
          Periodic advertising interval: 0.00 msec (0x0000)
          Direct address type: Reserved (0xff)
          Direct address: 00-00-00-00-00-00
          Data length: 0x1e
        02 01 02 1a ff 4c 00 02 15 18 a5 47 93 5c 75 49  .....L.....G.\uI
        ae af 6d 3e dd a8 4d ff c3 81 40 c0 e4 c5        ..m>..M...@...  
        Flags: 0x02
          LE General Discoverable Mode
        Company: Apple, Inc. (76)
          Type: iBeacon (2)
          UUID: c3ff4da8-dd3e-6daf-ae49-755c9347a518
          Version: 16513.58560
          TX power: -59 dB
< HCI Command: LE Set Extended Adv.. (0x08|0x0039) plen 6  #109 [hci1] 4.609969
        Extended advertising: Enabled (0x01)
        Number of sets: 1 (0x01)
        Entry 0
          Handle: 0x00
          Duration: 0 ms (0x00)
          Max ext adv events: 0
> HCI Event: Command Complete (0x0e) plen 4                #110 [hci1] 4.610470
      LE Set Extended Advertising Enable (0x08|0x0039) ncmd 1
        Status: Success (0x00)
> HCI Event: LE Meta Event (0x3e) plen 54                  #111 [hci1] 4.618310
      LE Extended Advertising Report (0x0d)
        Num reports: 1
        Entry 0
          Event type: 0x0010
            Props: 0x0010
              Use legacy advertising PDUs
            Data status: [0;32mComplete[0m
          Legacy PDU Type: ADV_NONCONN_IND (0x0010)
          Address type: Public (0x00)
          Address: A4:30:7A:95:74:FB (Samsung Electronics Co.,Ltd)
          Primary PHY: LE 1M
          Secondary PHY: No packets
          SID: no ADI field (0xff)
          TX power: 127 dBm
          RSSI: -79 dBm (0xb1)
          Periodic advertising interval: 0.00 msec (0x0000)
          Direct address type: Reserved (0xff)
          Direct address: 00-00-00-00-00-00
          Data length: 0x1c
        1b ff 75 00 42 04 01 80 6e a4 30 7a 95 74 fb a6  ..u.B...n.0z.t..
        30 7a 95 74 fa 01 d8 41 c5 d9 00 00              0z.t...A....    
        Company: Samsung Electronics Co. Ltd. (117)
          Data: 420401806ea4307a9574fba6307a9574fa01d841c5d90000
> HCI Event: LE Meta Event (0x3e) plen 55                  #112 [hci1] 4.641150
      LE Extended Advertising Report (0x0d)
        Num reports: 1
        Entry 0
          Event type: 0x0010
            Props: 0x0010
              Use legacy advertising PDUs
            Data status: [0;32mComplete[0m
          Legacy PDU Type: ADV_NONCONN_IND (0x0010)
          Address type: Random (0x01)
          Address: 12:33:8E:64:80:4D (Non-Resolvable)
          Primary PHY: LE 1M
          Secondary PHY: No packets
          SID: no ADI field (0xff)
          TX power: 127 dBm
          RSSI: -83 dBm (0xad)
          Periodic advertising interval: 0.00 msec (0x0000)
          Direct address type: Reserved (0xff)
          Direct address: 00-00-00-00-00-00
          Data length: 0x1d
        1c ff 06 00 01 09 21 0a 4d e0 8a 52 d2 d4 4c 41  ......!.M..R..LA
        50 54 4f 50 2d 45 35 32 45 4f 44 32 49           PTOP-E52EOD2I   
        Company: Microsoft (6)
          Data: 0109210a4de08a52d2d44c4150544f502d453532454f443249
> HCI Event: LE Meta Event (0x3e) plen 47                  #113 [hci1] 4.653937
      LE Extended Advertising Report (0x0d)
        Num reports: 1
        Entry 0
          Event type: 0x0013
            Props: 0x0013
              Connectable
              Scannable
              Use legacy advertising PDUs
            Data status: [0;32mComplete[0m
          Legacy PDU Type: ADV_IND (0x0013)
          Address type: Public (0x00)
          Address: A4:C1:38:8F:2F:B5 (Telink Semiconductor (Taipei) Co. Ltd.)
          Primary PHY: LE 1M
          Secondary PHY: No packets
          SID: no ADI field (0xff)
          TX power: 127 dBm
          RSSI: -82 dBm (0xae)
          Periodic advertising interval: 0.00 msec (0x0000)
          Direct address type: Reserved (0xff)
          Direct address: 00-00-00-00-00-00
          Data length: 0x15
        02 01 06 11 16 95 fe 30 58 5b 05 01 b5 2f 8f 38  .......0X[.../.8
        c1 a4 28 01 00                                   ..(..           
        Flags: 0x06
          LE General Discoverable Mode
          BR/EDR Not Supported
        Service Data: Xiaomi Inc. (0xfe95)
          Data: 30585b0501b52f8f38c1a4280100
> HCI Event: LE Meta Event (0x3e) plen 38                  #114 [hci1] 4.655383
      LE Extended Advertising Report (0x0d)
        Num reports: 1
        Entry 0
          Event type: 0x0012
            Props: 0x0012
              Scannable
              Use legacy advertising PDUs
            Data status: [0;32mComplete[0m
          Legacy PDU Type: ADV_SCAN_IND (0x0012)
          Address type: Random (0x01)
          Address: 5A:FA:3A:9A:ED:67 (Resolvable)
          Primary PHY: LE 1M
          Secondary PHY: No packets
          SID: no ADI field (0xff)
          TX power: 127 dBm
          RSSI: -89 dBm (0xa7)
          Periodic advertising interval: 0.00 msec (0x0000)
          Direct address type: Reserved (0xff)
          Direct address: 00-00-00-00-00-00
          Data length: 0x0c
        0b ff 4c 00 09 06 03 00 0a 03 07 12              ..L.........    
        Company: Apple, Inc. (76)
          Type: Apple TV (9)
          Data: 03000a030712
> HCI Event: LE Meta Event (0x3e) plen 54                  #115 [hci1] 4.656634
      LE Extended Advertising Report (0x0d)
        Num reports: 1
        Entry 0
          Event type: 0x0013
            Props: 0x0013
              Connectable
              Scannable
              Use legacy advertising PDUs
            Data status: [0;32mComplete[0m
          Legacy PDU Type: ADV_IND (0x0013)
          Address type: Random (0x01)
          Address: 09:A0:F8:7E:1E:9C (Non-Resolvable)
          Primary PHY: LE 1M
          Secondary PHY: No packets
          SID: no ADI field (0xff)
          TX power: 127 dBm
          RSSI: -98 dBm (0x9e)
          Periodic advertising interval: 0.00 msec (0x0000)
          Direct address type: Reserved (0xff)
          Direct address: 00-00-00-00-00-00
          Data length: 0x1c
        02 01 02 18 16 f1 fc 04 b0 7b 38 ea 2f 51 a3 c0  .........{8./Q..
        5c f5 52 f6 c7 a4 ae 64 4f b9 1f ee              \.R....dO...    
        Flags: 0x02
          LE General Discoverable Mode
        Service Data: Unknown (0xfcf1)
          Data: 04b07b38ea2f51a3c05cf552f6c7a4ae644fb91fee
