Bluetooth monitor ver 5.72
= Note: Linux version 7.0.0-31-generic (x86_64)                        0.801044
= Note: Bluetooth subsystem version 2.22                               0.801047
= New Index: 00:00:00:00:00:00 (Primary,UART,hci1)              [hci1] 0.801047
= New Index: 48:5F:99:8E:E0:64 (Primary,USB,hci0)               [hci0] 0.801048
= Open Index: 00:00:00:00:00:00                                 [hci1] 0.954273
= Index Info: 00:00:00:00:00:00 (Nordic Semiconductor ASA)      [hci1] 0.954279
@ USER Open: main (privileged) version 2.22            {0x0001} [hci1] 0.954286
< HCI Command: Reset (0x03|0x0003) plen 0                    #1 [hci1] 0.954851
> HCI Event: Command Complete (0x0e) plen 4                  #2 [hci1] 0.955376
      Reset (0x03|0x0003) ncmd 1
        Status: Success (0x00)
< HCI Command: Read Local Supported... (0x04|0x0003) plen 0  #3 [hci1] 0.974169
> HCI Event: Command Complete (0x0e) plen 12                 #4 [hci1] 0.974732
      Read Local Supported Features (0x04|0x0003) ncmd 1
        Status: Success (0x00)
        Features: 0x00 0x00 0x00 0x00 0x60 0x00 0x00 0x00
          BR/EDR Not Supported
          LE Supported (Controller)
< HCI Command: Read Local Version In.. (0x04|0x0001) plen 0  #5 [hci1] 0.994156
> HCI Event: Command Complete (0x0e) plen 12                 #6 [hci1] 0.994722
      Read Local Version Information (0x04|0x0001) ncmd 1
        Status: Success (0x00)
        HCI version: Reserved (0x11) - Revision 12345 (0x3039)
        LMP version: Reserved (0x11) - Subversion 12345 (0x3039)
        Manufacturer: Nordic Semiconductor ASA (89)
< HCI Command: Read Local Supported... (0x04|0x0002) plen 0  #7 [hci1] 1.014230
> HCI Event: Command Complete (0x0e) plen 68                 #8 [hci1] 1.015371
      Read Local Supported Commands (0x04|0x0002) ncmd 1
        Status: Success (0x00)
        Commands: 115 entries
          Disconnect (Octet 0 - Bit 5)
          Read Remote Version Information (Octet 2 - Bit 7)
          Set Event Mask (Octet 5 - Bit 6)
          Reset (Octet 5 - Bit 7)
          Read Connection Accept Timeout (Octet 7 - Bit 2)
          Write Connection Accept Timeout (Octet 7 - Bit 3)
          Read Transmit Power Level (Octet 10 - Bit 2)
          Set Controller To Host Flow Control (Octet 10 - Bit 5)
          Host Buffer Size (Octet 10 - Bit 6)
          Host Number of Completed Packets (Octet 10 - Bit 7)
          Read Local Version Information (Octet 14 - Bit 3)
          Read Local Supported Features (Octet 14 - Bit 5)
          Read BD ADDR (Octet 15 - Bit 1)
          Read RSSI (Octet 15 - Bit 5)
          Set Event Mask Page 2 (Octet 22 - Bit 2)
          LE Set Event Mask (Octet 25 - Bit 0)
          LE Read Buffer Size (Octet 25 - Bit 1)
          LE Read Local Supported Features (Octet 25 - Bit 2)
          LE Set Random Address (Octet 25 - Bit 4)
          LE Set Advertising Parameters (Octet 25 - Bit 5)
          LE Read Advertising Channel TX Power (Octet 25 - Bit 6)
          LE Set Advertising Data (Octet 25 - Bit 7)
          LE Set Scan Response Data (Octet 26 - Bit 0)
          LE Set Advertise Enable (Octet 26 - Bit 1)
          LE Set Scan Parameters (Octet 26 - Bit 2)
          LE Set Scan Enable (Octet 26 - Bit 3)
          LE Create Connection (Octet 26 - Bit 4)
          LE Create Connection Cancel (Octet 26 - Bit 5)
          LE Read Accept List Size (Octet 26 - Bit 6)
          LE Clear Accept List (Octet 26 - Bit 7)
          LE Add Device To Accept List (Octet 27 - Bit 0)
          LE Remove Device From Accept List (Octet 27 - Bit 1)
          LE Connection Update (Octet 27 - Bit 2)
          LE Set Host Channel Classification (Octet 27 - Bit 3)
          LE Read Channel Map (Octet 27 - Bit 4)
          LE Read Remote Used Features (Octet 27 - Bit 5)
          LE Encrypt (Octet 27 - Bit 6)
          LE Rand (Octet 27 - Bit 7)
          LE Start Encryption (Octet 28 - Bit 0)
          LE Long Term Key Request Reply (Octet 28 - Bit 1)
          LE Long Term Key Request Neg Reply (Octet 28 - Bit 2)
          LE Read Supported States (Octet 28 - Bit 3)
          Read Authenticated Payload Timeout (Octet 32 - Bit 4)
          Write Authenticated Payload Timeout (Octet 32 - Bit 5)
          LE Set Data Length (Octet 33 - Bit 6)
          LE Read Suggested Default Data Length (Octet 33 - Bit 7)
          LE Write Suggested Default Data Length (Octet 34 - Bit 0)
          LE Add Device To Resolving List (Octet 34 - Bit 3)
          LE Remove Device From Resolving List (Octet 34 - Bit 4)
          LE Clear Resolving List (Octet 34 - Bit 5)
          LE Read Resolving List Size (Octet 34 - Bit 6)
          LE Set Address Resolution Enable (Octet 35 - Bit 1)
          LE Set Resolvable Private Address Timeout (Octet 35 - Bit 2)
          LE Read Maximum Data Length (Octet 35 - Bit 3)
          LE Read PHY (Octet 35 - Bit 4)
          LE Set Default PHY (Octet 35 - Bit 5)
          LE Set PHY (Octet 35 - Bit 6)
          LE Set Advertising Set Random Address (Octet 36 - Bit 1)
          LE Set Extended Advertising Parameters (Octet 36 - Bit 2)
          LE Set Extended Advertising Data (Octet 36 - Bit 3)
          LE Set Extended Scan Response Data (Octet 36 - Bit 4)
          LE Set Extended Advertising Enable (Octet 36 - Bit 5)
          LE Read Maximum Advertising Data Length (Octet 36 - Bit 6)
          LE Read Number of Supported Advertising Sets (Octet 36 - Bit 7)
          LE Remove Advertising Set (Octet 37 - Bit 0)
          LE Clear Advertising Sets (Octet 37 - Bit 1)
          LE Set Periodic Advertising Parameters (Octet 37 - Bit 2)
          LE Set Periodic Advertising Data (Octet 37 - Bit 3)
          LE Set Periodic Advertising Enable (Octet 37 - Bit 4)
          LE Set Extended Scan Parameters (Octet 37 - Bit 5)
          LE Set Extended Scan Enable (Octet 37 - Bit 6)
          LE Extended Create Connection (Octet 37 - Bit 7)
          LE Periodic Advertising Create Sync (Octet 38 - Bit 0)
          LE Periodic Advertising Create Sync Cancel (Octet 38 - Bit 1)
          LE Periodic Advertising Terminate Sync (Octet 38 - Bit 2)
          LE Add Device To Periodic Advertiser List (Octet 38 - Bit 3)
          LE Remove Device From Periodic Advertiser List (Octet 38 - Bit 4)
          LE Clear Periodic Advertiser List (Octet 38 - Bit 5)
          LE Read Periodic Advertiser List Size (Octet 38 - Bit 6)
          LE Read Transmit Power (Octet 38 - Bit 7)
          LE Read RF Path Compensation (Octet 39 - Bit 0)
          LE Write RF Path Compensation (Octet 39 - Bit 1)
          LE Set Privacy Mode (Octet 39 - Bit 2)
          LE Periodic Advertising Receive Enable (Octet 40 - Bit 5)
          LE Periodic Advertising Sync Transfer (Octet 40 - Bit 6)
          LE Periodic Advertising Set Info Transfer (Octet 40 - Bit 7)
          LE Periodic Advertising Sync Transfer Parameters (Octet 41 - Bit 0)
          LE Set Default Periodic Advertisng Sync Transfer Parameters (Octet 41 - Bit 1)
          LE Read Buffer v2 (Octet 41 - Bit 5)
          LE Read ISO TX Sync (Octet 41 - Bit 6)
          LE Set Connected Isochronous Group Parameters (Octet 41 - Bit 7)
          LE Set Connected Isochronous Group Parameters Test (Octet 42 - Bit 0)
          LE Create Connected Isochronous Stream (Octet 42 - Bit 1)
          LE Remove Connected Isochronous Group (Octet 42 - Bit 2)
          LE Accept Connected Isochronous Stream Request (Octet 42 - Bit 3)
          LE Reject Connected Isochronous Stream Request (Octet 42 - Bit 4)
          LE Create Broadcast Isochronous Group (Octet 42 - Bit 5)
          LE Create Broadcast Isochronous Group Test (Octet 42 - Bit 6)
          LE Terminate Broadcast Isochronous Group (Octet 42 - Bit 7)
          LE Broadcast Isochronous Group Create Sync (Octet 43 - Bit 0)
          LE Broadcast Isochronous Group Terminate Sync (Octet 43 - Bit 1)
          LE Request Peer SCA (Octet 43 - Bit 2)
          LE Setup Isochronous Data Path (Octet 43 - Bit 3)
          LE Remove Isochronous Data Path (Octet 43 - Bit 4)
          LE Isochronous Transmit Test (Octet 43 - Bit 5)
          LE Isochronous Receive Test (Octet 43 - Bit 6)
          LE Isochronous Read Test Counters (Octet 43 - Bit 7)
          LE Isochronous Read Test Counters (Octet 44 - Bit 0)
          LE Set Host Feature (Octet 44 - Bit 1)
          Octet 44 - Bit 2 
          Octet 45 - Bit 6 
          Octet 46 - Bit 0 
          Octet 46 - Bit 1 
          Octet 46 - Bit 2 
          Octet 47 - Bit 4 
< HCI Command: Host Buffer Size (0x03|0x0033) plen 7         #9 [hci1] 1.034174
        ACL MTU: 255  ACL max packet: 16
        SCO MTU: 0    SCO max packet: 0
> HCI Event: Command Complete (0x0e) plen 4                 #10 [hci1] 1.034672
      Host Buffer Size (0x03|0x0033) ncmd 1
        Status: Success (0x00)
< HCI Command: Set Controller To Ho.. (0x03|0x0031) plen 1  #11 [hci1] 1.054206
        Flow control: ACL Data Packets (0x01)
> HCI Event: Command Complete (0x0e) plen 4                 #12 [hci1] 1.054653
      Set Controller To Host Flow Control (0x03|0x0031) ncmd 1
        Status: Success (0x00)
< HCI Command: LE Read Local Suppor.. (0x08|0x0003) plen 0  #13 [hci1] 1.074145
> HCI Event: Command Complete (0x0e) plen 12                #14 [hci1] 1.074632
      LE Read Local Supported Features (0x08|0x0003) ncmd 1
        Status: Success (0x00)
        Features: 0xfd 0x79 0x00 0xf7 0x30 0x01 0x00 0x00
          LE Encryption
          Extended Reject Indication
          Peripheral-initiated Features Exchange
          LE Ping
          LE Data Packet Length Extension
          LL Privacy
          Extended Scanner Filter Policies
          LE 2M PHY
          LE Coded PHY
          LE Extended Advertising
          LE Periodic Advertising
          Channel Selection Algorithm #2
          Periodic Advertising Sync Transfer - Sender
          Periodic Advertising Sync Transfer - Recipient
          Sleep Clock Accuracy Updates
          Connected Isochronous Stream - Central
          Connected Isochronous Stream - Peripheral
          Isochronous Broadcaster
          Synchronized Receiver
          Periodic Advertising ADI support
          Connection Subrating
          Unknown features (0x0000010000000000)
< HCI Command: LE Set Host Feature (0x08|0x0074) plen 2     #15 [hci1] 1.094156
        Bit Number: 32
          Connected Isochronous Stream (Host Support)
        Bit Value: 1
> HCI Event: Command Complete (0x0e) plen 4                 #16 [hci1] 1.094583
      LE Set Host Feature (0x08|0x0074) ncmd 1
        Status: Success (0x00)
< HCI Command: LE Read Buffer v2 (0x08|0x0060) plen 0       #17 [hci1] 1.114209
> HCI Event: Command Complete (0x0e) plen 10                #18 [hci1] 1.114749
      LE Read Buffer v2 (0x08|0x0060) ncmd 1
        Status: Success (0x00)
        ACL MTU: 27
        ACL max packet: 3
        ISO MTU: 318
        ISO max packet: 3
< HCI Command: LE Read Maximum Adve.. (0x08|0x003a) plen 0  #19 [hci1] 1.134247
> HCI Event: Command Complete (0x0e) plen 6                 #20 [hci1] 1.134771
      LE Read Maximum Advertising Data Length (0x08|0x003a) ncmd 1
        Status: Success (0x00)
        Max length: 1650
< HCI Command: LE Read Supported St.. (0x08|0x001c) plen 0  #21 [hci1] 1.154177
> HCI Event: Command Complete (0x0e) plen 12                #22 [hci1] 1.154739
      LE Read Supported States (0x08|0x001c) ncmd 1
        Status: Success (0x00)
        States: 0x000003ff3e0306ff
          Non-connectable Advertising State
          Scannable Advertising State
          Connectable Advertising State
          High Duty Cycle Directed Advertising State
          Passive Scanning State
          Active Scanning State
          Initiating State
            and Connection State (Central Role)
          Connection State (Peripheral Role)
          Scannable Advertising State
            and Passive Scanning State
          Connectable Advertising State
            and Passive Scanning State
          Non-connectable Advertising State
            and Initiating State
          Scannable Advertising State
            and Initiating State
          Active Scanning State
            and Connection State (Central Role)
          Passive Scanning State
            and Connection State (Peripheral Role)
          Active Scanning State
            and Connection State (Peripheral Role)
          Initiating State
            and Connection State (Central Role)
            and Central Role & Central Role
          Low Duty Cycle Directed Advertising State
          Connectable Advertising State
            and Initiating State
            and Central Role & Peripheral Role
          High Duty Cycle Directed Advertising State
            and Initiating State
            and Central Role & Peripheral Role
          Low Duty Cycle Directed Advertising State
            and Initiating State
            and Central Role & Peripheral Role
          Connectable Advertising State
            and Connection State (Central Role)
            and Central Role & Peripheral Role
          High Duty Cycle Directed Advertising State
            and Connection State (Central Role)
            and Central Role & Peripheral Role
          Low Duty Cycle Directed Advertising State
            and Connection State (Central Role)
            and Central Role & Peripheral Role
          Connectable Advertising State
            and Connection State (Peripheral Role)
            and Central Role & Peripheral Role
          High Duty Cycle Directed Advertising State
            and Connection State (Peripheral Role)
            and Peripheral Role & Peripheral Role
          Low Duty Cycle Directed Advertising State
            and Connection State (Peripheral Role)
            and Peripheral Role & Peripheral Role
          Initiating State
            and Connection State (Peripheral Role)
            and Central Role & Peripheral Role
< HCI Command: LE Read Maximum Data.. (0x08|0x002f) plen 0  #23 [hci1] 1.174203
> HCI Event: Command Complete (0x0e) plen 12                #24 [hci1] 1.174754
      LE Read Maximum Data Length (0x08|0x002f) ncmd 1
        Status: Success (0x00)
        Max TX octets: 251
        Max TX time: 2704
        Max RX octets: 251
        Max RX time: 2704
< HCI Command: LE Write Suggested D.. (0x08|0x0024) plen 4  #25 [hci1] 1.194170
        TX octets: 251
        TX time: 2704
> HCI Event: Command Complete (0x0e) plen 4                 #26 [hci1] 1.194593
      LE Write Suggested Default Data Length (0x08|0x0024) ncmd 1
        Status: Success (0x00)
< HCI Command: LE Read Resolving Li.. (0x08|0x002a) plen 0  #27 [hci1] 1.214178
> HCI Event: Command Complete (0x0e) plen 5                 #28 [hci1] 1.214710
      LE Read Resolving List Size (0x08|0x002a) ncmd 1
        Status: Success (0x00)
        Size: 8
< HCI Command: LE Set Host Feature (0x08|0x0074) plen 2     #29 [hci1] 1.234199
        Bit Number: 38
          Connection Subrating (Host Support)
        Bit Value: 1
> HCI Event: Command Complete (0x0e) plen 4                 #30 [hci1] 1.234592
      LE Set Host Feature (0x08|0x0074) ncmd 1
        Status: Success (0x00)
< HCI Command: LE Set Event Mask (0x08|0x0001) plen 8       #31 [hci1] 1.254196
        Mask: 0x000002063f87fa5e
          LE Advertising Report
          LE Connection Update Complete
          LE Read Remote Used Features Complete
          LE Long Term Key Request
          LE Data Length Change
          LE Enhanced Connection Complete
          LE PHY Update Complete
          LE Extended Advertising Report
          LE Periodic Advertising Sync Established
          LE Periodic Advertising Report
          LE Periodic Advertising Sync Lost
          LE Extended Scan Timeout
          LE Extended Advertising Set Terminated
          LE Scan Request Received
          LE Periodic Advertising Sync Transfer Rvc
          LE CIS Established
          LE CIS Request
          LE Create BIG Complete
          LE Terminate BIG Complete
          LE BIG Sync Estabilished Complete
          LE BIG Sync Lost
          LE BIG Info Advertising Report
          LE Subrate Change
          Unknown mask (0x0000020000000000)
> HCI Event: Command Complete (0x0e) plen 4                 #32 [hci1] 1.254804
      LE Set Event Mask (0x08|0x0001) ncmd 1
        Status: Success (0x00)
< HCI Command: Set Event Mask (0x03|0x0001) plen 8          #33 [hci1] 1.274199
        Mask: 0x2000800002008890
          Disconnection Complete
          Encryption Change
          Read Remote Version Information Complete
          Hardware Error
          Data Buffer Overflow
          Encryption Key Refresh Complete
          LE Meta
> HCI Event: Command Complete (0x0e) plen 4                 #34 [hci1] 1.274751
      Set Event Mask (0x03|0x0001) ncmd 1
        Status: Success (0x00)
< HCI Command: Read BD ADDR (0x04|0x0009) plen 0            #35 [hci1] 1.294179
> HCI Event: Command Complete (0x0e) plen 10                #36 [hci1] 1.294681
      Read BD ADDR (0x04|0x0009) ncmd 1
        Status: Success (0x00)
        Address: 00:00:00:00:00:00 (OUI 00-00-00)
< HCI Command: LE Set Random Address (0x08|0x0005) plen 6   #37 [hci1] 1.314212
        Address: D5:B6:CC:31:DB:3B (Static)
> HCI Event: Command Complete (0x0e) plen 4                 #38 [hci1] 1.314701
      LE Set Random Address (0x08|0x0005) ncmd 1
        Status: Success (0x00)
< HCI Command: LE Set Extended Adv.. (0x08|0x0036) plen 25  #39 [hci1] 4.704756
        Handle: 0x00
        Properties: 0x0013
          Connectable
          Scannable
          Use legacy advertising PDUs: ADV_IND
        Min advertising interval: 100.000 msec (0x00a0)
        Max advertising interval: 150.000 msec (0x00f0)
        Channel map: 37, 38, 39 (0x07)
        Own address type: Random (0x01)
        Peer address type: Public (0x00)
        Peer address: 00:00:00:00:00:00 (OUI 00-00-00)
        Filter policy: Allow Scan Request from Any, Allow Connect Request from Any (0x00)
        TX power: Host has no preference (0x7f)
        Primary PHY: LE 1M (0x01)
        Secondary max skip: 0x00
        Secondary PHY: LE 1M (0x01)
        SID: 0x00
        Scan request notifications: Disabled (0x00)
> HCI Event: Command Complete (0x0e) plen 5                 #40 [hci1] 4.705502
      LE Set Extended Advertising Parameters (0x08|0x0036) ncmd 1
        Status: Success (0x00)
        TX power (selected): 0 dbm (0x00)
< HCI Command: LE Set Advertising S.. (0x08|0x0035) plen 7  #41 [hci1] 4.714235
        Advertising handle: 0x00
        Advertising random address: D5:B6:CC:31:DB:3B (Static)
> HCI Event: Command Complete (0x0e) plen 4                 #42 [hci1] 4.714821
      LE Set Advertising Set Random Address (0x08|0x0035) ncmd 1
        Status: Success (0x00)
< HCI Command: LE Set Extended Adv.. (0x08|0x0037) plen 22  #43 [hci1] 4.734287
        Handle: 0x00
        Operation: Complete extended advertising data (0x03)
        Fragment preference: Minimize fragmentation (0x01)
        Data length: 0x12
        Flags: 0x06
          LE General Discoverable Mode
          BR/EDR Not Supported
        Name (complete): Tester_F6B11A
> HCI Event: Command Complete (0x0e) plen 4                 #44 [hci1] 4.734955
      LE Set Extended Advertising Data (0x08|0x0037) ncmd 1
        Status: Success (0x00)
< HCI Command: LE Set Extended Scan.. (0x08|0x0038) plen 4  #45 [hci1] 4.754233
        Handle: 0x00
        Operation: Complete scan response data (0x03)
        Fragment preference: Minimize fragmentation (0x01)
        Data length: 0x00
> HCI Event: Command Complete (0x0e) plen 4                 #46 [hci1] 4.754700
      LE Set Extended Scan Response Data (0x08|0x0038) ncmd 1
        Status: Success (0x00)
< HCI Command: LE Set Extended Adve.. (0x08|0x0039) plen 6  #47 [hci1] 4.774254
        Extended advertising: Enabled (0x01)
        Number of sets: 1 (0x01)
        Entry 0
          Handle: 0x00
          Duration: 0 ms (0x00)
          Max ext adv events: 0
> HCI Event: Command Complete (0x0e) plen 4                 #48 [hci1] 4.774830
      LE Set Extended Advertising Enable (0x08|0x0039) ncmd 1
        Status: Success (0x00)
> HCI Event: LE Meta Event (0x3e) plen 31                   #49 [hci1] 4.890684
      LE Enhanced Connection Complete (0x0a)
        Status: Success (0x00)
        Handle: 1389
        Role: Peripheral (0x01)
        Peer address type: Public (0x00)
        Peer address: DF:A9:FF:F6:B1:1A (OUI DF-A9-FF)
        Local resolvable private address: 00:00:00:00:00:00 (Non-Resolvable)
        Peer resolvable private address: 00:00:00:00:00:00 (Non-Resolvable)
        Connection interval: 87.50 msec (0x0046)
        Connection latency: 0 (0x0000)
        Supervision timeout: 25120 msec (0x09d0)
        Central clock accuracy: 0x01
> HCI Event: LE Meta Event (0x3e) plen 6                    #50 [hci1] 4.890830
      LE Advertising Set Terminated (0x12)
        Status: Success (0x00)
        Handle: 0
        Connection handle: 1389
        Number of completed extended advertising events: 0
< HCI Command: LE Read Remote Used... (0x08|0x0016) plen 2  #51 [hci1] 4.894599
        Handle: 1389 Address: DF:A9:FF:F6:B1:1A (OUI DF-A9-FF)
< ACL Data TX: Handle 1389 flags 0x00 dlen 7                #52 [hci1] 4.894633
      ATT: Exchange MTU Request (0x02) len 2
        Client RX MTU: 251
> HCI Event: Command Status (0x0f) plen 4                   #53 [hci1] 4.895202
      LE Read Remote Used Features (0x08|0x0016) ncmd 1
        Status: Success (0x00)
> HCI Event: Number of Completed Packets (0x13) plen 5      #54 [hci1] 5.066699
        Num handles: 1
        Handle: 1389 Address: DF:A9:FF:F6:B1:1A (OUI DF-A9-FF)
        Count: 1
        #52: len 7 (0 Kb/s)
        Latency: 172 msec (172-172 msec ~172 msec)
> HCI Event: LE Meta Event (0x3e) plen 12                   #55 [hci1] 5.154649
      LE Read Remote Used Features (0x04)
        Status: Success (0x00)
        Handle: 1389 Address: DF:A9:FF:F6:B1:1A (OUI DF-A9-FF)
        Features: 0x2d 0x49 0x00 0xf7 0x67 0xd9 0x00 0x80
          LE Encryption
          Extended Reject Indication
          Peripheral-initiated Features Exchange
          LE Data Packet Length Extension
          LE 2M PHY
          LE Coded PHY
          Channel Selection Algorithm #2
          Periodic Advertising Sync Transfer - Sender
          Periodic Advertising Sync Transfer - Recipient
          Sleep Clock Accuracy Updates
          Connected Isochronous Stream - Central
          Connected Isochronous Stream - Peripheral
          Isochronous Broadcaster
          Synchronized Receiver
          Connected Isochronous Stream (Host Support)
          LE Power Control Request
          LE Power Control Request
          Connection Subrating
          Connection Subrating (Host Support)
          Unknown features (0x8000d90000000000)
> ACL Data RX: Handle 1389 flags 0x02 dlen 11               #56 [hci1] 7.604357
      SMP: Pairing Request (0x01) len 6
        IO capability: KeyboardDisplay (0x04)
        OOB data: Authentication data not present (0x00)
        Authentication requirement: Bonding, No MITM, SC, No Keypresses (0x09)
        Max encryption key size: 16
        Initiator key distribution: EncKey IdKey (0x03)
        Responder key distribution: EncKey IdKey Sign (0x07)
> ACL Data RX: Handle 1389 flags 0x02 dlen 7                #57 [hci1] 7.604915
      ATT: Exchange MTU Response (0x03) len 2
        Server RX MTU: 23
< HCI Command: Host Number of Compl.. (0x03|0x0035) plen 5  #58 [hci1] 7.614751
        Num handles: 1
        Handle: 1389 Address: DF:A9:FF:F6:B1:1A (OUI DF-A9-FF)
        Count: 1
< ACL Data TX: Handle 1389 flags 0x00 dlen 11               #59 [hci1] 7.614924
      SMP: Pairing Response (0x02) len 6
        IO capability: NoInputNoOutput (0x03)
        OOB data: Authentication data not present (0x00)
        Authentication requirement: Bonding, No MITM, SC, No Keypresses (0x09)
        Max encryption key size: 16
        Initiator key distribution: IdKey (0x02)
        Responder key distribution: <none> (0x00)
< HCI Command: Host Number of Compl.. (0x03|0x0035) plen 5  #60 [hci1] 7.615211
        Num handles: 1
        Handle: 1389 Address: DF:A9:FF:F6:B1:1A (OUI DF-A9-FF)
        Count: 1
> HCI Event: Number of Completed Packets (0x13) plen 5      #61 [hci1] 7.779454
        Num handles: 1
        Handle: 1389 Address: DF:A9:FF:F6:B1:1A (OUI DF-A9-FF)
        Count: 1
        #59: len 11 (0 Kb/s)
        Latency: 164 msec (164-172 msec ~168 msec)
> ACL Data RX: Handle 1389 flags 0x02 dlen 27               #62 [hci1] 7.779866
> ACL Data RX: Handle 1389 flags 0x01 dlen 27               #63 [hci1] 7.780360
> ACL Data RX: Handle 1389 flags 0x01 dlen 15               #64 [hci1] 7.780830
      SMP: Pairing Public Key (0x0c) len 64
        X: fa5dece8c2595c740cf66946a06d34e5e8fa2b09dc45d66dc04db502903cab9a
        Y: a8b8e95fd452ab7502a3c8a4cea717c31557e2035ce79959d40aaf66511fc945
< HCI Command: Host Number of Compl.. (0x03|0x0035) plen 5  #65 [hci1] 7.795118
        Num handles: 1
        Handle: 1389 Address: DF:A9:FF:F6:B1:1A (OUI DF-A9-FF)
        Count: 1
< HCI Command: Host Number of Compl.. (0x03|0x0035) plen 5  #66 [hci1] 7.795435
        Num handles: 1
        Handle: 1389 Address: DF:A9:FF:F6:B1:1A (OUI DF-A9-FF)
        Count: 1
< HCI Command: Host Number of Compl.. (0x03|0x0035) plen 5  #67 [hci1] 7.795741
        Num handles: 1
        Handle: 1389 Address: DF:A9:FF:F6:B1:1A (OUI DF-A9-FF)
        Count: 1
< ACL Data TX: Handle 1389 flags 0x00 dlen 27               #68 [hci1] 7.795852
< ACL Data TX: Handle 1389 flags 0x01 dlen 27               #69 [hci1] 7.795879
< ACL Data TX: Handle 1389 flags 0x01 dlen 15               #70 [hci1] 7.795923
      SMP: Pairing Public Key (0x0c) len 64
        X: 98308440221e2d910f0e54b71e7ec652857aa9b5a0dc65028824cc19db1226e9
        Y: 67a4816bcb62efb21701e31fdb27561a6217575fb007a8bbdabe7e28b6f68482
> HCI Event: Number of Completed Packets (0x13) plen 5      #71 [hci1] 7.867396
        Num handles: 1
        Handle: 1389 Address: DF:A9:FF:F6:B1:1A (OUI DF-A9-FF)
        Count: 1
        #68: len 27 (3 Kb/s)
        Latency: 71 msec (71-172 msec ~119 msec)
> HCI Event: Number of Completed Packets (0x13) plen 5      #72 [hci1] 7.867947
        Num handles: 1
        Handle: 1389 Address: DF:A9:FF:F6:B1:1A (OUI DF-A9-FF)
        Count: 1
        #69: len 27 (3 Kb/s)
        Latency: 72 msec (71-172 msec ~95 msec)
< ACL Data TX: Handle 1389 flags 0x00 dlen 21               #73 [hci1] 7.874582
      SMP: Pairing Confirm (0x03) len 16
        Confim value: 99494f2c9641b5d1d74a2451d61d736e
> HCI Event: Number of Completed Packets (0x13) plen 5      #74 [hci1] 7.954169
        Num handles: 1
        Handle: 1389 Address: DF:A9:FF:F6:B1:1A (OUI DF-A9-FF)
        Count: 1
        #70: len 15 (0 Kb/s)
        Latency: 158 msec (71-172 msec ~127 msec)
> HCI Event: Number of Completed Packets (0x13) plen 5      #75 [hci1] 8.041942
        Num handles: 1
        Handle: 1389 Address: DF:A9:FF:F6:B1:1A (OUI DF-A9-FF)
        Count: 1
        #73: len 21 (1 Kb/s)
        Latency: 167 msec (71-172 msec ~147 msec)
> ACL Data RX: Handle 1389 flags 0x02 dlen 21               #76 [hci1] 8.042256
      SMP: Pairing Random (0x04) len 16
        Random value: b1ad311d247e90a70000000000000000
< HCI Command: Host Number of Compl.. (0x03|0x0035) plen 5  #77 [hci1] 8.054558
        Num handles: 1
        Handle: 1389 Address: DF:A9:FF:F6:B1:1A (OUI DF-A9-FF)
        Count: 1
< ACL Data TX: Handle 1389 flags 0x00 dlen 21               #78 [hci1] 8.054645
      SMP: Pairing Random (0x04) len 16
        Random value: 8e6108f966a694cbe26df70bb96773e6
> HCI Event: Number of Completed Packets (0x13) plen 5      #79 [hci1] 8.216647
        Num handles: 1
        Handle: 1389 Address: DF:A9:FF:F6:B1:1A (OUI DF-A9-FF)
        Count: 1
        #78: len 21 (1 Kb/s)
        Latency: 162 msec (71-172 msec ~154 msec)
> ACL Data RX: Handle 1389 flags 0x02 dlen 21               #80 [hci1] 8.392048
      SMP: Pairing DHKey Check (0x0d) len 16
        E: 1e273e46d5a94b4a1ec8e5845f98e4e1
< HCI Command: Host Number of Compl.. (0x03|0x0035) plen 5  #81 [hci1] 8.395175
        Num handles: 1
        Handle: 1389 Address: DF:A9:FF:F6:B1:1A (OUI DF-A9-FF)
        Count: 1
< ACL Data TX: Handle 1389 flags 0x00 dlen 21               #82 [hci1] 8.395226
      SMP: Pairing DHKey Check (0x0d) len 16
        E: 7a2444b56ae3af7b82dd3a36a9509232
> HCI Event: Number of Completed Packets (0x13) plen 5      #83 [hci1] 8.566714
        Num handles: 1
        Handle: 1389 Address: DF:A9:FF:F6:B1:1A (OUI DF-A9-FF)
        Count: 1
        #82: len 21 (0 Kb/s)
        Latency: 171 msec (71-172 msec ~163 msec)
> HCI Event: LE Meta Event (0x3e) plen 13                   #84 [hci1] 8.654710
      LE Long Term Key Request (0x05)
        Handle: 1389 Address: DF:A9:FF:F6:B1:1A (OUI DF-A9-FF)
        Random number: 0x0000000000000000
        Encrypted diversifier: 0x0000
< HCI Command: LE Long Term Key Re.. (0x08|0x001a) plen 18  #85 [hci1] 8.674334
        Handle: 1389 Address: DF:A9:FF:F6:B1:1A (OUI DF-A9-FF)
        Long term key: c599d3e7522506406aad90208052e3eb
> HCI Event: Command Complete (0x0e) plen 6                 #86 [hci1] 8.674979
      LE Long Term Key Request Reply (0x08|0x001a) ncmd 1
        Status: Success (0x00)
        Handle: 1389 Address: DF:A9:FF:F6:B1:1A (OUI DF-A9-FF)
> HCI Event: Encryption Change (0x08) plen 4                #87 [hci1] 9.092004
        Status: Success (0x00)
        Handle: 1389 Address: DF:A9:FF:F6:B1:1A (OUI DF-A9-FF)
        Encryption: Enabled with AES-CCM (0x01)
> ACL Data RX: Handle 1389 flags 0x02 dlen 21               #88 [hci1] 9.179511
      SMP: Identity Information (0x08) len 16
        Identity resolving key: 7227bc9147b52b35c929248f2703f154
< ACL Data TX: Handle 1389 flags 0x00 dlen 11               #89 [hci1] 9.204467
      ATT: Read By Type Request (0x08) len 6
        Handle range: 0x0001-0xffff
        Attribute type: Central Address Resolution (0x2aa6)
< HCI Command: Host Number of Compl.. (0x03|0x0035) plen 5  #90 [hci1] 9.204655
        Num handles: 1
        Handle: 1389 Address: DF:A9:FF:F6:B1:1A (OUI DF-A9-FF)
        Count: 1
> HCI Event: Number of Completed Packets (0x13) plen 5      #91 [hci1] 9.354342
        Num handles: 1
        Handle: 1389 Address: DF:A9:FF:F6:B1:1A (OUI DF-A9-FF)
        Count: 1
        #89: len 11 (0 Kb/s)
        Latency: 149 msec (71-172 msec ~156 msec)
> ACL Data RX: Handle 1389 flags 0x02 dlen 12               #92 [hci1] 9.354607
      SMP: Identity Address Information (0x09) len 7
        Address: DF:A9:FF:F6:B1:1A (OUI DF-A9-FF)
< HCI Command: LE Add Device To Re.. (0x08|0x0027) plen 39  #93 [hci1] 9.374730
        Address type: Public (0x00)
        Address: DF:A9:FF:F6:B1:1A (OUI DF-A9-FF)
        Peer identity resolving key: 7227bc9147b52b35c929248f2703f154
        Local identity resolving key: 00000000000000000000000000000000
> HCI Event: Command Complete (0x0e) plen 4                 #94 [hci1] 9.375717
      LE Add Device To Resolving List (0x08|0x0027) ncmd 1
        Status: Success (0x00)
< HCI Command: LE Set Privacy Mode (0x08|0x004e) plen 8     #95 [hci1] 9.394348
        Peer Identity address type: Public (0x00)
        Peer Identity address: DF:A9:FF:F6:B1:1A (OUI DF-A9-FF)
        Privacy Mode: Use Device Privacy (0x01)
> HCI Event: Command Complete (0x0e) plen 4                 #96 [hci1] 9.394849
      LE Set Privacy Mode (0x08|0x004e) ncmd 1
        Status: Success (0x00)
< HCI Command: LE Set Address Resol.. (0x08|0x002d) plen 1  #97 [hci1] 9.414339
        Address resolution: Enabled (0x01)
> HCI Event: Command Complete (0x0e) plen 4                 #98 [hci1] 9.414854
      LE Set Address Resolution Enable (0x08|0x002d) ncmd 1
        Status: Success (0x00)
< HCI Command: Host Number of Compl.. (0x03|0x0035) plen 5  #99 [hci1] 9.434313
        Num handles: 1
        Handle: 1389 Address: DF:A9:FF:F6:B1:1A (OUI DF-A9-FF)
        Count: 1
> ACL Data RX: Handle 1389 flags 0x02 dlen 11              #100 [hci1] 9.441982
      ATT: Read By Group Type Request (0x10) len 6
        Handle range: 0x0001-0xffff
        Attribute group type: Primary Service (0x2800)
< HCI Command: Host Number of Comp.. (0x03|0x0035) plen 5  #101 [hci1] 9.454422
        Num handles: 1
        Handle: 1389 Address: DF:A9:FF:F6:B1:1A (OUI DF-A9-FF)
        Count: 1
< ACL Data TX: Handle 1389 flags 0x00 dlen 24              #102 [hci1] 9.454496
      ATT: Read By Group Type Response (0x11) len 19
        Attribute data length: 6
        Attribute group list: 3 entries
        Handle range: 0x0001-0x000a
        UUID: Generic Attribute Profile (0x1801)
        Handle range: 0x000b-0x0011
        UUID: Generic Access Profile (0x1800)
        Handle range: 0x0012-0x0026
        UUID: Device Information (0x180a)
> ACL Data RX: Handle 1389 flags 0x02 dlen 9               #103 [hci1] 9.529349
      ATT: Read By Type Response (0x09) len 4
        Attribute data length: 3
        Attribute data list: 1 entry
        Handle: 0x000f
        Value: 01
< HCI Command: Host Number of Comp.. (0x03|0x0035) plen 5  #104 [hci1] 9.534499
        Num handles: 1
        Handle: 1389 Address: DF:A9:FF:F6:B1:1A (OUI DF-A9-FF)
        Count: 1
> HCI Event: Number of Completed Packets (0x13) plen 5     #105 [hci1] 9.616859
        Num handles: 1
        Handle: 1389 Address: DF:A9:FF:F6:B1:1A (OUI DF-A9-FF)
        Count: 1
        #102: len 24 (1 Kb/s)
        Latency: 162 msec (71-172 msec ~159 msec)
> ACL Data RX: Handle 1389 flags 0x02 dlen 11              #106 [hci1] 9.616999
      ATT: Read By Group Type Request (0x10) len 6
        Handle range: 0x0027-0xffff
        Attribute group type: Primary Service (0x2800)
< HCI Command: Host Number of Comp.. (0x03|0x0035) plen 5  #107 [hci1] 9.634621
        Num handles: 1
        Handle: 1389 Address: DF:A9:FF:F6:B1:1A (OUI DF-A9-FF)
        Count: 1
< ACL Data TX: Handle 1389 flags 0x00 dlen 18              #108 [hci1] 9.634655
      ATT: Read By Group Type Response (0x11) len 13
        Attribute data length: 6
        Attribute group list: 2 entries
        Handle range: 0x0027-0x0029
        UUID: Immediate Alert (0x1802)
        Handle range: 0x0062-0x006e
        UUID: Volume Control (0x1844)
> HCI Event: Number of Completed Packets (0x13) plen 5     #109 [hci1] 9.791842
        Num handles: 1
        Handle: 1389 Address: DF:A9:FF:F6:B1:1A (OUI DF-A9-FF)
        Count: 1
        #108: len 18 (0 Kb/s)
        Latency: 157 msec (71-172 msec ~158 msec)
> ACL Data RX: Handle 1389 flags 0x02 dlen 11              #110 [hci1] 9.792043
      ATT: Read By Group Type Request (0x10) len 6
        Handle range: 0x006f-0xffff
        Attribute group type: Primary Service (0x2800)
< HCI Command: Host Number of Comp.. (0x03|0x0035) plen 5  #111 [hci1] 9.794913
        Num handles: 1
        Handle: 1389 Address: DF:A9:FF:F6:B1:1A (OUI DF-A9-FF)
        Count: 1
< ACL Data TX: Handle 1389 flags 0x00 dlen 9               #112 [hci1] 9.795054
      ATT: Error Response (0x01) len 4
        Read By Group Type Request (0x10)
        Handle: 0x006f
        Error: Attribute Not Found (0x0a)
> HCI Event: Number of Completed Packets (0x13) plen 5     #113 [hci1] 9.966838
        Num handles: 1
        Handle: 1389 Address: DF:A9:FF:F6:B1:1A (OUI DF-A9-FF)
        Count: 1
        #112: len 9 (0 Kb/s)
        Latency: 171 msec (71-172 msec ~165 msec)
> ACL Data RX: Handle 1389 flags 0x02 dlen 11              #114 [hci1] 9.967048
      ATT: Read By Type Request (0x08) len 6
        Handle range: 0x0001-0x000a
        Attribute type: Characteristic (0x2803)
< HCI Command: Host Number of Comp.. (0x03|0x0035) plen 5  #115 [hci1] 9.974948
        Num handles: 1
        Handle: 1389 Address: DF:A9:FF:F6:B1:1A (OUI DF-A9-FF)
        Count: 1
< ACL Data TX: Handle 1389 flags 0x00 dlen 20              #116 [hci1] 9.975041
      ATT: Read By Type Response (0x09) len 15
        Attribute data length: 7
        Attribute data list: 2 entries
        Handle: 0x0002
        Value: 200300052a
            Properties: 0x20
              Indicate (0x20)
            Value Handle: 0x0003
            Value UUID: Service Changed (0x2a05)
        Handle: 0x0005
        Value: 0a0600292b
            Properties: 0x0a
              Read (0x02)
              Write (0x08)
            Value Handle: 0x0006
            Value UUID: Client Supported Features (0x2b29)
> HCI Event: Number of Completed Packets (0x13) plen 5    #117 [hci1] 10.141908
        Num handles: 1
        Handle: 1389 Address: DF:A9:FF:F6:B1:1A (OUI DF-A9-FF)
        Count: 1
        #116: len 20 (0 Kb/s)
        Latency: 166 msec (71-172 msec ~165 msec)
> ACL Data RX: Handle 1389 flags 0x02 dlen 11             #118 [hci1] 10.142077
      ATT: Read By Type Request (0x08) len 6
        Handle range: 0x0006-0x000a
        Attribute type: Characteristic (0x2803)
< HCI Command: Host Number of Com.. (0x03|0x0035) plen 5  #119 [hci1] 10.154588
        Num handles: 1
        Handle: 1389 Address: DF:A9:FF:F6:B1:1A (OUI DF-A9-FF)
        Count: 1
< ACL Data TX: Handle 1389 flags 0x00 dlen 20             #120 [hci1] 10.154620
      ATT: Read By Type Response (0x09) len 15
        Attribute data length: 7
        Attribute data list: 2 entries
        Handle: 0x0007
        Value: 0208002a2b
            Properties: 0x02
              Read (0x02)
            Value Handle: 0x0008
            Value UUID: Database Hash (0x2b2a)
        Handle: 0x0009
        Value: 020a003a2b
            Properties: 0x02
              Read (0x02)
            Value Handle: 0x000a
            Value UUID: Server Supported Features (0x2b3a)
> HCI Event: Number of Completed Packets (0x13) plen 5    #121 [hci1] 10.316869
        Num handles: 1
        Handle: 1389 Address: DF:A9:FF:F6:B1:1A (OUI DF-A9-FF)
        Count: 1
        #120: len 20 (0 Kb/s)
        Latency: 162 msec (71-172 msec ~164 msec)
> ACL Data RX: Handle 1389 flags 0x02 dlen 11             #122 [hci1] 10.317025
      ATT: Read By Type Request (0x08) len 6
        Handle range: 0x000a-0x000a
        Attribute type: Characteristic (0x2803)
< HCI Command: Host Number of Com.. (0x03|0x0035) plen 5  #123 [hci1] 10.334593
        Num handles: 1
        Handle: 1389 Address: DF:A9:FF:F6:B1:1A (OUI DF-A9-FF)
        Count: 1
< ACL Data TX: Handle 1389 flags 0x00 dlen 9              #124 [hci1] 10.334643
      ATT: Error Response (0x01) len 4
        Read By Type Request (0x08)
        Handle: 0x000a
        Error: Attribute Not Found (0x0a)
> HCI Event: Number of Completed Packets (0x13) plen 5    #125 [hci1] 10.491846
        Num handles: 1
        Handle: 1389 Address: DF:A9:FF:F6:B1:1A (OUI DF-A9-FF)
        Count: 1
        #124: len 9 (0 Kb/s)
        Latency: 157 msec (71-172 msec ~160 msec)
> ACL Data RX: Handle 1389 flags 0x02 dlen 9              #126 [hci1] 10.491975
      ATT: Find Information Request (0x04) len 4
        Handle range: 0x0004-0x0004
< HCI Command: Host Number of Com.. (0x03|0x0035) plen 5  #127 [hci1] 10.494943
        Num handles: 1
        Handle: 1389 Address: DF:A9:FF:F6:B1:1A (OUI DF-A9-FF)
        Count: 1
< ACL Data TX: Handle 1389 flags 0x00 dlen 10             #128 [hci1] 10.495035
      ATT: Find Information Response (0x05) len 5
        Format: UUID-16 (0x01)
        Handle: 0x0004
        UUID: Client Characteristic Configuration (0x2902)
> HCI Event: Number of Completed Packets (0x13) plen 5    #129 [hci1] 10.666852
        Num handles: 1
        Handle: 1389 Address: DF:A9:FF:F6:B1:1A (OUI DF-A9-FF)
        Count: 1
        #128: len 10 (0 Kb/s)
        Latency: 171 msec (71-172 msec ~166 msec)
> ACL Data RX: Handle 1389 flags 0x02 dlen 11             #130 [hci1] 10.667002
      ATT: Read By Type Request (0x08) len 6
        Handle range: 0x000b-0x0011
        Attribute type: Characteristic (0x2803)
< HCI Command: Host Number of Com.. (0x03|0x0035) plen 5  #131 [hci1] 10.674769
        Num handles: 1
        Handle: 1389 Address: DF:A9:FF:F6:B1:1A (OUI DF-A9-FF)
        Count: 1
< ACL Data TX: Handle 1389 flags 0x00 dlen 20             #132 [hci1] 10.674833
      ATT: Read By Type Response (0x09) len 15
        Attribute data length: 7
        Attribute data list: 2 entries
        Handle: 0x000c
        Value: 0a0d00002a
            Properties: 0x0a
              Read (0x02)
              Write (0x08)
            Value Handle: 0x000d
            Value UUID: Device Name (0x2a00)
        Handle: 0x000e
        Value: 0a0f00012a
            Properties: 0x0a
              Read (0x02)
              Write (0x08)
            Value Handle: 0x000f
            Value UUID: Appearance (0x2a01)
> HCI Event: Number of Completed Packets (0x13) plen 5    #133 [hci1] 10.841891
        Num handles: 1
        Handle: 1389 Address: DF:A9:FF:F6:B1:1A (OUI DF-A9-FF)
        Count: 1
        #132: len 20 (0 Kb/s)
        Latency: 167 msec (71-172 msec ~166 msec)
> ACL Data RX: Handle 1389 flags 0x02 dlen 11             #134 [hci1] 10.842010
      ATT: Read By Type Request (0x08) len 6
        Handle range: 0x000f-0x0011
        Attribute type: Characteristic (0x2803)
< HCI Command: Host Number of Com.. (0x03|0x0035) plen 5  #135 [hci1] 10.854619
        Num handles: 1
        Handle: 1389 Address: DF:A9:FF:F6:B1:1A (OUI DF-A9-FF)
        Count: 1
< ACL Data TX: Handle 1389 flags 0x00 dlen 13             #136 [hci1] 10.854667
      ATT: Read By Type Response (0x09) len 8
        Attribute data length: 7
        Attribute data list: 1 entry
        Handle: 0x0010
        Value: 021100042a
            Properties: 0x02
              Read (0x02)
            Value Handle: 0x0011
            Value UUID: Peripheral Preferred Connection Parameters (0x2a04)
> HCI Event: Number of Completed Packets (0x13) plen 5    #137 [hci1] 11.016823
        Num handles: 1
        Handle: 1389 Address: DF:A9:FF:F6:B1:1A (OUI DF-A9-FF)
        Count: 1
        #136: len 13 (0 Kb/s)
        Latency: 162 msec (71-172 msec ~164 msec)
> ACL Data RX: Handle 1389 flags 0x02 dlen 11             #138 [hci1] 11.017009
      ATT: Read By Type Request (0x08) len 6
        Handle range: 0x0011-0x0011
        Attribute type: Characteristic (0x2803)
< HCI Command: Host Number of Com.. (0x03|0x0035) plen 5  #139 [hci1] 11.034416
        Num handles: 1
        Handle: 1389 Address: DF:A9:FF:F6:B1:1A (OUI DF-A9-FF)
        Count: 1
< ACL Data TX: Handle 1389 flags 0x00 dlen 9              #140 [hci1] 11.034503
      ATT: Error Response (0x01) len 4
        Read By Type Request (0x08)
        Handle: 0x0011
        Error: Attribute Not Found (0x0a)
> HCI Event: Number of Completed Packets (0x13) plen 5    #141 [hci1] 11.191811
        Num handles: 1
        Handle: 1389 Address: DF:A9:FF:F6:B1:1A (OUI DF-A9-FF)
        Count: 1
        #140: len 9 (0 Kb/s)
        Latency: 157 msec (71-172 msec ~160 msec)
> ACL Data RX: Handle 1389 flags 0x02 dlen 11             #142 [hci1] 11.191972
      ATT: Read By Type Request (0x08) len 6
        Handle range: 0x0012-0x0026
        Attribute type: Characteristic (0x2803)
< HCI Command: Host Number of Com.. (0x03|0x0035) plen 5  #143 [hci1] 11.194444
        Num handles: 1
        Handle: 1389 Address: DF:A9:FF:F6:B1:1A (OUI DF-A9-FF)
        Count: 1
< ACL Data TX: Handle 1389 flags 0x00 dlen 20             #144 [hci1] 11.194468
      ATT: Read By Type Response (0x09) len 15
        Attribute data length: 7
        Attribute data list: 2 entries
        Handle: 0x0013
        Value: 021400242a
            Properties: 0x02
              Read (0x02)
            Value Handle: 0x0014
            Value UUID: Model Number String (0x2a24)
        Handle: 0x0015
        Value: 021600292a
            Properties: 0x02
              Read (0x02)
            Value Handle: 0x0016
            Value UUID: Manufacturer Name String (0x2a29)
> HCI Event: Number of Completed Packets (0x13) plen 5    #145 [hci1] 11.366886
        Num handles: 1
        Handle: 1389 Address: DF:A9:FF:F6:B1:1A (OUI DF-A9-FF)
        Count: 1
        #144: len 20 (0 Kb/s)
        Latency: 172 msec (71-172 msec ~166 msec)
> ACL Data RX: Handle 1389 flags 0x02 dlen 11             #146 [hci1] 11.367052
      ATT: Read By Type Request (0x08) len 6
        Handle range: 0x0016-0x0026
        Attribute type: Characteristic (0x2803)
< HCI Command: Host Number of Com.. (0x03|0x0035) plen 5  #147 [hci1] 11.374648
        Num handles: 1
        Handle: 1389 Address: DF:A9:FF:F6:B1:1A (OUI DF-A9-FF)
        Count: 1
< ACL Data TX: Handle 1389 flags 0x00 dlen 20             #148 [hci1] 11.374742
      ATT: Read By Type Response (0x09) len 15
        Attribute data length: 7
        Attribute data list: 2 entries
        Handle: 0x0017
        Value: 021800502a
            Properties: 0x02
              Read (0x02)
            Value Handle: 0x0018
            Value UUID: PnP ID (0x2a50)
        Handle: 0x0019
        Value: 021a00252a
            Properties: 0x02
              Read (0x02)
            Value Handle: 0x001a
            Value UUID: Serial Number String (0x2a25)
> HCI Event: Number of Completed Packets (0x13) plen 5    #149 [hci1] 11.541812
        Num handles: 1
        Handle: 1389 Address: DF:A9:FF:F6:B1:1A (OUI DF-A9-FF)
        Count: 1
        #148: len 20 (0 Kb/s)
        Latency: 167 msec (71-172 msec ~166 msec)
> ACL Data RX: Handle 1389 flags 0x02 dlen 11             #150 [hci1] 11.541969
      ATT: Read By Type Request (0x08) len 6
        Handle range: 0x001a-0x0026
        Attribute type: Characteristic (0x2803)
< HCI Command: Host Number of Com.. (0x03|0x0035) plen 5  #151 [hci1] 11.554608
        Num handles: 1
        Handle: 1389 Address: DF:A9:FF:F6:B1:1A (OUI DF-A9-FF)
        Count: 1
< ACL Data TX: Handle 1389 flags 0x00 dlen 20             #152 [hci1] 11.554635
      ATT: Read By Type Response (0x09) len 15
        Attribute data length: 7
        Attribute data list: 2 entries
        Handle: 0x001b
        Value: 021c00262a
            Properties: 0x02
              Read (0x02)
            Value Handle: 0x001c
            Value UUID: Firmware Revision String (0x2a26)
        Handle: 0x001d
        Value: 021e00272a
            Properties: 0x02
              Read (0x02)
            Value Handle: 0x001e
            Value UUID: Hardware Revision String (0x2a27)
> HCI Event: Number of Completed Packets (0x13) plen 5    #153 [hci1] 11.716825
        Num handles: 1
        Handle: 1389 Address: DF:A9:FF:F6:B1:1A (OUI DF-A9-FF)
        Count: 1
        #152: len 20 (0 Kb/s)
        Latency: 162 msec (71-172 msec ~164 msec)
> ACL Data RX: Handle 1389 flags 0x02 dlen 11             #154 [hci1] 11.716962
      ATT: Read By Type Request (0x08) len 6
        Handle range: 0x001e-0x0026
        Attribute type: Characteristic (0x2803)
< HCI Command: Host Number of Com.. (0x03|0x0035) plen 5  #155 [hci1] 11.734555
        Num handles: 1
        Handle: 1389 Address: DF:A9:FF:F6:B1:1A (OUI DF-A9-FF)
        Count: 1
< ACL Data TX: Handle 1389 flags 0x00 dlen 20             #156 [hci1] 11.734574
      ATT: Read By Type Response (0x09) len 15
        Attribute data length: 7
        Attribute data list: 2 entries
        Handle: 0x001f
        Value: 022000282a
            Properties: 0x02
              Read (0x02)
            Value Handle: 0x0020
            Value UUID: Software Revision String (0x2a28)
        Handle: 0x0021
        Value: 022200ff2b
            Properties: 0x02
              Read (0x02)
            Value Handle: 0x0022
            Value UUID: Unknown (0x2bff)
> HCI Event: Number of Completed Packets (0x13) plen 5    #157 [hci1] 11.891882
        Num handles: 1
        Handle: 1389 Address: DF:A9:FF:F6:B1:1A (OUI DF-A9-FF)
        Count: 1
        #156: len 20 (1 Kb/s)
        Latency: 157 msec (71-172 msec ~160 msec)
> ACL Data RX: Handle 1389 flags 0x02 dlen 11             #158 [hci1] 11.892009
      ATT: Read By Type Request (0x08) len 6
        Handle range: 0x0022-0x0026
        Attribute type: Characteristic (0x2803)
< HCI Command: Host Number of Com.. (0x03|0x0035) plen 5  #159 [hci1] 11.895038
        Num handles: 1
        Handle: 1389 Address: DF:A9:FF:F6:B1:1A (OUI DF-A9-FF)
        Count: 1
< ACL Data TX: Handle 1389 flags 0x00 dlen 20             #160 [hci1] 11.895133
      ATT: Read By Type Response (0x09) len 15
        Attribute data length: 7
        Attribute data list: 2 entries
        Handle: 0x0023
        Value: 022400232a
            Properties: 0x02
              Read (0x02)
            Value Handle: 0x0024
            Value UUID: System ID (0x2a23)
        Handle: 0x0025
        Value: 0226002a2a
            Properties: 0x02
              Read (0x02)
            Value Handle: 0x0026
            Value UUID: IEEE 11073-20601 Regulatory Cert. Data List (0x2a2a)
> HCI Event: Number of Completed Packets (0x13) plen 5    #161 [hci1] 12.066862
        Num handles: 1
        Handle: 1389 Address: DF:A9:FF:F6:B1:1A (OUI DF-A9-FF)
        Count: 1
        #160: len 20 (0 Kb/s)
        Latency: 171 msec (71-172 msec ~166 msec)
> ACL Data RX: Handle 1389 flags 0x02 dlen 11             #162 [hci1] 12.066975
      ATT: Read By Type Request (0x08) len 6
        Handle range: 0x0026-0x0026
        Attribute type: Characteristic (0x2803)
< HCI Command: Host Number of Com.. (0x03|0x0035) plen 5  #163 [hci1] 12.074601
        Num handles: 1
        Handle: 1389 Address: DF:A9:FF:F6:B1:1A (OUI DF-A9-FF)
        Count: 1
< ACL Data TX: Handle 1389 flags 0x00 dlen 9              #164 [hci1] 12.074702
      ATT: Error Response (0x01) len 4
        Read By Type Request (0x08)
        Handle: 0x0026
        Error: Attribute Not Found (0x0a)
> HCI Event: Number of Completed Packets (0x13) plen 5    #165 [hci1] 12.241825
        Num handles: 1
        Handle: 1389 Address: DF:A9:FF:F6:B1:1A (OUI DF-A9-FF)
        Count: 1
        #164: len 9 (0 Kb/s)
        Latency: 167 msec (71-172 msec ~166 msec)
> ACL Data RX: Handle 1389 flags 0x02 dlen 11             #166 [hci1] 12.242017
      ATT: Read By Type Request (0x08) len 6
        Handle range: 0x0027-0x0029
        Attribute type: Characteristic (0x2803)
< HCI Command: Host Number of Com.. (0x03|0x0035) plen 5  #167 [hci1] 12.254536
        Num handles: 1
        Handle: 1389 Address: DF:A9:FF:F6:B1:1A (OUI DF-A9-FF)
        Count: 1
< ACL Data TX: Handle 1389 flags 0x00 dlen 13             #168 [hci1] 12.254565
      ATT: Read By Type Response (0x09) len 8
        Attribute data length: 7
        Attribute data list: 1 entry
        Handle: 0x0028
        Value: 042900062a
            Properties: 0x04
              Write Without Response (0x04)
            Value Handle: 0x0029
            Value UUID: Alert Level (0x2a06)
> HCI Event: Number of Completed Packets (0x13) plen 5    #169 [hci1] 12.416780
        Num handles: 1
        Handle: 1389 Address: DF:A9:FF:F6:B1:1A (OUI DF-A9-FF)
        Count: 1
        #168: len 13 (0 Kb/s)
        Latency: 162 msec (71-172 msec ~164 msec)
> ACL Data RX: Handle 1389 flags 0x02 dlen 11             #170 [hci1] 12.417032
      ATT: Read By Type Request (0x08) len 6
        Handle range: 0x0029-0x0029
        Attribute type: Characteristic (0x2803)
< HCI Command: Host Number of Com.. (0x03|0x0035) plen 5  #171 [hci1] 12.435011
        Num handles: 1
        Handle: 1389 Address: DF:A9:FF:F6:B1:1A (OUI DF-A9-FF)
        Count: 1
< ACL Data TX: Handle 1389 flags 0x00 dlen 9              #172 [hci1] 12.435091
      ATT: Error Response (0x01) len 4
        Read By Type Request (0x08)
        Handle: 0x0029
        Error: Attribute Not Found (0x0a)
> HCI Event: Number of Completed Packets (0x13) plen 5    #173 [hci1] 12.591829
        Num handles: 1
        Handle: 1389 Address: DF:A9:FF:F6:B1:1A (OUI DF-A9-FF)
        Count: 1
        #172: len 9 (0 Kb/s)
        Latency: 156 msec (71-172 msec ~160 msec)
> ACL Data RX: Handle 1389 flags 0x02 dlen 11             #174 [hci1] 12.591986
      ATT: Read By Type Request (0x08) len 6
        Handle range: 0x0062-0x006e
        Attribute type: Characteristic (0x2803)
< HCI Command: Host Number of Com.. (0x03|0x0035) plen 5  #175 [hci1] 12.594597
        Num handles: 1
        Handle: 1389 Address: DF:A9:FF:F6:B1:1A (OUI DF-A9-FF)
        Count: 1
< ACL Data TX: Handle 1389 flags 0x00 dlen 20             #176 [hci1] 12.594661
      ATT: Read By Type Response (0x09) len 15
        Attribute data length: 7
        Attribute data list: 2 entries
        Handle: 0x0067
        Value: 1268007d2b
            Properties: 0x12
              Read (0x02)
              Notify (0x10)
            Value Handle: 0x0068
            Value UUID: Volume State (0x2b7d)
        Handle: 0x006a
        Value: 086b007e2b
            Properties: 0x08
              Write (0x08)
            Value Handle: 0x006b
            Value UUID: Volume Control Point (0x2b7e)
> HCI Event: Number of Completed Packets (0x13) plen 5    #177 [hci1] 12.766920
        Num handles: 1
        Handle: 1389 Address: DF:A9:FF:F6:B1:1A (OUI DF-A9-FF)
        Count: 1
        #176: len 20 (0 Kb/s)
        Latency: 172 msec (71-172 msec ~166 msec)
> ACL Data RX: Handle 1389 flags 0x02 dlen 11             #178 [hci1] 12.767006
      ATT: Read By Type Request (0x08) len 6
        Handle range: 0x006b-0x006e
        Attribute type: Characteristic (0x2803)
< HCI Command: Host Number of Com.. (0x03|0x0035) plen 5  #179 [hci1] 12.774523
        Num handles: 1
        Handle: 1389 Address: DF:A9:FF:F6:B1:1A (OUI DF-A9-FF)
        Count: 1
< ACL Data TX: Handle 1389 flags 0x00 dlen 13             #180 [hci1] 12.774590
      ATT: Read By Type Response (0x09) len 8
        Attribute data length: 7
        Attribute data list: 1 entry
        Handle: 0x006c
        Value: 126d007f2b
            Properties: 0x12
              Read (0x02)
              Notify (0x10)
            Value Handle: 0x006d
            Value UUID: Volume Flags (0x2b7f)
> HCI Event: Number of Completed Packets (0x13) plen 5    #181 [hci1] 12.941910
        Num handles: 1
        Handle: 1389 Address: DF:A9:FF:F6:B1:1A (OUI DF-A9-FF)
        Count: 1
        #180: len 13 (0 Kb/s)
        Latency: 167 msec (71-172 msec ~166 msec)
> ACL Data RX: Handle 1389 flags 0x02 dlen 11             #182 [hci1] 12.942044
      ATT: Read By Type Request (0x08) len 6
        Handle range: 0x006d-0x006e
        Attribute type: Characteristic (0x2803)
< HCI Command: Host Number of Com.. (0x03|0x0035) plen 5  #183 [hci1] 12.954951
        Num handles: 1
        Handle: 1389 Address: DF:A9:FF:F6:B1:1A (OUI DF-A9-FF)
        Count: 1
< ACL Data TX: Handle 1389 flags 0x00 dlen 9              #184 [hci1] 12.955116
      ATT: Error Response (0x01) len 4
        Read By Type Request (0x08)
        Handle: 0x006d
        Error: Attribute Not Found (0x0a)
> HCI Event: Number of Completed Packets (0x13) plen 5    #185 [hci1] 13.116804
        Num handles: 1
        Handle: 1389 Address: DF:A9:FF:F6:B1:1A (OUI DF-A9-FF)
        Count: 1
        #184: len 9 (0 Kb/s)
        Latency: 161 msec (71-172 msec ~164 msec)
> ACL Data RX: Handle 1389 flags 0x02 dlen 9              #186 [hci1] 13.116964
      ATT: Find Information Request (0x04) len 4
        Handle range: 0x0069-0x0069
< HCI Command: Host Number of Com.. (0x03|0x0035) plen 5  #187 [hci1] 13.134577
        Num handles: 1
        Handle: 1389 Address: DF:A9:FF:F6:B1:1A (OUI DF-A9-FF)
        Count: 1
< ACL Data TX: Handle 1389 flags 0x00 dlen 10             #188 [hci1] 13.134611
      ATT: Find Information Response (0x05) len 5
        Format: UUID-16 (0x01)
        Handle: 0x0069
        UUID: Client Characteristic Configuration (0x2902)
> HCI Event: Number of Completed Packets (0x13) plen 5    #189 [hci1] 13.291709
        Num handles: 1
        Handle: 1389 Address: DF:A9:FF:F6:B1:1A (OUI DF-A9-FF)
        Count: 1
        #188: len 10 (0 Kb/s)
        Latency: 157 msec (71-172 msec ~160 msec)
> ACL Data RX: Handle 1389 flags 0x02 dlen 9              #190 [hci1] 13.291946
      ATT: Find Information Request (0x04) len 4
        Handle range: 0x006e-0x006e
< HCI Command: Host Number of Com.. (0x03|0x0035) plen 5  #191 [hci1] 13.294517
        Num handles: 1
        Handle: 1389 Address: DF:A9:FF:F6:B1:1A (OUI DF-A9-FF)
        Count: 1
< ACL Data TX: Handle 1389 flags 0x00 dlen 10             #192 [hci1] 13.294550
      ATT: Find Information Response (0x05) len 5
        Format: UUID-16 (0x01)
        Handle: 0x006e
        UUID: Client Characteristic Configuration (0x2902)
> HCI Event: Number of Completed Packets (0x13) plen 5    #193 [hci1] 13.466761
        Num handles: 1
        Handle: 1389 Address: DF:A9:FF:F6:B1:1A (OUI DF-A9-FF)
        Count: 1
        #192: len 10 (0 Kb/s)
        Latency: 172 msec (71-172 msec ~166 msec)
> ACL Data RX: Handle 1389 flags 0x02 dlen 11             #194 [hci1] 13.466978
      ATT: Read By Type Request (0x08) len 6
        Handle range: 0x0001-0xffff
        Attribute type: Include (0x2802)
< HCI Command: Host Number of Com.. (0x03|0x0035) plen 5  #195 [hci1] 13.474679
        Num handles: 1
        Handle: 1389 Address: DF:A9:FF:F6:B1:1A (OUI DF-A9-FF)
        Count: 1
< ACL Data TX: Handle 1389 flags 0x00 dlen 22             #196 [hci1] 13.474713
      ATT: Read By Type Response (0x09) len 17
        Attribute data length: 8
        Attribute data list: 2 entries
        Handle: 0x0063
        Value: 2a0035004518
        Handle: 0x0064
        Value: 360041004518
> HCI Event: Number of Completed Packets (0x13) plen 5    #197 [hci1] 13.641823
        Num handles: 1
        Handle: 1389 Address: DF:A9:FF:F6:B1:1A (OUI DF-A9-FF)
        Count: 1
        #196: len 22 (1 Kb/s)
        Latency: 167 msec (71-172 msec ~166 msec)
> ACL Data RX: Handle 1389 flags 0x02 dlen 11             #198 [hci1] 13.642000
      ATT: Read By Type Request (0x08) len 6
        Handle range: 0x0065-0xffff
        Attribute type: Include (0x2802)
< HCI Command: Host Number of Com.. (0x03|0x0035) plen 5  #199 [hci1] 13.654615
        Num handles: 1
        Handle: 1389 Address: DF:A9:FF:F6:B1:1A (OUI DF-A9-FF)
        Count: 1
< ACL Data TX: Handle 1389 flags 0x00 dlen 22             #200 [hci1] 13.654647
      ATT: Read By Type Response (0x09) len 17
        Attribute data length: 8
        Attribute data list: 2 entries
        Handle: 0x0065
        Value: 420051004318
        Handle: 0x0066
        Value: 520061004318
> HCI Event: Number of Completed Packets (0x13) plen 5    #201 [hci1] 13.816784
        Num handles: 1
        Handle: 1389 Address: DF:A9:FF:F6:B1:1A (OUI DF-A9-FF)
        Count: 1
        #200: len 22 (1 Kb/s)
        Latency: 162 msec (71-172 msec ~164 msec)
> ACL Data RX: Handle 1389 flags 0x02 dlen 11             #202 [hci1] 13.817025
      ATT: Read By Type Request (0x08) len 6
        Handle range: 0x0067-0xffff
        Attribute type: Include (0x2802)
< HCI Command: Host Number of Com.. (0x03|0x0035) plen 5  #203 [hci1] 13.834621
        Num handles: 1
        Handle: 1389 Address: DF:A9:FF:F6:B1:1A (OUI DF-A9-FF)
        Count: 1
< ACL Data TX: Handle 1389 flags 0x00 dlen 9              #204 [hci1] 13.834713
      ATT: Error Response (0x01) len 4
        Read By Type Request (0x08)
        Handle: 0x0067
        Error: Attribute Not Found (0x0a)
> HCI Event: Number of Completed Packets (0x13) plen 5    #205 [hci1] 13.991973
        Num handles: 1
        Handle: 1389 Address: DF:A9:FF:F6:B1:1A (OUI DF-A9-FF)
        Count: 1
        #204: len 9 (0 Kb/s)
        Latency: 157 msec (71-172 msec ~160 msec)
> ACL Data RX: Handle 1389 flags 0x02 dlen 11             #206 [hci1] 13.991980
      ATT: Read By Type Request (0x08) len 6
        Handle range: 0x002a-0x0035
        Attribute type: Characteristic (0x2803)
< HCI Command: Host Number of Com.. (0x03|0x0035) plen 5  #207 [hci1] 13.994653
        Num handles: 1
        Handle: 1389 Address: DF:A9:FF:F6:B1:1A (OUI DF-A9-FF)
        Count: 1
< ACL Data TX: Handle 1389 flags 0x00 dlen 20             #208 [hci1] 13.994709
      ATT: Read By Type Response (0x09) len 15
        Attribute data length: 7
        Attribute data list: 2 entries
        Handle: 0x002b
        Value: 122c00802b
            Properties: 0x12
              Read (0x02)
              Notify (0x10)
            Value Handle: 0x002c
            Value UUID: Offset State (0x2b80)
        Handle: 0x002e
        Value: 162f00812b
            Properties: 0x16
              Read (0x02)
              Write Without Response (0x04)
              Notify (0x10)
            Value Handle: 0x002f
            Value UUID: Audio Location (0x2b81)
> HCI Event: Number of Completed Packets (0x13) plen 5    #209 [hci1] 14.166832
        Num handles: 1
        Handle: 1389 Address: DF:A9:FF:F6:B1:1A (OUI DF-A9-FF)
        Count: 1
        #208: len 20 (0 Kb/s)
        Latency: 172 msec (71-172 msec ~166 msec)
> ACL Data RX: Handle 1389 flags 0x02 dlen 11             #210 [hci1] 14.166965
      ATT: Read By Type Request (0x08) len 6
        Handle range: 0x002f-0x0035
        Attribute type: Characteristic (0x2803)
< HCI Command: Host Number of Com.. (0x03|0x0035) plen 5  #211 [hci1] 14.174646
        Num handles: 1
        Handle: 1389 Address: DF:A9:FF:F6:B1:1A (OUI DF-A9-FF)
        Count: 1
< ACL Data TX: Handle 1389 flags 0x00 dlen 20             #212 [hci1] 14.174691
      ATT: Read By Type Response (0x09) len 15
        Attribute data length: 7
        Attribute data list: 2 entries
        Handle: 0x0031
        Value: 083200822b
            Properties: 0x08
              Write (0x08)
            Value Handle: 0x0032
            Value UUID: Volume Offset Control Point (0x2b82)
        Handle: 0x0033
        Value: 163400832b
            Properties: 0x16
              Read (0x02)
              Write Without Response (0x04)
              Notify (0x10)
            Value Handle: 0x0034
            Value UUID: Audio Output Description (0x2b83)
> HCI Event: Number of Completed Packets (0x13) plen 5    #213 [hci1] 14.341801
        Num handles: 1
        Handle: 1389 Address: DF:A9:FF:F6:B1:1A (OUI DF-A9-FF)
        Count: 1
        #212: len 20 (0 Kb/s)
        Latency: 167 msec (71-172 msec ~166 msec)
> ACL Data RX: Handle 1389 flags 0x02 dlen 11             #214 [hci1] 14.341931
      ATT: Read By Type Request (0x08) len 6
        Handle range: 0x0034-0x0035
        Attribute type: Characteristic (0x2803)
< HCI Command: Host Number of Com.. (0x03|0x0035) plen 5  #215 [hci1] 14.354611
        Num handles: 1
        Handle: 1389 Address: DF:A9:FF:F6:B1:1A (OUI DF-A9-FF)
        Count: 1
< ACL Data TX: Handle 1389 flags 0x00 dlen 9              #216 [hci1] 14.354698
      ATT: Error Response (0x01) len 4
        Read By Type Request (0x08)
        Handle: 0x0034
        Error: Attribute Not Found (0x0a)
> HCI Event: Number of Completed Packets (0x13) plen 5    #217 [hci1] 14.516828
        Num handles: 1
        Handle: 1389 Address: DF:A9:FF:F6:B1:1A (OUI DF-A9-FF)
        Count: 1
        #216: len 9 (0 Kb/s)
        Latency: 162 msec (71-172 msec ~164 msec)
> ACL Data RX: Handle 1389 flags 0x02 dlen 9              #218 [hci1] 14.516996
      ATT: Find Information Request (0x04) len 4
        Handle range: 0x002d-0x002d
< HCI Command: Host Number of Com.. (0x03|0x0035) plen 5  #219 [hci1] 14.534909
        Num handles: 1
        Handle: 1389 Address: DF:A9:FF:F6:B1:1A (OUI DF-A9-FF)
        Count: 1
< ACL Data TX: Handle 1389 flags 0x00 dlen 10             #220 [hci1] 14.535009
      ATT: Find Information Response (0x05) len 5
        Format: UUID-16 (0x01)
        Handle: 0x002d
        UUID: Client Characteristic Configuration (0x2902)
> HCI Event: Number of Completed Packets (0x13) plen 5    #221 [hci1] 14.691856
        Num handles: 1
        Handle: 1389 Address: DF:A9:FF:F6:B1:1A (OUI DF-A9-FF)
        Count: 1
        #220: len 10 (0 Kb/s)
        Latency: 156 msec (71-172 msec ~160 msec)
> ACL Data RX: Handle 1389 flags 0x02 dlen 9              #222 [hci1] 14.691962
      ATT: Find Information Request (0x04) len 4
        Handle range: 0x0030-0x0030
< HCI Command: Host Number of Com.. (0x03|0x0035) plen 5  #223 [hci1] 14.694593
        Num handles: 1
        Handle: 1389 Address: DF:A9:FF:F6:B1:1A (OUI DF-A9-FF)
        Count: 1
< ACL Data TX: Handle 1389 flags 0x00 dlen 10             #224 [hci1] 14.694634
      ATT: Find Information Response (0x05) len 5
        Format: UUID-16 (0x01)
        Handle: 0x0030
        UUID: Client Characteristic Configuration (0x2902)
> HCI Event: Number of Completed Packets (0x13) plen 5    #225 [hci1] 14.866727
        Num handles: 1
        Handle: 1389 Address: DF:A9:FF:F6:B1:1A (OUI DF-A9-FF)
        Count: 1
        #224: len 10 (0 Kb/s)
        Latency: 172 msec (71-172 msec ~166 msec)
> ACL Data RX: Handle 1389 flags 0x02 dlen 9              #226 [hci1] 14.867002
      ATT: Find Information Request (0x04) len 4
        Handle range: 0x0035-0x0035
< HCI Command: Host Number of Com.. (0x03|0x0035) plen 5  #227 [hci1] 14.874508
        Num handles: 1
        Handle: 1389 Address: DF:A9:FF:F6:B1:1A (OUI DF-A9-FF)
        Count: 1
< ACL Data TX: Handle 1389 flags 0x00 dlen 10             #228 [hci1] 14.874547
      ATT: Find Information Response (0x05) len 5
        Format: UUID-16 (0x01)
        Handle: 0x0035
        UUID: Client Characteristic Configuration (0x2902)
> HCI Event: Number of Completed Packets (0x13) plen 5    #229 [hci1] 15.041784
        Num handles: 1
        Handle: 1389 Address: DF:A9:FF:F6:B1:1A (OUI DF-A9-FF)
        Count: 1
        #228: len 10 (0 Kb/s)
        Latency: 167 msec (71-172 msec ~166 msec)
> ACL Data RX: Handle 1389 flags 0x02 dlen 11             #230 [hci1] 15.041987
      ATT: Read By Type Request (0x08) len 6
        Handle range: 0x0036-0x0041
        Attribute type: Characteristic (0x2803)
< HCI Command: Host Number of Com.. (0x03|0x0035) plen 5  #231 [hci1] 15.055121
        Num handles: 1
        Handle: 1389 Address: DF:A9:FF:F6:B1:1A (OUI DF-A9-FF)
        Count: 1
< ACL Data TX: Handle 1389 flags 0x00 dlen 20             #232 [hci1] 15.055201
      ATT: Read By Type Response (0x09) len 15
        Attribute data length: 7
        Attribute data list: 2 entries
        Handle: 0x0037
        Value: 123800802b
            Properties: 0x12
              Read (0x02)
              Notify (0x10)
            Value Handle: 0x0038
            Value UUID: Offset State (0x2b80)
        Handle: 0x003a
        Value: 163b00812b
            Properties: 0x16
              Read (0x02)
              Write Without Response (0x04)
              Notify (0x10)
            Value Handle: 0x003b
            Value UUID: Audio Location (0x2b81)
> HCI Event: Number of Completed Packets (0x13) plen 5    #233 [hci1] 15.216766
        Num handles: 1
        Handle: 1389 Address: DF:A9:FF:F6:B1:1A (OUI DF-A9-FF)
        Count: 1
        #232: len 20 (0 Kb/s)
        Latency: 161 msec (71-172 msec ~164 msec)
> ACL Data RX: Handle 1389 flags 0x02 dlen 11             #234 [hci1] 15.216976
      ATT: Read By Type Request (0x08) len 6
        Handle range: 0x003b-0x0041
        Attribute type: Characteristic (0x2803)
< HCI Command: Host Number of Com.. (0x03|0x0035) plen 5  #235 [hci1] 15.234739
        Num handles: 1
        Handle: 1389 Address: DF:A9:FF:F6:B1:1A (OUI DF-A9-FF)
        Count: 1
< ACL Data TX: Handle 1389 flags 0x00 dlen 20             #236 [hci1] 15.234790
      ATT: Read By Type Response (0x09) len 15
        Attribute data length: 7
        Attribute data list: 2 entries
        Handle: 0x003d
        Value: 083e00822b
            Properties: 0x08
              Write (0x08)
            Value Handle: 0x003e
            Value UUID: Volume Offset Control Point (0x2b82)
        Handle: 0x003f
        Value: 164000832b
            Properties: 0x16
              Read (0x02)
              Write Without Response (0x04)
              Notify (0x10)
            Value Handle: 0x0040
            Value UUID: Audio Output Description (0x2b83)
> HCI Event: Number of Completed Packets (0x13) plen 5    #237 [hci1] 15.391974
        Num handles: 1
        Handle: 1389 Address: DF:A9:FF:F6:B1:1A (OUI DF-A9-FF)
        Count: 1
        #236: len 20 (1 Kb/s)
        Latency: 157 msec (71-172 msec ~160 msec)
> ACL Data RX: Handle 1389 flags 0x02 dlen 11             #238 [hci1] 15.391976
      ATT: Read By Type Request (0x08) len 6
        Handle range: 0x0040-0x0041
        Attribute type: Characteristic (0x2803)
< HCI Command: Host Number of Com.. (0x03|0x0035) plen 5  #239 [hci1] 15.394569
        Num handles: 1
        Handle: 1389 Address: DF:A9:FF:F6:B1:1A (OUI DF-A9-FF)
        Count: 1
< ACL Data TX: Handle 1389 flags 0x00 dlen 9              #240 [hci1] 15.394667
      ATT: Error Response (0x01) len 4
        Read By Type Request (0x08)
        Handle: 0x0040
        Error: Attribute Not Found (0x0a)
> HCI Event: Number of Completed Packets (0x13) plen 5    #241 [hci1] 15.566758
        Num handles: 1
        Handle: 1389 Address: DF:A9:FF:F6:B1:1A (OUI DF-A9-FF)
        Count: 1
        #240: len 9 (0 Kb/s)
        Latency: 172 msec (71-172 msec ~166 msec)
> ACL Data RX: Handle 1389 flags 0x02 dlen 9              #242 [hci1] 15.566988
      ATT: Find Information Request (0x04) len 4
        Handle range: 0x0039-0x0039
< HCI Command: Host Number of Com.. (0x03|0x0035) plen 5  #243 [hci1] 15.574940
        Num handles: 1
        Handle: 1389 Address: DF:A9:FF:F6:B1:1A (OUI DF-A9-FF)
        Count: 1
< ACL Data TX: Handle 1389 flags 0x00 dlen 10             #244 [hci1] 15.575071
      ATT: Find Information Response (0x05) len 5
        Format: UUID-16 (0x01)
        Handle: 0x0039
        UUID: Client Characteristic Configuration (0x2902)
> HCI Event: Number of Completed Packets (0x13) plen 5    #245 [hci1] 15.741731
        Num handles: 1
        Handle: 1389 Address: DF:A9:FF:F6:B1:1A (OUI DF-A9-FF)
        Count: 1
        #244: len 10 (0 Kb/s)
        Latency: 166 msec (71-172 msec ~166 msec)
> ACL Data RX: Handle 1389 flags 0x02 dlen 9              #246 [hci1] 15.741995
      ATT: Find Information Request (0x04) len 4
        Handle range: 0x003c-0x003c
< HCI Command: Host Number of Com.. (0x03|0x0035) plen 5  #247 [hci1] 15.754949
        Num handles: 1
        Handle: 1389 Address: DF:A9:FF:F6:B1:1A (OUI DF-A9-FF)
        Count: 1
< ACL Data TX: Handle 1389 flags 0x00 dlen 10             #248 [hci1] 15.755024
      ATT: Find Information Response (0x05) len 5
        Format: UUID-16 (0x01)
        Handle: 0x003c
        UUID: Client Characteristic Configuration (0x2902)
> HCI Event: Number of Completed Packets (0x13) plen 5    #249 [hci1] 15.916814
        Num handles: 1
        Handle: 1389 Address: DF:A9:FF:F6:B1:1A (OUI DF-A9-FF)
        Count: 1
        #248: len 10 (0 Kb/s)
        Latency: 161 msec (71-172 msec ~164 msec)
> ACL Data RX: Handle 1389 flags 0x02 dlen 9              #250 [hci1] 15.916970
      ATT: Find Information Request (0x04) len 4
        Handle range: 0x0041-0x0041
< HCI Command: Host Number of Com.. (0x03|0x0035) plen 5  #251 [hci1] 15.934921
        Num handles: 1
        Handle: 1389 Address: DF:A9:FF:F6:B1:1A (OUI DF-A9-FF)
        Count: 1
< ACL Data TX: Handle 1389 flags 0x00 dlen 10             #252 [hci1] 15.935012
      ATT: Find Information Response (0x05) len 5
        Format: UUID-16 (0x01)
        Handle: 0x0041
        UUID: Client Characteristic Configuration (0x2902)
> HCI Event: Number of Completed Packets (0x13) plen 5    #253 [hci1] 16.091850
        Num handles: 1
        Handle: 1389 Address: DF:A9:FF:F6:B1:1A (OUI DF-A9-FF)
        Count: 1
        #252: len 10 (0 Kb/s)
        Latency: 156 msec (71-172 msec ~160 msec)
> ACL Data RX: Handle 1389 flags 0x02 dlen 11             #254 [hci1] 16.092042
      ATT: Read By Type Request (0x08) len 6
        Handle range: 0x0042-0x0051
        Attribute type: Characteristic (0x2803)
< HCI Command: Host Number of Com.. (0x03|0x0035) plen 5  #255 [hci1] 16.094977
        Num handles: 1
        Handle: 1389 Address: DF:A9:FF:F6:B1:1A (OUI DF-A9-FF)
        Count: 1
< ACL Data TX: Handle 1389 flags 0x00 dlen 20             #256 [hci1] 16.095002
      ATT: Read By Type Response (0x09) len 15
        Attribute data length: 7
        Attribute data list: 2 entries
        Handle: 0x0043
        Value: 124400772b
            Properties: 0x12
              Read (0x02)
              Notify (0x10)
            Value Handle: 0x0044
            Value UUID: Audio Input State (0x2b77)
        Handle: 0x0046
        Value: 024700782b
            Properties: 0x02
              Read (0x02)
            Value Handle: 0x0047
            Value UUID: Gain Settings Attribute (0x2b78)
> HCI Event: Number of Completed Packets (0x13) plen 5    #257 [hci1] 16.266756
        Num handles: 1
        Handle: 1389 Address: DF:A9:FF:F6:B1:1A (OUI DF-A9-FF)
        Count: 1
        #256: len 20 (0 Kb/s)
        Latency: 171 msec (71-172 msec ~166 msec)
> ACL Data RX: Handle 1389 flags 0x02 dlen 11             #258 [hci1] 16.266979
      ATT: Read By Type Request (0x08) len 6
        Handle range: 0x0047-0x0051
        Attribute type: Characteristic (0x2803)
< HCI Command: Host Number of Com.. (0x03|0x0035) plen 5  #259 [hci1] 16.274618
        Num handles: 1
        Handle: 1389 Address: DF:A9:FF:F6:B1:1A (OUI DF-A9-FF)
        Count: 1
< ACL Data TX: Handle 1389 flags 0x00 dlen 20             #260 [hci1] 16.274702
      ATT: Read By Type Response (0x09) len 15
        Attribute data length: 7
        Attribute data list: 2 entries
        Handle: 0x0048
        Value: 024900792b
            Properties: 0x02
              Read (0x02)
            Value Handle: 0x0049
            Value UUID: Audio Input Type (0x2b79)
        Handle: 0x004a
        Value: 124b007a2b
            Properties: 0x12
              Read (0x02)
              Notify (0x10)
            Value Handle: 0x004b
            Value UUID: Audio Input Status (0x2b7a)
> HCI Event: Number of Completed Packets (0x13) plen 5    #261 [hci1] 16.441735
        Num handles: 1
        Handle: 1389 Address: DF:A9:FF:F6:B1:1A (OUI DF-A9-FF)
        Count: 1
        #260: len 20 (0 Kb/s)
        Latency: 167 msec (71-172 msec ~166 msec)
> ACL Data RX: Handle 1389 flags 0x02 dlen 11             #262 [hci1] 16.441975
      ATT: Read By Type Request (0x08) len 6
        Handle range: 0x004b-0x0051
        Attribute type: Characteristic (0x2803)
< HCI Command: Host Number of Com.. (0x03|0x0035) plen 5  #263 [hci1] 16.455026
        Num handles: 1
        Handle: 1389 Address: DF:A9:FF:F6:B1:1A (OUI DF-A9-FF)
        Count: 1
< ACL Data TX: Handle 1389 flags 0x00 dlen 20             #264 [hci1] 16.455198
      ATT: Read By Type Response (0x09) len 15
        Attribute data length: 7
        Attribute data list: 2 entries
        Handle: 0x004d
        Value: 084e007b2b
            Properties: 0x08
              Write (0x08)
            Value Handle: 0x004e
            Value UUID: Audio Input Control Point (0x2b7b)
        Handle: 0x004f
        Value: 1650007c2b
            Properties: 0x16
              Read (0x02)
              Write Without Response (0x04)
              Notify (0x10)
            Value Handle: 0x0050
            Value UUID: Audio Input Description (0x2b7c)
> HCI Event: Number of Completed Packets (0x13) plen 5    #265 [hci1] 16.616713
        Num handles: 1
        Handle: 1389 Address: DF:A9:FF:F6:B1:1A (OUI DF-A9-FF)
        Count: 1
        #264: len 20 (0 Kb/s)
        Latency: 161 msec (71-172 msec ~164 msec)
> ACL Data RX: Handle 1389 flags 0x02 dlen 11             #266 [hci1] 16.616975
      ATT: Read By Type Request (0x08) len 6
        Handle range: 0x0050-0x0051
        Attribute type: Characteristic (0x2803)
< HCI Command: Host Number of Com.. (0x03|0x0035) plen 5  #267 [hci1] 16.635017
        Num handles: 1
        Handle: 1389 Address: DF:A9:FF:F6:B1:1A (OUI DF-A9-FF)
        Count: 1
< ACL Data TX: Handle 1389 flags 0x00 dlen 9              #268 [hci1] 16.635247
      ATT: Error Response (0x01) len 4
        Read By Type Request (0x08)
        Handle: 0x0050
        Error: Attribute Not Found (0x0a)
> HCI Event: Number of Completed Packets (0x13) plen 5    #269 [hci1] 16.791738
        Num handles: 1
        Handle: 1389 Address: DF:A9:FF:F6:B1:1A (OUI DF-A9-FF)
        Count: 1
        #268: len 9 (0 Kb/s)
        Latency: 156 msec (71-172 msec ~160 msec)
> ACL Data RX: Handle 1389 flags 0x02 dlen 9              #270 [hci1] 16.791968
      ATT: Find Information Request (0x04) len 4
        Handle range: 0x0045-0x0045
< HCI Command: Host Number of Com.. (0x03|0x0035) plen 5  #271 [hci1] 16.794697
        Num handles: 1
        Handle: 1389 Address: DF:A9:FF:F6:B1:1A (OUI DF-A9-FF)
        Count: 1
< ACL Data TX: Handle 1389 flags 0x00 dlen 10             #272 [hci1] 16.794742
      ATT: Find Information Response (0x05) len 5
        Format: UUID-16 (0x01)
        Handle: 0x0045
        UUID: Client Characteristic Configuration (0x2902)
> HCI Event: Number of Completed Packets (0x13) plen 5    #273 [hci1] 16.966721
        Num handles: 1
        Handle: 1389 Address: DF:A9:FF:F6:B1:1A (OUI DF-A9-FF)
        Count: 1
        #272: len 10 (0 Kb/s)
        Latency: 171 msec (71-172 msec ~166 msec)
> ACL Data RX: Handle 1389 flags 0x02 dlen 9              #274 [hci1] 16.966985
      ATT: Find Information Request (0x04) len 4
        Handle range: 0x004c-0x004c
< HCI Command: Host Number of Com.. (0x03|0x0035) plen 5  #275 [hci1] 16.974777
        Num handles: 1
        Handle: 1389 Address: DF:A9:FF:F6:B1:1A (OUI DF-A9-FF)
        Count: 1
< ACL Data TX: Handle 1389 flags 0x00 dlen 10             #276 [hci1] 16.974825
      ATT: Find Information Response (0x05) len 5
        Format: UUID-16 (0x01)
        Handle: 0x004c
        UUID: Client Characteristic Configuration (0x2902)
> HCI Event: Number of Completed Packets (0x13) plen 5    #277 [hci1] 17.141730
        Num handles: 1
        Handle: 1389 Address: DF:A9:FF:F6:B1:1A (OUI DF-A9-FF)
        Count: 1
        #276: len 10 (0 Kb/s)
        Latency: 166 msec (71-172 msec ~166 msec)
> ACL Data RX: Handle 1389 flags 0x02 dlen 9              #278 [hci1] 17.141930
      ATT: Find Information Request (0x04) len 4
        Handle range: 0x0051-0x0051
< HCI Command: Host Number of Com.. (0x03|0x0035) plen 5  #279 [hci1] 17.154701
        Num handles: 1
        Handle: 1389 Address: DF:A9:FF:F6:B1:1A (OUI DF-A9-FF)
        Count: 1
< ACL Data TX: Handle 1389 flags 0x00 dlen 10             #280 [hci1] 17.154773
      ATT: Find Information Response (0x05) len 5
        Format: UUID-16 (0x01)
        Handle: 0x0051
        UUID: Client Characteristic Configuration (0x2902)
> HCI Event: Number of Completed Packets (0x13) plen 5    #281 [hci1] 17.316679
        Num handles: 1
        Handle: 1389 Address: DF:A9:FF:F6:B1:1A (OUI DF-A9-FF)
        Count: 1
        #280: len 10 (0 Kb/s)
        Latency: 161 msec (71-172 msec ~164 msec)
> ACL Data RX: Handle 1389 flags 0x02 dlen 11             #282 [hci1] 17.316963
      ATT: Read By Type Request (0x08) len 6
        Handle range: 0x0052-0x0061
        Attribute type: Characteristic (0x2803)
< HCI Command: Host Number of Com.. (0x03|0x0035) plen 5  #283 [hci1] 17.334589
        Num handles: 1
        Handle: 1389 Address: DF:A9:FF:F6:B1:1A (OUI DF-A9-FF)
        Count: 1
< ACL Data TX: Handle 1389 flags 0x00 dlen 20             #284 [hci1] 17.334612
      ATT: Read By Type Response (0x09) len 15
        Attribute data length: 7
        Attribute data list: 2 entries
        Handle: 0x0053
        Value: 125400772b
            Properties: 0x12
              Read (0x02)
              Notify (0x10)
            Value Handle: 0x0054
            Value UUID: Audio Input State (0x2b77)
        Handle: 0x0056
        Value: 025700782b
            Properties: 0x02
              Read (0x02)
            Value Handle: 0x0057
            Value UUID: Gain Settings Attribute (0x2b78)
> HCI Event: Number of Completed Packets (0x13) plen 5    #285 [hci1] 17.491721
        Num handles: 1
        Handle: 1389 Address: DF:A9:FF:F6:B1:1A (OUI DF-A9-FF)
        Count: 1
        #284: len 20 (1 Kb/s)
        Latency: 157 msec (71-172 msec ~160 msec)
> ACL Data RX: Handle 1389 flags 0x02 dlen 11             #286 [hci1] 17.491964
      ATT: Read By Type Request (0x08) len 6
        Handle range: 0x0057-0x0061
        Attribute type: Characteristic (0x2803)
< HCI Command: Host Number of Com.. (0x03|0x0035) plen 5  #287 [hci1] 17.496170
        Num handles: 1
        Handle: 1389 Address: DF:A9:FF:F6:B1:1A (OUI DF-A9-FF)
        Count: 1
< ACL Data TX: Handle 1389 flags 0x00 dlen 20             #288 [hci1] 17.496257
      ATT: Read By Type Response (0x09) len 15
        Attribute data length: 7
        Attribute data list: 2 entries
        Handle: 0x0058
        Value: 025900792b
            Properties: 0x02
              Read (0x02)
            Value Handle: 0x0059
            Value UUID: Audio Input Type (0x2b79)
        Handle: 0x005a
        Value: 125b007a2b
            Properties: 0x12
              Read (0x02)
              Notify (0x10)
            Value Handle: 0x005b
            Value UUID: Audio Input Status (0x2b7a)
> HCI Event: Number of Completed Packets (0x13) plen 5    #289 [hci1] 17.666707
        Num handles: 1
        Handle: 1389 Address: DF:A9:FF:F6:B1:1A (OUI DF-A9-FF)
        Count: 1
        #288: len 20 (0 Kb/s)
        Latency: 170 msec (71-172 msec ~165 msec)
> ACL Data RX: Handle 1389 flags 0x02 dlen 11             #290 [hci1] 17.666965
      ATT: Read By Type Request (0x08) len 6
        Handle range: 0x005b-0x0061
        Attribute type: Characteristic (0x2803)
< HCI Command: Host Number of Com.. (0x03|0x0035) plen 5  #291 [hci1] 17.674486
        Num handles: 1
        Handle: 1389 Address: DF:A9:FF:F6:B1:1A (OUI DF-A9-FF)
        Count: 1
< ACL Data TX: Handle 1389 flags 0x00 dlen 20             #292 [hci1] 17.674633
      ATT: Read By Type Response (0x09) len 15
        Attribute data length: 7
        Attribute data list: 2 entries
        Handle: 0x005d
        Value: 085e007b2b
            Properties: 0x08
              Write (0x08)
            Value Handle: 0x005e
            Value UUID: Audio Input Control Point (0x2b7b)
        Handle: 0x005f
        Value: 1660007c2b
            Properties: 0x16
              Read (0x02)
              Write Without Response (0x04)
              Notify (0x10)
            Value Handle: 0x0060
            Value UUID: Audio Input Description (0x2b7c)
> HCI Event: Number of Completed Packets (0x13) plen 5    #293 [hci1] 17.841744
        Num handles: 1
        Handle: 1389 Address: DF:A9:FF:F6:B1:1A (OUI DF-A9-FF)
        Count: 1
        #292: len 20 (0 Kb/s)
        Latency: 167 msec (71-172 msec ~166 msec)
> ACL Data RX: Handle 1389 flags 0x02 dlen 11             #294 [hci1] 17.841951
      ATT: Read By Type Request (0x08) len 6
        Handle range: 0x0060-0x0061
        Attribute type: Characteristic (0x2803)
< HCI Command: Host Number of Com.. (0x03|0x0035) plen 5  #295 [hci1] 17.854610
        Num handles: 1
        Handle: 1389 Address: DF:A9:FF:F6:B1:1A (OUI DF-A9-FF)
        Count: 1
< ACL Data TX: Handle 1389 flags 0x00 dlen 9              #296 [hci1] 17.854708
      ATT: Error Response (0x01) len 4
        Read By Type Request (0x08)
        Handle: 0x0060
        Error: Attribute Not Found (0x0a)
> HCI Event: Number of Completed Packets (0x13) plen 5    #297 [hci1] 18.016751
        Num handles: 1
        Handle: 1389 Address: DF:A9:FF:F6:B1:1A (OUI DF-A9-FF)
        Count: 1
        #296: len 9 (0 Kb/s)
        Latency: 162 msec (71-172 msec ~164 msec)
> ACL Data RX: Handle 1389 flags 0x02 dlen 9              #298 [hci1] 18.017016
      ATT: Find Information Request (0x04) len 4
        Handle range: 0x0055-0x0055
< HCI Command: Host Number of Com.. (0x03|0x0035) plen 5  #299 [hci1] 18.034847
        Num handles: 1
        Handle: 1389 Address: DF:A9:FF:F6:B1:1A (OUI DF-A9-FF)
        Count: 1
< ACL Data TX: Handle 1389 flags 0x00 dlen 10             #300 [hci1] 18.034909
      ATT: Find Information Response (0x05) len 5
        Format: UUID-16 (0x01)
        Handle: 0x0055
        UUID: Client Characteristic Configuration (0x2902)
> HCI Event: Number of Completed Packets (0x13) plen 5    #301 [hci1] 18.191717
        Num handles: 1
        Handle: 1389 Address: DF:A9:FF:F6:B1:1A (OUI DF-A9-FF)
        Count: 1
        #300: len 10 (0 Kb/s)
        Latency: 156 msec (71-172 msec ~160 msec)
> ACL Data RX: Handle 1389 flags 0x02 dlen 9              #302 [hci1] 18.191975
      ATT: Find Information Request (0x04) len 4
        Handle range: 0x005c-0x005c
< HCI Command: Host Number of Com.. (0x03|0x0035) plen 5  #303 [hci1] 18.194707
        Num handles: 1
        Handle: 1389 Address: DF:A9:FF:F6:B1:1A (OUI DF-A9-FF)
        Count: 1
< ACL Data TX: Handle 1389 flags 0x00 dlen 10             #304 [hci1] 18.194744
      ATT: Find Information Response (0x05) len 5
        Format: UUID-16 (0x01)
        Handle: 0x005c
        UUID: Client Characteristic Configuration (0x2902)
> HCI Event: Number of Completed Packets (0x13) plen 5    #305 [hci1] 18.366663
        Num handles: 1
        Handle: 1389 Address: DF:A9:FF:F6:B1:1A (OUI DF-A9-FF)
        Count: 1
        #304: len 10 (0 Kb/s)
        Latency: 171 msec (71-172 msec ~166 msec)
> ACL Data RX: Handle 1389 flags 0x02 dlen 9              #306 [hci1] 18.366912
      ATT: Find Information Request (0x04) len 4
        Handle range: 0x0061-0x0061
< HCI Command: Host Number of Com.. (0x03|0x0035) plen 5  #307 [hci1] 18.374608
        Num handles: 1
        Handle: 1389 Address: DF:A9:FF:F6:B1:1A (OUI DF-A9-FF)
        Count: 1
< ACL Data TX: Handle 1389 flags 0x00 dlen 10             #308 [hci1] 18.374705
      ATT: Find Information Response (0x05) len 5
        Format: UUID-16 (0x01)
        Handle: 0x0061
        UUID: Client Characteristic Configuration (0x2902)
> HCI Event: Number of Completed Packets (0x13) plen 5    #309 [hci1] 18.541717
        Num handles: 1
        Handle: 1389 Address: DF:A9:FF:F6:B1:1A (OUI DF-A9-FF)
        Count: 1
        #308: len 10 (0 Kb/s)
        Latency: 167 msec (71-172 msec ~166 msec)
> ACL Data RX: Handle 1389 flags 0x02 dlen 9              #310 [hci1] 18.542041
      ATT: Write Request (0x12) len 4
        Handle: 0x0069 Type: Client Characteristic Configuration (0x2902)
        Value Handle: 0x006d Type: Volume Flags (0x2b7f)
          Data: 0000
< HCI Command: Host Number of Com.. (0x03|0x0035) plen 5  #311 [hci1] 18.555014
        Num handles: 1
        Handle: 1389 Address: DF:A9:FF:F6:B1:1A (OUI DF-A9-FF)
        Count: 1
< ACL Data TX: Handle 1389 flags 0x00 dlen 5              #312 [hci1] 18.555080
      ATT: Write Response (0x13) len 0
> HCI Event: Number of Completed Packets (0x13) plen 5    #313 [hci1] 18.716737
        Num handles: 1
        Handle: 1389 Address: DF:A9:FF:F6:B1:1A (OUI DF-A9-FF)
        Count: 1
        #312: len 5 (0 Kb/s)
        Latency: 161 msec (71-172 msec ~164 msec)
> ACL Data RX: Handle 1389 flags 0x02 dlen 9              #314 [hci1] 18.716997
      ATT: Write Request (0x12) len 4
        Handle: 0x0069 Type: Client Characteristic Configuration (0x2902)
        Value Handle: 0x006d Type: Volume Flags (0x2b7f)
          Data: 0100
            Notification (0x01)
< HCI Command: Host Number of Com.. (0x03|0x0035) plen 5  #315 [hci1] 18.734676
        Num handles: 1
        Handle: 1389 Address: DF:A9:FF:F6:B1:1A (OUI DF-A9-FF)
        Count: 1
< ACL Data TX: Handle 1389 flags 0x00 dlen 5              #316 [hci1] 18.734742
      ATT: Write Response (0x13) len 0
> HCI Event: Number of Completed Packets (0x13) plen 5    #317 [hci1] 18.891718
        Num handles: 1
        Handle: 1389 Address: DF:A9:FF:F6:B1:1A (OUI DF-A9-FF)
        Count: 1
        #316: len 5 (0 Kb/s)
        Latency: 156 msec (71-172 msec ~160 msec)
> ACL Data RX: Handle 1389 flags 0x02 dlen 9              #318 [hci1] 18.891905
      ATT: Write Request (0x12) len 4
        Handle: 0x006e Type: Client Characteristic Configuration (0x2902)
        Value Handle: 0x006d Type: Volume Flags (0x2b7f)
          Data: 0000
< HCI Command: Host Number of Com.. (0x03|0x0035) plen 5  #319 [hci1] 18.894550
        Num handles: 1
        Handle: 1389 Address: DF:A9:FF:F6:B1:1A (OUI DF-A9-FF)
        Count: 1
< ACL Data TX: Handle 1389 flags 0x00 dlen 5              #320 [hci1] 18.894629
      ATT: Write Response (0x13) len 0
> HCI Event: Number of Completed Packets (0x13) plen 5    #321 [hci1] 19.066780
        Num handles: 1
        Handle: 1389 Address: DF:A9:FF:F6:B1:1A (OUI DF-A9-FF)
        Count: 1
        #320: len 5 (0 Kb/s)
        Latency: 172 msec (71-172 msec ~166 msec)
> ACL Data RX: Handle 1389 flags 0x02 dlen 9              #322 [hci1] 19.066855
      ATT: Write Request (0x12) len 4
        Handle: 0x006e Type: Client Characteristic Configuration (0x2902)
        Value Handle: 0x006d Type: Volume Flags (0x2b7f)
          Data: 0100
            Notification (0x01)
< HCI Command: Host Number of Com.. (0x03|0x0035) plen 5  #323 [hci1] 19.074691
        Num handles: 1
        Handle: 1389 Address: DF:A9:FF:F6:B1:1A (OUI DF-A9-FF)
        Count: 1
< ACL Data TX: Handle 1389 flags 0x00 dlen 5              #324 [hci1] 19.074759
      ATT: Write Response (0x13) len 0
> HCI Event: Number of Completed Packets (0x13) plen 5    #325 [hci1] 19.241670
        Num handles: 1
        Handle: 1389 Address: DF:A9:FF:F6:B1:1A (OUI DF-A9-FF)
        Count: 1
        #324: len 5 (0 Kb/s)
        Latency: 166 msec (71-172 msec ~166 msec)
> ACL Data RX: Handle 1389 flags 0x02 dlen 7              #326 [hci1] 19.241847
      ATT: Read Request (0x0a) len 2
        Handle: 0x0068 Type: Volume State (0x2b7d)
< HCI Command: Host Number of Com.. (0x03|0x0035) plen 5  #327 [hci1] 19.254743
        Num handles: 1
        Handle: 1389 Address: DF:A9:FF:F6:B1:1A (OUI DF-A9-FF)
        Count: 1
< ACL Data TX: Handle 1389 flags 0x00 dlen 8              #328 [hci1] 19.254780
      ATT: Read Response (0x0b) len 3
        Handle: 0x0068 Type: Volume State (0x2b7d)
        Value: fd0000
            Volume Setting: 253
            Not Muted: 0
            Change Counter: 0
> HCI Event: Number of Completed Packets (0x13) plen 5    #329 [hci1] 19.416717
        Num handles: 1
        Handle: 1389 Address: DF:A9:FF:F6:B1:1A (OUI DF-A9-FF)
        Count: 1
        #328: len 8 (0 Kb/s)
        Latency: 161 msec (71-172 msec ~164 msec)
> ACL Data RX: Handle 1389 flags 0x02 dlen 7              #330 [hci1] 19.416892
      ATT: Read Request (0x0a) len 2
        Handle: 0x006d Type: Volume Flags (0x2b7f)
< HCI Command: Host Number of Com.. (0x03|0x0035) plen 5  #331 [hci1] 19.434633
        Num handles: 1
        Handle: 1389 Address: DF:A9:FF:F6:B1:1A (OUI DF-A9-FF)
        Count: 1
< ACL Data TX: Handle 1389 flags 0x00 dlen 6              #332 [hci1] 19.434651
      ATT: Read Response (0x0b) len 1
        Handle: 0x006d Type: Volume Flags (0x2b7f)
        Value: 00
            Volume Flag: 0
> HCI Event: Number of Completed Packets (0x13) plen 5    #333 [hci1] 19.591770
        Num handles: 1
        Handle: 1389 Address: DF:A9:FF:F6:B1:1A (OUI DF-A9-FF)
        Count: 1
        #332: len 6 (0 Kb/s)
        Latency: 157 msec (71-172 msec ~160 msec)
> ACL Data RX: Handle 1389 flags 0x02 dlen 9              #334 [hci1] 19.591966
      ATT: Write Request (0x12) len 4
        Handle: 0x006b Type: Volume Control Point (0x2b7e)
          Data: 0100
            Opcode: Relative Volume Up (0x01)
            Change Counter: 0x00
< HCI Command: Host Number of Com.. (0x03|0x0035) plen 5  #335 [hci1] 19.598866
        Num handles: 1
        Handle: 1389 Address: DF:A9:FF:F6:B1:1A (OUI DF-A9-FF)
        Count: 1
< ACL Data TX: Handle 1389 flags 0x00 dlen 5              #336 [hci1] 19.599295
      ATT: Write Response (0x13) len 0
< ACL Data TX: Handle 1389 flags 0x00 dlen 10             #337 [hci1] 19.599560
      ATT: Handle Value Notification (0x1b) len 5
        Handle: 0x0068 Type: Volume State (0x2b7d)
          Data: fe0001
            Volume Setting: 254
            Not Muted: 0
            Change Counter: 1
< ACL Data TX: Handle 1389 flags 0x00 dlen 8              #338 [hci1] 19.599767
      ATT: Handle Value Notification (0x1b) len 3
        Handle: 0x006d Type: Volume Flags (0x2b7f)
          Data: 01
            Volume Flag: 1
> HCI Event: Number of Completed Packets (0x13) plen 5    #339 [hci1] 19.679573
        Num handles: 1
        Handle: 1389 Address: DF:A9:FF:F6:B1:1A (OUI DF-A9-FF)
        Count: 1
        #336: len 5 (0 Kb/s)
        Latency: 80 msec (71-172 msec ~120 msec)
> HCI Event: Number of Completed Packets (0x13) plen 5    #340 [hci1] 19.680169
        Num handles: 1
        Handle: 1389 Address: DF:A9:FF:F6:B1:1A (OUI DF-A9-FF)
        Count: 1
        #337: len 10 (1 Kb/s)
        Latency: 80 msec (71-172 msec ~100 msec)
> HCI Event: Number of Completed Packets (0x13) plen 5    #341 [hci1] 19.766689
        Num handles: 1
        Handle: 1389 Address: DF:A9:FF:F6:B1:1A (OUI DF-A9-FF)
        Count: 1
        #338: len 8 (0 Kb/s)
        Latency: 166 msec (71-172 msec ~133 msec)
> ACL Data RX: Handle 1389 flags 0x02 dlen 9              #342 [hci1] 19.767007
      ATT: Write Request (0x12) len 4
        Handle: 0x006b Type: Volume Control Point (0x2b7e)
          Data: 0101
            Opcode: Relative Volume Up (0x01)
            Change Counter: 0x01
< HCI Command: Host Number of Com.. (0x03|0x0035) plen 5  #343 [hci1] 19.774688
        Num handles: 1
        Handle: 1389 Address: DF:A9:FF:F6:B1:1A (OUI DF-A9-FF)
        Count: 1
< ACL Data TX: Handle 1389 flags 0x00 dlen 5              #344 [hci1] 19.774844
      ATT: Write Response (0x13) len 0
< ACL Data TX: Handle 1389 flags 0x00 dlen 10             #345 [hci1] 19.774942
      ATT: Handle Value Notification (0x1b) len 5
        Handle: 0x0068 Type: Volume State (0x2b7d)
          Data: ff0002
            Volume Setting: 255
            Not Muted: 0
            Change Counter: 2
> HCI Event: Number of Completed Packets (0x13) plen 5    #346 [hci1] 19.854521
        Num handles: 1
        Handle: 1389 Address: DF:A9:FF:F6:B1:1A (OUI DF-A9-FF)
        Count: 1
        #344: len 5 (0 Kb/s)
        Latency: 79 msec (71-172 msec ~106 msec)
> HCI Event: Number of Completed Packets (0x13) plen 5    #347 [hci1] 19.941564
        Num handles: 1
        Handle: 1389 Address: DF:A9:FF:F6:B1:1A (OUI DF-A9-FF)
        Count: 1
        #345: len 10 (0 Kb/s)
        Latency: 166 msec (71-172 msec ~136 msec)
> ACL Data RX: Handle 1389 flags 0x02 dlen 9              #348 [hci1] 21.954213
      ATT: Write Request (0x12) len 4
        Handle: 0x006b Type: Volume Control Point (0x2b7e)
          Data: 0102
            Opcode: Relative Volume Up (0x01)
            Change Counter: 0x02
< HCI Command: Host Number of Com.. (0x03|0x0035) plen 5  #349 [hci1] 21.954668
        Num handles: 1
        Handle: 1389 Address: DF:A9:FF:F6:B1:1A (OUI DF-A9-FF)
        Count: 1
< ACL Data TX: Handle 1389 flags 0x00 dlen 5              #350 [hci1] 21.954706
      ATT: Write Response (0x13) len 0
> HCI Event: Number of Completed Packets (0x13) plen 5    #351 [hci1] 22.129060
        Num handles: 1
        Handle: 1389 Address: DF:A9:FF:F6:B1:1A (OUI DF-A9-FF)
        Count: 1
        #350: len 5 (0 Kb/s)
        Latency: 174 msec (71-174 msec ~155 msec)
> HCI Event: Disconnect Complete (0x05) plen 4            #352 [hci1] 28.516760
        Status: Success (0x00)
        Handle: 1389 Address: DF:A9:FF:F6:B1:1A (OUI DF-A9-FF)
        Reason: Remote User Terminated Connection (0x13)
< HCI Command: Reset (0x03|0x0003) plen 0                 #353 [hci1] 34.994795
> HCI Event: Command Complete (0x0e) plen 4               #354 [hci1] 34.995207
      Reset (0x03|0x0003) ncmd 1
        Status: Success (0x00)
@ USER Close: main                                    {0x0001} [hci1] 35.014681
= Close Index: 00:00:00:00:00:00                               [hci1] 35.019159
