Bluetooth monitor ver 5.72
= Note: Linux version 6.14.0-36-generic (x86_64)                       0.865099
= Note: Bluetooth subsystem version 2.22                               0.865101
= New Index: 00:00:00:00:00:00 (Primary,UART,hci1)              [hci1] 0.865102
= New Index: 48:5F:99:8E:E0:64 (Primary,USB,hci0)               [hci0] 0.865102
= Open Index: 00:00:00:00:00:00                                 [hci1] 1.378949
= Index Info: 00:00:00:00:00:00 (Nordic Semiconductor ASA)      [hci1] 1.378963
@ USER Open: main (privileged) version 2.22            {0x0001} [hci1] 1.378972
< HCI Command: Reset (0x03|0x0003) plen 0                    #1 [hci1] 1.380231
> HCI Event: Command Complete (0x0e) plen 4                  #2 [hci1] 1.380793
      Reset (0x03|0x0003) ncmd 1
        Status: Success (0x00)
< HCI Command: Read Local Supported... (0x04|0x0003) plen 0  #3 [hci1] 1.398802
> HCI Event: Command Complete (0x0e) plen 12                 #4 [hci1] 1.399327
      Read Local Supported Features (0x04|0x0003) ncmd 1
        Status: Success (0x00)
        Features: 0x00 0x00 0x00 0x00 0x60 0x00 0x00 0x00
          BR/EDR Not Supported
          LE Supported (Controller)
< HCI Command: Read Local Version In.. (0x04|0x0001) plen 0  #5 [hci1] 1.418420
> HCI Event: Command Complete (0x0e) plen 12                 #6 [hci1] 1.418915
      Read Local Version Information (0x04|0x0001) ncmd 1
        Status: Success (0x00)
        HCI version: Reserved (0x0f) - Revision 12393 (0x3069)
        LMP version: Reserved (0x0f) - Subversion 12393 (0x3069)
        Manufacturer: Nordic Semiconductor ASA (89)
< HCI Command: Read Local Supported... (0x04|0x0002) plen 0  #7 [hci1] 1.438384
> HCI Event: Command Complete (0x0e) plen 68                 #8 [hci1] 1.439461
      Read Local Supported Commands (0x04|0x0002) ncmd 1
        Status: Success (0x00)
        Commands: 119 entries
          Disconnect (Octet 0 - Bit 5)
          Read Remote Version Information (Octet 2 - Bit 7)
          Set Event Mask (Octet 5 - Bit 6)
          Reset (Octet 5 - Bit 7)
          Read Connection Accept Timeout (Octet 7 - Bit 2)
          Write Connection Accept Timeout (Octet 7 - Bit 3)
          Read Transmit Power Level (Octet 10 - Bit 2)
          Set Controller To Host Flow Control (Octet 10 - Bit 5)
          Host Buffer Size (Octet 10 - Bit 6)
          Host Number of Completed Packets (Octet 10 - Bit 7)
          Read Local Version Information (Octet 14 - Bit 3)
          Read Local Supported Features (Octet 14 - Bit 5)
          Read BD ADDR (Octet 15 - Bit 1)
          Read RSSI (Octet 15 - Bit 5)
          Set Event Mask Page 2 (Octet 22 - Bit 2)
          LE Set Event Mask (Octet 25 - Bit 0)
          LE Read Buffer Size (Octet 25 - Bit 1)
          LE Read Local Supported Features (Octet 25 - Bit 2)
          LE Set Random Address (Octet 25 - Bit 4)
          LE Set Advertising Parameters (Octet 25 - Bit 5)
          LE Read Advertising Channel TX Power (Octet 25 - Bit 6)
          LE Set Advertising Data (Octet 25 - Bit 7)
          LE Set Scan Response Data (Octet 26 - Bit 0)
          LE Set Advertise Enable (Octet 26 - Bit 1)
          LE Set Scan Parameters (Octet 26 - Bit 2)
          LE Set Scan Enable (Octet 26 - Bit 3)
          LE Create Connection (Octet 26 - Bit 4)
          LE Create Connection Cancel (Octet 26 - Bit 5)
          LE Read Accept List Size (Octet 26 - Bit 6)
          LE Clear Accept List (Octet 26 - Bit 7)
          LE Add Device To Accept List (Octet 27 - Bit 0)
          LE Remove Device From Accept List (Octet 27 - Bit 1)
          LE Connection Update (Octet 27 - Bit 2)
          LE Set Host Channel Classification (Octet 27 - Bit 3)
          LE Read Channel Map (Octet 27 - Bit 4)
          LE Read Remote Used Features (Octet 27 - Bit 5)
          LE Encrypt (Octet 27 - Bit 6)
          LE Rand (Octet 27 - Bit 7)
          LE Start Encryption (Octet 28 - Bit 0)
          LE Long Term Key Request Reply (Octet 28 - Bit 1)
          LE Long Term Key Request Neg Reply (Octet 28 - Bit 2)
          LE Read Supported States (Octet 28 - Bit 3)
          LE Receiver Test (Octet 28 - Bit 4)
          LE Transmitter Test (Octet 28 - Bit 5)
          LE Test End (Octet 28 - Bit 6)
          Read Authenticated Payload Timeout (Octet 32 - Bit 4)
          Write Authenticated Payload Timeout (Octet 32 - Bit 5)
          LE Set Data Length (Octet 33 - Bit 6)
          LE Read Suggested Default Data Length (Octet 33 - Bit 7)
          LE Write Suggested Default Data Length (Octet 34 - Bit 0)
          LE Add Device To Resolving List (Octet 34 - Bit 3)
          LE Remove Device From Resolving List (Octet 34 - Bit 4)
          LE Clear Resolving List (Octet 34 - Bit 5)
          LE Read Resolving List Size (Octet 34 - Bit 6)
          LE Set Address Resolution Enable (Octet 35 - Bit 1)
          LE Set Resolvable Private Address Timeout (Octet 35 - Bit 2)
          LE Read Maximum Data Length (Octet 35 - Bit 3)
          LE Read PHY (Octet 35 - Bit 4)
          LE Set Default PHY (Octet 35 - Bit 5)
          LE Set PHY (Octet 35 - Bit 6)
          LE Enhanced Receiver Test (Octet 35 - Bit 7)
          LE Enhanced Transmitter Test (Octet 36 - Bit 0)
          LE Set Advertising Set Random Address (Octet 36 - Bit 1)
          LE Set Extended Advertising Parameters (Octet 36 - Bit 2)
          LE Set Extended Advertising Data (Octet 36 - Bit 3)
          LE Set Extended Scan Response Data (Octet 36 - Bit 4)
          LE Set Extended Advertising Enable (Octet 36 - Bit 5)
          LE Read Maximum Advertising Data Length (Octet 36 - Bit 6)
          LE Read Number of Supported Advertising Sets (Octet 36 - Bit 7)
          LE Remove Advertising Set (Octet 37 - Bit 0)
          LE Clear Advertising Sets (Octet 37 - Bit 1)
          LE Set Periodic Advertising Parameters (Octet 37 - Bit 2)
          LE Set Periodic Advertising Data (Octet 37 - Bit 3)
          LE Set Periodic Advertising Enable (Octet 37 - Bit 4)
          LE Set Extended Scan Parameters (Octet 37 - Bit 5)
          LE Set Extended Scan Enable (Octet 37 - Bit 6)
          LE Extended Create Connection (Octet 37 - Bit 7)
          LE Periodic Advertising Create Sync (Octet 38 - Bit 0)
          LE Periodic Advertising Create Sync Cancel (Octet 38 - Bit 1)
          LE Periodic Advertising Terminate Sync (Octet 38 - Bit 2)
          LE Add Device To Periodic Advertiser List (Octet 38 - Bit 3)
          LE Remove Device From Periodic Advertiser List (Octet 38 - Bit 4)
          LE Clear Periodic Advertiser List (Octet 38 - Bit 5)
          LE Read Periodic Advertiser List Size (Octet 38 - Bit 6)
          LE Read Transmit Power (Octet 38 - Bit 7)
          LE Read RF Path Compensation (Octet 39 - Bit 0)
          LE Write RF Path Compensation (Octet 39 - Bit 1)
          LE Set Privacy Mode (Octet 39 - Bit 2)
          LE Periodic Advertising Receive Enable (Octet 40 - Bit 5)
          LE Periodic Advertising Sync Transfer (Octet 40 - Bit 6)
          LE Periodic Advertising Set Info Transfer (Octet 40 - Bit 7)
          LE Periodic Advertising Sync Transfer Parameters (Octet 41 - Bit 0)
          LE Set Default Periodic Advertisng Sync Transfer Parameters (Octet 41 - Bit 1)
          LE Read Buffer v2 (Octet 41 - Bit 5)
          LE Read ISO TX Sync (Octet 41 - Bit 6)
          LE Set Connected Isochronous Group Parameters (Octet 41 - Bit 7)
          LE Set Connected Isochronous Group Parameters Test (Octet 42 - Bit 0)
          LE Create Connected Isochronous Stream (Octet 42 - Bit 1)
          LE Remove Connected Isochronous Group (Octet 42 - Bit 2)
          LE Accept Connected Isochronous Stream Request (Octet 42 - Bit 3)
          LE Reject Connected Isochronous Stream Request (Octet 42 - Bit 4)
          LE Create Broadcast Isochronous Group (Octet 42 - Bit 5)
          LE Create Broadcast Isochronous Group Test (Octet 42 - Bit 6)
          LE Terminate Broadcast Isochronous Group (Octet 42 - Bit 7)
          LE Broadcast Isochronous Group Create Sync (Octet 43 - Bit 0)
          LE Broadcast Isochronous Group Terminate Sync (Octet 43 - Bit 1)
          LE Request Peer SCA (Octet 43 - Bit 2)
          LE Setup Isochronous Data Path (Octet 43 - Bit 3)
          LE Remove Isochronous Data Path (Octet 43 - Bit 4)
          LE Isochronous Transmit Test (Octet 43 - Bit 5)
          LE Isochronous Receive Test (Octet 43 - Bit 6)
          LE Isochronous Read Test Counters (Octet 43 - Bit 7)
          LE Isochronous Read Test Counters (Octet 44 - Bit 0)
          LE Set Host Feature (Octet 44 - Bit 1)
          Octet 44 - Bit 2 
          Octet 45 - Bit 6 
          Octet 46 - Bit 0 
          Octet 46 - Bit 1 
          Octet 46 - Bit 2 
< HCI Command: Host Buffer Size (0x03|0x0033) plen 7         #9 [hci1] 1.458363
        ACL MTU: 255  ACL max packet: 16
        SCO MTU: 0    SCO max packet: 0
> HCI Event: Command Complete (0x0e) plen 4                 #10 [hci1] 1.458916
      Host Buffer Size (0x03|0x0033) ncmd 1
        Status: Success (0x00)
< HCI Command: Set Controller To Ho.. (0x03|0x0031) plen 1  #11 [hci1] 1.478364
        Flow control: ACL Data Packets (0x01)
> HCI Event: Command Complete (0x0e) plen 4                 #12 [hci1] 1.478878
      Set Controller To Host Flow Control (0x03|0x0031) ncmd 1
        Status: Success (0x00)
< HCI Command: LE Read Local Suppor.. (0x08|0x0003) plen 0  #13 [hci1] 1.498349
> HCI Event: Command Complete (0x0e) plen 12                #14 [hci1] 1.498843
      LE Read Local Supported Features (0x08|0x0003) ncmd 1
        Status: Success (0x00)
        Features: 0xfd 0x79 0x00 0xf7 0x30 0x01 0x00 0x00
          LE Encryption
          Extended Reject Indication
          Peripheral-initiated Features Exchange
          LE Ping
          LE Data Packet Length Extension
          LL Privacy
          Extended Scanner Filter Policies
          LE 2M PHY
          LE Coded PHY
          LE Extended Advertising
          LE Periodic Advertising
          Channel Selection Algorithm #2
          Periodic Advertising Sync Transfer - Sender
          Periodic Advertising Sync Transfer - Recipient
          Sleep Clock Accuracy Updates
          Connected Isochronous Stream - Central
          Connected Isochronous Stream - Peripheral
          Isochronous Broadcaster
          Synchronized Receiver
          Periodic Advertising ADI support
          Connection Subrating
          Unknown features (0x0000010000000000)
< HCI Command: LE Set Host Feature (0x08|0x0074) plen 2     #15 [hci1] 1.518368
        Bit Number: 32
          Connected Isochronous Stream (Host Support)
        Bit Value: 1
> HCI Event: Command Complete (0x0e) plen 4                 #16 [hci1] 1.518827
      LE Set Host Feature (0x08|0x0074) ncmd 1
        Status: Success (0x00)
< HCI Command: LE Read Buffer v2 (0x08|0x0060) plen 0       #17 [hci1] 1.538356
> HCI Event: Command Complete (0x0e) plen 10                #18 [hci1] 1.538813
      LE Read Buffer v2 (0x08|0x0060) ncmd 1
        Status: Success (0x00)
        ACL MTU: 27
        ACL max packet: 3
        ISO MTU: 318
        ISO max packet: 3
< HCI Command: LE Read Maximum Adve.. (0x08|0x003a) plen 0  #19 [hci1] 1.558389
> HCI Event: Command Complete (0x0e) plen 6                 #20 [hci1] 1.558915
      LE Read Maximum Advertising Data Length (0x08|0x003a) ncmd 1
        Status: Success (0x00)
        Max length: 1650
< HCI Command: LE Read Supported St.. (0x08|0x001c) plen 0  #21 [hci1] 1.578387
> HCI Event: Command Complete (0x0e) plen 12                #22 [hci1] 1.578914
      LE Read Supported States (0x08|0x001c) ncmd 1
        Status: Success (0x00)
        States: 0x000003ff3e0306ff
          Non-connectable Advertising State
          Scannable Advertising State
          Connectable Advertising State
          High Duty Cycle Directed Advertising State
          Passive Scanning State
          Active Scanning State
          Initiating State
            and Connection State (Central Role)
          Connection State (Peripheral Role)
          Scannable Advertising State
            and Passive Scanning State
          Connectable Advertising State
            and Passive Scanning State
          Non-connectable Advertising State
            and Initiating State
          Scannable Advertising State
            and Initiating State
          Active Scanning State
            and Connection State (Central Role)
          Passive Scanning State
            and Connection State (Peripheral Role)
          Active Scanning State
            and Connection State (Peripheral Role)
          Initiating State
            and Connection State (Central Role)
            and Central Role & Central Role
          Low Duty Cycle Directed Advertising State
          Connectable Advertising State
            and Initiating State
            and Central Role & Peripheral Role
          High Duty Cycle Directed Advertising State
            and Initiating State
            and Central Role & Peripheral Role
          Low Duty Cycle Directed Advertising State
            and Initiating State
            and Central Role & Peripheral Role
          Connectable Advertising State
            and Connection State (Central Role)
            and Central Role & Peripheral Role
          High Duty Cycle Directed Advertising State
            and Connection State (Central Role)
            and Central Role & Peripheral Role
          Low Duty Cycle Directed Advertising State
            and Connection State (Central Role)
            and Central Role & Peripheral Role
          Connectable Advertising State
            and Connection State (Peripheral Role)
            and Central Role & Peripheral Role
          High Duty Cycle Directed Advertising State
            and Connection State (Peripheral Role)
            and Peripheral Role & Peripheral Role
          Low Duty Cycle Directed Advertising State
            and Connection State (Peripheral Role)
            and Peripheral Role & Peripheral Role
          Initiating State
            and Connection State (Peripheral Role)
            and Central Role & Peripheral Role
< HCI Command: LE Read Maximum Data.. (0x08|0x002f) plen 0  #23 [hci1] 1.598389
> HCI Event: Command Complete (0x0e) plen 12                #24 [hci1] 1.598850
      LE Read Maximum Data Length (0x08|0x002f) ncmd 1
        Status: Success (0x00)
        Max TX octets: 251
        Max TX time: 2704
        Max RX octets: 251
        Max RX time: 2704
< HCI Command: LE Write Suggested D.. (0x08|0x0024) plen 4  #25 [hci1] 1.618380
        TX octets: 251
        TX time: 2704
> HCI Event: Command Complete (0x0e) plen 4                 #26 [hci1] 1.618941
      LE Write Suggested Default Data Length (0x08|0x0024) ncmd 1
        Status: Success (0x00)
< HCI Command: LE Read Resolving Li.. (0x08|0x002a) plen 0  #27 [hci1] 1.638370
> HCI Event: Command Complete (0x0e) plen 5                 #28 [hci1] 1.638801
      LE Read Resolving List Size (0x08|0x002a) ncmd 1
        Status: Success (0x00)
        Size: 8
< HCI Command: LE Set Event Mask (0x08|0x0001) plen 8       #29 [hci1] 1.658350
        Mask: 0x000002023f87fa5e
          LE Advertising Report
          LE Connection Update Complete
          LE Read Remote Used Features Complete
          LE Long Term Key Request
          LE Data Length Change
          LE Enhanced Connection Complete
          LE PHY Update Complete
          LE Extended Advertising Report
          LE Periodic Advertising Sync Established
          LE Periodic Advertising Report
          LE Periodic Advertising Sync Lost
          LE Extended Scan Timeout
          LE Extended Advertising Set Terminated
          LE Scan Request Received
          LE Periodic Advertising Sync Transfer Rvc
          LE CIS Established
          LE CIS Request
          LE Create BIG Complete
          LE Terminate BIG Complete
          LE BIG Sync Estabilished Complete
          LE BIG Sync Lost
          LE BIG Info Advertising Report
          Unknown mask (0x0000020000000000)
> HCI Event: Command Complete (0x0e) plen 4                 #30 [hci1] 1.658935
      LE Set Event Mask (0x08|0x0001) ncmd 1
        Status: Success (0x00)
< HCI Command: Set Event Mask (0x03|0x0001) plen 8          #31 [hci1] 1.678371
        Mask: 0x2000800002008890
          Disconnection Complete
          Encryption Change
          Read Remote Version Information Complete
          Hardware Error
          Data Buffer Overflow
          Encryption Key Refresh Complete
          LE Meta
> HCI Event: Command Complete (0x0e) plen 4                 #32 [hci1] 1.678992
      Set Event Mask (0x03|0x0001) ncmd 1
        Status: Success (0x00)
< HCI Command: Read BD ADDR (0x04|0x0009) plen 0            #33 [hci1] 1.698360
> HCI Event: Command Complete (0x0e) plen 10                #34 [hci1] 1.698848
      Read BD ADDR (0x04|0x0009) ncmd 1
        Status: Success (0x00)
        Address: 00:00:00:00:00:00 (OUI 00-00-00)
< HCI Command: LE Set Random Address (0x08|0x0005) plen 6   #35 [hci1] 1.718363
        Address: D5:B6:CC:31:DB:3B (Static)
> HCI Event: Command Complete (0x0e) plen 4                 #36 [hci1] 1.718940
      LE Set Random Address (0x08|0x0005) ncmd 1
        Status: Success (0x00)
< HCI Command: LE Set Extended Adv.. (0x08|0x0036) plen 25  #37 [hci1] 4.198955
        Handle: 0x00
        Properties: 0x0013
          Connectable
          Scannable
          Use legacy advertising PDUs: ADV_IND
        Min advertising interval: 100.000 msec (0x00a0)
        Max advertising interval: 150.000 msec (0x00f0)
        Channel map: 37, 38, 39 (0x07)
        Own address type: Random (0x01)
        Peer address type: Public (0x00)
        Peer address: 00:00:00:00:00:00 (OUI 00-00-00)
        Filter policy: Allow Scan Request from Any, Allow Connect Request from Any (0x00)
        TX power: Host has no preference (0x7f)
        Primary PHY: LE 1M (0x01)
        Secondary max skip: 0x00
        Secondary PHY: LE 1M (0x01)
        SID: 0x00
        Scan request notifications: Disabled (0x00)
> HCI Event: Command Complete (0x0e) plen 5                 #38 [hci1] 4.199906
      LE Set Extended Advertising Parameters (0x08|0x0036) ncmd 1
        Status: Success (0x00)
        TX power (selected): 0 dbm (0x00)
< HCI Command: LE Set Advertising S.. (0x08|0x0035) plen 7  #39 [hci1] 4.218857
        Advertising handle: 0x00
        Advertising random address: D5:B6:CC:31:DB:3B (Static)
> HCI Event: Command Complete (0x0e) plen 4                 #40 [hci1] 4.219445
      LE Set Advertising Set Random Address (0x08|0x0035) ncmd 1
        Status: Success (0x00)
< HCI Command: LE Set Extended Adv.. (0x08|0x0037) plen 22  #41 [hci1] 4.238560
        Handle: 0x00
        Operation: Complete extended advertising data (0x03)
        Fragment preference: Minimize fragmentation (0x01)
        Data length: 0x12
        Flags: 0x06
          LE General Discoverable Mode
          BR/EDR Not Supported
        Name (complete): Tester_F6B11A
> HCI Event: Command Complete (0x0e) plen 4                 #42 [hci1] 4.239257
      LE Set Extended Advertising Data (0x08|0x0037) ncmd 1
        Status: Success (0x00)
< HCI Command: LE Set Extended Scan.. (0x08|0x0038) plen 4  #43 [hci1] 4.258453
        Handle: 0x00
        Operation: Complete scan response data (0x03)
        Fragment preference: Minimize fragmentation (0x01)
        Data length: 0x00
> HCI Event: Command Complete (0x0e) plen 4                 #44 [hci1] 4.258978
      LE Set Extended Scan Response Data (0x08|0x0038) ncmd 1
        Status: Success (0x00)
< HCI Command: LE Set Extended Adve.. (0x08|0x0039) plen 6  #45 [hci1] 4.278366
        Extended advertising: Enabled (0x01)
        Number of sets: 1 (0x01)
        Entry 0
          Handle: 0x00
          Duration: 0 ms (0x00)
          Max ext adv events: 0
> HCI Event: Command Complete (0x0e) plen 4                 #46 [hci1] 4.278860
      LE Set Extended Advertising Enable (0x08|0x0039) ncmd 1
        Status: Success (0x00)
> HCI Event: LE Meta Event (0x3e) plen 31                   #47 [hci1] 4.388939
      LE Enhanced Connection Complete (0x0a)
        Status: Success (0x00)
        Handle: 363
        Role: Peripheral (0x01)
        Peer address type: Public (0x00)
        Peer address: DF:A9:FF:F6:B1:1A (OUI DF-A9-FF)
        Local resolvable private address: 00:00:00:00:00:00 (Non-Resolvable)
        Peer resolvable private address: 00:00:00:00:00:00 (Non-Resolvable)
        Connection interval: 87.50 msec (0x0046)
        Connection latency: 0 (0x0000)
        Supervision timeout: 25120 msec (0x09d0)
        Central clock accuracy: 0x01
> HCI Event: LE Meta Event (0x3e) plen 6                    #48 [hci1] 4.389056
      LE Advertising Set Terminated (0x12)
        Status: Success (0x00)
        Handle: 0
        Connection handle: 363
        Number of completed extended advertising events: 0
< HCI Command: LE Read Remote Used... (0x08|0x0016) plen 2  #49 [hci1] 4.399396
        Handle: 363 Address: DF:A9:FF:F6:B1:1A (OUI DF-A9-FF)
< ACL Data TX: Handle 363 flags 0x00 dlen 7                 #50 [hci1] 4.399419
      ATT: Exchange MTU Request (0x02) len 2
        Client RX MTU: 251
> HCI Event: Command Status (0x0f) plen 4                   #51 [hci1] 4.399999
      LE Read Remote Used Features (0x08|0x0016) ncmd 1
        Status: Success (0x00)
> HCI Event: Number of Completed Packets (0x13) plen 5      #52 [hci1] 4.564801
        Num handles: 1
        Handle: 363 Address: DF:A9:FF:F6:B1:1A (OUI DF-A9-FF)
        Count: 1
        #50: len 7 (0 Kb/s)
        Latency: 165 msec (165-165 msec ~165 msec)
> HCI Event: LE Meta Event (0x3e) plen 12                   #53 [hci1] 4.652751
      LE Read Remote Used Features (0x04)
        Status: Success (0x00)
        Handle: 363 Address: DF:A9:FF:F6:B1:1A (OUI DF-A9-FF)
        Features: 0x2d 0x49 0x00 0xf7 0x67 0xd8 0x00 0x00
          LE Encryption
          Extended Reject Indication
          Peripheral-initiated Features Exchange
          LE Data Packet Length Extension
          LE 2M PHY
          LE Coded PHY
          Channel Selection Algorithm #2
          Periodic Advertising Sync Transfer - Sender
          Periodic Advertising Sync Transfer - Recipient
          Sleep Clock Accuracy Updates
          Connected Isochronous Stream - Central
          Connected Isochronous Stream - Peripheral
          Isochronous Broadcaster
          Synchronized Receiver
          Connected Isochronous Stream (Host Support)
          LE Power Control Request
          LE Power Control Request
          Connection Subrating
          Connection Subrating (Host Support)
          Unknown features (0x0000d80000000000)
> ACL Data RX: Handle 363 flags 0x02 dlen 11                #54 [hci1] 7.102510
      SMP: Pairing Request (0x01) len 6
        IO capability: KeyboardDisplay (0x04)
        OOB data: Authentication data not present (0x00)
        Authentication requirement: Bonding, MITM, SC, No Keypresses (0x0d)
        Max encryption key size: 16
        Initiator key distribution: EncKey IdKey (0x03)
        Responder key distribution: EncKey IdKey Sign (0x07)
> ACL Data RX: Handle 363 flags 0x02 dlen 7                 #55 [hci1] 7.102878
      ATT: Exchange MTU Response (0x03) len 2
        Server RX MTU: 23
< HCI Command: Host Number of Compl.. (0x03|0x0035) plen 5  #56 [hci1] 7.119048
        Num handles: 1
        Handle: 363 Address: DF:A9:FF:F6:B1:1A (OUI DF-A9-FF)
        Count: 1
< ACL Data TX: Handle 363 flags 0x00 dlen 11                #57 [hci1] 7.119279
      SMP: Pairing Response (0x02) len 6
        IO capability: DisplayOnly (0x00)
        OOB data: Authentication data not present (0x00)
        Authentication requirement: Bonding, No MITM, SC, No Keypresses (0x09)
        Max encryption key size: 16
        Initiator key distribution: IdKey (0x02)
        Responder key distribution: <none> (0x00)
< HCI Command: Host Number of Compl.. (0x03|0x0035) plen 5  #58 [hci1] 7.119381
        Num handles: 1
        Handle: 363 Address: DF:A9:FF:F6:B1:1A (OUI DF-A9-FF)
        Count: 1
> HCI Event: Number of Completed Packets (0x13) plen 5      #59 [hci1] 7.277580
        Num handles: 1
        Handle: 363 Address: DF:A9:FF:F6:B1:1A (OUI DF-A9-FF)
        Count: 1
        #57: len 11 (0 Kb/s)
        Latency: 158 msec (158-165 msec ~161 msec)
> ACL Data RX: Handle 363 flags 0x02 dlen 27                #60 [hci1] 7.277884
> ACL Data RX: Handle 363 flags 0x01 dlen 27                #61 [hci1] 7.278327
> ACL Data RX: Handle 363 flags 0x01 dlen 15                #62 [hci1] 7.278826
      SMP: Pairing Public Key (0x0c) len 64
        X: 301f9845b6526627b48ed5c49e55f5b47c8423e12348dc935ae956084e47545b
        Y: b3ea82b83925da0b635f75ffd373f0598b1ec24feda8eff08e1df889631eae34
< HCI Command: Host Number of Compl.. (0x03|0x0035) plen 5  #63 [hci1] 7.279253
        Num handles: 1
        Handle: 363 Address: DF:A9:FF:F6:B1:1A (OUI DF-A9-FF)
        Count: 1
< HCI Command: Host Number of Compl.. (0x03|0x0035) plen 5  #64 [hci1] 7.298787
        Num handles: 1
        Handle: 363 Address: DF:A9:FF:F6:B1:1A (OUI DF-A9-FF)
        Count: 1
< HCI Command: Host Number of Compl.. (0x03|0x0035) plen 5  #65 [hci1] 7.299140
        Num handles: 1
        Handle: 363 Address: DF:A9:FF:F6:B1:1A (OUI DF-A9-FF)
        Count: 1
< ACL Data TX: Handle 363 flags 0x00 dlen 27                #66 [hci1] 7.299283
< ACL Data TX: Handle 363 flags 0x01 dlen 27                #67 [hci1] 7.299323
< ACL Data TX: Handle 363 flags 0x01 dlen 15                #68 [hci1] 7.299327
      SMP: Pairing Public Key (0x0c) len 64
        X: 98308440221e2d910f0e54b71e7ec652857aa9b5a0dc65028824cc19db1226e9
        Y: 67a4816bcb62efb21701e31fdb27561a6217575fb007a8bbdabe7e28b6f68482
> HCI Event: Number of Completed Packets (0x13) plen 5      #69 [hci1] 7.365333
        Num handles: 1
        Handle: 363 Address: DF:A9:FF:F6:B1:1A (OUI DF-A9-FF)
        Count: 1
        #66: len 27 (3 Kb/s)
        Latency: 66 msec (66-165 msec ~113 msec)
> HCI Event: Number of Completed Packets (0x13) plen 5      #70 [hci1] 7.366141
        Num handles: 1
        Handle: 363 Address: DF:A9:FF:F6:B1:1A (OUI DF-A9-FF)
        Count: 1
        #67: len 27 (3 Kb/s)
        Latency: 66 msec (66-165 msec ~90 msec)
> HCI Event: Number of Completed Packets (0x13) plen 5      #71 [hci1] 7.452269
        Num handles: 1
        Handle: 363 Address: DF:A9:FF:F6:B1:1A (OUI DF-A9-FF)
        Count: 1
        #68: len 15 (0 Kb/s)
        Latency: 152 msec (66-165 msec ~121 msec)
> ACL Data RX: Handle 363 flags 0x02 dlen 21                #72 [hci1] 8.415032
      SMP: Pairing Confirm (0x03) len 16
        Confim value: f7a8813710dee7033529d017dd29faae
< HCI Command: Host Number of Compl.. (0x03|0x0035) plen 5  #73 [hci1] 8.418727
        Num handles: 1
        Handle: 363 Address: DF:A9:FF:F6:B1:1A (OUI DF-A9-FF)
        Count: 1
< ACL Data TX: Handle 363 flags 0x00 dlen 21                #74 [hci1] 8.418877
      SMP: Pairing Confirm (0x03) len 16
        Confim value: 6315aa3b113b4222512cc77f890c438f
> HCI Event: Number of Completed Packets (0x13) plen 5      #75 [hci1] 8.589986
        Num handles: 1
        Handle: 363 Address: DF:A9:FF:F6:B1:1A (OUI DF-A9-FF)
        Count: 1
        #74: len 21 (0 Kb/s)
        Latency: 171 msec (66-171 msec ~146 msec)
> ACL Data RX: Handle 363 flags 0x02 dlen 21                #76 [hci1] 8.590253
      SMP: Pairing Random (0x04) len 16
        Random value: 302d983db5d730030000000000000000
< HCI Command: Host Number of Compl.. (0x03|0x0035) plen 5  #77 [hci1] 8.599214
        Num handles: 1
        Handle: 363 Address: DF:A9:FF:F6:B1:1A (OUI DF-A9-FF)
        Count: 1
< ACL Data TX: Handle 363 flags 0x00 dlen 21                #78 [hci1] 8.599307
      SMP: Pairing Random (0x04) len 16
        Random value: 8e6108f966a694cbe26df70bb96773e6
> HCI Event: Number of Completed Packets (0x13) plen 5      #79 [hci1] 8.764621
        Num handles: 1
        Handle: 363 Address: DF:A9:FF:F6:B1:1A (OUI DF-A9-FF)
        Count: 1
        #78: len 21 (1 Kb/s)
        Latency: 165 msec (66-171 msec ~155 msec)
> ACL Data RX: Handle 363 flags 0x02 dlen 21                #80 [hci1] 8.852603
      SMP: Pairing Confirm (0x03) len 16
        Confim value: 0ca7525c8d8165d897afc75b8a0c97e8
< HCI Command: Host Number of Compl.. (0x03|0x0035) plen 5  #81 [hci1] 8.858809
        Num handles: 1
        Handle: 363 Address: DF:A9:FF:F6:B1:1A (OUI DF-A9-FF)
        Count: 1
< ACL Data TX: Handle 363 flags 0x00 dlen 21                #82 [hci1] 8.858898
      SMP: Pairing Confirm (0x03) len 16
        Confim value: 8cd4e8a5d50d49763d807c87c1f65b90
> HCI Event: Number of Completed Packets (0x13) plen 5      #83 [hci1] 9.027390
        Num handles: 1
        Handle: 363 Address: DF:A9:FF:F6:B1:1A (OUI DF-A9-FF)
        Count: 1
        #82: len 21 (1 Kb/s)
        Latency: 168 msec (66-171 msec ~162 msec)
> ACL Data RX: Handle 363 flags 0x02 dlen 21                #84 [hci1] 9.027821
      SMP: Pairing Random (0x04) len 16
        Random value: 724cc41f4f5350870000000000000000
< HCI Command: Host Number of Compl.. (0x03|0x0035) plen 5  #85 [hci1] 9.039163
        Num handles: 1
        Handle: 363 Address: DF:A9:FF:F6:B1:1A (OUI DF-A9-FF)
        Count: 1
< ACL Data TX: Handle 363 flags 0x00 dlen 21                #86 [hci1] 9.039261
      SMP: Pairing Random (0x04) len 16
        Random value: 4d02679f89a05211af56d8b3da64d21e
> HCI Event: Number of Completed Packets (0x13) plen 5      #87 [hci1] 9.202284
        Num handles: 1
        Handle: 363 Address: DF:A9:FF:F6:B1:1A (OUI DF-A9-FF)
        Count: 1
        #86: len 21 (1 Kb/s)
        Latency: 163 msec (66-171 msec ~162 msec)
> ACL Data RX: Handle 363 flags 0x02 dlen 21                #88 [hci1] 9.289981
      SMP: Pairing Confirm (0x03) len 16
        Confim value: b3da1dd4b90e98f8596d90b0b90f960d
< HCI Command: Host Number of Compl.. (0x03|0x0035) plen 5  #89 [hci1] 9.299069
        Num handles: 1
        Handle: 363 Address: DF:A9:FF:F6:B1:1A (OUI DF-A9-FF)
        Count: 1
< ACL Data TX: Handle 363 flags 0x00 dlen 21                #90 [hci1] 9.299273
      SMP: Pairing Confirm (0x03) len 16
        Confim value: 4a8bccc08f0870ca5bab34fd64599810
> HCI Event: Number of Completed Packets (0x13) plen 5      #91 [hci1] 9.464872
        Num handles: 1
        Handle: 363 Address: DF:A9:FF:F6:B1:1A (OUI DF-A9-FF)
        Count: 1
        #90: len 21 (1 Kb/s)
        Latency: 165 msec (66-171 msec ~164 msec)
> ACL Data RX: Handle 363 flags 0x02 dlen 21                #92 [hci1] 9.465215
      SMP: Pairing Random (0x04) len 16
        Random value: 13648c4e99f7d4600000000000000000
< HCI Command: Host Number of Compl.. (0x03|0x0035) plen 5  #93 [hci1] 9.479242
        Num handles: 1
        Handle: 363 Address: DF:A9:FF:F6:B1:1A (OUI DF-A9-FF)
        Count: 1
< ACL Data TX: Handle 363 flags 0x00 dlen 21                #94 [hci1] 9.479263
      SMP: Pairing Random (0x04) len 16
        Random value: 5e8286bc235a02440d0c3424a2acf8fd
> HCI Event: Number of Completed Packets (0x13) plen 5      #95 [hci1] 9.639643
        Num handles: 1
        Handle: 363 Address: DF:A9:FF:F6:B1:1A (OUI DF-A9-FF)
        Count: 1
        #94: len 21 (1 Kb/s)
        Latency: 160 msec (66-171 msec ~162 msec)
> ACL Data RX: Handle 363 flags 0x02 dlen 21                #96 [hci1] 9.727559
      SMP: Pairing Confirm (0x03) len 16
        Confim value: c4e80c382464ba3f14c54d26f7620d9e
< HCI Command: Host Number of Compl.. (0x03|0x0035) plen 5  #97 [hci1] 9.738960
        Num handles: 1
        Handle: 363 Address: DF:A9:FF:F6:B1:1A (OUI DF-A9-FF)
        Count: 1
< ACL Data TX: Handle 363 flags 0x00 dlen 21                #98 [hci1] 9.739182
      SMP: Pairing Confirm (0x03) len 16
        Confim value: c577ca5a839405c238f573a117f49295
> HCI Event: Number of Completed Packets (0x13) plen 5      #99 [hci1] 9.902540
        Num handles: 1
        Handle: 363 Address: DF:A9:FF:F6:B1:1A (OUI DF-A9-FF)
        Count: 1
        #98: len 21 (1 Kb/s)
        Latency: 163 msec (66-171 msec ~162 msec)
> ACL Data RX: Handle 363 flags 0x02 dlen 21               #100 [hci1] 9.902709
      SMP: Pairing Random (0x04) len 16
        Random value: 88c092bbbbdc7b200000000000000000
< HCI Command: Host Number of Comp.. (0x03|0x0035) plen 5  #101 [hci1] 9.919115
        Num handles: 1
        Handle: 363 Address: DF:A9:FF:F6:B1:1A (OUI DF-A9-FF)
        Count: 1
< ACL Data TX: Handle 363 flags 0x00 dlen 21               #102 [hci1] 9.919290
      SMP: Pairing Random (0x04) len 16
        Random value: 5c4a1bcadd27bd58e945097b00bad7ac
> HCI Event: Number of Completed Packets (0x13) plen 5    #103 [hci1] 10.077188
        Num handles: 1
        Handle: 363 Address: DF:A9:FF:F6:B1:1A (OUI DF-A9-FF)
        Count: 1
        #102: len 21 (1 Kb/s)
        Latency: 157 msec (66-171 msec ~160 msec)
> ACL Data RX: Handle 363 flags 0x02 dlen 21              #104 [hci1] 10.165119
      SMP: Pairing Confirm (0x03) len 16
        Confim value: 59ea2662af23a2b7cb5e1172750e524d
< HCI Command: Host Number of Com.. (0x03|0x0035) plen 5  #105 [hci1] 10.178934
        Num handles: 1
        Handle: 363 Address: DF:A9:FF:F6:B1:1A (OUI DF-A9-FF)
        Count: 1
< ACL Data TX: Handle 363 flags 0x00 dlen 21              #106 [hci1] 10.179130
      SMP: Pairing Confirm (0x03) len 16
        Confim value: 3408b0305b5a29686a7784e11857ca14
> HCI Event: Number of Completed Packets (0x13) plen 5    #107 [hci1] 10.339908
        Num handles: 1
        Handle: 363 Address: DF:A9:FF:F6:B1:1A (OUI DF-A9-FF)
        Count: 1
        #106: len 21 (1 Kb/s)
        Latency: 160 msec (66-171 msec ~160 msec)
> ACL Data RX: Handle 363 flags 0x02 dlen 21              #108 [hci1] 10.340168
      SMP: Pairing Random (0x04) len 16
        Random value: 9bdd4122be140c0c0000000000000000
< HCI Command: Host Number of Com.. (0x03|0x0035) plen 5  #109 [hci1] 10.359236
        Num handles: 1
        Handle: 363 Address: DF:A9:FF:F6:B1:1A (OUI DF-A9-FF)
        Count: 1
< ACL Data TX: Handle 363 flags 0x00 dlen 21              #110 [hci1] 10.359328
      SMP: Pairing Random (0x04) len 16
        Random value: 32527e6e64e79f33b2e374394db8ab2d
> HCI Event: Number of Completed Packets (0x13) plen 5    #111 [hci1] 10.514706
        Num handles: 1
        Handle: 363 Address: DF:A9:FF:F6:B1:1A (OUI DF-A9-FF)
        Count: 1
        #110: len 21 (1 Kb/s)
        Latency: 155 msec (66-171 msec ~157 msec)
> ACL Data RX: Handle 363 flags 0x02 dlen 21              #112 [hci1] 10.602571
      SMP: Pairing Confirm (0x03) len 16
        Confim value: 80e5fe4cf4ae9f1a861b29d17d92d022
< HCI Command: Host Number of Com.. (0x03|0x0035) plen 5  #113 [hci1] 10.618770
        Num handles: 1
        Handle: 363 Address: DF:A9:FF:F6:B1:1A (OUI DF-A9-FF)
        Count: 1
< ACL Data TX: Handle 363 flags 0x00 dlen 21              #114 [hci1] 10.618916
      SMP: Pairing Confirm (0x03) len 16
        Confim value: 9173e66b6ed26fe869532b7fe19efb07
> HCI Event: Number of Completed Packets (0x13) plen 5    #115 [hci1] 10.777319
        Num handles: 1
        Handle: 363 Address: DF:A9:FF:F6:B1:1A (OUI DF-A9-FF)
        Count: 1
        #114: len 21 (1 Kb/s)
        Latency: 158 msec (66-171 msec ~158 msec)
> ACL Data RX: Handle 363 flags 0x02 dlen 21              #116 [hci1] 10.777724
      SMP: Pairing Random (0x04) len 16
        Random value: afe345792a9934c60000000000000000
< HCI Command: Host Number of Com.. (0x03|0x0035) plen 5  #117 [hci1] 10.779207
        Num handles: 1
        Handle: 363 Address: DF:A9:FF:F6:B1:1A (OUI DF-A9-FF)
        Count: 1
< ACL Data TX: Handle 363 flags 0x00 dlen 21              #118 [hci1] 10.779319
      SMP: Pairing Random (0x04) len 16
        Random value: dddbdfe2838e9a8cc6964353c850fef7
> HCI Event: Number of Completed Packets (0x13) plen 5    #119 [hci1] 10.952199
        Num handles: 1
        Handle: 363 Address: DF:A9:FF:F6:B1:1A (OUI DF-A9-FF)
        Count: 1
        #118: len 21 (0 Kb/s)
        Latency: 172 msec (66-172 msec ~165 msec)
> ACL Data RX: Handle 363 flags 0x02 dlen 21              #120 [hci1] 11.039991
      SMP: Pairing Confirm (0x03) len 16
        Confim value: 5ca45c5c86c37ad811ce2e2abba57689
< HCI Command: Host Number of Com.. (0x03|0x0035) plen 5  #121 [hci1] 11.059021
        Num handles: 1
        Handle: 363 Address: DF:A9:FF:F6:B1:1A (OUI DF-A9-FF)
        Count: 1
< ACL Data TX: Handle 363 flags 0x00 dlen 21              #122 [hci1] 11.059251
      SMP: Pairing Confirm (0x03) len 16
        Confim value: 81a057c201a2af46fc016c9ab03895fd
> HCI Event: Number of Completed Packets (0x13) plen 5    #123 [hci1] 11.214901
        Num handles: 1
        Handle: 363 Address: DF:A9:FF:F6:B1:1A (OUI DF-A9-FF)
        Count: 1
        #122: len 21 (1 Kb/s)
        Latency: 155 msec (66-172 msec ~160 msec)
> ACL Data RX: Handle 363 flags 0x02 dlen 21              #124 [hci1] 11.215146
      SMP: Pairing Random (0x04) len 16
        Random value: 4b1d829ec254d81e0000000000000000
< HCI Command: Host Number of Com.. (0x03|0x0035) plen 5  #125 [hci1] 11.219186
        Num handles: 1
        Handle: 363 Address: DF:A9:FF:F6:B1:1A (OUI DF-A9-FF)
        Count: 1
< ACL Data TX: Handle 363 flags 0x00 dlen 21              #126 [hci1] 11.219307
      SMP: Pairing Random (0x04) len 16
        Random value: eb9f1915536596b6fc3db1c86b2b1970
> HCI Event: Number of Completed Packets (0x13) plen 5    #127 [hci1] 11.389712
        Num handles: 1
        Handle: 363 Address: DF:A9:FF:F6:B1:1A (OUI DF-A9-FF)
        Count: 1
        #126: len 21 (0 Kb/s)
        Latency: 170 msec (66-172 msec ~165 msec)
> ACL Data RX: Handle 363 flags 0x02 dlen 21              #128 [hci1] 11.477551
      SMP: Pairing Confirm (0x03) len 16
        Confim value: c970b3c3fba6a49408399557b81942dd
< HCI Command: Host Number of Com.. (0x03|0x0035) plen 5  #129 [hci1] 11.478780
        Num handles: 1
        Handle: 363 Address: DF:A9:FF:F6:B1:1A (OUI DF-A9-FF)
        Count: 1
< ACL Data TX: Handle 363 flags 0x00 dlen 21              #130 [hci1] 11.478920
      SMP: Pairing Confirm (0x03) len 16
        Confim value: 3c57ba9c88ef5f3aaba8122acafe6427
> HCI Event: Number of Completed Packets (0x13) plen 5    #131 [hci1] 11.652334
        Num handles: 1
        Handle: 363 Address: DF:A9:FF:F6:B1:1A (OUI DF-A9-FF)
        Count: 1
        #130: len 21 (0 Kb/s)
        Latency: 173 msec (66-173 msec ~169 msec)
> ACL Data RX: Handle 363 flags 0x02 dlen 21              #132 [hci1] 11.652600
      SMP: Pairing Random (0x04) len 16
        Random value: 7e5b17c66798b3b40000000000000000
< HCI Command: Host Number of Com.. (0x03|0x0035) plen 5  #133 [hci1] 11.659036
        Num handles: 1
        Handle: 363 Address: DF:A9:FF:F6:B1:1A (OUI DF-A9-FF)
        Count: 1
< ACL Data TX: Handle 363 flags 0x00 dlen 21              #134 [hci1] 11.659144
      SMP: Pairing Random (0x04) len 16
        Random value: 5c794dc9ad9f2c3f295ebd5ad5e1c3cf
> HCI Event: Number of Completed Packets (0x13) plen 5    #135 [hci1] 11.827173
        Num handles: 1
        Handle: 363 Address: DF:A9:FF:F6:B1:1A (OUI DF-A9-FF)
        Count: 1
        #134: len 21 (1 Kb/s)
        Latency: 168 msec (66-173 msec ~168 msec)
> ACL Data RX: Handle 363 flags 0x02 dlen 21              #136 [hci1] 11.914969
      SMP: Pairing Confirm (0x03) len 16
        Confim value: 59a4a80c0aac3ee362509bc0f420879d
< HCI Command: Host Number of Com.. (0x03|0x0035) plen 5  #137 [hci1] 11.918765
        Num handles: 1
        Handle: 363 Address: DF:A9:FF:F6:B1:1A (OUI DF-A9-FF)
        Count: 1
< ACL Data TX: Handle 363 flags 0x00 dlen 21              #138 [hci1] 11.918889
      SMP: Pairing Confirm (0x03) len 16
        Confim value: d71189995f6ab3d4a9e9e7f111b9af6f
> HCI Event: Number of Completed Packets (0x13) plen 5    #139 [hci1] 12.089833
        Num handles: 1
        Handle: 363 Address: DF:A9:FF:F6:B1:1A (OUI DF-A9-FF)
        Count: 1
        #138: len 21 (0 Kb/s)
        Latency: 170 msec (66-173 msec ~169 msec)
> ACL Data RX: Handle 363 flags 0x02 dlen 21              #140 [hci1] 12.090161
      SMP: Pairing Random (0x04) len 16
        Random value: c56673052ca3ac000000000000000000
< HCI Command: Host Number of Com.. (0x03|0x0035) plen 5  #141 [hci1] 12.099180
        Num handles: 1
        Handle: 363 Address: DF:A9:FF:F6:B1:1A (OUI DF-A9-FF)
        Count: 1
< ACL Data TX: Handle 363 flags 0x00 dlen 21              #142 [hci1] 12.099285
      SMP: Pairing Random (0x04) len 16
        Random value: 5c2fff312cdf99c9491988e877355a9a
> HCI Event: Number of Completed Packets (0x13) plen 5    #143 [hci1] 12.264638
        Num handles: 1
        Handle: 363 Address: DF:A9:FF:F6:B1:1A (OUI DF-A9-FF)
        Count: 1
        #142: len 21 (1 Kb/s)
        Latency: 165 msec (66-173 msec ~167 msec)
> ACL Data RX: Handle 363 flags 0x02 dlen 21              #144 [hci1] 12.352439
      SMP: Pairing Confirm (0x03) len 16
        Confim value: e41ce25c99a40e863e5509e5d822effa
< HCI Command: Host Number of Com.. (0x03|0x0035) plen 5  #145 [hci1] 12.358897
        Num handles: 1
        Handle: 363 Address: DF:A9:FF:F6:B1:1A (OUI DF-A9-FF)
        Count: 1
< ACL Data TX: Handle 363 flags 0x00 dlen 21              #146 [hci1] 12.359064
      SMP: Pairing Confirm (0x03) len 16
        Confim value: 3551f21a80105ee2d3ec853a41b9450f
> HCI Event: Number of Completed Packets (0x13) plen 5    #147 [hci1] 12.527317
        Num handles: 1
        Handle: 363 Address: DF:A9:FF:F6:B1:1A (OUI DF-A9-FF)
        Count: 1
        #146: len 21 (1 Kb/s)
        Latency: 168 msec (66-173 msec ~167 msec)
> ACL Data RX: Handle 363 flags 0x02 dlen 21              #148 [hci1] 12.527681
      SMP: Pairing Random (0x04) len 16
        Random value: 74466012be864d260000000000000000
< HCI Command: Host Number of Com.. (0x03|0x0035) plen 5  #149 [hci1] 12.539242
        Num handles: 1
        Handle: 363 Address: DF:A9:FF:F6:B1:1A (OUI DF-A9-FF)
        Count: 1
< ACL Data TX: Handle 363 flags 0x00 dlen 21              #150 [hci1] 12.539350
      SMP: Pairing Random (0x04) len 16
        Random value: c629a3a987d808e808655d558dfc1155
> HCI Event: Number of Completed Packets (0x13) plen 5    #151 [hci1] 12.702113
        Num handles: 1
        Handle: 363 Address: DF:A9:FF:F6:B1:1A (OUI DF-A9-FF)
        Count: 1
        #150: len 21 (1 Kb/s)
        Latency: 162 msec (66-173 msec ~165 msec)
> ACL Data RX: Handle 363 flags 0x02 dlen 21              #152 [hci1] 12.789871
      SMP: Pairing Confirm (0x03) len 16
        Confim value: b0992641142c1dd8d846f1cf2e02e3cf
< HCI Command: Host Number of Com.. (0x03|0x0035) plen 5  #153 [hci1] 12.799083
        Num handles: 1
        Handle: 363 Address: DF:A9:FF:F6:B1:1A (OUI DF-A9-FF)
        Count: 1
< ACL Data TX: Handle 363 flags 0x00 dlen 21              #154 [hci1] 12.799302
      SMP: Pairing Confirm (0x03) len 16
        Confim value: ab32ee8f835e63d6ed1e58447d2b3459
> HCI Event: Number of Completed Packets (0x13) plen 5    #155 [hci1] 12.964960
        Num handles: 1
        Handle: 363 Address: DF:A9:FF:F6:B1:1A (OUI DF-A9-FF)
        Count: 1
        #154: len 21 (1 Kb/s)
        Latency: 165 msec (66-173 msec ~165 msec)
> ACL Data RX: Handle 363 flags 0x02 dlen 21              #156 [hci1] 12.965123
      SMP: Pairing Random (0x04) len 16
        Random value: d6f9fa4772dec8730000000000000000
< HCI Command: Host Number of Com.. (0x03|0x0035) plen 5  #157 [hci1] 12.979169
        Num handles: 1
        Handle: 363 Address: DF:A9:FF:F6:B1:1A (OUI DF-A9-FF)
        Count: 1
< ACL Data TX: Handle 363 flags 0x00 dlen 21              #158 [hci1] 12.979312
      SMP: Pairing Random (0x04) len 16
        Random value: 92f20f6ad8f13724432c7fd6001c45ff
> HCI Event: Number of Completed Packets (0x13) plen 5    #159 [hci1] 13.139508
        Num handles: 1
        Handle: 363 Address: DF:A9:FF:F6:B1:1A (OUI DF-A9-FF)
        Count: 1
        #158: len 21 (1 Kb/s)
        Latency: 160 msec (66-173 msec ~162 msec)
> ACL Data RX: Handle 363 flags 0x02 dlen 21              #160 [hci1] 13.227467
      SMP: Pairing Confirm (0x03) len 16
        Confim value: 99808561e1af54c2d159f967721b57ef
< HCI Command: Host Number of Com.. (0x03|0x0035) plen 5  #161 [hci1] 13.239024
        Num handles: 1
        Handle: 363 Address: DF:A9:FF:F6:B1:1A (OUI DF-A9-FF)
        Count: 1
< ACL Data TX: Handle 363 flags 0x00 dlen 21              #162 [hci1] 13.239246
      SMP: Pairing Confirm (0x03) len 16
        Confim value: 385c2cc87d37017d98a09b95517b83af
> HCI Event: Number of Completed Packets (0x13) plen 5    #163 [hci1] 13.402252
        Num handles: 1
        Handle: 363 Address: DF:A9:FF:F6:B1:1A (OUI DF-A9-FF)
        Count: 1
        #162: len 21 (1 Kb/s)
        Latency: 163 msec (66-173 msec ~162 msec)
> ACL Data RX: Handle 363 flags 0x02 dlen 21              #164 [hci1] 13.402548
      SMP: Pairing Random (0x04) len 16
        Random value: 155285ee2f8b1e310000000000000000
< HCI Command: Host Number of Com.. (0x03|0x0035) plen 5  #165 [hci1] 13.418787
        Num handles: 1
        Handle: 363 Address: DF:A9:FF:F6:B1:1A (OUI DF-A9-FF)
        Count: 1
< ACL Data TX: Handle 363 flags 0x00 dlen 21              #166 [hci1] 13.418864
      SMP: Pairing Random (0x04) len 16
        Random value: 23ac32ebbb5e14c8a6b9622f296d277f
> HCI Event: Number of Completed Packets (0x13) plen 5    #167 [hci1] 13.577167
        Num handles: 1
        Handle: 363 Address: DF:A9:FF:F6:B1:1A (OUI DF-A9-FF)
        Count: 1
        #166: len 21 (1 Kb/s)
        Latency: 158 msec (66-173 msec ~160 msec)
> ACL Data RX: Handle 363 flags 0x02 dlen 21              #168 [hci1] 13.664923
      SMP: Pairing Confirm (0x03) len 16
        Confim value: 40f6dc315ea84462b76b8cdff7afb824
< HCI Command: Host Number of Com.. (0x03|0x0035) plen 5  #169 [hci1] 13.679041
        Num handles: 1
        Handle: 363 Address: DF:A9:FF:F6:B1:1A (OUI DF-A9-FF)
        Count: 1
< ACL Data TX: Handle 363 flags 0x00 dlen 21              #170 [hci1] 13.679230
      SMP: Pairing Confirm (0x03) len 16
        Confim value: 4231202c8ab9c0d31a0886c7ceb461bc
> HCI Event: Number of Completed Packets (0x13) plen 5    #171 [hci1] 13.839797
        Num handles: 1
        Handle: 363 Address: DF:A9:FF:F6:B1:1A (OUI DF-A9-FF)
        Count: 1
        #170: len 21 (1 Kb/s)
        Latency: 160 msec (66-173 msec ~160 msec)
> ACL Data RX: Handle 363 flags 0x02 dlen 21              #172 [hci1] 13.840142
      SMP: Pairing Random (0x04) len 16
        Random value: 006f81f9bdeeec9c0000000000000000
< HCI Command: Host Number of Com.. (0x03|0x0035) plen 5  #173 [hci1] 13.859190
        Num handles: 1
        Handle: 363 Address: DF:A9:FF:F6:B1:1A (OUI DF-A9-FF)
        Count: 1
< ACL Data TX: Handle 363 flags 0x00 dlen 21              #174 [hci1] 13.859283
      SMP: Pairing Random (0x04) len 16
        Random value: 297efe85e67448a15f56bd27e3a3cf1d
> HCI Event: Number of Completed Packets (0x13) plen 5    #175 [hci1] 14.014538
        Num handles: 1
        Handle: 363 Address: DF:A9:FF:F6:B1:1A (OUI DF-A9-FF)
        Count: 1
        #174: len 21 (1 Kb/s)
        Latency: 155 msec (66-173 msec ~157 msec)
> ACL Data RX: Handle 363 flags 0x02 dlen 21              #176 [hci1] 14.102327
      SMP: Pairing Confirm (0x03) len 16
        Confim value: 0fce03e7cc5fefc5f95937170331636c
< HCI Command: Host Number of Com.. (0x03|0x0035) plen 5  #177 [hci1] 14.119039
        Num handles: 1
        Handle: 363 Address: DF:A9:FF:F6:B1:1A (OUI DF-A9-FF)
        Count: 1
< ACL Data TX: Handle 363 flags 0x00 dlen 21              #178 [hci1] 14.119260
      SMP: Pairing Confirm (0x03) len 16
        Confim value: 4d7d904423c216e5c5766ec072a4b98f
> HCI Event: Number of Completed Packets (0x13) plen 5    #179 [hci1] 14.277262
        Num handles: 1
        Handle: 363 Address: DF:A9:FF:F6:B1:1A (OUI DF-A9-FF)
        Count: 1
        #178: len 21 (1 Kb/s)
        Latency: 158 msec (66-173 msec ~157 msec)
> ACL Data RX: Handle 363 flags 0x02 dlen 21              #180 [hci1] 14.277572
      SMP: Pairing Random (0x04) len 16
        Random value: f97387dd3fc4b9130000000000000000
< HCI Command: Host Number of Com.. (0x03|0x0035) plen 5  #181 [hci1] 14.279268
        Num handles: 1
        Handle: 363 Address: DF:A9:FF:F6:B1:1A (OUI DF-A9-FF)
        Count: 1
< ACL Data TX: Handle 363 flags 0x00 dlen 21              #182 [hci1] 14.279343
      SMP: Pairing Random (0x04) len 16
        Random value: 25a9493fd3ce4faf02be7293595bb7c6
> HCI Event: Number of Completed Packets (0x13) plen 5    #183 [hci1] 14.452090
        Num handles: 1
        Handle: 363 Address: DF:A9:FF:F6:B1:1A (OUI DF-A9-FF)
        Count: 1
        #182: len 21 (0 Kb/s)
        Latency: 172 msec (66-173 msec ~165 msec)
> ACL Data RX: Handle 363 flags 0x02 dlen 21              #184 [hci1] 14.540019
      SMP: Pairing Confirm (0x03) len 16
        Confim value: f8120a926edf10409659644c6651a660
< HCI Command: Host Number of Com.. (0x03|0x0035) plen 5  #185 [hci1] 14.559028
        Num handles: 1
        Handle: 363 Address: DF:A9:FF:F6:B1:1A (OUI DF-A9-FF)
        Count: 1
< ACL Data TX: Handle 363 flags 0x00 dlen 21              #186 [hci1] 14.559227
      SMP: Pairing Confirm (0x03) len 16
        Confim value: aebe55d59742ec03abfe3c495c9be5e3
> HCI Event: Number of Completed Packets (0x13) plen 5    #187 [hci1] 14.714662
        Num handles: 1
        Handle: 363 Address: DF:A9:FF:F6:B1:1A (OUI DF-A9-FF)
        Count: 1
        #186: len 21 (1 Kb/s)
        Latency: 155 msec (66-173 msec ~160 msec)
> ACL Data RX: Handle 363 flags 0x02 dlen 21              #188 [hci1] 14.715026
      SMP: Pairing Random (0x04) len 16
        Random value: efc6c6685ce233520000000000000000
< HCI Command: Host Number of Com.. (0x03|0x0035) plen 5  #189 [hci1] 14.719204
        Num handles: 1
        Handle: 363 Address: DF:A9:FF:F6:B1:1A (OUI DF-A9-FF)
        Count: 1
< ACL Data TX: Handle 363 flags 0x00 dlen 21              #190 [hci1] 14.719381
      SMP: Pairing Random (0x04) len 16
        Random value: 58f6b41f855a6f6c3560debd84e2affc
> HCI Event: Number of Completed Packets (0x13) plen 5    #191 [hci1] 14.889508
        Num handles: 1
        Handle: 363 Address: DF:A9:FF:F6:B1:1A (OUI DF-A9-FF)
        Count: 1
        #190: len 21 (0 Kb/s)
        Latency: 170 msec (66-173 msec ~165 msec)
> ACL Data RX: Handle 363 flags 0x02 dlen 21              #192 [hci1] 14.977273
      SMP: Pairing Confirm (0x03) len 16
        Confim value: 39b3f5db8a394c80186c7381cd7d7d94
< HCI Command: Host Number of Com.. (0x03|0x0035) plen 5  #193 [hci1] 14.978762
        Num handles: 1
        Handle: 363 Address: DF:A9:FF:F6:B1:1A (OUI DF-A9-FF)
        Count: 1
< ACL Data TX: Handle 363 flags 0x00 dlen 21              #194 [hci1] 14.978896
      SMP: Pairing Confirm (0x03) len 16
        Confim value: 8035a8f2edf0109e0d993e0384f7be56
> HCI Event: Number of Completed Packets (0x13) plen 5    #195 [hci1] 15.152190
        Num handles: 1
        Handle: 363 Address: DF:A9:FF:F6:B1:1A (OUI DF-A9-FF)
        Count: 1
        #194: len 21 (0 Kb/s)
        Latency: 173 msec (66-173 msec ~169 msec)
> ACL Data RX: Handle 363 flags 0x02 dlen 21              #196 [hci1] 15.152757
      SMP: Pairing Random (0x04) len 16
        Random value: 71fedaaa30709f0f0000000000000000
< HCI Command: Host Number of Com.. (0x03|0x0035) plen 5  #197 [hci1] 15.159305
        Num handles: 1
        Handle: 363 Address: DF:A9:FF:F6:B1:1A (OUI DF-A9-FF)
        Count: 1
< ACL Data TX: Handle 363 flags 0x00 dlen 21              #198 [hci1] 15.159413
      SMP: Pairing Random (0x04) len 16
        Random value: b67e7216d5bf664139eda2b542549666
> HCI Event: Number of Completed Packets (0x13) plen 5    #199 [hci1] 15.327009
        Num handles: 1
        Handle: 363 Address: DF:A9:FF:F6:B1:1A (OUI DF-A9-FF)
        Count: 1
        #198: len 21 (1 Kb/s)
        Latency: 167 msec (66-173 msec ~168 msec)
> ACL Data RX: Handle 363 flags 0x02 dlen 21              #200 [hci1] 15.414913
      SMP: Pairing Confirm (0x03) len 16
        Confim value: 2b98621abbbdb7e62c9df42787374ce0
< HCI Command: Host Number of Com.. (0x03|0x0035) plen 5  #201 [hci1] 15.418709
        Num handles: 1
        Handle: 363 Address: DF:A9:FF:F6:B1:1A (OUI DF-A9-FF)
        Count: 1
< ACL Data TX: Handle 363 flags 0x00 dlen 21              #202 [hci1] 15.418854
      SMP: Pairing Confirm (0x03) len 16
        Confim value: d998266face476e12814cabefdcf5644
> HCI Event: Number of Completed Packets (0x13) plen 5    #203 [hci1] 15.589684
        Num handles: 1
        Handle: 363 Address: DF:A9:FF:F6:B1:1A (OUI DF-A9-FF)
        Count: 1
        #202: len 21 (0 Kb/s)
        Latency: 170 msec (66-173 msec ~169 msec)
> ACL Data RX: Handle 363 flags 0x02 dlen 21              #204 [hci1] 15.590159
      SMP: Pairing Random (0x04) len 16
        Random value: 69608fe5072eabda0000000000000000
< HCI Command: Host Number of Com.. (0x03|0x0035) plen 5  #205 [hci1] 15.599300
        Num handles: 1
        Handle: 363 Address: DF:A9:FF:F6:B1:1A (OUI DF-A9-FF)
        Count: 1
< ACL Data TX: Handle 363 flags 0x00 dlen 21              #206 [hci1] 15.599418
      SMP: Pairing Random (0x04) len 16
        Random value: ed17f76500c95219dd01e09d1e63f87b
> HCI Event: Number of Completed Packets (0x13) plen 5    #207 [hci1] 15.764547
        Num handles: 1
        Handle: 363 Address: DF:A9:FF:F6:B1:1A (OUI DF-A9-FF)
        Count: 1
        #206: len 21 (1 Kb/s)
        Latency: 165 msec (66-173 msec ~167 msec)
> ACL Data RX: Handle 363 flags 0x02 dlen 21              #208 [hci1] 15.852236
      SMP: Pairing Confirm (0x03) len 16
        Confim value: 73ce8c98042fab1f2c3ddab7c622aaba
< HCI Command: Host Number of Com.. (0x03|0x0035) plen 5  #209 [hci1] 15.859111
        Num handles: 1
        Handle: 363 Address: DF:A9:FF:F6:B1:1A (OUI DF-A9-FF)
        Count: 1
< ACL Data TX: Handle 363 flags 0x00 dlen 21              #210 [hci1] 15.859335
      SMP: Pairing Confirm (0x03) len 16
        Confim value: a10665609ac21bbf41c5c6d6957661de
> HCI Event: Number of Completed Packets (0x13) plen 5    #211 [hci1] 16.027254
        Num handles: 1
        Handle: 363 Address: DF:A9:FF:F6:B1:1A (OUI DF-A9-FF)
        Count: 1
        #210: len 21 (1 Kb/s)
        Latency: 167 msec (66-173 msec ~167 msec)
> ACL Data RX: Handle 363 flags 0x02 dlen 21              #212 [hci1] 16.027562
      SMP: Pairing Random (0x04) len 16
        Random value: 521628dc0e5f19860000000000000000
< HCI Command: Host Number of Com.. (0x03|0x0035) plen 5  #213 [hci1] 16.039225
        Num handles: 1
        Handle: 363 Address: DF:A9:FF:F6:B1:1A (OUI DF-A9-FF)
        Count: 1
< ACL Data TX: Handle 363 flags 0x00 dlen 21              #214 [hci1] 16.039317
      SMP: Pairing Random (0x04) len 16
        Random value: 81d35d47e1f6006d79c974bd9d9e1ee3
> HCI Event: Number of Completed Packets (0x13) plen 5    #215 [hci1] 16.202032
        Num handles: 1
        Handle: 363 Address: DF:A9:FF:F6:B1:1A (OUI DF-A9-FF)
        Count: 1
        #214: len 21 (1 Kb/s)
        Latency: 162 msec (66-173 msec ~165 msec)
> ACL Data RX: Handle 363 flags 0x02 dlen 21              #216 [hci1] 16.289952
      SMP: Pairing Confirm (0x03) len 16
        Confim value: 8b99e48d6c64d41db02d731a108fa6d8
< HCI Command: Host Number of Com.. (0x03|0x0035) plen 5  #217 [hci1] 16.298987
        Num handles: 1
        Handle: 363 Address: DF:A9:FF:F6:B1:1A (OUI DF-A9-FF)
        Count: 1
< ACL Data TX: Handle 363 flags 0x00 dlen 21              #218 [hci1] 16.299211
      SMP: Pairing Confirm (0x03) len 16
        Confim value: 8720328958c739243b88a75be676848e
> HCI Event: Number of Completed Packets (0x13) plen 5    #219 [hci1] 16.464732
        Num handles: 1
        Handle: 363 Address: DF:A9:FF:F6:B1:1A (OUI DF-A9-FF)
        Count: 1
        #218: len 21 (1 Kb/s)
        Latency: 165 msec (66-173 msec ~165 msec)
> ACL Data RX: Handle 363 flags 0x02 dlen 21              #220 [hci1] 16.464962
      SMP: Pairing Random (0x04) len 16
        Random value: 83603710621c8dea0000000000000000
< HCI Command: Host Number of Com.. (0x03|0x0035) plen 5  #221 [hci1] 16.479281
        Num handles: 1
        Handle: 363 Address: DF:A9:FF:F6:B1:1A (OUI DF-A9-FF)
        Count: 1
< ACL Data TX: Handle 363 flags 0x00 dlen 21              #222 [hci1] 16.479370
      SMP: Pairing Random (0x04) len 16
        Random value: e7f7e0c2476823e41736a7e381bafb7c
> HCI Event: Number of Completed Packets (0x13) plen 5    #223 [hci1] 16.639482
        Num handles: 1
        Handle: 363 Address: DF:A9:FF:F6:B1:1A (OUI DF-A9-FF)
        Count: 1
        #222: len 21 (1 Kb/s)
        Latency: 160 msec (66-173 msec ~162 msec)
> ACL Data RX: Handle 363 flags 0x02 dlen 21              #224 [hci1] 16.727271
      SMP: Pairing Confirm (0x03) len 16
        Confim value: 5754b6c4382acc95ac73bb10b93402d5
< HCI Command: Host Number of Com.. (0x03|0x0035) plen 5  #225 [hci1] 16.738672
        Num handles: 1
        Handle: 363 Address: DF:A9:FF:F6:B1:1A (OUI DF-A9-FF)
        Count: 1
< ACL Data TX: Handle 363 flags 0x00 dlen 21              #226 [hci1] 16.738788
      SMP: Pairing Confirm (0x03) len 16
        Confim value: e6ade271a620f9059500e6e69f4c44ed
> HCI Event: Number of Completed Packets (0x13) plen 5    #227 [hci1] 16.902191
        Num handles: 1
        Handle: 363 Address: DF:A9:FF:F6:B1:1A (OUI DF-A9-FF)
        Count: 1
        #226: len 21 (1 Kb/s)
        Latency: 163 msec (66-173 msec ~163 msec)
> ACL Data RX: Handle 363 flags 0x02 dlen 21              #228 [hci1] 16.902557
      SMP: Pairing Random (0x04) len 16
        Random value: c3f97006920ab3aa0000000000000000
< HCI Command: Host Number of Com.. (0x03|0x0035) plen 5  #229 [hci1] 16.919205
        Num handles: 1
        Handle: 363 Address: DF:A9:FF:F6:B1:1A (OUI DF-A9-FF)
        Count: 1
