Bluetooth monitor ver 5.72
= Note: Linux version 6.14.0-36-generic (x86_64)                       0.920997
= Note: Bluetooth subsystem version 2.22                               0.920999
= New Index: 00:00:00:00:00:00 (Primary,UART,hci1)              [hci1] 0.921000
= New Index: 48:5F:99:8E:E0:64 (Primary,USB,hci0)               [hci0] 0.921000
= Open Index: 00:00:00:00:00:00                                 [hci1] 1.034351
= Index Info: 00:00:00:00:00:00 (Nordic Semiconductor ASA)      [hci1] 1.034357
@ USER Open: main (privileged) version 2.22            {0x0001} [hci1] 1.034359
< HCI Command: Reset (0x03|0x0003) plen 0                    #1 [hci1] 1.034722
> HCI Event: Command Complete (0x0e) plen 4                  #2 [hci1] 1.035193
      Reset (0x03|0x0003) ncmd 1
        Status: Success (0x00)
< HCI Command: Read Local Supported... (0x04|0x0003) plen 0  #3 [hci1] 1.054297
> HCI Event: Command Complete (0x0e) plen 12                 #4 [hci1] 1.054812
      Read Local Supported Features (0x04|0x0003) ncmd 1
        Status: Success (0x00)
        Features: 0x00 0x00 0x00 0x00 0x60 0x00 0x00 0x00
          BR/EDR Not Supported
          LE Supported (Controller)
< HCI Command: Read Local Version In.. (0x04|0x0001) plen 0  #5 [hci1] 1.074306
> HCI Event: Command Complete (0x0e) plen 12                 #6 [hci1] 1.074808
      Read Local Version Information (0x04|0x0001) ncmd 1
        Status: Success (0x00)
        HCI version: Reserved (0x0f) - Revision 12393 (0x3069)
        LMP version: Reserved (0x0f) - Subversion 12393 (0x3069)
        Manufacturer: Nordic Semiconductor ASA (89)
< HCI Command: Read Local Supported... (0x04|0x0002) plen 0  #7 [hci1] 1.094330
> HCI Event: Command Complete (0x0e) plen 68                 #8 [hci1] 1.095334
      Read Local Supported Commands (0x04|0x0002) ncmd 1
        Status: Success (0x00)
        Commands: 119 entries
          Disconnect (Octet 0 - Bit 5)
          Read Remote Version Information (Octet 2 - Bit 7)
          Set Event Mask (Octet 5 - Bit 6)
          Reset (Octet 5 - Bit 7)
          Read Connection Accept Timeout (Octet 7 - Bit 2)
          Write Connection Accept Timeout (Octet 7 - Bit 3)
          Read Transmit Power Level (Octet 10 - Bit 2)
          Set Controller To Host Flow Control (Octet 10 - Bit 5)
          Host Buffer Size (Octet 10 - Bit 6)
          Host Number of Completed Packets (Octet 10 - Bit 7)
          Read Local Version Information (Octet 14 - Bit 3)
          Read Local Supported Features (Octet 14 - Bit 5)
          Read BD ADDR (Octet 15 - Bit 1)
          Read RSSI (Octet 15 - Bit 5)
          Set Event Mask Page 2 (Octet 22 - Bit 2)
          LE Set Event Mask (Octet 25 - Bit 0)
          LE Read Buffer Size (Octet 25 - Bit 1)
          LE Read Local Supported Features (Octet 25 - Bit 2)
          LE Set Random Address (Octet 25 - Bit 4)
          LE Set Advertising Parameters (Octet 25 - Bit 5)
          LE Read Advertising Channel TX Power (Octet 25 - Bit 6)
          LE Set Advertising Data (Octet 25 - Bit 7)
          LE Set Scan Response Data (Octet 26 - Bit 0)
          LE Set Advertise Enable (Octet 26 - Bit 1)
          LE Set Scan Parameters (Octet 26 - Bit 2)
          LE Set Scan Enable (Octet 26 - Bit 3)
          LE Create Connection (Octet 26 - Bit 4)
          LE Create Connection Cancel (Octet 26 - Bit 5)
          LE Read Accept List Size (Octet 26 - Bit 6)
          LE Clear Accept List (Octet 26 - Bit 7)
          LE Add Device To Accept List (Octet 27 - Bit 0)
          LE Remove Device From Accept List (Octet 27 - Bit 1)
          LE Connection Update (Octet 27 - Bit 2)
          LE Set Host Channel Classification (Octet 27 - Bit 3)
          LE Read Channel Map (Octet 27 - Bit 4)
          LE Read Remote Used Features (Octet 27 - Bit 5)
          LE Encrypt (Octet 27 - Bit 6)
          LE Rand (Octet 27 - Bit 7)
          LE Start Encryption (Octet 28 - Bit 0)
          LE Long Term Key Request Reply (Octet 28 - Bit 1)
          LE Long Term Key Request Neg Reply (Octet 28 - Bit 2)
          LE Read Supported States (Octet 28 - Bit 3)
          LE Receiver Test (Octet 28 - Bit 4)
          LE Transmitter Test (Octet 28 - Bit 5)
          LE Test End (Octet 28 - Bit 6)
          Read Authenticated Payload Timeout (Octet 32 - Bit 4)
          Write Authenticated Payload Timeout (Octet 32 - Bit 5)
          LE Set Data Length (Octet 33 - Bit 6)
          LE Read Suggested Default Data Length (Octet 33 - Bit 7)
          LE Write Suggested Default Data Length (Octet 34 - Bit 0)
          LE Add Device To Resolving List (Octet 34 - Bit 3)
          LE Remove Device From Resolving List (Octet 34 - Bit 4)
          LE Clear Resolving List (Octet 34 - Bit 5)
          LE Read Resolving List Size (Octet 34 - Bit 6)
          LE Set Address Resolution Enable (Octet 35 - Bit 1)
          LE Set Resolvable Private Address Timeout (Octet 35 - Bit 2)
          LE Read Maximum Data Length (Octet 35 - Bit 3)
          LE Read PHY (Octet 35 - Bit 4)
          LE Set Default PHY (Octet 35 - Bit 5)
          LE Set PHY (Octet 35 - Bit 6)
          LE Enhanced Receiver Test (Octet 35 - Bit 7)
          LE Enhanced Transmitter Test (Octet 36 - Bit 0)
          LE Set Advertising Set Random Address (Octet 36 - Bit 1)
          LE Set Extended Advertising Parameters (Octet 36 - Bit 2)
          LE Set Extended Advertising Data (Octet 36 - Bit 3)
          LE Set Extended Scan Response Data (Octet 36 - Bit 4)
          LE Set Extended Advertising Enable (Octet 36 - Bit 5)
          LE Read Maximum Advertising Data Length (Octet 36 - Bit 6)
          LE Read Number of Supported Advertising Sets (Octet 36 - Bit 7)
          LE Remove Advertising Set (Octet 37 - Bit 0)
          LE Clear Advertising Sets (Octet 37 - Bit 1)
          LE Set Periodic Advertising Parameters (Octet 37 - Bit 2)
          LE Set Periodic Advertising Data (Octet 37 - Bit 3)
          LE Set Periodic Advertising Enable (Octet 37 - Bit 4)
          LE Set Extended Scan Parameters (Octet 37 - Bit 5)
          LE Set Extended Scan Enable (Octet 37 - Bit 6)
          LE Extended Create Connection (Octet 37 - Bit 7)
          LE Periodic Advertising Create Sync (Octet 38 - Bit 0)
          LE Periodic Advertising Create Sync Cancel (Octet 38 - Bit 1)
          LE Periodic Advertising Terminate Sync (Octet 38 - Bit 2)
          LE Add Device To Periodic Advertiser List (Octet 38 - Bit 3)
          LE Remove Device From Periodic Advertiser List (Octet 38 - Bit 4)
          LE Clear Periodic Advertiser List (Octet 38 - Bit 5)
          LE Read Periodic Advertiser List Size (Octet 38 - Bit 6)
          LE Read Transmit Power (Octet 38 - Bit 7)
          LE Read RF Path Compensation (Octet 39 - Bit 0)
          LE Write RF Path Compensation (Octet 39 - Bit 1)
          LE Set Privacy Mode (Octet 39 - Bit 2)
          LE Periodic Advertising Receive Enable (Octet 40 - Bit 5)
          LE Periodic Advertising Sync Transfer (Octet 40 - Bit 6)
          LE Periodic Advertising Set Info Transfer (Octet 40 - Bit 7)
          LE Periodic Advertising Sync Transfer Parameters (Octet 41 - Bit 0)
          LE Set Default Periodic Advertisng Sync Transfer Parameters (Octet 41 - Bit 1)
          LE Read Buffer v2 (Octet 41 - Bit 5)
          LE Read ISO TX Sync (Octet 41 - Bit 6)
          LE Set Connected Isochronous Group Parameters (Octet 41 - Bit 7)
          LE Set Connected Isochronous Group Parameters Test (Octet 42 - Bit 0)
          LE Create Connected Isochronous Stream (Octet 42 - Bit 1)
          LE Remove Connected Isochronous Group (Octet 42 - Bit 2)
          LE Accept Connected Isochronous Stream Request (Octet 42 - Bit 3)
          LE Reject Connected Isochronous Stream Request (Octet 42 - Bit 4)
          LE Create Broadcast Isochronous Group (Octet 42 - Bit 5)
          LE Create Broadcast Isochronous Group Test (Octet 42 - Bit 6)
          LE Terminate Broadcast Isochronous Group (Octet 42 - Bit 7)
          LE Broadcast Isochronous Group Create Sync (Octet 43 - Bit 0)
          LE Broadcast Isochronous Group Terminate Sync (Octet 43 - Bit 1)
          LE Request Peer SCA (Octet 43 - Bit 2)
          LE Setup Isochronous Data Path (Octet 43 - Bit 3)
          LE Remove Isochronous Data Path (Octet 43 - Bit 4)
          LE Isochronous Transmit Test (Octet 43 - Bit 5)
          LE Isochronous Receive Test (Octet 43 - Bit 6)
          LE Isochronous Read Test Counters (Octet 43 - Bit 7)
          LE Isochronous Read Test Counters (Octet 44 - Bit 0)
          LE Set Host Feature (Octet 44 - Bit 1)
          Octet 44 - Bit 2 
          Octet 45 - Bit 6 
          Octet 46 - Bit 0 
          Octet 46 - Bit 1 
          Octet 46 - Bit 2 
< HCI Command: Host Buffer Size (0x03|0x0033) plen 7         #9 [hci1] 1.114313
        ACL MTU: 255  ACL max packet: 16
        SCO MTU: 0    SCO max packet: 0
> HCI Event: Command Complete (0x0e) plen 4                 #10 [hci1] 1.114806
      Host Buffer Size (0x03|0x0033) ncmd 1
        Status: Success (0x00)
< HCI Command: Set Controller To Ho.. (0x03|0x0031) plen 1  #11 [hci1] 1.134310
        Flow control: ACL Data Packets (0x01)
> HCI Event: Command Complete (0x0e) plen 4                 #12 [hci1] 1.134819
      Set Controller To Host Flow Control (0x03|0x0031) ncmd 1
        Status: Success (0x00)
< HCI Command: LE Read Local Suppor.. (0x08|0x0003) plen 0  #13 [hci1] 1.154320
> HCI Event: Command Complete (0x0e) plen 12                #14 [hci1] 1.154840
      LE Read Local Supported Features (0x08|0x0003) ncmd 1
        Status: Success (0x00)
        Features: 0xfd 0x79 0x00 0xf7 0x30 0x01 0x00 0x00
          LE Encryption
          Extended Reject Indication
          Peripheral-initiated Features Exchange
          LE Ping
          LE Data Packet Length Extension
          LL Privacy
          Extended Scanner Filter Policies
          LE 2M PHY
          LE Coded PHY
          LE Extended Advertising
          LE Periodic Advertising
          Channel Selection Algorithm #2
          Periodic Advertising Sync Transfer - Sender
          Periodic Advertising Sync Transfer - Recipient
          Sleep Clock Accuracy Updates
          Connected Isochronous Stream - Central
          Connected Isochronous Stream - Peripheral
          Isochronous Broadcaster
          Synchronized Receiver
          Periodic Advertising ADI support
          Connection Subrating
          Unknown features (0x0000010000000000)
< HCI Command: LE Set Host Feature (0x08|0x0074) plen 2     #15 [hci1] 1.174304
        Bit Number: 32
          Connected Isochronous Stream (Host Support)
        Bit Value: 1
> HCI Event: Command Complete (0x0e) plen 4                 #16 [hci1] 1.174687
      LE Set Host Feature (0x08|0x0074) ncmd 1
        Status: Success (0x00)
< HCI Command: LE Read Buffer v2 (0x08|0x0060) plen 0       #17 [hci1] 1.194295
> HCI Event: Command Complete (0x0e) plen 10                #18 [hci1] 1.194752
      LE Read Buffer v2 (0x08|0x0060) ncmd 1
        Status: Success (0x00)
        ACL MTU: 27
        ACL max packet: 3
        ISO MTU: 318
        ISO max packet: 3
< HCI Command: LE Read Maximum Adve.. (0x08|0x003a) plen 0  #19 [hci1] 1.214329
> HCI Event: Command Complete (0x0e) plen 6                 #20 [hci1] 1.214821
      LE Read Maximum Advertising Data Length (0x08|0x003a) ncmd 1
        Status: Success (0x00)
        Max length: 1650
< HCI Command: LE Read Supported St.. (0x08|0x001c) plen 0  #21 [hci1] 1.234297
> HCI Event: Command Complete (0x0e) plen 12                #22 [hci1] 1.234766
      LE Read Supported States (0x08|0x001c) ncmd 1
        Status: Success (0x00)
        States: 0x000003ff3e0306ff
          Non-connectable Advertising State
          Scannable Advertising State
          Connectable Advertising State
          High Duty Cycle Directed Advertising State
          Passive Scanning State
          Active Scanning State
          Initiating State
            and Connection State (Central Role)
          Connection State (Peripheral Role)
          Scannable Advertising State
            and Passive Scanning State
          Connectable Advertising State
            and Passive Scanning State
          Non-connectable Advertising State
            and Initiating State
          Scannable Advertising State
            and Initiating State
          Active Scanning State
            and Connection State (Central Role)
          Passive Scanning State
            and Connection State (Peripheral Role)
          Active Scanning State
            and Connection State (Peripheral Role)
          Initiating State
            and Connection State (Central Role)
            and Central Role & Central Role
          Low Duty Cycle Directed Advertising State
          Connectable Advertising State
            and Initiating State
            and Central Role & Peripheral Role
          High Duty Cycle Directed Advertising State
            and Initiating State
            and Central Role & Peripheral Role
          Low Duty Cycle Directed Advertising State
            and Initiating State
            and Central Role & Peripheral Role
          Connectable Advertising State
            and Connection State (Central Role)
            and Central Role & Peripheral Role
          High Duty Cycle Directed Advertising State
            and Connection State (Central Role)
            and Central Role & Peripheral Role
          Low Duty Cycle Directed Advertising State
            and Connection State (Central Role)
            and Central Role & Peripheral Role
          Connectable Advertising State
            and Connection State (Peripheral Role)
            and Central Role & Peripheral Role
          High Duty Cycle Directed Advertising State
            and Connection State (Peripheral Role)
            and Peripheral Role & Peripheral Role
          Low Duty Cycle Directed Advertising State
            and Connection State (Peripheral Role)
            and Peripheral Role & Peripheral Role
          Initiating State
            and Connection State (Peripheral Role)
            and Central Role & Peripheral Role
< HCI Command: LE Read Maximum Data.. (0x08|0x002f) plen 0  #23 [hci1] 1.254293
> HCI Event: Command Complete (0x0e) plen 12                #24 [hci1] 1.254807
      LE Read Maximum Data Length (0x08|0x002f) ncmd 1
        Status: Success (0x00)
        Max TX octets: 251
        Max TX time: 2704
        Max RX octets: 251
        Max RX time: 2704
< HCI Command: LE Write Suggested D.. (0x08|0x0024) plen 4  #25 [hci1] 1.274317
        TX octets: 251
        TX time: 2704
> HCI Event: Command Complete (0x0e) plen 4                 #26 [hci1] 1.274769
      LE Write Suggested Default Data Length (0x08|0x0024) ncmd 1
        Status: Success (0x00)
< HCI Command: LE Read Resolving Li.. (0x08|0x002a) plen 0  #27 [hci1] 1.294297
> HCI Event: Command Complete (0x0e) plen 5                 #28 [hci1] 1.294756
      LE Read Resolving List Size (0x08|0x002a) ncmd 1
        Status: Success (0x00)
        Size: 8
< HCI Command: LE Set Event Mask (0x08|0x0001) plen 8       #29 [hci1] 1.314288
        Mask: 0x000002023f87fa5e
          LE Advertising Report
          LE Connection Update Complete
          LE Read Remote Used Features Complete
          LE Long Term Key Request
          LE Data Length Change
          LE Enhanced Connection Complete
          LE PHY Update Complete
          LE Extended Advertising Report
          LE Periodic Advertising Sync Established
          LE Periodic Advertising Report
          LE Periodic Advertising Sync Lost
          LE Extended Scan Timeout
          LE Extended Advertising Set Terminated
          LE Scan Request Received
          LE Periodic Advertising Sync Transfer Rvc
          LE CIS Established
          LE CIS Request
          LE Create BIG Complete
          LE Terminate BIG Complete
          LE BIG Sync Estabilished Complete
          LE BIG Sync Lost
          LE BIG Info Advertising Report
          Unknown mask (0x0000020000000000)
> HCI Event: Command Complete (0x0e) plen 4                 #30 [hci1] 1.314776
      LE Set Event Mask (0x08|0x0001) ncmd 1
        Status: Success (0x00)
< HCI Command: Set Event Mask (0x03|0x0001) plen 8          #31 [hci1] 1.334300
        Mask: 0x2000800002008890
          Disconnection Complete
          Encryption Change
          Read Remote Version Information Complete
          Hardware Error
          Data Buffer Overflow
          Encryption Key Refresh Complete
          LE Meta
> HCI Event: Command Complete (0x0e) plen 4                 #32 [hci1] 1.334904
      Set Event Mask (0x03|0x0001) ncmd 1
        Status: Success (0x00)
< HCI Command: Read BD ADDR (0x04|0x0009) plen 0            #33 [hci1] 1.354308
> HCI Event: Command Complete (0x0e) plen 10                #34 [hci1] 1.354773
      Read BD ADDR (0x04|0x0009) ncmd 1
        Status: Success (0x00)
        Address: 00:00:00:00:00:00 (OUI 00-00-00)
< HCI Command: LE Set Random Address (0x08|0x0005) plen 6   #35 [hci1] 1.374313
        Address: D5:B6:CC:31:DB:3B (Static)
> HCI Event: Command Complete (0x0e) plen 4                 #36 [hci1] 1.374906
      LE Set Random Address (0x08|0x0005) ncmd 1
        Status: Success (0x00)
< HCI Command: LE Set Extended Adv.. (0x08|0x0036) plen 25  #37 [hci1] 3.974990
        Handle: 0x00
        Properties: 0x0013
          Connectable
          Scannable
          Use legacy advertising PDUs: ADV_IND
        Min advertising interval: 100.000 msec (0x00a0)
        Max advertising interval: 150.000 msec (0x00f0)
        Channel map: 37, 38, 39 (0x07)
        Own address type: Random (0x01)
        Peer address type: Public (0x00)
        Peer address: 00:00:00:00:00:00 (OUI 00-00-00)
        Filter policy: Allow Scan Request from Any, Allow Connect Request from Any (0x00)
        TX power: Host has no preference (0x7f)
        Primary PHY: LE 1M (0x01)
        Secondary max skip: 0x00
        Secondary PHY: LE 1M (0x01)
        SID: 0x00
        Scan request notifications: Disabled (0x00)
> HCI Event: Command Complete (0x0e) plen 5                 #38 [hci1] 3.975775
      LE Set Extended Advertising Parameters (0x08|0x0036) ncmd 1
        Status: Success (0x00)
        TX power (selected): 0 dbm (0x00)
< HCI Command: LE Set Advertising S.. (0x08|0x0035) plen 7  #39 [hci1] 3.994367
        Advertising handle: 0x00
        Advertising random address: D5:B6:CC:31:DB:3B (Static)
> HCI Event: Command Complete (0x0e) plen 4                 #40 [hci1] 3.994939
      LE Set Advertising Set Random Address (0x08|0x0035) ncmd 1
        Status: Success (0x00)
< HCI Command: LE Set Extended Adv.. (0x08|0x0037) plen 22  #41 [hci1] 4.014329
        Handle: 0x00
        Operation: Complete extended advertising data (0x03)
        Fragment preference: Minimize fragmentation (0x01)
        Data length: 0x12
        Flags: 0x06
          LE General Discoverable Mode
          BR/EDR Not Supported
        Name (complete): Tester_F6B11A
> HCI Event: Command Complete (0x0e) plen 4                 #42 [hci1] 4.015034
      LE Set Extended Advertising Data (0x08|0x0037) ncmd 1
        Status: Success (0x00)
< HCI Command: LE Set Extended Scan.. (0x08|0x0038) plen 4  #43 [hci1] 4.034358
        Handle: 0x00
        Operation: Complete scan response data (0x03)
        Fragment preference: Minimize fragmentation (0x01)
        Data length: 0x00
> HCI Event: Command Complete (0x0e) plen 4                 #44 [hci1] 4.034955
      LE Set Extended Scan Response Data (0x08|0x0038) ncmd 1
        Status: Success (0x00)
< HCI Command: LE Set Extended Adve.. (0x08|0x0039) plen 6  #45 [hci1] 4.054353
        Extended advertising: Enabled (0x01)
        Number of sets: 1 (0x01)
        Entry 0
          Handle: 0x00
          Duration: 0 ms (0x00)
          Max ext adv events: 0
> HCI Event: Command Complete (0x0e) plen 4                 #46 [hci1] 4.055015
      LE Set Extended Advertising Enable (0x08|0x0039) ncmd 1
        Status: Success (0x00)
> HCI Event: LE Meta Event (0x3e) plen 31                   #47 [hci1] 4.166272
      LE Enhanced Connection Complete (0x0a)
        Status: Success (0x00)
        Handle: 687
        Role: Peripheral (0x01)
        Peer address type: Public (0x00)
        Peer address: DF:A9:FF:F6:B1:1A (OUI DF-A9-FF)
        Local resolvable private address: 00:00:00:00:00:00 (Non-Resolvable)
        Peer resolvable private address: 00:00:00:00:00:00 (Non-Resolvable)
        Connection interval: 87.50 msec (0x0046)
        Connection latency: 0 (0x0000)
        Supervision timeout: 25120 msec (0x09d0)
        Central clock accuracy: 0x01
> HCI Event: LE Meta Event (0x3e) plen 6                    #48 [hci1] 4.166396
      LE Advertising Set Terminated (0x12)
        Status: Success (0x00)
        Handle: 0
        Connection handle: 687
        Number of completed extended advertising events: 0
< HCI Command: LE Read Remote Used... (0x08|0x0016) plen 2  #49 [hci1] 4.175563
        Handle: 687 Address: DF:A9:FF:F6:B1:1A (OUI DF-A9-FF)
< ACL Data TX: Handle 687 flags 0x00 dlen 7                 #50 [hci1] 4.175586
      ATT: Exchange MTU Request (0x02) len 2
        Client RX MTU: 251
> HCI Event: Command Status (0x0f) plen 4                   #51 [hci1] 4.176268
      LE Read Remote Used Features (0x08|0x0016) ncmd 1
        Status: Success (0x00)
> HCI Event: Number of Completed Packets (0x13) plen 5      #52 [hci1] 4.342208
        Num handles: 1
        Handle: 687 Address: DF:A9:FF:F6:B1:1A (OUI DF-A9-FF)
        Count: 1
        #50: len 7 (0 Kb/s)
        Latency: 166 msec (166-166 msec ~166 msec)
> HCI Event: LE Meta Event (0x3e) plen 12                   #53 [hci1] 4.430095
      LE Read Remote Used Features (0x04)
        Status: Success (0x00)
        Handle: 687 Address: DF:A9:FF:F6:B1:1A (OUI DF-A9-FF)
        Features: 0x2d 0x49 0x00 0xf7 0x67 0xd9 0x00 0x80
          LE Encryption
          Extended Reject Indication
          Peripheral-initiated Features Exchange
          LE Data Packet Length Extension
          LE 2M PHY
          LE Coded PHY
          Channel Selection Algorithm #2
          Periodic Advertising Sync Transfer - Sender
          Periodic Advertising Sync Transfer - Recipient
          Sleep Clock Accuracy Updates
          Connected Isochronous Stream - Central
          Connected Isochronous Stream - Peripheral
          Isochronous Broadcaster
          Synchronized Receiver
          Connected Isochronous Stream (Host Support)
          LE Power Control Request
          LE Power Control Request
          Connection Subrating
          Connection Subrating (Host Support)
          Unknown features (0x8000d90000000000)
> ACL Data RX: Handle 687 flags 0x02 dlen 11                #54 [hci1] 6.879705
      SMP: Pairing Request (0x01) len 6
        IO capability: KeyboardDisplay (0x04)
        OOB data: Authentication data not present (0x00)
        Authentication requirement: Bonding, MITM, SC, No Keypresses (0x0d)
        Max encryption key size: 16
        Initiator key distribution: EncKey IdKey (0x03)
        Responder key distribution: EncKey IdKey Sign (0x07)
> ACL Data RX: Handle 687 flags 0x02 dlen 7                 #55 [hci1] 6.880157
      ATT: Exchange MTU Response (0x03) len 2
        Server RX MTU: 23
< HCI Command: Host Number of Compl.. (0x03|0x0035) plen 5  #56 [hci1] 6.894960
        Num handles: 1
        Handle: 687 Address: DF:A9:FF:F6:B1:1A (OUI DF-A9-FF)
        Count: 1
< ACL Data TX: Handle 687 flags 0x00 dlen 11                #57 [hci1] 6.895080
      SMP: Pairing Response (0x02) len 6
        IO capability: DisplayOnly (0x00)
        OOB data: Authentication data not present (0x00)
        Authentication requirement: Bonding, No MITM, SC, No Keypresses (0x09)
        Max encryption key size: 16
        Initiator key distribution: IdKey (0x02)
        Responder key distribution: <none> (0x00)
< HCI Command: Host Number of Compl.. (0x03|0x0035) plen 5  #58 [hci1] 6.895577
        Num handles: 1
        Handle: 687 Address: DF:A9:FF:F6:B1:1A (OUI DF-A9-FF)
        Count: 1
> HCI Event: Number of Completed Packets (0x13) plen 5      #59 [hci1] 7.054856
        Num handles: 1
        Handle: 687 Address: DF:A9:FF:F6:B1:1A (OUI DF-A9-FF)
        Count: 1
        #57: len 11 (0 Kb/s)
        Latency: 159 msec (159-166 msec ~163 msec)
> ACL Data RX: Handle 687 flags 0x02 dlen 27                #60 [hci1] 7.055182
> ACL Data RX: Handle 687 flags 0x01 dlen 27                #61 [hci1] 7.055710
> ACL Data RX: Handle 687 flags 0x01 dlen 15                #62 [hci1] 7.056099
      SMP: Pairing Public Key (0x0c) len 64
        X: 415b72bb27f1469bc1e7a9100647cb12b040c6969bcc46f2f8e8b7cbd493b783
        Y: 89ccd7b0574fd61c276d1e2f94029680a77b0b892e0904022f6739d32b989093
< HCI Command: Host Number of Compl.. (0x03|0x0035) plen 5  #63 [hci1] 7.075218
        Num handles: 1
        Handle: 687 Address: DF:A9:FF:F6:B1:1A (OUI DF-A9-FF)
        Count: 1
< HCI Command: Host Number of Compl.. (0x03|0x0035) plen 5  #64 [hci1] 7.075309
        Num handles: 1
        Handle: 687 Address: DF:A9:FF:F6:B1:1A (OUI DF-A9-FF)
        Count: 1
< HCI Command: Host Number of Compl.. (0x03|0x0035) plen 5  #65 [hci1] 7.075773
        Num handles: 1
        Handle: 687 Address: DF:A9:FF:F6:B1:1A (OUI DF-A9-FF)
        Count: 1
< ACL Data TX: Handle 687 flags 0x00 dlen 27                #66 [hci1] 7.075835
< ACL Data TX: Handle 687 flags 0x01 dlen 27                #67 [hci1] 7.075854
< ACL Data TX: Handle 687 flags 0x01 dlen 15                #68 [hci1] 7.075885
      SMP: Pairing Public Key (0x0c) len 64
        X: 98308440221e2d910f0e54b71e7ec652857aa9b5a0dc65028824cc19db1226e9
        Y: 67a4816bcb62efb21701e31fdb27561a6217575fb007a8bbdabe7e28b6f68482
> HCI Event: Number of Completed Packets (0x13) plen 5      #69 [hci1] 7.142763
        Num handles: 1
        Handle: 687 Address: DF:A9:FF:F6:B1:1A (OUI DF-A9-FF)
        Count: 1
        #66: len 27 (3 Kb/s)
        Latency: 66 msec (66-166 msec ~115 msec)
> HCI Event: Number of Completed Packets (0x13) plen 5      #70 [hci1] 7.143388
        Num handles: 1
        Handle: 687 Address: DF:A9:FF:F6:B1:1A (OUI DF-A9-FF)
        Count: 1
        #67: len 27 (3 Kb/s)
        Latency: 67 msec (66-166 msec ~91 msec)
> HCI Event: Number of Completed Packets (0x13) plen 5      #71 [hci1] 7.229571
        Num handles: 1
        Handle: 687 Address: DF:A9:FF:F6:B1:1A (OUI DF-A9-FF)
        Count: 1
        #68: len 15 (0 Kb/s)
        Latency: 153 msec (66-166 msec ~122 msec)
> ACL Data RX: Handle 687 flags 0x02 dlen 21                #72 [hci1] 8.192393
      SMP: Pairing Confirm (0x03) len 16
        Confim value: 5da20215d70581dcc12b3c3d87352b29
< HCI Command: Host Number of Compl.. (0x03|0x0035) plen 5  #73 [hci1] 8.194691
        Num handles: 1
        Handle: 687 Address: DF:A9:FF:F6:B1:1A (OUI DF-A9-FF)
        Count: 1
< ACL Data TX: Handle 687 flags 0x00 dlen 21                #74 [hci1] 8.194773
      SMP: Pairing Confirm (0x03) len 16
        Confim value: 23bbcb855ef451b889674c78604726be
> HCI Event: Number of Completed Packets (0x13) plen 5      #75 [hci1] 8.367306
        Num handles: 1
        Handle: 687 Address: DF:A9:FF:F6:B1:1A (OUI DF-A9-FF)
        Count: 1
        #74: len 21 (0 Kb/s)
        Latency: 172 msec (66-172 msec ~147 msec)
> ACL Data RX: Handle 687 flags 0x02 dlen 21                #76 [hci1] 8.367603
      SMP: Pairing Random (0x04) len 16
        Random value: b11f3a72b5b7c6270000000000000000
< HCI Command: Host Number of Compl.. (0x03|0x0035) plen 5  #77 [hci1] 8.375166
        Num handles: 1
        Handle: 687 Address: DF:A9:FF:F6:B1:1A (OUI DF-A9-FF)
        Count: 1
< ACL Data TX: Handle 687 flags 0x00 dlen 21                #78 [hci1] 8.375340
      SMP: Pairing Random (0x04) len 16
        Random value: 8e6108f966a694cbe26df70bb96773e6
> HCI Event: Number of Completed Packets (0x13) plen 5      #79 [hci1] 8.542067
        Num handles: 1
        Handle: 687 Address: DF:A9:FF:F6:B1:1A (OUI DF-A9-FF)
        Count: 1
        #78: len 21 (1 Kb/s)
        Latency: 166 msec (66-172 msec ~157 msec)
> ACL Data RX: Handle 687 flags 0x02 dlen 21                #80 [hci1] 8.629871
      SMP: Pairing Confirm (0x03) len 16
        Confim value: 38327050cf3b8cb5589db3d94a4effb1
< HCI Command: Host Number of Compl.. (0x03|0x0035) plen 5  #81 [hci1] 8.634604
        Num handles: 1
        Handle: 687 Address: DF:A9:FF:F6:B1:1A (OUI DF-A9-FF)
        Count: 1
< ACL Data TX: Handle 687 flags 0x00 dlen 21                #82 [hci1] 8.634701
      SMP: Pairing Confirm (0x03) len 16
        Confim value: f59362531355c64e182b25a3ae51e5c4
> HCI Event: Number of Completed Packets (0x13) plen 5      #83 [hci1] 8.804867
        Num handles: 1
        Handle: 687 Address: DF:A9:FF:F6:B1:1A (OUI DF-A9-FF)
        Count: 1
        #82: len 21 (0 Kb/s)
        Latency: 170 msec (66-172 msec ~163 msec)
> ACL Data RX: Handle 687 flags 0x02 dlen 21                #84 [hci1] 8.805096
      SMP: Pairing Random (0x04) len 16
        Random value: 33a67af20d8554680000000000000000
< HCI Command: Host Number of Compl.. (0x03|0x0035) plen 5  #85 [hci1] 8.815226
        Num handles: 1
        Handle: 687 Address: DF:A9:FF:F6:B1:1A (OUI DF-A9-FF)
        Count: 1
< ACL Data TX: Handle 687 flags 0x00 dlen 21                #86 [hci1] 8.815382
      SMP: Pairing Random (0x04) len 16
        Random value: 4d02679f89a05211af56d8b3da64d21e
> HCI Event: Number of Completed Packets (0x13) plen 5      #87 [hci1] 8.979629
        Num handles: 1
        Handle: 687 Address: DF:A9:FF:F6:B1:1A (OUI DF-A9-FF)
        Count: 1
        #86: len 21 (1 Kb/s)
        Latency: 164 msec (66-172 msec ~163 msec)
> ACL Data RX: Handle 687 flags 0x02 dlen 21                #88 [hci1] 9.067356
      SMP: Pairing Confirm (0x03) len 16
        Confim value: 07c9054e094884b4176e9cc8d2752c49
< HCI Command: Host Number of Compl.. (0x03|0x0035) plen 5  #89 [hci1] 9.074568
        Num handles: 1
        Handle: 687 Address: DF:A9:FF:F6:B1:1A (OUI DF-A9-FF)
        Count: 1
< ACL Data TX: Handle 687 flags 0x00 dlen 21                #90 [hci1] 9.074580
      SMP: Pairing Confirm (0x03) len 16
        Confim value: 632ccfc2129cd07fdb2ec376610a6ad8
> HCI Event: Number of Completed Packets (0x13) plen 5      #91 [hci1] 9.242270
        Num handles: 1
        Handle: 687 Address: DF:A9:FF:F6:B1:1A (OUI DF-A9-FF)
        Count: 1
        #90: len 21 (1 Kb/s)
        Latency: 167 msec (66-172 msec ~165 msec)
> ACL Data RX: Handle 687 flags 0x02 dlen 21                #92 [hci1] 9.242585
      SMP: Pairing Random (0x04) len 16
        Random value: 2393ab46521383a70000000000000000
< HCI Command: Host Number of Compl.. (0x03|0x0035) plen 5  #93 [hci1] 9.255349
        Num handles: 1
        Handle: 687 Address: DF:A9:FF:F6:B1:1A (OUI DF-A9-FF)
        Count: 1
< ACL Data TX: Handle 687 flags 0x00 dlen 21                #94 [hci1] 9.255468
      SMP: Pairing Random (0x04) len 16
        Random value: 5e8286bc235a02440d0c3424a2acf8fd
> HCI Event: Number of Completed Packets (0x13) plen 5      #95 [hci1] 9.416991
        Num handles: 1
        Handle: 687 Address: DF:A9:FF:F6:B1:1A (OUI DF-A9-FF)
        Count: 1
        #94: len 21 (1 Kb/s)
        Latency: 161 msec (66-172 msec ~163 msec)
> ACL Data RX: Handle 687 flags 0x02 dlen 21                #96 [hci1] 9.505001
      SMP: Pairing Confirm (0x03) len 16
        Confim value: a1ddb2d26e8c658203b102151f2130b6
< HCI Command: Host Number of Compl.. (0x03|0x0035) plen 5  #97 [hci1] 9.515031
        Num handles: 1
        Handle: 687 Address: DF:A9:FF:F6:B1:1A (OUI DF-A9-FF)
        Count: 1
< ACL Data TX: Handle 687 flags 0x00 dlen 21                #98 [hci1] 9.515212
      SMP: Pairing Confirm (0x03) len 16
        Confim value: ff12eb283ed6661228207a1c29d4ae59
> HCI Event: Number of Completed Packets (0x13) plen 5      #99 [hci1] 9.679726
        Num handles: 1
        Handle: 687 Address: DF:A9:FF:F6:B1:1A (OUI DF-A9-FF)
        Count: 1
        #98: len 21 (1 Kb/s)
        Latency: 164 msec (66-172 msec ~164 msec)
> ACL Data RX: Handle 687 flags 0x02 dlen 21               #100 [hci1] 9.680072
      SMP: Pairing Random (0x04) len 16
        Random value: 62bd0cb8e692fa4e0000000000000000
< HCI Command: Host Number of Comp.. (0x03|0x0035) plen 5  #101 [hci1] 9.695323
        Num handles: 1
        Handle: 687 Address: DF:A9:FF:F6:B1:1A (OUI DF-A9-FF)
        Count: 1
< ACL Data TX: Handle 687 flags 0x00 dlen 21               #102 [hci1] 9.695415
      SMP: Pairing Random (0x04) len 16
        Random value: 5c4a1bcadd27bd58e945097b00bad7ac
> HCI Event: Number of Completed Packets (0x13) plen 5     #103 [hci1] 9.854549
        Num handles: 1
        Handle: 687 Address: DF:A9:FF:F6:B1:1A (OUI DF-A9-FF)
        Count: 1
        #102: len 21 (1 Kb/s)
        Latency: 159 msec (66-172 msec ~161 msec)
> ACL Data RX: Handle 687 flags 0x02 dlen 21               #104 [hci1] 9.942382
      SMP: Pairing Confirm (0x03) len 16
        Confim value: a6d1d75b74006f319069496855b85756
< HCI Command: Host Number of Comp.. (0x03|0x0035) plen 5  #105 [hci1] 9.955108
        Num handles: 1
        Handle: 687 Address: DF:A9:FF:F6:B1:1A (OUI DF-A9-FF)
        Count: 1
< ACL Data TX: Handle 687 flags 0x00 dlen 21               #106 [hci1] 9.955235
      SMP: Pairing Confirm (0x03) len 16
        Confim value: 2ff71bb8f0d5a2ba2ad346fd52e595f3
> HCI Event: Number of Completed Packets (0x13) plen 5    #107 [hci1] 10.117256
        Num handles: 1
        Handle: 687 Address: DF:A9:FF:F6:B1:1A (OUI DF-A9-FF)
        Count: 1
        #106: len 21 (1 Kb/s)
        Latency: 162 msec (66-172 msec ~161 msec)
> ACL Data RX: Handle 687 flags 0x02 dlen 21              #108 [hci1] 10.117564
      SMP: Pairing Random (0x04) len 16
        Random value: 422a159a4a4d44660000000000000000
< HCI Command: Host Number of Com.. (0x03|0x0035) plen 5  #109 [hci1] 10.135284
        Num handles: 1
        Handle: 687 Address: DF:A9:FF:F6:B1:1A (OUI DF-A9-FF)
        Count: 1
< ACL Data TX: Handle 687 flags 0x00 dlen 21              #110 [hci1] 10.135465
      SMP: Pairing Random (0x04) len 16
        Random value: 32527e6e64e79f33b2e374394db8ab2d
> HCI Event: Number of Completed Packets (0x13) plen 5    #111 [hci1] 10.292075
        Num handles: 1
        Handle: 687 Address: DF:A9:FF:F6:B1:1A (OUI DF-A9-FF)
        Count: 1
        #110: len 21 (1 Kb/s)
        Latency: 156 msec (66-172 msec ~159 msec)
> ACL Data RX: Handle 687 flags 0x02 dlen 21              #112 [hci1] 10.379929
      SMP: Pairing Confirm (0x03) len 16
        Confim value: 83c3a0e20fe4044b6e552c2b5d3c3a9b
< HCI Command: Host Number of Com.. (0x03|0x0035) plen 5  #113 [hci1] 10.394979
        Num handles: 1
        Handle: 687 Address: DF:A9:FF:F6:B1:1A (OUI DF-A9-FF)
        Count: 1
< ACL Data TX: Handle 687 flags 0x00 dlen 21              #114 [hci1] 10.395119
      SMP: Pairing Confirm (0x03) len 16
        Confim value: 0a7546cf00c28661394f9a50fdacca8b
> HCI Event: Number of Completed Packets (0x13) plen 5    #115 [hci1] 10.554706
        Num handles: 1
        Handle: 687 Address: DF:A9:FF:F6:B1:1A (OUI DF-A9-FF)
        Count: 1
        #114: len 21 (1 Kb/s)
        Latency: 159 msec (66-172 msec ~159 msec)
> ACL Data RX: Handle 687 flags 0x02 dlen 21              #116 [hci1] 10.555043
      SMP: Pairing Random (0x04) len 16
        Random value: 94314ab32093e2da0000000000000000
< HCI Command: Host Number of Com.. (0x03|0x0035) plen 5  #117 [hci1] 10.575316
        Num handles: 1
        Handle: 687 Address: DF:A9:FF:F6:B1:1A (OUI DF-A9-FF)
        Count: 1
< ACL Data TX: Handle 687 flags 0x00 dlen 21              #118 [hci1] 10.575512
      SMP: Pairing Random (0x04) len 16
        Random value: dddbdfe2838e9a8cc6964353c850fef7
> HCI Event: Number of Completed Packets (0x13) plen 5    #119 [hci1] 10.729550
        Num handles: 1
        Handle: 687 Address: DF:A9:FF:F6:B1:1A (OUI DF-A9-FF)
        Count: 1
        #118: len 21 (1 Kb/s)
        Latency: 154 msec (66-172 msec ~156 msec)
> ACL Data RX: Handle 687 flags 0x02 dlen 21              #120 [hci1] 10.817494
      SMP: Pairing Confirm (0x03) len 16
        Confim value: 2ea5ed251c9bb2f5c7d49ba509020e4e
< HCI Command: Host Number of Com.. (0x03|0x0035) plen 5  #121 [hci1] 10.834863
        Num handles: 1
        Handle: 687 Address: DF:A9:FF:F6:B1:1A (OUI DF-A9-FF)
        Count: 1
< ACL Data TX: Handle 687 flags 0x00 dlen 21              #122 [hci1] 10.834994
      SMP: Pairing Confirm (0x03) len 16
        Confim value: d7e59dc7512d83bdaaa50d9777d810fa
> HCI Event: Number of Completed Packets (0x13) plen 5    #123 [hci1] 10.992188
        Num handles: 1
        Handle: 687 Address: DF:A9:FF:F6:B1:1A (OUI DF-A9-FF)
        Count: 1
        #122: len 21 (1 Kb/s)
        Latency: 157 msec (66-172 msec ~156 msec)
> ACL Data RX: Handle 687 flags 0x02 dlen 21              #124 [hci1] 10.992567
      SMP: Pairing Random (0x04) len 16
        Random value: 8eca1ac46cbd6a750000000000000000
< HCI Command: Host Number of Com.. (0x03|0x0035) plen 5  #125 [hci1] 10.994927
        Num handles: 1
        Handle: 687 Address: DF:A9:FF:F6:B1:1A (OUI DF-A9-FF)
        Count: 1
< ACL Data TX: Handle 687 flags 0x00 dlen 21              #126 [hci1] 10.995036
      SMP: Pairing Random (0x04) len 16
        Random value: eb9f1915536596b6fc3db1c86b2b1970
> HCI Event: Number of Completed Packets (0x13) plen 5    #127 [hci1] 11.166986
        Num handles: 1
        Handle: 687 Address: DF:A9:FF:F6:B1:1A (OUI DF-A9-FF)
        Count: 1
        #126: len 21 (0 Kb/s)
        Latency: 171 msec (66-172 msec ~164 msec)
> ACL Data RX: Handle 687 flags 0x02 dlen 21              #128 [hci1] 11.254853
      SMP: Pairing Confirm (0x03) len 16
        Confim value: a6090f2f6c8315bbb1aa46c9a04019b2
< HCI Command: Host Number of Com.. (0x03|0x0035) plen 5  #129 [hci1] 11.274928
        Num handles: 1
        Handle: 687 Address: DF:A9:FF:F6:B1:1A (OUI DF-A9-FF)
        Count: 1
< ACL Data TX: Handle 687 flags 0x00 dlen 21              #130 [hci1] 11.275048
      SMP: Pairing Confirm (0x03) len 16
        Confim value: 9f392b53fa4adeff740fff7447542872
> HCI Event: Number of Completed Packets (0x13) plen 5    #131 [hci1] 11.429712
        Num handles: 1
        Handle: 687 Address: DF:A9:FF:F6:B1:1A (OUI DF-A9-FF)
        Count: 1
        #130: len 21 (1 Kb/s)
        Latency: 154 msec (66-172 msec ~159 msec)
> ACL Data RX: Handle 687 flags 0x02 dlen 21              #132 [hci1] 11.429968
      SMP: Pairing Random (0x04) len 16
        Random value: 90e66b30ec3fc1db0000000000000000
< HCI Command: Host Number of Com.. (0x03|0x0035) plen 5  #133 [hci1] 11.434634
        Num handles: 1
        Handle: 687 Address: DF:A9:FF:F6:B1:1A (OUI DF-A9-FF)
        Count: 1
< ACL Data TX: Handle 687 flags 0x00 dlen 21              #134 [hci1] 11.434708
      SMP: Pairing Random (0x04) len 16
        Random value: 5c794dc9ad9f2c3f295ebd5ad5e1c3cf
> HCI Event: Number of Completed Packets (0x13) plen 5    #135 [hci1] 11.604505
        Num handles: 1
        Handle: 687 Address: DF:A9:FF:F6:B1:1A (OUI DF-A9-FF)
        Count: 1
        #134: len 21 (0 Kb/s)
        Latency: 169 msec (66-172 msec ~164 msec)
> ACL Data RX: Handle 687 flags 0x02 dlen 21              #136 [hci1] 11.692389
      SMP: Pairing Confirm (0x03) len 16
        Confim value: f4c5b1edcad0b015c6f3d6a77bbb3ae5
< HCI Command: Host Number of Com.. (0x03|0x0035) plen 5  #137 [hci1] 11.695089
        Num handles: 1
        Handle: 687 Address: DF:A9:FF:F6:B1:1A (OUI DF-A9-FF)
        Count: 1
< ACL Data TX: Handle 687 flags 0x00 dlen 21              #138 [hci1] 11.695282
      SMP: Pairing Confirm (0x03) len 16
        Confim value: 82c45c866eee96e7524c5d7ac5bc8643
> HCI Event: Number of Completed Packets (0x13) plen 5    #139 [hci1] 11.867202
        Num handles: 1
        Handle: 687 Address: DF:A9:FF:F6:B1:1A (OUI DF-A9-FF)
        Count: 1
        #138: len 21 (0 Kb/s)
        Latency: 171 msec (66-172 msec ~168 msec)
> ACL Data RX: Handle 687 flags 0x02 dlen 21              #140 [hci1] 11.867595
      SMP: Pairing Random (0x04) len 16
        Random value: 8b8bf2d413032c980000000000000000
< HCI Command: Host Number of Com.. (0x03|0x0035) plen 5  #141 [hci1] 11.875308
        Num handles: 1
        Handle: 687 Address: DF:A9:FF:F6:B1:1A (OUI DF-A9-FF)
        Count: 1
< ACL Data TX: Handle 687 flags 0x00 dlen 21              #142 [hci1] 11.875359
      SMP: Pairing Random (0x04) len 16
        Random value: 5c2fff312cdf99c9491988e877355a9a
> HCI Event: Number of Completed Packets (0x13) plen 5    #143 [hci1] 12.042029
        Num handles: 1
        Handle: 687 Address: DF:A9:FF:F6:B1:1A (OUI DF-A9-FF)
        Count: 1
        #142: len 21 (1 Kb/s)
        Latency: 166 msec (66-172 msec ~167 msec)
> ACL Data RX: Handle 687 flags 0x02 dlen 21              #144 [hci1] 12.129823
      SMP: Pairing Confirm (0x03) len 16
        Confim value: ae39f2a9ffa132e5b5cbd0e9150a8679
< HCI Command: Host Number of Com.. (0x03|0x0035) plen 5  #145 [hci1] 12.134600
        Num handles: 1
        Handle: 687 Address: DF:A9:FF:F6:B1:1A (OUI DF-A9-FF)
        Count: 1
< ACL Data TX: Handle 687 flags 0x00 dlen 21              #146 [hci1] 12.134716
      SMP: Pairing Confirm (0x03) len 16
        Confim value: 419891b3695f6c03d8214433dcc38667
> HCI Event: Number of Completed Packets (0x13) plen 5    #147 [hci1] 12.304690
        Num handles: 1
        Handle: 687 Address: DF:A9:FF:F6:B1:1A (OUI DF-A9-FF)
        Count: 1
        #146: len 21 (0 Kb/s)
        Latency: 169 msec (66-172 msec ~168 msec)
> ACL Data RX: Handle 687 flags 0x02 dlen 21              #148 [hci1] 12.305060
      SMP: Pairing Random (0x04) len 16
        Random value: ef1d0a4471349e500000000000000000
< HCI Command: Host Number of Com.. (0x03|0x0035) plen 5  #149 [hci1] 12.315190
        Num handles: 1
        Handle: 687 Address: DF:A9:FF:F6:B1:1A (OUI DF-A9-FF)
        Count: 1
< ACL Data TX: Handle 687 flags 0x00 dlen 21              #150 [hci1] 12.315325
      SMP: Pairing Random (0x04) len 16
        Random value: c629a3a987d808e808655d558dfc1155
> HCI Event: Number of Completed Packets (0x13) plen 5    #151 [hci1] 12.479474
        Num handles: 1
        Handle: 687 Address: DF:A9:FF:F6:B1:1A (OUI DF-A9-FF)
        Count: 1
        #150: len 21 (1 Kb/s)
        Latency: 164 msec (66-172 msec ~166 msec)
> ACL Data RX: Handle 687 flags 0x02 dlen 21              #152 [hci1] 12.567344
      SMP: Pairing Confirm (0x03) len 16
        Confim value: 319ef22d121f804796e4e8cbea7ecc15
< HCI Command: Host Number of Com.. (0x03|0x0035) plen 5  #153 [hci1] 12.574966
        Num handles: 1
        Handle: 687 Address: DF:A9:FF:F6:B1:1A (OUI DF-A9-FF)
        Count: 1
< ACL Data TX: Handle 687 flags 0x00 dlen 21              #154 [hci1] 12.575137
      SMP: Pairing Confirm (0x03) len 16
        Confim value: 18f993a614567898b12c1a14fa1fea0b
> HCI Event: Number of Completed Packets (0x13) plen 5    #155 [hci1] 12.742131
        Num handles: 1
        Handle: 687 Address: DF:A9:FF:F6:B1:1A (OUI DF-A9-FF)
        Count: 1
        #154: len 21 (1 Kb/s)
        Latency: 166 msec (66-172 msec ~166 msec)
> ACL Data RX: Handle 687 flags 0x02 dlen 21              #156 [hci1] 12.742537
      SMP: Pairing Random (0x04) len 16
        Random value: 4f0ef1a8926463fd0000000000000000
< HCI Command: Host Number of Com.. (0x03|0x0035) plen 5  #157 [hci1] 12.755300
        Num handles: 1
        Handle: 687 Address: DF:A9:FF:F6:B1:1A (OUI DF-A9-FF)
        Count: 1
< ACL Data TX: Handle 687 flags 0x00 dlen 21              #158 [hci1] 12.755451
      SMP: Pairing Random (0x04) len 16
        Random value: 92f20f6ad8f13724432c7fd6001c45ff
> HCI Event: Number of Completed Packets (0x13) plen 5    #159 [hci1] 12.916982
        Num handles: 1
        Handle: 687 Address: DF:A9:FF:F6:B1:1A (OUI DF-A9-FF)
        Count: 1
        #158: len 21 (1 Kb/s)
        Latency: 161 msec (66-172 msec ~164 msec)
> ACL Data RX: Handle 687 flags 0x02 dlen 21              #160 [hci1] 13.004813
      SMP: Pairing Confirm (0x03) len 16
        Confim value: 79da03350031ea8f17b4b172026b3459
< HCI Command: Host Number of Com.. (0x03|0x0035) plen 5  #161 [hci1] 13.014687
        Num handles: 1
        Handle: 687 Address: DF:A9:FF:F6:B1:1A (OUI DF-A9-FF)
        Count: 1
< ACL Data TX: Handle 687 flags 0x00 dlen 21              #162 [hci1] 13.014756
      SMP: Pairing Confirm (0x03) len 16
        Confim value: acbf61b45cecd5ac5e4685e2ed24d0f8
> HCI Event: Number of Completed Packets (0x13) plen 5    #163 [hci1] 13.179677
        Num handles: 1
        Handle: 687 Address: DF:A9:FF:F6:B1:1A (OUI DF-A9-FF)
        Count: 1
        #162: len 21 (1 Kb/s)
        Latency: 164 msec (66-172 msec ~164 msec)
> ACL Data RX: Handle 687 flags 0x02 dlen 21              #164 [hci1] 13.180122
      SMP: Pairing Random (0x04) len 16
        Random value: 1a552ea9f1c861160000000000000000
< HCI Command: Host Number of Com.. (0x03|0x0035) plen 5  #165 [hci1] 13.195397
        Num handles: 1
        Handle: 687 Address: DF:A9:FF:F6:B1:1A (OUI DF-A9-FF)
        Count: 1
< ACL Data TX: Handle 687 flags 0x00 dlen 21              #166 [hci1] 13.195554
      SMP: Pairing Random (0x04) len 16
        Random value: 23ac32ebbb5e14c8a6b9622f296d277f
> HCI Event: Number of Completed Packets (0x13) plen 5    #167 [hci1] 13.354379
        Num handles: 1
        Handle: 687 Address: DF:A9:FF:F6:B1:1A (OUI DF-A9-FF)
        Count: 1
        #166: len 21 (1 Kb/s)
        Latency: 158 msec (66-172 msec ~161 msec)
> ACL Data RX: Handle 687 flags 0x02 dlen 21              #168 [hci1] 13.442336
      SMP: Pairing Confirm (0x03) len 16
        Confim value: 6c0fac9fc02fc9dedf9108db40e499c1
< HCI Command: Host Number of Com.. (0x03|0x0035) plen 5  #169 [hci1] 13.455084
        Num handles: 1
        Handle: 687 Address: DF:A9:FF:F6:B1:1A (OUI DF-A9-FF)
        Count: 1
< ACL Data TX: Handle 687 flags 0x00 dlen 21              #170 [hci1] 13.455223
      SMP: Pairing Confirm (0x03) len 16
        Confim value: 494b0c3b0f1cf2bdc2d578331c5971ab
> HCI Event: Number of Completed Packets (0x13) plen 5    #171 [hci1] 13.617157
        Num handles: 1
        Handle: 687 Address: DF:A9:FF:F6:B1:1A (OUI DF-A9-FF)
        Count: 1
        #170: len 21 (1 Kb/s)
        Latency: 161 msec (66-172 msec ~161 msec)
> ACL Data RX: Handle 687 flags 0x02 dlen 21              #172 [hci1] 13.617533
      SMP: Pairing Random (0x04) len 16
        Random value: b8bc1d62597c297e0000000000000000
< HCI Command: Host Number of Com.. (0x03|0x0035) plen 5  #173 [hci1] 13.634823
        Num handles: 1
        Handle: 687 Address: DF:A9:FF:F6:B1:1A (OUI DF-A9-FF)
        Count: 1
< ACL Data TX: Handle 687 flags 0x00 dlen 21              #174 [hci1] 13.634931
      SMP: Pairing Random (0x04) len 16
        Random value: 297efe85e67448a15f56bd27e3a3cf1d
> HCI Event: Number of Completed Packets (0x13) plen 5    #175 [hci1] 13.792040
        Num handles: 1
        Handle: 687 Address: DF:A9:FF:F6:B1:1A (OUI DF-A9-FF)
        Count: 1
        #174: len 21 (1 Kb/s)
        Latency: 157 msec (66-172 msec ~159 msec)
> ACL Data RX: Handle 687 flags 0x02 dlen 21              #176 [hci1] 13.879823
      SMP: Pairing Confirm (0x03) len 16
        Confim value: 7e7557fd89436bd40227b0393e2b9f10
< HCI Command: Host Number of Com.. (0x03|0x0035) plen 5  #177 [hci1] 13.894614
        Num handles: 1
        Handle: 687 Address: DF:A9:FF:F6:B1:1A (OUI DF-A9-FF)
        Count: 1
< ACL Data TX: Handle 687 flags 0x00 dlen 21              #178 [hci1] 13.894677
      SMP: Pairing Confirm (0x03) len 16
        Confim value: 1d8d6fc33a271243fe0157782ccc9cb4
> HCI Event: Number of Completed Packets (0x13) plen 5    #179 [hci1] 14.054768
        Num handles: 1
        Handle: 687 Address: DF:A9:FF:F6:B1:1A (OUI DF-A9-FF)
        Count: 1
        #178: len 21 (1 Kb/s)
        Latency: 160 msec (66-172 msec ~159 msec)
> ACL Data RX: Handle 687 flags 0x02 dlen 21              #180 [hci1] 14.055012
      SMP: Pairing Random (0x04) len 16
        Random value: 3b6120dd78c788510000000000000000
< HCI Command: Host Number of Com.. (0x03|0x0035) plen 5  #181 [hci1] 14.075316
        Num handles: 1
        Handle: 687 Address: DF:A9:FF:F6:B1:1A (OUI DF-A9-FF)
        Count: 1
< ACL Data TX: Handle 687 flags 0x00 dlen 21              #182 [hci1] 14.075483
      SMP: Pairing Random (0x04) len 16
        Random value: 25a9493fd3ce4faf02be7293595bb7c6
> HCI Event: Number of Completed Packets (0x13) plen 5    #183 [hci1] 14.229592
        Num handles: 1
        Handle: 687 Address: DF:A9:FF:F6:B1:1A (OUI DF-A9-FF)
        Count: 1
        #182: len 21 (1 Kb/s)
        Latency: 154 msec (66-172 msec ~156 msec)
> ACL Data RX: Handle 687 flags 0x02 dlen 21              #184 [hci1] 14.317350
      SMP: Pairing Confirm (0x03) len 16
        Confim value: 56916a5fed3d13a62e2136132c325524
< HCI Command: Host Number of Com.. (0x03|0x0035) plen 5  #185 [hci1] 14.335154
        Num handles: 1
        Handle: 687 Address: DF:A9:FF:F6:B1:1A (OUI DF-A9-FF)
        Count: 1
< ACL Data TX: Handle 687 flags 0x00 dlen 21              #186 [hci1] 14.335249
      SMP: Pairing Confirm (0x03) len 16
        Confim value: a08e6bcdc58aeb51bf8c2a22a5cea58e
> HCI Event: Number of Completed Packets (0x13) plen 5    #187 [hci1] 14.492177
        Num handles: 1
        Handle: 687 Address: DF:A9:FF:F6:B1:1A (OUI DF-A9-FF)
        Count: 1
        #186: len 21 (1 Kb/s)
        Latency: 156 msec (66-172 msec ~156 msec)
> ACL Data RX: Handle 687 flags 0x02 dlen 21              #188 [hci1] 14.492500
      SMP: Pairing Random (0x04) len 16
        Random value: f05e600c9f8c06a70000000000000000
< HCI Command: Host Number of Com.. (0x03|0x0035) plen 5  #189 [hci1] 14.495304
        Num handles: 1
        Handle: 687 Address: DF:A9:FF:F6:B1:1A (OUI DF-A9-FF)
        Count: 1
< ACL Data TX: Handle 687 flags 0x00 dlen 21              #190 [hci1] 14.495516
      SMP: Pairing Random (0x04) len 16
        Random value: 58f6b41f855a6f6c3560debd84e2affc
> HCI Event: Number of Completed Packets (0x13) plen 5    #191 [hci1] 14.666954
        Num handles: 1
        Handle: 687 Address: DF:A9:FF:F6:B1:1A (OUI DF-A9-FF)
        Count: 1
        #190: len 21 (0 Kb/s)
        Latency: 171 msec (66-172 msec ~164 msec)
> ACL Data RX: Handle 687 flags 0x02 dlen 21              #192 [hci1] 14.754789
      SMP: Pairing Confirm (0x03) len 16
        Confim value: 8b6b89867d14d7b7b6a1bae3c3170174
< HCI Command: Host Number of Com.. (0x03|0x0035) plen 5  #193 [hci1] 14.774881
        Num handles: 1
        Handle: 687 Address: DF:A9:FF:F6:B1:1A (OUI DF-A9-FF)
        Count: 1
< ACL Data TX: Handle 687 flags 0x00 dlen 21              #194 [hci1] 14.774965
      SMP: Pairing Confirm (0x03) len 16
        Confim value: d05acf3edbf66e5156ca317de6b54c95
> HCI Event: Number of Completed Packets (0x13) plen 5    #195 [hci1] 14.929636
        Num handles: 1
        Handle: 687 Address: DF:A9:FF:F6:B1:1A (OUI DF-A9-FF)
        Count: 1
        #194: len 21 (1 Kb/s)
        Latency: 154 msec (66-172 msec ~159 msec)
> ACL Data RX: Handle 687 flags 0x02 dlen 21              #196 [hci1] 14.930047
      SMP: Pairing Random (0x04) len 16
        Random value: 733a41a5622122260000000000000000
< HCI Command: Host Number of Com.. (0x03|0x0035) plen 5  #197 [hci1] 14.935326
        Num handles: 1
        Handle: 687 Address: DF:A9:FF:F6:B1:1A (OUI DF-A9-FF)
        Count: 1
< ACL Data TX: Handle 687 flags 0x00 dlen 21              #198 [hci1] 14.935435
      SMP: Pairing Random (0x04) len 16
        Random value: b67e7216d5bf664139eda2b542549666
> HCI Event: Number of Completed Packets (0x13) plen 5    #199 [hci1] 15.104411
        Num handles: 1
        Handle: 687 Address: DF:A9:FF:F6:B1:1A (OUI DF-A9-FF)
        Count: 1
        #198: len 21 (1 Kb/s)
        Latency: 168 msec (66-172 msec ~164 msec)
> ACL Data RX: Handle 687 flags 0x02 dlen 21              #200 [hci1] 15.192280
      SMP: Pairing Confirm (0x03) len 16
        Confim value: eb132560de511ee2b474b44a526a2d7e
< HCI Command: Host Number of Com.. (0x03|0x0035) plen 5  #201 [hci1] 15.195100
        Num handles: 1
        Handle: 687 Address: DF:A9:FF:F6:B1:1A (OUI DF-A9-FF)
        Count: 1
< ACL Data TX: Handle 687 flags 0x00 dlen 21              #202 [hci1] 15.195264
      SMP: Pairing Confirm (0x03) len 16
        Confim value: 3defea9e8cc37c2cd06f15dedf0c92f9
> HCI Event: Number of Completed Packets (0x13) plen 5    #203 [hci1] 15.367127
        Num handles: 1
        Handle: 687 Address: DF:A9:FF:F6:B1:1A (OUI DF-A9-FF)
        Count: 1
        #202: len 21 (0 Kb/s)
        Latency: 171 msec (66-172 msec ~168 msec)
> ACL Data RX: Handle 687 flags 0x02 dlen 21              #204 [hci1] 15.367486
      SMP: Pairing Random (0x04) len 16
        Random value: 5e90ceda3de890f60000000000000000
< HCI Command: Host Number of Com.. (0x03|0x0035) plen 5  #205 [hci1] 15.375277
        Num handles: 1
        Handle: 687 Address: DF:A9:FF:F6:B1:1A (OUI DF-A9-FF)
        Count: 1
< ACL Data TX: Handle 687 flags 0x00 dlen 21              #206 [hci1] 15.375406
      SMP: Pairing Random (0x04) len 16
        Random value: ed17f76500c95219dd01e09d1e63f87b
> HCI Event: Number of Completed Packets (0x13) plen 5    #207 [hci1] 15.541946
        Num handles: 1
        Handle: 687 Address: DF:A9:FF:F6:B1:1A (OUI DF-A9-FF)
        Count: 1
        #206: len 21 (1 Kb/s)
        Latency: 166 msec (66-172 msec ~167 msec)
> ACL Data RX: Handle 687 flags 0x02 dlen 21              #208 [hci1] 15.629906
      SMP: Pairing Confirm (0x03) len 16
        Confim value: 3fbdeaff53e74bc902046208007127a4
< HCI Command: Host Number of Com.. (0x03|0x0035) plen 5  #209 [hci1] 15.634818
        Num handles: 1
        Handle: 687 Address: DF:A9:FF:F6:B1:1A (OUI DF-A9-FF)
        Count: 1
< ACL Data TX: Handle 687 flags 0x00 dlen 21              #210 [hci1] 15.634912
      SMP: Pairing Confirm (0x03) len 16
        Confim value: 496e6ba037afbaad2a726e87e0c8c02a
> HCI Event: Number of Completed Packets (0x13) plen 5    #211 [hci1] 15.804632
        Num handles: 1
        Handle: 687 Address: DF:A9:FF:F6:B1:1A (OUI DF-A9-FF)
        Count: 1
        #210: len 21 (0 Kb/s)
        Latency: 169 msec (66-172 msec ~168 msec)
> ACL Data RX: Handle 687 flags 0x02 dlen 21              #212 [hci1] 15.805045
      SMP: Pairing Random (0x04) len 16
        Random value: aa387ebbcacc967d0000000000000000
< HCI Command: Host Number of Com.. (0x03|0x0035) plen 5  #213 [hci1] 15.815432
        Num handles: 1
        Handle: 687 Address: DF:A9:FF:F6:B1:1A (OUI DF-A9-FF)
        Count: 1
< ACL Data TX: Handle 687 flags 0x00 dlen 21              #214 [hci1] 15.815605
      SMP: Pairing Random (0x04) len 16
        Random value: 81d35d47e1f6006d79c974bd9d9e1ee3
> HCI Event: Number of Completed Packets (0x13) plen 5    #215 [hci1] 15.979476
        Num handles: 1
        Handle: 687 Address: DF:A9:FF:F6:B1:1A (OUI DF-A9-FF)
        Count: 1
        #214: len 21 (1 Kb/s)
        Latency: 163 msec (66-172 msec ~166 msec)
> ACL Data RX: Handle 687 flags 0x02 dlen 21              #216 [hci1] 16.067381
      SMP: Pairing Confirm (0x03) len 16
        Confim value: 7ed5c56a569dbc97e01be4fdb3d63218
< HCI Command: Host Number of Com.. (0x03|0x0035) plen 5  #217 [hci1] 16.074892
        Num handles: 1
        Handle: 687 Address: DF:A9:FF:F6:B1:1A (OUI DF-A9-FF)
        Count: 1
< ACL Data TX: Handle 687 flags 0x00 dlen 21              #218 [hci1] 16.074968
      SMP: Pairing Confirm (0x03) len 16
        Confim value: a9d1ac9387947f2a3736658574b53515
> HCI Event: Number of Completed Packets (0x13) plen 5    #219 [hci1] 16.242176
        Num handles: 1
        Handle: 687 Address: DF:A9:FF:F6:B1:1A (OUI DF-A9-FF)
        Count: 1
        #218: len 21 (1 Kb/s)
        Latency: 167 msec (66-172 msec ~166 msec)
> ACL Data RX: Handle 687 flags 0x02 dlen 21              #220 [hci1] 16.242530
      SMP: Pairing Random (0x04) len 16
        Random value: da21658883eb4b980000000000000000
< HCI Command: Host Number of Com.. (0x03|0x0035) plen 5  #221 [hci1] 16.255430
        Num handles: 1
        Handle: 687 Address: DF:A9:FF:F6:B1:1A (OUI DF-A9-FF)
        Count: 1
< ACL Data TX: Handle 687 flags 0x00 dlen 21              #222 [hci1] 16.255520
      SMP: Pairing Random (0x04) len 16
        Random value: e7f7e0c2476823e41736a7e381bafb7c
> HCI Event: Number of Completed Packets (0x13) plen 5    #223 [hci1] 16.416931
        Num handles: 1
        Handle: 687 Address: DF:A9:FF:F6:B1:1A (OUI DF-A9-FF)
        Count: 1
        #222: len 21 (1 Kb/s)
        Latency: 161 msec (66-172 msec ~164 msec)
> ACL Data RX: Handle 687 flags 0x02 dlen 21              #224 [hci1] 16.504838
      SMP: Pairing Confirm (0x03) len 16
        Confim value: a4b9a1e11976a0925608a1321e835535
< HCI Command: Host Number of Com.. (0x03|0x0035) plen 5  #225 [hci1] 16.515159
        Num handles: 1
        Handle: 687 Address: DF:A9:FF:F6:B1:1A (OUI DF-A9-FF)
        Count: 1
< ACL Data TX: Handle 687 flags 0x00 dlen 21              #226 [hci1] 16.515363
      SMP: Pairing Confirm (0x03) len 16
        Confim value: 780cb0d692f674b8665bc1d7d2aba4d1
> HCI Event: Number of Completed Packets (0x13) plen 5    #227 [hci1] 16.679726
        Num handles: 1
        Handle: 687 Address: DF:A9:FF:F6:B1:1A (OUI DF-A9-FF)
        Count: 1
        #226: len 21 (1 Kb/s)
        Latency: 164 msec (66-172 msec ~164 msec)
> ACL Data RX: Handle 687 flags 0x02 dlen 21              #228 [hci1] 16.680028
      SMP: Pairing Random (0x04) len 16
        Random value: e47ca3c7e8e7aea70000000000000000
< HCI Command: Host Number of Com.. (0x03|0x0035) plen 5  #229 [hci1] 16.695267
        Num handles: 1
        Handle: 687 Address: DF:A9:FF:F6:B1:1A (OUI DF-A9-FF)
        Count: 1
