Bluetooth monitor ver 5.72
= Note: Linux version 6.14.0-36-generic (x86_64)                       0.844073
= Note: Bluetooth subsystem version 2.22                               0.844074
= New Index: 00:00:00:00:00:00 (Primary,UART,hci2)              [hci2] 0.844075
= New Index: 00:00:00:00:00:00 (Primary,UART,hci1)              [hci1] 0.844076
= New Index: 48:5F:99:8E:E0:64 (Primary,USB,hci0)               [hci0] 0.844076
= Open Index: 00:00:00:00:00:00                                 [hci1] 0.980940
= Index Info: 00:00:00:00:00:00 (Nordic Semiconductor ASA)      [hci1] 0.980950
@ USER Open: main (privileged) version 2.22            {0x0001} [hci1] 0.980956
< HCI Command: Reset (0x03|0x0003) plen 0                    #1 [hci1] 0.981807
> HCI Event: Command Complete (0x0e) plen 4                  #2 [hci1] 0.982394
      Reset (0x03|0x0003) ncmd 1
        Status: Success (0x00)
< HCI Command: Read Local Supported... (0x04|0x0003) plen 0  #3 [hci1] 1.000676
> HCI Event: Command Complete (0x0e) plen 12                 #4 [hci1] 1.001143
      Read Local Supported Features (0x04|0x0003) ncmd 1
        Status: Success (0x00)
        Features: 0x00 0x00 0x00 0x00 0x60 0x00 0x00 0x00
          BR/EDR Not Supported
          LE Supported (Controller)
< HCI Command: Read Local Version In.. (0x04|0x0001) plen 0  #5 [hci1] 1.020656
> HCI Event: Command Complete (0x0e) plen 12                 #6 [hci1] 1.021191
      Read Local Version Information (0x04|0x0001) ncmd 1
        Status: Success (0x00)
        HCI version: Reserved (0x11) - Revision 12345 (0x3039)
        LMP version: Reserved (0x11) - Subversion 12345 (0x3039)
        Manufacturer: Nordic Semiconductor ASA (89)
< HCI Command: Read Local Supported... (0x04|0x0002) plen 0  #7 [hci1] 1.040693
> HCI Event: Command Complete (0x0e) plen 68                 #8 [hci1] 1.041859
      Read Local Supported Commands (0x04|0x0002) ncmd 1
        Status: Success (0x00)
        Commands: 115 entries
          Disconnect (Octet 0 - Bit 5)
          Read Remote Version Information (Octet 2 - Bit 7)
          Set Event Mask (Octet 5 - Bit 6)
          Reset (Octet 5 - Bit 7)
          Read Connection Accept Timeout (Octet 7 - Bit 2)
          Write Connection Accept Timeout (Octet 7 - Bit 3)
          Read Transmit Power Level (Octet 10 - Bit 2)
          Set Controller To Host Flow Control (Octet 10 - Bit 5)
          Host Buffer Size (Octet 10 - Bit 6)
          Host Number of Completed Packets (Octet 10 - Bit 7)
          Read Local Version Information (Octet 14 - Bit 3)
          Read Local Supported Features (Octet 14 - Bit 5)
          Read BD ADDR (Octet 15 - Bit 1)
          Read RSSI (Octet 15 - Bit 5)
          Set Event Mask Page 2 (Octet 22 - Bit 2)
          LE Set Event Mask (Octet 25 - Bit 0)
          LE Read Buffer Size (Octet 25 - Bit 1)
          LE Read Local Supported Features (Octet 25 - Bit 2)
          LE Set Random Address (Octet 25 - Bit 4)
          LE Set Advertising Parameters (Octet 25 - Bit 5)
          LE Read Advertising Channel TX Power (Octet 25 - Bit 6)
          LE Set Advertising Data (Octet 25 - Bit 7)
          LE Set Scan Response Data (Octet 26 - Bit 0)
          LE Set Advertise Enable (Octet 26 - Bit 1)
          LE Set Scan Parameters (Octet 26 - Bit 2)
          LE Set Scan Enable (Octet 26 - Bit 3)
          LE Create Connection (Octet 26 - Bit 4)
          LE Create Connection Cancel (Octet 26 - Bit 5)
          LE Read Accept List Size (Octet 26 - Bit 6)
          LE Clear Accept List (Octet 26 - Bit 7)
          LE Add Device To Accept List (Octet 27 - Bit 0)
          LE Remove Device From Accept List (Octet 27 - Bit 1)
          LE Connection Update (Octet 27 - Bit 2)
          LE Set Host Channel Classification (Octet 27 - Bit 3)
          LE Read Channel Map (Octet 27 - Bit 4)
          LE Read Remote Used Features (Octet 27 - Bit 5)
          LE Encrypt (Octet 27 - Bit 6)
          LE Rand (Octet 27 - Bit 7)
          LE Start Encryption (Octet 28 - Bit 0)
          LE Long Term Key Request Reply (Octet 28 - Bit 1)
          LE Long Term Key Request Neg Reply (Octet 28 - Bit 2)
          LE Read Supported States (Octet 28 - Bit 3)
          Read Authenticated Payload Timeout (Octet 32 - Bit 4)
          Write Authenticated Payload Timeout (Octet 32 - Bit 5)
          LE Set Data Length (Octet 33 - Bit 6)
          LE Read Suggested Default Data Length (Octet 33 - Bit 7)
          LE Write Suggested Default Data Length (Octet 34 - Bit 0)
          LE Add Device To Resolving List (Octet 34 - Bit 3)
          LE Remove Device From Resolving List (Octet 34 - Bit 4)
          LE Clear Resolving List (Octet 34 - Bit 5)
          LE Read Resolving List Size (Octet 34 - Bit 6)
          LE Set Address Resolution Enable (Octet 35 - Bit 1)
          LE Set Resolvable Private Address Timeout (Octet 35 - Bit 2)
          LE Read Maximum Data Length (Octet 35 - Bit 3)
          LE Read PHY (Octet 35 - Bit 4)
          LE Set Default PHY (Octet 35 - Bit 5)
          LE Set PHY (Octet 35 - Bit 6)
          LE Set Advertising Set Random Address (Octet 36 - Bit 1)
          LE Set Extended Advertising Parameters (Octet 36 - Bit 2)
          LE Set Extended Advertising Data (Octet 36 - Bit 3)
          LE Set Extended Scan Response Data (Octet 36 - Bit 4)
          LE Set Extended Advertising Enable (Octet 36 - Bit 5)
          LE Read Maximum Advertising Data Length (Octet 36 - Bit 6)
          LE Read Number of Supported Advertising Sets (Octet 36 - Bit 7)
          LE Remove Advertising Set (Octet 37 - Bit 0)
          LE Clear Advertising Sets (Octet 37 - Bit 1)
          LE Set Periodic Advertising Parameters (Octet 37 - Bit 2)
          LE Set Periodic Advertising Data (Octet 37 - Bit 3)
          LE Set Periodic Advertising Enable (Octet 37 - Bit 4)
          LE Set Extended Scan Parameters (Octet 37 - Bit 5)
          LE Set Extended Scan Enable (Octet 37 - Bit 6)
          LE Extended Create Connection (Octet 37 - Bit 7)
          LE Periodic Advertising Create Sync (Octet 38 - Bit 0)
          LE Periodic Advertising Create Sync Cancel (Octet 38 - Bit 1)
          LE Periodic Advertising Terminate Sync (Octet 38 - Bit 2)
          LE Add Device To Periodic Advertiser List (Octet 38 - Bit 3)
          LE Remove Device From Periodic Advertiser List (Octet 38 - Bit 4)
          LE Clear Periodic Advertiser List (Octet 38 - Bit 5)
          LE Read Periodic Advertiser List Size (Octet 38 - Bit 6)
          LE Read Transmit Power (Octet 38 - Bit 7)
          LE Read RF Path Compensation (Octet 39 - Bit 0)
          LE Write RF Path Compensation (Octet 39 - Bit 1)
          LE Set Privacy Mode (Octet 39 - Bit 2)
          LE Periodic Advertising Receive Enable (Octet 40 - Bit 5)
          LE Periodic Advertising Sync Transfer (Octet 40 - Bit 6)
          LE Periodic Advertising Set Info Transfer (Octet 40 - Bit 7)
          LE Periodic Advertising Sync Transfer Parameters (Octet 41 - Bit 0)
          LE Set Default Periodic Advertisng Sync Transfer Parameters (Octet 41 - Bit 1)
          LE Read Buffer v2 (Octet 41 - Bit 5)
          LE Read ISO TX Sync (Octet 41 - Bit 6)
          LE Set Connected Isochronous Group Parameters (Octet 41 - Bit 7)
          LE Set Connected Isochronous Group Parameters Test (Octet 42 - Bit 0)
          LE Create Connected Isochronous Stream (Octet 42 - Bit 1)
          LE Remove Connected Isochronous Group (Octet 42 - Bit 2)
          LE Accept Connected Isochronous Stream Request (Octet 42 - Bit 3)
          LE Reject Connected Isochronous Stream Request (Octet 42 - Bit 4)
          LE Create Broadcast Isochronous Group (Octet 42 - Bit 5)
          LE Create Broadcast Isochronous Group Test (Octet 42 - Bit 6)
          LE Terminate Broadcast Isochronous Group (Octet 42 - Bit 7)
          LE Broadcast Isochronous Group Create Sync (Octet 43 - Bit 0)
          LE Broadcast Isochronous Group Terminate Sync (Octet 43 - Bit 1)
          LE Request Peer SCA (Octet 43 - Bit 2)
          LE Setup Isochronous Data Path (Octet 43 - Bit 3)
          LE Remove Isochronous Data Path (Octet 43 - Bit 4)
          LE Isochronous Transmit Test (Octet 43 - Bit 5)
          LE Isochronous Receive Test (Octet 43 - Bit 6)
          LE Isochronous Read Test Counters (Octet 43 - Bit 7)
          LE Isochronous Read Test Counters (Octet 44 - Bit 0)
          LE Set Host Feature (Octet 44 - Bit 1)
          Octet 44 - Bit 2 
          Octet 45 - Bit 6 
          Octet 46 - Bit 0 
          Octet 46 - Bit 1 
          Octet 46 - Bit 2 
          Octet 47 - Bit 4 
< HCI Command: Host Buffer Size (0x03|0x0033) plen 7         #9 [hci1] 1.060651
        ACL MTU: 255  ACL max packet: 16
        SCO MTU: 0    SCO max packet: 0
> HCI Event: Command Complete (0x0e) plen 4                 #10 [hci1] 1.061224
      Host Buffer Size (0x03|0x0033) ncmd 1
        Status: Success (0x00)
< HCI Command: Set Controller To Ho.. (0x03|0x0031) plen 1  #11 [hci1] 1.080624
        Flow control: ACL Data Packets (0x01)
> HCI Event: Command Complete (0x0e) plen 4                 #12 [hci1] 1.081010
      Set Controller To Host Flow Control (0x03|0x0031) ncmd 1
        Status: Success (0x00)
< HCI Command: LE Read Local Suppor.. (0x08|0x0003) plen 0  #13 [hci1] 1.100658
> HCI Event: Command Complete (0x0e) plen 12                #14 [hci1] 1.101136
      LE Read Local Supported Features (0x08|0x0003) ncmd 1
        Status: Success (0x00)
        Features: 0xfd 0x79 0x00 0xf7 0x30 0x01 0x00 0x00
          LE Encryption
          Extended Reject Indication
          Peripheral-initiated Features Exchange
          LE Ping
          LE Data Packet Length Extension
          LL Privacy
          Extended Scanner Filter Policies
          LE 2M PHY
          LE Coded PHY
          LE Extended Advertising
          LE Periodic Advertising
          Channel Selection Algorithm #2
          Periodic Advertising Sync Transfer - Sender
          Periodic Advertising Sync Transfer - Recipient
          Sleep Clock Accuracy Updates
          Connected Isochronous Stream - Central
          Connected Isochronous Stream - Peripheral
          Isochronous Broadcaster
          Synchronized Receiver
          Periodic Advertising ADI support
          Connection Subrating
          Unknown features (0x0000010000000000)
< HCI Command: LE Set Host Feature (0x08|0x0074) plen 2     #15 [hci1] 1.120663
        Bit Number: 32
          Connected Isochronous Stream (Host Support)
        Bit Value: 1
> HCI Event: Command Complete (0x0e) plen 4                 #16 [hci1] 1.121125
      LE Set Host Feature (0x08|0x0074) ncmd 1
        Status: Success (0x00)
< HCI Command: LE Read Buffer v2 (0x08|0x0060) plen 0       #17 [hci1] 1.140651
> HCI Event: Command Complete (0x0e) plen 10                #18 [hci1] 1.141147
      LE Read Buffer v2 (0x08|0x0060) ncmd 1
        Status: Success (0x00)
        ACL MTU: 27
        ACL max packet: 3
        ISO MTU: 318
        ISO max packet: 3
< HCI Command: LE Read Maximum Adve.. (0x08|0x003a) plen 0  #19 [hci1] 1.160683
> HCI Event: Command Complete (0x0e) plen 6                 #20 [hci1] 1.161161
      LE Read Maximum Advertising Data Length (0x08|0x003a) ncmd 1
        Status: Success (0x00)
        Max length: 1650
< HCI Command: LE Read Supported St.. (0x08|0x001c) plen 0  #21 [hci1] 1.180656
> HCI Event: Command Complete (0x0e) plen 12                #22 [hci1] 1.181350
      LE Read Supported States (0x08|0x001c) ncmd 1
        Status: Success (0x00)
        States: 0x000003ff3e0306ff
          Non-connectable Advertising State
          Scannable Advertising State
          Connectable Advertising State
          High Duty Cycle Directed Advertising State
          Passive Scanning State
          Active Scanning State
          Initiating State
            and Connection State (Central Role)
          Connection State (Peripheral Role)
          Scannable Advertising State
            and Passive Scanning State
          Connectable Advertising State
            and Passive Scanning State
          Non-connectable Advertising State
            and Initiating State
          Scannable Advertising State
            and Initiating State
          Active Scanning State
            and Connection State (Central Role)
          Passive Scanning State
            and Connection State (Peripheral Role)
          Active Scanning State
            and Connection State (Peripheral Role)
          Initiating State
            and Connection State (Central Role)
            and Central Role & Central Role
          Low Duty Cycle Directed Advertising State
          Connectable Advertising State
            and Initiating State
            and Central Role & Peripheral Role
          High Duty Cycle Directed Advertising State
            and Initiating State
            and Central Role & Peripheral Role
          Low Duty Cycle Directed Advertising State
            and Initiating State
            and Central Role & Peripheral Role
          Connectable Advertising State
            and Connection State (Central Role)
            and Central Role & Peripheral Role
          High Duty Cycle Directed Advertising State
            and Connection State (Central Role)
            and Central Role & Peripheral Role
          Low Duty Cycle Directed Advertising State
            and Connection State (Central Role)
            and Central Role & Peripheral Role
          Connectable Advertising State
            and Connection State (Peripheral Role)
            and Central Role & Peripheral Role
          High Duty Cycle Directed Advertising State
            and Connection State (Peripheral Role)
            and Peripheral Role & Peripheral Role
          Low Duty Cycle Directed Advertising State
            and Connection State (Peripheral Role)
            and Peripheral Role & Peripheral Role
          Initiating State
            and Connection State (Peripheral Role)
            and Central Role & Peripheral Role
< HCI Command: LE Read Maximum Data.. (0x08|0x002f) plen 0  #23 [hci1] 1.200653
> HCI Event: Command Complete (0x0e) plen 12                #24 [hci1] 1.201156
      LE Read Maximum Data Length (0x08|0x002f) ncmd 1
        Status: Success (0x00)
        Max TX octets: 251
        Max TX time: 2704
        Max RX octets: 251
        Max RX time: 2704
< HCI Command: LE Write Suggested D.. (0x08|0x0024) plen 4  #25 [hci1] 1.220654
        TX octets: 251
        TX time: 2704
> HCI Event: Command Complete (0x0e) plen 4                 #26 [hci1] 1.221147
      LE Write Suggested Default Data Length (0x08|0x0024) ncmd 1
        Status: Success (0x00)
< HCI Command: LE Set Resolvable Pr.. (0x08|0x002e) plen 2  #27 [hci1] 1.240691
        Timeout: 30 seconds
> HCI Event: Command Complete (0x0e) plen 4                 #28 [hci1] 1.241148
      LE Set Resolvable Private Address Timeout (0x08|0x002e) ncmd 1
        Status: Success (0x00)
< HCI Command: LE Read Resolving Li.. (0x08|0x002a) plen 0  #29 [hci1] 1.260659
> HCI Event: Command Complete (0x0e) plen 5                 #30 [hci1] 1.261142
      LE Read Resolving List Size (0x08|0x002a) ncmd 1
        Status: Success (0x00)
        Size: 8
< HCI Command: LE Set Host Feature (0x08|0x0074) plen 2     #31 [hci1] 1.280651
        Bit Number: 38
          Connection Subrating (Host Support)
        Bit Value: 1
> HCI Event: Command Complete (0x0e) plen 4                 #32 [hci1] 1.281188
      LE Set Host Feature (0x08|0x0074) ncmd 1
        Status: Success (0x00)
< HCI Command: LE Set Event Mask (0x08|0x0001) plen 8       #33 [hci1] 1.300666
        Mask: 0x000002063f87fa5e
          LE Advertising Report
          LE Connection Update Complete
          LE Read Remote Used Features Complete
          LE Long Term Key Request
          LE Data Length Change
          LE Enhanced Connection Complete
          LE PHY Update Complete
          LE Extended Advertising Report
          LE Periodic Advertising Sync Established
          LE Periodic Advertising Report
          LE Periodic Advertising Sync Lost
          LE Extended Scan Timeout
          LE Extended Advertising Set Terminated
          LE Scan Request Received
          LE Periodic Advertising Sync Transfer Rvc
          LE CIS Established
          LE CIS Request
          LE Create BIG Complete
          LE Terminate BIG Complete
          LE BIG Sync Estabilished Complete
          LE BIG Sync Lost
          LE BIG Info Advertising Report
          LE Subrate Change
          Unknown mask (0x0000020000000000)
> HCI Event: Command Complete (0x0e) plen 4                 #34 [hci1] 1.301257
      LE Set Event Mask (0x08|0x0001) ncmd 1
        Status: Success (0x00)
< HCI Command: Set Event Mask (0x03|0x0001) plen 8          #35 [hci1] 1.320653
        Mask: 0x2000800002008890
          Disconnection Complete
          Encryption Change
          Read Remote Version Information Complete
          Hardware Error
          Data Buffer Overflow
          Encryption Key Refresh Complete
          LE Meta
> HCI Event: Command Complete (0x0e) plen 4                 #36 [hci1] 1.321129
      Set Event Mask (0x03|0x0001) ncmd 1
        Status: Success (0x00)
< HCI Command: Read BD ADDR (0x04|0x0009) plen 0            #37 [hci1] 1.340683
> HCI Event: Command Complete (0x0e) plen 10                #38 [hci1] 1.341157
      Read BD ADDR (0x04|0x0009) ncmd 1
        Status: Success (0x00)
        Address: 00:00:00:00:00:00 (OUI 00-00-00)
< HCI Command: LE Set Random Address (0x08|0x0005) plen 6   #39 [hci1] 1.360670
        Address: D5:B6:CC:31:DB:3B (Static)
> HCI Event: Command Complete (0x0e) plen 4                 #40 [hci1] 1.361229
      LE Set Random Address (0x08|0x0005) ncmd 1
        Status: Success (0x00)
< HCI Command: LE Set Random Address (0x08|0x0005) plen 6   #41 [hci1] 1.480727
        Address: 48:61:8E:DB:C6:F9 (Resolvable)
> HCI Event: Command Complete (0x0e) plen 4                 #42 [hci1] 1.481229
      LE Set Random Address (0x08|0x0005) ncmd 1
        Status: Success (0x00)
< HCI Command: LE Extended Create... (0x08|0x0043) plen 26  #43 [hci1] 4.180808
        Filter policy: Accept list is not used (0x00)
        Own address type: Random (0x03)
        Peer address type: Public (0x00)
        Peer address: DF:A9:FF:F6:B1:1A (OUI DF-A9-FF)
        Initiating PHYs: 0x01
        Entry 0: LE 1M
          Scan interval: 60.000 msec (0x0060)
          Scan window: 60.000 msec (0x0060)
          Min connection interval: 30.00 msec (0x0018)
          Max connection interval: 50.00 msec (0x0028)
          Connection latency: 0 (0x0000)
          Supervision timeout: 4000 msec (0x0190)
          Min connection length: 0.000 msec (0x0000)
          Max connection length: 0.000 msec (0x0000)
> HCI Event: Command Status (0x0f) plen 4                   #44 [hci1] 4.181717
      LE Extended Create Connection (0x08|0x0043) ncmd 1
        Status: Success (0x00)
> HCI Event: LE Meta Event (0x3e) plen 31                   #45 [hci1] 4.233415
      LE Enhanced Connection Complete (0x0a)
        Status: Success (0x00)
        Handle: 918
        Role: Central (0x00)
        Peer address type: Public (0x00)
        Peer address: DF:A9:FF:F6:B1:1A (OUI DF-A9-FF)
        Local resolvable private address: 48:61:8E:DB:C6:F9 (Resolvable)
        Peer resolvable private address: 00:00:00:00:00:00 (Non-Resolvable)
        Connection interval: 50.00 msec (0x0028)
        Connection latency: 0 (0x0000)
        Supervision timeout: 4000 msec (0x0190)
        Central clock accuracy: 0x00
< HCI Command: LE Read Remote Used... (0x08|0x0016) plen 2  #46 [hci1] 4.240833
        Handle: 918 Address: DF:A9:FF:F6:B1:1A (OUI DF-A9-FF)
> HCI Event: Command Status (0x0f) plen 4                   #47 [hci1] 4.241327
      LE Read Remote Used Features (0x08|0x0016) ncmd 1
        Status: Success (0x00)
< HCI Command: LE Set PHY (0x08|0x0032) plen 7              #48 [hci1] 4.260748
        Handle: 918 Address: DF:A9:FF:F6:B1:1A (OUI DF-A9-FF)
        All PHYs preference: 0x00
        TX PHYs preference: 0x02
          LE 2M
        RX PHYs preference: 0x02
          LE 2M
        PHY options preference: Reserved (0x0000)
> HCI Event: Command Status (0x0f) plen 4                   #49 [hci1] 4.261416
      LE Set PHY (0x08|0x0032) ncmd 1
        Status: Success (0x00)
> HCI Event: LE Meta Event (0x3e) plen 12                   #50 [hci1] 4.384865
      LE Read Remote Used Features (0x04)
        Status: Success (0x00)
        Handle: 918 Address: DF:A9:FF:F6:B1:1A (OUI DF-A9-FF)
        Features: 0x2d 0x49 0x00 0xf7 0x67 0xd9 0x00 0x80
          LE Encryption
          Extended Reject Indication
          Peripheral-initiated Features Exchange
          LE Data Packet Length Extension
          LE 2M PHY
          LE Coded PHY
          Channel Selection Algorithm #2
          Periodic Advertising Sync Transfer - Sender
          Periodic Advertising Sync Transfer - Recipient
          Sleep Clock Accuracy Updates
          Connected Isochronous Stream - Central
          Connected Isochronous Stream - Peripheral
          Isochronous Broadcaster
          Synchronized Receiver
          Connected Isochronous Stream (Host Support)
          LE Power Control Request
          LE Power Control Request
          Connection Subrating
          Connection Subrating (Host Support)
          Unknown features (0x8000d90000000000)
> HCI Event: LE Meta Event (0x3e) plen 6                    #51 [hci1] 4.884155
      LE PHY Update Complete (0x0c)
        Status: Success (0x00)
        Handle: 918 Address: DF:A9:FF:F6:B1:1A (OUI DF-A9-FF)
        TX PHY: LE 2M (0x02)
        RX PHY: LE 2M (0x02)
> ACL Data RX: Handle 918 flags 0x02 dlen 6                 #52 [hci1] 5.284589
      SMP: Security Request (0x0b) len 1
        Authentication requirement: Bonding, No MITM, SC, No Keypresses (0x09)
< HCI Command: Host Number of Compl.. (0x03|0x0035) plen 5  #53 [hci1] 5.301190
        Num handles: 1
        Handle: 918 Address: DF:A9:FF:F6:B1:1A (OUI DF-A9-FF)
        Count: 1
< ACL Data TX: Handle 918 flags 0x00 dlen 11                #54 [hci1] 5.301226
      SMP: Pairing Request (0x01) len 6
        IO capability: KeyboardDisplay (0x04)
        OOB data: Authentication data not present (0x00)
        Authentication requirement: Bonding, No MITM, SC, No Keypresses (0x09)
        Max encryption key size: 16
        Initiator key distribution: EncKey IdKey (0x03)
        Responder key distribution: EncKey IdKey (0x03)
> HCI Event: Number of Completed Packets (0x13) plen 5      #55 [hci1] 5.334617
        Num handles: 1
        Handle: 918 Address: DF:A9:FF:F6:B1:1A (OUI DF-A9-FF)
        Count: 1
        #54: len 11 (2 Kb/s)
        Latency: 33 msec (33-33 msec ~33 msec)
> ACL Data RX: Handle 918 flags 0x02 dlen 11                #56 [hci1] 5.384748
      SMP: Pairing Response (0x02) len 6
        IO capability: KeyboardDisplay (0x04)
        OOB data: Authentication data not present (0x00)
        Authentication requirement: Bonding, No MITM, SC, No Keypresses (0x09)
        Max encryption key size: 16
        Initiator key distribution: EncKey IdKey (0x03)
        Responder key distribution: EncKey IdKey (0x03)
< HCI Command: Host Number of Compl.. (0x03|0x0035) plen 5  #57 [hci1] 5.400848
        Num handles: 1
        Handle: 918 Address: DF:A9:FF:F6:B1:1A (OUI DF-A9-FF)
        Count: 1
< ACL Data TX: Handle 918 flags 0x00 dlen 27                #58 [hci1] 5.400901
< ACL Data TX: Handle 918 flags 0x01 dlen 27                #59 [hci1] 5.400906
< ACL Data TX: Handle 918 flags 0x01 dlen 15                #60 [hci1] 5.400908
      SMP: Pairing Public Key (0x0c) len 64
        X: 68f6ada634ce84d11617383d57f070fe3445c38b33b569efa5eb771a0dc8aea5
        Y: 83c407aaa8337331fdc418e55085d75e6c1c6e5d42f8bf9c18fb5a2a7d4f31aa
> HCI Event: Number of Completed Packets (0x13) plen 5      #61 [hci1] 5.434760
        Num handles: 1
        Handle: 918 Address: DF:A9:FF:F6:B1:1A (OUI DF-A9-FF)
        Count: 1
        #58: len 27 (6 Kb/s)
        Latency: 33 msec (33-33 msec ~33 msec)
> HCI Event: Number of Completed Packets (0x13) plen 5      #62 [hci1] 5.435111
        Num handles: 1
        Handle: 918 Address: DF:A9:FF:F6:B1:1A (OUI DF-A9-FF)
        Count: 1
        #59: len 27 (6 Kb/s)
        Latency: 34 msec (33-34 msec ~33 msec)
> HCI Event: Number of Completed Packets (0x13) plen 5      #63 [hci1] 5.435604
        Num handles: 1
        Handle: 918 Address: DF:A9:FF:F6:B1:1A (OUI DF-A9-FF)
        Count: 1
        #60: len 15 (3 Kb/s)
        Latency: 34 msec (33-34 msec ~34 msec)
> ACL Data RX: Handle 918 flags 0x02 dlen 27                #64 [hci1] 5.484868
> ACL Data RX: Handle 918 flags 0x01 dlen 27                #65 [hci1] 5.485344
> ACL Data RX: Handle 918 flags 0x01 dlen 15                #66 [hci1] 5.485734
      SMP: Pairing Public Key (0x0c) len 64
        X: dfacd7ebaf3b19f350b4f4f852f452cc84beb30cf9fd5f62d9dd2c13a55a29d6
        Y: ab7cf892e3a9c4824431d728a7ac2d34388cc02c572d4fbf4283135ff935b73e
< HCI Command: Host Number of Compl.. (0x03|0x0035) plen 5  #67 [hci1] 5.501470
        Num handles: 1
        Handle: 918 Address: DF:A9:FF:F6:B1:1A (OUI DF-A9-FF)
        Count: 1
< HCI Command: Host Number of Compl.. (0x03|0x0035) plen 5  #68 [hci1] 5.501688
        Num handles: 1
        Handle: 918 Address: DF:A9:FF:F6:B1:1A (OUI DF-A9-FF)
        Count: 1
< HCI Command: Host Number of Compl.. (0x03|0x0035) plen 5  #69 [hci1] 5.501835
        Num handles: 1
        Handle: 918 Address: DF:A9:FF:F6:B1:1A (OUI DF-A9-FF)
        Count: 1
> ACL Data RX: Handle 918 flags 0x02 dlen 21                #70 [hci1] 5.534770
      SMP: Pairing Confirm (0x03) len 16
        Confim value: 0f709b11e4f6fe05f9761218f71b0af2
< HCI Command: Host Number of Compl.. (0x03|0x0035) plen 5  #71 [hci1] 5.540809
        Num handles: 1
        Handle: 918 Address: DF:A9:FF:F6:B1:1A (OUI DF-A9-FF)
        Count: 1
< ACL Data TX: Handle 918 flags 0x00 dlen 21                #72 [hci1] 5.540842
      SMP: Pairing Random (0x04) len 16
        Random value: 555cc64d02679f89a05211af56d8b3da
> HCI Event: Number of Completed Packets (0x13) plen 5      #73 [hci1] 5.584663
        Num handles: 1
        Handle: 918 Address: DF:A9:FF:F6:B1:1A (OUI DF-A9-FF)
        Count: 1
        #72: len 21 (3 Kb/s)
        Latency: 43 msec (33-43 msec ~39 msec)
> ACL Data RX: Handle 918 flags 0x02 dlen 21                #74 [hci1] 5.634875
      SMP: Pairing Random (0x04) len 16
        Random value: 7b1fd35c2c27e7a20000000000000000
< HCI Command: Host Number of Compl.. (0x03|0x0035) plen 5  #75 [hci1] 5.641457
        Num handles: 1
        Handle: 918 Address: DF:A9:FF:F6:B1:1A (OUI DF-A9-FF)
        Count: 1
< ACL Data TX: Handle 918 flags 0x00 dlen 21                #76 [hci1] 5.641517
      SMP: Pairing DHKey Check (0x0d) len 16
        E: d254ae2939c14ff86a4c70a1b20c37ab
> HCI Event: Number of Completed Packets (0x13) plen 5      #77 [hci1] 5.684617
        Num handles: 1
        Handle: 918 Address: DF:A9:FF:F6:B1:1A (OUI DF-A9-FF)
        Count: 1
        #76: len 21 (3 Kb/s)
        Latency: 43 msec (33-43 msec ~41 msec)
> ACL Data RX: Handle 918 flags 0x02 dlen 21                #78 [hci1] 5.934906
      SMP: Pairing DHKey Check (0x0d) len 16
        E: b33de393c95098e29f941abc360037f8
< HCI Command: LE Start Encryption (0x08|0x0019) plen 28    #79 [hci1] 5.940999
        Handle: 918 Address: DF:A9:FF:F6:B1:1A (OUI DF-A9-FF)
        Random number: 0x0000000000000000
        Encrypted diversifier: 0x0000
        Long term key: aa395c01014b44a0b55d5471a7fd7d44
> HCI Event: Command Status (0x0f) plen 4                   #80 [hci1] 5.941860
      LE Start Encryption (0x08|0x0019) ncmd 1
        Status: Success (0x00)
< HCI Command: Host Number of Compl.. (0x03|0x0035) plen 5  #81 [hci1] 5.960899
        Num handles: 1
        Handle: 918 Address: DF:A9:FF:F6:B1:1A (OUI DF-A9-FF)
        Count: 1
> HCI Event: Encryption Change (0x08) plen 4                #82 [hci1] 6.284567
        Status: Success (0x00)
        Handle: 918 Address: DF:A9:FF:F6:B1:1A (OUI DF-A9-FF)
        Encryption: Enabled with AES-CCM (0x01)
> ACL Data RX: Handle 918 flags 0x02 dlen 21                #83 [hci1] 6.334862
      SMP: Identity Information (0x08) len 16
        Identity resolving key: 21c5ecae74ee4c3ef325d07e1848eae2
< HCI Command: Host Number of Compl.. (0x03|0x0035) plen 5  #84 [hci1] 6.341130
        Num handles: 1
        Handle: 918 Address: DF:A9:FF:F6:B1:1A (OUI DF-A9-FF)
        Count: 1
> ACL Data RX: Handle 918 flags 0x02 dlen 12                #85 [hci1] 6.384749
      SMP: Identity Address Information (0x09) len 7
        Address: DF:A9:FF:F6:B1:1A (OUI DF-A9-FF)
< HCI Command: LE Add Device To Re.. (0x08|0x0027) plen 39  #86 [hci1] 6.400923
        Address type: Public (0x00)
        Address: DF:A9:FF:F6:B1:1A (OUI DF-A9-FF)
        Peer identity resolving key: 21c5ecae74ee4c3ef325d07e1848eae2
        Local identity resolving key: 08aad2e1be87e47b88aeb19de6889efb
> HCI Event: Command Complete (0x0e) plen 4                 #87 [hci1] 6.401861
      LE Add Device To Resolving List (0x08|0x0027) ncmd 1
        Status: Success (0x00)
< HCI Command: LE Set Privacy Mode (0x08|0x004e) plen 8     #88 [hci1] 6.420809
        Peer Identity address type: Public (0x00)
        Peer Identity address: DF:A9:FF:F6:B1:1A (OUI DF-A9-FF)
        Privacy Mode: Use Device Privacy (0x01)
> HCI Event: Command Complete (0x0e) plen 4                 #89 [hci1] 6.421377
      LE Set Privacy Mode (0x08|0x004e) ncmd 1
        Status: Success (0x00)
< HCI Command: LE Set Address Resol.. (0x08|0x002d) plen 1  #90 [hci1] 6.441007
        Address resolution: Enabled (0x01)
> HCI Event: Command Complete (0x0e) plen 4                 #91 [hci1] 6.441437
      LE Set Address Resolution Enable (0x08|0x002d) ncmd 1
        Status: Success (0x00)
< HCI Command: Host Number of Compl.. (0x03|0x0035) plen 5  #92 [hci1] 6.460999
        Num handles: 1
        Handle: 918 Address: DF:A9:FF:F6:B1:1A (OUI DF-A9-FF)
        Count: 1
< ACL Data TX: Handle 918 flags 0x00 dlen 21                #93 [hci1] 6.461122
      SMP: Identity Information (0x08) len 16
        Identity resolving key: 08aad2e1be87e47b88aeb19de6889efb
< ACL Data TX: Handle 918 flags 0x00 dlen 12                #94 [hci1] 6.461150
      SMP: Identity Address Information (0x09) len 7
        Address: D5:B6:CC:31:DB:3B (Static)
> HCI Event: Number of Completed Packets (0x13) plen 5      #95 [hci1] 6.484735
        Num handles: 1
        Handle: 918 Address: DF:A9:FF:F6:B1:1A (OUI DF-A9-FF)
        Count: 1
        #93: len 21 (7 Kb/s)
        Latency: 23 msec (23-43 msec ~32 msec)
> HCI Event: Number of Completed Packets (0x13) plen 5      #96 [hci1] 6.485102
        Num handles: 1
        Handle: 918 Address: DF:A9:FF:F6:B1:1A (OUI DF-A9-FF)
        Count: 1
        #94: len 12 (4 Kb/s)
        Latency: 23 msec (23-43 msec ~28 msec)
< ACL Data TX: Handle 918 flags 0x00 dlen 11                #97 [hci1] 6.501050
      ATT: Read By Type Request (0x08) len 6
        Handle range: 0x0001-0xffff
        Attribute type: Central Address Resolution (0x2aa6)
> HCI Event: Number of Completed Packets (0x13) plen 5      #98 [hci1] 6.534667
        Num handles: 1
        Handle: 918 Address: DF:A9:FF:F6:B1:1A (OUI DF-A9-FF)
        Count: 1
        #97: len 11 (2 Kb/s)
        Latency: 33 msec (23-43 msec ~30 msec)
> ACL Data RX: Handle 918 flags 0x02 dlen 13                #99 [hci1] 6.684682
      ATT: Find By Type Value Request (0x06) len 8
        Handle range: 0x0001-0xffff
        Attribute type: Primary Service (0x2800)
          UUID: Generic Access Profile (0x1800)
< HCI Command: Host Number of Comp.. (0x03|0x0035) plen 5  #100 [hci1] 6.700949
        Num handles: 1
        Handle: 918 Address: DF:A9:FF:F6:B1:1A (OUI DF-A9-FF)
        Count: 1
< ACL Data TX: Handle 918 flags 0x00 dlen 9                #101 [hci1] 6.700997
      ATT: Find By Type Value Response (0x07) len 4
        Handle range: 0x000b-0x0013
> ACL Data RX: Handle 918 flags 0x02 dlen 9                #102 [hci1] 6.734612
      ATT: Read By Type Response (0x09) len 4
        Attribute data length: 3
        Attribute data list: 1 entry
        Handle: 0x000f
        Value: 01
> HCI Event: Number of Completed Packets (0x13) plen 5     #103 [hci1] 6.735067
        Num handles: 1
        Handle: 918 Address: DF:A9:FF:F6:B1:1A (OUI DF-A9-FF)
        Count: 1
        #101: len 9 (2 Kb/s)
        Latency: 34 msec (23-43 msec ~32 msec)
< HCI Command: Host Number of Comp.. (0x03|0x0035) plen 5  #104 [hci1] 6.741118
        Num handles: 1
        Handle: 918 Address: DF:A9:FF:F6:B1:1A (OUI DF-A9-FF)
        Count: 1
> ACL Data RX: Handle 918 flags 0x02 dlen 13               #105 [hci1] 6.784803
      ATT: Find By Type Value Request (0x06) len 8
        Handle range: 0x0014-0xffff
        Attribute type: Primary Service (0x2800)
          UUID: Generic Access Profile (0x1800)
< HCI Command: Host Number of Comp.. (0x03|0x0035) plen 5  #106 [hci1] 6.801314
        Num handles: 1
        Handle: 918 Address: DF:A9:FF:F6:B1:1A (OUI DF-A9-FF)
        Count: 1
< ACL Data TX: Handle 918 flags 0x00 dlen 9                #107 [hci1] 6.801562
      ATT: Error Response (0x01) len 4
        Find By Type Value Request (0x06)
        Handle: 0x0014
        Error: Attribute Not Found (0x0a)
> HCI Event: Number of Completed Packets (0x13) plen 5     #108 [hci1] 6.834622
        Num handles: 1
        Handle: 918 Address: DF:A9:FF:F6:B1:1A (OUI DF-A9-FF)
        Count: 1
        #107: len 9 (2 Kb/s)
        Latency: 33 msec (23-43 msec ~32 msec)
> ACL Data RX: Handle 918 flags 0x02 dlen 11               #109 [hci1] 6.884711
      ATT: Read By Type Request (0x08) len 6
        Handle range: 0x000b-0x0013
        Attribute type: Characteristic (0x2803)
< HCI Command: Host Number of Comp.. (0x03|0x0035) plen 5  #110 [hci1] 6.900965
        Num handles: 1
        Handle: 918 Address: DF:A9:FF:F6:B1:1A (OUI DF-A9-FF)
        Count: 1
< ACL Data TX: Handle 918 flags 0x00 dlen 20               #111 [hci1] 6.901005
      ATT: Read By Type Response (0x09) len 15
        Attribute data length: 7
        Attribute data list: 2 entries
        Handle: 0x000c
        Value: 0a0d00002a
            Properties: 0x0a
              Read (0x02)
              Write (0x08)
            Value Handle: 0x000d
            Value UUID: Device Name (0x2a00)
        Handle: 0x000e
        Value: 0a0f00012a
            Properties: 0x0a
              Read (0x02)
              Write (0x08)
            Value Handle: 0x000f
            Value UUID: Appearance (0x2a01)
> HCI Event: Number of Completed Packets (0x13) plen 5     #112 [hci1] 6.934608
        Num handles: 1
        Handle: 918 Address: DF:A9:FF:F6:B1:1A (OUI DF-A9-FF)
        Count: 1
        #111: len 20 (4 Kb/s)
        Latency: 33 msec (23-43 msec ~33 msec)
> ACL Data RX: Handle 918 flags 0x02 dlen 11               #113 [hci1] 6.984630
      ATT: Read By Type Request (0x08) len 6
        Handle range: 0x000f-0x0013
        Attribute type: Characteristic (0x2803)
< HCI Command: Host Number of Comp.. (0x03|0x0035) plen 5  #114 [hci1] 7.001190
        Num handles: 1
        Handle: 918 Address: DF:A9:FF:F6:B1:1A (OUI DF-A9-FF)
        Count: 1
< ACL Data TX: Handle 918 flags 0x00 dlen 20               #115 [hci1] 7.001242
      ATT: Read By Type Response (0x09) len 15
        Attribute data length: 7
        Attribute data list: 2 entries
        Handle: 0x0010
        Value: 021100a62a
            Properties: 0x02
              Read (0x02)
            Value Handle: 0x0011
            Value UUID: Central Address Resolution (0x2aa6)
        Handle: 0x0012
        Value: 021300042a
            Properties: 0x02
              Read (0x02)
            Value Handle: 0x0013
            Value UUID: Peripheral Preferred Connection Parameters (0x2a04)
> HCI Event: Number of Completed Packets (0x13) plen 5     #116 [hci1] 7.034718
        Num handles: 1
        Handle: 918 Address: DF:A9:FF:F6:B1:1A (OUI DF-A9-FF)
        Count: 1
        #115: len 20 (4 Kb/s)
        Latency: 33 msec (23-43 msec ~33 msec)
> ACL Data RX: Handle 918 flags 0x02 dlen 11               #117 [hci1] 7.084674
      ATT: Read By Type Request (0x08) len 6
        Handle range: 0x0013-0x0013
        Attribute type: Characteristic (0x2803)
< HCI Command: Host Number of Comp.. (0x03|0x0035) plen 5  #118 [hci1] 7.100986
        Num handles: 1
        Handle: 918 Address: DF:A9:FF:F6:B1:1A (OUI DF-A9-FF)
        Count: 1
< ACL Data TX: Handle 918 flags 0x00 dlen 9                #119 [hci1] 7.101116
      ATT: Error Response (0x01) len 4
        Read By Type Request (0x08)
        Handle: 0x0013
        Error: Attribute Not Found (0x0a)
> HCI Event: Number of Completed Packets (0x13) plen 5     #120 [hci1] 7.134663
        Num handles: 1
        Handle: 918 Address: DF:A9:FF:F6:B1:1A (OUI DF-A9-FF)
        Count: 1
        #119: len 9 (2 Kb/s)
        Latency: 33 msec (23-43 msec ~33 msec)
> ACL Data RX: Handle 918 flags 0x02 dlen 7                #121 [hci1] 7.184681
      ATT: Read Request (0x0a) len 2
        Handle: 0x0011
< HCI Command: Host Number of Comp.. (0x03|0x0035) plen 5  #122 [hci1] 7.200815
        Num handles: 1
        Handle: 918 Address: DF:A9:FF:F6:B1:1A (OUI DF-A9-FF)
        Count: 1
< ACL Data TX: Handle 918 flags 0x00 dlen 6                #123 [hci1] 7.200878
      ATT: Read Response (0x0b) len 1
> HCI Event: Number of Completed Packets (0x13) plen 5     #124 [hci1] 7.234573
        Num handles: 1
        Handle: 918 Address: DF:A9:FF:F6:B1:1A (OUI DF-A9-FF)
        Count: 1
        #123: len 6 (1 Kb/s)
        Latency: 33 msec (23-43 msec ~33 msec)
< HCI Command: Disconnect (0x01|0x0006) plen 3             #125 [hci1] 8.220814
        Handle: 918 Address: DF:A9:FF:F6:B1:1A (OUI DF-A9-FF)
        Reason: Remote User Terminated Connection (0x13)
> HCI Event: Command Status (0x0f) plen 4                  #126 [hci1] 8.221424
      Disconnect (0x01|0x0006) ncmd 1
        Status: Success (0x00)
> HCI Event: Disconnect Complete (0x05) plen 4             #127 [hci1] 8.284520
        Status: Success (0x00)
        Handle: 918 Address: DF:A9:FF:F6:B1:1A (OUI DF-A9-FF)
        Reason: Connection Terminated By Local Host (0x16)
< HCI Command: LE Clear Accept List (0x08|0x0010) plen 0   #128 [hci1] 9.291020
> HCI Event: Command Complete (0x0e) plen 4                #129 [hci1] 9.291521
      LE Clear Accept List (0x08|0x0010) ncmd 1
        Status: Success (0x00)
< HCI Command: LE Add Device To Ac.. (0x08|0x0011) plen 7  #130 [hci1] 9.300902
        Address type: Public (0x00)
        Address: DF:A9:FF:F6:B1:1A (OUI DF-A9-FF)
> HCI Event: Command Complete (0x0e) plen 4                #131 [hci1] 9.301439
      LE Add Device To Accept List (0x08|0x0011) ncmd 1
        Status: Success (0x00)
< HCI Command: LE Extended Create.. (0x08|0x0043) plen 26  #132 [hci1] 9.340793
        Filter policy: Accept list is used (0x01)
        Own address type: Random (0x03)
        Peer address type: Public (0x00)
        Peer address: 00:00:00:00:00:00 (OUI 00-00-00)
        Initiating PHYs: 0x01
        Entry 0: LE 1M
          Scan interval: 60.000 msec (0x0060)
          Scan window: 60.000 msec (0x0060)
          Min connection interval: 30.00 msec (0x0018)
          Max connection interval: 50.00 msec (0x0028)
          Connection latency: 0 (0x0000)
          Supervision timeout: 4000 msec (0x0190)
          Min connection length: 0.000 msec (0x0000)
          Max connection length: 0.000 msec (0x0000)
> HCI Event: Command Status (0x0f) plen 4                  #133 [hci1] 9.341778
      LE Extended Create Connection (0x08|0x0043) ncmd 1
        Status: Success (0x00)
> HCI Event: LE Meta Event (0x3e) plen 31                  #134 [hci1] 9.389369
      LE Enhanced Connection Complete (0x0a)
        Status: Success (0x00)
        Handle: 936
        Role: Central (0x00)
        Peer address type: Resolved Public (0x02)
        Peer address: DF:A9:FF:F6:B1:1A (OUI DF-A9-FF)
        Local resolvable private address: 73:CF:61:F9:47:81 (Resolvable)
          Identity type: Random (0x01)
          Identity: D5:B6:CC:31:DB:3B (Static)
        Peer resolvable private address: 74:BC:26:A6:5C:40 (Resolvable)
          Identity type: Public (0x00)
          Identity: DF:A9:FF:F6:B1:1A (OUI DF-A9-FF)
        Connection interval: 50.00 msec (0x0028)
        Connection latency: 0 (0x0000)
        Supervision timeout: 4000 msec (0x0190)
        Central clock accuracy: 0x00
< HCI Command: LE Read Remote Used.. (0x08|0x0016) plen 2  #135 [hci1] 9.400917
        Handle: 936 Address: DF:A9:FF:F6:B1:1A (OUI DF-A9-FF)
> HCI Event: Command Status (0x0f) plen 4                  #136 [hci1] 9.401414
      LE Read Remote Used Features (0x08|0x0016) ncmd 1
        Status: Success (0x00)
< HCI Command: LE Set PHY (0x08|0x0032) plen 7             #137 [hci1] 9.420778
        Handle: 936 Address: DF:A9:FF:F6:B1:1A (OUI DF-A9-FF)
        All PHYs preference: 0x00
        TX PHYs preference: 0x02
          LE 2M
        RX PHYs preference: 0x02
          LE 2M
        PHY options preference: Reserved (0x0000)
> HCI Event: Command Status (0x0f) plen 4                  #138 [hci1] 9.421343
      LE Set PHY (0x08|0x0032) ncmd 1
        Status: Success (0x00)
> HCI Event: LE Meta Event (0x3e) plen 12                  #139 [hci1] 9.540636
      LE Read Remote Used Features (0x04)
        Status: Success (0x00)
        Handle: 936 Address: DF:A9:FF:F6:B1:1A (OUI DF-A9-FF)
        Features: 0x2d 0x49 0x00 0xf7 0x67 0xd9 0x00 0x80
          LE Encryption
          Extended Reject Indication
          Peripheral-initiated Features Exchange
          LE Data Packet Length Extension
          LE 2M PHY
          LE Coded PHY
          Channel Selection Algorithm #2
          Periodic Advertising Sync Transfer - Sender
          Periodic Advertising Sync Transfer - Recipient
          Sleep Clock Accuracy Updates
          Connected Isochronous Stream - Central
          Connected Isochronous Stream - Peripheral
          Isochronous Broadcaster
          Synchronized Receiver
          Connected Isochronous Stream (Host Support)
          LE Power Control Request
          LE Power Control Request
          Connection Subrating
          Connection Subrating (Host Support)
          Unknown features (0x8000d90000000000)
> HCI Event: LE Meta Event (0x3e) plen 6                  #140 [hci1] 10.040207
      LE PHY Update Complete (0x0c)
        Status: Success (0x00)
        Handle: 936 Address: DF:A9:FF:F6:B1:1A (OUI DF-A9-FF)
        TX PHY: LE 2M (0x02)
        RX PHY: LE 2M (0x02)
> HCI Event: Disconnect Complete (0x05) plen 4            #141 [hci1] 13.690367
        Status: Success (0x00)
        Handle: 936 Address: DF:A9:FF:F6:B1:1A (OUI DF-A9-FF)
        Reason: Connection Timeout (0x08)
< HCI Command: Reset (0x03|0x0003) plen 0                 #142 [hci1] 14.330852
> HCI Event: Command Complete (0x0e) plen 4               #143 [hci1] 14.331308
      Reset (0x03|0x0003) ncmd 1
        Status: Success (0x00)
@ USER Close: main                                    {0x0001} [hci1] 14.340784
= Close Index: 00:00:00:00:00:00                               [hci1] 14.340792
