Bluetooth monitor ver 5.84
btmon[1697279]: = Note: Linux version 6.8.0-83-generic (x86_64)                                                          0.750105
btmon[1697279]: = Note: Bluetooth subsystem version 2.22                                                                 0.750107
= New Index: 00:00:00:00:00:00 (Primary,UART,hci0)                                                                       0.750108
= Open Index: 00:00:00:00:00:00                                                                                          1.254174
= Index Info: 00:00:00:00:00:00 (Nordic Semiconductor ASA)                                                               1.254354
zephyr.exe[1697281]: @ USER Open: main (privileged) version 2.22                                                {0x0001} 1.254404
zephyr.exe[1697281]: < HCI Command: Reset (0x03|0x0003) plen 0                                                        #1 1.254974
> HCI Event: Command Complete (0x0e) plen 4                                                                           #2 1.255647
      Reset (0x03|0x0003) ncmd 1
        Status: Success (0x00)
zephyr.exe[1697281]: < HCI Command: Read Local Supported Features (0x04|0x0003) plen 0                                #3 1.274194
> HCI Event: Command Complete (0x0e) plen 12                                                                          #4 1.275160
      Read Local Supported Features (0x04|0x0003) ncmd 1
        Status: Success (0x00)
        Features: 0x00 0x00 0x00 0x00 0x60 0x00 0x00 0x00
          BR/EDR Not Supported
          LE Supported (Controller)
zephyr.exe[1697281]: < HCI Command: Read Local Version Information (0x04|0x0001) plen 0                               #5 1.294208
> HCI Event: Command Complete (0x0e) plen 12                                                                          #6 1.295072
      Read Local Version Information (0x04|0x0001) ncmd 1
        Status: Success (0x00)
        HCI version: Reserved (0x0e) - Revision 12520 (0x30e8)
        LMP version: Reserved (0x0e) - Subversion 12520 (0x30e8)
        Manufacturer: Nordic Semiconductor ASA (89)
zephyr.exe[1697281]: < HCI Command: Read Local Supported Commands (0x04|0x0002) plen 0                                #7 1.314209
> HCI Event: Command Complete (0x0e) plen 68                                                                          #8 1.315737
      Read Local Supported Commands (0x04|0x0002) ncmd 1
        Status: Success (0x00)
        Commands: 119 entries
          Disconnect (Octet 0 - Bit 5)
          Read Remote Version Information (Octet 2 - Bit 7)
          Set Event Mask (Octet 5 - Bit 6)
          Reset (Octet 5 - Bit 7)
          Read Connection Accept Timeout (Octet 7 - Bit 2)
          Write Connection Accept Timeout (Octet 7 - Bit 3)
          Read Transmit Power Level (Octet 10 - Bit 2)
          Set Controller To Host Flow Control (Octet 10 - Bit 5)
          Host Buffer Size (Octet 10 - Bit 6)
          Host Number of Completed Packets (Octet 10 - Bit 7)
          Read Local Version Information (Octet 14 - Bit 3)
          Read Local Supported Features (Octet 14 - Bit 5)
          Read BD ADDR (Octet 15 - Bit 1)
          Read RSSI (Octet 15 - Bit 5)
          Set Event Mask Page 2 (Octet 22 - Bit 2)
          LE Set Event Mask (Octet 25 - Bit 0)
          LE Read Buffer Size (Octet 25 - Bit 1)
          LE Read Local Supported Features (Octet 25 - Bit 2)
          LE Set Random Address (Octet 25 - Bit 4)
          LE Set Advertising Parameters (Octet 25 - Bit 5)
          LE Read Advertising Channel TX Power (Octet 25 - Bit 6)
          LE Set Advertising Data (Octet 25 - Bit 7)
          LE Set Scan Response Data (Octet 26 - Bit 0)
          LE Set Advertise Enable (Octet 26 - Bit 1)
          LE Set Scan Parameters (Octet 26 - Bit 2)
          LE Set Scan Enable (Octet 26 - Bit 3)
          LE Create Connection (Octet 26 - Bit 4)
          LE Create Connection Cancel (Octet 26 - Bit 5)
          LE Read Accept List Size (Octet 26 - Bit 6)
          LE Clear Accept List (Octet 26 - Bit 7)
          LE Add Device To Accept List (Octet 27 - Bit 0)
          LE Remove Device From Accept List (Octet 27 - Bit 1)
          LE Connection Update (Octet 27 - Bit 2)
          LE Set Host Channel Classification (Octet 27 - Bit 3)
          LE Read Channel Map (Octet 27 - Bit 4)
          LE Read Remote Used Features (Octet 27 - Bit 5)
          LE Encrypt (Octet 27 - Bit 6)
          LE Rand (Octet 27 - Bit 7)
          LE Start Encryption (Octet 28 - Bit 0)
          LE Long Term Key Request Reply (Octet 28 - Bit 1)
          LE Long Term Key Request Neg Reply (Octet 28 - Bit 2)
          LE Read Supported States (Octet 28 - Bit 3)
          LE Receiver Test (Octet 28 - Bit 4)
          LE Transmitter Test (Octet 28 - Bit 5)
          LE Test End (Octet 28 - Bit 6)
          Read Authenticated Payload Timeout (Octet 32 - Bit 4)
          Write Authenticated Payload Timeout (Octet 32 - Bit 5)
          LE Set Data Length (Octet 33 - Bit 6)
          LE Read Suggested Default Data Length (Octet 33 - Bit 7)
          LE Write Suggested Default Data Length (Octet 34 - Bit 0)
          LE Add Device To Resolving List (Octet 34 - Bit 3)
          LE Remove Device From Resolving List (Octet 34 - Bit 4)
          LE Clear Resolving List (Octet 34 - Bit 5)
          LE Read Resolving List Size (Octet 34 - Bit 6)
          LE Set Address Resolution Enable (Octet 35 - Bit 1)
          LE Set Resolvable Private Address Timeout (Octet 35 - Bit 2)
          LE Read Maximum Data Length (Octet 35 - Bit 3)
          LE Read PHY (Octet 35 - Bit 4)
          LE Set Default PHY (Octet 35 - Bit 5)
          LE Set PHY (Octet 35 - Bit 6)
          LE Enhanced Receiver Test (Octet 35 - Bit 7)
          LE Enhanced Transmitter Test (Octet 36 - Bit 0)
          LE Set Advertising Set Random Address (Octet 36 - Bit 1)
          LE Set Extended Advertising Parameters (Octet 36 - Bit 2)
          LE Set Extended Advertising Data (Octet 36 - Bit 3)
          LE Set Extended Scan Response Data (Octet 36 - Bit 4)
          LE Set Extended Advertising Enable (Octet 36 - Bit 5)
          LE Read Maximum Advertising Data Length (Octet 36 - Bit 6)
          LE Read Number of Supported Advertising Sets (Octet 36 - Bit 7)
          LE Remove Advertising Set (Octet 37 - Bit 0)
          LE Clear Advertising Sets (Octet 37 - Bit 1)
          LE Set Periodic Advertising Parameters (Octet 37 - Bit 2)
          LE Set Periodic Advertising Data (Octet 37 - Bit 3)
          LE Set Periodic Advertising Enable (Octet 37 - Bit 4)
          LE Set Extended Scan Parameters (Octet 37 - Bit 5)
          LE Set Extended Scan Enable (Octet 37 - Bit 6)
          LE Extended Create Connection (Octet 37 - Bit 7)
          LE Periodic Advertising Create Sync (Octet 38 - Bit 0)
          LE Periodic Advertising Create Sync Cancel (Octet 38 - Bit 1)
          LE Periodic Advertising Terminate Sync (Octet 38 - Bit 2)
          LE Add Device To Periodic Advertiser List (Octet 38 - Bit 3)
          LE Remove Device From Periodic Advertiser List (Octet 38 - Bit 4)
          LE Clear Periodic Advertiser List (Octet 38 - Bit 5)
          LE Read Periodic Advertiser List Size (Octet 38 - Bit 6)
          LE Read Transmit Power (Octet 38 - Bit 7)
          LE Read RF Path Compensation (Octet 39 - Bit 0)
          LE Write RF Path Compensation (Octet 39 - Bit 1)
          LE Set Privacy Mode (Octet 39 - Bit 2)
          LE Periodic Advertising Receive Enable (Octet 40 - Bit 5)
          LE Periodic Advertising Sync Transfer (Octet 40 - Bit 6)
          LE Periodic Advertising Set Info Transfer (Octet 40 - Bit 7)
          LE Periodic Advertising Sync Transfer Parameters (Octet 41 - Bit 0)
          LE Set Default Periodic Advertisng Sync Transfer Parameters (Octet 41 - Bit 1)
          LE Read Buffer v2 (Octet 41 - Bit 5)
          LE Read ISO TX Sync (Octet 41 - Bit 6)
          LE Set Connected Isochronous Group Parameters (Octet 41 - Bit 7)
          LE Set Connected Isochronous Group Parameters Test (Octet 42 - Bit 0)
          LE Create Connected Isochronous Stream (Octet 42 - Bit 1)
          LE Remove Connected Isochronous Group (Octet 42 - Bit 2)
          LE Accept Connected Isochronous Stream Request (Octet 42 - Bit 3)
          LE Reject Connected Isochronous Stream Request (Octet 42 - Bit 4)
          LE Create Broadcast Isochronous Group (Octet 42 - Bit 5)
          LE Create Broadcast Isochronous Group Test (Octet 42 - Bit 6)
          LE Terminate Broadcast Isochronous Group (Octet 42 - Bit 7)
          LE Broadcast Isochronous Group Create Sync (Octet 43 - Bit 0)
          LE Broadcast Isochronous Group Terminate Sync (Octet 43 - Bit 1)
          LE Request Peer SCA (Octet 43 - Bit 2)
          LE Setup Isochronous Data Path (Octet 43 - Bit 3)
          LE Remove Isochronous Data Path (Octet 43 - Bit 4)
          LE Isochronous Transmit Test (Octet 43 - Bit 5)
          LE Isochronous Receive Test (Octet 43 - Bit 6)
          LE Isochronous Read Test Counters (Octet 43 - Bit 7)
          LE Isochronous Read Test Counters (Octet 44 - Bit 0)
          LE Set Host Feature (Octet 44 - Bit 1)
          LE Read ISO link quality (Octet 44 - Bit 2)
          Octet 45 - Bit 6 
          Octet 46 - Bit 0 
          Octet 46 - Bit 1 
          Octet 46 - Bit 2 
zephyr.exe[1697281]: < HCI Command: Host Buffer Size (0x03|0x0033) plen 7                                             #9 1.334186
        ACL MTU: 255  ACL max packet: 16
        SCO MTU: 0    SCO max packet: 0
> HCI Event: Command Complete (0x0e) plen 4                                                                          #10 1.334996
      Host Buffer Size (0x03|0x0033) ncmd 1
        Status: Success (0x00)
zephyr.exe[1697281]: < HCI Command: Set Controller To Host Flow Control (0x03|0x0031) plen 1                         #11 1.354183
        Flow control: ACL Data Packets (0x01)
> HCI Event: Command Complete (0x0e) plen 4                                                                          #12 1.355057
      Set Controller To Host Flow Control (0x03|0x0031) ncmd 1
        Status: Success (0x00)
zephyr.exe[1697281]: < HCI Command: LE Read Local Supported Features (0x08|0x0003) plen 0                            #13 1.374210
> HCI Event: Command Complete (0x0e) plen 12                                                                         #14 1.374792
      LE Read Local Supported Features (0x08|0x0003) ncmd 1
        Status: Success (0x00)
        Features: 0xfd 0x79 0x00 0xf7 0x30 0x01 0x00 0x00
          LE Encryption
          Extended Reject Indication
          Peripheral-initiated Features Exchange
          LE Ping
          LE Data Packet Length Extension
          LL Privacy
          Extended Scanner Filter Policies
          LE 2M PHY
          LE Coded PHY
          LE Extended Advertising
          LE Periodic Advertising
          Channel Selection Algorithm #2
          Periodic Advertising Sync Transfer - Sender
          Periodic Advertising Sync Transfer - Recipient
          Sleep Clock Accuracy Updates
          Connected Isochronous Stream - Central
          Connected Isochronous Stream - Peripheral
          Isochronous Broadcaster
          Synchronized Receiver
          Periodic Advertising ADI support
          Connection Subrating
          Unknown features (0x0000010000000000)
zephyr.exe[1697281]: < HCI Command: LE Set Host Feature (0x08|0x0074) plen 2                                         #15 1.394204
        Bit Number: 32
          Connected Isochronous Stream (Host Support)
        Bit Value: 1
> HCI Event: Command Complete (0x0e) plen 4                                                                          #16 1.394796
      LE Set Host Feature (0x08|0x0074) ncmd 1
        Status: Success (0x00)
zephyr.exe[1697281]: < HCI Command: LE Read Buffer v2 (0x08|0x0060) plen 0                                           #17 1.414198
> HCI Event: Command Complete (0x0e) plen 10                                                                         #18 1.415641
      LE Read Buffer v2 (0x08|0x0060) ncmd 1
        Status: Success (0x00)
        ACL MTU: 27
        ACL max packet: 3
        ISO MTU: 318
        ISO max packet: 3
zephyr.exe[1697281]: < HCI Command: LE Read Maximum Advertising Data Length (0x08|0x003a) plen 0                     #19 1.434211
> HCI Event: Command Complete (0x0e) plen 6                                                                          #20 1.434983
      LE Read Maximum Advertising Data Length (0x08|0x003a) ncmd 1
        Status: Success (0x00)
        Max length: 1650
zephyr.exe[1697281]: < HCI Command: LE Read Supported States (0x08|0x001c) plen 0                                    #21 1.454183
> HCI Event: Command Complete (0x0e) plen 12                                                                         #22 1.454896
      LE Read Supported States (0x08|0x001c) ncmd 1
        Status: Success (0x00)
        States: 0x000003ff3e0306ff
          Non-connectable Advertising State
          Scannable Advertising State
          Connectable Advertising State
          High Duty Cycle Directed Advertising State
          Passive Scanning State
          Active Scanning State
          Initiating State
            and Connection State (Central Role)
          Connection State (Peripheral Role)
          Scannable Advertising State
            and Passive Scanning State
          Connectable Advertising State
            and Passive Scanning State
          Non-connectable Advertising State
            and Initiating State
          Scannable Advertising State
            and Initiating State
          Active Scanning State
            and Connection State (Central Role)
          Passive Scanning State
            and Connection State (Peripheral Role)
          Active Scanning State
            and Connection State (Peripheral Role)
          Initiating State
            and Connection State (Central Role)
            and Central Role & Central Role
          Low Duty Cycle Directed Advertising State
          Connectable Advertising State
            and Initiating State
            and Central Role & Peripheral Role
          High Duty Cycle Directed Advertising State
            and Initiating State
            and Central Role & Peripheral Role
          Low Duty Cycle Directed Advertising State
            and Initiating State
            and Central Role & Peripheral Role
          Connectable Advertising State
            and Connection State (Central Role)
            and Central Role & Peripheral Role
          High Duty Cycle Directed Advertising State
            and Connection State (Central Role)
            and Central Role & Peripheral Role
          Low Duty Cycle Directed Advertising State
            and Connection State (Central Role)
            and Central Role & Peripheral Role
          Connectable Advertising State
            and Connection State (Peripheral Role)
            and Central Role & Peripheral Role
          High Duty Cycle Directed Advertising State
            and Connection State (Peripheral Role)
            and Peripheral Role & Peripheral Role
          Low Duty Cycle Directed Advertising State
            and Connection State (Peripheral Role)
            and Peripheral Role & Peripheral Role
          Initiating State
            and Connection State (Peripheral Role)
            and Central Role & Peripheral Role
zephyr.exe[1697281]: < HCI Command: LE Read Maximum Data Length (0x08|0x002f) plen 0                                 #23 1.474217
> HCI Event: Command Complete (0x0e) plen 12                                                                         #24 1.474953
      LE Read Maximum Data Length (0x08|0x002f) ncmd 1
        Status: Success (0x00)
        Max TX octets: 251
        Max TX time: 2704
        Max RX octets: 251
        Max RX time: 2704
zephyr.exe[1697281]: < HCI Command: LE Write Suggested Default Data Length (0x08|0x0024) plen 4                      #25 1.494214
        TX octets: 251
        TX time: 2704
> HCI Event: Command Complete (0x0e) plen 4                                                                          #26 1.494962
      LE Write Suggested Default Data Length (0x08|0x0024) ncmd 1
        Status: Success (0x00)
zephyr.exe[1697281]: < HCI Command: LE Read Resolving List Size (0x08|0x002a) plen 0                                 #27 1.514167
> HCI Event: Command Complete (0x0e) plen 5                                                                          #28 1.514841
      LE Read Resolving List Size (0x08|0x002a) ncmd 1
        Status: Success (0x00)
        Size: 8
zephyr.exe[1697281]: < HCI Command: LE Set Event Mask (0x08|0x0001) plen 8                                           #29 1.534225
        Mask: 0x000002023f87fa5e
          LE Advertising Report
          LE Connection Update Complete
          LE Read Remote Used Features Complete
          LE Long Term Key Request
          LE Data Length Change
          LE Enhanced Connection Complete
          LE PHY Update Complete
          LE Extended Advertising Report
          LE Periodic Advertising Sync Established
          LE Periodic Advertising Report
          LE Periodic Advertising Sync Lost
          LE Extended Scan Timeout
          LE Extended Advertising Set Terminated
          LE Scan Request Received
          LE Periodic Advertising Sync Transfer Rvc
          LE CIS Established
          LE CIS Request
          LE Create BIG Complete
          LE Terminate BIG Complete
          LE BIG Sync Established Complete
          LE BIG Sync Lost
          LE BIG Info Advertising Report
          Unknown mask (0x0000020000000000)
> HCI Event: Command Complete (0x0e) plen 4                                                                          #30 1.534965
      LE Set Event Mask (0x08|0x0001) ncmd 1
        Status: Success (0x00)
zephyr.exe[1697281]: < HCI Command: Set Event Mask (0x03|0x0001) plen 8                                              #31 1.554219
        Mask: 0x2000800002008890
          Disconnection Complete
          Encryption Change
          Read Remote Version Information Complete
          Hardware Error
          Data Buffer Overflow
          Encryption Key Refresh Complete
          LE Meta
> HCI Event: Command Complete (0x0e) plen 4                                                                          #32 1.555287
      Set Event Mask (0x03|0x0001) ncmd 1
        Status: Success (0x00)
zephyr.exe[1697281]: < HCI Command: Read BD ADDR (0x04|0x0009) plen 0                                                #33 1.574216
> HCI Event: Command Complete (0x0e) plen 10                                                                         #34 1.574851
      Read BD ADDR (0x04|0x0009) ncmd 1
        Status: Success (0x00)
        Address: 00:00:00:00:00:00 (OUI 00-00-00)
zephyr.exe[1697281]: < HCI Command: LE Set Random Address (0x08|0x0005) plen 6                                       #35 1.594207
        Address: D5:B6:CC:31:DB:3B (Static)
> HCI Event: Command Complete (0x0e) plen 4                                                                          #36 1.595261
      LE Set Random Address (0x08|0x0005) ncmd 1
        Status: Success (0x00)
zephyr.exe[1697281]: < HCI Command: LE Set Extended Advertising Parameters (0x08|0x0036) plen 25                     #37 5.034294
        Handle: 0x00
        Properties: 0x0013
          Connectable
          Scannable
          Use legacy advertising PDUs: ADV_IND
        Min advertising interval: 100.000 msec (0x00a0)
        Max advertising interval: 150.000 msec (0x00f0)
        Channel map: 37, 38, 39 (0x07)
        Own address type: Random (0x01)
        Peer address type: Public (0x00)
        Peer address: 00:00:00:00:00:00 (OUI 00-00-00)
        Filter policy: Allow Scan Request from Any, Allow Connect Request from Any (0x00)
        TX power: Host has no preference (0x7f)
        Primary PHY: LE 1M (0x01)
        Secondary max skip: 0x00
        Secondary PHY: LE 1M (0x01)
        SID: 0x00
        Scan request notifications: Disabled (0x00)
> HCI Event: Command Complete (0x0e) plen 5                                                                          #38 5.035735
      LE Set Extended Advertising Parameters (0x08|0x0036) ncmd 1
        Status: Success (0x00)
        TX power (selected): 0 dbm (0x00)
zephyr.exe[1697281]: < HCI Command: LE Set Advertising Set Random Address (0x08|0x0035) plen 7                       #39 5.054240
        Advertising handle: 0x00
        Advertising random address: D5:B6:CC:31:DB:3B (Static)
> HCI Event: Command Complete (0x0e) plen 4                                                                          #40 5.055009
      LE Set Advertising Set Random Address (0x08|0x0035) ncmd 1
        Status: Success (0x00)
zephyr.exe[1697281]: < HCI Command: LE Set Extended Advertising Data (0x08|0x0037) plen 22                           #41 5.074247
        Handle: 0x00
        Operation: Complete extended advertising data (0x03)
        Fragment preference: Minimize fragmentation (0x01)
        Data length: 0x12
        Flags: 0x06
          LE General Discoverable Mode
          BR/EDR Not Supported
        Name (complete): Tester_2CB6EE
> HCI Event: Command Complete (0x0e) plen 4                                                                          #42 5.075365
      LE Set Extended Advertising Data (0x08|0x0037) ncmd 1
        Status: Success (0x00)
zephyr.exe[1697281]: < HCI Command: LE Set Extended Scan Response Data (0x08|0x0038) plen 4                          #43 5.094258
        Handle: 0x00
        Operation: Complete scan response data (0x03)
        Fragment preference: Minimize fragmentation (0x01)
        Data length: 0x00
> HCI Event: Command Complete (0x0e) plen 4                                                                          #44 5.095155
      LE Set Extended Scan Response Data (0x08|0x0038) ncmd 1
        Status: Success (0x00)
zephyr.exe[1697281]: < HCI Command: LE Set Extended Advertising Enable (0x08|0x0039) plen 6                          #45 5.114256
        Extended advertising: Enabled (0x01)
        Number of sets: 1 (0x01)
        Entry 0
          Handle: 0x00
          Duration: 0 ms (0x00)
          Max ext adv events: 0
> HCI Event: Command Complete (0x0e) plen 4                                                                          #46 5.115226
      LE Set Extended Advertising Enable (0x08|0x0039) ncmd 1
        Status: Success (0x00)
> HCI Event: LE Meta Event (0x3e) plen 31                                                                            #47 5.225961
      LE Enhanced Connection Complete (0x0a)
        Status: Success (0x00)
        Handle: 687
        Role: Peripheral (0x01)
        Peer address type: Public (0x00)
        Peer address: C0:07:E8:2C:B6:EE (OUI C0-07-E8)
        Local resolvable private address: 00:00:00:00:00:00 (Non-Resolvable)
        Peer resolvable private address: 00:00:00:00:00:00 (Non-Resolvable)
        Connection interval: 62.50 msec (0x0032)
        Connection latency: 0 (0x0000)
        Supervision timeout: 25120 msec (0x09d0)
        Central clock accuracy: 0x07
> HCI Event: LE Meta Event (0x3e) plen 6                                                                             #48 5.225963
      LE Advertising Set Terminated (0x12)
        Status: Success (0x00)
        Handle: 0
        Connection handle: 687
        Number of completed extended advertising events: 0
zephyr.exe[1697281]: < HCI Command: LE Read Remote Used Features (0x08|0x0016) plen 2                                #49 5.234395
        Handle: 687 Address: C0:07:E8:2C:B6:EE (OUI C0-07-E8)
> HCI Event: Command Status (0x0f) plen 4                                                                            #50 5.235072
      LE Read Remote Used Features (0x08|0x0016) ncmd 1
        Status: Success (0x00)
zephyr.exe[1697281]: < HCI Command: LE Set PHY (0x08|0x0032) plen 7                                                  #51 5.254249
        Handle: 687 Address: C0:07:E8:2C:B6:EE (OUI C0-07-E8)
        All PHYs preference: 0x00
        TX PHYs preference: 0x02
          LE 2M
        RX PHYs preference: 0x02
          LE 2M
        PHY options preference: Reserved (0x0000)
> HCI Event: Command Status (0x0f) plen 4                                                                            #52 5.254877
      LE Set PHY (0x08|0x0032) ncmd 1
        Status: Success (0x00)
zephyr.exe[1697281]: < ACL Data TX: Handle 687 [1/3] flags 0x00 dlen 7                                               #53 5.274305
      ATT: Exchange MTU Request (0x02) len 2
        Client RX MTU: 251
> HCI Event: Number of Completed Packets (0x13) plen 5                                                               #54 5.351870
        Num handles: 1
        Handle: 687 Address: C0:07:E8:2C:B6:EE (OUI C0-07-E8)
        Count: 1
        Buffers: 0/3
        #53: len 7 (0 Kb/s)
        Latency: 77 msec (77-77 msec ~77 msec)
> HCI Event: LE Meta Event (0x3e) plen 12                                                                            #55 5.414875
      LE Read Remote Used Features (0x04)
        Status: Success (0x00)
        Handle: 687 Address: C0:07:E8:2C:B6:EE (OUI C0-07-E8)
        Features: 0x2d 0x49 0x01 0xf7 0xef 0x39 0x00 0x80
          LE Encryption
          Extended Reject Indication
          Peripheral-initiated Features Exchange
          LE Data Packet Length Extension
          LE 2M PHY
          LE Coded PHY
          Channel Selection Algorithm #2
          Minimum Number of Used Channels Procedure
          Periodic Advertising Sync Transfer - Sender
          Periodic Advertising Sync Transfer - Recipient
          Sleep Clock Accuracy Updates
          Connected Isochronous Stream - Central
          Connected Isochronous Stream - Peripheral
          Isochronous Broadcaster
          Synchronized Receiver
          Connected Isochronous Stream (Host Support)
          LE Power Control Request
          LE Power Control Request
          LE Path Loss Monitoring
          Connection Subrating
          Connection Subrating (Host Support)
          Channel Classification
          Unknown features (0x8000390000000000)
> HCI Event: LE Meta Event (0x3e) plen 6                                                                             #56 5.914124
      LE PHY Update Complete (0x0c)
        Status: Success (0x00)
        Handle: 687 Address: C0:07:E8:2C:B6:EE (OUI C0-07-E8)
        TX PHY: LE 2M (0x02)
        RX PHY: LE 2M (0x02)
> ACL Data RX: Handle 687 flags 0x02 dlen 11                                                                         #57 7.726985
      SMP: Pairing Request (0x01) len 6
        IO capability: KeyboardDisplay (0x04)
        OOB data: Authentication data not present (0x00)
        Authentication requirement: Bonding, No MITM, SC, No Keypresses (0x09)
        Max encryption key size: 16
        Initiator key distribution: EncKey IdKey (0x03)
        Responder key distribution: EncKey IdKey Sign (0x07)
> ACL Data RX: Handle 687 flags 0x02 dlen 7                                                                          #58 7.727355
      ATT: Exchange MTU Response (0x03) len 2
        Server RX MTU: 23
zephyr.exe[1697281]: < HCI Command: Host Number of Completed Packets (0x03|0x0035) plen 5                            #59 7.734299
        Num handles: 1
        Handle: 687 Address: C0:07:E8:2C:B6:EE (OUI C0-07-E8)
        Count: 1
zephyr.exe[1697281]: < ACL Data TX: Handle 687 [1/3] flags 0x00 dlen 11                                              #60 7.734502
      SMP: Pairing Response (0x02) len 6
        IO capability: DisplayOnly (0x00)
        OOB data: Authentication data not present (0x00)
        Authentication requirement: Bonding, No MITM, SC, No Keypresses (0x09)
        Max encryption key size: 16
        Initiator key distribution: IdKey (0x02)
        Responder key distribution: Sign (0x04)
zephyr.exe[1697281]: < HCI Command: Host Number of Completed Packets (0x03|0x0035) plen 5                            #61 7.734798
        Num handles: 1
        Handle: 687 Address: C0:07:E8:2C:B6:EE (OUI C0-07-E8)
        Count: 1
> HCI Event: Number of Completed Packets (0x13) plen 5                                                               #62 7.851992
        Num handles: 1
        Handle: 687 Address: C0:07:E8:2C:B6:EE (OUI C0-07-E8)
        Count: 1
        Buffers: 0/3
        #60: len 11 (0 Kb/s)
        Latency: 117 msec (77-117 msec ~97 msec)
> ACL Data RX: Handle 687 flags 0x02 dlen 27                                                                         #63 7.852335
> ACL Data RX: Handle 687 flags 0x01 dlen 27                                                                         #64 7.852691
> ACL Data RX: Handle 687 flags 0x01 dlen 15                                                                         #65 7.852952
      SMP: Pairing Public Key (0x0c) len 64
        X[32]: aed94d2d62bd31a0c502e594b63eac07b2b8b3a1c388518261435a563d8f8b04
        Y[32]: 87aceec0f059a13fc26ec65624d4a58ce4e6e08a048a32afb111d3c95114a052
zephyr.exe[1697281]: < HCI Command: Host Number of Completed Packets (0x03|0x0035) plen 5                            #66 7.854434
        Num handles: 1
        Handle: 687 Address: C0:07:E8:2C:B6:EE (OUI C0-07-E8)
        Count: 1
zephyr.exe[1697281]: < HCI Command: Host Number of Completed Packets (0x03|0x0035) plen 5                            #67 7.854538
        Num handles: 1
        Handle: 687 Address: C0:07:E8:2C:B6:EE (OUI C0-07-E8)
        Count: 1
zephyr.exe[1697281]: < HCI Command: Host Number of Completed Packets (0x03|0x0035) plen 5                            #68 7.854555
        Num handles: 1
        Handle: 687 Address: C0:07:E8:2C:B6:EE (OUI C0-07-E8)
        Count: 1
zephyr.exe[1697281]: < ACL Data TX: Handle 687 [1/3] flags 0x00 dlen 27                                              #69 7.855306
zephyr.exe[1697281]: < ACL Data TX: Handle 687 flags 0x01 dlen 27                                                    #70 7.855375
zephyr.exe[1697281]: < ACL Data TX: Handle 687 flags 0x01 dlen 15                                                    #71 7.855396
      SMP: Pairing Public Key (0x0c) len 64
        X[32]: 98308440221e2d910f0e54b71e7ec652857aa9b5a0dc65028824cc19db1226e9
        Y[32]: 67a4816bcb62efb21701e31fdb27561a6217575fb007a8bbdabe7e28b6f68482
> HCI Event: Number of Completed Packets (0x13) plen 5                                                               #72 7.914819
        Num handles: 1
        Handle: 687 Address: C0:07:E8:2C:B6:EE (OUI C0-07-E8)
        Count: 1
        Buffers: 0/3
        #69: len 27 (3 Kb/s)
        Latency: 59 msec (59-117 msec ~78 msec)
> HCI Event: Number of Completed Packets (0x13) plen 5                                                               #73 7.915298
        Num handles: 1
        Handle: 687 Address: C0:07:E8:2C:B6:EE (OUI C0-07-E8)
        Count: 1
        Buffers: underflow/3
        #70: len 27 (3 Kb/s)
        Latency: 59 msec (59-117 msec ~69 msec)
zephyr.exe[1697281]: < ACL Data TX: Handle 687 [1/3] flags 0x00 dlen 21                                              #74 7.934336
      SMP: Pairing Confirm (0x03) len 16
        Confirm value[16]: 159370a49db1368420154a22a6c5307b
> HCI Event: Number of Completed Packets (0x13) plen 5                                                               #75 7.976883
        Num handles: 1
        Handle: 687 Address: C0:07:E8:2C:B6:EE (OUI C0-07-E8)
        Count: 1
        Buffers: 0/3
        #71: len 15 (0 Kb/s)
        Latency: 121 msec (59-121 msec ~95 msec)
> HCI Event: Number of Completed Packets (0x13) plen 5                                                               #76 8.039469
        Num handles: 1
        Handle: 687 Address: C0:07:E8:2C:B6:EE (OUI C0-07-E8)
        Count: 1
        Buffers: underflow/3
        #74: len 21 (1 Kb/s)
        Latency: 105 msec (59-121 msec ~100 msec)
> ACL Data RX: Handle 687 flags 0x02 dlen 21                                                                         #77 8.039761
      SMP: Pairing Random (0x04) len 16
        Random value[16]: 8346c4312f07a5da0000000000000000
zephyr.exe[1697281]: < HCI Command: Host Number of Completed Packets (0x03|0x0035) plen 5                            #78 8.054397
        Num handles: 1
        Handle: 687 Address: C0:07:E8:2C:B6:EE (OUI C0-07-E8)
        Count: 1
zephyr.exe[1697281]: < ACL Data TX: Handle 687 [1/3] flags 0x00 dlen 21                                              #79 8.054699
      SMP: Pairing Random (0x04) len 16
        Random value[16]: 8e6108f966a694cbe26df70bb96773e6
> HCI Event: Number of Completed Packets (0x13) plen 5                                                               #80 8.164364
        Num handles: 1
        Handle: 687 Address: C0:07:E8:2C:B6:EE (OUI C0-07-E8)
        Count: 1
        Buffers: 0/3
        #79: len 21 (1 Kb/s)
        Latency: 109 msec (59-121 msec ~104 msec)
> ACL Data RX: Handle 687 flags 0x02 dlen 21                                                                         #81 8.227060
      SMP: Pairing DHKey Check (0x0d) len 16
        E[16]: c63aa839a0a5c0e017338ceb986623d3
zephyr.exe[1697281]: < HCI Command: Host Number of Completed Packets (0x03|0x0035) plen 5                            #82 8.234306
        Num handles: 1
        Handle: 687 Address: C0:07:E8:2C:B6:EE (OUI C0-07-E8)
        Count: 1
zephyr.exe[1697281]: < ACL Data TX: Handle 687 [1/3] flags 0x00 dlen 21                                              #83 8.234471
      SMP: Pairing DHKey Check (0x0d) len 16
        E[16]: 8e083a9f114e89f2771cbffa867b9c09
> HCI Event: Number of Completed Packets (0x13) plen 5                                                               #84 8.351884
        Num handles: 1
        Handle: 687 Address: C0:07:E8:2C:B6:EE (OUI C0-07-E8)
        Count: 1
        Buffers: 0/3
        #83: len 21 (1 Kb/s)
        Latency: 117 msec (59-121 msec ~111 msec)
> HCI Event: LE Meta Event (0x3e) plen 13                                                                            #85 8.414814
      LE Long Term Key Request (0x05)
        Handle: 687 Address: C0:07:E8:2C:B6:EE (OUI C0-07-E8)
        Random number: 0x0000000000000000
        Encrypted diversifier: 0x0000
zephyr.exe[1697281]: < HCI Command: LE Long Term Key Request Reply (0x08|0x001a) plen 18                             #86 8.434314
        Handle: 687 Address: C0:07:E8:2C:B6:EE (OUI C0-07-E8)
        Long term key[16]: 72a04cef5f2a12d7afea12e3a347c46b
> HCI Event: Command Complete (0x0e) plen 6                                                                          #87 8.435355
      LE Long Term Key Request Reply (0x08|0x001a) ncmd 1
        Status: Success (0x00)
        Handle: 687 Address: C0:07:E8:2C:B6:EE (OUI C0-07-E8)
> HCI Event: Encryption Change (0x08) plen 4                                                                         #88 8.727112
        Status: Success (0x00)
        Handle: 687 Address: C0:07:E8:2C:B6:EE (OUI C0-07-E8)
        Encryption: Enabled with AES-CCM (0x01)
zephyr.exe[1697281]: < ACL Data TX: Handle 687 [1/3] flags 0x00 dlen 21                                              #89 8.844300
      SMP: Signing Information (0x0a) len 16
        Signature key[16]: 5da095555cc64d02679f89a05211af56
> HCI Event: Number of Completed Packets (0x13) plen 5                                                               #90 8.914544
        Num handles: 1
        Handle: 687 Address: C0:07:E8:2C:B6:EE (OUI C0-07-E8)
        Count: 1
        Buffers: 0/3
        #89: len 21 (2 Kb/s)
        Latency: 70 msec (59-121 msec ~90 msec)
> ACL Data RX: Handle 687 flags 0x02 dlen 21                                                                         #91 8.914710
      SMP: Identity Information (0x08) len 16
        Identity resolving key[16]: 4d9df11a6796758676a7c35420b1cc06
> ACL Data RX: Handle 687 flags 0x02 dlen 12                                                                         #92 8.914967
      SMP: Identity Address Information (0x09) len 7
        Address: C0:07:E8:2C:B6:EE (OUI C0-07-E8)
zephyr.exe[1697281]: < HCI Command: Host Number of Completed Packets (0x03|0x0035) plen 5                            #93 8.934345
        Num handles: 1
        Handle: 687 Address: C0:07:E8:2C:B6:EE (OUI C0-07-E8)
        Count: 1
zephyr.exe[1697281]: < HCI Command: LE Add Device To Resolving List (0x08|0x0027) plen 39                            #94 8.934465
        Address type: Public (0x00)
        Address: C0:07:E8:2C:B6:EE (OUI C0-07-E8)
        Peer identity resolving key[16]: 4d9df11a6796758676a7c35420b1cc06
        Local identity resolving key[16]: 00000000000000000000000000000000
> HCI Event: Command Complete (0x0e) plen 4                                                                          #95 8.935975
      LE Add Device To Resolving List (0x08|0x0027) ncmd 1
        Status: Success (0x00)
zephyr.exe[1697281]: < HCI Command: LE Set Privacy Mode (0x08|0x004e) plen 8                                         #96 8.954321
        Peer Identity address type: Public (0x00)
        Peer Identity address: C0:07:E8:2C:B6:EE (OUI C0-07-E8)
        Privacy Mode: Use Device Privacy (0x01)
> HCI Event: Command Complete (0x0e) plen 4                                                                          #97 8.955997
      LE Set Privacy Mode (0x08|0x004e) ncmd 1
        Status: Success (0x00)
zephyr.exe[1697281]: < HCI Command: LE Set Address Resolution Enable (0x08|0x002d) plen 1                            #98 8.974343
        Address resolution: Enabled (0x01)
> HCI Event: Command Complete (0x0e) plen 4                                                                          #99 8.974941
      LE Set Address Resolution Enable (0x08|0x002d) ncmd 1
        Status: Success (0x00)
zephyr.exe[1697281]: < HCI Command: Host Number of Completed Packets (0x03|0x0035) plen 5                           #100 8.994277
        Num handles: 1
        Handle: 687 Address: C0:07:E8:2C:B6:EE (OUI C0-07-E8)
        Count: 1
> ACL Data RX: Handle 687 flags 0x02 dlen 13                                                                        #101 9.039574
      ATT: Find By Type Value Request (0x06) len 8
        Handle range: 0x0001-0xffff
        Attribute type: Primary Service (0x2800)
          UUID: Generic Media Control (0x1849)
zephyr.exe[1697281]: < HCI Command: Host Number of Completed Packets (0x03|0x0035) plen 5                           #102 9.054325
        Num handles: 1
        Handle: 687 Address: C0:07:E8:2C:B6:EE (OUI C0-07-E8)
        Count: 1
zephyr.exe[1697281]: < ACL Data TX: Handle 687 [1/3] flags 0x00 dlen 9                                              #103 9.054459
      ATT: Find By Type Value Response (0x07) len 4
        Handle range: 0x0037-0x0075
> HCI Event: Number of Completed Packets (0x13) plen 5                                                              #104 9.166086
        Num handles: 1
        Handle: 687 Address: C0:07:E8:2C:B6:EE (OUI C0-07-E8)
        Count: 1
        Buffers: 0/3
        #103: len 9 (0 Kb/s)
        Latency: 111 msec (59-121 msec ~101 msec)
> ACL Data RX: Handle 687 flags 0x02 dlen 13                                                                        #105 9.166090
      ATT: Find By Type Value Request (0x06) len 8
        Handle range: 0x0076-0xffff
        Attribute type: Primary Service (0x2800)
          UUID: Generic Media Control (0x1849)
zephyr.exe[1697281]: < HCI Command: Host Number of Completed Packets (0x03|0x0035) plen 5                           #106 9.174158
        Num handles: 1
        Handle: 687 Address: C0:07:E8:2C:B6:EE (OUI C0-07-E8)
        Count: 1
zephyr.exe[1697281]: < ACL Data TX: Handle 687 [1/3] flags 0x00 dlen 9                                              #107 9.174313
      ATT: Error Response (0x01) len 4
        Find By Type Value Request (0x06)
        Handle: 0x0076
        Error: Attribute Not Found (0x0a)
> HCI Event: Number of Completed Packets (0x13) plen 5                                                              #108 9.289407
        Num handles: 1
        Handle: 687 Address: C0:07:E8:2C:B6:EE (OUI C0-07-E8)
        Count: 1
        Buffers: 0/3
        #107: len 9 (0 Kb/s)
        Latency: 115 msec (59-121 msec ~108 msec)
> ACL Data RX: Handle 687 flags 0x02 dlen 11                                                                        #109 9.289699
      ATT: Read By Type Request (0x08) len 6
        Handle range: 0x0037-0x0075
        Attribute type: Characteristic (0x2803)
zephyr.exe[1697281]: < HCI Command: Host Number of Completed Packets (0x03|0x0035) plen 5                           #110 9.294160
        Num handles: 1
        Handle: 687 Address: C0:07:E8:2C:B6:EE (OUI C0-07-E8)
        Count: 1
zephyr.exe[1697281]: < ACL Data TX: Handle 687 [1/3] flags 0x00 dlen 20                                             #111 9.294468
      ATT: Read By Type Response (0x09) len 15
        Attribute data length: 7
        Attribute data list: 2 entries
        Handle: 0x0039
        Value[5]: 123a00932b
            Properties: 0x12
              Read (0x02)
              Notify (0x10)
            Value Handle: 0x003a
            Value UUID: Media Player Name (0x2b93)
        Handle: 0x003c
        Value[5]: 023d00942b
            Properties: 0x02
              Read (0x02)
            Value Handle: 0x003d
            Value UUID: Media Player Icon Object ID (0x2b94)
> HCI Event: Number of Completed Packets (0x13) plen 5                                                              #112 9.414395
        Num handles: 1
        Handle: 687 Address: C0:07:E8:2C:B6:EE (OUI C0-07-E8)
        Count: 1
        Buffers: 0/3
        #111: len 20 (1 Kb/s)
        Latency: 119 msec (59-121 msec ~114 msec)
> ACL Data RX: Handle 687 flags 0x02 dlen 11                                                                        #113 9.414639
      ATT: Read By Type Request (0x08) len 6
        Handle range: 0x003d-0x0075
        Attribute type: Characteristic (0x2803)
zephyr.exe[1697281]: < HCI Command: Host Number of Completed Packets (0x03|0x0035) plen 5                           #114 9.434341
        Num handles: 1
        Handle: 687 Address: C0:07:E8:2C:B6:EE (OUI C0-07-E8)
        Count: 1
zephyr.exe[1697281]: < ACL Data TX: Handle 687 [1/3] flags 0x00 dlen 20                                             #115 9.435426
      ATT: Read By Type Response (0x09) len 15
        Attribute data length: 7
        Attribute data list: 2 entries
        Handle: 0x003e
        Value[5]: 023f00952b
            Properties: 0x02
              Read (0x02)
            Value Handle: 0x003f
            Value UUID: Media Player Icon URL (0x2b95)
        Handle: 0x0040
        Value[5]: 104100962b
            Properties: 0x10
              Notify (0x10)
            Value Handle: 0x0041
            Value UUID: Track Changed (0x2b96)
> HCI Event: Number of Completed Packets (0x13) plen 5                                                              #116 9.539440
        Num handles: 1
        Handle: 687 Address: C0:07:E8:2C:B6:EE (OUI C0-07-E8)
        Count: 1
        Buffers: 0/3
        #115: len 20 (1 Kb/s)
        Latency: 104 msec (59-121 msec ~109 msec)
> ACL Data RX: Handle 687 flags 0x02 dlen 11                                                                        #117 9.539689
      ATT: Read By Type Request (0x08) len 6
        Handle range: 0x0041-0x0075
        Attribute type: Characteristic (0x2803)
zephyr.exe[1697281]: < HCI Command: Host Number of Completed Packets (0x03|0x0035) plen 5                           #118 9.554415
        Num handles: 1
        Handle: 687 Address: C0:07:E8:2C:B6:EE (OUI C0-07-E8)
        Count: 1
zephyr.exe[1697281]: < ACL Data TX: Handle 687 [1/3] flags 0x00 dlen 20                                             #119 9.554967
      ATT: Read By Type Response (0x09) len 15
        Attribute data length: 7
        Attribute data list: 2 entries
        Handle: 0x0043
        Value[5]: 124400972b
            Properties: 0x12
              Read (0x02)
              Notify (0x10)
            Value Handle: 0x0044
            Value UUID: Track Title (0x2b97)
        Handle: 0x0046
        Value[5]: 124700982b
            Properties: 0x12
              Read (0x02)
              Notify (0x10)
            Value Handle: 0x0047
            Value UUID: Track Duration (0x2b98)
> HCI Event: Number of Completed Packets (0x13) plen 5                                                              #120 9.664452
        Num handles: 1
        Handle: 687 Address: C0:07:E8:2C:B6:EE (OUI C0-07-E8)
        Count: 1
        Buffers: 0/3
        #119: len 20 (1 Kb/s)
        Latency: 109 msec (59-121 msec ~109 msec)
> ACL Data RX: Handle 687 flags 0x02 dlen 11                                                                        #121 9.664881
      ATT: Read By Type Request (0x08) len 6
        Handle range: 0x0047-0x0075
        Attribute type: Characteristic (0x2803)
zephyr.exe[1697281]: < HCI Command: Host Number of Completed Packets (0x03|0x0035) plen 5                           #122 9.674390
        Num handles: 1
        Handle: 687 Address: C0:07:E8:2C:B6:EE (OUI C0-07-E8)
        Count: 1
zephyr.exe[1697281]: < ACL Data TX: Handle 687 [1/3] flags 0x00 dlen 20                                             #123 9.674693
      ATT: Read By Type Response (0x09) len 15
        Attribute data length: 7
        Attribute data list: 2 entries
        Handle: 0x0049
        Value[5]: 1e4a00992b
            Properties: 0x1e
              Read (0x02)
              Write Without Response (0x04)
              Write (0x08)
              Notify (0x10)
            Value Handle: 0x004a
            Value UUID: Track Position (0x2b99)
        Handle: 0x004c
        Value[5]: 1e4d009a2b
            Properties: 0x1e
              Read (0x02)
              Write Without Response (0x04)
              Write (0x08)
              Notify (0x10)
            Value Handle: 0x004d
            Value UUID: Playback Speed (0x2b9a)
> HCI Event: Number of Completed Packets (0x13) plen 5                                                              #124 9.789458
        Num handles: 1
        Handle: 687 Address: C0:07:E8:2C:B6:EE (OUI C0-07-E8)
        Count: 1
        Buffers: 0/3
        #123: len 20 (1 Kb/s)
        Latency: 114 msec (59-121 msec ~112 msec)
> ACL Data RX: Handle 687 flags 0x02 dlen 11                                                                        #125 9.789637
      ATT: Read By Type Request (0x08) len 6
        Handle range: 0x004d-0x0075
        Attribute type: Characteristic (0x2803)
zephyr.exe[1697281]: < HCI Command: Host Number of Completed Packets (0x03|0x0035) plen 5                           #126 9.794439
        Num handles: 1
        Handle: 687 Address: C0:07:E8:2C:B6:EE (OUI C0-07-E8)
        Count: 1
zephyr.exe[1697281]: < ACL Data TX: Handle 687 [1/3] flags 0x00 dlen 20                                             #127 9.794935
      ATT: Read By Type Response (0x09) len 15
        Attribute data length: 7
        Attribute data list: 2 entries
        Handle: 0x004f
        Value[5]: 1250009b2b
            Properties: 0x12
              Read (0x02)
              Notify (0x10)
            Value Handle: 0x0050
            Value UUID: Seeking Speed (0x2b9b)
        Handle: 0x0052
        Value[5]: 0253009c2b
            Properties: 0x02
              Read (0x02)
            Value Handle: 0x0053
            Value UUID: Current Track Segments Object ID (0x2b9c)
> HCI Event: Number of Completed Packets (0x13) plen 5                                                              #128 9.914445
        Num handles: 1
        Handle: 687 Address: C0:07:E8:2C:B6:EE (OUI C0-07-E8)
        Count: 1
        Buffers: 0/3
        #127: len 20 (1 Kb/s)
        Latency: 119 msec (59-121 msec ~115 msec)
> ACL Data RX: Handle 687 flags 0x02 dlen 11                                                                        #129 9.914746
      ATT: Read By Type Request (0x08) len 6
        Handle range: 0x0053-0x0075
        Attribute type: Characteristic (0x2803)
zephyr.exe[1697281]: < HCI Command: Host Number of Completed Packets (0x03|0x0035) plen 5                           #130 9.934409
        Num handles: 1
        Handle: 687 Address: C0:07:E8:2C:B6:EE (OUI C0-07-E8)
        Count: 1
zephyr.exe[1697281]: < ACL Data TX: Handle 687 [1/3] flags 0x00 dlen 20                                             #131 9.934583
      ATT: Read By Type Response (0x09) len 15
        Attribute data length: 7
        Attribute data list: 2 entries
        Handle: 0x0054
        Value[5]: 1e55009d2b
            Properties: 0x1e
              Read (0x02)
              Write Without Response (0x04)
              Write (0x08)
              Notify (0x10)
            Value Handle: 0x0055
            Value UUID: Current Track Object ID (0x2b9d)
        Handle: 0x0057
        Value[5]: 1e58009e2b
            Properties: 0x1e
              Read (0x02)
              Write Without Response (0x04)
              Write (0x08)
              Notify (0x10)
            Value Handle: 0x0058
            Value UUID: Next Track Object ID (0x2b9e)
> HCI Event: Number of Completed Packets (0x13) plen 5                                                             #132 10.039485
        Num handles: 1
        Handle: 687 Address: C0:07:E8:2C:B6:EE (OUI C0-07-E8)
        Count: 1
        Buffers: 0/3
        #131: len 20 (1 Kb/s)
        Latency: 104 msec (59-121 msec ~110 msec)
> ACL Data RX: Handle 687 flags 0x02 dlen 11                                                                       #133 10.039716
      ATT: Read By Type Request (0x08) len 6
        Handle range: 0x0058-0x0075
        Attribute type: Characteristic (0x2803)
zephyr.exe[1697281]: < HCI Command: Host Number of Completed Packets (0x03|0x0035) plen 5                          #134 10.054276
        Num handles: 1
        Handle: 687 Address: C0:07:E8:2C:B6:EE (OUI C0-07-E8)
        Count: 1
zephyr.exe[1697281]: < ACL Data TX: Handle 687 [1/3] flags 0x00 dlen 20                                            #135 10.054804
      ATT: Read By Type Response (0x09) len 15
        Attribute data length: 7
        Attribute data list: 2 entries
        Handle: 0x005a
        Value[5]: 125b009f2b
            Properties: 0x12
              Read (0x02)
              Notify (0x10)
            Value Handle: 0x005b
            Value UUID: Parent Group Object ID (0x2b9f)
        Handle: 0x005d
        Value[5]: 1e5e00a02b
            Properties: 0x1e
              Read (0x02)
              Write Without Response (0x04)
              Write (0x08)
              Notify (0x10)
            Value Handle: 0x005e
            Value UUID: Current Group Object ID (0x2ba0)
> HCI Event: Number of Completed Packets (0x13) plen 5                                                             #136 10.164491
        Num handles: 1
        Handle: 687 Address: C0:07:E8:2C:B6:EE (OUI C0-07-E8)
        Count: 1
        Buffers: 0/3
        #135: len 20 (1 Kb/s)
        Latency: 109 msec (59-121 msec ~110 msec)
> ACL Data RX: Handle 687 flags 0x02 dlen 11                                                                       #137 10.164790
      ATT: Read By Type Request (0x08) len 6
        Handle range: 0x005e-0x0075
        Attribute type: Characteristic (0x2803)
zephyr.exe[1697281]: < HCI Command: Host Number of Completed Packets (0x03|0x0035) plen 5                          #138 10.174366
        Num handles: 1
        Handle: 687 Address: C0:07:E8:2C:B6:EE (OUI C0-07-E8)
        Count: 1
zephyr.exe[1697281]: < ACL Data TX: Handle 687 [1/3] flags 0x00 dlen 20                                            #139 10.174921
      ATT: Read By Type Response (0x09) len 15
        Attribute data length: 7
        Attribute data list: 2 entries
        Handle: 0x0060
        Value[5]: 1e6100a12b
            Properties: 0x1e
              Read (0x02)
              Write Without Response (0x04)
              Write (0x08)
              Notify (0x10)
            Value Handle: 0x0061
            Value UUID: Playing Order (0x2ba1)
        Handle: 0x0063
        Value[5]: 026400a22b
            Properties: 0x02
              Read (0x02)
            Value Handle: 0x0064
            Value UUID: Playing Orders Supported (0x2ba2)
> HCI Event: Number of Completed Packets (0x13) plen 5                                                             #140 10.289462
        Num handles: 1
        Handle: 687 Address: C0:07:E8:2C:B6:EE (OUI C0-07-E8)
        Count: 1
        Buffers: 0/3
        #139: len 20 (1 Kb/s)
        Latency: 114 msec (59-121 msec ~112 msec)
> ACL Data RX: Handle 687 flags 0x02 dlen 11                                                                       #141 10.289877
      ATT: Read By Type Request (0x08) len 6
        Handle range: 0x0064-0x0075
        Attribute type: Characteristic (0x2803)
zephyr.exe[1697281]: < HCI Command: Host Number of Completed Packets (0x03|0x0035) plen 5                          #142 10.294426
        Num handles: 1
        Handle: 687 Address: C0:07:E8:2C:B6:EE (OUI C0-07-E8)
        Count: 1
zephyr.exe[1697281]: < ACL Data TX: Handle 687 [1/3] flags 0x00 dlen 20                                            #143 10.294962
      ATT: Read By Type Response (0x09) len 15
        Attribute data length: 7
        Attribute data list: 2 entries
        Handle: 0x0065
        Value[5]: 126600a32b
            Properties: 0x12
              Read (0x02)
              Notify (0x10)
            Value Handle: 0x0066
            Value UUID: Media State (0x2ba3)
        Handle: 0x0068
        Value[5]: 1c6900a42b
            Properties: 0x1c
              Write Without Response (0x04)
              Write (0x08)
              Notify (0x10)
            Value Handle: 0x0069
            Value UUID: Media Control Point (0x2ba4)
> HCI Event: Number of Completed Packets (0x13) plen 5                                                             #144 10.414482
        Num handles: 1
        Handle: 687 Address: C0:07:E8:2C:B6:EE (OUI C0-07-E8)
        Count: 1
        Buffers: 0/3
        #143: len 20 (1 Kb/s)
        Latency: 119 msec (59-121 msec ~115 msec)
> ACL Data RX: Handle 687 flags 0x02 dlen 11                                                                       #145 10.414834
      ATT: Read By Type Request (0x08) len 6
        Handle range: 0x0069-0x0075
        Attribute type: Characteristic (0x2803)
zephyr.exe[1697281]: < HCI Command: Host Number of Completed Packets (0x03|0x0035) plen 5                          #146 10.434361
        Num handles: 1
        Handle: 687 Address: C0:07:E8:2C:B6:EE (OUI C0-07-E8)
        Count: 1
zephyr.exe[1697281]: < ACL Data TX: Handle 687 [1/3] flags 0x00 dlen 20                                            #147 10.434687
      ATT: Read By Type Response (0x09) len 15
        Attribute data length: 7
        Attribute data list: 2 entries
        Handle: 0x006b
        Value[5]: 126c00a52b
            Properties: 0x12
              Read (0x02)
              Notify (0x10)
            Value Handle: 0x006c
            Value UUID: Media Control Point Opcodes Supported (0x2ba5)
        Handle: 0x006e
        Value[5]: 1c6f00a72b
            Properties: 0x1c
              Write Without Response (0x04)
              Write (0x08)
              Notify (0x10)
            Value Handle: 0x006f
            Value UUID: Search Control Point (0x2ba7)
> HCI Event: Number of Completed Packets (0x13) plen 5                                                             #148 10.539556
        Num handles: 1
        Handle: 687 Address: C0:07:E8:2C:B6:EE (OUI C0-07-E8)
        Count: 1
        Buffers: 0/3
        #147: len 20 (1 Kb/s)
        Latency: 104 msec (59-121 msec ~110 msec)
> ACL Data RX: Handle 687 flags 0x02 dlen 11                                                                       #149 10.539916
      ATT: Read By Type Request (0x08) len 6
        Handle range: 0x006f-0x0075
        Attribute type: Characteristic (0x2803)
zephyr.exe[1697281]: < HCI Command: Host Number of Completed Packets (0x03|0x0035) plen 5                          #150 10.554381
        Num handles: 1
        Handle: 687 Address: C0:07:E8:2C:B6:EE (OUI C0-07-E8)
        Count: 1
zephyr.exe[1697281]: < ACL Data TX: Handle 687 [1/3] flags 0x00 dlen 20                                            #151 10.554889
      ATT: Read By Type Response (0x09) len 15
        Attribute data length: 7
        Attribute data list: 2 entries
        Handle: 0x0071
        Value[5]: 127200a62b
            Properties: 0x12
              Read (0x02)
              Notify (0x10)
            Value Handle: 0x0072
            Value UUID: Search Results Object ID (0x2ba6)
        Handle: 0x0074
        Value[5]: 027500ba2b
            Properties: 0x02
              Read (0x02)
            Value Handle: 0x0075
            Value UUID: Content Control ID (0x2bba)
> HCI Event: Number of Completed Packets (0x13) plen 5                                                             #152 10.664453
        Num handles: 1
        Handle: 687 Address: C0:07:E8:2C:B6:EE (OUI C0-07-E8)
        Count: 1
        Buffers: 0/3
        #151: len 20 (1 Kb/s)
        Latency: 109 msec (59-121 msec ~109 msec)
> ACL Data RX: Handle 687 flags 0x02 dlen 11                                                                       #153 10.664711
      ATT: Read By Type Request (0x08) len 6
        Handle range: 0x0075-0x0075
        Attribute type: Characteristic (0x2803)
zephyr.exe[1697281]: < HCI Command: Host Number of Completed Packets (0x03|0x0035) plen 5                          #154 10.674391
        Num handles: 1
        Handle: 687 Address: C0:07:E8:2C:B6:EE (OUI C0-07-E8)
        Count: 1
zephyr.exe[1697281]: < ACL Data TX: Handle 687 [1/3] flags 0x00 dlen 9                                             #155 10.674946
      ATT: Error Response (0x01) len 4
        Read By Type Request (0x08)
        Handle: 0x0075
        Error: Attribute Not Found (0x0a)
> HCI Event: Number of Completed Packets (0x13) plen 5                                                             #156 10.789471
        Num handles: 1
        Handle: 687 Address: C0:07:E8:2C:B6:EE (OUI C0-07-E8)
        Count: 1
        Buffers: 0/3
        #155: len 9 (0 Kb/s)
        Latency: 114 msec (59-121 msec ~112 msec)
> ACL Data RX: Handle 687 flags 0x02 dlen 9                                                                        #157 10.789743
      ATT: Find Information Request (0x04) len 4
        Handle range: 0x003b-0x003b
zephyr.exe[1697281]: < HCI Command: Host Number of Completed Packets (0x03|0x0035) plen 5                          #158 10.794462
        Num handles: 1
        Handle: 687 Address: C0:07:E8:2C:B6:EE (OUI C0-07-E8)
        Count: 1
zephyr.exe[1697281]: < ACL Data TX: Handle 687 [1/3] flags 0x00 dlen 10                                            #159 10.794937
      ATT: Find Information Response (0x05) len 5
        Format: UUID-16 (0x01)
        Handle: 0x003b
        UUID: Client Characteristic Configuration (0x2902)
> HCI Event: Number of Completed Packets (0x13) plen 5                                                             #160 10.914463
        Num handles: 1
        Handle: 687 Address: C0:07:E8:2C:B6:EE (OUI C0-07-E8)
        Count: 1
        Buffers: 0/3
        #159: len 10 (0 Kb/s)
        Latency: 119 msec (59-121 msec ~115 msec)
> ACL Data RX: Handle 687 flags 0x02 dlen 9                                                                        #161 10.915006
      ATT: Find Information Request (0x04) len 4
        Handle range: 0x0042-0x0042
zephyr.exe[1697281]: < HCI Command: Host Number of Completed Packets (0x03|0x0035) plen 5                          #162 10.934376
        Num handles: 1
        Handle: 687 Address: C0:07:E8:2C:B6:EE (OUI C0-07-E8)
        Count: 1
zephyr.exe[1697281]: < ACL Data TX: Handle 687 [1/3] flags 0x00 dlen 10                                            #163 10.935054
      ATT: Find Information Response (0x05) len 5
        Format: UUID-16 (0x01)
        Handle: 0x0042
        UUID: Client Characteristic Configuration (0x2902)
> HCI Event: Number of Completed Packets (0x13) plen 5                                                             #164 11.039446
        Num handles: 1
        Handle: 687 Address: C0:07:E8:2C:B6:EE (OUI C0-07-E8)
        Count: 1
        Buffers: 0/3
        #163: len 10 (0 Kb/s)
        Latency: 104 msec (59-121 msec ~110 msec)
> ACL Data RX: Handle 687 flags 0x02 dlen 9                                                                        #165 11.040016
      ATT: Find Information Request (0x04) len 4
        Handle range: 0x0045-0x0045
zephyr.exe[1697281]: < HCI Command: Host Number of Completed Packets (0x03|0x0035) plen 5                          #166 11.054455
        Num handles: 1
        Handle: 687 Address: C0:07:E8:2C:B6:EE (OUI C0-07-E8)
        Count: 1
zephyr.exe[1697281]: < ACL Data TX: Handle 687 [1/3] flags 0x00 dlen 10                                            #167 11.055037
      ATT: Find Information Response (0x05) len 5
        Format: UUID-16 (0x01)
        Handle: 0x0045
        UUID: Client Characteristic Configuration (0x2902)
> HCI Event: Number of Completed Packets (0x13) plen 5                                                             #168 11.164464
        Num handles: 1
        Handle: 687 Address: C0:07:E8:2C:B6:EE (OUI C0-07-E8)
        Count: 1
        Buffers: 0/3
        #167: len 10 (0 Kb/s)
        Latency: 109 msec (59-121 msec ~109 msec)
> ACL Data RX: Handle 687 flags 0x02 dlen 9                                                                        #169 11.164834
      ATT: Find Information Request (0x04) len 4
        Handle range: 0x0048-0x0048
zephyr.exe[1697281]: < HCI Command: Host Number of Completed Packets (0x03|0x0035) plen 5                          #170 11.174372
        Num handles: 1
        Handle: 687 Address: C0:07:E8:2C:B6:EE (OUI C0-07-E8)
        Count: 1
zephyr.exe[1697281]: < ACL Data TX: Handle 687 [1/3] flags 0x00 dlen 10                                            #171 11.174667
      ATT: Find Information Response (0x05) len 5
        Format: UUID-16 (0x01)
        Handle: 0x0048
        UUID: Client Characteristic Configuration (0x2902)
> HCI Event: Number of Completed Packets (0x13) plen 5                                                             #172 11.289455
        Num handles: 1
        Handle: 687 Address: C0:07:E8:2C:B6:EE (OUI C0-07-E8)
        Count: 1
        Buffers: 0/3
        #171: len 10 (0 Kb/s)
        Latency: 114 msec (59-121 msec ~112 msec)
> ACL Data RX: Handle 687 flags 0x02 dlen 9                                                                        #173 11.289990
      ATT: Find Information Request (0x04) len 4
        Handle range: 0x004b-0x004b
zephyr.exe[1697281]: < HCI Command: Host Number of Completed Packets (0x03|0x0035) plen 5                          #174 11.294359
        Num handles: 1
        Handle: 687 Address: C0:07:E8:2C:B6:EE (OUI C0-07-E8)
        Count: 1
zephyr.exe[1697281]: < ACL Data TX: Handle 687 [1/3] flags 0x00 dlen 10                                            #175 11.295069
      ATT: Find Information Response (0x05) len 5
        Format: UUID-16 (0x01)
        Handle: 0x004b
        UUID: Client Characteristic Configuration (0x2902)
> HCI Event: Number of Completed Packets (0x13) plen 5                                                             #176 11.414462
        Num handles: 1
        Handle: 687 Address: C0:07:E8:2C:B6:EE (OUI C0-07-E8)
        Count: 1
        Buffers: 0/3
        #175: len 10 (0 Kb/s)
        Latency: 119 msec (59-121 msec ~115 msec)
> ACL Data RX: Handle 687 flags 0x02 dlen 9                                                                        #177 11.414731
      ATT: Find Information Request (0x04) len 4
        Handle range: 0x004e-0x004e
zephyr.exe[1697281]: < HCI Command: Host Number of Completed Packets (0x03|0x0035) plen 5                          #178 11.434380
        Num handles: 1
        Handle: 687 Address: C0:07:E8:2C:B6:EE (OUI C0-07-E8)
        Count: 1
zephyr.exe[1697281]: < ACL Data TX: Handle 687 [1/3] flags 0x00 dlen 10                                            #179 11.434871
      ATT: Find Information Response (0x05) len 5
        Format: UUID-16 (0x01)
        Handle: 0x004e
        UUID: Client Characteristic Configuration (0x2902)
> HCI Event: Number of Completed Packets (0x13) plen 5                                                             #180 11.539444
        Num handles: 1
        Handle: 687 Address: C0:07:E8:2C:B6:EE (OUI C0-07-E8)
        Count: 1
        Buffers: 0/3
        #179: len 10 (0 Kb/s)
        Latency: 104 msec (59-121 msec ~110 msec)
> ACL Data RX: Handle 687 flags 0x02 dlen 9                                                                        #181 11.539615
      ATT: Find Information Request (0x04) len 4
        Handle range: 0x0051-0x0051
zephyr.exe[1697281]: < HCI Command: Host Number of Completed Packets (0x03|0x0035) plen 5                          #182 11.554411
        Num handles: 1
        Handle: 687 Address: C0:07:E8:2C:B6:EE (OUI C0-07-E8)
        Count: 1
zephyr.exe[1697281]: < ACL Data TX: Handle 687 [1/3] flags 0x00 dlen 10                                            #183 11.554958
      ATT: Find Information Response (0x05) len 5
        Format: UUID-16 (0x01)
        Handle: 0x0051
        UUID: Client Characteristic Configuration (0x2902)
> HCI Event: Number of Completed Packets (0x13) plen 5                                                             #184 11.664497
        Num handles: 1
        Handle: 687 Address: C0:07:E8:2C:B6:EE (OUI C0-07-E8)
        Count: 1
        Buffers: 0/3
        #183: len 10 (0 Kb/s)
        Latency: 109 msec (59-121 msec ~109 msec)
> ACL Data RX: Handle 687 flags 0x02 dlen 9                                                                        #185 11.664935
      ATT: Find Information Request (0x04) len 4
        Handle range: 0x0056-0x0056
zephyr.exe[1697281]: < HCI Command: Host Number of Completed Packets (0x03|0x0035) plen 5                          #186 11.674415
        Num handles: 1
        Handle: 687 Address: C0:07:E8:2C:B6:EE (OUI C0-07-E8)
        Count: 1
zephyr.exe[1697281]: < ACL Data TX: Handle 687 [1/3] flags 0x00 dlen 10                                            #187 11.674971
      ATT: Find Information Response (0x05) len 5
        Format: UUID-16 (0x01)
        Handle: 0x0056
        UUID: Client Characteristic Configuration (0x2902)
> HCI Event: Number of Completed Packets (0x13) plen 5                                                             #188 11.789507
        Num handles: 1
        Handle: 687 Address: C0:07:E8:2C:B6:EE (OUI C0-07-E8)
        Count: 1
        Buffers: 0/3
        #187: len 10 (0 Kb/s)
        Latency: 114 msec (59-121 msec ~112 msec)
> ACL Data RX: Handle 687 flags 0x02 dlen 9                                                                        #189 11.789865
      ATT: Find Information Request (0x04) len 4
        Handle range: 0x0059-0x0059
zephyr.exe[1697281]: < HCI Command: Host Number of Completed Packets (0x03|0x0035) plen 5                          #190 11.794469
        Num handles: 1
        Handle: 687 Address: C0:07:E8:2C:B6:EE (OUI C0-07-E8)
        Count: 1
zephyr.exe[1697281]: < ACL Data TX: Handle 687 [1/3] flags 0x00 dlen 10                                            #191 11.794788
      ATT: Find Information Response (0x05) len 5
        Format: UUID-16 (0x01)
        Handle: 0x0059
        UUID: Client Characteristic Configuration (0x2902)
> HCI Event: Number of Completed Packets (0x13) plen 5                                                             #192 11.914483
        Num handles: 1
        Handle: 687 Address: C0:07:E8:2C:B6:EE (OUI C0-07-E8)
        Count: 1
        Buffers: 0/3
        #191: len 10 (0 Kb/s)
        Latency: 119 msec (59-121 msec ~115 msec)
> ACL Data RX: Handle 687 flags 0x02 dlen 9                                                                        #193 11.914814
      ATT: Find Information Request (0x04) len 4
        Handle range: 0x005c-0x005c
zephyr.exe[1697281]: < HCI Command: Host Number of Completed Packets (0x03|0x0035) plen 5                          #194 11.934373
        Num handles: 1
        Handle: 687 Address: C0:07:E8:2C:B6:EE (OUI C0-07-E8)
        Count: 1
zephyr.exe[1697281]: < ACL Data TX: Handle 687 [1/3] flags 0x00 dlen 10                                            #195 11.934857
      ATT: Find Information Response (0x05) len 5
        Format: UUID-16 (0x01)
        Handle: 0x005c
        UUID: Client Characteristic Configuration (0x2902)
> HCI Event: Number of Completed Packets (0x13) plen 5                                                             #196 12.039539
        Num handles: 1
        Handle: 687 Address: C0:07:E8:2C:B6:EE (OUI C0-07-E8)
        Count: 1
        Buffers: 0/3
        #195: len 10 (0 Kb/s)
        Latency: 104 msec (59-121 msec ~110 msec)
> ACL Data RX: Handle 687 flags 0x02 dlen 9                                                                        #197 12.039633
      ATT: Find Information Request (0x04) len 4
        Handle range: 0x005f-0x005f
zephyr.exe[1697281]: < HCI Command: Host Number of Completed Packets (0x03|0x0035) plen 5                          #198 12.054463
        Num handles: 1
        Handle: 687 Address: C0:07:E8:2C:B6:EE (OUI C0-07-E8)
        Count: 1
zephyr.exe[1697281]: < ACL Data TX: Handle 687 [1/3] flags 0x00 dlen 10                                            #199 12.054924
      ATT: Find Information Response (0x05) len 5
        Format: UUID-16 (0x01)
        Handle: 0x005f
        UUID: Client Characteristic Configuration (0x2902)
> HCI Event: Number of Completed Packets (0x13) plen 5                                                             #200 12.164486
        Num handles: 1
        Handle: 687 Address: C0:07:E8:2C:B6:EE (OUI C0-07-E8)
        Count: 1
        Buffers: 0/3
        #199: len 10 (0 Kb/s)
        Latency: 109 msec (59-121 msec ~109 msec)
> ACL Data RX: Handle 687 flags 0x02 dlen 9                                                                        #201 12.164721
      ATT: Find Information Request (0x04) len 4
        Handle range: 0x0062-0x0062
zephyr.exe[1697281]: < HCI Command: Host Number of Completed Packets (0x03|0x0035) plen 5                          #202 12.174459
        Num handles: 1
        Handle: 687 Address: C0:07:E8:2C:B6:EE (OUI C0-07-E8)
        Count: 1
zephyr.exe[1697281]: < ACL Data TX: Handle 687 [1/3] flags 0x00 dlen 10                                            #203 12.174898
      ATT: Find Information Response (0x05) len 5
        Format: UUID-16 (0x01)
        Handle: 0x0062
        UUID: Client Characteristic Configuration (0x2902)
> HCI Event: Number of Completed Packets (0x13) plen 5                                                             #204 12.289478
        Num handles: 1
        Handle: 687 Address: C0:07:E8:2C:B6:EE (OUI C0-07-E8)
        Count: 1
        Buffers: 0/3
        #203: len 10 (0 Kb/s)
        Latency: 114 msec (59-121 msec ~112 msec)
> ACL Data RX: Handle 687 flags 0x02 dlen 9                                                                        #205 12.289691
      ATT: Find Information Request (0x04) len 4
        Handle range: 0x0067-0x0067
zephyr.exe[1697281]: < HCI Command: Host Number of Completed Packets (0x03|0x0035) plen 5                          #206 12.294464
        Num handles: 1
        Handle: 687 Address: C0:07:E8:2C:B6:EE (OUI C0-07-E8)
        Count: 1
zephyr.exe[1697281]: < ACL Data TX: Handle 687 [1/3] flags 0x00 dlen 10                                            #207 12.294985
      ATT: Find Information Response (0x05) len 5
        Format: UUID-16 (0x01)
        Handle: 0x0067
        UUID: Client Characteristic Configuration (0x2902)
> HCI Event: Number of Completed Packets (0x13) plen 5                                                             #208 12.414480
        Num handles: 1
        Handle: 687 Address: C0:07:E8:2C:B6:EE (OUI C0-07-E8)
        Count: 1
        Buffers: 0/3
        #207: len 10 (0 Kb/s)
        Latency: 119 msec (59-121 msec ~115 msec)
> ACL Data RX: Handle 687 flags 0x02 dlen 9                                                                        #209 12.414831
      ATT: Find Information Request (0x04) len 4
        Handle range: 0x006a-0x006a
zephyr.exe[1697281]: < HCI Command: Host Number of Completed Packets (0x03|0x0035) plen 5                          #210 12.434372
        Num handles: 1
        Handle: 687 Address: C0:07:E8:2C:B6:EE (OUI C0-07-E8)
        Count: 1
zephyr.exe[1697281]: < ACL Data TX: Handle 687 [1/3] flags 0x00 dlen 10                                            #211 12.434877
      ATT: Find Information Response (0x05) len 5
        Format: UUID-16 (0x01)
        Handle: 0x006a
        UUID: Client Characteristic Configuration (0x2902)
> HCI Event: Number of Completed Packets (0x13) plen 5                                                             #212 12.539459
        Num handles: 1
        Handle: 687 Address: C0:07:E8:2C:B6:EE (OUI C0-07-E8)
        Count: 1
        Buffers: 0/3
        #211: len 10 (0 Kb/s)
        Latency: 104 msec (59-121 msec ~110 msec)
> ACL Data RX: Handle 687 flags 0x02 dlen 9                                                                        #213 12.539853
      ATT: Find Information Request (0x04) len 4
        Handle range: 0x006d-0x006d
zephyr.exe[1697281]: < HCI Command: Host Number of Completed Packets (0x03|0x0035) plen 5                          #214 12.554374
        Num handles: 1
        Handle: 687 Address: C0:07:E8:2C:B6:EE (OUI C0-07-E8)
        Count: 1
zephyr.exe[1697281]: < ACL Data TX: Handle 687 [1/3] flags 0x00 dlen 10                                            #215 12.554877
      ATT: Find Information Response (0x05) len 5
        Format: UUID-16 (0x01)
        Handle: 0x006d
        UUID: Client Characteristic Configuration (0x2902)
> HCI Event: Number of Completed Packets (0x13) plen 5                                                             #216 12.664482
        Num handles: 1
        Handle: 687 Address: C0:07:E8:2C:B6:EE (OUI C0-07-E8)
        Count: 1
        Buffers: 0/3
        #215: len 10 (0 Kb/s)
        Latency: 109 msec (59-121 msec ~109 msec)
> ACL Data RX: Handle 687 flags 0x02 dlen 9                                                                        #217 12.664631
      ATT: Find Information Request (0x04) len 4
        Handle range: 0x0070-0x0070
zephyr.exe[1697281]: < HCI Command: Host Number of Completed Packets (0x03|0x0035) plen 5                          #218 12.674384
        Num handles: 1
        Handle: 687 Address: C0:07:E8:2C:B6:EE (OUI C0-07-E8)
        Count: 1
zephyr.exe[1697281]: < ACL Data TX: Handle 687 [1/3] flags 0x00 dlen 10                                            #219 12.674672
      ATT: Find Information Response (0x05) len 5
        Format: UUID-16 (0x01)
        Handle: 0x0070
        UUID: Client Characteristic Configuration (0x2902)
> HCI Event: Number of Completed Packets (0x13) plen 5                                                             #220 12.789499
        Num handles: 1
        Handle: 687 Address: C0:07:E8:2C:B6:EE (OUI C0-07-E8)
        Count: 1
        Buffers: 0/3
        #219: len 10 (0 Kb/s)
        Latency: 114 msec (59-121 msec ~112 msec)
> ACL Data RX: Handle 687 flags 0x02 dlen 9                                                                        #221 12.790209
      ATT: Find Information Request (0x04) len 4
        Handle range: 0x0073-0x0073
zephyr.exe[1697281]: < HCI Command: Host Number of Completed Packets (0x03|0x0035) plen 5                          #222 12.794388
        Num handles: 1
        Handle: 687 Address: C0:07:E8:2C:B6:EE (OUI C0-07-E8)
        Count: 1
zephyr.exe[1697281]: < ACL Data TX: Handle 687 [1/3] flags 0x00 dlen 10                                            #223 12.794916
      ATT: Find Information Response (0x05) len 5
        Format: UUID-16 (0x01)
        Handle: 0x0073
        UUID: Client Characteristic Configuration (0x2902)
> HCI Event: Number of Completed Packets (0x13) plen 5                                                             #224 12.976967
        Num handles: 1
        Handle: 687 Address: C0:07:E8:2C:B6:EE (OUI C0-07-E8)
        Count: 1
        Buffers: 0/3
        #223: len 10 (0 Kb/s)
        Latency: 182 msec (59-182 msec ~147 msec)
> ACL Data RX: Handle 687 flags 0x02 dlen 9                                                                        #225 12.977125
      ATT: Write Request (0x12) len 4
        Handle: 0x0067
          Data[2]: 0000
zephyr.exe[1697281]: < HCI Command: Host Number of Completed Packets (0x03|0x0035) plen 5                          #226 13.000224
        Num handles: 1
        Handle: 687 Address: C0:07:E8:2C:B6:EE (OUI C0-07-E8)
        Count: 1
zephyr.exe[1697281]: < ACL Data TX: Handle 687 [1/3] flags 0x00 dlen 5                                             #227 13.001449
      ATT: Write Response (0x13) len 0
> HCI Event: Number of Completed Packets (0x13) plen 5                                                             #228 13.101980
        Num handles: 1
        Handle: 687 Address: C0:07:E8:2C:B6:EE (OUI C0-07-E8)
        Count: 1
        Buffers: 0/3
        #227: len 5 (0 Kb/s)
        Latency: 100 msec (59-182 msec ~123 msec)
> ACL Data RX: Handle 687 flags 0x02 dlen 9                                                                        #229 13.102166
      ATT: Write Request (0x12) len 4
        Handle: 0x0067
          Data[2]: 0100
zephyr.exe[1697281]: < HCI Command: Host Number of Completed Packets (0x03|0x0035) plen 5                          #230 13.114328
        Num handles: 1
        Handle: 687 Address: C0:07:E8:2C:B6:EE (OUI C0-07-E8)
        Count: 1
zephyr.exe[1697281]: < ACL Data TX: Handle 687 [1/3] flags 0x00 dlen 5                                             #231 13.115811
      ATT: Write Response (0x13) len 0
> HCI Event: Number of Completed Packets (0x13) plen 5                                                             #232 13.226969
        Num handles: 1
        Handle: 687 Address: C0:07:E8:2C:B6:EE (OUI C0-07-E8)
        Count: 1
        Buffers: 0/3
        #231: len 5 (0 Kb/s)
        Latency: 111 msec (59-182 msec ~117 msec)
> ACL Data RX: Handle 687 flags 0x02 dlen 9                                                                        #233 13.227218
      ATT: Write Request (0x12) len 4
        Handle: 0x006a
          Data[2]: 0000
zephyr.exe[1697281]: < HCI Command: Host Number of Completed Packets (0x03|0x0035) plen 5                          #234 13.234217
        Num handles: 1
        Handle: 687 Address: C0:07:E8:2C:B6:EE (OUI C0-07-E8)
        Count: 1
zephyr.exe[1697281]: < ACL Data TX: Handle 687 [1/3] flags 0x00 dlen 5                                             #235 13.238083
      ATT: Write Response (0x13) len 0
> HCI Event: Number of Completed Packets (0x13) plen 5                                                             #236 13.351923
        Num handles: 1
        Handle: 687 Address: C0:07:E8:2C:B6:EE (OUI C0-07-E8)
        Count: 1
        Buffers: 0/3
        #235: len 5 (0 Kb/s)
        Latency: 113 msec (59-182 msec ~115 msec)
> ACL Data RX: Handle 687 flags 0x02 dlen 9                                                                        #237 13.352309
      ATT: Write Request (0x12) len 4
        Handle: 0x006a
          Data[2]: 0100
zephyr.exe[1697281]: < HCI Command: Host Number of Completed Packets (0x03|0x0035) plen 5                          #238 13.365081
        Num handles: 1
        Handle: 687 Address: C0:07:E8:2C:B6:EE (OUI C0-07-E8)
        Count: 1
zephyr.exe[1697281]: < ACL Data TX: Handle 687 [1/3] flags 0x00 dlen 5                                             #239 13.366640
      ATT: Write Response (0x13) len 0
> HCI Event: Number of Completed Packets (0x13) plen 5                                                             #240 13.476972
        Num handles: 1
        Handle: 687 Address: C0:07:E8:2C:B6:EE (OUI C0-07-E8)
        Count: 1
        Buffers: 0/3
        #239: len 5 (0 Kb/s)
        Latency: 110 msec (59-182 msec ~113 msec)
> ACL Data RX: Handle 687 flags 0x02 dlen 9                                                                        #241 13.477494
      ATT: Write Request (0x12) len 4
        Handle: 0x0042
          Data[2]: 0000
zephyr.exe[1697281]: < HCI Command: Host Number of Completed Packets (0x03|0x0035) plen 5                          #242 13.495158
        Num handles: 1
        Handle: 687 Address: C0:07:E8:2C:B6:EE (OUI C0-07-E8)
        Count: 1
zephyr.exe[1697281]: < ACL Data TX: Handle 687 [1/3] flags 0x00 dlen 5                                             #243 13.496319
      ATT: Write Response (0x13) len 0
> HCI Event: Number of Completed Packets (0x13) plen 5                                                             #244 13.602054
        Num handles: 1
        Handle: 687 Address: C0:07:E8:2C:B6:EE (OUI C0-07-E8)
        Count: 1
        Buffers: 0/3
        #243: len 5 (0 Kb/s)
        Latency: 105 msec (59-182 msec ~109 msec)
> ACL Data RX: Handle 687 flags 0x02 dlen 9                                                                        #245 13.602126
      ATT: Write Request (0x12) len 4
        Handle: 0x0042
          Data[2]: 0100
zephyr.exe[1697281]: < HCI Command: Host Number of Completed Packets (0x03|0x0035) plen 5                          #246 13.616203
        Num handles: 1
        Handle: 687 Address: C0:07:E8:2C:B6:EE (OUI C0-07-E8)
        Count: 1
zephyr.exe[1697281]: < ACL Data TX: Handle 687 [1/3] flags 0x00 dlen 5                                             #247 13.617853
      ATT: Write Response (0x13) len 0
> HCI Event: Number of Completed Packets (0x13) plen 5                                                             #248 13.727052
        Num handles: 1
        Handle: 687 Address: C0:07:E8:2C:B6:EE (OUI C0-07-E8)
        Count: 1
        Buffers: 0/3
        #247: len 5 (0 Kb/s)
        Latency: 109 msec (59-182 msec ~109 msec)
> ACL Data RX: Handle 687 flags 0x02 dlen 9                                                                        #249 13.727425
      ATT: Write Request (0x12) len 4
        Handle: 0x004b
          Data[2]: 0000
zephyr.exe[1697281]: < HCI Command: Host Number of Completed Packets (0x03|0x0035) plen 5                          #250 13.739185
        Num handles: 1
        Handle: 687 Address: C0:07:E8:2C:B6:EE (OUI C0-07-E8)
        Count: 1
zephyr.exe[1697281]: < ACL Data TX: Handle 687 [1/3] flags 0x00 dlen 5                                             #251 13.742083
      ATT: Write Response (0x13) len 0
> HCI Event: Number of Completed Packets (0x13) plen 5                                                             #252 13.851943
        Num handles: 1
        Handle: 687 Address: C0:07:E8:2C:B6:EE (OUI C0-07-E8)
        Count: 1
        Buffers: 0/3
        #251: len 5 (0 Kb/s)
        Latency: 109 msec (59-182 msec ~109 msec)
> ACL Data RX: Handle 687 flags 0x02 dlen 9                                                                        #253 13.852278
      ATT: Write Request (0x12) len 4
        Handle: 0x004b
          Data[2]: 0100
zephyr.exe[1697281]: < HCI Command: Host Number of Completed Packets (0x03|0x0035) plen 5                          #254 13.861166
        Num handles: 1
        Handle: 687 Address: C0:07:E8:2C:B6:EE (OUI C0-07-E8)
        Count: 1
zephyr.exe[1697281]: < ACL Data TX: Handle 687 [1/3] flags 0x00 dlen 5                                             #255 13.863106
      ATT: Write Response (0x13) len 0
> HCI Event: Number of Completed Packets (0x13) plen 5                                                             #256 13.976958
        Num handles: 1
        Handle: 687 Address: C0:07:E8:2C:B6:EE (OUI C0-07-E8)
        Count: 1
        Buffers: 0/3
        #255: len 5 (0 Kb/s)
        Latency: 113 msec (59-182 msec ~111 msec)
> ACL Data RX: Handle 687 flags 0x02 dlen 9                                                                        #257 13.977313
      ATT: Write Request (0x12) len 4
        Handle: 0x0048
          Data[2]: 0000
zephyr.exe[1697281]: < HCI Command: Host Number of Completed Packets (0x03|0x0035) plen 5                          #258 13.997084
        Num handles: 1
        Handle: 687 Address: C0:07:E8:2C:B6:EE (OUI C0-07-E8)
        Count: 1
zephyr.exe[1697281]: < ACL Data TX: Handle 687 [1/3] flags 0x00 dlen 5                                             #259 13.997188
      ATT: Write Response (0x13) len 0
> HCI Event: Number of Completed Packets (0x13) plen 5                                                             #260 14.102013
        Num handles: 1
        Handle: 687 Address: C0:07:E8:2C:B6:EE (OUI C0-07-E8)
        Count: 1
        Buffers: 0/3
        #259: len 5 (0 Kb/s)
        Latency: 104 msec (59-182 msec ~108 msec)
> ACL Data RX: Handle 687 flags 0x02 dlen 9                                                                        #261 14.102404
      ATT: Write Request (0x12) len 4
        Handle: 0x0048
          Data[2]: 0100
zephyr.exe[1697281]: < HCI Command: Host Number of Completed Packets (0x03|0x0035) plen 5                          #262 14.117172
        Num handles: 1
        Handle: 687 Address: C0:07:E8:2C:B6:EE (OUI C0-07-E8)
        Count: 1
zephyr.exe[1697281]: < ACL Data TX: Handle 687 [1/3] flags 0x00 dlen 5                                             #263 14.118285
      ATT: Write Response (0x13) len 0
> HCI Event: Number of Completed Packets (0x13) plen 5                                                             #264 14.227075
        Num handles: 1
        Handle: 687 Address: C0:07:E8:2C:B6:EE (OUI C0-07-E8)
        Count: 1
        Buffers: 0/3
        #263: len 5 (0 Kb/s)
        Latency: 108 msec (59-182 msec ~108 msec)
> ACL Data RX: Handle 687 flags 0x02 dlen 9                                                                        #265 14.227152
      ATT: Write Request (0x12) len 4
        Handle: 0x0045
          Data[2]: 0000
zephyr.exe[1697281]: < HCI Command: Host Number of Completed Packets (0x03|0x0035) plen 5                          #266 14.240081
        Num handles: 1
        Handle: 687 Address: C0:07:E8:2C:B6:EE (OUI C0-07-E8)
        Count: 1
zephyr.exe[1697281]: < ACL Data TX: Handle 687 [1/3] flags 0x00 dlen 5                                             #267 14.240192
      ATT: Write Response (0x13) len 0
> HCI Event: Number of Completed Packets (0x13) plen 5                                                             #268 14.352010
        Num handles: 1
        Handle: 687 Address: C0:07:E8:2C:B6:EE (OUI C0-07-E8)
        Count: 1
        Buffers: 0/3
        #267: len 5 (0 Kb/s)
        Latency: 111 msec (59-182 msec ~110 msec)
> ACL Data RX: Handle 687 flags 0x02 dlen 9                                                                        #269 14.352620
      ATT: Write Request (0x12) len 4
        Handle: 0x0045
          Data[2]: 0100
zephyr.exe[1697281]: < HCI Command: Host Number of Completed Packets (0x03|0x0035) plen 5                          #270 14.364241
        Num handles: 1
        Handle: 687 Address: C0:07:E8:2C:B6:EE (OUI C0-07-E8)
        Count: 1
zephyr.exe[1697281]: < ACL Data TX: Handle 687 [1/3] flags 0x00 dlen 5                                             #271 14.365789
      ATT: Write Response (0x13) len 0
> HCI Event: Number of Completed Packets (0x13) plen 5                                                             #272 14.476987
        Num handles: 1
        Handle: 687 Address: C0:07:E8:2C:B6:EE (OUI C0-07-E8)
        Count: 1
        Buffers: 0/3
        #271: len 5 (0 Kb/s)
        Latency: 111 msec (59-182 msec ~110 msec)
> ACL Data RX: Handle 687 flags 0x02 dlen 9                                                                        #273 14.477311
      ATT: Write Request (0x12) len 4
        Handle: 0x0056
          Data[2]: 0000
zephyr.exe[1697281]: < HCI Command: Host Number of Completed Packets (0x03|0x0035) plen 5                          #274 14.497081
        Num handles: 1
        Handle: 687 Address: C0:07:E8:2C:B6:EE (OUI C0-07-E8)
        Count: 1
zephyr.exe[1697281]: < ACL Data TX: Handle 687 [1/3] flags 0x00 dlen 5                                             #275 14.497205
      ATT: Write Response (0x13) len 0
> HCI Event: Number of Completed Packets (0x13) plen 5                                                             #276 14.601998
        Num handles: 1
        Handle: 687 Address: C0:07:E8:2C:B6:EE (OUI C0-07-E8)
        Count: 1
        Buffers: 0/3
        #275: len 5 (0 Kb/s)
        Latency: 104 msec (59-182 msec ~107 msec)
> ACL Data RX: Handle 687 flags 0x02 dlen 9                                                                        #277 14.602204
      ATT: Write Request (0x12) len 4
        Handle: 0x0056
          Data[2]: 0100
zephyr.exe[1697281]: < HCI Command: Host Number of Completed Packets (0x03|0x0035) plen 5                          #278 14.615080
        Num handles: 1
        Handle: 687 Address: C0:07:E8:2C:B6:EE (OUI C0-07-E8)
        Count: 1
zephyr.exe[1697281]: < ACL Data TX: Handle 687 [1/3] flags 0x00 dlen 5                                             #279 14.616523
      ATT: Write Response (0x13) len 0
> HCI Event: Number of Completed Packets (0x13) plen 5                                                             #280 14.727015
        Num handles: 1
        Handle: 687 Address: C0:07:E8:2C:B6:EE (OUI C0-07-E8)
        Count: 1
        Buffers: 0/3
        #279: len 5 (0 Kb/s)
        Latency: 110 msec (59-182 msec ~109 msec)
> ACL Data RX: Handle 687 flags 0x02 dlen 9                                                                        #281 14.727136
      ATT: Write Request (0x12) len 4
        Handle: 0x0059
          Data[2]: 0000
zephyr.exe[1697281]: < HCI Command: Host Number of Completed Packets (0x03|0x0035) plen 5                          #282 14.735255
        Num handles: 1
        Handle: 687 Address: C0:07:E8:2C:B6:EE (OUI C0-07-E8)
        Count: 1
zephyr.exe[1697281]: < ACL Data TX: Handle 687 [1/3] flags 0x00 dlen 5                                             #283 14.736403
      ATT: Write Response (0x13) len 0
> HCI Event: Number of Completed Packets (0x13) plen 5                                                             #284 14.852000
        Num handles: 1
        Handle: 687 Address: C0:07:E8:2C:B6:EE (OUI C0-07-E8)
        Count: 1
        Buffers: 0/3
        #283: len 5 (0 Kb/s)
        Latency: 115 msec (59-182 msec ~112 msec)
> ACL Data RX: Handle 687 flags 0x02 dlen 9                                                                        #285 14.852444
      ATT: Write Request (0x12) len 4
        Handle: 0x0059
          Data[2]: 0100
zephyr.exe[1697281]: < HCI Command: Host Number of Completed Packets (0x03|0x0035) plen 5                          #286 14.858176
        Num handles: 1
        Handle: 687 Address: C0:07:E8:2C:B6:EE (OUI C0-07-E8)
        Count: 1
zephyr.exe[1697281]: < ACL Data TX: Handle 687 [1/3] flags 0x00 dlen 5                                             #287 14.860123
      ATT: Write Response (0x13) len 0
> HCI Event: Number of Completed Packets (0x13) plen 5                                                             #288 14.976966
        Num handles: 1
        Handle: 687 Address: C0:07:E8:2C:B6:EE (OUI C0-07-E8)
        Count: 1
        Buffers: 0/3
        #287: len 5 (0 Kb/s)
        Latency: 116 msec (59-182 msec ~114 msec)
> ACL Data RX: Handle 687 flags 0x02 dlen 9                                                                        #289 14.977326
      ATT: Write Request (0x12) len 4
        Handle: 0x005f
          Data[2]: 0000
zephyr.exe[1697281]: < HCI Command: Host Number of Completed Packets (0x03|0x0035) plen 5                          #290 14.995204
        Num handles: 1
        Handle: 687 Address: C0:07:E8:2C:B6:EE (OUI C0-07-E8)
        Count: 1
zephyr.exe[1697281]: < ACL Data TX: Handle 687 [1/3] flags 0x00 dlen 5                                             #291 14.995316
      ATT: Write Response (0x13) len 0
> HCI Event: Number of Completed Packets (0x13) plen 5                                                             #292 15.102003
        Num handles: 1
        Handle: 687 Address: C0:07:E8:2C:B6:EE (OUI C0-07-E8)
        Count: 1
        Buffers: 0/3
        #291: len 5 (0 Kb/s)
        Latency: 106 msec (59-182 msec ~110 msec)
> ACL Data RX: Handle 687 flags 0x02 dlen 9                                                                        #293 15.102343
      ATT: Write Request (0x12) len 4
        Handle: 0x005f
          Data[2]: 0100
zephyr.exe[1697281]: < HCI Command: Host Number of Completed Packets (0x03|0x0035) plen 5                          #294 15.114212
        Num handles: 1
        Handle: 687 Address: C0:07:E8:2C:B6:EE (OUI C0-07-E8)
        Count: 1
zephyr.exe[1697281]: < ACL Data TX: Handle 687 [1/3] flags 0x00 dlen 5                                             #295 15.115150
      ATT: Write Response (0x13) len 0
> HCI Event: Number of Completed Packets (0x13) plen 5                                                             #296 15.226936
        Num handles: 1
        Handle: 687 Address: C0:07:E8:2C:B6:EE (OUI C0-07-E8)
        Count: 1
        Buffers: 0/3
        #295: len 5 (0 Kb/s)
        Latency: 111 msec (59-182 msec ~111 msec)
> ACL Data RX: Handle 687 flags 0x02 dlen 7                                                                        #297 15.227308
      ATT: Read Request (0x0a) len 2
        Handle: 0x006c
zephyr.exe[1697281]: < HCI Command: Host Number of Completed Packets (0x03|0x0035) plen 5                          #298 15.236178
        Num handles: 1
        Handle: 687 Address: C0:07:E8:2C:B6:EE (OUI C0-07-E8)
        Count: 1
zephyr.exe[1697281]: < ACL Data TX: Handle 687 [1/3] flags 0x00 dlen 9                                             #299 15.237564
      ATT: Read Response (0x0b) len 4
        Value[4]: ffff1f00
> HCI Event: Number of Completed Packets (0x13) plen 5                                                             #300 15.352051
        Num handles: 1
        Handle: 687 Address: C0:07:E8:2C:B6:EE (OUI C0-07-E8)
        Count: 1
        Buffers: 0/3
        #299: len 9 (0 Kb/s)
        Latency: 114 msec (59-182 msec ~112 msec)
> ACL Data RX: Handle 687 flags 0x02 dlen 7                                                                        #301 15.352315
      ATT: Read Request (0x0a) len 2
        Handle: 0x0066
zephyr.exe[1697281]: < HCI Command: Host Number of Completed Packets (0x03|0x0035) plen 5                          #302 15.358177
        Num handles: 1
        Handle: 687 Address: C0:07:E8:2C:B6:EE (OUI C0-07-E8)
        Count: 1
zephyr.exe[1697281]: < ACL Data TX: Handle 687 [1/3] flags 0x00 dlen 6                                             #303 15.359259
      ATT: Read Response (0x0b) len 1
        Value[1]: 02
> HCI Event: Number of Completed Packets (0x13) plen 5                                                             #304 15.476922
        Num handles: 1
        Handle: 687 Address: C0:07:E8:2C:B6:EE (OUI C0-07-E8)
        Count: 1
        Buffers: 0/3
        #303: len 6 (0 Kb/s)
        Latency: 117 msec (59-182 msec ~115 msec)
zephyr.exe[1697281]: < ACL Data TX: Handle 687 [1/3] flags 0x00 dlen 8                                             #305 16.174436
      ATT: Handle Value Notification (0x1b) len 3
        Handle: 0x0066
          Data[1]: 00
zephyr.exe[1697281]: < ACL Data TX: Handle 687 [2/3] flags 0x00 dlen 27                                            #306 16.214422
      ATT: Handle Value Notification (0x1b) len 22
        Handle: 0x0044
          Data[20]: 496e7465726c7564652023322028466f7220426f
zephyr.exe[1697281]: < ACL Data TX: Handle 687 [3/3] flags 0x00 dlen 11                                            #307 16.218083
      ATT: Handle Value Notification (0x1b) len 6
        Handle: 0x0047
          Data[4]: 4c1d0000
> HCI Event: Number of Completed Packets (0x13) plen 5                                                             #308 16.227295
        Num handles: 1
        Handle: 687 Address: C0:07:E8:2C:B6:EE (OUI C0-07-E8)
        Count: 1
        Buffers: 2/3
        #305: len 8 (1 Kb/s)
        Latency: 52 msec (52-182 msec ~84 msec)
> HCI Event: Number of Completed Packets (0x13) plen 5                                                             #309 16.228358
        Num handles: 1
        Handle: 687 Address: C0:07:E8:2C:B6:EE (OUI C0-07-E8)
        Count: 1
        Buffers: 1/3
        #306: len 27 (16 Kb/s)
        Latency: 13 msec (13-182 msec ~48 msec)
zephyr.exe[1697281]: < ACL Data TX: Handle 687 [2/3] flags 0x00 dlen 11                                            #310 16.234328
      ATT: Handle Value Notification (0x1b) len 6
        Handle: 0x004a
          Data[4]: 00000000
zephyr.exe[1697281]: < ACL Data TX: Handle 687 [3/3] flags 0x00 dlen 13                                            #311 16.235915
      ATT: Handle Value Notification (0x1b) len 8
        Handle: 0x0055
          Data[6]: 020100000000
> HCI Event: Number of Completed Packets (0x13) plen 5                                                             #312 16.289407
        Num handles: 1
        Handle: 687 Address: C0:07:E8:2C:B6:EE (OUI C0-07-E8)
        Count: 1
        Buffers: 2/3
        #307: len 11 (1 Kb/s)
        Latency: 71 msec (13-182 msec ~60 msec)
> HCI Event: Number of Completed Packets (0x13) plen 5                                                             #313 16.289849
        Num handles: 1
        Handle: 687 Address: C0:07:E8:2C:B6:EE (OUI C0-07-E8)
        Count: 1
        Buffers: 1/3
        #310: len 1