Bluetooth monitor ver 5.72
= Note: Linux version 6.14.0-36-generic (x86_64)                       0.019795
= Note: Bluetooth subsystem version 2.22                               0.019798
= New Index: 00:00:00:00:00:00 (Primary,UART,hci1)              [hci1] 0.019798
= New Index: 48:5F:99:8E:E0:64 (Primary,USB,hci0)               [hci0] 0.019799
= Open Index: 00:00:00:00:00:00                                 [hci1] 0.533541
= Index Info: 00:00:00:00:00:00 (Nordic Semiconductor ASA)      [hci1] 0.533555
@ USER Open: main (privileged) version 2.22            {0x0001} [hci1] 0.533564
< HCI Command: Reset (0x03|0x0003) plen 0                    #1 [hci1] 0.534106
> HCI Event: Command Complete (0x0e) plen 4                  #2 [hci1] 0.534569
      Reset (0x03|0x0003) ncmd 1
        Status: Success (0x00)
< HCI Command: Read Local Supported... (0x04|0x0003) plen 0  #3 [hci1] 0.552953
> HCI Event: Command Complete (0x0e) plen 12                 #4 [hci1] 0.553436
      Read Local Supported Features (0x04|0x0003) ncmd 1
        Status: Success (0x00)
        Features: 0x00 0x00 0x00 0x00 0x60 0x00 0x00 0x00
          BR/EDR Not Supported
          LE Supported (Controller)
< HCI Command: Read Local Version In.. (0x04|0x0001) plen 0  #5 [hci1] 0.572931
> HCI Event: Command Complete (0x0e) plen 12                 #6 [hci1] 0.573443
      Read Local Version Information (0x04|0x0001) ncmd 1
        Status: Success (0x00)
        HCI version: Reserved (0x0f) - Revision 12393 (0x3069)
        LMP version: Reserved (0x0f) - Subversion 12393 (0x3069)
        Manufacturer: Nordic Semiconductor ASA (89)
< HCI Command: Read Local Supported... (0x04|0x0002) plen 0  #7 [hci1] 0.592926
> HCI Event: Command Complete (0x0e) plen 68                 #8 [hci1] 0.594001
      Read Local Supported Commands (0x04|0x0002) ncmd 1
        Status: Success (0x00)
        Commands: 119 entries
          Disconnect (Octet 0 - Bit 5)
          Read Remote Version Information (Octet 2 - Bit 7)
          Set Event Mask (Octet 5 - Bit 6)
          Reset (Octet 5 - Bit 7)
          Read Connection Accept Timeout (Octet 7 - Bit 2)
          Write Connection Accept Timeout (Octet 7 - Bit 3)
          Read Transmit Power Level (Octet 10 - Bit 2)
          Set Controller To Host Flow Control (Octet 10 - Bit 5)
          Host Buffer Size (Octet 10 - Bit 6)
          Host Number of Completed Packets (Octet 10 - Bit 7)
          Read Local Version Information (Octet 14 - Bit 3)
          Read Local Supported Features (Octet 14 - Bit 5)
          Read BD ADDR (Octet 15 - Bit 1)
          Read RSSI (Octet 15 - Bit 5)
          Set Event Mask Page 2 (Octet 22 - Bit 2)
          LE Set Event Mask (Octet 25 - Bit 0)
          LE Read Buffer Size (Octet 25 - Bit 1)
          LE Read Local Supported Features (Octet 25 - Bit 2)
          LE Set Random Address (Octet 25 - Bit 4)
          LE Set Advertising Parameters (Octet 25 - Bit 5)
          LE Read Advertising Channel TX Power (Octet 25 - Bit 6)
          LE Set Advertising Data (Octet 25 - Bit 7)
          LE Set Scan Response Data (Octet 26 - Bit 0)
          LE Set Advertise Enable (Octet 26 - Bit 1)
          LE Set Scan Parameters (Octet 26 - Bit 2)
          LE Set Scan Enable (Octet 26 - Bit 3)
          LE Create Connection (Octet 26 - Bit 4)
          LE Create Connection Cancel (Octet 26 - Bit 5)
          LE Read Accept List Size (Octet 26 - Bit 6)
          LE Clear Accept List (Octet 26 - Bit 7)
          LE Add Device To Accept List (Octet 27 - Bit 0)
          LE Remove Device From Accept List (Octet 27 - Bit 1)
          LE Connection Update (Octet 27 - Bit 2)
          LE Set Host Channel Classification (Octet 27 - Bit 3)
          LE Read Channel Map (Octet 27 - Bit 4)
          LE Read Remote Used Features (Octet 27 - Bit 5)
          LE Encrypt (Octet 27 - Bit 6)
          LE Rand (Octet 27 - Bit 7)
          LE Start Encryption (Octet 28 - Bit 0)
          LE Long Term Key Request Reply (Octet 28 - Bit 1)
          LE Long Term Key Request Neg Reply (Octet 28 - Bit 2)
          LE Read Supported States (Octet 28 - Bit 3)
          LE Receiver Test (Octet 28 - Bit 4)
          LE Transmitter Test (Octet 28 - Bit 5)
          LE Test End (Octet 28 - Bit 6)
          Read Authenticated Payload Timeout (Octet 32 - Bit 4)
          Write Authenticated Payload Timeout (Octet 32 - Bit 5)
          LE Set Data Length (Octet 33 - Bit 6)
          LE Read Suggested Default Data Length (Octet 33 - Bit 7)
          LE Write Suggested Default Data Length (Octet 34 - Bit 0)
          LE Add Device To Resolving List (Octet 34 - Bit 3)
          LE Remove Device From Resolving List (Octet 34 - Bit 4)
          LE Clear Resolving List (Octet 34 - Bit 5)
          LE Read Resolving List Size (Octet 34 - Bit 6)
          LE Set Address Resolution Enable (Octet 35 - Bit 1)
          LE Set Resolvable Private Address Timeout (Octet 35 - Bit 2)
          LE Read Maximum Data Length (Octet 35 - Bit 3)
          LE Read PHY (Octet 35 - Bit 4)
          LE Set Default PHY (Octet 35 - Bit 5)
          LE Set PHY (Octet 35 - Bit 6)
          LE Enhanced Receiver Test (Octet 35 - Bit 7)
          LE Enhanced Transmitter Test (Octet 36 - Bit 0)
          LE Set Advertising Set Random Address (Octet 36 - Bit 1)
          LE Set Extended Advertising Parameters (Octet 36 - Bit 2)
          LE Set Extended Advertising Data (Octet 36 - Bit 3)
          LE Set Extended Scan Response Data (Octet 36 - Bit 4)
          LE Set Extended Advertising Enable (Octet 36 - Bit 5)
          LE Read Maximum Advertising Data Length (Octet 36 - Bit 6)
          LE Read Number of Supported Advertising Sets (Octet 36 - Bit 7)
          LE Remove Advertising Set (Octet 37 - Bit 0)
          LE Clear Advertising Sets (Octet 37 - Bit 1)
          LE Set Periodic Advertising Parameters (Octet 37 - Bit 2)
          LE Set Periodic Advertising Data (Octet 37 - Bit 3)
          LE Set Periodic Advertising Enable (Octet 37 - Bit 4)
          LE Set Extended Scan Parameters (Octet 37 - Bit 5)
          LE Set Extended Scan Enable (Octet 37 - Bit 6)
          LE Extended Create Connection (Octet 37 - Bit 7)
          LE Periodic Advertising Create Sync (Octet 38 - Bit 0)
          LE Periodic Advertising Create Sync Cancel (Octet 38 - Bit 1)
          LE Periodic Advertising Terminate Sync (Octet 38 - Bit 2)
          LE Add Device To Periodic Advertiser List (Octet 38 - Bit 3)
          LE Remove Device From Periodic Advertiser List (Octet 38 - Bit 4)
          LE Clear Periodic Advertiser List (Octet 38 - Bit 5)
          LE Read Periodic Advertiser List Size (Octet 38 - Bit 6)
          LE Read Transmit Power (Octet 38 - Bit 7)
          LE Read RF Path Compensation (Octet 39 - Bit 0)
          LE Write RF Path Compensation (Octet 39 - Bit 1)
          LE Set Privacy Mode (Octet 39 - Bit 2)
          LE Periodic Advertising Receive Enable (Octet 40 - Bit 5)
          LE Periodic Advertising Sync Transfer (Octet 40 - Bit 6)
          LE Periodic Advertising Set Info Transfer (Octet 40 - Bit 7)
          LE Periodic Advertising Sync Transfer Parameters (Octet 41 - Bit 0)
          LE Set Default Periodic Advertisng Sync Transfer Parameters (Octet 41 - Bit 1)
          LE Read Buffer v2 (Octet 41 - Bit 5)
          LE Read ISO TX Sync (Octet 41 - Bit 6)
          LE Set Connected Isochronous Group Parameters (Octet 41 - Bit 7)
          LE Set Connected Isochronous Group Parameters Test (Octet 42 - Bit 0)
          LE Create Connected Isochronous Stream (Octet 42 - Bit 1)
          LE Remove Connected Isochronous Group (Octet 42 - Bit 2)
          LE Accept Connected Isochronous Stream Request (Octet 42 - Bit 3)
          LE Reject Connected Isochronous Stream Request (Octet 42 - Bit 4)
          LE Create Broadcast Isochronous Group (Octet 42 - Bit 5)
          LE Create Broadcast Isochronous Group Test (Octet 42 - Bit 6)
          LE Terminate Broadcast Isochronous Group (Octet 42 - Bit 7)
          LE Broadcast Isochronous Group Create Sync (Octet 43 - Bit 0)
          LE Broadcast Isochronous Group Terminate Sync (Octet 43 - Bit 1)
          LE Request Peer SCA (Octet 43 - Bit 2)
          LE Setup Isochronous Data Path (Octet 43 - Bit 3)
          LE Remove Isochronous Data Path (Octet 43 - Bit 4)
          LE Isochronous Transmit Test (Octet 43 - Bit 5)
          LE Isochronous Receive Test (Octet 43 - Bit 6)
          LE Isochronous Read Test Counters (Octet 43 - Bit 7)
          LE Isochronous Read Test Counters (Octet 44 - Bit 0)
          LE Set Host Feature (Octet 44 - Bit 1)
          Octet 44 - Bit 2 
          Octet 45 - Bit 6 
          Octet 46 - Bit 0 
          Octet 46 - Bit 1 
          Octet 46 - Bit 2 
< HCI Command: Host Buffer Size (0x03|0x0033) plen 7         #9 [hci1] 0.612937
        ACL MTU: 255  ACL max packet: 16
        SCO MTU: 0    SCO max packet: 0
> HCI Event: Command Complete (0x0e) plen 4                 #10 [hci1] 0.613468
      Host Buffer Size (0x03|0x0033) ncmd 1
        Status: Success (0x00)
< HCI Command: Set Controller To Ho.. (0x03|0x0031) plen 1  #11 [hci1] 0.632943
        Flow control: ACL Data Packets (0x01)
> HCI Event: Command Complete (0x0e) plen 4                 #12 [hci1] 0.633383
      Set Controller To Host Flow Control (0x03|0x0031) ncmd 1
        Status: Success (0x00)
< HCI Command: LE Read Local Suppor.. (0x08|0x0003) plen 0  #13 [hci1] 0.652924
> HCI Event: Command Complete (0x0e) plen 12                #14 [hci1] 0.653383
      LE Read Local Supported Features (0x08|0x0003) ncmd 1
        Status: Success (0x00)
        Features: 0xfd 0x79 0x00 0xf7 0x30 0x01 0x00 0x00
          LE Encryption
          Extended Reject Indication
          Peripheral-initiated Features Exchange
          LE Ping
          LE Data Packet Length Extension
          LL Privacy
          Extended Scanner Filter Policies
          LE 2M PHY
          LE Coded PHY
          LE Extended Advertising
          LE Periodic Advertising
          Channel Selection Algorithm #2
          Periodic Advertising Sync Transfer - Sender
          Periodic Advertising Sync Transfer - Recipient
          Sleep Clock Accuracy Updates
          Connected Isochronous Stream - Central
          Connected Isochronous Stream - Peripheral
          Isochronous Broadcaster
          Synchronized Receiver
          Periodic Advertising ADI support
          Connection Subrating
          Unknown features (0x0000010000000000)
< HCI Command: LE Set Host Feature (0x08|0x0074) plen 2     #15 [hci1] 0.672922
        Bit Number: 32
          Connected Isochronous Stream (Host Support)
        Bit Value: 1
> HCI Event: Command Complete (0x0e) plen 4                 #16 [hci1] 0.673417
      LE Set Host Feature (0x08|0x0074) ncmd 1
        Status: Success (0x00)
< HCI Command: LE Read Buffer v2 (0x08|0x0060) plen 0       #17 [hci1] 0.692934
> HCI Event: Command Complete (0x0e) plen 10                #18 [hci1] 0.693451
      LE Read Buffer v2 (0x08|0x0060) ncmd 1
        Status: Success (0x00)
        ACL MTU: 27
        ACL max packet: 3
        ISO MTU: 318
        ISO max packet: 3
< HCI Command: LE Read Maximum Adve.. (0x08|0x003a) plen 0  #19 [hci1] 0.712982
> HCI Event: Command Complete (0x0e) plen 6                 #20 [hci1] 0.713454
      LE Read Maximum Advertising Data Length (0x08|0x003a) ncmd 1
        Status: Success (0x00)
        Max length: 1650
< HCI Command: LE Read Supported St.. (0x08|0x001c) plen 0  #21 [hci1] 0.732898
> HCI Event: Command Complete (0x0e) plen 12                #22 [hci1] 0.733432
      LE Read Supported States (0x08|0x001c) ncmd 1
        Status: Success (0x00)
        States: 0x000003ff3e0306ff
          Non-connectable Advertising State
          Scannable Advertising State
          Connectable Advertising State
          High Duty Cycle Directed Advertising State
          Passive Scanning State
          Active Scanning State
          Initiating State
            and Connection State (Central Role)
          Connection State (Peripheral Role)
          Scannable Advertising State
            and Passive Scanning State
          Connectable Advertising State
            and Passive Scanning State
          Non-connectable Advertising State
            and Initiating State
          Scannable Advertising State
            and Initiating State
          Active Scanning State
            and Connection State (Central Role)
          Passive Scanning State
            and Connection State (Peripheral Role)
          Active Scanning State
            and Connection State (Peripheral Role)
          Initiating State
            and Connection State (Central Role)
            and Central Role & Central Role
          Low Duty Cycle Directed Advertising State
          Connectable Advertising State
            and Initiating State
            and Central Role & Peripheral Role
          High Duty Cycle Directed Advertising State
            and Initiating State
            and Central Role & Peripheral Role
          Low Duty Cycle Directed Advertising State
            and Initiating State
            and Central Role & Peripheral Role
          Connectable Advertising State
            and Connection State (Central Role)
            and Central Role & Peripheral Role
          High Duty Cycle Directed Advertising State
            and Connection State (Central Role)
            and Central Role & Peripheral Role
          Low Duty Cycle Directed Advertising State
            and Connection State (Central Role)
            and Central Role & Peripheral Role
          Connectable Advertising State
            and Connection State (Peripheral Role)
            and Central Role & Peripheral Role
          High Duty Cycle Directed Advertising State
            and Connection State (Peripheral Role)
            and Peripheral Role & Peripheral Role
          Low Duty Cycle Directed Advertising State
            and Connection State (Peripheral Role)
            and Peripheral Role & Peripheral Role
          Initiating State
            and Connection State (Peripheral Role)
            and Central Role & Peripheral Role
< HCI Command: LE Read Maximum Data.. (0x08|0x002f) plen 0  #23 [hci1] 0.752926
> HCI Event: Command Complete (0x0e) plen 12                #24 [hci1] 0.753377
      LE Read Maximum Data Length (0x08|0x002f) ncmd 1
        Status: Success (0x00)
        Max TX octets: 251
        Max TX time: 2704
        Max RX octets: 251
        Max RX time: 2704
< HCI Command: LE Write Suggested D.. (0x08|0x0024) plen 4  #25 [hci1] 0.772931
        TX octets: 251
        TX time: 2704
> HCI Event: Command Complete (0x0e) plen 4                 #26 [hci1] 0.773399
      LE Write Suggested Default Data Length (0x08|0x0024) ncmd 1
        Status: Success (0x00)
< HCI Command: LE Read Resolving Li.. (0x08|0x002a) plen 0  #27 [hci1] 0.792923
> HCI Event: Command Complete (0x0e) plen 5                 #28 [hci1] 0.793389
      LE Read Resolving List Size (0x08|0x002a) ncmd 1
        Status: Success (0x00)
        Size: 8
< HCI Command: LE Set Event Mask (0x08|0x0001) plen 8       #29 [hci1] 0.812933
        Mask: 0x000002023f87fa5e
          LE Advertising Report
          LE Connection Update Complete
          LE Read Remote Used Features Complete
          LE Long Term Key Request
          LE Data Length Change
          LE Enhanced Connection Complete
          LE PHY Update Complete
          LE Extended Advertising Report
          LE Periodic Advertising Sync Established
          LE Periodic Advertising Report
          LE Periodic Advertising Sync Lost
          LE Extended Scan Timeout
          LE Extended Advertising Set Terminated
          LE Scan Request Received
          LE Periodic Advertising Sync Transfer Rvc
          LE CIS Established
          LE CIS Request
          LE Create BIG Complete
          LE Terminate BIG Complete
          LE BIG Sync Estabilished Complete
          LE BIG Sync Lost
          LE BIG Info Advertising Report
          Unknown mask (0x0000020000000000)
> HCI Event: Command Complete (0x0e) plen 4                 #30 [hci1] 0.813374
      LE Set Event Mask (0x08|0x0001) ncmd 1
        Status: Success (0x00)
< HCI Command: Set Event Mask (0x03|0x0001) plen 8          #31 [hci1] 0.832927
        Mask: 0x2000800002008890
          Disconnection Complete
          Encryption Change
          Read Remote Version Information Complete
          Hardware Error
          Data Buffer Overflow
          Encryption Key Refresh Complete
          LE Meta
> HCI Event: Command Complete (0x0e) plen 4                 #32 [hci1] 0.833419
      Set Event Mask (0x03|0x0001) ncmd 1
        Status: Success (0x00)
< HCI Command: Read BD ADDR (0x04|0x0009) plen 0            #33 [hci1] 0.852930
> HCI Event: Command Complete (0x0e) plen 10                #34 [hci1] 0.853440
      Read BD ADDR (0x04|0x0009) ncmd 1
        Status: Success (0x00)
        Address: 00:00:00:00:00:00 (OUI 00-00-00)
< HCI Command: LE Set Random Address (0x08|0x0005) plen 6   #35 [hci1] 0.872943
        Address: D5:B6:CC:31:DB:3B (Static)
> HCI Event: Command Complete (0x0e) plen 4                 #36 [hci1] 0.873482
      LE Set Random Address (0x08|0x0005) ncmd 1
        Status: Success (0x00)
< HCI Command: LE Set Extended Adv.. (0x08|0x0036) plen 25  #37 [hci1] 3.233044
        Handle: 0x00
        Properties: 0x0010
          Use legacy advertising PDUs: ADV_NONCONN_IND
        Min advertising interval: 20.000 msec (0x0020)
        Max advertising interval: 20.000 msec (0x0020)
        Channel map: 37, 38, 39 (0x07)
        Own address type: Random (0x01)
        Peer address type: Public (0x00)
        Peer address: 00:00:00:00:00:00 (OUI 00-00-00)
        Filter policy: Allow Scan Request from Any, Allow Connect Request from Any (0x00)
        TX power: Host has no preference (0x7f)
        Primary PHY: LE 1M (0x01)
        Secondary max skip: 0x00
        Secondary PHY: LE 1M (0x01)
        SID: 0x00
        Scan request notifications: Disabled (0x00)
> HCI Event: Command Complete (0x0e) plen 5                 #38 [hci1] 3.233846
      LE Set Extended Advertising Parameters (0x08|0x0036) ncmd 1
        Status: Success (0x00)
        TX power (selected): 0 dbm (0x00)
< HCI Command: LE Set Advertising S.. (0x08|0x0035) plen 7  #39 [hci1] 3.252983
        Advertising handle: 0x00
        Advertising random address: 24:34:0C:0D:44:02 (Non-Resolvable)
> HCI Event: Command Complete (0x0e) plen 4                 #40 [hci1] 3.253557
      LE Set Advertising Set Random Address (0x08|0x0035) ncmd 1
        Status: Success (0x00)
< HCI Command: LE Set Random Address (0x08|0x0005) plen 6   #41 [hci1] 3.272953
        Address: 24:71:FD:F8:AC:A2 (Non-Resolvable)
> HCI Event: Command Complete (0x0e) plen 4                 #42 [hci1] 3.273541
      LE Set Random Address (0x08|0x0005) ncmd 1
        Status: Success (0x00)
< HCI Command: LE Set Extended Scan.. (0x08|0x0041) plen 8  #43 [hci1] 3.293017
        Own address type: Random (0x01)
        Filter policy: Accept all advertisement (0x00)
        PHYs: 0x01
        Entry 0: LE 1M
          Type: Passive (0x00)
          Interval: 30.000 msec (0x0030)
          Window: 30.000 msec (0x0030)
> HCI Event: Command Complete (0x0e) plen 4                 #44 [hci1] 3.293617
      LE Set Extended Scan Parameters (0x08|0x0041) ncmd 1
        Status: Success (0x00)
< HCI Command: LE Set Extended Scan.. (0x08|0x0042) plen 6  #45 [hci1] 3.312959
        Extended scan: Enabled (0x01)
        Filter duplicates: Disabled (0x00)
        Duration: 0 msec (0x0000)
        Period: 0.00 sec (0x0000)
> HCI Event: Command Complete (0x0e) plen 4                 #46 [hci1] 3.313525
      LE Set Extended Scan Enable (0x08|0x0042) ncmd 1
        Status: Success (0x00)
< HCI Command: LE Set Advertising S.. (0x08|0x0035) plen 7  #47 [hci1] 3.333096
        Advertising handle: 0x00
        Advertising random address: D5:B6:CC:31:DB:3B (Static)
> HCI Event: Command Complete (0x0e) plen 4                 #48 [hci1] 3.333591
      LE Set Advertising Set Random Address (0x08|0x0035) ncmd 1
        Status: Success (0x00)
< HCI Command: LE Set Extended Adv.. (0x08|0x0036) plen 25  #49 [hci1] 3.353035
        Handle: 0x00
        Properties: 0x0013
          Connectable
          Scannable
          Use legacy advertising PDUs: ADV_IND
        Min advertising interval: 100.000 msec (0x00a0)
        Max advertising interval: 150.000 msec (0x00f0)
        Channel map: 37, 38, 39 (0x07)
        Own address type: Random (0x01)
        Peer address type: Public (0x00)
        Peer address: 00:00:00:00:00:00 (OUI 00-00-00)
        Filter policy: Allow Scan Request from Any, Allow Connect Request from Any (0x00)
        TX power: Host has no preference (0x7f)
        Primary PHY: LE 1M (0x01)
        Secondary max skip: 0x00
        Secondary PHY: LE 1M (0x01)
        SID: 0x00
        Scan request notifications: Disabled (0x00)
> HCI Event: Command Complete (0x0e) plen 5                 #50 [hci1] 3.353758
      LE Set Extended Advertising Parameters (0x08|0x0036) ncmd 1
        Status: Success (0x00)
        TX power (selected): 0 dbm (0x00)
< HCI Command: LE Set Extended Adv.. (0x08|0x0037) plen 33  #51 [hci1] 3.372978
        Handle: 0x00
        Operation: Complete extended advertising data (0x03)
        Fragment preference: Minimize fragmentation (0x01)
        Data length: 0x1d
        Flags: 0x06
          LE General Discoverable Mode
          BR/EDR Not Supported
        16-bit Service UUIDs (complete): 1 entry
          Mesh Provisioning (0x1827)
        Service Data: Mesh Provisioning (0x1827)
          Data: 65d060b6cf05456fa88b79e3cdf9f2080000
> HCI Event: Command Complete (0x0e) plen 4                 #52 [hci1] 3.373817
      LE Set Extended Advertising Data (0x08|0x0037) ncmd 1
        Status: Success (0x00)
< HCI Command: LE Set Extended Sca.. (0x08|0x0038) plen 20  #53 [hci1] 3.392989
        Handle: 0x00
        Operation: Complete scan response data (0x03)
        Fragment preference: Minimize fragmentation (0x01)
        Data length: 0x10
        Unknown EIR field 0x24: 546573746572
        Name (complete): Tester
> HCI Event: Command Complete (0x0e) plen 4                 #54 [hci1] 3.393621
      LE Set Extended Scan Response Data (0x08|0x0038) ncmd 1
        Status: Success (0x00)
< HCI Command: LE Set Extended Adve.. (0x08|0x0039) plen 6  #55 [hci1] 3.412983
        Extended advertising: Enabled (0x01)
        Number of sets: 1 (0x01)
        Entry 0
          Handle: 0x00
          Duration: 60000 ms (0x1770)
          Max ext adv events: 0
> HCI Event: Command Complete (0x0e) plen 4                 #56 [hci1] 3.413569
      LE Set Extended Advertising Enable (0x08|0x0039) ncmd 1
        Status: Success (0x00)
< HCI Command: LE Set Extended Adve.. (0x08|0x0039) plen 6  #57 [hci1] 3.433003
        Extended advertising: Disabled (0x00)
        Number of sets: 1 (0x01)
        Entry 0
          Handle: 0x00
          Duration: 0 ms (0x00)
          Max ext adv events: 0
> HCI Event: Command Complete (0x0e) plen 4                 #58 [hci1] 3.433470
      LE Set Extended Advertising Enable (0x08|0x0039) ncmd 1
        Status: Success (0x00)
< HCI Command: LE Set Advertising S.. (0x08|0x0035) plen 7  #59 [hci1] 3.452976
        Advertising handle: 0x00
        Advertising random address: 27:DD:CA:1B:4A:5C (Non-Resolvable)
> HCI Event: Command Complete (0x0e) plen 4                 #60 [hci1] 3.453406
      LE Set Advertising Set Random Address (0x08|0x0035) ncmd 1
        Status: Success (0x00)
< HCI Command: LE Set Extended Adv.. (0x08|0x0036) plen 25  #61 [hci1] 3.472987
        Handle: 0x00
        Properties: 0x0010
          Use legacy advertising PDUs: ADV_NONCONN_IND
        Min advertising interval: 20.000 msec (0x0020)
        Max advertising interval: 20.000 msec (0x0020)
        Channel map: 37, 38, 39 (0x07)
        Own address type: Random (0x01)
        Peer address type: Public (0x00)
        Peer address: 00:00:00:00:00:00 (OUI 00-00-00)
        Filter policy: Allow Scan Request from Any, Allow Connect Request from Any (0x00)
        TX power: Host has no preference (0x7f)
        Primary PHY: LE 1M (0x01)
        Secondary max skip: 0x00
        Secondary PHY: LE 1M (0x01)
        SID: 0x00
        Scan request notifications: Disabled (0x00)
> HCI Event: Command Complete (0x0e) plen 5                 #62 [hci1] 3.473751
      LE Set Extended Advertising Parameters (0x08|0x0036) ncmd 1
        Status: Success (0x00)
        TX power (selected): 0 dbm (0x00)
< HCI Command: LE Set Extended Adv.. (0x08|0x0037) plen 29  #63 [hci1] 3.492970
        Handle: 0x00
        Operation: Complete extended advertising data (0x03)
        Fragment preference: Minimize fragmentation (0x01)
        Data length: 0x19
        Mesh Beacon: 0065d060b6cf05456fa88b79e3cdf9f2080002a30a8708
          Unprovisioned Device Beacon (0x00)
          Device UUID: 65d060b6cf05456fa88b79e3cdf9f208
          OOB Information: 0x0002
            Electronic / URI
          URI Hash: 0xa30a8708
> HCI Event: Command Complete (0x0e) plen 4                 #64 [hci1] 3.493758
      LE Set Extended Advertising Data (0x08|0x0037) ncmd 1
        Status: Success (0x00)
< HCI Command: LE Set Extended Adve.. (0x08|0x0039) plen 6  #65 [hci1] 3.512977
        Extended advertising: Enabled (0x01)
        Number of sets: 1 (0x01)
        Entry 0
          Handle: 0x00
          Duration: 0 ms (0x00)
          Max ext adv events: 3
> HCI Event: Command Complete (0x0e) plen 4                 #66 [hci1] 3.513501
      LE Set Extended Advertising Enable (0x08|0x0039) ncmd 1
        Status: Success (0x00)
> HCI Event: LE Meta Event (0x3e) plen 50                   #67 [hci1] 3.543510
      LE Extended Advertising Report (0x0d)
        Num reports: 1
        Entry 0
          Event type: 0x0010
            Props: 0x0010
              Use legacy advertising PDUs
            Data status: [0;32mComplete[0m
          Legacy PDU Type: ADV_NONCONN_IND (0x0010)
          Address type: Public (0x00)
          Address: DF:A9:FF:F6:B1:1A (OUI DF-A9-FF)
          Primary PHY: LE 1M
          Secondary PHY: No packets
          SID: no ADI field (0xff)
          TX power: 127 dBm
          RSSI: -25 dBm (0xe7)
          Periodic advertising interval: 0.00 msec (0x0000)
          Direct address type: Reserved (0xff)
          Direct address: 00-00-00-00-00-00
          Data length: 0x18
        17 29 ed af eb 9e 00 03 65 d0 60 b6 cf 05 45 6f  .)......e.`...Eo
        a8 8b 79 e3 cd f9 f2 08                          ..y.....        
        Mesh Provisioning: edafeb9e000365d060b6cf05456fa88b79e3cdf9f208
          Link ID: 0xedafeb9e
          Transaction Number: 0
          Provisioning Bearer Control (0x03)
          Link Open (0x00)
          Device UUID: 0365d060b6cf05456fa88b79e3cdf9f2
> HCI Event: LE Meta Event (0x3e) plen 6                    #68 [hci1] 3.561883
      LE Advertising Set Terminated (0x12)
        Status: Limit Reached (0x43)
        Handle: 0
        Connection handle: 65535
        Number of completed extended advertising events: 3
> HCI Event: LE Meta Event (0x3e) plen 50                   #69 [hci1] 3.569424
      LE Extended Advertising Report (0x0d)
        Num reports: 1
        Entry 0
          Event type: 0x0010
            Props: 0x0010
              Use legacy advertising PDUs
            Data status: [0;32mComplete[0m
          Legacy PDU Type: ADV_NONCONN_IND (0x0010)
          Address type: Public (0x00)
          Address: DF:A9:FF:F6:B1:1A (OUI DF-A9-FF)
          Primary PHY: LE 1M
          Secondary PHY: No packets
          SID: no ADI field (0xff)
          TX power: 127 dBm
          RSSI: -20 dBm (0xec)
          Periodic advertising interval: 0.00 msec (0x0000)
          Direct address type: Reserved (0xff)
          Direct address: 00-00-00-00-00-00
          Data length: 0x18
        17 29 ed af eb 9e 00 03 65 d0 60 b6 cf 05 45 6f  .)......e.`...Eo
        a8 8b 79 e3 cd f9 f2 08                          ..y.....        
        Mesh Provisioning: edafeb9e000365d060b6cf05456fa88b79e3cdf9f208
          Link ID: 0xedafeb9e
          Transaction Number: 0
          Provisioning Bearer Control (0x03)
          Link Open (0x00)
          Device UUID: 0365d060b6cf05456fa88b79e3cdf9f2
< HCI Command: LE Set Extended Adv.. (0x08|0x0037) plen 12  #70 [hci1] 3.573154
        Handle: 0x00
        Operation: Complete extended advertising data (0x03)
        Fragment preference: Minimize fragmentation (0x01)
        Data length: 0x08
        Unknown EIR field 0x24: 546573746572
> HCI Event: Command Complete (0x0e) plen 4                 #71 [hci1] 3.573759
      LE Set Extended Advertising Data (0x08|0x0037) ncmd 1
        Status: Success (0x00)
< HCI Command: LE Set Advertising S.. (0x08|0x0035) plen 7  #72 [hci1] 3.593038
        Advertising handle: 0x00
        Advertising random address: 17:BA:00:7B:09:45 (Non-Resolvable)
> HCI Event: Command Complete (0x0e) plen 4                 #73 [hci1] 3.593542
      LE Set Advertising Set Random Address (0x08|0x0035) ncmd 1
        Status: Success (0x00)
> HCI Event: LE Meta Event (0x3e) plen 50                   #74 [hci1] 3.600434
      LE Extended Advertising Report (0x0d)
        Num reports: 1
        Entry 0
          Event type: 0x0010
            Props: 0x0010
              Use legacy advertising PDUs
            Data status: [0;32mComplete[0m
          Legacy PDU Type: ADV_NONCONN_IND (0x0010)
          Address type: Public (0x00)
          Address: DF:A9:FF:F6:B1:1A (OUI DF-A9-FF)
          Primary PHY: LE 1M
          Secondary PHY: No packets
          SID: no ADI field (0xff)
          TX power: 127 dBm
          RSSI: -20 dBm (0xec)
          Periodic advertising interval: 0.00 msec (0x0000)
          Direct address type: Reserved (0xff)
          Direct address: 00-00-00-00-00-00
          Data length: 0x18
        17 29 ed af eb 9e 00 03 65 d0 60 b6 cf 05 45 6f  .)......e.`...Eo
        a8 8b 79 e3 cd f9 f2 08                          ..y.....        
        Mesh Provisioning: edafeb9e000365d060b6cf05456fa88b79e3cdf9f208
          Link ID: 0xedafeb9e
          Transaction Number: 0
          Provisioning Bearer Control (0x03)
          Link Open (0x00)
          Device UUID: 0365d060b6cf05456fa88b79e3cdf9f2
< HCI Command: LE Set Extended Adve.. (0x08|0x0039) plen 6  #75 [hci1] 3.613038
        Extended advertising: Enabled (0x01)
        Number of sets: 1 (0x01)
        Entry 0
          Handle: 0x00
          Duration: 0 ms (0x00)
          Max ext adv events: 3
> HCI Event: Command Complete (0x0e) plen 4                 #76 [hci1] 3.613539
      LE Set Extended Advertising Enable (0x08|0x0039) ncmd 1
        Status: Success (0x00)
> HCI Event: LE Meta Event (0x3e) plen 6                    #77 [hci1] 3.667093
      LE Advertising Set Terminated (0x12)
        Status: Limit Reached (0x43)
        Handle: 0
        Connection handle: 65535
        Number of completed extended advertising events: 3
< HCI Command: LE Set Extended Adv.. (0x08|0x0037) plen 12  #78 [hci1] 3.673076
        Handle: 0x00
        Operation: Complete extended advertising data (0x03)
        Fragment preference: Minimize fragmentation (0x01)
        Data length: 0x08
        Mesh Provisioning: edafeb9e0007
          Link ID: 0xedafeb9e
          Transaction Number: 0
          Provisioning Bearer Control (0x03)
          Link Ack (0x01)
> HCI Event: Command Complete (0x0e) plen 4                 #79 [hci1] 3.673669
      LE Set Extended Advertising Data (0x08|0x0037) ncmd 1
        Status: Success (0x00)
< HCI Command: LE Set Advertising S.. (0x08|0x0035) plen 7  #80 [hci1] 3.692964
        Advertising handle: 0x00
        Advertising random address: 3E:52:32:BA:A1:AC (Non-Resolvable)
> HCI Event: Command Complete (0x0e) plen 4                 #81 [hci1] 3.693398
      LE Set Advertising Set Random Address (0x08|0x0035) ncmd 1
        Status: Success (0x00)
< HCI Command: LE Set Extended Adve.. (0x08|0x0039) plen 6  #82 [hci1] 3.713133
        Extended advertising: Enabled (0x01)
        Number of sets: 1 (0x01)
        Entry 0
          Handle: 0x00
          Duration: 0 ms (0x00)
          Max ext adv events: 3
> HCI Event: Command Complete (0x0e) plen 4                 #83 [hci1] 3.713701
      LE Set Extended Advertising Enable (0x08|0x0039) ncmd 1
        Status: Success (0x00)
> HCI Event: LE Meta Event (0x3e) plen 39                   #84 [hci1] 3.747689
      LE Extended Advertising Report (0x0d)
        Num reports: 1
        Entry 0
          Event type: 0x0010
            Props: 0x0010
              Use legacy advertising PDUs
            Data status: [0;32mComplete[0m
          Legacy PDU Type: ADV_NONCONN_IND (0x0010)
          Address type: Public (0x00)
          Address: DF:A9:FF:F6:B1:1A (OUI DF-A9-FF)
          Primary PHY: LE 1M
          Secondary PHY: No packets
          SID: no ADI field (0xff)
          TX power: 127 dBm
          RSSI: -25 dBm (0xe7)
          Periodic advertising interval: 0.00 msec (0x0000)
          Direct address type: Reserved (0xff)
          Direct address: 00-00-00-00-00-00
          Data length: 0x0d
        0c 29 ed af eb 9e 00 00 00 02 f7 00 02           .)...........   
        Mesh Provisioning: edafeb9e00000002f70002
          Link ID: 0xedafeb9e
          Transaction Number: 0
          Transaction Start (0x00)
          SeqN: 0
          TotalLength: 2
          FCS: 0xf7
          Data: 0002
        02                                               .               
> HCI Event: LE Meta Event (0x3e) plen 6                    #85 [hci1] 3.778002
      LE Advertising Set Terminated (0x12)
        Status: Limit Reached (0x43)
        Handle: 0
        Connection handle: 65535
        Number of completed extended advertising events: 3
< HCI Command: LE Set Extended Adv.. (0x08|0x0037) plen 12  #86 [hci1] 3.823032
        Handle: 0x00
        Operation: Complete extended advertising data (0x03)
        Fragment preference: Minimize fragmentation (0x01)
        Data length: 0x08
        Mesh Provisioning: edafeb9e0001
          Link ID: 0xedafeb9e
          Transaction Number: 0
          Transaction Acknowledgment (0x01)
> HCI Event: Command Complete (0x0e) plen 4                 #87 [hci1] 3.823693
      LE Set Extended Advertising Data (0x08|0x0037) ncmd 1
        Status: Success (0x00)
< HCI Command: LE Set Advertising S.. (0x08|0x0035) plen 7  #88 [hci1] 3.832968
        Advertising handle: 0x00
        Advertising random address: 39:74:E3:B2:33:9F (Non-Resolvable)
> HCI Event: Command Complete (0x0e) plen 4                 #89 [hci1] 3.833418
      LE Set Advertising Set Random Address (0x08|0x0035) ncmd 1
        Status: Success (0x00)
< HCI Command: LE Set Extended Adve.. (0x08|0x0039) plen 6  #90 [hci1] 3.852968
        Extended advertising: Enabled (0x01)
        Number of sets: 1 (0x01)
        Entry 0
          Handle: 0x00
          Duration: 0 ms (0x00)
          Max ext adv events: 3
> HCI Event: Command Complete (0x0e) plen 4                 #91 [hci1] 3.853484
      LE Set Extended Advertising Enable (0x08|0x0039) ncmd 1
        Status: Success (0x00)
> HCI Event: LE Meta Event (0x3e) plen 6                    #92 [hci1] 3.921276
      LE Advertising Set Terminated (0x12)
        Status: Limit Reached (0x43)
        Handle: 0
        Connection handle: 65535
        Number of completed extended advertising events: 3
< HCI Command: LE Set Extended Adv.. (0x08|0x0037) plen 27  #93 [hci1] 3.993052
        Handle: 0x00
        Operation: Complete extended advertising data (0x03)
        Fragment preference: Minimize fragmentation (0x01)
        Data length: 0x17
        Mesh Provisioning: edafeb9e8000000cf2010400030001010008010008
          Link ID: 0xedafeb9e
          Transaction Number: 128
          Transaction Start (0x00)
          SeqN: 0
          TotalLength: 12
          FCS: 0xf2
          Data: 010400030001010008010008
        04 00 03 00 01 01 00 08 01 00 08                 ...........     
> HCI Event: Command Complete (0x0e) plen 4                 #94 [hci1] 3.993854
      LE Set Extended Advertising Data (0x08|0x0037) ncmd 1
        Status: Success (0x00)
< HCI Command: LE Set Advertising S.. (0x08|0x0035) plen 7  #95 [hci1] 4.012971
        Advertising handle: 0x00
        Advertising random address: 1F:DB:DD:BA:95:2D (Non-Resolvable)
> HCI Event: Command Complete (0x0e) plen 4                 #96 [hci1] 4.013444
      LE Set Advertising Set Random Address (0x08|0x0035) ncmd 1
        Status: Success (0x00)
< HCI Command: LE Set Extended Adve.. (0x08|0x0039) plen 6  #97 [hci1] 4.032966
        Extended advertising: Enabled (0x01)
        Number of sets: 1 (0x01)
        Entry 0
          Handle: 0x00
          Duration: 0 ms (0x00)
          Max ext adv events: 1
> HCI Event: Command Complete (0x0e) plen 4                 #98 [hci1] 4.033498
      LE Set Extended Advertising Enable (0x08|0x0039) ncmd 1
        Status: Success (0x00)
> HCI Event: LE Meta Event (0x3e) plen 6                    #99 [hci1] 4.039518
      LE Advertising Set Terminated (0x12)
        Status: Limit Reached (0x43)
        Handle: 0
        Connection handle: 65535
        Number of completed extended advertising events: 1
> HCI Event: LE Meta Event (0x3e) plen 34                  #100 [hci1] 4.099357
      LE Extended Advertising Report (0x0d)
        Num reports: 1
        Entry 0
          Event type: 0x0010
            Props: 0x0010
              Use legacy advertising PDUs
            Data status: [0;32mComplete[0m
          Legacy PDU Type: ADV_NONCONN_IND (0x0010)
          Address type: Public (0x00)
          Address: DF:A9:FF:F6:B1:1A (OUI DF-A9-FF)
          Primary PHY: LE 1M
          Secondary PHY: No packets
          SID: no ADI field (0xff)
          TX power: 127 dBm
          RSSI: -20 dBm (0xec)
          Periodic advertising interval: 0.00 msec (0x0000)
          Direct address type: Reserved (0xff)
          Direct address: 00-00-00-00-00-00
          Data length: 0x08
        07 29 ed af eb 9e 80 01                          .)......        
        Mesh Provisioning: edafeb9e8001
          Link ID: 0xedafeb9e
          Transaction Number: 128
          Transaction Acknowledgment (0x01)
> HCI Event: LE Meta Event (0x3e) plen 34                  #101 [hci1] 4.131304
      LE Extended Advertising Report (0x0d)
        Num reports: 1
        Entry 0
          Event type: 0x0010
            Props: 0x0010
              Use legacy advertising PDUs
            Data status: [0;32mComplete[0m
          Legacy PDU Type: ADV_NONCONN_IND (0x0010)
          Address type: Public (0x00)
          Address: DF:A9:FF:F6:B1:1A (OUI DF-A9-FF)
          Primary PHY: LE 1M
          Secondary PHY: No packets
          SID: no ADI field (0xff)
          TX power: 127 dBm
          RSSI: -21 dBm (0xeb)
          Periodic advertising interval: 0.00 msec (0x0000)
          Direct address type: Reserved (0xff)
          Direct address: 00-00-00-00-00-00
          Data length: 0x08
        07 29 ed af eb 9e 80 01                          .)......        
        Mesh Provisioning: edafeb9e8001
          Link ID: 0xedafeb9e
          Transaction Number: 128
          Transaction Acknowledgment (0x01)
> HCI Event: LE Meta Event (0x3e) plen 34                  #102 [hci1] 4.165969
      LE Extended Advertising Report (0x0d)
        Num reports: 1
        Entry 0
          Event type: 0x0010
            Props: 0x0010
              Use legacy advertising PDUs
            Data status: [0;32mComplete[0m
          Legacy PDU Type: ADV_NONCONN_IND (0x0010)
          Address type: Public (0x00)
          Address: DF:A9:FF:F6:B1:1A (OUI DF-A9-FF)
          Primary PHY: LE 1M
          Secondary PHY: No packets
          SID: no ADI field (0xff)
          TX power: 127 dBm
          RSSI: -25 dBm (0xe7)
          Periodic advertising interval: 0.00 msec (0x0000)
          Direct address type: Reserved (0xff)
          Direct address: 00-00-00-00-00-00
          Data length: 0x08
        07 29 ed af eb 9e 80 01                          .)......        
        Mesh Provisioning: edafeb9e8001
          Link ID: 0xedafeb9e
          Transaction Number: 128
          Transaction Acknowledgment (0x01)
> HCI Event: LE Meta Event (0x3e) plen 43                  #103 [hci1] 4.225265
      LE Extended Advertising Report (0x0d)
        Num reports: 1
        Entry 0
          Event type: 0x0010
            Props: 0x0010
              Use legacy advertising PDUs
            Data status: [0;32mComplete[0m
          Legacy PDU Type: ADV_NONCONN_IND (0x0010)
          Address type: Public (0x00)
          Address: DF:A9:FF:F6:B1:1A (OUI DF-A9-FF)
          Primary PHY: LE 1M
          Secondary PHY: No packets
          SID: no ADI field (0xff)
          TX power: 127 dBm
          RSSI: -20 dBm (0xec)
          Periodic advertising interval: 0.00 msec (0x0000)
          Direct address type: Reserved (0xff)
          Direct address: 00-00-00-00-00-00
          Data length: 0x11
        10 29 ed af eb 9e 01 00 00 06 8d 02 01 00 00 00  .)..............
        00                                               .               
        Mesh Provisioning: edafeb9e010000068d020100000000
          Link ID: 0xedafeb9e
          Transaction Number: 1
          Transaction Start (0x00)
          SeqN: 0
          TotalLength: 6
          FCS: 0x8d
          Data: 020100000000
        01 00 00 00 00                                   .....           
< HCI Command: LE Set Extended Ad.. (0x08|0x0037) plen 12  #104 [hci1] 4.293061
        Handle: 0x00
        Operation: Complete extended advertising data (0x03)
        Fragment preference: Minimize fragmentation (0x01)
        Data length: 0x08
        Mesh Provisioning: edafeb9e0101
          Link ID: 0xedafeb9e
          Transaction Number: 1
          Transaction Acknowledgment (0x01)
> HCI Event: Command Complete (0x0e) plen 4                #105 [hci1] 4.293674
      LE Set Extended Advertising Data (0x08|0x0037) ncmd 1
        Status: Success (0x00)
< HCI Command: LE Set Advertising... (0x08|0x0035) plen 7  #106 [hci1] 4.312975
        Advertising handle: 0x00
        Advertising random address: 3E:50:C8:53:43:96 (Non-Resolvable)
> HCI Event: Command Complete (0x0e) plen 4                #107 [hci1] 4.313447
      LE Set Advertising Set Random Address (0x08|0x0035) ncmd 1
        Status: Success (0x00)
< HCI Command: LE Set Extended Adv.. (0x08|0x0039) plen 6  #108 [hci1] 4.332986
        Extended advertising: Enabled (0x01)
        Number of sets: 1 (0x01)
        Entry 0
          Handle: 0x00
          Duration: 0 ms (0x00)
          Max ext adv events: 3
> HCI Event: Command Complete (0x0e) plen 4                #109 [hci1] 4.333502
      LE Set Extended Advertising Enable (0x08|0x0039) ncmd 1
        Status: Success (0x00)
> HCI Event: LE Meta Event (0x3e) plen 57                  #110 [hci1] 4.359679
      LE Extended Advertising Report (0x0d)
        Num reports: 1
        Entry 0
          Event type: 0x0010
            Props: 0x0010
              Use legacy advertising PDUs
            Data status: [0;32mComplete[0m
          Legacy PDU Type: ADV_NONCONN_IND (0x0010)
          Address type: Public (0x00)
          Address: DF:A9:FF:F6:B1:1A (OUI DF-A9-FF)
          Primary PHY: LE 1M
          Secondary PHY: No packets
          SID: no ADI field (0xff)
          TX power: 127 dBm
          RSSI: -25 dBm (0xe7)
          Periodic advertising interval: 0.00 msec (0x0000)
          Direct address type: Reserved (0xff)
          Direct address: 00-00-00-00-00-00
          Data length: 0x1f
        1e 29 ed af eb 9e 02 08 00 41 0e 03 9f 65 b9 df  .).......A...e..
        a7 c9 7f c1 61 93 e6 77 6c a1 b8 f0 72 fc 63     ....a..wl...r.c 
        Mesh Provisioning: edafeb9e020800410e039f65b9dfa7c97fc16193e6776ca1b8f072fc63
          Link ID: 0xedafeb9e
          Transaction Number: 2
          Transaction Start (0x00)
          SeqN: 8
          TotalLength: 65
          FCS: 0x0e
          Data: 039f65b9dfa7c97fc16193e6776ca1b8f072fc63
        9f 65 b9 df a7 c9 7f c1 61 93 e6 77 6c a1 b8 f0  .e......a..wl...
        72 fc 63                                         r.c             
> HCI Event: LE Meta Event (0x3e) plen 6                   #111 [hci1] 4.385184
      LE Advertising Set Terminated (0x12)
        Status: Limit Reached (0x43)
        Handle: 0
        Connection handle: 65535
        Number of completed extended advertising events: 3
> HCI Event: LE Meta Event (0x3e) plen 57                  #112 [hci1] 4.413228
      LE Extended Advertising Report (0x0d)
        Num reports: 1
        Entry 0
          Event type: 0x0010
            Props: 0x0010
              Use legacy advertising PDUs
            Data status: [0;32mComplete[0m
          Legacy PDU Type: ADV_NONCONN_IND (0x0010)
          Address type: Public (0x00)
          Address: DF:A9:FF:F6:B1:1A (OUI DF-A9-FF)
          Primary PHY: LE 1M
          Secondary PHY: No packets
          SID: no ADI field (0xff)
          TX power: 127 dBm
          RSSI: -20 dBm (0xec)
          Periodic advertising interval: 0.00 msec (0x0000)
          Direct address type: Reserved (0xff)
          Direct address: 00-00-00-00-00-00
          Data length: 0x1f
        1e 29 ed af eb 9e 02 06 ab b4 6a ed 23 1a c1 c4  .)........j.#...
        9a e4 92 d1 b6 4f 2c 71 79 32 3d 46 cf 55 b7     .....O,qy2=F.U. 
        Mesh Provisioning: edafeb9e0206abb46aed231ac1c49ae492d1b64f2c7179323d46cf55b7
          Link ID: 0xedafeb9e
          Transaction Number: 2
          Transaction Continuation (0x02)
          SegmentIndex: 1
          Data: abb46aed231ac1c49ae492d1b64f2c7179323d46cf55b7
        b4 6a ed 23 1a c1 c4 9a e4 92 d1 b6 4f 2c 71 79  .j.#........O,qy
        32 3d 46 cf 55 b7                                2=F.U.          
> HCI Event: LE Meta Event (0x3e) plen 56                  #113 [hci1] 4.455634
      LE Extended Advertising Report (0x0d)
        Num reports: 1
        Entry 0
          Event type: 0x0010
            Props: 0x0010
              Use legacy advertising PDUs
            Data status: [0;32mComplete[0m
          Legacy PDU Type: ADV_NONCONN_IND (0x0010)
          Address type: Public (0x00)
          Address: DF:A9:FF:F6:B1:1A (OUI DF-A9-FF)
          Primary PHY: LE 1M
          Secondary PHY: No packets
          SID: no ADI field (0xff)
          TX power: 127 dBm
          RSSI: -25 dBm (0xe7)
          Periodic advertising interval: 0.00 msec (0x0000)
          Direct address type: Reserved (0xff)
          Direct address: 00-00-00-00-00-00
          Data length: 0x1e
        1d 29 ed af eb 9e 02 0a f0 d8 5b 39 0b ed e9 04  .)........[9....
        13 86 27 a3 80 a6 dc cf 9c 7c e6 85 f8 22        ..'......|..."  
        Mesh Provisioning: edafeb9e020af0d85b390bede904138627a380a6dccf9c7ce685f822
          Link ID: 0xedafeb9e
          Transaction Number: 2
          Transaction Continuation (0x02)
          SegmentIndex: 2
          Data: f0d85b390bede904138627a380a6dccf9c7ce685f822
        d8 5b 39 0b ed e9 04 13 86 27 a3 80 a6 dc cf 9c  .[9......'......
        7c e6 85 f8 22                                   |..."           
< HCI Command: LE Set Extended Ad.. (0x08|0x0037) plen 12  #114 [hci1] 4.523009
        Handle: 0x00
        Operation: Complete extended advertising data (0x03)
        Fragment preference: Minimize fragmentation (0x01)
        Data length: 0x08
        Mesh Provisioning: edafeb9e0201
          Link ID: 0xedafeb9e
          Transaction Number: 2
          Transaction Acknowledgment (0x01)
> HCI Event: Command Complete (0x0e) plen 4                #115 [hci1] 4.523657
      LE Set Extended Advertising Data (0x08|0x0037) ncmd 1
        Status: Success (0x00)
< HCI Command: LE Set Advertising... (0x08|0x0035) plen 7  #116 [hci1] 4.532959
        Advertising handle: 0x00
        Advertising random address: 08:B1:3D:FC:B6:96 (Non-Resolvable)
> HCI Event: Command Complete (0x0e) plen 4                #117 [hci1] 4.533436
      LE Set Advertising Set Random Address (0x08|0x0035) ncmd 1
        Status: Success (0x00)
< HCI Command: LE Set Extended Adv.. (0x08|0x0039) plen 6  #118 [hci1] 4.552967
        Extended advertising: Enabled (0x01)
        Number of sets: 1 (0x01)
        Entry 0
          Handle: 0x00
          Duration: 0 ms (0x00)
          Max ext adv events: 3
> HCI Event: Command Complete (0x0e) plen 4                #119 [hci1] 4.553445
      LE Set Extended Advertising Enable (0x08|0x0039) ncmd 1
        Status: Success (0x00)
> HCI Event: LE Meta Event (0x3e) plen 6                   #120 [hci1] 4.610852
      LE Advertising Set Terminated (0x12)
        Status: Limit Reached (0x43)
        Handle: 0
        Connection handle: 65535
        Number of completed extended advertising events: 3
< HCI Command: LE Set Extended Ad.. (0x08|0x0037) plen 35  #121 [hci1] 4.663009
        Handle: 0x00
        Operation: Complete extended advertising data (0x03)
        Fragment preference: Minimize fragmentation (0x01)
        Data length: 0x1f
        Mesh Provisioning: edafeb9e81080041ce034636b8a7a6622544b27e36949187ef97ec1595
          Link ID: 0xedafeb9e
          Transaction Number: 129
          Transaction Start (0x00)
          SeqN: 8
          TotalLength: 65
          FCS: 0xce
          Data: 034636b8a7a6622544b27e36949187ef97ec1595
        46 36 b8 a7 a6 62 25 44 b2 7e 36 94 91 87 ef 97  F6...b%D.~6.....
        ec 15 95                                         ...             
> HCI Event: Command Complete (0x0e) plen 4                #122 [hci1] 4.663856
      LE Set Extended Advertising Data (0x08|0x0037) ncmd 1
        Status: Success (0x00)
< HCI Command: LE Set Advertising... (0x08|0x0035) plen 7  #123 [hci1] 4.672978
        Advertising handle: 0x00
        Advertising random address: 0D:79:5C:CF:1B:70 (Non-Resolvable)
> HCI Event: Command Complete (0x0e) plen 4                #124 [hci1] 4.673416
      LE Set Advertising Set Random Address (0x08|0x0035) ncmd 1
        Status: Success (0x00)
< HCI Command: LE Set Extended Adv.. (0x08|0x0039) plen 6  #125 [hci1] 4.692968
        Extended advertising: Enabled (0x01)
        Number of sets: 1 (0x01)
        Entry 0
          Handle: 0x00
          Duration: 0 ms (0x00)
          Max ext adv events: 1
> HCI Event: Command Complete (0x0e) plen 4                #126 [hci1] 4.693484
      LE Set Extended Advertising Enable (0x08|0x0039) ncmd 1
        Status: Success (0x00)
> HCI Event: LE Meta Event (0x3e) plen 6                   #127 [hci1] 4.697426
      LE Advertising Set Terminated (0x12)
        Status: Limit Reached (0x43)
        Handle: 0
        Connection handle: 65535
        Number of completed extended advertising events: 1
< HCI Command: LE Set Extended Ad.. (0x08|0x0037) plen 35  #128 [hci1] 4.773061
        Handle: 0x00
        Operation: Complete extended advertising data (0x03)
        Fragment preference: Minimize fragmentation (0x01)
        Data length: 0x1f
        Mesh Provisioning: edafeb9e810683450fa93ceca4db684db5b45b5153af0cb7bb33ee3ab0
          Link ID: 0xedafeb9e
          Transaction Number: 129
          Transaction Continuation (0x02)
          SegmentIndex: 1
          Data: 83450fa93ceca4db684db5b45b5153af0cb7bb33ee3ab0
        45 0f a9 3c ec a4 db 68 4d b5 b4 5b 51 53 af 0c  E..<...hM..[QS..
        b7 bb 33 ee 3a b0                                ..3.:.          
> HCI Event: Command Complete (0x0e) plen 4                #129 [hci1] 4.773933
      LE Set Extended Advertising Data (0x08|0x0037) ncmd 1
        Status: Success (0x00)
< HCI Command: LE Set Advertising... (0x08|0x0035) plen 7  #130 [hci1] 4.792986
        Advertising handle: 0x00
        Advertising random address: 1A:BD:5E:29:3F:2C (Non-Resolvable)
> HCI Event: Command Complete (0x0e) plen 4                #131 [hci1] 4.793558
      LE Set Advertising Set Random Address (0x08|0x0035) ncmd 1
        Status: Success (0x00)
< HCI Command: LE Set Extended Adv.. (0x08|0x0039) plen 6  #132 [hci1] 4.812984
        Extended advertising: Enabled (0x01)
        Number of sets: 1 (0x01)
        Entry 0
          Handle: 0x00
          Duration: 0 ms (0x00)
          Max ext adv events: 1
> HCI Event: Command Complete (0x0e) plen 4                #133 [hci1] 4.813567
      LE Set Extended Advertising Enable (0x08|0x0039) ncmd 1
        Status: Success (0x00)
> HCI Event: LE Meta Event (0x3e) plen 6                   #134 [hci1] 4.823340
      LE Advertising Set Terminated (0x12)
        Status: Limit Reached (0x43)
        Handle: 0
        Connection handle: 65535
        Number of completed extended advertising events: 1
< HCI Command: LE Set Extended Ad.. (0x08|0x0037) plen 34  #135 [hci1] 4.873073
        Handle: 0x00
        Operation: Complete extended advertising data (0x03)
        Fragment preference: Minimize fragmentation (0x01)
        Data length: 0x1e
        Mesh Provisioning: edafeb9e810afd105027a980f361ffd0cca0c3a59e2b84b6be44c7ca
          Link ID: 0xedafeb9e
          Transaction Number: 129
          Transaction Continuation (0x02)
          SegmentIndex: 2
          Data: fd105027a980f361ffd0cca0c3a59e2b84b6be44c7ca
        10 50 27 a9 80 f3 61 ff d0 cc a0 c3 a5 9e 2b 84  .P'...a.......+.
        b6 be 44 c7 ca                                   ..D..           
> HCI Event: Command Complete (0x0e) plen 4                #136 [hci1] 4.873981
      LE Set Extended Advertising Data (0x08|0x0037) ncmd 1
        Status: Success (0x00)
< HCI Command: LE Set Advertising... (0x08|0x0035) plen 7  #137 [hci1] 4.892988
        Advertising handle: 0x00
        Advertising random address: 3F:2F:5C:21:EB:CF (Non-Resolvable)
> HCI Event: Command Complete (0x0e) plen 4                #138 [hci1] 4.893567
      LE Set Advertising Set Random Address (0x08|0x0035) ncmd 1
        Status: Success (0x00)
< HCI Command: LE Set Extended Adv.. (0x08|0x0039) plen 6  #139 [hci1] 4.912985
        Extended advertising: Enabled (0x01)
        Number of sets: 1 (0x01)
        Entry 0
          Handle: 0x00
          Duration: 0 ms (0x00)
          Max ext adv events: 1
> HCI Event: Command Complete (0x0e) plen 4                #140 [hci1] 4.913567
      LE Set Extended Advertising Enable (0x08|0x0039) ncmd 1
        Status: Success (0x00)
> HCI Event: LE Meta Event (0x3e) plen 6                   #141 [hci1] 4.919137
      LE Advertising Set Terminated (0x12)
        Status: Limit Reached (0x43)
        Handle: 0
        Connection handle: 65535
        Number of completed extended advertising events: 1
> HCI Event: LE Meta Event (0x3e) plen 34                  #142 [hci1] 4.989553
      LE Extended Advertising Report (0x0d)
        Num reports: 1
        Entry 0
          Event type: 0x0010
            Props: 0x0010
              Use legacy advertising PDUs
            Data status: [0;32mComplete[0m
          Legacy PDU Type: ADV_NONCONN_IND (0x0010)
          Address type: Public (0x00)
          Address: DF:A9:FF:F6:B1:1A (OUI DF-A9-FF)
          Primary PHY: LE 1M
          Secondary PHY: No packets
          SID: no ADI field (0xff)
          TX power: 127 dBm
          RSSI: -25 dBm (0xe7)
          Periodic advertising interval: 0.00 msec (0x0000)
          Direct address type: Reserved (0xff)
          Direct address: 00-00-00-00-00-00
          Data length: 0x08
        07 29 ed af eb 9e 81 01                          .)......        
        Mesh Provisioning: edafeb9e8101
          Link ID: 0xedafeb9e
          Transaction Number: 129
          Transaction Acknowledgment (0x01)
> HCI Event: LE Meta Event (0x3e) plen 34                  #143 [hci1] 5.029391
      LE Extended Advertising Report (0x0d)
        Num reports: 1
        Entry 0
          Event type: 0x0010
            Props: 0x0010
              Use legacy advertising PDUs
            Data status: [0;32mComplete[0m
          Legacy PDU Type: ADV_NONCONN_IND (0x0010)
          Address type: Public (0x00)
          Address: DF:A9:FF:F6:B1:1A (OUI DF-A9-FF)
          Primary PHY: LE 1M
          Secondary PHY: No packets
          SID: no ADI field (0xff)
          TX power: 127 dBm
          RSSI: -21 dBm (0xeb)
          Periodic advertising interval: 0.00 msec (0x0000)
          Direct address type: Reserved (0xff)
          Direct address: 00-00-00-00-00-00
          Data length: 0x08
        07 29 ed af eb 9e 81 01                          .)......        
        Mesh Provisioning: edafeb9e8101
          Link ID: 0xedafeb9e
          Transaction Number: 129
          Transaction Acknowledgment (0x01)
> HCI Event: LE Meta Event (0x3e) plen 34                  #144 [hci1] 5.061159
      LE Extended Advertising Report (0x0d)
        Num reports: 1
        Entry 0
          Event type: 0x0010
            Props: 0x0010
              Use legacy advertising PDUs
            Data status: [0;32mComplete[0m
          Legacy PDU Type: ADV_NONCONN_IND (0x0010)
          Address type: Public (0x00)
          Address: DF:A9:FF:F6:B1:1A (OUI DF-A9-FF)
          Primary PHY: LE 1M
          Secondary PHY: No packets
          SID: no ADI field (0xff)
          TX power: 127 dBm
          RSSI: -25 dBm (0xe7)
          Periodic advertising interval: 0.00 msec (0x0000)
          Direct address type: Reserved (0xff)
          Direct address: 00-00-00-00-00-00
          Data length: 0x08
        07 29 ed af eb 9e 81 01                          .)......        
        Mesh Provisioning: edafeb9e8101
          Link ID: 0xedafeb9e
          Transaction Number: 129
          Transaction Acknowledgment (0x01)
> HCI Event: LE Meta Event (0x3e) plen 57                  #145 [hci1] 5.127028
      LE Extended Advertising Report (0x0d)
        Num reports: 1
        Entry 0
          Event type: 0x0010
            Props: 0x0010
              Use legacy advertising PDUs
            Data status: [0;32mComplete[0m
          Legacy PDU Type: ADV_NONCONN_IND (0x0010)
          Address type: Public (0x00)
          Address: DF:A9:FF:F6:B1:1A (OUI DF-A9-FF)
          Primary PHY: LE 1M
          Secondary PHY: No packets
          SID: no ADI field (0xff)
          TX power: 127 dBm
          RSSI: -21 dBm (0xeb)
          Periodic advertising interval: 0.00 msec (0x0000)
          Direct address type: Reserved (0xff)
          Direct address: 00-00-00-00-00-00
          Data length: 0x1f
        1e 29 ed af eb 9e 03 04 00 21 3c 05 55 a0 a2 97  .).......!<.U...
        f0 29 c2 b1 69 c0 6f a5 a4 49 a8 00 71 66 43     .)..i.o..I..qfC 
        Mesh Provisioning: edafeb9e030400213c0555a0a297f029c2b169c06fa5a449a800716643
          Link ID: 0xedafeb9e
          Transaction Number: 3
          Transaction Start (0x00)
          SeqN: 4
          TotalLength: 33
          FCS: 0x3c
          Data: 0555a0a297f029c2b169c06fa5a449a800716643
        55 a0 a2 97 f0 29 c2 b1 69 c0 6f a5 a4 49 a8 00  U....)..i.o..I..
        71 66 43                                         qfC             
> HCI Event: LE Meta Event (0x3e) plen 47                  #146 [hci1] 5.168667
      LE Extended Advertising Report (0x0d)
        Num reports: 1
        Entry 0
          Event type: 0x0010
            Props: 0x0010
              Use legacy advertising PDUs
            Data status: [0;32mComplete[0m
          Legacy PDU Type: ADV_NONCONN_IND (0x0010)
          Address type: Public (0x00)
          Address: DF:A9:FF:F6:B1:1A (OUI DF-A9-FF)
          Primary PHY: LE 1M
          Secondary PHY: No packets
          SID: no ADI field (0xff)
          TX power: 127 dBm
          RSSI: -25 dBm (0xe7)
          Periodic advertising interval: 0.00 msec (0x0000)
          Direct address type: Reserved (0xff)
          Direct address: 00-00-00-00-00-00
          Data length: 0x15
        14 29 ed af eb 9e 03 06 bc 49 d0 9a ea f7 b7 76  .).......I.....v
        01 45 f9 21 74                                   .E.!t           
        Mesh Provisioning: edafeb9e0306bc49d09aeaf7b7760145f92174
          Link ID: 0xedafeb9e
          Transaction Number: 3
          Transaction Continuation (0x02)
          SegmentIndex: 1
          Data: bc49d09aeaf7b7760145f92174
        49 d0 9a ea f7 b7 76 01 45 f9 21 74              I.....v.E.!t    
< HCI Command: LE Set Extended Ad.. (0x08|0x0037) plen 12  #147 [hci1] 5.213519
        Handle: 0x00
        Operation: Complete extended advertising data (0x03)
        Fragment preference: Minimize fragmentation (0x01)
        Data length: 0x08
        Mesh Provisioning: edafeb9e0301
          Link ID: 0xedafeb9e
          Transaction Number: 3
          Transaction Acknowledgment (0x01)
> HCI Event: Command Complete (0x0e) plen 4                #148 [hci1] 5.214147
      LE Set Extended Advertising Data (0x08|0x0037) ncmd 1
        Status: Success (0x00)
< HCI Command: LE Set Advertising... (0x08|0x0035) plen 7  #149 [hci1] 5.233164
        Advertising handle: 0x00
        Advertising random address: 05:1C:00:D6:7F:2C (Non-Resolvable)
> HCI Event: Command Complete (0x0e) plen 4                #150 [hci1] 5.233668
      LE Set Advertising Set Random Address (0x08|0x0035) ncmd 1
        Status: Success (0x00)
< HCI Command: LE Set Extended Adv.. (0x08|0x0039) plen 6  #151 [hci1] 5.253052
        Extended advertising: Enabled (0x01)
        Number of sets: 1 (0x01)
        Entry 0
          Handle: 0x00
          Duration: 0 ms (0x00)
          Max ext adv events: 3
> HCI Event: Command Complete (0x0e) plen 4                #152 [hci1] 5.253623
      LE Set Extended Advertising Enable (0x08|0x0039) ncmd 1
        Status: Success (0x00)
