Bluetooth monitor ver 5.84
btmon[1586345]: = Note: Linux version 6.8.0-83-generic (x86_64)                                                          0.419719
btmon[1586345]: = Note: Bluetooth subsystem version 2.22                                                                 0.419720
= New Index: 00:00:00:00:00:00 (Primary,UART,hci0)                                                                       0.419721
= Open Index: 00:00:00:00:00:00                                                                                          0.423947
= Index Info: 00:00:00:00:00:00 (Nordic Semiconductor ASA)                                                               0.424109
zephyr.exe[1586347]: @ USER Open: main (privileged) version 2.22                                                {0x0001} 0.424161
zephyr.exe[1586347]: < HCI Command: Reset (0x03|0x0003) plen 0                                                        #1 0.424749
> HCI Event: Command Complete (0x0e) plen 4                                                                           #2 0.425492
      Reset (0x03|0x0003) ncmd 1
        Status: Success (0x00)
zephyr.exe[1586347]: < HCI Command: Read Local Supported Features (0x04|0x0003) plen 0                                #3 0.443973
> HCI Event: Command Complete (0x0e) plen 12                                                                          #4 0.444958
      Read Local Supported Features (0x04|0x0003) ncmd 1
        Status: Success (0x00)
        Features: 0x00 0x00 0x00 0x00 0x60 0x00 0x00 0x00
          BR/EDR Not Supported
          LE Supported (Controller)
zephyr.exe[1586347]: < HCI Command: Read Local Version Information (0x04|0x0001) plen 0                               #5 0.463961
> HCI Event: Command Complete (0x0e) plen 12                                                                          #6 0.465228
      Read Local Version Information (0x04|0x0001) ncmd 1
        Status: Success (0x00)
        HCI version: Reserved (0x0e) - Revision 12520 (0x30e8)
        LMP version: Reserved (0x0e) - Subversion 12520 (0x30e8)
        Manufacturer: Nordic Semiconductor ASA (89)
zephyr.exe[1586347]: < HCI Command: Read Local Supported Commands (0x04|0x0002) plen 0                                #7 0.483965
> HCI Event: Command Complete (0x0e) plen 68                                                                          #8 0.485485
      Read Local Supported Commands (0x04|0x0002) ncmd 1
        Status: Success (0x00)
        Commands: 119 entries
          Disconnect (Octet 0 - Bit 5)
          Read Remote Version Information (Octet 2 - Bit 7)
          Set Event Mask (Octet 5 - Bit 6)
          Reset (Octet 5 - Bit 7)
          Read Connection Accept Timeout (Octet 7 - Bit 2)
          Write Connection Accept Timeout (Octet 7 - Bit 3)
          Read Transmit Power Level (Octet 10 - Bit 2)
          Set Controller To Host Flow Control (Octet 10 - Bit 5)
          Host Buffer Size (Octet 10 - Bit 6)
          Host Number of Completed Packets (Octet 10 - Bit 7)
          Read Local Version Information (Octet 14 - Bit 3)
          Read Local Supported Features (Octet 14 - Bit 5)
          Read BD ADDR (Octet 15 - Bit 1)
          Read RSSI (Octet 15 - Bit 5)
          Set Event Mask Page 2 (Octet 22 - Bit 2)
          LE Set Event Mask (Octet 25 - Bit 0)
          LE Read Buffer Size (Octet 25 - Bit 1)
          LE Read Local Supported Features (Octet 25 - Bit 2)
          LE Set Random Address (Octet 25 - Bit 4)
          LE Set Advertising Parameters (Octet 25 - Bit 5)
          LE Read Advertising Channel TX Power (Octet 25 - Bit 6)
          LE Set Advertising Data (Octet 25 - Bit 7)
          LE Set Scan Response Data (Octet 26 - Bit 0)
          LE Set Advertise Enable (Octet 26 - Bit 1)
          LE Set Scan Parameters (Octet 26 - Bit 2)
          LE Set Scan Enable (Octet 26 - Bit 3)
          LE Create Connection (Octet 26 - Bit 4)
          LE Create Connection Cancel (Octet 26 - Bit 5)
          LE Read Accept List Size (Octet 26 - Bit 6)
          LE Clear Accept List (Octet 26 - Bit 7)
          LE Add Device To Accept List (Octet 27 - Bit 0)
          LE Remove Device From Accept List (Octet 27 - Bit 1)
          LE Connection Update (Octet 27 - Bit 2)
          LE Set Host Channel Classification (Octet 27 - Bit 3)
          LE Read Channel Map (Octet 27 - Bit 4)
          LE Read Remote Used Features (Octet 27 - Bit 5)
          LE Encrypt (Octet 27 - Bit 6)
          LE Rand (Octet 27 - Bit 7)
          LE Start Encryption (Octet 28 - Bit 0)
          LE Long Term Key Request Reply (Octet 28 - Bit 1)
          LE Long Term Key Request Neg Reply (Octet 28 - Bit 2)
          LE Read Supported States (Octet 28 - Bit 3)
          LE Receiver Test (Octet 28 - Bit 4)
          LE Transmitter Test (Octet 28 - Bit 5)
          LE Test End (Octet 28 - Bit 6)
          Read Authenticated Payload Timeout (Octet 32 - Bit 4)
          Write Authenticated Payload Timeout (Octet 32 - Bit 5)
          LE Set Data Length (Octet 33 - Bit 6)
          LE Read Suggested Default Data Length (Octet 33 - Bit 7)
          LE Write Suggested Default Data Length (Octet 34 - Bit 0)
          LE Add Device To Resolving List (Octet 34 - Bit 3)
          LE Remove Device From Resolving List (Octet 34 - Bit 4)
          LE Clear Resolving List (Octet 34 - Bit 5)
          LE Read Resolving List Size (Octet 34 - Bit 6)
          LE Set Address Resolution Enable (Octet 35 - Bit 1)
          LE Set Resolvable Private Address Timeout (Octet 35 - Bit 2)
          LE Read Maximum Data Length (Octet 35 - Bit 3)
          LE Read PHY (Octet 35 - Bit 4)
          LE Set Default PHY (Octet 35 - Bit 5)
          LE Set PHY (Octet 35 - Bit 6)
          LE Enhanced Receiver Test (Octet 35 - Bit 7)
          LE Enhanced Transmitter Test (Octet 36 - Bit 0)
          LE Set Advertising Set Random Address (Octet 36 - Bit 1)
          LE Set Extended Advertising Parameters (Octet 36 - Bit 2)
          LE Set Extended Advertising Data (Octet 36 - Bit 3)
          LE Set Extended Scan Response Data (Octet 36 - Bit 4)
          LE Set Extended Advertising Enable (Octet 36 - Bit 5)
          LE Read Maximum Advertising Data Length (Octet 36 - Bit 6)
          LE Read Number of Supported Advertising Sets (Octet 36 - Bit 7)
          LE Remove Advertising Set (Octet 37 - Bit 0)
          LE Clear Advertising Sets (Octet 37 - Bit 1)
          LE Set Periodic Advertising Parameters (Octet 37 - Bit 2)
          LE Set Periodic Advertising Data (Octet 37 - Bit 3)
          LE Set Periodic Advertising Enable (Octet 37 - Bit 4)
          LE Set Extended Scan Parameters (Octet 37 - Bit 5)
          LE Set Extended Scan Enable (Octet 37 - Bit 6)
          LE Extended Create Connection (Octet 37 - Bit 7)
          LE Periodic Advertising Create Sync (Octet 38 - Bit 0)
          LE Periodic Advertising Create Sync Cancel (Octet 38 - Bit 1)
          LE Periodic Advertising Terminate Sync (Octet 38 - Bit 2)
          LE Add Device To Periodic Advertiser List (Octet 38 - Bit 3)
          LE Remove Device From Periodic Advertiser List (Octet 38 - Bit 4)
          LE Clear Periodic Advertiser List (Octet 38 - Bit 5)
          LE Read Periodic Advertiser List Size (Octet 38 - Bit 6)
          LE Read Transmit Power (Octet 38 - Bit 7)
          LE Read RF Path Compensation (Octet 39 - Bit 0)
          LE Write RF Path Compensation (Octet 39 - Bit 1)
          LE Set Privacy Mode (Octet 39 - Bit 2)
          LE Periodic Advertising Receive Enable (Octet 40 - Bit 5)
          LE Periodic Advertising Sync Transfer (Octet 40 - Bit 6)
          LE Periodic Advertising Set Info Transfer (Octet 40 - Bit 7)
          LE Periodic Advertising Sync Transfer Parameters (Octet 41 - Bit 0)
          LE Set Default Periodic Advertisng Sync Transfer Parameters (Octet 41 - Bit 1)
          LE Read Buffer v2 (Octet 41 - Bit 5)
          LE Read ISO TX Sync (Octet 41 - Bit 6)
          LE Set Connected Isochronous Group Parameters (Octet 41 - Bit 7)
          LE Set Connected Isochronous Group Parameters Test (Octet 42 - Bit 0)
          LE Create Connected Isochronous Stream (Octet 42 - Bit 1)
          LE Remove Connected Isochronous Group (Octet 42 - Bit 2)
          LE Accept Connected Isochronous Stream Request (Octet 42 - Bit 3)
          LE Reject Connected Isochronous Stream Request (Octet 42 - Bit 4)
          LE Create Broadcast Isochronous Group (Octet 42 - Bit 5)
          LE Create Broadcast Isochronous Group Test (Octet 42 - Bit 6)
          LE Terminate Broadcast Isochronous Group (Octet 42 - Bit 7)
          LE Broadcast Isochronous Group Create Sync (Octet 43 - Bit 0)
          LE Broadcast Isochronous Group Terminate Sync (Octet 43 - Bit 1)
          LE Request Peer SCA (Octet 43 - Bit 2)
          LE Setup Isochronous Data Path (Octet 43 - Bit 3)
          LE Remove Isochronous Data Path (Octet 43 - Bit 4)
          LE Isochronous Transmit Test (Octet 43 - Bit 5)
          LE Isochronous Receive Test (Octet 43 - Bit 6)
          LE Isochronous Read Test Counters (Octet 43 - Bit 7)
          LE Isochronous Read Test Counters (Octet 44 - Bit 0)
          LE Set Host Feature (Octet 44 - Bit 1)
          LE Read ISO link quality (Octet 44 - Bit 2)
          Octet 45 - Bit 6 
          Octet 46 - Bit 0 
          Octet 46 - Bit 1 
          Octet 46 - Bit 2 
zephyr.exe[1586347]: < HCI Command: Host Buffer Size (0x03|0x0033) plen 7                                             #9 0.503971
        ACL MTU: 255  ACL max packet: 16
        SCO MTU: 0    SCO max packet: 0
> HCI Event: Command Complete (0x0e) plen 4                                                                          #10 0.504696
      Host Buffer Size (0x03|0x0033) ncmd 1
        Status: Success (0x00)
zephyr.exe[1586347]: < HCI Command: Set Controller To Host Flow Control (0x03|0x0031) plen 1                         #11 0.523976
        Flow control: ACL Data Packets (0x01)
> HCI Event: Command Complete (0x0e) plen 4                                                                          #12 0.524753
      Set Controller To Host Flow Control (0x03|0x0031) ncmd 1
        Status: Success (0x00)
zephyr.exe[1586347]: < HCI Command: LE Read Local Supported Features (0x08|0x0003) plen 0                            #13 0.543969
> HCI Event: Command Complete (0x0e) plen 12                                                                         #14 0.544751
      LE Read Local Supported Features (0x08|0x0003) ncmd 1
        Status: Success (0x00)
        Features: 0xfd 0x79 0x00 0xf7 0x30 0x01 0x00 0x00
          LE Encryption
          Extended Reject Indication
          Peripheral-initiated Features Exchange
          LE Ping
          LE Data Packet Length Extension
          LL Privacy
          Extended Scanner Filter Policies
          LE 2M PHY
          LE Coded PHY
          LE Extended Advertising
          LE Periodic Advertising
          Channel Selection Algorithm #2
          Periodic Advertising Sync Transfer - Sender
          Periodic Advertising Sync Transfer - Recipient
          Sleep Clock Accuracy Updates
          Connected Isochronous Stream - Central
          Connected Isochronous Stream - Peripheral
          Isochronous Broadcaster
          Synchronized Receiver
          Periodic Advertising ADI support
          Connection Subrating
          Unknown features (0x0000010000000000)
zephyr.exe[1586347]: < HCI Command: LE Set Host Feature (0x08|0x0074) plen 2                                         #15 0.563971
        Bit Number: 32
          Connected Isochronous Stream (Host Support)
        Bit Value: 1
> HCI Event: Command Complete (0x0e) plen 4                                                                          #16 0.564560
      LE Set Host Feature (0x08|0x0074) ncmd 1
        Status: Success (0x00)
zephyr.exe[1586347]: < HCI Command: LE Read Buffer v2 (0x08|0x0060) plen 0                                           #17 0.583976
> HCI Event: Command Complete (0x0e) plen 10                                                                         #18 0.584737
      LE Read Buffer v2 (0x08|0x0060) ncmd 1
        Status: Success (0x00)
        ACL MTU: 27
        ACL max packet: 3
        ISO MTU: 318
        ISO max packet: 3
zephyr.exe[1586347]: < HCI Command: LE Read Maximum Advertising Data Length (0x08|0x003a) plen 0                     #19 0.603992
> HCI Event: Command Complete (0x0e) plen 6                                                                          #20 0.604515
      LE Read Maximum Advertising Data Length (0x08|0x003a) ncmd 1
        Status: Success (0x00)
        Max length: 1650
zephyr.exe[1586347]: < HCI Command: LE Read Supported States (0x08|0x001c) plen 0                                    #21 0.623971
> HCI Event: Command Complete (0x0e) plen 12                                                                         #22 0.624539
      LE Read Supported States (0x08|0x001c) ncmd 1
        Status: Success (0x00)
        States: 0x000003ff3e0306ff
          Non-connectable Advertising State
          Scannable Advertising State
          Connectable Advertising State
          High Duty Cycle Directed Advertising State
          Passive Scanning State
          Active Scanning State
          Initiating State
            and Connection State (Central Role)
          Connection State (Peripheral Role)
          Scannable Advertising State
            and Passive Scanning State
          Connectable Advertising State
            and Passive Scanning State
          Non-connectable Advertising State
            and Initiating State
          Scannable Advertising State
            and Initiating State
          Active Scanning State
            and Connection State (Central Role)
          Passive Scanning State
            and Connection State (Peripheral Role)
          Active Scanning State
            and Connection State (Peripheral Role)
          Initiating State
            and Connection State (Central Role)
            and Central Role & Central Role
          Low Duty Cycle Directed Advertising State
          Connectable Advertising State
            and Initiating State
            and Central Role & Peripheral Role
          High Duty Cycle Directed Advertising State
            and Initiating State
            and Central Role & Peripheral Role
          Low Duty Cycle Directed Advertising State
            and Initiating State
            and Central Role & Peripheral Role
          Connectable Advertising State
            and Connection State (Central Role)
            and Central Role & Peripheral Role
          High Duty Cycle Directed Advertising State
            and Connection State (Central Role)
            and Central Role & Peripheral Role
          Low Duty Cycle Directed Advertising State
            and Connection State (Central Role)
            and Central Role & Peripheral Role
          Connectable Advertising State
            and Connection State (Peripheral Role)
            and Central Role & Peripheral Role
          High Duty Cycle Directed Advertising State
            and Connection State (Peripheral Role)
            and Peripheral Role & Peripheral Role
          Low Duty Cycle Directed Advertising State
            and Connection State (Peripheral Role)
            and Peripheral Role & Peripheral Role
          Initiating State
            and Connection State (Peripheral Role)
            and Central Role & Peripheral Role
zephyr.exe[1586347]: < HCI Command: LE Read Maximum Data Length (0x08|0x002f) plen 0                                 #23 0.643980
> HCI Event: Command Complete (0x0e) plen 12                                                                         #24 0.644586
      LE Read Maximum Data Length (0x08|0x002f) ncmd 1
        Status: Success (0x00)
        Max TX octets: 251
        Max TX time: 2704
        Max RX octets: 251
        Max RX time: 2704
zephyr.exe[1586347]: < HCI Command: LE Write Suggested Default Data Length (0x08|0x0024) plen 4                      #25 0.663979
        TX octets: 251
        TX time: 2704
> HCI Event: Command Complete (0x0e) plen 4                                                                          #26 0.664522
      LE Write Suggested Default Data Length (0x08|0x0024) ncmd 1
        Status: Success (0x00)
zephyr.exe[1586347]: < HCI Command: LE Set Resolvable Private Address Timeout (0x08|0x002e) plen 2                   #27 0.683945
        Timeout: 30 seconds
> HCI Event: Command Complete (0x0e) plen 4                                                                          #28 0.684789
      LE Set Resolvable Private Address Timeout (0x08|0x002e) ncmd 1
        Status: Success (0x00)
zephyr.exe[1586347]: < HCI Command: LE Read Resolving List Size (0x08|0x002a) plen 0                                 #29 0.703947
> HCI Event: Command Complete (0x0e) plen 5                                                                          #30 0.704934
      LE Read Resolving List Size (0x08|0x002a) ncmd 1
        Status: Success (0x00)
        Size: 8
zephyr.exe[1586347]: < HCI Command: LE Set Event Mask (0x08|0x0001) plen 8                                           #31 0.723941
        Mask: 0x000002023f87fa5e
          LE Advertising Report
          LE Connection Update Complete
          LE Read Remote Used Features Complete
          LE Long Term Key Request
          LE Data Length Change
          LE Enhanced Connection Complete
          LE PHY Update Complete
          LE Extended Advertising Report
          LE Periodic Advertising Sync Established
          LE Periodic Advertising Report
          LE Periodic Advertising Sync Lost
          LE Extended Scan Timeout
          LE Extended Advertising Set Terminated
          LE Scan Request Received
          LE Periodic Advertising Sync Transfer Rvc
          LE CIS Established
          LE CIS Request
          LE Create BIG Complete
          LE Terminate BIG Complete
          LE BIG Sync Established Complete
          LE BIG Sync Lost
          LE BIG Info Advertising Report
          Unknown mask (0x0000020000000000)
> HCI Event: Command Complete (0x0e) plen 4                                                                          #32 0.724605
      LE Set Event Mask (0x08|0x0001) ncmd 1
        Status: Success (0x00)
zephyr.exe[1586347]: < HCI Command: Set Event Mask (0x03|0x0001) plen 8                                              #33 0.743945
        Mask: 0x2000800002008890
          Disconnection Complete
          Encryption Change
          Read Remote Version Information Complete
          Hardware Error
          Data Buffer Overflow
          Encryption Key Refresh Complete
          LE Meta
> HCI Event: Command Complete (0x0e) plen 4                                                                          #34 0.744928
      Set Event Mask (0x03|0x0001) ncmd 1
        Status: Success (0x00)
zephyr.exe[1586347]: < HCI Command: Read BD ADDR (0x04|0x0009) plen 0                                                #35 0.763948
> HCI Event: Command Complete (0x0e) plen 10                                                                         #36 0.764580
      Read BD ADDR (0x04|0x0009) ncmd 1
        Status: Success (0x00)
        Address: 00:00:00:00:00:00 (OUI 00-00-00)
zephyr.exe[1586347]: < HCI Command: LE Set Random Address (0x08|0x0005) plen 6                                       #37 0.783983
        Address: D5:B6:CC:31:DB:3B (Static)
> HCI Event: Command Complete (0x0e) plen 4                                                                          #38 0.784625
      LE Set Random Address (0x08|0x0005) ncmd 1
        Status: Success (0x00)
zephyr.exe[1586347]: < HCI Command: LE Set Random Address (0x08|0x0005) plen 6                                       #39 0.903984
        Address: 48:61:8E:DB:C6:F9 (Resolvable)
> HCI Event: Command Complete (0x0e) plen 4                                                                          #40 0.907162
      LE Set Random Address (0x08|0x0005) ncmd 1
        Status: Success (0x00)
zephyr.exe[1586347]: < HCI Command: LE Extended Create Connection (0x08|0x0043) plen 26                              #41 4.324050
        Filter policy: Accept list is not used (0x00)
        Own address type: Random (0x03)
        Peer address type: Public (0x00)
        Peer address: C0:07:E8:2C:B6:EE (OUI C0-07-E8)
        Initiating PHYs: 0x01
        Entry 0: LE 1M
          Scan interval: 60.000 msec (0x0060)
          Scan window: 60.000 msec (0x0060)
          Min connection interval: 50.00 msec (0x0028)
          Max connection interval: 70.00 msec (0x0038)
          Connection latency: 0 (0x0000)
          Supervision timeout: 4000 msec (0x0190)
          Min connection length: 0.000 msec (0x0000)
          Max connection length: 0.000 msec (0x0000)
> HCI Event: Command Status (0x0f) plen 4                                                                            #42 4.325954
      LE Extended Create Connection (0x08|0x0043) ncmd 1
        Status: Success (0x00)
> HCI Event: LE Meta Event (0x3e) plen 31                                                                            #43 4.413891
      LE Enhanced Connection Complete (0x0a)
        Status: Success (0x00)
        Handle: 90
        Role: Central (0x00)
        Peer address type: Public (0x00)
        Peer address: C0:07:E8:2C:B6:EE (OUI C0-07-E8)
        Local resolvable private address: 48:61:8E:DB:C6:F9 (Resolvable)
        Peer resolvable private address: 00:00:00:00:00:00 (Non-Resolvable)
        Connection interval: 70.00 msec (0x0038)
        Connection latency: 0 (0x0000)
        Supervision timeout: 4000 msec (0x0190)
        Central clock accuracy: 0x00
zephyr.exe[1586347]: < HCI Command: LE Read Remote Used Features (0x08|0x0016) plen 2                                #44 4.424031
        Handle: 90 Address: C0:07:E8:2C:B6:EE (OUI C0-07-E8)
> HCI Event: Command Status (0x0f) plen 4                                                                            #45 4.424641
      LE Read Remote Used Features (0x08|0x0016) ncmd 1
        Status: Success (0x00)
zephyr.exe[1586347]: < HCI Command: LE Set PHY (0x08|0x0032) plen 7                                                  #46 4.443950
        Handle: 90 Address: C0:07:E8:2C:B6:EE (OUI C0-07-E8)
        All PHYs preference: 0x00
        TX PHYs preference: 0x02
          LE 2M
        RX PHYs preference: 0x02
          LE 2M
        PHY options preference: Reserved (0x0000)
> HCI Event: Command Status (0x0f) plen 4                                                                            #47 4.445168
      LE Set PHY (0x08|0x0032) ncmd 1
        Status: Success (0x00)
zephyr.exe[1586347]: < ACL Data TX: Handle 90 [1/3] flags 0x00 dlen 7                                                #48 4.463989
      ATT: Exchange MTU Request (0x02) len 2
        Client RX MTU: 251
> HCI Event: Number of Completed Packets (0x13) plen 5                                                               #49 4.486211
        Num handles: 1
        Handle: 90 Address: C0:07:E8:2C:B6:EE (OUI C0-07-E8)
        Count: 1
        Buffers: 0/3
        #48: len 7 (2 Kb/s)
        Latency: 22 msec (22-22 msec ~22 msec)
> HCI Event: LE Meta Event (0x3e) plen 12                                                                            #50 4.626331
      LE Read Remote Used Features (0x04)
        Status: Success (0x00)
        Handle: 90 Address: C0:07:E8:2C:B6:EE (OUI C0-07-E8)
        Features: 0x2d 0x49 0x01 0xf7 0xef 0x39 0x00 0x80
          LE Encryption
          Extended Reject Indication
          Peripheral-initiated Features Exchange
          LE Data Packet Length Extension
          LE 2M PHY
          LE Coded PHY
          Channel Selection Algorithm #2
          Minimum Number of Used Channels Procedure
          Periodic Advertising Sync Transfer - Sender
          Periodic Advertising Sync Transfer - Recipient
          Sleep Clock Accuracy Updates
          Connected Isochronous Stream - Central
          Connected Isochronous Stream - Peripheral
          Isochronous Broadcaster
          Synchronized Receiver
          Connected Isochronous Stream (Host Support)
          LE Power Control Request
          LE Power Control Request
          LE Path Loss Monitoring
          Connection Subrating
          Connection Subrating (Host Support)
          Channel Classification
          Unknown features (0x8000390000000000)
> HCI Event: LE Meta Event (0x3e) plen 6                                                                             #51 5.255659
      LE PHY Update Complete (0x0c)
        Status: Success (0x00)
        Handle: 90 Address: C0:07:E8:2C:B6:EE (OUI C0-07-E8)
        TX PHY: LE 2M (0x02)
        RX PHY: LE 2M (0x02)
> ACL Data RX: Handle 90 flags 0x02 dlen 6                                                                           #52 5.466027
      SMP: Security Request (0x0b) len 1
        Authentication requirement: Bonding, No MITM, SC, No Keypresses (0x09)
> ACL Data RX: Handle 90 flags 0x02 dlen 7                                                                           #53 5.466507
      ATT: Exchange MTU Response (0x03) len 2
        Server RX MTU: 23
zephyr.exe[1586347]: < HCI Command: Host Number of Completed Packets (0x03|0x0035) plen 5                            #54 5.484025
        Num handles: 1
        Handle: 90 Address: C0:07:E8:2C:B6:EE (OUI C0-07-E8)
        Count: 1
zephyr.exe[1586347]: < ACL Data TX: Handle 90 [1/3] flags 0x00 dlen 11                                               #55 5.484810
      SMP: Pairing Request (0x01) len 6
        IO capability: NoInputNoOutput (0x03)
        OOB data: Authentication data not present (0x00)
        Authentication requirement: Bonding, No MITM, SC, No Keypresses (0x09)
        Max encryption key size: 16
        Initiator key distribution: EncKey IdKey Sign (0x07)
        Responder key distribution: EncKey IdKey Sign (0x07)
zephyr.exe[1586347]: < HCI Command: Host Number of Completed Packets (0x03|0x0035) plen 5                            #56 5.485275
        Num handles: 1
        Handle: 90 Address: C0:07:E8:2C:B6:EE (OUI C0-07-E8)
        Count: 1
> HCI Event: Number of Completed Packets (0x13) plen 5                                                               #57 5.536023
        Num handles: 1
        Handle: 90 Address: C0:07:E8:2C:B6:EE (OUI C0-07-E8)
        Count: 1
        Buffers: 0/3
        #55: len 11 (1 Kb/s)
        Latency: 51 msec (22-51 msec ~36 msec)
> ACL Data RX: Handle 90 flags 0x02 dlen 11                                                                          #58 5.606156
      SMP: Pairing Response (0x02) len 6
        IO capability: KeyboardDisplay (0x04)
        OOB data: Authentication data not present (0x00)
        Authentication requirement: Bonding, No MITM, SC, No Keypresses (0x09)
        Max encryption key size: 16
        Initiator key distribution: EncKey IdKey Sign (0x07)
        Responder key distribution: EncKey IdKey (0x03)
zephyr.exe[1586347]: < HCI Command: Host Number of Completed Packets (0x03|0x0035) plen 5                            #59 5.624066
        Num handles: 1
        Handle: 90 Address: C0:07:E8:2C:B6:EE (OUI C0-07-E8)
        Count: 1
zephyr.exe[1586347]: < ACL Data TX: Handle 90 [1/3] flags 0x00 dlen 27                                               #60 5.624982
zephyr.exe[1586347]: < ACL Data TX: Handle 90 flags 0x01 dlen 27                                                     #61 5.625446
zephyr.exe[1586347]: < ACL Data TX: Handle 90 flags 0x01 dlen 15                                                     #62 5.625846
      SMP: Pairing Public Key (0x0c) len 64
        X[32]: 68f6ada634ce84d11617383d57f070fe3445c38b33b569efa5eb771a0dc8aea5
        Y[32]: 83c407aaa8337331fdc418e55085d75e6c1c6e5d42f8bf9c18fb5a2a7d4f31aa
> HCI Event: Number of Completed Packets (0x13) plen 5                                                               #63 5.675972
        Num handles: 1
        Handle: 90 Address: C0:07:E8:2C:B6:EE (OUI C0-07-E8)
        Count: 1
        Buffers: 0/3
        #60: len 27 (4 Kb/s)
        Latency: 50 msec (22-51 msec ~43 msec)
> HCI Event: Number of Completed Packets (0x13) plen 5                                                               #64 5.676591
        Num handles: 1
        Handle: 90 Address: C0:07:E8:2C:B6:EE (OUI C0-07-E8)
        Count: 1
        Buffers: underflow/3
        #61: len 27 (4 Kb/s)
        Latency: 51 msec (22-51 msec ~47 msec)
> HCI Event: Number of Completed Packets (0x13) plen 5                                                               #65 5.677034
        Num handles: 1
        Handle: 90 Address: C0:07:E8:2C:B6:EE (OUI C0-07-E8)
        Count: 1
        Buffers: underflow/3
        #62: len 15 (2 Kb/s)
        Latency: 51 msec (22-51 msec ~49 msec)
> ACL Data RX: Handle 90 flags 0x02 dlen 27                                                                          #66 5.746273
> ACL Data RX: Handle 90 flags 0x01 dlen 27                                                                          #67 5.746779
> ACL Data RX: Handle 90 flags 0x01 dlen 15                                                                          #68 5.747088
      SMP: Pairing Public Key (0x0c) len 64
        X[32]: 5e0fe294d4c60ca42ca95e8744e2c15003aebf4ff41df81fac0b9fc49165019b
        Y[32]: cbe32dda33a79ab2eea06250d00685ca2763e45b4c7a354c94d1163073745345
zephyr.exe[1586347]: < HCI Command: Host Number of Completed Packets (0x03|0x0035) plen 5                            #69 5.764012
        Num handles: 1
        Handle: 90 Address: C0:07:E8:2C:B6:EE (OUI C0-07-E8)
        Count: 1
zephyr.exe[1586347]: < HCI Command: Host Number of Completed Packets (0x03|0x0035) plen 5                            #70 5.764174
        Num handles: 1
        Handle: 90 Address: C0:07:E8:2C:B6:EE (OUI C0-07-E8)
        Count: 1
zephyr.exe[1586347]: < HCI Command: Host Number of Completed Packets (0x03|0x0035) plen 5                            #71 5.764200
        Num handles: 1
        Handle: 90 Address: C0:07:E8:2C:B6:EE (OUI C0-07-E8)
        Count: 1
> ACL Data RX: Handle 90 flags 0x02 dlen 21                                                                          #72 5.764944
      SMP: Pairing Confirm (0x03) len 16
        Confirm value[16]: 27be864e196551ae2000f42291a1756c
zephyr.exe[1586347]: < HCI Command: Host Number of Completed Packets (0x03|0x0035) plen 5                            #73 5.784001
        Num handles: 1
        Handle: 90 Address: C0:07:E8:2C:B6:EE (OUI C0-07-E8)
        Count: 1
zephyr.exe[1586347]: < ACL Data TX: Handle 90 [1/3] flags 0x00 dlen 21                                               #74 5.784339
      SMP: Pairing Random (0x04) len 16
        Random value[16]: 555cc64d02679f89a05211af56d8b3da
> HCI Event: Number of Completed Packets (0x13) plen 5                                                               #75 5.816028
        Num handles: 1
        Handle: 90 Address: C0:07:E8:2C:B6:EE (OUI C0-07-E8)
        Count: 1
        Buffers: 0/3
        #74: len 21 (5 Kb/s)
        Latency: 31 msec (22-51 msec ~40 msec)
> ACL Data RX: Handle 90 flags 0x02 dlen 21                                                                          #76 5.886283
      SMP: Pairing Random (0x04) len 16
        Random value[16]: 4fd8053030ebac2f0000000000000000
zephyr.exe[1586347]: < HCI Command: Host Number of Completed Packets (0x03|0x0035) plen 5                            #77 5.904082
        Num handles: 1
        Handle: 90 Address: C0:07:E8:2C:B6:EE (OUI C0-07-E8)
        Count: 1
zephyr.exe[1586347]: < ACL Data TX: Handle 90 [1/3] flags 0x00 dlen 21                                               #78 5.904325
      SMP: Pairing DHKey Check (0x0d) len 16
        E[16]: 319b157b503b4ed831ee2911ee0a1736
> HCI Event: Number of Completed Packets (0x13) plen 5                                                               #79 5.956011
        Num handles: 1
        Handle: 90 Address: C0:07:E8:2C:B6:EE (OUI C0-07-E8)
        Count: 1
        Buffers: 0/3
        #78: len 21 (3 Kb/s)
        Latency: 51 msec (22-51 msec ~46 msec)
> ACL Data RX: Handle 90 flags 0x02 dlen 21                                                                          #80 6.096288
      SMP: Pairing DHKey Check (0x0d) len 16
        E[16]: 10c33d834a60679d257800e6ce89a419
zephyr.exe[1586347]: < HCI Command: LE Start Encryption (0x08|0x0019) plen 28                                        #81 6.104055
        Handle: 90 Address: C0:07:E8:2C:B6:EE (OUI C0-07-E8)
        Random number: 0x0000000000000000
        Encrypted diversifier: 0x0000
        Long term key[16]: 11950c7b9548a1c96f48e4b853912704
> HCI Event: Command Status (0x0f) plen 4                                                                            #82 6.106254
      LE Start Encryption (0x08|0x0019) ncmd 1
        Status: Success (0x00)
zephyr.exe[1586347]: < HCI Command: Host Number of Completed Packets (0x03|0x0035) plen 5                            #83 6.123992
        Num handles: 1
        Handle: 90 Address: C0:07:E8:2C:B6:EE (OUI C0-07-E8)
        Count: 1
> HCI Event: Encryption Change (0x08) plen 4                                                                         #84 6.516039
        Status: Success (0x00)
        Handle: 90 Address: C0:07:E8:2C:B6:EE (OUI C0-07-E8)
        Encryption: Enabled with AES-CCM (0x01)
zephyr.exe[1586347]: < ACL Data TX: Handle 90 [1/3] flags 0x00 dlen 13                                               #85 6.573981
      ATT: Find By Type Value Request (0x06) len 8
        Handle range: 0x0001-0xffff
        Attribute type: Primary Service (0x2800)
          UUID: Coordinated Set Identification (0x1846)
> HCI Event: Number of Completed Packets (0x13) plen 5                                                               #86 6.586147
        Num handles: 1
        Handle: 90 Address: C0:07:E8:2C:B6:EE (OUI C0-07-E8)
        Count: 1
        Buffers: 0/3
        #85: len 13 (8 Kb/s)
        Latency: 12 msec (12-51 msec ~29 msec)
> ACL Data RX: Handle 90 flags 0x02 dlen 21                                                                          #87 6.586434
      SMP: Identity Information (0x08) len 16
        Identity resolving key[16]: f3eff3ec286e602c11f830b6c81262d9
zephyr.exe[1586347]: < HCI Command: Host Number of Completed Packets (0x03|0x0035) plen 5                            #88 6.603939
        Num handles: 1
        Handle: 90 Address: C0:07:E8:2C:B6:EE (OUI C0-07-E8)
        Count: 1
> ACL Data RX: Handle 90 flags 0x02 dlen 12                                                                          #89 6.656074
      SMP: Identity Address Information (0x09) len 7
        Address: C0:07:E8:2C:B6:EE (OUI C0-07-E8)
> ACL Data RX: Handle 90 flags 0x02 dlen 9                                                                           #90 6.656518
      ATT: Find By Type Value Response (0x07) len 4
        Handle range: 0x0160-0x016b
zephyr.exe[1586347]: < HCI Command: LE Add Device To Resolving List (0x08|0x0027) plen 39                            #91 6.665828
        Address type: Public (0x00)
        Address: C0:07:E8:2C:B6:EE (OUI C0-07-E8)
        Peer identity resolving key[16]: f3eff3ec286e602c11f830b6c81262d9
        Local identity resolving key[16]: 08aad2e1be87e47b88aeb19de6889efb
> HCI Event: Command Complete (0x0e) plen 4                                                                          #92 6.668789
      LE Add Device To Resolving List (0x08|0x0027) ncmd 1
        Status: Success (0x00)
zephyr.exe[1586347]: < HCI Command: LE Set Privacy Mode (0x08|0x004e) plen 8                                         #93 6.687084
        Peer Identity address type: Public (0x00)
        Peer Identity address: C0:07:E8:2C:B6:EE (OUI C0-07-E8)
        Privacy Mode: Use Device Privacy (0x01)
> HCI Event: Command Complete (0x0e) plen 4                                                                          #94 6.689754
      LE Set Privacy Mode (0x08|0x004e) ncmd 1
        Status: Success (0x00)
zephyr.exe[1586347]: < HCI Command: LE Set Address Resolution Enable (0x08|0x002d) plen 1                            #95 6.704153
        Address resolution: Enabled (0x01)
> HCI Event: Command Complete (0x0e) plen 4                                                                          #96 6.705494
      LE Set Address Resolution Enable (0x08|0x002d) ncmd 1
        Status: Success (0x00)
zephyr.exe[1586347]: < HCI Command: Host Number of Completed Packets (0x03|0x0035) plen 5                            #97 6.723931
        Num handles: 1
        Handle: 90 Address: C0:07:E8:2C:B6:EE (OUI C0-07-E8)
        Count: 1
zephyr.exe[1586347]: < ACL Data TX: Handle 90 [1/3] flags 0x00 dlen 21                                               #98 6.725054
      SMP: Identity Information (0x08) len 16
        Identity resolving key[16]: 08aad2e1be87e47b88aeb19de6889efb
zephyr.exe[1586347]: < HCI Command: Host Number of Completed Packets (0x03|0x0035) plen 5                            #99 6.725631
        Num handles: 1
        Handle: 90 Address: C0:07:E8:2C:B6:EE (OUI C0-07-E8)
        Count: 1
zephyr.exe[1586347]: < ACL Data TX: Handle 90 [2/3] flags 0x00 dlen 12                                              #100 6.726137
      SMP: Identity Address Information (0x09) len 7
        Address: D5:B6:CC:31:DB:3B (Static)
zephyr.exe[1586347]: < ACL Data TX: Handle 90 [3/3] flags 0x00 dlen 13                                              #101 6.727111
      ATT: Find By Type Value Request (0x06) len 8
        Handle range: 0x016c-0xffff
        Attribute type: Primary Service (0x2800)
          UUID: Coordinated Set Identification (0x1846)
> HCI Event: Number of Completed Packets (0x13) plen 5                                                              #102 6.795973
        Num handles: 1
        Handle: 90 Address: C0:07:E8:2C:B6:EE (OUI C0-07-E8)
        Count: 1
        Buffers: 2/3
        #98: len 21 (2 Kb/s)
        Latency: 70 msec (12-70 msec ~50 msec)
> HCI Event: Number of Completed Packets (0x13) plen 5                                                              #103 6.796581
        Num handles: 1
        Handle: 90 Address: C0:07:E8:2C:B6:EE (OUI C0-07-E8)
        Count: 1
        Buffers: 1/3
        #100: len 12 (1 Kb/s)
        Latency: 70 msec (12-70 msec ~60 msec)
> HCI Event: Number of Completed Packets (0x13) plen 5                                                              #104 6.796987
        Num handles: 1
        Handle: 90 Address: C0:07:E8:2C:B6:EE (OUI C0-07-E8)
        Count: 1
        Buffers: 0/3
        #101: len 13 (1 Kb/s)
        Latency: 69 msec (12-70 msec ~65 msec)
zephyr.exe[1586347]: < ACL Data TX: Handle 90 [1/3] flags 0x00 dlen 21                                              #105 6.803870
      SMP: Signing Information (0x0a) len 16
        Signature key[16]: 1ec8845e8286bc235a02440d0c3424a2
> HCI Event: Number of Completed Packets (0x13) plen 5                                                              #106 6.866162
        Num handles: 1
        Handle: 90 Address: C0:07:E8:2C:B6:EE (OUI C0-07-E8)
        Count: 1
        Buffers: 0/3
        #105: len 21 (2 Kb/s)
        Latency: 62 msec (12-70 msec ~63 msec)
> ACL Data RX: Handle 90 flags 0x02 dlen 9                                                                          #107 6.866594
      ATT: Error Response (0x01) len 4
        Find By Type Value Request (0x06)
        Handle: 0x016c
        Error: Attribute Not Found (0x0a)
zephyr.exe[1586347]: < HCI Command: Host Number of Completed Packets (0x03|0x0035) plen 5                           #108 6.884471
        Num handles: 1
        Handle: 90 Address: C0:07:E8:2C:B6:EE (OUI C0-07-E8)
        Count: 1
zephyr.exe[1586347]: < ACL Data TX: Handle 90 [1/3] flags 0x00 dlen 11                                              #109 6.884623
      ATT: Read By Type Request (0x08) len 6
        Handle range: 0x0001-0xffff
        Attribute type: Central Address Resolution (0x2aa6)
> HCI Event: Number of Completed Packets (0x13) plen 5                                                              #110 6.935959
        Num handles: 1
        Handle: 90 Address: C0:07:E8:2C:B6:EE (OUI C0-07-E8)
        Count: 1
        Buffers: 0/3
        #109: len 11 (1 Kb/s)
        Latency: 51 msec (12-70 msec ~57 msec)
> ACL Data RX: Handle 90 flags 0x02 dlen 9                                                                          #111 7.008090
      ATT: Read By Type Response (0x09) len 4
        Attribute data length: 3
        Attribute data list: 1 entry
        Handle: 0x000f
        Value[1]: 01
zephyr.exe[1586347]: < HCI Command: Host Number of Completed Packets (0x03|0x0035) plen 5                           #112 7.023891
        Num handles: 1
        Handle: 90 Address: C0:07:E8:2C:B6:EE (OUI C0-07-E8)
        Count: 1
zephyr.exe[1586347]: < ACL Data TX: Handle 90 [1/3] flags 0x00 dlen 11                                              #113 7.024377
      ATT: Read By Type Request (0x08) len 6
        Handle range: 0x0160-0x016b
        Attribute type: Characteristic (0x2803)
> HCI Event: Number of Completed Packets (0x13) plen 5                                                              #114 7.075999
        Num handles: 1
        Handle: 90 Address: C0:07:E8:2C:B6:EE (OUI C0-07-E8)
        Count: 1
        Buffers: 0/3
        #113: len 11 (1 Kb/s)
        Latency: 51 msec (12-70 msec ~54 msec)
> ACL Data RX: Handle 90 flags 0x02 dlen 27                                                                         #115 7.146330
      ATT: Read By Type Response (0x09) len 22
        Attribute data length: 7
        Attribute data list: 3 entries
        Handle: 0x0161
        Value[5]: 126201842b
            Properties: 0x12
              Read (0x02)
              Notify (0x10)
            Value Handle: 0x0162
            Value UUID: Set Identity Resolving Key (0x2b84)
        Handle: 0x0164
        Value[5]: 1a6501862b
            Properties: 0x1a
              Read (0x02)
              Write (0x08)
              Notify (0x10)
            Value Handle: 0x0165
            Value UUID: Set Member Lock (0x2b86)
        Handle: 0x0167
        Value[5]: 126801852b
            Properties: 0x12
              Read (0x02)
              Notify (0x10)
            Value Handle: 0x0168
            Value UUID: Coordinated Set Size (0x2b85)
zephyr.exe[1586347]: < HCI Command: Host Number of Completed Packets (0x03|0x0035) plen 5                           #116 7.163933
        Num handles: 1
        Handle: 90 Address: C0:07:E8:2C:B6:EE (OUI C0-07-E8)
        Count: 1
zephyr.exe[1586347]: < ACL Data TX: Handle 90 [1/3] flags 0x00 dlen 9                                               #117 7.164085
      ATT: Find Information Request (0x04) len 4
        Handle range: 0x0162-0x016b
> HCI Event: Number of Completed Packets (0x13) plen 5                                                              #118 7.215979
        Num handles: 1
        Handle: 90 Address: C0:07:E8:2C:B6:EE (OUI C0-07-E8)
        Count: 1
        Buffers: 0/3
        #117: len 9 (1 Kb/s)
        Latency: 51 msec (12-70 msec ~53 msec)
> ACL Data RX: Handle 90 flags 0x02 dlen 26                                                                         #119 7.286447
      ATT: Find Information Response (0x05) len 21
        Format: UUID-16 (0x01)
        Handle: 0x0162
        UUID: Set Identity Resolving Key (0x2b84)
        Handle: 0x0163
        UUID: Client Characteristic Configuration (0x2902)
        Handle: 0x0164
        UUID: Characteristic (0x2803)
        Handle: 0x0165
        UUID: Set Member Lock (0x2b86)
        Handle: 0x0166
        UUID: Client Characteristic Configuration (0x2902)
zephyr.exe[1586347]: < HCI Command: Host Number of Completed Packets (0x03|0x0035) plen 5                           #120 7.304006
        Num handles: 1
        Handle: 90 Address: C0:07:E8:2C:B6:EE (OUI C0-07-E8)
        Count: 1
zephyr.exe[1586347]: < ACL Data TX: Handle 90 [1/3] flags 0x00 dlen 9                                               #121 7.304629
      ATT: Find Information Request (0x04) len 4
        Handle range: 0x0165-0x016b
> HCI Event: Number of Completed Packets (0x13) plen 5                                                              #122 7.355971
        Num handles: 1
        Handle: 90 Address: C0:07:E8:2C:B6:EE (OUI C0-07-E8)
        Count: 1
        Buffers: 0/3
        #121: len 9 (1 Kb/s)
        Latency: 51 msec (12-70 msec ~52 msec)
> ACL Data RX: Handle 90 flags 0x02 dlen 26                                                                         #123 7.426427
      ATT: Find Information Response (0x05) len 21
        Format: UUID-16 (0x01)
        Handle: 0x0165
        UUID: Set Member Lock (0x2b86)
        Handle: 0x0166
        UUID: Client Characteristic Configuration (0x2902)
        Handle: 0x0167
        UUID: Characteristic (0x2803)
        Handle: 0x0168
        UUID: Coordinated Set Size (0x2b85)
        Handle: 0x0169
        UUID: Client Characteristic Configuration (0x2902)
zephyr.exe[1586347]: < HCI Command: Host Number of Completed Packets (0x03|0x0035) plen 5                           #124 7.444025
        Num handles: 1
        Handle: 90 Address: C0:07:E8:2C:B6:EE (OUI C0-07-E8)
        Count: 1
zephyr.exe[1586347]: < ACL Data TX: Handle 90 [1/3] flags 0x00 dlen 9                                               #125 7.444577
      ATT: Find Information Request (0x04) len 4
        Handle range: 0x0168-0x016b
> HCI Event: Number of Completed Packets (0x13) plen 5                                                              #126 7.495980
        Num handles: 1
        Handle: 90 Address: C0:07:E8:2C:B6:EE (OUI C0-07-E8)
        Count: 1
        Buffers: 0/3
        #125: len 9 (1 Kb/s)
        Latency: 51 msec (12-70 msec ~51 msec)
> ACL Data RX: Handle 90 flags 0x02 dlen 22                                                                         #127 7.566356
      ATT: Find Information Response (0x05) len 17
        Format: UUID-16 (0x01)
        Handle: 0x0168
        UUID: Coordinated Set Size (0x2b85)
        Handle: 0x0169
        UUID: Client Characteristic Configuration (0x2902)
        Handle: 0x016a
        UUID: Characteristic (0x2803)
        Handle: 0x016b
        UUID: Set Member Rank (0x2b87)
zephyr.exe[1586347]: < HCI Command: Host Number of Completed Packets (0x03|0x0035) plen 5                           #128 7.584046
        Num handles: 1
        Handle: 90 Address: C0:07:E8:2C:B6:EE (OUI C0-07-E8)
        Count: 1
zephyr.exe[1586347]: < ACL Data TX: Handle 90 [1/3] flags 0x00 dlen 11                                              #129 7.584504
      ATT: Read By Type Request (0x08) len 6
        Handle range: 0x0168-0x016b
        Attribute type: Characteristic (0x2803)
> HCI Event: Number of Completed Packets (0x13) plen 5                                                              #130 7.635988
        Num handles: 1
        Handle: 90 Address: C0:07:E8:2C:B6:EE (OUI C0-07-E8)
        Count: 1
        Buffers: 0/3
        #129: len 11 (1 Kb/s)
        Latency: 51 msec (12-70 msec ~51 msec)
> ACL Data RX: Handle 90 flags 0x02 dlen 13                                                                         #131 7.706103
      ATT: Read By Type Response (0x09) len 8
        Attribute data length: 7
        Attribute data list: 1 entry
        Handle: 0x016a
        Value[5]: 026b01872b
            Properties: 0x02
              Read (0x02)
            Value Handle: 0x016b
            Value UUID: Set Member Rank (0x2b87)
zephyr.exe[1586347]: < HCI Command: Host Number of Completed Packets (0x03|0x0035) plen 5                           #132 7.724041
        Num handles: 1
        Handle: 90 Address: C0:07:E8:2C:B6:EE (OUI C0-07-E8)
        Count: 1
zephyr.exe[1586347]: < ACL Data TX: Handle 90 [1/3] flags 0x00 dlen 9                                               #133 7.724254
      ATT: Write Request (0x12) len 4
        Handle: 0x0163
          Data[2]: 0100
> HCI Event: Number of Completed Packets (0x13) plen 5                                                              #134 7.775977
        Num handles: 1
        Handle: 90 Address: C0:07:E8:2C:B6:EE (OUI C0-07-E8)
        Count: 1
        Buffers: 0/3
        #133: len 9 (1 Kb/s)
        Latency: 51 msec (12-70 msec ~51 msec)
> ACL Data RX: Handle 90 flags 0x02 dlen 5                                                                          #135 7.846097
      ATT: Write Response (0x13) len 0
zephyr.exe[1586347]: < HCI Command: Host Number of Completed Packets (0x03|0x0035) plen 5                           #136 7.864102
        Num handles: 1
        Handle: 90 Address: C0:07:E8:2C:B6:EE (OUI C0-07-E8)
        Count: 1
zephyr.exe[1586347]: < ACL Data TX: Handle 90 [1/3] flags 0x00 dlen 9                                               #137 7.864649
      ATT: Write Request (0x12) len 4
        Handle: 0x0166
          Data[2]: 0100
> HCI Event: Number of Completed Packets (0x13) plen 5                                                              #138 7.915952
        Num handles: 1
        Handle: 90 Address: C0:07:E8:2C:B6:EE (OUI C0-07-E8)
        Count: 1
        Buffers: 0/3
        #137: len 9 (1 Kb/s)
        Latency: 51 msec (12-70 msec ~51 msec)
> ACL Data RX: Handle 90 flags 0x02 dlen 5                                                                          #139 7.986010
      ATT: Write Response (0x13) len 0
zephyr.exe[1586347]: < HCI Command: Host Number of Completed Packets (0x03|0x0035) plen 5                           #140 8.004047
        Num handles: 1
        Handle: 90 Address: C0:07:E8:2C:B6:EE (OUI C0-07-E8)
        Count: 1
zephyr.exe[1586347]: < ACL Data TX: Handle 90 [1/3] flags 0x00 dlen 9                                               #141 8.004336
      ATT: Write Request (0x12) len 4
        Handle: 0x0169
          Data[2]: 0100
> HCI Event: Number of Completed Packets (0x13) plen 5                                                              #142 8.055992
        Num handles: 1
        Handle: 90 Address: C0:07:E8:2C:B6:EE (OUI C0-07-E8)
        Count: 1
        Buffers: 0/3
        #141: len 9 (1 Kb/s)
        Latency: 51 msec (12-70 msec ~51 msec)
> ACL Data RX: Handle 90 flags 0x02 dlen 5                                                                          #143 8.126021
      ATT: Write Response (0x13) len 0
zephyr.exe[1586347]: < HCI Command: Host Number of Completed Packets (0x03|0x0035) plen 5                           #144 8.144200
        Num handles: 1
        Handle: 90 Address: C0:07:E8:2C:B6:EE (OUI C0-07-E8)
        Count: 1
zephyr.exe[1586347]: < ACL Data TX: Handle 90 [1/3] flags 0x00 dlen 11                                              #145 8.144610
      ATT: Read By Type Request (0x08) len 6
        Handle range: 0x016b-0x016b
        Attribute type: Characteristic (0x2803)
> HCI Event: Number of Completed Packets (0x13) plen 5                                                              #146 8.196014
        Num handles: 1
        Handle: 90 Address: C0:07:E8:2C:B6:EE (OUI C0-07-E8)
        Count: 1
        Buffers: 0/3
        #145: len 11 (1 Kb/s)
        Latency: 51 msec (12-70 msec ~51 msec)
> ACL Data RX: Handle 90 flags 0x02 dlen 9                                                                          #147 8.266031
      ATT: Error Response (0x01) len 4
        Read By Type Request (0x08)
        Handle: 0x016b
        Error: Attribute Not Found (0x0a)
zephyr.exe[1586347]: < HCI Command: Host Number of Completed Packets (0x03|0x0035) plen 5                           #148 8.284155
        Num handles: 1
        Handle: 90 Address: C0:07:E8:2C:B6:EE (OUI C0-07-E8)
        Count: 1
zephyr.exe[1586347]: < ACL Data TX: Handle 90 [1/3] flags 0x00 dlen 7                                               #149 8.284573
      ATT: Read Request (0x0a) len 2
        Handle: 0x0162
> HCI Event: Number of Completed Packets (0x13) plen 5                                                              #150 8.335962
        Num handles: 1
        Handle: 90 Address: C0:07:E8:2C:B6:EE (OUI C0-07-E8)
        Count: 1
        Buffers: 0/3
        #149: len 7 (1 Kb/s)
        Latency: 51 msec (12-70 msec ~51 msec)
> ACL Data RX: Handle 90 flags 0x02 dlen 22                                                                         #151 8.406340
      ATT: Read Response (0x0b) len 17
        Value[17]: 01b803eac6afbb65a25a41f15305688e83
zephyr.exe[1586347]: < HCI Command: Host Number of Completed Packets (0x03|0x0035) plen 5                           #152 8.424051
        Num handles: 1
        Handle: 90 Address: C0:07:E8:2C:B6:EE (OUI C0-07-E8)
        Count: 1
zephyr.exe[1586347]: < ACL Data TX: Handle 90 [1/3] flags 0x00 dlen 7                                               #153 8.424294
      ATT: Read Request (0x0a) len 2
        Handle: 0x0168
> HCI Event: Number of Completed Packets (0x13) plen 5                                                              #154 8.475996
        Num handles: 1
        Handle: 90 Address: C0:07:E8:2C:B6:EE (OUI C0-07-E8)
        Count: 1
        Buffers: 0/3
        #153: len 7 (1 Kb/s)
        Latency: 51 msec (12-70 msec ~51 msec)
> ACL Data RX: Handle 90 flags 0x02 dlen 6                                                                          #155 8.545982
      ATT: Read Response (0x0b) len 1
        Value[1]: 02
zephyr.exe[1586347]: < HCI Command: Host Number of Completed Packets (0x03|0x0035) plen 5                           #156 8.564061
        Num handles: 1
        Handle: 90 Address: C0:07:E8:2C:B6:EE (OUI C0-07-E8)
        Count: 1
zephyr.exe[1586347]: < ACL Data TX: Handle 90 [1/3] flags 0x00 dlen 7                                               #157 8.564228
      ATT: Read Request (0x0a) len 2
        Handle: 0x016b
> HCI Event: Number of Completed Packets (0x13) plen 5                                                              #158 8.615972
        Num handles: 1
        Handle: 90 Address: C0:07:E8:2C:B6:EE (OUI C0-07-E8)
        Count: 1
        Buffers: 0/3
        #157: len 7 (1 Kb/s)
        Latency: 51 msec (12-70 msec ~51 msec)
> ACL Data RX: Handle 90 flags 0x02 dlen 6                                                                          #159 8.685998
      ATT: Read Response (0x0b) len 1
        Value[1]: 01
zephyr.exe[1586347]: < HCI Command: Host Number of Completed Packets (0x03|0x0035) plen 5                           #160 8.704195
        Num handles: 1
        Handle: 90 Address: C0:07:E8:2C:B6:EE (OUI C0-07-E8)
        Count: 1
zephyr.exe[1586347]: < ACL Data TX: Handle 90 [1/3] flags 0x00 dlen 8                                              #161 10.114067
      ATT: Write Request (0x12) len 3
        Handle: 0x0165
          Data[1]: 01
> HCI Event: Number of Completed Packets (0x13) plen 5                                                             #162 10.155937
        Num handles: 1
        Handle: 90 Address: C0:07:E8:2C:B6:EE (OUI C0-07-E8)
        Count: 1
        Buffers: 0/3
        #161: len 8 (1 Kb/s)
        Latency: 41 msec (12-70 msec ~46 msec)
> ACL Data RX: Handle 90 flags 0x02 dlen 9                                                                         #163 10.226009
      ATT: Error Response (0x01) len 4
        Write Request (0x12)
        Handle: 0x0165
        Error: Reserved (0x82)
zephyr.exe[1586347]: < HCI Command: Host Number of Completed Packets (0x03|0x0035) plen 5                          #164 10.244271
        Num handles: 1
        Handle: 90 Address: C0:07:E8:2C:B6:EE (OUI C0-07-E8)
        Count: 1
zephyr.exe[1586347]: < ACL Data TX: Handle 90 [1/3] flags 0x00 dlen 13                                             #165 11.634081
      ATT: Find By Type Value Request (0x06) len 8
        Handle range: 0x0001-0xffff
        Attribute type: Primary Service (0x2800)
          UUID: Coordinated Set Identification (0x1846)
> HCI Event: Number of Completed Packets (0x13) plen 5                                                             #166 11.695930
        Num handles: 1
        Handle: 90 Address: C0:07:E8:2C:B6:EE (OUI C0-07-E8)
        Count: 1
        Buffers: 0/3
        #165: len 13 (1 Kb/s)
        Latency: 61 msec (12-70 msec ~54 msec)
> ACL Data RX: Handle 90 flags 0x02 dlen 9                                                                         #167 11.765978
      ATT: Find By Type Value Response (0x07) len 4
        Handle range: 0x0160-0x016b
zephyr.exe[1586347]: < HCI Command: Host Number of Completed Packets (0x03|0x0035) plen 5                          #168 11.784230
        Num handles: 1
        Handle: 90 Address: C0:07:E8:2C:B6:EE (OUI C0-07-E8)
        Count: 1
zephyr.exe[1586347]: < ACL Data TX: Handle 90 [1/3] flags 0x00 dlen 13                                             #169 11.784674
      ATT: Find By Type Value Request (0x06) len 8
        Handle range: 0x016c-0xffff
        Attribute type: Primary Service (0x2800)
          UUID: Coordinated Set Identification (0x1846)
> HCI Event: Number of Completed Packets (0x13) plen 5                                                             #170 11.835802
        Num handles: 1
        Handle: 90 Address: C0:07:E8:2C:B6:EE (OUI C0-07-E8)
        Count: 1
        Buffers: 0/3
        #169: len 13 (2 Kb/s)
        Latency: 51 msec (12-70 msec ~52 msec)
> ACL Data RX: Handle 90 flags 0x02 dlen 9                                                                         #171 11.905969
      ATT: Error Response (0x01) len 4
        Find By Type Value Request (0x06)
        Handle: 0x016c
        Error: Attribute Not Found (0x0a)
zephyr.exe[1586347]: < HCI Command: Host Number of Completed Packets (0x03|0x0035) plen 5                          #172 11.924194
        Num handles: 1
        Handle: 90 Address: C0:07:E8:2C:B6:EE (OUI C0-07-E8)
        Count: 1
zephyr.exe[1586347]: < ACL Data TX: Handle 90 [1/3] flags 0x00 dlen 11                                             #173 11.924798
      ATT: Read By Type Request (0x08) len 6
        Handle range: 0x0160-0x016b
        Attribute type: Characteristic (0x2803)
> HCI Event: Number of Completed Packets (0x13) plen 5                                                             #174 11.975901
        Num handles: 1
        Handle: 90 Address: C0:07:E8:2C:B6:EE (OUI C0-07-E8)
        Count: 1
        Buffers: 0/3
        #173: len 11 (1 Kb/s)
        Latency: 51 msec (12-70 msec ~51 msec)
> ACL Data RX: Handle 90 flags 0x02 dlen 27                                                                        #175 12.046194
      ATT: Read By Type Response (0x09) len 22
        Attribute data length: 7
        Attribute data list: 3 entries
        Handle: 0x0161
        Value[5]: 126201842b
            Properties: 0x12
              Read (0x02)
              Notify (0x10)
            Value Handle: 0x0162
            Value UUID: Set Identity Resolving Key (0x2b84)
        Handle: 0x0164
        Value[5]: 1a6501862b
            Properties: 0x1a
              Read (0x02)
              Write (0x08)
              Notify (0x10)
            Value Handle: 0x0165
            Value UUID: Set Member Lock (0x2b86)
        Handle: 0x0167
        Value[5]: 126801852b
            Properties: 0x12
              Read (0x02)
              Notify (0x10)
            Value Handle: 0x0168
            Value UUID: Coordinated Set Size (0x2b85)
zephyr.exe[1586347]: < HCI Command: Host Number of Completed Packets (0x03|0x0035) plen 5                          #176 12.064235
        Num handles: 1
        Handle: 90 Address: C0:07:E8:2C:B6:EE (OUI C0-07-E8)
        Count: 1
zephyr.exe[1586347]: < ACL Data TX: Handle 90 [1/3] flags 0x00 dlen 11                                             #177 12.064799
      ATT: Read By Type Request (0x08) len 6
        Handle range: 0x0168-0x016b
        Attribute type: Characteristic (0x2803)
> HCI Event: Number of Completed Packets (0x13) plen 5                                                             #178 12.115852
        Num handles: 1
        Handle: 90 Address: C0:07:E8:2C:B6:EE (OUI C0-07-E8)
        Count: 1
        Buffers: 0/3
        #177: len 11 (1 Kb/s)
        Latency: 51 msec (12-70 msec ~51 msec)
> ACL Data RX: Handle 90 flags 0x02 dlen 13                                                                        #179 12.185965
      ATT: Read By Type Response (0x09) len 8
        Attribute data length: 7
        Attribute data list: 1 entry
        Handle: 0x016a
        Value[5]: 026b01872b
            Properties: 0x02
              Read (0x02)
            Value Handle: 0x016b
            Value UUID: Set Member Rank (0x2b87)
zephyr.exe[1586347]: < HCI Command: Host Number of Completed Packets (0x03|0x0035) plen 5                          #180 12.204199
        Num handles: 1
        Handle: 90 Address: C0:07:E8:2C:B6:EE (OUI C0-07-E8)
        Count: 1
zephyr.exe[1586347]: < ACL Data TX: Handle 90 [1/3] flags 0x00 dlen 11                                             #181 12.204425
      ATT: Read By Type Request (0x08) len 6
        Handle range: 0x016b-0x016b
        Attribute type: Characteristic (0x2803)
> HCI Event: Number of Completed Packets (0x13) plen 5                                                             #182 12.255861
        Num handles: 1
        Handle: 90 Address: C0:07:E8:2C:B6:EE (OUI C0-07-E8)
        Count: 1
        Buffers: 0/3
        #181: len 11 (1 Kb/s)
        Latency: 51 msec (12-70 msec ~51 msec)
> ACL Data RX: Handle 90 flags 0x02 dlen 9                                                                         #183 12.325931
      ATT: Error Response (0x01) len 4
        Read By Type Request (0x08)
        Handle: 0x016b
        Error: Attribute Not Found (0x0a)
zephyr.exe[1586347]: < HCI Command: Host Number of Completed Packets (0x03|0x0035) plen 5                          #184 12.344197
        Num handles: 1
        Handle: 90 Address: C0:07:E8:2C:B6:EE (OUI C0-07-E8)
        Count: 1
zephyr.exe[1586347]: < ACL Data TX: Handle 90 [1/3] flags 0x00 dlen 7                                              #185 12.344607
      ATT: Read Request (0x0a) len 2
        Handle: 0x0162
> HCI Event: Number of Completed Packets (0x13) plen 5                                                             #186 12.395763
        Num handles: 1
        Handle: 90 Address: C0:07:E8:2C:B6:EE (OUI C0-07-E8)
        Count: 1
        Buffers: 0/3
        #185: len 7 (1 Kb/s)
        Latency: 51 msec (12-70 msec ~51 msec)
> ACL Data RX: Handle 90 flags 0x02 dlen 22                                                                        #187 12.466070
      ATT: Read Response (0x0b) len 17
        Value[17]: 01b803eac6afbb65a25a41f15305688e83
zephyr.exe[1586347]: < HCI Command: Host Number of Completed Packets (0x03|0x0035) plen 5                          #188 12.484193
        Num handles: 1
        Handle: 90 Address: C0:07:E8:2C:B6:EE (OUI C0-07-E8)
        Count: 1
zephyr.exe[1586347]: < ACL Data TX: Handle 90 [1/3] flags 0x00 dlen 7                                              #189 12.484627
      ATT: Read Request (0x0a) len 2
        Handle: 0x0168
> HCI Event: Number of Completed Packets (0x13) plen 5                                                             #190 12.535901
        Num handles: 1
        Handle: 90 Address: C0:07:E8:2C:B6:EE (OUI C0-07-E8)
        Count: 1
        Buffers: 0/3
        #189: len 7 (1 Kb/s)
        Latency: 51 msec (12-70 msec ~51 msec)
> ACL Data RX: Handle 90 flags 0x02 dlen 6                                                                         #191 12.605869
      ATT: Read Response (0x0b) len 1
        Value[1]: 02
zephyr.exe[1586347]: < HCI Command: Host Number of Completed Packets (0x03|0x0035) plen 5                          #192 12.624252
        Num handles: 1
        Handle: 90 Address: C0:07:E8:2C:B6:EE (OUI C0-07-E8)
        Count: 1
zephyr.exe[1586347]: < ACL Data TX: Handle 90 [1/3] flags 0x00 dlen 7                                              #193 12.624905
      ATT: Read Request (0x0a) len 2
        Handle: 0x016b
> HCI Event: Number of Completed Packets (0x13) plen 5                                                             #194 12.675859
        Num handles: 1
        Handle: 90 Address: C0:07:E8:2C:B6:EE (OUI C0-07-E8)
        Count: 1
        Buffers: 0/3
        #193: len 7 (1 Kb/s)
        Latency: 50 msec (12-70 msec ~51 msec)
> ACL Data RX: Handle 90 flags 0x02 dlen 6                                                                         #195 12.745859
      ATT: Read Response (0x0b) len 1
        Value[1]: 01
zephyr.exe[1586347]: < HCI Command: Host Number of Completed Packets (0x03|0x0035) plen 5                          #196 12.764262
        Num handles: 1
        Handle: 90 Address: C0:07:E8:2C:B6:EE (OUI C0-07-E8)
        Count: 1
zephyr.exe[1586347]: < ACL Data TX: Handle 90 [1/3] flags 0x00 dlen 8                                              #197 14.144089
      ATT: Write Request (0x12) len 3
        Handle: 0x0165
          Data[1]: 01
> HCI Event: Number of Completed Packets (0x13) plen 5                                                             #198 14.215771
        Num handles: 1
        Handle: 90 Address: C0:07:E8:2C:B6:EE (OUI C0-07-E8)
        Count: 1
        Buffers: 0/3
        #197: len 8 (0 Kb/s)
        Latency: 71 msec (12-71 msec ~61 msec)
> ACL Data RX: Handle 90 flags 0x02 dlen 9                                                                         #199 14.285807
      ATT: Error Response (0x01) len 4
        Write Request (0x12)
        Handle: 0x0165
        Error: Reserved (0x84)
zephyr.exe[1586347]: < HCI Command: Host Number of Completed Packets (0x03|0x0035) plen 5                          #200 14.304228
        Num handles: 1
        Handle: 90 Address: C0:07:E8:2C:B6:EE (OUI C0-07-E8)
        Count: 1
zephyr.exe[1586347]: < ACL Data TX: Handle 90 [1/3] flags 0x00 dlen 13                                             #201 15.665051
      ATT: Find By Type Value Request (0x06) len 8
        Handle range: 0x0001-0xffff
        Attribute type: Primary Service (0x2800)
          UUID: Coordinated Set Identification (0x1846)
> HCI Event: Number of Completed Packets (0x13) plen 5                                                             #202 15.685725
        Num handles: 1
        Handle: 90 Address: C0:07:E8:2C:B6:EE (OUI C0-07-E8)
        Count: 1
        Buffers: 0/3
        #201: len 13 (5 Kb/s)
        Latency: 20 msec (12-71 msec ~41 msec)
> ACL Data RX: Handle 90 flags 0x02 dlen 9                                                                         #203 15.755813
      ATT: Find By Type Value Response (0x07) len 4
        Handle range: 0x0160-0x016b
zephyr.exe[1586347]: < HCI Command: Host Number of Completed Packets (0x03|0x0035) plen 5                          #204 15.764270
        Num handles: 1
        Handle: 90 Address: C0:07:E8:2C:B6:EE (OUI C0-07-E8)
        Count: 1
zephyr.exe[1586347]: < ACL Data TX: Handle 90 [1/3] flags 0x00 dlen 13                                             #205 15.764800
      ATT: Find By Type Value Request (0x06) len 8
        Handle range: 0x016c-0xffff
        Attribute type: Primary Service (0x2800)
          UUID: Coordinated Set Identification (0x1846)
> HCI Event: Number of Completed Packets (0x13) plen 5                                                             #206 15.825669
        Num handles: 1
        Handle: 90 Address: C0:07:E8:2C:B6:EE (OUI C0-07-E8)
        Count: 1
        Buffers: 0/3
        #205: len 13 (1 Kb/s)
        Latency: 60 msec (12-71 msec ~50 msec)
> ACL Data RX: Handle 90 flags 0x02 dlen 9                                                                         #207 15.895766
      ATT: Error Response (0x01) len 4
        Find By Type Value Request (0x06)
        Handle: 0x016c
        Error: Attribute Not Found (0x0a)
zephyr.exe[1586347]: < HCI Command: Host Number of Completed Packets (0x03|0x0035) plen 5                          #208 15.904279
        Num handles: 1
        Handle: 90 Address: C0:07:E8:2C:B6:EE (OUI C0-07-E8)
        Count: 1
zephyr.exe[1586347]: < ACL Data TX: Handle 90 [1/3] flags 0x00 dlen 11                                             #209 15.904561
      ATT: Read By Type Request (0x08) len 6
        Handle range: 0x0160-0x016b
        Attribute type: Characteristic (0x2803)
> HCI Event: Number of Completed Packets (0x13) plen 5                                                             #210 15.965670
        Num handles: 1
        Handle: 90 Address: C0:07:E8:2C:B6:EE (OUI C0-07-E8)
        Count: 1
        Buffers: 0/3
        #209: len 11 (1 Kb/s)
        Latency: 61 msec (12-71 msec ~56 msec)
> ACL Data RX: Handle 90 flags 0x02 dlen 27                                                                        #211 16.036034
      ATT: Read By Type Response (0x09) len 22
        Attribute data length: 7
        Attribute data list: 3 entries
        Handle: 0x0161
        Value[5]: 126201842b
            Properties: 0x12
              Read (0x02)
              Notify (0x10)
            Value Handle: 0x0162
            Value UUID: Set Identity Resolving Key (0x2b84)
        Handle: 0x0164
        Value[5]: 1a6501862b
            Properties: 0x1a
              Read (0x02)
              Write (0x08)
              Notify (0x10)
            Value Handle: 0x0165
            Value UUID: Set Member Lock (0x2b86)
        Handle: 0x0167
        Value[5]: 126801852b
