Bluetooth monitor ver 5.72
= Note: Linux version 6.14.0-36-generic (x86_64)                       0.729466
= Note: Bluetooth subsystem version 2.22                               0.729468
= New Index: 00:00:00:00:00:00 (Primary,UART,hci1)              [hci1] 0.729470
= New Index: 48:5F:99:8E:E0:64 (Primary,USB,hci0)               [hci0] 0.729470
= Open Index: 00:00:00:00:00:00                                 [hci1] 0.842687
= Index Info: 00:00:00:00:00:00 (Nordic Semiconductor ASA)      [hci1] 0.842692
@ USER Open: main (privileged) version 2.22            {0x0001} [hci1] 0.842696
< HCI Command: Reset (0x03|0x0003) plen 0                    #1 [hci1] 0.843119
> HCI Event: Command Complete (0x0e) plen 4                  #2 [hci1] 0.843623
      Reset (0x03|0x0003) ncmd 1
        Status: Success (0x00)
< HCI Command: Read Local Supported... (0x04|0x0003) plen 0  #3 [hci1] 0.862594
> HCI Event: Command Complete (0x0e) plen 12                 #4 [hci1] 0.863044
      Read Local Supported Features (0x04|0x0003) ncmd 1
        Status: Success (0x00)
        Features: 0x00 0x00 0x00 0x00 0x60 0x00 0x00 0x00
          BR/EDR Not Supported
          LE Supported (Controller)
< HCI Command: Read Local Version In.. (0x04|0x0001) plen 0  #5 [hci1] 0.882606
> HCI Event: Command Complete (0x0e) plen 12                 #6 [hci1] 0.883059
      Read Local Version Information (0x04|0x0001) ncmd 1
        Status: Success (0x00)
        HCI version: Reserved (0x0f) - Revision 12393 (0x3069)
        LMP version: Reserved (0x0f) - Subversion 12393 (0x3069)
        Manufacturer: Nordic Semiconductor ASA (89)
< HCI Command: Read Local Supported... (0x04|0x0002) plen 0  #7 [hci1] 0.902584
> HCI Event: Command Complete (0x0e) plen 68                 #8 [hci1] 0.903681
      Read Local Supported Commands (0x04|0x0002) ncmd 1
        Status: Success (0x00)
        Commands: 119 entries
          Disconnect (Octet 0 - Bit 5)
          Read Remote Version Information (Octet 2 - Bit 7)
          Set Event Mask (Octet 5 - Bit 6)
          Reset (Octet 5 - Bit 7)
          Read Connection Accept Timeout (Octet 7 - Bit 2)
          Write Connection Accept Timeout (Octet 7 - Bit 3)
          Read Transmit Power Level (Octet 10 - Bit 2)
          Set Controller To Host Flow Control (Octet 10 - Bit 5)
          Host Buffer Size (Octet 10 - Bit 6)
          Host Number of Completed Packets (Octet 10 - Bit 7)
          Read Local Version Information (Octet 14 - Bit 3)
          Read Local Supported Features (Octet 14 - Bit 5)
          Read BD ADDR (Octet 15 - Bit 1)
          Read RSSI (Octet 15 - Bit 5)
          Set Event Mask Page 2 (Octet 22 - Bit 2)
          LE Set Event Mask (Octet 25 - Bit 0)
          LE Read Buffer Size (Octet 25 - Bit 1)
          LE Read Local Supported Features (Octet 25 - Bit 2)
          LE Set Random Address (Octet 25 - Bit 4)
          LE Set Advertising Parameters (Octet 25 - Bit 5)
          LE Read Advertising Channel TX Power (Octet 25 - Bit 6)
          LE Set Advertising Data (Octet 25 - Bit 7)
          LE Set Scan Response Data (Octet 26 - Bit 0)
          LE Set Advertise Enable (Octet 26 - Bit 1)
          LE Set Scan Parameters (Octet 26 - Bit 2)
          LE Set Scan Enable (Octet 26 - Bit 3)
          LE Create Connection (Octet 26 - Bit 4)
          LE Create Connection Cancel (Octet 26 - Bit 5)
          LE Read Accept List Size (Octet 26 - Bit 6)
          LE Clear Accept List (Octet 26 - Bit 7)
          LE Add Device To Accept List (Octet 27 - Bit 0)
          LE Remove Device From Accept List (Octet 27 - Bit 1)
          LE Connection Update (Octet 27 - Bit 2)
          LE Set Host Channel Classification (Octet 27 - Bit 3)
          LE Read Channel Map (Octet 27 - Bit 4)
          LE Read Remote Used Features (Octet 27 - Bit 5)
          LE Encrypt (Octet 27 - Bit 6)
          LE Rand (Octet 27 - Bit 7)
          LE Start Encryption (Octet 28 - Bit 0)
          LE Long Term Key Request Reply (Octet 28 - Bit 1)
          LE Long Term Key Request Neg Reply (Octet 28 - Bit 2)
          LE Read Supported States (Octet 28 - Bit 3)
          LE Receiver Test (Octet 28 - Bit 4)
          LE Transmitter Test (Octet 28 - Bit 5)
          LE Test End (Octet 28 - Bit 6)
          Read Authenticated Payload Timeout (Octet 32 - Bit 4)
          Write Authenticated Payload Timeout (Octet 32 - Bit 5)
          LE Set Data Length (Octet 33 - Bit 6)
          LE Read Suggested Default Data Length (Octet 33 - Bit 7)
          LE Write Suggested Default Data Length (Octet 34 - Bit 0)
          LE Add Device To Resolving List (Octet 34 - Bit 3)
          LE Remove Device From Resolving List (Octet 34 - Bit 4)
          LE Clear Resolving List (Octet 34 - Bit 5)
          LE Read Resolving List Size (Octet 34 - Bit 6)
          LE Set Address Resolution Enable (Octet 35 - Bit 1)
          LE Set Resolvable Private Address Timeout (Octet 35 - Bit 2)
          LE Read Maximum Data Length (Octet 35 - Bit 3)
          LE Read PHY (Octet 35 - Bit 4)
          LE Set Default PHY (Octet 35 - Bit 5)
          LE Set PHY (Octet 35 - Bit 6)
          LE Enhanced Receiver Test (Octet 35 - Bit 7)
          LE Enhanced Transmitter Test (Octet 36 - Bit 0)
          LE Set Advertising Set Random Address (Octet 36 - Bit 1)
          LE Set Extended Advertising Parameters (Octet 36 - Bit 2)
          LE Set Extended Advertising Data (Octet 36 - Bit 3)
          LE Set Extended Scan Response Data (Octet 36 - Bit 4)
          LE Set Extended Advertising Enable (Octet 36 - Bit 5)
          LE Read Maximum Advertising Data Length (Octet 36 - Bit 6)
          LE Read Number of Supported Advertising Sets (Octet 36 - Bit 7)
          LE Remove Advertising Set (Octet 37 - Bit 0)
          LE Clear Advertising Sets (Octet 37 - Bit 1)
          LE Set Periodic Advertising Parameters (Octet 37 - Bit 2)
          LE Set Periodic Advertising Data (Octet 37 - Bit 3)
          LE Set Periodic Advertising Enable (Octet 37 - Bit 4)
          LE Set Extended Scan Parameters (Octet 37 - Bit 5)
          LE Set Extended Scan Enable (Octet 37 - Bit 6)
          LE Extended Create Connection (Octet 37 - Bit 7)
          LE Periodic Advertising Create Sync (Octet 38 - Bit 0)
          LE Periodic Advertising Create Sync Cancel (Octet 38 - Bit 1)
          LE Periodic Advertising Terminate Sync (Octet 38 - Bit 2)
          LE Add Device To Periodic Advertiser List (Octet 38 - Bit 3)
          LE Remove Device From Periodic Advertiser List (Octet 38 - Bit 4)
          LE Clear Periodic Advertiser List (Octet 38 - Bit 5)
          LE Read Periodic Advertiser List Size (Octet 38 - Bit 6)
          LE Read Transmit Power (Octet 38 - Bit 7)
          LE Read RF Path Compensation (Octet 39 - Bit 0)
          LE Write RF Path Compensation (Octet 39 - Bit 1)
          LE Set Privacy Mode (Octet 39 - Bit 2)
          LE Periodic Advertising Receive Enable (Octet 40 - Bit 5)
          LE Periodic Advertising Sync Transfer (Octet 40 - Bit 6)
          LE Periodic Advertising Set Info Transfer (Octet 40 - Bit 7)
          LE Periodic Advertising Sync Transfer Parameters (Octet 41 - Bit 0)
          LE Set Default Periodic Advertisng Sync Transfer Parameters (Octet 41 - Bit 1)
          LE Read Buffer v2 (Octet 41 - Bit 5)
          LE Read ISO TX Sync (Octet 41 - Bit 6)
          LE Set Connected Isochronous Group Parameters (Octet 41 - Bit 7)
          LE Set Connected Isochronous Group Parameters Test (Octet 42 - Bit 0)
          LE Create Connected Isochronous Stream (Octet 42 - Bit 1)
          LE Remove Connected Isochronous Group (Octet 42 - Bit 2)
          LE Accept Connected Isochronous Stream Request (Octet 42 - Bit 3)
          LE Reject Connected Isochronous Stream Request (Octet 42 - Bit 4)
          LE Create Broadcast Isochronous Group (Octet 42 - Bit 5)
          LE Create Broadcast Isochronous Group Test (Octet 42 - Bit 6)
          LE Terminate Broadcast Isochronous Group (Octet 42 - Bit 7)
          LE Broadcast Isochronous Group Create Sync (Octet 43 - Bit 0)
          LE Broadcast Isochronous Group Terminate Sync (Octet 43 - Bit 1)
          LE Request Peer SCA (Octet 43 - Bit 2)
          LE Setup Isochronous Data Path (Octet 43 - Bit 3)
          LE Remove Isochronous Data Path (Octet 43 - Bit 4)
          LE Isochronous Transmit Test (Octet 43 - Bit 5)
          LE Isochronous Receive Test (Octet 43 - Bit 6)
          LE Isochronous Read Test Counters (Octet 43 - Bit 7)
          LE Isochronous Read Test Counters (Octet 44 - Bit 0)
          LE Set Host Feature (Octet 44 - Bit 1)
          Octet 44 - Bit 2 
          Octet 45 - Bit 6 
          Octet 46 - Bit 0 
          Octet 46 - Bit 1 
          Octet 46 - Bit 2 
< HCI Command: Host Buffer Size (0x03|0x0033) plen 7         #9 [hci1] 0.922573
        ACL MTU: 255  ACL max packet: 16
        SCO MTU: 0    SCO max packet: 0
> HCI Event: Command Complete (0x0e) plen 4                 #10 [hci1] 0.923071
      Host Buffer Size (0x03|0x0033) ncmd 1
        Status: Success (0x00)
< HCI Command: Set Controller To Ho.. (0x03|0x0031) plen 1  #11 [hci1] 0.942596
        Flow control: ACL Data Packets (0x01)
> HCI Event: Command Complete (0x0e) plen 4                 #12 [hci1] 0.943101
      Set Controller To Host Flow Control (0x03|0x0031) ncmd 1
        Status: Success (0x00)
< HCI Command: LE Read Local Suppor.. (0x08|0x0003) plen 0  #13 [hci1] 0.962596
> HCI Event: Command Complete (0x0e) plen 12                #14 [hci1] 0.963048
      LE Read Local Supported Features (0x08|0x0003) ncmd 1
        Status: Success (0x00)
        Features: 0xfd 0x79 0x00 0xf7 0x30 0x01 0x00 0x00
          LE Encryption
          Extended Reject Indication
          Peripheral-initiated Features Exchange
          LE Ping
          LE Data Packet Length Extension
          LL Privacy
          Extended Scanner Filter Policies
          LE 2M PHY
          LE Coded PHY
          LE Extended Advertising
          LE Periodic Advertising
          Channel Selection Algorithm #2
          Periodic Advertising Sync Transfer - Sender
          Periodic Advertising Sync Transfer - Recipient
          Sleep Clock Accuracy Updates
          Connected Isochronous Stream - Central
          Connected Isochronous Stream - Peripheral
          Isochronous Broadcaster
          Synchronized Receiver
          Periodic Advertising ADI support
          Connection Subrating
          Unknown features (0x0000010000000000)
< HCI Command: LE Set Host Feature (0x08|0x0074) plen 2     #15 [hci1] 0.982562
        Bit Number: 32
          Connected Isochronous Stream (Host Support)
        Bit Value: 1
> HCI Event: Command Complete (0x0e) plen 4                 #16 [hci1] 0.983023
      LE Set Host Feature (0x08|0x0074) ncmd 1
        Status: Success (0x00)
< HCI Command: LE Read Buffer v2 (0x08|0x0060) plen 0       #17 [hci1] 1.002560
> HCI Event: Command Complete (0x0e) plen 10                #18 [hci1] 1.003031
      LE Read Buffer v2 (0x08|0x0060) ncmd 1
        Status: Success (0x00)
        ACL MTU: 27
        ACL max packet: 3
        ISO MTU: 318
        ISO max packet: 3
< HCI Command: LE Read Maximum Adve.. (0x08|0x003a) plen 0  #19 [hci1] 1.022629
> HCI Event: Command Complete (0x0e) plen 6                 #20 [hci1] 1.023053
      LE Read Maximum Advertising Data Length (0x08|0x003a) ncmd 1
        Status: Success (0x00)
        Max length: 1650
< HCI Command: LE Read Supported St.. (0x08|0x001c) plen 0  #21 [hci1] 1.042582
> HCI Event: Command Complete (0x0e) plen 12                #22 [hci1] 1.043053
      LE Read Supported States (0x08|0x001c) ncmd 1
        Status: Success (0x00)
        States: 0x000003ff3e0306ff
          Non-connectable Advertising State
          Scannable Advertising State
          Connectable Advertising State
          High Duty Cycle Directed Advertising State
          Passive Scanning State
          Active Scanning State
          Initiating State
            and Connection State (Central Role)
          Connection State (Peripheral Role)
          Scannable Advertising State
            and Passive Scanning State
          Connectable Advertising State
            and Passive Scanning State
          Non-connectable Advertising State
            and Initiating State
          Scannable Advertising State
            and Initiating State
          Active Scanning State
            and Connection State (Central Role)
          Passive Scanning State
            and Connection State (Peripheral Role)
          Active Scanning State
            and Connection State (Peripheral Role)
          Initiating State
            and Connection State (Central Role)
            and Central Role & Central Role
          Low Duty Cycle Directed Advertising State
          Connectable Advertising State
            and Initiating State
            and Central Role & Peripheral Role
          High Duty Cycle Directed Advertising State
            and Initiating State
            and Central Role & Peripheral Role
          Low Duty Cycle Directed Advertising State
            and Initiating State
            and Central Role & Peripheral Role
          Connectable Advertising State
            and Connection State (Central Role)
            and Central Role & Peripheral Role
          High Duty Cycle Directed Advertising State
            and Connection State (Central Role)
            and Central Role & Peripheral Role
          Low Duty Cycle Directed Advertising State
            and Connection State (Central Role)
            and Central Role & Peripheral Role
          Connectable Advertising State
            and Connection State (Peripheral Role)
            and Central Role & Peripheral Role
          High Duty Cycle Directed Advertising State
            and Connection State (Peripheral Role)
            and Peripheral Role & Peripheral Role
          Low Duty Cycle Directed Advertising State
            and Connection State (Peripheral Role)
            and Peripheral Role & Peripheral Role
          Initiating State
            and Connection State (Peripheral Role)
            and Central Role & Peripheral Role
< HCI Command: LE Read Maximum Data.. (0x08|0x002f) plen 0  #23 [hci1] 1.062582
> HCI Event: Command Complete (0x0e) plen 12                #24 [hci1] 1.063055
      LE Read Maximum Data Length (0x08|0x002f) ncmd 1
        Status: Success (0x00)
        Max TX octets: 251
        Max TX time: 2704
        Max RX octets: 251
        Max RX time: 2704
< HCI Command: LE Write Suggested D.. (0x08|0x0024) plen 4  #25 [hci1] 1.082508
        TX octets: 251
        TX time: 2704
> HCI Event: Command Complete (0x0e) plen 4                 #26 [hci1] 1.082987
      LE Write Suggested Default Data Length (0x08|0x0024) ncmd 1
        Status: Success (0x00)
< HCI Command: LE Read Resolving Li.. (0x08|0x002a) plen 0  #27 [hci1] 1.102599
> HCI Event: Command Complete (0x0e) plen 5                 #28 [hci1] 1.103034
      LE Read Resolving List Size (0x08|0x002a) ncmd 1
        Status: Success (0x00)
        Size: 8
< HCI Command: LE Set Event Mask (0x08|0x0001) plen 8       #29 [hci1] 1.122633
        Mask: 0x000002023f87fa5e
          LE Advertising Report
          LE Connection Update Complete
          LE Read Remote Used Features Complete
          LE Long Term Key Request
          LE Data Length Change
          LE Enhanced Connection Complete
          LE PHY Update Complete
          LE Extended Advertising Report
          LE Periodic Advertising Sync Established
          LE Periodic Advertising Report
          LE Periodic Advertising Sync Lost
          LE Extended Scan Timeout
          LE Extended Advertising Set Terminated
          LE Scan Request Received
          LE Periodic Advertising Sync Transfer Rvc
          LE CIS Established
          LE CIS Request
          LE Create BIG Complete
          LE Terminate BIG Complete
          LE BIG Sync Estabilished Complete
          LE BIG Sync Lost
          LE BIG Info Advertising Report
          Unknown mask (0x0000020000000000)
> HCI Event: Command Complete (0x0e) plen 4                 #30 [hci1] 1.123125
      LE Set Event Mask (0x08|0x0001) ncmd 1
        Status: Success (0x00)
< HCI Command: Set Event Mask (0x03|0x0001) plen 8          #31 [hci1] 1.142619
        Mask: 0x2000800002008890
          Disconnection Complete
          Encryption Change
          Read Remote Version Information Complete
          Hardware Error
          Data Buffer Overflow
          Encryption Key Refresh Complete
          LE Meta
> HCI Event: Command Complete (0x0e) plen 4                 #32 [hci1] 1.143132
      Set Event Mask (0x03|0x0001) ncmd 1
        Status: Success (0x00)
< HCI Command: Read BD ADDR (0x04|0x0009) plen 0            #33 [hci1] 1.162607
> HCI Event: Command Complete (0x0e) plen 10                #34 [hci1] 1.163065
      Read BD ADDR (0x04|0x0009) ncmd 1
        Status: Success (0x00)
        Address: 00:00:00:00:00:00 (OUI 00-00-00)
< HCI Command: LE Set Random Address (0x08|0x0005) plen 6   #35 [hci1] 1.182516
        Address: D5:B6:CC:31:DB:3B (Static)
> HCI Event: Command Complete (0x0e) plen 4                 #36 [hci1] 1.183000
      LE Set Random Address (0x08|0x0005) ncmd 1
        Status: Success (0x00)
< HCI Command: LE Set Extended Adv.. (0x08|0x0036) plen 25  #37 [hci1] 3.792647
        Handle: 0x00
        Properties: 0x0013
          Connectable
          Scannable
          Use legacy advertising PDUs: ADV_IND
        Min advertising interval: 100.000 msec (0x00a0)
        Max advertising interval: 150.000 msec (0x00f0)
        Channel map: 37, 38, 39 (0x07)
        Own address type: Random (0x01)
        Peer address type: Public (0x00)
        Peer address: 00:00:00:00:00:00 (OUI 00-00-00)
        Filter policy: Allow Scan Request from Any, Allow Connect Request from Any (0x00)
        TX power: Host has no preference (0x7f)
        Primary PHY: LE 1M (0x01)
        Secondary max skip: 0x00
        Secondary PHY: LE 1M (0x01)
        SID: 0x00
        Scan request notifications: Disabled (0x00)
> HCI Event: Command Complete (0x0e) plen 5                 #38 [hci1] 3.793425
      LE Set Extended Advertising Parameters (0x08|0x0036) ncmd 1
        Status: Success (0x00)
        TX power (selected): 0 dbm (0x00)
< HCI Command: LE Set Advertising S.. (0x08|0x0035) plen 7  #39 [hci1] 3.802687
        Advertising handle: 0x00
        Advertising random address: D5:B6:CC:31:DB:3B (Static)
> HCI Event: Command Complete (0x0e) plen 4                 #40 [hci1] 3.803168
      LE Set Advertising Set Random Address (0x08|0x0035) ncmd 1
        Status: Success (0x00)
< HCI Command: LE Set Extended Adv.. (0x08|0x0037) plen 22  #41 [hci1] 3.822676
        Handle: 0x00
        Operation: Complete extended advertising data (0x03)
        Fragment preference: Minimize fragmentation (0x01)
        Data length: 0x12
        Flags: 0x06
          LE General Discoverable Mode
          BR/EDR Not Supported
        Name (complete): Tester_F6B11A
> HCI Event: Command Complete (0x0e) plen 4                 #42 [hci1] 3.823379
      LE Set Extended Advertising Data (0x08|0x0037) ncmd 1
        Status: Success (0x00)
< HCI Command: LE Set Extended Scan.. (0x08|0x0038) plen 4  #43 [hci1] 3.842644
        Handle: 0x00
        Operation: Complete scan response data (0x03)
        Fragment preference: Minimize fragmentation (0x01)
        Data length: 0x00
> HCI Event: Command Complete (0x0e) plen 4                 #44 [hci1] 3.843072
      LE Set Extended Scan Response Data (0x08|0x0038) ncmd 1
        Status: Success (0x00)
< HCI Command: LE Set Extended Adve.. (0x08|0x0039) plen 6  #45 [hci1] 3.862639
        Extended advertising: Enabled (0x01)
        Number of sets: 1 (0x01)
        Entry 0
          Handle: 0x00
          Duration: 0 ms (0x00)
          Max ext adv events: 0
> HCI Event: Command Complete (0x0e) plen 4                 #46 [hci1] 3.863239
      LE Set Extended Advertising Enable (0x08|0x0039) ncmd 1
        Status: Success (0x00)
> HCI Event: LE Meta Event (0x3e) plen 31                   #47 [hci1] 3.973435
      LE Enhanced Connection Complete (0x0a)
        Status: Success (0x00)
        Handle: 93
        Role: Peripheral (0x01)
        Peer address type: Public (0x00)
        Peer address: DF:A9:FF:F6:B1:1A (OUI DF-A9-FF)
        Local resolvable private address: 00:00:00:00:00:00 (Non-Resolvable)
        Peer resolvable private address: 00:00:00:00:00:00 (Non-Resolvable)
        Connection interval: 87.50 msec (0x0046)
        Connection latency: 0 (0x0000)
        Supervision timeout: 25120 msec (0x09d0)
        Central clock accuracy: 0x01
> HCI Event: LE Meta Event (0x3e) plen 6                    #48 [hci1] 3.973516
      LE Advertising Set Terminated (0x12)
        Status: Success (0x00)
        Handle: 0
        Connection handle: 93
        Number of completed extended advertising events: 0
< HCI Command: LE Read Remote Used... (0x08|0x0016) plen 2  #49 [hci1] 3.982830
        Handle: 93 Address: DF:A9:FF:F6:B1:1A (OUI DF-A9-FF)
< ACL Data TX: Handle 93 flags 0x00 dlen 7                  #50 [hci1] 3.982838
      ATT: Exchange MTU Request (0x02) len 2
        Client RX MTU: 251
> HCI Event: Command Status (0x0f) plen 4                   #51 [hci1] 3.983390
      LE Read Remote Used Features (0x08|0x0016) ncmd 1
        Status: Success (0x00)
> HCI Event: Number of Completed Packets (0x13) plen 5      #52 [hci1] 4.149386
        Num handles: 1
        Handle: 93 Address: DF:A9:FF:F6:B1:1A (OUI DF-A9-FF)
        Count: 1
        #50: len 7 (0 Kb/s)
        Latency: 166 msec (166-166 msec ~166 msec)
> HCI Event: LE Meta Event (0x3e) plen 12                   #53 [hci1] 4.237339
      LE Read Remote Used Features (0x04)
        Status: Success (0x00)
        Handle: 93 Address: DF:A9:FF:F6:B1:1A (OUI DF-A9-FF)
        Features: 0x2d 0x49 0x00 0xf7 0x67 0xd8 0x00 0x00
          LE Encryption
          Extended Reject Indication
          Peripheral-initiated Features Exchange
          LE Data Packet Length Extension
          LE 2M PHY
          LE Coded PHY
          Channel Selection Algorithm #2
          Periodic Advertising Sync Transfer - Sender
          Periodic Advertising Sync Transfer - Recipient
          Sleep Clock Accuracy Updates
          Connected Isochronous Stream - Central
          Connected Isochronous Stream - Peripheral
          Isochronous Broadcaster
          Synchronized Receiver
          Connected Isochronous Stream (Host Support)
          LE Power Control Request
          LE Power Control Request
          Connection Subrating
          Connection Subrating (Host Support)
          Unknown features (0x0000d80000000000)
> ACL Data RX: Handle 93 flags 0x02 dlen 11                 #54 [hci1] 6.687047
      SMP: Pairing Request (0x01) len 6
        IO capability: KeyboardDisplay (0x04)
        OOB data: Authentication data not present (0x00)
        Authentication requirement: Bonding, MITM, SC, No Keypresses (0x0d)
        Max encryption key size: 16
        Initiator key distribution: EncKey IdKey (0x03)
        Responder key distribution: EncKey IdKey Sign (0x07)
> ACL Data RX: Handle 93 flags 0x02 dlen 7                  #55 [hci1] 6.687406
      ATT: Exchange MTU Response (0x03) len 2
        Server RX MTU: 23
< HCI Command: Host Number of Compl.. (0x03|0x0035) plen 5  #56 [hci1] 6.703232
        Num handles: 1
        Handle: 93 Address: DF:A9:FF:F6:B1:1A (OUI DF-A9-FF)
        Count: 1
< ACL Data TX: Handle 93 flags 0x00 dlen 11                 #57 [hci1] 6.703394
      SMP: Pairing Response (0x02) len 6
        IO capability: DisplayOnly (0x00)
        OOB data: Authentication data not present (0x00)
        Authentication requirement: Bonding, No MITM, SC, No Keypresses (0x09)
        Max encryption key size: 16
        Initiator key distribution: IdKey (0x02)
        Responder key distribution: <none> (0x00)
< HCI Command: Host Number of Compl.. (0x03|0x0035) plen 5  #58 [hci1] 6.703810
        Num handles: 1
        Handle: 93 Address: DF:A9:FF:F6:B1:1A (OUI DF-A9-FF)
        Count: 1
> HCI Event: Number of Completed Packets (0x13) plen 5      #59 [hci1] 6.862090
        Num handles: 1
        Handle: 93 Address: DF:A9:FF:F6:B1:1A (OUI DF-A9-FF)
        Count: 1
        #57: len 11 (0 Kb/s)
        Latency: 158 msec (158-166 msec ~162 msec)
> ACL Data RX: Handle 93 flags 0x02 dlen 27                 #60 [hci1] 6.862388
> ACL Data RX: Handle 93 flags 0x01 dlen 27                 #61 [hci1] 6.862887
> ACL Data RX: Handle 93 flags 0x01 dlen 15                 #62 [hci1] 6.863361
      SMP: Pairing Public Key (0x0c) len 64
        X: 1511ed573c9b04695dc50918ecb75b264fc119ee31a189f55144fe48c0f1664c
        Y: 3bf48a79542a0b072cf9a8a8cbb9bd1a70cc52cda69312e125fe9dca6c25f718
< HCI Command: Host Number of Compl.. (0x03|0x0035) plen 5  #63 [hci1] 6.883154
        Num handles: 1
        Handle: 93 Address: DF:A9:FF:F6:B1:1A (OUI DF-A9-FF)
        Count: 1
< HCI Command: Host Number of Compl.. (0x03|0x0035) plen 5  #64 [hci1] 6.883260
        Num handles: 1
        Handle: 93 Address: DF:A9:FF:F6:B1:1A (OUI DF-A9-FF)
        Count: 1
< HCI Command: Host Number of Compl.. (0x03|0x0035) plen 5  #65 [hci1] 6.883629
        Num handles: 1
        Handle: 93 Address: DF:A9:FF:F6:B1:1A (OUI DF-A9-FF)
        Count: 1
< ACL Data TX: Handle 93 flags 0x00 dlen 27                 #66 [hci1] 6.883766
< ACL Data TX: Handle 93 flags 0x01 dlen 27                 #67 [hci1] 6.883781
< ACL Data TX: Handle 93 flags 0x01 dlen 15                 #68 [hci1] 6.883784
      SMP: Pairing Public Key (0x0c) len 64
        X: 98308440221e2d910f0e54b71e7ec652857aa9b5a0dc65028824cc19db1226e9
        Y: 67a4816bcb62efb21701e31fdb27561a6217575fb007a8bbdabe7e28b6f68482
> HCI Event: Number of Completed Packets (0x13) plen 5      #69 [hci1] 6.949985
        Num handles: 1
        Handle: 93 Address: DF:A9:FF:F6:B1:1A (OUI DF-A9-FF)
        Count: 1
        #66: len 27 (3 Kb/s)
        Latency: 66 msec (66-166 msec ~114 msec)
> HCI Event: Number of Completed Packets (0x13) plen 5      #70 [hci1] 6.950684
        Num handles: 1
        Handle: 93 Address: DF:A9:FF:F6:B1:1A (OUI DF-A9-FF)
        Count: 1
        #67: len 27 (3 Kb/s)
        Latency: 66 msec (66-166 msec ~90 msec)
> HCI Event: Number of Completed Packets (0x13) plen 5      #71 [hci1] 7.036835
        Num handles: 1
        Handle: 93 Address: DF:A9:FF:F6:B1:1A (OUI DF-A9-FF)
        Count: 1
        #68: len 15 (0 Kb/s)
        Latency: 153 msec (66-166 msec ~121 msec)
> ACL Data RX: Handle 93 flags 0x02 dlen 21                 #72 [hci1] 8.087091
      SMP: Pairing Confirm (0x03) len 16
        Confim value: 7f392fbba4c5ff7217d4a517c9f2785a
< HCI Command: Host Number of Compl.. (0x03|0x0035) plen 5  #73 [hci1] 8.103393
        Num handles: 1
        Handle: 93 Address: DF:A9:FF:F6:B1:1A (OUI DF-A9-FF)
        Count: 1
< ACL Data TX: Handle 93 flags 0x00 dlen 21                 #74 [hci1] 8.103543
      SMP: Pairing Confirm (0x03) len 16
        Confim value: c248a3ba985a92eb02e66b5aad59e14b
> HCI Event: Number of Completed Packets (0x13) plen 5      #75 [hci1] 8.261945
        Num handles: 1
        Handle: 93 Address: DF:A9:FF:F6:B1:1A (OUI DF-A9-FF)
        Count: 1
        #74: len 21 (1 Kb/s)
        Latency: 158 msec (66-166 msec ~140 msec)
> ACL Data RX: Handle 93 flags 0x02 dlen 21                 #76 [hci1] 8.262412
      SMP: Pairing Random (0x04) len 16
        Random value: 3f99920cea0fff500000000000000000
< HCI Command: Host Number of Compl.. (0x03|0x0035) plen 5  #77 [hci1] 8.263603
        Num handles: 1
        Handle: 93 Address: DF:A9:FF:F6:B1:1A (OUI DF-A9-FF)
        Count: 1
< ACL Data TX: Handle 93 flags 0x00 dlen 21                 #78 [hci1] 8.263753
      SMP: Pairing Random (0x04) len 16
        Random value: 8e6108f966a694cbe26df70bb96773e6
> HCI Event: Number of Completed Packets (0x13) plen 5      #79 [hci1] 8.436754
        Num handles: 1
        Handle: 93 Address: DF:A9:FF:F6:B1:1A (OUI DF-A9-FF)
        Count: 1
        #78: len 21 (0 Kb/s)
        Latency: 173 msec (66-173 msec ~156 msec)
> ACL Data RX: Handle 93 flags 0x02 dlen 21                 #80 [hci1] 8.524532
      SMP: Pairing Confirm (0x03) len 16
        Confim value: acfad185f9cb1942da131c788036fa00
< HCI Command: Host Number of Compl.. (0x03|0x0035) plen 5  #81 [hci1] 8.542904
        Num handles: 1
        Handle: 93 Address: DF:A9:FF:F6:B1:1A (OUI DF-A9-FF)
        Count: 1
< ACL Data TX: Handle 93 flags 0x00 dlen 21                 #82 [hci1] 8.543023
      SMP: Pairing Confirm (0x03) len 16
        Confim value: 67416067ad6175453819e88eb9a0f70d
> HCI Event: Number of Completed Packets (0x13) plen 5      #83 [hci1] 8.699459
        Num handles: 1
        Handle: 93 Address: DF:A9:FF:F6:B1:1A (OUI DF-A9-FF)
        Count: 1
        #82: len 21 (1 Kb/s)
        Latency: 156 msec (66-173 msec ~156 msec)
> ACL Data RX: Handle 93 flags 0x02 dlen 21                 #84 [hci1] 8.699743
      SMP: Pairing Random (0x04) len 16
        Random value: 7735f97d545262b30000000000000000
< HCI Command: Host Number of Compl.. (0x03|0x0035) plen 5  #85 [hci1] 8.702896
        Num handles: 1
        Handle: 93 Address: DF:A9:FF:F6:B1:1A (OUI DF-A9-FF)
        Count: 1
< ACL Data TX: Handle 93 flags 0x00 dlen 21                 #86 [hci1] 8.702924
      SMP: Pairing Random (0x04) len 16
        Random value: 4d02679f89a05211af56d8b3da64d21e
> HCI Event: Number of Completed Packets (0x13) plen 5      #87 [hci1] 8.874281
        Num handles: 1
        Handle: 93 Address: DF:A9:FF:F6:B1:1A (OUI DF-A9-FF)
        Count: 1
        #86: len 21 (0 Kb/s)
        Latency: 171 msec (66-173 msec ~163 msec)
> ACL Data RX: Handle 93 flags 0x02 dlen 21                 #88 [hci1] 8.962065
      SMP: Pairing Confirm (0x03) len 16
        Confim value: eddbf39b467307bc92460d292e6705b3
< HCI Command: Host Number of Compl.. (0x03|0x0035) plen 5  #89 [hci1] 8.963314
        Num handles: 1
        Handle: 93 Address: DF:A9:FF:F6:B1:1A (OUI DF-A9-FF)
        Count: 1
< ACL Data TX: Handle 93 flags 0x00 dlen 21                 #90 [hci1] 8.963416
      SMP: Pairing Confirm (0x03) len 16
        Confim value: 054fdb4051f96f4b1cb07a0b0c16afcd
> HCI Event: Number of Completed Packets (0x13) plen 5      #91 [hci1] 9.136992
        Num handles: 1
        Handle: 93 Address: DF:A9:FF:F6:B1:1A (OUI DF-A9-FF)
        Count: 1
        #90: len 21 (0 Kb/s)
        Latency: 173 msec (66-173 msec ~168 msec)
> ACL Data RX: Handle 93 flags 0x02 dlen 21                 #92 [hci1] 9.137252
      SMP: Pairing Random (0x04) len 16
        Random value: b5858b8fc7fdbeef0000000000000000
< HCI Command: Host Number of Compl.. (0x03|0x0035) plen 5  #93 [hci1] 9.143114
        Num handles: 1
        Handle: 93 Address: DF:A9:FF:F6:B1:1A (OUI DF-A9-FF)
        Count: 1
< ACL Data TX: Handle 93 flags 0x00 dlen 21                 #94 [hci1] 9.143162
      SMP: Pairing Random (0x04) len 16
        Random value: 5e8286bc235a02440d0c3424a2acf8fd
> HCI Event: Number of Completed Packets (0x13) plen 5      #95 [hci1] 9.311983
        Num handles: 1
        Handle: 93 Address: DF:A9:FF:F6:B1:1A (OUI DF-A9-FF)
        Count: 1
        #94: len 21 (1 Kb/s)
        Latency: 168 msec (66-173 msec ~168 msec)
> ACL Data RX: Handle 93 flags 0x02 dlen 21                 #96 [hci1] 9.312276
      SMP: Pairing Confirm (0x03) len 16
        Confim value: f106562acb0c83f1fa814b8c660bd6ae
< HCI Command: Host Number of Compl.. (0x03|0x0035) plen 5  #97 [hci1] 9.322920
        Num handles: 1
        Handle: 93 Address: DF:A9:FF:F6:B1:1A (OUI DF-A9-FF)
        Count: 1
< ACL Data TX: Handle 93 flags 0x00 dlen 21                 #98 [hci1] 9.323009
      SMP: Pairing Confirm (0x03) len 16
        Confim value: e4020d1ad892eb23f05074673673a695
> HCI Event: Number of Completed Packets (0x13) plen 5      #99 [hci1] 9.487027
        Num handles: 1
        Handle: 93 Address: DF:A9:FF:F6:B1:1A (OUI DF-A9-FF)
        Count: 1
        #98: len 21 (1 Kb/s)
        Latency: 164 msec (66-173 msec ~166 msec)
> ACL Data RX: Handle 93 flags 0x02 dlen 21                #100 [hci1] 9.487268
      SMP: Pairing Random (0x04) len 16
        Random value: ab5836771e0392be0000000000000000
< HCI Command: Host Number of Comp.. (0x03|0x0035) plen 5  #101 [hci1] 9.503074
        Num handles: 1
        Handle: 93 Address: DF:A9:FF:F6:B1:1A (OUI DF-A9-FF)
        Count: 1
< ACL Data TX: Handle 93 flags 0x00 dlen 21                #102 [hci1] 9.503123
      SMP: Pairing Random (0x04) len 16
        Random value: 5c4a1bcadd27bd58e945097b00bad7ac
> HCI Event: Number of Completed Packets (0x13) plen 5     #103 [hci1] 9.661710
        Num handles: 1
        Handle: 93 Address: DF:A9:FF:F6:B1:1A (OUI DF-A9-FF)
        Count: 1
        #102: len 21 (1 Kb/s)
        Latency: 158 msec (66-173 msec ~162 msec)
> ACL Data RX: Handle 93 flags 0x02 dlen 21                #104 [hci1] 9.749640
      SMP: Pairing Confirm (0x03) len 16
        Confim value: 8ce79549560805c04563c7e7d973ca1d
< HCI Command: Host Number of Comp.. (0x03|0x0035) plen 5  #105 [hci1] 9.762841
        Num handles: 1
        Handle: 93 Address: DF:A9:FF:F6:B1:1A (OUI DF-A9-FF)
        Count: 1
< ACL Data TX: Handle 93 flags 0x00 dlen 21                #106 [hci1] 9.762918
      SMP: Pairing Confirm (0x03) len 16
        Confim value: a9f4fb10f5774adb0edaf56f61995be6
> HCI Event: Number of Completed Packets (0x13) plen 5     #107 [hci1] 9.924440
        Num handles: 1
        Handle: 93 Address: DF:A9:FF:F6:B1:1A (OUI DF-A9-FF)
        Count: 1
        #106: len 21 (1 Kb/s)
        Latency: 161 msec (66-173 msec ~162 msec)
> ACL Data RX: Handle 93 flags 0x02 dlen 21                #108 [hci1] 9.924973
      SMP: Pairing Random (0x04) len 16
        Random value: a432598d7059c0bc0000000000000000
< HCI Command: Host Number of Comp.. (0x03|0x0035) plen 5  #109 [hci1] 9.943713
        Num handles: 1
        Handle: 93 Address: DF:A9:FF:F6:B1:1A (OUI DF-A9-FF)
        Count: 1
< ACL Data TX: Handle 93 flags 0x00 dlen 21                #110 [hci1] 9.943802
      SMP: Pairing Random (0x04) len 16
        Random value: 32527e6e64e79f33b2e374394db8ab2d
> HCI Event: Number of Completed Packets (0x13) plen 5    #111 [hci1] 10.099257
        Num handles: 1
        Handle: 93 Address: DF:A9:FF:F6:B1:1A (OUI DF-A9-FF)
        Count: 1
        #110: len 21 (1 Kb/s)
        Latency: 155 msec (66-173 msec ~158 msec)
> ACL Data RX: Handle 93 flags 0x02 dlen 21               #112 [hci1] 10.187039
      SMP: Pairing Confirm (0x03) len 16
        Confim value: 846fc529a790c37a1aff9af41dc1f737
< HCI Command: Host Number of Com.. (0x03|0x0035) plen 5  #113 [hci1] 10.202927
        Num handles: 1
        Handle: 93 Address: DF:A9:FF:F6:B1:1A (OUI DF-A9-FF)
        Count: 1
< ACL Data TX: Handle 93 flags 0x00 dlen 21               #114 [hci1] 10.203018
      SMP: Pairing Confirm (0x03) len 16
        Confim value: 147c10ef89474426b273e2cc2bf97db7
> HCI Event: Number of Completed Packets (0x13) plen 5    #115 [hci1] 10.362013
        Num handles: 1
        Handle: 93 Address: DF:A9:FF:F6:B1:1A (OUI DF-A9-FF)
        Count: 1
        #114: len 21 (1 Kb/s)
        Latency: 158 msec (66-173 msec ~158 msec)
> ACL Data RX: Handle 93 flags 0x02 dlen 21               #116 [hci1] 10.362213
      SMP: Pairing Random (0x04) len 16
        Random value: f01a4774bd1acfbb0000000000000000
< HCI Command: Host Number of Com.. (0x03|0x0035) plen 5  #117 [hci1] 10.363308
        Num handles: 1
        Handle: 93 Address: DF:A9:FF:F6:B1:1A (OUI DF-A9-FF)
        Count: 1
< ACL Data TX: Handle 93 flags 0x00 dlen 21               #118 [hci1] 10.363454
      SMP: Pairing Random (0x04) len 16
        Random value: dddbdfe2838e9a8cc6964353c850fef7
> HCI Event: Number of Completed Packets (0x13) plen 5    #119 [hci1] 10.536688
        Num handles: 1
        Handle: 93 Address: DF:A9:FF:F6:B1:1A (OUI DF-A9-FF)
        Count: 1
        #118: len 21 (0 Kb/s)
        Latency: 173 msec (66-173 msec ~166 msec)
> ACL Data RX: Handle 93 flags 0x02 dlen 21               #120 [hci1] 10.624571
      SMP: Pairing Confirm (0x03) len 16
        Confim value: 1d494658062a53e7745779515182ab8d
< HCI Command: Host Number of Com.. (0x03|0x0035) plen 5  #121 [hci1] 10.643079
        Num handles: 1
        Handle: 93 Address: DF:A9:FF:F6:B1:1A (OUI DF-A9-FF)
        Count: 1
< ACL Data TX: Handle 93 flags 0x00 dlen 21               #122 [hci1] 10.643134
      SMP: Pairing Confirm (0x03) len 16
        Confim value: c64f27930f9305a1434ef81430a6d611
> HCI Event: Number of Completed Packets (0x13) plen 5    #123 [hci1] 10.799402
        Num handles: 1
        Handle: 93 Address: DF:A9:FF:F6:B1:1A (OUI DF-A9-FF)
        Count: 1
        #122: len 21 (1 Kb/s)
        Latency: 156 msec (66-173 msec ~161 msec)
> ACL Data RX: Handle 93 flags 0x02 dlen 21               #124 [hci1] 10.799695
      SMP: Pairing Random (0x04) len 16
        Random value: b2c7869f3c76ac190000000000000000
< HCI Command: Host Number of Com.. (0x03|0x0035) plen 5  #125 [hci1] 10.803014
        Num handles: 1
        Handle: 93 Address: DF:A9:FF:F6:B1:1A (OUI DF-A9-FF)
        Count: 1
< ACL Data TX: Handle 93 flags 0x00 dlen 21               #126 [hci1] 10.803067
      SMP: Pairing Random (0x04) len 16
        Random value: eb9f1915536596b6fc3db1c86b2b1970
> HCI Event: Number of Completed Packets (0x13) plen 5    #127 [hci1] 10.974130
        Num handles: 1
        Handle: 93 Address: DF:A9:FF:F6:B1:1A (OUI DF-A9-FF)
        Count: 1
        #126: len 21 (0 Kb/s)
        Latency: 171 msec (66-173 msec ~166 msec)
> ACL Data RX: Handle 93 flags 0x02 dlen 21               #128 [hci1] 11.062061
      SMP: Pairing Confirm (0x03) len 16
        Confim value: 101775d0310a0bb7aa31e90df2d74cbd
< HCI Command: Host Number of Com.. (0x03|0x0035) plen 5  #129 [hci1] 11.063004
        Num handles: 1
        Handle: 93 Address: DF:A9:FF:F6:B1:1A (OUI DF-A9-FF)
        Count: 1
< ACL Data TX: Handle 93 flags 0x00 dlen 21               #130 [hci1] 11.063050
      SMP: Pairing Confirm (0x03) len 16
        Confim value: 4a480dc45dfb4178573c06a032893be3
> HCI Event: Number of Completed Packets (0x13) plen 5    #131 [hci1] 11.236951
        Num handles: 1
        Handle: 93 Address: DF:A9:FF:F6:B1:1A (OUI DF-A9-FF)
        Count: 1
        #130: len 21 (0 Kb/s)
        Latency: 173 msec (66-173 msec ~170 msec)
> ACL Data RX: Handle 93 flags 0x02 dlen 21               #132 [hci1] 11.237167
      SMP: Pairing Random (0x04) len 16
        Random value: 6f8de1e8ef1687ac0000000000000000
< HCI Command: Host Number of Com.. (0x03|0x0035) plen 5  #133 [hci1] 11.242972
        Num handles: 1
        Handle: 93 Address: DF:A9:FF:F6:B1:1A (OUI DF-A9-FF)
        Count: 1
< ACL Data TX: Handle 93 flags 0x00 dlen 21               #134 [hci1] 11.243049
      SMP: Pairing Random (0x04) len 16
        Random value: 5c794dc9ad9f2c3f295ebd5ad5e1c3cf
> HCI Event: Number of Completed Packets (0x13) plen 5    #135 [hci1] 11.411688
        Num handles: 1
        Handle: 93 Address: DF:A9:FF:F6:B1:1A (OUI DF-A9-FF)
        Count: 1
        #134: len 21 (1 Kb/s)
        Latency: 168 msec (66-173 msec ~169 msec)
> ACL Data RX: Handle 93 flags 0x02 dlen 21               #136 [hci1] 11.499587
      SMP: Pairing Confirm (0x03) len 16
        Confim value: fd8729a608bb37e420f4ebd70d7855b7
< HCI Command: Host Number of Com.. (0x03|0x0035) plen 5  #137 [hci1] 11.503196
        Num handles: 1
        Handle: 93 Address: DF:A9:FF:F6:B1:1A (OUI DF-A9-FF)
        Count: 1
< ACL Data TX: Handle 93 flags 0x00 dlen 21               #138 [hci1] 11.503233
      SMP: Pairing Confirm (0x03) len 16
        Confim value: 37c8982b41b7a4ce79aa3e224a2ddd61
> HCI Event: Number of Completed Packets (0x13) plen 5    #139 [hci1] 11.674354
        Num handles: 1
        Handle: 93 Address: DF:A9:FF:F6:B1:1A (OUI DF-A9-FF)
        Count: 1
        #138: len 21 (0 Kb/s)
        Latency: 171 msec (66-173 msec ~170 msec)
> ACL Data RX: Handle 93 flags 0x02 dlen 21               #140 [hci1] 11.674673
      SMP: Pairing Random (0x04) len 16
        Random value: 1cb0c9d26fbba1300000000000000000
< HCI Command: Host Number of Com.. (0x03|0x0035) plen 5  #141 [hci1] 11.683075
        Num handles: 1
        Handle: 93 Address: DF:A9:FF:F6:B1:1A (OUI DF-A9-FF)
        Count: 1
< ACL Data TX: Handle 93 flags 0x00 dlen 21               #142 [hci1] 11.683145
      SMP: Pairing Random (0x04) len 16
        Random value: 5c2fff312cdf99c9491988e877355a9a
> HCI Event: Number of Completed Packets (0x13) plen 5    #143 [hci1] 11.849120
        Num handles: 1
        Handle: 93 Address: DF:A9:FF:F6:B1:1A (OUI DF-A9-FF)
        Count: 1
        #142: len 21 (1 Kb/s)
        Latency: 165 msec (66-173 msec ~168 msec)
> ACL Data RX: Handle 93 flags 0x02 dlen 21               #144 [hci1] 11.936970
      SMP: Pairing Confirm (0x03) len 16
        Confim value: b49e94a218dd2ac6c1168e85f9ab49d9
< HCI Command: Host Number of Com.. (0x03|0x0035) plen 5  #145 [hci1] 11.943084
        Num handles: 1
        Handle: 93 Address: DF:A9:FF:F6:B1:1A (OUI DF-A9-FF)
        Count: 1
< ACL Data TX: Handle 93 flags 0x00 dlen 21               #146 [hci1] 11.943148
      SMP: Pairing Confirm (0x03) len 16
        Confim value: 6ef1f298a69c1a4cf45057f8f2b4150e
> HCI Event: Number of Completed Packets (0x13) plen 5    #147 [hci1] 12.111881
        Num handles: 1
        Handle: 93 Address: DF:A9:FF:F6:B1:1A (OUI DF-A9-FF)
        Count: 1
        #146: len 21 (1 Kb/s)
        Latency: 168 msec (66-173 msec ~168 msec)
> ACL Data RX: Handle 93 flags 0x02 dlen 21               #148 [hci1] 12.112145
      SMP: Pairing Random (0x04) len 16
        Random value: 0b0e05cecf4456720000000000000000
< HCI Command: Host Number of Com.. (0x03|0x0035) plen 5  #149 [hci1] 12.123071
        Num handles: 1
        Handle: 93 Address: DF:A9:FF:F6:B1:1A (OUI DF-A9-FF)
        Count: 1
< ACL Data TX: Handle 93 flags 0x00 dlen 21               #150 [hci1] 12.123142
      SMP: Pairing Random (0x04) len 16
        Random value: c629a3a987d808e808655d558dfc1155
> HCI Event: Number of Completed Packets (0x13) plen 5    #151 [hci1] 12.286736
        Num handles: 1
        Handle: 93 Address: DF:A9:FF:F6:B1:1A (OUI DF-A9-FF)
        Count: 1
        #150: len 21 (1 Kb/s)
        Latency: 163 msec (66-173 msec ~166 msec)
> ACL Data RX: Handle 93 flags 0x02 dlen 21               #152 [hci1] 12.374590
      SMP: Pairing Confirm (0x03) len 16
        Confim value: fcccf5402be081634439e5d55e2f6216
< HCI Command: Host Number of Com.. (0x03|0x0035) plen 5  #153 [hci1] 12.383391
        Num handles: 1
        Handle: 93 Address: DF:A9:FF:F6:B1:1A (OUI DF-A9-FF)
        Count: 1
< ACL Data TX: Handle 93 flags 0x00 dlen 21               #154 [hci1] 12.383538
      SMP: Pairing Confirm (0x03) len 16
        Confim value: 0a0510cc9f7455a6732daa2924afd4f9
> HCI Event: Number of Completed Packets (0x13) plen 5    #155 [hci1] 12.549318
        Num handles: 1
        Handle: 93 Address: DF:A9:FF:F6:B1:1A (OUI DF-A9-FF)
        Count: 1
        #154: len 21 (1 Kb/s)
        Latency: 165 msec (66-173 msec ~165 msec)
> ACL Data RX: Handle 93 flags 0x02 dlen 21               #156 [hci1] 12.549753
      SMP: Pairing Random (0x04) len 16
        Random value: 75a52e32d8e9e67e0000000000000000
< HCI Command: Host Number of Com.. (0x03|0x0035) plen 5  #157 [hci1] 12.563417
        Num handles: 1
        Handle: 93 Address: DF:A9:FF:F6:B1:1A (OUI DF-A9-FF)
        Count: 1
< ACL Data TX: Handle 93 flags 0x00 dlen 21               #158 [hci1] 12.563535
      SMP: Pairing Random (0x04) len 16
        Random value: 92f20f6ad8f13724432c7fd6001c45ff
> HCI Event: Number of Completed Packets (0x13) plen 5    #159 [hci1] 12.724078
        Num handles: 1
        Handle: 93 Address: DF:A9:FF:F6:B1:1A (OUI DF-A9-FF)
        Count: 1
        #158: len 21 (1 Kb/s)
        Latency: 160 msec (66-173 msec ~163 msec)
> ACL Data RX: Handle 93 flags 0x02 dlen 21               #160 [hci1] 12.812015
      SMP: Pairing Confirm (0x03) len 16
        Confim value: 7afa05bfc06f278bf9ffe387e143830d
< HCI Command: Host Number of Com.. (0x03|0x0035) plen 5  #161 [hci1] 12.823554
        Num handles: 1
        Handle: 93 Address: DF:A9:FF:F6:B1:1A (OUI DF-A9-FF)
        Count: 1
< ACL Data TX: Handle 93 flags 0x00 dlen 21               #162 [hci1] 12.823667
      SMP: Pairing Confirm (0x03) len 16
        Confim value: 5e68e47a93d02f5e84e9ea17b48d7b5e
> HCI Event: Number of Completed Packets (0x13) plen 5    #163 [hci1] 12.986890
        Num handles: 1
        Handle: 93 Address: DF:A9:FF:F6:B1:1A (OUI DF-A9-FF)
        Count: 1
        #162: len 21 (1 Kb/s)
        Latency: 163 msec (66-173 msec ~163 msec)
> ACL Data RX: Handle 93 flags 0x02 dlen 21               #164 [hci1] 12.987118
      SMP: Pairing Random (0x04) len 16
        Random value: 9b4010f7df6d47dd0000000000000000
< HCI Command: Host Number of Com.. (0x03|0x0035) plen 5  #165 [hci1] 13.003096
        Num handles: 1
        Handle: 93 Address: DF:A9:FF:F6:B1:1A (OUI DF-A9-FF)
        Count: 1
< ACL Data TX: Handle 93 flags 0x00 dlen 21               #166 [hci1] 13.003134
      SMP: Pairing Random (0x04) len 16
        Random value: 23ac32ebbb5e14c8a6b9622f296d277f
> HCI Event: Number of Completed Packets (0x13) plen 5    #167 [hci1] 13.161572
        Num handles: 1
        Handle: 93 Address: DF:A9:FF:F6:B1:1A (OUI DF-A9-FF)
        Count: 1
        #166: len 21 (1 Kb/s)
        Latency: 158 msec (66-173 msec ~160 msec)
> ACL Data RX: Handle 93 flags 0x02 dlen 21               #168 [hci1] 13.249448
      SMP: Pairing Confirm (0x03) len 16
        Confim value: a50d72ac7058f18f02dd2cc4cdf0bb07
< HCI Command: Host Number of Com.. (0x03|0x0035) plen 5  #169 [hci1] 13.262904
        Num handles: 1
        Handle: 93 Address: DF:A9:FF:F6:B1:1A (OUI DF-A9-FF)
        Count: 1
< ACL Data TX: Handle 93 flags 0x00 dlen 21               #170 [hci1] 13.262994
      SMP: Pairing Confirm (0x03) len 16
        Confim value: a9fc2b6284d223a5c19a78573eaba7b2
> HCI Event: Number of Completed Packets (0x13) plen 5    #171 [hci1] 13.424307
        Num handles: 1
        Handle: 93 Address: DF:A9:FF:F6:B1:1A (OUI DF-A9-FF)
        Count: 1
        #170: len 21 (1 Kb/s)
        Latency: 161 msec (66-173 msec ~161 msec)
> ACL Data RX: Handle 93 flags 0x02 dlen 21               #172 [hci1] 13.424624
      SMP: Pairing Random (0x04) len 16
        Random value: 45f37c9189047e4d0000000000000000
< HCI Command: Host Number of Com.. (0x03|0x0035) plen 5  #173 [hci1] 13.443560
        Num handles: 1
        Handle: 93 Address: DF:A9:FF:F6:B1:1A (OUI DF-A9-FF)
        Count: 1
< ACL Data TX: Handle 93 flags 0x00 dlen 21               #174 [hci1] 13.443680
      SMP: Pairing Random (0x04) len 16
        Random value: 297efe85e67448a15f56bd27e3a3cf1d
> HCI Event: Number of Completed Packets (0x13) plen 5    #175 [hci1] 13.599035
        Num handles: 1
        Handle: 93 Address: DF:A9:FF:F6:B1:1A (OUI DF-A9-FF)
        Count: 1
        #174: len 21 (1 Kb/s)
        Latency: 155 msec (66-173 msec ~158 msec)
> ACL Data RX: Handle 93 flags 0x02 dlen 21               #176 [hci1] 13.686962
      SMP: Pairing Confirm (0x03) len 16
        Confim value: 6ab426c6fb230a7c2dc16fa1cd7b08cb
< HCI Command: Host Number of Com.. (0x03|0x0035) plen 5  #177 [hci1] 13.703031
        Num handles: 1
        Handle: 93 Address: DF:A9:FF:F6:B1:1A (OUI DF-A9-FF)
        Count: 1
< ACL Data TX: Handle 93 flags 0x00 dlen 21               #178 [hci1] 13.703121
      SMP: Pairing Confirm (0x03) len 16
        Confim value: 04e70803801f27ba1e59f2a5f69c95d7
> HCI Event: Number of Completed Packets (0x13) plen 5    #179 [hci1] 13.861834
        Num handles: 1
        Handle: 93 Address: DF:A9:FF:F6:B1:1A (OUI DF-A9-FF)
        Count: 1
        #178: len 21 (1 Kb/s)
        Latency: 158 msec (66-173 msec ~158 msec)
> ACL Data RX: Handle 93 flags 0x02 dlen 21               #180 [hci1] 13.862155
      SMP: Pairing Random (0x04) len 16
        Random value: c124c18705bf36d30000000000000000
< HCI Command: Host Number of Com.. (0x03|0x0035) plen 5  #181 [hci1] 13.863417
        Num handles: 1
        Handle: 93 Address: DF:A9:FF:F6:B1:1A (OUI DF-A9-FF)
        Count: 1
< ACL Data TX: Handle 93 flags 0x00 dlen 21               #182 [hci1] 13.863578
      SMP: Pairing Random (0x04) len 16
        Random value: 25a9493fd3ce4faf02be7293595bb7c6
> HCI Event: Number of Completed Packets (0x13) plen 5    #183 [hci1] 14.036694
        Num handles: 1
        Handle: 93 Address: DF:A9:FF:F6:B1:1A (OUI DF-A9-FF)
        Count: 1
        #182: len 21 (0 Kb/s)
        Latency: 173 msec (66-173 msec ~165 msec)
> ACL Data RX: Handle 93 flags 0x02 dlen 21               #184 [hci1] 14.124429
      SMP: Pairing Confirm (0x03) len 16
        Confim value: 40074173e6f7acdc68f0bd41190c5038
< HCI Command: Host Number of Com.. (0x03|0x0035) plen 5  #185 [hci1] 14.143336
        Num handles: 1
        Handle: 93 Address: DF:A9:FF:F6:B1:1A (OUI DF-A9-FF)
        Count: 1
< ACL Data TX: Handle 93 flags 0x00 dlen 21               #186 [hci1] 14.143447
      SMP: Pairing Confirm (0x03) len 16
        Confim value: 6121ab3b3e7a1e36d043b26369df1ee1
> HCI Event: Number of Completed Packets (0x13) plen 5    #187 [hci1] 14.299240
        Num handles: 1
        Handle: 93 Address: DF:A9:FF:F6:B1:1A (OUI DF-A9-FF)
        Count: 1
        #186: len 21 (1 Kb/s)
        Latency: 155 msec (66-173 msec ~160 msec)
> ACL Data RX: Handle 93 flags 0x02 dlen 21               #188 [hci1] 14.299576
      SMP: Pairing Random (0x04) len 16
        Random value: b58ba42702bc6ef10000000000000000
< HCI Command: Host Number of Com.. (0x03|0x0035) plen 5  #189 [hci1] 14.303072
        Num handles: 1
        Handle: 93 Address: DF:A9:FF:F6:B1:1A (OUI DF-A9-FF)
        Count: 1
< ACL Data TX: Handle 93 flags 0x00 dlen 21               #190 [hci1] 14.303116
      SMP: Pairing Random (0x04) len 16
        Random value: 58f6b41f855a6f6c3560debd84e2affc
> HCI Event: Number of Completed Packets (0x13) plen 5    #191 [hci1] 14.474037
        Num handles: 1
        Handle: 93 Address: DF:A9:FF:F6:B1:1A (OUI DF-A9-FF)
        Count: 1
        #190: len 21 (0 Kb/s)
        Latency: 170 msec (66-173 msec ~165 msec)
> ACL Data RX: Handle 93 flags 0x02 dlen 21               #192 [hci1] 14.561939
      SMP: Pairing Confirm (0x03) len 16
        Confim value: 77b2579ba446292bcd3a40f0a46a6d74
< HCI Command: Host Number of Com.. (0x03|0x0035) plen 5  #193 [hci1] 14.563287
        Num handles: 1
        Handle: 93 Address: DF:A9:FF:F6:B1:1A (OUI DF-A9-FF)
        Count: 1
< ACL Data TX: Handle 93 flags 0x00 dlen 21               #194 [hci1] 14.563411
      SMP: Pairing Confirm (0x03) len 16
        Confim value: 7924c7dabe2e5fd87ed6617a1310d737
> HCI Event: Number of Completed Packets (0x13) plen 5    #195 [hci1] 14.736794
        Num handles: 1
        Handle: 93 Address: DF:A9:FF:F6:B1:1A (OUI DF-A9-FF)
        Count: 1
        #194: len 21 (0 Kb/s)
        Latency: 173 msec (66-173 msec ~169 msec)
> ACL Data RX: Handle 93 flags 0x02 dlen 21               #196 [hci1] 14.737105
      SMP: Pairing Random (0x04) len 16
        Random value: 51521b981b43bd040000000000000000
< HCI Command: Host Number of Com.. (0x03|0x0035) plen 5  #197 [hci1] 14.743199
        Num handles: 1
        Handle: 93 Address: DF:A9:FF:F6:B1:1A (OUI DF-A9-FF)
        Count: 1
< ACL Data TX: Handle 93 flags 0x00 dlen 21               #198 [hci1] 14.743294
      SMP: Pairing Random (0x04) len 16
        Random value: b67e7216d5bf664139eda2b542549666
> HCI Event: Number of Completed Packets (0x13) plen 5    #199 [hci1] 14.911553
        Num handles: 1
        Handle: 93 Address: DF:A9:FF:F6:B1:1A (OUI DF-A9-FF)
        Count: 1
        #198: len 21 (1 Kb/s)
        Latency: 168 msec (66-173 msec ~168 msec)
> ACL Data RX: Handle 93 flags 0x02 dlen 21               #200 [hci1] 14.999355
      SMP: Pairing Confirm (0x03) len 16
        Confim value: fa5a13a449dd3805aa73837400054097
< HCI Command: Host Number of Com.. (0x03|0x0035) plen 5  #201 [hci1] 15.002999
        Num handles: 1
        Handle: 93 Address: DF:A9:FF:F6:B1:1A (OUI DF-A9-FF)
        Count: 1
< ACL Data TX: Handle 93 flags 0x00 dlen 21               #202 [hci1] 15.003109
      SMP: Pairing Confirm (0x03) len 16
        Confim value: 0862e08ff998775abce097a4c53b35f4
> HCI Event: Number of Completed Packets (0x13) plen 5    #203 [hci1] 15.174202
        Num handles: 1
        Handle: 93 Address: DF:A9:FF:F6:B1:1A (OUI DF-A9-FF)
        Count: 1
        #202: len 21 (0 Kb/s)
        Latency: 171 msec (66-173 msec ~170 msec)
> ACL Data RX: Handle 93 flags 0x02 dlen 21               #204 [hci1] 15.174568
      SMP: Pairing Random (0x04) len 16
        Random value: 2bdc3e33b74b54bc0000000000000000
< HCI Command: Host Number of Com.. (0x03|0x0035) plen 5  #205 [hci1] 15.184391
        Num handles: 1
        Handle: 93 Address: DF:A9:FF:F6:B1:1A (OUI DF-A9-FF)
        Count: 1
< ACL Data TX: Handle 93 flags 0x00 dlen 21               #206 [hci1] 15.184509
      SMP: Pairing Random (0x04) len 16
        Random value: ed17f76500c95219dd01e09d1e63f87b
> HCI Event: Number of Completed Packets (0x13) plen 5    #207 [hci1] 15.349093
        Num handles: 1
        Handle: 93 Address: DF:A9:FF:F6:B1:1A (OUI DF-A9-FF)
        Count: 1
        #206: len 21 (1 Kb/s)
        Latency: 164 msec (66-173 msec ~167 msec)
> ACL Data RX: Handle 93 flags 0x02 dlen 21               #208 [hci1] 15.436896
      SMP: Pairing Confirm (0x03) len 16
        Confim value: 90302cc234ccc1bc4141605d1ec101bd
< HCI Command: Host Number of Com.. (0x03|0x0035) plen 5  #209 [hci1] 15.445565
        Num handles: 1
        Handle: 93 Address: DF:A9:FF:F6:B1:1A (OUI DF-A9-FF)
        Count: 1
< ACL Data TX: Handle 93 flags 0x00 dlen 21               #210 [hci1] 15.445596
      SMP: Pairing Confirm (0x03) len 16
        Confim value: e9145dd650a5642153eba8aa607f2c68
> HCI Event: Number of Completed Packets (0x13) plen 5    #211 [hci1] 15.611767
        Num handles: 1
        Handle: 93 Address: DF:A9:FF:F6:B1:1A (OUI DF-A9-FF)
        Count: 1
        #210: len 21 (1 Kb/s)
        Latency: 166 msec (66-173 msec ~166 msec)
> ACL Data RX: Handle 93 flags 0x02 dlen 21               #212 [hci1] 15.612041
      SMP: Pairing Random (0x04) len 16
        Random value: b67fa6058b123b0b0000000000000000
< HCI Command: Host Number of Com.. (0x03|0x0035) plen 5  #213 [hci1] 15.622940
        Num handles: 1
        Handle: 93 Address: DF:A9:FF:F6:B1:1A (OUI DF-A9-FF)
        Count: 1
< ACL Data TX: Handle 93 flags 0x00 dlen 21               #214 [hci1] 15.622984
      SMP: Pairing Random (0x04) len 16
        Random value: 81d35d47e1f6006d79c974bd9d9e1ee3
> HCI Event: Number of Completed Packets (0x13) plen 5    #215 [hci1] 15.786464
        Num handles: 1
        Handle: 93 Address: DF:A9:FF:F6:B1:1A (OUI DF-A9-FF)
        Count: 1
        #214: len 21 (1 Kb/s)
        Latency: 163 msec (66-173 msec ~165 msec)
> ACL Data RX: Handle 93 flags 0x02 dlen 21               #216 [hci1] 15.874377
      SMP: Pairing Confirm (0x03) len 16
        Confim value: 1dcd0a45753e2e661ae7f123f57e7949
< HCI Command: Host Number of Com.. (0x03|0x0035) plen 5  #217 [hci1] 15.883361
        Num handles: 1
        Handle: 93 Address: DF:A9:FF:F6:B1:1A (OUI DF-A9-FF)
        Count: 1
< ACL Data TX: Handle 93 flags 0x00 dlen 21               #218 [hci1] 15.883515
      SMP: Pairing Confirm (0x03) len 16
        Confim value: 9c8b41d306d80b1e40f1d84d6cd8bf2e
> HCI Event: Number of Completed Packets (0x13) plen 5    #219 [hci1] 16.049222
        Num handles: 1
        Handle: 93 Address: DF:A9:FF:F6:B1:1A (OUI DF-A9-FF)
        Count: 1
        #218: len 21 (1 Kb/s)
        Latency: 165 msec (66-173 msec ~165 msec)
> ACL Data RX: Handle 93 flags 0x02 dlen 21               #220 [hci1] 16.049566
      SMP: Pairing Random (0x04) len 16
        Random value: 1f3b73e990fbc0450000000000000000
< HCI Command: Host Number of Com.. (0x03|0x0035) plen 5  #221 [hci1] 16.063578
        Num handles: 1
        Handle: 93 Address: DF:A9:FF:F6:B1:1A (OUI DF-A9-FF)
        Count: 1
< ACL Data TX: Handle 93 flags 0x00 dlen 21               #222 [hci1] 16.063736
      SMP: Pairing Random (0x04) len 16
        Random value: e7f7e0c2476823e41736a7e381bafb7c
> HCI Event: Number of Completed Packets (0x13) plen 5    #223 [hci1] 16.223969
        Num handles: 1
        Handle: 93 Address: DF:A9:FF:F6:B1:1A (OUI DF-A9-FF)
        Count: 1
        #222: len 21 (1 Kb/s)
        Latency: 160 msec (66-173 msec ~162 msec)
> ACL Data RX: Handle 93 flags 0x02 dlen 21               #224 [hci1] 16.311883
      SMP: Pairing Confirm (0x03) len 16
        Confim value: be08e46777e51b4469a81799ee9da60c
< HCI Command: Host Number of Com.. (0x03|0x0035) plen 5  #225 [hci1] 16.323035
        Num handles: 1
        Handle: 93 Address: DF:A9:FF:F6:B1:1A (OUI DF-A9-FF)
        Count: 1
< ACL Data TX: Handle 93 flags 0x00 dlen 21               #226 [hci1] 16.323081
      SMP: Pairing Confirm (0x03) len 16
        Confim value: 1d8caa299374585ce57453caa768e3dd
> HCI Event: Number of Completed Packets (0x13) plen 5    #227 [hci1] 16.486715
        Num handles: 1
        Handle: 93 Address: DF:A9:FF:F6:B1:1A (OUI DF-A9-FF)
        Count: 1
        #226: len 21 (1 Kb/s)
        Latency: 163 msec (66-173 msec ~163 msec)
> ACL Data RX: Handle 93 flags 0x02 dlen 21               #228 [hci1] 16.487035
      SMP: Pairing Random (0x04) len 16
        Random value: c2bdd7a0af9bffe00000000000000000
< HCI Command: Host Number of Com.. (0x03|0x0035) plen 5  #229 [hci1] 16.503103
        Num handles: 1
        Handle: 93 Address: DF:A9:FF:F6:B1:1A (OUI DF-A9-FF)
        Count: 1
