Bluetooth monitor ver 5.72
= Note: Linux version 6.14.0-36-generic (x86_64)                       0.870800
= Note: Bluetooth subsystem version 2.22                               0.870802
= New Index: 00:00:00:00:00:00 (Primary,UART,hci1)              [hci1] 0.870803
= New Index: 48:5F:99:8E:E0:64 (Primary,USB,hci0)               [hci0] 0.870804
= Open Index: 00:00:00:00:00:00                                 [hci1] 0.883974
= Index Info: 00:00:00:00:00:00 (Nordic Semiconductor ASA)      [hci1] 0.883982
@ USER Open: main (privileged) version 2.22            {0x0001} [hci1] 0.883984
< HCI Command: Reset (0x03|0x0003) plen 0                    #1 [hci1] 0.884347
> HCI Event: Command Complete (0x0e) plen 4                  #2 [hci1] 0.884902
      Reset (0x03|0x0003) ncmd 1
        Status: Success (0x00)
< HCI Command: Read Local Supported... (0x04|0x0003) plen 0  #3 [hci1] 0.903953
> HCI Event: Command Complete (0x0e) plen 12                 #4 [hci1] 0.904496
      Read Local Supported Features (0x04|0x0003) ncmd 1
        Status: Success (0x00)
        Features: 0x00 0x00 0x00 0x00 0x60 0x00 0x00 0x00
          BR/EDR Not Supported
          LE Supported (Controller)
< HCI Command: Read Local Version In.. (0x04|0x0001) plen 0  #5 [hci1] 0.923960
> HCI Event: Command Complete (0x0e) plen 12                 #6 [hci1] 0.924499
      Read Local Version Information (0x04|0x0001) ncmd 1
        Status: Success (0x00)
        HCI version: Reserved (0x0f) - Revision 12393 (0x3069)
        LMP version: Reserved (0x0f) - Subversion 12393 (0x3069)
        Manufacturer: Nordic Semiconductor ASA (89)
< HCI Command: Read Local Supported... (0x04|0x0002) plen 0  #7 [hci1] 0.943954
> HCI Event: Command Complete (0x0e) plen 68                 #8 [hci1] 0.944991
      Read Local Supported Commands (0x04|0x0002) ncmd 1
        Status: Success (0x00)
        Commands: 119 entries
          Disconnect (Octet 0 - Bit 5)
          Read Remote Version Information (Octet 2 - Bit 7)
          Set Event Mask (Octet 5 - Bit 6)
          Reset (Octet 5 - Bit 7)
          Read Connection Accept Timeout (Octet 7 - Bit 2)
          Write Connection Accept Timeout (Octet 7 - Bit 3)
          Read Transmit Power Level (Octet 10 - Bit 2)
          Set Controller To Host Flow Control (Octet 10 - Bit 5)
          Host Buffer Size (Octet 10 - Bit 6)
          Host Number of Completed Packets (Octet 10 - Bit 7)
          Read Local Version Information (Octet 14 - Bit 3)
          Read Local Supported Features (Octet 14 - Bit 5)
          Read BD ADDR (Octet 15 - Bit 1)
          Read RSSI (Octet 15 - Bit 5)
          Set Event Mask Page 2 (Octet 22 - Bit 2)
          LE Set Event Mask (Octet 25 - Bit 0)
          LE Read Buffer Size (Octet 25 - Bit 1)
          LE Read Local Supported Features (Octet 25 - Bit 2)
          LE Set Random Address (Octet 25 - Bit 4)
          LE Set Advertising Parameters (Octet 25 - Bit 5)
          LE Read Advertising Channel TX Power (Octet 25 - Bit 6)
          LE Set Advertising Data (Octet 25 - Bit 7)
          LE Set Scan Response Data (Octet 26 - Bit 0)
          LE Set Advertise Enable (Octet 26 - Bit 1)
          LE Set Scan Parameters (Octet 26 - Bit 2)
          LE Set Scan Enable (Octet 26 - Bit 3)
          LE Create Connection (Octet 26 - Bit 4)
          LE Create Connection Cancel (Octet 26 - Bit 5)
          LE Read Accept List Size (Octet 26 - Bit 6)
          LE Clear Accept List (Octet 26 - Bit 7)
          LE Add Device To Accept List (Octet 27 - Bit 0)
          LE Remove Device From Accept List (Octet 27 - Bit 1)
          LE Connection Update (Octet 27 - Bit 2)
          LE Set Host Channel Classification (Octet 27 - Bit 3)
          LE Read Channel Map (Octet 27 - Bit 4)
          LE Read Remote Used Features (Octet 27 - Bit 5)
          LE Encrypt (Octet 27 - Bit 6)
          LE Rand (Octet 27 - Bit 7)
          LE Start Encryption (Octet 28 - Bit 0)
          LE Long Term Key Request Reply (Octet 28 - Bit 1)
          LE Long Term Key Request Neg Reply (Octet 28 - Bit 2)
          LE Read Supported States (Octet 28 - Bit 3)
          LE Receiver Test (Octet 28 - Bit 4)
          LE Transmitter Test (Octet 28 - Bit 5)
          LE Test End (Octet 28 - Bit 6)
          Read Authenticated Payload Timeout (Octet 32 - Bit 4)
          Write Authenticated Payload Timeout (Octet 32 - Bit 5)
          LE Set Data Length (Octet 33 - Bit 6)
          LE Read Suggested Default Data Length (Octet 33 - Bit 7)
          LE Write Suggested Default Data Length (Octet 34 - Bit 0)
          LE Add Device To Resolving List (Octet 34 - Bit 3)
          LE Remove Device From Resolving List (Octet 34 - Bit 4)
          LE Clear Resolving List (Octet 34 - Bit 5)
          LE Read Resolving List Size (Octet 34 - Bit 6)
          LE Set Address Resolution Enable (Octet 35 - Bit 1)
          LE Set Resolvable Private Address Timeout (Octet 35 - Bit 2)
          LE Read Maximum Data Length (Octet 35 - Bit 3)
          LE Read PHY (Octet 35 - Bit 4)
          LE Set Default PHY (Octet 35 - Bit 5)
          LE Set PHY (Octet 35 - Bit 6)
          LE Enhanced Receiver Test (Octet 35 - Bit 7)
          LE Enhanced Transmitter Test (Octet 36 - Bit 0)
          LE Set Advertising Set Random Address (Octet 36 - Bit 1)
          LE Set Extended Advertising Parameters (Octet 36 - Bit 2)
          LE Set Extended Advertising Data (Octet 36 - Bit 3)
          LE Set Extended Scan Response Data (Octet 36 - Bit 4)
          LE Set Extended Advertising Enable (Octet 36 - Bit 5)
          LE Read Maximum Advertising Data Length (Octet 36 - Bit 6)
          LE Read Number of Supported Advertising Sets (Octet 36 - Bit 7)
          LE Remove Advertising Set (Octet 37 - Bit 0)
          LE Clear Advertising Sets (Octet 37 - Bit 1)
          LE Set Periodic Advertising Parameters (Octet 37 - Bit 2)
          LE Set Periodic Advertising Data (Octet 37 - Bit 3)
          LE Set Periodic Advertising Enable (Octet 37 - Bit 4)
          LE Set Extended Scan Parameters (Octet 37 - Bit 5)
          LE Set Extended Scan Enable (Octet 37 - Bit 6)
          LE Extended Create Connection (Octet 37 - Bit 7)
          LE Periodic Advertising Create Sync (Octet 38 - Bit 0)
          LE Periodic Advertising Create Sync Cancel (Octet 38 - Bit 1)
          LE Periodic Advertising Terminate Sync (Octet 38 - Bit 2)
          LE Add Device To Periodic Advertiser List (Octet 38 - Bit 3)
          LE Remove Device From Periodic Advertiser List (Octet 38 - Bit 4)
          LE Clear Periodic Advertiser List (Octet 38 - Bit 5)
          LE Read Periodic Advertiser List Size (Octet 38 - Bit 6)
          LE Read Transmit Power (Octet 38 - Bit 7)
          LE Read RF Path Compensation (Octet 39 - Bit 0)
          LE Write RF Path Compensation (Octet 39 - Bit 1)
          LE Set Privacy Mode (Octet 39 - Bit 2)
          LE Periodic Advertising Receive Enable (Octet 40 - Bit 5)
          LE Periodic Advertising Sync Transfer (Octet 40 - Bit 6)
          LE Periodic Advertising Set Info Transfer (Octet 40 - Bit 7)
          LE Periodic Advertising Sync Transfer Parameters (Octet 41 - Bit 0)
          LE Set Default Periodic Advertisng Sync Transfer Parameters (Octet 41 - Bit 1)
          LE Read Buffer v2 (Octet 41 - Bit 5)
          LE Read ISO TX Sync (Octet 41 - Bit 6)
          LE Set Connected Isochronous Group Parameters (Octet 41 - Bit 7)
          LE Set Connected Isochronous Group Parameters Test (Octet 42 - Bit 0)
          LE Create Connected Isochronous Stream (Octet 42 - Bit 1)
          LE Remove Connected Isochronous Group (Octet 42 - Bit 2)
          LE Accept Connected Isochronous Stream Request (Octet 42 - Bit 3)
          LE Reject Connected Isochronous Stream Request (Octet 42 - Bit 4)
          LE Create Broadcast Isochronous Group (Octet 42 - Bit 5)
          LE Create Broadcast Isochronous Group Test (Octet 42 - Bit 6)
          LE Terminate Broadcast Isochronous Group (Octet 42 - Bit 7)
          LE Broadcast Isochronous Group Create Sync (Octet 43 - Bit 0)
          LE Broadcast Isochronous Group Terminate Sync (Octet 43 - Bit 1)
          LE Request Peer SCA (Octet 43 - Bit 2)
          LE Setup Isochronous Data Path (Octet 43 - Bit 3)
          LE Remove Isochronous Data Path (Octet 43 - Bit 4)
          LE Isochronous Transmit Test (Octet 43 - Bit 5)
          LE Isochronous Receive Test (Octet 43 - Bit 6)
          LE Isochronous Read Test Counters (Octet 43 - Bit 7)
          LE Isochronous Read Test Counters (Octet 44 - Bit 0)
          LE Set Host Feature (Octet 44 - Bit 1)
          Octet 44 - Bit 2 
          Octet 45 - Bit 6 
          Octet 46 - Bit 0 
          Octet 46 - Bit 1 
          Octet 46 - Bit 2 
< HCI Command: Host Buffer Size (0x03|0x0033) plen 7         #9 [hci1] 0.963969
        ACL MTU: 255  ACL max packet: 16
        SCO MTU: 0    SCO max packet: 0
> HCI Event: Command Complete (0x0e) plen 4                 #10 [hci1] 0.964495
      Host Buffer Size (0x03|0x0033) ncmd 1
        Status: Success (0x00)
< HCI Command: Set Controller To Ho.. (0x03|0x0031) plen 1  #11 [hci1] 0.983950
        Flow control: ACL Data Packets (0x01)
> HCI Event: Command Complete (0x0e) plen 4                 #12 [hci1] 0.984430
      Set Controller To Host Flow Control (0x03|0x0031) ncmd 1
        Status: Success (0x00)
< HCI Command: LE Read Local Suppor.. (0x08|0x0003) plen 0  #13 [hci1] 1.003957
> HCI Event: Command Complete (0x0e) plen 12                #14 [hci1] 1.004487
      LE Read Local Supported Features (0x08|0x0003) ncmd 1
        Status: Success (0x00)
        Features: 0xfd 0x79 0x00 0xf7 0x30 0x01 0x00 0x00
          LE Encryption
          Extended Reject Indication
          Peripheral-initiated Features Exchange
          LE Ping
          LE Data Packet Length Extension
          LL Privacy
          Extended Scanner Filter Policies
          LE 2M PHY
          LE Coded PHY
          LE Extended Advertising
          LE Periodic Advertising
          Channel Selection Algorithm #2
          Periodic Advertising Sync Transfer - Sender
          Periodic Advertising Sync Transfer - Recipient
          Sleep Clock Accuracy Updates
          Connected Isochronous Stream - Central
          Connected Isochronous Stream - Peripheral
          Isochronous Broadcaster
          Synchronized Receiver
          Periodic Advertising ADI support
          Connection Subrating
          Unknown features (0x0000010000000000)
< HCI Command: LE Set Host Feature (0x08|0x0074) plen 2     #15 [hci1] 1.023966
        Bit Number: 32
          Connected Isochronous Stream (Host Support)
        Bit Value: 1
> HCI Event: Command Complete (0x0e) plen 4                 #16 [hci1] 1.024509
      LE Set Host Feature (0x08|0x0074) ncmd 1
        Status: Success (0x00)
< HCI Command: LE Read Buffer v2 (0x08|0x0060) plen 0       #17 [hci1] 1.043964
> HCI Event: Command Complete (0x0e) plen 10                #18 [hci1] 1.044476
      LE Read Buffer v2 (0x08|0x0060) ncmd 1
        Status: Success (0x00)
        ACL MTU: 27
        ACL max packet: 3
        ISO MTU: 318
        ISO max packet: 3
< HCI Command: LE Read Maximum Adve.. (0x08|0x003a) plen 0  #19 [hci1] 1.063987
> HCI Event: Command Complete (0x0e) plen 6                 #20 [hci1] 1.064471
      LE Read Maximum Advertising Data Length (0x08|0x003a) ncmd 1
        Status: Success (0x00)
        Max length: 1650
< HCI Command: LE Read Supported St.. (0x08|0x001c) plen 0  #21 [hci1] 1.083954
> HCI Event: Command Complete (0x0e) plen 12                #22 [hci1] 1.084462
      LE Read Supported States (0x08|0x001c) ncmd 1
        Status: Success (0x00)
        States: 0x000003ff3e0306ff
          Non-connectable Advertising State
          Scannable Advertising State
          Connectable Advertising State
          High Duty Cycle Directed Advertising State
          Passive Scanning State
          Active Scanning State
          Initiating State
            and Connection State (Central Role)
          Connection State (Peripheral Role)
          Scannable Advertising State
            and Passive Scanning State
          Connectable Advertising State
            and Passive Scanning State
          Non-connectable Advertising State
            and Initiating State
          Scannable Advertising State
            and Initiating State
          Active Scanning State
            and Connection State (Central Role)
          Passive Scanning State
            and Connection State (Peripheral Role)
          Active Scanning State
            and Connection State (Peripheral Role)
          Initiating State
            and Connection State (Central Role)
            and Central Role & Central Role
          Low Duty Cycle Directed Advertising State
          Connectable Advertising State
            and Initiating State
            and Central Role & Peripheral Role
          High Duty Cycle Directed Advertising State
            and Initiating State
            and Central Role & Peripheral Role
          Low Duty Cycle Directed Advertising State
            and Initiating State
            and Central Role & Peripheral Role
          Connectable Advertising State
            and Connection State (Central Role)
            and Central Role & Peripheral Role
          High Duty Cycle Directed Advertising State
            and Connection State (Central Role)
            and Central Role & Peripheral Role
          Low Duty Cycle Directed Advertising State
            and Connection State (Central Role)
            and Central Role & Peripheral Role
          Connectable Advertising State
            and Connection State (Peripheral Role)
            and Central Role & Peripheral Role
          High Duty Cycle Directed Advertising State
            and Connection State (Peripheral Role)
            and Peripheral Role & Peripheral Role
          Low Duty Cycle Directed Advertising State
            and Connection State (Peripheral Role)
            and Peripheral Role & Peripheral Role
          Initiating State
            and Connection State (Peripheral Role)
            and Central Role & Peripheral Role
< HCI Command: LE Read Maximum Data.. (0x08|0x002f) plen 0  #23 [hci1] 1.103954
> HCI Event: Command Complete (0x0e) plen 12                #24 [hci1] 1.104453
      LE Read Maximum Data Length (0x08|0x002f) ncmd 1
        Status: Success (0x00)
        Max TX octets: 251
        Max TX time: 2704
        Max RX octets: 251
        Max RX time: 2704
< HCI Command: LE Write Suggested D.. (0x08|0x0024) plen 4  #25 [hci1] 1.123955
        TX octets: 251
        TX time: 2704
> HCI Event: Command Complete (0x0e) plen 4                 #26 [hci1] 1.124458
      LE Write Suggested Default Data Length (0x08|0x0024) ncmd 1
        Status: Success (0x00)
< HCI Command: LE Set Resolvable Pr.. (0x08|0x002e) plen 2  #27 [hci1] 1.143959
        Timeout: 30 seconds
> HCI Event: Command Complete (0x0e) plen 4                 #28 [hci1] 1.144458
      LE Set Resolvable Private Address Timeout (0x08|0x002e) ncmd 1
        Status: Success (0x00)
< HCI Command: LE Read Resolving Li.. (0x08|0x002a) plen 0  #29 [hci1] 1.163957
> HCI Event: Command Complete (0x0e) plen 5                 #30 [hci1] 1.164414
      LE Read Resolving List Size (0x08|0x002a) ncmd 1
        Status: Success (0x00)
        Size: 8
< HCI Command: LE Set Event Mask (0x08|0x0001) plen 8       #31 [hci1] 1.183978
        Mask: 0x000002023f87fa5e
          LE Advertising Report
          LE Connection Update Complete
          LE Read Remote Used Features Complete
          LE Long Term Key Request
          LE Data Length Change
          LE Enhanced Connection Complete
          LE PHY Update Complete
          LE Extended Advertising Report
          LE Periodic Advertising Sync Established
          LE Periodic Advertising Report
          LE Periodic Advertising Sync Lost
          LE Extended Scan Timeout
          LE Extended Advertising Set Terminated
          LE Scan Request Received
          LE Periodic Advertising Sync Transfer Rvc
          LE CIS Established
          LE CIS Request
          LE Create BIG Complete
          LE Terminate BIG Complete
          LE BIG Sync Estabilished Complete
          LE BIG Sync Lost
          LE BIG Info Advertising Report
          Unknown mask (0x0000020000000000)
> HCI Event: Command Complete (0x0e) plen 4                 #32 [hci1] 1.184630
      LE Set Event Mask (0x08|0x0001) ncmd 1
        Status: Success (0x00)
< HCI Command: Set Event Mask (0x03|0x0001) plen 8          #33 [hci1] 1.203964
        Mask: 0x2000800002008890
          Disconnection Complete
          Encryption Change
          Read Remote Version Information Complete
          Hardware Error
          Data Buffer Overflow
          Encryption Key Refresh Complete
          LE Meta
> HCI Event: Command Complete (0x0e) plen 4                 #34 [hci1] 1.204537
      Set Event Mask (0x03|0x0001) ncmd 1
        Status: Success (0x00)
< HCI Command: Read BD ADDR (0x04|0x0009) plen 0            #35 [hci1] 1.223952
> HCI Event: Command Complete (0x0e) plen 10                #36 [hci1] 1.224458
      Read BD ADDR (0x04|0x0009) ncmd 1
        Status: Success (0x00)
        Address: 00:00:00:00:00:00 (OUI 00-00-00)
< HCI Command: LE Set Random Address (0x08|0x0005) plen 6   #37 [hci1] 1.243964
        Address: D5:B6:CC:31:DB:3B (Static)
> HCI Event: Command Complete (0x0e) plen 4                 #38 [hci1] 1.244478
      LE Set Random Address (0x08|0x0005) ncmd 1
        Status: Success (0x00)
< HCI Command: LE Set Random Address (0x08|0x0005) plen 6   #39 [hci1] 1.373967
        Address: 48:61:8E:DB:C6:F9 (Resolvable)
> HCI Event: Command Complete (0x0e) plen 4                 #40 [hci1] 1.374490
      LE Set Random Address (0x08|0x0005) ncmd 1
        Status: Success (0x00)
< HCI Command: LE Extended Create... (0x08|0x0043) plen 26  #41 [hci1] 3.484292
        Filter policy: Accept list is not used (0x00)
        Own address type: Random (0x03)
        Peer address type: Public (0x00)
        Peer address: DF:A9:FF:F6:B1:1A (OUI DF-A9-FF)
        Initiating PHYs: 0x01
        Entry 0: LE 1M
          Scan interval: 60.000 msec (0x0060)
          Scan window: 60.000 msec (0x0060)
          Min connection interval: 30.00 msec (0x0018)
          Max connection interval: 50.00 msec (0x0028)
          Connection latency: 0 (0x0000)
          Supervision timeout: 4000 msec (0x0190)
          Min connection length: 0.000 msec (0x0000)
          Max connection length: 0.000 msec (0x0000)
> HCI Event: Command Status (0x0f) plen 4                   #42 [hci1] 3.485260
      LE Extended Create Connection (0x08|0x0043) ncmd 1
        Status: Success (0x00)
> HCI Event: LE Meta Event (0x3e) plen 31                   #43 [hci1] 3.531214
      LE Enhanced Connection Complete (0x0a)
        Status: Success (0x00)
        Handle: 180
        Role: Central (0x00)
        Peer address type: Public (0x00)
        Peer address: DF:A9:FF:F6:B1:1A (OUI DF-A9-FF)
        Local resolvable private address: 48:61:8E:DB:C6:F9 (Resolvable)
        Peer resolvable private address: 00:00:00:00:00:00 (Non-Resolvable)
        Connection interval: 50.00 msec (0x0028)
        Connection latency: 0 (0x0000)
        Supervision timeout: 4000 msec (0x0190)
        Central clock accuracy: 0x00
< HCI Command: LE Read Remote Used... (0x08|0x0016) plen 2  #44 [hci1] 3.544194
        Handle: 180 Address: DF:A9:FF:F6:B1:1A (OUI DF-A9-FF)
> HCI Event: Command Status (0x0f) plen 4                   #45 [hci1] 3.544692
      LE Read Remote Used Features (0x08|0x0016) ncmd 1
        Status: Success (0x00)
< HCI Command: LE Set PHY (0x08|0x0032) plen 7              #46 [hci1] 3.563992
        Handle: 180 Address: DF:A9:FF:F6:B1:1A (OUI DF-A9-FF)
        All PHYs preference: 0x00
        TX PHYs preference: 0x02
          LE 2M
        RX PHYs preference: 0x02
          LE 2M
        PHY options preference: Reserved (0x0000)
> HCI Event: Command Status (0x0f) plen 4                   #47 [hci1] 3.564648
      LE Set PHY (0x08|0x0032) ncmd 1
        Status: Success (0x00)
> HCI Event: LE Meta Event (0x3e) plen 12                   #48 [hci1] 3.682783
      LE Read Remote Used Features (0x04)
        Status: Success (0x00)
        Handle: 180 Address: DF:A9:FF:F6:B1:1A (OUI DF-A9-FF)
        Features: 0x2d 0x49 0x00 0xf7 0x67 0xd8 0x00 0x00
          LE Encryption
          Extended Reject Indication
          Peripheral-initiated Features Exchange
          LE Data Packet Length Extension
          LE 2M PHY
          LE Coded PHY
          Channel Selection Algorithm #2
          Periodic Advertising Sync Transfer - Sender
          Periodic Advertising Sync Transfer - Recipient
          Sleep Clock Accuracy Updates
          Connected Isochronous Stream - Central
          Connected Isochronous Stream - Peripheral
          Isochronous Broadcaster
          Synchronized Receiver
          Connected Isochronous Stream (Host Support)
          LE Power Control Request
          LE Power Control Request
          Connection Subrating
          Connection Subrating (Host Support)
          Unknown features (0x0000d80000000000)
> HCI Event: LE Meta Event (0x3e) plen 6                    #49 [hci1] 4.181984
      LE PHY Update Complete (0x0c)
        Status: Success (0x00)
        Handle: 180 Address: DF:A9:FF:F6:B1:1A (OUI DF-A9-FF)
        TX PHY: LE 2M (0x02)
        RX PHY: LE 2M (0x02)
< ACL Data TX: Handle 180 flags 0x00 dlen 11                #50 [hci1] 4.624147
      SMP: Pairing Request (0x01) len 6
        IO capability: DisplayOnly (0x00)
        OOB data: Authentication data not present (0x00)
        Authentication requirement: Bonding, No MITM, SC, No Keypresses (0x09)
        Max encryption key size: 16
        Initiator key distribution: EncKey IdKey (0x03)
        Responder key distribution: EncKey IdKey (0x03)
> HCI Event: Number of Completed Packets (0x13) plen 5      #51 [hci1] 4.632458
        Num handles: 1
        Handle: 180 Address: DF:A9:FF:F6:B1:1A (OUI DF-A9-FF)
        Count: 1
        #50: len 11 (11 Kb/s)
        Latency: 8 msec (8-8 msec ~8 msec)
> ACL Data RX: Handle 180 flags 0x02 dlen 11                #52 [hci1] 4.682494
      SMP: Pairing Response (0x02) len 6
        IO capability: KeyboardDisplay (0x04)
        OOB data: Authentication data not present (0x00)
        Authentication requirement: Bonding, MITM, SC, No Keypresses (0x0d)
        Max encryption key size: 16
        Initiator key distribution: IdKey (0x02)
        Responder key distribution: <none> (0x00)
< HCI Command: Host Number of Compl.. (0x03|0x0035) plen 5  #53 [hci1] 4.684068
        Num handles: 1
        Handle: 180 Address: DF:A9:FF:F6:B1:1A (OUI DF-A9-FF)
        Count: 1
< ACL Data TX: Handle 180 flags 0x00 dlen 27                #54 [hci1] 4.684171
< ACL Data TX: Handle 180 flags 0x01 dlen 27                #55 [hci1] 4.684177
< ACL Data TX: Handle 180 flags 0x01 dlen 15                #56 [hci1] 4.684179
      SMP: Pairing Public Key (0x0c) len 64
        X: 68f6ada634ce84d11617383d57f070fe3445c38b33b569efa5eb771a0dc8aea5
        Y: 83c407aaa8337331fdc418e55085d75e6c1c6e5d42f8bf9c18fb5a2a7d4f31aa
> HCI Event: Number of Completed Packets (0x13) plen 5      #57 [hci1] 4.732509
        Num handles: 1
        Handle: 180 Address: DF:A9:FF:F6:B1:1A (OUI DF-A9-FF)
        Count: 1
        #54: len 27 (4 Kb/s)
        Latency: 48 msec (8-48 msec ~28 msec)
> HCI Event: Number of Completed Packets (0x13) plen 5      #58 [hci1] 4.732953
        Num handles: 1
        Handle: 180 Address: DF:A9:FF:F6:B1:1A (OUI DF-A9-FF)
        Count: 1
        #55: len 27 (4 Kb/s)
        Latency: 48 msec (8-48 msec ~38 msec)
> HCI Event: Number of Completed Packets (0x13) plen 5      #59 [hci1] 4.733440
        Num handles: 1
        Handle: 180 Address: DF:A9:FF:F6:B1:1A (OUI DF-A9-FF)
        Count: 1
        #56: len 15 (2 Kb/s)
        Latency: 49 msec (8-49 msec ~43 msec)
> ACL Data RX: Handle 180 flags 0x02 dlen 27                #60 [hci1] 4.782718
> ACL Data RX: Handle 180 flags 0x01 dlen 27                #61 [hci1] 4.783125
> ACL Data RX: Handle 180 flags 0x01 dlen 15                #62 [hci1] 4.783549
      SMP: Pairing Public Key (0x0c) len 64
        X: 4d2f778e54e735295046967db574d560b8b8a6a6557b30e6ce314c1aec3d4063
        Y: ca68cdafc504c76ea4a92c20427f5eea365e6c1f0cbcb9fe24214acceb473d24
< HCI Command: Host Number of Compl.. (0x03|0x0035) plen 5  #63 [hci1] 4.784144
        Num handles: 1
        Handle: 180 Address: DF:A9:FF:F6:B1:1A (OUI DF-A9-FF)
        Count: 1
< HCI Command: Host Number of Compl.. (0x03|0x0035) plen 5  #64 [hci1] 4.784255
        Num handles: 1
        Handle: 180 Address: DF:A9:FF:F6:B1:1A (OUI DF-A9-FF)
        Count: 1
< HCI Command: Host Number of Compl.. (0x03|0x0035) plen 5  #65 [hci1] 4.784523
        Num handles: 1
        Handle: 180 Address: DF:A9:FF:F6:B1:1A (OUI DF-A9-FF)
        Count: 1
< ACL Data TX: Handle 180 flags 0x00 dlen 21                #66 [hci1] 4.784532
      SMP: Pairing Confirm (0x03) len 16
        Confim value: dcd7759420c21b3946df375962276208
> HCI Event: Number of Completed Packets (0x13) plen 5      #67 [hci1] 4.832470
        Num handles: 1
        Handle: 180 Address: DF:A9:FF:F6:B1:1A (OUI DF-A9-FF)
        Count: 1
        #66: len 21 (3 Kb/s)
        Latency: 47 msec (8-49 msec ~45 msec)
> ACL Data RX: Handle 180 flags 0x02 dlen 21                #68 [hci1] 5.682702
      SMP: Pairing Confirm (0x03) len 16
        Confim value: 66579f4feb92bf033ad37e01ed74df72
< HCI Command: Host Number of Compl.. (0x03|0x0035) plen 5  #69 [hci1] 5.684530
        Num handles: 1
        Handle: 180 Address: DF:A9:FF:F6:B1:1A (OUI DF-A9-FF)
        Count: 1
< ACL Data TX: Handle 180 flags 0x00 dlen 21                #70 [hci1] 5.684773
      SMP: Pairing Random (0x04) len 16
        Random value: 555cc64d02679f89a05211af56d8b3da
> HCI Event: Number of Completed Packets (0x13) plen 5      #71 [hci1] 5.732440
        Num handles: 1
        Handle: 180 Address: DF:A9:FF:F6:B1:1A (OUI DF-A9-FF)
        Count: 1
        #70: len 21 (3 Kb/s)
        Latency: 47 msec (8-49 msec ~46 msec)
> ACL Data RX: Handle 180 flags 0x02 dlen 21                #72 [hci1] 5.982659
      SMP: Pairing Random (0x04) len 16
        Random value: 6d9afb30d979c4df2a285c43d0fd5f22
< HCI Command: Host Number of Compl.. (0x03|0x0035) plen 5  #73 [hci1] 5.984848
        Num handles: 1
        Handle: 180 Address: DF:A9:FF:F6:B1:1A (OUI DF-A9-FF)
        Count: 1
< ACL Data TX: Handle 180 flags 0x00 dlen 21                #74 [hci1] 5.985079
      SMP: Pairing Confirm (0x03) len 16
        Confim value: 6b351e5385b4dce89eb327c35f02edb5
> HCI Event: Number of Completed Packets (0x13) plen 5      #75 [hci1] 6.032559
        Num handles: 1
        Handle: 180 Address: DF:A9:FF:F6:B1:1A (OUI DF-A9-FF)
        Count: 1
        #74: len 21 (3 Kb/s)
        Latency: 47 msec (8-49 msec ~47 msec)
> ACL Data RX: Handle 180 flags 0x02 dlen 21                #76 [hci1] 6.082671
      SMP: Pairing Confirm (0x03) len 16
        Confim value: 58a3fab48502a17bc03e4f578e62caba
< HCI Command: Host Number of Compl.. (0x03|0x0035) plen 5  #77 [hci1] 6.084261
        Num handles: 1
        Handle: 180 Address: DF:A9:FF:F6:B1:1A (OUI DF-A9-FF)
        Count: 1
< ACL Data TX: Handle 180 flags 0x00 dlen 21                #78 [hci1] 6.084406
      SMP: Pairing Random (0x04) len 16
        Random value: bc235a02440d0c3424a2acf8fd71a45c
> HCI Event: Number of Completed Packets (0x13) plen 5      #79 [hci1] 6.132456
        Num handles: 1
        Handle: 180 Address: DF:A9:FF:F6:B1:1A (OUI DF-A9-FF)
        Count: 1
        #78: len 21 (3 Kb/s)
        Latency: 48 msec (8-49 msec ~47 msec)
> ACL Data RX: Handle 180 flags 0x02 dlen 21                #80 [hci1] 6.382624
      SMP: Pairing Random (0x04) len 16
        Random value: 5bc3c54f582163f1b78f792436a03dd1
< HCI Command: Host Number of Compl.. (0x03|0x0035) plen 5  #81 [hci1] 6.384235
        Num handles: 1
        Handle: 180 Address: DF:A9:FF:F6:B1:1A (OUI DF-A9-FF)
        Count: 1
< ACL Data TX: Handle 180 flags 0x00 dlen 21                #82 [hci1] 6.384318
      SMP: Pairing Confirm (0x03) len 16
        Confim value: 865d36ef75b7453b759049390a0e329d
> HCI Event: Number of Completed Packets (0x13) plen 5      #83 [hci1] 6.432561
        Num handles: 1
        Handle: 180 Address: DF:A9:FF:F6:B1:1A (OUI DF-A9-FF)
        Count: 1
        #82: len 21 (3 Kb/s)
        Latency: 48 msec (8-49 msec ~47 msec)
> ACL Data RX: Handle 180 flags 0x02 dlen 21                #84 [hci1] 6.482636
      SMP: Pairing Confirm (0x03) len 16
        Confim value: c9598c113709ff7b02458ba49dbb68a1
< HCI Command: Host Number of Compl.. (0x03|0x0035) plen 5  #85 [hci1] 6.484519
        Num handles: 1
        Handle: 180 Address: DF:A9:FF:F6:B1:1A (OUI DF-A9-FF)
        Count: 1
< ACL Data TX: Handle 180 flags 0x00 dlen 21                #86 [hci1] 6.484742
      SMP: Pairing Random (0x04) len 16
        Random value: cadd27bd58e945097b00bad7aca1ba32
> HCI Event: Number of Completed Packets (0x13) plen 5      #87 [hci1] 6.532576
        Num handles: 1
        Handle: 180 Address: DF:A9:FF:F6:B1:1A (OUI DF-A9-FF)
        Count: 1
        #86: len 21 (3 Kb/s)
        Latency: 47 msec (8-49 msec ~47 msec)
> ACL Data RX: Handle 180 flags 0x02 dlen 21                #88 [hci1] 6.782648
      SMP: Pairing Random (0x04) len 16
        Random value: a99287b61a78f7f64e634db811e115c8
< HCI Command: Host Number of Compl.. (0x03|0x0035) plen 5  #89 [hci1] 6.784567
        Num handles: 1
        Handle: 180 Address: DF:A9:FF:F6:B1:1A (OUI DF-A9-FF)
        Count: 1
< ACL Data TX: Handle 180 flags 0x00 dlen 21                #90 [hci1] 6.784800
      SMP: Pairing Confirm (0x03) len 16
        Confim value: d5a6011485646a840e811362e5bde8b3
> HCI Event: Number of Completed Packets (0x13) plen 5      #91 [hci1] 6.832459
        Num handles: 1
        Handle: 180 Address: DF:A9:FF:F6:B1:1A (OUI DF-A9-FF)
        Count: 1
        #90: len 21 (3 Kb/s)
        Latency: 47 msec (8-49 msec ~47 msec)
> ACL Data RX: Handle 180 flags 0x02 dlen 21                #92 [hci1] 6.882589
      SMP: Pairing Confirm (0x03) len 16
        Confim value: f1edc2b455dc598b1f385c1f6ab88a75
< HCI Command: Host Number of Compl.. (0x03|0x0035) plen 5  #93 [hci1] 6.884286
        Num handles: 1
        Handle: 180 Address: DF:A9:FF:F6:B1:1A (OUI DF-A9-FF)
        Count: 1
< ACL Data TX: Handle 180 flags 0x00 dlen 21                #94 [hci1] 6.884383
      SMP: Pairing Random (0x04) len 16
        Random value: 6e64e79f33b2e374394db8ab2d95badd
> HCI Event: Number of Completed Packets (0x13) plen 5      #95 [hci1] 6.932574
        Num handles: 1
        Handle: 180 Address: DF:A9:FF:F6:B1:1A (OUI DF-A9-FF)
        Count: 1
        #94: len 21 (3 Kb/s)
        Latency: 48 msec (8-49 msec ~47 msec)
> ACL Data RX: Handle 180 flags 0x02 dlen 21                #96 [hci1] 7.182700
      SMP: Pairing Random (0x04) len 16
        Random value: b5e7f87e6c0ea6382be56c788eb2eeae
< HCI Command: Host Number of Compl.. (0x03|0x0035) plen 5  #97 [hci1] 7.184606
        Num handles: 1
        Handle: 180 Address: DF:A9:FF:F6:B1:1A (OUI DF-A9-FF)
        Count: 1
< ACL Data TX: Handle 180 flags 0x00 dlen 21                #98 [hci1] 7.184821
      SMP: Pairing Confirm (0x03) len 16
        Confim value: bb744140df4d9625f0e27de80846d75e
> HCI Event: Number of Completed Packets (0x13) plen 5      #99 [hci1] 7.232422
        Num handles: 1
        Handle: 180 Address: DF:A9:FF:F6:B1:1A (OUI DF-A9-FF)
        Count: 1
        #98: len 21 (3 Kb/s)
        Latency: 47 msec (8-49 msec ~47 msec)
> ACL Data RX: Handle 180 flags 0x02 dlen 21               #100 [hci1] 7.282632
      SMP: Pairing Confirm (0x03) len 16
        Confim value: f40cdeed76b5f0585f67d5dc43bbd924
< HCI Command: Host Number of Comp.. (0x03|0x0035) plen 5  #101 [hci1] 7.284399
        Num handles: 1
        Handle: 180 Address: DF:A9:FF:F6:B1:1A (OUI DF-A9-FF)
        Count: 1
< ACL Data TX: Handle 180 flags 0x00 dlen 21               #102 [hci1] 7.284558
      SMP: Pairing Random (0x04) len 16
        Random value: e2838e9a8cc6964353c850fef72c5ceb
> HCI Event: Number of Completed Packets (0x13) plen 5     #103 [hci1] 7.332442
        Num handles: 1
        Handle: 180 Address: DF:A9:FF:F6:B1:1A (OUI DF-A9-FF)
        Count: 1
        #102: len 21 (3 Kb/s)
        Latency: 47 msec (8-49 msec ~47 msec)
> ACL Data RX: Handle 180 flags 0x02 dlen 21               #104 [hci1] 7.582645
      SMP: Pairing Random (0x04) len 16
        Random value: 1ae30c00dab6d43fcc96ac1e18430c6e
< HCI Command: Host Number of Comp.. (0x03|0x0035) plen 5  #105 [hci1] 7.584609
        Num handles: 1
        Handle: 180 Address: DF:A9:FF:F6:B1:1A (OUI DF-A9-FF)
        Count: 1
< ACL Data TX: Handle 180 flags 0x00 dlen 21               #106 [hci1] 7.584833
      SMP: Pairing Confirm (0x03) len 16
        Confim value: 0efc62ce7cb0656a7c5a7766ffc9b878
> HCI Event: Number of Completed Packets (0x13) plen 5     #107 [hci1] 7.632509
        Num handles: 1
        Handle: 180 Address: DF:A9:FF:F6:B1:1A (OUI DF-A9-FF)
        Count: 1
        #106: len 21 (3 Kb/s)
        Latency: 47 msec (8-49 msec ~47 msec)
> ACL Data RX: Handle 180 flags 0x02 dlen 21               #108 [hci1] 7.682614
      SMP: Pairing Confirm (0x03) len 16
        Confim value: f2aa3a01a6ce3704d6e218cf1c6bc065
< HCI Command: Host Number of Comp.. (0x03|0x0035) plen 5  #109 [hci1] 7.684433
        Num handles: 1
        Handle: 180 Address: DF:A9:FF:F6:B1:1A (OUI DF-A9-FF)
        Count: 1
< ACL Data TX: Handle 180 flags 0x00 dlen 21               #110 [hci1] 7.684614
      SMP: Pairing Random (0x04) len 16
        Random value: 15536596b6fc3db1c86b2b19701bcf5c
> HCI Event: Number of Completed Packets (0x13) plen 5     #111 [hci1] 7.732428
        Num handles: 1
        Handle: 180 Address: DF:A9:FF:F6:B1:1A (OUI DF-A9-FF)
        Count: 1
        #110: len 21 (3 Kb/s)
        Latency: 47 msec (8-49 msec ~47 msec)
> ACL Data RX: Handle 180 flags 0x02 dlen 21               #112 [hci1] 7.982690
      SMP: Pairing Random (0x04) len 16
        Random value: b6e8f7d4338027d5ed3621a15e06f42f
< HCI Command: Host Number of Comp.. (0x03|0x0035) plen 5  #113 [hci1] 7.984725
        Num handles: 1
        Handle: 180 Address: DF:A9:FF:F6:B1:1A (OUI DF-A9-FF)
        Count: 1
< ACL Data TX: Handle 180 flags 0x00 dlen 21               #114 [hci1] 7.984946
      SMP: Pairing Confirm (0x03) len 16
        Confim value: 3e9bb534dfcff9e10719ea8084471c9a
> HCI Event: Number of Completed Packets (0x13) plen 5     #115 [hci1] 8.032404
        Num handles: 1
        Handle: 180 Address: DF:A9:FF:F6:B1:1A (OUI DF-A9-FF)
        Count: 1
        #114: len 21 (3 Kb/s)
        Latency: 47 msec (8-49 msec ~47 msec)
> ACL Data RX: Handle 180 flags 0x02 dlen 21               #116 [hci1] 8.082694
      SMP: Pairing Confirm (0x03) len 16
        Confim value: c2cd521a0aa7fa2d41c53aa475a779f8
< HCI Command: Host Number of Comp.. (0x03|0x0035) plen 5  #117 [hci1] 8.084492
        Num handles: 1
        Handle: 180 Address: DF:A9:FF:F6:B1:1A (OUI DF-A9-FF)
        Count: 1
< ACL Data TX: Handle 180 flags 0x00 dlen 21               #118 [hci1] 8.084709
      SMP: Pairing Random (0x04) len 16
        Random value: c9ad9f2c3f295ebd5ad5e1c3cfeb215c
> HCI Event: Number of Completed Packets (0x13) plen 5     #119 [hci1] 8.132516
        Num handles: 1
        Handle: 180 Address: DF:A9:FF:F6:B1:1A (OUI DF-A9-FF)
        Count: 1
        #118: len 21 (3 Kb/s)
        Latency: 47 msec (8-49 msec ~47 msec)
> ACL Data RX: Handle 180 flags 0x02 dlen 21               #120 [hci1] 8.382605
      SMP: Pairing Random (0x04) len 16
        Random value: a79630d482bd84028cc7203c4cab6c5b
< HCI Command: Host Number of Comp.. (0x03|0x0035) plen 5  #121 [hci1] 8.384280
        Num handles: 1
        Handle: 180 Address: DF:A9:FF:F6:B1:1A (OUI DF-A9-FF)
        Count: 1
< ACL Data TX: Handle 180 flags 0x00 dlen 21               #122 [hci1] 8.384412
      SMP: Pairing Confirm (0x03) len 16
        Confim value: 2b792b5168c9364282ca63e3a3f4929b
> HCI Event: Number of Completed Packets (0x13) plen 5     #123 [hci1] 8.432494
        Num handles: 1
        Handle: 180 Address: DF:A9:FF:F6:B1:1A (OUI DF-A9-FF)
        Count: 1
        #122: len 21 (3 Kb/s)
        Latency: 48 msec (8-49 msec ~47 msec)
> ACL Data RX: Handle 180 flags 0x02 dlen 21               #124 [hci1] 8.482564
      SMP: Pairing Confirm (0x03) len 16
        Confim value: 950b0754561fce319be2b22a80a39f14
< HCI Command: Host Number of Comp.. (0x03|0x0035) plen 5  #125 [hci1] 8.484563
        Num handles: 1
        Handle: 180 Address: DF:A9:FF:F6:B1:1A (OUI DF-A9-FF)
        Count: 1
< ACL Data TX: Handle 180 flags 0x00 dlen 21               #126 [hci1] 8.484773
      SMP: Pairing Random (0x04) len 16
        Random value: 312cdf99c9491988e877355a9a8321c6
> HCI Event: Number of Completed Packets (0x13) plen 5     #127 [hci1] 8.532416
        Num handles: 1
        Handle: 180 Address: DF:A9:FF:F6:B1:1A (OUI DF-A9-FF)
        Count: 1
        #126: len 21 (3 Kb/s)
        Latency: 47 msec (8-49 msec ~47 msec)
> ACL Data RX: Handle 180 flags 0x02 dlen 21               #128 [hci1] 8.782580
      SMP: Pairing Random (0x04) len 16
        Random value: 48ce6a1915ff0f10e58a3f680f24779c
< HCI Command: Host Number of Comp.. (0x03|0x0035) plen 5  #129 [hci1] 8.784590
        Num handles: 1
        Handle: 180 Address: DF:A9:FF:F6:B1:1A (OUI DF-A9-FF)
        Count: 1
< ACL Data TX: Handle 180 flags 0x00 dlen 21               #130 [hci1] 8.784781
      SMP: Pairing Confirm (0x03) len 16
        Confim value: 8cb1a4d5b440b550999e795969b1e2c2
> HCI Event: Number of Completed Packets (0x13) plen 5     #131 [hci1] 8.832373
        Num handles: 1
        Handle: 180 Address: DF:A9:FF:F6:B1:1A (OUI DF-A9-FF)
        Count: 1
        #130: len 21 (3 Kb/s)
        Latency: 47 msec (8-49 msec ~47 msec)
> ACL Data RX: Handle 180 flags 0x02 dlen 21               #132 [hci1] 8.882617
      SMP: Pairing Confirm (0x03) len 16
        Confim value: 2c68b38758141d44dd76d5f34686501e
< HCI Command: Host Number of Comp.. (0x03|0x0035) plen 5  #133 [hci1] 8.884357
        Num handles: 1
        Handle: 180 Address: DF:A9:FF:F6:B1:1A (OUI DF-A9-FF)
        Count: 1
< ACL Data TX: Handle 180 flags 0x00 dlen 21               #134 [hci1] 8.884431
      SMP: Pairing Random (0x04) len 16
        Random value: a987d808e808655d558dfc1155a0b492
> HCI Event: Number of Completed Packets (0x13) plen 5     #135 [hci1] 8.932394
        Num handles: 1
        Handle: 180 Address: DF:A9:FF:F6:B1:1A (OUI DF-A9-FF)
        Count: 1
        #134: len 21 (3 Kb/s)
        Latency: 47 msec (8-49 msec ~47 msec)
> ACL Data RX: Handle 180 flags 0x02 dlen 21               #136 [hci1] 9.182653
      SMP: Pairing Random (0x04) len 16
        Random value: 37b29bfb78152f87750052dc15a15cd9
< HCI Command: Host Number of Comp.. (0x03|0x0035) plen 5  #137 [hci1] 9.184516
        Num handles: 1
        Handle: 180 Address: DF:A9:FF:F6:B1:1A (OUI DF-A9-FF)
        Count: 1
< ACL Data TX: Handle 180 flags 0x00 dlen 21               #138 [hci1] 9.184689
      SMP: Pairing Confirm (0x03) len 16
        Confim value: 6351ef973dd1b607ad28dc0c0f958897
> HCI Event: Number of Completed Packets (0x13) plen 5     #139 [hci1] 9.232555
        Num handles: 1
        Handle: 180 Address: DF:A9:FF:F6:B1:1A (OUI DF-A9-FF)
        Count: 1
        #138: len 21 (3 Kb/s)
        Latency: 47 msec (8-49 msec ~47 msec)
> ACL Data RX: Handle 180 flags 0x02 dlen 21               #140 [hci1] 9.282582
      SMP: Pairing Confirm (0x03) len 16
        Confim value: c774b58d68f759ce87f5ff67e80a9c58
< HCI Command: Host Number of Comp.. (0x03|0x0035) plen 5  #141 [hci1] 9.284586
        Num handles: 1
        Handle: 180 Address: DF:A9:FF:F6:B1:1A (OUI DF-A9-FF)
        Count: 1
< ACL Data TX: Handle 180 flags 0x00 dlen 21               #142 [hci1] 9.284860
      SMP: Pairing Random (0x04) len 16
        Random value: 6ad8f13724432c7fd6001c45ff744123
> HCI Event: Number of Completed Packets (0x13) plen 5     #143 [hci1] 9.332382
        Num handles: 1
        Handle: 180 Address: DF:A9:FF:F6:B1:1A (OUI DF-A9-FF)
        Count: 1
        #142: len 21 (3 Kb/s)
        Latency: 47 msec (8-49 msec ~47 msec)
> ACL Data RX: Handle 180 flags 0x02 dlen 21               #144 [hci1] 9.582520
      SMP: Pairing Random (0x04) len 16
        Random value: 52a2f8147a118630fbea6f930a959e3c
< HCI Command: Host Number of Comp.. (0x03|0x0035) plen 5  #145 [hci1] 9.584149
        Num handles: 1
        Handle: 180 Address: DF:A9:FF:F6:B1:1A (OUI DF-A9-FF)
        Count: 1
< ACL Data TX: Handle 180 flags 0x00 dlen 21               #146 [hci1] 9.584226
      SMP: Pairing Confirm (0x03) len 16
        Confim value: 5b96774429d828c1ef6201c54eb5ad77
> HCI Event: Number of Completed Packets (0x13) plen 5     #147 [hci1] 9.632366
        Num handles: 1
        Handle: 180 Address: DF:A9:FF:F6:B1:1A (OUI DF-A9-FF)
        Count: 1
        #146: len 21 (3 Kb/s)
        Latency: 48 msec (8-49 msec ~47 msec)
> ACL Data RX: Handle 180 flags 0x02 dlen 21               #148 [hci1] 9.682575
      SMP: Pairing Confirm (0x03) len 16
        Confim value: c982882757701d220ec9e7ecf769e28f
< HCI Command: Host Number of Comp.. (0x03|0x0035) plen 5  #149 [hci1] 9.684156
        Num handles: 1
        Handle: 180 Address: DF:A9:FF:F6:B1:1A (OUI DF-A9-FF)
        Count: 1
< ACL Data TX: Handle 180 flags 0x00 dlen 21               #150 [hci1] 9.684235
      SMP: Pairing Random (0x04) len 16
        Random value: ebbb5e14c8a6b9622f296d277ff3bf29
> HCI Event: Number of Completed Packets (0x13) plen 5     #151 [hci1] 9.732381
        Num handles: 1
        Handle: 180 Address: DF:A9:FF:F6:B1:1A (OUI DF-A9-FF)
        Count: 1
        #150: len 21 (3 Kb/s)
        Latency: 48 msec (8-49 msec ~48 msec)
> ACL Data RX: Handle 180 flags 0x02 dlen 21               #152 [hci1] 9.982536
      SMP: Pairing Random (0x04) len 16
        Random value: b43ff63d2644fb157148e9c4dbae042e
< HCI Command: Host Number of Comp.. (0x03|0x0035) plen 5  #153 [hci1] 9.984653
        Num handles: 1
        Handle: 180 Address: DF:A9:FF:F6:B1:1A (OUI DF-A9-FF)
        Count: 1
< ACL Data TX: Handle 180 flags 0x00 dlen 21               #154 [hci1] 9.984877
      SMP: Pairing Confirm (0x03) len 16
        Confim value: 176e9d4dd481a3a7254f76ff33042cf8
> HCI Event: Number of Completed Packets (0x13) plen 5    #155 [hci1] 10.032468
        Num handles: 1
        Handle: 180 Address: DF:A9:FF:F6:B1:1A (OUI DF-A9-FF)
        Count: 1
        #154: len 21 (3 Kb/s)
        Latency: 47 msec (8-49 msec ~47 msec)
> ACL Data RX: Handle 180 flags 0x02 dlen 21              #156 [hci1] 10.082549
      SMP: Pairing Confirm (0x03) len 16
        Confim value: 3d4e22a642f3b0aa5fedc6884456f39a
< HCI Command: Host Number of Com.. (0x03|0x0035) plen 5  #157 [hci1] 10.084445
        Num handles: 1
        Handle: 180 Address: DF:A9:FF:F6:B1:1A (OUI DF-A9-FF)
        Count: 1
< ACL Data TX: Handle 180 flags 0x00 dlen 21              #158 [hci1] 10.084664
      SMP: Pairing Random (0x04) len 16
        Random value: 85e67448a15f56bd27e3a3cf1d832325
> HCI Event: Number of Completed Packets (0x13) plen 5    #159 [hci1] 10.132364
        Num handles: 1
        Handle: 180 Address: DF:A9:FF:F6:B1:1A (OUI DF-A9-FF)
        Count: 1
        #158: len 21 (3 Kb/s)
        Latency: 47 msec (8-49 msec ~47 msec)
> ACL Data RX: Handle 180 flags 0x02 dlen 21              #160 [hci1] 10.382471
      SMP: Pairing Random (0x04) len 16
        Random value: bb6b4a8eca40b37f175c58eab6e09258
< HCI Command: Host Number of Com.. (0x03|0x0035) plen 5  #161 [hci1] 10.384644
        Num handles: 1
        Handle: 180 Address: DF:A9:FF:F6:B1:1A (OUI DF-A9-FF)
        Count: 1
< ACL Data TX: Handle 180 flags 0x00 dlen 21              #162 [hci1] 10.384859
      SMP: Pairing Confirm (0x03) len 16
        Confim value: 9993e3aa5cd341896c0f807dcdd1ff06
> HCI Event: Number of Completed Packets (0x13) plen 5    #163 [hci1] 10.432357
        Num handles: 1
        Handle: 180 Address: DF:A9:FF:F6:B1:1A (OUI DF-A9-FF)
        Count: 1
        #162: len 21 (3 Kb/s)
        Latency: 47 msec (8-49 msec ~47 msec)
> ACL Data RX: Handle 180 flags 0x02 dlen 21              #164 [hci1] 10.482611
      SMP: Pairing Confirm (0x03) len 16
        Confim value: dcf57b71ce4e60e8aec6da570885acb5
< HCI Command: Host Number of Com.. (0x03|0x0035) plen 5  #165 [hci1] 10.484373
        Num handles: 1
        Handle: 180 Address: DF:A9:FF:F6:B1:1A (OUI DF-A9-FF)
        Count: 1
< ACL Data TX: Handle 180 flags 0x00 dlen 21              #166 [hci1] 10.484486
      SMP: Pairing Random (0x04) len 16
        Random value: 3fd3ce4faf02be7293595bb7c6e45c58
> HCI Event: Number of Completed Packets (0x13) plen 5    #167 [hci1] 10.532449
        Num handles: 1
        Handle: 180 Address: DF:A9:FF:F6:B1:1A (OUI DF-A9-FF)
        Count: 1
        #166: len 21 (3 Kb/s)
        Latency: 47 msec (8-49 msec ~47 msec)
> ACL Data RX: Handle 180 flags 0x02 dlen 21              #168 [hci1] 10.782551
      SMP: Pairing Random (0x04) len 16
        Random value: 0546e961f2d413f568a88ebd06598da3
< HCI Command: Host Number of Com.. (0x03|0x0035) plen 5  #169 [hci1] 10.784672
        Num handles: 1
        Handle: 180 Address: DF:A9:FF:F6:B1:1A (OUI DF-A9-FF)
        Count: 1
< ACL Data TX: Handle 180 flags 0x00 dlen 21              #170 [hci1] 10.784918
      SMP: Pairing Confirm (0x03) len 16
        Confim value: d5eba25035de91b1e02ea5d21271fe56
> HCI Event: Number of Completed Packets (0x13) plen 5    #171 [hci1] 10.832353
        Num handles: 1
        Handle: 180 Address: DF:A9:FF:F6:B1:1A (OUI DF-A9-FF)
        Count: 1
        #170: len 21 (3 Kb/s)
        Latency: 47 msec (8-49 msec ~47 msec)
> ACL Data RX: Handle 180 flags 0x02 dlen 21              #172 [hci1] 10.882625
      SMP: Pairing Confirm (0x03) len 16
        Confim value: b32c96c32cc2b2d74b576bce0ad2d09d
< HCI Command: Host Number of Com.. (0x03|0x0035) plen 5  #173 [hci1] 10.884296
        Num handles: 1
        Handle: 180 Address: DF:A9:FF:F6:B1:1A (OUI DF-A9-FF)
        Count: 1
< ACL Data TX: Handle 180 flags 0x00 dlen 21              #174 [hci1] 10.884439
      SMP: Pairing Random (0x04) len 16
        Random value: 1f855a6f6c3560debd84e2affc6847b6
> HCI Event: Number of Completed Packets (0x13) plen 5    #175 [hci1] 10.932338
        Num handles: 1
        Handle: 180 Address: DF:A9:FF:F6:B1:1A (OUI DF-A9-FF)
        Count: 1
        #174: len 21 (3 Kb/s)
        Latency: 47 msec (8-49 msec ~47 msec)
> ACL Data RX: Handle 180 flags 0x02 dlen 21              #176 [hci1] 11.182611
      SMP: Pairing Random (0x04) len 16
        Random value: 6d31084f6d13bf4321eba3377a8d7b38
< HCI Command: Host Number of Com.. (0x03|0x0035) plen 5  #177 [hci1] 11.184667
        Num handles: 1
        Handle: 180 Address: DF:A9:FF:F6:B1:1A (OUI DF-A9-FF)
        Count: 1
< ACL Data TX: Handle 180 flags 0x00 dlen 21              #178 [hci1] 11.184940
      SMP: Pairing Confirm (0x03) len 16
        Confim value: c8c50692335280026b977424a139ae4e
> HCI Event: Number of Completed Packets (0x13) plen 5    #179 [hci1] 11.232353
        Num handles: 1
        Handle: 180 Address: DF:A9:FF:F6:B1:1A (OUI DF-A9-FF)
        Count: 1
        #178: len 21 (3 Kb/s)
        Latency: 47 msec (8-49 msec ~47 msec)
> ACL Data RX: Handle 180 flags 0x02 dlen 21              #180 [hci1] 11.282588
      SMP: Pairing Confirm (0x03) len 16
        Confim value: d9d792c465a509b8128956fbacf41244
< HCI Command: Host Number of Com.. (0x03|0x0035) plen 5  #181 [hci1] 11.284524
        Num handles: 1
        Handle: 180 Address: DF:A9:FF:F6:B1:1A (OUI DF-A9-FF)
        Count: 1
< ACL Data TX: Handle 180 flags 0x00 dlen 21              #182 [hci1] 11.284796
      SMP: Pairing Random (0x04) len 16
        Random value: 16d5bf664139eda2b5425496665d7eed
> HCI Event: Number of Completed Packets (0x13) plen 5    #183 [hci1] 11.332330
        Num handles: 1
        Handle: 180 Address: DF:A9:FF:F6:B1:1A (OUI DF-A9-FF)
        Count: 1
        #182: len 21 (3 Kb/s)
        Latency: 47 msec (8-49 msec ~47 msec)
> ACL Data RX: Handle 180 flags 0x02 dlen 21              #184 [hci1] 11.582604
      SMP: Pairing Random (0x04) len 16
        Random value: 12cd1b31464d9d704026e98ffe2b1f80
< HCI Command: Host Number of Com.. (0x03|0x0035) plen 5  #185 [hci1] 11.584728
        Num handles: 1
        Handle: 180 Address: DF:A9:FF:F6:B1:1A (OUI DF-A9-FF)
        Count: 1
< ACL Data TX: Handle 180 flags 0x00 dlen 21              #186 [hci1] 11.584955
      SMP: Pairing Confirm (0x03) len 16
        Confim value: 31478591a4c1748a77f5f143e27274d4
> HCI Event: Number of Completed Packets (0x13) plen 5    #187 [hci1] 11.632412
        Num handles: 1
        Handle: 180 Address: DF:A9:FF:F6:B1:1A (OUI DF-A9-FF)
        Count: 1
        #186: len 21 (3 Kb/s)
        Latency: 47 msec (8-49 msec ~47 msec)
> ACL Data RX: Handle 180 flags 0x02 dlen 21              #188 [hci1] 11.682640
      SMP: Pairing Confirm (0x03) len 16
        Confim value: c1a0a40dc78ff49cf78e45d59f3f13c9
< HCI Command: Host Number of Com.. (0x03|0x0035) plen 5  #189 [hci1] 11.684516
        Num handles: 1
        Handle: 180 Address: DF:A9:FF:F6:B1:1A (OUI DF-A9-FF)
        Count: 1
< ACL Data TX: Handle 180 flags 0x00 dlen 21              #190 [hci1] 11.684751
      SMP: Pairing Random (0x04) len 16
        Random value: 6500c95219dd01e09d1e63f87b860481
> HCI Event: Number of Completed Packets (0x13) plen 5    #191 [hci1] 11.732408
        Num handles: 1
        Handle: 180 Address: DF:A9:FF:F6:B1:1A (OUI DF-A9-FF)
        Count: 1
        #190: len 21 (3 Kb/s)
        Latency: 47 msec (8-49 msec ~47 msec)
> ACL Data RX: Handle 180 flags 0x02 dlen 21              #192 [hci1] 11.982630
      SMP: Pairing Random (0x04) len 16
        Random value: 4ffcd91fcb12d2c5019cf740c0248024
< HCI Command: Host Number of Com.. (0x03|0x0035) plen 5  #193 [hci1] 11.984417
        Num handles: 1
        Handle: 180 Address: DF:A9:FF:F6:B1:1A (OUI DF-A9-FF)
        Count: 1
< ACL Data TX: Handle 180 flags 0x00 dlen 21              #194 [hci1] 11.984569
      SMP: Pairing Confirm (0x03) len 16
        Confim value: 9bcc2fea40e305d3e0ec0621949bdeab
> HCI Event: Number of Completed Packets (0x13) plen 5    #195 [hci1] 12.032319
        Num handles: 1
        Handle: 180 Address: DF:A9:FF:F6:B1:1A (OUI DF-A9-FF)
        Count: 1
        #194: len 21 (3 Kb/s)
        Latency: 47 msec (8-49 msec ~47 msec)
> ACL Data RX: Handle 180 flags 0x02 dlen 21              #196 [hci1] 12.082477
      SMP: Pairing Confirm (0x03) len 16
        Confim value: 387caf572d723b6f2ee08f1e61b1bd26
< HCI Command: Host Number of Com.. (0x03|0x0035) plen 5  #197 [hci1] 12.084593
        Num handles: 1
        Handle: 180 Address: DF:A9:FF:F6:B1:1A (OUI DF-A9-FF)
        Count: 1
< ACL Data TX: Handle 180 flags 0x00 dlen 21              #198 [hci1] 12.084799
      SMP: Pairing Random (0x04) len 16
        Random value: 47e1f6006d79c974bd9d9e1ee31049e7
> HCI Event: Number of Completed Packets (0x13) plen 5    #199 [hci1] 12.132305
        Num handles: 1
        Handle: 180 Address: DF:A9:FF:F6:B1:1A (OUI DF-A9-FF)
        Count: 1
        #198: len 21 (3 Kb/s)
        Latency: 47 msec (8-49 msec ~47 msec)
> ACL Data RX: Handle 180 flags 0x02 dlen 21              #200 [hci1] 12.382525
      SMP: Pairing Random (0x04) len 16
        Random value: c3df35738935c2cce2cda1022cabe10d
< HCI Command: Host Number of Com.. (0x03|0x0035) plen 5  #201 [hci1] 12.384736
        Num handles: 1
        Handle: 180 Address: DF:A9:FF:F6:B1:1A (OUI DF-A9-FF)
        Count: 1
< ACL Data TX: Handle 180 flags 0x00 dlen 21              #202 [hci1] 12.384961
      SMP: Pairing Confirm (0x03) len 16
        Confim value: 84bf04f615cb40e7e3d265554f8c4fc5
> HCI Event: Number of Completed Packets (0x13) plen 5    #203 [hci1] 12.432292
        Num handles: 1
        Handle: 180 Address: DF:A9:FF:F6:B1:1A (OUI DF-A9-FF)
        Count: 1
        #202: len 21 (3 Kb/s)
        Latency: 47 msec (8-49 msec ~47 msec)
> ACL Data RX: Handle 180 flags 0x02 dlen 21              #204 [hci1] 12.482443
      SMP: Pairing Confirm (0x03) len 16
        Confim value: 64f3a3252cfe822111968eaa6bd9caa4
< HCI Command: Host Number of Com.. (0x03|0x0035) plen 5  #205 [hci1] 12.484278
        Num handles: 1
        Handle: 180 Address: DF:A9:FF:F6:B1:1A (OUI DF-A9-FF)
        Count: 1
< ACL Data TX: Handle 180 flags 0x00 dlen 21              #206 [hci1] 12.484324
      SMP: Pairing Random (0x04) len 16
        Random value: c2476823e41736a7e381bafb7c3fcffc
> HCI Event: Number of Completed Packets (0x13) plen 5    #207 [hci1] 12.532308
        Num handles: 1
        Handle: 180 Address: DF:A9:FF:F6:B1:1A (OUI DF-A9-FF)
        Count: 1
        #206: len 21 (3 Kb/s)
        Latency: 47 msec (8-49 msec ~47 msec)
> ACL Data RX: Handle 180 flags 0x02 dlen 21              #208 [hci1] 12.782588
      SMP: Pairing Random (0x04) len 16
        Random value: 49d565c64cc6124d9f79fdceef2ec964
< HCI Command: Host Number of Com.. (0x03|0x0035) plen 5  #209 [hci1] 12.784752
        Num handles: 1
        Handle: 180 Address: DF:A9:FF:F6:B1:1A (OUI DF-A9-FF)
        Count: 1
< ACL Data TX: Handle 180 flags 0x00 dlen 21              #210 [hci1] 12.784968
      SMP: Pairing Confirm (0x03) len 16
        Confim value: ecb46c70956b52cbd2f78e36e580bb3f
> HCI Event: Number of Completed Packets (0x13) plen 5    #211 [hci1] 12.832302
        Num handles: 1
        Handle: 180 Address: DF:A9:FF:F6:B1:1A (OUI DF-A9-FF)
        Count: 1
        #210: len 21 (3 Kb/s)
        Latency: 47 msec (8-49 msec ~47 msec)
> ACL Data RX: Handle 180 flags 0x02 dlen 21              #212 [hci1] 12.882551
      SMP: Pairing Confirm (0x03) len 16
        Confim value: fb3cd3776191e9450b02c49b9eb3204a
< HCI Command: Host Number of Com.. (0x03|0x0035) plen 5  #213 [hci1] 12.884453
        Num handles: 1
        Handle: 180 Address: DF:A9:FF:F6:B1:1A (OUI DF-A9-FF)
        Count: 1
< ACL Data TX: Handle 180 flags 0x00 dlen 21              #214 [hci1] 12.884653
      SMP: Pairing Random (0x04) len 16
        Random value: d9b0b09bc4296bf8753a8f6e1fa7d968
> HCI Event: Number of Completed Packets (0x13) plen 5    #215 [hci1] 12.932381
        Num handles: 1
        Handle: 180 Address: DF:A9:FF:F6:B1:1A (OUI DF-A9-FF)
        Count: 1
        #214: len 21 (3 Kb/s)
        Latency: 47 msec (8-49 msec ~47 msec)
> ACL Data RX: Handle 180 flags 0x02 dlen 21              #216 [hci1] 13.182450
      SMP: Pairing Random (0x04) len 16
        Random value: 0081def02316a95136a25fdef661fc92
< HCI Command: Host Number of Com.. (0x03|0x0035) plen 5  #217 [hci1] 13.184686
        Num handles: 1
        Handle: 180 Address: DF:A9:FF:F6:B1:1A (OUI DF-A9-FF)
        Count: 1
< ACL Data TX: Handle 180 flags 0x00 dlen 21              #218 [hci1] 13.184898
      SMP: Pairing Confirm (0x03) len 16
        Confim value: a7da5c519a2f95f82e5a4870750c368c
> HCI Event: Number of Completed Packets (0x13) plen 5    #219 [hci1] 13.232357
        Num handles: 1
        Handle: 180 Address: DF:A9:FF:F6:B1:1A (OUI DF-A9-FF)
        Count: 1
        #218: len 21 (3 Kb/s)
        Latency: 47 msec (8-49 msec ~47 msec)
> ACL Data RX: Handle 180 flags 0x02 dlen 21              #220 [hci1] 13.282530
      SMP: Pairing Confirm (0x03) len 16
        Confim value: 26ffc7f28c0c3980b523378e55e4f778
< HCI Command: Host Number of Com.. (0x03|0x0035) plen 5  #221 [hci1] 13.284597
        Num handles: 1
        Handle: 180 Address: DF:A9:FF:F6:B1:1A (OUI DF-A9-FF)
        Count: 1
< ACL Data TX: Handle 180 flags 0x00 dlen 21              #222 [hci1] 13.284846
      SMP: Pairing Random (0x04) len 16
        Random value: f00de1357c99cea2f6ddb09677d02f35
> HCI Event: Number of Completed Packets (0x13) plen 5    #223 [hci1] 13.332303
        Num handles: 1
        Handle: 180 Address: DF:A9:FF:F6:B1:1A (OUI DF-A9-FF)
        Count: 1
        #222: len 21 (3 Kb/s)
        Latency: 47 msec (8-49 msec ~47 msec)
> ACL Data RX: Handle 180 flags 0x02 dlen 21              #224 [hci1] 13.582603
      SMP: Pairing Random (0x04) len 16
        Random value: 43c3550b59b6aa22e3895ca96e337f3f
< HCI Command: Host Number of Com.. (0x03|0x0035) plen 5  #225 [hci1] 13.584438
        Num handles: 1
        Handle: 180 Address: DF:A9:FF:F6:B1:1A (OUI DF-A9-FF)
        Count: 1
< ACL Data TX: Handle 180 flags 0x00 dlen 21              #226 [hci1] 13.584544
      SMP: Pairing DHKey Check (0x0d) len 16
        E: 966c1471fc15dac5b6cca28f01f9ae51
> HCI Event: Number of Completed Packets (0x13) plen 5    #227 [hci1] 13.632266
        Num handles: 1
        Handle: 180 Address: DF:A9:FF:F6:B1:1A (OUI DF-A9-FF)
        Count: 1
        #226: len 21 (3 Kb/s)
        Latency: 47 msec (8-49 msec ~47 msec)
> ACL Data RX: Handle 180 flags 0x02 dlen 21              #228 [hci1] 13.682466
      SMP: Pairing DHKey Check (0x0d) len 16
        E: 5b5f28c7e32d5eb75569c9f58349255d
< HCI Command: LE Start Encryption (0x08|0x0019) plen 28  #229 [hci1] 13.684722
        Handle: 180 Address: DF:A9:FF:F6:B1:1A (OUI DF-A9-FF)
        Random number: 0x0000000000000000
        Encrypted diversifier: 0x0000
        Long term key: c890289988825afc498169f487f068a3
> HCI Event: Command Status (0x0f) plen 4                 #230 [hci1] 13.685675
      LE Start Encryption (0x08|0x0019) ncmd 1
        Status: Success (0x00)
< HCI Command: Host Number of Com.. (0x03|0x0035) plen 5  #231 [hci1] 13.704306
        Num handles: 1
        Handle: 180 Address: DF:A9:FF:F6:B1:1A (OUI DF-A9-FF)
        Count: 1
