Bluetooth monitor ver 5.72
= Note: Linux version 6.14.0-36-generic (x86_64)                       0.724572
= Note: Bluetooth subsystem version 2.22                               0.724574
= New Index: 00:00:00:00:00:00 (Primary,UART,hci1)              [hci1] 0.724574
= New Index: 48:5F:99:8E:E0:64 (Primary,USB,hci0)               [hci0] 0.724575
= Open Index: 00:00:00:00:00:00                                 [hci1] 0.857543
= Index Info: 00:00:00:00:00:00 (Nordic Semiconductor ASA)      [hci1] 0.857548
@ USER Open: main (privileged) version 2.22            {0x0001} [hci1] 0.857551
< HCI Command: Reset (0x03|0x0003) plen 0                    #1 [hci1] 0.857913
> HCI Event: Command Complete (0x0e) plen 4                  #2 [hci1] 0.858433
      Reset (0x03|0x0003) ncmd 1
        Status: Success (0x00)
< HCI Command: Read Local Supported... (0x04|0x0003) plen 0  #3 [hci1] 0.877521
> HCI Event: Command Complete (0x0e) plen 12                 #4 [hci1] 0.878113
      Read Local Supported Features (0x04|0x0003) ncmd 1
        Status: Success (0x00)
        Features: 0x00 0x00 0x00 0x00 0x60 0x00 0x00 0x00
          BR/EDR Not Supported
          LE Supported (Controller)
< HCI Command: Read Local Version In.. (0x04|0x0001) plen 0  #5 [hci1] 0.897512
> HCI Event: Command Complete (0x0e) plen 12                 #6 [hci1] 0.898017
      Read Local Version Information (0x04|0x0001) ncmd 1
        Status: Success (0x00)
        HCI version: Reserved (0x11) - Revision 12345 (0x3039)
        LMP version: Reserved (0x11) - Subversion 12345 (0x3039)
        Manufacturer: Nordic Semiconductor ASA (89)
< HCI Command: Read Local Supported... (0x04|0x0002) plen 0  #7 [hci1] 0.917590
> HCI Event: Command Complete (0x0e) plen 68                 #8 [hci1] 0.918613
      Read Local Supported Commands (0x04|0x0002) ncmd 1
        Status: Success (0x00)
        Commands: 115 entries
          Disconnect (Octet 0 - Bit 5)
          Read Remote Version Information (Octet 2 - Bit 7)
          Set Event Mask (Octet 5 - Bit 6)
          Reset (Octet 5 - Bit 7)
          Read Connection Accept Timeout (Octet 7 - Bit 2)
          Write Connection Accept Timeout (Octet 7 - Bit 3)
          Read Transmit Power Level (Octet 10 - Bit 2)
          Set Controller To Host Flow Control (Octet 10 - Bit 5)
          Host Buffer Size (Octet 10 - Bit 6)
          Host Number of Completed Packets (Octet 10 - Bit 7)
          Read Local Version Information (Octet 14 - Bit 3)
          Read Local Supported Features (Octet 14 - Bit 5)
          Read BD ADDR (Octet 15 - Bit 1)
          Read RSSI (Octet 15 - Bit 5)
          Set Event Mask Page 2 (Octet 22 - Bit 2)
          LE Set Event Mask (Octet 25 - Bit 0)
          LE Read Buffer Size (Octet 25 - Bit 1)
          LE Read Local Supported Features (Octet 25 - Bit 2)
          LE Set Random Address (Octet 25 - Bit 4)
          LE Set Advertising Parameters (Octet 25 - Bit 5)
          LE Read Advertising Channel TX Power (Octet 25 - Bit 6)
          LE Set Advertising Data (Octet 25 - Bit 7)
          LE Set Scan Response Data (Octet 26 - Bit 0)
          LE Set Advertise Enable (Octet 26 - Bit 1)
          LE Set Scan Parameters (Octet 26 - Bit 2)
          LE Set Scan Enable (Octet 26 - Bit 3)
          LE Create Connection (Octet 26 - Bit 4)
          LE Create Connection Cancel (Octet 26 - Bit 5)
          LE Read Accept List Size (Octet 26 - Bit 6)
          LE Clear Accept List (Octet 26 - Bit 7)
          LE Add Device To Accept List (Octet 27 - Bit 0)
          LE Remove Device From Accept List (Octet 27 - Bit 1)
          LE Connection Update (Octet 27 - Bit 2)
          LE Set Host Channel Classification (Octet 27 - Bit 3)
          LE Read Channel Map (Octet 27 - Bit 4)
          LE Read Remote Used Features (Octet 27 - Bit 5)
          LE Encrypt (Octet 27 - Bit 6)
          LE Rand (Octet 27 - Bit 7)
          LE Start Encryption (Octet 28 - Bit 0)
          LE Long Term Key Request Reply (Octet 28 - Bit 1)
          LE Long Term Key Request Neg Reply (Octet 28 - Bit 2)
          LE Read Supported States (Octet 28 - Bit 3)
          Read Authenticated Payload Timeout (Octet 32 - Bit 4)
          Write Authenticated Payload Timeout (Octet 32 - Bit 5)
          LE Set Data Length (Octet 33 - Bit 6)
          LE Read Suggested Default Data Length (Octet 33 - Bit 7)
          LE Write Suggested Default Data Length (Octet 34 - Bit 0)
          LE Add Device To Resolving List (Octet 34 - Bit 3)
          LE Remove Device From Resolving List (Octet 34 - Bit 4)
          LE Clear Resolving List (Octet 34 - Bit 5)
          LE Read Resolving List Size (Octet 34 - Bit 6)
          LE Set Address Resolution Enable (Octet 35 - Bit 1)
          LE Set Resolvable Private Address Timeout (Octet 35 - Bit 2)
          LE Read Maximum Data Length (Octet 35 - Bit 3)
          LE Read PHY (Octet 35 - Bit 4)
          LE Set Default PHY (Octet 35 - Bit 5)
          LE Set PHY (Octet 35 - Bit 6)
          LE Set Advertising Set Random Address (Octet 36 - Bit 1)
          LE Set Extended Advertising Parameters (Octet 36 - Bit 2)
          LE Set Extended Advertising Data (Octet 36 - Bit 3)
          LE Set Extended Scan Response Data (Octet 36 - Bit 4)
          LE Set Extended Advertising Enable (Octet 36 - Bit 5)
          LE Read Maximum Advertising Data Length (Octet 36 - Bit 6)
          LE Read Number of Supported Advertising Sets (Octet 36 - Bit 7)
          LE Remove Advertising Set (Octet 37 - Bit 0)
          LE Clear Advertising Sets (Octet 37 - Bit 1)
          LE Set Periodic Advertising Parameters (Octet 37 - Bit 2)
          LE Set Periodic Advertising Data (Octet 37 - Bit 3)
          LE Set Periodic Advertising Enable (Octet 37 - Bit 4)
          LE Set Extended Scan Parameters (Octet 37 - Bit 5)
          LE Set Extended Scan Enable (Octet 37 - Bit 6)
          LE Extended Create Connection (Octet 37 - Bit 7)
          LE Periodic Advertising Create Sync (Octet 38 - Bit 0)
          LE Periodic Advertising Create Sync Cancel (Octet 38 - Bit 1)
          LE Periodic Advertising Terminate Sync (Octet 38 - Bit 2)
          LE Add Device To Periodic Advertiser List (Octet 38 - Bit 3)
          LE Remove Device From Periodic Advertiser List (Octet 38 - Bit 4)
          LE Clear Periodic Advertiser List (Octet 38 - Bit 5)
          LE Read Periodic Advertiser List Size (Octet 38 - Bit 6)
          LE Read Transmit Power (Octet 38 - Bit 7)
          LE Read RF Path Compensation (Octet 39 - Bit 0)
          LE Write RF Path Compensation (Octet 39 - Bit 1)
          LE Set Privacy Mode (Octet 39 - Bit 2)
          LE Periodic Advertising Receive Enable (Octet 40 - Bit 5)
          LE Periodic Advertising Sync Transfer (Octet 40 - Bit 6)
          LE Periodic Advertising Set Info Transfer (Octet 40 - Bit 7)
          LE Periodic Advertising Sync Transfer Parameters (Octet 41 - Bit 0)
          LE Set Default Periodic Advertisng Sync Transfer Parameters (Octet 41 - Bit 1)
          LE Read Buffer v2 (Octet 41 - Bit 5)
          LE Read ISO TX Sync (Octet 41 - Bit 6)
          LE Set Connected Isochronous Group Parameters (Octet 41 - Bit 7)
          LE Set Connected Isochronous Group Parameters Test (Octet 42 - Bit 0)
          LE Create Connected Isochronous Stream (Octet 42 - Bit 1)
          LE Remove Connected Isochronous Group (Octet 42 - Bit 2)
          LE Accept Connected Isochronous Stream Request (Octet 42 - Bit 3)
          LE Reject Connected Isochronous Stream Request (Octet 42 - Bit 4)
          LE Create Broadcast Isochronous Group (Octet 42 - Bit 5)
          LE Create Broadcast Isochronous Group Test (Octet 42 - Bit 6)
          LE Terminate Broadcast Isochronous Group (Octet 42 - Bit 7)
          LE Broadcast Isochronous Group Create Sync (Octet 43 - Bit 0)
          LE Broadcast Isochronous Group Terminate Sync (Octet 43 - Bit 1)
          LE Request Peer SCA (Octet 43 - Bit 2)
          LE Setup Isochronous Data Path (Octet 43 - Bit 3)
          LE Remove Isochronous Data Path (Octet 43 - Bit 4)
          LE Isochronous Transmit Test (Octet 43 - Bit 5)
          LE Isochronous Receive Test (Octet 43 - Bit 6)
          LE Isochronous Read Test Counters (Octet 43 - Bit 7)
          LE Isochronous Read Test Counters (Octet 44 - Bit 0)
          LE Set Host Feature (Octet 44 - Bit 1)
          Octet 44 - Bit 2 
          Octet 45 - Bit 6 
          Octet 46 - Bit 0 
          Octet 46 - Bit 1 
          Octet 46 - Bit 2 
          Octet 47 - Bit 4 
< HCI Command: Host Buffer Size (0x03|0x0033) plen 7         #9 [hci1] 0.937580
        ACL MTU: 255  ACL max packet: 16
        SCO MTU: 0    SCO max packet: 0
> HCI Event: Command Complete (0x0e) plen 4                 #10 [hci1] 0.938026
      Host Buffer Size (0x03|0x0033) ncmd 1
        Status: Success (0x00)
< HCI Command: Set Controller To Ho.. (0x03|0x0031) plen 1  #11 [hci1] 0.957501
        Flow control: ACL Data Packets (0x01)
> HCI Event: Command Complete (0x0e) plen 4                 #12 [hci1] 0.957879
      Set Controller To Host Flow Control (0x03|0x0031) ncmd 1
        Status: Success (0x00)
< HCI Command: LE Read Local Suppor.. (0x08|0x0003) plen 0  #13 [hci1] 0.977542
> HCI Event: Command Complete (0x0e) plen 12                #14 [hci1] 0.978024
      LE Read Local Supported Features (0x08|0x0003) ncmd 1
        Status: Success (0x00)
        Features: 0xfd 0x79 0x00 0xf7 0x30 0x01 0x00 0x00
          LE Encryption
          Extended Reject Indication
          Peripheral-initiated Features Exchange
          LE Ping
          LE Data Packet Length Extension
          LL Privacy
          Extended Scanner Filter Policies
          LE 2M PHY
          LE Coded PHY
          LE Extended Advertising
          LE Periodic Advertising
          Channel Selection Algorithm #2
          Periodic Advertising Sync Transfer - Sender
          Periodic Advertising Sync Transfer - Recipient
          Sleep Clock Accuracy Updates
          Connected Isochronous Stream - Central
          Connected Isochronous Stream - Peripheral
          Isochronous Broadcaster
          Synchronized Receiver
          Periodic Advertising ADI support
          Connection Subrating
          Unknown features (0x0000010000000000)
< HCI Command: LE Set Host Feature (0x08|0x0074) plen 2     #15 [hci1] 0.997492
        Bit Number: 32
          Connected Isochronous Stream (Host Support)
        Bit Value: 1
> HCI Event: Command Complete (0x0e) plen 4                 #16 [hci1] 0.997856
      LE Set Host Feature (0x08|0x0074) ncmd 1
        Status: Success (0x00)
< HCI Command: LE Read Buffer v2 (0x08|0x0060) plen 0       #17 [hci1] 1.017585
> HCI Event: Command Complete (0x0e) plen 10                #18 [hci1] 1.018053
      LE Read Buffer v2 (0x08|0x0060) ncmd 1
        Status: Success (0x00)
        ACL MTU: 27
        ACL max packet: 3
        ISO MTU: 318
        ISO max packet: 3
< HCI Command: LE Read Maximum Adve.. (0x08|0x003a) plen 0  #19 [hci1] 1.037609
> HCI Event: Command Complete (0x0e) plen 6                 #20 [hci1] 1.038090
      LE Read Maximum Advertising Data Length (0x08|0x003a) ncmd 1
        Status: Success (0x00)
        Max length: 1650
< HCI Command: LE Read Supported St.. (0x08|0x001c) plen 0  #21 [hci1] 1.057531
> HCI Event: Command Complete (0x0e) plen 12                #22 [hci1] 1.058023
      LE Read Supported States (0x08|0x001c) ncmd 1
        Status: Success (0x00)
        States: 0x000003ff3e0306ff
          Non-connectable Advertising State
          Scannable Advertising State
          Connectable Advertising State
          High Duty Cycle Directed Advertising State
          Passive Scanning State
          Active Scanning State
          Initiating State
            and Connection State (Central Role)
          Connection State (Peripheral Role)
          Scannable Advertising State
            and Passive Scanning State
          Connectable Advertising State
            and Passive Scanning State
          Non-connectable Advertising State
            and Initiating State
          Scannable Advertising State
            and Initiating State
          Active Scanning State
            and Connection State (Central Role)
          Passive Scanning State
            and Connection State (Peripheral Role)
          Active Scanning State
            and Connection State (Peripheral Role)
          Initiating State
            and Connection State (Central Role)
            and Central Role & Central Role
          Low Duty Cycle Directed Advertising State
          Connectable Advertising State
            and Initiating State
            and Central Role & Peripheral Role
          High Duty Cycle Directed Advertising State
            and Initiating State
            and Central Role & Peripheral Role
          Low Duty Cycle Directed Advertising State
            and Initiating State
            and Central Role & Peripheral Role
          Connectable Advertising State
            and Connection State (Central Role)
            and Central Role & Peripheral Role
          High Duty Cycle Directed Advertising State
            and Connection State (Central Role)
            and Central Role & Peripheral Role
          Low Duty Cycle Directed Advertising State
            and Connection State (Central Role)
            and Central Role & Peripheral Role
          Connectable Advertising State
            and Connection State (Peripheral Role)
            and Central Role & Peripheral Role
          High Duty Cycle Directed Advertising State
            and Connection State (Peripheral Role)
            and Peripheral Role & Peripheral Role
          Low Duty Cycle Directed Advertising State
            and Connection State (Peripheral Role)
            and Peripheral Role & Peripheral Role
          Initiating State
            and Connection State (Peripheral Role)
            and Central Role & Peripheral Role
< HCI Command: LE Read Maximum Data.. (0x08|0x002f) plen 0  #23 [hci1] 1.077478
> HCI Event: Command Complete (0x0e) plen 12                #24 [hci1] 1.078093
      LE Read Maximum Data Length (0x08|0x002f) ncmd 1
        Status: Success (0x00)
        Max TX octets: 251
        Max TX time: 2704
        Max RX octets: 251
        Max RX time: 2704
< HCI Command: LE Write Suggested D.. (0x08|0x0024) plen 4  #25 [hci1] 1.097539
        TX octets: 251
        TX time: 2704
> HCI Event: Command Complete (0x0e) plen 4                 #26 [hci1] 1.098060
      LE Write Suggested Default Data Length (0x08|0x0024) ncmd 1
        Status: Success (0x00)
< HCI Command: LE Read Resolving Li.. (0x08|0x002a) plen 0  #27 [hci1] 1.117586
> HCI Event: Command Complete (0x0e) plen 5                 #28 [hci1] 1.118066
      LE Read Resolving List Size (0x08|0x002a) ncmd 1
        Status: Success (0x00)
        Size: 8
< HCI Command: LE Set Host Feature (0x08|0x0074) plen 2     #29 [hci1] 1.137585
        Bit Number: 38
          Connection Subrating (Host Support)
        Bit Value: 1
> HCI Event: Command Complete (0x0e) plen 4                 #30 [hci1] 1.138045
      LE Set Host Feature (0x08|0x0074) ncmd 1
        Status: Success (0x00)
< HCI Command: LE Set Event Mask (0x08|0x0001) plen 8       #31 [hci1] 1.157565
        Mask: 0x000002063f87fa5e
          LE Advertising Report
          LE Connection Update Complete
          LE Read Remote Used Features Complete
          LE Long Term Key Request
          LE Data Length Change
          LE Enhanced Connection Complete
          LE PHY Update Complete
          LE Extended Advertising Report
          LE Periodic Advertising Sync Established
          LE Periodic Advertising Report
          LE Periodic Advertising Sync Lost
          LE Extended Scan Timeout
          LE Extended Advertising Set Terminated
          LE Scan Request Received
          LE Periodic Advertising Sync Transfer Rvc
          LE CIS Established
          LE CIS Request
          LE Create BIG Complete
          LE Terminate BIG Complete
          LE BIG Sync Estabilished Complete
          LE BIG Sync Lost
          LE BIG Info Advertising Report
          LE Subrate Change
          Unknown mask (0x0000020000000000)
> HCI Event: Command Complete (0x0e) plen 4                 #32 [hci1] 1.158024
      LE Set Event Mask (0x08|0x0001) ncmd 1
        Status: Success (0x00)
< HCI Command: Set Event Mask (0x03|0x0001) plen 8          #33 [hci1] 1.177541
        Mask: 0x2000800002008890
          Disconnection Complete
          Encryption Change
          Read Remote Version Information Complete
          Hardware Error
          Data Buffer Overflow
          Encryption Key Refresh Complete
          LE Meta
> HCI Event: Command Complete (0x0e) plen 4                 #34 [hci1] 1.178036
      Set Event Mask (0x03|0x0001) ncmd 1
        Status: Success (0x00)
< HCI Command: Read BD ADDR (0x04|0x0009) plen 0            #35 [hci1] 1.197529
> HCI Event: Command Complete (0x0e) plen 10                #36 [hci1] 1.198043
      Read BD ADDR (0x04|0x0009) ncmd 1
        Status: Success (0x00)
        Address: 00:00:00:00:00:00 (OUI 00-00-00)
< HCI Command: LE Set Random Address (0x08|0x0005) plen 6   #37 [hci1] 1.217597
        Address: D5:B6:CC:31:DB:3B (Static)
> HCI Event: Command Complete (0x0e) plen 4                 #38 [hci1] 1.218147
      LE Set Random Address (0x08|0x0005) ncmd 1
        Status: Success (0x00)
< HCI Command: LE Set Extended Adv.. (0x08|0x0036) plen 25  #39 [hci1] 3.947651
        Handle: 0x00
        Properties: 0x0001
          Connectable
        Min advertising interval: 100.000 msec (0x00a0)
        Max advertising interval: 150.000 msec (0x00f0)
        Channel map: 37, 38, 39 (0x07)
        Own address type: Random (0x01)
        Peer address type: Public (0x00)
        Peer address: 00:00:00:00:00:00 (OUI 00-00-00)
        Filter policy: Allow Scan Request from Any, Allow Connect Request from Any (0x00)
        TX power: Host has no preference (0x7f)
        Primary PHY: LE 1M (0x01)
        Secondary max skip: 0x00
        Secondary PHY: LE 2M (0x02)
        SID: 0x00
        Scan request notifications: Disabled (0x00)
> HCI Event: Command Complete (0x0e) plen 5                 #40 [hci1] 3.948415
      LE Set Extended Advertising Parameters (0x08|0x0036) ncmd 1
        Status: Success (0x00)
        TX power (selected): 0 dbm (0x00)
< HCI Command: LE Set Advertising S.. (0x08|0x0035) plen 7  #41 [hci1] 3.957626
        Advertising handle: 0x00
        Advertising random address: D5:B6:CC:31:DB:3B (Static)
> HCI Event: Command Complete (0x0e) plen 4                 #42 [hci1] 3.958102
      LE Set Advertising Set Random Address (0x08|0x0035) ncmd 1
        Status: Success (0x00)
< HCI Command: LE Set Extended Adv.. (0x08|0x0037) plen 39  #43 [hci1] 3.977595
        Handle: 0x00
        Operation: Complete extended advertising data (0x03)
        Fragment preference: Minimize fragmentation (0x01)
        Data length: 0x23
        Flags: 0x06
          LE General Discoverable Mode
          BR/EDR Not Supported
        Name (complete): Tester_F6B11A
        Flags: 0x06
          LE General Discoverable Mode
          BR/EDR Not Supported
        16-bit Service UUIDs (complete): 1 entry
          Audio Stream Control (0x184e)
        Service Data: Audio Stream Control (0x184e)
          Data: 01ff0fff0f00
> HCI Event: Command Complete (0x0e) plen 4                 #44 [hci1] 3.978491
      LE Set Extended Advertising Data (0x08|0x0037) ncmd 1
        Status: Success (0x00)
< HCI Command: LE Set Extended Adve.. (0x08|0x0039) plen 6  #45 [hci1] 3.997613
        Extended advertising: Enabled (0x01)
        Number of sets: 1 (0x01)
        Entry 0
          Handle: 0x00
          Duration: 0 ms (0x00)
          Max ext adv events: 0
> HCI Event: Command Complete (0x0e) plen 4                 #46 [hci1] 3.998244
      LE Set Extended Advertising Enable (0x08|0x0039) ncmd 1
        Status: Success (0x00)
> HCI Event: LE Meta Event (0x3e) plen 31                   #47 [hci1] 4.106904
      LE Enhanced Connection Complete (0x0a)
        Status: Success (0x00)
        Handle: 2649
        Role: Peripheral (0x01)
        Peer address type: Public (0x00)
        Peer address: DF:A9:FF:F6:B1:1A (OUI DF-A9-FF)
        Local resolvable private address: 00:00:00:00:00:00 (Non-Resolvable)
        Peer resolvable private address: 00:00:00:00:00:00 (Non-Resolvable)
        Connection interval: 60.00 msec (0x0030)
        Connection latency: 0 (0x0000)
        Supervision timeout: 25120 msec (0x09d0)
        Central clock accuracy: 0x01
> HCI Event: LE Meta Event (0x3e) plen 6                    #48 [hci1] 4.106997
      LE Advertising Set Terminated (0x12)
        Status: Success (0x00)
        Handle: 0
        Connection handle: 2649
        Number of completed extended advertising events: 0
< HCI Command: LE Read Remote Used... (0x08|0x0016) plen 2  #49 [hci1] 4.117771
        Handle: 2649 Address: DF:A9:FF:F6:B1:1A (OUI DF-A9-FF)
< ACL Data TX: Handle 2649 flags 0x00 dlen 7                #50 [hci1] 4.117780
      ATT: Exchange MTU Request (0x02) len 2
        Client RX MTU: 251
> HCI Event: Command Status (0x0f) plen 4                   #51 [hci1] 4.118265
      LE Read Remote Used Features (0x08|0x0016) ncmd 1
        Status: Success (0x00)
> HCI Event: Number of Completed Packets (0x13) plen 5      #52 [hci1] 4.228990
        Num handles: 1
        Handle: 2649 Address: DF:A9:FF:F6:B1:1A (OUI DF-A9-FF)
        Count: 1
        #50: len 7 (0 Kb/s)
        Latency: 111 msec (111-111 msec ~111 msec)
> HCI Event: LE Meta Event (0x3e) plen 12                   #53 [hci1] 4.289285
      LE Read Remote Used Features (0x04)
        Status: Success (0x00)
        Handle: 2649 Address: DF:A9:FF:F6:B1:1A (OUI DF-A9-FF)
        Features: 0x2d 0x49 0x00 0xf7 0x67 0xd9 0x00 0x80
          LE Encryption
          Extended Reject Indication
          Peripheral-initiated Features Exchange
          LE Data Packet Length Extension
          LE 2M PHY
          LE Coded PHY
          Channel Selection Algorithm #2
          Periodic Advertising Sync Transfer - Sender
          Periodic Advertising Sync Transfer - Recipient
          Sleep Clock Accuracy Updates
          Connected Isochronous Stream - Central
          Connected Isochronous Stream - Peripheral
          Isochronous Broadcaster
          Synchronized Receiver
          Connected Isochronous Stream (Host Support)
          LE Power Control Request
          LE Power Control Request
          Connection Subrating
          Connection Subrating (Host Support)
          Unknown features (0x8000d90000000000)
> ACL Data RX: Handle 2649 flags 0x02 dlen 7                #54 [hci1] 4.588931
      ATT: Exchange MTU Request (0x02) len 2
        Client RX MTU: 64
> ACL Data RX: Handle 2649 flags 0x02 dlen 7                #55 [hci1] 4.589410
      ATT: Exchange MTU Response (0x03) len 2
        Server RX MTU: 64
< HCI Command: Host Number of Compl.. (0x03|0x0035) plen 5  #56 [hci1] 4.597739
        Num handles: 1
        Handle: 2649 Address: DF:A9:FF:F6:B1:1A (OUI DF-A9-FF)
        Count: 1
< ACL Data TX: Handle 2649 flags 0x00 dlen 7                #57 [hci1] 4.597805
      ATT: Exchange MTU Response (0x03) len 2
        Server RX MTU: 251
< HCI Command: Host Number of Compl.. (0x03|0x0035) plen 5  #58 [hci1] 4.597952
        Num handles: 1
        Handle: 2649 Address: DF:A9:FF:F6:B1:1A (OUI DF-A9-FF)
        Count: 1
> HCI Event: Number of Completed Packets (0x13) plen 5      #59 [hci1] 4.708953
        Num handles: 1
        Handle: 2649 Address: DF:A9:FF:F6:B1:1A (OUI DF-A9-FF)
        Count: 1
        #57: len 7 (0 Kb/s)
        Latency: 111 msec (111-111 msec ~111 msec)
> ACL Data RX: Handle 2649 flags 0x02 dlen 11               #60 [hci1] 6.689086
      SMP: Pairing Request (0x01) len 6
        IO capability: KeyboardDisplay (0x04)
        OOB data: Authentication data not present (0x00)
        Authentication requirement: Bonding, No MITM, SC, No Keypresses (0x09)
        Max encryption key size: 16
        Initiator key distribution: EncKey IdKey (0x03)
        Responder key distribution: EncKey IdKey Sign (0x07)
< HCI Command: Host Number of Compl.. (0x03|0x0035) plen 5  #61 [hci1] 6.697733
        Num handles: 1
        Handle: 2649 Address: DF:A9:FF:F6:B1:1A (OUI DF-A9-FF)
        Count: 1
< ACL Data TX: Handle 2649 flags 0x00 dlen 11               #62 [hci1] 6.697765
      SMP: Pairing Response (0x02) len 6
        IO capability: NoInputNoOutput (0x03)
        OOB data: Authentication data not present (0x00)
        Authentication requirement: Bonding, No MITM, SC, No Keypresses (0x09)
        Max encryption key size: 16
        Initiator key distribution: IdKey (0x02)
        Responder key distribution: <none> (0x00)
> HCI Event: Number of Completed Packets (0x13) plen 5      #63 [hci1] 6.809026
        Num handles: 1
        Handle: 2649 Address: DF:A9:FF:F6:B1:1A (OUI DF-A9-FF)
        Count: 1
        #62: len 11 (0 Kb/s)
        Latency: 111 msec (111-111 msec ~111 msec)
> ACL Data RX: Handle 2649 flags 0x02 dlen 27               #64 [hci1] 6.809362
> ACL Data RX: Handle 2649 flags 0x01 dlen 27               #65 [hci1] 6.809715
> ACL Data RX: Handle 2649 flags 0x01 dlen 15               #66 [hci1] 6.810013
      SMP: Pairing Public Key (0x0c) len 64
        X: fb9c268b5d19b1069118ac91bc19171a85f2abe182137be96a3cf005d460d4d4
        Y: 156197c52119513b366a83739cc81df28785c6f0168124035b0cf67af6d0a355
< HCI Command: Host Number of Compl.. (0x03|0x0035) plen 5  #67 [hci1] 6.818499
        Num handles: 1
        Handle: 2649 Address: DF:A9:FF:F6:B1:1A (OUI DF-A9-FF)
        Count: 1
< HCI Command: Host Number of Compl.. (0x03|0x0035) plen 5  #68 [hci1] 6.818716
        Num handles: 1
        Handle: 2649 Address: DF:A9:FF:F6:B1:1A (OUI DF-A9-FF)
        Count: 1
< HCI Command: Host Number of Compl.. (0x03|0x0035) plen 5  #69 [hci1] 6.819013
        Num handles: 1
        Handle: 2649 Address: DF:A9:FF:F6:B1:1A (OUI DF-A9-FF)
        Count: 1
< ACL Data TX: Handle 2649 flags 0x00 dlen 27               #70 [hci1] 6.819080
< ACL Data TX: Handle 2649 flags 0x01 dlen 27               #71 [hci1] 6.819103
< ACL Data TX: Handle 2649 flags 0x01 dlen 15               #72 [hci1] 6.819169
      SMP: Pairing Public Key (0x0c) len 64
        X: 98308440221e2d910f0e54b71e7ec652857aa9b5a0dc65028824cc19db1226e9
        Y: 67a4816bcb62efb21701e31fdb27561a6217575fb007a8bbdabe7e28b6f68482
> HCI Event: Number of Completed Packets (0x13) plen 5      #73 [hci1] 6.869387
        Num handles: 1
        Handle: 2649 Address: DF:A9:FF:F6:B1:1A (OUI DF-A9-FF)
        Count: 1
        #70: len 27 (4 Kb/s)
        Latency: 50 msec (50-111 msec ~80 msec)
> HCI Event: Number of Completed Packets (0x13) plen 5      #74 [hci1] 6.869871
        Num handles: 1
        Handle: 2649 Address: DF:A9:FF:F6:B1:1A (OUI DF-A9-FF)
        Count: 1
        #71: len 27 (4 Kb/s)
        Latency: 50 msec (50-111 msec ~65 msec)
< ACL Data TX: Handle 2649 flags 0x00 dlen 21               #75 [hci1] 6.878015
      SMP: Pairing Confirm (0x03) len 16
        Confim value: 97fd94fab861fbb2fbadf67e98f9f3a9
> HCI Event: Number of Completed Packets (0x13) plen 5      #76 [hci1] 6.928878
        Num handles: 1
        Handle: 2649 Address: DF:A9:FF:F6:B1:1A (OUI DF-A9-FF)
        Count: 1
        #72: len 15 (1 Kb/s)
        Latency: 109 msec (50-111 msec ~87 msec)
> HCI Event: Number of Completed Packets (0x13) plen 5      #77 [hci1] 6.988988
        Num handles: 1
        Handle: 2649 Address: DF:A9:FF:F6:B1:1A (OUI DF-A9-FF)
        Count: 1
        #75: len 21 (1 Kb/s)
        Latency: 110 msec (50-111 msec ~99 msec)
> ACL Data RX: Handle 2649 flags 0x02 dlen 21               #78 [hci1] 6.989414
      SMP: Pairing Random (0x04) len 16
        Random value: 7386f969ba1db7e20000000000000000
< HCI Command: Host Number of Compl.. (0x03|0x0035) plen 5  #79 [hci1] 6.997813
        Num handles: 1
        Handle: 2649 Address: DF:A9:FF:F6:B1:1A (OUI DF-A9-FF)
        Count: 1
< ACL Data TX: Handle 2649 flags 0x00 dlen 21               #80 [hci1] 6.997822
      SMP: Pairing Random (0x04) len 16
        Random value: 8e6108f966a694cbe26df70bb96773e6
> HCI Event: Number of Completed Packets (0x13) plen 5      #81 [hci1] 7.108923
        Num handles: 1
        Handle: 2649 Address: DF:A9:FF:F6:B1:1A (OUI DF-A9-FF)
        Count: 1
        #80: len 21 (1 Kb/s)
        Latency: 111 msec (50-111 msec ~105 msec)
> ACL Data RX: Handle 2649 flags 0x02 dlen 21               #82 [hci1] 7.289159
      SMP: Pairing DHKey Check (0x0d) len 16
        E: d7423f17c9cb474fff65a75c090aab03
< HCI Command: Host Number of Compl.. (0x03|0x0035) plen 5  #83 [hci1] 7.298068
        Num handles: 1
        Handle: 2649 Address: DF:A9:FF:F6:B1:1A (OUI DF-A9-FF)
        Count: 1
< ACL Data TX: Handle 2649 flags 0x00 dlen 21               #84 [hci1] 7.298121
      SMP: Pairing DHKey Check (0x0d) len 16
        E: b3ae287d59d23ad7d4de05d5fdb6b0cf
> HCI Event: Number of Completed Packets (0x13) plen 5      #85 [hci1] 7.408958
        Num handles: 1
        Handle: 2649 Address: DF:A9:FF:F6:B1:1A (OUI DF-A9-FF)
        Count: 1
        #84: len 21 (1 Kb/s)
        Latency: 110 msec (50-111 msec ~108 msec)
> HCI Event: LE Meta Event (0x3e) plen 13                   #86 [hci1] 7.469412
      LE Long Term Key Request (0x05)
        Handle: 2649 Address: DF:A9:FF:F6:B1:1A (OUI DF-A9-FF)
        Random number: 0x0000000000000000
        Encrypted diversifier: 0x0000
< HCI Command: LE Long Term Key Re.. (0x08|0x001a) plen 18  #87 [hci1] 7.477957
        Handle: 2649 Address: DF:A9:FF:F6:B1:1A (OUI DF-A9-FF)
        Long term key: bb7eb0037e95d80ad1c55c70171fded9
> HCI Event: Command Complete (0x0e) plen 6                 #88 [hci1] 7.478752
      LE Long Term Key Request Reply (0x08|0x001a) ncmd 1
        Status: Success (0x00)
        Handle: 2649 Address: DF:A9:FF:F6:B1:1A (OUI DF-A9-FF)
> HCI Event: Encryption Change (0x08) plen 4                #89 [hci1] 7.769131
        Status: Success (0x00)
        Handle: 2649 Address: DF:A9:FF:F6:B1:1A (OUI DF-A9-FF)
        Encryption: Enabled with AES-CCM (0x01)
> ACL Data RX: Handle 2649 flags 0x02 dlen 21               #90 [hci1] 7.829164
      SMP: Identity Information (0x08) len 16
        Identity resolving key: f4559feb39ac703d3cf6d48c1f2408f2
< HCI Command: Host Number of Compl.. (0x03|0x0035) plen 5  #91 [hci1] 7.888390
        Num handles: 1
        Handle: 2649 Address: DF:A9:FF:F6:B1:1A (OUI DF-A9-FF)
        Count: 1
> ACL Data RX: Handle 2649 flags 0x02 dlen 12               #92 [hci1] 7.949064
      SMP: Identity Address Information (0x09) len 7
        Address: DF:A9:FF:F6:B1:1A (OUI DF-A9-FF)
< HCI Command: LE Add Device To Re.. (0x08|0x0027) plen 39  #93 [hci1] 7.958227
        Address type: Public (0x00)
        Address: DF:A9:FF:F6:B1:1A (OUI DF-A9-FF)
        Peer identity resolving key: f4559feb39ac703d3cf6d48c1f2408f2
        Local identity resolving key: 00000000000000000000000000000000
> HCI Event: Command Complete (0x0e) plen 4                 #94 [hci1] 7.959187
      LE Add Device To Resolving List (0x08|0x0027) ncmd 1
        Status: Success (0x00)
< HCI Command: LE Set Privacy Mode (0x08|0x004e) plen 8     #95 [hci1] 7.978005
        Peer Identity address type: Public (0x00)
        Peer Identity address: DF:A9:FF:F6:B1:1A (OUI DF-A9-FF)
        Privacy Mode: Use Device Privacy (0x01)
> HCI Event: Command Complete (0x0e) plen 4                 #96 [hci1] 7.978526
      LE Set Privacy Mode (0x08|0x004e) ncmd 1
        Status: Success (0x00)
< HCI Command: LE Set Address Resol.. (0x08|0x002d) plen 1  #97 [hci1] 7.997984
        Address resolution: Enabled (0x01)
> HCI Event: Command Complete (0x0e) plen 4                 #98 [hci1] 7.998489
      LE Set Address Resolution Enable (0x08|0x002d) ncmd 1
        Status: Success (0x00)
> ACL Data RX: Handle 2649 flags 0x02 dlen 11               #99 [hci1] 8.009017
      ATT: Read By Group Type Request (0x10) len 6
        Handle range: 0x0001-0xffff
        Attribute group type: Primary Service (0x2800)
< HCI Command: Host Number of Comp.. (0x03|0x0035) plen 5  #100 [hci1] 8.017896
        Num handles: 1
        Handle: 2649 Address: DF:A9:FF:F6:B1:1A (OUI DF-A9-FF)
        Count: 1
< HCI Command: Host Number of Comp.. (0x03|0x0035) plen 5  #101 [hci1] 8.018414
        Num handles: 1
        Handle: 2649 Address: DF:A9:FF:F6:B1:1A (OUI DF-A9-FF)
        Count: 1
< ACL Data TX: Handle 2649 flags 0x00 dlen 27              #102 [hci1] 8.018534
< ACL Data TX: Handle 2649 flags 0x01 dlen 21              #103 [hci1] 8.018542
      ATT: Read By Group Type Response (0x11) len 43
        Attribute data length: 6
        Attribute group list: 7 entries
        Handle range: 0x0001-0x000a
        UUID: Generic Attribute Profile (0x1801)
        Handle range: 0x000b-0x0011
        UUID: Generic Access Profile (0x1800)
        Handle range: 0x0012-0x0026
        UUID: Device Information (0x180a)
        Handle range: 0x0027-0x0029
        UUID: Immediate Alert (0x1802)
        Handle range: 0x002a-0x003c
        UUID: Published Audio Capabilities (0x1850)
        Handle range: 0x003d-0x004c
        UUID: Audio Stream Control (0x184e)
        Handle range: 0x004d-0x0052
        UUID: Broadcast Audio Scan (0x184f)
> HCI Event: Number of Completed Packets (0x13) plen 5     #104 [hci1] 8.069421
        Num handles: 1
        Handle: 2649 Address: DF:A9:FF:F6:B1:1A (OUI DF-A9-FF)
        Count: 1
        #102: len 27 (4 Kb/s)
        Latency: 50 msec (50-111 msec ~79 msec)
> HCI Event: Number of Completed Packets (0x13) plen 5     #105 [hci1] 8.128973
        Num handles: 1
        Handle: 2649 Address: DF:A9:FF:F6:B1:1A (OUI DF-A9-FF)
        Count: 1
        #103: len 21 (1 Kb/s)
        Latency: 110 msec (50-111 msec ~94 msec)
> ACL Data RX: Handle 2649 flags 0x02 dlen 11              #106 [hci1] 8.129214
      ATT: Read By Group Type Request (0x10) len 6
        Handle range: 0x0053-0xffff
        Attribute group type: Primary Service (0x2800)
< HCI Command: Host Number of Comp.. (0x03|0x0035) plen 5  #107 [hci1] 8.137783
        Num handles: 1
        Handle: 2649 Address: DF:A9:FF:F6:B1:1A (OUI DF-A9-FF)
        Count: 1
< ACL Data TX: Handle 2649 flags 0x00 dlen 9               #108 [hci1] 8.137889
      ATT: Error Response (0x01) len 4
        Read By Group Type Request (0x10)
        Handle: 0x0053
        Error: Attribute Not Found (0x0a)
> HCI Event: Number of Completed Packets (0x13) plen 5     #109 [hci1] 8.249073
        Num handles: 1
        Handle: 2649 Address: DF:A9:FF:F6:B1:1A (OUI DF-A9-FF)
        Count: 1
        #108: len 9 (0 Kb/s)
        Latency: 111 msec (50-111 msec ~103 msec)
> ACL Data RX: Handle 2649 flags 0x02 dlen 11              #110 [hci1] 8.249142
      ATT: Read By Type Request (0x08) len 6
        Handle range: 0x0001-0x000a
        Attribute type: Characteristic (0x2803)
< HCI Command: Host Number of Comp.. (0x03|0x0035) plen 5  #111 [hci1] 8.257737
        Num handles: 1
        Handle: 2649 Address: DF:A9:FF:F6:B1:1A (OUI DF-A9-FF)
        Count: 1
< ACL Data TX: Handle 2649 flags 0x00 dlen 27              #112 [hci1] 8.257767
< ACL Data TX: Handle 2649 flags 0x01 dlen 7               #113 [hci1] 8.257769
      ATT: Read By Type Response (0x09) len 29
        Attribute data length: 7
        Attribute data list: 4 entries
        Handle: 0x0002
        Value: 200300052a
            Properties: 0x20
              Indicate (0x20)
            Value Handle: 0x0003
            Value UUID: Service Changed (0x2a05)
        Handle: 0x0005
        Value: 0a0600292b
            Properties: 0x0a
              Read (0x02)
              Write (0x08)
            Value Handle: 0x0006
            Value UUID: Client Supported Features (0x2b29)
        Handle: 0x0007
        Value: 0208002a2b
            Properties: 0x02
              Read (0x02)
            Value Handle: 0x0008
            Value UUID: Database Hash (0x2b2a)
        Handle: 0x0009
        Value: 020a003a2b
            Properties: 0x02
              Read (0x02)
            Value Handle: 0x000a
            Value UUID: Server Supported Features (0x2b3a)
> HCI Event: Number of Completed Packets (0x13) plen 5     #114 [hci1] 8.309425
        Num handles: 1
        Handle: 2649 Address: DF:A9:FF:F6:B1:1A (OUI DF-A9-FF)
        Count: 1
        #112: len 27 (4 Kb/s)
        Latency: 51 msec (50-111 msec ~77 msec)
> HCI Event: Number of Completed Packets (0x13) plen 5     #115 [hci1] 8.369010
        Num handles: 1
        Handle: 2649 Address: DF:A9:FF:F6:B1:1A (OUI DF-A9-FF)
        Count: 1
        #113: len 7 (0 Kb/s)
        Latency: 111 msec (50-111 msec ~94 msec)
> ACL Data RX: Handle 2649 flags 0x02 dlen 11              #116 [hci1] 8.369155
      ATT: Read By Type Request (0x08) len 6
        Handle range: 0x000a-0x000a
        Attribute type: Characteristic (0x2803)
< HCI Command: Host Number of Comp.. (0x03|0x0035) plen 5  #117 [hci1] 8.378344
        Num handles: 1
        Handle: 2649 Address: DF:A9:FF:F6:B1:1A (OUI DF-A9-FF)
        Count: 1
< ACL Data TX: Handle 2649 flags 0x00 dlen 9               #118 [hci1] 8.378595
      ATT: Error Response (0x01) len 4
        Read By Type Request (0x08)
        Handle: 0x000a
        Error: Attribute Not Found (0x0a)
> HCI Event: Number of Completed Packets (0x13) plen 5     #119 [hci1] 8.488986
        Num handles: 1
        Handle: 2649 Address: DF:A9:FF:F6:B1:1A (OUI DF-A9-FF)
        Count: 1
        #118: len 9 (0 Kb/s)
        Latency: 110 msec (50-111 msec ~102 msec)
> ACL Data RX: Handle 2649 flags 0x02 dlen 9               #120 [hci1] 8.489200
      ATT: Find Information Request (0x04) len 4
        Handle range: 0x0004-0x0004
< HCI Command: Host Number of Comp.. (0x03|0x0035) plen 5  #121 [hci1] 8.498335
        Num handles: 1
        Handle: 2649 Address: DF:A9:FF:F6:B1:1A (OUI DF-A9-FF)
        Count: 1
< ACL Data TX: Handle 2649 flags 0x00 dlen 10              #122 [hci1] 8.498428
      ATT: Find Information Response (0x05) len 5
        Format: UUID-16 (0x01)
        Handle: 0x0004
        UUID: Client Characteristic Configuration (0x2902)
> HCI Event: Number of Completed Packets (0x13) plen 5     #123 [hci1] 8.608948
        Num handles: 1
        Handle: 2649 Address: DF:A9:FF:F6:B1:1A (OUI DF-A9-FF)
        Count: 1
        #122: len 10 (0 Kb/s)
        Latency: 110 msec (50-111 msec ~106 msec)
> ACL Data RX: Handle 2649 flags 0x02 dlen 11              #124 [hci1] 8.609169
      ATT: Read By Type Request (0x08) len 6
        Handle range: 0x000b-0x0011
        Attribute type: Characteristic (0x2803)
< HCI Command: Host Number of Comp.. (0x03|0x0035) plen 5  #125 [hci1] 8.618101
        Num handles: 1
        Handle: 2649 Address: DF:A9:FF:F6:B1:1A (OUI DF-A9-FF)
        Count: 1
< ACL Data TX: Handle 2649 flags 0x00 dlen 27              #126 [hci1] 8.618160
      ATT: Read By Type Response (0x09) len 22
        Attribute data length: 7
        Attribute data list: 3 entries
        Handle: 0x000c
        Value: 0a0d00002a
            Properties: 0x0a
              Read (0x02)
              Write (0x08)
            Value Handle: 0x000d
            Value UUID: Device Name (0x2a00)
        Handle: 0x000e
        Value: 0a0f00012a
            Properties: 0x0a
              Read (0x02)
              Write (0x08)
            Value Handle: 0x000f
            Value UUID: Appearance (0x2a01)
        Handle: 0x0010
        Value: 021100042a
            Properties: 0x02
              Read (0x02)
            Value Handle: 0x0011
            Value UUID: Peripheral Preferred Connection Parameters (0x2a04)
> HCI Event: Number of Completed Packets (0x13) plen 5     #127 [hci1] 8.728960
        Num handles: 1
        Handle: 2649 Address: DF:A9:FF:F6:B1:1A (OUI DF-A9-FF)
        Count: 1
        #126: len 27 (1 Kb/s)
        Latency: 110 msec (50-111 msec ~108 msec)
> ACL Data RX: Handle 2649 flags 0x02 dlen 11              #128 [hci1] 8.729151
      ATT: Read By Type Request (0x08) len 6
        Handle range: 0x0011-0x0011
        Attribute type: Characteristic (0x2803)
< HCI Command: Host Number of Comp.. (0x03|0x0035) plen 5  #129 [hci1] 8.737833
        Num handles: 1
        Handle: 2649 Address: DF:A9:FF:F6:B1:1A (OUI DF-A9-FF)
        Count: 1
< ACL Data TX: Handle 2649 flags 0x00 dlen 9               #130 [hci1] 8.737962
      ATT: Error Response (0x01) len 4
        Read By Type Request (0x08)
        Handle: 0x0011
        Error: Attribute Not Found (0x0a)
> HCI Event: Number of Completed Packets (0x13) plen 5     #131 [hci1] 8.849037
        Num handles: 1
        Handle: 2649 Address: DF:A9:FF:F6:B1:1A (OUI DF-A9-FF)
        Count: 1
        #130: len 9 (0 Kb/s)
        Latency: 111 msec (50-111 msec ~109 msec)
> ACL Data RX: Handle 2649 flags 0x02 dlen 11              #132 [hci1] 8.849129
      ATT: Read By Type Request (0x08) len 6
        Handle range: 0x0012-0x0026
        Attribute type: Characteristic (0x2803)
< HCI Command: Host Number of Comp.. (0x03|0x0035) plen 5  #133 [hci1] 8.858363
        Num handles: 1
        Handle: 2649 Address: DF:A9:FF:F6:B1:1A (OUI DF-A9-FF)
        Count: 1
< ACL Data TX: Handle 2649 flags 0x00 dlen 27              #134 [hci1] 8.858525
< ACL Data TX: Handle 2649 flags 0x01 dlen 27              #135 [hci1] 8.858536
< ACL Data TX: Handle 2649 flags 0x01 dlen 8               #136 [hci1] 8.858565
      ATT: Read By Type Response (0x09) len 57
        Attribute data length: 7
        Attribute data list: 8 entries
        Handle: 0x0013
        Value: 021400242a
            Properties: 0x02
              Read (0x02)
            Value Handle: 0x0014
            Value UUID: Model Number String (0x2a24)
        Handle: 0x0015
        Value: 021600292a
            Properties: 0x02
              Read (0x02)
            Value Handle: 0x0016
            Value UUID: Manufacturer Name String (0x2a29)
        Handle: 0x0017
        Value: 021800502a
            Properties: 0x02
              Read (0x02)
            Value Handle: 0x0018
            Value UUID: PnP ID (0x2a50)
        Handle: 0x0019
        Value: 021a00252a
            Properties: 0x02
              Read (0x02)
            Value Handle: 0x001a
            Value UUID: Serial Number String (0x2a25)
        Handle: 0x001b
        Value: 021c00262a
            Properties: 0x02
              Read (0x02)
            Value Handle: 0x001c
            Value UUID: Firmware Revision String (0x2a26)
        Handle: 0x001d
        Value: 021e00272a
            Properties: 0x02
              Read (0x02)
            Value Handle: 0x001e
            Value UUID: Hardware Revision String (0x2a27)
        Handle: 0x001f
        Value: 022000282a
            Properties: 0x02
              Read (0x02)
            Value Handle: 0x0020
            Value UUID: Software Revision String (0x2a28)
        Handle: 0x0021
        Value: 022200ff2b
            Properties: 0x02
              Read (0x02)
            Value Handle: 0x0022
            Value UUID: Unknown (0x2bff)
> HCI Event: Number of Completed Packets (0x13) plen 5     #137 [hci1] 8.909326
        Num handles: 1
        Handle: 2649 Address: DF:A9:FF:F6:B1:1A (OUI DF-A9-FF)
        Count: 1
        #134: len 27 (4 Kb/s)
        Latency: 50 msec (50-111 msec ~80 msec)
> HCI Event: Number of Completed Packets (0x13) plen 5     #138 [hci1] 8.909846
        Num handles: 1
        Handle: 2649 Address: DF:A9:FF:F6:B1:1A (OUI DF-A9-FF)
        Count: 1
        #135: len 27 (4 Kb/s)
        Latency: 51 msec (50-111 msec ~65 msec)
> HCI Event: Number of Completed Packets (0x13) plen 5     #139 [hci1] 8.968972
        Num handles: 1
        Handle: 2649 Address: DF:A9:FF:F6:B1:1A (OUI DF-A9-FF)
        Count: 1
        #136: len 8 (0 Kb/s)
        Latency: 110 msec (50-111 msec ~88 msec)
> ACL Data RX: Handle 2649 flags 0x02 dlen 11              #140 [hci1] 8.969131
      ATT: Read By Type Request (0x08) len 6
        Handle range: 0x0022-0x0026
        Attribute type: Characteristic (0x2803)
< HCI Command: Host Number of Comp.. (0x03|0x0035) plen 5  #141 [hci1] 8.978243
        Num handles: 1
        Handle: 2649 Address: DF:A9:FF:F6:B1:1A (OUI DF-A9-FF)
        Count: 1
< ACL Data TX: Handle 2649 flags 0x00 dlen 20              #142 [hci1] 8.978334
      ATT: Read By Type Response (0x09) len 15
        Attribute data length: 7
        Attribute data list: 2 entries
        Handle: 0x0023
        Value: 022400232a
            Properties: 0x02
              Read (0x02)
            Value Handle: 0x0024
            Value UUID: System ID (0x2a23)
        Handle: 0x0025
        Value: 0226002a2a
            Properties: 0x02
              Read (0x02)
            Value Handle: 0x0026
            Value UUID: IEEE 11073-20601 Regulatory Cert. Data List (0x2a2a)
> HCI Event: Number of Completed Packets (0x13) plen 5     #143 [hci1] 9.089030
        Num handles: 1
        Handle: 2649 Address: DF:A9:FF:F6:B1:1A (OUI DF-A9-FF)
        Count: 1
        #142: len 20 (1 Kb/s)
        Latency: 110 msec (50-111 msec ~99 msec)
> ACL Data RX: Handle 2649 flags 0x02 dlen 11              #144 [hci1] 9.089203
      ATT: Read By Type Request (0x08) len 6
        Handle range: 0x0026-0x0026
        Attribute type: Characteristic (0x2803)
< HCI Command: Host Number of Comp.. (0x03|0x0035) plen 5  #145 [hci1] 9.098223
        Num handles: 1
        Handle: 2649 Address: DF:A9:FF:F6:B1:1A (OUI DF-A9-FF)
        Count: 1
< ACL Data TX: Handle 2649 flags 0x00 dlen 9               #146 [hci1] 9.098371
      ATT: Error Response (0x01) len 4
        Read By Type Request (0x08)
        Handle: 0x0026
        Error: Attribute Not Found (0x0a)
> HCI Event: Number of Completed Packets (0x13) plen 5     #147 [hci1] 9.208952
        Num handles: 1
        Handle: 2649 Address: DF:A9:FF:F6:B1:1A (OUI DF-A9-FF)
        Count: 1
        #146: len 9 (0 Kb/s)
        Latency: 110 msec (50-111 msec ~104 msec)
> ACL Data RX: Handle 2649 flags 0x02 dlen 11              #148 [hci1] 9.209115
      ATT: Read By Type Request (0x08) len 6
        Handle range: 0x0027-0x0029
        Attribute type: Characteristic (0x2803)
< HCI Command: Host Number of Comp.. (0x03|0x0035) plen 5  #149 [hci1] 9.217820
        Num handles: 1
        Handle: 2649 Address: DF:A9:FF:F6:B1:1A (OUI DF-A9-FF)
        Count: 1
< ACL Data TX: Handle 2649 flags 0x00 dlen 13              #150 [hci1] 9.217847
      ATT: Read By Type Response (0x09) len 8
        Attribute data length: 7
        Attribute data list: 1 entry
        Handle: 0x0028
        Value: 042900062a
            Properties: 0x04
              Write Without Response (0x04)
            Value Handle: 0x0029
            Value UUID: Alert Level (0x2a06)
> HCI Event: Number of Completed Packets (0x13) plen 5     #151 [hci1] 9.329020
        Num handles: 1
        Handle: 2649 Address: DF:A9:FF:F6:B1:1A (OUI DF-A9-FF)
        Count: 1
        #150: len 13 (0 Kb/s)
        Latency: 111 msec (50-111 msec ~108 msec)
> ACL Data RX: Handle 2649 flags 0x02 dlen 11              #152 [hci1] 9.329134
      ATT: Read By Type Request (0x08) len 6
        Handle range: 0x0029-0x0029
        Attribute type: Characteristic (0x2803)
< HCI Command: Host Number of Comp.. (0x03|0x0035) plen 5  #153 [hci1] 9.338300
        Num handles: 1
        Handle: 2649 Address: DF:A9:FF:F6:B1:1A (OUI DF-A9-FF)
        Count: 1
< ACL Data TX: Handle 2649 flags 0x00 dlen 9               #154 [hci1] 9.338495
      ATT: Error Response (0x01) len 4
        Read By Type Request (0x08)
        Handle: 0x0029
        Error: Attribute Not Found (0x0a)
> HCI Event: Number of Completed Packets (0x13) plen 5     #155 [hci1] 9.448948
        Num handles: 1
        Handle: 2649 Address: DF:A9:FF:F6:B1:1A (OUI DF-A9-FF)
        Count: 1
        #154: len 9 (0 Kb/s)
        Latency: 110 msec (50-111 msec ~109 msec)
> ACL Data RX: Handle 2649 flags 0x02 dlen 11              #156 [hci1] 9.449157
      ATT: Read By Type Request (0x08) len 6
        Handle range: 0x002a-0x003c
        Attribute type: Characteristic (0x2803)
< HCI Command: Host Number of Comp.. (0x03|0x0035) plen 5  #157 [hci1] 9.458190
        Num handles: 1
        Handle: 2649 Address: DF:A9:FF:F6:B1:1A (OUI DF-A9-FF)
        Count: 1
< ACL Data TX: Handle 2649 flags 0x00 dlen 27              #158 [hci1] 9.458278
< ACL Data TX: Handle 2649 flags 0x01 dlen 21              #159 [hci1] 9.458315
      ATT: Read By Type Response (0x09) len 43
        Attribute data length: 7
        Attribute data list: 6 entries
        Handle: 0x002b
        Value: 122c00c92b
            Properties: 0x12
              Read (0x02)
              Notify (0x10)
            Value Handle: 0x002c
            Value UUID: Sink PAC (0x2bc9)
        Handle: 0x002e
        Value: 1a2f00ca2b
            Properties: 0x1a
              Read (0x02)
              Write (0x08)
              Notify (0x10)
            Value Handle: 0x002f
            Value UUID: Sink Audio Locations (0x2bca)
        Handle: 0x0031
        Value: 123200cb2b
            Properties: 0x12
              Read (0x02)
              Notify (0x10)
            Value Handle: 0x0032
            Value UUID: Source PAC (0x2bcb)
        Handle: 0x0034
        Value: 1a3500cc2b
            Properties: 0x1a
              Read (0x02)
              Write (0x08)
              Notify (0x10)
            Value Handle: 0x0035
            Value UUID: Source Audio Locations (0x2bcc)
        Handle: 0x0037
        Value: 123800cd2b
            Properties: 0x12
              Read (0x02)
              Notify (0x10)
            Value Handle: 0x0038
            Value UUID: Available Audio Contexts (0x2bcd)
        Handle: 0x003a
        Value: 123b00ce2b
            Properties: 0x12
              Read (0x02)
              Notify (0x10)
            Value Handle: 0x003b
            Value UUID: Supported Audio Contexts (0x2bce)
> HCI Event: Number of Completed Packets (0x13) plen 5     #160 [hci1] 9.509314
        Num handles: 1
        Handle: 2649 Address: DF:A9:FF:F6:B1:1A (OUI DF-A9-FF)
        Count: 1
        #158: len 27 (4 Kb/s)
        Latency: 51 msec (50-111 msec ~80 msec)
> HCI Event: Number of Completed Packets (0x13) plen 5     #161 [hci1] 9.568993
        Num handles: 1
        Handle: 2649 Address: DF:A9:FF:F6:B1:1A (OUI DF-A9-FF)
        Count: 1
        #159: len 21 (1 Kb/s)
        Latency: 110 msec (50-111 msec ~95 msec)
> ACL Data RX: Handle 2649 flags 0x02 dlen 11              #162 [hci1] 9.569116
      ATT: Read By Type Request (0x08) len 6
        Handle range: 0x003b-0x003c
        Attribute type: Characteristic (0x2803)
< HCI Command: Host Number of Comp.. (0x03|0x0035) plen 5  #163 [hci1] 9.578339
        Num handles: 1
        Handle: 2649 Address: DF:A9:FF:F6:B1:1A (OUI DF-A9-FF)
        Count: 1
< ACL Data TX: Handle 2649 flags 0x00 dlen 9               #164 [hci1] 9.578560
      ATT: Error Response (0x01) len 4
        Read By Type Request (0x08)
        Handle: 0x003b
        Error: Attribute Not Found (0x0a)
> HCI Event: Number of Completed Packets (0x13) plen 5     #165 [hci1] 9.689030
        Num handles: 1
        Handle: 2649 Address: DF:A9:FF:F6:B1:1A (OUI DF-A9-FF)
        Count: 1
        #164: len 9 (0 Kb/s)
        Latency: 110 msec (50-111 msec ~102 msec)
> ACL Data RX: Handle 2649 flags 0x02 dlen 9               #166 [hci1] 9.689123
      ATT: Find Information Request (0x04) len 4
        Handle range: 0x002d-0x002d
< HCI Command: Host Number of Comp.. (0x03|0x0035) plen 5  #167 [hci1] 9.697877
        Num handles: 1
        Handle: 2649 Address: DF:A9:FF:F6:B1:1A (OUI DF-A9-FF)
        Count: 1
< ACL Data TX: Handle 2649 flags 0x00 dlen 10              #168 [hci1] 9.697967
      ATT: Find Information Response (0x05) len 5
        Format: UUID-16 (0x01)
        Handle: 0x002d
        UUID: Client Characteristic Configuration (0x2902)
> HCI Event: Number of Completed Packets (0x13) plen 5     #169 [hci1] 9.808963
        Num handles: 1
        Handle: 2649 Address: DF:A9:FF:F6:B1:1A (OUI DF-A9-FF)
        Count: 1
        #168: len 10 (0 Kb/s)
        Latency: 110 msec (50-111 msec ~106 msec)
> ACL Data RX: Handle 2649 flags 0x02 dlen 9               #170 [hci1] 9.809054
      ATT: Find Information Request (0x04) len 4
        Handle range: 0x0030-0x0030
< HCI Command: Host Number of Comp.. (0x03|0x0035) plen 5  #171 [hci1] 9.818112
        Num handles: 1
        Handle: 2649 Address: DF:A9:FF:F6:B1:1A (OUI DF-A9-FF)
        Count: 1
< ACL Data TX: Handle 2649 flags 0x00 dlen 10              #172 [hci1] 9.818189
      ATT: Find Information Response (0x05) len 5
        Format: UUID-16 (0x01)
        Handle: 0x0030
        UUID: Client Characteristic Configuration (0x2902)
> HCI Event: Number of Completed Packets (0x13) plen 5     #173 [hci1] 9.929030
        Num handles: 1
        Handle: 2649 Address: DF:A9:FF:F6:B1:1A (OUI DF-A9-FF)
        Count: 1
        #172: len 10 (0 Kb/s)
        Latency: 110 msec (50-111 msec ~108 msec)
> ACL Data RX: Handle 2649 flags 0x02 dlen 9               #174 [hci1] 9.929084
      ATT: Find Information Request (0x04) len 4
        Handle range: 0x0033-0x0033
< HCI Command: Host Number of Comp.. (0x03|0x0035) plen 5  #175 [hci1] 9.938199
        Num handles: 1
        Handle: 2649 Address: DF:A9:FF:F6:B1:1A (OUI DF-A9-FF)
        Count: 1
< ACL Data TX: Handle 2649 flags 0x00 dlen 10              #176 [hci1] 9.938334
      ATT: Find Information Response (0x05) len 5
        Format: UUID-16 (0x01)
        Handle: 0x0033
        UUID: Client Characteristic Configuration (0x2902)
> HCI Event: Number of Completed Packets (0x13) plen 5    #177 [hci1] 10.049043
        Num handles: 1
        Handle: 2649 Address: DF:A9:FF:F6:B1:1A (OUI DF-A9-FF)
        Count: 1
        #176: len 10 (0 Kb/s)
        Latency: 110 msec (50-111 msec ~109 msec)
> ACL Data RX: Handle 2649 flags 0x02 dlen 9              #178 [hci1] 10.049102
      ATT: Find Information Request (0x04) len 4
        Handle range: 0x0036-0x0036
< HCI Command: Host Number of Com.. (0x03|0x0035) plen 5  #179 [hci1] 10.058273
        Num handles: 1
        Handle: 2649 Address: DF:A9:FF:F6:B1:1A (OUI DF-A9-FF)
        Count: 1
< ACL Data TX: Handle 2649 flags 0x00 dlen 10             #180 [hci1] 10.058381
      ATT: Find Information Response (0x05) len 5
        Format: UUID-16 (0x01)
        Handle: 0x0036
        UUID: Client Characteristic Configuration (0x2902)
> HCI Event: Number of Completed Packets (0x13) plen 5    #181 [hci1] 10.169022
        Num handles: 1
        Handle: 2649 Address: DF:A9:FF:F6:B1:1A (OUI DF-A9-FF)
        Count: 1
        #180: len 10 (0 Kb/s)
        Latency: 110 msec (50-111 msec ~110 msec)
> ACL Data RX: Handle 2649 flags 0x02 dlen 9              #182 [hci1] 10.169116
      ATT: Find Information Request (0x04) len 4
        Handle range: 0x0039-0x0039
< HCI Command: Host Number of Com.. (0x03|0x0035) plen 5  #183 [hci1] 10.177858
        Num handles: 1
        Handle: 2649 Address: DF:A9:FF:F6:B1:1A (OUI DF-A9-FF)
        Count: 1
< ACL Data TX: Handle 2649 flags 0x00 dlen 10             #184 [hci1] 10.177877
      ATT: Find Information Response (0x05) len 5
        Format: UUID-16 (0x01)
        Handle: 0x0039
        UUID: Client Characteristic Configuration (0x2902)
> HCI Event: Number of Completed Packets (0x13) plen 5    #185 [hci1] 10.289062
        Num handles: 1
        Handle: 2649 Address: DF:A9:FF:F6:B1:1A (OUI DF-A9-FF)
        Count: 1
        #184: len 10 (0 Kb/s)
        Latency: 111 msec (50-111 msec ~110 msec)
> ACL Data RX: Handle 2649 flags 0x02 dlen 9              #186 [hci1] 10.289097
      ATT: Find Information Request (0x04) len 4
        Handle range: 0x003c-0x003c
< HCI Command: Host Number of Com.. (0x03|0x0035) plen 5  #187 [hci1] 10.297766
        Num handles: 1
        Handle: 2649 Address: DF:A9:FF:F6:B1:1A (OUI DF-A9-FF)
        Count: 1
< ACL Data TX: Handle 2649 flags 0x00 dlen 10             #188 [hci1] 10.297875
      ATT: Find Information Response (0x05) len 5
        Format: UUID-16 (0x01)
        Handle: 0x003c
        UUID: Client Characteristic Configuration (0x2902)
> HCI Event: Number of Completed Packets (0x13) plen 5    #189 [hci1] 10.408938
        Num handles: 1
        Handle: 2649 Address: DF:A9:FF:F6:B1:1A (OUI DF-A9-FF)
        Count: 1
        #188: len 10 (0 Kb/s)
        Latency: 111 msec (50-111 msec ~110 msec)
> ACL Data RX: Handle 2649 flags 0x02 dlen 11             #190 [hci1] 10.409084
      ATT: Read By Type Request (0x08) len 6
        Handle range: 0x003d-0x004c
        Attribute type: Characteristic (0x2803)
< HCI Command: Host Number of Com.. (0x03|0x0035) plen 5  #191 [hci1] 10.418431
        Num handles: 1
        Handle: 2649 Address: DF:A9:FF:F6:B1:1A (OUI DF-A9-FF)
        Count: 1
< ACL Data TX: Handle 2649 flags 0x00 dlen 27             #192 [hci1] 10.418539
< ACL Data TX: Handle 2649 flags 0x01 dlen 14             #193 [hci1] 10.418567
      ATT: Read By Type Response (0x09) len 36
        Attribute data length: 7
        Attribute data list: 5 entries
        Handle: 0x003e
        Value: 1c3f00c62b
            Properties: 0x1c
              Write Without Response (0x04)
              Write (0x08)
              Notify (0x10)
            Value Handle: 0x003f
            Value UUID: ASE Control Point (0x2bc6)
        Handle: 0x0041
        Value: 124200c42b
            Properties: 0x12
              Read (0x02)
              Notify (0x10)
            Value Handle: 0x0042
            Value UUID: Sink ASE (0x2bc4)
        Handle: 0x0044
        Value: 124500c42b
            Properties: 0x12
              Read (0x02)
              Notify (0x10)
            Value Handle: 0x0045
            Value UUID: Sink ASE (0x2bc4)
        Handle: 0x0047
        Value: 124800c52b
            Properties: 0x12
              Read (0x02)
              Notify (0x10)
            Value Handle: 0x0048
            Value UUID: Source ASE (0x2bc5)
        Handle: 0x004a
        Value: 124b00c52b
            Properties: 0x12
              Read (0x02)
              Notify (0x10)
            Value Handle: 0x004b
            Value UUID: Source ASE (0x2bc5)
> HCI Event: Number of Completed Packets (0x13) plen 5    #194 [hci1] 10.469339
        Num handles: 1
        Handle: 2649 Address: DF:A9:FF:F6:B1:1A (OUI DF-A9-FF)
        Count: 1
        #192: len 27 (4 Kb/s)
        Latency: 50 msec (50-111 msec ~80 msec)
> HCI Event: Number of Completed Packets (0x13) plen 5    #195 [hci1] 10.529004
        Num handles: 1
        Handle: 2649 Address: DF:A9:FF:F6:B1:1A (OUI DF-A9-FF)
        Count: 1
        #193: len 14 (1 Kb/s)
        Latency: 110 msec (50-111 msec ~95 msec)
> ACL Data RX: Handle 2649 flags 0x02 dlen 11             #196 [hci1] 10.529150
      ATT: Read By Type Request (0x08) len 6
        Handle range: 0x004b-0x004c
        Attribute type: Characteristic (0x2803)
< HCI Command: Host Number of Com.. (0x03|0x0035) plen 5  #197 [hci1] 10.538281
        Num handles: 1
        Handle: 2649 Address: DF:A9:FF:F6:B1:1A (OUI DF-A9-FF)
        Count: 1
< ACL Data TX: Handle 2649 flags 0x00 dlen 9              #198 [hci1] 10.538473
      ATT: Error Response (0x01) len 4
        Read By Type Request (0x08)
        Handle: 0x004b
        Error: Attribute Not Found (0x0a)
> HCI Event: Number of Completed Packets (0x13) plen 5    #199 [hci1] 10.649005
        Num handles: 1
        Handle: 2649 Address: DF:A9:FF:F6:B1:1A (OUI DF-A9-FF)
        Count: 1
        #198: len 9 (0 Kb/s)
        Latency: 110 msec (50-111 msec ~103 msec)
> ACL Data RX: Handle 2649 flags 0x02 dlen 9              #200 [hci1] 10.649110
      ATT: Find Information Request (0x04) len 4
        Handle range: 0x0040-0x0040
< HCI Command: Host Number of Com.. (0x03|0x0035) plen 5  #201 [hci1] 10.658112
        Num handles: 1
        Handle: 2649 Address: DF:A9:FF:F6:B1:1A (OUI DF-A9-FF)
        Count: 1
< ACL Data TX: Handle 2649 flags 0x00 dlen 10             #202 [hci1] 10.658202
      ATT: Find Information Response (0x05) len 5
        Format: UUID-16 (0x01)
        Handle: 0x0040
        UUID: Client Characteristic Configuration (0x2902)
> HCI Event: Number of Completed Packets (0x13) plen 5    #203 [hci1] 10.768979
        Num handles: 1
        Handle: 2649 Address: DF:A9:FF:F6:B1:1A (OUI DF-A9-FF)
        Count: 1
        #202: len 10 (0 Kb/s)
        Latency: 110 msec (50-111 msec ~106 msec)
> ACL Data RX: Handle 2649 flags 0x02 dlen 9              #204 [hci1] 10.769074
      ATT: Find Information Request (0x04) len 4
        Handle range: 0x0043-0x0043
< HCI Command: Host Number of Com.. (0x03|0x0035) plen 5  #205 [hci1] 10.777916
        Num handles: 1
        Handle: 2649 Address: DF:A9:FF:F6:B1:1A (OUI DF-A9-FF)
        Count: 1
< ACL Data TX: Handle 2649 flags 0x00 dlen 10             #206 [hci1] 10.777981
      ATT: Find Information Response (0x05) len 5
        Format: UUID-16 (0x01)
        Handle: 0x0043
        UUID: Client Characteristic Configuration (0x2902)
> HCI Event: Number of Completed Packets (0x13) plen 5    #207 [hci1] 10.888934
        Num handles: 1
        Handle: 2649 Address: DF:A9:FF:F6:B1:1A (OUI DF-A9-FF)
        Count: 1
        #206: len 10 (0 Kb/s)
        Latency: 110 msec (50-111 msec ~108 msec)
> ACL Data RX: Handle 2649 flags 0x02 dlen 9              #208 [hci1] 10.889135
      ATT: Find Information Request (0x04) len 4
        Handle range: 0x0046-0x0046
< HCI Command: Host Number of Com.. (0x03|0x0035) plen 5  #209 [hci1] 10.898151
        Num handles: 1
        Handle: 2649 Address: DF:A9:FF:F6:B1:1A (OUI DF-A9-FF)
        Count: 1
< ACL Data TX: Handle 2649 flags 0x00 dlen 10             #210 [hci1] 10.898234
      ATT: Find Information Response (0x05) len 5
        Format: UUID-16 (0x01)
        Handle: 0x0046
        UUID: Client Characteristic Configuration (0x2902)
> HCI Event: Number of Completed Packets (0x13) plen 5    #211 [hci1] 11.008972
        Num handles: 1
        Handle: 2649 Address: DF:A9:FF:F6:B1:1A (OUI DF-A9-FF)
        Count: 1
        #210: len 10 (0 Kb/s)
        Latency: 110 msec (50-111 msec ~109 msec)
> ACL Data RX: Handle 2649 flags 0x02 dlen 9              #212 [hci1] 11.009125
      ATT: Find Information Request (0x04) len 4
        Handle range: 0x0049-0x0049
< HCI Command: Host Number of Com.. (0x03|0x0035) plen 5  #213 [hci1] 11.018286
        Num handles: 1
        Handle: 2649 Address: DF:A9:FF:F6:B1:1A (OUI DF-A9-FF)
        Count: 1
< ACL Data TX: Handle 2649 flags 0x00 dlen 10             #214 [hci1] 11.018385
      ATT: Find Information Response (0x05) len 5
        Format: UUID-16 (0x01)
        Handle: 0x0049
        UUID: Client Characteristic Configuration (0x2902)
> HCI Event: Number of Completed Packets (0x13) plen 5    #215 [hci1] 11.129016
        Num handles: 1
        Handle: 2649 Address: DF:A9:FF:F6:B1:1A (OUI DF-A9-FF)
        Count: 1
        #214: len 10 (0 Kb/s)
        Latency: 110 msec (50-111 msec ~110 msec)
> ACL Data RX: Handle 2649 flags 0x02 dlen 9              #216 [hci1] 11.129064
      ATT: Find Information Request (0x04) len 4
        Handle range: 0x004c-0x004c
< HCI Command: Host Number of Com.. (0x03|0x0035) plen 5  #217 [hci1] 11.138308
        Num handles: 1
        Handle: 2649 Address: DF:A9:FF:F6:B1:1A (OUI DF-A9-FF)
        Count: 1
< ACL Data TX: Handle 2649 flags 0x00 dlen 10             #218 [hci1] 11.138449
      ATT: Find Information Response (0x05) len 5
        Format: UUID-16 (0x01)
        Handle: 0x004c
        UUID: Client Characteristic Configuration (0x2902)
> HCI Event: Number of Completed Packets (0x13) plen 5    #219 [hci1] 11.249029
        Num handles: 1
        Handle: 2649 Address: DF:A9:FF:F6:B1:1A (OUI DF-A9-FF)
        Count: 1
        #218: len 10 (0 Kb/s)
        Latency: 110 msec (50-111 msec ~110 msec)
> ACL Data RX: Handle 2649 flags 0x02 dlen 11             #220 [hci1] 11.249126
      ATT: Read By Type Request (0x08) len 6
        Handle range: 0x004d-0x0052
        Attribute type: Characteristic (0x2803)
< HCI Command: Host Number of Com.. (0x03|0x0035) plen 5  #221 [hci1] 11.257995
        Num handles: 1
        Handle: 2649 Address: DF:A9:FF:F6:B1:1A (OUI DF-A9-FF)
        Count: 1
< ACL Data TX: Handle 2649 flags 0x00 dlen 20             #222 [hci1] 11.258037
      ATT: Read By Type Response (0x09) len 15
        Attribute data length: 7
        Attribute data list: 2 entries
        Handle: 0x004e
        Value: 0c4f00c72b
            Properties: 0x0c
              Write Without Response (0x04)
              Write (0x08)
            Value Handle: 0x004f
            Value UUID: Broadcast Audio Scan Control Point (0x2bc7)
        Handle: 0x0050
        Value: 125100c82b
            Properties: 0x12
              Read (0x02)
              Notify (0x10)
            Value Handle: 0x0051
            Value UUID: Broadcast Receive State (0x2bc8)
> HCI Event: Number of Completed Packets (0x13) plen 5    #223 [hci1] 11.368932
        Num handles: 1
        Handle: 2649 Address: DF:A9:FF:F6:B1:1A (OUI DF-A9-FF)
        Count: 1
        #222: len 20 (1 Kb/s)
        Latency: 110 msec (50-111 msec ~110 msec)
> ACL Data RX: Handle 2649 flags 0x02 dlen 11             #224 [hci1] 11.369097
      ATT: Read By Type Request (0x08) len 6
        Handle range: 0x0051-0x0052
        Attribute type: Characteristic (0x2803)
< HCI Command: Host Number of Com.. (0x03|0x0035) plen 5  #225 [hci1] 11.377967
        Num handles: 1
        Handle: 2649 Address: DF:A9:FF:F6:B1:1A (OUI DF-A9-FF)
        Count: 1
< ACL Data TX: Handle 2649 flags 0x00 dlen 9              #226 [hci1] 11.378081
      ATT: Error Response (0x01) len 4
        Read By Type Request (0x08)
        Handle: 0x0051
        Error: Attribute Not Found (0x0a)
> HCI Event: Number of Completed Packets (0x13) plen 5    #227 [hci1] 11.488939
        Num handles: 1
        Handle: 2649 Address: DF:A9:FF:F6:B1:1A (OUI DF-A9-FF)
        Count: 1
        #226: len 9 (0 Kb/s)
        Latency: 110 msec (50-111 msec ~110 msec)
> ACL Data RX: Handle 2649 flags 0x02 dlen 9              #228 [hci1] 11.489102
      ATT: Find Information Request (0x04) len 4
        Handle range: 0x0052-0x0052
< HCI Command: Host Number of Com.. (0x03|0x0035) plen 5  #229 [hci1] 11.498272
        Num handles: 1
        Handle: 2649 Address: DF:A9:FF:F6:B1:1A (OUI DF-A9-FF)
        Count: 1
< ACL Data TX: Handle 2649 flags 0x00 dlen 10             #230 [hci1] 11.498429
      ATT: Find Information Response (0x05) len 5
        Format: UUID-16 (0x01)
        Handle: 0x0052
        UUID: Client Characteristic Configuration (0x2902)
> HCI Event: Number of Completed Packets (0x13) plen 5    #231 [hci1] 11.609004
        Num handles: 1
        Handle: 2649 Address: DF:A9:FF:F6:B1:1A (OUI DF-A9-FF)
        Count: 1
        #230: len 10 (0 Kb/s)
        Latency: 110 msec (50-111 msec ~110 msec)
> ACL Data RX: Handle 2649 flags 0x02 dlen 11             #232 [hci1] 11.609077
      ATT: Read By Type Request (0x08) len 6
        Handle range: 0x0001-0xffff
        Attribute type: Include (0x2802)
< HCI Command: Host Number of Com.. (0x03|0x0035) plen 5  #233 [hci1] 11.618280
        Num handles: 1
        Handle: 2649 Address: DF:A9:FF:F6:B1:1A (OUI DF-A9-FF)
        Count: 1
< ACL Data TX: Handle 2649 flags 0x00 dlen 9              #234 [hci1] 11.618568
      ATT: Error Response (0x01) len 4
        Read By Type Request (0x08)
        Handle: 0x0001
        Error: Attribute Not Found (0x0a)
> HCI Event: Number of Completed Packets (0x13) plen 5    #235 [hci1] 11.729037
        Num handles: 1
        Handle: 2649 Address: DF:A9:FF:F6:B1:1A (OUI DF-A9-FF)
        Count: 1
        #234: len 9 (0 Kb/s)
        Latency: 110 msec (50-111 msec ~110 msec)
> ACL Data RX: Handle 2649 flags 0x02 dlen 9              #236 [hci1] 11.729040
      ATT: Write Request (0x12) len 4
        Handle: 0x0052 Type: Client Characteristic Configuration (0x2902)
        Value Handle: 0x0051 Type: Broadcast Receive State (0x2bc8)
          Data: 0000
< HCI Command: Host Number of Com.. (0x03|0x0035) plen 5  #237 [hci1] 11.737994
        Num handles: 1
        Handle: 2649 Address: DF:A9:FF:F6:B1:1A (OUI DF-A9-FF)
        Count: 1
< ACL Data TX: Handle 2649 flags 0x00 dlen 5              #238 [hci1] 11.738085
      ATT: Write Response (0x13) len 0
> HCI Event: Number of Completed Packets (0x13) plen 5    #239 [hci1] 11.848971
        Num handles: 1
        Handle: 2649 Address: DF:A9:FF:F6:B1:1A (OUI DF-A9-FF)
        Count: 1
        #238: len 5 (0 Kb/s)
        Latency: 110 msec (50-111 msec ~110 msec)
> ACL Data RX: Handle 2649 flags 0x02 dlen 9              #240 [hci1] 11.849115
      ATT: Write Request (0x12) len 4
        Handle: 0x0052 Type: Client Characteristic Configuration (0x2902)
        Value Handle: 0x0051 Type: Broadcast Receive State (0x2bc8)
          Data: 0100
            Notification (0x01)
< HCI Command: Host Number of Com.. (0x03|0x0035) plen 5  #241 [hci1] 11.857978
        Num handles: 1
        Handle: 2649 Address: DF:A9:FF:F6:B1:1A (OUI DF-A9-FF)
        Count: 1
< ACL Data TX: Handle 2649 flags 0x00 dlen 5              #242 [hci1] 11.858054
      ATT: Write Response (0x13) len 0
> HCI Event: Number of Completed Packets (0x13) plen 5    #243 [hci1] 11.968904
        Num handles: 1
        Handle: 2649 Address: DF:A9:FF:F6:B1:1A (OUI DF-A9-FF)
        Count: 1
        #242: len 5 (0 Kb/s)
        Latency: 110 msec (50-111 msec ~110 msec)
< HCI Command: LE Set Random Addr.. (0x08|0x0005) plen 6  #244 [hci1] 12.087689
        Address: 06:5C:55:95:A0:5D (Non-Resolvable)
> HCI Event: Command Complete (0x0e) plen 4               #245 [hci1] 12.088170
      LE Set Random Address (0x08|0x0005) ncmd 1
        Status: Success (0x00)
< HCI Command: LE Set Extended Sc.. (0x08|0x0041) plen 8  #246 [hci1] 12.097702
        Own address type: Random (0x01)
        Filter policy: Accept all advertisement (0x00)
        PHYs: 0x01
        Entry 0: LE 1M
          Type: Active (0x01)
          Interval: 60.000 msec (0x0060)
          Window: 30.000 msec (0x0030)
> HCI Event: Command Complete (0x0e) plen 4               #247 [hci1] 12.098201
      LE Set Extended Scan Parameters (0x08|0x0041) ncmd 1
        Status: Success (0x00)
< HCI Command: LE Set Extended Sc.. (0x08|0x0042) plen 6  #248 [hci1] 12.117724
        Extended scan: Enabled (0x01)
        Filter duplicates: Enabled (0x01)
        Duration: 0 msec (0x0000)
        Period: 0.00 sec (0x0000)
> HCI Event: Command Complete (0x0e) plen 4               #249 [hci1] 12.118221
      LE Set Extended Scan Enable (0x08|0x0042) ncmd 1
        Status: Success (0x00)
> HCI Event: LE Meta Event (0x3e) plen 48                 #250 [hci1] 12.681696
      LE Extended Advertising Report (0x0d)
        Num reports: 1
        Entry 0
          Event type: 0x0000
            Props: 0x0000
            Data status: [0;32mComplete[0m
          Address type: Public (0x00)
          Address: DF:A9:FF:F6:B1:1A (OUI DF-A9-FF)
          Primary PHY: LE 1M
          Secondary PHY: LE 1M
          SID: 0x01
          TX power: 127 dBm
          RSSI: -25 dBm (0xe7)
          Periodic advertising interval: 120.00 msec (0x0060)
          Direct address type: Reserved (0xff)
          Direct address: 00-00-00-00-00-00
          Data length: 0x16
        06 16 52 18 a6 3b 50 0e 09 50 54 53 2d 42 41 53  ..R..;P..PTS-BAS
        53 2d 42 31 31 41                                S-B11A          
        Service Data: Broadcast Audio Announcement (0x1852)
        Broadcast ID: 5258150 (0x503ba6)
        Name (complete): PTS-BASS-B11A
< HCI Command: LE Set Extended Sc.. (0x08|0x0042) plen 6  #251 [hci1] 12.767820
        Extended scan: Disabled (0x00)
        Filter duplicates: Disabled (0x00)
        Duration: 0 msec (0x0000)
        Period: 0.00 sec (0x0000)
> HCI Event: Command Complete (0x0e) plen 4               #252 [hci1] 12.768320
      LE Set Extended Scan Enable (0x08|0x0042) ncmd 1
        Status: Success (0x00)
< HCI Command: LE Periodic Adver.. (0x08|0x0044) plen 14  #253 [hci1] 12.797811
        Options: 0x0000
        Use advertising SID, Advertiser Address Type and address
        Reporting initially enabled
        SID: 0x01
        Adv address type: Public (0x00)
        Adv address: DF:A9:FF:F6:B1:1A (OUI DF-A9-FF)
        Skip: 0x0005
        Sync timeout: 10000 msec (0x03e8)
        Sync CTE type: 0x0000
> HCI Event: Command Status (0x0f) plen 4                 #254 [hci1] 12.798488
      LE Periodic Advertising Create Sync (0x08|0x0044) ncmd 1
        Status: Success (0x00)
< HCI Command: LE Set Random Addr.. (0x08|0x0005) plen 6  #255 [hci1] 12.817727
        Address: 20:89:9F:67:02:4D (Non-Resolvable)
> HCI Event: Command Complete (0x0e) plen 4               #256 [hci1] 12.818171
      LE Set Random Address (0x08|0x0005) ncmd 1
        Status: Success (0x00)
< HCI Command: LE Set Extended S.. (0x08|0x0041) plen 13  #257 [hci1] 12.837731
        Own address type: Random (0x01)
        Filter policy: Accept all advertisement (0x00)
        PHYs: 0x05
        Entry 0: LE 1M
          Type: Passive (0x00)
          Interval: 60.000 msec (0x0060)
          Window: 30.000 msec (0x0030)
        Entry 1: LE Coded
          Type: Passive (0x00)
          Interval: 60.000 msec (0x0060)
          Window: 30.000 msec (0x0030)
> HCI Event: Command Complete (0x0e) plen 4               #258 [hci1] 12.838271
      LE Set Extended Scan Parameters (0x08|0x0041) ncmd 1
        Status: Success (0x00)
< HCI Command: LE Set Extended Sc.. (0x08|0x0042) plen 6  #259 [hci1] 12.857740
        Extended scan: Enabled (0x01)
        Filter duplicates: Enabled (0x01)
        Duration: 0 msec (0x0000)
        Period: 0.00 sec (0x0000)
> HCI Event: Command Complete (0x0e) plen 4               #260 [hci1] 12.858279
      LE Set Extended Scan Enable (0x08|0x0042) ncmd 1
        Status: Success (0x00)
> HCI Event: LE Meta Event (0x3e) plen 48                 #261 [hci1] 12.883374
      LE Extended Advertising Report (0x0d)
        Num reports: 1
        Entry 0
          Event type: 0x0000
            Props: 0x0000
            Data status: [0;32mComplete[0m
          Address type: Public (0x00)
          Address: DF:A9:FF:F6:B1:1A (OUI DF-A9-FF)
          Primary PHY: LE 1M
          Secondary PHY: LE 1M
          SID: 0x01
          TX power: 127 dBm
          RSSI: -25 dBm (0xe7)
          Periodic advertising interval: 120.00 msec (0x0060)
          Direct address type: Reserved (0xff)
          Direct address: 00-00-00-00-00-00
          Data length: 0x16
        06 16 52 18 a6 3b 50 0e 09 50 54 53 2d 42 41 53  ..R..;P..PTS-BAS
        53 2d 42 31 31 41                                S-B11A          
        Service Data: Broadcast Audio Announcement (0x1852)
        Broadcast ID: 5258150 (0x503ba6)
        Name (complete): PTS-BASS-B11A
> HCI Event: LE Meta Event (0x3e) plen 16                 #262 [hci1] 12.919752
      LE Periodic Advertising Sync Established (0x0e)
        Status: Success (0x00)
        Sync handle: 3675
        Advertising SID: 0x01
        Advertiser address type: Resolved Public (0x02)
        Advertiser address: DF:A9:FF:F6:B1:1A (OUI DF-A9-FF)
        Advertiser PHY: LE 1M (0x01)
        Periodic advertising interval: 120.00 msec (0x0060)
        Advertiser clock accuracy: 0x01
> HCI Event: LE Meta Event (0x3e) plen 48                 #263 [hci1] 12.920229
      LE Periodic Advertising Report (0x0f)
        Sync handle: 3675
        TX power: 127 dbm (0x7f)
        RSSI: -24 dBm (0xe8)
        CTE Type: No Constant Tone Extension (0xff)
        Data status: [0;32mComplete[0m
        Data length: 0x28
        27 16 51 18 40 9c 00 01 01 06 00 00 00 00 0a 02  '.Q.@...........
        01 03 02 02 01 03 04 28 00 06 03 02 04 00 01 09  .......(........
        01 06 05 03 01 00 00 00                          ........        
> HCI Event: LE Meta Event (0x3e) plen 20                 #264 [hci1] 12.920464
      LE Broadcast Isochronous Group Info Advertising Report (0x22)
        Sync Handle: 0x0e5b
        Number BIS: 1
        NSE: 3
        ISO Interval: 10.00 msec (0x0008)
        BN: 1
        PTO: 1
        IRC: 2
        Maximum PDU: 40
        SDU Interval: 10000 us (0x002710)
        Maximum SDU: 40
        PHY: LE 1M (0x01)
        Framing: Unframed (0x00)
        Encryption: 0x00
< HCI Command: LE Set Extended Sc.. (0x08|0x0042) plen 6  #265 [hci1] 12.937844
        Extended scan: Disabled (0x00)
        Filter duplicates: Disabled (0x00)
        Duration: 0 msec (0x0000)
        Period: 0.00 sec (0x0000)
> HCI Event: Command Complete (0x0e) plen 4               #266 [hci1] 12.939515
      LE Set Extended Scan Enable (0x08|0x0042) ncmd 1
        Status: Success (0x00)
< ACL Data TX: Handle 2649 flags 0x00 dlen 27             #267 [hci1] 12.960638
< ACL Data TX: Handle 2649 flags 0x01 dlen 6              #268 [hci1] 12.960649
      ATT: Handle Value Notification (0x1b) len 28
        Handle: 0x0051 Type: Broadcast Receive State (0x2bc8)
          Data: 00001ab1f6ffa9df01a63b500200010000000006030204000109
          Source_ID: 0
          Source_Address_Type: 0
          Source_Address: DF:A9:FF:F6:B1:1A
          Source_Adv_SID: 1
          Broadcast_ID: 0x503ba6
          PA_Sync_State: Synchronized to PA
          BIG_Encryption: Not encrypted
          Num_Subgroups: 1
          Subgroup #0:
            BIS_Sync State: 0x00000000
            Metadata: #0: len 0x03 type 0x02
            Metadata:   04 00                                            ..              
            Metadata: #1: len 0x01 type 0x09
> HCI Event: Number of Completed Packets (0x13) plen 5    #269 [hci1] 12.989239
        Num handles: 1
        Handle: 2649 Address: DF:A9:FF:F6:B1:1A (OUI DF-A9-FF)
        Count: 1
        #267: len 27 (7 Kb/s)
        Latency: 28 msec (28-111 msec ~69 msec)
< HCI Command: LE Broadcast Isoc.. (0x08|0x006b) plen 25  #270 [hci1] 13.018458
        BIG Handle: 0x00
        BIG Sync Handle: 0x0e5b
        Encryption: Unencrypted (0x00)
        Broadcast Code: 00000000000000000000000000000000
        Maximum Number Subevents: 0x00
        Timeout: 200 ms (0x0014)
        Number of BIS: 1
        BIS ID: 0x01
> HCI Event: Command Status (0x0f) plen 4                 #271 [hci1] 13.019623
      LE Broadcast Isochronous Group Create Sync (0x08|0x006b) ncmd 1
        Status: Success (0x00)
> HCI Event: Number of Completed Packets (0x13) plen 5    #272 [hci1] 13.048835
        Num handles: 1
        Handle: 2649 Address: DF:A9:FF:F6:B1:1A (OUI DF-A9-FF)
        Count: 1
        #268: len 6 (0 Kb/s)
        Latency: 88 msec (28-111 msec ~78 msec)
> HCI Event: LE Meta Event (0x3e) plen 48                 #273 [hci1] 13.640011
      LE Periodic Advertising Report (0x0f)
        Sync handle: 3675
        TX power: 127 dbm (0x7f)
        RSSI: -23 dBm (0xe9)
        CTE Type: No Constant Tone Extension (0xff)
        Data status: [0;32mComplete[0m
        Data length: 0x28
        27 16 51 18 40 9c 00 01 01 06 00 00 00 00 0a 02  '.Q.@...........
        01 03 02 02 01 03 04 28 00 06 03 02 04 00 01 09  .......(........
        01 06 05 03 01 00 00 00                          ........        
> HCI Event: LE Meta Event (0x3e) plen 20                 #274 [hci1] 13.640227
      LE Broadcast Isochronous Group Info Advertising Report (0x22)
        Sync Handle: 0x0e5b
        Number BIS: 1
        NSE: 3
        ISO Interval: 10.00 msec (0x0008)
        BN: 1
        PTO: 1
        IRC: 2
        Maximum PDU: 40
        SDU Interval: 10000 us (0x002710)
        Maximum SDU: 40
        PHY: LE 1M (0x01)
        Framing: Unframed (0x00)
        Encryption: 0x00
> HCI Event: LE Meta Event (0x3e) plen 17                 #275 [hci1] 13.646362
      LE Broadcast Isochronous Group Sync Estabilished (0x1d)
        Status: Success (0x00)
        BIG Handle: 0x00
        Transport Latency: 11500 us (0x002cec)
        NSE: 3
        BN: 1
        PTO: 1
        IRC: 2
        Maximum PDU: 40
        ISO Interval: 10.00 msec (0x0008)
        Connection Handle #0: 214
< HCI Command: LE Setup Isochron.. (0x08|0x006e) plen 13  #276 [hci1] 13.658259
        Handle: 214
        Data Path Direction: Output (Controller to Host) (0x01)
        Data Path: HCI (0x00)
        Coding Format: Transparent (0x03)
        Company Codec ID: Ericsson Technology Licensing (0)
        Vendor Codec ID: 0
        Controller Delay: 0 us (0x000000)
        Codec Configuration Length: 0
        Codec Configuration: 
> HCI Event: Command Complete (0x0e) plen 6               #277 [hci1] 13.658834
      LE Setup Isochronous Data Path (0x08|0x006e) ncmd 1
        Status: Success (0x00)
        Handle: 214
> ISO Data RX: Handle 214 flags 0x06 dlen 8               #278 [hci1] 13.666172
> ISO Data RX: Handle 214 flags 0x06 dlen 8               #279 [hci1] 13.667396
> ISO Data RX: Handle 214 flags 0x06 dlen 8               #280 [hci1] 13.677372
< ACL Data TX: Handle 2649 flags 0x00 dlen 27             #281 [hci1] 13.678167
< ACL Data TX: Handle 2649 flags 0x01 dlen 6              #282 [hci1] 13.678176
      ATT: Handle Value Notification (0x1b) len 28
        Handle: 0x0051 Type: Broadcast Receive State (0x2bc8)
          Data: 00001ab1f6ffa9df01a63b500200010100000006030204000109
          Source_ID: 0
          Source_Address_Type: 0
          Source_Address: DF:A9:FF:F6:B1:1A
          Source_Adv_SID: 1
          Broadcast_ID: 0x503ba6
          PA_Sync_State: Synchronized to PA
          BIG_Encryption: Not encrypted
          Num_Subgroups: 1
          Subgroup #0:
            BIS_Sync State: 0x00000001
            Metadata: #0: len 0x03 type 0x02
            Metadata:   04 00                                            ..              
            Metadata: #1: len 0x01 type 0x09
> ISO Data RX: Handle 214 flags 0x06 dlen 8               #283 [hci1] 13.687376
> ISO Data RX: Handle 214 flags 0x06 dlen 8               #284 [hci1] 13.697371
> ISO Data RX: Handle 214 flags 0x06 dlen 8               #285 [hci1] 13.707324
> HCI Event: Number of Completed Packets (0x13) plen 5    #286 [hci1] 13.709377
        Num handles: 1
        Handle: 2649 Address: DF:A9:FF:F6:B1:1A (OUI DF-A9-FF)
        Count: 1
        #281: len 27 (6 Kb/s)
        Latency: 31 msec (28-111 msec ~55 msec)
> ISO Data RX: Handle 214 flags 0x06 dlen 8               #287 [hci1] 13.717299
> ISO Data RX: Handle 214 flags 0x06 dlen 8               #288 [hci1] 13.727348
> ISO Data RX: Handle 214 flags 0x06 dlen 8               #289 [hci1] 13.737371
> ISO Data RX: Handle 214 flags 0x06 dlen 8               #290 [hci1] 13.747354
> ISO Data RX: Handle 214 flags 0x06 dlen 8               #291 [hci1] 13.757283
> ISO Data RX: Handle 214 flags 0x06 dlen 8               #292 [hci1] 13.767327
> HCI Event: Number of Completed Packets (0x13) plen 5    #293 [hci1] 13.768719
        Num handles: 1
        Handle: 2649 Address: DF:A9:FF:F6:B1:1A (OUI DF-A9-FF)
        Count: 1
        #282: len 6 (0 Kb/s)
        Latency: 90 msec (28-111 msec ~72 msec)
> ISO Data RX: Handle 214 flags 0x06 dlen 8               #294 [hci1] 13.777364
> ISO Data RX: Handle 214 flags 0x06 dlen 8               #295 [hci1] 13.787433
> ISO Data RX: Handle 214 flags 0x06 dlen 8               #296 [hci1] 13.797445
> ISO Data RX: Handle 214 flags 0x06 dlen 8               #297 [hci1] 13.807368
> ISO Data RX: Handle 214 flags 0x06 dlen 8               #298 [hci1] 13.817329
> ISO Data RX: Handle 214 flags 0x06 dlen 8               #299 [hci1] 13.827399
> ISO Data RX: Handle 214 flags 0x06 dlen 8               #300 [hci1] 13.837402
> ISO Data RX: Handle 214 flags 0x06 dlen 8               #301 [hci1] 13.847365
> ISO Data RX: Handle 214 flags 0x06 dlen 8               #302 [hci1] 13.857321
> ISO Data RX: Handle 214 flags 0x06 dlen 8               #303 [hci1] 13.867357
> ISO Data RX: Handle 214 flags 0x06 dlen 8               #304 [hci1] 13.877401
> ISO Data RX: Handle 214 flags 0x06 dlen 8               #305 [hci1] 13.887296
> ISO Data RX: Handle 214 flags 0x06 dlen 8               #306 [hci1] 13.897372
> ISO Data RX: Handle 214 flags 0x06 dlen 8               #307 [hci1] 13.907392
> ISO Data RX: Handle 214 flags 0x06 dlen 8               #308 [hci1] 13.917375
> ISO Data RX: Handle 214 flags 0x06 dlen 8               #309 [hci1] 13.927366
> ISO Data RX: Handle 214 flags 0x06 dlen 8               #310 [hci1] 13.937343
> ISO Data RX: Handle 214 flags 0x06 dlen 8               #311 [hci1] 13.947408
> ISO Data RX: Handle 214 flags 0x06 dlen 8               #312 [hci1] 13.957401
> ISO Data RX: Handle 214 flags 0x06 dlen 8               #313 [hci1] 13.967292
> ISO Data RX: Handle 214 flags 0x06 dlen 8               #314 [hci1] 13.977412
> ISO Data RX: Handle 214 flags 0x06 dlen 8               #315 [hci1] 13.987349
> ISO Data RX: Handle 214 flags 0x06 dlen 8               #316 [hci1] 13.997410
> ISO Data RX: Handle 214 flags 0x06 dlen 8               #317 [hci1] 14.007359
> ISO Data RX: Handle 214 flags 0x06 dlen 8               #318 [hci1] 14.017316
> ISO Data RX: Handle 214 flags 0x06 dlen 8               #319 [hci1] 14.027358
> ISO Data RX: Handle 214 flags 0x06 dlen 8               #320 [hci1] 14.037416
> ISO Data RX: Handle 214 flags 0x06 dlen 8               #321 [hci1] 14.047330
> ISO Data RX: Handle 214 flags 0x06 dlen 8               #322 [hci1] 14.057352
> ISO Data RX: Handle 214 flags 0x06 dlen 8               #323 [hci1] 14.067330
> ISO Data RX: Handle 214 flags 0x06 dlen 8               #324 [hci1] 14.077361
> ISO Data RX: Handle 214 flags 0x06 dlen 8               #325 [hci1] 14.087361
> ISO Data RX: Handle 214 flags 0x06 dlen 8               #326 [hci1] 14.097413
> ISO Data RX: Handle 214 flags 0x06 dlen 8               #327 [hci1] 14.107314
> ISO Data RX: Handle 214 flags 0x06 dlen 8               #328 [hci1] 14.117396
> ISO Data RX: Handle 214 flags 0x06 dlen 8               #329 [hci1] 14.127283
> ISO Data RX: Handle 214 flags 0x06 dlen 8               #330 [hci1] 14.137348
> ISO Data RX: Handle 214 flags 0x06 dlen 8               #331 [hci1] 14.147308
> ISO Data RX: Handle 214 flags 0x06 dlen 8               #332 [hci1] 14.157288
> ISO Data RX: Handle 214 flags 0x06 dlen 8               #333 [hci1] 14.167303
> ISO Data RX: Handle 214 flags 0x06 dlen 8               #334 [hci1] 14.177310
> ISO Data RX: Handle 214 flags 0x06 dlen 8               #335 [hci1] 14.187371
> ISO Data RX: Handle 214 flags 0x06 dlen 8               #336 [hci1] 14.197354
> ISO Data RX: Handle 214 flags 0x06 dlen 8               #337 [hci1] 14.207316
> ISO Data RX: Handle 214 flags 0x06 dlen 8               #338 [hci1] 14.217404
> ISO Data RX: Handle 214 flags 0x06 dlen 8               #339 [hci1] 14.227391
> ISO Data RX: Handle 214 flags 0x06 dlen 8               #340 [hci1] 14.237472
> ISO Data RX: Handle 214 flags 0x06 dlen 8               #341 [hci1] 14.247350
> ISO Data RX: Handle 214 flags 0x06 dlen 8               #342 [hci1] 14.257344
> ISO Data RX: Handle 214 flags 0x06 dlen 8               #343 [hci1] 14.267321
> ISO Data RX: Handle 214 flags 0x06 dlen 8               #344 [hci1] 14.277297
> ISO Data RX: Handle 214 flags 0x06 dlen 8               #345 [hci1] 14.287352
> ISO Data RX: Handle 214 flags 0x06 dlen 8               #346 [hci1] 14.297316
> ISO Data RX: Handle 214 flags 0x06 dlen 8               #347 [hci1] 14.307360
> ISO Data RX: Handle 214 flags 0x06 dlen 8               #348 [hci1] 14.317326
> ISO Data RX: Handle 214 flags 0x06 dlen 8               #349 [hci1] 14.327307
> ISO Data RX: Handle 214 flags 0x06 dlen 8               #350 [hci1] 14.337314
> ISO Data RX: Handle 214 flags 0x06 dlen 8               #351 [hci1] 14.347295
> ISO Data RX: Handle 214 flags 0x06 dlen 8               #352 [hci1] 14.357272
> HCI Event: LE Meta Event (0x3e) plen 48                 #353 [hci1] 14.360017
      LE Periodic Advertising Report (0x0f)
        Sync handle: 3675
        TX power: 127 dbm (0x7f)
        RSSI: -23 dBm (0xe9)
        CTE Type: No Constant Tone Extension (0xff)
        Data status: [0;32mComplete[0m
        Data length: 0x28
        27 16 51 18 40 9c 00 01 01 06 00 00 00 00 0a 02  '.Q.@...........
        01 03 02 02 01 03 04 28 00 06 03 02 04 00 01 09  .......(........
        01 06 05 03 01 00 00 00                          ........        
> HCI Event: LE Meta Event (0x3e) plen 20                 #354 [hci1] 14.360164
      LE Broadcast Isochronous Group Info Advertising Report (0x22)
        Sync Handle: 0x0e5b
        Number BIS: 1
        NSE: 3
        ISO Interval: 10.00 msec (0x0008)
        BN: 1
        PTO: 1
        IRC: 2
        Maximum PDU: 40
        SDU Interval: 10000 us (0x002710)
        Maximum SDU: 40
        PHY: LE 1M (0x01)
        Framing: Unframed (0x00)
        Encryption: 0x00
> ISO Data RX: Handle 214 flags 0x06 dlen 8               #355 [hci1] 14.367360
> ISO Data RX: Handle 214 flags 0x06 dlen 8               #356 [hci1] 14.377331
> ISO Data RX: Handle 214 flags 0x06 dlen 8               #357 [hci1] 14.387261
> ISO Data RX: Handle 214 flags 0x06 dlen 8               #358 [hci1] 14.397323
> ISO Data RX: Handle 214 flags 0x06 dlen 8               #359 [hci1] 14.407351
> ISO Data RX: Handle 214 flags 0x06 dlen 8               #360 [hci1] 14.417317
> ISO Data RX: Handle 214 flags 0x06 dlen 8               #361 [hci1] 14.427400
> ISO Data RX: Handle 214 flags 0x06 dlen 8               #362 [hci1] 14.437345
> ISO Data RX: Handle 214 flags 0x06 dlen 8               #363 [hci1] 14.447425
> ISO Data RX: Handle 214 flags 0x06 dlen 8               #364 [hci1] 14.457309
> ISO Data RX: Handle 214 flags 0x06 dlen 8               #365 [hci1] 14.467358
> ISO Data RX: Handle 214 flags 0x06 dlen 8               #366 [hci1] 14.477366
> ISO Data RX: Handle 214 flags 0x06 dlen 8               #367 [hci1] 14.487303
> ISO Data RX: Handle 214 flags 0x06 dlen 8               #368 [hci1] 14.497356
> ISO Data RX: Handle 214 flags 0x06 dlen 8               #369 [hci1] 14.507351
> ISO Data RX: Handle 214 flags 0x06 dlen 8               #370 [hci1] 14.517319
> ISO Data RX: Handle 214 flags 0x06 dlen 8               #371 [hci1] 14.527307
> ISO Data RX: Handle 214 flags 0x06 dlen 8               #372 [hci1] 14.537320
> ISO Data RX: Handle 214 flags 0x06 dlen 8               #373 [hci1] 14.547425
> ISO Data RX: Handle 214 flags 0x06 dlen 8               #374 [hci1] 14.557335
> ISO Data RX: Handle 214 flags 0x06 dlen 8               #375 [hci1] 14.567340
> ISO Data RX: Handle 214 flags 0x06 dlen 8               #376 [hci1] 14.577320
> ISO Data RX: Handle 214 flags 0x06 dlen 8               #377 [hci1] 14.587307
> ISO Data RX: Handle 214 flags 0x06 dlen 8               #378 [hci1] 14.597337
> ISO Data RX: Handle 214 flags 0x06 dlen 8               #379 [hci1] 14.607413
> ISO Data RX: Handle 214 flags 0x06 dlen 8               #380 [hci1] 14.617316
> ISO Data RX: Handle 214 flags 0x06 dlen 8               #381 [hci1] 14.627376
> ISO Data RX: Handle 214 flags 0x06 dlen 8               #382 [hci1] 14.637348
> ISO Data RX: Handle 214 flags 0x06 dlen 8               #383 [hci1] 14.647460
> ISO Data RX: Handle 214 flags 0x06 dlen 8               #384 [hci1] 14.657354
> ISO Data RX: Handle 214 flags 0x06 dlen 8               #385 [hci1] 14.667339
> ISO Data RX: Handle 214 flags 0x06 dlen 8               #386 [hci1] 14.677304
> ISO Data RX: Handle 214 flags 0x06 dlen 8               #387 [hci1] 14.687298
> ISO Data RX: Handle 214 flags 0x06 dlen 8               #388 [hci1] 14.697298
> ISO Data RX: Handle 214 flags 0x06 dlen 8               #389 [hci1] 14.707284
> ISO Data RX: Handle 214 flags 0x06 dlen 8               #390 [hci1] 14.717293
> ISO Data RX: Handle 214 flags 0x06 dlen 8               #391 [hci1] 14.727338
> ISO Data RX: Handle 214 flags 0x06 dlen 8               #392 [hci1] 14.737323
> ISO Data RX: Handle 214 flags 0x06 dlen 8               #393 [hci1] 14.747388
> ISO Data RX: Handle 214 flags 0x06 dlen 8               #394 [hci1] 14.757302
> ISO Data RX: Handle 214 flags 0x06 dlen 8               #395 [hci1] 14.767349
> ISO Data RX: Handle 214 flags 0x06 dlen 8               #396 [hci1] 14.777274
> ISO Data RX: Handle 214 flags 0x06 dlen 8               #397 [hci1] 14.787364
> ISO Data RX: Handle 214 flags 0x06 dlen 8               #398 [hci1] 14.797275
> ISO Data RX: Handle 214 flags 0x06 dlen 8               #399 [hci1] 14.807296
> ISO Data RX: Handle 214 flags 0x06 dlen 8               #400 [hci1] 14.817347
> ISO Data RX: Handle 214 flags 0x06 dlen 8               #401 [hci1] 14.827360
> ISO Data RX: Handle 214 flags 0x06 dlen 8               #402 [hci1] 14.837369
> ISO Data RX: Handle 214 flags 0x06 dlen 8               #403 [hci1] 14.847289
> ISO Data RX: Handle 214 flags 0x06 dlen 8               #404 [hci1] 14.857393
> ISO Data RX: Handle 214 flags 0x06 dlen 8               #405 [hci1] 14.867315
> ISO Data RX: Handle 214 flags 0x06 dlen 8               #406 [hci1] 14.877293
> ISO Data RX: Handle 214 flags 0x06 dlen 8               #407 [hci1] 14.887305
> ISO Data RX: Handle 214 flags 0x06 dlen 8               #408 [hci1] 14.897328
> ISO Data RX: Handle 214 flags 0x06 dlen 8               #409 [hci1] 14.907342
> ISO Data RX: Handle 214 flags 0x06 dlen 8               #410 [hci1] 14.917391
> ISO Data RX: Handle 214 flags 0x06 dlen 8               #411 [hci1] 14.927295
> ISO Data RX: Handle 214 flags 0x06 dlen 8               #412 [hci1] 14.937323
> ISO Data RX: Handle 214 flags 0x06 dlen 8               #413 [hci1] 14.947389
> ISO Data RX: Handle 214 flags 0x06 dlen 8               #414 [hci1] 14.957408
> ISO Data RX: Handle 214 flags 0x06 dlen 8               #415 [hci1] 14.967286
> ISO Data RX: Handle 214 flags 0x06 dlen 8               #416 [hci1] 14.977316
> ISO Data RX: Handle 214 flags 0x06 dlen 8               #417 [hci1] 14.987311
> ISO Data RX: Handle 214 flags 0x06 dlen 8               #418 [hci1] 14.997361
> ISO Data RX: Handle 214 flags 0x06 dlen 8               #419 [hci1] 15.007354
> ISO Data RX: Handle 214 flags 0x06 dlen 8               #420 [hci1] 15.017290
> ISO Data RX: Handle 214 flags 0x06 dlen 8               #421 [hci1] 15.027311
> ISO Data RX: Handle 214 flags 0x06 dlen 8               #422 [hci1] 15.037318
> ISO Data RX: Handle 214 flags 0x06 dlen 8               #423 [hci1] 15.047423
> ISO Data RX: Handle 214 flags 0x06 dlen 8               #424 [hci1] 15.057279
> ISO Data RX: Handle 214 flags 0x06 dlen 8               #425 [hci1] 15.067279
> ISO Data RX: Handle 214 flags 0x06 dlen 8               #426 [hci1] 15.077297
> HCI Event: LE Meta Event (0x3e) plen 48                 #427 [hci1] 15.080059
      LE Periodic Advertising Report (0x0f)
        Sync handle: 3675
        TX power: 127 dbm (0x7f)
        RSSI: -26 dBm (0xe6)
        CTE Type: No Constant Tone Extension (0xff)
        Data status: [0;32mComplete[0m
        Data length: 0x28
        27 16 51 18 40 9c 00 01 01 06 00 00 00 00 0a 02  '.Q.@...........
        01 03 02 02 01 03 04 28 00 06 03 02 04 00 01 09  .......(........
        01 06 05 03 01 00 00 00                          ........        
> HCI Event: LE Meta Event (0x3e) plen 20                 #428 [hci1] 15.080137
      LE Broadcast Isochronous Group Info Advertising Report (0x22)
        Sync Handle: 0x0e5b
        Number BIS: 1
        NSE: 3
        ISO Interval: 10.00 msec (0x0008)
        BN: 1
        PTO: 1
        IRC: 2
        Maximum PDU: 40
        SDU Interval: 10000 us (0x002710)
        Maximum SDU: 40
        PHY: LE 1M (0x01)
        Framing: Unframed (0x00)
        Encryption: 0x00
> ISO Data RX: Handle 214 flags 0x06 dlen 8               #429 [hci1] 15.087333
> ISO Data RX: Handle 214 flags 0x06 dlen 8               #430 [hci1] 15.097284
> ISO Data RX: Handle 214 flags 0x06 dlen 8               #431 [hci1] 15.107274
> ISO Data RX: Handle 214 flags 0x06 dlen 8               #432 [hci1] 15.117352
> ISO Data RX: Handle 214 flags 0x06 dlen 8               #433 [hci1] 15.127280
> ISO Data RX: Handle 214 flags 0x06 dlen 8               #434 [hci1] 15.137322
> ISO Data RX: Handle 214 flags 0x06 dlen 8               #435 [hci1] 15.147283
> ISO Data RX: Handle 214 flags 0x06 dlen 8               #436 [hci1] 15.157306
> ISO Data RX: Handle 214 flags 0x06 dlen 8               #437 [hci1] 15.167296
> ISO Data RX: Handle 214 flags 0x06 dlen 8               #438 [hci1] 15.177358
> ISO Data RX: Handle 214 flags 0x06 dlen 8               #439 [hci1] 15.187344
> ISO Data RX: Handle 214 flags 0x06 dlen 8               #440 [hci1] 15.197338
> ISO Data RX: Handle 214 flags 0x06 dlen 8               #441 [hci1] 15.207297
> HCI Event: Disconnect Complete (0x05) plen 4            #442 [hci1] 15.209005
        Status: Success (0x00)
        Handle: 2649 Address: DF:A9:FF:F6:B1:1A (OUI DF-A9-FF)
        Reason: Remote User Terminated Connection (0x13)
> ISO Data RX: Handle 214 flags 0x06 dlen 8               #443 [hci1] 15.217311
> ISO Data RX: Handle 214 flags 0x06 dlen 8               #444 [hci1] 15.236687
> ISO Data RX: Handle 214 flags 0x06 dlen 8               #445 [hci1] 15.246681
> ISO Data RX: Handle 214 flags 0x06 dlen 8               #446 [hci1] 15.256655
> ISO Data RX: Handle 214 flags 0x06 dlen 8               #447 [hci1] 15.266688
> ISO Data RX: Handle 214 flags 0x06 dlen 8               #448 [hci1] 15.276705
> ISO Data RX: Handle 214 flags 0x06 dlen 8               #449 [hci1] 15.286728
> ISO Data RX: Handle 214 flags 0x06 dlen 8               #450 [hci1] 15.296722
> ISO Data RX: Handle 214 flags 0x06 dlen 8               #451 [hci1] 15.306706
> ISO Data RX: Handle 214 flags 0x06 dlen 8               #452 [hci1] 15.316722
> ISO Data RX: Handle 214 flags 0x06 dlen 8               #453 [hci1] 15.326712
> ISO Data RX: Handle 214 flags 0x06 dlen 8               #454 [hci1] 15.336748
> ISO Data RX: Handle 214 flags 0x06 dlen 8               #455 [hci1] 15.346731
> ISO Data RX: Handle 214 flags 0x06 dlen 8               #456 [hci1] 15.356748
> ISO Data RX: Handle 214 flags 0x06 dlen 8               #457 [hci1] 15.366716
> ISO Data RX: Handle 214 flags 0x06 dlen 8               #458 [hci1] 15.376761
> ISO Data RX: Handle 214 flags 0x06 dlen 8               #459 [hci1] 15.386820
> ISO Data RX: Handle 214 flags 0x06 dlen 8               #460 [hci1] 15.396764
> ISO Data RX: Handle 214 flags 0x06 dlen 8               #461 [hci1] 15.406727
> ISO Data RX: Handle 214 flags 0x06 dlen 8               #462 [hci1] 15.416835
> HCI Event: LE Meta Event (0x3e) plen 3                  #463 [hci1] 15.417250
      LE Broadcast Isochronous Group Sync Lost (0x1e)
        BIG Handle: 0x00
        Reason: Connection Timeout (0x08)
> HCI Event: LE Meta Event (0x3e) plen 3                  #464 [hci1] 25.043590
      LE Periodic Advertising Sync Lost (0x10)
        Sync handle: 3675
< HCI Command: Reset (0x03|0x0003) plen 0                 #465 [hci1] 48.098214
> HCI Event: Command Complete (0x0e) plen 4               #466 [hci1] 48.098651
      Reset (0x03|0x0003) ncmd 1
        Status: Success (0x00)
@ USER Close: main                                    {0x0001} [hci1] 48.118088
= Close Index: 00:00:00:00:00:00                               [hci1] 48.118096
