Bluetooth monitor ver 5.84
btmon[1938980]: = Note: Linux version 6.8.0-83-generic (x86_64)                                                          0.212590
btmon[1938980]: = Note: Bluetooth subsystem version 2.22                                                                 0.212592
= New Index: 00:00:00:00:00:00 (Primary,UART,hci0)                                                                       0.212593
= Open Index: 00:00:00:00:00:00                                                                                          0.716909
= Index Info: 00:00:00:00:00:00 (Nordic Semiconductor ASA)                                                               0.717068
zephyr.exe[1938982]: @ USER Open: main (privileged) version 2.22                                                {0x0001} 0.717125
zephyr.exe[1938982]: < HCI Command: Reset (0x03|0x0003) plen 0                                                        #1 0.717737
> HCI Event: Command Complete (0x0e) plen 4                                                                           #2 0.718332
      Reset (0x03|0x0003) ncmd 1
        Status: Success (0x00)
zephyr.exe[1938982]: < HCI Command: Read Local Supported Features (0x04|0x0003) plen 0                                #3 0.736925
> HCI Event: Command Complete (0x0e) plen 12                                                                          #4 0.737784
      Read Local Supported Features (0x04|0x0003) ncmd 1
        Status: Success (0x00)
        Features: 0x00 0x00 0x00 0x00 0x60 0x00 0x00 0x00
          BR/EDR Not Supported
          LE Supported (Controller)
zephyr.exe[1938982]: < HCI Command: Read Local Version Information (0x04|0x0001) plen 0                               #5 0.756914
> HCI Event: Command Complete (0x0e) plen 12                                                                          #6 0.757786
      Read Local Version Information (0x04|0x0001) ncmd 1
        Status: Success (0x00)
        HCI version: Reserved (0x0e) - Revision 12520 (0x30e8)
        LMP version: Reserved (0x0e) - Subversion 12520 (0x30e8)
        Manufacturer: Nordic Semiconductor ASA (89)
zephyr.exe[1938982]: < HCI Command: Read Local Supported Commands (0x04|0x0002) plen 0                                #7 0.776914
> HCI Event: Command Complete (0x0e) plen 68                                                                          #8 0.778405
      Read Local Supported Commands (0x04|0x0002) ncmd 1
        Status: Success (0x00)
        Commands: 119 entries
          Disconnect (Octet 0 - Bit 5)
          Read Remote Version Information (Octet 2 - Bit 7)
          Set Event Mask (Octet 5 - Bit 6)
          Reset (Octet 5 - Bit 7)
          Read Connection Accept Timeout (Octet 7 - Bit 2)
          Write Connection Accept Timeout (Octet 7 - Bit 3)
          Read Transmit Power Level (Octet 10 - Bit 2)
          Set Controller To Host Flow Control (Octet 10 - Bit 5)
          Host Buffer Size (Octet 10 - Bit 6)
          Host Number of Completed Packets (Octet 10 - Bit 7)
          Read Local Version Information (Octet 14 - Bit 3)
          Read Local Supported Features (Octet 14 - Bit 5)
          Read BD ADDR (Octet 15 - Bit 1)
          Read RSSI (Octet 15 - Bit 5)
          Set Event Mask Page 2 (Octet 22 - Bit 2)
          LE Set Event Mask (Octet 25 - Bit 0)
          LE Read Buffer Size (Octet 25 - Bit 1)
          LE Read Local Supported Features (Octet 25 - Bit 2)
          LE Set Random Address (Octet 25 - Bit 4)
          LE Set Advertising Parameters (Octet 25 - Bit 5)
          LE Read Advertising Channel TX Power (Octet 25 - Bit 6)
          LE Set Advertising Data (Octet 25 - Bit 7)
          LE Set Scan Response Data (Octet 26 - Bit 0)
          LE Set Advertise Enable (Octet 26 - Bit 1)
          LE Set Scan Parameters (Octet 26 - Bit 2)
          LE Set Scan Enable (Octet 26 - Bit 3)
          LE Create Connection (Octet 26 - Bit 4)
          LE Create Connection Cancel (Octet 26 - Bit 5)
          LE Read Accept List Size (Octet 26 - Bit 6)
          LE Clear Accept List (Octet 26 - Bit 7)
          LE Add Device To Accept List (Octet 27 - Bit 0)
          LE Remove Device From Accept List (Octet 27 - Bit 1)
          LE Connection Update (Octet 27 - Bit 2)
          LE Set Host Channel Classification (Octet 27 - Bit 3)
          LE Read Channel Map (Octet 27 - Bit 4)
          LE Read Remote Used Features (Octet 27 - Bit 5)
          LE Encrypt (Octet 27 - Bit 6)
          LE Rand (Octet 27 - Bit 7)
          LE Start Encryption (Octet 28 - Bit 0)
          LE Long Term Key Request Reply (Octet 28 - Bit 1)
          LE Long Term Key Request Neg Reply (Octet 28 - Bit 2)
          LE Read Supported States (Octet 28 - Bit 3)
          LE Receiver Test (Octet 28 - Bit 4)
          LE Transmitter Test (Octet 28 - Bit 5)
          LE Test End (Octet 28 - Bit 6)
          Read Authenticated Payload Timeout (Octet 32 - Bit 4)
          Write Authenticated Payload Timeout (Octet 32 - Bit 5)
          LE Set Data Length (Octet 33 - Bit 6)
          LE Read Suggested Default Data Length (Octet 33 - Bit 7)
          LE Write Suggested Default Data Length (Octet 34 - Bit 0)
          LE Add Device To Resolving List (Octet 34 - Bit 3)
          LE Remove Device From Resolving List (Octet 34 - Bit 4)
          LE Clear Resolving List (Octet 34 - Bit 5)
          LE Read Resolving List Size (Octet 34 - Bit 6)
          LE Set Address Resolution Enable (Octet 35 - Bit 1)
          LE Set Resolvable Private Address Timeout (Octet 35 - Bit 2)
          LE Read Maximum Data Length (Octet 35 - Bit 3)
          LE Read PHY (Octet 35 - Bit 4)
          LE Set Default PHY (Octet 35 - Bit 5)
          LE Set PHY (Octet 35 - Bit 6)
          LE Enhanced Receiver Test (Octet 35 - Bit 7)
          LE Enhanced Transmitter Test (Octet 36 - Bit 0)
          LE Set Advertising Set Random Address (Octet 36 - Bit 1)
          LE Set Extended Advertising Parameters (Octet 36 - Bit 2)
          LE Set Extended Advertising Data (Octet 36 - Bit 3)
          LE Set Extended Scan Response Data (Octet 36 - Bit 4)
          LE Set Extended Advertising Enable (Octet 36 - Bit 5)
          LE Read Maximum Advertising Data Length (Octet 36 - Bit 6)
          LE Read Number of Supported Advertising Sets (Octet 36 - Bit 7)
          LE Remove Advertising Set (Octet 37 - Bit 0)
          LE Clear Advertising Sets (Octet 37 - Bit 1)
          LE Set Periodic Advertising Parameters (Octet 37 - Bit 2)
          LE Set Periodic Advertising Data (Octet 37 - Bit 3)
          LE Set Periodic Advertising Enable (Octet 37 - Bit 4)
          LE Set Extended Scan Parameters (Octet 37 - Bit 5)
          LE Set Extended Scan Enable (Octet 37 - Bit 6)
          LE Extended Create Connection (Octet 37 - Bit 7)
          LE Periodic Advertising Create Sync (Octet 38 - Bit 0)
          LE Periodic Advertising Create Sync Cancel (Octet 38 - Bit 1)
          LE Periodic Advertising Terminate Sync (Octet 38 - Bit 2)
          LE Add Device To Periodic Advertiser List (Octet 38 - Bit 3)
          LE Remove Device From Periodic Advertiser List (Octet 38 - Bit 4)
          LE Clear Periodic Advertiser List (Octet 38 - Bit 5)
          LE Read Periodic Advertiser List Size (Octet 38 - Bit 6)
          LE Read Transmit Power (Octet 38 - Bit 7)
          LE Read RF Path Compensation (Octet 39 - Bit 0)
          LE Write RF Path Compensation (Octet 39 - Bit 1)
          LE Set Privacy Mode (Octet 39 - Bit 2)
          LE Periodic Advertising Receive Enable (Octet 40 - Bit 5)
          LE Periodic Advertising Sync Transfer (Octet 40 - Bit 6)
          LE Periodic Advertising Set Info Transfer (Octet 40 - Bit 7)
          LE Periodic Advertising Sync Transfer Parameters (Octet 41 - Bit 0)
          LE Set Default Periodic Advertisng Sync Transfer Parameters (Octet 41 - Bit 1)
          LE Read Buffer v2 (Octet 41 - Bit 5)
          LE Read ISO TX Sync (Octet 41 - Bit 6)
          LE Set Connected Isochronous Group Parameters (Octet 41 - Bit 7)
          LE Set Connected Isochronous Group Parameters Test (Octet 42 - Bit 0)
          LE Create Connected Isochronous Stream (Octet 42 - Bit 1)
          LE Remove Connected Isochronous Group (Octet 42 - Bit 2)
          LE Accept Connected Isochronous Stream Request (Octet 42 - Bit 3)
          LE Reject Connected Isochronous Stream Request (Octet 42 - Bit 4)
          LE Create Broadcast Isochronous Group (Octet 42 - Bit 5)
          LE Create Broadcast Isochronous Group Test (Octet 42 - Bit 6)
          LE Terminate Broadcast Isochronous Group (Octet 42 - Bit 7)
          LE Broadcast Isochronous Group Create Sync (Octet 43 - Bit 0)
          LE Broadcast Isochronous Group Terminate Sync (Octet 43 - Bit 1)
          LE Request Peer SCA (Octet 43 - Bit 2)
          LE Setup Isochronous Data Path (Octet 43 - Bit 3)
          LE Remove Isochronous Data Path (Octet 43 - Bit 4)
          LE Isochronous Transmit Test (Octet 43 - Bit 5)
          LE Isochronous Receive Test (Octet 43 - Bit 6)
          LE Isochronous Read Test Counters (Octet 43 - Bit 7)
          LE Isochronous Read Test Counters (Octet 44 - Bit 0)
          LE Set Host Feature (Octet 44 - Bit 1)
          LE Read ISO link quality (Octet 44 - Bit 2)
          Octet 45 - Bit 6 
          Octet 46 - Bit 0 
          Octet 46 - Bit 1 
          Octet 46 - Bit 2 
zephyr.exe[1938982]: < HCI Command: Host Buffer Size (0x03|0x0033) plen 7                                             #9 0.796917
        ACL MTU: 255  ACL max packet: 16
        SCO MTU: 0    SCO max packet: 0
> HCI Event: Command Complete (0x0e) plen 4                                                                          #10 0.797566
      Host Buffer Size (0x03|0x0033) ncmd 1
        Status: Success (0x00)
zephyr.exe[1938982]: < HCI Command: Set Controller To Host Flow Control (0x03|0x0031) plen 1                         #11 0.816919
        Flow control: ACL Data Packets (0x01)
> HCI Event: Command Complete (0x0e) plen 4                                                                          #12 0.817401
      Set Controller To Host Flow Control (0x03|0x0031) ncmd 1
        Status: Success (0x00)
zephyr.exe[1938982]: < HCI Command: LE Read Local Supported Features (0x08|0x0003) plen 0                            #13 0.836910
> HCI Event: Command Complete (0x0e) plen 12                                                                         #14 0.837498
      LE Read Local Supported Features (0x08|0x0003) ncmd 1
        Status: Success (0x00)
        Features: 0xfd 0x79 0x00 0xf7 0x30 0x01 0x00 0x00
          LE Encryption
          Extended Reject Indication
          Peripheral-initiated Features Exchange
          LE Ping
          LE Data Packet Length Extension
          LL Privacy
          Extended Scanner Filter Policies
          LE 2M PHY
          LE Coded PHY
          LE Extended Advertising
          LE Periodic Advertising
          Channel Selection Algorithm #2
          Periodic Advertising Sync Transfer - Sender
          Periodic Advertising Sync Transfer - Recipient
          Sleep Clock Accuracy Updates
          Connected Isochronous Stream - Central
          Connected Isochronous Stream - Peripheral
          Isochronous Broadcaster
          Synchronized Receiver
          Periodic Advertising ADI support
          Connection Subrating
          Unknown features (0x0000010000000000)
zephyr.exe[1938982]: < HCI Command: LE Set Host Feature (0x08|0x0074) plen 2                                         #15 0.856913
        Bit Number: 32
          Connected Isochronous Stream (Host Support)
        Bit Value: 1
> HCI Event: Command Complete (0x0e) plen 4                                                                          #16 0.857536
      LE Set Host Feature (0x08|0x0074) ncmd 1
        Status: Success (0x00)
zephyr.exe[1938982]: < HCI Command: LE Read Buffer v2 (0x08|0x0060) plen 0                                           #17 0.876921
> HCI Event: Command Complete (0x0e) plen 10                                                                         #18 0.877622
      LE Read Buffer v2 (0x08|0x0060) ncmd 1
        Status: Success (0x00)
        ACL MTU: 27
        ACL max packet: 3
        ISO MTU: 318
        ISO max packet: 3
zephyr.exe[1938982]: < HCI Command: LE Read Maximum Advertising Data Length (0x08|0x003a) plen 0                     #19 0.896950
> HCI Event: Command Complete (0x0e) plen 6                                                                          #20 0.897478
      LE Read Maximum Advertising Data Length (0x08|0x003a) ncmd 1
        Status: Success (0x00)
        Max length: 1650
zephyr.exe[1938982]: < HCI Command: LE Read Supported States (0x08|0x001c) plen 0                                    #21 0.916916
> HCI Event: Command Complete (0x0e) plen 12                                                                         #22 0.917518
      LE Read Supported States (0x08|0x001c) ncmd 1
        Status: Success (0x00)
        States: 0x000003ff3e0306ff
          Non-connectable Advertising State
          Scannable Advertising State
          Connectable Advertising State
          High Duty Cycle Directed Advertising State
          Passive Scanning State
          Active Scanning State
          Initiating State
            and Connection State (Central Role)
          Connection State (Peripheral Role)
          Scannable Advertising State
            and Passive Scanning State
          Connectable Advertising State
            and Passive Scanning State
          Non-connectable Advertising State
            and Initiating State
          Scannable Advertising State
            and Initiating State
          Active Scanning State
            and Connection State (Central Role)
          Passive Scanning State
            and Connection State (Peripheral Role)
          Active Scanning State
            and Connection State (Peripheral Role)
          Initiating State
            and Connection State (Central Role)
            and Central Role & Central Role
          Low Duty Cycle Directed Advertising State
          Connectable Advertising State
            and Initiating State
            and Central Role & Peripheral Role
          High Duty Cycle Directed Advertising State
            and Initiating State
            and Central Role & Peripheral Role
          Low Duty Cycle Directed Advertising State
            and Initiating State
            and Central Role & Peripheral Role
          Connectable Advertising State
            and Connection State (Central Role)
            and Central Role & Peripheral Role
          High Duty Cycle Directed Advertising State
            and Connection State (Central Role)
            and Central Role & Peripheral Role
          Low Duty Cycle Directed Advertising State
            and Connection State (Central Role)
            and Central Role & Peripheral Role
          Connectable Advertising State
            and Connection State (Peripheral Role)
            and Central Role & Peripheral Role
          High Duty Cycle Directed Advertising State
            and Connection State (Peripheral Role)
            and Peripheral Role & Peripheral Role
          Low Duty Cycle Directed Advertising State
            and Connection State (Peripheral Role)
            and Peripheral Role & Peripheral Role
          Initiating State
            and Connection State (Peripheral Role)
            and Central Role & Peripheral Role
zephyr.exe[1938982]: < HCI Command: LE Read Maximum Data Length (0x08|0x002f) plen 0                                 #23 0.936916
> HCI Event: Command Complete (0x0e) plen 12                                                                         #24 0.937565
      LE Read Maximum Data Length (0x08|0x002f) ncmd 1
        Status: Success (0x00)
        Max TX octets: 251
        Max TX time: 2704
        Max RX octets: 251
        Max RX time: 2704
zephyr.exe[1938982]: < HCI Command: LE Write Suggested Default Data Length (0x08|0x0024) plen 4                      #25 0.956921
        TX octets: 251
        TX time: 2704
> HCI Event: Command Complete (0x0e) plen 4                                                                          #26 0.957427
      LE Write Suggested Default Data Length (0x08|0x0024) ncmd 1
        Status: Success (0x00)
zephyr.exe[1938982]: < HCI Command: LE Read Resolving List Size (0x08|0x002a) plen 0                                 #27 0.976920
> HCI Event: Command Complete (0x0e) plen 5                                                                          #28 0.977513
      LE Read Resolving List Size (0x08|0x002a) ncmd 1
        Status: Success (0x00)
        Size: 8
zephyr.exe[1938982]: < HCI Command: LE Set Event Mask (0x08|0x0001) plen 8                                           #29 0.996950
        Mask: 0x000002023f87fa5e
          LE Advertising Report
          LE Connection Update Complete
          LE Read Remote Used Features Complete
          LE Long Term Key Request
          LE Data Length Change
          LE Enhanced Connection Complete
          LE PHY Update Complete
          LE Extended Advertising Report
          LE Periodic Advertising Sync Established
          LE Periodic Advertising Report
          LE Periodic Advertising Sync Lost
          LE Extended Scan Timeout
          LE Extended Advertising Set Terminated
          LE Scan Request Received
          LE Periodic Advertising Sync Transfer Rvc
          LE CIS Established
          LE CIS Request
          LE Create BIG Complete
          LE Terminate BIG Complete
          LE BIG Sync Established Complete
          LE BIG Sync Lost
          LE BIG Info Advertising Report
          Unknown mask (0x0000020000000000)
> HCI Event: Command Complete (0x0e) plen 4                                                                          #30 0.997535
      LE Set Event Mask (0x08|0x0001) ncmd 1
        Status: Success (0x00)
zephyr.exe[1938982]: < HCI Command: Set Event Mask (0x03|0x0001) plen 8                                              #31 1.016916
        Mask: 0x2000800002008890
          Disconnection Complete
          Encryption Change
          Read Remote Version Information Complete
          Hardware Error
          Data Buffer Overflow
          Encryption Key Refresh Complete
          LE Meta
> HCI Event: Command Complete (0x0e) plen 4                                                                          #32 1.017487
      Set Event Mask (0x03|0x0001) ncmd 1
        Status: Success (0x00)
zephyr.exe[1938982]: < HCI Command: Read BD ADDR (0x04|0x0009) plen 0                                                #33 1.036921
> HCI Event: Command Complete (0x0e) plen 10                                                                         #34 1.037526
      Read BD ADDR (0x04|0x0009) ncmd 1
        Status: Success (0x00)
        Address: 00:00:00:00:00:00 (OUI 00-00-00)
zephyr.exe[1938982]: < HCI Command: LE Set Random Address (0x08|0x0005) plen 6                                       #35 1.056927
        Address: D5:B6:CC:31:DB:3B (Static)
> HCI Event: Command Complete (0x0e) plen 4                                                                          #36 1.057595
      LE Set Random Address (0x08|0x0005) ncmd 1
        Status: Success (0x00)
zephyr.exe[1938982]: < HCI Command: LE Set Extended Advertising Parameters (0x08|0x0036) plen 25                     #37 5.406977
        Handle: 0x00
        Properties: 0x0013
          Connectable
          Scannable
          Use legacy advertising PDUs: ADV_IND
        Min advertising interval: 100.000 msec (0x00a0)
        Max advertising interval: 150.000 msec (0x00f0)
        Channel map: 37, 38, 39 (0x07)
        Own address type: Random (0x01)
        Peer address type: Public (0x00)
        Peer address: 00:00:00:00:00:00 (OUI 00-00-00)
        Filter policy: Allow Scan Request from Any, Allow Connect Request from Any (0x00)
        TX power: Host has no preference (0x7f)
        Primary PHY: LE 1M (0x01)
        Secondary max skip: 0x00
        Secondary PHY: LE 1M (0x01)
        SID: 0x00
        Scan request notifications: Disabled (0x00)
> HCI Event: Command Complete (0x0e) plen 5                                                                          #38 5.408576
      LE Set Extended Advertising Parameters (0x08|0x0036) ncmd 1
        Status: Success (0x00)
        TX power (selected): 0 dbm (0x00)
zephyr.exe[1938982]: < HCI Command: LE Set Advertising Set Random Address (0x08|0x0035) plen 7                       #39 5.416937
        Advertising handle: 0x00
        Advertising random address: D5:B6:CC:31:DB:3B (Static)
> HCI Event: Command Complete (0x0e) plen 4                                                                          #40 5.417860
      LE Set Advertising Set Random Address (0x08|0x0035) ncmd 1
        Status: Success (0x00)
zephyr.exe[1938982]: < HCI Command: LE Set Extended Advertising Data (0x08|0x0037) plen 22                           #41 5.436971
        Handle: 0x00
        Operation: Complete extended advertising data (0x03)
        Fragment preference: Minimize fragmentation (0x01)
        Data length: 0x12
        Flags: 0x04
          BR/EDR Not Supported
        Name (complete): Tester_2CB6EE
> HCI Event: Command Complete (0x0e) plen 4                                                                          #42 5.438109
      LE Set Extended Advertising Data (0x08|0x0037) ncmd 1
        Status: Success (0x00)
zephyr.exe[1938982]: < HCI Command: LE Set Extended Scan Response Data (0x08|0x0038) plen 4                          #43 5.456988
        Handle: 0x00
        Operation: Complete scan response data (0x03)
        Fragment preference: Minimize fragmentation (0x01)
        Data length: 0x00
> HCI Event: Command Complete (0x0e) plen 4                                                                          #44 5.457776
      LE Set Extended Scan Response Data (0x08|0x0038) ncmd 1
        Status: Success (0x00)
zephyr.exe[1938982]: < HCI Command: LE Set Extended Advertising Enable (0x08|0x0039) plen 6                          #45 5.476967
        Extended advertising: Enabled (0x01)
        Number of sets: 1 (0x01)
        Entry 0
          Handle: 0x00
          Duration: 0 ms (0x00)
          Max ext adv events: 0
> HCI Event: Command Complete (0x0e) plen 4                                                                          #46 5.477927
      LE Set Extended Advertising Enable (0x08|0x0039) ncmd 1
        Status: Success (0x00)
> HCI Event: LE Meta Event (0x3e) plen 31                                                                            #47 5.998898
      LE Enhanced Connection Complete (0x0a)
        Status: Success (0x00)
        Handle: 111
        Role: Peripheral (0x01)
        Peer address type: Public (0x00)
        Peer address: C0:07:E8:2C:B6:EE (OUI C0-07-E8)
        Local resolvable private address: 00:00:00:00:00:00 (Non-Resolvable)
        Peer resolvable private address: 00:00:00:00:00:00 (Non-Resolvable)
        Connection interval: 62.50 msec (0x0032)
        Connection latency: 0 (0x0000)
        Supervision timeout: 20000 msec (0x07d0)
        Central clock accuracy: 0x07
> HCI Event: LE Meta Event (0x3e) plen 6                                                                             #48 5.999251
      LE Advertising Set Terminated (0x12)
        Status: Success (0x00)
        Handle: 0
        Connection handle: 111
        Number of completed extended advertising events: 0
zephyr.exe[1938982]: < HCI Command: LE Read Remote Used Features (0x08|0x0016) plen 2                                #49 6.017071
        Handle: 111 Address: C0:07:E8:2C:B6:EE (OUI C0-07-E8)
> HCI Event: Command Status (0x0f) plen 4                                                                            #50 6.017993
      LE Read Remote Used Features (0x08|0x0016) ncmd 1
        Status: Success (0x00)
zephyr.exe[1938982]: < HCI Command: LE Set PHY (0x08|0x0032) plen 7                                                  #51 6.037021
        Handle: 111 Address: C0:07:E8:2C:B6:EE (OUI C0-07-E8)
        All PHYs preference: 0x00
        TX PHYs preference: 0x02
          LE 2M
        RX PHYs preference: 0x02
          LE 2M
        PHY options preference: Reserved (0x0000)
> HCI Event: Command Status (0x0f) plen 4                                                                            #52 6.037964
      LE Set PHY (0x08|0x0032) ncmd 1
        Status: Success (0x00)
> HCI Event: LE Meta Event (0x3e) plen 12                                                                            #53 6.187824
      LE Read Remote Used Features (0x04)
        Status: Success (0x00)
        Handle: 111 Address: C0:07:E8:2C:B6:EE (OUI C0-07-E8)
        Features: 0x2d 0x49 0x01 0xf7 0xef 0x39 0x00 0x80
          LE Encryption
          Extended Reject Indication
          Peripheral-initiated Features Exchange
          LE Data Packet Length Extension
          LE 2M PHY
          LE Coded PHY
          Channel Selection Algorithm #2
          Minimum Number of Used Channels Procedure
          Periodic Advertising Sync Transfer - Sender
          Periodic Advertising Sync Transfer - Recipient
          Sleep Clock Accuracy Updates
          Connected Isochronous Stream - Central
          Connected Isochronous Stream - Peripheral
          Isochronous Broadcaster
          Synchronized Receiver
          Connected Isochronous Stream (Host Support)
          LE Power Control Request
          LE Power Control Request
          LE Path Loss Monitoring
          Connection Subrating
          Connection Subrating (Host Support)
          Channel Classification
          Unknown features (0x8000390000000000)
> HCI Event: LE Meta Event (0x3e) plen 6                                                                             #54 6.687183
      LE PHY Update Complete (0x0c)
        Status: Success (0x00)
        Handle: 111 Address: C0:07:E8:2C:B6:EE (OUI C0-07-E8)
        TX PHY: LE 2M (0x02)
        RX PHY: LE 2M (0x02)
> ACL Data RX: Handle 111 flags 0x02 dlen 11                                                                         #55 8.500067
      SMP: Pairing Request (0x01) len 6
        IO capability: KeyboardDisplay (0x04)
        OOB data: Authentication data not present (0x00)
        Authentication requirement: Bonding, No MITM, Legacy, No Keypresses (0x01)
        Max encryption key size: 16
        Initiator key distribution: EncKey IdKey (0x03)
        Responder key distribution: EncKey IdKey Sign (0x07)
zephyr.exe[1938982]: < HCI Command: Host Number of Completed Packets (0x03|0x0035) plen 5                            #56 8.517134
        Num handles: 1
        Handle: 111 Address: C0:07:E8:2C:B6:EE (OUI C0-07-E8)
        Count: 1
zephyr.exe[1938982]: < ACL Data TX: Handle 111 [1/3] flags 0x00 dlen 11                                              #57 8.517252
      SMP: Pairing Response (0x02) len 6
        IO capability: NoInputNoOutput (0x03)
        OOB data: Authentication data not present (0x00)
        Authentication requirement: Bonding, No MITM, Legacy, No Keypresses (0x01)
        Max encryption key size: 16
        Initiator key distribution: EncKey IdKey (0x03)
        Responder key distribution: EncKey Sign (0x05)
> HCI Event: Number of Completed Packets (0x13) plen 5                                                               #58 8.625016
        Num handles: 1
        Handle: 111 Address: C0:07:E8:2C:B6:EE (OUI C0-07-E8)
        Count: 1
        Buffers: 0/3
        #57: len 11 (0 Kb/s)
        Latency: 107 msec (107-107 msec ~107 msec)
> ACL Data RX: Handle 111 flags 0x02 dlen 21                                                                         #59 8.625259
      SMP: Pairing Confirm (0x03) len 16
        Confirm value[16]: 3426841ffb4ed77fff1d3cb94049ba19
zephyr.exe[1938982]: < HCI Command: Host Number of Completed Packets (0x03|0x0035) plen 5                            #60 8.637043
        Num handles: 1
        Handle: 111 Address: C0:07:E8:2C:B6:EE (OUI C0-07-E8)
        Count: 1
zephyr.exe[1938982]: < ACL Data TX: Handle 111 [1/3] flags 0x00 dlen 21                                              #61 8.637169
      SMP: Pairing Confirm (0x03) len 16
        Confirm value[16]: b498fbf97aa9c945e17cde41f3035b40
> HCI Event: Number of Completed Packets (0x13) plen 5                                                               #62 8.749955
        Num handles: 1
        Handle: 111 Address: C0:07:E8:2C:B6:EE (OUI C0-07-E8)
        Count: 1
        Buffers: 0/3
        #61: len 21 (1 Kb/s)
        Latency: 112 msec (107-112 msec ~110 msec)
> ACL Data RX: Handle 111 flags 0x02 dlen 21                                                                         #63 8.750315
      SMP: Pairing Random (0x04) len 16
        Random value[16]: c609dd5a55e77e760000000000000000
zephyr.exe[1938982]: < HCI Command: Host Number of Completed Packets (0x03|0x0035) plen 5                            #64 8.757010
        Num handles: 1
        Handle: 111 Address: C0:07:E8:2C:B6:EE (OUI C0-07-E8)
        Count: 1
zephyr.exe[1938982]: < ACL Data TX: Handle 111 [1/3] flags 0x00 dlen 21                                              #65 8.757139
      SMP: Pairing Random (0x04) len 16
        Random value[16]: 8e6108f966a694cbe26df70bb96773e6
> HCI Event: Number of Completed Packets (0x13) plen 5                                                               #66 8.874939
        Num handles: 1
        Handle: 111 Address: C0:07:E8:2C:B6:EE (OUI C0-07-E8)
        Count: 1
        Buffers: 0/3
        #65: len 21 (1 Kb/s)
        Latency: 117 msec (107-117 msec ~114 msec)
> HCI Event: LE Meta Event (0x3e) plen 13                                                                            #67 8.937848
      LE Long Term Key Request (0x05)
        Handle: 111 Address: C0:07:E8:2C:B6:EE (OUI C0-07-E8)
        Random number: 0x0000000000000000
        Encrypted diversifier: 0x0000
zephyr.exe[1938982]: < HCI Command: LE Long Term Key Request Reply (0x08|0x001a) plen 18                             #68 8.957083
        Handle: 111 Address: C0:07:E8:2C:B6:EE (OUI C0-07-E8)
        Long term key[16]: f339faf4cb2d94e25c53202125a5510a
> HCI Event: Command Complete (0x0e) plen 6                                                                          #69 8.958215
      LE Long Term Key Request Reply (0x08|0x001a) ncmd 1
        Status: Success (0x00)
        Handle: 111 Address: C0:07:E8:2C:B6:EE (OUI C0-07-E8)
> HCI Event: Encryption Change (0x08) plen 4                                                                         #70 9.250128
        Status: Success (0x00)
        Handle: 111 Address: C0:07:E8:2C:B6:EE (OUI C0-07-E8)
        Encryption: Enabled with AES-CCM (0x01)
zephyr.exe[1938982]: < ACL Data TX: Handle 111 [1/3] flags 0x00 dlen 21                                              #71 9.367138
      SMP: Encryption Information (0x06) len 16
        Long term key[16]: 5da095555cc64d02679f89a05211af56
zephyr.exe[1938982]: < ACL Data TX: Handle 111 [2/3] flags 0x00 dlen 15                                              #72 9.367327
      SMP: Central Identification (0x07) len 10
        EDIV: 0x825e
        Rand: 0x84c81ed264dab3d8
zephyr.exe[1938982]: < ACL Data TX: Handle 111 [3/3] flags 0x00 dlen 21                                              #73 9.367353
      SMP: Signing Information (0x0a) len 16
        Signature key[16]: bc235a02440d0c3424a2acf8fd71a45c
> HCI Event: Number of Completed Packets (0x13) plen 5                                                               #74 9.375401
        Num handles: 1
        Handle: 111 Address: C0:07:E8:2C:B6:EE (OUI C0-07-E8)
        Count: 1
        Buffers: 2/3
        #71: len 21 (21 Kb/s)
        Latency: 8 msec (8-117 msec ~61 msec)
> HCI Event: Number of Completed Packets (0x13) plen 5                                                               #75 9.375786
        Num handles: 1
        Handle: 111 Address: C0:07:E8:2C:B6:EE (OUI C0-07-E8)
        Count: 1
        Buffers: 1/3
        #72: len 15 (15 Kb/s)
        Latency: 8 msec (8-117 msec ~34 msec)
> HCI Event: Number of Completed Packets (0x13) plen 5                                                               #76 9.437509
        Num handles: 1
        Handle: 111 Address: C0:07:E8:2C:B6:EE (OUI C0-07-E8)
        Count: 1
        Buffers: 0/3
        #73: len 21 (2 Kb/s)
        Latency: 70 msec (8-117 msec ~52 msec)
> ACL Data RX: Handle 111 flags 0x02 dlen 21                                                                         #77 9.437821
      SMP: Encryption Information (0x06) len 16
        Long term key[16]: 1190dc8fe50007dbd6f221fd5fc799f6
> ACL Data RX: Handle 111 flags 0x02 dlen 15                                                                         #78 9.438047
      SMP: Central Identification (0x07) len 10
        EDIV: 0x01f5
        Rand: 0x805ceeafb53a1492
> ACL Data RX: Handle 111 flags 0x02 dlen 21                                                                         #79 9.438533
      SMP: Identity Information (0x08) len 16
        Identity resolving key[16]: 655c96b84e4913b446e013a1f3bb1a08
zephyr.exe[1938982]: < HCI Command: Host Number of Completed Packets (0x03|0x0035) plen 5                            #80 9.457128
        Num handles: 1
        Handle: 111 Address: C0:07:E8:2C:B6:EE (OUI C0-07-E8)
        Count: 1
zephyr.exe[1938982]: < HCI Command: Host Number of Completed Packets (0x03|0x0035) plen 5                            #81 9.457250
        Num handles: 1
        Handle: 111 Address: C0:07:E8:2C:B6:EE (OUI C0-07-E8)
        Count: 1
zephyr.exe[1938982]: < HCI Command: Host Number of Completed Packets (0x03|0x0035) plen 5                            #82 9.457772
        Num handles: 1
        Handle: 111 Address: C0:07:E8:2C:B6:EE (OUI C0-07-E8)
        Count: 1
> ACL Data RX: Handle 111 flags 0x02 dlen 12                                                                         #83 9.458015
      SMP: Identity Address Information (0x09) len 7
        Address: C0:07:E8:2C:B6:EE (OUI C0-07-E8)
zephyr.exe[1938982]: < HCI Command: LE Add Device To Resolving List (0x08|0x0027) plen 39                            #84 9.477177
        Address type: Public (0x00)
        Address: C0:07:E8:2C:B6:EE (OUI C0-07-E8)
        Peer identity resolving key[16]: 655c96b84e4913b446e013a1f3bb1a08
        Local identity resolving key[16]: 00000000000000000000000000000000
> HCI Event: Command Complete (0x0e) plen 4                                                                          #85 9.478304
      LE Add Device To Resolving List (0x08|0x0027) ncmd 1
        Status: Success (0x00)
zephyr.exe[1938982]: < HCI Command: LE Set Privacy Mode (0x08|0x004e) plen 8                                         #86 9.497116
        Peer Identity address type: Public (0x00)
        Peer Identity address: C0:07:E8:2C:B6:EE (OUI C0-07-E8)
        Privacy Mode: Use Device Privacy (0x01)
> HCI Event: Command Complete (0x0e) plen 4                                                                          #87 9.498168
      LE Set Privacy Mode (0x08|0x004e) ncmd 1
        Status: Success (0x00)
> ACL Data RX: Handle 111 flags 0x02 dlen 13                                                                         #88 9.500048
      ATT: Find By Type Value Request (0x06) len 8
        Handle range: 0x0001-0xffff
        Attribute type: Primary Service (0x2800)
          UUID: Object Transfer (0x1825)
zephyr.exe[1938982]: < HCI Command: LE Set Address Resolution Enable (0x08|0x002d) plen 1                            #89 9.517102
        Address resolution: Enabled (0x01)
> HCI Event: Command Complete (0x0e) plen 4                                                                          #90 9.517917
      LE Set Address Resolution Enable (0x08|0x002d) ncmd 1
        Status: Success (0x00)
zephyr.exe[1938982]: < HCI Command: Host Number of Completed Packets (0x03|0x0035) plen 5                            #91 9.537038
        Num handles: 1
        Handle: 111 Address: C0:07:E8:2C:B6:EE (OUI C0-07-E8)
        Count: 1
zephyr.exe[1938982]: < HCI Command: Host Number of Completed Packets (0x03|0x0035) plen 5                            #92 9.537177
        Num handles: 1
        Handle: 111 Address: C0:07:E8:2C:B6:EE (OUI C0-07-E8)
        Count: 1
zephyr.exe[1938982]: < ACL Data TX: Handle 111 [1/3] flags 0x00 dlen 9                                               #93 9.537202
      ATT: Find By Type Value Response (0x07) len 4
        Handle range: 0x0021-0x0033
> HCI Event: Number of Completed Packets (0x13) plen 5                                                               #94 9.625012
        Num handles: 1
        Handle: 111 Address: C0:07:E8:2C:B6:EE (OUI C0-07-E8)
        Count: 1
        Buffers: 0/3
        #93: len 9 (0 Kb/s)
        Latency: 87 msec (8-117 msec ~70 msec)
> ACL Data RX: Handle 111 flags 0x02 dlen 13                                                                         #95 9.625186
      ATT: Find By Type Value Request (0x06) len 8
        Handle range: 0x0034-0xffff
        Attribute type: Primary Service (0x2800)
          UUID: Object Transfer (0x1825)
zephyr.exe[1938982]: < HCI Command: Host Number of Completed Packets (0x03|0x0035) plen 5                            #96 9.637196
        Num handles: 1
        Handle: 111 Address: C0:07:E8:2C:B6:EE (OUI C0-07-E8)
        Count: 1
zephyr.exe[1938982]: < ACL Data TX: Handle 111 [1/3] flags 0x00 dlen 9                                               #97 9.637350
      ATT: Error Response (0x01) len 4
        Find By Type Value Request (0x06)
        Handle: 0x0034
        Error: Attribute Not Found (0x0a)
> HCI Event: Number of Completed Packets (0x13) plen 5                                                               #98 9.749997
        Num handles: 1
        Handle: 111 Address: C0:07:E8:2C:B6:EE (OUI C0-07-E8)
        Count: 1
        Buffers: 0/3
        #97: len 9 (0 Kb/s)
        Latency: 112 msec (8-117 msec ~91 msec)
> ACL Data RX: Handle 111 flags 0x02 dlen 11                                                                         #99 9.750176
      ATT: Read By Type Request (0x08) len 6
        Handle range: 0x0021-0x0033
        Attribute type: Characteristic (0x2803)
zephyr.exe[1938982]: < HCI Command: Host Number of Completed Packets (0x03|0x0035) plen 5                           #100 9.757088
        Num handles: 1
        Handle: 111 Address: C0:07:E8:2C:B6:EE (OUI C0-07-E8)
        Count: 1
zephyr.exe[1938982]: < ACL Data TX: Handle 111 [1/3] flags 0x00 dlen 20                                             #101 9.757289
      ATT: Read By Type Response (0x09) len 15
        Attribute data length: 7
        Attribute data list: 2 entries
        Handle: 0x0022
        Value[5]: 022300bd2a
            Properties: 0x02
              Read (0x02)
            Value Handle: 0x0023
            Value UUID: OTS Feature (0x2abd)
        Handle: 0x0024
        Value[5]: 0a2500be2a
            Properties: 0x0a
              Read (0x02)
              Write (0x08)
            Value Handle: 0x0025
            Value UUID: Object Name (0x2abe)
> HCI Event: Number of Completed Packets (0x13) plen 5                                                              #102 9.875002
        Num handles: 1
        Handle: 111 Address: C0:07:E8:2C:B6:EE (OUI C0-07-E8)
        Count: 1
        Buffers: 0/3
        #101: len 20 (1 Kb/s)
        Latency: 117 msec (8-117 msec ~104 msec)
> ACL Data RX: Handle 111 flags 0x02 dlen 11                                                                        #103 9.875189
      ATT: Read By Type Request (0x08) len 6
        Handle range: 0x0025-0x0033
        Attribute type: Characteristic (0x2803)
zephyr.exe[1938982]: < HCI Command: Host Number of Completed Packets (0x03|0x0035) plen 5                           #104 9.876980
        Num handles: 1
        Handle: 111 Address: C0:07:E8:2C:B6:EE (OUI C0-07-E8)
        Count: 1
zephyr.exe[1938982]: < ACL Data TX: Handle 111 [1/3] flags 0x00 dlen 20                                             #105 9.877233
      ATT: Read By Type Response (0x09) len 15
        Attribute data length: 7
        Attribute data list: 2 entries
        Handle: 0x0026
        Value[5]: 022700bf2a
            Properties: 0x02
              Read (0x02)
            Value Handle: 0x0027
            Value UUID: Object Type (0x2abf)
        Handle: 0x0028
        Value[5]: 022900c02a
            Properties: 0x02
              Read (0x02)
            Value Handle: 0x0029
            Value UUID: Object Size (0x2ac0)
> HCI Event: Number of Completed Packets (0x13) plen 5                                                              #106 9.999951
        Num handles: 1
        Handle: 111 Address: C0:07:E8:2C:B6:EE (OUI C0-07-E8)
        Count: 1
        Buffers: 0/3
        #105: len 20 (1 Kb/s)
        Latency: 122 msec (8-122 msec ~113 msec)
> ACL Data RX: Handle 111 flags 0x02 dlen 11                                                                       #107 10.000199
      ATT: Read By Type Request (0x08) len 6
        Handle range: 0x0029-0x0033
        Attribute type: Characteristic (0x2803)
zephyr.exe[1938982]: < HCI Command: Host Number of Completed Packets (0x03|0x0035) plen 5                          #108 10.017044
        Num handles: 1
        Handle: 111 Address: C0:07:E8:2C:B6:EE (OUI C0-07-E8)
        Count: 1
zephyr.exe[1938982]: < ACL Data TX: Handle 111 [1/3] flags 0x00 dlen 20                                            #109 10.017236
      ATT: Read By Type Response (0x09) len 15
        Attribute data length: 7
        Attribute data list: 2 entries
        Handle: 0x002a
        Value[5]: 022b00c32a
            Properties: 0x02
              Read (0x02)
            Value Handle: 0x002b
            Value UUID: Object ID (0x2ac3)
        Handle: 0x002c
        Value[5]: 022d00c42a
            Properties: 0x02
              Read (0x02)
            Value Handle: 0x002d
            Value UUID: Object Properties (0x2ac4)
> HCI Event: Number of Completed Packets (0x13) plen 5                                                             #110 10.125022
        Num handles: 1
        Handle: 111 Address: C0:07:E8:2C:B6:EE (OUI C0-07-E8)
        Count: 1
        Buffers: 0/3
        #109: len 20 (1 Kb/s)
        Latency: 107 msec (8-122 msec ~110 msec)
> ACL Data RX: Handle 111 flags 0x02 dlen 11                                                                       #111 10.125169
      ATT: Read By Type Request (0x08) len 6
        Handle range: 0x002d-0x0033
        Attribute type: Characteristic (0x2803)
zephyr.exe[1938982]: < HCI Command: Host Number of Completed Packets (0x03|0x0035) plen 5                          #112 10.137048
        Num handles: 1
        Handle: 111 Address: C0:07:E8:2C:B6:EE (OUI C0-07-E8)
        Count: 1
zephyr.exe[1938982]: < ACL Data TX: Handle 111 [1/3] flags 0x00 dlen 20                                            #113 10.137167
      ATT: Read By Type Response (0x09) len 15
        Attribute data length: 7
        Attribute data list: 2 entries
        Handle: 0x002e
        Value[5]: 282f00c52a
            Properties: 0x28
              Write (0x08)
              Indicate (0x20)
            Value Handle: 0x002f
            Value UUID: Object Action Control Point (0x2ac5)
        Handle: 0x0031
        Value[5]: 283200c62a
            Properties: 0x28
              Write (0x08)
              Indicate (0x20)
            Value Handle: 0x0032
            Value UUID: Object List Control Point (0x2ac6)
> HCI Event: Number of Completed Packets (0x13) plen 5                                                             #114 10.250024
        Num handles: 1
        Handle: 111 Address: C0:07:E8:2C:B6:EE (OUI C0-07-E8)
        Count: 1
        Buffers: 0/3
        #113: len 20 (1 Kb/s)
        Latency: 112 msec (8-122 msec ~111 msec)
> ACL Data RX: Handle 111 flags 0x02 dlen 11                                                                       #115 10.250168
      ATT: Read By Type Request (0x08) len 6
        Handle range: 0x0032-0x0033
        Attribute type: Characteristic (0x2803)
zephyr.exe[1938982]: < HCI Command: Host Number of Completed Packets (0x03|0x0035) plen 5                          #116 10.257087
        Num handles: 1
        Handle: 111 Address: C0:07:E8:2C:B6:EE (OUI C0-07-E8)
        Count: 1
zephyr.exe[1938982]: < ACL Data TX: Handle 111 [1/3] flags 0x00 dlen 9                                             #117 10.257239
      ATT: Error Response (0x01) len 4
        Read By Type Request (0x08)
        Handle: 0x0032
        Error: Attribute Not Found (0x0a)
> HCI Event: Number of Completed Packets (0x13) plen 5                                                             #118 10.374977
        Num handles: 1
        Handle: 111 Address: C0:07:E8:2C:B6:EE (OUI C0-07-E8)
        Count: 1
        Buffers: 0/3
        #117: len 9 (0 Kb/s)
        Latency: 117 msec (8-122 msec ~114 msec)
> ACL Data RX: Handle 111 flags 0x02 dlen 9                                                                        #119 10.375127
      ATT: Find Information Request (0x04) len 4
        Handle range: 0x0030-0x0030
zephyr.exe[1938982]: < HCI Command: Host Number of Completed Packets (0x03|0x0035) plen 5                          #120 10.377006
        Num handles: 1
        Handle: 111 Address: C0:07:E8:2C:B6:EE (OUI C0-07-E8)
        Count: 1
zephyr.exe[1938982]: < ACL Data TX: Handle 111 [1/3] flags 0x00 dlen 10                                            #121 10.377143
      ATT: Find Information Response (0x05) len 5
        Format: UUID-16 (0x01)
        Handle: 0x0030
        UUID: Client Characteristic Configuration (0x2902)
> HCI Event: Number of Completed Packets (0x13) plen 5                                                             #122 10.500027
        Num handles: 1
        Handle: 111 Address: C0:07:E8:2C:B6:EE (OUI C0-07-E8)
        Count: 1
        Buffers: 0/3
        #121: len 10 (0 Kb/s)
        Latency: 122 msec (8-122 msec ~118 msec)
> ACL Data RX: Handle 111 flags 0x02 dlen 9                                                                        #123 10.500153
      ATT: Find Information Request (0x04) len 4
        Handle range: 0x0033-0x0033
zephyr.exe[1938982]: < HCI Command: Host Number of Completed Packets (0x03|0x0035) plen 5                          #124 10.517060
        Num handles: 1
        Handle: 111 Address: C0:07:E8:2C:B6:EE (OUI C0-07-E8)
        Count: 1
zephyr.exe[1938982]: < ACL Data TX: Handle 111 [1/3] flags 0x00 dlen 10                                            #125 10.517203
      ATT: Find Information Response (0x05) len 5
        Format: UUID-16 (0x01)
        Handle: 0x0033
        UUID: Client Characteristic Configuration (0x2902)
> HCI Event: Number of Completed Packets (0x13) plen 5                                                             #126 10.625001
        Num handles: 1
        Handle: 111 Address: C0:07:E8:2C:B6:EE (OUI C0-07-E8)
        Count: 1
        Buffers: 0/3
        #125: len 10 (0 Kb/s)
        Latency: 107 msec (8-122 msec ~113 msec)
> ACL Data RX: Handle 111 flags 0x02 dlen 7                                                                        #127 10.625110
      ATT: Read Request (0x0a) len 2
        Handle: 0x0023
zephyr.exe[1938982]: < HCI Command: Host Number of Completed Packets (0x03|0x0035) plen 5                          #128 10.637032
        Num handles: 1
        Handle: 111 Address: C0:07:E8:2C:B6:EE (OUI C0-07-E8)
        Count: 1
zephyr.exe[1938982]: < ACL Data TX: Handle 111 [1/3] flags 0x00 dlen 13                                            #129 10.637166
      ATT: Read Response (0x0b) len 8
        Value[8]: 3701000001000000
> HCI Event: Number of Completed Packets (0x13) plen 5                                                             #130 10.750023
        Num handles: 1
        Handle: 111 Address: C0:07:E8:2C:B6:EE (OUI C0-07-E8)
        Count: 1
        Buffers: 0/3
        #129: len 13 (0 Kb/s)
        Latency: 112 msec (8-122 msec ~113 msec)
> ACL Data RX: Handle 111 flags 0x02 dlen 13                                                                       #131 10.750204
      ATT: Find By Type Value Request (0x06) len 8
        Handle range: 0x0001-0xffff
        Attribute type: Primary Service (0x2800)
          UUID: Object Transfer (0x1825)
zephyr.exe[1938982]: < HCI Command: Host Number of Completed Packets (0x03|0x0035) plen 5                          #132 10.757066
        Num handles: 1
        Handle: 111 Address: C0:07:E8:2C:B6:EE (OUI C0-07-E8)
        Count: 1
zephyr.exe[1938982]: < ACL Data TX: Handle 111 [1/3] flags 0x00 dlen 9                                             #133 10.757190
      ATT: Find By Type Value Response (0x07) len 4
        Handle range: 0x0021-0x0033
> HCI Event: Number of Completed Packets (0x13) plen 5                                                             #134 10.874967
        Num handles: 1
        Handle: 111 Address: C0:07:E8:2C:B6:EE (OUI C0-07-E8)
        Count: 1
        Buffers: 0/3
        #133: len 9 (0 Kb/s)
        Latency: 117 msec (8-122 msec ~115 msec)
> ACL Data RX: Handle 111 flags 0x02 dlen 13                                                                       #135 10.875213
      ATT: Find By Type Value Request (0x06) len 8
        Handle range: 0x0034-0xffff
        Attribute type: Primary Service (0x2800)
          UUID: Object Transfer (0x1825)
zephyr.exe[1938982]: < HCI Command: Host Number of Completed Packets (0x03|0x0035) plen 5                          #136 10.877000
        Num handles: 1
        Handle: 111 Address: C0:07:E8:2C:B6:EE (OUI C0-07-E8)
        Count: 1
zephyr.exe[1938982]: < ACL Data TX: Handle 111 [1/3] flags 0x00 dlen 9                                             #137 10.877109
      ATT: Error Response (0x01) len 4
        Find By Type Value Request (0x06)
        Handle: 0x0034
        Error: Attribute Not Found (0x0a)
> HCI Event: Number of Completed Packets (0x13) plen 5                                                             #138 11.000079
        Num handles: 1
        Handle: 111 Address: C0:07:E8:2C:B6:EE (OUI C0-07-E8)
        Count: 1
        Buffers: 0/3
        #137: len 9 (0 Kb/s)
        Latency: 122 msec (8-122 msec ~119 msec)
> ACL Data RX: Handle 111 flags 0x02 dlen 11                                                                       #139 11.000180
      ATT: Read By Type Request (0x08) len 6
        Handle range: 0x0021-0x0033
        Attribute type: Characteristic (0x2803)
zephyr.exe[1938982]: < HCI Command: Host Number of Completed Packets (0x03|0x0035) plen 5                          #140 11.017170
        Num handles: 1
        Handle: 111 Address: C0:07:E8:2C:B6:EE (OUI C0-07-E8)
        Count: 1
zephyr.exe[1938982]: < ACL Data TX: Handle 111 [1/3] flags 0x00 dlen 20                                            #141 11.017320
      ATT: Read By Type Response (0x09) len 15
        Attribute data length: 7
        Attribute data list: 2 entries
        Handle: 0x0022
        Value[5]: 022300bd2a
            Properties: 0x02
              Read (0x02)
            Value Handle: 0x0023
            Value UUID: OTS Feature (0x2abd)
        Handle: 0x0024
        Value[5]: 0a2500be2a
            Properties: 0x0a
              Read (0x02)
              Write (0x08)
            Value Handle: 0x0025
            Value UUID: Object Name (0x2abe)
zephyr.exe[1938982]: < ACL Data TX: Handle 111 [2/3] flags 0x00 dlen 16                                            #142 11.027037
      LE L2CAP: Connection Parameter Update Request (0x12) ident 1 len 8
        Min interval: 24
        Max interval: 40
        Peripheral latency: 0
        Timeout multiplier: 42
> HCI Event: Number of Completed Packets (0x13) plen 5                                                             #143 11.062838
        Num handles: 1
        Handle: 111 Address: C0:07:E8:2C:B6:EE (OUI C0-07-E8)
        Count: 1
        Buffers: 1/3
        #141: len 20 (3 Kb/s)
        Latency: 45 msec (8-122 msec ~82 msec)
> HCI Event: Number of Completed Packets (0x13) plen 5                                                             #144 11.125023
        Num handles: 1
        Handle: 111 Address: C0:07:E8:2C:B6:EE (OUI C0-07-E8)
        Count: 1
        Buffers: 0/3
        #142: len 16 (1 Kb/s)
        Latency: 97 msec (8-122 msec ~90 msec)
> ACL Data RX: Handle 111 flags 0x02 dlen 11                                                                       #145 11.125154
      ATT: Read By Type Request (0x08) len 6
        Handle range: 0x0025-0x0033
        Attribute type: Characteristic (0x2803)
> ACL Data RX: Handle 111 flags 0x02 dlen 10                                                                       #146 11.125415
      LE L2CAP: Connection Parameter Update Response (0x13) ident 1 len 2
        Result: Connection Parameters accepted (0x0000)
zephyr.exe[1938982]: < HCI Command: Host Number of Completed Packets (0x03|0x0035) plen 5                          #147 11.137046
        Num handles: 1
        Handle: 111 Address: C0:07:E8:2C:B6:EE (OUI C0-07-E8)
        Count: 1
zephyr.exe[1938982]: < ACL Data TX: Handle 111 [1/3] flags 0x00 dlen 20                                            #148 11.137186
      ATT: Read By Type Response (0x09) len 15
        Attribute data length: 7
        Attribute data list: 2 entries
        Handle: 0x0026
        Value[5]: 022700bf2a
            Properties: 0x02
              Read (0x02)
            Value Handle: 0x0027
            Value UUID: Object Type (0x2abf)
        Handle: 0x0028
        Value[5]: 022900c02a
            Properties: 0x02
              Read (0x02)
            Value Handle: 0x0029
            Value UUID: Object Size (0x2ac0)
zephyr.exe[1938982]: < HCI Command: Host Number of Completed Packets (0x03|0x0035) plen 5                          #149 11.137217
        Num handles: 1
        Handle: 111 Address: C0:07:E8:2C:B6:EE (OUI C0-07-E8)
        Count: 1
> HCI Event: Number of Completed Packets (0x13) plen 5                                                             #150 11.250014
        Num handles: 1
        Handle: 111 Address: C0:07:E8:2C:B6:EE (OUI C0-07-E8)
        Count: 1
        Buffers: 0/3
        #148: len 20 (1 Kb/s)
        Latency: 112 msec (8-122 msec ~101 msec)
> ACL Data RX: Handle 111 flags 0x02 dlen 11                                                                       #151 11.250201
      ATT: Read By Type Request (0x08) len 6
        Handle range: 0x0029-0x0033
        Attribute type: Characteristic (0x2803)
zephyr.exe[1938982]: < HCI Command: Host Number of Completed Packets (0x03|0x0035) plen 5                          #152 11.257057
        Num handles: 1
        Handle: 111 Address: C0:07:E8:2C:B6:EE (OUI C0-07-E8)
        Count: 1
zephyr.exe[1938982]: < ACL Data TX: Handle 111 [1/3] flags 0x00 dlen 20                                            #153 11.257414
      ATT: Read By Type Response (0x09) len 15
        Attribute data length: 7
        Attribute data list: 2 entries
        Handle: 0x002a
        Value[5]: 022b00c32a
            Properties: 0x02
              Read (0x02)
            Value Handle: 0x002b
            Value UUID: Object ID (0x2ac3)
        Handle: 0x002c
        Value[5]: 022d00c42a
            Properties: 0x02
              Read (0x02)
            Value Handle: 0x002d
            Value UUID: Object Properties (0x2ac4)
> HCI Event: Number of Completed Packets (0x13) plen 5                                                             #154 11.375029
        Num handles: 1
        Handle: 111 Address: C0:07:E8:2C:B6:EE (OUI C0-07-E8)
        Count: 1
        Buffers: 0/3
        #153: len 20 (1 Kb/s)
        Latency: 117 msec (8-122 msec ~109 msec)
> ACL Data RX: Handle 111 flags 0x02 dlen 11                                                                       #155 11.375306
      ATT: Read By Type Request (0x08) len 6
        Handle range: 0x002d-0x0033
        Attribute type: Characteristic (0x2803)
zephyr.exe[1938982]: < HCI Command: Host Number of Completed Packets (0x03|0x0035) plen 5                          #156 11.377072
        Num handles: 1
        Handle: 111 Address: C0:07:E8:2C:B6:EE (OUI C0-07-E8)
        Count: 1
zephyr.exe[1938982]: < ACL Data TX: Handle 111 [1/3] flags 0x00 dlen 20                                            #157 11.377182
      ATT: Read By Type Response (0x09) len 15
        Attribute data length: 7
        Attribute data list: 2 entries
        Handle: 0x002e
        Value[5]: 282f00c52a
            Properties: 0x28
              Write (0x08)
              Indicate (0x20)
            Value Handle: 0x002f
            Value UUID: Object Action Control Point (0x2ac5)
        Handle: 0x0031
        Value[5]: 283200c62a
            Properties: 0x28
              Write (0x08)
              Indicate (0x20)
            Value Handle: 0x0032
            Value UUID: Object List Control Point (0x2ac6)
> HCI Event: Number of Completed Packets (0x13) plen 5                                                             #158 11.500040
        Num handles: 1
        Handle: 111 Address: C0:07:E8:2C:B6:EE (OUI C0-07-E8)
        Count: 1
        Buffers: 0/3
        #157: len 20 (1 Kb/s)
        Latency: 122 msec (8-122 msec ~116 msec)
> ACL Data RX: Handle 111 flags 0x02 dlen 11                                                                       #159 11.500299
      ATT: Read By Type Request (0x08) len 6
        Handle range: 0x0032-0x0033
        Attribute type: Characteristic (0x2803)
zephyr.exe[1938982]: < HCI Command: Host Number of Completed Packets (0x03|0x0035) plen 5                          #160 11.517067
        Num handles: 1
        Handle: 111 Address: C0:07:E8:2C:B6:EE (OUI C0-07-E8)
        Count: 1
zephyr.exe[1938982]: < ACL Data TX: Handle 111 [1/3] flags 0x00 dlen 9                                             #161 11.517235
      ATT: Error Response (0x01) len 4
        Read By Type Request (0x08)
        Handle: 0x0032
        Error: Attribute Not Found (0x0a)
> HCI Event: Number of Completed Packets (0x13) plen 5                                                             #162 11.625010
        Num handles: 1
        Handle: 111 Address: C0:07:E8:2C:B6:EE (OUI C0-07-E8)
        Count: 1
        Buffers: 0/3
        #161: len 9 (0 Kb/s)
        Latency: 107 msec (8-122 msec ~111 msec)
> ACL Data RX: Handle 111 flags 0x02 dlen 9                                                                        #163 11.625264
      ATT: Find Information Request (0x04) len 4
        Handle range: 0x0030-0x0030
zephyr.exe[1938982]: < HCI Command: Host Number of Completed Packets (0x03|0x0035) plen 5                          #164 11.637052
        Num handles: 1
        Handle: 111 Address: C0:07:E8:2C:B6:EE (OUI C0-07-E8)
        Count: 1
zephyr.exe[1938982]: < ACL Data TX: Handle 111 [1/3] flags 0x00 dlen 10                                            #165 11.637196
      ATT: Find Information Response (0x05) len 5
        Format: UUID-16 (0x01)
        Handle: 0x0030
        UUID: Client Characteristic Configuration (0x2902)
> HCI Event: Number of Completed Packets (0x13) plen 5                                                             #166 11.750024
        Num handles: 1
        Handle: 111 Address: C0:07:E8:2C:B6:EE (OUI C0-07-E8)
        Count: 1
        Buffers: 0/3
        #165: len 10 (0 Kb/s)
        Latency: 112 msec (8-122 msec ~112 msec)
> ACL Data RX: Handle 111 flags 0x02 dlen 9                                                                        #167 11.750137
      ATT: Find Information Request (0x04) len 4
        Handle range: 0x0033-0x0033
zephyr.exe[1938982]: < HCI Command: Host Number of Completed Packets (0x03|0x0035) plen 5                          #168 11.757152
        Num handles: 1
        Handle: 111 Address: C0:07:E8:2C:B6:EE (OUI C0-07-E8)
        Count: 1
zephyr.exe[1938982]: < ACL Data TX: Handle 111 [1/3] flags 0x00 dlen 10                                            #169 11.757299
      ATT: Find Information Response (0x05) len 5
        Format: UUID-16 (0x01)
        Handle: 0x0033
        UUID: Client Characteristic Configuration (0x2902)
> HCI Event: Number of Completed Packets (0x13) plen 5                                                             #170 11.874991
        Num handles: 1
        Handle: 111 Address: C0:07:E8:2C:B6:EE (OUI C0-07-E8)
        Count: 1
        Buffers: 0/3
        #169: len 10 (0 Kb/s)
        Latency: 117 msec (8-122 msec ~115 msec)
> ACL Data RX: Handle 111 flags 0x02 dlen 7                                                                        #171 11.875160
      ATT: Read Request (0x0a) len 2
        Handle: 0x0023
zephyr.exe[1938982]: < HCI Command: Host Number of Completed Packets (0x03|0x0035) plen 5                          #172 11.877045
        Num handles: 1
        Handle: 111 Address: C0:07:E8:2C:B6:EE (OUI C0-07-E8)
        Count: 1
zephyr.exe[1938982]: < ACL Data TX: Handle 111 [1/3] flags 0x00 dlen 13                                            #173 11.877169
      ATT: Read Response (0x0b) len 8
        Value[8]: 3701000001000000
> HCI Event: Number of Completed Packets (0x13) plen 5                                                             #174 12.000065
        Num handles: 1
        Handle: 111 Address: C0:07:E8:2C:B6:EE (OUI C0-07-E8)
        Count: 1
        Buffers: 0/3
        #173: len 13 (0 Kb/s)
        Latency: 122 msec (8-122 msec ~118 msec)
> ACL Data RX: Handle 111 flags 0x02 dlen 9                                                                        #175 12.000327
      ATT: Write Request (0x12) len 4
        Handle: 0x0030
          Data[2]: 0000
zephyr.exe[1938982]: < HCI Command: Host Number of Completed Packets (0x03|0x0035) plen 5                          #176 12.017111
        Num handles: 1
        Handle: 111 Address: C0:07:E8:2C:B6:EE (OUI C0-07-E8)
        Count: 1
zephyr.exe[1938982]: < ACL Data TX: Handle 111 [1/3] flags 0x00 dlen 5                                             #177 12.017238
      ATT: Write Response (0x13) len 0
> HCI Event: Number of Completed Packets (0x13) plen 5                                                             #178 12.124943
        Num handles: 1
        Handle: 111 Address: C0:07:E8:2C:B6:EE (OUI C0-07-E8)
        Count: 1
        Buffers: 0/3
        #177: len 5 (0 Kb/s)
        Latency: 107 msec (8-122 msec ~113 msec)
> ACL Data RX: Handle 111 flags 0x02 dlen 9                                                                        #179 12.125230
      ATT: Write Request (0x12) len 4
        Handle: 0x0030
          Data[2]: 0200
zephyr.exe[1938982]: < HCI Command: Host Number of Completed Packets (0x03|0x0035) plen 5                          #180 12.137080
        Num handles: 1
        Handle: 111 Address: C0:07:E8:2C:B6:EE (OUI C0-07-E8)
        Count: 1
zephyr.exe[1938982]: < ACL Data TX: Handle 111 [1/3] flags 0x00 dlen 5                                             #181 12.137215
      ATT: Write Response (0x13) len 0
> HCI Event: Number of Completed Packets (0x13) plen 5                                                             #182 12.250027
        Num handles: 1
        Handle: 111 Address: C0:07:E8:2C:B6:EE (OUI C0-07-E8)
        Count: 1
        Buffers: 0/3
        #181: len 5 (0 Kb/s)
        Latency: 112 msec (8-122 msec ~113 msec)
> ACL Data RX: Handle 111 flags 0x02 dlen 9                                                                        #183 12.250290
      ATT: Write Request (0x12) len 4
        Handle: 0x0033
          Data[2]: 0000
zephyr.exe[1938982]: < HCI Command: Host Number of Completed Packets (0x03|0x0035) plen 5                          #184 12.257108
        Num handles: 1
        Handle: 111 Address: C0:07:E8:2C:B6:EE (OUI C0-07-E8)
        Count: 1
zephyr.exe[1938982]: < ACL Data TX: Handle 111 [1/3] flags 0x00 dlen 5                                             #185 12.257235
      ATT: Write Response (0x13) len 0
> HCI Event: Number of Completed Packets (0x13) plen 5                                                             #186 12.374987
        Num handles: 1
        Handle: 111 Address: C0:07:E8:2C:B6:EE (OUI C0-07-E8)
        Count: 1
        Buffers: 0/3
        #185: len 5 (0 Kb/s)
        Latency: 117 msec (8-122 msec ~115 msec)
> ACL Data RX: Handle 111 flags 0x02 dlen 9                                                                        #187 12.375254
      ATT: Write Request (0x12) len 4
        Handle: 0x0033
          Data[2]: 0200
zephyr.exe[1938982]: < HCI Command: Host Number of Completed Packets (0x03|0x0035) plen 5                          #188 12.377187
        Num handles: 1
        Handle: 111 Address: C0:07:E8:2C:B6:EE (OUI C0-07-E8)
        Count: 1
zephyr.exe[1938982]: < ACL Data TX: Handle 111 [1/3] flags 0x00 dlen 5                                             #189 12.377353
      ATT: Write Response (0x13) len 0
> HCI Event: Number of Completed Packets (0x13) plen 5                                                             #190 12.562518
        Num handles: 1
        Handle: 111 Address: C0:07:E8:2C:B6:EE (OUI C0-07-E8)
        Count: 1
        Buffers: 0/3
        #189: len 5 (0 Kb/s)
        Latency: 185 msec (8-185 msec ~150 msec)
> ACL Data RX: Handle 111 flags 0x02 dlen 9                                                                        #191 12.562820
      ATT: Write Request (0x12) len 4
        Handle: 0x0033
          Data[2]: 0000
zephyr.exe[1938982]: < HCI Command: Host Number of Completed Packets (0x03|0x0035) plen 5                          #192 12.577156
        Num handles: 1
        Handle: 111 Address: C0:07:E8:2C:B6:EE (OUI C0-07-E8)
        Count: 1
zephyr.exe[1938982]: < ACL Data TX: Handle 111 [1/3] flags 0x00 dlen 5                                             #193 12.577352
      ATT: Write Response (0x13) len 0
> HCI Event: Number of Completed Packets (0x13) plen 5                                                             #194 12.687481
        Num handles: 1
        Handle: 111 Address: C0:07:E8:2C:B6:EE (OUI C0-07-E8)
        Count: 1
        Buffers: 0/3
        #193: len 5 (0 Kb/s)
        Latency: 110 msec (8-185 msec ~130 msec)
> ACL Data RX: Handle 111 flags 0x02 dlen 9                                                                        #195 12.687644
      ATT: Write Request (0x12) len 4
        Handle: 0x0033
          Data[2]: 0200
zephyr.exe[1938982]: < HCI Command: Host Number of Completed Packets (0x03|0x0035) plen 5                          #196 12.697180
        Num handles: 1
        Handle: 111 Address: C0:07:E8:2C:B6:EE (OUI C0-07-E8)
        Count: 1
zephyr.exe[1938982]: < ACL Data TX: Handle 111 [1/3] flags 0x00 dlen 5                                             #197 12.697301
      ATT: Write Response (0x13) len 0
> HCI Event: Number of Completed Packets (0x13) plen 5                                                             #198 12.812571
        Num handles: 1
        Handle: 111 Address: C0:07:E8:2C:B6:EE (OUI C0-07-E8)
        Count: 1
        Buffers: 0/3
        #197: len 5 (0 Kb/s)
        Latency: 115 msec (8-185 msec ~122 msec)
> ACL Data RX: Handle 111 flags 0x02 dlen 18                                                                       #199 12.812778
      LE L2CAP: LE Connection Request (0x14) ident 1 len 10
        PSM: 37 (0x0025)
        Source CID: 84
        MTU: 1024
        MPS: 32
        Credits: 3
zephyr.exe[1938982]: < HCI Command: Host Number of Completed Packets (0x03|0x0035) plen 5                          #200 12.817165
        Num handles: 1
        Handle: 111 Address: C0:07:E8:2C:B6:EE (OUI C0-07-E8)
        Count: 1
zephyr.exe[1938982]: < ACL Data TX: Handle 111 [1/3] flags 0x00 dlen 18                                            #201 12.817342
      LE L2CAP: LE Connection Response (0x15) ident 1 len 10
        Destination CID: 64
        MTU: 255
        MPS: 251
        Credits: 1
        Result: Connection successful (0x0000)
> HCI Event: Number of Completed Packets (0x13) plen 5                                                             #202 12.937434
        Num handles: 1
        Handle: 111 Address: C0:07:E8:2C:B6:EE (OUI C0-07-E8)
        Count: 1
        Buffers: 0/3
        #201: len 18 (1 Kb/s)
        Latency: 120 msec (8-185 msec ~121 msec)
> ACL Data RX: Handle 111 flags 0x02 dlen 8                                                                        #203 12.937654
      ATT: Write Request (0x12) len 3
        Handle: 0x0032
          Data[1]: 01
zephyr.exe[1938982]: < HCI Command: Host Number of Completed Packets (0x03|0x0035) plen 5                          #204 12.957015
        Num handles: 1
        Handle: 111 Address: C0:07:E8:2C:B6:EE (OUI C0-07-E8)
        Count: 1
zephyr.exe[1938982]: < ACL Data TX: Handle 111 [1/3] flags 0x00 dlen 5                                             #205 12.957158
      ATT: Write Response (0x13) len 0
zephyr.exe[1938982]: < ACL Data TX: Handle 111 [2/3] flags 0x00 dlen 10                                            #206 12.957182
      ATT: Handle Value Indication (0x1d) len 5
        Handle: 0x0032
          Data[3]: 700101
> HCI Event: Number of Completed Packets (0x13) plen 5                                                             #207 13.000264
        Num handles: 1
        Handle: 111 Address: C0:07:E8:2C:B6:EE (OUI C0-07-E8)
        Count: 1
        Buffers: 1/3
        #205: len 5 (0 Kb/s)
        Latency: 43 msec (8-185 msec ~82 msec)
> HCI Event: Number of Completed Packets (0x13) plen 5                                                             #208 13.062507
        Num handles: 1
        Handle: 111 Address: C0:07:E8:2C:B6:EE (OUI C0-07-E8)
        Count: 1
        Buffers: 0/3
        #206: len 10 (0 Kb/s)
        Latency: 105 msec (8-185 msec ~93 msec)
> ACL Data RX: Handle 111 flags 0x02 dlen 5                                                                        #209 13.062509
      ATT: Handle Value Confirmation (0x1e) len 0
> ACL Data RX: Handle 111 flags 0x02 dlen 7                                                                        #210 13.062875
      ATT: Read Request (0x0a) len 2
        Handle: 0x0025
zephyr.exe[1938982]: < HCI Command: Host Number of Completed Packets (0x03|0x0035) plen 5                          #211 13.077178
        Num handles: 1
        Handle: 111 Address: C0:07:E8:2C:B6:EE (OUI C0-07-E8)
        Count: 1
zephyr.exe[1938982]: < HCI Command: Host Number of Completed Packets (0x03|0x0035) plen 5                          #212 13.077289
        Num handles: 1
        Handle: 111 Address: C0:07:E8:2C:B6:EE (OUI C0-07-E8)
        Count: 1
zephyr.exe[1938982]: < ACL Data TX: Handle 111 [1/3] flags 0x00 dlen 14                                            #213 13.077314
      ATT: Read Response (0x0b) len 9
        Value[9]: 4469726563746f7279
> HCI Event: Number of Completed Packets (0x13) plen 5                                                             #214 13.187514
        Num handles: 1
        Handle: 111 Address: C0:07:E8:2C:B6:EE (OUI C0-07-E8)
        Count: 1
        Buffers: 0/3
        #213: len 14 (1 Kb/s)
        Latency: 110 msec (8-185 msec ~101 msec)
> ACL Data RX: Handle 111 flags 0x02 dlen 7                                                                        #215 13.187622
      ATT: Read Request (0x0a) len 2
        Handle: 0x0027
zephyr.exe[1938982]: < HCI Command: Host Number of Completed Packets (0x03|0x0035) plen 5                          #216 13.197037
        Num handles: 1
        Handle: 111 Address: C0:07:E8:2C:B6:EE (OUI C0-07-E8)
        Count: 1
zephyr.exe[1938982]: < ACL Data TX: Handle 111 [1/3] flags 0x00 dlen 7                                             #217 13.197391
      ATT: Read Response (0x0b) len 2
        Value[2]: cb2a
> HCI Event: Number of Completed Packets (0x13) plen 5                                                             #218 13.312450
        Num handles: 1
        Handle: 111 Address: C0:07:E8:2C:B6:EE (OUI C0-07-E8)
        Count: 1
        Buffers: 0/3
        #217: len 7 (0 Kb/s)
        Latency: 115 msec (8-185 msec ~108 msec)
> ACL Data RX: Handle 111 flags 0x02 dlen 7                                                                        #219 13.312655
      ATT: Read Request (0x0a) len 2
        Handle: 0x0029
zephyr.exe[1938982]: < HCI Command: Host Number of Completed Packets (0x03|0x0035) plen 5                          #220 13.317052
        Num handles: 1
        Handle: 111 Address: C0:07:E8:2C:B6:EE (OUI C0-07-E8)
        Count: 1
zephyr.exe[1938982]: < ACL Data TX: Handle 111 [1/3] flags 0x00 dlen 13                                            #221 13.317201
      ATT: Read Response (0x0b) len 8
        Value[8]: 4d0000005c030000
> HCI Event: Number of Completed Packets (0x13) plen 5                                                             #222 13.437497
        Num handles: 1
        Handle: 111 Address: C0:07:E8:2C:B6:EE (OUI C0-07-E8)
        Count: 1
        Buffers: 0/3
        #221: len 13 (0 Kb/s)
        Latency: 120 msec (8-185 msec ~114 msec)
> ACL Data RX: Handle 111 flags 0x02 dlen 7                                                                        #223 13.437611
      ATT: Read Request (0x0a) len 2
        Handle: 0x002d
zephyr.exe[1938982]: < HCI Command: Host Number of Completed Packets (0x03|0x0035) plen 5                          #224 13.457043
        Num handles: 1
        Handle: 111 Address: C0:07:E8:2C:B6:EE (OUI C0-07-E8)
        Count: 1
zephyr.exe[1938982]: < ACL Data TX: Handle 111 [1/3] flags 0x00 dlen 9                                             #225 13.457199
      ATT: Read Response (0x0b) len 4
        Value[4]: 04000000
> HCI Event: Number of Completed Packets (0x13) plen 5                                                             #226 13.562480
        Num handles: 1
        Handle: 111 Address: C0:07:E8:2C:B6:EE (OUI C0-07-E8)
        Count: 1
        Buffers: 0/3
        #225: len 9 (0 Kb/s)
        Latency: 105 msec (8-185 msec ~109 msec)
> ACL Data RX: Handle 111 flags 0x02 dlen 7                                                                        #227 13.562652
      ATT: Read Request (0x0a) len 2
        Handle: 0x002b
zephyr.exe[1938982]: < HCI Command: Host Number of Completed Packets (0x03|0x0035) plen 5                          #228 13.577039
        Num handles: 1
        Handle: 111 Address: C0:07:E8:2C:B6:EE (OUI C0-07-E8)
        Count: 1
zephyr.exe[1938982]: < ACL Data TX: Handle 111 [1/3] flags 0x00 dlen 11                                            #229 13.577178
      ATT: Read Response (0x0b) len 6
        Value[6]: 000000000000
> HCI Event: Number of Completed Packets (0x13) plen 5                                                             #230 13.687495
        Num handles: 1
        Handle: 111 Address: C0:07:E8:2C:B6:EE (OUI C0-07-E8)
        Count: 1
        Buffers: 0/3
        #229: len 11 (0 Kb/s)
        Latency: 110 msec (8-185 msec ~110 msec)
> ACL Data RX: Handle 111 flags 0x02 dlen 8                                                                        #231 13.687636
      ATT: Write Request (0x12) len 3
        Handle: 0x0032
          Data[1]: 04
zephyr.exe[1938982]: < HCI Command: Host Number of Completed Packets (0x03|0x0035) plen 5                          #232 13.697079
        Num handles: 1
        Handle: 111 Address: C0:07:E8:2C:B6:EE (OUI C0-07-E8)
        Count: 1
zephyr.exe[1938982]: < ACL Data TX: Handle 111 [1/3] flags 0x00 dlen 5                                             #233 13.697207
      ATT: Write Response (0x13) len 0
zephyr.exe[1938982]: < ACL Data TX: Handle 111 [2/3] flags 0x00 dlen 10                                            #234 13.697236
      ATT: Handle Value Indication (0x1d) len 5
        Handle: 0x0032
          Data[3]: 700401
> HCI Event: Number of Completed Packets (0x13) plen 5                                                             #235 13.750288
        Num handles: 1
        Handle: 111 Address: C0:07:E8:2C:B6:EE (OUI C0-07-E8)
        Count: 1
        Buffers: 1/3
        #233: len 5 (0 Kb/s)
        Latency: 53 msec (8-185 msec ~81 msec)
> HCI Event: Number of Completed Packets (0x13) plen 5                                                             #236 13.812513
        Num handles: 1
        Handle: 111 Address: C0:07:E8:2C:B6:EE (OUI C0-07-E8)
        Count: 1
        Buffers: 0/3
        #234: len 10 (0 Kb/s)
        Latency: 115 msec (8-185 msec ~98 msec)
> ACL Data RX: Handle 111 flags 0x02 dlen 5                                                                        #237 13.812515
      ATT: Handle Value Confirmation (0x1e) len 0
> ACL Data RX: Handle 111 flags 0x02 dlen 7                                                                        #238 13.812881
      ATT: Read Request (0x0a) len 2
        Handle: 0x0025
zephyr.exe[1938982]: < HCI Command: Host Number of Completed Packets (0x03|0x0035) plen 5                          #239 13.817184
        Num handles: 1
        Handle: 111 Address: C0:07:E8:2C:B6:EE (OUI C0-07-E8)
        Count: 1
zephyr.exe[1938982]: < HCI Command: Host Number of Completed Packets (0x03|0x0035) plen 5                          #240 13.817430
        Num handles: 1
        Handle: 111 Address: C0:07:E8:2C:B6:EE (OUI C0-07-E8)
        Count: 1
zephyr.exe[1938982]: < ACL Data TX: Handle 111 [1/3] flags 0x00 dlen 27                                            #241 13.817483
      ATT: Read Response (0x0b) len 22
        Value[22]: 4f626a656374203120776974682076657279206c6f6e
> HCI Event: Number of Completed Packets (0x13) plen 5                                                             #242 13.937541
        Num handles: 1
        Handle: 111 Address: C0:07:E8:2C:B6:EE (OUI C0-07-E8)
        Count: 1
        Buffers: 0/3
        #241: len 27 (1 Kb/s)
        Latency: 120 msec (8-185 msec ~109 msec)
> ACL Data RX: Handle 111 flags 0x02 dlen 9                                                                        #243 13.937651
      ATT: Read Blob Request (0x0c) len 4
        Handle: 0x0025
        Offset: 0x0016
zephyr.exe[1938982]: < HCI Command: Host Number of Completed Packets (0x03|0x0035) plen 5                          #244 13.957099
        Num handles: 1
        Handle: 111 Address: C0:07:E8:2C:B6:EE (OUI C0-07-E8)
        Count: 1
zephyr.exe[1938982]: < ACL Data TX: Handle 111 [1/3] flags 0x00 dlen 11                                            #245 13.957271
      ATT: Read Blob Response (0x0d) len 6
        Value[6]: 67206e616d65
> HCI Event: Number of Completed Packets (0x13) plen 5                                                             #246 14.062558
        Num handles: 1
        Handle: 111 Address: C0:07:E8:2C:B6:EE (OUI C0-07-E8)
        Count: 1
        Buffers: 0/3
        #245: len 11 (0 Kb/s)
        Latency: 105 msec (8-185 msec ~107 msec)
> ACL Data RX: Handle 111 flags 0x02 dlen 7                                                                        #247 14.062708
      ATT: Read Request (0x0a) len 2
        Handle: 0x0027
zephyr.exe[1938982]: < HCI Command: Host Number of Completed Packets (0x03|0x0035) plen 5                          #248 14.077102
        Num handles: 1
        Handle: 111 Address: C0:07:E8:2C:B6:EE (OUI C0-07-E8)
        Count: 1
zephyr.exe[1938982]: < ACL Data TX: Handle 111 [1/3] flags 0x00 dlen 7                                             #249 14.077247
      ATT: Read Response (0x0b) len 2
        Value[2]: ca2a
> HCI Event: Number of Completed Packets (0x13) plen 5                                                             #250 14.187530
        Num handles: 1
        Handle: 111 Address: C0:07:E8:2C:B6:EE (OUI C0-07-E8)
        Count: 1
        Buffers: 0/3
        #249: len 7 (0 Kb/s)
        Latency: 110 msec (8-185 msec ~108 msec)
> ACL Data RX: Handle 111 flags 0x02 dlen 7                                                                        #251 14.187672
      ATT: Read Request (0x0a) len 2
        Handle: 0x0029
zephyr.exe[1938982]: < HCI Command: Host Number of Completed Packets (0x03|0x0035) plen 5                          #252 14.197117
        Num handles: 1
        Handle: 111 Address: C0:07:E8:2C:B6:EE (OUI C0-07-E8)
        Count: 1
zephyr.exe[1938982]: < ACL Data TX: Handle 111 [1/3] flags 0x00 dlen 13                                            #253 14.197520
      ATT: Read Response (0x0b) len 8
        Value[8]: 3200000064000000
> HCI Event: Number of Completed Packets (0x13) plen 5                                                             #254 14.312510
        Num handles: 1
        Handle: 111 Address: C0:07:E8:2C:B6:EE (OUI C0-07-E8)
        Count: 1
        Buffers: 0/3
        #253: len 13 (0 Kb/s)
        Latency: 114 msec (8-185 msec ~111 msec)
> ACL Data RX: Handle 111 flags 0x02 dlen 7                                                                        #255 14.312845
      ATT: Read Request (0x0a) len 2
        Handle: 0x002d
zephyr.exe[1938982]: < HCI Command: Host Number of Completed Packets (0x03|0x0035) plen 5                          #256 14.317195
        Num handles: 1
        Handle: 111 Address: C0:07:E8:2C:B6:EE (OUI C0-07-E8)
        Count: 1
zephyr.exe[1938982]: < ACL Data TX: Handle 111 [1/3] flags 0x00 dlen 9                                             #257 14.317329
      ATT: Read Response (0x0b) len 4
        Value[4]: 4d000000
> HCI Event: Number of Completed Packets (0x13) plen 5                                                             #258 14.437456
        Num handles: 1
        Handle: 111 Address: C0:07:E8:2C:B6:EE (OUI C0-07-E8)
        Count: 1
        Buffers: 0/3
        #257: len 9 (0 Kb/s)
        Latency: 120 msec (8-185 msec ~116 msec)
> ACL Data RX: Handle 111 flags 0x02 dlen 7                                                                        #259 14.437626
      ATT: Read Request (0x0a) len 2
        Handle: 0x002b
zephyr.exe[1938982]: < HCI Command: Host Number of Completed Packets (0x03|0x0035) plen 5                          #260 14.457217
        Num handles: 1
        Handle: 111 Address: C0:07:E8:2C:B6:EE (OUI C0-07-E8)
        Count: 1
zephyr.exe[1938982]: < ACL Data TX: Handle 111 [1/3] flags 0x00 dlen 11                                            #261 14.457567
      ATT: Read Response (0x0b) len 6
        Value[6]: 000100000000
> HCI Event: Number of Completed Packets (0x13) plen 5                                                             #262 14.562568
        Num handles: 1
        Handle: 111 Address: C0:07:E8:2C:B6:EE (OUI C0-07-E8)
        Count: 1
        Buffers: 0/3
        #261: len 11 (0 Kb/s)
        Latency: 105 msec (8-185 msec ~110 msec)
> ACL Data RX: Handle 111 flags 0x02 dlen 17                                                                       #263 14.562874
      ATT: Write Request (0x12) len 12
        Handle: 0x002f
          Data[10]: 06200000002000000000
zephyr.exe[1938982]: < HCI Command: Host Number of Completed Packets (0x03|0x0035) plen 5                          #264 14.577061
        Num handles: 1
        Handle: 111 Address: C0:07:E8:2C:B6:EE (OUI C0-07-E8)
        Count: 1
zephyr.exe[1938982]: < ACL Data TX: Handle 111 [1/3] flags 0x00 dlen 5                                             #265 14.577196
      ATT: Write Response (0x13) len 0
zephyr.exe[1938982]: < ACL Data TX: Handle 111 [2/3] flags 0x00 dlen 10                                            #266 14.577384
      ATT: Handle Value Indication (0x1d) len 5
        Handle: 0x002f
          Data[3]: 600601
> HCI Event: Number of Completed Packets (0x13) plen 5                                                             #267 14.625332
        Num handles: 1
        Handle: 111 Address: C0:07:E8:2C:B6:EE (OUI C0-07-E8)
        Count: 1
        Buffers: 1/3
        #265: len 5 (0 Kb/s)
        Latency: 48 msec (8-185 msec ~79 msec)
> HCI Event: Number of Completed Packets (0x13) plen 5                                                             #268 14.687512
        Num handles: 1
        Handle: 111 Address: C0:07:E8:2C:B6:EE (OUI C0-07-E8)
        Count: 1
        Buffers: 0/3
        #266: len 10 (0 Kb/s)
        Latency: 110 msec (8-185 msec ~94 msec)
> ACL Data RX: Handle 111 flags 0x02 dlen 5                                                                        #269 14.687655
      ATT: Handle Value Confirmation (0x1e) len 0
> ACL Data RX: Handle 111 flags 0x02 dlen 27                                                                       #270 14.688196
> ACL Data RX: Handle 111 flags 0x01 dlen 11                                                                       #271 14.688432
      Channel: 64 len 34 sdu 32 [PSM 37 mode LE Flow Control (0x80)] {chan 0}
        20 00 20 1f 1e 1d 1c 1b 1a 19 18 17 16 15 14 13   . .............
        12 11 10 0f 0e 0d 0c 0b 0a 09 08 07 06 05 04 03  ................
        02 01                                            ..              
zephyr.exe[1938982]: < HCI Command: Host Number of Completed Packets (0x03|0x0035) plen 5                          #272 14.697093
        Num handles: 1
        Handle: 111 Address: C0:07:E8:2C:B6:EE (OUI C0-07-E8)
        Count: 1
zephyr.exe[1938982]: < HCI Command: Host Number of Completed Packets (0x03|0x0035) plen 5                          #273 14.697251
        Num handles: 1
        Handle: 111 Address: C0:07:E8:2C:B6:EE (OUI C0-07-E8)
        Count: 1
zephyr.exe[1938982]: < HCI Command: Host Number of Completed Packets (0x03|0x0035) plen 5                          #274 14.697278
        Num handles: 1
        Handle: 111 Address: C0:07:E8:2C:B6:EE (OUI C0-07-E8)
        Count: 1
zephyr.exe[1938982]: < ACL Data TX: Handle 111 [1/3] flags 0x00 dlen 12                                            #275 14.697293
      LE L2CAP: LE Flow Control Credit (0x16) ident 2 len 4
        Source CID: 64
        Credits: 1
> HCI Event: Number of Completed Packets (0x13) plen 5                                                             #276 14.812408
        Num handles: 1
        Handle: 111 Address: C0:07:E8:2C:B6:EE (OUI C0-07-E8)
        Count: 1
        Buffers: 0/3
        #275: len 12 (0 Kb/s)
        Latency: 115 msec (8-185 msec ~104 msec)
> ACL Data RX: Handle 111 flags 0x02 dlen 16                                                                       #277 20.500141
      ATT: Write Request (0x12) len 11
        Handle: 0x002f
          Data[9]: 050000000040000000
zephyr.exe[1938982]: < HCI Command: Host Number of Completed Packets (0x03|0x0035) plen 5                          #278 20.517155
        Num handles: 1
        Handle: 111 Address: C0:07:E8:2C:B6:EE (OUI C0-07-E8)
        Count: 1
zephyr.exe[1938982]: < ACL Data TX: Handle 111 [1/3] flags 0x00 dlen 5                                             #279 20.517276
      ATT: Write Response (0x13) len 0
zephyr.exe[1938982]: < ACL Data TX: Handle 111 [2/3] flags 0x00 dlen 10                                            #280 20.517296
      ATT: Handle Value Indication (0x1d) len 5
        Handle: 0x002f
          Data[3]: 600501
> HCI Event: Number of Completed Packets (0x13) plen 5                                                             #281 20.562853
        Num handles: 1
        Handle: 111 Address: C0:07:E8:2C:B6:EE (OUI C0-07-E8)
        Count: 1
        Buffers: 1/3
        #279: len 5 (0 Kb/s)
        Latency: 45 msec (8-185 msec ~75 msec)
> HCI Event: Number of Completed Packets (0x13) plen 5                                                             #282 20.625155
        Num handles: 1
        Handle: 111 Address: C0:07:E8:2C:B6:EE (OUI C0-07-E8)
        Count: 1
        Buffers: 0/3
        #280: len 10 (0 Kb/s)
        Latency: 107 msec (8-185 msec ~91 msec)
> ACL Data RX: Handle 111 flags 0x02 dlen 5                                                                        #283 20.625158
      ATT: Handle Value Confirmation (0x1e) len 0
zephyr.exe[1938982]: < HCI Command: Host Number of Completed Packets (0x03|0x0035) plen 5                          #284 20.637263
        Num handles: 1
        Handle: 111 Address: C0:07:E8:2C:B6:EE (OUI C0-07-E8)
        Count: 1
zephyr.exe[1938982]: < ACL Data TX: Handle 111 [1/3] flags 0x00 dlen 27                                            #285 20.637410
zephyr.exe[1938982]: < ACL Data TX: Handle 111 flags 0x01 dlen 9                                                   #286 20.637434
      Channel: 84 len 32 sdu 64 [PSM 37 mode LE Flow Control (0x80)] {chan 0}
        40 00 00 00 00 00 00 00 00 00 00 00 00 00 00 00  @...............
        00 00 00 00 00 00 00 00 00 00 00 00 00 00 00 00  ................
zephyr.exe[1938982]: < ACL Data TX: Handle 111 [2/3] flags 0x00 dlen 27                                            #287 20.637448
> HCI Event: Number of Completed Packets (0x13) plen 5                                                             #288 20.687944
        Num handles: 1
        Handle: 111 Address: C0:07:E8:2C:B6:EE (OUI C0-07-E8)
        Count: 1
        Buffers: 1/3
        #285: len 27 (4 Kb/s)
        Latency: 50 msec (8-185 msec ~71 msec)
        Channel: 84 [PSM 37 mode LE Flow Control (0x80)] {chan 0}
        Channel Latency: 50 msec (50-50 msec ~50 msec)
> HCI Event: Number of Completed Packets (0x13) plen 5                                                             #289 20.688415
        Num handles: 1
        Handle: 111 Address: C0:07:E8:2C:B6:EE (OUI C0-07-E8)
        Count: 1
        Buffers: 0/3
        #286: len 9 (1 Kb/s)
        Latency: 50 msec (8-185 msec ~61 msec)
zephyr.exe[1938982]: < ACL Data TX: Handle 111 flags 0x01 dlen 9                                                   #290 20.697237
      Channel: 84 len 32 sdu 34 [PSM 37 mode LE Flow Control (0x80)] {chan 0}
        00 00 20 1f 1e 1d 1c 1b 1a 19 18 17 16 15 14 13  .. .............
        12 11 10 0f 0e 0d 0c 0b 0a 09 08 07 06 05 04 03  ......