Bluetooth monitor ver 5.72
btmon[1444653]: = Note: Linux version 6.14.0-36-generic (x86_64)                                                         0.511964
btmon[1444653]: = Note: Bluetooth subsystem version 2.22                                                                 0.511970
= New Index: 00:00:00:00:00:00 (Primary,UART,hci1)                                                                       0.511973
= New Index: 48:5F:99:8E:E0:64 (Primary,USB,hci0)                                                                        0.511974
= Open Index: 00:00:00:00:00:00                                                                                          1.032095
= Index Info: 00:00:00:00:00:00 (Nordic Semiconductor ASA)                                                               1.032115
zephyr.exe[1444655]: @ USER Open: main (privileged) version 2.22                                                {0x0001} 1.032125
zephyr.exe[1444655]: < HCI Command: Reset (0x03|0x0003) plen 0                                                        #1 1.033292
> HCI Event: Command Complete (0x0e) plen 4                                                                           #2 1.033840
      Reset (0x03|0x0003) ncmd 1
        Status: Success (0x00)
zephyr.exe[1444655]: < HCI Command: Read Local Supported Features (0x04|0x0003) plen 0                                #3 1.052001
> HCI Event: Command Complete (0x0e) plen 12                                                                          #4 1.052689
      Read Local Supported Features (0x04|0x0003) ncmd 1
        Status: Success (0x00)
        Features: 0x00 0x00 0x00 0x00 0x60 0x00 0x00 0x00
          BR/EDR Not Supported
          LE Supported (Controller)
zephyr.exe[1444655]: < HCI Command: Read Local Version Information (0x04|0x0001) plen 0                               #5 1.071699
> HCI Event: Command Complete (0x0e) plen 12                                                                          #6 1.072180
      Read Local Version Information (0x04|0x0001) ncmd 1
        Status: Success (0x00)
        HCI version: Reserved (0x0f) - Revision 12393 (0x3069)
        LMP version: Reserved (0x0f) - Subversion 12393 (0x3069)
        Manufacturer: Nordic Semiconductor ASA (89)
zephyr.exe[1444655]: < HCI Command: Read Local Supported Commands (0x04|0x0002) plen 0                                #7 1.091649
> HCI Event: Command Complete (0x0e) plen 68                                                                          #8 1.092702
      Read Local Supported Commands (0x04|0x0002) ncmd 1
        Status: Success (0x00)
        Commands: 119 entries
          Disconnect (Octet 0 - Bit 5)
          Read Remote Version Information (Octet 2 - Bit 7)
          Set Event Mask (Octet 5 - Bit 6)
          Reset (Octet 5 - Bit 7)
          Read Connection Accept Timeout (Octet 7 - Bit 2)
          Write Connection Accept Timeout (Octet 7 - Bit 3)
          Read Transmit Power Level (Octet 10 - Bit 2)
          Set Controller To Host Flow Control (Octet 10 - Bit 5)
          Host Buffer Size (Octet 10 - Bit 6)
          Host Number of Completed Packets (Octet 10 - Bit 7)
          Read Local Version Information (Octet 14 - Bit 3)
          Read Local Supported Features (Octet 14 - Bit 5)
          Read BD ADDR (Octet 15 - Bit 1)
          Read RSSI (Octet 15 - Bit 5)
          Set Event Mask Page 2 (Octet 22 - Bit 2)
          LE Set Event Mask (Octet 25 - Bit 0)
          LE Read Buffer Size (Octet 25 - Bit 1)
          LE Read Local Supported Features (Octet 25 - Bit 2)
          LE Set Random Address (Octet 25 - Bit 4)
          LE Set Advertising Parameters (Octet 25 - Bit 5)
          LE Read Advertising Channel TX Power (Octet 25 - Bit 6)
          LE Set Advertising Data (Octet 25 - Bit 7)
          LE Set Scan Response Data (Octet 26 - Bit 0)
          LE Set Advertise Enable (Octet 26 - Bit 1)
          LE Set Scan Parameters (Octet 26 - Bit 2)
          LE Set Scan Enable (Octet 26 - Bit 3)
          LE Create Connection (Octet 26 - Bit 4)
          LE Create Connection Cancel (Octet 26 - Bit 5)
          LE Read Accept List Size (Octet 26 - Bit 6)
          LE Clear Accept List (Octet 26 - Bit 7)
          LE Add Device To Accept List (Octet 27 - Bit 0)
          LE Remove Device From Accept List (Octet 27 - Bit 1)
          LE Connection Update (Octet 27 - Bit 2)
          LE Set Host Channel Classification (Octet 27 - Bit 3)
          LE Read Channel Map (Octet 27 - Bit 4)
          LE Read Remote Used Features (Octet 27 - Bit 5)
          LE Encrypt (Octet 27 - Bit 6)
          LE Rand (Octet 27 - Bit 7)
          LE Start Encryption (Octet 28 - Bit 0)
          LE Long Term Key Request Reply (Octet 28 - Bit 1)
          LE Long Term Key Request Neg Reply (Octet 28 - Bit 2)
          LE Read Supported States (Octet 28 - Bit 3)
          LE Receiver Test (Octet 28 - Bit 4)
          LE Transmitter Test (Octet 28 - Bit 5)
          LE Test End (Octet 28 - Bit 6)
          Read Authenticated Payload Timeout (Octet 32 - Bit 4)
          Write Authenticated Payload Timeout (Octet 32 - Bit 5)
          LE Set Data Length (Octet 33 - Bit 6)
          LE Read Suggested Default Data Length (Octet 33 - Bit 7)
          LE Write Suggested Default Data Length (Octet 34 - Bit 0)
          LE Add Device To Resolving List (Octet 34 - Bit 3)
          LE Remove Device From Resolving List (Octet 34 - Bit 4)
          LE Clear Resolving List (Octet 34 - Bit 5)
          LE Read Resolving List Size (Octet 34 - Bit 6)
          LE Set Address Resolution Enable (Octet 35 - Bit 1)
          LE Set Resolvable Private Address Timeout (Octet 35 - Bit 2)
          LE Read Maximum Data Length (Octet 35 - Bit 3)
          LE Read PHY (Octet 35 - Bit 4)
          LE Set Default PHY (Octet 35 - Bit 5)
          LE Set PHY (Octet 35 - Bit 6)
          LE Enhanced Receiver Test (Octet 35 - Bit 7)
          LE Enhanced Transmitter Test (Octet 36 - Bit 0)
          LE Set Advertising Set Random Address (Octet 36 - Bit 1)
          LE Set Extended Advertising Parameters (Octet 36 - Bit 2)
          LE Set Extended Advertising Data (Octet 36 - Bit 3)
          LE Set Extended Scan Response Data (Octet 36 - Bit 4)
          LE Set Extended Advertising Enable (Octet 36 - Bit 5)
          LE Read Maximum Advertising Data Length (Octet 36 - Bit 6)
          LE Read Number of Supported Advertising Sets (Octet 36 - Bit 7)
          LE Remove Advertising Set (Octet 37 - Bit 0)
          LE Clear Advertising Sets (Octet 37 - Bit 1)
          LE Set Periodic Advertising Parameters (Octet 37 - Bit 2)
          LE Set Periodic Advertising Data (Octet 37 - Bit 3)
          LE Set Periodic Advertising Enable (Octet 37 - Bit 4)
          LE Set Extended Scan Parameters (Octet 37 - Bit 5)
          LE Set Extended Scan Enable (Octet 37 - Bit 6)
          LE Extended Create Connection (Octet 37 - Bit 7)
          LE Periodic Advertising Create Sync (Octet 38 - Bit 0)
          LE Periodic Advertising Create Sync Cancel (Octet 38 - Bit 1)
          LE Periodic Advertising Terminate Sync (Octet 38 - Bit 2)
          LE Add Device To Periodic Advertiser List (Octet 38 - Bit 3)
          LE Remove Device From Periodic Advertiser List (Octet 38 - Bit 4)
          LE Clear Periodic Advertiser List (Octet 38 - Bit 5)
          LE Read Periodic Advertiser List Size (Octet 38 - Bit 6)
          LE Read Transmit Power (Octet 38 - Bit 7)
          LE Read RF Path Compensation (Octet 39 - Bit 0)
          LE Write RF Path Compensation (Octet 39 - Bit 1)
          LE Set Privacy Mode (Octet 39 - Bit 2)
          LE Periodic Advertising Receive Enable (Octet 40 - Bit 5)
          LE Periodic Advertising Sync Transfer (Octet 40 - Bit 6)
          LE Periodic Advertising Set Info Transfer (Octet 40 - Bit 7)
          LE Periodic Advertising Sync Transfer Parameters (Octet 41 - Bit 0)
          LE Set Default Periodic Advertisng Sync Transfer Parameters (Octet 41 - Bit 1)
          LE Read Buffer v2 (Octet 41 - Bit 5)
          LE Read ISO TX Sync (Octet 41 - Bit 6)
          LE Set Connected Isochronous Group Parameters (Octet 41 - Bit 7)
          LE Set Connected Isochronous Group Parameters Test (Octet 42 - Bit 0)
          LE Create Connected Isochronous Stream (Octet 42 - Bit 1)
          LE Remove Connected Isochronous Group (Octet 42 - Bit 2)
          LE Accept Connected Isochronous Stream Request (Octet 42 - Bit 3)
          LE Reject Connected Isochronous Stream Request (Octet 42 - Bit 4)
          LE Create Broadcast Isochronous Group (Octet 42 - Bit 5)
          LE Create Broadcast Isochronous Group Test (Octet 42 - Bit 6)
          LE Terminate Broadcast Isochronous Group (Octet 42 - Bit 7)
          LE Broadcast Isochronous Group Create Sync (Octet 43 - Bit 0)
          LE Broadcast Isochronous Group Terminate Sync (Octet 43 - Bit 1)
          LE Request Peer SCA (Octet 43 - Bit 2)
          LE Setup Isochronous Data Path (Octet 43 - Bit 3)
          LE Remove Isochronous Data Path (Octet 43 - Bit 4)
          LE Isochronous Transmit Test (Octet 43 - Bit 5)
          LE Isochronous Receive Test (Octet 43 - Bit 6)
          LE Isochronous Read Test Counters (Octet 43 - Bit 7)
          LE Isochronous Read Test Counters (Octet 44 - Bit 0)
          LE Set Host Feature (Octet 44 - Bit 1)
          Octet 44 - Bit 2 
          Octet 45 - Bit 6 
          Octet 46 - Bit 0 
          Octet 46 - Bit 1 
          Octet 46 - Bit 2 
zephyr.exe[1444655]: < HCI Command: Host Buffer Size (0x03|0x0033) plen 7                                             #9 1.111621
        ACL MTU: 255  ACL max packet: 16
        SCO MTU: 0    SCO max packet: 0
> HCI Event: Command Complete (0x0e) plen 4                                                                          #10 1.112140
      Host Buffer Size (0x03|0x0033) ncmd 1
        Status: Success (0x00)
zephyr.exe[1444655]: < HCI Command: Set Controller To Host Flow Control (0x03|0x0031) plen 1                         #11 1.131640
        Flow control: ACL Data Packets (0x01)
> HCI Event: Command Complete (0x0e) plen 4                                                                          #12 1.132067
      Set Controller To Host Flow Control (0x03|0x0031) ncmd 1
        Status: Success (0x00)
zephyr.exe[1444655]: < HCI Command: LE Read Local Supported Features (0x08|0x0003) plen 0                            #13 1.151608
> HCI Event: Command Complete (0x0e) plen 12                                                                         #14 1.152063
      LE Read Local Supported Features (0x08|0x0003) ncmd 1
        Status: Success (0x00)
        Features: 0xfd 0x79 0x00 0xf7 0x30 0x01 0x00 0x00
          LE Encryption
          Extended Reject Indication
          Peripheral-initiated Features Exchange
          LE Ping
          LE Data Packet Length Extension
          LL Privacy
          Extended Scanner Filter Policies
          LE 2M PHY
          LE Coded PHY
          LE Extended Advertising
          LE Periodic Advertising
          Channel Selection Algorithm #2
          Periodic Advertising Sync Transfer - Sender
          Periodic Advertising Sync Transfer - Recipient
          Sleep Clock Accuracy Updates
          Connected Isochronous Stream - Central
          Connected Isochronous Stream - Peripheral
          Isochronous Broadcaster
          Synchronized Receiver
          Periodic Advertising ADI support
          Connection Subrating
          Unknown features (0x0000010000000000)
zephyr.exe[1444655]: < HCI Command: LE Set Host Feature (0x08|0x0074) plen 2                                         #15 1.171656
        Bit Number: 32
          Connected Isochronous Stream (Host Support)
        Bit Value: 1
> HCI Event: Command Complete (0x0e) plen 4                                                                          #16 1.172059
      LE Set Host Feature (0x08|0x0074) ncmd 1
        Status: Success (0x00)
zephyr.exe[1444655]: < HCI Command: LE Read Buffer v2 (0x08|0x0060) plen 0                                           #17 1.191646
> HCI Event: Command Complete (0x0e) plen 10                                                                         #18 1.192061
      LE Read Buffer v2 (0x08|0x0060) ncmd 1
        Status: Success (0x00)
        ACL MTU: 27
        ACL max packet: 3
        ISO MTU: 318
        ISO max packet: 3
zephyr.exe[1444655]: < HCI Command: LE Read Maximum Advertising Data Length (0x08|0x003a) plen 0                     #19 1.211674
> HCI Event: Command Complete (0x0e) plen 6                                                                          #20 1.212145
      LE Read Maximum Advertising Data Length (0x08|0x003a) ncmd 1
        Status: Success (0x00)
        Max length: 1650
zephyr.exe[1444655]: < HCI Command: LE Read Supported States (0x08|0x001c) plen 0                                    #21 1.231649
> HCI Event: Command Complete (0x0e) plen 12                                                                         #22 1.232101
      LE Read Supported States (0x08|0x001c) ncmd 1
        Status: Success (0x00)
        States: 0x000003ff3e0306ff
          Non-connectable Advertising State
          Scannable Advertising State
          Connectable Advertising State
          High Duty Cycle Directed Advertising State
          Passive Scanning State
          Active Scanning State
          Initiating State
            and Connection State (Central Role)
          Connection State (Peripheral Role)
          Scannable Advertising State
            and Passive Scanning State
          Connectable Advertising State
            and Passive Scanning State
          Non-connectable Advertising State
            and Initiating State
          Scannable Advertising State
            and Initiating State
          Active Scanning State
            and Connection State (Central Role)
          Passive Scanning State
            and Connection State (Peripheral Role)
          Active Scanning State
            and Connection State (Peripheral Role)
          Initiating State
            and Connection State (Central Role)
            and Central Role & Central Role
          Low Duty Cycle Directed Advertising State
          Connectable Advertising State
            and Initiating State
            and Central Role & Peripheral Role
          High Duty Cycle Directed Advertising State
            and Initiating State
            and Central Role & Peripheral Role
          Low Duty Cycle Directed Advertising State
            and Initiating State
            and Central Role & Peripheral Role
          Connectable Advertising State
            and Connection State (Central Role)
            and Central Role & Peripheral Role
          High Duty Cycle Directed Advertising State
            and Connection State (Central Role)
            and Central Role & Peripheral Role
          Low Duty Cycle Directed Advertising State
            and Connection State (Central Role)
            and Central Role & Peripheral Role
          Connectable Advertising State
            and Connection State (Peripheral Role)
            and Central Role & Peripheral Role
          High Duty Cycle Directed Advertising State
            and Connection State (Peripheral Role)
            and Peripheral Role & Peripheral Role
          Low Duty Cycle Directed Advertising State
            and Connection State (Peripheral Role)
            and Peripheral Role & Peripheral Role
          Initiating State
            and Connection State (Peripheral Role)
            and Central Role & Peripheral Role
zephyr.exe[1444655]: < HCI Command: LE Read Maximum Data Length (0x08|0x002f) plen 0                                 #23 1.251641
> HCI Event: Command Complete (0x0e) plen 12                                                                         #24 1.252167
      LE Read Maximum Data Length (0x08|0x002f) ncmd 1
        Status: Success (0x00)
        Max TX octets: 251
        Max TX time: 2704
        Max RX octets: 251
        Max RX time: 2704
zephyr.exe[1444655]: < HCI Command: LE Write Suggested Default Data Length (0x08|0x0024) plen 4                      #25 1.271642
        TX octets: 251
        TX time: 2704
> HCI Event: Command Complete (0x0e) plen 4                                                                          #26 1.272118
      LE Write Suggested Default Data Length (0x08|0x0024) ncmd 1
        Status: Success (0x00)
zephyr.exe[1444655]: < HCI Command: LE Read Resolving List Size (0x08|0x002a) plen 0                                 #27 1.291622
> HCI Event: Command Complete (0x0e) plen 5                                                                          #28 1.292040
      LE Read Resolving List Size (0x08|0x002a) ncmd 1
        Status: Success (0x00)
        Size: 8
zephyr.exe[1444655]: < HCI Command: LE Set Event Mask (0x08|0x0001) plen 8                                           #29 1.311608
        Mask: 0x000002023f87fa5e
          LE Advertising Report
          LE Connection Update Complete
          LE Read Remote Used Features Complete
          LE Long Term Key Request
          LE Data Length Change
          LE Enhanced Connection Complete
          LE PHY Update Complete
          LE Extended Advertising Report
          LE Periodic Advertising Sync Established
          LE Periodic Advertising Report
          LE Periodic Advertising Sync Lost
          LE Extended Scan Timeout
          LE Extended Advertising Set Terminated
          LE Scan Request Received
          LE Periodic Advertising Sync Transfer Rvc
          LE CIS Established
          LE CIS Request
          LE Create BIG Complete
          LE Terminate BIG Complete
          LE BIG Sync Estabilished Complete
          LE BIG Sync Lost
          LE BIG Info Advertising Report
          Unknown mask (0x0000020000000000)
> HCI Event: Command Complete (0x0e) plen 4                                                                          #30 1.312074
      LE Set Event Mask (0x08|0x0001) ncmd 1
        Status: Success (0x00)
zephyr.exe[1444655]: < HCI Command: Set Event Mask (0x03|0x0001) plen 8                                              #31 1.331620
        Mask: 0x2000800002008890
          Disconnection Complete
          Encryption Change
          Read Remote Version Information Complete
          Hardware Error
          Data Buffer Overflow
          Encryption Key Refresh Complete
          LE Meta
> HCI Event: Command Complete (0x0e) plen 4                                                                          #32 1.332171
      Set Event Mask (0x03|0x0001) ncmd 1
        Status: Success (0x00)
zephyr.exe[1444655]: < HCI Command: Read BD ADDR (0x04|0x0009) plen 0                                                #33 1.351641
> HCI Event: Command Complete (0x0e) plen 10                                                                         #34 1.352109
      Read BD ADDR (0x04|0x0009) ncmd 1
        Status: Success (0x00)
        Address: 00:00:00:00:00:00 (OUI 00-00-00)
zephyr.exe[1444655]: < HCI Command: LE Set Random Address (0x08|0x0005) plen 6                                       #35 1.371652
        Address: D5:B6:CC:31:DB:3B (Static)
> HCI Event: Command Complete (0x0e) plen 4                                                                          #36 1.372150
      LE Set Random Address (0x08|0x0005) ncmd 1
        Status: Success (0x00)
zephyr.exe[1444655]: < HCI Command: LE Set Extended Advertising Parameters (0x08|0x0036) plen 25                     #37 3.591741
        Handle: 0x00
        Properties: 0x0013
          Connectable
          Scannable
          Use legacy advertising PDUs: ADV_IND
        Min advertising interval: 100.000 msec (0x00a0)
        Max advertising interval: 150.000 msec (0x00f0)
        Channel map: 37, 38, 39 (0x07)
        Own address type: Random (0x01)
        Peer address type: Public (0x00)
        Peer address: 00:00:00:00:00:00 (OUI 00-00-00)
        Filter policy: Allow Scan Request from Any, Allow Connect Request from Any (0x00)
        TX power: Host has no preference (0x7f)
        Primary PHY: LE 1M (0x01)
        Secondary max skip: 0x00
        Secondary PHY: LE 1M (0x01)
        SID: 0x00
        Scan request notifications: Disabled (0x00)
> HCI Event: Command Complete (0x0e) plen 5                                                                          #38 3.592612
      LE Set Extended Advertising Parameters (0x08|0x0036) ncmd 1
        Status: Success (0x00)
        TX power (selected): 0 dbm (0x00)
zephyr.exe[1444655]: < HCI Command: LE Set Advertising Set Random Address (0x08|0x0035) plen 7                       #39 3.611680
        Advertising handle: 0x00
        Advertising random address: D5:B6:CC:31:DB:3B (Static)
> HCI Event: Command Complete (0x0e) plen 4                                                                          #40 3.612154
      LE Set Advertising Set Random Address (0x08|0x0035) ncmd 1
        Status: Success (0x00)
zephyr.exe[1444655]: < HCI Command: LE Set Extended Advertising Data (0x08|0x0037) plen 22                           #41 3.631672
        Handle: 0x00
        Operation: Complete extended advertising data (0x03)
        Fragment preference: Minimize fragmentation (0x01)
        Data length: 0x12
        Flags: 0x06
          LE General Discoverable Mode
          BR/EDR Not Supported
        Name (complete): Tester_F6B11A
> HCI Event: Command Complete (0x0e) plen 4                                                                          #42 3.632558
      LE Set Extended Advertising Data (0x08|0x0037) ncmd 1
        Status: Success (0x00)
zephyr.exe[1444655]: < HCI Command: LE Set Extended Scan Response Data (0x08|0x0038) plen 4                          #43 3.651691
        Handle: 0x00
        Operation: Complete scan response data (0x03)
        Fragment preference: Minimize fragmentation (0x01)
        Data length: 0x00
> HCI Event: Command Complete (0x0e) plen 4                                                                          #44 3.652128
      LE Set Extended Scan Response Data (0x08|0x0038) ncmd 1
        Status: Success (0x00)
zephyr.exe[1444655]: < HCI Command: LE Set Extended Advertising Enable (0x08|0x0039) plen 6                          #45 3.671676
        Extended advertising: Enabled (0x01)
        Number of sets: 1 (0x01)
        Entry 0
          Handle: 0x00
          Duration: 0 ms (0x00)
          Max ext adv events: 0
> HCI Event: Command Complete (0x0e) plen 4                                                                          #46 3.672321
      LE Set Extended Advertising Enable (0x08|0x0039) ncmd 1
        Status: Success (0x00)
> HCI Event: LE Meta Event (0x3e) plen 31                                                                            #47 3.788385
      LE Enhanced Connection Complete (0x0a)
        Status: Success (0x00)
        Handle: 471
        Role: Peripheral (0x01)
        Peer address type: Public (0x00)
        Peer address: DF:A9:FF:F6:B1:1A (OUI DF-A9-FF)
        Local resolvable private address: 00:00:00:00:00:00 (Non-Resolvable)
        Peer resolvable private address: 00:00:00:00:00:00 (Non-Resolvable)
        Connection interval: 87.50 msec (0x0046)
        Connection latency: 0 (0x0000)
        Supervision timeout: 20000 msec (0x07d0)
        Central clock accuracy: 0x01
> HCI Event: LE Meta Event (0x3e) plen 6                                                                             #48 3.788467
      LE Advertising Set Terminated (0x12)
        Status: Success (0x00)
        Handle: 0
        Connection handle: 471
        Number of completed extended advertising events: 0
zephyr.exe[1444655]: < HCI Command: LE Read Remote Used Features (0x08|0x0016) plen 2                                #49 3.791919
        Handle: 471 Address: DF:A9:FF:F6:B1:1A (OUI DF-A9-FF)
> HCI Event: Command Status (0x0f) plen 4                                                                            #50 3.792415
      LE Read Remote Used Features (0x08|0x0016) ncmd 1
        Status: Success (0x00)
> HCI Event: LE Meta Event (0x3e) plen 12                                                                            #51 4.052297
      LE Read Remote Used Features (0x04)
        Status: Success (0x00)
        Handle: 471 Address: DF:A9:FF:F6:B1:1A (OUI DF-A9-FF)
        Features: 0x2d 0x49 0x00 0xf7 0x67 0xd8 0x00 0x00
          LE Encryption
          Extended Reject Indication
          Peripheral-initiated Features Exchange
          LE Data Packet Length Extension
          LE 2M PHY
          LE Coded PHY
          Channel Selection Algorithm #2
          Periodic Advertising Sync Transfer - Sender
          Periodic Advertising Sync Transfer - Recipient
          Sleep Clock Accuracy Updates
          Connected Isochronous Stream - Central
          Connected Isochronous Stream - Peripheral
          Isochronous Broadcaster
          Synchronized Receiver
          Connected Isochronous Stream (Host Support)
          LE Power Control Request
          LE Power Control Request
          Connection Subrating
          Connection Subrating (Host Support)
          Unknown features (0x0000d80000000000)
> ACL Data RX: Handle 471 flags 0x02 dlen 11                                                                         #52 4.489479
      SMP: Pairing Request (0x01) len 6
        IO capability: KeyboardOnly (0x02)
        OOB data: Authentication data not present (0x00)
        Authentication requirement: No bonding, MITM, SC, No Keypresses (0xcc)
        Max encryption key size: 16
        Initiator key distribution: <none> (0x00)
        Responder key distribution: <none> (0x00)
zephyr.exe[1444655]: < HCI Command: Host Number of Completed Packets (0x03|0x0035) plen 5                            #53 4.492123
        Num handles: 1
        Handle: 471 Address: DF:A9:FF:F6:B1:1A (OUI DF-A9-FF)
        Count: 1
zephyr.exe[1444655]: < ACL Data TX: Handle 471 flags 0x00 dlen 11                                                    #54 4.492301
      SMP: Pairing Response (0x02) len 6
        IO capability: DisplayOnly (0x00)
        OOB data: Authentication data not present (0x00)
        Authentication requirement: Bonding, No MITM, SC, No Keypresses (0x09)
        Max encryption key size: 16
        Initiator key distribution: <none> (0x00)
        Responder key distribution: <none> (0x00)
> HCI Event: Number of Completed Packets (0x13) plen 5                                                               #55 4.664577
        Num handles: 1
        Handle: 471 Address: DF:A9:FF:F6:B1:1A (OUI DF-A9-FF)
        Count: 1
        #54: len 11 (0 Kb/s)
        Latency: 172 msec (172-172 msec ~172 msec)
> ACL Data RX: Handle 471 flags 0x02 dlen 27                                                                         #56 4.665293
> ACL Data RX: Handle 471 flags 0x01 dlen 27                                                                         #57 4.665402
> ACL Data RX: Handle 471 flags 0x01 dlen 15                                                                         #58 4.665961
      SMP: Pairing Public Key (0x0c) len 64
        X: 9e440f5b97bf45379c04174656fc9aa54fe0012aef7dccc8a917a4392610f62d
        Y: 04d009786fdbfb3400e1d0c309846873292815677b174f76b9184f58755c344b
zephyr.exe[1444655]: < HCI Command: Host Number of Completed Packets (0x03|0x0035) plen 5                            #59 4.672481
        Num handles: 1
        Handle: 471 Address: DF:A9:FF:F6:B1:1A (OUI DF-A9-FF)
        Count: 1
zephyr.exe[1444655]: < HCI Command: Host Number of Completed Packets (0x03|0x0035) plen 5                            #60 4.672756
        Num handles: 1
        Handle: 471 Address: DF:A9:FF:F6:B1:1A (OUI DF-A9-FF)
        Count: 1
zephyr.exe[1444655]: < HCI Command: Host Number of Completed Packets (0x03|0x0035) plen 5                            #61 4.673091
        Num handles: 1
        Handle: 471 Address: DF:A9:FF:F6:B1:1A (OUI DF-A9-FF)
        Count: 1
zephyr.exe[1444655]: < ACL Data TX: Handle 471 flags 0x00 dlen 27                                                    #62 4.673246
zephyr.exe[1444655]: < ACL Data TX: Handle 471 flags 0x01 dlen 27                                                    #63 4.673284
zephyr.exe[1444655]: < ACL Data TX: Handle 471 flags 0x01 dlen 15                                                    #64 4.673288
      SMP: Pairing Public Key (0x0c) len 64
        X: 98308440221e2d910f0e54b71e7ec652857aa9b5a0dc65028824cc19db1226e9
        Y: 67a4816bcb62efb21701e31fdb27561a6217575fb007a8bbdabe7e28b6f68482
> HCI Event: Number of Completed Packets (0x13) plen 5                                                               #65 4.752479
        Num handles: 1
        Handle: 471 Address: DF:A9:FF:F6:B1:1A (OUI DF-A9-FF)
        Count: 1
        #62: len 27 (2 Kb/s)
        Latency: 79 msec (79-172 msec ~125 msec)
> HCI Event: Number of Completed Packets (0x13) plen 5                                                               #66 4.753069
        Num handles: 1
        Handle: 471 Address: DF:A9:FF:F6:B1:1A (OUI DF-A9-FF)
        Count: 1
        #63: len 27 (2 Kb/s)
        Latency: 79 msec (79-172 msec ~102 msec)
> HCI Event: Number of Completed Packets (0x13) plen 5                                                               #67 4.839282
        Num handles: 1
        Handle: 471 Address: DF:A9:FF:F6:B1:1A (OUI DF-A9-FF)
        Count: 1
        #64: len 15 (0 Kb/s)
        Latency: 165 msec (79-172 msec ~134 msec)
> ACL Data RX: Handle 471 flags 0x02 dlen 21                                                                         #68 5.802128
      SMP: Pairing Confirm (0x03) len 16
        Confim value: dd96b8d7eead552cef52f9de39802f2d
zephyr.exe[1444655]: < HCI Command: Host Number of Completed Packets (0x03|0x0035) plen 5                            #69 5.811868
        Num handles: 1
        Handle: 471 Address: DF:A9:FF:F6:B1:1A (OUI DF-A9-FF)
        Count: 1
zephyr.exe[1444655]: < ACL Data TX: Handle 471 flags 0x00 dlen 21                                                    #70 5.811957
      SMP: Pairing Confirm (0x03) len 16
        Confim value: c22571009760c34a78881dc575f88d57
> HCI Event: Number of Completed Packets (0x13) plen 5                                                               #71 5.976972
        Num handles: 1
        Handle: 471 Address: DF:A9:FF:F6:B1:1A (OUI DF-A9-FF)
        Count: 1
        #70: len 21 (1 Kb/s)
        Latency: 165 msec (79-172 msec ~149 msec)
> ACL Data RX: Handle 471 flags 0x02 dlen 21                                                                         #72 5.977258
      SMP: Pairing Random (0x04) len 16
        Random value: 27da796f6d4622eb72d980ce1fd4a278
zephyr.exe[1444655]: < HCI Command: Host Number of Completed Packets (0x03|0x0035) plen 5                            #73 5.994342
        Num handles: 1
        Handle: 471 Address: DF:A9:FF:F6:B1:1A (OUI DF-A9-FF)
        Count: 1
zephyr.exe[1444655]: < ACL Data TX: Handle 471 flags 0x00 dlen 21                                                    #74 5.994357
      SMP: Pairing Random (0x04) len 16
        Random value: 8e6108f966a694cbe26df70bb96773e6
> HCI Event: Number of Completed Packets (0x13) plen 5                                                               #75 6.152045
        Num handles: 1
        Handle: 471 Address: DF:A9:FF:F6:B1:1A (OUI DF-A9-FF)
        Count: 1
        #74: len 21 (1 Kb/s)
        Latency: 157 msec (79-172 msec ~153 msec)
> ACL Data RX: Handle 471 flags 0x02 dlen 21                                                                         #76 6.152305
      SMP: Pairing Confirm (0x03) len 16
        Confim value: 4e332e1212cafb116ea4dbe939471e87
zephyr.exe[1444655]: < HCI Command: Host Number of Completed Packets (0x03|0x0035) plen 5                            #77 6.171907
        Num handles: 1
        Handle: 471 Address: DF:A9:FF:F6:B1:1A (OUI DF-A9-FF)
        Count: 1
zephyr.exe[1444655]: < ACL Data TX: Handle 471 flags 0x00 dlen 21                                                    #78 6.171930
      SMP: Pairing Confirm (0x03) len 16
        Confim value: 6dae8337994280df9ff13697f581417f
> HCI Event: Number of Completed Packets (0x13) plen 5                                                               #79 6.327057
        Num handles: 1
        Handle: 471 Address: DF:A9:FF:F6:B1:1A (OUI DF-A9-FF)
        Count: 1
        #78: len 21 (1 Kb/s)
        Latency: 155 msec (79-172 msec ~154 msec)
> ACL Data RX: Handle 471 flags 0x02 dlen 21                                                                         #80 6.327312
      SMP: Pairing Random (0x04) len 16
        Random value: ccf88c5fae8eebb365aff3867bbbfe21
zephyr.exe[1444655]: < HCI Command: Host Number of Completed Packets (0x03|0x0035) plen 5                            #81 6.331835
        Num handles: 1
        Handle: 471 Address: DF:A9:FF:F6:B1:1A (OUI DF-A9-FF)
        Count: 1
zephyr.exe[1444655]: < ACL Data TX: Handle 471 flags 0x00 dlen 21                                                    #82 6.331903
      SMP: Pairing Random (0x04) len 16
        Random value: 4d02679f89a05211af56d8b3da64d21e
> HCI Event: Number of Completed Packets (0x13) plen 5                                                               #83 6.501964
        Num handles: 1
        Handle: 471 Address: DF:A9:FF:F6:B1:1A (OUI DF-A9-FF)
        Count: 1
        #82: len 21 (0 Kb/s)
        Latency: 170 msec (79-172 msec ~162 msec)
> ACL Data RX: Handle 471 flags 0x02 dlen 21                                                                         #84 6.502305
      SMP: Pairing Confirm (0x03) len 16
        Confim value: 8e7e2a54845bfd4da2c452d0800d7eba
zephyr.exe[1444655]: < HCI Command: Host Number of Completed Packets (0x03|0x0035) plen 5                            #85 6.512385
        Num handles: 1
        Handle: 471 Address: DF:A9:FF:F6:B1:1A (OUI DF-A9-FF)
        Count: 1
zephyr.exe[1444655]: < ACL Data TX: Handle 471 flags 0x00 dlen 21                                                    #86 6.512515
      SMP: Pairing Confirm (0x03) len 16
        Confim value: 46daa8e5e9b0c5901962740d894d2848
> HCI Event: Number of Completed Packets (0x13) plen 5                                                               #87 6.676948
        Num handles: 1
        Handle: 471 Address: DF:A9:FF:F6:B1:1A (OUI DF-A9-FF)
        Count: 1
        #86: len 21 (1 Kb/s)
        Latency: 164 msec (79-172 msec ~163 msec)
> ACL Data RX: Handle 471 flags 0x02 dlen 21                                                                         #88 6.677237
      SMP: Pairing Random (0x04) len 16
        Random value: 3ed6245389fe17ded1b71a880443943c
zephyr.exe[1444655]: < HCI Command: Host Number of Completed Packets (0x03|0x0035) plen 5                            #89 6.692362
        Num handles: 1
        Handle: 471 Address: DF:A9:FF:F6:B1:1A (OUI DF-A9-FF)
        Count: 1
zephyr.exe[1444655]: < ACL Data TX: Handle 471 flags 0x00 dlen 21                                                    #90 6.692527
      SMP: Pairing Random (0x04) len 16
        Random value: 5e8286bc235a02440d0c3424a2acf8fd
> HCI Event: Number of Completed Packets (0x13) plen 5                                                               #91 6.851983
        Num handles: 1
        Handle: 471 Address: DF:A9:FF:F6:B1:1A (OUI DF-A9-FF)
        Count: 1
        #90: len 21 (1 Kb/s)
        Latency: 159 msec (79-172 msec ~161 msec)
> ACL Data RX: Handle 471 flags 0x02 dlen 21                                                                         #92 6.852311
      SMP: Pairing Confirm (0x03) len 16
        Confim value: d0c75d5daf49de7cc14db5c3194711b3
zephyr.exe[1444655]: < HCI Command: Host Number of Completed Packets (0x03|0x0035) plen 5                            #93 6.872434
        Num handles: 1
        Handle: 471 Address: DF:A9:FF:F6:B1:1A (OUI DF-A9-FF)
        Count: 1
zephyr.exe[1444655]: < ACL Data TX: Handle 471 flags 0x00 dlen 21                                                    #94 6.872523
      SMP: Pairing Confirm (0x03) len 16
        Confim value: 98a695f0c00292472a0a85f2dfb42b61
> HCI Event: Number of Completed Packets (0x13) plen 5                                                               #95 7.026948
        Num handles: 1
        Handle: 471 Address: DF:A9:FF:F6:B1:1A (OUI DF-A9-FF)
        Count: 1
        #94: len 21 (1 Kb/s)
        Latency: 154 msec (79-172 msec ~157 msec)
> ACL Data RX: Handle 471 flags 0x02 dlen 21                                                                         #96 7.027218
      SMP: Pairing Random (0x04) len 16
        Random value: 174252efc6526684af9f6757e20985be
zephyr.exe[1444655]: < HCI Command: Host Number of Completed Packets (0x03|0x0035) plen 5                            #97 7.032575
        Num handles: 1
        Handle: 471 Address: DF:A9:FF:F6:B1:1A (OUI DF-A9-FF)
        Count: 1
zephyr.exe[1444655]: < ACL Data TX: Handle 471 flags 0x00 dlen 21                                                    #98 7.032658
      SMP: Pairing Random (0x04) len 16
        Random value: 5c4a1bcadd27bd58e945097b00bad7ac
> HCI Event: Number of Completed Packets (0x13) plen 5                                                               #99 7.201865
        Num handles: 1
        Handle: 471 Address: DF:A9:FF:F6:B1:1A (OUI DF-A9-FF)
        Count: 1
        #98: len 21 (0 Kb/s)
        Latency: 169 msec (79-172 msec ~163 msec)
> ACL Data RX: Handle 471 flags 0x02 dlen 21                                                                        #100 7.202344
      SMP: Pairing Confirm (0x03) len 16
        Confim value: 1337fb21136451e62e1dd8f2ecf832bf
zephyr.exe[1444655]: < HCI Command: Host Number of Completed Packets (0x03|0x0035) plen 5                           #101 7.212407
        Num handles: 1
        Handle: 471 Address: DF:A9:FF:F6:B1:1A (OUI DF-A9-FF)
        Count: 1
zephyr.exe[1444655]: < ACL Data TX: Handle 471 flags 0x00 dlen 21                                                   #102 7.212522
      SMP: Pairing Confirm (0x03) len 16
        Confim value: 4646c07c39b27d1cd87cf744032c178a
> HCI Event: Number of Completed Packets (0x13) plen 5                                                              #103 7.376935
        Num handles: 1
        Handle: 471 Address: DF:A9:FF:F6:B1:1A (OUI DF-A9-FF)
        Count: 1
        #102: len 21 (1 Kb/s)
        Latency: 164 msec (79-172 msec ~163 msec)
> ACL Data RX: Handle 471 flags 0x02 dlen 21                                                                        #104 7.377332
      SMP: Pairing Random (0x04) len 16
        Random value: 2f4967196f87daf739538aba80ea33dc
zephyr.exe[1444655]: < HCI Command: Host Number of Completed Packets (0x03|0x0035) plen 5                           #105 7.391917
        Num handles: 1
        Handle: 471 Address: DF:A9:FF:F6:B1:1A (OUI DF-A9-FF)
        Count: 1
zephyr.exe[1444655]: < ACL Data TX: Handle 471 flags 0x00 dlen 21                                                   #106 7.391958
      SMP: Pairing Random (0x04) len 16
        Random value: 32527e6e64e79f33b2e374394db8ab2d
> HCI Event: Number of Completed Packets (0x13) plen 5                                                              #107 7.551892
        Num handles: 1
        Handle: 471 Address: DF:A9:FF:F6:B1:1A (OUI DF-A9-FF)
        Count: 1
        #106: len 21 (1 Kb/s)
        Latency: 159 msec (79-172 msec ~161 msec)
> ACL Data RX: Handle 471 flags 0x02 dlen 21                                                                        #108 7.552408
      SMP: Pairing Confirm (0x03) len 16
        Confim value: be8cf8ffd4b1b8dec84655e4179baa54
zephyr.exe[1444655]: < HCI Command: Host Number of Completed Packets (0x03|0x0035) plen 5                           #109 7.572472
        Num handles: 1
        Handle: 471 Address: DF:A9:FF:F6:B1:1A (OUI DF-A9-FF)
        Count: 1
zephyr.exe[1444655]: < ACL Data TX: Handle 471 flags 0x00 dlen 21                                                   #110 7.572583
      SMP: Pairing Confirm (0x03) len 16
        Confim value: bf8907e05701895f19e2dee56e92abb1
> HCI Event: Number of Completed Packets (0x13) plen 5                                                              #111 7.727007
        Num handles: 1
        Handle: 471 Address: DF:A9:FF:F6:B1:1A (OUI DF-A9-FF)
        Count: 1
        #110: len 21 (1 Kb/s)
        Latency: 154 msec (79-172 msec ~158 msec)
> ACL Data RX: Handle 471 flags 0x02 dlen 21                                                                        #112 7.727210
      SMP: Pairing Random (0x04) len 16
        Random value: a038f5f6ccdbb4cee70075b486033e0b
zephyr.exe[1444655]: < HCI Command: Host Number of Completed Packets (0x03|0x0035) plen 5                           #113 7.732323
        Num handles: 1
        Handle: 471 Address: DF:A9:FF:F6:B1:1A (OUI DF-A9-FF)
        Count: 1
zephyr.exe[1444655]: < ACL Data TX: Handle 471 flags 0x00 dlen 21                                                   #114 7.732416
      SMP: Pairing Random (0x04) len 16
        Random value: dddbdfe2838e9a8cc6964353c850fef7
> HCI Event: Number of Completed Packets (0x13) plen 5                                                              #115 7.901938
        Num handles: 1
        Handle: 471 Address: DF:A9:FF:F6:B1:1A (OUI DF-A9-FF)
        Count: 1
        #114: len 21 (0 Kb/s)
        Latency: 169 msec (79-172 msec ~163 msec)
> ACL Data RX: Handle 471 flags 0x02 dlen 21                                                                        #116 7.902371
      SMP: Pairing Confirm (0x03) len 16
        Confim value: c5006c07473e21f2f69b250c4e6df618
zephyr.exe[1444655]: < HCI Command: Host Number of Completed Packets (0x03|0x0035) plen 5                           #117 7.912490
        Num handles: 1
        Handle: 471 Address: DF:A9:FF:F6:B1:1A (OUI DF-A9-FF)
        Count: 1
zephyr.exe[1444655]: < ACL Data TX: Handle 471 flags 0x00 dlen 21                                                   #118 7.912612
      SMP: Pairing Confirm (0x03) len 16
        Confim value: d051cc0734cccb36ba767f8c669d0c8c
> HCI Event: Number of Completed Packets (0x13) plen 5                                                              #119 8.076972
        Num handles: 1
        Handle: 471 Address: DF:A9:FF:F6:B1:1A (OUI DF-A9-FF)
        Count: 1
        #118: len 21 (1 Kb/s)
        Latency: 164 msec (79-172 msec ~164 msec)
> ACL Data RX: Handle 471 flags 0x02 dlen 21                                                                        #120 8.077307
      SMP: Pairing Random (0x04) len 16
        Random value: c39bcbea67cb75de7214598cddb187ff
zephyr.exe[1444655]: < HCI Command: Host Number of Completed Packets (0x03|0x0035) plen 5                           #121 8.092398
        Num handles: 1
        Handle: 471 Address: DF:A9:FF:F6:B1:1A (OUI DF-A9-FF)
        Count: 1
zephyr.exe[1444655]: < ACL Data TX: Handle 471 flags 0x00 dlen 21                                                   #122 8.092506
      SMP: Pairing Random (0x04) len 16
        Random value: eb9f1915536596b6fc3db1c86b2b1970
> HCI Event: Number of Completed Packets (0x13) plen 5                                                              #123 8.251851
        Num handles: 1
        Handle: 471 Address: DF:A9:FF:F6:B1:1A (OUI DF-A9-FF)
        Count: 1
        #122: len 21 (1 Kb/s)
        Latency: 159 msec (79-172 msec ~161 msec)
> ACL Data RX: Handle 471 flags 0x02 dlen 21                                                                        #124 8.252218
      SMP: Pairing Confirm (0x03) len 16
        Confim value: 909e58e20222fbf83fad71c2edc9862c
zephyr.exe[1444655]: < HCI Command: Host Number of Completed Packets (0x03|0x0035) plen 5                           #125 8.272516
        Num handles: 1
        Handle: 471 Address: DF:A9:FF:F6:B1:1A (OUI DF-A9-FF)
        Count: 1
zephyr.exe[1444655]: < ACL Data TX: Handle 471 flags 0x00 dlen 21                                                   #126 8.272633
      SMP: Pairing Confirm (0x03) len 16
        Confim value: d18344ff2b4f5aed34eefe9b6e52dee5
> HCI Event: Number of Completed Packets (0x13) plen 5                                                              #127 8.426994
        Num handles: 1
        Handle: 471 Address: DF:A9:FF:F6:B1:1A (OUI DF-A9-FF)
        Count: 1
        #126: len 21 (1 Kb/s)
        Latency: 154 msec (79-172 msec ~158 msec)
> ACL Data RX: Handle 471 flags 0x02 dlen 21                                                                        #128 8.427277
      SMP: Pairing Random (0x04) len 16
        Random value: 3140fb9b0813de3bd33aa6c6ae9230af
zephyr.exe[1444655]: < HCI Command: Host Number of Completed Packets (0x03|0x0035) plen 5                           #129 8.432490
        Num handles: 1
        Handle: 471 Address: DF:A9:FF:F6:B1:1A (OUI DF-A9-FF)
        Count: 1
zephyr.exe[1444655]: < ACL Data TX: Handle 471 flags 0x00 dlen 21                                                   #130 8.432567
      SMP: Pairing Random (0x04) len 16
        Random value: 5c794dc9ad9f2c3f295ebd5ad5e1c3cf
> HCI Event: Number of Completed Packets (0x13) plen 5                                                              #131 8.601975
        Num handles: 1
        Handle: 471 Address: DF:A9:FF:F6:B1:1A (OUI DF-A9-FF)
        Count: 1
        #130: len 21 (0 Kb/s)
        Latency: 169 msec (79-172 msec ~163 msec)
> ACL Data RX: Handle 471 flags 0x02 dlen 21                                                                        #132 8.602278
      SMP: Pairing Confirm (0x03) len 16
        Confim value: 7f7a7a3b1825c07a37dc054740c8a89d
zephyr.exe[1444655]: < HCI Command: Host Number of Completed Packets (0x03|0x0035) plen 5                           #133 8.612456
        Num handles: 1
        Handle: 471 Address: DF:A9:FF:F6:B1:1A (OUI DF-A9-FF)
        Count: 1
zephyr.exe[1444655]: < ACL Data TX: Handle 471 flags 0x00 dlen 21                                                   #134 8.612613
      SMP: Pairing Confirm (0x03) len 16
        Confim value: e85101eaa17e177f1012a2896971f9bb
> HCI Event: Number of Completed Packets (0x13) plen 5                                                              #135 8.776866
        Num handles: 1
        Handle: 471 Address: DF:A9:FF:F6:B1:1A (OUI DF-A9-FF)
        Count: 1
        #134: len 21 (1 Kb/s)
        Latency: 164 msec (79-172 msec ~163 msec)
> ACL Data RX: Handle 471 flags 0x02 dlen 21                                                                        #136 8.777197
      SMP: Pairing Random (0x04) len 16
        Random value: c234d7eeb9b1ef3a43610e276181994e
zephyr.exe[1444655]: < HCI Command: Host Number of Completed Packets (0x03|0x0035) plen 5                           #137 8.792034
        Num handles: 1
        Handle: 471 Address: DF:A9:FF:F6:B1:1A (OUI DF-A9-FF)
        Count: 1
zephyr.exe[1444655]: < ACL Data TX: Handle 471 flags 0x00 dlen 21                                                   #138 8.792071
      SMP: Pairing Random (0x04) len 16
        Random value: 5c2fff312cdf99c9491988e877355a9a
zephyr.exe[1444655]: < ACL Data TX: Handle 471 flags 0x00 dlen 16                                                   #139 8.801755
      LE L2CAP: Connection Parameter Update Request (0x12) ident 1 len 8
        Min interval: 24
        Max interval: 40
        Peripheral latency: 0
        Timeout multiplier: 42
> HCI Event: Number of Completed Packets (0x13) plen 5                                                              #140 8.864933
        Num handles: 1
        Handle: 471 Address: DF:A9:FF:F6:B1:1A (OUI DF-A9-FF)
        Count: 1
        #138: len 21 (2 Kb/s)
        Latency: 72 msec (72-172 msec ~118 msec)
> HCI Event: Number of Completed Packets (0x13) plen 5                                                              #141 8.951982
        Num handles: 1
        Handle: 471 Address: DF:A9:FF:F6:B1:1A (OUI DF-A9-FF)
        Count: 1
        #139: len 16 (0 Kb/s)
        Latency: 150 msec (72-172 msec ~134 msec)
> ACL Data RX: Handle 471 flags 0x02 dlen 21                                                                        #142 8.952231
      SMP: Pairing Confirm (0x03) len 16
        Confim value: ed13d163f01d6560151affe947e965e3
zephyr.exe[1444655]: < HCI Command: Host Number of Completed Packets (0x03|0x0035) plen 5                           #143 8.972435
        Num handles: 1
        Handle: 471 Address: DF:A9:FF:F6:B1:1A (OUI DF-A9-FF)
        Count: 1
zephyr.exe[1444655]: < ACL Data TX: Handle 471 flags 0x00 dlen 21                                                   #144 8.972527
      SMP: Pairing Confirm (0x03) len 16
        Confim value: 51fed4ceba623bc256b95382482cf11d
> ACL Data RX: Handle 471 flags 0x02 dlen 10                                                                        #145 9.039409
      LE L2CAP: Connection Parameter Update Response (0x13) ident 1 len 2
        Result: Connection Parameters accepted (0x0000)
zephyr.exe[1444655]: < HCI Command: Host Number of Completed Packets (0x03|0x0035) plen 5                           #146 9.052128
        Num handles: 1
        Handle: 471 Address: DF:A9:FF:F6:B1:1A (OUI DF-A9-FF)
        Count: 1
> HCI Event: Number of Completed Packets (0x13) plen 5                                                              #147 9.126837
        Num handles: 1
        Handle: 471 Address: DF:A9:FF:F6:B1:1A (OUI DF-A9-FF)
        Count: 1
        #144: len 21 (1 Kb/s)
        Latency: 154 msec (72-172 msec ~144 msec)
> ACL Data RX: Handle 471 flags 0x02 dlen 21                                                                        #148 9.127145
      SMP: Pairing Random (0x04) len 16
        Random value: 90c4ee07c2e1eb713cb581b5a19c6353
zephyr.exe[1444655]: < HCI Command: Host Number of Completed Packets (0x03|0x0035) plen 5                           #149 9.132477
        Num handles: 1
        Handle: 471 Address: DF:A9:FF:F6:B1:1A (OUI DF-A9-FF)
        Count: 1
zephyr.exe[1444655]: < ACL Data TX: Handle 471 flags 0x00 dlen 21                                                   #150 9.132582
      SMP: Pairing Random (0x04) len 16
        Random value: c629a3a987d808e808655d558dfc1155
> HCI Event: Number of Completed Packets (0x13) plen 5                                                              #151 9.301803
        Num handles: 1
        Handle: 471 Address: DF:A9:FF:F6:B1:1A (OUI DF-A9-FF)
        Count: 1
        #150: len 21 (0 Kb/s)
        Latency: 169 msec (72-172 msec ~156 msec)
> ACL Data RX: Handle 471 flags 0x02 dlen 21                                                                        #152 9.302258
      SMP: Pairing Confirm (0x03) len 16
        Confim value: 2b075d5042271dfd327c3fcfe3393d98
zephyr.exe[1444655]: < HCI Command: Host Number of Completed Packets (0x03|0x0035) plen 5                           #153 9.312327
        Num handles: 1
        Handle: 471 Address: DF:A9:FF:F6:B1:1A (OUI DF-A9-FF)
        Count: 1
zephyr.exe[1444655]: < ACL Data TX: Handle 471 flags 0x00 dlen 21                                                   #154 9.312396
      SMP: Pairing Confirm (0x03) len 16
        Confim value: f01fb313bca4f1c7e46633246002a67c
> HCI Event: Number of Completed Packets (0x13) plen 5                                                              #155 9.476912
        Num handles: 1
        Handle: 471 Address: DF:A9:FF:F6:B1:1A (OUI DF-A9-FF)
        Count: 1
        #154: len 21 (1 Kb/s)
        Latency: 164 msec (72-172 msec ~160 msec)
> ACL Data RX: Handle 471 flags 0x02 dlen 21                                                                        #156 9.477168
      SMP: Pairing Random (0x04) len 16
        Random value: f47d134cac2051b475a431b356407071
zephyr.exe[1444655]: < HCI Command: Host Number of Completed Packets (0x03|0x0035) plen 5                           #157 9.492049
        Num handles: 1
        Handle: 471 Address: DF:A9:FF:F6:B1:1A (OUI DF-A9-FF)
        Count: 1
zephyr.exe[1444655]: < ACL Data TX: Handle 471 flags 0x00 dlen 21                                                   #158 9.492125
      SMP: Pairing Random (0x04) len 16
        Random value: 92f20f6ad8f13724432c7fd6001c45ff
> HCI Event: Number of Completed Packets (0x13) plen 5                                                              #159 9.651949
        Num handles: 1
        Handle: 471 Address: DF:A9:FF:F6:B1:1A (OUI DF-A9-FF)
        Count: 1
        #158: len 21 (1 Kb/s)
        Latency: 159 msec (72-172 msec ~160 msec)
> ACL Data RX: Handle 471 flags 0x02 dlen 21                                                                        #160 9.652225
      SMP: Pairing Confirm (0x03) len 16
        Confim value: 9ea87399d2db95aae253a6a468de5b03
zephyr.exe[1444655]: < HCI Command: Host Number of Completed Packets (0x03|0x0035) plen 5                           #161 9.672624
        Num handles: 1
        Handle: 471 Address: DF:A9:FF:F6:B1:1A (OUI DF-A9-FF)
        Count: 1
zephyr.exe[1444655]: < ACL Data TX: Handle 471 flags 0x00 dlen 21                                                   #162 9.672712
      SMP: Pairing Confirm (0x03) len 16
        Confim value: ab5a1b5aa87c7c964818f7c5a173d0b3
> HCI Event: Number of Completed Packets (0x13) plen 5                                                              #163 9.826883
        Num handles: 1
        Handle: 471 Address: DF:A9:FF:F6:B1:1A (OUI DF-A9-FF)
        Count: 1
        #162: len 21 (1 Kb/s)
        Latency: 154 msec (72-172 msec ~157 msec)
> ACL Data RX: Handle 471 flags 0x02 dlen 21                                                                        #164 9.827196
      SMP: Pairing Random (0x04) len 16
        Random value: 862b5561412ce318e9da8fa8a80ae09e
zephyr.exe[1444655]: < HCI Command: Host Number of Completed Packets (0x03|0x0035) plen 5                           #165 9.831897
        Num handles: 1
        Handle: 471 Address: DF:A9:FF:F6:B1:1A (OUI DF-A9-FF)
        Count: 1
zephyr.exe[1444655]: < ACL Data TX: Handle 471 flags 0x00 dlen 21                                                   #166 9.831922
      SMP: Pairing Random (0x04) len 16
        Random value: 23ac32ebbb5e14c8a6b9622f296d277f
> HCI Event: Number of Completed Packets (0x13) plen 5                                                             #167 10.001873
        Num handles: 1
        Handle: 471 Address: DF:A9:FF:F6:B1:1A (OUI DF-A9-FF)
        Count: 1
        #166: len 21 (0 Kb/s)
        Latency: 169 msec (72-172 msec ~163 msec)
> ACL Data RX: Handle 471 flags 0x02 dlen 21                                                                       #168 10.002152
      SMP: Pairing Confirm (0x03) len 16
        Confim value: 5aee2c9fc00eb8384ecb1167eb5a4783
zephyr.exe[1444655]: < HCI Command: Host Number of Completed Packets (0x03|0x0035) plen 5                          #169 10.012536
        Num handles: 1
        Handle: 471 Address: DF:A9:FF:F6:B1:1A (OUI DF-A9-FF)
        Count: 1
zephyr.exe[1444655]: < ACL Data TX: Handle 471 flags 0x00 dlen 21                                                  #170 10.012670
      SMP: Pairing Confirm (0x03) len 16
        Confim value: b9e0e871129b8ab0096dc9170b293156
> HCI Event: Number of Completed Packets (0x13) plen 5                                                             #171 10.176933
        Num handles: 1
        Handle: 471 Address: DF:A9:FF:F6:B1:1A (OUI DF-A9-FF)
        Count: 1
        #170: len 21 (1 Kb/s)
        Latency: 164 msec (72-172 msec ~163 msec)
> ACL Data RX: Handle 471 flags 0x02 dlen 21                                                                       #172 10.177312
      SMP: Pairing Random (0x04) len 16
        Random value: 21dc072d8902a2f3d0444b5702d8140f
zephyr.exe[1444655]: < HCI Command: Host Number of Completed Packets (0x03|0x0035) plen 5                          #173 10.192594
        Num handles: 1
        Handle: 471 Address: DF:A9:FF:F6:B1:1A (OUI DF-A9-FF)
        Count: 1
zephyr.exe[1444655]: < ACL Data TX: Handle 471 flags 0x00 dlen 21                                                  #174 10.192719
      SMP: Pairing Random (0x04) len 16
        Random value: 297efe85e67448a15f56bd27e3a3cf1d
> HCI Event: Number of Completed Packets (0x13) plen 5                                                             #175 10.351785
        Num handles: 1
        Handle: 471 Address: DF:A9:FF:F6:B1:1A (OUI DF-A9-FF)
        Count: 1
        #174: len 21 (1 Kb/s)
        Latency: 159 msec (72-172 msec ~161 msec)
> ACL Data RX: Handle 471 flags 0x02 dlen 21                                                                       #176 10.352121
      SMP: Pairing Confirm (0x03) len 16
        Confim value: 608204bd112e5d2a13cd59d0d9c5e633
zephyr.exe[1444655]: < HCI Command: Host Number of Completed Packets (0x03|0x0035) plen 5                          #177 10.372012
        Num handles: 1
        Handle: 471 Address: DF:A9:FF:F6:B1:1A (OUI DF-A9-FF)
        Count: 1
zephyr.exe[1444655]: < ACL Data TX: Handle 471 flags 0x00 dlen 21                                                  #178 10.372049
      SMP: Pairing Confirm (0x03) len 16
        Confim value: d3819e4c78786097e87f6d22af8d4597
> HCI Event: Number of Completed Packets (0x13) plen 5                                                             #179 10.526821
        Num handles: 1
        Handle: 471 Address: DF:A9:FF:F6:B1:1A (OUI DF-A9-FF)
        Count: 1
        #178: len 21 (1 Kb/s)
        Latency: 154 msec (72-172 msec ~158 msec)
> ACL Data RX: Handle 471 flags 0x02 dlen 21                                                                       #180 10.527128
      SMP: Pairing Random (0x04) len 16
        Random value: dbddb9d2cedecfd9a40f56c70bc5ae39
zephyr.exe[1444655]: < HCI Command: Host Number of Completed Packets (0x03|0x0035) plen 5                          #181 10.532428
        Num handles: 1
        Handle: 471 Address: DF:A9:FF:F6:B1:1A (OUI DF-A9-FF)
        Count: 1
zephyr.exe[1444655]: < ACL Data TX: Handle 471 flags 0x00 dlen 21                                                  #182 10.532504
      SMP: Pairing Random (0x04) len 16
        Random value: 25a9493fd3ce4faf02be7293595bb7c6
> HCI Event: Number of Completed Packets (0x13) plen 5                                                             #183 10.701852
        Num handles: 1
        Handle: 471 Address: DF:A9:FF:F6:B1:1A (OUI DF-A9-FF)
        Count: 1
        #182: len 21 (0 Kb/s)
        Latency: 169 msec (72-172 msec ~163 msec)
> ACL Data RX: Handle 471 flags 0x02 dlen 21                                                                       #184 10.702143
      SMP: Pairing Confirm (0x03) len 16
        Confim value: 79c4845f6cd0daeab20a4259d229bc8d
zephyr.exe[1444655]: < HCI Command: Host Number of Completed Packets (0x03|0x0035) plen 5                          #185 10.712041
        Num handles: 1
        Handle: 471 Address: DF:A9:FF:F6:B1:1A (OUI DF-A9-FF)
        Count: 1
zephyr.exe[1444655]: < ACL Data TX: Handle 471 flags 0x00 dlen 21                                                  #186 10.712130
      SMP: Pairing Confirm (0x03) len 16
        Confim value: 8b5e1b8b768acff6fe7ac517c77a828c
> HCI Event: Number of Completed Packets (0x13) plen 5                                                             #187 10.876891
        Num handles: 1
        Handle: 471 Address: DF:A9:FF:F6:B1:1A (OUI DF-A9-FF)
        Count: 1
        #186: len 21 (1 Kb/s)
        Latency: 164 msec (72-172 msec ~164 msec)
> ACL Data RX: Handle 471 flags 0x02 dlen 21                                                                       #188 10.877157
      SMP: Pairing Random (0x04) len 16
        Random value: 10ba3cb8983eeaa01ca9e33cae2f8ed0
zephyr.exe[1444655]: < HCI Command: Host Number of Completed Packets (0x03|0x0035) plen 5                          #189 10.892292
        Num handles: 1
        Handle: 471 Address: DF:A9:FF:F6:B1:1A (OUI DF-A9-FF)
        Count: 1
zephyr.exe[1444655]: < ACL Data TX: Handle 471 flags 0x00 dlen 21                                                  #190 10.892340
      SMP: Pairing Random (0x04) len 16
        Random value: 58f6b41f855a6f6c3560debd84e2affc
> HCI Event: Number of Completed Packets (0x13) plen 5                                                             #191 11.051883
        Num handles: 1
        Handle: 471 Address: DF:A9:FF:F6:B1:1A (OUI DF-A9-FF)
        Count: 1
        #190: len 21 (1 Kb/s)
        Latency: 159 msec (72-172 msec ~161 msec)
> ACL Data RX: Handle 471 flags 0x02 dlen 21                                                                       #192 11.052176
      SMP: Pairing Confirm (0x03) len 16
        Confim value: 113a60ecc273047531b1c46aad42d051
zephyr.exe[1444655]: < HCI Command: Host Number of Completed Packets (0x03|0x0035) plen 5                          #193 11.072414
        Num handles: 1
        Handle: 471 Address: DF:A9:FF:F6:B1:1A (OUI DF-A9-FF)
        Count: 1
zephyr.exe[1444655]: < ACL Data TX: Handle 471 flags 0x00 dlen 21                                                  #194 11.072569
      SMP: Pairing Confirm (0x03) len 16
        Confim value: a8e9b01158e64befb4cc564f35330b46
> HCI Event: Number of Completed Packets (0x13) plen 5                                                             #195 11.226886
        Num handles: 1
        Handle: 471 Address: DF:A9:FF:F6:B1:1A (OUI DF-A9-FF)
        Count: 1
        #194: len 21 (1 Kb/s)
        Latency: 154 msec (72-172 msec ~158 msec)
> ACL Data RX: Handle 471 flags 0x02 dlen 21                                                                       #196 11.227122
      SMP: Pairing Random (0x04) len 16
        Random value: 5742a182b1deb65c33bd603b12b4d5cb
zephyr.exe[1444655]: < HCI Command: Host Number of Completed Packets (0x03|0x0035) plen 5                          #197 11.232529
        Num handles: 1
        Handle: 471 Address: DF:A9:FF:F6:B1:1A (OUI DF-A9-FF)
        Count: 1
zephyr.exe[1444655]: < ACL Data TX: Handle 471 flags 0x00 dlen 21                                                  #198 11.232625
      SMP: Pairing Random (0x04) len 16
        Random value: b67e7216d5bf664139eda2b542549666
> HCI Event: Number of Completed Packets (0x13) plen 5                                                             #199 11.401856
        Num handles: 1
        Handle: 471 Address: DF:A9:FF:F6:B1:1A (OUI DF-A9-FF)
        Count: 1
        #198: len 21 (0 Kb/s)
        Latency: 169 msec (72-172 msec ~163 msec)
> ACL Data RX: Handle 471 flags 0x02 dlen 21                                                                       #200 11.402218
      SMP: Pairing Confirm (0x03) len 16
        Confim value: b85a516ac12cc026d2f09cf588e3c1e1
zephyr.exe[1444655]: < HCI Command: Host Number of Completed Packets (0x03|0x0035) plen 5                          #201 11.412389
        Num handles: 1
        Handle: 471 Address: DF:A9:FF:F6:B1:1A (OUI DF-A9-FF)
        Count: 1
zephyr.exe[1444655]: < ACL Data TX: Handle 471 flags 0x00 dlen 21                                                  #202 11.412482
      SMP: Pairing Confirm (0x03) len 16
        Confim value: bb44d3676de4c5c11011a4a91cc9424e
> HCI Event: Number of Completed Packets (0x13) plen 5                                                             #203 11.576895
        Num handles: 1
        Handle: 471 Address: DF:A9:FF:F6:B1:1A (OUI DF-A9-FF)
        Count: 1
        #202: len 21 (1 Kb/s)
        Latency: 164 msec (72-172 msec ~164 msec)
> ACL Data RX: Handle 471 flags 0x02 dlen 21                                                                       #204 11.577064
      SMP: Pairing Random (0x04) len 16
        Random value: 8a80391621bc3262213b818aa12fe55e
zephyr.exe[1444655]: < HCI Command: Host Number of Completed Packets (0x03|0x0035) plen 5                          #205 11.592470
        Num handles: 1
        Handle: 471 Address: DF:A9:FF:F6:B1:1A (OUI DF-A9-FF)
        Count: 1
zephyr.exe[1444655]: < ACL Data TX: Handle 471 flags 0x00 dlen 21                                                  #206 11.592596
      SMP: Pairing Random (0x04) len 16
        Random value: ed17f76500c95219dd01e09d1e63f87b
> HCI Event: Number of Completed Packets (0x13) plen 5                                                             #207 11.751891
        Num handles: 1
        Handle: 471 Address: DF:A9:FF:F6:B1:1A (OUI DF-A9-FF)
        Count: 1
        #206: len 21 (1 Kb/s)
        Latency: 159 msec (72-172 msec ~161 msec)
> ACL Data RX: Handle 471 flags 0x02 dlen 21                                                                       #208 11.752219
      SMP: Pairing Confirm (0x03) len 16
        Confim value: 08ecaa7f90fba0306329ba44a5104e5e
zephyr.exe[1444655]: < HCI Command: Host Number of Completed Packets (0x03|0x0035) plen 5                          #209 11.772329
        Num handles: 1
        Handle: 471 Address: DF:A9:FF:F6:B1:1A (OUI DF-A9-FF)
        Count: 1
zephyr.exe[1444655]: < ACL Data TX: Handle 471 flags 0x00 dlen 21                                                  #210 11.772440
      SMP: Pairing Confirm (0x03) len 16
        Confim value: d6063b3a38836dd31650f938f7f5159a
> HCI Event: Number of Completed Packets (0x13) plen 5                                                             #211 11.926891
        Num handles: 1
        Handle: 471 Address: DF:A9:FF:F6:B1:1A (OUI DF-A9-FF)
        Count: 1
        #210: len 21 (1 Kb/s)
        Latency: 154 msec (72-172 msec ~158 msec)
> ACL