Bluetooth monitor ver 5.72
= Note: Linux version 6.14.0-36-generic (x86_64)                       0.197356
= Note: Bluetooth subsystem version 2.22                               0.197357
= New Index: 00:00:00:00:00:00 (Primary,UART,hci1)              [hci1] 0.197359
= New Index: 48:5F:99:8E:E0:64 (Primary,USB,hci0)               [hci0] 0.197359
= Open Index: 00:00:00:00:00:00                                 [hci1] 0.311193
= Index Info: 00:00:00:00:00:00 (Nordic Semiconductor ASA)      [hci1] 0.311212
@ USER Open: main (privileged) version 2.22            {0x0001} [hci1] 0.311223
< HCI Command: Reset (0x03|0x0003) plen 0                    #1 [hci1] 0.312518
> HCI Event: Command Complete (0x0e) plen 4                  #2 [hci1] 0.313067
      Reset (0x03|0x0003) ncmd 1
        Status: Success (0x00)
< HCI Command: Read Local Supported... (0x04|0x0003) plen 0  #3 [hci1] 0.330596
> HCI Event: Command Complete (0x0e) plen 12                 #4 [hci1] 0.331123
      Read Local Supported Features (0x04|0x0003) ncmd 1
        Status: Success (0x00)
        Features: 0x00 0x00 0x00 0x00 0x60 0x00 0x00 0x00
          BR/EDR Not Supported
          LE Supported (Controller)
< HCI Command: Read Local Version In.. (0x04|0x0001) plen 0  #5 [hci1] 0.350604
> HCI Event: Command Complete (0x0e) plen 12                 #6 [hci1] 0.351127
      Read Local Version Information (0x04|0x0001) ncmd 1
        Status: Success (0x00)
        HCI version: Reserved (0x0f) - Revision 12393 (0x3069)
        LMP version: Reserved (0x0f) - Subversion 12393 (0x3069)
        Manufacturer: Nordic Semiconductor ASA (89)
< HCI Command: Read Local Supported... (0x04|0x0002) plen 0  #7 [hci1] 0.370586
> HCI Event: Command Complete (0x0e) plen 68                 #8 [hci1] 0.371652
      Read Local Supported Commands (0x04|0x0002) ncmd 1
        Status: Success (0x00)
        Commands: 119 entries
          Disconnect (Octet 0 - Bit 5)
          Read Remote Version Information (Octet 2 - Bit 7)
          Set Event Mask (Octet 5 - Bit 6)
          Reset (Octet 5 - Bit 7)
          Read Connection Accept Timeout (Octet 7 - Bit 2)
          Write Connection Accept Timeout (Octet 7 - Bit 3)
          Read Transmit Power Level (Octet 10 - Bit 2)
          Set Controller To Host Flow Control (Octet 10 - Bit 5)
          Host Buffer Size (Octet 10 - Bit 6)
          Host Number of Completed Packets (Octet 10 - Bit 7)
          Read Local Version Information (Octet 14 - Bit 3)
          Read Local Supported Features (Octet 14 - Bit 5)
          Read BD ADDR (Octet 15 - Bit 1)
          Read RSSI (Octet 15 - Bit 5)
          Set Event Mask Page 2 (Octet 22 - Bit 2)
          LE Set Event Mask (Octet 25 - Bit 0)
          LE Read Buffer Size (Octet 25 - Bit 1)
          LE Read Local Supported Features (Octet 25 - Bit 2)
          LE Set Random Address (Octet 25 - Bit 4)
          LE Set Advertising Parameters (Octet 25 - Bit 5)
          LE Read Advertising Channel TX Power (Octet 25 - Bit 6)
          LE Set Advertising Data (Octet 25 - Bit 7)
          LE Set Scan Response Data (Octet 26 - Bit 0)
          LE Set Advertise Enable (Octet 26 - Bit 1)
          LE Set Scan Parameters (Octet 26 - Bit 2)
          LE Set Scan Enable (Octet 26 - Bit 3)
          LE Create Connection (Octet 26 - Bit 4)
          LE Create Connection Cancel (Octet 26 - Bit 5)
          LE Read Accept List Size (Octet 26 - Bit 6)
          LE Clear Accept List (Octet 26 - Bit 7)
          LE Add Device To Accept List (Octet 27 - Bit 0)
          LE Remove Device From Accept List (Octet 27 - Bit 1)
          LE Connection Update (Octet 27 - Bit 2)
          LE Set Host Channel Classification (Octet 27 - Bit 3)
          LE Read Channel Map (Octet 27 - Bit 4)
          LE Read Remote Used Features (Octet 27 - Bit 5)
          LE Encrypt (Octet 27 - Bit 6)
          LE Rand (Octet 27 - Bit 7)
          LE Start Encryption (Octet 28 - Bit 0)
          LE Long Term Key Request Reply (Octet 28 - Bit 1)
          LE Long Term Key Request Neg Reply (Octet 28 - Bit 2)
          LE Read Supported States (Octet 28 - Bit 3)
          LE Receiver Test (Octet 28 - Bit 4)
          LE Transmitter Test (Octet 28 - Bit 5)
          LE Test End (Octet 28 - Bit 6)
          Read Authenticated Payload Timeout (Octet 32 - Bit 4)
          Write Authenticated Payload Timeout (Octet 32 - Bit 5)
          LE Set Data Length (Octet 33 - Bit 6)
          LE Read Suggested Default Data Length (Octet 33 - Bit 7)
          LE Write Suggested Default Data Length (Octet 34 - Bit 0)
          LE Add Device To Resolving List (Octet 34 - Bit 3)
          LE Remove Device From Resolving List (Octet 34 - Bit 4)
          LE Clear Resolving List (Octet 34 - Bit 5)
          LE Read Resolving List Size (Octet 34 - Bit 6)
          LE Set Address Resolution Enable (Octet 35 - Bit 1)
          LE Set Resolvable Private Address Timeout (Octet 35 - Bit 2)
          LE Read Maximum Data Length (Octet 35 - Bit 3)
          LE Read PHY (Octet 35 - Bit 4)
          LE Set Default PHY (Octet 35 - Bit 5)
          LE Set PHY (Octet 35 - Bit 6)
          LE Enhanced Receiver Test (Octet 35 - Bit 7)
          LE Enhanced Transmitter Test (Octet 36 - Bit 0)
          LE Set Advertising Set Random Address (Octet 36 - Bit 1)
          LE Set Extended Advertising Parameters (Octet 36 - Bit 2)
          LE Set Extended Advertising Data (Octet 36 - Bit 3)
          LE Set Extended Scan Response Data (Octet 36 - Bit 4)
          LE Set Extended Advertising Enable (Octet 36 - Bit 5)
          LE Read Maximum Advertising Data Length (Octet 36 - Bit 6)
          LE Read Number of Supported Advertising Sets (Octet 36 - Bit 7)
          LE Remove Advertising Set (Octet 37 - Bit 0)
          LE Clear Advertising Sets (Octet 37 - Bit 1)
          LE Set Periodic Advertising Parameters (Octet 37 - Bit 2)
          LE Set Periodic Advertising Data (Octet 37 - Bit 3)
          LE Set Periodic Advertising Enable (Octet 37 - Bit 4)
          LE Set Extended Scan Parameters (Octet 37 - Bit 5)
          LE Set Extended Scan Enable (Octet 37 - Bit 6)
          LE Extended Create Connection (Octet 37 - Bit 7)
          LE Periodic Advertising Create Sync (Octet 38 - Bit 0)
          LE Periodic Advertising Create Sync Cancel (Octet 38 - Bit 1)
          LE Periodic Advertising Terminate Sync (Octet 38 - Bit 2)
          LE Add Device To Periodic Advertiser List (Octet 38 - Bit 3)
          LE Remove Device From Periodic Advertiser List (Octet 38 - Bit 4)
          LE Clear Periodic Advertiser List (Octet 38 - Bit 5)
          LE Read Periodic Advertiser List Size (Octet 38 - Bit 6)
          LE Read Transmit Power (Octet 38 - Bit 7)
          LE Read RF Path Compensation (Octet 39 - Bit 0)
          LE Write RF Path Compensation (Octet 39 - Bit 1)
          LE Set Privacy Mode (Octet 39 - Bit 2)
          LE Periodic Advertising Receive Enable (Octet 40 - Bit 5)
          LE Periodic Advertising Sync Transfer (Octet 40 - Bit 6)
          LE Periodic Advertising Set Info Transfer (Octet 40 - Bit 7)
          LE Periodic Advertising Sync Transfer Parameters (Octet 41 - Bit 0)
          LE Set Default Periodic Advertisng Sync Transfer Parameters (Octet 41 - Bit 1)
          LE Read Buffer v2 (Octet 41 - Bit 5)
          LE Read ISO TX Sync (Octet 41 - Bit 6)
          LE Set Connected Isochronous Group Parameters (Octet 41 - Bit 7)
          LE Set Connected Isochronous Group Parameters Test (Octet 42 - Bit 0)
          LE Create Connected Isochronous Stream (Octet 42 - Bit 1)
          LE Remove Connected Isochronous Group (Octet 42 - Bit 2)
          LE Accept Connected Isochronous Stream Request (Octet 42 - Bit 3)
          LE Reject Connected Isochronous Stream Request (Octet 42 - Bit 4)
          LE Create Broadcast Isochronous Group (Octet 42 - Bit 5)
          LE Create Broadcast Isochronous Group Test (Octet 42 - Bit 6)
          LE Terminate Broadcast Isochronous Group (Octet 42 - Bit 7)
          LE Broadcast Isochronous Group Create Sync (Octet 43 - Bit 0)
          LE Broadcast Isochronous Group Terminate Sync (Octet 43 - Bit 1)
          LE Request Peer SCA (Octet 43 - Bit 2)
          LE Setup Isochronous Data Path (Octet 43 - Bit 3)
          LE Remove Isochronous Data Path (Octet 43 - Bit 4)
          LE Isochronous Transmit Test (Octet 43 - Bit 5)
          LE Isochronous Receive Test (Octet 43 - Bit 6)
          LE Isochronous Read Test Counters (Octet 43 - Bit 7)
          LE Isochronous Read Test Counters (Octet 44 - Bit 0)
          LE Set Host Feature (Octet 44 - Bit 1)
          Octet 44 - Bit 2 
          Octet 45 - Bit 6 
          Octet 46 - Bit 0 
          Octet 46 - Bit 1 
          Octet 46 - Bit 2 
< HCI Command: Host Buffer Size (0x03|0x0033) plen 7         #9 [hci1] 0.390611
        ACL MTU: 255  ACL max packet: 16
        SCO MTU: 0    SCO max packet: 0
> HCI Event: Command Complete (0x0e) plen 4                 #10 [hci1] 0.391130
      Host Buffer Size (0x03|0x0033) ncmd 1
        Status: Success (0x00)
< HCI Command: Set Controller To Ho.. (0x03|0x0031) plen 1  #11 [hci1] 0.410573
        Flow control: ACL Data Packets (0x01)
> HCI Event: Command Complete (0x0e) plen 4                 #12 [hci1] 0.411001
      Set Controller To Host Flow Control (0x03|0x0031) ncmd 1
        Status: Success (0x00)
< HCI Command: LE Read Local Suppor.. (0x08|0x0003) plen 0  #13 [hci1] 0.430560
> HCI Event: Command Complete (0x0e) plen 12                #14 [hci1] 0.431084
      LE Read Local Supported Features (0x08|0x0003) ncmd 1
        Status: Success (0x00)
        Features: 0xfd 0x79 0x00 0xf7 0x30 0x01 0x00 0x00
          LE Encryption
          Extended Reject Indication
          Peripheral-initiated Features Exchange
          LE Ping
          LE Data Packet Length Extension
          LL Privacy
          Extended Scanner Filter Policies
          LE 2M PHY
          LE Coded PHY
          LE Extended Advertising
          LE Periodic Advertising
          Channel Selection Algorithm #2
          Periodic Advertising Sync Transfer - Sender
          Periodic Advertising Sync Transfer - Recipient
          Sleep Clock Accuracy Updates
          Connected Isochronous Stream - Central
          Connected Isochronous Stream - Peripheral
          Isochronous Broadcaster
          Synchronized Receiver
          Periodic Advertising ADI support
          Connection Subrating
          Unknown features (0x0000010000000000)
< HCI Command: LE Set Host Feature (0x08|0x0074) plen 2     #15 [hci1] 0.450584
        Bit Number: 32
          Connected Isochronous Stream (Host Support)
        Bit Value: 1
> HCI Event: Command Complete (0x0e) plen 4                 #16 [hci1] 0.451064
      LE Set Host Feature (0x08|0x0074) ncmd 1
        Status: Success (0x00)
< HCI Command: LE Read Buffer v2 (0x08|0x0060) plen 0       #17 [hci1] 0.470593
> HCI Event: Command Complete (0x0e) plen 10                #18 [hci1] 0.471123
      LE Read Buffer v2 (0x08|0x0060) ncmd 1
        Status: Success (0x00)
        ACL MTU: 27
        ACL max packet: 3
        ISO MTU: 318
        ISO max packet: 3
< HCI Command: LE Read Maximum Adve.. (0x08|0x003a) plen 0  #19 [hci1] 0.490614
> HCI Event: Command Complete (0x0e) plen 6                 #20 [hci1] 0.491031
      LE Read Maximum Advertising Data Length (0x08|0x003a) ncmd 1
        Status: Success (0x00)
        Max length: 1650
< HCI Command: LE Read Supported St.. (0x08|0x001c) plen 0  #21 [hci1] 0.510564
> HCI Event: Command Complete (0x0e) plen 12                #22 [hci1] 0.511065
      LE Read Supported States (0x08|0x001c) ncmd 1
        Status: Success (0x00)
        States: 0x000003ff3e0306ff
          Non-connectable Advertising State
          Scannable Advertising State
          Connectable Advertising State
          High Duty Cycle Directed Advertising State
          Passive Scanning State
          Active Scanning State
          Initiating State
            and Connection State (Central Role)
          Connection State (Peripheral Role)
          Scannable Advertising State
            and Passive Scanning State
          Connectable Advertising State
            and Passive Scanning State
          Non-connectable Advertising State
            and Initiating State
          Scannable Advertising State
            and Initiating State
          Active Scanning State
            and Connection State (Central Role)
          Passive Scanning State
            and Connection State (Peripheral Role)
          Active Scanning State
            and Connection State (Peripheral Role)
          Initiating State
            and Connection State (Central Role)
            and Central Role & Central Role
          Low Duty Cycle Directed Advertising State
          Connectable Advertising State
            and Initiating State
            and Central Role & Peripheral Role
          High Duty Cycle Directed Advertising State
            and Initiating State
            and Central Role & Peripheral Role
          Low Duty Cycle Directed Advertising State
            and Initiating State
            and Central Role & Peripheral Role
          Connectable Advertising State
            and Connection State (Central Role)
            and Central Role & Peripheral Role
          High Duty Cycle Directed Advertising State
            and Connection State (Central Role)
            and Central Role & Peripheral Role
          Low Duty Cycle Directed Advertising State
            and Connection State (Central Role)
            and Central Role & Peripheral Role
          Connectable Advertising State
            and Connection State (Peripheral Role)
            and Central Role & Peripheral Role
          High Duty Cycle Directed Advertising State
            and Connection State (Peripheral Role)
            and Peripheral Role & Peripheral Role
          Low Duty Cycle Directed Advertising State
            and Connection State (Peripheral Role)
            and Peripheral Role & Peripheral Role
          Initiating State
            and Connection State (Peripheral Role)
            and Central Role & Peripheral Role
< HCI Command: LE Read Maximum Data.. (0x08|0x002f) plen 0  #23 [hci1] 0.530567
> HCI Event: Command Complete (0x0e) plen 12                #24 [hci1] 0.531148
      LE Read Maximum Data Length (0x08|0x002f) ncmd 1
        Status: Success (0x00)
        Max TX octets: 251
        Max TX time: 2704
        Max RX octets: 251
        Max RX time: 2704
< HCI Command: LE Write Suggested D.. (0x08|0x0024) plen 4  #25 [hci1] 0.550585
        TX octets: 251
        TX time: 2704
> HCI Event: Command Complete (0x0e) plen 4                 #26 [hci1] 0.550992
      LE Write Suggested Default Data Length (0x08|0x0024) ncmd 1
        Status: Success (0x00)
< HCI Command: LE Read Resolving Li.. (0x08|0x002a) plen 0  #27 [hci1] 0.570574
> HCI Event: Command Complete (0x0e) plen 5                 #28 [hci1] 0.571032
      LE Read Resolving List Size (0x08|0x002a) ncmd 1
        Status: Success (0x00)
        Size: 8
< HCI Command: LE Set Event Mask (0x08|0x0001) plen 8       #29 [hci1] 0.590557
        Mask: 0x000002023f87fa5e
          LE Advertising Report
          LE Connection Update Complete
          LE Read Remote Used Features Complete
          LE Long Term Key Request
          LE Data Length Change
          LE Enhanced Connection Complete
          LE PHY Update Complete
          LE Extended Advertising Report
          LE Periodic Advertising Sync Established
          LE Periodic Advertising Report
          LE Periodic Advertising Sync Lost
          LE Extended Scan Timeout
          LE Extended Advertising Set Terminated
          LE Scan Request Received
          LE Periodic Advertising Sync Transfer Rvc
          LE CIS Established
          LE CIS Request
          LE Create BIG Complete
          LE Terminate BIG Complete
          LE BIG Sync Estabilished Complete
          LE BIG Sync Lost
          LE BIG Info Advertising Report
          Unknown mask (0x0000020000000000)
> HCI Event: Command Complete (0x0e) plen 4                 #30 [hci1] 0.591135
      LE Set Event Mask (0x08|0x0001) ncmd 1
        Status: Success (0x00)
< HCI Command: Set Event Mask (0x03|0x0001) plen 8          #31 [hci1] 0.610577
        Mask: 0x2000800002008890
          Disconnection Complete
          Encryption Change
          Read Remote Version Information Complete
          Hardware Error
          Data Buffer Overflow
          Encryption Key Refresh Complete
          LE Meta
> HCI Event: Command Complete (0x0e) plen 4                 #32 [hci1] 0.611170
      Set Event Mask (0x03|0x0001) ncmd 1
        Status: Success (0x00)
< HCI Command: Read BD ADDR (0x04|0x0009) plen 0            #33 [hci1] 0.630563
> HCI Event: Command Complete (0x0e) plen 10                #34 [hci1] 0.631020
      Read BD ADDR (0x04|0x0009) ncmd 1
        Status: Success (0x00)
        Address: 00:00:00:00:00:00 (OUI 00-00-00)
< HCI Command: LE Set Random Address (0x08|0x0005) plen 6   #35 [hci1] 0.650612
        Address: D5:B6:CC:31:DB:3B (Static)
> HCI Event: Command Complete (0x0e) plen 4                 #36 [hci1] 0.651102
      LE Set Random Address (0x08|0x0005) ncmd 1
        Status: Success (0x00)
< HCI Command: LE Set Extended Adv.. (0x08|0x0036) plen 25  #37 [hci1] 3.191177
        Handle: 0x00
        Properties: 0x0013
          Connectable
          Scannable
          Use legacy advertising PDUs: ADV_IND
        Min advertising interval: 100.000 msec (0x00a0)
        Max advertising interval: 150.000 msec (0x00f0)
        Channel map: 37, 38, 39 (0x07)
        Own address type: Random (0x01)
        Peer address type: Public (0x00)
        Peer address: 00:00:00:00:00:00 (OUI 00-00-00)
        Filter policy: Allow Scan Request from Any, Allow Connect Request from Any (0x00)
        TX power: Host has no preference (0x7f)
        Primary PHY: LE 1M (0x01)
        Secondary max skip: 0x00
        Secondary PHY: LE 1M (0x01)
        SID: 0x00
        Scan request notifications: Disabled (0x00)
> HCI Event: Command Complete (0x0e) plen 5                 #38 [hci1] 3.191984
      LE Set Extended Advertising Parameters (0x08|0x0036) ncmd 1
        Status: Success (0x00)
        TX power (selected): 0 dbm (0x00)
< HCI Command: LE Set Advertising S.. (0x08|0x0035) plen 7  #39 [hci1] 3.210622
        Advertising handle: 0x00
        Advertising random address: D5:B6:CC:31:DB:3B (Static)
> HCI Event: Command Complete (0x0e) plen 4                 #40 [hci1] 3.211115
      LE Set Advertising Set Random Address (0x08|0x0035) ncmd 1
        Status: Success (0x00)
< HCI Command: LE Set Extended Adv.. (0x08|0x0037) plen 22  #41 [hci1] 3.230608
        Handle: 0x00
        Operation: Complete extended advertising data (0x03)
        Fragment preference: Minimize fragmentation (0x01)
        Data length: 0x12
        Flags: 0x06
          LE General Discoverable Mode
          BR/EDR Not Supported
        Name (complete): Tester_F6B11A
> HCI Event: Command Complete (0x0e) plen 4                 #42 [hci1] 3.231254
      LE Set Extended Advertising Data (0x08|0x0037) ncmd 1
        Status: Success (0x00)
< HCI Command: LE Set Extended Scan.. (0x08|0x0038) plen 4  #43 [hci1] 3.250621
        Handle: 0x00
        Operation: Complete scan response data (0x03)
        Fragment preference: Minimize fragmentation (0x01)
        Data length: 0x00
> HCI Event: Command Complete (0x0e) plen 4                 #44 [hci1] 3.251107
      LE Set Extended Scan Response Data (0x08|0x0038) ncmd 1
        Status: Success (0x00)
< HCI Command: LE Set Extended Adve.. (0x08|0x0039) plen 6  #45 [hci1] 3.270614
        Extended advertising: Enabled (0x01)
        Number of sets: 1 (0x01)
        Entry 0
          Handle: 0x00
          Duration: 0 ms (0x00)
          Max ext adv events: 0
> HCI Event: Command Complete (0x0e) plen 4                 #46 [hci1] 3.271199
      LE Set Extended Advertising Enable (0x08|0x0039) ncmd 1
        Status: Success (0x00)
> HCI Event: LE Meta Event (0x3e) plen 31                   #47 [hci1] 3.379717
      LE Enhanced Connection Complete (0x0a)
        Status: Success (0x00)
        Handle: 975
        Role: Peripheral (0x01)
        Peer address type: Public (0x00)
        Peer address: DF:A9:FF:F6:B1:1A (OUI DF-A9-FF)
        Local resolvable private address: 00:00:00:00:00:00 (Non-Resolvable)
        Peer resolvable private address: 00:00:00:00:00:00 (Non-Resolvable)
        Connection interval: 87.50 msec (0x0046)
        Connection latency: 0 (0x0000)
        Supervision timeout: 25120 msec (0x09d0)
        Central clock accuracy: 0x01
> HCI Event: LE Meta Event (0x3e) plen 6                    #48 [hci1] 3.379795
      LE Advertising Set Terminated (0x12)
        Status: Success (0x00)
        Handle: 0
        Connection handle: 975
        Number of completed extended advertising events: 0
< HCI Command: LE Read Remote Used... (0x08|0x0016) plen 2  #49 [hci1] 3.391980
        Handle: 975 Address: DF:A9:FF:F6:B1:1A (OUI DF-A9-FF)
< ACL Data TX: Handle 975 flags 0x00 dlen 7                 #50 [hci1] 3.392008
      ATT: Exchange MTU Request (0x02) len 2
        Client RX MTU: 251
> HCI Event: Command Status (0x0f) plen 4                   #51 [hci1] 3.392564
      LE Read Remote Used Features (0x08|0x0016) ncmd 1
        Status: Success (0x00)
> HCI Event: Number of Completed Packets (0x13) plen 5      #52 [hci1] 3.555556
        Num handles: 1
        Handle: 975 Address: DF:A9:FF:F6:B1:1A (OUI DF-A9-FF)
        Count: 1
        #50: len 7 (0 Kb/s)
        Latency: 163 msec (163-163 msec ~163 msec)
> HCI Event: LE Meta Event (0x3e) plen 12                   #53 [hci1] 3.643575
      LE Read Remote Used Features (0x04)
        Status: Success (0x00)
        Handle: 975 Address: DF:A9:FF:F6:B1:1A (OUI DF-A9-FF)
        Features: 0x2d 0x49 0x00 0xf7 0x67 0xd9 0x00 0x80
          LE Encryption
          Extended Reject Indication
          Peripheral-initiated Features Exchange
          LE Data Packet Length Extension
          LE 2M PHY
          LE Coded PHY
          Channel Selection Algorithm #2
          Periodic Advertising Sync Transfer - Sender
          Periodic Advertising Sync Transfer - Recipient
          Sleep Clock Accuracy Updates
          Connected Isochronous Stream - Central
          Connected Isochronous Stream - Peripheral
          Isochronous Broadcaster
          Synchronized Receiver
          Connected Isochronous Stream (Host Support)
          LE Power Control Request
          LE Power Control Request
          Connection Subrating
          Connection Subrating (Host Support)
          Unknown features (0x8000d90000000000)
> ACL Data RX: Handle 975 flags 0x02 dlen 11                #54 [hci1] 6.093310
      SMP: Pairing Request (0x01) len 6
        IO capability: KeyboardDisplay (0x04)
        OOB data: Authentication data not present (0x00)
        Authentication requirement: Bonding, MITM, SC, No Keypresses (0x0d)
        Max encryption key size: 16
        Initiator key distribution: EncKey IdKey (0x03)
        Responder key distribution: EncKey IdKey Sign (0x07)
> ACL Data RX: Handle 975 flags 0x02 dlen 7                 #55 [hci1] 6.093756
      ATT: Exchange MTU Response (0x03) len 2
        Server RX MTU: 23
< HCI Command: Host Number of Compl.. (0x03|0x0035) plen 5  #56 [hci1] 6.111251
        Num handles: 1
        Handle: 975 Address: DF:A9:FF:F6:B1:1A (OUI DF-A9-FF)
        Count: 1
< ACL Data TX: Handle 975 flags 0x00 dlen 11                #57 [hci1] 6.111341
      SMP: Pairing Response (0x02) len 6
        IO capability: DisplayOnly (0x00)
        OOB data: Authentication data not present (0x00)
        Authentication requirement: Bonding, No MITM, SC, No Keypresses (0x09)
        Max encryption key size: 16
        Initiator key distribution: IdKey (0x02)
        Responder key distribution: <none> (0x00)
< HCI Command: Host Number of Compl.. (0x03|0x0035) plen 5  #58 [hci1] 6.111832
        Num handles: 1
        Handle: 975 Address: DF:A9:FF:F6:B1:1A (OUI DF-A9-FF)
        Count: 1
> HCI Event: Number of Completed Packets (0x13) plen 5      #59 [hci1] 6.268331
        Num handles: 1
        Handle: 975 Address: DF:A9:FF:F6:B1:1A (OUI DF-A9-FF)
        Count: 1
        #57: len 11 (0 Kb/s)
        Latency: 156 msec (156-163 msec ~160 msec)
> ACL Data RX: Handle 975 flags 0x02 dlen 27                #60 [hci1] 6.268768
> ACL Data RX: Handle 975 flags 0x01 dlen 27                #61 [hci1] 6.269208
> ACL Data RX: Handle 975 flags 0x01 dlen 15                #62 [hci1] 6.269703
      SMP: Pairing Public Key (0x0c) len 64
        X: 4ad7c224362e346a5453362b5eabe7fd1b1b7ebc6e3303db0c24c9ce8d9b86c2
        Y: 0437af8ad29c73766f81d4036e5cb280437bd8707646fa2daefdd5eede1c7f3c
< HCI Command: Host Number of Compl.. (0x03|0x0035) plen 5  #63 [hci1] 6.271405
        Num handles: 1
        Handle: 975 Address: DF:A9:FF:F6:B1:1A (OUI DF-A9-FF)
        Count: 1
< HCI Command: Host Number of Compl.. (0x03|0x0035) plen 5  #64 [hci1] 6.271555
        Num handles: 1
        Handle: 975 Address: DF:A9:FF:F6:B1:1A (OUI DF-A9-FF)
        Count: 1
< HCI Command: Host Number of Compl.. (0x03|0x0035) plen 5  #65 [hci1] 6.271985
        Num handles: 1
        Handle: 975 Address: DF:A9:FF:F6:B1:1A (OUI DF-A9-FF)
        Count: 1
< ACL Data TX: Handle 975 flags 0x00 dlen 27                #66 [hci1] 6.272128
< ACL Data TX: Handle 975 flags 0x01 dlen 27                #67 [hci1] 6.272160
< ACL Data TX: Handle 975 flags 0x01 dlen 15                #68 [hci1] 6.272220
      SMP: Pairing Public Key (0x0c) len 64
        X: 98308440221e2d910f0e54b71e7ec652857aa9b5a0dc65028824cc19db1226e9
        Y: 67a4816bcb62efb21701e31fdb27561a6217575fb007a8bbdabe7e28b6f68482
> HCI Event: Number of Completed Packets (0x13) plen 5      #69 [hci1] 6.356250
        Num handles: 1
        Handle: 975 Address: DF:A9:FF:F6:B1:1A (OUI DF-A9-FF)
        Count: 1
        #66: len 27 (2 Kb/s)
        Latency: 84 msec (84-163 msec ~122 msec)
> HCI Event: Number of Completed Packets (0x13) plen 5      #70 [hci1] 6.356958
        Num handles: 1
        Handle: 975 Address: DF:A9:FF:F6:B1:1A (OUI DF-A9-FF)
        Count: 1
        #67: len 27 (2 Kb/s)
        Latency: 84 msec (84-163 msec ~103 msec)
> HCI Event: Number of Completed Packets (0x13) plen 5      #71 [hci1] 6.443090
        Num handles: 1
        Handle: 975 Address: DF:A9:FF:F6:B1:1A (OUI DF-A9-FF)
        Count: 1
        #68: len 15 (0 Kb/s)
        Latency: 170 msec (84-170 msec ~137 msec)
> ACL Data RX: Handle 975 flags 0x02 dlen 21                #72 [hci1] 7.405841
      SMP: Pairing Confirm (0x03) len 16
        Confim value: fe8953129c1b382452dea196a2382920
< HCI Command: Host Number of Compl.. (0x03|0x0035) plen 5  #73 [hci1] 7.410938
        Num handles: 1
        Handle: 975 Address: DF:A9:FF:F6:B1:1A (OUI DF-A9-FF)
        Count: 1
< ACL Data TX: Handle 975 flags 0x00 dlen 21                #74 [hci1] 7.411040
      SMP: Pairing Confirm (0x03) len 16
        Confim value: d30549586c824d55dc668fa67022b1b5
> HCI Event: Number of Completed Packets (0x13) plen 5      #75 [hci1] 7.580768
        Num handles: 1
        Handle: 975 Address: DF:A9:FF:F6:B1:1A (OUI DF-A9-FF)
        Count: 1
        #74: len 21 (0 Kb/s)
        Latency: 169 msec (84-170 msec ~153 msec)
> ACL Data RX: Handle 975 flags 0x02 dlen 21                #76 [hci1] 7.581162
      SMP: Pairing Random (0x04) len 16
        Random value: ac33d781b13b39350000000000000000
< HCI Command: Host Number of Compl.. (0x03|0x0035) plen 5  #77 [hci1] 7.591326
        Num handles: 1
        Handle: 975 Address: DF:A9:FF:F6:B1:1A (OUI DF-A9-FF)
        Count: 1
< ACL Data TX: Handle 975 flags 0x00 dlen 21                #78 [hci1] 7.591488
      SMP: Pairing Random (0x04) len 16
        Random value: 8e6108f966a694cbe26df70bb96773e6
> HCI Event: Number of Completed Packets (0x13) plen 5      #79 [hci1] 7.755574
        Num handles: 1
        Handle: 975 Address: DF:A9:FF:F6:B1:1A (OUI DF-A9-FF)
        Count: 1
        #78: len 21 (1 Kb/s)
        Latency: 164 msec (84-170 msec ~158 msec)
> ACL Data RX: Handle 975 flags 0x02 dlen 21                #80 [hci1] 7.843355
      SMP: Pairing Confirm (0x03) len 16
        Confim value: 8d43fc1726c5ed73fa8196db970c77fa
< HCI Command: Host Number of Compl.. (0x03|0x0035) plen 5  #81 [hci1] 7.850941
        Num handles: 1
        Handle: 975 Address: DF:A9:FF:F6:B1:1A (OUI DF-A9-FF)
        Count: 1
< ACL Data TX: Handle 975 flags 0x00 dlen 21                #82 [hci1] 7.851047
      SMP: Pairing Confirm (0x03) len 16
        Confim value: cc24295369d96d1ff684499744c1cc65
> HCI Event: Number of Completed Packets (0x13) plen 5      #83 [hci1] 8.018287
        Num handles: 1
        Handle: 975 Address: DF:A9:FF:F6:B1:1A (OUI DF-A9-FF)
        Count: 1
        #82: len 21 (1 Kb/s)
        Latency: 167 msec (84-170 msec ~163 msec)
> ACL Data RX: Handle 975 flags 0x02 dlen 21                #84 [hci1] 8.018704
      SMP: Pairing Random (0x04) len 16
        Random value: 2fbf52171f5bfe3d0000000000000000
< HCI Command: Host Number of Compl.. (0x03|0x0035) plen 5  #85 [hci1] 8.031569
        Num handles: 1
        Handle: 975 Address: DF:A9:FF:F6:B1:1A (OUI DF-A9-FF)
        Count: 1
< ACL Data TX: Handle 975 flags 0x00 dlen 21                #86 [hci1] 8.031752
      SMP: Pairing Random (0x04) len 16
        Random value: 4d02679f89a05211af56d8b3da64d21e
> HCI Event: Number of Completed Packets (0x13) plen 5      #87 [hci1] 8.193029
        Num handles: 1
        Handle: 975 Address: DF:A9:FF:F6:B1:1A (OUI DF-A9-FF)
        Count: 1
        #86: len 21 (1 Kb/s)
        Latency: 161 msec (84-170 msec ~162 msec)
> ACL Data RX: Handle 975 flags 0x02 dlen 21                #88 [hci1] 8.280981
      SMP: Pairing Confirm (0x03) len 16
        Confim value: 3f5ae183987940426244ad629e483d94
< HCI Command: Host Number of Compl.. (0x03|0x0035) plen 5  #89 [hci1] 8.291290
        Num handles: 1
        Handle: 975 Address: DF:A9:FF:F6:B1:1A (OUI DF-A9-FF)
        Count: 1
< ACL Data TX: Handle 975 flags 0x00 dlen 21                #90 [hci1] 8.291380
      SMP: Pairing Confirm (0x03) len 16
        Confim value: 7a504e04b2c6565dddc887e46991e98b
> HCI Event: Number of Completed Packets (0x13) plen 5      #91 [hci1] 8.455851
        Num handles: 1
        Handle: 975 Address: DF:A9:FF:F6:B1:1A (OUI DF-A9-FF)
        Count: 1
        #90: len 21 (1 Kb/s)
        Latency: 164 msec (84-170 msec ~163 msec)
> ACL Data RX: Handle 975 flags 0x02 dlen 21                #92 [hci1] 8.456100
      SMP: Pairing Random (0x04) len 16
        Random value: 9c3d421bec8a33600000000000000000
< HCI Command: Host Number of Compl.. (0x03|0x0035) plen 5  #93 [hci1] 8.471445
        Num handles: 1
        Handle: 975 Address: DF:A9:FF:F6:B1:1A (OUI DF-A9-FF)
        Count: 1
< ACL Data TX: Handle 975 flags 0x00 dlen 21                #94 [hci1] 8.471626
      SMP: Pairing Random (0x04) len 16
        Random value: 5e8286bc235a02440d0c3424a2acf8fd
> HCI Event: Number of Completed Packets (0x13) plen 5      #95 [hci1] 8.630489
        Num handles: 1
        Handle: 975 Address: DF:A9:FF:F6:B1:1A (OUI DF-A9-FF)
        Count: 1
        #94: len 21 (1 Kb/s)
        Latency: 158 msec (84-170 msec ~161 msec)
> ACL Data RX: Handle 975 flags 0x02 dlen 21                #96 [hci1] 8.718365
      SMP: Pairing Confirm (0x03) len 16
        Confim value: 1dc9a98a3b0f89e8e3e1498c3ec69b96
< HCI Command: Host Number of Compl.. (0x03|0x0035) plen 5  #97 [hci1] 8.731266
        Num handles: 1
        Handle: 975 Address: DF:A9:FF:F6:B1:1A (OUI DF-A9-FF)
        Count: 1
< ACL Data TX: Handle 975 flags 0x00 dlen 21                #98 [hci1] 8.731437
      SMP: Pairing Confirm (0x03) len 16
        Confim value: 9eeee3431752b850358e2f739cfc8566
> HCI Event: Number of Completed Packets (0x13) plen 5      #99 [hci1] 8.893208
        Num handles: 1
        Handle: 975 Address: DF:A9:FF:F6:B1:1A (OUI DF-A9-FF)
        Count: 1
        #98: len 21 (1 Kb/s)
        Latency: 161 msec (84-170 msec ~161 msec)
> ACL Data RX: Handle 975 flags 0x02 dlen 21               #100 [hci1] 8.893589
      SMP: Pairing Random (0x04) len 16
        Random value: 28473fb03aacf5780000000000000000
< HCI Command: Host Number of Comp.. (0x03|0x0035) plen 5  #101 [hci1] 8.911158
        Num handles: 1
        Handle: 975 Address: DF:A9:FF:F6:B1:1A (OUI DF-A9-FF)
        Count: 1
< ACL Data TX: Handle 975 flags 0x00 dlen 21               #102 [hci1] 8.911260
      SMP: Pairing Random (0x04) len 16
        Random value: 5c4a1bcadd27bd58e945097b00bad7ac
> HCI Event: Number of Completed Packets (0x13) plen 5     #103 [hci1] 9.068069
        Num handles: 1
        Handle: 975 Address: DF:A9:FF:F6:B1:1A (OUI DF-A9-FF)
        Count: 1
        #102: len 21 (1 Kb/s)
        Latency: 156 msec (84-170 msec ~159 msec)
> ACL Data RX: Handle 975 flags 0x02 dlen 21               #104 [hci1] 9.155928
      SMP: Pairing Confirm (0x03) len 16
        Confim value: fa46db591e10125078298426631089f7
< HCI Command: Host Number of Comp.. (0x03|0x0035) plen 5  #105 [hci1] 9.171335
        Num handles: 1
        Handle: 975 Address: DF:A9:FF:F6:B1:1A (OUI DF-A9-FF)
        Count: 1
< ACL Data TX: Handle 975 flags 0x00 dlen 21               #106 [hci1] 9.171523
      SMP: Pairing Confirm (0x03) len 16
        Confim value: 4e2a3f94ebb5f0b6a51dff38f63c3d0e
> HCI Event: Number of Completed Packets (0x13) plen 5     #107 [hci1] 9.330729
        Num handles: 1
        Handle: 975 Address: DF:A9:FF:F6:B1:1A (OUI DF-A9-FF)
        Count: 1
        #106: len 21 (1 Kb/s)
        Latency: 159 msec (84-170 msec ~159 msec)
> ACL Data RX: Handle 975 flags 0x02 dlen 21               #108 [hci1] 9.331130
      SMP: Pairing Random (0x04) len 16
        Random value: b6761b07481e42200000000000000000
< HCI Command: Host Number of Comp.. (0x03|0x0035) plen 5  #109 [hci1] 9.351148
        Num handles: 1
        Handle: 975 Address: DF:A9:FF:F6:B1:1A (OUI DF-A9-FF)
        Count: 1
< ACL Data TX: Handle 975 flags 0x00 dlen 21               #110 [hci1] 9.351241
      SMP: Pairing Random (0x04) len 16
        Random value: 32527e6e64e79f33b2e374394db8ab2d
> HCI Event: Number of Completed Packets (0x13) plen 5     #111 [hci1] 9.505524
        Num handles: 1
        Handle: 975 Address: DF:A9:FF:F6:B1:1A (OUI DF-A9-FF)
        Count: 1
        #110: len 21 (1 Kb/s)
        Latency: 154 msec (84-170 msec ~156 msec)
> ACL Data RX: Handle 975 flags 0x02 dlen 21               #112 [hci1] 9.593410
      SMP: Pairing Confirm (0x03) len 16
        Confim value: c9349a00e9e77dc1fe04bede9fade942
< HCI Command: Host Number of Comp.. (0x03|0x0035) plen 5  #113 [hci1] 9.611278
        Num handles: 1
        Handle: 975 Address: DF:A9:FF:F6:B1:1A (OUI DF-A9-FF)
        Count: 1
< ACL Data TX: Handle 975 flags 0x00 dlen 21               #114 [hci1] 9.611486
      SMP: Pairing Confirm (0x03) len 16
        Confim value: 53f6e699c77f593ccab3a2341bb0772e
> HCI Event: Number of Completed Packets (0x13) plen 5     #115 [hci1] 9.768252
        Num handles: 1
        Handle: 975 Address: DF:A9:FF:F6:B1:1A (OUI DF-A9-FF)
        Count: 1
        #114: len 21 (1 Kb/s)
        Latency: 156 msec (84-170 msec ~156 msec)
> ACL Data RX: Handle 975 flags 0x02 dlen 21               #116 [hci1] 9.768577
      SMP: Pairing Random (0x04) len 16
        Random value: 8ac3678836c3cd130000000000000000
< HCI Command: Host Number of Comp.. (0x03|0x0035) plen 5  #117 [hci1] 9.770954
        Num handles: 1
        Handle: 975 Address: DF:A9:FF:F6:B1:1A (OUI DF-A9-FF)
        Count: 1
< ACL Data TX: Handle 975 flags 0x00 dlen 21               #118 [hci1] 9.771052
      SMP: Pairing Random (0x04) len 16
        Random value: dddbdfe2838e9a8cc6964353c850fef7
> HCI Event: Number of Completed Packets (0x13) plen 5     #119 [hci1] 9.943074
        Num handles: 1
        Handle: 975 Address: DF:A9:FF:F6:B1:1A (OUI DF-A9-FF)
        Count: 1
        #118: len 21 (0 Kb/s)
        Latency: 172 msec (84-172 msec ~164 msec)
> ACL Data RX: Handle 975 flags 0x02 dlen 21              #120 [hci1] 10.030943
      SMP: Pairing Confirm (0x03) len 16
        Confim value: ebd12819089fa1fc535175bef2b7a8df
< HCI Command: Host Number of Com.. (0x03|0x0035) plen 5  #121 [hci1] 10.051159
        Num handles: 1
        Handle: 975 Address: DF:A9:FF:F6:B1:1A (OUI DF-A9-FF)
        Count: 1
< ACL Data TX: Handle 975 flags 0x00 dlen 21              #122 [hci1] 10.051285
      SMP: Pairing Confirm (0x03) len 16
        Confim value: fc846bea1f9103ecd72802171b5efbbe
> HCI Event: Number of Completed Packets (0x13) plen 5    #123 [hci1] 10.205762
        Num handles: 1
        Handle: 975 Address: DF:A9:FF:F6:B1:1A (OUI DF-A9-FF)
        Count: 1
        #122: len 21 (1 Kb/s)
        Latency: 154 msec (84-172 msec ~159 msec)
> ACL Data RX: Handle 975 flags 0x02 dlen 21              #124 [hci1] 10.206225
      SMP: Pairing Random (0x04) len 16
        Random value: 8976b25beb6fb09c0000000000000000
< HCI Command: Host Number of Com.. (0x03|0x0035) plen 5  #125 [hci1] 10.211583
        Num handles: 1
        Handle: 975 Address: DF:A9:FF:F6:B1:1A (OUI DF-A9-FF)
        Count: 1
< ACL Data TX: Handle 975 flags 0x00 dlen 21              #126 [hci1] 10.211726
      SMP: Pairing Random (0x04) len 16
        Random value: eb9f1915536596b6fc3db1c86b2b1970
> HCI Event: Number of Completed Packets (0x13) plen 5    #127 [hci1] 10.380562
        Num handles: 1
        Handle: 975 Address: DF:A9:FF:F6:B1:1A (OUI DF-A9-FF)
        Count: 1
        #126: len 21 (1 Kb/s)
        Latency: 168 msec (84-172 msec ~164 msec)
> ACL Data RX: Handle 975 flags 0x02 dlen 21              #128 [hci1] 10.468474
      SMP: Pairing Confirm (0x03) len 16
        Confim value: 0016c02d899339598f571f3dc691d8b1
< HCI Command: Host Number of Com.. (0x03|0x0035) plen 5  #129 [hci1] 10.471312
        Num handles: 1
        Handle: 975 Address: DF:A9:FF:F6:B1:1A (OUI DF-A9-FF)
        Count: 1
< ACL Data TX: Handle 975 flags 0x00 dlen 21              #130 [hci1] 10.471531
      SMP: Pairing Confirm (0x03) len 16
        Confim value: b77b1572ce6bd32c8b3e368b36e44f2a
> HCI Event: Number of Completed Packets (0x13) plen 5    #131 [hci1] 10.643282
        Num handles: 1
        Handle: 975 Address: DF:A9:FF:F6:B1:1A (OUI DF-A9-FF)
        Count: 1
        #130: len 21 (0 Kb/s)
        Latency: 171 msec (84-172 msec ~167 msec)
> ACL Data RX: Handle 975 flags 0x02 dlen 21              #132 [hci1] 10.643545
      SMP: Pairing Random (0x04) len 16
        Random value: 93ea698630f2e3190000000000000000
< HCI Command: Host Number of Com.. (0x03|0x0035) plen 5  #133 [hci1] 10.651636
        Num handles: 1
        Handle: 975 Address: DF:A9:FF:F6:B1:1A (OUI DF-A9-FF)
        Count: 1
< ACL Data TX: Handle 975 flags 0x00 dlen 21              #134 [hci1] 10.651822
      SMP: Pairing Random (0x04) len 16
        Random value: 5c794dc9ad9f2c3f295ebd5ad5e1c3cf
> HCI Event: Number of Completed Packets (0x13) plen 5    #135 [hci1] 10.818020
        Num handles: 1
        Handle: 975 Address: DF:A9:FF:F6:B1:1A (OUI DF-A9-FF)
        Count: 1
        #134: len 21 (1 Kb/s)
        Latency: 166 msec (84-172 msec ~167 msec)
> ACL Data RX: Handle 975 flags 0x02 dlen 21              #136 [hci1] 10.905875
      SMP: Pairing Confirm (0x03) len 16
        Confim value: 48081e32d5491e3093c7bd9354950a83
< HCI Command: Host Number of Com.. (0x03|0x0035) plen 5  #137 [hci1] 10.911048
        Num handles: 1
        Handle: 975 Address: DF:A9:FF:F6:B1:1A (OUI DF-A9-FF)
        Count: 1
< ACL Data TX: Handle 975 flags 0x00 dlen 21              #138 [hci1] 10.911149
      SMP: Pairing Confirm (0x03) len 16
        Confim value: 31c750613be8e83883235ef12ad831ba
> HCI Event: Number of Completed Packets (0x13) plen 5    #139 [hci1] 11.080698
        Num handles: 1
        Handle: 975 Address: DF:A9:FF:F6:B1:1A (OUI DF-A9-FF)
        Count: 1
        #138: len 21 (0 Kb/s)
        Latency: 169 msec (84-172 msec ~168 msec)
> ACL Data RX: Handle 975 flags 0x02 dlen 21              #140 [hci1] 11.081087
      SMP: Pairing Random (0x04) len 16
        Random value: bceb1d248f76230a0000000000000000
< HCI Command: Host Number of Com.. (0x03|0x0035) plen 5  #141 [hci1] 11.091533
        Num handles: 1
        Handle: 975 Address: DF:A9:FF:F6:B1:1A (OUI DF-A9-FF)
        Count: 1
< ACL Data TX: Handle 975 flags 0x00 dlen 21              #142 [hci1] 11.091622
      SMP: Pairing Random (0x04) len 16
        Random value: 5c2fff312cdf99c9491988e877355a9a
> HCI Event: Number of Completed Packets (0x13) plen 5    #143 [hci1] 11.255525
        Num handles: 1
        Handle: 975 Address: DF:A9:FF:F6:B1:1A (OUI DF-A9-FF)
        Count: 1
        #142: len 21 (1 Kb/s)
        Latency: 163 msec (84-172 msec ~166 msec)
> ACL Data RX: Handle 975 flags 0x02 dlen 21              #144 [hci1] 11.343349
      SMP: Pairing Confirm (0x03) len 16
        Confim value: 144b0c790658832186d68d77df172ea4
< HCI Command: Host Number of Com.. (0x03|0x0035) plen 5  #145 [hci1] 11.351052
        Num handles: 1
        Handle: 975 Address: DF:A9:FF:F6:B1:1A (OUI DF-A9-FF)
        Count: 1
< ACL Data TX: Handle 975 flags 0x00 dlen 21              #146 [hci1] 11.351187
      SMP: Pairing Confirm (0x03) len 16
        Confim value: 59ff1659320bda20a25a8f712bbd9090
> HCI Event: Number of Completed Packets (0x13) plen 5    #147 [hci1] 11.518265
        Num handles: 1
        Handle: 975 Address: DF:A9:FF:F6:B1:1A (OUI DF-A9-FF)
        Count: 1
        #146: len 21 (1 Kb/s)
        Latency: 167 msec (84-172 msec ~166 msec)
> ACL Data RX: Handle 975 flags 0x02 dlen 21              #148 [hci1] 11.518549
      SMP: Pairing Random (0x04) len 16
        Random value: 106bc0c1c4fba0bd0000000000000000
< HCI Command: Host Number of Com.. (0x03|0x0035) plen 5  #149 [hci1] 11.531535
        Num handles: 1
        Handle: 975 Address: DF:A9:FF:F6:B1:1A (OUI DF-A9-FF)
        Count: 1
< ACL Data TX: Handle 975 flags 0x00 dlen 21              #150 [hci1] 11.531735
      SMP: Pairing Random (0x04) len 16
        Random value: c629a3a987d808e808655d558dfc1155
> HCI Event: Number of Completed Packets (0x13) plen 5    #151 [hci1] 11.692946
        Num handles: 1
        Handle: 975 Address: DF:A9:FF:F6:B1:1A (OUI DF-A9-FF)
        Count: 1
        #150: len 21 (1 Kb/s)
        Latency: 161 msec (84-172 msec ~163 msec)
> ACL Data RX: Handle 975 flags 0x02 dlen 21              #152 [hci1] 11.780823
      SMP: Pairing Confirm (0x03) len 16
        Confim value: 6fcbf39808a3f3b02af0a4b17cdbb6e3
< HCI Command: Host Number of Com.. (0x03|0x0035) plen 5  #153 [hci1] 11.791291
        Num handles: 1
        Handle: 975 Address: DF:A9:FF:F6:B1:1A (OUI DF-A9-FF)
        Count: 1
< ACL Data TX: Handle 975 flags 0x00 dlen 21              #154 [hci1] 11.791362
      SMP: Pairing Confirm (0x03) len 16
        Confim value: 02a25b631c502509d4fb07b18d0c4e64
> HCI Event: Number of Completed Packets (0x13) plen 5    #155 [hci1] 11.955641
        Num handles: 1
        Handle: 975 Address: DF:A9:FF:F6:B1:1A (OUI DF-A9-FF)
        Count: 1
        #154: len 21 (1 Kb/s)
        Latency: 164 msec (84-172 msec ~164 msec)
> ACL Data RX: Handle 975 flags 0x02 dlen 21              #156 [hci1] 11.956088
      SMP: Pairing Random (0x04) len 16
        Random value: f44553ce341f18ce0000000000000000
< HCI Command: Host Number of Com.. (0x03|0x0035) plen 5  #157 [hci1] 11.971584
        Num handles: 1
        Handle: 975 Address: DF:A9:FF:F6:B1:1A (OUI DF-A9-FF)
        Count: 1
< ACL Data TX: Handle 975 flags 0x00 dlen 21              #158 [hci1] 11.971732
      SMP: Pairing Random (0x04) len 16
        Random value: 92f20f6ad8f13724432c7fd6001c45ff
> HCI Event: Number of Completed Packets (0x13) plen 5    #159 [hci1] 12.130503
        Num handles: 1
        Handle: 975 Address: DF:A9:FF:F6:B1:1A (OUI DF-A9-FF)
        Count: 1
        #158: len 21 (1 Kb/s)
        Latency: 158 msec (84-172 msec ~161 msec)
> ACL Data RX: Handle 975 flags 0x02 dlen 21              #160 [hci1] 12.218328
      SMP: Pairing Confirm (0x03) len 16
        Confim value: e88c65df1984c9ff9890d7db3ae65ff9
< HCI Command: Host Number of Com.. (0x03|0x0035) plen 5  #161 [hci1] 12.231069
        Num handles: 1
        Handle: 975 Address: DF:A9:FF:F6:B1:1A (OUI DF-A9-FF)
        Count: 1
< ACL Data TX: Handle 975 flags 0x00 dlen 21              #162 [hci1] 12.231137
      SMP: Pairing Confirm (0x03) len 16
        Confim value: 63ee864e1291e6c01d7640e5d793a102
> HCI Event: Number of Completed Packets (0x13) plen 5    #163 [hci1] 12.393246
        Num handles: 1
        Handle: 975 Address: DF:A9:FF:F6:B1:1A (OUI DF-A9-FF)
        Count: 1
        #162: len 21 (1 Kb/s)
        Latency: 162 msec (84-172 msec ~161 msec)
> ACL Data RX: Handle 975 flags 0x02 dlen 21              #164 [hci1] 12.393489
      SMP: Pairing Random (0x04) len 16
        Random value: d1dc7670dbfd0f770000000000000000
< HCI Command: Host Number of Com.. (0x03|0x0035) plen 5  #165 [hci1] 12.411265
        Num handles: 1
        Handle: 975 Address: DF:A9:FF:F6:B1:1A (OUI DF-A9-FF)
        Count: 1
< ACL Data TX: Handle 975 flags 0x00 dlen 21              #166 [hci1] 12.411329
      SMP: Pairing Random (0x04) len 16
        Random value: 23ac32ebbb5e14c8a6b9622f296d277f
> HCI Event: Number of Completed Packets (0x13) plen 5    #167 [hci1] 12.567968
        Num handles: 1
        Handle: 975 Address: DF:A9:FF:F6:B1:1A (OUI DF-A9-FF)
        Count: 1
        #166: len 21 (1 Kb/s)
        Latency: 156 msec (84-172 msec ~159 msec)
> ACL Data RX: Handle 975 flags 0x02 dlen 21              #168 [hci1] 12.655785
      SMP: Pairing Confirm (0x03) len 16
        Confim value: f91fea8cbe3c72de7508f3b4157cd188
< HCI Command: Host Number of Com.. (0x03|0x0035) plen 5  #169 [hci1] 12.671287
        Num handles: 1
        Handle: 975 Address: DF:A9:FF:F6:B1:1A (OUI DF-A9-FF)
        Count: 1
< ACL Data TX: Handle 975 flags 0x00 dlen 21              #170 [hci1] 12.671448
      SMP: Pairing Confirm (0x03) len 16
        Confim value: fd0d3ac34780c823575496d969a1c84b
> HCI Event: Number of Completed Packets (0x13) plen 5    #171 [hci1] 12.830780
        Num handles: 1
        Handle: 975 Address: DF:A9:FF:F6:B1:1A (OUI DF-A9-FF)
        Count: 1
        #170: len 21 (1 Kb/s)
        Latency: 159 msec (84-172 msec ~159 msec)
> ACL Data RX: Handle 975 flags 0x02 dlen 21              #172 [hci1] 12.831015
      SMP: Pairing Random (0x04) len 16
        Random value: 9836e7660d0d1c780000000000000000
< HCI Command: Host Number of Com.. (0x03|0x0035) plen 5  #173 [hci1] 12.851462
        Num handles: 1
        Handle: 975 Address: DF:A9:FF:F6:B1:1A (OUI DF-A9-FF)
        Count: 1
< ACL Data TX: Handle 975 flags 0x00 dlen 21              #174 [hci1] 12.851662
      SMP: Pairing Random (0x04) len 16
        Random value: 297efe85e67448a15f56bd27e3a3cf1d
> HCI Event: Number of Completed Packets (0x13) plen 5    #175 [hci1] 13.005531
        Num handles: 1
        Handle: 975 Address: DF:A9:FF:F6:B1:1A (OUI DF-A9-FF)
        Count: 1
        #174: len 21 (1 Kb/s)
        Latency: 153 msec (84-172 msec ~156 msec)
> ACL Data RX: Handle 975 flags 0x02 dlen 21              #176 [hci1] 13.093308
      SMP: Pairing Confirm (0x03) len 16
        Confim value: 5444cd71114e50554b6b2388eed6306d
< HCI Command: Host Number of Com.. (0x03|0x0035) plen 5  #177 [hci1] 13.111264
        Num handles: 1
        Handle: 975 Address: DF:A9:FF:F6:B1:1A (OUI DF-A9-FF)
        Count: 1
< ACL Data TX: Handle 975 flags 0x00 dlen 21              #178 [hci1] 13.111464
      SMP: Pairing Confirm (0x03) len 16
        Confim value: 2eeb51406244642fa75434db68de9eb3
> HCI Event: Number of Completed Packets (0x13) plen 5    #179 [hci1] 13.268290
        Num handles: 1
        Handle: 975 Address: DF:A9:FF:F6:B1:1A (OUI DF-A9-FF)
        Count: 1
        #178: len 21 (1 Kb/s)
        Latency: 156 msec (84-172 msec ~156 msec)
> ACL Data RX: Handle 975 flags 0x02 dlen 21              #180 [hci1] 13.268502
      SMP: Pairing Random (0x04) len 16
        Random value: d8cac49cf0d3461f0000000000000000
< HCI Command: Host Number of Com.. (0x03|0x0035) plen 5  #181 [hci1] 13.271550
        Num handles: 1
        Handle: 975 Address: DF:A9:FF:F6:B1:1A (OUI DF-A9-FF)
        Count: 1
< ACL Data TX: Handle 975 flags 0x00 dlen 21              #182 [hci1] 13.271747
      SMP: Pairing Random (0x04) len 16
        Random value: 25a9493fd3ce4faf02be7293595bb7c6
> HCI Event: Number of Completed Packets (0x13) plen 5    #183 [hci1] 13.442989
        Num handles: 1
        Handle: 975 Address: DF:A9:FF:F6:B1:1A (OUI DF-A9-FF)
        Count: 1
        #182: len 21 (0 Kb/s)
        Latency: 171 msec (84-172 msec ~163 msec)
> ACL Data RX: Handle 975 flags 0x02 dlen 21              #184 [hci1] 13.530930
      SMP: Pairing Confirm (0x03) len 16
        Confim value: ee472fa0b5890ea5d6dc0c3c95a2a650
< HCI Command: Host Number of Com.. (0x03|0x0035) plen 5  #185 [hci1] 13.551307
        Num handles: 1
        Handle: 975 Address: DF:A9:FF:F6:B1:1A (OUI DF-A9-FF)
        Count: 1
< ACL Data TX: Handle 975 flags 0x00 dlen 21              #186 [hci1] 13.551483
      SMP: Pairing Confirm (0x03) len 16
        Confim value: 054f3f5a1b25fbaf62c5443412812a51
> HCI Event: Number of Completed Packets (0x13) plen 5    #187 [hci1] 13.705738
        Num handles: 1
        Handle: 975 Address: DF:A9:FF:F6:B1:1A (OUI DF-A9-FF)
        Count: 1
        #186: len 21 (1 Kb/s)
        Latency: 154 msec (84-172 msec ~159 msec)
> ACL Data RX: Handle 975 flags 0x02 dlen 21              #188 [hci1] 13.706012
      SMP: Pairing Random (0x04) len 16
        Random value: 5349fb0857ebe8b90000000000000000
< HCI Command: Host Number of Com.. (0x03|0x0035) plen 5  #189 [hci1] 13.711524
        Num handles: 1
        Handle: 975 Address: DF:A9:FF:F6:B1:1A (OUI DF-A9-FF)
        Count: 1
< ACL Data TX: Handle 975 flags 0x00 dlen 21              #190 [hci1] 13.711597
      SMP: Pairing Random (0x04) len 16
        Random value: 58f6b41f855a6f6c3560debd84e2affc
> HCI Event: Number of Completed Packets (0x13) plen 5    #191 [hci1] 13.880477
        Num handles: 1
        Handle: 975 Address: DF:A9:FF:F6:B1:1A (OUI DF-A9-FF)
        Count: 1
        #190: len 21 (1 Kb/s)
        Latency: 168 msec (84-172 msec ~163 msec)
> ACL Data RX: Handle 975 flags 0x02 dlen 21              #192 [hci1] 13.968304
      SMP: Pairing Confirm (0x03) len 16
        Confim value: 59664cd14177cc60b8508920144ba821
< HCI Command: Host Number of Com.. (0x03|0x0035) plen 5  #193 [hci1] 13.971272
        Num handles: 1
        Handle: 975 Address: DF:A9:FF:F6:B1:1A (OUI DF-A9-FF)
        Count: 1
< ACL Data TX: Handle 975 flags 0x00 dlen 21              #194 [hci1] 13.971389
      SMP: Pairing Confirm (0x03) len 16
        Confim value: 47fd2bd879d7b5655e7e59a46f846f97
> HCI Event: Number of Completed Packets (0x13) plen 5    #195 [hci1] 14.143151
        Num handles: 1
        Handle: 975 Address: DF:A9:FF:F6:B1:1A (OUI DF-A9-FF)
        Count: 1
        #194: len 21 (0 Kb/s)
        Latency: 171 msec (84-172 msec ~167 msec)
> ACL Data RX: Handle 975 flags 0x02 dlen 21              #196 [hci1] 14.143501
      SMP: Pairing Random (0x04) len 16
        Random value: 94b99dad44516ce20000000000000000
< HCI Command: Host Number of Com.. (0x03|0x0035) plen 5  #197 [hci1] 14.151560
        Num handles: 1
        Handle: 975 Address: DF:A9:FF:F6:B1:1A (OUI DF-A9-FF)
        Count: 1
< ACL Data TX: Handle 975 flags 0x00 dlen 21              #198 [hci1] 14.151728
      SMP: Pairing Random (0x04) len 16
        Random value: b67e7216d5bf664139eda2b542549666
> HCI Event: Number of Completed Packets (0x13) plen 5    #199 [hci1] 14.317999
        Num handles: 1
        Handle: 975 Address: DF:A9:FF:F6:B1:1A (OUI DF-A9-FF)
        Count: 1
        #198: len 21 (1 Kb/s)
        Latency: 166 msec (84-172 msec ~167 msec)
> ACL Data RX: Handle 975 flags 0x02 dlen 21              #200 [hci1] 14.405811
      SMP: Pairing Confirm (0x03) len 16
        Confim value: 03f63823f1550827cbeebb267798eff6
< HCI Command: Host Number of Com.. (0x03|0x0035) plen 5  #201 [hci1] 14.410742
        Num handles: 1
        Handle: 975 Address: DF:A9:FF:F6:B1:1A (OUI DF-A9-FF)
        Count: 1
< ACL Data TX: Handle 975 flags 0x00 dlen 21              #202 [hci1] 14.410792
      SMP: Pairing Confirm (0x03) len 16
        Confim value: 5b75eede2b54fcab22f132a1b7a6b723
> HCI Event: Number of Completed Packets (0x13) plen 5    #203 [hci1] 14.580666
        Num handles: 1
        Handle: 975 Address: DF:A9:FF:F6:B1:1A (OUI DF-A9-FF)
        Count: 1
        #202: len 21 (0 Kb/s)
        Latency: 169 msec (84-172 msec ~168 msec)
> ACL Data RX: Handle 975 flags 0x02 dlen 21              #204 [hci1] 14.581022
      SMP: Pairing Random (0x04) len 16
        Random value: 370b8279682d9f870000000000000000
< HCI Command: Host Number of Com.. (0x03|0x0035) plen 5  #205 [hci1] 14.591321
        Num handles: 1
        Handle: 975 Address: DF:A9:FF:F6:B1:1A (OUI DF-A9-FF)
        Count: 1
< ACL Data TX: Handle 975 flags 0x00 dlen 21              #206 [hci1] 14.591517
      SMP: Pairing Random (0x04) len 16
        Random value: ed17f76500c95219dd01e09d1e63f87b
> HCI Event: Number of Completed Packets (0x13) plen 5    #207 [hci1] 14.755423
        Num handles: 1
        Handle: 975 Address: DF:A9:FF:F6:B1:1A (OUI DF-A9-FF)
        Count: 1
        #206: len 21 (1 Kb/s)
        Latency: 163 msec (84-172 msec ~166 msec)
> ACL Data RX: Handle 975 flags 0x02 dlen 21              #208 [hci1] 14.843332
      SMP: Pairing Confirm (0x03) len 16
        Confim value: 48beacba5363cf638605400b85f21a24
< HCI Command: Host Number of Com.. (0x03|0x0035) plen 5  #209 [hci1] 14.851246
        Num handles: 1
        Handle: 975 Address: DF:A9:FF:F6:B1:1A (OUI DF-A9-FF)
        Count: 1
< ACL Data TX: Handle 975 flags 0x00 dlen 21              #210 [hci1] 14.851381
      SMP: Pairing Confirm (0x03) len 16
        Confim value: 36ef9c53596dc3f4bc7d93dc1cb9e214
> HCI Event: Number of Completed Packets (0x13) plen 5    #211 [hci1] 15.018120
        Num handles: 1
        Handle: 975 Address: DF:A9:FF:F6:B1:1A (OUI DF-A9-FF)
        Count: 1
        #210: len 21 (1 Kb/s)
        Latency: 166 msec (84-172 msec ~166 msec)
> ACL Data RX: Handle 975 flags 0x02 dlen 21              #212 [hci1] 15.018540
      SMP: Pairing Random (0x04) len 16
        Random value: f64084fc9e8786b30000000000000000
< HCI Command: Host Number of Com.. (0x03|0x0035) plen 5  #213 [hci1] 15.031534
        Num handles: 1
        Handle: 975 Address: DF:A9:FF:F6:B1:1A (OUI DF-A9-FF)
        Count: 1
< ACL Data TX: Handle 975 flags 0x00 dlen 21              #214 [hci1] 15.031700
      SMP: Pairing Random (0x04) len 16
        Random value: 81d35d47e1f6006d79c974bd9d9e1ee3
> HCI Event: Number of Completed Packets (0x13) plen 5    #215 [hci1] 15.192998
        Num handles: 1
        Handle: 975 Address: DF:A9:FF:F6:B1:1A (OUI DF-A9-FF)
        Count: 1
        #214: len 21 (1 Kb/s)
        Latency: 161 msec (84-172 msec ~163 msec)
> ACL Data RX: Handle 975 flags 0x02 dlen 21              #216 [hci1] 15.280787
      SMP: Pairing Confirm (0x03) len 16
        Confim value: 34705c03788a4639c7a17670ee25fea1
< HCI Command: Host Number of Com.. (0x03|0x0035) plen 5  #217 [hci1] 15.291271
        Num handles: 1
        Handle: 975 Address: DF:A9:FF:F6:B1:1A (OUI DF-A9-FF)
        Count: 1
< ACL Data TX: Handle 975 flags 0x00 dlen 21              #218 [hci1] 15.291385
      SMP: Pairing Confirm (0x03) len 16
        Confim value: 54a09afb189da17ad43a630ac9db5835
> HCI Event: Number of Completed Packets (0x13) plen 5    #219 [hci1] 15.455686
        Num handles: 1
        Handle: 975 Address: DF:A9:FF:F6:B1:1A (OUI DF-A9-FF)
        Count: 1
        #218: len 21 (1 Kb/s)
        Latency: 164 msec (84-172 msec ~164 msec)
> ACL Data RX: Handle 975 flags 0x02 dlen 21              #220 [hci1] 15.455947
      SMP: Pairing Random (0x04) len 16
        Random value: e2335ba2d78809030000000000000000
< HCI Command: Host Number of Com.. (0x03|0x0035) plen 5  #221 [hci1] 15.471015
        Num handles: 1
        Handle: 975 Address: DF:A9:FF:F6:B1:1A (OUI DF-A9-FF)
        Count: 1
< ACL Data TX: Handle 975 flags 0x00 dlen 21              #222 [hci1] 15.471085
      SMP: Pairing Random (0x04) len 16
        Random value: e7f7e0c2476823e41736a7e381bafb7c
> HCI Event: Number of Completed Packets (0x13) plen 5    #223 [hci1] 15.630398
        Num handles: 1
        Handle: 975 Address: DF:A9:FF:F6:B1:1A (OUI DF-A9-FF)
        Count: 1
        #222: len 21 (1 Kb/s)
        Latency: 159 msec (84-172 msec ~161 msec)
> ACL Data RX: Handle 975 flags 0x02 dlen 21              #224 [hci1] 15.718328
      SMP: Pairing Confirm (0x03) len 16
        Confim value: bbcd50949bea3f74b6473e282e476384
< HCI Command: Host Number of Com.. (0x03|0x0035) plen 5  #225 [hci1] 15.731418
        Num handles: 1
        Handle: 975 Address: DF:A9:FF:F6:B1:1A (OUI DF-A9-FF)
        Count: 1
< ACL Data TX: Handle 975 flags 0x00 dlen 21              #226 [hci1] 15.731585
      SMP: Pairing Confirm (0x03) len 16
        Confim value: 172cf505ade642915b90474046333533
> HCI Event: Number of Completed Packets (0x13) plen 5    #227 [hci1] 15.893146
        Num handles: 1
        Handle: 975 Address: DF:A9:FF:F6:B1:1A (OUI DF-A9-FF)
        Count: 1
        #226: len 21 (1 Kb/s)
        Latency: 161 msec (84-172 msec ~161 msec)
> ACL Data RX: Handle 975 flags 0x02 dlen 21              #228 [hci1] 15.893458
      SMP: Pairing Random (0x04) len 16
        Random value: 32fba36c5ea1396b0000000000000000
< HCI Command: Host Number of Com.. (0x03|0x0035) plen 5  #229 [hci1] 15.911406
        Num handles: 1
        Handle: 975 Address: DF:A9:FF:F6:B1:1A (OUI DF-A9-FF)
        Count: 1
