Bluetooth monitor ver 5.72
= Note: Linux version 6.14.0-36-generic (x86_64)                       0.610442
= Note: Bluetooth subsystem version 2.22                               0.610444
= New Index: 00:00:00:00:00:00 (Primary,UART,hci1)              [hci1] 0.610445
= New Index: 48:5F:99:8E:E0:64 (Primary,USB,hci0)               [hci0] 0.610445
= Open Index: 00:00:00:00:00:00                                 [hci1] 0.724145
= Index Info: 00:00:00:00:00:00 (Nordic Semiconductor ASA)      [hci1] 0.724164
@ USER Open: main (privileged) version 2.22            {0x0001} [hci1] 0.724173
< HCI Command: Reset (0x03|0x0003) plen 0                    #1 [hci1] 0.725310
> HCI Event: Command Complete (0x0e) plen 4                  #2 [hci1] 0.725925
      Reset (0x03|0x0003) ncmd 1
        Status: Success (0x00)
< HCI Command: Read Local Supported... (0x04|0x0003) plen 0  #3 [hci1] 0.744007
> HCI Event: Command Complete (0x0e) plen 12                 #4 [hci1] 0.744584
      Read Local Supported Features (0x04|0x0003) ncmd 1
        Status: Success (0x00)
        Features: 0x00 0x00 0x00 0x00 0x60 0x00 0x00 0x00
          BR/EDR Not Supported
          LE Supported (Controller)
< HCI Command: Read Local Version In.. (0x04|0x0001) plen 0  #5 [hci1] 0.763712
> HCI Event: Command Complete (0x0e) plen 12                 #6 [hci1] 0.764293
      Read Local Version Information (0x04|0x0001) ncmd 1
        Status: Success (0x00)
        HCI version: Reserved (0x0f) - Revision 12393 (0x3069)
        LMP version: Reserved (0x0f) - Subversion 12393 (0x3069)
        Manufacturer: Nordic Semiconductor ASA (89)
< HCI Command: Read Local Supported... (0x04|0x0002) plen 0  #7 [hci1] 0.783673
> HCI Event: Command Complete (0x0e) plen 68                 #8 [hci1] 0.784759
      Read Local Supported Commands (0x04|0x0002) ncmd 1
        Status: Success (0x00)
        Commands: 119 entries
          Disconnect (Octet 0 - Bit 5)
          Read Remote Version Information (Octet 2 - Bit 7)
          Set Event Mask (Octet 5 - Bit 6)
          Reset (Octet 5 - Bit 7)
          Read Connection Accept Timeout (Octet 7 - Bit 2)
          Write Connection Accept Timeout (Octet 7 - Bit 3)
          Read Transmit Power Level (Octet 10 - Bit 2)
          Set Controller To Host Flow Control (Octet 10 - Bit 5)
          Host Buffer Size (Octet 10 - Bit 6)
          Host Number of Completed Packets (Octet 10 - Bit 7)
          Read Local Version Information (Octet 14 - Bit 3)
          Read Local Supported Features (Octet 14 - Bit 5)
          Read BD ADDR (Octet 15 - Bit 1)
          Read RSSI (Octet 15 - Bit 5)
          Set Event Mask Page 2 (Octet 22 - Bit 2)
          LE Set Event Mask (Octet 25 - Bit 0)
          LE Read Buffer Size (Octet 25 - Bit 1)
          LE Read Local Supported Features (Octet 25 - Bit 2)
          LE Set Random Address (Octet 25 - Bit 4)
          LE Set Advertising Parameters (Octet 25 - Bit 5)
          LE Read Advertising Channel TX Power (Octet 25 - Bit 6)
          LE Set Advertising Data (Octet 25 - Bit 7)
          LE Set Scan Response Data (Octet 26 - Bit 0)
          LE Set Advertise Enable (Octet 26 - Bit 1)
          LE Set Scan Parameters (Octet 26 - Bit 2)
          LE Set Scan Enable (Octet 26 - Bit 3)
          LE Create Connection (Octet 26 - Bit 4)
          LE Create Connection Cancel (Octet 26 - Bit 5)
          LE Read Accept List Size (Octet 26 - Bit 6)
          LE Clear Accept List (Octet 26 - Bit 7)
          LE Add Device To Accept List (Octet 27 - Bit 0)
          LE Remove Device From Accept List (Octet 27 - Bit 1)
          LE Connection Update (Octet 27 - Bit 2)
          LE Set Host Channel Classification (Octet 27 - Bit 3)
          LE Read Channel Map (Octet 27 - Bit 4)
          LE Read Remote Used Features (Octet 27 - Bit 5)
          LE Encrypt (Octet 27 - Bit 6)
          LE Rand (Octet 27 - Bit 7)
          LE Start Encryption (Octet 28 - Bit 0)
          LE Long Term Key Request Reply (Octet 28 - Bit 1)
          LE Long Term Key Request Neg Reply (Octet 28 - Bit 2)
          LE Read Supported States (Octet 28 - Bit 3)
          LE Receiver Test (Octet 28 - Bit 4)
          LE Transmitter Test (Octet 28 - Bit 5)
          LE Test End (Octet 28 - Bit 6)
          Read Authenticated Payload Timeout (Octet 32 - Bit 4)
          Write Authenticated Payload Timeout (Octet 32 - Bit 5)
          LE Set Data Length (Octet 33 - Bit 6)
          LE Read Suggested Default Data Length (Octet 33 - Bit 7)
          LE Write Suggested Default Data Length (Octet 34 - Bit 0)
          LE Add Device To Resolving List (Octet 34 - Bit 3)
          LE Remove Device From Resolving List (Octet 34 - Bit 4)
          LE Clear Resolving List (Octet 34 - Bit 5)
          LE Read Resolving List Size (Octet 34 - Bit 6)
          LE Set Address Resolution Enable (Octet 35 - Bit 1)
          LE Set Resolvable Private Address Timeout (Octet 35 - Bit 2)
          LE Read Maximum Data Length (Octet 35 - Bit 3)
          LE Read PHY (Octet 35 - Bit 4)
          LE Set Default PHY (Octet 35 - Bit 5)
          LE Set PHY (Octet 35 - Bit 6)
          LE Enhanced Receiver Test (Octet 35 - Bit 7)
          LE Enhanced Transmitter Test (Octet 36 - Bit 0)
          LE Set Advertising Set Random Address (Octet 36 - Bit 1)
          LE Set Extended Advertising Parameters (Octet 36 - Bit 2)
          LE Set Extended Advertising Data (Octet 36 - Bit 3)
          LE Set Extended Scan Response Data (Octet 36 - Bit 4)
          LE Set Extended Advertising Enable (Octet 36 - Bit 5)
          LE Read Maximum Advertising Data Length (Octet 36 - Bit 6)
          LE Read Number of Supported Advertising Sets (Octet 36 - Bit 7)
          LE Remove Advertising Set (Octet 37 - Bit 0)
          LE Clear Advertising Sets (Octet 37 - Bit 1)
          LE Set Periodic Advertising Parameters (Octet 37 - Bit 2)
          LE Set Periodic Advertising Data (Octet 37 - Bit 3)
          LE Set Periodic Advertising Enable (Octet 37 - Bit 4)
          LE Set Extended Scan Parameters (Octet 37 - Bit 5)
          LE Set Extended Scan Enable (Octet 37 - Bit 6)
          LE Extended Create Connection (Octet 37 - Bit 7)
          LE Periodic Advertising Create Sync (Octet 38 - Bit 0)
          LE Periodic Advertising Create Sync Cancel (Octet 38 - Bit 1)
          LE Periodic Advertising Terminate Sync (Octet 38 - Bit 2)
          LE Add Device To Periodic Advertiser List (Octet 38 - Bit 3)
          LE Remove Device From Periodic Advertiser List (Octet 38 - Bit 4)
          LE Clear Periodic Advertiser List (Octet 38 - Bit 5)
          LE Read Periodic Advertiser List Size (Octet 38 - Bit 6)
          LE Read Transmit Power (Octet 38 - Bit 7)
          LE Read RF Path Compensation (Octet 39 - Bit 0)
          LE Write RF Path Compensation (Octet 39 - Bit 1)
          LE Set Privacy Mode (Octet 39 - Bit 2)
          LE Periodic Advertising Receive Enable (Octet 40 - Bit 5)
          LE Periodic Advertising Sync Transfer (Octet 40 - Bit 6)
          LE Periodic Advertising Set Info Transfer (Octet 40 - Bit 7)
          LE Periodic Advertising Sync Transfer Parameters (Octet 41 - Bit 0)
          LE Set Default Periodic Advertisng Sync Transfer Parameters (Octet 41 - Bit 1)
          LE Read Buffer v2 (Octet 41 - Bit 5)
          LE Read ISO TX Sync (Octet 41 - Bit 6)
          LE Set Connected Isochronous Group Parameters (Octet 41 - Bit 7)
          LE Set Connected Isochronous Group Parameters Test (Octet 42 - Bit 0)
          LE Create Connected Isochronous Stream (Octet 42 - Bit 1)
          LE Remove Connected Isochronous Group (Octet 42 - Bit 2)
          LE Accept Connected Isochronous Stream Request (Octet 42 - Bit 3)
          LE Reject Connected Isochronous Stream Request (Octet 42 - Bit 4)
          LE Create Broadcast Isochronous Group (Octet 42 - Bit 5)
          LE Create Broadcast Isochronous Group Test (Octet 42 - Bit 6)
          LE Terminate Broadcast Isochronous Group (Octet 42 - Bit 7)
          LE Broadcast Isochronous Group Create Sync (Octet 43 - Bit 0)
          LE Broadcast Isochronous Group Terminate Sync (Octet 43 - Bit 1)
          LE Request Peer SCA (Octet 43 - Bit 2)
          LE Setup Isochronous Data Path (Octet 43 - Bit 3)
          LE Remove Isochronous Data Path (Octet 43 - Bit 4)
          LE Isochronous Transmit Test (Octet 43 - Bit 5)
          LE Isochronous Receive Test (Octet 43 - Bit 6)
          LE Isochronous Read Test Counters (Octet 43 - Bit 7)
          LE Isochronous Read Test Counters (Octet 44 - Bit 0)
          LE Set Host Feature (Octet 44 - Bit 1)
          Octet 44 - Bit 2 
          Octet 45 - Bit 6 
          Octet 46 - Bit 0 
          Octet 46 - Bit 1 
          Octet 46 - Bit 2 
< HCI Command: Host Buffer Size (0x03|0x0033) plen 7         #9 [hci1] 0.803670
        ACL MTU: 255  ACL max packet: 16
        SCO MTU: 0    SCO max packet: 0
> HCI Event: Command Complete (0x0e) plen 4                 #10 [hci1] 0.804270
      Host Buffer Size (0x03|0x0033) ncmd 1
        Status: Success (0x00)
< HCI Command: Set Controller To Ho.. (0x03|0x0031) plen 1  #11 [hci1] 0.823657
        Flow control: ACL Data Packets (0x01)
> HCI Event: Command Complete (0x0e) plen 4                 #12 [hci1] 0.824087
      Set Controller To Host Flow Control (0x03|0x0031) ncmd 1
        Status: Success (0x00)
< HCI Command: LE Read Local Suppor.. (0x08|0x0003) plen 0  #13 [hci1] 0.843667
> HCI Event: Command Complete (0x0e) plen 12                #14 [hci1] 0.844182
      LE Read Local Supported Features (0x08|0x0003) ncmd 1
        Status: Success (0x00)
        Features: 0xfd 0x79 0x00 0xf7 0x30 0x01 0x00 0x00
          LE Encryption
          Extended Reject Indication
          Peripheral-initiated Features Exchange
          LE Ping
          LE Data Packet Length Extension
          LL Privacy
          Extended Scanner Filter Policies
          LE 2M PHY
          LE Coded PHY
          LE Extended Advertising
          LE Periodic Advertising
          Channel Selection Algorithm #2
          Periodic Advertising Sync Transfer - Sender
          Periodic Advertising Sync Transfer - Recipient
          Sleep Clock Accuracy Updates
          Connected Isochronous Stream - Central
          Connected Isochronous Stream - Peripheral
          Isochronous Broadcaster
          Synchronized Receiver
          Periodic Advertising ADI support
          Connection Subrating
          Unknown features (0x0000010000000000)
< HCI Command: LE Set Host Feature (0x08|0x0074) plen 2     #15 [hci1] 0.863639
        Bit Number: 32
          Connected Isochronous Stream (Host Support)
        Bit Value: 1
> HCI Event: Command Complete (0x0e) plen 4                 #16 [hci1] 0.864111
      LE Set Host Feature (0x08|0x0074) ncmd 1
        Status: Success (0x00)
< HCI Command: LE Read Buffer v2 (0x08|0x0060) plen 0       #17 [hci1] 0.883666
> HCI Event: Command Complete (0x0e) plen 10                #18 [hci1] 0.884151
      LE Read Buffer v2 (0x08|0x0060) ncmd 1
        Status: Success (0x00)
        ACL MTU: 27
        ACL max packet: 3
        ISO MTU: 318
        ISO max packet: 3
< HCI Command: LE Read Maximum Adve.. (0x08|0x003a) plen 0  #19 [hci1] 0.903698
> HCI Event: Command Complete (0x0e) plen 6                 #20 [hci1] 0.904136
      LE Read Maximum Advertising Data Length (0x08|0x003a) ncmd 1
        Status: Success (0x00)
        Max length: 1650
< HCI Command: LE Read Supported St.. (0x08|0x001c) plen 0  #21 [hci1] 0.923641
> HCI Event: Command Complete (0x0e) plen 12                #22 [hci1] 0.924133
      LE Read Supported States (0x08|0x001c) ncmd 1
        Status: Success (0x00)
        States: 0x000003ff3e0306ff
          Non-connectable Advertising State
          Scannable Advertising State
          Connectable Advertising State
          High Duty Cycle Directed Advertising State
          Passive Scanning State
          Active Scanning State
          Initiating State
            and Connection State (Central Role)
          Connection State (Peripheral Role)
          Scannable Advertising State
            and Passive Scanning State
          Connectable Advertising State
            and Passive Scanning State
          Non-connectable Advertising State
            and Initiating State
          Scannable Advertising State
            and Initiating State
          Active Scanning State
            and Connection State (Central Role)
          Passive Scanning State
            and Connection State (Peripheral Role)
          Active Scanning State
            and Connection State (Peripheral Role)
          Initiating State
            and Connection State (Central Role)
            and Central Role & Central Role
          Low Duty Cycle Directed Advertising State
          Connectable Advertising State
            and Initiating State
            and Central Role & Peripheral Role
          High Duty Cycle Directed Advertising State
            and Initiating State
            and Central Role & Peripheral Role
          Low Duty Cycle Directed Advertising State
            and Initiating State
            and Central Role & Peripheral Role
          Connectable Advertising State
            and Connection State (Central Role)
            and Central Role & Peripheral Role
          High Duty Cycle Directed Advertising State
            and Connection State (Central Role)
            and Central Role & Peripheral Role
          Low Duty Cycle Directed Advertising State
            and Connection State (Central Role)
            and Central Role & Peripheral Role
          Connectable Advertising State
            and Connection State (Peripheral Role)
            and Central Role & Peripheral Role
          High Duty Cycle Directed Advertising State
            and Connection State (Peripheral Role)
            and Peripheral Role & Peripheral Role
          Low Duty Cycle Directed Advertising State
            and Connection State (Peripheral Role)
            and Peripheral Role & Peripheral Role
          Initiating State
            and Connection State (Peripheral Role)
            and Central Role & Peripheral Role
< HCI Command: LE Read Maximum Data.. (0x08|0x002f) plen 0  #23 [hci1] 0.943631
> HCI Event: Command Complete (0x0e) plen 12                #24 [hci1] 0.944131
      LE Read Maximum Data Length (0x08|0x002f) ncmd 1
        Status: Success (0x00)
        Max TX octets: 251
        Max TX time: 2704
        Max RX octets: 251
        Max RX time: 2704
< HCI Command: LE Write Suggested D.. (0x08|0x0024) plen 4  #25 [hci1] 0.963609
        TX octets: 251
        TX time: 2704
> HCI Event: Command Complete (0x0e) plen 4                 #26 [hci1] 0.964090
      LE Write Suggested Default Data Length (0x08|0x0024) ncmd 1
        Status: Success (0x00)
< HCI Command: LE Read Resolving Li.. (0x08|0x002a) plen 0  #27 [hci1] 0.983675
> HCI Event: Command Complete (0x0e) plen 5                 #28 [hci1] 0.984095
      LE Read Resolving List Size (0x08|0x002a) ncmd 1
        Status: Success (0x00)
        Size: 8
< HCI Command: LE Set Event Mask (0x08|0x0001) plen 8       #29 [hci1] 1.003635
        Mask: 0x000002023f87fa5e
          LE Advertising Report
          LE Connection Update Complete
          LE Read Remote Used Features Complete
          LE Long Term Key Request
          LE Data Length Change
          LE Enhanced Connection Complete
          LE PHY Update Complete
          LE Extended Advertising Report
          LE Periodic Advertising Sync Established
          LE Periodic Advertising Report
          LE Periodic Advertising Sync Lost
          LE Extended Scan Timeout
          LE Extended Advertising Set Terminated
          LE Scan Request Received
          LE Periodic Advertising Sync Transfer Rvc
          LE CIS Established
          LE CIS Request
          LE Create BIG Complete
          LE Terminate BIG Complete
          LE BIG Sync Estabilished Complete
          LE BIG Sync Lost
          LE BIG Info Advertising Report
          Unknown mask (0x0000020000000000)
> HCI Event: Command Complete (0x0e) plen 4                 #30 [hci1] 1.004093
      LE Set Event Mask (0x08|0x0001) ncmd 1
        Status: Success (0x00)
< HCI Command: Set Event Mask (0x03|0x0001) plen 8          #31 [hci1] 1.023652
        Mask: 0x2000800002008890
          Disconnection Complete
          Encryption Change
          Read Remote Version Information Complete
          Hardware Error
          Data Buffer Overflow
          Encryption Key Refresh Complete
          LE Meta
> HCI Event: Command Complete (0x0e) plen 4                 #32 [hci1] 1.024206
      Set Event Mask (0x03|0x0001) ncmd 1
        Status: Success (0x00)
< HCI Command: Read BD ADDR (0x04|0x0009) plen 0            #33 [hci1] 1.043633
> HCI Event: Command Complete (0x0e) plen 10                #34 [hci1] 1.044138
      Read BD ADDR (0x04|0x0009) ncmd 1
        Status: Success (0x00)
        Address: 00:00:00:00:00:00 (OUI 00-00-00)
< HCI Command: LE Set Random Address (0x08|0x0005) plen 6   #35 [hci1] 1.063665
        Address: D5:B6:CC:31:DB:3B (Static)
> HCI Event: Command Complete (0x0e) plen 4                 #36 [hci1] 1.064138
      LE Set Random Address (0x08|0x0005) ncmd 1
        Status: Success (0x00)
< HCI Command: LE Set Extended Adv.. (0x08|0x0036) plen 25  #37 [hci1] 3.153646
        Handle: 0x00
        Properties: 0x0001
          Connectable
        Min advertising interval: 100.000 msec (0x00a0)
        Max advertising interval: 150.000 msec (0x00f0)
        Channel map: 37, 38, 39 (0x07)
        Own address type: Random (0x01)
        Peer address type: Public (0x00)
        Peer address: 00:00:00:00:00:00 (OUI 00-00-00)
        Filter policy: Allow Scan Request from Any, Allow Connect Request from Any (0x00)
        TX power: Host has no preference (0x7f)
        Primary PHY: LE 1M (0x01)
        Secondary max skip: 0x00
        Secondary PHY: LE 2M (0x02)
        SID: 0x00
        Scan request notifications: Disabled (0x00)
> HCI Event: Command Complete (0x0e) plen 5                 #38 [hci1] 3.154374
      LE Set Extended Advertising Parameters (0x08|0x0036) ncmd 1
        Status: Success (0x00)
        TX power (selected): 0 dbm (0x00)
< HCI Command: LE Set Advertising S.. (0x08|0x0035) plen 7  #39 [hci1] 3.163668
        Advertising handle: 0x00
        Advertising random address: D5:B6:CC:31:DB:3B (Static)
> HCI Event: Command Complete (0x0e) plen 4                 #40 [hci1] 3.164209
      LE Set Advertising Set Random Address (0x08|0x0035) ncmd 1
        Status: Success (0x00)
< HCI Command: LE Set Extended Adv.. (0x08|0x0037) plen 30  #41 [hci1] 3.183692
        Handle: 0x00
        Operation: Complete extended advertising data (0x03)
        Fragment preference: Minimize fragmentation (0x01)
        Data length: 0x1a
        Flags: 0x06
          LE General Discoverable Mode
          BR/EDR Not Supported
        Service Data: Common Audio (0x1853)
          Data: 01
        Service Data: Audio Stream Control (0x184e)
          Data: 014602420000
        Resolvable Set Identifier: 48-61-8E-0C-80-97
          Hash: 0x c8097
          Random: 0x48618e
> HCI Event: Command Complete (0x0e) plen 4                 #42 [hci1] 3.184578
      LE Set Extended Advertising Data (0x08|0x0037) ncmd 1
        Status: Success (0x00)
< HCI Command: LE Set Extended Adve.. (0x08|0x0039) plen 6  #43 [hci1] 3.203686
        Extended advertising: Enabled (0x01)
        Number of sets: 1 (0x01)
        Entry 0
          Handle: 0x00
          Duration: 0 ms (0x00)
          Max ext adv events: 0
> HCI Event: Command Complete (0x0e) plen 4                 #44 [hci1] 3.204245
      LE Set Extended Advertising Enable (0x08|0x0039) ncmd 1
        Status: Success (0x00)
> HCI Event: LE Meta Event (0x3e) plen 31                   #45 [hci1] 5.087275
      LE Enhanced Connection Complete (0x0a)
        Status: Success (0x00)
        Handle: 1929
        Role: Peripheral (0x01)
        Peer address type: Public (0x00)
        Peer address: DF:A9:FF:F6:B1:1A (OUI DF-A9-FF)
        Local resolvable private address: 00:00:00:00:00:00 (Non-Resolvable)
        Peer resolvable private address: 00:00:00:00:00:00 (Non-Resolvable)
        Connection interval: 100.00 msec (0x0050)
        Connection latency: 0 (0x0000)
        Supervision timeout: 25120 msec (0x09d0)
        Central clock accuracy: 0x01
> HCI Event: LE Meta Event (0x3e) plen 6                    #46 [hci1] 5.087434
      LE Advertising Set Terminated (0x12)
        Status: Success (0x00)
        Handle: 0
        Connection handle: 1929
        Number of completed extended advertising events: 0
< HCI Command: LE Read Remote Used... (0x08|0x0016) plen 2  #47 [hci1] 5.104759
        Handle: 1929 Address: DF:A9:FF:F6:B1:1A (OUI DF-A9-FF)
< ACL Data TX: Handle 1929 flags 0x00 dlen 7                #48 [hci1] 5.104783
      ATT: Exchange MTU Request (0x02) len 2
        Client RX MTU: 251
> HCI Event: Command Status (0x0f) plen 4                   #49 [hci1] 5.105353
      LE Read Remote Used Features (0x08|0x0016) ncmd 1
        Status: Success (0x00)
> HCI Event: Number of Completed Packets (0x13) plen 5      #50 [hci1] 5.289155
        Num handles: 1
        Handle: 1929 Address: DF:A9:FF:F6:B1:1A (OUI DF-A9-FF)
        Count: 1
        #48: len 7 (0 Kb/s)
        Latency: 184 msec (184-184 msec ~184 msec)
> HCI Event: LE Meta Event (0x3e) plen 12                   #51 [hci1] 5.389510
      LE Read Remote Used Features (0x04)
        Status: Success (0x00)
        Handle: 1929 Address: DF:A9:FF:F6:B1:1A (OUI DF-A9-FF)
        Features: 0x2d 0x49 0x00 0xf7 0x67 0xd9 0x00 0x80
          LE Encryption
          Extended Reject Indication
          Peripheral-initiated Features Exchange
          LE Data Packet Length Extension
          LE 2M PHY
          LE Coded PHY
          Channel Selection Algorithm #2
          Periodic Advertising Sync Transfer - Sender
          Periodic Advertising Sync Transfer - Recipient
          Sleep Clock Accuracy Updates
          Connected Isochronous Stream - Central
          Connected Isochronous Stream - Peripheral
          Isochronous Broadcaster
          Synchronized Receiver
          Connected Isochronous Stream (Host Support)
          LE Power Control Request
          LE Power Control Request
          Connection Subrating
          Connection Subrating (Host Support)
          Unknown features (0x8000d90000000000)
> ACL Data RX: Handle 1929 flags 0x02 dlen 7                #52 [hci1] 5.889271
      ATT: Exchange MTU Request (0x02) len 2
        Client RX MTU: 64
> ACL Data RX: Handle 1929 flags 0x02 dlen 7                #53 [hci1] 5.889691
      ATT: Exchange MTU Response (0x03) len 2
        Server RX MTU: 64
< HCI Command: Host Number of Compl.. (0x03|0x0035) plen 5  #54 [hci1] 5.904229
        Num handles: 1
        Handle: 1929 Address: DF:A9:FF:F6:B1:1A (OUI DF-A9-FF)
        Count: 1
< ACL Data TX: Handle 1929 flags 0x00 dlen 7                #55 [hci1] 5.904313
      ATT: Exchange MTU Response (0x03) len 2
        Server RX MTU: 251
< HCI Command: Host Number of Compl.. (0x03|0x0035) plen 5  #56 [hci1] 5.904702
        Num handles: 1
        Handle: 1929 Address: DF:A9:FF:F6:B1:1A (OUI DF-A9-FF)
        Count: 1
> HCI Event: Number of Completed Packets (0x13) plen 5      #57 [hci1] 6.089140
        Num handles: 1
        Handle: 1929 Address: DF:A9:FF:F6:B1:1A (OUI DF-A9-FF)
        Count: 1
        #55: len 7 (0 Kb/s)
        Latency: 184 msec (184-184 msec ~184 msec)
> ACL Data RX: Handle 1929 flags 0x02 dlen 11               #58 [hci1] 8.089333
      SMP: Pairing Request (0x01) len 6
        IO capability: KeyboardDisplay (0x04)
        OOB data: Authentication data not present (0x00)
        Authentication requirement: Bonding, No MITM, SC, No Keypresses (0x09)
        Max encryption key size: 16
        Initiator key distribution: EncKey IdKey Sign (0x07)
        Responder key distribution: EncKey IdKey Sign (0x07)
< HCI Command: Host Number of Compl.. (0x03|0x0035) plen 5  #59 [hci1] 8.103813
        Num handles: 1
        Handle: 1929 Address: DF:A9:FF:F6:B1:1A (OUI DF-A9-FF)
        Count: 1
< ACL Data TX: Handle 1929 flags 0x00 dlen 11               #60 [hci1] 8.103850
      SMP: Pairing Response (0x02) len 6
        IO capability: NoInputNoOutput (0x03)
        OOB data: Authentication data not present (0x00)
        Authentication requirement: Bonding, No MITM, SC, No Keypresses (0x09)
        Max encryption key size: 16
        Initiator key distribution: IdKey (0x02)
        Responder key distribution: <none> (0x00)
> HCI Event: Number of Completed Packets (0x13) plen 5      #61 [hci1] 8.289289
        Num handles: 1
        Handle: 1929 Address: DF:A9:FF:F6:B1:1A (OUI DF-A9-FF)
        Count: 1
        #60: len 11 (0 Kb/s)
        Latency: 185 msec (184-185 msec ~185 msec)
> ACL Data RX: Handle 1929 flags 0x02 dlen 27               #62 [hci1] 8.289689
> ACL Data RX: Handle 1929 flags 0x01 dlen 27               #63 [hci1] 8.289965
> ACL Data RX: Handle 1929 flags 0x01 dlen 15               #64 [hci1] 8.290270
      SMP: Pairing Public Key (0x0c) len 64
        X: ca7c3b030e520532b1697e87e7e4dd162882af40bf484ac2aed2bc50437fc58b
        Y: 24639c9326ea223a678914a6e89bcfa524d2bdbbe9644f9278a9a2c9dce73a99
< HCI Command: Host Number of Compl.. (0x03|0x0035) plen 5  #65 [hci1] 8.304168
        Num handles: 1
        Handle: 1929 Address: DF:A9:FF:F6:B1:1A (OUI DF-A9-FF)
        Count: 1
< HCI Command: Host Number of Compl.. (0x03|0x0035) plen 5  #66 [hci1] 8.304201
        Num handles: 1
        Handle: 1929 Address: DF:A9:FF:F6:B1:1A (OUI DF-A9-FF)
        Count: 1
< HCI Command: Host Number of Compl.. (0x03|0x0035) plen 5  #67 [hci1] 8.304725
        Num handles: 1
        Handle: 1929 Address: DF:A9:FF:F6:B1:1A (OUI DF-A9-FF)
        Count: 1
< ACL Data TX: Handle 1929 flags 0x00 dlen 27               #68 [hci1] 8.304737
< ACL Data TX: Handle 1929 flags 0x01 dlen 27               #69 [hci1] 8.304740
< ACL Data TX: Handle 1929 flags 0x01 dlen 15               #70 [hci1] 8.304743
      SMP: Pairing Public Key (0x0c) len 64
        X: 98308440221e2d910f0e54b71e7ec652857aa9b5a0dc65028824cc19db1226e9
        Y: 67a4816bcb62efb21701e31fdb27561a6217575fb007a8bbdabe7e28b6f68482
> HCI Event: Number of Completed Packets (0x13) plen 5      #71 [hci1] 8.389564
        Num handles: 1
        Handle: 1929 Address: DF:A9:FF:F6:B1:1A (OUI DF-A9-FF)
        Count: 1
        #68: len 27 (2 Kb/s)
        Latency: 84 msec (84-185 msec ~134 msec)
> HCI Event: Number of Completed Packets (0x13) plen 5      #72 [hci1] 8.390110
        Num handles: 1
        Handle: 1929 Address: DF:A9:FF:F6:B1:1A (OUI DF-A9-FF)
        Count: 1
        #69: len 27 (2 Kb/s)
        Latency: 85 msec (84-185 msec ~110 msec)
< ACL Data TX: Handle 1929 flags 0x00 dlen 21               #73 [hci1] 8.403739
      SMP: Pairing Confirm (0x03) len 16
        Confim value: bd664e371296c569b334fd61189007ca
> HCI Event: Number of Completed Packets (0x13) plen 5      #74 [hci1] 8.489245
        Num handles: 1
        Handle: 1929 Address: DF:A9:FF:F6:B1:1A (OUI DF-A9-FF)
        Count: 1
        #70: len 15 (0 Kb/s)
        Latency: 184 msec (84-185 msec ~147 msec)
> HCI Event: Number of Completed Packets (0x13) plen 5      #75 [hci1] 8.589294
        Num handles: 1
        Handle: 1929 Address: DF:A9:FF:F6:B1:1A (OUI DF-A9-FF)
        Count: 1
        #73: len 21 (0 Kb/s)
        Latency: 185 msec (84-185 msec ~166 msec)
> ACL Data RX: Handle 1929 flags 0x02 dlen 21               #76 [hci1] 8.589580
      SMP: Pairing Random (0x04) len 16
        Random value: c4a99848786eb6c10000000000000000
< HCI Command: Host Number of Compl.. (0x03|0x0035) plen 5  #77 [hci1] 8.604237
        Num handles: 1
        Handle: 1929 Address: DF:A9:FF:F6:B1:1A (OUI DF-A9-FF)
        Count: 1
< ACL Data TX: Handle 1929 flags 0x00 dlen 21               #78 [hci1] 8.604351
      SMP: Pairing Random (0x04) len 16
        Random value: f966a694cbe26df70bb96773e6cc6f5d
> HCI Event: Number of Completed Packets (0x13) plen 5      #79 [hci1] 8.789180
        Num handles: 1
        Handle: 1929 Address: DF:A9:FF:F6:B1:1A (OUI DF-A9-FF)
        Count: 1
        #78: len 21 (0 Kb/s)
        Latency: 184 msec (84-185 msec ~175 msec)
> ACL Data RX: Handle 1929 flags 0x02 dlen 21               #80 [hci1] 8.989462
      SMP: Pairing DHKey Check (0x0d) len 16
        E: fa74f541e48ea3727235b2833b4ffd8f
< HCI Command: Host Number of Compl.. (0x03|0x0035) plen 5  #81 [hci1] 9.004571
        Num handles: 1
        Handle: 1929 Address: DF:A9:FF:F6:B1:1A (OUI DF-A9-FF)
        Count: 1
< ACL Data TX: Handle 1929 flags 0x00 dlen 21               #82 [hci1] 9.004681
      SMP: Pairing DHKey Check (0x0d) len 16
        E: 96c3e033a3b04cd35d2837b67c77bb0e
> HCI Event: Number of Completed Packets (0x13) plen 5      #83 [hci1] 9.189106
        Num handles: 1
        Handle: 1929 Address: DF:A9:FF:F6:B1:1A (OUI DF-A9-FF)
        Count: 1
        #82: len 21 (0 Kb/s)
        Latency: 184 msec (84-185 msec ~180 msec)
> HCI Event: LE Meta Event (0x3e) plen 13                   #84 [hci1] 9.289648
      LE Long Term Key Request (0x05)
        Handle: 1929 Address: DF:A9:FF:F6:B1:1A (OUI DF-A9-FF)
        Random number: 0x0000000000000000
        Encrypted diversifier: 0x0000
< HCI Command: LE Long Term Key Re.. (0x08|0x001a) plen 18  #85 [hci1] 9.304075
        Handle: 1929 Address: DF:A9:FF:F6:B1:1A (OUI DF-A9-FF)
        Long term key: b98857372ff3b653a184bfab4f017643
> HCI Event: Command Complete (0x0e) plen 6                 #86 [hci1] 9.304792
      LE Long Term Key Request Reply (0x08|0x001a) ncmd 1
        Status: Success (0x00)
        Handle: 1929 Address: DF:A9:FF:F6:B1:1A (OUI DF-A9-FF)
> HCI Event: Encryption Change (0x08) plen 4                #87 [hci1] 9.789379
        Status: Success (0x00)
        Handle: 1929 Address: DF:A9:FF:F6:B1:1A (OUI DF-A9-FF)
        Encryption: Enabled with AES-CCM (0x01)
> ACL Data RX: Handle 1929 flags 0x02 dlen 21               #88 [hci1] 9.889504
      SMP: Identity Information (0x08) len 16
        Identity resolving key: 38715b500322509ce571c749e69234cc
< HCI Command: Host Number of Compl.. (0x03|0x0035) plen 5  #89 [hci1] 9.914435
        Num handles: 1
        Handle: 1929 Address: DF:A9:FF:F6:B1:1A (OUI DF-A9-FF)
        Count: 1
> ACL Data RX: Handle 1929 flags 0x02 dlen 12              #90 [hci1] 10.089252
      SMP: Identity Address Information (0x09) len 7
        Address: DF:A9:FF:F6:B1:1A (OUI DF-A9-FF)
< HCI Command: LE Add Device To R.. (0x08|0x0027) plen 39  #91 [hci1] 10.104001
        Address type: Public (0x00)
        Address: DF:A9:FF:F6:B1:1A (OUI DF-A9-FF)
        Peer identity resolving key: 38715b500322509ce571c749e69234cc
        Local identity resolving key: 00000000000000000000000000000000
> HCI Event: Command Complete (0x0e) plen 4                #92 [hci1] 10.104943
      LE Add Device To Resolving List (0x08|0x0027) ncmd 1
        Status: Success (0x00)
< HCI Command: LE Set Privacy Mode (0x08|0x004e) plen 8    #93 [hci1] 10.124116
        Peer Identity address type: Public (0x00)
        Peer Identity address: DF:A9:FF:F6:B1:1A (OUI DF-A9-FF)
        Privacy Mode: Use Device Privacy (0x01)
> HCI Event: Command Complete (0x0e) plen 4                #94 [hci1] 10.124775
      LE Set Privacy Mode (0x08|0x004e) ncmd 1
        Status: Success (0x00)
< HCI Command: LE Set Address Reso.. (0x08|0x002d) plen 1  #95 [hci1] 10.143994
        Address resolution: Enabled (0x01)
> HCI Event: Command Complete (0x0e) plen 4                #96 [hci1] 10.144489
      LE Set Address Resolution Enable (0x08|0x002d) ncmd 1
        Status: Success (0x00)
< HCI Command: Host Number of Comp.. (0x03|0x0035) plen 5  #97 [hci1] 10.163964
        Num handles: 1
        Handle: 1929 Address: DF:A9:FF:F6:B1:1A (OUI DF-A9-FF)
        Count: 1
> ACL Data RX: Handle 1929 flags 0x02 dlen 13              #98 [hci1] 10.189295
      ATT: Find By Type Value Request (0x06) len 8
        Handle range: 0x0001-0xffff
        Attribute type: Primary Service (0x2800)
          UUID: Published Audio Capabilities (0x1850)
< HCI Command: Host Number of Comp.. (0x03|0x0035) plen 5  #99 [hci1] 10.204723
        Num handles: 1
        Handle: 1929 Address: DF:A9:FF:F6:B1:1A (OUI DF-A9-FF)
        Count: 1
< ACL Data TX: Handle 1929 flags 0x00 dlen 9              #100 [hci1] 10.204866
      ATT: Find By Type Value Response (0x07) len 4
        Handle range: 0x00d0-0x00e2
> HCI Event: Number of Completed Packets (0x13) plen 5    #101 [hci1] 10.389226
        Num handles: 1
        Handle: 1929 Address: DF:A9:FF:F6:B1:1A (OUI DF-A9-FF)
        Count: 1
        #100: len 9 (0 Kb/s)
        Latency: 184 msec (84-185 msec ~182 msec)
> ACL Data RX: Handle 1929 flags 0x02 dlen 13             #102 [hci1] 10.389461
      ATT: Find By Type Value Request (0x06) len 8
        Handle range: 0x00e3-0xffff
        Attribute type: Primary Service (0x2800)
          UUID: Published Audio Capabilities (0x1850)
< HCI Command: Host Number of Com.. (0x03|0x0035) plen 5  #103 [hci1] 10.404592
        Num handles: 1
        Handle: 1929 Address: DF:A9:FF:F6:B1:1A (OUI DF-A9-FF)
        Count: 1
< ACL Data TX: Handle 1929 flags 0x00 dlen 9              #104 [hci1] 10.404643
      ATT: Error Response (0x01) len 4
        Find By Type Value Request (0x06)
        Handle: 0x00e3
        Error: Attribute Not Found (0x0a)
> HCI Event: Number of Completed Packets (0x13) plen 5    #105 [hci1] 10.589200
        Num handles: 1
        Handle: 1929 Address: DF:A9:FF:F6:B1:1A (OUI DF-A9-FF)
        Count: 1
        #104: len 9 (0 Kb/s)
        Latency: 184 msec (84-185 msec ~183 msec)
> ACL Data RX: Handle 1929 flags 0x02 dlen 11             #106 [hci1] 10.589495
      ATT: Read By Type Request (0x08) len 6
        Handle range: 0x00d0-0x00e2
        Attribute type: Characteristic (0x2803)
< HCI Command: Host Number of Com.. (0x03|0x0035) plen 5  #107 [hci1] 10.604396
        Num handles: 1
        Handle: 1929 Address: DF:A9:FF:F6:B1:1A (OUI DF-A9-FF)
        Count: 1
< ACL Data TX: Handle 1929 flags 0x00 dlen 27             #108 [hci1] 10.604487
< ACL Data TX: Handle 1929 flags 0x01 dlen 21             #109 [hci1] 10.604506
      ATT: Read By Type Response (0x09) len 43
        Attribute data length: 7
        Attribute data list: 6 entries
        Handle: 0x00d1
        Value: 12d200c92b
            Properties: 0x12
              Read (0x02)
              Notify (0x10)
            Value Handle: 0x00d2
            Value UUID: Sink PAC (0x2bc9)
        Handle: 0x00d4
        Value: 1ad500ca2b
            Properties: 0x1a
              Read (0x02)
              Write (0x08)
              Notify (0x10)
            Value Handle: 0x00d5
            Value UUID: Sink Audio Locations (0x2bca)
        Handle: 0x00d7
        Value: 12d800cb2b
            Properties: 0x12
              Read (0x02)
              Notify (0x10)
            Value Handle: 0x00d8
            Value UUID: Source PAC (0x2bcb)
        Handle: 0x00da
        Value: 1adb00cc2b
            Properties: 0x1a
              Read (0x02)
              Write (0x08)
              Notify (0x10)
            Value Handle: 0x00db
            Value UUID: Source Audio Locations (0x2bcc)
        Handle: 0x00dd
        Value: 12de00cd2b
            Properties: 0x12
              Read (0x02)
              Notify (0x10)
            Value Handle: 0x00de
            Value UUID: Available Audio Contexts (0x2bcd)
        Handle: 0x00e0
        Value: 12e100ce2b
            Properties: 0x12
              Read (0x02)
              Notify (0x10)
            Value Handle: 0x00e1
            Value UUID: Supported Audio Contexts (0x2bce)
> HCI Event: Number of Completed Packets (0x13) plen 5    #110 [hci1] 10.689611
        Num handles: 1
        Handle: 1929 Address: DF:A9:FF:F6:B1:1A (OUI DF-A9-FF)
        Count: 1
        #108: len 27 (2 Kb/s)
        Latency: 85 msec (84-185 msec ~134 msec)
> HCI Event: Number of Completed Packets (0x13) plen 5    #111 [hci1] 10.789192
        Num handles: 1
        Handle: 1929 Address: DF:A9:FF:F6:B1:1A (OUI DF-A9-FF)
        Count: 1
        #109: len 21 (0 Kb/s)
        Latency: 184 msec (84-185 msec ~159 msec)
> ACL Data RX: Handle 1929 flags 0x02 dlen 11             #112 [hci1] 10.789507
      ATT: Read By Type Request (0x08) len 6
        Handle range: 0x00e1-0x00e2
        Attribute type: Characteristic (0x2803)
< HCI Command: Host Number of Com.. (0x03|0x0035) plen 5  #113 [hci1] 10.804526
        Num handles: 1
        Handle: 1929 Address: DF:A9:FF:F6:B1:1A (OUI DF-A9-FF)
        Count: 1
< ACL Data TX: Handle 1929 flags 0x00 dlen 9              #114 [hci1] 10.804714
      ATT: Error Response (0x01) len 4
        Read By Type Request (0x08)
        Handle: 0x00e1
        Error: Attribute Not Found (0x0a)
> HCI Event: Number of Completed Packets (0x13) plen 5    #115 [hci1] 10.989185
        Num handles: 1
        Handle: 1929 Address: DF:A9:FF:F6:B1:1A (OUI DF-A9-FF)
        Count: 1
        #114: len 9 (0 Kb/s)
        Latency: 184 msec (84-185 msec ~171 msec)
> ACL Data RX: Handle 1929 flags 0x02 dlen 9              #116 [hci1] 10.989474
      ATT: Find Information Request (0x04) len 4
        Handle range: 0x00d3-0x00d3
< HCI Command: Host Number of Com.. (0x03|0x0035) plen 5  #117 [hci1] 11.004396
        Num handles: 1
        Handle: 1929 Address: DF:A9:FF:F6:B1:1A (OUI DF-A9-FF)
        Count: 1
< ACL Data TX: Handle 1929 flags 0x00 dlen 10             #118 [hci1] 11.004577
      ATT: Find Information Response (0x05) len 5
        Format: UUID-16 (0x01)
        Handle: 0x00d3
        UUID: Client Characteristic Configuration (0x2902)
> HCI Event: Number of Completed Packets (0x13) plen 5    #119 [hci1] 11.189227
        Num handles: 1
        Handle: 1929 Address: DF:A9:FF:F6:B1:1A (OUI DF-A9-FF)
        Count: 1
        #118: len 10 (0 Kb/s)
        Latency: 184 msec (84-185 msec ~178 msec)
> ACL Data RX: Handle 1929 flags 0x02 dlen 9              #120 [hci1] 11.189500
      ATT: Find Information Request (0x04) len 4
        Handle range: 0x00d6-0x00d6
< HCI Command: Host Number of Com.. (0x03|0x0035) plen 5  #121 [hci1] 11.204404
        Num handles: 1
        Handle: 1929 Address: DF:A9:FF:F6:B1:1A (OUI DF-A9-FF)
        Count: 1
< ACL Data TX: Handle 1929 flags 0x00 dlen 10             #122 [hci1] 11.204518
      ATT: Find Information Response (0x05) len 5
        Format: UUID-16 (0x01)
        Handle: 0x00d6
        UUID: Client Characteristic Configuration (0x2902)
> HCI Event: Number of Completed Packets (0x13) plen 5    #123 [hci1] 11.389135
        Num handles: 1
        Handle: 1929 Address: DF:A9:FF:F6:B1:1A (OUI DF-A9-FF)
        Count: 1
        #122: len 10 (0 Kb/s)
        Latency: 184 msec (84-185 msec ~181 msec)
> ACL Data RX: Handle 1929 flags 0x02 dlen 9              #124 [hci1] 11.389391
      ATT: Find Information Request (0x04) len 4
        Handle range: 0x00d9-0x00d9
< HCI Command: Host Number of Com.. (0x03|0x0035) plen 5  #125 [hci1] 11.404394
        Num handles: 1
        Handle: 1929 Address: DF:A9:FF:F6:B1:1A (OUI DF-A9-FF)
        Count: 1
< ACL Data TX: Handle 1929 flags 0x00 dlen 10             #126 [hci1] 11.404542
      ATT: Find Information Response (0x05) len 5
        Format: UUID-16 (0x01)
        Handle: 0x00d9
        UUID: Client Characteristic Configuration (0x2902)
> HCI Event: Number of Completed Packets (0x13) plen 5    #127 [hci1] 11.589229
        Num handles: 1
        Handle: 1929 Address: DF:A9:FF:F6:B1:1A (OUI DF-A9-FF)
        Count: 1
        #126: len 10 (0 Kb/s)
        Latency: 184 msec (84-185 msec ~183 msec)
> ACL Data RX: Handle 1929 flags 0x02 dlen 9              #128 [hci1] 11.589464
      ATT: Find Information Request (0x04) len 4
        Handle range: 0x00dc-0x00dc
< HCI Command: Host Number of Com.. (0x03|0x0035) plen 5  #129 [hci1] 11.604429
        Num handles: 1
        Handle: 1929 Address: DF:A9:FF:F6:B1:1A (OUI DF-A9-FF)
        Count: 1
< ACL Data TX: Handle 1929 flags 0x00 dlen 10             #130 [hci1] 11.604544
      ATT: Find Information Response (0x05) len 5
        Format: UUID-16 (0x01)
        Handle: 0x00dc
        UUID: Client Characteristic Configuration (0x2902)
> HCI Event: Number of Completed Packets (0x13) plen 5    #131 [hci1] 11.789208
        Num handles: 1
        Handle: 1929 Address: DF:A9:FF:F6:B1:1A (OUI DF-A9-FF)
        Count: 1
        #130: len 10 (0 Kb/s)
        Latency: 184 msec (84-185 msec ~183 msec)
> ACL Data RX: Handle 1929 flags 0x02 dlen 9              #132 [hci1] 11.789346
      ATT: Find Information Request (0x04) len 4
        Handle range: 0x00df-0x00df
< HCI Command: Host Number of Com.. (0x03|0x0035) plen 5  #133 [hci1] 11.804196
        Num handles: 1
        Handle: 1929 Address: DF:A9:FF:F6:B1:1A (OUI DF-A9-FF)
        Count: 1
< ACL Data TX: Handle 1929 flags 0x00 dlen 10             #134 [hci1] 11.804245
      ATT: Find Information Response (0x05) len 5
        Format: UUID-16 (0x01)
        Handle: 0x00df
        UUID: Client Characteristic Configuration (0x2902)
> HCI Event: Number of Completed Packets (0x13) plen 5    #135 [hci1] 11.989141
        Num handles: 1
        Handle: 1929 Address: DF:A9:FF:F6:B1:1A (OUI DF-A9-FF)
        Count: 1
        #134: len 10 (0 Kb/s)
        Latency: 184 msec (84-185 msec ~184 msec)
> ACL Data RX: Handle 1929 flags 0x02 dlen 9              #136 [hci1] 11.989336
      ATT: Find Information Request (0x04) len 4
        Handle range: 0x00e2-0x00e2
< HCI Command: Host Number of Com.. (0x03|0x0035) plen 5  #137 [hci1] 12.003983
        Num handles: 1
        Handle: 1929 Address: DF:A9:FF:F6:B1:1A (OUI DF-A9-FF)
        Count: 1
< ACL Data TX: Handle 1929 flags 0x00 dlen 10             #138 [hci1] 12.004002
      ATT: Find Information Response (0x05) len 5
        Format: UUID-16 (0x01)
        Handle: 0x00e2
        UUID: Client Characteristic Configuration (0x2902)
> HCI Event: Number of Completed Packets (0x13) plen 5    #139 [hci1] 12.189211
        Num handles: 1
        Handle: 1929 Address: DF:A9:FF:F6:B1:1A (OUI DF-A9-FF)
        Count: 1
        #138: len 10 (0 Kb/s)
        Latency: 185 msec (84-185 msec ~184 msec)
> ACL Data RX: Handle 1929 flags 0x02 dlen 13             #140 [hci1] 12.189496
      ATT: Find By Type Value Request (0x06) len 8
        Handle range: 0x0001-0xffff
        Attribute type: Primary Service (0x2800)
          UUID: Audio Stream Control (0x184e)
< HCI Command: Host Number of Com.. (0x03|0x0035) plen 5  #141 [hci1] 12.204905
        Num handles: 1
        Handle: 1929 Address: DF:A9:FF:F6:B1:1A (OUI DF-A9-FF)
        Count: 1
< ACL Data TX: Handle 1929 flags 0x00 dlen 9              #142 [hci1] 12.205055
      ATT: Find By Type Value Response (0x07) len 4
        Handle range: 0x00e3-0x00f2
> HCI Event: Number of Completed Packets (0x13) plen 5    #143 [hci1] 12.389231
        Num handles: 1
        Handle: 1929 Address: DF:A9:FF:F6:B1:1A (OUI DF-A9-FF)
        Count: 1
        #142: len 9 (0 Kb/s)
        Latency: 184 msec (84-185 msec ~184 msec)
> ACL Data RX: Handle 1929 flags 0x02 dlen 13             #144 [hci1] 12.389499
      ATT: Find By Type Value Request (0x06) len 8
        Handle range: 0x00f3-0xffff
        Attribute type: Primary Service (0x2800)
          UUID: Audio Stream Control (0x184e)
< HCI Command: Host Number of Com.. (0x03|0x0035) plen 5  #145 [hci1] 12.404558
        Num handles: 1
        Handle: 1929 Address: DF:A9:FF:F6:B1:1A (OUI DF-A9-FF)
        Count: 1
< ACL Data TX: Handle 1929 flags 0x00 dlen 9              #146 [hci1] 12.404735
      ATT: Error Response (0x01) len 4
        Find By Type Value Request (0x06)
        Handle: 0x00f3
        Error: Attribute Not Found (0x0a)
> HCI Event: Number of Completed Packets (0x13) plen 5    #147 [hci1] 12.589235
        Num handles: 1
        Handle: 1929 Address: DF:A9:FF:F6:B1:1A (OUI DF-A9-FF)
        Count: 1
        #146: len 9 (0 Kb/s)
        Latency: 184 msec (84-185 msec ~184 msec)
> ACL Data RX: Handle 1929 flags 0x02 dlen 11             #148 [hci1] 12.589422
      ATT: Read By Type Request (0x08) len 6
        Handle range: 0x00e3-0x00f2
        Attribute type: Characteristic (0x2803)
< HCI Command: Host Number of Com.. (0x03|0x0035) plen 5  #149 [hci1] 12.604501
        Num handles: 1
        Handle: 1929 Address: DF:A9:FF:F6:B1:1A (OUI DF-A9-FF)
        Count: 1
< ACL Data TX: Handle 1929 flags 0x00 dlen 27             #150 [hci1] 12.604549
< ACL Data TX: Handle 1929 flags 0x01 dlen 14             #151 [hci1] 12.604598
      ATT: Read By Type Response (0x09) len 36
        Attribute data length: 7
        Attribute data list: 5 entries
        Handle: 0x00e4
        Value: 1ce500c62b
            Properties: 0x1c
              Write Without Response (0x04)
              Write (0x08)
              Notify (0x10)
            Value Handle: 0x00e5
            Value UUID: ASE Control Point (0x2bc6)
        Handle: 0x00e7
        Value: 12e800c42b
            Properties: 0x12
              Read (0x02)
              Notify (0x10)
            Value Handle: 0x00e8
            Value UUID: Sink ASE (0x2bc4)
        Handle: 0x00ea
        Value: 12eb00c42b
            Properties: 0x12
              Read (0x02)
              Notify (0x10)
            Value Handle: 0x00eb
            Value UUID: Sink ASE (0x2bc4)
        Handle: 0x00ed
        Value: 12ee00c52b
            Properties: 0x12
              Read (0x02)
              Notify (0x10)
            Value Handle: 0x00ee
            Value UUID: Source ASE (0x2bc5)
        Handle: 0x00f0
        Value: 12f100c52b
            Properties: 0x12
              Read (0x02)
              Notify (0x10)
            Value Handle: 0x00f1
            Value UUID: Source ASE (0x2bc5)
> HCI Event: Number of Completed Packets (0x13) plen 5    #152 [hci1] 12.689545
        Num handles: 1
        Handle: 1929 Address: DF:A9:FF:F6:B1:1A (OUI DF-A9-FF)
        Count: 1
        #150: len 27 (2 Kb/s)
        Latency: 84 msec (84-185 msec ~134 msec)
> HCI Event: Number of Completed Packets (0x13) plen 5    #153 [hci1] 12.789169
        Num handles: 1
        Handle: 1929 Address: DF:A9:FF:F6:B1:1A (OUI DF-A9-FF)
        Count: 1
        #151: len 14 (0 Kb/s)
        Latency: 184 msec (84-185 msec ~159 msec)
> ACL Data RX: Handle 1929 flags 0x02 dlen 11             #154 [hci1] 12.789370
      ATT: Read By Type Request (0x08) len 6
        Handle range: 0x00f1-0x00f2
        Attribute type: Characteristic (0x2803)
< HCI Command: Host Number of Com.. (0x03|0x0035) plen 5  #155 [hci1] 12.804458
        Num handles: 1
        Handle: 1929 Address: DF:A9:FF:F6:B1:1A (OUI DF-A9-FF)
        Count: 1
< ACL Data TX: Handle 1929 flags 0x00 dlen 9              #156 [hci1] 12.804664
      ATT: Error Response (0x01) len 4
        Read By Type Request (0x08)
        Handle: 0x00f1
        Error: Attribute Not Found (0x0a)
> HCI Event: Number of Completed Packets (0x13) plen 5    #157 [hci1] 12.989148
        Num handles: 1
        Handle: 1929 Address: DF:A9:FF:F6:B1:1A (OUI DF-A9-FF)
        Count: 1
        #156: len 9 (0 Kb/s)
        Latency: 184 msec (84-185 msec ~172 msec)
> ACL Data RX: Handle 1929 flags 0x02 dlen 9              #158 [hci1] 12.989508
      ATT: Find Information Request (0x04) len 4
        Handle range: 0x00e6-0x00e6
< HCI Command: Host Number of Com.. (0x03|0x0035) plen 5  #159 [hci1] 13.004516
        Num handles: 1
        Handle: 1929 Address: DF:A9:FF:F6:B1:1A (OUI DF-A9-FF)
        Count: 1
< ACL Data TX: Handle 1929 flags 0x00 dlen 10             #160 [hci1] 13.004629
      ATT: Find Information Response (0x05) len 5
        Format: UUID-16 (0x01)
        Handle: 0x00e6
        UUID: Client Characteristic Configuration (0x2902)
> HCI Event: Number of Completed Packets (0x13) plen 5    #161 [hci1] 13.189168
        Num handles: 1
        Handle: 1929 Address: DF:A9:FF:F6:B1:1A (OUI DF-A9-FF)
        Count: 1
        #160: len 10 (0 Kb/s)
        Latency: 184 msec (84-185 msec ~178 msec)
> ACL Data RX: Handle 1929 flags 0x02 dlen 9              #162 [hci1] 13.189403
      ATT: Find Information Request (0x04) len 4
        Handle range: 0x00e9-0x00e9
< HCI Command: Host Number of Com.. (0x03|0x0035) plen 5  #163 [hci1] 13.204347
        Num handles: 1
        Handle: 1929 Address: DF:A9:FF:F6:B1:1A (OUI DF-A9-FF)
        Count: 1
< ACL Data TX: Handle 1929 flags 0x00 dlen 10             #164 [hci1] 13.204515
      ATT: Find Information Response (0x05) len 5
        Format: UUID-16 (0x01)
        Handle: 0x00e9
        UUID: Client Characteristic Configuration (0x2902)
> HCI Event: Number of Completed Packets (0x13) plen 5    #165 [hci1] 13.389229
        Num handles: 1
        Handle: 1929 Address: DF:A9:FF:F6:B1:1A (OUI DF-A9-FF)
        Count: 1
        #164: len 10 (0 Kb/s)
        Latency: 184 msec (84-185 msec ~181 msec)
> ACL Data RX: Handle 1929 flags 0x02 dlen 9              #166 [hci1] 13.389406
      ATT: Find Information Request (0x04) len 4
        Handle range: 0x00ec-0x00ec
< HCI Command: Host Number of Com.. (0x03|0x0035) plen 5  #167 [hci1] 13.404452
        Num handles: 1
        Handle: 1929 Address: DF:A9:FF:F6:B1:1A (OUI DF-A9-FF)
        Count: 1
< ACL Data TX: Handle 1929 flags 0x00 dlen 10             #168 [hci1] 13.404602
      ATT: Find Information Response (0x05) len 5
        Format: UUID-16 (0x01)
        Handle: 0x00ec
        UUID: Client Characteristic Configuration (0x2902)
> HCI Event: Number of Completed Packets (0x13) plen 5    #169 [hci1] 13.589175
        Num handles: 1
        Handle: 1929 Address: DF:A9:FF:F6:B1:1A (OUI DF-A9-FF)
        Count: 1
        #168: len 10 (0 Kb/s)
        Latency: 184 msec (84-185 msec ~183 msec)
> ACL Data RX: Handle 1929 flags 0x02 dlen 9              #170 [hci1] 13.589341
      ATT: Find Information Request (0x04) len 4
        Handle range: 0x00ef-0x00ef
< HCI Command: Host Number of Com.. (0x03|0x0035) plen 5  #171 [hci1] 13.604420
        Num handles: 1
        Handle: 1929 Address: DF:A9:FF:F6:B1:1A (OUI DF-A9-FF)
        Count: 1
< ACL Data TX: Handle 1929 flags 0x00 dlen 10             #172 [hci1] 13.604565
      ATT: Find Information Response (0x05) len 5
        Format: UUID-16 (0x01)
        Handle: 0x00ef
        UUID: Client Characteristic Configuration (0x2902)
> HCI Event: Number of Completed Packets (0x13) plen 5    #173 [hci1] 13.789183
        Num handles: 1
        Handle: 1929 Address: DF:A9:FF:F6:B1:1A (OUI DF-A9-FF)
        Count: 1
        #172: len 10 (0 Kb/s)
        Latency: 184 msec (84-185 msec ~183 msec)
> ACL Data RX: Handle 1929 flags 0x02 dlen 9              #174 [hci1] 13.789344
      ATT: Find Information Request (0x04) len 4
        Handle range: 0x00f2-0x00f2
< HCI Command: Host Number of Com.. (0x03|0x0035) plen 5  #175 [hci1] 13.804403
        Num handles: 1
        Handle: 1929 Address: DF:A9:FF:F6:B1:1A (OUI DF-A9-FF)
        Count: 1
< ACL Data TX: Handle 1929 flags 0x00 dlen 10             #176 [hci1] 13.804496
      ATT: Find Information Response (0x05) len 5
        Format: UUID-16 (0x01)
        Handle: 0x00f2
        UUID: Client Characteristic Configuration (0x2902)
> HCI Event: Number of Completed Packets (0x13) plen 5    #177 [hci1] 13.989151
        Num handles: 1
        Handle: 1929 Address: DF:A9:FF:F6:B1:1A (OUI DF-A9-FF)
        Count: 1
        #176: len 10 (0 Kb/s)
        Latency: 184 msec (84-185 msec ~184 msec)
> ACL Data RX: Handle 1929 flags 0x02 dlen 13             #178 [hci1] 13.989472
      ATT: Find By Type Value Request (0x06) len 8
        Handle range: 0x0001-0xffff
        Attribute type: Primary Service (0x2800)
          UUID: Common Audio (0x1853)
< HCI Command: Host Number of Com.. (0x03|0x0035) plen 5  #179 [hci1] 14.004899
        Num handles: 1
        Handle: 1929 Address: DF:A9:FF:F6:B1:1A (OUI DF-A9-FF)
        Count: 1
< ACL Data TX: Handle 1929 flags 0x00 dlen 9              #180 [hci1] 14.004978
      ATT: Find By Type Value Response (0x07) len 4
        Handle range: 0x00ff-0x0100
> HCI Event: Number of Completed Packets (0x13) plen 5    #181 [hci1] 14.189229
        Num handles: 1
        Handle: 1929 Address: DF:A9:FF:F6:B1:1A (OUI DF-A9-FF)
        Count: 1
        #180: len 9 (0 Kb/s)
        Latency: 184 msec (84-185 msec ~184 msec)
> ACL Data RX: Handle 1929 flags 0x02 dlen 13             #182 [hci1] 14.189509
      ATT: Find By Type Value Request (0x06) len 8
        Handle range: 0x0101-0xffff
        Attribute type: Primary Service (0x2800)
          UUID: Common Audio (0x1853)
< HCI Command: Host Number of Com.. (0x03|0x0035) plen 5  #183 [hci1] 14.204686
        Num handles: 1
        Handle: 1929 Address: DF:A9:FF:F6:B1:1A (OUI DF-A9-FF)
        Count: 1
< ACL Data TX: Handle 1929 flags 0x00 dlen 9              #184 [hci1] 14.204877
      ATT: Error Response (0x01) len 4
        Find By Type Value Request (0x06)
        Handle: 0x0101
        Error: Attribute Not Found (0x0a)
> HCI Event: Number of Completed Packets (0x13) plen 5    #185 [hci1] 14.389199
        Num handles: 1
        Handle: 1929 Address: DF:A9:FF:F6:B1:1A (OUI DF-A9-FF)
        Count: 1
        #184: len 9 (0 Kb/s)
        Latency: 184 msec (84-185 msec ~184 msec)
> ACL Data RX: Handle 1929 flags 0x02 dlen 11             #186 [hci1] 14.389352
      ATT: Read By Type Request (0x08) len 6
        Handle range: 0x00ff-0x0100
        Attribute type: Include (0x2802)
< HCI Command: Host Number of Com.. (0x03|0x0035) plen 5  #187 [hci1] 14.404529
        Num handles: 1
        Handle: 1929 Address: DF:A9:FF:F6:B1:1A (OUI DF-A9-FF)
        Count: 1
< ACL Data TX: Handle 1929 flags 0x00 dlen 14             #188 [hci1] 14.404670
      ATT: Read By Type Response (0x09) len 9
        Attribute data length: 8
        Attribute data list: 1 entry
        Handle: 0x0100
        Value: f300fe004618
> HCI Event: Number of Completed Packets (0x13) plen 5    #189 [hci1] 14.589215
        Num handles: 1
        Handle: 1929 Address: DF:A9:FF:F6:B1:1A (OUI DF-A9-FF)
        Count: 1
        #188: len 14 (0 Kb/s)
        Latency: 184 msec (84-185 msec ~184 msec)
> ACL Data RX: Handle 1929 flags 0x02 dlen 11             #190 [hci1] 14.589364
      ATT: Read By Type Request (0x08) len 6
        Handle range: 0x00f3-0x00fe
        Attribute type: Characteristic (0x2803)
< HCI Command: Host Number of Com.. (0x03|0x0035) plen 5  #191 [hci1] 14.604552
        Num handles: 1
        Handle: 1929 Address: DF:A9:FF:F6:B1:1A (OUI DF-A9-FF)
        Count: 1
< ACL Data TX: Handle 1929 flags 0x00 dlen 27             #192 [hci1] 14.604637
< ACL Data TX: Handle 1929 flags 0x01 dlen 7              #193 [hci1] 14.604664
      ATT: Read By Type Response (0x09) len 29
        Attribute data length: 7
        Attribute data list: 4 entries
        Handle: 0x00f4
        Value: 12f500842b
            Properties: 0x12
              Read (0x02)
              Notify (0x10)
            Value Handle: 0x00f5
            Value UUID: Set Identity Resolving Key (0x2b84)
        Handle: 0x00f7
        Value: 12f800852b
            Properties: 0x12
              Read (0x02)
              Notify (0x10)
            Value Handle: 0x00f8
            Value UUID: Coordinated Set Size (0x2b85)
        Handle: 0x00fa
        Value: 1afb00862b
            Properties: 0x1a
              Read (0x02)
              Write (0x08)
              Notify (0x10)
            Value Handle: 0x00fb
            Value UUID: Set Member Lock (0x2b86)
        Handle: 0x00fd
        Value: 02fe00872b
            Properties: 0x02
              Read (0x02)
            Value Handle: 0x00fe
            Value UUID: Set Member Rank (0x2b87)
> HCI Event: Number of Completed Packets (0x13) plen 5    #194 [hci1] 14.689547
        Num handles: 1
        Handle: 1929 Address: DF:A9:FF:F6:B1:1A (OUI DF-A9-FF)
        Count: 1
        #192: len 27 (2 Kb/s)
        Latency: 84 msec (84-185 msec ~134 msec)
> HCI Event: Number of Completed Packets (0x13) plen 5    #195 [hci1] 14.789203
        Num handles: 1
        Handle: 1929 Address: DF:A9:FF:F6:B1:1A (OUI DF-A9-FF)
        Count: 1
        #193: len 7 (0 Kb/s)
        Latency: 184 msec (84-185 msec ~159 msec)
> ACL Data RX: Handle 1929 flags 0x02 dlen 11             #196 [hci1] 14.789332
      ATT: Read By Type Request (0x08) len 6
        Handle range: 0x00fe-0x00fe
        Attribute type: Characteristic (0x2803)
< HCI Command: Host Number of Com.. (0x03|0x0035) plen 5  #197 [hci1] 14.804097
        Num handles: 1
        Handle: 1929 Address: DF:A9:FF:F6:B1:1A (OUI DF-A9-FF)
        Count: 1
< ACL Data TX: Handle 1929 flags 0x00 dlen 9              #198 [hci1] 14.804185
      ATT: Error Response (0x01) len 4
        Read By Type Request (0x08)
        Handle: 0x00fe
        Error: Attribute Not Found (0x0a)
> HCI Event: Number of Completed Packets (0x13) plen 5    #199 [hci1] 14.989192
        Num handles: 1
        Handle: 1929 Address: DF:A9:FF:F6:B1:1A (OUI DF-A9-FF)
        Count: 1
        #198: len 9 (0 Kb/s)
        Latency: 185 msec (84-185 msec ~172 msec)
> ACL Data RX: Handle 1929 flags 0x02 dlen 9              #200 [hci1] 14.989368
      ATT: Find Information Request (0x04) len 4
        Handle range: 0x00f6-0x00f6
< HCI Command: Host Number of Com.. (0x03|0x0035) plen 5  #201 [hci1] 15.004456
        Num handles: 1
        Handle: 1929 Address: DF:A9:FF:F6:B1:1A (OUI DF-A9-FF)
        Count: 1
< ACL Data TX: Handle 1929 flags 0x00 dlen 10             #202 [hci1] 15.004575
      ATT: Find Information Response (0x05) len 5
        Format: UUID-16 (0x01)
        Handle: 0x00f6
        UUID: Client Characteristic Configuration (0x2902)
> HCI Event: Number of Completed Packets (0x13) plen 5    #203 [hci1] 15.189124
        Num handles: 1
        Handle: 1929 Address: DF:A9:FF:F6:B1:1A (OUI DF-A9-FF)
        Count: 1
        #202: len 10 (0 Kb/s)
        Latency: 184 msec (84-185 msec ~178 msec)
> ACL Data RX: Handle 1929 flags 0x02 dlen 9              #204 [hci1] 15.189368
      ATT: Find Information Request (0x04) len 4
        Handle range: 0x00f9-0x00f9
< HCI Command: Host Number of Com.. (0x03|0x0035) plen 5  #205 [hci1] 15.204434
        Num handles: 1
        Handle: 1929 Address: DF:A9:FF:F6:B1:1A (OUI DF-A9-FF)
        Count: 1
< ACL Data TX: Handle 1929 flags 0x00 dlen 10             #206 [hci1] 15.204563
      ATT: Find Information Response (0x05) len 5
        Format: UUID-16 (0x01)
        Handle: 0x00f9
        UUID: Client Characteristic Configuration (0x2902)
> HCI Event: Number of Completed Packets (0x13) plen 5    #207 [hci1] 15.389093
        Num handles: 1
        Handle: 1929 Address: DF:A9:FF:F6:B1:1A (OUI DF-A9-FF)
        Count: 1
        #206: len 10 (0 Kb/s)
        Latency: 184 msec (84-185 msec ~181 msec)
> ACL Data RX: Handle 1929 flags 0x02 dlen 9              #208 [hci1] 15.389306
      ATT: Find Information Request (0x04) len 4
        Handle range: 0x00fc-0x00fc
< HCI Command: Host Number of Com.. (0x03|0x0035) plen 5  #209 [hci1] 15.404546
        Num handles: 1
        Handle: 1929 Address: DF:A9:FF:F6:B1:1A (OUI DF-A9-FF)
        Count: 1
< ACL Data TX: Handle 1929 flags 0x00 dlen 10             #210 [hci1] 15.404638
      ATT: Find Information Response (0x05) len 5
        Format: UUID-16 (0x01)
        Handle: 0x00fc
        UUID: Client Characteristic Configuration (0x2902)
> HCI Event: Number of Completed Packets (0x13) plen 5    #211 [hci1] 15.589151
        Num handles: 1
        Handle: 1929 Address: DF:A9:FF:F6:B1:1A (OUI DF-A9-FF)
        Count: 1
        #210: len 10 (0 Kb/s)
        Latency: 184 msec (84-185 msec ~182 msec)
> ACL Data RX: Handle 1929 flags 0x02 dlen 9              #212 [hci1] 15.589285
      ATT: Write Request (0x12) len 4
        Handle: 0x00df
          Data: 0000
< HCI Command: Host Number of Com.. (0x03|0x0035) plen 5  #213 [hci1] 15.604442
        Num handles: 1
        Handle: 1929 Address: DF:A9:FF:F6:B1:1A (OUI DF-A9-FF)
        Count: 1
< ACL Data TX: Handle 1929 flags 0x00 dlen 5              #214 [hci1] 15.604587
      ATT: Write Response (0x13) len 0
> HCI Event: Number of Completed Packets (0x13) plen 5    #215 [hci1] 15.789127
        Num handles: 1
        Handle: 1929 Address: DF:A9:FF:F6:B1:1A (OUI DF-A9-FF)
        Count: 1
        #214: len 5 (0 Kb/s)
        Latency: 184 msec (84-185 msec ~183 msec)
> ACL Data RX: Handle 1929 flags 0x02 dlen 9              #216 [hci1] 15.789366
      ATT: Write Request (0x12) len 4
        Handle: 0x00df
          Data: 0100
< HCI Command: Host Number of Com.. (0x03|0x0035) plen 5  #217 [hci1] 15.804494
        Num handles: 1
        Handle: 1929 Address: DF:A9:FF:F6:B1:1A (OUI DF-A9-FF)
        Count: 1
< ACL Data TX: Handle 1929 flags 0x00 dlen 5              #218 [hci1] 15.804652
      ATT: Write Response (0x13) len 0
> HCI Event: Number of Completed Packets (0x13) plen 5    #219 [hci1] 15.989215
        Num handles: 1
        Handle: 1929 Address: DF:A9:FF:F6:B1:1A (OUI DF-A9-FF)
        Count: 1
        #218: len 5 (0 Kb/s)
        Latency: 184 msec (84-185 msec ~184 msec)
> ACL Data RX: Handle 1929 flags 0x02 dlen 9              #220 [hci1] 15.989280
      ATT: Write Request (0x12) len 4
        Handle: 0x00e6
          Data: 0000
< HCI Command: Host Number of Com.. (0x03|0x0035) plen 5  #221 [hci1] 16.004507
        Num handles: 1
        Handle: 1929 Address: DF:A9:FF:F6:B1:1A (OUI DF-A9-FF)
        Count: 1
< ACL Data TX: Handle 1929 flags 0x00 dlen 5              #222 [hci1] 16.004531
      ATT: Write Response (0x13) len 0
> HCI Event: Number of Completed Packets (0x13) plen 5    #223 [hci1] 16.189084
        Num handles: 1
        Handle: 1929 Address: DF:A9:FF:F6:B1:1A (OUI DF-A9-FF)
        Count: 1
        #222: len 5 (0 Kb/s)
        Latency: 184 msec (84-185 msec ~184 msec)
> ACL Data RX: Handle 1929 flags 0x02 dlen 9              #224 [hci1] 16.189227
      ATT: Write Request (0x12) len 4
        Handle: 0x00e6
          Data: 0100
< HCI Command: Host Number of Com.. (0x03|0x0035) plen 5  #225 [hci1] 16.204335
        Num handles: 1
        Handle: 1929 Address: DF:A9:FF:F6:B1:1A (OUI DF-A9-FF)
        Count: 1
< ACL Data TX: Handle 1929 flags 0x00 dlen 5              #226 [hci1] 16.204446
      ATT: Write Response (0x13) len 0
> HCI Event: Number of Completed Packets (0x13) plen 5    #227 [hci1] 16.389167
        Num handles: 1
        Handle: 1929 Address: DF:A9:FF:F6:B1:1A (OUI DF-A9-FF)
        Count: 1
        #226: len 5 (0 Kb/s)
        Latency: 184 msec (84-185 msec ~184 msec)
> ACL Data RX: Handle 1929 flags 0x02 dlen 9              #228 [hci1] 16.389307
      ATT: Write Request (0x12) len 4
        Handle: 0x00e9
          Data: 0000
< HCI Command: Host Number of Com.. (0x03|0x0035) plen 5  #229 [hci1] 16.404525
        Num handles: 1
        Handle: 1929 Address: DF:A9:FF:F6:B1:1A (OUI DF-A9-FF)
        Count: 1
< ACL Data TX: Handle 1929 flags 0x00 dlen 5              #230 [hci1] 16.404644
      ATT: Write Response (0x13) len 0
> HCI Event: Number of Completed Packets (0x13) plen 5    #231 [hci1] 16.589212
        Num handles: 1
        Handle: 1929 Address: DF:A9:FF:F6:B1:1A (OUI DF-A9-FF)
        Count: 1
        #230: len 5 (0 Kb/s)
        Latency: 184 msec (84-185 msec ~184 msec)
> ACL Data RX: Handle 1929 flags 0x02 dlen 9              #232 [hci1] 16.589412
      ATT: Write Request (0x12) len 4
        Handle: 0x00e9
          Data: 0100
< HCI Command: Host Number of Com.. (0x03|0x0035) plen 5  #233 [hci1] 16.604509
        Num handles: 1
        Handle: 1929 Address: DF:A9:FF:F6:B1:1A (OUI DF-A9-FF)
        Count: 1
< ACL Data TX: Handle 1929 flags 0x00 dlen 5              #234 [hci1] 16.604631
      ATT: Write Response (0x13) len 0
> HCI Event: Number of Completed Packets (0x13) plen 5    #235 [hci1] 16.789209
        Num handles: 1
        Handle: 1929 Address: DF:A9:FF:F6:B1:1A (OUI DF-A9-FF)
        Count: 1
        #234: len 5 (0 Kb/s)
        Latency: 184 msec (84-185 msec ~184 msec)
> ACL Data RX: Handle 1929 flags 0x02 dlen 9              #236 [hci1] 16.789317
      ATT: Write Request (0x12) len 4
        Handle: 0x00ec
          Data: 0000
< HCI Command: Host Number of Com.. (0x03|0x0035) plen 5  #237 [hci1] 16.804508
        Num handles: 1
        Handle: 1929 Address: DF:A9:FF:F6:B1:1A (OUI DF-A9-FF)
        Count: 1
< ACL Data TX: Handle 1929 flags 0x00 dlen 5              #238 [hci1] 16.804602
      ATT: Write Response (0x13) len 0
> HCI Event: Number of Completed Packets (0x13) plen 5    #239 [hci1] 16.989149
        Num handles: 1
        Handle: 1929 Address: DF:A9:FF:F6:B1:1A (OUI DF-A9-FF)
        Count: 1
        #238: len 5 (0 Kb/s)
        Latency: 184 msec (84-185 msec ~184 msec)
> ACL Data RX: Handle 1929 flags 0x02 dlen 9              #240 [hci1] 16.989275
      ATT: Write Request (0x12) len 4
        Handle: 0x00ec
          Data: 0100
< HCI Command: Host Number of Com.. (0x03|0x0035) plen 5  #241 [hci1] 17.004531
        Num handles: 1
        Handle: 1929 Address: DF:A9:FF:F6:B1:1A (OUI DF-A9-FF)
        Count: 1
< ACL Data TX: Handle 1929 flags 0x00 dlen 5              #242 [hci1] 17.004631
      ATT: Write Response (0x13) len 0
> HCI Event: Number of Completed Packets (0x13) plen 5    #243 [hci1] 17.189203
        Num handles: 1
        Handle: 1929 Address: DF:A9:FF:F6:B1:1A (OUI DF-A9-FF)
        Count: 1
        #242: len 5 (0 Kb/s)
        Latency: 184 msec (84-185 msec ~184 msec)
> ACL Data RX: Handle 1929 flags 0x02 dlen 9              #244 [hci1] 17.189331
      ATT: Write Request (0x12) len 4
        Handle: 0x00ef
          Data: 0000
< HCI Command: Host Number of Com.. (0x03|0x0035) plen 5  #245 [hci1] 17.204522
        Num handles: 1
        Handle: 1929 Address: DF:A9:FF:F6:B1:1A (OUI DF-A9-FF)
        Count: 1
< ACL Data TX: Handle 1929 flags 0x00 dlen 5              #246 [hci1] 17.204620
      ATT: Write Response (0x13) len 0
> HCI Event: Number of Completed Packets (0x13) plen 5    #247 [hci1] 17.389134
        Num handles: 1
        Handle: 1929 Address: DF:A9:FF:F6:B1:1A (OUI DF-A9-FF)
        Count: 1
        #246: len 5 (0 Kb/s)
        Latency: 184 msec (84-185 msec ~184 msec)
> ACL Data RX: Handle 1929 flags 0x02 dlen 9              #248 [hci1] 17.389315
      ATT: Write Request (0x12) len 4
        Handle: 0x00ef
          Data: 0100
< HCI Command: Host Number of Com.. (0x03|0x0035) plen 5  #249 [hci1] 17.404467
        Num handles: 1
        Handle: 1929 Address: DF:A9:FF:F6:B1:1A (OUI DF-A9-FF)
        Count: 1
< ACL Data TX: Handle 1929 flags 0x00 dlen 5              #250 [hci1] 17.404539
      ATT: Write Response (0x13) len 0
> HCI Event: Number of Completed Packets (0x13) plen 5    #251 [hci1] 17.589102
        Num handles: 1
        Handle: 1929 Address: DF:A9:FF:F6:B1:1A (OUI DF-A9-FF)
        Count: 1
        #250: len 5 (0 Kb/s)
        Latency: 184 msec (84-185 msec ~184 msec)
> ACL Data RX: Handle 1929 flags 0x02 dlen 9              #252 [hci1] 17.589260
      ATT: Write Request (0x12) len 4
        Handle: 0x00f2
          Data: 0000
< HCI Command: Host Number of Com.. (0x03|0x0035) plen 5  #253 [hci1] 17.604512
        Num handles: 1
        Handle: 1929 Address: DF:A9:FF:F6:B1:1A (OUI DF-A9-FF)
        Count: 1
< ACL Data TX: Handle 1929 flags 0x00 dlen 5              #254 [hci1] 17.604588
      ATT: Write Response (0x13) len 0
> HCI Event: Number of Completed Packets (0x13) plen 5    #255 [hci1] 17.789265
        Num handles: 1
        Handle: 1929 Address: DF:A9:FF:F6:B1:1A (OUI DF-A9-FF)
        Count: 1
        #254: len 5 (0 Kb/s)
        Latency: 184 msec (84-185 msec ~184 msec)
> ACL Data RX: Handle 1929 flags 0x02 dlen 9              #256 [hci1] 17.789364
      ATT: Write Request (0x12) len 4
        Handle: 0x00f2
          Data: 0100
< HCI Command: Host Number of Com.. (0x03|0x0035) plen 5  #257 [hci1] 17.804586
        Num handles: 1
        Handle: 1929 Address: DF:A9:FF:F6:B1:1A (OUI DF-A9-FF)
        Count: 1
< ACL Data TX: Handle 1929 flags 0x00 dlen 5              #258 [hci1] 17.804665
      ATT: Write Response (0x13) len 0
> HCI Event: Number of Completed Packets (0x13) plen 5    #259 [hci1] 17.989106
        Num handles: 1
        Handle: 1929 Address: DF:A9:FF:F6:B1:1A (OUI DF-A9-FF)
        Count: 1
        #258: len 5 (0 Kb/s)
        Latency: 184 msec (84-185 msec ~184 msec)
> ACL Data RX: Handle 1929 flags 0x02 dlen 7              #260 [hci1] 17.989290
      ATT: Read Request (0x0a) len 2
        Handle: 0x00e8
< HCI Command: Host Number of Com.. (0x03|0x0035) plen 5  #261 [hci1] 18.004511
        Num handles: 1
        Handle: 1929 Address: DF:A9:FF:F6:B1:1A (OUI DF-A9-FF)
        Count: 1
< ACL Data TX: Handle 1929 flags 0x00 dlen 7              #262 [hci1] 18.004673
      ATT: Read Response (0x0b) len 2
> HCI Event: Number of Completed Packets (0x13) plen 5    #263 [hci1] 18.189168
        Num handles: 1
        Handle: 1929 Address: DF:A9:FF:F6:B1:1A (OUI DF-A9-FF)
        Count: 1
        #262: len 7 (0 Kb/s)
        Latency: 184 msec (84-185 msec ~184 msec)
> ACL Data RX: Handle 1929 flags 0x02 dlen 7              #264 [hci1] 18.189277
      ATT: Read Request (0x0a) len 2
        Handle: 0x00eb
< HCI Command: Host Number of Com.. (0x03|0x0035) plen 5  #265 [hci1] 18.204536
        Num handles: 1
        Handle: 1929 Address: DF:A9:FF:F6:B1:1A (OUI DF-A9-FF)
        Count: 1
< ACL Data TX: Handle 1929 flags 0x00 dlen 7              #266 [hci1] 18.204629
      ATT: Read Response (0x0b) len 2
> HCI Event: Number of Completed Packets (0x13) plen 5    #267 [hci1] 18.389075
        Num handles: 1
        Handle: 1929 Address: DF:A9:FF:F6:B1:1A (OUI DF-A9-FF)
        Count: 1
        #266: len 7 (0 Kb/s)
        Latency: 184 msec (84-185 msec ~184 msec)
> ACL Data RX: Handle 1929 flags 0x02 dlen 7              #268 [hci1] 18.389254
      ATT: Read Request (0x0a) len 2
        Handle: 0x00ee
< HCI Command: Host Number of Com.. (0x03|0x0035) plen 5  #269 [hci1] 18.404544
        Num handles: 1
        Handle: 1929 Address: DF:A9:FF:F6:B1:1A (OUI DF-A9-FF)
        Count: 1
< ACL Data TX: Handle 1929 flags 0x00 dlen 7              #270 [hci1] 18.404631
      ATT: Read Response (0x0b) len 2
> HCI Event: Number of Completed Packets (0x13) plen 5    #271 [hci1] 18.589089
        Num handles: 1
        Handle: 1929 Address: DF:A9:FF:F6:B1:1A (OUI DF-A9-FF)
        Count: 1
        #270: len 7 (0 Kb/s)
        Latency: 184 msec (84-185 msec ~184 msec)
> ACL Data RX: Handle 1929 flags 0x02 dlen 7              #272 [hci1] 18.589286
      ATT: Read Request (0x0a) len 2
        Handle: 0x00f1
< HCI Command: Host Number of Com.. (0x03|0x0035) plen 5  #273 [hci1] 18.604533
        Num handles: 1
        Handle: 1929 Address: DF:A9:FF:F6:B1:1A (OUI DF-A9-FF)
        Count: 1
< ACL Data TX: Handle 1929 flags 0x00 dlen 7              #274 [hci1] 18.604643
      ATT: Read Response (0x0b) len 2
> HCI Event: Number of Completed Packets (0x13) plen 5    #275 [hci1] 18.789086
        Num handles: 1
        Handle: 1929 Address: DF:A9:FF:F6:B1:1A (OUI DF-A9-FF)
        Count: 1
        #274: len 7 (0 Kb/s)
        Latency: 184 msec (84-185 msec ~184 msec)
> ACL Data RX: Handle 1929 flags 0x02 dlen 9              #276 [hci1] 18.789282
      ATT: Write Request (0x12) len 4
        Handle: 0x00fc
          Data: 0000
< HCI Command: Host Number of Com.. (0x03|0x0035) plen 5  #277 [hci1] 18.804481
        Num handles: 1
        Handle: 1929 Address: DF:A9:FF:F6:B1:1A (OUI DF-A9-FF)
        Count: 1
< ACL Data TX: Handle 1929 flags 0x00 dlen 5              #278 [hci1] 18.804552
      ATT: Write Response (0x13) len 0
> HCI Event: Number of Completed Packets (0x13) plen 5    #279 [hci1] 18.989129
        Num handles: 1
        Handle: 1929 Address: DF:A9:FF:F6:B1:1A (OUI DF-A9-FF)
        Count: 1
        #278: len 5 (0 Kb/s)
        Latency: 184 msec (84-185 msec ~184 msec)
> ACL Data RX: Handle 1929 flags 0x02 dlen 9              #280 [hci1] 18.989297
      ATT: Write Request (0x12) len 4
        Handle: 0x00fc
          Data: 0100
< HCI Command: Host Number of Com.. (0x03|0x0035) plen 5  #281 [hci1] 19.004560
        Num handles: 1
        Handle: 1929 Address: DF:A9:FF:F6:B1:1A (OUI DF-A9-FF)
        Count: 1
< ACL Data TX: Handle 1929 flags 0x00 dlen 5              #282 [hci1] 19.004704
      ATT: Write Response (0x13) len 0
> HCI Event: Number of Completed Packets (0x13) plen 5    #283 [hci1] 19.189212
        Num handles: 1
        Handle: 1929 Address: DF:A9:FF:F6:B1:1A (OUI DF-A9-FF)
        Count: 1
        #282: len 5 (0 Kb/s)
        Latency: 184 msec (84-185 msec ~184 msec)
> ACL Data RX: Handle 1929 flags 0x02 dlen 7              #284 [hci1] 19.189318
      ATT: Read Request (0x0a) len 2
        Handle: 0x00d5
< HCI Command: Host Number of Com.. (0x03|0x0035) plen 5  #285 [hci1] 19.204543
        Num handles: 1
        Handle: 1929 Address: DF:A9:FF:F6:B1:1A (OUI DF-A9-FF)
        Count: 1
< ACL Data TX: Handle 1929 flags 0x00 dlen 9              #286 [hci1] 19.204565
      ATT: Read Response (0x0b) len 4
> HCI Event: Number of Completed Packets (0x13) plen 5    #287 [hci1] 19.389131
        Num handles: 1
        Handle: 1929 Address: DF:A9:FF:F6:B1:1A (OUI DF-A9-FF)
        Count: 1
        #286: len 9 (0 Kb/s)
        Latency: 184 msec (84-185 msec ~184 msec)
> ACL Data RX: Handle 1929 flags 0x02 dlen 7              #288 [hci1] 19.389202
      ATT: Read Request (0x0a) len 2
        Handle: 0x00d2
< HCI Command: Host Number of Com.. (0x03|0x0035) plen 5  #289 [hci1] 19.404462
        Num handles: 1
        Handle: 1929 Address: DF:A9:FF:F6:B1:1A (OUI DF-A9-FF)
        Count: 1
< ACL Data TX: Handle 1929 flags 0x00 dlen 27             #290 [hci1] 19.404583
< ACL Data TX: Handle 1929 flags 0x01 dlen 27             #291 [hci1] 19.404603
< ACL Data TX: Handle 1929 flags 0x01 dlen 12             #292 [hci1] 19.404636
      ATT: Read Response (0x0b) len 61
> HCI Event: Number of Completed Packets (0x13) plen 5    #293 [hci1] 19.489456
        Num handles: 1
        Handle: 1929 Address: DF:A9:FF:F6:B1:1A (OUI DF-A9-FF)
        Count: 1
        #290: len 27 (2 Kb/s)
        Latency: 84 msec (84-185 msec ~134 msec)
> HCI Event: Number of Completed Packets (0x13) plen 5    #294 [hci1] 19.489977
        Num handles: 1
        Handle: 1929 Address: DF:A9:FF:F6:B1:1A (OUI DF-A9-FF)
        Count: 1
        #291: len 27 (2 Kb/s)
        Latency: 85 msec (84-185 msec ~110 msec)
> HCI Event: Number of Completed Packets (0x13) plen 5    #295 [hci1] 19.589073
        Num handles: 1
        Handle: 1929 Address: DF:A9:FF:F6:B1:1A (OUI DF-A9-FF)
        Count: 1
        #292: len 12 (0 Kb/s)
        Latency: 184 msec (84-185 msec ~147 msec)
> ACL Data RX: Handle 1929 flags 0x02 dlen 7              #296 [hci1] 19.589271
      ATT: Read Request (0x0a) len 2
        Handle: 0x00de
< HCI Command: Host Number of Com.. (0x03|0x0035) plen 5  #297 [hci1] 19.604036
        Num handles: 1
        Handle: 1929 Address: DF:A9:FF:F6:B1:1A (OUI DF-A9-FF)
        Count: 1
< ACL Data TX: Handle 1929 flags 0x00 dlen 9              #298 [hci1] 19.604112
      ATT: Read Response (0x0b) len 4
> HCI Event: Number of Completed Packets (0x13) plen 5    #299 [hci1] 19.789020
        Num handles: 1
        Handle: 1929 Address: DF:A9:FF:F6:B1:1A (OUI DF-A9-FF)
        Count: 1
        #298: len 9 (0 Kb/s)
        Latency: 184 msec (84-185 msec ~166 msec)
> ACL Data RX: Handle 1929 flags 0x02 dlen 7              #300 [hci1] 19.789205
      ATT: Read Request (0x0a) len 2
        Handle: 0x00e1
< HCI Command: Host Number of Com.. (0x03|0x0035) plen 5  #301 [hci1] 19.804499
        Num handles: 1
        Handle: 1929 Address: DF:A9:FF:F6:B1:1A (OUI DF-A9-FF)
        Count: 1
< ACL Data TX: Handle 1929 flags 0x00 dlen 9              #302 [hci1] 19.804670
      ATT: Read Response (0x0b) len 4
> HCI Event: Number of Completed Packets (0x13) plen 5    #303 [hci1] 19.989125
        Num handles: 1
        Handle: 1929 Address: DF:A9:FF:F6:B1:1A (OUI DF-A9-FF)
        Count: 1
        #302: len 9 (0 Kb/s)
        Latency: 184 msec (84-185 msec ~175 msec)
> ACL Data RX: Handle 1929 flags 0x02 dlen 7              #304 [hci1] 19.989231
      ATT: Read Request (0x0a) len 2
        Handle: 0x00fb
< HCI Command: Host Number of Com.. (0x03|0x0035) plen 5  #305 [hci1] 20.004440
        Num handles: 1
        Handle: 1929 Address: DF:A9:FF:F6:B1:1A (OUI DF-A9-FF)
        Count: 1
< ACL Data TX: Handle 1929 flags 0x00 dlen 6              #306 [hci1] 20.004524
      ATT: Read Response (0x0b) len 1
> HCI Event: Number of Completed Packets (0x13) plen 5    #307 [hci1] 20.189097
        Num handles: 1
        Handle: 1929 Address: DF:A9:FF:F6:B1:1A (OUI DF-A9-FF)
        Count: 1
        #306: len 6 (0 Kb/s)
        Latency: 184 msec (84-185 msec ~179 msec)
> ACL Data RX: Handle 1929 flags 0x02 dlen 27             #308 [hci1] 20.189527
> ACL Data RX: Handle 1929 flags 0x01 dlen 7              #309 [hci1] 20.189605
      ATT: Write Command (0x52) len 29
        Handle: 0x00e5
          Data: 010101020206000000001002010302020103042800050302000000
< HCI Command: Host Number of Com.. (0x03|0x0035) plen 5  #310 [hci1] 20.204135
        Num handles: 1
        Handle: 1929 Address: DF:A9:FF:F6:B1:1A (OUI DF-A9-FF)
        Count: 1
< HCI Command: Host Number of Com.. (0x03|0x0035) plen 5  #311 [hci1] 20.204565
        Num handles: 1
        Handle: 1929 Address: DF:A9:FF:F6:B1:1A (OUI DF-A9-FF)
        Count: 1
< ACL Data TX: Handle 1929 flags 0x00 dlen 12             #312 [hci1] 20.204753
      ATT: Handle Value Notification (0x1b) len 7
        Handle: 0x00e5
          Data: 0101010000
< ACL Data TX: Handle 1929 flags 0x00 dlen 27             #313 [hci1] 20.204820
< ACL Data TX: Handle 1929 flags 0x01 dlen 21             #314 [hci1] 20.204835
      ATT: Handle Value Notification (0x1b) len 43
        Handle: 0x00e8
          Data: 01010002020a00102700409c00102700409c0006000000001002010302020103042800050302000000
> HCI Event: Number of Completed Packets (0x13) plen 5    #315 [hci1] 20.289412
        Num handles: 1
        Handle: 1929 Address: DF:A9:FF:F6:B1:1A (OUI DF-A9-FF)
        Count: 1
        #312: len 12 (1 Kb/s)
        Latency: 84 msec (84-185 msec ~132 msec)
> HCI Event: Number of Completed Packets (0x13) plen 5    #316 [hci1] 20.289977
        Num handles: 1
        Handle: 1929 Address: DF:A9:FF:F6:B1:1A (OUI DF-A9-FF)
        Count: 1
        #313: len 27 (2 Kb/s)
        Latency: 85 msec (84-185 msec ~108 msec)
> HCI Event: Number of Completed Packets (0x13) plen 5    #317 [hci1] 20.389253
        Num handles: 1
        Handle: 1929 Address: DF:A9:FF:F6:B1:1A (OUI DF-A9-FF)
        Count: 1
        #314: len 21 (0 Kb/s)
        Latency: 184 msec (84-185 msec ~146 msec)
> ACL Data RX: Handle 1929 flags 0x02 dlen 25             #318 [hci1] 20.389461
      ATT: Write Command (0x52) len 20
        Handle: 0x00e5
          Data: 020101010110270000022800020a00a86100
< HCI Command: Host Number of Com.. (0x03|0x0035) plen 5  #319 [hci1] 20.404124
        Num handles: 1
        Handle: 1929 Address: DF:A9:FF:F6:B1:1A (OUI DF-A9-FF)
        Count: 1
< ACL Data TX: Handle 1929 flags 0x00 dlen 12             #320 [hci1] 20.404314
      ATT: Handle Value Notification (0x1b) len 7
        Handle: 0x00e5
          Data: 0201010000
< ACL Data TX: Handle 1929 flags 0x00 dlen 24             #321 [hci1] 20.404320
      ATT: Handle Value Notification (0x1b) len 19
        Handle: 0x00e8
          Data: 0102010110270000022800020a00a86100
> HCI Event: Number of Completed Packets (0x13) plen 5    #322 [hci1] 20.489468
        Num handles: 1
        Handle: 1929 Address: DF:A9:FF:F6:B1:1A (OUI DF-A9-FF)
        Count: 1
        #320: len 12 (1 Kb/s)
        Latency: 85 msec (84-185 msec ~115 msec)
> HCI Event: Number of Completed Packets (0x13) plen 5    #323 [hci1] 20.589139
        Num handles: 1
        Handle: 1929 Address: DF:A9:FF:F6:B1:1A (OUI DF-A9-FF)
        Count: 1
        #321: len 24 (1 Kb/s)
        Latency: 184 msec (84-185 msec ~150 msec)
> ACL Data RX: Handle 1929 flags 0x02 dlen 15             #324 [hci1] 20.589280
      ATT: Write Request (0x12) len 10
        Handle: 0x00e5
          Data: 030101040302fd0f
< HCI Command: Host Number of Com.. (0x03|0x0035) plen 5  #325 [hci1] 20.604230
        Num handles: 1
        Handle: 1929 Address: DF:A9:FF:F6:B1:1A (OUI DF-A9-FF)
        Count: 1
< ACL Data TX: Handle 1929 flags 0x00 dlen 12             #326 [hci1] 20.604261
      ATT: Handle Value Notification (0x1b) len 7
        Handle: 0x00e5
          Data: 0301010b02
< ACL Data TX: Handle 1929 flags 0x00 dlen 5              #327 [hci1] 20.604314
      ATT: Write Response (0x13) len 0
> HCI Event: Number of Completed Packets (0x13) plen 5    #328 [hci1] 20.689427
        Num handles: 1
        Handle: 1929 Address: DF:A9:FF:F6:B1:1A (OUI DF-A9-FF)
        Count: 1
        #326: len 12 (1 Kb/s)
        Latency: 85 msec (84-185 msec ~117 msec)
> HCI Event: Number of Completed Packets (0x13) plen 5    #329 [hci1] 20.789016
        Num handles: 1
        Handle: 1929 Address: DF:A9:FF:F6:B1:1A (OUI DF-A9-FF)
        Count: 1
        #327: len 5 (0 Kb/s)
        Latency: 184 msec (84-185 msec ~151 msec)
> ACL Data RX: Handle 1929 flags 0x02 dlen 10             #330 [hci1] 40.788874
      ATT: Write Command (0x52) len 5
        Handle: 0x00e5
          Data: 080101
< HCI Command: Host Number of Com.. (0x03|0x0035) plen 5  #331 [hci1] 40.804646
        Num handles: 1
        Handle: 1929 Address: DF:A9:FF:F6:B1:1A (OUI DF-A9-FF)
        Count: 1
< ACL Data TX: Handle 1929 flags 0x00 dlen 12             #332 [hci1] 40.804800
      ATT: Handle Value Notification (0x1b) len 7
        Handle: 0x00e5
          Data: 0801010000
< ACL Data TX: Handle 1929 flags 0x00 dlen 9              #333 [hci1] 40.805141
      ATT: Handle Value Notification (0x1b) len 4
        Handle: 0x00e8
          Data: 0106
< ACL Data TX: Handle 1929 flags 0x00 dlen 9              #334 [hci1] 40.805296
      ATT: Handle Value Notification (0x1b) len 4
        Handle: 0x00e8
          Data: 0100
> HCI Event: Number of Completed Packets (0x13) plen 5    #335 [hci1] 40.889232
        Num handles: 1
        Handle: 1929 Address: DF:A9:FF:F6:B1:1A (OUI DF-A9-FF)
        Count: 1
        #332: len 12 (1 Kb/s)
        Latency: 84 msec (84-185 msec ~117 msec)
> HCI Event: Number of Completed Packets (0x13) plen 5    #336 [hci1] 40.889657
        Num handles: 1
        Handle: 1929 Address: DF:A9:FF:F6:B1:1A (OUI DF-A9-FF)
        Count: 1
        #333: len 9 (0 Kb/s)
        Latency: 84 msec (84-185 msec ~101 msec)
> HCI Event: Number of Completed Packets (0x13) plen 5    #337 [hci1] 40.988695
        Num handles: 1
        Handle: 1929 Address: DF:A9:FF:F6:B1:1A (OUI DF-A9-FF)
        Count: 1
        #334: len 9 (0 Kb/s)
        Latency: 183 msec (84-185 msec ~142 msec)
> HCI Event: Disconnect Complete (0x05) plen 4            #338 [hci1] 41.089068
        Status: Success (0x00)
        Handle: 1929 Address: DF:A9:FF:F6:B1:1A (OUI DF-A9-FF)
        Reason: Remote User Terminated Connection (0x13)
< HCI Command: Reset (0x03|0x0003) plen 0                 #339 [hci1] 46.894277
> HCI Event: Command Complete (0x0e) plen 4               #340 [hci1] 46.894768
      Reset (0x03|0x0003) ncmd 1
        Status: Success (0x00)
@ USER Close: main                                    {0x0001} [hci1] 46.904202
= Close Index: 00:00:00:00:00:00                               [hci1] 46.904210
