Bluetooth monitor ver 5.84
btmon[1706185]: = Note: Linux version 6.8.0-83-generic (x86_64)                                                          0.876636
btmon[1706185]: = Note: Bluetooth subsystem version 2.22                                                                 0.876638
= New Index: 00:00:00:00:00:00 (Primary,UART,hci0)                                                                       0.876639
= Open Index: 00:00:00:00:00:00                                                                                          1.380542
= Index Info: 00:00:00:00:00:00 (Nordic Semiconductor ASA)                                                               1.380720
zephyr.exe[1706187]: @ USER Open: main (privileged) version 2.22                                                {0x0001} 1.380771
zephyr.exe[1706187]: < HCI Command: Reset (0x03|0x0003) plen 0                                                        #1 1.381070
> HCI Event: Command Complete (0x0e) plen 4                                                                           #2 1.381653
      Reset (0x03|0x0003) ncmd 1
        Status: Success (0x00)
zephyr.exe[1706187]: < HCI Command: Read Local Supported Features (0x04|0x0003) plen 0                                #3 1.400564
> HCI Event: Command Complete (0x0e) plen 12                                                                          #4 1.401332
      Read Local Supported Features (0x04|0x0003) ncmd 1
        Status: Success (0x00)
        Features: 0x00 0x00 0x00 0x00 0x60 0x00 0x00 0x00
          BR/EDR Not Supported
          LE Supported (Controller)
zephyr.exe[1706187]: < HCI Command: Read Local Version Information (0x04|0x0001) plen 0                               #5 1.420573
> HCI Event: Command Complete (0x0e) plen 12                                                                          #6 1.421167
      Read Local Version Information (0x04|0x0001) ncmd 1
        Status: Success (0x00)
        HCI version: Reserved (0x0e) - Revision 12520 (0x30e8)
        LMP version: Reserved (0x0e) - Subversion 12520 (0x30e8)
        Manufacturer: Nordic Semiconductor ASA (89)
zephyr.exe[1706187]: < HCI Command: Read Local Supported Commands (0x04|0x0002) plen 0                                #7 1.440563
> HCI Event: Command Complete (0x0e) plen 68                                                                          #8 1.441831
      Read Local Supported Commands (0x04|0x0002) ncmd 1
        Status: Success (0x00)
        Commands: 119 entries
          Disconnect (Octet 0 - Bit 5)
          Read Remote Version Information (Octet 2 - Bit 7)
          Set Event Mask (Octet 5 - Bit 6)
          Reset (Octet 5 - Bit 7)
          Read Connection Accept Timeout (Octet 7 - Bit 2)
          Write Connection Accept Timeout (Octet 7 - Bit 3)
          Read Transmit Power Level (Octet 10 - Bit 2)
          Set Controller To Host Flow Control (Octet 10 - Bit 5)
          Host Buffer Size (Octet 10 - Bit 6)
          Host Number of Completed Packets (Octet 10 - Bit 7)
          Read Local Version Information (Octet 14 - Bit 3)
          Read Local Supported Features (Octet 14 - Bit 5)
          Read BD ADDR (Octet 15 - Bit 1)
          Read RSSI (Octet 15 - Bit 5)
          Set Event Mask Page 2 (Octet 22 - Bit 2)
          LE Set Event Mask (Octet 25 - Bit 0)
          LE Read Buffer Size (Octet 25 - Bit 1)
          LE Read Local Supported Features (Octet 25 - Bit 2)
          LE Set Random Address (Octet 25 - Bit 4)
          LE Set Advertising Parameters (Octet 25 - Bit 5)
          LE Read Advertising Channel TX Power (Octet 25 - Bit 6)
          LE Set Advertising Data (Octet 25 - Bit 7)
          LE Set Scan Response Data (Octet 26 - Bit 0)
          LE Set Advertise Enable (Octet 26 - Bit 1)
          LE Set Scan Parameters (Octet 26 - Bit 2)
          LE Set Scan Enable (Octet 26 - Bit 3)
          LE Create Connection (Octet 26 - Bit 4)
          LE Create Connection Cancel (Octet 26 - Bit 5)
          LE Read Accept List Size (Octet 26 - Bit 6)
          LE Clear Accept List (Octet 26 - Bit 7)
          LE Add Device To Accept List (Octet 27 - Bit 0)
          LE Remove Device From Accept List (Octet 27 - Bit 1)
          LE Connection Update (Octet 27 - Bit 2)
          LE Set Host Channel Classification (Octet 27 - Bit 3)
          LE Read Channel Map (Octet 27 - Bit 4)
          LE Read Remote Used Features (Octet 27 - Bit 5)
          LE Encrypt (Octet 27 - Bit 6)
          LE Rand (Octet 27 - Bit 7)
          LE Start Encryption (Octet 28 - Bit 0)
          LE Long Term Key Request Reply (Octet 28 - Bit 1)
          LE Long Term Key Request Neg Reply (Octet 28 - Bit 2)
          LE Read Supported States (Octet 28 - Bit 3)
          LE Receiver Test (Octet 28 - Bit 4)
          LE Transmitter Test (Octet 28 - Bit 5)
          LE Test End (Octet 28 - Bit 6)
          Read Authenticated Payload Timeout (Octet 32 - Bit 4)
          Write Authenticated Payload Timeout (Octet 32 - Bit 5)
          LE Set Data Length (Octet 33 - Bit 6)
          LE Read Suggested Default Data Length (Octet 33 - Bit 7)
          LE Write Suggested Default Data Length (Octet 34 - Bit 0)
          LE Add Device To Resolving List (Octet 34 - Bit 3)
          LE Remove Device From Resolving List (Octet 34 - Bit 4)
          LE Clear Resolving List (Octet 34 - Bit 5)
          LE Read Resolving List Size (Octet 34 - Bit 6)
          LE Set Address Resolution Enable (Octet 35 - Bit 1)
          LE Set Resolvable Private Address Timeout (Octet 35 - Bit 2)
          LE Read Maximum Data Length (Octet 35 - Bit 3)
          LE Read PHY (Octet 35 - Bit 4)
          LE Set Default PHY (Octet 35 - Bit 5)
          LE Set PHY (Octet 35 - Bit 6)
          LE Enhanced Receiver Test (Octet 35 - Bit 7)
          LE Enhanced Transmitter Test (Octet 36 - Bit 0)
          LE Set Advertising Set Random Address (Octet 36 - Bit 1)
          LE Set Extended Advertising Parameters (Octet 36 - Bit 2)
          LE Set Extended Advertising Data (Octet 36 - Bit 3)
          LE Set Extended Scan Response Data (Octet 36 - Bit 4)
          LE Set Extended Advertising Enable (Octet 36 - Bit 5)
          LE Read Maximum Advertising Data Length (Octet 36 - Bit 6)
          LE Read Number of Supported Advertising Sets (Octet 36 - Bit 7)
          LE Remove Advertising Set (Octet 37 - Bit 0)
          LE Clear Advertising Sets (Octet 37 - Bit 1)
          LE Set Periodic Advertising Parameters (Octet 37 - Bit 2)
          LE Set Periodic Advertising Data (Octet 37 - Bit 3)
          LE Set Periodic Advertising Enable (Octet 37 - Bit 4)
          LE Set Extended Scan Parameters (Octet 37 - Bit 5)
          LE Set Extended Scan Enable (Octet 37 - Bit 6)
          LE Extended Create Connection (Octet 37 - Bit 7)
          LE Periodic Advertising Create Sync (Octet 38 - Bit 0)
          LE Periodic Advertising Create Sync Cancel (Octet 38 - Bit 1)
          LE Periodic Advertising Terminate Sync (Octet 38 - Bit 2)
          LE Add Device To Periodic Advertiser List (Octet 38 - Bit 3)
          LE Remove Device From Periodic Advertiser List (Octet 38 - Bit 4)
          LE Clear Periodic Advertiser List (Octet 38 - Bit 5)
          LE Read Periodic Advertiser List Size (Octet 38 - Bit 6)
          LE Read Transmit Power (Octet 38 - Bit 7)
          LE Read RF Path Compensation (Octet 39 - Bit 0)
          LE Write RF Path Compensation (Octet 39 - Bit 1)
          LE Set Privacy Mode (Octet 39 - Bit 2)
          LE Periodic Advertising Receive Enable (Octet 40 - Bit 5)
          LE Periodic Advertising Sync Transfer (Octet 40 - Bit 6)
          LE Periodic Advertising Set Info Transfer (Octet 40 - Bit 7)
          LE Periodic Advertising Sync Transfer Parameters (Octet 41 - Bit 0)
          LE Set Default Periodic Advertisng Sync Transfer Parameters (Octet 41 - Bit 1)
          LE Read Buffer v2 (Octet 41 - Bit 5)
          LE Read ISO TX Sync (Octet 41 - Bit 6)
          LE Set Connected Isochronous Group Parameters (Octet 41 - Bit 7)
          LE Set Connected Isochronous Group Parameters Test (Octet 42 - Bit 0)
          LE Create Connected Isochronous Stream (Octet 42 - Bit 1)
          LE Remove Connected Isochronous Group (Octet 42 - Bit 2)
          LE Accept Connected Isochronous Stream Request (Octet 42 - Bit 3)
          LE Reject Connected Isochronous Stream Request (Octet 42 - Bit 4)
          LE Create Broadcast Isochronous Group (Octet 42 - Bit 5)
          LE Create Broadcast Isochronous Group Test (Octet 42 - Bit 6)
          LE Terminate Broadcast Isochronous Group (Octet 42 - Bit 7)
          LE Broadcast Isochronous Group Create Sync (Octet 43 - Bit 0)
          LE Broadcast Isochronous Group Terminate Sync (Octet 43 - Bit 1)
          LE Request Peer SCA (Octet 43 - Bit 2)
          LE Setup Isochronous Data Path (Octet 43 - Bit 3)
          LE Remove Isochronous Data Path (Octet 43 - Bit 4)
          LE Isochronous Transmit Test (Octet 43 - Bit 5)
          LE Isochronous Receive Test (Octet 43 - Bit 6)
          LE Isochronous Read Test Counters (Octet 43 - Bit 7)
          LE Isochronous Read Test Counters (Octet 44 - Bit 0)
          LE Set Host Feature (Octet 44 - Bit 1)
          LE Read ISO link quality (Octet 44 - Bit 2)
          Octet 45 - Bit 6 
          Octet 46 - Bit 0 
          Octet 46 - Bit 1 
          Octet 46 - Bit 2 
zephyr.exe[1706187]: < HCI Command: Host Buffer Size (0x03|0x0033) plen 7                                             #9 1.460556
        ACL MTU: 255  ACL max packet: 16
        SCO MTU: 0    SCO max packet: 0
> HCI Event: Command Complete (0x0e) plen 4                                                                          #10 1.461149
      Host Buffer Size (0x03|0x0033) ncmd 1
        Status: Success (0x00)
zephyr.exe[1706187]: < HCI Command: Set Controller To Host Flow Control (0x03|0x0031) plen 1                         #11 1.480564
        Flow control: ACL Data Packets (0x01)
> HCI Event: Command Complete (0x0e) plen 4                                                                          #12 1.481158
      Set Controller To Host Flow Control (0x03|0x0031) ncmd 1
        Status: Success (0x00)
zephyr.exe[1706187]: < HCI Command: LE Read Local Supported Features (0x08|0x0003) plen 0                            #13 1.500566
> HCI Event: Command Complete (0x0e) plen 12                                                                         #14 1.501248
      LE Read Local Supported Features (0x08|0x0003) ncmd 1
        Status: Success (0x00)
        Features: 0xfd 0x79 0x00 0xf7 0x30 0x01 0x00 0x00
          LE Encryption
          Extended Reject Indication
          Peripheral-initiated Features Exchange
          LE Ping
          LE Data Packet Length Extension
          LL Privacy
          Extended Scanner Filter Policies
          LE 2M PHY
          LE Coded PHY
          LE Extended Advertising
          LE Periodic Advertising
          Channel Selection Algorithm #2
          Periodic Advertising Sync Transfer - Sender
          Periodic Advertising Sync Transfer - Recipient
          Sleep Clock Accuracy Updates
          Connected Isochronous Stream - Central
          Connected Isochronous Stream - Peripheral
          Isochronous Broadcaster
          Synchronized Receiver
          Periodic Advertising ADI support
          Connection Subrating
          Unknown features (0x0000010000000000)
zephyr.exe[1706187]: < HCI Command: LE Set Host Feature (0x08|0x0074) plen 2                                         #15 1.520564
        Bit Number: 32
          Connected Isochronous Stream (Host Support)
        Bit Value: 1
> HCI Event: Command Complete (0x0e) plen 4                                                                          #16 1.522080
      LE Set Host Feature (0x08|0x0074) ncmd 1
        Status: Success (0x00)
zephyr.exe[1706187]: < HCI Command: LE Read Buffer v2 (0x08|0x0060) plen 0                                           #17 1.540557
> HCI Event: Command Complete (0x0e) plen 10                                                                         #18 1.541579
      LE Read Buffer v2 (0x08|0x0060) ncmd 1
        Status: Success (0x00)
        ACL MTU: 27
        ACL max packet: 3
        ISO MTU: 318
        ISO max packet: 3
zephyr.exe[1706187]: < HCI Command: LE Read Maximum Advertising Data Length (0x08|0x003a) plen 0                     #19 1.560554
> HCI Event: Command Complete (0x0e) plen 6                                                                          #20 1.561105
      LE Read Maximum Advertising Data Length (0x08|0x003a) ncmd 1
        Status: Success (0x00)
        Max length: 1650
zephyr.exe[1706187]: < HCI Command: LE Read Supported States (0x08|0x001c) plen 0                                    #21 1.580559
> HCI Event: Command Complete (0x0e) plen 12                                                                         #22 1.581285
      LE Read Supported States (0x08|0x001c) ncmd 1
        Status: Success (0x00)
        States: 0x000003ff3e0306ff
          Non-connectable Advertising State
          Scannable Advertising State
          Connectable Advertising State
          High Duty Cycle Directed Advertising State
          Passive Scanning State
          Active Scanning State
          Initiating State
            and Connection State (Central Role)
          Connection State (Peripheral Role)
          Scannable Advertising State
            and Passive Scanning State
          Connectable Advertising State
            and Passive Scanning State
          Non-connectable Advertising State
            and Initiating State
          Scannable Advertising State
            and Initiating State
          Active Scanning State
            and Connection State (Central Role)
          Passive Scanning State
            and Connection State (Peripheral Role)
          Active Scanning State
            and Connection State (Peripheral Role)
          Initiating State
            and Connection State (Central Role)
            and Central Role & Central Role
          Low Duty Cycle Directed Advertising State
          Connectable Advertising State
            and Initiating State
            and Central Role & Peripheral Role
          High Duty Cycle Directed Advertising State
            and Initiating State
            and Central Role & Peripheral Role
          Low Duty Cycle Directed Advertising State
            and Initiating State
            and Central Role & Peripheral Role
          Connectable Advertising State
            and Connection State (Central Role)
            and Central Role & Peripheral Role
          High Duty Cycle Directed Advertising State
            and Connection State (Central Role)
            and Central Role & Peripheral Role
          Low Duty Cycle Directed Advertising State
            and Connection State (Central Role)
            and Central Role & Peripheral Role
          Connectable Advertising State
            and Connection State (Peripheral Role)
            and Central Role & Peripheral Role
          High Duty Cycle Directed Advertising State
            and Connection State (Peripheral Role)
            and Peripheral Role & Peripheral Role
          Low Duty Cycle Directed Advertising State
            and Connection State (Peripheral Role)
            and Peripheral Role & Peripheral Role
          Initiating State
            and Connection State (Peripheral Role)
            and Central Role & Peripheral Role
zephyr.exe[1706187]: < HCI Command: LE Read Maximum Data Length (0x08|0x002f) plen 0                                 #23 1.600542
> HCI Event: Command Complete (0x0e) plen 12                                                                         #24 1.601126
      LE Read Maximum Data Length (0x08|0x002f) ncmd 1
        Status: Success (0x00)
        Max TX octets: 251
        Max TX time: 2704
        Max RX octets: 251
        Max RX time: 2704
zephyr.exe[1706187]: < HCI Command: LE Write Suggested Default Data Length (0x08|0x0024) plen 4                      #25 1.620555
        TX octets: 251
        TX time: 2704
> HCI Event: Command Complete (0x0e) plen 4                                                                          #26 1.621390
      LE Write Suggested Default Data Length (0x08|0x0024) ncmd 1
        Status: Success (0x00)
zephyr.exe[1706187]: < HCI Command: LE Read Resolving List Size (0x08|0x002a) plen 0                                 #27 1.640561
> HCI Event: Command Complete (0x0e) plen 5                                                                          #28 1.641256
      LE Read Resolving List Size (0x08|0x002a) ncmd 1
        Status: Success (0x00)
        Size: 8
zephyr.exe[1706187]: < HCI Command: LE Set Event Mask (0x08|0x0001) plen 8                                           #29 1.660554
        Mask: 0x000002023f87fa5e
          LE Advertising Report
          LE Connection Update Complete
          LE Read Remote Used Features Complete
          LE Long Term Key Request
          LE Data Length Change
          LE Enhanced Connection Complete
          LE PHY Update Complete
          LE Extended Advertising Report
          LE Periodic Advertising Sync Established
          LE Periodic Advertising Report
          LE Periodic Advertising Sync Lost
          LE Extended Scan Timeout
          LE Extended Advertising Set Terminated
          LE Scan Request Received
          LE Periodic Advertising Sync Transfer Rvc
          LE CIS Established
          LE CIS Request
          LE Create BIG Complete
          LE Terminate BIG Complete
          LE BIG Sync Established Complete
          LE BIG Sync Lost
          LE BIG Info Advertising Report
          Unknown mask (0x0000020000000000)
> HCI Event: Command Complete (0x0e) plen 4                                                                          #30 1.661252
      LE Set Event Mask (0x08|0x0001) ncmd 1
        Status: Success (0x00)
zephyr.exe[1706187]: < HCI Command: Set Event Mask (0x03|0x0001) plen 8                                              #31 1.680565
        Mask: 0x2000800002008890
          Disconnection Complete
          Encryption Change
          Read Remote Version Information Complete
          Hardware Error
          Data Buffer Overflow
          Encryption Key Refresh Complete
          LE Meta
> HCI Event: Command Complete (0x0e) plen 4                                                                          #32 1.681344
      Set Event Mask (0x03|0x0001) ncmd 1
        Status: Success (0x00)
zephyr.exe[1706187]: < HCI Command: Read BD ADDR (0x04|0x0009) plen 0                                                #33 1.700557
> HCI Event: Command Complete (0x0e) plen 10                                                                         #34 1.701170
      Read BD ADDR (0x04|0x0009) ncmd 1
        Status: Success (0x00)
        Address: 00:00:00:00:00:00 (OUI 00-00-00)
zephyr.exe[1706187]: < HCI Command: LE Set Random Address (0x08|0x0005) plen 6                                       #35 1.720575
        Address: D5:B6:CC:31:DB:3B (Static)
> HCI Event: Command Complete (0x0e) plen 4                                                                          #36 1.721463
      LE Set Random Address (0x08|0x0005) ncmd 1
        Status: Success (0x00)
zephyr.exe[1706187]: < HCI Command: LE Set Extended Advertising Parameters (0x08|0x0036) plen 25                     #37 4.160629
        Handle: 0x00
        Properties: 0x0013
          Connectable
          Scannable
          Use legacy advertising PDUs: ADV_IND
        Min advertising interval: 100.000 msec (0x00a0)
        Max advertising interval: 150.000 msec (0x00f0)
        Channel map: 37, 38, 39 (0x07)
        Own address type: Random (0x01)
        Peer address type: Public (0x00)
        Peer address: 00:00:00:00:00:00 (OUI 00-00-00)
        Filter policy: Allow Scan Request from Any, Allow Connect Request from Any (0x00)
        TX power: Host has no preference (0x7f)
        Primary PHY: LE 1M (0x01)
        Secondary max skip: 0x00
        Secondary PHY: LE 1M (0x01)
        SID: 0x00
        Scan request notifications: Disabled (0x00)
> HCI Event: Command Complete (0x0e) plen 5                                                                          #38 4.162176
      LE Set Extended Advertising Parameters (0x08|0x0036) ncmd 1
        Status: Success (0x00)
        TX power (selected): 0 dbm (0x00)
zephyr.exe[1706187]: < HCI Command: LE Set Advertising Set Random Address (0x08|0x0035) plen 7                       #39 4.180585
        Advertising handle: 0x00
        Advertising random address: D5:B6:CC:31:DB:3B (Static)
> HCI Event: Command Complete (0x0e) plen 4                                                                          #40 4.181615
      LE Set Advertising Set Random Address (0x08|0x0035) ncmd 1
        Status: Success (0x00)
zephyr.exe[1706187]: < HCI Command: LE Set Extended Advertising Data (0x08|0x0037) plen 22                           #41 4.200594
        Handle: 0x00
        Operation: Complete extended advertising data (0x03)
        Fragment preference: Minimize fragmentation (0x01)
        Data length: 0x12
        Flags: 0x06
          LE General Discoverable Mode
          BR/EDR Not Supported
        Name (complete): Tester_2CB6EE
> HCI Event: Command Complete (0x0e) plen 4                                                                          #42 4.201674
      LE Set Extended Advertising Data (0x08|0x0037) ncmd 1
        Status: Success (0x00)
zephyr.exe[1706187]: < HCI Command: LE Set Extended Scan Response Data (0x08|0x0038) plen 4                          #43 4.220593
        Handle: 0x00
        Operation: Complete scan response data (0x03)
        Fragment preference: Minimize fragmentation (0x01)
        Data length: 0x00
> HCI Event: Command Complete (0x0e) plen 4                                                                          #44 4.221425
      LE Set Extended Scan Response Data (0x08|0x0038) ncmd 1
        Status: Success (0x00)
zephyr.exe[1706187]: < HCI Command: LE Set Extended Advertising Enable (0x08|0x0039) plen 6                          #45 4.240593
        Extended advertising: Enabled (0x01)
        Number of sets: 1 (0x01)
        Entry 0
          Handle: 0x00
          Duration: 0 ms (0x00)
          Max ext adv events: 0
> HCI Event: Command Complete (0x0e) plen 4                                                                          #46 4.241533
      LE Set Extended Advertising Enable (0x08|0x0039) ncmd 1
        Status: Success (0x00)
> HCI Event: LE Meta Event (0x3e) plen 31                                                                            #47 4.349849
      LE Enhanced Connection Complete (0x0a)
        Status: Success (0x00)
        Handle: 57
        Role: Peripheral (0x01)
        Peer address type: Public (0x00)
        Peer address: C0:07:E8:2C:B6:EE (OUI C0-07-E8)
        Local resolvable private address: 00:00:00:00:00:00 (Non-Resolvable)
        Peer resolvable private address: 00:00:00:00:00:00 (Non-Resolvable)
        Connection interval: 62.50 msec (0x0032)
        Connection latency: 0 (0x0000)
        Supervision timeout: 25120 msec (0x09d0)
        Central clock accuracy: 0x07
> HCI Event: LE Meta Event (0x3e) plen 6                                                                             #48 4.350141
      LE Advertising Set Terminated (0x12)
        Status: Success (0x00)
        Handle: 0
        Connection handle: 57
        Number of completed extended advertising events: 0
zephyr.exe[1706187]: < HCI Command: LE Read Remote Used Features (0x08|0x0016) plen 2                                #49 4.360647
        Handle: 57 Address: C0:07:E8:2C:B6:EE (OUI C0-07-E8)
> HCI Event: Command Status (0x0f) plen 4                                                                            #50 4.361495
      LE Read Remote Used Features (0x08|0x0016) ncmd 1
        Status: Success (0x00)
zephyr.exe[1706187]: < HCI Command: LE Set PHY (0x08|0x0032) plen 7                                                  #51 4.380556
        Handle: 57 Address: C0:07:E8:2C:B6:EE (OUI C0-07-E8)
        All PHYs preference: 0x00
        TX PHYs preference: 0x02
          LE 2M
        RX PHYs preference: 0x02
          LE 2M
        PHY options preference: Reserved (0x0000)
> HCI Event: Command Status (0x0f) plen 4                                                                            #52 4.381135
      LE Set PHY (0x08|0x0032) ncmd 1
        Status: Success (0x00)
zephyr.exe[1706187]: < ACL Data TX: Handle 57 [1/3] flags 0x00 dlen 7                                                #53 4.400529
      ATT: Exchange MTU Request (0x02) len 2
        Client RX MTU: 251
> HCI Event: Number of Completed Packets (0x13) plen 5                                                               #54 4.475918
        Num handles: 1
        Handle: 57 Address: C0:07:E8:2C:B6:EE (OUI C0-07-E8)
        Count: 1
        Buffers: 0/3
        #53: len 7 (0 Kb/s)
        Latency: 75 msec (75-75 msec ~75 msec)
> HCI Event: LE Meta Event (0x3e) plen 12                                                                            #55 4.538830
      LE Read Remote Used Features (0x04)
        Status: Success (0x00)
        Handle: 57 Address: C0:07:E8:2C:B6:EE (OUI C0-07-E8)
        Features: 0x2d 0x49 0x01 0xf7 0xef 0x39 0x00 0x80
          LE Encryption
          Extended Reject Indication
          Peripheral-initiated Features Exchange
          LE Data Packet Length Extension
          LE 2M PHY
          LE Coded PHY
          Channel Selection Algorithm #2
          Minimum Number of Used Channels Procedure
          Periodic Advertising Sync Transfer - Sender
          Periodic Advertising Sync Transfer - Recipient
          Sleep Clock Accuracy Updates
          Connected Isochronous Stream - Central
          Connected Isochronous Stream - Peripheral
          Isochronous Broadcaster
          Synchronized Receiver
          Connected Isochronous Stream (Host Support)
          LE Power Control Request
          LE Power Control Request
          LE Path Loss Monitoring
          Connection Subrating
          Connection Subrating (Host Support)
          Channel Classification
          Unknown features (0x8000390000000000)
> HCI Event: LE Meta Event (0x3e) plen 6                                                                             #56 5.038032
      LE PHY Update Complete (0x0c)
        Status: Success (0x00)
        Handle: 57 Address: C0:07:E8:2C:B6:EE (OUI C0-07-E8)
        TX PHY: LE 2M (0x02)
        RX PHY: LE 2M (0x02)
> ACL Data RX: Handle 57 flags 0x02 dlen 11                                                                          #57 6.913492
      SMP: Pairing Request (0x01) len 6
        IO capability: KeyboardDisplay (0x04)
        OOB data: Authentication data not present (0x00)
        Authentication requirement: Bonding, No MITM, SC, No Keypresses (0x09)
        Max encryption key size: 16
        Initiator key distribution: EncKey IdKey (0x03)
        Responder key distribution: EncKey IdKey Sign (0x07)
> ACL Data RX: Handle 57 flags 0x02 dlen 7                                                                           #58 6.913862
      ATT: Exchange MTU Response (0x03) len 2
        Server RX MTU: 23
zephyr.exe[1706187]: < HCI Command: Host Number of Completed Packets (0x03|0x0035) plen 5                            #59 6.920744
        Num handles: 1
        Handle: 57 Address: C0:07:E8:2C:B6:EE (OUI C0-07-E8)
        Count: 1
zephyr.exe[1706187]: < ACL Data TX: Handle 57 [1/3] flags 0x00 dlen 11                                               #60 6.920903
      SMP: Pairing Response (0x02) len 6
        IO capability: DisplayOnly (0x00)
        OOB data: Authentication data not present (0x00)
        Authentication requirement: Bonding, No MITM, SC, No Keypresses (0x09)
        Max encryption key size: 16
        Initiator key distribution: IdKey (0x02)
        Responder key distribution: Sign (0x04)
zephyr.exe[1706187]: < HCI Command: Host Number of Completed Packets (0x03|0x0035) plen 5                            #61 6.921306
        Num handles: 1
        Handle: 57 Address: C0:07:E8:2C:B6:EE (OUI C0-07-E8)
        Count: 1
> HCI Event: Number of Completed Packets (0x13) plen 5                                                               #62 7.038546
        Num handles: 1
        Handle: 57 Address: C0:07:E8:2C:B6:EE (OUI C0-07-E8)
        Count: 1
        Buffers: 0/3
        #60: len 11 (0 Kb/s)
        Latency: 117 msec (75-117 msec ~96 msec)
> ACL Data RX: Handle 57 flags 0x02 dlen 27                                                                          #63 7.039060
> ACL Data RX: Handle 57 flags 0x01 dlen 27                                                                          #64 7.039229
> ACL Data RX: Handle 57 flags 0x01 dlen 15                                                                          #65 7.039554
      SMP: Pairing Public Key (0x0c) len 64
        X[32]: ec77ccc05f178c05bfd2c25c41ee9bfacede4d16d0fc532a0587cb9d499d1e51
        Y[32]: 510068fc44a7c72ec57ecdfc4df65b6521e1de444a238538041c5e2fcb844e07
zephyr.exe[1706187]: < HCI Command: Host Number of Completed Packets (0x03|0x0035) plen 5                            #66 7.040751
        Num handles: 1
        Handle: 57 Address: C0:07:E8:2C:B6:EE (OUI C0-07-E8)
        Count: 1
zephyr.exe[1706187]: < HCI Command: Host Number of Completed Packets (0x03|0x0035) plen 5                            #67 7.040987
        Num handles: 1
        Handle: 57 Address: C0:07:E8:2C:B6:EE (OUI C0-07-E8)
        Count: 1
zephyr.exe[1706187]: < HCI Command: Host Number of Completed Packets (0x03|0x0035) plen 5                            #68 7.041024
        Num handles: 1
        Handle: 57 Address: C0:07:E8:2C:B6:EE (OUI C0-07-E8)
        Count: 1
zephyr.exe[1706187]: < ACL Data TX: Handle 57 [1/3] flags 0x00 dlen 27                                               #69 7.041629
zephyr.exe[1706187]: < ACL Data TX: Handle 57 flags 0x01 dlen 27                                                     #70 7.041693
zephyr.exe[1706187]: < ACL Data TX: Handle 57 flags 0x01 dlen 15                                                     #71 7.041713
      SMP: Pairing Public Key (0x0c) len 64
        X[32]: 98308440221e2d910f0e54b71e7ec652857aa9b5a0dc65028824cc19db1226e9
        Y[32]: 67a4816bcb62efb21701e31fdb27561a6217575fb007a8bbdabe7e28b6f68482
> HCI Event: Number of Completed Packets (0x13) plen 5                                                               #72 7.101308
        Num handles: 1
        Handle: 57 Address: C0:07:E8:2C:B6:EE (OUI C0-07-E8)
        Count: 1
        Buffers: 0/3
        #69: len 27 (3 Kb/s)
        Latency: 59 msec (59-117 msec ~78 msec)
> HCI Event: Number of Completed Packets (0x13) plen 5                                                               #73 7.101845
        Num handles: 1
        Handle: 57 Address: C0:07:E8:2C:B6:EE (OUI C0-07-E8)
        Count: 1
        Buffers: underflow/3
        #70: len 27 (3 Kb/s)
        Latency: 60 msec (59-117 msec ~69 msec)
zephyr.exe[1706187]: < ACL Data TX: Handle 57 [1/3] flags 0x00 dlen 21                                               #74 7.120566
      SMP: Pairing Confirm (0x03) len 16
        Confirm value[16]: af5d46b00a1d867bbc65fe4b30944632
> HCI Event: Number of Completed Packets (0x13) plen 5                                                               #75 7.163440
        Num handles: 1
        Handle: 57 Address: C0:07:E8:2C:B6:EE (OUI C0-07-E8)
        Count: 1
        Buffers: 0/3
        #71: len 15 (0 Kb/s)
        Latency: 121 msec (59-121 msec ~95 msec)
> HCI Event: Number of Completed Packets (0x13) plen 5                                                               #76 7.226011
        Num handles: 1
        Handle: 57 Address: C0:07:E8:2C:B6:EE (OUI C0-07-E8)
        Count: 1
        Buffers: underflow/3
        #74: len 21 (1 Kb/s)
        Latency: 105 msec (59-121 msec ~100 msec)
> ACL Data RX: Handle 57 flags 0x02 dlen 21                                                                          #77 7.226295
      SMP: Pairing Random (0x04) len 16
        Random value[16]: 4d1b5062b1400df40000000000000000
zephyr.exe[1706187]: < HCI Command: Host Number of Completed Packets (0x03|0x0035) plen 5                            #78 7.240661
        Num handles: 1
        Handle: 57 Address: C0:07:E8:2C:B6:EE (OUI C0-07-E8)
        Count: 1
zephyr.exe[1706187]: < ACL Data TX: Handle 57 [1/3] flags 0x00 dlen 21                                               #79 7.240768
      SMP: Pairing Random (0x04) len 16
        Random value[16]: 8e6108f966a694cbe26df70bb96773e6
> HCI Event: Number of Completed Packets (0x13) plen 5                                                               #80 7.350918
        Num handles: 1
        Handle: 57 Address: C0:07:E8:2C:B6:EE (OUI C0-07-E8)
        Count: 1
        Buffers: 0/3
        #79: len 21 (1 Kb/s)
        Latency: 110 msec (59-121 msec ~105 msec)
> ACL Data RX: Handle 57 flags 0x02 dlen 21                                                                          #81 7.413688
      SMP: Pairing DHKey Check (0x0d) len 16
        E[16]: a843548a21d8f6221a10c12ce1e436e7
zephyr.exe[1706187]: < HCI Command: Host Number of Completed Packets (0x03|0x0035) plen 5                            #82 7.420760
        Num handles: 1
        Handle: 57 Address: C0:07:E8:2C:B6:EE (OUI C0-07-E8)
        Count: 1
zephyr.exe[1706187]: < ACL Data TX: Handle 57 [1/3] flags 0x00 dlen 21                                               #83 7.421395
      SMP: Pairing DHKey Check (0x0d) len 16
        E[16]: 5fedff7f866eda74e4fe7b66570dfc76
> HCI Event: Number of Completed Packets (0x13) plen 5                                                               #84 7.538353
        Num handles: 1
        Handle: 57 Address: C0:07:E8:2C:B6:EE (OUI C0-07-E8)
        Count: 1
        Buffers: 0/3
        #83: len 21 (1 Kb/s)
        Latency: 116 msec (59-121 msec ~111 msec)
> HCI Event: LE Meta Event (0x3e) plen 13                                                                            #85 7.601391
      LE Long Term Key Request (0x05)
        Handle: 57 Address: C0:07:E8:2C:B6:EE (OUI C0-07-E8)
        Random number: 0x0000000000000000
        Encrypted diversifier: 0x0000
zephyr.exe[1706187]: < HCI Command: LE Long Term Key Request Reply (0x08|0x001a) plen 18                             #86 7.620607
        Handle: 57 Address: C0:07:E8:2C:B6:EE (OUI C0-07-E8)
        Long term key[16]: f840997b82cc24c775d6255ef69701de
> HCI Event: Command Complete (0x0e) plen 6                                                                          #87 7.621308
      LE Long Term Key Request Reply (0x08|0x001a) ncmd 1
        Status: Success (0x00)
        Handle: 57 Address: C0:07:E8:2C:B6:EE (OUI C0-07-E8)
> HCI Event: Encryption Change (0x08) plen 4                                                                         #88 7.913605
        Status: Success (0x00)
        Handle: 57 Address: C0:07:E8:2C:B6:EE (OUI C0-07-E8)
        Encryption: Enabled with AES-CCM (0x01)
zephyr.exe[1706187]: < ACL Data TX: Handle 57 [1/3] flags 0x00 dlen 21                                               #89 8.030695
      SMP: Signing Information (0x0a) len 16
        Signature key[16]: 5da095555cc64d02679f89a05211af56
> HCI Event: Number of Completed Packets (0x13) plen 5                                                               #90 8.101068
        Num handles: 1
        Handle: 57 Address: C0:07:E8:2C:B6:EE (OUI C0-07-E8)
        Count: 1
        Buffers: 0/3
        #89: len 21 (2 Kb/s)
        Latency: 70 msec (59-121 msec ~90 msec)
> ACL Data RX: Handle 57 flags 0x02 dlen 21                                                                          #91 8.101508
      SMP: Identity Information (0x08) len 16
        Identity resolving key[16]: 8f9b6b0e206abb2be40861f4951809b9
> ACL Data RX: Handle 57 flags 0x02 dlen 12                                                                          #92 8.101513
      SMP: Identity Address Information (0x09) len 7
        Address: C0:07:E8:2C:B6:EE (OUI C0-07-E8)
zephyr.exe[1706187]: < HCI Command: Host Number of Completed Packets (0x03|0x0035) plen 5                            #93 8.120762
        Num handles: 1
        Handle: 57 Address: C0:07:E8:2C:B6:EE (OUI C0-07-E8)
        Count: 1
zephyr.exe[1706187]: < HCI Command: LE Add Device To Resolving List (0x08|0x0027) plen 39                            #94 8.120936
        Address type: Public (0x00)
        Address: C0:07:E8:2C:B6:EE (OUI C0-07-E8)
        Peer identity resolving key[16]: 8f9b6b0e206abb2be40861f4951809b9
        Local identity resolving key[16]: 00000000000000000000000000000000
> HCI Event: Command Complete (0x0e) plen 4                                                                          #95 8.122090
      LE Add Device To Resolving List (0x08|0x0027) ncmd 1
        Status: Success (0x00)
zephyr.exe[1706187]: < HCI Command: LE Set Privacy Mode (0x08|0x004e) plen 8                                         #96 8.140618
        Peer Identity address type: Public (0x00)
        Peer Identity address: C0:07:E8:2C:B6:EE (OUI C0-07-E8)
        Privacy Mode: Use Device Privacy (0x01)
> HCI Event: Command Complete (0x0e) plen 4                                                                          #97 8.141578
      LE Set Privacy Mode (0x08|0x004e) ncmd 1
        Status: Success (0x00)
zephyr.exe[1706187]: < HCI Command: LE Set Address Resolution Enable (0x08|0x002d) plen 1                            #98 8.160715
        Address resolution: Enabled (0x01)
> HCI Event: Command Complete (0x0e) plen 4                                                                          #99 8.161711
      LE Set Address Resolution Enable (0x08|0x002d) ncmd 1
        Status: Success (0x00)
zephyr.exe[1706187]: < HCI Command: Host Number of Completed Packets (0x03|0x0035) plen 5                           #100 8.180678
        Num handles: 1
        Handle: 57 Address: C0:07:E8:2C:B6:EE (OUI C0-07-E8)
        Count: 1
> ACL Data RX: Handle 57 flags 0x02 dlen 13                                                                         #101 8.226068
      ATT: Find By Type Value Request (0x06) len 8
        Handle range: 0x0001-0xffff
        Attribute type: Primary Service (0x2800)
          UUID: Generic Telephony Bearer (0x184c)
zephyr.exe[1706187]: < HCI Command: Host Number of Completed Packets (0x03|0x0035) plen 5                           #102 8.240767
        Num handles: 1
        Handle: 57 Address: C0:07:E8:2C:B6:EE (OUI C0-07-E8)
        Count: 1
zephyr.exe[1706187]: < ACL Data TX: Handle 57 [1/3] flags 0x00 dlen 9                                               #103 8.241062
      ATT: Find By Type Value Response (0x07) len 4
        Handle range: 0x0024-0x0050
> HCI Event: Number of Completed Packets (0x13) plen 5                                                              #104 8.351001
        Num handles: 1
        Handle: 57 Address: C0:07:E8:2C:B6:EE (OUI C0-07-E8)
        Count: 1
        Buffers: 0/3
        #103: len 9 (0 Kb/s)
        Latency: 109 msec (59-121 msec ~100 msec)
> ACL Data RX: Handle 57 flags 0x02 dlen 13                                                                         #105 8.351482
      ATT: Find By Type Value Request (0x06) len 8
        Handle range: 0x0051-0xffff
        Attribute type: Primary Service (0x2800)
          UUID: Generic Telephony Bearer (0x184c)
zephyr.exe[1706187]: < HCI Command: Host Number of Completed Packets (0x03|0x0035) plen 5                           #106 8.360765
        Num handles: 1
        Handle: 57 Address: C0:07:E8:2C:B6:EE (OUI C0-07-E8)
        Count: 1
zephyr.exe[1706187]: < ACL Data TX: Handle 57 [1/3] flags 0x00 dlen 9                                               #107 8.361022
      ATT: Error Response (0x01) len 4
        Find By Type Value Request (0x06)
        Handle: 0x0051
        Error: Attribute Not Found (0x0a)
> HCI Event: Number of Completed Packets (0x13) plen 5                                                              #108 8.475963
        Num handles: 1
        Handle: 57 Address: C0:07:E8:2C:B6:EE (OUI C0-07-E8)
        Count: 1
        Buffers: 0/3
        #107: len 9 (0 Kb/s)
        Latency: 114 msec (59-121 msec ~107 msec)
> ACL Data RX: Handle 57 flags 0x02 dlen 11                                                                         #109 8.476287
      ATT: Read By Type Request (0x08) len 6
        Handle range: 0x0024-0x0050
        Attribute type: Characteristic (0x2803)
zephyr.exe[1706187]: < HCI Command: Host Number of Completed Packets (0x03|0x0035) plen 5                           #110 8.480758
        Num handles: 1
        Handle: 57 Address: C0:07:E8:2C:B6:EE (OUI C0-07-E8)
        Count: 1
zephyr.exe[1706187]: < ACL Data TX: Handle 57 [1/3] flags 0x00 dlen 20                                              #111 8.481052
      ATT: Read By Type Response (0x09) len 15
        Attribute data length: 7
        Attribute data list: 2 entries
        Handle: 0x0025
        Value[5]: 122600b32b
            Properties: 0x12
              Read (0x02)
              Notify (0x10)
            Value Handle: 0x0026
            Value UUID: Bearer Provider Name (0x2bb3)
        Handle: 0x0028
        Value[5]: 022900b42b
            Properties: 0x02
              Read (0x02)
            Value Handle: 0x0029
            Value UUID: Bearer UCI (0x2bb4)
> HCI Event: Number of Completed Packets (0x13) plen 5                                                              #112 8.601025
        Num handles: 1
        Handle: 57 Address: C0:07:E8:2C:B6:EE (OUI C0-07-E8)
        Count: 1
        Buffers: 0/3
        #111: len 20 (1 Kb/s)
        Latency: 119 msec (59-121 msec ~113 msec)
> ACL Data RX: Handle 57 flags 0x02 dlen 11                                                                         #113 8.601382
      ATT: Read By Type Request (0x08) len 6
        Handle range: 0x0029-0x0050
        Attribute type: Characteristic (0x2803)
zephyr.exe[1706187]: < HCI Command: Host Number of Completed Packets (0x03|0x0035) plen 5                           #114 8.620750
        Num handles: 1
        Handle: 57 Address: C0:07:E8:2C:B6:EE (OUI C0-07-E8)
        Count: 1
zephyr.exe[1706187]: < ACL Data TX: Handle 57 [1/3] flags 0x00 dlen 20                                              #115 8.621083
      ATT: Read By Type Response (0x09) len 15
        Attribute data length: 7
        Attribute data list: 2 entries
        Handle: 0x002a
        Value[5]: 122b00b52b
            Properties: 0x12
              Read (0x02)
              Notify (0x10)
            Value Handle: 0x002b
            Value UUID: Bearer Technology (0x2bb5)
        Handle: 0x002d
        Value[5]: 122e00b62b
            Properties: 0x12
              Read (0x02)
              Notify (0x10)
            Value Handle: 0x002e
            Value UUID: Bearer URI Schemes Supported List (0x2bb6)
> HCI Event: Number of Completed Packets (0x13) plen 5                                                              #116 8.726014
        Num handles: 1
        Handle: 57 Address: C0:07:E8:2C:B6:EE (OUI C0-07-E8)
        Count: 1
        Buffers: 0/3
        #115: len 20 (1 Kb/s)
        Latency: 104 msec (59-121 msec ~109 msec)
> ACL Data RX: Handle 57 flags 0x02 dlen 11                                                                         #117 8.726606
      ATT: Read By Type Request (0x08) len 6
        Handle range: 0x002e-0x0050
        Attribute type: Characteristic (0x2803)
zephyr.exe[1706187]: < HCI Command: Host Number of Completed Packets (0x03|0x0035) plen 5                           #118 8.740754
        Num handles: 1
        Handle: 57 Address: C0:07:E8:2C:B6:EE (OUI C0-07-E8)
        Count: 1
zephyr.exe[1706187]: < ACL Data TX: Handle 57 [1/3] flags 0x00 dlen 20                                              #119 8.741282
      ATT: Read By Type Response (0x09) len 15
        Attribute data length: 7
        Attribute data list: 2 entries
        Handle: 0x0030
        Value[5]: 123100b72b
            Properties: 0x12
              Read (0x02)
              Notify (0x10)
            Value Handle: 0x0031
            Value UUID: Bearer Signal Strength (0x2bb7)
        Handle: 0x0033
        Value[5]: 0e3400b82b
            Properties: 0x0e
              Read (0x02)
              Write Without Response (0x04)
              Write (0x08)
            Value Handle: 0x0034
            Value UUID: Bearer Signal Strength Reporting Interval (0x2bb8)
> HCI Event: Number of Completed Packets (0x13) plen 5                                                              #120 8.850982
        Num handles: 1
        Handle: 57 Address: C0:07:E8:2C:B6:EE (OUI C0-07-E8)
        Count: 1
        Buffers: 0/3
        #119: len 20 (1 Kb/s)
        Latency: 109 msec (59-121 msec ~109 msec)
> ACL Data RX: Handle 57 flags 0x02 dlen 11                                                                         #121 8.851244
      ATT: Read By Type Request (0x08) len 6
        Handle range: 0x0034-0x0050
        Attribute type: Characteristic (0x2803)
zephyr.exe[1706187]: < HCI Command: Host Number of Completed Packets (0x03|0x0035) plen 5                           #122 8.860772
        Num handles: 1
        Handle: 57 Address: C0:07:E8:2C:B6:EE (OUI C0-07-E8)
        Count: 1
zephyr.exe[1706187]: < ACL Data TX: Handle 57 [1/3] flags 0x00 dlen 20                                              #123 8.861362
      ATT: Read By Type Response (0x09) len 15
        Attribute data length: 7
        Attribute data list: 2 entries
        Handle: 0x0035
        Value[5]: 123600b92b
            Properties: 0x12
              Read (0x02)
              Notify (0x10)
            Value Handle: 0x0036
            Value UUID: Bearer List Current Calls (0x2bb9)
        Handle: 0x0038
        Value[5]: 023900ba2b
            Properties: 0x02
              Read (0x02)
            Value Handle: 0x0039
            Value UUID: Content Control ID (0x2bba)
> HCI Event: Number of Completed Packets (0x13) plen 5                                                              #124 8.975994
        Num handles: 1
        Handle: 57 Address: C0:07:E8:2C:B6:EE (OUI C0-07-E8)
        Count: 1
        Buffers: 0/3
        #123: len 20 (1 Kb/s)
        Latency: 114 msec (59-121 msec ~112 msec)
> ACL Data RX: Handle 57 flags 0x02 dlen 11                                                                         #125 8.976321
      ATT: Read By Type Request (0x08) len 6
        Handle range: 0x0039-0x0050
        Attribute type: Characteristic (0x2803)
zephyr.exe[1706187]: < HCI Command: Host Number of Completed Packets (0x03|0x0035) plen 5                           #126 8.980698
        Num handles: 1
        Handle: 57 Address: C0:07:E8:2C:B6:EE (OUI C0-07-E8)
        Count: 1
zephyr.exe[1706187]: < ACL Data TX: Handle 57 [1/3] flags 0x00 dlen 20                                              #127 8.981260
      ATT: Read By Type Response (0x09) len 15
        Attribute data length: 7
        Attribute data list: 2 entries
        Handle: 0x003a
        Value[5]: 123b00bb2b
            Properties: 0x12
              Read (0x02)
              Notify (0x10)
            Value Handle: 0x003b
            Value UUID: Status Flags (0x2bbb)
        Handle: 0x003d
        Value[5]: 123e00bc2b
            Properties: 0x12
              Read (0x02)
              Notify (0x10)
            Value Handle: 0x003e
            Value UUID: Incoming Call Target Bearer URI (0x2bbc)
> HCI Event: Number of Completed Packets (0x13) plen 5                                                              #128 9.101013
        Num handles: 1
        Handle: 57 Address: C0:07:E8:2C:B6:EE (OUI C0-07-E8)
        Count: 1
        Buffers: 0/3
        #127: len 20 (1 Kb/s)
        Latency: 119 msec (59-121 msec ~115 msec)
> ACL Data RX: Handle 57 flags 0x02 dlen 11                                                                         #129 9.101248
      ATT: Read By Type Request (0x08) len 6
        Handle range: 0x003e-0x0050
        Attribute type: Characteristic (0x2803)
zephyr.exe[1706187]: < HCI Command: Host Number of Completed Packets (0x03|0x0035) plen 5                           #130 9.120671
        Num handles: 1
        Handle: 57 Address: C0:07:E8:2C:B6:EE (OUI C0-07-E8)
        Count: 1
zephyr.exe[1706187]: < ACL Data TX: Handle 57 [1/3] flags 0x00 dlen 20                                              #131 9.121238
      ATT: Read By Type Response (0x09) len 15
        Attribute data length: 7
        Attribute data list: 2 entries
        Handle: 0x0040
        Value[5]: 124100bd2b
            Properties: 0x12
              Read (0x02)
              Notify (0x10)
            Value Handle: 0x0041
            Value UUID: Call State (0x2bbd)
        Handle: 0x0043
        Value[5]: 1c4400be2b
            Properties: 0x1c
              Write Without Response (0x04)
              Write (0x08)
              Notify (0x10)
            Value Handle: 0x0044
            Value UUID: Call Control Point (0x2bbe)
> HCI Event: Number of Completed Packets (0x13) plen 5                                                              #132 9.226083
        Num handles: 1
        Handle: 57 Address: C0:07:E8:2C:B6:EE (OUI C0-07-E8)
        Count: 1
        Buffers: 0/3
        #131: len 20 (1 Kb/s)
        Latency: 104 msec (59-121 msec ~110 msec)
> ACL Data RX: Handle 57 flags 0x02 dlen 11                                                                         #133 9.226599
      ATT: Read By Type Request (0x08) len 6
        Handle range: 0x0044-0x0050
        Attribute type: Characteristic (0x2803)
zephyr.exe[1706187]: < HCI Command: Host Number of Completed Packets (0x03|0x0035) plen 5                           #134 9.240791
        Num handles: 1
        Handle: 57 Address: C0:07:E8:2C:B6:EE (OUI C0-07-E8)
        Count: 1
zephyr.exe[1706187]: < ACL Data TX: Handle 57 [1/3] flags 0x00 dlen 20                                              #135 9.241157
      ATT: Read By Type Response (0x09) len 15
        Attribute data length: 7
        Attribute data list: 2 entries
        Handle: 0x0046
        Value[5]: 024700bf2b
            Properties: 0x02
              Read (0x02)
            Value Handle: 0x0047
            Value UUID: Call Control Point Optional Opcodes (0x2bbf)
        Handle: 0x0048
        Value[5]: 104900c02b
            Properties: 0x10
              Notify (0x10)
            Value Handle: 0x0049
            Value UUID: Termination Reason (0x2bc0)
> HCI Event: Number of Completed Packets (0x13) plen 5                                                              #136 9.350979
        Num handles: 1
        Handle: 57 Address: C0:07:E8:2C:B6:EE (OUI C0-07-E8)
        Count: 1
        Buffers: 0/3
        #135: len 20 (1 Kb/s)
        Latency: 109 msec (59-121 msec ~110 msec)
> ACL Data RX: Handle 57 flags 0x02 dlen 11                                                                         #137 9.351423
      ATT: Read By Type Request (0x08) len 6
        Handle range: 0x0049-0x0050
        Attribute type: Characteristic (0x2803)
zephyr.exe[1706187]: < HCI Command: Host Number of Completed Packets (0x03|0x0035) plen 5                           #138 9.360745
        Num handles: 1
        Handle: 57 Address: C0:07:E8:2C:B6:EE (OUI C0-07-E8)
        Count: 1
zephyr.exe[1706187]: < ACL Data TX: Handle 57 [1/3] flags 0x00 dlen 20                                              #139 9.361091
      ATT: Read By Type Response (0x09) len 15
        Attribute data length: 7
        Attribute data list: 2 entries
        Handle: 0x004b
        Value[5]: 124c00c12b
            Properties: 0x12
              Read (0x02)
              Notify (0x10)
            Value Handle: 0x004c
            Value UUID: Incoming Call (0x2bc1)
        Handle: 0x004e
        Value[5]: 124f00c22b
            Properties: 0x12
              Read (0x02)
              Notify (0x10)
            Value Handle: 0x004f
            Value UUID: Call Friendly Name (0x2bc2)
> HCI Event: Number of Completed Packets (0x13) plen 5                                                              #140 9.475931
        Num handles: 1
        Handle: 57 Address: C0:07:E8:2C:B6:EE (OUI C0-07-E8)
        Count: 1
        Buffers: 0/3
        #139: len 20 (1 Kb/s)
        Latency: 114 msec (59-121 msec ~112 msec)
> ACL Data RX: Handle 57 flags 0x02 dlen 11                                                                         #141 9.476178
      ATT: Read By Type Request (0x08) len 6
        Handle range: 0x004f-0x0050
        Attribute type: Characteristic (0x2803)
zephyr.exe[1706187]: < HCI Command: Host Number of Completed Packets (0x03|0x0035) plen 5                           #142 9.480766
        Num handles: 1
        Handle: 57 Address: C0:07:E8:2C:B6:EE (OUI C0-07-E8)
        Count: 1
zephyr.exe[1706187]: < ACL Data TX: Handle 57 [1/3] flags 0x00 dlen 9                                               #143 9.480943
      ATT: Error Response (0x01) len 4
        Read By Type Request (0x08)
        Handle: 0x004f
        Error: Attribute Not Found (0x0a)
> HCI Event: Number of Completed Packets (0x13) plen 5                                                              #144 9.601015
        Num handles: 1
        Handle: 57 Address: C0:07:E8:2C:B6:EE (OUI C0-07-E8)
        Count: 1
        Buffers: 0/3
        #143: len 9 (0 Kb/s)
        Latency: 120 msec (59-121 msec ~116 msec)
> ACL Data RX: Handle 57 flags 0x02 dlen 9                                                                          #145 9.601371
      ATT: Find Information Request (0x04) len 4
        Handle range: 0x0027-0x0027
zephyr.exe[1706187]: < HCI Command: Host Number of Completed Packets (0x03|0x0035) plen 5                           #146 9.620772
        Num handles: 1
        Handle: 57 Address: C0:07:E8:2C:B6:EE (OUI C0-07-E8)
        Count: 1
zephyr.exe[1706187]: < ACL Data TX: Handle 57 [1/3] flags 0x00 dlen 10                                              #147 9.621319
      ATT: Find Information Response (0x05) len 5
        Format: UUID-16 (0x01)
        Handle: 0x0027
        UUID: Client Characteristic Configuration (0x2902)
> HCI Event: Number of Completed Packets (0x13) plen 5                                                              #148 9.725953
        Num handles: 1
        Handle: 57 Address: C0:07:E8:2C:B6:EE (OUI C0-07-E8)
        Count: 1
        Buffers: 0/3
        #147: len 10 (0 Kb/s)
        Latency: 104 msec (59-121 msec ~110 msec)
> ACL Data RX: Handle 57 flags 0x02 dlen 9                                                                          #149 9.726428
      ATT: Find Information Request (0x04) len 4
        Handle range: 0x002c-0x002c
zephyr.exe[1706187]: < HCI Command: Host Number of Completed Packets (0x03|0x0035) plen 5                           #150 9.740769
        Num handles: 1
        Handle: 57 Address: C0:07:E8:2C:B6:EE (OUI C0-07-E8)
        Count: 1
zephyr.exe[1706187]: < ACL Data TX: Handle 57 [1/3] flags 0x00 dlen 10                                              #151 9.741339
      ATT: Find Information Response (0x05) len 5
        Format: UUID-16 (0x01)
        Handle: 0x002c
        UUID: Client Characteristic Configuration (0x2902)
> HCI Event: Number of Completed Packets (0x13) plen 5                                                              #152 9.850966
        Num handles: 1
        Handle: 57 Address: C0:07:E8:2C:B6:EE (OUI C0-07-E8)
        Count: 1
        Buffers: 0/3
        #151: len 10 (0 Kb/s)
        Latency: 109 msec (59-121 msec ~110 msec)
> ACL Data RX: Handle 57 flags 0x02 dlen 9                                                                          #153 9.851341
      ATT: Find Information Request (0x04) len 4
        Handle range: 0x002f-0x002f
zephyr.exe[1706187]: < HCI Command: Host Number of Completed Packets (0x03|0x0035) plen 5                           #154 9.860777
        Num handles: 1
        Handle: 57 Address: C0:07:E8:2C:B6:EE (OUI C0-07-E8)
        Count: 1
zephyr.exe[1706187]: < ACL Data TX: Handle 57 [1/3] flags 0x00 dlen 10                                              #155 9.861024
      ATT: Find Information Response (0x05) len 5
        Format: UUID-16 (0x01)
        Handle: 0x002f
        UUID: Client Characteristic Configuration (0x2902)
> HCI Event: Number of Completed Packets (0x13) plen 5                                                              #156 9.975938
        Num handles: 1
        Handle: 57 Address: C0:07:E8:2C:B6:EE (OUI C0-07-E8)
        Count: 1
        Buffers: 0/3
        #155: len 10 (0 Kb/s)
        Latency: 114 msec (59-121 msec ~112 msec)
> ACL Data RX: Handle 57 flags 0x02 dlen 9                                                                          #157 9.976164
      ATT: Find Information Request (0x04) len 4
        Handle range: 0x0032-0x0032
zephyr.exe[1706187]: < HCI Command: Host Number of Completed Packets (0x03|0x0035) plen 5                           #158 9.980726
        Num handles: 1
        Handle: 57 Address: C0:07:E8:2C:B6:EE (OUI C0-07-E8)
        Count: 1
zephyr.exe[1706187]: < ACL Data TX: Handle 57 [1/3] flags 0x00 dlen 10                                              #159 9.980981
      ATT: Find Information Response (0x05) len 5
        Format: UUID-16 (0x01)
        Handle: 0x0032
        UUID: Client Characteristic Configuration (0x2902)
> HCI Event: Number of Completed Packets (0x13) plen 5                                                             #160 10.101007
        Num handles: 1
        Handle: 57 Address: C0:07:E8:2C:B6:EE (OUI C0-07-E8)
        Count: 1
        Buffers: 0/3
        #159: len 10 (0 Kb/s)
        Latency: 120 msec (59-121 msec ~116 msec)
> ACL Data RX: Handle 57 flags 0x02 dlen 9                                                                         #161 10.101381
      ATT: Find Information Request (0x04) len 4
        Handle range: 0x0037-0x0037
zephyr.exe[1706187]: < HCI Command: Host Number of Completed Packets (0x03|0x0035) plen 5                          #162 10.120644
        Num handles: 1
        Handle: 57 Address: C0:07:E8:2C:B6:EE (OUI C0-07-E8)
        Count: 1
zephyr.exe[1706187]: < ACL Data TX: Handle 57 [1/3] flags 0x00 dlen 10                                             #163 10.121036
      ATT: Find Information Response (0x05) len 5
        Format: UUID-16 (0x01)
        Handle: 0x0037
        UUID: Client Characteristic Configuration (0x2902)
> HCI Event: Number of Completed Packets (0x13) plen 5                                                             #164 10.226016
        Num handles: 1
        Handle: 57 Address: C0:07:E8:2C:B6:EE (OUI C0-07-E8)
        Count: 1
        Buffers: 0/3
        #163: len 10 (0 Kb/s)
        Latency: 104 msec (59-121 msec ~110 msec)
> ACL Data RX: Handle 57 flags 0x02 dlen 9                                                                         #165 10.226467
      ATT: Find Information Request (0x04) len 4
        Handle range: 0x003c-0x003c
zephyr.exe[1706187]: < HCI Command: Host Number of Completed Packets (0x03|0x0035) plen 5                          #166 10.240707
        Num handles: 1
        Handle: 57 Address: C0:07:E8:2C:B6:EE (OUI C0-07-E8)
        Count: 1
zephyr.exe[1706187]: < ACL Data TX: Handle 57 [1/3] flags 0x00 dlen 10                                             #167 10.241056
      ATT: Find Information Response (0x05) len 5
        Format: UUID-16 (0x01)
        Handle: 0x003c
        UUID: Client Characteristic Configuration (0x2902)
> HCI Event: Number of Completed Packets (0x13) plen 5                                                             #168 10.350931
        Num handles: 1
        Handle: 57 Address: C0:07:E8:2C:B6:EE (OUI C0-07-E8)
        Count: 1
        Buffers: 0/3
        #167: len 10 (0 Kb/s)
        Latency: 109 msec (59-121 msec ~110 msec)
> ACL Data RX: Handle 57 flags 0x02 dlen 9                                                                         #169 10.351318
      ATT: Find Information Request (0x04) len 4
        Handle range: 0x003f-0x003f
zephyr.exe[1706187]: < HCI Command: Host Number of Completed Packets (0x03|0x0035) plen 5                          #170 10.360721
        Num handles: 1
        Handle: 57 Address: C0:07:E8:2C:B6:EE (OUI C0-07-E8)
        Count: 1
zephyr.exe[1706187]: < ACL Data TX: Handle 57 [1/3] flags 0x00 dlen 10                                             #171 10.361235
      ATT: Find Information Response (0x05) len 5
        Format: UUID-16 (0x01)
        Handle: 0x003f
        UUID: Client Characteristic Configuration (0x2902)
> HCI Event: Number of Completed Packets (0x13) plen 5                                                             #172 10.475983
        Num handles: 1
        Handle: 57 Address: C0:07:E8:2C:B6:EE (OUI C0-07-E8)
        Count: 1
        Buffers: 0/3
        #171: len 10 (0 Kb/s)
        Latency: 114 msec (59-121 msec ~112 msec)
> ACL Data RX: Handle 57 flags 0x02 dlen 9                                                                         #173 10.476336
      ATT: Find Information Request (0x04) len 4
        Handle range: 0x0042-0x0042
zephyr.exe[1706187]: < HCI Command: Host Number of Completed Packets (0x03|0x0035) plen 5                          #174 10.480791
        Num handles: 1
        Handle: 57 Address: C0:07:E8:2C:B6:EE (OUI C0-07-E8)
        Count: 1
zephyr.exe[1706187]: < ACL Data TX: Handle 57 [1/3] flags 0x00 dlen 10                                             #175 10.481112
      ATT: Find Information Response (0x05) len 5
        Format: UUID-16 (0x01)
        Handle: 0x0042
        UUID: Client Characteristic Configuration (0x2902)
> HCI Event: Number of Completed Packets (0x13) plen 5                                                             #176 10.601027
        Num handles: 1
        Handle: 57 Address: C0:07:E8:2C:B6:EE (OUI C0-07-E8)
        Count: 1
        Buffers: 0/3
        #175: len 10 (0 Kb/s)
        Latency: 119 msec (59-121 msec ~116 msec)
> ACL Data RX: Handle 57 flags 0x02 dlen 9                                                                         #177 10.601375
      ATT: Find Information Request (0x04) len 4
        Handle range: 0x0045-0x0045
zephyr.exe[1706187]: < HCI Command: Host Number of Completed Packets (0x03|0x0035) plen 5                          #178 10.620659
        Num handles: 1
        Handle: 57 Address: C0:07:E8:2C:B6:EE (OUI C0-07-E8)
        Count: 1
zephyr.exe[1706187]: < ACL Data TX: Handle 57 [1/3] flags 0x00 dlen 10                                             #179 10.620964
      ATT: Find Information Response (0x05) len 5
        Format: UUID-16 (0x01)
        Handle: 0x0045
        UUID: Client Characteristic Configuration (0x2902)
> HCI Event: Number of Completed Packets (0x13) plen 5                                                             #180 10.726020
        Num handles: 1
        Handle: 57 Address: C0:07:E8:2C:B6:EE (OUI C0-07-E8)
        Count: 1
        Buffers: 0/3
        #179: len 10 (0 Kb/s)
        Latency: 105 msec (59-121 msec ~110 msec)
> ACL Data RX: Handle 57 flags 0x02 dlen 9                                                                         #181 10.726380
      ATT: Find Information Request (0x04) len 4
        Handle range: 0x004a-0x004a
zephyr.exe[1706187]: < HCI Command: Host Number of Completed Packets (0x03|0x0035) plen 5                          #182 10.740741
        Num handles: 1
        Handle: 57 Address: C0:07:E8:2C:B6:EE (OUI C0-07-E8)
        Count: 1
zephyr.exe[1706187]: < ACL Data TX: Handle 57 [1/3] flags 0x00 dlen 10                                             #183 10.741051
      ATT: Find Information Response (0x05) len 5
        Format: UUID-16 (0x01)
        Handle: 0x004a
        UUID: Client Characteristic Configuration (0x2902)
> HCI Event: Number of Completed Packets (0x13) plen 5                                                             #184 10.850965
        Num handles: 1
        Handle: 57 Address: C0:07:E8:2C:B6:EE (OUI C0-07-E8)
        Count: 1
        Buffers: 0/3
        #183: len 10 (0 Kb/s)
        Latency: 109 msec (59-121 msec ~110 msec)
> ACL Data RX: Handle 57 flags 0x02 dlen 9                                                                         #185 10.851454
      ATT: Find Information Request (0x04) len 4
        Handle range: 0x004d-0x004d
zephyr.exe[1706187]: < HCI Command: Host Number of Completed Packets (0x03|0x0035) plen 5                          #186 10.860782
        Num handles: 1
        Handle: 57 Address: C0:07:E8:2C:B6:EE (OUI C0-07-E8)
        Count: 1
zephyr.exe[1706187]: < ACL Data TX: Handle 57 [1/3] flags 0x00 dlen 10                                             #187 10.860947
      ATT: Find Information Response (0x05) len 5
        Format: UUID-16 (0x01)
        Handle: 0x004d
        UUID: Client Characteristic Configuration (0x2902)
> HCI Event: Number of Completed Packets (0x13) plen 5                                                             #188 10.976030
        Num handles: 1
        Handle: 57 Address: C0:07:E8:2C:B6:EE (OUI C0-07-E8)
        Count: 1
        Buffers: 0/3
        #187: len 10 (0 Kb/s)
        Latency: 115 msec (59-121 msec ~112 msec)
> ACL Data RX: Handle 57 flags 0x02 dlen 9                                                                         #189 10.976281
      ATT: Find Information Request (0x04) len 4
        Handle range: 0x0050-0x0050
zephyr.exe[1706187]: < HCI Command: Host Number of Completed Packets (0x03|0x0035) plen 5                          #190 10.980770
        Num handles: 1
        Handle: 57 Address: C0:07:E8:2C:B6:EE (OUI C0-07-E8)
        Count: 1
zephyr.exe[1706187]: < ACL Data TX: Handle 57 [1/3] flags 0x00 dlen 10                                             #191 10.981256
      ATT: Find Information Response (0x05) len 5
        Format: UUID-16 (0x01)
        Handle: 0x0050
        UUID: Client Characteristic Configuration (0x2902)
> HCI Event: Number of Completed Packets (0x13) plen 5                                                             #192 11.100888
        Num handles: 1
        Handle: 57 Address: C0:07:E8:2C:B6:EE (OUI C0-07-E8)
        Count: 1
        Buffers: 0/3
        #191: len 10 (0 Kb/s)
        Latency: 119 msec (59-121 msec ~116 msec)
> ACL Data RX: Handle 57 flags 0x02 dlen 9                                                                         #193 11.351015
      ATT: Write Request (0x12) len 4
        Handle: 0x004d
          Data[2]: 0000
zephyr.exe[1706187]: < HCI Command: Host Number of Completed Packets (0x03|0x0035) plen 5                          #194 11.361161
        Num handles: 1
        Handle: 57 Address: C0:07:E8:2C:B6:EE (OUI C0-07-E8)
        Count: 1
zephyr.exe[1706187]: < ACL Data TX: Handle 57 [1/3] flags 0x00 dlen 5                                              #195 11.365084
      ATT: Write Response (0x13) len 0
> HCI Event: Number of Completed Packets (0x13) plen 5                                                             #196 11.476007
        Num handles: 1
        Handle: 57 Address: C0:07:E8:2C:B6:EE (OUI C0-07-E8)
        Count: 1
        Buffers: 0/3
        #195: len 5 (0 Kb/s)
        Latency: 110 msec (59-121 msec ~113 msec)
> ACL Data RX: Handle 57 flags 0x02 dlen 9                                                                         #197 11.476260
      ATT: Write Request (0x12) len 4
        Handle: 0x004d
          Data[2]: 0100
zephyr.exe[1706187]: < HCI Command: Host Number of Completed Packets (0x03|0x0035) plen 5                          #198 11.488207
        Num handles: 1
        Handle: 57 Address: C0:07:E8:2C:B6:EE (OUI C0-07-E8)
        Count: 1
zephyr.exe[1706187]: < ACL Data TX: Handle 57 [1/3] flags 0x00 dlen 5                                              #199 11.492086
      ATT: Write Response (0x13) len 0
> HCI Event: Number of Completed Packets (0x13) plen 5                                                             #200 11.601046
        Num handles: 1
        Handle: 57 Address: C0:07:E8:2C:B6:EE (OUI C0-07-E8)
        Count: 1
        Buffers: 0/3
        #199: len 5 (0 Kb/s)
        Latency: 108 msec (59-121 msec ~111 msec)
> ACL Data RX: Handle 57 flags 0x02 dlen 9                                                                         #201 11.601451
      ATT: Read Blob Request (0x0c) len 4
        Handle: 0x004c
        Offset: 0x0000
zephyr.exe[1706187]: < HCI Command: Host Number of Completed Packets (0x03|0x0035) plen 5                          #202 11.620601
        Num handles: 1
        Handle: 57 Address: C0:07:E8:2C:B6:EE (OUI C0-07-E8)
        Count: 1
zephyr.exe[1706187]: < ACL Data TX: Handle 57 [1/3] flags 0x00 dlen 27                                             #203 11.621370
      ATT: Read Blob Response (0x0d) len 22
        Value[22]: 0174656c3a3132333435363738393031323334353637
> HCI Event: Number of Completed Packets (0x13) plen 5                                                             #204 11.725905
        Num handles: 1
        Handle: 57 Address: C0:07:E8:2C:B6:EE (OUI C0-07-E8)
        Count: 1
        Buffers: 0/3
        #203: len 27 (2 Kb/s)
        Latency: 104 msec (59-121 msec ~107 msec)
zephyr.exe[1706187]: < ACL Data TX: Handle 57 [1/3] flags 0x00 dlen 27                                             #205 12.310824
      ATT: Handle Va