Bluetooth monitor ver 5.72
= Note: Linux version 6.14.0-36-generic (x86_64)                       0.219048
= Note: Bluetooth subsystem version 2.22                               0.219050
= New Index: 00:00:00:00:00:00 (Primary,UART,hci2)              [hci2] 0.219051
= New Index: 00:00:00:00:00:00 (Primary,UART,hci1)              [hci1] 0.219051
= New Index: 48:5F:99:8E:E0:64 (Primary,USB,hci0)               [hci0] 0.219052
= Open Index: 00:00:00:00:00:00                                 [hci1] 0.332208
= Index Info: 00:00:00:00:00:00 (Nordic Semiconductor ASA)      [hci1] 0.332213
@ USER Open: main (privileged) version 2.22            {0x0001} [hci1] 0.332216
< HCI Command: Reset (0x03|0x0003) plen 0                    #1 [hci1] 0.332602
> HCI Event: Command Complete (0x0e) plen 4                  #2 [hci1] 0.333102
      Reset (0x03|0x0003) ncmd 1
        Status: Success (0x00)
< HCI Command: Read Local Supported... (0x04|0x0003) plen 0  #3 [hci1] 0.352192
> HCI Event: Command Complete (0x0e) plen 12                 #4 [hci1] 0.352798
      Read Local Supported Features (0x04|0x0003) ncmd 1
        Status: Success (0x00)
        Features: 0x00 0x00 0x00 0x00 0x60 0x00 0x00 0x00
          BR/EDR Not Supported
          LE Supported (Controller)
< HCI Command: Read Local Version In.. (0x04|0x0001) plen 0  #5 [hci1] 0.372161
> HCI Event: Command Complete (0x0e) plen 12                 #6 [hci1] 0.372672
      Read Local Version Information (0x04|0x0001) ncmd 1
        Status: Success (0x00)
        HCI version: Reserved (0x0f) - Revision 12393 (0x3069)
        LMP version: Reserved (0x0f) - Subversion 12393 (0x3069)
        Manufacturer: Nordic Semiconductor ASA (89)
< HCI Command: Read Local Supported... (0x04|0x0002) plen 0  #7 [hci1] 0.392245
> HCI Event: Command Complete (0x0e) plen 68                 #8 [hci1] 0.393358
      Read Local Supported Commands (0x04|0x0002) ncmd 1
        Status: Success (0x00)
        Commands: 119 entries
          Disconnect (Octet 0 - Bit 5)
          Read Remote Version Information (Octet 2 - Bit 7)
          Set Event Mask (Octet 5 - Bit 6)
          Reset (Octet 5 - Bit 7)
          Read Connection Accept Timeout (Octet 7 - Bit 2)
          Write Connection Accept Timeout (Octet 7 - Bit 3)
          Read Transmit Power Level (Octet 10 - Bit 2)
          Set Controller To Host Flow Control (Octet 10 - Bit 5)
          Host Buffer Size (Octet 10 - Bit 6)
          Host Number of Completed Packets (Octet 10 - Bit 7)
          Read Local Version Information (Octet 14 - Bit 3)
          Read Local Supported Features (Octet 14 - Bit 5)
          Read BD ADDR (Octet 15 - Bit 1)
          Read RSSI (Octet 15 - Bit 5)
          Set Event Mask Page 2 (Octet 22 - Bit 2)
          LE Set Event Mask (Octet 25 - Bit 0)
          LE Read Buffer Size (Octet 25 - Bit 1)
          LE Read Local Supported Features (Octet 25 - Bit 2)
          LE Set Random Address (Octet 25 - Bit 4)
          LE Set Advertising Parameters (Octet 25 - Bit 5)
          LE Read Advertising Channel TX Power (Octet 25 - Bit 6)
          LE Set Advertising Data (Octet 25 - Bit 7)
          LE Set Scan Response Data (Octet 26 - Bit 0)
          LE Set Advertise Enable (Octet 26 - Bit 1)
          LE Set Scan Parameters (Octet 26 - Bit 2)
          LE Set Scan Enable (Octet 26 - Bit 3)
          LE Create Connection (Octet 26 - Bit 4)
          LE Create Connection Cancel (Octet 26 - Bit 5)
          LE Read Accept List Size (Octet 26 - Bit 6)
          LE Clear Accept List (Octet 26 - Bit 7)
          LE Add Device To Accept List (Octet 27 - Bit 0)
          LE Remove Device From Accept List (Octet 27 - Bit 1)
          LE Connection Update (Octet 27 - Bit 2)
          LE Set Host Channel Classification (Octet 27 - Bit 3)
          LE Read Channel Map (Octet 27 - Bit 4)
          LE Read Remote Used Features (Octet 27 - Bit 5)
          LE Encrypt (Octet 27 - Bit 6)
          LE Rand (Octet 27 - Bit 7)
          LE Start Encryption (Octet 28 - Bit 0)
          LE Long Term Key Request Reply (Octet 28 - Bit 1)
          LE Long Term Key Request Neg Reply (Octet 28 - Bit 2)
          LE Read Supported States (Octet 28 - Bit 3)
          LE Receiver Test (Octet 28 - Bit 4)
          LE Transmitter Test (Octet 28 - Bit 5)
          LE Test End (Octet 28 - Bit 6)
          Read Authenticated Payload Timeout (Octet 32 - Bit 4)
          Write Authenticated Payload Timeout (Octet 32 - Bit 5)
          LE Set Data Length (Octet 33 - Bit 6)
          LE Read Suggested Default Data Length (Octet 33 - Bit 7)
          LE Write Suggested Default Data Length (Octet 34 - Bit 0)
          LE Add Device To Resolving List (Octet 34 - Bit 3)
          LE Remove Device From Resolving List (Octet 34 - Bit 4)
          LE Clear Resolving List (Octet 34 - Bit 5)
          LE Read Resolving List Size (Octet 34 - Bit 6)
          LE Set Address Resolution Enable (Octet 35 - Bit 1)
          LE Set Resolvable Private Address Timeout (Octet 35 - Bit 2)
          LE Read Maximum Data Length (Octet 35 - Bit 3)
          LE Read PHY (Octet 35 - Bit 4)
          LE Set Default PHY (Octet 35 - Bit 5)
          LE Set PHY (Octet 35 - Bit 6)
          LE Enhanced Receiver Test (Octet 35 - Bit 7)
          LE Enhanced Transmitter Test (Octet 36 - Bit 0)
          LE Set Advertising Set Random Address (Octet 36 - Bit 1)
          LE Set Extended Advertising Parameters (Octet 36 - Bit 2)
          LE Set Extended Advertising Data (Octet 36 - Bit 3)
          LE Set Extended Scan Response Data (Octet 36 - Bit 4)
          LE Set Extended Advertising Enable (Octet 36 - Bit 5)
          LE Read Maximum Advertising Data Length (Octet 36 - Bit 6)
          LE Read Number of Supported Advertising Sets (Octet 36 - Bit 7)
          LE Remove Advertising Set (Octet 37 - Bit 0)
          LE Clear Advertising Sets (Octet 37 - Bit 1)
          LE Set Periodic Advertising Parameters (Octet 37 - Bit 2)
          LE Set Periodic Advertising Data (Octet 37 - Bit 3)
          LE Set Periodic Advertising Enable (Octet 37 - Bit 4)
          LE Set Extended Scan Parameters (Octet 37 - Bit 5)
          LE Set Extended Scan Enable (Octet 37 - Bit 6)
          LE Extended Create Connection (Octet 37 - Bit 7)
          LE Periodic Advertising Create Sync (Octet 38 - Bit 0)
          LE Periodic Advertising Create Sync Cancel (Octet 38 - Bit 1)
          LE Periodic Advertising Terminate Sync (Octet 38 - Bit 2)
          LE Add Device To Periodic Advertiser List (Octet 38 - Bit 3)
          LE Remove Device From Periodic Advertiser List (Octet 38 - Bit 4)
          LE Clear Periodic Advertiser List (Octet 38 - Bit 5)
          LE Read Periodic Advertiser List Size (Octet 38 - Bit 6)
          LE Read Transmit Power (Octet 38 - Bit 7)
          LE Read RF Path Compensation (Octet 39 - Bit 0)
          LE Write RF Path Compensation (Octet 39 - Bit 1)
          LE Set Privacy Mode (Octet 39 - Bit 2)
          LE Periodic Advertising Receive Enable (Octet 40 - Bit 5)
          LE Periodic Advertising Sync Transfer (Octet 40 - Bit 6)
          LE Periodic Advertising Set Info Transfer (Octet 40 - Bit 7)
          LE Periodic Advertising Sync Transfer Parameters (Octet 41 - Bit 0)
          LE Set Default Periodic Advertisng Sync Transfer Parameters (Octet 41 - Bit 1)
          LE Read Buffer v2 (Octet 41 - Bit 5)
          LE Read ISO TX Sync (Octet 41 - Bit 6)
          LE Set Connected Isochronous Group Parameters (Octet 41 - Bit 7)
          LE Set Connected Isochronous Group Parameters Test (Octet 42 - Bit 0)
          LE Create Connected Isochronous Stream (Octet 42 - Bit 1)
          LE Remove Connected Isochronous Group (Octet 42 - Bit 2)
          LE Accept Connected Isochronous Stream Request (Octet 42 - Bit 3)
          LE Reject Connected Isochronous Stream Request (Octet 42 - Bit 4)
          LE Create Broadcast Isochronous Group (Octet 42 - Bit 5)
          LE Create Broadcast Isochronous Group Test (Octet 42 - Bit 6)
          LE Terminate Broadcast Isochronous Group (Octet 42 - Bit 7)
          LE Broadcast Isochronous Group Create Sync (Octet 43 - Bit 0)
          LE Broadcast Isochronous Group Terminate Sync (Octet 43 - Bit 1)
          LE Request Peer SCA (Octet 43 - Bit 2)
          LE Setup Isochronous Data Path (Octet 43 - Bit 3)
          LE Remove Isochronous Data Path (Octet 43 - Bit 4)
          LE Isochronous Transmit Test (Octet 43 - Bit 5)
          LE Isochronous Receive Test (Octet 43 - Bit 6)
          LE Isochronous Read Test Counters (Octet 43 - Bit 7)
          LE Isochronous Read Test Counters (Octet 44 - Bit 0)
          LE Set Host Feature (Octet 44 - Bit 1)
          Octet 44 - Bit 2 
          Octet 45 - Bit 6 
          Octet 46 - Bit 0 
          Octet 46 - Bit 1 
          Octet 46 - Bit 2 
< HCI Command: Host Buffer Size (0x03|0x0033) plen 7         #9 [hci1] 0.412138
        ACL MTU: 255  ACL max packet: 16
        SCO MTU: 0    SCO max packet: 0
> HCI Event: Command Complete (0x0e) plen 4                 #10 [hci1] 0.412741
      Host Buffer Size (0x03|0x0033) ncmd 1
        Status: Success (0x00)
< HCI Command: Set Controller To Ho.. (0x03|0x0031) plen 1  #11 [hci1] 0.432105
        Flow control: ACL Data Packets (0x01)
> HCI Event: Command Complete (0x0e) plen 4                 #12 [hci1] 0.432646
      Set Controller To Host Flow Control (0x03|0x0031) ncmd 1
        Status: Success (0x00)
< HCI Command: LE Read Local Suppor.. (0x08|0x0003) plen 0  #13 [hci1] 0.452117
> HCI Event: Command Complete (0x0e) plen 12                #14 [hci1] 0.452643
      LE Read Local Supported Features (0x08|0x0003) ncmd 1
        Status: Success (0x00)
        Features: 0xfd 0x79 0x00 0xf7 0x30 0x01 0x00 0x00
          LE Encryption
          Extended Reject Indication
          Peripheral-initiated Features Exchange
          LE Ping
          LE Data Packet Length Extension
          LL Privacy
          Extended Scanner Filter Policies
          LE 2M PHY
          LE Coded PHY
          LE Extended Advertising
          LE Periodic Advertising
          Channel Selection Algorithm #2
          Periodic Advertising Sync Transfer - Sender
          Periodic Advertising Sync Transfer - Recipient
          Sleep Clock Accuracy Updates
          Connected Isochronous Stream - Central
          Connected Isochronous Stream - Peripheral
          Isochronous Broadcaster
          Synchronized Receiver
          Periodic Advertising ADI support
          Connection Subrating
          Unknown features (0x0000010000000000)
< HCI Command: LE Set Host Feature (0x08|0x0074) plen 2     #15 [hci1] 0.472128
        Bit Number: 32
          Connected Isochronous Stream (Host Support)
        Bit Value: 1
> HCI Event: Command Complete (0x0e) plen 4                 #16 [hci1] 0.472743
      LE Set Host Feature (0x08|0x0074) ncmd 1
        Status: Success (0x00)
< HCI Command: LE Read Buffer v2 (0x08|0x0060) plen 0       #17 [hci1] 0.492127
> HCI Event: Command Complete (0x0e) plen 10                #18 [hci1] 0.492633
      LE Read Buffer v2 (0x08|0x0060) ncmd 1
        Status: Success (0x00)
        ACL MTU: 27
        ACL max packet: 3
        ISO MTU: 318
        ISO max packet: 3
< HCI Command: LE Read Maximum Adve.. (0x08|0x003a) plen 0  #19 [hci1] 0.512160
> HCI Event: Command Complete (0x0e) plen 6                 #20 [hci1] 0.512651
      LE Read Maximum Advertising Data Length (0x08|0x003a) ncmd 1
        Status: Success (0x00)
        Max length: 1650
< HCI Command: LE Read Supported St.. (0x08|0x001c) plen 0  #21 [hci1] 0.532129
> HCI Event: Command Complete (0x0e) plen 12                #22 [hci1] 0.532654
      LE Read Supported States (0x08|0x001c) ncmd 1
        Status: Success (0x00)
        States: 0x000003ff3e0306ff
          Non-connectable Advertising State
          Scannable Advertising State
          Connectable Advertising State
          High Duty Cycle Directed Advertising State
          Passive Scanning State
          Active Scanning State
          Initiating State
            and Connection State (Central Role)
          Connection State (Peripheral Role)
          Scannable Advertising State
            and Passive Scanning State
          Connectable Advertising State
            and Passive Scanning State
          Non-connectable Advertising State
            and Initiating State
          Scannable Advertising State
            and Initiating State
          Active Scanning State
            and Connection State (Central Role)
          Passive Scanning State
            and Connection State (Peripheral Role)
          Active Scanning State
            and Connection State (Peripheral Role)
          Initiating State
            and Connection State (Central Role)
            and Central Role & Central Role
          Low Duty Cycle Directed Advertising State
          Connectable Advertising State
            and Initiating State
            and Central Role & Peripheral Role
          High Duty Cycle Directed Advertising State
            and Initiating State
            and Central Role & Peripheral Role
          Low Duty Cycle Directed Advertising State
            and Initiating State
            and Central Role & Peripheral Role
          Connectable Advertising State
            and Connection State (Central Role)
            and Central Role & Peripheral Role
          High Duty Cycle Directed Advertising State
            and Connection State (Central Role)
            and Central Role & Peripheral Role
          Low Duty Cycle Directed Advertising State
            and Connection State (Central Role)
            and Central Role & Peripheral Role
          Connectable Advertising State
            and Connection State (Peripheral Role)
            and Central Role & Peripheral Role
          High Duty Cycle Directed Advertising State
            and Connection State (Peripheral Role)
            and Peripheral Role & Peripheral Role
          Low Duty Cycle Directed Advertising State
            and Connection State (Peripheral Role)
            and Peripheral Role & Peripheral Role
          Initiating State
            and Connection State (Peripheral Role)
            and Central Role & Peripheral Role
< HCI Command: LE Read Maximum Data.. (0x08|0x002f) plen 0  #23 [hci1] 0.552120
> HCI Event: Command Complete (0x0e) plen 12                #24 [hci1] 0.552764
      LE Read Maximum Data Length (0x08|0x002f) ncmd 1
        Status: Success (0x00)
        Max TX octets: 251
        Max TX time: 2704
        Max RX octets: 251
        Max RX time: 2704
< HCI Command: LE Write Suggested D.. (0x08|0x0024) plen 4  #25 [hci1] 0.572131
        TX octets: 251
        TX time: 2704
> HCI Event: Command Complete (0x0e) plen 4                 #26 [hci1] 0.572564
      LE Write Suggested Default Data Length (0x08|0x0024) ncmd 1
        Status: Success (0x00)
< HCI Command: LE Read Resolving Li.. (0x08|0x002a) plen 0  #27 [hci1] 0.592127
> HCI Event: Command Complete (0x0e) plen 5                 #28 [hci1] 0.592579
      LE Read Resolving List Size (0x08|0x002a) ncmd 1
        Status: Success (0x00)
        Size: 8
< HCI Command: LE Set Event Mask (0x08|0x0001) plen 8       #29 [hci1] 0.612159
        Mask: 0x000002023f87fa5e
          LE Advertising Report
          LE Connection Update Complete
          LE Read Remote Used Features Complete
          LE Long Term Key Request
          LE Data Length Change
          LE Enhanced Connection Complete
          LE PHY Update Complete
          LE Extended Advertising Report
          LE Periodic Advertising Sync Established
          LE Periodic Advertising Report
          LE Periodic Advertising Sync Lost
          LE Extended Scan Timeout
          LE Extended Advertising Set Terminated
          LE Scan Request Received
          LE Periodic Advertising Sync Transfer Rvc
          LE CIS Established
          LE CIS Request
          LE Create BIG Complete
          LE Terminate BIG Complete
          LE BIG Sync Estabilished Complete
          LE BIG Sync Lost
          LE BIG Info Advertising Report
          Unknown mask (0x0000020000000000)
> HCI Event: Command Complete (0x0e) plen 4                 #30 [hci1] 0.612887
      LE Set Event Mask (0x08|0x0001) ncmd 1
        Status: Success (0x00)
< HCI Command: Set Event Mask (0x03|0x0001) plen 8          #31 [hci1] 0.632162
        Mask: 0x2000800002008890
          Disconnection Complete
          Encryption Change
          Read Remote Version Information Complete
          Hardware Error
          Data Buffer Overflow
          Encryption Key Refresh Complete
          LE Meta
> HCI Event: Command Complete (0x0e) plen 4                 #32 [hci1] 0.632759
      Set Event Mask (0x03|0x0001) ncmd 1
        Status: Success (0x00)
< HCI Command: Read BD ADDR (0x04|0x0009) plen 0            #33 [hci1] 0.652149
> HCI Event: Command Complete (0x0e) plen 10                #34 [hci1] 0.652774
      Read BD ADDR (0x04|0x0009) ncmd 1
        Status: Success (0x00)
        Address: 00:00:00:00:00:00 (OUI 00-00-00)
< HCI Command: LE Set Random Address (0x08|0x0005) plen 6   #35 [hci1] 0.672160
        Address: D5:B6:CC:31:DB:3B (Static)
> HCI Event: Command Complete (0x0e) plen 4                 #36 [hci1] 0.672778
      LE Set Random Address (0x08|0x0005) ncmd 1
        Status: Success (0x00)
< HCI Command: LE Set Extended Adv.. (0x08|0x0036) plen 25  #37 [hci1] 2.922166
        Handle: 0x00
        Properties: 0x0013
          Connectable
          Scannable
          Use legacy advertising PDUs: ADV_IND
        Min advertising interval: 100.000 msec (0x00a0)
        Max advertising interval: 150.000 msec (0x00f0)
        Channel map: 37, 38, 39 (0x07)
        Own address type: Random (0x01)
        Peer address type: Public (0x00)
        Peer address: 00:00:00:00:00:00 (OUI 00-00-00)
        Filter policy: Allow Scan Request from Any, Allow Connect Request from Any (0x00)
        TX power: Host has no preference (0x7f)
        Primary PHY: LE 1M (0x01)
        Secondary max skip: 0x00
        Secondary PHY: LE 1M (0x01)
        SID: 0x00
        Scan request notifications: Disabled (0x00)
> HCI Event: Command Complete (0x0e) plen 5                 #38 [hci1] 2.923087
      LE Set Extended Advertising Parameters (0x08|0x0036) ncmd 1
        Status: Success (0x00)
        TX power (selected): 0 dbm (0x00)
< HCI Command: LE Set Advertising S.. (0x08|0x0035) plen 7  #39 [hci1] 2.932157
        Advertising handle: 0x00
        Advertising random address: D5:B6:CC:31:DB:3B (Static)
> HCI Event: Command Complete (0x0e) plen 4                 #40 [hci1] 2.932709
      LE Set Advertising Set Random Address (0x08|0x0035) ncmd 1
        Status: Success (0x00)
< HCI Command: LE Set Extended Adv.. (0x08|0x0037) plen 22  #41 [hci1] 2.952224
        Handle: 0x00
        Operation: Complete extended advertising data (0x03)
        Fragment preference: Minimize fragmentation (0x01)
        Data length: 0x12
        Flags: 0x06
          LE General Discoverable Mode
          BR/EDR Not Supported
        Name (complete): Tester_F6B11A
> HCI Event: Command Complete (0x0e) plen 4                 #42 [hci1] 2.953050
      LE Set Extended Advertising Data (0x08|0x0037) ncmd 1
        Status: Success (0x00)
< HCI Command: LE Set Extended Scan.. (0x08|0x0038) plen 4  #43 [hci1] 2.972136
        Handle: 0x00
        Operation: Complete scan response data (0x03)
        Fragment preference: Minimize fragmentation (0x01)
        Data length: 0x00
> HCI Event: Command Complete (0x0e) plen 4                 #44 [hci1] 2.972669
      LE Set Extended Scan Response Data (0x08|0x0038) ncmd 1
        Status: Success (0x00)
< HCI Command: LE Set Extended Adve.. (0x08|0x0039) plen 6  #45 [hci1] 2.992143
        Extended advertising: Enabled (0x01)
        Number of sets: 1 (0x01)
        Entry 0
          Handle: 0x00
          Duration: 0 ms (0x00)
          Max ext adv events: 0
> HCI Event: Command Complete (0x0e) plen 4                 #46 [hci1] 2.992754
      LE Set Extended Advertising Enable (0x08|0x0039) ncmd 1
        Status: Success (0x00)
> HCI Event: LE Meta Event (0x3e) plen 31                   #47 [hci1] 3.637769
      LE Enhanced Connection Complete (0x0a)
        Status: Success (0x00)
        Handle: 1245
        Role: Peripheral (0x01)
        Peer address type: Public (0x00)
        Peer address: DF:A9:FF:F6:B1:1A (OUI DF-A9-FF)
        Local resolvable private address: 00:00:00:00:00:00 (Non-Resolvable)
        Peer resolvable private address: 00:00:00:00:00:00 (Non-Resolvable)
        Connection interval: 87.50 msec (0x0046)
        Connection latency: 0 (0x0000)
        Supervision timeout: 20000 msec (0x07d0)
        Central clock accuracy: 0x01
> HCI Event: LE Meta Event (0x3e) plen 6                    #48 [hci1] 3.637775
      LE Advertising Set Terminated (0x12)
        Status: Success (0x00)
        Handle: 0
        Connection handle: 1245
        Number of completed extended advertising events: 0
< HCI Command: LE Read Remote Used... (0x08|0x0016) plen 2  #49 [hci1] 3.653339
        Handle: 1245 Address: DF:A9:FF:F6:B1:1A (OUI DF-A9-FF)
> HCI Event: Command Status (0x0f) plen 4                   #50 [hci1] 3.653913
      LE Read Remote Used Features (0x08|0x0016) ncmd 1
        Status: Success (0x00)
> HCI Event: LE Meta Event (0x3e) plen 12                   #51 [hci1] 3.901522
      LE Read Remote Used Features (0x04)
        Status: Success (0x00)
        Handle: 1245 Address: DF:A9:FF:F6:B1:1A (OUI DF-A9-FF)
        Features: 0x2d 0x49 0x00 0xf7 0x67 0xd9 0x00 0x80
          LE Encryption
          Extended Reject Indication
          Peripheral-initiated Features Exchange
          LE Data Packet Length Extension
          LE 2M PHY
          LE Coded PHY
          Channel Selection Algorithm #2
          Periodic Advertising Sync Transfer - Sender
          Periodic Advertising Sync Transfer - Recipient
          Sleep Clock Accuracy Updates
          Connected Isochronous Stream - Central
          Connected Isochronous Stream - Peripheral
          Isochronous Broadcaster
          Synchronized Receiver
          Connected Isochronous Stream (Host Support)
          LE Power Control Request
          LE Power Control Request
          Connection Subrating
          Connection Subrating (Host Support)
          Unknown features (0x8000d90000000000)
> ACL Data RX: Handle 1245 flags 0x02 dlen 11               #52 [hci1] 4.338786
      SMP: Pairing Request (0x01) len 6
        IO capability: KeyboardOnly (0x02)
        OOB data: Authentication data not present (0x00)
        Authentication requirement: No bonding, MITM, SC, No Keypresses (0xcc)
        Max encryption key size: 16
        Initiator key distribution: <none> (0x00)
        Responder key distribution: <none> (0x00)
< HCI Command: Host Number of Compl.. (0x03|0x0035) plen 5  #53 [hci1] 4.352398
        Num handles: 1
        Handle: 1245 Address: DF:A9:FF:F6:B1:1A (OUI DF-A9-FF)
        Count: 1
< ACL Data TX: Handle 1245 flags 0x00 dlen 11               #54 [hci1] 4.352452
      SMP: Pairing Response (0x02) len 6
        IO capability: DisplayOnly (0x00)
        OOB data: Authentication data not present (0x00)
        Authentication requirement: Bonding, No MITM, SC, No Keypresses (0x09)
        Max encryption key size: 16
        Initiator key distribution: <none> (0x00)
        Responder key distribution: <none> (0x00)
> HCI Event: Number of Completed Packets (0x13) plen 5      #55 [hci1] 4.513938
        Num handles: 1
        Handle: 1245 Address: DF:A9:FF:F6:B1:1A (OUI DF-A9-FF)
        Count: 1
        #54: len 11 (0 Kb/s)
        Latency: 161 msec (161-161 msec ~161 msec)
> ACL Data RX: Handle 1245 flags 0x02 dlen 27               #56 [hci1] 4.514141
> ACL Data RX: Handle 1245 flags 0x01 dlen 27               #57 [hci1] 4.514734
> ACL Data RX: Handle 1245 flags 0x01 dlen 15               #58 [hci1] 4.515159
      SMP: Pairing Public Key (0x0c) len 64
        X: 2d603029bf77bb0e63b2e238cd81b27a6d31c5230e7d522b2347eae8043a7e03
        Y: 494e856603bbc278ecadd14fe59e48046df072012552a0bae1892d69b766c48c
< HCI Command: Host Number of Compl.. (0x03|0x0035) plen 5  #59 [hci1] 4.533251
        Num handles: 1
        Handle: 1245 Address: DF:A9:FF:F6:B1:1A (OUI DF-A9-FF)
        Count: 1
< HCI Command: Host Number of Compl.. (0x03|0x0035) plen 5  #60 [hci1] 4.533555
        Num handles: 1
        Handle: 1245 Address: DF:A9:FF:F6:B1:1A (OUI DF-A9-FF)
        Count: 1
< HCI Command: Host Number of Compl.. (0x03|0x0035) plen 5  #61 [hci1] 4.534051
        Num handles: 1
        Handle: 1245 Address: DF:A9:FF:F6:B1:1A (OUI DF-A9-FF)
        Count: 1
< ACL Data TX: Handle 1245 flags 0x00 dlen 27               #62 [hci1] 4.534105
< ACL Data TX: Handle 1245 flags 0x01 dlen 27               #63 [hci1] 4.534145
< ACL Data TX: Handle 1245 flags 0x01 dlen 15               #64 [hci1] 4.534219
      SMP: Pairing Public Key (0x0c) len 64
        X: 98308440221e2d910f0e54b71e7ec652857aa9b5a0dc65028824cc19db1226e9
        Y: 67a4816bcb62efb21701e31fdb27561a6217575fb007a8bbdabe7e28b6f68482
> HCI Event: Number of Completed Packets (0x13) plen 5      #65 [hci1] 4.601783
        Num handles: 1
        Handle: 1245 Address: DF:A9:FF:F6:B1:1A (OUI DF-A9-FF)
        Count: 1
        #62: len 27 (3 Kb/s)
        Latency: 67 msec (67-161 msec ~114 msec)
> HCI Event: Number of Completed Packets (0x13) plen 5      #66 [hci1] 4.602588
        Num handles: 1
        Handle: 1245 Address: DF:A9:FF:F6:B1:1A (OUI DF-A9-FF)
        Count: 1
        #63: len 27 (3 Kb/s)
        Latency: 68 msec (67-161 msec ~91 msec)
> HCI Event: Number of Completed Packets (0x13) plen 5      #67 [hci1] 4.688610
        Num handles: 1
        Handle: 1245 Address: DF:A9:FF:F6:B1:1A (OUI DF-A9-FF)
        Count: 1
        #64: len 15 (0 Kb/s)
        Latency: 154 msec (67-161 msec ~122 msec)
> ACL Data RX: Handle 1245 flags 0x02 dlen 21               #68 [hci1] 5.126457
      SMP: Pairing Confirm (0x03) len 16
        Confim value: baa2b0fd2326197fb4659b6cac51f80f
< HCI Command: Host Number of Compl.. (0x03|0x0035) plen 5  #69 [hci1] 5.133009
        Num handles: 1
        Handle: 1245 Address: DF:A9:FF:F6:B1:1A (OUI DF-A9-FF)
        Count: 1
< ACL Data TX: Handle 1245 flags 0x00 dlen 21               #70 [hci1] 5.133133
      SMP: Pairing Confirm (0x03) len 16
        Confim value: 4790a848cdc544ac54ad3999c87d5e50
> HCI Event: Number of Completed Packets (0x13) plen 5      #71 [hci1] 5.301277
        Num handles: 1
        Handle: 1245 Address: DF:A9:FF:F6:B1:1A (OUI DF-A9-FF)
        Count: 1
        #70: len 21 (1 Kb/s)
        Latency: 168 msec (67-168 msec ~145 msec)
> ACL Data RX: Handle 1245 flags 0x02 dlen 21               #72 [hci1] 5.301578
      SMP: Pairing Random (0x04) len 16
        Random value: d1028e6d674d7d699de9cf522abff0ab
< HCI Command: Host Number of Compl.. (0x03|0x0035) plen 5  #73 [hci1] 5.312587
        Num handles: 1
        Handle: 1245 Address: DF:A9:FF:F6:B1:1A (OUI DF-A9-FF)
        Count: 1
< ACL Data TX: Handle 1245 flags 0x00 dlen 21               #74 [hci1] 5.312620
      SMP: Pairing Random (0x04) len 16
        Random value: 8e6108f966a694cbe26df70bb96773e6
> HCI Event: Number of Completed Packets (0x13) plen 5      #75 [hci1] 5.476321
        Num handles: 1
        Handle: 1245 Address: DF:A9:FF:F6:B1:1A (OUI DF-A9-FF)
        Count: 1
        #74: len 21 (1 Kb/s)
        Latency: 163 msec (67-168 msec ~154 msec)
> ACL Data RX: Handle 1245 flags 0x02 dlen 21               #76 [hci1] 5.476659
      SMP: Pairing Confirm (0x03) len 16
        Confim value: 0237ee235128cd01a3b6d7415d7fa6e2
< HCI Command: Host Number of Compl.. (0x03|0x0035) plen 5  #77 [hci1] 5.492508
        Num handles: 1
        Handle: 1245 Address: DF:A9:FF:F6:B1:1A (OUI DF-A9-FF)
        Count: 1
< ACL Data TX: Handle 1245 flags 0x00 dlen 21               #78 [hci1] 5.492545
      SMP: Pairing Confirm (0x03) len 16
        Confim value: d6791c83c87904db9238167faa3e01df
> HCI Event: Number of Completed Packets (0x13) plen 5      #79 [hci1] 5.651318
        Num handles: 1
        Handle: 1245 Address: DF:A9:FF:F6:B1:1A (OUI DF-A9-FF)
        Count: 1
        #78: len 21 (1 Kb/s)
        Latency: 158 msec (67-168 msec ~156 msec)
> ACL Data RX: Handle 1245 flags 0x02 dlen 21               #80 [hci1] 5.651600
      SMP: Pairing Random (0x04) len 16
        Random value: 4d4156a80d829cc0eea9d456b59bc0d0
< HCI Command: Host Number of Compl.. (0x03|0x0035) plen 5  #81 [hci1] 5.652573
        Num handles: 1
        Handle: 1245 Address: DF:A9:FF:F6:B1:1A (OUI DF-A9-FF)
        Count: 1
< ACL Data TX: Handle 1245 flags 0x00 dlen 21               #82 [hci1] 5.652610
      SMP: Pairing Random (0x04) len 16
        Random value: 4d02679f89a05211af56d8b3da64d21e
> HCI Event: Number of Completed Packets (0x13) plen 5      #83 [hci1] 5.826358
        Num handles: 1
        Handle: 1245 Address: DF:A9:FF:F6:B1:1A (OUI DF-A9-FF)
        Count: 1
        #82: len 21 (0 Kb/s)
        Latency: 173 msec (67-173 msec ~165 msec)
> ACL Data RX: Handle 1245 flags 0x02 dlen 21               #84 [hci1] 5.826627
      SMP: Pairing Confirm (0x03) len 16
        Confim value: c5912ecdd698c7fd9191790a6496d05a
< HCI Command: Host Number of Compl.. (0x03|0x0035) plen 5  #85 [hci1] 5.832489
        Num handles: 1
        Handle: 1245 Address: DF:A9:FF:F6:B1:1A (OUI DF-A9-FF)
        Count: 1
< ACL Data TX: Handle 1245 flags 0x00 dlen 21               #86 [hci1] 5.832561
      SMP: Pairing Confirm (0x03) len 16
        Confim value: d84d6797b7849d006e6c95bbdc4a776b
> HCI Event: Number of Completed Packets (0x13) plen 5      #87 [hci1] 6.001307
        Num handles: 1
        Handle: 1245 Address: DF:A9:FF:F6:B1:1A (OUI DF-A9-FF)
        Count: 1
        #86: len 21 (1 Kb/s)
        Latency: 168 msec (67-173 msec ~166 msec)
> ACL Data RX: Handle 1245 flags 0x02 dlen 21               #88 [hci1] 6.001641
      SMP: Pairing Random (0x04) len 16
        Random value: ef8ff48b2bff7e1beda04cceca0e38ac
< HCI Command: Host Number of Compl.. (0x03|0x0035) plen 5  #89 [hci1] 6.012908
        Num handles: 1
        Handle: 1245 Address: DF:A9:FF:F6:B1:1A (OUI DF-A9-FF)
        Count: 1
< ACL Data TX: Handle 1245 flags 0x00 dlen 21               #90 [hci1] 6.012994
      SMP: Pairing Random (0x04) len 16
        Random value: 5e8286bc235a02440d0c3424a2acf8fd
> HCI Event: Number of Completed Packets (0x13) plen 5      #91 [hci1] 6.176301
        Num handles: 1
        Handle: 1245 Address: DF:A9:FF:F6:B1:1A (OUI DF-A9-FF)
        Count: 1
        #90: len 21 (1 Kb/s)
        Latency: 163 msec (67-173 msec ~165 msec)
> ACL Data RX: Handle 1245 flags 0x02 dlen 21               #92 [hci1] 6.176669
      SMP: Pairing Confirm (0x03) len 16
        Confim value: 7247dda45183e5aad864b197018bb6b0
< HCI Command: Host Number of Compl.. (0x03|0x0035) plen 5  #93 [hci1] 6.193301
        Num handles: 1
        Handle: 1245 Address: DF:A9:FF:F6:B1:1A (OUI DF-A9-FF)
        Count: 1
< ACL Data TX: Handle 1245 flags 0x00 dlen 21               #94 [hci1] 6.193435
      SMP: Pairing Confirm (0x03) len 16
        Confim value: c4beb0bd2e8195397c77b18f8021e44a
> HCI Event: Number of Completed Packets (0x13) plen 5      #95 [hci1] 6.351264
        Num handles: 1
        Handle: 1245 Address: DF:A9:FF:F6:B1:1A (OUI DF-A9-FF)
        Count: 1
        #94: len 21 (1 Kb/s)
        Latency: 157 msec (67-173 msec ~161 msec)
> ACL Data RX: Handle 1245 flags 0x02 dlen 21               #96 [hci1] 6.351653
      SMP: Pairing Random (0x04) len 16
        Random value: 520c5c704e968804184d0d73d44a9d29
< HCI Command: Host Number of Compl.. (0x03|0x0035) plen 5  #97 [hci1] 6.352486
        Num handles: 1
        Handle: 1245 Address: DF:A9:FF:F6:B1:1A (OUI DF-A9-FF)
        Count: 1
< ACL Data TX: Handle 1245 flags 0x00 dlen 21               #98 [hci1] 6.352508
      SMP: Pairing Random (0x04) len 16
        Random value: 5c4a1bcadd27bd58e945097b00bad7ac
> HCI Event: Number of Completed Packets (0x13) plen 5      #99 [hci1] 6.526274
        Num handles: 1
        Handle: 1245 Address: DF:A9:FF:F6:B1:1A (OUI DF-A9-FF)
        Count: 1
        #98: len 21 (0 Kb/s)
        Latency: 173 msec (67-173 msec ~167 msec)
> ACL Data RX: Handle 1245 flags 0x02 dlen 21              #100 [hci1] 6.526742
      SMP: Pairing Confirm (0x03) len 16
        Confim value: 923af31548a0f763a5918c6fe8273cd2
< HCI Command: Host Number of Comp.. (0x03|0x0035) plen 5  #101 [hci1] 6.533263
        Num handles: 1
        Handle: 1245 Address: DF:A9:FF:F6:B1:1A (OUI DF-A9-FF)
        Count: 1
< ACL Data TX: Handle 1245 flags 0x00 dlen 21              #102 [hci1] 6.533317
      SMP: Pairing Confirm (0x03) len 16
        Confim value: c1d124d139be73bcac12f5685c6064ac
> HCI Event: Number of Completed Packets (0x13) plen 5     #103 [hci1] 6.701400
        Num handles: 1
        Handle: 1245 Address: DF:A9:FF:F6:B1:1A (OUI DF-A9-FF)
        Count: 1
        #102: len 21 (1 Kb/s)
        Latency: 168 msec (67-173 msec ~167 msec)
> ACL Data RX: Handle 1245 flags 0x02 dlen 21              #104 [hci1] 6.701615
      SMP: Pairing Random (0x04) len 16
        Random value: 5519c5f042575e432b722b3f82bf7470
< HCI Command: Host Number of Comp.. (0x03|0x0035) plen 5  #105 [hci1] 6.712979
        Num handles: 1
        Handle: 1245 Address: DF:A9:FF:F6:B1:1A (OUI DF-A9-FF)
        Count: 1
< ACL Data TX: Handle 1245 flags 0x00 dlen 21              #106 [hci1] 6.713036
      SMP: Pairing Random (0x04) len 16
        Random value: 32527e6e64e79f33b2e374394db8ab2d
> HCI Event: Number of Completed Packets (0x13) plen 5     #107 [hci1] 6.876278
        Num handles: 1
        Handle: 1245 Address: DF:A9:FF:F6:B1:1A (OUI DF-A9-FF)
        Count: 1
        #106: len 21 (1 Kb/s)
        Latency: 163 msec (67-173 msec ~165 msec)
> ACL Data RX: Handle 1245 flags 0x02 dlen 21              #108 [hci1] 6.876697
      SMP: Pairing Confirm (0x03) len 16
        Confim value: 8fe289d23550a9186b55737164f7023f
< HCI Command: Host Number of Comp.. (0x03|0x0035) plen 5  #109 [hci1] 6.893224
        Num handles: 1
        Handle: 1245 Address: DF:A9:FF:F6:B1:1A (OUI DF-A9-FF)
        Count: 1
< ACL Data TX: Handle 1245 flags 0x00 dlen 21              #110 [hci1] 6.893394
      SMP: Pairing Confirm (0x03) len 16
        Confim value: 39a4f1c6e8fecd4ce618e183c1e6a479
> HCI Event: Number of Completed Packets (0x13) plen 5     #111 [hci1] 7.051369
        Num handles: 1
        Handle: 1245 Address: DF:A9:FF:F6:B1:1A (OUI DF-A9-FF)
        Count: 1
        #110: len 21 (1 Kb/s)
        Latency: 157 msec (67-173 msec ~161 msec)
> ACL Data RX: Handle 1245 flags 0x02 dlen 21              #112 [hci1] 7.051546
      SMP: Pairing Random (0x04) len 16
        Random value: 1358a2e41592e6e22410fb69c01f83ea
< HCI Command: Host Number of Comp.. (0x03|0x0035) plen 5  #113 [hci1] 7.052595
        Num handles: 1
        Handle: 1245 Address: DF:A9:FF:F6:B1:1A (OUI DF-A9-FF)
        Count: 1
< ACL Data TX: Handle 1245 flags 0x00 dlen 21              #114 [hci1] 7.052665
      SMP: Pairing Random (0x04) len 16
        Random value: dddbdfe2838e9a8cc6964353c850fef7
> HCI Event: Number of Completed Packets (0x13) plen 5     #115 [hci1] 7.226270
        Num handles: 1
        Handle: 1245 Address: DF:A9:FF:F6:B1:1A (OUI DF-A9-FF)
        Count: 1
        #114: len 21 (0 Kb/s)
        Latency: 173 msec (67-173 msec ~167 msec)
> ACL Data RX: Handle 1245 flags 0x02 dlen 21              #116 [hci1] 7.226655
      SMP: Pairing Confirm (0x03) len 16
        Confim value: 4142dd26d007d43d58d69c1e10a5d62f
< HCI Command: Host Number of Comp.. (0x03|0x0035) plen 5  #117 [hci1] 7.233230
        Num handles: 1
        Handle: 1245 Address: DF:A9:FF:F6:B1:1A (OUI DF-A9-FF)
        Count: 1
< ACL Data TX: Handle 1245 flags 0x00 dlen 21              #118 [hci1] 7.233364
      SMP: Pairing Confirm (0x03) len 16
        Confim value: 6e92799861c4af97d922dce5aed5bf16
> HCI Event: Number of Completed Packets (0x13) plen 5     #119 [hci1] 7.401245
        Num handles: 1
        Handle: 1245 Address: DF:A9:FF:F6:B1:1A (OUI DF-A9-FF)
        Count: 1
        #118: len 21 (1 Kb/s)
        Latency: 167 msec (67-173 msec ~167 msec)
> ACL Data RX: Handle 1245 flags 0x02 dlen 21              #120 [hci1] 7.401666
      SMP: Pairing Random (0x04) len 16
        Random value: eba9aa6414da44293f67136cbc5bcd40
< HCI Command: Host Number of Comp.. (0x03|0x0035) plen 5  #121 [hci1] 7.412789
        Num handles: 1
        Handle: 1245 Address: DF:A9:FF:F6:B1:1A (OUI DF-A9-FF)
        Count: 1
< ACL Data TX: Handle 1245 flags 0x00 dlen 21              #122 [hci1] 7.412891
      SMP: Pairing Random (0x04) len 16
        Random value: eb9f1915536596b6fc3db1c86b2b1970
> HCI Event: Number of Completed Packets (0x13) plen 5     #123 [hci1] 7.576303
        Num handles: 1
        Handle: 1245 Address: DF:A9:FF:F6:B1:1A (OUI DF-A9-FF)
        Count: 1
        #122: len 21 (1 Kb/s)
        Latency: 163 msec (67-173 msec ~165 msec)
> ACL Data RX: Handle 1245 flags 0x02 dlen 21              #124 [hci1] 7.576601
      SMP: Pairing Confirm (0x03) len 16
        Confim value: 5c7fa4cb08d9d6d7d663e1b1c6fee0de
< HCI Command: Host Number of Comp.. (0x03|0x0035) plen 5  #125 [hci1] 7.593232
        Num handles: 1
        Handle: 1245 Address: DF:A9:FF:F6:B1:1A (OUI DF-A9-FF)
        Count: 1
< ACL Data TX: Handle 1245 flags 0x00 dlen 21              #126 [hci1] 7.593330
      SMP: Pairing Confirm (0x03) len 16
        Confim value: def51fcb9f23aa4e5aef80293a97a29a
> HCI Event: Number of Completed Packets (0x13) plen 5     #127 [hci1] 7.751308
        Num handles: 1
        Handle: 1245 Address: DF:A9:FF:F6:B1:1A (OUI DF-A9-FF)
        Count: 1
        #126: len 21 (1 Kb/s)
        Latency: 157 msec (67-173 msec ~161 msec)
> ACL Data RX: Handle 1245 flags 0x02 dlen 21              #128 [hci1] 7.751610
      SMP: Pairing Random (0x04) len 16
        Random value: 782dd0caccffdea2fafa4700e2a3995a
< HCI Command: Host Number of Comp.. (0x03|0x0035) plen 5  #129 [hci1] 7.752570
        Num handles: 1
        Handle: 1245 Address: DF:A9:FF:F6:B1:1A (OUI DF-A9-FF)
        Count: 1
< ACL Data TX: Handle 1245 flags 0x00 dlen 21              #130 [hci1] 7.752662
      SMP: Pairing Random (0x04) len 16
        Random value: 5c794dc9ad9f2c3f295ebd5ad5e1c3cf
> HCI Event: Number of Completed Packets (0x13) plen 5     #131 [hci1] 7.926189
        Num handles: 1
        Handle: 1245 Address: DF:A9:FF:F6:B1:1A (OUI DF-A9-FF)
        Count: 1
        #130: len 21 (0 Kb/s)
        Latency: 173 msec (67-173 msec ~167 msec)
> ACL Data RX: Handle 1245 flags 0x02 dlen 21              #132 [hci1] 7.926573
      SMP: Pairing Confirm (0x03) len 16
        Confim value: a50d1e85e9f65df1b7fcb708d9ad0572
< HCI Command: Host Number of Comp.. (0x03|0x0035) plen 5  #133 [hci1] 7.933208
        Num handles: 1
        Handle: 1245 Address: DF:A9:FF:F6:B1:1A (OUI DF-A9-FF)
        Count: 1
< ACL Data TX: Handle 1245 flags 0x00 dlen 21              #134 [hci1] 7.933400
      SMP: Pairing Confirm (0x03) len 16
        Confim value: a047e9f5b947b20d73cd1ac0a4651951
> HCI Event: Number of Completed Packets (0x13) plen 5     #135 [hci1] 8.101377
        Num handles: 1
        Handle: 1245 Address: DF:A9:FF:F6:B1:1A (OUI DF-A9-FF)
        Count: 1
        #134: len 21 (1 Kb/s)
        Latency: 167 msec (67-173 msec ~167 msec)
> ACL Data RX: Handle 1245 flags 0x02 dlen 21              #136 [hci1] 8.101774
      SMP: Pairing Random (0x04) len 16
        Random value: 99454aaf091259151288ad1edf696b63
< HCI Command: Host Number of Comp.. (0x03|0x0035) plen 5  #137 [hci1] 8.113218
        Num handles: 1
        Handle: 1245 Address: DF:A9:FF:F6:B1:1A (OUI DF-A9-FF)
        Count: 1
< ACL Data TX: Handle 1245 flags 0x00 dlen 21              #138 [hci1] 8.113305
      SMP: Pairing Random (0x04) len 16
        Random value: 5c2fff312cdf99c9491988e877355a9a
> HCI Event: Number of Completed Packets (0x13) plen 5     #139 [hci1] 8.276379
        Num handles: 1
        Handle: 1245 Address: DF:A9:FF:F6:B1:1A (OUI DF-A9-FF)
        Count: 1
        #138: len 21 (1 Kb/s)
        Latency: 163 msec (67-173 msec ~165 msec)
> ACL Data RX: Handle 1245 flags 0x02 dlen 21              #140 [hci1] 8.276679
      SMP: Pairing Confirm (0x03) len 16
        Confim value: da7cf954c1222a9fe910f560d75dd37b
< HCI Command: Host Number of Comp.. (0x03|0x0035) plen 5  #141 [hci1] 8.293262
        Num handles: 1
        Handle: 1245 Address: DF:A9:FF:F6:B1:1A (OUI DF-A9-FF)
        Count: 1
< ACL Data TX: Handle 1245 flags 0x00 dlen 21              #142 [hci1] 8.293390
      SMP: Pairing Confirm (0x03) len 16
        Confim value: a860803313d1a383f3e89ed614aa48ac
> HCI Event: Number of Completed Packets (0x13) plen 5     #143 [hci1] 8.451174
        Num handles: 1
        Handle: 1245 Address: DF:A9:FF:F6:B1:1A (OUI DF-A9-FF)
        Count: 1
        #142: len 21 (1 Kb/s)
        Latency: 157 msec (67-173 msec ~161 msec)
> ACL Data RX: Handle 1245 flags 0x02 dlen 21              #144 [hci1] 8.451611
      SMP: Pairing Random (0x04) len 16
        Random value: 69938eebda649a8c83139900a05d08c3
< HCI Command: Host Number of Comp.. (0x03|0x0035) plen 5  #145 [hci1] 8.452475
        Num handles: 1
        Handle: 1245 Address: DF:A9:FF:F6:B1:1A (OUI DF-A9-FF)
        Count: 1
< ACL Data TX: Handle 1245 flags 0x00 dlen 21              #146 [hci1] 8.452547
      SMP: Pairing Random (0x04) len 16
        Random value: c629a3a987d808e808655d558dfc1155
> HCI Event: Number of Completed Packets (0x13) plen 5     #147 [hci1] 8.626230
        Num handles: 1
        Handle: 1245 Address: DF:A9:FF:F6:B1:1A (OUI DF-A9-FF)
        Count: 1
        #146: len 21 (0 Kb/s)
        Latency: 173 msec (67-173 msec ~167 msec)
> ACL Data RX: Handle 1245 flags 0x02 dlen 21              #148 [hci1] 8.626519
      SMP: Pairing Confirm (0x03) len 16
        Confim value: 8f6c5793e68b5f55ff12b4f1d4bb57d9
< HCI Command: Host Number of Comp.. (0x03|0x0035) plen 5  #149 [hci1] 8.633254
        Num handles: 1
        Handle: 1245 Address: DF:A9:FF:F6:B1:1A (OUI DF-A9-FF)
        Count: 1
< ACL Data TX: Handle 1245 flags 0x00 dlen 21              #150 [hci1] 8.633414
      SMP: Pairing Confirm (0x03) len 16
        Confim value: 068ab683c5bd96f7a40c0b5bfddd54ef
< ACL Data TX: Handle 1245 flags 0x00 dlen 16              #151 [hci1] 8.662610
      LE L2CAP: Connection Parameter Update Request (0x12) ident 1 len 8
        Min interval: 24
        Max interval: 40
        Peripheral latency: 0
        Timeout multiplier: 42
> HCI Event: Number of Completed Packets (0x13) plen 5     #152 [hci1] 8.714216
        Num handles: 1
        Handle: 1245 Address: DF:A9:FF:F6:B1:1A (OUI DF-A9-FF)
        Count: 1
        #150: len 21 (2 Kb/s)
        Latency: 80 msec (67-173 msec ~124 msec)
> HCI Event: Number of Completed Packets (0x13) plen 5     #153 [hci1] 8.801211
        Num handles: 1
        Handle: 1245 Address: DF:A9:FF:F6:B1:1A (OUI DF-A9-FF)
        Count: 1
        #151: len 16 (0 Kb/s)
        Latency: 138 msec (67-173 msec ~131 msec)
> ACL Data RX: Handle 1245 flags 0x02 dlen 21              #154 [hci1] 8.801592
      SMP: Pairing Random (0x04) len 16
        Random value: 47f84f988a86c54f8adca11d53717523
< HCI Command: Host Number of Comp.. (0x03|0x0035) plen 5  #155 [hci1] 8.813308
        Num handles: 1
        Handle: 1245 Address: DF:A9:FF:F6:B1:1A (OUI DF-A9-FF)
        Count: 1
< ACL Data TX: Handle 1245 flags 0x00 dlen 21              #156 [hci1] 8.813474
      SMP: Pairing Random (0x04) len 16
        Random value: 92f20f6ad8f13724432c7fd6001c45ff
> ACL Data RX: Handle 1245 flags 0x02 dlen 10              #157 [hci1] 8.888618
      LE L2CAP: Connection Parameter Update Response (0x13) ident 1 len 2
        Result: Connection Parameters accepted (0x0000)
< HCI Command: Host Number of Comp.. (0x03|0x0035) plen 5  #158 [hci1] 8.892441
        Num handles: 1
        Handle: 1245 Address: DF:A9:FF:F6:B1:1A (OUI DF-A9-FF)
        Count: 1
> HCI Event: Number of Completed Packets (0x13) plen 5     #159 [hci1] 8.976251
        Num handles: 1
        Handle: 1245 Address: DF:A9:FF:F6:B1:1A (OUI DF-A9-FF)
        Count: 1
        #156: len 21 (1 Kb/s)
        Latency: 162 msec (67-173 msec ~147 msec)
> ACL Data RX: Handle 1245 flags 0x02 dlen 21              #160 [hci1] 8.976604
      SMP: Pairing Confirm (0x03) len 16
        Confim value: ae4a635f50503139e9b9b9fadfcc97aa
< HCI Command: Host Number of Comp.. (0x03|0x0035) plen 5  #161 [hci1] 8.993053
        Num handles: 1
        Handle: 1245 Address: DF:A9:FF:F6:B1:1A (OUI DF-A9-FF)
        Count: 1
< ACL Data TX: Handle 1245 flags 0x00 dlen 21              #162 [hci1] 8.993132
      SMP: Pairing Confirm (0x03) len 16
        Confim value: 45ecdf1ec57aeffc7a7ab473c88cf0c5
> HCI Event: Number of Completed Packets (0x13) plen 5     #163 [hci1] 9.151262
        Num handles: 1
        Handle: 1245 Address: DF:A9:FF:F6:B1:1A (OUI DF-A9-FF)
        Count: 1
        #162: len 21 (1 Kb/s)
        Latency: 158 msec (67-173 msec ~152 msec)
> ACL Data RX: Handle 1245 flags 0x02 dlen 21              #164 [hci1] 9.151549
      SMP: Pairing Random (0x04) len 16
        Random value: ce93820fa7493fe7a564983063d6f76b
< HCI Command: Host Number of Comp.. (0x03|0x0035) plen 5  #165 [hci1] 9.153320
        Num handles: 1
        Handle: 1245 Address: DF:A9:FF:F6:B1:1A (OUI DF-A9-FF)
        Count: 1
< ACL Data TX: Handle 1245 flags 0x00 dlen 21              #166 [hci1] 9.153474
      SMP: Pairing Random (0x04) len 16
        Random value: 23ac32ebbb5e14c8a6b9622f296d277f
> HCI Event: Number of Completed Packets (0x13) plen 5     #167 [hci1] 9.326364
        Num handles: 1
        Handle: 1245 Address: DF:A9:FF:F6:B1:1A (OUI DF-A9-FF)
        Count: 1
        #166: len 21 (0 Kb/s)
        Latency: 172 msec (67-173 msec ~162 msec)
> ACL Data RX: Handle 1245 flags 0x02 dlen 21              #168 [hci1] 9.326660
      SMP: Pairing Confirm (0x03) len 16
        Confim value: 2c3f42f8aa8a9b7121fd2e1c38a15f15
< HCI Command: Host Number of Comp.. (0x03|0x0035) plen 5  #169 [hci1] 9.333191
        Num handles: 1
        Handle: 1245 Address: DF:A9:FF:F6:B1:1A (OUI DF-A9-FF)
        Count: 1
< ACL Data TX: Handle 1245 flags 0x00 dlen 21              #170 [hci1] 9.333275
      SMP: Pairing Confirm (0x03) len 16
        Confim value: b70e94fa13575167e0688052e3451ea0
> HCI Event: Number of Completed Packets (0x13) plen 5     #171 [hci1] 9.501235
        Num handles: 1
        Handle: 1245 Address: DF:A9:FF:F6:B1:1A (OUI DF-A9-FF)
        Count: 1
        #170: len 21 (1 Kb/s)
        Latency: 167 msec (67-173 msec ~165 msec)
> ACL Data RX: Handle 1245 flags 0x02 dlen 21              #172 [hci1] 9.501638
      SMP: Pairing Random (0x04) len 16
        Random value: ddc75ee8fdbeaf1e906b96317ffc14c6
< HCI Command: Host Number of Comp.. (0x03|0x0035) plen 5  #173 [hci1] 9.513259
        Num handles: 1
        Handle: 1245 Address: DF:A9:FF:F6:B1:1A (OUI DF-A9-FF)
        Count: 1
< ACL Data TX: Handle 1245 flags 0x00 dlen 21              #174 [hci1] 9.513335
      SMP: Pairing Random (0x04) len 16
        Random value: 297efe85e67448a15f56bd27e3a3cf1d
> HCI Event: Number of Completed Packets (0x13) plen 5     #175 [hci1] 9.676204
        Num handles: 1
        Handle: 1245 Address: DF:A9:FF:F6:B1:1A (OUI DF-A9-FF)
        Count: 1
        #174: len 21 (1 Kb/s)
        Latency: 162 msec (67-173 msec ~164 msec)
> ACL Data RX: Handle 1245 flags 0x02 dlen 21              #176 [hci1] 9.676489
      SMP: Pairing Confirm (0x03) len 16
        Confim value: 1102736b2ec352ec2e1e39e1b3d1f9ba
< HCI Command: Host Number of Comp.. (0x03|0x0035) plen 5  #177 [hci1] 9.693262
        Num handles: 1
        Handle: 1245 Address: DF:A9:FF:F6:B1:1A (OUI DF-A9-FF)
        Count: 1
< ACL Data TX: Handle 1245 flags 0x00 dlen 21              #178 [hci1] 9.693384
      SMP: Pairing Confirm (0x03) len 16
        Confim value: 83b1db2c1b3a62113193883afe8250f2
> HCI Event: Number of Completed Packets (0x13) plen 5     #179 [hci1] 9.851210
        Num handles: 1
        Handle: 1245 Address: DF:A9:FF:F6:B1:1A (OUI DF-A9-FF)
        Count: 1
        #178: len 21 (1 Kb/s)
        Latency: 157 msec (67-173 msec ~160 msec)
> ACL Data RX: Handle 1245 flags 0x02 dlen 21              #180 [hci1] 9.851675
      SMP: Pairing Random (0x04) len 16
        Random value: 8f3457fd9b36f8fd49f4ed5994948f9b
< HCI Command: Host Number of Comp.. (0x03|0x0035) plen 5  #181 [hci1] 9.852993
        Num handles: 1
        Handle: 1245 Address: DF:A9:FF:F6:B1:1A (OUI DF-A9-FF)
        Count: 1
< ACL Data TX: Handle 1245 flags 0x00 dlen 21              #182 [hci1] 9.853156
      SMP: Pairing Random (0x04) len 16
        Random value: 25a9493fd3ce4faf02be7293595bb7c6
> HCI Event: Number of Completed Packets (0x13) plen 5    #183 [hci1] 10.026265
        Num handles: 1
        Handle: 1245 Address: DF:A9:FF:F6:B1:1A (OUI DF-A9-FF)
        Count: 1
        #182: len 21 (0 Kb/s)
        Latency: 173 msec (67-173 msec ~167 msec)
> ACL Data RX: Handle 1245 flags 0x02 dlen 21             #184 [hci1] 10.026545
      SMP: Pairing Confirm (0x03) len 16
        Confim value: eb5f954a2c337cdb7060fbe5c9329587
< HCI Command: Host Number of Com.. (0x03|0x0035) plen 5  #185 [hci1] 10.033005
        Num handles: 1
        Handle: 1245 Address: DF:A9:FF:F6:B1:1A (OUI DF-A9-FF)
        Count: 1
< ACL Data TX: Handle 1245 flags 0x00 dlen 21             #186 [hci1] 10.033076
      SMP: Pairing Confirm (0x03) len 16
        Confim value: d3f6c92dfe03b40fccf92bb03c6bc451
> HCI Event: Number of Completed Packets (0x13) plen 5    #187 [hci1] 10.201290
        Num handles: 1
        Handle: 1245 Address: DF:A9:FF:F6:B1:1A (OUI DF-A9-FF)
        Count: 1
        #186: len 21 (1 Kb/s)
        Latency: 168 msec (67-173 msec ~167 msec)
> ACL Data RX: Handle 1245 flags 0x02 dlen 21             #188 [hci1] 10.201500
      SMP: Pairing Random (0x04) len 16
        Random value: 43bc2267cc433fcc0d3e3422cd916f95
< HCI Command: Host Number of Com.. (0x03|0x0035) plen 5  #189 [hci1] 10.213277
        Num handles: 1
        Handle: 1245 Address: DF:A9:FF:F6:B1:1A (OUI DF-A9-FF)
        Count: 1
< ACL Data TX: Handle 1245 flags 0x00 dlen 21             #190 [hci1] 10.213474
      SMP: Pairing Random (0x04) len 16
        Random value: 58f6b41f855a6f6c3560debd84e2affc
> HCI Event: Number of Completed Packets (0x13) plen 5    #191 [hci1] 10.376213
        Num handles: 1
        Handle: 1245 Address: DF:A9:FF:F6:B1:1A (OUI DF-A9-FF)
        Count: 1
        #190: len 21 (1 Kb/s)
        Latency: 162 msec (67-173 msec ~165 msec)
> ACL Data RX: Handle 1245 flags 0x02 dlen 21             #192 [hci1] 10.376549
      SMP: Pairing Confirm (0x03) len 16
        Confim value: 33f04d06df8207920e1c5a6c062c7cfe
< HCI Command: Host Number of Com.. (0x03|0x0035) plen 5  #193 [hci1] 10.392761
        Num handles: 1
        Handle: 1245 Address: DF:A9:FF:F6:B1:1A (OUI DF-A9-FF)
        Count: 1
< ACL Data TX: Handle 1245 flags 0x00 dlen 21             #194 [hci1] 10.392815
      SMP: Pairing Confirm (0x03) len 16
        Confim value: a51d8d16d28f0809347f9d753dbbf29b
> HCI Event: Number of Completed Packets (0x13) plen 5    #195 [hci1] 10.551270
        Num handles: 1
        Handle: 1245 Address: DF:A9:FF:F6:B1:1A (OUI DF-A9-FF)
        Count: 1
        #194: len 21 (1 Kb/s)
        Latency: 158 msec (67-173 msec ~161 msec)
> ACL Data RX: Handle 1245 flags 0x02 dlen 21             #196 [hci1] 10.551564
      SMP: Pairing Random (0x04) len 16
        Random value: 957fb37f1eb4eb1458cb40439921f89b
< HCI Command: Host Number of Com.. (0x03|0x0035) plen 5  #197 [hci1] 10.552483
        Num handles: 1
        Handle: 1245 Address: DF:A9:FF:F6:B1:1A (OUI DF-A9-FF)
        Count: 1
< ACL Data TX: Handle 1245 flags 0x00 dlen 21             #198 [hci1] 10.552552
      SMP: Pairing Random (0x04) len 16
        Random value: b67e7216d5bf664139eda2b542549666
> HCI Event: Number of Completed Packets (0x13) plen 5    #199 [hci1] 10.726152
        Num handles: 1
        Handle: 1245 Address: DF:A9:FF:F6:B1:1A (OUI DF-A9-FF)
        Count: 1
        #198: len 21 (0 Kb/s)
        Latency: 173 msec (67-173 msec ~167 msec)
> ACL Data RX: Handle 1245 flags 0x02 dlen 21             #200 [hci1] 10.726467
      SMP: Pairing Confirm (0x03) len 16
        Confim value: 44e7799e068134297688ed33c3766ba6
< HCI Command: Host Number of Com.. (0x03|0x0035) plen 5  #201 [hci1] 10.732631
        Num handles: 1
        Handle: 1245 Address: DF:A9:FF:F6:B1:1A (OUI DF-A9-FF)
        Count: 1
< ACL Data TX: Handle 1245 flags 0x00 dlen 21             #202 [hci1] 10.732666
      SMP: Pairing Confirm (0x03) len 16
        Confim value: e38366af72b447d9a3746deb101f3967
> HCI Event: Number of Completed Packets (0x13) plen 5    #203 [hci1] 10.901264
        Num handles: 1
        Handle: 1245 Address: DF:A9:FF:F6:B1:1A (OUI DF-A9-FF)
        Count: 1
        #202: len 21 (1 Kb/s)
        Latency: 168 msec (67-173 msec ~168 msec)
> ACL Data RX: Handle 1245 flags 0x02 dlen 21             #204 [hci1] 10.901555
      SMP: Pairing Random (0x04) len 16
        Random value: 61de40dd5d9c9f9fe75c24b7a4b8afd8
< HCI Command: Host Number of Com.. (0x03|0x0035) plen 5  #205 [hci1] 10.913202
        Num handles: 1
        Handle: 1245 Address: DF:A9:FF:F6:B1:1A (OUI DF-A9-FF)
        Count: 1
< ACL Data TX: Handle 1245 flags 0x00 dlen 21             #206 [hci1] 10.913354
      SMP: Pairing Random (0x04) len 16
        Random value: ed17f76500c95219dd01e09d1e63f87b
> HCI Event: Number of Completed Packets (0x13) plen 5    #207 [hci1] 11.076212
        Num handles: 1
        Handle: 1245 Address: DF:A9:FF:F6:B1:1A (OUI DF-A9-FF)
        Count: 1
        #206: len 21 (1 Kb/s)
        Latency: 162 msec (67-173 msec ~165 msec)
> ACL Data RX: Handle 1245 flags 0x02 dlen 21             #208 [hci1] 11.076666
      SMP: Pairing Confirm (0x03) len 16
        Confim value: fe69c5f082d744b9f3c48e2d946554dd
< HCI Command: Host Number of Com.. (0x03|0x0035) plen 5  #209 [hci1] 11.093163
        Num handles: 1
        Handle: 1245 Address: DF:A9:FF:F6:B1:1A (OUI DF-A9-FF)
        Count: 1
< ACL Data TX: Handle 1245 flags 0x00 dlen 21             #210 [hci1] 11.093362
      SMP: Pairing Confirm (0x03) len 16
        Confim value: 81e2df1555974787bb10b802ad8cce8b
> HCI Event: Number of Completed Packets (0x13) plen 5    #211 [hci1] 11.251267
        Num handles: 1
        Handle: 1245 Address: DF:A9:FF:F6:B1:1A (OUI DF-A9-FF)
        Count: 1
        #210: len 21 (1 Kb/s)
        Latency: 157 msec (67-173 msec ~161 msec)
> ACL Data RX: Handle 1245 flags 0x02 dlen 21             #212 [hci1] 11.251462
      SMP: Pairing Random (0x04) len 16
        Random value: c67a3f5b984a4075b8f238b6dc0559b3
< HCI Command: Host Number of Com.. (0x03|0x0035) plen 5  #213 [hci1] 11.252416
        Num handles: 1
        Handle: 1245 Address: DF:A9:FF:F6:B1:1A (OUI DF-A9-FF)
        Count: 1
< ACL Data TX: Handle 1245 flags 0x00 dlen 21             #214 [hci1] 11.252483
      SMP: Pairing Random (0x04) len 16
        Random value: 81d35d47e1f6006d79c974bd9d9e1ee3
> HCI Event: Number of Completed Packets (0x13) plen 5    #215 [hci1] 11.426221
        Num handles: 1
        Handle: 1245 Address: DF:A9:FF:F6:B1:1A (OUI DF-A9-FF)
        Count: 1
        #214: len 21 (0 Kb/s)
        Latency: 173 msec (67-173 msec ~167 msec)
> ACL Data RX: Handle 1245 flags 0x02 dlen 21             #216 [hci1] 11.426549
      SMP: Pairing Confirm (0x03) len 16
        Confim value: 99e622e33e9c61a54a90dac37c980f24
< HCI Command: Host Number of Com.. (0x03|0x0035) plen 5  #217 [hci1] 11.432727
        Num handles: 1
        Handle: 1245 Address: DF:A9:FF:F6:B1:1A (OUI DF-A9-FF)
        Count: 1
< ACL Data TX: Handle 1245 flags 0x00 dlen 21             #218 [hci1] 11.432778
      SMP: Pairing Confirm (0x03) len 16
        Confim value: 7376bf4fd44efd43b1a67121d75d3adc
> HCI Event: Number of Completed Packets (0x13) plen 5    #219 [hci1] 11.601221
        Num handles: 1
        Handle: 1245 Address: DF:A9:FF:F6:B1:1A (OUI DF-A9-FF)
        Count: 1
        #218: len 21 (1 Kb/s)
        Latency: 168 msec (67-173 msec ~168 msec)
> ACL Data RX: Handle 1245 flags 0x02 dlen 21             #220 [hci1] 11.601505
      SMP: Pairing Random (0x04) len 16
        Random value: 1f3563121a51f4e008cd0eb96cf9fbd7
< HCI Command: Host Number of Com.. (0x03|0x0035) plen 5  #221 [hci1] 11.613426
        Num handles: 1
        Handle: 1245 Address: DF:A9:FF:F6:B1:1A (OUI DF-A9-FF)
        Count: 1
< ACL Data TX: Handle 1245 flags 0x00 dlen 21             #222 [hci1] 11.613529
      SMP: Pairing Random (0x04) len 16
        Random value: e7f7e0c2476823e41736a7e381bafb7c
> HCI Event: Number of Completed Packets (0x13) plen 5    #223 [hci1] 11.776181
        Num handles: 1
        Handle: 1245 Address: DF:A9:FF:F6:B1:1A (OUI DF-A9-FF)
        Count: 1
        #222: len 21 (1 Kb/s)
        Latency: 162 msec (67-173 msec ~165 msec)
> ACL Data RX: Handle 1245 flags 0x02 dlen 21             #224 [hci1] 11.776651
      SMP: Pairing Confirm (0x03) len 16
        Confim value: e7369b9cccea5a120034754faed14ec8
< HCI Command: Host Number of Com.. (0x03|0x0035) plen 5  #225 [hci1] 11.793189
        Num handles: 1
        Handle: 1245 Address: DF:A9:FF:F6:B1:1A (OUI DF-A9-FF)
        Count: 1
< ACL Data TX: Handle 1245 flags 0x00 dlen 21             #226 [hci1] 11.793266
      SMP: Pairing Confirm (0x03) len 16
        Confim value: 089c1305902c516ec231b03af80a1303
> HCI Event: Number of Completed Packets (0x13) plen 5    #227 [hci1] 11.951183
        Num handles: 1
        Handle: 1245 Address: DF:A9:FF:F6:B1:1A (OUI DF-A9-FF)
        Count: 1
        #226: len 21 (1 Kb/s)
        Latency: 157 msec (67-173 msec ~161 msec)
