Bluetooth monitor ver 5.72
= Note: Linux version 6.14.0-36-generic (x86_64)                       0.102229
= Note: Bluetooth subsystem version 2.22                               0.102231
= New Index: 00:00:00:00:00:00 (Primary,UART,hci1)              [hci1] 0.102233
= New Index: 48:5F:99:8E:E0:64 (Primary,USB,hci0)               [hci0] 0.102233
= Open Index: 00:00:00:00:00:00                                 [hci1] 0.216041
= Index Info: 00:00:00:00:00:00 (Nordic Semiconductor ASA)      [hci1] 0.216078
@ USER Open: main (privileged) version 2.22            {0x0001} [hci1] 0.216088
< HCI Command: Reset (0x03|0x0003) plen 0                    #1 [hci1] 0.217552
> HCI Event: Command Complete (0x0e) plen 4                  #2 [hci1] 0.218116
      Reset (0x03|0x0003) ncmd 1
        Status: Success (0x00)
< HCI Command: Read Local Supported... (0x04|0x0003) plen 0  #3 [hci1] 0.235816
> HCI Event: Command Complete (0x0e) plen 12                 #4 [hci1] 0.236392
      Read Local Supported Features (0x04|0x0003) ncmd 1
        Status: Success (0x00)
        Features: 0x00 0x00 0x00 0x00 0x60 0x00 0x00 0x00
          BR/EDR Not Supported
          LE Supported (Controller)
< HCI Command: Read Local Version In.. (0x04|0x0001) plen 0  #5 [hci1] 0.255473
> HCI Event: Command Complete (0x0e) plen 12                 #6 [hci1] 0.255992
      Read Local Version Information (0x04|0x0001) ncmd 1
        Status: Success (0x00)
        HCI version: Reserved (0x0f) - Revision 12393 (0x3069)
        LMP version: Reserved (0x0f) - Subversion 12393 (0x3069)
        Manufacturer: Nordic Semiconductor ASA (89)
< HCI Command: Read Local Supported... (0x04|0x0002) plen 0  #7 [hci1] 0.275402
> HCI Event: Command Complete (0x0e) plen 68                 #8 [hci1] 0.276459
      Read Local Supported Commands (0x04|0x0002) ncmd 1
        Status: Success (0x00)
        Commands: 119 entries
          Disconnect (Octet 0 - Bit 5)
          Read Remote Version Information (Octet 2 - Bit 7)
          Set Event Mask (Octet 5 - Bit 6)
          Reset (Octet 5 - Bit 7)
          Read Connection Accept Timeout (Octet 7 - Bit 2)
          Write Connection Accept Timeout (Octet 7 - Bit 3)
          Read Transmit Power Level (Octet 10 - Bit 2)
          Set Controller To Host Flow Control (Octet 10 - Bit 5)
          Host Buffer Size (Octet 10 - Bit 6)
          Host Number of Completed Packets (Octet 10 - Bit 7)
          Read Local Version Information (Octet 14 - Bit 3)
          Read Local Supported Features (Octet 14 - Bit 5)
          Read BD ADDR (Octet 15 - Bit 1)
          Read RSSI (Octet 15 - Bit 5)
          Set Event Mask Page 2 (Octet 22 - Bit 2)
          LE Set Event Mask (Octet 25 - Bit 0)
          LE Read Buffer Size (Octet 25 - Bit 1)
          LE Read Local Supported Features (Octet 25 - Bit 2)
          LE Set Random Address (Octet 25 - Bit 4)
          LE Set Advertising Parameters (Octet 25 - Bit 5)
          LE Read Advertising Channel TX Power (Octet 25 - Bit 6)
          LE Set Advertising Data (Octet 25 - Bit 7)
          LE Set Scan Response Data (Octet 26 - Bit 0)
          LE Set Advertise Enable (Octet 26 - Bit 1)
          LE Set Scan Parameters (Octet 26 - Bit 2)
          LE Set Scan Enable (Octet 26 - Bit 3)
          LE Create Connection (Octet 26 - Bit 4)
          LE Create Connection Cancel (Octet 26 - Bit 5)
          LE Read Accept List Size (Octet 26 - Bit 6)
          LE Clear Accept List (Octet 26 - Bit 7)
          LE Add Device To Accept List (Octet 27 - Bit 0)
          LE Remove Device From Accept List (Octet 27 - Bit 1)
          LE Connection Update (Octet 27 - Bit 2)
          LE Set Host Channel Classification (Octet 27 - Bit 3)
          LE Read Channel Map (Octet 27 - Bit 4)
          LE Read Remote Used Features (Octet 27 - Bit 5)
          LE Encrypt (Octet 27 - Bit 6)
          LE Rand (Octet 27 - Bit 7)
          LE Start Encryption (Octet 28 - Bit 0)
          LE Long Term Key Request Reply (Octet 28 - Bit 1)
          LE Long Term Key Request Neg Reply (Octet 28 - Bit 2)
          LE Read Supported States (Octet 28 - Bit 3)
          LE Receiver Test (Octet 28 - Bit 4)
          LE Transmitter Test (Octet 28 - Bit 5)
          LE Test End (Octet 28 - Bit 6)
          Read Authenticated Payload Timeout (Octet 32 - Bit 4)
          Write Authenticated Payload Timeout (Octet 32 - Bit 5)
          LE Set Data Length (Octet 33 - Bit 6)
          LE Read Suggested Default Data Length (Octet 33 - Bit 7)
          LE Write Suggested Default Data Length (Octet 34 - Bit 0)
          LE Add Device To Resolving List (Octet 34 - Bit 3)
          LE Remove Device From Resolving List (Octet 34 - Bit 4)
          LE Clear Resolving List (Octet 34 - Bit 5)
          LE Read Resolving List Size (Octet 34 - Bit 6)
          LE Set Address Resolution Enable (Octet 35 - Bit 1)
          LE Set Resolvable Private Address Timeout (Octet 35 - Bit 2)
          LE Read Maximum Data Length (Octet 35 - Bit 3)
          LE Read PHY (Octet 35 - Bit 4)
          LE Set Default PHY (Octet 35 - Bit 5)
          LE Set PHY (Octet 35 - Bit 6)
          LE Enhanced Receiver Test (Octet 35 - Bit 7)
          LE Enhanced Transmitter Test (Octet 36 - Bit 0)
          LE Set Advertising Set Random Address (Octet 36 - Bit 1)
          LE Set Extended Advertising Parameters (Octet 36 - Bit 2)
          LE Set Extended Advertising Data (Octet 36 - Bit 3)
          LE Set Extended Scan Response Data (Octet 36 - Bit 4)
          LE Set Extended Advertising Enable (Octet 36 - Bit 5)
          LE Read Maximum Advertising Data Length (Octet 36 - Bit 6)
          LE Read Number of Supported Advertising Sets (Octet 36 - Bit 7)
          LE Remove Advertising Set (Octet 37 - Bit 0)
          LE Clear Advertising Sets (Octet 37 - Bit 1)
          LE Set Periodic Advertising Parameters (Octet 37 - Bit 2)
          LE Set Periodic Advertising Data (Octet 37 - Bit 3)
          LE Set Periodic Advertising Enable (Octet 37 - Bit 4)
          LE Set Extended Scan Parameters (Octet 37 - Bit 5)
          LE Set Extended Scan Enable (Octet 37 - Bit 6)
          LE Extended Create Connection (Octet 37 - Bit 7)
          LE Periodic Advertising Create Sync (Octet 38 - Bit 0)
          LE Periodic Advertising Create Sync Cancel (Octet 38 - Bit 1)
          LE Periodic Advertising Terminate Sync (Octet 38 - Bit 2)
          LE Add Device To Periodic Advertiser List (Octet 38 - Bit 3)
          LE Remove Device From Periodic Advertiser List (Octet 38 - Bit 4)
          LE Clear Periodic Advertiser List (Octet 38 - Bit 5)
          LE Read Periodic Advertiser List Size (Octet 38 - Bit 6)
          LE Read Transmit Power (Octet 38 - Bit 7)
          LE Read RF Path Compensation (Octet 39 - Bit 0)
          LE Write RF Path Compensation (Octet 39 - Bit 1)
          LE Set Privacy Mode (Octet 39 - Bit 2)
          LE Periodic Advertising Receive Enable (Octet 40 - Bit 5)
          LE Periodic Advertising Sync Transfer (Octet 40 - Bit 6)
          LE Periodic Advertising Set Info Transfer (Octet 40 - Bit 7)
          LE Periodic Advertising Sync Transfer Parameters (Octet 41 - Bit 0)
          LE Set Default Periodic Advertisng Sync Transfer Parameters (Octet 41 - Bit 1)
          LE Read Buffer v2 (Octet 41 - Bit 5)
          LE Read ISO TX Sync (Octet 41 - Bit 6)
          LE Set Connected Isochronous Group Parameters (Octet 41 - Bit 7)
          LE Set Connected Isochronous Group Parameters Test (Octet 42 - Bit 0)
          LE Create Connected Isochronous Stream (Octet 42 - Bit 1)
          LE Remove Connected Isochronous Group (Octet 42 - Bit 2)
          LE Accept Connected Isochronous Stream Request (Octet 42 - Bit 3)
          LE Reject Connected Isochronous Stream Request (Octet 42 - Bit 4)
          LE Create Broadcast Isochronous Group (Octet 42 - Bit 5)
          LE Create Broadcast Isochronous Group Test (Octet 42 - Bit 6)
          LE Terminate Broadcast Isochronous Group (Octet 42 - Bit 7)
          LE Broadcast Isochronous Group Create Sync (Octet 43 - Bit 0)
          LE Broadcast Isochronous Group Terminate Sync (Octet 43 - Bit 1)
          LE Request Peer SCA (Octet 43 - Bit 2)
          LE Setup Isochronous Data Path (Octet 43 - Bit 3)
          LE Remove Isochronous Data Path (Octet 43 - Bit 4)
          LE Isochronous Transmit Test (Octet 43 - Bit 5)
          LE Isochronous Receive Test (Octet 43 - Bit 6)
          LE Isochronous Read Test Counters (Octet 43 - Bit 7)
          LE Isochronous Read Test Counters (Octet 44 - Bit 0)
          LE Set Host Feature (Octet 44 - Bit 1)
          Octet 44 - Bit 2 
          Octet 45 - Bit 6 
          Octet 46 - Bit 0 
          Octet 46 - Bit 1 
          Octet 46 - Bit 2 
< HCI Command: Host Buffer Size (0x03|0x0033) plen 7         #9 [hci1] 0.295356
        ACL MTU: 255  ACL max packet: 16
        SCO MTU: 0    SCO max packet: 0
> HCI Event: Command Complete (0x0e) plen 4                 #10 [hci1] 0.295991
      Host Buffer Size (0x03|0x0033) ncmd 1
        Status: Success (0x00)
< HCI Command: Set Controller To Ho.. (0x03|0x0031) plen 1  #11 [hci1] 0.315419
        Flow control: ACL Data Packets (0x01)
> HCI Event: Command Complete (0x0e) plen 4                 #12 [hci1] 0.315866
      Set Controller To Host Flow Control (0x03|0x0031) ncmd 1
        Status: Success (0x00)
< HCI Command: LE Read Local Suppor.. (0x08|0x0003) plen 0  #13 [hci1] 0.335360
> HCI Event: Command Complete (0x0e) plen 12                #14 [hci1] 0.335959
      LE Read Local Supported Features (0x08|0x0003) ncmd 1
        Status: Success (0x00)
        Features: 0xfd 0x79 0x00 0xf7 0x30 0x01 0x00 0x00
          LE Encryption
          Extended Reject Indication
          Peripheral-initiated Features Exchange
          LE Ping
          LE Data Packet Length Extension
          LL Privacy
          Extended Scanner Filter Policies
          LE 2M PHY
          LE Coded PHY
          LE Extended Advertising
          LE Periodic Advertising
          Channel Selection Algorithm #2
          Periodic Advertising Sync Transfer - Sender
          Periodic Advertising Sync Transfer - Recipient
          Sleep Clock Accuracy Updates
          Connected Isochronous Stream - Central
          Connected Isochronous Stream - Peripheral
          Isochronous Broadcaster
          Synchronized Receiver
          Periodic Advertising ADI support
          Connection Subrating
          Unknown features (0x0000010000000000)
< HCI Command: LE Set Host Feature (0x08|0x0074) plen 2     #15 [hci1] 0.355386
        Bit Number: 32
          Connected Isochronous Stream (Host Support)
        Bit Value: 1
> HCI Event: Command Complete (0x0e) plen 4                 #16 [hci1] 0.355783
      LE Set Host Feature (0x08|0x0074) ncmd 1
        Status: Success (0x00)
< HCI Command: LE Read Buffer v2 (0x08|0x0060) plen 0       #17 [hci1] 0.375380
> HCI Event: Command Complete (0x0e) plen 10                #18 [hci1] 0.375801
      LE Read Buffer v2 (0x08|0x0060) ncmd 1
        Status: Success (0x00)
        ACL MTU: 27
        ACL max packet: 3
        ISO MTU: 318
        ISO max packet: 3
< HCI Command: LE Read Maximum Adve.. (0x08|0x003a) plen 0  #19 [hci1] 0.395415
> HCI Event: Command Complete (0x0e) plen 6                 #20 [hci1] 0.395833
      LE Read Maximum Advertising Data Length (0x08|0x003a) ncmd 1
        Status: Success (0x00)
        Max length: 1650
< HCI Command: LE Read Supported St.. (0x08|0x001c) plen 0  #21 [hci1] 0.415413
> HCI Event: Command Complete (0x0e) plen 12                #22 [hci1] 0.415969
      LE Read Supported States (0x08|0x001c) ncmd 1
        Status: Success (0x00)
        States: 0x000003ff3e0306ff
          Non-connectable Advertising State
          Scannable Advertising State
          Connectable Advertising State
          High Duty Cycle Directed Advertising State
          Passive Scanning State
          Active Scanning State
          Initiating State
            and Connection State (Central Role)
          Connection State (Peripheral Role)
          Scannable Advertising State
            and Passive Scanning State
          Connectable Advertising State
            and Passive Scanning State
          Non-connectable Advertising State
            and Initiating State
          Scannable Advertising State
            and Initiating State
          Active Scanning State
            and Connection State (Central Role)
          Passive Scanning State
            and Connection State (Peripheral Role)
          Active Scanning State
            and Connection State (Peripheral Role)
          Initiating State
            and Connection State (Central Role)
            and Central Role & Central Role
          Low Duty Cycle Directed Advertising State
          Connectable Advertising State
            and Initiating State
            and Central Role & Peripheral Role
          High Duty Cycle Directed Advertising State
            and Initiating State
            and Central Role & Peripheral Role
          Low Duty Cycle Directed Advertising State
            and Initiating State
            and Central Role & Peripheral Role
          Connectable Advertising State
            and Connection State (Central Role)
            and Central Role & Peripheral Role
          High Duty Cycle Directed Advertising State
            and Connection State (Central Role)
            and Central Role & Peripheral Role
          Low Duty Cycle Directed Advertising State
            and Connection State (Central Role)
            and Central Role & Peripheral Role
          Connectable Advertising State
            and Connection State (Peripheral Role)
            and Central Role & Peripheral Role
          High Duty Cycle Directed Advertising State
            and Connection State (Peripheral Role)
            and Peripheral Role & Peripheral Role
          Low Duty Cycle Directed Advertising State
            and Connection State (Peripheral Role)
            and Peripheral Role & Peripheral Role
          Initiating State
            and Connection State (Peripheral Role)
            and Central Role & Peripheral Role
< HCI Command: LE Read Maximum Data.. (0x08|0x002f) plen 0  #23 [hci1] 0.435374
> HCI Event: Command Complete (0x0e) plen 12                #24 [hci1] 0.435898
      LE Read Maximum Data Length (0x08|0x002f) ncmd 1
        Status: Success (0x00)
        Max TX octets: 251
        Max TX time: 2704
        Max RX octets: 251
        Max RX time: 2704
< HCI Command: LE Write Suggested D.. (0x08|0x0024) plen 4  #25 [hci1] 0.455366
        TX octets: 251
        TX time: 2704
> HCI Event: Command Complete (0x0e) plen 4                 #26 [hci1] 0.455814
      LE Write Suggested Default Data Length (0x08|0x0024) ncmd 1
        Status: Success (0x00)
< HCI Command: LE Read Resolving Li.. (0x08|0x002a) plen 0  #27 [hci1] 0.475392
> HCI Event: Command Complete (0x0e) plen 5                 #28 [hci1] 0.475827
      LE Read Resolving List Size (0x08|0x002a) ncmd 1
        Status: Success (0x00)
        Size: 8
< HCI Command: LE Set Event Mask (0x08|0x0001) plen 8       #29 [hci1] 0.495347
        Mask: 0x000002023f87fa5e
          LE Advertising Report
          LE Connection Update Complete
          LE Read Remote Used Features Complete
          LE Long Term Key Request
          LE Data Length Change
          LE Enhanced Connection Complete
          LE PHY Update Complete
          LE Extended Advertising Report
          LE Periodic Advertising Sync Established
          LE Periodic Advertising Report
          LE Periodic Advertising Sync Lost
          LE Extended Scan Timeout
          LE Extended Advertising Set Terminated
          LE Scan Request Received
          LE Periodic Advertising Sync Transfer Rvc
          LE CIS Established
          LE CIS Request
          LE Create BIG Complete
          LE Terminate BIG Complete
          LE BIG Sync Estabilished Complete
          LE BIG Sync Lost
          LE BIG Info Advertising Report
          Unknown mask (0x0000020000000000)
> HCI Event: Command Complete (0x0e) plen 4                 #30 [hci1] 0.495920
      LE Set Event Mask (0x08|0x0001) ncmd 1
        Status: Success (0x00)
< HCI Command: Set Event Mask (0x03|0x0001) plen 8          #31 [hci1] 0.515317
        Mask: 0x2000800002008890
          Disconnection Complete
          Encryption Change
          Read Remote Version Information Complete
          Hardware Error
          Data Buffer Overflow
          Encryption Key Refresh Complete
          LE Meta
> HCI Event: Command Complete (0x0e) plen 4                 #32 [hci1] 0.515866
      Set Event Mask (0x03|0x0001) ncmd 1
        Status: Success (0x00)
< HCI Command: Read BD ADDR (0x04|0x0009) plen 0            #33 [hci1] 0.535412
> HCI Event: Command Complete (0x0e) plen 10                #34 [hci1] 0.535857
      Read BD ADDR (0x04|0x0009) ncmd 1
        Status: Success (0x00)
        Address: 00:00:00:00:00:00 (OUI 00-00-00)
< HCI Command: LE Set Random Address (0x08|0x0005) plen 6   #35 [hci1] 0.555415
        Address: D5:B6:CC:31:DB:3B (Static)
> HCI Event: Command Complete (0x0e) plen 4                 #36 [hci1] 0.555926
      LE Set Random Address (0x08|0x0005) ncmd 1
        Status: Success (0x00)
< HCI Command: LE Set Extended Adv.. (0x08|0x0036) plen 25  #37 [hci1] 3.096030
        Handle: 0x00
        Properties: 0x0013
          Connectable
          Scannable
          Use legacy advertising PDUs: ADV_IND
        Min advertising interval: 100.000 msec (0x00a0)
        Max advertising interval: 150.000 msec (0x00f0)
        Channel map: 37, 38, 39 (0x07)
        Own address type: Random (0x01)
        Peer address type: Public (0x00)
        Peer address: 00:00:00:00:00:00 (OUI 00-00-00)
        Filter policy: Allow Scan Request from Any, Allow Connect Request from Any (0x00)
        TX power: Host has no preference (0x7f)
        Primary PHY: LE 1M (0x01)
        Secondary max skip: 0x00
        Secondary PHY: LE 1M (0x01)
        SID: 0x00
        Scan request notifications: Disabled (0x00)
> HCI Event: Command Complete (0x0e) plen 5                 #38 [hci1] 3.096837
      LE Set Extended Advertising Parameters (0x08|0x0036) ncmd 1
        Status: Success (0x00)
        TX power (selected): 0 dbm (0x00)
< HCI Command: LE Set Advertising S.. (0x08|0x0035) plen 7  #39 [hci1] 3.115846
        Advertising handle: 0x00
        Advertising random address: D5:B6:CC:31:DB:3B (Static)
> HCI Event: Command Complete (0x0e) plen 4                 #40 [hci1] 3.116469
      LE Set Advertising Set Random Address (0x08|0x0035) ncmd 1
        Status: Success (0x00)
< HCI Command: LE Set Extended Adv.. (0x08|0x0037) plen 22  #41 [hci1] 3.135509
        Handle: 0x00
        Operation: Complete extended advertising data (0x03)
        Fragment preference: Minimize fragmentation (0x01)
        Data length: 0x12
        Flags: 0x06
          LE General Discoverable Mode
          BR/EDR Not Supported
        Name (complete): Tester_F6B11A
> HCI Event: Command Complete (0x0e) plen 4                 #42 [hci1] 3.136210
      LE Set Extended Advertising Data (0x08|0x0037) ncmd 1
        Status: Success (0x00)
< HCI Command: LE Set Extended Scan.. (0x08|0x0038) plen 4  #43 [hci1] 3.155433
        Handle: 0x00
        Operation: Complete scan response data (0x03)
        Fragment preference: Minimize fragmentation (0x01)
        Data length: 0x00
> HCI Event: Command Complete (0x0e) plen 4                 #44 [hci1] 3.155862
      LE Set Extended Scan Response Data (0x08|0x0038) ncmd 1
        Status: Success (0x00)
< HCI Command: LE Set Extended Adve.. (0x08|0x0039) plen 6  #45 [hci1] 3.175430
        Extended advertising: Enabled (0x01)
        Number of sets: 1 (0x01)
        Entry 0
          Handle: 0x00
          Duration: 0 ms (0x00)
          Max ext adv events: 0
> HCI Event: Command Complete (0x0e) plen 4                 #46 [hci1] 3.176025
      LE Set Extended Advertising Enable (0x08|0x0039) ncmd 1
        Status: Success (0x00)
> HCI Event: LE Meta Event (0x3e) plen 31                   #47 [hci1] 3.289868
      LE Enhanced Connection Complete (0x0a)
        Status: Success (0x00)
        Handle: 1497
        Role: Peripheral (0x01)
        Peer address type: Public (0x00)
        Peer address: DF:A9:FF:F6:B1:1A (OUI DF-A9-FF)
        Local resolvable private address: 00:00:00:00:00:00 (Non-Resolvable)
        Peer resolvable private address: 00:00:00:00:00:00 (Non-Resolvable)
        Connection interval: 87.50 msec (0x0046)
        Connection latency: 0 (0x0000)
        Supervision timeout: 25120 msec (0x09d0)
        Central clock accuracy: 0x01
> HCI Event: LE Meta Event (0x3e) plen 6                    #48 [hci1] 3.289999
      LE Advertising Set Terminated (0x12)
        Status: Success (0x00)
        Handle: 0
        Connection handle: 1497
        Number of completed extended advertising events: 0
< HCI Command: LE Read Remote Used... (0x08|0x0016) plen 2  #49 [hci1] 3.296613
        Handle: 1497 Address: DF:A9:FF:F6:B1:1A (OUI DF-A9-FF)
< ACL Data TX: Handle 1497 flags 0x00 dlen 7                #50 [hci1] 3.296638
      ATT: Exchange MTU Request (0x02) len 2
        Client RX MTU: 251
> HCI Event: Command Status (0x0f) plen 4                   #51 [hci1] 3.297133
      LE Read Remote Used Features (0x08|0x0016) ncmd 1
        Status: Success (0x00)
> HCI Event: Number of Completed Packets (0x13) plen 5      #52 [hci1] 3.465862
        Num handles: 1
        Handle: 1497 Address: DF:A9:FF:F6:B1:1A (OUI DF-A9-FF)
        Count: 1
        #50: len 7 (0 Kb/s)
        Latency: 169 msec (169-169 msec ~169 msec)
> HCI Event: LE Meta Event (0x3e) plen 12                   #53 [hci1] 3.553720
      LE Read Remote Used Features (0x04)
        Status: Success (0x00)
        Handle: 1497 Address: DF:A9:FF:F6:B1:1A (OUI DF-A9-FF)
        Features: 0x2d 0x49 0x00 0xf7 0x67 0xd9 0x00 0x80
          LE Encryption
          Extended Reject Indication
          Peripheral-initiated Features Exchange
          LE Data Packet Length Extension
          LE 2M PHY
          LE Coded PHY
          Channel Selection Algorithm #2
          Periodic Advertising Sync Transfer - Sender
          Periodic Advertising Sync Transfer - Recipient
          Sleep Clock Accuracy Updates
          Connected Isochronous Stream - Central
          Connected Isochronous Stream - Peripheral
          Isochronous Broadcaster
          Synchronized Receiver
          Connected Isochronous Stream (Host Support)
          LE Power Control Request
          LE Power Control Request
          Connection Subrating
          Connection Subrating (Host Support)
          Unknown features (0x8000d90000000000)
> ACL Data RX: Handle 1497 flags 0x02 dlen 11               #54 [hci1] 6.003495
      SMP: Pairing Request (0x01) len 6
        IO capability: KeyboardDisplay (0x04)
        OOB data: Authentication data not present (0x00)
        Authentication requirement: Bonding, MITM, SC, No Keypresses (0x0d)
        Max encryption key size: 16
        Initiator key distribution: EncKey IdKey (0x03)
        Responder key distribution: EncKey IdKey Sign (0x07)
> ACL Data RX: Handle 1497 flags 0x02 dlen 7                #55 [hci1] 6.003884
      ATT: Exchange MTU Response (0x03) len 2
        Server RX MTU: 23
< HCI Command: Host Number of Compl.. (0x03|0x0035) plen 5  #56 [hci1] 6.015770
        Num handles: 1
        Handle: 1497 Address: DF:A9:FF:F6:B1:1A (OUI DF-A9-FF)
        Count: 1
< ACL Data TX: Handle 1497 flags 0x00 dlen 11               #57 [hci1] 6.015831
      SMP: Pairing Response (0x02) len 6
        IO capability: DisplayOnly (0x00)
        OOB data: Authentication data not present (0x00)
        Authentication requirement: Bonding, No MITM, SC, No Keypresses (0x09)
        Max encryption key size: 16
        Initiator key distribution: IdKey (0x02)
        Responder key distribution: <none> (0x00)
< HCI Command: Host Number of Compl.. (0x03|0x0035) plen 5  #58 [hci1] 6.016182
        Num handles: 1
        Handle: 1497 Address: DF:A9:FF:F6:B1:1A (OUI DF-A9-FF)
        Count: 1
> HCI Event: Number of Completed Packets (0x13) plen 5      #59 [hci1] 6.178489
        Num handles: 1
        Handle: 1497 Address: DF:A9:FF:F6:B1:1A (OUI DF-A9-FF)
        Count: 1
        #57: len 11 (0 Kb/s)
        Latency: 162 msec (162-169 msec ~165 msec)
> ACL Data RX: Handle 1497 flags 0x02 dlen 27               #60 [hci1] 6.178900
> ACL Data RX: Handle 1497 flags 0x01 dlen 27               #61 [hci1] 6.179505
> ACL Data RX: Handle 1497 flags 0x01 dlen 15               #62 [hci1] 6.179847
      SMP: Pairing Public Key (0x0c) len 64
        X: a17191f8101587bbf3eaab6d94d989caa81c4979a566668ac91870010093fa56
        Y: 9391063b4f5106e3d08246e144a330b8acb54f82b5e797092c340d77acf2e714
< HCI Command: Host Number of Compl.. (0x03|0x0035) plen 5  #63 [hci1] 6.196428
        Num handles: 1
        Handle: 1497 Address: DF:A9:FF:F6:B1:1A (OUI DF-A9-FF)
        Count: 1
< HCI Command: Host Number of Compl.. (0x03|0x0035) plen 5  #64 [hci1] 6.196645
        Num handles: 1
        Handle: 1497 Address: DF:A9:FF:F6:B1:1A (OUI DF-A9-FF)
        Count: 1
< HCI Command: Host Number of Compl.. (0x03|0x0035) plen 5  #65 [hci1] 6.197005
        Num handles: 1
        Handle: 1497 Address: DF:A9:FF:F6:B1:1A (OUI DF-A9-FF)
        Count: 1
< ACL Data TX: Handle 1497 flags 0x00 dlen 27               #66 [hci1] 6.197151
< ACL Data TX: Handle 1497 flags 0x01 dlen 27               #67 [hci1] 6.197212
< ACL Data TX: Handle 1497 flags 0x01 dlen 15               #68 [hci1] 6.197254
      SMP: Pairing Public Key (0x0c) len 64
        X: 98308440221e2d910f0e54b71e7ec652857aa9b5a0dc65028824cc19db1226e9
        Y: 67a4816bcb62efb21701e31fdb27561a6217575fb007a8bbdabe7e28b6f68482
> HCI Event: Number of Completed Packets (0x13) plen 5      #69 [hci1] 6.266470
        Num handles: 1
        Handle: 1497 Address: DF:A9:FF:F6:B1:1A (OUI DF-A9-FF)
        Count: 1
        #66: len 27 (3 Kb/s)
        Latency: 69 msec (69-169 msec ~117 msec)
> HCI Event: Number of Completed Packets (0x13) plen 5      #70 [hci1] 6.267118
        Num handles: 1
        Handle: 1497 Address: DF:A9:FF:F6:B1:1A (OUI DF-A9-FF)
        Count: 1
        #67: len 27 (3 Kb/s)
        Latency: 69 msec (69-169 msec ~93 msec)
> HCI Event: Number of Completed Packets (0x13) plen 5      #71 [hci1] 6.353288
        Num handles: 1
        Handle: 1497 Address: DF:A9:FF:F6:B1:1A (OUI DF-A9-FF)
        Count: 1
        #68: len 15 (0 Kb/s)
        Latency: 156 msec (69-169 msec ~124 msec)
> ACL Data RX: Handle 1497 flags 0x02 dlen 21               #72 [hci1] 7.316101
      SMP: Pairing Confirm (0x03) len 16
        Confim value: 23a0a36614424fac992fec27c2534d5b
< HCI Command: Host Number of Compl.. (0x03|0x0035) plen 5  #73 [hci1] 7.336032
        Num handles: 1
        Handle: 1497 Address: DF:A9:FF:F6:B1:1A (OUI DF-A9-FF)
        Count: 1
< ACL Data TX: Handle 1497 flags 0x00 dlen 21               #74 [hci1] 7.336160
      SMP: Pairing Confirm (0x03) len 16
        Confim value: 3c4b4026445483407a4c2fcc6697bea2
> HCI Event: Number of Completed Packets (0x13) plen 5      #75 [hci1] 7.490976
        Num handles: 1
        Handle: 1497 Address: DF:A9:FF:F6:B1:1A (OUI DF-A9-FF)
        Count: 1
        #74: len 21 (1 Kb/s)
        Latency: 154 msec (69-169 msec ~139 msec)
> ACL Data RX: Handle 1497 flags 0x02 dlen 21               #76 [hci1] 7.491274
      SMP: Pairing Random (0x04) len 16
        Random value: 6622ab16099529ff0000000000000000
< HCI Command: Host Number of Compl.. (0x03|0x0035) plen 5  #77 [hci1] 7.496335
        Num handles: 1
        Handle: 1497 Address: DF:A9:FF:F6:B1:1A (OUI DF-A9-FF)
        Count: 1
< ACL Data TX: Handle 1497 flags 0x00 dlen 21               #78 [hci1] 7.496520
      SMP: Pairing Random (0x04) len 16
        Random value: 8e6108f966a694cbe26df70bb96773e6
> HCI Event: Number of Completed Packets (0x13) plen 5      #79 [hci1] 7.665745
        Num handles: 1
        Handle: 1497 Address: DF:A9:FF:F6:B1:1A (OUI DF-A9-FF)
        Count: 1
        #78: len 21 (0 Kb/s)
        Latency: 169 msec (69-169 msec ~154 msec)
> ACL Data RX: Handle 1497 flags 0x02 dlen 21               #80 [hci1] 7.753594
      SMP: Pairing Confirm (0x03) len 16
        Confim value: 30409d141acc207be60aca2173d5c87d
< HCI Command: Host Number of Compl.. (0x03|0x0035) plen 5  #81 [hci1] 7.755954
        Num handles: 1
        Handle: 1497 Address: DF:A9:FF:F6:B1:1A (OUI DF-A9-FF)
        Count: 1
< ACL Data TX: Handle 1497 flags 0x00 dlen 21               #82 [hci1] 7.756149
      SMP: Pairing Confirm (0x03) len 16
        Confim value: 0dbde3c18fa52b1a254614570691b856
> HCI Event: Number of Completed Packets (0x13) plen 5      #83 [hci1] 7.928440
        Num handles: 1
        Handle: 1497 Address: DF:A9:FF:F6:B1:1A (OUI DF-A9-FF)
        Count: 1
        #82: len 21 (0 Kb/s)
        Latency: 172 msec (69-172 msec ~163 msec)
> ACL Data RX: Handle 1497 flags 0x02 dlen 21               #84 [hci1] 7.928896
      SMP: Pairing Random (0x04) len 16
        Random value: 4f88d971c767658a0000000000000000
< HCI Command: Host Number of Compl.. (0x03|0x0035) plen 5  #85 [hci1] 7.935638
        Num handles: 1
        Handle: 1497 Address: DF:A9:FF:F6:B1:1A (OUI DF-A9-FF)
        Count: 1
< ACL Data TX: Handle 1497 flags 0x00 dlen 21               #86 [hci1] 7.935711
      SMP: Pairing Random (0x04) len 16
        Random value: 4d02679f89a05211af56d8b3da64d21e
> HCI Event: Number of Completed Packets (0x13) plen 5      #87 [hci1] 8.103285
        Num handles: 1
        Handle: 1497 Address: DF:A9:FF:F6:B1:1A (OUI DF-A9-FF)
        Count: 1
        #86: len 21 (1 Kb/s)
        Latency: 167 msec (69-172 msec ~165 msec)
> ACL Data RX: Handle 1497 flags 0x02 dlen 21               #88 [hci1] 8.191110
      SMP: Pairing Confirm (0x03) len 16
        Confim value: b5fd505b922342025166063df1d003be
< HCI Command: Host Number of Compl.. (0x03|0x0035) plen 5  #89 [hci1] 8.195978
        Num handles: 1
        Handle: 1497 Address: DF:A9:FF:F6:B1:1A (OUI DF-A9-FF)
        Count: 1
< ACL Data TX: Handle 1497 flags 0x00 dlen 21               #90 [hci1] 8.196083
      SMP: Pairing Confirm (0x03) len 16
        Confim value: a8f0bd6503ef8166b9ad3f3fcdd34a6a
> HCI Event: Number of Completed Packets (0x13) plen 5      #91 [hci1] 8.365975
        Num handles: 1
        Handle: 1497 Address: DF:A9:FF:F6:B1:1A (OUI DF-A9-FF)
        Count: 1
        #90: len 21 (0 Kb/s)
        Latency: 169 msec (69-172 msec ~167 msec)
> ACL Data RX: Handle 1497 flags 0x02 dlen 21               #92 [hci1] 8.366369
      SMP: Pairing Random (0x04) len 16
        Random value: cbac26a4aa880f8f0000000000000000
< HCI Command: Host Number of Compl.. (0x03|0x0035) plen 5  #93 [hci1] 8.376266
        Num handles: 1
        Handle: 1497 Address: DF:A9:FF:F6:B1:1A (OUI DF-A9-FF)
        Count: 1
< ACL Data TX: Handle 1497 flags 0x00 dlen 21               #94 [hci1] 8.376435
      SMP: Pairing Random (0x04) len 16
        Random value: 5e8286bc235a02440d0c3424a2acf8fd
> HCI Event: Number of Completed Packets (0x13) plen 5      #95 [hci1] 8.540729
        Num handles: 1
        Handle: 1497 Address: DF:A9:FF:F6:B1:1A (OUI DF-A9-FF)
        Count: 1
        #94: len 21 (1 Kb/s)
        Latency: 164 msec (69-172 msec ~165 msec)
> ACL Data RX: Handle 1497 flags 0x02 dlen 21               #96 [hci1] 8.628577
      SMP: Pairing Confirm (0x03) len 16
        Confim value: 1307d1bec4c0278e8b0bcb5711aebea2
< HCI Command: Host Number of Compl.. (0x03|0x0035) plen 5  #97 [hci1] 8.636088
        Num handles: 1
        Handle: 1497 Address: DF:A9:FF:F6:B1:1A (OUI DF-A9-FF)
        Count: 1
< ACL Data TX: Handle 1497 flags 0x00 dlen 21               #98 [hci1] 8.636228
      SMP: Pairing Confirm (0x03) len 16
        Confim value: d6ab0ace3a94b1d68138a5d75716e87b
> HCI Event: Number of Completed Packets (0x13) plen 5      #99 [hci1] 8.803425
        Num handles: 1
        Handle: 1497 Address: DF:A9:FF:F6:B1:1A (OUI DF-A9-FF)
        Count: 1
        #98: len 21 (1 Kb/s)
        Latency: 167 msec (69-172 msec ~166 msec)
> ACL Data RX: Handle 1497 flags 0x02 dlen 21              #100 [hci1] 8.803870
      SMP: Pairing Random (0x04) len 16
        Random value: b155bfeefe37da450000000000000000
< HCI Command: Host Number of Comp.. (0x03|0x0035) plen 5  #101 [hci1] 8.816293
        Num handles: 1
        Handle: 1497 Address: DF:A9:FF:F6:B1:1A (OUI DF-A9-FF)
        Count: 1
< ACL Data TX: Handle 1497 flags 0x00 dlen 21              #102 [hci1] 8.816490
      SMP: Pairing Random (0x04) len 16
        Random value: 5c4a1bcadd27bd58e945097b00bad7ac
> HCI Event: Number of Completed Packets (0x13) plen 5     #103 [hci1] 8.978206
        Num handles: 1
        Handle: 1497 Address: DF:A9:FF:F6:B1:1A (OUI DF-A9-FF)
        Count: 1
        #102: len 21 (1 Kb/s)
        Latency: 161 msec (69-172 msec ~164 msec)
> ACL Data RX: Handle 1497 flags 0x02 dlen 21              #104 [hci1] 9.066089
      SMP: Pairing Confirm (0x03) len 16
        Confim value: 24222072f15ea1d5f9f92e9dbd2d67d2
< HCI Command: Host Number of Comp.. (0x03|0x0035) plen 5  #105 [hci1] 9.075742
        Num handles: 1
        Handle: 1497 Address: DF:A9:FF:F6:B1:1A (OUI DF-A9-FF)
        Count: 1
< ACL Data TX: Handle 1497 flags 0x00 dlen 21              #106 [hci1] 9.075833
      SMP: Pairing Confirm (0x03) len 16
        Confim value: 8886f36b2ff1a4c5e052e196f33f1afd
> HCI Event: Number of Completed Packets (0x13) plen 5     #107 [hci1] 9.240997
        Num handles: 1
        Handle: 1497 Address: DF:A9:FF:F6:B1:1A (OUI DF-A9-FF)
        Count: 1
        #106: len 21 (1 Kb/s)
        Latency: 165 msec (69-172 msec ~164 msec)
> ACL Data RX: Handle 1497 flags 0x02 dlen 21              #108 [hci1] 9.241271
      SMP: Pairing Random (0x04) len 16
        Random value: 7e2244506ac1d78d0000000000000000
< HCI Command: Host Number of Comp.. (0x03|0x0035) plen 5  #109 [hci1] 9.256307
        Num handles: 1
        Handle: 1497 Address: DF:A9:FF:F6:B1:1A (OUI DF-A9-FF)
        Count: 1
< ACL Data TX: Handle 1497 flags 0x00 dlen 21              #110 [hci1] 9.256425
      SMP: Pairing Random (0x04) len 16
        Random value: 32527e6e64e79f33b2e374394db8ab2d
> HCI Event: Number of Completed Packets (0x13) plen 5     #111 [hci1] 9.415730
        Num handles: 1
        Handle: 1497 Address: DF:A9:FF:F6:B1:1A (OUI DF-A9-FF)
        Count: 1
        #110: len 21 (1 Kb/s)
        Latency: 159 msec (69-172 msec ~161 msec)
> ACL Data RX: Handle 1497 flags 0x02 dlen 21              #112 [hci1] 9.503588
      SMP: Pairing Confirm (0x03) len 16
        Confim value: 90b1e9c09f160bf3dd5683994cb3e30c
< HCI Command: Host Number of Comp.. (0x03|0x0035) plen 5  #113 [hci1] 9.515725
        Num handles: 1
        Handle: 1497 Address: DF:A9:FF:F6:B1:1A (OUI DF-A9-FF)
        Count: 1
< ACL Data TX: Handle 1497 flags 0x00 dlen 21              #114 [hci1] 9.515828
      SMP: Pairing Confirm (0x03) len 16
        Confim value: 584b48bff7a9ffddc534e72df02f614f
> HCI Event: Number of Completed Packets (0x13) plen 5     #115 [hci1] 9.678502
        Num handles: 1
        Handle: 1497 Address: DF:A9:FF:F6:B1:1A (OUI DF-A9-FF)
        Count: 1
        #114: len 21 (1 Kb/s)
        Latency: 162 msec (69-172 msec ~162 msec)
> ACL Data RX: Handle 1497 flags 0x02 dlen 21              #116 [hci1] 9.678764
      SMP: Pairing Random (0x04) len 16
        Random value: 52550478f37505430000000000000000
< HCI Command: Host Number of Comp.. (0x03|0x0035) plen 5  #117 [hci1] 9.696306
        Num handles: 1
        Handle: 1497 Address: DF:A9:FF:F6:B1:1A (OUI DF-A9-FF)
        Count: 1
< ACL Data TX: Handle 1497 flags 0x00 dlen 21              #118 [hci1] 9.696506
      SMP: Pairing Random (0x04) len 16
        Random value: dddbdfe2838e9a8cc6964353c850fef7
> HCI Event: Number of Completed Packets (0x13) plen 5     #119 [hci1] 9.853184
        Num handles: 1
        Handle: 1497 Address: DF:A9:FF:F6:B1:1A (OUI DF-A9-FF)
        Count: 1
        #118: len 21 (1 Kb/s)
        Latency: 156 msec (69-172 msec ~159 msec)
> ACL Data RX: Handle 1497 flags 0x02 dlen 21              #120 [hci1] 9.941076
      SMP: Pairing Confirm (0x03) len 16
        Confim value: 8e035377c81cf2f9edc91d49a3f9faef
< HCI Command: Host Number of Comp.. (0x03|0x0035) plen 5  #121 [hci1] 9.956018
        Num handles: 1
        Handle: 1497 Address: DF:A9:FF:F6:B1:1A (OUI DF-A9-FF)
        Count: 1
< ACL Data TX: Handle 1497 flags 0x00 dlen 21              #122 [hci1] 9.956145
      SMP: Pairing Confirm (0x03) len 16
        Confim value: dbd642ce867cd12a676603a38b490c30
> HCI Event: Number of Completed Packets (0x13) plen 5    #123 [hci1] 10.115954
        Num handles: 1
        Handle: 1497 Address: DF:A9:FF:F6:B1:1A (OUI DF-A9-FF)
        Count: 1
        #122: len 21 (1 Kb/s)
        Latency: 159 msec (69-172 msec ~159 msec)
> ACL Data RX: Handle 1497 flags 0x02 dlen 21             #124 [hci1] 10.116321
      SMP: Pairing Random (0x04) len 16
        Random value: 307ace393447645f0000000000000000
< HCI Command: Host Number of Com.. (0x03|0x0035) plen 5  #125 [hci1] 10.136183
        Num handles: 1
        Handle: 1497 Address: DF:A9:FF:F6:B1:1A (OUI DF-A9-FF)
        Count: 1
< ACL Data TX: Handle 1497 flags 0x00 dlen 21             #126 [hci1] 10.136340
      SMP: Pairing Random (0x04) len 16
        Random value: eb9f1915536596b6fc3db1c86b2b1970
> HCI Event: Number of Completed Packets (0x13) plen 5    #127 [hci1] 10.290750
        Num handles: 1
        Handle: 1497 Address: DF:A9:FF:F6:B1:1A (OUI DF-A9-FF)
        Count: 1
        #126: len 21 (1 Kb/s)
        Latency: 154 msec (69-172 msec ~157 msec)
> ACL Data RX: Handle 1497 flags 0x02 dlen 21             #128 [hci1] 10.378539
      SMP: Pairing Confirm (0x03) len 16
        Confim value: 1e74fc898984fed8241db87de19d30e8
< HCI Command: Host Number of Com.. (0x03|0x0035) plen 5  #129 [hci1] 10.395889
        Num handles: 1
        Handle: 1497 Address: DF:A9:FF:F6:B1:1A (OUI DF-A9-FF)
        Count: 1
< ACL Data TX: Handle 1497 flags 0x00 dlen 21             #130 [hci1] 10.395942
      SMP: Pairing Confirm (0x03) len 16
        Confim value: 9f37e687ecbb4d7b89bab24496c64785
> HCI Event: Number of Completed Packets (0x13) plen 5    #131 [hci1] 10.553468
        Num handles: 1
        Handle: 1497 Address: DF:A9:FF:F6:B1:1A (OUI DF-A9-FF)
        Count: 1
        #130: len 21 (1 Kb/s)
        Latency: 157 msec (69-172 msec ~157 msec)
> ACL Data RX: Handle 1497 flags 0x02 dlen 21             #132 [hci1] 10.553730
      SMP: Pairing Random (0x04) len 16
        Random value: e205938d208b03370000000000000000
< HCI Command: Host Number of Com.. (0x03|0x0035) plen 5  #133 [hci1] 10.556253
        Num handles: 1
        Handle: 1497 Address: DF:A9:FF:F6:B1:1A (OUI DF-A9-FF)
        Count: 1
< ACL Data TX: Handle 1497 flags 0x00 dlen 21             #134 [hci1] 10.556459
      SMP: Pairing Random (0x04) len 16
        Random value: 5c794dc9ad9f2c3f295ebd5ad5e1c3cf
> HCI Event: Number of Completed Packets (0x13) plen 5    #135 [hci1] 10.728215
        Num handles: 1
        Handle: 1497 Address: DF:A9:FF:F6:B1:1A (OUI DF-A9-FF)
        Count: 1
        #134: len 21 (0 Kb/s)
        Latency: 171 msec (69-172 msec ~164 msec)
> ACL Data RX: Handle 1497 flags 0x02 dlen 21             #136 [hci1] 10.816042
      SMP: Pairing Confirm (0x03) len 16
        Confim value: ed91a8f0c81a9218e36e33d07237860e
< HCI Command: Host Number of Com.. (0x03|0x0035) plen 5  #137 [hci1] 10.836086
        Num handles: 1
        Handle: 1497 Address: DF:A9:FF:F6:B1:1A (OUI DF-A9-FF)
        Count: 1
< ACL Data TX: Handle 1497 flags 0x00 dlen 21             #138 [hci1] 10.836191
      SMP: Pairing Confirm (0x03) len 16
        Confim value: 4cd64ee6704a626611fa5de6f0605dff
> HCI Event: Number of Completed Packets (0x13) plen 5    #139 [hci1] 10.990920
        Num handles: 1
        Handle: 1497 Address: DF:A9:FF:F6:B1:1A (OUI DF-A9-FF)
        Count: 1
        #138: len 21 (1 Kb/s)
        Latency: 154 msec (69-172 msec ~159 msec)
> ACL Data RX: Handle 1497 flags 0x02 dlen 21             #140 [hci1] 10.991239
      SMP: Pairing Random (0x04) len 16
        Random value: 4aead7f70d571efc0000000000000000
< HCI Command: Host Number of Com.. (0x03|0x0035) plen 5  #141 [hci1] 10.995719
        Num handles: 1
        Handle: 1497 Address: DF:A9:FF:F6:B1:1A (OUI DF-A9-FF)
        Count: 1
< ACL Data TX: Handle 1497 flags 0x00 dlen 21             #142 [hci1] 10.995789
      SMP: Pairing Random (0x04) len 16
        Random value: 5c2fff312cdf99c9491988e877355a9a
> HCI Event: Number of Completed Packets (0x13) plen 5    #143 [hci1] 11.165746
        Num handles: 1
        Handle: 1497 Address: DF:A9:FF:F6:B1:1A (OUI DF-A9-FF)
        Count: 1
        #142: len 21 (0 Kb/s)
        Latency: 169 msec (69-172 msec ~164 msec)
> ACL Data RX: Handle 1497 flags 0x02 dlen 21             #144 [hci1] 11.253554
      SMP: Pairing Confirm (0x03) len 16
        Confim value: 30d7d364ad67caffcc6307f4cf5df15e
< HCI Command: Host Number of Com.. (0x03|0x0035) plen 5  #145 [hci1] 11.255999
        Num handles: 1
        Handle: 1497 Address: DF:A9:FF:F6:B1:1A (OUI DF-A9-FF)
        Count: 1
< ACL Data TX: Handle 1497 flags 0x00 dlen 21             #146 [hci1] 11.256089
      SMP: Pairing Confirm (0x03) len 16
        Confim value: 9b896df4c107b1c934daad78891fc231
> HCI Event: Number of Completed Packets (0x13) plen 5    #147 [hci1] 11.428429
        Num handles: 1
        Handle: 1497 Address: DF:A9:FF:F6:B1:1A (OUI DF-A9-FF)
        Count: 1
        #146: len 21 (0 Kb/s)
        Latency: 172 msec (69-172 msec ~168 msec)
> ACL Data RX: Handle 1497 flags 0x02 dlen 21             #148 [hci1] 11.428780
      SMP: Pairing Random (0x04) len 16
        Random value: 670a5aab087b42ad0000000000000000
< HCI Command: Host Number of Com.. (0x03|0x0035) plen 5  #149 [hci1] 11.436130
        Num handles: 1
        Handle: 1497 Address: DF:A9:FF:F6:B1:1A (OUI DF-A9-FF)
        Count: 1
< ACL Data TX: Handle 1497 flags 0x00 dlen 21             #150 [hci1] 11.436323
      SMP: Pairing Random (0x04) len 16
        Random value: c629a3a987d808e808655d558dfc1155
> HCI Event: Number of Completed Packets (0x13) plen 5    #151 [hci1] 11.603170
        Num handles: 1
        Handle: 1497 Address: DF:A9:FF:F6:B1:1A (OUI DF-A9-FF)
        Count: 1
        #150: len 21 (1 Kb/s)
        Latency: 166 msec (69-172 msec ~167 msec)
> ACL Data RX: Handle 1497 flags 0x02 dlen 21             #152 [hci1] 11.691109
      SMP: Pairing Confirm (0x03) len 16
        Confim value: 06c78e0e6f42926dabeb10d6c2ab0583
< HCI Command: Host Number of Com.. (0x03|0x0035) plen 5  #153 [hci1] 11.696039
        Num handles: 1
        Handle: 1497 Address: DF:A9:FF:F6:B1:1A (OUI DF-A9-FF)
        Count: 1
< ACL Data TX: Handle 1497 flags 0x00 dlen 21             #154 [hci1] 11.696151
      SMP: Pairing Confirm (0x03) len 16
        Confim value: afd787901bb1ca08f84d93e5a637dfc8
> HCI Event: Number of Completed Packets (0x13) plen 5    #155 [hci1] 11.865927
        Num handles: 1
        Handle: 1497 Address: DF:A9:FF:F6:B1:1A (OUI DF-A9-FF)
        Count: 1
        #154: len 21 (0 Kb/s)
        Latency: 169 msec (69-172 msec ~168 msec)
> ACL Data RX: Handle 1497 flags 0x02 dlen 21             #156 [hci1] 11.866196
      SMP: Pairing Random (0x04) len 16
        Random value: f0fb6e48f67a04fd0000000000000000
< HCI Command: Host Number of Com.. (0x03|0x0035) plen 5  #157 [hci1] 11.876352
        Num handles: 1
        Handle: 1497 Address: DF:A9:FF:F6:B1:1A (OUI DF-A9-FF)
        Count: 1
< ACL Data TX: Handle 1497 flags 0x00 dlen 21             #158 [hci1] 11.876449
      SMP: Pairing Random (0x04) len 16
        Random value: 92f20f6ad8f13724432c7fd6001c45ff
> HCI Event: Number of Completed Packets (0x13) plen 5    #159 [hci1] 12.040727
        Num handles: 1
        Handle: 1497 Address: DF:A9:FF:F6:B1:1A (OUI DF-A9-FF)
        Count: 1
        #158: len 21 (1 Kb/s)
        Latency: 164 msec (69-172 msec ~166 msec)
> ACL Data RX: Handle 1497 flags 0x02 dlen 21             #160 [hci1] 12.128654
      SMP: Pairing Confirm (0x03) len 16
        Confim value: beae6e52be3af90c6877632ff890f922
< HCI Command: Host Number of Com.. (0x03|0x0035) plen 5  #161 [hci1] 12.136009
        Num handles: 1
        Handle: 1497 Address: DF:A9:FF:F6:B1:1A (OUI DF-A9-FF)
        Count: 1
< ACL Data TX: Handle 1497 flags 0x00 dlen 21             #162 [hci1] 12.136116
      SMP: Pairing Confirm (0x03) len 16
        Confim value: 853a28aee47753e9c83421b0066acc3c
> HCI Event: Number of Completed Packets (0x13) plen 5    #163 [hci1] 12.303378
        Num handles: 1
        Handle: 1497 Address: DF:A9:FF:F6:B1:1A (OUI DF-A9-FF)
        Count: 1
        #162: len 21 (1 Kb/s)
        Latency: 167 msec (69-172 msec ~166 msec)
> ACL Data RX: Handle 1497 flags 0x02 dlen 21             #164 [hci1] 12.303691
      SMP: Pairing Random (0x04) len 16
        Random value: f73a1e31cb88bf5c0000000000000000
< HCI Command: Host Number of Com.. (0x03|0x0035) plen 5  #165 [hci1] 12.316166
        Num handles: 1
        Handle: 1497 Address: DF:A9:FF:F6:B1:1A (OUI DF-A9-FF)
        Count: 1
< ACL Data TX: Handle 1497 flags 0x00 dlen 21             #166 [hci1] 12.316328
      SMP: Pairing Random (0x04) len 16
        Random value: 23ac32ebbb5e14c8a6b9622f296d277f
> HCI Event: Number of Completed Packets (0x13) plen 5    #167 [hci1] 12.478167
        Num handles: 1
        Handle: 1497 Address: DF:A9:FF:F6:B1:1A (OUI DF-A9-FF)
        Count: 1
        #166: len 21 (1 Kb/s)
        Latency: 161 msec (69-172 msec ~164 msec)
> ACL Data RX: Handle 1497 flags 0x02 dlen 21             #168 [hci1] 12.566046
      SMP: Pairing Confirm (0x03) len 16
        Confim value: 4a2dadc217fa9c2a7ec29dfd98979c8a
< HCI Command: Host Number of Com.. (0x03|0x0035) plen 5  #169 [hci1] 12.576129
        Num handles: 1
        Handle: 1497 Address: DF:A9:FF:F6:B1:1A (OUI DF-A9-FF)
        Count: 1
< ACL Data TX: Handle 1497 flags 0x00 dlen 21             #170 [hci1] 12.576260
      SMP: Pairing Confirm (0x03) len 16
        Confim value: 45cbf862ffe72f4be99452def7da195c
> HCI Event: Number of Completed Packets (0x13) plen 5    #171 [hci1] 12.740908
        Num handles: 1
        Handle: 1497 Address: DF:A9:FF:F6:B1:1A (OUI DF-A9-FF)
        Count: 1
        #170: len 21 (1 Kb/s)
        Latency: 164 msec (69-172 msec ~164 msec)
> ACL Data RX: Handle 1497 flags 0x02 dlen 21             #172 [hci1] 12.741216
      SMP: Pairing Random (0x04) len 16
        Random value: 9f322fd102442a460000000000000000
< HCI Command: Host Number of Com.. (0x03|0x0035) plen 5  #173 [hci1] 12.756479
        Num handles: 1
        Handle: 1497 Address: DF:A9:FF:F6:B1:1A (OUI DF-A9-FF)
        Count: 1
< ACL Data TX: Handle 1497 flags 0x00 dlen 21             #174 [hci1] 12.756664
      SMP: Pairing Random (0x04) len 16
        Random value: 297efe85e67448a15f56bd27e3a3cf1d
> HCI Event: Number of Completed Packets (0x13) plen 5    #175 [hci1] 12.915738
        Num handles: 1
        Handle: 1497 Address: DF:A9:FF:F6:B1:1A (OUI DF-A9-FF)
        Count: 1
        #174: len 21 (1 Kb/s)
        Latency: 159 msec (69-172 msec ~161 msec)
> ACL Data RX: Handle 1497 flags 0x02 dlen 21             #176 [hci1] 13.003602
      SMP: Pairing Confirm (0x03) len 16
        Confim value: 695f4036a260fbf8eb1fb2e36c8d3549
< HCI Command: Host Number of Com.. (0x03|0x0035) plen 5  #177 [hci1] 13.015857
        Num handles: 1
        Handle: 1497 Address: DF:A9:FF:F6:B1:1A (OUI DF-A9-FF)
        Count: 1
< ACL Data TX: Handle 1497 flags 0x00 dlen 21             #178 [hci1] 13.015971
      SMP: Pairing Confirm (0x03) len 16
        Confim value: ab61ada35b7fe35384e4cd420c4fc392
> HCI Event: Number of Completed Packets (0x13) plen 5    #179 [hci1] 13.178426
        Num handles: 1
        Handle: 1497 Address: DF:A9:FF:F6:B1:1A (OUI DF-A9-FF)
        Count: 1
        #178: len 21 (1 Kb/s)
        Latency: 162 msec (69-172 msec ~162 msec)
> ACL Data RX: Handle 1497 flags 0x02 dlen 21             #180 [hci1] 13.178669
      SMP: Pairing Random (0x04) len 16
        Random value: c94934824278145c0000000000000000
< HCI Command: Host Number of Com.. (0x03|0x0035) plen 5  #181 [hci1] 13.195863
        Num handles: 1
        Handle: 1497 Address: DF:A9:FF:F6:B1:1A (OUI DF-A9-FF)
        Count: 1
< ACL Data TX: Handle 1497 flags 0x00 dlen 21             #182 [hci1] 13.195963
      SMP: Pairing Random (0x04) len 16
        Random value: 25a9493fd3ce4faf02be7293595bb7c6
> HCI Event: Number of Completed Packets (0x13) plen 5    #183 [hci1] 13.353170
        Num handles: 1
        Handle: 1497 Address: DF:A9:FF:F6:B1:1A (OUI DF-A9-FF)
        Count: 1
        #182: len 21 (1 Kb/s)
        Latency: 157 msec (69-172 msec ~159 msec)
> ACL Data RX: Handle 1497 flags 0x02 dlen 21             #184 [hci1] 13.441005
      SMP: Pairing Confirm (0x03) len 16
        Confim value: 63f12f7fe354fc853b5983d25aa2318d
< HCI Command: Host Number of Com.. (0x03|0x0035) plen 5  #185 [hci1] 13.456152
        Num handles: 1
        Handle: 1497 Address: DF:A9:FF:F6:B1:1A (OUI DF-A9-FF)
        Count: 1
< ACL Data TX: Handle 1497 flags 0x00 dlen 21             #186 [hci1] 13.456217
      SMP: Pairing Confirm (0x03) len 16
        Confim value: 04fe3c1878761c747c71a0d5bc1bd01a
> HCI Event: Number of Completed Packets (0x13) plen 5    #187 [hci1] 13.615852
        Num handles: 1
        Handle: 1497 Address: DF:A9:FF:F6:B1:1A (OUI DF-A9-FF)
        Count: 1
        #186: len 21 (1 Kb/s)
        Latency: 159 msec (69-172 msec ~159 msec)
> ACL Data RX: Handle 1497 flags 0x02 dlen 21             #188 [hci1] 13.616150
      SMP: Pairing Random (0x04) len 16
        Random value: c3d3ee22a3796dfb0000000000000000
< HCI Command: Host Number of Com.. (0x03|0x0035) plen 5  #189 [hci1] 13.636095
        Num handles: 1
        Handle: 1497 Address: DF:A9:FF:F6:B1:1A (OUI DF-A9-FF)
        Count: 1
< ACL Data TX: Handle 1497 flags 0x00 dlen 21             #190 [hci1] 13.636238
      SMP: Pairing Random (0x04) len 16
        Random value: 58f6b41f855a6f6c3560debd84e2affc
> HCI Event: Number of Completed Packets (0x13) plen 5    #191 [hci1] 13.790704
        Num handles: 1
        Handle: 1497 Address: DF:A9:FF:F6:B1:1A (OUI DF-A9-FF)
        Count: 1
        #190: len 21 (1 Kb/s)
        Latency: 154 msec (69-172 msec ~157 msec)
> ACL Data RX: Handle 1497 flags 0x02 dlen 21             #192 [hci1] 13.878530
      SMP: Pairing Confirm (0x03) len 16
        Confim value: 9b2ad265fa1b2ae79cd755b1c8220b75
< HCI Command: Host Number of Com.. (0x03|0x0035) plen 5  #193 [hci1] 13.895553
        Num handles: 1
        Handle: 1497 Address: DF:A9:FF:F6:B1:1A (OUI DF-A9-FF)
        Count: 1
< ACL Data TX: Handle 1497 flags 0x00 dlen 21             #194 [hci1] 13.895689
      SMP: Pairing Confirm (0x03) len 16
        Confim value: 16ab755c8f5071c0c078dd49008b0d8d
> HCI Event: Number of Completed Packets (0x13) plen 5    #195 [hci1] 14.053431
        Num handles: 1
        Handle: 1497 Address: DF:A9:FF:F6:B1:1A (OUI DF-A9-FF)
        Count: 1
        #194: len 21 (1 Kb/s)
        Latency: 157 msec (69-172 msec ~157 msec)
> ACL Data RX: Handle 1497 flags 0x02 dlen 21             #196 [hci1] 14.053664
      SMP: Pairing Random (0x04) len 16
        Random value: f8f4737fcbb79e600000000000000000
< HCI Command: Host Number of Com.. (0x03|0x0035) plen 5  #197 [hci1] 14.056334
        Num handles: 1
        Handle: 1497 Address: DF:A9:FF:F6:B1:1A (OUI DF-A9-FF)
        Count: 1
< ACL Data TX: Handle 1497 flags 0x00 dlen 21             #198 [hci1] 14.056488
      SMP: Pairing Random (0x04) len 16
        Random value: b67e7216d5bf664139eda2b542549666
> HCI Event: Number of Completed Packets (0x13) plen 5    #199 [hci1] 14.228101
        Num handles: 1
        Handle: 1497 Address: DF:A9:FF:F6:B1:1A (OUI DF-A9-FF)
        Count: 1
        #198: len 21 (0 Kb/s)
        Latency: 171 msec (69-172 msec ~164 msec)
> ACL Data RX: Handle 1497 flags 0x02 dlen 21             #200 [hci1] 14.316110
      SMP: Pairing Confirm (0x03) len 16
        Confim value: 5fe07178d0cf726c58cff320048d6bd5
< HCI Command: Host Number of Com.. (0x03|0x0035) plen 5  #201 [hci1] 14.336129
        Num handles: 1
        Handle: 1497 Address: DF:A9:FF:F6:B1:1A (OUI DF-A9-FF)
        Count: 1
< ACL Data TX: Handle 1497 flags 0x00 dlen 21             #202 [hci1] 14.336285
      SMP: Pairing Confirm (0x03) len 16
        Confim value: b02451722be9ad965fb9250c6071691b
> HCI Event: Number of Completed Packets (0x13) plen 5    #203 [hci1] 14.490972
        Num handles: 1
        Handle: 1497 Address: DF:A9:FF:F6:B1:1A (OUI DF-A9-FF)
        Count: 1
        #202: len 21 (1 Kb/s)
        Latency: 154 msec (69-172 msec ~159 msec)
> ACL Data RX: Handle 1497 flags 0x02 dlen 21             #204 [hci1] 14.491211
      SMP: Pairing Random (0x04) len 16
        Random value: 3c18e9fa08c80bea0000000000000000
< HCI Command: Host Number of Com.. (0x03|0x0035) plen 5  #205 [hci1] 14.496358
        Num handles: 1
        Handle: 1497 Address: DF:A9:FF:F6:B1:1A (OUI DF-A9-FF)
        Count: 1
< ACL Data TX: Handle 1497 flags 0x00 dlen 21             #206 [hci1] 14.496515
      SMP: Pairing Random (0x04) len 16
        Random value: ed17f76500c95219dd01e09d1e63f87b
> HCI Event: Number of Completed Packets (0x13) plen 5    #207 [hci1] 14.665701
        Num handles: 1
        Handle: 1497 Address: DF:A9:FF:F6:B1:1A (OUI DF-A9-FF)
        Count: 1
        #206: len 21 (0 Kb/s)
        Latency: 169 msec (69-172 msec ~164 msec)
> ACL Data RX: Handle 1497 flags 0x02 dlen 21             #208 [hci1] 14.753563
      SMP: Pairing Confirm (0x03) len 16
        Confim value: a144ffb11c945978cb52b7d68b5cc63b
< HCI Command: Host Number of Com.. (0x03|0x0035) plen 5  #209 [hci1] 14.755945
        Num handles: 1
        Handle: 1497 Address: DF:A9:FF:F6:B1:1A (OUI DF-A9-FF)
        Count: 1
< ACL Data TX: Handle 1497 flags 0x00 dlen 21             #210 [hci1] 14.756086
      SMP: Pairing Confirm (0x03) len 16
        Confim value: bb4d71f96285922b86e90b77b56f8102
> HCI Event: Number of Completed Packets (0x13) plen 5    #211 [hci1] 14.928312
        Num handles: 1
        Handle: 1497 Address: DF:A9:FF:F6:B1:1A (OUI DF-A9-FF)
        Count: 1
        #210: len 21 (0 Kb/s)
        Latency: 172 msec (69-172 msec ~168 msec)
> ACL Data RX: Handle 1497 flags 0x02 dlen 21             #212 [hci1] 14.928654
      SMP: Pairing Random (0x04) len 16
        Random value: cc2433b6b8636be00000000000000000
< HCI Command: Host Number of Com.. (0x03|0x0035) plen 5  #213 [hci1] 14.936338
        Num handles: 1
        Handle: 1497 Address: DF:A9:FF:F6:B1:1A (OUI DF-A9-FF)
        Count: 1
< ACL Data TX: Handle 1497 flags 0x00 dlen 21             #214 [hci1] 14.936495
      SMP: Pairing Random (0x04) len 16
        Random value: 81d35d47e1f6006d79c974bd9d9e1ee3
> HCI Event: Number of Completed Packets (0x13) plen 5    #215 [hci1] 15.103102
        Num handles: 1
        Handle: 1497 Address: DF:A9:FF:F6:B1:1A (OUI DF-A9-FF)
        Count: 1
        #214: len 21 (1 Kb/s)
        Latency: 166 msec (69-172 msec ~167 msec)
> ACL Data RX: Handle 1497 flags 0x02 dlen 21             #216 [hci1] 15.191020
      SMP: Pairing Confirm (0x03) len 16
        Confim value: 0c8d27fdbd26955d01df7c38acb9eb0e
< HCI Command: Host Number of Com.. (0x03|0x0035) plen 5  #217 [hci1] 15.196049
        Num handles: 1
        Handle: 1497 Address: DF:A9:FF:F6:B1:1A (OUI DF-A9-FF)
        Count: 1
< ACL Data TX: Handle 1497 flags 0x00 dlen 21             #218 [hci1] 15.196124
      SMP: Pairing Confirm (0x03) len 16
        Confim value: 6c0bab552e62398871bdfe13af6275c0
> HCI Event: Number of Completed Packets (0x13) plen 5    #219 [hci1] 15.365799
        Num handles: 1
        Handle: 1497 Address: DF:A9:FF:F6:B1:1A (OUI DF-A9-FF)
        Count: 1
        #218: len 21 (0 Kb/s)
        Latency: 169 msec (69-172 msec ~168 msec)
> ACL Data RX: Handle 1497 flags 0x02 dlen 21             #220 [hci1] 15.366144
      SMP: Pairing Random (0x04) len 16
        Random value: f7ababc1b6b922d10000000000000000
< HCI Command: Host Number of Com.. (0x03|0x0035) plen 5  #221 [hci1] 15.376392
        Num handles: 1
        Handle: 1497 Address: DF:A9:FF:F6:B1:1A (OUI DF-A9-FF)
        Count: 1
< ACL Data TX: Handle 1497 flags 0x00 dlen 21             #222 [hci1] 15.376564
      SMP: Pairing Random (0x04) len 16
        Random value: e7f7e0c2476823e41736a7e381bafb7c
> HCI Event: Number of Completed Packets (0x13) plen 5    #223 [hci1] 15.540668
        Num handles: 1
        Handle: 1497 Address: DF:A9:FF:F6:B1:1A (OUI DF-A9-FF)
        Count: 1
        #222: len 21 (1 Kb/s)
        Latency: 164 msec (69-172 msec ~166 msec)
> ACL Data RX: Handle 1497 flags 0x02 dlen 21             #224 [hci1] 15.628597
      SMP: Pairing Confirm (0x03) len 16
        Confim value: b0ee5c25a4420c9a8b67fe69cfad01f3
< HCI Command: Host Number of Com.. (0x03|0x0035) plen 5  #225 [hci1] 15.635897
        Num handles: 1
        Handle: 1497 Address: DF:A9:FF:F6:B1:1A (OUI DF-A9-FF)
        Count: 1
< ACL Data TX: Handle 1497 flags 0x00 dlen 21             #226 [hci1] 15.635969
      SMP: Pairing Confirm (0x03) len 16
        Confim value: f6091ee77c74825bc193102549895f22
> HCI Event: Number of Completed Packets (0x13) plen 5    #227 [hci1] 15.803327
        Num handles: 1
        Handle: 1497 Address: DF:A9:FF:F6:B1:1A (OUI DF-A9-FF)
        Count: 1
        #226: len 21 (1 Kb/s)
        Latency: 167 msec (69-172 msec ~166 msec)
> ACL Data RX: Handle 1497 flags 0x02 dlen 21             #228 [hci1] 15.803666
      SMP: Pairing Random (0x04) len 16
        Random value: b445be0d9ab249340000000000000000
