Bluetooth monitor ver 5.72
= Note: Linux version 6.14.0-36-generic (x86_64)                       0.926748
= Note: Bluetooth subsystem version 2.22                               0.926750
= New Index: 00:00:00:00:00:00 (Primary,UART,hci2)              [hci2] 0.926751
= New Index: 00:00:00:00:00:00 (Primary,UART,hci1)              [hci1] 0.926752
= New Index: 48:5F:99:8E:E0:64 (Primary,USB,hci0)               [hci0] 0.926752
= Open Index: 00:00:00:00:00:00                                 [hci1] 1.070304
= Index Info: 00:00:00:00:00:00 (Nordic Semiconductor ASA)      [hci1] 1.070317
@ USER Open: main (privileged) version 2.22            {0x0001} [hci1] 1.070324
< HCI Command: Reset (0x03|0x0003) plen 0                    #1 [hci1] 1.071179
> HCI Event: Command Complete (0x0e) plen 4                  #2 [hci1] 1.071745
      Reset (0x03|0x0003) ncmd 1
        Status: Success (0x00)
< HCI Command: Read Local Supported... (0x04|0x0003) plen 0  #3 [hci1] 1.090006
> HCI Event: Command Complete (0x0e) plen 12                 #4 [hci1] 1.090512
      Read Local Supported Features (0x04|0x0003) ncmd 1
        Status: Success (0x00)
        Features: 0x00 0x00 0x00 0x00 0x60 0x00 0x00 0x00
          BR/EDR Not Supported
          LE Supported (Controller)
< HCI Command: Read Local Version In.. (0x04|0x0001) plen 0  #5 [hci1] 1.109978
> HCI Event: Command Complete (0x0e) plen 12                 #6 [hci1] 1.110626
      Read Local Version Information (0x04|0x0001) ncmd 1
        Status: Success (0x00)
        HCI version: Reserved (0x0f) - Revision 12393 (0x3069)
        LMP version: Reserved (0x0f) - Subversion 12393 (0x3069)
        Manufacturer: Nordic Semiconductor ASA (89)
< HCI Command: Read Local Supported... (0x04|0x0002) plen 0  #7 [hci1] 1.129987
> HCI Event: Command Complete (0x0e) plen 68                 #8 [hci1] 1.131070
      Read Local Supported Commands (0x04|0x0002) ncmd 1
        Status: Success (0x00)
        Commands: 119 entries
          Disconnect (Octet 0 - Bit 5)
          Read Remote Version Information (Octet 2 - Bit 7)
          Set Event Mask (Octet 5 - Bit 6)
          Reset (Octet 5 - Bit 7)
          Read Connection Accept Timeout (Octet 7 - Bit 2)
          Write Connection Accept Timeout (Octet 7 - Bit 3)
          Read Transmit Power Level (Octet 10 - Bit 2)
          Set Controller To Host Flow Control (Octet 10 - Bit 5)
          Host Buffer Size (Octet 10 - Bit 6)
          Host Number of Completed Packets (Octet 10 - Bit 7)
          Read Local Version Information (Octet 14 - Bit 3)
          Read Local Supported Features (Octet 14 - Bit 5)
          Read BD ADDR (Octet 15 - Bit 1)
          Read RSSI (Octet 15 - Bit 5)
          Set Event Mask Page 2 (Octet 22 - Bit 2)
          LE Set Event Mask (Octet 25 - Bit 0)
          LE Read Buffer Size (Octet 25 - Bit 1)
          LE Read Local Supported Features (Octet 25 - Bit 2)
          LE Set Random Address (Octet 25 - Bit 4)
          LE Set Advertising Parameters (Octet 25 - Bit 5)
          LE Read Advertising Channel TX Power (Octet 25 - Bit 6)
          LE Set Advertising Data (Octet 25 - Bit 7)
          LE Set Scan Response Data (Octet 26 - Bit 0)
          LE Set Advertise Enable (Octet 26 - Bit 1)
          LE Set Scan Parameters (Octet 26 - Bit 2)
          LE Set Scan Enable (Octet 26 - Bit 3)
          LE Create Connection (Octet 26 - Bit 4)
          LE Create Connection Cancel (Octet 26 - Bit 5)
          LE Read Accept List Size (Octet 26 - Bit 6)
          LE Clear Accept List (Octet 26 - Bit 7)
          LE Add Device To Accept List (Octet 27 - Bit 0)
          LE Remove Device From Accept List (Octet 27 - Bit 1)
          LE Connection Update (Octet 27 - Bit 2)
          LE Set Host Channel Classification (Octet 27 - Bit 3)
          LE Read Channel Map (Octet 27 - Bit 4)
          LE Read Remote Used Features (Octet 27 - Bit 5)
          LE Encrypt (Octet 27 - Bit 6)
          LE Rand (Octet 27 - Bit 7)
          LE Start Encryption (Octet 28 - Bit 0)
          LE Long Term Key Request Reply (Octet 28 - Bit 1)
          LE Long Term Key Request Neg Reply (Octet 28 - Bit 2)
          LE Read Supported States (Octet 28 - Bit 3)
          LE Receiver Test (Octet 28 - Bit 4)
          LE Transmitter Test (Octet 28 - Bit 5)
          LE Test End (Octet 28 - Bit 6)
          Read Authenticated Payload Timeout (Octet 32 - Bit 4)
          Write Authenticated Payload Timeout (Octet 32 - Bit 5)
          LE Set Data Length (Octet 33 - Bit 6)
          LE Read Suggested Default Data Length (Octet 33 - Bit 7)
          LE Write Suggested Default Data Length (Octet 34 - Bit 0)
          LE Add Device To Resolving List (Octet 34 - Bit 3)
          LE Remove Device From Resolving List (Octet 34 - Bit 4)
          LE Clear Resolving List (Octet 34 - Bit 5)
          LE Read Resolving List Size (Octet 34 - Bit 6)
          LE Set Address Resolution Enable (Octet 35 - Bit 1)
          LE Set Resolvable Private Address Timeout (Octet 35 - Bit 2)
          LE Read Maximum Data Length (Octet 35 - Bit 3)
          LE Read PHY (Octet 35 - Bit 4)
          LE Set Default PHY (Octet 35 - Bit 5)
          LE Set PHY (Octet 35 - Bit 6)
          LE Enhanced Receiver Test (Octet 35 - Bit 7)
          LE Enhanced Transmitter Test (Octet 36 - Bit 0)
          LE Set Advertising Set Random Address (Octet 36 - Bit 1)
          LE Set Extended Advertising Parameters (Octet 36 - Bit 2)
          LE Set Extended Advertising Data (Octet 36 - Bit 3)
          LE Set Extended Scan Response Data (Octet 36 - Bit 4)
          LE Set Extended Advertising Enable (Octet 36 - Bit 5)
          LE Read Maximum Advertising Data Length (Octet 36 - Bit 6)
          LE Read Number of Supported Advertising Sets (Octet 36 - Bit 7)
          LE Remove Advertising Set (Octet 37 - Bit 0)
          LE Clear Advertising Sets (Octet 37 - Bit 1)
          LE Set Periodic Advertising Parameters (Octet 37 - Bit 2)
          LE Set Periodic Advertising Data (Octet 37 - Bit 3)
          LE Set Periodic Advertising Enable (Octet 37 - Bit 4)
          LE Set Extended Scan Parameters (Octet 37 - Bit 5)
          LE Set Extended Scan Enable (Octet 37 - Bit 6)
          LE Extended Create Connection (Octet 37 - Bit 7)
          LE Periodic Advertising Create Sync (Octet 38 - Bit 0)
          LE Periodic Advertising Create Sync Cancel (Octet 38 - Bit 1)
          LE Periodic Advertising Terminate Sync (Octet 38 - Bit 2)
          LE Add Device To Periodic Advertiser List (Octet 38 - Bit 3)
          LE Remove Device From Periodic Advertiser List (Octet 38 - Bit 4)
          LE Clear Periodic Advertiser List (Octet 38 - Bit 5)
          LE Read Periodic Advertiser List Size (Octet 38 - Bit 6)
          LE Read Transmit Power (Octet 38 - Bit 7)
          LE Read RF Path Compensation (Octet 39 - Bit 0)
          LE Write RF Path Compensation (Octet 39 - Bit 1)
          LE Set Privacy Mode (Octet 39 - Bit 2)
          LE Periodic Advertising Receive Enable (Octet 40 - Bit 5)
          LE Periodic Advertising Sync Transfer (Octet 40 - Bit 6)
          LE Periodic Advertising Set Info Transfer (Octet 40 - Bit 7)
          LE Periodic Advertising Sync Transfer Parameters (Octet 41 - Bit 0)
          LE Set Default Periodic Advertisng Sync Transfer Parameters (Octet 41 - Bit 1)
          LE Read Buffer v2 (Octet 41 - Bit 5)
          LE Read ISO TX Sync (Octet 41 - Bit 6)
          LE Set Connected Isochronous Group Parameters (Octet 41 - Bit 7)
          LE Set Connected Isochronous Group Parameters Test (Octet 42 - Bit 0)
          LE Create Connected Isochronous Stream (Octet 42 - Bit 1)
          LE Remove Connected Isochronous Group (Octet 42 - Bit 2)
          LE Accept Connected Isochronous Stream Request (Octet 42 - Bit 3)
          LE Reject Connected Isochronous Stream Request (Octet 42 - Bit 4)
          LE Create Broadcast Isochronous Group (Octet 42 - Bit 5)
          LE Create Broadcast Isochronous Group Test (Octet 42 - Bit 6)
          LE Terminate Broadcast Isochronous Group (Octet 42 - Bit 7)
          LE Broadcast Isochronous Group Create Sync (Octet 43 - Bit 0)
          LE Broadcast Isochronous Group Terminate Sync (Octet 43 - Bit 1)
          LE Request Peer SCA (Octet 43 - Bit 2)
          LE Setup Isochronous Data Path (Octet 43 - Bit 3)
          LE Remove Isochronous Data Path (Octet 43 - Bit 4)
          LE Isochronous Transmit Test (Octet 43 - Bit 5)
          LE Isochronous Receive Test (Octet 43 - Bit 6)
          LE Isochronous Read Test Counters (Octet 43 - Bit 7)
          LE Isochronous Read Test Counters (Octet 44 - Bit 0)
          LE Set Host Feature (Octet 44 - Bit 1)
          Octet 44 - Bit 2 
          Octet 45 - Bit 6 
          Octet 46 - Bit 0 
          Octet 46 - Bit 1 
          Octet 46 - Bit 2 
< HCI Command: Host Buffer Size (0x03|0x0033) plen 7         #9 [hci1] 1.149985
        ACL MTU: 255  ACL max packet: 16
        SCO MTU: 0    SCO max packet: 0
> HCI Event: Command Complete (0x0e) plen 4                 #10 [hci1] 1.150527
      Host Buffer Size (0x03|0x0033) ncmd 1
        Status: Success (0x00)
< HCI Command: Set Controller To Ho.. (0x03|0x0031) plen 1  #11 [hci1] 1.169976
        Flow control: ACL Data Packets (0x01)
> HCI Event: Command Complete (0x0e) plen 4                 #12 [hci1] 1.170426
      Set Controller To Host Flow Control (0x03|0x0031) ncmd 1
        Status: Success (0x00)
< HCI Command: LE Read Local Suppor.. (0x08|0x0003) plen 0  #13 [hci1] 1.189975
> HCI Event: Command Complete (0x0e) plen 12                #14 [hci1] 1.190574
      LE Read Local Supported Features (0x08|0x0003) ncmd 1
        Status: Success (0x00)
        Features: 0xfd 0x79 0x00 0xf7 0x30 0x01 0x00 0x00
          LE Encryption
          Extended Reject Indication
          Peripheral-initiated Features Exchange
          LE Ping
          LE Data Packet Length Extension
          LL Privacy
          Extended Scanner Filter Policies
          LE 2M PHY
          LE Coded PHY
          LE Extended Advertising
          LE Periodic Advertising
          Channel Selection Algorithm #2
          Periodic Advertising Sync Transfer - Sender
          Periodic Advertising Sync Transfer - Recipient
          Sleep Clock Accuracy Updates
          Connected Isochronous Stream - Central
          Connected Isochronous Stream - Peripheral
          Isochronous Broadcaster
          Synchronized Receiver
          Periodic Advertising ADI support
          Connection Subrating
          Unknown features (0x0000010000000000)
< HCI Command: LE Set Host Feature (0x08|0x0074) plen 2     #15 [hci1] 1.209990
        Bit Number: 32
          Connected Isochronous Stream (Host Support)
        Bit Value: 1
> HCI Event: Command Complete (0x0e) plen 4                 #16 [hci1] 1.210496
      LE Set Host Feature (0x08|0x0074) ncmd 1
        Status: Success (0x00)
< HCI Command: LE Read Buffer v2 (0x08|0x0060) plen 0       #17 [hci1] 1.229978
> HCI Event: Command Complete (0x0e) plen 10                #18 [hci1] 1.230577
      LE Read Buffer v2 (0x08|0x0060) ncmd 1
        Status: Success (0x00)
        ACL MTU: 27
        ACL max packet: 3
        ISO MTU: 318
        ISO max packet: 3
< HCI Command: LE Read Maximum Adve.. (0x08|0x003a) plen 0  #19 [hci1] 1.250005
> HCI Event: Command Complete (0x0e) plen 6                 #20 [hci1] 1.250587
      LE Read Maximum Advertising Data Length (0x08|0x003a) ncmd 1
        Status: Success (0x00)
        Max length: 1650
< HCI Command: LE Read Supported St.. (0x08|0x001c) plen 0  #21 [hci1] 1.269984
> HCI Event: Command Complete (0x0e) plen 12                #22 [hci1] 1.270506
      LE Read Supported States (0x08|0x001c) ncmd 1
        Status: Success (0x00)
        States: 0x000003ff3e0306ff
          Non-connectable Advertising State
          Scannable Advertising State
          Connectable Advertising State
          High Duty Cycle Directed Advertising State
          Passive Scanning State
          Active Scanning State
          Initiating State
            and Connection State (Central Role)
          Connection State (Peripheral Role)
          Scannable Advertising State
            and Passive Scanning State
          Connectable Advertising State
            and Passive Scanning State
          Non-connectable Advertising State
            and Initiating State
          Scannable Advertising State
            and Initiating State
          Active Scanning State
            and Connection State (Central Role)
          Passive Scanning State
            and Connection State (Peripheral Role)
          Active Scanning State
            and Connection State (Peripheral Role)
          Initiating State
            and Connection State (Central Role)
            and Central Role & Central Role
          Low Duty Cycle Directed Advertising State
          Connectable Advertising State
            and Initiating State
            and Central Role & Peripheral Role
          High Duty Cycle Directed Advertising State
            and Initiating State
            and Central Role & Peripheral Role
          Low Duty Cycle Directed Advertising State
            and Initiating State
            and Central Role & Peripheral Role
          Connectable Advertising State
            and Connection State (Central Role)
            and Central Role & Peripheral Role
          High Duty Cycle Directed Advertising State
            and Connection State (Central Role)
            and Central Role & Peripheral Role
          Low Duty Cycle Directed Advertising State
            and Connection State (Central Role)
            and Central Role & Peripheral Role
          Connectable Advertising State
            and Connection State (Peripheral Role)
            and Central Role & Peripheral Role
          High Duty Cycle Directed Advertising State
            and Connection State (Peripheral Role)
            and Peripheral Role & Peripheral Role
          Low Duty Cycle Directed Advertising State
            and Connection State (Peripheral Role)
            and Peripheral Role & Peripheral Role
          Initiating State
            and Connection State (Peripheral Role)
            and Central Role & Peripheral Role
< HCI Command: LE Read Maximum Data.. (0x08|0x002f) plen 0  #23 [hci1] 1.289996
> HCI Event: Command Complete (0x0e) plen 12                #24 [hci1] 1.290507
      LE Read Maximum Data Length (0x08|0x002f) ncmd 1
        Status: Success (0x00)
        Max TX octets: 251
        Max TX time: 2704
        Max RX octets: 251
        Max RX time: 2704
< HCI Command: LE Write Suggested D.. (0x08|0x0024) plen 4  #25 [hci1] 1.309985
        TX octets: 251
        TX time: 2704
> HCI Event: Command Complete (0x0e) plen 4                 #26 [hci1] 1.310567
      LE Write Suggested Default Data Length (0x08|0x0024) ncmd 1
        Status: Success (0x00)
< HCI Command: LE Read Resolving Li.. (0x08|0x002a) plen 0  #27 [hci1] 1.329979
> HCI Event: Command Complete (0x0e) plen 5                 #28 [hci1] 1.330429
      LE Read Resolving List Size (0x08|0x002a) ncmd 1
        Status: Success (0x00)
        Size: 8
< HCI Command: LE Set Host Feature (0x08|0x0074) plen 2     #29 [hci1] 1.349977
        Bit Number: 38
          Connection Subrating (Host Support)
        Bit Value: 1
> HCI Event: Command Complete (0x0e) plen 4                 #30 [hci1] 1.350452
      LE Set Host Feature (0x08|0x0074) ncmd 1
        Status: Success (0x00)
< HCI Command: LE Set Event Mask (0x08|0x0001) plen 8       #31 [hci1] 1.369979
        Mask: 0x000002063f87fa5e
          LE Advertising Report
          LE Connection Update Complete
          LE Read Remote Used Features Complete
          LE Long Term Key Request
          LE Data Length Change
          LE Enhanced Connection Complete
          LE PHY Update Complete
          LE Extended Advertising Report
          LE Periodic Advertising Sync Established
          LE Periodic Advertising Report
          LE Periodic Advertising Sync Lost
          LE Extended Scan Timeout
          LE Extended Advertising Set Terminated
          LE Scan Request Received
          LE Periodic Advertising Sync Transfer Rvc
          LE CIS Established
          LE CIS Request
          LE Create BIG Complete
          LE Terminate BIG Complete
          LE BIG Sync Estabilished Complete
          LE BIG Sync Lost
          LE BIG Info Advertising Report
          LE Subrate Change
          Unknown mask (0x0000020000000000)
> HCI Event: Command Complete (0x0e) plen 4                 #32 [hci1] 1.370608
      LE Set Event Mask (0x08|0x0001) ncmd 1
        Status: Success (0x00)
< HCI Command: Set Event Mask (0x03|0x0001) plen 8          #33 [hci1] 1.389986
        Mask: 0x2000800002008890
          Disconnection Complete
          Encryption Change
          Read Remote Version Information Complete
          Hardware Error
          Data Buffer Overflow
          Encryption Key Refresh Complete
          LE Meta
> HCI Event: Command Complete (0x0e) plen 4                 #34 [hci1] 1.390560
      Set Event Mask (0x03|0x0001) ncmd 1
        Status: Success (0x00)
< HCI Command: Read BD ADDR (0x04|0x0009) plen 0            #35 [hci1] 1.409974
> HCI Event: Command Complete (0x0e) plen 10                #36 [hci1] 1.410584
      Read BD ADDR (0x04|0x0009) ncmd 1
        Status: Success (0x00)
        Address: 00:00:00:00:00:00 (OUI 00-00-00)
< HCI Command: LE Set Random Address (0x08|0x0005) plen 6   #37 [hci1] 1.429953
        Address: D5:B6:CC:31:DB:3B (Static)
> HCI Event: Command Complete (0x0e) plen 4                 #38 [hci1] 1.430497
      LE Set Random Address (0x08|0x0005) ncmd 1
        Status: Success (0x00)
< HCI Command: LE Extended Create... (0x08|0x0043) plen 26  #39 [hci1] 3.680012
        Filter policy: Accept list is not used (0x00)
        Own address type: Random (0x01)
        Peer address type: Public (0x00)
        Peer address: DF:A9:FF:F6:B1:1A (OUI DF-A9-FF)
        Initiating PHYs: 0x01
        Entry 0: LE 1M
          Scan interval: 60.000 msec (0x0060)
          Scan window: 60.000 msec (0x0060)
          Min connection interval: 30.00 msec (0x0018)
          Max connection interval: 50.00 msec (0x0028)
          Connection latency: 0 (0x0000)
          Supervision timeout: 4000 msec (0x0190)
          Min connection length: 0.000 msec (0x0000)
          Max connection length: 0.000 msec (0x0000)
> HCI Event: Command Status (0x0f) plen 4                   #40 [hci1] 3.680953
      LE Extended Create Connection (0x08|0x0043) ncmd 1
        Status: Success (0x00)
> HCI Event: LE Meta Event (0x3e) plen 31                   #41 [hci1] 3.712468
      LE Enhanced Connection Complete (0x0a)
        Status: Success (0x00)
        Handle: 720
        Role: Central (0x00)
        Peer address type: Public (0x00)
        Peer address: DF:A9:FF:F6:B1:1A (OUI DF-A9-FF)
        Local resolvable private address: 00:00:00:00:00:00 (Non-Resolvable)
        Peer resolvable private address: 00:00:00:00:00:00 (Non-Resolvable)
        Connection interval: 50.00 msec (0x0028)
        Connection latency: 0 (0x0000)
        Supervision timeout: 4000 msec (0x0190)
        Central clock accuracy: 0x00
< HCI Command: LE Read Remote Used... (0x08|0x0016) plen 2  #42 [hci1] 3.730203
        Handle: 720 Address: DF:A9:FF:F6:B1:1A (OUI DF-A9-FF)
> HCI Event: Command Status (0x0f) plen 4                   #43 [hci1] 3.730643
      LE Read Remote Used Features (0x08|0x0016) ncmd 1
        Status: Success (0x00)
< HCI Command: LE Set PHY (0x08|0x0032) plen 7              #44 [hci1] 3.750132
        Handle: 720 Address: DF:A9:FF:F6:B1:1A (OUI DF-A9-FF)
        All PHYs preference: 0x00
        TX PHYs preference: 0x02
          LE 2M
        RX PHYs preference: 0x02
          LE 2M
        PHY options preference: Reserved (0x0000)
> HCI Event: Command Status (0x0f) plen 4                   #45 [hci1] 3.750786
      LE Set PHY (0x08|0x0032) ncmd 1
        Status: Success (0x00)
> ACL Data RX: Handle 720 flags 0x02 dlen 6                 #46 [hci1] 3.763872
      SMP: Security Request (0x0b) len 1
        Authentication requirement: No bonding, MITM, SC, No Keypresses (0x0c)
< HCI Command: Host Number of Compl.. (0x03|0x0035) plen 5  #47 [hci1] 3.770246
        Num handles: 1
        Handle: 720 Address: DF:A9:FF:F6:B1:1A (OUI DF-A9-FF)
        Count: 1
< ACL Data TX: Handle 720 flags 0x00 dlen 11                #48 [hci1] 3.770349
      SMP: Pairing Request (0x01) len 6
        IO capability: DisplayOnly (0x00)
        OOB data: Authentication data not present (0x00)
        Authentication requirement: Bonding, No MITM, SC, No Keypresses (0x09)
        Max encryption key size: 16
        Initiator key distribution: EncKey (0x01)
        Responder key distribution: EncKey IdKey (0x03)
> HCI Event: Number of Completed Packets (0x13) plen 5      #49 [hci1] 3.863929
        Num handles: 1
        Handle: 720 Address: DF:A9:FF:F6:B1:1A (OUI DF-A9-FF)
        Count: 1
        #48: len 11 (0 Kb/s)
        Latency: 93 msec (93-93 msec ~93 msec)
> HCI Event: LE Meta Event (0x3e) plen 12                   #50 [hci1] 3.864123
      LE Read Remote Used Features (0x04)
        Status: Success (0x00)
        Handle: 720 Address: DF:A9:FF:F6:B1:1A (OUI DF-A9-FF)
        Features: 0x2d 0x49 0x00 0xf7 0x67 0xd9 0x00 0x80
          LE Encryption
          Extended Reject Indication
          Peripheral-initiated Features Exchange
          LE Data Packet Length Extension
          LE 2M PHY
          LE Coded PHY
          Channel Selection Algorithm #2
          Periodic Advertising Sync Transfer - Sender
          Periodic Advertising Sync Transfer - Recipient
          Sleep Clock Accuracy Updates
          Connected Isochronous Stream - Central
          Connected Isochronous Stream - Peripheral
          Isochronous Broadcaster
          Synchronized Receiver
          Connected Isochronous Stream (Host Support)
          LE Power Control Request
          LE Power Control Request
          Connection Subrating
          Connection Subrating (Host Support)
          Unknown features (0x8000d90000000000)
> ACL Data RX: Handle 720 flags 0x02 dlen 11                #51 [hci1] 3.913985
      SMP: Pairing Response (0x02) len 6
        IO capability: KeyboardDisplay (0x04)
        OOB data: Authentication data not present (0x00)
        Authentication requirement: No bonding, MITM, SC, No Keypresses (0x0c)
        Max encryption key size: 16
        Initiator key distribution: <none> (0x00)
        Responder key distribution: <none> (0x00)
< HCI Command: Host Number of Compl.. (0x03|0x0035) plen 5  #52 [hci1] 3.930113
        Num handles: 1
        Handle: 720 Address: DF:A9:FF:F6:B1:1A (OUI DF-A9-FF)
        Count: 1
< ACL Data TX: Handle 720 flags 0x00 dlen 27                #53 [hci1] 3.930146
< ACL Data TX: Handle 720 flags 0x01 dlen 27                #54 [hci1] 3.930195
< ACL Data TX: Handle 720 flags 0x01 dlen 15                #55 [hci1] 3.930201
      SMP: Pairing Public Key (0x0c) len 64
        X: 98308440221e2d910f0e54b71e7ec652857aa9b5a0dc65028824cc19db1226e9
        Y: 67a4816bcb62efb21701e31fdb27561a6217575fb007a8bbdabe7e28b6f68482
> HCI Event: Number of Completed Packets (0x13) plen 5      #56 [hci1] 3.963932
        Num handles: 1
        Handle: 720 Address: DF:A9:FF:F6:B1:1A (OUI DF-A9-FF)
        Count: 1
        #53: len 27 (6 Kb/s)
        Latency: 33 msec (33-93 msec ~63 msec)
> HCI Event: Number of Completed Packets (0x13) plen 5      #57 [hci1] 4.013974
        Num handles: 1
        Handle: 720 Address: DF:A9:FF:F6:B1:1A (OUI DF-A9-FF)
        Count: 1
        #54: len 27 (2 Kb/s)
        Latency: 83 msec (33-93 msec ~73 msec)
> HCI Event: Number of Completed Packets (0x13) plen 5      #58 [hci1] 4.113982
        Num handles: 1
        Handle: 720 Address: DF:A9:FF:F6:B1:1A (OUI DF-A9-FF)
        Count: 1
        #55: len 15 (0 Kb/s)
        Latency: 183 msec (33-183 msec ~128 msec)
> ACL Data RX: Handle 720 flags 0x02 dlen 27                #59 [hci1] 4.164065
> ACL Data RX: Handle 720 flags 0x01 dlen 27                #60 [hci1] 4.164830
> ACL Data RX: Handle 720 flags 0x01 dlen 15                #61 [hci1] 4.165233
      SMP: Pairing Public Key (0x0c) len 64
        X: b7e554c3f1a55904cdb1ae27437a7a66a6a9717c3f560780d977f90bfdace181
        Y: bcbb40c5d3bc94bebff9833d248bc146384785e3fbb6152affd4dba098f0d6e9
< HCI Command: Host Number of Compl.. (0x03|0x0035) plen 5  #62 [hci1] 4.170708
        Num handles: 1
        Handle: 720 Address: DF:A9:FF:F6:B1:1A (OUI DF-A9-FF)
        Count: 1
< HCI Command: Host Number of Compl.. (0x03|0x0035) plen 5  #63 [hci1] 4.170933
        Num handles: 1
        Handle: 720 Address: DF:A9:FF:F6:B1:1A (OUI DF-A9-FF)
        Count: 1
< HCI Command: Host Number of Compl.. (0x03|0x0035) plen 5  #64 [hci1] 4.171340
        Num handles: 1
        Handle: 720 Address: DF:A9:FF:F6:B1:1A (OUI DF-A9-FF)
        Count: 1
< ACL Data TX: Handle 720 flags 0x00 dlen 21                #65 [hci1] 4.171557
      SMP: Pairing Confirm (0x03) len 16
        Confim value: 768274f14f36ccdd67c4bfa8b8d724c7
> HCI Event: Number of Completed Packets (0x13) plen 5      #66 [hci1] 4.213956
        Num handles: 1
        Handle: 720 Address: DF:A9:FF:F6:B1:1A (OUI DF-A9-FF)
        Count: 1
        #65: len 21 (4 Kb/s)
        Latency: 42 msec (33-183 msec ~85 msec)
> HCI Event: LE Meta Event (0x3e) plen 6                    #67 [hci1] 4.363277
      LE PHY Update Complete (0x0c)
        Status: Success (0x00)
        Handle: 720 Address: DF:A9:FF:F6:B1:1A (OUI DF-A9-FF)
        TX PHY: LE 2M (0x02)
        RX PHY: LE 2M (0x02)
> ACL Data RX: Handle 720 flags 0x02 dlen 21                #68 [hci1] 4.863951
      SMP: Pairing Confirm (0x03) len 16
        Confim value: bb11747ea176044ae7fc0590b4d64d6e
< HCI Command: Host Number of Compl.. (0x03|0x0035) plen 5  #69 [hci1] 4.870225
        Num handles: 1
        Handle: 720 Address: DF:A9:FF:F6:B1:1A (OUI DF-A9-FF)
        Count: 1
< ACL Data TX: Handle 720 flags 0x00 dlen 21                #70 [hci1] 4.870239
      SMP: Pairing Random (0x04) len 16
        Random value: 8e6108f966a694cbe26df70bb96773e6
> HCI Event: Number of Completed Packets (0x13) plen 5      #71 [hci1] 4.913742
        Num handles: 1
        Handle: 720 Address: DF:A9:FF:F6:B1:1A (OUI DF-A9-FF)
        Count: 1
        #70: len 21 (3 Kb/s)
        Latency: 43 msec (33-183 msec ~64 msec)
> ACL Data RX: Handle 720 flags 0x02 dlen 21                #72 [hci1] 5.164026
      SMP: Pairing Random (0x04) len 16
        Random value: 5155f2b333af8ba50d12fe7ec5d9da23
< HCI Command: Host Number of Compl.. (0x03|0x0035) plen 5  #73 [hci1] 5.170756
        Num handles: 1
        Handle: 720 Address: DF:A9:FF:F6:B1:1A (OUI DF-A9-FF)
        Count: 1
< ACL Data TX: Handle 720 flags 0x00 dlen 21                #74 [hci1] 5.170834
      SMP: Pairing Confirm (0x03) len 16
        Confim value: 5705d1ce79a1ab6e2b03eb49e1e83b6c
> HCI Event: Number of Completed Packets (0x13) plen 5      #75 [hci1] 5.213710
        Num handles: 1
        Handle: 720 Address: DF:A9:FF:F6:B1:1A (OUI DF-A9-FF)
        Count: 1
        #74: len 21 (4 Kb/s)
        Latency: 42 msec (33-183 msec ~53 msec)
> ACL Data RX: Handle 720 flags 0x02 dlen 21                #76 [hci1] 5.263902
      SMP: Pairing Confirm (0x03) len 16
        Confim value: 7fa9880b8f87a25f3397e35a7c4ea349
< HCI Command: Host Number of Compl.. (0x03|0x0035) plen 5  #77 [hci1] 5.270540
        Num handles: 1
        Handle: 720 Address: DF:A9:FF:F6:B1:1A (OUI DF-A9-FF)
        Count: 1
< ACL Data TX: Handle 720 flags 0x00 dlen 21                #78 [hci1] 5.270638
      SMP: Pairing Random (0x04) len 16
        Random value: 4d02679f89a05211af56d8b3da64d21e
> HCI Event: Number of Completed Packets (0x13) plen 5      #79 [hci1] 5.313713
        Num handles: 1
        Handle: 720 Address: DF:A9:FF:F6:B1:1A (OUI DF-A9-FF)
        Count: 1
        #78: len 21 (3 Kb/s)
        Latency: 43 msec (33-183 msec ~48 msec)
> ACL Data RX: Handle 720 flags 0x02 dlen 21                #80 [hci1] 5.563998
      SMP: Pairing Random (0x04) len 16
        Random value: bfab21257f1dec7c329ac24edd7354b0
< HCI Command: Host Number of Compl.. (0x03|0x0035) plen 5  #81 [hci1] 5.570191
        Num handles: 1
        Handle: 720 Address: DF:A9:FF:F6:B1:1A (OUI DF-A9-FF)
        Count: 1
< ACL Data TX: Handle 720 flags 0x00 dlen 21                #82 [hci1] 5.570226
      SMP: Pairing Confirm (0x03) len 16
        Confim value: 9bf354253b31c69b5325d46b73dee485
> HCI Event: Number of Completed Packets (0x13) plen 5      #83 [hci1] 5.613860
        Num handles: 1
        Handle: 720 Address: DF:A9:FF:F6:B1:1A (OUI DF-A9-FF)
        Count: 1
        #82: len 21 (3 Kb/s)
        Latency: 43 msec (33-183 msec ~46 msec)
> ACL Data RX: Handle 720 flags 0x02 dlen 21                #84 [hci1] 5.663874
      SMP: Pairing Confirm (0x03) len 16
        Confim value: e6061cfa0f640898e95d29b230bf9df7
< HCI Command: Host Number of Compl.. (0x03|0x0035) plen 5  #85 [hci1] 5.670476
        Num handles: 1
        Handle: 720 Address: DF:A9:FF:F6:B1:1A (OUI DF-A9-FF)
        Count: 1
< ACL Data TX: Handle 720 flags 0x00 dlen 21                #86 [hci1] 5.670567
      SMP: Pairing Random (0x04) len 16
        Random value: 5e8286bc235a02440d0c3424a2acf8fd
> HCI Event: Number of Completed Packets (0x13) plen 5      #87 [hci1] 5.713774
        Num handles: 1
        Handle: 720 Address: DF:A9:FF:F6:B1:1A (OUI DF-A9-FF)
        Count: 1
        #86: len 21 (3 Kb/s)
        Latency: 43 msec (33-183 msec ~44 msec)
> ACL Data RX: Handle 720 flags 0x02 dlen 21                #88 [hci1] 5.963989
      SMP: Pairing Random (0x04) len 16
        Random value: c1c213edbe73dda92b656d0ebfd2f4b0
< HCI Command: Host Number of Compl.. (0x03|0x0035) plen 5  #89 [hci1] 5.970718
        Num handles: 1
        Handle: 720 Address: DF:A9:FF:F6:B1:1A (OUI DF-A9-FF)
        Count: 1
< ACL Data TX: Handle 720 flags 0x00 dlen 21                #90 [hci1] 5.970811
      SMP: Pairing Confirm (0x03) len 16
        Confim value: 33110daf6e8f6a2ace35655e9b03b907
> HCI Event: Number of Completed Packets (0x13) plen 5      #91 [hci1] 6.013899
        Num handles: 1
        Handle: 720 Address: DF:A9:FF:F6:B1:1A (OUI DF-A9-FF)
        Count: 1
        #90: len 21 (3 Kb/s)
        Latency: 43 msec (33-183 msec ~43 msec)
> ACL Data RX: Handle 720 flags 0x02 dlen 21                #92 [hci1] 6.063958
      SMP: Pairing Confirm (0x03) len 16
        Confim value: 4b9086f4d0ed1e4bf66f4193ede3d852
< HCI Command: Host Number of Compl.. (0x03|0x0035) plen 5  #93 [hci1] 6.070229
        Num handles: 1
        Handle: 720 Address: DF:A9:FF:F6:B1:1A (OUI DF-A9-FF)
        Count: 1
< ACL Data TX: Handle 720 flags 0x00 dlen 21                #94 [hci1] 6.070267
      SMP: Pairing Random (0x04) len 16
        Random value: 5c4a1bcadd27bd58e945097b00bad7ac
> HCI Event: Number of Completed Packets (0x13) plen 5      #95 [hci1] 6.113764
        Num handles: 1
        Handle: 720 Address: DF:A9:FF:F6:B1:1A (OUI DF-A9-FF)
        Count: 1
        #94: len 21 (3 Kb/s)
        Latency: 43 msec (33-183 msec ~43 msec)
> ACL Data RX: Handle 720 flags 0x02 dlen 21                #96 [hci1] 6.363902
      SMP: Pairing Random (0x04) len 16
        Random value: 507a9bdbd7ee4c9f07bf1bfa956edfb2
< HCI Command: Host Number of Compl.. (0x03|0x0035) plen 5  #97 [hci1] 6.370723
        Num handles: 1
        Handle: 720 Address: DF:A9:FF:F6:B1:1A (OUI DF-A9-FF)
        Count: 1
< ACL Data TX: Handle 720 flags 0x00 dlen 21                #98 [hci1] 6.370841
      SMP: Pairing Confirm (0x03) len 16
        Confim value: bc357bf57525e8d4adc547ec7ae10e2c
> HCI Event: Number of Completed Packets (0x13) plen 5      #99 [hci1] 6.413738
        Num handles: 1
        Handle: 720 Address: DF:A9:FF:F6:B1:1A (OUI DF-A9-FF)
        Count: 1
        #98: len 21 (4 Kb/s)
        Latency: 42 msec (33-183 msec ~43 msec)
> ACL Data RX: Handle 720 flags 0x02 dlen 21               #100 [hci1] 6.463892
      SMP: Pairing Confirm (0x03) len 16
        Confim value: 9b71824cd219c39dce526624e96e2bfa
< HCI Command: Host Number of Comp.. (0x03|0x0035) plen 5  #101 [hci1] 6.470308
        Num handles: 1
        Handle: 720 Address: DF:A9:FF:F6:B1:1A (OUI DF-A9-FF)
        Count: 1
< ACL Data TX: Handle 720 flags 0x00 dlen 21               #102 [hci1] 6.470412
      SMP: Pairing Random (0x04) len 16
        Random value: 32527e6e64e79f33b2e374394db8ab2d
> HCI Event: Number of Completed Packets (0x13) plen 5     #103 [hci1] 6.513733
        Num handles: 1
        Handle: 720 Address: DF:A9:FF:F6:B1:1A (OUI DF-A9-FF)
        Count: 1
        #102: len 21 (3 Kb/s)
        Latency: 43 msec (33-183 msec ~43 msec)
> ACL Data RX: Handle 720 flags 0x02 dlen 21               #104 [hci1] 6.764095
      SMP: Pairing Random (0x04) len 16
        Random value: f71d8618fd9bdd87fc3351c585e76728
< HCI Command: Host Number of Comp.. (0x03|0x0035) plen 5  #105 [hci1] 6.770583
        Num handles: 1
        Handle: 720 Address: DF:A9:FF:F6:B1:1A (OUI DF-A9-FF)
        Count: 1
< ACL Data TX: Handle 720 flags 0x00 dlen 21               #106 [hci1] 6.770681
      SMP: Pairing Confirm (0x03) len 16
        Confim value: e3b58e9c5f326e3131ad64798df6687c
> HCI Event: Number of Completed Packets (0x13) plen 5     #107 [hci1] 6.813702
        Num handles: 1
        Handle: 720 Address: DF:A9:FF:F6:B1:1A (OUI DF-A9-FF)
        Count: 1
        #106: len 21 (3 Kb/s)
        Latency: 43 msec (33-183 msec ~43 msec)
> ACL Data RX: Handle 720 flags 0x02 dlen 21               #108 [hci1] 6.863872
      SMP: Pairing Confirm (0x03) len 16
        Confim value: bb49c31d10bb07e316a23e059ccf1443
< HCI Command: Host Number of Comp.. (0x03|0x0035) plen 5  #109 [hci1] 6.870218
        Num handles: 1
        Handle: 720 Address: DF:A9:FF:F6:B1:1A (OUI DF-A9-FF)
        Count: 1
< ACL Data TX: Handle 720 flags 0x00 dlen 21               #110 [hci1] 6.870287
      SMP: Pairing Random (0x04) len 16
        Random value: dddbdfe2838e9a8cc6964353c850fef7
> HCI Event: Number of Completed Packets (0x13) plen 5     #111 [hci1] 6.913694
        Num handles: 1
        Handle: 720 Address: DF:A9:FF:F6:B1:1A (OUI DF-A9-FF)
        Count: 1
        #110: len 21 (3 Kb/s)
        Latency: 43 msec (33-183 msec ~43 msec)
> ACL Data RX: Handle 720 flags 0x02 dlen 21               #112 [hci1] 7.163786
      SMP: Pairing Random (0x04) len 16
        Random value: c8b0acf751ee6d0ca35956bd8f989b0a
< HCI Command: Host Number of Comp.. (0x03|0x0035) plen 5  #113 [hci1] 7.170714
        Num handles: 1
        Handle: 720 Address: DF:A9:FF:F6:B1:1A (OUI DF-A9-FF)
        Count: 1
< ACL Data TX: Handle 720 flags 0x00 dlen 21               #114 [hci1] 7.170793
      SMP: Pairing Confirm (0x03) len 16
        Confim value: cc2322c064721e490f110e04e5ede260
> HCI Event: Number of Completed Packets (0x13) plen 5     #115 [hci1] 7.213619
        Num handles: 1
        Handle: 720 Address: DF:A9:FF:F6:B1:1A (OUI DF-A9-FF)
        Count: 1
        #114: len 21 (4 Kb/s)
        Latency: 42 msec (33-183 msec ~43 msec)
> ACL Data RX: Handle 720 flags 0x02 dlen 21               #116 [hci1] 7.263957
      SMP: Pairing Confirm (0x03) len 16
        Confim value: c4de332dad9a08a286fd4c59d1c40a15
< HCI Command: Host Number of Comp.. (0x03|0x0035) plen 5  #117 [hci1] 7.270590
        Num handles: 1
        Handle: 720 Address: DF:A9:FF:F6:B1:1A (OUI DF-A9-FF)
        Count: 1
< ACL Data TX: Handle 720 flags 0x00 dlen 21               #118 [hci1] 7.270758
      SMP: Pairing Random (0x04) len 16
        Random value: eb9f1915536596b6fc3db1c86b2b1970
> HCI Event: Number of Completed Packets (0x13) plen 5     #119 [hci1] 7.313751
        Num handles: 1
        Handle: 720 Address: DF:A9:FF:F6:B1:1A (OUI DF-A9-FF)
        Count: 1
        #118: len 21 (4 Kb/s)
        Latency: 42 msec (33-183 msec ~43 msec)
> ACL Data RX: Handle 720 flags 0x02 dlen 21               #120 [hci1] 7.563826
      SMP: Pairing Random (0x04) len 16
        Random value: b6799281b5471365fcff5fc85a9b7d51
< HCI Command: Host Number of Comp.. (0x03|0x0035) plen 5  #121 [hci1] 7.570232
        Num handles: 1
        Handle: 720 Address: DF:A9:FF:F6:B1:1A (OUI DF-A9-FF)
        Count: 1
< ACL Data TX: Handle 720 flags 0x00 dlen 21               #122 [hci1] 7.570267
      SMP: Pairing Confirm (0x03) len 16
        Confim value: 2bbe2f1de0ff4f59d23927576a5e416b
> HCI Event: Number of Completed Packets (0x13) plen 5     #123 [hci1] 7.613764
        Num handles: 1
        Handle: 720 Address: DF:A9:FF:F6:B1:1A (OUI DF-A9-FF)
        Count: 1
        #122: len 21 (3 Kb/s)
        Latency: 43 msec (33-183 msec ~43 msec)
> ACL Data RX: Handle 720 flags 0x02 dlen 21               #124 [hci1] 7.663822
      SMP: Pairing Confirm (0x03) len 16
        Confim value: 41b293cced86cca732dc3710cd3552ef
< HCI Command: Host Number of Comp.. (0x03|0x0035) plen 5  #125 [hci1] 7.670457
        Num handles: 1
        Handle: 720 Address: DF:A9:FF:F6:B1:1A (OUI DF-A9-FF)
        Count: 1
< ACL Data TX: Handle 720 flags 0x00 dlen 21               #126 [hci1] 7.670663
      SMP: Pairing Random (0x04) len 16
        Random value: 5c794dc9ad9f2c3f295ebd5ad5e1c3cf
> HCI Event: Number of Completed Packets (0x13) plen 5     #127 [hci1] 7.713729
        Num handles: 1
        Handle: 720 Address: DF:A9:FF:F6:B1:1A (OUI DF-A9-FF)
        Count: 1
        #126: len 21 (3 Kb/s)
        Latency: 43 msec (33-183 msec ~43 msec)
> ACL Data RX: Handle 720 flags 0x02 dlen 21               #128 [hci1] 7.963866
      SMP: Pairing Random (0x04) len 16
        Random value: 6d92c0a90ff5195db1e4a84c76f776c8
< HCI Command: Host Number of Comp.. (0x03|0x0035) plen 5  #129 [hci1] 7.970721
        Num handles: 1
        Handle: 720 Address: DF:A9:FF:F6:B1:1A (OUI DF-A9-FF)
        Count: 1
< ACL Data TX: Handle 720 flags 0x00 dlen 21               #130 [hci1] 7.970851
      SMP: Pairing Confirm (0x03) len 16
        Confim value: 13e76366bbc31579548792bbf3c6aed1
> HCI Event: Number of Completed Packets (0x13) plen 5     #131 [hci1] 8.013628
        Num handles: 1
        Handle: 720 Address: DF:A9:FF:F6:B1:1A (OUI DF-A9-FF)
        Count: 1
        #130: len 21 (4 Kb/s)
        Latency: 42 msec (33-183 msec ~42 msec)
> ACL Data RX: Handle 720 flags 0x02 dlen 21               #132 [hci1] 8.063782
      SMP: Pairing Confirm (0x03) len 16
        Confim value: c775f6ec3db8a2b8940638a51c04168c
< HCI Command: Host Number of Comp.. (0x03|0x0035) plen 5  #133 [hci1] 8.070142
        Num handles: 1
        Handle: 720 Address: DF:A9:FF:F6:B1:1A (OUI DF-A9-FF)
        Count: 1
< ACL Data TX: Handle 720 flags 0x00 dlen 21               #134 [hci1] 8.070202
      SMP: Pairing Random (0x04) len 16
        Random value: 5c2fff312cdf99c9491988e877355a9a
> HCI Event: Number of Completed Packets (0x13) plen 5     #135 [hci1] 8.113669
        Num handles: 1
        Handle: 720 Address: DF:A9:FF:F6:B1:1A (OUI DF-A9-FF)
        Count: 1
        #134: len 21 (3 Kb/s)
        Latency: 43 msec (33-183 msec ~43 msec)
> ACL Data RX: Handle 720 flags 0x02 dlen 21               #136 [hci1] 8.363775
      SMP: Pairing Random (0x04) len 16
        Random value: 3b4265a58e2bb1edcf896fc92a256c1b
< HCI Command: Host Number of Comp.. (0x03|0x0035) plen 5  #137 [hci1] 8.370784
        Num handles: 1
        Handle: 720 Address: DF:A9:FF:F6:B1:1A (OUI DF-A9-FF)
        Count: 1
< ACL Data TX: Handle 720 flags 0x00 dlen 21               #138 [hci1] 8.370893
      SMP: Pairing Confirm (0x03) len 16
        Confim value: f62358b90689a3e9ec94ae49a4b644c2
> HCI Event: Number of Completed Packets (0x13) plen 5     #139 [hci1] 8.413646
        Num handles: 1
        Handle: 720 Address: DF:A9:FF:F6:B1:1A (OUI DF-A9-FF)
        Count: 1
        #138: len 21 (4 Kb/s)
        Latency: 42 msec (33-183 msec ~42 msec)
> ACL Data RX: Handle 720 flags 0x02 dlen 21               #140 [hci1] 8.463958
      SMP: Pairing Confirm (0x03) len 16
        Confim value: e9798866fef9a6d0ca08452ff08447bd
< HCI Command: Host Number of Comp.. (0x03|0x0035) plen 5  #141 [hci1] 8.470328
        Num handles: 1
        Handle: 720 Address: DF:A9:FF:F6:B1:1A (OUI DF-A9-FF)
        Count: 1
< ACL Data TX: Handle 720 flags 0x00 dlen 21               #142 [hci1] 8.470460
      SMP: Pairing Random (0x04) len 16
        Random value: c629a3a987d808e808655d558dfc1155
> HCI Event: Number of Completed Packets (0x13) plen 5     #143 [hci1] 8.513674
        Num handles: 1
        Handle: 720 Address: DF:A9:FF:F6:B1:1A (OUI DF-A9-FF)
        Count: 1
        #142: len 21 (3 Kb/s)
        Latency: 43 msec (33-183 msec ~43 msec)
> ACL Data RX: Handle 720 flags 0x02 dlen 21               #144 [hci1] 8.763931
      SMP: Pairing Random (0x04) len 16
        Random value: ffe7326b5188619e0cbef93dfe67741c
< HCI Command: Host Number of Comp.. (0x03|0x0035) plen 5  #145 [hci1] 8.770226
        Num handles: 1
        Handle: 720 Address: DF:A9:FF:F6:B1:1A (OUI DF-A9-FF)
        Count: 1
< ACL Data TX: Handle 720 flags 0x00 dlen 21               #146 [hci1] 8.770318
      SMP: Pairing Confirm (0x03) len 16
        Confim value: c3f125e485ac8ff575e450f8d90438a3
> HCI Event: Number of Completed Packets (0x13) plen 5     #147 [hci1] 8.813692
        Num handles: 1
        Handle: 720 Address: DF:A9:FF:F6:B1:1A (OUI DF-A9-FF)
        Count: 1
        #146: len 21 (3 Kb/s)
        Latency: 43 msec (33-183 msec ~43 msec)
> ACL Data RX: Handle 720 flags 0x02 dlen 21               #148 [hci1] 8.863877
      SMP: Pairing Confirm (0x03) len 16
        Confim value: 4825f4e25a2af4305e154796e85bad4e
< HCI Command: Host Number of Comp.. (0x03|0x0035) plen 5  #149 [hci1] 8.870649
        Num handles: 1
        Handle: 720 Address: DF:A9:FF:F6:B1:1A (OUI DF-A9-FF)
        Count: 1
< ACL Data TX: Handle 720 flags 0x00 dlen 21               #150 [hci1] 8.870758
      SMP: Pairing Random (0x04) len 16
        Random value: 92f20f6ad8f13724432c7fd6001c45ff
> HCI Event: Number of Completed Packets (0x13) plen 5     #151 [hci1] 8.913635
        Num handles: 1
        Handle: 720 Address: DF:A9:FF:F6:B1:1A (OUI DF-A9-FF)
        Count: 1
        #150: len 21 (4 Kb/s)
        Latency: 42 msec (33-183 msec ~43 msec)
> ACL Data RX: Handle 720 flags 0x02 dlen 21               #152 [hci1] 9.163893
      SMP: Pairing Random (0x04) len 16
        Random value: 7a2dd3c987a34b810d1bd59a9874d23f
< HCI Command: Host Number of Comp.. (0x03|0x0035) plen 5  #153 [hci1] 9.170773
        Num handles: 1
        Handle: 720 Address: DF:A9:FF:F6:B1:1A (OUI DF-A9-FF)
        Count: 1
< ACL Data TX: Handle 720 flags 0x00 dlen 21               #154 [hci1] 9.170826
      SMP: Pairing Confirm (0x03) len 16
        Confim value: 1c9c8753a8ea40942dd1ce57e69951b5
> HCI Event: Number of Completed Packets (0x13) plen 5     #155 [hci1] 9.213702
        Num handles: 1
        Handle: 720 Address: DF:A9:FF:F6:B1:1A (OUI DF-A9-FF)
        Count: 1
        #154: len 21 (4 Kb/s)
        Latency: 42 msec (33-183 msec ~42 msec)
> ACL Data RX: Handle 720 flags 0x02 dlen 21               #156 [hci1] 9.263776
      SMP: Pairing Confirm (0x03) len 16
        Confim value: f6a6ebb817d31e2cd1b50231b89edff6
< HCI Command: Host Number of Comp.. (0x03|0x0035) plen 5  #157 [hci1] 9.270247
        Num handles: 1
        Handle: 720 Address: DF:A9:FF:F6:B1:1A (OUI DF-A9-FF)
        Count: 1
< ACL Data TX: Handle 720 flags 0x00 dlen 21               #158 [hci1] 9.270253
      SMP: Pairing Random (0x04) len 16
        Random value: 23ac32ebbb5e14c8a6b9622f296d277f
> HCI Event: Number of Completed Packets (0x13) plen 5     #159 [hci1] 9.313616
        Num handles: 1
        Handle: 720 Address: DF:A9:FF:F6:B1:1A (OUI DF-A9-FF)
        Count: 1
        #158: len 21 (3 Kb/s)
        Latency: 43 msec (33-183 msec ~43 msec)
> ACL Data RX: Handle 720 flags 0x02 dlen 21               #160 [hci1] 9.513907
      SMP: Pairing Random (0x04) len 16
        Random value: aad31a47176420b418a19f872201994f
< HCI Command: Host Number of Comp.. (0x03|0x0035) plen 5  #161 [hci1] 9.530326
        Num handles: 1
        Handle: 720 Address: DF:A9:FF:F6:B1:1A (OUI DF-A9-FF)
        Count: 1
< ACL Data TX: Handle 720 flags 0x00 dlen 21               #162 [hci1] 9.530370
      SMP: Pairing Confirm (0x03) len 16
        Confim value: 7bd61dbca2671d82715a8d6b05cf8ccd
> HCI Event: Number of Completed Packets (0x13) plen 5     #163 [hci1] 9.563679
        Num handles: 1
        Handle: 720 Address: DF:A9:FF:F6:B1:1A (OUI DF-A9-FF)
        Count: 1
        #162: len 21 (5 Kb/s)
        Latency: 33 msec (33-183 msec ~38 msec)
> ACL Data RX: Handle 720 flags 0x02 dlen 21               #164 [hci1] 9.613897
      SMP: Pairing Confirm (0x03) len 16
        Confim value: 9477925aca5037e5d676c9cfceeb9e6c
< HCI Command: Host Number of Comp.. (0x03|0x0035) plen 5  #165 [hci1] 9.630690
        Num handles: 1
        Handle: 720 Address: DF:A9:FF:F6:B1:1A (OUI DF-A9-FF)
        Count: 1
< ACL Data TX: Handle 720 flags 0x00 dlen 21               #166 [hci1] 9.630878
      SMP: Pairing Random (0x04) len 16
        Random value: 297efe85e67448a15f56bd27e3a3cf1d
> HCI Event: Number of Completed Packets (0x13) plen 5     #167 [hci1] 9.663721
        Num handles: 1
        Handle: 720 Address: DF:A9:FF:F6:B1:1A (OUI DF-A9-FF)
        Count: 1
        #166: len 21 (5 Kb/s)
        Latency: 32 msec (32-183 msec ~35 msec)
> ACL Data RX: Handle 720 flags 0x02 dlen 21               #168 [hci1] 9.913774
      SMP: Pairing Random (0x04) len 16
        Random value: 90963474ef463f487ed7d931891890c1
< HCI Command: Host Number of Comp.. (0x03|0x0035) plen 5  #169 [hci1] 9.930749
        Num handles: 1
        Handle: 720 Address: DF:A9:FF:F6:B1:1A (OUI DF-A9-FF)
        Count: 1
< ACL Data TX: Handle 720 flags 0x00 dlen 21               #170 [hci1] 9.930883
      SMP: Pairing Confirm (0x03) len 16
        Confim value: f360bde6e3b63ad21c7c8324d72f60f6
> HCI Event: Number of Completed Packets (0x13) plen 5     #171 [hci1] 9.963643
        Num handles: 1
        Handle: 720 Address: DF:A9:FF:F6:B1:1A (OUI DF-A9-FF)
        Count: 1
        #170: len 21 (5 Kb/s)
        Latency: 32 msec (32-183 msec ~34 msec)
> ACL Data RX: Handle 720 flags 0x02 dlen 21              #172 [hci1] 10.013885
      SMP: Pairing Confirm (0x03) len 16
        Confim value: ce299e7b0404593fe200fa800ce613b7
< HCI Command: Host Number of Com.. (0x03|0x0035) plen 5  #173 [hci1] 10.030322
        Num handles: 1
        Handle: 720 Address: DF:A9:FF:F6:B1:1A (OUI DF-A9-FF)
        Count: 1
< ACL Data TX: Handle 720 flags 0x00 dlen 21              #174 [hci1] 10.030436
      SMP: Pairing Random (0x04) len 16
        Random value: 25a9493fd3ce4faf02be7293595bb7c6
> HCI Event: Number of Completed Packets (0x13) plen 5    #175 [hci1] 10.063559
        Num handles: 1
        Handle: 720 Address: DF:A9:FF:F6:B1:1A (OUI DF-A9-FF)
        Count: 1
        #174: len 21 (5 Kb/s)
        Latency: 33 msec (32-183 msec ~33 msec)
> ACL Data RX: Handle 720 flags 0x02 dlen 21              #176 [hci1] 10.313836
      SMP: Pairing Random (0x04) len 16
        Random value: 9ff18519778a3a3365fd43b57d711d66
< HCI Command: Host Number of Com.. (0x03|0x0035) plen 5  #177 [hci1] 10.330699
        Num handles: 1
        Handle: 720 Address: DF:A9:FF:F6:B1:1A (OUI DF-A9-FF)
        Count: 1
< ACL Data TX: Handle 720 flags 0x00 dlen 21              #178 [hci1] 10.330859
      SMP: Pairing Confirm (0x03) len 16
        Confim value: 0fcbb0f6c9ccf6e0ef55cf9265105a4b
> HCI Event: Number of Completed Packets (0x13) plen 5    #179 [hci1] 10.363553
        Num handles: 1
        Handle: 720 Address: DF:A9:FF:F6:B1:1A (OUI DF-A9-FF)
        Count: 1
        #178: len 21 (5 Kb/s)
        Latency: 32 msec (32-183 msec ~33 msec)
> ACL Data RX: Handle 720 flags 0x02 dlen 21              #180 [hci1] 10.413800
      SMP: Pairing Confirm (0x03) len 16
        Confim value: 249bda3b89729495e2e5c5a5183cf612
< HCI Command: Host Number of Com.. (0x03|0x0035) plen 5  #181 [hci1] 10.430506
        Num handles: 1
        Handle: 720 Address: DF:A9:FF:F6:B1:1A (OUI DF-A9-FF)
        Count: 1
< ACL Data TX: Handle 720 flags 0x00 dlen 21              #182 [hci1] 10.430589
      SMP: Pairing Random (0x04) len 16
        Random value: 58f6b41f855a6f6c3560debd84e2affc
> HCI Event: Number of Completed Packets (0x13) plen 5    #183 [hci1] 10.463661
        Num handles: 1
        Handle: 720 Address: DF:A9:FF:F6:B1:1A (OUI DF-A9-FF)
        Count: 1
        #182: len 21 (5 Kb/s)
        Latency: 33 msec (32-183 msec ~33 msec)
> ACL Data RX: Handle 720 flags 0x02 dlen 21              #184 [hci1] 10.713783
      SMP: Pairing Random (0x04) len 16
        Random value: a411afcaddb55a3c724191e374c58349
< HCI Command: Host Number of Com.. (0x03|0x0035) plen 5  #185 [hci1] 10.730620
        Num handles: 1
        Handle: 720 Address: DF:A9:FF:F6:B1:1A (OUI DF-A9-FF)
        Count: 1
< ACL Data TX: Handle 720 flags 0x00 dlen 21              #186 [hci1] 10.730768
      SMP: Pairing Confirm (0x03) len 16
        Confim value: 9c3695f7afb9288f50f35098c8c8bdbd
> HCI Event: Number of Completed Packets (0x13) plen 5    #187 [hci1] 10.763660
        Num handles: 1
        Handle: 720 Address: DF:A9:FF:F6:B1:1A (OUI DF-A9-FF)
        Count: 1
        #186: len 21 (5 Kb/s)
        Latency: 32 msec (32-183 msec ~33 msec)
> ACL Data RX: Handle 720 flags 0x02 dlen 21              #188 [hci1] 10.813737
      SMP: Pairing Confirm (0x03) len 16
        Confim value: 12bbc831f5f17358d42ad4f9f010c39a
< HCI Command: Host Number of Com.. (0x03|0x0035) plen 5  #189 [hci1] 10.830666
        Num handles: 1
        Handle: 720 Address: DF:A9:FF:F6:B1:1A (OUI DF-A9-FF)
        Count: 1
< ACL Data TX: Handle 720 flags 0x00 dlen 21              #190 [hci1] 10.830778
      SMP: Pairing Random (0x04) len 16
        Random value: b67e7216d5bf664139eda2b542549666
> HCI Event: Number of Completed Packets (0x13) plen 5    #191 [hci1] 10.863653
        Num handles: 1
        Handle: 720 Address: DF:A9:FF:F6:B1:1A (OUI DF-A9-FF)
        Count: 1
        #190: len 21 (5 Kb/s)
        Latency: 32 msec (32-183 msec ~32 msec)
> ACL Data RX: Handle 720 flags 0x02 dlen 21              #192 [hci1] 11.113799
      SMP: Pairing Random (0x04) len 16
        Random value: f31939e36d4e1da1cc17b49c825af137
< HCI Command: Host Number of Com.. (0x03|0x0035) plen 5  #193 [hci1] 11.130195
        Num handles: 1
        Handle: 720 Address: DF:A9:FF:F6:B1:1A (OUI DF-A9-FF)
        Count: 1
< ACL Data TX: Handle 720 flags 0x00 dlen 21              #194 [hci1] 11.130215
      SMP: Pairing Confirm (0x03) len 16
        Confim value: 923b3f9ac31b16116c9c20a785dd5ae0
> HCI Event: Number of Completed Packets (0x13) plen 5    #195 [hci1] 11.163661
        Num handles: 1
        Handle: 720 Address: DF:A9:FF:F6:B1:1A (OUI DF-A9-FF)
        Count: 1
        #194: len 21 (5 Kb/s)
        Latency: 33 msec (32-183 msec ~33 msec)
> ACL Data RX: Handle 720 flags 0x02 dlen 21              #196 [hci1] 11.213859
      SMP: Pairing Confirm (0x03) len 16
        Confim value: e940bdbc9772e185f6fa0a603a70f200
< HCI Command: Host Number of Com.. (0x03|0x0035) plen 5  #197 [hci1] 11.230200
        Num handles: 1
        Handle: 720 Address: DF:A9:FF:F6:B1:1A (OUI DF-A9-FF)
        Count: 1
< ACL Data TX: Handle 720 flags 0x00 dlen 21              #198 [hci1] 11.230247
      SMP: Pairing Random (0x04) len 16
        Random value: ed17f76500c95219dd01e09d1e63f87b
> HCI Event: Number of Completed Packets (0x13) plen 5    #199 [hci1] 11.263603
        Num handles: 1
        Handle: 720 Address: DF:A9:FF:F6:B1:1A (OUI DF-A9-FF)
        Count: 1
        #198: len 21 (5 Kb/s)
        Latency: 33 msec (32-183 msec ~33 msec)
> ACL Data RX: Handle 720 flags 0x02 dlen 21              #200 [hci1] 11.513762
      SMP: Pairing Random (0x04) len 16
        Random value: d664f0adb272cd9f67b42a4d98316518
< HCI Command: Host Number of Com.. (0x03|0x0035) plen 5  #201 [hci1] 11.530749
        Num handles: 1
        Handle: 720 Address: DF:A9:FF:F6:B1:1A (OUI DF-A9-FF)
        Count: 1
< ACL Data TX: Handle 720 flags 0x00 dlen 21              #202 [hci1] 11.530856
      SMP: Pairing Confirm (0x03) len 16
        Confim value: d7a9394123c0f79652ae9374cf48ffe8
> HCI Event: Number of Completed Packets (0x13) plen 5    #203 [hci1] 11.563565
        Num handles: 1
        Handle: 720 Address: DF:A9:FF:F6:B1:1A (OUI DF-A9-FF)
        Count: 1
        #202: len 21 (5 Kb/s)
        Latency: 32 msec (32-183 msec ~32 msec)
> ACL Data RX: Handle 720 flags 0x02 dlen 21              #204 [hci1] 11.613872
      SMP: Pairing Confirm (0x03) len 16
        Confim value: e32c0eb2486365d0243ba335aa6287f2
< HCI Command: Host Number of Com.. (0x03|0x0035) plen 5  #205 [hci1] 11.630294
        Num handles: 1
        Handle: 720 Address: DF:A9:FF:F6:B1:1A (OUI DF-A9-FF)
        Count: 1
< ACL Data TX: Handle 720 flags 0x00 dlen 21              #206 [hci1] 11.630328
      SMP: Pairing Random (0x04) len 16
        Random value: 81d35d47e1f6006d79c974bd9d9e1ee3
> HCI Event: Number of Completed Packets (0x13) plen 5    #207 [hci1] 11.663649
        Num handles: 1
        Handle: 720 Address: DF:A9:FF:F6:B1:1A (OUI DF-A9-FF)
        Count: 1
        #206: len 21 (5 Kb/s)
        Latency: 33 msec (32-183 msec ~33 msec)
> ACL Data RX: Handle 720 flags 0x02 dlen 21              #208 [hci1] 11.913809
      SMP: Pairing Random (0x04) len 16
        Random value: b161a47f239f03093051ef1ea31f5c45
< HCI Command: Host Number of Com.. (0x03|0x0035) plen 5  #209 [hci1] 11.930714
        Num handles: 1
        Handle: 720 Address: DF:A9:FF:F6:B1:1A (OUI DF-A9-FF)
        Count: 1
< ACL Data TX: Handle 720 flags 0x00 dlen 21              #210 [hci1] 11.930872
      SMP: Pairing Confirm (0x03) len 16
        Confim value: edeb269a10968cb5c5cb2a7647d4dc82
> HCI Event: Number of Completed Packets (0x13) plen 5    #211 [hci1] 11.963622
        Num handles: 1
        Handle: 720 Address: DF:A9:FF:F6:B1:1A (OUI DF-A9-FF)
        Count: 1
        #210: len 21 (5 Kb/s)
        Latency: 32 msec (32-183 msec ~32 msec)
> ACL Data RX: Handle 720 flags 0x02 dlen 21              #212 [hci1] 12.013860
      SMP: Pairing Confirm (0x03) len 16
        Confim value: 1c05c28ffea8c96222a3477f2dc08682
< HCI Command: Host Number of Com.. (0x03|0x0035) plen 5  #213 [hci1] 12.030659
        Num handles: 1
        Handle: 720 Address: DF:A9:FF:F6:B1:1A (OUI DF-A9-FF)
        Count: 1
< ACL Data TX: Handle 720 flags 0x00 dlen 21              #214 [hci1] 12.030738
      SMP: Pairing Random (0x04) len 16
        Random value: e7f7e0c2476823e41736a7e381bafb7c
> HCI Event: Number of Completed Packets (0x13) plen 5    #215 [hci1] 12.063695
        Num handles: 1
        Handle: 720 Address: DF:A9:FF:F6:B1:1A (OUI DF-A9-FF)
        Count: 1
        #214: len 21 (5 Kb/s)
        Latency: 32 msec (32-183 msec ~32 msec)
> ACL Data RX: Handle 720 flags 0x02 dlen 21              #216 [hci1] 12.313826
      SMP: Pairing Random (0x04) len 16
        Random value: 3ad637c3108f6fb57ee6e392cb2b560c
< HCI Command: Host Number of Com.. (0x03|0x0035) plen 5  #217 [hci1] 12.330777
        Num handles: 1
        Handle: 720 Address: DF:A9:FF:F6:B1:1A (OUI DF-A9-FF)
        Count: 1
< ACL Data TX: Handle 720 flags 0x00 dlen 21              #218 [hci1] 12.330888
      SMP: Pairing Confirm (0x03) len 16
        Confim value: 9d9d5c4432801832453a9d0a9c9b8ddb
> HCI Event: Number of Completed Packets (0x13) plen 5    #219 [hci1] 12.363672
        Num handles: 1
        Handle: 720 Address: DF:A9:FF:F6:B1:1A (OUI DF-A9-FF)
        Count: 1
        #218: len 21 (5 Kb/s)
        Latency: 32 msec (32-183 msec ~32 msec)
> ACL Data RX: Handle 720 flags 0x02 dlen 21              #220 [hci1] 12.413763
      SMP: Pairing Confirm (0x03) len 16
        Confim value: 7205049088841e24b7af7aa311031954
< HCI Command: Host Number of Com.. (0x03|0x0035) plen 5  #221 [hci1] 12.430536
        Num handles: 1
        Handle: 720 Address: DF:A9:FF:F6:B1:1A (OUI DF-A9-FF)
        Count: 1
< ACL Data TX: Handle 720 flags 0x00 dlen 21              #222 [hci1] 12.430644
      SMP: Pairing Random (0x04) len 16
        Random value: fc8b40d9b0b09bc4296bf8753a8f6e1f
> HCI Event: Number of Completed Packets (0x13) plen 5    #223 [hci1] 12.463614
        Num handles: 1
        Handle: 720 Address: DF:A9:FF:F6:B1:1A (OUI DF-A9-FF)
        Count: 1
        #222: len 21 (5 Kb/s)
        Latency: 32 msec (32-183 msec ~32 msec)
> ACL Data RX: Handle 720 flags 0x02 dlen 21              #224 [hci1] 12.713841
      SMP: Pairing Random (0x04) len 16
        Random value: b8d24a57c51864dbfb56351111605336
< HCI Command: Host Number of Com.. (0x03|0x0035) plen 5  #225 [hci1] 12.731059
        Num handles: 1
        Handle: 720 Address: DF:A9:FF:F6:B1:1A (OUI DF-A9-FF)
        Count: 1
< ACL Data TX: Handle 720 flags 0x00 dlen 21              #226 [hci1] 12.731160
      SMP: Pairing DHKey Check (0x0d) len 16
        E: 1fdc333befb63d17e9b7b3f20334af56
> HCI Event: Number of Completed Packets (0x13) plen 5    #227 [hci1] 12.763560
        Num handles: 1
        Handle: 720 Address: DF:A9:FF:F6:B1:1A (OUI DF-A9-FF)
        Count: 1
        #226: len 21 (5 Kb/s)
        Latency: 32 msec (32-183 msec ~32 msec)
> ACL Data RX: Handle 720 flags 0x02 dlen 21              #228 [hci1] 12.813774
      SMP: Pairing DHKey Check (0x0d) len 16
        E: 7ae6fb5aea36bb610d0cace89095f1f5
< HCI Command: LE Start Encryption (0x08|0x0019) plen 28  #229 [hci1] 12.830888
        Handle: 720 Address: DF:A9:FF:F6:B1:1A (OUI DF-A9-FF)
        Random number: 0x0000000000000000
        Encrypted diversifier: 0x0000
        Long term key: 88a68cafaa8b32d0c6581c963772c354
> HCI Event: Command Status (0x0f) plen 4                 #230 [hci1] 12.831817
      LE Start Encryption (0x08|0x0019) ncmd 1
        Status: Success (0x00)
< HCI Command: Host Number of Com.. (0x03|0x0035) plen 5  #231 [hci1] 12.850346
        Num handles: 1
        Handle: 720 Address: DF:A9:FF:F6:B1:1A (OUI DF-A9-FF)
        Count: 1
> HCI Event: Encryption Change (0x08) plen 4              #232 [hci1] 13.163538
        Status: Success (0x00)
        Handle: 720 Address: DF:A9:FF:F6:B1:1A (OUI DF-A9-FF)
        Encryption: Enabled with AES-CCM (0x01)
< HCI Command: Disconnect (0x01|0x0006) plen 3            #233 [hci1] 13.830183
        Handle: 720 Address: DF:A9:FF:F6:B1:1A (OUI DF-A9-FF)
        Reason: Remote User Terminated Connection (0x13)
> HCI Event: Command Status (0x0f) plen 4                 #234 [hci1] 13.830653
      Disconnect (0x01|0x0006) ncmd 1
        Status: Success (0x00)
> HCI Event: Disconnect Complete (0x05) plen 4            #235 [hci1] 13.913517
        Status: Success (0x00)
        Handle: 720 Address: DF:A9:FF:F6:B1:1A (OUI DF-A9-FF)
        Reason: Connection Terminated By Local Host (0x16)
< HCI Command: Reset (0x03|0x0003) plen 0                 #236 [hci1] 19.670217
> HCI Event: Command Complete (0x0e) plen 4               #237 [hci1] 19.670704
      Reset (0x03|0x0003) ncmd 1
        Status: Success (0x00)
@ USER Close: main                                    {0x0001} [hci1] 19.690136
= Close Index: 00:00:00:00:00:00                               [hci1] 19.690144
