Bluetooth monitor ver 5.72
btmon[1628522]: = Note: Linux version 6.14.0-36-generic (x86_64)                                                         0.161403
btmon[1628522]: = Note: Bluetooth subsystem version 2.22                                                                 0.161405
= New Index: 00:00:00:00:00:00 (Primary,UART,hci1)                                                                       0.161406
= New Index: 48:5F:99:8E:E0:64 (Primary,USB,hci0)                                                                        0.161407
= Open Index: 00:00:00:00:00:00                                                                                          0.675049
= Index Info: 00:00:00:00:00:00 (Nordic Semiconductor ASA)                                                               0.675069
zephyr.exe[1628524]: @ USER Open: main (privileged) version 2.22                                                {0x0001} 0.675078
zephyr.exe[1628524]: < HCI Command: Reset (0x03|0x0003) plen 0                                                        #1 0.676169
> HCI Event: Command Complete (0x0e) plen 4                                                                           #2 0.676708
      Reset (0x03|0x0003) ncmd 1
        Status: Success (0x00)
zephyr.exe[1628524]: < HCI Command: Read Local Supported Features (0x04|0x0003) plen 0                                #3 0.694572
> HCI Event: Command Complete (0x0e) plen 12                                                                          #4 0.695054
      Read Local Supported Features (0x04|0x0003) ncmd 1
        Status: Success (0x00)
        Features: 0x00 0x00 0x00 0x00 0x60 0x00 0x00 0x00
          BR/EDR Not Supported
          LE Supported (Controller)
zephyr.exe[1628524]: < HCI Command: Read Local Version Information (0x04|0x0001) plen 0                               #5 0.714533
> HCI Event: Command Complete (0x0e) plen 12                                                                          #6 0.715056
      Read Local Version Information (0x04|0x0001) ncmd 1
        Status: Success (0x00)
        HCI version: Reserved (0x0f) - Revision 12393 (0x3069)
        LMP version: Reserved (0x0f) - Subversion 12393 (0x3069)
        Manufacturer: Nordic Semiconductor ASA (89)
zephyr.exe[1628524]: < HCI Command: Read Local Supported Commands (0x04|0x0002) plen 0                                #7 0.734532
> HCI Event: Command Complete (0x0e) plen 68                                                                          #8 0.735705
      Read Local Supported Commands (0x04|0x0002) ncmd 1
        Status: Success (0x00)
        Commands: 119 entries
          Disconnect (Octet 0 - Bit 5)
          Read Remote Version Information (Octet 2 - Bit 7)
          Set Event Mask (Octet 5 - Bit 6)
          Reset (Octet 5 - Bit 7)
          Read Connection Accept Timeout (Octet 7 - Bit 2)
          Write Connection Accept Timeout (Octet 7 - Bit 3)
          Read Transmit Power Level (Octet 10 - Bit 2)
          Set Controller To Host Flow Control (Octet 10 - Bit 5)
          Host Buffer Size (Octet 10 - Bit 6)
          Host Number of Completed Packets (Octet 10 - Bit 7)
          Read Local Version Information (Octet 14 - Bit 3)
          Read Local Supported Features (Octet 14 - Bit 5)
          Read BD ADDR (Octet 15 - Bit 1)
          Read RSSI (Octet 15 - Bit 5)
          Set Event Mask Page 2 (Octet 22 - Bit 2)
          LE Set Event Mask (Octet 25 - Bit 0)
          LE Read Buffer Size (Octet 25 - Bit 1)
          LE Read Local Supported Features (Octet 25 - Bit 2)
          LE Set Random Address (Octet 25 - Bit 4)
          LE Set Advertising Parameters (Octet 25 - Bit 5)
          LE Read Advertising Channel TX Power (Octet 25 - Bit 6)
          LE Set Advertising Data (Octet 25 - Bit 7)
          LE Set Scan Response Data (Octet 26 - Bit 0)
          LE Set Advertise Enable (Octet 26 - Bit 1)
          LE Set Scan Parameters (Octet 26 - Bit 2)
          LE Set Scan Enable (Octet 26 - Bit 3)
          LE Create Connection (Octet 26 - Bit 4)
          LE Create Connection Cancel (Octet 26 - Bit 5)
          LE Read Accept List Size (Octet 26 - Bit 6)
          LE Clear Accept List (Octet 26 - Bit 7)
          LE Add Device To Accept List (Octet 27 - Bit 0)
          LE Remove Device From Accept List (Octet 27 - Bit 1)
          LE Connection Update (Octet 27 - Bit 2)
          LE Set Host Channel Classification (Octet 27 - Bit 3)
          LE Read Channel Map (Octet 27 - Bit 4)
          LE Read Remote Used Features (Octet 27 - Bit 5)
          LE Encrypt (Octet 27 - Bit 6)
          LE Rand (Octet 27 - Bit 7)
          LE Start Encryption (Octet 28 - Bit 0)
          LE Long Term Key Request Reply (Octet 28 - Bit 1)
          LE Long Term Key Request Neg Reply (Octet 28 - Bit 2)
          LE Read Supported States (Octet 28 - Bit 3)
          LE Receiver Test (Octet 28 - Bit 4)
          LE Transmitter Test (Octet 28 - Bit 5)
          LE Test End (Octet 28 - Bit 6)
          Read Authenticated Payload Timeout (Octet 32 - Bit 4)
          Write Authenticated Payload Timeout (Octet 32 - Bit 5)
          LE Set Data Length (Octet 33 - Bit 6)
          LE Read Suggested Default Data Length (Octet 33 - Bit 7)
          LE Write Suggested Default Data Length (Octet 34 - Bit 0)
          LE Add Device To Resolving List (Octet 34 - Bit 3)
          LE Remove Device From Resolving List (Octet 34 - Bit 4)
          LE Clear Resolving List (Octet 34 - Bit 5)
          LE Read Resolving List Size (Octet 34 - Bit 6)
          LE Set Address Resolution Enable (Octet 35 - Bit 1)
          LE Set Resolvable Private Address Timeout (Octet 35 - Bit 2)
          LE Read Maximum Data Length (Octet 35 - Bit 3)
          LE Read PHY (Octet 35 - Bit 4)
          LE Set Default PHY (Octet 35 - Bit 5)
          LE Set PHY (Octet 35 - Bit 6)
          LE Enhanced Receiver Test (Octet 35 - Bit 7)
          LE Enhanced Transmitter Test (Octet 36 - Bit 0)
          LE Set Advertising Set Random Address (Octet 36 - Bit 1)
          LE Set Extended Advertising Parameters (Octet 36 - Bit 2)
          LE Set Extended Advertising Data (Octet 36 - Bit 3)
          LE Set Extended Scan Response Data (Octet 36 - Bit 4)
          LE Set Extended Advertising Enable (Octet 36 - Bit 5)
          LE Read Maximum Advertising Data Length (Octet 36 - Bit 6)
          LE Read Number of Supported Advertising Sets (Octet 36 - Bit 7)
          LE Remove Advertising Set (Octet 37 - Bit 0)
          LE Clear Advertising Sets (Octet 37 - Bit 1)
          LE Set Periodic Advertising Parameters (Octet 37 - Bit 2)
          LE Set Periodic Advertising Data (Octet 37 - Bit 3)
          LE Set Periodic Advertising Enable (Octet 37 - Bit 4)
          LE Set Extended Scan Parameters (Octet 37 - Bit 5)
          LE Set Extended Scan Enable (Octet 37 - Bit 6)
          LE Extended Create Connection (Octet 37 - Bit 7)
          LE Periodic Advertising Create Sync (Octet 38 - Bit 0)
          LE Periodic Advertising Create Sync Cancel (Octet 38 - Bit 1)
          LE Periodic Advertising Terminate Sync (Octet 38 - Bit 2)
          LE Add Device To Periodic Advertiser List (Octet 38 - Bit 3)
          LE Remove Device From Periodic Advertiser List (Octet 38 - Bit 4)
          LE Clear Periodic Advertiser List (Octet 38 - Bit 5)
          LE Read Periodic Advertiser List Size (Octet 38 - Bit 6)
          LE Read Transmit Power (Octet 38 - Bit 7)
          LE Read RF Path Compensation (Octet 39 - Bit 0)
          LE Write RF Path Compensation (Octet 39 - Bit 1)
          LE Set Privacy Mode (Octet 39 - Bit 2)
          LE Periodic Advertising Receive Enable (Octet 40 - Bit 5)
          LE Periodic Advertising Sync Transfer (Octet 40 - Bit 6)
          LE Periodic Advertising Set Info Transfer (Octet 40 - Bit 7)
          LE Periodic Advertising Sync Transfer Parameters (Octet 41 - Bit 0)
          LE Set Default Periodic Advertisng Sync Transfer Parameters (Octet 41 - Bit 1)
          LE Read Buffer v2 (Octet 41 - Bit 5)
          LE Read ISO TX Sync (Octet 41 - Bit 6)
          LE Set Connected Isochronous Group Parameters (Octet 41 - Bit 7)
          LE Set Connected Isochronous Group Parameters Test (Octet 42 - Bit 0)
          LE Create Connected Isochronous Stream (Octet 42 - Bit 1)
          LE Remove Connected Isochronous Group (Octet 42 - Bit 2)
          LE Accept Connected Isochronous Stream Request (Octet 42 - Bit 3)
          LE Reject Connected Isochronous Stream Request (Octet 42 - Bit 4)
          LE Create Broadcast Isochronous Group (Octet 42 - Bit 5)
          LE Create Broadcast Isochronous Group Test (Octet 42 - Bit 6)
          LE Terminate Broadcast Isochronous Group (Octet 42 - Bit 7)
          LE Broadcast Isochronous Group Create Sync (Octet 43 - Bit 0)
          LE Broadcast Isochronous Group Terminate Sync (Octet 43 - Bit 1)
          LE Request Peer SCA (Octet 43 - Bit 2)
          LE Setup Isochronous Data Path (Octet 43 - Bit 3)
          LE Remove Isochronous Data Path (Octet 43 - Bit 4)
          LE Isochronous Transmit Test (Octet 43 - Bit 5)
          LE Isochronous Receive Test (Octet 43 - Bit 6)
          LE Isochronous Read Test Counters (Octet 43 - Bit 7)
          LE Isochronous Read Test Counters (Octet 44 - Bit 0)
          LE Set Host Feature (Octet 44 - Bit 1)
          Octet 44 - Bit 2 
          Octet 45 - Bit 6 
          Octet 46 - Bit 0 
          Octet 46 - Bit 1 
          Octet 46 - Bit 2 
zephyr.exe[1628524]: < HCI Command: Host Buffer Size (0x03|0x0033) plen 7                                             #9 0.754569
        ACL MTU: 255  ACL max packet: 16
        SCO MTU: 0    SCO max packet: 0
> HCI Event: Command Complete (0x0e) plen 4                                                                          #10 0.755028
      Host Buffer Size (0x03|0x0033) ncmd 1
        Status: Success (0x00)
zephyr.exe[1628524]: < HCI Command: Set Controller To Host Flow Control (0x03|0x0031) plen 1                         #11 0.774579
        Flow control: ACL Data Packets (0x01)
> HCI Event: Command Complete (0x0e) plen 4                                                                          #12 0.775043
      Set Controller To Host Flow Control (0x03|0x0031) ncmd 1
        Status: Success (0x00)
zephyr.exe[1628524]: < HCI Command: LE Read Local Supported Features (0x08|0x0003) plen 0                            #13 0.794512
> HCI Event: Command Complete (0x0e) plen 12                                                                         #14 0.795019
      LE Read Local Supported Features (0x08|0x0003) ncmd 1
        Status: Success (0x00)
        Features: 0xfd 0x79 0x00 0xf7 0x30 0x01 0x00 0x00
          LE Encryption
          Extended Reject Indication
          Peripheral-initiated Features Exchange
          LE Ping
          LE Data Packet Length Extension
          LL Privacy
          Extended Scanner Filter Policies
          LE 2M PHY
          LE Coded PHY
          LE Extended Advertising
          LE Periodic Advertising
          Channel Selection Algorithm #2
          Periodic Advertising Sync Transfer - Sender
          Periodic Advertising Sync Transfer - Recipient
          Sleep Clock Accuracy Updates
          Connected Isochronous Stream - Central
          Connected Isochronous Stream - Peripheral
          Isochronous Broadcaster
          Synchronized Receiver
          Periodic Advertising ADI support
          Connection Subrating
          Unknown features (0x0000010000000000)
zephyr.exe[1628524]: < HCI Command: LE Set Host Feature (0x08|0x0074) plen 2                                         #15 0.814576
        Bit Number: 32
          Connected Isochronous Stream (Host Support)
        Bit Value: 1
> HCI Event: Command Complete (0x0e) plen 4                                                                          #16 0.815120
      LE Set Host Feature (0x08|0x0074) ncmd 1
        Status: Success (0x00)
zephyr.exe[1628524]: < HCI Command: LE Read Buffer v2 (0x08|0x0060) plen 0                                           #17 0.834533
> HCI Event: Command Complete (0x0e) plen 10                                                                         #18 0.835097
      LE Read Buffer v2 (0x08|0x0060) ncmd 1
        Status: Success (0x00)
        ACL MTU: 27
        ACL max packet: 3
        ISO MTU: 318
        ISO max packet: 3
zephyr.exe[1628524]: < HCI Command: LE Read Maximum Advertising Data Length (0x08|0x003a) plen 0                     #19 0.854565
> HCI Event: Command Complete (0x0e) plen 6                                                                          #20 0.855050
      LE Read Maximum Advertising Data Length (0x08|0x003a) ncmd 1
        Status: Success (0x00)
        Max length: 1650
zephyr.exe[1628524]: < HCI Command: LE Read Supported States (0x08|0x001c) plen 0                                    #21 0.874572
> HCI Event: Command Complete (0x0e) plen 12                                                                         #22 0.875054
      LE Read Supported States (0x08|0x001c) ncmd 1
        Status: Success (0x00)
        States: 0x000003ff3e0306ff
          Non-connectable Advertising State
          Scannable Advertising State
          Connectable Advertising State
          High Duty Cycle Directed Advertising State
          Passive Scanning State
          Active Scanning State
          Initiating State
            and Connection State (Central Role)
          Connection State (Peripheral Role)
          Scannable Advertising State
            and Passive Scanning State
          Connectable Advertising State
            and Passive Scanning State
          Non-connectable Advertising State
            and Initiating State
          Scannable Advertising State
            and Initiating State
          Active Scanning State
            and Connection State (Central Role)
          Passive Scanning State
            and Connection State (Peripheral Role)
          Active Scanning State
            and Connection State (Peripheral Role)
          Initiating State
            and Connection State (Central Role)
            and Central Role & Central Role
          Low Duty Cycle Directed Advertising State
          Connectable Advertising State
            and Initiating State
            and Central Role & Peripheral Role
          High Duty Cycle Directed Advertising State
            and Initiating State
            and Central Role & Peripheral Role
          Low Duty Cycle Directed Advertising State
            and Initiating State
            and Central Role & Peripheral Role
          Connectable Advertising State
            and Connection State (Central Role)
            and Central Role & Peripheral Role
          High Duty Cycle Directed Advertising State
            and Connection State (Central Role)
            and Central Role & Peripheral Role
          Low Duty Cycle Directed Advertising State
            and Connection State (Central Role)
            and Central Role & Peripheral Role
          Connectable Advertising State
            and Connection State (Peripheral Role)
            and Central Role & Peripheral Role
          High Duty Cycle Directed Advertising State
            and Connection State (Peripheral Role)
            and Peripheral Role & Peripheral Role
          Low Duty Cycle Directed Advertising State
            and Connection State (Peripheral Role)
            and Peripheral Role & Peripheral Role
          Initiating State
            and Connection State (Peripheral Role)
            and Central Role & Peripheral Role
zephyr.exe[1628524]: < HCI Command: LE Read Maximum Data Length (0x08|0x002f) plen 0                                 #23 0.894572
> HCI Event: Command Complete (0x0e) plen 12                                                                         #24 0.895072
      LE Read Maximum Data Length (0x08|0x002f) ncmd 1
        Status: Success (0x00)
        Max TX octets: 251
        Max TX time: 2704
        Max RX octets: 251
        Max RX time: 2704
zephyr.exe[1628524]: < HCI Command: LE Write Suggested Default Data Length (0x08|0x0024) plen 4                      #25 0.914577
        TX octets: 251
        TX time: 2704
> HCI Event: Command Complete (0x0e) plen 4                                                                          #26 0.915040
      LE Write Suggested Default Data Length (0x08|0x0024) ncmd 1
        Status: Success (0x00)
zephyr.exe[1628524]: < HCI Command: LE Read Resolving List Size (0x08|0x002a) plen 0                                 #27 0.934544
> HCI Event: Command Complete (0x0e) plen 5                                                                          #28 0.934934
      LE Read Resolving List Size (0x08|0x002a) ncmd 1
        Status: Success (0x00)
        Size: 8
zephyr.exe[1628524]: < HCI Command: LE Set Event Mask (0x08|0x0001) plen 8                                           #29 0.954536
        Mask: 0x000002023f87fa5e
          LE Advertising Report
          LE Connection Update Complete
          LE Read Remote Used Features Complete
          LE Long Term Key Request
          LE Data Length Change
          LE Enhanced Connection Complete
          LE PHY Update Complete
          LE Extended Advertising Report
          LE Periodic Advertising Sync Established
          LE Periodic Advertising Report
          LE Periodic Advertising Sync Lost
          LE Extended Scan Timeout
          LE Extended Advertising Set Terminated
          LE Scan Request Received
          LE Periodic Advertising Sync Transfer Rvc
          LE CIS Established
          LE CIS Request
          LE Create BIG Complete
          LE Terminate BIG Complete
          LE BIG Sync Estabilished Complete
          LE BIG Sync Lost
          LE BIG Info Advertising Report
          Unknown mask (0x0000020000000000)
> HCI Event: Command Complete (0x0e) plen 4                                                                          #30 0.955076
      LE Set Event Mask (0x08|0x0001) ncmd 1
        Status: Success (0x00)
zephyr.exe[1628524]: < HCI Command: Set Event Mask (0x03|0x0001) plen 8                                              #31 0.974536
        Mask: 0x2000800002008890
          Disconnection Complete
          Encryption Change
          Read Remote Version Information Complete
          Hardware Error
          Data Buffer Overflow
          Encryption Key Refresh Complete
          LE Meta
> HCI Event: Command Complete (0x0e) plen 4                                                                          #32 0.975179
      Set Event Mask (0x03|0x0001) ncmd 1
        Status: Success (0x00)
zephyr.exe[1628524]: < HCI Command: Read BD ADDR (0x04|0x0009) plen 0                                                #33 0.994542
> HCI Event: Command Complete (0x0e) plen 10                                                                         #34 0.995084
      Read BD ADDR (0x04|0x0009) ncmd 1
        Status: Success (0x00)
        Address: 00:00:00:00:00:00 (OUI 00-00-00)
zephyr.exe[1628524]: < HCI Command: LE Set Random Address (0x08|0x0005) plen 6                                       #35 1.014548
        Address: D5:B6:CC:31:DB:3B (Static)
> HCI Event: Command Complete (0x0e) plen 4                                                                          #36 1.015088
      LE Set Random Address (0x08|0x0005) ncmd 1
        Status: Success (0x00)
zephyr.exe[1628524]: < HCI Command: LE Set Extended Advertising Parameters (0x08|0x0036) plen 25                     #37 2.284567
        Handle: 0x00
        Properties: 0x0001
          Connectable
        Min advertising interval: 100.000 msec (0x00a0)
        Max advertising interval: 150.000 msec (0x00f0)
        Channel map: 37, 38, 39 (0x07)
        Own address type: Random (0x01)
        Peer address type: Public (0x00)
        Peer address: 00:00:00:00:00:00 (OUI 00-00-00)
        Filter policy: Allow Scan Request from Any, Allow Connect Request from Any (0x00)
        TX power: Host has no preference (0x7f)
        Primary PHY: LE 1M (0x01)
        Secondary max skip: 0x00
        Secondary PHY: LE 2M (0x02)
        SID: 0x00
        Scan request notifications: Disabled (0x00)
> HCI Event: Command Complete (0x0e) plen 5                                                                          #38 2.285399
      LE Set Extended Advertising Parameters (0x08|0x0036) ncmd 1
        Status: Success (0x00)
        TX power (selected): 0 dbm (0x00)
zephyr.exe[1628524]: < HCI Command: LE Set Advertising Set Random Address (0x08|0x0035) plen 7                       #39 2.294566
        Advertising handle: 0x00
        Advertising random address: D5:B6:CC:31:DB:3B (Static)
> HCI Event: Command Complete (0x0e) plen 4                                                                          #40 2.295057
      LE Set Advertising Set Random Address (0x08|0x0035) ncmd 1
        Status: Success (0x00)
zephyr.exe[1628524]: < HCI Command: LE Set Extended Advertising Data (0x08|0x0037) plen 30                           #41 2.314559
        Handle: 0x00
        Operation: Complete extended advertising data (0x03)
        Fragment preference: Minimize fragmentation (0x01)
        Data length: 0x1a
        Flags: 0x06
          LE General Discoverable Mode
          BR/EDR Not Supported
        Service Data: Common Audio (0x1853)
          Data: 01
        Service Data: Audio Stream Control (0x184e)
          Data: 014400400000
        Resolvable Set Identifier: 48-61-8E-0C-80-97
          Hash: 0x c8097
          Random: 0x48618e
> HCI Event: Command Complete (0x0e) plen 4                                                                          #42 2.315403
      LE Set Extended Advertising Data (0x08|0x0037) ncmd 1
        Status: Success (0x00)
zephyr.exe[1628524]: < HCI Command: LE Set Extended Advertising Enable (0x08|0x0039) plen 6                          #43 2.334545
        Extended advertising: Enabled (0x01)
        Number of sets: 1 (0x01)
        Entry 0
          Handle: 0x00
          Duration: 0 ms (0x00)
          Max ext adv events: 0
> HCI Event: Command Complete (0x0e) plen 4                                                                          #44 2.335175
      LE Set Extended Advertising Enable (0x08|0x0039) ncmd 1
        Status: Success (0x00)
> HCI Event: LE Meta Event (0x3e) plen 31                                                                            #45 4.224450
      LE Enhanced Connection Complete (0x0a)
        Status: Success (0x00)
        Handle: 75
        Role: Peripheral (0x01)
        Peer address type: Public (0x00)
        Peer address: DF:A9:FF:F6:B1:1A (OUI DF-A9-FF)
        Local resolvable private address: 00:00:00:00:00:00 (Non-Resolvable)
        Peer resolvable private address: 00:00:00:00:00:00 (Non-Resolvable)
        Connection interval: 87.50 msec (0x0046)
        Connection latency: 0 (0x0000)
        Supervision timeout: 25120 msec (0x09d0)
        Central clock accuracy: 0x01
> HCI Event: LE Meta Event (0x3e) plen 6                                                                             #46 4.224514
      LE Advertising Set Terminated (0x12)
        Status: Success (0x00)
        Handle: 0
        Connection handle: 75
        Number of completed extended advertising events: 0
zephyr.exe[1628524]: < HCI Command: LE Read Remote Used Features (0x08|0x0016) plen 2                                #47 4.234906
        Handle: 75 Address: DF:A9:FF:F6:B1:1A (OUI DF-A9-FF)
zephyr.exe[1628524]: < ACL Data TX: Handle 75 flags 0x00 dlen 7                                                      #48 4.234915
      ATT: Exchange MTU Request (0x02) len 2
        Client RX MTU: 251
> HCI Event: Command Status (0x0f) plen 4                                                                            #49 4.235412
      LE Read Remote Used Features (0x08|0x0016) ncmd 1
        Status: Success (0x00)
> HCI Event: Number of Completed Packets (0x13) plen 5                                                               #50 4.401451
        Num handles: 1
        Handle: 75 Address: DF:A9:FF:F6:B1:1A (OUI DF-A9-FF)
        Count: 1
        #48: len 7 (0 Kb/s)
        Latency: 166 msec (166-166 msec ~166 msec)
zephyr.exe[1628524]: < HCI Command: LE Remove Advertising Set (0x08|0x003c) plen 1                                   #51 4.454624
        Handle: 0
> HCI Event: Command Complete (0x0e) plen 4                                                                          #52 4.455075
      LE Remove Advertising Set (0x08|0x003c) ncmd 1
        Status: Success (0x00)
zephyr.exe[1628524]: < HCI Command: LE Set Extended Advertising Parameters (0x08|0x0036) plen 25                     #53 4.474632
        Handle: 0x00
        Properties: 0x0001
          Connectable
        Min advertising interval: 100.000 msec (0x00a0)
        Max advertising interval: 150.000 msec (0x00f0)
        Channel map: 37, 38, 39 (0x07)
        Own address type: Random (0x01)
        Peer address type: Public (0x00)
        Peer address: 00:00:00:00:00:00 (OUI 00-00-00)
        Filter policy: Allow Scan Request from Any, Allow Connect Request from Any (0x00)
        TX power: Host has no preference (0x7f)
        Primary PHY: LE 1M (0x01)
        Secondary max skip: 0x00
        Secondary PHY: LE 2M (0x02)
        SID: 0x01
        Scan request notifications: Disabled (0x00)
> HCI Event: Command Complete (0x0e) plen 5                                                                          #54 4.475450
      LE Set Extended Advertising Parameters (0x08|0x0036) ncmd 1
        Status: Success (0x00)
        TX power (selected): 0 dbm (0x00)
> HCI Event: LE Meta Event (0x3e) plen 12                                                                            #55 4.489407
      LE Read Remote Used Features (0x04)
        Status: Success (0x00)
        Handle: 75 Address: DF:A9:FF:F6:B1:1A (OUI DF-A9-FF)
        Features: 0x2d 0x49 0x00 0xf7 0x67 0xd8 0x00 0x00
          LE Encryption
          Extended Reject Indication
          Peripheral-initiated Features Exchange
          LE Data Packet Length Extension
          LE 2M PHY
          LE Coded PHY
          Channel Selection Algorithm #2
          Periodic Advertising Sync Transfer - Sender
          Periodic Advertising Sync Transfer - Recipient
          Sleep Clock Accuracy Updates
          Connected Isochronous Stream - Central
          Connected Isochronous Stream - Peripheral
          Isochronous Broadcaster
          Synchronized Receiver
          Connected Isochronous Stream (Host Support)
          LE Power Control Request
          LE Power Control Request
          Connection Subrating
          Connection Subrating (Host Support)
          Unknown features (0x0000d80000000000)
zephyr.exe[1628524]: < HCI Command: LE Set Advertising Set Random Address (0x08|0x0035) plen 7                       #56 4.494600
        Advertising handle: 0x00
        Advertising random address: D5:B6:CC:31:DB:3B (Static)
> HCI Event: Command Complete (0x0e) plen 4                                                                          #57 4.495098
      LE Set Advertising Set Random Address (0x08|0x0035) ncmd 1
        Status: Success (0x00)
zephyr.exe[1628524]: < HCI Command: LE Set Extended Advertising Data (0x08|0x0037) plen 22                           #58 4.514582
        Handle: 0x00
        Operation: Complete extended advertising data (0x03)
        Fragment preference: Minimize fragmentation (0x01)
        Data length: 0x12
        Flags: 0x06
          LE General Discoverable Mode
          BR/EDR Not Supported
        Name (complete): Tester_F6B11A
> HCI Event: Command Complete (0x0e) plen 4                                                                          #59 4.515283
      LE Set Extended Advertising Data (0x08|0x0037) ncmd 1
        Status: Success (0x00)
zephyr.exe[1628524]: < HCI Command: LE Set Extended Advertising Enable (0x08|0x0039) plen 6                          #60 4.534611
        Extended advertising: Enabled (0x01)
        Number of sets: 1 (0x01)
        Entry 0
          Handle: 0x00
          Duration: 0 ms (0x00)
          Max ext adv events: 0
> HCI Event: Command Complete (0x0e) plen 4                                                                          #61 4.535249
      LE Set Extended Advertising Enable (0x08|0x0039) ncmd 1
        Status: Success (0x00)
> ACL Data RX: Handle 75 flags 0x02 dlen 7                                                                           #62 4.926527
      ATT: Exchange MTU Request (0x02) len 2
        Client RX MTU: 64
> ACL Data RX: Handle 75 flags 0x02 dlen 7                                                                           #63 4.926999
      ATT: Exchange MTU Response (0x03) len 2
        Server RX MTU: 64
zephyr.exe[1628524]: < HCI Command: Host Number of Completed Packets (0x03|0x0035) plen 5                            #64 4.934628
        Num handles: 1
        Handle: 75 Address: DF:A9:FF:F6:B1:1A (OUI DF-A9-FF)
        Count: 1
zephyr.exe[1628524]: < ACL Data TX: Handle 75 flags 0x00 dlen 7                                                      #65 4.934728
      ATT: Exchange MTU Response (0x03) len 2
        Server RX MTU: 251
zephyr.exe[1628524]: < HCI Command: Host Number of Completed Packets (0x03|0x0035) plen 5                            #66 4.934754
        Num handles: 1
        Handle: 75 Address: DF:A9:FF:F6:B1:1A (OUI DF-A9-FF)
        Count: 1
> HCI Event: Number of Completed Packets (0x13) plen 5                                                               #67 5.101419
        Num handles: 1
        Handle: 75 Address: DF:A9:FF:F6:B1:1A (OUI DF-A9-FF)
        Count: 1
        #65: len 7 (0 Kb/s)
        Latency: 166 msec (166-166 msec ~166 msec)
> ACL Data RX: Handle 75 flags 0x02 dlen 11                                                                          #68 7.114016
      SMP: Pairing Request (0x01) len 6
        IO capability: KeyboardDisplay (0x04)
        OOB data: Authentication data not present (0x00)
        Authentication requirement: Bonding, No MITM, SC, No Keypresses (0x09)
        Max encryption key size: 16
        Initiator key distribution: EncKey IdKey (0x03)
        Responder key distribution: EncKey IdKey Sign (0x07)
zephyr.exe[1628524]: < HCI Command: Host Number of Completed Packets (0x03|0x0035) plen 5                            #69 7.115055
        Num handles: 1
        Handle: 75 Address: DF:A9:FF:F6:B1:1A (OUI DF-A9-FF)
        Count: 1
zephyr.exe[1628524]: < ACL Data TX: Handle 75 flags 0x00 dlen 11                                                     #70 7.115166
      SMP: Pairing Response (0x02) len 6
        IO capability: NoInputNoOutput (0x03)
        OOB data: Authentication data not present (0x00)
        Authentication requirement: Bonding, No MITM, SC, No Keypresses (0x09)
        Max encryption key size: 16
        Initiator key distribution: IdKey (0x02)
        Responder key distribution: <none> (0x00)
> HCI Event: Number of Completed Packets (0x13) plen 5                                                               #71 7.289118
        Num handles: 1
        Handle: 75 Address: DF:A9:FF:F6:B1:1A (OUI DF-A9-FF)
        Count: 1
        #70: len 11 (0 Kb/s)
        Latency: 173 msec (166-173 msec ~170 msec)
> ACL Data RX: Handle 75 flags 0x02 dlen 27                                                                          #72 7.289251
> ACL Data RX: Handle 75 flags 0x01 dlen 27                                                                          #73 7.289721
> ACL Data RX: Handle 75 flags 0x01 dlen 15                                                                          #74 7.289936
      SMP: Pairing Public Key (0x0c) len 64
        X: 9e9057648fb806ec552b131ffafb3010751da92f660a73790ba35921982b078e
        Y: 645a57c08d468d8fcea4ef5764c1d5cf44d01ea4956a497b73f430776bfadf14
zephyr.exe[1628524]: < HCI Command: Host Number of Completed Packets (0x03|0x0035) plen 5                            #75 7.294943
        Num handles: 1
        Handle: 75 Address: DF:A9:FF:F6:B1:1A (OUI DF-A9-FF)
        Count: 1
zephyr.exe[1628524]: < HCI Command: Host Number of Completed Packets (0x03|0x0035) plen 5                            #76 7.295037
        Num handles: 1
        Handle: 75 Address: DF:A9:FF:F6:B1:1A (OUI DF-A9-FF)
        Count: 1
zephyr.exe[1628524]: < HCI Command: Host Number of Completed Packets (0x03|0x0035) plen 5                            #77 7.295109
        Num handles: 1
        Handle: 75 Address: DF:A9:FF:F6:B1:1A (OUI DF-A9-FF)
        Count: 1
zephyr.exe[1628524]: < ACL Data TX: Handle 75 flags 0x00 dlen 27                                                     #78 7.295178
zephyr.exe[1628524]: < ACL Data TX: Handle 75 flags 0x01 dlen 27                                                     #79 7.295193
zephyr.exe[1628524]: < ACL Data TX: Handle 75 flags 0x01 dlen 15                                                     #80 7.295206
      SMP: Pairing Public Key (0x0c) len 64
        X: 98308440221e2d910f0e54b71e7ec652857aa9b5a0dc65028824cc19db1226e9
        Y: 67a4816bcb62efb21701e31fdb27561a6217575fb007a8bbdabe7e28b6f68482
> HCI Event: Number of Completed Packets (0x13) plen 5                                                               #81 7.376764
        Num handles: 1
        Handle: 75 Address: DF:A9:FF:F6:B1:1A (OUI DF-A9-FF)
        Count: 1
        #78: len 27 (2 Kb/s)
        Latency: 81 msec (81-173 msec ~125 msec)
> HCI Event: Number of Completed Packets (0x13) plen 5                                                               #82 7.377303
        Num handles: 1
        Handle: 75 Address: DF:A9:FF:F6:B1:1A (OUI DF-A9-FF)
        Count: 1
        #79: len 27 (2 Kb/s)
        Latency: 82 msec (81-173 msec ~104 msec)
zephyr.exe[1628524]: < ACL Data TX: Handle 75 flags 0x00 dlen 21                                                     #83 7.395024
      SMP: Pairing Confirm (0x03) len 16
        Confim value: bd9b40aa185789898410dd236c014339
> HCI Event: Number of Completed Packets (0x13) plen 5                                                               #84 7.463794
        Num handles: 1
        Handle: 75 Address: DF:A9:FF:F6:B1:1A (OUI DF-A9-FF)
        Count: 1
        #80: len 15 (0 Kb/s)
        Latency: 168 msec (81-173 msec ~136 msec)
> HCI Event: Number of Completed Packets (0x13) plen 5                                                               #85 7.551440
        Num handles: 1
        Handle: 75 Address: DF:A9:FF:F6:B1:1A (OUI DF-A9-FF)
        Count: 1
        #83: len 21 (1 Kb/s)
        Latency: 156 msec (81-173 msec ~146 msec)
> ACL Data RX: Handle 75 flags 0x02 dlen 21                                                                          #86 7.551821
      SMP: Pairing Random (0x04) len 16
        Random value: 785158951eec53000000000000000000
zephyr.exe[1628524]: < HCI Command: Host Number of Completed Packets (0x03|0x0035) plen 5                            #87 7.554974
        Num handles: 1
        Handle: 75 Address: DF:A9:FF:F6:B1:1A (OUI DF-A9-FF)
        Count: 1
zephyr.exe[1628524]: < ACL Data TX: Handle 75 flags 0x00 dlen 21                                                     #88 7.555004
      SMP: Pairing Random (0x04) len 16
        Random value: f966a694cbe26df70bb96773e6cc6f5d
> HCI Event: Number of Completed Packets (0x13) plen 5                                                               #89 7.726307
        Num handles: 1
        Handle: 75 Address: DF:A9:FF:F6:B1:1A (OUI DF-A9-FF)
        Count: 1
        #88: len 21 (0 Kb/s)
        Latency: 171 msec (81-173 msec ~158 msec)
> ACL Data RX: Handle 75 flags 0x02 dlen 21                                                                          #90 7.901638
      SMP: Pairing DHKey Check (0x0d) len 16
        E: ed08dadcfe53eafafc61b2b919838383
zephyr.exe[1628524]: < HCI Command: Host Number of Completed Packets (0x03|0x0035) plen 5                            #91 7.915478
        Num handles: 1
        Handle: 75 Address: DF:A9:FF:F6:B1:1A (OUI DF-A9-FF)
        Count: 1
zephyr.exe[1628524]: < ACL Data TX: Handle 75 flags 0x00 dlen 21                                                     #92 7.915736
      SMP: Pairing DHKey Check (0x0d) len 16
        E: 1b733b5b027bdad237a09b1c6ce0a236
> HCI Event: Number of Completed Packets (0x13) plen 5                                                               #93 8.163831
        Num handles: 1
        Handle: 75 Address: DF:A9:FF:F6:B1:1A (OUI DF-A9-FF)
        Count: 1
        #92: len 21 (0 Kb/s)
        Latency: 248 msec (81-248 msec ~203 msec)
> HCI Event: LE Meta Event (0x3e) plen 13                                                                            #94 8.251824
      LE Long Term Key Request (0x05)
        Handle: 75 Address: DF:A9:FF:F6:B1:1A (OUI DF-A9-FF)
        Random number: 0x0000000000000000
        Encrypted diversifier: 0x0000
zephyr.exe[1628524]: < HCI Command: LE Long Term Key Request Reply (0x08|0x001a) plen 18                             #95 8.254820
        Handle: 75 Address: DF:A9:FF:F6:B1:1A (OUI DF-A9-FF)
        Long term key: 059ec2092eefc4dcea2ae565872ab858
> HCI Event: Command Complete (0x0e) plen 6                                                                          #96 8.255476
      LE Long Term Key Request Reply (0x08|0x001a) ncmd 1
        Status: Success (0x00)
        Handle: 75 Address: DF:A9:FF:F6:B1:1A (OUI DF-A9-FF)
> HCI Event: Encryption Change (0x08) plen 4                                                                         #97 8.689020
        Status: Success (0x00)
        Handle: 75 Address: DF:A9:FF:F6:B1:1A (OUI DF-A9-FF)
        Encryption: Enabled with AES-CCM (0x01)
> ACL Data RX: Handle 75 flags 0x02 dlen 21                                                                          #98 8.776560
      SMP: Identity Information (0x08) len 16
        Identity resolving key: ed4a34aa19038f3cb28b4286ecd4c432
zephyr.exe[1628524]: < HCI Command: Host Number of Completed Packets (0x03|0x0035) plen 5                            #99 8.804919
        Num handles: 1
        Handle: 75 Address: DF:A9:FF:F6:B1:1A (OUI DF-A9-FF)
        Count: 1
> ACL Data RX: Handle 75 flags 0x02 dlen 12                                                                         #100 8.951431
      SMP: Identity Address Information (0x09) len 7
        Address: DF:A9:FF:F6:B1:1A (OUI DF-A9-FF)
zephyr.exe[1628524]: < HCI Command: LE Set Extended Advertising Enable (0x08|0x0039) plen 6                         #101 8.955210
        Extended advertising: Disabled (0x00)
        Number of sets: 1 (0x01)
        Entry 0
          Handle: 0x00
          Duration: 0 ms (0x00)
          Max ext adv events: 0
> HCI Event: Command Complete (0x0e) plen 4                                                                         #102 8.955798
      LE Set Extended Advertising Enable (0x08|0x0039) ncmd 1
        Status: Success (0x00)
zephyr.exe[1628524]: < HCI Command: LE Add Device To Resolving List (0x08|0x0027) plen 39                           #103 8.975002
        Address type: Public (0x00)
        Address: DF:A9:FF:F6:B1:1A (OUI DF-A9-FF)
        Peer identity resolving key: ed4a34aa19038f3cb28b4286ecd4c432
        Local identity resolving key: 00000000000000000000000000000000
> HCI Event: Command Complete (0x0e) plen 4                                                                         #104 8.976131
      LE Add Device To Resolving List (0x08|0x0027) ncmd 1
        Status: Success (0x00)
zephyr.exe[1628524]: < HCI Command: LE Set Privacy Mode (0x08|0x004e) plen 8                                        #105 8.994674
        Peer Identity address type: Public (0x00)
        Peer Identity address: DF:A9:FF:F6:B1:1A (OUI DF-A9-FF)
        Privacy Mode: Use Device Privacy (0x01)
> HCI Event: Command Complete (0x0e) plen 4                                                                         #106 8.995283
      LE Set Privacy Mode (0x08|0x004e) ncmd 1
        Status: Success (0x00)
zephyr.exe[1628524]: < HCI Command: LE Set Address Resolution Enable (0x08|0x002d) plen 1                           #107 9.014640
        Address resolution: Enabled (0x01)
> HCI Event: Command Complete (0x0e) plen 4                                                                         #108 9.015133
      LE Set Address Resolution Enable (0x08|0x002d) ncmd 1
        Status: Success (0x00)
zephyr.exe[1628524]: < HCI Command: LE Set Extended Advertising Enable (0x08|0x0039) plen 6                         #109 9.034747
        Extended advertising: Enabled (0x01)
        Number of sets: 1 (0x01)
        Entry 0
          Handle: 0x00
          Duration: 0 ms (0x00)
          Max ext adv events: 0
> HCI Event: Command Complete (0x0e) plen 4                                                                         #110 9.035371
      LE Set Extended Advertising Enable (0x08|0x0039) ncmd 1
        Status: Success (0x00)
zephyr.exe[1628524]: < HCI Command: Host Number of Completed Packets (0x03|0x0035) plen 5                           #111 9.054803
        Num handles: 1
        Handle: 75 Address: DF:A9:FF:F6:B1:1A (OUI DF-A9-FF)
        Count: 1
> ACL Data RX: Handle 75 flags 0x02 dlen 11                                                                         #112 9.126418
      ATT: Read By Group Type Request (0x10) len 6
        Handle range: 0x0001-0xffff
        Attribute group type: Primary Service (0x2800)
zephyr.exe[1628524]: < HCI Command: Host Number of Completed Packets (0x03|0x0035) plen 5                           #113 9.135502
        Num handles: 1
        Handle: 75 Address: DF:A9:FF:F6:B1:1A (OUI DF-A9-FF)
        Count: 1
zephyr.exe[1628524]: < ACL Data TX: Handle 75 flags 0x00 dlen 27                                                    #114 9.135719
zephyr.exe[1628524]: < ACL Data TX: Handle 75 flags 0x01 dlen 27                                                    #115 9.135738
zephyr.exe[1628524]: < ACL Data TX: Handle 75 flags 0x01 dlen 12                                                    #116 9.135742
      ATT: Read By Group Type Response (0x11) len 61
        Attribute data length: 6
        Attribute group list: 10 entries
        Handle range: 0x0001-0x000a
        UUID: Generic Attribute Profile (0x1801)
        Handle range: 0x000b-0x0011
        UUID: Generic Access Profile (0x1800)
        Handle range: 0x0012-0x0020
        UUID: Device Information (0x180a)
        Handle range: 0x0021-0x0023
        UUID: Immediate Alert (0x1802)
        Handle range: 0x0034-0x0038
        UUID: Microphone Control (0x184d)
        Handle range: 0x0039-0x004b
        UUID: Published Audio Capabilities (0x1850)
        Handle range: 0x004c-0x005b
        UUID: Audio Stream Control (0x184e)
        Handle range: 0x0094-0x00a0
        UUID: Volume Control (0x1844)
        Handle range: 0x00a1-0x00ac
        UUID: Coordinated Set Identification (0x1846)
        Handle range: 0x00ad-0x00ae
        UUID: Common Audio (0x1853)
> HCI Event: Number of Completed Packets (0x13) plen 5                                                              #117 9.214345
        Num handles: 1
        Handle: 75 Address: DF:A9:FF:F6:B1:1A (OUI DF-A9-FF)
        Count: 1
        #114: len 27 (2 Kb/s)
        Latency: 78 msec (78-248 msec ~141 msec)
> HCI Event: Number of Completed Packets (0x13) plen 5                                                              #118 9.214763
        Num handles: 1
        Handle: 75 Address: DF:A9:FF:F6:B1:1A (OUI DF-A9-FF)
        Count: 1
        #115: len 27 (2 Kb/s)
        Latency: 79 msec (78-248 msec ~110 msec)
> HCI Event: Number of Completed Packets (0x13) plen 5                                                              #119 9.301467
        Num handles: 1
        Handle: 75 Address: DF:A9:FF:F6:B1:1A (OUI DF-A9-FF)
        Count: 1
        #116: len 12 (0 Kb/s)
        Latency: 165 msec (78-248 msec ~137 msec)
> ACL Data RX: Handle 75 flags 0x02 dlen 11                                                                         #120 9.301591
      ATT: Read By Group Type Request (0x10) len 6
        Handle range: 0x00af-0xffff
        Attribute group type: Primary Service (0x2800)
zephyr.exe[1628524]: < HCI Command: Host Number of Completed Packets (0x03|0x0035) plen 5                           #121 9.314996
        Num handles: 1
        Handle: 75 Address: DF:A9:FF:F6:B1:1A (OUI DF-A9-FF)
        Count: 1
zephyr.exe[1628524]: < ACL Data TX: Handle 75 flags 0x00 dlen 12                                                    #122 9.315044
      ATT: Read By Group Type Response (0x11) len 7
        Attribute data length: 6
        Attribute group list: 1 entry
        Handle range: 0x00af-0x00b7
        UUID: Hearing Aid (0x1854)
> HCI Event: Number of Completed Packets (0x13) plen 5                                                              #123 9.476425
        Num handles: 1
        Handle: 75 Address: DF:A9:FF:F6:B1:1A (OUI DF-A9-FF)
        Count: 1
        #122: len 12 (0 Kb/s)
        Latency: 161 msec (78-248 msec ~149 msec)
> ACL Data RX: Handle 75 flags 0x02 dlen 11                                                                         #124 9.476551
      ATT: Read By Group Type Request (0x10) len 6
        Handle range: 0x00b8-0xffff
        Attribute group type: Primary Service (0x2800)
zephyr.exe[1628524]: < HCI Command: Host Number of Completed Packets (0x03|0x0035) plen 5                           #125 9.495317
        Num handles: 1
        Handle: 75 Address: DF:A9:FF:F6:B1:1A (OUI DF-A9-FF)
        Count: 1
zephyr.exe[1628524]: < ACL Data TX: Handle 75 flags 0x00 dlen 9                                                     #126 9.495400
      ATT: Error Response (0x01) len 4
        Read By Group Type Request (0x10)
        Handle: 0x00b8
        Error: Attribute Not Found (0x0a)
> HCI Event: Number of Completed Packets (0x13) plen 5                                                              #127 9.738966
        Num handles: 1
        Handle: 75 Address: DF:A9:FF:F6:B1:1A (OUI DF-A9-FF)
        Count: 1
        #126: len 9 (0 Kb/s)
        Latency: 243 msec (78-248 msec ~196 msec)
> ACL Data RX: Handle 75 flags 0x02 dlen 11                                                                         #128 9.739126
      ATT: Read By Type Request (0x08) len 6
        Handle range: 0x0001-0x000a
        Attribute type: Include (0x2802)
zephyr.exe[1628524]: < HCI Command: Host Number of Completed Packets (0x03|0x0035) plen 5                           #129 9.755317
        Num handles: 1
        Handle: 75 Address: DF:A9:FF:F6:B1:1A (OUI DF-A9-FF)
        Count: 1
zephyr.exe[1628524]: < ACL Data TX: Handle 75 flags 0x00 dlen 9                                                     #130 9.755405
      ATT: Error Response (0x01) len 4
        Read By Type Request (0x08)
        Handle: 0x0001
        Error: Attribute Not Found (0x0a)
> HCI Event: Number of Completed Packets (0x13) plen 5                                                              #131 9.913835
        Num handles: 1
        Handle: 75 Address: DF:A9:FF:F6:B1:1A (OUI DF-A9-FF)
        Count: 1
        #130: len 9 (0 Kb/s)
        Latency: 158 msec (78-248 msec ~177 msec)
> ACL Data RX: Handle 75 flags 0x02 dlen 11                                                                         #132 9.914042
      ATT: Read By Type Request (0x08) len 6
        Handle range: 0x000b-0x0011
        Attribute type: Include (0x2802)
zephyr.exe[1628524]: < HCI Command: Host Number of Completed Packets (0x03|0x0035) plen 5                           #133 9.915398
        Num handles: 1
        Handle: 75 Address: DF:A9:FF:F6:B1:1A (OUI DF-A9-FF)
        Count: 1
zephyr.exe[1628524]: < ACL Data TX: Handle 75 flags 0x00 dlen 9                                                     #134 9.915454
      ATT: Error Response (0x01) len 4
        Read By Type Request (0x08)
        Handle: 0x000b
        Error: Attribute Not Found (0x0a)
> HCI Event: Number of Completed Packets (0x13) plen 5                                                             #135 10.088941
        Num handles: 1
        Handle: 75 Address: DF:A9:FF:F6:B1:1A (OUI DF-A9-FF)
        Count: 1
        #134: len 9 (0 Kb/s)
        Latency: 173 msec (78-248 msec ~175 msec)
> ACL Data RX: Handle 75 flags 0x02 dlen 11                                                                        #136 10.089062
      ATT: Read By Type Request (0x08) len 6
        Handle range: 0x0012-0x0020
        Attribute type: Include (0x2802)
zephyr.exe[1628524]: < HCI Command: Host Number of Completed Packets (0x03|0x0035) plen 5                          #137 10.095091
        Num handles: 1
        Handle: 75 Address: DF:A9:FF:F6:B1:1A (OUI DF-A9-FF)
        Count: 1
zephyr.exe[1628524]: < ACL Data TX: Handle 75 flags 0x00 dlen 9                                                    #138 10.095131
      ATT: Error Response (0x01) len 4
        Read By Type Request (0x08)
        Handle: 0x0012
        Error: Attribute Not Found (0x0a)
> HCI Event: Number of Completed Packets (0x13) plen 5                                                             #139 10.263804
        Num handles: 1
        Handle: 75 Address: DF:A9:FF:F6:B1:1A (OUI DF-A9-FF)
        Count: 1
        #138: len 9 (0 Kb/s)
        Latency: 168 msec (78-248 msec ~172 msec)
> ACL Data RX: Handle 75 flags 0x02 dlen 11                                                                        #140 10.264058
      ATT: Read By Type Request (0x08) len 6
        Handle range: 0x0021-0x0023
        Attribute type: Include (0x2802)
zephyr.exe[1628524]: < HCI Command: Host Number of Completed Packets (0x03|0x0035) plen 5                          #141 10.275326
        Num handles: 1
        Handle: 75 Address: DF:A9:FF:F6:B1:1A (OUI DF-A9-FF)
        Count: 1
zephyr.exe[1628524]: < ACL Data TX: Handle 75 flags 0x00 dlen 9                                                    #142 10.275430
      ATT: Error Response (0x01) len 4
        Read By Type Request (0x08)
        Handle: 0x0021
        Error: Attribute Not Found (0x0a)
> HCI Event: Number of Completed Packets (0x13) plen 5                                                             #143 10.438885
        Num handles: 1
        Handle: 75 Address: DF:A9:FF:F6:B1:1A (OUI DF-A9-FF)
        Count: 1
        #142: len 9 (0 Kb/s)
        Latency: 163 msec (78-248 msec ~167 msec)
> ACL Data RX: Handle 75 flags 0x02 dlen 11                                                                        #144 10.439012
      ATT: Read By Type Request (0x08) len 6
        Handle range: 0x0034-0x0038
        Attribute type: Include (0x2802)
zephyr.exe[1628524]: < HCI Command: Host Number of Completed Packets (0x03|0x0035) plen 5                          #145 10.455016
        Num handles: 1
        Handle: 75 Address: DF:A9:FF:F6:B1:1A (OUI DF-A9-FF)
        Count: 1
zephyr.exe[1628524]: < ACL Data TX: Handle 75 flags 0x00 dlen 14                                                   #146 10.455059
      ATT: Read By Type Response (0x09) len 9
        Attribute data length: 8
        Attribute data list: 1 entry
        Handle: 0x0035
        Value: 240033004318
> HCI Event: Number of Completed Packets (0x13) plen 5                                                             #147 10.613779
        Num handles: 1
        Handle: 75 Address: DF:A9:FF:F6:B1:1A (OUI DF-A9-FF)
        Count: 1
        #146: len 14 (0 Kb/s)
        Latency: 158 msec (78-248 msec ~163 msec)
> ACL Data RX: Handle 75 flags 0x02 dlen 11                                                                        #148 10.614031
      ATT: Read By Type Request (0x08) len 6
        Handle range: 0x0036-0x0038
        Attribute type: Include (0x2802)
zephyr.exe[1628524]: < HCI Command: Host Number of Completed Packets (0x03|0x0035) plen 5                          #149 10.614828
        Num handles: 1
        Handle: 75 Address: DF:A9:FF:F6:B1:1A (OUI DF-A9-FF)
        Count: 1
zephyr.exe[1628524]: < ACL Data TX: Handle 75 flags 0x00 dlen 9                                                    #150 10.614876
      ATT: Error Response (0x01) len 4
        Read By Type Request (0x08)
        Handle: 0x0036
        Error: Attribute Not Found (0x0a)
> HCI Event: Number of Completed Packets (0x13) plen 5                                                             #151 10.788851
        Num handles: 1
        Handle: 75 Address: DF:A9:FF:F6:B1:1A (OUI DF-A9-FF)
        Count: 1
        #150: len 9 (0 Kb/s)
        Latency: 173 msec (78-248 msec ~168 msec)
> ACL Data RX: Handle 75 flags 0x02 dlen 11                                                                        #152 10.789046
      ATT: Read By Type Request (0x08) len 6
        Handle range: 0x0039-0x004b
        Attribute type: Include (0x2802)
zephyr.exe[1628524]: < HCI Command: Host Number of Completed Packets (0x03|0x0035) plen 5                          #153 10.795038
        Num handles: 1
        Handle: 75 Address: DF:A9:FF:F6:B1:1A (OUI DF-A9-FF)
        Count: 1
zephyr.exe[1628524]: < ACL Data TX: Handle 75 flags 0x00 dlen 9                                                    #154 10.795091
      ATT: Error Response (0x01) len 4
        Read By Type Request (0x08)
        Handle: 0x0039
        Error: Attribute Not Found (0x0a)
> HCI Event: Number of Completed Packets (0x13) plen 5                                                             #155 10.963837
        Num handles: 1
        Handle: 75 Address: DF:A9:FF:F6:B1:1A (OUI DF-A9-FF)
        Count: 1
        #154: len 9 (0 Kb/s)
        Latency: 168 msec (78-248 msec ~168 msec)
> ACL Data RX: Handle 75 flags 0x02 dlen 11                                                                        #156 10.963986
      ATT: Read By Type Request (0x08) len 6
        Handle range: 0x004c-0x005b
        Attribute type: Include (0x2802)
zephyr.exe[1628524]: < HCI Command: Host Number of Completed Packets (0x03|0x0035) plen 5                          #157 10.975375
        Num handles: 1
        Handle: 75 Address: DF:A9:FF:F6:B1:1A (OUI DF-A9-FF)
        Count: 1
zephyr.exe[1628524]: < ACL Data TX: Handle 75 flags 0x00 dlen 9                                                    #158 10.975427
      ATT: Error Response (0x01) len 4
        Read By Type Request (0x08)
        Handle: 0x004c
        Error: Attribute Not Found (0x0a)
> HCI Event: Number of Completed Packets (0x13) plen 5                                                             #159 11.226352
        Num handles: 1
        Handle: 75 Address: DF:A9:FF:F6:B1:1A (OUI DF-A9-FF)
        Count: 1
        #158: len 9 (0 Kb/s)
        Latency: 250 msec (78-250 msec ~209 msec)
> ACL Data RX: Handle 75 flags 0x02 dlen 11                                                                        #160 11.226605
      ATT: Read By Type Request (0x08) len 6
        Handle range: 0x0094-0x00a0
        Attribute type: Include (0x2802)
zephyr.exe[1628524]: < HCI Command: Host Number of Completed Packets (0x03|0x0035) plen 5                          #161 11.235450
        Num handles: 1
        Handle: 75 Address: DF:A9:FF:F6:B1:1A (OUI DF-A9-FF)
        Count: 1
zephyr.exe[1628524]: < ACL Data TX: Handle 75 flags 0x00 dlen 27                                                   #162 11.235531
zephyr.exe[1628524]: < ACL Data TX: Handle 75 flags 0x01 dlen 11                                                   #163 11.235731
      ATT: Read By Type Response (0x09) len 33
        Attribute data length: 8
        Attribute data list: 4 entries
        Handle: 0x0095
        Value: 5c0067004518
        Handle: 0x0096
        Value: 680073004518
        Handle: 0x0097
        Value: 740083004318
        Handle: 0x0098
        Value: 840093004318
> HCI Event: Number of Completed Packets (0x13) plen 5                                                             #164 11.314253
        Num handles: 1
        Handle: 75 Address: DF:A9:FF:F6:B1:1A (OUI DF-A9-FF)
        Count: 1
        #162: len 27 (2 Kb/s)
        Latency: 78 msec (78-250 msec ~144 msec)
> HCI Event: Number of Completed Packets (0x13) plen 5                                                             #165 11.401469
        Num handles: 1
        Handle: 75 Address: DF:A9:FF:F6:B1:1A (OUI DF-A9-FF)
        Count: 1
        #163: len 11 (0 Kb/s)
        Latency: 165 msec (78-250 msec ~154 msec)
> ACL Data RX: Handle 75 flags 0x02 dlen 11                                                                        #166 11.401477
      ATT: Read By Type Request (0x08) len 6
        Handle range: 0x0099-0x00a0
        Attribute type: Include (0x2802)
zephyr.exe[1628524]: < HCI Command: Host Number of Completed Packets (0x03|0x0035) plen 5                          #167 11.415470
        Num handles: 1
        Handle: 75 Address: DF:A9:FF:F6:B1:1A (OUI DF-A9-FF)
        Count: 1
zephyr.exe[1628524]: < ACL Data TX: Handle 75 flags 0x00 dlen 9                                                    #168 11.415589
      ATT: Error Response (0x01) len 4
        Read By Type Request (0x08)
        Handle: 0x0099
        Error: Attribute Not Found (0x0a)
> HCI Event: Number of Completed Packets (0x13) plen 5                                                             