Bluetooth monitor ver 5.72
= Note: Linux version 7.0.0-31-generic (x86_64)                        0.880660
= Note: Bluetooth subsystem version 2.22                               0.880662
= New Index: 00:00:00:00:00:00 (Primary,UART,hci1)              [hci1] 0.880663
= New Index: 48:5F:99:8E:E0:64 (Primary,USB,hci0)               [hci0] 0.880663
= Open Index: 00:00:00:00:00:00                                 [hci1] 1.023910
= Index Info: 00:00:00:00:00:00 (Nordic Semiconductor ASA)      [hci1] 1.023914
@ USER Open: main (privileged) version 2.22            {0x0001} [hci1] 1.023917
< HCI Command: Reset (0x03|0x0003) plen 0                    #1 [hci1] 1.024286
> HCI Event: Command Complete (0x0e) plen 4                  #2 [hci1] 1.024800
      Reset (0x03|0x0003) ncmd 1
        Status: Success (0x00)
< HCI Command: Read Local Supported... (0x04|0x0003) plen 0  #3 [hci1] 1.043893
> HCI Event: Command Complete (0x0e) plen 12                 #4 [hci1] 1.044405
      Read Local Supported Features (0x04|0x0003) ncmd 1
        Status: Success (0x00)
        Features: 0x00 0x00 0x00 0x00 0x60 0x00 0x00 0x00
          BR/EDR Not Supported
          LE Supported (Controller)
< HCI Command: Read Local Version In.. (0x04|0x0001) plen 0  #5 [hci1] 1.063868
> HCI Event: Command Complete (0x0e) plen 12                 #6 [hci1] 1.064354
      Read Local Version Information (0x04|0x0001) ncmd 1
        Status: Success (0x00)
        HCI version: Reserved (0x11) - Revision 12345 (0x3039)
        LMP version: Reserved (0x11) - Subversion 12345 (0x3039)
        Manufacturer: Nordic Semiconductor ASA (89)
< HCI Command: Read Local Supported... (0x04|0x0002) plen 0  #7 [hci1] 1.083910
> HCI Event: Command Complete (0x0e) plen 68                 #8 [hci1] 1.084947
      Read Local Supported Commands (0x04|0x0002) ncmd 1
        Status: Success (0x00)
        Commands: 115 entries
          Disconnect (Octet 0 - Bit 5)
          Read Remote Version Information (Octet 2 - Bit 7)
          Set Event Mask (Octet 5 - Bit 6)
          Reset (Octet 5 - Bit 7)
          Read Connection Accept Timeout (Octet 7 - Bit 2)
          Write Connection Accept Timeout (Octet 7 - Bit 3)
          Read Transmit Power Level (Octet 10 - Bit 2)
          Set Controller To Host Flow Control (Octet 10 - Bit 5)
          Host Buffer Size (Octet 10 - Bit 6)
          Host Number of Completed Packets (Octet 10 - Bit 7)
          Read Local Version Information (Octet 14 - Bit 3)
          Read Local Supported Features (Octet 14 - Bit 5)
          Read BD ADDR (Octet 15 - Bit 1)
          Read RSSI (Octet 15 - Bit 5)
          Set Event Mask Page 2 (Octet 22 - Bit 2)
          LE Set Event Mask (Octet 25 - Bit 0)
          LE Read Buffer Size (Octet 25 - Bit 1)
          LE Read Local Supported Features (Octet 25 - Bit 2)
          LE Set Random Address (Octet 25 - Bit 4)
          LE Set Advertising Parameters (Octet 25 - Bit 5)
          LE Read Advertising Channel TX Power (Octet 25 - Bit 6)
          LE Set Advertising Data (Octet 25 - Bit 7)
          LE Set Scan Response Data (Octet 26 - Bit 0)
          LE Set Advertise Enable (Octet 26 - Bit 1)
          LE Set Scan Parameters (Octet 26 - Bit 2)
          LE Set Scan Enable (Octet 26 - Bit 3)
          LE Create Connection (Octet 26 - Bit 4)
          LE Create Connection Cancel (Octet 26 - Bit 5)
          LE Read Accept List Size (Octet 26 - Bit 6)
          LE Clear Accept List (Octet 26 - Bit 7)
          LE Add Device To Accept List (Octet 27 - Bit 0)
          LE Remove Device From Accept List (Octet 27 - Bit 1)
          LE Connection Update (Octet 27 - Bit 2)
          LE Set Host Channel Classification (Octet 27 - Bit 3)
          LE Read Channel Map (Octet 27 - Bit 4)
          LE Read Remote Used Features (Octet 27 - Bit 5)
          LE Encrypt (Octet 27 - Bit 6)
          LE Rand (Octet 27 - Bit 7)
          LE Start Encryption (Octet 28 - Bit 0)
          LE Long Term Key Request Reply (Octet 28 - Bit 1)
          LE Long Term Key Request Neg Reply (Octet 28 - Bit 2)
          LE Read Supported States (Octet 28 - Bit 3)
          Read Authenticated Payload Timeout (Octet 32 - Bit 4)
          Write Authenticated Payload Timeout (Octet 32 - Bit 5)
          LE Set Data Length (Octet 33 - Bit 6)
          LE Read Suggested Default Data Length (Octet 33 - Bit 7)
          LE Write Suggested Default Data Length (Octet 34 - Bit 0)
          LE Add Device To Resolving List (Octet 34 - Bit 3)
          LE Remove Device From Resolving List (Octet 34 - Bit 4)
          LE Clear Resolving List (Octet 34 - Bit 5)
          LE Read Resolving List Size (Octet 34 - Bit 6)
          LE Set Address Resolution Enable (Octet 35 - Bit 1)
          LE Set Resolvable Private Address Timeout (Octet 35 - Bit 2)
          LE Read Maximum Data Length (Octet 35 - Bit 3)
          LE Read PHY (Octet 35 - Bit 4)
          LE Set Default PHY (Octet 35 - Bit 5)
          LE Set PHY (Octet 35 - Bit 6)
          LE Set Advertising Set Random Address (Octet 36 - Bit 1)
          LE Set Extended Advertising Parameters (Octet 36 - Bit 2)
          LE Set Extended Advertising Data (Octet 36 - Bit 3)
          LE Set Extended Scan Response Data (Octet 36 - Bit 4)
          LE Set Extended Advertising Enable (Octet 36 - Bit 5)
          LE Read Maximum Advertising Data Length (Octet 36 - Bit 6)
          LE Read Number of Supported Advertising Sets (Octet 36 - Bit 7)
          LE Remove Advertising Set (Octet 37 - Bit 0)
          LE Clear Advertising Sets (Octet 37 - Bit 1)
          LE Set Periodic Advertising Parameters (Octet 37 - Bit 2)
          LE Set Periodic Advertising Data (Octet 37 - Bit 3)
          LE Set Periodic Advertising Enable (Octet 37 - Bit 4)
          LE Set Extended Scan Parameters (Octet 37 - Bit 5)
          LE Set Extended Scan Enable (Octet 37 - Bit 6)
          LE Extended Create Connection (Octet 37 - Bit 7)
          LE Periodic Advertising Create Sync (Octet 38 - Bit 0)
          LE Periodic Advertising Create Sync Cancel (Octet 38 - Bit 1)
          LE Periodic Advertising Terminate Sync (Octet 38 - Bit 2)
          LE Add Device To Periodic Advertiser List (Octet 38 - Bit 3)
          LE Remove Device From Periodic Advertiser List (Octet 38 - Bit 4)
          LE Clear Periodic Advertiser List (Octet 38 - Bit 5)
          LE Read Periodic Advertiser List Size (Octet 38 - Bit 6)
          LE Read Transmit Power (Octet 38 - Bit 7)
          LE Read RF Path Compensation (Octet 39 - Bit 0)
          LE Write RF Path Compensation (Octet 39 - Bit 1)
          LE Set Privacy Mode (Octet 39 - Bit 2)
          LE Periodic Advertising Receive Enable (Octet 40 - Bit 5)
          LE Periodic Advertising Sync Transfer (Octet 40 - Bit 6)
          LE Periodic Advertising Set Info Transfer (Octet 40 - Bit 7)
          LE Periodic Advertising Sync Transfer Parameters (Octet 41 - Bit 0)
          LE Set Default Periodic Advertisng Sync Transfer Parameters (Octet 41 - Bit 1)
          LE Read Buffer v2 (Octet 41 - Bit 5)
          LE Read ISO TX Sync (Octet 41 - Bit 6)
          LE Set Connected Isochronous Group Parameters (Octet 41 - Bit 7)
          LE Set Connected Isochronous Group Parameters Test (Octet 42 - Bit 0)
          LE Create Connected Isochronous Stream (Octet 42 - Bit 1)
          LE Remove Connected Isochronous Group (Octet 42 - Bit 2)
          LE Accept Connected Isochronous Stream Request (Octet 42 - Bit 3)
          LE Reject Connected Isochronous Stream Request (Octet 42 - Bit 4)
          LE Create Broadcast Isochronous Group (Octet 42 - Bit 5)
          LE Create Broadcast Isochronous Group Test (Octet 42 - Bit 6)
          LE Terminate Broadcast Isochronous Group (Octet 42 - Bit 7)
          LE Broadcast Isochronous Group Create Sync (Octet 43 - Bit 0)
          LE Broadcast Isochronous Group Terminate Sync (Octet 43 - Bit 1)
          LE Request Peer SCA (Octet 43 - Bit 2)
          LE Setup Isochronous Data Path (Octet 43 - Bit 3)
          LE Remove Isochronous Data Path (Octet 43 - Bit 4)
          LE Isochronous Transmit Test (Octet 43 - Bit 5)
          LE Isochronous Receive Test (Octet 43 - Bit 6)
          LE Isochronous Read Test Counters (Octet 43 - Bit 7)
          LE Isochronous Read Test Counters (Octet 44 - Bit 0)
          LE Set Host Feature (Octet 44 - Bit 1)
          Octet 44 - Bit 2 
          Octet 45 - Bit 6 
          Octet 46 - Bit 0 
          Octet 46 - Bit 1 
          Octet 46 - Bit 2 
          Octet 47 - Bit 4 
< HCI Command: Host Buffer Size (0x03|0x0033) plen 7         #9 [hci1] 1.103896
        ACL MTU: 255  ACL max packet: 16
        SCO MTU: 0    SCO max packet: 0
> HCI Event: Command Complete (0x0e) plen 4                 #10 [hci1] 1.104308
      Host Buffer Size (0x03|0x0033) ncmd 1
        Status: Success (0x00)
< HCI Command: Set Controller To Ho.. (0x03|0x0031) plen 1  #11 [hci1] 1.123889
        Flow control: ACL Data Packets (0x01)
> HCI Event: Command Complete (0x0e) plen 4                 #12 [hci1] 1.124296
      Set Controller To Host Flow Control (0x03|0x0031) ncmd 1
        Status: Success (0x00)
< HCI Command: LE Read Local Suppor.. (0x08|0x0003) plen 0  #13 [hci1] 1.143926
> HCI Event: Command Complete (0x0e) plen 12                #14 [hci1] 1.144373
      LE Read Local Supported Features (0x08|0x0003) ncmd 1
        Status: Success (0x00)
        Features: 0xfd 0x79 0x00 0xf7 0x30 0x01 0x00 0x00
          LE Encryption
          Extended Reject Indication
          Peripheral-initiated Features Exchange
          LE Ping
          LE Data Packet Length Extension
          LL Privacy
          Extended Scanner Filter Policies
          LE 2M PHY
          LE Coded PHY
          LE Extended Advertising
          LE Periodic Advertising
          Channel Selection Algorithm #2
          Periodic Advertising Sync Transfer - Sender
          Periodic Advertising Sync Transfer - Recipient
          Sleep Clock Accuracy Updates
          Connected Isochronous Stream - Central
          Connected Isochronous Stream - Peripheral
          Isochronous Broadcaster
          Synchronized Receiver
          Periodic Advertising ADI support
          Connection Subrating
          Unknown features (0x0000010000000000)
< HCI Command: LE Set Host Feature (0x08|0x0074) plen 2     #15 [hci1] 1.163910
        Bit Number: 32
          Connected Isochronous Stream (Host Support)
        Bit Value: 1
> HCI Event: Command Complete (0x0e) plen 4                 #16 [hci1] 1.164391
      LE Set Host Feature (0x08|0x0074) ncmd 1
        Status: Success (0x00)
< HCI Command: LE Read Buffer v2 (0x08|0x0060) plen 0       #17 [hci1] 1.183898
> HCI Event: Command Complete (0x0e) plen 10                #18 [hci1] 1.184366
      LE Read Buffer v2 (0x08|0x0060) ncmd 1
        Status: Success (0x00)
        ACL MTU: 27
        ACL max packet: 3
        ISO MTU: 318
        ISO max packet: 3
< HCI Command: LE Read Maximum Adve.. (0x08|0x003a) plen 0  #19 [hci1] 1.203929
> HCI Event: Command Complete (0x0e) plen 6                 #20 [hci1] 1.204327
      LE Read Maximum Advertising Data Length (0x08|0x003a) ncmd 1
        Status: Success (0x00)
        Max length: 1650
< HCI Command: LE Read Supported St.. (0x08|0x001c) plen 0  #21 [hci1] 1.223904
> HCI Event: Command Complete (0x0e) plen 12                #22 [hci1] 1.224366
      LE Read Supported States (0x08|0x001c) ncmd 1
        Status: Success (0x00)
        States: 0x000003ff3e0306ff
          Non-connectable Advertising State
          Scannable Advertising State
          Connectable Advertising State
          High Duty Cycle Directed Advertising State
          Passive Scanning State
          Active Scanning State
          Initiating State
            and Connection State (Central Role)
          Connection State (Peripheral Role)
          Scannable Advertising State
            and Passive Scanning State
          Connectable Advertising State
            and Passive Scanning State
          Non-connectable Advertising State
            and Initiating State
          Scannable Advertising State
            and Initiating State
          Active Scanning State
            and Connection State (Central Role)
          Passive Scanning State
            and Connection State (Peripheral Role)
          Active Scanning State
            and Connection State (Peripheral Role)
          Initiating State
            and Connection State (Central Role)
            and Central Role & Central Role
          Low Duty Cycle Directed Advertising State
          Connectable Advertising State
            and Initiating State
            and Central Role & Peripheral Role
          High Duty Cycle Directed Advertising State
            and Initiating State
            and Central Role & Peripheral Role
          Low Duty Cycle Directed Advertising State
            and Initiating State
            and Central Role & Peripheral Role
          Connectable Advertising State
            and Connection State (Central Role)
            and Central Role & Peripheral Role
          High Duty Cycle Directed Advertising State
            and Connection State (Central Role)
            and Central Role & Peripheral Role
          Low Duty Cycle Directed Advertising State
            and Connection State (Central Role)
            and Central Role & Peripheral Role
          Connectable Advertising State
            and Connection State (Peripheral Role)
            and Central Role & Peripheral Role
          High Duty Cycle Directed Advertising State
            and Connection State (Peripheral Role)
            and Peripheral Role & Peripheral Role
          Low Duty Cycle Directed Advertising State
            and Connection State (Peripheral Role)
            and Peripheral Role & Peripheral Role
          Initiating State
            and Connection State (Peripheral Role)
            and Central Role & Peripheral Role
< HCI Command: LE Read Maximum Data.. (0x08|0x002f) plen 0  #23 [hci1] 1.243895
> HCI Event: Command Complete (0x0e) plen 12                #24 [hci1] 1.244344
      LE Read Maximum Data Length (0x08|0x002f) ncmd 1
        Status: Success (0x00)
        Max TX octets: 251
        Max TX time: 2704
        Max RX octets: 251
        Max RX time: 2704
< HCI Command: LE Write Suggested D.. (0x08|0x0024) plen 4  #25 [hci1] 1.263894
        TX octets: 251
        TX time: 2704
> HCI Event: Command Complete (0x0e) plen 4                 #26 [hci1] 1.264312
      LE Write Suggested Default Data Length (0x08|0x0024) ncmd 1
        Status: Success (0x00)
< HCI Command: LE Set Resolvable Pr.. (0x08|0x002e) plen 2  #27 [hci1] 1.283885
        Timeout: 30 seconds
> HCI Event: Command Complete (0x0e) plen 4                 #28 [hci1] 1.284318
      LE Set Resolvable Private Address Timeout (0x08|0x002e) ncmd 1
        Status: Success (0x00)
< HCI Command: LE Read Resolving Li.. (0x08|0x002a) plen 0  #29 [hci1] 1.303909
> HCI Event: Command Complete (0x0e) plen 5                 #30 [hci1] 1.304374
      LE Read Resolving List Size (0x08|0x002a) ncmd 1
        Status: Success (0x00)
        Size: 8
< HCI Command: LE Set Host Feature (0x08|0x0074) plen 2     #31 [hci1] 1.323911
        Bit Number: 38
          Connection Subrating (Host Support)
        Bit Value: 1
> HCI Event: Command Complete (0x0e) plen 4                 #32 [hci1] 1.324317
      LE Set Host Feature (0x08|0x0074) ncmd 1
        Status: Success (0x00)
< HCI Command: LE Set Event Mask (0x08|0x0001) plen 8       #33 [hci1] 1.343907
        Mask: 0x000002063f87fa5e
          LE Advertising Report
          LE Connection Update Complete
          LE Read Remote Used Features Complete
          LE Long Term Key Request
          LE Data Length Change
          LE Enhanced Connection Complete
          LE PHY Update Complete
          LE Extended Advertising Report
          LE Periodic Advertising Sync Established
          LE Periodic Advertising Report
          LE Periodic Advertising Sync Lost
          LE Extended Scan Timeout
          LE Extended Advertising Set Terminated
          LE Scan Request Received
          LE Periodic Advertising Sync Transfer Rvc
          LE CIS Established
          LE CIS Request
          LE Create BIG Complete
          LE Terminate BIG Complete
          LE BIG Sync Estabilished Complete
          LE BIG Sync Lost
          LE BIG Info Advertising Report
          LE Subrate Change
          Unknown mask (0x0000020000000000)
> HCI Event: Command Complete (0x0e) plen 4                 #34 [hci1] 1.344386
      LE Set Event Mask (0x08|0x0001) ncmd 1
        Status: Success (0x00)
< HCI Command: Set Event Mask (0x03|0x0001) plen 8          #35 [hci1] 1.363893
        Mask: 0x2000800002008890
          Disconnection Complete
          Encryption Change
          Read Remote Version Information Complete
          Hardware Error
          Data Buffer Overflow
          Encryption Key Refresh Complete
          LE Meta
> HCI Event: Command Complete (0x0e) plen 4                 #36 [hci1] 1.364316
      Set Event Mask (0x03|0x0001) ncmd 1
        Status: Success (0x00)
< HCI Command: Read BD ADDR (0x04|0x0009) plen 0            #37 [hci1] 1.383902
> HCI Event: Command Complete (0x0e) plen 10                #38 [hci1] 1.384302
      Read BD ADDR (0x04|0x0009) ncmd 1
        Status: Success (0x00)
        Address: 00:00:00:00:00:00 (OUI 00-00-00)
< HCI Command: LE Set Random Address (0x08|0x0005) plen 6   #39 [hci1] 1.403910
        Address: D5:B6:CC:31:DB:3B (Static)
> HCI Event: Command Complete (0x0e) plen 4                 #40 [hci1] 1.404380
      LE Set Random Address (0x08|0x0005) ncmd 1
        Status: Success (0x00)
< HCI Command: LE Set Random Address (0x08|0x0005) plen 6   #41 [hci1] 1.493965
        Address: 48:61:8E:DB:C6:F9 (Resolvable)
> HCI Event: Command Complete (0x0e) plen 4                 #42 [hci1] 1.494537
      LE Set Random Address (0x08|0x0005) ncmd 1
        Status: Success (0x00)
< HCI Command: LE Set Extended Adv.. (0x08|0x0036) plen 25  #43 [hci1] 3.843973
        Handle: 0x00
        Properties: 0x0013
          Connectable
          Scannable
          Use legacy advertising PDUs: ADV_IND
        Min advertising interval: 100.000 msec (0x00a0)
        Max advertising interval: 150.000 msec (0x00f0)
        Channel map: 37, 38, 39 (0x07)
        Own address type: Random (0x01)
        Peer address type: Public (0x00)
        Peer address: 00:00:00:00:00:00 (OUI 00-00-00)
        Filter policy: Allow Scan Request from Any, Allow Connect Request from Any (0x00)
        TX power: Host has no preference (0x7f)
        Primary PHY: LE 1M (0x01)
        Secondary max skip: 0x00
        Secondary PHY: LE 1M (0x01)
        SID: 0x00
        Scan request notifications: Disabled (0x00)
> HCI Event: Command Complete (0x0e) plen 5                 #44 [hci1] 3.844719
      LE Set Extended Advertising Parameters (0x08|0x0036) ncmd 1
        Status: Success (0x00)
        TX power (selected): 0 dbm (0x00)
< HCI Command: LE Set Advertising S.. (0x08|0x0035) plen 7  #45 [hci1] 3.863965
        Advertising handle: 0x00
        Advertising random address: 48:61:8E:DB:C6:F9 (Resolvable)
> HCI Event: Command Complete (0x0e) plen 4                 #46 [hci1] 3.864452
      LE Set Advertising Set Random Address (0x08|0x0035) ncmd 1
        Status: Success (0x00)
< HCI Command: LE Set Extended Adv.. (0x08|0x0037) plen 15  #47 [hci1] 3.883924
        Handle: 0x00
        Operation: Complete extended advertising data (0x03)
        Fragment preference: Minimize fragmentation (0x01)
        Data length: 0x0b
        Flags: 0x06
          LE General Discoverable Mode
          BR/EDR Not Supported
        Resolvable Set Identifier: 46-5C-55-EA-DD-14
          Hash: 0xeadd14
          Random: 0x465c55
> HCI Event: Command Complete (0x0e) plen 4                 #48 [hci1] 3.884572
      LE Set Extended Advertising Data (0x08|0x0037) ncmd 1
        Status: Success (0x00)
< HCI Command: LE Set Extended Scan.. (0x08|0x0038) plen 4  #49 [hci1] 3.903965
        Handle: 0x00
        Operation: Complete scan response data (0x03)
        Fragment preference: Minimize fragmentation (0x01)
        Data length: 0x00
> HCI Event: Command Complete (0x0e) plen 4                 #50 [hci1] 3.904416
      LE Set Extended Scan Response Data (0x08|0x0038) ncmd 1
        Status: Success (0x00)
< HCI Command: LE Set Extended Adve.. (0x08|0x0039) plen 6  #51 [hci1] 3.923982
        Extended advertising: Enabled (0x01)
        Number of sets: 1 (0x01)
        Entry 0
          Handle: 0x00
          Duration: 0 ms (0x00)
          Max ext adv events: 0
> HCI Event: Command Complete (0x0e) plen 4                 #52 [hci1] 3.924520
      LE Set Extended Advertising Enable (0x08|0x0039) ncmd 1
        Status: Success (0x00)
> HCI Event: LE Meta Event (0x3e) plen 31                   #53 [hci1] 4.241268
      LE Enhanced Connection Complete (0x0a)
        Status: Success (0x00)
        Handle: 903
        Role: Peripheral (0x01)
        Peer address type: Public (0x00)
        Peer address: DF:A9:FF:F6:B1:1A (OUI DF-A9-FF)
        Local resolvable private address: 00:00:00:00:00:00 (Non-Resolvable)
        Peer resolvable private address: 00:00:00:00:00:00 (Non-Resolvable)
        Connection interval: 87.50 msec (0x0046)
        Connection latency: 0 (0x0000)
        Supervision timeout: 25120 msec (0x09d0)
        Central clock accuracy: 0x01
> HCI Event: LE Meta Event (0x3e) plen 6                    #54 [hci1] 4.241404
      LE Advertising Set Terminated (0x12)
        Status: Success (0x00)
        Handle: 0
        Connection handle: 903
        Number of completed extended advertising events: 0
< HCI Command: LE Read Remote Used... (0x08|0x0016) plen 2  #55 [hci1] 4.244537
        Handle: 903 Address: DF:A9:FF:F6:B1:1A (OUI DF-A9-FF)
< ACL Data TX: Handle 903 flags 0x00 dlen 7                 #56 [hci1] 4.244559
      ATT: Exchange MTU Request (0x02) len 2
        Client RX MTU: 251
> HCI Event: Command Status (0x0f) plen 4                   #57 [hci1] 4.245130
      LE Read Remote Used Features (0x08|0x0016) ncmd 1
        Status: Success (0x00)
> HCI Event: Number of Completed Packets (0x13) plen 5      #58 [hci1] 4.417276
        Num handles: 1
        Handle: 903 Address: DF:A9:FF:F6:B1:1A (OUI DF-A9-FF)
        Count: 1
        #56: len 7 (0 Kb/s)
        Latency: 172 msec (172-172 msec ~172 msec)
> HCI Event: LE Meta Event (0x3e) plen 12                   #59 [hci1] 4.505223
      LE Read Remote Used Features (0x04)
        Status: Success (0x00)
        Handle: 903 Address: DF:A9:FF:F6:B1:1A (OUI DF-A9-FF)
        Features: 0x2d 0x49 0x00 0xf7 0x67 0xd9 0x00 0x80
          LE Encryption
          Extended Reject Indication
          Peripheral-initiated Features Exchange
          LE Data Packet Length Extension
          LE 2M PHY
          LE Coded PHY
          Channel Selection Algorithm #2
          Periodic Advertising Sync Transfer - Sender
          Periodic Advertising Sync Transfer - Recipient
          Sleep Clock Accuracy Updates
          Connected Isochronous Stream - Central
          Connected Isochronous Stream - Peripheral
          Isochronous Broadcaster
          Synchronized Receiver
          Connected Isochronous Stream (Host Support)
          LE Power Control Request
          LE Power Control Request
          Connection Subrating
          Connection Subrating (Host Support)
          Unknown features (0x8000d90000000000)
> ACL Data RX: Handle 903 flags 0x02 dlen 11                #60 [hci1] 6.954873
      SMP: Pairing Request (0x01) len 6
        IO capability: KeyboardDisplay (0x04)
        OOB data: Authentication data not present (0x00)
        Authentication requirement: Bonding, No MITM, SC, No Keypresses (0x09)
        Max encryption key size: 16
        Initiator key distribution: EncKey IdKey Sign (0x07)
        Responder key distribution: EncKey IdKey Sign (0x07)
> ACL Data RX: Handle 903 flags 0x02 dlen 7                 #61 [hci1] 6.955336
      ATT: Exchange MTU Response (0x03) len 2
        Server RX MTU: 23
< HCI Command: Host Number of Compl.. (0x03|0x0035) plen 5  #62 [hci1] 6.964450
        Num handles: 1
        Handle: 903 Address: DF:A9:FF:F6:B1:1A (OUI DF-A9-FF)
        Count: 1
< ACL Data TX: Handle 903 flags 0x00 dlen 11                #63 [hci1] 6.964649
      SMP: Pairing Response (0x02) len 6
        IO capability: NoInputNoOutput (0x03)
        OOB data: Authentication data not present (0x00)
        Authentication requirement: Bonding, No MITM, SC, No Keypresses (0x09)
        Max encryption key size: 16
        Initiator key distribution: IdKey (0x02)
        Responder key distribution: IdKey (0x02)
< HCI Command: Host Number of Compl.. (0x03|0x0035) plen 5  #64 [hci1] 6.965017
        Num handles: 1
        Handle: 903 Address: DF:A9:FF:F6:B1:1A (OUI DF-A9-FF)
        Count: 1
> HCI Event: Number of Completed Packets (0x13) plen 5      #65 [hci1] 7.129931
        Num handles: 1
        Handle: 903 Address: DF:A9:FF:F6:B1:1A (OUI DF-A9-FF)
        Count: 1
        #63: len 11 (0 Kb/s)
        Latency: 165 msec (165-172 msec ~168 msec)
> ACL Data RX: Handle 903 flags 0x02 dlen 27                #66 [hci1] 7.130278
> ACL Data RX: Handle 903 flags 0x01 dlen 27                #67 [hci1] 7.130796
> ACL Data RX: Handle 903 flags 0x01 dlen 15                #68 [hci1] 7.131331
      SMP: Pairing Public Key (0x0c) len 64
        X: 1505ffa91ef02c5d4ab4ce342fa81304b4e64e2159af226c0d4bdca776cbdef1
        Y: 516ab9671820b79a9762addc70e6f6802cdbd44e02bcf105dbecde491add7036
< HCI Command: Host Number of Compl.. (0x03|0x0035) plen 5  #69 [hci1] 7.144452
        Num handles: 1
        Handle: 903 Address: DF:A9:FF:F6:B1:1A (OUI DF-A9-FF)
        Count: 1
< HCI Command: Host Number of Compl.. (0x03|0x0035) plen 5  #70 [hci1] 7.144605
        Num handles: 1
        Handle: 903 Address: DF:A9:FF:F6:B1:1A (OUI DF-A9-FF)
        Count: 1
< HCI Command: Host Number of Compl.. (0x03|0x0035) plen 5  #71 [hci1] 7.144776
        Num handles: 1
        Handle: 903 Address: DF:A9:FF:F6:B1:1A (OUI DF-A9-FF)
        Count: 1
< ACL Data TX: Handle 903 flags 0x00 dlen 27                #72 [hci1] 7.144848
< ACL Data TX: Handle 903 flags 0x01 dlen 27                #73 [hci1] 7.144865
< ACL Data TX: Handle 903 flags 0x01 dlen 15                #74 [hci1] 7.144868
      SMP: Pairing Public Key (0x0c) len 64
        X: 68f6ada634ce84d11617383d57f070fe3445c38b33b569efa5eb771a0dc8aea5
        Y: 83c407aaa8337331fdc418e55085d75e6c1c6e5d42f8bf9c18fb5a2a7d4f31aa
> HCI Event: Number of Completed Packets (0x13) plen 5      #75 [hci1] 7.217814
        Num handles: 1
        Handle: 903 Address: DF:A9:FF:F6:B1:1A (OUI DF-A9-FF)
        Count: 1
        #72: len 27 (3 Kb/s)
        Latency: 72 msec (72-172 msec ~120 msec)
> HCI Event: Number of Completed Packets (0x13) plen 5      #76 [hci1] 7.218573
        Num handles: 1
        Handle: 903 Address: DF:A9:FF:F6:B1:1A (OUI DF-A9-FF)
        Count: 1
        #73: len 27 (2 Kb/s)
        Latency: 73 msec (72-172 msec ~97 msec)
< ACL Data TX: Handle 903 flags 0x00 dlen 21                #77 [hci1] 7.224115
      SMP: Pairing Confirm (0x03) len 16
        Confim value: 41d67531829058caad2fd68475592bb8
> HCI Event: Number of Completed Packets (0x13) plen 5      #78 [hci1] 7.304674
        Num handles: 1
        Handle: 903 Address: DF:A9:FF:F6:B1:1A (OUI DF-A9-FF)
        Count: 1
        #74: len 15 (0 Kb/s)
        Latency: 159 msec (72-172 msec ~128 msec)
> HCI Event: Number of Completed Packets (0x13) plen 5      #79 [hci1] 7.392365
        Num handles: 1
        Handle: 903 Address: DF:A9:FF:F6:B1:1A (OUI DF-A9-FF)
        Count: 1
        #77: len 21 (1 Kb/s)
        Latency: 168 msec (72-172 msec ~148 msec)
> ACL Data RX: Handle 903 flags 0x02 dlen 21                #80 [hci1] 7.392699
      SMP: Pairing Random (0x04) len 16
        Random value: 915519fa56d943830000000000000000
< HCI Command: Host Number of Compl.. (0x03|0x0035) plen 5  #81 [hci1] 7.404192
        Num handles: 1
        Handle: 903 Address: DF:A9:FF:F6:B1:1A (OUI DF-A9-FF)
        Count: 1
< ACL Data TX: Handle 903 flags 0x00 dlen 21                #82 [hci1] 7.404213
      SMP: Pairing Random (0x04) len 16
        Random value: 4d02679f89a05211af56d8b3da64d21e
> HCI Event: Number of Completed Packets (0x13) plen 5      #83 [hci1] 7.567258
        Num handles: 1
        Handle: 903 Address: DF:A9:FF:F6:B1:1A (OUI DF-A9-FF)
        Count: 1
        #82: len 21 (1 Kb/s)
        Latency: 163 msec (72-172 msec ~155 msec)
> ACL Data RX: Handle 903 flags 0x02 dlen 21                #84 [hci1] 7.742593
      SMP: Pairing DHKey Check (0x0d) len 16
        E: 641abad8da17ee6d54e3f4ad812f4413
< HCI Command: Host Number of Compl.. (0x03|0x0035) plen 5  #85 [hci1] 7.744124
        Num handles: 1
        Handle: 903 Address: DF:A9:FF:F6:B1:1A (OUI DF-A9-FF)
        Count: 1
< ACL Data TX: Handle 903 flags 0x00 dlen 21                #86 [hci1] 7.744224
      SMP: Pairing DHKey Check (0x0d) len 16
        E: ad88d5e43ba91def5f8de13ee97f27b6
> HCI Event: Number of Completed Packets (0x13) plen 5      #87 [hci1] 7.917225
        Num handles: 1
        Handle: 903 Address: DF:A9:FF:F6:B1:1A (OUI DF-A9-FF)
        Count: 1
        #86: len 21 (0 Kb/s)
        Latency: 173 msec (72-173 msec ~164 msec)
> HCI Event: LE Meta Event (0x3e) plen 13                   #88 [hci1] 8.005268
      LE Long Term Key Request (0x05)
        Handle: 903 Address: DF:A9:FF:F6:B1:1A (OUI DF-A9-FF)
        Random number: 0x0000000000000000
        Encrypted diversifier: 0x0000
< HCI Command: LE Long Term Key Re.. (0x08|0x001a) plen 18  #89 [hci1] 8.024240
        Handle: 903 Address: DF:A9:FF:F6:B1:1A (OUI DF-A9-FF)
        Long term key: 920bcc438859da58bc971fcc97b43dc2
> HCI Event: Command Complete (0x0e) plen 6                 #90 [hci1] 8.025020
      LE Long Term Key Request Reply (0x08|0x001a) ncmd 1
        Status: Success (0x00)
        Handle: 903 Address: DF:A9:FF:F6:B1:1A (OUI DF-A9-FF)
> HCI Event: Encryption Change (0x08) plen 4                #91 [hci1] 8.442410
        Status: Success (0x00)
        Handle: 903 Address: DF:A9:FF:F6:B1:1A (OUI DF-A9-FF)
        Encryption: Enabled with AES-CCM (0x01)
< ACL Data TX: Handle 903 flags 0x00 dlen 21                #92 [hci1] 8.554125
      SMP: Identity Information (0x08) len 16
        Identity resolving key: 08aad2e1be87e47b88aeb19de6889efb
< ACL Data TX: Handle 903 flags 0x00 dlen 12                #93 [hci1] 8.554135
      SMP: Identity Address Information (0x09) len 7
        Address: D5:B6:CC:31:DB:3B (Static)
> HCI Event: Number of Completed Packets (0x13) plen 5      #94 [hci1] 8.617836
        Num handles: 1
        Handle: 903 Address: DF:A9:FF:F6:B1:1A (OUI DF-A9-FF)
        Count: 1
        #92: len 21 (2 Kb/s)
        Latency: 63 msec (63-173 msec ~114 msec)
> HCI Event: Number of Completed Packets (0x13) plen 5      #95 [hci1] 8.704972
        Num handles: 1
        Handle: 903 Address: DF:A9:FF:F6:B1:1A (OUI DF-A9-FF)
        Count: 1
        #93: len 12 (0 Kb/s)
        Latency: 150 msec (63-173 msec ~132 msec)
> ACL Data RX: Handle 903 flags 0x02 dlen 21                #96 [hci1] 8.705200
      SMP: Identity Information (0x08) len 16
        Identity resolving key: 07e4cd44397bc75e13b6fb4fd9d7767f
> ACL Data RX: Handle 903 flags 0x02 dlen 12                #97 [hci1] 8.705507
      SMP: Identity Address Information (0x09) len 7
        Address: DF:A9:FF:F6:B1:1A (OUI DF-A9-FF)
> ACL Data RX: Handle 903 flags 0x02 dlen 11                #98 [hci1] 8.706120
      ATT: Read By Group Type Request (0x10) len 6
        Handle range: 0x0001-0xffff
        Attribute group type: Primary Service (0x2800)
< HCI Command: Host Number of Compl.. (0x03|0x0035) plen 5  #99 [hci1] 8.724227
        Num handles: 1
        Handle: 903 Address: DF:A9:FF:F6:B1:1A (OUI DF-A9-FF)
        Count: 1
< HCI Command: LE Add Device To R.. (0x08|0x0027) plen 39  #100 [hci1] 8.724317
        Address type: Public (0x00)
        Address: DF:A9:FF:F6:B1:1A (OUI DF-A9-FF)
        Peer identity resolving key: 07e4cd44397bc75e13b6fb4fd9d7767f
        Local identity resolving key: 08aad2e1be87e47b88aeb19de6889efb
> HCI Event: Command Complete (0x0e) plen 4                #101 [hci1] 8.725224
      LE Add Device To Resolving List (0x08|0x0027) ncmd 1
        Status: Success (0x00)
< HCI Command: LE Set Privacy Mode (0x08|0x004e) plen 8    #102 [hci1] 8.744068
        Peer Identity address type: Public (0x00)
        Peer Identity address: DF:A9:FF:F6:B1:1A (OUI DF-A9-FF)
        Privacy Mode: Use Device Privacy (0x01)
> HCI Event: Command Complete (0x0e) plen 4                #103 [hci1] 8.744668
      LE Set Privacy Mode (0x08|0x004e) ncmd 1
        Status: Success (0x00)
< HCI Command: LE Set Address Reso.. (0x08|0x002d) plen 1  #104 [hci1] 8.764255
        Address resolution: Enabled (0x01)
> HCI Event: Command Complete (0x0e) plen 4                #105 [hci1] 8.764675
      LE Set Address Resolution Enable (0x08|0x002d) ncmd 1
        Status: Success (0x00)
< HCI Command: Host Number of Comp.. (0x03|0x0035) plen 5  #106 [hci1] 8.784270
        Num handles: 1
        Handle: 903 Address: DF:A9:FF:F6:B1:1A (OUI DF-A9-FF)
        Count: 1
< ACL Data TX: Handle 903 flags 0x00 dlen 11               #107 [hci1] 8.784350
      ATT: Read By Type Request (0x08) len 6
        Handle range: 0x0001-0xffff
        Attribute type: Central Address Resolution (0x2aa6)
< HCI Command: Host Number of Comp.. (0x03|0x0035) plen 5  #108 [hci1] 8.784804
        Num handles: 1
        Handle: 903 Address: DF:A9:FF:F6:B1:1A (OUI DF-A9-FF)
        Count: 1
< ACL Data TX: Handle 903 flags 0x00 dlen 24               #109 [hci1] 8.784864
      ATT: Read By Group Type Response (0x11) len 19
        Attribute data length: 6
        Attribute group list: 3 entries
        Handle range: 0x0001-0x000a
        UUID: Generic Attribute Profile (0x1801)
        Handle range: 0x000b-0x0013
        UUID: Generic Access Profile (0x1800)
        Handle range: 0x0014-0x0028
        UUID: Device Information (0x180a)
> HCI Event: Number of Completed Packets (0x13) plen 5     #110 [hci1] 8.792708
        Num handles: 1
        Handle: 903 Address: DF:A9:FF:F6:B1:1A (OUI DF-A9-FF)
        Count: 1
        #107: len 11 (11 Kb/s)
        Latency: 8 msec (8-173 msec ~70 msec)
> HCI Event: Number of Completed Packets (0x13) plen 5     #111 [hci1] 8.879870
        Num handles: 1
        Handle: 903 Address: DF:A9:FF:F6:B1:1A (OUI DF-A9-FF)
        Count: 1
        #109: len 24 (2 Kb/s)
        Latency: 95 msec (8-173 msec ~82 msec)
> ACL Data RX: Handle 903 flags 0x02 dlen 9                #112 [hci1] 8.880020
      ATT: Read By Type Response (0x09) len 4
        Attribute data length: 3
        Attribute data list: 1 entry
        Handle: 0x000f
        Value: 01
> ACL Data RX: Handle 903 flags 0x02 dlen 11               #113 [hci1] 8.880471
      ATT: Read By Group Type Request (0x10) len 6
        Handle range: 0x0029-0xffff
        Attribute group type: Primary Service (0x2800)
< HCI Command: Host Number of Comp.. (0x03|0x0035) plen 5  #114 [hci1] 8.884206
        Num handles: 1
        Handle: 903 Address: DF:A9:FF:F6:B1:1A (OUI DF-A9-FF)
        Count: 1
< HCI Command: Host Number of Comp.. (0x03|0x0035) plen 5  #115 [hci1] 8.884353
        Num handles: 1
        Handle: 903 Address: DF:A9:FF:F6:B1:1A (OUI DF-A9-FF)
        Count: 1
< ACL Data TX: Handle 903 flags 0x00 dlen 18               #116 [hci1] 8.884372
      ATT: Read By Group Type Response (0x11) len 13
        Attribute data length: 6
        Attribute group list: 2 entries
        Handle range: 0x0029-0x002b
        UUID: Immediate Alert (0x1802)
        Handle range: 0x002c-0x0037
        UUID: Coordinated Set Identification (0x1846)
> HCI Event: Number of Completed Packets (0x13) plen 5     #117 [hci1] 9.054850
        Num handles: 1
        Handle: 903 Address: DF:A9:FF:F6:B1:1A (OUI DF-A9-FF)
        Count: 1
        #116: len 18 (0 Kb/s)
        Latency: 170 msec (8-173 msec ~126 msec)
> ACL Data RX: Handle 903 flags 0x02 dlen 11               #118 [hci1] 9.055095
      ATT: Read By Group Type Request (0x10) len 6
        Handle range: 0x0038-0xffff
        Attribute group type: Primary Service (0x2800)
< HCI Command: Host Number of Comp.. (0x03|0x0035) plen 5  #119 [hci1] 9.064724
        Num handles: 1
        Handle: 903 Address: DF:A9:FF:F6:B1:1A (OUI DF-A9-FF)
        Count: 1
< ACL Data TX: Handle 903 flags 0x00 dlen 9                #120 [hci1] 9.065010
      ATT: Error Response (0x01) len 4
        Read By Group Type Request (0x10)
        Handle: 0x0038
        Error: Attribute Not Found (0x0a)
> HCI Event: Number of Completed Packets (0x13) plen 5     #121 [hci1] 9.229911
        Num handles: 1
        Handle: 903 Address: DF:A9:FF:F6:B1:1A (OUI DF-A9-FF)
        Count: 1
        #120: len 9 (0 Kb/s)
        Latency: 164 msec (8-173 msec ~145 msec)
> ACL Data RX: Handle 903 flags 0x02 dlen 11               #122 [hci1] 9.230081
      ATT: Read By Type Request (0x08) len 6
        Handle range: 0x0001-0x000a
        Attribute type: Characteristic (0x2803)
< HCI Command: Host Number of Comp.. (0x03|0x0035) plen 5  #123 [hci1] 9.244182
        Num handles: 1
        Handle: 903 Address: DF:A9:FF:F6:B1:1A (OUI DF-A9-FF)
        Count: 1
< ACL Data TX: Handle 903 flags 0x00 dlen 20               #124 [hci1] 9.244247
      ATT: Read By Type Response (0x09) len 15
        Attribute data length: 7
        Attribute data list: 2 entries
        Handle: 0x0002
        Value: 200300052a
            Properties: 0x20
              Indicate (0x20)
            Value Handle: 0x0003
            Value UUID: Service Changed (0x2a05)
        Handle: 0x0005
        Value: 0a0600292b
            Properties: 0x0a
              Read (0x02)
              Write (0x08)
            Value Handle: 0x0006
            Value UUID: Client Supported Features (0x2b29)
> HCI Event: Number of Completed Packets (0x13) plen 5     #125 [hci1] 9.404881
        Num handles: 1
        Handle: 903 Address: DF:A9:FF:F6:B1:1A (OUI DF-A9-FF)
        Count: 1
        #124: len 20 (1 Kb/s)
        Latency: 160 msec (8-173 msec ~153 msec)
> ACL Data RX: Handle 903 flags 0x02 dlen 11               #126 [hci1] 9.405059
      ATT: Read By Type Request (0x08) len 6
        Handle range: 0x0006-0x000a
        Attribute type: Characteristic (0x2803)
< HCI Command: Host Number of Comp.. (0x03|0x0035) plen 5  #127 [hci1] 9.424313
        Num handles: 1
        Handle: 903 Address: DF:A9:FF:F6:B1:1A (OUI DF-A9-FF)
        Count: 1
< ACL Data TX: Handle 903 flags 0x00 dlen 20               #128 [hci1] 9.424420
      ATT: Read By Type Response (0x09) len 15
        Attribute data length: 7
        Attribute data list: 2 entries
        Handle: 0x0007
        Value: 0208002a2b
            Properties: 0x02
              Read (0x02)
            Value Handle: 0x0008
            Value UUID: Database Hash (0x2b2a)
        Handle: 0x0009
        Value: 020a003a2b
            Properties: 0x02
              Read (0x02)
            Value Handle: 0x000a
            Value UUID: Server Supported Features (0x2b3a)
> HCI Event: Number of Completed Packets (0x13) plen 5     #129 [hci1] 9.579816
        Num handles: 1
        Handle: 903 Address: DF:A9:FF:F6:B1:1A (OUI DF-A9-FF)
        Count: 1
        #128: len 20 (1 Kb/s)
        Latency: 155 msec (8-173 msec ~154 msec)
> ACL Data RX: Handle 903 flags 0x02 dlen 11               #130 [hci1] 9.580056
      ATT: Read By Type Request (0x08) len 6
        Handle range: 0x000a-0x000a
        Attribute type: Characteristic (0x2803)
< HCI Command: Host Number of Comp.. (0x03|0x0035) plen 5  #131 [hci1] 9.584559
        Num handles: 1
        Handle: 903 Address: DF:A9:FF:F6:B1:1A (OUI DF-A9-FF)
        Count: 1
< ACL Data TX: Handle 903 flags 0x00 dlen 9                #132 [hci1] 9.584762
      ATT: Error Response (0x01) len 4
        Read By Type Request (0x08)
        Handle: 0x000a
        Error: Attribute Not Found (0x0a)
> HCI Event: Number of Completed Packets (0x13) plen 5     #133 [hci1] 9.754819
        Num handles: 1
        Handle: 903 Address: DF:A9:FF:F6:B1:1A (OUI DF-A9-FF)
        Count: 1
        #132: len 9 (0 Kb/s)
        Latency: 170 msec (8-173 msec ~162 msec)
> ACL Data RX: Handle 903 flags 0x02 dlen 9                #134 [hci1] 9.755007
      ATT: Find Information Request (0x04) len 4
        Handle range: 0x0004-0x0004
< HCI Command: Host Number of Comp.. (0x03|0x0035) plen 5  #135 [hci1] 9.764276
        Num handles: 1
        Handle: 903 Address: DF:A9:FF:F6:B1:1A (OUI DF-A9-FF)
        Count: 1
< ACL Data TX: Handle 903 flags 0x00 dlen 10               #136 [hci1] 9.764354
      ATT: Find Information Response (0x05) len 5
        Format: UUID-16 (0x01)
        Handle: 0x0004
        UUID: Client Characteristic Configuration (0x2902)
> HCI Event: Number of Completed Packets (0x13) plen 5     #137 [hci1] 9.929825
        Num handles: 1
        Handle: 903 Address: DF:A9:FF:F6:B1:1A (OUI DF-A9-FF)
        Count: 1
        #136: len 10 (0 Kb/s)
        Latency: 165 msec (8-173 msec ~163 msec)
> ACL Data RX: Handle 903 flags 0x02 dlen 11               #138 [hci1] 9.929979
      ATT: Read By Type Request (0x08) len 6
        Handle range: 0x000b-0x0013
        Attribute type: Characteristic (0x2803)
< HCI Command: Host Number of Comp.. (0x03|0x0035) plen 5  #139 [hci1] 9.944698
        Num handles: 1
        Handle: 903 Address: DF:A9:FF:F6:B1:1A (OUI DF-A9-FF)
        Count: 1
< ACL Data TX: Handle 903 flags 0x00 dlen 20               #140 [hci1] 9.944777
      ATT: Read By Type Response (0x09) len 15
        Attribute data length: 7
        Attribute data list: 2 entries
        Handle: 0x000c
        Value: 0a0d00002a
            Properties: 0x0a
              Read (0x02)
              Write (0x08)
            Value Handle: 0x000d
            Value UUID: Device Name (0x2a00)
        Handle: 0x000e
        Value: 0a0f00012a
            Properties: 0x0a
              Read (0x02)
              Write (0x08)
            Value Handle: 0x000f
            Value UUID: Appearance (0x2a01)
> HCI Event: Number of Completed Packets (0x13) plen 5    #141 [hci1] 10.104849
        Num handles: 1
        Handle: 903 Address: DF:A9:FF:F6:B1:1A (OUI DF-A9-FF)
        Count: 1
        #140: len 20 (1 Kb/s)
        Latency: 160 msec (8-173 msec ~161 msec)
> ACL Data RX: Handle 903 flags 0x02 dlen 11              #142 [hci1] 10.105053
      ATT: Read By Type Request (0x08) len 6
        Handle range: 0x000f-0x0013
        Attribute type: Characteristic (0x2803)
< HCI Command: Host Number of Com.. (0x03|0x0035) plen 5  #143 [hci1] 10.124759
        Num handles: 1
        Handle: 903 Address: DF:A9:FF:F6:B1:1A (OUI DF-A9-FF)
        Count: 1
< ACL Data TX: Handle 903 flags 0x00 dlen 20              #144 [hci1] 10.124927
      ATT: Read By Type Response (0x09) len 15
        Attribute data length: 7
        Attribute data list: 2 entries
        Handle: 0x0010
        Value: 021100a62a
            Properties: 0x02
              Read (0x02)
            Value Handle: 0x0011
            Value UUID: Central Address Resolution (0x2aa6)
        Handle: 0x0012
        Value: 021300042a
            Properties: 0x02
              Read (0x02)
            Value Handle: 0x0013
            Value UUID: Peripheral Preferred Connection Parameters (0x2a04)
> HCI Event: Number of Completed Packets (0x13) plen 5    #145 [hci1] 10.279757
        Num handles: 1
        Handle: 903 Address: DF:A9:FF:F6:B1:1A (OUI DF-A9-FF)
        Count: 1
        #144: len 20 (1 Kb/s)
        Latency: 154 msec (8-173 msec ~158 msec)
> ACL Data RX: Handle 903 flags 0x02 dlen 11              #146 [hci1] 10.280005
      ATT: Read By Type Request (0x08) len 6
        Handle range: 0x0013-0x0013
        Attribute type: Characteristic (0x2803)
< HCI Command: Host Number of Com.. (0x03|0x0035) plen 5  #147 [hci1] 10.284264
        Num handles: 1
        Handle: 903 Address: DF:A9:FF:F6:B1:1A (OUI DF-A9-FF)
        Count: 1
< ACL Data TX: Handle 903 flags 0x00 dlen 9               #148 [hci1] 10.284295
      ATT: Error Response (0x01) len 4
        Read By Type Request (0x08)
        Handle: 0x0013
        Error: Attribute Not Found (0x0a)
> HCI Event: Number of Completed Packets (0x13) plen 5    #149 [hci1] 10.454856
        Num handles: 1
        Handle: 903 Address: DF:A9:FF:F6:B1:1A (OUI DF-A9-FF)
        Count: 1
        #148: len 9 (0 Kb/s)
        Latency: 170 msec (8-173 msec ~164 msec)
> ACL Data RX: Handle 903 flags 0x02 dlen 11              #150 [hci1] 10.455135
      ATT: Read By Type Request (0x08) len 6
        Handle range: 0x0014-0x0028
        Attribute type: Characteristic (0x2803)
< HCI Command: Host Number of Com.. (0x03|0x0035) plen 5  #151 [hci1] 10.464197
        Num handles: 1
        Handle: 903 Address: DF:A9:FF:F6:B1:1A (OUI DF-A9-FF)
        Count: 1
< ACL Data TX: Handle 903 flags 0x00 dlen 20              #152 [hci1] 10.464223
      ATT: Read By Type Response (0x09) len 15
        Attribute data length: 7
        Attribute data list: 2 entries
        Handle: 0x0015
        Value: 021600242a
            Properties: 0x02
              Read (0x02)
            Value Handle: 0x0016
            Value UUID: Model Number String (0x2a24)
        Handle: 0x0017
        Value: 021800292a
            Properties: 0x02
              Read (0x02)
            Value Handle: 0x0018
            Value UUID: Manufacturer Name String (0x2a29)
> HCI Event: Number of Completed Packets (0x13) plen 5    #153 [hci1] 10.629834
        Num handles: 1
        Handle: 903 Address: DF:A9:FF:F6:B1:1A (OUI DF-A9-FF)
        Count: 1
        #152: len 20 (0 Kb/s)
        Latency: 165 msec (8-173 msec ~165 msec)
> ACL Data RX: Handle 903 flags 0x02 dlen 11              #154 [hci1] 10.630030
      ATT: Read By Type Request (0x08) len 6
        Handle range: 0x0018-0x0028
        Attribute type: Characteristic (0x2803)
< HCI Command: Host Number of Com.. (0x03|0x0035) plen 5  #155 [hci1] 10.644581
        Num handles: 1
        Handle: 903 Address: DF:A9:FF:F6:B1:1A (OUI DF-A9-FF)
        Count: 1
< ACL Data TX: Handle 903 flags 0x00 dlen 20              #156 [hci1] 10.644684
      ATT: Read By Type Response (0x09) len 15
        Attribute data length: 7
        Attribute data list: 2 entries
        Handle: 0x0019
        Value: 021a00502a
            Properties: 0x02
              Read (0x02)
            Value Handle: 0x001a
            Value UUID: PnP ID (0x2a50)
        Handle: 0x001b
        Value: 021c00252a
            Properties: 0x02
              Read (0x02)
            Value Handle: 0x001c
            Value UUID: Serial Number String (0x2a25)
> HCI Event: Number of Completed Packets (0x13) plen 5    #157 [hci1] 10.804802
        Num handles: 1
        Handle: 903 Address: DF:A9:FF:F6:B1:1A (OUI DF-A9-FF)
        Count: 1
        #156: len 20 (1 Kb/s)
        Latency: 160 msec (8-173 msec ~162 msec)
> ACL Data RX: Handle 903 flags 0x02 dlen 11              #158 [hci1] 10.805100
      ATT: Read By Type Request (0x08) len 6
        Handle range: 0x001c-0x0028
        Attribute type: Characteristic (0x2803)
< HCI Command: Host Number of Com.. (0x03|0x0035) plen 5  #159 [hci1] 10.824370
        Num handles: 1
        Handle: 903 Address: DF:A9:FF:F6:B1:1A (OUI DF-A9-FF)
        Count: 1
< ACL Data TX: Handle 903 flags 0x00 dlen 20              #160 [hci1] 10.824444
      ATT: Read By Type Response (0x09) len 15
        Attribute data length: 7
        Attribute data list: 2 entries
        Handle: 0x001d
        Value: 021e00262a
            Properties: 0x02
              Read (0x02)
            Value Handle: 0x001e
            Value UUID: Firmware Revision String (0x2a26)
        Handle: 0x001f
        Value: 022000272a
            Properties: 0x02
              Read (0x02)
            Value Handle: 0x0020
            Value UUID: Hardware Revision String (0x2a27)
> HCI Event: Number of Completed Packets (0x13) plen 5    #161 [hci1] 10.979804
        Num handles: 1
        Handle: 903 Address: DF:A9:FF:F6:B1:1A (OUI DF-A9-FF)
        Count: 1
        #160: len 20 (1 Kb/s)
        Latency: 155 msec (8-173 msec ~158 msec)
> ACL Data RX: Handle 903 flags 0x02 dlen 11              #162 [hci1] 10.980000
      ATT: Read By Type Request (0x08) len 6
        Handle range: 0x0020-0x0028
        Attribute type: Characteristic (0x2803)
< HCI Command: Host Number of Com.. (0x03|0x0035) plen 5  #163 [hci1] 10.984193
        Num handles: 1
        Handle: 903 Address: DF:A9:FF:F6:B1:1A (OUI DF-A9-FF)
        Count: 1
< ACL Data TX: Handle 903 flags 0x00 dlen 20              #164 [hci1] 10.984221
      ATT: Read By Type Response (0x09) len 15
        Attribute data length: 7
        Attribute data list: 2 entries
        Handle: 0x0021
        Value: 022200282a
            Properties: 0x02
              Read (0x02)
            Value Handle: 0x0022
            Value UUID: Software Revision String (0x2a28)
        Handle: 0x0023
        Value: 022400ff2b
            Properties: 0x02
              Read (0x02)
            Value Handle: 0x0024
            Value UUID: Unknown (0x2bff)
> HCI Event: Number of Completed Packets (0x13) plen 5    #165 [hci1] 11.154843
        Num handles: 1
        Handle: 903 Address: DF:A9:FF:F6:B1:1A (OUI DF-A9-FF)
        Count: 1
        #164: len 20 (0 Kb/s)
        Latency: 170 msec (8-173 msec ~164 msec)
> ACL Data RX: Handle 903 flags 0x02 dlen 11              #166 [hci1] 11.155012
      ATT: Read By Type Request (0x08) len 6
        Handle range: 0x0024-0x0028
        Attribute type: Characteristic (0x2803)
< HCI Command: Host Number of Com.. (0x03|0x0035) plen 5  #167 [hci1] 11.164236
        Num handles: 1
        Handle: 903 Address: DF:A9:FF:F6:B1:1A (OUI DF-A9-FF)
        Count: 1
< ACL Data TX: Handle 903 flags 0x00 dlen 20              #168 [hci1] 11.164292
      ATT: Read By Type Response (0x09) len 15
        Attribute data length: 7
        Attribute data list: 2 entries
        Handle: 0x0025
        Value: 022600232a
            Properties: 0x02
              Read (0x02)
            Value Handle: 0x0026
            Value UUID: System ID (0x2a23)
        Handle: 0x0027
        Value: 0228002a2a
            Properties: 0x02
              Read (0x02)
            Value Handle: 0x0028
            Value UUID: IEEE 11073-20601 Regulatory Cert. Data List (0x2a2a)
> HCI Event: Number of Completed Packets (0x13) plen 5    #169 [hci1] 11.329789
        Num handles: 1
        Handle: 903 Address: DF:A9:FF:F6:B1:1A (OUI DF-A9-FF)
        Count: 1
        #168: len 20 (0 Kb/s)
        Latency: 165 msec (8-173 msec ~165 msec)
> ACL Data RX: Handle 903 flags 0x02 dlen 11              #170 [hci1] 11.329996
      ATT: Read By Type Request (0x08) len 6
        Handle range: 0x0028-0x0028
        Attribute type: Characteristic (0x2803)
< HCI Command: Host Number of Com.. (0x03|0x0035) plen 5  #171 [hci1] 11.344265
        Num handles: 1
        Handle: 903 Address: DF:A9:FF:F6:B1:1A (OUI DF-A9-FF)
        Count: 1
< ACL Data TX: Handle 903 flags 0x00 dlen 9               #172 [hci1] 11.344364
      ATT: Error Response (0x01) len 4
        Read By Type Request (0x08)
        Handle: 0x0028
        Error: Attribute Not Found (0x0a)
> HCI Event: Number of Completed Packets (0x13) plen 5    #173 [hci1] 11.504783
        Num handles: 1
        Handle: 903 Address: DF:A9:FF:F6:B1:1A (OUI DF-A9-FF)
        Count: 1
        #172: len 9 (0 Kb/s)
        Latency: 160 msec (8-173 msec ~162 msec)
> ACL Data RX: Handle 903 flags 0x02 dlen 11              #174 [hci1] 11.505011
      ATT: Read By Type Request (0x08) len 6
        Handle range: 0x0029-0x002b
        Attribute type: Characteristic (0x2803)
< HCI Command: Host Number of Com.. (0x03|0x0035) plen 5  #175 [hci1] 11.524248
        Num handles: 1
        Handle: 903 Address: DF:A9:FF:F6:B1:1A (OUI DF-A9-FF)
        Count: 1
< ACL Data TX: Handle 903 flags 0x00 dlen 13              #176 [hci1] 11.524263
      ATT: Read By Type Response (0x09) len 8
        Attribute data length: 7
        Attribute data list: 1 entry
        Handle: 0x002a
        Value: 042b00062a
            Properties: 0x04
              Write Without Response (0x04)
            Value Handle: 0x002b
            Value UUID: Alert Level (0x2a06)
> HCI Event: Number of Completed Packets (0x13) plen 5    #177 [hci1] 11.679840
        Num handles: 1
        Handle: 903 Address: DF:A9:FF:F6:B1:1A (OUI DF-A9-FF)
        Count: 1
        #176: len 13 (0 Kb/s)
        Latency: 155 msec (8-173 msec ~159 msec)
> ACL Data RX: Handle 903 flags 0x02 dlen 11              #178 [hci1] 11.679972
      ATT: Read By Type Request (0x08) len 6
        Handle range: 0x002b-0x002b
        Attribute type: Characteristic (0x2803)
< HCI Command: Host Number of Com.. (0x03|0x0035) plen 5  #179 [hci1] 11.684121
        Num handles: 1
        Handle: 903 Address: DF:A9:FF:F6:B1:1A (OUI DF-A9-FF)
        Count: 1
< ACL Data TX: Handle 903 flags 0x00 dlen 9               #180 [hci1] 11.684130
      ATT: Error Response (0x01) len 4
        Read By Type Request (0x08)
        Handle: 0x002b
        Error: Attribute Not Found (0x0a)
> HCI Event: Number of Completed Packets (0x13) plen 5    #181 [hci1] 11.854739
        Num handles: 1
        Handle: 903 Address: DF:A9:FF:F6:B1:1A (OUI DF-A9-FF)
        Count: 1
        #180: len 9 (0 Kb/s)
        Latency: 170 msec (8-173 msec ~164 msec)
> ACL Data RX: Handle 903 flags 0x02 dlen 11              #182 [hci1] 11.855010
      ATT: Read By Type Request (0x08) len 6
        Handle range: 0x002c-0x0037
        Attribute type: Characteristic (0x2803)
< HCI Command: Host Number of Com.. (0x03|0x0035) plen 5  #183 [hci1] 11.864449
        Num handles: 1
        Handle: 903 Address: DF:A9:FF:F6:B1:1A (OUI DF-A9-FF)
        Count: 1
< ACL Data TX: Handle 903 flags 0x00 dlen 20              #184 [hci1] 11.864492
      ATT: Read By Type Response (0x09) len 15
        Attribute data length: 7
        Attribute data list: 2 entries
        Handle: 0x002d
        Value: 122e00842b
            Properties: 0x12
              Read (0x02)
              Notify (0x10)
            Value Handle: 0x002e
            Value UUID: Set Identity Resolving Key (0x2b84)
        Handle: 0x0030
        Value: 123100852b
            Properties: 0x12
              Read (0x02)
              Notify (0x10)
            Value Handle: 0x0031
            Value UUID: Coordinated Set Size (0x2b85)
> HCI Event: Number of Completed Packets (0x13) plen 5    #185 [hci1] 12.029873
        Num handles: 1
        Handle: 903 Address: DF:A9:FF:F6:B1:1A (OUI DF-A9-FF)
        Count: 1
        #184: len 20 (0 Kb/s)
        Latency: 165 msec (8-173 msec ~165 msec)
> ACL Data RX: Handle 903 flags 0x02 dlen 11              #186 [hci1] 12.030042
      ATT: Read By Type Request (0x08) len 6
        Handle range: 0x0031-0x0037
        Attribute type: Characteristic (0x2803)
< HCI Command: Host Number of Com.. (0x03|0x0035) plen 5  #187 [hci1] 12.044286
        Num handles: 1
        Handle: 903 Address: DF:A9:FF:F6:B1:1A (OUI DF-A9-FF)
        Count: 1
< ACL Data TX: Handle 903 flags 0x00 dlen 20              #188 [hci1] 12.044300
      ATT: Read By Type Response (0x09) len 15
        Attribute data length: 7
        Attribute data list: 2 entries
        Handle: 0x0033
        Value: 1a3400862b
            Properties: 0x1a
              Read (0x02)
              Write (0x08)
              Notify (0x10)
            Value Handle: 0x0034
            Value UUID: Set Member Lock (0x2b86)
        Handle: 0x0036
        Value: 023700872b
            Properties: 0x02
              Read (0x02)
            Value Handle: 0x0037
            Value UUID: Set Member Rank (0x2b87)
> HCI Event: Number of Completed Packets (0x13) plen 5    #189 [hci1] 12.204789
        Num handles: 1
        Handle: 903 Address: DF:A9:FF:F6:B1:1A (OUI DF-A9-FF)
        Count: 1
        #188: len 20 (1 Kb/s)
        Latency: 160 msec (8-173 msec ~162 msec)
> ACL Data RX: Handle 903 flags 0x02 dlen 11              #190 [hci1] 12.204985
      ATT: Read By Type Request (0x08) len 6
        Handle range: 0x0037-0x0037
        Attribute type: Characteristic (0x2803)
< HCI Command: Host Number of Com.. (0x03|0x0035) plen 5  #191 [hci1] 12.224340
        Num handles: 1
        Handle: 903 Address: DF:A9:FF:F6:B1:1A (OUI DF-A9-FF)
        Count: 1
< ACL Data TX: Handle 903 flags 0x00 dlen 9               #192 [hci1] 12.224355
      ATT: Error Response (0x01) len 4
        Read By Type Request (0x08)
        Handle: 0x0037
        Error: Attribute Not Found (0x0a)
> HCI Event: Number of Completed Packets (0x13) plen 5    #193 [hci1] 12.379778
        Num handles: 1
        Handle: 903 Address: DF:A9:FF:F6:B1:1A (OUI DF-A9-FF)
        Count: 1
        #192: len 9 (0 Kb/s)
        Latency: 155 msec (8-173 msec ~159 msec)
> ACL Data RX: Handle 903 flags 0x02 dlen 9               #194 [hci1] 12.379953
      ATT: Find Information Request (0x04) len 4
        Handle range: 0x002f-0x002f
< HCI Command: Host Number of Com.. (0x03|0x0035) plen 5  #195 [hci1] 12.384336
        Num handles: 1
        Handle: 903 Address: DF:A9:FF:F6:B1:1A (OUI DF-A9-FF)
        Count: 1
< ACL Data TX: Handle 903 flags 0x00 dlen 10              #196 [hci1] 12.384414
      ATT: Find Information Response (0x05) len 5
        Format: UUID-16 (0x01)
        Handle: 0x002f
        UUID: Client Characteristic Configuration (0x2902)
> HCI Event: Number of Completed Packets (0x13) plen 5    #197 [hci1] 12.554770
        Num handles: 1
        Handle: 903 Address: DF:A9:FF:F6:B1:1A (OUI DF-A9-FF)
        Count: 1
        #196: len 10 (0 Kb/s)
        Latency: 170 msec (8-173 msec ~164 msec)
> ACL Data RX: Handle 903 flags 0x02 dlen 9               #198 [hci1] 12.554994
      ATT: Find Information Request (0x04) len 4
        Handle range: 0x0032-0x0032
< HCI Command: Host Number of Com.. (0x03|0x0035) plen 5  #199 [hci1] 12.564212
        Num handles: 1
        Handle: 903 Address: DF:A9:FF:F6:B1:1A (OUI DF-A9-FF)
        Count: 1
< ACL Data TX: Handle 903 flags 0x00 dlen 10              #200 [hci1] 12.564248
      ATT: Find Information Response (0x05) len 5
        Format: UUID-16 (0x01)
        Handle: 0x0032
        UUID: Client Characteristic Configuration (0x2902)
> HCI Event: Number of Completed Packets (0x13) plen 5    #201 [hci1] 12.729755
        Num handles: 1
        Handle: 903 Address: DF:A9:FF:F6:B1:1A (OUI DF-A9-FF)
        Count: 1
        #200: len 10 (0 Kb/s)
        Latency: 165 msec (8-173 msec ~165 msec)
> ACL Data RX: Handle 903 flags 0x02 dlen 9               #202 [hci1] 12.729928
      ATT: Find Information Request (0x04) len 4
        Handle range: 0x0035-0x0035
< HCI Command: Host Number of Com.. (0x03|0x0035) plen 5  #203 [hci1] 12.744266
        Num handles: 1
        Handle: 903 Address: DF:A9:FF:F6:B1:1A (OUI DF-A9-FF)
        Count: 1
< ACL Data TX: Handle 903 flags 0x00 dlen 10              #204 [hci1] 12.744278
      ATT: Find Information Response (0x05) len 5
        Format: UUID-16 (0x01)
        Handle: 0x0035
        UUID: Client Characteristic Configuration (0x2902)
> HCI Event: Number of Completed Packets (0x13) plen 5    #205 [hci1] 12.904788
        Num handles: 1
        Handle: 903 Address: DF:A9:FF:F6:B1:1A (OUI DF-A9-FF)
        Count: 1
        #204: len 10 (0 Kb/s)
        Latency: 160 msec (8-173 msec ~162 msec)
> ACL Data RX: Handle 903 flags 0x02 dlen 11              #206 [hci1] 12.905113
      ATT: Read By Type Request (0x08) len 6
        Handle range: 0x0001-0xffff
        Attribute type: Include (0x2802)
< HCI Command: Host Number of Com.. (0x03|0x0035) plen 5  #207 [hci1] 12.924462
        Num handles: 1
        Handle: 903 Address: DF:A9:FF:F6:B1:1A (OUI DF-A9-FF)
        Count: 1
< ACL Data TX: Handle 903 flags 0x00 dlen 9               #208 [hci1] 12.924590
      ATT: Error Response (0x01) len 4
        Read By Type Request (0x08)
        Handle: 0x0001
        Error: Attribute Not Found (0x0a)
> HCI Event: Number of Completed Packets (0x13) plen 5    #209 [hci1] 13.079748
        Num handles: 1
        Handle: 903 Address: DF:A9:FF:F6:B1:1A (OUI DF-A9-FF)
        Count: 1
        #208: len 9 (0 Kb/s)
        Latency: 155 msec (8-173 msec ~158 msec)
> ACL Data RX: Handle 903 flags 0x02 dlen 7               #210 [hci1] 13.079964
      ATT: Read Request (0x0a) len 2
        Handle: 0x002e Type: Set Identity Resolving Key (0x2b84)
< HCI Command: Host Number of Com.. (0x03|0x0035) plen 5  #211 [hci1] 13.084200
        Num handles: 1
        Handle: 903 Address: DF:A9:FF:F6:B1:1A (OUI DF-A9-FF)
        Count: 1
< ACL Data TX: Handle 903 flags 0x00 dlen 22              #212 [hci1] 13.084225
      ATT: Read Response (0x0b) len 17
        Handle: 0x002e Type: Set Identity Resolving Key (0x2b84)
        Value: 01b803eac6afbb65a25a41f15305688e83
          SIRK: 01b803eac6afbb65a25a41f15305688e83
> HCI Event: Number of Completed Packets (0x13) plen 5    #213 [hci1] 13.254699
        Num handles: 1
        Handle: 903 Address: DF:A9:FF:F6:B1:1A (OUI DF-A9-FF)
        Count: 1
        #212: len 22 (1 Kb/s)
        Latency: 170 msec (8-173 msec ~164 msec)
> HCI Event: Disconnect Complete (0x05) plen 4            #214 [hci1] 14.654940
        Status: Success (0x00)
        Handle: 903 Address: DF:A9:FF:F6:B1:1A (OUI DF-A9-FF)
        Reason: Remote User Terminated Connection (0x13)
< HCI Command: Reset (0x03|0x0003) plen 0                 #215 [hci1] 20.284210
> HCI Event: Command Complete (0x0e) plen 4               #216 [hci1] 20.284680
      Reset (0x03|0x0003) ncmd 1
        Status: Success (0x00)
@ USER Close: main                                    {0x0001} [hci1] 20.304064
= Close Index: 00:00:00:00:00:00                               [hci1] 20.311444
