Bluetooth monitor ver 5.72
= Note: Linux version 7.0.0-31-generic (x86_64)                        0.834620
= Note: Bluetooth subsystem version 2.22                               0.834622
= New Index: 00:00:00:00:00:00 (Primary,UART,hci1)              [hci1] 0.834623
= New Index: 48:5F:99:8E:E0:64 (Primary,USB,hci0)               [hci0] 0.834623
= Open Index: 00:00:00:00:00:00                                 [hci1] 0.957787
= Index Info: 00:00:00:00:00:00 (Nordic Semiconductor ASA)      [hci1] 0.957795
@ USER Open: main (privileged) version 2.22            {0x0001} [hci1] 0.957798
< HCI Command: Reset (0x03|0x0003) plen 0                    #1 [hci1] 0.961386
> HCI Event: Command Complete (0x0e) plen 4                  #2 [hci1] 0.961868
      Reset (0x03|0x0003) ncmd 1
        Status: Success (0x00)
< HCI Command: Read Local Supported... (0x04|0x0003) plen 0  #3 [hci1] 0.978386
> HCI Event: Command Complete (0x0e) plen 12                 #4 [hci1] 0.978823
      Read Local Supported Features (0x04|0x0003) ncmd 1
        Status: Success (0x00)
        Features: 0x00 0x00 0x00 0x00 0x60 0x00 0x00 0x00
          BR/EDR Not Supported
          LE Supported (Controller)
< HCI Command: Read Local Version In.. (0x04|0x0001) plen 0  #5 [hci1] 0.998385
> HCI Event: Command Complete (0x0e) plen 12                 #6 [hci1] 0.999385
      Read Local Version Information (0x04|0x0001) ncmd 1
        Status: Success (0x00)
        HCI version: Reserved (0x11) - Revision 12345 (0x3039)
        LMP version: Reserved (0x11) - Subversion 12345 (0x3039)
        Manufacturer: Nordic Semiconductor ASA (89)
< HCI Command: Read Local Supported... (0x04|0x0002) plen 0  #7 [hci1] 1.017807
> HCI Event: Command Complete (0x0e) plen 68                 #8 [hci1] 1.018945
      Read Local Supported Commands (0x04|0x0002) ncmd 1
        Status: Success (0x00)
        Commands: 115 entries
          Disconnect (Octet 0 - Bit 5)
          Read Remote Version Information (Octet 2 - Bit 7)
          Set Event Mask (Octet 5 - Bit 6)
          Reset (Octet 5 - Bit 7)
          Read Connection Accept Timeout (Octet 7 - Bit 2)
          Write Connection Accept Timeout (Octet 7 - Bit 3)
          Read Transmit Power Level (Octet 10 - Bit 2)
          Set Controller To Host Flow Control (Octet 10 - Bit 5)
          Host Buffer Size (Octet 10 - Bit 6)
          Host Number of Completed Packets (Octet 10 - Bit 7)
          Read Local Version Information (Octet 14 - Bit 3)
          Read Local Supported Features (Octet 14 - Bit 5)
          Read BD ADDR (Octet 15 - Bit 1)
          Read RSSI (Octet 15 - Bit 5)
          Set Event Mask Page 2 (Octet 22 - Bit 2)
          LE Set Event Mask (Octet 25 - Bit 0)
          LE Read Buffer Size (Octet 25 - Bit 1)
          LE Read Local Supported Features (Octet 25 - Bit 2)
          LE Set Random Address (Octet 25 - Bit 4)
          LE Set Advertising Parameters (Octet 25 - Bit 5)
          LE Read Advertising Channel TX Power (Octet 25 - Bit 6)
          LE Set Advertising Data (Octet 25 - Bit 7)
          LE Set Scan Response Data (Octet 26 - Bit 0)
          LE Set Advertise Enable (Octet 26 - Bit 1)
          LE Set Scan Parameters (Octet 26 - Bit 2)
          LE Set Scan Enable (Octet 26 - Bit 3)
          LE Create Connection (Octet 26 - Bit 4)
          LE Create Connection Cancel (Octet 26 - Bit 5)
          LE Read Accept List Size (Octet 26 - Bit 6)
          LE Clear Accept List (Octet 26 - Bit 7)
          LE Add Device To Accept List (Octet 27 - Bit 0)
          LE Remove Device From Accept List (Octet 27 - Bit 1)
          LE Connection Update (Octet 27 - Bit 2)
          LE Set Host Channel Classification (Octet 27 - Bit 3)
          LE Read Channel Map (Octet 27 - Bit 4)
          LE Read Remote Used Features (Octet 27 - Bit 5)
          LE Encrypt (Octet 27 - Bit 6)
          LE Rand (Octet 27 - Bit 7)
          LE Start Encryption (Octet 28 - Bit 0)
          LE Long Term Key Request Reply (Octet 28 - Bit 1)
          LE Long Term Key Request Neg Reply (Octet 28 - Bit 2)
          LE Read Supported States (Octet 28 - Bit 3)
          Read Authenticated Payload Timeout (Octet 32 - Bit 4)
          Write Authenticated Payload Timeout (Octet 32 - Bit 5)
          LE Set Data Length (Octet 33 - Bit 6)
          LE Read Suggested Default Data Length (Octet 33 - Bit 7)
          LE Write Suggested Default Data Length (Octet 34 - Bit 0)
          LE Add Device To Resolving List (Octet 34 - Bit 3)
          LE Remove Device From Resolving List (Octet 34 - Bit 4)
          LE Clear Resolving List (Octet 34 - Bit 5)
          LE Read Resolving List Size (Octet 34 - Bit 6)
          LE Set Address Resolution Enable (Octet 35 - Bit 1)
          LE Set Resolvable Private Address Timeout (Octet 35 - Bit 2)
          LE Read Maximum Data Length (Octet 35 - Bit 3)
          LE Read PHY (Octet 35 - Bit 4)
          LE Set Default PHY (Octet 35 - Bit 5)
          LE Set PHY (Octet 35 - Bit 6)
          LE Set Advertising Set Random Address (Octet 36 - Bit 1)
          LE Set Extended Advertising Parameters (Octet 36 - Bit 2)
          LE Set Extended Advertising Data (Octet 36 - Bit 3)
          LE Set Extended Scan Response Data (Octet 36 - Bit 4)
          LE Set Extended Advertising Enable (Octet 36 - Bit 5)
          LE Read Maximum Advertising Data Length (Octet 36 - Bit 6)
          LE Read Number of Supported Advertising Sets (Octet 36 - Bit 7)
          LE Remove Advertising Set (Octet 37 - Bit 0)
          LE Clear Advertising Sets (Octet 37 - Bit 1)
          LE Set Periodic Advertising Parameters (Octet 37 - Bit 2)
          LE Set Periodic Advertising Data (Octet 37 - Bit 3)
          LE Set Periodic Advertising Enable (Octet 37 - Bit 4)
          LE Set Extended Scan Parameters (Octet 37 - Bit 5)
          LE Set Extended Scan Enable (Octet 37 - Bit 6)
          LE Extended Create Connection (Octet 37 - Bit 7)
          LE Periodic Advertising Create Sync (Octet 38 - Bit 0)
          LE Periodic Advertising Create Sync Cancel (Octet 38 - Bit 1)
          LE Periodic Advertising Terminate Sync (Octet 38 - Bit 2)
          LE Add Device To Periodic Advertiser List (Octet 38 - Bit 3)
          LE Remove Device From Periodic Advertiser List (Octet 38 - Bit 4)
          LE Clear Periodic Advertiser List (Octet 38 - Bit 5)
          LE Read Periodic Advertiser List Size (Octet 38 - Bit 6)
          LE Read Transmit Power (Octet 38 - Bit 7)
          LE Read RF Path Compensation (Octet 39 - Bit 0)
          LE Write RF Path Compensation (Octet 39 - Bit 1)
          LE Set Privacy Mode (Octet 39 - Bit 2)
          LE Periodic Advertising Receive Enable (Octet 40 - Bit 5)
          LE Periodic Advertising Sync Transfer (Octet 40 - Bit 6)
          LE Periodic Advertising Set Info Transfer (Octet 40 - Bit 7)
          LE Periodic Advertising Sync Transfer Parameters (Octet 41 - Bit 0)
          LE Set Default Periodic Advertisng Sync Transfer Parameters (Octet 41 - Bit 1)
          LE Read Buffer v2 (Octet 41 - Bit 5)
          LE Read ISO TX Sync (Octet 41 - Bit 6)
          LE Set Connected Isochronous Group Parameters (Octet 41 - Bit 7)
          LE Set Connected Isochronous Group Parameters Test (Octet 42 - Bit 0)
          LE Create Connected Isochronous Stream (Octet 42 - Bit 1)
          LE Remove Connected Isochronous Group (Octet 42 - Bit 2)
          LE Accept Connected Isochronous Stream Request (Octet 42 - Bit 3)
          LE Reject Connected Isochronous Stream Request (Octet 42 - Bit 4)
          LE Create Broadcast Isochronous Group (Octet 42 - Bit 5)
          LE Create Broadcast Isochronous Group Test (Octet 42 - Bit 6)
          LE Terminate Broadcast Isochronous Group (Octet 42 - Bit 7)
          LE Broadcast Isochronous Group Create Sync (Octet 43 - Bit 0)
          LE Broadcast Isochronous Group Terminate Sync (Octet 43 - Bit 1)
          LE Request Peer SCA (Octet 43 - Bit 2)
          LE Setup Isochronous Data Path (Octet 43 - Bit 3)
          LE Remove Isochronous Data Path (Octet 43 - Bit 4)
          LE Isochronous Transmit Test (Octet 43 - Bit 5)
          LE Isochronous Receive Test (Octet 43 - Bit 6)
          LE Isochronous Read Test Counters (Octet 43 - Bit 7)
          LE Isochronous Read Test Counters (Octet 44 - Bit 0)
          LE Set Host Feature (Octet 44 - Bit 1)
          Octet 44 - Bit 2 
          Octet 45 - Bit 6 
          Octet 46 - Bit 0 
          Octet 46 - Bit 1 
          Octet 46 - Bit 2 
          Octet 47 - Bit 4 
< HCI Command: Host Buffer Size (0x03|0x0033) plen 7         #9 [hci1] 1.037804
        ACL MTU: 255  ACL max packet: 16
        SCO MTU: 0    SCO max packet: 0
> HCI Event: Command Complete (0x0e) plen 4                 #10 [hci1] 1.038258
      Host Buffer Size (0x03|0x0033) ncmd 1
        Status: Success (0x00)
< HCI Command: Set Controller To Ho.. (0x03|0x0031) plen 1  #11 [hci1] 1.057818
        Flow control: ACL Data Packets (0x01)
> HCI Event: Command Complete (0x0e) plen 4                 #12 [hci1] 1.058171
      Set Controller To Host Flow Control (0x03|0x0031) ncmd 1
        Status: Success (0x00)
< HCI Command: LE Read Local Suppor.. (0x08|0x0003) plen 0  #13 [hci1] 1.077777
> HCI Event: Command Complete (0x0e) plen 12                #14 [hci1] 1.078223
      LE Read Local Supported Features (0x08|0x0003) ncmd 1
        Status: Success (0x00)
        Features: 0xfd 0x79 0x00 0xf7 0x30 0x01 0x00 0x00
          LE Encryption
          Extended Reject Indication
          Peripheral-initiated Features Exchange
          LE Ping
          LE Data Packet Length Extension
          LL Privacy
          Extended Scanner Filter Policies
          LE 2M PHY
          LE Coded PHY
          LE Extended Advertising
          LE Periodic Advertising
          Channel Selection Algorithm #2
          Periodic Advertising Sync Transfer - Sender
          Periodic Advertising Sync Transfer - Recipient
          Sleep Clock Accuracy Updates
          Connected Isochronous Stream - Central
          Connected Isochronous Stream - Peripheral
          Isochronous Broadcaster
          Synchronized Receiver
          Periodic Advertising ADI support
          Connection Subrating
          Unknown features (0x0000010000000000)
< HCI Command: LE Set Host Feature (0x08|0x0074) plen 2     #15 [hci1] 1.097799
        Bit Number: 32
          Connected Isochronous Stream (Host Support)
        Bit Value: 1
> HCI Event: Command Complete (0x0e) plen 4                 #16 [hci1] 1.098267
      LE Set Host Feature (0x08|0x0074) ncmd 1
        Status: Success (0x00)
< HCI Command: LE Read Buffer v2 (0x08|0x0060) plen 0       #17 [hci1] 1.117801
> HCI Event: Command Complete (0x0e) plen 10                #18 [hci1] 1.118295
      LE Read Buffer v2 (0x08|0x0060) ncmd 1
        Status: Success (0x00)
        ACL MTU: 27
        ACL max packet: 3
        ISO MTU: 318
        ISO max packet: 3
< HCI Command: LE Read Maximum Adve.. (0x08|0x003a) plen 0  #19 [hci1] 1.137839
> HCI Event: Command Complete (0x0e) plen 6                 #20 [hci1] 1.138242
      LE Read Maximum Advertising Data Length (0x08|0x003a) ncmd 1
        Status: Success (0x00)
        Max length: 1650
< HCI Command: LE Read Supported St.. (0x08|0x001c) plen 0  #21 [hci1] 1.157833
> HCI Event: Command Complete (0x0e) plen 12                #22 [hci1] 1.158279
      LE Read Supported States (0x08|0x001c) ncmd 1
        Status: Success (0x00)
        States: 0x000003ff3e0306ff
          Non-connectable Advertising State
          Scannable Advertising State
          Connectable Advertising State
          High Duty Cycle Directed Advertising State
          Passive Scanning State
          Active Scanning State
          Initiating State
            and Connection State (Central Role)
          Connection State (Peripheral Role)
          Scannable Advertising State
            and Passive Scanning State
          Connectable Advertising State
            and Passive Scanning State
          Non-connectable Advertising State
            and Initiating State
          Scannable Advertising State
            and Initiating State
          Active Scanning State
            and Connection State (Central Role)
          Passive Scanning State
            and Connection State (Peripheral Role)
          Active Scanning State
            and Connection State (Peripheral Role)
          Initiating State
            and Connection State (Central Role)
            and Central Role & Central Role
          Low Duty Cycle Directed Advertising State
          Connectable Advertising State
            and Initiating State
            and Central Role & Peripheral Role
          High Duty Cycle Directed Advertising State
            and Initiating State
            and Central Role & Peripheral Role
          Low Duty Cycle Directed Advertising State
            and Initiating State
            and Central Role & Peripheral Role
          Connectable Advertising State
            and Connection State (Central Role)
            and Central Role & Peripheral Role
          High Duty Cycle Directed Advertising State
            and Connection State (Central Role)
            and Central Role & Peripheral Role
          Low Duty Cycle Directed Advertising State
            and Connection State (Central Role)
            and Central Role & Peripheral Role
          Connectable Advertising State
            and Connection State (Peripheral Role)
            and Central Role & Peripheral Role
          High Duty Cycle Directed Advertising State
            and Connection State (Peripheral Role)
            and Peripheral Role & Peripheral Role
          Low Duty Cycle Directed Advertising State
            and Connection State (Peripheral Role)
            and Peripheral Role & Peripheral Role
          Initiating State
            and Connection State (Peripheral Role)
            and Central Role & Peripheral Role
< HCI Command: LE Read Maximum Data.. (0x08|0x002f) plen 0  #23 [hci1] 1.177805
> HCI Event: Command Complete (0x0e) plen 12                #24 [hci1] 1.178277
      LE Read Maximum Data Length (0x08|0x002f) ncmd 1
        Status: Success (0x00)
        Max TX octets: 251
        Max TX time: 2704
        Max RX octets: 251
        Max RX time: 2704
< HCI Command: LE Write Suggested D.. (0x08|0x0024) plen 4  #25 [hci1] 1.197806
        TX octets: 251
        TX time: 2704
> HCI Event: Command Complete (0x0e) plen 4                 #26 [hci1] 1.198295
      LE Write Suggested Default Data Length (0x08|0x0024) ncmd 1
        Status: Success (0x00)
< HCI Command: LE Read Resolving Li.. (0x08|0x002a) plen 0  #27 [hci1] 1.217831
> HCI Event: Command Complete (0x0e) plen 5                 #28 [hci1] 1.218273
      LE Read Resolving List Size (0x08|0x002a) ncmd 1
        Status: Success (0x00)
        Size: 8
< HCI Command: LE Set Host Feature (0x08|0x0074) plen 2     #29 [hci1] 1.237800
        Bit Number: 38
          Connection Subrating (Host Support)
        Bit Value: 1
> HCI Event: Command Complete (0x0e) plen 4                 #30 [hci1] 1.238267
      LE Set Host Feature (0x08|0x0074) ncmd 1
        Status: Success (0x00)
< HCI Command: LE Set Event Mask (0x08|0x0001) plen 8       #31 [hci1] 1.257785
        Mask: 0x000002063f87fa5e
          LE Advertising Report
          LE Connection Update Complete
          LE Read Remote Used Features Complete
          LE Long Term Key Request
          LE Data Length Change
          LE Enhanced Connection Complete
          LE PHY Update Complete
          LE Extended Advertising Report
          LE Periodic Advertising Sync Established
          LE Periodic Advertising Report
          LE Periodic Advertising Sync Lost
          LE Extended Scan Timeout
          LE Extended Advertising Set Terminated
          LE Scan Request Received
          LE Periodic Advertising Sync Transfer Rvc
          LE CIS Established
          LE CIS Request
          LE Create BIG Complete
          LE Terminate BIG Complete
          LE BIG Sync Estabilished Complete
          LE BIG Sync Lost
          LE BIG Info Advertising Report
          LE Subrate Change
          Unknown mask (0x0000020000000000)
> HCI Event: Command Complete (0x0e) plen 4                 #32 [hci1] 1.258340
      LE Set Event Mask (0x08|0x0001) ncmd 1
        Status: Success (0x00)
< HCI Command: Set Event Mask (0x03|0x0001) plen 8          #33 [hci1] 1.277833
        Mask: 0x2000800002008890
          Disconnection Complete
          Encryption Change
          Read Remote Version Information Complete
          Hardware Error
          Data Buffer Overflow
          Encryption Key Refresh Complete
          LE Meta
> HCI Event: Command Complete (0x0e) plen 4                 #34 [hci1] 1.278312
      Set Event Mask (0x03|0x0001) ncmd 1
        Status: Success (0x00)
< HCI Command: Read BD ADDR (0x04|0x0009) plen 0            #35 [hci1] 1.297832
> HCI Event: Command Complete (0x0e) plen 10                #36 [hci1] 1.298301
      Read BD ADDR (0x04|0x0009) ncmd 1
        Status: Success (0x00)
        Address: 00:00:00:00:00:00 (OUI 00-00-00)
< HCI Command: LE Set Random Address (0x08|0x0005) plen 6   #37 [hci1] 1.317836
        Address: D5:B6:CC:31:DB:3B (Static)
> HCI Event: Command Complete (0x0e) plen 4                 #38 [hci1] 1.318295
      LE Set Random Address (0x08|0x0005) ncmd 1
        Status: Success (0x00)
< HCI Command: LE Set Extended Adv.. (0x08|0x0036) plen 25  #39 [hci1] 3.487867
        Handle: 0x00
        Properties: 0x0001
          Connectable
        Min advertising interval: 100.000 msec (0x00a0)
        Max advertising interval: 150.000 msec (0x00f0)
        Channel map: 37, 38, 39 (0x07)
        Own address type: Random (0x01)
        Peer address type: Public (0x00)
        Peer address: 00:00:00:00:00:00 (OUI 00-00-00)
        Filter policy: Allow Scan Request from Any, Allow Connect Request from Any (0x00)
        TX power: Host has no preference (0x7f)
        Primary PHY: LE 1M (0x01)
        Secondary max skip: 0x00
        Secondary PHY: LE 2M (0x02)
        SID: 0x00
        Scan request notifications: Disabled (0x00)
> HCI Event: Command Complete (0x0e) plen 5                 #40 [hci1] 3.488605
      LE Set Extended Advertising Parameters (0x08|0x0036) ncmd 1
        Status: Success (0x00)
        TX power (selected): 0 dbm (0x00)
< HCI Command: LE Set Advertising S.. (0x08|0x0035) plen 7  #41 [hci1] 3.497846
        Advertising handle: 0x00
        Advertising random address: D5:B6:CC:31:DB:3B (Static)
> HCI Event: Command Complete (0x0e) plen 4                 #42 [hci1] 3.498355
      LE Set Advertising Set Random Address (0x08|0x0035) ncmd 1
        Status: Success (0x00)
< HCI Command: LE Set Extended Adv.. (0x08|0x0037) plen 30  #43 [hci1] 3.517809
        Handle: 0x00
        Operation: Complete extended advertising data (0x03)
        Fragment preference: Minimize fragmentation (0x01)
        Data length: 0x1a
        Flags: 0x06
          LE General Discoverable Mode
          BR/EDR Not Supported
        Service Data: Common Audio (0x1853)
          Data: 01
        Service Data: Audio Stream Control (0x184e)
          Data: 010000000000
        Resolvable Set Identifier: 48-61-8E-0C-80-97
          Hash: 0x c8097
          Random: 0x48618e
> HCI Event: Command Complete (0x0e) plen 4                 #44 [hci1] 3.518579
      LE Set Extended Advertising Data (0x08|0x0037) ncmd 1
        Status: Success (0x00)
< HCI Command: LE Set Extended Adve.. (0x08|0x0039) plen 6  #45 [hci1] 3.537809
        Extended advertising: Enabled (0x01)
        Number of sets: 1 (0x01)
        Entry 0
          Handle: 0x00
          Duration: 0 ms (0x00)
          Max ext adv events: 0
> HCI Event: Command Complete (0x0e) plen 4                 #46 [hci1] 3.538312
      LE Set Extended Advertising Enable (0x08|0x0039) ncmd 1
        Status: Success (0x00)
> HCI Event: LE Meta Event (0x3e) plen 31                   #47 [hci1] 5.021899
      LE Enhanced Connection Complete (0x0a)
        Status: Success (0x00)
        Handle: 3747
        Role: Peripheral (0x01)
        Peer address type: Public (0x00)
        Peer address: DF:A9:FF:F6:B1:1A (OUI DF-A9-FF)
        Local resolvable private address: 00:00:00:00:00:00 (Non-Resolvable)
        Peer resolvable private address: 00:00:00:00:00:00 (Non-Resolvable)
        Connection interval: 100.00 msec (0x0050)
        Connection latency: 0 (0x0000)
        Supervision timeout: 25120 msec (0x09d0)
        Central clock accuracy: 0x01
> HCI Event: LE Meta Event (0x3e) plen 6                    #48 [hci1] 5.022024
      LE Advertising Set Terminated (0x12)
        Status: Success (0x00)
        Handle: 0
        Connection handle: 3747
        Number of completed extended advertising events: 0
< HCI Command: LE Read Remote Used... (0x08|0x0016) plen 2  #49 [hci1] 5.038715
        Handle: 3747 Address: DF:A9:FF:F6:B1:1A (OUI DF-A9-FF)
< ACL Data TX: Handle 3747 flags 0x00 dlen 7                #50 [hci1] 5.038736
      ATT: Exchange MTU Request (0x02) len 2
        Client RX MTU: 251
> HCI Event: Command Status (0x0f) plen 4                   #51 [hci1] 5.039235
      LE Read Remote Used Features (0x08|0x0016) ncmd 1
        Status: Success (0x00)
> HCI Event: Number of Completed Packets (0x13) plen 5      #52 [hci1] 5.223880
        Num handles: 1
        Handle: 3747 Address: DF:A9:FF:F6:B1:1A (OUI DF-A9-FF)
        Count: 1
        #50: len 7 (0 Kb/s)
        Latency: 185 msec (185-185 msec ~185 msec)
> HCI Event: LE Meta Event (0x3e) plen 12                   #53 [hci1] 5.324189
      LE Read Remote Used Features (0x04)
        Status: Success (0x00)
        Handle: 3747 Address: DF:A9:FF:F6:B1:1A (OUI DF-A9-FF)
        Features: 0x2d 0x49 0x00 0xf7 0x67 0xd9 0x00 0x80
          LE Encryption
          Extended Reject Indication
          Peripheral-initiated Features Exchange
          LE Data Packet Length Extension
          LE 2M PHY
          LE Coded PHY
          Channel Selection Algorithm #2
          Periodic Advertising Sync Transfer - Sender
          Periodic Advertising Sync Transfer - Recipient
          Sleep Clock Accuracy Updates
          Connected Isochronous Stream - Central
          Connected Isochronous Stream - Peripheral
          Isochronous Broadcaster
          Synchronized Receiver
          Connected Isochronous Stream (Host Support)
          LE Power Control Request
          LE Power Control Request
          Connection Subrating
          Connection Subrating (Host Support)
          Unknown features (0x8000d90000000000)
> ACL Data RX: Handle 3747 flags 0x02 dlen 7                #54 [hci1] 5.823899
      ATT: Exchange MTU Request (0x02) len 2
        Client RX MTU: 64
> ACL Data RX: Handle 3747 flags 0x02 dlen 7                #55 [hci1] 5.824358
      ATT: Exchange MTU Response (0x03) len 2
        Server RX MTU: 64
< HCI Command: Host Number of Compl.. (0x03|0x0035) plen 5  #56 [hci1] 5.838106
        Num handles: 1
        Handle: 3747 Address: DF:A9:FF:F6:B1:1A (OUI DF-A9-FF)
        Count: 1
< ACL Data TX: Handle 3747 flags 0x00 dlen 7                #57 [hci1] 5.838125
      ATT: Exchange MTU Response (0x03) len 2
        Server RX MTU: 251
< HCI Command: Host Number of Compl.. (0x03|0x0035) plen 5  #58 [hci1] 5.838336
        Num handles: 1
        Handle: 3747 Address: DF:A9:FF:F6:B1:1A (OUI DF-A9-FF)
        Count: 1
> HCI Event: Number of Completed Packets (0x13) plen 5      #59 [hci1] 6.023771
        Num handles: 1
        Handle: 3747 Address: DF:A9:FF:F6:B1:1A (OUI DF-A9-FF)
        Count: 1
        #57: len 7 (0 Kb/s)
        Latency: 185 msec (185-185 msec ~185 msec)
> ACL Data RX: Handle 3747 flags 0x02 dlen 11               #60 [hci1] 8.023945
      SMP: Pairing Request (0x01) len 6
        IO capability: KeyboardDisplay (0x04)
        OOB data: Authentication data not present (0x00)
        Authentication requirement: Bonding, No MITM, SC, No Keypresses (0x09)
        Max encryption key size: 16
        Initiator key distribution: EncKey IdKey Sign (0x07)
        Responder key distribution: EncKey IdKey Sign (0x07)
< HCI Command: Host Number of Compl.. (0x03|0x0035) plen 5  #61 [hci1] 8.038285
        Num handles: 1
        Handle: 3747 Address: DF:A9:FF:F6:B1:1A (OUI DF-A9-FF)
        Count: 1
< ACL Data TX: Handle 3747 flags 0x00 dlen 11               #62 [hci1] 8.038357
      SMP: Pairing Response (0x02) len 6
        IO capability: NoInputNoOutput (0x03)
        OOB data: Authentication data not present (0x00)
        Authentication requirement: Bonding, No MITM, SC, No Keypresses (0x09)
        Max encryption key size: 16
        Initiator key distribution: IdKey (0x02)
        Responder key distribution: <none> (0x00)
> HCI Event: Number of Completed Packets (0x13) plen 5      #63 [hci1] 8.223941
        Num handles: 1
        Handle: 3747 Address: DF:A9:FF:F6:B1:1A (OUI DF-A9-FF)
        Count: 1
        #62: len 11 (0 Kb/s)
        Latency: 185 msec (185-185 msec ~185 msec)
> ACL Data RX: Handle 3747 flags 0x02 dlen 27               #64 [hci1] 8.224240
> ACL Data RX: Handle 3747 flags 0x01 dlen 27               #65 [hci1] 8.224618
> ACL Data RX: Handle 3747 flags 0x01 dlen 15               #66 [hci1] 8.224998
      SMP: Pairing Public Key (0x0c) len 64
        X: e3dd3f93b8623cc84986006701df87a6586867dad9112be64e9a675d6af26b57
        Y: e5b9d4659eac9d03c38869242ea5e103ccd2426e14be3c762fe8cbfb53c6bf6e
< HCI Command: Host Number of Compl.. (0x03|0x0035) plen 5  #67 [hci1] 8.238490
        Num handles: 1
        Handle: 3747 Address: DF:A9:FF:F6:B1:1A (OUI DF-A9-FF)
        Count: 1
< HCI Command: Host Number of Compl.. (0x03|0x0035) plen 5  #68 [hci1] 8.238754
        Num handles: 1
        Handle: 3747 Address: DF:A9:FF:F6:B1:1A (OUI DF-A9-FF)
        Count: 1
< HCI Command: Host Number of Compl.. (0x03|0x0035) plen 5  #69 [hci1] 8.239061
        Num handles: 1
        Handle: 3747 Address: DF:A9:FF:F6:B1:1A (OUI DF-A9-FF)
        Count: 1
< ACL Data TX: Handle 3747 flags 0x00 dlen 27               #70 [hci1] 8.239175
< ACL Data TX: Handle 3747 flags 0x01 dlen 27               #71 [hci1] 8.239200
< ACL Data TX: Handle 3747 flags 0x01 dlen 15               #72 [hci1] 8.239237
      SMP: Pairing Public Key (0x0c) len 64
        X: 98308440221e2d910f0e54b71e7ec652857aa9b5a0dc65028824cc19db1226e9
        Y: 67a4816bcb62efb21701e31fdb27561a6217575fb007a8bbdabe7e28b6f68482
> HCI Event: Number of Completed Packets (0x13) plen 5      #73 [hci1] 8.324371
        Num handles: 1
        Handle: 3747 Address: DF:A9:FF:F6:B1:1A (OUI DF-A9-FF)
        Count: 1
        #70: len 27 (2 Kb/s)
        Latency: 85 msec (85-185 msec ~135 msec)
> HCI Event: Number of Completed Packets (0x13) plen 5      #74 [hci1] 8.324708
        Num handles: 1
        Handle: 3747 Address: DF:A9:FF:F6:B1:1A (OUI DF-A9-FF)
        Count: 1
        #71: len 27 (2 Kb/s)
        Latency: 85 msec (85-185 msec ~110 msec)
< ACL Data TX: Handle 3747 flags 0x00 dlen 21               #75 [hci1] 8.338028
      SMP: Pairing Confirm (0x03) len 16
        Confim value: fca4b483150b5a458eb3f1175cf9a009
> HCI Event: Number of Completed Packets (0x13) plen 5      #76 [hci1] 8.423734
        Num handles: 1
        Handle: 3747 Address: DF:A9:FF:F6:B1:1A (OUI DF-A9-FF)
        Count: 1
        #72: len 15 (0 Kb/s)
        Latency: 184 msec (85-185 msec ~147 msec)
> HCI Event: Number of Completed Packets (0x13) plen 5      #77 [hci1] 8.523933
        Num handles: 1
        Handle: 3747 Address: DF:A9:FF:F6:B1:1A (OUI DF-A9-FF)
        Count: 1
        #75: len 21 (0 Kb/s)
        Latency: 185 msec (85-185 msec ~166 msec)
> ACL Data RX: Handle 3747 flags 0x02 dlen 21               #78 [hci1] 8.524193
      SMP: Pairing Random (0x04) len 16
        Random value: 703eacc54047e0700000000000000000
< HCI Command: Host Number of Compl.. (0x03|0x0035) plen 5  #79 [hci1] 8.538088
        Num handles: 1
        Handle: 3747 Address: DF:A9:FF:F6:B1:1A (OUI DF-A9-FF)
        Count: 1
< ACL Data TX: Handle 3747 flags 0x00 dlen 21               #80 [hci1] 8.538113
      SMP: Pairing Random (0x04) len 16
        Random value: f966a694cbe26df70bb96773e6cc6f5d
> HCI Event: Number of Completed Packets (0x13) plen 5      #81 [hci1] 8.723921
        Num handles: 1
        Handle: 3747 Address: DF:A9:FF:F6:B1:1A (OUI DF-A9-FF)
        Count: 1
        #80: len 21 (0 Kb/s)
        Latency: 185 msec (85-185 msec ~176 msec)
> ACL Data RX: Handle 3747 flags 0x02 dlen 21               #82 [hci1] 8.824156
      SMP: Pairing DHKey Check (0x0d) len 16
        E: 49ab768a04c1f5c4dd146d0a790ae085
< HCI Command: Host Number of Compl.. (0x03|0x0035) plen 5  #83 [hci1] 8.838793
        Num handles: 1
        Handle: 3747 Address: DF:A9:FF:F6:B1:1A (OUI DF-A9-FF)
        Count: 1
< ACL Data TX: Handle 3747 flags 0x00 dlen 21               #84 [hci1] 8.838869
      SMP: Pairing DHKey Check (0x0d) len 16
        E: aec3b7758760dd40251ddda12e3a0227
> HCI Event: Number of Completed Packets (0x13) plen 5      #85 [hci1] 9.023744
        Num handles: 1
        Handle: 3747 Address: DF:A9:FF:F6:B1:1A (OUI DF-A9-FF)
        Count: 1
        #84: len 21 (0 Kb/s)
        Latency: 184 msec (85-185 msec ~180 msec)
> HCI Event: LE Meta Event (0x3e) plen 13                   #86 [hci1] 9.124341
      LE Long Term Key Request (0x05)
        Handle: 3747 Address: DF:A9:FF:F6:B1:1A (OUI DF-A9-FF)
        Random number: 0x0000000000000000
        Encrypted diversifier: 0x0000
< HCI Command: LE Long Term Key Re.. (0x08|0x001a) plen 18  #87 [hci1] 9.138016
        Handle: 3747 Address: DF:A9:FF:F6:B1:1A (OUI DF-A9-FF)
        Long term key: 2f88d6f89851e1c1f0bc8272a09afaf9
> HCI Event: Command Complete (0x0e) plen 6                 #88 [hci1] 9.138700
      LE Long Term Key Request Reply (0x08|0x001a) ncmd 1
        Status: Success (0x00)
        Handle: 3747 Address: DF:A9:FF:F6:B1:1A (OUI DF-A9-FF)
> HCI Event: Encryption Change (0x08) plen 4                #89 [hci1] 9.624000
        Status: Success (0x00)
        Handle: 3747 Address: DF:A9:FF:F6:B1:1A (OUI DF-A9-FF)
        Encryption: Enabled with AES-CCM (0x01)
> ACL Data RX: Handle 3747 flags 0x02 dlen 21               #90 [hci1] 9.724000
      SMP: Identity Information (0x08) len 16
        Identity resolving key: d8a9fbe6f40bf3e388e9c75a89f6b1ad
< ACL Data TX: Handle 3747 flags 0x00 dlen 11               #91 [hci1] 9.748141
      ATT: Read By Type Request (0x08) len 6
        Handle range: 0x0001-0xffff
        Attribute type: Central Address Resolution (0x2aa6)
< HCI Command: Host Number of Compl.. (0x03|0x0035) plen 5  #92 [hci1] 9.748361
        Num handles: 1
        Handle: 3747 Address: DF:A9:FF:F6:B1:1A (OUI DF-A9-FF)
        Count: 1
> HCI Event: Number of Completed Packets (0x13) plen 5      #93 [hci1] 9.923860
        Num handles: 1
        Handle: 3747 Address: DF:A9:FF:F6:B1:1A (OUI DF-A9-FF)
        Count: 1
        #91: len 11 (0 Kb/s)
        Latency: 175 msec (85-185 msec ~178 msec)
> ACL Data RX: Handle 3747 flags 0x02 dlen 12               #94 [hci1] 9.924110
      SMP: Identity Address Information (0x09) len 7
        Address: DF:A9:FF:F6:B1:1A (OUI DF-A9-FF)
< HCI Command: LE Add Device To Re.. (0x08|0x0027) plen 39  #95 [hci1] 9.938606
        Address type: Public (0x00)
        Address: DF:A9:FF:F6:B1:1A (OUI DF-A9-FF)
        Peer identity resolving key: d8a9fbe6f40bf3e388e9c75a89f6b1ad
        Local identity resolving key: 00000000000000000000000000000000
> HCI Event: Command Complete (0x0e) plen 4                 #96 [hci1] 9.939556
      LE Add Device To Resolving List (0x08|0x0027) ncmd 1
        Status: Success (0x00)
< HCI Command: LE Set Privacy Mode (0x08|0x004e) plen 8     #97 [hci1] 9.958039
        Peer Identity address type: Public (0x00)
        Peer Identity address: DF:A9:FF:F6:B1:1A (OUI DF-A9-FF)
        Privacy Mode: Use Device Privacy (0x01)
> HCI Event: Command Complete (0x0e) plen 4                 #98 [hci1] 9.958609
      LE Set Privacy Mode (0x08|0x004e) ncmd 1
        Status: Success (0x00)
< HCI Command: LE Set Address Resol.. (0x08|0x002d) plen 1  #99 [hci1] 9.977976
        Address resolution: Enabled (0x01)
> HCI Event: Command Complete (0x0e) plen 4                #100 [hci1] 9.978382
      LE Set Address Resolution Enable (0x08|0x002d) ncmd 1
        Status: Success (0x00)
< HCI Command: Host Number of Comp.. (0x03|0x0035) plen 5  #101 [hci1] 9.997908
        Num handles: 1
        Handle: 3747 Address: DF:A9:FF:F6:B1:1A (OUI DF-A9-FF)
        Count: 1
> ACL Data RX: Handle 3747 flags 0x02 dlen 13             #102 [hci1] 10.023911
      ATT: Find By Type Value Request (0x06) len 8
        Handle range: 0x0001-0xffff
        Attribute type: Primary Service (0x2800)
          UUID: Published Audio Capabilities (0x1850)
< HCI Command: Host Number of Com.. (0x03|0x0035) plen 5  #103 [hci1] 10.038146
        Num handles: 1
        Handle: 3747 Address: DF:A9:FF:F6:B1:1A (OUI DF-A9-FF)
        Count: 1
< ACL Data TX: Handle 3747 flags 0x00 dlen 9              #104 [hci1] 10.038171
      ATT: Find By Type Value Response (0x07) len 4
        Handle range: 0x00d6-0x00e8
> ACL Data RX: Handle 3747 flags 0x02 dlen 9              #105 [hci1] 10.123931
      ATT: Read By Type Response (0x09) len 4
        Attribute data length: 3
        Attribute data list: 1 entry
        Handle: 0x000f
        Value: 01
< HCI Command: Host Number of Com.. (0x03|0x0035) plen 5  #106 [hci1] 10.138402
        Num handles: 1
        Handle: 3747 Address: DF:A9:FF:F6:B1:1A (OUI DF-A9-FF)
        Count: 1
> HCI Event: Number of Completed Packets (0x13) plen 5    #107 [hci1] 10.223816
        Num handles: 1
        Handle: 3747 Address: DF:A9:FF:F6:B1:1A (OUI DF-A9-FF)
        Count: 1
        #104: len 9 (0 Kb/s)
        Latency: 185 msec (85-185 msec ~181 msec)
> ACL Data RX: Handle 3747 flags 0x02 dlen 13             #108 [hci1] 10.224002
      ATT: Find By Type Value Request (0x06) len 8
        Handle range: 0x00e9-0xffff
        Attribute type: Primary Service (0x2800)
          UUID: Published Audio Capabilities (0x1850)
< HCI Command: Host Number of Com.. (0x03|0x0035) plen 5  #109 [hci1] 10.238700
        Num handles: 1
        Handle: 3747 Address: DF:A9:FF:F6:B1:1A (OUI DF-A9-FF)
        Count: 1
< ACL Data TX: Handle 3747 flags 0x00 dlen 9              #110 [hci1] 10.238888
      ATT: Error Response (0x01) len 4
        Find By Type Value Request (0x06)
        Handle: 0x00e9
        Error: Attribute Not Found (0x0a)
> HCI Event: Number of Completed Packets (0x13) plen 5    #111 [hci1] 10.423911
        Num handles: 1
        Handle: 3747 Address: DF:A9:FF:F6:B1:1A (OUI DF-A9-FF)
        Count: 1
        #110: len 9 (0 Kb/s)
        Latency: 185 msec (85-185 msec ~183 msec)
> ACL Data RX: Handle 3747 flags 0x02 dlen 11             #112 [hci1] 10.424115
      ATT: Read By Type Request (0x08) len 6
        Handle range: 0x00d6-0x00e8
        Attribute type: Characteristic (0x2803)
< HCI Command: Host Number of Com.. (0x03|0x0035) plen 5  #113 [hci1] 10.438485
        Num handles: 1
        Handle: 3747 Address: DF:A9:FF:F6:B1:1A (OUI DF-A9-FF)
        Count: 1
< ACL Data TX: Handle 3747 flags 0x00 dlen 27             #114 [hci1] 10.438575
< ACL Data TX: Handle 3747 flags 0x01 dlen 21             #115 [hci1] 10.438616
      ATT: Read By Type Response (0x09) len 43
        Attribute data length: 7
        Attribute data list: 6 entries
        Handle: 0x00d7
        Value: 12d800c92b
            Properties: 0x12
              Read (0x02)
              Notify (0x10)
            Value Handle: 0x00d8
            Value UUID: Sink PAC (0x2bc9)
        Handle: 0x00da
        Value: 1adb00ca2b
            Properties: 0x1a
              Read (0x02)
              Write (0x08)
              Notify (0x10)
            Value Handle: 0x00db
            Value UUID: Sink Audio Locations (0x2bca)
        Handle: 0x00dd
        Value: 12de00cb2b
            Properties: 0x12
              Read (0x02)
              Notify (0x10)
            Value Handle: 0x00de
            Value UUID: Source PAC (0x2bcb)
        Handle: 0x00e0
        Value: 1ae100cc2b
            Properties: 0x1a
              Read (0x02)
              Write (0x08)
              Notify (0x10)
            Value Handle: 0x00e1
            Value UUID: Source Audio Locations (0x2bcc)
        Handle: 0x00e3
        Value: 12e400cd2b
            Properties: 0x12
              Read (0x02)
              Notify (0x10)
            Value Handle: 0x00e4
            Value UUID: Available Audio Contexts (0x2bcd)
        Handle: 0x00e6
        Value: 12e700ce2b
            Properties: 0x12
              Read (0x02)
              Notify (0x10)
            Value Handle: 0x00e7
            Value UUID: Supported Audio Contexts (0x2bce)
> HCI Event: Number of Completed Packets (0x13) plen 5    #116 [hci1] 10.524258
        Num handles: 1
        Handle: 3747 Address: DF:A9:FF:F6:B1:1A (OUI DF-A9-FF)
        Count: 1
        #114: len 27 (2 Kb/s)
        Latency: 85 msec (85-185 msec ~134 msec)
> HCI Event: Number of Completed Packets (0x13) plen 5    #117 [hci1] 10.623835
        Num handles: 1
        Handle: 3747 Address: DF:A9:FF:F6:B1:1A (OUI DF-A9-FF)
        Count: 1
        #115: len 21 (0 Kb/s)
        Latency: 185 msec (85-185 msec ~159 msec)
> ACL Data RX: Handle 3747 flags 0x02 dlen 11             #118 [hci1] 10.624023
      ATT: Read By Type Request (0x08) len 6
        Handle range: 0x00e7-0x00e8
        Attribute type: Characteristic (0x2803)
< HCI Command: Host Number of Com.. (0x03|0x0035) plen 5  #119 [hci1] 10.638286
        Num handles: 1
        Handle: 3747 Address: DF:A9:FF:F6:B1:1A (OUI DF-A9-FF)
        Count: 1
< ACL Data TX: Handle 3747 flags 0x00 dlen 9              #120 [hci1] 10.638398
      ATT: Error Response (0x01) len 4
        Read By Type Request (0x08)
        Handle: 0x00e7
        Error: Attribute Not Found (0x0a)
> HCI Event: Number of Completed Packets (0x13) plen 5    #121 [hci1] 10.823857
        Num handles: 1
        Handle: 3747 Address: DF:A9:FF:F6:B1:1A (OUI DF-A9-FF)
        Count: 1
        #120: len 9 (0 Kb/s)
        Latency: 185 msec (85-185 msec ~172 msec)
> ACL Data RX: Handle 3747 flags 0x02 dlen 9              #122 [hci1] 10.824117
      ATT: Find Information Request (0x04) len 4
        Handle range: 0x00d9-0x00d9
< HCI Command: Host Number of Com.. (0x03|0x0035) plen 5  #123 [hci1] 10.838545
        Num handles: 1
        Handle: 3747 Address: DF:A9:FF:F6:B1:1A (OUI DF-A9-FF)
        Count: 1
< ACL Data TX: Handle 3747 flags 0x00 dlen 10             #124 [hci1] 10.838680
      ATT: Find Information Response (0x05) len 5
        Format: UUID-16 (0x01)
        Handle: 0x00d9
        UUID: Client Characteristic Configuration (0x2902)
> HCI Event: Number of Completed Packets (0x13) plen 5    #125 [hci1] 11.023779
        Num handles: 1
        Handle: 3747 Address: DF:A9:FF:F6:B1:1A (OUI DF-A9-FF)
        Count: 1
        #124: len 10 (0 Kb/s)
        Latency: 185 msec (85-185 msec ~178 msec)
> ACL Data RX: Handle 3747 flags 0x02 dlen 9              #126 [hci1] 11.024081
      ATT: Find Information Request (0x04) len 4
        Handle range: 0x00dc-0x00dc
< HCI Command: Host Number of Com.. (0x03|0x0035) plen 5  #127 [hci1] 11.038212
        Num handles: 1
        Handle: 3747 Address: DF:A9:FF:F6:B1:1A (OUI DF-A9-FF)
        Count: 1
< ACL Data TX: Handle 3747 flags 0x00 dlen 10             #128 [hci1] 11.038247
      ATT: Find Information Response (0x05) len 5
        Format: UUID-16 (0x01)
        Handle: 0x00dc
        UUID: Client Characteristic Configuration (0x2902)
> HCI Event: Number of Completed Packets (0x13) plen 5    #129 [hci1] 11.223833
        Num handles: 1
        Handle: 3747 Address: DF:A9:FF:F6:B1:1A (OUI DF-A9-FF)
        Count: 1
        #128: len 10 (0 Kb/s)
        Latency: 185 msec (85-185 msec ~182 msec)
> ACL Data RX: Handle 3747 flags 0x02 dlen 9              #130 [hci1] 11.224022
      ATT: Find Information Request (0x04) len 4
        Handle range: 0x00df-0x00df
< HCI Command: Host Number of Com.. (0x03|0x0035) plen 5  #131 [hci1] 11.238243
        Num handles: 1
        Handle: 3747 Address: DF:A9:FF:F6:B1:1A (OUI DF-A9-FF)
        Count: 1
< ACL Data TX: Handle 3747 flags 0x00 dlen 10             #132 [hci1] 11.238295
      ATT: Find Information Response (0x05) len 5
        Format: UUID-16 (0x01)
        Handle: 0x00df
        UUID: Client Characteristic Configuration (0x2902)
> HCI Event: Number of Completed Packets (0x13) plen 5    #133 [hci1] 11.423834
        Num handles: 1
        Handle: 3747 Address: DF:A9:FF:F6:B1:1A (OUI DF-A9-FF)
        Count: 1
        #132: len 10 (0 Kb/s)
        Latency: 185 msec (85-185 msec ~183 msec)
> ACL Data RX: Handle 3747 flags 0x02 dlen 9              #134 [hci1] 11.423972
      ATT: Find Information Request (0x04) len 4
        Handle range: 0x00e2-0x00e2
< HCI Command: Host Number of Com.. (0x03|0x0035) plen 5  #135 [hci1] 11.438603
        Num handles: 1
        Handle: 3747 Address: DF:A9:FF:F6:B1:1A (OUI DF-A9-FF)
        Count: 1
< ACL Data TX: Handle 3747 flags 0x00 dlen 10             #136 [hci1] 11.438716
      ATT: Find Information Response (0x05) len 5
        Format: UUID-16 (0x01)
        Handle: 0x00e2
        UUID: Client Characteristic Configuration (0x2902)
> HCI Event: Number of Completed Packets (0x13) plen 5    #137 [hci1] 11.623895
        Num handles: 1
        Handle: 3747 Address: DF:A9:FF:F6:B1:1A (OUI DF-A9-FF)
        Count: 1
        #136: len 10 (0 Kb/s)
        Latency: 185 msec (85-185 msec ~184 msec)
> ACL Data RX: Handle 3747 flags 0x02 dlen 9              #138 [hci1] 11.623973
      ATT: Find Information Request (0x04) len 4
        Handle range: 0x00e5-0x00e5
< HCI Command: Host Number of Com.. (0x03|0x0035) plen 5  #139 [hci1] 11.638235
        Num handles: 1
        Handle: 3747 Address: DF:A9:FF:F6:B1:1A (OUI DF-A9-FF)
        Count: 1
< ACL Data TX: Handle 3747 flags 0x00 dlen 10             #140 [hci1] 11.638297
      ATT: Find Information Response (0x05) len 5
        Format: UUID-16 (0x01)
        Handle: 0x00e5
        UUID: Client Characteristic Configuration (0x2902)
> HCI Event: Number of Completed Packets (0x13) plen 5    #141 [hci1] 11.824390
        Num handles: 1
        Handle: 3747 Address: DF:A9:FF:F6:B1:1A (OUI DF-A9-FF)
        Count: 1
        #140: len 10 (0 Kb/s)
        Latency: 186 msec (85-186 msec ~185 msec)
> ACL Data RX: Handle 3747 flags 0x02 dlen 9              #142 [hci1] 11.824394
      ATT: Find Information Request (0x04) len 4
        Handle range: 0x00e8-0x00e8
< HCI Command: Host Number of Com.. (0x03|0x0035) plen 5  #143 [hci1] 11.838516
        Num handles: 1
        Handle: 3747 Address: DF:A9:FF:F6:B1:1A (OUI DF-A9-FF)
        Count: 1
< ACL Data TX: Handle 3747 flags 0x00 dlen 10             #144 [hci1] 11.838721
      ATT: Find Information Response (0x05) len 5
        Format: UUID-16 (0x01)
        Handle: 0x00e8
        UUID: Client Characteristic Configuration (0x2902)
> HCI Event: Number of Completed Packets (0x13) plen 5    #145 [hci1] 12.023847
        Num handles: 1
        Handle: 3747 Address: DF:A9:FF:F6:B1:1A (OUI DF-A9-FF)
        Count: 1
        #144: len 10 (0 Kb/s)
        Latency: 185 msec (85-186 msec ~185 msec)
> ACL Data RX: Handle 3747 flags 0x02 dlen 7              #146 [hci1] 12.023937
      ATT: Read Request (0x0a) len 2
        Handle: 0x00e4
< HCI Command: Host Number of Com.. (0x03|0x0035) plen 5  #147 [hci1] 12.038240
        Num handles: 1
        Handle: 3747 Address: DF:A9:FF:F6:B1:1A (OUI DF-A9-FF)
        Count: 1
< ACL Data TX: Handle 3747 flags 0x00 dlen 9              #148 [hci1] 12.038275
      ATT: Read Response (0x0b) len 4
> HCI Event: Number of Completed Packets (0x13) plen 5    #149 [hci1] 12.223749
        Num handles: 1
        Handle: 3747 Address: DF:A9:FF:F6:B1:1A (OUI DF-A9-FF)
        Count: 1
        #148: len 9 (0 Kb/s)
        Latency: 185 msec (85-186 msec ~185 msec)
> HCI Event: Disconnect Complete (0x05) plen 4            #150 [hci1] 13.623937
        Status: Success (0x00)
        Handle: 3747 Address: DF:A9:FF:F6:B1:1A (OUI DF-A9-FF)
        Reason: Remote User Terminated Connection (0x13)
< HCI Command: Reset (0x03|0x0003) plen 0                 #151 [hci1] 18.138088
> HCI Event: Command Complete (0x0e) plen 4               #152 [hci1] 18.138517
      Reset (0x03|0x0003) ncmd 1
        Status: Success (0x00)
@ USER Close: main                                    {0x0001} [hci1] 18.157964
= Close Index: 00:00:00:00:00:00                               [hci1] 18.161458
