Bluetooth monitor ver 5.72
btmon[2514216]: = Note: Linux version 6.14.0-36-generic (x86_64)                                                         0.884516
btmon[2514216]: = Note: Bluetooth subsystem version 2.22                                                                 0.884517
= New Index: 00:00:00:00:00:00 (Primary,UART,hci1)                                                                       0.884518
= New Index: 48:5F:99:8E:E0:64 (Primary,USB,hci0)                                                                        0.884519
= Open Index: 00:00:00:00:00:00                                                                                          1.397950
= Index Info: 00:00:00:00:00:00 (Nordic Semiconductor ASA)                                                               1.397969
zephyr.exe[2514218]: @ USER Open: main (privileged) version 2.22                                                {0x0001} 1.397978
zephyr.exe[2514218]: < HCI Command: Reset (0x03|0x0003) plen 0                                                        #1 1.399064
> HCI Event: Command Complete (0x0e) plen 4                                                                           #2 1.399762
      Reset (0x03|0x0003) ncmd 1
        Status: Success (0x00)
zephyr.exe[2514218]: < HCI Command: Read Local Supported Features (0x04|0x0003) plen 0                                #3 1.417691
> HCI Event: Command Complete (0x0e) plen 12                                                                          #4 1.418333
      Read Local Supported Features (0x04|0x0003) ncmd 1
        Status: Success (0x00)
        Features: 0x00 0x00 0x00 0x00 0x60 0x00 0x00 0x00
          BR/EDR Not Supported
          LE Supported (Controller)
zephyr.exe[2514218]: < HCI Command: Read Local Version Information (0x04|0x0001) plen 0                               #5 1.437454
> HCI Event: Command Complete (0x0e) plen 12                                                                          #6 1.438002
      Read Local Version Information (0x04|0x0001) ncmd 1
        Status: Success (0x00)
        HCI version: Reserved (0x0f) - Revision 12393 (0x3069)
        LMP version: Reserved (0x0f) - Subversion 12393 (0x3069)
        Manufacturer: Nordic Semiconductor ASA (89)
zephyr.exe[2514218]: < HCI Command: Read Local Supported Commands (0x04|0x0002) plen 0                                #7 1.457413
> HCI Event: Command Complete (0x0e) plen 68                                                                          #8 1.458429
      Read Local Supported Commands (0x04|0x0002) ncmd 1
        Status: Success (0x00)
        Commands: 119 entries
          Disconnect (Octet 0 - Bit 5)
          Read Remote Version Information (Octet 2 - Bit 7)
          Set Event Mask (Octet 5 - Bit 6)
          Reset (Octet 5 - Bit 7)
          Read Connection Accept Timeout (Octet 7 - Bit 2)
          Write Connection Accept Timeout (Octet 7 - Bit 3)
          Read Transmit Power Level (Octet 10 - Bit 2)
          Set Controller To Host Flow Control (Octet 10 - Bit 5)
          Host Buffer Size (Octet 10 - Bit 6)
          Host Number of Completed Packets (Octet 10 - Bit 7)
          Read Local Version Information (Octet 14 - Bit 3)
          Read Local Supported Features (Octet 14 - Bit 5)
          Read BD ADDR (Octet 15 - Bit 1)
          Read RSSI (Octet 15 - Bit 5)
          Set Event Mask Page 2 (Octet 22 - Bit 2)
          LE Set Event Mask (Octet 25 - Bit 0)
          LE Read Buffer Size (Octet 25 - Bit 1)
          LE Read Local Supported Features (Octet 25 - Bit 2)
          LE Set Random Address (Octet 25 - Bit 4)
          LE Set Advertising Parameters (Octet 25 - Bit 5)
          LE Read Advertising Channel TX Power (Octet 25 - Bit 6)
          LE Set Advertising Data (Octet 25 - Bit 7)
          LE Set Scan Response Data (Octet 26 - Bit 0)
          LE Set Advertise Enable (Octet 26 - Bit 1)
          LE Set Scan Parameters (Octet 26 - Bit 2)
          LE Set Scan Enable (Octet 26 - Bit 3)
          LE Create Connection (Octet 26 - Bit 4)
          LE Create Connection Cancel (Octet 26 - Bit 5)
          LE Read Accept List Size (Octet 26 - Bit 6)
          LE Clear Accept List (Octet 26 - Bit 7)
          LE Add Device To Accept List (Octet 27 - Bit 0)
          LE Remove Device From Accept List (Octet 27 - Bit 1)
          LE Connection Update (Octet 27 - Bit 2)
          LE Set Host Channel Classification (Octet 27 - Bit 3)
          LE Read Channel Map (Octet 27 - Bit 4)
          LE Read Remote Used Features (Octet 27 - Bit 5)
          LE Encrypt (Octet 27 - Bit 6)
          LE Rand (Octet 27 - Bit 7)
          LE Start Encryption (Octet 28 - Bit 0)
          LE Long Term Key Request Reply (Octet 28 - Bit 1)
          LE Long Term Key Request Neg Reply (Octet 28 - Bit 2)
          LE Read Supported States (Octet 28 - Bit 3)
          LE Receiver Test (Octet 28 - Bit 4)
          LE Transmitter Test (Octet 28 - Bit 5)
          LE Test End (Octet 28 - Bit 6)
          Read Authenticated Payload Timeout (Octet 32 - Bit 4)
          Write Authenticated Payload Timeout (Octet 32 - Bit 5)
          LE Set Data Length (Octet 33 - Bit 6)
          LE Read Suggested Default Data Length (Octet 33 - Bit 7)
          LE Write Suggested Default Data Length (Octet 34 - Bit 0)
          LE Add Device To Resolving List (Octet 34 - Bit 3)
          LE Remove Device From Resolving List (Octet 34 - Bit 4)
          LE Clear Resolving List (Octet 34 - Bit 5)
          LE Read Resolving List Size (Octet 34 - Bit 6)
          LE Set Address Resolution Enable (Octet 35 - Bit 1)
          LE Set Resolvable Private Address Timeout (Octet 35 - Bit 2)
          LE Read Maximum Data Length (Octet 35 - Bit 3)
          LE Read PHY (Octet 35 - Bit 4)
          LE Set Default PHY (Octet 35 - Bit 5)
          LE Set PHY (Octet 35 - Bit 6)
          LE Enhanced Receiver Test (Octet 35 - Bit 7)
          LE Enhanced Transmitter Test (Octet 36 - Bit 0)
          LE Set Advertising Set Random Address (Octet 36 - Bit 1)
          LE Set Extended Advertising Parameters (Octet 36 - Bit 2)
          LE Set Extended Advertising Data (Octet 36 - Bit 3)
          LE Set Extended Scan Response Data (Octet 36 - Bit 4)
          LE Set Extended Advertising Enable (Octet 36 - Bit 5)
          LE Read Maximum Advertising Data Length (Octet 36 - Bit 6)
          LE Read Number of Supported Advertising Sets (Octet 36 - Bit 7)
          LE Remove Advertising Set (Octet 37 - Bit 0)
          LE Clear Advertising Sets (Octet 37 - Bit 1)
          LE Set Periodic Advertising Parameters (Octet 37 - Bit 2)
          LE Set Periodic Advertising Data (Octet 37 - Bit 3)
          LE Set Periodic Advertising Enable (Octet 37 - Bit 4)
          LE Set Extended Scan Parameters (Octet 37 - Bit 5)
          LE Set Extended Scan Enable (Octet 37 - Bit 6)
          LE Extended Create Connection (Octet 37 - Bit 7)
          LE Periodic Advertising Create Sync (Octet 38 - Bit 0)
          LE Periodic Advertising Create Sync Cancel (Octet 38 - Bit 1)
          LE Periodic Advertising Terminate Sync (Octet 38 - Bit 2)
          LE Add Device To Periodic Advertiser List (Octet 38 - Bit 3)
          LE Remove Device From Periodic Advertiser List (Octet 38 - Bit 4)
          LE Clear Periodic Advertiser List (Octet 38 - Bit 5)
          LE Read Periodic Advertiser List Size (Octet 38 - Bit 6)
          LE Read Transmit Power (Octet 38 - Bit 7)
          LE Read RF Path Compensation (Octet 39 - Bit 0)
          LE Write RF Path Compensation (Octet 39 - Bit 1)
          LE Set Privacy Mode (Octet 39 - Bit 2)
          LE Periodic Advertising Receive Enable (Octet 40 - Bit 5)
          LE Periodic Advertising Sync Transfer (Octet 40 - Bit 6)
          LE Periodic Advertising Set Info Transfer (Octet 40 - Bit 7)
          LE Periodic Advertising Sync Transfer Parameters (Octet 41 - Bit 0)
          LE Set Default Periodic Advertisng Sync Transfer Parameters (Octet 41 - Bit 1)
          LE Read Buffer v2 (Octet 41 - Bit 5)
          LE Read ISO TX Sync (Octet 41 - Bit 6)
          LE Set Connected Isochronous Group Parameters (Octet 41 - Bit 7)
          LE Set Connected Isochronous Group Parameters Test (Octet 42 - Bit 0)
          LE Create Connected Isochronous Stream (Octet 42 - Bit 1)
          LE Remove Connected Isochronous Group (Octet 42 - Bit 2)
          LE Accept Connected Isochronous Stream Request (Octet 42 - Bit 3)
          LE Reject Connected Isochronous Stream Request (Octet 42 - Bit 4)
          LE Create Broadcast Isochronous Group (Octet 42 - Bit 5)
          LE Create Broadcast Isochronous Group Test (Octet 42 - Bit 6)
          LE Terminate Broadcast Isochronous Group (Octet 42 - Bit 7)
          LE Broadcast Isochronous Group Create Sync (Octet 43 - Bit 0)
          LE Broadcast Isochronous Group Terminate Sync (Octet 43 - Bit 1)
          LE Request Peer SCA (Octet 43 - Bit 2)
          LE Setup Isochronous Data Path (Octet 43 - Bit 3)
          LE Remove Isochronous Data Path (Octet 43 - Bit 4)
          LE Isochronous Transmit Test (Octet 43 - Bit 5)
          LE Isochronous Receive Test (Octet 43 - Bit 6)
          LE Isochronous Read Test Counters (Octet 43 - Bit 7)
          LE Isochronous Read Test Counters (Octet 44 - Bit 0)
          LE Set Host Feature (Octet 44 - Bit 1)
          Octet 44 - Bit 2 
          Octet 45 - Bit 6 
          Octet 46 - Bit 0 
          Octet 46 - Bit 1 
          Octet 46 - Bit 2 
zephyr.exe[2514218]: < HCI Command: Host Buffer Size (0x03|0x0033) plen 7                                             #9 1.477536
        ACL MTU: 255  ACL max packet: 16
        SCO MTU: 0    SCO max packet: 0
> HCI Event: Command Complete (0x0e) plen 4                                                                          #10 1.478082
      Host Buffer Size (0x03|0x0033) ncmd 1
        Status: Success (0x00)
zephyr.exe[2514218]: < HCI Command: Set Controller To Host Flow Control (0x03|0x0031) plen 1                         #11 1.497506
        Flow control: ACL Data Packets (0x01)
> HCI Event: Command Complete (0x0e) plen 4                                                                          #12 1.497881
      Set Controller To Host Flow Control (0x03|0x0031) ncmd 1
        Status: Success (0x00)
zephyr.exe[2514218]: < HCI Command: LE Read Local Supported Features (0x08|0x0003) plen 0                            #13 1.517435
> HCI Event: Command Complete (0x0e) plen 12                                                                         #14 1.517984
      LE Read Local Supported Features (0x08|0x0003) ncmd 1
        Status: Success (0x00)
        Features: 0xfd 0x79 0x00 0xf7 0x30 0x01 0x00 0x00
          LE Encryption
          Extended Reject Indication
          Peripheral-initiated Features Exchange
          LE Ping
          LE Data Packet Length Extension
          LL Privacy
          Extended Scanner Filter Policies
          LE 2M PHY
          LE Coded PHY
          LE Extended Advertising
          LE Periodic Advertising
          Channel Selection Algorithm #2
          Periodic Advertising Sync Transfer - Sender
          Periodic Advertising Sync Transfer - Recipient
          Sleep Clock Accuracy Updates
          Connected Isochronous Stream - Central
          Connected Isochronous Stream - Peripheral
          Isochronous Broadcaster
          Synchronized Receiver
          Periodic Advertising ADI support
          Connection Subrating
          Unknown features (0x0000010000000000)
zephyr.exe[2514218]: < HCI Command: LE Set Host Feature (0x08|0x0074) plen 2                                         #15 1.537456
        Bit Number: 32
          Connected Isochronous Stream (Host Support)
        Bit Value: 1
> HCI Event: Command Complete (0x0e) plen 4                                                                          #16 1.537868
      LE Set Host Feature (0x08|0x0074) ncmd 1
        Status: Success (0x00)
zephyr.exe[2514218]: < HCI Command: LE Read Buffer v2 (0x08|0x0060) plen 0                                           #17 1.557412
> HCI Event: Command Complete (0x0e) plen 10                                                                         #18 1.557902
      LE Read Buffer v2 (0x08|0x0060) ncmd 1
        Status: Success (0x00)
        ACL MTU: 27
        ACL max packet: 3
        ISO MTU: 318
        ISO max packet: 3
zephyr.exe[2514218]: < HCI Command: LE Read Maximum Advertising Data Length (0x08|0x003a) plen 0                     #19 1.577400
> HCI Event: Command Complete (0x0e) plen 6                                                                          #20 1.577815
      LE Read Maximum Advertising Data Length (0x08|0x003a) ncmd 1
        Status: Success (0x00)
        Max length: 1650
zephyr.exe[2514218]: < HCI Command: LE Read Supported States (0x08|0x001c) plen 0                                    #21 1.597446
> HCI Event: Command Complete (0x0e) plen 12                                                                         #22 1.597928
      LE Read Supported States (0x08|0x001c) ncmd 1
        Status: Success (0x00)
        States: 0x000003ff3e0306ff
          Non-connectable Advertising State
          Scannable Advertising State
          Connectable Advertising State
          High Duty Cycle Directed Advertising State
          Passive Scanning State
          Active Scanning State
          Initiating State
            and Connection State (Central Role)
          Connection State (Peripheral Role)
          Scannable Advertising State
            and Passive Scanning State
          Connectable Advertising State
            and Passive Scanning State
          Non-connectable Advertising State
            and Initiating State
          Scannable Advertising State
            and Initiating State
          Active Scanning State
            and Connection State (Central Role)
          Passive Scanning State
            and Connection State (Peripheral Role)
          Active Scanning State
            and Connection State (Peripheral Role)
          Initiating State
            and Connection State (Central Role)
            and Central Role & Central Role
          Low Duty Cycle Directed Advertising State
          Connectable Advertising State
            and Initiating State
            and Central Role & Peripheral Role
          High Duty Cycle Directed Advertising State
            and Initiating State
            and Central Role & Peripheral Role
          Low Duty Cycle Directed Advertising State
            and Initiating State
            and Central Role & Peripheral Role
          Connectable Advertising State
            and Connection State (Central Role)
            and Central Role & Peripheral Role
          High Duty Cycle Directed Advertising State
            and Connection State (Central Role)
            and Central Role & Peripheral Role
          Low Duty Cycle Directed Advertising State
            and Connection State (Central Role)
            and Central Role & Peripheral Role
          Connectable Advertising State
            and Connection State (Peripheral Role)
            and Central Role & Peripheral Role
          High Duty Cycle Directed Advertising State
            and Connection State (Peripheral Role)
            and Peripheral Role & Peripheral Role
          Low Duty Cycle Directed Advertising State
            and Connection State (Peripheral Role)
            and Peripheral Role & Peripheral Role
          Initiating State
            and Connection State (Peripheral Role)
            and Central Role & Peripheral Role
zephyr.exe[2514218]: < HCI Command: LE Read Maximum Data Length (0x08|0x002f) plen 0                                 #23 1.617435
> HCI Event: Command Complete (0x0e) plen 12                                                                         #24 1.617911
      LE Read Maximum Data Length (0x08|0x002f) ncmd 1
        Status: Success (0x00)
        Max TX octets: 251
        Max TX time: 2704
        Max RX octets: 251
        Max RX time: 2704
zephyr.exe[2514218]: < HCI Command: LE Write Suggested Default Data Length (0x08|0x0024) plen 4                      #25 1.637470
        TX octets: 251
        TX time: 2704
> HCI Event: Command Complete (0x0e) plen 4                                                                          #26 1.637992
      LE Write Suggested Default Data Length (0x08|0x0024) ncmd 1
        Status: Success (0x00)
zephyr.exe[2514218]: < HCI Command: LE Read Resolving List Size (0x08|0x002a) plen 0                                 #27 1.657456
> HCI Event: Command Complete (0x0e) plen 5                                                                          #28 1.657891
      LE Read Resolving List Size (0x08|0x002a) ncmd 1
        Status: Success (0x00)
        Size: 8
zephyr.exe[2514218]: < HCI Command: LE Set Event Mask (0x08|0x0001) plen 8                                           #29 1.677503
        Mask: 0x000002023f87fa5e
          LE Advertising Report
          LE Connection Update Complete
          LE Read Remote Used Features Complete
          LE Long Term Key Request
          LE Data Length Change
          LE Enhanced Connection Complete
          LE PHY Update Complete
          LE Extended Advertising Report
          LE Periodic Advertising Sync Established
          LE Periodic Advertising Report
          LE Periodic Advertising Sync Lost
          LE Extended Scan Timeout
          LE Extended Advertising Set Terminated
          LE Scan Request Received
          LE Periodic Advertising Sync Transfer Rvc
          LE CIS Established
          LE CIS Request
          LE Create BIG Complete
          LE Terminate BIG Complete
          LE BIG Sync Estabilished Complete
          LE BIG Sync Lost
          LE BIG Info Advertising Report
          Unknown mask (0x0000020000000000)
> HCI Event: Command Complete (0x0e) plen 4                                                                          #30 1.678084
      LE Set Event Mask (0x08|0x0001) ncmd 1
        Status: Success (0x00)
zephyr.exe[2514218]: < HCI Command: Set Event Mask (0x03|0x0001) plen 8                                              #31 1.697500
        Mask: 0x2000800002008890
          Disconnection Complete
          Encryption Change
          Read Remote Version Information Complete
          Hardware Error
          Data Buffer Overflow
          Encryption Key Refresh Complete
          LE Meta
> HCI Event: Command Complete (0x0e) plen 4                                                                          #32 1.698051
      Set Event Mask (0x03|0x0001) ncmd 1
        Status: Success (0x00)
zephyr.exe[2514218]: < HCI Command: Read BD ADDR (0x04|0x0009) plen 0                                                #33 1.717482
> HCI Event: Command Complete (0x0e) plen 10                                                                         #34 1.717939
      Read BD ADDR (0x04|0x0009) ncmd 1
        Status: Success (0x00)
        Address: 00:00:00:00:00:00 (OUI 00-00-00)
zephyr.exe[2514218]: < HCI Command: LE Set Random Address (0x08|0x0005) plen 6                                       #35 1.737504
        Address: D5:B6:CC:31:DB:3B (Static)
> HCI Event: Command Complete (0x0e) plen 4                                                                          #36 1.738055
      LE Set Random Address (0x08|0x0005) ncmd 1
        Status: Success (0x00)
zephyr.exe[2514218]: < HCI Command: LE Set Extended Advertising Parameters (0x08|0x0036) plen 25                     #37 7.177894
        Handle: 0x00
        Properties: 0x0013
          Connectable
          Scannable
          Use legacy advertising PDUs: ADV_IND
        Min advertising interval: 100.000 msec (0x00a0)
        Max advertising interval: 150.000 msec (0x00f0)
        Channel map: 37, 38, 39 (0x07)
        Own address type: Random (0x01)
        Peer address type: Public (0x00)
        Peer address: 00:00:00:00:00:00 (OUI 00-00-00)
        Filter policy: Allow Scan Request from Any, Allow Connect Request from Any (0x00)
        TX power: Host has no preference (0x7f)
        Primary PHY: LE 1M (0x01)
        Secondary max skip: 0x00
        Secondary PHY: LE 1M (0x01)
        SID: 0x00
        Scan request notifications: Disabled (0x00)
> HCI Event: Command Complete (0x0e) plen 5                                                                          #38 7.178845
      LE Set Extended Advertising Parameters (0x08|0x0036) ncmd 1
        Status: Success (0x00)
        TX power (selected): 0 dbm (0x00)
zephyr.exe[2514218]: < HCI Command: LE Set Advertising Set Random Address (0x08|0x0035) plen 7                       #39 7.197556
        Advertising handle: 0x00
        Advertising random address: D5:B6:CC:31:DB:3B (Static)
> HCI Event: Command Complete (0x0e) plen 4                                                                          #40 7.198120
      LE Set Advertising Set Random Address (0x08|0x0035) ncmd 1
        Status: Success (0x00)
zephyr.exe[2514218]: < HCI Command: LE Set Extended Advertising Data (0x08|0x0037) plen 22                           #41 7.217535
        Handle: 0x00
        Operation: Complete extended advertising data (0x03)
        Fragment preference: Minimize fragmentation (0x01)
        Data length: 0x12
        Flags: 0x06
          LE General Discoverable Mode
          BR/EDR Not Supported
        Name (complete): Tester_F6B11A
> HCI Event: Command Complete (0x0e) plen 4                                                                          #42 7.218297
      LE Set Extended Advertising Data (0x08|0x0037) ncmd 1
        Status: Success (0x00)
zephyr.exe[2514218]: < HCI Command: LE Set Extended Scan Response Data (0x08|0x0038) plen 4                          #43 7.237533
        Handle: 0x00
        Operation: Complete scan response data (0x03)
        Fragment preference: Minimize fragmentation (0x01)
        Data length: 0x00
> HCI Event: Command Complete (0x0e) plen 4                                                                          #44 7.238051
      LE Set Extended Scan Response Data (0x08|0x0038) ncmd 1
        Status: Success (0x00)
zephyr.exe[2514218]: < HCI Command: LE Set Extended Advertising Enable (0x08|0x0039) plen 6                          #45 7.257531
        Extended advertising: Enabled (0x01)
        Number of sets: 1 (0x01)
        Entry 0
          Handle: 0x00
          Duration: 0 ms (0x00)
          Max ext adv events: 0
> HCI Event: Command Complete (0x0e) plen 4                                                                          #46 7.258083
      LE Set Extended Advertising Enable (0x08|0x0039) ncmd 1
        Status: Success (0x00)
> HCI Event: LE Meta Event (0x3e) plen 31                                                                            #47 7.786084
      LE Enhanced Connection Complete (0x0a)
        Status: Success (0x00)
        Handle: 3
        Role: Peripheral (0x01)
        Peer address type: Public (0x00)
        Peer address: DF:A9:FF:F6:B1:1A (OUI DF-A9-FF)
        Local resolvable private address: 00:00:00:00:00:00 (Non-Resolvable)
        Peer resolvable private address: 00:00:00:00:00:00 (Non-Resolvable)
        Connection interval: 87.50 msec (0x0046)
        Connection latency: 0 (0x0000)
        Supervision timeout: 25120 msec (0x09d0)
        Central clock accuracy: 0x01
> HCI Event: LE Meta Event (0x3e) plen 6                                                                             #48 7.786250
      LE Advertising Set Terminated (0x12)
        Status: Success (0x00)
        Handle: 0
        Connection handle: 3
        Number of completed extended advertising events: 0
zephyr.exe[2514218]: < HCI Command: LE Read Remote Used Features (0x08|0x0016) plen 2                                #49 7.798445
        Handle: 3 Address: DF:A9:FF:F6:B1:1A (OUI DF-A9-FF)
zephyr.exe[2514218]: < ACL Data TX: Handle 3 flags 0x00 dlen 7                                                       #50 7.798470
      ATT: Exchange MTU Request (0x02) len 2
        Client RX MTU: 251
> HCI Event: Command Status (0x0f) plen 4                                                                            #51 7.799042
      LE Read Remote Used Features (0x08|0x0016) ncmd 1
        Status: Success (0x00)
> HCI Event: Number of Completed Packets (0x13) plen 5                                                               #52 7.962082
        Num handles: 1
        Handle: 3 Address: DF:A9:FF:F6:B1:1A (OUI DF-A9-FF)
        Count: 1
        #50: len 7 (0 Kb/s)
        Latency: 163 msec (163-163 msec ~163 msec)
> HCI Event: LE Meta Event (0x3e) plen 12                                                                            #53 8.050020
      LE Read Remote Used Features (0x04)
        Status: Success (0x00)
        Handle: 3 Address: DF:A9:FF:F6:B1:1A (OUI DF-A9-FF)
        Features: 0x2d 0x49 0x00 0xf7 0x67 0xd8 0x00 0x00
          LE Encryption
          Extended Reject Indication
          Peripheral-initiated Features Exchange
          LE Data Packet Length Extension
          LE 2M PHY
          LE Coded PHY
          Channel Selection Algorithm #2
          Periodic Advertising Sync Transfer - Sender
          Periodic Advertising Sync Transfer - Recipient
          Sleep Clock Accuracy Updates
          Connected Isochronous Stream - Central
          Connected Isochronous Stream - Peripheral
          Isochronous Broadcaster
          Synchronized Receiver
          Connected Isochronous Stream (Host Support)
          LE Power Control Request
          LE Power Control Request
          Connection Subrating
          Connection Subrating (Host Support)
          Unknown features (0x0000d80000000000)
> ACL Data RX: Handle 3 flags 0x02 dlen 11                                                                          #54 10.499696
      SMP: Pairing Request (0x01) len 6
        IO capability: KeyboardDisplay (0x04)
        OOB data: Authentication data not present (0x00)
        Authentication requirement: Bonding, No MITM, SC, No Keypresses (0x09)
        Max encryption key size: 16
        Initiator key distribution: EncKey IdKey (0x03)
        Responder key distribution: EncKey IdKey Sign (0x07)
> ACL Data RX: Handle 3 flags 0x02 dlen 7                                                                           #55 10.500135
      ATT: Exchange MTU Response (0x03) len 2
        Server RX MTU: 23
zephyr.exe[2514218]: < HCI Command: Host Number of Completed Packets (0x03|0x0035) plen 5                           #56 10.518068
        Num handles: 1
        Handle: 3 Address: DF:A9:FF:F6:B1:1A (OUI DF-A9-FF)
        Count: 1
zephyr.exe[2514218]: < ACL Data TX: Handle 3 flags 0x00 dlen 11                                                     #57 10.518284
      SMP: Pairing Response (0x02) len 6
        IO capability: DisplayOnly (0x00)
        OOB data: Authentication data not present (0x00)
        Authentication requirement: Bonding, No MITM, SC, No Keypresses (0x09)
        Max encryption key size: 16
        Initiator key distribution: IdKey (0x02)
        Responder key distribution: <none> (0x00)
zephyr.exe[2514218]: < HCI Command: Host Number of Completed Packets (0x03|0x0035) plen 5                           #58 10.518463
        Num handles: 1
        Handle: 3 Address: DF:A9:FF:F6:B1:1A (OUI DF-A9-FF)
        Count: 1
> HCI Event: Number of Completed Packets (0x13) plen 5                                                              #59 10.674886
        Num handles: 1
        Handle: 3 Address: DF:A9:FF:F6:B1:1A (OUI DF-A9-FF)
        Count: 1
        #57: len 11 (0 Kb/s)
        Latency: 156 msec (156-163 msec ~160 msec)
> ACL Data RX: Handle 3 flags 0x02 dlen 27                                                                          #60 10.675084
> ACL Data RX: Handle 3 flags 0x01 dlen 27                                                                          #61 10.675660
> ACL Data RX: Handle 3 flags 0x01 dlen 15                                                                          #62 10.676038
      SMP: Pairing Public Key (0x0c) len 64
        X: ec40517000ec7445beaf76916855ccc4cc2c01cddaa0dbba1ba73d08fbc3b76a
        Y: 5f721e53eb01b97291a6b048f48ea93ba147032e41d65d40ede4663541492b88
zephyr.exe[2514218]: < HCI Command: Host Number of Completed Packets (0x03|0x0035) plen 5                           #63 10.678250
        Num handles: 1
        Handle: 3 Address: DF:A9:FF:F6:B1:1A (OUI DF-A9-FF)
        Count: 1
zephyr.exe[2514218]: < HCI Command: Host Number of Completed Packets (0x03|0x0035) plen 5                           #64 10.678454
        Num handles: 1
        Handle: 3 Address: DF:A9:FF:F6:B1:1A (OUI DF-A9-FF)
        Count: 1
zephyr.exe[2514218]: < HCI Command: Host Number of Completed Packets (0x03|0x0035) plen 5                           #65 10.678730
        Num handles: 1
        Handle: 3 Address: DF:A9:FF:F6:B1:1A (OUI DF-A9-FF)
        Count: 1
zephyr.exe[2514218]: < ACL Data TX: Handle 3 flags 0x00 dlen 27                                                     #66 10.678919
zephyr.exe[2514218]: < ACL Data TX: Handle 3 flags 0x01 dlen 27                                                     #67 10.678936
zephyr.exe[2514218]: < ACL Data TX: Handle 3 flags 0x01 dlen 15                                                     #68 10.678940
      SMP: Pairing Public Key (0x0c) len 64
        X: 98308440221e2d910f0e54b71e7ec652857aa9b5a0dc65028824cc19db1226e9
        Y: 67a4816bcb62efb21701e31fdb27561a6217575fb007a8bbdabe7e28b6f68482
> HCI Event: Number of Completed Packets (0x13) plen 5                                                              #69 10.762638
        Num handles: 1
        Handle: 3 Address: DF:A9:FF:F6:B1:1A (OUI DF-A9-FF)
        Count: 1
        #66: len 27 (2 Kb/s)
        Latency: 83 msec (83-163 msec ~121 msec)
> HCI Event: Number of Completed Packets (0x13) plen 5                                                              #70 10.763613
        Num handles: 1
        Handle: 3 Address: DF:A9:FF:F6:B1:1A (OUI DF-A9-FF)
        Count: 1
        #67: len 27 (2 Kb/s)
        Latency: 84 msec (83-163 msec ~103 msec)
zephyr.exe[2514218]: < ACL Data TX: Handle 3 flags 0x00 dlen 21                                                     #71 10.777937
      SMP: Pairing Confirm (0x03) len 16
        Confim value: 7f58ad9fa134d2ac5b2b303efd616003
> HCI Event: Number of Completed Packets (0x13) plen 5                                                              #72 10.849553
        Num handles: 1
        Handle: 3 Address: DF:A9:FF:F6:B1:1A (OUI DF-A9-FF)
        Count: 1
        #68: len 15 (0 Kb/s)
        Latency: 170 msec (83-170 msec ~136 msec)
> HCI Event: Number of Completed Packets (0x13) plen 5                                                              #73 10.937201
        Num handles: 1
        Handle: 3 Address: DF:A9:FF:F6:B1:1A (OUI DF-A9-FF)
        Count: 1
        #71: len 21 (1 Kb/s)
        Latency: 159 msec (83-170 msec ~148 msec)
> ACL Data RX: Handle 3 flags 0x02 dlen 21                                                                          #74 10.937533
      SMP: Pairing Random (0x04) len 16
        Random value: 4e0ea575ad31fc1f0000000000000000
zephyr.exe[2514218]: < HCI Command: Host Number of Completed Packets (0x03|0x0035) plen 5                           #75 10.938159
        Num handles: 1
        Handle: 3 Address: DF:A9:FF:F6:B1:1A (OUI DF-A9-FF)
        Count: 1
zephyr.exe[2514218]: < ACL Data TX: Handle 3 flags 0x00 dlen 21                                                     #76 10.938247
      SMP: Pairing Random (0x04) len 16
        Random value: 8e6108f966a694cbe26df70bb96773e6
> HCI Event: Number of Completed Packets (0x13) plen 5                                                              #77 11.112049
        Num handles: 1
        Handle: 3 Address: DF:A9:FF:F6:B1:1A (OUI DF-A9-FF)
        Count: 1
        #76: len 21 (0 Kb/s)
        Latency: 173 msec (83-173 msec ~160 msec)
> ACL Data RX: Handle 3 flags 0x02 dlen 21                                                                          #78 11.287473
      SMP: Pairing DHKey Check (0x0d) len 16
        E: 63766608b6077852e626b9aa3f3377da
zephyr.exe[2514218]: < HCI Command: Host Number of Completed Packets (0x03|0x0035) plen 5                           #79 11.298464
        Num handles: 1
        Handle: 3 Address: DF:A9:FF:F6:B1:1A (OUI DF-A9-FF)
        Count: 1
zephyr.exe[2514218]: < ACL Data TX: Handle 3 flags 0x00 dlen 21                                                     #80 11.298664
      SMP: Pairing DHKey Check (0x0d) len 16
        E: 049b090d3d79899636a74a342bdde81a
> HCI Event: Number of Completed Packets (0x13) plen 5                                                              #81 11.462008
        Num handles: 1
        Handle: 3 Address: DF:A9:FF:F6:B1:1A (OUI DF-A9-FF)
        Count: 1
        #80: len 21 (1 Kb/s)
        Latency: 163 msec (83-173 msec ~162 msec)
> HCI Event: LE Meta Event (0x3e) plen 13                                                                           #82 11.550106
      LE Long Term Key Request (0x05)
        Handle: 3 Address: DF:A9:FF:F6:B1:1A (OUI DF-A9-FF)
        Random number: 0x0000000000000000
        Encrypted diversifier: 0x0000
zephyr.exe[2514218]: < HCI Command: LE Long Term Key Request Reply (0x08|0x001a) plen 18                            #83 11.557927
        Handle: 3 Address: DF:A9:FF:F6:B1:1A (OUI DF-A9-FF)
        Long term key: 08aaeb959364e533d0a5070c2053d34b
> HCI Event: Command Complete (0x0e) plen 6                                                                         #84 11.558610
      LE Long Term Key Request Reply (0x08|0x001a) ncmd 1
        Status: Success (0x00)
        Handle: 3 Address: DF:A9:FF:F6:B1:1A (OUI DF-A9-FF)
> HCI Event: Encryption Change (0x08) plen 4                                                                        #85 11.987253
        Status: Success (0x00)
        Handle: 3 Address: DF:A9:FF:F6:B1:1A (OUI DF-A9-FF)
        Encryption: Enabled with AES-CCM (0x01)
> ACL Data RX: Handle 3 flags 0x02 dlen 21                                                                          #86 12.074966
      SMP: Identity Information (0x08) len 16
        Identity resolving key: 25d7b27b88d581f5a0398c69c296710d
zephyr.exe[2514218]: < HCI Command: Host Number of Completed Packets (0x03|0x0035) plen 5                           #87 12.108360
        Num handles: 1
        Handle: 3 Address: DF:A9:FF:F6:B1:1A (OUI DF-A9-FF)
        Count: 1
> ACL Data RX: Handle 3 flags 0x02 dlen 12                                                                          #88 12.249783
      SMP: Identity Address Information (0x09) len 7
        Address: DF:A9:FF:F6:B1:1A (OUI DF-A9-FF)
zephyr.exe[2514218]: < HCI Command: LE Add Device To Resolving List (0x08|0x0027) plen 39                           #89 12.257800
        Address type: Public (0x00)
        Address: DF:A9:FF:F6:B1:1A (OUI DF-A9-FF)
        Peer identity resolving key: 25d7b27b88d581f5a0398c69c296710d
        Local identity resolving key: 00000000000000000000000000000000
> HCI Event: Command Complete (0x0e) plen 4                                                                         #90 12.258863
      LE Add Device To Resolving List (0x08|0x0027) ncmd 1
        Status: Success (0x00)
zephyr.exe[2514218]: < HCI Command: LE Set Privacy Mode (0x08|0x004e) plen 8                                        #91 12.277796
        Peer Identity address type: Public (0x00)
        Peer Identity address: DF:A9:FF:F6:B1:1A (OUI DF-A9-FF)
        Privacy Mode: Use Device Privacy (0x01)
> HCI Event: Command Complete (0x0e) plen 4                                                                         #92 12.278281
      LE Set Privacy Mode (0x08|0x004e) ncmd 1
        Status: Success (0x00)
zephyr.exe[2514218]: < HCI Command: LE Set Address Resolution Enable (0x08|0x002d) plen 1                           #93 12.297893
        Address resolution: Enabled (0x01)
> HCI Event: Command Complete (0x0e) plen 4                                                                         #94 12.298543
      LE Set Address Resolution Enable (0x08|0x002d) ncmd 1
        Status: Success (0x00)
zephyr.exe[2514218]: < HCI Command: Host Number of Completed Packets (0x03|0x0035) plen 5                           #95 12.317925
        Num handles: 1
        Handle: 3 Address: DF:A9:FF:F6:B1:1A (OUI DF-A9-FF)
        Count: 1
> ACL Data RX: Handle 3 flags 0x02 dlen 11                                                                          #96 12.424721
      ATT: Read By Group Type Request (0x10) len 6
        Handle range: 0x0001-0xffff
        Attribute group type: Primary Service (0x2800)
zephyr.exe[2514218]: < HCI Command: Host Number of Completed Packets (0x03|0x0035) plen 5                           #97 12.438165
        Num handles: 1
        Handle: 3 Address: DF:A9:FF:F6:B1:1A (OUI DF-A9-FF)
        Count: 1
zephyr.exe[2514218]: < ACL Data TX: Handle 3 flags 0x00 dlen 24                                                     #98 12.438364
      ATT: Read By Group Type Response (0x11) len 19
        Attribute data length: 6
        Attribute group list: 3 entries
        Handle range: 0x0001-0x000a
        UUID: Generic Attribute Profile (0x1801)
        Handle range: 0x000b-0x0011
        UUID: Generic Access Profile (0x1800)
        Handle range: 0x0012-0x0020
        UUID: Device Information (0x180a)
> HCI Event: Number of Completed Packets (0x13) plen 5                                                              #99 12.599635
        Num handles: 1
        Handle: 3 Address: DF:A9:FF:F6:B1:1A (OUI DF-A9-FF)
        Count: 1
        #98: len 24 (1 Kb/s)
        Latency: 161 msec (83-173 msec ~161 msec)
> ACL Data RX: Handle 3 flags 0x02 dlen 11                                                                         #100 12.599873
      ATT: Read By Group Type Request (0x10) len 6
        Handle range: 0x0021-0xffff
        Attribute group type: Primary Service (0x2800)
zephyr.exe[2514218]: < HCI Command: Host Number of Completed Packets (0x03|0x0035) plen 5                          #101 12.618448
        Num handles: 1
        Handle: 3 Address: DF:A9:FF:F6:B1:1A (OUI DF-A9-FF)
        Count: 1
zephyr.exe[2514218]: < ACL Data TX: Handle 3 flags 0x00 dlen 24                                                    #102 12.618614
      ATT: Read By Group Type Response (0x11) len 19
        Attribute data length: 6
        Attribute group list: 3 entries
        Handle range: 0x0021-0x0023
        UUID: Immediate Alert (0x1802)
        Handle range: 0x0024-0x0050
        UUID: Generic Telephony Bearer (0x184c)
        Handle range: 0x0051-0x007d
        UUID: Telephony Bearer (0x184b)
> HCI Event: Number of Completed Packets (0x13) plen 5                                                             #103 12.774602
        Num handles: 1
        Handle: 3 Address: DF:A9:FF:F6:B1:1A (OUI DF-A9-FF)
        Count: 1
        #102: len 24 (1 Kb/s)
        Latency: 155 msec (83-173 msec ~158 msec)
> ACL Data RX: Handle 3 flags 0x02 dlen 11                                                                         #104 12.774863
      ATT: Read By Group Type Request (0x10) len 6
        Handle range: 0x007e-0xffff
        Attribute group type: Primary Service (0x2800)
zephyr.exe[2514218]: < HCI Command: Host Number of Completed Packets (0x03|0x0035) plen 5                          #105 12.778244
        Num handles: 1
        Handle: 3 Address: DF:A9:FF:F6:B1:1A (OUI DF-A9-FF)
        Count: 1
zephyr.exe[2514218]: < ACL Data TX: Handle 3 flags 0x00 dlen 9                                                     #106 12.778382
      ATT: Error Response (0x01) len 4
        Read By Group Type Request (0x10)
        Handle: 0x007e
        Error: Attribute Not Found (0x0a)
> HCI Event: Number of Completed Packets (0x13) plen 5                                                             #107 12.949669
        Num handles: 1
        Handle: 3 Address: DF:A9:FF:F6:B1:1A (OUI DF-A9-FF)
        Count: 1
        #106: len 9 (0 Kb/s)
        Latency: 171 msec (83-173 msec ~165 msec)
> ACL Data RX: Handle 3 flags 0x02 dlen 13                                                                         #108 12.949865
      ATT: Find By Type Value Request (0x06) len 8
        Handle range: 0x0001-0xffff
        Attribute type: Primary Service (0x2800)
          UUID: Telephony Bearer (0x184b)
zephyr.exe[2514218]: < HCI Command: Host Number of Completed Packets (0x03|0x0035) plen 5                          #109 12.958411
        Num handles: 1
        Handle: 3 Address: DF:A9:FF:F6:B1:1A (OUI DF-A9-FF)
        Count: 1
zephyr.exe[2514218]: < ACL Data TX: Handle 3 flags 0x00 dlen 9                                                     #110 12.958511
      ATT: Find By Type Value Response (0x07) len 4
        Handle range: 0x0051-0x007d
> HCI Event: Number of Completed Packets (0x13) plen 5                                                             #111 13.124601
        Num handles: 1
        Handle: 3 Address: DF:A9:FF:F6:B1:1A (OUI DF-A9-FF)
        Count: 1
        #110: len 9 (0 Kb/s)
        Latency: 166 msec (83-173 msec ~165 msec)
> ACL Data RX: Handle 3 flags 0x02 dlen 13                                                                         #112 13.124853
      ATT: Find By Type Value Request (0x06) len 8
        Handle range: 0x007e-0xffff
        Attribute type: Primary Service (0x2800)
          UUID: Telephony Bearer (0x184b)
zephyr.exe[2514218]: < HCI Command: Host Number of Completed Packets (0x03|0x0035) plen 5                          #113 13.138277
        Num handles: 1
        Handle: 3 Address: DF:A9:FF:F6:B1:1A (OUI DF-A9-FF)
        Count: 1
zephyr.exe[2514218]: < ACL Data TX: Handle 3 flags 0x00 dlen 9                                                     #114 13.138439
      ATT: Error Response (0x01) len 4
        Find By Type Value Request (0x06)
        Handle: 0x007e
        Error: Attribute Not Found (0x0a)
> HCI Event: Number of Completed Packets (0x13) plen 5                                                             #115 13.299548
        Num handles: 1
        Handle: 3 Address: DF:A9:FF:F6:B1:1A (OUI DF-A9-FF)
        Count: 1
        #114: len 9 (0 Kb/s)
        Latency: 161 msec (83-173 msec ~163 msec)
> ACL Data RX: Handle 3 flags 0x02 dlen 11                                                                         #116 13.299841
      ATT: Read By Type Request (0x08) len 6
        Handle range: 0x0051-0x007d
        Attribute type: Characteristic (0x2803)
zephyr.exe[2514218]: < HCI Command: Host Number of Completed Packets (0x03|0x0035) plen 5                          #117 13.318165
        Num handles: 1
        Handle: 3 Address: DF:A9:FF:F6:B1:1A (OUI DF-A9-FF)
        Count: 1
zephyr.exe[2514218]: < ACL Data TX: Handle 3 flags 0x00 dlen 20                                                    #118 13.318301
      ATT: Read By Type Response (0x09) len 15
        Attribute data length: 7
        Attribute data list: 2 entries
        Handle: 0x0052
        Value: 125300b32b
            Properties: 0x12
              Read (0x02)
              Notify (0x10)
            Value Handle: 0x0053
            Value UUID: Bearer Provider Name (0x2bb3)
        Handle: 0x0055
        Value: 025600b42b
            Properties: 0x02
              Read (0x02)
            Value Handle: 0x0056
            Value UUID: Bearer UCI (0x2bb4)
> HCI Event: Number of Completed Packets (0x13) plen 5                                                             #119 13.474658
        Num handles: 1
        Handle: 3 Address: DF:A9:FF:F6:B1:1A (OUI DF-A9-FF)
        Count: 1
        #118: len 20 (1 Kb/s)
        Latency: 156 msec (83-173 msec ~159 msec)
> ACL Data RX: Handle 3 flags 0x02 dlen 11                                                                         #120 13.474796
      ATT: Read By Type Request (0x08) len 6
        Handle range: 0x0056-0x007d
        Attribute type: Characteristic (0x2803)
zephyr.exe[2514218]: < HCI Command: Host Number of Completed Packets (0x03|0x0035) plen 5                          #121 13.478247
        Num handles: 1
        Handle: 3 Address: DF:A9:FF:F6:B1:1A (OUI DF-A9-FF)
        Count: 1
zephyr.exe[2514218]: < ACL Data TX: Handle 3 flags 0x00 dlen 20                                                    #122 13.478344
      ATT: Read By Type Response (0x09) len 15
        Attribute data length: 7
        Attribute data list: 2 entries
        Handle: 0x0057
        Value: 125800b52b
            Properties: 0x12
              Read (0x02)
              Notify (0x10)
            Value Handle: 0x0058
            Value UUID: Bearer Technology (0x2bb5)
        Handle: 0x005a
        Value: 125b00b62b
            Properties: 0x12
              Read (0x02)
              Notify (0x10)
            Value Handle: 0x005b
            Value UUID: Bearer URI Schemes Supported List (0x2bb6)
> HCI Event: Number of Completed Packets (0x13) plen 5                                                             #123 13.649582
        Num handles: 1
        Handle: 3 Address: DF:A9:FF:F6:B1:1A (OUI DF-A9-FF)
        Count: 1
        #122: len 20 (0 Kb/s)
        Latency: 171 msec (83-173 msec ~165 msec)
> ACL Data RX: Handle 3 flags 0x02 dlen 11                                                                         #124 13.649772
      ATT: Read By Type Request (0x08) len 6
        Handle range: 0x005b-0x007d
        Attribute type: Characteristic (0x2803)
zephyr.exe[2514218]: < HCI Command: Host Number of Completed Packets (0x03|0x0035) plen 5                          #125 13.658253
        Num handles: 1
        Handle: 3 Address: DF:A9:FF:F6:B1:1A (OUI DF-A9-FF)
        Count: 1
zephyr.exe[2514218]: < ACL Data TX: Handle 3 flags 0x00 dlen 20                                                    #126 13.658328
      ATT: Read By Type Response (0x09) len 15
        Attribute data length: 7
        Attribute data list: 2 entries
        Handle: 0x005d
        Value: 125e00b72b
            Properties: 0x12
              Read (0x02)
              Notify (0x10)
            Value Handle: 0x005e
            Value UUID: Bearer Signal Strength (0x2bb7)
        Handle: 0x0060
        Value: 0e6100b82b
            Properties: 0x0e
              Read (0x02)
              Write Without Response (0x04)
              Write (0x08)
            Value Handle: 0x0061
            Value UUID: Bearer Signal Strength Reporting Interval (0x2bb8)
> HCI Event: Number of Completed Packets (0x13) plen 5                                                             #127 13.824545
        Num handles: 1
        Handle: 3 Address: DF:A9:FF:F6:B1:1A (OUI DF-A9-FF)
        Count: 1
        #126: len 20 (0 Kb/s)
        Latency: 166 msec (83-173 msec ~165 msec)
> ACL Data RX: Handle 3 flags 0x02 dlen 11                                                                         #128 13.824816
      ATT: Read By Type Request (0x08) len 6
        Handle range: 0x0061-0x007d
        Attribute type: Characteristic (0x2803)
zephyr.exe[2514218]: < HCI Command: Host Number of Completed Packets (0x03|0x0035) plen 5                          #129 13.838226
        Num handles: 1
        Handle: 3 Address: DF:A9:FF:F6:B1:1A (OUI DF-A9-FF)
        Count: 1
zephyr.exe[2514218]: < ACL Data TX: Handle 3 flags 0x00 dlen 20                                                    #130 13.838339
      ATT: Read By Type Response (0x09) len 15
        Attribute data length: 7
        Attribute data list: 2 entries
        Handle: 0x0062
        Value: 126300b92b
            Properties: 0x12
              Read (0x02)
              Notify (0x10)
            Value Handle: 0x0063
            Value UUID: Bearer List Current Calls (0x2bb9)
        Handle: 0x0065
        Value: 026600ba2b
            Properties: 0x02
              Read (0x02)
            Value Handle: 0x0066
            Value UUID: Content Control ID (0x2bba)
> HCI Event: Number of Completed Packets (0x13) plen 5                                                             #131 13.999593
        Num handles: 1
        Handle: 3 Address: DF:A9:FF:F6:B1:1A (OUI DF-A9-FF)
        Count: 1
        #130: len 20 (0 Kb/s)
        Latency: 161 msec (83-173 msec ~163 msec)
> ACL Data RX: Handle 3 flags 0x02 dlen 11                                                                         #132 13.999803
      ATT: Read By Type Request (0x08) len 6
        Handle range: 0x0066-0x007d
        Attribute type: Characteristic (0x2803)
zephyr.exe[2514218]: < HCI Command: Host Number of Completed Packets (0x03|0x0035) plen 5                          #133 14.018342
        Num handles: 1
        Handle: 3 Address: DF:A9:FF:F6:B1:1A (OUI DF-A9-FF)
        Count: 1
zephyr.exe[2514218]: < ACL Data TX: Handle 3 flags 0x00 dlen 20                                                    #134 14.018522
      ATT: Read By Type Response (0x09) len 15
        Attribute data length: 7
        Attribute data list: 2 entries
        Handle: 0x0067
  