Bluetooth monitor ver 5.84
btmon[265740]: = Note: Linux version 6.8.0-83-generic (x86_64)                                                           0.740619
btmon[265740]: = Note: Bluetooth subsystem version 2.22                                                                  0.740621
= New Index: 00:00:00:00:00:00 (Primary,UART,hci0)                                                                       0.740621
= Open Index: 00:00:00:00:00:00                                                                                          0.748128
= Index Info: 00:00:00:00:00:00 (Nordic Semiconductor ASA)                                                               0.748132
zephyr.exe[265742]: @ USER Open: main (privileged) version 2.22                                                 {0x0001} 0.748134
zephyr.exe[265742]: < HCI Command: Reset (0x03|0x0003) plen 0                                                         #1 0.748373
> HCI Event: Command Complete (0x0e) plen 4                                                                           #2 0.748962
      Reset (0x03|0x0003) ncmd 1
        Status: Success (0x00)
zephyr.exe[265742]: < HCI Command: Read Local Supported Features (0x04|0x0003) plen 0                                 #3 0.768098
> HCI Event: Command Complete (0x0e) plen 12                                                                          #4 0.768816
      Read Local Supported Features (0x04|0x0003) ncmd 1
        Status: Success (0x00)
        Features: 0x00 0x00 0x00 0x00 0x60 0x00 0x00 0x00
          BR/EDR Not Supported
          LE Supported (Controller)
zephyr.exe[265742]: < HCI Command: Read Local Version Information (0x04|0x0001) plen 0                                #5 0.788097
> HCI Event: Command Complete (0x0e) plen 12                                                                          #6 0.788807
      Read Local Version Information (0x04|0x0001) ncmd 1
        Status: Success (0x00)
        HCI version: Reserved (0x0e) - Revision 12520 (0x30e8)
        LMP version: Reserved (0x0e) - Subversion 12520 (0x30e8)
        Manufacturer: Nordic Semiconductor ASA (89)
zephyr.exe[265742]: < HCI Command: Read Local Supported Commands (0x04|0x0002) plen 0                                 #7 0.808058
> HCI Event: Command Complete (0x0e) plen 68                                                                          #8 0.809247
      Read Local Supported Commands (0x04|0x0002) ncmd 1
        Status: Success (0x00)
        Commands: 119 entries
          Disconnect (Octet 0 - Bit 5)
          Read Remote Version Information (Octet 2 - Bit 7)
          Set Event Mask (Octet 5 - Bit 6)
          Reset (Octet 5 - Bit 7)
          Read Connection Accept Timeout (Octet 7 - Bit 2)
          Write Connection Accept Timeout (Octet 7 - Bit 3)
          Read Transmit Power Level (Octet 10 - Bit 2)
          Set Controller To Host Flow Control (Octet 10 - Bit 5)
          Host Buffer Size (Octet 10 - Bit 6)
          Host Number of Completed Packets (Octet 10 - Bit 7)
          Read Local Version Information (Octet 14 - Bit 3)
          Read Local Supported Features (Octet 14 - Bit 5)
          Read BD ADDR (Octet 15 - Bit 1)
          Read RSSI (Octet 15 - Bit 5)
          Set Event Mask Page 2 (Octet 22 - Bit 2)
          LE Set Event Mask (Octet 25 - Bit 0)
          LE Read Buffer Size (Octet 25 - Bit 1)
          LE Read Local Supported Features (Octet 25 - Bit 2)
          LE Set Random Address (Octet 25 - Bit 4)
          LE Set Advertising Parameters (Octet 25 - Bit 5)
          LE Read Advertising Channel TX Power (Octet 25 - Bit 6)
          LE Set Advertising Data (Octet 25 - Bit 7)
          LE Set Scan Response Data (Octet 26 - Bit 0)
          LE Set Advertise Enable (Octet 26 - Bit 1)
          LE Set Scan Parameters (Octet 26 - Bit 2)
          LE Set Scan Enable (Octet 26 - Bit 3)
          LE Create Connection (Octet 26 - Bit 4)
          LE Create Connection Cancel (Octet 26 - Bit 5)
          LE Read Accept List Size (Octet 26 - Bit 6)
          LE Clear Accept List (Octet 26 - Bit 7)
          LE Add Device To Accept List (Octet 27 - Bit 0)
          LE Remove Device From Accept List (Octet 27 - Bit 1)
          LE Connection Update (Octet 27 - Bit 2)
          LE Set Host Channel Classification (Octet 27 - Bit 3)
          LE Read Channel Map (Octet 27 - Bit 4)
          LE Read Remote Used Features (Octet 27 - Bit 5)
          LE Encrypt (Octet 27 - Bit 6)
          LE Rand (Octet 27 - Bit 7)
          LE Start Encryption (Octet 28 - Bit 0)
          LE Long Term Key Request Reply (Octet 28 - Bit 1)
          LE Long Term Key Request Neg Reply (Octet 28 - Bit 2)
          LE Read Supported States (Octet 28 - Bit 3)
          LE Receiver Test (Octet 28 - Bit 4)
          LE Transmitter Test (Octet 28 - Bit 5)
          LE Test End (Octet 28 - Bit 6)
          Read Authenticated Payload Timeout (Octet 32 - Bit 4)
          Write Authenticated Payload Timeout (Octet 32 - Bit 5)
          LE Set Data Length (Octet 33 - Bit 6)
          LE Read Suggested Default Data Length (Octet 33 - Bit 7)
          LE Write Suggested Default Data Length (Octet 34 - Bit 0)
          LE Add Device To Resolving List (Octet 34 - Bit 3)
          LE Remove Device From Resolving List (Octet 34 - Bit 4)
          LE Clear Resolving List (Octet 34 - Bit 5)
          LE Read Resolving List Size (Octet 34 - Bit 6)
          LE Set Address Resolution Enable (Octet 35 - Bit 1)
          LE Set Resolvable Private Address Timeout (Octet 35 - Bit 2)
          LE Read Maximum Data Length (Octet 35 - Bit 3)
          LE Read PHY (Octet 35 - Bit 4)
          LE Set Default PHY (Octet 35 - Bit 5)
          LE Set PHY (Octet 35 - Bit 6)
          LE Enhanced Receiver Test (Octet 35 - Bit 7)
          LE Enhanced Transmitter Test (Octet 36 - Bit 0)
          LE Set Advertising Set Random Address (Octet 36 - Bit 1)
          LE Set Extended Advertising Parameters (Octet 36 - Bit 2)
          LE Set Extended Advertising Data (Octet 36 - Bit 3)
          LE Set Extended Scan Response Data (Octet 36 - Bit 4)
          LE Set Extended Advertising Enable (Octet 36 - Bit 5)
          LE Read Maximum Advertising Data Length (Octet 36 - Bit 6)
          LE Read Number of Supported Advertising Sets (Octet 36 - Bit 7)
          LE Remove Advertising Set (Octet 37 - Bit 0)
          LE Clear Advertising Sets (Octet 37 - Bit 1)
          LE Set Periodic Advertising Parameters (Octet 37 - Bit 2)
          LE Set Periodic Advertising Data (Octet 37 - Bit 3)
          LE Set Periodic Advertising Enable (Octet 37 - Bit 4)
          LE Set Extended Scan Parameters (Octet 37 - Bit 5)
          LE Set Extended Scan Enable (Octet 37 - Bit 6)
          LE Extended Create Connection (Octet 37 - Bit 7)
          LE Periodic Advertising Create Sync (Octet 38 - Bit 0)
          LE Periodic Advertising Create Sync Cancel (Octet 38 - Bit 1)
          LE Periodic Advertising Terminate Sync (Octet 38 - Bit 2)
          LE Add Device To Periodic Advertiser List (Octet 38 - Bit 3)
          LE Remove Device From Periodic Advertiser List (Octet 38 - Bit 4)
          LE Clear Periodic Advertiser List (Octet 38 - Bit 5)
          LE Read Periodic Advertiser List Size (Octet 38 - Bit 6)
          LE Read Transmit Power (Octet 38 - Bit 7)
          LE Read RF Path Compensation (Octet 39 - Bit 0)
          LE Write RF Path Compensation (Octet 39 - Bit 1)
          LE Set Privacy Mode (Octet 39 - Bit 2)
          LE Periodic Advertising Receive Enable (Octet 40 - Bit 5)
          LE Periodic Advertising Sync Transfer (Octet 40 - Bit 6)
          LE Periodic Advertising Set Info Transfer (Octet 40 - Bit 7)
          LE Periodic Advertising Sync Transfer Parameters (Octet 41 - Bit 0)
          LE Set Default Periodic Advertisng Sync Transfer Parameters (Octet 41 - Bit 1)
          LE Read Buffer v2 (Octet 41 - Bit 5)
          LE Read ISO TX Sync (Octet 41 - Bit 6)
          LE Set Connected Isochronous Group Parameters (Octet 41 - Bit 7)
          LE Set Connected Isochronous Group Parameters Test (Octet 42 - Bit 0)
          LE Create Connected Isochronous Stream (Octet 42 - Bit 1)
          LE Remove Connected Isochronous Group (Octet 42 - Bit 2)
          LE Accept Connected Isochronous Stream Request (Octet 42 - Bit 3)
          LE Reject Connected Isochronous Stream Request (Octet 42 - Bit 4)
          LE Create Broadcast Isochronous Group (Octet 42 - Bit 5)
          LE Create Broadcast Isochronous Group Test (Octet 42 - Bit 6)
          LE Terminate Broadcast Isochronous Group (Octet 42 - Bit 7)
          LE Broadcast Isochronous Group Create Sync (Octet 43 - Bit 0)
          LE Broadcast Isochronous Group Terminate Sync (Octet 43 - Bit 1)
          LE Request Peer SCA (Octet 43 - Bit 2)
          LE Setup Isochronous Data Path (Octet 43 - Bit 3)
          LE Remove Isochronous Data Path (Octet 43 - Bit 4)
          LE Isochronous Transmit Test (Octet 43 - Bit 5)
          LE Isochronous Receive Test (Octet 43 - Bit 6)
          LE Isochronous Read Test Counters (Octet 43 - Bit 7)
          LE Isochronous Read Test Counters (Octet 44 - Bit 0)
          LE Set Host Feature (Octet 44 - Bit 1)
          LE Read ISO link quality (Octet 44 - Bit 2)
          Octet 45 - Bit 6 
          Octet 46 - Bit 0 
          Octet 46 - Bit 1 
          Octet 46 - Bit 2 
zephyr.exe[265742]: < HCI Command: Host Buffer Size (0x03|0x0033) plen 7                                              #9 0.828066
        ACL MTU: 255  ACL max packet: 16
        SCO MTU: 0    SCO max packet: 0
> HCI Event: Command Complete (0x0e) plen 4                                                                          #10 0.828690
      Host Buffer Size (0x03|0x0033) ncmd 1
        Status: Success (0x00)
zephyr.exe[265742]: < HCI Command: Set Controller To Host Flow Control (0x03|0x0031) plen 1                          #11 0.848061
        Flow control: ACL Data Packets (0x01)
> HCI Event: Command Complete (0x0e) plen 4                                                                          #12 0.848656
      Set Controller To Host Flow Control (0x03|0x0031) ncmd 1
        Status: Success (0x00)
zephyr.exe[265742]: < HCI Command: LE Read Local Supported Features (0x08|0x0003) plen 0                             #13 0.868066
> HCI Event: Command Complete (0x0e) plen 12                                                                         #14 0.868873
      LE Read Local Supported Features (0x08|0x0003) ncmd 1
        Status: Success (0x00)
        Features: 0xfd 0x79 0x00 0xf7 0x30 0x01 0x00 0x00
          LE Encryption
          Extended Reject Indication
          Peripheral-initiated Features Exchange
          LE Ping
          LE Data Packet Length Extension
          LL Privacy
          Extended Scanner Filter Policies
          LE 2M PHY
          LE Coded PHY
          LE Extended Advertising
          LE Periodic Advertising
          Channel Selection Algorithm #2
          Periodic Advertising Sync Transfer - Sender
          Periodic Advertising Sync Transfer - Recipient
          Sleep Clock Accuracy Updates
          Connected Isochronous Stream - Central
          Connected Isochronous Stream - Peripheral
          Isochronous Broadcaster
          Synchronized Receiver
          Periodic Advertising ADI support
          Connection Subrating
          Unknown features (0x0000010000000000)
zephyr.exe[265742]: < HCI Command: LE Set Host Feature (0x08|0x0074) plen 2                                          #15 0.888080
        Bit Number: 32
          Connected Isochronous Stream (Host Support)
        Bit Value: 1
> HCI Event: Command Complete (0x0e) plen 4                                                                          #16 0.888677
      LE Set Host Feature (0x08|0x0074) ncmd 1
        Status: Success (0x00)
zephyr.exe[265742]: < HCI Command: LE Read Buffer v2 (0x08|0x0060) plen 0                                            #17 0.908070
> HCI Event: Command Complete (0x0e) plen 10                                                                         #18 0.909095
      LE Read Buffer v2 (0x08|0x0060) ncmd 1
        Status: Success (0x00)
        ACL MTU: 27
        ACL max packet: 3
        ISO MTU: 318
        ISO max packet: 3
zephyr.exe[265742]: < HCI Command: LE Read Maximum Advertising Data Length (0x08|0x003a) plen 0                      #19 0.928083
> HCI Event: Command Complete (0x0e) plen 6                                                                          #20 0.929067
      LE Read Maximum Advertising Data Length (0x08|0x003a) ncmd 1
        Status: Success (0x00)
        Max length: 1650
zephyr.exe[265742]: < HCI Command: LE Read Supported States (0x08|0x001c) plen 0                                     #21 0.948069
> HCI Event: Command Complete (0x0e) plen 12                                                                         #22 0.949042
      LE Read Supported States (0x08|0x001c) ncmd 1
        Status: Success (0x00)
        States: 0x000003ff3e0306ff
          Non-connectable Advertising State
          Scannable Advertising State
          Connectable Advertising State
          High Duty Cycle Directed Advertising State
          Passive Scanning State
          Active Scanning State
          Initiating State
            and Connection State (Central Role)
          Connection State (Peripheral Role)
          Scannable Advertising State
            and Passive Scanning State
          Connectable Advertising State
            and Passive Scanning State
          Non-connectable Advertising State
            and Initiating State
          Scannable Advertising State
            and Initiating State
          Active Scanning State
            and Connection State (Central Role)
          Passive Scanning State
            and Connection State (Peripheral Role)
          Active Scanning State
            and Connection State (Peripheral Role)
          Initiating State
            and Connection State (Central Role)
            and Central Role & Central Role
          Low Duty Cycle Directed Advertising State
          Connectable Advertising State
            and Initiating State
            and Central Role & Peripheral Role
          High Duty Cycle Directed Advertising State
            and Initiating State
            and Central Role & Peripheral Role
          Low Duty Cycle Directed Advertising State
            and Initiating State
            and Central Role & Peripheral Role
          Connectable Advertising State
            and Connection State (Central Role)
            and Central Role & Peripheral Role
          High Duty Cycle Directed Advertising State
            and Connection State (Central Role)
            and Central Role & Peripheral Role
          Low Duty Cycle Directed Advertising State
            and Connection State (Central Role)
            and Central Role & Peripheral Role
          Connectable Advertising State
            and Connection State (Peripheral Role)
            and Central Role & Peripheral Role
          High Duty Cycle Directed Advertising State
            and Connection State (Peripheral Role)
            and Peripheral Role & Peripheral Role
          Low Duty Cycle Directed Advertising State
            and Connection State (Peripheral Role)
            and Peripheral Role & Peripheral Role
          Initiating State
            and Connection State (Peripheral Role)
            and Central Role & Peripheral Role
zephyr.exe[265742]: < HCI Command: LE Read Maximum Data Length (0x08|0x002f) plen 0                                  #23 0.968034
> HCI Event: Command Complete (0x0e) plen 12                                                                         #24 0.969376
      LE Read Maximum Data Length (0x08|0x002f) ncmd 1
        Status: Success (0x00)
        Max TX octets: 251
        Max TX time: 2704
        Max RX octets: 251
        Max RX time: 2704
zephyr.exe[265742]: < HCI Command: LE Write Suggested Default Data Length (0x08|0x0024) plen 4                       #25 0.988063
        TX octets: 251
        TX time: 2704
> HCI Event: Command Complete (0x0e) plen 4                                                                          #26 0.989629
      LE Write Suggested Default Data Length (0x08|0x0024) ncmd 1
        Status: Success (0x00)
zephyr.exe[265742]: < HCI Command: LE Read Resolving List Size (0x08|0x002a) plen 0                                  #27 1.008099
> HCI Event: Command Complete (0x0e) plen 5                                                                          #28 1.009066
      LE Read Resolving List Size (0x08|0x002a) ncmd 1
        Status: Success (0x00)
        Size: 8
zephyr.exe[265742]: < HCI Command: LE Set Event Mask (0x08|0x0001) plen 8                                            #29 1.028099
        Mask: 0x000002023f87fa5e
          LE Advertising Report
          LE Connection Update Complete
          LE Read Remote Used Features Complete
          LE Long Term Key Request
          LE Data Length Change
          LE Enhanced Connection Complete
          LE PHY Update Complete
          LE Extended Advertising Report
          LE Periodic Advertising Sync Established
          LE Periodic Advertising Report
          LE Periodic Advertising Sync Lost
          LE Extended Scan Timeout
          LE Extended Advertising Set Terminated
          LE Scan Request Received
          LE Periodic Advertising Sync Transfer Rvc
          LE CIS Established
          LE CIS Request
          LE Create BIG Complete
          LE Terminate BIG Complete
          LE BIG Sync Established Complete
          LE BIG Sync Lost
          LE BIG Info Advertising Report
          Unknown mask (0x0000020000000000)
> HCI Event: Command Complete (0x0e) plen 4                                                                          #30 1.028790
      LE Set Event Mask (0x08|0x0001) ncmd 1
        Status: Success (0x00)
zephyr.exe[265742]: < HCI Command: Set Event Mask (0x03|0x0001) plen 8                                               #31 1.048101
        Mask: 0x2000800002008890
          Disconnection Complete
          Encryption Change
          Read Remote Version Information Complete
          Hardware Error
          Data Buffer Overflow
          Encryption Key Refresh Complete
          LE Meta
> HCI Event: Command Complete (0x0e) plen 4                                                                          #32 1.049002
      Set Event Mask (0x03|0x0001) ncmd 1
        Status: Success (0x00)
zephyr.exe[265742]: < HCI Command: Read BD ADDR (0x04|0x0009) plen 0                                                 #33 1.068075
> HCI Event: Command Complete (0x0e) plen 10                                                                         #34 1.069162
      Read BD ADDR (0x04|0x0009) ncmd 1
        Status: Success (0x00)
        Address: 00:00:00:00:00:00 (OUI 00-00-00)
zephyr.exe[265742]: < HCI Command: LE Set Random Address (0x08|0x0005) plen 6                                        #35 1.088105
        Address: D5:B6:CC:31:DB:3B (Static)
> HCI Event: Command Complete (0x0e) plen 4                                                                          #36 1.088887
      LE Set Random Address (0x08|0x0005) ncmd 1
        Status: Success (0x00)
zephyr.exe[265742]: < HCI Command: LE Extended Create Connection (0x08|0x0043) plen 26                               #37 5.278206
        Filter policy: Accept list is not used (0x00)
        Own address type: Random (0x01)
        Peer address type: Public (0x00)
        Peer address: DF:A9:FF:F6:B1:1A (OUI DF-A9-FF)
        Initiating PHYs: 0x01
        Entry 0: LE 1M
          Scan interval: 60.000 msec (0x0060)
          Scan window: 60.000 msec (0x0060)
          Min connection interval: 30.00 msec (0x0018)
          Max connection interval: 50.00 msec (0x0028)
          Connection latency: 0 (0x0000)
          Supervision timeout: 4000 msec (0x0190)
          Min connection length: 0.000 msec (0x0000)
          Max connection length: 0.000 msec (0x0000)
> HCI Event: Command Status (0x0f) plen 4                                                                            #38 5.279250
      LE Extended Create Connection (0x08|0x0043) ncmd 1
        Status: Success (0x00)
> HCI Event: LE Meta Event (0x3e) plen 31                                                                            #39 5.362069
      LE Enhanced Connection Complete (0x0a)
        Status: Success (0x00)
        Handle: 0
        Role: Central (0x00)
        Peer address type: Public (0x00)
        Peer address: DF:A9:FF:F6:B1:1A (OUI DF-A9-FF)
        Local resolvable private address: 00:00:00:00:00:00 (Non-Resolvable)
        Peer resolvable private address: 00:00:00:00:00:00 (Non-Resolvable)
        Connection interval: 50.00 msec (0x0028)
        Connection latency: 0 (0x0000)
        Supervision timeout: 4000 msec (0x0190)
        Central clock accuracy: 0x00
zephyr.exe[265742]: < HCI Command: LE Read Remote Used Features (0x08|0x0016) plen 2                                 #40 5.368157
        Handle: 0 Address: DF:A9:FF:F6:B1:1A (OUI DF-A9-FF)
> HCI Event: Command Status (0x0f) plen 4                                                                            #41 5.368680
      LE Read Remote Used Features (0x08|0x0016) ncmd 1
        Status: Success (0x00)
zephyr.exe[265742]: < HCI Command: LE Set PHY (0x08|0x0032) plen 7                                                   #42 5.388088
        Handle: 0 Address: DF:A9:FF:F6:B1:1A (OUI DF-A9-FF)
        All PHYs preference: 0x00
        TX PHYs preference: 0x02
          LE 2M
        RX PHYs preference: 0x02
          LE 2M
        PHY options preference: Reserved (0x0000)
> HCI Event: Command Status (0x0f) plen 4                                                                            #43 5.388696
      LE Set PHY (0x08|0x0032) ncmd 1
        Status: Success (0x00)
> ACL Data RX: Handle 0 flags 0x02 dlen 6                                                                            #44 5.413856
      SMP: Security Request (0x0b) len 1
        Authentication requirement: No bonding, MITM, SC, No Keypresses (0x0c)
zephyr.exe[265742]: < HCI Command: Host Number of Completed Packets (0x03|0x0035) plen 5                             #45 5.428227
        Num handles: 1
        Handle: 0 Address: DF:A9:FF:F6:B1:1A (OUI DF-A9-FF)
        Count: 1
zephyr.exe[265742]: < ACL Data TX: Handle 0 [1/3] flags 0x00 dlen 11                                                 #46 5.428290
      SMP: Pairing Request (0x01) len 6
        IO capability: DisplayOnly (0x00)
        OOB data: Authentication data not present (0x00)
        Authentication requirement: Bonding, No MITM, SC, No Keypresses (0x09)
        Max encryption key size: 16
        Initiator key distribution: EncKey Sign (0x05)
        Responder key distribution: EncKey IdKey Sign (0x07)
> HCI Event: Number of Completed Packets (0x13) plen 5                                                               #47 5.513578
        Num handles: 1
        Handle: 0 Address: DF:A9:FF:F6:B1:1A (OUI DF-A9-FF)
        Count: 1
        Buffers: 0/3
        #46: len 11 (1 Kb/s)
        Latency: 85 msec (85-85 msec ~85 msec)
> HCI Event: LE Meta Event (0x3e) plen 12                                                                            #48 5.513666
      LE Read Remote Used Features (0x04)
        Status: Success (0x00)
        Handle: 0 Address: DF:A9:FF:F6:B1:1A (OUI DF-A9-FF)
        Features: 0x2d 0x49 0x00 0xf7 0x67 0xd8 0x00 0x00
          LE Encryption
          Extended Reject Indication
          Peripheral-initiated Features Exchange
          LE Data Packet Length Extension
          LE 2M PHY
          LE Coded PHY
          Channel Selection Algorithm #2
          Periodic Advertising Sync Transfer - Sender
          Periodic Advertising Sync Transfer - Recipient
          Sleep Clock Accuracy Updates
          Connected Isochronous Stream - Central
          Connected Isochronous Stream - Peripheral
          Isochronous Broadcaster
          Synchronized Receiver
          Connected Isochronous Stream (Host Support)
          LE Power Control Request
          LE Power Control Request
          Connection Subrating
          Connection Subrating (Host Support)
          Unknown features (0x0000d80000000000)
> ACL Data RX: Handle 0 flags 0x02 dlen 11                                                                           #49 5.564093
      SMP: Pairing Response (0x02) len 6
        IO capability: KeyboardDisplay (0x04)
        OOB data: Authentication data not present (0x00)
        Authentication requirement: No bonding, MITM, SC, No Keypresses (0x0c)
        Max encryption key size: 16
        Initiator key distribution: <none> (0x00)
        Responder key distribution: <none> (0x00)
zephyr.exe[265742]: < HCI Command: Host Number of Completed Packets (0x03|0x0035) plen 5                             #50 5.568335
        Num handles: 1
        Handle: 0 Address: DF:A9:FF:F6:B1:1A (OUI DF-A9-FF)
        Count: 1
zephyr.exe[265742]: < ACL Data TX: Handle 0 [1/3] flags 0x00 dlen 27                                                 #51 5.568399
zephyr.exe[265742]: < ACL Data TX: Handle 0 flags 0x01 dlen 27                                                       #52 5.568403
zephyr.exe[265742]: < ACL Data TX: Handle 0 flags 0x01 dlen 15                                                       #53 5.568404
      SMP: Pairing Public Key (0x0c) len 64
        X[32]: 98308440221e2d910f0e54b71e7ec652857aa9b5a0dc65028824cc19db1226e9
        Y[32]: 67a4816bcb62efb21701e31fdb27561a6217575fb007a8bbdabe7e28b6f68482
> HCI Event: Number of Completed Packets (0x13) plen 5                                                               #54 5.613523
        Num handles: 1
        Handle: 0 Address: DF:A9:FF:F6:B1:1A (OUI DF-A9-FF)
        Count: 1
        Buffers: 0/3
        #51: len 27 (4 Kb/s)
        Latency: 45 msec (45-85 msec ~65 msec)
> HCI Event: Number of Completed Packets (0x13) plen 5                                                               #55 5.663645
        Num handles: 1
        Handle: 0 Address: DF:A9:FF:F6:B1:1A (OUI DF-A9-FF)
        Count: 1
        Buffers: underflow/3
        #52: len 27 (2 Kb/s)
        Latency: 95 msec (45-95 msec ~80 msec)
> HCI Event: Number of Completed Packets (0x13) plen 5                                                               #56 5.763651
        Num handles: 1
        Handle: 0 Address: DF:A9:FF:F6:B1:1A (OUI DF-A9-FF)
        Count: 1
        Buffers: underflow/3
        #53: len 15 (0 Kb/s)
        Latency: 195 msec (45-195 msec ~137 msec)
> ACL Data RX: Handle 0 flags 0x02 dlen 27                                                                           #57 5.813766
> ACL Data RX: Handle 0 flags 0x01 dlen 27                                                                           #58 5.814525
> ACL Data RX: Handle 0 flags 0x01 dlen 15                                                                           #59 5.815071
      SMP: Pairing Public Key (0x0c) len 64
        X[32]: e9473a87abb7332681de250c91bcb0d2f7ea0450dce1eea8b270df346cd11619
        Y[32]: e456d4538a769a92bf299bb2d9891c6c3b3cbf4653389352f36627660254f257
zephyr.exe[265742]: < HCI Command: Host Number of Completed Packets (0x03|0x0035) plen 5                             #60 5.828431
        Num handles: 1
        Handle: 0 Address: DF:A9:FF:F6:B1:1A (OUI DF-A9-FF)
        Count: 1
zephyr.exe[265742]: < HCI Command: Host Number of Completed Packets (0x03|0x0035) plen 5                             #61 5.828525
        Num handles: 1
        Handle: 0 Address: DF:A9:FF:F6:B1:1A (OUI DF-A9-FF)
        Count: 1
zephyr.exe[265742]: < HCI Command: Host Number of Completed Packets (0x03|0x0035) plen 5                             #62 5.828616
        Num handles: 1
        Handle: 0 Address: DF:A9:FF:F6:B1:1A (OUI DF-A9-FF)
        Count: 1
zephyr.exe[265742]: < ACL Data TX: Handle 0 [1/3] flags 0x00 dlen 21                                                 #63 5.828702
      SMP: Pairing Confirm (0x03) len 16
        Confirm value[16]: f4ede0237437190a747888af46f522a4
> HCI Event: Number of Completed Packets (0x13) plen 5                                                               #64 5.863517
        Num handles: 1
        Handle: 0 Address: DF:A9:FF:F6:B1:1A (OUI DF-A9-FF)
        Count: 1
        Buffers: 0/3
        #63: len 21 (4 Kb/s)
        Latency: 34 msec (34-195 msec ~86 msec)
> HCI Event: LE Meta Event (0x3e) plen 6                                                                             #65 6.012922
      LE PHY Update Complete (0x0c)
        Status: Success (0x00)
        Handle: 0 Address: DF:A9:FF:F6:B1:1A (OUI DF-A9-FF)
        TX PHY: LE 2M (0x02)
        RX PHY: LE 2M (0x02)
> ACL Data RX: Handle 0 flags 0x02 dlen 21                                                                           #66 6.464106
      SMP: Pairing Confirm (0x03) len 16
        Confirm value[16]: 09dc57ba8b620ba8b814ca56116fe87b
zephyr.exe[265742]: < HCI Command: Host Number of Completed Packets (0x03|0x0035) plen 5                             #67 6.468324
        Num handles: 1
        Handle: 0 Address: DF:A9:FF:F6:B1:1A (OUI DF-A9-FF)
        Count: 1
zephyr.exe[265742]: < ACL Data TX: Handle 0 [1/3] flags 0x00 dlen 21                                                 #68 6.468352
      SMP: Pairing Random (0x04) len 16
        Random value[16]: 8e6108f966a694cbe26df70bb96773e6
> HCI Event: Number of Completed Packets (0x13) plen 5                                                               #69 6.513492
        Num handles: 1
        Handle: 0 Address: DF:A9:FF:F6:B1:1A (OUI DF-A9-FF)
        Count: 1
        Buffers: 0/3
        #68: len 21 (3 Kb/s)
        Latency: 45 msec (34-195 msec ~65 msec)
> ACL Data RX: Handle 0 flags 0x02 dlen 21                                                                           #70 6.763414
      SMP: Pairing Random (0x04) len 16
        Random value[16]: 08fd49e1ee560ac158d215c06cf710b9
zephyr.exe[265742]: < HCI Command: Host Number of Completed Packets (0x03|0x0035) plen 5                             #71 6.768402
        Num handles: 1
        Handle: 0 Address: DF:A9:FF:F6:B1:1A (OUI DF-A9-FF)
        Count: 1
zephyr.exe[265742]: < ACL Data TX: Handle 0 [1/3] flags 0x00 dlen 21                                                 #72 6.768430
      SMP: Pairing Confirm (0x03) len 16
        Confirm value[16]: fb7f7a22f0f7e04d5585fee39989294b
> HCI Event: Number of Completed Packets (0x13) plen 5                                                               #73 6.813409
        Num handles: 1
        Handle: 0 Address: DF:A9:FF:F6:B1:1A (OUI DF-A9-FF)
        Count: 1
        Buffers: 0/3
        #72: len 21 (3 Kb/s)
        Latency: 44 msec (34-195 msec ~55 msec)
> ACL Data RX: Handle 0 flags 0x02 dlen 21                                                                           #74 6.863632
      SMP: Pairing Confirm (0x03) len 16
        Confirm value[16]: 8918bbcf11bcedc47202fa485d52c552
zephyr.exe[265742]: < HCI Command: Host Number of Completed Packets (0x03|0x0035) plen 5                             #75 6.868318
        Num handles: 1
        Handle: 0 Address: DF:A9:FF:F6:B1:1A (OUI DF-A9-FF)
        Count: 1
zephyr.exe[265742]: < ACL Data TX: Handle 0 [1/3] flags 0x00 dlen 21                                                 #76 6.868341
      SMP: Pairing Random (0x04) len 16
        Random value[16]: 4d02679f89a05211af56d8b3da64d21e
> HCI Event: Number of Completed Packets (0x13) plen 5                                                               #77 6.913505
        Num handles: 1
        Handle: 0 Address: DF:A9:FF:F6:B1:1A (OUI DF-A9-FF)
        Count: 1
        Buffers: 0/3
        #76: len 21 (3 Kb/s)
        Latency: 45 msec (34-195 msec ~50 msec)
> ACL Data RX: Handle 0 flags 0x02 dlen 21                                                                           #78 7.163757
      SMP: Pairing Random (0x04) len 16
        Random value[16]: ef558394fea9b46212613066345f269f
zephyr.exe[265742]: < HCI Command: Host Number of Completed Packets (0x03|0x0035) plen 5                             #79 7.168293
        Num handles: 1
        Handle: 0 Address: DF:A9:FF:F6:B1:1A (OUI DF-A9-FF)
        Count: 1
zephyr.exe[265742]: < ACL Data TX: Handle 0 [1/3] flags 0x00 dlen 21                                                 #80 7.168320
      SMP: Pairing Confirm (0x03) len 16
        Confirm value[16]: 4435d0efa1430d613a9d9e4dbf9966e5
> HCI Event: Number of Completed Packets (0x13) plen 5                                                               #81 7.213226
        Num handles: 1
        Handle: 0 Address: DF:A9:FF:F6:B1:1A (OUI DF-A9-FF)
        Count: 1
        Buffers: 0/3
        #80: len 21 (3 Kb/s)
        Latency: 44 msec (34-195 msec ~47 msec)
> ACL Data RX: Handle 0 flags 0x02 dlen 21                                                                           #82 7.263568
      SMP: Pairing Confirm (0x03) len 16
        Confirm value[16]: 8fee654d2918b45fc1984f864ec18bab
zephyr.exe[265742]: < HCI Command: Host Number of Completed Packets (0x03|0x0035) plen 5                             #83 7.268182
        Num handles: 1
        Handle: 0 Address: DF:A9:FF:F6:B1:1A (OUI DF-A9-FF)
        Count: 1
zephyr.exe[265742]: < ACL Data TX: Handle 0 [1/3] flags 0x00 dlen 21                                                 #84 7.268210
      SMP: Pairing Random (0x04) len 16
        Random value[16]: 5e8286bc235a02440d0c3424a2acf8fd
> HCI Event: Number of Completed Packets (0x13) plen 5                                                               #85 7.313314
        Num handles: 1
        Handle: 0 Address: DF:A9:FF:F6:B1:1A (OUI DF-A9-FF)
        Count: 1
        Buffers: 0/3
        #84: len 21 (3 Kb/s)
        Latency: 45 msec (34-195 msec ~46 msec)
> ACL Data RX: Handle 0 flags 0x02 dlen 21                                                                           #86 7.563652
      SMP: Pairing Random (0x04) len 16
        Random value[16]: abc0d1c57f86a073ed942ef09fecf521
zephyr.exe[265742]: < HCI Command: Host Number of Completed Packets (0x03|0x0035) plen 5                             #87 7.568236
        Num handles: 1
        Handle: 0 Address: DF:A9:FF:F6:B1:1A (OUI DF-A9-FF)
        Count: 1
zephyr.exe[265742]: < ACL Data TX: Handle 0 [1/3] flags 0x00 dlen 21                                                 #88 7.568293
      SMP: Pairing Confirm (0x03) len 16
        Confirm value[16]: f9a0cec6dcf5c6c8e01dfde5d7435869
> HCI Event: Number of Completed Packets (0x13) plen 5                                                               #89 7.613475
        Num handles: 1
        Handle: 0 Address: DF:A9:FF:F6:B1:1A (OUI DF-A9-FF)
        Count: 1
        Buffers: 0/3
        #88: len 21 (3 Kb/s)
        Latency: 45 msec (34-195 msec ~45 msec)
> ACL Data RX: Handle 0 flags 0x02 dlen 21                                                                           #90 7.663511
      SMP: Pairing Confirm (0x03) len 16
        Confirm value[16]: b4f3dc9b7c60e332c5c0a42e489116ab
zephyr.exe[265742]: < HCI Command: Host Number of Completed Packets (0x03|0x0035) plen 5                             #91 7.668211
        Num handles: 1
        Handle: 0 Address: DF:A9:FF:F6:B1:1A (OUI DF-A9-FF)
        Count: 1
zephyr.exe[265742]: < ACL Data TX: Handle 0 [1/3] flags 0x00 dlen 21                                                 #92 7.668216
      SMP: Pairing Random (0x04) len 16
        Random value[16]: 5c4a1bcadd27bd58e945097b00bad7ac
> HCI Event: Number of Completed Packets (0x13) plen 5                                                               #93 7.713308
        Num handles: 1
        Handle: 0 Address: DF:A9:FF:F6:B1:1A (OUI DF-A9-FF)
        Count: 1
        Buffers: 0/3
        #92: len 21 (3 Kb/s)
        Latency: 45 msec (34-195 msec ~45 msec)
> ACL Data RX: Handle 0 flags 0x02 dlen 21                                                                           #94 7.963631
      SMP: Pairing Random (0x04) len 16
        Random value[16]: 95cc05daf96b4fc9a0da41a398f95ff6
zephyr.exe[265742]: < HCI Command: Host Number of Completed Packets (0x03|0x0035) plen 5                             #95 7.968361
        Num handles: 1
        Handle: 0 Address: DF:A9:FF:F6:B1:1A (OUI DF-A9-FF)
        Count: 1
zephyr.exe[265742]: < ACL Data TX: Handle 0 [1/3] flags 0x00 dlen 21                                                 #96 7.968411
      SMP: Pairing Confirm (0x03) len 16
        Confirm value[16]: e8600e781752eda6524d8acae68fe5b8
> HCI Event: Number of Completed Packets (0x13) plen 5                                                               #97 8.013423
        Num handles: 1
        Handle: 0 Address: DF:A9:FF:F6:B1:1A (OUI DF-A9-FF)
        Count: 1
        Buffers: 0/3
        #96: len 21 (3 Kb/s)
        Latency: 45 msec (34-195 msec ~45 msec)
> ACL Data RX: Handle 0 flags 0x02 dlen 21                                                                           #98 8.064024
      SMP: Pairing Confirm (0x03) len 16
        Confirm value[16]: 56615e3f0eeb6de33b858b8041d91bb3
zephyr.exe[265742]: < HCI Command: Host Number of Completed Packets (0x03|0x0035) plen 5                             #99 8.068325
        Num handles: 1
        Handle: 0 Address: DF:A9:FF:F6:B1:1A (OUI DF-A9-FF)
        Count: 1
zephyr.exe[265742]: < ACL Data TX: Handle 0 [1/3] flags 0x00 dlen 21                                                #100 8.068370
      SMP: Pairing Random (0x04) len 16
        Random value[16]: 32527e6e64e79f33b2e374394db8ab2d
> HCI Event: Number of Completed Packets (0x13) plen 5                                                              #101 8.113270
        Num handles: 1
        Handle: 0 Address: DF:A9:FF:F6:B1:1A (OUI DF-A9-FF)
        Count: 1
        Buffers: 0/3
        #100: len 21 (3 Kb/s)
        Latency: 44 msec (34-195 msec ~45 msec)
> ACL Data RX: Handle 0 flags 0x02 dlen 21                                                                          #102 8.313812
      SMP: Pairing Random (0x04) len 16
        Random value[16]: 45452e783615827826dfd90346258411
zephyr.exe[265742]: < HCI Command: Host Number of Completed Packets (0x03|0x0035) plen 5                            #103 8.328293
        Num handles: 1
        Handle: 0 Address: DF:A9:FF:F6:B1:1A (OUI DF-A9-FF)
        Count: 1
zephyr.exe[265742]: < ACL Data TX: Handle 0 [1/3] flags 0x00 dlen 21                                                #104 8.328315
      SMP: Pairing Confirm (0x03) len 16
        Confirm value[16]: 435870e8c2d83dec99dc5133f3c96aba
> HCI Event: Number of Completed Packets (0x13) plen 5                                                              #105 8.363460
        Num handles: 1
        Handle: 0 Address: DF:A9:FF:F6:B1:1A (OUI DF-A9-FF)
        Count: 1
        Buffers: 0/3
        #104: len 21 (4 Kb/s)
        Latency: 35 msec (34-195 msec ~40 msec)
> ACL Data RX: Handle 0 flags 0x02 dlen 21                                                                          #106 8.413900
      SMP: Pairing Confirm (0x03) len 16
        Confirm value[16]: 09e19d6ef3f7e843a3b760b31aa5dbdc
zephyr.exe[265742]: < HCI Command: Host Number of Completed Packets (0x03|0x0035) plen 5                            #107 8.428265
        Num handles: 1
        Handle: 0 Address: DF:A9:FF:F6:B1:1A (OUI DF-A9-FF)
        Count: 1
zephyr.exe[265742]: < ACL Data TX: Handle 0 [1/3] flags 0x00 dlen 21                                                #108 8.428286
      SMP: Pairing Random (0x04) len 16
        Random value[16]: dddbdfe2838e9a8cc6964353c850fef7
> HCI Event: Number of Completed Packets (0x13) plen 5                                                              #109 8.463419
        Num handles: 1
        Handle: 0 Address: DF:A9:FF:F6:B1:1A (OUI DF-A9-FF)
        Count: 1
        Buffers: 0/3
        #108: len 21 (4 Kb/s)
        Latency: 35 msec (34-195 msec ~37 msec)
> ACL Data RX: Handle 0 flags 0x02 dlen 21                                                                          #110 8.713792
      SMP: Pairing Random (0x04) len 16
        Random value[16]: 953a9f843e803ad5b791a8d8144cc5a9
zephyr.exe[265742]: < HCI Command: Host Number of Completed Packets (0x03|0x0035) plen 5                            #111 8.728374
        Num handles: 1
        Handle: 0 Address: DF:A9:FF:F6:B1:1A (OUI DF-A9-FF)
        Count: 1
zephyr.exe[265742]: < ACL Data TX: Handle 0 [1/3] flags 0x00 dlen 21                                                #112 8.728396
      SMP: Pairing Confirm (0x03) len 16
        Confirm value[16]: 2ac077c392118d9ccd2f25b3f1bce051
> HCI Event: Number of Completed Packets (0x13) plen 5                                                              #113 8.763223
        Num handles: 1
        Handle: 0 Address: DF:A9:FF:F6:B1:1A (OUI DF-A9-FF)
        Count: 1
        Buffers: 0/3
        #112: len 21 (4 Kb/s)
        Latency: 34 msec (34-195 msec ~36 msec)
> ACL Data RX: Handle 0 flags 0x02 dlen 21                                                                          #114 8.813454
      SMP: Pairing Confirm (0x03) len 16
        Confirm value[16]: 4105fd1a6191e07eb42debe59b631d04
zephyr.exe[265742]: < HCI Command: Host Number of Completed Packets (0x03|0x0035) plen 5                            #115 8.828352
        Num handles: 1
        Handle: 0 Address: DF:A9:FF:F6:B1:1A (OUI DF-A9-FF)
        Count: 1
zephyr.exe[265742]: < ACL Data TX: Handle 0 [1/3] flags 0x00 dlen 21                                                #116 8.828378
      SMP: Pairing Random (0x04) len 16
        Random value[16]: eb9f1915536596b6fc3db1c86b2b1970
> HCI Event: Number of Completed Packets (0x13) plen 5                                                              #117 8.863143
        Num handles: 1
        Handle: 0 Address: DF:A9:FF:F6:B1:1A (OUI DF-A9-FF)
        Count: 1
        Buffers: 0/3
        #116: len 21 (4 Kb/s)
        Latency: 34 msec (34-195 msec ~35 msec)
> ACL Data RX: Handle 0 flags 0x02 dlen 21                                                                          #118 9.063872
      SMP: Pairing Random (0x04) len 16
        Random value[16]: 9ef6e8225be9b875cc1c9f24a98ac431
zephyr.exe[265742]: < HCI Command: Host Number of Completed Packets (0x03|0x0035) plen 5                            #119 9.068401
        Num handles: 1
        Handle: 0 Address: DF:A9:FF:F6:B1:1A (OUI DF-A9-FF)
        Count: 1
zephyr.exe[265742]: < ACL Data TX: Handle 0 [1/3] flags 0x00 dlen 21                                                #120 9.068455
      SMP: Pairing Confirm (0x03) len 16
        Confirm value[16]: ed7a8da858fce0ee21c22da3e81916de
> HCI Event: Number of Completed Packets (0x13) plen 5                                                              #121 9.113329
        Num handles: 1
        Handle: 0 Address: DF:A9:FF:F6:B1:1A (OUI DF-A9-FF)
        Count: 1
        Buffers: 0/3
        #120: len 21 (3 Kb/s)
        Latency: 44 msec (34-195 msec ~40 msec)
> ACL Data RX: Handle 0 flags 0x02 dlen 21                                                                          #122 9.163591
      SMP: Pairing Confirm (0x03) len 16
        Confirm value[16]: 25614263d33b477e42f0bd69e0296576
zephyr.exe[265742]: < HCI Command: Host Number of Completed Packets (0x03|0x0035) plen 5                            #123 9.168356
        Num handles: 1
        Handle: 0 Address: DF:A9:FF:F6:B1:1A (OUI DF-A9-FF)
        Count: 1
zephyr.exe[265742]: < ACL Data TX: Handle 0 [1/3] flags 0x00 dlen 21                                                #124 9.168419
      SMP: Pairing Random (0x04) len 16
        Random value[16]: 5c794dc9ad9f2c3f295ebd5ad5e1c3cf
> HCI Event: Number of Completed Packets (0x13) plen 5                                                              #125 9.213187
        Num handles: 1
        Handle: 0 Address: DF:A9:FF:F6:B1:1A (OUI DF-A9-FF)
        Count: 1
        Buffers: 0/3
        #124: len 21 (3 Kb/s)
        Latency: 44 msec (34-195 msec ~42 msec)
> ACL Data RX: Handle 0 flags 0x02 dlen 21                                                                          #126 9.463503
      SMP: Pairing Random (0x04) len 16
        Random value[16]: b807dab815ce7c2e1fecee2def3e605f
zephyr.exe[265742]: < HCI Command: Host Number of Completed Packets (0x03|0x0035) plen 5                            #127 9.468321
        Num handles: 1
        Handle: 0 Address: DF:A9:FF:F6:B1:1A (OUI DF-A9-FF)
        Count: 1
zephyr.exe[265742]: < ACL Data TX: Handle 0 [1/3] flags 0x00 dlen 21                                                #128 9.468374
      SMP: Pairing Confirm (0x03) len 16
        Confirm value[16]: ca8f54db0572ed2416a20c6658f77c47
> HCI Event: Number of Completed Packets (0x13) plen 5                                                              #129 9.513174
        Num handles: 1
        Handle: 0 Address: DF:A9:FF:F6:B1:1A (OUI DF-A9-FF)
        Count: 1
        Buffers: 0/3
        #128: len 21 (3 Kb/s)
        Latency: 44 msec (34-195 msec ~43 msec)
> ACL Data RX: Handle 0 flags 0x02 dlen 21                                                                          #130 9.563982
      SMP: Pairing Confirm (0x03) len 16
        Confirm value[16]: f2f38a91994dc4f098df64c4589eb470
zephyr.exe[265742]: < HCI Command: Host Number of Completed Packets (0x03|0x0035) plen 5                            #131 9.568303
        Num handles: 1
        Handle: 0 Address: DF:A9:FF:F6:B1:1A (OUI DF-A9-FF)
        Count: 1
zephyr.exe[265742]: < ACL Data TX: Handle 0 [1/3] flags 0x00 dlen 21                                                #132 9.568368
      SMP: Pairing Random (0x04) len 16
        Random value[16]: 5c2fff312cdf99c9491988e877355a9a
> HCI Event: Number of Completed Packets (0x13) plen 5                                                              #133 9.613176
        Num handles: 1
        Handle: 0 Address: DF:A9:FF:F6:B1:1A (OUI DF-A9-FF)
        Count: 1
        Buffers: 0/3
        #132: len 21 (3 Kb/s)
        Latency: 44 msec (34-195 msec ~44 msec)
> ACL Data RX: Handle 0 flags 0x02 dlen 21                                                                          #134 9.813461
      SMP: Pairing Random (0x04) len 16
        Random value[16]: 7d3a85ea36ec4815a7b107791004bd28
zephyr.exe[265742]: < HCI Command: Host Number of Completed Packets (0x03|0x0035) plen 5                            #135 9.828384
        Num handles: 1
        Handle: 0 Address: DF:A9:FF:F6:B1:1A (OUI DF-A9-FF)
        Count: 1
zephyr.exe[265742]: < ACL Data TX: Handle 0 [1/3] flags 0x00 dlen 21                                                #136 9.828443
      SMP: Pairing Confirm (0x03) len 16
        Confirm value[16]: a5c53b67a0a5638db5aff3504d5c5200
> HCI Event: Number of Completed Packets (0x13) plen 5                                                              #137 9.863259
        Num handles: 1
        Handle: 0 Address: DF:A9:FF:F6:B1:1A (OUI DF-A9-FF)
        Count: 1
        Buffers: 0/3
        #136: len 21 (4 Kb/s)
        Latency: 34 msec (34-195 msec ~39 msec)
> ACL Data RX: Handle 0 flags 0x02 dlen 21                                                                          #138 9.913492
      SMP: Pairing Confirm (0x03) len 16
        Confirm value[16]: 0e2801def29d10c5fefc3386b2c395c5
zephyr.exe[265742]: < HCI Command: Host Number of Completed Packets (0x03|0x0035) plen 5                            #139 9.928352
        Num handles: 1
        Handle: 0 Address: DF:A9:FF:F6:B1:1A (OUI DF-A9-FF)
        Count: 1
zephyr.exe[265742]: < ACL Data TX: Handle 0 [1/3] flags 0x00 dlen 21                                                #140 9.928376
      SMP: Pairing Random (0x04) len 16
        Random value[16]: c629a3a987d808e808655d558dfc1155
> HCI Event: Number of Completed Packets (0x13) plen 5                                                              #141 9.963068
        Num handles: 1
        Handle: 0 Address: DF:A9:FF:F6:B1:1A (OUI DF-A9-FF)
        Count: 1
        Buffers: 0/3
        #140: len 21 (4 Kb/s)
        Latency: 34 msec (34-195 msec ~37 msec)
> ACL Data RX: Handle 0 flags 0x02 dlen 21                                                                         #142 10.214144
      SMP: Pairing Random (0x04) len 16
        Random value[16]: c69b3c9ec63f1d7d9f559acb73b839c1
zephyr.exe[265742]: < HCI Command: Host Number of Completed Packets (0x03|0x0035) plen 5                           #143 10.228391
        Num handles: 1
        Handle: 0 Address: DF:A9:FF:F6:B1:1A (OUI DF-A9-FF)
        Count: 1
zephyr.exe[265742]: < ACL Data TX: Handle 0 [1/3] flags 0x00 dlen 21                                               #144 10.228448
      SMP: Pairing Confirm (0x03) len 16
        Confirm value[16]: 994ea51b859ac707a953255986786520
> HCI Event: Number of Completed Packets (0x13) plen 5                                                             #145 10.263051
        Num handles: 1
        Handle: 0 Address: DF:A9:FF:F6:B1:1A (OUI DF-A9-FF)
        Count: 1
        Buffers: 0/3
        #144: len 21 (4 Kb/s)
        Latency: 34 msec (34-195 msec ~35 msec)
> ACL Data RX: Handle 0 flags 0x02 dlen 21                                                                         #146 10.313361
      SMP: Pairing Confirm (0x03) len 16
        Confirm value[16]: e2bcf80055ddd040fc86fe74415384f2
zephyr.exe[265742]: < HCI Command: Host Number of Completed Packets (0x03|0x0035) plen 5                           #147 10.328272
        Num handles: 1
        Handle: 0 Address: DF:A9:FF:F6:B1:1A (OUI DF-A9-FF)
        Count: 1
zephyr.exe[265742]: < ACL Data TX: Handle 0 [1/3] flags 0x00 dlen 21                                               #148 10.328299
      SMP: Pairing Random (0x04) len 16
        Random value[16]: 92f20f6ad8f13724432c7fd6001c45ff
> HCI Event: Number of Completed Packets (0x13) plen 5                                                             #149 10.363139
        Num handles: 1
        Handle: 0 Address: DF:A9:FF:F6:B1:1A (OUI DF-A9-FF)
        Count: 1
        Buffers: 0/3
        #148: len 21 (4 Kb/s)
        Latency: 34 msec (34-195 msec ~35 msec)
> ACL Data RX: Handle 0 flags 0x02 dlen 21                                                                         #150 10.563767
      SMP: Pairing Random (0x04) len 16
        Random value[16]: ac788ff90e043cfd7f07992ac279779f
zephyr.exe[265742]: < HCI Command: Host Number of Completed Packets (0x03|0x0035) plen 5                           #151 10.568385
        Num handles: 1
        Handle: 0 Address: DF:A9:FF:F6:B1:1A (OUI DF-A9-FF)
        Count: 1
zephyr.exe[265742]: < ACL Data TX: Handle 0 [1/3] flags 0x00 dlen 21                                               #152 10.568413
      SMP: Pairing Confirm (0x03) len 16
        Confirm value[16]: c98503a1f32aeeb32bcde5c969b59a0b
> HCI Event: Number of Completed Packets (0x13) plen 5                                                             #153 10.613156
        Num handles: 1
        Handle: 0 Address: DF:A9:FF:F6:B1:1A (OUI DF-A9-FF)
        Count: 1
        Buffers: 0/3
        #152: len 21 (3 Kb/s)
        Latency: 44 msec (34-195 msec ~40 msec)
> ACL Data RX: Handle 0 flags 0x02 dlen 21                                                                         #154 10.663597
      SMP: Pairing Confirm (0x03) len 16
        Confirm value[16]: 58547722d2c6fd98c311a5fb6cb7e2a7
zephyr.exe[265742]: < HCI Command: Host Number of Completed Packets (0x03|0x0035) plen 5                           #155 10.668311
        Num handles: 1
        Handle: 0 Address: DF:A9:FF:F6:B1:1A (OUI DF-A9-FF)
        Count: 1
zephyr.exe[265742]: < ACL Data TX: Handle 0 [1/3] flags 0x00 dlen 21                                               #156 10.668344
      SMP: Pairing Random (0x04) len 16
        Random value[16]: 23ac32ebbb5e14c8a6b9622f296d277f
> HCI Event: Number of Completed Packets (0x13) plen 5                                                             #157 10.712999
        Num handles: 1
        Handle: 0 Address: DF:A9:FF:F6:B1:1A (OUI DF-A9-FF)
        Count: 1
        Buffers: 0/3
        #156: len 21 (3 Kb/s)
        Latency: 44 msec (34-195 msec ~42 msec)
> ACL Data RX: Handle 0 flags 0x02 dlen 21                                                                         #158 10.963431
      SMP: Pairing Random (0x04) len 16
        Random value[16]: 875e4f6098ba266a013334dae6a35776
zephyr.exe[265742]: < HCI Command: Host Number of Completed Packets (0x03|0x0035) plen 5                           #159 10.968391
        Num handles: 1
        Handle: 0 Address: DF:A9:FF:F6:B1:1A (OUI DF-A9-FF)
        Count: 1
zephyr.exe[265742]: < ACL Data TX: Handle 0 [1/3] flags 0x00 dlen 21                                               #160 10.968419
      SMP: Pairing Confirm (0x03) len 16
        Confirm value[16]: cd00c43328ee52ec652ba4fdcab21d58
> HCI Event: Number of Completed Packets (0x13) plen 5                                                             #161 11.013258
        Num handles: 1
        Handle: 0 Address: DF:A9:FF:F6:B1:1A (OUI DF-A9-FF)
        Count: 1
        Buffers: 0/3
        #160: len 21 (3 Kb/s)
        Latency: 44 msec (34-195 msec ~43 msec)
> ACL Data RX: Handle 0 flags 0x02 dlen 21                                                                         #162 11.063366
      SMP: Pairing Confirm (0x03) len 16
        Confirm value[16]: 71cae693aa881b2bf3f82207d63b3b04
zephyr.exe[265742]: < HCI Command: Host Number of Completed Packets (0x03|0x0035) plen 5                           #163 11.068377
        Num handles: 1
        Handle: 0 Address: DF:A9:FF:F6:B1:1A (OUI DF-A9-FF)
        Count: 1
zephyr.exe[265742]: < ACL Data TX: Handle 0 [1/3] flags 0x00 dlen 21                                               #164 11.068400
      SMP: Pairing Random (0x04) len 16
        Random value[16]: 297efe85e67448a15f56bd27e3a3cf1d
> HCI Event: Number of Completed Packets (0x13) plen 5                                                             #165 11.113176
        Num handles: 1
        Handle: 0 Address: DF:A9:FF:F6:B1:1A (OUI DF-A9-FF)
        Count: 1
        Buffers: 0/3
        #164: len 21 (3 Kb/s)
        Latency: 44 msec (34-195 msec ~44 msec)
> ACL Data RX: Handle 0 flags 0x02 dlen 21                                                                         #166 11.313584
      SMP: Pairing Random (0x04) len 16
        Random value[16]: f11a8e772d1b9bd81c86dd6008d3fb3d
zephyr.exe[265742]: < HCI Command: Host Number of Completed Packets (0x03|0x0035) plen 5                           #167 11.328259
        Num handles: 1
        Handle: 0 Address: DF:A9:FF:F6:B1:1A (OUI DF-A9-FF)
        Count: 1
zephyr.exe[265742]: < ACL Data TX: Handle 0 [1/3] flags 0x00 dlen 21                                               #168 11.328329
      SMP: Pairing Confirm (0x03) len 16
        Confirm value[16]: 5f0a7af8032064930df3c8d0daebdba1
> HCI Event: Number of Completed Packets (0x13) plen 5                                                             #169 11.363291
        Num handles: 1
        Handle: 0 Address: DF:A9:FF:F6:B1:1A (OUI DF-A9-FF)
        Count: 1
        Buffers: 0/3
        #168: len 21 (4 Kb/s)
        Latency: 34 msec (34-195 msec ~39 msec)
> ACL Data RX: Handle 0 flags 0x02 dlen 21                                                                         #170 11.413420
      SMP: Pairing Confirm (0x03) len 16
        Confirm value[16]: 39d738d62b6077f2a0469eb62db8a824
zephyr.exe[265742]: < HCI Command: Host Number of Completed Packets (0x03|0x0035) plen 5                           #171 11.428369
        Num handles: 1
        Handle: 0 Address: DF:A9:FF:F6:B1:1A (OUI DF-A9-FF)
        Count: 1
zephyr.exe[265742]: < ACL Data TX: Handle 0 [1/3] flags 0x00 dlen 21                                               #172 11.428397
      SMP: Pairing Random (0x04) len 16
        Random value[16]: 25a9493fd3ce4faf02be7293595bb7c6
> HCI Event: Number of Completed Packets (0x13) plen 5                                                             #173 11.463311
        Num handles: 1
        Handle: 0 Address: DF:A9:FF:F6:B1:1A (OUI DF-A9-FF)
        Count: 1
        Buffers: 0/3
        #172: len 21 (4 Kb/s)
        Latency: 34 msec (34-195 msec ~37 msec)
> ACL Data RX: Handle 0 flags 0x02 dlen 21                                                                         #174 11.713311
      SMP: Pairing Random (0x04) len 16
        Random value[16]: c3b99b23d5269e9c0bee458191e5c327
zephyr.exe[265742]: < HCI Command: Host Number of Completed Packets (0x03|0x0035) plen 5                           #175 11.728405
        Num handles: 1
        Handle: 0 Address: DF:A9:FF:F6:B1:1A (OUI DF-A9-FF)
        Count: 1
zephyr.exe[265742]: < ACL Data TX: Handle 0 [1/3] flags 0x00 dlen 21                                               #176 11.728429
      SMP: Pairing Confirm (0x03) len 16
        Confirm value[16]: 65d5b850f27a0f1cf1bf82532bf3040f
> HCI Event: Number of Completed Packets (0x13) plen 5                                                             #177 11.763355
        Num handles: 1
        Handle: 0 Address: DF:A9:FF:F6:B1:1A (OUI DF-A9-FF)
        Count: 1
        Buffers: 0/3
        #176: len 21 (4 Kb/s)
        Latency: 34 msec (34-195 msec ~36 msec)
> ACL Data RX: Handle 0 flags 0x02 dlen 21                                                                         #178 11.813400
      SMP: Pairing Confirm (0x03) len 16
        Confirm value[16]: a59669f2e6b3a4edb8f3d63ca09aa5b5
zephyr.exe[265742]: < HCI Command: Host Number of Completed Packets (0x03|0x0035) plen 5                           #179 11.828430
        Num handles: 1
        Handle: 0 Address: DF:A9:FF:F6:B1:1A (OUI DF-A9-FF)
        Count: 1
zephyr.exe[265742]: < ACL Data TX: Handle 0 [1/3] flags 0x00 dlen 21                                               #180 11.828487
      SMP: Pairing Random (0x04) len 16
        Random value[16]: 58f6b41f855a6f6c3560debd84e2affc
> HCI Event: Number of Completed Packets (0x13) plen 5                                                             #181 11.863081
        Num handles: 1
        Handle: 0 Address: DF:A9:FF:F6:B1:1A (OUI DF-A9-FF)
        Count: 1
        Buffers: 0/3
        #180: len 21 (4 Kb/s)
        Latency: 34 msec (34-195 msec ~35 msec)
> ACL Data RX: Handle 0 flags 0x02 dlen 21                                                                         #182 12.063254
      SMP: Pairing Random (0x04) len 16
        Random value[16]: 1587088bd9186e4c46965c432af850ab
zephyr.exe[265742]: < HCI Command: Host Number of Completed Packets (0x03|0x0035) plen 5                           #183 12.068381
        Num handles: 1
        Handle: 0 Address: DF:A9:FF:F6:B1:1A (OUI DF-A9-FF)
        Count: 1
zephyr.exe[265742]: < ACL Data TX: Handle 0 [1/3] flags 0x00 dlen 21                                               #184 12.068408
      SMP: Pairing Confirm (0x03) len 16
        Confirm value[16]: 34fe7b4e3de80a7e8c5dc46cae0999dd
> HCI Event: Number of Completed Packets (0x13) plen 5                                                             #185 12.113347
        Num handles: 1
        Handle: 0 Address: DF:A9:FF:F6:B1:1A (OUI DF-A9-FF)
        Count: 1
        Buffers: 0/3
        #184: len 21 (3 Kb/s)
        Latency: 44 msec (34-195 msec ~40 msec)
> ACL Data RX: Handle 0 flags 0x02 dlen 21                                                                         #186 12.163533
      SMP: Pairing Confirm (0x03) len 16
        Confirm value[16]: b34bc152ef1cd2b6f036496d2e40316a
zephyr.exe[265742]: < HCI Command: Host Number of Completed Packets (0x03|0x0035) plen 5                           #187 12.168385
        Num handles: 1
        Handle: 0 Address: DF:A9:FF:F6:B1:1A (OUI DF-A9-FF)
        Count: 1
zephyr.exe[265742]: < ACL Data TX: Handle 0 [1/3] flags 0x00 dlen 21                                               #188 12.168444
      SMP: Pairing Random (0x04) len 16
        Random value[16]: b67e7216d5bf664139eda2b542549666
> HCI Event: Number of Completed Packets (0x13) plen 5                                                             #189 12.213092
        Num handles: 1
        Handle: 0 Address: DF:A9:FF:F6:B1:1A (OUI DF-A9-FF)
        Count: 1
        Buffers: 0/3
        #188: len 21 (3 Kb/s)
        Latency: 44 msec (34-195 msec ~42 msec)
> ACL Data RX: Handle 0 flags 0x02 dlen 21                                                                         #190 12.463698
      SMP: Pairing Random (0x04) len 16
        Random value[16]: 4112a712c36d8dbc86ee54e9bc68837c
zephyr.exe[265742]: < HCI Command: Host Number of Completed Packets (0x03|0x0035) plen 5                           #191 12.468412
        Num handles: 1
        Handle: 0 Address: DF:A9:FF:F6:B1:1A (OUI DF-A9-FF)
        Count: 1
zephyr.exe[265742]: < ACL Data TX: Handle 0 [1/3] flags 0x00 dlen 21                                               #192 12.468466
      SMP: Pairing Confirm (0x03) len 16
        Confirm value[16]: 229eb4c0883179f0c67aeb1be04eb361
> HCI Event: Number of Completed Packets (0x13) plen 5                                                             #193 12.513183
        Num handles: 1
        Handle: 0 Address: DF:A9:FF:F6:B1:1A (OUI DF-A9-FF)
        Count: 1
        Buffers: 0/3
        #192: len 21 (3 Kb/s)
        Latency: 44 msec (34-195 msec ~43 msec)
> ACL Data RX: Handle 0 flags 0x02 dlen 21                                                                         #194 12.563882
      SMP: Pairing Confirm (0x03) len 16
        Confirm value[16]: 276a9f1e8495a9359a3f24e6307dce27
zephyr.exe[265742]: < HCI Command: Host Number of Completed Packets (0x03|0x0035) plen 5                           #195 12.568375
        Num handles: 1
        Handle: 0 Address: DF:A9:FF:F6:B1:1A (OUI DF-A9-FF)
        Count: 1
zephyr.exe[265742]: < ACL Data TX: Handle 0 [1/3] flags 0x00 dlen 21                                               #196 12.568402
      SMP: Pairing Random (0x04) len 16
        Random value[16]: ed17f76500c95219dd01e09d1e63f87b
> HCI Event: Number of Completed Packets (0x13) plen 5                                                             #197 12.612984
        Num handles: 1
        Handle: 0 Address: DF:A9:FF:F6:B1:1A (OUI DF-A9-FF)
        Count: 1
        Buffers: 0/3
        #196: len 21 (3 Kb/s)
        Latency: 44 msec (34-195 msec ~44 msec)
> ACL Data RX: Handle 0 flags 0x02 dlen 21                                                                         #198 12.863268
      SMP: Pairing Random (0x04) len 16
        Random value[16]: e027875d5be3bc01c4a09dfa70d27e90
zephyr.exe[265742]: < HCI Command: Host Number of Completed Packets (0x03|0x0035) plen 5                           #199 12.868404
        Num handles: 1
        Handle: 0 Address: DF:A9:FF:F6:B1:1A (OUI DF-A9-FF)
        Count: 1
zephyr.exe[265742]: < ACL Data TX: Handle 0 [1/3] flags 0x00 dlen 21                                               #200 12.868432
      SMP: Pairing Confirm (0x03) len 16
        Confirm value[16]: 0458edda8df8ee92f5d22e2675b5daeb
> HCI Event: Number of Completed Packets (0x13) plen 5                                                             #201 12.912924
        Num handles: 1
        Handle: 0 Address: DF:A9:FF:F6:B1:1A (OUI DF-A9-FF)
        Count: 1
        Buffers: 0/3
        #200: len 21 (3 Kb/s)
        Latency: 44 msec (34-195 msec ~44 msec)
> ACL Data RX: Handle 0 flags 0x02 dlen 21                                                                         #202 12.963548
      SMP: Pairing Confirm (0x03) len 16
        Confirm value[16]: 426b2058ff91c5ef1ecefdb52057a781
zephyr.exe[265742]: < HCI Command: Host Number of Completed Packets (0x03|0x0035) plen 5                           #203 12.968381
        Num handles: 1
        Handle: 0 Address: DF:A9:FF:F6:B1:1A (OUI DF-A9-FF)
        Count: 1
zephyr.exe[265742]: < ACL Data TX: Handle 0 [1/3] flags 0x00 dlen 21                                               #204 12.968409
      SMP: Pairing Random (0x04) len 16
        Random value[16]: 81d35d47e1f6006d79c974bd9d9e1ee3
> HCI Event: Number of Completed Packets (0x13) plen 5                                                             #205 13.012978
        Num handles: 1
        Handle: 0 Address: DF:A9:FF:F6:B1:1A (OUI DF-A9-FF)
        Count: 1
        Buffers: 0/3
        #204: len 21 (3 Kb/s)
        Latency: 44 msec (34-195 msec ~44 msec)
> ACL Data RX: Handle 0 flags 0x02 dlen 21                                                                         #206 13.263653
      SMP: Pairing Random (0x04) len 16
        Random value[16]: cad2fb52aa76fc71399ae93aaf12a11c
zephyr.exe[265742]: < HCI Command: Host Number of Completed Packets (0x03|0x0035) plen 5                           #207 13.268409
        Num handles: 1
        Handle: 0 Address: DF:A9:FF:F6:B1:1A (OUI DF-A9-FF)
        Count: 1
zephyr.exe[265742]: < ACL Data TX: Handle 0 [1/3] flags 0x00 dlen 21                                               #208 13.268434
      SMP: Pairing Confirm (0x03) len 16
        Confirm value[16]: a6f482aad02a2041f8268d7d54c4729e
> HCI Event: Number of Completed Packets (0x13) plen 5                                                             #209 13.312980
        Num handles: 1
        Handle: 0 Address: DF:A9:FF:F6:B1:1A (OUI DF-A9-FF)
        Count: 1
        Buffers: 0/3
        #208: len 21 (3 K