Bluetooth monitor ver 5.72
= Note: Linux version 6.14.0-36-generic (x86_64)                       0.776841
= Note: Bluetooth subsystem version 2.22                               0.776843
= New Index: 00:00:00:00:00:00 (Primary,UART,hci1)              [hci1] 0.776844
= New Index: 48:5F:99:8E:E0:64 (Primary,USB,hci0)               [hci0] 0.776845
= Open Index: 00:00:00:00:00:00                                 [hci1] 0.890835
= Index Info: 00:00:00:00:00:00 (Nordic Semiconductor ASA)      [hci1] 0.890853
@ USER Open: main (privileged) version 2.22            {0x0001} [hci1] 0.890862
< HCI Command: Reset (0x03|0x0003) plen 0                    #1 [hci1] 0.892131
> HCI Event: Command Complete (0x0e) plen 4                  #2 [hci1] 0.892618
      Reset (0x03|0x0003) ncmd 1
        Status: Success (0x00)
< HCI Command: Read Local Supported... (0x04|0x0003) plen 0  #3 [hci1] 0.910574
> HCI Event: Command Complete (0x0e) plen 12                 #4 [hci1] 0.911121
      Read Local Supported Features (0x04|0x0003) ncmd 1
        Status: Success (0x00)
        Features: 0x00 0x00 0x00 0x00 0x60 0x00 0x00 0x00
          BR/EDR Not Supported
          LE Supported (Controller)
< HCI Command: Read Local Version In.. (0x04|0x0001) plen 0  #5 [hci1] 0.930276
> HCI Event: Command Complete (0x0e) plen 12                 #6 [hci1] 0.930768
      Read Local Version Information (0x04|0x0001) ncmd 1
        Status: Success (0x00)
        HCI version: Reserved (0x0f) - Revision 12393 (0x3069)
        LMP version: Reserved (0x0f) - Subversion 12393 (0x3069)
        Manufacturer: Nordic Semiconductor ASA (89)
< HCI Command: Read Local Supported... (0x04|0x0002) plen 0  #7 [hci1] 0.950193
> HCI Event: Command Complete (0x0e) plen 68                 #8 [hci1] 0.951342
      Read Local Supported Commands (0x04|0x0002) ncmd 1
        Status: Success (0x00)
        Commands: 119 entries
          Disconnect (Octet 0 - Bit 5)
          Read Remote Version Information (Octet 2 - Bit 7)
          Set Event Mask (Octet 5 - Bit 6)
          Reset (Octet 5 - Bit 7)
          Read Connection Accept Timeout (Octet 7 - Bit 2)
          Write Connection Accept Timeout (Octet 7 - Bit 3)
          Read Transmit Power Level (Octet 10 - Bit 2)
          Set Controller To Host Flow Control (Octet 10 - Bit 5)
          Host Buffer Size (Octet 10 - Bit 6)
          Host Number of Completed Packets (Octet 10 - Bit 7)
          Read Local Version Information (Octet 14 - Bit 3)
          Read Local Supported Features (Octet 14 - Bit 5)
          Read BD ADDR (Octet 15 - Bit 1)
          Read RSSI (Octet 15 - Bit 5)
          Set Event Mask Page 2 (Octet 22 - Bit 2)
          LE Set Event Mask (Octet 25 - Bit 0)
          LE Read Buffer Size (Octet 25 - Bit 1)
          LE Read Local Supported Features (Octet 25 - Bit 2)
          LE Set Random Address (Octet 25 - Bit 4)
          LE Set Advertising Parameters (Octet 25 - Bit 5)
          LE Read Advertising Channel TX Power (Octet 25 - Bit 6)
          LE Set Advertising Data (Octet 25 - Bit 7)
          LE Set Scan Response Data (Octet 26 - Bit 0)
          LE Set Advertise Enable (Octet 26 - Bit 1)
          LE Set Scan Parameters (Octet 26 - Bit 2)
          LE Set Scan Enable (Octet 26 - Bit 3)
          LE Create Connection (Octet 26 - Bit 4)
          LE Create Connection Cancel (Octet 26 - Bit 5)
          LE Read Accept List Size (Octet 26 - Bit 6)
          LE Clear Accept List (Octet 26 - Bit 7)
          LE Add Device To Accept List (Octet 27 - Bit 0)
          LE Remove Device From Accept List (Octet 27 - Bit 1)
          LE Connection Update (Octet 27 - Bit 2)
          LE Set Host Channel Classification (Octet 27 - Bit 3)
          LE Read Channel Map (Octet 27 - Bit 4)
          LE Read Remote Used Features (Octet 27 - Bit 5)
          LE Encrypt (Octet 27 - Bit 6)
          LE Rand (Octet 27 - Bit 7)
          LE Start Encryption (Octet 28 - Bit 0)
          LE Long Term Key Request Reply (Octet 28 - Bit 1)
          LE Long Term Key Request Neg Reply (Octet 28 - Bit 2)
          LE Read Supported States (Octet 28 - Bit 3)
          LE Receiver Test (Octet 28 - Bit 4)
          LE Transmitter Test (Octet 28 - Bit 5)
          LE Test End (Octet 28 - Bit 6)
          Read Authenticated Payload Timeout (Octet 32 - Bit 4)
          Write Authenticated Payload Timeout (Octet 32 - Bit 5)
          LE Set Data Length (Octet 33 - Bit 6)
          LE Read Suggested Default Data Length (Octet 33 - Bit 7)
          LE Write Suggested Default Data Length (Octet 34 - Bit 0)
          LE Add Device To Resolving List (Octet 34 - Bit 3)
          LE Remove Device From Resolving List (Octet 34 - Bit 4)
          LE Clear Resolving List (Octet 34 - Bit 5)
          LE Read Resolving List Size (Octet 34 - Bit 6)
          LE Set Address Resolution Enable (Octet 35 - Bit 1)
          LE Set Resolvable Private Address Timeout (Octet 35 - Bit 2)
          LE Read Maximum Data Length (Octet 35 - Bit 3)
          LE Read PHY (Octet 35 - Bit 4)
          LE Set Default PHY (Octet 35 - Bit 5)
          LE Set PHY (Octet 35 - Bit 6)
          LE Enhanced Receiver Test (Octet 35 - Bit 7)
          LE Enhanced Transmitter Test (Octet 36 - Bit 0)
          LE Set Advertising Set Random Address (Octet 36 - Bit 1)
          LE Set Extended Advertising Parameters (Octet 36 - Bit 2)
          LE Set Extended Advertising Data (Octet 36 - Bit 3)
          LE Set Extended Scan Response Data (Octet 36 - Bit 4)
          LE Set Extended Advertising Enable (Octet 36 - Bit 5)
          LE Read Maximum Advertising Data Length (Octet 36 - Bit 6)
          LE Read Number of Supported Advertising Sets (Octet 36 - Bit 7)
          LE Remove Advertising Set (Octet 37 - Bit 0)
          LE Clear Advertising Sets (Octet 37 - Bit 1)
          LE Set Periodic Advertising Parameters (Octet 37 - Bit 2)
          LE Set Periodic Advertising Data (Octet 37 - Bit 3)
          LE Set Periodic Advertising Enable (Octet 37 - Bit 4)
          LE Set Extended Scan Parameters (Octet 37 - Bit 5)
          LE Set Extended Scan Enable (Octet 37 - Bit 6)
          LE Extended Create Connection (Octet 37 - Bit 7)
          LE Periodic Advertising Create Sync (Octet 38 - Bit 0)
          LE Periodic Advertising Create Sync Cancel (Octet 38 - Bit 1)
          LE Periodic Advertising Terminate Sync (Octet 38 - Bit 2)
          LE Add Device To Periodic Advertiser List (Octet 38 - Bit 3)
          LE Remove Device From Periodic Advertiser List (Octet 38 - Bit 4)
          LE Clear Periodic Advertiser List (Octet 38 - Bit 5)
          LE Read Periodic Advertiser List Size (Octet 38 - Bit 6)
          LE Read Transmit Power (Octet 38 - Bit 7)
          LE Read RF Path Compensation (Octet 39 - Bit 0)
          LE Write RF Path Compensation (Octet 39 - Bit 1)
          LE Set Privacy Mode (Octet 39 - Bit 2)
          LE Periodic Advertising Receive Enable (Octet 40 - Bit 5)
          LE Periodic Advertising Sync Transfer (Octet 40 - Bit 6)
          LE Periodic Advertising Set Info Transfer (Octet 40 - Bit 7)
          LE Periodic Advertising Sync Transfer Parameters (Octet 41 - Bit 0)
          LE Set Default Periodic Advertisng Sync Transfer Parameters (Octet 41 - Bit 1)
          LE Read Buffer v2 (Octet 41 - Bit 5)
          LE Read ISO TX Sync (Octet 41 - Bit 6)
          LE Set Connected Isochronous Group Parameters (Octet 41 - Bit 7)
          LE Set Connected Isochronous Group Parameters Test (Octet 42 - Bit 0)
          LE Create Connected Isochronous Stream (Octet 42 - Bit 1)
          LE Remove Connected Isochronous Group (Octet 42 - Bit 2)
          LE Accept Connected Isochronous Stream Request (Octet 42 - Bit 3)
          LE Reject Connected Isochronous Stream Request (Octet 42 - Bit 4)
          LE Create Broadcast Isochronous Group (Octet 42 - Bit 5)
          LE Create Broadcast Isochronous Group Test (Octet 42 - Bit 6)
          LE Terminate Broadcast Isochronous Group (Octet 42 - Bit 7)
          LE Broadcast Isochronous Group Create Sync (Octet 43 - Bit 0)
          LE Broadcast Isochronous Group Terminate Sync (Octet 43 - Bit 1)
          LE Request Peer SCA (Octet 43 - Bit 2)
          LE Setup Isochronous Data Path (Octet 43 - Bit 3)
          LE Remove Isochronous Data Path (Octet 43 - Bit 4)
          LE Isochronous Transmit Test (Octet 43 - Bit 5)
          LE Isochronous Receive Test (Octet 43 - Bit 6)
          LE Isochronous Read Test Counters (Octet 43 - Bit 7)
          LE Isochronous Read Test Counters (Octet 44 - Bit 0)
          LE Set Host Feature (Octet 44 - Bit 1)
          Octet 44 - Bit 2 
          Octet 45 - Bit 6 
          Octet 46 - Bit 0 
          Octet 46 - Bit 1 
          Octet 46 - Bit 2 
< HCI Command: Host Buffer Size (0x03|0x0033) plen 7         #9 [hci1] 0.970187
        ACL MTU: 255  ACL max packet: 16
        SCO MTU: 0    SCO max packet: 0
> HCI Event: Command Complete (0x0e) plen 4                 #10 [hci1] 0.970608
      Host Buffer Size (0x03|0x0033) ncmd 1
        Status: Success (0x00)
< HCI Command: Set Controller To Ho.. (0x03|0x0031) plen 1  #11 [hci1] 0.990161
        Flow control: ACL Data Packets (0x01)
> HCI Event: Command Complete (0x0e) plen 4                 #12 [hci1] 0.990570
      Set Controller To Host Flow Control (0x03|0x0031) ncmd 1
        Status: Success (0x00)
< HCI Command: LE Read Local Suppor.. (0x08|0x0003) plen 0  #13 [hci1] 1.010154
> HCI Event: Command Complete (0x0e) plen 12                #14 [hci1] 1.010657
      LE Read Local Supported Features (0x08|0x0003) ncmd 1
        Status: Success (0x00)
        Features: 0xfd 0x79 0x00 0xf7 0x30 0x01 0x00 0x00
          LE Encryption
          Extended Reject Indication
          Peripheral-initiated Features Exchange
          LE Ping
          LE Data Packet Length Extension
          LL Privacy
          Extended Scanner Filter Policies
          LE 2M PHY
          LE Coded PHY
          LE Extended Advertising
          LE Periodic Advertising
          Channel Selection Algorithm #2
          Periodic Advertising Sync Transfer - Sender
          Periodic Advertising Sync Transfer - Recipient
          Sleep Clock Accuracy Updates
          Connected Isochronous Stream - Central
          Connected Isochronous Stream - Peripheral
          Isochronous Broadcaster
          Synchronized Receiver
          Periodic Advertising ADI support
          Connection Subrating
          Unknown features (0x0000010000000000)
< HCI Command: LE Set Host Feature (0x08|0x0074) plen 2     #15 [hci1] 1.030158
        Bit Number: 32
          Connected Isochronous Stream (Host Support)
        Bit Value: 1
> HCI Event: Command Complete (0x0e) plen 4                 #16 [hci1] 1.030541
      LE Set Host Feature (0x08|0x0074) ncmd 1
        Status: Success (0x00)
< HCI Command: LE Read Buffer v2 (0x08|0x0060) plen 0       #17 [hci1] 1.050093
> HCI Event: Command Complete (0x0e) plen 10                #18 [hci1] 1.050574
      LE Read Buffer v2 (0x08|0x0060) ncmd 1
        Status: Success (0x00)
        ACL MTU: 27
        ACL max packet: 3
        ISO MTU: 318
        ISO max packet: 3
< HCI Command: LE Read Maximum Adve.. (0x08|0x003a) plen 0  #19 [hci1] 1.070225
> HCI Event: Command Complete (0x0e) plen 6                 #20 [hci1] 1.070649
      LE Read Maximum Advertising Data Length (0x08|0x003a) ncmd 1
        Status: Success (0x00)
        Max length: 1650
< HCI Command: LE Read Supported St.. (0x08|0x001c) plen 0  #21 [hci1] 1.090202
> HCI Event: Command Complete (0x0e) plen 12                #22 [hci1] 1.090715
      LE Read Supported States (0x08|0x001c) ncmd 1
        Status: Success (0x00)
        States: 0x000003ff3e0306ff
          Non-connectable Advertising State
          Scannable Advertising State
          Connectable Advertising State
          High Duty Cycle Directed Advertising State
          Passive Scanning State
          Active Scanning State
          Initiating State
            and Connection State (Central Role)
          Connection State (Peripheral Role)
          Scannable Advertising State
            and Passive Scanning State
          Connectable Advertising State
            and Passive Scanning State
          Non-connectable Advertising State
            and Initiating State
          Scannable Advertising State
            and Initiating State
          Active Scanning State
            and Connection State (Central Role)
          Passive Scanning State
            and Connection State (Peripheral Role)
          Active Scanning State
            and Connection State (Peripheral Role)
          Initiating State
            and Connection State (Central Role)
            and Central Role & Central Role
          Low Duty Cycle Directed Advertising State
          Connectable Advertising State
            and Initiating State
            and Central Role & Peripheral Role
          High Duty Cycle Directed Advertising State
            and Initiating State
            and Central Role & Peripheral Role
          Low Duty Cycle Directed Advertising State
            and Initiating State
            and Central Role & Peripheral Role
          Connectable Advertising State
            and Connection State (Central Role)
            and Central Role & Peripheral Role
          High Duty Cycle Directed Advertising State
            and Connection State (Central Role)
            and Central Role & Peripheral Role
          Low Duty Cycle Directed Advertising State
            and Connection State (Central Role)
            and Central Role & Peripheral Role
          Connectable Advertising State
            and Connection State (Peripheral Role)
            and Central Role & Peripheral Role
          High Duty Cycle Directed Advertising State
            and Connection State (Peripheral Role)
            and Peripheral Role & Peripheral Role
          Low Duty Cycle Directed Advertising State
            and Connection State (Peripheral Role)
            and Peripheral Role & Peripheral Role
          Initiating State
            and Connection State (Peripheral Role)
            and Central Role & Peripheral Role
< HCI Command: LE Read Maximum Data.. (0x08|0x002f) plen 0  #23 [hci1] 1.110198
> HCI Event: Command Complete (0x0e) plen 12                #24 [hci1] 1.110690
      LE Read Maximum Data Length (0x08|0x002f) ncmd 1
        Status: Success (0x00)
        Max TX octets: 251
        Max TX time: 2704
        Max RX octets: 251
        Max RX time: 2704
< HCI Command: LE Write Suggested D.. (0x08|0x0024) plen 4  #25 [hci1] 1.130122
        TX octets: 251
        TX time: 2704
> HCI Event: Command Complete (0x0e) plen 4                 #26 [hci1] 1.130577
      LE Write Suggested Default Data Length (0x08|0x0024) ncmd 1
        Status: Success (0x00)
< HCI Command: LE Read Resolving Li.. (0x08|0x002a) plen 0  #27 [hci1] 1.150156
> HCI Event: Command Complete (0x0e) plen 5                 #28 [hci1] 1.150576
      LE Read Resolving List Size (0x08|0x002a) ncmd 1
        Status: Success (0x00)
        Size: 8
< HCI Command: LE Set Event Mask (0x08|0x0001) plen 8       #29 [hci1] 1.170192
        Mask: 0x000002023f87fa5e
          LE Advertising Report
          LE Connection Update Complete
          LE Read Remote Used Features Complete
          LE Long Term Key Request
          LE Data Length Change
          LE Enhanced Connection Complete
          LE PHY Update Complete
          LE Extended Advertising Report
          LE Periodic Advertising Sync Established
          LE Periodic Advertising Report
          LE Periodic Advertising Sync Lost
          LE Extended Scan Timeout
          LE Extended Advertising Set Terminated
          LE Scan Request Received
          LE Periodic Advertising Sync Transfer Rvc
          LE CIS Established
          LE CIS Request
          LE Create BIG Complete
          LE Terminate BIG Complete
          LE BIG Sync Estabilished Complete
          LE BIG Sync Lost
          LE BIG Info Advertising Report
          Unknown mask (0x0000020000000000)
> HCI Event: Command Complete (0x0e) plen 4                 #30 [hci1] 1.170716
      LE Set Event Mask (0x08|0x0001) ncmd 1
        Status: Success (0x00)
< HCI Command: Set Event Mask (0x03|0x0001) plen 8          #31 [hci1] 1.190165
        Mask: 0x2000800002008890
          Disconnection Complete
          Encryption Change
          Read Remote Version Information Complete
          Hardware Error
          Data Buffer Overflow
          Encryption Key Refresh Complete
          LE Meta
> HCI Event: Command Complete (0x0e) plen 4                 #32 [hci1] 1.190677
      Set Event Mask (0x03|0x0001) ncmd 1
        Status: Success (0x00)
< HCI Command: Read BD ADDR (0x04|0x0009) plen 0            #33 [hci1] 1.210174
> HCI Event: Command Complete (0x0e) plen 10                #34 [hci1] 1.210594
      Read BD ADDR (0x04|0x0009) ncmd 1
        Status: Success (0x00)
        Address: 00:00:00:00:00:00 (OUI 00-00-00)
< HCI Command: LE Set Random Address (0x08|0x0005) plen 6   #35 [hci1] 1.230196
        Address: D5:B6:CC:31:DB:3B (Static)
> HCI Event: Command Complete (0x0e) plen 4                 #36 [hci1] 1.230683
      LE Set Random Address (0x08|0x0005) ncmd 1
        Status: Success (0x00)
< HCI Command: LE Set Extended Adv.. (0x08|0x0036) plen 25  #37 [hci1] 3.800693
        Handle: 0x00
        Properties: 0x0013
          Connectable
          Scannable
          Use legacy advertising PDUs: ADV_IND
        Min advertising interval: 100.000 msec (0x00a0)
        Max advertising interval: 150.000 msec (0x00f0)
        Channel map: 37, 38, 39 (0x07)
        Own address type: Random (0x01)
        Peer address type: Public (0x00)
        Peer address: 00:00:00:00:00:00 (OUI 00-00-00)
        Filter policy: Allow Scan Request from Any, Allow Connect Request from Any (0x00)
        TX power: Host has no preference (0x7f)
        Primary PHY: LE 1M (0x01)
        Secondary max skip: 0x00
        Secondary PHY: LE 1M (0x01)
        SID: 0x00
        Scan request notifications: Disabled (0x00)
> HCI Event: Command Complete (0x0e) plen 5                 #38 [hci1] 3.801549
      LE Set Extended Advertising Parameters (0x08|0x0036) ncmd 1
        Status: Success (0x00)
        TX power (selected): 0 dbm (0x00)
< HCI Command: LE Set Advertising S.. (0x08|0x0035) plen 7  #39 [hci1] 3.810208
        Advertising handle: 0x00
        Advertising random address: D5:B6:CC:31:DB:3B (Static)
> HCI Event: Command Complete (0x0e) plen 4                 #40 [hci1] 3.810694
      LE Set Advertising Set Random Address (0x08|0x0035) ncmd 1
        Status: Success (0x00)
< HCI Command: LE Set Extended Adv.. (0x08|0x0037) plen 22  #41 [hci1] 3.830161
        Handle: 0x00
        Operation: Complete extended advertising data (0x03)
        Fragment preference: Minimize fragmentation (0x01)
        Data length: 0x12
        Flags: 0x06
          LE General Discoverable Mode
          BR/EDR Not Supported
        Name (complete): Tester_F6B11A
> HCI Event: Command Complete (0x0e) plen 4                 #42 [hci1] 3.830942
      LE Set Extended Advertising Data (0x08|0x0037) ncmd 1
        Status: Success (0x00)
< HCI Command: LE Set Extended Scan.. (0x08|0x0038) plen 4  #43 [hci1] 3.850148
        Handle: 0x00
        Operation: Complete scan response data (0x03)
        Fragment preference: Minimize fragmentation (0x01)
        Data length: 0x00
> HCI Event: Command Complete (0x0e) plen 4                 #44 [hci1] 3.850590
      LE Set Extended Scan Response Data (0x08|0x0038) ncmd 1
        Status: Success (0x00)
< HCI Command: LE Set Extended Adve.. (0x08|0x0039) plen 6  #45 [hci1] 3.870164
        Extended advertising: Enabled (0x01)
        Number of sets: 1 (0x01)
        Entry 0
          Handle: 0x00
          Duration: 0 ms (0x00)
          Max ext adv events: 0
> HCI Event: Command Complete (0x0e) plen 4                 #46 [hci1] 3.870750
      LE Set Extended Advertising Enable (0x08|0x0039) ncmd 1
        Status: Success (0x00)
> HCI Event: LE Meta Event (0x3e) plen 31                   #47 [hci1] 3.986923
      LE Enhanced Connection Complete (0x0a)
        Status: Success (0x00)
        Handle: 1551
        Role: Peripheral (0x01)
        Peer address type: Public (0x00)
        Peer address: DF:A9:FF:F6:B1:1A (OUI DF-A9-FF)
        Local resolvable private address: 00:00:00:00:00:00 (Non-Resolvable)
        Peer resolvable private address: 00:00:00:00:00:00 (Non-Resolvable)
        Connection interval: 87.50 msec (0x0046)
        Connection latency: 0 (0x0000)
        Supervision timeout: 25120 msec (0x09d0)
        Central clock accuracy: 0x01
> HCI Event: LE Meta Event (0x3e) plen 6                    #48 [hci1] 3.987064
      LE Advertising Set Terminated (0x12)
        Status: Success (0x00)
        Handle: 0
        Connection handle: 1551
        Number of completed extended advertising events: 0
< HCI Command: LE Read Remote Used... (0x08|0x0016) plen 2  #49 [hci1] 3.994630
        Handle: 1551 Address: DF:A9:FF:F6:B1:1A (OUI DF-A9-FF)
< ACL Data TX: Handle 1551 flags 0x00 dlen 7                #50 [hci1] 3.994654
      ATT: Exchange MTU Request (0x02) len 2
        Client RX MTU: 251
> HCI Event: Command Status (0x0f) plen 4                   #51 [hci1] 3.995300
      LE Read Remote Used Features (0x08|0x0016) ncmd 1
        Status: Success (0x00)
> HCI Event: Number of Completed Packets (0x13) plen 5      #52 [hci1] 4.162945
        Num handles: 1
        Handle: 1551 Address: DF:A9:FF:F6:B1:1A (OUI DF-A9-FF)
        Count: 1
        #50: len 7 (0 Kb/s)
        Latency: 168 msec (168-168 msec ~168 msec)
> HCI Event: LE Meta Event (0x3e) plen 12                   #53 [hci1] 4.250904
      LE Read Remote Used Features (0x04)
        Status: Success (0x00)
        Handle: 1551 Address: DF:A9:FF:F6:B1:1A (OUI DF-A9-FF)
        Features: 0x2d 0x49 0x00 0xf7 0x67 0xd9 0x00 0x80
          LE Encryption
          Extended Reject Indication
          Peripheral-initiated Features Exchange
          LE Data Packet Length Extension
          LE 2M PHY
          LE Coded PHY
          Channel Selection Algorithm #2
          Periodic Advertising Sync Transfer - Sender
          Periodic Advertising Sync Transfer - Recipient
          Sleep Clock Accuracy Updates
          Connected Isochronous Stream - Central
          Connected Isochronous Stream - Peripheral
          Isochronous Broadcaster
          Synchronized Receiver
          Connected Isochronous Stream (Host Support)
          LE Power Control Request
          LE Power Control Request
          Connection Subrating
          Connection Subrating (Host Support)
          Unknown features (0x8000d90000000000)
> ACL Data RX: Handle 1551 flags 0x02 dlen 11               #54 [hci1] 6.700679
      SMP: Pairing Request (0x01) len 6
        IO capability: KeyboardDisplay (0x04)
        OOB data: Authentication data not present (0x00)
        Authentication requirement: Bonding, MITM, SC, No Keypresses (0x0d)
        Max encryption key size: 16
        Initiator key distribution: EncKey IdKey (0x03)
        Responder key distribution: EncKey IdKey Sign (0x07)
> ACL Data RX: Handle 1551 flags 0x02 dlen 7                #55 [hci1] 6.700978
      ATT: Exchange MTU Response (0x03) len 2
        Server RX MTU: 23
< HCI Command: Host Number of Compl.. (0x03|0x0035) plen 5  #56 [hci1] 6.710859
        Num handles: 1
        Handle: 1551 Address: DF:A9:FF:F6:B1:1A (OUI DF-A9-FF)
        Count: 1
< ACL Data TX: Handle 1551 flags 0x00 dlen 11               #57 [hci1] 6.710965
      SMP: Pairing Response (0x02) len 6
        IO capability: DisplayOnly (0x00)
        OOB data: Authentication data not present (0x00)
        Authentication requirement: Bonding, No MITM, SC, No Keypresses (0x09)
        Max encryption key size: 16
        Initiator key distribution: IdKey (0x02)
        Responder key distribution: <none> (0x00)
< HCI Command: Host Number of Compl.. (0x03|0x0035) plen 5  #58 [hci1] 6.711409
        Num handles: 1
        Handle: 1551 Address: DF:A9:FF:F6:B1:1A (OUI DF-A9-FF)
        Count: 1
> HCI Event: Number of Completed Packets (0x13) plen 5      #59 [hci1] 6.875640
        Num handles: 1
        Handle: 1551 Address: DF:A9:FF:F6:B1:1A (OUI DF-A9-FF)
        Count: 1
        #57: len 11 (0 Kb/s)
        Latency: 164 msec (164-168 msec ~166 msec)
> ACL Data RX: Handle 1551 flags 0x02 dlen 27               #60 [hci1] 6.875955
> ACL Data RX: Handle 1551 flags 0x01 dlen 27               #61 [hci1] 6.876483
> ACL Data RX: Handle 1551 flags 0x01 dlen 15               #62 [hci1] 6.876945
      SMP: Pairing Public Key (0x0c) len 64
        X: 3f6093e21d9305ed1cf44529633addc27a964ebcb6d62189dce6a411b82cfbf3
        Y: 41b59480e10cd969eb4922c5a6487f85bbcc33ce8d2d0fd4aa8cff884dc6a264
< HCI Command: Host Number of Compl.. (0x03|0x0035) plen 5  #63 [hci1] 6.891212
        Num handles: 1
        Handle: 1551 Address: DF:A9:FF:F6:B1:1A (OUI DF-A9-FF)
        Count: 1
< HCI Command: Host Number of Compl.. (0x03|0x0035) plen 5  #64 [hci1] 6.891415
        Num handles: 1
        Handle: 1551 Address: DF:A9:FF:F6:B1:1A (OUI DF-A9-FF)
        Count: 1
< HCI Command: Host Number of Compl.. (0x03|0x0035) plen 5  #65 [hci1] 6.891757
        Num handles: 1
        Handle: 1551 Address: DF:A9:FF:F6:B1:1A (OUI DF-A9-FF)
        Count: 1
< ACL Data TX: Handle 1551 flags 0x00 dlen 27               #66 [hci1] 6.891945
< ACL Data TX: Handle 1551 flags 0x01 dlen 27               #67 [hci1] 6.891963
< ACL Data TX: Handle 1551 flags 0x01 dlen 15               #68 [hci1] 6.891967
      SMP: Pairing Public Key (0x0c) len 64
        X: 98308440221e2d910f0e54b71e7ec652857aa9b5a0dc65028824cc19db1226e9
        Y: 67a4816bcb62efb21701e31fdb27561a6217575fb007a8bbdabe7e28b6f68482
> HCI Event: Number of Completed Packets (0x13) plen 5      #69 [hci1] 6.963530
        Num handles: 1
        Handle: 1551 Address: DF:A9:FF:F6:B1:1A (OUI DF-A9-FF)
        Count: 1
        #66: len 27 (3 Kb/s)
        Latency: 71 msec (71-168 msec ~119 msec)
> HCI Event: Number of Completed Packets (0x13) plen 5      #70 [hci1] 6.964273
        Num handles: 1
        Handle: 1551 Address: DF:A9:FF:F6:B1:1A (OUI DF-A9-FF)
        Count: 1
        #67: len 27 (3 Kb/s)
        Latency: 72 msec (71-168 msec ~95 msec)
> HCI Event: Number of Completed Packets (0x13) plen 5      #71 [hci1] 7.050434
        Num handles: 1
        Handle: 1551 Address: DF:A9:FF:F6:B1:1A (OUI DF-A9-FF)
        Count: 1
        #68: len 15 (0 Kb/s)
        Latency: 158 msec (71-168 msec ~127 msec)
> ACL Data RX: Handle 1551 flags 0x02 dlen 21               #72 [hci1] 8.013182
      SMP: Pairing Confirm (0x03) len 16
        Confim value: 0b77465c7f35d0b8d78072cd265491f6
< HCI Command: Host Number of Compl.. (0x03|0x0035) plen 5  #73 [hci1] 8.030702
        Num handles: 1
        Handle: 1551 Address: DF:A9:FF:F6:B1:1A (OUI DF-A9-FF)
        Count: 1
< ACL Data TX: Handle 1551 flags 0x00 dlen 21               #74 [hci1] 8.030795
      SMP: Pairing Confirm (0x03) len 16
        Confim value: ce6a3136a970fa0dbea22144ae30fa88
> HCI Event: Number of Completed Packets (0x13) plen 5      #75 [hci1] 8.188017
        Num handles: 1
        Handle: 1551 Address: DF:A9:FF:F6:B1:1A (OUI DF-A9-FF)
        Count: 1
        #74: len 21 (1 Kb/s)
        Latency: 157 msec (71-168 msec ~142 msec)
> ACL Data RX: Handle 1551 flags 0x02 dlen 21               #76 [hci1] 8.188428
      SMP: Pairing Random (0x04) len 16
        Random value: c63f03197953c24c0000000000000000
< HCI Command: Host Number of Compl.. (0x03|0x0035) plen 5  #77 [hci1] 8.191193
        Num handles: 1
        Handle: 1551 Address: DF:A9:FF:F6:B1:1A (OUI DF-A9-FF)
        Count: 1
< ACL Data TX: Handle 1551 flags 0x00 dlen 21               #78 [hci1] 8.191290
      SMP: Pairing Random (0x04) len 16
        Random value: 8e6108f966a694cbe26df70bb96773e6
> HCI Event: Number of Completed Packets (0x13) plen 5      #79 [hci1] 8.362853
        Num handles: 1
        Handle: 1551 Address: DF:A9:FF:F6:B1:1A (OUI DF-A9-FF)
        Count: 1
        #78: len 21 (0 Kb/s)
        Latency: 171 msec (71-171 msec ~156 msec)
> ACL Data RX: Handle 1551 flags 0x02 dlen 21               #80 [hci1] 8.450822
      SMP: Pairing Confirm (0x03) len 16
        Confim value: 6930afa2ba3a868f6ddc9bf5ab7fb3a8
< HCI Command: Host Number of Compl.. (0x03|0x0035) plen 5  #81 [hci1] 8.470876
        Num handles: 1
        Handle: 1551 Address: DF:A9:FF:F6:B1:1A (OUI DF-A9-FF)
        Count: 1
< ACL Data TX: Handle 1551 flags 0x00 dlen 21               #82 [hci1] 8.471023
      SMP: Pairing Confirm (0x03) len 16
        Confim value: 9b4f73f9d19364b3e448a9bc669470f7
> HCI Event: Number of Completed Packets (0x13) plen 5      #83 [hci1] 8.625543
        Num handles: 1
        Handle: 1551 Address: DF:A9:FF:F6:B1:1A (OUI DF-A9-FF)
        Count: 1
        #82: len 21 (1 Kb/s)
        Latency: 154 msec (71-171 msec ~155 msec)
> ACL Data RX: Handle 1551 flags 0x02 dlen 21               #84 [hci1] 8.625919
      SMP: Pairing Random (0x04) len 16
        Random value: 7e4a765da81446ea0000000000000000
< HCI Command: Host Number of Compl.. (0x03|0x0035) plen 5  #85 [hci1] 8.631149
        Num handles: 1
        Handle: 1551 Address: DF:A9:FF:F6:B1:1A (OUI DF-A9-FF)
        Count: 1
< ACL Data TX: Handle 1551 flags 0x00 dlen 21               #86 [hci1] 8.631351
      SMP: Pairing Random (0x04) len 16
        Random value: 4d02679f89a05211af56d8b3da64d21e
> HCI Event: Number of Completed Packets (0x13) plen 5      #87 [hci1] 8.800557
        Num handles: 1
        Handle: 1551 Address: DF:A9:FF:F6:B1:1A (OUI DF-A9-FF)
        Count: 1
        #86: len 21 (0 Kb/s)
        Latency: 169 msec (71-171 msec ~162 msec)
> ACL Data RX: Handle 1551 flags 0x02 dlen 21               #88 [hci1] 8.888218
      SMP: Pairing Confirm (0x03) len 16
        Confim value: cbecb5b6449b2f9d08f16272cf7d3811
< HCI Command: Host Number of Compl.. (0x03|0x0035) plen 5  #89 [hci1] 8.890895
        Num handles: 1
        Handle: 1551 Address: DF:A9:FF:F6:B1:1A (OUI DF-A9-FF)
        Count: 1
< ACL Data TX: Handle 1551 flags 0x00 dlen 21               #90 [hci1] 8.891045
      SMP: Pairing Confirm (0x03) len 16
        Confim value: 98700c1065f62dbe9a84e55a3faf27a0
> HCI Event: Number of Completed Packets (0x13) plen 5      #91 [hci1] 9.063133
        Num handles: 1
        Handle: 1551 Address: DF:A9:FF:F6:B1:1A (OUI DF-A9-FF)
        Count: 1
        #90: len 21 (0 Kb/s)
        Latency: 172 msec (71-172 msec ~167 msec)
> ACL Data RX: Handle 1551 flags 0x02 dlen 21               #92 [hci1] 9.063444
      SMP: Pairing Random (0x04) len 16
        Random value: 5447600f872ba07c0000000000000000
< HCI Command: Host Number of Compl.. (0x03|0x0035) plen 5  #93 [hci1] 9.071192
        Num handles: 1
        Handle: 1551 Address: DF:A9:FF:F6:B1:1A (OUI DF-A9-FF)
        Count: 1
< ACL Data TX: Handle 1551 flags 0x00 dlen 21               #94 [hci1] 9.071355
      SMP: Pairing Random (0x04) len 16
        Random value: 5e8286bc235a02440d0c3424a2acf8fd
> HCI Event: Number of Completed Packets (0x13) plen 5      #95 [hci1] 9.237890
        Num handles: 1
        Handle: 1551 Address: DF:A9:FF:F6:B1:1A (OUI DF-A9-FF)
        Count: 1
        #94: len 21 (1 Kb/s)
        Latency: 166 msec (71-172 msec ~166 msec)
> ACL Data RX: Handle 1551 flags 0x02 dlen 21               #96 [hci1] 9.325751
      SMP: Pairing Confirm (0x03) len 16
        Confim value: 3a8b0c8e69dd2dc8a5820eefc0c64d8a
< HCI Command: Host Number of Compl.. (0x03|0x0035) plen 5  #97 [hci1] 9.330859
        Num handles: 1
        Handle: 1551 Address: DF:A9:FF:F6:B1:1A (OUI DF-A9-FF)
        Count: 1
< ACL Data TX: Handle 1551 flags 0x00 dlen 21               #98 [hci1] 9.331005
      SMP: Pairing Confirm (0x03) len 16
        Confim value: 59ab71faab34503eee7b6a320cf5ed62
> HCI Event: Number of Completed Packets (0x13) plen 5      #99 [hci1] 9.500556
        Num handles: 1
        Handle: 1551 Address: DF:A9:FF:F6:B1:1A (OUI DF-A9-FF)
        Count: 1
        #98: len 21 (0 Kb/s)
        Latency: 169 msec (71-172 msec ~168 msec)
> ACL Data RX: Handle 1551 flags 0x02 dlen 21              #100 [hci1] 9.500909
      SMP: Pairing Random (0x04) len 16
        Random value: 20a1772db11ae2a00000000000000000
< HCI Command: Host Number of Comp.. (0x03|0x0035) plen 5  #101 [hci1] 9.511204
        Num handles: 1
        Handle: 1551 Address: DF:A9:FF:F6:B1:1A (OUI DF-A9-FF)
        Count: 1
< ACL Data TX: Handle 1551 flags 0x00 dlen 21              #102 [hci1] 9.511402
      SMP: Pairing Random (0x04) len 16
        Random value: 5c4a1bcadd27bd58e945097b00bad7ac
> HCI Event: Number of Completed Packets (0x13) plen 5     #103 [hci1] 9.675322
        Num handles: 1
        Handle: 1551 Address: DF:A9:FF:F6:B1:1A (OUI DF-A9-FF)
        Count: 1
        #102: len 21 (1 Kb/s)
        Latency: 163 msec (71-172 msec ~166 msec)
> ACL Data RX: Handle 1551 flags 0x02 dlen 21              #104 [hci1] 9.763195
      SMP: Pairing Confirm (0x03) len 16
        Confim value: 0af6a26be72822e60744c1baf43d43f8
< HCI Command: Host Number of Comp.. (0x03|0x0035) plen 5  #105 [hci1] 9.770586
        Num handles: 1
        Handle: 1551 Address: DF:A9:FF:F6:B1:1A (OUI DF-A9-FF)
        Count: 1
< ACL Data TX: Handle 1551 flags 0x00 dlen 21              #106 [hci1] 9.770710
      SMP: Pairing Confirm (0x03) len 16
        Confim value: 820c99eef8b07a2e458cb13f9a0dbb74
> HCI Event: Number of Completed Packets (0x13) plen 5     #107 [hci1] 9.938054
        Num handles: 1
        Handle: 1551 Address: DF:A9:FF:F6:B1:1A (OUI DF-A9-FF)
        Count: 1
        #106: len 21 (1 Kb/s)
        Latency: 167 msec (71-172 msec ~166 msec)
> ACL Data RX: Handle 1551 flags 0x02 dlen 21              #108 [hci1] 9.938443
      SMP: Pairing Random (0x04) len 16
        Random value: b2456ebbff77e26c0000000000000000
< HCI Command: Host Number of Comp.. (0x03|0x0035) plen 5  #109 [hci1] 9.951132
        Num handles: 1
        Handle: 1551 Address: DF:A9:FF:F6:B1:1A (OUI DF-A9-FF)
        Count: 1
< ACL Data TX: Handle 1551 flags 0x00 dlen 21              #110 [hci1] 9.951304
      SMP: Pairing Random (0x04) len 16
        Random value: 32527e6e64e79f33b2e374394db8ab2d
> HCI Event: Number of Completed Packets (0x13) plen 5    #111 [hci1] 10.112902
        Num handles: 1
        Handle: 1551 Address: DF:A9:FF:F6:B1:1A (OUI DF-A9-FF)
        Count: 1
        #110: len 21 (1 Kb/s)
        Latency: 161 msec (71-172 msec ~164 msec)
> ACL Data RX: Handle 1551 flags 0x02 dlen 21             #112 [hci1] 10.200618
      SMP: Pairing Confirm (0x03) len 16
        Confim value: 096a34ffe91425f0fca3ca168383d438
< HCI Command: Host Number of Com.. (0x03|0x0035) plen 5  #113 [hci1] 10.210688
        Num handles: 1
        Handle: 1551 Address: DF:A9:FF:F6:B1:1A (OUI DF-A9-FF)
        Count: 1
< ACL Data TX: Handle 1551 flags 0x00 dlen 21             #114 [hci1] 10.210785
      SMP: Pairing Confirm (0x03) len 16
        Confim value: 718e112fc61a6bb2ee843d01d08f08b7
> HCI Event: Number of Completed Packets (0x13) plen 5    #115 [hci1] 10.375505
        Num handles: 1
        Handle: 1551 Address: DF:A9:FF:F6:B1:1A (OUI DF-A9-FF)
        Count: 1
        #114: len 21 (1 Kb/s)
        Latency: 164 msec (71-172 msec ~164 msec)
> ACL Data RX: Handle 1551 flags 0x02 dlen 21             #116 [hci1] 10.375871
      SMP: Pairing Random (0x04) len 16
        Random value: b720d5386ad902d30000000000000000
< HCI Command: Host Number of Com.. (0x03|0x0035) plen 5  #117 [hci1] 10.391251
        Num handles: 1
        Handle: 1551 Address: DF:A9:FF:F6:B1:1A (OUI DF-A9-FF)
        Count: 1
< ACL Data TX: Handle 1551 flags 0x00 dlen 21             #118 [hci1] 10.391476
      SMP: Pairing Random (0x04) len 16
        Random value: dddbdfe2838e9a8cc6964353c850fef7
> HCI Event: Number of Completed Packets (0x13) plen 5    #119 [hci1] 10.550372
        Num handles: 1
        Handle: 1551 Address: DF:A9:FF:F6:B1:1A (OUI DF-A9-FF)
        Count: 1
        #118: len 21 (1 Kb/s)
        Latency: 158 msec (71-172 msec ~161 msec)
> ACL Data RX: Handle 1551 flags 0x02 dlen 21             #120 [hci1] 10.638200
      SMP: Pairing Confirm (0x03) len 16
        Confim value: e458bd43d19f7e3506faeda3d3babfb2
< HCI Command: Host Number of Com.. (0x03|0x0035) plen 5  #121 [hci1] 10.650956
        Num handles: 1
        Handle: 1551 Address: DF:A9:FF:F6:B1:1A (OUI DF-A9-FF)
        Count: 1
< ACL Data TX: Handle 1551 flags 0x00 dlen 21             #122 [hci1] 10.651061
      SMP: Pairing Confirm (0x03) len 16
        Confim value: 21753adcfddc4949459aee247229f9d2
> HCI Event: Number of Completed Packets (0x13) plen 5    #123 [hci1] 10.813056
        Num handles: 1
        Handle: 1551 Address: DF:A9:FF:F6:B1:1A (OUI DF-A9-FF)
        Count: 1
        #122: len 21 (1 Kb/s)
        Latency: 161 msec (71-172 msec ~161 msec)
> ACL Data RX: Handle 1551 flags 0x02 dlen 21             #124 [hci1] 10.813452
      SMP: Pairing Random (0x04) len 16
        Random value: ea3372500300376e0000000000000000
< HCI Command: Host Number of Com.. (0x03|0x0035) plen 5  #125 [hci1] 10.831250
        Num handles: 1
        Handle: 1551 Address: DF:A9:FF:F6:B1:1A (OUI DF-A9-FF)
        Count: 1
< ACL Data TX: Handle 1551 flags 0x00 dlen 21             #126 [hci1] 10.831451
      SMP: Pairing Random (0x04) len 16
        Random value: eb9f1915536596b6fc3db1c86b2b1970
> HCI Event: Number of Completed Packets (0x13) plen 5    #127 [hci1] 10.987849
        Num handles: 1
        Handle: 1551 Address: DF:A9:FF:F6:B1:1A (OUI DF-A9-FF)
        Count: 1
        #126: len 21 (1 Kb/s)
        Latency: 156 msec (71-172 msec ~159 msec)
> ACL Data RX: Handle 1551 flags 0x02 dlen 21             #128 [hci1] 11.075737
      SMP: Pairing Confirm (0x03) len 16
        Confim value: 7c4f645e4fdfe9ed0dc6cd20916d7ad8
< HCI Command: Host Number of Com.. (0x03|0x0035) plen 5  #129 [hci1] 11.090900
        Num handles: 1
        Handle: 1551 Address: DF:A9:FF:F6:B1:1A (OUI DF-A9-FF)
        Count: 1
< ACL Data TX: Handle 1551 flags 0x00 dlen 21             #130 [hci1] 11.091063
      SMP: Pairing Confirm (0x03) len 16
        Confim value: de778b8900efedc508d007edca8c9982
> HCI Event: Number of Completed Packets (0x13) plen 5    #131 [hci1] 11.250529
        Num handles: 1
        Handle: 1551 Address: DF:A9:FF:F6:B1:1A (OUI DF-A9-FF)
        Count: 1
        #130: len 21 (1 Kb/s)
        Latency: 159 msec (71-172 msec ~159 msec)
> ACL Data RX: Handle 1551 flags 0x02 dlen 21             #132 [hci1] 11.250951
      SMP: Pairing Random (0x04) len 16
        Random value: 3394a5ed477a97cb0000000000000000
< HCI Command: Host Number of Com.. (0x03|0x0035) plen 5  #133 [hci1] 11.271338
        Num handles: 1
        Handle: 1551 Address: DF:A9:FF:F6:B1:1A (OUI DF-A9-FF)
        Count: 1
< ACL Data TX: Handle 1551 flags 0x00 dlen 21             #134 [hci1] 11.271500
      SMP: Pairing Random (0x04) len 16
        Random value: 5c794dc9ad9f2c3f295ebd5ad5e1c3cf
> HCI Event: Number of Completed Packets (0x13) plen 5    #135 [hci1] 11.425323
        Num handles: 1
        Handle: 1551 Address: DF:A9:FF:F6:B1:1A (OUI DF-A9-FF)
        Count: 1
        #134: len 21 (1 Kb/s)
        Latency: 153 msec (71-172 msec ~156 msec)
> ACL Data RX: Handle 1551 flags 0x02 dlen 21             #136 [hci1] 11.513224
      SMP: Pairing Confirm (0x03) len 16
        Confim value: 8df7f8e039d197a929ea1fa2a993dc03
< HCI Command: Host Number of Com.. (0x03|0x0035) plen 5  #137 [hci1] 11.530709
        Num handles: 1
        Handle: 1551 Address: DF:A9:FF:F6:B1:1A (OUI DF-A9-FF)
        Count: 1
< ACL Data TX: Handle 1551 flags 0x00 dlen 21             #138 [hci1] 11.530800
      SMP: Pairing Confirm (0x03) len 16
        Confim value: eac942bf9d5cf0ad59b1b590c9b27e21
> HCI Event: Number of Completed Packets (0x13) plen 5    #139 [hci1] 11.688007
        Num handles: 1
        Handle: 1551 Address: DF:A9:FF:F6:B1:1A (OUI DF-A9-FF)
        Count: 1
        #138: len 21 (1 Kb/s)
        Latency: 157 msec (71-172 msec ~156 msec)
> ACL Data RX: Handle 1551 flags 0x02 dlen 21             #140 [hci1] 11.688366
      SMP: Pairing Random (0x04) len 16
        Random value: 67016d04d867a7550000000000000000
< HCI Command: Host Number of Com.. (0x03|0x0035) plen 5  #141 [hci1] 11.691132
        Num handles: 1
        Handle: 1551 Address: DF:A9:FF:F6:B1:1A (OUI DF-A9-FF)
        Count: 1
< ACL Data TX: Handle 1551 flags 0x00 dlen 21             #142 [hci1] 11.691282
      SMP: Pairing Random (0x04) len 16
        Random value: 5c2fff312cdf99c9491988e877355a9a
> HCI Event: Number of Completed Packets (0x13) plen 5    #143 [hci1] 11.862807
        Num handles: 1
        Handle: 1551 Address: DF:A9:FF:F6:B1:1A (OUI DF-A9-FF)
        Count: 1
        #142: len 21 (0 Kb/s)
        Latency: 171 msec (71-172 msec ~164 msec)
> ACL Data RX: Handle 1551 flags 0x02 dlen 21             #144 [hci1] 11.950640
      SMP: Pairing Confirm (0x03) len 16
        Confim value: abf6dce8e0ad3480d7771f82bb0ff4ee
< HCI Command: Host Number of Com.. (0x03|0x0035) plen 5  #145 [hci1] 11.970425
        Num handles: 1
        Handle: 1551 Address: DF:A9:FF:F6:B1:1A (OUI DF-A9-FF)
        Count: 1
< ACL Data TX: Handle 1551 flags 0x00 dlen 21             #146 [hci1] 11.970464
      SMP: Pairing Confirm (0x03) len 16
        Confim value: dbbbeceb7ab602a52f2918c9c5a6b81f
> HCI Event: Number of Completed Packets (0x13) plen 5    #147 [hci1] 12.125611
        Num handles: 1
        Handle: 1551 Address: DF:A9:FF:F6:B1:1A (OUI DF-A9-FF)
        Count: 1
        #146: len 21 (1 Kb/s)
        Latency: 155 msec (71-172 msec ~159 msec)
> ACL Data RX: Handle 1551 flags 0x02 dlen 21             #148 [hci1] 12.125834
      SMP: Pairing Random (0x04) len 16
        Random value: 62f5982878ee77c00000000000000000
< HCI Command: Host Number of Com.. (0x03|0x0035) plen 5  #149 [hci1] 12.131252
        Num handles: 1
        Handle: 1551 Address: DF:A9:FF:F6:B1:1A (OUI DF-A9-FF)
        Count: 1
< ACL Data TX: Handle 1551 flags 0x00 dlen 21             #150 [hci1] 12.131421
      SMP: Pairing Random (0x04) len 16
        Random value: c629a3a987d808e808655d558dfc1155
> HCI Event: Number of Completed Packets (0x13) plen 5    #151 [hci1] 12.300257
        Num handles: 1
        Handle: 1551 Address: DF:A9:FF:F6:B1:1A (OUI DF-A9-FF)
        Count: 1
        #150: len 21 (1 Kb/s)
        Latency: 168 msec (71-172 msec ~164 msec)
> ACL Data RX: Handle 1551 flags 0x02 dlen 21             #152 [hci1] 12.388137
      SMP: Pairing Confirm (0x03) len 16
        Confim value: d55d4a38e7cdeabcd9491a904ec0691e
< HCI Command: Host Number of Com.. (0x03|0x0035) plen 5  #153 [hci1] 12.390622
        Num handles: 1
        Handle: 1551 Address: DF:A9:FF:F6:B1:1A (OUI DF-A9-FF)
        Count: 1
< ACL Data TX: Handle 1551 flags 0x00 dlen 21             #154 [hci1] 12.390724
      SMP: Pairing Confirm (0x03) len 16
        Confim value: 63e36ee2ff69657fc499d639cd2b2c7e
> HCI Event: Number of Completed Packets (0x13) plen 5    #155 [hci1] 12.563062
        Num handles: 1
        Handle: 1551 Address: DF:A9:FF:F6:B1:1A (OUI DF-A9-FF)
        Count: 1
        #154: len 21 (0 Kb/s)
        Latency: 172 msec (71-172 msec ~168 msec)
> ACL Data RX: Handle 1551 flags 0x02 dlen 21             #156 [hci1] 12.563387
      SMP: Pairing Random (0x04) len 16
        Random value: 3b6d1390e29fc0740000000000000000
< HCI Command: Host Number of Com.. (0x03|0x0035) plen 5  #157 [hci1] 12.571219
        Num handles: 1
        Handle: 1551 Address: DF:A9:FF:F6:B1:1A (OUI DF-A9-FF)
        Count: 1
< ACL Data TX: Handle 1551 flags 0x00 dlen 21             #158 [hci1] 12.571327
      SMP: Pairing Random (0x04) len 16
        Random value: 92f20f6ad8f13724432c7fd6001c45ff
> HCI Event: Number of Completed Packets (0x13) plen 5    #159 [hci1] 12.737764
        Num handles: 1
        Handle: 1551 Address: DF:A9:FF:F6:B1:1A (OUI DF-A9-FF)
        Count: 1
        #158: len 21 (1 Kb/s)
        Latency: 166 msec (71-172 msec ~167 msec)
> ACL Data RX: Handle 1551 flags 0x02 dlen 21             #160 [hci1] 12.825731
      SMP: Pairing Confirm (0x03) len 16
        Confim value: d68aa9ddbc3fe1e69f2197ae13a9784c
< HCI Command: Host Number of Com.. (0x03|0x0035) plen 5  #161 [hci1] 12.830562
        Num handles: 1
        Handle: 1551 Address: DF:A9:FF:F6:B1:1A (OUI DF-A9-FF)
        Count: 1
< ACL Data TX: Handle 1551 flags 0x00 dlen 21             #162 [hci1] 12.830650
      SMP: Pairing Confirm (0x03) len 16
        Confim value: c36ebdbadb37b801008c468121548159
> HCI Event: Number of Completed Packets (0x13) plen 5    #163 [hci1] 13.000619
        Num handles: 1
        Handle: 1551 Address: DF:A9:FF:F6:B1:1A (OUI DF-A9-FF)
        Count: 1
        #162: len 21 (0 Kb/s)
        Latency: 169 msec (71-172 msec ~168 msec)
> ACL Data RX: Handle 1551 flags 0x02 dlen 21             #164 [hci1] 13.000912
      SMP: Pairing Random (0x04) len 16
        Random value: aa7fd561ed71c1b30000000000000000
< HCI Command: Host Number of Com.. (0x03|0x0035) plen 5  #165 [hci1] 13.011228
        Num handles: 1
        Handle: 1551 Address: DF:A9:FF:F6:B1:1A (OUI DF-A9-FF)
        Count: 1
< ACL Data TX: Handle 1551 flags 0x00 dlen 21             #166 [hci1] 13.011378
      SMP: Pairing Random (0x04) len 16
        Random value: 23ac32ebbb5e14c8a6b9622f296d277f
> HCI Event: Number of Completed Packets (0x13) plen 5    #167 [hci1] 13.175272
        Num handles: 1
        Handle: 1551 Address: DF:A9:FF:F6:B1:1A (OUI DF-A9-FF)
        Count: 1
        #166: len 21 (1 Kb/s)
        Latency: 163 msec (71-172 msec ~166 msec)
> ACL Data RX: Handle 1551 flags 0x02 dlen 21             #168 [hci1] 13.263106
      SMP: Pairing Confirm (0x03) len 16
        Confim value: dc32e80ff54135d3d2e50736b3e71797
< HCI Command: Host Number of Com.. (0x03|0x0035) plen 5  #169 [hci1] 13.270956
        Num handles: 1
        Handle: 1551 Address: DF:A9:FF:F6:B1:1A (OUI DF-A9-FF)
        Count: 1
< ACL Data TX: Handle 1551 flags 0x00 dlen 21             #170 [hci1] 13.271094
      SMP: Pairing Confirm (0x03) len 16
        Confim value: fa983522e19ce504c066cf41ec0bac09
> HCI Event: Number of Completed Packets (0x13) plen 5    #171 [hci1] 13.438048
        Num handles: 1
        Handle: 1551 Address: DF:A9:FF:F6:B1:1A (OUI DF-A9-FF)
        Count: 1
        #170: len 21 (1 Kb/s)
        Latency: 166 msec (71-172 msec ~166 msec)
> ACL Data RX: Handle 1551 flags 0x02 dlen 21             #172 [hci1] 13.438376
      SMP: Pairing Random (0x04) len 16
        Random value: 71ab2e72face16f90000000000000000
< HCI Command: Host Number of Com.. (0x03|0x0035) plen 5  #173 [hci1] 13.451216
        Num handles: 1
        Handle: 1551 Address: DF:A9:FF:F6:B1:1A (OUI DF-A9-FF)
        Count: 1
< ACL Data TX: Handle 1551 flags 0x00 dlen 21             #174 [hci1] 13.451323
      SMP: Pairing Random (0x04) len 16
        Random value: 297efe85e67448a15f56bd27e3a3cf1d
> HCI Event: Number of Completed Packets (0x13) plen 5    #175 [hci1] 13.612823
        Num handles: 1
        Handle: 1551 Address: DF:A9:FF:F6:B1:1A (OUI DF-A9-FF)
        Count: 1
        #174: len 21 (1 Kb/s)
        Latency: 161 msec (71-172 msec ~164 msec)
> ACL Data RX: Handle 1551 flags 0x02 dlen 21             #176 [hci1] 13.700655
      SMP: Pairing Confirm (0x03) len 16
        Confim value: e91dba01bd5a4a963bd971156d040812
< HCI Command: Host Number of Com.. (0x03|0x0035) plen 5  #177 [hci1] 13.710531
        Num handles: 1
        Handle: 1551 Address: DF:A9:FF:F6:B1:1A (OUI DF-A9-FF)
        Count: 1
< ACL Data TX: Handle 1551 flags 0x00 dlen 21             #178 [hci1] 13.710567
      SMP: Pairing Confirm (0x03) len 16
        Confim value: e8f3a2be5424ff622a850f3072426f36
> HCI Event: Number of Completed Packets (0x13) plen 5    #179 [hci1] 13.875539
        Num handles: 1
        Handle: 1551 Address: DF:A9:FF:F6:B1:1A (OUI DF-A9-FF)
        Count: 1
        #178: len 21 (1 Kb/s)
        Latency: 164 msec (71-172 msec ~164 msec)
> ACL Data RX: Handle 1551 flags 0x02 dlen 21             #180 [hci1] 13.875778
      SMP: Pairing Random (0x04) len 16
        Random value: 2e6fc63a227aed1d0000000000000000
< HCI Command: Host Number of Com.. (0x03|0x0035) plen 5  #181 [hci1] 13.891091
        Num handles: 1
        Handle: 1551 Address: DF:A9:FF:F6:B1:1A (OUI DF-A9-FF)
        Count: 1
< ACL Data TX: Handle 1551 flags 0x00 dlen 21             #182 [hci1] 13.891276
      SMP: Pairing Random (0x04) len 16
        Random value: 25a9493fd3ce4faf02be7293595bb7c6
> HCI Event: Number of Completed Packets (0x13) plen 5    #183 [hci1] 14.050244
        Num handles: 1
        Handle: 1551 Address: DF:A9:FF:F6:B1:1A (OUI DF-A9-FF)
        Count: 1
        #182: len 21 (1 Kb/s)
        Latency: 158 msec (71-172 msec ~161 msec)
> ACL Data RX: Handle 1551 flags 0x02 dlen 21             #184 [hci1] 14.138098
      SMP: Pairing Confirm (0x03) len 16
        Confim value: 71824fa174235c09240c3e55e7a7b5bb
< HCI Command: Host Number of Com.. (0x03|0x0035) plen 5  #185 [hci1] 14.150969
        Num handles: 1
        Handle: 1551 Address: DF:A9:FF:F6:B1:1A (OUI DF-A9-FF)
        Count: 1
< ACL Data TX: Handle 1551 flags 0x00 dlen 21             #186 [hci1] 14.151143
      SMP: Pairing Confirm (0x03) len 16
        Confim value: 8bc8cbdc5b6e41010cbcd0f911c82504
> HCI Event: Number of Completed Packets (0x13) plen 5    #187 [hci1] 14.312995
        Num handles: 1
        Handle: 1551 Address: DF:A9:FF:F6:B1:1A (OUI DF-A9-FF)
        Count: 1
        #186: len 21 (1 Kb/s)
        Latency: 161 msec (71-172 msec ~161 msec)
> ACL Data RX: Handle 1551 flags 0x02 dlen 21             #188 [hci1] 14.313284
      SMP: Pairing Random (0x04) len 16
        Random value: 91653cf6f7034a1d0000000000000000
< HCI Command: Host Number of Com.. (0x03|0x0035) plen 5  #189 [hci1] 14.331231
        Num handles: 1
        Handle: 1551 Address: DF:A9:FF:F6:B1:1A (OUI DF-A9-FF)
        Count: 1
< ACL Data TX: Handle 1551 flags 0x00 dlen 21             #190 [hci1] 14.331318
      SMP: Pairing Random (0x04) len 16
        Random value: 58f6b41f855a6f6c3560debd84e2affc
> HCI Event: Number of Completed Packets (0x13) plen 5    #191 [hci1] 14.487735
        Num handles: 1
        Handle: 1551 Address: DF:A9:FF:F6:B1:1A (OUI DF-A9-FF)
        Count: 1
        #190: len 21 (1 Kb/s)
        Latency: 156 msec (71-172 msec ~159 msec)
> ACL Data RX: Handle 1551 flags 0x02 dlen 21             #192 [hci1] 14.575725
      SMP: Pairing Confirm (0x03) len 16
        Confim value: fbe64aec11b0d7fe40e90812d9fbdb0b
< HCI Command: Host Number of Com.. (0x03|0x0035) plen 5  #193 [hci1] 14.590991
        Num handles: 1
        Handle: 1551 Address: DF:A9:FF:F6:B1:1A (OUI DF-A9-FF)
        Count: 1
< ACL Data TX: Handle 1551 flags 0x00 dlen 21             #194 [hci1] 14.591085
      SMP: Pairing Confirm (0x03) len 16
        Confim value: bcbd8311171003bdd43ac09af9925afb
> HCI Event: Number of Completed Packets (0x13) plen 5    #195 [hci1] 14.750568
        Num handles: 1
        Handle: 1551 Address: DF:A9:FF:F6:B1:1A (OUI DF-A9-FF)
        Count: 1
        #194: len 21 (1 Kb/s)
        Latency: 159 msec (71-172 msec ~159 msec)
> ACL Data RX: Handle 1551 flags 0x02 dlen 21             #196 [hci1] 14.750815
      SMP: Pairing Random (0x04) len 16
        Random value: da5542d14c8426cc0000000000000000
< HCI Command: Host Number of Com.. (0x03|0x0035) plen 5  #197 [hci1] 14.771161
        Num handles: 1
        Handle: 1551 Address: DF:A9:FF:F6:B1:1A (OUI DF-A9-FF)
        Count: 1
< ACL Data TX: Handle 1551 flags 0x00 dlen 21             #198 [hci1] 14.771334
      SMP: Pairing Random (0x04) len 16
        Random value: b67e7216d5bf664139eda2b542549666
> HCI Event: Number of Completed Packets (0x13) plen 5    #199 [hci1] 14.925299
        Num handles: 1
        Handle: 1551 Address: DF:A9:FF:F6:B1:1A (OUI DF-A9-FF)
        Count: 1
        #198: len 21 (1 Kb/s)
        Latency: 153 msec (71-172 msec ~156 msec)
> ACL Data RX: Handle 1551 flags 0x02 dlen 21             #200 [hci1] 15.013065
      SMP: Pairing Confirm (0x03) len 16
        Confim value: 3320288032b86aee5b4299395b78c2e9
< HCI Command: Host Number of Com.. (0x03|0x0035) plen 5  #201 [hci1] 15.030464
        Num handles: 1
        Handle: 1551 Address: DF:A9:FF:F6:B1:1A (OUI DF-A9-FF)
        Count: 1
< ACL Data TX: Handle 1551 flags 0x00 dlen 21             #202 [hci1] 15.030529
      SMP: Pairing Confirm (0x03) len 16
        Confim value: 13181abf0f32ef24859738c6b74b39d6
> HCI Event: Number of Completed Packets (0x13) plen 5    #203 [hci1] 15.187954
        Num handles: 1
        Handle: 1551 Address: DF:A9:FF:F6:B1:1A (OUI DF-A9-FF)
        Count: 1
        #202: len 21 (1 Kb/s)
        Latency: 157 msec (71-172 msec ~157 msec)
> ACL Data RX: Handle 1551 flags 0x02 dlen 21             #204 [hci1] 15.188288
      SMP: Pairing Random (0x04) len 16
        Random value: f764b5166f3324b10000000000000000
< HCI Command: Host Number of Com.. (0x03|0x0035) plen 5  #205 [hci1] 15.191282
        Num handles: 1
        Handle: 1551 Address: DF:A9:FF:F6:B1:1A (OUI DF-A9-FF)
        Count: 1
< ACL Data TX: Handle 1551 flags 0x00 dlen 21             #206 [hci1] 15.191394
      SMP: Pairing Random (0x04) len 16
        Random value: ed17f76500c95219dd01e09d1e63f87b
> HCI Event: Number of Completed Packets (0x13) plen 5    #207 [hci1] 15.362760
        Num handles: 1
        Handle: 1551 Address: DF:A9:FF:F6:B1:1A (OUI DF-A9-FF)
        Count: 1
        #206: len 21 (0 Kb/s)
        Latency: 171 msec (71-172 msec ~164 msec)
> ACL Data RX: Handle 1551 flags 0x02 dlen 21             #208 [hci1] 15.450556
      SMP: Pairing Confirm (0x03) len 16
        Confim value: 9003d54c1ecc05e1ee0c06265532f3a7
< HCI Command: Host Number of Com.. (0x03|0x0035) plen 5  #209 [hci1] 15.470950
        Num handles: 1
        Handle: 1551 Address: DF:A9:FF:F6:B1:1A (OUI DF-A9-FF)
        Count: 1
< ACL Data TX: Handle 1551 flags 0x00 dlen 21             #210 [hci1] 15.471075
      SMP: Pairing Confirm (0x03) len 16
        Confim value: 9fef3c24f7976afc8e38ae685f33c4d2
> HCI Event: Number of Completed Packets (0x13) plen 5    #211 [hci1] 15.625586
        Num handles: 1
        Handle: 1551 Address: DF:A9:FF:F6:B1:1A (OUI DF-A9-FF)
        Count: 1
        #210: len 21 (1 Kb/s)
        Latency: 154 msec (71-172 msec ~159 msec)
> ACL Data RX: Handle 1551 flags 0x02 dlen 21             #212 [hci1] 15.625753
      SMP: Pairing Random (0x04) len 16
        Random value: 484ad56ce6e8fd510000000000000000
< HCI Command: Host Number of Com.. (0x03|0x0035) plen 5  #213 [hci1] 15.631266
        Num handles: 1
        Handle: 1551 Address: DF:A9:FF:F6:B1:1A (OUI DF-A9-FF)
        Count: 1
< ACL Data TX: Handle 1551 flags 0x00 dlen 21             #214 [hci1] 15.631442
      SMP: Pairing Random (0x04) len 16
        Random value: 81d35d47e1f6006d79c974bd9d9e1ee3
> HCI Event: Number of Completed Packets (0x13) plen 5    #215 [hci1] 15.800284
        Num handles: 1
        Handle: 1551 Address: DF:A9:FF:F6:B1:1A (OUI DF-A9-FF)
        Count: 1
        #214: len 21 (1 Kb/s)
        Latency: 168 msec (71-172 msec ~164 msec)
> ACL Data RX: Handle 1551 flags 0x02 dlen 21             #216 [hci1] 15.888123
      SMP: Pairing Confirm (0x03) len 16
        Confim value: 97a5e0bbc49fdd2f1eedf981842e5fda
< HCI Command: Host Number of Com.. (0x03|0x0035) plen 5  #217 [hci1] 15.890877
        Num handles: 1
        Handle: 1551 Address: DF:A9:FF:F6:B1:1A (OUI DF-A9-FF)
        Count: 1
< ACL Data TX: Handle 1551 flags 0x00 dlen 21             #218 [hci1] 15.890979
      SMP: Pairing Confirm (0x03) len 16
        Confim value: 9c46dc325bec1b251eb9b462cdc48be4
> HCI Event: Number of Completed Packets (0x13) plen 5    #219 [hci1] 16.062968
        Num handles: 1
        Handle: 1551 Address: DF:A9:FF:F6:B1:1A (OUI DF-A9-FF)
        Count: 1
        #218: len 21 (0 Kb/s)
        Latency: 171 msec (71-172 msec ~168 msec)
> ACL Data RX: Handle 1551 flags 0x02 dlen 21             #220 [hci1] 16.063232
      SMP: Pairing Random (0x04) len 16
        Random value: df2c38d5b885e5350000000000000000
< HCI Command: Host Number of Com.. (0x03|0x0035) plen 5  #221 [hci1] 16.070718
        Num handles: 1
        Handle: 1551 Address: DF:A9:FF:F6:B1:1A (OUI DF-A9-FF)
        Count: 1
< ACL Data TX: Handle 1551 flags 0x00 dlen 21             #222 [hci1] 16.070808
      SMP: Pairing Random (0x04) len 16
        Random value: e7f7e0c2476823e41736a7e381bafb7c
> HCI Event: Number of Completed Packets (0x13) plen 5    #223 [hci1] 16.237738
        Num handles: 1
        Handle: 1551 Address: DF:A9:FF:F6:B1:1A (OUI DF-A9-FF)
        Count: 1
        #222: len 21 (1 Kb/s)
        Latency: 166 msec (71-172 msec ~167 msec)
> ACL Data RX: Handle 1551 flags 0x02 dlen 21             #224 [hci1] 16.325573
      SMP: Pairing Confirm (0x03) len 16
        Confim value: 9ca1214fc7b99d6f074a0a1554decbd6
< HCI Command: Host Number of Com.. (0x03|0x0035) plen 5  #225 [hci1] 16.330654
        Num handles: 1
        Handle: 1551 Address: DF:A9:FF:F6:B1:1A (OUI DF-A9-FF)
        Count: 1
< ACL Data TX: Handle 1551 flags 0x00 dlen 21             #226 [hci1] 16.330701
      SMP: Pairing Confirm (0x03) len 16
        Confim value: 2b0c3b9cb9550f0d3db683d46b9d7cc3
> HCI Event: Number of Completed Packets (0x13) plen 5    #227 [hci1] 16.500544
        Num handles: 1
        Handle: 1551 Address: DF:A9:FF:F6:B1:1A (OUI DF-A9-FF)
        Count: 1
        #226: len 21 (0 Kb/s)
        Latency: 169 msec (71-172 msec ~168 msec)
> ACL Data RX: Handle 1551 flags 0x02 dlen 21             #228 [hci1] 16.500863
      SMP: Pairing Random (0x04) len 16
        Random value: 408f05c97e6d1c340000000000000000
