Bluetooth monitor ver 5.72
= Note: Linux version 6.14.0-36-generic (x86_64)                       0.975895
= Note: Bluetooth subsystem version 2.22                               0.975897
= New Index: 00:00:00:00:00:00 (Primary,UART,hci1)              [hci1] 0.975898
= New Index: 48:5F:99:8E:E0:64 (Primary,USB,hci0)               [hci0] 0.975899
= Open Index: 00:00:00:00:00:00                                 [hci1] 1.089724
= Index Info: 00:00:00:00:00:00 (Nordic Semiconductor ASA)      [hci1] 1.089744
@ USER Open: main (privileged) version 2.22            {0x0001} [hci1] 1.089754
< HCI Command: Reset (0x03|0x0003) plen 0                    #1 [hci1] 1.091063
> HCI Event: Command Complete (0x0e) plen 4                  #2 [hci1] 1.091621
      Reset (0x03|0x0003) ncmd 1
        Status: Success (0x00)
< HCI Command: Read Local Supported... (0x04|0x0003) plen 0  #3 [hci1] 1.109535
> HCI Event: Command Complete (0x0e) plen 12                 #4 [hci1] 1.110110
      Read Local Supported Features (0x04|0x0003) ncmd 1
        Status: Success (0x00)
        Features: 0x00 0x00 0x00 0x00 0x60 0x00 0x00 0x00
          BR/EDR Not Supported
          LE Supported (Controller)
< HCI Command: Read Local Version In.. (0x04|0x0001) plen 0  #5 [hci1] 1.129142
> HCI Event: Command Complete (0x0e) plen 12                 #6 [hci1] 1.129650
      Read Local Version Information (0x04|0x0001) ncmd 1
        Status: Success (0x00)
        HCI version: Reserved (0x0f) - Revision 12393 (0x3069)
        LMP version: Reserved (0x0f) - Subversion 12393 (0x3069)
        Manufacturer: Nordic Semiconductor ASA (89)
< HCI Command: Read Local Supported... (0x04|0x0002) plen 0  #7 [hci1] 1.149090
> HCI Event: Command Complete (0x0e) plen 68                 #8 [hci1] 1.150183
      Read Local Supported Commands (0x04|0x0002) ncmd 1
        Status: Success (0x00)
        Commands: 119 entries
          Disconnect (Octet 0 - Bit 5)
          Read Remote Version Information (Octet 2 - Bit 7)
          Set Event Mask (Octet 5 - Bit 6)
          Reset (Octet 5 - Bit 7)
          Read Connection Accept Timeout (Octet 7 - Bit 2)
          Write Connection Accept Timeout (Octet 7 - Bit 3)
          Read Transmit Power Level (Octet 10 - Bit 2)
          Set Controller To Host Flow Control (Octet 10 - Bit 5)
          Host Buffer Size (Octet 10 - Bit 6)
          Host Number of Completed Packets (Octet 10 - Bit 7)
          Read Local Version Information (Octet 14 - Bit 3)
          Read Local Supported Features (Octet 14 - Bit 5)
          Read BD ADDR (Octet 15 - Bit 1)
          Read RSSI (Octet 15 - Bit 5)
          Set Event Mask Page 2 (Octet 22 - Bit 2)
          LE Set Event Mask (Octet 25 - Bit 0)
          LE Read Buffer Size (Octet 25 - Bit 1)
          LE Read Local Supported Features (Octet 25 - Bit 2)
          LE Set Random Address (Octet 25 - Bit 4)
          LE Set Advertising Parameters (Octet 25 - Bit 5)
          LE Read Advertising Channel TX Power (Octet 25 - Bit 6)
          LE Set Advertising Data (Octet 25 - Bit 7)
          LE Set Scan Response Data (Octet 26 - Bit 0)
          LE Set Advertise Enable (Octet 26 - Bit 1)
          LE Set Scan Parameters (Octet 26 - Bit 2)
          LE Set Scan Enable (Octet 26 - Bit 3)
          LE Create Connection (Octet 26 - Bit 4)
          LE Create Connection Cancel (Octet 26 - Bit 5)
          LE Read Accept List Size (Octet 26 - Bit 6)
          LE Clear Accept List (Octet 26 - Bit 7)
          LE Add Device To Accept List (Octet 27 - Bit 0)
          LE Remove Device From Accept List (Octet 27 - Bit 1)
          LE Connection Update (Octet 27 - Bit 2)
          LE Set Host Channel Classification (Octet 27 - Bit 3)
          LE Read Channel Map (Octet 27 - Bit 4)
          LE Read Remote Used Features (Octet 27 - Bit 5)
          LE Encrypt (Octet 27 - Bit 6)
          LE Rand (Octet 27 - Bit 7)
          LE Start Encryption (Octet 28 - Bit 0)
          LE Long Term Key Request Reply (Octet 28 - Bit 1)
          LE Long Term Key Request Neg Reply (Octet 28 - Bit 2)
          LE Read Supported States (Octet 28 - Bit 3)
          LE Receiver Test (Octet 28 - Bit 4)
          LE Transmitter Test (Octet 28 - Bit 5)
          LE Test End (Octet 28 - Bit 6)
          Read Authenticated Payload Timeout (Octet 32 - Bit 4)
          Write Authenticated Payload Timeout (Octet 32 - Bit 5)
          LE Set Data Length (Octet 33 - Bit 6)
          LE Read Suggested Default Data Length (Octet 33 - Bit 7)
          LE Write Suggested Default Data Length (Octet 34 - Bit 0)
          LE Add Device To Resolving List (Octet 34 - Bit 3)
          LE Remove Device From Resolving List (Octet 34 - Bit 4)
          LE Clear Resolving List (Octet 34 - Bit 5)
          LE Read Resolving List Size (Octet 34 - Bit 6)
          LE Set Address Resolution Enable (Octet 35 - Bit 1)
          LE Set Resolvable Private Address Timeout (Octet 35 - Bit 2)
          LE Read Maximum Data Length (Octet 35 - Bit 3)
          LE Read PHY (Octet 35 - Bit 4)
          LE Set Default PHY (Octet 35 - Bit 5)
          LE Set PHY (Octet 35 - Bit 6)
          LE Enhanced Receiver Test (Octet 35 - Bit 7)
          LE Enhanced Transmitter Test (Octet 36 - Bit 0)
          LE Set Advertising Set Random Address (Octet 36 - Bit 1)
          LE Set Extended Advertising Parameters (Octet 36 - Bit 2)
          LE Set Extended Advertising Data (Octet 36 - Bit 3)
          LE Set Extended Scan Response Data (Octet 36 - Bit 4)
          LE Set Extended Advertising Enable (Octet 36 - Bit 5)
          LE Read Maximum Advertising Data Length (Octet 36 - Bit 6)
          LE Read Number of Supported Advertising Sets (Octet 36 - Bit 7)
          LE Remove Advertising Set (Octet 37 - Bit 0)
          LE Clear Advertising Sets (Octet 37 - Bit 1)
          LE Set Periodic Advertising Parameters (Octet 37 - Bit 2)
          LE Set Periodic Advertising Data (Octet 37 - Bit 3)
          LE Set Periodic Advertising Enable (Octet 37 - Bit 4)
          LE Set Extended Scan Parameters (Octet 37 - Bit 5)
          LE Set Extended Scan Enable (Octet 37 - Bit 6)
          LE Extended Create Connection (Octet 37 - Bit 7)
          LE Periodic Advertising Create Sync (Octet 38 - Bit 0)
          LE Periodic Advertising Create Sync Cancel (Octet 38 - Bit 1)
          LE Periodic Advertising Terminate Sync (Octet 38 - Bit 2)
          LE Add Device To Periodic Advertiser List (Octet 38 - Bit 3)
          LE Remove Device From Periodic Advertiser List (Octet 38 - Bit 4)
          LE Clear Periodic Advertiser List (Octet 38 - Bit 5)
          LE Read Periodic Advertiser List Size (Octet 38 - Bit 6)
          LE Read Transmit Power (Octet 38 - Bit 7)
          LE Read RF Path Compensation (Octet 39 - Bit 0)
          LE Write RF Path Compensation (Octet 39 - Bit 1)
          LE Set Privacy Mode (Octet 39 - Bit 2)
          LE Periodic Advertising Receive Enable (Octet 40 - Bit 5)
          LE Periodic Advertising Sync Transfer (Octet 40 - Bit 6)
          LE Periodic Advertising Set Info Transfer (Octet 40 - Bit 7)
          LE Periodic Advertising Sync Transfer Parameters (Octet 41 - Bit 0)
          LE Set Default Periodic Advertisng Sync Transfer Parameters (Octet 41 - Bit 1)
          LE Read Buffer v2 (Octet 41 - Bit 5)
          LE Read ISO TX Sync (Octet 41 - Bit 6)
          LE Set Connected Isochronous Group Parameters (Octet 41 - Bit 7)
          LE Set Connected Isochronous Group Parameters Test (Octet 42 - Bit 0)
          LE Create Connected Isochronous Stream (Octet 42 - Bit 1)
          LE Remove Connected Isochronous Group (Octet 42 - Bit 2)
          LE Accept Connected Isochronous Stream Request (Octet 42 - Bit 3)
          LE Reject Connected Isochronous Stream Request (Octet 42 - Bit 4)
          LE Create Broadcast Isochronous Group (Octet 42 - Bit 5)
          LE Create Broadcast Isochronous Group Test (Octet 42 - Bit 6)
          LE Terminate Broadcast Isochronous Group (Octet 42 - Bit 7)
          LE Broadcast Isochronous Group Create Sync (Octet 43 - Bit 0)
          LE Broadcast Isochronous Group Terminate Sync (Octet 43 - Bit 1)
          LE Request Peer SCA (Octet 43 - Bit 2)
          LE Setup Isochronous Data Path (Octet 43 - Bit 3)
          LE Remove Isochronous Data Path (Octet 43 - Bit 4)
          LE Isochronous Transmit Test (Octet 43 - Bit 5)
          LE Isochronous Receive Test (Octet 43 - Bit 6)
          LE Isochronous Read Test Counters (Octet 43 - Bit 7)
          LE Isochronous Read Test Counters (Octet 44 - Bit 0)
          LE Set Host Feature (Octet 44 - Bit 1)
          Octet 44 - Bit 2 
          Octet 45 - Bit 6 
          Octet 46 - Bit 0 
          Octet 46 - Bit 1 
          Octet 46 - Bit 2 
< HCI Command: Host Buffer Size (0x03|0x0033) plen 7         #9 [hci1] 1.169082
        ACL MTU: 255  ACL max packet: 16
        SCO MTU: 0    SCO max packet: 0
> HCI Event: Command Complete (0x0e) plen 4                 #10 [hci1] 1.169628
      Host Buffer Size (0x03|0x0033) ncmd 1
        Status: Success (0x00)
< HCI Command: Set Controller To Ho.. (0x03|0x0031) plen 1  #11 [hci1] 1.189091
        Flow control: ACL Data Packets (0x01)
> HCI Event: Command Complete (0x0e) plen 4                 #12 [hci1] 1.189538
      Set Controller To Host Flow Control (0x03|0x0031) ncmd 1
        Status: Success (0x00)
< HCI Command: LE Read Local Suppor.. (0x08|0x0003) plen 0  #13 [hci1] 1.209093
> HCI Event: Command Complete (0x0e) plen 12                #14 [hci1] 1.209623
      LE Read Local Supported Features (0x08|0x0003) ncmd 1
        Status: Success (0x00)
        Features: 0xfd 0x79 0x00 0xf7 0x30 0x01 0x00 0x00
          LE Encryption
          Extended Reject Indication
          Peripheral-initiated Features Exchange
          LE Ping
          LE Data Packet Length Extension
          LL Privacy
          Extended Scanner Filter Policies
          LE 2M PHY
          LE Coded PHY
          LE Extended Advertising
          LE Periodic Advertising
          Channel Selection Algorithm #2
          Periodic Advertising Sync Transfer - Sender
          Periodic Advertising Sync Transfer - Recipient
          Sleep Clock Accuracy Updates
          Connected Isochronous Stream - Central
          Connected Isochronous Stream - Peripheral
          Isochronous Broadcaster
          Synchronized Receiver
          Periodic Advertising ADI support
          Connection Subrating
          Unknown features (0x0000010000000000)
< HCI Command: LE Set Host Feature (0x08|0x0074) plen 2     #15 [hci1] 1.229098
        Bit Number: 32
          Connected Isochronous Stream (Host Support)
        Bit Value: 1
> HCI Event: Command Complete (0x0e) plen 4                 #16 [hci1] 1.229497
      LE Set Host Feature (0x08|0x0074) ncmd 1
        Status: Success (0x00)
< HCI Command: LE Read Buffer v2 (0x08|0x0060) plen 0       #17 [hci1] 1.249084
> HCI Event: Command Complete (0x0e) plen 10                #18 [hci1] 1.249583
      LE Read Buffer v2 (0x08|0x0060) ncmd 1
        Status: Success (0x00)
        ACL MTU: 27
        ACL max packet: 3
        ISO MTU: 318
        ISO max packet: 3
< HCI Command: LE Read Maximum Adve.. (0x08|0x003a) plen 0  #19 [hci1] 1.269119
> HCI Event: Command Complete (0x0e) plen 6                 #20 [hci1] 1.269586
      LE Read Maximum Advertising Data Length (0x08|0x003a) ncmd 1
        Status: Success (0x00)
        Max length: 1650
< HCI Command: LE Read Supported St.. (0x08|0x001c) plen 0  #21 [hci1] 1.289057
> HCI Event: Command Complete (0x0e) plen 12                #22 [hci1] 1.289588
      LE Read Supported States (0x08|0x001c) ncmd 1
        Status: Success (0x00)
        States: 0x000003ff3e0306ff
          Non-connectable Advertising State
          Scannable Advertising State
          Connectable Advertising State
          High Duty Cycle Directed Advertising State
          Passive Scanning State
          Active Scanning State
          Initiating State
            and Connection State (Central Role)
          Connection State (Peripheral Role)
          Scannable Advertising State
            and Passive Scanning State
          Connectable Advertising State
            and Passive Scanning State
          Non-connectable Advertising State
            and Initiating State
          Scannable Advertising State
            and Initiating State
          Active Scanning State
            and Connection State (Central Role)
          Passive Scanning State
            and Connection State (Peripheral Role)
          Active Scanning State
            and Connection State (Peripheral Role)
          Initiating State
            and Connection State (Central Role)
            and Central Role & Central Role
          Low Duty Cycle Directed Advertising State
          Connectable Advertising State
            and Initiating State
            and Central Role & Peripheral Role
          High Duty Cycle Directed Advertising State
            and Initiating State
            and Central Role & Peripheral Role
          Low Duty Cycle Directed Advertising State
            and Initiating State
            and Central Role & Peripheral Role
          Connectable Advertising State
            and Connection State (Central Role)
            and Central Role & Peripheral Role
          High Duty Cycle Directed Advertising State
            and Connection State (Central Role)
            and Central Role & Peripheral Role
          Low Duty Cycle Directed Advertising State
            and Connection State (Central Role)
            and Central Role & Peripheral Role
          Connectable Advertising State
            and Connection State (Peripheral Role)
            and Central Role & Peripheral Role
          High Duty Cycle Directed Advertising State
            and Connection State (Peripheral Role)
            and Peripheral Role & Peripheral Role
          Low Duty Cycle Directed Advertising State
            and Connection State (Peripheral Role)
            and Peripheral Role & Peripheral Role
          Initiating State
            and Connection State (Peripheral Role)
            and Central Role & Peripheral Role
< HCI Command: LE Read Maximum Data.. (0x08|0x002f) plen 0  #23 [hci1] 1.309106
> HCI Event: Command Complete (0x0e) plen 12                #24 [hci1] 1.309641
      LE Read Maximum Data Length (0x08|0x002f) ncmd 1
        Status: Success (0x00)
        Max TX octets: 251
        Max TX time: 2704
        Max RX octets: 251
        Max RX time: 2704
< HCI Command: LE Write Suggested D.. (0x08|0x0024) plen 4  #25 [hci1] 1.329098
        TX octets: 251
        TX time: 2704
> HCI Event: Command Complete (0x0e) plen 4                 #26 [hci1] 1.329538
      LE Write Suggested Default Data Length (0x08|0x0024) ncmd 1
        Status: Success (0x00)
< HCI Command: LE Read Resolving Li.. (0x08|0x002a) plen 0  #27 [hci1] 1.349095
> HCI Event: Command Complete (0x0e) plen 5                 #28 [hci1] 1.349564
      LE Read Resolving List Size (0x08|0x002a) ncmd 1
        Status: Success (0x00)
        Size: 8
< HCI Command: LE Set Event Mask (0x08|0x0001) plen 8       #29 [hci1] 1.369086
        Mask: 0x000002023f87fa5e
          LE Advertising Report
          LE Connection Update Complete
          LE Read Remote Used Features Complete
          LE Long Term Key Request
          LE Data Length Change
          LE Enhanced Connection Complete
          LE PHY Update Complete
          LE Extended Advertising Report
          LE Periodic Advertising Sync Established
          LE Periodic Advertising Report
          LE Periodic Advertising Sync Lost
          LE Extended Scan Timeout
          LE Extended Advertising Set Terminated
          LE Scan Request Received
          LE Periodic Advertising Sync Transfer Rvc
          LE CIS Established
          LE CIS Request
          LE Create BIG Complete
          LE Terminate BIG Complete
          LE BIG Sync Estabilished Complete
          LE BIG Sync Lost
          LE BIG Info Advertising Report
          Unknown mask (0x0000020000000000)
> HCI Event: Command Complete (0x0e) plen 4                 #30 [hci1] 1.369656
      LE Set Event Mask (0x08|0x0001) ncmd 1
        Status: Success (0x00)
< HCI Command: Set Event Mask (0x03|0x0001) plen 8          #31 [hci1] 1.389062
        Mask: 0x2000800002008890
          Disconnection Complete
          Encryption Change
          Read Remote Version Information Complete
          Hardware Error
          Data Buffer Overflow
          Encryption Key Refresh Complete
          LE Meta
> HCI Event: Command Complete (0x0e) plen 4                 #32 [hci1] 1.389582
      Set Event Mask (0x03|0x0001) ncmd 1
        Status: Success (0x00)
< HCI Command: Read BD ADDR (0x04|0x0009) plen 0            #33 [hci1] 1.409097
> HCI Event: Command Complete (0x0e) plen 10                #34 [hci1] 1.409641
      Read BD ADDR (0x04|0x0009) ncmd 1
        Status: Success (0x00)
        Address: 00:00:00:00:00:00 (OUI 00-00-00)
< HCI Command: LE Set Random Address (0x08|0x0005) plen 6   #35 [hci1] 1.429110
        Address: D5:B6:CC:31:DB:3B (Static)
> HCI Event: Command Complete (0x0e) plen 4                 #36 [hci1] 1.429646
      LE Set Random Address (0x08|0x0005) ncmd 1
        Status: Success (0x00)
< HCI Command: LE Set Extended Adv.. (0x08|0x0036) plen 25  #37 [hci1] 3.989140
        Handle: 0x00
        Properties: 0x0013
          Connectable
          Scannable
          Use legacy advertising PDUs: ADV_IND
        Min advertising interval: 100.000 msec (0x00a0)
        Max advertising interval: 150.000 msec (0x00f0)
        Channel map: 37, 38, 39 (0x07)
        Own address type: Random (0x01)
        Peer address type: Public (0x00)
        Peer address: 00:00:00:00:00:00 (OUI 00-00-00)
        Filter policy: Allow Scan Request from Any, Allow Connect Request from Any (0x00)
        TX power: Host has no preference (0x7f)
        Primary PHY: LE 1M (0x01)
        Secondary max skip: 0x00
        Secondary PHY: LE 1M (0x01)
        SID: 0x00
        Scan request notifications: Disabled (0x00)
> HCI Event: Command Complete (0x0e) plen 5                 #38 [hci1] 3.989955
      LE Set Extended Advertising Parameters (0x08|0x0036) ncmd 1
        Status: Success (0x00)
        TX power (selected): 0 dbm (0x00)
< HCI Command: LE Set Advertising S.. (0x08|0x0035) plen 7  #39 [hci1] 4.009126
        Advertising handle: 0x00
        Advertising random address: D5:B6:CC:31:DB:3B (Static)
> HCI Event: Command Complete (0x0e) plen 4                 #40 [hci1] 4.009630
      LE Set Advertising Set Random Address (0x08|0x0035) ncmd 1
        Status: Success (0x00)
< HCI Command: LE Set Extended Adv.. (0x08|0x0037) plen 22  #41 [hci1] 4.029123
        Handle: 0x00
        Operation: Complete extended advertising data (0x03)
        Fragment preference: Minimize fragmentation (0x01)
        Data length: 0x12
        Flags: 0x06
          LE General Discoverable Mode
          BR/EDR Not Supported
        Name (complete): Tester_F6B11A
> HCI Event: Command Complete (0x0e) plen 4                 #42 [hci1] 4.029761
      LE Set Extended Advertising Data (0x08|0x0037) ncmd 1
        Status: Success (0x00)
< HCI Command: LE Set Extended Scan.. (0x08|0x0038) plen 4  #43 [hci1] 4.049113
        Handle: 0x00
        Operation: Complete scan response data (0x03)
        Fragment preference: Minimize fragmentation (0x01)
        Data length: 0x00
> HCI Event: Command Complete (0x0e) plen 4                 #44 [hci1] 4.049558
      LE Set Extended Scan Response Data (0x08|0x0038) ncmd 1
        Status: Success (0x00)
< HCI Command: LE Set Extended Adve.. (0x08|0x0039) plen 6  #45 [hci1] 4.069142
        Extended advertising: Enabled (0x01)
        Number of sets: 1 (0x01)
        Entry 0
          Handle: 0x00
          Duration: 0 ms (0x00)
          Max ext adv events: 0
> HCI Event: Command Complete (0x0e) plen 4                 #46 [hci1] 4.069753
      LE Set Extended Advertising Enable (0x08|0x0039) ncmd 1
        Status: Success (0x00)
> HCI Event: LE Meta Event (0x3e) plen 31                   #47 [hci1] 4.183696
      LE Enhanced Connection Complete (0x0a)
        Status: Success (0x00)
        Handle: 2001
        Role: Peripheral (0x01)
        Peer address type: Public (0x00)
        Peer address: DF:A9:FF:F6:B1:1A (OUI DF-A9-FF)
        Local resolvable private address: 00:00:00:00:00:00 (Non-Resolvable)
        Peer resolvable private address: 00:00:00:00:00:00 (Non-Resolvable)
        Connection interval: 87.50 msec (0x0046)
        Connection latency: 0 (0x0000)
        Supervision timeout: 25120 msec (0x09d0)
        Central clock accuracy: 0x01
> HCI Event: LE Meta Event (0x3e) plen 6                    #48 [hci1] 4.183702
      LE Advertising Set Terminated (0x12)
        Status: Success (0x00)
        Handle: 0
        Connection handle: 2001
        Number of completed extended advertising events: 0
< HCI Command: LE Read Remote Used... (0x08|0x0016) plen 2  #49 [hci1] 4.191195
        Handle: 2001 Address: DF:A9:FF:F6:B1:1A (OUI DF-A9-FF)
< ACL Data TX: Handle 2001 flags 0x00 dlen 7                #50 [hci1] 4.191303
      ATT: Exchange MTU Request (0x02) len 2
        Client RX MTU: 251
> HCI Event: Command Status (0x0f) plen 4                   #51 [hci1] 4.191701
      LE Read Remote Used Features (0x08|0x0016) ncmd 1
        Status: Success (0x00)
> HCI Event: Number of Completed Packets (0x13) plen 5      #52 [hci1] 4.359564
        Num handles: 1
        Handle: 2001 Address: DF:A9:FF:F6:B1:1A (OUI DF-A9-FF)
        Count: 1
        #50: len 7 (0 Kb/s)
        Latency: 168 msec (168-168 msec ~168 msec)
> HCI Event: LE Meta Event (0x3e) plen 12                   #53 [hci1] 4.447504
      LE Read Remote Used Features (0x04)
        Status: Success (0x00)
        Handle: 2001 Address: DF:A9:FF:F6:B1:1A (OUI DF-A9-FF)
        Features: 0x2d 0x49 0x00 0xf7 0x67 0xd8 0x00 0x00
          LE Encryption
          Extended Reject Indication
          Peripheral-initiated Features Exchange
          LE Data Packet Length Extension
          LE 2M PHY
          LE Coded PHY
          Channel Selection Algorithm #2
          Periodic Advertising Sync Transfer - Sender
          Periodic Advertising Sync Transfer - Recipient
          Sleep Clock Accuracy Updates
          Connected Isochronous Stream - Central
          Connected Isochronous Stream - Peripheral
          Isochronous Broadcaster
          Synchronized Receiver
          Connected Isochronous Stream (Host Support)
          LE Power Control Request
          LE Power Control Request
          Connection Subrating
          Connection Subrating (Host Support)
          Unknown features (0x0000d80000000000)
> ACL Data RX: Handle 2001 flags 0x02 dlen 11               #54 [hci1] 6.897136
      SMP: Pairing Request (0x01) len 6
        IO capability: KeyboardDisplay (0x04)
        OOB data: Authentication data not present (0x00)
        Authentication requirement: Bonding, MITM, SC, No Keypresses (0x0d)
        Max encryption key size: 16
        Initiator key distribution: EncKey IdKey (0x03)
        Responder key distribution: EncKey IdKey Sign (0x07)
> ACL Data RX: Handle 2001 flags 0x02 dlen 7                #55 [hci1] 6.897721
      ATT: Exchange MTU Response (0x03) len 2
        Server RX MTU: 23
< HCI Command: Host Number of Compl.. (0x03|0x0035) plen 5  #56 [hci1] 6.909815
        Num handles: 1
        Handle: 2001 Address: DF:A9:FF:F6:B1:1A (OUI DF-A9-FF)
        Count: 1
< ACL Data TX: Handle 2001 flags 0x00 dlen 11               #57 [hci1] 6.909936
      SMP: Pairing Response (0x02) len 6
        IO capability: DisplayOnly (0x00)
        OOB data: Authentication data not present (0x00)
        Authentication requirement: Bonding, No MITM, SC, No Keypresses (0x09)
        Max encryption key size: 16
        Initiator key distribution: IdKey (0x02)
        Responder key distribution: <none> (0x00)
< HCI Command: Host Number of Compl.. (0x03|0x0035) plen 5  #58 [hci1] 6.910354
        Num handles: 1
        Handle: 2001 Address: DF:A9:FF:F6:B1:1A (OUI DF-A9-FF)
        Count: 1
> HCI Event: Number of Completed Packets (0x13) plen 5      #59 [hci1] 7.072164
        Num handles: 1
        Handle: 2001 Address: DF:A9:FF:F6:B1:1A (OUI DF-A9-FF)
        Count: 1
        #57: len 11 (0 Kb/s)
        Latency: 162 msec (162-168 msec ~165 msec)
> ACL Data RX: Handle 2001 flags 0x02 dlen 27               #60 [hci1] 7.072493
> ACL Data RX: Handle 2001 flags 0x01 dlen 27               #61 [hci1] 7.073030
> ACL Data RX: Handle 2001 flags 0x01 dlen 15               #62 [hci1] 7.073469
      SMP: Pairing Public Key (0x0c) len 64
        X: e876ea93f16bfb84c6eef761f4c58fd9dd5d5cf86fe709f144641801911d3561
        Y: 217110cde4a463fdb7f9af83bf829d5657047b07d104765d0056adc0186b25d2
< HCI Command: Host Number of Compl.. (0x03|0x0035) plen 5  #63 [hci1] 7.089505
        Num handles: 1
        Handle: 2001 Address: DF:A9:FF:F6:B1:1A (OUI DF-A9-FF)
        Count: 1
< HCI Command: Host Number of Compl.. (0x03|0x0035) plen 5  #64 [hci1] 7.089606
        Num handles: 1
        Handle: 2001 Address: DF:A9:FF:F6:B1:1A (OUI DF-A9-FF)
        Count: 1
< HCI Command: Host Number of Compl.. (0x03|0x0035) plen 5  #65 [hci1] 7.089721
        Num handles: 1
        Handle: 2001 Address: DF:A9:FF:F6:B1:1A (OUI DF-A9-FF)
        Count: 1
< ACL Data TX: Handle 2001 flags 0x00 dlen 27               #66 [hci1] 7.089727
< ACL Data TX: Handle 2001 flags 0x01 dlen 27               #67 [hci1] 7.089738
< ACL Data TX: Handle 2001 flags 0x01 dlen 15               #68 [hci1] 7.089752
      SMP: Pairing Public Key (0x0c) len 64
        X: 98308440221e2d910f0e54b71e7ec652857aa9b5a0dc65028824cc19db1226e9
        Y: 67a4816bcb62efb21701e31fdb27561a6217575fb007a8bbdabe7e28b6f68482
> HCI Event: Number of Completed Packets (0x13) plen 5      #69 [hci1] 7.160158
        Num handles: 1
        Handle: 2001 Address: DF:A9:FF:F6:B1:1A (OUI DF-A9-FF)
        Count: 1
        #66: len 27 (3 Kb/s)
        Latency: 70 msec (70-168 msec ~117 msec)
> HCI Event: Number of Completed Packets (0x13) plen 5      #70 [hci1] 7.160726
        Num handles: 1
        Handle: 2001 Address: DF:A9:FF:F6:B1:1A (OUI DF-A9-FF)
        Count: 1
        #67: len 27 (3 Kb/s)
        Latency: 70 msec (70-168 msec ~94 msec)
> HCI Event: Number of Completed Packets (0x13) plen 5      #71 [hci1] 7.247019
        Num handles: 1
        Handle: 2001 Address: DF:A9:FF:F6:B1:1A (OUI DF-A9-FF)
        Count: 1
        #68: len 15 (0 Kb/s)
        Latency: 157 msec (70-168 msec ~125 msec)
> ACL Data RX: Handle 2001 flags 0x02 dlen 21               #72 [hci1] 8.209819
      SMP: Pairing Confirm (0x03) len 16
        Confim value: e41290f00da75edbd1f21359c05be5a0
< HCI Command: Host Number of Compl.. (0x03|0x0035) plen 5  #73 [hci1] 8.229952
        Num handles: 1
        Handle: 2001 Address: DF:A9:FF:F6:B1:1A (OUI DF-A9-FF)
        Count: 1
< ACL Data TX: Handle 2001 flags 0x00 dlen 21               #74 [hci1] 8.230140
      SMP: Pairing Confirm (0x03) len 16
        Confim value: e0adc1253211656088c3d3bb15014a58
> HCI Event: Number of Completed Packets (0x13) plen 5      #75 [hci1] 8.384741
        Num handles: 1
        Handle: 2001 Address: DF:A9:FF:F6:B1:1A (OUI DF-A9-FF)
        Count: 1
        #74: len 21 (1 Kb/s)
        Latency: 154 msec (70-168 msec ~140 msec)
> ACL Data RX: Handle 2001 flags 0x02 dlen 21               #76 [hci1] 8.384901
      SMP: Pairing Random (0x04) len 16
        Random value: 5a74f4b830c0f7dd0000000000000000
< HCI Command: Host Number of Compl.. (0x03|0x0035) plen 5  #77 [hci1] 8.390076
        Num handles: 1
        Handle: 2001 Address: DF:A9:FF:F6:B1:1A (OUI DF-A9-FF)
        Count: 1
< ACL Data TX: Handle 2001 flags 0x00 dlen 21               #78 [hci1] 8.390187
      SMP: Pairing Random (0x04) len 16
        Random value: 8e6108f966a694cbe26df70bb96773e6
> HCI Event: Number of Completed Packets (0x13) plen 5      #79 [hci1] 8.559407
        Num handles: 1
        Handle: 2001 Address: DF:A9:FF:F6:B1:1A (OUI DF-A9-FF)
        Count: 1
        #78: len 21 (0 Kb/s)
        Latency: 169 msec (70-169 msec ~154 msec)
> ACL Data RX: Handle 2001 flags 0x02 dlen 21               #80 [hci1] 8.647269
      SMP: Pairing Confirm (0x03) len 16
        Confim value: 54ceb1736e2fc04b18170ad73eaf3ec3
< HCI Command: Host Number of Compl.. (0x03|0x0035) plen 5  #81 [hci1] 8.649855
        Num handles: 1
        Handle: 2001 Address: DF:A9:FF:F6:B1:1A (OUI DF-A9-FF)
        Count: 1
< ACL Data TX: Handle 2001 flags 0x00 dlen 21               #82 [hci1] 8.649941
      SMP: Pairing Confirm (0x03) len 16
        Confim value: 3ff3c289e15008f963ced286729ada61
> HCI Event: Number of Completed Packets (0x13) plen 5      #83 [hci1] 8.822188
        Num handles: 1
        Handle: 2001 Address: DF:A9:FF:F6:B1:1A (OUI DF-A9-FF)
        Count: 1
        #82: len 21 (0 Kb/s)
        Latency: 172 msec (70-172 msec ~163 msec)
> ACL Data RX: Handle 2001 flags 0x02 dlen 21               #84 [hci1] 8.822499
      SMP: Pairing Random (0x04) len 16
        Random value: 94111d1ddaa0e3070000000000000000
< HCI Command: Host Number of Compl.. (0x03|0x0035) plen 5  #85 [hci1] 8.830089
        Num handles: 1
        Handle: 2001 Address: DF:A9:FF:F6:B1:1A (OUI DF-A9-FF)
        Count: 1
< ACL Data TX: Handle 2001 flags 0x00 dlen 21               #86 [hci1] 8.830283
      SMP: Pairing Random (0x04) len 16
        Random value: 4d02679f89a05211af56d8b3da64d21e
> HCI Event: Number of Completed Packets (0x13) plen 5      #87 [hci1] 8.996933
        Num handles: 1
        Handle: 2001 Address: DF:A9:FF:F6:B1:1A (OUI DF-A9-FF)
        Count: 1
        #86: len 21 (1 Kb/s)
        Latency: 166 msec (70-172 msec ~165 msec)
> ACL Data RX: Handle 2001 flags 0x02 dlen 21               #88 [hci1] 9.084731
      SMP: Pairing Confirm (0x03) len 16
        Confim value: 7c58be37759a5a766cfdcd4e3ee4f0ed
< HCI Command: Host Number of Compl.. (0x03|0x0035) plen 5  #89 [hci1] 9.089273
        Num handles: 1
        Handle: 2001 Address: DF:A9:FF:F6:B1:1A (OUI DF-A9-FF)
        Count: 1
< ACL Data TX: Handle 2001 flags 0x00 dlen 21               #90 [hci1] 9.089340
      SMP: Pairing Confirm (0x03) len 16
        Confim value: 252c055eb7d90e59027de52bca4850ca
> HCI Event: Number of Completed Packets (0x13) plen 5      #91 [hci1] 9.259563
        Num handles: 1
        Handle: 2001 Address: DF:A9:FF:F6:B1:1A (OUI DF-A9-FF)
        Count: 1
        #90: len 21 (0 Kb/s)
        Latency: 170 msec (70-172 msec ~167 msec)
> ACL Data RX: Handle 2001 flags 0x02 dlen 21               #92 [hci1] 9.259972
      SMP: Pairing Random (0x04) len 16
        Random value: e8edf5e112ca297c0000000000000000
< HCI Command: Host Number of Compl.. (0x03|0x0035) plen 5  #93 [hci1] 9.270051
        Num handles: 1
        Handle: 2001 Address: DF:A9:FF:F6:B1:1A (OUI DF-A9-FF)
        Count: 1
< ACL Data TX: Handle 2001 flags 0x00 dlen 21               #94 [hci1] 9.270220
      SMP: Pairing Random (0x04) len 16
        Random value: 5e8286bc235a02440d0c3424a2acf8fd
> HCI Event: Number of Completed Packets (0x13) plen 5      #95 [hci1] 9.434405
        Num handles: 1
        Handle: 2001 Address: DF:A9:FF:F6:B1:1A (OUI DF-A9-FF)
        Count: 1
        #94: len 21 (1 Kb/s)
        Latency: 164 msec (70-172 msec ~165 msec)
> ACL Data RX: Handle 2001 flags 0x02 dlen 21               #96 [hci1] 9.522169
      SMP: Pairing Confirm (0x03) len 16
        Confim value: f26800fd99f613eacb132c328b2669ff
< HCI Command: Host Number of Compl.. (0x03|0x0035) plen 5  #97 [hci1] 9.529710
        Num handles: 1
        Handle: 2001 Address: DF:A9:FF:F6:B1:1A (OUI DF-A9-FF)
        Count: 1
< ACL Data TX: Handle 2001 flags 0x00 dlen 21               #98 [hci1] 9.529808
      SMP: Pairing Confirm (0x03) len 16
        Confim value: daea867f1c9265914852671f6bceba5a
> HCI Event: Number of Completed Packets (0x13) plen 5      #99 [hci1] 9.697157
        Num handles: 1
        Handle: 2001 Address: DF:A9:FF:F6:B1:1A (OUI DF-A9-FF)
        Count: 1
        #98: len 21 (1 Kb/s)
        Latency: 167 msec (70-172 msec ~166 msec)
> ACL Data RX: Handle 2001 flags 0x02 dlen 21              #100 [hci1] 9.697387
      SMP: Pairing Random (0x04) len 16
        Random value: 108377ee996ee0610000000000000000
< HCI Command: Host Number of Comp.. (0x03|0x0035) plen 5  #101 [hci1] 9.710159
        Num handles: 1
        Handle: 2001 Address: DF:A9:FF:F6:B1:1A (OUI DF-A9-FF)
        Count: 1
< ACL Data TX: Handle 2001 flags 0x00 dlen 21              #102 [hci1] 9.710355
      SMP: Pairing Random (0x04) len 16
        Random value: 5c4a1bcadd27bd58e945097b00bad7ac
> HCI Event: Number of Completed Packets (0x13) plen 5     #103 [hci1] 9.871817
        Num handles: 1
        Handle: 2001 Address: DF:A9:FF:F6:B1:1A (OUI DF-A9-FF)
        Count: 1
        #102: len 21 (1 Kb/s)
        Latency: 161 msec (70-172 msec ~164 msec)
> ACL Data RX: Handle 2001 flags 0x02 dlen 21              #104 [hci1] 9.959690
      SMP: Pairing Confirm (0x03) len 16
        Confim value: fa670e50c845395825bf95214e0ca43a
< HCI Command: Host Number of Comp.. (0x03|0x0035) plen 5  #105 [hci1] 9.969841
        Num handles: 1
        Handle: 2001 Address: DF:A9:FF:F6:B1:1A (OUI DF-A9-FF)
        Count: 1
< ACL Data TX: Handle 2001 flags 0x00 dlen 21              #106 [hci1] 9.969936
      SMP: Pairing Confirm (0x03) len 16
        Confim value: 005687611f050a0af5bdc4f22c657fe5
> HCI Event: Number of Completed Packets (0x13) plen 5    #107 [hci1] 10.134511
        Num handles: 1
        Handle: 2001 Address: DF:A9:FF:F6:B1:1A (OUI DF-A9-FF)
        Count: 1
        #106: len 21 (1 Kb/s)
        Latency: 164 msec (70-172 msec ~164 msec)
> ACL Data RX: Handle 2001 flags 0x02 dlen 21             #108 [hci1] 10.134943
      SMP: Pairing Random (0x04) len 16
        Random value: 49b597f609d7e82d0000000000000000
< HCI Command: Host Number of Com.. (0x03|0x0035) plen 5  #109 [hci1] 10.149480
        Num handles: 1
        Handle: 2001 Address: DF:A9:FF:F6:B1:1A (OUI DF-A9-FF)
        Count: 1
< ACL Data TX: Handle 2001 flags 0x00 dlen 21             #110 [hci1] 10.149503
      SMP: Pairing Random (0x04) len 16
        Random value: 32527e6e64e79f33b2e374394db8ab2d
> HCI Event: Number of Completed Packets (0x13) plen 5    #111 [hci1] 10.309390
        Num handles: 1
        Handle: 2001 Address: DF:A9:FF:F6:B1:1A (OUI DF-A9-FF)
        Count: 1
        #110: len 21 (1 Kb/s)
        Latency: 159 msec (70-172 msec ~162 msec)
> ACL Data RX: Handle 2001 flags 0x02 dlen 21             #112 [hci1] 10.397135
      SMP: Pairing Confirm (0x03) len 16
        Confim value: 02f9d7ef7887bc1bb5cfcd0fa16c5474
< HCI Command: Host Number of Com.. (0x03|0x0035) plen 5  #113 [hci1] 10.409432
        Num handles: 1
        Handle: 2001 Address: DF:A9:FF:F6:B1:1A (OUI DF-A9-FF)
        Count: 1
< ACL Data TX: Handle 2001 flags 0x00 dlen 21             #114 [hci1] 10.409507
      SMP: Pairing Confirm (0x03) len 16
        Confim value: 43173e444d2839515eacfea774b5b5dc
> HCI Event: Number of Completed Packets (0x13) plen 5    #115 [hci1] 10.572000
        Num handles: 1
        Handle: 2001 Address: DF:A9:FF:F6:B1:1A (OUI DF-A9-FF)
        Count: 1
        #114: len 21 (1 Kb/s)
        Latency: 162 msec (70-172 msec ~162 msec)
> ACL Data RX: Handle 2001 flags 0x02 dlen 21             #116 [hci1] 10.572331
      SMP: Pairing Random (0x04) len 16
        Random value: 2b7d74a05f986f650000000000000000
< HCI Command: Host Number of Com.. (0x03|0x0035) plen 5  #117 [hci1] 10.590080
        Num handles: 1
        Handle: 2001 Address: DF:A9:FF:F6:B1:1A (OUI DF-A9-FF)
        Count: 1
< ACL Data TX: Handle 2001 flags 0x00 dlen 21             #118 [hci1] 10.590291
      SMP: Pairing Random (0x04) len 16
        Random value: dddbdfe2838e9a8cc6964353c850fef7
> HCI Event: Number of Completed Packets (0x13) plen 5    #119 [hci1] 10.746799
        Num handles: 1
        Handle: 2001 Address: DF:A9:FF:F6:B1:1A (OUI DF-A9-FF)
        Count: 1
        #118: len 21 (1 Kb/s)
        Latency: 156 msec (70-172 msec ~159 msec)
> ACL Data RX: Handle 2001 flags 0x02 dlen 21             #120 [hci1] 10.834738
      SMP: Pairing Confirm (0x03) len 16
        Confim value: 2ac1a47ef1f5e7a6a11f95c703b9f5bb
< HCI Command: Host Number of Com.. (0x03|0x0035) plen 5  #121 [hci1] 10.849667
        Num handles: 1
        Handle: 2001 Address: DF:A9:FF:F6:B1:1A (OUI DF-A9-FF)
        Count: 1
< ACL Data TX: Handle 2001 flags 0x00 dlen 21             #122 [hci1] 10.849794
      SMP: Pairing Confirm (0x03) len 16
        Confim value: 70716d4254498fc0830fe221dfc45d8c
> HCI Event: Number of Completed Packets (0x13) plen 5    #123 [hci1] 11.009504
        Num handles: 1
        Handle: 2001 Address: DF:A9:FF:F6:B1:1A (OUI DF-A9-FF)
        Count: 1
        #122: len 21 (1 Kb/s)
        Latency: 159 msec (70-172 msec ~159 msec)
> ACL Data RX: Handle 2001 flags 0x02 dlen 21             #124 [hci1] 11.009865
      SMP: Pairing Random (0x04) len 16
        Random value: 5659114a6c9fe45a0000000000000000
< HCI Command: Host Number of Com.. (0x03|0x0035) plen 5  #125 [hci1] 11.030078
        Num handles: 1
        Handle: 2001 Address: DF:A9:FF:F6:B1:1A (OUI DF-A9-FF)
        Count: 1
< ACL Data TX: Handle 2001 flags 0x00 dlen 21             #126 [hci1] 11.030189
      SMP: Pairing Random (0x04) len 16
        Random value: eb9f1915536596b6fc3db1c86b2b1970
> HCI Event: Number of Completed Packets (0x13) plen 5    #127 [hci1] 11.184324
        Num handles: 1
        Handle: 2001 Address: DF:A9:FF:F6:B1:1A (OUI DF-A9-FF)
        Count: 1
        #126: len 21 (1 Kb/s)
        Latency: 154 msec (70-172 msec ~156 msec)
> ACL Data RX: Handle 2001 flags 0x02 dlen 21             #128 [hci1] 11.272156
      SMP: Pairing Confirm (0x03) len 16
        Confim value: 5631bbbefb8053b95f08a8cbc1b8bea2
< HCI Command: Host Number of Com.. (0x03|0x0035) plen 5  #129 [hci1] 11.289914
        Num handles: 1
        Handle: 2001 Address: DF:A9:FF:F6:B1:1A (OUI DF-A9-FF)
        Count: 1
< ACL Data TX: Handle 2001 flags 0x00 dlen 21             #130 [hci1] 11.290084
      SMP: Pairing Confirm (0x03) len 16
        Confim value: e6e4d3cd99498dca17451c90ce198e0d
> HCI Event: Number of Completed Packets (0x13) plen 5    #131 [hci1] 11.446973
        Num handles: 1
        Handle: 2001 Address: DF:A9:FF:F6:B1:1A (OUI DF-A9-FF)
        Count: 1
        #130: len 21 (1 Kb/s)
        Latency: 156 msec (70-172 msec ~156 msec)
> ACL Data RX: Handle 2001 flags 0x02 dlen 21             #132 [hci1] 11.447295
      SMP: Pairing Random (0x04) len 16
        Random value: d57afeedf82e9f780000000000000000
< HCI Command: Host Number of Com.. (0x03|0x0035) plen 5  #133 [hci1] 11.449209
        Num handles: 1
        Handle: 2001 Address: DF:A9:FF:F6:B1:1A (OUI DF-A9-FF)
        Count: 1
< ACL Data TX: Handle 2001 flags 0x00 dlen 21             #134 [hci1] 11.449293
      SMP: Pairing Random (0x04) len 16
        Random value: 5c794dc9ad9f2c3f295ebd5ad5e1c3cf
> HCI Event: Number of Completed Packets (0x13) plen 5    #135 [hci1] 11.621836
        Num handles: 1
        Handle: 2001 Address: DF:A9:FF:F6:B1:1A (OUI DF-A9-FF)
        Count: 1
        #134: len 21 (0 Kb/s)
        Latency: 172 msec (70-172 msec ~164 msec)
> ACL Data RX: Handle 2001 flags 0x02 dlen 21             #136 [hci1] 11.709621
      SMP: Pairing Confirm (0x03) len 16
        Confim value: e6e0b4eb8a6ad3fb60adf19318a941a1
< HCI Command: Host Number of Com.. (0x03|0x0035) plen 5  #137 [hci1] 11.729371
        Num handles: 1
        Handle: 2001 Address: DF:A9:FF:F6:B1:1A (OUI DF-A9-FF)
        Count: 1
< ACL Data TX: Handle 2001 flags 0x00 dlen 21             #138 [hci1] 11.729407
      SMP: Pairing Confirm (0x03) len 16
        Confim value: 41b1153b9bff9a6224a94bad41202c11
> HCI Event: Number of Completed Packets (0x13) plen 5    #139 [hci1] 11.884516
        Num handles: 1
        Handle: 2001 Address: DF:A9:FF:F6:B1:1A (OUI DF-A9-FF)
        Count: 1
        #138: len 21 (1 Kb/s)
        Latency: 155 msec (70-172 msec ~159 msec)
> ACL Data RX: Handle 2001 flags 0x02 dlen 21             #140 [hci1] 11.884843
      SMP: Pairing Random (0x04) len 16
        Random value: c07627578909f9220000000000000000
< HCI Command: Host Number of Com.. (0x03|0x0035) plen 5  #141 [hci1] 11.889827
        Num handles: 1
        Handle: 2001 Address: DF:A9:FF:F6:B1:1A (OUI DF-A9-FF)
        Count: 1
< ACL Data TX: Handle 2001 flags 0x00 dlen 21             #142 [hci1] 11.889885
      SMP: Pairing Random (0x04) len 16
        Random value: 5c2fff312cdf99c9491988e877355a9a
> HCI Event: Number of Completed Packets (0x13) plen 5    #143 [hci1] 12.059321
        Num handles: 1
        Handle: 2001 Address: DF:A9:FF:F6:B1:1A (OUI DF-A9-FF)
        Count: 1
        #142: len 21 (0 Kb/s)
        Latency: 169 msec (70-172 msec ~164 msec)
> ACL Data RX: Handle 2001 flags 0x02 dlen 21             #144 [hci1] 12.147129
      SMP: Pairing Confirm (0x03) len 16
        Confim value: cfb7a77360ea35552191b475fd27dc5d
< HCI Command: Host Number of Com.. (0x03|0x0035) plen 5  #145 [hci1] 12.149303
        Num handles: 1
        Handle: 2001 Address: DF:A9:FF:F6:B1:1A (OUI DF-A9-FF)
        Count: 1
< ACL Data TX: Handle 2001 flags 0x00 dlen 21             #146 [hci1] 12.149368
      SMP: Pairing Confirm (0x03) len 16
        Confim value: 386e8315995a9bf383060e8be07855a2
> HCI Event: Number of Completed Packets (0x13) plen 5    #147 [hci1] 12.322040
        Num handles: 1
        Handle: 2001 Address: DF:A9:FF:F6:B1:1A (OUI DF-A9-FF)
        Count: 1
        #146: len 21 (0 Kb/s)
        Latency: 172 msec (70-172 msec ~168 msec)
> ACL Data RX: Handle 2001 flags 0x02 dlen 21             #148 [hci1] 12.322316
      SMP: Pairing Random (0x04) len 16
        Random value: b20c116e0494f8ca0000000000000000
< HCI Command: Host Number of Com.. (0x03|0x0035) plen 5  #149 [hci1] 12.330103
        Num handles: 1
        Handle: 2001 Address: DF:A9:FF:F6:B1:1A (OUI DF-A9-FF)
        Count: 1
< ACL Data TX: Handle 2001 flags 0x00 dlen 21             #150 [hci1] 12.330303
      SMP: Pairing Random (0x04) len 16
        Random value: c629a3a987d808e808655d558dfc1155
> HCI Event: Number of Completed Packets (0x13) plen 5    #151 [hci1] 12.496769
        Num handles: 1
        Handle: 2001 Address: DF:A9:FF:F6:B1:1A (OUI DF-A9-FF)
        Count: 1
        #150: len 21 (1 Kb/s)
        Latency: 166 msec (70-172 msec ~167 msec)
> ACL Data RX: Handle 2001 flags 0x02 dlen 21             #152 [hci1] 12.584752
      SMP: Pairing Confirm (0x03) len 16
        Confim value: 577c758782c32b22a9e83e68a782b28d
< HCI Command: Host Number of Com.. (0x03|0x0035) plen 5  #153 [hci1] 12.589927
        Num handles: 1
        Handle: 2001 Address: DF:A9:FF:F6:B1:1A (OUI DF-A9-FF)
        Count: 1
< ACL Data TX: Handle 2001 flags 0x00 dlen 21             #154 [hci1] 12.590120
      SMP: Pairing Confirm (0x03) len 16
        Confim value: 3528d2f8c0ddb81d268d4e7f234b343a
> HCI Event: Number of Completed Packets (0x13) plen 5    #155 [hci1] 12.759459
        Num handles: 1
        Handle: 2001 Address: DF:A9:FF:F6:B1:1A (OUI DF-A9-FF)
        Count: 1
        #154: len 21 (0 Kb/s)
        Latency: 169 msec (70-172 msec ~168 msec)
> ACL Data RX: Handle 2001 flags 0x02 dlen 21             #156 [hci1] 12.759774
      SMP: Pairing Random (0x04) len 16
        Random value: 834eb3b3189a40610000000000000000
< HCI Command: Host Number of Com.. (0x03|0x0035) plen 5  #157 [hci1] 12.769178
        Num handles: 1
        Handle: 2001 Address: DF:A9:FF:F6:B1:1A (OUI DF-A9-FF)
        Count: 1
< ACL Data TX: Handle 2001 flags 0x00 dlen 21             #158 [hci1] 12.769203
      SMP: Pairing Random (0x04) len 16
        Random value: 92f20f6ad8f13724432c7fd6001c45ff
> HCI Event: Number of Completed Packets (0x13) plen 5    #159 [hci1] 12.934183
        Num handles: 1
        Handle: 2001 Address: DF:A9:FF:F6:B1:1A (OUI DF-A9-FF)
        Count: 1
        #158: len 21 (1 Kb/s)
        Latency: 164 msec (70-172 msec ~166 msec)
> ACL Data RX: Handle 2001 flags 0x02 dlen 21             #160 [hci1] 13.022136
      SMP: Pairing Confirm (0x03) len 16
        Confim value: b4a7a6300b4be86d6a3b70d507294e5d
< HCI Command: Host Number of Com.. (0x03|0x0035) plen 5  #161 [hci1] 13.029217
        Num handles: 1
        Handle: 2001 Address: DF:A9:FF:F6:B1:1A (OUI DF-A9-FF)
        Count: 1
< ACL Data TX: Handle 2001 flags 0x00 dlen 21             #162 [hci1] 13.029279
      SMP: Pairing Confirm (0x03) len 16
        Confim value: 23dc9299131f903471e1dc64320f5ca2
> HCI Event: Number of Completed Packets (0x13) plen 5    #163 [hci1] 13.196956
        Num handles: 1
        Handle: 2001 Address: DF:A9:FF:F6:B1:1A (OUI DF-A9-FF)
        Count: 1
        #162: len 21 (1 Kb/s)
        Latency: 167 msec (70-172 msec ~167 msec)
> ACL Data RX: Handle 2001 flags 0x02 dlen 21             #164 [hci1] 13.197324
      SMP: Pairing Random (0x04) len 16
        Random value: 5ba982f272e2eaed0000000000000000
< HCI Command: Host Number of Com.. (0x03|0x0035) plen 5  #165 [hci1] 13.209341
        Num handles: 1
        Handle: 2001 Address: DF:A9:FF:F6:B1:1A (OUI DF-A9-FF)
        Count: 1
< ACL Data TX: Handle 2001 flags 0x00 dlen 21             #166 [hci1] 13.209377
      SMP: Pairing Random (0x04) len 16
        Random value: 23ac32ebbb5e14c8a6b9622f296d277f
> HCI Event: Number of Completed Packets (0x13) plen 5    #167 [hci1] 13.371737
        Num handles: 1
        Handle: 2001 Address: DF:A9:FF:F6:B1:1A (OUI DF-A9-FF)
        Count: 1
        #166: len 21 (1 Kb/s)
        Latency: 162 msec (70-172 msec ~164 msec)
> ACL Data RX: Handle 2001 flags 0x02 dlen 21             #168 [hci1] 13.459575
      SMP: Pairing Confirm (0x03) len 16
        Confim value: c919f36f0def4c6430a64836ec0b2279
< HCI Command: Host Number of Com.. (0x03|0x0035) plen 5  #169 [hci1] 13.469352
        Num handles: 1
        Handle: 2001 Address: DF:A9:FF:F6:B1:1A (OUI DF-A9-FF)
        Count: 1
< ACL Data TX: Handle 2001 flags 0x00 dlen 21             #170 [hci1] 13.469359
      SMP: Pairing Confirm (0x03) len 16
        Confim value: 3d45d4a326660fbebf3f4d39f00488ac
> HCI Event: Number of Completed Packets (0x13) plen 5    #171 [hci1] 13.634451
        Num handles: 1
        Handle: 2001 Address: DF:A9:FF:F6:B1:1A (OUI DF-A9-FF)
        Count: 1
        #170: len 21 (1 Kb/s)
        Latency: 165 msec (70-172 msec ~164 msec)
> ACL Data RX: Handle 2001 flags 0x02 dlen 21             #172 [hci1] 13.634927
      SMP: Pairing Random (0x04) len 16
        Random value: 2fb0f33b0c4b4b1b0000000000000000
< HCI Command: Host Number of Com.. (0x03|0x0035) plen 5  #173 [hci1] 13.649410
        Num handles: 1
        Handle: 2001 Address: DF:A9:FF:F6:B1:1A (OUI DF-A9-FF)
        Count: 1
< ACL Data TX: Handle 2001 flags 0x00 dlen 21             #174 [hci1] 13.649445
      SMP: Pairing Random (0x04) len 16
        Random value: 297efe85e67448a15f56bd27e3a3cf1d
> HCI Event: Number of Completed Packets (0x13) plen 5    #175 [hci1] 13.809384
        Num handles: 1
        Handle: 2001 Address: DF:A9:FF:F6:B1:1A (OUI DF-A9-FF)
        Count: 1
        #174: len 21 (1 Kb/s)
        Latency: 159 msec (70-172 msec ~162 msec)
> ACL Data RX: Handle 2001 flags 0x02 dlen 21             #176 [hci1] 13.809734
      SMP: Pairing Confirm (0x03) len 16
        Confim value: c6633efab6901756ccd5357b8c649962
< HCI Command: Host Number of Com.. (0x03|0x0035) plen 5  #177 [hci1] 13.829469
        Num handles: 1
        Handle: 2001 Address: DF:A9:FF:F6:B1:1A (OUI DF-A9-FF)
        Count: 1
< ACL Data TX: Handle 2001 flags 0x00 dlen 21             #178 [hci1] 13.829559
      SMP: Pairing Confirm (0x03) len 16
        Confim value: 4ac3da09567ae320f353f454b75a638d
> HCI Event: Number of Completed Packets (0x13) plen 5    #179 [hci1] 13.984389
        Num handles: 1
        Handle: 2001 Address: DF:A9:FF:F6:B1:1A (OUI DF-A9-FF)
        Count: 1
        #178: len 21 (1 Kb/s)
        Latency: 154 msec (70-172 msec ~158 msec)
> ACL Data RX: Handle 2001 flags 0x02 dlen 21             #180 [hci1] 13.984764
      SMP: Pairing Random (0x04) len 16
        Random value: 495cc3146059081f0000000000000000
< HCI Command: Host Number of Com.. (0x03|0x0035) plen 5  #181 [hci1] 13.989991
        Num handles: 1
        Handle: 2001 Address: DF:A9:FF:F6:B1:1A (OUI DF-A9-FF)
        Count: 1
< ACL Data TX: Handle 2001 flags 0x00 dlen 21             #182 [hci1] 13.990073
      SMP: Pairing Random (0x04) len 16
        Random value: 25a9493fd3ce4faf02be7293595bb7c6
> HCI Event: Number of Completed Packets (0x13) plen 5    #183 [hci1] 14.159180
        Num handles: 1
        Handle: 2001 Address: DF:A9:FF:F6:B1:1A (OUI DF-A9-FF)
        Count: 1
        #182: len 21 (0 Kb/s)
        Latency: 169 msec (70-172 msec ~163 msec)
> ACL Data RX: Handle 2001 flags 0x02 dlen 21             #184 [hci1] 14.247039
      SMP: Pairing Confirm (0x03) len 16
        Confim value: b3ffe371dc5ac8b3615d42d4c400efad
< HCI Command: Host Number of Com.. (0x03|0x0035) plen 5  #185 [hci1] 14.249902
        Num handles: 1
        Handle: 2001 Address: DF:A9:FF:F6:B1:1A (OUI DF-A9-FF)
        Count: 1
< ACL Data TX: Handle 2001 flags 0x00 dlen 21             #186 [hci1] 14.250048
      SMP: Pairing Confirm (0x03) len 16
        Confim value: 66ac3481449ba2bfd18edb14b6e7b94b
> HCI Event: Number of Completed Packets (0x13) plen 5    #187 [hci1] 14.421844
        Num handles: 1
        Handle: 2001 Address: DF:A9:FF:F6:B1:1A (OUI DF-A9-FF)
        Count: 1
        #186: len 21 (0 Kb/s)
        Latency: 171 msec (70-172 msec ~167 msec)
> ACL Data RX: Handle 2001 flags 0x02 dlen 21             #188 [hci1] 14.422238
      SMP: Pairing Random (0x04) len 16
        Random value: 9af4774ae255851c0000000000000000
< HCI Command: Host Number of Com.. (0x03|0x0035) plen 5  #189 [hci1] 14.429619
        Num handles: 1
        Handle: 2001 Address: DF:A9:FF:F6:B1:1A (OUI DF-A9-FF)
        Count: 1
< ACL Data TX: Handle 2001 flags 0x00 dlen 21             #190 [hci1] 14.429711
      SMP: Pairing Random (0x04) len 16
        Random value: 58f6b41f855a6f6c3560debd84e2affc
> HCI Event: Number of Completed Packets (0x13) plen 5    #191 [hci1] 14.596714
        Num handles: 1
        Handle: 2001 Address: DF:A9:FF:F6:B1:1A (OUI DF-A9-FF)
        Count: 1
        #190: len 21 (1 Kb/s)
        Latency: 167 msec (70-172 msec ~167 msec)
> ACL Data RX: Handle 2001 flags 0x02 dlen 21             #192 [hci1] 14.684639
      SMP: Pairing Confirm (0x03) len 16
        Confim value: 50b7a872116664a5cd78f1ab1adada8c
< HCI Command: Host Number of Com.. (0x03|0x0035) plen 5  #193 [hci1] 14.689878
        Num handles: 1
        Handle: 2001 Address: DF:A9:FF:F6:B1:1A (OUI DF-A9-FF)
        Count: 1
< ACL Data TX: Handle 2001 flags 0x00 dlen 21             #194 [hci1] 14.690021
      SMP: Pairing Confirm (0x03) len 16
        Confim value: 31f3c130dcbd03dad43bd9d9d9a67fde
> HCI Event: Number of Completed Packets (0x13) plen 5    #195 [hci1] 14.859415
        Num handles: 1
        Handle: 2001 Address: DF:A9:FF:F6:B1:1A (OUI DF-A9-FF)
        Count: 1
        #194: len 21 (0 Kb/s)
        Latency: 169 msec (70-172 msec ~168 msec)
> ACL Data RX: Handle 2001 flags 0x02 dlen 21             #196 [hci1] 14.859778
      SMP: Pairing Random (0x04) len 16
        Random value: dbb7814831b3af950000000000000000
< HCI Command: Host Number of Com.. (0x03|0x0035) plen 5  #197 [hci1] 14.870157
        Num handles: 1
        Handle: 2001 Address: DF:A9:FF:F6:B1:1A (OUI DF-A9-FF)
        Count: 1
< ACL Data TX: Handle 2001 flags 0x00 dlen 21             #198 [hci1] 14.870288
      SMP: Pairing Random (0x04) len 16
        Random value: b67e7216d5bf664139eda2b542549666
> HCI Event: Number of Completed Packets (0x13) plen 5    #199 [hci1] 15.034156
        Num handles: 1
        Handle: 2001 Address: DF:A9:FF:F6:B1:1A (OUI DF-A9-FF)
        Count: 1
        #198: len 21 (1 Kb/s)
        Latency: 163 msec (70-172 msec ~166 msec)
> ACL Data RX: Handle 2001 flags 0x02 dlen 21             #200 [hci1] 15.122080
      SMP: Pairing Confirm (0x03) len 16
        Confim value: 236cbbbd743aaef5a52bbb07922c195b
< HCI Command: Host Number of Com.. (0x03|0x0035) plen 5  #201 [hci1] 15.129658
        Num handles: 1
        Handle: 2001 Address: DF:A9:FF:F6:B1:1A (OUI DF-A9-FF)
        Count: 1
< ACL Data TX: Handle 2001 flags 0x00 dlen 21             #202 [hci1] 15.129729
      SMP: Pairing Confirm (0x03) len 16
        Confim value: 922fb64a3d47c4363f70325e98b7f12b
> HCI Event: Number of Completed Packets (0x13) plen 5    #203 [hci1] 15.296844
        Num handles: 1
        Handle: 2001 Address: DF:A9:FF:F6:B1:1A (OUI DF-A9-FF)
        Count: 1
        #202: len 21 (1 Kb/s)
        Latency: 167 msec (70-172 msec ~166 msec)
> ACL Data RX: Handle 2001 flags 0x02 dlen 21             #204 [hci1] 15.297217
      SMP: Pairing Random (0x04) len 16
        Random value: 45a4d2c8de5d8a250000000000000000
< HCI Command: Host Number of Com.. (0x03|0x0035) plen 5  #205 [hci1] 15.310226
        Num handles: 1
        Handle: 2001 Address: DF:A9:FF:F6:B1:1A (OUI DF-A9-FF)
        Count: 1
< ACL Data TX: Handle 2001 flags 0x00 dlen 21             #206 [hci1] 15.310425
      SMP: Pairing Random (0x04) len 16
        Random value: ed17f76500c95219dd01e09d1e63f87b
> HCI Event: Number of Completed Packets (0x13) plen 5    #207 [hci1] 15.471647
        Num handles: 1
        Handle: 2001 Address: DF:A9:FF:F6:B1:1A (OUI DF-A9-FF)
        Count: 1
        #206: len 21 (1 Kb/s)
        Latency: 161 msec (70-172 msec ~163 msec)
> ACL Data RX: Handle 2001 flags 0x02 dlen 21             #208 [hci1] 15.559588
      SMP: Pairing Confirm (0x03) len 16
        Confim value: f4494b6ffb96c5bf9b905379e0bb3f24
< HCI Command: Host Number of Com.. (0x03|0x0035) plen 5  #209 [hci1] 15.569936
        Num handles: 1
        Handle: 2001 Address: DF:A9:FF:F6:B1:1A (OUI DF-A9-FF)
        Count: 1
< ACL Data TX: Handle 2001 flags 0x00 dlen 21             #210 [hci1] 15.570055
      SMP: Pairing Confirm (0x03) len 16
        Confim value: f14bd6680e5a572333da30f95b5dbaf0
> HCI Event: Number of Completed Packets (0x13) plen 5    #211 [hci1] 15.734349
        Num handles: 1
        Handle: 2001 Address: DF:A9:FF:F6:B1:1A (OUI DF-A9-FF)
        Count: 1
        #210: len 21 (1 Kb/s)
        Latency: 164 msec (70-172 msec ~164 msec)
> ACL Data RX: Handle 2001 flags 0x02 dlen 21             #212 [hci1] 15.734798
      SMP: Pairing Random (0x04) len 16
        Random value: cd712a1e0be02e9d0000000000000000
< HCI Command: Host Number of Com.. (0x03|0x0035) plen 5  #213 [hci1] 15.749644
        Num handles: 1
        Handle: 2001 Address: DF:A9:FF:F6:B1:1A (OUI DF-A9-FF)
        Count: 1
< ACL Data TX: Handle 2001 flags 0x00 dlen 21             #214 [hci1] 15.749726
      SMP: Pairing Random (0x04) len 16
        Random value: 81d35d47e1f6006d79c974bd9d9e1ee3
> HCI Event: Number of Completed Packets (0x13) plen 5    #215 [hci1] 15.909267
        Num handles: 1
        Handle: 2001 Address: DF:A9:FF:F6:B1:1A (OUI DF-A9-FF)
        Count: 1
        #214: len 21 (1 Kb/s)
        Latency: 159 msec (70-172 msec ~161 msec)
> ACL Data RX: Handle 2001 flags 0x02 dlen 21             #216 [hci1] 15.997027
      SMP: Pairing Confirm (0x03) len 16
        Confim value: 3aa1ee0337285d1b56630da384185c3f
< HCI Command: Host Number of Com.. (0x03|0x0035) plen 5  #217 [hci1] 16.009882
        Num handles: 1
        Handle: 2001 Address: DF:A9:FF:F6:B1:1A (OUI DF-A9-FF)
        Count: 1
< ACL Data TX: Handle 2001 flags 0x00 dlen 21             #218 [hci1] 16.010028
      SMP: Pairing Confirm (0x03) len 16
        Confim value: 0a7100addb3bdb1dd2df0242688a1ef2
> HCI Event: Number of Completed Packets (0x13) plen 5    #219 [hci1] 16.171808
        Num handles: 1
        Handle: 2001 Address: DF:A9:FF:F6:B1:1A (OUI DF-A9-FF)
        Count: 1
        #218: len 21 (1 Kb/s)
        Latency: 161 msec (70-172 msec ~161 msec)
> ACL Data RX: Handle 2001 flags 0x02 dlen 21             #220 [hci1] 16.172300
      SMP: Pairing Random (0x04) len 16
        Random value: 61871b45d5582e2f0000000000000000
< HCI Command: Host Number of Com.. (0x03|0x0035) plen 5  #221 [hci1] 16.190238
        Num handles: 1
        Handle: 2001 Address: DF:A9:FF:F6:B1:1A (OUI DF-A9-FF)
        Count: 1
< ACL Data TX: Handle 2001 flags 0x00 dlen 21             #222 [hci1] 16.190333
      SMP: Pairing Random (0x04) len 16
        Random value: e7f7e0c2476823e41736a7e381bafb7c
> HCI Event: Number of Completed Packets (0x13) plen 5    #223 [hci1] 16.346665
        Num handles: 1
        Handle: 2001 Address: DF:A9:FF:F6:B1:1A (OUI DF-A9-FF)
        Count: 1
        #222: len 21 (1 Kb/s)
        Latency: 156 msec (70-172 msec ~159 msec)
> ACL Data RX: Handle 2001 flags 0x02 dlen 21             #224 [hci1] 16.434510
      SMP: Pairing Confirm (0x03) len 16
        Confim value: 97da832776961e97b84dba4347849425
< HCI Command: Host Number of Com.. (0x03|0x0035) plen 5  #225 [hci1] 16.449924
        Num handles: 1
        Handle: 2001 Address: DF:A9:FF:F6:B1:1A (OUI DF-A9-FF)
        Count: 1
< ACL Data TX: Handle 2001 flags 0x00 dlen 21             #226 [hci1] 16.450056
      SMP: Pairing Confirm (0x03) len 16
        Confim value: 3836443df4da9ed09632d69da63c50d7
> HCI Event: Number of Completed Packets (0x13) plen 5    #227 [hci1] 16.609291
        Num handles: 1
        Handle: 2001 Address: DF:A9:FF:F6:B1:1A (OUI DF-A9-FF)
        Count: 1
        #226: len 21 (1 Kb/s)
        Latency: 159 msec (70-172 msec ~159 msec)
> ACL Data RX: Handle 2001 flags 0x02 dlen 21             #228 [hci1] 16.609763
      SMP: Pairing Random (0x04) len 16
        Random value: f8315c9aaa5ec3920000000000000000
