Bluetooth monitor ver 5.72
btmon[480817]: = Note: Linux version 6.14.0-36-generic (x86_64)                                                          0.101110
btmon[480817]: = Note: Bluetooth subsystem version 2.22                                                                  0.101112
= New Index: 00:00:00:00:00:00 (Primary,UART,hci1)                                                                       0.101113
= New Index: 48:5F:99:8E:E0:64 (Primary,USB,hci0)                                                                        0.101114
= Open Index: 00:00:00:00:00:00                                                                                          0.616234
= Index Info: 00:00:00:00:00:00 (Nordic Semiconductor ASA)                                                               0.616248
zephyr.exe[480819]: @ USER Open: main (privileged) version 2.22                                                 {0x0001} 0.616257
zephyr.exe[480819]: < HCI Command: Reset (0x03|0x0003) plen 0                                                         #1 0.617488
> HCI Event: Command Complete (0x0e) plen 4                                                                           #2 0.618014
      Reset (0x03|0x0003) ncmd 1
        Status: Success (0x00)
zephyr.exe[480819]: < HCI Command: Read Local Supported Features (0x04|0x0003) plen 0                                 #3 0.635838
> HCI Event: Command Complete (0x0e) plen 12                                                                          #4 0.636449
      Read Local Supported Features (0x04|0x0003) ncmd 1
        Status: Success (0x00)
        Features: 0x00 0x00 0x00 0x00 0x60 0x00 0x00 0x00
          BR/EDR Not Supported
          LE Supported (Controller)
zephyr.exe[480819]: < HCI Command: Read Local Version Information (0x04|0x0001) plen 0                                #5 0.655694
> HCI Event: Command Complete (0x0e) plen 12                                                                          #6 0.656176
      Read Local Version Information (0x04|0x0001) ncmd 1
        Status: Success (0x00)
        HCI version: Reserved (0x0e) - Revision 12520 (0x30e8)
        LMP version: Reserved (0x0e) - Subversion 12520 (0x30e8)
        Manufacturer: Nordic Semiconductor ASA (89)
zephyr.exe[480819]: < HCI Command: Read Local Supported Commands (0x04|0x0002) plen 0                                 #7 0.675654
> HCI Event: Command Complete (0x0e) plen 68                                                                          #8 0.676702
      Read Local Supported Commands (0x04|0x0002) ncmd 1
        Status: Success (0x00)
        Commands: 119 entries
          Disconnect (Octet 0 - Bit 5)
          Read Remote Version Information (Octet 2 - Bit 7)
          Set Event Mask (Octet 5 - Bit 6)
          Reset (Octet 5 - Bit 7)
          Read Connection Accept Timeout (Octet 7 - Bit 2)
          Write Connection Accept Timeout (Octet 7 - Bit 3)
          Read Transmit Power Level (Octet 10 - Bit 2)
          Set Controller To Host Flow Control (Octet 10 - Bit 5)
          Host Buffer Size (Octet 10 - Bit 6)
          Host Number of Completed Packets (Octet 10 - Bit 7)
          Read Local Version Information (Octet 14 - Bit 3)
          Read Local Supported Features (Octet 14 - Bit 5)
          Read BD ADDR (Octet 15 - Bit 1)
          Read RSSI (Octet 15 - Bit 5)
          Set Event Mask Page 2 (Octet 22 - Bit 2)
          LE Set Event Mask (Octet 25 - Bit 0)
          LE Read Buffer Size (Octet 25 - Bit 1)
          LE Read Local Supported Features (Octet 25 - Bit 2)
          LE Set Random Address (Octet 25 - Bit 4)
          LE Set Advertising Parameters (Octet 25 - Bit 5)
          LE Read Advertising Channel TX Power (Octet 25 - Bit 6)
          LE Set Advertising Data (Octet 25 - Bit 7)
          LE Set Scan Response Data (Octet 26 - Bit 0)
          LE Set Advertise Enable (Octet 26 - Bit 1)
          LE Set Scan Parameters (Octet 26 - Bit 2)
          LE Set Scan Enable (Octet 26 - Bit 3)
          LE Create Connection (Octet 26 - Bit 4)
          LE Create Connection Cancel (Octet 26 - Bit 5)
          LE Read Accept List Size (Octet 26 - Bit 6)
          LE Clear Accept List (Octet 26 - Bit 7)
          LE Add Device To Accept List (Octet 27 - Bit 0)
          LE Remove Device From Accept List (Octet 27 - Bit 1)
          LE Connection Update (Octet 27 - Bit 2)
          LE Set Host Channel Classification (Octet 27 - Bit 3)
          LE Read Channel Map (Octet 27 - Bit 4)
          LE Read Remote Used Features (Octet 27 - Bit 5)
          LE Encrypt (Octet 27 - Bit 6)
          LE Rand (Octet 27 - Bit 7)
          LE Start Encryption (Octet 28 - Bit 0)
          LE Long Term Key Request Reply (Octet 28 - Bit 1)
          LE Long Term Key Request Neg Reply (Octet 28 - Bit 2)
          LE Read Supported States (Octet 28 - Bit 3)
          LE Receiver Test (Octet 28 - Bit 4)
          LE Transmitter Test (Octet 28 - Bit 5)
          LE Test End (Octet 28 - Bit 6)
          Read Authenticated Payload Timeout (Octet 32 - Bit 4)
          Write Authenticated Payload Timeout (Octet 32 - Bit 5)
          LE Set Data Length (Octet 33 - Bit 6)
          LE Read Suggested Default Data Length (Octet 33 - Bit 7)
          LE Write Suggested Default Data Length (Octet 34 - Bit 0)
          LE Add Device To Resolving List (Octet 34 - Bit 3)
          LE Remove Device From Resolving List (Octet 34 - Bit 4)
          LE Clear Resolving List (Octet 34 - Bit 5)
          LE Read Resolving List Size (Octet 34 - Bit 6)
          LE Set Address Resolution Enable (Octet 35 - Bit 1)
          LE Set Resolvable Private Address Timeout (Octet 35 - Bit 2)
          LE Read Maximum Data Length (Octet 35 - Bit 3)
          LE Read PHY (Octet 35 - Bit 4)
          LE Set Default PHY (Octet 35 - Bit 5)
          LE Set PHY (Octet 35 - Bit 6)
          LE Enhanced Receiver Test (Octet 35 - Bit 7)
          LE Enhanced Transmitter Test (Octet 36 - Bit 0)
          LE Set Advertising Set Random Address (Octet 36 - Bit 1)
          LE Set Extended Advertising Parameters (Octet 36 - Bit 2)
          LE Set Extended Advertising Data (Octet 36 - Bit 3)
          LE Set Extended Scan Response Data (Octet 36 - Bit 4)
          LE Set Extended Advertising Enable (Octet 36 - Bit 5)
          LE Read Maximum Advertising Data Length (Octet 36 - Bit 6)
          LE Read Number of Supported Advertising Sets (Octet 36 - Bit 7)
          LE Remove Advertising Set (Octet 37 - Bit 0)
          LE Clear Advertising Sets (Octet 37 - Bit 1)
          LE Set Periodic Advertising Parameters (Octet 37 - Bit 2)
          LE Set Periodic Advertising Data (Octet 37 - Bit 3)
          LE Set Periodic Advertising Enable (Octet 37 - Bit 4)
          LE Set Extended Scan Parameters (Octet 37 - Bit 5)
          LE Set Extended Scan Enable (Octet 37 - Bit 6)
          LE Extended Create Connection (Octet 37 - Bit 7)
          LE Periodic Advertising Create Sync (Octet 38 - Bit 0)
          LE Periodic Advertising Create Sync Cancel (Octet 38 - Bit 1)
          LE Periodic Advertising Terminate Sync (Octet 38 - Bit 2)
          LE Add Device To Periodic Advertiser List (Octet 38 - Bit 3)
          LE Remove Device From Periodic Advertiser List (Octet 38 - Bit 4)
          LE Clear Periodic Advertiser List (Octet 38 - Bit 5)
          LE Read Periodic Advertiser List Size (Octet 38 - Bit 6)
          LE Read Transmit Power (Octet 38 - Bit 7)
          LE Read RF Path Compensation (Octet 39 - Bit 0)
          LE Write RF Path Compensation (Octet 39 - Bit 1)
          LE Set Privacy Mode (Octet 39 - Bit 2)
          LE Periodic Advertising Receive Enable (Octet 40 - Bit 5)
          LE Periodic Advertising Sync Transfer (Octet 40 - Bit 6)
          LE Periodic Advertising Set Info Transfer (Octet 40 - Bit 7)
          LE Periodic Advertising Sync Transfer Parameters (Octet 41 - Bit 0)
          LE Set Default Periodic Advertisng Sync Transfer Parameters (Octet 41 - Bit 1)
          LE Read Buffer v2 (Octet 41 - Bit 5)
          LE Read ISO TX Sync (Octet 41 - Bit 6)
          LE Set Connected Isochronous Group Parameters (Octet 41 - Bit 7)
          LE Set Connected Isochronous Group Parameters Test (Octet 42 - Bit 0)
          LE Create Connected Isochronous Stream (Octet 42 - Bit 1)
          LE Remove Connected Isochronous Group (Octet 42 - Bit 2)
          LE Accept Connected Isochronous Stream Request (Octet 42 - Bit 3)
          LE Reject Connected Isochronous Stream Request (Octet 42 - Bit 4)
          LE Create Broadcast Isochronous Group (Octet 42 - Bit 5)
          LE Create Broadcast Isochronous Group Test (Octet 42 - Bit 6)
          LE Terminate Broadcast Isochronous Group (Octet 42 - Bit 7)
          LE Broadcast Isochronous Group Create Sync (Octet 43 - Bit 0)
          LE Broadcast Isochronous Group Terminate Sync (Octet 43 - Bit 1)
          LE Request Peer SCA (Octet 43 - Bit 2)
          LE Setup Isochronous Data Path (Octet 43 - Bit 3)
          LE Remove Isochronous Data Path (Octet 43 - Bit 4)
          LE Isochronous Transmit Test (Octet 43 - Bit 5)
          LE Isochronous Receive Test (Octet 43 - Bit 6)
          LE Isochronous Read Test Counters (Octet 43 - Bit 7)
          LE Isochronous Read Test Counters (Octet 44 - Bit 0)
          LE Set Host Feature (Octet 44 - Bit 1)
          Octet 44 - Bit 2 
          Octet 45 - Bit 6 
          Octet 46 - Bit 0 
          Octet 46 - Bit 1 
          Octet 46 - Bit 2 
zephyr.exe[480819]: < HCI Command: Host Buffer Size (0x03|0x0033) plen 7                                              #9 0.695651
        ACL MTU: 255  ACL max packet: 16
        SCO MTU: 0    SCO max packet: 0
> HCI Event: Command Complete (0x0e) plen 4                                                                          #10 0.696159
      Host Buffer Size (0x03|0x0033) ncmd 1
        Status: Success (0x00)
zephyr.exe[480819]: < HCI Command: Set Controller To Host Flow Control (0x03|0x0031) plen 1                          #11 0.715656
        Flow control: ACL Data Packets (0x01)
> HCI Event: Command Complete (0x0e) plen 4                                                                          #12 0.716080
      Set Controller To Host Flow Control (0x03|0x0031) ncmd 1
        Status: Success (0x00)
zephyr.exe[480819]: < HCI Command: LE Read Local Supported Features (0x08|0x0003) plen 0                             #13 0.735651
> HCI Event: Command Complete (0x0e) plen 12                                                                         #14 0.736235
      LE Read Local Supported Features (0x08|0x0003) ncmd 1
        Status: Success (0x00)
        Features: 0xfd 0x79 0x00 0xf7 0x30 0x01 0x00 0x00
          LE Encryption
          Extended Reject Indication
          Peripheral-initiated Features Exchange
          LE Ping
          LE Data Packet Length Extension
          LL Privacy
          Extended Scanner Filter Policies
          LE 2M PHY
          LE Coded PHY
          LE Extended Advertising
          LE Periodic Advertising
          Channel Selection Algorithm #2
          Periodic Advertising Sync Transfer - Sender
          Periodic Advertising Sync Transfer - Recipient
          Sleep Clock Accuracy Updates
          Connected Isochronous Stream - Central
          Connected Isochronous Stream - Peripheral
          Isochronous Broadcaster
          Synchronized Receiver
          Periodic Advertising ADI support
          Connection Subrating
          Unknown features (0x0000010000000000)
zephyr.exe[480819]: < HCI Command: LE Set Host Feature (0x08|0x0074) plen 2                                          #15 0.755656
        Bit Number: 32
          Connected Isochronous Stream (Host Support)
        Bit Value: 1
> HCI Event: Command Complete (0x0e) plen 4                                                                          #16 0.756132
      LE Set Host Feature (0x08|0x0074) ncmd 1
        Status: Success (0x00)
zephyr.exe[480819]: < HCI Command: LE Read Buffer v2 (0x08|0x0060) plen 0                                            #17 0.775646
> HCI Event: Command Complete (0x0e) plen 10                                                                         #18 0.776129
      LE Read Buffer v2 (0x08|0x0060) ncmd 1
        Status: Success (0x00)
        ACL MTU: 27
        ACL max packet: 3
        ISO MTU: 318
        ISO max packet: 3
zephyr.exe[480819]: < HCI Command: LE Read Maximum Advertising Data Length (0x08|0x003a) plen 0                      #19 0.795677
> HCI Event: Command Complete (0x0e) plen 6                                                                          #20 0.796067
      LE Read Maximum Advertising Data Length (0x08|0x003a) ncmd 1
        Status: Success (0x00)
        Max length: 1650
zephyr.exe[480819]: < HCI Command: LE Read Supported States (0x08|0x001c) plen 0                                     #21 0.815620
> HCI Event: Command Complete (0x0e) plen 12                                                                         #22 0.816054
      LE Read Supported States (0x08|0x001c) ncmd 1
        Status: Success (0x00)
        States: 0x000003ff3e0306ff
          Non-connectable Advertising State
          Scannable Advertising State
          Connectable Advertising State
          High Duty Cycle Directed Advertising State
          Passive Scanning State
          Active Scanning State
          Initiating State
            and Connection State (Central Role)
          Connection State (Peripheral Role)
          Scannable Advertising State
            and Passive Scanning State
          Connectable Advertising State
            and Passive Scanning State
          Non-connectable Advertising State
            and Initiating State
          Scannable Advertising State
            and Initiating State
          Active Scanning State
            and Connection State (Central Role)
          Passive Scanning State
            and Connection State (Peripheral Role)
          Active Scanning State
            and Connection State (Peripheral Role)
          Initiating State
            and Connection State (Central Role)
            and Central Role & Central Role
          Low Duty Cycle Directed Advertising State
          Connectable Advertising State
            and Initiating State
            and Central Role & Peripheral Role
          High Duty Cycle Directed Advertising State
            and Initiating State
            and Central Role & Peripheral Role
          Low Duty Cycle Directed Advertising State
            and Initiating State
            and Central Role & Peripheral Role
          Connectable Advertising State
            and Connection State (Central Role)
            and Central Role & Peripheral Role
          High Duty Cycle Directed Advertising State
            and Connection State (Central Role)
            and Central Role & Peripheral Role
          Low Duty Cycle Directed Advertising State
            and Connection State (Central Role)
            and Central Role & Peripheral Role
          Connectable Advertising State
            and Connection State (Peripheral Role)
            and Central Role & Peripheral Role
          High Duty Cycle Directed Advertising State
            and Connection State (Peripheral Role)
            and Peripheral Role & Peripheral Role
          Low Duty Cycle Directed Advertising State
            and Connection State (Peripheral Role)
            and Peripheral Role & Peripheral Role
          Initiating State
            and Connection State (Peripheral Role)
            and Central Role & Peripheral Role
zephyr.exe[480819]: < HCI Command: LE Read Maximum Data Length (0x08|0x002f) plen 0                                  #23 0.835645
> HCI Event: Command Complete (0x0e) plen 12                                                                         #24 0.836074
      LE Read Maximum Data Length (0x08|0x002f) ncmd 1
        Status: Success (0x00)
        Max TX octets: 251
        Max TX time: 2704
        Max RX octets: 251
        Max RX time: 2704
zephyr.exe[480819]: < HCI Command: LE Write Suggested Default Data Length (0x08|0x0024) plen 4                       #25 0.855619
        TX octets: 251
        TX time: 2704
> HCI Event: Command Complete (0x0e) plen 4                                                                          #26 0.856104
      LE Write Suggested Default Data Length (0x08|0x0024) ncmd 1
        Status: Success (0x00)
zephyr.exe[480819]: < HCI Command: LE Read Resolving List Size (0x08|0x002a) plen 0                                  #27 0.875653
> HCI Event: Command Complete (0x0e) plen 5                                                                          #28 0.876095
      LE Read Resolving List Size (0x08|0x002a) ncmd 1
        Status: Success (0x00)
        Size: 8
zephyr.exe[480819]: < HCI Command: LE Set Event Mask (0x08|0x0001) plen 8                                            #29 0.895650
        Mask: 0x000002023f87fa5e
          LE Advertising Report
          LE Connection Update Complete
          LE Read Remote Used Features Complete
          LE Long Term Key Request
          LE Data Length Change
          LE Enhanced Connection Complete
          LE PHY Update Complete
          LE Extended Advertising Report
          LE Periodic Advertising Sync Established
          LE Periodic Advertising Report
          LE Periodic Advertising Sync Lost
          LE Extended Scan Timeout
          LE Extended Advertising Set Terminated
          LE Scan Request Received
          LE Periodic Advertising Sync Transfer Rvc
          LE CIS Established
          LE CIS Request
          LE Create BIG Complete
          LE Terminate BIG Complete
          LE BIG Sync Estabilished Complete
          LE BIG Sync Lost
          LE BIG Info Advertising Report
          Unknown mask (0x0000020000000000)
> HCI Event: Command Complete (0x0e) plen 4                                                                          #30 0.896247
      LE Set Event Mask (0x08|0x0001) ncmd 1
        Status: Success (0x00)
zephyr.exe[480819]: < HCI Command: Set Event Mask (0x03|0x0001) plen 8                                               #31 0.915653
        Mask: 0x2000800002008890
          Disconnection Complete
          Encryption Change
          Read Remote Version Information Complete
          Hardware Error
          Data Buffer Overflow
          Encryption Key Refresh Complete
          LE Meta
> HCI Event: Command Complete (0x0e) plen 4                                                                          #32 0.916165
      Set Event Mask (0x03|0x0001) ncmd 1
        Status: Success (0x00)
zephyr.exe[480819]: < HCI Command: Read BD ADDR (0x04|0x0009) plen 0                                                 #33 0.935658
> HCI Event: Command Complete (0x0e) plen 10                                                                         #34 0.936174
      Read BD ADDR (0x04|0x0009) ncmd 1
        Status: Success (0x00)
        Address: 00:00:00:00:00:00 (OUI 00-00-00)
zephyr.exe[480819]: < HCI Command: LE Set Random Address (0x08|0x0005) plen 6                                        #35 0.955661
        Address: D5:B6:CC:31:DB:3B (Static)
> HCI Event: Command Complete (0x0e) plen 4                                                                          #36 0.956136
      LE Set Random Address (0x08|0x0005) ncmd 1
        Status: Success (0x00)
zephyr.exe[480819]: < HCI Command: LE Set Extended Advertising Parameters (0x08|0x0036) plen 25                      #37 3.676255
        Handle: 0x00
        Properties: 0x0001
          Connectable
        Min advertising interval: 100.000 msec (0x00a0)
        Max advertising interval: 150.000 msec (0x00f0)
        Channel map: 37, 38, 39 (0x07)
        Own address type: Random (0x01)
        Peer address type: Public (0x00)
        Peer address: 00:00:00:00:00:00 (OUI 00-00-00)
        Filter policy: Allow Scan Request from Any, Allow Connect Request from Any (0x00)
        TX power: Host has no preference (0x7f)
        Primary PHY: LE 1M (0x01)
        Secondary max skip: 0x00
        Secondary PHY: LE 2M (0x02)
        SID: 0x00
        Scan request notifications: Disabled (0x00)
> HCI Event: Command Complete (0x0e) plen 5                                                                          #38 3.677089
      LE Set Extended Advertising Parameters (0x08|0x0036) ncmd 1
        Status: Success (0x00)
        TX power (selected): 0 dbm (0x00)
zephyr.exe[480819]: < HCI Command: LE Set Advertising Set Random Address (0x08|0x0035) plen 7                        #39 3.695773
        Advertising handle: 0x00
        Advertising random address: D5:B6:CC:31:DB:3B (Static)
> HCI Event: Command Complete (0x0e) plen 4                                                                          #40 3.696329
      LE Set Advertising Set Random Address (0x08|0x0035) ncmd 1
        Status: Success (0x00)
zephyr.exe[480819]: < HCI Command: LE Set Extended Advertising Data (0x08|0x0037) plen 39                            #41 3.715676
        Handle: 0x00
        Operation: Complete extended advertising data (0x03)
        Fragment preference: Minimize fragmentation (0x01)
        Data length: 0x23
        Flags: 0x06
          LE General Discoverable Mode
          BR/EDR Not Supported
        Name (complete): Tester_F6B11A
        Flags: 0x06
          LE General Discoverable Mode
          BR/EDR Not Supported
        16-bit Service UUIDs (complete): 1 entry
          Audio Stream Control (0x184e)
        Service Data: Audio Stream Control (0x184e)
          Data: 01ff0fff0f00
> HCI Event: Command Complete (0x0e) plen 4                                                                          #42 3.716595
      LE Set Extended Advertising Data (0x08|0x0037) ncmd 1
        Status: Success (0x00)
zephyr.exe[480819]: < HCI Command: LE Set Extended Advertising Enable (0x08|0x0039) plen 6                           #43 3.735676
        Extended advertising: Enabled (0x01)
        Number of sets: 1 (0x01)
        Entry 0
          Handle: 0x00
          Duration: 0 ms (0x00)
          Max ext adv events: 0
> HCI Event: Command Complete (0x0e) plen 4                                                                          #44 3.736303
      LE Set Extended Advertising Enable (0x08|0x0039) ncmd 1
        Status: Success (0x00)
> HCI Event: LE Meta Event (0x3e) plen 31                                                                            #45 3.854095
      LE Enhanced Connection Complete (0x0a)
        Status: Success (0x00)
        Handle: 75
        Role: Peripheral (0x01)
        Peer address type: Public (0x00)
        Peer address: DF:A9:FF:F6:B1:1A (OUI DF-A9-FF)
        Local resolvable private address: 00:00:00:00:00:00 (Non-Resolvable)
        Peer resolvable private address: 00:00:00:00:00:00 (Non-Resolvable)
        Connection interval: 60.00 msec (0x0030)
        Connection latency: 0 (0x0000)
        Supervision timeout: 25120 msec (0x09d0)
        Central clock accuracy: 0x01
> HCI Event: LE Meta Event (0x3e) plen 6                                                                             #46 3.854103
      LE Advertising Set Terminated (0x12)
        Status: Success (0x00)
        Handle: 0
        Connection handle: 75
        Number of completed extended advertising events: 0
zephyr.exe[480819]: < HCI Command: LE Read Remote Used Features (0x08|0x0016) plen 2                                 #47 3.856735
        Handle: 75 Address: DF:A9:FF:F6:B1:1A (OUI DF-A9-FF)
zephyr.exe[480819]: < ACL Data TX: Handle 75 flags 0x00 dlen 7                                                       #48 3.856755
      ATT: Exchange MTU Request (0x02) len 2
        Client RX MTU: 251
> HCI Event: Command Status (0x0f) plen 4                                                                            #49 3.857276
      LE Read Remote Used Features (0x08|0x0016) ncmd 1
        Status: Success (0x00)
> HCI Event: Number of Completed Packets (0x13) plen 5                                                               #50 3.976025
        Num handles: 1
        Handle: 75 Address: DF:A9:FF:F6:B1:1A (OUI DF-A9-FF)
        Count: 1
        #48: len 7 (0 Kb/s)
        Latency: 119 msec (119-119 msec ~119 msec)
> HCI Event: LE Meta Event (0x3e) plen 12                                                                            #51 4.036247
      LE Read Remote Used Features (0x04)
        Status: Success (0x00)
        Handle: 75 Address: DF:A9:FF:F6:B1:1A (OUI DF-A9-FF)
        Features: 0x2d 0x49 0x00 0xf7 0x67 0xd8 0x00 0x00
          LE Encryption
          Extended Reject Indication
          Peripheral-initiated Features Exchange
          LE Data Packet Length Extension
          LE 2M PHY
          LE Coded PHY
          Channel Selection Algorithm #2
          Periodic Advertising Sync Transfer - Sender
          Periodic Advertising Sync Transfer - Recipient
          Sleep Clock Accuracy Updates
          Connected Isochronous Stream - Central
          Connected Isochronous Stream - Peripheral
          Isochronous Broadcaster
          Synchronized Receiver
          Connected Isochronous Stream (Host Support)
          LE Power Control Request
          LE Power Control Request
          Connection Subrating
          Connection Subrating (Host Support)
          Unknown features (0x0000d80000000000)
> ACL Data RX: Handle 75 flags 0x02 dlen 7                                                                           #52 4.335988
      ATT: Exchange MTU Request (0x02) len 2
        Client RX MTU: 64
> ACL Data RX: Handle 75 flags 0x02 dlen 7                                                                           #53 4.336385
      ATT: Exchange MTU Response (0x03) len 2
        Server RX MTU: 64
zephyr.exe[480819]: < HCI Command: Host Number of Completed Packets (0x03|0x0035) plen 5                             #54 4.356278
        Num handles: 1
        Handle: 75 Address: DF:A9:FF:F6:B1:1A (OUI DF-A9-FF)
        Count: 1
zephyr.exe[480819]: < ACL Data TX: Handle 75 flags 0x00 dlen 7                                                       #55 4.356529
      ATT: Exchange MTU Response (0x03) len 2
        Server RX MTU: 251
zephyr.exe[480819]: < HCI Command: Host Number of Completed Packets (0x03|0x0035) plen 5                             #56 4.356728
        Num handles: 1
        Handle: 75 Address: DF:A9:FF:F6:B1:1A (OUI DF-A9-FF)
        Count: 1
> HCI Event: Number of Completed Packets (0x13) plen 5                                                               #57 4.455960
        Num handles: 1
        Handle: 75 Address: DF:A9:FF:F6:B1:1A (OUI DF-A9-FF)
        Count: 1
        #55: len 7 (0 Kb/s)
        Latency: 99 msec (99-119 msec ~109 msec)
> ACL Data RX: Handle 75 flags 0x02 dlen 11                                                                          #58 6.435985
      SMP: Pairing Request (0x01) len 6
        IO capability: KeyboardDisplay (0x04)
        OOB data: Authentication data not present (0x00)
        Authentication requirement: Bonding, No MITM, SC, No Keypresses (0x09)
        Max encryption key size: 16
        Initiator key distribution: EncKey IdKey (0x03)
        Responder key distribution: EncKey IdKey Sign (0x07)
zephyr.exe[480819]: < HCI Command: Host Number of Completed Packets (0x03|0x0035) plen 5                             #59 6.456148
        Num handles: 1
        Handle: 75 Address: DF:A9:FF:F6:B1:1A (OUI DF-A9-FF)
        Count: 1
zephyr.exe[480819]: < ACL Data TX: Handle 75 flags 0x00 dlen 11                                                      #60 6.456368
      SMP: Pairing Response (0x02) len 6
        IO capability: NoInputNoOutput (0x03)
        OOB data: Authentication data not present (0x00)
        Authentication requirement: Bonding, No MITM, SC, No Keypresses (0x09)
        Max encryption key size: 16
        Initiator key distribution: IdKey (0x02)
        Responder key distribution: <none> (0x00)
> HCI Event: Number of Completed Packets (0x13) plen 5                                                               #61 6.556037
        Num handles: 1
        Handle: 75 Address: DF:A9:FF:F6:B1:1A (OUI DF-A9-FF)
        Count: 1
        #60: len 11 (0 Kb/s)
        Latency: 99 msec (99-119 msec ~104 msec)
> ACL Data RX: Handle 75 flags 0x02 dlen 27                                                                          #62 6.556320
> ACL Data RX: Handle 75 flags 0x01 dlen 27                                                                          #63 6.556723
> ACL Data RX: Handle 75 flags 0x01 dlen 15                                                                          #64 6.557005
      SMP: Pairing Public Key (0x0c) len 64
        X: e78da3107661bc3c692d031eed927a50f70ee3ad399dec9d552347c6efadc114
        Y: 097e8fd3cda557c68e108da1b14a70fab6351a99ca65973db65102ed90055859
zephyr.exe[480819]: < HCI Command: Host Number of Completed Packets (0x03|0x0035) plen 5                             #65 6.576075
        Num handles: 1
        Handle: 75 Address: DF:A9:FF:F6:B1:1A (OUI DF-A9-FF)
        Count: 1
zephyr.exe[480819]: < HCI Command: Host Number of Completed Packets (0x03|0x0035) plen 5                             #66 6.576142
        Num handles: 1
        Handle: 75 Address: DF:A9:FF:F6:B1:1A (OUI DF-A9-FF)
        Count: 1
zephyr.exe[480819]: < HCI Command: Host Number of Completed Packets (0x03|0x0035) plen 5                             #67 6.576282
        Num handles: 1
        Handle: 75 Address: DF:A9:FF:F6:B1:1A (OUI DF-A9-FF)
        Count: 1
zephyr.exe[480819]: < ACL Data TX: Handle 75 flags 0x00 dlen 27                                                      #68 6.576364
zephyr.exe[480819]: < ACL Data TX: Handle 75 flags 0x01 dlen 27                                                      #69 6.576369
zephyr.exe[480819]: < ACL Data TX: Handle 75 flags 0x01 dlen 15                                                      #70 6.576380
      SMP: Pairing Public Key (0x0c) len 64
        X: 98308440221e2d910f0e54b71e7ec652857aa9b5a0dc65028824cc19db1226e9
        Y: 67a4816bcb62efb21701e31fdb27561a6217575fb007a8bbdabe7e28b6f68482
> HCI Event: Number of Completed Packets (0x13) plen 5                                                               #71 6.616367
        Num handles: 1
        Handle: 75 Address: DF:A9:FF:F6:B1:1A (OUI DF-A9-FF)
        Count: 1
        #68: len 27 (5 Kb/s)
        Latency: 40 msec (40-119 msec ~72 msec)
> HCI Event: Number of Completed Packets (0x13) plen 5                                                               #72 6.616816
        Num handles: 1
        Handle: 75 Address: DF:A9:FF:F6:B1:1A (OUI DF-A9-FF)
        Count: 1
        #69: len 27 (5 Kb/s)
        Latency: 40 msec (40-119 msec ~56 msec)
zephyr.exe[480819]: < ACL Data TX: Handle 75 flags 0x00 dlen 21                                                      #73 6.635984
      SMP: Pairing Confirm (0x03) len 16
        Confim value: 56c9f425b1d0123273a1d01178b54296
> HCI Event: Number of Completed Packets (0x13) plen 5                                                               #74 6.675817
        Num handles: 1
        Handle: 75 Address: DF:A9:FF:F6:B1:1A (OUI DF-A9-FF)
        Count: 1
        #70: len 15 (1 Kb/s)
        Latency: 99 msec (40-119 msec ~77 msec)
> HCI Event: Number of Completed Packets (0x13) plen 5                                                               #75 6.736068
        Num handles: 1
        Handle: 75 Address: DF:A9:FF:F6:B1:1A (OUI DF-A9-FF)
        Count: 1
        #73: len 21 (1 Kb/s)
        Latency: 100 msec (40-119 msec ~88 msec)
> ACL Data RX: Handle 75 flags 0x02 dlen 21                                                                          #76 6.736298
      SMP: Pairing Random (0x04) len 16
        Random value: 35ccb16695f7a3330000000000000000
zephyr.exe[480819]: < HCI Command: Host Number of Completed Packets (0x03|0x0035) plen 5                             #77 6.756365
        Num handles: 1
        Handle: 75 Address: DF:A9:FF:F6:B1:1A (OUI DF-A9-FF)
        Count: 1
zephyr.exe[480819]: < ACL Data TX: Handle 75 flags 0x00 dlen 21                                                      #78 6.756436
      SMP: Pairing Random (0x04) len 16
        Random value: 8e6108f966a694cbe26df70bb96773e6
> HCI Event: Number of Completed Packets (0x13) plen 5                                                               #79 6.855810
        Num handles: 1
        Handle: 75 Address: DF:A9:FF:F6:B1:1A (OUI DF-A9-FF)
        Count: 1
        #78: len 21 (1 Kb/s)
        Latency: 99 msec (40-119 msec ~94 msec)
> ACL Data RX: Handle 75 flags 0x02 dlen 21                                                                          #80 7.096197
      SMP: Pairing DHKey Check (0x0d) len 16
        E: 1393c486b91700ec80458619b22f3722
zephyr.exe[480819]: < HCI Command: Host Number of Completed Packets (0x03|0x0035) plen 5                             #81 7.116518
        Num handles: 1
        Handle: 75 Address: DF:A9:FF:F6:B1:1A (OUI DF-A9-FF)
        Count: 1
zephyr.exe[480819]: < ACL Data TX: Handle 75 flags 0x00 dlen 21                                                      #82 7.116725
      SMP: Pairing DHKey Check (0x0d) len 16
        E: 346e51257b5eb24db9d98f8b25390add
> HCI Event: Number of Completed Packets (0x13) plen 5                                                               #83 7.215888
        Num handles: 1
        Handle: 75 Address: DF:A9:FF:F6:B1:1A (OUI DF-A9-FF)
        Count: 1
        #82: len 21 (1 Kb/s)
        Latency: 99 msec (40-119 msec ~96 msec)
> HCI Event: LE Meta Event (0x3e) plen 13                                                                            #84 7.336331
      LE Long Term Key Request (0x05)
        Handle: 75 Address: DF:A9:FF:F6:B1:1A (OUI DF-A9-FF)
        Random number: 0x0000000000000000
        Encrypted diversifier: 0x0000
zephyr.exe[480819]: < HCI Command: LE Long Term Key Request Reply (0x08|0x001a) plen 18                              #85 7.356092
        Handle: 75 Address: DF:A9:FF:F6:B1:1A (OUI DF-A9-FF)
        Long term key: d3d7cf8f4401f3a9148626622cf97e92
> HCI Event: Command Complete (0x0e) plen 6                                                                          #86 7.356910
      LE Long Term Key Request Reply (0x08|0x001a) ncmd 1
        Status: Success (0x00)
        Handle: 75 Address: DF:A9:FF:F6:B1:1A (OUI DF-A9-FF)
> HCI Event: Encryption Change (0x08) plen 4                                                                         #87 7.636099
        Status: Success (0x00)
        Handle: 75 Address: DF:A9:FF:F6:B1:1A (OUI DF-A9-FF)
        Encryption: Enabled with AES-CCM (0x01)
> ACL Data RX: Handle 75 flags 0x02 dlen 21                                                                          #88 7.696148
      SMP: Identity Information (0x08) len 16
        Identity resolving key: 1ae28326566c6b1cb1eb825aa43f3473
zephyr.exe[480819]: < HCI Command: Host Number of Completed Packets (0x03|0x0035) plen 5                             #89 7.766543
        Num handles: 1
        Handle: 75 Address: DF:A9:FF:F6:B1:1A (OUI DF-A9-FF)
        Count: 1
> ACL Data RX: Handle 75 flags 0x02 dlen 12                                                                          #90 7.816032
      SMP: Identity Address Information (0x09) len 7
        Address: DF:A9:FF:F6:B1:1A (OUI DF-A9-FF)
zephyr.exe[480819]: < HCI Command: LE Add Device To Resolving List (0x08|0x0027) plen 39                             #91 7.836280
        Address type: Public (0x00)
        Address: DF:A9:FF:F6:B1:1A (OUI DF-A9-FF)
        Peer identity resolving key: 1ae28326566c6b1cb1eb825aa43f3473
        Local identity resolving key: 00000000000000000000000000000000
> HCI Event: Command Complete (0x0e) plen 4                                                                          #92 7.837259
      LE Add Device To Resolving List (0x08|0x0027) ncmd 1
        Status: Success (0x00)
zephyr.exe[480819]: < HCI Command: LE Set Privacy Mode (0x08|0x004e) plen 8                                          #93 7.856094
        Peer Identity address type: Public (0x00)
        Peer Identity address: DF:A9:FF:F6:B1:1A (OUI DF-A9-FF)
        Privacy Mode: Use Device Privacy (0x01)
> HCI Event: Command Complete (0x0e) plen 4                                                                          #94 7.856688
      LE Set Privacy Mode (0x08|0x004e) ncmd 1
        Status: Success (0x00)
> ACL Data RX: Handle 75 flags 0x02 dlen 13                                                                          #95 7.876034
      ATT: Find By Type Value Request (0x06) len 8
        Handle range: 0x0001-0xffff
        Attribute type: Primary Service (0x2800)
          UUID: Broadcast Audio Scan (0x184f)
zephyr.exe[480819]: < HCI Command: LE Set Address Resolution Enable (0x08|0x002d) plen 1                             #96 7.876125
        Address resolution: Enabled (0x01)
> HCI Event: Command Complete (0x0e) plen 4                                                                          #97 7.876664
      LE Set Address Resolution Enable (0x08|0x002d) ncmd 1
        Status: Success (0x00)
zephyr.exe[480819]: < HCI Command: Host Number of Completed Packets (0x03|0x0035) plen 5                             #98 7.895974
        Num handles: 1
        Handle: 75 Address: DF:A9:FF:F6:B1:1A (OUI DF-A9-FF)
        Count: 1
zephyr.exe[480819]: < HCI Command: Host Number of Completed Packets (0x03|0x0035) plen 5                             #99 7.896464
        Num handles: 1
        Handle: 75 Address: DF:A9:FF:F6:B1:1A (OUI DF-A9-FF)
        Count: 1
zephyr.exe[480819]: < ACL Data TX: Handle 75 flags 0x00 dlen 9                                                      #100 7.896670
      ATT: Find By Type Value Response (0x07) len 4
        Handle range: 0x0047-0x004c
> HCI Event: Number of Completed Packets (0x13) plen 5                                                              #101 7.995939
        Num handles: 1
        Handle: 75 Address: DF:A9:FF:F6:B1:1A (OUI DF-A9-FF)
        Count: 1
        #100: len 9 (0 Kb/s)
        Latency: 99 msec (40-119 msec ~97 msec)
> ACL Data RX: Handle 75 flags 0x02 dlen 13                                                                         #102 7.996222
      ATT: Find By Type Value Request (0x06) len 8
        Handle range: 0x004d-0xffff
        Attribute type: Primary Service (0x2800)
          UUID: Broadcast Audio Scan (0x184f)
zephyr.exe[480819]: < HCI Command: Host Number of Completed Packets (0x03|0x0035) plen 5                            #103 8.016348
        Num handles: 1
        Handle: 75 Address: DF:A9:FF:F6:B1:1A (OUI DF-A9-FF)
        Count: 1
zephyr.exe[480819]: < ACL Data TX: Handle 75 flags 0x00 dlen 9                                                      #104 8.016484
      ATT: Error Response (0x01) len 4
        Find By Type Value Request (0x06)
        Handle: 0x004d
        Error: Attribute Not Found (0x0a)
> HCI Event: Number of Completed Packets (0x13) plen 5                                                              #105 8.115881
        Num handles: 1
        Handle: 75 Address: DF:A9:FF:F6:B1:1A (OUI DF-A9-FF)
        Count: 1
        #104: len 9 (0 Kb/s)
        Latency: 99 msec (40-119 msec ~98 msec)
> ACL Data RX: Handle 75 flags 0x02 dlen 11                                                                         #106 8.116142
      ATT: Read By Type Request (0x08) len 6
        Handle range: 0x0047-0x004c
        Attribute type: Characteristic (0x2803)
zephyr.exe[480819]: < HCI Command: Host Number of Completed Packets (0x03|0x0035) plen 5                            #107 8.136330
        Num handles: 1
        Handle: 75 Address: DF:A9:FF:F6:B1:1A (OUI DF-A9-FF)
        Count: 1
zephyr.exe[480819]: < ACL Data TX: Handle 75 flags 0x00 dlen 20                                                     #108 8.136401
      ATT: Read By Type Response (0x09) len 15
        Attribute data length: 7
        Attribute data list: 2 entries
        Handle: 0x0048
        Value: 0c4900c72b
            Properties: 0x0c
              Write Without Response (0x04)
              Write (0x08)
            Value Handle: 0x0049
            Value UUID: Broadcast Audio Scan Control Point (0x2bc7)
        Handle: 0x004a
        Value: 124b00c82b
            Properties: 0x12
              Read (0x02)
              Notify (0x10)
            Value Handle: 0x004b
            Value UUID: Broadcast Receive State (0x2bc8)
> HCI Event: Number of Completed Packets (0x13) plen 5                                                              #109 8.235985
        Num handles: 1
        Handle: 75 Address: DF:A9:FF:F6:B1:1A (OUI DF-A9-FF)
        Count: 1
        #108: len 20 (1 Kb/s)
        Latency: 99 msec (40-119 msec ~99 msec)
> ACL Data RX: Handle 75 flags 0x02 dlen 11                                                                         #110 8.236159
      ATT: Read By Type Request (0x08) len 6
        Handle range: 0x004b-0x004c
        Attribute type: Characteristic (0x2803)
zephyr.exe[480819]: < HCI Command: Host Number of Completed Packets (0x03|0x0035) plen 5                            #111 8.256236
        Num handles: 1
        Handle: 75 Address: DF:A9:FF:F6:B1:1A (OUI DF-A9-FF)
        Count: 1
zephyr.exe[480819]: < ACL Data TX: Handle 75 flags 0x00 dlen 9                                                      #112 8.256375
      ATT: Error Response (0x01) len 4
        Read By Type Request (0x08)
        Handle: 0x004b
        Error: Attribute Not Found (0x0a)
> HCI Event: Number of Completed Packets (0x13) plen 5                                                              #113 8.355983
        Num handles: 1
        Handle: 75 Address: DF:A9:FF:F6:B1:1A (OUI DF-A9-FF)
        Count: 1
        #112: len 9 (0 Kb/s)
        Latency: 99 msec (40-119 msec ~99 msec)
> ACL Data RX: Handle 75 flags 0x02 dlen 9                                                                          #114 8.356065
      ATT: Find Information Request (0x04) len 4
        Handle range: 0x004c-0x004c
zephyr.exe[480819]: < HCI Command: Host Number of Completed Packets (0x03|0x0035) plen 5                            #115 8.376341
        Num handles: 1
        Handle: 75 Address: DF:A9:FF:F6:B1:1A (OUI DF-A9-FF)
        Count: 1
zephyr.exe[480819]: < ACL Data TX: Handle 75 flags 0x00 dlen 10                                                     #116 8.376421
      ATT: Find Information Response (0x05) len 5
        Format: UUID-16 (0x01)
        Handle: 0x004c
        UUID: Client Characteristic Configuration (0x2902)
> HCI Event: Number of Completed Packets (0x13) plen 5                                                              #117 8.475942
        Num handles: 1
        Handle: 75 Address: DF:A9:FF:F6:B1:1A (OUI DF-A9-FF)
        Count: 1
        #116: len 10 (0 Kb/s)
        Latency: 99 msec (40-119 msec ~99 msec)
> ACL Data RX: Handle 75 flags 0x02 dlen 9                                                                          #118 8.476196
      ATT: Write Request (0x12) len 4
        Handle: 0x004c
          Data: 0000
zephyr.exe[480819]: < HCI Command: Host Number of Completed Packets (0x03|0x0035) plen 5                            #119 8.496399
        Num handles: 1
        Handle: 75 Address: DF:A9:FF:F6:B1:1A (OUI DF-A9-FF)
        Count: 1
zephyr.exe[480819]: < ACL Data TX: Handle 75 flags 0x00 dlen 5                                                      #120 8.496588
      ATT: Write Response (0x13) len 0
> HCI Event: Number of Completed Packets (0x13) plen 5                                                              #121 8.595920
        Num handles: 1
        Handle: 75 Address: DF:A9:FF:F6:B1:1A (OUI DF-A9-FF)
        Count: 1
        #120: len 5 (0 Kb/s)
        Latency: 99 msec (40-119 msec ~99 msec)
> ACL Data RX: Handle 75 flags 0x02 dlen 9                                                                          #122 8.596046
      ATT: Write Request (0x12) len 4
        Handle: 0x004c
          Data: 0100
zephyr.exe[480819]: < HCI Command: Host Number of Completed Packets (0x03|0x0035) plen 5                            #123 8.616380
        Num handles: 1
        Handle: 75 Address: DF:A9:FF:F6:B1:1A (OUI DF-A9-FF)
        Count: 1
zephyr.exe[480819]: < ACL Data TX: Handle 75 flags 0x00 dlen 5                                                      #124 8.616521
      ATT: Write Response (0x13) len 0
> HCI Event: Number of Completed Packets (0x13) plen 5                                                              #125 8.715825
        Num handles: 1
        Handle: 75 Address: DF:A9:FF:F6:B1:1A (OUI DF-A9-FF)
        Count: 1
        #124: len 5 (0 Kb/s)
        Latency: 99 msec (40-119 msec ~99 msec)
zephyr.exe[480819]: < HCI Command: LE Set Random Address (0x08|0x0005) plen 6                                       #126 8.815785
        Address: 06:5C:55:95:A0:5D (Non-Resolvable)
> HCI Event: Command Complete (0x0e) plen 4                                                                         #127 8.816260
      LE Set Random Address (0x08|0x0005) ncmd 1
        Status: Success (0x00)
zephyr.exe[480819]: < HCI Command: LE Set Extended Scan Parameters (0x08|0x0041) plen 8                             #128 8.835737
        Own address type: Random (0x01)
        Filter policy: Accept all advertisement (0x00)
        PHYs: 0x01
        Entry 0: LE 1M
          Type: Active (0x01)
          Interval: 60.000 msec (0x0060)
          Window: 30.000 msec (0x0030)
> HCI Event: Command Complete (0x0e) plen 4                                                                         #129 8.836495
      LE Set Extended Scan Parameters (0x08|0x0041) ncmd 1
        Status: Success (0x00)
zephyr.exe[480819]: < HCI Command: LE Set Extended Scan Enable (0x08|0x0042) plen 6                                 #130 8.855750
        Extended scan: Enabled (0x01)
        Filter duplicates: Enabled (0x01)
        Duration: 0 msec (0x0000)
        Period: 0.00 sec (0x0000)
> HCI Event: Command Complete (0x0e) plen 4                                                                         #131 8.856353
      LE Set Extended Scan Enable (0x08|0x0042) ncmd 1
        Status: Success (0x00)
> HCI Event: LE Meta Event (0x3e) plen 51                                                                           #132 8.867821
      LE Extended Advertising Report (0x0d)
        Num reports: 1
        Entry 0
          Event type: 0x0013
            Props: 0x0013
              Connectable
              Scannable
              Use legacy advertising PDUs
            Data status: [0;32mComplete[0m
          Legacy PDU Type: ADV_IND (0x0013)
          Address type: Public (0x00)
          Address: F0:18:98:96:04:94 (Apple, Inc.)
          Primary PHY: LE 1M
          Secondary PHY: No packets
          SID: no ADI field (0xff)
          TX power: 127 dBm
          RSSI: -84 dBm (0xac)
          Periodic advertising interval: 0.00 msec (0x0000)
          Direct address type: Reserved (0xff)
          Direct address: 00-00-00-00-00-00
          Data length: 0x19
        02 01 06 11 07 00 00 00 00 00 00 00 00 00 00 00  ................
        00 00 01 31 5a 03 09 7a 6d                       ...1Z..zm       
        Flags: 0x06
          LE General Discoverable Mode
          BR/EDR Not Supported
        128-bit Service UUIDs (complete): 1 entry
          Vendor specific
        Name (complete): zm
> HCI Event: LE Meta Event (0x3e) plen 26                                                                           #133 8.868156
      LE Extended Advertising Report (0x0d)
        Num reports: 1
        Entry 0
          Event type: 0x001b
            Props: 0x001b
              Connectable
              Scannable
              Scan response
              Use legacy advertising PDUs
            Data status: [0;32mComplete[0m
          Legacy PDU Type: SCAN_RSP to an ADV_SCAN_IND (0x001b)
          Address type: Public (0x00)
          Address: F0:18:98:96:04:94 (Apple, Inc.)
          Primary PHY: LE 1M
          Secondary PHY: No packets
          SID: no ADI field (0xff)
          TX power: 127 dBm
          RSSI: -83 dBm (0xad)
          Periodic advertising interval: 0.00 msec (0x0000)
          Direct address type: Reserved (0xff)
          Direct address: 00-00-00-00-00-00
          Data length: 0x00
> HCI Event: LE Meta Event (0x3e) plen 55                                                                           #134 8.935112
      LE Extended Advertising Report (0x0d)
        Num reports: 1
        Entry 0
          Event type: 0x0010
            Props: 0x0010
              Use legacy advertising PDUs
            Data status: [0;32mComplete[0m
          Legacy PDU Type: ADV_NONCONN_IND (0x0010)
          Address type: Random (0x01)
          Address: 36:B2:03:42:11:98 (Non-Resolvable)
          Primary PHY: LE 1M
          Secondary PHY: No packets
          SID: no ADI field (0xff)
          TX power: 127 dBm
          RSSI: -90 dBm (0xa6)
          Periodic advertising interval: 0.00 msec (0x0000)
          Direct address type: Reserved (0xff)
          Direct address: 00-00-00-00-00-00
          Data length: 0x1d
        1c ff 06 00 01 09 21 0a 4d e0 8a 52 d2 d4 4c 41  ......!.M..R..LA
        50 54 4f 50 2d 45 35 32 45 4f 44 32 49           PTOP-E52EOD2I   
        Company: Microsoft (6)
          Data: 0109210a4de08a52d2d44c4150544f502d453532454f443249
> HCI Event: LE Meta Event (0x3e) plen 55                                                                           #135 9.042118
      LE Extended Advertising Report (0x0d)
        Num reports: 1
        Entry 0
          Event type: 0x0010
            Props: 0x0010
              Use legacy advertising PDUs
            Data status: [0;32mComplete[0m
          Legacy PDU Type: ADV_NONCONN_IND (0x0010)
          Address type: Random (0x01)
          Address: 36:B2:03:42:11:98 (Non-Resolvable)
          Primary PHY: LE 1M
          Secondary PHY: No packets
          SID: no ADI field (0xff)
          TX power: 127 dBm
          RSSI: -80 dBm (0xb0)
          Periodic advertising interval: 0.00 msec (0x0000)
          Direct address type: Reserved (0xff)
          Direct address: 00-00-00-00-00-00
          Data length: 0x1d
        1c ff 06 00 01 09 21 0a 4d e0 8a 52 d2 d4 4c 41  ......!.M..R..LA
        50 54 4f 50 2d 45 35 32 45 4f 44 32 49           PTOP-E52EOD2I   
        Company: Microsoft (6)
          Data: 0109210a4de08a52d2d44c4150544f502d453532454f443249
> HCI Event: LE Meta Event (0x3e) plen 51                                                                           #136 9.052856
      LE Extended Advertising Report (0x0d)
        Num reports: 1
        Entry 0
          Event type: 0x0013
            Props: 0x0013
              Connectable
              Scannable
              Use legacy advertising PDUs
            Data status: [0;32mComplete[0m
          Legacy PDU Type: ADV_IND (0x0013)
          Address type: Public (0x00)
          Address: F0:18:98:96:04:94 (Apple, Inc.)
          Primary PHY: LE 1M
          Secondary PHY: No packets
          SID: no ADI field (0xff)
          TX power: 127 dBm
          RSSI: -84 dBm (0xac)
          Periodic advertising interval: 0.00 msec (0x0000)
          Direct address type: Reserved (0xff)
          Direct address: 00-00-00-00-00-00
          Data length: 0x19
        02 01 06 11 07 00 00 00 00 00 00 00 00 00 00 00  ................
        00 00 01 31 5a 03 09 7a 6d                       ...1Z..zm       
        Flags: 0x06
          LE General Discoverable Mode
          BR/EDR Not Supported
        128-bit Service UUIDs (complete): 1 entry
          Vendor specific
        Name (complete): zm
> HCI Event: LE Meta Event (0x3e) plen 54                                                                           #137 9.104966
      LE Extended Advertising Report (0x0d)
        Num reports: 1
        Entry 0
          Event type: 0x0010
            Props: 0x0010
              Use legacy advertising PDUs
            Data status: [0;32mComplete[0m
          Legacy PDU Type: ADV_NONCONN_IND (0x0010)
          Address type: Public (0x00)
          Address: A4:30:7A:95:74:FB (Samsung Electronics Co.,Ltd)
          Primary PHY: LE 1M
          Secondary PHY: No packets
          SID: no ADI field (0xff)
          TX power: 127 dBm
          RSSI: -81 dBm (0xaf)
          Periodic advertising interval: 0.00 msec (0x0000)
          Direct address type: Reserved (0xff)
          Direct address: 00-00-00-00-00-00
          Data length: 0x1c
        1b ff 75 00 42 04 01 80 6e a4 30 7a 95 74 fb a6  ..u.B...n.0z.t..
        30 7a 95 74 fa 01 d8 41 c5 d9 00 00              0z.t...A....    
        Company: Samsung Electronics Co. Ltd. (117)
          Data: 420401806ea4307a9574fba6307a9574fa01d841c5d90000
> HCI Event: LE Meta Event (0x3e) plen 38                                                                           #138 9.220981
      LE Extended Advertising Report (0x0d)
        Num reports: 1
        Entry 0
          Event type: 0x0012
            Props: 0x0012
              Scannable
              Use legacy advertising PDUs
            Data status: [0;32mComplete[0m
          Legacy PDU Type: ADV_SCAN_IND (0x0012)
          Address type: Random (0x01)
          Address: 64:3F:0C:BE:57:89 (Resolvable)
          Primary PHY: LE 1M
          Secondary PHY: No packets
          SID: no ADI field (0xff)
          TX power: 127 dBm
          RSSI: -83 dBm (0xad)
          Periodic advertising interval: 0.00 msec (0x0000)
          Direct address type: Reserved (0xff)
          Direct address: 00-00-00-00-00-00
          Data length: 0x0c
        0b ff 4c 00 09 06 03 00 0a 03 07 11              ..L.........    
        Company: Apple, Inc. (76)
          Type: Apple TV (9)
          Data: 03000a030711
> HCI Event: LE Meta Event (0x3e) plen 48                                                                           #139 9.238347
      LE Extended Advertising Report (0x0d)
        Num reports: 1
        Entry 0
          Event type: 0x0000
            Props: 0x0000
            Data status: [0;32mComplete[0m
          Address type: Public (0x00)
          Address: DF:A9:FF:F6:B1:1A (OUI DF-A9-FF)
          Primary PHY: LE 1M
          Secondary PHY: LE 1M
          SID: 0x01
          TX power: 127 dBm
          RSSI: -16 dBm (0xf0)
          Periodic advertising interval: 120.00 msec (0x0060)
          Direct address type: Reserved (0xff)
          Direct address: 00-00-00-00-00-00
          Data length: 0x16
        06 16 52 18 09 f7 a9 0e 09 50 54 53 2d 42 41 53  ..R......PTS-BAS
        53 2d 42 31 31 41                                S-B11A          
        Service Data: Broadcast Audio Announcement (0x1852)
        Broadcast ID: 11138825 (0xa9f709)
        Name (complete): PTS-BASS-B11A
> HCI Event: LE Meta Event (0x3e) plen 56                                                                           #140 9.289697
      LE Extended Advertising Report (0x0d)
        Num reports: 1
        Entry 0
          Event type: 0x0013
            Props: 0x0013
              Connectable
              Scannable
              Use legacy advertising PDUs
            Data status: [0;32mComplete[0m
          Legacy PDU Type: ADV_IND (0x0013)
          Address type: Random (0x01)
          Address: 7C:7F:ED:68:F4:97 (Resolvable)
          Primary PHY: LE 1M
          Secondary PHY: No packets
          SID: no ADI field (0xff)
          TX power: 127 dBm
          RSSI: -91 dBm (0xa5)
          Periodic advertising interval: 0.00 msec (0x0000)
          Direct address type: Reserved (0xff)
          Direct address: 00-00-00-00-00-00
          Data length: 0x1e
        02 01 02 1a ff 4c 00 02 15 18 a5 47 93 5c 75 49  .....L.....G.\uI
        ae af 6d 3e dd a8 4d ff c3 41 40 c0 e4 c5        ..m>..M..A@...  
        Flags: 0x02
          LE General Discoverable Mode
        Company: Apple, Inc. (76)
          Type: iBeacon (2)
          UUID: c3ff4da8-dd3e-6daf-ae49-755c9347a518
          Version: 16449.58560
          TX power: -59 dB
> HCI Event: LE Meta Event (0x3e) plen 37                                                                           #141 9.290136
      LE Extended Advertising Report (0x0d)
        Num reports: 1
        Entry 0
          Event type: 0x001b
            Props: 0x001b
              Connectable
              Scannable
              Scan response
              Use legacy advertising PDUs
            Data status: [0;32mComplete[0m
          Legacy PDU Type: SCAN_RSP to an ADV_SCAN_IND (0x001b)
          Address type: Random (0x01)
          Address: 7C:7F:ED:68:F4:97 (Resolvable)
          Primary PHY: LE 1M
          Secondary PHY: No packets
          SID: no ADI field (0xff)
          TX power: 127 dBm
          RSSI: -92 dBm (0xa4)
          Periodic advertising interval: 0.00 msec (0x0000)
          Direct address type: Reserved (0xff)
          Direct address: 00-00-00-00-00-00
          Data length: 0x0b
        0a 09 53 74 75 64 69 6f 58 35 30                 ..StudioX50     
        Name (complete): StudioX50
> HCI Event: LE Meta Event (0x3e) plen 55                                                                           #142 9.352150
      LE Extended Advertising Report (0x0d)
        Num reports: 1
        Entry 0
          Event type: 0x0010
            Props: 0x0010
              Use legacy advertising PDUs
            Data status: [0;32mComplete[0m
          Legacy PDU Type: ADV_NONCONN_IND (0x0010)
          Address type: Random (0x01)
          Address: 36:B2:03:42:11:98 (Non-Resolvable)
          Primary PHY: LE 1M
          Secondary PHY: No packets
          SID: no ADI field (0xff)
          TX power: 127 dBm
          RSSI: -81 dBm (0xaf)
          Periodic advertising interval: 0.00 msec (0x0000)
          Direct address type: Reserved (0xff)
          Direct address: 00-00-00-00-00-00
          Data length: 0x1d
        1c ff 06 00 01 09 21 0a 4d e0 8a 52 d2 d4 4c 41  ......!.M..R..LA
        50 54 4f 50 2d 45 35 32 45 4f 44 32 49           PTOP-E52EOD2I   
        Company: Microsoft (6)
          Data: 0109210a4de08a52d2d44c4150544f502d453532454f443249
> HCI Event: LE Meta Event (0x3e) plen 38                                                                           #143 9.359081
      LE Extended Advertising Report (0x0d)
        Num reports: 1
        Entry 0
          Event type: 0x0012
            Props: 0x0012
              Scannable
              Use legacy advertising PDUs
            Data status: [0;32mComplete[0m
          Legacy PDU Type: ADV_SCAN_IND (0x0012)
          Address type: Random (0x01)
          Address: 64:3F:0C:BE:57:89 (Resolvable)
          Primary PHY: LE 1M
          Secondary PHY: No packets
          SID: no ADI field (0xff)
          TX power: 127 dBm
          RSSI: -89 dBm (0xa7)
          Periodic advertising interval: 0.00 msec (0x0000)
          Direct address type: Reserved (0xff)
          Direct address: 00-00-00-00-00-00
          Data length: 0x0c
        0b ff 4c 00 09 06 03 00 0a 03 07 11              ..L.........    
        Company: Apple, Inc. (76)
          Type: Apple TV (9)
          Data: 03000a030711
zephyr.exe[480819]: < HCI Command: LE Set Extended Scan Enable (0x08|0x0042) plen 6                                 #144 9.396173
        Extended scan: Disabled (0x00)
        Filter duplicates: Disabled (0x00)
        Duration: 0 msec (0x0000)
        Period: 0.00 sec (0x0000)
> HCI Event: Command Complete (0x0e) plen 4                                                                         #145 9.396717
      LE Set Extended Scan Enable (0x08|0x0042) ncmd 1
        Status: Success (0x00)
zephyr.exe[480819]: < HCI Command: LE Periodic Advertising Create Sync (0x08|0x0044) plen 14                        #146 9.435793
        Options: 0x0000
        Use advertising SID, Advertiser Address Type and address
        Reporting initially enabled
        SID: 0x01
        Adv address type: Public (0x00)
        Adv address: DF:A9:FF:F6:B1:1A (OUI DF-A9-FF)
        Skip: 0x0005
        Sync timeout: 10000 msec (0x03e8)
        Sync CTE type: 0x0000
> HCI Event: Command Status (0x0f) plen 4                                                                           #147 9.436426
      LE Periodic Advertising Create Sync (0x08|0x0044) ncmd 1
        Status: Success (0x00)
zephyr.exe[480819]: < HCI Command: LE Set Random Address (0x08|0x0005) plen 6                                       #148 9.455736
        Address: 20:89:9F:67:02:4D (Non-Resolvable)
> HCI Event: Command Complete (0x0e) plen 4                                                                         #149 9.456286
      LE Set Random Address (0x08|0x0005) ncmd 1
        Status: Success (0x00)
zephyr.exe[480819]: < HCI Command: LE Set Extended Scan Parameters (0x08|0x0041) plen 13                            #150 9.475736
        Own address type: Random (0x01)
        Filter policy: Accept all advertisement (0x00)
        PHYs: 0x05
        Entry 0: LE 1M
          Type: Passive (0x00)
          Interval: 60.000 msec (0x0060)
          Window: 30.000 msec (0x0030)
        Entry 1: LE Coded
          Type: Passive (0x00)
          Interval: 60.000 msec (0x0060)
          Window: 30.000 msec (0x0030)
> HCI Event: Command Complete (0x0e) plen 4                                                                         #151 9.476335
      LE Set Extended Scan Parameters (0x08|0x0041) ncmd 1
        Status: Success (0x00)
zephyr.exe[480819]: < HCI Command: LE Set Extended Scan Enable (0x08|0x0042) plen 6                                 #152 9.495729
        Extended scan: Enabled (0x01)
        Filter duplicates: Enabled (0x01)
        Duration: 0 msec (0x0000)
        Period: 0.00 sec (0x0000)
> HCI Event: Command Complete (0x0e) plen 4                                                                         #153 9.496224
      LE Set Extended Scan Enable (0x08|0x0042) ncmd 1
        Status: Success (0x00)
> HCI Event: LE Meta Event (0x3e) plen 51                                                                          #154 11.988543
      LE Extended Advertising Report (0x0d)
        Num reports: 1
        Entry 0
          Event type: 0x0013
            Props: 0x0013
              Connectable
              Scannable
              Use legacy advertising PDUs
            Data status: [0;32mComplete[0m
          Legacy PDU Type: ADV_IND (0x0013)
          Address type: Public (0x00)
          Address: F0:18:98:96:04:94 (Apple, Inc.)
          Primary PHY: LE 1M
          Secondary PHY: No packets
          SID: no ADI field (0xff)
          TX power: 127 dBm
          RSSI: -85 dBm (0xab)
          Periodic advertising interval: 0.00 msec (0x0000)
          Direct address type: Reserved (0xff)
          Direct address: 00-00-00-00-00-00
          Data length: 0x19
        02 01 06 11 07 00 00 00 00 00 00 00 00 00 00 00  ................
        00 00 01 31 5a 03 09 7a 6d                       ...1Z..zm       
        Flags: 0x06
          LE General Discoverable Mode
          BR/EDR Not Supported
        128-bit Service UUIDs (complete): 1 entry
          Vendor specific
        Name (complete): zm
> HCI Event: LE Meta Event (0x3e) plen 55                                                                          #155 12.167855
      LE Extended Advertising Report (0x0d)
        Num reports: 1
        Entry 0
          Event type: 0x0010
            Props: 0x0010
              Use legacy advertising PDUs
            Data status: [0;32mComplete[0m
          Legacy PDU Type: ADV_NONCONN_IND (0x0010)
          Address type: Random (0x01)
          Address: 36:B2:03:42:11:98 (Non-Resolvable)
          Primary PHY: LE 1M
          Secondary PHY: No packets
          SID: no ADI field (0xff)
          TX power: 127 dBm
          RSSI: -81 dBm (0xaf)
          Periodic advertising interval: 0.00 msec (0x0000)
          Direct address type: Reserved (0xff)
          Direct address: 00-00-00-00-00-00
          Data length: 0x1d
        1c ff 06 00 01 09 21 0a 4d e0 8a 52 d2 d4 4c 41  ......!.M..R..LA
        50 54 4f 50 2d 45 35 32 45 4f 44 32 49           PTOP-E52EOD2I   
        Company: Microsoft (6)
          Data: 0109210a4de08a52d2d44c4150544f502d453532454f443249
> HCI Event: LE Meta Event (0x3e) plen 48                                                                          #156 12.709342
      LE Extended Advertising Report (0x0d)
        Num reports: 1
        Entry 0
          Event type: 0x0000
            Props: 0x0000
            Data status: [0;32mComplete[0m
          Address type: Public (0x00)
          Address: DF:A9:FF:F6:B1:1A (OUI DF-A9-FF)
          Primary PHY: LE 1M
          Secondary PHY: LE 1M
          SID: 0x01
          TX power: 127 dBm
          RSSI: -16 dBm (0xf0)
          Periodic advertising interval: 120.00 msec (0x0060)
          Direct address type: Reserved (0xff)
          Direct address: 00-00-00-00-00-00
          Data length: 0x16
        06 16 52 18 09 f7 a9 0e 09 50 54 53 2d 42 41 53  ..R......PTS-BAS
        53 2d 42 31 31 41                                S-B11A          
        Service Data: Broadcast Audio Announcement (0x1852)
        Broadcast ID: 11138825 (0xa9f709)
        Name (complete): PTS-BASS-B11A
> HCI Event: LE Meta Event (0x3e) plen 16                                                                          #157 12.826758
      LE Periodic Advertising Sync Established (0x0e)
        Status: Success (0x00)
        Sync handle: 40
        Advertising SID: 0x01
        Advertiser address type: Resolved Public (0x02)
        Advertiser address: DF:A9:FF:F6:B1:1A (OUI DF-A9-FF)
        Advertiser PHY: LE 1M (0x01)
        Periodic advertising interval: 120.00 msec (0x0060)
        Advertiser clock accuracy: 0x01
> HCI Event: LE Meta Event (0x3e) plen 48                                                                          #158 12.827301
      LE Periodic Advertising Report (0x0f)
        Sync handle: 40
        TX power: 127 dbm (0x7f)
        RSSI: -17 dBm (0xef)
        CTE Type: No Constant Tone Extension (0xff)
        Data status: [0;32mComplete[0m
        Data length: 0x28
        27 16 51 18 40 9c 00 01 01 06 00 00 00 00 0a 02  '.Q.@...........
        01 03 02 02 01 03 04 28 00 06 03 02 04 00 01 09  .......(........
        01 06 05 03 01 00 00 00                          ........        
> HCI Event: LE Meta Event (0x3e) plen 20                                                                          #159 12.827546
      LE Broadcast Isochronous Group Info Advertising Report (0x22)
        Sync Handle: 0x0028
        Number BIS: 1
        NSE: 3
        ISO Interval: 10.00 msec (0x0008)
        BN: 1
        PTO: 1
        IRC: 2
        Maximum PDU: 40
        SDU Interval: 10000 us (0x002710)
        Maximum SDU: 40
        PHY: LE 1M (0x01)
        Framing: Unframed (0x00)
        Encryption: 0x01
zephyr.exe[480819]: < HCI Command: LE Set Extended Scan Enable (0x08|0x0042) plen 6                                #160 12.836247
        Extended scan: Disabled (0x00)
        Filter duplicates: Disabled (0x00)
        Duration: 0 msec (0x0000)
        Period: 0.00 sec (0x0000)
> HCI Event: Command Complete (0x0e) plen 4                                                                        #161 12.837092
      LE Set Extended Scan Enable (0x08|0x0042) ncmd 1
        Status: Success (0x00)
zephyr.exe[480819]: < ACL Data TX: Handle 75 flags 0x00 dlen 27                                                    #162 12.859304
zephyr.exe[480819]: < ACL Data TX: Handle 75 flags 0x01 dlen 6                                                     #163 12.859407
      ATT: Handle Value Notification (0x1b) len 28
        Handle: 0x004b
          Data: 00001ab1f6ffa9df0109f7a90201010000000006030204000109
> HCI Event: Number of Completed Packets (0x13) plen 5                                                             #164 12.975695
        Num handles: 1
        Handle: 75 Address: DF:A9:FF:F6:B1:1A (OUI DF-A9-FF)
        Count: 1
        #162: len 27 (1 Kb/s)
        Latency: 116 msec (40-119 msec ~107 msec)
zephyr.exe[480819]: < HCI Command: LE Broadcast Isochronous Group Create Sync (0x08|0x006b) plen 25                #165 13.036193
        BIG Handle: 0x00
        BIG Sync Handle: 0x0028
        Encryption: Encrypted (0x01)
        Broadcast Code: 00000000000000000000000000000000
        Maximum Number Subevents: 0x00
        Timeout: 200 ms (0x0014)
        Number of BIS: 1
        BIS ID: 0x01
> HCI Event: Number of Completed Packets (0x13) plen 5                                                             #166 13.035849
        Num handles: 1
        Handle: 75 Address: DF:A9:FF:F6:B1:1A (OUI DF-A9-FF)
        Count: 1
        #163: len 6 (0 Kb/s)
        Latency: 176 msec (40-176 msec ~142 msec)
> ACL Data RX: Handle 75 flags 0x02 dlen 25                                                                        #167 13.036155
      ATT: Write Command (0x52) len 20
        Handle: 0x0049
          Data: 040047fc153950449a5da5be0eacfa97fdfe
> HCI Event: Command Status (0x0f) plen 4                                                                          #168 13.037005
      LE Broadcast Isochronous Group Create Sync (0x08|0x006b) ncmd 1
        Status: Success (0x00)
zephyr.exe[480819]: < HCI Command: Host Number of Completed Packets (0x03|0x0035) plen 5                           #169 13.055827
        Num handles: 1
        Handle: 75 Address: DF:A9:FF:F6:B1:1A (OUI DF-A9-FF)
        Count: 1
> HCI Event: LE Meta Event (0x3e) plen 48                                                                          #170 13.547112
      LE Periodic Advertising Report (0x0f)
        Sync handle: 40
        TX power: 127 dbm (0x7f)
        RSSI: -16 dBm (0xf0)
        CTE Type: No Constant Tone Extension (0xff)
        Data status: [0;32mComplete[0m
        Data length: 0x28
        27 16 51 18 40 9c 00 01 01 06 00 00 00 00 0a 02  '.Q.@...........
        01 03 02 02 01 03 04 28 00 06 03 02 04 00 01 09  .......(........
        01 06 05 03 01 00 00 00                          ........        
> HCI Event: LE Meta Event (0x3e) plen 20                                                                          #171 13.547350
      LE Broadcast Isochronous Group Info Advertising Report (0x22)
        Sync Handle: 0x0028
        Number BIS: 1
        NSE: 3
        ISO Interval: 10.00 msec (0x0008)
        BN: 1
        PTO: 1
        IRC: 2
        Maximum PDU: 40
        SDU Interval: 10000 us (0x002710)
        Maximum SDU: 40
        PHY: LE 1M (0x01)
        Framing: Unframed (0x00)
        Encryption: 0x01
> HCI Event: LE Meta Event (0x3e) plen 15                                                                          #172 13.553260
      LE Broadcast Isochronous Group Sync Estabilished (0x1d)
        Status: Connection Terminated due to MIC Failure (0x3d)
        BIG Handle: 0x00
        Transport Latency: 525057 us (0x080301)
        NSE: 0
        BN: 1
        PTO: 1
        IRC: 2
        Maximum PDU: 40
        ISO Interval: 12500.00 msec (0x2710)
zephyr.exe[480819]: < ACL Data TX: Handle 75 flags 0x00 dlen 27                                                    #173 13.556152
zephyr.exe[480819]: < ACL Data TX: Handle 75 flags 0x01 dlen 22                                                    #174 13.556223
      ATT: Handle Value Notification (0x1b) len 44
        Handle: 0x004b
          Data: 00001ab1f6ffa9df0109f7a90203ffffffffffffffffffffffffffffffff01ffffffff06030204000109
> HCI Event: Number of Completed Packets (0x13) plen 5                                                             #175 13.576105
        Num handles: 1
        Handle: 75 Address: DF:A9:FF:F6:B1:1A (OUI DF-A9-FF)
        Count: 1
        #173: len 27 (11 Kb/s)
        Latency: 19 msec (19-176 msec ~81 msec)
> HCI Event: Number of Completed Packets (0x13) plen 5                                                             #176 13.635647
        Num handles: 1
        Handle: 75 Address: DF:A9:FF:F6:B1:1A (OUI DF-A9-FF)
        Count: 1
        #174: len 22 (2 Kb/s)
        Latency: 79 msec (19-176 msec ~80 msec)
> HCI Event: LE Meta Event (0x3e) plen 48                                                                          #177 14.266969
      LE Periodic Advertising Report (0x0f)
        Sync handle: 40
        TX power: 127 dbm (0x7f)
        RSSI: -17 dBm (0xef)
        CTE Type: No Constant Tone Extension (0xff)
        Data status: [0;32mComplete[0m
        Data length: 0x28
        27 16 51 18 40 9c 00 01 01 06 00 00 00 00 0a 02  '.Q.@...........
        01 03 02 02 01 03 04 28 00 06 03 02 04 00 01 09  .......(........
        01 06 05 03 01 00 00 00                          ........        
> HCI Event: LE Meta Event (0x3e) plen 20                                                                          #178 14.267238
      LE Broadcast Isochronous Group Info Advertising Report (0x22)
        Sync Handle: 0x0028
        Number BIS: 1
        NSE: 3
        ISO Interval: 10.00 msec (0x0008)
        BN: 1
        PTO: 1
        IRC: 2
        Maximum PDU: 40
        SDU Interval: 10000 us (0x002710)
        Maximum SDU: 40
        PHY: LE 1M (0x01)
        Framing: Unframed (0x00)
        Encryption: 0x01
zephyr.exe[480819]: < HCI Command: LE Broadcast Isochronous Group Create Sync (0x08|0x006b) plen 25                #179 14.276338
        BIG Handle: 0x00
        BIG Sync Handle: 0x0028
        Encryption: Encrypted (0x01)
        Broadcast Code: 47fc153950449a5da5be0eacfa97fdfe
        Maximum Number Subevents: 0x00
        Timeout: 200 ms (0x0014)
        Number of BIS: 1
        BIS ID: 0x01
> HCI Event: Command Status (0x0f) plen 4                                                                          #180 14.277083
      LE Broadcast Isochronous Group Create Sync (0x08|0x006b) ncmd 1
        Status: Success (0x00)
> HCI Event: LE Meta Event (0x3e) plen 48                                                                          #181 14.987103
      LE Periodic Advertising Report (0x0f)
        Sync handle: 40
        TX power: 127 dbm (0x7f)
        RSSI: -16 dBm (0xf0)
        CTE Type: No Constant Tone Extension (0xff)
        Data status: [0;32mComplete[0m
        Data length: 0x28
        27 16 51 18 40 9c 00 01 01 06 00 00 00 00 0a 02  '.Q.@...........
        01 03 02 02 01 03 04 28 00 06 03 02 04 00 01 09  .......(........
        01 06 05 03 01 00 00 00                          ........        
> HCI Event: LE Meta Event (0x3e) plen 20                                                                          #182 14.987339
      LE Broadcast Isochronous Group Info Advertising Report (0x22)
        Sync Handle: 0x0028
        Number BIS: 1
        NSE: 3
        ISO Interval: 10.00 msec (0x0008)
        BN: 1
        PTO: 1
        IRC: 2
        Maximum PDU: 40
        SDU Interval: 10000 us (0x002710)
        Maximum SDU: 40
        PHY: LE 1M (0x01)
        Framing: Unframed (0x00)
        Encryption: 0x01
> HCI Event: LE Meta Event (0x3e) plen 17                                                                          #183 14.992900
      LE Broadcast Isochronous Group Sync Estabilished (0x1d)
        Status: Success (0x00)
        BIG Handle: 0x00
        Transport Latency: 11596 us (0x002d4c)
        NSE: 3
        BN: 1
        PTO: 1
        IRC: 2
        Maximum PDU: 40
        ISO Interval: 10.00 msec (0x0008)
        Connection Handle #0: 70
zephyr.exe[480819]: < HCI Command: LE Setup Isochronous Data Path (0x08|0x006e) plen 13                            #184 14.997333
        Handle: 70
        Data Path Direction: Output (Controller to Host) (0x01)
        Data Path: HCI (0x00)
        Coding Format: Transparent (0x03)
        Company Codec ID: Ericsson Technology Licensing (0)
        Vendor Codec ID: 0
        Controller Delay: 0 us (0x000000)
        Codec Configuration Length: 0
        Codec Configuration: 
> HCI Event: Command Complete (0x0e) plen 6                                                                        #185 14.998069
      LE Setup Isochronous Data Path (0x08|0x006e) ncmd 1
        Status: Success (0x00)
        Handle: 70
> ISO Data RX: Handle 70 flags 0x06 dlen 8                                                                         #186 15.002966
> ISO Data RX: Handle 70 flags 0x06 dlen 8                                                                         #187 15.004122
> ISO Data RX: Handle 70 flags 0x06 dlen 8                                                                         #188 15.014007
zephyr.exe[480819]: < ACL Data TX: Handle 75 flags 0x00 dlen 27                                                    #189 15.017205
zephyr.exe[480819]: < ACL Data TX: Handle 75 flags 0x01 dlen 6                                                     #190 15.017255
      ATT: Handle Value Notification (0x1b) len 28
        Handle: 0x004b
          Data: 00001ab1f6ffa9df0109f7a90202010100000006030204000109
> ISO Data RX: Handle 70 flags 0x06 dlen 8                                                                         #191 15.024042
> ISO Data RX: Handle 70 flags 0x06 dlen 8                                                                         #192 15.034065
> ISO Data RX: Handle 70 flags 0x06 dlen 8                                                                         #193 15.044119
> ISO Data RX: Handle 70 flags 0x06 dlen 8                                                                         #194 15.054030
> ISO Data RX: Handle 70 flags 0x06 d