Bluetooth monitor ver 5.72
= Note: Linux version 6.14.0-36-generic (x86_64)                       0.849473
= Note: Bluetooth subsystem version 2.22                               0.849474
= New Index: 00:00:00:00:00:00 (Primary,UART,hci2)              [hci2] 0.849475
= New Index: 00:00:00:00:00:00 (Primary,UART,hci1)              [hci1] 0.849476
= New Index: 48:5F:99:8E:E0:64 (Primary,USB,hci0)               [hci0] 0.849476
= Open Index: 00:00:00:00:00:00                                 [hci1] 0.963237
= Index Info: 00:00:00:00:00:00 (Nordic Semiconductor ASA)      [hci1] 0.963254
@ USER Open: main (privileged) version 2.22            {0x0001} [hci1] 0.963263
< HCI Command: Reset (0x03|0x0003) plen 0                    #1 [hci1] 0.964672
> HCI Event: Command Complete (0x0e) plen 4                  #2 [hci1] 0.965279
      Reset (0x03|0x0003) ncmd 1
        Status: Success (0x00)
< HCI Command: Read Local Supported... (0x04|0x0003) plen 0  #3 [hci1] 0.982938
> HCI Event: Command Complete (0x0e) plen 12                 #4 [hci1] 0.983523
      Read Local Supported Features (0x04|0x0003) ncmd 1
        Status: Success (0x00)
        Features: 0x00 0x00 0x00 0x00 0x60 0x00 0x00 0x00
          BR/EDR Not Supported
          LE Supported (Controller)
< HCI Command: Read Local Version In.. (0x04|0x0001) plen 0  #5 [hci1] 1.002652
> HCI Event: Command Complete (0x0e) plen 12                 #6 [hci1] 1.003176
      Read Local Version Information (0x04|0x0001) ncmd 1
        Status: Success (0x00)
        HCI version: Reserved (0x0f) - Revision 12393 (0x3069)
        LMP version: Reserved (0x0f) - Subversion 12393 (0x3069)
        Manufacturer: Nordic Semiconductor ASA (89)
< HCI Command: Read Local Supported... (0x04|0x0002) plen 0  #7 [hci1] 1.022598
> HCI Event: Command Complete (0x0e) plen 68                 #8 [hci1] 1.023790
      Read Local Supported Commands (0x04|0x0002) ncmd 1
        Status: Success (0x00)
        Commands: 119 entries
          Disconnect (Octet 0 - Bit 5)
          Read Remote Version Information (Octet 2 - Bit 7)
          Set Event Mask (Octet 5 - Bit 6)
          Reset (Octet 5 - Bit 7)
          Read Connection Accept Timeout (Octet 7 - Bit 2)
          Write Connection Accept Timeout (Octet 7 - Bit 3)
          Read Transmit Power Level (Octet 10 - Bit 2)
          Set Controller To Host Flow Control (Octet 10 - Bit 5)
          Host Buffer Size (Octet 10 - Bit 6)
          Host Number of Completed Packets (Octet 10 - Bit 7)
          Read Local Version Information (Octet 14 - Bit 3)
          Read Local Supported Features (Octet 14 - Bit 5)
          Read BD ADDR (Octet 15 - Bit 1)
          Read RSSI (Octet 15 - Bit 5)
          Set Event Mask Page 2 (Octet 22 - Bit 2)
          LE Set Event Mask (Octet 25 - Bit 0)
          LE Read Buffer Size (Octet 25 - Bit 1)
          LE Read Local Supported Features (Octet 25 - Bit 2)
          LE Set Random Address (Octet 25 - Bit 4)
          LE Set Advertising Parameters (Octet 25 - Bit 5)
          LE Read Advertising Channel TX Power (Octet 25 - Bit 6)
          LE Set Advertising Data (Octet 25 - Bit 7)
          LE Set Scan Response Data (Octet 26 - Bit 0)
          LE Set Advertise Enable (Octet 26 - Bit 1)
          LE Set Scan Parameters (Octet 26 - Bit 2)
          LE Set Scan Enable (Octet 26 - Bit 3)
          LE Create Connection (Octet 26 - Bit 4)
          LE Create Connection Cancel (Octet 26 - Bit 5)
          LE Read Accept List Size (Octet 26 - Bit 6)
          LE Clear Accept List (Octet 26 - Bit 7)
          LE Add Device To Accept List (Octet 27 - Bit 0)
          LE Remove Device From Accept List (Octet 27 - Bit 1)
          LE Connection Update (Octet 27 - Bit 2)
          LE Set Host Channel Classification (Octet 27 - Bit 3)
          LE Read Channel Map (Octet 27 - Bit 4)
          LE Read Remote Used Features (Octet 27 - Bit 5)
          LE Encrypt (Octet 27 - Bit 6)
          LE Rand (Octet 27 - Bit 7)
          LE Start Encryption (Octet 28 - Bit 0)
          LE Long Term Key Request Reply (Octet 28 - Bit 1)
          LE Long Term Key Request Neg Reply (Octet 28 - Bit 2)
          LE Read Supported States (Octet 28 - Bit 3)
          LE Receiver Test (Octet 28 - Bit 4)
          LE Transmitter Test (Octet 28 - Bit 5)
          LE Test End (Octet 28 - Bit 6)
          Read Authenticated Payload Timeout (Octet 32 - Bit 4)
          Write Authenticated Payload Timeout (Octet 32 - Bit 5)
          LE Set Data Length (Octet 33 - Bit 6)
          LE Read Suggested Default Data Length (Octet 33 - Bit 7)
          LE Write Suggested Default Data Length (Octet 34 - Bit 0)
          LE Add Device To Resolving List (Octet 34 - Bit 3)
          LE Remove Device From Resolving List (Octet 34 - Bit 4)
          LE Clear Resolving List (Octet 34 - Bit 5)
          LE Read Resolving List Size (Octet 34 - Bit 6)
          LE Set Address Resolution Enable (Octet 35 - Bit 1)
          LE Set Resolvable Private Address Timeout (Octet 35 - Bit 2)
          LE Read Maximum Data Length (Octet 35 - Bit 3)
          LE Read PHY (Octet 35 - Bit 4)
          LE Set Default PHY (Octet 35 - Bit 5)
          LE Set PHY (Octet 35 - Bit 6)
          LE Enhanced Receiver Test (Octet 35 - Bit 7)
          LE Enhanced Transmitter Test (Octet 36 - Bit 0)
          LE Set Advertising Set Random Address (Octet 36 - Bit 1)
          LE Set Extended Advertising Parameters (Octet 36 - Bit 2)
          LE Set Extended Advertising Data (Octet 36 - Bit 3)
          LE Set Extended Scan Response Data (Octet 36 - Bit 4)
          LE Set Extended Advertising Enable (Octet 36 - Bit 5)
          LE Read Maximum Advertising Data Length (Octet 36 - Bit 6)
          LE Read Number of Supported Advertising Sets (Octet 36 - Bit 7)
          LE Remove Advertising Set (Octet 37 - Bit 0)
          LE Clear Advertising Sets (Octet 37 - Bit 1)
          LE Set Periodic Advertising Parameters (Octet 37 - Bit 2)
          LE Set Periodic Advertising Data (Octet 37 - Bit 3)
          LE Set Periodic Advertising Enable (Octet 37 - Bit 4)
          LE Set Extended Scan Parameters (Octet 37 - Bit 5)
          LE Set Extended Scan Enable (Octet 37 - Bit 6)
          LE Extended Create Connection (Octet 37 - Bit 7)
          LE Periodic Advertising Create Sync (Octet 38 - Bit 0)
          LE Periodic Advertising Create Sync Cancel (Octet 38 - Bit 1)
          LE Periodic Advertising Terminate Sync (Octet 38 - Bit 2)
          LE Add Device To Periodic Advertiser List (Octet 38 - Bit 3)
          LE Remove Device From Periodic Advertiser List (Octet 38 - Bit 4)
          LE Clear Periodic Advertiser List (Octet 38 - Bit 5)
          LE Read Periodic Advertiser List Size (Octet 38 - Bit 6)
          LE Read Transmit Power (Octet 38 - Bit 7)
          LE Read RF Path Compensation (Octet 39 - Bit 0)
          LE Write RF Path Compensation (Octet 39 - Bit 1)
          LE Set Privacy Mode (Octet 39 - Bit 2)
          LE Periodic Advertising Receive Enable (Octet 40 - Bit 5)
          LE Periodic Advertising Sync Transfer (Octet 40 - Bit 6)
          LE Periodic Advertising Set Info Transfer (Octet 40 - Bit 7)
          LE Periodic Advertising Sync Transfer Parameters (Octet 41 - Bit 0)
          LE Set Default Periodic Advertisng Sync Transfer Parameters (Octet 41 - Bit 1)
          LE Read Buffer v2 (Octet 41 - Bit 5)
          LE Read ISO TX Sync (Octet 41 - Bit 6)
          LE Set Connected Isochronous Group Parameters (Octet 41 - Bit 7)
          LE Set Connected Isochronous Group Parameters Test (Octet 42 - Bit 0)
          LE Create Connected Isochronous Stream (Octet 42 - Bit 1)
          LE Remove Connected Isochronous Group (Octet 42 - Bit 2)
          LE Accept Connected Isochronous Stream Request (Octet 42 - Bit 3)
          LE Reject Connected Isochronous Stream Request (Octet 42 - Bit 4)
          LE Create Broadcast Isochronous Group (Octet 42 - Bit 5)
          LE Create Broadcast Isochronous Group Test (Octet 42 - Bit 6)
          LE Terminate Broadcast Isochronous Group (Octet 42 - Bit 7)
          LE Broadcast Isochronous Group Create Sync (Octet 43 - Bit 0)
          LE Broadcast Isochronous Group Terminate Sync (Octet 43 - Bit 1)
          LE Request Peer SCA (Octet 43 - Bit 2)
          LE Setup Isochronous Data Path (Octet 43 - Bit 3)
          LE Remove Isochronous Data Path (Octet 43 - Bit 4)
          LE Isochronous Transmit Test (Octet 43 - Bit 5)
          LE Isochronous Receive Test (Octet 43 - Bit 6)
          LE Isochronous Read Test Counters (Octet 43 - Bit 7)
          LE Isochronous Read Test Counters (Octet 44 - Bit 0)
          LE Set Host Feature (Octet 44 - Bit 1)
          Octet 44 - Bit 2 
          Octet 45 - Bit 6 
          Octet 46 - Bit 0 
          Octet 46 - Bit 1 
          Octet 46 - Bit 2 
< HCI Command: Host Buffer Size (0x03|0x0033) plen 7         #9 [hci1] 1.042623
        ACL MTU: 255  ACL max packet: 16
        SCO MTU: 0    SCO max packet: 0
> HCI Event: Command Complete (0x0e) plen 4                 #10 [hci1] 1.043188
      Host Buffer Size (0x03|0x0033) ncmd 1
        Status: Success (0x00)
< HCI Command: Set Controller To Ho.. (0x03|0x0031) plen 1  #11 [hci1] 1.062662
        Flow control: ACL Data Packets (0x01)
> HCI Event: Command Complete (0x0e) plen 4                 #12 [hci1] 1.063179
      Set Controller To Host Flow Control (0x03|0x0031) ncmd 1
        Status: Success (0x00)
< HCI Command: LE Read Local Suppor.. (0x08|0x0003) plen 0  #13 [hci1] 1.082633
> HCI Event: Command Complete (0x0e) plen 12                #14 [hci1] 1.083174
      LE Read Local Supported Features (0x08|0x0003) ncmd 1
        Status: Success (0x00)
        Features: 0xfd 0x79 0x00 0xf7 0x30 0x01 0x00 0x00
          LE Encryption
          Extended Reject Indication
          Peripheral-initiated Features Exchange
          LE Ping
          LE Data Packet Length Extension
          LL Privacy
          Extended Scanner Filter Policies
          LE 2M PHY
          LE Coded PHY
          LE Extended Advertising
          LE Periodic Advertising
          Channel Selection Algorithm #2
          Periodic Advertising Sync Transfer - Sender
          Periodic Advertising Sync Transfer - Recipient
          Sleep Clock Accuracy Updates
          Connected Isochronous Stream - Central
          Connected Isochronous Stream - Peripheral
          Isochronous Broadcaster
          Synchronized Receiver
          Periodic Advertising ADI support
          Connection Subrating
          Unknown features (0x0000010000000000)
< HCI Command: LE Set Host Feature (0x08|0x0074) plen 2     #15 [hci1] 1.102607
        Bit Number: 32
          Connected Isochronous Stream (Host Support)
        Bit Value: 1
> HCI Event: Command Complete (0x0e) plen 4                 #16 [hci1] 1.103282
      LE Set Host Feature (0x08|0x0074) ncmd 1
        Status: Success (0x00)
< HCI Command: LE Read Buffer v2 (0x08|0x0060) plen 0       #17 [hci1] 1.122593
> HCI Event: Command Complete (0x0e) plen 10                #18 [hci1] 1.123169
      LE Read Buffer v2 (0x08|0x0060) ncmd 1
        Status: Success (0x00)
        ACL MTU: 27
        ACL max packet: 3
        ISO MTU: 318
        ISO max packet: 3
< HCI Command: LE Read Maximum Adve.. (0x08|0x003a) plen 0  #19 [hci1] 1.142597
> HCI Event: Command Complete (0x0e) plen 6                 #20 [hci1] 1.143066
      LE Read Maximum Advertising Data Length (0x08|0x003a) ncmd 1
        Status: Success (0x00)
        Max length: 1650
< HCI Command: LE Read Supported St.. (0x08|0x001c) plen 0  #21 [hci1] 1.162574
> HCI Event: Command Complete (0x0e) plen 12                #22 [hci1] 1.163109
      LE Read Supported States (0x08|0x001c) ncmd 1
        Status: Success (0x00)
        States: 0x000003ff3e0306ff
          Non-connectable Advertising State
          Scannable Advertising State
          Connectable Advertising State
          High Duty Cycle Directed Advertising State
          Passive Scanning State
          Active Scanning State
          Initiating State
            and Connection State (Central Role)
          Connection State (Peripheral Role)
          Scannable Advertising State
            and Passive Scanning State
          Connectable Advertising State
            and Passive Scanning State
          Non-connectable Advertising State
            and Initiating State
          Scannable Advertising State
            and Initiating State
          Active Scanning State
            and Connection State (Central Role)
          Passive Scanning State
            and Connection State (Peripheral Role)
          Active Scanning State
            and Connection State (Peripheral Role)
          Initiating State
            and Connection State (Central Role)
            and Central Role & Central Role
          Low Duty Cycle Directed Advertising State
          Connectable Advertising State
            and Initiating State
            and Central Role & Peripheral Role
          High Duty Cycle Directed Advertising State
            and Initiating State
            and Central Role & Peripheral Role
          Low Duty Cycle Directed Advertising State
            and Initiating State
            and Central Role & Peripheral Role
          Connectable Advertising State
            and Connection State (Central Role)
            and Central Role & Peripheral Role
          High Duty Cycle Directed Advertising State
            and Connection State (Central Role)
            and Central Role & Peripheral Role
          Low Duty Cycle Directed Advertising State
            and Connection State (Central Role)
            and Central Role & Peripheral Role
          Connectable Advertising State
            and Connection State (Peripheral Role)
            and Central Role & Peripheral Role
          High Duty Cycle Directed Advertising State
            and Connection State (Peripheral Role)
            and Peripheral Role & Peripheral Role
          Low Duty Cycle Directed Advertising State
            and Connection State (Peripheral Role)
            and Peripheral Role & Peripheral Role
          Initiating State
            and Connection State (Peripheral Role)
            and Central Role & Peripheral Role
< HCI Command: LE Read Maximum Data.. (0x08|0x002f) plen 0  #23 [hci1] 1.182598
> HCI Event: Command Complete (0x0e) plen 12                #24 [hci1] 1.183164
      LE Read Maximum Data Length (0x08|0x002f) ncmd 1
        Status: Success (0x00)
        Max TX octets: 251
        Max TX time: 2704
        Max RX octets: 251
        Max RX time: 2704
< HCI Command: LE Write Suggested D.. (0x08|0x0024) plen 4  #25 [hci1] 1.202618
        TX octets: 251
        TX time: 2704
> HCI Event: Command Complete (0x0e) plen 4                 #26 [hci1] 1.203189
      LE Write Suggested Default Data Length (0x08|0x0024) ncmd 1
        Status: Success (0x00)
< HCI Command: LE Read Resolving Li.. (0x08|0x002a) plen 0  #27 [hci1] 1.222604
> HCI Event: Command Complete (0x0e) plen 5                 #28 [hci1] 1.223147
      LE Read Resolving List Size (0x08|0x002a) ncmd 1
        Status: Success (0x00)
        Size: 8
< HCI Command: LE Set Event Mask (0x08|0x0001) plen 8       #29 [hci1] 1.242602
        Mask: 0x000002023f87fa5e
          LE Advertising Report
          LE Connection Update Complete
          LE Read Remote Used Features Complete
          LE Long Term Key Request
          LE Data Length Change
          LE Enhanced Connection Complete
          LE PHY Update Complete
          LE Extended Advertising Report
          LE Periodic Advertising Sync Established
          LE Periodic Advertising Report
          LE Periodic Advertising Sync Lost
          LE Extended Scan Timeout
          LE Extended Advertising Set Terminated
          LE Scan Request Received
          LE Periodic Advertising Sync Transfer Rvc
          LE CIS Established
          LE CIS Request
          LE Create BIG Complete
          LE Terminate BIG Complete
          LE BIG Sync Estabilished Complete
          LE BIG Sync Lost
          LE BIG Info Advertising Report
          Unknown mask (0x0000020000000000)
> HCI Event: Command Complete (0x0e) plen 4                 #30 [hci1] 1.243149
      LE Set Event Mask (0x08|0x0001) ncmd 1
        Status: Success (0x00)
< HCI Command: Set Event Mask (0x03|0x0001) plen 8          #31 [hci1] 1.262641
        Mask: 0x2000800002008890
          Disconnection Complete
          Encryption Change
          Read Remote Version Information Complete
          Hardware Error
          Data Buffer Overflow
          Encryption Key Refresh Complete
          LE Meta
> HCI Event: Command Complete (0x0e) plen 4                 #32 [hci1] 1.263140
      Set Event Mask (0x03|0x0001) ncmd 1
        Status: Success (0x00)
< HCI Command: Read BD ADDR (0x04|0x0009) plen 0            #33 [hci1] 1.282608
> HCI Event: Command Complete (0x0e) plen 10                #34 [hci1] 1.283040
      Read BD ADDR (0x04|0x0009) ncmd 1
        Status: Success (0x00)
        Address: 00:00:00:00:00:00 (OUI 00-00-00)
< HCI Command: LE Set Random Address (0x08|0x0005) plen 6   #35 [hci1] 1.302610
        Address: D5:B6:CC:31:DB:3B (Static)
> HCI Event: Command Complete (0x0e) plen 4                 #36 [hci1] 1.303105
      LE Set Random Address (0x08|0x0005) ncmd 1
        Status: Success (0x00)
< HCI Command: LE Set Extended Adv.. (0x08|0x0036) plen 25  #37 [hci1] 8.192679
        Handle: 0x00
        Properties: 0x0013
          Connectable
          Scannable
          Use legacy advertising PDUs: ADV_IND
        Min advertising interval: 100.000 msec (0x00a0)
        Max advertising interval: 150.000 msec (0x00f0)
        Channel map: 37, 38, 39 (0x07)
        Own address type: Random (0x01)
        Peer address type: Public (0x00)
        Peer address: 00:00:00:00:00:00 (OUI 00-00-00)
        Filter policy: Allow Scan Request from Any, Allow Connect Request from Any (0x00)
        TX power: Host has no preference (0x7f)
        Primary PHY: LE 1M (0x01)
        Secondary max skip: 0x00
        Secondary PHY: LE 1M (0x01)
        SID: 0x00
        Scan request notifications: Disabled (0x00)
> HCI Event: Command Complete (0x0e) plen 5                 #38 [hci1] 8.193464
      LE Set Extended Advertising Parameters (0x08|0x0036) ncmd 1
        Status: Success (0x00)
        TX power (selected): 0 dbm (0x00)
< HCI Command: LE Set Advertising S.. (0x08|0x0035) plen 7  #39 [hci1] 8.202705
        Advertising handle: 0x00
        Advertising random address: D5:B6:CC:31:DB:3B (Static)
> HCI Event: Command Complete (0x0e) plen 4                 #40 [hci1] 8.203259
      LE Set Advertising Set Random Address (0x08|0x0035) ncmd 1
        Status: Success (0x00)
< HCI Command: LE Set Extended Adv.. (0x08|0x0037) plen 22  #41 [hci1] 8.222689
        Handle: 0x00
        Operation: Complete extended advertising data (0x03)
        Fragment preference: Minimize fragmentation (0x01)
        Data length: 0x12
        Flags: 0x06
          LE General Discoverable Mode
          BR/EDR Not Supported
        Name (complete): Tester_F6B11A
> HCI Event: Command Complete (0x0e) plen 4                 #42 [hci1] 8.223344
      LE Set Extended Advertising Data (0x08|0x0037) ncmd 1
        Status: Success (0x00)
< HCI Command: LE Set Extended Scan.. (0x08|0x0038) plen 4  #43 [hci1] 8.242707
        Handle: 0x00
        Operation: Complete scan response data (0x03)
        Fragment preference: Minimize fragmentation (0x01)
        Data length: 0x00
> HCI Event: Command Complete (0x0e) plen 4                 #44 [hci1] 8.243230
      LE Set Extended Scan Response Data (0x08|0x0038) ncmd 1
        Status: Success (0x00)
< HCI Command: LE Set Extended Adve.. (0x08|0x0039) plen 6  #45 [hci1] 8.262712
        Extended advertising: Enabled (0x01)
        Number of sets: 1 (0x01)
        Entry 0
          Handle: 0x00
          Duration: 0 ms (0x00)
          Max ext adv events: 0
> HCI Event: Command Complete (0x0e) plen 4                 #46 [hci1] 8.263361
      LE Set Extended Advertising Enable (0x08|0x0039) ncmd 1
        Status: Success (0x00)
> HCI Event: LE Meta Event (0x3e) plen 31                   #47 [hci1] 8.581542
      LE Enhanced Connection Complete (0x0a)
        Status: Success (0x00)
        Handle: 1317
        Role: Peripheral (0x01)
        Peer address type: Public (0x00)
        Peer address: DF:A9:FF:F6:B1:1A (OUI DF-A9-FF)
        Local resolvable private address: 00:00:00:00:00:00 (Non-Resolvable)
        Peer resolvable private address: 00:00:00:00:00:00 (Non-Resolvable)
        Connection interval: 87.50 msec (0x0046)
        Connection latency: 0 (0x0000)
        Supervision timeout: 20000 msec (0x07d0)
        Central clock accuracy: 0x01
> HCI Event: LE Meta Event (0x3e) plen 6                    #48 [hci1] 8.581592
      LE Advertising Set Terminated (0x12)
        Status: Success (0x00)
        Handle: 0
        Connection handle: 1317
        Number of completed extended advertising events: 0
< HCI Command: LE Read Remote Used... (0x08|0x0016) plen 2  #49 [hci1] 8.583470
        Handle: 1317 Address: DF:A9:FF:F6:B1:1A (OUI DF-A9-FF)
> HCI Event: Command Status (0x0f) plen 4                   #50 [hci1] 8.583987
      LE Read Remote Used Features (0x08|0x0016) ncmd 1
        Status: Success (0x00)
> HCI Event: LE Meta Event (0x3e) plen 12                   #51 [hci1] 8.845450
      LE Read Remote Used Features (0x04)
        Status: Success (0x00)
        Handle: 1317 Address: DF:A9:FF:F6:B1:1A (OUI DF-A9-FF)
        Features: 0x2d 0x49 0x00 0xf7 0x67 0xd9 0x00 0x80
          LE Encryption
          Extended Reject Indication
          Peripheral-initiated Features Exchange
          LE Data Packet Length Extension
          LE 2M PHY
          LE Coded PHY
          Channel Selection Algorithm #2
          Periodic Advertising Sync Transfer - Sender
          Periodic Advertising Sync Transfer - Recipient
          Sleep Clock Accuracy Updates
          Connected Isochronous Stream - Central
          Connected Isochronous Stream - Peripheral
          Isochronous Broadcaster
          Synchronized Receiver
          Connected Isochronous Stream (Host Support)
          LE Power Control Request
          LE Power Control Request
          Connection Subrating
          Connection Subrating (Host Support)
          Unknown features (0x8000d90000000000)
> ACL Data RX: Handle 1317 flags 0x02 dlen 11               #52 [hci1] 9.807552
      ATT: Read By Type Request (0x08) len 6
        Handle range: 0x0001-0xffff
        Attribute type: Characteristic (0x2803)
< HCI Command: Host Number of Compl.. (0x03|0x0035) plen 5  #53 [hci1] 9.822770
        Num handles: 1
        Handle: 1317 Address: DF:A9:FF:F6:B1:1A (OUI DF-A9-FF)
        Count: 1
< ACL Data TX: Handle 1317 flags 0x00 dlen 20               #54 [hci1] 9.822804
      ATT: Read By Type Response (0x09) len 15
        Attribute data length: 7
        Attribute data list: 2 entries
        Handle: 0x0002
        Value: 200300052a
            Properties: 0x20
              Indicate (0x20)
            Value Handle: 0x0003
            Value UUID: Service Changed (0x2a05)
        Handle: 0x0005
        Value: 0a0600292b
            Properties: 0x0a
              Read (0x02)
              Write (0x08)
            Value Handle: 0x0006
            Value UUID: Client Supported Features (0x2b29)
> HCI Event: Number of Completed Packets (0x13) plen 5      #55 [hci1] 9.982629
        Num handles: 1
        Handle: 1317 Address: DF:A9:FF:F6:B1:1A (OUI DF-A9-FF)
        Count: 1
        #54: len 20 (1 Kb/s)
        Latency: 159 msec (159-159 msec ~159 msec)
> ACL Data RX: Handle 1317 flags 0x02 dlen 11               #56 [hci1] 9.982868
      ATT: Read By Type Request (0x08) len 6
        Handle range: 0x0006-0xffff
        Attribute type: Characteristic (0x2803)
< HCI Command: Host Number of Comp.. (0x03|0x0035) plen 5  #57 [hci1] 10.003333
        Num handles: 1
        Handle: 1317 Address: DF:A9:FF:F6:B1:1A (OUI DF-A9-FF)
        Count: 1
< ACL Data TX: Handle 1317 flags 0x00 dlen 20              #58 [hci1] 10.003445
      ATT: Read By Type Response (0x09) len 15
        Attribute data length: 7
        Attribute data list: 2 entries
        Handle: 0x0007
        Value: 0208002a2b
            Properties: 0x02
              Read (0x02)
            Value Handle: 0x0008
            Value UUID: Database Hash (0x2b2a)
        Handle: 0x0009
        Value: 020a003a2b
            Properties: 0x02
              Read (0x02)
            Value Handle: 0x000a
            Value UUID: Server Supported Features (0x2b3a)
> HCI Event: Number of Completed Packets (0x13) plen 5     #59 [hci1] 10.157498
        Num handles: 1
        Handle: 1317 Address: DF:A9:FF:F6:B1:1A (OUI DF-A9-FF)
        Count: 1
        #58: len 20 (1 Kb/s)
        Latency: 154 msec (154-159 msec ~156 msec)
> ACL Data RX: Handle 1317 flags 0x02 dlen 11              #60 [hci1] 10.157920
      ATT: Read By Type Request (0x08) len 6
        Handle range: 0x000a-0xffff
        Attribute type: Characteristic (0x2803)
< HCI Command: Host Number of Comp.. (0x03|0x0035) plen 5  #61 [hci1] 10.162788
        Num handles: 1
        Handle: 1317 Address: DF:A9:FF:F6:B1:1A (OUI DF-A9-FF)
        Count: 1
< ACL Data TX: Handle 1317 flags 0x00 dlen 20              #62 [hci1] 10.162841
      ATT: Read By Type Response (0x09) len 15
        Attribute data length: 7
        Attribute data list: 2 entries
        Handle: 0x000c
        Value: 0a0d00002a
            Properties: 0x0a
              Read (0x02)
              Write (0x08)
            Value Handle: 0x000d
            Value UUID: Device Name (0x2a00)
        Handle: 0x000e
        Value: 0a0f00012a
            Properties: 0x0a
              Read (0x02)
              Write (0x08)
            Value Handle: 0x000f
            Value UUID: Appearance (0x2a01)
> HCI Event: Number of Completed Packets (0x13) plen 5     #63 [hci1] 10.332532
        Num handles: 1
        Handle: 1317 Address: DF:A9:FF:F6:B1:1A (OUI DF-A9-FF)
        Count: 1
        #62: len 20 (0 Kb/s)
        Latency: 169 msec (154-169 msec ~163 msec)
> ACL Data RX: Handle 1317 flags 0x02 dlen 11              #64 [hci1] 10.332823
      ATT: Read By Type Request (0x08) len 6
        Handle range: 0x000f-0xffff
        Attribute type: Characteristic (0x2803)
< HCI Command: Host Number of Comp.. (0x03|0x0035) plen 5  #65 [hci1] 10.343280
        Num handles: 1
        Handle: 1317 Address: DF:A9:FF:F6:B1:1A (OUI DF-A9-FF)
        Count: 1
< ACL Data TX: Handle 1317 flags 0x00 dlen 20              #66 [hci1] 10.343392
      ATT: Read By Type Response (0x09) len 15
        Attribute data length: 7
        Attribute data list: 2 entries
        Handle: 0x0010
        Value: 021100042a
            Properties: 0x02
              Read (0x02)
            Value Handle: 0x0011
            Value UUID: Peripheral Preferred Connection Parameters (0x2a04)
        Handle: 0x0013
        Value: 021400242a
            Properties: 0x02
              Read (0x02)
            Value Handle: 0x0014
            Value UUID: Model Number String (0x2a24)
> HCI Event: Number of Completed Packets (0x13) plen 5     #67 [hci1] 10.507633
        Num handles: 1
        Handle: 1317 Address: DF:A9:FF:F6:B1:1A (OUI DF-A9-FF)
        Count: 1
        #66: len 20 (0 Kb/s)
        Latency: 164 msec (154-169 msec ~163 msec)
> ACL Data RX: Handle 1317 flags 0x02 dlen 11              #68 [hci1] 10.507940
      ATT: Read By Type Request (0x08) len 6
        Handle range: 0x0014-0xffff
        Attribute type: Characteristic (0x2803)
< HCI Command: Host Number of Comp.. (0x03|0x0035) plen 5  #69 [hci1] 10.522936
        Num handles: 1
        Handle: 1317 Address: DF:A9:FF:F6:B1:1A (OUI DF-A9-FF)
        Count: 1
< ACL Data TX: Handle 1317 flags 0x00 dlen 20              #70 [hci1] 10.522966
      ATT: Read By Type Response (0x09) len 15
        Attribute data length: 7
        Attribute data list: 2 entries
        Handle: 0x0015
        Value: 021600292a
            Properties: 0x02
              Read (0x02)
            Value Handle: 0x0016
            Value UUID: Manufacturer Name String (0x2a29)
        Handle: 0x0017
        Value: 021800502a
            Properties: 0x02
              Read (0x02)
            Value Handle: 0x0018
            Value UUID: PnP ID (0x2a50)
> HCI Event: Number of Completed Packets (0x13) plen 5     #71 [hci1] 10.682604
        Num handles: 1
        Handle: 1317 Address: DF:A9:FF:F6:B1:1A (OUI DF-A9-FF)
        Count: 1
        #70: len 20 (1 Kb/s)
        Latency: 159 msec (154-169 msec ~161 msec)
> ACL Data RX: Handle 1317 flags 0x02 dlen 11              #72 [hci1] 10.682802
      ATT: Read By Type Request (0x08) len 6
        Handle range: 0x0018-0xffff
        Attribute type: Characteristic (0x2803)
< HCI Command: Host Number of Comp.. (0x03|0x0035) plen 5  #73 [hci1] 10.702963
        Num handles: 1
        Handle: 1317 Address: DF:A9:FF:F6:B1:1A (OUI DF-A9-FF)
        Count: 1
< ACL Data TX: Handle 1317 flags 0x00 dlen 20              #74 [hci1] 10.703009
      ATT: Read By Type Response (0x09) len 15
        Attribute data length: 7
        Attribute data list: 2 entries
        Handle: 0x0019
        Value: 021a00252a
            Properties: 0x02
              Read (0x02)
            Value Handle: 0x001a
            Value UUID: Serial Number String (0x2a25)
        Handle: 0x001b
        Value: 021c00262a
            Properties: 0x02
              Read (0x02)
            Value Handle: 0x001c
            Value UUID: Firmware Revision String (0x2a26)
> HCI Event: Number of Completed Packets (0x13) plen 5     #75 [hci1] 10.857435
        Num handles: 1
        Handle: 1317 Address: DF:A9:FF:F6:B1:1A (OUI DF-A9-FF)
        Count: 1
        #74: len 20 (1 Kb/s)
        Latency: 154 msec (154-169 msec ~158 msec)
> ACL Data RX: Handle 1317 flags 0x02 dlen 11              #76 [hci1] 10.857947
      ATT: Read By Type Request (0x08) len 6
        Handle range: 0x001c-0xffff
        Attribute type: Characteristic (0x2803)
< HCI Command: Host Number of Comp.. (0x03|0x0035) plen 5  #77 [hci1] 10.862913
        Num handles: 1
        Handle: 1317 Address: DF:A9:FF:F6:B1:1A (OUI DF-A9-FF)
        Count: 1
< ACL Data TX: Handle 1317 flags 0x00 dlen 20              #78 [hci1] 10.862983
      ATT: Read By Type Response (0x09) len 15
        Attribute data length: 7
        Attribute data list: 2 entries
        Handle: 0x001d
        Value: 021e00272a
            Properties: 0x02
              Read (0x02)
            Value Handle: 0x001e
            Value UUID: Hardware Revision String (0x2a27)
        Handle: 0x001f
        Value: 022000282a
            Properties: 0x02
              Read (0x02)
            Value Handle: 0x0020
            Value UUID: Software Revision String (0x2a28)
> HCI Event: Number of Completed Packets (0x13) plen 5     #79 [hci1] 11.032601
        Num handles: 1
        Handle: 1317 Address: DF:A9:FF:F6:B1:1A (OUI DF-A9-FF)
        Count: 1
        #78: len 20 (0 Kb/s)
        Latency: 169 msec (154-169 msec ~163 msec)
> ACL Data RX: Handle 1317 flags 0x02 dlen 11              #80 [hci1] 11.032872
      ATT: Read By Type Request (0x08) len 6
        Handle range: 0x0020-0xffff
        Attribute type: Characteristic (0x2803)
< HCI Command: Host Number of Comp.. (0x03|0x0035) plen 5  #81 [hci1] 11.043068
        Num handles: 1
        Handle: 1317 Address: DF:A9:FF:F6:B1:1A (OUI DF-A9-FF)
        Count: 1
< ACL Data TX: Handle 1317 flags 0x00 dlen 20              #82 [hci1] 11.043120
      ATT: Read By Type Response (0x09) len 15
        Attribute data length: 7
        Attribute data list: 2 entries
        Handle: 0x0022
        Value: 0a230050aa
            Properties: 0x0a
              Read (0x02)
              Write (0x08)
            Value Handle: 0x0023
            Value UUID: Unknown (0xaa50)
        Handle: 0x0024
        Value: 0a250051aa
            Properties: 0x0a
              Read (0x02)
              Write (0x08)
            Value Handle: 0x0025
            Value UUID: Unknown (0xaa51)
> HCI Event: Number of Completed Packets (0x13) plen 5     #83 [hci1] 11.207607
        Num handles: 1
        Handle: 1317 Address: DF:A9:FF:F6:B1:1A (OUI DF-A9-FF)
        Count: 1
        #82: len 20 (0 Kb/s)
        Latency: 164 msec (154-169 msec ~164 msec)
> ACL Data RX: Handle 1317 flags 0x02 dlen 11              #84 [hci1] 11.207781
      ATT: Read By Type Request (0x08) len 6
        Handle range: 0x0025-0xffff
        Attribute type: Characteristic (0x2803)
< HCI Command: Host Number of Comp.. (0x03|0x0035) plen 5  #85 [hci1] 11.222957
        Num handles: 1
        Handle: 1317 Address: DF:A9:FF:F6:B1:1A (OUI DF-A9-FF)
        Count: 1
< ACL Data TX: Handle 1317 flags 0x00 dlen 20              #86 [hci1] 11.222995
      ATT: Read By Type Response (0x09) len 15
        Attribute data length: 7
        Attribute data list: 2 entries
        Handle: 0x0026
        Value: 0a270052aa
            Properties: 0x0a
              Read (0x02)
              Write (0x08)
            Value Handle: 0x0027
            Value UUID: Unknown (0xaa52)
        Handle: 0x0028
        Value: 0a290053aa
            Properties: 0x0a
              Read (0x02)
              Write (0x08)
            Value Handle: 0x0029
            Value UUID: Unknown (0xaa53)
> HCI Event: Number of Completed Packets (0x13) plen 5     #87 [hci1] 11.382630
        Num handles: 1
        Handle: 1317 Address: DF:A9:FF:F6:B1:1A (OUI DF-A9-FF)
        Count: 1
        #86: len 20 (1 Kb/s)
        Latency: 159 msec (154-169 msec ~161 msec)
> ACL Data RX: Handle 1317 flags 0x02 dlen 11              #88 [hci1] 11.382925
      ATT: Read By Type Request (0x08) len 6
        Handle range: 0x0029-0xffff
        Attribute type: Characteristic (0x2803)
< HCI Command: Host Number of Comp.. (0x03|0x0035) plen 5  #89 [hci1] 11.403053
        Num handles: 1
        Handle: 1317 Address: DF:A9:FF:F6:B1:1A (OUI DF-A9-FF)
        Count: 1
< ACL Data TX: Handle 1317 flags 0x00 dlen 20              #90 [hci1] 11.403151
      ATT: Read By Type Response (0x09) len 15
        Attribute data length: 7
        Attribute data list: 2 entries
        Handle: 0x002a
        Value: 3a2b0054aa
            Properties: 0x3a
              Read (0x02)
              Write (0x08)
              Notify (0x10)
              Indicate (0x20)
            Value Handle: 0x002b
            Value UUID: Unknown (0xaa54)
        Handle: 0x002d
        Value: 3a2e0055aa
            Properties: 0x3a
              Read (0x02)
              Write (0x08)
              Notify (0x10)
              Indicate (0x20)
            Value Handle: 0x002e
            Value UUID: Unknown (0xaa55)
> HCI Event: Number of Completed Packets (0x13) plen 5     #91 [hci1] 11.557661
        Num handles: 1
        Handle: 1317 Address: DF:A9:FF:F6:B1:1A (OUI DF-A9-FF)
        Count: 1
        #90: len 20 (1 Kb/s)
        Latency: 154 msec (154-169 msec ~158 msec)
> ACL Data RX: Handle 1317 flags 0x02 dlen 11              #92 [hci1] 11.557695
      ATT: Read By Type Request (0x08) len 6
        Handle range: 0x002e-0xffff
        Attribute type: Characteristic (0x2803)
< HCI Command: Host Number of Comp.. (0x03|0x0035) plen 5  #93 [hci1] 11.563150
        Num handles: 1
        Handle: 1317 Address: DF:A9:FF:F6:B1:1A (OUI DF-A9-FF)
        Count: 1
< ACL Data TX: Handle 1317 flags 0x00 dlen 20              #94 [hci1] 11.563248
      ATT: Read By Type Response (0x09) len 15
        Attribute data length: 7
        Attribute data list: 2 entries
        Handle: 0x0030
        Value: 06310056aa
            Properties: 0x06
              Read (0x02)
              Write Without Response (0x04)
            Value Handle: 0x0031
            Value UUID: Unknown (0xaa56)
        Handle: 0x0032
        Value: 06330057aa
            Properties: 0x06
              Read (0x02)
              Write Without Response (0x04)
            Value Handle: 0x0033
            Value UUID: Unknown (0xaa57)
> HCI Event: Number of Completed Packets (0x13) plen 5     #95 [hci1] 11.732488
        Num handles: 1
        Handle: 1317 Address: DF:A9:FF:F6:B1:1A (OUI DF-A9-FF)
        Count: 1
        #94: len 20 (0 Kb/s)
        Latency: 169 msec (154-169 msec ~163 msec)
> ACL Data RX: Handle 1317 flags 0x02 dlen 11              #96 [hci1] 11.732799
      ATT: Read By Type Request (0x08) len 6
        Handle range: 0x0033-0xffff
        Attribute type: Characteristic (0x2803)
< HCI Command: Host Number of Comp.. (0x03|0x0035) plen 5  #97 [hci1] 11.742825
        Num handles: 1
        Handle: 1317 Address: DF:A9:FF:F6:B1:1A (OUI DF-A9-FF)
        Count: 1
< ACL Data TX: Handle 1317 flags 0x00 dlen 20              #98 [hci1] 11.742930
      ATT: Read By Type Response (0x09) len 15
        Attribute data length: 7
        Attribute data list: 2 entries
        Handle: 0x0034
        Value: 8a350058aa
            Properties: 0x8a
              Read (0x02)
              Write (0x08)
            Unknown fields (0x80)
            Value Handle: 0x0035
            Value UUID: Unknown (0xaa58)
        Handle: 0x0037
        Value: 0a380059aa
            Properties: 0x0a
              Read (0x02)
              Write (0x08)
            Value Handle: 0x0038
            Value UUID: Unknown (0xaa59)
> HCI Event: Number of Completed Packets (0x13) plen 5     #99 [hci1] 11.907528
        Num handles: 1
        Handle: 1317 Address: DF:A9:FF:F6:B1:1A (OUI DF-A9-FF)
        Count: 1
        #98: len 20 (0 Kb/s)
        Latency: 164 msec (154-169 msec ~164 msec)
> ACL Data RX: Handle 1317 flags 0x02 dlen 11             #100 [hci1] 11.907894
      ATT: Read By Type Request (0x08) len 6
        Handle range: 0x0038-0xffff
        Attribute type: Characteristic (0x2803)
< HCI Command: Host Number of Com.. (0x03|0x0035) plen 5  #101 [hci1] 11.923062
        Num handles: 1
        Handle: 1317 Address: DF:A9:FF:F6:B1:1A (OUI DF-A9-FF)
        Count: 1
< ACL Data TX: Handle 1317 flags 0x00 dlen 13             #102 [hci1] 11.923145
      ATT: Read By Type Response (0x09) len 8
        Attribute data length: 7
        Attribute data list: 1 entry
        Handle: 0x0039
        Value: 0a3a005aaa
            Properties: 0x0a
              Read (0x02)
              Write (0x08)
            Value Handle: 0x003a
            Value UUID: Unknown (0xaa5a)
> HCI Event: Number of Completed Packets (0x13) plen 5    #103 [hci1] 12.082711
        Num handles: 1
        Handle: 1317 Address: DF:A9:FF:F6:B1:1A (OUI DF-A9-FF)
        Count: 1
        #102: len 13 (0 Kb/s)
        Latency: 159 msec (154-169 msec ~161 msec)
> ACL Data RX: Handle 1317 flags 0x02 dlen 11             #104 [hci1] 12.082787
      ATT: Read By Type Request (0x08) len 6
        Handle range: 0x003a-0xffff
        Attribute type: Characteristic (0x2803)
< HCI Command: Host Number of Com.. (0x03|0x0035) plen 5  #105 [hci1] 12.103466
        Num handles: 1
        Handle: 1317 Address: DF:A9:FF:F6:B1:1A (OUI DF-A9-FF)
        Count: 1
< ACL Data TX: Handle 1317 flags 0x00 dlen 27             #106 [hci1] 12.103537
      ATT: Read By Type Response (0x09) len 22
        Attribute data length: 21
        Attribute data list: 1 entry
        Handle: 0x003b
        Value: 0a3c00efcdab89674523b10040510450bb00f0
            Properties: 0x0a
              Read (0x02)
              Write (0x08)
            Value Handle: 0x003c
            Value UUID: Vendor specific (f000bb50-0451-4000-b123-456789abcdef)
> HCI Event: Number of Completed Packets (0x13) plen 5    #107 [hci1] 12.257590
        Num handles: 1
        Handle: 1317 Address: DF:A9:FF:F6:B1:1A (OUI DF-A9-FF)
        Count: 1
        #106: len 27 (1 Kb/s)
        Latency: 154 msec (154-169 msec ~157 msec)
> ACL Data RX: Handle 1317 flags 0x02 dlen 11             #108 [hci1] 12.257830
      ATT: Read By Type Request (0x08) len 6
        Handle range: 0x003c-0xffff
        Attribute type: Characteristic (0x2803)
< HCI Command: Host Number of Com.. (0x03|0x0035) plen 5  #109 [hci1] 12.262862
        Num handles: 1
        Handle: 1317 Address: DF:A9:FF:F6:B1:1A (OUI DF-A9-FF)
        Count: 1
< ACL Data TX: Handle 1317 flags 0x00 dlen 20             #110 [hci1] 12.262893
      ATT: Read By Type Response (0x09) len 15
        Attribute data length: 7
        Attribute data list: 2 entries
        Handle: 0x003f
        Value: 0a400050aa
            Properties: 0x0a
              Read (0x02)
              Write (0x08)
            Value Handle: 0x0040
            Value UUID: Unknown (0xaa50)
        Handle: 0x0041
        Value: 0a420051aa
            Properties: 0x0a
              Read (0x02)
              Write (0x08)
            Value Handle: 0x0042
            Value UUID: Unknown (0xaa51)
> HCI Event: Number of Completed Packets (0x13) plen 5    #111 [hci1] 12.432563
        Num handles: 1
        Handle: 1317 Address: DF:A9:FF:F6:B1:1A (OUI DF-A9-FF)
        Count: 1
        #110: len 20 (0 Kb/s)
        Latency: 169 msec (154-169 msec ~163 msec)
> ACL Data RX: Handle 1317 flags 0x02 dlen 11             #112 [hci1] 12.432822
      ATT: Read By Type Request (0x08) len 6
        Handle range: 0x0042-0xffff
        Attribute type: Characteristic (0x2803)
< HCI Command: Host Number of Com.. (0x03|0x0035) plen 5  #113 [hci1] 12.443013
        Num handles: 1
        Handle: 1317 Address: DF:A9:FF:F6:B1:1A (OUI DF-A9-FF)
        Count: 1
< ACL Data TX: Handle 1317 flags 0x00 dlen 20             #114 [hci1] 12.443062
      ATT: Read By Type Response (0x09) len 15
        Attribute data length: 7
        Attribute data list: 2 entries
        Handle: 0x0043
        Value: 0a440052aa
            Properties: 0x0a
              Read (0x02)
              Write (0x08)
            Value Handle: 0x0044
            Value UUID: Unknown (0xaa52)
        Handle: 0x0045
        Value: 02460053aa
            Properties: 0x02
              Read (0x02)
            Value Handle: 0x0046
            Value UUID: Unknown (0xaa53)
> HCI Event: Number of Completed Packets (0x13) plen 5    #115 [hci1] 12.607522
        Num handles: 1
        Handle: 1317 Address: DF:A9:FF:F6:B1:1A (OUI DF-A9-FF)
        Count: 1
        #114: len 20 (0 Kb/s)
        Latency: 164 msec (154-169 msec ~164 msec)
> ACL Data RX: Handle 1317 flags 0x02 dlen 11             #116 [hci1] 12.607791
      ATT: Read By Type Request (0x08) len 6
        Handle range: 0x0046-0xffff
        Attribute type: Characteristic (0x2803)
< HCI Command: Host Number of Com.. (0x03|0x0035) plen 5  #117 [hci1] 12.623158
        Num handles: 1
        Handle: 1317 Address: DF:A9:FF:F6:B1:1A (OUI DF-A9-FF)
        Count: 1
< ACL Data TX: Handle 1317 flags 0x00 dlen 20             #118 [hci1] 12.623177
      ATT: Read By Type Response (0x09) len 15
        Attribute data length: 7
        Attribute data list: 2 entries
        Handle: 0x0048
        Value: 0a490055aa
            Properties: 0x0a
              Read (0x02)
              Write (0x08)
            Value Handle: 0x0049
            Value UUID: Unknown (0xaa55)
        Handle: 0x004a
        Value: 0a4b0056aa
            Properties: 0x0a
              Read (0x02)
              Write (0x08)
            Value Handle: 0x004b
            Value UUID: Unknown (0xaa56)
> HCI Event: Number of Completed Packets (0x13) plen 5    #119 [hci1] 12.782480
        Num handles: 1
        Handle: 1317 Address: DF:A9:FF:F6:B1:1A (OUI DF-A9-FF)
        Count: 1
        #118: len 20 (1 Kb/s)
        Latency: 159 msec (154-169 msec ~161 msec)
> ACL Data RX: Handle 1317 flags 0x02 dlen 11             #120 [hci1] 12.782705
      ATT: Read By Type Request (0x08) len 6
        Handle range: 0x004b-0xffff
        Attribute type: Characteristic (0x2803)
< HCI Command: Host Number of Com.. (0x03|0x0035) plen 5  #121 [hci1] 12.802803
        Num handles: 1
        Handle: 1317 Address: DF:A9:FF:F6:B1:1A (OUI DF-A9-FF)
        Count: 1
< ACL Data TX: Handle 1317 flags 0x00 dlen 9              #122 [hci1] 12.802955
      ATT: Error Response (0x01) len 4
        Read By Type Request (0x08)
        Handle: 0x004b
        Error: Attribute Not Found (0x0a)
> HCI Event: Number of Completed Packets (0x13) plen 5    #123 [hci1] 12.957504
        Num handles: 1
        Handle: 1317 Address: DF:A9:FF:F6:B1:1A (OUI DF-A9-FF)
        Count: 1
        #122: len 9 (0 Kb/s)
        Latency: 154 msec (154-169 msec ~158 msec)
> ACL Data RX: Handle 1317 flags 0x02 dlen 7              #124 [hci1] 12.957793
      ATT: Read Request (0x0a) len 2
        Handle: 0x000a
< HCI Command: Host Number of Com.. (0x03|0x0035) plen 5  #125 [hci1] 12.962977
        Num handles: 1
        Handle: 1317 Address: DF:A9:FF:F6:B1:1A (OUI DF-A9-FF)
        Count: 1
< ACL Data TX: Handle 1317 flags 0x00 dlen 6              #126 [hci1] 12.963070
      ATT: Read Response (0x0b) len 1
> HCI Event: Number of Completed Packets (0x13) plen 5    #127 [hci1] 13.132599
        Num handles: 1
        Handle: 1317 Address: DF:A9:FF:F6:B1:1A (OUI DF-A9-FF)
        Count: 1
        #126: len 6 (0 Kb/s)
        Latency: 169 msec (154-169 msec ~163 msec)
> ACL Data RX: Handle 1317 flags 0x02 dlen 11             #128 [hci1] 13.132809
      ATT: Read By Type Request (0x08) len 6
        Handle range: 0x0001-0xffff
        Attribute type: Characteristic (0x2803)
< HCI Command: Host Number of Com.. (0x03|0x0035) plen 5  #129 [hci1] 13.143246
        Num handles: 1
        Handle: 1317 Address: DF:A9:FF:F6:B1:1A (OUI DF-A9-FF)
        Count: 1
< ACL Data TX: Handle 1317 flags 0x00 dlen 20             #130 [hci1] 13.143481
      ATT: Read By Type Response (0x09) len 15
        Attribute data length: 7
        Attribute data list: 2 entries
        Handle: 0x0002
        Value: 200300052a
            Properties: 0x20
              Indicate (0x20)
            Value Handle: 0x0003
            Value UUID: Service Changed (0x2a05)
        Handle: 0x0005
        Value: 0a0600292b
            Properties: 0x0a
              Read (0x02)
              Write (0x08)
            Value Handle: 0x0006
            Value UUID: Client Supported Features (0x2b29)
> HCI Event: Number of Completed Packets (0x13) plen 5    #131 [hci1] 13.307543
        Num handles: 1
        Handle: 1317 Address: DF:A9:FF:F6:B1:1A (OUI DF-A9-FF)
        Count: 1
        #130: len 20 (0 Kb/s)
        Latency: 164 msec (154-169 msec ~163 msec)
> ACL Data RX: Handle 1317 flags 0x02 dlen 11             #132 [hci1] 13.307804
      ATT: Read By Type Request (0x08) len 6
        Handle range: 0x0006-0xffff
        Attribute type: Characteristic (0x2803)
< HCI Command: Host Number of Com.. (0x03|0x0035) plen 5  #133 [hci1] 13.323441
        Num handles: 1
        Handle: 1317 Address: DF:A9:FF:F6:B1:1A (OUI DF-A9-FF)
        Count: 1
< ACL Data TX: Handle 1317 flags 0x00 dlen 20             #134 [hci1] 13.323665
      ATT: Read By Type Response (0x09) len 15
        Attribute data length: 7
        Attribute data list: 2 entries
        Handle: 0x0007
        Value: 0208002a2b
            Properties: 0x02
              Read (0x02)
            Value Handle: 0x0008
            Value UUID: Database Hash (0x2b2a)
        Handle: 0x0009
        Value: 020a003a2b
            Properties: 0x02
              Read (0x02)
            Value Handle: 0x000a
            Value UUID: Server Supported Features (0x2b3a)
> HCI Event: Number of Completed Packets (0x13) plen 5    #135 [hci1] 13.482500
        Num handles: 1
        Handle: 1317 Address: DF:A9:FF:F6:B1:1A (OUI DF-A9-FF)
        Count: 1
        #134: len 20 (1 Kb/s)
        Latency: 158 msec (154-169 msec ~161 msec)
> ACL Data RX: Handle 1317 flags 0x02 dlen 11             #136 [hci1] 13.482755
      ATT: Read By Type Request (0x08) len 6
        Handle range: 0x000a-0xffff
        Attribute type: Characteristic (0x2803)
< HCI Command: Host Number of Com.. (0x03|0x0035) plen 5  #137 [hci1] 13.502875
        Num handles: 1
        Handle: 1317 Address: DF:A9:FF:F6:B1:1A (OUI DF-A9-FF)
        Count: 1
< ACL Data TX: Handle 1317 flags 0x00 dlen 20             #138 [hci1] 13.502897
      ATT: Read By Type Response (0x09) len 15
        Attribute data length: 7
        Attribute data list: 2 entries
        Handle: 0x000c
        Value: 0a0d00002a
            Properties: 0x0a
              Read (0x02)
              Write (0x08)
            Value Handle: 0x000d
            Value UUID: Device Name (0x2a00)
        Handle: 0x000e
        Value: 0a0f00012a
            Properties: 0x0a
              Read (0x02)
              Write (0x08)
            Value Handle: 0x000f
            Value UUID: Appearance (0x2a01)
< ACL Data TX: Handle 1317 flags 0x00 dlen 16             #139 [hci1] 13.592898
      LE L2CAP: Connection Parameter Update Request (0x12) ident 1 len 8
        Min interval: 24
        Max interval: 40
        Peripheral latency: 0
        Timeout multiplier: 42
> HCI Event: Number of Completed Packets (0x13) plen 5    #140 [hci1] 13.657578
        Num handles: 1
        Handle: 1317 Address: DF:A9:FF:F6:B1:1A (OUI DF-A9-FF)
        Count: 1
        #138: len 20 (1 Kb/s)
        Latency: 154 msec (154-169 msec ~158 msec)
> ACL Data RX: Handle 1317 flags 0x02 dlen 11             #141 [hci1] 13.657746
      ATT: Read By Type Request (0x08) len 6
        Handle range: 0x000f-0xffff
        Attribute type: Characteristic (0x2803)
< HCI Command: Host Number of Com.. (0x03|0x0035) plen 5  #142 [hci1] 13.663663
        Num handles: 1
        Handle: 1317 Address: DF:A9:FF:F6:B1:1A (OUI DF-A9-FF)
        Count: 1
< ACL Data TX: Handle 1317 flags 0x00 dlen 20             #143 [hci1] 13.663752
      ATT: Read By Type Response (0x09) len 15
        Attribute data length: 7
        Attribute data list: 2 entries
        Handle: 0x0010
        Value: 021100042a
            Properties: 0x02
              Read (0x02)
            Value Handle: 0x0011
            Value UUID: Peripheral Preferred Connection Parameters (0x2a04)
        Handle: 0x0013
        Value: 021400242a
            Properties: 0x02
              Read (0x02)
            Value Handle: 0x0014
            Value UUID: Model Number String (0x2a24)
> HCI Event: Number of Completed Packets (0x13) plen 5    #144 [hci1] 13.745091
        Num handles: 1
        Handle: 1317 Address: DF:A9:FF:F6:B1:1A (OUI DF-A9-FF)
        Count: 1
        #139: len 16 (0 Kb/s)
        Latency: 152 msec (152-169 msec ~155 msec)
> ACL Data RX: Handle 1317 flags 0x02 dlen 10             #145 [hci1] 13.745132
      LE L2CAP: Connection Parameter Update Response (0x13) ident 1 len 2
        Result: Connection Parameters accepted (0x0000)
< HCI Command: Host Number of Com.. (0x03|0x0035) plen 5  #146 [hci1] 13.763041
        Num handles: 1
        Handle: 1317 Address: DF:A9:FF:F6:B1:1A (OUI DF-A9-FF)
        Count: 1
> HCI Event: Number of Completed Packets (0x13) plen 5    #147 [hci1] 13.832658
        Num handles: 1
        Handle: 1317 Address: DF:A9:FF:F6:B1:1A (OUI DF-A9-FF)
        Count: 1
        #143: len 20 (0 Kb/s)
        Latency: 168 msec (152-169 msec ~162 msec)
> ACL Data RX: Handle 1317 flags 0x02 dlen 11             #148 [hci1] 13.832745
      ATT: Read By Type Request (0x08) len 6
        Handle range: 0x0014-0xffff
        Attribute type: Characteristic (0x2803)
< HCI Command: Host Number of Com.. (0x03|0x0035) plen 5  #149 [hci1] 13.842961
        Num handles: 1
        Handle: 1317 Address: DF:A9:FF:F6:B1:1A (OUI DF-A9-FF)
        Count: 1
< ACL Data TX: Handle 1317 flags 0x00 dlen 20             #150 [hci1] 13.843050
      ATT: Read By Type Response (0x09) len 15
        Attribute data length: 7
        Attribute data list: 2 entries
        Handle: 0x0015
        Value: 021600292a
            Properties: 0x02
              Read (0x02)
            Value Handle: 0x0016
            Value UUID: Manufacturer Name String (0x2a29)
        Handle: 0x0017
        Value: 021800502a
            Properties: 0x02
              Read (0x02)
            Value Handle: 0x0018
            Value UUID: PnP ID (0x2a50)
> HCI Event: Number of Completed Packets (0x13) plen 5    #151 [hci1] 14.007489
        Num handles: 1
        Handle: 1317 Address: DF:A9:FF:F6:B1:1A (OUI DF-A9-FF)
        Count: 1
        #150: len 20 (0 Kb/s)
        Latency: 164 msec (152-169 msec ~163 msec)
> ACL Data RX: Handle 1317 flags 0x02 dlen 11             #152 [hci1] 14.007751
      ATT: Read By Type Request (0x08) len 6
        Handle range: 0x0018-0xffff
        Attribute type: Characteristic (0x2803)
< HCI Command: Host Number of Com.. (0x03|0x0035) plen 5  #153 [hci1] 14.023114
        Num handles: 1
        Handle: 1317 Address: DF:A9:FF:F6:B1:1A (OUI DF-A9-FF)
        Count: 1
< ACL Data TX: Handle 1317 flags 0x00 dlen 20             #154 [hci1] 14.023170
      ATT: Read By Type Response (0x09) len 15
        Attribute data length: 7
        Attribute data list: 2 entries
        Handle: 0x0019
        Value: 021a00252a
            Properties: 0x02
              Read (0x02)
            Value Handle: 0x001a
            Value UUID: Serial Number String (0x2a25)
        Handle: 0x001b
        Value: 021c00262a
            Properties: 0x02
              Read (0x02)
            Value Handle: 0x001c
            Value UUID: Firmware Revision String (0x2a26)
> HCI Event: Number of Completed Packets (0x13) plen 5    #155 [hci1] 14.182512
        Num handles: 1
        Handle: 1317 Address: DF:A9:FF:F6:B1:1A (OUI DF-A9-FF)
        Count: 1
        #154: len 20 (1 Kb/s)
        Latency: 159 msec (152-169 msec ~161 msec)
> ACL Data RX: Handle 1317 flags 0x02 dlen 11             #156 [hci1] 14.182785
      ATT: Read By Type Request (0x08) len 6
        Handle range: 0x001c-0xffff
        Attribute type: Characteristic (0x2803)
< HCI Command: Host Number of Com.. (0x03|0x0035) plen 5  #157 [hci1] 14.202870
        Num handles: 1
        Handle: 1317 Address: DF:A9:FF:F6:B1:1A (OUI DF-A9-FF)
        Count: 1
< ACL Data TX: Handle 1317 flags 0x00 dlen 20             #158 [hci1] 14.202900
      ATT: Read By Type Response (0x09) len 15
        Attribute data length: 7
        Attribute data list: 2 entries
        Handle: 0x001d
        Value: 021e00272a
            Properties: 0x02
              Read (0x02)
            Value Handle: 0x001e
            Value UUID: Hardware Revision String (0x2a27)
        Handle: 0x001f
        Value: 022000282a
            Properties: 0x02
              Read (0x02)
            Value Handle: 0x0020
            Value UUID: Software Revision String (0x2a28)
> HCI Event: Number of Completed Packets (0x13) plen 5    #159 [hci1] 14.357577
        Num handles: 1
        Handle: 1317 Address: DF:A9:FF:F6:B1:1A (OUI DF-A9-FF)
        Count: 1
        #158: len 20 (1 Kb/s)
        Latency: 154 msec (152-169 msec ~157 msec)
> ACL Data RX: Handle 1317 flags 0x02 dlen 11             #160 [hci1] 14.357866
      ATT: Read By Type Request (0x08) len 6
        Handle range: 0x0020-0xffff
        Attribute type: Characteristic (0x2803)
< HCI Command: Host Number of Com.. (0x03|0x0035) plen 5  #161 [hci1] 14.363299
        Num handles: 1
        Handle: 1317 Address: DF:A9:FF:F6:B1:1A (OUI DF-A9-FF)
        Count: 1
< ACL Data TX: Handle 1317 flags 0x00 dlen 20             #162 [hci1] 14.363439
      ATT: Read By Type Response (0x09) len 15
        Attribute data length: 7
        Attribute data list: 2 entries
        Handle: 0x0022
        Value: 0a230050aa
            Properties: 0x0a
              Read (0x02)
              Write (0x08)
            Value Handle: 0x0023
            Value UUID: Unknown (0xaa50)
        Handle: 0x0024
        Value: 0a250051aa
            Properties: 0x0a
              Read (0x02)
              Write (0x08)
            Value Handle: 0x0025
            Value UUID: Unknown (0xaa51)
> HCI Event: Number of Completed Packets (0x13) plen 5    #163 [hci1] 14.532534
        Num handles: 1
        Handle: 1317 Address: DF:A9:FF:F6:B1:1A (OUI DF-A9-FF)
        Count: 1
        #162: len 20 (0 Kb/s)
        Latency: 169 msec (152-169 msec ~163 msec)
> ACL Data RX: Handle 1317 flags 0x02 dlen 11             #164 [hci1] 14.532651
      ATT: Read By Type Request (0x08) len 6
        Handle range: 0x0025-0xffff
        Attribute type: Characteristic (0x2803)
< HCI Command: Host Number of Com.. (0x03|0x0035) plen 5  #165 [hci1] 14.542720
        Num handles: 1
        Handle: 1317 Address: DF:A9:FF:F6:B1:1A (OUI DF-A9-FF)
        Count: 1
< ACL Data TX: Handle 1317 flags 0x00 dlen 20             #166 [hci1] 14.542927
      ATT: Read By Type Response (0x09) len 15
        Attribute data length: 7
        Attribute data list: 2 entries
        Handle: 0x0026
        Value: 0a270052aa
            Properties: 0x0a
              Read (0x02)
              Write (0x08)
            Value Handle: 0x0027
            Value UUID: Unknown (0xaa52)
        Handle: 0x0028
        Value: 0a290053aa
            Properties: 0x0a
              Read (0x02)
              Write (0x08)
            Value Handle: 0x0029
            Value UUID: Unknown (0xaa53)
> HCI Event: Number of Completed Packets (0x13) plen 5    #167 [hci1] 14.707461
        Num handles: 1
        Handle: 1317 Address: DF:A9:FF:F6:B1:1A (OUI DF-A9-FF)
        Count: 1
        #166: len 20 (0 Kb/s)
        Latency: 164 msec (152-169 msec ~164 msec)
> ACL Data RX: Handle 1317 flags 0x02 dlen 11             #168 [hci1] 14.707813
      ATT: Read By Type Request (0x08) len 6
        Handle range: 0x0029-0xffff
        Attribute type: Characteristic (0x2803)
< HCI Command: Host Number of Com.. (0x03|0x0035) plen 5  #169 [hci1] 14.724984
        Num handles: 1
        Handle: 1317 Address: DF:A9:FF:F6:B1:1A (OUI DF-A9-FF)
        Count: 1
< ACL Data TX: Handle 1317 flags 0x00 dlen 20             #170 [hci1] 14.724997
      ATT: Read By Type Response (0x09) len 15
        Attribute data length: 7
        Attribute data list: 2 entries
        Handle: 0x002a
        Value: 3a2b0054aa
            Properties: 0x3a
              Read (0x02)
              Write (0x08)
              Notify (0x10)
              Indicate (0x20)
            Value Handle: 0x002b
            Value UUID: Unknown (0xaa54)
        Handle: 0x002d
        Value: 3a2e0055aa
            Properties: 0x3a
              Read (0x02)
              Write (0x08)
              Notify (0x10)
              Indicate (0x20)
            Value Handle: 0x002e
            Value UUID: Unknown (0xaa55)
> HCI Event: Number of Completed Packets (0x13) plen 5    #171 [hci1] 14.882465
        Num handles: 1
        Handle: 1317 Address: DF:A9:FF:F6:B1:1A (OUI DF-A9-FF)
        Count: 1
        #170: len 20 (1 Kb/s)
        Latency: 157 msec (152-169 msec ~160 msec)
> ACL Data RX: Handle 1317 flags 0x02 dlen 11             #172 [hci1] 14.882718
      ATT: Read By Type Request (0x08) len 6
        Handle range: 0x002e-0xffff
        Attribute type: Characteristic (0x2803)
< HCI Command: Host Number of Com.. (0x03|0x0035) plen 5  #173 [hci1] 14.902808
        Num handles: 1
        Handle: 1317 Address: DF:A9:FF:F6:B1:1A (OUI DF-A9-FF)
        Count: 1
< ACL Data TX: Handle 1317 flags 0x00 dlen 20             #174 [hci1] 14.902814
      ATT: Read By Type Response (0x09) len 15
        Attribute data length: 7
        Attribute data list: 2 entries
        Handle: 0x0030
        Value: 06310056aa
            Properties: 0x06
              Read (0x02)
              Write Without Response (0x04)
            Value Handle: 0x0031
            Value UUID: Unknown (0xaa56)
        Handle: 0x0032
        Value: 06330057aa
            Properties: 0x06
              Read (0x02)
              Write Without Response (0x04)
            Value Handle: 0x0033
            Value UUID: Unknown (0xaa57)
> HCI Event: Number of Completed Packets (0x13) plen 5    #175 [hci1] 15.057503
        Num handles: 1
        Handle: 1317 Address: DF:A9:FF:F6:B1:1A (OUI DF-A9-FF)
        Count: 1
        #174: len 20 (1 Kb/s)
        Latency: 154 msec (152-169 msec ~157 msec)
> ACL Data RX: Handle 1317 flags 0x02 dlen 11             #176 [hci1] 15.057834
      ATT: Read By Type Request (0x08) len 6
        Handle range: 0x0033-0xffff
        Attribute type: Characteristic (0x2803)
< HCI Command: Host Number of Com.. (0x03|0x0035) plen 5  #177 [hci1] 15.063156
        Num handles: 1
        Handle: 1317 Address: DF:A9:FF:F6:B1:1A (OUI DF-A9-FF)
        Count: 1
< ACL Data TX: Handle 1317 flags 0x00 dlen 20             #178 [hci1] 15.063216
      ATT: Read By Type Response (0x09) len 15
        Attribute data length: 7
        Attribute data list: 2 entries
        Handle: 0x0034
        Value: 8a350058aa
            Properties: 0x8a
              Read (0x02)
              Write (0x08)
            Unknown fields (0x80)
            Value Handle: 0x0035
            Value UUID: Unknown (0xaa58)
        Handle: 0x0037
        Value: 0a380059aa
            Properties: 0x0a
              Read (0x02)
              Write (0x08)
            Value Handle: 0x0038
            Value UUID: Unknown (0xaa59)
> HCI Event: Number of Completed Packets (0x13) plen 5    #179 [hci1] 15.232451
        Num handles: 1
        Handle: 1317 Address: DF:A9:FF:F6:B1:1A (OUI DF-A9-FF)
        Count: 1
        #178: len 20 (0 Kb/s)
        Latency: 169 msec (152-169 msec ~163 msec)
> ACL Data RX: Handle 1317 flags 0x02 dlen 11             #180 [hci1] 15.232728
      ATT: Read By Type Request (0x08) len 6
        Handle range: 0x0038-0xffff
        Attribute type: Characteristic (0x2803)
< HCI Command: Host Number of Com.. (0x03|0x0035) plen 5  #181 [hci1] 15.242781
        Num handles: 1
        Handle: 1317 Address: DF:A9:FF:F6:B1:1A (OUI DF-A9-FF)
        Count: 1
< ACL Data TX: Handle 1317 flags 0x00 dlen 13             #182 [hci1] 15.242821
      ATT: Read By Type Response (0x09) len 8
        Attribute data length: 7
        Attribute data list: 1 entry
        Handle: 0x0039
        Value: 0a3a005aaa
            Properties: 0x0a
              Read (0x02)
              Write (0x08)
            Value Handle: 0x003a
            Value UUID: Unknown (0xaa5a)
> HCI Event: Number of Completed Packets (0x13) plen 5    #183 [hci1] 15.407565
        Num handles: 1
        Handle: 1317 Address: DF:A9:FF:F6:B1:1A (OUI DF-A9-FF)
        Count: 1
        #182: len 13 (0 Kb/s)
        Latency: 164 msec (152-169 msec ~164 msec)
> ACL Data RX: Handle 1317 flags 0x02 dlen 11             #184 [hci1] 15.407680
      ATT: Read By Type Request (0x08) len 6
        Handle range: 0x003a-0xffff
        Attribute type: Characteristic (0x2803)
< HCI Command: Host Number of Com.. (0x03|0x0035) plen 5  #185 [hci1] 15.423446
        Num handles: 1
        Handle: 1317 Address: DF:A9:FF:F6:B1:1A (OUI DF-A9-FF)
        Count: 1
< ACL Data TX: Handle 1317 flags 0x00 dlen 27             #186 [hci1] 15.423559
      ATT: Read By Type Response (0x09) len 22
        Attribute data length: 21
        Attribute data list: 1 entry
        Handle: 0x003b
        Value: 0a3c00efcdab89674523b10040510450bb00f0
            Properties: 0x0a
              Read (0x02)
              Write (0x08)
            Value Handle: 0x003c
            Value UUID: Vendor specific (f000bb50-0451-4000-b123-456789abcdef)
> HCI Event: Number of Completed Packets (0x13) plen 5    #187 [hci1] 15.582483
        Num handles: 1
        Handle: 1317 Address: DF:A9:FF:F6:B1:1A (OUI DF-A9-FF)
        Count: 1
        #186: len 27 (1 Kb/s)
        Latency: 158 msec (152-169 msec ~161 msec)
> ACL Data RX: Handle 1317 flags 0x02 dlen 11             #188 [hci1] 15.582728
      ATT: Read By Type Request (0x08) len 6
        Handle range: 0x003c-0xffff
        Attribute type: Characteristic (0x2803)
< HCI Command: Host Number of Com.. (0x03|0x0035) plen 5  #189 [hci1] 15.602906
        Num handles: 1
        Handle: 1317 Address: DF:A9:FF:F6:B1:1A (OUI DF-A9-FF)
        Count: 1
< ACL Data TX: Handle 1317 flags 0x00 dlen 20             #190 [hci1] 15.602942
      ATT: Read By Type Response (0x09) len 15
        Attribute data length: 7
        Attribute data list: 2 entries
        Handle: 0x003f
        Value: 0a400050aa
            Properties: 0x0a
              Read (0x02)
              Write (0x08)
            Value Handle: 0x0040
            Value UUID: Unknown (0xaa50)
        Handle: 0x0041
        Value: 0a420051aa
            Properties: 0x0a
              Read (0x02)
              Write (0x08)
            Value Handle: 0x0042
            Value UUID: Unknown (0xaa51)
> HCI Event: Number of Completed Packets (0x13) plen 5    #191 [hci1] 15.757509
        Num handles: 1
        Handle: 1317 Address: DF:A9:FF:F6:B1:1A (OUI DF-A9-FF)
        Count: 1
        #190: len 20 (1 Kb/s)
        Latency: 154 msec (152-169 msec ~158 msec)
> ACL Data RX: Handle 1317 flags 0x02 dlen 11             #192 [hci1] 15.757724
      ATT: Read By Type Request (0x08) len 6
        Handle range: 0x0042-0xffff
        Attribute type: Characteristic (0x2803)
< HCI Command: Host Number of Com.. (0x03|0x0035) plen 5  #193 [hci1] 15.763422
        Num handles: 1
        Handle: 1317 Address: DF:A9:FF:F6:B1:1A (OUI DF-A9-FF)
        Count: 1
< ACL Data TX: Handle 1317 flags 0x00 dlen 20             #194 [hci1] 15.763501
      ATT: Read By Type Response (0x09) len 15
        Attribute data length: 7
        Attribute data list: 2 entries
        Handle: 0x0043
        Value: 0a440052aa
            Properties: 0x0a
              Read (0x02)
              Write (0x08)
            Value Handle: 0x0044
            Value UUID: Unknown (0xaa52)
        Handle: 0x0045
        Value: 02460053aa
            Properties: 0x02
              Read (0x02)
            Value Handle: 0x0046
            Value UUID: Unknown (0xaa53)
> HCI Event: Number of Completed Packets (0x13) plen 5    #195 [hci1] 15.932462
        Num handles: 1
        Handle: 1317 Address: DF:A9:FF:F6:B1:1A (OUI DF-A9-FF)
        Count: 1
        #194: len 20 (0 Kb/s)
        Latency: 168 msec (152-169 msec ~163 msec)
> ACL Data RX: Handle 1317 flags 0x02 dlen 11             #196 [hci1] 15.932700
      ATT: Read By Type Request (0x08) len 6
        Handle range: 0x0046-0xffff
        Attribute type: Characteristic (0x2803)
< HCI Command: Host Number of Com.. (0x03|0x0035) plen 5  #197 [hci1] 15.943446
        Num handles: 1
        Handle: 1317 Address: DF:A9:FF:F6:B1:1A (OUI DF-A9-FF)
        Count: 1
< ACL Data TX: Handle 1317 flags 0x00 dlen 20             #198 [hci1] 15.943494
      ATT: Read By Type Response (0x09) len 15
        Attribute data length: 7
        Attribute data list: 2 entries
        Handle: 0x0048
        Value: 0a490055aa
            Properties: 0x0a
              Read (0x02)
              Write (0x08)
            Value Handle: 0x0049
            Value UUID: Unknown (0xaa55)
        Handle: 0x004a
        Value: 0a4b0056aa
            Properties: 0x0a
              Read (0x02)
              Write (0x08)
            Value Handle: 0x004b
            Value UUID: Unknown (0xaa56)
> HCI Event: Number of Completed Packets (0x13) plen 5    #199 [hci1] 16.107517
        Num handles: 1
        Handle: 1317 Address: DF:A9:FF:F6:B1:1A (OUI DF-A9-FF)
        Count: 1
        #198: len 20 (0 Kb/s)
        Latency: 164 msec (152-169 msec ~163 msec)
> ACL Data RX: Handle 1317 flags 0x02 dlen 11             #200 [hci1] 16.107728
      ATT: Read By Type Request (0x08) len 6
        Handle range: 0x004b-0xffff
        Attribute type: Characteristic (0x2803)
< HCI Command: Host Number of Com.. (0x03|0x0035) plen 5  #201 [hci1] 16.123032
        Num handles: 1
        Handle: 1317 Address: DF:A9:FF:F6:B1:1A (OUI DF-A9-FF)
        Count: 1
< ACL Data TX: Handle 1317 flags 0x00 dlen 9              #202 [hci1] 16.123152
      ATT: Error Response (0x01) len 4
        Read By Type Request (0x08)
        Handle: 0x004b
        Error: Attribute Not Found (0x0a)
> HCI Event: Number of Completed Packets (0x13) plen 5    #203 [hci1] 16.282419
        Num handles: 1
        Handle: 1317 Address: DF:A9:FF:F6:B1:1A (OUI DF-A9-FF)
        Count: 1
        #202: len 9 (0 Kb/s)
        Latency: 159 msec (152-169 msec ~161 msec)
> ACL Data RX: Handle 1317 flags 0x02 dlen 7              #204 [hci1] 16.282653
      ATT: Read Request (0x0a) len 2
        Handle: 0x0006
< HCI Command: Host Number of Com.. (0x03|0x0035) plen 5  #205 [hci1] 16.283333
        Num handles: 1
        Handle: 1317 Address: DF:A9:FF:F6:B1:1A (OUI DF-A9-FF)
        Count: 1
< ACL Data TX: Handle 1317 flags 0x00 dlen 6              #206 [hci1] 16.283425
      ATT: Read Response (0x0b) len 1
> HCI Event: Number of Completed Packets (0x13) plen 5    #207 [hci1] 16.457409
        Num handles: 1
        Handle: 1317 Address: DF:A9:FF:F6:B1:1A (OUI DF-A9-FF)
        Count: 1
        #206: len 6 (0 Kb/s)
        Latency: 173 msec (152-173 msec ~167 msec)
> ACL Data RX: Handle 1317 flags 0x02 dlen 8              #208 [hci1] 16.457653
      ATT: Write Request (0x12) len 3
        Handle: 0x0006
          Data: 02
< HCI Command: Host Number of Com.. (0x03|0x0035) plen 5  #209 [hci1] 16.463450
        Num handles: 1
        Handle: 1317 Address: DF:A9:FF:F6:B1:1A (OUI DF-A9-FF)
        Count: 1
< ACL Data TX: Handle 1317 flags 0x00 dlen 5              #210 [hci1] 16.463468
      ATT: Write Response (0x13) len 0
> HCI Event: Number of Completed Packets (0x13) plen 5    #211 [hci1] 16.632383
        Num handles: 1
        Handle: 1317 Address: DF:A9:FF:F6:B1:1A (OUI DF-A9-FF)
        Count: 1
        #210: len 5 (0 Kb/s)
        Latency: 168 msec (152-173 msec ~168 msec)
> ACL Data RX: Handle 1317 flags 0x02 dlen 11             #212 [hci1] 19.169989
      SMP: Pairing Request (0x01) len 6
        IO capability: KeyboardDisplay (0x04)
        OOB data: Authentication data not present (0x00)
        Authentication requirement: Bonding, No MITM, SC, No Keypresses (0x09)
        Max encryption key size: 16
        Initiator key distribution: EncKey IdKey Sign (0x07)
        Responder key distribution: EncKey IdKey Sign (0x07)
< HCI Command: Host Number of Com.. (0x03|0x0035) plen 5  #213 [hci1] 19.183025
        Num handles: 1
        Handle: 1317 Address: DF:A9:FF:F6:B1:1A (OUI DF-A9-FF)
        Count: 1
< ACL Data TX: Handle 1317 flags 0x00 dlen 11             #214 [hci1] 19.183138
      SMP: Pairing Response (0x02) len 6
        IO capability: DisplayOnly (0x00)
        OOB data: Authentication data not present (0x00)
        Authentication requirement: Bonding, No MITM, SC, No Keypresses (0x09)
        Max encryption key size: 16
        Initiator key distribution: IdKey (0x02)
        Responder key distribution: <none> (0x00)
> HCI Event: Number of Completed Packets (0x13) plen 5    #215 [hci1] 19.345058
        Num handles: 1
        Handle: 1317 Address: DF:A9:FF:F6:B1:1A (OUI DF-A9-FF)
        Count: 1
        #214: len 11 (0 Kb/s)
        Latency: 161 msec (152-173 msec ~165 msec)
> ACL Data RX: Handle 1317 flags 0x02 dlen 27             #216 [hci1] 19.345359
> ACL Data RX: Handle 1317 flags 0x01 dlen 27             #217 [hci1] 19.345959
> ACL Data RX: Handle 1317 flags 0x01 dlen 15             #218 [hci1] 19.346345
      SMP: Pairing Public Key (0x0c) len 64
        X: b6f1808299d02dfe4266e7223b6acac736b3a63860f158df3e15e9713d1ccef2
        Y: 5652d437d0fb289f7b411dfdae7d6bc2050cdae4c98bed143f9650047da2f00c
< HCI Command: Host Number of Com.. (0x03|0x0035) plen 5  #219 [hci1] 19.363421
        Num handles: 1
        Handle: 1317 Address: DF:A9:FF:F6:B1:1A (OUI DF-A9-FF)
        Count: 1
< HCI Command: Host Number of Com.. (0x03|0x0035) plen 5  #220 [hci1] 19.363635
        Num handles: 1
        Handle: 1317 Address: DF:A9:FF:F6:B1:1A (OUI DF-A9-FF)
        Count: 1
< HCI Command: Host Number of Com.. (0x03|0x0035) plen 5  #221 [hci1] 19.363858
        Num handles: 1
        Handle: 1317 Address: DF:A9:FF:F6:B1:1A (OUI DF-A9-FF)
        Count: 1
< ACL Data TX: Handle 1317 flags 0x00 dlen 27             #222 [hci1] 19.363942
< ACL Data TX: Handle 1317 flags 0x01 dlen 27             #223 [hci1] 19.363960
< ACL Data TX: Handle 1317 flags 0x01 dlen 15             #224 [hci1] 19.363964
      SMP: Pairing Public Key (0x0c) len 64
        X: 98308440221e2d910f0e54b71e7ec652857aa9b5a0dc65028824cc19db1226e9
        Y: 67a4816bcb62efb21701e31fdb27561a6217575fb007a8bbdabe7e28b6f68482
> HCI Event: Number of Completed Packets (0x13) plen 5    #225 [hci1] 19.432872
        Num handles: 1
        Handle: 1317 Address: DF:A9:FF:F6:B1:1A (OUI DF-A9-FF)
        Count: 1
        #222: len 27 (3 Kb/s)
        Latency: 68 msec (68-173 msec ~117 msec)
> HCI Event: Number of Completed Packets (0x13) plen 5    #226 [hci1] 19.433594
        Num handles: 1
        Handle: 1317 Address: DF:A9:FF:F6:B1:1A (OUI DF-A9-FF)
        Count: 1
        #223: len 27 (3 Kb/s)
        Latency: 69 msec (68-173 msec ~93 msec)
< ACL Data TX: Handle 1317 flags 0x00 dlen 21             #227 [hci1] 19.442825
      SMP: Pairing Confirm (0x03) len 16
        Confim value: 942d0fdbbd2d515d635ba0081c4eab48
> HCI Event: Number of Completed Packets (0x13) plen 5    #228 [hci1] 19.519821
        Num handles: 1
        Handle: 1317 Address: DF:A9:FF:F6:B1:1A (OUI DF-A9-FF)
        Count: 1
        #224: len 15 (0 Kb/s)
        Latency: 155 msec (68-173 msec ~124 msec)
> HCI Event: Number of Completed Packets (0x13) plen 5    #229 [hci1] 19.607499
        Num handles: 1
        Handle: 1317 Address: DF:A9:FF:F6:B1:1A (OUI DF-A9-FF)
        Count: 1
        #227: len 21 (1 Kb/s)
        Latency: 164 msec (68-173 msec ~144 msec)
> ACL Data RX: Handle 1317 flags 0x02 dlen 21             #230 [hci1] 19.607879
      SMP: Pairing Random (0x04) len 16
        Random value: 13a1813558d65d960000000000000000
< HCI Command: Host Number of Com.. (0x03|0x0035) plen 5  #231 [hci1] 19.623018
        Num handles: 1
        Handle: 1317 Address: DF:A9:FF:F6:B1:1A (OUI DF-A9-FF)
        Count: 1
< ACL Data TX: Handle 1317 flags 0x00 dlen 21             #232 [hci1] 19.623041
      SMP: Pairing Random (0x04) len 16
        Random value: 8e6108f966a694cbe26df70bb96773e6
> HCI Event: Number of Completed Packets (0x13) plen 5    #233 [hci1] 19.782368
        Num handles: 1
        Handle: 1317 Address: DF:A9:FF:F6:B1:1A (OUI DF-A9-FF)
        Count: 1
        #232: len 21 (1 Kb/s)
        Latency: 159 msec (68-173 msec ~151 msec)
> ACL Data RX: Handle 1317 flags 0x02 dlen 21             #234 [hci1] 19.957641
      SMP: Pairing DHKey Check (0x0d) len 16
        E: 02568dd988391a7a23591ad2f5c5b101
< HCI Command: Host Number of Com.. (0x03|0x0035) plen 5  #235 [hci1] 19.963696
        Num handles: 1
        Handle: 1317 Address: DF:A9:FF:F6:B1:1A (OUI DF-A9-FF)
        Count: 1
< ACL Data TX: Handle 1317 flags 0x00 dlen 21             #236 [hci1] 19.963783
      SMP: Pairing DHKey Check (0x0d) len 16
        E: ce5e08ea7b58122b1a73e3c03c4a1e0e
> HCI Event: Number of Completed Packets (0x13) plen 5    #237 [hci1] 20.132237
        Num handles: 1
        Handle: 1317 Address: DF:A9:FF:F6:B1:1A (OUI DF-A9-FF)
        Count: 1
        #236: len 21 (1 Kb/s)
        Latency: 168 msec (68-173 msec ~160 msec)
> HCI Event: LE Meta Event (0x3e) plen 13                 #238 [hci1] 20.220448
      LE Long Term Key Request (0x05)
        Handle: 1317 Address: DF:A9:FF:F6:B1:1A (OUI DF-A9-FF)
        Random number: 0x0000000000000000
        Encrypted diversifier: 0x0000
< HCI Command: LE Long Term Key... (0x08|0x001a) plen 18  #239 [hci1] 20.223196
        Handle: 1317 Address: DF:A9:FF:F6:B1:1A (OUI DF-A9-FF)
        Long term key: bbb59c6974adfe40f6b5a637f916301e
> HCI Event: Command Complete (0x0e) plen 6               #240 [hci1] 20.224089
      LE Long Term Key Request Reply (0x08|0x001a) ncmd 1
        Status: Success (0x00)
        Handle: 1317 Address: DF:A9:FF:F6:B1:1A (OUI DF-A9-FF)
> HCI Event: Encryption Change (0x08) plen 4              #241 [hci1] 20.657573
        Status: Success (0x00)
        Handle: 1317 Address: DF:A9:FF:F6:B1:1A (OUI DF-A9-FF)
        Encryption: Enabled with AES-CCM (0x01)
> ACL Data RX: Handle 1317 flags 0x02 dlen 21             #242 [hci1] 20.745315
      SMP: Identity Information (0x08) len 16
        Identity resolving key: e51b5a2b7ee198008d47e5d613e1d9f4
< HCI Command: Host Number of Com.. (0x03|0x0035) plen 5  #243 [hci1] 20.773472
        Num handles: 1
        Handle: 1317 Address: DF:A9:FF:F6:B1:1A (OUI DF-A9-FF)
        Count: 1
> ACL Data RX: Handle 1317 flags 0x02 dlen 12             #244 [hci1] 20.832556
      SMP: Identity Address Information (0x09) len 7
        Address: DF:A9:FF:F6:B1:1A (OUI DF-A9-FF)
> ACL Data RX: Handle 1317 flags 0x02 dlen 26             #245 [hci1] 20.833303
      LE L2CAP: Enhanced Credit Connection Request (0x17) ident 1 len 18
        PSM: 39 (0x0027)
        MTU: 64
        MPS: 64
        Credits: 5
        Source CID: 84
        Source CID: 83
        Source CID: 82
        Source CID: 81
        Source CID: 80
< HCI Command: LE Add Device To... (0x08|0x0027) plen 39  #246 [hci1] 20.843392
        Address type: Public (0x00)
        Address: DF:A9:FF:F6:B1:1A (OUI DF-A9-FF)
        Peer identity resolving key: e51b5a2b7ee198008d47e5d613e1d9f4
        Local identity resolving key: 00000000000000000000000000000000
> HCI Event: Command Complete (0x0e) plen 4               #247 [hci1] 20.844388
      LE Add Device To Resolving List (0x08|0x0027) ncmd 1
        Status: Success (0x00)
< HCI Command: LE Set Privacy Mode (0x08|0x004e) plen 8   #248 [hci1] 20.863085
        Peer Identity address type: Public (0x00)
        Peer Identity address: DF:A9:FF:F6:B1:1A (OUI DF-A9-FF)
        Privacy Mode: Use Device Privacy (0x01)
> HCI Event: Command Complete (0x0e) plen 4               #249 [hci1] 20.863805
      LE Set Privacy Mode (0x08|0x004e) ncmd 1
        Status: Success (0x00)
< HCI Command: LE Set Address Res.. (0x08|0x002d) plen 1  #250 [hci1] 20.883174
        Address resolution: Enabled (0x01)
> HCI Event: Command Complete (0x0e) plen 4               #251 [hci1] 20.883654
      LE Set Address Resolution Enable (0x08|0x002d) ncmd 1
        Status: Success (0x00)
< HCI Command: Host Number of Com.. (0x03|0x0035) plen 5  #252 [hci1] 20.903139
        Num handles: 1
        Handle: 1317 Address: DF:A9:FF:F6:B1:1A (OUI DF-A9-FF)
        Count: 1
< HCI Command: Host Number of Com.. (0x03|0x0035) plen 5  #253 [hci1] 20.903552
        Num handles: 1
        Handle: 1317 Address: DF:A9:FF:F6:B1:1A (OUI DF-A9-FF)
        Count: 1
< ACL Data TX: Handle 1317 flags 0x00 dlen 26             #254 [hci1] 20.903599
      LE L2CAP: Enhanced Credit Connection Response (0x18) ident 1 len 18
        MTU: 249
        MPS: 251
        Credits: 1
        Result: Connection successful (0x0000)
        Destination CID: 64
        Destination CID: 65
        Destination CID: 66
        Destination CID: 67
        Destination CID: 68
> HCI Event: Number of Completed Packets (0x13) plen 5    #255 [hci1] 21.007275
        Num handles: 1
        Handle: 1317 Address: DF:A9:FF:F6:B1:1A (OUI DF-A9-FF)
        Count: 1
        #254: len 26 (2 Kb/s)
        Latency: 103 msec (68-173 msec ~131 msec)
> ACL Data RX: Handle 1317 flags 0x02 dlen 13             #256 [hci1] 23.020141
      Channel: 68 len 9 sdu 7 [PSM 39 mode Enhanced Credit (0x81)] {chan 4}
      ATT: Read By Group Type Request (0x10) len 6
        Handle range: 0x0001-0xffff
        Attribute group type: Primary Service (0x2800)
< HCI Command: Host Number of Com.. (0x03|0x0035) plen 5  #257 [hci1] 23.022903
        Num handles: 1
        Handle: 1317 Address: DF:A9:FF:F6:B1:1A (OUI DF-A9-FF)
        Count: 1
< ACL Data TX: Handle 1317 flags 0x00 dlen 27             #258 [hci1] 23.022909
< ACL Data TX: Handle 1317 flags 0x01 dlen 5              #259 [hci1] 23.022910
      Channel: 80 len 28 sdu 26 [PSM 39 mode Enhanced Credit (0x81)] {chan 4}
      ATT: Read By Group Type Response (0x11) len 25
        Attribute data length: 6
        Attribute group list: 4 entries
        Handle range: 0x0001-0x000a
        UUID: Generic Attribute Profile (0x1801)
        Handle range: 0x000b-0x0011
        UUID: Generic Access Profile (0x1800)
        Handle range: 0x0012-0x0020
        UUID: Device Information (0x180a)
        Handle range: 0x003d-0x004b
        UUID: Unknown (0xaa41)
< ACL Data TX: Handle 1317 flags 0x00 dlen 12             #260 [hci1] 23.023016
      LE L2CAP: LE Flow Control Credit (0x16) ident 2 len 4
        Source CID: 68
        Credits: 1
> HCI Event: Number of Completed Packets (0x13) plen 5    #261 [hci1] 23.107968
        Num handles: 1
        Handle: 1317 Address: DF:A9:FF:F6:B1:1A (OUI DF-A9-FF)
        Count: 1
        #258: len 27 (2 Kb/s)
        Latency: 85 msec (68-173 msec ~108 msec)
        Channel: 80 [PSM 39 mode Enhanced Credit (0x81)] {chan 4}
        Channel Latency: 85 msec (85-85 msec ~85 msec)
> HCI Event: Number of Completed Packets (0x13) plen 5    #262 [hci1] 23.108727
        Num handles: 1
        Handle: 1317 Address: DF:A9:FF:F6:B1:1A (OUI DF-A9-FF)
        Count: 1
        #259: len 5 (0 Kb/s)
        Latency: 85 msec (68-173 msec ~97 msec)
        Channel: 80 [PSM 39 mode Enhanced Credit (0x81)] {chan 4}
        Channel Latency: 85 msec (85-85 msec ~85 msec)
> HCI Event: Number of Completed Packets (0x13) plen 5    #263 [hci1] 23.194908
        Num handles: 1
        Handle: 1317 Address: DF:A9:FF:F6:B1:1A (OUI DF-A9-FF)
        Count: 1
        #260: len 12 (0 Kb/s)
        Latency: 171 msec (68-173 msec ~134 msec)
> ACL Data RX: Handle 1317 flags 0x02 dlen 13             #264 [hci1] 23.195153
      Channel: 68 len 9 sdu 7 [PSM 39 mode Enhanced Credit (0x81)] {chan 4}
      ATT: Read By Group Type Request (0x10) len 6
        Handle range: 0x004c-0xffff
        Attribute group type: Primary Service (0x2800)
< HCI Command: Host Number of Com.. (0x03|0x0035) plen 5  #265 [hci1] 23.203550
        Num handles: 1
        Handle: 1317 Address: DF:A9:FF:F6:B1:1A (OUI DF-A9-FF)
        Count: 1
< ACL Data TX: Handle 1317 flags 0x00 dlen 11             #266 [hci1] 23.203723
      Channel: 80 len 7 sdu 5 [PSM 39 mode Enhanced Credit (0x81)] {chan 4}
      ATT: Error Response (0x01) len 4
        Read By Group Type Request (0x10)
        Handle: 0x004c
        Error: Attribute Not Found (0x0a)
< ACL Data TX: Handle 1317 flags 0x00 dlen 12             #267 [hci1] 23.203884
      LE L2CAP: LE Flow Control Credit (0x16) ident 3 len 4
        Source CID: 68
        Credits: 1
> HCI Event: Number of Completed Packets (0x13) plen 5    #268 [hci1] 23.282805
        Num handles: 1
        Handle: 1317 Address: DF:A9:FF:F6:B1:1A (OUI DF-A9-FF)
        Count: 1
        #266: len 11 (1 Kb/s)
        Latency: 79 msec (68-173 msec ~106 msec)
        Channel: 80 [PSM 39 mode Enhanced Credit (0x81)] {chan 4}
        Channel Latency: 79 msec (79-85 msec ~82 msec)
> HCI Event: Number of Completed Packets (0x13) plen 5    #269 [hci1] 23.369970
        Num handles: 1
        Handle: 1317 Address: DF:A9:FF:F6:B1:1A (OUI DF-A9-FF)
        Count: 1
        #267: len 12 (0 Kb/s)
        Latency: 166 msec (68-173 msec ~136 msec)
        Channel: 80 [PSM 39 mode Enhanced Credit (0x81)] {chan 4}
        Channel Latency: 166 msec (79-166 msec ~124 msec)
> ACL Data RX: Handle 1317 flags 0x02 dlen 15             #270 [hci1] 23.370242
      Channel: 68 len 11 sdu 9 [PSM 39 mode Enhanced Credit (0x81)] {chan 4}
      ATT: Find By Type Value Request (0x06) len 8
        Handle range: 0x0001-0xffff
        Attribute type: Primary Service (0x2800)
          UUID: Generic Attribute Profile (0x1801)
< HCI Command: Host Number of Com.. (0x03|0x0035) plen 5  #271 [hci1] 23.383592
        Num handles: 1
        Handle: 1317 Address: DF:A9:FF:F6:B1:1A (OUI DF-A9-FF)
        Count: 1
< ACL Data TX: Handle 1317 flags 0x00 dlen 11             #272 [hci1] 23.383671
      Channel: 80 len 7 sdu 5 [PSM 39 mode Enhanced Credit (0x81)] {chan 4}
      ATT: Find By Type Value Response (0x07) len 4
        Handle range: 0x0001-0x000a
< ACL Data TX: Handle 1317 flags 0x00 dlen 12             #273 [hci1] 23.383787
      LE L2CAP: LE Flow Control Credit (0x16) ident 4 len 4
        Source CID: 68
        Credits: 1
> HCI Event: Number of Completed Packets (0x13) plen 5    #274 [hci1] 23.457931
        Num handles: 1
        Handle: 1317 Address: DF:A9:FF:F6:B1:1A (OUI DF-A9-FF)
        Count: 1
        #272: len 11 (1 Kb/s)
        Latency: 74 msec (68-173 msec ~105 msec)
> HCI Event: Number of Completed Packets (0x13) plen 5    #275 [hci1] 23.544912
        Num handles: 1
        Handle: 1317 Address: DF:A9:FF:F6:B1:1A (OUI DF-A9-FF)
        Count: 1
        #273: len 12 (0 Kb/s)
        Latency: 161 msec (68-173 msec ~133 msec)
        Channel: 80 [PSM 39 mode Enhanced Credit (0x81)] {chan 4}
        Channel Latency: 161 msec (79-166 msec ~142 msec)
> ACL Data RX: Handle 1317 flags 0x02 dlen 15             #276 [hci1] 23.545274
      Channel: 68 len 11 sdu 9 [PSM 39 mode Enhanced Credit (0x81)] {chan 4}
      ATT: Find By Type Value Request (0x06) len 8
        Handle range: 0x000b-0xffff
        Attribute type: Primary Service (0x2800)
          UUID: Generic Attribute Profile (0x1801)
< HCI Command: Host Number of Com.. (0x03|0x0035) plen 5  #277 [hci1] 23.563435
        Num handles: 1
        Handle: 1317 Address: DF:A9:FF:F6:B1:1A (OUI DF-A9-FF)
        Count: 1
< ACL Data TX: Handle 1317 flags 0x00 dlen 11             #278 [hci1] 23.563643
      Channel: 80 len 7 sdu 5 [PSM 39 mode Enhanced Credit (0x81)] {chan 4}
      ATT: Error Response (0x01) len 4
        Find By Type Value Request (0x06)
        Handle: 0x000b
        Error: Attribute Not Found (0x0a)
< ACL Data TX: Handle 1317 flags 0x00 dlen 12             #279 [hci1] 23.563802
      LE L2CAP: LE Flow Control Credit (0x16) ident 5 len 4
        Source CID: 68
        Credits: 1
> HCI Event: Number of Completed Packets (0x13) plen 5    #280 [hci1] 23.632752
        Num handles: 1
        Handle: 1317 Address: DF:A9:FF:F6:B1:1A (OUI DF-A9-FF)
        Count: 1
        #278: len 11 (1 Kb/s)
        Latency: 69 msec (68-173 msec ~101 msec)
        Channel: 80 [PSM 39 mode Enhanced Credit (0x81)] {chan 4}
        Channel Latency: 69 msec (69-166 msec ~105 msec)
> HCI Event: Number of Completed Packets (0x13) plen 5    #281 [hci1] 23.719956
        Num handles: 1
        Handle: 1317 Address: DF:A9:FF:F6:B1:1A (OUI DF-A9-FF)
        Count: 1
        #279: len 12 (0 Kb/s)
        Latency: 156 msec (68-173 msec ~128 msec)
> ACL Data RX: Handle 1317 flags 0x02 dlen 12             #282 [hci1] 23.720030
      LE L2CAP: LE Flow Control Credit (0x16) ident 2 len 4
        Source CID: 80
        Credits: 10
> ACL Data RX: Handle 1317 flags 0x02 dlen 13             #283 [hci1] 23.720548
      Channel: 68 len 9 sdu 7 [PSM 39 mode Enhanced Credit (0x81)] {chan 4}
      ATT: Read By Type Request (0x08) len 6
        Handle range: 0x0001-0x000a
        Attribute type: Characteristic (0x2803)
< HCI Command: Host Number of Com.. (0x03|0x0035) plen 5  #284 [hci1] 23.723033
        Num handles: 1
        Handle: 1317 Address: DF:A9:FF:F6:B1:1A (OUI DF-A9-FF)
        Count: 1
< HCI Command: Host Number of Com.. (0x03|0x0035) plen 5  #285 [hci1] 23.723203
        Num handles: 1
        Handle: 1317 Address: DF:A9:FF:F6:B1:1A (OUI DF-A9-FF)
        Count: 1
< ACL Data TX: Handle 1317 flags 0x00 dlen 27             #286 [hci1] 23.723253
< ACL Data TX: Handle 1317 flags 0x01 dlen 9              #287 [hci1] 23.723267
      Channel: 80 len 32 sdu 30 [PSM 39 mode Enhanced Credit (0x81)] {chan 4}
      ATT: Read By Type Response (0x09) len 29
        Attribute data length: 7
        Attribute data list: 4 entries
        Handle: 0x0002
        Value: 200300052a
            Properties: 0x20
              Indicate (0x20)
            Value Handle: 0x0003
            Value UUID: Service Changed (0x2a05)
        Handle: 0x0005
        Value: 0a0600292b
            Properties: 0x0a
              Read (0x02)
              Write (0x08)
            Value Handle: 0x0006
            Value UUID: Client Supported Features (0x2b29)
        Handle: 0x0007
        Value: 0208002a2b
            Properties: 0x02
              Read (0x02)
            Value Handle: 0x0008
            Value UUID: Database Hash (0x2b2a)
        Handle: 0x0009
        Value: 020a003a2b
            Properties: 0x02
              Read (0x02)
            Value Handle: 0x000a
            Value UUID: Server Supported Features (0x2b3a)
< ACL Data TX: Handle 1317 flags 0x00 dlen 12             #288 [hci1] 23.723329
      LE L2CAP: LE Flow Control Credit (0x16) ident 6 len 4
        Source CID: 68
        Credits: 1
> HCI Event: Number of Completed Packets (0x13) plen 5    #289 [hci1] 23.807983
        Num handles: 1
        Handle: 1317 Address: DF:A9:FF:F6:B1:1A (OUI DF-A9-FF)
        Count: 1
        #286: len 27 (2 Kb/s)
        Latency: 84 msec (68-173 msec ~106 msec)
        Channel: 80 [PSM 39 mode Enhanced Credit (0x81)] {chan 4}
        Channel Latency: 84 msec (69-166 msec ~95 msec)
> HCI Event: Number of Completed Packets (0x13) plen 5    #290 [hci1] 23.808470
        Num handles: 1
        Handle: 1317 Address: DF:A9:FF:F6:B1:1A (OUI DF-A9-FF)
        Count: 1
        #287: len 9 (0 Kb/s)
        Latency: 85 msec (68-173 msec ~95 msec)
        Channel: 80 [PSM 39 mode Enhanced Credit (0x81)] {chan 4}
        Channel Latency: 85 msec (69-166 msec ~90 msec)
> HCI Event: Number of Completed Packets (0x13) plen 5    #291 [hci1] 23.894892
        Num handles: 1
        Handle: 1317 Address: DF:A9:FF:F6:B1:1A (OUI DF-A9-FF)
        Count: 1
        #288: len 12 (0 Kb/s)
        Latency: 171 msec (68-173 msec ~133 msec)
> ACL Data RX: Handle 1317 flags 0x02 dlen 13             #292 [hci1] 23.895223
      Channel: 68 len 9 sdu 7 [PSM 39 mode Enhanced Credit (0x81)] {chan 4}
      ATT: Read By Type Request (0x08) len 6
        Handle range: 0x000a-0x000a
        Attribute type: Characteristic (0x2803)
< HCI Command: Host Number of Com.. (0x03|0x0035) plen 5  #293 [hci1] 23.903525
        Num handles: 1
        Handle: 1317 Address: DF:A9:FF:F6:B1:1A (OUI DF-A9-FF)
        Count: 1
< ACL Data TX: Handle 1317 flags 0x00 dlen 11             #294 [hci1] 23.903769
      Channel: 80 len 7 sdu 5 [PSM 39 mode Enhanced Credit (0x81)] {chan 4}
      ATT: Error Response (0x01) len 4
        Read By Type Request (0x08)
        Handle: 0x000a
        Error: Attribute Not Found (0x0a)
< ACL Data TX: Handle 1317 flags 0x00 dlen 12             #295 [hci1] 23.903962
      LE L2CAP: LE Flow Control Credit (0x16) ident 7 len 4
        Source CID: 68
        Credits: 1
> HCI Event: Number of Completed Packets (0x13) plen 5    #296 [hci1] 23.982790
        Num handles: 1
        Handle: 1317 Address: DF:A9:FF:F6:B1:1A (OUI DF-A9-FF)
        Count: 1
        #294: len 11 (1 Kb/s)
        Latency: 79 msec (68-173 msec ~106 msec)
        Channel: 80 [PSM 39 mode Enhanced Credit (0x81)] {chan 4}
        Channel Latency: 79 msec (69-166 msec ~84 msec)
> HCI Event: Number of Completed Packets (0x13) plen 5    #297 [hci1] 24.069759
        Num handles: 1
        Handle: 1317 Address: DF:A9:FF:F6:B1:1A (OUI DF-A9-FF)
        Count: 1
        #295: len 12 (0 Kb/s)
        Latency: 165 msec (68-173 msec ~136 msec)
        Channel: 80 [PSM 39 mode Enhanced Credit (0x81)] {chan 4}
        Channel Latency: 165 msec (69-166 msec ~125 msec)
> HCI Event: Disconnect Complete (0x05) plen 4            #298 [hci1] 25.470026
        Status: Success (0x00)
        Handle: 1317 Address: DF:A9:FF:F6:B1:1A (OUI DF-A9-FF)
        Reason: Remote User Terminated Connection (0x13)
< HCI Command: Reset (0x03|0x0003) plen 0                 #299 [hci1] 31.832991
> HCI Event: Command Complete (0x0e) plen 4               #300 [hci1] 31.833561
      Reset (0x03|0x0003) ncmd 1
        Status: Success (0x00)
@ USER Close: main                                    {0x0001} [hci1] 31.842909
= Close Index: 00:00:00:00:00:00                               [hci1] 31.842917
