Bluetooth monitor ver 5.72
= Note: Linux version 6.14.0-36-generic (x86_64)                       0.565821
= Note: Bluetooth subsystem version 2.22                               0.565824
= New Index: 00:00:00:00:00:00 (Primary,UART,hci1)              [hci1] 0.565826
= New Index: 48:5F:99:8E:E0:64 (Primary,USB,hci0)               [hci0] 0.565827
= Open Index: 00:00:00:00:00:00                                 [hci1] 1.081879
= Index Info: 00:00:00:00:00:00 (Nordic Semiconductor ASA)      [hci1] 1.081894
@ USER Open: main (privileged) version 2.22            {0x0001} [hci1] 1.081902
< HCI Command: Reset (0x03|0x0003) plen 0                    #1 [hci1] 1.083051
> HCI Event: Command Complete (0x0e) plen 4                  #2 [hci1] 1.083538
      Reset (0x03|0x0003) ncmd 1
        Status: Success (0x00)
< HCI Command: Read Local Supported... (0x04|0x0003) plen 0  #3 [hci1] 1.101698
> HCI Event: Command Complete (0x0e) plen 12                 #4 [hci1] 1.102215
      Read Local Supported Features (0x04|0x0003) ncmd 1
        Status: Success (0x00)
        Features: 0x00 0x00 0x00 0x00 0x60 0x00 0x00 0x00
          BR/EDR Not Supported
          LE Supported (Controller)
< HCI Command: Read Local Version In.. (0x04|0x0001) plen 0  #5 [hci1] 1.121331
> HCI Event: Command Complete (0x0e) plen 12                 #6 [hci1] 1.121882
      Read Local Version Information (0x04|0x0001) ncmd 1
        Status: Success (0x00)
        HCI version: Reserved (0x0f) - Revision 12393 (0x3069)
        LMP version: Reserved (0x0f) - Subversion 12393 (0x3069)
        Manufacturer: Nordic Semiconductor ASA (89)
< HCI Command: Read Local Supported... (0x04|0x0002) plen 0  #7 [hci1] 1.141278
> HCI Event: Command Complete (0x0e) plen 68                 #8 [hci1] 1.142327
      Read Local Supported Commands (0x04|0x0002) ncmd 1
        Status: Success (0x00)
        Commands: 119 entries
          Disconnect (Octet 0 - Bit 5)
          Read Remote Version Information (Octet 2 - Bit 7)
          Set Event Mask (Octet 5 - Bit 6)
          Reset (Octet 5 - Bit 7)
          Read Connection Accept Timeout (Octet 7 - Bit 2)
          Write Connection Accept Timeout (Octet 7 - Bit 3)
          Read Transmit Power Level (Octet 10 - Bit 2)
          Set Controller To Host Flow Control (Octet 10 - Bit 5)
          Host Buffer Size (Octet 10 - Bit 6)
          Host Number of Completed Packets (Octet 10 - Bit 7)
          Read Local Version Information (Octet 14 - Bit 3)
          Read Local Supported Features (Octet 14 - Bit 5)
          Read BD ADDR (Octet 15 - Bit 1)
          Read RSSI (Octet 15 - Bit 5)
          Set Event Mask Page 2 (Octet 22 - Bit 2)
          LE Set Event Mask (Octet 25 - Bit 0)
          LE Read Buffer Size (Octet 25 - Bit 1)
          LE Read Local Supported Features (Octet 25 - Bit 2)
          LE Set Random Address (Octet 25 - Bit 4)
          LE Set Advertising Parameters (Octet 25 - Bit 5)
          LE Read Advertising Channel TX Power (Octet 25 - Bit 6)
          LE Set Advertising Data (Octet 25 - Bit 7)
          LE Set Scan Response Data (Octet 26 - Bit 0)
          LE Set Advertise Enable (Octet 26 - Bit 1)
          LE Set Scan Parameters (Octet 26 - Bit 2)
          LE Set Scan Enable (Octet 26 - Bit 3)
          LE Create Connection (Octet 26 - Bit 4)
          LE Create Connection Cancel (Octet 26 - Bit 5)
          LE Read Accept List Size (Octet 26 - Bit 6)
          LE Clear Accept List (Octet 26 - Bit 7)
          LE Add Device To Accept List (Octet 27 - Bit 0)
          LE Remove Device From Accept List (Octet 27 - Bit 1)
          LE Connection Update (Octet 27 - Bit 2)
          LE Set Host Channel Classification (Octet 27 - Bit 3)
          LE Read Channel Map (Octet 27 - Bit 4)
          LE Read Remote Used Features (Octet 27 - Bit 5)
          LE Encrypt (Octet 27 - Bit 6)
          LE Rand (Octet 27 - Bit 7)
          LE Start Encryption (Octet 28 - Bit 0)
          LE Long Term Key Request Reply (Octet 28 - Bit 1)
          LE Long Term Key Request Neg Reply (Octet 28 - Bit 2)
          LE Read Supported States (Octet 28 - Bit 3)
          LE Receiver Test (Octet 28 - Bit 4)
          LE Transmitter Test (Octet 28 - Bit 5)
          LE Test End (Octet 28 - Bit 6)
          Read Authenticated Payload Timeout (Octet 32 - Bit 4)
          Write Authenticated Payload Timeout (Octet 32 - Bit 5)
          LE Set Data Length (Octet 33 - Bit 6)
          LE Read Suggested Default Data Length (Octet 33 - Bit 7)
          LE Write Suggested Default Data Length (Octet 34 - Bit 0)
          LE Add Device To Resolving List (Octet 34 - Bit 3)
          LE Remove Device From Resolving List (Octet 34 - Bit 4)
          LE Clear Resolving List (Octet 34 - Bit 5)
          LE Read Resolving List Size (Octet 34 - Bit 6)
          LE Set Address Resolution Enable (Octet 35 - Bit 1)
          LE Set Resolvable Private Address Timeout (Octet 35 - Bit 2)
          LE Read Maximum Data Length (Octet 35 - Bit 3)
          LE Read PHY (Octet 35 - Bit 4)
          LE Set Default PHY (Octet 35 - Bit 5)
          LE Set PHY (Octet 35 - Bit 6)
          LE Enhanced Receiver Test (Octet 35 - Bit 7)
          LE Enhanced Transmitter Test (Octet 36 - Bit 0)
          LE Set Advertising Set Random Address (Octet 36 - Bit 1)
          LE Set Extended Advertising Parameters (Octet 36 - Bit 2)
          LE Set Extended Advertising Data (Octet 36 - Bit 3)
          LE Set Extended Scan Response Data (Octet 36 - Bit 4)
          LE Set Extended Advertising Enable (Octet 36 - Bit 5)
          LE Read Maximum Advertising Data Length (Octet 36 - Bit 6)
          LE Read Number of Supported Advertising Sets (Octet 36 - Bit 7)
          LE Remove Advertising Set (Octet 37 - Bit 0)
          LE Clear Advertising Sets (Octet 37 - Bit 1)
          LE Set Periodic Advertising Parameters (Octet 37 - Bit 2)
          LE Set Periodic Advertising Data (Octet 37 - Bit 3)
          LE Set Periodic Advertising Enable (Octet 37 - Bit 4)
          LE Set Extended Scan Parameters (Octet 37 - Bit 5)
          LE Set Extended Scan Enable (Octet 37 - Bit 6)
          LE Extended Create Connection (Octet 37 - Bit 7)
          LE Periodic Advertising Create Sync (Octet 38 - Bit 0)
          LE Periodic Advertising Create Sync Cancel (Octet 38 - Bit 1)
          LE Periodic Advertising Terminate Sync (Octet 38 - Bit 2)
          LE Add Device To Periodic Advertiser List (Octet 38 - Bit 3)
          LE Remove Device From Periodic Advertiser List (Octet 38 - Bit 4)
          LE Clear Periodic Advertiser List (Octet 38 - Bit 5)
          LE Read Periodic Advertiser List Size (Octet 38 - Bit 6)
          LE Read Transmit Power (Octet 38 - Bit 7)
          LE Read RF Path Compensation (Octet 39 - Bit 0)
          LE Write RF Path Compensation (Octet 39 - Bit 1)
          LE Set Privacy Mode (Octet 39 - Bit 2)
          LE Periodic Advertising Receive Enable (Octet 40 - Bit 5)
          LE Periodic Advertising Sync Transfer (Octet 40 - Bit 6)
          LE Periodic Advertising Set Info Transfer (Octet 40 - Bit 7)
          LE Periodic Advertising Sync Transfer Parameters (Octet 41 - Bit 0)
          LE Set Default Periodic Advertisng Sync Transfer Parameters (Octet 41 - Bit 1)
          LE Read Buffer v2 (Octet 41 - Bit 5)
          LE Read ISO TX Sync (Octet 41 - Bit 6)
          LE Set Connected Isochronous Group Parameters (Octet 41 - Bit 7)
          LE Set Connected Isochronous Group Parameters Test (Octet 42 - Bit 0)
          LE Create Connected Isochronous Stream (Octet 42 - Bit 1)
          LE Remove Connected Isochronous Group (Octet 42 - Bit 2)
          LE Accept Connected Isochronous Stream Request (Octet 42 - Bit 3)
          LE Reject Connected Isochronous Stream Request (Octet 42 - Bit 4)
          LE Create Broadcast Isochronous Group (Octet 42 - Bit 5)
          LE Create Broadcast Isochronous Group Test (Octet 42 - Bit 6)
          LE Terminate Broadcast Isochronous Group (Octet 42 - Bit 7)
          LE Broadcast Isochronous Group Create Sync (Octet 43 - Bit 0)
          LE Broadcast Isochronous Group Terminate Sync (Octet 43 - Bit 1)
          LE Request Peer SCA (Octet 43 - Bit 2)
          LE Setup Isochronous Data Path (Octet 43 - Bit 3)
          LE Remove Isochronous Data Path (Octet 43 - Bit 4)
          LE Isochronous Transmit Test (Octet 43 - Bit 5)
          LE Isochronous Receive Test (Octet 43 - Bit 6)
          LE Isochronous Read Test Counters (Octet 43 - Bit 7)
          LE Isochronous Read Test Counters (Octet 44 - Bit 0)
          LE Set Host Feature (Octet 44 - Bit 1)
          Octet 44 - Bit 2 
          Octet 45 - Bit 6 
          Octet 46 - Bit 0 
          Octet 46 - Bit 1 
          Octet 46 - Bit 2 
< HCI Command: Host Buffer Size (0x03|0x0033) plen 7         #9 [hci1] 1.161288
        ACL MTU: 255  ACL max packet: 16
        SCO MTU: 0    SCO max packet: 0
> HCI Event: Command Complete (0x0e) plen 4                 #10 [hci1] 1.161834
      Host Buffer Size (0x03|0x0033) ncmd 1
        Status: Success (0x00)
< HCI Command: Set Controller To Ho.. (0x03|0x0031) plen 1  #11 [hci1] 1.181289
        Flow control: ACL Data Packets (0x01)
> HCI Event: Command Complete (0x0e) plen 4                 #12 [hci1] 1.181832
      Set Controller To Host Flow Control (0x03|0x0031) ncmd 1
        Status: Success (0x00)
< HCI Command: LE Read Local Suppor.. (0x08|0x0003) plen 0  #13 [hci1] 1.201291
> HCI Event: Command Complete (0x0e) plen 12                #14 [hci1] 1.201898
      LE Read Local Supported Features (0x08|0x0003) ncmd 1
        Status: Success (0x00)
        Features: 0xfd 0x79 0x00 0xf7 0x30 0x01 0x00 0x00
          LE Encryption
          Extended Reject Indication
          Peripheral-initiated Features Exchange
          LE Ping
          LE Data Packet Length Extension
          LL Privacy
          Extended Scanner Filter Policies
          LE 2M PHY
          LE Coded PHY
          LE Extended Advertising
          LE Periodic Advertising
          Channel Selection Algorithm #2
          Periodic Advertising Sync Transfer - Sender
          Periodic Advertising Sync Transfer - Recipient
          Sleep Clock Accuracy Updates
          Connected Isochronous Stream - Central
          Connected Isochronous Stream - Peripheral
          Isochronous Broadcaster
          Synchronized Receiver
          Periodic Advertising ADI support
          Connection Subrating
          Unknown features (0x0000010000000000)
< HCI Command: LE Set Host Feature (0x08|0x0074) plen 2     #15 [hci1] 1.221295
        Bit Number: 32
          Connected Isochronous Stream (Host Support)
        Bit Value: 1
> HCI Event: Command Complete (0x0e) plen 4                 #16 [hci1] 1.221662
      LE Set Host Feature (0x08|0x0074) ncmd 1
        Status: Success (0x00)
< HCI Command: LE Read Buffer v2 (0x08|0x0060) plen 0       #17 [hci1] 1.241275
> HCI Event: Command Complete (0x0e) plen 10                #18 [hci1] 1.241748
      LE Read Buffer v2 (0x08|0x0060) ncmd 1
        Status: Success (0x00)
        ACL MTU: 27
        ACL max packet: 3
        ISO MTU: 318
        ISO max packet: 3
< HCI Command: LE Read Maximum Adve.. (0x08|0x003a) plen 0  #19 [hci1] 1.261305
> HCI Event: Command Complete (0x0e) plen 6                 #20 [hci1] 1.261781
      LE Read Maximum Advertising Data Length (0x08|0x003a) ncmd 1
        Status: Success (0x00)
        Max length: 1650
< HCI Command: LE Read Supported St.. (0x08|0x001c) plen 0  #21 [hci1] 1.281314
> HCI Event: Command Complete (0x0e) plen 12                #22 [hci1] 1.281844
      LE Read Supported States (0x08|0x001c) ncmd 1
        Status: Success (0x00)
        States: 0x000003ff3e0306ff
          Non-connectable Advertising State
          Scannable Advertising State
          Connectable Advertising State
          High Duty Cycle Directed Advertising State
          Passive Scanning State
          Active Scanning State
          Initiating State
            and Connection State (Central Role)
          Connection State (Peripheral Role)
          Scannable Advertising State
            and Passive Scanning State
          Connectable Advertising State
            and Passive Scanning State
          Non-connectable Advertising State
            and Initiating State
          Scannable Advertising State
            and Initiating State
          Active Scanning State
            and Connection State (Central Role)
          Passive Scanning State
            and Connection State (Peripheral Role)
          Active Scanning State
            and Connection State (Peripheral Role)
          Initiating State
            and Connection State (Central Role)
            and Central Role & Central Role
          Low Duty Cycle Directed Advertising State
          Connectable Advertising State
            and Initiating State
            and Central Role & Peripheral Role
          High Duty Cycle Directed Advertising State
            and Initiating State
            and Central Role & Peripheral Role
          Low Duty Cycle Directed Advertising State
            and Initiating State
            and Central Role & Peripheral Role
          Connectable Advertising State
            and Connection State (Central Role)
            and Central Role & Peripheral Role
          High Duty Cycle Directed Advertising State
            and Connection State (Central Role)
            and Central Role & Peripheral Role
          Low Duty Cycle Directed Advertising State
            and Connection State (Central Role)
            and Central Role & Peripheral Role
          Connectable Advertising State
            and Connection State (Peripheral Role)
            and Central Role & Peripheral Role
          High Duty Cycle Directed Advertising State
            and Connection State (Peripheral Role)
            and Peripheral Role & Peripheral Role
          Low Duty Cycle Directed Advertising State
            and Connection State (Peripheral Role)
            and Peripheral Role & Peripheral Role
          Initiating State
            and Connection State (Peripheral Role)
            and Central Role & Peripheral Role
< HCI Command: LE Read Maximum Data.. (0x08|0x002f) plen 0  #23 [hci1] 1.301287
> HCI Event: Command Complete (0x0e) plen 12                #24 [hci1] 1.301900
      LE Read Maximum Data Length (0x08|0x002f) ncmd 1
        Status: Success (0x00)
        Max TX octets: 251
        Max TX time: 2704
        Max RX octets: 251
        Max RX time: 2704
< HCI Command: LE Write Suggested D.. (0x08|0x0024) plen 4  #25 [hci1] 1.321308
        TX octets: 251
        TX time: 2704
> HCI Event: Command Complete (0x0e) plen 4                 #26 [hci1] 1.321991
      LE Write Suggested Default Data Length (0x08|0x0024) ncmd 1
        Status: Success (0x00)
< HCI Command: LE Read Resolving Li.. (0x08|0x002a) plen 0  #27 [hci1] 1.341317
> HCI Event: Command Complete (0x0e) plen 5                 #28 [hci1] 1.341912
      LE Read Resolving List Size (0x08|0x002a) ncmd 1
        Status: Success (0x00)
        Size: 8
< HCI Command: LE Set Event Mask (0x08|0x0001) plen 8       #29 [hci1] 1.361309
        Mask: 0x000002023f87fa5e
          LE Advertising Report
          LE Connection Update Complete
          LE Read Remote Used Features Complete
          LE Long Term Key Request
          LE Data Length Change
          LE Enhanced Connection Complete
          LE PHY Update Complete
          LE Extended Advertising Report
          LE Periodic Advertising Sync Established
          LE Periodic Advertising Report
          LE Periodic Advertising Sync Lost
          LE Extended Scan Timeout
          LE Extended Advertising Set Terminated
          LE Scan Request Received
          LE Periodic Advertising Sync Transfer Rvc
          LE CIS Established
          LE CIS Request
          LE Create BIG Complete
          LE Terminate BIG Complete
          LE BIG Sync Estabilished Complete
          LE BIG Sync Lost
          LE BIG Info Advertising Report
          Unknown mask (0x0000020000000000)
> HCI Event: Command Complete (0x0e) plen 4                 #30 [hci1] 1.361916
      LE Set Event Mask (0x08|0x0001) ncmd 1
        Status: Success (0x00)
< HCI Command: Set Event Mask (0x03|0x0001) plen 8          #31 [hci1] 1.381321
        Mask: 0x2000800002008890
          Disconnection Complete
          Encryption Change
          Read Remote Version Information Complete
          Hardware Error
          Data Buffer Overflow
          Encryption Key Refresh Complete
          LE Meta
> HCI Event: Command Complete (0x0e) plen 4                 #32 [hci1] 1.381923
      Set Event Mask (0x03|0x0001) ncmd 1
        Status: Success (0x00)
< HCI Command: Read BD ADDR (0x04|0x0009) plen 0            #33 [hci1] 1.401291
> HCI Event: Command Complete (0x0e) plen 10                #34 [hci1] 1.401846
      Read BD ADDR (0x04|0x0009) ncmd 1
        Status: Success (0x00)
        Address: 00:00:00:00:00:00 (OUI 00-00-00)
< HCI Command: LE Set Random Address (0x08|0x0005) plen 6   #35 [hci1] 1.421315
        Address: D5:B6:CC:31:DB:3B (Static)
> HCI Event: Command Complete (0x0e) plen 4                 #36 [hci1] 1.421802
      LE Set Random Address (0x08|0x0005) ncmd 1
        Status: Success (0x00)
< HCI Command: LE Set Random Address (0x08|0x0005) plen 6   #37 [hci1] 5.081361
        Address: 26:66:F9:08:61:8E (Non-Resolvable)
> HCI Event: Command Complete (0x0e) plen 4                 #38 [hci1] 5.081922
      LE Set Random Address (0x08|0x0005) ncmd 1
        Status: Success (0x00)
< HCI Command: LE Set Extended Scan.. (0x08|0x0041) plen 8  #39 [hci1] 5.101350
        Own address type: Random (0x01)
        Filter policy: Accept all advertisement (0x00)
        PHYs: 0x01
        Entry 0: LE 1M
          Type: Active (0x01)
          Interval: 60.000 msec (0x0060)
          Window: 30.000 msec (0x0030)
> HCI Event: Command Complete (0x0e) plen 4                 #40 [hci1] 5.101999
      LE Set Extended Scan Parameters (0x08|0x0041) ncmd 1
        Status: Success (0x00)
< HCI Command: LE Set Extended Scan.. (0x08|0x0042) plen 6  #41 [hci1] 5.121331
        Extended scan: Enabled (0x01)
        Filter duplicates: Enabled (0x01)
        Duration: 0 msec (0x0000)
        Period: 0.00 sec (0x0000)
> HCI Event: Command Complete (0x0e) plen 4                 #42 [hci1] 5.121942
      LE Set Extended Scan Enable (0x08|0x0042) ncmd 1
        Status: Success (0x00)
> HCI Event: LE Meta Event (0x3e) plen 54                   #43 [hci1] 5.136494
      LE Extended Advertising Report (0x0d)
        Num reports: 1
        Entry 0
          Event type: 0x0010
            Props: 0x0010
              Use legacy advertising PDUs
            Data status: [0;32mComplete[0m
          Legacy PDU Type: ADV_NONCONN_IND (0x0010)
          Address type: Public (0x00)
          Address: A4:30:7A:95:74:FB (Samsung Electronics Co.,Ltd)
          Primary PHY: LE 1M
          Secondary PHY: No packets
          SID: no ADI field (0xff)
          TX power: 127 dBm
          RSSI: -81 dBm (0xaf)
          Periodic advertising interval: 0.00 msec (0x0000)
          Direct address type: Reserved (0xff)
          Direct address: 00-00-00-00-00-00
          Data length: 0x1c
        1b ff 75 00 42 04 01 80 6e a4 30 7a 95 74 fb a6  ..u.B...n.0z.t..
        30 7a 95 74 fa 01 d8 41 c5 d9 00 00              0z.t...A....    
        Company: Samsung Electronics Co. Ltd. (117)
          Data: 420401806ea4307a9574fba6307a9574fa01d841c5d90000
> HCI Event: LE Meta Event (0x3e) plen 57                   #44 [hci1] 5.139885
      LE Extended Advertising Report (0x0d)
        Num reports: 1
        Entry 0
          Event type: 0x0013
            Props: 0x0013
              Connectable
              Scannable
              Use legacy advertising PDUs
            Data status: [0;32mComplete[0m
          Legacy PDU Type: ADV_IND (0x0013)
          Address type: Random (0x01)
          Address: F4:E7:81:03:A9:EC (Static)
          Primary PHY: LE 1M
          Secondary PHY: No packets
          SID: no ADI field (0xff)
          TX power: 127 dBm
          RSSI: -93 dBm (0xa3)
          Periodic advertising interval: 0.00 msec (0x0000)
          Direct address type: Reserved (0xff)
          Direct address: 00-00-00-00-00-00
          Data length: 0x1f
        02 01 06 1b ff 99 04 05 10 71 38 2b c0 8b 03 f4  .........q8+....
        00 bc ff b8 af 56 4d d5 e0 f4 e7 81 03 a9 ec     .....VM........ 
        Flags: 0x06
          LE General Discoverable Mode
          BR/EDR Not Supported
        Company: Ruuvi Innovations Ltd. (1177)
          Data: 051071382bc08b03f400bcffb8af564dd5e0f4e78103a9ec
> HCI Event: LE Meta Event (0x3e) plen 38                   #45 [hci1] 5.151204
      LE Extended Advertising Report (0x0d)
        Num reports: 1
        Entry 0
          Event type: 0x0012
            Props: 0x0012
              Scannable
              Use legacy advertising PDUs
            Data status: [0;32mComplete[0m
          Legacy PDU Type: ADV_SCAN_IND (0x0012)
          Address type: Random (0x01)
          Address: 7B:8D:6E:EC:38:21 (Resolvable)
          Primary PHY: LE 1M
          Secondary PHY: No packets
          SID: no ADI field (0xff)
          TX power: 127 dBm
          RSSI: -89 dBm (0xa7)
          Periodic advertising interval: 0.00 msec (0x0000)
          Direct address type: Reserved (0xff)
          Direct address: 00-00-00-00-00-00
          Data length: 0x0c
        0b ff 4c 00 09 06 03 00 0a 03 07 12              ..L.........    
        Company: Apple, Inc. (76)
          Type: Apple TV (9)
          Data: 03000a030712
> HCI Event: LE Meta Event (0x3e) plen 26                   #46 [hci1] 5.249862
      LE Extended Advertising Report (0x0d)
        Num reports: 1
        Entry 0
          Event type: 0x0010
            Props: 0x0010
              Use legacy advertising PDUs
            Data status: [0;32mComplete[0m
          Legacy PDU Type: ADV_NONCONN_IND (0x0010)
          Address type: Public (0x00)
          Address: 90:CD:B6:41:AD:52 (Hon Hai Precision Ind. Co.,Ltd.)
          Primary PHY: LE 1M
          Secondary PHY: No packets
          SID: no ADI field (0xff)
          TX power: 127 dBm
          RSSI: -93 dBm (0xa3)
          Periodic advertising interval: 0.00 msec (0x0000)
          Direct address type: Reserved (0xff)
          Direct address: 00-00-00-00-00-00
          Data length: 0x00
> HCI Event: LE Meta Event (0x3e) plen 72                   #47 [hci1] 5.330251
      LE Extended Advertising Report (0x0d)
        Num reports: 1
        Entry 0
          Event type: 0x0000
            Props: 0x0000
            Data status: [0;32mComplete[0m
          Address type: Random (0x01)
          Address: EC:98:83:EA:36:AB (Static)
          Primary PHY: LE 1M
          Secondary PHY: LE 2M
          SID: 0x0c
          TX power: 127 dBm
          RSSI: -86 dBm (0xaa)
          Periodic advertising interval: 106.25 msec (0x0055)
          Direct address type: Reserved (0xff)
          Direct address: 00-00-00-00-00-00
          Data length: 0x2e
        06 16 52 18 c0 de c0 05 16 56 18 04 00 0d 30 4e  ..R......V....0N
        69 6d 42 4c 45 20 61 75 64 69 6f 0e 09 41 70 61  imBLE audio..Apa
        63 68 65 20 4e 69 6d 42 4c 45 03 19 80 08        che NimBLE....  
        Service Data: Broadcast Audio Announcement (0x1852)
        Broadcast ID: 12639936 (0xc0dec0)
        Service Data: Public Broadcast Announcement (0x1856)
          Data: 0400
        Unknown EIR field 0x30: 4e696d424c4520617564696f
        Name (complete): Apache NimBLE
        Appearance: Undefined (0x0880)
> HCI Event: LE Meta Event (0x3e) plen 57                   #48 [hci1] 5.450741
      LE Extended Advertising Report (0x0d)
        Num reports: 1
        Entry 0
          Event type: 0x0013
            Props: 0x0013
              Connectable
              Scannable
              Use legacy advertising PDUs
            Data status: [0;32mComplete[0m
          Legacy PDU Type: ADV_IND (0x0013)
          Address type: Random (0x01)
          Address: D4:70:55:10:84:95 (Static)
          Primary PHY: LE 1M
          Secondary PHY: No packets
          SID: no ADI field (0xff)
          TX power: 127 dBm
          RSSI: -81 dBm (0xaf)
          Periodic advertising interval: 0.00 msec (0x0000)
          Direct address type: Reserved (0xff)
          Direct address: 00-00-00-00-00-00
          Data length: 0x1f
        02 01 06 1b ff 99 04 05 10 59 37 2c c0 7e ff d8  .........Y7,.~..
        04 18 00 40 ae 76 19 d5 f4 d4 70 55 10 84 95     ...@.v....pU... 
        Flags: 0x06
          LE General Discoverable Mode
          BR/EDR Not Supported
        Company: Ruuvi Innovations Ltd. (1177)
          Data: 051059372cc07effd804180040ae7619d5f4d47055108495
> HCI Event: LE Meta Event (0x3e) plen 56                   #49 [hci1] 5.451459
      LE Extended Advertising Report (0x0d)
        Num reports: 1
        Entry 0
          Event type: 0x001b
            Props: 0x001b
              Connectable
              Scannable
              Scan response
              Use legacy advertising PDUs
            Data status: [0;32mComplete[0m
          Legacy PDU Type: SCAN_RSP to an ADV_SCAN_IND (0x001b)
          Address type: Random (0x01)
          Address: D4:70:55:10:84:95 (Static)
          Primary PHY: LE 1M
          Secondary PHY: No packets
          SID: no ADI field (0xff)
          TX power: 127 dBm
          RSSI: -81 dBm (0xaf)
          Periodic advertising interval: 0.00 msec (0x0000)
          Direct address type: Reserved (0xff)
          Direct address: 00-00-00-00-00-00
          Data length: 0x1e
        11 07 9e ca dc 24 0e e5 a9 e0 93 f3 a3 b5 01 00  .....$..........
        40 6e 0b 09 52 75 75 76 69 20 38 34 39 35        @n..Ruuvi 8495  
        128-bit Service UUIDs (complete): 1 entry
          Nordic UART Service
        Name (complete): Ruuvi 8495
> HCI Event: LE Meta Event (0x3e) plen 57                   #50 [hci1] 5.485128
      LE Extended Advertising Report (0x0d)
        Num reports: 1
        Entry 0
          Event type: 0x0013
            Props: 0x0013
              Connectable
              Scannable
              Use legacy advertising PDUs
            Data status: [0;32mComplete[0m
          Legacy PDU Type: ADV_IND (0x0013)
          Address type: Random (0x01)
          Address: C4:B6:3F:DD:A5:47 (Static)
          Primary PHY: LE 1M
          Secondary PHY: No packets
          SID: no ADI field (0xff)
          TX power: 127 dBm
          RSSI: -87 dBm (0xa9)
          Periodic advertising interval: 0.00 msec (0x0000)
          Direct address type: Reserved (0xff)
          Direct address: 00-00-00-00-00-00
          Data length: 0x1f
        02 01 06 1b ff 99 04 05 10 58 36 15 c0 80 03 dc  .........X6.....
        00 d4 ff ec ac b6 59 d6 4b c4 b6 3f dd a5 47     ......Y.K..?..G 
        Flags: 0x06
          LE General Discoverable Mode
          BR/EDR Not Supported
        Company: Ruuvi Innovations Ltd. (1177)
          Data: 0510583615c08003dc00d4ffecacb659d64bc4b63fdda547
> HCI Event: LE Meta Event (0x3e) plen 56                   #51 [hci1] 5.485949
      LE Extended Advertising Report (0x0d)
        Num reports: 1
        Entry 0
          Event type: 0x001b
            Props: 0x001b
              Connectable
              Scannable
              Scan response
              Use legacy advertising PDUs
            Data status: [0;32mComplete[0m
          Legacy PDU Type: SCAN_RSP to an ADV_SCAN_IND (0x001b)
          Address type: Random (0x01)
          Address: C4:B6:3F:DD:A5:47 (Static)
          Primary PHY: LE 1M
          Secondary PHY: No packets
          SID: no ADI field (0xff)
          TX power: 127 dBm
          RSSI: -86 dBm (0xaa)
          Periodic advertising interval: 0.00 msec (0x0000)
          Direct address type: Reserved (0xff)
          Direct address: 00-00-00-00-00-00
          Data length: 0x1e
        11 07 9e ca dc 24 0e e5 a9 e0 93 f3 a3 b5 01 00  .....$..........
        40 6e 0b 09 52 75 75 76 69 20 41 35 34 37        @n..Ruuvi A547  
        128-bit Service UUIDs (complete): 1 entry
          Nordic UART Service
        Name (complete): Ruuvi A547
> HCI Event: LE Meta Event (0x3e) plen 72                   #52 [hci1] 5.501193
      LE Extended Advertising Report (0x0d)
        Num reports: 1
        Entry 0
          Event type: 0x0000
            Props: 0x0000
            Data status: [0;32mComplete[0m
          Address type: Random (0x01)
          Address: EC:98:83:EA:36:AB (Static)
          Primary PHY: LE 1M
          Secondary PHY: LE 2M
          SID: 0x0c
          TX power: 127 dBm
          RSSI: -87 dBm (0xa9)
          Periodic advertising interval: 106.25 msec (0x0055)
          Direct address type: Reserved (0xff)
          Direct address: 00-00-00-00-00-00
          Data length: 0x2e
        06 16 52 18 c0 de c0 05 16 56 18 04 00 0d 30 4e  ..R......V....0N
        69 6d 42 4c 45 20 61 75 64 69 6f 0e 09 41 70 61  imBLE audio..Apa
        63 68 65 20 4e 69 6d 42 4c 45 03 19 80 08        che NimBLE....  
        Service Data: Broadcast Audio Announcement (0x1852)
        Broadcast ID: 12639936 (0xc0dec0)
        Service Data: Public Broadcast Announcement (0x1856)
          Data: 0400
        Unknown EIR field 0x30: 4e696d424c4520617564696f
        Name (complete): Apache NimBLE
        Appearance: Undefined (0x0880)
> HCI Event: LE Meta Event (0x3e) plen 38                   #53 [hci1] 5.563171
      LE Extended Advertising Report (0x0d)
        Num reports: 1
        Entry 0
          Event type: 0x0012
            Props: 0x0012
              Scannable
              Use legacy advertising PDUs
            Data status: [0;32mComplete[0m
          Legacy PDU Type: ADV_SCAN_IND (0x0012)
          Address type: Random (0x01)
          Address: 7B:8D:6E:EC:38:21 (Resolvable)
          Primary PHY: LE 1M
          Secondary PHY: No packets
          SID: no ADI field (0xff)
          TX power: 127 dBm
          RSSI: -85 dBm (0xab)
          Periodic advertising interval: 0.00 msec (0x0000)
          Direct address type: Reserved (0xff)
          Direct address: 00-00-00-00-00-00
          Data length: 0x0c
        0b ff 4c 00 09 06 03 00 0a 03 07 12              ..L.........    
        Company: Apple, Inc. (76)
          Type: Apple TV (9)
          Data: 03000a030712
> HCI Event: LE Meta Event (0x3e) plen 26                   #54 [hci1] 5.563597
      LE Extended Advertising Report (0x0d)
        Num reports: 1
        Entry 0
          Event type: 0x001a
            Props: 0x001a
              Scannable
              Scan response
              Use legacy advertising PDUs
            Data status: [0;32mComplete[0m
          Legacy PDU Type: SCAN_RSP to an ADV_IND (0x001a)
          Address type: Random (0x01)
          Address: 7B:8D:6E:EC:38:21 (Resolvable)
          Primary PHY: LE 1M
          Secondary PHY: No packets
          SID: no ADI field (0xff)
          TX power: 127 dBm
          RSSI: -84 dBm (0xac)
          Periodic advertising interval: 0.00 msec (0x0000)
          Direct address type: Reserved (0xff)
          Direct address: 00-00-00-00-00-00
          Data length: 0x00
> HCI Event: LE Meta Event (0x3e) plen 55                   #55 [hci1] 5.611206
      LE Extended Advertising Report (0x0d)
        Num reports: 1
        Entry 0
          Event type: 0x0010
            Props: 0x0010
              Use legacy advertising PDUs
            Data status: [0;32mComplete[0m
          Legacy PDU Type: ADV_NONCONN_IND (0x0010)
          Address type: Random (0x01)
          Address: 3F:C8:4B:E3:43:7D (Non-Resolvable)
          Primary PHY: LE 1M
          Secondary PHY: No packets
          SID: no ADI field (0xff)
          TX power: 127 dBm
          RSSI: -88 dBm (0xa8)
          Periodic advertising interval: 0.00 msec (0x0000)
          Direct address type: Reserved (0xff)
          Direct address: 00-00-00-00-00-00
          Data length: 0x1d
        1c ff 06 00 01 09 21 0a 4d e0 8a 52 d2 d4 4c 41  ......!.M..R..LA
        50 54 4f 50 2d 45 35 32 45 4f 44 32 49           PTOP-E52EOD2I   
        Company: Microsoft (6)
          Data: 0109210a4de08a52d2d44c4150544f502d453532454f443249
> HCI Event: LE Meta Event (0x3e) plen 72                   #56 [hci1] 5.621189
      LE Extended Advertising Report (0x0d)
        Num reports: 1
        Entry 0
          Event type: 0x0000
            Props: 0x0000
            Data status: [0;32mComplete[0m
          Address type: Random (0x01)
          Address: EC:98:83:EA:36:AB (Static)
          Primary PHY: LE 1M
          Secondary PHY: LE 2M
          SID: 0x0c
          TX power: 127 dBm
          RSSI: -87 dBm (0xa9)
          Periodic advertising interval: 106.25 msec (0x0055)
          Direct address type: Reserved (0xff)
          Direct address: 00-00-00-00-00-00
          Data length: 0x2e
        06 16 52 18 c0 de c0 05 16 56 18 04 00 0d 30 4e  ..R......V....0N
        69 6d 42 4c 45 20 61 75 64 69 6f 0e 09 41 70 61  imBLE audio..Apa
        63 68 65 20 4e 69 6d 42 4c 45 03 19 80 08        che NimBLE....  
        Service Data: Broadcast Audio Announcement (0x1852)
        Broadcast ID: 12639936 (0xc0dec0)
        Service Data: Public Broadcast Announcement (0x1856)
          Data: 0400
        Unknown EIR field 0x30: 4e696d424c4520617564696f
        Name (complete): Apache NimBLE
        Appearance: Undefined (0x0880)
> HCI Event: LE Meta Event (0x3e) plen 72                   #57 [hci1] 5.746111
      LE Extended Advertising Report (0x0d)
        Num reports: 1
        Entry 0
          Event type: 0x0000
            Props: 0x0000
            Data status: [0;32mComplete[0m
          Address type: Random (0x01)
          Address: EC:98:83:EA:36:AB (Static)
          Primary PHY: LE 1M
          Secondary PHY: LE 2M
          SID: 0x0c
          TX power: 127 dBm
          RSSI: -91 dBm (0xa5)
          Periodic advertising interval: 106.25 msec (0x0055)
          Direct address type: Reserved (0xff)
          Direct address: 00-00-00-00-00-00
          Data length: 0x2e
        06 16 52 18 c0 de c0 05 16 56 18 04 00 0d 30 4e  ..R......V....0N
        69 6d 42 4c 45 20 61 75 64 69 6f 0e 09 41 70 61  imBLE audio..Apa
        63 68 65 20 4e 69 6d 42 4c 45 03 19 80 08        che NimBLE....  
        Service Data: Broadcast Audio Announcement (0x1852)
        Broadcast ID: 12639936 (0xc0dec0)
        Service Data: Public Broadcast Announcement (0x1856)
          Data: 0400
        Unknown EIR field 0x30: 4e696d424c4520617564696f
        Name (complete): Apache NimBLE
        Appearance: Undefined (0x0880)
> HCI Event: LE Meta Event (0x3e) plen 47                   #58 [hci1] 5.869205
      LE Extended Advertising Report (0x0d)
        Num reports: 1
        Entry 0
          Event type: 0x0000
            Props: 0x0000
            Data status: [0;32mComplete[0m
          Address type: Public (0x00)
          Address: DF:A9:FF:F6:B1:1A (OUI DF-A9-FF)
          Primary PHY: LE 1M
          Secondary PHY: LE 1M
          SID: 0x00
          TX power: 127 dBm
          RSSI: -17 dBm (0xef)
          Periodic advertising interval: 750.00 msec (0x0258)
          Direct address type: Reserved (0xff)
          Direct address: 00-00-00-00-00-00
          Data length: 0x15
        06 16 52 18 66 9c bd 0d 09 50 54 53 2d 42 41 50  ..R.f....PTS-BAP
        2d 42 31 31 41                                   -B11A           
        Service Data: Broadcast Audio Announcement (0x1852)
        Broadcast ID: 12426342 (0xbd9c66)
        Name (complete): PTS-BAP-B11A
> HCI Event: LE Meta Event (0x3e) plen 55                   #59 [hci1] 5.930983
      LE Extended Advertising Report (0x0d)
        Num reports: 1
        Entry 0
          Event type: 0x0010
            Props: 0x0010
              Use legacy advertising PDUs
            Data status: [0;32mComplete[0m
          Legacy PDU Type: ADV_NONCONN_IND (0x0010)
          Address type: Random (0x01)
          Address: 3F:C8:4B:E3:43:7D (Non-Resolvable)
          Primary PHY: LE 1M
          Secondary PHY: No packets
          SID: no ADI field (0xff)
          TX power: 127 dBm
          RSSI: -80 dBm (0xb0)
          Periodic advertising interval: 0.00 msec (0x0000)
          Direct address type: Reserved (0xff)
          Direct address: 00-00-00-00-00-00
          Data length: 0x1d
        1c ff 06 00 01 09 21 0a 4d e0 8a 52 d2 d4 4c 41  ......!.M..R..LA
        50 54 4f 50 2d 45 35 32 45 4f 44 32 49           PTOP-E52EOD2I   
        Company: Microsoft (6)
          Data: 0109210a4de08a52d2d44c4150544f502d453532454f443249
> HCI Event: LE Meta Event (0x3e) plen 57                   #60 [hci1] 6.170922
      LE Extended Advertising Report (0x0d)
        Num reports: 1
        Entry 0
          Event type: 0x0013
            Props: 0x0013
              Connectable
              Scannable
              Use legacy advertising PDUs
            Data status: [0;32mComplete[0m
          Legacy PDU Type: ADV_IND (0x0013)
          Address type: Random (0x01)
          Address: C1:E3:95:67:AC:55 (Static)
          Primary PHY: LE 1M
          Secondary PHY: No packets
          SID: no ADI field (0xff)
          TX power: 127 dBm
          RSSI: -94 dBm (0xa2)
          Periodic advertising interval: 0.00 msec (0x0000)
          Direct address type: Reserved (0xff)
          Direct address: 00-00-00-00-00-00
          Data length: 0x1f
        02 01 06 1b ff 99 04 05 11 29 33 ba c0 84 03 d0  .........)3.....
        01 04 00 28 b0 36 05 d6 82 c1 e3 95 67 ac 55     ...(.6......g.U 
        Flags: 0x06
          LE General Discoverable Mode
          BR/EDR Not Supported
        Company: Ruuvi Innovations Ltd. (1177)
          Data: 05112933bac08403d001040028b03605d682c1e39567ac55
< HCI Command: LE Set Extended Scan.. (0x08|0x0042) plen 6  #61 [hci1] 6.181929
        Extended scan: Disabled (0x00)
        Filter duplicates: Disabled (0x00)
        Duration: 0 msec (0x0000)
        Period: 0.00 sec (0x0000)
> HCI Event: Command Complete (0x0e) plen 4                 #62 [hci1] 6.182460
      LE Set Extended Scan Enable (0x08|0x0042) ncmd 1
        Status: Success (0x00)
< HCI Command: LE Periodic Adverti.. (0x08|0x0044) plen 14  #63 [hci1] 6.221546
        Options: 0x0000
        Use advertising SID, Advertiser Address Type and address
        Reporting initially enabled
        SID: 0x00
        Adv address type: Public (0x00)
        Adv address: DF:A9:FF:F6:B1:1A (OUI DF-A9-FF)
        Skip: 0x0005
        Sync timeout: 1000 msec (0x0064)
        Sync CTE type: 0x0000
> HCI Event: Command Status (0x0f) plen 4                   #64 [hci1] 6.222145
      LE Periodic Advertising Create Sync (0x08|0x0044) ncmd 1
        Status: Success (0x00)
< HCI Command: LE Set Random Address (0x08|0x0005) plen 6   #65 [hci1] 6.241370
        Address: 0B:F7:6D:E2:CB:94 (Non-Resolvable)
> HCI Event: Command Complete (0x0e) plen 4                 #66 [hci1] 6.241916
      LE Set Random Address (0x08|0x0005) ncmd 1
        Status: Success (0x00)
< HCI Command: LE Set Extended Sca.. (0x08|0x0041) plen 13  #67 [hci1] 6.261361
        Own address type: Random (0x01)
        Filter policy: Accept all advertisement (0x00)
        PHYs: 0x05
        Entry 0: LE 1M
          Type: Passive (0x00)
          Interval: 60.000 msec (0x0060)
          Window: 30.000 msec (0x0030)
        Entry 1: LE Coded
          Type: Passive (0x00)
          Interval: 60.000 msec (0x0060)
          Window: 30.000 msec (0x0030)
> HCI Event: Command Complete (0x0e) plen 4                 #68 [hci1] 6.261925
      LE Set Extended Scan Parameters (0x08|0x0041) ncmd 1
        Status: Success (0x00)
< HCI Command: LE Set Extended Scan.. (0x08|0x0042) plen 6  #69 [hci1] 6.281390
        Extended scan: Enabled (0x01)
        Filter duplicates: Enabled (0x01)
        Duration: 0 msec (0x0000)
        Period: 0.00 sec (0x0000)
> HCI Event: Command Complete (0x0e) plen 4                 #70 [hci1] 6.282023
      LE Set Extended Scan Enable (0x08|0x0042) ncmd 1
        Status: Success (0x00)
> HCI Event: LE Meta Event (0x3e) plen 55                   #71 [hci1] 6.349259
      LE Extended Advertising Report (0x0d)
        Num reports: 1
        Entry 0
          Event type: 0x0010
            Props: 0x0010
              Use legacy advertising PDUs
            Data status: [0;32mComplete[0m
          Legacy PDU Type: ADV_NONCONN_IND (0x0010)
          Address type: Random (0x01)
          Address: 3F:C8:4B:E3:43:7D (Non-Resolvable)
          Primary PHY: LE 1M
          Secondary PHY: No packets
          SID: no ADI field (0xff)
          TX power: 127 dBm
          RSSI: -80 dBm (0xb0)
          Periodic advertising interval: 0.00 msec (0x0000)
          Direct address type: Reserved (0xff)
          Direct address: 00-00-00-00-00-00
          Data length: 0x1d
        1c ff 06 00 01 09 21 0a 4d e0 8a 52 d2 d4 4c 41  ......!.M..R..LA
        50 54 4f 50 2d 45 35 32 45 4f 44 32 49           PTOP-E52EOD2I   
        Company: Microsoft (6)
          Data: 0109210a4de08a52d2d44c4150544f502d453532454f443249
> HCI Event: LE Meta Event (0x3e) plen 47                   #72 [hci1] 6.359740
      LE Extended Advertising Report (0x0d)
        Num reports: 1
        Entry 0
          Event type: 0x0013
            Props: 0x0013
              Connectable
              Scannable
              Use legacy advertising PDUs
            Data status: [0;32mComplete[0m
          Legacy PDU Type: ADV_IND (0x0013)
          Address type: Random (0x01)
          Address: 70:76:AE:0A:E8:6F (Resolvable)
          Primary PHY: LE 1M
          Secondary PHY: No packets
          SID: no ADI field (0xff)
          TX power: 127 dBm
          RSSI: -95 dBm (0xa1)
          Periodic advertising interval: 0.00 msec (0x0000)
          Direct address type: Reserved (0xff)
          Direct address: 00-00-00-00-00-00
          Data length: 0x15
        02 01 02 11 07 00 00 00 00 00 00 00 00 00 00 00  ................
        00 00 01 31 5a                                   ...1Z           
        Flags: 0x02
          LE General Discoverable Mode
        128-bit Service UUIDs (complete): 1 entry
          Vendor specific
> HCI Event: LE Meta Event (0x3e) plen 54                   #73 [hci1] 6.368882
      LE Extended Advertising Report (0x0d)
        Num reports: 1
        Entry 0
          Event type: 0x0010
            Props: 0x0010
              Use legacy advertising PDUs
            Data status: [0;32mComplete[0m
          Legacy PDU Type: ADV_NONCONN_IND (0x0010)
          Address type: Public (0x00)
          Address: A4:30:7A:95:74:FB (Samsung Electronics Co.,Ltd)
          Primary PHY: LE 1M
          Secondary PHY: No packets
          SID: no ADI field (0xff)
          TX power: 127 dBm
          RSSI: -88 dBm (0xa8)
          Periodic advertising interval: 0.00 msec (0x0000)
          Direct address type: Reserved (0xff)
          Direct address: 00-00-00-00-00-00
          Data length: 0x1c
        1b ff 75 00 42 04 01 80 6e a4 30 7a 95 74 fb a6  ..u.B...n.0z.t..
        30 7a 95 74 fa 01 d8 41 c5 d9 00 00              0z.t...A....    
        Company: Samsung Electronics Co. Ltd. (117)
          Data: 420401806ea4307a9574fba6307a9574fa01d841c5d90000
> HCI Event: LE Meta Event (0x3e) plen 72                   #74 [hci1] 6.421364
      LE Extended Advertising Report (0x0d)
        Num reports: 1
        Entry 0
          Event type: 0x0000
            Props: 0x0000
            Data status: [0;32mComplete[0m
          Address type: Random (0x01)
          Address: EC:98:83:EA:36:AB (Static)
          Primary PHY: LE 1M
          Secondary PHY: LE 2M
          SID: 0x0c
          TX power: 127 dBm
          RSSI: -86 dBm (0xaa)
          Periodic advertising interval: 106.25 msec (0x0055)
          Direct address type: Reserved (0xff)
          Direct address: 00-00-00-00-00-00
          Data length: 0x2e
        06 16 52 18 c0 de c0 05 16 56 18 04 00 0d 30 4e  ..R......V....0N
        69 6d 42 4c 45 20 61 75 64 69 6f 0e 09 41 70 61  imBLE audio..Apa
        63 68 65 20 4e 69 6d 42 4c 45 03 19 80 08        che NimBLE....  
        Service Data: Broadcast Audio Announcement (0x1852)
        Broadcast ID: 12639936 (0xc0dec0)
        Service Data: Public Broadcast Announcement (0x1856)
          Data: 0400
        Unknown EIR field 0x30: 4e696d424c4520617564696f
        Name (complete): Apache NimBLE
        Appearance: Undefined (0x0880)
> HCI Event: LE Meta Event (0x3e) plen 72                   #75 [hci1] 6.596083
      LE Extended Advertising Report (0x0d)
        Num reports: 1
        Entry 0
          Event type: 0x0000
            Props: 0x0000
            Data status: [0;32mComplete[0m
          Address type: Random (0x01)
          Address: EC:98:83:EA:36:AB (Static)
          Primary PHY: LE 1M
          Secondary PHY: LE 2M
          SID: 0x0c
          TX power: 127 dBm
          RSSI: -85 dBm (0xab)
          Periodic advertising interval: 106.25 msec (0x0055)
          Direct address type: Reserved (0xff)
          Direct address: 00-00-00-00-00-00
          Data length: 0x2e
        06 16 52 18 c0 de c0 05 16 56 18 04 00 0d 30 4e  ..R......V....0N
        69 6d 42 4c 45 20 61 75 64 69 6f 0e 09 41 70 61  imBLE audio..Apa
        63 68 65 20 4e 69 6d 42 4c 45 03 19 80 08        che NimBLE....  
        Service Data: Broadcast Audio Announcement (0x1852)
        Broadcast ID: 12639936 (0xc0dec0)
        Service Data: Public Broadcast Announcement (0x1856)
          Data: 0400
        Unknown EIR field 0x30: 4e696d424c4520617564696f
        Name (complete): Apache NimBLE
        Appearance: Undefined (0x0880)
> HCI Event: LE Meta Event (0x3e) plen 38                   #76 [hci1] 6.657491
      LE Extended Advertising Report (0x0d)
        Num reports: 1
        Entry 0
          Event type: 0x0012
            Props: 0x0012
              Scannable
              Use legacy advertising PDUs
            Data status: [0;32mComplete[0m
          Legacy PDU Type: ADV_SCAN_IND (0x0012)
          Address type: Random (0x01)
          Address: 7B:8D:6E:EC:38:21 (Resolvable)
          Primary PHY: LE 1M
          Secondary PHY: No packets
          SID: no ADI field (0xff)
          TX power: 127 dBm
          RSSI: -90 dBm (0xa6)
          Periodic advertising interval: 0.00 msec (0x0000)
          Direct address type: Reserved (0xff)
          Direct address: 00-00-00-00-00-00
          Data length: 0x0c
        0b ff 4c 00 09 06 03 00 0a 03 07 12              ..L.........    
        Company: Apple, Inc. (76)
          Type: Apple TV (9)
          Data: 03000a030712
> HCI Event: LE Meta Event (0x3e) plen 72                   #77 [hci1] 6.676039
      LE Extended Advertising Report (0x0d)
        Num reports: 1
        Entry 0
          Event type: 0x0000
            Props: 0x0000
            Data status: [0;32mComplete[0m
          Address type: Random (0x01)
          Address: EC:98:83:EA:36:AB (Static)
          Primary PHY: LE 1M
          Secondary PHY: LE 2M
          SID: 0x0c
          TX power: 127 dBm
          RSSI: -91 dBm (0xa5)
          Periodic advertising interval: 106.25 msec (0x0055)
          Direct address type: Reserved (0xff)
          Direct address: 00-00-00-00-00-00
          Data length: 0x2e
        06 16 52 18 c0 de c0 05 16 56 18 04 00 0d 30 4e  ..R......V....0N
        69 6d 42 4c 45 20 61 75 64 69 6f 0e 09 41 70 61  imBLE audio..Apa
        63 68 65 20 4e 69 6d 42 4c 45 03 19 80 08        che NimBLE....  
        Service Data: Broadcast Audio Announcement (0x1852)
        Broadcast ID: 12639936 (0xc0dec0)
        Service Data: Public Broadcast Announcement (0x1856)
          Data: 0400
        Unknown EIR field 0x30: 4e696d424c4520617564696f
        Name (complete): Apache NimBLE
        Appearance: Undefined (0x0880)
> HCI Event: LE Meta Event (0x3e) plen 57                   #78 [hci1] 6.730738
      LE Extended Advertising Report (0x0d)
        Num reports: 1
        Entry 0
          Event type: 0x0013
            Props: 0x0013
              Connectable
              Scannable
              Use legacy advertising PDUs
            Data status: [0;32mComplete[0m
          Legacy PDU Type: ADV_IND (0x0013)
          Address type: Random (0x01)
          Address: D4:70:55:10:84:95 (Static)
          Primary PHY: LE 1M
          Secondary PHY: No packets
          SID: no ADI field (0xff)
          TX power: 127 dBm
          RSSI: -82 dBm (0xae)
          Periodic advertising interval: 0.00 msec (0x0000)
          Direct address type: Reserved (0xff)
          Direct address: 00-00-00-00-00-00
          Data length: 0x1f
        02 01 06 1b ff 99 04 05 10 5b 37 2d c0 86 ff d4  .........[7-....
        04 14 00 3c ae 76 19 d5 f5 d4 70 55 10 84 95     ...<.v....pU... 
        Flags: 0x06
          LE General Discoverable Mode
          BR/EDR Not Supported
        Company: Ruuvi Innovations Ltd. (1177)
          Data: 05105b372dc086ffd40414003cae7619d5f5d47055108495
> HCI Event: LE Meta Event (0x3e) plen 38                   #79 [hci1] 6.789373
      LE Extended Advertising Report (0x0d)
        Num reports: 1
        Entry 0
          Event type: 0x0012
            Props: 0x0012
              Scannable
              Use legacy advertising PDUs
            Data status: [0;32mComplete[0m
          Legacy PDU Type: ADV_SCAN_IND (0x0012)
          Address type: Random (0x01)
          Address: 7B:8D:6E:EC:38:21 (Resolvable)
          Primary PHY: LE 1M
          Secondary PHY: No packets
          SID: no ADI field (0xff)
          TX power: 127 dBm
          RSSI: -95 dBm (0xa1)
          Periodic advertising interval: 0.00 msec (0x0000)
          Direct address type: Reserved (0xff)
          Direct address: 00-00-00-00-00-00
          Data length: 0x0c
        0b ff 4c 00 09 06 03 00 0a 03 07 12              ..L.........    
        Company: Apple, Inc. (76)
          Type: Apple TV (9)
          Data: 03000a030712
> HCI Event: LE Meta Event (0x3e) plen 72                   #80 [hci1] 7.036077
      LE Extended Advertising Report (0x0d)
        Num reports: 1
        Entry 0
          Event type: 0x0000
            Props: 0x0000
            Data status: [0;32mComplete[0m
          Address type: Random (0x01)
          Address: EC:98:83:EA:36:AB (Static)
          Primary PHY: LE 1M
          Secondary PHY: LE 2M
          SID: 0x0c
          TX power: 127 dBm
          RSSI: -83 dBm (0xad)
          Periodic advertising interval: 106.25 msec (0x0055)
          Direct address type: Reserved (0xff)
          Direct address: 00-00-00-00-00-00
          Data length: 0x2e
        06 16 52 18 c0 de c0 05 16 56 18 04 00 0d 30 4e  ..R......V....0N
        69 6d 42 4c 45 20 61 75 64 69 6f 0e 09 41 70 61  imBLE audio..Apa
        63 68 65 20 4e 69 6d 42 4c 45 03 19 80 08        che NimBLE....  
        Service Data: Broadcast Audio Announcement (0x1852)
        Broadcast ID: 12639936 (0xc0dec0)
        Service Data: Public Broadcast Announcement (0x1856)
          Data: 0400
        Unknown EIR field 0x30: 4e696d424c4520617564696f
        Name (complete): Apache NimBLE
        Appearance: Undefined (0x0880)
> HCI Event: LE Meta Event (0x3e) plen 55                   #81 [hci1] 7.091681
      LE Extended Advertising Report (0x0d)
        Num reports: 1
        Entry 0
          Event type: 0x0010
            Props: 0x0010
              Use legacy advertising PDUs
            Data status: [0;32mComplete[0m
          Legacy PDU Type: ADV_NONCONN_IND (0x0010)
          Address type: Random (0x01)
          Address: 3F:C8:4B:E3:43:7D (Non-Resolvable)
          Primary PHY: LE 1M
          Secondary PHY: No packets
          SID: no ADI field (0xff)
          TX power: 127 dBm
          RSSI: -80 dBm (0xb0)
          Periodic advertising interval: 0.00 msec (0x0000)
          Direct address type: Reserved (0xff)
          Direct address: 00-00-00-00-00-00
          Data length: 0x1d
        1c ff 06 00 01 09 21 0a 4d e0 8a 52 d2 d4 4c 41  ......!.M..R..LA
        50 54 4f 50 2d 45 35 32 45 4f 44 32 49           PTOP-E52EOD2I   
        Company: Microsoft (6)
          Data: 0109210a4de08a52d2d44c4150544f502d453532454f443249
> HCI Event: LE Meta Event (0x3e) plen 55                   #82 [hci1] 7.198684
      LE Extended Advertising Report (0x0d)
        Num reports: 1
        Entry 0
          Event type: 0x0010
            Props: 0x0010
              Use legacy advertising PDUs
            Data status: [0;32mComplete[0m
          Legacy PDU Type: ADV_NONCONN_IND (0x0010)
          Address type: Random (0x01)
          Address: 3F:C8:4B:E3:43:7D (Non-Resolvable)
          Primary PHY: LE 1M
          Secondary PHY: No packets
          SID: no ADI field (0xff)
          TX power: 127 dBm
          RSSI: -80 dBm (0xb0)
          Periodic advertising interval: 0.00 msec (0x0000)
          Direct address type: Reserved (0xff)
          Direct address: 00-00-00-00-00-00
          Data length: 0x1d
        1c ff 06 00 01 09 21 0a 4d e0 8a 52 d2 d4 4c 41  ......!.M..R..LA
        50 54 4f 50 2d 45 35 32 45 4f 44 32 49           PTOP-E52EOD2I   
        Company: Microsoft (6)
          Data: 0109210a4de08a52d2d44c4150544f502d453532454f443249
> HCI Event: LE Meta Event (0x3e) plen 55                   #83 [hci1] 7.307454
      LE Extended Advertising Report (0x0d)
        Num reports: 1
        Entry 0
          Event type: 0x0010
            Props: 0x0010
              Use legacy advertising PDUs
            Data status: [0;32mComplete[0m
          Legacy PDU Type: ADV_NONCONN_IND (0x0010)
          Address type: Random (0x01)
          Address: 3F:C8:4B:E3:43:7D (Non-Resolvable)
          Primary PHY: LE 1M
          Secondary PHY: No packets
          SID: no ADI field (0xff)
          TX power: 127 dBm
          RSSI: -88 dBm (0xa8)
          Periodic advertising interval: 0.00 msec (0x0000)
          Direct address type: Reserved (0xff)
          Direct address: 00-00-00-00-00-00
          Data length: 0x1d
        1c ff 06 00 01 09 21 0a 4d e0 8a 52 d2 d4 4c 41  ......!.M..R..LA
        50 54 4f 50 2d 45 35 32 45 4f 44 32 49           PTOP-E52EOD2I   
        Company: Microsoft (6)
          Data: 0109210a4de08a52d2d44c4150544f502d453532454f443249
> HCI Event: LE Meta Event (0x3e) plen 47                   #84 [hci1] 7.379141
      LE Extended Advertising Report (0x0d)
        Num reports: 1
        Entry 0
          Event type: 0x0000
            Props: 0x0000
            Data status: [0;32mComplete[0m
          Address type: Public (0x00)
          Address: DF:A9:FF:F6:B1:1A (OUI DF-A9-FF)
          Primary PHY: LE 1M
          Secondary PHY: LE 1M
          SID: 0x00
          TX power: 127 dBm
          RSSI: -16 dBm (0xf0)
          Periodic advertising interval: 750.00 msec (0x0258)
          Direct address type: Reserved (0xff)
          Direct address: 00-00-00-00-00-00
          Data length: 0x15
        06 16 52 18 66 9c bd 0d 09 50 54 53 2d 42 41 50  ..R.f....PTS-BAP
        2d 42 31 31 41                                   -B11A           
        Service Data: Broadcast Audio Announcement (0x1852)
        Broadcast ID: 12426342 (0xbd9c66)
        Name (complete): PTS-BAP-B11A
> HCI Event: LE Meta Event (0x3e) plen 72                   #85 [hci1] 7.441080
      LE Extended Advertising Report (0x0d)
        Num reports: 1
        Entry 0
          Event type: 0x0000
            Props: 0x0000
            Data status: [0;32mComplete[0m
          Address type: Random (0x01)
          Address: EC:98:83:EA:36:AB (Static)
          Primary PHY: LE 1M
          Secondary PHY: LE 2M
          SID: 0x0c
          TX power: 127 dBm
          RSSI: -88 dBm (0xa8)
          Periodic advertising interval: 106.25 msec (0x0055)
          Direct address type: Reserved (0xff)
          Direct address: 00-00-00-00-00-00
          Data length: 0x2e
        06 16 52 18 c0 de c0 05 16 56 18 04 00 0d 30 4e  ..R......V....0N
        69 6d 42 4c 45 20 61 75 64 69 6f 0e 09 41 70 61  imBLE audio..Apa
        63 68 65 20 4e 69 6d 42 4c 45 03 19 80 08        che NimBLE....  
        Service Data: Broadcast Audio Announcement (0x1852)
        Broadcast ID: 12639936 (0xc0dec0)
        Service Data: Public Broadcast Announcement (0x1856)
          Data: 0400
        Unknown EIR field 0x30: 4e696d424c4520617564696f
        Name (complete): Apache NimBLE
        Appearance: Undefined (0x0880)
> HCI Event: LE Meta Event (0x3e) plen 55                   #86 [hci1] 7.550558
      LE Extended Advertising Report (0x0d)
        Num reports: 1
        Entry 0
          Event type: 0x0013
            Props: 0x0013
              Connectable
              Scannable
              Use legacy advertising PDUs
            Data status: [0;32mComplete[0m
          Legacy PDU Type: ADV_IND (0x0013)
          Address type: Random (0x01)
          Address: 13:C6:FA:A4:89:34 (Non-Resolvable)
          Primary PHY: LE 1M
          Secondary PHY: No packets
          SID: no ADI field (0xff)
          TX power: 127 dBm
          RSSI: -95 dBm (0xa1)
          Periodic advertising interval: 0.00 msec (0x0000)
          Direct address type: Reserved (0xff)
          Direct address: 00-00-00-00-00-00
          Data length: 0x1d
        02 01 02 19 16 f1 fc 04 a9 a9 e1 c7 18 ac cf c8  ................
        21 aa ce a0 2d 2d 98 3c c5 3b e6 46 7a           !...--.<.;.Fz   
        Flags: 0x02
          LE General Discoverable Mode
        Service Data: Unknown (0xfcf1)
          Data: 04a9a9e1c718accfc821aacea02d2d983cc53be6467a
> HCI Event: LE Meta Event (0x3e) plen 38                   #87 [hci1] 7.605591
      LE Extended Advertising Report (0x0d)
        Num reports: 1
        Entry 0
          Event type: 0x0012
            Props: 0x0012
              Scannable
              Use legacy advertising PDUs
            Data status: [0;32mComplete[0m
          Legacy PDU Type: ADV_SCAN_IND (0x0012)
          Address type: Random (0x01)
          Address: 7B:8D:6E:EC:38:21 (Resolvable)
          Primary PHY: LE 1M
          Secondary PHY: No packets
          SID: no ADI field (0xff)
          TX power: 127 dBm
          RSSI: -85 dBm (0xab)
          Periodic advertising interval: 0.00 msec (0x0000)
          Direct address type: Reserved (0xff)
          Direct address: 00-00-00-00-00-00
          Data length: 0x0c
        0b ff 4c 00 09 06 03 00 0a 03 07 12              ..L.........    
        Company: Apple, Inc. (76)
          Type: Apple TV (9)
          Data: 03000a030712
> HCI Event: LE Meta Event (0x3e) plen 54                   #88 [hci1] 7.611263
      LE Extended Advertising Report (0x0d)
        Num reports: 1
        Entry 0
          Event type: 0x0010
            Props: 0x0010
              Use legacy advertising PDUs
            Data status: [0;32mComplete[0m
          Legacy PDU Type: ADV_NONCONN_IND (0x0010)
          Address type: Public (0x00)
          Address: A4:30:7A:95:74:FB (Samsung Electronics Co.,Ltd)
          Primary PHY: LE 1M
          Secondary PHY: No packets
          SID: no ADI field (0xff)
          TX power: 127 dBm
          RSSI: -89 dBm (0xa7)
          Periodic advertising interval: 0.00 msec (0x0000)
          Direct address type: Reserved (0xff)
          Direct address: 00-00-00-00-00-00
          Data length: 0x1c
        1b ff 75 00 42 04 01 80 6e a4 30 7a 95 74 fb a6  ..u.B...n.0z.t..
        30 7a 95 74 fa 01 d8 41 c5 d9 00 00              0z.t...A....    
        Company: Samsung Electronics Co. Ltd. (117)
          Data: 420401806ea4307a9574fba6307a9574fa01d841c5d90000
> HCI Event: LE Meta Event (0x3e) plen 55                   #89 [hci1] 7.630385
      LE Extended Advertising Report (0x0d)
        Num reports: 1
        Entry 0
          Event type: 0x0010
            Props: 0x0010
              Use legacy advertising PDUs
            Data status: [0;32mComplete[0m
          Legacy PDU Type: ADV_NONCONN_IND (0x0010)
          Address type: Random (0x01)
          Address: 3F:C8:4B:E3:43:7D (Non-Resolvable)
          Primary PHY: LE 1M
          Secondary PHY: No packets
          SID: no ADI field (0xff)
          TX power: 127 dBm
          RSSI: -80 dBm (0xb0)
          Periodic advertising interval: 0.00 msec (0x0000)
          Direct address type: Reserved (0xff)
          Direct address: 00-00-00-00-00-00
          Data length: 0x1d
        1c ff 06 00 01 09 21 0a 4d e0 8a 52 d2 d4 4c 41  ......!.M..R..LA
        50 54 4f 50 2d 45 35 32 45 4f 44 32 49           PTOP-E52EOD2I   
        Company: Microsoft (6)
          Data: 0109210a4de08a52d2d44c4150544f502d453532454f443249
> HCI Event: LE Meta Event (0x3e) plen 51                   #90 [hci1] 7.667305
      LE Extended Advertising Report (0x0d)
        Num reports: 1
        Entry 0
          Event type: 0x0013
            Props: 0x0013
              Connectable
              Scannable
              Use legacy advertising PDUs
            Data status: [0;32mComplete[0m
          Legacy PDU Type: ADV_IND (0x0013)
          Address type: Public (0x00)
          Address: F0:18:98:96:04:94 (Apple, Inc.)
          Primary PHY: LE 1M
          Secondary PHY: No packets
          SID: no ADI field (0xff)
          TX power: 127 dBm
          RSSI: -87 dBm (0xa9)
          Periodic advertising interval: 0.00 msec (0x0000)
          Direct address type: Reserved (0xff)
          Direct address: 00-00-00-00-00-00
          Data length: 0x19
        02 01 06 11 07 00 00 00 00 00 00 00 00 00 00 00  ................
        00 00 01 31 5a 03 09 7a 6d                       ...1Z..zm       
        Flags: 0x06
          LE General Discoverable Mode
          BR/EDR Not Supported
        128-bit Service UUIDs (complete): 1 entry
          Vendor specific
        Name (complete): zm
> HCI Event: LE Meta Event (0x3e) plen 57                   #91 [hci1] 7.671693
      LE Extended Advertising Report (0x0d)
        Num reports: 1
        Entry 0
          Event type: 0x0013
            Props: 0x0013
              Connectable
              Scannable
              Use legacy advertising PDUs
            Data status: [0;32mComplete[0m
          Legacy PDU Type: ADV_IND (0x0013)
          Address type: Random (0x01)
          Address: F3:4B:0E:78:72:2A (Static)
          Primary PHY: LE 1M
          Secondary PHY: No packets
          SID: no ADI field (0xff)
          TX power: 127 dBm
          RSSI: -83 dBm (0xad)
          Periodic advertising interval: 0.00 msec (0x0000)
          Direct address type: Reserved (0xff)
          Direct address: 00-00-00-00-00-00
          Data length: 0x1f
        02 01 06 1b ff 99 04 05 10 40 37 9d c0 80 04 14  .........@7.....
        00 60 ff fc ae f6 1d d6 1c f3 4b 0e 78 72 2a     .`........K.xr* 
        Flags: 0x06
          LE General Discoverable Mode
          BR/EDR Not Supported
        Company: Ruuvi Innovations Ltd. (1177)
          Data: 051040379dc08004140060fffcaef61dd61cf34b0e78722a
> HCI Event: LE Meta Event (0x3e) plen 72                   #92 [hci1] 7.696093
      LE Extended Advertising Report (0x0d)
        Num reports: 1
        Entry 0
          Event type: 0x0000
            Props: 0x0000
            Data status: [0;32mComplete[0m
          Address type: Random (0x01)
          Address: EC:98:83:EA:36:AB (Static)
          Primary PHY: LE 1M
          Secondary PHY: LE 2M
          SID: 0x0c
          TX power: 127 dBm
          RSSI: -87 dBm (0xa9)
          Periodic advertising interval: 106.25 msec (0x0055)
          Direct address type: Reserved (0xff)
          Direct address: 00-00-00-00-00-00
          Data length: 0x2e
        06 16 52 18 c0 de c0 05 16 56 18 04 00 0d 30 4e  ..R......V....0N
        69 6d 42 4c 45 20 61 75 64 69 6f 0e 09 41 70 61  imBLE audio..Apa
        63 68 65 20 4e 69 6d 42 4c 45 03 19 80 08        che NimBLE....  
        Service Data: Broadcast Audio Announcement (0x1852)
        Broadcast ID: 12639936 (0xc0dec0)
        Service Data: Public Broadcast Announcement (0x1856)
          Data: 0400
        Unknown EIR field 0x30: 4e696d424c4520617564696f
        Name (complete): Apache NimBLE
        Appearance: Undefined (0x0880)
> HCI Event: LE Meta Event (0x3e) plen 72                   #93 [hci1] 7.736172
      LE Extended Advertising Report (0x0d)
        Num reports: 1
        Entry 0
          Event type: 0x0000
            Props: 0x0000
            Data status: [0;32mComplete[0m
          Address type: Random (0x01)
          Address: EC:98:83:EA:36:AB (Static)
          Primary PHY: LE 1M
          Secondary PHY: LE 2M
          SID: 0x0c
          TX power: 127 dBm
          RSSI: -87 dBm (0xa9)
          Periodic advertising interval: 106.25 msec (0x0055)
          Direct address type: Reserved (0xff)
          Direct address: 00-00-00-00-00-00
          Data length: 0x2e
        06 16 52 18 c0 de c0 05 16 56 18 04 00 0d 30 4e  ..R......V....0N
        69 6d 42 4c 45 20 61 75 64 69 6f 0e 09 41 70 61  imBLE audio..Apa
        63 68 65 20 4e 69 6d 42 4c 45 03 19 80 08        che NimBLE....  
        Service Data: Broadcast Audio Announcement (0x1852)
        Broadcast ID: 12639936 (0xc0dec0)
        Service Data: Public Broadcast Announcement (0x1856)
          Data: 0400
        Unknown EIR field 0x30: 4e696d424c4520617564696f
        Name (complete): Apache NimBLE
        Appearance: Undefined (0x0880)
