Bluetooth monitor ver 5.72
= Note: Linux version 6.14.0-36-generic (x86_64)                       0.674442
= Note: Bluetooth subsystem version 2.22                               0.674445
= New Index: 00:00:00:00:00:00 (Primary,UART,hci1)              [hci1] 0.674446
= New Index: 48:5F:99:8E:E0:64 (Primary,USB,hci0)               [hci0] 0.674447
= Open Index: 00:00:00:00:00:00                                 [hci1] 0.789912
= Index Info: 00:00:00:00:00:00 (Nordic Semiconductor ASA)      [hci1] 0.789931
@ USER Open: main (privileged) version 2.22            {0x0001} [hci1] 0.789943
< HCI Command: Reset (0x03|0x0003) plen 0                    #1 [hci1] 0.791184
> HCI Event: Command Complete (0x0e) plen 4                  #2 [hci1] 0.791668
      Reset (0x03|0x0003) ncmd 1
        Status: Success (0x00)
< HCI Command: Read Local Supported... (0x04|0x0003) plen 0  #3 [hci1] 0.809663
> HCI Event: Command Complete (0x0e) plen 12                 #4 [hci1] 0.810237
      Read Local Supported Features (0x04|0x0003) ncmd 1
        Status: Success (0x00)
        Features: 0x00 0x00 0x00 0x00 0x60 0x00 0x00 0x00
          BR/EDR Not Supported
          LE Supported (Controller)
< HCI Command: Read Local Version In.. (0x04|0x0001) plen 0  #5 [hci1] 0.829356
> HCI Event: Command Complete (0x0e) plen 12                 #6 [hci1] 0.829878
      Read Local Version Information (0x04|0x0001) ncmd 1
        Status: Success (0x00)
        HCI version: Reserved (0x0f) - Revision 12393 (0x3069)
        LMP version: Reserved (0x0f) - Subversion 12393 (0x3069)
        Manufacturer: Nordic Semiconductor ASA (89)
< HCI Command: Read Local Supported... (0x04|0x0002) plen 0  #7 [hci1] 0.849234
> HCI Event: Command Complete (0x0e) plen 68                 #8 [hci1] 0.850284
      Read Local Supported Commands (0x04|0x0002) ncmd 1
        Status: Success (0x00)
        Commands: 119 entries
          Disconnect (Octet 0 - Bit 5)
          Read Remote Version Information (Octet 2 - Bit 7)
          Set Event Mask (Octet 5 - Bit 6)
          Reset (Octet 5 - Bit 7)
          Read Connection Accept Timeout (Octet 7 - Bit 2)
          Write Connection Accept Timeout (Octet 7 - Bit 3)
          Read Transmit Power Level (Octet 10 - Bit 2)
          Set Controller To Host Flow Control (Octet 10 - Bit 5)
          Host Buffer Size (Octet 10 - Bit 6)
          Host Number of Completed Packets (Octet 10 - Bit 7)
          Read Local Version Information (Octet 14 - Bit 3)
          Read Local Supported Features (Octet 14 - Bit 5)
          Read BD ADDR (Octet 15 - Bit 1)
          Read RSSI (Octet 15 - Bit 5)
          Set Event Mask Page 2 (Octet 22 - Bit 2)
          LE Set Event Mask (Octet 25 - Bit 0)
          LE Read Buffer Size (Octet 25 - Bit 1)
          LE Read Local Supported Features (Octet 25 - Bit 2)
          LE Set Random Address (Octet 25 - Bit 4)
          LE Set Advertising Parameters (Octet 25 - Bit 5)
          LE Read Advertising Channel TX Power (Octet 25 - Bit 6)
          LE Set Advertising Data (Octet 25 - Bit 7)
          LE Set Scan Response Data (Octet 26 - Bit 0)
          LE Set Advertise Enable (Octet 26 - Bit 1)
          LE Set Scan Parameters (Octet 26 - Bit 2)
          LE Set Scan Enable (Octet 26 - Bit 3)
          LE Create Connection (Octet 26 - Bit 4)
          LE Create Connection Cancel (Octet 26 - Bit 5)
          LE Read Accept List Size (Octet 26 - Bit 6)
          LE Clear Accept List (Octet 26 - Bit 7)
          LE Add Device To Accept List (Octet 27 - Bit 0)
          LE Remove Device From Accept List (Octet 27 - Bit 1)
          LE Connection Update (Octet 27 - Bit 2)
          LE Set Host Channel Classification (Octet 27 - Bit 3)
          LE Read Channel Map (Octet 27 - Bit 4)
          LE Read Remote Used Features (Octet 27 - Bit 5)
          LE Encrypt (Octet 27 - Bit 6)
          LE Rand (Octet 27 - Bit 7)
          LE Start Encryption (Octet 28 - Bit 0)
          LE Long Term Key Request Reply (Octet 28 - Bit 1)
          LE Long Term Key Request Neg Reply (Octet 28 - Bit 2)
          LE Read Supported States (Octet 28 - Bit 3)
          LE Receiver Test (Octet 28 - Bit 4)
          LE Transmitter Test (Octet 28 - Bit 5)
          LE Test End (Octet 28 - Bit 6)
          Read Authenticated Payload Timeout (Octet 32 - Bit 4)
          Write Authenticated Payload Timeout (Octet 32 - Bit 5)
          LE Set Data Length (Octet 33 - Bit 6)
          LE Read Suggested Default Data Length (Octet 33 - Bit 7)
          LE Write Suggested Default Data Length (Octet 34 - Bit 0)
          LE Add Device To Resolving List (Octet 34 - Bit 3)
          LE Remove Device From Resolving List (Octet 34 - Bit 4)
          LE Clear Resolving List (Octet 34 - Bit 5)
          LE Read Resolving List Size (Octet 34 - Bit 6)
          LE Set Address Resolution Enable (Octet 35 - Bit 1)
          LE Set Resolvable Private Address Timeout (Octet 35 - Bit 2)
          LE Read Maximum Data Length (Octet 35 - Bit 3)
          LE Read PHY (Octet 35 - Bit 4)
          LE Set Default PHY (Octet 35 - Bit 5)
          LE Set PHY (Octet 35 - Bit 6)
          LE Enhanced Receiver Test (Octet 35 - Bit 7)
          LE Enhanced Transmitter Test (Octet 36 - Bit 0)
          LE Set Advertising Set Random Address (Octet 36 - Bit 1)
          LE Set Extended Advertising Parameters (Octet 36 - Bit 2)
          LE Set Extended Advertising Data (Octet 36 - Bit 3)
          LE Set Extended Scan Response Data (Octet 36 - Bit 4)
          LE Set Extended Advertising Enable (Octet 36 - Bit 5)
          LE Read Maximum Advertising Data Length (Octet 36 - Bit 6)
          LE Read Number of Supported Advertising Sets (Octet 36 - Bit 7)
          LE Remove Advertising Set (Octet 37 - Bit 0)
          LE Clear Advertising Sets (Octet 37 - Bit 1)
          LE Set Periodic Advertising Parameters (Octet 37 - Bit 2)
          LE Set Periodic Advertising Data (Octet 37 - Bit 3)
          LE Set Periodic Advertising Enable (Octet 37 - Bit 4)
          LE Set Extended Scan Parameters (Octet 37 - Bit 5)
          LE Set Extended Scan Enable (Octet 37 - Bit 6)
          LE Extended Create Connection (Octet 37 - Bit 7)
          LE Periodic Advertising Create Sync (Octet 38 - Bit 0)
          LE Periodic Advertising Create Sync Cancel (Octet 38 - Bit 1)
          LE Periodic Advertising Terminate Sync (Octet 38 - Bit 2)
          LE Add Device To Periodic Advertiser List (Octet 38 - Bit 3)
          LE Remove Device From Periodic Advertiser List (Octet 38 - Bit 4)
          LE Clear Periodic Advertiser List (Octet 38 - Bit 5)
          LE Read Periodic Advertiser List Size (Octet 38 - Bit 6)
          LE Read Transmit Power (Octet 38 - Bit 7)
          LE Read RF Path Compensation (Octet 39 - Bit 0)
          LE Write RF Path Compensation (Octet 39 - Bit 1)
          LE Set Privacy Mode (Octet 39 - Bit 2)
          LE Periodic Advertising Receive Enable (Octet 40 - Bit 5)
          LE Periodic Advertising Sync Transfer (Octet 40 - Bit 6)
          LE Periodic Advertising Set Info Transfer (Octet 40 - Bit 7)
          LE Periodic Advertising Sync Transfer Parameters (Octet 41 - Bit 0)
          LE Set Default Periodic Advertisng Sync Transfer Parameters (Octet 41 - Bit 1)
          LE Read Buffer v2 (Octet 41 - Bit 5)
          LE Read ISO TX Sync (Octet 41 - Bit 6)
          LE Set Connected Isochronous Group Parameters (Octet 41 - Bit 7)
          LE Set Connected Isochronous Group Parameters Test (Octet 42 - Bit 0)
          LE Create Connected Isochronous Stream (Octet 42 - Bit 1)
          LE Remove Connected Isochronous Group (Octet 42 - Bit 2)
          LE Accept Connected Isochronous Stream Request (Octet 42 - Bit 3)
          LE Reject Connected Isochronous Stream Request (Octet 42 - Bit 4)
          LE Create Broadcast Isochronous Group (Octet 42 - Bit 5)
          LE Create Broadcast Isochronous Group Test (Octet 42 - Bit 6)
          LE Terminate Broadcast Isochronous Group (Octet 42 - Bit 7)
          LE Broadcast Isochronous Group Create Sync (Octet 43 - Bit 0)
          LE Broadcast Isochronous Group Terminate Sync (Octet 43 - Bit 1)
          LE Request Peer SCA (Octet 43 - Bit 2)
          LE Setup Isochronous Data Path (Octet 43 - Bit 3)
          LE Remove Isochronous Data Path (Octet 43 - Bit 4)
          LE Isochronous Transmit Test (Octet 43 - Bit 5)
          LE Isochronous Receive Test (Octet 43 - Bit 6)
          LE Isochronous Read Test Counters (Octet 43 - Bit 7)
          LE Isochronous Read Test Counters (Octet 44 - Bit 0)
          LE Set Host Feature (Octet 44 - Bit 1)
          Octet 44 - Bit 2 
          Octet 45 - Bit 6 
          Octet 46 - Bit 0 
          Octet 46 - Bit 1 
          Octet 46 - Bit 2 
< HCI Command: Host Buffer Size (0x03|0x0033) plen 7         #9 [hci1] 0.869232
        ACL MTU: 255  ACL max packet: 16
        SCO MTU: 0    SCO max packet: 0
> HCI Event: Command Complete (0x0e) plen 4                 #10 [hci1] 0.869807
      Host Buffer Size (0x03|0x0033) ncmd 1
        Status: Success (0x00)
< HCI Command: Set Controller To Ho.. (0x03|0x0031) plen 1  #11 [hci1] 0.889246
        Flow control: ACL Data Packets (0x01)
> HCI Event: Command Complete (0x0e) plen 4                 #12 [hci1] 0.889668
      Set Controller To Host Flow Control (0x03|0x0031) ncmd 1
        Status: Success (0x00)
< HCI Command: LE Read Local Suppor.. (0x08|0x0003) plen 0  #13 [hci1] 0.909235
> HCI Event: Command Complete (0x0e) plen 12                #14 [hci1] 0.909723
      LE Read Local Supported Features (0x08|0x0003) ncmd 1
        Status: Success (0x00)
        Features: 0xfd 0x79 0x00 0xf7 0x30 0x01 0x00 0x00
          LE Encryption
          Extended Reject Indication
          Peripheral-initiated Features Exchange
          LE Ping
          LE Data Packet Length Extension
          LL Privacy
          Extended Scanner Filter Policies
          LE 2M PHY
          LE Coded PHY
          LE Extended Advertising
          LE Periodic Advertising
          Channel Selection Algorithm #2
          Periodic Advertising Sync Transfer - Sender
          Periodic Advertising Sync Transfer - Recipient
          Sleep Clock Accuracy Updates
          Connected Isochronous Stream - Central
          Connected Isochronous Stream - Peripheral
          Isochronous Broadcaster
          Synchronized Receiver
          Periodic Advertising ADI support
          Connection Subrating
          Unknown features (0x0000010000000000)
< HCI Command: LE Set Host Feature (0x08|0x0074) plen 2     #15 [hci1] 0.929240
        Bit Number: 32
          Connected Isochronous Stream (Host Support)
        Bit Value: 1
> HCI Event: Command Complete (0x0e) plen 4                 #16 [hci1] 0.929689
      LE Set Host Feature (0x08|0x0074) ncmd 1
        Status: Success (0x00)
< HCI Command: LE Read Buffer v2 (0x08|0x0060) plen 0       #17 [hci1] 0.949230
> HCI Event: Command Complete (0x0e) plen 10                #18 [hci1] 0.949757
      LE Read Buffer v2 (0x08|0x0060) ncmd 1
        Status: Success (0x00)
        ACL MTU: 27
        ACL max packet: 3
        ISO MTU: 318
        ISO max packet: 3
< HCI Command: LE Read Maximum Adve.. (0x08|0x003a) plen 0  #19 [hci1] 0.969262
> HCI Event: Command Complete (0x0e) plen 6                 #20 [hci1] 0.969707
      LE Read Maximum Advertising Data Length (0x08|0x003a) ncmd 1
        Status: Success (0x00)
        Max length: 1650
< HCI Command: LE Read Supported St.. (0x08|0x001c) plen 0  #21 [hci1] 0.989235
> HCI Event: Command Complete (0x0e) plen 12                #22 [hci1] 0.989690
      LE Read Supported States (0x08|0x001c) ncmd 1
        Status: Success (0x00)
        States: 0x000003ff3e0306ff
          Non-connectable Advertising State
          Scannable Advertising State
          Connectable Advertising State
          High Duty Cycle Directed Advertising State
          Passive Scanning State
          Active Scanning State
          Initiating State
            and Connection State (Central Role)
          Connection State (Peripheral Role)
          Scannable Advertising State
            and Passive Scanning State
          Connectable Advertising State
            and Passive Scanning State
          Non-connectable Advertising State
            and Initiating State
          Scannable Advertising State
            and Initiating State
          Active Scanning State
            and Connection State (Central Role)
          Passive Scanning State
            and Connection State (Peripheral Role)
          Active Scanning State
            and Connection State (Peripheral Role)
          Initiating State
            and Connection State (Central Role)
            and Central Role & Central Role
          Low Duty Cycle Directed Advertising State
          Connectable Advertising State
            and Initiating State
            and Central Role & Peripheral Role
          High Duty Cycle Directed Advertising State
            and Initiating State
            and Central Role & Peripheral Role
          Low Duty Cycle Directed Advertising State
            and Initiating State
            and Central Role & Peripheral Role
          Connectable Advertising State
            and Connection State (Central Role)
            and Central Role & Peripheral Role
          High Duty Cycle Directed Advertising State
            and Connection State (Central Role)
            and Central Role & Peripheral Role
          Low Duty Cycle Directed Advertising State
            and Connection State (Central Role)
            and Central Role & Peripheral Role
          Connectable Advertising State
            and Connection State (Peripheral Role)
            and Central Role & Peripheral Role
          High Duty Cycle Directed Advertising State
            and Connection State (Peripheral Role)
            and Peripheral Role & Peripheral Role
          Low Duty Cycle Directed Advertising State
            and Connection State (Peripheral Role)
            and Peripheral Role & Peripheral Role
          Initiating State
            and Connection State (Peripheral Role)
            and Central Role & Peripheral Role
< HCI Command: LE Read Maximum Data.. (0x08|0x002f) plen 0  #23 [hci1] 1.009225
> HCI Event: Command Complete (0x0e) plen 12                #24 [hci1] 1.009744
      LE Read Maximum Data Length (0x08|0x002f) ncmd 1
        Status: Success (0x00)
        Max TX octets: 251
        Max TX time: 2704
        Max RX octets: 251
        Max RX time: 2704
< HCI Command: LE Write Suggested D.. (0x08|0x0024) plen 4  #25 [hci1] 1.029234
        TX octets: 251
        TX time: 2704
> HCI Event: Command Complete (0x0e) plen 4                 #26 [hci1] 1.029805
      LE Write Suggested Default Data Length (0x08|0x0024) ncmd 1
        Status: Success (0x00)
< HCI Command: LE Read Resolving Li.. (0x08|0x002a) plen 0  #27 [hci1] 1.049235
> HCI Event: Command Complete (0x0e) plen 5                 #28 [hci1] 1.049621
      LE Read Resolving List Size (0x08|0x002a) ncmd 1
        Status: Success (0x00)
        Size: 8
< HCI Command: LE Set Event Mask (0x08|0x0001) plen 8       #29 [hci1] 1.069229
        Mask: 0x000002023f87fa5e
          LE Advertising Report
          LE Connection Update Complete
          LE Read Remote Used Features Complete
          LE Long Term Key Request
          LE Data Length Change
          LE Enhanced Connection Complete
          LE PHY Update Complete
          LE Extended Advertising Report
          LE Periodic Advertising Sync Established
          LE Periodic Advertising Report
          LE Periodic Advertising Sync Lost
          LE Extended Scan Timeout
          LE Extended Advertising Set Terminated
          LE Scan Request Received
          LE Periodic Advertising Sync Transfer Rvc
          LE CIS Established
          LE CIS Request
          LE Create BIG Complete
          LE Terminate BIG Complete
          LE BIG Sync Estabilished Complete
          LE BIG Sync Lost
          LE BIG Info Advertising Report
          Unknown mask (0x0000020000000000)
> HCI Event: Command Complete (0x0e) plen 4                 #30 [hci1] 1.069764
      LE Set Event Mask (0x08|0x0001) ncmd 1
        Status: Success (0x00)
< HCI Command: Set Event Mask (0x03|0x0001) plen 8          #31 [hci1] 1.089243
        Mask: 0x2000800002008890
          Disconnection Complete
          Encryption Change
          Read Remote Version Information Complete
          Hardware Error
          Data Buffer Overflow
          Encryption Key Refresh Complete
          LE Meta
> HCI Event: Command Complete (0x0e) plen 4                 #32 [hci1] 1.089803
      Set Event Mask (0x03|0x0001) ncmd 1
        Status: Success (0x00)
< HCI Command: Read BD ADDR (0x04|0x0009) plen 0            #33 [hci1] 1.109239
> HCI Event: Command Complete (0x0e) plen 10                #34 [hci1] 1.109727
      Read BD ADDR (0x04|0x0009) ncmd 1
        Status: Success (0x00)
        Address: 00:00:00:00:00:00 (OUI 00-00-00)
< HCI Command: LE Set Random Address (0x08|0x0005) plen 6   #35 [hci1] 1.129247
        Address: D5:B6:CC:31:DB:3B (Static)
> HCI Event: Command Complete (0x0e) plen 4                 #36 [hci1] 1.129702
      LE Set Random Address (0x08|0x0005) ncmd 1
        Status: Success (0x00)
< HCI Command: LE Set Extended Adv.. (0x08|0x0036) plen 25  #37 [hci1] 3.619762
        Handle: 0x00
        Properties: 0x0013
          Connectable
          Scannable
          Use legacy advertising PDUs: ADV_IND
        Min advertising interval: 100.000 msec (0x00a0)
        Max advertising interval: 150.000 msec (0x00f0)
        Channel map: 37, 38, 39 (0x07)
        Own address type: Random (0x01)
        Peer address type: Public (0x00)
        Peer address: 00:00:00:00:00:00 (OUI 00-00-00)
        Filter policy: Allow Scan Request from Any, Allow Connect Request from Any (0x00)
        TX power: Host has no preference (0x7f)
        Primary PHY: LE 1M (0x01)
        Secondary max skip: 0x00
        Secondary PHY: LE 1M (0x01)
        SID: 0x00
        Scan request notifications: Disabled (0x00)
> HCI Event: Command Complete (0x0e) plen 5                 #38 [hci1] 3.620650
      LE Set Extended Advertising Parameters (0x08|0x0036) ncmd 1
        Status: Success (0x00)
        TX power (selected): 0 dbm (0x00)
< HCI Command: LE Set Advertising S.. (0x08|0x0035) plen 7  #39 [hci1] 3.629306
        Advertising handle: 0x00
        Advertising random address: D5:B6:CC:31:DB:3B (Static)
> HCI Event: Command Complete (0x0e) plen 4                 #40 [hci1] 3.629781
      LE Set Advertising Set Random Address (0x08|0x0035) ncmd 1
        Status: Success (0x00)
< HCI Command: LE Set Extended Adv.. (0x08|0x0037) plen 22  #41 [hci1] 3.649272
        Handle: 0x00
        Operation: Complete extended advertising data (0x03)
        Fragment preference: Minimize fragmentation (0x01)
        Data length: 0x12
        Flags: 0x06
          LE General Discoverable Mode
          BR/EDR Not Supported
        Name (complete): Tester_F6B11A
> HCI Event: Command Complete (0x0e) plen 4                 #42 [hci1] 3.649993
      LE Set Extended Advertising Data (0x08|0x0037) ncmd 1
        Status: Success (0x00)
< HCI Command: LE Set Extended Scan.. (0x08|0x0038) plen 4  #43 [hci1] 3.669235
        Handle: 0x00
        Operation: Complete scan response data (0x03)
        Fragment preference: Minimize fragmentation (0x01)
        Data length: 0x00
> HCI Event: Command Complete (0x0e) plen 4                 #44 [hci1] 3.669665
      LE Set Extended Scan Response Data (0x08|0x0038) ncmd 1
        Status: Success (0x00)
< HCI Command: LE Set Extended Adve.. (0x08|0x0039) plen 6  #45 [hci1] 3.689276
        Extended advertising: Enabled (0x01)
        Number of sets: 1 (0x01)
        Entry 0
          Handle: 0x00
          Duration: 0 ms (0x00)
          Max ext adv events: 0
> HCI Event: Command Complete (0x0e) plen 4                 #46 [hci1] 3.689801
      LE Set Extended Advertising Enable (0x08|0x0039) ncmd 1
        Status: Success (0x00)
> HCI Event: LE Meta Event (0x3e) plen 31                   #47 [hci1] 3.803279
      LE Enhanced Connection Complete (0x0a)
        Status: Success (0x00)
        Handle: 1047
        Role: Peripheral (0x01)
        Peer address type: Public (0x00)
        Peer address: DF:A9:FF:F6:B1:1A (OUI DF-A9-FF)
        Local resolvable private address: 00:00:00:00:00:00 (Non-Resolvable)
        Peer resolvable private address: 00:00:00:00:00:00 (Non-Resolvable)
        Connection interval: 87.50 msec (0x0046)
        Connection latency: 0 (0x0000)
        Supervision timeout: 25120 msec (0x09d0)
        Central clock accuracy: 0x01
> HCI Event: LE Meta Event (0x3e) plen 6                    #48 [hci1] 3.803285
      LE Advertising Set Terminated (0x12)
        Status: Success (0x00)
        Handle: 0
        Connection handle: 1047
        Number of completed extended advertising events: 0
< HCI Command: LE Read Remote Used... (0x08|0x0016) plen 2  #49 [hci1] 3.810355
        Handle: 1047 Address: DF:A9:FF:F6:B1:1A (OUI DF-A9-FF)
< ACL Data TX: Handle 1047 flags 0x00 dlen 7                #50 [hci1] 3.810452
      ATT: Exchange MTU Request (0x02) len 2
        Client RX MTU: 251
> HCI Event: Command Status (0x0f) plen 4                   #51 [hci1] 3.810795
      LE Read Remote Used Features (0x08|0x0016) ncmd 1
        Status: Success (0x00)
> HCI Event: Number of Completed Packets (0x13) plen 5      #52 [hci1] 3.979174
        Num handles: 1
        Handle: 1047 Address: DF:A9:FF:F6:B1:1A (OUI DF-A9-FF)
        Count: 1
        #50: len 7 (0 Kb/s)
        Latency: 168 msec (168-168 msec ~168 msec)
> HCI Event: LE Meta Event (0x3e) plen 12                   #53 [hci1] 4.067223
      LE Read Remote Used Features (0x04)
        Status: Success (0x00)
        Handle: 1047 Address: DF:A9:FF:F6:B1:1A (OUI DF-A9-FF)
        Features: 0x2d 0x49 0x00 0xf7 0x67 0xd9 0x00 0x80
          LE Encryption
          Extended Reject Indication
          Peripheral-initiated Features Exchange
          LE Data Packet Length Extension
          LE 2M PHY
          LE Coded PHY
          Channel Selection Algorithm #2
          Periodic Advertising Sync Transfer - Sender
          Periodic Advertising Sync Transfer - Recipient
          Sleep Clock Accuracy Updates
          Connected Isochronous Stream - Central
          Connected Isochronous Stream - Peripheral
          Isochronous Broadcaster
          Synchronized Receiver
          Connected Isochronous Stream (Host Support)
          LE Power Control Request
          LE Power Control Request
          Connection Subrating
          Connection Subrating (Host Support)
          Unknown features (0x8000d90000000000)
> ACL Data RX: Handle 1047 flags 0x02 dlen 11               #54 [hci1] 6.516760
      SMP: Pairing Request (0x01) len 6
        IO capability: KeyboardDisplay (0x04)
        OOB data: Authentication data not present (0x00)
        Authentication requirement: Bonding, MITM, SC, No Keypresses (0x0d)
        Max encryption key size: 16
        Initiator key distribution: EncKey IdKey (0x03)
        Responder key distribution: EncKey IdKey Sign (0x07)
> ACL Data RX: Handle 1047 flags 0x02 dlen 7                #55 [hci1] 6.517280
      ATT: Exchange MTU Response (0x03) len 2
        Server RX MTU: 23
< HCI Command: Host Number of Compl.. (0x03|0x0035) plen 5  #56 [hci1] 6.529947
        Num handles: 1
        Handle: 1047 Address: DF:A9:FF:F6:B1:1A (OUI DF-A9-FF)
        Count: 1
< ACL Data TX: Handle 1047 flags 0x00 dlen 11               #57 [hci1] 6.530115
      SMP: Pairing Response (0x02) len 6
        IO capability: DisplayOnly (0x00)
        OOB data: Authentication data not present (0x00)
        Authentication requirement: Bonding, No MITM, SC, No Keypresses (0x09)
        Max encryption key size: 16
        Initiator key distribution: IdKey (0x02)
        Responder key distribution: <none> (0x00)
< HCI Command: Host Number of Compl.. (0x03|0x0035) plen 5  #58 [hci1] 6.530565
        Num handles: 1
        Handle: 1047 Address: DF:A9:FF:F6:B1:1A (OUI DF-A9-FF)
        Count: 1
> HCI Event: Number of Completed Packets (0x13) plen 5      #59 [hci1] 6.691881
        Num handles: 1
        Handle: 1047 Address: DF:A9:FF:F6:B1:1A (OUI DF-A9-FF)
        Count: 1
        #57: len 11 (0 Kb/s)
        Latency: 161 msec (161-168 msec ~165 msec)
> ACL Data RX: Handle 1047 flags 0x02 dlen 27               #60 [hci1] 6.692201
> ACL Data RX: Handle 1047 flags 0x01 dlen 27               #61 [hci1] 6.692711
> ACL Data RX: Handle 1047 flags 0x01 dlen 15               #62 [hci1] 6.693162
      SMP: Pairing Public Key (0x0c) len 64
        X: dc9433d061057b3d025158ad5c09906612e2c8d6d08ba0fa66b1e6f8de190b6c
        Y: e8f1e98204fa8a2da434bfa0377524d699ac9d8fabf32df98c3c39dfef1b30ec
< HCI Command: Host Number of Compl.. (0x03|0x0035) plen 5  #63 [hci1] 6.710288
        Num handles: 1
        Handle: 1047 Address: DF:A9:FF:F6:B1:1A (OUI DF-A9-FF)
        Count: 1
< HCI Command: Host Number of Compl.. (0x03|0x0035) plen 5  #64 [hci1] 6.710505
        Num handles: 1
        Handle: 1047 Address: DF:A9:FF:F6:B1:1A (OUI DF-A9-FF)
        Count: 1
< HCI Command: Host Number of Compl.. (0x03|0x0035) plen 5  #65 [hci1] 6.710856
        Num handles: 1
        Handle: 1047 Address: DF:A9:FF:F6:B1:1A (OUI DF-A9-FF)
        Count: 1
< ACL Data TX: Handle 1047 flags 0x00 dlen 27               #66 [hci1] 6.711052
< ACL Data TX: Handle 1047 flags 0x01 dlen 27               #67 [hci1] 6.711070
< ACL Data TX: Handle 1047 flags 0x01 dlen 15               #68 [hci1] 6.711074
      SMP: Pairing Public Key (0x0c) len 64
        X: 98308440221e2d910f0e54b71e7ec652857aa9b5a0dc65028824cc19db1226e9
        Y: 67a4816bcb62efb21701e31fdb27561a6217575fb007a8bbdabe7e28b6f68482
> HCI Event: Number of Completed Packets (0x13) plen 5      #69 [hci1] 6.779807
        Num handles: 1
        Handle: 1047 Address: DF:A9:FF:F6:B1:1A (OUI DF-A9-FF)
        Count: 1
        #66: len 27 (3 Kb/s)
        Latency: 68 msec (68-168 msec ~116 msec)
> HCI Event: Number of Completed Packets (0x13) plen 5      #70 [hci1] 6.780575
        Num handles: 1
        Handle: 1047 Address: DF:A9:FF:F6:B1:1A (OUI DF-A9-FF)
        Count: 1
        #67: len 27 (3 Kb/s)
        Latency: 69 msec (68-168 msec ~93 msec)
> HCI Event: Number of Completed Packets (0x13) plen 5      #71 [hci1] 6.866622
        Num handles: 1
        Handle: 1047 Address: DF:A9:FF:F6:B1:1A (OUI DF-A9-FF)
        Count: 1
        #68: len 15 (0 Kb/s)
        Latency: 155 msec (68-168 msec ~124 msec)
> ACL Data RX: Handle 1047 flags 0x02 dlen 21               #72 [hci1] 7.829444
      SMP: Pairing Confirm (0x03) len 16
        Confim value: 4e2a734c1040aac03504272a942e4d13
< HCI Command: Host Number of Compl.. (0x03|0x0035) plen 5  #73 [hci1] 7.850054
        Num handles: 1
        Handle: 1047 Address: DF:A9:FF:F6:B1:1A (OUI DF-A9-FF)
        Count: 1
< ACL Data TX: Handle 1047 flags 0x00 dlen 21               #74 [hci1] 7.850197
      SMP: Pairing Confirm (0x03) len 16
        Confim value: f6cdb2d098fb74a66001f550f70d2493
> HCI Event: Number of Completed Packets (0x13) plen 5      #75 [hci1] 8.004346
        Num handles: 1
        Handle: 1047 Address: DF:A9:FF:F6:B1:1A (OUI DF-A9-FF)
        Count: 1
        #74: len 21 (1 Kb/s)
        Latency: 154 msec (68-168 msec ~139 msec)
> ACL Data RX: Handle 1047 flags 0x02 dlen 21               #76 [hci1] 8.004614
      SMP: Pairing Random (0x04) len 16
        Random value: 8447f8ebcd0c1af30000000000000000
< HCI Command: Host Number of Compl.. (0x03|0x0035) plen 5  #77 [hci1] 8.010191
        Num handles: 1
        Handle: 1047 Address: DF:A9:FF:F6:B1:1A (OUI DF-A9-FF)
        Count: 1
< ACL Data TX: Handle 1047 flags 0x00 dlen 21               #78 [hci1] 8.010360
      SMP: Pairing Random (0x04) len 16
        Random value: 8e6108f966a694cbe26df70bb96773e6
> HCI Event: Number of Completed Packets (0x13) plen 5      #79 [hci1] 8.179098
        Num handles: 1
        Handle: 1047 Address: DF:A9:FF:F6:B1:1A (OUI DF-A9-FF)
        Count: 1
        #78: len 21 (1 Kb/s)
        Latency: 168 msec (68-168 msec ~154 msec)
> ACL Data RX: Handle 1047 flags 0x02 dlen 21               #80 [hci1] 8.266985
      SMP: Pairing Confirm (0x03) len 16
        Confim value: 258abcb582156da2d45a883e345be8c0
< HCI Command: Host Number of Compl.. (0x03|0x0035) plen 5  #81 [hci1] 8.269956
        Num handles: 1
        Handle: 1047 Address: DF:A9:FF:F6:B1:1A (OUI DF-A9-FF)
        Count: 1
< ACL Data TX: Handle 1047 flags 0x00 dlen 21               #82 [hci1] 8.270109
      SMP: Pairing Confirm (0x03) len 16
        Confim value: f216fcdf4a72a4d6bec5490eb83a6e7d
> HCI Event: Number of Completed Packets (0x13) plen 5      #83 [hci1] 8.441782
        Num handles: 1
        Handle: 1047 Address: DF:A9:FF:F6:B1:1A (OUI DF-A9-FF)
        Count: 1
        #82: len 21 (0 Kb/s)
        Latency: 171 msec (68-171 msec ~162 msec)
> ACL Data RX: Handle 1047 flags 0x02 dlen 21               #84 [hci1] 8.442148
      SMP: Pairing Random (0x04) len 16
        Random value: e306c48856c604aa0000000000000000
< HCI Command: Host Number of Compl.. (0x03|0x0035) plen 5  #85 [hci1] 8.449604
        Num handles: 1
        Handle: 1047 Address: DF:A9:FF:F6:B1:1A (OUI DF-A9-FF)
        Count: 1
< ACL Data TX: Handle 1047 flags 0x00 dlen 21               #86 [hci1] 8.449687
      SMP: Pairing Random (0x04) len 16
        Random value: 4d02679f89a05211af56d8b3da64d21e
> HCI Event: Number of Completed Packets (0x13) plen 5      #87 [hci1] 8.616613
        Num handles: 1
        Handle: 1047 Address: DF:A9:FF:F6:B1:1A (OUI DF-A9-FF)
        Count: 1
        #86: len 21 (1 Kb/s)
        Latency: 166 msec (68-171 msec ~164 msec)
> ACL Data RX: Handle 1047 flags 0x02 dlen 21               #88 [hci1] 8.704463
      SMP: Pairing Confirm (0x03) len 16
        Confim value: 4fed409a2354ff4e888715cb056ab6d1
< HCI Command: Host Number of Compl.. (0x03|0x0035) plen 5  #89 [hci1] 8.709949
        Num handles: 1
        Handle: 1047 Address: DF:A9:FF:F6:B1:1A (OUI DF-A9-FF)
        Count: 1
< ACL Data TX: Handle 1047 flags 0x00 dlen 21               #90 [hci1] 8.710087
      SMP: Pairing Confirm (0x03) len 16
        Confim value: b85b5cdf34b12670d2dc14f7492091ef
> HCI Event: Number of Completed Packets (0x13) plen 5      #91 [hci1] 8.879274
        Num handles: 1
        Handle: 1047 Address: DF:A9:FF:F6:B1:1A (OUI DF-A9-FF)
        Count: 1
        #90: len 21 (0 Kb/s)
        Latency: 169 msec (68-171 msec ~167 msec)
> ACL Data RX: Handle 1047 flags 0x02 dlen 21               #92 [hci1] 8.879649
      SMP: Pairing Random (0x04) len 16
        Random value: 6af1795aa83060250000000000000000
< HCI Command: Host Number of Compl.. (0x03|0x0035) plen 5  #93 [hci1] 8.890170
        Num handles: 1
        Handle: 1047 Address: DF:A9:FF:F6:B1:1A (OUI DF-A9-FF)
        Count: 1
< ACL Data TX: Handle 1047 flags 0x00 dlen 21               #94 [hci1] 8.890335
      SMP: Pairing Random (0x04) len 16
        Random value: 5e8286bc235a02440d0c3424a2acf8fd
> HCI Event: Number of Completed Packets (0x13) plen 5      #95 [hci1] 9.054121
        Num handles: 1
        Handle: 1047 Address: DF:A9:FF:F6:B1:1A (OUI DF-A9-FF)
        Count: 1
        #94: len 21 (1 Kb/s)
        Latency: 163 msec (68-171 msec ~165 msec)
> ACL Data RX: Handle 1047 flags 0x02 dlen 21               #96 [hci1] 9.141883
      SMP: Pairing Confirm (0x03) len 16
        Confim value: 5bd28b431043a97a2dd1c5e5f34e6b32
< HCI Command: Host Number of Compl.. (0x03|0x0035) plen 5  #97 [hci1] 9.149840
        Num handles: 1
        Handle: 1047 Address: DF:A9:FF:F6:B1:1A (OUI DF-A9-FF)
        Count: 1
< ACL Data TX: Handle 1047 flags 0x00 dlen 21               #98 [hci1] 9.150019
      SMP: Pairing Confirm (0x03) len 16
        Confim value: d4d9bb32c9e677b1d81e447df84a0dec
> HCI Event: Number of Completed Packets (0x13) plen 5      #99 [hci1] 9.316858
        Num handles: 1
        Handle: 1047 Address: DF:A9:FF:F6:B1:1A (OUI DF-A9-FF)
        Count: 1
        #98: len 21 (1 Kb/s)
        Latency: 166 msec (68-171 msec ~166 msec)
> ACL Data RX: Handle 1047 flags 0x02 dlen 21              #100 [hci1] 9.317113
      SMP: Pairing Random (0x04) len 16
        Random value: 5a6004da9314a8410000000000000000
< HCI Command: Host Number of Comp.. (0x03|0x0035) plen 5  #101 [hci1] 9.330234
        Num handles: 1
        Handle: 1047 Address: DF:A9:FF:F6:B1:1A (OUI DF-A9-FF)
        Count: 1
< ACL Data TX: Handle 1047 flags 0x00 dlen 21              #102 [hci1] 9.330392
      SMP: Pairing Random (0x04) len 16
        Random value: 5c4a1bcadd27bd58e945097b00bad7ac
> HCI Event: Number of Completed Packets (0x13) plen 5     #103 [hci1] 9.491592
        Num handles: 1
        Handle: 1047 Address: DF:A9:FF:F6:B1:1A (OUI DF-A9-FF)
        Count: 1
        #102: len 21 (1 Kb/s)
        Latency: 161 msec (68-171 msec ~163 msec)
> ACL Data RX: Handle 1047 flags 0x02 dlen 21              #104 [hci1] 9.579470
      SMP: Pairing Confirm (0x03) len 16
        Confim value: e8d922e80f2ccb743ef12e772de2c45d
< HCI Command: Host Number of Comp.. (0x03|0x0035) plen 5  #105 [hci1] 9.589486
        Num handles: 1
        Handle: 1047 Address: DF:A9:FF:F6:B1:1A (OUI DF-A9-FF)
        Count: 1
< ACL Data TX: Handle 1047 flags 0x00 dlen 21              #106 [hci1] 9.589599
      SMP: Pairing Confirm (0x03) len 16
        Confim value: 629c4d9867920e9599f54164cfcec9a5
> HCI Event: Number of Completed Packets (0x13) plen 5     #107 [hci1] 9.754315
        Num handles: 1
        Handle: 1047 Address: DF:A9:FF:F6:B1:1A (OUI DF-A9-FF)
        Count: 1
        #106: len 21 (1 Kb/s)
        Latency: 164 msec (68-171 msec ~164 msec)
> ACL Data RX: Handle 1047 flags 0x02 dlen 21              #108 [hci1] 9.754624
      SMP: Pairing Random (0x04) len 16
        Random value: 8c64cb200f6186380000000000000000
< HCI Command: Host Number of Comp.. (0x03|0x0035) plen 5  #109 [hci1] 9.769468
        Num handles: 1
        Handle: 1047 Address: DF:A9:FF:F6:B1:1A (OUI DF-A9-FF)
        Count: 1
< ACL Data TX: Handle 1047 flags 0x00 dlen 21              #110 [hci1] 9.769497
      SMP: Pairing Random (0x04) len 16
        Random value: 32527e6e64e79f33b2e374394db8ab2d
> HCI Event: Number of Completed Packets (0x13) plen 5     #111 [hci1] 9.929016
        Num handles: 1
        Handle: 1047 Address: DF:A9:FF:F6:B1:1A (OUI DF-A9-FF)
        Count: 1
        #110: len 21 (1 Kb/s)
        Latency: 159 msec (68-171 msec ~161 msec)
> ACL Data RX: Handle 1047 flags 0x02 dlen 21             #112 [hci1] 10.016909
      SMP: Pairing Confirm (0x03) len 16
        Confim value: 17bb5b3b5e4bf04d509da02c5291fdb8
< HCI Command: Host Number of Com.. (0x03|0x0035) plen 5  #113 [hci1] 10.029436
        Num handles: 1
        Handle: 1047 Address: DF:A9:FF:F6:B1:1A (OUI DF-A9-FF)
        Count: 1
< ACL Data TX: Handle 1047 flags 0x00 dlen 21             #114 [hci1] 10.029469
      SMP: Pairing Confirm (0x03) len 16
        Confim value: 6b61b5aff403ca604ec7456c233bb89e
> HCI Event: Number of Completed Packets (0x13) plen 5    #115 [hci1] 10.191781
        Num handles: 1
        Handle: 1047 Address: DF:A9:FF:F6:B1:1A (OUI DF-A9-FF)
        Count: 1
        #114: len 21 (1 Kb/s)
        Latency: 162 msec (68-171 msec ~162 msec)
> ACL Data RX: Handle 1047 flags 0x02 dlen 21             #116 [hci1] 10.192076
      SMP: Pairing Random (0x04) len 16
        Random value: da9805eb1731ea940000000000000000
< HCI Command: Host Number of Com.. (0x03|0x0035) plen 5  #117 [hci1] 10.210172
        Num handles: 1
        Handle: 1047 Address: DF:A9:FF:F6:B1:1A (OUI DF-A9-FF)
        Count: 1
< ACL Data TX: Handle 1047 flags 0x00 dlen 21             #118 [hci1] 10.210300
      SMP: Pairing Random (0x04) len 16
        Random value: dddbdfe2838e9a8cc6964353c850fef7
> HCI Event: Number of Completed Packets (0x13) plen 5    #119 [hci1] 10.366544
        Num handles: 1
        Handle: 1047 Address: DF:A9:FF:F6:B1:1A (OUI DF-A9-FF)
        Count: 1
        #118: len 21 (1 Kb/s)
        Latency: 156 msec (68-171 msec ~159 msec)
> ACL Data RX: Handle 1047 flags 0x02 dlen 21             #120 [hci1] 10.454396
      SMP: Pairing Confirm (0x03) len 16
        Confim value: 9df4164c20dd152924b06318b3ca68f0
< HCI Command: Host Number of Com.. (0x03|0x0035) plen 5  #121 [hci1] 10.469886
        Num handles: 1
        Handle: 1047 Address: DF:A9:FF:F6:B1:1A (OUI DF-A9-FF)
        Count: 1
< ACL Data TX: Handle 1047 flags 0x00 dlen 21             #122 [hci1] 10.470041
      SMP: Pairing Confirm (0x03) len 16
        Confim value: f12bc18b13893ae011aa70f3aeee33bb
> HCI Event: Number of Completed Packets (0x13) plen 5    #123 [hci1] 10.629234
        Num handles: 1
        Handle: 1047 Address: DF:A9:FF:F6:B1:1A (OUI DF-A9-FF)
        Count: 1
        #122: len 21 (1 Kb/s)
        Latency: 159 msec (68-171 msec ~159 msec)
> ACL Data RX: Handle 1047 flags 0x02 dlen 21             #124 [hci1] 10.629633
      SMP: Pairing Random (0x04) len 16
        Random value: 1f1be6502b69e5f10000000000000000
< HCI Command: Host Number of Com.. (0x03|0x0035) plen 5  #125 [hci1] 10.649974
        Num handles: 1
        Handle: 1047 Address: DF:A9:FF:F6:B1:1A (OUI DF-A9-FF)
        Count: 1
< ACL Data TX: Handle 1047 flags 0x00 dlen 21             #126 [hci1] 10.650172
      SMP: Pairing Random (0x04) len 16
        Random value: eb9f1915536596b6fc3db1c86b2b1970
> HCI Event: Number of Completed Packets (0x13) plen 5    #127 [hci1] 10.804040
        Num handles: 1
        Handle: 1047 Address: DF:A9:FF:F6:B1:1A (OUI DF-A9-FF)
        Count: 1
        #126: len 21 (1 Kb/s)
        Latency: 153 msec (68-171 msec ~156 msec)
> ACL Data RX: Handle 1047 flags 0x02 dlen 21             #128 [hci1] 10.891891
      SMP: Pairing Confirm (0x03) len 16
        Confim value: 4303abda5128ebdb1377ea3ac166c83d
< HCI Command: Host Number of Com.. (0x03|0x0035) plen 5  #129 [hci1] 10.910012
        Num handles: 1
        Handle: 1047 Address: DF:A9:FF:F6:B1:1A (OUI DF-A9-FF)
        Count: 1
< ACL Data TX: Handle 1047 flags 0x00 dlen 21             #130 [hci1] 10.910112
      SMP: Pairing Confirm (0x03) len 16
        Confim value: c901c7dad3bff46177379c590b7b11c1
> HCI Event: Number of Completed Packets (0x13) plen 5    #131 [hci1] 11.066794
        Num handles: 1
        Handle: 1047 Address: DF:A9:FF:F6:B1:1A (OUI DF-A9-FF)
        Count: 1
        #130: len 21 (1 Kb/s)
        Latency: 156 msec (68-171 msec ~156 msec)
> ACL Data RX: Handle 1047 flags 0x02 dlen 21             #132 [hci1] 11.067108
      SMP: Pairing Random (0x04) len 16
        Random value: 4bfe6b101aba081d0000000000000000
< HCI Command: Host Number of Com.. (0x03|0x0035) plen 5  #133 [hci1] 11.070213
        Num handles: 1
        Handle: 1047 Address: DF:A9:FF:F6:B1:1A (OUI DF-A9-FF)
        Count: 1
< ACL Data TX: Handle 1047 flags 0x00 dlen 21             #134 [hci1] 11.070321
      SMP: Pairing Random (0x04) len 16
        Random value: 5c794dc9ad9f2c3f295ebd5ad5e1c3cf
> HCI Event: Number of Completed Packets (0x13) plen 5    #135 [hci1] 11.241506
        Num handles: 1
        Handle: 1047 Address: DF:A9:FF:F6:B1:1A (OUI DF-A9-FF)
        Count: 1
        #134: len 21 (0 Kb/s)
        Latency: 171 msec (68-171 msec ~163 msec)
> ACL Data RX: Handle 1047 flags 0x02 dlen 21             #136 [hci1] 11.329464
      SMP: Pairing Confirm (0x03) len 16
        Confim value: e742427c9d86090415f0ed389f7ad92c
< HCI Command: Host Number of Com.. (0x03|0x0035) plen 5  #137 [hci1] 11.349928
        Num handles: 1
        Handle: 1047 Address: DF:A9:FF:F6:B1:1A (OUI DF-A9-FF)
        Count: 1
< ACL Data TX: Handle 1047 flags 0x00 dlen 21             #138 [hci1] 11.350064
      SMP: Pairing Confirm (0x03) len 16
        Confim value: d22334c11bea7e2bf0625ea175661579
> HCI Event: Number of Completed Packets (0x13) plen 5    #139 [hci1] 11.504260
        Num handles: 1
        Handle: 1047 Address: DF:A9:FF:F6:B1:1A (OUI DF-A9-FF)
        Count: 1
        #138: len 21 (1 Kb/s)
        Latency: 154 msec (68-171 msec ~159 msec)
> ACL Data RX: Handle 1047 flags 0x02 dlen 21             #140 [hci1] 11.504611
      SMP: Pairing Random (0x04) len 16
        Random value: ac4642f9336f994a0000000000000000
< HCI Command: Host Number of Com.. (0x03|0x0035) plen 5  #141 [hci1] 11.510120
        Num handles: 1
        Handle: 1047 Address: DF:A9:FF:F6:B1:1A (OUI DF-A9-FF)
        Count: 1
< ACL Data TX: Handle 1047 flags 0x00 dlen 21             #142 [hci1] 11.510254
      SMP: Pairing Random (0x04) len 16
        Random value: 5c2fff312cdf99c9491988e877355a9a
> HCI Event: Number of Completed Packets (0x13) plen 5    #143 [hci1] 11.679025
        Num handles: 1
        Handle: 1047 Address: DF:A9:FF:F6:B1:1A (OUI DF-A9-FF)
        Count: 1
        #142: len 21 (1 Kb/s)
        Latency: 168 msec (68-171 msec ~163 msec)
> ACL Data RX: Handle 1047 flags 0x02 dlen 21             #144 [hci1] 11.767107
      SMP: Pairing Confirm (0x03) len 16
        Confim value: d0d4d0cb50cd4e48b058370388f961b6
< HCI Command: Host Number of Com.. (0x03|0x0035) plen 5  #145 [hci1] 11.769869
        Num handles: 1
        Handle: 1047 Address: DF:A9:FF:F6:B1:1A (OUI DF-A9-FF)
        Count: 1
< ACL Data TX: Handle 1047 flags 0x00 dlen 21             #146 [hci1] 11.770036
      SMP: Pairing Confirm (0x03) len 16
        Confim value: 3d82dd24782a63fe24d8761d284671cb
> HCI Event: Number of Completed Packets (0x13) plen 5    #147 [hci1] 11.941710
        Num handles: 1
        Handle: 1047 Address: DF:A9:FF:F6:B1:1A (OUI DF-A9-FF)
        Count: 1
        #146: len 21 (0 Kb/s)
        Latency: 171 msec (68-171 msec ~167 msec)
> ACL Data RX: Handle 1047 flags 0x02 dlen 21             #148 [hci1] 11.942088
      SMP: Pairing Random (0x04) len 16
        Random value: ba842e006b52ad350000000000000000
< HCI Command: Host Number of Com.. (0x03|0x0035) plen 5  #149 [hci1] 11.950242
        Num handles: 1
        Handle: 1047 Address: DF:A9:FF:F6:B1:1A (OUI DF-A9-FF)
        Count: 1
< ACL Data TX: Handle 1047 flags 0x00 dlen 21             #150 [hci1] 11.950368
      SMP: Pairing Random (0x04) len 16
        Random value: c629a3a987d808e808655d558dfc1155
> HCI Event: Number of Completed Packets (0x13) plen 5    #151 [hci1] 12.116526
        Num handles: 1
        Handle: 1047 Address: DF:A9:FF:F6:B1:1A (OUI DF-A9-FF)
        Count: 1
        #150: len 21 (1 Kb/s)
        Latency: 166 msec (68-171 msec ~166 msec)
> ACL Data RX: Handle 1047 flags 0x02 dlen 21             #152 [hci1] 12.204487
      SMP: Pairing Confirm (0x03) len 16
        Confim value: 258cc9d81e29de50a1e7945ddf452414
< HCI Command: Host Number of Com.. (0x03|0x0035) plen 5  #153 [hci1] 12.210020
        Num handles: 1
        Handle: 1047 Address: DF:A9:FF:F6:B1:1A (OUI DF-A9-FF)
        Count: 1
< ACL Data TX: Handle 1047 flags 0x00 dlen 21             #154 [hci1] 12.210196
      SMP: Pairing Confirm (0x03) len 16
        Confim value: bba53d6b81b59dc66c1d0e3fe1141e35
> HCI Event: Number of Completed Packets (0x13) plen 5    #155 [hci1] 12.379237
        Num handles: 1
        Handle: 1047 Address: DF:A9:FF:F6:B1:1A (OUI DF-A9-FF)
        Count: 1
        #154: len 21 (0 Kb/s)
        Latency: 169 msec (68-171 msec ~168 msec)
> ACL Data RX: Handle 1047 flags 0x02 dlen 21             #156 [hci1] 12.379705
      SMP: Pairing Random (0x04) len 16
        Random value: eefd6c7af5de7c030000000000000000
< HCI Command: Host Number of Com.. (0x03|0x0035) plen 5  #157 [hci1] 12.390279
        Num handles: 1
        Handle: 1047 Address: DF:A9:FF:F6:B1:1A (OUI DF-A9-FF)
        Count: 1
< ACL Data TX: Handle 1047 flags 0x00 dlen 21             #158 [hci1] 12.390369
      SMP: Pairing Random (0x04) len 16
        Random value: 92f20f6ad8f13724432c7fd6001c45ff
> HCI Event: Number of Completed Packets (0x13) plen 5    #159 [hci1] 12.554082
        Num handles: 1
        Handle: 1047 Address: DF:A9:FF:F6:B1:1A (OUI DF-A9-FF)
        Count: 1
        #158: len 21 (1 Kb/s)
        Latency: 163 msec (68-171 msec ~165 msec)
> ACL Data RX: Handle 1047 flags 0x02 dlen 21             #160 [hci1] 12.641978
      SMP: Pairing Confirm (0x03) len 16
        Confim value: 42c7fc4f10abee9c8bafe807258ff84a
< HCI Command: Host Number of Com.. (0x03|0x0035) plen 5  #161 [hci1] 12.649669
        Num handles: 1
        Handle: 1047 Address: DF:A9:FF:F6:B1:1A (OUI DF-A9-FF)
        Count: 1
< ACL Data TX: Handle 1047 flags 0x00 dlen 21             #162 [hci1] 12.649761
      SMP: Pairing Confirm (0x03) len 16
        Confim value: ace551bcceaa3bd535cd391dfa4048bd
> HCI Event: Number of Completed Packets (0x13) plen 5    #163 [hci1] 12.816701
        Num handles: 1
        Handle: 1047 Address: DF:A9:FF:F6:B1:1A (OUI DF-A9-FF)
        Count: 1
        #162: len 21 (1 Kb/s)
        Latency: 166 msec (68-171 msec ~166 msec)
> ACL Data RX: Handle 1047 flags 0x02 dlen 21             #164 [hci1] 12.817103
      SMP: Pairing Random (0x04) len 16
        Random value: a5e4bdcd4d8135810000000000000000
< HCI Command: Host Number of Com.. (0x03|0x0035) plen 5  #165 [hci1] 12.830275
        Num handles: 1
        Handle: 1047 Address: DF:A9:FF:F6:B1:1A (OUI DF-A9-FF)
        Count: 1
< ACL Data TX: Handle 1047 flags 0x00 dlen 21             #166 [hci1] 12.830456
      SMP: Pairing Random (0x04) len 16
        Random value: 23ac32ebbb5e14c8a6b9622f296d277f
> HCI Event: Number of Completed Packets (0x13) plen 5    #167 [hci1] 12.991529
        Num handles: 1
        Handle: 1047 Address: DF:A9:FF:F6:B1:1A (OUI DF-A9-FF)
        Count: 1
        #166: len 21 (1 Kb/s)
        Latency: 161 msec (68-171 msec ~163 msec)
> ACL Data RX: Handle 1047 flags 0x02 dlen 21             #168 [hci1] 13.079365
      SMP: Pairing Confirm (0x03) len 16
        Confim value: bd69fd747cfa4e3ec638a51189ee0488
< HCI Command: Host Number of Com.. (0x03|0x0035) plen 5  #169 [hci1] 13.089646
        Num handles: 1
        Handle: 1047 Address: DF:A9:FF:F6:B1:1A (OUI DF-A9-FF)
        Count: 1
< ACL Data TX: Handle 1047 flags 0x00 dlen 21             #170 [hci1] 13.089728
      SMP: Pairing Confirm (0x03) len 16
        Confim value: 5eb58e26cbd62a4fb1297ddc02b80ebe
> HCI Event: Number of Completed Packets (0x13) plen 5    #171 [hci1] 13.254245
        Num handles: 1
        Handle: 1047 Address: DF:A9:FF:F6:B1:1A (OUI DF-A9-FF)
        Count: 1
        #170: len 21 (1 Kb/s)
        Latency: 164 msec (68-171 msec ~164 msec)
> ACL Data RX: Handle 1047 flags 0x02 dlen 21             #172 [hci1] 13.254537
      SMP: Pairing Random (0x04) len 16
        Random value: 5e19f2a7471cd8b40000000000000000
< HCI Command: Host Number of Com.. (0x03|0x0035) plen 5  #173 [hci1] 13.270277
        Num handles: 1
        Handle: 1047 Address: DF:A9:FF:F6:B1:1A (OUI DF-A9-FF)
        Count: 1
< ACL Data TX: Handle 1047 flags 0x00 dlen 21             #174 [hci1] 13.270370
      SMP: Pairing Random (0x04) len 16
        Random value: 297efe85e67448a15f56bd27e3a3cf1d
> HCI Event: Number of Completed Packets (0x13) plen 5    #175 [hci1] 13.429105
        Num handles: 1
        Handle: 1047 Address: DF:A9:FF:F6:B1:1A (OUI DF-A9-FF)
        Count: 1
        #174: len 21 (1 Kb/s)
        Latency: 158 msec (68-171 msec ~161 msec)
> ACL Data RX: Handle 1047 flags 0x02 dlen 21             #176 [hci1] 13.516969
      SMP: Pairing Confirm (0x03) len 16
        Confim value: c3556d359e8924b96f9b1f2ab9137d1b
< HCI Command: Host Number of Com.. (0x03|0x0035) plen 5  #177 [hci1] 13.530049
        Num handles: 1
        Handle: 1047 Address: DF:A9:FF:F6:B1:1A (OUI DF-A9-FF)
        Count: 1
< ACL Data TX: Handle 1047 flags 0x00 dlen 21             #178 [hci1] 13.530219
      SMP: Pairing Confirm (0x03) len 16
        Confim value: b6fb425f66d1287293f03c32d4007340
> HCI Event: Number of Completed Packets (0x13) plen 5    #179 [hci1] 13.691727
        Num handles: 1
        Handle: 1047 Address: DF:A9:FF:F6:B1:1A (OUI DF-A9-FF)
        Count: 1
        #178: len 21 (1 Kb/s)
        Latency: 161 msec (68-171 msec ~161 msec)
> ACL Data RX: Handle 1047 flags 0x02 dlen 21             #180 [hci1] 13.692171
      SMP: Pairing Random (0x04) len 16
        Random value: 784df2276ac1dd3e0000000000000000
< HCI Command: Host Number of Com.. (0x03|0x0035) plen 5  #181 [hci1] 13.709946
        Num handles: 1
        Handle: 1047 Address: DF:A9:FF:F6:B1:1A (OUI DF-A9-FF)
        Count: 1
< ACL Data TX: Handle 1047 flags 0x00 dlen 21             #182 [hci1] 13.710114
      SMP: Pairing Random (0x04) len 16
        Random value: 25a9493fd3ce4faf02be7293595bb7c6
> HCI Event: Number of Completed Packets (0x13) plen 5    #183 [hci1] 13.866507
        Num handles: 1
        Handle: 1047 Address: DF:A9:FF:F6:B1:1A (OUI DF-A9-FF)
        Count: 1
        #182: len 21 (1 Kb/s)
        Latency: 156 msec (68-171 msec ~158 msec)
> ACL Data RX: Handle 1047 flags 0x02 dlen 21             #184 [hci1] 13.954415
      SMP: Pairing Confirm (0x03) len 16
        Confim value: 6e392b70117ae5d2f69edd4ba66d1036
< HCI Command: Host Number of Com.. (0x03|0x0035) plen 5  #185 [hci1] 13.969957
        Num handles: 1
        Handle: 1047 Address: DF:A9:FF:F6:B1:1A (OUI DF-A9-FF)
        Count: 1
< ACL Data TX: Handle 1047 flags 0x00 dlen 21             #186 [hci1] 13.970110
      SMP: Pairing Confirm (0x03) len 16
        Confim value: 597169d868d0825f697c48fce10fc8a5
> HCI Event: Number of Completed Packets (0x13) plen 5    #187 [hci1] 14.129209
        Num handles: 1
        Handle: 1047 Address: DF:A9:FF:F6:B1:1A (OUI DF-A9-FF)
        Count: 1
        #186: len 21 (1 Kb/s)
        Latency: 159 msec (68-171 msec ~159 msec)
> ACL Data RX: Handle 1047 flags 0x02 dlen 21             #188 [hci1] 14.129613
      SMP: Pairing Random (0x04) len 16
        Random value: 1ff30efb199d23620000000000000000
< HCI Command: Host Number of Com.. (0x03|0x0035) plen 5  #189 [hci1] 14.150007
        Num handles: 1
        Handle: 1047 Address: DF:A9:FF:F6:B1:1A (OUI DF-A9-FF)
        Count: 1
< ACL Data TX: Handle 1047 flags 0x00 dlen 21             #190 [hci1] 14.150087
      SMP: Pairing Random (0x04) len 16
        Random value: 58f6b41f855a6f6c3560debd84e2affc
> HCI Event: Number of Completed Packets (0x13) plen 5    #191 [hci1] 14.304043
        Num handles: 1
        Handle: 1047 Address: DF:A9:FF:F6:B1:1A (OUI DF-A9-FF)
        Count: 1
        #190: len 21 (1 Kb/s)
        Latency: 153 msec (68-171 msec ~156 msec)
> ACL Data RX: Handle 1047 flags 0x02 dlen 21             #192 [hci1] 14.391838
      SMP: Pairing Confirm (0x03) len 16
        Confim value: 9f69abe6ccc3d60f2590c4d9404f0573
< HCI Command: Host Number of Com.. (0x03|0x0035) plen 5  #193 [hci1] 14.409988
        Num handles: 1
        Handle: 1047 Address: DF:A9:FF:F6:B1:1A (OUI DF-A9-FF)
        Count: 1
< ACL Data TX: Handle 1047 flags 0x00 dlen 21             #194 [hci1] 14.410126
      SMP: Pairing Confirm (0x03) len 16
        Confim value: 887a0ed5090d72ea64f56969ef83fafd
> HCI Event: Number of Completed Packets (0x13) plen 5    #195 [hci1] 14.566722
        Num handles: 1
        Handle: 1047 Address: DF:A9:FF:F6:B1:1A (OUI DF-A9-FF)
        Count: 1
        #194: len 21 (1 Kb/s)
        Latency: 156 msec (68-171 msec ~156 msec)
> ACL Data RX: Handle 1047 flags 0x02 dlen 21             #196 [hci1] 14.567076
      SMP: Pairing Random (0x04) len 16
        Random value: 8242b3544b8927a60000000000000000
< HCI Command: Host Number of Com.. (0x03|0x0035) plen 5  #197 [hci1] 14.569851
        Num handles: 1
        Handle: 1047 Address: DF:A9:FF:F6:B1:1A (OUI DF-A9-FF)
        Count: 1
< ACL Data TX: Handle 1047 flags 0x00 dlen 21             #198 [hci1] 14.569993
      SMP: Pairing Random (0x04) len 16
        Random value: b67e7216d5bf664139eda2b542549666
> HCI Event: Number of Completed Packets (0x13) plen 5    #199 [hci1] 14.741430
        Num handles: 1
        Handle: 1047 Address: DF:A9:FF:F6:B1:1A (OUI DF-A9-FF)
        Count: 1
        #198: len 21 (0 Kb/s)
        Latency: 171 msec (68-171 msec ~163 msec)
> ACL Data RX: Handle 1047 flags 0x02 dlen 21             #200 [hci1] 14.829411
      SMP: Pairing Confirm (0x03) len 16
        Confim value: 0cdb41f8240e477203a6e74aef6309fa
< HCI Command: Host Number of Com.. (0x03|0x0035) plen 5  #201 [hci1] 14.849940
        Num handles: 1
        Handle: 1047 Address: DF:A9:FF:F6:B1:1A (OUI DF-A9-FF)
        Count: 1
< ACL Data TX: Handle 1047 flags 0x00 dlen 21             #202 [hci1] 14.850080
      SMP: Pairing Confirm (0x03) len 16
        Confim value: 165414a87a3cae129a8820aa82d6bd76
> HCI Event: Number of Completed Packets (0x13) plen 5    #203 [hci1] 15.004197
        Num handles: 1
        Handle: 1047 Address: DF:A9:FF:F6:B1:1A (OUI DF-A9-FF)
        Count: 1
        #202: len 21 (1 Kb/s)
        Latency: 154 msec (68-171 msec ~159 msec)
> ACL Data RX: Handle 1047 flags 0x02 dlen 21             #204 [hci1] 15.004570
      SMP: Pairing Random (0x04) len 16
        Random value: 223aee9486498cf90000000000000000
< HCI Command: Host Number of Com.. (0x03|0x0035) plen 5  #205 [hci1] 15.010200
        Num handles: 1
        Handle: 1047 Address: DF:A9:FF:F6:B1:1A (OUI DF-A9-FF)
        Count: 1
< ACL Data TX: Handle 1047 flags 0x00 dlen 21             #206 [hci1] 15.010306
      SMP: Pairing Random (0x04) len 16
        Random value: ed17f76500c95219dd01e09d1e63f87b
> HCI Event: Number of Completed Packets (0x13) plen 5    #207 [hci1] 15.179136
        Num handles: 1
        Handle: 1047 Address: DF:A9:FF:F6:B1:1A (OUI DF-A9-FF)
        Count: 1
        #206: len 21 (1 Kb/s)
        Latency: 168 msec (68-171 msec ~163 msec)
> ACL Data RX: Handle 1047 flags 0x02 dlen 21             #208 [hci1] 15.266834
      SMP: Pairing Confirm (0x03) len 16
        Confim value: b4cedbc21692d2c7439d909d395db89c
< HCI Command: Host Number of Com.. (0x03|0x0035) plen 5  #209 [hci1] 15.270019
        Num handles: 1
        Handle: 1047 Address: DF:A9:FF:F6:B1:1A (OUI DF-A9-FF)
        Count: 1
< ACL Data TX: Handle 1047 flags 0x00 dlen 21             #210 [hci1] 15.270182
      SMP: Pairing Confirm (0x03) len 16
        Confim value: 97067950a319c2532993793295183987
> HCI Event: Number of Completed Packets (0x13) plen 5    #211 [hci1] 15.441713
        Num handles: 1
        Handle: 1047 Address: DF:A9:FF:F6:B1:1A (OUI DF-A9-FF)
        Count: 1
        #210: len 21 (0 Kb/s)
        Latency: 171 msec (68-171 msec ~167 msec)
> ACL Data RX: Handle 1047 flags 0x02 dlen 21             #212 [hci1] 15.442029
      SMP: Pairing Random (0x04) len 16
        Random value: a2517a9f478bae9f0000000000000000
< HCI Command: Host Number of Com.. (0x03|0x0035) plen 5  #213 [hci1] 15.450202
        Num handles: 1
        Handle: 1047 Address: DF:A9:FF:F6:B1:1A (OUI DF-A9-FF)
        Count: 1
< ACL Data TX: Handle 1047 flags 0x00 dlen 21             #214 [hci1] 15.450336
      SMP: Pairing Random (0x04) len 16
        Random value: 81d35d47e1f6006d79c974bd9d9e1ee3
> HCI Event: Number of Completed Packets (0x13) plen 5    #215 [hci1] 15.616523
        Num handles: 1
        Handle: 1047 Address: DF:A9:FF:F6:B1:1A (OUI DF-A9-FF)
        Count: 1
        #214: len 21 (1 Kb/s)
        Latency: 166 msec (68-171 msec ~166 msec)
> ACL Data RX: Handle 1047 flags 0x02 dlen 21             #216 [hci1] 15.704323
      SMP: Pairing Confirm (0x03) len 16
        Confim value: cfae1401091ae0419bc21fd8e6dd8cbb
< HCI Command: Host Number of Com.. (0x03|0x0035) plen 5  #217 [hci1] 15.709731
        Num handles: 1
        Handle: 1047 Address: DF:A9:FF:F6:B1:1A (OUI DF-A9-FF)
        Count: 1
< ACL Data TX: Handle 1047 flags 0x00 dlen 21             #218 [hci1] 15.709787
      SMP: Pairing Confirm (0x03) len 16
        Confim value: ccb9ae13631d2c59b071b1b6abc34fbb
> HCI Event: Number of Completed Packets (0x13) plen 5    #219 [hci1] 15.879110
        Num handles: 1
        Handle: 1047 Address: DF:A9:FF:F6:B1:1A (OUI DF-A9-FF)
        Count: 1
        #218: len 21 (0 Kb/s)
        Latency: 169 msec (68-171 msec ~168 msec)
> ACL Data RX: Handle 1047 flags 0x02 dlen 21             #220 [hci1] 15.879473
      SMP: Pairing Random (0x04) len 16
        Random value: 09238c6c64b89edd0000000000000000
< HCI Command: Host Number of Com.. (0x03|0x0035) plen 5  #221 [hci1] 15.890341
        Num handles: 1
        Handle: 1047 Address: DF:A9:FF:F6:B1:1A (OUI DF-A9-FF)
        Count: 1
< ACL Data TX: Handle 1047 flags 0x00 dlen 21             #222 [hci1] 15.890503
      SMP: Pairing Random (0x04) len 16
        Random value: e7f7e0c2476823e41736a7e381bafb7c
> HCI Event: Number of Completed Packets (0x13) plen 5    #223 [hci1] 16.053970
        Num handles: 1
        Handle: 1047 Address: DF:A9:FF:F6:B1:1A (OUI DF-A9-FF)
        Count: 1
        #222: len 21 (1 Kb/s)
        Latency: 163 msec (68-171 msec ~165 msec)
> ACL Data RX: Handle 1047 flags 0x02 dlen 21             #224 [hci1] 16.141895
      SMP: Pairing Confirm (0x03) len 16
        Confim value: fdfbe41585736b071af30804106ddec7
< HCI Command: Host Number of Com.. (0x03|0x0035) plen 5  #225 [hci1] 16.150058
        Num handles: 1
        Handle: 1047 Address: DF:A9:FF:F6:B1:1A (OUI DF-A9-FF)
        Count: 1
< ACL Data TX: Handle 1047 flags 0x00 dlen 21             #226 [hci1] 16.150147
      SMP: Pairing Confirm (0x03) len 16
        Confim value: 3c06aa40e8a0d4622912fb18ebff3ba4
> HCI Event: Number of Completed Packets (0x13) plen 5    #227 [hci1] 16.316655
        Num handles: 1
        Handle: 1047 Address: DF:A9:FF:F6:B1:1A (OUI DF-A9-FF)
        Count: 1
        #226: len 21 (1 Kb/s)
        Latency: 166 msec (68-171 msec ~166 msec)
> ACL Data RX: Handle 1047 flags 0x02 dlen 21             #228 [hci1] 16.317049
      SMP: Pairing Random (0x04) len 16
        Random value: 8ec1cff2e47fa2dd0000000000000000
