Bluetooth monitor ver 5.84
btmon[688512]: = Note: Linux version 6.8.0-83-generic (x86_64)                                                           0.284126
btmon[688512]: = Note: Bluetooth subsystem version 2.22                                                                  0.284128
= New Index: 00:00:00:00:00:00 (Primary,UART,hci0)                                                                       0.284128
= Open Index: 00:00:00:00:00:00                                                                                          0.791345
= Index Info: 00:00:00:00:00:00 (Nordic Semiconductor ASA)                                                               0.791349
zephyr.exe[688514]: @ USER Open: main (privileged) version 2.22                                                 {0x0001} 0.791351
zephyr.exe[688514]: < HCI Command: Reset (0x03|0x0003) plen 0                                                         #1 0.791615
> HCI Event: Command Complete (0x0e) plen 4                                                                           #2 0.792288
      Reset (0x03|0x0003) ncmd 1
        Status: Success (0x00)
zephyr.exe[688514]: < HCI Command: Read Local Supported Features (0x04|0x0003) plen 0                                 #3 0.811256
> HCI Event: Command Complete (0x0e) plen 12                                                                          #4 0.811734
      Read Local Supported Features (0x04|0x0003) ncmd 1
        Status: Success (0x00)
        Features: 0x00 0x00 0x00 0x00 0x60 0x00 0x00 0x00
          BR/EDR Not Supported
          LE Supported (Controller)
zephyr.exe[688514]: < HCI Command: Read Local Version Information (0x04|0x0001) plen 0                                #5 0.831222
> HCI Event: Command Complete (0x0e) plen 12                                                                          #6 0.832110
      Read Local Version Information (0x04|0x0001) ncmd 1
        Status: Success (0x00)
        HCI version: Reserved (0x0e) - Revision 12520 (0x30e8)
        LMP version: Reserved (0x0e) - Subversion 12520 (0x30e8)
        Manufacturer: Nordic Semiconductor ASA (89)
zephyr.exe[688514]: < HCI Command: Read Local Supported Commands (0x04|0x0002) plen 0                                 #7 0.851263
> HCI Event: Command Complete (0x0e) plen 68                                                                          #8 0.852875
      Read Local Supported Commands (0x04|0x0002) ncmd 1
        Status: Success (0x00)
        Commands: 119 entries
          Disconnect (Octet 0 - Bit 5)
          Read Remote Version Information (Octet 2 - Bit 7)
          Set Event Mask (Octet 5 - Bit 6)
          Reset (Octet 5 - Bit 7)
          Read Connection Accept Timeout (Octet 7 - Bit 2)
          Write Connection Accept Timeout (Octet 7 - Bit 3)
          Read Transmit Power Level (Octet 10 - Bit 2)
          Set Controller To Host Flow Control (Octet 10 - Bit 5)
          Host Buffer Size (Octet 10 - Bit 6)
          Host Number of Completed Packets (Octet 10 - Bit 7)
          Read Local Version Information (Octet 14 - Bit 3)
          Read Local Supported Features (Octet 14 - Bit 5)
          Read BD ADDR (Octet 15 - Bit 1)
          Read RSSI (Octet 15 - Bit 5)
          Set Event Mask Page 2 (Octet 22 - Bit 2)
          LE Set Event Mask (Octet 25 - Bit 0)
          LE Read Buffer Size (Octet 25 - Bit 1)
          LE Read Local Supported Features (Octet 25 - Bit 2)
          LE Set Random Address (Octet 25 - Bit 4)
          LE Set Advertising Parameters (Octet 25 - Bit 5)
          LE Read Advertising Channel TX Power (Octet 25 - Bit 6)
          LE Set Advertising Data (Octet 25 - Bit 7)
          LE Set Scan Response Data (Octet 26 - Bit 0)
          LE Set Advertise Enable (Octet 26 - Bit 1)
          LE Set Scan Parameters (Octet 26 - Bit 2)
          LE Set Scan Enable (Octet 26 - Bit 3)
          LE Create Connection (Octet 26 - Bit 4)
          LE Create Connection Cancel (Octet 26 - Bit 5)
          LE Read Accept List Size (Octet 26 - Bit 6)
          LE Clear Accept List (Octet 26 - Bit 7)
          LE Add Device To Accept List (Octet 27 - Bit 0)
          LE Remove Device From Accept List (Octet 27 - Bit 1)
          LE Connection Update (Octet 27 - Bit 2)
          LE Set Host Channel Classification (Octet 27 - Bit 3)
          LE Read Channel Map (Octet 27 - Bit 4)
          LE Read Remote Used Features (Octet 27 - Bit 5)
          LE Encrypt (Octet 27 - Bit 6)
          LE Rand (Octet 27 - Bit 7)
          LE Start Encryption (Octet 28 - Bit 0)
          LE Long Term Key Request Reply (Octet 28 - Bit 1)
          LE Long Term Key Request Neg Reply (Octet 28 - Bit 2)
          LE Read Supported States (Octet 28 - Bit 3)
          LE Receiver Test (Octet 28 - Bit 4)
          LE Transmitter Test (Octet 28 - Bit 5)
          LE Test End (Octet 28 - Bit 6)
          Read Authenticated Payload Timeout (Octet 32 - Bit 4)
          Write Authenticated Payload Timeout (Octet 32 - Bit 5)
          LE Set Data Length (Octet 33 - Bit 6)
          LE Read Suggested Default Data Length (Octet 33 - Bit 7)
          LE Write Suggested Default Data Length (Octet 34 - Bit 0)
          LE Add Device To Resolving List (Octet 34 - Bit 3)
          LE Remove Device From Resolving List (Octet 34 - Bit 4)
          LE Clear Resolving List (Octet 34 - Bit 5)
          LE Read Resolving List Size (Octet 34 - Bit 6)
          LE Set Address Resolution Enable (Octet 35 - Bit 1)
          LE Set Resolvable Private Address Timeout (Octet 35 - Bit 2)
          LE Read Maximum Data Length (Octet 35 - Bit 3)
          LE Read PHY (Octet 35 - Bit 4)
          LE Set Default PHY (Octet 35 - Bit 5)
          LE Set PHY (Octet 35 - Bit 6)
          LE Enhanced Receiver Test (Octet 35 - Bit 7)
          LE Enhanced Transmitter Test (Octet 36 - Bit 0)
          LE Set Advertising Set Random Address (Octet 36 - Bit 1)
          LE Set Extended Advertising Parameters (Octet 36 - Bit 2)
          LE Set Extended Advertising Data (Octet 36 - Bit 3)
          LE Set Extended Scan Response Data (Octet 36 - Bit 4)
          LE Set Extended Advertising Enable (Octet 36 - Bit 5)
          LE Read Maximum Advertising Data Length (Octet 36 - Bit 6)
          LE Read Number of Supported Advertising Sets (Octet 36 - Bit 7)
          LE Remove Advertising Set (Octet 37 - Bit 0)
          LE Clear Advertising Sets (Octet 37 - Bit 1)
          LE Set Periodic Advertising Parameters (Octet 37 - Bit 2)
          LE Set Periodic Advertising Data (Octet 37 - Bit 3)
          LE Set Periodic Advertising Enable (Octet 37 - Bit 4)
          LE Set Extended Scan Parameters (Octet 37 - Bit 5)
          LE Set Extended Scan Enable (Octet 37 - Bit 6)
          LE Extended Create Connection (Octet 37 - Bit 7)
          LE Periodic Advertising Create Sync (Octet 38 - Bit 0)
          LE Periodic Advertising Create Sync Cancel (Octet 38 - Bit 1)
          LE Periodic Advertising Terminate Sync (Octet 38 - Bit 2)
          LE Add Device To Periodic Advertiser List (Octet 38 - Bit 3)
          LE Remove Device From Periodic Advertiser List (Octet 38 - Bit 4)
          LE Clear Periodic Advertiser List (Octet 38 - Bit 5)
          LE Read Periodic Advertiser List Size (Octet 38 - Bit 6)
          LE Read Transmit Power (Octet 38 - Bit 7)
          LE Read RF Path Compensation (Octet 39 - Bit 0)
          LE Write RF Path Compensation (Octet 39 - Bit 1)
          LE Set Privacy Mode (Octet 39 - Bit 2)
          LE Periodic Advertising Receive Enable (Octet 40 - Bit 5)
          LE Periodic Advertising Sync Transfer (Octet 40 - Bit 6)
          LE Periodic Advertising Set Info Transfer (Octet 40 - Bit 7)
          LE Periodic Advertising Sync Transfer Parameters (Octet 41 - Bit 0)
          LE Set Default Periodic Advertisng Sync Transfer Parameters (Octet 41 - Bit 1)
          LE Read Buffer v2 (Octet 41 - Bit 5)
          LE Read ISO TX Sync (Octet 41 - Bit 6)
          LE Set Connected Isochronous Group Parameters (Octet 41 - Bit 7)
          LE Set Connected Isochronous Group Parameters Test (Octet 42 - Bit 0)
          LE Create Connected Isochronous Stream (Octet 42 - Bit 1)
          LE Remove Connected Isochronous Group (Octet 42 - Bit 2)
          LE Accept Connected Isochronous Stream Request (Octet 42 - Bit 3)
          LE Reject Connected Isochronous Stream Request (Octet 42 - Bit 4)
          LE Create Broadcast Isochronous Group (Octet 42 - Bit 5)
          LE Create Broadcast Isochronous Group Test (Octet 42 - Bit 6)
          LE Terminate Broadcast Isochronous Group (Octet 42 - Bit 7)
          LE Broadcast Isochronous Group Create Sync (Octet 43 - Bit 0)
          LE Broadcast Isochronous Group Terminate Sync (Octet 43 - Bit 1)
          LE Request Peer SCA (Octet 43 - Bit 2)
          LE Setup Isochronous Data Path (Octet 43 - Bit 3)
          LE Remove Isochronous Data Path (Octet 43 - Bit 4)
          LE Isochronous Transmit Test (Octet 43 - Bit 5)
          LE Isochronous Receive Test (Octet 43 - Bit 6)
          LE Isochronous Read Test Counters (Octet 43 - Bit 7)
          LE Isochronous Read Test Counters (Octet 44 - Bit 0)
          LE Set Host Feature (Octet 44 - Bit 1)
          LE Read ISO link quality (Octet 44 - Bit 2)
          Octet 45 - Bit 6 
          Octet 46 - Bit 0 
          Octet 46 - Bit 1 
          Octet 46 - Bit 2 
zephyr.exe[688514]: < HCI Command: Host Buffer Size (0x03|0x0033) plen 7                                              #9 0.871258
        ACL MTU: 255  ACL max packet: 16
        SCO MTU: 0    SCO max packet: 0
> HCI Event: Command Complete (0x0e) plen 4                                                                          #10 0.871997
      Host Buffer Size (0x03|0x0033) ncmd 1
        Status: Success (0x00)
zephyr.exe[688514]: < HCI Command: Set Controller To Host Flow Control (0x03|0x0031) plen 1                          #11 0.891255
        Flow control: ACL Data Packets (0x01)
> HCI Event: Command Complete (0x0e) plen 4                                                                          #12 0.891836
      Set Controller To Host Flow Control (0x03|0x0031) ncmd 1
        Status: Success (0x00)
zephyr.exe[688514]: < HCI Command: LE Read Local Supported Features (0x08|0x0003) plen 0                             #13 0.911237
> HCI Event: Command Complete (0x0e) plen 12                                                                         #14 0.912387
      LE Read Local Supported Features (0x08|0x0003) ncmd 1
        Status: Success (0x00)
        Features: 0xfd 0x79 0x00 0xf7 0x30 0x01 0x00 0x00
          LE Encryption
          Extended Reject Indication
          Peripheral-initiated Features Exchange
          LE Ping
          LE Data Packet Length Extension
          LL Privacy
          Extended Scanner Filter Policies
          LE 2M PHY
          LE Coded PHY
          LE Extended Advertising
          LE Periodic Advertising
          Channel Selection Algorithm #2
          Periodic Advertising Sync Transfer - Sender
          Periodic Advertising Sync Transfer - Recipient
          Sleep Clock Accuracy Updates
          Connected Isochronous Stream - Central
          Connected Isochronous Stream - Peripheral
          Isochronous Broadcaster
          Synchronized Receiver
          Periodic Advertising ADI support
          Connection Subrating
          Unknown features (0x0000010000000000)
zephyr.exe[688514]: < HCI Command: LE Set Host Feature (0x08|0x0074) plen 2                                          #15 0.931278
        Bit Number: 32
          Connected Isochronous Stream (Host Support)
        Bit Value: 1
> HCI Event: Command Complete (0x0e) plen 4                                                                          #16 0.932314
      LE Set Host Feature (0x08|0x0074) ncmd 1
        Status: Success (0x00)
zephyr.exe[688514]: < HCI Command: LE Read Buffer v2 (0x08|0x0060) plen 0                                            #17 0.951242
> HCI Event: Command Complete (0x0e) plen 10                                                                         #18 0.952034
      LE Read Buffer v2 (0x08|0x0060) ncmd 1
        Status: Success (0x00)
        ACL MTU: 27
        ACL max packet: 3
        ISO MTU: 318
        ISO max packet: 3
zephyr.exe[688514]: < HCI Command: LE Read Maximum Advertising Data Length (0x08|0x003a) plen 0                      #19 0.971307
> HCI Event: Command Complete (0x0e) plen 6                                                                          #20 0.971843
      LE Read Maximum Advertising Data Length (0x08|0x003a) ncmd 1
        Status: Success (0x00)
        Max length: 1650
zephyr.exe[688514]: < HCI Command: LE Read Supported States (0x08|0x001c) plen 0                                     #21 0.991198
> HCI Event: Command Complete (0x0e) plen 12                                                                         #22 0.991998
      LE Read Supported States (0x08|0x001c) ncmd 1
        Status: Success (0x00)
        States: 0x000003ff3e0306ff
          Non-connectable Advertising State
          Scannable Advertising State
          Connectable Advertising State
          High Duty Cycle Directed Advertising State
          Passive Scanning State
          Active Scanning State
          Initiating State
            and Connection State (Central Role)
          Connection State (Peripheral Role)
          Scannable Advertising State
            and Passive Scanning State
          Connectable Advertising State
            and Passive Scanning State
          Non-connectable Advertising State
            and Initiating State
          Scannable Advertising State
            and Initiating State
          Active Scanning State
            and Connection State (Central Role)
          Passive Scanning State
            and Connection State (Peripheral Role)
          Active Scanning State
            and Connection State (Peripheral Role)
          Initiating State
            and Connection State (Central Role)
            and Central Role & Central Role
          Low Duty Cycle Directed Advertising State
          Connectable Advertising State
            and Initiating State
            and Central Role & Peripheral Role
          High Duty Cycle Directed Advertising State
            and Initiating State
            and Central Role & Peripheral Role
          Low Duty Cycle Directed Advertising State
            and Initiating State
            and Central Role & Peripheral Role
          Connectable Advertising State
            and Connection State (Central Role)
            and Central Role & Peripheral Role
          High Duty Cycle Directed Advertising State
            and Connection State (Central Role)
            and Central Role & Peripheral Role
          Low Duty Cycle Directed Advertising State
            and Connection State (Central Role)
            and Central Role & Peripheral Role
          Connectable Advertising State
            and Connection State (Peripheral Role)
            and Central Role & Peripheral Role
          High Duty Cycle Directed Advertising State
            and Connection State (Peripheral Role)
            and Peripheral Role & Peripheral Role
          Low Duty Cycle Directed Advertising State
            and Connection State (Peripheral Role)
            and Peripheral Role & Peripheral Role
          Initiating State
            and Connection State (Peripheral Role)
            and Central Role & Peripheral Role
zephyr.exe[688514]: < HCI Command: LE Read Maximum Data Length (0x08|0x002f) plen 0                                  #23 1.011259
> HCI Event: Command Complete (0x0e) plen 12                                                                         #24 1.012410
      LE Read Maximum Data Length (0x08|0x002f) ncmd 1
        Status: Success (0x00)
        Max TX octets: 251
        Max TX time: 2704
        Max RX octets: 251
        Max RX time: 2704
zephyr.exe[688514]: < HCI Command: LE Write Suggested Default Data Length (0x08|0x0024) plen 4                       #25 1.031256
        TX octets: 251
        TX time: 2704
> HCI Event: Command Complete (0x0e) plen 4                                                                          #26 1.032192
      LE Write Suggested Default Data Length (0x08|0x0024) ncmd 1
        Status: Success (0x00)
zephyr.exe[688514]: < HCI Command: LE Read Resolving List Size (0x08|0x002a) plen 0                                  #27 1.051249
> HCI Event: Command Complete (0x0e) plen 5                                                                          #28 1.052003
      LE Read Resolving List Size (0x08|0x002a) ncmd 1
        Status: Success (0x00)
        Size: 8
zephyr.exe[688514]: < HCI Command: LE Set Event Mask (0x08|0x0001) plen 8                                            #29 1.071254
        Mask: 0x000002023f87fa5e
          LE Advertising Report
          LE Connection Update Complete
          LE Read Remote Used Features Complete
          LE Long Term Key Request
          LE Data Length Change
          LE Enhanced Connection Complete
          LE PHY Update Complete
          LE Extended Advertising Report
          LE Periodic Advertising Sync Established
          LE Periodic Advertising Report
          LE Periodic Advertising Sync Lost
          LE Extended Scan Timeout
          LE Extended Advertising Set Terminated
          LE Scan Request Received
          LE Periodic Advertising Sync Transfer Rvc
          LE CIS Established
          LE CIS Request
          LE Create BIG Complete
          LE Terminate BIG Complete
          LE BIG Sync Established Complete
          LE BIG Sync Lost
          LE BIG Info Advertising Report
          Unknown mask (0x0000020000000000)
> HCI Event: Command Complete (0x0e) plen 4                                                                          #30 1.072122
      LE Set Event Mask (0x08|0x0001) ncmd 1
        Status: Success (0x00)
zephyr.exe[688514]: < HCI Command: Set Event Mask (0x03|0x0001) plen 8                                               #31 1.091257
        Mask: 0x2000800002008890
          Disconnection Complete
          Encryption Change
          Read Remote Version Information Complete
          Hardware Error
          Data Buffer Overflow
          Encryption Key Refresh Complete
          LE Meta
> HCI Event: Command Complete (0x0e) plen 4                                                                          #32 1.091950
      Set Event Mask (0x03|0x0001) ncmd 1
        Status: Success (0x00)
zephyr.exe[688514]: < HCI Command: Read BD ADDR (0x04|0x0009) plen 0                                                 #33 1.111250
> HCI Event: Command Complete (0x0e) plen 10                                                                         #34 1.111914
      Read BD ADDR (0x04|0x0009) ncmd 1
        Status: Success (0x00)
        Address: 00:00:00:00:00:00 (OUI 00-00-00)
zephyr.exe[688514]: < HCI Command: LE Set Random Address (0x08|0x0005) plen 6                                        #35 1.131257
        Address: D5:B6:CC:31:DB:3B (Static)
> HCI Event: Command Complete (0x0e) plen 4                                                                          #36 1.132136
      LE Set Random Address (0x08|0x0005) ncmd 1
        Status: Success (0x00)
zephyr.exe[688514]: < HCI Command: LE Set Extended Advertising Parameters (0x08|0x0036) plen 25                      #37 5.901316
        Handle: 0x00
        Properties: 0x0013
          Connectable
          Scannable
          Use legacy advertising PDUs: ADV_IND
        Min advertising interval: 100.000 msec (0x00a0)
        Max advertising interval: 150.000 msec (0x00f0)
        Channel map: 37, 38, 39 (0x07)
        Own address type: Random (0x01)
        Peer address type: Public (0x00)
        Peer address: 00:00:00:00:00:00 (OUI 00-00-00)
        Filter policy: Allow Scan Request from Any, Allow Connect Request from Any (0x00)
        TX power: Host has no preference (0x7f)
        Primary PHY: LE 1M (0x01)
        Secondary max skip: 0x00
        Secondary PHY: LE 1M (0x01)
        SID: 0x00
        Scan request notifications: Disabled (0x00)
> HCI Event: Command Complete (0x0e) plen 5                                                                          #38 5.902423
      LE Set Extended Advertising Parameters (0x08|0x0036) ncmd 1
        Status: Success (0x00)
        TX power (selected): 0 dbm (0x00)
zephyr.exe[688514]: < HCI Command: LE Set Advertising Set Random Address (0x08|0x0035) plen 7                        #39 5.911341
        Advertising handle: 0x00
        Advertising random address: D5:B6:CC:31:DB:3B (Static)
> HCI Event: Command Complete (0x0e) plen 4                                                                          #40 5.911946
      LE Set Advertising Set Random Address (0x08|0x0035) ncmd 1
        Status: Success (0x00)
zephyr.exe[688514]: < HCI Command: LE Set Extended Advertising Data (0x08|0x0037) plen 22                            #41 5.931275
        Handle: 0x00
        Operation: Complete extended advertising data (0x03)
        Fragment preference: Minimize fragmentation (0x01)
        Data length: 0x12
        Flags: 0x06
          LE General Discoverable Mode
          BR/EDR Not Supported
        Name (complete): Tester_F6B11A
> HCI Event: Command Complete (0x0e) plen 4                                                                          #42 5.932371
      LE Set Extended Advertising Data (0x08|0x0037) ncmd 1
        Status: Success (0x00)
zephyr.exe[688514]: < HCI Command: LE Set Extended Scan Response Data (0x08|0x0038) plen 4                           #43 5.951344
        Handle: 0x00
        Operation: Complete scan response data (0x03)
        Fragment preference: Minimize fragmentation (0x01)
        Data length: 0x00
> HCI Event: Command Complete (0x0e) plen 4                                                                          #44 5.951939
      LE Set Extended Scan Response Data (0x08|0x0038) ncmd 1
        Status: Success (0x00)
zephyr.exe[688514]: < HCI Command: LE Set Extended Advertising Enable (0x08|0x0039) plen 6                           #45 5.971351
        Extended advertising: Enabled (0x01)
        Number of sets: 1 (0x01)
        Entry 0
          Handle: 0x00
          Duration: 0 ms (0x00)
          Max ext adv events: 0
> HCI Event: Command Complete (0x0e) plen 4                                                                          #46 5.972201
      LE Set Extended Advertising Enable (0x08|0x0039) ncmd 1
        Status: Success (0x00)
> HCI Event: LE Meta Event (0x3e) plen 31                                                                            #47 6.294465
      LE Enhanced Connection Complete (0x0a)
        Status: Success (0x00)
        Handle: 615
        Role: Peripheral (0x01)
        Peer address type: Public (0x00)
        Peer address: DF:A9:FF:F6:B1:1A (OUI DF-A9-FF)
        Local resolvable private address: 00:00:00:00:00:00 (Non-Resolvable)
        Peer resolvable private address: 00:00:00:00:00:00 (Non-Resolvable)
        Connection interval: 87.50 msec (0x0046)
        Connection latency: 0 (0x0000)
        Supervision timeout: 20000 msec (0x07d0)
        Central clock accuracy: 0x01
> HCI Event: LE Meta Event (0x3e) plen 6                                                                             #48 6.294467
      LE Advertising Set Terminated (0x12)
        Status: Success (0x00)
        Handle: 0
        Connection handle: 615
        Number of completed extended advertising events: 0
zephyr.exe[688514]: < HCI Command: LE Read Remote Used Features (0x08|0x0016) plen 2                                 #49 6.311472
        Handle: 615 Address: DF:A9:FF:F6:B1:1A (OUI DF-A9-FF)
> HCI Event: Command Status (0x0f) plen 4                                                                            #50 6.312038
      LE Read Remote Used Features (0x08|0x0016) ncmd 1
        Status: Success (0x00)
> HCI Event: LE Meta Event (0x3e) plen 12                                                                            #51 6.558338
      LE Read Remote Used Features (0x04)
        Status: Success (0x00)
        Handle: 615 Address: DF:A9:FF:F6:B1:1A (OUI DF-A9-FF)
        Features: 0x2d 0x49 0x00 0xf7 0x67 0xd8 0x00 0x00
          LE Encryption
          Extended Reject Indication
          Peripheral-initiated Features Exchange
          LE Data Packet Length Extension
          LE 2M PHY
          LE Coded PHY
          Channel Selection Algorithm #2
          Periodic Advertising Sync Transfer - Sender
          Periodic Advertising Sync Transfer - Recipient
          Sleep Clock Accuracy Updates
          Connected Isochronous Stream - Central
          Connected Isochronous Stream - Peripheral
          Isochronous Broadcaster
          Synchronized Receiver
          Connected Isochronous Stream (Host Support)
          LE Power Control Request
          LE Power Control Request
          Connection Subrating
          Connection Subrating (Host Support)
          Unknown features (0x0000d80000000000)
> ACL Data RX: Handle 615 flags 0x02 dlen 11                                                                         #52 9.007865
      SMP: Pairing Request (0x01) len 6
        IO capability: KeyboardDisplay (0x04)
        OOB data: Authentication data not present (0x00)
        Authentication requirement: Bonding, No MITM, Legacy, No Keypresses (0x01)
        Max encryption key size: 7
        Initiator key distribution: EncKey IdKey Sign (0x07)
        Responder key distribution: EncKey IdKey Sign (0x07)
zephyr.exe[688514]: < HCI Command: Host Number of Completed Packets (0x03|0x0035) plen 5                             #53 9.011374
        Num handles: 1
        Handle: 615 Address: DF:A9:FF:F6:B1:1A (OUI DF-A9-FF)
        Count: 1
zephyr.exe[688514]: < ACL Data TX: Handle 615 [1/3] flags 0x00 dlen 11                                               #54 9.011421
      SMP: Pairing Response (0x02) len 6
        IO capability: DisplayOnly (0x00)
        OOB data: Authentication data not present (0x00)
        Authentication requirement: Bonding, No MITM, Legacy, No Keypresses (0x01)
        Max encryption key size: 16
        Initiator key distribution: EncKey IdKey Sign (0x07)
        Responder key distribution: EncKey Sign (0x05)
> HCI Event: Number of Completed Packets (0x13) plen 5                                                               #55 9.183059
        Num handles: 1
        Handle: 615 Address: DF:A9:FF:F6:B1:1A (OUI DF-A9-FF)
        Count: 1
        Buffers: 0/3
        #54: len 11 (0 Kb/s)
        Latency: 171 msec (171-171 msec ~171 msec)
> ACL Data RX: Handle 615 flags 0x02 dlen 21                                                                         #56 9.183159
      SMP: Pairing Confirm (0x03) len 16
        Confirm value[16]: ea5673a2d3e18249527597e01470b6f8
zephyr.exe[688514]: < HCI Command: Host Number of Completed Packets (0x03|0x0035) plen 5                             #57 9.191505
        Num handles: 1
        Handle: 615 Address: DF:A9:FF:F6:B1:1A (OUI DF-A9-FF)
        Count: 1
zephyr.exe[688514]: < ACL Data TX: Handle 615 [1/3] flags 0x00 dlen 21                                               #58 9.191571
      SMP: Pairing Confirm (0x03) len 16
        Confirm value[16]: 67d3da447fac7762480951c14f4adaec
> HCI Event: Number of Completed Packets (0x13) plen 5                                                               #59 9.358032
        Num handles: 1
        Handle: 615 Address: DF:A9:FF:F6:B1:1A (OUI DF-A9-FF)
        Count: 1
        Buffers: 0/3
        #58: len 21 (1 Kb/s)
        Latency: 166 msec (166-171 msec ~169 msec)
> ACL Data RX: Handle 615 flags 0x02 dlen 21                                                                         #60 9.358399
      SMP: Pairing Random (0x04) len 16
        Random value[16]: 51b392e418772e1d0000000000000000
zephyr.exe[688514]: < HCI Command: Host Number of Completed Packets (0x03|0x0035) plen 5                             #61 9.371467
        Num handles: 1
        Handle: 615 Address: DF:A9:FF:F6:B1:1A (OUI DF-A9-FF)
        Count: 1
zephyr.exe[688514]: < ACL Data TX: Handle 615 [1/3] flags 0x00 dlen 21                                               #62 9.371513
      SMP: Pairing Random (0x04) len 16
        Random value[16]: 8e6108f966a694cbe26df70bb96773e6
> HCI Event: Number of Completed Packets (0x13) plen 5                                                               #63 9.532835
        Num handles: 1
        Handle: 615 Address: DF:A9:FF:F6:B1:1A (OUI DF-A9-FF)
        Count: 1
        Buffers: 0/3
        #62: len 21 (1 Kb/s)
        Latency: 161 msec (161-171 msec ~165 msec)
> HCI Event: LE Meta Event (0x3e) plen 13                                                                            #64 9.621156
      LE Long Term Key Request (0x05)
        Handle: 615 Address: DF:A9:FF:F6:B1:1A (OUI DF-A9-FF)
        Random number: 0x0000000000000000
        Encrypted diversifier: 0x0000
zephyr.exe[688514]: < HCI Command: LE Long Term Key Request Reply (0x08|0x001a) plen 18                              #65 9.631354
        Handle: 615 Address: DF:A9:FF:F6:B1:1A (OUI DF-A9-FF)
        Long term key[16]: 527cddf1c5205b000000000000000000
> HCI Event: Command Complete (0x0e) plen 6                                                                          #66 9.632410
      LE Long Term Key Request Reply (0x08|0x001a) ncmd 1
        Status: Success (0x00)
        Handle: 615 Address: DF:A9:FF:F6:B1:1A (OUI DF-A9-FF)
> HCI Event: Encryption Change (0x08) plen 4                                                                        #67 10.057895
        Status: Success (0x00)
        Handle: 615 Address: DF:A9:FF:F6:B1:1A (OUI DF-A9-FF)
        Encryption: Enabled with AES-CCM (0x01)
zephyr.exe[688514]: < ACL Data TX: Handle 615 [1/3] flags 0x00 dlen 21                                              #68 10.181412
      SMP: Encryption Information (0x06) len 16
        Long term key[16]: 5da095555cc64d000000000000000000
zephyr.exe[688514]: < ACL Data TX: Handle 615 [2/3] flags 0x00 dlen 15                                              #69 10.181422
      SMP: Central Identification (0x07) len 10
        EDIV: 0x825e
        Rand: 0x84c81ed264dab3d8
zephyr.exe[688514]: < ACL Data TX: Handle 615 [3/3] flags 0x00 dlen 21                                              #70 10.181422
      SMP: Signing Information (0x0a) len 16
        Signature key[16]: bc235a02440d0c3424a2acf8fd71a45c
> HCI Event: Number of Completed Packets (0x13) plen 5                                                              #71 10.233496
        Num handles: 1
        Handle: 615 Address: DF:A9:FF:F6:B1:1A (OUI DF-A9-FF)
        Count: 1
        Buffers: 2/3
        #68: len 21 (3 Kb/s)
        Latency: 52 msec (52-171 msec ~108 msec)
> HCI Event: Number of Completed Packets (0x13) plen 5                                                              #72 10.234050
        Num handles: 1
        Handle: 615 Address: DF:A9:FF:F6:B1:1A (OUI DF-A9-FF)
        Count: 1
        Buffers: 1/3
        #69: len 15 (2 Kb/s)
        Latency: 52 msec (52-171 msec ~80 msec)
> HCI Event: Number of Completed Packets (0x13) plen 5                                                              #73 10.320486
        Num handles: 1
        Handle: 615 Address: DF:A9:FF:F6:B1:1A (OUI DF-A9-FF)
        Count: 1
        Buffers: 0/3
        #70: len 21 (1 Kb/s)
        Latency: 139 msec (52-171 msec ~109 msec)
> ACL Data RX: Handle 615 flags 0x02 dlen 21                                                                        #74 10.320610
      SMP: Encryption Information (0x06) len 16
        Long term key[16]: d8ad062345a2b2000000000000000000
> ACL Data RX: Handle 615 flags 0x02 dlen 15                                                                        #75 10.321010
      SMP: Central Identification (0x07) len 10
        EDIV: 0x17a8
        Rand: 0x006e390421f2f356
> ACL Data RX: Handle 615 flags 0x02 dlen 21                                                                        #76 10.321799
      SMP: Identity Information (0x08) len 16
        Identity resolving key[16]: cb80b50a60d1d2c7308b68f6061ac30c
zephyr.exe[688514]: < HCI Command: Host Number of Completed Packets (0x03|0x0035) plen 5                            #77 10.331428
        Num handles: 1
        Handle: 615 Address: DF:A9:FF:F6:B1:1A (OUI DF-A9-FF)
        Count: 1
zephyr.exe[688514]: < HCI Command: Host Number of Completed Packets (0x03|0x0035) plen 5                            #78 10.331532
        Num handles: 1
        Handle: 615 Address: DF:A9:FF:F6:B1:1A (OUI DF-A9-FF)
        Count: 1
zephyr.exe[688514]: < HCI Command: Host Number of Completed Packets (0x03|0x0035) plen 5                            #79 10.331622
        Num handles: 1
        Handle: 615 Address: DF:A9:FF:F6:B1:1A (OUI DF-A9-FF)
        Count: 1
> ACL Data RX: Handle 615 flags 0x02 dlen 12                                                                        #80 10.407871
      SMP: Identity Address Information (0x09) len 7
        Address: DF:A9:FF:F6:B1:1A (OUI DF-A9-FF)
> ACL Data RX: Handle 615 flags 0x02 dlen 21                                                                        #81 10.408838
      SMP: Signing Information (0x0a) len 16
        Signature key[16]: 973454fd1216efa4f81137652e465611
> ACL Data RX: Handle 615 flags 0x02 dlen 11                                                                        #82 10.409013
      ATT: Read By Type Request (0x08) len 6
        Handle range: 0x0001-0xffff
        Attribute type: Characteristic (0x2803)
zephyr.exe[688514]: < HCI Command: LE Add Device To Resolving List (0x08|0x0027) plen 39                            #83 10.411424
        Address type: Public (0x00)
        Address: DF:A9:FF:F6:B1:1A (OUI DF-A9-FF)
        Peer identity resolving key[16]: cb80b50a60d1d2c7308b68f6061ac30c
        Local identity resolving key[16]: 00000000000000000000000000000000
> HCI Event: Command Complete (0x0e) plen 4                                                                         #84 10.412365
      LE Add Device To Resolving List (0x08|0x0027) ncmd 1
        Status: Success (0x00)
zephyr.exe[688514]: < HCI Command: LE Set Privacy Mode (0x08|0x004e) plen 8                                         #85 10.431351
        Peer Identity address type: Public (0x00)
        Peer Identity address: DF:A9:FF:F6:B1:1A (OUI DF-A9-FF)
        Privacy Mode: Use Device Privacy (0x01)
> HCI Event: Command Complete (0x0e) plen 4                                                                         #86 10.432492
      LE Set Privacy Mode (0x08|0x004e) ncmd 1
        Status: Success (0x00)
zephyr.exe[688514]: < HCI Command: LE Set Address Resolution Enable (0x08|0x002d) plen 1                            #87 10.451379
        Address resolution: Enabled (0x01)
> HCI Event: Command Complete (0x0e) plen 4                                                                         #88 10.452531
      LE Set Address Resolution Enable (0x08|0x002d) ncmd 1
        Status: Success (0x00)
zephyr.exe[688514]: < HCI Command: Host Number of Completed Packets (0x03|0x0035) plen 5                            #89 10.471333
        Num handles: 1
        Handle: 615 Address: DF:A9:FF:F6:B1:1A (OUI DF-A9-FF)
        Count: 1
zephyr.exe[688514]: < HCI Command: Host Number of Completed Packets (0x03|0x0035) plen 5                            #90 10.471429
        Num handles: 1
        Handle: 615 Address: DF:A9:FF:F6:B1:1A (OUI DF-A9-FF)
        Count: 1
zephyr.exe[688514]: < HCI Command: Host Number of Completed Packets (0x03|0x0035) plen 5                            #91 10.471528
        Num handles: 1
        Handle: 615 Address: DF:A9:FF:F6:B1:1A (OUI DF-A9-FF)
        Count: 1
zephyr.exe[688514]: < ACL Data TX: Handle 615 [1/3] flags 0x00 dlen 20                                              #92 10.471588
      ATT: Read By Type Response (0x09) len 15
        Attribute data length: 7
        Attribute data list: 2 entries
        Handle: 0x0002
        Value[5]: 200300052a
            Properties: 0x20
              Indicate (0x20)
            Value Handle: 0x0003
            Value UUID: Service Changed (0x2a05)
        Handle: 0x0005
        Value[5]: 0a0600292b
            Properties: 0x0a
              Read (0x02)
              Write (0x08)
            Value Handle: 0x0006
            Value UUID: Client Supported Features (0x2b29)
> HCI Event: Number of Completed Packets (0x13) plen 5                                                              #93 10.582869
        Num handles: 1
        Handle: 615 Address: DF:A9:FF:F6:B1:1A (OUI DF-A9-FF)
        Count: 1
        Buffers: 0/3
        #92: len 20 (1 Kb/s)
        Latency: 111 msec (52-171 msec ~110 msec)
> ACL Data RX: Handle 615 flags 0x02 dlen 11                                                                        #94 10.582962
      ATT: Read By Type Request (0x08) len 6
        Handle range: 0x0006-0xffff
        Attribute type: Characteristic (0x2803)
zephyr.exe[688514]: < HCI Command: Host Number of Completed Packets (0x03|0x0035) plen 5                            #95 10.591409
        Num handles: 1
        Handle: 615 Address: DF:A9:FF:F6:B1:1A (OUI DF-A9-FF)
        Count: 1
zephyr.exe[688514]: < ACL Data TX: Handle 615 [1/3] flags 0x00 dlen 20                                              #96 10.591477
      ATT: Read By Type Response (0x09) len 15
        Attribute data length: 7
        Attribute data list: 2 entries
        Handle: 0x0007
        Value[5]: 0208002a2b
            Properties: 0x02
              Read (0x02)
            Value Handle: 0x0008
            Value UUID: Database Hash (0x2b2a)
        Handle: 0x0009
        Value[5]: 020a003a2b
            Properties: 0x02
              Read (0x02)
            Value Handle: 0x000a
            Value UUID: Server Supported Features (0x2b3a)
> HCI Event: Number of Completed Packets (0x13) plen 5                                                              #97 10.757826
        Num handles: 1
        Handle: 615 Address: DF:A9:FF:F6:B1:1A (OUI DF-A9-FF)
        Count: 1
        Buffers: 0/3
        #96: len 20 (0 Kb/s)
        Latency: 166 msec (52-171 msec ~138 msec)
> ACL Data RX: Handle 615 flags 0x02 dlen 11                                                                        #98 10.758049
      ATT: Read By Type Request (0x08) len 6
        Handle range: 0x000a-0xffff
        Attribute type: Characteristic (0x2803)
zephyr.exe[688514]: < HCI Command: Host Number of Completed Packets (0x03|0x0035) plen 5                            #99 10.771312
        Num handles: 1
        Handle: 615 Address: DF:A9:FF:F6:B1:1A (OUI DF-A9-FF)
        Count: 1
zephyr.exe[688514]: < ACL Data TX: Handle 615 [1/3] flags 0x00 dlen 20                                             #100 10.771318
      ATT: Read By Type Response (0x09) len 15
        Attribute data length: 7
        Attribute data list: 2 entries
        Handle: 0x000c
        Value[5]: 0a0d00002a
            Properties: 0x0a
              Read (0x02)
              Write (0x08)
            Value Handle: 0x000d
            Value UUID: Device Name (0x2a00)
        Handle: 0x000e
        Value[5]: 0a0f00012a
            Properties: 0x0a
              Read (0x02)
              Write (0x08)
            Value Handle: 0x000f
            Value UUID: Appearance (0x2a01)
> HCI Event: Number of Completed Packets (0x13) plen 5                                                             #101 10.932881
        Num handles: 1
        Handle: 615 Address: DF:A9:FF:F6:B1:1A (OUI DF-A9-FF)
        Count: 1
        Buffers: 0/3
        #100: len 20 (0 Kb/s)
        Latency: 161 msec (52-171 msec ~150 msec)
> ACL Data RX: Handle 615 flags 0x02 dlen 11                                                                       #102 10.933304
      ATT: Read By Type Request (0x08) len 6
        Handle range: 0x000f-0xffff
        Attribute type: Characteristic (0x2803)
zephyr.exe[688514]: < HCI Command: Host Number of Completed Packets (0x03|0x0035) plen 5                           #103 10.951365
        Num handles: 1
        Handle: 615 Address: DF:A9:FF:F6:B1:1A (OUI DF-A9-FF)
        Count: 1
zephyr.exe[688514]: < ACL Data TX: Handle 615 [1/3] flags 0x00 dlen 20                                             #104 10.951389
      ATT: Read By Type Response (0x09) len 15
        Attribute data length: 7
        Attribute data list: 2 entries
        Handle: 0x0010
        Value[5]: 021100042a
            Properties: 0x02
              Read (0x02)
            Value Handle: 0x0011
            Value UUID: Peripheral Preferred Connection Parameters (0x2a04)
        Handle: 0x0013
        Value[5]: 021400242a
            Properties: 0x02
              Read (0x02)
            Value Handle: 0x0014
            Value UUID: Model Number String (0x2a24)
> HCI Event: Number of Completed Packets (0x13) plen 5                                                             #105 11.107759
        Num handles: 1
        Handle: 615 Address: DF:A9:FF:F6:B1:1A (OUI DF-A9-FF)
        Count: 1
        Buffers: 0/3
        #104: len 20 (1 Kb/s)
        Latency: 156 msec (52-171 msec ~153 msec)
> ACL Data RX: Handle 615 flags 0x02 dlen 11                                                                       #106 11.108290
      ATT: Read By Type Request (0x08) len 6
        Handle range: 0x0014-0xffff
        Attribute type: Characteristic (0x2803)
zephyr.exe[688514]: < HCI Command: Host Number of Completed Packets (0x03|0x0035) plen 5                           #107 11.111420
        Num handles: 1
        Handle: 615 Address: DF:A9:FF:F6:B1:1A (OUI DF-A9-FF)
        Count: 1
zephyr.exe[688514]: < ACL Data TX: Handle 615 [1/3] flags 0x00 dlen 20                                             #108 11.111448
      ATT: Read By Type Response (0x09) len 15
        Attribute data length: 7
        Attribute data list: 2 entries
        Handle: 0x0015
        Value[5]: 021600292a
            Properties: 0x02
              Read (0x02)
            Value Handle: 0x0016
            Value UUID: Manufacturer Name String (0x2a29)
        Handle: 0x0017
        Value[5]: 021800502a
            Properties: 0x02
              Read (0x02)
            Value Handle: 0x0018
            Value UUID: PnP ID (0x2a50)
> HCI Event: Number of Completed Packets (0x13) plen 5                                                             #109 11.282859
        Num handles: 1
        Handle: 615 Address: DF:A9:FF:F6:B1:1A (OUI DF-A9-FF)
        Count: 1
        Buffers: 0/3
        #108: len 20 (0 Kb/s)
        Latency: 171 msec (52-171 msec ~162 msec)
> ACL Data RX: Handle 615 flags 0x02 dlen 11                                                                       #110 11.283042
      ATT: Read By Type Request (0x08) len 6
        Handle range: 0x0018-0xffff
        Attribute type: Characteristic (0x2803)
zephyr.exe[688514]: < HCI Command: Host Number of Completed Packets (0x03|0x0035) plen 5                           #111 11.291398
        Num handles: 1
        Handle: 615 Address: DF:A9:FF:F6:B1:1A (OUI DF-A9-FF)
        Count: 1
zephyr.exe[688514]: < ACL Data TX: Handle 615 [1/3] flags 0x00 dlen 20                                             #112 11.291422
      ATT: Read By Type Response (0x09) len 15
        Attribute data length: 7
        Attribute data list: 2 entries
        Handle: 0x0019
        Value[5]: 021a00252a
            Properties: 0x02
              Read (0x02)
            Value Handle: 0x001a
            Value UUID: Serial Number String (0x2a25)
        Handle: 0x001b
        Value[5]: 021c00262a
            Properties: 0x02
              Read (0x02)
            Value Handle: 0x001c
            Value UUID: Firmware Revision String (0x2a26)
zephyr.exe[688514]: < ACL Data TX: Handle 615 [2/3] flags 0x00 dlen 16                                             #113 11.321324
      LE L2CAP: Connection Parameter Update Request (0x12) ident 1 len 8
        Min interval: 24
        Max interval: 40
        Peripheral latency: 0
        Timeout multiplier: 42
> HCI Event: Number of Completed Packets (0x13) plen 5                                                             #114 11.370711
        Num handles: 1
        Handle: 615 Address: DF:A9:FF:F6:B1:1A (OUI DF-A9-FF)
        Count: 1
        Buffers: 1/3
        #112: len 20 (2 Kb/s)
        Latency: 79 msec (52-171 msec ~120 msec)
> HCI Event: Number of Completed Packets (0x13) plen 5                                                             #115 11.457774
        Num handles: 1
        Handle: 615 Address: DF:A9:FF:F6:B1:1A (OUI DF-A9-FF)
        Count: 1
        Buffers: 0/3
        #113: len 16 (0 Kb/s)
        Latency: 136 msec (52-171 msec ~128 msec)
> ACL Data RX: Handle 615 flags 0x02 dlen 11                                                                       #116 11.458062
      ATT: Read By Type Request (0x08) len 6
        Handle range: 0x001c-0xffff
        Attribute type: Characteristic (0x2803)
> ACL Data RX: Handle 615 flags 0x02 dlen 10                                                                       #117 11.458336
      LE L2CAP: Connection Parameter Update Response (0x13) ident 1 len 2
        Result: Connection Parameters accepted (0x0000)
zephyr.exe[688514]: < HCI Command: Host Number of Completed Packets (0x03|0x0035) plen 5                           #118 11.471493
        Num handles: 1
        Handle: 615 Address: DF:A9:FF:F6:B1:1A (OUI DF-A9-FF)
        Count: 1
zephyr.exe[688514]: < ACL Data TX: Handle 615 [1/3] flags 0x00 dlen 20                                             #119 11.471520
      ATT: Read By Type Response (0x09) len 15
        Attribute data length: 7
        Attribute data list: 2 entries
        Handle: 0x001d
        Value[5]: 021e00272a
            Properties: 0x02
              Read (0x02)
            Value Handle: 0x001e
            Value UUID: Hardware Revision String (0x2a27)
        Handle: 0x001f
        Value[5]: 022000282a
            Properties: 0x02
              Read (0x02)
            Value Handle: 0x0020
            Value UUID: Software Revision String (0x2a28)
zephyr.exe[688514]: < HCI Command: Host Number of Completed Packets (0x03|0x0035) plen 5                           #120 11.471569
        Num handles: 1
        Handle: 615 Address: DF:A9:FF:F6:B1:1A (OUI DF-A9-FF)
        Count: 1
> HCI Event: Number of Completed Packets (0x13) plen 5                                                             #121 11.632935
        Num handles: 1
        Handle: 615 Address: DF:A9:FF:F6:B1:1A (OUI DF-A9-FF)
        Count: 1
        Buffers: 0/3
        #119: len 20 (0 Kb/s)
        Latency: 161 msec (52-171 msec ~145 msec)
> ACL Data RX: Handle 615 flags 0x02 dlen 11                                                                       #122 11.633002
      ATT: Read By Type Request (0x08) len 6
        Handle range: 0x0020-0xffff
        Attribute type: Characteristic (0x2803)
zephyr.exe[688514]: < HCI Command: Host Number of Completed Packets (0x03|0x0035) plen 5                           #123 11.651489
        Num handles: 1
        Handle: 615 Address: DF:A9:FF:F6:B1:1A (OUI DF-A9-FF)
        Count: 1
zephyr.exe[688514]: < ACL Data TX: Handle 615 [1/3] flags 0x00 dlen 20                                             #124 11.651517
      ATT: Read By Type Response (0x09) len 15
        Attribute data length: 7
        Attribute data list: 2 entries
        Handle: 0x0022
        Value[5]: 0a2300aa50
            Properties: 0x0a
              Read (0x02)
              Write (0x08)
            Value Handle: 0x0023
            Value UUID: Unknown (0x50aa)
        Handle: 0x0024
        Value[5]: 0a2500aa51
            Properties: 0x0a
              Read (0x02)
              Write (0x08)
            Value Handle: 0x0025
            Value UUID: Unknown (0x51aa)
> HCI Event: Number of Completed Packets (0x13) plen 5                                                             #125 11.807775
        Num handles: 1
        Handle: 615 Address: DF:A9:FF:F6:B1:1A (OUI DF-A9-FF)
        Count: 1
        Buffers: 0/3
        #124: len 20 (1 Kb/s)
        Latency: 156 msec (52-171 msec ~150 msec)
> ACL Data RX: Handle 615 flags 0x02 dlen 11                                                                       #126 11.807939
      ATT: Read By Type Request (0x08) len 6
        Handle range: 0x0025-0xffff
        Attribute type: Characteristic (0x2803)
zephyr.exe[688514]: < HCI Command: Host Number of Completed Packets (0x03|0x0035) plen 5                           #127 11.811395
        Num handles: 1
        Handle: 615 Address: DF:A9:FF:F6:B1:1A (OUI DF-A9-FF)
        Count: 1
zephyr.exe[688514]: < ACL Data TX: Handle 615 [1/3] flags 0x00 dlen 20                                             #128 11.811418
      ATT: Read By Type Response (0x09) len 15
        Attribute data length: 7
        Attribute data list: 2 entries
        Handle: 0x0026
        Value[5]: 0a2700aa52
            Properties: 0x0a
              Read (0x02)
              Write (0x08)
            Value Handle: 0x0027
            Value UUID: Unknown (0x52aa)
        Handle: 0x0028
        Value[5]: 0a2900aa53
            Properties: 0x0a
              Read (0x02)
              Write (0x08)
            Value Handle: 0x0029
            Value UUID: Unknown (0x53aa)
> HCI Event: Number of Completed Packets (0x13) plen 5                                                             #129 11.982927
        Num handles: 1
        Handle: 615 Address: DF:A9:FF:F6:B1:1A (OUI DF-A9-FF)
        Count: 1
        Buffers: 0/3
        #128: len 20 (0 Kb/s)
        Latency: 171 msec (52-171 msec ~161 msec)
> ACL Data RX: Handle 615 flags 0x02 dlen 11                                                                       #130 11.982962
      ATT: Read By Type Request (0x08) len 6
        Handle range: 0x0029-0xffff
        Attribute type: Characteristic (0x2803)
zephyr.exe[688514]: < HCI Command: Host Number of Completed Packets (0x03|0x0035) plen 5                           #131 11.991481
        Num handles: 1
        Handle: 615 Address: DF:A9:FF:F6:B1:1A (OUI DF-A9-FF)
        Count: 1
zephyr.exe[688514]: < ACL Data TX: Handle 615 [1/3] flags 0x00 dlen 20                                             #132 11.991508
      ATT: Read By Type Response (0x09) len 15
        Attribute data length: 7
        Attribute data list: 2 entries
        Handle: 0x002a
        Value[5]: 3a2b00aa54
            Properties: 0x3a
              Read (0x02)
              Write (0x08)
              Notify (0x10)
              Indicate (0x20)
            Value Handle: 0x002b
            Value UUID: Unknown (0x54aa)
        Handle: 0x002d
        Value[5]: 3a2e00aa55
            Properties: 0x3a
              Read (0x02)
              Write (0x08)
              Notify (0x10)
              Indicate (0x20)
            Value Handle: 0x002e
            Value UUID: Unknown (0x55aa)
> HCI Event: Number of Completed Packets (0x13) plen 5                                                             #133 12.157838
        Num handles: 1
        Handle: 615 Address: DF:A9:FF:F6:B1:1A (OUI DF-A9-FF)
        Count: 1
        Buffers: 0/3
        #132: len 20 (0 Kb/s)
        Latency: 166 msec (52-171 msec ~163 msec)
> ACL Data RX: Handle 615 flags 0x02 dlen 11                                                                       #134 12.157912
      ATT: Read By Type Request (0x08) len 6
        Handle range: 0x002e-0xffff
        Attribute type: Characteristic (0x2803)
zephyr.exe[688514]: < HCI Command: Host Number of Completed Packets (0x03|0x0035) plen 5                           #135 12.171492
        Num handles: 1
        Handle: 615 Address: DF:A9:FF:F6:B1:1A (OUI DF-A9-FF)
        Count: 1
zephyr.exe[688514]: < ACL Data TX: Handle 615 [1/3] flags 0x00 dlen 20                                             #136 12.171520
      ATT: Read By Type Response (0x09) len 15
        Attribute data length: 7
        Attribute data list: 2 entries
        Handle: 0x0030
        Value[5]: 463100aa56
            Properties: 0x46
              Read (0x02)
              Write Without Response (0x04)
              Authorize (0x40)
              Extended Properties (0x80)
            Value Handle: 0x0031
            Value UUID: Unknown (0x56aa)
        Handle: 0x0032
        Value[5]: 463300aa57
            Properties: 0x46
              Read (0x02)
              Write Without Response (0x04)
              Authorize (0x40)
              Extended Properties (0x80)
            Value Handle: 0x0033
            Value UUID: Unknown (0x57aa)
> HCI Event: Number of Completed Packets (0x13) plen 5                                                             #137 12.332973
        Num handles: 1
        Handle: 615 Address: DF:A9:FF:F6:B1:1A (OUI DF-A9-FF)
        Count: 1
        Buffers: 0/3
        #136: len 20 (0 Kb/s)
        Latency: 161 msec (52-171 msec ~162 msec)
> ACL Data RX: Handle 615 flags 0x02 dlen 11                                                                       #138 12.332976
      ATT: Read By Type Request (0x08) len 6
        Handle range: 0x0033-0xffff
        Attribute type: Characteristic (0x2803)
zephyr.exe[688514]: < HCI Command: Host Number of Completed Packets (0x03|0x0035) plen 5                           #139 12.351487
        Num handles: 1
        Handle: 615 Address: DF:A9:FF:F6:B1:1A (OUI DF-A9-FF)
        Count: 1
zephyr.exe[688514]: < ACL Data TX: Handle 615 [1/3] flags 0x00 dlen 20                                             #140 12.351512
      ATT: Read By Type Response (0x09) len 15
        Attribute data length: 7
        Attribute data list: 2 entries
        Handle: 0x0034
        Value[5]: 8a3500aa58
            Properties: 0x8a
              Read (0x02)
              Write (0x08)
            Unknown fields (0x80)
            Value Handle: 0x0035
            Value UUID: Unknown (0x58aa)
        Handle: 0x0037
        Value[5]: 0a3800aa59
            Properties: 0x0a
              Read (0x02)
              Write (0x08)
            Value Handle: 0x0038
            Value UUID: Unknown (0x59aa)
> HCI Event: Number of Completed Packets (0x13) plen 5                                                             #141 12.507842
        Num handles: 1
        Handle: 615 Address: DF:A9:FF:F6:B1:1A (OUI DF-A9-FF)
        Count: 1
        Buffers: 0/3
        #140: len 20 (1 Kb/s)
        Latency: 156 msec (52-171 msec ~159 msec)
> ACL Data RX: Handle 615 flags 0x02 dlen 11                                                                       #142 12.507924
      ATT: Read By Type Request (0x08) len 6
        Handle range: 0x0038-0xffff
        Attribute type: Characteristic (0x2803)
zephyr.exe[688514]: < HCI Command: Host Number of Completed Packets (0x03|0x0035) plen 5                           #143 12.511378
        Num handles: 1
        Handle: 615 Address: DF:A9:FF:F6:B1:1A (OUI DF-A9-FF)
        Count: 1
zephyr.exe[688514]: < ACL Data TX: Handle 615 [1/3] flags 0x00 dlen 13                                             #144 12.511400
      ATT: Read By Type Response (0x09) len 8
        Attribute data length: 7
        Attribute data list: 1 entry
        Handle: 0x0039
        Value[5]: 0a3a00aa5a
            Properties: 0x0a
              Read (0x02)
              Write (0x08)
            Value Handle: 0x003a
            Value UUID: Unknown (0x5aaa)
> HCI Event: Number of Completed Packets (0x13) plen 5                                                             #145 12.682799
        Num handles: 1
        Handle: 615 Address: DF:A9:FF:F6:B1:1A (OUI DF-A9-FF)
        Count: 1
        Buffers: 0/3
        #144: len 13 (0 Kb/s)
        Latency: 171 msec (52-171 msec ~165 msec)
> ACL Data RX: Handle 615 flags 0x02 dlen 11                                                                       #146 12.682948
      ATT: Read By Type Request (0x08) len 6
        Handle range: 0x003a-0xffff
        Attribute type: Characteristic (0x2803)
zephyr.exe[688514]: < HCI Command: Host Number of Completed Packets (0x03|0x0035) plen 5                           #147 12.691392
        Num handles: 1
        Handle: 615 Address: DF:A9:FF:F6:B1:1A (OUI DF-A9-FF)
        Count: 1
zephyr.exe[688514]: < ACL Data TX: Handle 615 [1/3] flags 0x00 dlen 27                                             #148 12.691414
      ATT: Read By Type Response (0x09) len 22
        Attribute data length: 21
        Attribute data list: 1 entry
        Handle: 0x003b
        Value[19]: 0a3c00f000bb5004514000b123456789abcdef
            Properties: 0x0a
              Read (0x02)
              Write (0x08)
            Value Handle: 0x003c
            Value UUID: Vendor specific (efcdab89-6745-23b1-0040-510450bb00f0)
> HCI Event: Number of Completed Packets (0x13) plen 5                                                             #149 12.857991
        Num handles: 1
        Handle: 615 Address: DF:A9:FF:F6:B1:1A (OUI DF-A9-FF)
        Count: 1
        Buffers: 0/3
        #148: len 27 (1 Kb/s)
        Latency: 166 msec (52-171 msec ~166 msec)
> ACL Data RX: Handle 615 flags 0x02 dlen 11                                                                       #150 12.857993
      ATT: Read By Type Request (0x08) len 6
        Handle range: 0x003c-0xffff
        Attribute type: Characteristic (0x2803)
zephyr.exe[688514]: < HCI Command: Host Number of Completed Packets (0x03|0x0035) plen 5                           #151 12.871421
        Num handles: 1
        Handle: 615 Address: DF:A9:FF:F6:B1:1A (OUI DF-A9-FF)
        Count: 1
zephyr.exe[688514]: < ACL Data TX: Handle 615 [1/3] flags 0x00 dlen 20                                             #152 12.871474
      ATT: Read By Type Response (0x09) len 15
        Attribute data length: 7
        Attribute data list: 2 entries
        Handle: 0x003f
        Value[5]: 0a4000aa50
            Properties: 0x0a
              Read (0x02)
              Write (0x08)
            Value Handle: 0x0040
            Value UUID: Unknown (0x50aa)
        Handle: 0x0041
        Value[5]: 0a4200aa51
            Properties: 0x0a
              Read (0x02)
              Write (0x08)
            Value Handle: 0x0042
            Value UUID: Unknown (0x51aa)
> HCI Event: Number of Completed Packets (0x13) plen 5                                                             #153 13.032909
        Num handles: 1
        Handle: 615 Address: DF:A9:FF:F6:B1:1A (OUI DF-A9-FF)
        Count: 1
        Buffers: 0/3
        #152: len 20 (0 Kb/s)
        Latency: 161 msec (52-171 msec ~163 msec)
> ACL Data RX: Handle 615 flags 0x02 dlen 11                                                                       #154 13.032970
      ATT: Read By Type Request (0x08) len 6
        Handle range: 0x0042-0xffff
        Attribute type: Characteristic (0x2803)
zephyr.exe[688514]: < HCI Command: Host Number of Completed Packets (0x03|0x0035) plen 5                           #155 13.051445
        Num handles: 1
        Handle: 615 Address: DF:A9:FF:F6:B1:1A (OUI DF-A9-FF)
        Count: 1
zephyr.exe[688514]: < ACL Data TX: Handle 615 [1/3] flags 0x00 dlen 20                                             #156 13.051473
      ATT: Read By Type Response (0x09) len 15
        Attribute data length: 7
        Attribute data list: 2 entries
        Handle: 0x0043
        Value[5]: 0a4400aa52
            Properties: 0x0a
              Read (0x02)
              Write (0x08)
            Value Handle: 0x0044
            Value UUID: Unknown (0x52aa)
        Handle: 0x0045
        Value[5]: 024600aa53
            Properties: 0x02
              Read (0x02)
            Value Handle: 0x0046
            Value UUID: Unknown (0x53aa)
> HCI Event: Number of Completed Packets (0x13) plen 5                                                             #157 13.207778
        Num handles: 1
        Handle: 615 Address: DF:A9:FF:F6:B1:1A (OUI DF-A9-FF)
        Count: 1
        Buffers: 0/3
        #156: len 20 (1 Kb/s)
        Latency: 156 msec (52-171 msec ~160 msec)
> ACL Data RX: Handle 615 flags 0x02 dlen 11                                                                       #158 13.207882
      ATT: Read By Type Request (0x08) len 6
        Handle range: 0x0046-0xffff
        Attribute type: Characteristic (0x2803)
zephyr.exe[688514]: < HCI Command: Host Number of Completed Packets (0x03|0x0035) plen 5                           #159 13.211438
        Num handles: 1
        Handle: 615 Address: DF:A9:FF:F6:B1:1A (OUI DF-A9-FF)
        Count: 1
zephyr.exe[688514]: < ACL Data TX: Handle 615 [1/3] flags 0x00 dlen 20                                             #160 13.211466
      ATT: Read By Type Response (0x09) len 15
        Attribute data length: 7
        Attribute data list: 2 entries
        Handle: 0x0048
        Value[5]: 0a4900aa55
            Properties: 0x0a
              Read (0x02)
              Write (0x08)
            Value Handle: 0x0049
            Value UUID: Unknown (0x55aa)
        Handle: 0x004a
        Value[5]: 0a4b00aa56
            Properties: 0x0a
              Read (0x02)
              Write (0x08)
            Value Handle: 0x004b
            Value UUID: Unknown (0x56aa)
> HCI Event: Number of Completed Packets (0x13) plen 5                                                             #161 13.382788
        Num handles: 1
        Handle: 615 Address: DF:A9:FF:F6:B1:1A (OUI DF-A9-FF)
        Count: 1
        Buffers: 0/3
        #160: len 20 (0 Kb/s)
        Latency: 171 msec (52-171 msec ~165 msec)
> ACL Data RX: Handle 615 flags 0x02 dlen 11                                                                       #162 13.382827
      ATT: Read By Type Request (0x08) len 6
        Handle range: 0x004b-0xffff
        Attribute type: Characteristic (0x2803)
zephyr.exe[688514]: < HCI Command: Host Number of Completed Packets (0x03|0x0035) plen 5                           #163 13.391456
        Num handles: 1
        Handle: 615 Address: DF:A9:FF:F6:B1:1A (OUI DF-A9-FF)
        Count: 1
zephyr.exe[688514]: < ACL Data TX: Handle 615 [1/3] flags 0x00 dlen 9                                              #164 13.391507
      ATT: Error Response (0x01) len 4
        Read By Type Request (0x08)
        Handle: 0x004b
        Error: Attribute Not Found (0x0a)
> HCI Event: Number of Completed Packets (0x13) plen 5                                                             #165 13.557857
        Num handles: 1
        Handle: 615 Address: DF:A9:FF:F6:B1:1A (OUI DF-A9-FF)
        Count: 1
        Buffers: 0/3
        #164: len 9 (0 Kb/s)
        Latency: 166 msec (52-171 msec ~166 msec)
> ACL Data RX: Handle 615 flags 0x02 dlen 7                                                                        #166 13.558151
      ATT: Read Request (0x0a) len 2
        Handle: 0x004b
zephyr.exe[688514]: < HCI Command: Host Number of Completed Packets (0x03|0x0035) plen 5                           #167 13.571449
        Num handles: 1
        Handle: 615 Address: DF:A9:FF:F6:B1:1A (OUI DF-A9-FF)
        Count: 1
zephyr.exe[688514]: < ACL Data TX: Handle 615 [1/3] flags 0x00 dlen 27                                             #168 13.571472
      ATT: Read Response (0x0b) len 22
        Value[22]: 02020202020202020202020202020202020202020202
> HCI Event: Number of Completed Packets (0x13) plen 5                                                             #169 13.733052
        Num handles: 1
        Handle: 615 Address: DF:A9:FF:F6:B1:1A (OUI DF-A9-FF)
        Count: 1
        Buffers: 0/3
        #168: len 27 (1 Kb/s)
        Latency: 161 msec (52-171 msec ~163 msec)
> ACL Data RX: Handle 615 flags 0x02 dlen 9                                                                        #170 13.733055
      ATT: Read Blob Request (0x0c) len 4
        Handle: 0x004b
        Offset: 0x0016
zephyr.exe[688514]: < HCI Command: Host Number of Completed Packets (0x03|0x0035) plen 5                           #171 13.751451
        Num handles: 1
        Handle: 615 Address: DF:A9:FF:F6:B1:1A (OUI DF-A9-FF)
        Count: 1
zephyr.exe[688514]: < ACL Data TX: Handle 615 [1/3] flags 0x00 dlen 27                                             #172 13.751516
      ATT: Read Blob Response (0x0d) len 22
        Value[22]: 02020202020202020202020202020202020202020202
> HCI Event: Number of Completed Packets (0x13) plen 5                                                             #173 13.907799
        Num handles: 1
        Handle: 615 Address: DF:A9:FF:F6:B1:1A (OUI DF-A9-FF)
        Count: 1
        Buffers: 0/3
        #172: len 27 (1 Kb/s)
        Latency: 156 msec (52-171 msec ~160 msec)
> ACL Data RX: Handle 615 flags 0x02 dlen 9                                                                        #174 13.907845
      ATT: Read Blob Request (0x0c) len 4
        Handle: 0x004b
        Offset: 0x002c
zephyr.exe[688514]: < HCI Command: Host Number of Completed Packets (0x03|0x0035) plen 5                           #175 13.911424
        Num handles: 1
        Handle: 615 Address: DF:A9:FF:F6:B1:1A (OUI DF-A9-FF)
        Count: 1
zephyr.exe[688514]: < ACL Data TX: Handle 615 [1/3] flags 0x00 dlen 27                                             #176 13.911480
      ATT: Read Blob Response (0x0d) len 22
        Value[22]: 02020202020202020202020202020202020202020202
> HCI Event: Number of Completed Packets (0x13) plen 5                                                             #177 14.082921
        Num handles: 1
        Handle: 615 Address: DF:A9:FF:F6:B1:1A (OUI DF-A9-FF)
        Count: 1
        Buffers: 0/3
        #176: len 27 (1 Kb/s)
        Latency: 171 msec (52-171 msec ~165 msec)
> ACL Data RX: Handle 615 flags 0x02 dlen 9                                                                        #178 14.083388
      ATT: Read Blob Request (0x0c) len 4
        Handle: 0x004b
        Offset: 0x0042
zephyr.exe[688514]: < HCI Command: Host Number of Completed Packets (0x03|0x0035) plen 5                           #179 14.091464
        Num handles: 1
        Handle: 615 Address: DF:A9:FF:F6:B1:1A (OUI DF-A9-FF)
        Count: 1
zephyr.exe[688514]: < ACL Data TX: Handle 615 [1/3] flags 0x00 dlen 27                                             #180 14.091493
      ATT: Read Blob Response (0x0d) len 22
        Value[22]: 02020202020202020202020202020202020202020202
> HCI Event: Number of Completed Packets (0x13) plen 5                                                             #181 14.257914
        Num handles: 1
        Handle: 615 Address: DF:A9:FF:F6:B1:1A (OUI DF-A9-FF)
        Count: 1
        Buffers: 0/3
        #180: len 27 (1 Kb/s)
        Latency: 166 msec (52-171 msec ~166 msec)
> ACL Data RX: Handle 615 flags 0x02 dlen 9                                                                        #182 14.257916
      ATT: Read Blob Request (0x0c) len 4
        Handle: 0x004b
        Offset: 0x0058
zephyr.exe[688514]: < HCI Command: Host Number of Completed Packets (0x03|0x0035) plen 5                           #183 14.271463
        Num handles: 1
        Handle: 615 Address: DF:A9:FF:F6:B1:1A (OUI DF-A9-FF)
        Count: 1
zephyr.exe[688514]: < ACL Data TX: Handle 615 [1/3] flags 0x00 dlen 27                                             #184 14.271521
      ATT: Read Blob Response (0x0d) len 22
        Value[22]: 02020202020202020202020202020202020202020202
> HCI Event: Number of Completed Packets (0x13) plen 5                                                             #185 14.432724
        Num handles: 1
        Handle: 615 Address: DF:A9:FF:F6:B1:1A (OUI DF-A9-FF)
        Count: 1
        Buffers: 0/3
        #184: len 27 (1 Kb/s)
        Latency: 161 msec (52-171 msec ~163 msec)
> ACL Data RX: Handle 615 flags 0x02 dlen 9                                                                        #186 14.432905
      ATT: Read Blob Request (0x0c) len 4
        Handle: 0x004b
        Offset: 0x006e
zephyr.exe[688514]: < HCI Command: Host Number of Completed Packets (0x03|0x0035) plen 5                           #187 14.451419
        Num handles: 1
        Handle: 615 Address: DF:A9:FF:F6:B1:1A (OUI DF-A9-FF)
        Count: 1
zephyr.exe[688514]: < ACL Data TX: Handle 615 [1/3] flags 0x00 dlen 27                                             #188 14.451443
      ATT: Read Blob Response (0x0d) len 22
        Value[22]: 02020202020202020202020202020202020202020202
> HCI Event: Number of Completed Packets (0x13) plen 5                                                             #189 14.607535
        Num handles: 1
        Handle: 615 Address: DF:A9:FF:F6:B1:1A (OUI DF-A9-FF)
        Count: 1
        Buffers: 0/3
        #188: len 27 (1 Kb/s)
        Latency: 156 msec (52-171 msec ~159 msec)
> ACL Data RX: Handle 615 flags 0x02 dlen 9                                                                        #190 14.607884
      ATT: Read Blob Request (0x0c) len 4
        Handle: 0x004b
        Offset: 0x0084
zephyr.exe[688514]: < HCI Command: Host Number of Completed Packets (0x03|0x0035) plen 5                           #191 14.611470
        Num handles: 1
        Handle: 615 Address: DF:A9:FF:F6:B1:1A (OUI DF-A9-FF)
        Count: 1
zephyr.exe[688514]: < ACL Data TX: Handle 615 [1/3] flags 0x00 dlen 27                                             #192 14.611476
      ATT: Read Blob Response (0x0d) len 22
        Value[22]: 02020202020202020202020202020202020202020202
> HCI Event: Number of Completed Packets (0x13) plen 5                                                             #193 14.782753
        Num handles: 1
        Handle: 615 Address: DF:A9:FF:F6:B1:1A (OUI DF-A9-FF)
        Count: 1
        Buffers: 0/3
        #192: len 27 (1 Kb/s)
        Latency: 171 msec (52-171 msec ~165 msec)
> ACL Data RX: Handle 615 flags 0x02 dlen 9                                                                        #194 14.782829
      ATT: Read Blob Request (0x0c) len 4
        Handle: 0x004b
        Offset: 0x009a
zephyr.exe[688514]: < HCI Command: Host Number of Completed Packets (0x03|0x0035) plen 5                           #195 14.791474
        Num handles: 1
        Handle: 615 Address: DF:A9:FF:F6:B1:1A (OUI DF-A9-FF)
        Count: 1
zephyr.exe[688514]: < ACL Data TX: Handle 615 [1/3] flags 0x00 dlen 27                                             #196 14.791487
      ATT: Read Blob Response (0x0d) len 22
        Value[22]: 02020202020202020202020202020202020202020202
> HCI Event: Number of Completed Packets (0x13) plen 5                                                             #197 14.957702
        Num handles: 1
        Handle: 615 Address: DF:A9:FF:F6:B1:1A (OUI DF-A9-FF)
        Count: 1
        Buffers: 0/3
        #196: len 27 (1 Kb/s)
        Latency: 166 msec (52-171 msec ~165 msec)
> ACL Data RX: Handle 615 flags 0x02 dlen 9                                                                        #198 14.957833
      ATT: Read Blob Request (0x0c) len 4
        Handle: 0x004b
        Offset: 0x00b0
zephyr.exe[688514]: < HCI Command: Host Number of Completed Packets (0x03|0x0035) plen 5                           #199 14.971419
        Num handles: 1
        Handle: 615 Address: DF:A9:FF:F6:B1:1A (OUI DF-A9-FF)
        Count: 1
zephyr.exe[688514]: < ACL Data TX: Handle 615 [1/3] flags 0x00 dlen 27                                             #200 14.971487
      ATT: Read Blob Response (0x0d) len 22
        Value[22]: 02020202020202020202020202020202020202020202
> HCI Event: Number of Completed Packets (0x13) plen 5                                                             #201 15.132617
        Num handles: 1
        Handle: 615 Address: DF:A9:FF:F6:B1:1A (OUI DF-A9-FF)
        Count: 1
        Buffers: 0/3
        #200: len 27 (1 Kb/s)
        Latency: 161 msec (52-171 msec ~163 msec)
> ACL Data RX: Handle 615 flags 0x02 dlen 9                                                                        #202 15.132823
      ATT: Read Blob Request (0x0c) len 4
        Handle: 0x004b
        Offset: 0x00c6
zephyr.exe[688514]: < HCI Command: Host Number of Completed Packets (0x03|0x0035) plen 5                           #203 15.151457
        Num handles: 1
        Handle: 615 Address: DF:A9:FF:F6:B1:1A (OUI DF-A9-FF)
        Count: 1
zephyr.exe[688514]: < ACL Data TX: Handle 615 [1/3] flags 0x00 dlen 27                                             #204 15.151462
      ATT: Read Blob Response (0x0d) len 22
        Value[22]: 02020202020202020202020202020202020202020202
> HCI Event: Number of Completed Packets (0x13) plen 5                                                             #205 15.307696
        Num handles: 1
        Handle: 615 Address: DF:A9:FF:F6:B1:1A (OUI DF-A9-FF)
        Count: 1
        Buffers: 0/3
        #204: len 27 (1 Kb/s)
        Latency: 156 msec (52-171 msec ~159 msec)
> ACL Data RX: Handle 615 flags 0x02 dlen 9                                                                        #206 15.308031
      ATT: Read Blob Request (0x0c) len 4
        Handle: 0x004b
        Offset: 0x00dc
zephyr.exe[688514]: < HCI Command: Host Number of Completed Packets (0x03|0x0035) plen 5                           #207 15.311460
        Num handles: 1
        Handle: 615 Address: DF:A9:FF:F6:B1:1A (OUI DF-A9-FF)
        Count: 1
zephyr.exe[688514]: < ACL Data TX: Handle 615 [1/3] flags 0x00 dlen 27                                             #208 15.311466
      ATT: Read Blob Response (0x0d) len 22
        Value[22]: 02020202020202020202020202020202020202020202
> HCI Event: Number of Completed Packets (0x13) plen 5                                                             #209 15.482673
        Num handles: 1
        Handle: 615 Address: DF:A9:FF:F6:B1:1A (OUI DF-A9-FF)
        Count: 1
        Buffers: 0/3
        #208: len 27 (1 Kb/s)
        Latency: 171 msec (52-171 msec ~165 msec)
> ACL Data RX: Handle 615 flags 0x02 dlen 9                                                                        #210 15.483117
      ATT: Read Blob Request (0x0c) len 4
        Handle: 0x004b
        Offset: 0x00f2
zephyr.exe[688514]: < HCI Command: Host Number of Completed Packets (0x03|0x0035) plen 5                           #211 15.491407
        Num handles: 1
        Handle: 615 Address: DF:A9:FF:F6:B1:1A (OUI DF-A9-FF)
        Count: 1
zephyr.exe[688514]: < ACL Data TX: Handle 615 [1/3] flags 0x00 dlen 27                                             #212 15.491472
      ATT: Read Blob Response (0x0d) len 22
        Value[22]: 02020202020202020202020202020202020202020202
> HCI Event: Number of Completed Packets (0x13) plen 5                                                             #213 15.657738
        Num handles: 1
        Handle: 615 Address: DF:A9:FF:F6:B1:1A (OUI DF-A9-FF)
        Count: 1
        Buffers: 0/3
        #212: len 27 (1 Kb/s)
        Latency: 166 msec (52-171 msec ~165 msec)
> ACL Data RX: Handle 615 flags 0x02 dlen 9                                                                        #214 15.657828
      ATT: Read Blob Request (0x0c) len 4
        Handle: 0x004b
        Offset: 0x0108
zephyr.exe[688514]: < HCI Command: Host Number of Completed Packets (0x03|0x0035) plen 5                           #215 15.671426
        Num handles: 1
        Handle: 615 Address: DF:A9:FF:F6:B1:1A (OUI DF-A9-FF)
        Count: 1
zephyr.exe[688514]: < ACL Data TX: Handle 615 [1/3] flags 0x00 dlen 27                                             #216 15.671432
      ATT: Read Blob Response (0x0d) len 22
        Value[22]: 02020202020202020202020202020202020202020202
> HCI Event: Number of Completed Packets (0x13) plen 5                                                             #217 15.832536
        Num handles: 1
        Handle: 615 Address: DF:A9:FF:F6:B1:1A (OUI DF-A9-FF)
        Count: 1
        Buffers: 0/3
        #216: len 27 (1 Kb/s)
        Latency: 161 msec (52-171 msec ~163 msec)
> ACL Data RX: Handle 615 flags 0x02 dlen 9                                                                        #218 15.833239
      ATT: Read Blob Request (0x0c) len 4
        Handle: 0x004b
        Offset: 0x011e
zephyr.exe[688514]: < HCI Command: Host Number of Completed Packets (0x03|0x0035) plen 5                           #219 15.851468
        Num handles: 1
        Handle: 615 Address: DF:A9:FF:F6:B1:1A (OUI DF-A9-FF)
        Count: 1
zephyr.exe[688514]: < ACL Data TX: Handle 615 [1/3] flags 0x00 dlen 27                                             #220 15.851474
      ATT: Read Blob Response (0x0d) len 22
        Value[22]: 02020202020202020202020202020202020202020202
> HCI Event: Number of Completed Packets (0x13) plen 5                                                             #221 16.007530
        Num handles: 1
        Handle: 615 Address: DF:A9:FF:F6:B1:1A (OUI DF-A9-FF)
        Count: 1
        Buffers: 0/3
        #220: len 27 (1 Kb/s)
        Latency: 156 msec (52-171 msec ~159 msec)
> ACL Data RX: Handle 615 flags 0x02 dlen 9                                                                        #222 16.008411
      ATT: Read Blob Request (0x0c) len 4
        Handle: 0x004b
        Offset: 0x0134
zephyr.exe[688514]: < HCI Command: Host Number of Completed Packets (0x03|0x0035) plen 5                           #223 16.011479
        Num handles: 1
        Handle: 615 Address: DF:A9:FF:F6:B1:1A (OUI DF-A9-FF)
        Count: 1
zephyr.exe[688514]: < ACL Data TX: Handle 615 [1/3] flags 0x00 dlen 27                                             #224 16.011505
      ATT: Read Blob Response (0x0d) len 22
        Value[22]: 02020202020202020202020202020202020202020202
> HCI Event: Number of Completed Packets (0x13) plen 5                                                             #225 16.182705
        Num handles: 1
        Handle: 615 Address: DF:A9:FF:F6:B1:1A (OUI DF-A9-FF)
        Count: 1
        Buffers: 0/3
        #224: len 27 (1 Kb/s)
        Latency: 171 msec (52-171 msec ~165 msec)
> ACL Data RX: Handle 615 flags 0x02 dlen 9                                                                        #226 16.182985
      ATT: Read Blob Request (0x0c) len 4
        Handle: 0x004b
        Offset: 0x014a
zephyr.exe[688514]: < HCI Command: Host Number of Completed Packets (0x03|0x0035) plen 5                           #227 16.191521
        Num handles: 1
        Handle: 615 Address: DF:A9:FF:F6:B1:1A (OUI DF-A9-FF)
        Count: 1
zephyr.exe[688514]: < ACL Data TX: Handle 615 [1/3] flags 0x00 dlen 27                                             #228 16.191583
      ATT: Read Blob Response (0x0d) len 22
        Value[22]: 02020202020202020202020202020202020202020202
> HCI Event: Number of Completed Packets (0x13) plen 5                                                             #229 16.357764
        Num handles: 1
        Handle: 615 Address: DF:A9:FF:F6:B1:1A (OUI DF-A9-FF)
        Count: 1
        Buffers: 0/3
        #228: len 27 (1 Kb/s)
        Latency: 166 msec (52-171 msec ~165 msec)
> ACL Data RX: Handle 615 flags 0x02 dlen 9                                                                        #230 16.357868
      ATT: Read Blob Request (0x0c) len 4
        Handle: 0x004b
        Offset: 0x0160
zephyr.exe[688514]: < HCI Command: Host Number of Completed Packets (0x03|0x0035) plen 5                           #231 16.371469
        Num handles: 1
        Handle: 615 Address: DF:A9:FF:F6:B1:1A (OUI DF-A9-FF)
        Count: 1
zephyr.exe[688514]: < ACL Data TX: Handle 615 [1/3] flags 0x00 dlen 27                                             #232 16.371475
      ATT: Read Blob Response (0x0d) len 22
        Value[22]: 02020202020202020202020202020202020202020202
> HCI Event: Number of Completed Packets (0x13) plen 5                                                             #233 16.532633
        Num handles: 1
        Handle: 615 Address: DF:A9:FF:F6:B1:1A (OUI DF-A9-FF)
        Count: 1
        Buffers: 0/3
        #232: len 27 (1 Kb/s)
        Latency: 161 msec (52-171 msec ~163 msec)
> ACL Data RX: Handle 615 flags 0x02 dlen 9                                                                        #234 16.532712
      ATT: Read Blob Request (0x0c) len 4
        Handle: 0x004b
        Offset: 0x0176
zephyr.exe[688514]: < HCI Command: Host Number of Completed Packets (0x03|0x0035) plen 5                           #235 16.551476
        Num handles: 1
        Handle: 615 Address: DF:A9:FF:F6:B1:1A (OUI DF-A9-FF)
        Count: 1
zephyr.exe[688514]: < ACL Data TX: Handle 615 [1/3] flags 0x00 dlen 27                                             #236 16.551504
      ATT: Read Blob Response (0x0d) len 22
        Value[22]: 02020202020202020202020202020202020202020202
> HCI Event: Number of Completed Packets (0x13) plen 5                                                             #237 16.707651
        Num handles: 1
        Handle: 615 Address: DF:A9:FF:F6:B1:1A (OUI DF-A9-FF)
        Count: 1
        Buffers: 0/3
        #236: len 27 (1 Kb/s)
        Latency: 156 msec (52-171 msec ~159 msec)
> ACL Data RX: Handle 615 flags 0x02 dlen 9                                                                        #238 16.707827
      ATT: Read Blob Request (0x0c) len 4
        Handle: 0x004b
        Offset: 0x018c
zephyr.exe[688514]: < HCI Command: Host Number of Completed Packets (0x03|0x0035) plen 5                           #239 16.711464
        Num handles: 1
        Handle: 615 Address: DF:A9:FF:F6:B1:1A (OUI DF-A9-FF)
        Count: 1
zephyr.exe[688514]: < ACL Data TX: Handle 615 [1/3] flags 0x00 dlen 27                                             #240 16.711536
      ATT: Read Blob Response (0x0d) len 22
        Value[22]: 02020202020202020202020202020202020202020202
> HCI Event: Number of Completed Packets (0x13) plen 5                                                             #241 16.882678
        Num handles: 1
        Handle: 615 Address: DF:A9:FF:F6:B1:1A (OUI DF-A9-FF)
        Count: 1
        Buffers: 0/3
        #240: len 27 (1 Kb/s)
        Latency: 171 msec (52-171 msec ~165 msec)
> ACL Data RX: Handle 615 flags 0x02 dlen 9                                                                        #242 16.882738
      ATT: Read Blob Request (0x0c) len 4
        Handle: 0x004b
        Offset: 0x01a2
zephyr.exe[688514]: < HCI Command: Host Number of Completed Packets (0x03|0x0035) plen 5                           #243 16.891476
        Num handles: 1
        Handle: 615 Address: DF:A9:FF:F6:B1:1A (OUI DF-A9-FF)
        Count: 1
zephyr.exe[688514]: < ACL Data TX: Handle 615 [1/3] flags 0x00 dlen 27                                             #244 16.891537
      ATT: Read Blob Response (0x0d) len 22
        Value[22]: 02020202020202020202020202020202020202020202
> HCI Event: Number of Completed Packets (0x13) plen 5                                                             #245 17.057522
        Num handles: 1
        Handle: 615 Address: DF:A9:FF:F6:B1:1A (OUI DF-A9-FF)
        Count: 1
        Buffers: 0/3
        #244: len 27 (1 Kb/s)
        Latency: 165 msec (52-171 msec ~165 msec)
> ACL Data RX: Handle 615 flags 0x02 dlen 9                                                                        #246 17.057930
      ATT: Read Blob Request (0x0c) len 4
        Handle: 0x004b
        Offset: 0x01b8
zephyr.exe[688514]: < HCI Command: Host Number of Completed Packets (0x03|0x0035) plen 5                           #247 17.071464
        Num handles: 1
        Handle: 615 Address: DF:A9:FF:F6:B1:1A (OUI DF-A9-FF)
        Count: 1
zephyr.exe[688514]: < ACL Data TX: Handle 615 [1/3] flags 0x00 dlen 27                                             #248 17.071532
      ATT: Read Blob Response (0x0d) len 22
        Value[22]: 02020202020202020202020202020202020202020202
> HCI Event: Number of Completed Packets (0x13) plen 5                                                             #249 17.232564
        Num handles: 1
        Handle: 615 Address: DF:A9:FF:F6:B1:1A (OUI DF-A9-FF)
        Count: 1
        Buffers: 0/3
        #248: len 27 (1 Kb/s)
        Latency: 161 msec (52-171 msec ~163 msec)
> ACL Data RX: Handle 615 flags 0x02 dlen 9                                                                        #250 17.232763
      ATT: Read Blob Request (0x0c) len 4
        Handle: 0x004b
        Offset: 0x01ce
zephyr.exe[688514]: < HCI Command: Host Number of Completed Packets (0x03|0x0035) plen 5                           #251 17.251497
        Num handles: 1
        Handle: 615 Address: DF:A9:FF:F6:B1:1A (OUI DF-A9-FF)
        Count: 1
zephyr.exe[688514]: < ACL Data TX: Handle 615 [1/3] flags 0x00 dlen 27                                             #252 17.251506
      ATT: Read Blob Response (0x0d) len 22
        Value[22]: 02020202020202020202020202020202020202020202
> HCI Event: Number of Completed Packets (0x13) plen 5                                                             #253 17.407668
        Num handles: 1
        Handle: 615 Address: DF:A9:FF:F6:B1:1A (OUI DF-A9-FF)
        Count: 1
        Buffers: 0/3
        #252: len 27 (1 Kb/s)
        Latency: 156 msec (52-171 msec ~159 msec)
> ACL Data RX: Handle 615 flags 0x02 dlen 9                                                                        #254 17.407843
      ATT: Read Blob Request (0x0c) len 4
        Handle: 0x004b
        Offset: 0x01e4
zephyr.exe[688514]: < HCI Command: Host Number of Completed Packets (0x03|0x0035) plen 5                           #255 17.411483
        Num handles: 1
        Handle: 615 Address: DF:A9:FF:F6:B1:1A (OUI DF-A9-FF)
        Count: 1
zephyr.exe[688514]: < ACL Data TX: Handle 615 [1/3] flags 0x00 dlen 27                                             #256 17.411511
      ATT: Read Blob Response (0x0d) len 22
        Value[22]: 02020202020202020202020202020202020202020202
> HCI Event: Number of Completed Packets (0x13) plen 5                                                             #257 17.582390
        Num handles: 1
        Handle: 615 Address: DF:A9:FF:F6:B1:1A (OUI DF-A9-FF)
        Count: 1
        Buffers: 0/3
        #256: len 27 (1 Kb/s)
        Latency: 170 msec (52-171 msec ~165 msec)
> ACL Data RX: Handle 615 flags 0x02 dlen 9                                                                        #258 17.582926
      ATT: Read Blob Request (0x0c) len 4
        Handle: 0x004b
        Offset: 0x01fa
zephyr.exe[688514]: < HCI Command: Host Number of Completed Packets (0x03|0x0035) plen 5                           #259 17.591484
        Num handles: 1
        Handle: 615 Address: DF:A9:FF:F6:B1:1A (OUI DF-A9-FF)
        Count: 1
zephyr.exe[688514]: < ACL Data TX: Handle 615 [1/3] flags 0x00 dlen 11                                             #260 17.591554
      ATT: Read Blob Response (0x0d) len 6
        Value[6]: 020202020202
> HCI Event: Number of Completed Packets (0x13) plen 5                                                             #261 17.758402
        Num handles: 1
        Handle: 615 Address: DF:A9:FF:F6:B1:1A (OUI DF-A9-FF)
        Count: 1
        Buffers: 0/3
        #260: len 11 (0 Kb/s)
        Latency: 166 msec (52-171 msec ~166 msec)
> ACL Data RX: Handle 615 flags 0x02 dlen 7                                                                        #262 17.758404
      ATT: Read Request (0x0a) len 2
        Handle: 0x000f
zephyr.exe[688514]: < HCI Command: Host Number of Completed Packets (0x03|0x0035) plen 5                           #263 17.771498
        Num handles: 1
        Handle: 615 Address: DF:A9:FF:F6:B1:1A (OUI DF-A9-FF)
        Count: 1
zephyr.exe[688514]: < ACL Data TX: Handle 615 [1/3] flags 0x00 dlen 7                                              #264 17.771522
      ATT: Read Response (0x0b) len 2
        Value[2]: 0000
> HCI Event: Number of Completed Packets (0x13) plen 5                                                             #265 17.932510
        Num handles: 1
        Handle: 615 Address: DF:A9:FF:F6:B1:1A (OUI DF-A9-FF)
        Count: 1
        Buffers: 0/3
        #264: len 7 (0 Kb/s)
        Latency: 160 msec (52-171 msec ~163 msec)
> ACL Data RX: Handle 615 flags 0x02 dlen 7                                                                        #266 17.932756
      ATT: Read Request (0x0a) len 2
        Handle: 0x0031
zephyr.exe[688514]: < HCI Command: Host Number of Completed Packets (0x03|0x0035) plen 5                           #267 17.951490
        Num handles: 1
        Handle: 615 Address: DF:A9:FF:F6:B1:1A (OUI DF-A9-FF)
        Count: 1
zephyr.exe[688514]: < ACL Data TX: Handle 615 [1/3] flags 0x00 dlen 13                                             #268 17.951557
      ATT: Read Response (0x0b) len 8
        Value[8]: 0123456789abcdef
> HCI Event: Number of Completed Packets (0x13) plen 5                                                             #269 18.107608
        Num handles: 1
        Handle: 615 Address: DF:A9:FF:F6:B1:1A (OUI DF-A9-FF)
        Count: 1
        Buffers: 0/3
        #268: len 13 (0 Kb/s)
        Latency: 156 msec (52-171 msec ~159 msec)
> ACL Data RX: Handle 615 flags 0x02 dlen 7                                                                        #270 18.107922
      ATT: Read Request (0x0a) len 2
        Handle: 0x000d
zephyr.exe[688514]: < HCI Command: Host Number of Completed Packets (0x03|0x0035) plen 5                           #271 18.111486
        Num handles: 1
        Handle: 615 Address: DF:A9:FF:F6:B1:1A (OUI DF-A9-FF)
        Count: 1
zephyr.exe[688514]: < ACL Data TX: Handle 615 [1/3] flags 0x00 dlen 11                                             #272 18.111512
      ATT: Read Response (0x0b) len 6
        Value[6]: 546573746572
> HCI Event: Number of Completed Packets (0x13) plen 5                                                             #273 18.282564
        Num handles: 1
        Handle: 615 Address: DF:A9:FF:F6:B1:1A (OUI DF-A9-FF)
        Count: 1
        Buffers: 0/3
        #272: len 11 (0 Kb/s)
        Latency: 171 msec (52-171 msec ~165 msec)
> ACL Data RX: Handle 615 flags 0x02 dlen 7                                                                        #274 18.282990
      ATT: Read Request (0x0a) len 2
        Handle: 0x0014
zephyr.exe[688514]: < HCI Command: Host Number of Completed Packets (0x03|0x0035) plen 5                           #275 18.291494
        Num handles: 1
        Handle: 615 Address: DF:A9:FF:F6:B1:1A (OUI DF-A9-FF)
        Count: 1
zephyr.exe[688514]: < ACL Data TX: Handle 615 [1/3] flags 0x00 dlen 11                                             #276 18.291521
      ATT: Read Response (0x0b) len 6
        Value[6]: 6e6174697665
> HCI Event: Number of Completed Packets (0x13) plen 5                                                             #277 18.457582
        Num handles: 1
        Handle: 615 Address: DF:A9:FF:F6:B1:1A (OUI DF-A9-FF)
        Count: 1
        Buffers: 0/3
        #276: len 11 (0 Kb/s)
        Latency: 166 msec (52-171 msec ~165 msec)
> ACL Data RX: Handle 615 flags 0x02 dlen 7                                                                        #278 18.457586
      ATT: Read Request (0x0a) len 2
        Handle: 0x0027
zephyr.exe[688514]: < HCI Command: Host Number of Completed Packets (0x03|0x0035) plen 5                           #279 18.471501
        Num handles: 1
        Handle: 615 Address: DF:A9:FF:F6:B1:1A (OUI DF-A9-FF)
        Count: 1
zephyr.exe[688514]: < ACL Data TX: Handle 615 [1/3] flags 0x00 dlen 9                                              #280 18.471552
      ATT: Error Response (0x01) len 4
        Read Request (0x0a)
        Handle: 0x0027
        Error: Insufficient Authentication (0x05)
> HCI Event: Number of Completed Packets (0x13) plen 5                                                             #281 18.632715
        Num handles: 1
        Handle: 615 Address: DF:A9:FF:F6:B1:1A (OUI DF-A9-FF)
        Count: 1
        Buffers: 0/3
        #280: len 9 (0 Kb/s)
        Latency: 161 msec (52-171 msec ~163 msec)
> ACL Data RX: Handle 615 flags 0x02 dlen 7                                                                        #282 18.632717
      ATT: Read Request (0x0a) len 2
        Handle: 0x003c
zephyr.exe[688514]: < HCI Command: Host Number of Completed Packets (0x03|0x0035) plen 5                           #283 18.651501
        Num handles: 1
        Handle: 615 Address: DF:A9:FF:F6:B1:1A (OUI DF-A9-FF)
        Count: 1
zephyr.exe[688514]: < ACL Data TX: Handle 615 [1/3] flags 0x00 dlen 13                                             #284 18.651555
      ATT: Read Response (0x0b) len 8
        Value[8]: 0123456789abcdef
> HCI Event: Number of Completed Packets (0x13) plen 5                                                             #285 18.807671
        Num handles: 1
        Handle: 615 Address: DF:A9:FF:F6:B1:1A (OUI DF-A9-FF)
        Count: 1
        Buffers: 0/3
        #284: len 13 (0 Kb/s)
        Latency: 156 msec (52-171 msec ~159 msec)
> ACL Data RX: Handle 615 flags 0x02 dlen 7                                                                        #286 18.807674
      ATT: Read Request (0x0a) len 2
        Handle: 0x002b
zephyr.exe[688514]: < HCI Command: Host Number of Completed Packets (0x03|0x0035) plen 5                           #287 18.811504
        Num handles: 1
        Handle: 615 Address: DF:A9:FF:F6:B1:1A (OUI DF-A9-FF)
        Count: 1
zephyr.exe[688514]: < ACL Data TX: Handle 615 [1/3] flags 0x00 dlen 13                                             #288 18.811571
      ATT: Read Response (0x0b) len 8
        Value[8]: 0123456789abcdef
> HCI Event: Number of Completed Packets (0x13) plen 5                                                             #289 18.982574
        Num handles: 1
        Handle: 615 Address: DF:A9:FF:F6:B1:1A (OUI DF-A9-FF)
        Count: 1
        Buffers: 0/3
        #288: len 13 (0 Kb/s)
        Latency: 171 msec (52-171 msec ~165 msec)
> ACL Data RX: Handle 615 flags 0x02 dlen 7                                                                        #290 18.982715
      ATT: Read Request (0x0a) len 2
        Handle: 0x001e
zephyr.exe[688514]: < HCI Command: Host Number of Completed Packets (0x03|0x0035) plen 5                           #291 18.991513
        Num handles: 1
        Handle: 615 Address: DF:A9:FF:F6:B1:1A (OUI DF-A9-FF)
        Count: 1
zephyr.exe[688514]: < ACL Data TX: Handle 615 [1/3] flags 0x00 dlen 5                                              #292 18.991565
      ATT: Read Response (0x0b) len 0
        Value[0]: 
> HCI Event: Number of Completed Packets (0x13) plen 5                                                             #293 19.157390
        Num handles: 1
        Handle: 615 Address: DF:A9:FF:F6:B1:1A (OUI DF-A9-FF)
        Count: 1
        Buffers: 0/3
        #292: len 5 (0 Kb/s)
        Latency: 165 msec (52-171 msec ~165 msec)
> ACL Data RX: Handle 615 flags 0x02 dlen 7                                                                        #294 19.157719
      ATT: Read Request (0x0a) len 2
        Handle: 0x0011
zephyr.exe[688514]: < HCI Command: Host Number of Completed Packets (0x03|0x0035) plen 5                           #295 19.171508
        Num handles: 1
        Handle: 615 Address: DF:A9:FF:F6:B1:1A (OUI DF-A9-FF)
        Count: 1
zephyr.exe[688514]: < ACL Data TX: Handle 615 [1/3] flags 0x00 dlen 13                                             #296 19.171535
      ATT: Read Response (0x0b) len 8
        Value[8]: 1800280000002a00
> HCI Event: Number of Completed Packets (0x13) plen 5                                                             #297 19.332613
        Num handles: 1
        Handle: 615 Address: DF:A9:FF:F6:B1:1A (OUI DF-A9-FF)
        Count: 1
        Buffers: 0/3
        #296: len 13 (0 Kb/s)
        Latency: 161 msec (52-171 msec ~163 msec)
> ACL Data RX: Handle 615 flags 0x02 dlen 7                                                                        #298 19.332616
      ATT: Read Request (0x0a) len 2
        Handle: 0x0042
zephyr.exe[688514]: < HCI Command: Host Number of Completed Packets (0x03|0x0035) plen 5                           #299 19.351512
        Num handles: 1
        Handle: 615 Address: DF:A9:FF:F6:B1:1A (OUI DF-A9-FF)
        Count: 1
zephyr.exe[688514]: < ACL Data TX: Handle 615 [1/3] flags 0x00 dlen 27                                             #300 19.351573
      ATT: Read Response (0x0b) len 22
        Value[22]: fedcba9876543210fedcba9876543210fedcba987654
> HCI Event: Number of Completed Packets (0x13) plen 5                                                             #301 19.507741
        Num handles: 1
        Handle: 615 Address: DF:A9:FF:F6:B1:1A (OUI DF-A9-FF)
        Count: 1
        Buffers: 0/3
        #300: len 27 (1 Kb/s)
        Latency: 156 msec (52-171 msec ~159 msec)
> ACL Data RX: Handle 615 flags 0x02 dlen 9                                                                        #302 19.507801
      ATT: Read Blob Request (0x0c) len 4
        Handle: 0x0042
        Offset: 0x0016
zephyr.exe[688514]: < HCI Command: Host Number of Completed Packets (0x03|0x0035) plen 5                           #303 19.511445
        Num handles: 1
        Handle: 615 Address: DF:A9:FF:F6:B1:1A (OUI DF-A9-FF)
        Count: 1
zephyr.exe[688514]: < ACL Data TX: Handle 615 [1/3] flags 0x00 dlen 15                                             #304 19.511451
      ATT: Read Blob Response (0x0d) len 10
        Value[10]: 3210fedcba9876543210
> HCI Event: Number of Completed Packets (0x13) plen 5                                                             #305 19.682704
        Num handles: 1
        Handle: 615 Address: DF:A9:FF:F6:B1:1A (OUI DF-A9-FF)
        Count: 1
        Buffers: 0/3
        #304: len 15 (0 Kb/s)
        Latency: 171 msec (52-171 msec ~165 msec)
> ACL Data RX: Handle 615 flags 0x02 dlen 7                                                                        #306 19.682923
      ATT: Read Request (0x0a) len 2
        Handle: 0x001c
zephyr.exe[688514]: < HCI Command: Host Number of Completed Packets (0x03|0x0035) plen 5                           #307 19.691519
        Num handles: 1
        Handle: 615 Address: DF:A9:FF:F6:B1:1A (OUI DF-A9-FF)
 