Bluetooth monitor ver 5.72
= Note: Linux version 6.14.0-36-generic (x86_64)                       0.902326
= Note: Bluetooth subsystem version 2.22                               0.902328
= New Index: 00:00:00:00:00:00 (Primary,UART,hci1)              [hci1] 0.902329
= New Index: 48:5F:99:8E:E0:64 (Primary,USB,hci0)               [hci0] 0.902330
= Open Index: 00:00:00:00:00:00                                 [hci1] 1.414002
= Index Info: 00:00:00:00:00:00 (Nordic Semiconductor ASA)      [hci1] 1.414007
@ USER Open: main (privileged) version 2.22            {0x0001} [hci1] 1.414011
< HCI Command: Reset (0x03|0x0003) plen 0                    #1 [hci1] 1.414310
> HCI Event: Command Complete (0x0e) plen 4                  #2 [hci1] 1.414890
      Reset (0x03|0x0003) ncmd 1
        Status: Success (0x00)
< HCI Command: Read Local Supported... (0x04|0x0003) plen 0  #3 [hci1] 1.433930
> HCI Event: Command Complete (0x0e) plen 12                 #4 [hci1] 1.434478
      Read Local Supported Features (0x04|0x0003) ncmd 1
        Status: Success (0x00)
        Features: 0x00 0x00 0x00 0x00 0x60 0x00 0x00 0x00
          BR/EDR Not Supported
          LE Supported (Controller)
< HCI Command: Read Local Version In.. (0x04|0x0001) plen 0  #5 [hci1] 1.453985
> HCI Event: Command Complete (0x0e) plen 12                 #6 [hci1] 1.454516
      Read Local Version Information (0x04|0x0001) ncmd 1
        Status: Success (0x00)
        HCI version: Reserved (0x0f) - Revision 12393 (0x3069)
        LMP version: Reserved (0x0f) - Subversion 12393 (0x3069)
        Manufacturer: Nordic Semiconductor ASA (89)
< HCI Command: Read Local Supported... (0x04|0x0002) plen 0  #7 [hci1] 1.473987
> HCI Event: Command Complete (0x0e) plen 68                 #8 [hci1] 1.475090
      Read Local Supported Commands (0x04|0x0002) ncmd 1
        Status: Success (0x00)
        Commands: 119 entries
          Disconnect (Octet 0 - Bit 5)
          Read Remote Version Information (Octet 2 - Bit 7)
          Set Event Mask (Octet 5 - Bit 6)
          Reset (Octet 5 - Bit 7)
          Read Connection Accept Timeout (Octet 7 - Bit 2)
          Write Connection Accept Timeout (Octet 7 - Bit 3)
          Read Transmit Power Level (Octet 10 - Bit 2)
          Set Controller To Host Flow Control (Octet 10 - Bit 5)
          Host Buffer Size (Octet 10 - Bit 6)
          Host Number of Completed Packets (Octet 10 - Bit 7)
          Read Local Version Information (Octet 14 - Bit 3)
          Read Local Supported Features (Octet 14 - Bit 5)
          Read BD ADDR (Octet 15 - Bit 1)
          Read RSSI (Octet 15 - Bit 5)
          Set Event Mask Page 2 (Octet 22 - Bit 2)
          LE Set Event Mask (Octet 25 - Bit 0)
          LE Read Buffer Size (Octet 25 - Bit 1)
          LE Read Local Supported Features (Octet 25 - Bit 2)
          LE Set Random Address (Octet 25 - Bit 4)
          LE Set Advertising Parameters (Octet 25 - Bit 5)
          LE Read Advertising Channel TX Power (Octet 25 - Bit 6)
          LE Set Advertising Data (Octet 25 - Bit 7)
          LE Set Scan Response Data (Octet 26 - Bit 0)
          LE Set Advertise Enable (Octet 26 - Bit 1)
          LE Set Scan Parameters (Octet 26 - Bit 2)
          LE Set Scan Enable (Octet 26 - Bit 3)
          LE Create Connection (Octet 26 - Bit 4)
          LE Create Connection Cancel (Octet 26 - Bit 5)
          LE Read Accept List Size (Octet 26 - Bit 6)
          LE Clear Accept List (Octet 26 - Bit 7)
          LE Add Device To Accept List (Octet 27 - Bit 0)
          LE Remove Device From Accept List (Octet 27 - Bit 1)
          LE Connection Update (Octet 27 - Bit 2)
          LE Set Host Channel Classification (Octet 27 - Bit 3)
          LE Read Channel Map (Octet 27 - Bit 4)
          LE Read Remote Used Features (Octet 27 - Bit 5)
          LE Encrypt (Octet 27 - Bit 6)
          LE Rand (Octet 27 - Bit 7)
          LE Start Encryption (Octet 28 - Bit 0)
          LE Long Term Key Request Reply (Octet 28 - Bit 1)
          LE Long Term Key Request Neg Reply (Octet 28 - Bit 2)
          LE Read Supported States (Octet 28 - Bit 3)
          LE Receiver Test (Octet 28 - Bit 4)
          LE Transmitter Test (Octet 28 - Bit 5)
          LE Test End (Octet 28 - Bit 6)
          Read Authenticated Payload Timeout (Octet 32 - Bit 4)
          Write Authenticated Payload Timeout (Octet 32 - Bit 5)
          LE Set Data Length (Octet 33 - Bit 6)
          LE Read Suggested Default Data Length (Octet 33 - Bit 7)
          LE Write Suggested Default Data Length (Octet 34 - Bit 0)
          LE Add Device To Resolving List (Octet 34 - Bit 3)
          LE Remove Device From Resolving List (Octet 34 - Bit 4)
          LE Clear Resolving List (Octet 34 - Bit 5)
          LE Read Resolving List Size (Octet 34 - Bit 6)
          LE Set Address Resolution Enable (Octet 35 - Bit 1)
          LE Set Resolvable Private Address Timeout (Octet 35 - Bit 2)
          LE Read Maximum Data Length (Octet 35 - Bit 3)
          LE Read PHY (Octet 35 - Bit 4)
          LE Set Default PHY (Octet 35 - Bit 5)
          LE Set PHY (Octet 35 - Bit 6)
          LE Enhanced Receiver Test (Octet 35 - Bit 7)
          LE Enhanced Transmitter Test (Octet 36 - Bit 0)
          LE Set Advertising Set Random Address (Octet 36 - Bit 1)
          LE Set Extended Advertising Parameters (Octet 36 - Bit 2)
          LE Set Extended Advertising Data (Octet 36 - Bit 3)
          LE Set Extended Scan Response Data (Octet 36 - Bit 4)
          LE Set Extended Advertising Enable (Octet 36 - Bit 5)
          LE Read Maximum Advertising Data Length (Octet 36 - Bit 6)
          LE Read Number of Supported Advertising Sets (Octet 36 - Bit 7)
          LE Remove Advertising Set (Octet 37 - Bit 0)
          LE Clear Advertising Sets (Octet 37 - Bit 1)
          LE Set Periodic Advertising Parameters (Octet 37 - Bit 2)
          LE Set Periodic Advertising Data (Octet 37 - Bit 3)
          LE Set Periodic Advertising Enable (Octet 37 - Bit 4)
          LE Set Extended Scan Parameters (Octet 37 - Bit 5)
          LE Set Extended Scan Enable (Octet 37 - Bit 6)
          LE Extended Create Connection (Octet 37 - Bit 7)
          LE Periodic Advertising Create Sync (Octet 38 - Bit 0)
          LE Periodic Advertising Create Sync Cancel (Octet 38 - Bit 1)
          LE Periodic Advertising Terminate Sync (Octet 38 - Bit 2)
          LE Add Device To Periodic Advertiser List (Octet 38 - Bit 3)
          LE Remove Device From Periodic Advertiser List (Octet 38 - Bit 4)
          LE Clear Periodic Advertiser List (Octet 38 - Bit 5)
          LE Read Periodic Advertiser List Size (Octet 38 - Bit 6)
          LE Read Transmit Power (Octet 38 - Bit 7)
          LE Read RF Path Compensation (Octet 39 - Bit 0)
          LE Write RF Path Compensation (Octet 39 - Bit 1)
          LE Set Privacy Mode (Octet 39 - Bit 2)
          LE Periodic Advertising Receive Enable (Octet 40 - Bit 5)
          LE Periodic Advertising Sync Transfer (Octet 40 - Bit 6)
          LE Periodic Advertising Set Info Transfer (Octet 40 - Bit 7)
          LE Periodic Advertising Sync Transfer Parameters (Octet 41 - Bit 0)
          LE Set Default Periodic Advertisng Sync Transfer Parameters (Octet 41 - Bit 1)
          LE Read Buffer v2 (Octet 41 - Bit 5)
          LE Read ISO TX Sync (Octet 41 - Bit 6)
          LE Set Connected Isochronous Group Parameters (Octet 41 - Bit 7)
          LE Set Connected Isochronous Group Parameters Test (Octet 42 - Bit 0)
          LE Create Connected Isochronous Stream (Octet 42 - Bit 1)
          LE Remove Connected Isochronous Group (Octet 42 - Bit 2)
          LE Accept Connected Isochronous Stream Request (Octet 42 - Bit 3)
          LE Reject Connected Isochronous Stream Request (Octet 42 - Bit 4)
          LE Create Broadcast Isochronous Group (Octet 42 - Bit 5)
          LE Create Broadcast Isochronous Group Test (Octet 42 - Bit 6)
          LE Terminate Broadcast Isochronous Group (Octet 42 - Bit 7)
          LE Broadcast Isochronous Group Create Sync (Octet 43 - Bit 0)
          LE Broadcast Isochronous Group Terminate Sync (Octet 43 - Bit 1)
          LE Request Peer SCA (Octet 43 - Bit 2)
          LE Setup Isochronous Data Path (Octet 43 - Bit 3)
          LE Remove Isochronous Data Path (Octet 43 - Bit 4)
          LE Isochronous Transmit Test (Octet 43 - Bit 5)
          LE Isochronous Receive Test (Octet 43 - Bit 6)
          LE Isochronous Read Test Counters (Octet 43 - Bit 7)
          LE Isochronous Read Test Counters (Octet 44 - Bit 0)
          LE Set Host Feature (Octet 44 - Bit 1)
          Octet 44 - Bit 2 
          Octet 45 - Bit 6 
          Octet 46 - Bit 0 
          Octet 46 - Bit 1 
          Octet 46 - Bit 2 
< HCI Command: Host Buffer Size (0x03|0x0033) plen 7         #9 [hci1] 1.493964
        ACL MTU: 255  ACL max packet: 16
        SCO MTU: 0    SCO max packet: 0
> HCI Event: Command Complete (0x0e) plen 4                 #10 [hci1] 1.494450
      Host Buffer Size (0x03|0x0033) ncmd 1
        Status: Success (0x00)
< HCI Command: Set Controller To Ho.. (0x03|0x0031) plen 1  #11 [hci1] 1.513928
        Flow control: ACL Data Packets (0x01)
> HCI Event: Command Complete (0x0e) plen 4                 #12 [hci1] 1.514366
      Set Controller To Host Flow Control (0x03|0x0031) ncmd 1
        Status: Success (0x00)
< HCI Command: LE Read Local Suppor.. (0x08|0x0003) plen 0  #13 [hci1] 1.533972
> HCI Event: Command Complete (0x0e) plen 12                #14 [hci1] 1.534514
      LE Read Local Supported Features (0x08|0x0003) ncmd 1
        Status: Success (0x00)
        Features: 0xfd 0x79 0x00 0xf7 0x30 0x01 0x00 0x00
          LE Encryption
          Extended Reject Indication
          Peripheral-initiated Features Exchange
          LE Ping
          LE Data Packet Length Extension
          LL Privacy
          Extended Scanner Filter Policies
          LE 2M PHY
          LE Coded PHY
          LE Extended Advertising
          LE Periodic Advertising
          Channel Selection Algorithm #2
          Periodic Advertising Sync Transfer - Sender
          Periodic Advertising Sync Transfer - Recipient
          Sleep Clock Accuracy Updates
          Connected Isochronous Stream - Central
          Connected Isochronous Stream - Peripheral
          Isochronous Broadcaster
          Synchronized Receiver
          Periodic Advertising ADI support
          Connection Subrating
          Unknown features (0x0000010000000000)
< HCI Command: LE Set Host Feature (0x08|0x0074) plen 2     #15 [hci1] 1.553988
        Bit Number: 32
          Connected Isochronous Stream (Host Support)
        Bit Value: 1
> HCI Event: Command Complete (0x0e) plen 4                 #16 [hci1] 1.554453
      LE Set Host Feature (0x08|0x0074) ncmd 1
        Status: Success (0x00)
< HCI Command: LE Read Buffer v2 (0x08|0x0060) plen 0       #17 [hci1] 1.573982
> HCI Event: Command Complete (0x0e) plen 10                #18 [hci1] 1.574490
      LE Read Buffer v2 (0x08|0x0060) ncmd 1
        Status: Success (0x00)
        ACL MTU: 27
        ACL max packet: 3
        ISO MTU: 318
        ISO max packet: 3
< HCI Command: LE Read Maximum Adve.. (0x08|0x003a) plen 0  #19 [hci1] 1.594001
> HCI Event: Command Complete (0x0e) plen 6                 #20 [hci1] 1.596842
      LE Read Maximum Advertising Data Length (0x08|0x003a) ncmd 1
        Status: Success (0x00)
        Max length: 1650
< HCI Command: LE Read Supported St.. (0x08|0x001c) plen 0  #21 [hci1] 1.613975
> HCI Event: Command Complete (0x0e) plen 12                #22 [hci1] 1.614561
      LE Read Supported States (0x08|0x001c) ncmd 1
        Status: Success (0x00)
        States: 0x000003ff3e0306ff
          Non-connectable Advertising State
          Scannable Advertising State
          Connectable Advertising State
          High Duty Cycle Directed Advertising State
          Passive Scanning State
          Active Scanning State
          Initiating State
            and Connection State (Central Role)
          Connection State (Peripheral Role)
          Scannable Advertising State
            and Passive Scanning State
          Connectable Advertising State
            and Passive Scanning State
          Non-connectable Advertising State
            and Initiating State
          Scannable Advertising State
            and Initiating State
          Active Scanning State
            and Connection State (Central Role)
          Passive Scanning State
            and Connection State (Peripheral Role)
          Active Scanning State
            and Connection State (Peripheral Role)
          Initiating State
            and Connection State (Central Role)
            and Central Role & Central Role
          Low Duty Cycle Directed Advertising State
          Connectable Advertising State
            and Initiating State
            and Central Role & Peripheral Role
          High Duty Cycle Directed Advertising State
            and Initiating State
            and Central Role & Peripheral Role
          Low Duty Cycle Directed Advertising State
            and Initiating State
            and Central Role & Peripheral Role
          Connectable Advertising State
            and Connection State (Central Role)
            and Central Role & Peripheral Role
          High Duty Cycle Directed Advertising State
            and Connection State (Central Role)
            and Central Role & Peripheral Role
          Low Duty Cycle Directed Advertising State
            and Connection State (Central Role)
            and Central Role & Peripheral Role
          Connectable Advertising State
            and Connection State (Peripheral Role)
            and Central Role & Peripheral Role
          High Duty Cycle Directed Advertising State
            and Connection State (Peripheral Role)
            and Peripheral Role & Peripheral Role
          Low Duty Cycle Directed Advertising State
            and Connection State (Peripheral Role)
            and Peripheral Role & Peripheral Role
          Initiating State
            and Connection State (Peripheral Role)
            and Central Role & Peripheral Role
< HCI Command: LE Read Maximum Data.. (0x08|0x002f) plen 0  #23 [hci1] 1.633983
> HCI Event: Command Complete (0x0e) plen 12                #24 [hci1] 1.634520
      LE Read Maximum Data Length (0x08|0x002f) ncmd 1
        Status: Success (0x00)
        Max TX octets: 251
        Max TX time: 2704
        Max RX octets: 251
        Max RX time: 2704
< HCI Command: LE Write Suggested D.. (0x08|0x0024) plen 4  #25 [hci1] 1.653958
        TX octets: 251
        TX time: 2704
> HCI Event: Command Complete (0x0e) plen 4                 #26 [hci1] 1.654553
      LE Write Suggested Default Data Length (0x08|0x0024) ncmd 1
        Status: Success (0x00)
< HCI Command: LE Read Resolving Li.. (0x08|0x002a) plen 0  #27 [hci1] 1.673997
> HCI Event: Command Complete (0x0e) plen 5                 #28 [hci1] 1.674512
      LE Read Resolving List Size (0x08|0x002a) ncmd 1
        Status: Success (0x00)
        Size: 8
< HCI Command: LE Set Event Mask (0x08|0x0001) plen 8       #29 [hci1] 1.693972
        Mask: 0x000002023f87fa5e
          LE Advertising Report
          LE Connection Update Complete
          LE Read Remote Used Features Complete
          LE Long Term Key Request
          LE Data Length Change
          LE Enhanced Connection Complete
          LE PHY Update Complete
          LE Extended Advertising Report
          LE Periodic Advertising Sync Established
          LE Periodic Advertising Report
          LE Periodic Advertising Sync Lost
          LE Extended Scan Timeout
          LE Extended Advertising Set Terminated
          LE Scan Request Received
          LE Periodic Advertising Sync Transfer Rvc
          LE CIS Established
          LE CIS Request
          LE Create BIG Complete
          LE Terminate BIG Complete
          LE BIG Sync Estabilished Complete
          LE BIG Sync Lost
          LE BIG Info Advertising Report
          Unknown mask (0x0000020000000000)
> HCI Event: Command Complete (0x0e) plen 4                 #30 [hci1] 1.694551
      LE Set Event Mask (0x08|0x0001) ncmd 1
        Status: Success (0x00)
< HCI Command: Set Event Mask (0x03|0x0001) plen 8          #31 [hci1] 1.713938
        Mask: 0x2000800002008890
          Disconnection Complete
          Encryption Change
          Read Remote Version Information Complete
          Hardware Error
          Data Buffer Overflow
          Encryption Key Refresh Complete
          LE Meta
> HCI Event: Command Complete (0x0e) plen 4                 #32 [hci1] 1.714488
      Set Event Mask (0x03|0x0001) ncmd 1
        Status: Success (0x00)
< HCI Command: Read BD ADDR (0x04|0x0009) plen 0            #33 [hci1] 1.733998
> HCI Event: Command Complete (0x0e) plen 10                #34 [hci1] 1.734454
      Read BD ADDR (0x04|0x0009) ncmd 1
        Status: Success (0x00)
        Address: 00:00:00:00:00:00 (OUI 00-00-00)
< HCI Command: LE Set Random Address (0x08|0x0005) plen 6   #35 [hci1] 1.754004
        Address: D5:B6:CC:31:DB:3B (Static)
> HCI Event: Command Complete (0x0e) plen 4                 #36 [hci1] 1.754511
      LE Set Random Address (0x08|0x0005) ncmd 1
        Status: Success (0x00)
< HCI Command: LE Extended Create... (0x08|0x0043) plen 26  #37 [hci1] 4.024002
        Filter policy: Accept list is not used (0x00)
        Own address type: Random (0x01)
        Peer address type: Public (0x00)
        Peer address: DF:A9:FF:F6:B1:1A (OUI DF-A9-FF)
        Initiating PHYs: 0x01
        Entry 0: LE 1M
          Scan interval: 60.000 msec (0x0060)
          Scan window: 60.000 msec (0x0060)
          Min connection interval: 30.00 msec (0x0018)
          Max connection interval: 50.00 msec (0x0028)
          Connection latency: 0 (0x0000)
          Supervision timeout: 4000 msec (0x0190)
          Min connection length: 0.000 msec (0x0000)
          Max connection length: 0.000 msec (0x0000)
> HCI Event: Command Status (0x0f) plen 4                   #38 [hci1] 4.024957
      LE Extended Create Connection (0x08|0x0043) ncmd 1
        Status: Success (0x00)
> HCI Event: LE Meta Event (0x3e) plen 31                   #39 [hci1] 4.050574
      LE Enhanced Connection Complete (0x0a)
        Status: Success (0x00)
        Handle: 684
        Role: Central (0x00)
        Peer address type: Public (0x00)
        Peer address: DF:A9:FF:F6:B1:1A (OUI DF-A9-FF)
        Local resolvable private address: 00:00:00:00:00:00 (Non-Resolvable)
        Peer resolvable private address: 00:00:00:00:00:00 (Non-Resolvable)
        Connection interval: 50.00 msec (0x0028)
        Connection latency: 0 (0x0000)
        Supervision timeout: 4000 msec (0x0190)
        Central clock accuracy: 0x00
< HCI Command: LE Read Remote Used... (0x08|0x0016) plen 2  #40 [hci1] 4.054155
        Handle: 684 Address: DF:A9:FF:F6:B1:1A (OUI DF-A9-FF)
> HCI Event: Command Status (0x0f) plen 4                   #41 [hci1] 4.054578
      LE Read Remote Used Features (0x08|0x0016) ncmd 1
        Status: Success (0x00)
< HCI Command: LE Set PHY (0x08|0x0032) plen 7              #42 [hci1] 4.073977
        Handle: 684 Address: DF:A9:FF:F6:B1:1A (OUI DF-A9-FF)
        All PHYs preference: 0x00
        TX PHYs preference: 0x02
          LE 2M
        RX PHYs preference: 0x02
          LE 2M
        PHY options preference: Reserved (0x0000)
> HCI Event: Command Status (0x0f) plen 4                   #43 [hci1] 4.074618
      LE Set PHY (0x08|0x0032) ncmd 1
        Status: Success (0x00)
> HCI Event: LE Meta Event (0x3e) plen 12                   #44 [hci1] 4.201963
      LE Read Remote Used Features (0x04)
        Status: Success (0x00)
        Handle: 684 Address: DF:A9:FF:F6:B1:1A (OUI DF-A9-FF)
        Features: 0x2d 0x49 0x00 0xf7 0x67 0xd8 0x00 0x00
          LE Encryption
          Extended Reject Indication
          Peripheral-initiated Features Exchange
          LE Data Packet Length Extension
          LE 2M PHY
          LE Coded PHY
          Channel Selection Algorithm #2
          Periodic Advertising Sync Transfer - Sender
          Periodic Advertising Sync Transfer - Recipient
          Sleep Clock Accuracy Updates
          Connected Isochronous Stream - Central
          Connected Isochronous Stream - Peripheral
          Isochronous Broadcaster
          Synchronized Receiver
          Connected Isochronous Stream (Host Support)
          LE Power Control Request
          LE Power Control Request
          Connection Subrating
          Connection Subrating (Host Support)
          Unknown features (0x0000d80000000000)
> HCI Event: LE Meta Event (0x3e) plen 6                    #45 [hci1] 4.701352
      LE PHY Update Complete (0x0c)
        Status: Success (0x00)
        Handle: 684 Address: DF:A9:FF:F6:B1:1A (OUI DF-A9-FF)
        TX PHY: LE 2M (0x02)
        RX PHY: LE 2M (0x02)
< ACL Data TX: Handle 684 flags 0x00 dlen 11                #46 [hci1] 5.154073
      SMP: Pairing Request (0x01) len 6
        IO capability: KeyboardOnly (0x02)
        OOB data: Authentication data not present (0x00)
        Authentication requirement: No bonding, No MITM, SC, No Keypresses (0x08)
        Max encryption key size: 16
        Initiator key distribution: <none> (0x00)
        Responder key distribution: <none> (0x00)
> HCI Event: Number of Completed Packets (0x13) plen 5      #47 [hci1] 5.201923
        Num handles: 1
        Handle: 684 Address: DF:A9:FF:F6:B1:1A (OUI DF-A9-FF)
        Count: 1
        #46: len 11 (1 Kb/s)
        Latency: 47 msec (47-47 msec ~47 msec)
> ACL Data RX: Handle 684 flags 0x02 dlen 11                #48 [hci1] 5.251894
      SMP: Pairing Response (0x02) len 6
        IO capability: KeyboardOnly (0x02)
        OOB data: Authentication data not present (0x00)
        Authentication requirement: No bonding, MITM, SC, No Keypresses (0x0c)
        Max encryption key size: 16
        Initiator key distribution: <none> (0x00)
        Responder key distribution: <none> (0x00)
< HCI Command: Host Number of Compl.. (0x03|0x0035) plen 5  #49 [hci1] 5.254255
        Num handles: 1
        Handle: 684 Address: DF:A9:FF:F6:B1:1A (OUI DF-A9-FF)
        Count: 1
< ACL Data TX: Handle 684 flags 0x00 dlen 27                #50 [hci1] 5.254350
< ACL Data TX: Handle 684 flags 0x01 dlen 27                #51 [hci1] 5.254378
< ACL Data TX: Handle 684 flags 0x01 dlen 15                #52 [hci1] 5.254381
      SMP: Pairing Public Key (0x0c) len 64
        X: 98308440221e2d910f0e54b71e7ec652857aa9b5a0dc65028824cc19db1226e9
        Y: 67a4816bcb62efb21701e31fdb27561a6217575fb007a8bbdabe7e28b6f68482
> HCI Event: Number of Completed Packets (0x13) plen 5      #53 [hci1] 5.301818
        Num handles: 1
        Handle: 684 Address: DF:A9:FF:F6:B1:1A (OUI DF-A9-FF)
        Count: 1
        #50: len 27 (4 Kb/s)
        Latency: 47 msec (47-47 msec ~47 msec)
> HCI Event: Number of Completed Packets (0x13) plen 5      #54 [hci1] 5.302316
        Num handles: 1
        Handle: 684 Address: DF:A9:FF:F6:B1:1A (OUI DF-A9-FF)
        Count: 1
        #51: len 27 (4 Kb/s)
        Latency: 47 msec (47-47 msec ~47 msec)
> HCI Event: Number of Completed Packets (0x13) plen 5      #55 [hci1] 5.302857
        Num handles: 1
        Handle: 684 Address: DF:A9:FF:F6:B1:1A (OUI DF-A9-FF)
        Count: 1
        #52: len 15 (2 Kb/s)
        Latency: 48 msec (47-48 msec ~48 msec)
> ACL Data RX: Handle 684 flags 0x02 dlen 27                #56 [hci1] 5.352067
> ACL Data RX: Handle 684 flags 0x01 dlen 27                #57 [hci1] 5.352495
> ACL Data RX: Handle 684 flags 0x01 dlen 15                #58 [hci1] 5.352929
      SMP: Pairing Public Key (0x0c) len 64
        X: 115cf521d0515096d6ccc0e4dd027258759cf44eef4d4a723d97e031023be09d
        Y: 1ec0b8f34f1392ec9ad4909db3ffa11b3968c238b41d6bb32e8cf3f3b7572e56
< HCI Command: Host Number of Compl.. (0x03|0x0035) plen 5  #59 [hci1] 5.354140
        Num handles: 1
        Handle: 684 Address: DF:A9:FF:F6:B1:1A (OUI DF-A9-FF)
        Count: 1
< HCI Command: Host Number of Compl.. (0x03|0x0035) plen 5  #60 [hci1] 5.354286
        Num handles: 1
        Handle: 684 Address: DF:A9:FF:F6:B1:1A (OUI DF-A9-FF)
        Count: 1
< HCI Command: Host Number of Compl.. (0x03|0x0035) plen 5  #61 [hci1] 5.354354
        Num handles: 1
        Handle: 684 Address: DF:A9:FF:F6:B1:1A (OUI DF-A9-FF)
        Count: 1
< ACL Data TX: Handle 684 flags 0x00 dlen 21                #62 [hci1] 6.194819
      SMP: Pairing Confirm (0x03) len 16
        Confim value: 554ea6387034e007f689ce2eb2b77169
> HCI Event: Number of Completed Packets (0x13) plen 5      #63 [hci1] 6.201936
        Num handles: 1
        Handle: 684 Address: DF:A9:FF:F6:B1:1A (OUI DF-A9-FF)
        Count: 1
        #62: len 21 (24 Kb/s)
        Latency: 7 msec (7-48 msec ~27 msec)
> ACL Data RX: Handle 684 flags 0x02 dlen 21                #64 [hci1] 6.251997
      SMP: Pairing Confirm (0x03) len 16
        Confim value: 15536b07670cedf9bc1473060fcfb3d3
< HCI Command: Host Number of Compl.. (0x03|0x0035) plen 5  #65 [hci1] 6.254315
        Num handles: 1
        Handle: 684 Address: DF:A9:FF:F6:B1:1A (OUI DF-A9-FF)
        Count: 1
< ACL Data TX: Handle 684 flags 0x00 dlen 21                #66 [hci1] 6.254402
      SMP: Pairing Random (0x04) len 16
        Random value: 8e6108f966a694cbe26df70bb96773e6
> HCI Event: Number of Completed Packets (0x13) plen 5      #67 [hci1] 6.301849
        Num handles: 1
        Handle: 684 Address: DF:A9:FF:F6:B1:1A (OUI DF-A9-FF)
        Count: 1
        #66: len 21 (3 Kb/s)
        Latency: 47 msec (7-48 msec ~37 msec)
> ACL Data RX: Handle 684 flags 0x02 dlen 21                #68 [hci1] 6.552059
      SMP: Pairing Random (0x04) len 16
        Random value: a3eedb7d9c7723374a92db96d3ed6cb2
< HCI Command: Host Number of Compl.. (0x03|0x0035) plen 5  #69 [hci1] 6.554721
        Num handles: 1
        Handle: 684 Address: DF:A9:FF:F6:B1:1A (OUI DF-A9-FF)
        Count: 1
< ACL Data TX: Handle 684 flags 0x00 dlen 21                #70 [hci1] 6.554944
      SMP: Pairing Confirm (0x03) len 16
        Confim value: c45df3cf65cb4260bbc555031695d21f
> HCI Event: Number of Completed Packets (0x13) plen 5      #71 [hci1] 6.601824
        Num handles: 1
        Handle: 684 Address: DF:A9:FF:F6:B1:1A (OUI DF-A9-FF)
        Count: 1
        #70: len 21 (3 Kb/s)
        Latency: 46 msec (7-48 msec ~42 msec)
> ACL Data RX: Handle 684 flags 0x02 dlen 21                #72 [hci1] 6.652001
      SMP: Pairing Confirm (0x03) len 16
        Confim value: 28d6530ccae6e3bae53b622b93c09d2c
< HCI Command: Host Number of Compl.. (0x03|0x0035) plen 5  #73 [hci1] 6.654448
        Num handles: 1
        Handle: 684 Address: DF:A9:FF:F6:B1:1A (OUI DF-A9-FF)
        Count: 1
< ACL Data TX: Handle 684 flags 0x00 dlen 21                #74 [hci1] 6.654631
      SMP: Pairing Random (0x04) len 16
        Random value: 5da095555cc64d02679f89a05211af56
> HCI Event: Number of Completed Packets (0x13) plen 5      #75 [hci1] 6.701800
        Num handles: 1
        Handle: 684 Address: DF:A9:FF:F6:B1:1A (OUI DF-A9-FF)
        Count: 1
        #74: len 21 (3 Kb/s)
        Latency: 47 msec (7-48 msec ~44 msec)
> ACL Data RX: Handle 684 flags 0x02 dlen 21                #76 [hci1] 6.952099
      SMP: Pairing Random (0x04) len 16
        Random value: 1e1b3d1a285e9797c453bf05e10f536a
< HCI Command: Host Number of Compl.. (0x03|0x0035) plen 5  #77 [hci1] 6.954338
        Num handles: 1
        Handle: 684 Address: DF:A9:FF:F6:B1:1A (OUI DF-A9-FF)
        Count: 1
< ACL Data TX: Handle 684 flags 0x00 dlen 21                #78 [hci1] 6.954469
      SMP: Pairing Confirm (0x03) len 16
        Confim value: bba92ed9e4d3b2904b7fee39d2fb419c
> HCI Event: Number of Completed Packets (0x13) plen 5      #79 [hci1] 7.001895
        Num handles: 1
        Handle: 684 Address: DF:A9:FF:F6:B1:1A (OUI DF-A9-FF)
        Count: 1
        #78: len 21 (3 Kb/s)
        Latency: 47 msec (7-48 msec ~46 msec)
> ACL Data RX: Handle 684 flags 0x02 dlen 21                #80 [hci1] 7.052015
      SMP: Pairing Confirm (0x03) len 16
        Confim value: 764b12a3251fab2af5d5b771c06749fd
< HCI Command: Host Number of Compl.. (0x03|0x0035) plen 5  #81 [hci1] 7.054426
        Num handles: 1
        Handle: 684 Address: DF:A9:FF:F6:B1:1A (OUI DF-A9-FF)
        Count: 1
< ACL Data TX: Handle 684 flags 0x00 dlen 21                #82 [hci1] 7.054519
      SMP: Pairing Random (0x04) len 16
        Random value: da64d21ec8845e8286bc235a02440d0c
> HCI Event: Number of Completed Packets (0x13) plen 5      #83 [hci1] 7.101907
        Num handles: 1
        Handle: 684 Address: DF:A9:FF:F6:B1:1A (OUI DF-A9-FF)
        Count: 1
        #82: len 21 (3 Kb/s)
        Latency: 47 msec (7-48 msec ~46 msec)
> ACL Data RX: Handle 684 flags 0x02 dlen 21                #84 [hci1] 7.352009
      SMP: Pairing Random (0x04) len 16
        Random value: c0164bd91a52f50455e6a2cfec0ee1ef
< HCI Command: Host Number of Compl.. (0x03|0x0035) plen 5  #85 [hci1] 7.354654
        Num handles: 1
        Handle: 684 Address: DF:A9:FF:F6:B1:1A (OUI DF-A9-FF)
        Count: 1
< ACL Data TX: Handle 684 flags 0x00 dlen 21                #86 [hci1] 7.354907
      SMP: Pairing Confirm (0x03) len 16
        Confim value: a4b7adbcb30cb9a8223d882eb6ee4445
> HCI Event: Number of Completed Packets (0x13) plen 5      #87 [hci1] 7.401891
        Num handles: 1
        Handle: 684 Address: DF:A9:FF:F6:B1:1A (OUI DF-A9-FF)
        Count: 1
        #86: len 21 (3 Kb/s)
        Latency: 46 msec (7-48 msec ~46 msec)
> ACL Data RX: Handle 684 flags 0x02 dlen 21                #88 [hci1] 7.452035
      SMP: Pairing Confirm (0x03) len 16
        Confim value: 4d494757d07b0ce6e7b40a073f0bcb7b
< HCI Command: Host Number of Compl.. (0x03|0x0035) plen 5  #89 [hci1] 7.454485
        Num handles: 1
        Handle: 684 Address: DF:A9:FF:F6:B1:1A (OUI DF-A9-FF)
        Count: 1
< ACL Data TX: Handle 684 flags 0x00 dlen 21                #90 [hci1] 7.454787
      SMP: Pairing Random (0x04) len 16
        Random value: a2acf8fd71a45c4a1bcadd27bd58e945
> HCI Event: Number of Completed Packets (0x13) plen 5      #91 [hci1] 7.501798
        Num handles: 1
        Handle: 684 Address: DF:A9:FF:F6:B1:1A (OUI DF-A9-FF)
        Count: 1
        #90: len 21 (3 Kb/s)
        Latency: 47 msec (7-48 msec ~46 msec)
> ACL Data RX: Handle 684 flags 0x02 dlen 21                #92 [hci1] 7.752134
      SMP: Pairing Random (0x04) len 16
        Random value: 1a044df6b1eab8aaed522c11945eee4f
< HCI Command: Host Number of Compl.. (0x03|0x0035) plen 5  #93 [hci1] 7.754531
        Num handles: 1
        Handle: 684 Address: DF:A9:FF:F6:B1:1A (OUI DF-A9-FF)
        Count: 1
< ACL Data TX: Handle 684 flags 0x00 dlen 21                #94 [hci1] 7.754673
      SMP: Pairing Confirm (0x03) len 16
        Confim value: 1923877eb6e49465c03757be6296f573
> HCI Event: Number of Completed Packets (0x13) plen 5      #95 [hci1] 7.801844
        Num handles: 1
        Handle: 684 Address: DF:A9:FF:F6:B1:1A (OUI DF-A9-FF)
        Count: 1
        #94: len 21 (3 Kb/s)
        Latency: 47 msec (7-48 msec ~47 msec)
> ACL Data RX: Handle 684 flags 0x02 dlen 21                #96 [hci1] 7.851956
      SMP: Pairing Confirm (0x03) len 16
        Confim value: cc21cd3c3dded1449568b6654f99bfd0
< HCI Command: Host Number of Compl.. (0x03|0x0035) plen 5  #97 [hci1] 7.854195
        Num handles: 1
        Handle: 684 Address: DF:A9:FF:F6:B1:1A (OUI DF-A9-FF)
        Count: 1
< ACL Data TX: Handle 684 flags 0x00 dlen 21                #98 [hci1] 7.854325
      SMP: Pairing Random (0x04) len 16
        Random value: 00bad7aca1ba32527e6e64e79f33b2e3
> HCI Event: Number of Completed Packets (0x13) plen 5      #99 [hci1] 7.901826
        Num handles: 1
        Handle: 684 Address: DF:A9:FF:F6:B1:1A (OUI DF-A9-FF)
        Count: 1
        #98: len 21 (3 Kb/s)
        Latency: 47 msec (7-48 msec ~47 msec)
> ACL Data RX: Handle 684 flags 0x02 dlen 21               #100 [hci1] 8.152037
      SMP: Pairing Random (0x04) len 16
        Random value: fe49cdee6ffb98f7bddb4828bab494d6
< HCI Command: Host Number of Comp.. (0x03|0x0035) plen 5  #101 [hci1] 8.154593
        Num handles: 1
        Handle: 684 Address: DF:A9:FF:F6:B1:1A (OUI DF-A9-FF)
        Count: 1
< ACL Data TX: Handle 684 flags 0x00 dlen 21               #102 [hci1] 8.154773
      SMP: Pairing Confirm (0x03) len 16
        Confim value: 7777d7a028491a2f62e639c8b707f5d3
> HCI Event: Number of Completed Packets (0x13) plen 5     #103 [hci1] 8.201727
        Num handles: 1
        Handle: 684 Address: DF:A9:FF:F6:B1:1A (OUI DF-A9-FF)
        Count: 1
        #102: len 21 (3 Kb/s)
        Latency: 46 msec (7-48 msec ~47 msec)
> ACL Data RX: Handle 684 flags 0x02 dlen 21               #104 [hci1] 8.252058
      SMP: Pairing Confirm (0x03) len 16
        Confim value: 070f038078fd033e1d9aeb5aa5bebeff
< HCI Command: Host Number of Comp.. (0x03|0x0035) plen 5  #105 [hci1] 8.254280
        Num handles: 1
        Handle: 684 Address: DF:A9:FF:F6:B1:1A (OUI DF-A9-FF)
        Count: 1
< ACL Data TX: Handle 684 flags 0x00 dlen 21               #106 [hci1] 8.254501
      SMP: Pairing Random (0x04) len 16
        Random value: 4db8ab2d95badddbdfe2838e9a8cc696
> HCI Event: Number of Completed Packets (0x13) plen 5     #107 [hci1] 8.301846
        Num handles: 1
        Handle: 684 Address: DF:A9:FF:F6:B1:1A (OUI DF-A9-FF)
        Count: 1
        #106: len 21 (3 Kb/s)
        Latency: 47 msec (7-48 msec ~47 msec)
> ACL Data RX: Handle 684 flags 0x02 dlen 21               #108 [hci1] 8.552107
      SMP: Pairing Random (0x04) len 16
        Random value: 7b8b937f14998e9637061eb280042c13
< HCI Command: Host Number of Comp.. (0x03|0x0035) plen 5  #109 [hci1] 8.554673
        Num handles: 1
        Handle: 684 Address: DF:A9:FF:F6:B1:1A (OUI DF-A9-FF)
        Count: 1
< ACL Data TX: Handle 684 flags 0x00 dlen 21               #110 [hci1] 8.554893
      SMP: Pairing Confirm (0x03) len 16
        Confim value: 59a1cbcc4ece40865513d65a911846d1
> HCI Event: Number of Completed Packets (0x13) plen 5     #111 [hci1] 8.601801
        Num handles: 1
        Handle: 684 Address: DF:A9:FF:F6:B1:1A (OUI DF-A9-FF)
        Count: 1
        #110: len 21 (3 Kb/s)
        Latency: 46 msec (7-48 msec ~47 msec)
> ACL Data RX: Handle 684 flags 0x02 dlen 21               #112 [hci1] 8.652127
      SMP: Pairing Confirm (0x03) len 16
        Confim value: e988863a39018bd1568dae9c10d3dc65
< HCI Command: Host Number of Comp.. (0x03|0x0035) plen 5  #113 [hci1] 8.654481
        Num handles: 1
        Handle: 684 Address: DF:A9:FF:F6:B1:1A (OUI DF-A9-FF)
        Count: 1
< ACL Data TX: Handle 684 flags 0x00 dlen 21               #114 [hci1] 8.654680
      SMP: Pairing Random (0x04) len 16
        Random value: c850fef72c5ceb9f1915536596b6fc3d
> HCI Event: Number of Completed Packets (0x13) plen 5     #115 [hci1] 8.701934
        Num handles: 1
        Handle: 684 Address: DF:A9:FF:F6:B1:1A (OUI DF-A9-FF)
        Count: 1
        #114: len 21 (3 Kb/s)
        Latency: 47 msec (7-48 msec ~47 msec)
> ACL Data RX: Handle 684 flags 0x02 dlen 21               #116 [hci1] 8.952009
      SMP: Pairing Random (0x04) len 16
        Random value: e3afa8a6a319d3760c98178a46854fd1
< HCI Command: Host Number of Comp.. (0x03|0x0035) plen 5  #117 [hci1] 8.954578
        Num handles: 1
        Handle: 684 Address: DF:A9:FF:F6:B1:1A (OUI DF-A9-FF)
        Count: 1
< ACL Data TX: Handle 684 flags 0x00 dlen 21               #118 [hci1] 8.954723
      SMP: Pairing Confirm (0x03) len 16
        Confim value: 978229c775ba2782d3d6c61e5c2488e1
> HCI Event: Number of Completed Packets (0x13) plen 5     #119 [hci1] 9.001870
        Num handles: 1
        Handle: 684 Address: DF:A9:FF:F6:B1:1A (OUI DF-A9-FF)
        Count: 1
        #118: len 21 (3 Kb/s)
        Latency: 47 msec (7-48 msec ~47 msec)
> ACL Data RX: Handle 684 flags 0x02 dlen 21               #120 [hci1] 9.052012
      SMP: Pairing Confirm (0x03) len 16
        Confim value: 469d05edfff77cf61e31e2665660ef92
< HCI Command: Host Number of Comp.. (0x03|0x0035) plen 5  #121 [hci1] 9.054422
        Num handles: 1
        Handle: 684 Address: DF:A9:FF:F6:B1:1A (OUI DF-A9-FF)
        Count: 1
< ACL Data TX: Handle 684 flags 0x00 dlen 21               #122 [hci1] 9.054601
      SMP: Pairing Random (0x04) len 16
        Random value: 6b2b19701bcf5c794dc9ad9f2c3f295e
> HCI Event: Number of Completed Packets (0x13) plen 5     #123 [hci1] 9.101767
        Num handles: 1
        Handle: 684 Address: DF:A9:FF:F6:B1:1A (OUI DF-A9-FF)
        Count: 1
        #122: len 21 (3 Kb/s)
        Latency: 47 msec (7-48 msec ~47 msec)
> ACL Data RX: Handle 684 flags 0x02 dlen 21               #124 [hci1] 9.351918
      SMP: Pairing Random (0x04) len 16
        Random value: c8d9569f5b10e1c42c96dbceadaad51e
< HCI Command: Host Number of Comp.. (0x03|0x0035) plen 5  #125 [hci1] 9.354645
        Num handles: 1
        Handle: 684 Address: DF:A9:FF:F6:B1:1A (OUI DF-A9-FF)
        Count: 1
< ACL Data TX: Handle 684 flags 0x00 dlen 21               #126 [hci1] 9.354857
      SMP: Pairing Confirm (0x03) len 16
        Confim value: 0a90b7918ad02c9cf2c9520c62402074
> HCI Event: Number of Completed Packets (0x13) plen 5     #127 [hci1] 9.401773
        Num handles: 1
        Handle: 684 Address: DF:A9:FF:F6:B1:1A (OUI DF-A9-FF)
        Count: 1
        #126: len 21 (3 Kb/s)
        Latency: 46 msec (7-48 msec ~47 msec)
> ACL Data RX: Handle 684 flags 0x02 dlen 21               #128 [hci1] 9.452072
      SMP: Pairing Confirm (0x03) len 16
        Confim value: e17b3503519f702469121f9e6d904781
< HCI Command: Host Number of Comp.. (0x03|0x0035) plen 5  #129 [hci1] 9.454368
        Num handles: 1
        Handle: 684 Address: DF:A9:FF:F6:B1:1A (OUI DF-A9-FF)
        Count: 1
< ACL Data TX: Handle 684 flags 0x00 dlen 21               #130 [hci1] 9.454492
      SMP: Pairing Random (0x04) len 16
        Random value: d5e1c3cfeb215c2fff312cdf99c94919
> HCI Event: Number of Completed Packets (0x13) plen 5     #131 [hci1] 9.501771
        Num handles: 1
        Handle: 684 Address: DF:A9:FF:F6:B1:1A (OUI DF-A9-FF)
        Count: 1
        #130: len 21 (3 Kb/s)
        Latency: 47 msec (7-48 msec ~47 msec)
> ACL Data RX: Handle 684 flags 0x02 dlen 21               #132 [hci1] 9.752006
      SMP: Pairing Random (0x04) len 16
        Random value: f96f26e8bf5470ebc94655db9729d847
< HCI Command: Host Number of Comp.. (0x03|0x0035) plen 5  #133 [hci1] 9.754558
        Num handles: 1
        Handle: 684 Address: DF:A9:FF:F6:B1:1A (OUI DF-A9-FF)
        Count: 1
< ACL Data TX: Handle 684 flags 0x00 dlen 21               #134 [hci1] 9.754773
      SMP: Pairing Confirm (0x03) len 16
        Confim value: 0cb30429648b48ac1428935f8dd41dda
> HCI Event: Number of Completed Packets (0x13) plen 5     #135 [hci1] 9.801778
        Num handles: 1
        Handle: 684 Address: DF:A9:FF:F6:B1:1A (OUI DF-A9-FF)
        Count: 1
        #134: len 21 (3 Kb/s)
        Latency: 47 msec (7-48 msec ~47 msec)
> ACL Data RX: Handle 684 flags 0x02 dlen 21               #136 [hci1] 9.851951
      SMP: Pairing Confirm (0x03) len 16
        Confim value: f8340ecef450593f29d9fc4b500279b8
< HCI Command: Host Number of Comp.. (0x03|0x0035) plen 5  #137 [hci1] 9.854288
        Num handles: 1
        Handle: 684 Address: DF:A9:FF:F6:B1:1A (OUI DF-A9-FF)
        Count: 1
< ACL Data TX: Handle 684 flags 0x00 dlen 21               #138 [hci1] 9.854346
      SMP: Pairing Random (0x04) len 16
        Random value: 77355a9a8321c629a3a987d808e80865
> HCI Event: Number of Completed Packets (0x13) plen 5     #139 [hci1] 9.901804
        Num handles: 1
        Handle: 684 Address: DF:A9:FF:F6:B1:1A (OUI DF-A9-FF)
        Count: 1
        #138: len 21 (3 Kb/s)
        Latency: 47 msec (7-48 msec ~47 msec)
> ACL Data RX: Handle 684 flags 0x02 dlen 21              #140 [hci1] 10.151976
      SMP: Pairing Random (0x04) len 16
        Random value: 8915e03d8efa799a542bac4e24f7b1d8
< HCI Command: Host Number of Com.. (0x03|0x0035) plen 5  #141 [hci1] 10.154341
        Num handles: 1
        Handle: 684 Address: DF:A9:FF:F6:B1:1A (OUI DF-A9-FF)
        Count: 1
< ACL Data TX: Handle 684 flags 0x00 dlen 21              #142 [hci1] 10.154479
      SMP: Pairing Confirm (0x03) len 16
        Confim value: ef4008a211c014b35c8c55fcc7ed12c0
> HCI Event: Number of Completed Packets (0x13) plen 5    #143 [hci1] 10.201756
        Num handles: 1
        Handle: 684 Address: DF:A9:FF:F6:B1:1A (OUI DF-A9-FF)
        Count: 1
        #142: len 21 (3 Kb/s)
        Latency: 47 msec (7-48 msec ~47 msec)
> ACL Data RX: Handle 684 flags 0x02 dlen 21              #144 [hci1] 10.252088
      SMP: Pairing Confirm (0x03) len 16
        Confim value: afcf216d91c8de30dc94b753da0caebc
< HCI Command: Host Number of Com.. (0x03|0x0035) plen 5  #145 [hci1] 10.254494
        Num handles: 1
        Handle: 684 Address: DF:A9:FF:F6:B1:1A (OUI DF-A9-FF)
        Count: 1
< ACL Data TX: Handle 684 flags 0x00 dlen 21              #146 [hci1] 10.254814
      SMP: Pairing Random (0x04) len 16
        Random value: 8dfc1155a0b492f20f6ad8f13724432c
> HCI Event: Number of Completed Packets (0x13) plen 5    #147 [hci1] 10.301792
        Num handles: 1
        Handle: 684 Address: DF:A9:FF:F6:B1:1A (OUI DF-A9-FF)
        Count: 1
        #146: len 21 (3 Kb/s)
        Latency: 46 msec (7-48 msec ~47 msec)
> ACL Data RX: Handle 684 flags 0x02 dlen 21              #148 [hci1] 10.551956
      SMP: Pairing Random (0x04) len 16
        Random value: c8b28d9bc95635bd7d0c4b05b549f8a0
< HCI Command: Host Number of Com.. (0x03|0x0035) plen 5  #149 [hci1] 10.554684
        Num handles: 1
        Handle: 684 Address: DF:A9:FF:F6:B1:1A (OUI DF-A9-FF)
        Count: 1
< ACL Data TX: Handle 684 flags 0x00 dlen 21              #150 [hci1] 10.554927
      SMP: Pairing Confirm (0x03) len 16
        Confim value: c80d890475a4514adc719d7d1453149c
> HCI Event: Number of Completed Packets (0x13) plen 5    #151 [hci1] 10.601904
        Num handles: 1
        Handle: 684 Address: DF:A9:FF:F6:B1:1A (OUI DF-A9-FF)
        Count: 1
        #150: len 21 (3 Kb/s)
        Latency: 46 msec (7-48 msec ~47 msec)
> ACL Data RX: Handle 684 flags 0x02 dlen 21              #152 [hci1] 10.652083
      SMP: Pairing Confirm (0x03) len 16
        Confim value: b3a524789ee8242a32dbd84368ce8100
< HCI Command: Host Number of Com.. (0x03|0x0035) plen 5  #153 [hci1] 10.654537
        Num handles: 1
        Handle: 684 Address: DF:A9:FF:F6:B1:1A (OUI DF-A9-FF)
        Count: 1
< ACL Data TX: Handle 684 flags 0x00 dlen 21              #154 [hci1] 10.654757
      SMP: Pairing Random (0x04) len 16
        Random value: 001c45ff744123ac32ebbb5e14c8a6b9
> HCI Event: Number of Completed Packets (0x13) plen 5    #155 [hci1] 10.701716
        Num handles: 1
        Handle: 684 Address: DF:A9:FF:F6:B1:1A (OUI DF-A9-FF)
        Count: 1
        #154: len 21 (3 Kb/s)
        Latency: 46 msec (7-48 msec ~47 msec)
> ACL Data RX: Handle 684 flags 0x02 dlen 21              #156 [hci1] 10.952001
      SMP: Pairing Random (0x04) len 16
        Random value: 47687741b3fd1d8136edd91bec9487aa
< HCI Command: Host Number of Com.. (0x03|0x0035) plen 5  #157 [hci1] 10.954642
        Num handles: 1
        Handle: 684 Address: DF:A9:FF:F6:B1:1A (OUI DF-A9-FF)
        Count: 1
< ACL Data TX: Handle 684 flags 0x00 dlen 21              #158 [hci1] 10.954789
      SMP: Pairing Confirm (0x03) len 16
        Confim value: a637ea4e7c5e6f7019c5db40240f3cf8
> HCI Event: Number of Completed Packets (0x13) plen 5    #159 [hci1] 11.001792
        Num handles: 1
        Handle: 684 Address: DF:A9:FF:F6:B1:1A (OUI DF-A9-FF)
        Count: 1
        #158: len 21 (3 Kb/s)
        Latency: 47 msec (7-48 msec ~47 msec)
> ACL Data RX: Handle 684 flags 0x02 dlen 21              #160 [hci1] 11.051956
      SMP: Pairing Confirm (0x03) len 16
        Confim value: 6aa9c4b4464a740cbc11a51e5ac78535
< HCI Command: Host Number of Com.. (0x03|0x0035) plen 5  #161 [hci1] 11.054507
        Num handles: 1
        Handle: 684 Address: DF:A9:FF:F6:B1:1A (OUI DF-A9-FF)
        Count: 1
< ACL Data TX: Handle 684 flags 0x00 dlen 21              #162 [hci1] 11.054741
      SMP: Pairing Random (0x04) len 16
        Random value: 296d277ff3bf297efe85e67448a15f56
> HCI Event: Number of Completed Packets (0x13) plen 5    #163 [hci1] 11.101696
        Num handles: 1
        Handle: 684 Address: DF:A9:FF:F6:B1:1A (OUI DF-A9-FF)
        Count: 1
        #162: len 21 (3 Kb/s)
        Latency: 46 msec (7-48 msec ~46 msec)
> ACL Data RX: Handle 684 flags 0x02 dlen 21              #164 [hci1] 11.351958
      SMP: Pairing Random (0x04) len 16
        Random value: d79f26a9ccc4eb54af1341eea98d7743
< HCI Command: Host Number of Com.. (0x03|0x0035) plen 5  #165 [hci1] 11.354367
        Num handles: 1
        Handle: 684 Address: DF:A9:FF:F6:B1:1A (OUI DF-A9-FF)
        Count: 1
< ACL Data TX: Handle 684 flags 0x00 dlen 21              #166 [hci1] 11.354505
      SMP: Pairing Confirm (0x03) len 16
        Confim value: 8b3577ad57292979e57f9e2a9b7d93a8
> HCI Event: Number of Completed Packets (0x13) plen 5    #167 [hci1] 11.401712
        Num handles: 1
        Handle: 684 Address: DF:A9:FF:F6:B1:1A (OUI DF-A9-FF)
        Count: 1
        #166: len 21 (3 Kb/s)
        Latency: 47 msec (7-48 msec ~47 msec)
> ACL Data RX: Handle 684 flags 0x02 dlen 21              #168 [hci1] 11.451897
      SMP: Pairing Confirm (0x03) len 16
        Confim value: 5247238c84b0f1b7b2700ff3fc09760f
< HCI Command: Host Number of Com.. (0x03|0x0035) plen 5  #169 [hci1] 11.454170
        Num handles: 1
        Handle: 684 Address: DF:A9:FF:F6:B1:1A (OUI DF-A9-FF)
        Count: 1
< ACL Data TX: Handle 684 flags 0x00 dlen 21              #170 [hci1] 11.454266
      SMP: Pairing Random (0x04) len 16
        Random value: e3a3cf1d832325a9493fd3ce4faf02be
> HCI Event: Number of Completed Packets (0x13) plen 5    #171 [hci1] 11.501782
        Num handles: 1
        Handle: 684 Address: DF:A9:FF:F6:B1:1A (OUI DF-A9-FF)
        Count: 1
        #170: len 21 (3 Kb/s)
        Latency: 47 msec (7-48 msec ~47 msec)
> ACL Data RX: Handle 684 flags 0x02 dlen 21              #172 [hci1] 11.752008
      SMP: Pairing Random (0x04) len 16
        Random value: 88fa6492d4c197e25a03aa1b0d2821fa
< HCI Command: Host Number of Com.. (0x03|0x0035) plen 5  #173 [hci1] 11.754611
        Num handles: 1
        Handle: 684 Address: DF:A9:FF:F6:B1:1A (OUI DF-A9-FF)
        Count: 1
< ACL Data TX: Handle 684 flags 0x00 dlen 21              #174 [hci1] 11.754855
      SMP: Pairing Confirm (0x03) len 16
        Confim value: e3fcacd8e1e58fccad958c0c521d936e
> HCI Event: Number of Completed Packets (0x13) plen 5    #175 [hci1] 11.801834
        Num handles: 1
        Handle: 684 Address: DF:A9:FF:F6:B1:1A (OUI DF-A9-FF)
        Count: 1
        #174: len 21 (3 Kb/s)
        Latency: 46 msec (7-48 msec ~47 msec)
> ACL Data RX: Handle 684 flags 0x02 dlen 21              #176 [hci1] 11.851950
      SMP: Pairing Confirm (0x03) len 16
        Confim value: 702df99db4093d088ec717f9baeae535
< HCI Command: Host Number of Com.. (0x03|0x0035) plen 5  #177 [hci1] 11.854518
        Num handles: 1
        Handle: 684 Address: DF:A9:FF:F6:B1:1A (OUI DF-A9-FF)
        Count: 1
< ACL Data TX: Handle 684 flags 0x00 dlen 21              #178 [hci1] 11.854730
      SMP: Pairing Random (0x04) len 16
        Random value: 595bb7c6e45c58f6b41f855a6f6c3560
> HCI Event: Number of Completed Packets (0x13) plen 5    #179 [hci1] 11.901768
        Num handles: 1
        Handle: 684 Address: DF:A9:FF:F6:B1:1A (OUI DF-A9-FF)
        Count: 1
        #178: len 21 (3 Kb/s)
        Latency: 47 msec (7-48 msec ~47 msec)
> ACL Data RX: Handle 684 flags 0x02 dlen 21              #180 [hci1] 12.151872
      SMP: Pairing Random (0x04) len 16
        Random value: ae5f39f9cd495a18e7827e807a9c1d9a
< HCI Command: Host Number of Com.. (0x03|0x0035) plen 5  #181 [hci1] 12.154751
        Num handles: 1
        Handle: 684 Address: DF:A9:FF:F6:B1:1A (OUI DF-A9-FF)
        Count: 1
< ACL Data TX: Handle 684 flags 0x00 dlen 21              #182 [hci1] 12.154929
      SMP: Pairing Confirm (0x03) len 16
        Confim value: dcd0e86af0811acd9d731278121fd079
> HCI Event: Number of Completed Packets (0x13) plen 5    #183 [hci1] 12.201721
        Num handles: 1
        Handle: 684 Address: DF:A9:FF:F6:B1:1A (OUI DF-A9-FF)
        Count: 1
        #182: len 21 (3 Kb/s)
        Latency: 46 msec (7-48 msec ~46 msec)
> ACL Data RX: Handle 684 flags 0x02 dlen 21              #184 [hci1] 12.251993
      SMP: Pairing Confirm (0x03) len 16
        Confim value: 3771993fe7438e409f5a4bd22c9911ff
< HCI Command: Host Number of Com.. (0x03|0x0035) plen 5  #185 [hci1] 12.254542
        Num handles: 1
        Handle: 684 Address: DF:A9:FF:F6:B1:1A (OUI DF-A9-FF)
        Count: 1
< ACL Data TX: Handle 684 flags 0x00 dlen 21              #186 [hci1] 12.254754
      SMP: Pairing Random (0x04) len 16
        Random value: 84e2affc6847b67e7216d5bf664139ed
> HCI Event: Number of Completed Packets (0x13) plen 5    #187 [hci1] 12.301840
        Num handles: 1
        Handle: 684 Address: DF:A9:FF:F6:B1:1A (OUI DF-A9-FF)
        Count: 1
        #186: len 21 (3 Kb/s)
        Latency: 47 msec (7-48 msec ~47 msec)
> ACL Data RX: Handle 684 flags 0x02 dlen 21              #188 [hci1] 12.551934
      SMP: Pairing Random (0x04) len 16
        Random value: d7f2ef1af8efad2348966738905c4531
< HCI Command: Host Number of Com.. (0x03|0x0035) plen 5  #189 [hci1] 12.554797
        Num handles: 1
        Handle: 684 Address: DF:A9:FF:F6:B1:1A (OUI DF-A9-FF)
        Count: 1
< ACL Data TX: Handle 684 flags 0x00 dlen 21              #190 [hci1] 12.555009
      SMP: Pairing Confirm (0x03) len 16
        Confim value: 64869a851c61ad9c414cd599b90ee2cc
> HCI Event: Number of Completed Packets (0x13) plen 5    #191 [hci1] 12.601724
        Num handles: 1
        Handle: 684 Address: DF:A9:FF:F6:B1:1A (OUI DF-A9-FF)
        Count: 1
        #190: len 21 (3 Kb/s)
        Latency: 46 msec (7-48 msec ~46 msec)
> ACL Data RX: Handle 684 flags 0x02 dlen 21              #192 [hci1] 12.651947
      SMP: Pairing Confirm (0x03) len 16
        Confim value: 9c313a7c440de8c24134576e01a9bcc8
< HCI Command: Host Number of Com.. (0x03|0x0035) plen 5  #193 [hci1] 12.654620
        Num handles: 1
        Handle: 684 Address: DF:A9:FF:F6:B1:1A (OUI DF-A9-FF)
        Count: 1
< ACL Data TX: Handle 684 flags 0x00 dlen 21              #194 [hci1] 12.654805
      SMP: Pairing Random (0x04) len 16
        Random value: 425496665d7eed17f76500c95219dd01
> HCI Event: Number of Completed Packets (0x13) plen 5    #195 [hci1] 12.701717
        Num handles: 1
        Handle: 684 Address: DF:A9:FF:F6:B1:1A (OUI DF-A9-FF)
        Count: 1
        #194: len 21 (3 Kb/s)
        Latency: 46 msec (7-48 msec ~46 msec)
> ACL Data RX: Handle 684 flags 0x02 dlen 21              #196 [hci1] 12.952074
      SMP: Pairing Random (0x04) len 16
        Random value: d5190e73d68b4971ae824ca1301fb20c
< HCI Command: Host Number of Com.. (0x03|0x0035) plen 5  #197 [hci1] 12.954195
        Num handles: 1
        Handle: 684 Address: DF:A9:FF:F6:B1:1A (OUI DF-A9-FF)
        Count: 1
< ACL Data TX: Handle 684 flags 0x00 dlen 21              #198 [hci1] 12.954275
      SMP: Pairing Confirm (0x03) len 16
        Confim value: bf17ecf407499a774134774eee735619
> HCI Event: Number of Completed Packets (0x13) plen 5    #199 [hci1] 13.001699
        Num handles: 1
        Handle: 684 Address: DF:A9:FF:F6:B1:1A (OUI DF-A9-FF)
        Count: 1
        #198: len 21 (3 Kb/s)
        Latency: 47 msec (7-48 msec ~47 msec)
> ACL Data RX: Handle 684 flags 0x02 dlen 21              #200 [hci1] 13.051904
      SMP: Pairing Confirm (0x03) len 16
        Confim value: 5db1b76fe2118a8cb931596d30b3f187
< HCI Command: Host Number of Com.. (0x03|0x0035) plen 5  #201 [hci1] 13.054287
        Num handles: 1
        Handle: 684 Address: DF:A9:FF:F6:B1:1A (OUI DF-A9-FF)
        Count: 1
< ACL Data TX: Handle 684 flags 0x00 dlen 21              #202 [hci1] 13.054400
      SMP: Pairing Random (0x04) len 16
        Random value: 1e63f87b860481d35d47e1f6006d79c9
> HCI Event: Number of Completed Packets (0x13) plen 5    #203 [hci1] 13.101783
        Num handles: 1
        Handle: 684 Address: DF:A9:FF:F6:B1:1A (OUI DF-A9-FF)
        Count: 1
        #202: len 21 (3 Kb/s)
        Latency: 47 msec (7-48 msec ~47 msec)
> ACL Data RX: Handle 684 flags 0x02 dlen 21              #204 [hci1] 13.351989
      SMP: Pairing Random (0x04) len 16
        Random value: b9795fc0282f28ae89cd57597cd8bcb8
< HCI Command: Host Number of Com.. (0x03|0x0035) plen 5  #205 [hci1] 13.354737
        Num handles: 1
        Handle: 684 Address: DF:A9:FF:F6:B1:1A (OUI DF-A9-FF)
        Count: 1
< ACL Data TX: Handle 684 flags 0x00 dlen 21              #206 [hci1] 13.354978
      SMP: Pairing Confirm (0x03) len 16
        Confim value: dedf3dfb6a59f4554f091b948119e3c6
> HCI Event: Number of Completed Packets (0x13) plen 5    #207 [hci1] 13.401749
        Num handles: 1
        Handle: 684 Address: DF:A9:FF:F6:B1:1A (OUI DF-A9-FF)
        Count: 1
        #206: len 21 (3 Kb/s)
        Latency: 46 msec (7-48 msec ~47 msec)
> ACL Data RX: Handle 684 flags 0x02 dlen 21              #208 [hci1] 13.451899
      SMP: Pairing Confirm (0x03) len 16
        Confim value: 75b0a69c30db542f25e34f3ad67b5b69
< HCI Command: Host Number of Com.. (0x03|0x0035) plen 5  #209 [hci1] 13.454218
        Num handles: 1
        Handle: 684 Address: DF:A9:FF:F6:B1:1A (OUI DF-A9-FF)
        Count: 1
< ACL Data TX: Handle 684 flags 0x00 dlen 21              #210 [hci1] 13.454317
      SMP: Pairing Random (0x04) len 16
        Random value: 9d9e1ee31049e7f7e0c2476823e41736
> HCI Event: Number of Completed Packets (0x13) plen 5    #211 [hci1] 13.501677
        Num handles: 1
        Handle: 684 Address: DF:A9:FF:F6:B1:1A (OUI DF-A9-FF)
        Count: 1
        #210: len 21 (3 Kb/s)
        Latency: 47 msec (7-48 msec ~47 msec)
> ACL Data RX: Handle 684 flags 0x02 dlen 21              #212 [hci1] 13.751902
      SMP: Pairing Random (0x04) len 16
        Random value: d5f6ecffee3281c78a3bf13bd4bdfd01
< HCI Command: Host Number of Com.. (0x03|0x0035) plen 5  #213 [hci1] 13.754640
        Num handles: 1
        Handle: 684 Address: DF:A9:FF:F6:B1:1A (OUI DF-A9-FF)
        Count: 1
< ACL Data TX: Handle 684 flags 0x00 dlen 21              #214 [hci1] 13.754870
      SMP: Pairing Confirm (0x03) len 16
        Confim value: 17ea91b5bc4e7f0771e1f2c8d79528d6
> HCI Event: Number of Completed Packets (0x13) plen 5    #215 [hci1] 13.801738
        Num handles: 1
        Handle: 684 Address: DF:A9:FF:F6:B1:1A (OUI DF-A9-FF)
        Count: 1
        #214: len 21 (3 Kb/s)
        Latency: 46 msec (7-48 msec ~47 msec)
> ACL Data RX: Handle 684 flags 0x02 dlen 21              #216 [hci1] 13.851965
      SMP: Pairing Confirm (0x03) len 16
        Confim value: 75a0df01f62da79ff74ee1d59db08bde
< HCI Command: Host Number of Com.. (0x03|0x0035) plen 5  #217 [hci1] 13.854549
        Num handles: 1
        Handle: 684 Address: DF:A9:FF:F6:B1:1A (OUI DF-A9-FF)
        Count: 1
< ACL Data TX: Handle 684 flags 0x00 dlen 21              #218 [hci1] 13.854782
      SMP: Pairing Random (0x04) len 16
        Random value: 81bafb7c3fcffc8b40d9b0b09bc4296b
> HCI Event: Number of Completed Packets (0x13) plen 5    #219 [hci1] 13.901773
        Num handles: 1
        Handle: 684 Address: DF:A9:FF:F6:B1:1A (OUI DF-A9-FF)
        Count: 1
        #218: len 21 (3 Kb/s)
        Latency: 46 msec (7-48 msec ~47 msec)
> ACL Data RX: Handle 684 flags 0x02 dlen 21              #220 [hci1] 14.151905
      SMP: Pairing Random (0x04) len 16
        Random value: b8b6fe6c6b28cfe9a4d1c366d9434ef5
< HCI Command: Host Number of Com.. (0x03|0x0035) plen 5  #221 [hci1] 14.155081
        Num handles: 1
        Handle: 684 Address: DF:A9:FF:F6:B1:1A (OUI DF-A9-FF)
        Count: 1
< ACL Data TX: Handle 684 flags 0x00 dlen 21              #222 [hci1] 14.155310
      SMP: Pairing DHKey Check (0x0d) len 16
        E: ff6e3d2b4915600566094475da19a8eb
> HCI Event: Number of Completed Packets (0x13) plen 5    #223 [hci1] 14.201687
        Num handles: 1
        Handle: 684 Address: DF:A9:FF:F6:B1:1A (OUI DF-A9-FF)
        Count: 1
        #222: len 21 (3 Kb/s)
        Latency: 46 msec (7-48 msec ~46 msec)
> ACL Data RX: Handle 684 flags 0x02 dlen 21              #224 [hci1] 14.252042
      SMP: Pairing DHKey Check (0x0d) len 16
        E: af2a24640b6033a7c2af8f773891c413
< HCI Command: LE Start Encryption (0x08|0x0019) plen 28  #225 [hci1] 14.254925
        Handle: 684 Address: DF:A9:FF:F6:B1:1A (OUI DF-A9-FF)
        Random number: 0x0000000000000000
        Encrypted diversifier: 0x0000
        Long term key: 4df2679423830a5c23364047922460b3
> HCI Event: Command Status (0x0f) plen 4                 #226 [hci1] 14.255821
      LE Start Encryption (0x08|0x0019) ncmd 1
        Status: Success (0x00)
< HCI Command: Host Number of Com.. (0x03|0x0035) plen 5  #227 [hci1] 14.274381
        Num handles: 1
        Handle: 684 Address: DF:A9:FF:F6:B1:1A (OUI DF-A9-FF)
        Count: 1
> HCI Event: Encryption Change (0x08) plen 4              #228 [hci1] 14.601642
        Status: Success (0x00)
        Handle: 684 Address: DF:A9:FF:F6:B1:1A (OUI DF-A9-FF)
        Encryption: Enabled with AES-CCM (0x01)
< HCI Command: Disconnect (0x01|0x0006) plen 3            #229 [hci1] 15.224543
        Handle: 684 Address: DF:A9:FF:F6:B1:1A (OUI DF-A9-FF)
        Reason: Remote User Terminated Connection (0x13)
> HCI Event: Command Status (0x0f) plen 4                 #230 [hci1] 15.225032
      Disconnect (0x01|0x0006) ncmd 1
        Status: Success (0x00)
