Bluetooth monitor ver 5.72
= Note: Linux version 6.14.0-36-generic (x86_64)                       0.312164
= Note: Bluetooth subsystem version 2.22                               0.312166
= New Index: 00:00:00:00:00:00 (Primary,UART,hci1)              [hci1] 0.312167
= New Index: 00:00:00:00:00:00 (Primary,UART,hci2)              [hci2] 0.312167
= New Index: 48:5F:99:8E:E0:64 (Primary,USB,hci0)               [hci0] 0.312168
= Open Index: 00:00:00:00:00:00                                 [hci1] 0.825892
= Index Info: 00:00:00:00:00:00 (Nordic Semiconductor ASA)      [hci1] 0.825907
@ USER Open: main (privileged) version 2.22            {0x0001} [hci1] 0.825916
< HCI Command: Reset (0x03|0x0003) plen 0                    #1 [hci1] 0.827046
> HCI Event: Command Complete (0x0e) plen 4                  #2 [hci1] 0.827584
      Reset (0x03|0x0003) ncmd 1
        Status: Success (0x00)
< HCI Command: Read Local Supported... (0x04|0x0003) plen 0  #3 [hci1] 0.845367
> HCI Event: Command Complete (0x0e) plen 12                 #4 [hci1] 0.845953
      Read Local Supported Features (0x04|0x0003) ncmd 1
        Status: Success (0x00)
        Features: 0x00 0x00 0x00 0x00 0x60 0x00 0x00 0x00
          BR/EDR Not Supported
          LE Supported (Controller)
< HCI Command: Read Local Version In.. (0x04|0x0001) plen 0  #5 [hci1] 0.865368
> HCI Event: Command Complete (0x0e) plen 12                 #6 [hci1] 0.865929
      Read Local Version Information (0x04|0x0001) ncmd 1
        Status: Success (0x00)
        HCI version: Reserved (0x0f) - Revision 12393 (0x3069)
        LMP version: Reserved (0x0f) - Subversion 12393 (0x3069)
        Manufacturer: Nordic Semiconductor ASA (89)
< HCI Command: Read Local Supported... (0x04|0x0002) plen 0  #7 [hci1] 0.885390
> HCI Event: Command Complete (0x0e) plen 68                 #8 [hci1] 0.886508
      Read Local Supported Commands (0x04|0x0002) ncmd 1
        Status: Success (0x00)
        Commands: 119 entries
          Disconnect (Octet 0 - Bit 5)
          Read Remote Version Information (Octet 2 - Bit 7)
          Set Event Mask (Octet 5 - Bit 6)
          Reset (Octet 5 - Bit 7)
          Read Connection Accept Timeout (Octet 7 - Bit 2)
          Write Connection Accept Timeout (Octet 7 - Bit 3)
          Read Transmit Power Level (Octet 10 - Bit 2)
          Set Controller To Host Flow Control (Octet 10 - Bit 5)
          Host Buffer Size (Octet 10 - Bit 6)
          Host Number of Completed Packets (Octet 10 - Bit 7)
          Read Local Version Information (Octet 14 - Bit 3)
          Read Local Supported Features (Octet 14 - Bit 5)
          Read BD ADDR (Octet 15 - Bit 1)
          Read RSSI (Octet 15 - Bit 5)
          Set Event Mask Page 2 (Octet 22 - Bit 2)
          LE Set Event Mask (Octet 25 - Bit 0)
          LE Read Buffer Size (Octet 25 - Bit 1)
          LE Read Local Supported Features (Octet 25 - Bit 2)
          LE Set Random Address (Octet 25 - Bit 4)
          LE Set Advertising Parameters (Octet 25 - Bit 5)
          LE Read Advertising Channel TX Power (Octet 25 - Bit 6)
          LE Set Advertising Data (Octet 25 - Bit 7)
          LE Set Scan Response Data (Octet 26 - Bit 0)
          LE Set Advertise Enable (Octet 26 - Bit 1)
          LE Set Scan Parameters (Octet 26 - Bit 2)
          LE Set Scan Enable (Octet 26 - Bit 3)
          LE Create Connection (Octet 26 - Bit 4)
          LE Create Connection Cancel (Octet 26 - Bit 5)
          LE Read Accept List Size (Octet 26 - Bit 6)
          LE Clear Accept List (Octet 26 - Bit 7)
          LE Add Device To Accept List (Octet 27 - Bit 0)
          LE Remove Device From Accept List (Octet 27 - Bit 1)
          LE Connection Update (Octet 27 - Bit 2)
          LE Set Host Channel Classification (Octet 27 - Bit 3)
          LE Read Channel Map (Octet 27 - Bit 4)
          LE Read Remote Used Features (Octet 27 - Bit 5)
          LE Encrypt (Octet 27 - Bit 6)
          LE Rand (Octet 27 - Bit 7)
          LE Start Encryption (Octet 28 - Bit 0)
          LE Long Term Key Request Reply (Octet 28 - Bit 1)
          LE Long Term Key Request Neg Reply (Octet 28 - Bit 2)
          LE Read Supported States (Octet 28 - Bit 3)
          LE Receiver Test (Octet 28 - Bit 4)
          LE Transmitter Test (Octet 28 - Bit 5)
          LE Test End (Octet 28 - Bit 6)
          Read Authenticated Payload Timeout (Octet 32 - Bit 4)
          Write Authenticated Payload Timeout (Octet 32 - Bit 5)
          LE Set Data Length (Octet 33 - Bit 6)
          LE Read Suggested Default Data Length (Octet 33 - Bit 7)
          LE Write Suggested Default Data Length (Octet 34 - Bit 0)
          LE Add Device To Resolving List (Octet 34 - Bit 3)
          LE Remove Device From Resolving List (Octet 34 - Bit 4)
          LE Clear Resolving List (Octet 34 - Bit 5)
          LE Read Resolving List Size (Octet 34 - Bit 6)
          LE Set Address Resolution Enable (Octet 35 - Bit 1)
          LE Set Resolvable Private Address Timeout (Octet 35 - Bit 2)
          LE Read Maximum Data Length (Octet 35 - Bit 3)
          LE Read PHY (Octet 35 - Bit 4)
          LE Set Default PHY (Octet 35 - Bit 5)
          LE Set PHY (Octet 35 - Bit 6)
          LE Enhanced Receiver Test (Octet 35 - Bit 7)
          LE Enhanced Transmitter Test (Octet 36 - Bit 0)
          LE Set Advertising Set Random Address (Octet 36 - Bit 1)
          LE Set Extended Advertising Parameters (Octet 36 - Bit 2)
          LE Set Extended Advertising Data (Octet 36 - Bit 3)
          LE Set Extended Scan Response Data (Octet 36 - Bit 4)
          LE Set Extended Advertising Enable (Octet 36 - Bit 5)
          LE Read Maximum Advertising Data Length (Octet 36 - Bit 6)
          LE Read Number of Supported Advertising Sets (Octet 36 - Bit 7)
          LE Remove Advertising Set (Octet 37 - Bit 0)
          LE Clear Advertising Sets (Octet 37 - Bit 1)
          LE Set Periodic Advertising Parameters (Octet 37 - Bit 2)
          LE Set Periodic Advertising Data (Octet 37 - Bit 3)
          LE Set Periodic Advertising Enable (Octet 37 - Bit 4)
          LE Set Extended Scan Parameters (Octet 37 - Bit 5)
          LE Set Extended Scan Enable (Octet 37 - Bit 6)
          LE Extended Create Connection (Octet 37 - Bit 7)
          LE Periodic Advertising Create Sync (Octet 38 - Bit 0)
          LE Periodic Advertising Create Sync Cancel (Octet 38 - Bit 1)
          LE Periodic Advertising Terminate Sync (Octet 38 - Bit 2)
          LE Add Device To Periodic Advertiser List (Octet 38 - Bit 3)
          LE Remove Device From Periodic Advertiser List (Octet 38 - Bit 4)
          LE Clear Periodic Advertiser List (Octet 38 - Bit 5)
          LE Read Periodic Advertiser List Size (Octet 38 - Bit 6)
          LE Read Transmit Power (Octet 38 - Bit 7)
          LE Read RF Path Compensation (Octet 39 - Bit 0)
          LE Write RF Path Compensation (Octet 39 - Bit 1)
          LE Set Privacy Mode (Octet 39 - Bit 2)
          LE Periodic Advertising Receive Enable (Octet 40 - Bit 5)
          LE Periodic Advertising Sync Transfer (Octet 40 - Bit 6)
          LE Periodic Advertising Set Info Transfer (Octet 40 - Bit 7)
          LE Periodic Advertising Sync Transfer Parameters (Octet 41 - Bit 0)
          LE Set Default Periodic Advertisng Sync Transfer Parameters (Octet 41 - Bit 1)
          LE Read Buffer v2 (Octet 41 - Bit 5)
          LE Read ISO TX Sync (Octet 41 - Bit 6)
          LE Set Connected Isochronous Group Parameters (Octet 41 - Bit 7)
          LE Set Connected Isochronous Group Parameters Test (Octet 42 - Bit 0)
          LE Create Connected Isochronous Stream (Octet 42 - Bit 1)
          LE Remove Connected Isochronous Group (Octet 42 - Bit 2)
          LE Accept Connected Isochronous Stream Request (Octet 42 - Bit 3)
          LE Reject Connected Isochronous Stream Request (Octet 42 - Bit 4)
          LE Create Broadcast Isochronous Group (Octet 42 - Bit 5)
          LE Create Broadcast Isochronous Group Test (Octet 42 - Bit 6)
          LE Terminate Broadcast Isochronous Group (Octet 42 - Bit 7)
          LE Broadcast Isochronous Group Create Sync (Octet 43 - Bit 0)
          LE Broadcast Isochronous Group Terminate Sync (Octet 43 - Bit 1)
          LE Request Peer SCA (Octet 43 - Bit 2)
          LE Setup Isochronous Data Path (Octet 43 - Bit 3)
          LE Remove Isochronous Data Path (Octet 43 - Bit 4)
          LE Isochronous Transmit Test (Octet 43 - Bit 5)
          LE Isochronous Receive Test (Octet 43 - Bit 6)
          LE Isochronous Read Test Counters (Octet 43 - Bit 7)
          LE Isochronous Read Test Counters (Octet 44 - Bit 0)
          LE Set Host Feature (Octet 44 - Bit 1)
          Octet 44 - Bit 2 
          Octet 45 - Bit 6 
          Octet 46 - Bit 0 
          Octet 46 - Bit 1 
          Octet 46 - Bit 2 
< HCI Command: Host Buffer Size (0x03|0x0033) plen 7         #9 [hci1] 0.905440
        ACL MTU: 255  ACL max packet: 16
        SCO MTU: 0    SCO max packet: 0
> HCI Event: Command Complete (0x0e) plen 4                 #10 [hci1] 0.906117
      Host Buffer Size (0x03|0x0033) ncmd 1
        Status: Success (0x00)
< HCI Command: Set Controller To Ho.. (0x03|0x0031) plen 1  #11 [hci1] 0.925426
        Flow control: ACL Data Packets (0x01)
> HCI Event: Command Complete (0x0e) plen 4                 #12 [hci1] 0.925858
      Set Controller To Host Flow Control (0x03|0x0031) ncmd 1
        Status: Success (0x00)
< HCI Command: LE Read Local Suppor.. (0x08|0x0003) plen 0  #13 [hci1] 0.945377
> HCI Event: Command Complete (0x0e) plen 12                #14 [hci1] 0.945934
      LE Read Local Supported Features (0x08|0x0003) ncmd 1
        Status: Success (0x00)
        Features: 0xfd 0x79 0x00 0xf7 0x30 0x01 0x00 0x00
          LE Encryption
          Extended Reject Indication
          Peripheral-initiated Features Exchange
          LE Ping
          LE Data Packet Length Extension
          LL Privacy
          Extended Scanner Filter Policies
          LE 2M PHY
          LE Coded PHY
          LE Extended Advertising
          LE Periodic Advertising
          Channel Selection Algorithm #2
          Periodic Advertising Sync Transfer - Sender
          Periodic Advertising Sync Transfer - Recipient
          Sleep Clock Accuracy Updates
          Connected Isochronous Stream - Central
          Connected Isochronous Stream - Peripheral
          Isochronous Broadcaster
          Synchronized Receiver
          Periodic Advertising ADI support
          Connection Subrating
          Unknown features (0x0000010000000000)
< HCI Command: LE Set Host Feature (0x08|0x0074) plen 2     #15 [hci1] 0.965407
        Bit Number: 32
          Connected Isochronous Stream (Host Support)
        Bit Value: 1
> HCI Event: Command Complete (0x0e) plen 4                 #16 [hci1] 0.965965
      LE Set Host Feature (0x08|0x0074) ncmd 1
        Status: Success (0x00)
< HCI Command: LE Read Buffer v2 (0x08|0x0060) plen 0       #17 [hci1] 0.985431
> HCI Event: Command Complete (0x0e) plen 10                #18 [hci1] 0.985904
      LE Read Buffer v2 (0x08|0x0060) ncmd 1
        Status: Success (0x00)
        ACL MTU: 27
        ACL max packet: 3
        ISO MTU: 318
        ISO max packet: 3
< HCI Command: LE Read Maximum Adve.. (0x08|0x003a) plen 0  #19 [hci1] 1.005424
> HCI Event: Command Complete (0x0e) plen 6                 #20 [hci1] 1.005843
      LE Read Maximum Advertising Data Length (0x08|0x003a) ncmd 1
        Status: Success (0x00)
        Max length: 1650
< HCI Command: LE Read Supported St.. (0x08|0x001c) plen 0  #21 [hci1] 1.025403
> HCI Event: Command Complete (0x0e) plen 12                #22 [hci1] 1.025931
      LE Read Supported States (0x08|0x001c) ncmd 1
        Status: Success (0x00)
        States: 0x000003ff3e0306ff
          Non-connectable Advertising State
          Scannable Advertising State
          Connectable Advertising State
          High Duty Cycle Directed Advertising State
          Passive Scanning State
          Active Scanning State
          Initiating State
            and Connection State (Central Role)
          Connection State (Peripheral Role)
          Scannable Advertising State
            and Passive Scanning State
          Connectable Advertising State
            and Passive Scanning State
          Non-connectable Advertising State
            and Initiating State
          Scannable Advertising State
            and Initiating State
          Active Scanning State
            and Connection State (Central Role)
          Passive Scanning State
            and Connection State (Peripheral Role)
          Active Scanning State
            and Connection State (Peripheral Role)
          Initiating State
            and Connection State (Central Role)
            and Central Role & Central Role
          Low Duty Cycle Directed Advertising State
          Connectable Advertising State
            and Initiating State
            and Central Role & Peripheral Role
          High Duty Cycle Directed Advertising State
            and Initiating State
            and Central Role & Peripheral Role
          Low Duty Cycle Directed Advertising State
            and Initiating State
            and Central Role & Peripheral Role
          Connectable Advertising State
            and Connection State (Central Role)
            and Central Role & Peripheral Role
          High Duty Cycle Directed Advertising State
            and Connection State (Central Role)
            and Central Role & Peripheral Role
          Low Duty Cycle Directed Advertising State
            and Connection State (Central Role)
            and Central Role & Peripheral Role
          Connectable Advertising State
            and Connection State (Peripheral Role)
            and Central Role & Peripheral Role
          High Duty Cycle Directed Advertising State
            and Connection State (Peripheral Role)
            and Peripheral Role & Peripheral Role
          Low Duty Cycle Directed Advertising State
            and Connection State (Peripheral Role)
            and Peripheral Role & Peripheral Role
          Initiating State
            and Connection State (Peripheral Role)
            and Central Role & Peripheral Role
< HCI Command: LE Read Maximum Data.. (0x08|0x002f) plen 0  #23 [hci1] 1.045405
> HCI Event: Command Complete (0x0e) plen 12                #24 [hci1] 1.045975
      LE Read Maximum Data Length (0x08|0x002f) ncmd 1
        Status: Success (0x00)
        Max TX octets: 251
        Max TX time: 2704
        Max RX octets: 251
        Max RX time: 2704
< HCI Command: LE Write Suggested D.. (0x08|0x0024) plen 4  #25 [hci1] 1.065401
        TX octets: 251
        TX time: 2704
> HCI Event: Command Complete (0x0e) plen 4                 #26 [hci1] 1.065938
      LE Write Suggested Default Data Length (0x08|0x0024) ncmd 1
        Status: Success (0x00)
< HCI Command: LE Set Resolvable Pr.. (0x08|0x002e) plen 2  #27 [hci1] 1.085400
        Timeout: 30 seconds
> HCI Event: Command Complete (0x0e) plen 4                 #28 [hci1] 1.085826
      LE Set Resolvable Private Address Timeout (0x08|0x002e) ncmd 1
        Status: Success (0x00)
< HCI Command: LE Read Resolving Li.. (0x08|0x002a) plen 0  #29 [hci1] 1.105392
> HCI Event: Command Complete (0x0e) plen 5                 #30 [hci1] 1.105856
      LE Read Resolving List Size (0x08|0x002a) ncmd 1
        Status: Success (0x00)
        Size: 8
< HCI Command: LE Set Event Mask (0x08|0x0001) plen 8       #31 [hci1] 1.125379
        Mask: 0x000002023f87fa5e
          LE Advertising Report
          LE Connection Update Complete
          LE Read Remote Used Features Complete
          LE Long Term Key Request
          LE Data Length Change
          LE Enhanced Connection Complete
          LE PHY Update Complete
          LE Extended Advertising Report
          LE Periodic Advertising Sync Established
          LE Periodic Advertising Report
          LE Periodic Advertising Sync Lost
          LE Extended Scan Timeout
          LE Extended Advertising Set Terminated
          LE Scan Request Received
          LE Periodic Advertising Sync Transfer Rvc
          LE CIS Established
          LE CIS Request
          LE Create BIG Complete
          LE Terminate BIG Complete
          LE BIG Sync Estabilished Complete
          LE BIG Sync Lost
          LE BIG Info Advertising Report
          Unknown mask (0x0000020000000000)
> HCI Event: Command Complete (0x0e) plen 4                 #32 [hci1] 1.125913
      LE Set Event Mask (0x08|0x0001) ncmd 1
        Status: Success (0x00)
< HCI Command: Set Event Mask (0x03|0x0001) plen 8          #33 [hci1] 1.145402
        Mask: 0x2000800002008890
          Disconnection Complete
          Encryption Change
          Read Remote Version Information Complete
          Hardware Error
          Data Buffer Overflow
          Encryption Key Refresh Complete
          LE Meta
> HCI Event: Command Complete (0x0e) plen 4                 #34 [hci1] 1.145895
      Set Event Mask (0x03|0x0001) ncmd 1
        Status: Success (0x00)
< HCI Command: Read BD ADDR (0x04|0x0009) plen 0            #35 [hci1] 1.165398
> HCI Event: Command Complete (0x0e) plen 10                #36 [hci1] 1.166009
      Read BD ADDR (0x04|0x0009) ncmd 1
        Status: Success (0x00)
        Address: 00:00:00:00:00:00 (OUI 00-00-00)
< HCI Command: LE Set Random Address (0x08|0x0005) plen 6   #37 [hci1] 1.185403
        Address: D5:B6:CC:31:DB:3B (Static)
> HCI Event: Command Complete (0x0e) plen 4                 #38 [hci1] 1.185982
      LE Set Random Address (0x08|0x0005) ncmd 1
        Status: Success (0x00)
< HCI Command: LE Set Random Address (0x08|0x0005) plen 6   #39 [hci1] 1.295458
        Address: 48:61:8E:DB:C6:F9 (Resolvable)
> HCI Event: Command Complete (0x0e) plen 4                 #40 [hci1] 1.295995
      LE Set Random Address (0x08|0x0005) ncmd 1
        Status: Success (0x00)
< HCI Command: LE Extended Create... (0x08|0x0043) plen 26  #41 [hci1] 3.399514
        Filter policy: Accept list is not used (0x00)
        Own address type: Random (0x03)
        Peer address type: Public (0x00)
        Peer address: DF:A9:FF:F6:B1:1A (OUI DF-A9-FF)
        Initiating PHYs: 0x01
        Entry 0: LE 1M
          Scan interval: 60.000 msec (0x0060)
          Scan window: 60.000 msec (0x0060)
          Min connection interval: 30.00 msec (0x0018)
          Max connection interval: 50.00 msec (0x0028)
          Connection latency: 0 (0x0000)
          Supervision timeout: 4000 msec (0x0190)
          Min connection length: 0.000 msec (0x0000)
          Max connection length: 0.000 msec (0x0000)
> HCI Event: Command Status (0x0f) plen 4                   #42 [hci1] 3.400528
      LE Extended Create Connection (0x08|0x0043) ncmd 1
        Status: Success (0x00)
> HCI Event: LE Meta Event (0x3e) plen 31                   #43 [hci1] 3.492886
      LE Enhanced Connection Complete (0x0a)
        Status: Success (0x00)
        Handle: 180
        Role: Central (0x00)
        Peer address type: Public (0x00)
        Peer address: DF:A9:FF:F6:B1:1A (OUI DF-A9-FF)
        Local resolvable private address: 48:61:8E:DB:C6:F9 (Resolvable)
        Peer resolvable private address: 00:00:00:00:00:00 (Non-Resolvable)
        Connection interval: 50.00 msec (0x0028)
        Connection latency: 0 (0x0000)
        Supervision timeout: 4000 msec (0x0190)
        Central clock accuracy: 0x00
< HCI Command: LE Read Remote Used... (0x08|0x0016) plen 2  #44 [hci1] 3.505602
        Handle: 180 Address: DF:A9:FF:F6:B1:1A (OUI DF-A9-FF)
> HCI Event: Command Status (0x0f) plen 4                   #45 [hci1] 3.506059
      LE Read Remote Used Features (0x08|0x0016) ncmd 1
        Status: Success (0x00)
< HCI Command: LE Set PHY (0x08|0x0032) plen 7              #46 [hci1] 3.525451
        Handle: 180 Address: DF:A9:FF:F6:B1:1A (OUI DF-A9-FF)
        All PHYs preference: 0x00
        TX PHYs preference: 0x02
          LE 2M
        RX PHYs preference: 0x02
          LE 2M
        PHY options preference: Reserved (0x0000)
> HCI Event: Command Status (0x0f) plen 4                   #47 [hci1] 3.526023
      LE Set PHY (0x08|0x0032) ncmd 1
        Status: Success (0x00)
> HCI Event: LE Meta Event (0x3e) plen 12                   #48 [hci1] 3.644245
      LE Read Remote Used Features (0x04)
        Status: Success (0x00)
        Handle: 180 Address: DF:A9:FF:F6:B1:1A (OUI DF-A9-FF)
        Features: 0x2d 0x49 0x00 0xf7 0x67 0xd8 0x00 0x00
          LE Encryption
          Extended Reject Indication
          Peripheral-initiated Features Exchange
          LE Data Packet Length Extension
          LE 2M PHY
          LE Coded PHY
          Channel Selection Algorithm #2
          Periodic Advertising Sync Transfer - Sender
          Periodic Advertising Sync Transfer - Recipient
          Sleep Clock Accuracy Updates
          Connected Isochronous Stream - Central
          Connected Isochronous Stream - Peripheral
          Isochronous Broadcaster
          Synchronized Receiver
          Connected Isochronous Stream (Host Support)
          LE Power Control Request
          LE Power Control Request
          Connection Subrating
          Connection Subrating (Host Support)
          Unknown features (0x0000d80000000000)
> HCI Event: LE Meta Event (0x3e) plen 6                    #49 [hci1] 4.143641
      LE PHY Update Complete (0x0c)
        Status: Success (0x00)
        Handle: 180 Address: DF:A9:FF:F6:B1:1A (OUI DF-A9-FF)
        TX PHY: LE 2M (0x02)
        RX PHY: LE 2M (0x02)
< ACL Data TX: Handle 180 flags 0x00 dlen 11                #50 [hci1] 4.526261
      SMP: Pairing Request (0x01) len 6
        IO capability: DisplayOnly (0x00)
        OOB data: Authentication data not present (0x00)
        Authentication requirement: Bonding, No MITM, SC, No Keypresses (0x09)
        Max encryption key size: 16
        Initiator key distribution: EncKey IdKey (0x03)
        Responder key distribution: EncKey IdKey (0x03)
> HCI Event: Number of Completed Packets (0x13) plen 5      #51 [hci1] 4.543982
        Num handles: 1
        Handle: 180 Address: DF:A9:FF:F6:B1:1A (OUI DF-A9-FF)
        Count: 1
        #50: len 11 (5 Kb/s)
        Latency: 17 msec (17-17 msec ~17 msec)
> ACL Data RX: Handle 180 flags 0x02 dlen 11                #52 [hci1] 4.594164
      SMP: Pairing Response (0x02) len 6
        IO capability: KeyboardDisplay (0x04)
        OOB data: Authentication data not present (0x00)
        Authentication requirement: Bonding, MITM, SC, No Keypresses (0x0d)
        Max encryption key size: 16
        Initiator key distribution: IdKey (0x02)
        Responder key distribution: <none> (0x00)
< HCI Command: Host Number of Compl.. (0x03|0x0035) plen 5  #53 [hci1] 4.605758
        Num handles: 1
        Handle: 180 Address: DF:A9:FF:F6:B1:1A (OUI DF-A9-FF)
        Count: 1
< ACL Data TX: Handle 180 flags 0x00 dlen 27                #54 [hci1] 4.605946
< ACL Data TX: Handle 180 flags 0x01 dlen 27                #55 [hci1] 4.605961
< ACL Data TX: Handle 180 flags 0x01 dlen 15                #56 [hci1] 4.605963
      SMP: Pairing Public Key (0x0c) len 64
        X: 68f6ada634ce84d11617383d57f070fe3445c38b33b569efa5eb771a0dc8aea5
        Y: 83c407aaa8337331fdc418e55085d75e6c1c6e5d42f8bf9c18fb5a2a7d4f31aa
> HCI Event: Number of Completed Packets (0x13) plen 5      #57 [hci1] 4.644037
        Num handles: 1
        Handle: 180 Address: DF:A9:FF:F6:B1:1A (OUI DF-A9-FF)
        Count: 1
        #54: len 27 (5 Kb/s)
        Latency: 38 msec (17-38 msec ~27 msec)
> HCI Event: Number of Completed Packets (0x13) plen 5      #58 [hci1] 4.644478
        Num handles: 1
        Handle: 180 Address: DF:A9:FF:F6:B1:1A (OUI DF-A9-FF)
        Count: 1
        #55: len 27 (5 Kb/s)
        Latency: 38 msec (17-38 msec ~33 msec)
> HCI Event: Number of Completed Packets (0x13) plen 5      #59 [hci1] 4.645094
        Num handles: 1
        Handle: 180 Address: DF:A9:FF:F6:B1:1A (OUI DF-A9-FF)
        Count: 1
        #56: len 15 (3 Kb/s)
        Latency: 39 msec (17-39 msec ~36 msec)
> ACL Data RX: Handle 180 flags 0x02 dlen 27                #60 [hci1] 4.694355
> ACL Data RX: Handle 180 flags 0x01 dlen 27                #61 [hci1] 4.694744
> ACL Data RX: Handle 180 flags 0x01 dlen 15                #62 [hci1] 4.695258
      SMP: Pairing Public Key (0x0c) len 64
        X: 42612d3298daf3e4debe101afb064ca8dcbd436143179a521c03ebb29a71b5ba
        Y: c9487d2d8da51250b2077271d9c948b4138e7e4b1942c6650edeae24275592f9
< HCI Command: Host Number of Compl.. (0x03|0x0035) plen 5  #63 [hci1] 4.705680
        Num handles: 1
        Handle: 180 Address: DF:A9:FF:F6:B1:1A (OUI DF-A9-FF)
        Count: 1
< HCI Command: Host Number of Compl.. (0x03|0x0035) plen 5  #64 [hci1] 4.705771
        Num handles: 1
        Handle: 180 Address: DF:A9:FF:F6:B1:1A (OUI DF-A9-FF)
        Count: 1
< HCI Command: Host Number of Compl.. (0x03|0x0035) plen 5  #65 [hci1] 4.705975
        Num handles: 1
        Handle: 180 Address: DF:A9:FF:F6:B1:1A (OUI DF-A9-FF)
        Count: 1
< ACL Data TX: Handle 180 flags 0x00 dlen 21                #66 [hci1] 4.706054
      SMP: Pairing Confirm (0x03) len 16
        Confim value: ec90b72c0c62a06d9f9ad19bffe0aa7c
> HCI Event: Number of Completed Packets (0x13) plen 5      #67 [hci1] 4.744157
        Num handles: 1
        Handle: 180 Address: DF:A9:FF:F6:B1:1A (OUI DF-A9-FF)
        Count: 1
        #66: len 21 (4 Kb/s)
        Latency: 38 msec (17-39 msec ~37 msec)
> ACL Data RX: Handle 180 flags 0x02 dlen 21                #68 [hci1] 5.594299
      SMP: Pairing Confirm (0x03) len 16
        Confim value: 49146be2a83fc85aa618581179f74247
< HCI Command: Host Number of Compl.. (0x03|0x0035) plen 5  #69 [hci1] 5.605909
        Num handles: 1
        Handle: 180 Address: DF:A9:FF:F6:B1:1A (OUI DF-A9-FF)
        Count: 1
< ACL Data TX: Handle 180 flags 0x00 dlen 21                #70 [hci1] 5.606083
      SMP: Pairing Random (0x04) len 16
        Random value: 555cc64d02679f89a05211af56d8b3da
> HCI Event: Number of Completed Packets (0x13) plen 5      #71 [hci1] 5.644314
        Num handles: 1
        Handle: 180 Address: DF:A9:FF:F6:B1:1A (OUI DF-A9-FF)
        Count: 1
        #70: len 21 (4 Kb/s)
        Latency: 38 msec (17-39 msec ~37 msec)
> ACL Data RX: Handle 180 flags 0x02 dlen 21                #72 [hci1] 5.894396
      SMP: Pairing Random (0x04) len 16
        Random value: 70ec5720d0aac7643aff26db673f285a
< HCI Command: Host Number of Compl.. (0x03|0x0035) plen 5  #73 [hci1] 5.906409
        Num handles: 1
        Handle: 180 Address: DF:A9:FF:F6:B1:1A (OUI DF-A9-FF)
        Count: 1
< ACL Data TX: Handle 180 flags 0x00 dlen 21                #74 [hci1] 5.906758
      SMP: Pairing Confirm (0x03) len 16
        Confim value: 39529da8868a7b36f8b3967e6b72ccdb
> HCI Event: Number of Completed Packets (0x13) plen 5      #75 [hci1] 5.944233
        Num handles: 1
        Handle: 180 Address: DF:A9:FF:F6:B1:1A (OUI DF-A9-FF)
        Count: 1
        #74: len 21 (4 Kb/s)
        Latency: 37 msec (17-39 msec ~37 msec)
> ACL Data RX: Handle 180 flags 0x02 dlen 21                #76 [hci1] 5.994316
      SMP: Pairing Confirm (0x03) len 16
        Confim value: 9f579dc6c4d625be087d96b3d640cb3e
< HCI Command: Host Number of Compl.. (0x03|0x0035) plen 5  #77 [hci1] 6.006050
        Num handles: 1
        Handle: 180 Address: DF:A9:FF:F6:B1:1A (OUI DF-A9-FF)
        Count: 1
< ACL Data TX: Handle 180 flags 0x00 dlen 21                #78 [hci1] 6.006349
      SMP: Pairing Random (0x04) len 16
        Random value: bc235a02440d0c3424a2acf8fd71a45c
> HCI Event: Number of Completed Packets (0x13) plen 5      #79 [hci1] 6.044051
        Num handles: 1
        Handle: 180 Address: DF:A9:FF:F6:B1:1A (OUI DF-A9-FF)
        Count: 1
        #78: len 21 (4 Kb/s)
        Latency: 37 msec (17-39 msec ~37 msec)
> ACL Data RX: Handle 180 flags 0x02 dlen 21                #80 [hci1] 6.294361
      SMP: Pairing Random (0x04) len 16
        Random value: 4bfafc222e1591ee397e4348a906f14c
< HCI Command: Host Number of Compl.. (0x03|0x0035) plen 5  #81 [hci1] 6.306134
        Num handles: 1
        Handle: 180 Address: DF:A9:FF:F6:B1:1A (OUI DF-A9-FF)
        Count: 1
< ACL Data TX: Handle 180 flags 0x00 dlen 21                #82 [hci1] 6.306403
      SMP: Pairing Confirm (0x03) len 16
        Confim value: 1e4e1803ceaa308623a6bb67f2f2684f
> HCI Event: Number of Completed Packets (0x13) plen 5      #83 [hci1] 6.344140
        Num handles: 1
        Handle: 180 Address: DF:A9:FF:F6:B1:1A (OUI DF-A9-FF)
        Count: 1
        #82: len 21 (4 Kb/s)
        Latency: 37 msec (17-39 msec ~37 msec)
> ACL Data RX: Handle 180 flags 0x02 dlen 21                #84 [hci1] 6.394360
      SMP: Pairing Confirm (0x03) len 16
        Confim value: e92f44cf822c7de9c464362c345375f4
< HCI Command: Host Number of Compl.. (0x03|0x0035) plen 5  #85 [hci1] 6.406050
        Num handles: 1
        Handle: 180 Address: DF:A9:FF:F6:B1:1A (OUI DF-A9-FF)
        Count: 1
< ACL Data TX: Handle 180 flags 0x00 dlen 21                #86 [hci1] 6.406253
      SMP: Pairing Random (0x04) len 16
        Random value: cadd27bd58e945097b00bad7aca1ba32
> HCI Event: Number of Completed Packets (0x13) plen 5      #87 [hci1] 6.444058
        Num handles: 1
        Handle: 180 Address: DF:A9:FF:F6:B1:1A (OUI DF-A9-FF)
        Count: 1
        #86: len 21 (4 Kb/s)
        Latency: 37 msec (17-39 msec ~37 msec)
> ACL Data RX: Handle 180 flags 0x02 dlen 21                #88 [hci1] 6.694301
      SMP: Pairing Random (0x04) len 16
        Random value: 41af2f7a0a079ee6af864d41ad3d05aa
< HCI Command: Host Number of Compl.. (0x03|0x0035) plen 5  #89 [hci1] 6.705953
        Num handles: 1
        Handle: 180 Address: DF:A9:FF:F6:B1:1A (OUI DF-A9-FF)
        Count: 1
< ACL Data TX: Handle 180 flags 0x00 dlen 21                #90 [hci1] 6.706100
      SMP: Pairing Confirm (0x03) len 16
        Confim value: af62494f118f27d7b8404b43feeacd1d
> HCI Event: Number of Completed Packets (0x13) plen 5      #91 [hci1] 6.744062
        Num handles: 1
        Handle: 180 Address: DF:A9:FF:F6:B1:1A (OUI DF-A9-FF)
        Count: 1
        #90: len 21 (4 Kb/s)
        Latency: 37 msec (17-39 msec ~37 msec)
> ACL Data RX: Handle 180 flags 0x02 dlen 21                #92 [hci1] 6.794200
      SMP: Pairing Confirm (0x03) len 16
        Confim value: eb3a9c20d8bb9a97a27a297dde65a2ba
< HCI Command: Host Number of Compl.. (0x03|0x0035) plen 5  #93 [hci1] 6.806141
        Num handles: 1
        Handle: 180 Address: DF:A9:FF:F6:B1:1A (OUI DF-A9-FF)
        Count: 1
< ACL Data TX: Handle 180 flags 0x00 dlen 21                #94 [hci1] 6.806403
      SMP: Pairing Random (0x04) len 16
        Random value: 6e64e79f33b2e374394db8ab2d95badd
> HCI Event: Number of Completed Packets (0x13) plen 5      #95 [hci1] 6.844058
        Num handles: 1
        Handle: 180 Address: DF:A9:FF:F6:B1:1A (OUI DF-A9-FF)
        Count: 1
        #94: len 21 (4 Kb/s)
        Latency: 37 msec (17-39 msec ~37 msec)
> ACL Data RX: Handle 180 flags 0x02 dlen 21                #96 [hci1] 7.094339
      SMP: Pairing Random (0x04) len 16
        Random value: 89f9a1edcd5c508332e4556a3ca1248a
< HCI Command: Host Number of Compl.. (0x03|0x0035) plen 5  #97 [hci1] 7.106110
        Num handles: 1
        Handle: 180 Address: DF:A9:FF:F6:B1:1A (OUI DF-A9-FF)
        Count: 1
< ACL Data TX: Handle 180 flags 0x00 dlen 21                #98 [hci1] 7.106407
      SMP: Pairing Confirm (0x03) len 16
        Confim value: b4553cd691b1edf98cf957a099e735e3
> HCI Event: Number of Completed Packets (0x13) plen 5      #99 [hci1] 7.144095
        Num handles: 1
        Handle: 180 Address: DF:A9:FF:F6:B1:1A (OUI DF-A9-FF)
        Count: 1
        #98: len 21 (4 Kb/s)
        Latency: 37 msec (17-39 msec ~37 msec)
> ACL Data RX: Handle 180 flags 0x02 dlen 21               #100 [hci1] 7.194241
      SMP: Pairing Confirm (0x03) len 16
        Confim value: 9edeb32dc9b886149ed550e7079015b5
< HCI Command: Host Number of Comp.. (0x03|0x0035) plen 5  #101 [hci1] 7.205646
        Num handles: 1
        Handle: 180 Address: DF:A9:FF:F6:B1:1A (OUI DF-A9-FF)
        Count: 1
< ACL Data TX: Handle 180 flags 0x00 dlen 21               #102 [hci1] 7.205777
      SMP: Pairing Random (0x04) len 16
        Random value: e2838e9a8cc6964353c850fef72c5ceb
> HCI Event: Number of Completed Packets (0x13) plen 5     #103 [hci1] 7.244190
        Num handles: 1
        Handle: 180 Address: DF:A9:FF:F6:B1:1A (OUI DF-A9-FF)
        Count: 1
        #102: len 21 (4 Kb/s)
        Latency: 38 msec (17-39 msec ~38 msec)
> ACL Data RX: Handle 180 flags 0x02 dlen 21               #104 [hci1] 7.494269
      SMP: Pairing Random (0x04) len 16
        Random value: 9e044281203147389ea5aca85e2e5141
< HCI Command: Host Number of Comp.. (0x03|0x0035) plen 5  #105 [hci1] 7.506221
        Num handles: 1
        Handle: 180 Address: DF:A9:FF:F6:B1:1A (OUI DF-A9-FF)
        Count: 1
< ACL Data TX: Handle 180 flags 0x00 dlen 21               #106 [hci1] 7.506477
      SMP: Pairing Confirm (0x03) len 16
        Confim value: 33338245393c188f47947b741c849842
> HCI Event: Number of Completed Packets (0x13) plen 5     #107 [hci1] 7.544088
        Num handles: 1
        Handle: 180 Address: DF:A9:FF:F6:B1:1A (OUI DF-A9-FF)
        Count: 1
        #106: len 21 (4 Kb/s)
        Latency: 37 msec (17-39 msec ~37 msec)
> ACL Data RX: Handle 180 flags 0x02 dlen 21               #108 [hci1] 7.594335
      SMP: Pairing Confirm (0x03) len 16
        Confim value: f433ec22699ae16ca3e9287943ec3be7
< HCI Command: Host Number of Comp.. (0x03|0x0035) plen 5  #109 [hci1] 7.606003
        Num handles: 1
        Handle: 180 Address: DF:A9:FF:F6:B1:1A (OUI DF-A9-FF)
        Count: 1
< ACL Data TX: Handle 180 flags 0x00 dlen 21               #110 [hci1] 7.606222
      SMP: Pairing Random (0x04) len 16
        Random value: 15536596b6fc3db1c86b2b19701bcf5c
> HCI Event: Number of Completed Packets (0x13) plen 5     #111 [hci1] 7.644067
        Num handles: 1
        Handle: 180 Address: DF:A9:FF:F6:B1:1A (OUI DF-A9-FF)
        Count: 1
        #110: len 21 (4 Kb/s)
        Latency: 37 msec (17-39 msec ~37 msec)
> ACL Data RX: Handle 180 flags 0x02 dlen 21               #112 [hci1] 7.844304
      SMP: Pairing Random (0x04) len 16
        Random value: 383d4479ece265bb0a15e3225c22cb62
< HCI Command: Host Number of Comp.. (0x03|0x0035) plen 5  #113 [hci1] 7.846264
        Num handles: 1
        Handle: 180 Address: DF:A9:FF:F6:B1:1A (OUI DF-A9-FF)
        Count: 1
< ACL Data TX: Handle 180 flags 0x00 dlen 21               #114 [hci1] 7.846496
      SMP: Pairing Confirm (0x03) len 16
        Confim value: 6119015808704dfbd7992e3a8c084d37
> HCI Event: Number of Completed Packets (0x13) plen 5     #115 [hci1] 7.894109
        Num handles: 1
        Handle: 180 Address: DF:A9:FF:F6:B1:1A (OUI DF-A9-FF)
        Count: 1
        #114: len 21 (3 Kb/s)
        Latency: 47 msec (17-47 msec ~42 msec)
> ACL Data RX: Handle 180 flags 0x02 dlen 21               #116 [hci1] 7.944137
      SMP: Pairing Confirm (0x03) len 16
        Confim value: 5c7c0dd48c882b7e6cbe439eaaa5d655
< HCI Command: Host Number of Comp.. (0x03|0x0035) plen 5  #117 [hci1] 7.946001
        Num handles: 1
        Handle: 180 Address: DF:A9:FF:F6:B1:1A (OUI DF-A9-FF)
        Count: 1
< ACL Data TX: Handle 180 flags 0x00 dlen 21               #118 [hci1] 7.946333
      SMP: Pairing Random (0x04) len 16
        Random value: c9ad9f2c3f295ebd5ad5e1c3cfeb215c
> HCI Event: Number of Completed Packets (0x13) plen 5     #119 [hci1] 7.994101
        Num handles: 1
        Handle: 180 Address: DF:A9:FF:F6:B1:1A (OUI DF-A9-FF)
        Count: 1
        #118: len 21 (3 Kb/s)
        Latency: 47 msec (17-47 msec ~45 msec)
> ACL Data RX: Handle 180 flags 0x02 dlen 21               #120 [hci1] 8.244250
      SMP: Pairing Random (0x04) len 16
        Random value: 5051175c5a0eca02d0c2cc3ac0f914c4
< HCI Command: Host Number of Comp.. (0x03|0x0035) plen 5  #121 [hci1] 8.245867
        Num handles: 1
        Handle: 180 Address: DF:A9:FF:F6:B1:1A (OUI DF-A9-FF)
        Count: 1
< ACL Data TX: Handle 180 flags 0x00 dlen 21               #122 [hci1] 8.246038
      SMP: Pairing Confirm (0x03) len 16
        Confim value: b2881afadf9853e3f49ed47f844b2b71
> HCI Event: Number of Completed Packets (0x13) plen 5     #123 [hci1] 8.294034
        Num handles: 1
        Handle: 180 Address: DF:A9:FF:F6:B1:1A (OUI DF-A9-FF)
        Count: 1
        #122: len 21 (3 Kb/s)
        Latency: 47 msec (17-47 msec ~46 msec)
> ACL Data RX: Handle 180 flags 0x02 dlen 21               #124 [hci1] 8.344192
      SMP: Pairing Confirm (0x03) len 16
        Confim value: 3a24cc97d7bc6804e2774da470ee0ca7
< HCI Command: Host Number of Comp.. (0x03|0x0035) plen 5  #125 [hci1] 8.345747
        Num handles: 1
        Handle: 180 Address: DF:A9:FF:F6:B1:1A (OUI DF-A9-FF)
        Count: 1
< ACL Data TX: Handle 180 flags 0x00 dlen 21               #126 [hci1] 8.345918
      SMP: Pairing Random (0x04) len 16
        Random value: 312cdf99c9491988e877355a9a8321c6
> HCI Event: Number of Completed Packets (0x13) plen 5     #127 [hci1] 8.393986
        Num handles: 1
        Handle: 180 Address: DF:A9:FF:F6:B1:1A (OUI DF-A9-FF)
        Count: 1
        #126: len 21 (3 Kb/s)
        Latency: 48 msec (17-48 msec ~47 msec)
> ACL Data RX: Handle 180 flags 0x02 dlen 21               #128 [hci1] 8.644407
      SMP: Pairing Random (0x04) len 16
        Random value: 202e6deed391d740897976985270ed7c
< HCI Command: Host Number of Comp.. (0x03|0x0035) plen 5  #129 [hci1] 8.646247
        Num handles: 1
        Handle: 180 Address: DF:A9:FF:F6:B1:1A (OUI DF-A9-FF)
        Count: 1
< ACL Data TX: Handle 180 flags 0x00 dlen 21               #130 [hci1] 8.646533
      SMP: Pairing Confirm (0x03) len 16
        Confim value: c9108f7184659ee3a631a529b602b2c9
> HCI Event: Number of Completed Packets (0x13) plen 5     #131 [hci1] 8.694060
        Num handles: 1
        Handle: 180 Address: DF:A9:FF:F6:B1:1A (OUI DF-A9-FF)
        Count: 1
        #130: len 21 (3 Kb/s)
        Latency: 47 msec (17-48 msec ~47 msec)
> ACL Data RX: Handle 180 flags 0x02 dlen 21               #132 [hci1] 8.744256
      SMP: Pairing Confirm (0x03) len 16
        Confim value: 1be586487198da9e1ff7967b25b01ee9
< HCI Command: Host Number of Comp.. (0x03|0x0035) plen 5  #133 [hci1] 8.745736
        Num handles: 1
        Handle: 180 Address: DF:A9:FF:F6:B1:1A (OUI DF-A9-FF)
        Count: 1
< ACL Data TX: Handle 180 flags 0x00 dlen 21               #134 [hci1] 8.745911
      SMP: Pairing Random (0x04) len 16
        Random value: a987d808e808655d558dfc1155a0b492
> HCI Event: Number of Completed Packets (0x13) plen 5     #135 [hci1] 8.794001
        Num handles: 1
        Handle: 180 Address: DF:A9:FF:F6:B1:1A (OUI DF-A9-FF)
        Count: 1
        #134: len 21 (3 Kb/s)
        Latency: 48 msec (17-48 msec ~47 msec)
> ACL Data RX: Handle 180 flags 0x02 dlen 21               #136 [hci1] 9.044165
      SMP: Pairing Random (0x04) len 16
        Random value: 20ff3734ff882deb0e47341f1c8656de
< HCI Command: Host Number of Comp.. (0x03|0x0035) plen 5  #137 [hci1] 9.046230
        Num handles: 1
        Handle: 180 Address: DF:A9:FF:F6:B1:1A (OUI DF-A9-FF)
        Count: 1
< ACL Data TX: Handle 180 flags 0x00 dlen 21               #138 [hci1] 9.046425
      SMP: Pairing Confirm (0x03) len 16
        Confim value: 9aafeebc872e7f09733fed84efe2f0e7
> HCI Event: Number of Completed Packets (0x13) plen 5     #139 [hci1] 9.094031
        Num handles: 1
        Handle: 180 Address: DF:A9:FF:F6:B1:1A (OUI DF-A9-FF)
        Count: 1
        #138: len 21 (3 Kb/s)
        Latency: 47 msec (17-48 msec ~47 msec)
> ACL Data RX: Handle 180 flags 0x02 dlen 21               #140 [hci1] 9.144231
      SMP: Pairing Confirm (0x03) len 16
        Confim value: 7e1c32039b0e3fe53942328572b3e3ff
< HCI Command: Host Number of Comp.. (0x03|0x0035) plen 5  #141 [hci1] 9.146019
        Num handles: 1
        Handle: 180 Address: DF:A9:FF:F6:B1:1A (OUI DF-A9-FF)
        Count: 1
< ACL Data TX: Handle 180 flags 0x00 dlen 21               #142 [hci1] 9.146157
      SMP: Pairing Random (0x04) len 16
        Random value: 6ad8f13724432c7fd6001c45ff744123
> HCI Event: Number of Completed Packets (0x13) plen 5     #143 [hci1] 9.193994
        Num handles: 1
        Handle: 180 Address: DF:A9:FF:F6:B1:1A (OUI DF-A9-FF)
        Count: 1
        #142: len 21 (3 Kb/s)
        Latency: 47 msec (17-48 msec ~47 msec)
> ACL Data RX: Handle 180 flags 0x02 dlen 21               #144 [hci1] 9.444176
      SMP: Pairing Random (0x04) len 16
        Random value: 0834a573c950aeb7777895f56675927f
< HCI Command: Host Number of Comp.. (0x03|0x0035) plen 5  #145 [hci1] 9.445585
        Num handles: 1
        Handle: 180 Address: DF:A9:FF:F6:B1:1A (OUI DF-A9-FF)
        Count: 1
< ACL Data TX: Handle 180 flags 0x00 dlen 21               #146 [hci1] 9.445591
      SMP: Pairing Confirm (0x03) len 16
        Confim value: dd1da8d5f356257fac94421f64208f50
> HCI Event: Number of Completed Packets (0x13) plen 5     #147 [hci1] 9.493977
        Num handles: 1
        Handle: 180 Address: DF:A9:FF:F6:B1:1A (OUI DF-A9-FF)
        Count: 1
        #146: len 21 (3 Kb/s)
        Latency: 48 msec (17-48 msec ~48 msec)
> ACL Data RX: Handle 180 flags 0x02 dlen 21               #148 [hci1] 9.544149
      SMP: Pairing Confirm (0x03) len 16
        Confim value: fec095ac8698cbd9d6ab3c94d329b729
< HCI Command: Host Number of Comp.. (0x03|0x0035) plen 5  #149 [hci1] 9.546027
        Num handles: 1
        Handle: 180 Address: DF:A9:FF:F6:B1:1A (OUI DF-A9-FF)
        Count: 1
< ACL Data TX: Handle 180 flags 0x00 dlen 21               #150 [hci1] 9.546187
      SMP: Pairing Random (0x04) len 16
        Random value: ebbb5e14c8a6b9622f296d277ff3bf29
> HCI Event: Number of Completed Packets (0x13) plen 5     #151 [hci1] 9.593974
        Num handles: 1
        Handle: 180 Address: DF:A9:FF:F6:B1:1A (OUI DF-A9-FF)
        Count: 1
        #150: len 21 (3 Kb/s)
        Latency: 47 msec (17-48 msec ~47 msec)
> ACL Data RX: Handle 180 flags 0x02 dlen 21               #152 [hci1] 9.844229
      SMP: Pairing Random (0x04) len 16
        Random value: d377283059867a9b1e9a6c7fb9bd2035
< HCI Command: Host Number of Comp.. (0x03|0x0035) plen 5  #153 [hci1] 9.845819
        Num handles: 1
        Handle: 180 Address: DF:A9:FF:F6:B1:1A (OUI DF-A9-FF)
        Count: 1
< ACL Data TX: Handle 180 flags 0x00 dlen 21               #154 [hci1] 9.846032
      SMP: Pairing Confirm (0x03) len 16
        Confim value: bc50dd1305c5082d00c4389dcd6c67d6
> HCI Event: Number of Completed Packets (0x13) plen 5     #155 [hci1] 9.893960
        Num handles: 1
        Handle: 180 Address: DF:A9:FF:F6:B1:1A (OUI DF-A9-FF)
        Count: 1
        #154: len 21 (3 Kb/s)
        Latency: 47 msec (17-48 msec ~47 msec)
> ACL Data RX: Handle 180 flags 0x02 dlen 21               #156 [hci1] 9.944313
      SMP: Pairing Confirm (0x03) len 16
        Confim value: 46fb0415bfd3573f198f8ed7d31712d5
< HCI Command: Host Number of Comp.. (0x03|0x0035) plen 5  #157 [hci1] 9.945916
        Num handles: 1
        Handle: 180 Address: DF:A9:FF:F6:B1:1A (OUI DF-A9-FF)
        Count: 1
< ACL Data TX: Handle 180 flags 0x00 dlen 21               #158 [hci1] 9.946118
      SMP: Pairing Random (0x04) len 16
        Random value: 85e67448a15f56bd27e3a3cf1d832325
> HCI Event: Number of Completed Packets (0x13) plen 5     #159 [hci1] 9.993997
        Num handles: 1
        Handle: 180 Address: DF:A9:FF:F6:B1:1A (OUI DF-A9-FF)
        Count: 1
        #158: len 21 (3 Kb/s)
        Latency: 47 msec (17-48 msec ~47 msec)
> ACL Data RX: Handle 180 flags 0x02 dlen 21              #160 [hci1] 10.244267
      SMP: Pairing Random (0x04) len 16
        Random value: bab772301706f3cb9b7ac961df18c214
< HCI Command: Host Number of Com.. (0x03|0x0035) plen 5  #161 [hci1] 10.246197
        Num handles: 1
        Handle: 180 Address: DF:A9:FF:F6:B1:1A (OUI DF-A9-FF)
        Count: 1
< ACL Data TX: Handle 180 flags 0x00 dlen 21              #162 [hci1] 10.246432
      SMP: Pairing Confirm (0x03) len 16
        Confim value: e89a1678cbe92ae3a81885b0297a3a8d
> HCI Event: Number of Completed Packets (0x13) plen 5    #163 [hci1] 10.293937
        Num handles: 1
        Handle: 180 Address: DF:A9:FF:F6:B1:1A (OUI DF-A9-FF)
        Count: 1
        #162: len 21 (3 Kb/s)
        Latency: 47 msec (17-48 msec ~47 msec)
> ACL Data RX: Handle 180 flags 0x02 dlen 21              #164 [hci1] 10.344168
      SMP: Pairing Confirm (0x03) len 16
        Confim value: 63c8bf4491fa44b902bb2c4d215ec262
< HCI Command: Host Number of Com.. (0x03|0x0035) plen 5  #165 [hci1] 10.346070
        Num handles: 1
        Handle: 180 Address: DF:A9:FF:F6:B1:1A (OUI DF-A9-FF)
        Count: 1
< ACL Data TX: Handle 180 flags 0x00 dlen 21              #166 [hci1] 10.346394
      SMP: Pairing Random (0x04) len 16
        Random value: 3fd3ce4faf02be7293595bb7c6e45c58
> HCI Event: Number of Completed Packets (0x13) plen 5    #167 [hci1] 10.393974
        Num handles: 1
        Handle: 180 Address: DF:A9:FF:F6:B1:1A (OUI DF-A9-FF)
        Count: 1
        #166: len 21 (3 Kb/s)
        Latency: 47 msec (17-48 msec ~47 msec)
> ACL Data RX: Handle 180 flags 0x02 dlen 21              #168 [hci1] 10.644131
      SMP: Pairing Random (0x04) len 16
        Random value: 34207479aeefb9bbc825fd81e1867971
< HCI Command: Host Number of Com.. (0x03|0x0035) plen 5  #169 [hci1] 10.646126
        Num handles: 1
        Handle: 180 Address: DF:A9:FF:F6:B1:1A (OUI DF-A9-FF)
        Count: 1
< ACL Data TX: Handle 180 flags 0x00 dlen 21              #170 [hci1] 10.646366
      SMP: Pairing Confirm (0x03) len 16
        Confim value: eea1cb6eb971eefe6a02e5cf1b3f3c47
> HCI Event: Number of Completed Packets (0x13) plen 5    #171 [hci1] 10.694009
        Num handles: 1
        Handle: 180 Address: DF:A9:FF:F6:B1:1A (OUI DF-A9-FF)
        Count: 1
        #170: len 21 (3 Kb/s)
        Latency: 47 msec (17-48 msec ~47 msec)
> ACL Data RX: Handle 180 flags 0x02 dlen 21              #172 [hci1] 10.744280
      SMP: Pairing Confirm (0x03) len 16
        Confim value: f978cf177d888ce4cfad7c4cf14af07d
< HCI Command: Host Number of Com.. (0x03|0x0035) plen 5  #173 [hci1] 10.745984
        Num handles: 1
        Handle: 180 Address: DF:A9:FF:F6:B1:1A (OUI DF-A9-FF)
        Count: 1
< ACL Data TX: Handle 180 flags 0x00 dlen 21              #174 [hci1] 10.746157
      SMP: Pairing Random (0x04) len 16
        Random value: 1f855a6f6c3560debd84e2affc6847b6
> HCI Event: Number of Completed Packets (0x13) plen 5    #175 [hci1] 10.794005
        Num handles: 1
        Handle: 180 Address: DF:A9:FF:F6:B1:1A (OUI DF-A9-FF)
        Count: 1
        #174: len 21 (3 Kb/s)
        Latency: 47 msec (17-48 msec ~47 msec)
> ACL Data RX: Handle 180 flags 0x02 dlen 21              #176 [hci1] 11.044101
      SMP: Pairing Random (0x04) len 16
        Random value: fc1f5f4e069dad22bee79903074186e2
< HCI Command: Host Number of Com.. (0x03|0x0035) plen 5  #177 [hci1] 11.046273
        Num handles: 1
        Handle: 180 Address: DF:A9:FF:F6:B1:1A (OUI DF-A9-FF)
        Count: 1
< ACL Data TX: Handle 180 flags 0x00 dlen 21              #178 [hci1] 11.046538
      SMP: Pairing Confirm (0x03) len 16
        Confim value: 4f37863510a77d30c8f656ede042c941
> HCI Event: Number of Completed Packets (0x13) plen 5    #179 [hci1] 11.093935
        Num handles: 1
        Handle: 180 Address: DF:A9:FF:F6:B1:1A (OUI DF-A9-FF)
        Count: 1
        #178: len 21 (3 Kb/s)
        Latency: 47 msec (17-48 msec ~47 msec)
> ACL Data RX: Handle 180 flags 0x02 dlen 21              #180 [hci1] 11.144245
      SMP: Pairing Confirm (0x03) len 16
        Confim value: bf6316d824ecef4f85a06dce74414735
< HCI Command: Host Number of Com.. (0x03|0x0035) plen 5  #181 [hci1] 11.146043
        Num handles: 1
        Handle: 180 Address: DF:A9:FF:F6:B1:1A (OUI DF-A9-FF)
        Count: 1
< ACL Data TX: Handle 180 flags 0x00 dlen 21              #182 [hci1] 11.146299
      SMP: Pairing Random (0x04) len 16
        Random value: 16d5bf664139eda2b5425496665d7eed
> HCI Event: Number of Completed Packets (0x13) plen 5    #183 [hci1] 11.193934
        Num handles: 1
        Handle: 180 Address: DF:A9:FF:F6:B1:1A (OUI DF-A9-FF)
        Count: 1
        #182: len 21 (3 Kb/s)
        Latency: 47 msec (17-48 msec ~47 msec)
> ACL Data RX: Handle 180 flags 0x02 dlen 21              #184 [hci1] 11.444143
      SMP: Pairing Random (0x04) len 16
        Random value: 0a61a23647adf0f3d64e6e4ddac96a3b
< HCI Command: Host Number of Com.. (0x03|0x0035) plen 5  #185 [hci1] 11.446215
        Num handles: 1
        Handle: 180 Address: DF:A9:FF:F6:B1:1A (OUI DF-A9-FF)
        Count: 1
< ACL Data TX: Handle 180 flags 0x00 dlen 21              #186 [hci1] 11.446470
      SMP: Pairing Confirm (0x03) len 16
        Confim value: 8b4b52f9bc2688e0da4fa54a876c9efd
> HCI Event: Number of Completed Packets (0x13) plen 5    #187 [hci1] 11.494060
        Num handles: 1
        Handle: 180 Address: DF:A9:FF:F6:B1:1A (OUI DF-A9-FF)
        Count: 1
        #186: len 21 (3 Kb/s)
        Latency: 47 msec (17-48 msec ~47 msec)
> ACL Data RX: Handle 180 flags 0x02 dlen 21              #188 [hci1] 11.544098
      SMP: Pairing Confirm (0x03) len 16
        Confim value: bc2ad961f8e7eb5566e615e3a3244dfc
< HCI Command: Host Number of Com.. (0x03|0x0035) plen 5  #189 [hci1] 11.546086
        Num handles: 1
        Handle: 180 Address: DF:A9:FF:F6:B1:1A (OUI DF-A9-FF)
        Count: 1
< ACL Data TX: Handle 180 flags 0x00 dlen 21              #190 [hci1] 11.546308
      SMP: Pairing Random (0x04) len 16
        Random value: 6500c95219dd01e09d1e63f87b860481
> HCI Event: Number of Completed Packets (0x13) plen 5    #191 [hci1] 11.593993
        Num handles: 1
        Handle: 180 Address: DF:A9:FF:F6:B1:1A (OUI DF-A9-FF)
        Count: 1
        #190: len 21 (3 Kb/s)
        Latency: 47 msec (17-48 msec ~47 msec)
> ACL Data RX: Handle 180 flags 0x02 dlen 21              #192 [hci1] 11.844104
      SMP: Pairing Random (0x04) len 16
        Random value: 97d4f1f5dcfce464a8278d0424d8e592
< HCI Command: Host Number of Com.. (0x03|0x0035) plen 5  #193 [hci1] 11.845616
        Num handles: 1
        Handle: 180 Address: DF:A9:FF:F6:B1:1A (OUI DF-A9-FF)
        Count: 1
< ACL Data TX: Handle 180 flags 0x00 dlen 21              #194 [hci1] 11.845757
      SMP: Pairing Confirm (0x03) len 16
        Confim value: 16ea1164df15752e989a783b758648d9
> HCI Event: Number of Completed Packets (0x13) plen 5    #195 [hci1] 11.894005
        Num handles: 1
        Handle: 180 Address: DF:A9:FF:F6:B1:1A (OUI DF-A9-FF)
        Count: 1
        #194: len 21 (3 Kb/s)
        Latency: 48 msec (17-48 msec ~47 msec)
> ACL Data RX: Handle 180 flags 0x02 dlen 21              #196 [hci1] 11.944217
      SMP: Pairing Confirm (0x03) len 16
        Confim value: 702a36d372add1bcdfc0f79feb438a67
< HCI Command: Host Number of Com.. (0x03|0x0035) plen 5  #197 [hci1] 11.946038
        Num handles: 1
        Handle: 180 Address: DF:A9:FF:F6:B1:1A (OUI DF-A9-FF)
        Count: 1
< ACL Data TX: Handle 180 flags 0x00 dlen 21              #198 [hci1] 11.946322
      SMP: Pairing Random (0x04) len 16
        Random value: 47e1f6006d79c974bd9d9e1ee31049e7
> HCI Event: Number of Completed Packets (0x13) plen 5    #199 [hci1] 11.993870
        Num handles: 1
        Handle: 180 Address: DF:A9:FF:F6:B1:1A (OUI DF-A9-FF)
        Count: 1
        #198: len 21 (3 Kb/s)
        Latency: 47 msec (17-48 msec ~47 msec)
> ACL Data RX: Handle 180 flags 0x02 dlen 21              #200 [hci1] 12.244133
      SMP: Pairing Random (0x04) len 16
        Random value: 1ca43b906ca729ea0e7f470ced6efa3b
< HCI Command: Host Number of Com.. (0x03|0x0035) plen 5  #201 [hci1] 12.246089
        Num handles: 1
        Handle: 180 Address: DF:A9:FF:F6:B1:1A (OUI DF-A9-FF)
        Count: 1
< ACL Data TX: Handle 180 flags 0x00 dlen 21              #202 [hci1] 12.246306
      SMP: Pairing Confirm (0x03) len 16
        Confim value: 0d329c33c12d5ea231abb93320b2ffcc
> HCI Event: Number of Completed Packets (0x13) plen 5    #203 [hci1] 12.294270
        Num handles: 1
        Handle: 180 Address: DF:A9:FF:F6:B1:1A (OUI DF-A9-FF)
        Count: 1
        #202: len 21 (3 Kb/s)
        Latency: 47 msec (17-48 msec ~47 msec)
> ACL Data RX: Handle 180 flags 0x02 dlen 21              #204 [hci1] 12.344197
      SMP: Pairing Confirm (0x03) len 16
        Confim value: 4bda3a111c0f8830312cf27c9582fcdf
< HCI Command: Host Number of Com.. (0x03|0x0035) plen 5  #205 [hci1] 12.345657
        Num handles: 1
        Handle: 180 Address: DF:A9:FF:F6:B1:1A (OUI DF-A9-FF)
        Count: 1
< ACL Data TX: Handle 180 flags 0x00 dlen 21              #206 [hci1] 12.345666
      SMP: Pairing Random (0x04) len 16
        Random value: c2476823e41736a7e381bafb7c3fcffc
> HCI Event: Number of Completed Packets (0x13) plen 5    #207 [hci1] 12.394023
        Num handles: 1
        Handle: 180 Address: DF:A9:FF:F6:B1:1A (OUI DF-A9-FF)
        Count: 1
        #206: len 21 (3 Kb/s)
        Latency: 48 msec (17-48 msec ~48 msec)
> ACL Data RX: Handle 180 flags 0x02 dlen 21              #208 [hci1] 12.594163
      SMP: Pairing Random (0x04) len 16
        Random value: 533eb24ce10ba03a21a22d8b7fc6e8cb
< HCI Command: Host Number of Com.. (0x03|0x0035) plen 5  #209 [hci1] 12.606205
        Num handles: 1
        Handle: 180 Address: DF:A9:FF:F6:B1:1A (OUI DF-A9-FF)
        Count: 1
< ACL Data TX: Handle 180 flags 0x00 dlen 21              #210 [hci1] 12.606464
      SMP: Pairing Confirm (0x03) len 16
        Confim value: ab4c256138e911af483a8fa489717de7
> HCI Event: Number of Completed Packets (0x13) plen 5    #211 [hci1] 12.644045
        Num handles: 1
        Handle: 180 Address: DF:A9:FF:F6:B1:1A (OUI DF-A9-FF)
        Count: 1
        #210: len 21 (4 Kb/s)
        Latency: 37 msec (17-48 msec ~42 msec)
> ACL Data RX: Handle 180 flags 0x02 dlen 21              #212 [hci1] 12.694087
      SMP: Pairing Confirm (0x03) len 16
        Confim value: e12c341c7f7f3d7940cb802a26b72a54
< HCI Command: Host Number of Com.. (0x03|0x0035) plen 5  #213 [hci1] 12.705969
        Num handles: 1
        Handle: 180 Address: DF:A9:FF:F6:B1:1A (OUI DF-A9-FF)
        Count: 1
< ACL Data TX: Handle 180 flags 0x00 dlen 21              #214 [hci1] 12.706273
      SMP: Pairing Random (0x04) len 16
        Random value: d9b0b09bc4296bf8753a8f6e1fa7d968
> HCI Event: Number of Completed Packets (0x13) plen 5    #215 [hci1] 12.743898
        Num handles: 1
        Handle: 180 Address: DF:A9:FF:F6:B1:1A (OUI DF-A9-FF)
        Count: 1
        #214: len 21 (4 Kb/s)
        Latency: 37 msec (17-48 msec ~40 msec)
> ACL Data RX: Handle 180 flags 0x02 dlen 21              #216 [hci1] 12.994121
      SMP: Pairing Random (0x04) len 16
        Random value: 3350c6af65c56b493a1f11e6625d3118
< HCI Command: Host Number of Com.. (0x03|0x0035) plen 5  #217 [hci1] 13.006269
        Num handles: 1
        Handle: 180 Address: DF:A9:FF:F6:B1:1A (OUI DF-A9-FF)
        Count: 1
< ACL Data TX: Handle 180 flags 0x00 dlen 21              #218 [hci1] 13.006455
      SMP: Pairing Confirm (0x03) len 16
        Confim value: 59262e5fd725c2c8cc2c276ea6a5ff39
> HCI Event: Number of Completed Packets (0x13) plen 5    #219 [hci1] 13.043923
        Num handles: 1
        Handle: 180 Address: DF:A9:FF:F6:B1:1A (OUI DF-A9-FF)
        Count: 1
        #218: len 21 (4 Kb/s)
        Latency: 37 msec (17-48 msec ~38 msec)
> ACL Data RX: Handle 180 flags 0x02 dlen 21              #220 [hci1] 13.094136
      SMP: Pairing Confirm (0x03) len 16
        Confim value: b9a39179e261ace4577c379f413ee1d7
< HCI Command: Host Number of Com.. (0x03|0x0035) plen 5  #221 [hci1] 13.106024
        Num handles: 1
        Handle: 180 Address: DF:A9:FF:F6:B1:1A (OUI DF-A9-FF)
        Count: 1
< ACL Data TX: Handle 180 flags 0x00 dlen 21              #222 [hci1] 13.106319
      SMP: Pairing Random (0x04) len 16
        Random value: f00de1357c99cea2f6ddb09677d02f35
> HCI Event: Number of Completed Packets (0x13) plen 5    #223 [hci1] 13.144015
        Num handles: 1
        Handle: 180 Address: DF:A9:FF:F6:B1:1A (OUI DF-A9-FF)
        Count: 1
        #222: len 21 (4 Kb/s)
        Latency: 37 msec (17-48 msec ~38 msec)
> ACL Data RX: Handle 180 flags 0x02 dlen 21              #224 [hci1] 13.394128
      SMP: Pairing Random (0x04) len 16
        Random value: f7c5297c5fb2ea4cf1c102c160f19636
< HCI Command: Host Number of Com.. (0x03|0x0035) plen 5  #225 [hci1] 13.405714
        Num handles: 1
        Handle: 180 Address: DF:A9:FF:F6:B1:1A (OUI DF-A9-FF)
        Count: 1
< ACL Data TX: Handle 180 flags 0x00 dlen 21              #226 [hci1] 13.405723
      SMP: Pairing DHKey Check (0x0d) len 16
        E: 04753f924412c6e45bceb6cbb9593e16
> HCI Event: Number of Completed Packets (0x13) plen 5    #227 [hci1] 13.443958
        Num handles: 1
        Handle: 180 Address: DF:A9:FF:F6:B1:1A (OUI DF-A9-FF)
        Count: 1
        #226: len 21 (4 Kb/s)
        Latency: 38 msec (17-48 msec ~38 msec)
> ACL Data RX: Handle 180 flags 0x02 dlen 21              #228 [hci1] 13.494074
      SMP: Pairing DHKey Check (0x0d) len 16
        E: a288fb4f9df69027c5e27ebfb56c9940
< HCI Command: LE Start Encryption (0x08|0x0019) plen 28  #229 [hci1] 13.505695
        Handle: 180 Address: DF:A9:FF:F6:B1:1A (OUI DF-A9-FF)
        Random number: 0x0000000000000000
        Encrypted diversifier: 0x0000
        Long term key: 7b7f4b40461df8d861b1517f7f91c319
> HCI Event: Command Status (0x0f) plen 4                 #230 [hci1] 13.506762
      LE Start Encryption (0x08|0x0019) ncmd 1
        Status: Success (0x00)
