Bluetooth monitor ver 5.72
= Note: Linux version 6.14.0-36-generic (x86_64)                       0.291201
= Note: Bluetooth subsystem version 2.22                               0.291202
= New Index: 00:00:00:00:00:00 (Primary,UART,hci2)              [hci2] 0.291203
= New Index: 00:00:00:00:00:00 (Primary,UART,hci1)              [hci1] 0.291204
= New Index: 48:5F:99:8E:E0:64 (Primary,USB,hci0)               [hci0] 0.291204
= Open Index: 00:00:00:00:00:00                                 [hci1] 0.404407
= Index Info: 00:00:00:00:00:00 (Nordic Semiconductor ASA)      [hci1] 0.404412
@ USER Open: main (privileged) version 2.22            {0x0001} [hci1] 0.404415
< HCI Command: Reset (0x03|0x0003) plen 0                    #1 [hci1] 0.404745
> HCI Event: Command Complete (0x0e) plen 4                  #2 [hci1] 0.405309
      Reset (0x03|0x0003) ncmd 1
        Status: Success (0x00)
< HCI Command: Read Local Supported... (0x04|0x0003) plen 0  #3 [hci1] 0.424338
> HCI Event: Command Complete (0x0e) plen 12                 #4 [hci1] 0.424908
      Read Local Supported Features (0x04|0x0003) ncmd 1
        Status: Success (0x00)
        Features: 0x00 0x00 0x00 0x00 0x60 0x00 0x00 0x00
          BR/EDR Not Supported
          LE Supported (Controller)
< HCI Command: Read Local Version In.. (0x04|0x0001) plen 0  #5 [hci1] 0.444313
> HCI Event: Command Complete (0x0e) plen 12                 #6 [hci1] 0.444891
      Read Local Version Information (0x04|0x0001) ncmd 1
        Status: Success (0x00)
        HCI version: Reserved (0x0f) - Revision 12393 (0x3069)
        LMP version: Reserved (0x0f) - Subversion 12393 (0x3069)
        Manufacturer: Nordic Semiconductor ASA (89)
< HCI Command: Read Local Supported... (0x04|0x0002) plen 0  #7 [hci1] 0.464304
> HCI Event: Command Complete (0x0e) plen 68                 #8 [hci1] 0.465481
      Read Local Supported Commands (0x04|0x0002) ncmd 1
        Status: Success (0x00)
        Commands: 119 entries
          Disconnect (Octet 0 - Bit 5)
          Read Remote Version Information (Octet 2 - Bit 7)
          Set Event Mask (Octet 5 - Bit 6)
          Reset (Octet 5 - Bit 7)
          Read Connection Accept Timeout (Octet 7 - Bit 2)
          Write Connection Accept Timeout (Octet 7 - Bit 3)
          Read Transmit Power Level (Octet 10 - Bit 2)
          Set Controller To Host Flow Control (Octet 10 - Bit 5)
          Host Buffer Size (Octet 10 - Bit 6)
          Host Number of Completed Packets (Octet 10 - Bit 7)
          Read Local Version Information (Octet 14 - Bit 3)
          Read Local Supported Features (Octet 14 - Bit 5)
          Read BD ADDR (Octet 15 - Bit 1)
          Read RSSI (Octet 15 - Bit 5)
          Set Event Mask Page 2 (Octet 22 - Bit 2)
          LE Set Event Mask (Octet 25 - Bit 0)
          LE Read Buffer Size (Octet 25 - Bit 1)
          LE Read Local Supported Features (Octet 25 - Bit 2)
          LE Set Random Address (Octet 25 - Bit 4)
          LE Set Advertising Parameters (Octet 25 - Bit 5)
          LE Read Advertising Channel TX Power (Octet 25 - Bit 6)
          LE Set Advertising Data (Octet 25 - Bit 7)
          LE Set Scan Response Data (Octet 26 - Bit 0)
          LE Set Advertise Enable (Octet 26 - Bit 1)
          LE Set Scan Parameters (Octet 26 - Bit 2)
          LE Set Scan Enable (Octet 26 - Bit 3)
          LE Create Connection (Octet 26 - Bit 4)
          LE Create Connection Cancel (Octet 26 - Bit 5)
          LE Read Accept List Size (Octet 26 - Bit 6)
          LE Clear Accept List (Octet 26 - Bit 7)
          LE Add Device To Accept List (Octet 27 - Bit 0)
          LE Remove Device From Accept List (Octet 27 - Bit 1)
          LE Connection Update (Octet 27 - Bit 2)
          LE Set Host Channel Classification (Octet 27 - Bit 3)
          LE Read Channel Map (Octet 27 - Bit 4)
          LE Read Remote Used Features (Octet 27 - Bit 5)
          LE Encrypt (Octet 27 - Bit 6)
          LE Rand (Octet 27 - Bit 7)
          LE Start Encryption (Octet 28 - Bit 0)
          LE Long Term Key Request Reply (Octet 28 - Bit 1)
          LE Long Term Key Request Neg Reply (Octet 28 - Bit 2)
          LE Read Supported States (Octet 28 - Bit 3)
          LE Receiver Test (Octet 28 - Bit 4)
          LE Transmitter Test (Octet 28 - Bit 5)
          LE Test End (Octet 28 - Bit 6)
          Read Authenticated Payload Timeout (Octet 32 - Bit 4)
          Write Authenticated Payload Timeout (Octet 32 - Bit 5)
          LE Set Data Length (Octet 33 - Bit 6)
          LE Read Suggested Default Data Length (Octet 33 - Bit 7)
          LE Write Suggested Default Data Length (Octet 34 - Bit 0)
          LE Add Device To Resolving List (Octet 34 - Bit 3)
          LE Remove Device From Resolving List (Octet 34 - Bit 4)
          LE Clear Resolving List (Octet 34 - Bit 5)
          LE Read Resolving List Size (Octet 34 - Bit 6)
          LE Set Address Resolution Enable (Octet 35 - Bit 1)
          LE Set Resolvable Private Address Timeout (Octet 35 - Bit 2)
          LE Read Maximum Data Length (Octet 35 - Bit 3)
          LE Read PHY (Octet 35 - Bit 4)
          LE Set Default PHY (Octet 35 - Bit 5)
          LE Set PHY (Octet 35 - Bit 6)
          LE Enhanced Receiver Test (Octet 35 - Bit 7)
          LE Enhanced Transmitter Test (Octet 36 - Bit 0)
          LE Set Advertising Set Random Address (Octet 36 - Bit 1)
          LE Set Extended Advertising Parameters (Octet 36 - Bit 2)
          LE Set Extended Advertising Data (Octet 36 - Bit 3)
          LE Set Extended Scan Response Data (Octet 36 - Bit 4)
          LE Set Extended Advertising Enable (Octet 36 - Bit 5)
          LE Read Maximum Advertising Data Length (Octet 36 - Bit 6)
          LE Read Number of Supported Advertising Sets (Octet 36 - Bit 7)
          LE Remove Advertising Set (Octet 37 - Bit 0)
          LE Clear Advertising Sets (Octet 37 - Bit 1)
          LE Set Periodic Advertising Parameters (Octet 37 - Bit 2)
          LE Set Periodic Advertising Data (Octet 37 - Bit 3)
          LE Set Periodic Advertising Enable (Octet 37 - Bit 4)
          LE Set Extended Scan Parameters (Octet 37 - Bit 5)
          LE Set Extended Scan Enable (Octet 37 - Bit 6)
          LE Extended Create Connection (Octet 37 - Bit 7)
          LE Periodic Advertising Create Sync (Octet 38 - Bit 0)
          LE Periodic Advertising Create Sync Cancel (Octet 38 - Bit 1)
          LE Periodic Advertising Terminate Sync (Octet 38 - Bit 2)
          LE Add Device To Periodic Advertiser List (Octet 38 - Bit 3)
          LE Remove Device From Periodic Advertiser List (Octet 38 - Bit 4)
          LE Clear Periodic Advertiser List (Octet 38 - Bit 5)
          LE Read Periodic Advertiser List Size (Octet 38 - Bit 6)
          LE Read Transmit Power (Octet 38 - Bit 7)
          LE Read RF Path Compensation (Octet 39 - Bit 0)
          LE Write RF Path Compensation (Octet 39 - Bit 1)
          LE Set Privacy Mode (Octet 39 - Bit 2)
          LE Periodic Advertising Receive Enable (Octet 40 - Bit 5)
          LE Periodic Advertising Sync Transfer (Octet 40 - Bit 6)
          LE Periodic Advertising Set Info Transfer (Octet 40 - Bit 7)
          LE Periodic Advertising Sync Transfer Parameters (Octet 41 - Bit 0)
          LE Set Default Periodic Advertisng Sync Transfer Parameters (Octet 41 - Bit 1)
          LE Read Buffer v2 (Octet 41 - Bit 5)
          LE Read ISO TX Sync (Octet 41 - Bit 6)
          LE Set Connected Isochronous Group Parameters (Octet 41 - Bit 7)
          LE Set Connected Isochronous Group Parameters Test (Octet 42 - Bit 0)
          LE Create Connected Isochronous Stream (Octet 42 - Bit 1)
          LE Remove Connected Isochronous Group (Octet 42 - Bit 2)
          LE Accept Connected Isochronous Stream Request (Octet 42 - Bit 3)
          LE Reject Connected Isochronous Stream Request (Octet 42 - Bit 4)
          LE Create Broadcast Isochronous Group (Octet 42 - Bit 5)
          LE Create Broadcast Isochronous Group Test (Octet 42 - Bit 6)
          LE Terminate Broadcast Isochronous Group (Octet 42 - Bit 7)
          LE Broadcast Isochronous Group Create Sync (Octet 43 - Bit 0)
          LE Broadcast Isochronous Group Terminate Sync (Octet 43 - Bit 1)
          LE Request Peer SCA (Octet 43 - Bit 2)
          LE Setup Isochronous Data Path (Octet 43 - Bit 3)
          LE Remove Isochronous Data Path (Octet 43 - Bit 4)
          LE Isochronous Transmit Test (Octet 43 - Bit 5)
          LE Isochronous Receive Test (Octet 43 - Bit 6)
          LE Isochronous Read Test Counters (Octet 43 - Bit 7)
          LE Isochronous Read Test Counters (Octet 44 - Bit 0)
          LE Set Host Feature (Octet 44 - Bit 1)
          Octet 44 - Bit 2 
          Octet 45 - Bit 6 
          Octet 46 - Bit 0 
          Octet 46 - Bit 1 
          Octet 46 - Bit 2 
< HCI Command: Host Buffer Size (0x03|0x0033) plen 7         #9 [hci1] 0.484314
        ACL MTU: 255  ACL max packet: 16
        SCO MTU: 0    SCO max packet: 0
> HCI Event: Command Complete (0x0e) plen 4                 #10 [hci1] 0.484890
      Host Buffer Size (0x03|0x0033) ncmd 1
        Status: Success (0x00)
< HCI Command: Set Controller To Ho.. (0x03|0x0031) plen 1  #11 [hci1] 0.504302
        Flow control: ACL Data Packets (0x01)
> HCI Event: Command Complete (0x0e) plen 4                 #12 [hci1] 0.504890
      Set Controller To Host Flow Control (0x03|0x0031) ncmd 1
        Status: Success (0x00)
< HCI Command: LE Read Local Suppor.. (0x08|0x0003) plen 0  #13 [hci1] 0.524308
> HCI Event: Command Complete (0x0e) plen 12                #14 [hci1] 0.524837
      LE Read Local Supported Features (0x08|0x0003) ncmd 1
        Status: Success (0x00)
        Features: 0xfd 0x79 0x00 0xf7 0x30 0x01 0x00 0x00
          LE Encryption
          Extended Reject Indication
          Peripheral-initiated Features Exchange
          LE Ping
          LE Data Packet Length Extension
          LL Privacy
          Extended Scanner Filter Policies
          LE 2M PHY
          LE Coded PHY
          LE Extended Advertising
          LE Periodic Advertising
          Channel Selection Algorithm #2
          Periodic Advertising Sync Transfer - Sender
          Periodic Advertising Sync Transfer - Recipient
          Sleep Clock Accuracy Updates
          Connected Isochronous Stream - Central
          Connected Isochronous Stream - Peripheral
          Isochronous Broadcaster
          Synchronized Receiver
          Periodic Advertising ADI support
          Connection Subrating
          Unknown features (0x0000010000000000)
< HCI Command: LE Set Host Feature (0x08|0x0074) plen 2     #15 [hci1] 0.544313
        Bit Number: 32
          Connected Isochronous Stream (Host Support)
        Bit Value: 1
> HCI Event: Command Complete (0x0e) plen 4                 #16 [hci1] 0.544853
      LE Set Host Feature (0x08|0x0074) ncmd 1
        Status: Success (0x00)
< HCI Command: LE Read Buffer v2 (0x08|0x0060) plen 0       #17 [hci1] 0.564313
> HCI Event: Command Complete (0x0e) plen 10                #18 [hci1] 0.564884
      LE Read Buffer v2 (0x08|0x0060) ncmd 1
        Status: Success (0x00)
        ACL MTU: 27
        ACL max packet: 3
        ISO MTU: 318
        ISO max packet: 3
< HCI Command: LE Read Maximum Adve.. (0x08|0x003a) plen 0  #19 [hci1] 0.584358
> HCI Event: Command Complete (0x0e) plen 6                 #20 [hci1] 0.584829
      LE Read Maximum Advertising Data Length (0x08|0x003a) ncmd 1
        Status: Success (0x00)
        Max length: 1650
< HCI Command: LE Read Supported St.. (0x08|0x001c) plen 0  #21 [hci1] 0.604383
> HCI Event: Command Complete (0x0e) plen 12                #22 [hci1] 0.604915
      LE Read Supported States (0x08|0x001c) ncmd 1
        Status: Success (0x00)
        States: 0x000003ff3e0306ff
          Non-connectable Advertising State
          Scannable Advertising State
          Connectable Advertising State
          High Duty Cycle Directed Advertising State
          Passive Scanning State
          Active Scanning State
          Initiating State
            and Connection State (Central Role)
          Connection State (Peripheral Role)
          Scannable Advertising State
            and Passive Scanning State
          Connectable Advertising State
            and Passive Scanning State
          Non-connectable Advertising State
            and Initiating State
          Scannable Advertising State
            and Initiating State
          Active Scanning State
            and Connection State (Central Role)
          Passive Scanning State
            and Connection State (Peripheral Role)
          Active Scanning State
            and Connection State (Peripheral Role)
          Initiating State
            and Connection State (Central Role)
            and Central Role & Central Role
          Low Duty Cycle Directed Advertising State
          Connectable Advertising State
            and Initiating State
            and Central Role & Peripheral Role
          High Duty Cycle Directed Advertising State
            and Initiating State
            and Central Role & Peripheral Role
          Low Duty Cycle Directed Advertising State
            and Initiating State
            and Central Role & Peripheral Role
          Connectable Advertising State
            and Connection State (Central Role)
            and Central Role & Peripheral Role
          High Duty Cycle Directed Advertising State
            and Connection State (Central Role)
            and Central Role & Peripheral Role
          Low Duty Cycle Directed Advertising State
            and Connection State (Central Role)
            and Central Role & Peripheral Role
          Connectable Advertising State
            and Connection State (Peripheral Role)
            and Central Role & Peripheral Role
          High Duty Cycle Directed Advertising State
            and Connection State (Peripheral Role)
            and Peripheral Role & Peripheral Role
          Low Duty Cycle Directed Advertising State
            and Connection State (Peripheral Role)
            and Peripheral Role & Peripheral Role
          Initiating State
            and Connection State (Peripheral Role)
            and Central Role & Peripheral Role
< HCI Command: LE Read Maximum Data.. (0x08|0x002f) plen 0  #23 [hci1] 0.624328
> HCI Event: Command Complete (0x0e) plen 12                #24 [hci1] 0.624917
      LE Read Maximum Data Length (0x08|0x002f) ncmd 1
        Status: Success (0x00)
        Max TX octets: 251
        Max TX time: 2704
        Max RX octets: 251
        Max RX time: 2704
< HCI Command: LE Write Suggested D.. (0x08|0x0024) plen 4  #25 [hci1] 0.644340
        TX octets: 251
        TX time: 2704
> HCI Event: Command Complete (0x0e) plen 4                 #26 [hci1] 0.644895
      LE Write Suggested Default Data Length (0x08|0x0024) ncmd 1
        Status: Success (0x00)
< HCI Command: LE Read Resolving Li.. (0x08|0x002a) plen 0  #27 [hci1] 0.664379
> HCI Event: Command Complete (0x0e) plen 5                 #28 [hci1] 0.664880
      LE Read Resolving List Size (0x08|0x002a) ncmd 1
        Status: Success (0x00)
        Size: 8
< HCI Command: LE Set Event Mask (0x08|0x0001) plen 8       #29 [hci1] 0.684337
        Mask: 0x000002023f87fa5e
          LE Advertising Report
          LE Connection Update Complete
          LE Read Remote Used Features Complete
          LE Long Term Key Request
          LE Data Length Change
          LE Enhanced Connection Complete
          LE PHY Update Complete
          LE Extended Advertising Report
          LE Periodic Advertising Sync Established
          LE Periodic Advertising Report
          LE Periodic Advertising Sync Lost
          LE Extended Scan Timeout
          LE Extended Advertising Set Terminated
          LE Scan Request Received
          LE Periodic Advertising Sync Transfer Rvc
          LE CIS Established
          LE CIS Request
          LE Create BIG Complete
          LE Terminate BIG Complete
          LE BIG Sync Estabilished Complete
          LE BIG Sync Lost
          LE BIG Info Advertising Report
          Unknown mask (0x0000020000000000)
> HCI Event: Command Complete (0x0e) plen 4                 #30 [hci1] 0.684917
      LE Set Event Mask (0x08|0x0001) ncmd 1
        Status: Success (0x00)
< HCI Command: Set Event Mask (0x03|0x0001) plen 8          #31 [hci1] 0.704336
        Mask: 0x2000800002008890
          Disconnection Complete
          Encryption Change
          Read Remote Version Information Complete
          Hardware Error
          Data Buffer Overflow
          Encryption Key Refresh Complete
          LE Meta
> HCI Event: Command Complete (0x0e) plen 4                 #32 [hci1] 0.704920
      Set Event Mask (0x03|0x0001) ncmd 1
        Status: Success (0x00)
< HCI Command: Read BD ADDR (0x04|0x0009) plen 0            #33 [hci1] 0.724315
> HCI Event: Command Complete (0x0e) plen 10                #34 [hci1] 0.724853
      Read BD ADDR (0x04|0x0009) ncmd 1
        Status: Success (0x00)
        Address: 00:00:00:00:00:00 (OUI 00-00-00)
< HCI Command: LE Set Random Address (0x08|0x0005) plen 6   #35 [hci1] 0.744356
        Address: D5:B6:CC:31:DB:3B (Static)
> HCI Event: Command Complete (0x0e) plen 4                 #36 [hci1] 0.744850
      LE Set Random Address (0x08|0x0005) ncmd 1
        Status: Success (0x00)
< HCI Command: LE Set Extended Adv.. (0x08|0x0036) plen 25  #37 [hci1] 5.034458
        Handle: 0x00
        Properties: 0x0013
          Connectable
          Scannable
          Use legacy advertising PDUs: ADV_IND
        Min advertising interval: 100.000 msec (0x00a0)
        Max advertising interval: 150.000 msec (0x00f0)
        Channel map: 37, 38, 39 (0x07)
        Own address type: Random (0x01)
        Peer address type: Public (0x00)
        Peer address: 00:00:00:00:00:00 (OUI 00-00-00)
        Filter policy: Allow Scan Request from Any, Allow Connect Request from Any (0x00)
        TX power: Host has no preference (0x7f)
        Primary PHY: LE 1M (0x01)
        Secondary max skip: 0x00
        Secondary PHY: LE 1M (0x01)
        SID: 0x00
        Scan request notifications: Disabled (0x00)
> HCI Event: Command Complete (0x0e) plen 5                 #38 [hci1] 5.035264
      LE Set Extended Advertising Parameters (0x08|0x0036) ncmd 1
        Status: Success (0x00)
        TX power (selected): 0 dbm (0x00)
< HCI Command: LE Set Advertising S.. (0x08|0x0035) plen 7  #39 [hci1] 5.044421
        Advertising handle: 0x00
        Advertising random address: D5:B6:CC:31:DB:3B (Static)
> HCI Event: Command Complete (0x0e) plen 4                 #40 [hci1] 5.044984
      LE Set Advertising Set Random Address (0x08|0x0035) ncmd 1
        Status: Success (0x00)
< HCI Command: LE Set Extended Adv.. (0x08|0x0037) plen 22  #41 [hci1] 5.064440
        Handle: 0x00
        Operation: Complete extended advertising data (0x03)
        Fragment preference: Minimize fragmentation (0x01)
        Data length: 0x12
        Flags: 0x06
          LE General Discoverable Mode
          BR/EDR Not Supported
        Name (complete): Tester_F6B11A
> HCI Event: Command Complete (0x0e) plen 4                 #42 [hci1] 5.065265
      LE Set Extended Advertising Data (0x08|0x0037) ncmd 1
        Status: Success (0x00)
< HCI Command: LE Set Extended Scan.. (0x08|0x0038) plen 4  #43 [hci1] 5.084424
        Handle: 0x00
        Operation: Complete scan response data (0x03)
        Fragment preference: Minimize fragmentation (0x01)
        Data length: 0x00
> HCI Event: Command Complete (0x0e) plen 4                 #44 [hci1] 5.085048
      LE Set Extended Scan Response Data (0x08|0x0038) ncmd 1
        Status: Success (0x00)
< HCI Command: LE Set Extended Adve.. (0x08|0x0039) plen 6  #45 [hci1] 5.104432
        Extended advertising: Enabled (0x01)
        Number of sets: 1 (0x01)
        Entry 0
          Handle: 0x00
          Duration: 0 ms (0x00)
          Max ext adv events: 0
> HCI Event: Command Complete (0x0e) plen 4                 #46 [hci1] 5.105010
      LE Set Extended Advertising Enable (0x08|0x0039) ncmd 1
        Status: Success (0x00)
> HCI Event: LE Meta Event (0x3e) plen 31                   #47 [hci1] 5.536512
      LE Enhanced Connection Complete (0x0a)
        Status: Success (0x00)
        Handle: 1947
        Role: Peripheral (0x01)
        Peer address type: Public (0x00)
        Peer address: DF:A9:FF:F6:B1:1A (OUI DF-A9-FF)
        Local resolvable private address: 00:00:00:00:00:00 (Non-Resolvable)
        Peer resolvable private address: 00:00:00:00:00:00 (Non-Resolvable)
        Connection interval: 87.50 msec (0x0046)
        Connection latency: 0 (0x0000)
        Supervision timeout: 20000 msec (0x07d0)
        Central clock accuracy: 0x01
> HCI Event: LE Meta Event (0x3e) plen 6                    #48 [hci1] 5.536597
      LE Advertising Set Terminated (0x12)
        Status: Success (0x00)
        Handle: 0
        Connection handle: 1947
        Number of completed extended advertising events: 0
< HCI Command: LE Read Remote Used... (0x08|0x0016) plen 2  #49 [hci1] 5.544764
        Handle: 1947 Address: DF:A9:FF:F6:B1:1A (OUI DF-A9-FF)
> HCI Event: Command Status (0x0f) plen 4                   #50 [hci1] 5.545247
      LE Read Remote Used Features (0x08|0x0016) ncmd 1
        Status: Success (0x00)
> HCI Event: LE Meta Event (0x3e) plen 12                   #51 [hci1] 5.800362
      LE Read Remote Used Features (0x04)
        Status: Success (0x00)
        Handle: 1947 Address: DF:A9:FF:F6:B1:1A (OUI DF-A9-FF)
        Features: 0x2d 0x49 0x00 0xf7 0x67 0xd9 0x00 0x80
          LE Encryption
          Extended Reject Indication
          Peripheral-initiated Features Exchange
          LE Data Packet Length Extension
          LE 2M PHY
          LE Coded PHY
          Channel Selection Algorithm #2
          Periodic Advertising Sync Transfer - Sender
          Periodic Advertising Sync Transfer - Recipient
          Sleep Clock Accuracy Updates
          Connected Isochronous Stream - Central
          Connected Isochronous Stream - Peripheral
          Isochronous Broadcaster
          Synchronized Receiver
          Connected Isochronous Stream (Host Support)
          LE Power Control Request
          LE Power Control Request
          Connection Subrating
          Connection Subrating (Host Support)
          Unknown features (0x8000d90000000000)
< ACL Data TX: Handle 1947 flags 0x00 dlen 16              #52 [hci1] 10.554772
      LE L2CAP: Connection Parameter Update Request (0x12) ident 1 len 8
        Min interval: 24
        Max interval: 40
        Peripheral latency: 0
        Timeout multiplier: 42
> HCI Event: Number of Completed Packets (0x13) plen 5     #53 [hci1] 10.700005
        Num handles: 1
        Handle: 1947 Address: DF:A9:FF:F6:B1:1A (OUI DF-A9-FF)
        Count: 1
        #52: len 16 (0 Kb/s)
        Latency: 145 msec (145-145 msec ~145 msec)
> ACL Data RX: Handle 1947 flags 0x02 dlen 10              #54 [hci1] 10.700318
      LE L2CAP: Connection Parameter Update Response (0x13) ident 1 len 2
        Result: Connection Parameters accepted (0x0000)
< HCI Command: Host Number of Comp.. (0x03|0x0035) plen 5  #55 [hci1] 10.704953
        Num handles: 1
        Handle: 1947 Address: DF:A9:FF:F6:B1:1A (OUI DF-A9-FF)
        Count: 1
> ACL Data RX: Handle 1947 flags 0x02 dlen 11              #56 [hci1] 13.412571
      SMP: Pairing Request (0x01) len 6
        IO capability: KeyboardDisplay (0x04)
        OOB data: Authentication data not present (0x00)
        Authentication requirement: Bonding, No MITM, SC, No Keypresses (0x09)
        Max encryption key size: 16
        Initiator key distribution: EncKey IdKey Sign (0x07)
        Responder key distribution: EncKey IdKey Sign (0x07)
< HCI Command: Host Number of Comp.. (0x03|0x0035) plen 5  #57 [hci1] 13.424851
        Num handles: 1
        Handle: 1947 Address: DF:A9:FF:F6:B1:1A (OUI DF-A9-FF)
        Count: 1
< ACL Data TX: Handle 1947 flags 0x00 dlen 11              #58 [hci1] 13.424912
      SMP: Pairing Response (0x02) len 6
        IO capability: NoInputNoOutput (0x03)
        OOB data: Authentication data not present (0x00)
        Authentication requirement: Bonding, No MITM, SC, No Keypresses (0x09)
        Max encryption key size: 16
        Initiator key distribution: IdKey (0x02)
        Responder key distribution: <none> (0x00)
> HCI Event: Number of Completed Packets (0x13) plen 5     #59 [hci1] 13.587662
        Num handles: 1
        Handle: 1947 Address: DF:A9:FF:F6:B1:1A (OUI DF-A9-FF)
        Count: 1
        #58: len 11 (0 Kb/s)
        Latency: 162 msec (145-162 msec ~153 msec)
> ACL Data RX: Handle 1947 flags 0x02 dlen 27              #60 [hci1] 13.588059
> ACL Data RX: Handle 1947 flags 0x01 dlen 27              #61 [hci1] 13.588501
> ACL Data RX: Handle 1947 flags 0x01 dlen 15              #62 [hci1] 13.589014
      SMP: Pairing Public Key (0x0c) len 64
        X: 24fa7bcc6134cf8976b557b52a475beca7364be8289f575a26fc7589c030b4a9
        Y: dfefed74f261e2ae1e6e309707e97fde0eacfd915e7bf4d31df1abd128939b77
< HCI Command: Host Number of Comp.. (0x03|0x0035) plen 5  #63 [hci1] 13.605317
        Num handles: 1
        Handle: 1947 Address: DF:A9:FF:F6:B1:1A (OUI DF-A9-FF)
        Count: 1
< HCI Command: Host Number of Comp.. (0x03|0x0035) plen 5  #64 [hci1] 13.605514
        Num handles: 1
        Handle: 1947 Address: DF:A9:FF:F6:B1:1A (OUI DF-A9-FF)
        Count: 1
< HCI Command: Host Number of Comp.. (0x03|0x0035) plen 5  #65 [hci1] 13.605795
        Num handles: 1
        Handle: 1947 Address: DF:A9:FF:F6:B1:1A (OUI DF-A9-FF)
        Count: 1
< ACL Data TX: Handle 1947 flags 0x00 dlen 27              #66 [hci1] 13.605905
< ACL Data TX: Handle 1947 flags 0x01 dlen 27              #67 [hci1] 13.605936
< ACL Data TX: Handle 1947 flags 0x01 dlen 15              #68 [hci1] 13.605996
      SMP: Pairing Public Key (0x0c) len 64
        X: 98308440221e2d910f0e54b71e7ec652857aa9b5a0dc65028824cc19db1226e9
        Y: 67a4816bcb62efb21701e31fdb27561a6217575fb007a8bbdabe7e28b6f68482
> HCI Event: Number of Completed Packets (0x13) plen 5     #69 [hci1] 13.675555
        Num handles: 1
        Handle: 1947 Address: DF:A9:FF:F6:B1:1A (OUI DF-A9-FF)
        Count: 1
        #66: len 27 (3 Kb/s)
        Latency: 69 msec (69-162 msec ~111 msec)
> HCI Event: Number of Completed Packets (0x13) plen 5     #70 [hci1] 13.676256
        Num handles: 1
        Handle: 1947 Address: DF:A9:FF:F6:B1:1A (OUI DF-A9-FF)
        Count: 1
        #67: len 27 (3 Kb/s)
        Latency: 70 msec (69-162 msec ~91 msec)
< ACL Data TX: Handle 1947 flags 0x00 dlen 21              #71 [hci1] 13.684869
      SMP: Pairing Confirm (0x03) len 16
        Confim value: 015dfe631d02f4ec3f3d85d975eea205
> HCI Event: Number of Completed Packets (0x13) plen 5     #72 [hci1] 13.762375
        Num handles: 1
        Handle: 1947 Address: DF:A9:FF:F6:B1:1A (OUI DF-A9-FF)
        Count: 1
        #68: len 15 (0 Kb/s)
        Latency: 156 msec (69-162 msec ~123 msec)
> HCI Event: Number of Completed Packets (0x13) plen 5     #73 [hci1] 13.850072
        Num handles: 1
        Handle: 1947 Address: DF:A9:FF:F6:B1:1A (OUI DF-A9-FF)
        Count: 1
        #71: len 21 (1 Kb/s)
        Latency: 165 msec (69-165 msec ~144 msec)
> ACL Data RX: Handle 1947 flags 0x02 dlen 21              #74 [hci1] 13.850498
      SMP: Pairing Random (0x04) len 16
        Random value: d45ee5aa5f61bf8f0000000000000000
< HCI Command: Host Number of Comp.. (0x03|0x0035) plen 5  #75 [hci1] 13.864971
        Num handles: 1
        Handle: 1947 Address: DF:A9:FF:F6:B1:1A (OUI DF-A9-FF)
        Count: 1
< ACL Data TX: Handle 1947 flags 0x00 dlen 21              #76 [hci1] 13.865044
      SMP: Pairing Random (0x04) len 16
        Random value: 8e6108f966a694cbe26df70bb96773e6
> HCI Event: Number of Completed Packets (0x13) plen 5     #77 [hci1] 14.024946
        Num handles: 1
        Handle: 1947 Address: DF:A9:FF:F6:B1:1A (OUI DF-A9-FF)
        Count: 1
        #76: len 21 (1 Kb/s)
        Latency: 159 msec (69-165 msec ~152 msec)
> ACL Data RX: Handle 1947 flags 0x02 dlen 21              #78 [hci1] 14.112734
      SMP: Pairing DHKey Check (0x0d) len 16
        E: 93a5b775929df513237170c515241cb7
< HCI Command: Host Number of Comp.. (0x03|0x0035) plen 5  #79 [hci1] 14.124724
        Num handles: 1
        Handle: 1947 Address: DF:A9:FF:F6:B1:1A (OUI DF-A9-FF)
        Count: 1
< ACL Data TX: Handle 1947 flags 0x00 dlen 21              #80 [hci1] 14.124753
      SMP: Pairing DHKey Check (0x0d) len 16
        E: cb9e9a8b183df32760ece11baefe9b32
> HCI Event: Number of Completed Packets (0x13) plen 5     #81 [hci1] 14.287322
        Num handles: 1
        Handle: 1947 Address: DF:A9:FF:F6:B1:1A (OUI DF-A9-FF)
        Count: 1
        #80: len 21 (1 Kb/s)
        Latency: 162 msec (69-165 msec ~157 msec)
> HCI Event: LE Meta Event (0x3e) plen 13                  #82 [hci1] 14.375469
      LE Long Term Key Request (0x05)
        Handle: 1947 Address: DF:A9:FF:F6:B1:1A (OUI DF-A9-FF)
        Random number: 0x0000000000000000
        Encrypted diversifier: 0x0000
< HCI Command: LE Long Term Key R.. (0x08|0x001a) plen 18  #83 [hci1] 14.384867
        Handle: 1947 Address: DF:A9:FF:F6:B1:1A (OUI DF-A9-FF)
        Long term key: b6078d4c8cd3aa5e3e85a0fa3981738e
> HCI Event: Command Complete (0x0e) plen 6                #84 [hci1] 14.385643
      LE Long Term Key Request Reply (0x08|0x001a) ncmd 1
        Status: Success (0x00)
        Handle: 1947 Address: DF:A9:FF:F6:B1:1A (OUI DF-A9-FF)
> HCI Event: Encryption Change (0x08) plen 4               #85 [hci1] 14.812631
        Status: Success (0x00)
        Handle: 1947 Address: DF:A9:FF:F6:B1:1A (OUI DF-A9-FF)
        Encryption: Enabled with AES-CCM (0x01)
> ACL Data RX: Handle 1947 flags 0x02 dlen 21              #86 [hci1] 14.900263
      SMP: Identity Information (0x08) len 16
        Identity resolving key: ef14f4575654198057208ddb5d0243e2
< HCI Command: Host Number of Comp.. (0x03|0x0035) plen 5  #87 [hci1] 14.934839
        Num handles: 1
        Handle: 1947 Address: DF:A9:FF:F6:B1:1A (OUI DF-A9-FF)
        Count: 1
> ACL Data RX: Handle 1947 flags 0x02 dlen 12              #88 [hci1] 14.987570
      SMP: Identity Address Information (0x09) len 7
        Address: DF:A9:FF:F6:B1:1A (OUI DF-A9-FF)
> ACL Data RX: Handle 1947 flags 0x02 dlen 26              #89 [hci1] 14.988466
      LE L2CAP: Enhanced Credit Connection Request (0x17) ident 1 len 18
        PSM: 39 (0x0027)
        MTU: 64
        MPS: 64
        Credits: 5
        Source CID: 84
        Source CID: 83
        Source CID: 82
        Source CID: 81
        Source CID: 80
< HCI Command: LE Add Device To R.. (0x08|0x0027) plen 39  #90 [hci1] 15.004820
        Address type: Public (0x00)
        Address: DF:A9:FF:F6:B1:1A (OUI DF-A9-FF)
        Peer identity resolving key: ef14f4575654198057208ddb5d0243e2
        Local identity resolving key: 00000000000000000000000000000000
> HCI Event: Command Complete (0x0e) plen 4                #91 [hci1] 15.005874
      LE Add Device To Resolving List (0x08|0x0027) ncmd 1
        Status: Success (0x00)
< HCI Command: LE Set Privacy Mode (0x08|0x004e) plen 8    #92 [hci1] 15.024853
        Peer Identity address type: Public (0x00)
        Peer Identity address: DF:A9:FF:F6:B1:1A (OUI DF-A9-FF)
        Privacy Mode: Use Device Privacy (0x01)
> HCI Event: Command Complete (0x0e) plen 4                #93 [hci1] 15.025472
      LE Set Privacy Mode (0x08|0x004e) ncmd 1
        Status: Success (0x00)
< HCI Command: LE Set Address Reso.. (0x08|0x002d) plen 1  #94 [hci1] 15.044821
        Address resolution: Enabled (0x01)
> HCI Event: Command Complete (0x0e) plen 4                #95 [hci1] 15.045358
      LE Set Address Resolution Enable (0x08|0x002d) ncmd 1
        Status: Success (0x00)
< HCI Command: Host Number of Comp.. (0x03|0x0035) plen 5  #96 [hci1] 15.064775
        Num handles: 1
        Handle: 1947 Address: DF:A9:FF:F6:B1:1A (OUI DF-A9-FF)
        Count: 1
< HCI Command: Host Number of Comp.. (0x03|0x0035) plen 5  #97 [hci1] 15.065160
        Num handles: 1
        Handle: 1947 Address: DF:A9:FF:F6:B1:1A (OUI DF-A9-FF)
        Count: 1
< ACL Data TX: Handle 1947 flags 0x00 dlen 26              #98 [hci1] 15.065265
      LE L2CAP: Enhanced Credit Connection Response (0x18) ident 1 len 18
        MTU: 249
        MPS: 251
        Credits: 1
        Result: Connection successful (0x0000)
        Destination CID: 64
        Destination CID: 65
        Destination CID: 66
        Destination CID: 67
        Destination CID: 68
> HCI Event: Number of Completed Packets (0x13) plen 5     #99 [hci1] 15.162550
        Num handles: 1
        Handle: 1947 Address: DF:A9:FF:F6:B1:1A (OUI DF-A9-FF)
        Count: 1
        #98: len 26 (2 Kb/s)
        Latency: 97 msec (69-165 msec ~127 msec)
< ACL Data TX: Handle 1947 flags 0x00 dlen 13             #100 [hci1] 17.595226
      Channel: 80 len 9 sdu 7 [PSM 39 mode Enhanced Credit (0x81)] {chan 4}
      ATT: Read By Type Request (0x08) len 6
        Handle range: 0x0001-0xffff
        Attribute type: Unknown (0xb002)
> HCI Event: Number of Completed Packets (0x13) plen 5    #101 [hci1] 17.700089
        Num handles: 1
        Handle: 1947 Address: DF:A9:FF:F6:B1:1A (OUI DF-A9-FF)
        Count: 1
        #100: len 13 (1 Kb/s)
        Latency: 104 msec (69-165 msec ~116 msec)
        Channel: 80 [PSM 39 mode Enhanced Credit (0x81)] {chan 4}
        Channel Latency: 104 msec (104-104 msec ~104 msec)
> ACL Data RX: Handle 1947 flags 0x02 dlen 27             #102 [hci1] 17.700555
> ACL Data RX: Handle 1947 flags 0x01 dlen 27             #103 [hci1] 17.701085
> ACL Data RX: Handle 1947 flags 0x01 dlen 16             #104 [hci1] 17.701453
      Channel: 68 len 66 sdu 64 [PSM 39 mode Enhanced Credit (0x81)] {chan 4}
      ATT: Read By Type Response (0x09) len 63
        Attribute data length: 62
        Attribute data list: 1 entry
        Handle: 0x0045
        Value: 313131313132323232323333333333343434343435353535353636363636373737373738383838383939393939303030303031313131313232323232
< HCI Command: Host Number of Com.. (0x03|0x0035) plen 5  #105 [hci1] 17.704803
        Num handles: 1
        Handle: 1947 Address: DF:A9:FF:F6:B1:1A (OUI DF-A9-FF)
        Count: 1
< HCI Command: Host Number of Com.. (0x03|0x0035) plen 5  #106 [hci1] 17.704809
        Num handles: 1
        Handle: 1947 Address: DF:A9:FF:F6:B1:1A (OUI DF-A9-FF)
        Count: 1
< HCI Command: Host Number of Com.. (0x03|0x0035) plen 5  #107 [hci1] 17.704908
        Num handles: 1
        Handle: 1947 Address: DF:A9:FF:F6:B1:1A (OUI DF-A9-FF)
        Count: 1
< ACL Data TX: Handle 1947 flags 0x00 dlen 13             #108 [hci1] 17.704921
      Channel: 80 len 9 sdu 7 [PSM 39 mode Enhanced Credit (0x81)] {chan 4}
      ATT: Read By Type Request (0x08) len 6
        Handle range: 0x0046-0xffff
        Attribute type: Unknown (0xb002)
< ACL Data TX: Handle 1947 flags 0x00 dlen 12             #109 [hci1] 17.705005
      LE L2CAP: LE Flow Control Credit (0x16) ident 2 len 4
        Source CID: 68
        Credits: 1
> HCI Event: Number of Completed Packets (0x13) plen 5    #110 [hci1] 17.787841
        Num handles: 1
        Handle: 1947 Address: DF:A9:FF:F6:B1:1A (OUI DF-A9-FF)
        Count: 1
        #108: len 13 (1 Kb/s)
        Latency: 82 msec (69-165 msec ~99 msec)
        Channel: 80 [PSM 39 mode Enhanced Credit (0x81)] {chan 4}
        Channel Latency: 82 msec (82-104 msec ~93 msec)
> HCI Event: Number of Completed Packets (0x13) plen 5    #111 [hci1] 17.875049
        Num handles: 1
        Handle: 1947 Address: DF:A9:FF:F6:B1:1A (OUI DF-A9-FF)
        Count: 1
        #109: len 12 (0 Kb/s)
        Latency: 170 msec (69-170 msec ~134 msec)
        Channel: 80 [PSM 39 mode Enhanced Credit (0x81)] {chan 4}
        Channel Latency: 170 msec (82-170 msec ~131 msec)
> ACL Data RX: Handle 1947 flags 0x02 dlen 27             #112 [hci1] 17.875506
> ACL Data RX: Handle 1947 flags 0x01 dlen 4              #113 [hci1] 17.875557
      Channel: 68 len 27 sdu 25 [PSM 39 mode Enhanced Credit (0x81)] {chan 4}
      ATT: Read By Type Response (0x09) len 24
        Attribute data length: 23
        Attribute data list: 1 entry
        Handle: 0x0174
        Value: 313131313132323232323333333333343434343435
< HCI Command: Host Number of Com.. (0x03|0x0035) plen 5  #114 [hci1] 17.884834
        Num handles: 1
        Handle: 1947 Address: DF:A9:FF:F6:B1:1A (OUI DF-A9-FF)
        Count: 1
< HCI Command: Host Number of Com.. (0x03|0x0035) plen 5  #115 [hci1] 17.884909
        Num handles: 1
        Handle: 1947 Address: DF:A9:FF:F6:B1:1A (OUI DF-A9-FF)
        Count: 1
< ACL Data TX: Handle 1947 flags 0x00 dlen 13             #116 [hci1] 17.884980
      Channel: 80 len 9 sdu 7 [PSM 39 mode Enhanced Credit (0x81)] {chan 4}
      ATT: Read By Type Request (0x08) len 6
        Handle range: 0x0175-0xffff
        Attribute type: Unknown (0xb002)
< ACL Data TX: Handle 1947 flags 0x00 dlen 12             #117 [hci1] 17.885084
      LE L2CAP: LE Flow Control Credit (0x16) ident 3 len 4
        Source CID: 68
        Credits: 1
> HCI Event: Number of Completed Packets (0x13) plen 5    #118 [hci1] 17.962924
        Num handles: 1
        Handle: 1947 Address: DF:A9:FF:F6:B1:1A (OUI DF-A9-FF)
        Count: 1
        #116: len 13 (1 Kb/s)
        Latency: 77 msec (69-170 msec ~106 msec)
        Channel: 80 [PSM 39 mode Enhanced Credit (0x81)] {chan 4}
        Channel Latency: 77 msec (77-170 msec ~104 msec)
> HCI Event: Number of Completed Packets (0x13) plen 5    #119 [hci1] 18.050095
        Num handles: 1
        Handle: 1947 Address: DF:A9:FF:F6:B1:1A (OUI DF-A9-FF)
        Count: 1
        #117: len 12 (0 Kb/s)
        Latency: 165 msec (69-170 msec ~135 msec)
> ACL Data RX: Handle 1947 flags 0x02 dlen 27             #120 [hci1] 18.050547
> ACL Data RX: Handle 1947 flags 0x01 dlen 5              #121 [hci1] 18.050634
      Channel: 68 len 28 sdu 26 [PSM 39 mode Enhanced Credit (0x81)] {chan 4}
      ATT: Read By Type Response (0x09) len 25
        Attribute data length: 24
        Attribute data list: 1 entry
        Handle: 0x0177
        Value: 32323232323333333333343434343435353535353636
< HCI Command: Host Number of Com.. (0x03|0x0035) plen 5  #122 [hci1] 18.064788
        Num handles: 1
        Handle: 1947 Address: DF:A9:FF:F6:B1:1A (OUI DF-A9-FF)
        Count: 1
< HCI Command: Host Number of Com.. (0x03|0x0035) plen 5  #123 [hci1] 18.064851
        Num handles: 1
        Handle: 1947 Address: DF:A9:FF:F6:B1:1A (OUI DF-A9-FF)
        Count: 1
< ACL Data TX: Handle 1947 flags 0x00 dlen 13             #124 [hci1] 18.064939
      Channel: 80 len 9 sdu 7 [PSM 39 mode Enhanced Credit (0x81)] {chan 4}
      ATT: Read By Type Request (0x08) len 6
        Handle range: 0x0178-0xffff
        Attribute type: Unknown (0xb002)
< ACL Data TX: Handle 1947 flags 0x00 dlen 12             #125 [hci1] 18.065066
      LE L2CAP: LE Flow Control Credit (0x16) ident 4 len 4
        Source CID: 68
        Credits: 1
> HCI Event: Number of Completed Packets (0x13) plen 5    #126 [hci1] 18.138004
        Num handles: 1
        Handle: 1947 Address: DF:A9:FF:F6:B1:1A (OUI DF-A9-FF)
        Count: 1
        #124: len 13 (1 Kb/s)
        Latency: 73 msec (69-170 msec ~104 msec)
        Channel: 80 [PSM 39 mode Enhanced Credit (0x81)] {chan 4}
        Channel Latency: 73 msec (73-170 msec ~89 msec)
> HCI Event: Number of Completed Packets (0x13) plen 5    #127 [hci1] 18.224995
        Num handles: 1
        Handle: 1947 Address: DF:A9:FF:F6:B1:1A (OUI DF-A9-FF)
        Count: 1
        #125: len 12 (0 Kb/s)
        Latency: 159 msec (69-170 msec ~132 msec)
        Channel: 80 [PSM 39 mode Enhanced Credit (0x81)] {chan 4}
        Channel Latency: 159 msec (73-170 msec ~124 msec)
> ACL Data RX: Handle 1947 flags 0x02 dlen 12             #128 [hci1] 18.225172
      LE L2CAP: LE Flow Control Credit (0x16) ident 2 len 4
        Source CID: 80
        Credits: 10
> ACL Data RX: Handle 1947 flags 0x02 dlen 27             #129 [hci1] 18.225860
> ACL Data RX: Handle 1947 flags 0x01 dlen 6              #130 [hci1] 18.226180
      Channel: 68 len 29 sdu 27 [PSM 39 mode Enhanced Credit (0x81)] {chan 4}
      ATT: Read By Type Response (0x09) len 26
        Attribute data length: 25
        Attribute data list: 1 entry
        Handle: 0x017a
        Value: 3333333333343434343435353535353636363636373737
< HCI Command: Host Number of Com.. (0x03|0x0035) plen 5  #131 [hci1] 18.244741
        Num handles: 1
        Handle: 1947 Address: DF:A9:FF:F6:B1:1A (OUI DF-A9-FF)
        Count: 1
< HCI Command: Host Number of Com.. (0x03|0x0035) plen 5  #132 [hci1] 18.244901
        Num handles: 1
        Handle: 1947 Address: DF:A9:FF:F6:B1:1A (OUI DF-A9-FF)
        Count: 1
< HCI Command: Host Number of Com.. (0x03|0x0035) plen 5  #133 [hci1] 18.245002
        Num handles: 1
        Handle: 1947 Address: DF:A9:FF:F6:B1:1A (OUI DF-A9-FF)
        Count: 1
< ACL Data TX: Handle 1947 flags 0x00 dlen 13             #134 [hci1] 18.245080
      Channel: 80 len 9 sdu 7 [PSM 39 mode Enhanced Credit (0x81)] {chan 4}
      ATT: Read By Type Request (0x08) len 6
        Handle range: 0x017b-0xffff
        Attribute type: Unknown (0xb002)
< ACL Data TX: Handle 1947 flags 0x00 dlen 12             #135 [hci1] 18.245093
      LE L2CAP: LE Flow Control Credit (0x16) ident 5 len 4
        Source CID: 68
        Credits: 1
> HCI Event: Number of Completed Packets (0x13) plen 5    #136 [hci1] 18.312822
        Num handles: 1
        Handle: 1947 Address: DF:A9:FF:F6:B1:1A (OUI DF-A9-FF)
        Count: 1
        #134: len 13 (1 Kb/s)
        Latency: 67 msec (67-170 msec ~99 msec)
> HCI Event: Number of Completed Packets (0x13) plen 5    #137 [hci1] 18.400185
        Num handles: 1
        Handle: 1947 Address: DF:A9:FF:F6:B1:1A (OUI DF-A9-FF)
        Count: 1
        #135: len 12 (0 Kb/s)
        Latency: 155 msec (67-170 msec ~127 msec)
        Channel: 80 [PSM 39 mode Enhanced Credit (0x81)] {chan 4}
        Channel Latency: 155 msec (73-170 msec ~139 msec)
> ACL Data RX: Handle 1947 flags 0x02 dlen 27             #138 [hci1] 18.400487
> ACL Data RX: Handle 1947 flags 0x01 dlen 26             #139 [hci1] 18.400941
      Channel: 68 len 49 sdu 47 [PSM 39 mode Enhanced Credit (0x81)] {chan 4}
      ATT: Read By Type Response (0x09) len 46
        Attribute data length: 45
        Attribute data list: 1 entry
        Handle: 0x017d
        Value: 11223344556677889900123456789012345678901234567890123456789011223344556677889900112233
< HCI Command: Host Number of Com.. (0x03|0x0035) plen 5  #140 [hci1] 18.404833
        Num handles: 1
        Handle: 1947 Address: DF:A9:FF:F6:B1:1A (OUI DF-A9-FF)
        Count: 1
< HCI Command: Host Number of Com.. (0x03|0x0035) plen 5  #141 [hci1] 18.404857
        Num handles: 1
        Handle: 1947 Address: DF:A9:FF:F6:B1:1A (OUI DF-A9-FF)
        Count: 1
< ACL Data TX: Handle 1947 flags 0x00 dlen 13             #142 [hci1] 18.404935
      Channel: 80 len 9 sdu 7 [PSM 39 mode Enhanced Credit (0x81)] {chan 4}
      ATT: Read By Type Request (0x08) len 6
        Handle range: 0x017e-0xffff
        Attribute type: Unknown (0xb002)
< ACL Data TX: Handle 1947 flags 0x00 dlen 12             #143 [hci1] 18.405047
      LE L2CAP: LE Flow Control Credit (0x16) ident 6 len 4
        Source CID: 68
        Credits: 1
> HCI Event: Number of Completed Packets (0x13) plen 5    #144 [hci1] 18.487977
        Num handles: 1
        Handle: 1947 Address: DF:A9:FF:F6:B1:1A (OUI DF-A9-FF)
        Count: 1
        #142: len 13 (1 Kb/s)
        Latency: 83 msec (67-170 msec ~105 msec)
        Channel: 80 [PSM 39 mode Enhanced Credit (0x81)] {chan 4}
        Channel Latency: 83 msec (73-170 msec ~111 msec)
> HCI Event: Number of Completed Packets (0x13) plen 5    #145 [hci1] 18.575155
        Num handles: 1
        Handle: 1947 Address: DF:A9:FF:F6:B1:1A (OUI DF-A9-FF)
        Count: 1
        #143: len 12 (0 Kb/s)
        Latency: 170 msec (67-170 msec ~137 msec)
> ACL Data RX: Handle 1947 flags 0x02 dlen 27             #146 [hci1] 18.575386
> ACL Data RX: Handle 1947 flags 0x01 dlen 27             #147 [hci1] 18.575878
      Channel: 68 len 50 sdu 48 [PSM 39 mode Enhanced Credit (0x81)] {chan 4}
      ATT: Read By Type Response (0x09) len 47
        Attribute data length: 46
        Attribute data list: 1 entry
        Handle: 0x0180
        Value: 1122334455667788990012345678901234567890123456789012345678901122334455667788990011223344
< HCI Command: Host Number of Com.. (0x03|0x0035) plen 5  #148 [hci1] 18.584812
        Num handles: 1
        Handle: 1947 Address: DF:A9:FF:F6:B1:1A (OUI DF-A9-FF)
        Count: 1
< HCI Command: Host Number of Com.. (0x03|0x0035) plen 5  #149 [hci1] 18.584842
        Num handles: 1
        Handle: 1947 Address: DF:A9:FF:F6:B1:1A (OUI DF-A9-FF)
        Count: 1
< ACL Data TX: Handle 1947 flags 0x00 dlen 13             #150 [hci1] 18.584930
      Channel: 80 len 9 sdu 7 [PSM 39 mode Enhanced Credit (0x81)] {chan 4}
      ATT: Read By Type Request (0x08) len 6
        Handle range: 0x0181-0xffff
        Attribute type: Unknown (0xb002)
< ACL Data TX: Handle 1947 flags 0x00 dlen 12             #151 [hci1] 18.585029
      LE L2CAP: LE Flow Control Credit (0x16) ident 7 len 4
        Source CID: 68
        Credits: 1
> HCI Event: Number of Completed Packets (0x13) plen 5    #152 [hci1] 18.662808
        Num handles: 1
        Handle: 1947 Address: DF:A9:FF:F6:B1:1A (OUI DF-A9-FF)
        Count: 1
        #150: len 13 (1 Kb/s)
        Latency: 77 msec (67-170 msec ~107 msec)
        Channel: 80 [PSM 39 mode Enhanced Credit (0x81)] {chan 4}
        Channel Latency: 77 msec (73-170 msec ~94 msec)
> HCI Event: Number of Completed Packets (0x13) plen 5    #153 [hci1] 18.750074
        Num handles: 1
        Handle: 1947 Address: DF:A9:FF:F6:B1:1A (OUI DF-A9-FF)
        Count: 1
        #151: len 12 (0 Kb/s)
        Latency: 165 msec (67-170 msec ~136 msec)
        Channel: 80 [PSM 39 mode Enhanced Credit (0x81)] {chan 4}
        Channel Latency: 165 msec (73-170 msec ~129 msec)
> ACL Data RX: Handle 1947 flags 0x02 dlen 27             #154 [hci1] 18.750333
> ACL Data RX: Handle 1947 flags 0x01 dlen 27             #155 [hci1] 18.750995
> ACL Data RX: Handle 1947 flags 0x01 dlen 1              #156 [hci1] 18.751182
      Channel: 68 len 51 sdu 49 [PSM 39 mode Enhanced Credit (0x81)] {chan 4}
      ATT: Read By Type Response (0x09) len 48
        Attribute data length: 47
        Attribute data list: 1 entry
        Handle: 0x0183
        Value: 112233445566778899001234567890123456789012345678901234567890112233445566778899001122334455
< HCI Command: Host Number of Com.. (0x03|0x0035) plen 5  #157 [hci1] 18.764798
        Num handles: 1
        Handle: 1947 Address: DF:A9:FF:F6:B1:1A (OUI DF-A9-FF)
        Count: 1
< HCI Command: Host Number of Com.. (0x03|0x0035) plen 5  #158 [hci1] 18.764886
        Num handles: 1
        Handle: 1947 Address: DF:A9:FF:F6:B1:1A (OUI DF-A9-FF)
        Count: 1
< HCI Command: Host Number of Com.. (0x03|0x0035) plen 5  #159 [hci1] 18.764979
        Num handles: 1
        Handle: 1947 Address: DF:A9:FF:F6:B1:1A (OUI DF-A9-FF)
        Count: 1
< ACL Data TX: Handle 1947 flags 0x00 dlen 13             #160 [hci1] 18.764983
      Channel: 80 len 9 sdu 7 [PSM 39 mode Enhanced Credit (0x81)] {chan 4}
      ATT: Read By Type Request (0x08) len 6
        Handle range: 0x0184-0xffff
        Attribute type: Unknown (0xb002)
< ACL Data TX: Handle 1947 flags 0x00 dlen 12             #161 [hci1] 18.765105
      LE L2CAP: LE Flow Control Credit (0x16) ident 8 len 4
        Source CID: 68
        Credits: 1
> HCI Event: Number of Completed Packets (0x13) plen 5    #162 [hci1] 18.837902
        Num handles: 1
        Handle: 1947 Address: DF:A9:FF:F6:B1:1A (OUI DF-A9-FF)
        Count: 1
        #160: len 13 (1 Kb/s)
        Latency: 72 msec (67-170 msec ~104 msec)
> HCI Event: Number of Completed Packets (0x13) plen 5    #163 [hci1] 18.925002
        Num handles: 1
        Handle: 1947 Address: DF:A9:FF:F6:B1:1A (OUI DF-A9-FF)
        Count: 1
        #161: len 12 (0 Kb/s)
        Latency: 159 msec (67-170 msec ~132 msec)
        Channel: 80 [PSM 39 mode Enhanced Credit (0x81)] {chan 4}
        Channel Latency: 159 msec (73-170 msec ~144 msec)
> ACL Data RX: Handle 1947 flags 0x02 dlen 27             #164 [hci1] 18.925406
> ACL Data RX: Handle 1947 flags 0x01 dlen 27             #165 [hci1] 18.926004
> ACL Data RX: Handle 1947 flags 0x01 dlen 1              #166 [hci1] 18.926211
      Channel: 68 len 51 sdu 49 [PSM 39 mode Enhanced Credit (0x81)] {chan 4}
      ATT: Read By Type Response (0x09) len 48
        Attribute data length: 47
        Attribute data list: 1 entry
        Handle: 0x018c
        Value: 333333333334343434343535353535363636363637373737373838383838393939393930303030303131313131
< HCI Command: Host Number of Com.. (0x03|0x0035) plen 5  #167 [hci1] 18.944852
        Num handles: 1
        Handle: 1947 Address: DF:A9:FF:F6:B1:1A (OUI DF-A9-FF)
        Count: 1
< HCI Command: Host Number of Com.. (0x03|0x0035) plen 5  #168 [hci1] 18.944985
        Num handles: 1
        Handle: 1947 Address: DF:A9:FF:F6:B1:1A (OUI DF-A9-FF)
        Count: 1
< HCI Command: Host Number of Com.. (0x03|0x0035) plen 5  #169 [hci1] 18.945079
        Num handles: 1
        Handle: 1947 Address: DF:A9:FF:F6:B1:1A (OUI DF-A9-FF)
        Count: 1
< ACL Data TX: Handle 1947 flags 0x00 dlen 13             #170 [hci1] 18.945126
      Channel: 80 len 9 sdu 7 [PSM 39 mode Enhanced Credit (0x81)] {chan 4}
      ATT: Read By Type Request (0x08) len 6
        Handle range: 0x018d-0xffff
        Attribute type: Unknown (0xb002)
< ACL Data TX: Handle 1947 flags 0x00 dlen 12             #171 [hci1] 18.945201
      LE L2CAP: LE Flow Control Credit (0x16) ident 9 len 4
        Source CID: 68
        Credits: 1
> HCI Event: Number of Completed Packets (0x13) plen 5    #172 [hci1] 19.012875
        Num handles: 1
        Handle: 1947 Address: DF:A9:FF:F6:B1:1A (OUI DF-A9-FF)
        Count: 1
        #170: len 13 (1 Kb/s)
        Latency: 67 msec (67-170 msec ~100 msec)
        Channel: 80 [PSM 39 mode Enhanced Credit (0x81)] {chan 4}
        Channel Latency: 67 msec (67-170 msec ~106 msec)
> HCI Event: Number of Completed Packets (0x13) plen 5    #173 [hci1] 19.100112
        Num handles: 1
        Handle: 1947 Address: DF:A9:FF:F6:B1:1A (OUI DF-A9-FF)
        Count: 1
        #171: len 12 (0 Kb/s)
        Latency: 154 msec (67-170 msec ~127 msec)
> ACL Data RX: Handle 1947 flags 0x02 dlen 27             #174 [hci1] 19.100328
> ACL Data RX: Handle 1947 flags 0x01 dlen 27             #175 [hci1] 19.100910
> ACL Data RX: Handle 1947 flags 0x01 dlen 7              #176 [hci1] 19.101314
      Channel: 68 len 57 sdu 55 [PSM 39 mode Enhanced Credit (0x81)] {chan 4}
      ATT: Read By Type Response (0x09) len 54
        Attribute data length: 53
        Attribute data list: 1 entry
        Handle: 0x01a1
        Value: 112233445566778899001234567890123456789012345678901234567890112233445566778899001122334455667788990011
< HCI Command: Host Number of Com.. (0x03|0x0035) plen 5  #177 [hci1] 19.104817
        Num handles: 1
        Handle: 1947 Address: DF:A9:FF:F6:B1:1A (OUI DF-A9-FF)
        Count: 1
< HCI Command: Host Number of Com.. (0x03|0x0035) plen 5  #178 [hci1] 19.104910
        Num handles: 1
        Handle: 1947 Address: DF:A9:FF:F6:B1:1A (OUI DF-A9-FF)
        Count: 1
< HCI Command: Host Number of Com.. (0x03|0x0035) plen 5  #179 [hci1] 19.106764
        Num handles: 1
        Handle: 1947 Address: DF:A9:FF:F6:B1:1A (OUI DF-A9-FF)
        Count: 1
< ACL Data TX: Handle 1947 flags 0x00 dlen 13             #180 [hci1] 19.106823
      Channel: 80 len 9 sdu 7 [PSM 39 mode Enhanced Credit (0x81)] {chan 4}
      ATT: Read By Type Request (0x08) len 6
        Handle range: 0x01a2-0xffff
        Attribute type: Unknown (0xb002)
< ACL Data TX: Handle 1947 flags 0x00 dlen 12             #181 [hci1] 19.106932
      LE L2CAP: LE Flow Control Credit (0x16) ident 10 len 4
        Source CID: 68
        Credits: 1
> HCI Event: Number of Completed Packets (0x13) plen 5    #182 [hci1] 19.187781
        Num handles: 1
        Handle: 1947 Address: DF:A9:FF:F6:B1:1A (OUI DF-A9-FF)
        Count: 1
        #180: len 13 (1 Kb/s)
        Latency: 80 msec (67-170 msec ~104 msec)
        Channel: 80 [PSM 39 mode Enhanced Credit (0x81)] {chan 4}
        Channel Latency: 80 msec (67-170 msec ~93 msec)
> HCI Event: Number of Completed Packets (0x13) plen 5    #183 [hci1] 19.274765
        Num handles: 1
        Handle: 1947 Address: DF:A9:FF:F6:B1:1A (OUI DF-A9-FF)
        Count: 1
        #181: len 12 (0 Kb/s)
        Latency: 167 msec (67-170 msec ~136 msec)
        Channel: 80 [PSM 39 mode Enhanced Credit (0x81)] {chan 4}
        Channel Latency: 167 msec (67-170 msec ~130 msec)
> ACL Data RX: Handle 1947 flags 0x02 dlen 11             #184 [hci1] 19.362560
      Channel: 68 len 7 sdu 5 [PSM 39 mode Enhanced Credit (0x81)] {chan 4}
      ATT: Error Response (0x01) len 4
        Read By Type Request (0x08)
        Handle: 0x01a2
        Error: Attribute Not Found (0x0a)
< HCI Command: Host Number of Com.. (0x03|0x0035) plen 5  #185 [hci1] 19.365286
        Num handles: 1
        Handle: 1947 Address: DF:A9:FF:F6:B1:1A (OUI DF-A9-FF)
        Count: 1
< ACL Data TX: Handle 1947 flags 0x00 dlen 12             #186 [hci1] 19.365293
      LE L2CAP: LE Flow Control Credit (0x16) ident 11 len 4
        Source CID: 68
        Credits: 1
> HCI Event: Number of Completed Packets (0x13) plen 5    #187 [hci1] 19.537364
        Num handles: 1
        Handle: 1947 Address: DF:A9:FF:F6:B1:1A (OUI DF-A9-FF)
        Count: 1
        #186: len 12 (0 Kb/s)
        Latency: 172 msec (67-172 msec ~154 msec)
< ACL Data TX: Handle 1947 flags 0x00 dlen 27             #188 [hci1] 21.435204
      Channel: 80 len 23 sdu 21 [PSM 39 mode Enhanced Credit (0x81)] {chan 4}
      ATT: Read By Type Request (0x08) len 20
        Handle range: 0x0001-0xffff
        Attribute type: Vendor specific (0000b009-0000-0000-0123-456789abcdef)
> HCI Event: Number of Completed Packets (0x13) plen 5    #189 [hci1] 21.549881
        Num handles: 1
        Handle: 1947 Address: DF:A9:FF:F6:B1:1A (OUI DF-A9-FF)
        Count: 1
        #188: len 27 (1 Kb/s)
        Latency: 114 msec (67-172 msec ~134 msec)
        Channel: 80 [PSM 39 mode Enhanced Credit (0x81)] {chan 4}
        Channel Latency: 114 msec (67-170 msec ~122 msec)
> ACL Data RX: Handle 1947 flags 0x02 dlen 11             #190 [hci1] 21.550193
      Channel: 68 len 7 sdu 5 [PSM 39 mode Enhanced Credit (0x81)] {chan 4}
      ATT: Read By Type Response (0x09) len 4
        Attribute data length: 3
        Attribute data list: 1 entry
        Handle: 0x0123
        Value: 09
< HCI Command: Host Number of Com.. (0x03|0x0035) plen 5  #191 [hci1] 21.564822
        Num handles: 1
        Handle: 1947 Address: DF:A9:FF:F6:B1:1A (OUI DF-A9-FF)
        Count: 1
< ACL Data TX: Handle 1947 flags 0x00 dlen 27             #192 [hci1] 21.564852
      Channel: 80 len 23 sdu 21 [PSM 39 mode Enhanced Credit (0x81)] {chan 4}
      ATT: Read By Type Request (0x08) len 20
        Handle range: 0x0124-0xffff
        Attribute type: Vendor specific (0000b009-0000-0000-0123-456789abcdef)
< ACL Data TX: Handle 1947 flags 0x00 dlen 12             #193 [hci1] 21.564970
      LE L2CAP: LE Flow Control Credit (0x16) ident 12 len 4
        Source CID: 68
        Credits: 1
> HCI Event: Number of Completed Packets (0x13) plen 5    #194 [hci1] 21.637906
        Num handles: 1
        Handle: 1947 Address: DF:A9:FF:F6:B1:1A (OUI DF-A9-FF)
        Count: 1
        #192: len 27 (2 Kb/s)
        Latency: 73 msec (67-172 msec ~103 msec)
        Channel: 80 [PSM 39 mode Enhanced Credit (0x81)] {chan 4}
        Channel Latency: 73 msec (67-170 msec ~97 msec)
> HCI Event: Number of Completed Packets (0x13) plen 5    #195 [hci1] 21.724825
        Num handles: 1
        Handle: 1947 Address: DF:A9:FF:F6:B1:1A (OUI DF-A9-FF)
        Count: 1
        #193: len 12 (0 Kb/s)
        Latency: 159 msec (67-172 msec ~131 msec)
> ACL Data RX: Handle 1947 flags 0x02 dlen 11             #196 [hci1] 21.812436
      Channel: 68 len 7 sdu 5 [PSM 39 mode Enhanced Credit (0x81)] {chan 4}
      ATT: Error Response (0x01) len 4
        Read By Type Request (0x08)
        Handle: 0x0124
        Error: Attribute Not Found (0x0a)
< HCI Command: Host Number of Com.. (0x03|0x0035) plen 5  #197 [hci1] 21.824723
        Num handles: 1
        Handle: 1947 Address: DF:A9:FF:F6:B1:1A (OUI DF-A9-FF)
        Count: 1
< ACL Data TX: Handle 1947 flags 0x00 dlen 12             #198 [hci1] 21.824839
      LE L2CAP: LE Flow Control Credit (0x16) ident 13 len 4
        Source CID: 68
        Credits: 1
> HCI Event: Number of Completed Packets (0x13) plen 5    #199 [hci1] 21.987258
        Num handles: 1
        Handle: 1947 Address: DF:A9:FF:F6:B1:1A (OUI DF-A9-FF)
        Count: 1
        #198: len 12 (0 Kb/s)
        Latency: 162 msec (67-172 msec ~147 msec)
        Channel: 80 [PSM 39 mode Enhanced Credit (0x81)] {chan 4}
        Channel Latency: 162 msec (67-170 msec ~130 msec)
> HCI Event: Disconnect Complete (0x05) plen 4            #200 [hci1] 24.350050
        Status: Success (0x00)
        Handle: 1947 Address: DF:A9:FF:F6:B1:1A (OUI DF-A9-FF)
        Reason: Remote User Terminated Connection (0x13)
< HCI Command: Reset (0x03|0x0003) plen 0                 #201 [hci1] 29.924671
> HCI Event: Command Complete (0x0e) plen 4               #202 [hci1] 29.925236
      Reset (0x03|0x0003) ncmd 1
        Status: Success (0x00)
@ USER Close: main                                    {0x0001} [hci1] 29.944649
= Close Index: 00:00:00:00:00:00                               [hci1] 29.944676
