Bluetooth monitor ver 5.72
= Note: Linux version 6.14.0-36-generic (x86_64)                       0.376874
= Note: Bluetooth subsystem version 2.22                               0.376876
= New Index: 00:00:00:00:00:00 (Primary,UART,hci1)              [hci1] 0.376877
= New Index: 48:5F:99:8E:E0:64 (Primary,USB,hci0)               [hci0] 0.376877
= Open Index: 00:00:00:00:00:00                                 [hci1] 0.491157
= Index Info: 00:00:00:00:00:00 (Nordic Semiconductor ASA)      [hci1] 0.491199
@ USER Open: main (privileged) version 2.22            {0x0001} [hci1] 0.491209
< HCI Command: Reset (0x03|0x0003) plen 0                    #1 [hci1] 0.492455
> HCI Event: Command Complete (0x0e) plen 4                  #2 [hci1] 0.493013
      Reset (0x03|0x0003) ncmd 1
        Status: Success (0x00)
< HCI Command: Read Local Supported... (0x04|0x0003) plen 0  #3 [hci1] 0.510588
> HCI Event: Command Complete (0x0e) plen 12                 #4 [hci1] 0.511109
      Read Local Supported Features (0x04|0x0003) ncmd 1
        Status: Success (0x00)
        Features: 0x00 0x00 0x00 0x00 0x60 0x00 0x00 0x00
          BR/EDR Not Supported
          LE Supported (Controller)
< HCI Command: Read Local Version In.. (0x04|0x0001) plen 0  #5 [hci1] 0.530622
> HCI Event: Command Complete (0x0e) plen 12                 #6 [hci1] 0.531110
      Read Local Version Information (0x04|0x0001) ncmd 1
        Status: Success (0x00)
        HCI version: Reserved (0x0f) - Revision 12393 (0x3069)
        LMP version: Reserved (0x0f) - Subversion 12393 (0x3069)
        Manufacturer: Nordic Semiconductor ASA (89)
< HCI Command: Read Local Supported... (0x04|0x0002) plen 0  #7 [hci1] 0.550604
> HCI Event: Command Complete (0x0e) plen 68                 #8 [hci1] 0.551693
      Read Local Supported Commands (0x04|0x0002) ncmd 1
        Status: Success (0x00)
        Commands: 119 entries
          Disconnect (Octet 0 - Bit 5)
          Read Remote Version Information (Octet 2 - Bit 7)
          Set Event Mask (Octet 5 - Bit 6)
          Reset (Octet 5 - Bit 7)
          Read Connection Accept Timeout (Octet 7 - Bit 2)
          Write Connection Accept Timeout (Octet 7 - Bit 3)
          Read Transmit Power Level (Octet 10 - Bit 2)
          Set Controller To Host Flow Control (Octet 10 - Bit 5)
          Host Buffer Size (Octet 10 - Bit 6)
          Host Number of Completed Packets (Octet 10 - Bit 7)
          Read Local Version Information (Octet 14 - Bit 3)
          Read Local Supported Features (Octet 14 - Bit 5)
          Read BD ADDR (Octet 15 - Bit 1)
          Read RSSI (Octet 15 - Bit 5)
          Set Event Mask Page 2 (Octet 22 - Bit 2)
          LE Set Event Mask (Octet 25 - Bit 0)
          LE Read Buffer Size (Octet 25 - Bit 1)
          LE Read Local Supported Features (Octet 25 - Bit 2)
          LE Set Random Address (Octet 25 - Bit 4)
          LE Set Advertising Parameters (Octet 25 - Bit 5)
          LE Read Advertising Channel TX Power (Octet 25 - Bit 6)
          LE Set Advertising Data (Octet 25 - Bit 7)
          LE Set Scan Response Data (Octet 26 - Bit 0)
          LE Set Advertise Enable (Octet 26 - Bit 1)
          LE Set Scan Parameters (Octet 26 - Bit 2)
          LE Set Scan Enable (Octet 26 - Bit 3)
          LE Create Connection (Octet 26 - Bit 4)
          LE Create Connection Cancel (Octet 26 - Bit 5)
          LE Read Accept List Size (Octet 26 - Bit 6)
          LE Clear Accept List (Octet 26 - Bit 7)
          LE Add Device To Accept List (Octet 27 - Bit 0)
          LE Remove Device From Accept List (Octet 27 - Bit 1)
          LE Connection Update (Octet 27 - Bit 2)
          LE Set Host Channel Classification (Octet 27 - Bit 3)
          LE Read Channel Map (Octet 27 - Bit 4)
          LE Read Remote Used Features (Octet 27 - Bit 5)
          LE Encrypt (Octet 27 - Bit 6)
          LE Rand (Octet 27 - Bit 7)
          LE Start Encryption (Octet 28 - Bit 0)
          LE Long Term Key Request Reply (Octet 28 - Bit 1)
          LE Long Term Key Request Neg Reply (Octet 28 - Bit 2)
          LE Read Supported States (Octet 28 - Bit 3)
          LE Receiver Test (Octet 28 - Bit 4)
          LE Transmitter Test (Octet 28 - Bit 5)
          LE Test End (Octet 28 - Bit 6)
          Read Authenticated Payload Timeout (Octet 32 - Bit 4)
          Write Authenticated Payload Timeout (Octet 32 - Bit 5)
          LE Set Data Length (Octet 33 - Bit 6)
          LE Read Suggested Default Data Length (Octet 33 - Bit 7)
          LE Write Suggested Default Data Length (Octet 34 - Bit 0)
          LE Add Device To Resolving List (Octet 34 - Bit 3)
          LE Remove Device From Resolving List (Octet 34 - Bit 4)
          LE Clear Resolving List (Octet 34 - Bit 5)
          LE Read Resolving List Size (Octet 34 - Bit 6)
          LE Set Address Resolution Enable (Octet 35 - Bit 1)
          LE Set Resolvable Private Address Timeout (Octet 35 - Bit 2)
          LE Read Maximum Data Length (Octet 35 - Bit 3)
          LE Read PHY (Octet 35 - Bit 4)
          LE Set Default PHY (Octet 35 - Bit 5)
          LE Set PHY (Octet 35 - Bit 6)
          LE Enhanced Receiver Test (Octet 35 - Bit 7)
          LE Enhanced Transmitter Test (Octet 36 - Bit 0)
          LE Set Advertising Set Random Address (Octet 36 - Bit 1)
          LE Set Extended Advertising Parameters (Octet 36 - Bit 2)
          LE Set Extended Advertising Data (Octet 36 - Bit 3)
          LE Set Extended Scan Response Data (Octet 36 - Bit 4)
          LE Set Extended Advertising Enable (Octet 36 - Bit 5)
          LE Read Maximum Advertising Data Length (Octet 36 - Bit 6)
          LE Read Number of Supported Advertising Sets (Octet 36 - Bit 7)
          LE Remove Advertising Set (Octet 37 - Bit 0)
          LE Clear Advertising Sets (Octet 37 - Bit 1)
          LE Set Periodic Advertising Parameters (Octet 37 - Bit 2)
          LE Set Periodic Advertising Data (Octet 37 - Bit 3)
          LE Set Periodic Advertising Enable (Octet 37 - Bit 4)
          LE Set Extended Scan Parameters (Octet 37 - Bit 5)
          LE Set Extended Scan Enable (Octet 37 - Bit 6)
          LE Extended Create Connection (Octet 37 - Bit 7)
          LE Periodic Advertising Create Sync (Octet 38 - Bit 0)
          LE Periodic Advertising Create Sync Cancel (Octet 38 - Bit 1)
          LE Periodic Advertising Terminate Sync (Octet 38 - Bit 2)
          LE Add Device To Periodic Advertiser List (Octet 38 - Bit 3)
          LE Remove Device From Periodic Advertiser List (Octet 38 - Bit 4)
          LE Clear Periodic Advertiser List (Octet 38 - Bit 5)
          LE Read Periodic Advertiser List Size (Octet 38 - Bit 6)
          LE Read Transmit Power (Octet 38 - Bit 7)
          LE Read RF Path Compensation (Octet 39 - Bit 0)
          LE Write RF Path Compensation (Octet 39 - Bit 1)
          LE Set Privacy Mode (Octet 39 - Bit 2)
          LE Periodic Advertising Receive Enable (Octet 40 - Bit 5)
          LE Periodic Advertising Sync Transfer (Octet 40 - Bit 6)
          LE Periodic Advertising Set Info Transfer (Octet 40 - Bit 7)
          LE Periodic Advertising Sync Transfer Parameters (Octet 41 - Bit 0)
          LE Set Default Periodic Advertisng Sync Transfer Parameters (Octet 41 - Bit 1)
          LE Read Buffer v2 (Octet 41 - Bit 5)
          LE Read ISO TX Sync (Octet 41 - Bit 6)
          LE Set Connected Isochronous Group Parameters (Octet 41 - Bit 7)
          LE Set Connected Isochronous Group Parameters Test (Octet 42 - Bit 0)
          LE Create Connected Isochronous Stream (Octet 42 - Bit 1)
          LE Remove Connected Isochronous Group (Octet 42 - Bit 2)
          LE Accept Connected Isochronous Stream Request (Octet 42 - Bit 3)
          LE Reject Connected Isochronous Stream Request (Octet 42 - Bit 4)
          LE Create Broadcast Isochronous Group (Octet 42 - Bit 5)
          LE Create Broadcast Isochronous Group Test (Octet 42 - Bit 6)
          LE Terminate Broadcast Isochronous Group (Octet 42 - Bit 7)
          LE Broadcast Isochronous Group Create Sync (Octet 43 - Bit 0)
          LE Broadcast Isochronous Group Terminate Sync (Octet 43 - Bit 1)
          LE Request Peer SCA (Octet 43 - Bit 2)
          LE Setup Isochronous Data Path (Octet 43 - Bit 3)
          LE Remove Isochronous Data Path (Octet 43 - Bit 4)
          LE Isochronous Transmit Test (Octet 43 - Bit 5)
          LE Isochronous Receive Test (Octet 43 - Bit 6)
          LE Isochronous Read Test Counters (Octet 43 - Bit 7)
          LE Isochronous Read Test Counters (Octet 44 - Bit 0)
          LE Set Host Feature (Octet 44 - Bit 1)
          Octet 44 - Bit 2 
          Octet 45 - Bit 6 
          Octet 46 - Bit 0 
          Octet 46 - Bit 1 
          Octet 46 - Bit 2 
< HCI Command: Host Buffer Size (0x03|0x0033) plen 7         #9 [hci1] 0.570588
        ACL MTU: 255  ACL max packet: 16
        SCO MTU: 0    SCO max packet: 0
> HCI Event: Command Complete (0x0e) plen 4                 #10 [hci1] 0.571099
      Host Buffer Size (0x03|0x0033) ncmd 1
        Status: Success (0x00)
< HCI Command: Set Controller To Ho.. (0x03|0x0031) plen 1  #11 [hci1] 0.590597
        Flow control: ACL Data Packets (0x01)
> HCI Event: Command Complete (0x0e) plen 4                 #12 [hci1] 0.591024
      Set Controller To Host Flow Control (0x03|0x0031) ncmd 1
        Status: Success (0x00)
< HCI Command: LE Read Local Suppor.. (0x08|0x0003) plen 0  #13 [hci1] 0.610584
> HCI Event: Command Complete (0x0e) plen 12                #14 [hci1] 0.611170
      LE Read Local Supported Features (0x08|0x0003) ncmd 1
        Status: Success (0x00)
        Features: 0xfd 0x79 0x00 0xf7 0x30 0x01 0x00 0x00
          LE Encryption
          Extended Reject Indication
          Peripheral-initiated Features Exchange
          LE Ping
          LE Data Packet Length Extension
          LL Privacy
          Extended Scanner Filter Policies
          LE 2M PHY
          LE Coded PHY
          LE Extended Advertising
          LE Periodic Advertising
          Channel Selection Algorithm #2
          Periodic Advertising Sync Transfer - Sender
          Periodic Advertising Sync Transfer - Recipient
          Sleep Clock Accuracy Updates
          Connected Isochronous Stream - Central
          Connected Isochronous Stream - Peripheral
          Isochronous Broadcaster
          Synchronized Receiver
          Periodic Advertising ADI support
          Connection Subrating
          Unknown features (0x0000010000000000)
< HCI Command: LE Set Host Feature (0x08|0x0074) plen 2     #15 [hci1] 0.630597
        Bit Number: 32
          Connected Isochronous Stream (Host Support)
        Bit Value: 1
> HCI Event: Command Complete (0x0e) plen 4                 #16 [hci1] 0.631044
      LE Set Host Feature (0x08|0x0074) ncmd 1
        Status: Success (0x00)
< HCI Command: LE Read Buffer v2 (0x08|0x0060) plen 0       #17 [hci1] 0.650594
> HCI Event: Command Complete (0x0e) plen 10                #18 [hci1] 0.651089
      LE Read Buffer v2 (0x08|0x0060) ncmd 1
        Status: Success (0x00)
        ACL MTU: 27
        ACL max packet: 3
        ISO MTU: 318
        ISO max packet: 3
< HCI Command: LE Read Maximum Adve.. (0x08|0x003a) plen 0  #19 [hci1] 0.670615
> HCI Event: Command Complete (0x0e) plen 6                 #20 [hci1] 0.671005
      LE Read Maximum Advertising Data Length (0x08|0x003a) ncmd 1
        Status: Success (0x00)
        Max length: 1650
< HCI Command: LE Read Supported St.. (0x08|0x001c) plen 0  #21 [hci1] 0.690600
> HCI Event: Command Complete (0x0e) plen 12                #22 [hci1] 0.691104
      LE Read Supported States (0x08|0x001c) ncmd 1
        Status: Success (0x00)
        States: 0x000003ff3e0306ff
          Non-connectable Advertising State
          Scannable Advertising State
          Connectable Advertising State
          High Duty Cycle Directed Advertising State
          Passive Scanning State
          Active Scanning State
          Initiating State
            and Connection State (Central Role)
          Connection State (Peripheral Role)
          Scannable Advertising State
            and Passive Scanning State
          Connectable Advertising State
            and Passive Scanning State
          Non-connectable Advertising State
            and Initiating State
          Scannable Advertising State
            and Initiating State
          Active Scanning State
            and Connection State (Central Role)
          Passive Scanning State
            and Connection State (Peripheral Role)
          Active Scanning State
            and Connection State (Peripheral Role)
          Initiating State
            and Connection State (Central Role)
            and Central Role & Central Role
          Low Duty Cycle Directed Advertising State
          Connectable Advertising State
            and Initiating State
            and Central Role & Peripheral Role
          High Duty Cycle Directed Advertising State
            and Initiating State
            and Central Role & Peripheral Role
          Low Duty Cycle Directed Advertising State
            and Initiating State
            and Central Role & Peripheral Role
          Connectable Advertising State
            and Connection State (Central Role)
            and Central Role & Peripheral Role
          High Duty Cycle Directed Advertising State
            and Connection State (Central Role)
            and Central Role & Peripheral Role
          Low Duty Cycle Directed Advertising State
            and Connection State (Central Role)
            and Central Role & Peripheral Role
          Connectable Advertising State
            and Connection State (Peripheral Role)
            and Central Role & Peripheral Role
          High Duty Cycle Directed Advertising State
            and Connection State (Peripheral Role)
            and Peripheral Role & Peripheral Role
          Low Duty Cycle Directed Advertising State
            and Connection State (Peripheral Role)
            and Peripheral Role & Peripheral Role
          Initiating State
            and Connection State (Peripheral Role)
            and Central Role & Peripheral Role
< HCI Command: LE Read Maximum Data.. (0x08|0x002f) plen 0  #23 [hci1] 0.710587
> HCI Event: Command Complete (0x0e) plen 12                #24 [hci1] 0.711175
      LE Read Maximum Data Length (0x08|0x002f) ncmd 1
        Status: Success (0x00)
        Max TX octets: 251
        Max TX time: 2704
        Max RX octets: 251
        Max RX time: 2704
< HCI Command: LE Write Suggested D.. (0x08|0x0024) plen 4  #25 [hci1] 0.730586
        TX octets: 251
        TX time: 2704
> HCI Event: Command Complete (0x0e) plen 4                 #26 [hci1] 0.731086
      LE Write Suggested Default Data Length (0x08|0x0024) ncmd 1
        Status: Success (0x00)
< HCI Command: LE Read Resolving Li.. (0x08|0x002a) plen 0  #27 [hci1] 0.750613
> HCI Event: Command Complete (0x0e) plen 5                 #28 [hci1] 0.751077
      LE Read Resolving List Size (0x08|0x002a) ncmd 1
        Status: Success (0x00)
        Size: 8
< HCI Command: LE Set Event Mask (0x08|0x0001) plen 8       #29 [hci1] 0.770582
        Mask: 0x000002023f87fa5e
          LE Advertising Report
          LE Connection Update Complete
          LE Read Remote Used Features Complete
          LE Long Term Key Request
          LE Data Length Change
          LE Enhanced Connection Complete
          LE PHY Update Complete
          LE Extended Advertising Report
          LE Periodic Advertising Sync Established
          LE Periodic Advertising Report
          LE Periodic Advertising Sync Lost
          LE Extended Scan Timeout
          LE Extended Advertising Set Terminated
          LE Scan Request Received
          LE Periodic Advertising Sync Transfer Rvc
          LE CIS Established
          LE CIS Request
          LE Create BIG Complete
          LE Terminate BIG Complete
          LE BIG Sync Estabilished Complete
          LE BIG Sync Lost
          LE BIG Info Advertising Report
          Unknown mask (0x0000020000000000)
> HCI Event: Command Complete (0x0e) plen 4                 #30 [hci1] 0.771120
      LE Set Event Mask (0x08|0x0001) ncmd 1
        Status: Success (0x00)
< HCI Command: Set Event Mask (0x03|0x0001) plen 8          #31 [hci1] 0.790589
        Mask: 0x2000800002008890
          Disconnection Complete
          Encryption Change
          Read Remote Version Information Complete
          Hardware Error
          Data Buffer Overflow
          Encryption Key Refresh Complete
          LE Meta
> HCI Event: Command Complete (0x0e) plen 4                 #32 [hci1] 0.791123
      Set Event Mask (0x03|0x0001) ncmd 1
        Status: Success (0x00)
< HCI Command: Read BD ADDR (0x04|0x0009) plen 0            #33 [hci1] 0.810590
> HCI Event: Command Complete (0x0e) plen 10                #34 [hci1] 0.811052
      Read BD ADDR (0x04|0x0009) ncmd 1
        Status: Success (0x00)
        Address: 00:00:00:00:00:00 (OUI 00-00-00)
< HCI Command: LE Set Random Address (0x08|0x0005) plen 6   #35 [hci1] 0.830619
        Address: D5:B6:CC:31:DB:3B (Static)
> HCI Event: Command Complete (0x0e) plen 4                 #36 [hci1] 0.831149
      LE Set Random Address (0x08|0x0005) ncmd 1
        Status: Success (0x00)
< HCI Command: LE Set Extended Adv.. (0x08|0x0036) plen 25  #37 [hci1] 3.421101
        Handle: 0x00
        Properties: 0x0013
          Connectable
          Scannable
          Use legacy advertising PDUs: ADV_IND
        Min advertising interval: 100.000 msec (0x00a0)
        Max advertising interval: 150.000 msec (0x00f0)
        Channel map: 37, 38, 39 (0x07)
        Own address type: Random (0x01)
        Peer address type: Public (0x00)
        Peer address: 00:00:00:00:00:00 (OUI 00-00-00)
        Filter policy: Allow Scan Request from Any, Allow Connect Request from Any (0x00)
        TX power: Host has no preference (0x7f)
        Primary PHY: LE 1M (0x01)
        Secondary max skip: 0x00
        Secondary PHY: LE 1M (0x01)
        SID: 0x00
        Scan request notifications: Disabled (0x00)
> HCI Event: Command Complete (0x0e) plen 5                 #38 [hci1] 3.421932
      LE Set Extended Advertising Parameters (0x08|0x0036) ncmd 1
        Status: Success (0x00)
        TX power (selected): 0 dbm (0x00)
< HCI Command: LE Set Advertising S.. (0x08|0x0035) plen 7  #39 [hci1] 3.430940
        Advertising handle: 0x00
        Advertising random address: D5:B6:CC:31:DB:3B (Static)
> HCI Event: Command Complete (0x0e) plen 4                 #40 [hci1] 3.431445
      LE Set Advertising Set Random Address (0x08|0x0035) ncmd 1
        Status: Success (0x00)
< HCI Command: LE Set Extended Adv.. (0x08|0x0037) plen 22  #41 [hci1] 3.450767
        Handle: 0x00
        Operation: Complete extended advertising data (0x03)
        Fragment preference: Minimize fragmentation (0x01)
        Data length: 0x12
        Flags: 0x06
          LE General Discoverable Mode
          BR/EDR Not Supported
        Name (complete): Tester_F6B11A
> HCI Event: Command Complete (0x0e) plen 4                 #42 [hci1] 3.451486
      LE Set Extended Advertising Data (0x08|0x0037) ncmd 1
        Status: Success (0x00)
< HCI Command: LE Set Extended Scan.. (0x08|0x0038) plen 4  #43 [hci1] 3.470663
        Handle: 0x00
        Operation: Complete scan response data (0x03)
        Fragment preference: Minimize fragmentation (0x01)
        Data length: 0x00
> HCI Event: Command Complete (0x0e) plen 4                 #44 [hci1] 3.471271
      LE Set Extended Scan Response Data (0x08|0x0038) ncmd 1
        Status: Success (0x00)
< HCI Command: LE Set Extended Adve.. (0x08|0x0039) plen 6  #45 [hci1] 3.490621
        Extended advertising: Enabled (0x01)
        Number of sets: 1 (0x01)
        Entry 0
          Handle: 0x00
          Duration: 0 ms (0x00)
          Max ext adv events: 0
> HCI Event: Command Complete (0x0e) plen 4                 #46 [hci1] 3.491146
      LE Set Extended Advertising Enable (0x08|0x0039) ncmd 1
        Status: Success (0x00)
> HCI Event: LE Meta Event (0x3e) plen 31                   #47 [hci1] 3.595463
      LE Enhanced Connection Complete (0x0a)
        Status: Success (0x00)
        Handle: 2181
        Role: Peripheral (0x01)
        Peer address type: Public (0x00)
        Peer address: DF:A9:FF:F6:B1:1A (OUI DF-A9-FF)
        Local resolvable private address: 00:00:00:00:00:00 (Non-Resolvable)
        Peer resolvable private address: 00:00:00:00:00:00 (Non-Resolvable)
        Connection interval: 87.50 msec (0x0046)
        Connection latency: 0 (0x0000)
        Supervision timeout: 25120 msec (0x09d0)
        Central clock accuracy: 0x01
> HCI Event: LE Meta Event (0x3e) plen 6                    #48 [hci1] 3.595566
      LE Advertising Set Terminated (0x12)
        Status: Success (0x00)
        Handle: 0
        Connection handle: 2181
        Number of completed extended advertising events: 0
< HCI Command: LE Read Remote Used... (0x08|0x0016) plen 2  #49 [hci1] 3.611847
        Handle: 2181 Address: DF:A9:FF:F6:B1:1A (OUI DF-A9-FF)
< ACL Data TX: Handle 2181 flags 0x00 dlen 7                #50 [hci1] 3.611871
      ATT: Exchange MTU Request (0x02) len 2
        Client RX MTU: 251
> HCI Event: Command Status (0x0f) plen 4                   #51 [hci1] 3.612446
      LE Read Remote Used Features (0x08|0x0016) ncmd 1
        Status: Success (0x00)
> HCI Event: Number of Completed Packets (0x13) plen 5      #52 [hci1] 3.771421
        Num handles: 1
        Handle: 2181 Address: DF:A9:FF:F6:B1:1A (OUI DF-A9-FF)
        Count: 1
        #50: len 7 (0 Kb/s)
        Latency: 159 msec (159-159 msec ~159 msec)
> HCI Event: LE Meta Event (0x3e) plen 12                   #53 [hci1] 3.859274
      LE Read Remote Used Features (0x04)
        Status: Success (0x00)
        Handle: 2181 Address: DF:A9:FF:F6:B1:1A (OUI DF-A9-FF)
        Features: 0x2d 0x49 0x00 0xf7 0x67 0xd8 0x00 0x00
          LE Encryption
          Extended Reject Indication
          Peripheral-initiated Features Exchange
          LE Data Packet Length Extension
          LE 2M PHY
          LE Coded PHY
          Channel Selection Algorithm #2
          Periodic Advertising Sync Transfer - Sender
          Periodic Advertising Sync Transfer - Recipient
          Sleep Clock Accuracy Updates
          Connected Isochronous Stream - Central
          Connected Isochronous Stream - Peripheral
          Isochronous Broadcaster
          Synchronized Receiver
          Connected Isochronous Stream (Host Support)
          LE Power Control Request
          LE Power Control Request
          Connection Subrating
          Connection Subrating (Host Support)
          Unknown features (0x0000d80000000000)
> ACL Data RX: Handle 2181 flags 0x02 dlen 11               #54 [hci1] 6.308935
      SMP: Pairing Request (0x01) len 6
        IO capability: KeyboardDisplay (0x04)
        OOB data: Authentication data not present (0x00)
        Authentication requirement: Bonding, MITM, SC, No Keypresses (0x0d)
        Max encryption key size: 16
        Initiator key distribution: EncKey IdKey (0x03)
        Responder key distribution: EncKey IdKey Sign (0x07)
> ACL Data RX: Handle 2181 flags 0x02 dlen 7                #55 [hci1] 6.309438
      ATT: Exchange MTU Response (0x03) len 2
        Server RX MTU: 23
< HCI Command: Host Number of Compl.. (0x03|0x0035) plen 5  #56 [hci1] 6.311263
        Num handles: 1
        Handle: 2181 Address: DF:A9:FF:F6:B1:1A (OUI DF-A9-FF)
        Count: 1
< ACL Data TX: Handle 2181 flags 0x00 dlen 11               #57 [hci1] 6.311334
      SMP: Pairing Response (0x02) len 6
        IO capability: DisplayOnly (0x00)
        OOB data: Authentication data not present (0x00)
        Authentication requirement: Bonding, No MITM, SC, No Keypresses (0x09)
        Max encryption key size: 16
        Initiator key distribution: IdKey (0x02)
        Responder key distribution: <none> (0x00)
< HCI Command: Host Number of Compl.. (0x03|0x0035) plen 5  #58 [hci1] 6.311804
        Num handles: 1
        Handle: 2181 Address: DF:A9:FF:F6:B1:1A (OUI DF-A9-FF)
        Count: 1
> HCI Event: Number of Completed Packets (0x13) plen 5      #59 [hci1] 6.484107
        Num handles: 1
        Handle: 2181 Address: DF:A9:FF:F6:B1:1A (OUI DF-A9-FF)
        Count: 1
        #57: len 11 (0 Kb/s)
        Latency: 172 msec (159-172 msec ~166 msec)
> ACL Data RX: Handle 2181 flags 0x02 dlen 27               #60 [hci1] 6.484412
> ACL Data RX: Handle 2181 flags 0x01 dlen 27               #61 [hci1] 6.484910
> ACL Data RX: Handle 2181 flags 0x01 dlen 15               #62 [hci1] 6.485383
      SMP: Pairing Public Key (0x0c) len 64
        X: f2c0df18fb641c78c260bcc607247c20ac1559201f8458e0c4c2cda0ae9dc1ee
        Y: 32237bb4cdaea74f378d3d152a3515b0aaf5d4205133b3c1559d75899c857011
< HCI Command: Host Number of Compl.. (0x03|0x0035) plen 5  #63 [hci1] 6.491601
        Num handles: 1
        Handle: 2181 Address: DF:A9:FF:F6:B1:1A (OUI DF-A9-FF)
        Count: 1
< HCI Command: Host Number of Compl.. (0x03|0x0035) plen 5  #64 [hci1] 6.491827
        Num handles: 1
        Handle: 2181 Address: DF:A9:FF:F6:B1:1A (OUI DF-A9-FF)
        Count: 1
< HCI Command: Host Number of Compl.. (0x03|0x0035) plen 5  #65 [hci1] 6.492235
        Num handles: 1
        Handle: 2181 Address: DF:A9:FF:F6:B1:1A (OUI DF-A9-FF)
        Count: 1
< ACL Data TX: Handle 2181 flags 0x00 dlen 27               #66 [hci1] 6.492417
< ACL Data TX: Handle 2181 flags 0x01 dlen 27               #67 [hci1] 6.492495
< ACL Data TX: Handle 2181 flags 0x01 dlen 15               #68 [hci1] 6.492514
      SMP: Pairing Public Key (0x0c) len 64
        X: 98308440221e2d910f0e54b71e7ec652857aa9b5a0dc65028824cc19db1226e9
        Y: 67a4816bcb62efb21701e31fdb27561a6217575fb007a8bbdabe7e28b6f68482
> HCI Event: Number of Completed Packets (0x13) plen 5      #69 [hci1] 6.572010
        Num handles: 1
        Handle: 2181 Address: DF:A9:FF:F6:B1:1A (OUI DF-A9-FF)
        Count: 1
        #66: len 27 (2 Kb/s)
        Latency: 79 msec (79-172 msec ~122 msec)
> HCI Event: Number of Completed Packets (0x13) plen 5      #70 [hci1] 6.572618
        Num handles: 1
        Handle: 2181 Address: DF:A9:FF:F6:B1:1A (OUI DF-A9-FF)
        Count: 1
        #67: len 27 (2 Kb/s)
        Latency: 80 msec (79-172 msec ~101 msec)
> HCI Event: Number of Completed Packets (0x13) plen 5      #71 [hci1] 6.658863
        Num handles: 1
        Handle: 2181 Address: DF:A9:FF:F6:B1:1A (OUI DF-A9-FF)
        Count: 1
        #68: len 15 (0 Kb/s)
        Latency: 166 msec (79-172 msec ~133 msec)
> ACL Data RX: Handle 2181 flags 0x02 dlen 21               #72 [hci1] 7.621572
      SMP: Pairing Confirm (0x03) len 16
        Confim value: d2e933d6a4d994b0037350bbbde76b3e
< HCI Command: Host Number of Compl.. (0x03|0x0035) plen 5  #73 [hci1] 7.630950
        Num handles: 1
        Handle: 2181 Address: DF:A9:FF:F6:B1:1A (OUI DF-A9-FF)
        Count: 1
< ACL Data TX: Handle 2181 flags 0x00 dlen 21               #74 [hci1] 7.631020
      SMP: Pairing Confirm (0x03) len 16
        Confim value: c8e4224b2cd5e6751e3c8f3cb9a3b264
> HCI Event: Number of Completed Packets (0x13) plen 5      #75 [hci1] 7.796555
        Num handles: 1
        Handle: 2181 Address: DF:A9:FF:F6:B1:1A (OUI DF-A9-FF)
        Count: 1
        #74: len 21 (1 Kb/s)
        Latency: 165 msec (79-172 msec ~149 msec)
> ACL Data RX: Handle 2181 flags 0x02 dlen 21               #76 [hci1] 7.796761
      SMP: Pairing Random (0x04) len 16
        Random value: 2822d93bbc9bfa8a0000000000000000
< HCI Command: Host Number of Compl.. (0x03|0x0035) plen 5  #77 [hci1] 7.811479
        Num handles: 1
        Handle: 2181 Address: DF:A9:FF:F6:B1:1A (OUI DF-A9-FF)
        Count: 1
< ACL Data TX: Handle 2181 flags 0x00 dlen 21               #78 [hci1] 7.811622
      SMP: Pairing Random (0x04) len 16
        Random value: 8e6108f966a694cbe26df70bb96773e6
> HCI Event: Number of Completed Packets (0x13) plen 5      #79 [hci1] 7.971316
        Num handles: 1
        Handle: 2181 Address: DF:A9:FF:F6:B1:1A (OUI DF-A9-FF)
        Count: 1
        #78: len 21 (1 Kb/s)
        Latency: 159 msec (79-172 msec ~154 msec)
> ACL Data RX: Handle 2181 flags 0x02 dlen 21               #80 [hci1] 8.059154
      SMP: Pairing Confirm (0x03) len 16
        Confim value: 3c953740881e2c0ce87a14918b58c84b
< HCI Command: Host Number of Compl.. (0x03|0x0035) plen 5  #81 [hci1] 8.071433
        Num handles: 1
        Handle: 2181 Address: DF:A9:FF:F6:B1:1A (OUI DF-A9-FF)
        Count: 1
< ACL Data TX: Handle 2181 flags 0x00 dlen 21               #82 [hci1] 8.071555
      SMP: Pairing Confirm (0x03) len 16
        Confim value: 06a4b3e4f38881e2f74066131eea3feb
> HCI Event: Number of Completed Packets (0x13) plen 5      #83 [hci1] 8.233966
        Num handles: 1
        Handle: 2181 Address: DF:A9:FF:F6:B1:1A (OUI DF-A9-FF)
        Count: 1
        #82: len 21 (1 Kb/s)
        Latency: 162 msec (79-172 msec ~158 msec)
> ACL Data RX: Handle 2181 flags 0x02 dlen 21               #84 [hci1] 8.234380
      SMP: Pairing Random (0x04) len 16
        Random value: a16f707873c12f970000000000000000
< HCI Command: Host Number of Compl.. (0x03|0x0035) plen 5  #85 [hci1] 8.251731
        Num handles: 1
        Handle: 2181 Address: DF:A9:FF:F6:B1:1A (OUI DF-A9-FF)
        Count: 1
< ACL Data TX: Handle 2181 flags 0x00 dlen 21               #86 [hci1] 8.251900
      SMP: Pairing Random (0x04) len 16
        Random value: 4d02679f89a05211af56d8b3da64d21e
> HCI Event: Number of Completed Packets (0x13) plen 5      #87 [hci1] 8.408774
        Num handles: 1
        Handle: 2181 Address: DF:A9:FF:F6:B1:1A (OUI DF-A9-FF)
        Count: 1
        #86: len 21 (1 Kb/s)
        Latency: 156 msec (79-172 msec ~157 msec)
> ACL Data RX: Handle 2181 flags 0x02 dlen 21               #88 [hci1] 8.496600
      SMP: Pairing Confirm (0x03) len 16
        Confim value: 091a7f10b2e2173783a97e852331d0bf
< HCI Command: Host Number of Compl.. (0x03|0x0035) plen 5  #89 [hci1] 8.511422
        Num handles: 1
        Handle: 2181 Address: DF:A9:FF:F6:B1:1A (OUI DF-A9-FF)
        Count: 1
< ACL Data TX: Handle 2181 flags 0x00 dlen 21               #90 [hci1] 8.511518
      SMP: Pairing Confirm (0x03) len 16
        Confim value: f21c0c5d90800bae0071d25adc304aae
> HCI Event: Number of Completed Packets (0x13) plen 5      #91 [hci1] 8.671519
        Num handles: 1
        Handle: 2181 Address: DF:A9:FF:F6:B1:1A (OUI DF-A9-FF)
        Count: 1
        #90: len 21 (1 Kb/s)
        Latency: 160 msec (79-172 msec ~158 msec)
> ACL Data RX: Handle 2181 flags 0x02 dlen 21               #92 [hci1] 8.671746
      SMP: Pairing Random (0x04) len 16
        Random value: 7e2eafc241bd2f970000000000000000
< HCI Command: Host Number of Compl.. (0x03|0x0035) plen 5  #93 [hci1] 8.691571
        Num handles: 1
        Handle: 2181 Address: DF:A9:FF:F6:B1:1A (OUI DF-A9-FF)
        Count: 1
< ACL Data TX: Handle 2181 flags 0x00 dlen 21               #94 [hci1] 8.691738
      SMP: Pairing Random (0x04) len 16
        Random value: 5e8286bc235a02440d0c3424a2acf8fd
> HCI Event: Number of Completed Packets (0x13) plen 5      #95 [hci1] 8.846228
        Num handles: 1
        Handle: 2181 Address: DF:A9:FF:F6:B1:1A (OUI DF-A9-FF)
        Count: 1
        #94: len 21 (1 Kb/s)
        Latency: 154 msec (79-172 msec ~156 msec)
> ACL Data RX: Handle 2181 flags 0x02 dlen 21               #96 [hci1] 8.934079
      SMP: Pairing Confirm (0x03) len 16
        Confim value: 9ed8a7f70e36f54edd4c3964ee2c90e3
< HCI Command: Host Number of Compl.. (0x03|0x0035) plen 5  #97 [hci1] 8.950962
        Num handles: 1
        Handle: 2181 Address: DF:A9:FF:F6:B1:1A (OUI DF-A9-FF)
        Count: 1
< ACL Data TX: Handle 2181 flags 0x00 dlen 21               #98 [hci1] 8.951059
      SMP: Pairing Confirm (0x03) len 16
        Confim value: 7279b1a12d007900831faa39b780e1c5
> HCI Event: Number of Completed Packets (0x13) plen 5      #99 [hci1] 9.108956
        Num handles: 1
        Handle: 2181 Address: DF:A9:FF:F6:B1:1A (OUI DF-A9-FF)
        Count: 1
        #98: len 21 (1 Kb/s)
        Latency: 157 msec (79-172 msec ~157 msec)
> ACL Data RX: Handle 2181 flags 0x02 dlen 21              #100 [hci1] 9.109282
      SMP: Pairing Random (0x04) len 16
        Random value: 18980408fc963f650000000000000000
< HCI Command: Host Number of Comp.. (0x03|0x0035) plen 5  #101 [hci1] 9.111413
        Num handles: 1
        Handle: 2181 Address: DF:A9:FF:F6:B1:1A (OUI DF-A9-FF)
        Count: 1
< ACL Data TX: Handle 2181 flags 0x00 dlen 21              #102 [hci1] 9.111603
      SMP: Pairing Random (0x04) len 16
        Random value: 5c4a1bcadd27bd58e945097b00bad7ac
> HCI Event: Number of Completed Packets (0x13) plen 5     #103 [hci1] 9.283754
        Num handles: 1
        Handle: 2181 Address: DF:A9:FF:F6:B1:1A (OUI DF-A9-FF)
        Count: 1
        #102: len 21 (0 Kb/s)
        Latency: 172 msec (79-172 msec ~164 msec)
> ACL Data RX: Handle 2181 flags 0x02 dlen 21              #104 [hci1] 9.371540
      SMP: Pairing Confirm (0x03) len 16
        Confim value: 42c501110269e53aae42b53c8c6af237
< HCI Command: Host Number of Comp.. (0x03|0x0035) plen 5  #105 [hci1] 9.391299
        Num handles: 1
        Handle: 2181 Address: DF:A9:FF:F6:B1:1A (OUI DF-A9-FF)
        Count: 1
< ACL Data TX: Handle 2181 flags 0x00 dlen 21              #106 [hci1] 9.391411
      SMP: Pairing Confirm (0x03) len 16
        Confim value: caf64a405c8a19aa962a6061fbacfa83
> HCI Event: Number of Completed Packets (0x13) plen 5     #107 [hci1] 9.546426
        Num handles: 1
        Handle: 2181 Address: DF:A9:FF:F6:B1:1A (OUI DF-A9-FF)
        Count: 1
        #106: len 21 (1 Kb/s)
        Latency: 155 msec (79-172 msec ~159 msec)
> ACL Data RX: Handle 2181 flags 0x02 dlen 21              #108 [hci1] 9.546714
      SMP: Pairing Random (0x04) len 16
        Random value: ef3a82bd5158f90b0000000000000000
< HCI Command: Host Number of Comp.. (0x03|0x0035) plen 5  #109 [hci1] 9.550915
        Num handles: 1
        Handle: 2181 Address: DF:A9:FF:F6:B1:1A (OUI DF-A9-FF)
        Count: 1
< ACL Data TX: Handle 2181 flags 0x00 dlen 21              #110 [hci1] 9.550978
      SMP: Pairing Random (0x04) len 16
        Random value: 32527e6e64e79f33b2e374394db8ab2d
> HCI Event: Number of Completed Packets (0x13) plen 5     #111 [hci1] 9.721240
        Num handles: 1
        Handle: 2181 Address: DF:A9:FF:F6:B1:1A (OUI DF-A9-FF)
        Count: 1
        #110: len 21 (0 Kb/s)
        Latency: 170 msec (79-172 msec ~165 msec)
> ACL Data RX: Handle 2181 flags 0x02 dlen 21              #112 [hci1] 9.809019
      SMP: Pairing Confirm (0x03) len 16
        Confim value: 5a3b94cbeaa61194464a88180c9c86b0
< HCI Command: Host Number of Comp.. (0x03|0x0035) plen 5  #113 [hci1] 9.811284
        Num handles: 1
        Handle: 2181 Address: DF:A9:FF:F6:B1:1A (OUI DF-A9-FF)
        Count: 1
< ACL Data TX: Handle 2181 flags 0x00 dlen 21              #114 [hci1] 9.811318
      SMP: Pairing Confirm (0x03) len 16
        Confim value: 223c815db9454adb1cd4a93579b2253e
> HCI Event: Number of Completed Packets (0x13) plen 5     #115 [hci1] 9.983954
        Num handles: 1
        Handle: 2181 Address: DF:A9:FF:F6:B1:1A (OUI DF-A9-FF)
        Count: 1
        #114: len 21 (0 Kb/s)
        Latency: 172 msec (79-172 msec ~168 msec)
> ACL Data RX: Handle 2181 flags 0x02 dlen 21              #116 [hci1] 9.984222
      SMP: Pairing Random (0x04) len 16
        Random value: 1d659af14618bb7c0000000000000000
< HCI Command: Host Number of Comp.. (0x03|0x0035) plen 5  #117 [hci1] 9.990907
        Num handles: 1
        Handle: 2181 Address: DF:A9:FF:F6:B1:1A (OUI DF-A9-FF)
        Count: 1
< ACL Data TX: Handle 2181 flags 0x00 dlen 21              #118 [hci1] 9.990944
      SMP: Pairing Random (0x04) len 16
        Random value: dddbdfe2838e9a8cc6964353c850fef7
> HCI Event: Number of Completed Packets (0x13) plen 5    #119 [hci1] 10.158837
        Num handles: 1
        Handle: 2181 Address: DF:A9:FF:F6:B1:1A (OUI DF-A9-FF)
        Count: 1
        #118: len 21 (1 Kb/s)
        Latency: 167 msec (79-172 msec ~168 msec)
> ACL Data RX: Handle 2181 flags 0x02 dlen 21             #120 [hci1] 10.159204
      SMP: Pairing Confirm (0x03) len 16
        Confim value: 503705de8ca8e0f3e3139a13772e0877
< HCI Command: Host Number of Com.. (0x03|0x0035) plen 5  #121 [hci1] 10.170866
        Num handles: 1
        Handle: 2181 Address: DF:A9:FF:F6:B1:1A (OUI DF-A9-FF)
        Count: 1
< ACL Data TX: Handle 2181 flags 0x00 dlen 21             #122 [hci1] 10.170899
      SMP: Pairing Confirm (0x03) len 16
        Confim value: f30c86a1fe15ee796347a79389c97f86
> HCI Event: Number of Completed Packets (0x13) plen 5    #123 [hci1] 10.333883
        Num handles: 1
        Handle: 2181 Address: DF:A9:FF:F6:B1:1A (OUI DF-A9-FF)
        Count: 1
        #122: len 21 (1 Kb/s)
        Latency: 162 msec (79-172 msec ~165 msec)
> ACL Data RX: Handle 2181 flags 0x02 dlen 21             #124 [hci1] 10.334317
      SMP: Pairing Random (0x04) len 16
        Random value: b48d2e45fe7eb6870000000000000000
< HCI Command: Host Number of Com.. (0x03|0x0035) plen 5  #125 [hci1] 10.350813
        Num handles: 1
        Handle: 2181 Address: DF:A9:FF:F6:B1:1A (OUI DF-A9-FF)
        Count: 1
< ACL Data TX: Handle 2181 flags 0x00 dlen 21             #126 [hci1] 10.350822
      SMP: Pairing Random (0x04) len 16
        Random value: eb9f1915536596b6fc3db1c86b2b1970
> HCI Event: Number of Completed Packets (0x13) plen 5    #127 [hci1] 10.508643
        Num handles: 1
        Handle: 2181 Address: DF:A9:FF:F6:B1:1A (OUI DF-A9-FF)
        Count: 1
        #126: len 21 (1 Kb/s)
        Latency: 157 msec (79-172 msec ~161 msec)
> ACL Data RX: Handle 2181 flags 0x02 dlen 21             #128 [hci1] 10.596493
      SMP: Pairing Confirm (0x03) len 16
        Confim value: 4bc47a69f6a53fef40bd9d4aeb748bab
< HCI Command: Host Number of Com.. (0x03|0x0035) plen 5  #129 [hci1] 10.610837
        Num handles: 1
        Handle: 2181 Address: DF:A9:FF:F6:B1:1A (OUI DF-A9-FF)
        Count: 1
< ACL Data TX: Handle 2181 flags 0x00 dlen 21             #130 [hci1] 10.610905
      SMP: Pairing Confirm (0x03) len 16
        Confim value: da6f093f1787bd30ac24ff1d125b3a76
> HCI Event: Number of Completed Packets (0x13) plen 5    #131 [hci1] 10.771463
        Num handles: 1
        Handle: 2181 Address: DF:A9:FF:F6:B1:1A (OUI DF-A9-FF)
        Count: 1
        #130: len 21 (1 Kb/s)
        Latency: 160 msec (79-172 msec ~161 msec)
> ACL Data RX: Handle 2181 flags 0x02 dlen 21             #132 [hci1] 10.771786
      SMP: Pairing Random (0x04) len 16
        Random value: 3417be2401b5d4980000000000000000
< HCI Command: Host Number of Com.. (0x03|0x0035) plen 5  #133 [hci1] 10.791587
        Num handles: 1
        Handle: 2181 Address: DF:A9:FF:F6:B1:1A (OUI DF-A9-FF)
        Count: 1
< ACL Data TX: Handle 2181 flags 0x00 dlen 21             #134 [hci1] 10.791667
      SMP: Pairing Random (0x04) len 16
        Random value: 5c794dc9ad9f2c3f295ebd5ad5e1c3cf
> HCI Event: Number of Completed Packets (0x13) plen 5    #135 [hci1] 10.946116
        Num handles: 1
        Handle: 2181 Address: DF:A9:FF:F6:B1:1A (OUI DF-A9-FF)
        Count: 1
        #134: len 21 (1 Kb/s)
        Latency: 154 msec (79-172 msec ~157 msec)
> ACL Data RX: Handle 2181 flags 0x02 dlen 21             #136 [hci1] 11.034062
      SMP: Pairing Confirm (0x03) len 16
        Confim value: b09cbb4ce012670905fd3caceb261105
< HCI Command: Host Number of Com.. (0x03|0x0035) plen 5  #137 [hci1] 11.051373
        Num handles: 1
        Handle: 2181 Address: DF:A9:FF:F6:B1:1A (OUI DF-A9-FF)
        Count: 1
< ACL Data TX: Handle 2181 flags 0x00 dlen 21             #138 [hci1] 11.051465
      SMP: Pairing Confirm (0x03) len 16
        Confim value: 425fa167cba2a87c35d19be0ae5f6791
> HCI Event: Number of Completed Packets (0x13) plen 5    #139 [hci1] 11.208892
        Num handles: 1
        Handle: 2181 Address: DF:A9:FF:F6:B1:1A (OUI DF-A9-FF)
        Count: 1
        #138: len 21 (1 Kb/s)
        Latency: 157 msec (79-172 msec ~157 msec)
> ACL Data RX: Handle 2181 flags 0x02 dlen 21             #140 [hci1] 11.209238
      SMP: Pairing Random (0x04) len 16
        Random value: 9cf79a1e8f2cdf310000000000000000
< HCI Command: Host Number of Com.. (0x03|0x0035) plen 5  #141 [hci1] 11.211062
        Num handles: 1
        Handle: 2181 Address: DF:A9:FF:F6:B1:1A (OUI DF-A9-FF)
        Count: 1
< ACL Data TX: Handle 2181 flags 0x00 dlen 21             #142 [hci1] 11.211109
      SMP: Pairing Random (0x04) len 16
        Random value: 5c2fff312cdf99c9491988e877355a9a
> HCI Event: Number of Completed Packets (0x13) plen 5    #143 [hci1] 11.383685
        Num handles: 1
        Handle: 2181 Address: DF:A9:FF:F6:B1:1A (OUI DF-A9-FF)
        Count: 1
        #142: len 21 (0 Kb/s)
        Latency: 172 msec (79-172 msec ~165 msec)
> ACL Data RX: Handle 2181 flags 0x02 dlen 21             #144 [hci1] 11.471550
      SMP: Pairing Confirm (0x03) len 16
        Confim value: 0a5dfe9f0891b83a221e45a94d0e4890
< HCI Command: Host Number of Com.. (0x03|0x0035) plen 5  #145 [hci1] 11.491257
        Num handles: 1
        Handle: 2181 Address: DF:A9:FF:F6:B1:1A (OUI DF-A9-FF)
        Count: 1
< ACL Data TX: Handle 2181 flags 0x00 dlen 21             #146 [hci1] 11.491463
      SMP: Pairing Confirm (0x03) len 16
        Confim value: 1cb8d0d9c2ab5657a5dcd431b7a5c2b0
> HCI Event: Number of Completed Packets (0x13) plen 5    #147 [hci1] 11.646347
        Num handles: 1
        Handle: 2181 Address: DF:A9:FF:F6:B1:1A (OUI DF-A9-FF)
        Count: 1
        #146: len 21 (1 Kb/s)
        Latency: 154 msec (79-172 msec ~159 msec)
> ACL Data RX: Handle 2181 flags 0x02 dlen 21             #148 [hci1] 11.646743
      SMP: Pairing Random (0x04) len 16
        Random value: 79f6700e43462b170000000000000000
< HCI Command: Host Number of Com.. (0x03|0x0035) plen 5  #149 [hci1] 11.651503
        Num handles: 1
        Handle: 2181 Address: DF:A9:FF:F6:B1:1A (OUI DF-A9-FF)
        Count: 1
< ACL Data TX: Handle 2181 flags 0x00 dlen 21             #150 [hci1] 11.651666
      SMP: Pairing Random (0x04) len 16
        Random value: c629a3a987d808e808655d558dfc1155
> HCI Event: Number of Completed Packets (0x13) plen 5    #151 [hci1] 11.821255
        Num handles: 1
        Handle: 2181 Address: DF:A9:FF:F6:B1:1A (OUI DF-A9-FF)
        Count: 1
        #150: len 21 (0 Kb/s)
        Latency: 169 msec (79-172 msec ~164 msec)
> ACL Data RX: Handle 2181 flags 0x02 dlen 21             #152 [hci1] 11.909032
      SMP: Pairing Confirm (0x03) len 16
        Confim value: 706ddfd63f74ba5f7b71f5cc0ba316f7
< HCI Command: Host Number of Com.. (0x03|0x0035) plen 5  #153 [hci1] 11.911183
        Num handles: 1
        Handle: 2181 Address: DF:A9:FF:F6:B1:1A (OUI DF-A9-FF)
        Count: 1
< ACL Data TX: Handle 2181 flags 0x00 dlen 21             #154 [hci1] 11.911292
      SMP: Pairing Confirm (0x03) len 16
        Confim value: 0cfc207d75f1ba06bdcd38ba79d21de7
> HCI Event: Number of Completed Packets (0x13) plen 5    #155 [hci1] 12.083854
        Num handles: 1
        Handle: 2181 Address: DF:A9:FF:F6:B1:1A (OUI DF-A9-FF)
        Count: 1
        #154: len 21 (0 Kb/s)
        Latency: 172 msec (79-172 msec ~168 msec)
> ACL Data RX: Handle 2181 flags 0x02 dlen 21             #156 [hci1] 12.084231
      SMP: Pairing Random (0x04) len 16
        Random value: 7c2ebaf54b0f1ab70000000000000000
< HCI Command: Host Number of Com.. (0x03|0x0035) plen 5  #157 [hci1] 12.091062
        Num handles: 1
        Handle: 2181 Address: DF:A9:FF:F6:B1:1A (OUI DF-A9-FF)
        Count: 1
< ACL Data TX: Handle 2181 flags 0x00 dlen 21             #158 [hci1] 12.091105
      SMP: Pairing Random (0x04) len 16
        Random value: 92f20f6ad8f13724432c7fd6001c45ff
> HCI Event: Number of Completed Packets (0x13) plen 5    #159 [hci1] 12.258616
        Num handles: 1
        Handle: 2181 Address: DF:A9:FF:F6:B1:1A (OUI DF-A9-FF)
        Count: 1
        #158: len 21 (1 Kb/s)
        Latency: 167 msec (79-172 msec ~168 msec)
> ACL Data RX: Handle 2181 flags 0x02 dlen 21             #160 [hci1] 12.346446
      SMP: Pairing Confirm (0x03) len 16
        Confim value: ed5f6dc75d127191f9e605437d887626
< HCI Command: Host Number of Com.. (0x03|0x0035) plen 5  #161 [hci1] 12.351376
        Num handles: 1
        Handle: 2181 Address: DF:A9:FF:F6:B1:1A (OUI DF-A9-FF)
        Count: 1
< ACL Data TX: Handle 2181 flags 0x00 dlen 21             #162 [hci1] 12.351522
      SMP: Pairing Confirm (0x03) len 16
        Confim value: d00e94508df9247e1d126e32af977627
> HCI Event: Number of Completed Packets (0x13) plen 5    #163 [hci1] 12.521395
        Num handles: 1
        Handle: 2181 Address: DF:A9:FF:F6:B1:1A (OUI DF-A9-FF)
        Count: 1
        #162: len 21 (0 Kb/s)
        Latency: 169 msec (79-172 msec ~168 msec)
> ACL Data RX: Handle 2181 flags 0x02 dlen 21             #164 [hci1] 12.521752
      SMP: Pairing Random (0x04) len 16
        Random value: e71d4d522167230f0000000000000000
< HCI Command: Host Number of Com.. (0x03|0x0035) plen 5  #165 [hci1] 12.531485
        Num handles: 1
        Handle: 2181 Address: DF:A9:FF:F6:B1:1A (OUI DF-A9-FF)
        Count: 1
< ACL Data TX: Handle 2181 flags 0x00 dlen 21             #166 [hci1] 12.531660
      SMP: Pairing Random (0x04) len 16
        Random value: 23ac32ebbb5e14c8a6b9622f296d277f
> HCI Event: Number of Completed Packets (0x13) plen 5    #167 [hci1] 12.696111
        Num handles: 1
        Handle: 2181 Address: DF:A9:FF:F6:B1:1A (OUI DF-A9-FF)
        Count: 1
        #166: len 21 (1 Kb/s)
        Latency: 164 msec (79-172 msec ~166 msec)
> ACL Data RX: Handle 2181 flags 0x02 dlen 21             #168 [hci1] 12.783928
      SMP: Pairing Confirm (0x03) len 16
        Confim value: 3e620578864ab6a2c8b3e26b00c50ecf
< HCI Command: Host Number of Com.. (0x03|0x0035) plen 5  #169 [hci1] 12.791394
        Num handles: 1
        Handle: 2181 Address: DF:A9:FF:F6:B1:1A (OUI DF-A9-FF)
        Count: 1
< ACL Data TX: Handle 2181 flags 0x00 dlen 21             #170 [hci1] 12.791537
      SMP: Pairing Confirm (0x03) len 16
        Confim value: eb44033f2124b3f49cff3b466d18786f
> HCI Event: Number of Completed Packets (0x13) plen 5    #171 [hci1] 12.958869
        Num handles: 1
        Handle: 2181 Address: DF:A9:FF:F6:B1:1A (OUI DF-A9-FF)
        Count: 1
        #170: len 21 (1 Kb/s)
        Latency: 167 msec (79-172 msec ~167 msec)
> ACL Data RX: Handle 2181 flags 0x02 dlen 21             #172 [hci1] 12.959150
      SMP: Pairing Random (0x04) len 16
        Random value: c599c5611e41a1b70000000000000000
< HCI Command: Host Number of Com.. (0x03|0x0035) plen 5  #173 [hci1] 12.971694
        Num handles: 1
        Handle: 2181 Address: DF:A9:FF:F6:B1:1A (OUI DF-A9-FF)
        Count: 1
< ACL Data TX: Handle 2181 flags 0x00 dlen 21             #174 [hci1] 12.971870
      SMP: Pairing Random (0x04) len 16
        Random value: 297efe85e67448a15f56bd27e3a3cf1d
> HCI Event: Number of Completed Packets (0x13) plen 5    #175 [hci1] 13.133564
        Num handles: 1
        Handle: 2181 Address: DF:A9:FF:F6:B1:1A (OUI DF-A9-FF)
        Count: 1
        #174: len 21 (1 Kb/s)
        Latency: 161 msec (79-172 msec ~164 msec)
> ACL Data RX: Handle 2181 flags 0x02 dlen 21             #176 [hci1] 13.221460
      SMP: Pairing Confirm (0x03) len 16
        Confim value: cf6e65bd1975725016bf70d31409969e
< HCI Command: Host Number of Com.. (0x03|0x0035) plen 5  #177 [hci1] 13.231024
        Num handles: 1
        Handle: 2181 Address: DF:A9:FF:F6:B1:1A (OUI DF-A9-FF)
        Count: 1
< ACL Data TX: Handle 2181 flags 0x00 dlen 21             #178 [hci1] 13.231128
      SMP: Pairing Confirm (0x03) len 16
        Confim value: e2c647b6daeb28ceae954cbee412faf9
> HCI Event: Number of Completed Packets (0x13) plen 5    #179 [hci1] 13.396343
        Num handles: 1
        Handle: 2181 Address: DF:A9:FF:F6:B1:1A (OUI DF-A9-FF)
        Count: 1
        #178: len 21 (1 Kb/s)
        Latency: 165 msec (79-172 msec ~164 msec)
> ACL Data RX: Handle 2181 flags 0x02 dlen 21             #180 [hci1] 13.396723
      SMP: Pairing Random (0x04) len 16
        Random value: 7fbe7400745528b20000000000000000
< HCI Command: Host Number of Com.. (0x03|0x0035) plen 5  #181 [hci1] 13.411528
        Num handles: 1
        Handle: 2181 Address: DF:A9:FF:F6:B1:1A (OUI DF-A9-FF)
        Count: 1
< ACL Data TX: Handle 2181 flags 0x00 dlen 21             #182 [hci1] 13.411695
      SMP: Pairing Random (0x04) len 16
        Random value: 25a9493fd3ce4faf02be7293595bb7c6
> HCI Event: Number of Completed Packets (0x13) plen 5    #183 [hci1] 13.571061
        Num handles: 1
        Handle: 2181 Address: DF:A9:FF:F6:B1:1A (OUI DF-A9-FF)
        Count: 1
        #182: len 21 (1 Kb/s)
        Latency: 159 msec (79-172 msec ~162 msec)
> ACL Data RX: Handle 2181 flags 0x02 dlen 21             #184 [hci1] 13.658944
      SMP: Pairing Confirm (0x03) len 16
        Confim value: 4332a947bc3fa2041cbce85d71956356
< HCI Command: Host Number of Com.. (0x03|0x0035) plen 5  #185 [hci1] 13.670921
        Num handles: 1
        Handle: 2181 Address: DF:A9:FF:F6:B1:1A (OUI DF-A9-FF)
        Count: 1
< ACL Data TX: Handle 2181 flags 0x00 dlen 21             #186 [hci1] 13.670997
      SMP: Pairing Confirm (0x03) len 16
        Confim value: d5678d0065e56f842df93090dd0cd916
> HCI Event: Number of Completed Packets (0x13) plen 5    #187 [hci1] 13.833734
        Num handles: 1
        Handle: 2181 Address: DF:A9:FF:F6:B1:1A (OUI DF-A9-FF)
        Count: 1
        #186: len 21 (1 Kb/s)
        Latency: 162 msec (79-172 msec ~162 msec)
> ACL Data RX: Handle 2181 flags 0x02 dlen 21             #188 [hci1] 13.834192
      SMP: Pairing Random (0x04) len 16
        Random value: 3ec2d63fd92649860000000000000000
< HCI Command: Host Number of Com.. (0x03|0x0035) plen 5  #189 [hci1] 13.851636
        Num handles: 1
        Handle: 2181 Address: DF:A9:FF:F6:B1:1A (OUI DF-A9-FF)
        Count: 1
< ACL Data TX: Handle 2181 flags 0x00 dlen 21             #190 [hci1] 13.851789
      SMP: Pairing Random (0x04) len 16
        Random value: 58f6b41f855a6f6c3560debd84e2affc
> HCI Event: Number of Completed Packets (0x13) plen 5    #191 [hci1] 14.008696
        Num handles: 1
        Handle: 2181 Address: DF:A9:FF:F6:B1:1A (OUI DF-A9-FF)
        Count: 1
        #190: len 21 (1 Kb/s)
        Latency: 156 msec (79-172 msec ~159 msec)
> ACL Data RX: Handle 2181 flags 0x02 dlen 21             #192 [hci1] 14.096416
      SMP: Pairing Confirm (0x03) len 16
        Confim value: 53932ccf05eb32c98b579174d7f8b99f
< HCI Command: Host Number of Com.. (0x03|0x0035) plen 5  #193 [hci1] 14.111351
        Num handles: 1
        Handle: 2181 Address: DF:A9:FF:F6:B1:1A (OUI DF-A9-FF)
        Count: 1
< ACL Data TX: Handle 2181 flags 0x00 dlen 21             #194 [hci1] 14.111530
      SMP: Pairing Confirm (0x03) len 16
        Confim value: 4463bcfc03bb32cb5953ecd685d3075b
> HCI Event: Number of Completed Packets (0x13) plen 5    #195 [hci1] 14.271281
        Num handles: 1
        Handle: 2181 Address: DF:A9:FF:F6:B1:1A (OUI DF-A9-FF)
        Count: 1
        #194: len 21 (1 Kb/s)
        Latency: 159 msec (79-172 msec ~159 msec)
> ACL Data RX: Handle 2181 flags 0x02 dlen 21             #196 [hci1] 14.271715
      SMP: Pairing Random (0x04) len 16
        Random value: 60e491639c61d6450000000000000000
< HCI Command: Host Number of Com.. (0x03|0x0035) plen 5  #197 [hci1] 14.291550
        Num handles: 1
        Handle: 2181 Address: DF:A9:FF:F6:B1:1A (OUI DF-A9-FF)
        Count: 1
< ACL Data TX: Handle 2181 flags 0x00 dlen 21             #198 [hci1] 14.291706
      SMP: Pairing Random (0x04) len 16
        Random value: b67e7216d5bf664139eda2b542549666
> HCI Event: Number of Completed Packets (0x13) plen 5    #199 [hci1] 14.445994
        Num handles: 1
        Handle: 2181 Address: DF:A9:FF:F6:B1:1A (OUI DF-A9-FF)
        Count: 1
        #198: len 21 (1 Kb/s)
        Latency: 154 msec (79-172 msec ~156 msec)
> ACL Data RX: Handle 2181 flags 0x02 dlen 21             #200 [hci1] 14.533872
      SMP: Pairing Confirm (0x03) len 16
        Confim value: a8fe943864b8bd1a185b0fa420ff152c
< HCI Command: Host Number of Com.. (0x03|0x0035) plen 5  #201 [hci1] 14.551331
        Num handles: 1
        Handle: 2181 Address: DF:A9:FF:F6:B1:1A (OUI DF-A9-FF)
        Count: 1
< ACL Data TX: Handle 2181 flags 0x00 dlen 21             #202 [hci1] 14.551492
      SMP: Pairing Confirm (0x03) len 16
        Confim value: 233895f07084328c3c4a26c0f5d9540f
> HCI Event: Number of Completed Packets (0x13) plen 5    #203 [hci1] 14.708777
        Num handles: 1
        Handle: 2181 Address: DF:A9:FF:F6:B1:1A (OUI DF-A9-FF)
        Count: 1
        #202: len 21 (1 Kb/s)
        Latency: 157 msec (79-172 msec ~157 msec)
> ACL Data RX: Handle 2181 flags 0x02 dlen 21             #204 [hci1] 14.709067
      SMP: Pairing Random (0x04) len 16
        Random value: 93840dc4890f00de0000000000000000
< HCI Command: Host Number of Com.. (0x03|0x0035) plen 5  #205 [hci1] 14.711595
        Num handles: 1
        Handle: 2181 Address: DF:A9:FF:F6:B1:1A (OUI DF-A9-FF)
        Count: 1
< ACL Data TX: Handle 2181 flags 0x00 dlen 21             #206 [hci1] 14.711754
      SMP: Pairing Random (0x04) len 16
        Random value: ed17f76500c95219dd01e09d1e63f87b
> HCI Event: Number of Completed Packets (0x13) plen 5    #207 [hci1] 14.883579
        Num handles: 1
        Handle: 2181 Address: DF:A9:FF:F6:B1:1A (OUI DF-A9-FF)
        Count: 1
        #206: len 21 (0 Kb/s)
        Latency: 171 msec (79-172 msec ~164 msec)
> ACL Data RX: Handle 2181 flags 0x02 dlen 21             #208 [hci1] 14.971385
      SMP: Pairing Confirm (0x03) len 16
        Confim value: 4305770586531953894a7e3fa0c066e5
< HCI Command: Host Number of Com.. (0x03|0x0035) plen 5  #209 [hci1] 14.991369
        Num handles: 1
        Handle: 2181 Address: DF:A9:FF:F6:B1:1A (OUI DF-A9-FF)
        Count: 1
< ACL Data TX: Handle 2181 flags 0x00 dlen 21             #210 [hci1] 14.991471
      SMP: Pairing Confirm (0x03) len 16
        Confim value: aaea17e8b9d884a04dad017076cc9e3f
> HCI Event: Number of Completed Packets (0x13) plen 5    #211 [hci1] 15.146271
        Num handles: 1
        Handle: 2181 Address: DF:A9:FF:F6:B1:1A (OUI DF-A9-FF)
        Count: 1
        #210: len 21 (1 Kb/s)
        Latency: 154 msec (79-172 msec ~159 msec)
> ACL Data RX: Handle 2181 flags 0x02 dlen 21             #212 [hci1] 15.146604
      SMP: Pairing Random (0x04) len 16
        Random value: 8fff917d068c8c860000000000000000
< HCI Command: Host Number of Com.. (0x03|0x0035) plen 5  #213 [hci1] 15.151549
        Num handles: 1
        Handle: 2181 Address: DF:A9:FF:F6:B1:1A (OUI DF-A9-FF)
        Count: 1
< ACL Data TX: Handle 2181 flags 0x00 dlen 21             #214 [hci1] 15.151716
      SMP: Pairing Random (0x04) len 16
        Random value: 81d35d47e1f6006d79c974bd9d9e1ee3
> HCI Event: Number of Completed Packets (0x13) plen 5    #215 [hci1] 15.321094
        Num handles: 1
        Handle: 2181 Address: DF:A9:FF:F6:B1:1A (OUI DF-A9-FF)
        Count: 1
        #214: len 21 (0 Kb/s)
        Latency: 169 msec (79-172 msec ~164 msec)
> ACL Data RX: Handle 2181 flags 0x02 dlen 21             #216 [hci1] 15.408875
      SMP: Pairing Confirm (0x03) len 16
        Confim value: 349483f8a8341451edc50be5216c0e7c
< HCI Command: Host Number of Com.. (0x03|0x0035) plen 5  #217 [hci1] 15.411386
        Num handles: 1
        Handle: 2181 Address: DF:A9:FF:F6:B1:1A (OUI DF-A9-FF)
        Count: 1
< ACL Data TX: Handle 2181 flags 0x00 dlen 21             #218 [hci1] 15.411480
      SMP: Pairing Confirm (0x03) len 16
        Confim value: 01e22b40c3a81cae3c030fd6859f5cc6
> HCI Event: Number of Completed Packets (0x13) plen 5    #219 [hci1] 15.583762
        Num handles: 1
        Handle: 2181 Address: DF:A9:FF:F6:B1:1A (OUI DF-A9-FF)
        Count: 1
        #218: len 21 (0 Kb/s)
        Latency: 172 msec (79-172 msec ~168 msec)
> ACL Data RX: Handle 2181 flags 0x02 dlen 21             #220 [hci1] 15.584035
      SMP: Pairing Random (0x04) len 16
        Random value: 23c6e3a3f110ce1f0000000000000000
< HCI Command: Host Number of Com.. (0x03|0x0035) plen 5  #221 [hci1] 15.591087
        Num handles: 1
        Handle: 2181 Address: DF:A9:FF:F6:B1:1A (OUI DF-A9-FF)
        Count: 1
< ACL Data TX: Handle 2181 flags 0x00 dlen 21             #222 [hci1] 15.591129
      SMP: Pairing Random (0x04) len 16
        Random value: e7f7e0c2476823e41736a7e381bafb7c
> HCI Event: Number of Completed Packets (0x13) plen 5    #223 [hci1] 15.758540
        Num handles: 1
        Handle: 2181 Address: DF:A9:FF:F6:B1:1A (OUI DF-A9-FF)
        Count: 1
        #222: len 21 (1 Kb/s)
        Latency: 167 msec (79-172 msec ~167 msec)
> ACL Data RX: Handle 2181 flags 0x02 dlen 21             #224 [hci1] 15.846386
      SMP: Pairing Confirm (0x03) len 16
        Confim value: 676b72f798b1e07eeb3ca5f88ded153a
< HCI Command: Host Number of Com.. (0x03|0x0035) plen 5  #225 [hci1] 15.851384
        Num handles: 1
        Handle: 2181 Address: DF:A9:FF:F6:B1:1A (OUI DF-A9-FF)
        Count: 1
< ACL Data TX: Handle 2181 flags 0x00 dlen 21             #226 [hci1] 15.851522
      SMP: Pairing Confirm (0x03) len 16
        Confim value: f487dcfa0ab0ed74bee64efeb5da7e49
> HCI Event: Number of Completed Packets (0x13) plen 5    #227 [hci1] 16.021319
        Num handles: 1
        Handle: 2181 Address: DF:A9:FF:F6:B1:1A (OUI DF-A9-FF)
        Count: 1
        #226: len 21 (0 Kb/s)
        Latency: 169 msec (79-172 msec ~168 msec)
> ACL Data RX: Handle 2181 flags 0x02 dlen 21             #228 [hci1] 16.021515
      SMP: Pairing Random (0x04) len 16
        Random value: f42fe03ae2c780a40000000000000000
