Bluetooth monitor ver 5.72
= Note: Linux version 6.14.0-36-generic (x86_64)                       0.219293
= Note: Bluetooth subsystem version 2.22                               0.219295
= New Index: 00:00:00:00:00:00 (Primary,UART,hci1)              [hci1] 0.219296
= New Index: 48:5F:99:8E:E0:64 (Primary,USB,hci0)               [hci0] 0.219296
= Open Index: 00:00:00:00:00:00                                 [hci1] 0.333074
= Index Info: 00:00:00:00:00:00 (Nordic Semiconductor ASA)      [hci1] 0.333092
@ USER Open: main (privileged) version 2.22            {0x0001} [hci1] 0.333100
< HCI Command: Reset (0x03|0x0003) plen 0                    #1 [hci1] 0.334374
> HCI Event: Command Complete (0x0e) plen 4                  #2 [hci1] 0.334871
      Reset (0x03|0x0003) ncmd 1
        Status: Success (0x00)
< HCI Command: Read Local Supported... (0x04|0x0003) plen 0  #3 [hci1] 0.352871
> HCI Event: Command Complete (0x0e) plen 12                 #4 [hci1] 0.353423
      Read Local Supported Features (0x04|0x0003) ncmd 1
        Status: Success (0x00)
        Features: 0x00 0x00 0x00 0x00 0x60 0x00 0x00 0x00
          BR/EDR Not Supported
          LE Supported (Controller)
< HCI Command: Read Local Version In.. (0x04|0x0001) plen 0  #5 [hci1] 0.372518
> HCI Event: Command Complete (0x0e) plen 12                 #6 [hci1] 0.373041
      Read Local Version Information (0x04|0x0001) ncmd 1
        Status: Success (0x00)
        HCI version: Reserved (0x0f) - Revision 12393 (0x3069)
        LMP version: Reserved (0x0f) - Subversion 12393 (0x3069)
        Manufacturer: Nordic Semiconductor ASA (89)
< HCI Command: Read Local Supported... (0x04|0x0002) plen 0  #7 [hci1] 0.392440
> HCI Event: Command Complete (0x0e) plen 68                 #8 [hci1] 0.393512
      Read Local Supported Commands (0x04|0x0002) ncmd 1
        Status: Success (0x00)
        Commands: 119 entries
          Disconnect (Octet 0 - Bit 5)
          Read Remote Version Information (Octet 2 - Bit 7)
          Set Event Mask (Octet 5 - Bit 6)
          Reset (Octet 5 - Bit 7)
          Read Connection Accept Timeout (Octet 7 - Bit 2)
          Write Connection Accept Timeout (Octet 7 - Bit 3)
          Read Transmit Power Level (Octet 10 - Bit 2)
          Set Controller To Host Flow Control (Octet 10 - Bit 5)
          Host Buffer Size (Octet 10 - Bit 6)
          Host Number of Completed Packets (Octet 10 - Bit 7)
          Read Local Version Information (Octet 14 - Bit 3)
          Read Local Supported Features (Octet 14 - Bit 5)
          Read BD ADDR (Octet 15 - Bit 1)
          Read RSSI (Octet 15 - Bit 5)
          Set Event Mask Page 2 (Octet 22 - Bit 2)
          LE Set Event Mask (Octet 25 - Bit 0)
          LE Read Buffer Size (Octet 25 - Bit 1)
          LE Read Local Supported Features (Octet 25 - Bit 2)
          LE Set Random Address (Octet 25 - Bit 4)
          LE Set Advertising Parameters (Octet 25 - Bit 5)
          LE Read Advertising Channel TX Power (Octet 25 - Bit 6)
          LE Set Advertising Data (Octet 25 - Bit 7)
          LE Set Scan Response Data (Octet 26 - Bit 0)
          LE Set Advertise Enable (Octet 26 - Bit 1)
          LE Set Scan Parameters (Octet 26 - Bit 2)
          LE Set Scan Enable (Octet 26 - Bit 3)
          LE Create Connection (Octet 26 - Bit 4)
          LE Create Connection Cancel (Octet 26 - Bit 5)
          LE Read Accept List Size (Octet 26 - Bit 6)
          LE Clear Accept List (Octet 26 - Bit 7)
          LE Add Device To Accept List (Octet 27 - Bit 0)
          LE Remove Device From Accept List (Octet 27 - Bit 1)
          LE Connection Update (Octet 27 - Bit 2)
          LE Set Host Channel Classification (Octet 27 - Bit 3)
          LE Read Channel Map (Octet 27 - Bit 4)
          LE Read Remote Used Features (Octet 27 - Bit 5)
          LE Encrypt (Octet 27 - Bit 6)
          LE Rand (Octet 27 - Bit 7)
          LE Start Encryption (Octet 28 - Bit 0)
          LE Long Term Key Request Reply (Octet 28 - Bit 1)
          LE Long Term Key Request Neg Reply (Octet 28 - Bit 2)
          LE Read Supported States (Octet 28 - Bit 3)
          LE Receiver Test (Octet 28 - Bit 4)
          LE Transmitter Test (Octet 28 - Bit 5)
          LE Test End (Octet 28 - Bit 6)
          Read Authenticated Payload Timeout (Octet 32 - Bit 4)
          Write Authenticated Payload Timeout (Octet 32 - Bit 5)
          LE Set Data Length (Octet 33 - Bit 6)
          LE Read Suggested Default Data Length (Octet 33 - Bit 7)
          LE Write Suggested Default Data Length (Octet 34 - Bit 0)
          LE Add Device To Resolving List (Octet 34 - Bit 3)
          LE Remove Device From Resolving List (Octet 34 - Bit 4)
          LE Clear Resolving List (Octet 34 - Bit 5)
          LE Read Resolving List Size (Octet 34 - Bit 6)
          LE Set Address Resolution Enable (Octet 35 - Bit 1)
          LE Set Resolvable Private Address Timeout (Octet 35 - Bit 2)
          LE Read Maximum Data Length (Octet 35 - Bit 3)
          LE Read PHY (Octet 35 - Bit 4)
          LE Set Default PHY (Octet 35 - Bit 5)
          LE Set PHY (Octet 35 - Bit 6)
          LE Enhanced Receiver Test (Octet 35 - Bit 7)
          LE Enhanced Transmitter Test (Octet 36 - Bit 0)
          LE Set Advertising Set Random Address (Octet 36 - Bit 1)
          LE Set Extended Advertising Parameters (Octet 36 - Bit 2)
          LE Set Extended Advertising Data (Octet 36 - Bit 3)
          LE Set Extended Scan Response Data (Octet 36 - Bit 4)
          LE Set Extended Advertising Enable (Octet 36 - Bit 5)
          LE Read Maximum Advertising Data Length (Octet 36 - Bit 6)
          LE Read Number of Supported Advertising Sets (Octet 36 - Bit 7)
          LE Remove Advertising Set (Octet 37 - Bit 0)
          LE Clear Advertising Sets (Octet 37 - Bit 1)
          LE Set Periodic Advertising Parameters (Octet 37 - Bit 2)
          LE Set Periodic Advertising Data (Octet 37 - Bit 3)
          LE Set Periodic Advertising Enable (Octet 37 - Bit 4)
          LE Set Extended Scan Parameters (Octet 37 - Bit 5)
          LE Set Extended Scan Enable (Octet 37 - Bit 6)
          LE Extended Create Connection (Octet 37 - Bit 7)
          LE Periodic Advertising Create Sync (Octet 38 - Bit 0)
          LE Periodic Advertising Create Sync Cancel (Octet 38 - Bit 1)
          LE Periodic Advertising Terminate Sync (Octet 38 - Bit 2)
          LE Add Device To Periodic Advertiser List (Octet 38 - Bit 3)
          LE Remove Device From Periodic Advertiser List (Octet 38 - Bit 4)
          LE Clear Periodic Advertiser List (Octet 38 - Bit 5)
          LE Read Periodic Advertiser List Size (Octet 38 - Bit 6)
          LE Read Transmit Power (Octet 38 - Bit 7)
          LE Read RF Path Compensation (Octet 39 - Bit 0)
          LE Write RF Path Compensation (Octet 39 - Bit 1)
          LE Set Privacy Mode (Octet 39 - Bit 2)
          LE Periodic Advertising Receive Enable (Octet 40 - Bit 5)
          LE Periodic Advertising Sync Transfer (Octet 40 - Bit 6)
          LE Periodic Advertising Set Info Transfer (Octet 40 - Bit 7)
          LE Periodic Advertising Sync Transfer Parameters (Octet 41 - Bit 0)
          LE Set Default Periodic Advertisng Sync Transfer Parameters (Octet 41 - Bit 1)
          LE Read Buffer v2 (Octet 41 - Bit 5)
          LE Read ISO TX Sync (Octet 41 - Bit 6)
          LE Set Connected Isochronous Group Parameters (Octet 41 - Bit 7)
          LE Set Connected Isochronous Group Parameters Test (Octet 42 - Bit 0)
          LE Create Connected Isochronous Stream (Octet 42 - Bit 1)
          LE Remove Connected Isochronous Group (Octet 42 - Bit 2)
          LE Accept Connected Isochronous Stream Request (Octet 42 - Bit 3)
          LE Reject Connected Isochronous Stream Request (Octet 42 - Bit 4)
          LE Create Broadcast Isochronous Group (Octet 42 - Bit 5)
          LE Create Broadcast Isochronous Group Test (Octet 42 - Bit 6)
          LE Terminate Broadcast Isochronous Group (Octet 42 - Bit 7)
          LE Broadcast Isochronous Group Create Sync (Octet 43 - Bit 0)
          LE Broadcast Isochronous Group Terminate Sync (Octet 43 - Bit 1)
          LE Request Peer SCA (Octet 43 - Bit 2)
          LE Setup Isochronous Data Path (Octet 43 - Bit 3)
          LE Remove Isochronous Data Path (Octet 43 - Bit 4)
          LE Isochronous Transmit Test (Octet 43 - Bit 5)
          LE Isochronous Receive Test (Octet 43 - Bit 6)
          LE Isochronous Read Test Counters (Octet 43 - Bit 7)
          LE Isochronous Read Test Counters (Octet 44 - Bit 0)
          LE Set Host Feature (Octet 44 - Bit 1)
          Octet 44 - Bit 2 
          Octet 45 - Bit 6 
          Octet 46 - Bit 0 
          Octet 46 - Bit 1 
          Octet 46 - Bit 2 
< HCI Command: Host Buffer Size (0x03|0x0033) plen 7         #9 [hci1] 0.412486
        ACL MTU: 255  ACL max packet: 16
        SCO MTU: 0    SCO max packet: 0
> HCI Event: Command Complete (0x0e) plen 4                 #10 [hci1] 0.413056
      Host Buffer Size (0x03|0x0033) ncmd 1
        Status: Success (0x00)
< HCI Command: Set Controller To Ho.. (0x03|0x0031) plen 1  #11 [hci1] 0.432484
        Flow control: ACL Data Packets (0x01)
> HCI Event: Command Complete (0x0e) plen 4                 #12 [hci1] 0.432954
      Set Controller To Host Flow Control (0x03|0x0031) ncmd 1
        Status: Success (0x00)
< HCI Command: LE Read Local Suppor.. (0x08|0x0003) plen 0  #13 [hci1] 0.452405
> HCI Event: Command Complete (0x0e) plen 12                #14 [hci1] 0.452885
      LE Read Local Supported Features (0x08|0x0003) ncmd 1
        Status: Success (0x00)
        Features: 0xfd 0x79 0x00 0xf7 0x30 0x01 0x00 0x00
          LE Encryption
          Extended Reject Indication
          Peripheral-initiated Features Exchange
          LE Ping
          LE Data Packet Length Extension
          LL Privacy
          Extended Scanner Filter Policies
          LE 2M PHY
          LE Coded PHY
          LE Extended Advertising
          LE Periodic Advertising
          Channel Selection Algorithm #2
          Periodic Advertising Sync Transfer - Sender
          Periodic Advertising Sync Transfer - Recipient
          Sleep Clock Accuracy Updates
          Connected Isochronous Stream - Central
          Connected Isochronous Stream - Peripheral
          Isochronous Broadcaster
          Synchronized Receiver
          Periodic Advertising ADI support
          Connection Subrating
          Unknown features (0x0000010000000000)
< HCI Command: LE Set Host Feature (0x08|0x0074) plen 2     #15 [hci1] 0.472448
        Bit Number: 32
          Connected Isochronous Stream (Host Support)
        Bit Value: 1
> HCI Event: Command Complete (0x0e) plen 4                 #16 [hci1] 0.472903
      LE Set Host Feature (0x08|0x0074) ncmd 1
        Status: Success (0x00)
< HCI Command: LE Read Buffer v2 (0x08|0x0060) plen 0       #17 [hci1] 0.492448
> HCI Event: Command Complete (0x0e) plen 10                #18 [hci1] 0.492942
      LE Read Buffer v2 (0x08|0x0060) ncmd 1
        Status: Success (0x00)
        ACL MTU: 27
        ACL max packet: 3
        ISO MTU: 318
        ISO max packet: 3
< HCI Command: LE Read Maximum Adve.. (0x08|0x003a) plen 0  #19 [hci1] 0.512507
> HCI Event: Command Complete (0x0e) plen 6                 #20 [hci1] 0.512923
      LE Read Maximum Advertising Data Length (0x08|0x003a) ncmd 1
        Status: Success (0x00)
        Max length: 1650
< HCI Command: LE Read Supported St.. (0x08|0x001c) plen 0  #21 [hci1] 0.532498
> HCI Event: Command Complete (0x0e) plen 12                #22 [hci1] 0.533016
      LE Read Supported States (0x08|0x001c) ncmd 1
        Status: Success (0x00)
        States: 0x000003ff3e0306ff
          Non-connectable Advertising State
          Scannable Advertising State
          Connectable Advertising State
          High Duty Cycle Directed Advertising State
          Passive Scanning State
          Active Scanning State
          Initiating State
            and Connection State (Central Role)
          Connection State (Peripheral Role)
          Scannable Advertising State
            and Passive Scanning State
          Connectable Advertising State
            and Passive Scanning State
          Non-connectable Advertising State
            and Initiating State
          Scannable Advertising State
            and Initiating State
          Active Scanning State
            and Connection State (Central Role)
          Passive Scanning State
            and Connection State (Peripheral Role)
          Active Scanning State
            and Connection State (Peripheral Role)
          Initiating State
            and Connection State (Central Role)
            and Central Role & Central Role
          Low Duty Cycle Directed Advertising State
          Connectable Advertising State
            and Initiating State
            and Central Role & Peripheral Role
          High Duty Cycle Directed Advertising State
            and Initiating State
            and Central Role & Peripheral Role
          Low Duty Cycle Directed Advertising State
            and Initiating State
            and Central Role & Peripheral Role
          Connectable Advertising State
            and Connection State (Central Role)
            and Central Role & Peripheral Role
          High Duty Cycle Directed Advertising State
            and Connection State (Central Role)
            and Central Role & Peripheral Role
          Low Duty Cycle Directed Advertising State
            and Connection State (Central Role)
            and Central Role & Peripheral Role
          Connectable Advertising State
            and Connection State (Peripheral Role)
            and Central Role & Peripheral Role
          High Duty Cycle Directed Advertising State
            and Connection State (Peripheral Role)
            and Peripheral Role & Peripheral Role
          Low Duty Cycle Directed Advertising State
            and Connection State (Peripheral Role)
            and Peripheral Role & Peripheral Role
          Initiating State
            and Connection State (Peripheral Role)
            and Central Role & Peripheral Role
< HCI Command: LE Read Maximum Data.. (0x08|0x002f) plen 0  #23 [hci1] 0.552485
> HCI Event: Command Complete (0x0e) plen 12                #24 [hci1] 0.552999
      LE Read Maximum Data Length (0x08|0x002f) ncmd 1
        Status: Success (0x00)
        Max TX octets: 251
        Max TX time: 2704
        Max RX octets: 251
        Max RX time: 2704
< HCI Command: LE Write Suggested D.. (0x08|0x0024) plen 4  #25 [hci1] 0.572460
        TX octets: 251
        TX time: 2704
> HCI Event: Command Complete (0x0e) plen 4                 #26 [hci1] 0.572893
      LE Write Suggested Default Data Length (0x08|0x0024) ncmd 1
        Status: Success (0x00)
< HCI Command: LE Read Resolving Li.. (0x08|0x002a) plen 0  #27 [hci1] 0.592481
> HCI Event: Command Complete (0x0e) plen 5                 #28 [hci1] 0.592925
      LE Read Resolving List Size (0x08|0x002a) ncmd 1
        Status: Success (0x00)
        Size: 8
< HCI Command: LE Set Event Mask (0x08|0x0001) plen 8       #29 [hci1] 0.612333
        Mask: 0x000002023f87fa5e
          LE Advertising Report
          LE Connection Update Complete
          LE Read Remote Used Features Complete
          LE Long Term Key Request
          LE Data Length Change
          LE Enhanced Connection Complete
          LE PHY Update Complete
          LE Extended Advertising Report
          LE Periodic Advertising Sync Established
          LE Periodic Advertising Report
          LE Periodic Advertising Sync Lost
          LE Extended Scan Timeout
          LE Extended Advertising Set Terminated
          LE Scan Request Received
          LE Periodic Advertising Sync Transfer Rvc
          LE CIS Established
          LE CIS Request
          LE Create BIG Complete
          LE Terminate BIG Complete
          LE BIG Sync Estabilished Complete
          LE BIG Sync Lost
          LE BIG Info Advertising Report
          Unknown mask (0x0000020000000000)
> HCI Event: Command Complete (0x0e) plen 4                 #30 [hci1] 0.612793
      LE Set Event Mask (0x08|0x0001) ncmd 1
        Status: Success (0x00)
< HCI Command: Set Event Mask (0x03|0x0001) plen 8          #31 [hci1] 0.632488
        Mask: 0x2000800002008890
          Disconnection Complete
          Encryption Change
          Read Remote Version Information Complete
          Hardware Error
          Data Buffer Overflow
          Encryption Key Refresh Complete
          LE Meta
> HCI Event: Command Complete (0x0e) plen 4                 #32 [hci1] 0.632936
      Set Event Mask (0x03|0x0001) ncmd 1
        Status: Success (0x00)
< HCI Command: Read BD ADDR (0x04|0x0009) plen 0            #33 [hci1] 0.652439
> HCI Event: Command Complete (0x0e) plen 10                #34 [hci1] 0.652884
      Read BD ADDR (0x04|0x0009) ncmd 1
        Status: Success (0x00)
        Address: 00:00:00:00:00:00 (OUI 00-00-00)
< HCI Command: LE Set Random Address (0x08|0x0005) plen 6   #35 [hci1] 0.672442
        Address: D5:B6:CC:31:DB:3B (Static)
> HCI Event: Command Complete (0x0e) plen 4                 #36 [hci1] 0.672922
      LE Set Random Address (0x08|0x0005) ncmd 1
        Status: Success (0x00)
< HCI Command: LE Set Extended Adv.. (0x08|0x0036) plen 25  #37 [hci1] 2.882527
        Handle: 0x00
        Properties: 0x0013
          Connectable
          Scannable
          Use legacy advertising PDUs: ADV_IND
        Min advertising interval: 100.000 msec (0x00a0)
        Max advertising interval: 150.000 msec (0x00f0)
        Channel map: 37, 38, 39 (0x07)
        Own address type: Random (0x01)
        Peer address type: Public (0x00)
        Peer address: 00:00:00:00:00:00 (OUI 00-00-00)
        Filter policy: Allow Scan Request from Any, Allow Connect Request from Any (0x00)
        TX power: Host has no preference (0x7f)
        Primary PHY: LE 1M (0x01)
        Secondary max skip: 0x00
        Secondary PHY: LE 1M (0x01)
        SID: 0x00
        Scan request notifications: Disabled (0x00)
> HCI Event: Command Complete (0x0e) plen 5                 #38 [hci1] 2.883296
      LE Set Extended Advertising Parameters (0x08|0x0036) ncmd 1
        Status: Success (0x00)
        TX power (selected): 0 dbm (0x00)
< HCI Command: LE Set Advertising S.. (0x08|0x0035) plen 7  #39 [hci1] 2.892500
        Advertising handle: 0x00
        Advertising random address: D5:B6:CC:31:DB:3B (Static)
> HCI Event: Command Complete (0x0e) plen 4                 #40 [hci1] 2.892961
      LE Set Advertising Set Random Address (0x08|0x0035) ncmd 1
        Status: Success (0x00)
< HCI Command: LE Set Extended Adv.. (0x08|0x0037) plen 22  #41 [hci1] 2.912432
        Handle: 0x00
        Operation: Complete extended advertising data (0x03)
        Fragment preference: Minimize fragmentation (0x01)
        Data length: 0x12
        Flags: 0x06
          LE General Discoverable Mode
          BR/EDR Not Supported
        Name (complete): Tester_F6B11A
> HCI Event: Command Complete (0x0e) plen 4                 #42 [hci1] 2.913164
      LE Set Extended Advertising Data (0x08|0x0037) ncmd 1
        Status: Success (0x00)
< HCI Command: LE Set Extended Scan.. (0x08|0x0038) plen 4  #43 [hci1] 2.932570
        Handle: 0x00
        Operation: Complete scan response data (0x03)
        Fragment preference: Minimize fragmentation (0x01)
        Data length: 0x00
> HCI Event: Command Complete (0x0e) plen 4                 #44 [hci1] 2.933058
      LE Set Extended Scan Response Data (0x08|0x0038) ncmd 1
        Status: Success (0x00)
< HCI Command: LE Set Extended Adve.. (0x08|0x0039) plen 6  #45 [hci1] 2.952520
        Extended advertising: Enabled (0x01)
        Number of sets: 1 (0x01)
        Entry 0
          Handle: 0x00
          Duration: 0 ms (0x00)
          Max ext adv events: 0
> HCI Event: Command Complete (0x0e) plen 4                 #46 [hci1] 2.953009
      LE Set Extended Advertising Enable (0x08|0x0039) ncmd 1
        Status: Success (0x00)
> HCI Event: LE Meta Event (0x3e) plen 31                   #47 [hci1] 3.598689
      LE Enhanced Connection Complete (0x0a)
        Status: Success (0x00)
        Handle: 507
        Role: Peripheral (0x01)
        Peer address type: Public (0x00)
        Peer address: DF:A9:FF:F6:B1:1A (OUI DF-A9-FF)
        Local resolvable private address: 00:00:00:00:00:00 (Non-Resolvable)
        Peer resolvable private address: 00:00:00:00:00:00 (Non-Resolvable)
        Connection interval: 87.50 msec (0x0046)
        Connection latency: 0 (0x0000)
        Supervision timeout: 20000 msec (0x07d0)
        Central clock accuracy: 0x01
> HCI Event: LE Meta Event (0x3e) plen 6                    #48 [hci1] 3.598733
      LE Advertising Set Terminated (0x12)
        Status: Success (0x00)
        Handle: 0
        Connection handle: 507
        Number of completed extended advertising events: 0
< HCI Command: LE Read Remote Used... (0x08|0x0016) plen 2  #49 [hci1] 3.613590
        Handle: 507 Address: DF:A9:FF:F6:B1:1A (OUI DF-A9-FF)
> HCI Event: Command Status (0x0f) plen 4                   #50 [hci1] 3.614012
      LE Read Remote Used Features (0x08|0x0016) ncmd 1
        Status: Success (0x00)
> HCI Event: LE Meta Event (0x3e) plen 12                   #51 [hci1] 3.862515
      LE Read Remote Used Features (0x04)
        Status: Success (0x00)
        Handle: 507 Address: DF:A9:FF:F6:B1:1A (OUI DF-A9-FF)
        Features: 0x2d 0x49 0x00 0xf7 0x67 0xd8 0x00 0x00
          LE Encryption
          Extended Reject Indication
          Peripheral-initiated Features Exchange
          LE Data Packet Length Extension
          LE 2M PHY
          LE Coded PHY
          Channel Selection Algorithm #2
          Periodic Advertising Sync Transfer - Sender
          Periodic Advertising Sync Transfer - Recipient
          Sleep Clock Accuracy Updates
          Connected Isochronous Stream - Central
          Connected Isochronous Stream - Peripheral
          Isochronous Broadcaster
          Synchronized Receiver
          Connected Isochronous Stream (Host Support)
          LE Power Control Request
          LE Power Control Request
          Connection Subrating
          Connection Subrating (Host Support)
          Unknown features (0x0000d80000000000)
> ACL Data RX: Handle 507 flags 0x02 dlen 11                #52 [hci1] 4.299825
      SMP: Pairing Request (0x01) len 6
        IO capability: DisplayYesNo (0x01)
        OOB data: Authentication data not present (0x00)
        Authentication requirement: No bonding, No MITM, SC, No Keypresses (0x08)
        Max encryption key size: 16
        Initiator key distribution: <none> (0x00)
        Responder key distribution: <none> (0x00)
< HCI Command: Host Number of Compl.. (0x03|0x0035) plen 5  #53 [hci1] 4.312779
        Num handles: 1
        Handle: 507 Address: DF:A9:FF:F6:B1:1A (OUI DF-A9-FF)
        Count: 1
< ACL Data TX: Handle 507 flags 0x00 dlen 11                #54 [hci1] 4.312851
      SMP: Pairing Response (0x02) len 6
        IO capability: NoInputNoOutput (0x03)
        OOB data: Authentication data not present (0x00)
        Authentication requirement: No bonding, No MITM, SC, No Keypresses (0x08)
        Max encryption key size: 16
        Initiator key distribution: <none> (0x00)
        Responder key distribution: <none> (0x00)
> HCI Event: Number of Completed Packets (0x13) plen 5      #55 [hci1] 4.474923
        Num handles: 1
        Handle: 507 Address: DF:A9:FF:F6:B1:1A (OUI DF-A9-FF)
        Count: 1
        #54: len 11 (0 Kb/s)
        Latency: 162 msec (162-162 msec ~162 msec)
> ACL Data RX: Handle 507 flags 0x02 dlen 27                #56 [hci1] 4.475268
> ACL Data RX: Handle 507 flags 0x01 dlen 27                #57 [hci1] 4.475692
> ACL Data RX: Handle 507 flags 0x01 dlen 15                #58 [hci1] 4.476158
      SMP: Pairing Public Key (0x0c) len 64
        X: e6c2e98500039beba6ad64c8444fa1c0cf18fbdc638ffc39a7620a21cad7f85b
        Y: f5c524c9b90bab51d4e24b06ca2e863e18c008d8e9aaeeebadc7d610c070956f
< HCI Command: Host Number of Compl.. (0x03|0x0035) plen 5  #59 [hci1] 4.493291
        Num handles: 1
        Handle: 507 Address: DF:A9:FF:F6:B1:1A (OUI DF-A9-FF)
        Count: 1
< HCI Command: Host Number of Compl.. (0x03|0x0035) plen 5  #60 [hci1] 4.493542
        Num handles: 1
        Handle: 507 Address: DF:A9:FF:F6:B1:1A (OUI DF-A9-FF)
        Count: 1
< HCI Command: Host Number of Compl.. (0x03|0x0035) plen 5  #61 [hci1] 4.493994
        Num handles: 1
        Handle: 507 Address: DF:A9:FF:F6:B1:1A (OUI DF-A9-FF)
        Count: 1
< ACL Data TX: Handle 507 flags 0x00 dlen 27                #62 [hci1] 4.494091
< ACL Data TX: Handle 507 flags 0x01 dlen 27                #63 [hci1] 4.494171
< ACL Data TX: Handle 507 flags 0x01 dlen 15                #64 [hci1] 4.494205
      SMP: Pairing Public Key (0x0c) len 64
        X: 98308440221e2d910f0e54b71e7ec652857aa9b5a0dc65028824cc19db1226e9
        Y: 67a4816bcb62efb21701e31fdb27561a6217575fb007a8bbdabe7e28b6f68482
> HCI Event: Number of Completed Packets (0x13) plen 5      #65 [hci1] 4.562745
        Num handles: 1
        Handle: 507 Address: DF:A9:FF:F6:B1:1A (OUI DF-A9-FF)
        Count: 1
        #62: len 27 (3 Kb/s)
        Latency: 68 msec (68-162 msec ~115 msec)
> HCI Event: Number of Completed Packets (0x13) plen 5      #66 [hci1] 4.563433
        Num handles: 1
        Handle: 507 Address: DF:A9:FF:F6:B1:1A (OUI DF-A9-FF)
        Count: 1
        #63: len 27 (3 Kb/s)
        Latency: 69 msec (68-162 msec ~92 msec)
< ACL Data TX: Handle 507 flags 0x00 dlen 21                #67 [hci1] 4.572791
      SMP: Pairing Confirm (0x03) len 16
        Confim value: b660d612eeb163dd86fe8653a424771e
> HCI Event: Number of Completed Packets (0x13) plen 5      #68 [hci1] 4.649702
        Num handles: 1
        Handle: 507 Address: DF:A9:FF:F6:B1:1A (OUI DF-A9-FF)
        Count: 1
        #64: len 15 (0 Kb/s)
        Latency: 155 msec (68-162 msec ~123 msec)
> HCI Event: Number of Completed Packets (0x13) plen 5      #69 [hci1] 4.737314
        Num handles: 1
        Handle: 507 Address: DF:A9:FF:F6:B1:1A (OUI DF-A9-FF)
        Count: 1
        #67: len 21 (1 Kb/s)
        Latency: 164 msec (68-164 msec ~144 msec)
> ACL Data RX: Handle 507 flags 0x02 dlen 21                #70 [hci1] 4.737730
      SMP: Pairing Random (0x04) len 16
        Random value: 592e151e87d00e5ee44b8e2dd3e37979
< HCI Command: Host Number of Compl.. (0x03|0x0035) plen 5  #71 [hci1] 4.752818
        Num handles: 1
        Handle: 507 Address: DF:A9:FF:F6:B1:1A (OUI DF-A9-FF)
        Count: 1
< ACL Data TX: Handle 507 flags 0x00 dlen 21                #72 [hci1] 4.752859
      SMP: Pairing Random (0x04) len 16
        Random value: 8e6108f966a694cbe26df70bb96773e6
> HCI Event: Number of Completed Packets (0x13) plen 5      #73 [hci1] 4.912402
        Num handles: 1
        Handle: 507 Address: DF:A9:FF:F6:B1:1A (OUI DF-A9-FF)
        Count: 1
        #72: len 21 (1 Kb/s)
        Latency: 159 msec (68-164 msec ~151 msec)
> ACL Data RX: Handle 507 flags 0x02 dlen 21                #74 [hci1] 4.912729
      SMP: Pairing DHKey Check (0x0d) len 16
        E: c8389394a854436a4796f09bc2730afc
< HCI Command: Host Number of Compl.. (0x03|0x0035) plen 5  #75 [hci1] 4.933579
        Num handles: 1
        Handle: 507 Address: DF:A9:FF:F6:B1:1A (OUI DF-A9-FF)
        Count: 1
< ACL Data TX: Handle 507 flags 0x00 dlen 21                #76 [hci1] 4.933734
      SMP: Pairing DHKey Check (0x0d) len 16
        E: f29ccd7ffedb90e1d010c7b04a704e9f
> HCI Event: Number of Completed Packets (0x13) plen 5      #77 [hci1] 5.087115
        Num handles: 1
        Handle: 507 Address: DF:A9:FF:F6:B1:1A (OUI DF-A9-FF)
        Count: 1
        #76: len 21 (1 Kb/s)
        Latency: 153 msec (68-164 msec ~152 msec)
> HCI Event: LE Meta Event (0x3e) plen 13                   #78 [hci1] 5.175274
      LE Long Term Key Request (0x05)
        Handle: 507 Address: DF:A9:FF:F6:B1:1A (OUI DF-A9-FF)
        Random number: 0x0000000000000000
        Encrypted diversifier: 0x0000
< HCI Command: LE Long Term Key Re.. (0x08|0x001a) plen 18  #79 [hci1] 5.192931
        Handle: 507 Address: DF:A9:FF:F6:B1:1A (OUI DF-A9-FF)
        Long term key: 1e8dd9eeca300becaf87db7c62a3f2b1
> HCI Event: Command Complete (0x0e) plen 6                 #80 [hci1] 5.193609
      LE Long Term Key Request Reply (0x08|0x001a) ncmd 1
        Status: Success (0x00)
        Handle: 507 Address: DF:A9:FF:F6:B1:1A (OUI DF-A9-FF)
> HCI Event: Encryption Change (0x08) plen 4                #81 [hci1] 5.612454
        Status: Success (0x00)
        Handle: 507 Address: DF:A9:FF:F6:B1:1A (OUI DF-A9-FF)
        Encryption: Enabled with AES-CCM (0x01)
< ACL Data TX: Handle 507 flags 0x00 dlen 16                #82 [hci1] 8.622787
      LE L2CAP: Connection Parameter Update Request (0x12) ident 1 len 8
        Min interval: 24
        Max interval: 40
        Peripheral latency: 0
        Timeout multiplier: 42
> HCI Event: Number of Completed Packets (0x13) plen 5      #83 [hci1] 8.761947
        Num handles: 1
        Handle: 507 Address: DF:A9:FF:F6:B1:1A (OUI DF-A9-FF)
        Count: 1
        #82: len 16 (0 Kb/s)
        Latency: 139 msec (68-164 msec ~145 msec)
> HCI Event: Disconnect Complete (0x05) plen 4              #84 [hci1] 8.762258
        Status: Success (0x00)
        Handle: 507 Address: DF:A9:FF:F6:B1:1A (OUI DF-A9-FF)
        Reason: Remote User Terminated Connection (0x13)
< HCI Command: LE Set Extended Ad.. (0x08|0x0036) plen 25  #85 [hci1] 10.062924
        Handle: 0x00
        Properties: 0x0013
          Connectable
          Scannable
          Use legacy advertising PDUs: ADV_IND
        Min advertising interval: 100.000 msec (0x00a0)
        Max advertising interval: 150.000 msec (0x00f0)
        Channel map: 37, 38, 39 (0x07)
        Own address type: Random (0x01)
        Peer address type: Public (0x00)
        Peer address: 00:00:00:00:00:00 (OUI 00-00-00)
        Filter policy: Allow Scan Request from Any, Allow Connect Request from Any (0x00)
        TX power: Host has no preference (0x7f)
        Primary PHY: LE 1M (0x01)
        Secondary max skip: 0x00
        Secondary PHY: LE 1M (0x01)
        SID: 0x00
        Scan request notifications: Disabled (0x00)
> HCI Event: Command Complete (0x0e) plen 5                #86 [hci1] 10.063834
      LE Set Extended Advertising Parameters (0x08|0x0036) ncmd 1
        Status: Success (0x00)
        TX power (selected): 0 dbm (0x00)
< HCI Command: LE Set Advertising... (0x08|0x0035) plen 7  #87 [hci1] 10.072652
        Advertising handle: 0x00
        Advertising random address: D5:B6:CC:31:DB:3B (Static)
> HCI Event: Command Complete (0x0e) plen 4                #88 [hci1] 10.073127
      LE Set Advertising Set Random Address (0x08|0x0035) ncmd 1
        Status: Success (0x00)
< HCI Command: LE Set Extended Ad.. (0x08|0x0037) plen 22  #89 [hci1] 10.092533
        Handle: 0x00
        Operation: Complete extended advertising data (0x03)
        Fragment preference: Minimize fragmentation (0x01)
        Data length: 0x12
        Flags: 0x06
          LE General Discoverable Mode
          BR/EDR Not Supported
        Name (complete): Tester_F6B11A
> HCI Event: Command Complete (0x0e) plen 4                #90 [hci1] 10.093253
      LE Set Extended Advertising Data (0x08|0x0037) ncmd 1
        Status: Success (0x00)
< HCI Command: LE Set Extended Sca.. (0x08|0x0038) plen 4  #91 [hci1] 10.112504
        Handle: 0x00
        Operation: Complete scan response data (0x03)
        Fragment preference: Minimize fragmentation (0x01)
        Data length: 0x00
> HCI Event: Command Complete (0x0e) plen 4                #92 [hci1] 10.112991
      LE Set Extended Scan Response Data (0x08|0x0038) ncmd 1
        Status: Success (0x00)
< HCI Command: LE Set Extended Adv.. (0x08|0x0039) plen 6  #93 [hci1] 10.132566
        Extended advertising: Enabled (0x01)
        Number of sets: 1 (0x01)
        Entry 0
          Handle: 0x00
          Duration: 0 ms (0x00)
          Max ext adv events: 0
> HCI Event: Command Complete (0x0e) plen 4                #94 [hci1] 10.133107
      LE Set Extended Advertising Enable (0x08|0x0039) ncmd 1
        Status: Success (0x00)
> HCI Event: LE Meta Event (0x3e) plen 31                  #95 [hci1] 10.567867
      LE Enhanced Connection Complete (0x0a)
        Status: Success (0x00)
        Handle: 525
        Role: Peripheral (0x01)
        Peer address type: Public (0x00)
        Peer address: DF:A9:FF:F6:B1:1A (OUI DF-A9-FF)
        Local resolvable private address: 00:00:00:00:00:00 (Non-Resolvable)
        Peer resolvable private address: 00:00:00:00:00:00 (Non-Resolvable)
        Connection interval: 87.50 msec (0x0046)
        Connection latency: 0 (0x0000)
        Supervision timeout: 20000 msec (0x07d0)
        Central clock accuracy: 0x01
> HCI Event: LE Meta Event (0x3e) plen 6                   #96 [hci1] 10.567975
      LE Advertising Set Terminated (0x12)
        Status: Success (0x00)
        Handle: 0
        Connection handle: 525
        Number of completed extended advertising events: 0
< HCI Command: LE Read Remote Used.. (0x08|0x0016) plen 2  #97 [hci1] 10.573659
        Handle: 525 Address: DF:A9:FF:F6:B1:1A (OUI DF-A9-FF)
> HCI Event: Command Status (0x0f) plen 4                  #98 [hci1] 10.574079
      LE Read Remote Used Features (0x08|0x0016) ncmd 1
        Status: Success (0x00)
> HCI Event: LE Meta Event (0x3e) plen 12                  #99 [hci1] 10.831752
      LE Read Remote Used Features (0x04)
        Status: Success (0x00)
        Handle: 525 Address: DF:A9:FF:F6:B1:1A (OUI DF-A9-FF)
        Features: 0x2d 0x49 0x00 0xf7 0x67 0xd8 0x00 0x00
          LE Encryption
          Extended Reject Indication
          Peripheral-initiated Features Exchange
          LE Data Packet Length Extension
          LE 2M PHY
          LE Coded PHY
          Channel Selection Algorithm #2
          Periodic Advertising Sync Transfer - Sender
          Periodic Advertising Sync Transfer - Recipient
          Sleep Clock Accuracy Updates
          Connected Isochronous Stream - Central
          Connected Isochronous Stream - Peripheral
          Isochronous Broadcaster
          Synchronized Receiver
          Connected Isochronous Stream (Host Support)
          LE Power Control Request
          LE Power Control Request
          Connection Subrating
          Connection Subrating (Host Support)
          Unknown features (0x0000d80000000000)
> ACL Data RX: Handle 525 flags 0x02 dlen 11              #100 [hci1] 11.268920
      SMP: Pairing Request (0x01) len 6
        IO capability: DisplayYesNo (0x01)
        OOB data: Authentication data not present (0x00)
        Authentication requirement: No bonding, No MITM, SC, No Keypresses (0x08)
        Max encryption key size: 16
        Initiator key distribution: <none> (0x00)
        Responder key distribution: <none> (0x00)
< HCI Command: Host Number of Com.. (0x03|0x0035) plen 5  #101 [hci1] 11.273074
        Num handles: 1
        Handle: 525 Address: DF:A9:FF:F6:B1:1A (OUI DF-A9-FF)
        Count: 1
< ACL Data TX: Handle 525 flags 0x00 dlen 11              #102 [hci1] 11.273258
      SMP: Pairing Response (0x02) len 6
        IO capability: NoInputNoOutput (0x03)
        OOB data: Authentication data not present (0x00)
        Authentication requirement: No bonding, No MITM, SC, No Keypresses (0x08)
        Max encryption key size: 16
        Initiator key distribution: <none> (0x00)
        Responder key distribution: <none> (0x00)
> HCI Event: Number of Completed Packets (0x13) plen 5    #103 [hci1] 11.443991
        Num handles: 1
        Handle: 525 Address: DF:A9:FF:F6:B1:1A (OUI DF-A9-FF)
        Count: 1
        #102: len 11 (0 Kb/s)
        Latency: 170 msec (170-170 msec ~170 msec)
> ACL Data RX: Handle 525 flags 0x02 dlen 27              #104 [hci1] 11.444312
> ACL Data RX: Handle 525 flags 0x01 dlen 27              #105 [hci1] 11.444851
> ACL Data RX: Handle 525 flags 0x01 dlen 15              #106 [hci1] 11.445304
      SMP: Pairing Public Key (0x0c) len 64
        X: 32d1c83da6048d2463637edded550139c6e0482b975eb6e70b7abf746f2ba5eb
        Y: 37722e62d5eced236e5b60c1159eee30442a86351b2b92c741a6662109646678
< HCI Command: Host Number of Com.. (0x03|0x0035) plen 5  #107 [hci1] 11.453558
        Num handles: 1
        Handle: 525 Address: DF:A9:FF:F6:B1:1A (OUI DF-A9-FF)
        Count: 1
< HCI Command: Host Number of Com.. (0x03|0x0035) plen 5  #108 [hci1] 11.453864
        Num handles: 1
        Handle: 525 Address: DF:A9:FF:F6:B1:1A (OUI DF-A9-FF)
        Count: 1
< HCI Command: Host Number of Com.. (0x03|0x0035) plen 5  #109 [hci1] 11.454265
        Num handles: 1
        Handle: 525 Address: DF:A9:FF:F6:B1:1A (OUI DF-A9-FF)
        Count: 1
< ACL Data TX: Handle 525 flags 0x00 dlen 27              #110 [hci1] 11.454352
< ACL Data TX: Handle 525 flags 0x01 dlen 27              #111 [hci1] 11.454413
< ACL Data TX: Handle 525 flags 0x01 dlen 15              #112 [hci1] 11.454425
      SMP: Pairing Public Key (0x0c) len 64
        X: 98308440221e2d910f0e54b71e7ec652857aa9b5a0dc65028824cc19db1226e9
        Y: 67a4816bcb62efb21701e31fdb27561a6217575fb007a8bbdabe7e28b6f68482
> HCI Event: Number of Completed Packets (0x13) plen 5    #113 [hci1] 11.531921
        Num handles: 1
        Handle: 525 Address: DF:A9:FF:F6:B1:1A (OUI DF-A9-FF)
        Count: 1
        #110: len 27 (2 Kb/s)
        Latency: 77 msec (77-170 msec ~124 msec)
> HCI Event: Number of Completed Packets (0x13) plen 5    #114 [hci1] 11.532572
        Num handles: 1
        Handle: 525 Address: DF:A9:FF:F6:B1:1A (OUI DF-A9-FF)
        Count: 1
        #111: len 27 (2 Kb/s)
        Latency: 78 msec (77-170 msec ~101 msec)
< ACL Data TX: Handle 525 flags 0x00 dlen 21              #115 [hci1] 11.532629
      SMP: Pairing Confirm (0x03) len 16
        Confim value: c927836efef211b45c56d1d7980bf5c4
> HCI Event: Number of Completed Packets (0x13) plen 5    #116 [hci1] 11.618707
        Num handles: 1
        Handle: 525 Address: DF:A9:FF:F6:B1:1A (OUI DF-A9-FF)
        Count: 1
        #112: len 15 (0 Kb/s)
        Latency: 164 msec (77-170 msec ~132 msec)
> HCI Event: Number of Completed Packets (0x13) plen 5    #117 [hci1] 11.706586
        Num handles: 1
        Handle: 525 Address: DF:A9:FF:F6:B1:1A (OUI DF-A9-FF)
        Count: 1
        #115: len 21 (0 Kb/s)
        Latency: 173 msec (77-173 msec ~153 msec)
> ACL Data RX: Handle 525 flags 0x02 dlen 21              #118 [hci1] 11.706757
      SMP: Pairing Random (0x04) len 16
        Random value: 76c4267ac06ec24effb414d0b4259013
< HCI Command: Host Number of Com.. (0x03|0x0035) plen 5  #119 [hci1] 11.713183
        Num handles: 1
        Handle: 525 Address: DF:A9:FF:F6:B1:1A (OUI DF-A9-FF)
        Count: 1
< ACL Data TX: Handle 525 flags 0x00 dlen 21              #120 [hci1] 11.713405
      SMP: Pairing Random (0x04) len 16
        Random value: 5da095555cc64d02679f89a05211af56
> HCI Event: Number of Completed Packets (0x13) plen 5    #121 [hci1] 11.881450
        Num handles: 1
        Handle: 525 Address: DF:A9:FF:F6:B1:1A (OUI DF-A9-FF)
        Count: 1
        #120: len 21 (1 Kb/s)
        Latency: 168 msec (77-173 msec ~160 msec)
> ACL Data RX: Handle 525 flags 0x02 dlen 21              #122 [hci1] 11.881755
      SMP: Pairing DHKey Check (0x0d) len 16
        E: 325af16811bfcb6ebbae4e74015f95e8
< HCI Command: Host Number of Com.. (0x03|0x0035) plen 5  #123 [hci1] 11.893642
        Num handles: 1
        Handle: 525 Address: DF:A9:FF:F6:B1:1A (OUI DF-A9-FF)
        Count: 1
< ACL Data TX: Handle 525 flags 0x00 dlen 21              #124 [hci1] 11.893793
      SMP: Pairing DHKey Check (0x0d) len 16
        E: 9285260323b2977fe37fcf885ac2f5ea
> HCI Event: Number of Completed Packets (0x13) plen 5    #125 [hci1] 12.056237
        Num handles: 1
        Handle: 525 Address: DF:A9:FF:F6:B1:1A (OUI DF-A9-FF)
        Count: 1
        #124: len 21 (1 Kb/s)
        Latency: 162 msec (77-173 msec ~161 msec)
> HCI Event: LE Meta Event (0x3e) plen 13                 #126 [hci1] 12.144365
      LE Long Term Key Request (0x05)
        Handle: 525 Address: DF:A9:FF:F6:B1:1A (OUI DF-A9-FF)
        Random number: 0x0000000000000000
        Encrypted diversifier: 0x0000
< HCI Command: LE Long Term Key... (0x08|0x001a) plen 18  #127 [hci1] 12.152883
        Handle: 525 Address: DF:A9:FF:F6:B1:1A (OUI DF-A9-FF)
        Long term key: b4be45d48baa4d366e6b9f2a3885449d
> HCI Event: Command Complete (0x0e) plen 6               #128 [hci1] 12.153613
      LE Long Term Key Request Reply (0x08|0x001a) ncmd 1
        Status: Success (0x00)
        Handle: 525 Address: DF:A9:FF:F6:B1:1A (OUI DF-A9-FF)
> HCI Event: Encryption Change (0x08) plen 4              #129 [hci1] 12.581542
        Status: Success (0x00)
        Handle: 525 Address: DF:A9:FF:F6:B1:1A (OUI DF-A9-FF)
        Encryption: Enabled with AES-CCM (0x01)
< ACL Data TX: Handle 525 flags 0x00 dlen 16              #130 [hci1] 15.582918
      LE L2CAP: Connection Parameter Update Request (0x12) ident 2 len 8
        Min interval: 24
        Max interval: 40
        Peripheral latency: 0
        Timeout multiplier: 42
> HCI Event: Number of Completed Packets (0x13) plen 5    #131 [hci1] 15.731324
        Num handles: 1
        Handle: 525 Address: DF:A9:FF:F6:B1:1A (OUI DF-A9-FF)
        Count: 1
        #130: len 16 (0 Kb/s)
        Latency: 148 msec (77-173 msec ~154 msec)
> HCI Event: Disconnect Complete (0x05) plen 4            #132 [hci1] 15.731497
        Status: Success (0x00)
        Handle: 525 Address: DF:A9:FF:F6:B1:1A (OUI DF-A9-FF)
        Reason: Remote User Terminated Connection (0x13)
< HCI Command: LE Set Extended A.. (0x08|0x0036) plen 25  #133 [hci1] 16.252750
        Handle: 0x00
        Properties: 0x0013
          Connectable
          Scannable
          Use legacy advertising PDUs: ADV_IND
        Min advertising interval: 100.000 msec (0x00a0)
        Max advertising interval: 150.000 msec (0x00f0)
        Channel map: 37, 38, 39 (0x07)
        Own address type: Random (0x01)
        Peer address type: Public (0x00)
        Peer address: 00:00:00:00:00:00 (OUI 00-00-00)
        Filter policy: Allow Scan Request from Any, Allow Connect Request from Any (0x00)
        TX power: Host has no preference (0x7f)
        Primary PHY: LE 1M (0x01)
        Secondary max skip: 0x00
        Secondary PHY: LE 1M (0x01)
        SID: 0x00
        Scan request notifications: Disabled (0x00)
> HCI Event: Command Complete (0x0e) plen 5               #134 [hci1] 16.253502
      LE Set Extended Advertising Parameters (0x08|0x0036) ncmd 1
        Status: Success (0x00)
        TX power (selected): 0 dbm (0x00)
< HCI Command: LE Set Advertising.. (0x08|0x0035) plen 7  #135 [hci1] 16.272608
        Advertising handle: 0x00
        Advertising random address: D5:B6:CC:31:DB:3B (Static)
> HCI Event: Command Complete (0x0e) plen 4               #136 [hci1] 16.273248
      LE Set Advertising Set Random Address (0x08|0x0035) ncmd 1
        Status: Success (0x00)
< HCI Command: LE Set Extended A.. (0x08|0x0037) plen 22  #137 [hci1] 16.292660
        Handle: 0x00
        Operation: Complete extended advertising data (0x03)
        Fragment preference: Minimize fragmentation (0x01)
        Data length: 0x12
        Flags: 0x06
          LE General Discoverable Mode
          BR/EDR Not Supported
        Name (complete): Tester_F6B11A
> HCI Event: Command Complete (0x0e) plen 4               #138 [hci1] 16.293352
      LE Set Extended Advertising Data (0x08|0x0037) ncmd 1
        Status: Success (0x00)
< HCI Command: LE Set Extended Sc.. (0x08|0x0038) plen 4  #139 [hci1] 16.312666
        Handle: 0x00
        Operation: Complete scan response data (0x03)
        Fragment preference: Minimize fragmentation (0x01)
        Data length: 0x00
> HCI Event: Command Complete (0x0e) plen 4               #140 [hci1] 16.313066
      LE Set Extended Scan Response Data (0x08|0x0038) ncmd 1
        Status: Success (0x00)
< HCI Command: LE Set Extended Ad.. (0x08|0x0039) plen 6  #141 [hci1] 16.332696
        Extended advertising: Enabled (0x01)
        Number of sets: 1 (0x01)
        Entry 0
          Handle: 0x00
          Duration: 0 ms (0x00)
          Max ext adv events: 0
> HCI Event: Command Complete (0x0e) plen 4               #142 [hci1] 16.333258
      LE Set Extended Advertising Enable (0x08|0x0039) ncmd 1
        Status: Success (0x00)
> HCI Event: LE Meta Event (0x3e) plen 31                 #143 [hci1] 16.850956
      LE Enhanced Connection Complete (0x0a)
        Status: Success (0x00)
        Handle: 543
        Role: Peripheral (0x01)
        Peer address type: Public (0x00)
        Peer address: DF:A9:FF:F6:B1:1A (OUI DF-A9-FF)
        Local resolvable private address: 00:00:00:00:00:00 (Non-Resolvable)
        Peer resolvable private address: 00:00:00:00:00:00 (Non-Resolvable)
        Connection interval: 87.50 msec (0x0046)
        Connection latency: 0 (0x0000)
        Supervision timeout: 20000 msec (0x07d0)
        Central clock accuracy: 0x01
> HCI Event: LE Meta Event (0x3e) plen 6                  #144 [hci1] 16.851053
      LE Advertising Set Terminated (0x12)
        Status: Success (0x00)
        Handle: 0
        Connection handle: 543
        Number of completed extended advertising events: 0
< HCI Command: LE Read Remote Use.. (0x08|0x0016) plen 2  #145 [hci1] 16.852833
        Handle: 543 Address: DF:A9:FF:F6:B1:1A (OUI DF-A9-FF)
> HCI Event: Command Status (0x0f) plen 4                 #146 [hci1] 16.853273
      LE Read Remote Used Features (0x08|0x0016) ncmd 1
        Status: Success (0x00)
> HCI Event: LE Meta Event (0x3e) plen 12                 #147 [hci1] 17.114867
      LE Read Remote Used Features (0x04)
        Status: Success (0x00)
        Handle: 543 Address: DF:A9:FF:F6:B1:1A (OUI DF-A9-FF)
        Features: 0x2d 0x49 0x00 0xf7 0x67 0xd8 0x00 0x00
          LE Encryption
          Extended Reject Indication
          Peripheral-initiated Features Exchange
          LE Data Packet Length Extension
          LE 2M PHY
          LE Coded PHY
          Channel Selection Algorithm #2
          Periodic Advertising Sync Transfer - Sender
          Periodic Advertising Sync Transfer - Recipient
          Sleep Clock Accuracy Updates
          Connected Isochronous Stream - Central
          Connected Isochronous Stream - Peripheral
          Isochronous Broadcaster
          Synchronized Receiver
          Connected Isochronous Stream (Host Support)
          LE Power Control Request
          LE Power Control Request
          Connection Subrating
          Connection Subrating (Host Support)
          Unknown features (0x0000d80000000000)
> ACL Data RX: Handle 543 flags 0x02 dlen 11              #148 [hci1] 17.552116
      SMP: Pairing Request (0x01) len 6
        IO capability: DisplayYesNo (0x01)
        OOB data: Authentication data not present (0x00)
        Authentication requirement: No bonding, No MITM, SC, No Keypresses (0x08)
        Max encryption key size: 16
        Initiator key distribution: <none> (0x00)
        Responder key distribution: <none> (0x00)
< HCI Command: Host Number of Com.. (0x03|0x0035) plen 5  #149 [hci1] 17.552747
        Num handles: 1
        Handle: 543 Address: DF:A9:FF:F6:B1:1A (OUI DF-A9-FF)
        Count: 1
< ACL Data TX: Handle 543 flags 0x00 dlen 11              #150 [hci1] 17.552835
      SMP: Pairing Response (0x02) len 6
        IO capability: NoInputNoOutput (0x03)
        OOB data: Authentication data not present (0x00)
        Authentication requirement: No bonding, No MITM, SC, No Keypresses (0x08)
        Max encryption key size: 16
        Initiator key distribution: <none> (0x00)
        Responder key distribution: <none> (0x00)
> HCI Event: Number of Completed Packets (0x13) plen 5    #151 [hci1] 17.727131
        Num handles: 1
        Handle: 543 Address: DF:A9:FF:F6:B1:1A (OUI DF-A9-FF)
        Count: 1
        #150: len 11 (0 Kb/s)
        Latency: 174 msec (174-174 msec ~174 msec)
> ACL Data RX: Handle 543 flags 0x02 dlen 27              #152 [hci1] 17.727475
> ACL Data RX: Handle 543 flags 0x01 dlen 27              #153 [hci1] 17.728007
> ACL Data RX: Handle 543 flags 0x01 dlen 15              #154 [hci1] 17.728471
      SMP: Pairing Public Key (0x0c) len 64
        X: e30030c4e9bfb310f8945c72d0f9fba7a9a2fcaf918d14156e4753f7df63652b
        Y: 19e645b079db14bd4a2c4cf22b19768eb79797f7b8d00cd97758de0a8e7a39b7
< HCI Command: Host Number of Com.. (0x03|0x0035) plen 5  #155 [hci1] 17.732925
        Num handles: 1
        Handle: 543 Address: DF:A9:FF:F6:B1:1A (OUI DF-A9-FF)
        Count: 1
< HCI Command: Host Number of Com.. (0x03|0x0035) plen 5  #156 [hci1] 17.733037
        Num handles: 1
        Handle: 543 Address: DF:A9:FF:F6:B1:1A (OUI DF-A9-FF)
        Count: 1
< HCI Command: Host Number of Com.. (0x03|0x0035) plen 5  #157 [hci1] 17.733097
        Num handles: 1
        Handle: 543 Address: DF:A9:FF:F6:B1:1A (OUI DF-A9-FF)
        Count: 1
< ACL Data TX: Handle 543 flags 0x00 dlen 27              #158 [hci1] 17.733155
< ACL Data TX: Handle 543 flags 0x01 dlen 27              #159 [hci1] 17.733168
< ACL Data TX: Handle 543 flags 0x01 dlen 15              #160 [hci1] 17.733186
      SMP: Pairing Public Key (0x0c) len 64
        X: 98308440221e2d910f0e54b71e7ec652857aa9b5a0dc65028824cc19db1226e9
        Y: 67a4816bcb62efb21701e31fdb27561a6217575fb007a8bbdabe7e28b6f68482
> HCI Event: Number of Completed Packets (0x13) plen 5    #161 [hci1] 17.815027
        Num handles: 1
        Handle: 543 Address: DF:A9:FF:F6:B1:1A (OUI DF-A9-FF)
        Count: 1
        #158: len 27 (2 Kb/s)
        Latency: 81 msec (81-174 msec ~128 msec)
> HCI Event: Number of Completed Packets (0x13) plen 5    #162 [hci1] 17.815794
        Num handles: 1
        Handle: 543 Address: DF:A9:FF:F6:B1:1A (OUI DF-A9-FF)
        Count: 1
        #159: len 27 (2 Kb/s)
        Latency: 82 msec (81-174 msec ~105 msec)
< ACL Data TX: Handle 543 flags 0x00 dlen 21              #163 [hci1] 17.832685
      SMP: Pairing Confirm (0x03) len 16
        Confim value: e7ac8bb3883966d2a36b40f08384efc5
> HCI Event: Number of Completed Packets (0x13) plen 5    #164 [hci1] 17.901910
        Num handles: 1
        Handle: 543 Address: DF:A9:FF:F6:B1:1A (OUI DF-A9-FF)
        Count: 1
        #160: len 15 (0 Kb/s)
        Latency: 168 msec (81-174 msec ~137 msec)
> HCI Event: Number of Completed Packets (0x13) plen 5    #165 [hci1] 17.989588
        Num handles: 1
        Handle: 543 Address: DF:A9:FF:F6:B1:1A (OUI DF-A9-FF)
        Count: 1
        #163: len 21 (1 Kb/s)
        Latency: 156 msec (81-174 msec ~146 msec)
> ACL Data RX: Handle 543 flags 0x02 dlen 21              #166 [hci1] 17.989984
      SMP: Pairing Random (0x04) len 16
        Random value: ba4895f0a55dd710d7f8f1020f3f27ec
< HCI Command: Host Number of Com.. (0x03|0x0035) plen 5  #167 [hci1] 17.992884
        Num handles: 1
        Handle: 543 Address: DF:A9:FF:F6:B1:1A (OUI DF-A9-FF)
        Count: 1
< ACL Data TX: Handle 543 flags 0x00 dlen 21              #168 [hci1] 17.992914
      SMP: Pairing Random (0x04) len 16
        Random value: da64d21ec8845e8286bc235a02440d0c
> HCI Event: Number of Completed Packets (0x13) plen 5    #169 [hci1] 18.164611
        Num handles: 1
        Handle: 543 Address: DF:A9:FF:F6:B1:1A (OUI DF-A9-FF)
        Count: 1
        #168: len 21 (0 Kb/s)
        Latency: 171 msec (81-174 msec ~159 msec)
> ACL Data RX: Handle 543 flags 0x02 dlen 21              #170 [hci1] 18.164941
      SMP: Pairing DHKey Check (0x0d) len 16
        E: 59e117bf2b6b2801fafd445707dbab85
< HCI Command: Host Number of Com.. (0x03|0x0035) plen 5  #171 [hci1] 18.172932
        Num handles: 1
        Handle: 543 Address: DF:A9:FF:F6:B1:1A (OUI DF-A9-FF)
        Count: 1
< ACL Data TX: Handle 543 flags 0x00 dlen 21              #172 [hci1] 18.172978
      SMP: Pairing DHKey Check (0x0d) len 16
        E: 5657aee9b8d9e61624f5fb14245b127e
> HCI Event: Number of Completed Packets (0x13) plen 5    #173 [hci1] 18.339375
        Num handles: 1
        Handle: 543 Address: DF:A9:FF:F6:B1:1A (OUI DF-A9-FF)
        Count: 1
        #172: len 21 (1 Kb/s)
        Latency: 166 msec (81-174 msec ~162 msec)
> HCI Event: LE Meta Event (0x3e) plen 13                 #174 [hci1] 18.427480
      LE Long Term Key Request (0x05)
        Handle: 543 Address: DF:A9:FF:F6:B1:1A (OUI DF-A9-FF)
        Random number: 0x0000000000000000
        Encrypted diversifier: 0x0000
< HCI Command: LE Long Term Key... (0x08|0x001a) plen 18  #175 [hci1] 18.432697
        Handle: 543 Address: DF:A9:FF:F6:B1:1A (OUI DF-A9-FF)
        Long term key: 9de3940a19721f296a7c166330889123
> HCI Event: Command Complete (0x0e) plen 6               #176 [hci1] 18.433394
      LE Long Term Key Request Reply (0x08|0x001a) ncmd 1
        Status: Success (0x00)
        Handle: 543 Address: DF:A9:FF:F6:B1:1A (OUI DF-A9-FF)
> HCI Event: Encryption Change (0x08) plen 4              #177 [hci1] 18.864699
        Status: Success (0x00)
        Handle: 543 Address: DF:A9:FF:F6:B1:1A (OUI DF-A9-FF)
        Encryption: Enabled with AES-CCM (0x01)
< ACL Data TX: Handle 543 flags 0x00 dlen 16              #178 [hci1] 21.862606
      LE L2CAP: Connection Parameter Update Request (0x12) ident 3 len 8
        Min interval: 24
        Max interval: 40
        Peripheral latency: 0
        Timeout multiplier: 42
> HCI Event: Number of Completed Packets (0x13) plen 5    #179 [hci1] 22.014335
        Num handles: 1
        Handle: 543 Address: DF:A9:FF:F6:B1:1A (OUI DF-A9-FF)
        Count: 1
        #178: len 16 (0 Kb/s)
        Latency: 151 msec (81-174 msec ~157 msec)
> HCI Event: Disconnect Complete (0x05) plen 4            #180 [hci1] 22.014581
        Status: Success (0x00)
        Handle: 543 Address: DF:A9:FF:F6:B1:1A (OUI DF-A9-FF)
        Reason: Remote User Terminated Connection (0x13)
< HCI Command: Reset (0x03|0x0003) plen 0                 #181 [hci1] 29.272844
> HCI Event: Command Complete (0x0e) plen 4               #182 [hci1] 29.273417
      Reset (0x03|0x0003) ncmd 1
        Status: Success (0x00)
@ USER Close: main                                    {0x0001} [hci1] 29.292729
= Close Index: 00:00:00:00:00:00                               [hci1] 29.292742
