Bluetooth monitor ver 5.72
= Note: Linux version 6.14.0-36-generic (x86_64)                       0.534970
= Note: Bluetooth subsystem version 2.22                               0.534972
= New Index: 00:00:00:00:00:00 (Primary,UART,hci1)              [hci1] 0.534973
= New Index: 48:5F:99:8E:E0:64 (Primary,USB,hci0)               [hci0] 0.534974
= Open Index: 00:00:00:00:00:00                                 [hci1] 0.648732
= Index Info: 00:00:00:00:00:00 (Nordic Semiconductor ASA)      [hci1] 0.648749
@ USER Open: main (privileged) version 2.22            {0x0001} [hci1] 0.648759
< HCI Command: Reset (0x03|0x0003) plen 0                    #1 [hci1] 0.650112
> HCI Event: Command Complete (0x0e) plen 4                  #2 [hci1] 0.650637
      Reset (0x03|0x0003) ncmd 1
        Status: Success (0x00)
< HCI Command: Read Local Supported... (0x04|0x0003) plen 0  #3 [hci1] 0.668321
> HCI Event: Command Complete (0x0e) plen 12                 #4 [hci1] 0.668828
      Read Local Supported Features (0x04|0x0003) ncmd 1
        Status: Success (0x00)
        Features: 0x00 0x00 0x00 0x00 0x60 0x00 0x00 0x00
          BR/EDR Not Supported
          LE Supported (Controller)
< HCI Command: Read Local Version In.. (0x04|0x0001) plen 0  #5 [hci1] 0.688099
> HCI Event: Command Complete (0x0e) plen 12                 #6 [hci1] 0.688565
      Read Local Version Information (0x04|0x0001) ncmd 1
        Status: Success (0x00)
        HCI version: Reserved (0x0f) - Revision 12393 (0x3069)
        LMP version: Reserved (0x0f) - Subversion 12393 (0x3069)
        Manufacturer: Nordic Semiconductor ASA (89)
< HCI Command: Read Local Supported... (0x04|0x0002) plen 0  #7 [hci1] 0.708076
> HCI Event: Command Complete (0x0e) plen 68                 #8 [hci1] 0.709170
      Read Local Supported Commands (0x04|0x0002) ncmd 1
        Status: Success (0x00)
        Commands: 119 entries
          Disconnect (Octet 0 - Bit 5)
          Read Remote Version Information (Octet 2 - Bit 7)
          Set Event Mask (Octet 5 - Bit 6)
          Reset (Octet 5 - Bit 7)
          Read Connection Accept Timeout (Octet 7 - Bit 2)
          Write Connection Accept Timeout (Octet 7 - Bit 3)
          Read Transmit Power Level (Octet 10 - Bit 2)
          Set Controller To Host Flow Control (Octet 10 - Bit 5)
          Host Buffer Size (Octet 10 - Bit 6)
          Host Number of Completed Packets (Octet 10 - Bit 7)
          Read Local Version Information (Octet 14 - Bit 3)
          Read Local Supported Features (Octet 14 - Bit 5)
          Read BD ADDR (Octet 15 - Bit 1)
          Read RSSI (Octet 15 - Bit 5)
          Set Event Mask Page 2 (Octet 22 - Bit 2)
          LE Set Event Mask (Octet 25 - Bit 0)
          LE Read Buffer Size (Octet 25 - Bit 1)
          LE Read Local Supported Features (Octet 25 - Bit 2)
          LE Set Random Address (Octet 25 - Bit 4)
          LE Set Advertising Parameters (Octet 25 - Bit 5)
          LE Read Advertising Channel TX Power (Octet 25 - Bit 6)
          LE Set Advertising Data (Octet 25 - Bit 7)
          LE Set Scan Response Data (Octet 26 - Bit 0)
          LE Set Advertise Enable (Octet 26 - Bit 1)
          LE Set Scan Parameters (Octet 26 - Bit 2)
          LE Set Scan Enable (Octet 26 - Bit 3)
          LE Create Connection (Octet 26 - Bit 4)
          LE Create Connection Cancel (Octet 26 - Bit 5)
          LE Read Accept List Size (Octet 26 - Bit 6)
          LE Clear Accept List (Octet 26 - Bit 7)
          LE Add Device To Accept List (Octet 27 - Bit 0)
          LE Remove Device From Accept List (Octet 27 - Bit 1)
          LE Connection Update (Octet 27 - Bit 2)
          LE Set Host Channel Classification (Octet 27 - Bit 3)
          LE Read Channel Map (Octet 27 - Bit 4)
          LE Read Remote Used Features (Octet 27 - Bit 5)
          LE Encrypt (Octet 27 - Bit 6)
          LE Rand (Octet 27 - Bit 7)
          LE Start Encryption (Octet 28 - Bit 0)
          LE Long Term Key Request Reply (Octet 28 - Bit 1)
          LE Long Term Key Request Neg Reply (Octet 28 - Bit 2)
          LE Read Supported States (Octet 28 - Bit 3)
          LE Receiver Test (Octet 28 - Bit 4)
          LE Transmitter Test (Octet 28 - Bit 5)
          LE Test End (Octet 28 - Bit 6)
          Read Authenticated Payload Timeout (Octet 32 - Bit 4)
          Write Authenticated Payload Timeout (Octet 32 - Bit 5)
          LE Set Data Length (Octet 33 - Bit 6)
          LE Read Suggested Default Data Length (Octet 33 - Bit 7)
          LE Write Suggested Default Data Length (Octet 34 - Bit 0)
          LE Add Device To Resolving List (Octet 34 - Bit 3)
          LE Remove Device From Resolving List (Octet 34 - Bit 4)
          LE Clear Resolving List (Octet 34 - Bit 5)
          LE Read Resolving List Size (Octet 34 - Bit 6)
          LE Set Address Resolution Enable (Octet 35 - Bit 1)
          LE Set Resolvable Private Address Timeout (Octet 35 - Bit 2)
          LE Read Maximum Data Length (Octet 35 - Bit 3)
          LE Read PHY (Octet 35 - Bit 4)
          LE Set Default PHY (Octet 35 - Bit 5)
          LE Set PHY (Octet 35 - Bit 6)
          LE Enhanced Receiver Test (Octet 35 - Bit 7)
          LE Enhanced Transmitter Test (Octet 36 - Bit 0)
          LE Set Advertising Set Random Address (Octet 36 - Bit 1)
          LE Set Extended Advertising Parameters (Octet 36 - Bit 2)
          LE Set Extended Advertising Data (Octet 36 - Bit 3)
          LE Set Extended Scan Response Data (Octet 36 - Bit 4)
          LE Set Extended Advertising Enable (Octet 36 - Bit 5)
          LE Read Maximum Advertising Data Length (Octet 36 - Bit 6)
          LE Read Number of Supported Advertising Sets (Octet 36 - Bit 7)
          LE Remove Advertising Set (Octet 37 - Bit 0)
          LE Clear Advertising Sets (Octet 37 - Bit 1)
          LE Set Periodic Advertising Parameters (Octet 37 - Bit 2)
          LE Set Periodic Advertising Data (Octet 37 - Bit 3)
          LE Set Periodic Advertising Enable (Octet 37 - Bit 4)
          LE Set Extended Scan Parameters (Octet 37 - Bit 5)
          LE Set Extended Scan Enable (Octet 37 - Bit 6)
          LE Extended Create Connection (Octet 37 - Bit 7)
          LE Periodic Advertising Create Sync (Octet 38 - Bit 0)
          LE Periodic Advertising Create Sync Cancel (Octet 38 - Bit 1)
          LE Periodic Advertising Terminate Sync (Octet 38 - Bit 2)
          LE Add Device To Periodic Advertiser List (Octet 38 - Bit 3)
          LE Remove Device From Periodic Advertiser List (Octet 38 - Bit 4)
          LE Clear Periodic Advertiser List (Octet 38 - Bit 5)
          LE Read Periodic Advertiser List Size (Octet 38 - Bit 6)
          LE Read Transmit Power (Octet 38 - Bit 7)
          LE Read RF Path Compensation (Octet 39 - Bit 0)
          LE Write RF Path Compensation (Octet 39 - Bit 1)
          LE Set Privacy Mode (Octet 39 - Bit 2)
          LE Periodic Advertising Receive Enable (Octet 40 - Bit 5)
          LE Periodic Advertising Sync Transfer (Octet 40 - Bit 6)
          LE Periodic Advertising Set Info Transfer (Octet 40 - Bit 7)
          LE Periodic Advertising Sync Transfer Parameters (Octet 41 - Bit 0)
          LE Set Default Periodic Advertisng Sync Transfer Parameters (Octet 41 - Bit 1)
          LE Read Buffer v2 (Octet 41 - Bit 5)
          LE Read ISO TX Sync (Octet 41 - Bit 6)
          LE Set Connected Isochronous Group Parameters (Octet 41 - Bit 7)
          LE Set Connected Isochronous Group Parameters Test (Octet 42 - Bit 0)
          LE Create Connected Isochronous Stream (Octet 42 - Bit 1)
          LE Remove Connected Isochronous Group (Octet 42 - Bit 2)
          LE Accept Connected Isochronous Stream Request (Octet 42 - Bit 3)
          LE Reject Connected Isochronous Stream Request (Octet 42 - Bit 4)
          LE Create Broadcast Isochronous Group (Octet 42 - Bit 5)
          LE Create Broadcast Isochronous Group Test (Octet 42 - Bit 6)
          LE Terminate Broadcast Isochronous Group (Octet 42 - Bit 7)
          LE Broadcast Isochronous Group Create Sync (Octet 43 - Bit 0)
          LE Broadcast Isochronous Group Terminate Sync (Octet 43 - Bit 1)
          LE Request Peer SCA (Octet 43 - Bit 2)
          LE Setup Isochronous Data Path (Octet 43 - Bit 3)
          LE Remove Isochronous Data Path (Octet 43 - Bit 4)
          LE Isochronous Transmit Test (Octet 43 - Bit 5)
          LE Isochronous Receive Test (Octet 43 - Bit 6)
          LE Isochronous Read Test Counters (Octet 43 - Bit 7)
          LE Isochronous Read Test Counters (Octet 44 - Bit 0)
          LE Set Host Feature (Octet 44 - Bit 1)
          Octet 44 - Bit 2 
          Octet 45 - Bit 6 
          Octet 46 - Bit 0 
          Octet 46 - Bit 1 
          Octet 46 - Bit 2 
< HCI Command: Host Buffer Size (0x03|0x0033) plen 7         #9 [hci1] 0.728104
        ACL MTU: 255  ACL max packet: 16
        SCO MTU: 0    SCO max packet: 0
> HCI Event: Command Complete (0x0e) plen 4                 #10 [hci1] 0.728745
      Host Buffer Size (0x03|0x0033) ncmd 1
        Status: Success (0x00)
< HCI Command: Set Controller To Ho.. (0x03|0x0031) plen 1  #11 [hci1] 0.748089
        Flow control: ACL Data Packets (0x01)
> HCI Event: Command Complete (0x0e) plen 4                 #12 [hci1] 0.748549
      Set Controller To Host Flow Control (0x03|0x0031) ncmd 1
        Status: Success (0x00)
< HCI Command: LE Read Local Suppor.. (0x08|0x0003) plen 0  #13 [hci1] 0.768099
> HCI Event: Command Complete (0x0e) plen 12                #14 [hci1] 0.768598
      LE Read Local Supported Features (0x08|0x0003) ncmd 1
        Status: Success (0x00)
        Features: 0xfd 0x79 0x00 0xf7 0x30 0x01 0x00 0x00
          LE Encryption
          Extended Reject Indication
          Peripheral-initiated Features Exchange
          LE Ping
          LE Data Packet Length Extension
          LL Privacy
          Extended Scanner Filter Policies
          LE 2M PHY
          LE Coded PHY
          LE Extended Advertising
          LE Periodic Advertising
          Channel Selection Algorithm #2
          Periodic Advertising Sync Transfer - Sender
          Periodic Advertising Sync Transfer - Recipient
          Sleep Clock Accuracy Updates
          Connected Isochronous Stream - Central
          Connected Isochronous Stream - Peripheral
          Isochronous Broadcaster
          Synchronized Receiver
          Periodic Advertising ADI support
          Connection Subrating
          Unknown features (0x0000010000000000)
< HCI Command: LE Set Host Feature (0x08|0x0074) plen 2     #15 [hci1] 0.788115
        Bit Number: 32
          Connected Isochronous Stream (Host Support)
        Bit Value: 1
> HCI Event: Command Complete (0x0e) plen 4                 #16 [hci1] 0.788523
      LE Set Host Feature (0x08|0x0074) ncmd 1
        Status: Success (0x00)
< HCI Command: LE Read Buffer v2 (0x08|0x0060) plen 0       #17 [hci1] 0.808100
> HCI Event: Command Complete (0x0e) plen 10                #18 [hci1] 0.808642
      LE Read Buffer v2 (0x08|0x0060) ncmd 1
        Status: Success (0x00)
        ACL MTU: 27
        ACL max packet: 3
        ISO MTU: 318
        ISO max packet: 3
< HCI Command: LE Read Maximum Adve.. (0x08|0x003a) plen 0  #19 [hci1] 0.828095
> HCI Event: Command Complete (0x0e) plen 6                 #20 [hci1] 0.828526
      LE Read Maximum Advertising Data Length (0x08|0x003a) ncmd 1
        Status: Success (0x00)
        Max length: 1650
< HCI Command: LE Read Supported St.. (0x08|0x001c) plen 0  #21 [hci1] 0.848099
> HCI Event: Command Complete (0x0e) plen 12                #22 [hci1] 0.848612
      LE Read Supported States (0x08|0x001c) ncmd 1
        Status: Success (0x00)
        States: 0x000003ff3e0306ff
          Non-connectable Advertising State
          Scannable Advertising State
          Connectable Advertising State
          High Duty Cycle Directed Advertising State
          Passive Scanning State
          Active Scanning State
          Initiating State
            and Connection State (Central Role)
          Connection State (Peripheral Role)
          Scannable Advertising State
            and Passive Scanning State
          Connectable Advertising State
            and Passive Scanning State
          Non-connectable Advertising State
            and Initiating State
          Scannable Advertising State
            and Initiating State
          Active Scanning State
            and Connection State (Central Role)
          Passive Scanning State
            and Connection State (Peripheral Role)
          Active Scanning State
            and Connection State (Peripheral Role)
          Initiating State
            and Connection State (Central Role)
            and Central Role & Central Role
          Low Duty Cycle Directed Advertising State
          Connectable Advertising State
            and Initiating State
            and Central Role & Peripheral Role
          High Duty Cycle Directed Advertising State
            and Initiating State
            and Central Role & Peripheral Role
          Low Duty Cycle Directed Advertising State
            and Initiating State
            and Central Role & Peripheral Role
          Connectable Advertising State
            and Connection State (Central Role)
            and Central Role & Peripheral Role
          High Duty Cycle Directed Advertising State
            and Connection State (Central Role)
            and Central Role & Peripheral Role
          Low Duty Cycle Directed Advertising State
            and Connection State (Central Role)
            and Central Role & Peripheral Role
          Connectable Advertising State
            and Connection State (Peripheral Role)
            and Central Role & Peripheral Role
          High Duty Cycle Directed Advertising State
            and Connection State (Peripheral Role)
            and Peripheral Role & Peripheral Role
          Low Duty Cycle Directed Advertising State
            and Connection State (Peripheral Role)
            and Peripheral Role & Peripheral Role
          Initiating State
            and Connection State (Peripheral Role)
            and Central Role & Peripheral Role
< HCI Command: LE Read Maximum Data.. (0x08|0x002f) plen 0  #23 [hci1] 0.868094
> HCI Event: Command Complete (0x0e) plen 12                #24 [hci1] 0.868573
      LE Read Maximum Data Length (0x08|0x002f) ncmd 1
        Status: Success (0x00)
        Max TX octets: 251
        Max TX time: 2704
        Max RX octets: 251
        Max RX time: 2704
< HCI Command: LE Write Suggested D.. (0x08|0x0024) plen 4  #25 [hci1] 0.888098
        TX octets: 251
        TX time: 2704
> HCI Event: Command Complete (0x0e) plen 4                 #26 [hci1] 0.888524
      LE Write Suggested Default Data Length (0x08|0x0024) ncmd 1
        Status: Success (0x00)
< HCI Command: LE Read Resolving Li.. (0x08|0x002a) plen 0  #27 [hci1] 0.908077
> HCI Event: Command Complete (0x0e) plen 5                 #28 [hci1] 0.908607
      LE Read Resolving List Size (0x08|0x002a) ncmd 1
        Status: Success (0x00)
        Size: 8
< HCI Command: LE Set Event Mask (0x08|0x0001) plen 8       #29 [hci1] 0.928098
        Mask: 0x000002023f87fa5e
          LE Advertising Report
          LE Connection Update Complete
          LE Read Remote Used Features Complete
          LE Long Term Key Request
          LE Data Length Change
          LE Enhanced Connection Complete
          LE PHY Update Complete
          LE Extended Advertising Report
          LE Periodic Advertising Sync Established
          LE Periodic Advertising Report
          LE Periodic Advertising Sync Lost
          LE Extended Scan Timeout
          LE Extended Advertising Set Terminated
          LE Scan Request Received
          LE Periodic Advertising Sync Transfer Rvc
          LE CIS Established
          LE CIS Request
          LE Create BIG Complete
          LE Terminate BIG Complete
          LE BIG Sync Estabilished Complete
          LE BIG Sync Lost
          LE BIG Info Advertising Report
          Unknown mask (0x0000020000000000)
> HCI Event: Command Complete (0x0e) plen 4                 #30 [hci1] 0.928654
      LE Set Event Mask (0x08|0x0001) ncmd 1
        Status: Success (0x00)
< HCI Command: Set Event Mask (0x03|0x0001) plen 8          #31 [hci1] 0.948099
        Mask: 0x2000800002008890
          Disconnection Complete
          Encryption Change
          Read Remote Version Information Complete
          Hardware Error
          Data Buffer Overflow
          Encryption Key Refresh Complete
          LE Meta
> HCI Event: Command Complete (0x0e) plen 4                 #32 [hci1] 0.948548
      Set Event Mask (0x03|0x0001) ncmd 1
        Status: Success (0x00)
< HCI Command: Read BD ADDR (0x04|0x0009) plen 0            #33 [hci1] 0.968099
> HCI Event: Command Complete (0x0e) plen 10                #34 [hci1] 0.968581
      Read BD ADDR (0x04|0x0009) ncmd 1
        Status: Success (0x00)
        Address: 00:00:00:00:00:00 (OUI 00-00-00)
< HCI Command: LE Set Random Address (0x08|0x0005) plen 6   #35 [hci1] 0.988088
        Address: D5:B6:CC:31:DB:3B (Static)
> HCI Event: Command Complete (0x0e) plen 4                 #36 [hci1] 0.988613
      LE Set Random Address (0x08|0x0005) ncmd 1
        Status: Success (0x00)
< HCI Command: LE Set Extended Adv.. (0x08|0x0036) plen 25  #37 [hci1] 3.538392
        Handle: 0x00
        Properties: 0x0013
          Connectable
          Scannable
          Use legacy advertising PDUs: ADV_IND
        Min advertising interval: 100.000 msec (0x00a0)
        Max advertising interval: 150.000 msec (0x00f0)
        Channel map: 37, 38, 39 (0x07)
        Own address type: Random (0x01)
        Peer address type: Public (0x00)
        Peer address: 00:00:00:00:00:00 (OUI 00-00-00)
        Filter policy: Allow Scan Request from Any, Allow Connect Request from Any (0x00)
        TX power: Host has no preference (0x7f)
        Primary PHY: LE 1M (0x01)
        Secondary max skip: 0x00
        Secondary PHY: LE 1M (0x01)
        SID: 0x00
        Scan request notifications: Disabled (0x00)
> HCI Event: Command Complete (0x0e) plen 5                 #38 [hci1] 3.539226
      LE Set Extended Advertising Parameters (0x08|0x0036) ncmd 1
        Status: Success (0x00)
        TX power (selected): 0 dbm (0x00)
< HCI Command: LE Set Advertising S.. (0x08|0x0035) plen 7  #39 [hci1] 3.548144
        Advertising handle: 0x00
        Advertising random address: D5:B6:CC:31:DB:3B (Static)
> HCI Event: Command Complete (0x0e) plen 4                 #40 [hci1] 3.548719
      LE Set Advertising Set Random Address (0x08|0x0035) ncmd 1
        Status: Success (0x00)
< HCI Command: LE Set Extended Adv.. (0x08|0x0037) plen 22  #41 [hci1] 3.568129
        Handle: 0x00
        Operation: Complete extended advertising data (0x03)
        Fragment preference: Minimize fragmentation (0x01)
        Data length: 0x12
        Flags: 0x06
          LE General Discoverable Mode
          BR/EDR Not Supported
        Name (complete): Tester_F6B11A
> HCI Event: Command Complete (0x0e) plen 4                 #42 [hci1] 3.568994
      LE Set Extended Advertising Data (0x08|0x0037) ncmd 1
        Status: Success (0x00)
< HCI Command: LE Set Extended Scan.. (0x08|0x0038) plen 4  #43 [hci1] 3.588124
        Handle: 0x00
        Operation: Complete scan response data (0x03)
        Fragment preference: Minimize fragmentation (0x01)
        Data length: 0x00
> HCI Event: Command Complete (0x0e) plen 4                 #44 [hci1] 3.588557
      LE Set Extended Scan Response Data (0x08|0x0038) ncmd 1
        Status: Success (0x00)
< HCI Command: LE Set Extended Adve.. (0x08|0x0039) plen 6  #45 [hci1] 3.608136
        Extended advertising: Enabled (0x01)
        Number of sets: 1 (0x01)
        Entry 0
          Handle: 0x00
          Duration: 0 ms (0x00)
          Max ext adv events: 0
> HCI Event: Command Complete (0x0e) plen 4                 #46 [hci1] 3.608836
      LE Set Extended Advertising Enable (0x08|0x0039) ncmd 1
        Status: Success (0x00)
> HCI Event: LE Meta Event (0x3e) plen 31                   #47 [hci1] 3.714518
      LE Enhanced Connection Complete (0x0a)
        Status: Success (0x00)
        Handle: 309
        Role: Peripheral (0x01)
        Peer address type: Public (0x00)
        Peer address: DF:A9:FF:F6:B1:1A (OUI DF-A9-FF)
        Local resolvable private address: 00:00:00:00:00:00 (Non-Resolvable)
        Peer resolvable private address: 00:00:00:00:00:00 (Non-Resolvable)
        Connection interval: 87.50 msec (0x0046)
        Connection latency: 0 (0x0000)
        Supervision timeout: 25120 msec (0x09d0)
        Central clock accuracy: 0x01
> HCI Event: LE Meta Event (0x3e) plen 6                    #48 [hci1] 3.714525
      LE Advertising Set Terminated (0x12)
        Status: Success (0x00)
        Handle: 0
        Connection handle: 309
        Number of completed extended advertising events: 0
< HCI Command: LE Read Remote Used... (0x08|0x0016) plen 2  #49 [hci1] 3.729181
        Handle: 309 Address: DF:A9:FF:F6:B1:1A (OUI DF-A9-FF)
< ACL Data TX: Handle 309 flags 0x00 dlen 7                 #50 [hci1] 3.729207
      ATT: Exchange MTU Request (0x02) len 2
        Client RX MTU: 251
> HCI Event: Command Status (0x0f) plen 4                   #51 [hci1] 3.729762
      LE Read Remote Used Features (0x08|0x0016) ncmd 1
        Status: Success (0x00)
> HCI Event: Number of Completed Packets (0x13) plen 5      #52 [hci1] 3.890363
        Num handles: 1
        Handle: 309 Address: DF:A9:FF:F6:B1:1A (OUI DF-A9-FF)
        Count: 1
        #50: len 7 (0 Kb/s)
        Latency: 161 msec (161-161 msec ~161 msec)
> HCI Event: LE Meta Event (0x3e) plen 12                   #53 [hci1] 3.978366
      LE Read Remote Used Features (0x04)
        Status: Success (0x00)
        Handle: 309 Address: DF:A9:FF:F6:B1:1A (OUI DF-A9-FF)
        Features: 0x2d 0x49 0x00 0xf7 0x67 0xd9 0x00 0x80
          LE Encryption
          Extended Reject Indication
          Peripheral-initiated Features Exchange
          LE Data Packet Length Extension
          LE 2M PHY
          LE Coded PHY
          Channel Selection Algorithm #2
          Periodic Advertising Sync Transfer - Sender
          Periodic Advertising Sync Transfer - Recipient
          Sleep Clock Accuracy Updates
          Connected Isochronous Stream - Central
          Connected Isochronous Stream - Peripheral
          Isochronous Broadcaster
          Synchronized Receiver
          Connected Isochronous Stream (Host Support)
          LE Power Control Request
          LE Power Control Request
          Connection Subrating
          Connection Subrating (Host Support)
          Unknown features (0x8000d90000000000)
> ACL Data RX: Handle 309 flags 0x02 dlen 11                #54 [hci1] 6.428032
      SMP: Pairing Request (0x01) len 6
        IO capability: KeyboardDisplay (0x04)
        OOB data: Authentication data not present (0x00)
        Authentication requirement: Bonding, No MITM, SC, No Keypresses (0x09)
        Max encryption key size: 16
        Initiator key distribution: EncKey IdKey (0x03)
        Responder key distribution: EncKey IdKey Sign (0x07)
> ACL Data RX: Handle 309 flags 0x02 dlen 7                 #55 [hci1] 6.428454
      ATT: Exchange MTU Response (0x03) len 2
        Server RX MTU: 23
< HCI Command: Host Number of Compl.. (0x03|0x0035) plen 5  #56 [hci1] 6.428630
        Num handles: 1
        Handle: 309 Address: DF:A9:FF:F6:B1:1A (OUI DF-A9-FF)
        Count: 1
< ACL Data TX: Handle 309 flags 0x00 dlen 11                #57 [hci1] 6.428707
      SMP: Pairing Response (0x02) len 6
        IO capability: NoInputNoOutput (0x03)
        OOB data: Authentication data not present (0x00)
        Authentication requirement: Bonding, No MITM, SC, No Keypresses (0x09)
        Max encryption key size: 16
        Initiator key distribution: IdKey (0x02)
        Responder key distribution: <none> (0x00)
< HCI Command: Host Number of Compl.. (0x03|0x0035) plen 5  #58 [hci1] 6.448605
        Num handles: 1
        Handle: 309 Address: DF:A9:FF:F6:B1:1A (OUI DF-A9-FF)
        Count: 1
> HCI Event: Number of Completed Packets (0x13) plen 5      #59 [hci1] 6.603180
        Num handles: 1
        Handle: 309 Address: DF:A9:FF:F6:B1:1A (OUI DF-A9-FF)
        Count: 1
        #57: len 11 (0 Kb/s)
        Latency: 174 msec (161-174 msec ~167 msec)
> ACL Data RX: Handle 309 flags 0x02 dlen 27                #60 [hci1] 6.603463
> ACL Data RX: Handle 309 flags 0x01 dlen 27                #61 [hci1] 6.604017
> ACL Data RX: Handle 309 flags 0x01 dlen 15                #62 [hci1] 6.604423
      SMP: Pairing Public Key (0x0c) len 64
        X: f7167f8d2f08c14168bbf3476823a1eaa7c8dc210f29cc375afe51cb2c5e8673
        Y: 8c17040c9195edc6dbf0a3aa3658ed51f9ebe20a8de3ecd75aeb38220868345a
< HCI Command: Host Number of Compl.. (0x03|0x0035) plen 5  #63 [hci1] 6.608762
        Num handles: 1
        Handle: 309 Address: DF:A9:FF:F6:B1:1A (OUI DF-A9-FF)
        Count: 1
< HCI Command: Host Number of Compl.. (0x03|0x0035) plen 5  #64 [hci1] 6.609587
        Num handles: 1
        Handle: 309 Address: DF:A9:FF:F6:B1:1A (OUI DF-A9-FF)
        Count: 1
< HCI Command: Host Number of Compl.. (0x03|0x0035) plen 5  #65 [hci1] 6.609909
        Num handles: 1
        Handle: 309 Address: DF:A9:FF:F6:B1:1A (OUI DF-A9-FF)
        Count: 1
< ACL Data TX: Handle 309 flags 0x00 dlen 27                #66 [hci1] 6.610050
< ACL Data TX: Handle 309 flags 0x01 dlen 27                #67 [hci1] 6.610063
< ACL Data TX: Handle 309 flags 0x01 dlen 15                #68 [hci1] 6.610067
      SMP: Pairing Public Key (0x0c) len 64
        X: 98308440221e2d910f0e54b71e7ec652857aa9b5a0dc65028824cc19db1226e9
        Y: 67a4816bcb62efb21701e31fdb27561a6217575fb007a8bbdabe7e28b6f68482
> HCI Event: Number of Completed Packets (0x13) plen 5      #69 [hci1] 6.691118
        Num handles: 1
        Handle: 309 Address: DF:A9:FF:F6:B1:1A (OUI DF-A9-FF)
        Count: 1
        #66: len 27 (2 Kb/s)
        Latency: 81 msec (81-174 msec ~124 msec)
> HCI Event: Number of Completed Packets (0x13) plen 5      #70 [hci1] 6.691641
        Num handles: 1
        Handle: 309 Address: DF:A9:FF:F6:B1:1A (OUI DF-A9-FF)
        Count: 1
        #67: len 27 (2 Kb/s)
        Latency: 81 msec (81-174 msec ~103 msec)
< ACL Data TX: Handle 309 flags 0x00 dlen 21                #71 [hci1] 6.708536
      SMP: Pairing Confirm (0x03) len 16
        Confim value: ad55967a3cb04631b75d3cb2c68ead23
> HCI Event: Number of Completed Packets (0x13) plen 5      #72 [hci1] 6.777885
        Num handles: 1
        Handle: 309 Address: DF:A9:FF:F6:B1:1A (OUI DF-A9-FF)
        Count: 1
        #68: len 15 (0 Kb/s)
        Latency: 167 msec (81-174 msec ~135 msec)
> HCI Event: Number of Completed Packets (0x13) plen 5      #73 [hci1] 6.865517
        Num handles: 1
        Handle: 309 Address: DF:A9:FF:F6:B1:1A (OUI DF-A9-FF)
        Count: 1
        #71: len 21 (1 Kb/s)
        Latency: 156 msec (81-174 msec ~146 msec)
> ACL Data RX: Handle 309 flags 0x02 dlen 21                #74 [hci1] 6.865968
      SMP: Pairing Random (0x04) len 16
        Random value: 238d05ad5d8662e50000000000000000
< HCI Command: Host Number of Compl.. (0x03|0x0035) plen 5  #75 [hci1] 6.868656
        Num handles: 1
        Handle: 309 Address: DF:A9:FF:F6:B1:1A (OUI DF-A9-FF)
        Count: 1
< ACL Data TX: Handle 309 flags 0x00 dlen 21                #76 [hci1] 6.868728
      SMP: Pairing Random (0x04) len 16
        Random value: 8e6108f966a694cbe26df70bb96773e6
> HCI Event: Number of Completed Packets (0x13) plen 5      #77 [hci1] 7.040356
        Num handles: 1
        Handle: 309 Address: DF:A9:FF:F6:B1:1A (OUI DF-A9-FF)
        Count: 1
        #76: len 21 (0 Kb/s)
        Latency: 171 msec (81-174 msec ~158 msec)
> ACL Data RX: Handle 309 flags 0x02 dlen 21                #78 [hci1] 7.215695
      SMP: Pairing DHKey Check (0x0d) len 16
        E: 5907f305bbf5952dd92638bd44917267
< HCI Command: Host Number of Compl.. (0x03|0x0035) plen 5  #79 [hci1] 7.228963
        Num handles: 1
        Handle: 309 Address: DF:A9:FF:F6:B1:1A (OUI DF-A9-FF)
        Count: 1
< ACL Data TX: Handle 309 flags 0x00 dlen 21                #80 [hci1] 7.229034
      SMP: Pairing DHKey Check (0x0d) len 16
        E: 2599acfa7e7058f8ea3186072383c9d7
> HCI Event: Number of Completed Packets (0x13) plen 5      #81 [hci1] 7.390436
        Num handles: 1
        Handle: 309 Address: DF:A9:FF:F6:B1:1A (OUI DF-A9-FF)
        Count: 1
        #80: len 21 (1 Kb/s)
        Latency: 161 msec (81-174 msec ~160 msec)
> HCI Event: LE Meta Event (0x3e) plen 13                   #82 [hci1] 7.478429
      LE Long Term Key Request (0x05)
        Handle: 309 Address: DF:A9:FF:F6:B1:1A (OUI DF-A9-FF)
        Random number: 0x0000000000000000
        Encrypted diversifier: 0x0000
< HCI Command: LE Long Term Key Re.. (0x08|0x001a) plen 18  #83 [hci1] 7.488514
        Handle: 309 Address: DF:A9:FF:F6:B1:1A (OUI DF-A9-FF)
        Long term key: b9b2415f8eac73b8f981775062c98683
> HCI Event: Command Complete (0x0e) plen 6                 #84 [hci1] 7.489270
      LE Long Term Key Request Reply (0x08|0x001a) ncmd 1
        Status: Success (0x00)
        Handle: 309 Address: DF:A9:FF:F6:B1:1A (OUI DF-A9-FF)
> HCI Event: Encryption Change (0x08) plen 4                #85 [hci1] 7.915699
        Status: Success (0x00)
        Handle: 309 Address: DF:A9:FF:F6:B1:1A (OUI DF-A9-FF)
        Encryption: Enabled with AES-CCM (0x01)
> ACL Data RX: Handle 309 flags 0x02 dlen 21                #86 [hci1] 8.003359
      SMP: Identity Information (0x08) len 16
        Identity resolving key: b96aad8ce915398a4b18f05a3974a90b
< HCI Command: Host Number of Compl.. (0x03|0x0035) plen 5  #87 [hci1] 8.038901
        Num handles: 1
        Handle: 309 Address: DF:A9:FF:F6:B1:1A (OUI DF-A9-FF)
        Count: 1
> ACL Data RX: Handle 309 flags 0x02 dlen 12                #88 [hci1] 8.178051
      SMP: Identity Address Information (0x09) len 7
        Address: DF:A9:FF:F6:B1:1A (OUI DF-A9-FF)
< HCI Command: LE Add Device To Re.. (0x08|0x0027) plen 39  #89 [hci1] 8.188700
        Address type: Public (0x00)
        Address: DF:A9:FF:F6:B1:1A (OUI DF-A9-FF)
        Peer identity resolving key: b96aad8ce915398a4b18f05a3974a90b
        Local identity resolving key: 00000000000000000000000000000000
> HCI Event: Command Complete (0x0e) plen 4                 #90 [hci1] 8.189711
      LE Add Device To Resolving List (0x08|0x0027) ncmd 1
        Status: Success (0x00)
< HCI Command: LE Set Privacy Mode (0x08|0x004e) plen 8     #91 [hci1] 8.208532
        Peer Identity address type: Public (0x00)
        Peer Identity address: DF:A9:FF:F6:B1:1A (OUI DF-A9-FF)
        Privacy Mode: Use Device Privacy (0x01)
> HCI Event: Command Complete (0x0e) plen 4                 #92 [hci1] 8.209084
      LE Set Privacy Mode (0x08|0x004e) ncmd 1
        Status: Success (0x00)
< HCI Command: LE Set Address Resol.. (0x08|0x002d) plen 1  #93 [hci1] 8.228469
        Address resolution: Enabled (0x01)
> HCI Event: Command Complete (0x0e) plen 4                 #94 [hci1] 8.228950
      LE Set Address Resolution Enable (0x08|0x002d) ncmd 1
        Status: Success (0x00)
< HCI Command: Host Number of Compl.. (0x03|0x0035) plen 5  #95 [hci1] 8.248387
        Num handles: 1
        Handle: 309 Address: DF:A9:FF:F6:B1:1A (OUI DF-A9-FF)
        Count: 1
> ACL Data RX: Handle 309 flags 0x02 dlen 13                #96 [hci1] 8.265654
      ATT: Find By Type Value Request (0x06) len 8
        Handle range: 0x0001-0xffff
        Attribute type: Primary Service (0x2800)
          UUID: Audio Input Control (0x1843)
< HCI Command: Host Number of Compl.. (0x03|0x0035) plen 5  #97 [hci1] 8.268753
        Num handles: 1
        Handle: 309 Address: DF:A9:FF:F6:B1:1A (OUI DF-A9-FF)
        Count: 1
< ACL Data TX: Handle 309 flags 0x00 dlen 9                 #98 [hci1] 8.268975
      ATT: Error Response (0x01) len 4
        Find By Type Value Request (0x06)
        Handle: 0x0001
        Error: Attribute Not Found (0x0a)
> HCI Event: Number of Completed Packets (0x13) plen 5      #99 [hci1] 8.440561
        Num handles: 1
        Handle: 309 Address: DF:A9:FF:F6:B1:1A (OUI DF-A9-FF)
        Count: 1
        #98: len 9 (0 Kb/s)
        Latency: 171 msec (81-174 msec ~165 msec)
> ACL Data RX: Handle 309 flags 0x02 dlen 11               #100 [hci1] 8.440790
      ATT: Read By Type Request (0x08) len 6
        Handle range: 0x0001-0xffff
        Attribute type: Include (0x2802)
< HCI Command: Host Number of Comp.. (0x03|0x0035) plen 5  #101 [hci1] 8.448940
        Num handles: 1
        Handle: 309 Address: DF:A9:FF:F6:B1:1A (OUI DF-A9-FF)
        Count: 1
< ACL Data TX: Handle 309 flags 0x00 dlen 22               #102 [hci1] 8.449139
      ATT: Read By Type Response (0x09) len 17
        Attribute data length: 8
        Attribute data list: 2 entries
        Handle: 0x005d
        Value: 24002f004518
        Handle: 0x005e
        Value: 30003b004518
> HCI Event: Number of Completed Packets (0x13) plen 5     #103 [hci1] 8.615529
        Num handles: 1
        Handle: 309 Address: DF:A9:FF:F6:B1:1A (OUI DF-A9-FF)
        Count: 1
        #102: len 22 (1 Kb/s)
        Latency: 166 msec (81-174 msec ~166 msec)
> ACL Data RX: Handle 309 flags 0x02 dlen 11               #104 [hci1] 8.615763
      ATT: Read By Type Request (0x08) len 6
        Handle range: 0x005f-0xffff
        Attribute type: Include (0x2802)
< HCI Command: Host Number of Comp.. (0x03|0x0035) plen 5  #105 [hci1] 8.628906
        Num handles: 1
        Handle: 309 Address: DF:A9:FF:F6:B1:1A (OUI DF-A9-FF)
        Count: 1
< ACL Data TX: Handle 309 flags 0x00 dlen 22               #106 [hci1] 8.629007
      ATT: Read By Type Response (0x09) len 17
        Attribute data length: 8
        Attribute data list: 2 entries
        Handle: 0x005f
        Value: 3c004b004318
        Handle: 0x0060
        Value: 4c005b004318
> HCI Event: Number of Completed Packets (0x13) plen 5     #107 [hci1] 8.790602
        Num handles: 1
        Handle: 309 Address: DF:A9:FF:F6:B1:1A (OUI DF-A9-FF)
        Count: 1
        #106: len 22 (1 Kb/s)
        Latency: 161 msec (81-174 msec ~163 msec)
> ACL Data RX: Handle 309 flags 0x02 dlen 11               #108 [hci1] 8.790702
      ATT: Read By Type Request (0x08) len 6
        Handle range: 0x0061-0xffff
        Attribute type: Include (0x2802)
< HCI Command: Host Number of Comp.. (0x03|0x0035) plen 5  #109 [hci1] 8.808786
        Num handles: 1
        Handle: 309 Address: DF:A9:FF:F6:B1:1A (OUI DF-A9-FF)
        Count: 1
< ACL Data TX: Handle 309 flags 0x00 dlen 9                #110 [hci1] 8.809037
      ATT: Error Response (0x01) len 4
        Read By Type Request (0x08)
        Handle: 0x0061
        Error: Attribute Not Found (0x0a)
> HCI Event: Number of Completed Packets (0x13) plen 5     #111 [hci1] 8.965461
        Num handles: 1
        Handle: 309 Address: DF:A9:FF:F6:B1:1A (OUI DF-A9-FF)
        Count: 1
        #110: len 9 (0 Kb/s)
        Latency: 156 msec (81-174 msec ~160 msec)
> ACL Data RX: Handle 309 flags 0x02 dlen 11               #112 [hci1] 8.965707
      ATT: Read By Type Request (0x08) len 6
        Handle range: 0x003c-0x004b
        Attribute type: Characteristic (0x2803)
< HCI Command: Host Number of Comp.. (0x03|0x0035) plen 5  #113 [hci1] 8.968748
        Num handles: 1
        Handle: 309 Address: DF:A9:FF:F6:B1:1A (OUI DF-A9-FF)
        Count: 1
< ACL Data TX: Handle 309 flags 0x00 dlen 20               #114 [hci1] 8.968798
      ATT: Read By Type Response (0x09) len 15
        Attribute data length: 7
        Attribute data list: 2 entries
        Handle: 0x003d
        Value: 123e00772b
            Properties: 0x12
              Read (0x02)
              Notify (0x10)
            Value Handle: 0x003e
            Value UUID: Audio Input State (0x2b77)
        Handle: 0x0040
        Value: 024100782b
            Properties: 0x02
              Read (0x02)
            Value Handle: 0x0041
            Value UUID: Gain Settings Attribute (0x2b78)
> HCI Event: Number of Completed Packets (0x13) plen 5     #115 [hci1] 9.140496
        Num handles: 1
        Handle: 309 Address: DF:A9:FF:F6:B1:1A (OUI DF-A9-FF)
        Count: 1
        #114: len 20 (0 Kb/s)
        Latency: 171 msec (81-174 msec ~165 msec)
> ACL Data RX: Handle 309 flags 0x02 dlen 11               #116 [hci1] 9.140707
      ATT: Read By Type Request (0x08) len 6
        Handle range: 0x0041-0x004b
        Attribute type: Characteristic (0x2803)
< HCI Command: Host Number of Comp.. (0x03|0x0035) plen 5  #117 [hci1] 9.148770
        Num handles: 1
        Handle: 309 Address: DF:A9:FF:F6:B1:1A (OUI DF-A9-FF)
        Count: 1
< ACL Data TX: Handle 309 flags 0x00 dlen 20               #118 [hci1] 9.148906
      ATT: Read By Type Response (0x09) len 15
        Attribute data length: 7
        Attribute data list: 2 entries
        Handle: 0x0042
        Value: 024300792b
            Properties: 0x02
              Read (0x02)
            Value Handle: 0x0043
            Value UUID: Audio Input Type (0x2b79)
        Handle: 0x0044
        Value: 1245007a2b
            Properties: 0x12
              Read (0x02)
              Notify (0x10)
            Value Handle: 0x0045
            Value UUID: Audio Input Status (0x2b7a)
> HCI Event: Number of Completed Packets (0x13) plen 5     #119 [hci1] 9.315479
        Num handles: 1
        Handle: 309 Address: DF:A9:FF:F6:B1:1A (OUI DF-A9-FF)
        Count: 1
        #118: len 20 (0 Kb/s)
        Latency: 166 msec (81-174 msec ~166 msec)
> ACL Data RX: Handle 309 flags 0x02 dlen 11               #120 [hci1] 9.315685
      ATT: Read By Type Request (0x08) len 6
        Handle range: 0x0045-0x004b
        Attribute type: Characteristic (0x2803)
< HCI Command: Host Number of Comp.. (0x03|0x0035) plen 5  #121 [hci1] 9.328906
        Num handles: 1
        Handle: 309 Address: DF:A9:FF:F6:B1:1A (OUI DF-A9-FF)
        Count: 1
< ACL Data TX: Handle 309 flags 0x00 dlen 20               #122 [hci1] 9.329001
      ATT: Read By Type Response (0x09) len 15
        Attribute data length: 7
        Attribute data list: 2 entries
        Handle: 0x0047
        Value: 0848007b2b
            Properties: 0x08
              Write (0x08)
            Value Handle: 0x0048
            Value UUID: Audio Input Control Point (0x2b7b)
        Handle: 0x0049
        Value: 164a007c2b
            Properties: 0x16
              Read (0x02)
              Write Without Response (0x04)
              Notify (0x10)
            Value Handle: 0x004a
            Value UUID: Audio Input Description (0x2b7c)
> HCI Event: Number of Completed Packets (0x13) plen 5     #123 [hci1] 9.490582
        Num handles: 1
        Handle: 309 Address: DF:A9:FF:F6:B1:1A (OUI DF-A9-FF)
        Count: 1
        #122: len 20 (0 Kb/s)
        Latency: 161 msec (81-174 msec ~163 msec)
> ACL Data RX: Handle 309 flags 0x02 dlen 11               #124 [hci1] 9.490746
      ATT: Read By Type Request (0x08) len 6
        Handle range: 0x004a-0x004b
        Attribute type: Characteristic (0x2803)
< HCI Command: Host Number of Comp.. (0x03|0x0035) plen 5  #125 [hci1] 9.508818
        Num handles: 1
        Handle: 309 Address: DF:A9:FF:F6:B1:1A (OUI DF-A9-FF)
        Count: 1
< ACL Data TX: Handle 309 flags 0x00 dlen 9                #126 [hci1] 9.509045
      ATT: Error Response (0x01) len 4
        Read By Type Request (0x08)
        Handle: 0x004a
        Error: Attribute Not Found (0x0a)
> HCI Event: Number of Completed Packets (0x13) plen 5     #127 [hci1] 9.665437
        Num handles: 1
        Handle: 309 Address: DF:A9:FF:F6:B1:1A (OUI DF-A9-FF)
        Count: 1
        #126: len 9 (0 Kb/s)
        Latency: 156 msec (81-174 msec ~160 msec)
> ACL Data RX: Handle 309 flags 0x02 dlen 9                #128 [hci1] 9.665661
      ATT: Find Information Request (0x04) len 4
        Handle range: 0x003f-0x003f
< HCI Command: Host Number of Comp.. (0x03|0x0035) plen 5  #129 [hci1] 9.668421
        Num handles: 1
        Handle: 309 Address: DF:A9:FF:F6:B1:1A (OUI DF-A9-FF)
        Count: 1
< ACL Data TX: Handle 309 flags 0x00 dlen 10               #130 [hci1] 9.668442
      ATT: Find Information Response (0x05) len 5
        Format: UUID-16 (0x01)
        Handle: 0x003f
        UUID: Client Characteristic Configuration (0x2902)
> HCI Event: Number of Completed Packets (0x13) plen 5     #131 [hci1] 9.840510
        Num handles: 1
        Handle: 309 Address: DF:A9:FF:F6:B1:1A (OUI DF-A9-FF)
        Count: 1
        #130: len 10 (0 Kb/s)
        Latency: 172 msec (81-174 msec ~166 msec)
> ACL Data RX: Handle 309 flags 0x02 dlen 9                #132 [hci1] 9.840667
      ATT: Find Information Request (0x04) len 4
        Handle range: 0x0046-0x0046
< HCI Command: Host Number of Comp.. (0x03|0x0035) plen 5  #133 [hci1] 9.848381
        Num handles: 1
        Handle: 309 Address: DF:A9:FF:F6:B1:1A (OUI DF-A9-FF)
        Count: 1
< ACL Data TX: Handle 309 flags 0x00 dlen 10               #134 [hci1] 9.848566
      ATT: Find Information Response (0x05) len 5
        Format: UUID-16 (0x01)
        Handle: 0x0046
        UUID: Client Characteristic Configuration (0x2902)
> HCI Event: Number of Completed Packets (0x13) plen 5    #135 [hci1] 10.015601
        Num handles: 1
        Handle: 309 Address: DF:A9:FF:F6:B1:1A (OUI DF-A9-FF)
        Count: 1
        #134: len 10 (0 Kb/s)
        Latency: 167 msec (81-174 msec ~166 msec)
> ACL Data RX: Handle 309 flags 0x02 dlen 9               #136 [hci1] 10.015724
      ATT: Find Information Request (0x04) len 4
        Handle range: 0x004b-0x004b
< HCI Command: Host Number of Com.. (0x03|0x0035) plen 5  #137 [hci1] 10.028798
        Num handles: 1
        Handle: 309 Address: DF:A9:FF:F6:B1:1A (OUI DF-A9-FF)
        Count: 1
< ACL Data TX: Handle 309 flags 0x00 dlen 10              #138 [hci1] 10.028945
      ATT: Find Information Response (0x05) len 5
        Format: UUID-16 (0x01)
        Handle: 0x004b
        UUID: Client Characteristic Configuration (0x2902)
> HCI Event: Number of Completed Packets (0x13) plen 5    #139 [hci1] 10.190495
        Num handles: 1
        Handle: 309 Address: DF:A9:FF:F6:B1:1A (OUI DF-A9-FF)
        Count: 1
        #138: len 10 (0 Kb/s)
        Latency: 161 msec (81-174 msec ~164 msec)
> ACL Data RX: Handle 309 flags 0x02 dlen 11              #140 [hci1] 10.190663
      ATT: Read By Type Request (0x08) len 6
        Handle range: 0x004c-0x005b
        Attribute type: Characteristic (0x2803)
< HCI Command: Host Number of Com.. (0x03|0x0035) plen 5  #141 [hci1] 10.208326
        Num handles: 1
        Handle: 309 Address: DF:A9:FF:F6:B1:1A (OUI DF-A9-FF)
        Count: 1
< ACL Data TX: Handle 309 flags 0x00 dlen 20              #142 [hci1] 10.208384
      ATT: Read By Type Response (0x09) len 15
        Attribute data length: 7
        Attribute data list: 2 entries
        Handle: 0x004d
        Value: 124e00772b
            Properties: 0x12
              Read (0x02)
              Notify (0x10)
            Value Handle: 0x004e
            Value UUID: Audio Input State (0x2b77)
        Handle: 0x0050
        Value: 025100782b
            Properties: 0x02
              Read (0x02)
            Value Handle: 0x0051
            Value UUID: Gain Settings Attribute (0x2b78)
> HCI Event: Number of Completed Packets (0x13) plen 5    #143 [hci1] 10.365466
        Num handles: 1
        Handle: 309 Address: DF:A9:FF:F6:B1:1A (OUI DF-A9-FF)
        Count: 1
        #142: len 20 (1 Kb/s)
        Latency: 157 msec (81-174 msec ~160 msec)
> ACL Data RX: Handle 309 flags 0x02 dlen 11              #144 [hci1] 10.365730
      ATT: Read By Type Request (0x08) len 6
        Handle range: 0x0051-0x005b
        Attribute type: Characteristic (0x2803)
< HCI Command: Host Number of Com.. (0x03|0x0035) plen 5  #145 [hci1] 10.368823
        Num handles: 1
        Handle: 309 Address: DF:A9:FF:F6:B1:1A (OUI DF-A9-FF)
        Count: 1
< ACL Data TX: Handle 309 flags 0x00 dlen 20              #146 [hci1] 10.368915
      ATT: Read By Type Response (0x09) len 15
        Attribute data length: 7
        Attribute data list: 2 entries
        Handle: 0x0052
        Value: 025300792b
            Properties: 0x02
              Read (0x02)
            Value Handle: 0x0053
            Value UUID: Audio Input Type (0x2b79)
        Handle: 0x0054
        Value: 1255007a2b
            Properties: 0x12
              Read (0x02)
              Notify (0x10)
            Value Handle: 0x0055
            Value UUID: Audio Input Status (0x2b7a)
> HCI Event: Number of Completed Packets (0x13) plen 5    #147 [hci1] 10.540485
        Num handles: 1
        Handle: 309 Address: DF:A9:FF:F6:B1:1A (OUI DF-A9-FF)
        Count: 1
        #146: len 20 (0 Kb/s)
        Latency: 171 msec (81-174 msec ~166 msec)
> ACL Data RX: Handle 309 flags 0x02 dlen 11              #148 [hci1] 10.540707
      ATT: Read By Type Request (0x08) len 6
        Handle range: 0x0055-0x005b
        Attribute type: Characteristic (0x2803)
< HCI Command: Host Number of Com.. (0x03|0x0035) plen 5  #149 [hci1] 10.548315
        Num handles: 1
        Handle: 309 Address: DF:A9:FF:F6:B1:1A (OUI DF-A9-FF)
        Count: 1
< ACL Data TX: Handle 309 flags 0x00 dlen 20              #150 [hci1] 10.548322
      ATT: Read By Type Response (0x09) len 15
        Attribute data length: 7
        Attribute data list: 2 entries
        Handle: 0x0057
        Value: 0858007b2b
            Properties: 0x08
              Write (0x08)
            Value Handle: 0x0058
            Value UUID: Audio Input Control Point (0x2b7b)
        Handle: 0x0059
        Value: 165a007c2b
            Properties: 0x16
              Read (0x02)
              Write Without Response (0x04)
              Notify (0x10)
            Value Handle: 0x005a
            Value UUID: Audio Input Description (0x2b7c)
> HCI Event: Number of Completed Packets (0x13) plen 5    #151 [hci1] 10.715456
        Num handles: 1
        Handle: 309 Address: DF:A9:FF:F6:B1:1A (OUI DF-A9-FF)
        Count: 1
        #150: len 20 (0 Kb/s)
        Latency: 167 msec (81-174 msec ~166 msec)
> ACL Data RX: Handle 309 flags 0x02 dlen 11              #152 [hci1] 10.715719
      ATT: Read By Type Request (0x08) len 6
        Handle range: 0x005a-0x005b
        Attribute type: Characteristic (0x2803)
< HCI Command: Host Number of Com.. (0x03|0x0035) plen 5  #153 [hci1] 10.728827
        Num handles: 1
        Handle: 309 Address: DF:A9:FF:F6:B1:1A (OUI DF-A9-FF)
        Count: 1
< ACL Data TX: Handle 309 flags 0x00 dlen 9               #154 [hci1] 10.729006
      ATT: Error Response (0x01) len 4
        Read By Type Request (0x08)
        Handle: 0x005a
        Error: Attribute Not Found (0x0a)
> HCI Event: Number of Completed Packets (0x13) plen 5    #155 [hci1] 10.890417
        Num handles: 1
        Handle: 309 Address: DF:A9:FF:F6:B1:1A (OUI DF-A9-FF)
        Count: 1
        #154: len 9 (0 Kb/s)
        Latency: 161 msec (81-174 msec ~164 msec)
> ACL Data RX: Handle 309 flags 0x02 dlen 9               #156 [hci1] 10.890651
      ATT: Find Information Request (0x04) len 4
        Handle range: 0x004f-0x004f
< HCI Command: Host Number of Com.. (0x03|0x0035) plen 5  #157 [hci1] 10.908834
        Num handles: 1
        Handle: 309 Address: DF:A9:FF:F6:B1:1A (OUI DF-A9-FF)
        Count: 1
< ACL Data TX: Handle 309 flags 0x00 dlen 10              #158 [hci1] 10.908990
      ATT: Find Information Response (0x05) len 5
        Format: UUID-16 (0x01)
        Handle: 0x004f
        UUID: Client Characteristic Configuration (0x2902)
> HCI Event: Number of Completed Packets (0x13) plen 5    #159 [hci1] 11.065423
        Num handles: 1
        Handle: 309 Address: DF:A9:FF:F6:B1:1A (OUI DF-A9-FF)
        Count: 1
        #158: len 10 (0 Kb/s)
        Latency: 156 msec (81-174 msec ~160 msec)
> ACL Data RX: Handle 309 flags 0x02 dlen 9               #160 [hci1] 11.065715
      ATT: Find Information Request (0x04) len 4
        Handle range: 0x0056-0x0056
< HCI Command: Host Number of Com.. (0x03|0x0035) plen 5  #161 [hci1] 11.068413
        Num handles: 1
        Handle: 309 Address: DF:A9:FF:F6:B1:1A (OUI DF-A9-FF)
        Count: 1
< ACL Data TX: Handle 309 flags 0x00 dlen 10              #162 [hci1] 11.068424
      ATT: Find Information Response (0x05) len 5
        Format: UUID-16 (0x01)
        Handle: 0x0056
        UUID: Client Characteristic Configuration (0x2902)
> HCI Event: Number of Completed Packets (0x13) plen 5    #163 [hci1] 11.240445
        Num handles: 1
        Handle: 309 Address: DF:A9:FF:F6:B1:1A (OUI DF-A9-FF)
        Count: 1
        #162: len 10 (0 Kb/s)
        Latency: 172 msec (81-174 msec ~166 msec)
> ACL Data RX: Handle 309 flags 0x02 dlen 9               #164 [hci1] 11.240640
      ATT: Find Information Request (0x04) len 4
        Handle range: 0x005b-0x005b
< HCI Command: Host Number of Com.. (0x03|0x0035) plen 5  #165 [hci1] 11.248841
        Num handles: 1
        Handle: 309 Address: DF:A9:FF:F6:B1:1A (OUI DF-A9-FF)
        Count: 1
< ACL Data TX: Handle 309 flags 0x00 dlen 10              #166 [hci1] 11.248929
      ATT: Find Information Response (0x05) len 5
        Format: UUID-16 (0x01)
        Handle: 0x005b
        UUID: Client Characteristic Configuration (0x2902)
> HCI Event: Number of Completed Packets (0x13) plen 5    #167 [hci1] 11.415441
        Num handles: 1
        Handle: 309 Address: DF:A9:FF:F6:B1:1A (OUI DF-A9-FF)
        Count: 1
        #166: len 10 (0 Kb/s)
        Latency: 166 msec (81-174 msec ~166 msec)
> ACL Data RX: Handle 309 flags 0x02 dlen 9               #168 [hci1] 11.415697
      ATT: Write Request (0x12) len 4
        Handle: 0x003f
          Data: 0000
< HCI Command: Host Number of Com.. (0x03|0x0035) plen 5  #169 [hci1] 11.428851
        Num handles: 1
        Handle: 309 Address: DF:A9:FF:F6:B1:1A (OUI DF-A9-FF)
        Count: 1
< ACL Data TX: Handle 309 flags 0x00 dlen 5               #170 [hci1] 11.428952
      ATT: Write Response (0x13) len 0
> HCI Event: Number of Completed Packets (0x13) plen 5    #171 [hci1] 11.590392
        Num handles: 1
        Handle: 309 Address: DF:A9:FF:F6:B1:1A (OUI DF-A9-FF)
        Count: 1
        #170: len 5 (0 Kb/s)
        Latency: 161 msec (81-174 msec ~163 msec)
> ACL Data RX: Handle 309 flags 0x02 dlen 9               #172 [hci1] 11.590700
      ATT: Write Request (0x12) len 4
        Handle: 0x003f
          Data: 0100
< HCI Command: Host Number of Com.. (0x03|0x0035) plen 5  #173 [hci1] 11.608906
        Num handles: 1
        Handle: 309 Address: DF:A9:FF:F6:B1:1A (OUI DF-A9-FF)
        Count: 1
< ACL Data TX: Handle 309 flags 0x00 dlen 5               #174 [hci1] 11.608979
      ATT: Write Response (0x13) len 0
> HCI Event: Number of Completed Packets (0x13) plen 5    #175 [hci1] 11.765452
        Num handles: 1
        Handle: 309 Address: DF:A9:FF:F6:B1:1A (OUI DF-A9-FF)
        Count: 1
        #174: len 5 (0 Kb/s)
        Latency: 156 msec (81-174 msec ~160 msec)
> ACL Data RX: Handle 309 flags 0x02 dlen 9               #176 [hci1] 11.765693
      ATT: Write Request (0x12) len 4
        Handle: 0x004f
          Data: 0000
< HCI Command: Host Number of Com.. (0x03|0x0035) plen 5  #177 [hci1] 11.768608
        Num handles: 1
        Handle: 309 Address: DF:A9:FF:F6:B1:1A (OUI DF-A9-FF)
        Count: 1
< ACL Data TX: Handle 309 flags 0x00 dlen 5               #178 [hci1] 11.768667
      ATT: Write Response (0x13) len 0
> HCI Event: Number of Completed Packets (0x13) plen 5    #179 [hci1] 11.940391
        Num handles: 1
        Handle: 309 Address: DF:A9:FF:F6:B1:1A (OUI DF-A9-FF)
        Count: 1
        #178: len 5 (0 Kb/s)
        Latency: 171 msec (81-174 msec ~165 msec)
> ACL Data RX: Handle 309 flags 0x02 dlen 9               #180 [hci1] 11.940691
      ATT: Write Request (0x12) len 4
        Handle: 0x004f
          Data: 0100
< HCI Command: Host Number of Com.. (0x03|0x0035) plen 5  #181 [hci1] 11.948890
        Num handles: 1
        Handle: 309 Address: DF:A9:FF:F6:B1:1A (OUI DF-A9-FF)
        Count: 1
< ACL Data TX: Handle 309 flags 0x00 dlen 5               #182 [hci1] 11.948987
      ATT: Write Response (0x13) len 0
> HCI Event: Number of Completed Packets (0x13) plen 5    #183 [hci1] 12.115464
        Num handles: 1
        Handle: 309 Address: DF:A9:FF:F6:B1:1A (OUI DF-A9-FF)
        Count: 1
        #182: len 5 (0 Kb/s)
        Latency: 166 msec (81-174 msec ~166 msec)
> ACL Data RX: Handle 309 flags 0x02 dlen 7               #184 [hci1] 12.115618
      ATT: Read Request (0x0a) len 2
        Handle: 0x003e
< HCI Command: Host Number of Com.. (0x03|0x0035) plen 5  #185 [hci1] 12.128895
        Num handles: 1
        Handle: 309 Address: DF:A9:FF:F6:B1:1A (OUI DF-A9-FF)
        Count: 1
< ACL Data TX: Handle 309 flags 0x00 dlen 9               #186 [hci1] 12.128992
      ATT: Read Response (0x0b) len 4
> HCI Event: Number of Completed Packets (0x13) plen 5    #187 [hci1] 12.290426
        Num handles: 1
        Handle: 309 Address: DF:A9:FF:F6:B1:1A (OUI DF-A9-FF)
        Count: 1
        #186: len 9 (0 Kb/s)
        Latency: 161 msec (81-174 msec ~163 msec)
> ACL Data RX: Handle 309 flags 0x02 dlen 10              #188 [hci1] 12.290729
      ATT: Write Request (0x12) len 5
        Handle: 0x0048
          Data: 016400
< HCI Command: Host Number of Com.. (0x03|0x0035) plen 5  #189 [hci1] 12.308858
        Num handles: 1
        Handle: 309 Address: DF:A9:FF:F6:B1:1A (OUI DF-A9-FF)
        Count: 1
< ACL Data TX: Handle 309 flags 0x00 dlen 9               #190 [hci1] 12.309054
      ATT: Error Response (0x01) len 4
        Write Request (0x12)
        Handle: 0x0048
        Error: Reserved (0x80)
> HCI Event: Number of Completed Packets (0x13) plen 5    #191 [hci1] 12.465451
        Num handles: 1
        Handle: 309 Address: DF:A9:FF:F6:B1:1A (OUI DF-A9-FF)
        Count: 1
        #190: len 9 (0 Kb/s)
        Latency: 156 msec (81-174 msec ~160 msec)
> ACL Data RX: Handle 309 flags 0x02 dlen 9               #192 [hci1] 12.465585
      ATT: Write Request (0x12) len 4
        Handle: 0x0048
          Data: 0265
< HCI Command: Host Number of Com.. (0x03|0x0035) plen 5  #193 [hci1] 12.468838
        Num handles: 1
        Handle: 309 Address: DF:A9:FF:F6:B1:1A (OUI DF-A9-FF)
        Count: 1
< ACL Data TX: Handle 309 flags 0x00 dlen 9               #194 [hci1] 12.469061
      ATT: Error Response (0x01) len 4
        Write Request (0x12)
        Handle: 0x0048
        Error: Reserved (0x80)
> HCI Event: Number of Completed Packets (0x13) plen 5    #195 [hci1] 12.640709
        Num handles: 1
        Handle: 309 Address: DF:A9:FF:F6:B1:1A (OUI DF-A9-FF)
        Count: 1
        #194: len 9 (0 Kb/s)
        Latency: 171 msec (81-174 msec ~165 msec)
> ACL Data RX: Handle 309 flags 0x02 dlen 9               #196 [hci1] 12.640717
      ATT: Write Request (0x12) len 4
        Handle: 0x0048
          Data: 0366
< HCI Command: Host Number of Com.. (0x03|0x0035) plen 5  #197 [hci1] 12.648799
        Num handles: 1
        Handle: 309 Address: DF:A9:FF:F6:B1:1A (OUI DF-A9-FF)
        Count: 1
< ACL Data TX: Handle 309 flags 0x00 dlen 9               #198 [hci1] 12.648824
      ATT: Error Response (0x01) len 4
        Write Request (0x12)
        Handle: 0x0048
        Error: Reserved (0x80)
> HCI Event: Number of Completed Packets (0x13) plen 5    #199 [hci1] 12.815497
        Num handles: 1
        Handle: 309 Address: DF:A9:FF:F6:B1:1A (OUI DF-A9-FF)
        Count: 1
        #198: len 9 (0 Kb/s)
        Latency: 166 msec (81-174 msec ~166 msec)
> ACL Data RX: Handle 309 flags 0x02 dlen 9               #200 [hci1] 12.815615
      ATT: Write Request (0x12) len 4
        Handle: 0x0048
          Data: 0467
< HCI Command: Host Number of Com.. (0x03|0x0035) plen 5  #201 [hci1] 12.828838
        Num handles: 1
        Handle: 309 Address: DF:A9:FF:F6:B1:1A (OUI DF-A9-FF)
        Count: 1
< ACL Data TX: Handle 309 flags 0x00 dlen 9               #202 [hci1] 12.829036
      ATT: Error Response (0x01) len 4
        Write Request (0x12)
        Handle: 0x0048
        Error: Reserved (0x80)
> HCI Event: Number of Completed Packets (0x13) plen 5    #203 [hci1] 12.990429
        Num handles: 1
        Handle: 309 Address: DF:A9:FF:F6:B1:1A (OUI DF-A9-FF)
        Count: 1
        #202: len 9 (0 Kb/s)
        Latency: 161 msec (81-174 msec ~163 msec)
> ACL Data RX: Handle 309 flags 0x02 dlen 9               #204 [hci1] 12.990648
      ATT: Write Request (0x12) len 4
        Handle: 0x0048
          Data: 0568
< HCI Command: Host Number of Com.. (0x03|0x0035) plen 5  #205 [hci1] 13.008836
        Num handles: 1
        Handle: 309 Address: DF:A9:FF:F6:B1:1A (OUI DF-A9-FF)
        Count: 1
< ACL Data TX: Handle 309 flags 0x00 dlen 9               #206 [hci1] 13.008994
      ATT: Error Response (0x01) len 4
        Write Request (0x12)
        Handle: 0x0048
        Error: Reserved (0x80)
> HCI Event: Number of Completed Packets (0x13) plen 5    #207 [hci1] 13.165284
        Num handles: 1
        Handle: 309 Address: DF:A9:FF:F6:B1:1A (OUI DF-A9-FF)
        Count: 1
        #206: len 9 (0 Kb/s)
        Latency: 156 msec (81-174 msec ~160 msec)
> HCI Event: Disconnect Complete (0x05) plen 4            #208 [hci1] 14.565622
        Status: Success (0x00)
        Handle: 309 Address: DF:A9:FF:F6:B1:1A (OUI DF-A9-FF)
        Reason: Remote User Terminated Connection (0x13)
< HCI Command: Reset (0x03|0x0003) plen 0                 #209 [hci1] 18.998331
> HCI Event: Command Complete (0x0e) plen 4               #210 [hci1] 18.998783
      Reset (0x03|0x0003) ncmd 1
        Status: Success (0x00)
@ USER Close: main                                    {0x0001} [hci1] 19.008250
= Close Index: 00:00:00:00:00:00                               [hci1] 19.008257
