Bluetooth monitor ver 5.72
= Note: Linux version 6.14.0-36-generic (x86_64)                       0.529159
= Note: Bluetooth subsystem version 2.22                               0.529161
= New Index: 00:00:00:00:00:00 (Primary,UART,hci1)              [hci1] 0.529162
= New Index: 48:5F:99:8E:E0:64 (Primary,USB,hci0)               [hci0] 0.529163
= Open Index: 00:00:00:00:00:00                                 [hci1] 0.643009
= Index Info: 00:00:00:00:00:00 (Nordic Semiconductor ASA)      [hci1] 0.643026
@ USER Open: main (privileged) version 2.22            {0x0001} [hci1] 0.643035
< HCI Command: Reset (0x03|0x0003) plen 0                    #1 [hci1] 0.644401
> HCI Event: Command Complete (0x0e) plen 4                  #2 [hci1] 0.644925
      Reset (0x03|0x0003) ncmd 1
        Status: Success (0x00)
< HCI Command: Read Local Supported... (0x04|0x0003) plen 0  #3 [hci1] 0.662868
> HCI Event: Command Complete (0x0e) plen 12                 #4 [hci1] 0.663436
      Read Local Supported Features (0x04|0x0003) ncmd 1
        Status: Success (0x00)
        Features: 0x00 0x00 0x00 0x00 0x60 0x00 0x00 0x00
          BR/EDR Not Supported
          LE Supported (Controller)
< HCI Command: Read Local Version In.. (0x04|0x0001) plen 0  #5 [hci1] 0.682504
> HCI Event: Command Complete (0x0e) plen 12                 #6 [hci1] 0.683010
      Read Local Version Information (0x04|0x0001) ncmd 1
        Status: Success (0x00)
        HCI version: Reserved (0x0f) - Revision 12393 (0x3069)
        LMP version: Reserved (0x0f) - Subversion 12393 (0x3069)
        Manufacturer: Nordic Semiconductor ASA (89)
< HCI Command: Read Local Supported... (0x04|0x0002) plen 0  #7 [hci1] 0.702434
> HCI Event: Command Complete (0x0e) plen 68                 #8 [hci1] 0.703461
      Read Local Supported Commands (0x04|0x0002) ncmd 1
        Status: Success (0x00)
        Commands: 119 entries
          Disconnect (Octet 0 - Bit 5)
          Read Remote Version Information (Octet 2 - Bit 7)
          Set Event Mask (Octet 5 - Bit 6)
          Reset (Octet 5 - Bit 7)
          Read Connection Accept Timeout (Octet 7 - Bit 2)
          Write Connection Accept Timeout (Octet 7 - Bit 3)
          Read Transmit Power Level (Octet 10 - Bit 2)
          Set Controller To Host Flow Control (Octet 10 - Bit 5)
          Host Buffer Size (Octet 10 - Bit 6)
          Host Number of Completed Packets (Octet 10 - Bit 7)
          Read Local Version Information (Octet 14 - Bit 3)
          Read Local Supported Features (Octet 14 - Bit 5)
          Read BD ADDR (Octet 15 - Bit 1)
          Read RSSI (Octet 15 - Bit 5)
          Set Event Mask Page 2 (Octet 22 - Bit 2)
          LE Set Event Mask (Octet 25 - Bit 0)
          LE Read Buffer Size (Octet 25 - Bit 1)
          LE Read Local Supported Features (Octet 25 - Bit 2)
          LE Set Random Address (Octet 25 - Bit 4)
          LE Set Advertising Parameters (Octet 25 - Bit 5)
          LE Read Advertising Channel TX Power (Octet 25 - Bit 6)
          LE Set Advertising Data (Octet 25 - Bit 7)
          LE Set Scan Response Data (Octet 26 - Bit 0)
          LE Set Advertise Enable (Octet 26 - Bit 1)
          LE Set Scan Parameters (Octet 26 - Bit 2)
          LE Set Scan Enable (Octet 26 - Bit 3)
          LE Create Connection (Octet 26 - Bit 4)
          LE Create Connection Cancel (Octet 26 - Bit 5)
          LE Read Accept List Size (Octet 26 - Bit 6)
          LE Clear Accept List (Octet 26 - Bit 7)
          LE Add Device To Accept List (Octet 27 - Bit 0)
          LE Remove Device From Accept List (Octet 27 - Bit 1)
          LE Connection Update (Octet 27 - Bit 2)
          LE Set Host Channel Classification (Octet 27 - Bit 3)
          LE Read Channel Map (Octet 27 - Bit 4)
          LE Read Remote Used Features (Octet 27 - Bit 5)
          LE Encrypt (Octet 27 - Bit 6)
          LE Rand (Octet 27 - Bit 7)
          LE Start Encryption (Octet 28 - Bit 0)
          LE Long Term Key Request Reply (Octet 28 - Bit 1)
          LE Long Term Key Request Neg Reply (Octet 28 - Bit 2)
          LE Read Supported States (Octet 28 - Bit 3)
          LE Receiver Test (Octet 28 - Bit 4)
          LE Transmitter Test (Octet 28 - Bit 5)
          LE Test End (Octet 28 - Bit 6)
          Read Authenticated Payload Timeout (Octet 32 - Bit 4)
          Write Authenticated Payload Timeout (Octet 32 - Bit 5)
          LE Set Data Length (Octet 33 - Bit 6)
          LE Read Suggested Default Data Length (Octet 33 - Bit 7)
          LE Write Suggested Default Data Length (Octet 34 - Bit 0)
          LE Add Device To Resolving List (Octet 34 - Bit 3)
          LE Remove Device From Resolving List (Octet 34 - Bit 4)
          LE Clear Resolving List (Octet 34 - Bit 5)
          LE Read Resolving List Size (Octet 34 - Bit 6)
          LE Set Address Resolution Enable (Octet 35 - Bit 1)
          LE Set Resolvable Private Address Timeout (Octet 35 - Bit 2)
          LE Read Maximum Data Length (Octet 35 - Bit 3)
          LE Read PHY (Octet 35 - Bit 4)
          LE Set Default PHY (Octet 35 - Bit 5)
          LE Set PHY (Octet 35 - Bit 6)
          LE Enhanced Receiver Test (Octet 35 - Bit 7)
          LE Enhanced Transmitter Test (Octet 36 - Bit 0)
          LE Set Advertising Set Random Address (Octet 36 - Bit 1)
          LE Set Extended Advertising Parameters (Octet 36 - Bit 2)
          LE Set Extended Advertising Data (Octet 36 - Bit 3)
          LE Set Extended Scan Response Data (Octet 36 - Bit 4)
          LE Set Extended Advertising Enable (Octet 36 - Bit 5)
          LE Read Maximum Advertising Data Length (Octet 36 - Bit 6)
          LE Read Number of Supported Advertising Sets (Octet 36 - Bit 7)
          LE Remove Advertising Set (Octet 37 - Bit 0)
          LE Clear Advertising Sets (Octet 37 - Bit 1)
          LE Set Periodic Advertising Parameters (Octet 37 - Bit 2)
          LE Set Periodic Advertising Data (Octet 37 - Bit 3)
          LE Set Periodic Advertising Enable (Octet 37 - Bit 4)
          LE Set Extended Scan Parameters (Octet 37 - Bit 5)
          LE Set Extended Scan Enable (Octet 37 - Bit 6)
          LE Extended Create Connection (Octet 37 - Bit 7)
          LE Periodic Advertising Create Sync (Octet 38 - Bit 0)
          LE Periodic Advertising Create Sync Cancel (Octet 38 - Bit 1)
          LE Periodic Advertising Terminate Sync (Octet 38 - Bit 2)
          LE Add Device To Periodic Advertiser List (Octet 38 - Bit 3)
          LE Remove Device From Periodic Advertiser List (Octet 38 - Bit 4)
          LE Clear Periodic Advertiser List (Octet 38 - Bit 5)
          LE Read Periodic Advertiser List Size (Octet 38 - Bit 6)
          LE Read Transmit Power (Octet 38 - Bit 7)
          LE Read RF Path Compensation (Octet 39 - Bit 0)
          LE Write RF Path Compensation (Octet 39 - Bit 1)
          LE Set Privacy Mode (Octet 39 - Bit 2)
          LE Periodic Advertising Receive Enable (Octet 40 - Bit 5)
          LE Periodic Advertising Sync Transfer (Octet 40 - Bit 6)
          LE Periodic Advertising Set Info Transfer (Octet 40 - Bit 7)
          LE Periodic Advertising Sync Transfer Parameters (Octet 41 - Bit 0)
          LE Set Default Periodic Advertisng Sync Transfer Parameters (Octet 41 - Bit 1)
          LE Read Buffer v2 (Octet 41 - Bit 5)
          LE Read ISO TX Sync (Octet 41 - Bit 6)
          LE Set Connected Isochronous Group Parameters (Octet 41 - Bit 7)
          LE Set Connected Isochronous Group Parameters Test (Octet 42 - Bit 0)
          LE Create Connected Isochronous Stream (Octet 42 - Bit 1)
          LE Remove Connected Isochronous Group (Octet 42 - Bit 2)
          LE Accept Connected Isochronous Stream Request (Octet 42 - Bit 3)
          LE Reject Connected Isochronous Stream Request (Octet 42 - Bit 4)
          LE Create Broadcast Isochronous Group (Octet 42 - Bit 5)
          LE Create Broadcast Isochronous Group Test (Octet 42 - Bit 6)
          LE Terminate Broadcast Isochronous Group (Octet 42 - Bit 7)
          LE Broadcast Isochronous Group Create Sync (Octet 43 - Bit 0)
          LE Broadcast Isochronous Group Terminate Sync (Octet 43 - Bit 1)
          LE Request Peer SCA (Octet 43 - Bit 2)
          LE Setup Isochronous Data Path (Octet 43 - Bit 3)
          LE Remove Isochronous Data Path (Octet 43 - Bit 4)
          LE Isochronous Transmit Test (Octet 43 - Bit 5)
          LE Isochronous Receive Test (Octet 43 - Bit 6)
          LE Isochronous Read Test Counters (Octet 43 - Bit 7)
          LE Isochronous Read Test Counters (Octet 44 - Bit 0)
          LE Set Host Feature (Octet 44 - Bit 1)
          Octet 44 - Bit 2 
          Octet 45 - Bit 6 
          Octet 46 - Bit 0 
          Octet 46 - Bit 1 
          Octet 46 - Bit 2 
< HCI Command: Host Buffer Size (0x03|0x0033) plen 7         #9 [hci1] 0.722370
        ACL MTU: 255  ACL max packet: 16
        SCO MTU: 0    SCO max packet: 0
> HCI Event: Command Complete (0x0e) plen 4                 #10 [hci1] 0.722878
      Host Buffer Size (0x03|0x0033) ncmd 1
        Status: Success (0x00)
< HCI Command: Set Controller To Ho.. (0x03|0x0031) plen 1  #11 [hci1] 0.742432
        Flow control: ACL Data Packets (0x01)
> HCI Event: Command Complete (0x0e) plen 4                 #12 [hci1] 0.742851
      Set Controller To Host Flow Control (0x03|0x0031) ncmd 1
        Status: Success (0x00)
< HCI Command: LE Read Local Suppor.. (0x08|0x0003) plen 0  #13 [hci1] 0.762350
> HCI Event: Command Complete (0x0e) plen 12                #14 [hci1] 0.762788
      LE Read Local Supported Features (0x08|0x0003) ncmd 1
        Status: Success (0x00)
        Features: 0xfd 0x79 0x00 0xf7 0x30 0x01 0x00 0x00
          LE Encryption
          Extended Reject Indication
          Peripheral-initiated Features Exchange
          LE Ping
          LE Data Packet Length Extension
          LL Privacy
          Extended Scanner Filter Policies
          LE 2M PHY
          LE Coded PHY
          LE Extended Advertising
          LE Periodic Advertising
          Channel Selection Algorithm #2
          Periodic Advertising Sync Transfer - Sender
          Periodic Advertising Sync Transfer - Recipient
          Sleep Clock Accuracy Updates
          Connected Isochronous Stream - Central
          Connected Isochronous Stream - Peripheral
          Isochronous Broadcaster
          Synchronized Receiver
          Periodic Advertising ADI support
          Connection Subrating
          Unknown features (0x0000010000000000)
< HCI Command: LE Set Host Feature (0x08|0x0074) plen 2     #15 [hci1] 0.782386
        Bit Number: 32
          Connected Isochronous Stream (Host Support)
        Bit Value: 1
> HCI Event: Command Complete (0x0e) plen 4                 #16 [hci1] 0.782801
      LE Set Host Feature (0x08|0x0074) ncmd 1
        Status: Success (0x00)
< HCI Command: LE Read Buffer v2 (0x08|0x0060) plen 0       #17 [hci1] 0.802349
> HCI Event: Command Complete (0x0e) plen 10                #18 [hci1] 0.802797
      LE Read Buffer v2 (0x08|0x0060) ncmd 1
        Status: Success (0x00)
        ACL MTU: 27
        ACL max packet: 3
        ISO MTU: 318
        ISO max packet: 3
< HCI Command: LE Read Maximum Adve.. (0x08|0x003a) plen 0  #19 [hci1] 0.822388
> HCI Event: Command Complete (0x0e) plen 6                 #20 [hci1] 0.822797
      LE Read Maximum Advertising Data Length (0x08|0x003a) ncmd 1
        Status: Success (0x00)
        Max length: 1650
< HCI Command: LE Read Supported St.. (0x08|0x001c) plen 0  #21 [hci1] 0.842363
> HCI Event: Command Complete (0x0e) plen 12                #22 [hci1] 0.842930
      LE Read Supported States (0x08|0x001c) ncmd 1
        Status: Success (0x00)
        States: 0x000003ff3e0306ff
          Non-connectable Advertising State
          Scannable Advertising State
          Connectable Advertising State
          High Duty Cycle Directed Advertising State
          Passive Scanning State
          Active Scanning State
          Initiating State
            and Connection State (Central Role)
          Connection State (Peripheral Role)
          Scannable Advertising State
            and Passive Scanning State
          Connectable Advertising State
            and Passive Scanning State
          Non-connectable Advertising State
            and Initiating State
          Scannable Advertising State
            and Initiating State
          Active Scanning State
            and Connection State (Central Role)
          Passive Scanning State
            and Connection State (Peripheral Role)
          Active Scanning State
            and Connection State (Peripheral Role)
          Initiating State
            and Connection State (Central Role)
            and Central Role & Central Role
          Low Duty Cycle Directed Advertising State
          Connectable Advertising State
            and Initiating State
            and Central Role & Peripheral Role
          High Duty Cycle Directed Advertising State
            and Initiating State
            and Central Role & Peripheral Role
          Low Duty Cycle Directed Advertising State
            and Initiating State
            and Central Role & Peripheral Role
          Connectable Advertising State
            and Connection State (Central Role)
            and Central Role & Peripheral Role
          High Duty Cycle Directed Advertising State
            and Connection State (Central Role)
            and Central Role & Peripheral Role
          Low Duty Cycle Directed Advertising State
            and Connection State (Central Role)
            and Central Role & Peripheral Role
          Connectable Advertising State
            and Connection State (Peripheral Role)
            and Central Role & Peripheral Role
          High Duty Cycle Directed Advertising State
            and Connection State (Peripheral Role)
            and Peripheral Role & Peripheral Role
          Low Duty Cycle Directed Advertising State
            and Connection State (Peripheral Role)
            and Peripheral Role & Peripheral Role
          Initiating State
            and Connection State (Peripheral Role)
            and Central Role & Peripheral Role
< HCI Command: LE Read Maximum Data.. (0x08|0x002f) plen 0  #23 [hci1] 0.862394
> HCI Event: Command Complete (0x0e) plen 12                #24 [hci1] 0.862971
      LE Read Maximum Data Length (0x08|0x002f) ncmd 1
        Status: Success (0x00)
        Max TX octets: 251
        Max TX time: 2704
        Max RX octets: 251
        Max RX time: 2704
< HCI Command: LE Write Suggested D.. (0x08|0x0024) plen 4  #25 [hci1] 0.882352
        TX octets: 251
        TX time: 2704
> HCI Event: Command Complete (0x0e) plen 4                 #26 [hci1] 0.882801
      LE Write Suggested Default Data Length (0x08|0x0024) ncmd 1
        Status: Success (0x00)
< HCI Command: LE Read Resolving Li.. (0x08|0x002a) plen 0  #27 [hci1] 0.902353
> HCI Event: Command Complete (0x0e) plen 5                 #28 [hci1] 0.902783
      LE Read Resolving List Size (0x08|0x002a) ncmd 1
        Status: Success (0x00)
        Size: 8
< HCI Command: LE Set Event Mask (0x08|0x0001) plen 8       #29 [hci1] 0.922353
        Mask: 0x000002023f87fa5e
          LE Advertising Report
          LE Connection Update Complete
          LE Read Remote Used Features Complete
          LE Long Term Key Request
          LE Data Length Change
          LE Enhanced Connection Complete
          LE PHY Update Complete
          LE Extended Advertising Report
          LE Periodic Advertising Sync Established
          LE Periodic Advertising Report
          LE Periodic Advertising Sync Lost
          LE Extended Scan Timeout
          LE Extended Advertising Set Terminated
          LE Scan Request Received
          LE Periodic Advertising Sync Transfer Rvc
          LE CIS Established
          LE CIS Request
          LE Create BIG Complete
          LE Terminate BIG Complete
          LE BIG Sync Estabilished Complete
          LE BIG Sync Lost
          LE BIG Info Advertising Report
          Unknown mask (0x0000020000000000)
> HCI Event: Command Complete (0x0e) plen 4                 #30 [hci1] 0.922843
      LE Set Event Mask (0x08|0x0001) ncmd 1
        Status: Success (0x00)
< HCI Command: Set Event Mask (0x03|0x0001) plen 8          #31 [hci1] 0.942350
        Mask: 0x2000800002008890
          Disconnection Complete
          Encryption Change
          Read Remote Version Information Complete
          Hardware Error
          Data Buffer Overflow
          Encryption Key Refresh Complete
          LE Meta
> HCI Event: Command Complete (0x0e) plen 4                 #32 [hci1] 0.942787
      Set Event Mask (0x03|0x0001) ncmd 1
        Status: Success (0x00)
< HCI Command: Read BD ADDR (0x04|0x0009) plen 0            #33 [hci1] 0.962354
> HCI Event: Command Complete (0x0e) plen 10                #34 [hci1] 0.962819
      Read BD ADDR (0x04|0x0009) ncmd 1
        Status: Success (0x00)
        Address: 00:00:00:00:00:00 (OUI 00-00-00)
< HCI Command: LE Set Random Address (0x08|0x0005) plen 6   #35 [hci1] 0.982349
        Address: D5:B6:CC:31:DB:3B (Static)
> HCI Event: Command Complete (0x0e) plen 4                 #36 [hci1] 0.982922
      LE Set Random Address (0x08|0x0005) ncmd 1
        Status: Success (0x00)
< HCI Command: LE Set Extended Adv.. (0x08|0x0036) plen 25  #37 [hci1] 3.453007
        Handle: 0x00
        Properties: 0x0013
          Connectable
          Scannable
          Use legacy advertising PDUs: ADV_IND
        Min advertising interval: 100.000 msec (0x00a0)
        Max advertising interval: 150.000 msec (0x00f0)
        Channel map: 37, 38, 39 (0x07)
        Own address type: Random (0x01)
        Peer address type: Public (0x00)
        Peer address: 00:00:00:00:00:00 (OUI 00-00-00)
        Filter policy: Allow Scan Request from Any, Allow Connect Request from Any (0x00)
        TX power: Host has no preference (0x7f)
        Primary PHY: LE 1M (0x01)
        Secondary max skip: 0x00
        Secondary PHY: LE 1M (0x01)
        SID: 0x00
        Scan request notifications: Disabled (0x00)
> HCI Event: Command Complete (0x0e) plen 5                 #38 [hci1] 3.453819
      LE Set Extended Advertising Parameters (0x08|0x0036) ncmd 1
        Status: Success (0x00)
        TX power (selected): 0 dbm (0x00)
< HCI Command: LE Set Advertising S.. (0x08|0x0035) plen 7  #39 [hci1] 3.462402
        Advertising handle: 0x00
        Advertising random address: D5:B6:CC:31:DB:3B (Static)
> HCI Event: Command Complete (0x0e) plen 4                 #40 [hci1] 3.462928
      LE Set Advertising Set Random Address (0x08|0x0035) ncmd 1
        Status: Success (0x00)
< HCI Command: LE Set Extended Adv.. (0x08|0x0037) plen 22  #41 [hci1] 3.482397
        Handle: 0x00
        Operation: Complete extended advertising data (0x03)
        Fragment preference: Minimize fragmentation (0x01)
        Data length: 0x12
        Flags: 0x06
          LE General Discoverable Mode
          BR/EDR Not Supported
        Name (complete): Tester_F6B11A
> HCI Event: Command Complete (0x0e) plen 4                 #42 [hci1] 3.483188
      LE Set Extended Advertising Data (0x08|0x0037) ncmd 1
        Status: Success (0x00)
< HCI Command: LE Set Extended Scan.. (0x08|0x0038) plen 4  #43 [hci1] 3.502438
        Handle: 0x00
        Operation: Complete scan response data (0x03)
        Fragment preference: Minimize fragmentation (0x01)
        Data length: 0x00
> HCI Event: Command Complete (0x0e) plen 4                 #44 [hci1] 3.502895
      LE Set Extended Scan Response Data (0x08|0x0038) ncmd 1
        Status: Success (0x00)
< HCI Command: LE Set Extended Adve.. (0x08|0x0039) plen 6  #45 [hci1] 3.522399
        Extended advertising: Enabled (0x01)
        Number of sets: 1 (0x01)
        Entry 0
          Handle: 0x00
          Duration: 0 ms (0x00)
          Max ext adv events: 0
> HCI Event: Command Complete (0x0e) plen 4                 #46 [hci1] 3.522950
      LE Set Extended Advertising Enable (0x08|0x0039) ncmd 1
        Status: Success (0x00)
> HCI Event: LE Meta Event (0x3e) plen 31                   #47 [hci1] 3.644167
      LE Enhanced Connection Complete (0x0a)
        Status: Success (0x00)
        Handle: 1407
        Role: Peripheral (0x01)
        Peer address type: Public (0x00)
        Peer address: DF:A9:FF:F6:B1:1A (OUI DF-A9-FF)
        Local resolvable private address: 00:00:00:00:00:00 (Non-Resolvable)
        Peer resolvable private address: 00:00:00:00:00:00 (Non-Resolvable)
        Connection interval: 87.50 msec (0x0046)
        Connection latency: 0 (0x0000)
        Supervision timeout: 25120 msec (0x09d0)
        Central clock accuracy: 0x01
> HCI Event: LE Meta Event (0x3e) plen 6                    #48 [hci1] 3.644256
      LE Advertising Set Terminated (0x12)
        Status: Success (0x00)
        Handle: 0
        Connection handle: 1407
        Number of completed extended advertising events: 0
< HCI Command: LE Read Remote Used... (0x08|0x0016) plen 2  #49 [hci1] 3.663153
        Handle: 1407 Address: DF:A9:FF:F6:B1:1A (OUI DF-A9-FF)
< ACL Data TX: Handle 1407 flags 0x00 dlen 7                #50 [hci1] 3.663167
      ATT: Exchange MTU Request (0x02) len 2
        Client RX MTU: 251
> HCI Event: Command Status (0x0f) plen 4                   #51 [hci1] 3.663696
      LE Read Remote Used Features (0x08|0x0016) ncmd 1
        Status: Success (0x00)
> HCI Event: Number of Completed Packets (0x13) plen 5      #52 [hci1] 3.820162
        Num handles: 1
        Handle: 1407 Address: DF:A9:FF:F6:B1:1A (OUI DF-A9-FF)
        Count: 1
        #50: len 7 (0 Kb/s)
        Latency: 156 msec (156-156 msec ~156 msec)
> HCI Event: LE Meta Event (0x3e) plen 12                   #53 [hci1] 3.908133
      LE Read Remote Used Features (0x04)
        Status: Success (0x00)
        Handle: 1407 Address: DF:A9:FF:F6:B1:1A (OUI DF-A9-FF)
        Features: 0x2d 0x49 0x00 0xf7 0x67 0xd9 0x00 0x80
          LE Encryption
          Extended Reject Indication
          Peripheral-initiated Features Exchange
          LE Data Packet Length Extension
          LE 2M PHY
          LE Coded PHY
          Channel Selection Algorithm #2
          Periodic Advertising Sync Transfer - Sender
          Periodic Advertising Sync Transfer - Recipient
          Sleep Clock Accuracy Updates
          Connected Isochronous Stream - Central
          Connected Isochronous Stream - Peripheral
          Isochronous Broadcaster
          Synchronized Receiver
          Connected Isochronous Stream (Host Support)
          LE Power Control Request
          LE Power Control Request
          Connection Subrating
          Connection Subrating (Host Support)
          Unknown features (0x8000d90000000000)
> ACL Data RX: Handle 1407 flags 0x02 dlen 11               #54 [hci1] 6.357820
      SMP: Pairing Request (0x01) len 6
        IO capability: KeyboardDisplay (0x04)
        OOB data: Authentication data not present (0x00)
        Authentication requirement: Bonding, MITM, SC, No Keypresses (0x0d)
        Max encryption key size: 16
        Initiator key distribution: EncKey IdKey (0x03)
        Responder key distribution: EncKey IdKey Sign (0x07)
> ACL Data RX: Handle 1407 flags 0x02 dlen 7                #55 [hci1] 6.358256
      ATT: Exchange MTU Response (0x03) len 2
        Server RX MTU: 23
< HCI Command: Host Number of Compl.. (0x03|0x0035) plen 5  #56 [hci1] 6.362966
        Num handles: 1
        Handle: 1407 Address: DF:A9:FF:F6:B1:1A (OUI DF-A9-FF)
        Count: 1
< ACL Data TX: Handle 1407 flags 0x00 dlen 11               #57 [hci1] 6.363062
      SMP: Pairing Response (0x02) len 6
        IO capability: DisplayOnly (0x00)
        OOB data: Authentication data not present (0x00)
        Authentication requirement: Bonding, No MITM, SC, No Keypresses (0x09)
        Max encryption key size: 16
        Initiator key distribution: IdKey (0x02)
        Responder key distribution: <none> (0x00)
< HCI Command: Host Number of Compl.. (0x03|0x0035) plen 5  #58 [hci1] 6.363431
        Num handles: 1
        Handle: 1407 Address: DF:A9:FF:F6:B1:1A (OUI DF-A9-FF)
        Count: 1
> HCI Event: Number of Completed Packets (0x13) plen 5      #59 [hci1] 6.533015
        Num handles: 1
        Handle: 1407 Address: DF:A9:FF:F6:B1:1A (OUI DF-A9-FF)
        Count: 1
        #57: len 11 (0 Kb/s)
        Latency: 169 msec (156-169 msec ~163 msec)
> ACL Data RX: Handle 1407 flags 0x02 dlen 27               #60 [hci1] 6.533225
> ACL Data RX: Handle 1407 flags 0x01 dlen 27               #61 [hci1] 6.533680
> ACL Data RX: Handle 1407 flags 0x01 dlen 15               #62 [hci1] 6.534131
      SMP: Pairing Public Key (0x0c) len 64
        X: 8684c9f231e3a5bec6400da30aa8d1e0e724de15b881319c1861904526b17ef0
        Y: 4631a43e95b76630b1d854044f9e24d5dd350805de981315df61a4a151881c36
< HCI Command: Host Number of Compl.. (0x03|0x0035) plen 5  #63 [hci1] 6.543362
        Num handles: 1
        Handle: 1407 Address: DF:A9:FF:F6:B1:1A (OUI DF-A9-FF)
        Count: 1
< HCI Command: Host Number of Compl.. (0x03|0x0035) plen 5  #64 [hci1] 6.543508
        Num handles: 1
        Handle: 1407 Address: DF:A9:FF:F6:B1:1A (OUI DF-A9-FF)
        Count: 1
< HCI Command: Host Number of Compl.. (0x03|0x0035) plen 5  #65 [hci1] 6.543894
        Num handles: 1
        Handle: 1407 Address: DF:A9:FF:F6:B1:1A (OUI DF-A9-FF)
        Count: 1
< ACL Data TX: Handle 1407 flags 0x00 dlen 27               #66 [hci1] 6.544041
< ACL Data TX: Handle 1407 flags 0x01 dlen 27               #67 [hci1] 6.544130
< ACL Data TX: Handle 1407 flags 0x01 dlen 15               #68 [hci1] 6.544142
      SMP: Pairing Public Key (0x0c) len 64
        X: 98308440221e2d910f0e54b71e7ec652857aa9b5a0dc65028824cc19db1226e9
        Y: 67a4816bcb62efb21701e31fdb27561a6217575fb007a8bbdabe7e28b6f68482
> HCI Event: Number of Completed Packets (0x13) plen 5      #69 [hci1] 6.620756
        Num handles: 1
        Handle: 1407 Address: DF:A9:FF:F6:B1:1A (OUI DF-A9-FF)
        Count: 1
        #66: len 27 (2 Kb/s)
        Latency: 76 msec (76-169 msec ~120 msec)
> HCI Event: Number of Completed Packets (0x13) plen 5      #70 [hci1] 6.621466
        Num handles: 1
        Handle: 1407 Address: DF:A9:FF:F6:B1:1A (OUI DF-A9-FF)
        Count: 1
        #67: len 27 (2 Kb/s)
        Latency: 77 msec (76-169 msec ~98 msec)
> HCI Event: Number of Completed Packets (0x13) plen 5      #71 [hci1] 6.707569
        Num handles: 1
        Handle: 1407 Address: DF:A9:FF:F6:B1:1A (OUI DF-A9-FF)
        Count: 1
        #68: len 15 (0 Kb/s)
        Latency: 163 msec (76-169 msec ~131 msec)
> ACL Data RX: Handle 1407 flags 0x02 dlen 21               #72 [hci1] 7.670438
      SMP: Pairing Confirm (0x03) len 16
        Confim value: 24321015d1eeacb6b8232b67c3237df1
< HCI Command: Host Number of Compl.. (0x03|0x0035) plen 5  #73 [hci1] 7.682707
        Num handles: 1
        Handle: 1407 Address: DF:A9:FF:F6:B1:1A (OUI DF-A9-FF)
        Count: 1
< ACL Data TX: Handle 1407 flags 0x00 dlen 21               #74 [hci1] 7.682788
      SMP: Pairing Confirm (0x03) len 16
        Confim value: d369e8398dc090870e068e5739a31e75
> HCI Event: Number of Completed Packets (0x13) plen 5      #75 [hci1] 7.845272
        Num handles: 1
        Handle: 1407 Address: DF:A9:FF:F6:B1:1A (OUI DF-A9-FF)
        Count: 1
        #74: len 21 (1 Kb/s)
        Latency: 162 msec (76-169 msec ~146 msec)
> ACL Data RX: Handle 1407 flags 0x02 dlen 21               #76 [hci1] 7.845663
      SMP: Pairing Random (0x04) len 16
        Random value: aa4607408e340fc50000000000000000
< HCI Command: Host Number of Compl.. (0x03|0x0035) plen 5  #77 [hci1] 7.863459
        Num handles: 1
        Handle: 1407 Address: DF:A9:FF:F6:B1:1A (OUI DF-A9-FF)
        Count: 1
< ACL Data TX: Handle 1407 flags 0x00 dlen 21               #78 [hci1] 7.863558
      SMP: Pairing Random (0x04) len 16
        Random value: 8e6108f966a694cbe26df70bb96773e6
> HCI Event: Number of Completed Packets (0x13) plen 5      #79 [hci1] 8.020128
        Num handles: 1
        Handle: 1407 Address: DF:A9:FF:F6:B1:1A (OUI DF-A9-FF)
        Count: 1
        #78: len 21 (1 Kb/s)
        Latency: 156 msec (76-169 msec ~151 msec)
> ACL Data RX: Handle 1407 flags 0x02 dlen 21               #80 [hci1] 8.107953
      SMP: Pairing Confirm (0x03) len 16
        Confim value: 801a3680949b33536a535b0c8f5f835c
< HCI Command: Host Number of Compl.. (0x03|0x0035) plen 5  #81 [hci1] 8.122839
        Num handles: 1
        Handle: 1407 Address: DF:A9:FF:F6:B1:1A (OUI DF-A9-FF)
        Count: 1
< ACL Data TX: Handle 1407 flags 0x00 dlen 21               #82 [hci1] 8.122948
      SMP: Pairing Confirm (0x03) len 16
        Confim value: 96abace994631b686304a09682b4bf5c
> HCI Event: Number of Completed Packets (0x13) plen 5      #83 [hci1] 8.282715
        Num handles: 1
        Handle: 1407 Address: DF:A9:FF:F6:B1:1A (OUI DF-A9-FF)
        Count: 1
        #82: len 21 (1 Kb/s)
        Latency: 159 msec (76-169 msec ~155 msec)
> ACL Data RX: Handle 1407 flags 0x02 dlen 21               #84 [hci1] 8.283103
      SMP: Pairing Random (0x04) len 16
        Random value: 18737be3eed511590000000000000000
< HCI Command: Host Number of Compl.. (0x03|0x0035) plen 5  #85 [hci1] 8.303355
        Num handles: 1
        Handle: 1407 Address: DF:A9:FF:F6:B1:1A (OUI DF-A9-FF)
        Count: 1
< ACL Data TX: Handle 1407 flags 0x00 dlen 21               #86 [hci1] 8.303520
      SMP: Pairing Random (0x04) len 16
        Random value: 4d02679f89a05211af56d8b3da64d21e
> HCI Event: Number of Completed Packets (0x13) plen 5      #87 [hci1] 8.457528
        Num handles: 1
        Handle: 1407 Address: DF:A9:FF:F6:B1:1A (OUI DF-A9-FF)
        Count: 1
        #86: len 21 (1 Kb/s)
        Latency: 154 msec (76-169 msec ~154 msec)
> ACL Data RX: Handle 1407 flags 0x02 dlen 21               #88 [hci1] 8.545504
      SMP: Pairing Confirm (0x03) len 16
        Confim value: eb714840672221640cea078d03c7e693
< HCI Command: Host Number of Compl.. (0x03|0x0035) plen 5  #89 [hci1] 8.563178
        Num handles: 1
        Handle: 1407 Address: DF:A9:FF:F6:B1:1A (OUI DF-A9-FF)
        Count: 1
< ACL Data TX: Handle 1407 flags 0x00 dlen 21               #90 [hci1] 8.563277
      SMP: Pairing Confirm (0x03) len 16
        Confim value: 735ca4680ecd0bdc87fa2794566ba7d1
> HCI Event: Number of Completed Packets (0x13) plen 5      #91 [hci1] 8.720289
        Num handles: 1
        Handle: 1407 Address: DF:A9:FF:F6:B1:1A (OUI DF-A9-FF)
        Count: 1
        #90: len 21 (1 Kb/s)
        Latency: 157 msec (76-169 msec ~155 msec)
> ACL Data RX: Handle 1407 flags 0x02 dlen 21               #92 [hci1] 8.720595
      SMP: Pairing Random (0x04) len 16
        Random value: 220e8d2d8d16e4b00000000000000000
< HCI Command: Host Number of Compl.. (0x03|0x0035) plen 5  #93 [hci1] 8.723234
        Num handles: 1
        Handle: 1407 Address: DF:A9:FF:F6:B1:1A (OUI DF-A9-FF)
        Count: 1
< ACL Data TX: Handle 1407 flags 0x00 dlen 21               #94 [hci1] 8.723342
      SMP: Pairing Random (0x04) len 16
        Random value: 5e8286bc235a02440d0c3424a2acf8fd
> HCI Event: Number of Completed Packets (0x13) plen 5      #95 [hci1] 8.895134
        Num handles: 1
        Handle: 1407 Address: DF:A9:FF:F6:B1:1A (OUI DF-A9-FF)
        Count: 1
        #94: len 21 (0 Kb/s)
        Latency: 171 msec (76-171 msec ~163 msec)
> ACL Data RX: Handle 1407 flags 0x02 dlen 21               #96 [hci1] 8.982914
      SMP: Pairing Confirm (0x03) len 16
        Confim value: 0f794b7f2ca38bb5a0e1b99a522fb78f
< HCI Command: Host Number of Compl.. (0x03|0x0035) plen 5  #97 [hci1] 9.003133
        Num handles: 1
        Handle: 1407 Address: DF:A9:FF:F6:B1:1A (OUI DF-A9-FF)
        Count: 1
< ACL Data TX: Handle 1407 flags 0x00 dlen 21               #98 [hci1] 9.003251
      SMP: Pairing Confirm (0x03) len 16
        Confim value: efe815304f89cabdc576a2ec8075ccaf
> HCI Event: Number of Completed Packets (0x13) plen 5      #99 [hci1] 9.157723
        Num handles: 1
        Handle: 1407 Address: DF:A9:FF:F6:B1:1A (OUI DF-A9-FF)
        Count: 1
        #98: len 21 (1 Kb/s)
        Latency: 154 msec (76-171 msec ~159 msec)
> ACL Data RX: Handle 1407 flags 0x02 dlen 21              #100 [hci1] 9.158049
      SMP: Pairing Random (0x04) len 16
        Random value: 35811339b1fa6e0b0000000000000000
< HCI Command: Host Number of Comp.. (0x03|0x0035) plen 5  #101 [hci1] 9.163054
        Num handles: 1
        Handle: 1407 Address: DF:A9:FF:F6:B1:1A (OUI DF-A9-FF)
        Count: 1
< ACL Data TX: Handle 1407 flags 0x00 dlen 21              #102 [hci1] 9.163173
      SMP: Pairing Random (0x04) len 16
        Random value: 5c4a1bcadd27bd58e945097b00bad7ac
> HCI Event: Number of Completed Packets (0x13) plen 5     #103 [hci1] 9.332568
        Num handles: 1
        Handle: 1407 Address: DF:A9:FF:F6:B1:1A (OUI DF-A9-FF)
        Count: 1
        #102: len 21 (0 Kb/s)
        Latency: 169 msec (76-171 msec ~164 msec)
> ACL Data RX: Handle 1407 flags 0x02 dlen 21              #104 [hci1] 9.420441
      SMP: Pairing Confirm (0x03) len 16
        Confim value: 824997f301b8131e524066f3942e02c1
< HCI Command: Host Number of Comp.. (0x03|0x0035) plen 5  #105 [hci1] 9.422694
        Num handles: 1
        Handle: 1407 Address: DF:A9:FF:F6:B1:1A (OUI DF-A9-FF)
        Count: 1
< ACL Data TX: Handle 1407 flags 0x00 dlen 21              #106 [hci1] 9.422766
      SMP: Pairing Confirm (0x03) len 16
        Confim value: d638ca5bbb1f7ac60c26b9b1589b4134
> HCI Event: Number of Completed Packets (0x13) plen 5     #107 [hci1] 9.595286
        Num handles: 1
        Handle: 1407 Address: DF:A9:FF:F6:B1:1A (OUI DF-A9-FF)
        Count: 1
        #106: len 21 (0 Kb/s)
        Latency: 172 msec (76-172 msec ~168 msec)
> ACL Data RX: Handle 1407 flags 0x02 dlen 21              #108 [hci1] 9.595552
      SMP: Pairing Random (0x04) len 16
        Random value: 203ec0311d5210460000000000000000
< HCI Command: Host Number of Comp.. (0x03|0x0035) plen 5  #109 [hci1] 9.603445
        Num handles: 1
        Handle: 1407 Address: DF:A9:FF:F6:B1:1A (OUI DF-A9-FF)
        Count: 1
< ACL Data TX: Handle 1407 flags 0x00 dlen 21              #110 [hci1] 9.603557
      SMP: Pairing Random (0x04) len 16
        Random value: 32527e6e64e79f33b2e374394db8ab2d
> HCI Event: Number of Completed Packets (0x13) plen 5     #111 [hci1] 9.770056
        Num handles: 1
        Handle: 1407 Address: DF:A9:FF:F6:B1:1A (OUI DF-A9-FF)
        Count: 1
        #110: len 21 (1 Kb/s)
        Latency: 166 msec (76-172 msec ~167 msec)
> ACL Data RX: Handle 1407 flags 0x02 dlen 21              #112 [hci1] 9.857911
      SMP: Pairing Confirm (0x03) len 16
        Confim value: fbea8eece63ea3f9c0b7fdb191b36584
< HCI Command: Host Number of Comp.. (0x03|0x0035) plen 5  #113 [hci1] 9.863162
        Num handles: 1
        Handle: 1407 Address: DF:A9:FF:F6:B1:1A (OUI DF-A9-FF)
        Count: 1
< ACL Data TX: Handle 1407 flags 0x00 dlen 21              #114 [hci1] 9.863312
      SMP: Pairing Confirm (0x03) len 16
        Confim value: babd3244e12609275632782955265729
> HCI Event: Number of Completed Packets (0x13) plen 5    #115 [hci1] 10.032760
        Num handles: 1
        Handle: 1407 Address: DF:A9:FF:F6:B1:1A (OUI DF-A9-FF)
        Count: 1
        #114: len 21 (0 Kb/s)
        Latency: 169 msec (76-172 msec ~168 msec)
> ACL Data RX: Handle 1407 flags 0x02 dlen 21             #116 [hci1] 10.033061
      SMP: Pairing Random (0x04) len 16
        Random value: d5b32786497c63320000000000000000
< HCI Command: Host Number of Com.. (0x03|0x0035) plen 5  #117 [hci1] 10.043318
        Num handles: 1
        Handle: 1407 Address: DF:A9:FF:F6:B1:1A (OUI DF-A9-FF)
        Count: 1
< ACL Data TX: Handle 1407 flags 0x00 dlen 21             #118 [hci1] 10.043496
      SMP: Pairing Random (0x04) len 16
        Random value: dddbdfe2838e9a8cc6964353c850fef7
> HCI Event: Number of Completed Packets (0x13) plen 5    #119 [hci1] 10.207579
        Num handles: 1
        Handle: 1407 Address: DF:A9:FF:F6:B1:1A (OUI DF-A9-FF)
        Count: 1
        #118: len 21 (1 Kb/s)
        Latency: 164 msec (76-172 msec ~166 msec)
> ACL Data RX: Handle 1407 flags 0x02 dlen 21             #120 [hci1] 10.295448
      SMP: Pairing Confirm (0x03) len 16
        Confim value: 370912897899853b218368eee86d0355
< HCI Command: Host Number of Com.. (0x03|0x0035) plen 5  #121 [hci1] 10.302931
        Num handles: 1
        Handle: 1407 Address: DF:A9:FF:F6:B1:1A (OUI DF-A9-FF)
        Count: 1
< ACL Data TX: Handle 1407 flags 0x00 dlen 21             #122 [hci1] 10.303003
      SMP: Pairing Confirm (0x03) len 16
        Confim value: 1400e08f79774cb7023f0e52bbaa9fc5
> HCI Event: Number of Completed Packets (0x13) plen 5    #123 [hci1] 10.470201
        Num handles: 1
        Handle: 1407 Address: DF:A9:FF:F6:B1:1A (OUI DF-A9-FF)
        Count: 1
        #122: len 21 (1 Kb/s)
        Latency: 167 msec (76-172 msec ~166 msec)
> ACL Data RX: Handle 1407 flags 0x02 dlen 21             #124 [hci1] 10.470530
      SMP: Pairing Random (0x04) len 16
        Random value: 9809074307edb3480000000000000000
< HCI Command: Host Number of Com.. (0x03|0x0035) plen 5  #125 [hci1] 10.483462
        Num handles: 1
        Handle: 1407 Address: DF:A9:FF:F6:B1:1A (OUI DF-A9-FF)
        Count: 1
< ACL Data TX: Handle 1407 flags 0x00 dlen 21             #126 [hci1] 10.483621
      SMP: Pairing Random (0x04) len 16
        Random value: eb9f1915536596b6fc3db1c86b2b1970
> HCI Event: Number of Completed Packets (0x13) plen 5    #127 [hci1] 10.645016
        Num handles: 1
        Handle: 1407 Address: DF:A9:FF:F6:B1:1A (OUI DF-A9-FF)
        Count: 1
        #126: len 21 (1 Kb/s)
        Latency: 161 msec (76-172 msec ~164 msec)
> ACL Data RX: Handle 1407 flags 0x02 dlen 21             #128 [hci1] 10.732838
      SMP: Pairing Confirm (0x03) len 16
        Confim value: f2843355c4902b29922fd4d97e286392
< HCI Command: Host Number of Com.. (0x03|0x0035) plen 5  #129 [hci1] 10.742960
        Num handles: 1
        Handle: 1407 Address: DF:A9:FF:F6:B1:1A (OUI DF-A9-FF)
        Count: 1
< ACL Data TX: Handle 1407 flags 0x00 dlen 21             #130 [hci1] 10.743109
      SMP: Pairing Confirm (0x03) len 16
        Confim value: 68f01d3875bdfd3522131ea5b19227f0
> HCI Event: Number of Completed Packets (0x13) plen 5    #131 [hci1] 10.907723
        Num handles: 1
        Handle: 1407 Address: DF:A9:FF:F6:B1:1A (OUI DF-A9-FF)
        Count: 1
        #130: len 21 (1 Kb/s)
        Latency: 164 msec (76-172 msec ~164 msec)
> ACL Data RX: Handle 1407 flags 0x02 dlen 21             #132 [hci1] 10.908021
      SMP: Pairing Random (0x04) len 16
        Random value: 395b5249f00015c60000000000000000
< HCI Command: Host Number of Com.. (0x03|0x0035) plen 5  #133 [hci1] 10.923356
        Num handles: 1
        Handle: 1407 Address: DF:A9:FF:F6:B1:1A (OUI DF-A9-FF)
        Count: 1
< ACL Data TX: Handle 1407 flags 0x00 dlen 21             #134 [hci1] 10.923529
      SMP: Pairing Random (0x04) len 16
        Random value: 5c794dc9ad9f2c3f295ebd5ad5e1c3cf
> HCI Event: Number of Completed Packets (0x13) plen 5    #135 [hci1] 11.082568
        Num handles: 1
        Handle: 1407 Address: DF:A9:FF:F6:B1:1A (OUI DF-A9-FF)
        Count: 1
        #134: len 21 (1 Kb/s)
        Latency: 159 msec (76-172 msec ~161 msec)
> ACL Data RX: Handle 1407 flags 0x02 dlen 21             #136 [hci1] 11.170389
      SMP: Pairing Confirm (0x03) len 16
        Confim value: c5b2d482b85ef3686db2037ded7f2fdc
< HCI Command: Host Number of Com.. (0x03|0x0035) plen 5  #137 [hci1] 11.183164
        Num handles: 1
        Handle: 1407 Address: DF:A9:FF:F6:B1:1A (OUI DF-A9-FF)
        Count: 1
< ACL Data TX: Handle 1407 flags 0x00 dlen 21             #138 [hci1] 11.183265
      SMP: Pairing Confirm (0x03) len 16
        Confim value: 3c50e479629163a1f6920d4eab18787d
> HCI Event: Number of Completed Packets (0x13) plen 5    #139 [hci1] 11.345260
        Num handles: 1
        Handle: 1407 Address: DF:A9:FF:F6:B1:1A (OUI DF-A9-FF)
        Count: 1
        #138: len 21 (1 Kb/s)
        Latency: 161 msec (76-172 msec ~161 msec)
> ACL Data RX: Handle 1407 flags 0x02 dlen 21             #140 [hci1] 11.345643
      SMP: Pairing Random (0x04) len 16
        Random value: 195d8b9744dacffa0000000000000000
< HCI Command: Host Number of Com.. (0x03|0x0035) plen 5  #141 [hci1] 11.363309
        Num handles: 1
        Handle: 1407 Address: DF:A9:FF:F6:B1:1A (OUI DF-A9-FF)
        Count: 1
< ACL Data TX: Handle 1407 flags 0x00 dlen 21             #142 [hci1] 11.363484
      SMP: Pairing Random (0x04) len 16
        Random value: 5c2fff312cdf99c9491988e877355a9a
> HCI Event: Number of Completed Packets (0x13) plen 5    #143 [hci1] 11.520087
        Num handles: 1
        Handle: 1407 Address: DF:A9:FF:F6:B1:1A (OUI DF-A9-FF)
        Count: 1
        #142: len 21 (1 Kb/s)
        Latency: 156 msec (76-172 msec ~159 msec)
> ACL Data RX: Handle 1407 flags 0x02 dlen 21             #144 [hci1] 11.607911
      SMP: Pairing Confirm (0x03) len 16
        Confim value: d40bec228fd5976a8ee60882ff196946
< HCI Command: Host Number of Com.. (0x03|0x0035) plen 5  #145 [hci1] 11.622956
        Num handles: 1
        Handle: 1407 Address: DF:A9:FF:F6:B1:1A (OUI DF-A9-FF)
        Count: 1
< ACL Data TX: Handle 1407 flags 0x00 dlen 21             #146 [hci1] 11.623098
      SMP: Pairing Confirm (0x03) len 16
        Confim value: 75e4720d3d348d63e102a4a551f98cb2
> HCI Event: Number of Completed Packets (0x13) plen 5    #147 [hci1] 11.782735
        Num handles: 1
        Handle: 1407 Address: DF:A9:FF:F6:B1:1A (OUI DF-A9-FF)
        Count: 1
        #146: len 21 (1 Kb/s)
        Latency: 159 msec (76-172 msec ~159 msec)
> ACL Data RX: Handle 1407 flags 0x02 dlen 21             #148 [hci1] 11.783082
      SMP: Pairing Random (0x04) len 16
        Random value: 20e4c181053814200000000000000000
< HCI Command: Host Number of Com.. (0x03|0x0035) plen 5  #149 [hci1] 11.803350
        Num handles: 1
        Handle: 1407 Address: DF:A9:FF:F6:B1:1A (OUI DF-A9-FF)
        Count: 1
< ACL Data TX: Handle 1407 flags 0x00 dlen 21             #150 [hci1] 11.803526
      SMP: Pairing Random (0x04) len 16
        Random value: c629a3a987d808e808655d558dfc1155
> HCI Event: Number of Completed Packets (0x13) plen 5    #151 [hci1] 11.957511
        Num handles: 1
        Handle: 1407 Address: DF:A9:FF:F6:B1:1A (OUI DF-A9-FF)
        Count: 1
        #150: len 21 (1 Kb/s)
        Latency: 153 msec (76-172 msec ~156 msec)
> ACL Data RX: Handle 1407 flags 0x02 dlen 21             #152 [hci1] 12.045326
      SMP: Pairing Confirm (0x03) len 16
        Confim value: 0c215eeba6d5c116ce9b8991cae940ca
< HCI Command: Host Number of Com.. (0x03|0x0035) plen 5  #153 [hci1] 12.063128
        Num handles: 1
        Handle: 1407 Address: DF:A9:FF:F6:B1:1A (OUI DF-A9-FF)
        Count: 1
< ACL Data TX: Handle 1407 flags 0x00 dlen 21             #154 [hci1] 12.063247
      SMP: Pairing Confirm (0x03) len 16
        Confim value: a7954fd01a67988c52e6a43b777139f6
> HCI Event: Number of Completed Packets (0x13) plen 5    #155 [hci1] 12.220319
        Num handles: 1
        Handle: 1407 Address: DF:A9:FF:F6:B1:1A (OUI DF-A9-FF)
        Count: 1
        #154: len 21 (1 Kb/s)
        Latency: 157 msec (76-172 msec ~156 msec)
> ACL Data RX: Handle 1407 flags 0x02 dlen 21             #156 [hci1] 12.220663
      SMP: Pairing Random (0x04) len 16
        Random value: f3ccadf000aaab320000000000000000
< HCI Command: Host Number of Com.. (0x03|0x0035) plen 5  #157 [hci1] 12.223359
        Num handles: 1
        Handle: 1407 Address: DF:A9:FF:F6:B1:1A (OUI DF-A9-FF)
        Count: 1
< ACL Data TX: Handle 1407 flags 0x00 dlen 21             #158 [hci1] 12.223420
      SMP: Pairing Random (0x04) len 16
        Random value: 92f20f6ad8f13724432c7fd6001c45ff
> HCI Event: Number of Completed Packets (0x13) plen 5    #159 [hci1] 12.395239
        Num handles: 1
        Handle: 1407 Address: DF:A9:FF:F6:B1:1A (OUI DF-A9-FF)
        Count: 1
        #158: len 21 (0 Kb/s)
        Latency: 171 msec (76-172 msec ~164 msec)
> ACL Data RX: Handle 1407 flags 0x02 dlen 21             #160 [hci1] 12.482992
      SMP: Pairing Confirm (0x03) len 16
        Confim value: 55e67de7053c1416c58881374541132e
< HCI Command: Host Number of Com.. (0x03|0x0035) plen 5  #161 [hci1] 12.503245
        Num handles: 1
        Handle: 1407 Address: DF:A9:FF:F6:B1:1A (OUI DF-A9-FF)
        Count: 1
< ACL Data TX: Handle 1407 flags 0x00 dlen 21             #162 [hci1] 12.503361
      SMP: Pairing Confirm (0x03) len 16
        Confim value: 9312fac525e3090a27e911a355ae2ea5
> HCI Event: Number of Completed Packets (0x13) plen 5    #163 [hci1] 12.657744
        Num handles: 1
        Handle: 1407 Address: DF:A9:FF:F6:B1:1A (OUI DF-A9-FF)
        Count: 1
        #162: len 21 (1 Kb/s)
        Latency: 154 msec (76-172 msec ~159 msec)
> ACL Data RX: Handle 1407 flags 0x02 dlen 21             #164 [hci1] 12.658088
      SMP: Pairing Random (0x04) len 16
        Random value: ff978bf6310b9ef80000000000000000
< HCI Command: Host Number of Com.. (0x03|0x0035) plen 5  #165 [hci1] 12.663400
        Num handles: 1
        Handle: 1407 Address: DF:A9:FF:F6:B1:1A (OUI DF-A9-FF)
        Count: 1
< ACL Data TX: Handle 1407 flags 0x00 dlen 21             #166 [hci1] 12.663543
      SMP: Pairing Random (0x04) len 16
        Random value: 23ac32ebbb5e14c8a6b9622f296d277f
> HCI Event: Number of Completed Packets (0x13) plen 5    #167 [hci1] 12.832466
        Num handles: 1
        Handle: 1407 Address: DF:A9:FF:F6:B1:1A (OUI DF-A9-FF)
        Count: 1
        #166: len 21 (1 Kb/s)
        Latency: 168 msec (76-172 msec ~164 msec)
> ACL Data RX: Handle 1407 flags 0x02 dlen 21             #168 [hci1] 12.920366
      SMP: Pairing Confirm (0x03) len 16
        Confim value: 3f7b1c3b7adbd5d95da5fbff946dce67
< HCI Command: Host Number of Com.. (0x03|0x0035) plen 5  #169 [hci1] 12.923225
        Num handles: 1
        Handle: 1407 Address: DF:A9:FF:F6:B1:1A (OUI DF-A9-FF)
        Count: 1
< ACL Data TX: Handle 1407 flags 0x00 dlen 21             #170 [hci1] 12.923360
      SMP: Pairing Confirm (0x03) len 16
        Confim value: 3e4211e5c8e0b3310b49fc63c634a3f8
> HCI Event: Number of Completed Packets (0x13) plen 5    #171 [hci1] 13.095302
        Num handles: 1
        Handle: 1407 Address: DF:A9:FF:F6:B1:1A (OUI DF-A9-FF)
        Count: 1
        #170: len 21 (0 Kb/s)
        Latency: 171 msec (76-172 msec ~168 msec)
> ACL Data RX: Handle 1407 flags 0x02 dlen 21             #172 [hci1] 13.095535
      SMP: Pairing Random (0x04) len 16
        Random value: eb572bc15b18a1be0000000000000000
< HCI Command: Host Number of Com.. (0x03|0x0035) plen 5  #173 [hci1] 13.103368
        Num handles: 1
        Handle: 1407 Address: DF:A9:FF:F6:B1:1A (OUI DF-A9-FF)
        Count: 1
< ACL Data TX: Handle 1407 flags 0x00 dlen 21             #174 [hci1] 13.103522
      SMP: Pairing Random (0x04) len 16
        Random value: 297efe85e67448a15f56bd27e3a3cf1d
> HCI Event: Number of Completed Packets (0x13) plen 5    #175 [hci1] 13.270014
        Num handles: 1
        Handle: 1407 Address: DF:A9:FF:F6:B1:1A (OUI DF-A9-FF)
        Count: 1
        #174: len 21 (1 Kb/s)
        Latency: 166 msec (76-172 msec ~167 msec)
> ACL Data RX: Handle 1407 flags 0x02 dlen 21             #176 [hci1] 13.357871
      SMP: Pairing Confirm (0x03) len 16
        Confim value: 42b89f12f458779ef6d9c60c9a8e84fc
< HCI Command: Host Number of Com.. (0x03|0x0035) plen 5  #177 [hci1] 13.363194
        Num handles: 1
        Handle: 1407 Address: DF:A9:FF:F6:B1:1A (OUI DF-A9-FF)
        Count: 1
< ACL Data TX: Handle 1407 flags 0x00 dlen 21             #178 [hci1] 13.363349
      SMP: Pairing Confirm (0x03) len 16
        Confim value: 50d150acb11dc3c10ca4eb1351dacd87
> HCI Event: Number of Completed Packets (0x13) plen 5    #179 [hci1] 13.532677
        Num handles: 1
        Handle: 1407 Address: DF:A9:FF:F6:B1:1A (OUI DF-A9-FF)
        Count: 1
        #178: len 21 (0 Kb/s)
        Latency: 169 msec (76-172 msec ~168 msec)
> ACL Data RX: Handle 1407 flags 0x02 dlen 21             #180 [hci1] 13.532978
      SMP: Pairing Random (0x04) len 16
        Random value: 4e8e8caff1af5c0d0000000000000000
< HCI Command: Host Number of Com.. (0x03|0x0035) plen 5  #181 [hci1] 13.543398
        Num handles: 1
        Handle: 1407 Address: DF:A9:FF:F6:B1:1A (OUI DF-A9-FF)
        Count: 1
< ACL Data TX: Handle 1407 flags 0x00 dlen 21             #182 [hci1] 13.543551
      SMP: Pairing Random (0x04) len 16
        Random value: 25a9493fd3ce4faf02be7293595bb7c6
> HCI Event: Number of Completed Packets (0x13) plen 5    #183 [hci1] 13.707425
        Num handles: 1
        Handle: 1407 Address: DF:A9:FF:F6:B1:1A (OUI DF-A9-FF)
        Count: 1
        #182: len 21 (1 Kb/s)
        Latency: 163 msec (76-172 msec ~166 msec)
> ACL Data RX: Handle 1407 flags 0x02 dlen 21             #184 [hci1] 13.795310
      SMP: Pairing Confirm (0x03) len 16
        Confim value: f567de4b14da74f85ce16553c18e3caa
< HCI Command: Host Number of Com.. (0x03|0x0035) plen 5  #185 [hci1] 13.803158
        Num handles: 1
        Handle: 1407 Address: DF:A9:FF:F6:B1:1A (OUI DF-A9-FF)
        Count: 1
< ACL Data TX: Handle 1407 flags 0x00 dlen 21             #186 [hci1] 13.803245
      SMP: Pairing Confirm (0x03) len 16
        Confim value: 6c1509ce3239da4d783be40c589850cf
> HCI Event: Number of Completed Packets (0x13) plen 5    #187 [hci1] 13.970222
        Num handles: 1
        Handle: 1407 Address: DF:A9:FF:F6:B1:1A (OUI DF-A9-FF)
        Count: 1
        #186: len 21 (1 Kb/s)
        Latency: 166 msec (76-172 msec ~166 msec)
> ACL Data RX: Handle 1407 flags 0x02 dlen 21             #188 [hci1] 13.970537
      SMP: Pairing Random (0x04) len 16
        Random value: 811368752bc2e30c0000000000000000
< HCI Command: Host Number of Com.. (0x03|0x0035) plen 5  #189 [hci1] 13.983463
        Num handles: 1
        Handle: 1407 Address: DF:A9:FF:F6:B1:1A (OUI DF-A9-FF)
        Count: 1
< ACL Data TX: Handle 1407 flags 0x00 dlen 21             #190 [hci1] 13.983576
      SMP: Pairing Random (0x04) len 16
        Random value: 58f6b41f855a6f6c3560debd84e2affc
> HCI Event: Number of Completed Packets (0x13) plen 5    #191 [hci1] 14.144923
        Num handles: 1
        Handle: 1407 Address: DF:A9:FF:F6:B1:1A (OUI DF-A9-FF)
        Count: 1
        #190: len 21 (1 Kb/s)
        Latency: 161 msec (76-172 msec ~163 msec)
> ACL Data RX: Handle 1407 flags 0x02 dlen 21             #192 [hci1] 14.232892
      SMP: Pairing Confirm (0x03) len 16
        Confim value: 15ce36239c89e4956e23e25911aea33b
< HCI Command: Host Number of Com.. (0x03|0x0035) plen 5  #193 [hci1] 14.242931
        Num handles: 1
        Handle: 1407 Address: DF:A9:FF:F6:B1:1A (OUI DF-A9-FF)
        Count: 1
< ACL Data TX: Handle 1407 flags 0x00 dlen 21             #194 [hci1] 14.243002
      SMP: Pairing Confirm (0x03) len 16
        Confim value: 88899fc15e744c4963d48b11584147a9
> HCI Event: Number of Completed Packets (0x13) plen 5    #195 [hci1] 14.407763
        Num handles: 1
        Handle: 1407 Address: DF:A9:FF:F6:B1:1A (OUI DF-A9-FF)
        Count: 1
        #194: len 21 (1 Kb/s)
        Latency: 164 msec (76-172 msec ~164 msec)
> ACL Data RX: Handle 1407 flags 0x02 dlen 21             #196 [hci1] 14.408108
      SMP: Pairing Random (0x04) len 16
        Random value: b2e4205432f3a42a0000000000000000
< HCI Command: Host Number of Com.. (0x03|0x0035) plen 5  #197 [hci1] 14.423447
        Num handles: 1
        Handle: 1407 Address: DF:A9:FF:F6:B1:1A (OUI DF-A9-FF)
        Count: 1
< ACL Data TX: Handle 1407 flags 0x00 dlen 21             #198 [hci1] 14.423497
      SMP: Pairing Random (0x04) len 16
        Random value: b67e7216d5bf664139eda2b542549666
> HCI Event: Number of Completed Packets (0x13) plen 5    #199 [hci1] 14.582484
        Num handles: 1
        Handle: 1407 Address: DF:A9:FF:F6:B1:1A (OUI DF-A9-FF)
        Count: 1
        #198: len 21 (1 Kb/s)
        Latency: 158 msec (76-172 msec ~161 msec)
> ACL Data RX: Handle 1407 flags 0x02 dlen 21             #200 [hci1] 14.670255
      SMP: Pairing Confirm (0x03) len 16
        Confim value: 93142d32f1e15fbeeec55afc426e0825
< HCI Command: Host Number of Com.. (0x03|0x0035) plen 5  #201 [hci1] 14.683099
        Num handles: 1
        Handle: 1407 Address: DF:A9:FF:F6:B1:1A (OUI DF-A9-FF)
        Count: 1
< ACL Data TX: Handle 1407 flags 0x00 dlen 21             #202 [hci1] 14.683290
      SMP: Pairing Confirm (0x03) len 16
        Confim value: 1eadb81a192bc3fab1f6f860b81c3d25
> HCI Event: Number of Completed Packets (0x13) plen 5    #203 [hci1] 14.845169
        Num handles: 1
        Handle: 1407 Address: DF:A9:FF:F6:B1:1A (OUI DF-A9-FF)
        Count: 1
        #202: len 21 (1 Kb/s)
        Latency: 161 msec (76-172 msec ~161 msec)
> ACL Data RX: Handle 1407 flags 0x02 dlen 21             #204 [hci1] 14.845470
      SMP: Pairing Random (0x04) len 16
        Random value: 3ba834ea011ba8e20000000000000000
< HCI Command: Host Number of Com.. (0x03|0x0035) plen 5  #205 [hci1] 14.863466
        Num handles: 1
        Handle: 1407 Address: DF:A9:FF:F6:B1:1A (OUI DF-A9-FF)
        Count: 1
< ACL Data TX: Handle 1407 flags 0x00 dlen 21             #206 [hci1] 14.863566
      SMP: Pairing Random (0x04) len 16
        Random value: ed17f76500c95219dd01e09d1e63f87b
> HCI Event: Number of Completed Packets (0x13) plen 5    #207 [hci1] 15.020041
        Num handles: 1
        Handle: 1407 Address: DF:A9:FF:F6:B1:1A (OUI DF-A9-FF)
        Count: 1
        #206: len 21 (1 Kb/s)
        Latency: 156 msec (76-172 msec ~159 msec)
> ACL Data RX: Handle 1407 flags 0x02 dlen 21             #208 [hci1] 15.107771
      SMP: Pairing Confirm (0x03) len 16
        Confim value: 416ec94c1e15d64922f1ba4ac50f46be
< HCI Command: Host Number of Com.. (0x03|0x0035) plen 5  #209 [hci1] 15.123158
        Num handles: 1
        Handle: 1407 Address: DF:A9:FF:F6:B1:1A (OUI DF-A9-FF)
        Count: 1
< ACL Data TX: Handle 1407 flags 0x00 dlen 21             #210 [hci1] 15.123383
      SMP: Pairing Confirm (0x03) len 16
        Confim value: 4f310f6fe4e926863d990731edcfb4e7
> HCI Event: Number of Completed Packets (0x13) plen 5    #211 [hci1] 15.282768
        Num handles: 1
        Handle: 1407 Address: DF:A9:FF:F6:B1:1A (OUI DF-A9-FF)
        Count: 1
        #210: len 21 (1 Kb/s)
        Latency: 159 msec (76-172 msec ~159 msec)
> ACL Data RX: Handle 1407 flags 0x02 dlen 21             #212 [hci1] 15.282952
      SMP: Pairing Random (0x04) len 16
        Random value: 3d78a31802aa2a0f0000000000000000
< HCI Command: Host Number of Com.. (0x03|0x0035) plen 5  #213 [hci1] 15.303275
        Num handles: 1
        Handle: 1407 Address: DF:A9:FF:F6:B1:1A (OUI DF-A9-FF)
        Count: 1
< ACL Data TX: Handle 1407 flags 0x00 dlen 21             #214 [hci1] 15.303512
      SMP: Pairing Random (0x04) len 16
        Random value: 81d35d47e1f6006d79c974bd9d9e1ee3
> HCI Event: Number of Completed Packets (0x13) plen 5    #215 [hci1] 15.457460
        Num handles: 1
        Handle: 1407 Address: DF:A9:FF:F6:B1:1A (OUI DF-A9-FF)
        Count: 1
        #214: len 21 (1 Kb/s)
        Latency: 153 msec (76-172 msec ~156 msec)
> ACL Data RX: Handle 1407 flags 0x02 dlen 21             #216 [hci1] 15.545263
      SMP: Pairing Confirm (0x03) len 16
        Confim value: 25aa1815f188179517ac72865c8a6d4a
< HCI Command: Host Number of Com.. (0x03|0x0035) plen 5  #217 [hci1] 15.563237
        Num handles: 1
        Handle: 1407 Address: DF:A9:FF:F6:B1:1A (OUI DF-A9-FF)
        Count: 1
< ACL Data TX: Handle 1407 flags 0x00 dlen 21             #218 [hci1] 15.563337
      SMP: Pairing Confirm (0x03) len 16
        Confim value: eb75e217897ae90e2b00e99024c8958f
> HCI Event: Number of Completed Packets (0x13) plen 5    #219 [hci1] 15.720272
        Num handles: 1
        Handle: 1407 Address: DF:A9:FF:F6:B1:1A (OUI DF-A9-FF)
        Count: 1
        #218: len 21 (1 Kb/s)
        Latency: 156 msec (76-172 msec ~156 msec)
> ACL Data RX: Handle 1407 flags 0x02 dlen 21             #220 [hci1] 15.720458
      SMP: Pairing Random (0x04) len 16
        Random value: 7f740581ce700aad0000000000000000
< HCI Command: Host Number of Com.. (0x03|0x0035) plen 5  #221 [hci1] 15.723365
        Num handles: 1
        Handle: 1407 Address: DF:A9:FF:F6:B1:1A (OUI DF-A9-FF)
        Count: 1
< ACL Data TX: Handle 1407 flags 0x00 dlen 21             #222 [hci1] 15.723480
      SMP: Pairing Random (0x04) len 16
        Random value: e7f7e0c2476823e41736a7e381bafb7c
> HCI Event: Number of Completed Packets (0x13) plen 5    #223 [hci1] 15.894960
        Num handles: 1
        Handle: 1407 Address: DF:A9:FF:F6:B1:1A (OUI DF-A9-FF)
        Count: 1
        #222: len 21 (0 Kb/s)
        Latency: 171 msec (76-172 msec ~164 msec)
> ACL Data RX: Handle 1407 flags 0x02 dlen 21             #224 [hci1] 15.982924
      SMP: Pairing Confirm (0x03) len 16
        Confim value: fa3e39eedf5267817c4c4e1cdf5ccdf0
< HCI Command: Host Number of Com.. (0x03|0x0035) plen 5  #225 [hci1] 16.003226
        Num handles: 1
        Handle: 1407 Address: DF:A9:FF:F6:B1:1A (OUI DF-A9-FF)
        Count: 1
< ACL Data TX: Handle 1407 flags 0x00 dlen 21             #226 [hci1] 16.003329
      SMP: Pairing Confirm (0x03) len 16
        Confim value: f941aa6694cad5a055ca2c6b85d86125
> HCI Event: Number of Completed Packets (0x13) plen 5    #227 [hci1] 16.157600
        Num handles: 1
        Handle: 1407 Address: DF:A9:FF:F6:B1:1A (OUI DF-A9-FF)
        Count: 1
        #226: len 21 (1 Kb/s)
        Latency: 154 msec (76-172 msec ~159 msec)
> ACL Data RX: Handle 1407 flags 0x02 dlen 21             #228 [hci1] 16.157959
      SMP: Pairing Random (0x04) len 16
        Random value: db8bcddaa165f23d0000000000000000
