Bluetooth monitor ver 5.72
= Note: Linux version 6.14.0-36-generic (x86_64)                       0.652197
= Note: Bluetooth subsystem version 2.22                               0.652199
= New Index: 00:00:00:00:00:00 (Primary,UART,hci1)              [hci1] 0.652200
= New Index: 48:5F:99:8E:E0:64 (Primary,USB,hci0)               [hci0] 0.652218
= Open Index: 00:00:00:00:00:00                                 [hci1] 1.166056
= Index Info: 00:00:00:00:00:00 (Nordic Semiconductor ASA)      [hci1] 1.166077
@ USER Open: main (privileged) version 2.22            {0x0001} [hci1] 1.166087
< HCI Command: Reset (0x03|0x0003) plen 0                    #1 [hci1] 1.167347
> HCI Event: Command Complete (0x0e) plen 4                  #2 [hci1] 1.167840
      Reset (0x03|0x0003) ncmd 1
        Status: Success (0x00)
< HCI Command: Read Local Supported... (0x04|0x0003) plen 0  #3 [hci1] 1.185478
> HCI Event: Command Complete (0x0e) plen 12                 #4 [hci1] 1.186107
      Read Local Supported Features (0x04|0x0003) ncmd 1
        Status: Success (0x00)
        Features: 0x00 0x00 0x00 0x00 0x60 0x00 0x00 0x00
          BR/EDR Not Supported
          LE Supported (Controller)
< HCI Command: Read Local Version In.. (0x04|0x0001) plen 0  #5 [hci1] 1.205448
> HCI Event: Command Complete (0x0e) plen 12                 #6 [hci1] 1.205920
      Read Local Version Information (0x04|0x0001) ncmd 1
        Status: Success (0x00)
        HCI version: Reserved (0x0f) - Revision 12393 (0x3069)
        LMP version: Reserved (0x0f) - Subversion 12393 (0x3069)
        Manufacturer: Nordic Semiconductor ASA (89)
< HCI Command: Read Local Supported... (0x04|0x0002) plen 0  #7 [hci1] 1.225479
> HCI Event: Command Complete (0x0e) plen 68                 #8 [hci1] 1.226534
      Read Local Supported Commands (0x04|0x0002) ncmd 1
        Status: Success (0x00)
        Commands: 119 entries
          Disconnect (Octet 0 - Bit 5)
          Read Remote Version Information (Octet 2 - Bit 7)
          Set Event Mask (Octet 5 - Bit 6)
          Reset (Octet 5 - Bit 7)
          Read Connection Accept Timeout (Octet 7 - Bit 2)
          Write Connection Accept Timeout (Octet 7 - Bit 3)
          Read Transmit Power Level (Octet 10 - Bit 2)
          Set Controller To Host Flow Control (Octet 10 - Bit 5)
          Host Buffer Size (Octet 10 - Bit 6)
          Host Number of Completed Packets (Octet 10 - Bit 7)
          Read Local Version Information (Octet 14 - Bit 3)
          Read Local Supported Features (Octet 14 - Bit 5)
          Read BD ADDR (Octet 15 - Bit 1)
          Read RSSI (Octet 15 - Bit 5)
          Set Event Mask Page 2 (Octet 22 - Bit 2)
          LE Set Event Mask (Octet 25 - Bit 0)
          LE Read Buffer Size (Octet 25 - Bit 1)
          LE Read Local Supported Features (Octet 25 - Bit 2)
          LE Set Random Address (Octet 25 - Bit 4)
          LE Set Advertising Parameters (Octet 25 - Bit 5)
          LE Read Advertising Channel TX Power (Octet 25 - Bit 6)
          LE Set Advertising Data (Octet 25 - Bit 7)
          LE Set Scan Response Data (Octet 26 - Bit 0)
          LE Set Advertise Enable (Octet 26 - Bit 1)
          LE Set Scan Parameters (Octet 26 - Bit 2)
          LE Set Scan Enable (Octet 26 - Bit 3)
          LE Create Connection (Octet 26 - Bit 4)
          LE Create Connection Cancel (Octet 26 - Bit 5)
          LE Read Accept List Size (Octet 26 - Bit 6)
          LE Clear Accept List (Octet 26 - Bit 7)
          LE Add Device To Accept List (Octet 27 - Bit 0)
          LE Remove Device From Accept List (Octet 27 - Bit 1)
          LE Connection Update (Octet 27 - Bit 2)
          LE Set Host Channel Classification (Octet 27 - Bit 3)
          LE Read Channel Map (Octet 27 - Bit 4)
          LE Read Remote Used Features (Octet 27 - Bit 5)
          LE Encrypt (Octet 27 - Bit 6)
          LE Rand (Octet 27 - Bit 7)
          LE Start Encryption (Octet 28 - Bit 0)
          LE Long Term Key Request Reply (Octet 28 - Bit 1)
          LE Long Term Key Request Neg Reply (Octet 28 - Bit 2)
          LE Read Supported States (Octet 28 - Bit 3)
          LE Receiver Test (Octet 28 - Bit 4)
          LE Transmitter Test (Octet 28 - Bit 5)
          LE Test End (Octet 28 - Bit 6)
          Read Authenticated Payload Timeout (Octet 32 - Bit 4)
          Write Authenticated Payload Timeout (Octet 32 - Bit 5)
          LE Set Data Length (Octet 33 - Bit 6)
          LE Read Suggested Default Data Length (Octet 33 - Bit 7)
          LE Write Suggested Default Data Length (Octet 34 - Bit 0)
          LE Add Device To Resolving List (Octet 34 - Bit 3)
          LE Remove Device From Resolving List (Octet 34 - Bit 4)
          LE Clear Resolving List (Octet 34 - Bit 5)
          LE Read Resolving List Size (Octet 34 - Bit 6)
          LE Set Address Resolution Enable (Octet 35 - Bit 1)
          LE Set Resolvable Private Address Timeout (Octet 35 - Bit 2)
          LE Read Maximum Data Length (Octet 35 - Bit 3)
          LE Read PHY (Octet 35 - Bit 4)
          LE Set Default PHY (Octet 35 - Bit 5)
          LE Set PHY (Octet 35 - Bit 6)
          LE Enhanced Receiver Test (Octet 35 - Bit 7)
          LE Enhanced Transmitter Test (Octet 36 - Bit 0)
          LE Set Advertising Set Random Address (Octet 36 - Bit 1)
          LE Set Extended Advertising Parameters (Octet 36 - Bit 2)
          LE Set Extended Advertising Data (Octet 36 - Bit 3)
          LE Set Extended Scan Response Data (Octet 36 - Bit 4)
          LE Set Extended Advertising Enable (Octet 36 - Bit 5)
          LE Read Maximum Advertising Data Length (Octet 36 - Bit 6)
          LE Read Number of Supported Advertising Sets (Octet 36 - Bit 7)
          LE Remove Advertising Set (Octet 37 - Bit 0)
          LE Clear Advertising Sets (Octet 37 - Bit 1)
          LE Set Periodic Advertising Parameters (Octet 37 - Bit 2)
          LE Set Periodic Advertising Data (Octet 37 - Bit 3)
          LE Set Periodic Advertising Enable (Octet 37 - Bit 4)
          LE Set Extended Scan Parameters (Octet 37 - Bit 5)
          LE Set Extended Scan Enable (Octet 37 - Bit 6)
          LE Extended Create Connection (Octet 37 - Bit 7)
          LE Periodic Advertising Create Sync (Octet 38 - Bit 0)
          LE Periodic Advertising Create Sync Cancel (Octet 38 - Bit 1)
          LE Periodic Advertising Terminate Sync (Octet 38 - Bit 2)
          LE Add Device To Periodic Advertiser List (Octet 38 - Bit 3)
          LE Remove Device From Periodic Advertiser List (Octet 38 - Bit 4)
          LE Clear Periodic Advertiser List (Octet 38 - Bit 5)
          LE Read Periodic Advertiser List Size (Octet 38 - Bit 6)
          LE Read Transmit Power (Octet 38 - Bit 7)
          LE Read RF Path Compensation (Octet 39 - Bit 0)
          LE Write RF Path Compensation (Octet 39 - Bit 1)
          LE Set Privacy Mode (Octet 39 - Bit 2)
          LE Periodic Advertising Receive Enable (Octet 40 - Bit 5)
          LE Periodic Advertising Sync Transfer (Octet 40 - Bit 6)
          LE Periodic Advertising Set Info Transfer (Octet 40 - Bit 7)
          LE Periodic Advertising Sync Transfer Parameters (Octet 41 - Bit 0)
          LE Set Default Periodic Advertisng Sync Transfer Parameters (Octet 41 - Bit 1)
          LE Read Buffer v2 (Octet 41 - Bit 5)
          LE Read ISO TX Sync (Octet 41 - Bit 6)
          LE Set Connected Isochronous Group Parameters (Octet 41 - Bit 7)
          LE Set Connected Isochronous Group Parameters Test (Octet 42 - Bit 0)
          LE Create Connected Isochronous Stream (Octet 42 - Bit 1)
          LE Remove Connected Isochronous Group (Octet 42 - Bit 2)
          LE Accept Connected Isochronous Stream Request (Octet 42 - Bit 3)
          LE Reject Connected Isochronous Stream Request (Octet 42 - Bit 4)
          LE Create Broadcast Isochronous Group (Octet 42 - Bit 5)
          LE Create Broadcast Isochronous Group Test (Octet 42 - Bit 6)
          LE Terminate Broadcast Isochronous Group (Octet 42 - Bit 7)
          LE Broadcast Isochronous Group Create Sync (Octet 43 - Bit 0)
          LE Broadcast Isochronous Group Terminate Sync (Octet 43 - Bit 1)
          LE Request Peer SCA (Octet 43 - Bit 2)
          LE Setup Isochronous Data Path (Octet 43 - Bit 3)
          LE Remove Isochronous Data Path (Octet 43 - Bit 4)
          LE Isochronous Transmit Test (Octet 43 - Bit 5)
          LE Isochronous Receive Test (Octet 43 - Bit 6)
          LE Isochronous Read Test Counters (Octet 43 - Bit 7)
          LE Isochronous Read Test Counters (Octet 44 - Bit 0)
          LE Set Host Feature (Octet 44 - Bit 1)
          Octet 44 - Bit 2 
          Octet 45 - Bit 6 
          Octet 46 - Bit 0 
          Octet 46 - Bit 1 
          Octet 46 - Bit 2 
< HCI Command: Host Buffer Size (0x03|0x0033) plen 7         #9 [hci1] 1.245468
        ACL MTU: 255  ACL max packet: 16
        SCO MTU: 0    SCO max packet: 0
> HCI Event: Command Complete (0x0e) plen 4                 #10 [hci1] 1.246068
      Host Buffer Size (0x03|0x0033) ncmd 1
        Status: Success (0x00)
< HCI Command: Set Controller To Ho.. (0x03|0x0031) plen 1  #11 [hci1] 1.265460
        Flow control: ACL Data Packets (0x01)
> HCI Event: Command Complete (0x0e) plen 4                 #12 [hci1] 1.265928
      Set Controller To Host Flow Control (0x03|0x0031) ncmd 1
        Status: Success (0x00)
< HCI Command: LE Read Local Suppor.. (0x08|0x0003) plen 0  #13 [hci1] 1.285449
> HCI Event: Command Complete (0x0e) plen 12                #14 [hci1] 1.286061
      LE Read Local Supported Features (0x08|0x0003) ncmd 1
        Status: Success (0x00)
        Features: 0xfd 0x79 0x00 0xf7 0x30 0x01 0x00 0x00
          LE Encryption
          Extended Reject Indication
          Peripheral-initiated Features Exchange
          LE Ping
          LE Data Packet Length Extension
          LL Privacy
          Extended Scanner Filter Policies
          LE 2M PHY
          LE Coded PHY
          LE Extended Advertising
          LE Periodic Advertising
          Channel Selection Algorithm #2
          Periodic Advertising Sync Transfer - Sender
          Periodic Advertising Sync Transfer - Recipient
          Sleep Clock Accuracy Updates
          Connected Isochronous Stream - Central
          Connected Isochronous Stream - Peripheral
          Isochronous Broadcaster
          Synchronized Receiver
          Periodic Advertising ADI support
          Connection Subrating
          Unknown features (0x0000010000000000)
< HCI Command: LE Set Host Feature (0x08|0x0074) plen 2     #15 [hci1] 1.305463
        Bit Number: 32
          Connected Isochronous Stream (Host Support)
        Bit Value: 1
> HCI Event: Command Complete (0x0e) plen 4                 #16 [hci1] 1.305939
      LE Set Host Feature (0x08|0x0074) ncmd 1
        Status: Success (0x00)
< HCI Command: LE Read Buffer v2 (0x08|0x0060) plen 0       #17 [hci1] 1.325432
> HCI Event: Command Complete (0x0e) plen 10                #18 [hci1] 1.326067
      LE Read Buffer v2 (0x08|0x0060) ncmd 1
        Status: Success (0x00)
        ACL MTU: 27
        ACL max packet: 3
        ISO MTU: 318
        ISO max packet: 3
< HCI Command: LE Read Maximum Adve.. (0x08|0x003a) plen 0  #19 [hci1] 1.345473
> HCI Event: Command Complete (0x0e) plen 6                 #20 [hci1] 1.345891
      LE Read Maximum Advertising Data Length (0x08|0x003a) ncmd 1
        Status: Success (0x00)
        Max length: 1650
< HCI Command: LE Read Supported St.. (0x08|0x001c) plen 0  #21 [hci1] 1.365390
> HCI Event: Command Complete (0x0e) plen 12                #22 [hci1] 1.365843
      LE Read Supported States (0x08|0x001c) ncmd 1
        Status: Success (0x00)
        States: 0x000003ff3e0306ff
          Non-connectable Advertising State
          Scannable Advertising State
          Connectable Advertising State
          High Duty Cycle Directed Advertising State
          Passive Scanning State
          Active Scanning State
          Initiating State
            and Connection State (Central Role)
          Connection State (Peripheral Role)
          Scannable Advertising State
            and Passive Scanning State
          Connectable Advertising State
            and Passive Scanning State
          Non-connectable Advertising State
            and Initiating State
          Scannable Advertising State
            and Initiating State
          Active Scanning State
            and Connection State (Central Role)
          Passive Scanning State
            and Connection State (Peripheral Role)
          Active Scanning State
            and Connection State (Peripheral Role)
          Initiating State
            and Connection State (Central Role)
            and Central Role & Central Role
          Low Duty Cycle Directed Advertising State
          Connectable Advertising State
            and Initiating State
            and Central Role & Peripheral Role
          High Duty Cycle Directed Advertising State
            and Initiating State
            and Central Role & Peripheral Role
          Low Duty Cycle Directed Advertising State
            and Initiating State
            and Central Role & Peripheral Role
          Connectable Advertising State
            and Connection State (Central Role)
            and Central Role & Peripheral Role
          High Duty Cycle Directed Advertising State
            and Connection State (Central Role)
            and Central Role & Peripheral Role
          Low Duty Cycle Directed Advertising State
            and Connection State (Central Role)
            and Central Role & Peripheral Role
          Connectable Advertising State
            and Connection State (Peripheral Role)
            and Central Role & Peripheral Role
          High Duty Cycle Directed Advertising State
            and Connection State (Peripheral Role)
            and Peripheral Role & Peripheral Role
          Low Duty Cycle Directed Advertising State
            and Connection State (Peripheral Role)
            and Peripheral Role & Peripheral Role
          Initiating State
            and Connection State (Peripheral Role)
            and Central Role & Peripheral Role
< HCI Command: LE Read Maximum Data.. (0x08|0x002f) plen 0  #23 [hci1] 1.385436
> HCI Event: Command Complete (0x0e) plen 12                #24 [hci1] 1.385924
      LE Read Maximum Data Length (0x08|0x002f) ncmd 1
        Status: Success (0x00)
        Max TX octets: 251
        Max TX time: 2704
        Max RX octets: 251
        Max RX time: 2704
< HCI Command: LE Write Suggested D.. (0x08|0x0024) plen 4  #25 [hci1] 1.405446
        TX octets: 251
        TX time: 2704
> HCI Event: Command Complete (0x0e) plen 4                 #26 [hci1] 1.405988
      LE Write Suggested Default Data Length (0x08|0x0024) ncmd 1
        Status: Success (0x00)
< HCI Command: LE Read Resolving Li.. (0x08|0x002a) plen 0  #27 [hci1] 1.425430
> HCI Event: Command Complete (0x0e) plen 5                 #28 [hci1] 1.425907
      LE Read Resolving List Size (0x08|0x002a) ncmd 1
        Status: Success (0x00)
        Size: 8
< HCI Command: LE Set Event Mask (0x08|0x0001) plen 8       #29 [hci1] 1.445451
        Mask: 0x000002023f87fa5e
          LE Advertising Report
          LE Connection Update Complete
          LE Read Remote Used Features Complete
          LE Long Term Key Request
          LE Data Length Change
          LE Enhanced Connection Complete
          LE PHY Update Complete
          LE Extended Advertising Report
          LE Periodic Advertising Sync Established
          LE Periodic Advertising Report
          LE Periodic Advertising Sync Lost
          LE Extended Scan Timeout
          LE Extended Advertising Set Terminated
          LE Scan Request Received
          LE Periodic Advertising Sync Transfer Rvc
          LE CIS Established
          LE CIS Request
          LE Create BIG Complete
          LE Terminate BIG Complete
          LE BIG Sync Estabilished Complete
          LE BIG Sync Lost
          LE BIG Info Advertising Report
          Unknown mask (0x0000020000000000)
> HCI Event: Command Complete (0x0e) plen 4                 #30 [hci1] 1.446041
      LE Set Event Mask (0x08|0x0001) ncmd 1
        Status: Success (0x00)
< HCI Command: Set Event Mask (0x03|0x0001) plen 8          #31 [hci1] 1.465452
        Mask: 0x2000800002008890
          Disconnection Complete
          Encryption Change
          Read Remote Version Information Complete
          Hardware Error
          Data Buffer Overflow
          Encryption Key Refresh Complete
          LE Meta
> HCI Event: Command Complete (0x0e) plen 4                 #32 [hci1] 1.466061
      Set Event Mask (0x03|0x0001) ncmd 1
        Status: Success (0x00)
< HCI Command: Read BD ADDR (0x04|0x0009) plen 0            #33 [hci1] 1.485451
> HCI Event: Command Complete (0x0e) plen 10                #34 [hci1] 1.486061
      Read BD ADDR (0x04|0x0009) ncmd 1
        Status: Success (0x00)
        Address: 00:00:00:00:00:00 (OUI 00-00-00)
< HCI Command: LE Set Random Address (0x08|0x0005) plen 6   #35 [hci1] 1.505460
        Address: D5:B6:CC:31:DB:3B (Static)
> HCI Event: Command Complete (0x0e) plen 4                 #36 [hci1] 1.506069
      LE Set Random Address (0x08|0x0005) ncmd 1
        Status: Success (0x00)
< HCI Command: LE Set Extended Adv.. (0x08|0x0036) plen 25  #37 [hci1] 3.965976
        Handle: 0x00
        Properties: 0x0013
          Connectable
          Scannable
          Use legacy advertising PDUs: ADV_IND
        Min advertising interval: 100.000 msec (0x00a0)
        Max advertising interval: 150.000 msec (0x00f0)
        Channel map: 37, 38, 39 (0x07)
        Own address type: Random (0x01)
        Peer address type: Public (0x00)
        Peer address: 00:00:00:00:00:00 (OUI 00-00-00)
        Filter policy: Allow Scan Request from Any, Allow Connect Request from Any (0x00)
        TX power: Host has no preference (0x7f)
        Primary PHY: LE 1M (0x01)
        Secondary max skip: 0x00
        Secondary PHY: LE 1M (0x01)
        SID: 0x00
        Scan request notifications: Disabled (0x00)
> HCI Event: Command Complete (0x0e) plen 5                 #38 [hci1] 3.966863
      LE Set Extended Advertising Parameters (0x08|0x0036) ncmd 1
        Status: Success (0x00)
        TX power (selected): 0 dbm (0x00)
< HCI Command: LE Set Advertising S.. (0x08|0x0035) plen 7  #39 [hci1] 3.985477
        Advertising handle: 0x00
        Advertising random address: D5:B6:CC:31:DB:3B (Static)
> HCI Event: Command Complete (0x0e) plen 4                 #40 [hci1] 3.985935
      LE Set Advertising Set Random Address (0x08|0x0035) ncmd 1
        Status: Success (0x00)
< HCI Command: LE Set Extended Adv.. (0x08|0x0037) plen 22  #41 [hci1] 4.005464
        Handle: 0x00
        Operation: Complete extended advertising data (0x03)
        Fragment preference: Minimize fragmentation (0x01)
        Data length: 0x12
        Flags: 0x06
          LE General Discoverable Mode
          BR/EDR Not Supported
        Name (complete): Tester_F6B11A
> HCI Event: Command Complete (0x0e) plen 4                 #42 [hci1] 4.006140
      LE Set Extended Advertising Data (0x08|0x0037) ncmd 1
        Status: Success (0x00)
< HCI Command: LE Set Extended Scan.. (0x08|0x0038) plen 4  #43 [hci1] 4.025446
        Handle: 0x00
        Operation: Complete scan response data (0x03)
        Fragment preference: Minimize fragmentation (0x01)
        Data length: 0x00
> HCI Event: Command Complete (0x0e) plen 4                 #44 [hci1] 4.025917
      LE Set Extended Scan Response Data (0x08|0x0038) ncmd 1
        Status: Success (0x00)
< HCI Command: LE Set Extended Adve.. (0x08|0x0039) plen 6  #45 [hci1] 4.045459
        Extended advertising: Enabled (0x01)
        Number of sets: 1 (0x01)
        Entry 0
          Handle: 0x00
          Duration: 0 ms (0x00)
          Max ext adv events: 0
> HCI Event: Command Complete (0x0e) plen 4                 #46 [hci1] 4.046091
      LE Set Extended Advertising Enable (0x08|0x0039) ncmd 1
        Status: Success (0x00)
> HCI Event: LE Meta Event (0x3e) plen 31                   #47 [hci1] 4.165244
      LE Enhanced Connection Complete (0x0a)
        Status: Success (0x00)
        Handle: 111
        Role: Peripheral (0x01)
        Peer address type: Public (0x00)
        Peer address: DF:A9:FF:F6:B1:1A (OUI DF-A9-FF)
        Local resolvable private address: 00:00:00:00:00:00 (Non-Resolvable)
        Peer resolvable private address: 00:00:00:00:00:00 (Non-Resolvable)
        Connection interval: 87.50 msec (0x0046)
        Connection latency: 0 (0x0000)
        Supervision timeout: 25120 msec (0x09d0)
        Central clock accuracy: 0x01
> HCI Event: LE Meta Event (0x3e) plen 6                    #48 [hci1] 4.165373
      LE Advertising Set Terminated (0x12)
        Status: Success (0x00)
        Handle: 0
        Connection handle: 111
        Number of completed extended advertising events: 0
< HCI Command: LE Read Remote Used... (0x08|0x0016) plen 2  #49 [hci1] 4.166024
        Handle: 111 Address: DF:A9:FF:F6:B1:1A (OUI DF-A9-FF)
< ACL Data TX: Handle 111 flags 0x00 dlen 7                 #50 [hci1] 4.166040
      ATT: Exchange MTU Request (0x02) len 2
        Client RX MTU: 251
> HCI Event: Command Status (0x0f) plen 4                   #51 [hci1] 4.166641
      LE Read Remote Used Features (0x08|0x0016) ncmd 1
        Status: Success (0x00)
> HCI Event: Number of Completed Packets (0x13) plen 5      #52 [hci1] 4.341213
        Num handles: 1
        Handle: 111 Address: DF:A9:FF:F6:B1:1A (OUI DF-A9-FF)
        Count: 1
        #50: len 7 (0 Kb/s)
        Latency: 175 msec (175-175 msec ~175 msec)
> HCI Event: LE Meta Event (0x3e) plen 12                   #53 [hci1] 4.429123
      LE Read Remote Used Features (0x04)
        Status: Success (0x00)
        Handle: 111 Address: DF:A9:FF:F6:B1:1A (OUI DF-A9-FF)
        Features: 0x2d 0x49 0x00 0xf7 0x67 0xd8 0x00 0x00
          LE Encryption
          Extended Reject Indication
          Peripheral-initiated Features Exchange
          LE Data Packet Length Extension
          LE 2M PHY
          LE Coded PHY
          Channel Selection Algorithm #2
          Periodic Advertising Sync Transfer - Sender
          Periodic Advertising Sync Transfer - Recipient
          Sleep Clock Accuracy Updates
          Connected Isochronous Stream - Central
          Connected Isochronous Stream - Peripheral
          Isochronous Broadcaster
          Synchronized Receiver
          Connected Isochronous Stream (Host Support)
          LE Power Control Request
          LE Power Control Request
          Connection Subrating
          Connection Subrating (Host Support)
          Unknown features (0x0000d80000000000)
> ACL Data RX: Handle 111 flags 0x02 dlen 11                #54 [hci1] 6.878762
      SMP: Pairing Request (0x01) len 6
        IO capability: KeyboardDisplay (0x04)
        OOB data: Authentication data not present (0x00)
        Authentication requirement: Bonding, MITM, SC, No Keypresses (0x0d)
        Max encryption key size: 16
        Initiator key distribution: EncKey IdKey (0x03)
        Responder key distribution: EncKey IdKey Sign (0x07)
> ACL Data RX: Handle 111 flags 0x02 dlen 7                 #55 [hci1] 6.879280
      ATT: Exchange MTU Response (0x03) len 2
        Server RX MTU: 23
< HCI Command: Host Number of Compl.. (0x03|0x0035) plen 5  #56 [hci1] 6.885853
        Num handles: 1
        Handle: 111 Address: DF:A9:FF:F6:B1:1A (OUI DF-A9-FF)
        Count: 1
< ACL Data TX: Handle 111 flags 0x00 dlen 11                #57 [hci1] 6.886073
      SMP: Pairing Response (0x02) len 6
        IO capability: DisplayOnly (0x00)
        OOB data: Authentication data not present (0x00)
        Authentication requirement: Bonding, No MITM, SC, No Keypresses (0x09)
        Max encryption key size: 16
        Initiator key distribution: IdKey (0x02)
        Responder key distribution: <none> (0x00)
< HCI Command: Host Number of Compl.. (0x03|0x0035) plen 5  #58 [hci1] 6.886173
        Num handles: 1
        Handle: 111 Address: DF:A9:FF:F6:B1:1A (OUI DF-A9-FF)
        Count: 1
> HCI Event: Number of Completed Packets (0x13) plen 5      #59 [hci1] 7.053855
        Num handles: 1
        Handle: 111 Address: DF:A9:FF:F6:B1:1A (OUI DF-A9-FF)
        Count: 1
        #57: len 11 (0 Kb/s)
        Latency: 167 msec (167-175 msec ~171 msec)
> ACL Data RX: Handle 111 flags 0x02 dlen 27                #60 [hci1] 7.054180
> ACL Data RX: Handle 111 flags 0x01 dlen 27                #61 [hci1] 7.054729
> ACL Data RX: Handle 111 flags 0x01 dlen 15                #62 [hci1] 7.055164
      SMP: Pairing Public Key (0x0c) len 64
        X: 32b008910377a63093c270bfff81b8e1c99c9daf957f185a680565710b052cc9
        Y: 19cf6bf327ebe5cffa21e8ac932c49a5f1c675eb76974cbc61c7c4b0e0ad7670
< HCI Command: Host Number of Compl.. (0x03|0x0035) plen 5  #63 [hci1] 7.066375
        Num handles: 1
        Handle: 111 Address: DF:A9:FF:F6:B1:1A (OUI DF-A9-FF)
        Count: 1
< HCI Command: Host Number of Compl.. (0x03|0x0035) plen 5  #64 [hci1] 7.066492
        Num handles: 1
        Handle: 111 Address: DF:A9:FF:F6:B1:1A (OUI DF-A9-FF)
        Count: 1
< HCI Command: Host Number of Compl.. (0x03|0x0035) plen 5  #65 [hci1] 7.066909
        Num handles: 1
        Handle: 111 Address: DF:A9:FF:F6:B1:1A (OUI DF-A9-FF)
        Count: 1
< ACL Data TX: Handle 111 flags 0x00 dlen 27                #66 [hci1] 7.067154
< ACL Data TX: Handle 111 flags 0x01 dlen 27                #67 [hci1] 7.067172
< ACL Data TX: Handle 111 flags 0x01 dlen 15                #68 [hci1] 7.067179
      SMP: Pairing Public Key (0x0c) len 64
        X: 98308440221e2d910f0e54b71e7ec652857aa9b5a0dc65028824cc19db1226e9
        Y: 67a4816bcb62efb21701e31fdb27561a6217575fb007a8bbdabe7e28b6f68482
> HCI Event: Number of Completed Packets (0x13) plen 5      #69 [hci1] 7.141854
        Num handles: 1
        Handle: 111 Address: DF:A9:FF:F6:B1:1A (OUI DF-A9-FF)
        Count: 1
        #66: len 27 (2 Kb/s)
        Latency: 74 msec (74-175 msec ~123 msec)
> HCI Event: Number of Completed Packets (0x13) plen 5      #70 [hci1] 7.142473
        Num handles: 1
        Handle: 111 Address: DF:A9:FF:F6:B1:1A (OUI DF-A9-FF)
        Count: 1
        #67: len 27 (2 Kb/s)
        Latency: 75 msec (74-175 msec ~99 msec)
> HCI Event: Number of Completed Packets (0x13) plen 5      #71 [hci1] 7.228718
        Num handles: 1
        Handle: 111 Address: DF:A9:FF:F6:B1:1A (OUI DF-A9-FF)
        Count: 1
        #68: len 15 (0 Kb/s)
        Latency: 161 msec (74-175 msec ~130 msec)
> ACL Data RX: Handle 111 flags 0x02 dlen 21                #72 [hci1] 8.191420
      SMP: Pairing Confirm (0x03) len 16
        Confim value: ab3d4b9290dc27f6ebcea19240ceadb6
< HCI Command: Host Number of Compl.. (0x03|0x0035) plen 5  #73 [hci1] 8.205876
        Num handles: 1
        Handle: 111 Address: DF:A9:FF:F6:B1:1A (OUI DF-A9-FF)
        Count: 1
< ACL Data TX: Handle 111 flags 0x00 dlen 21                #74 [hci1] 8.206024
      SMP: Pairing Confirm (0x03) len 16
        Confim value: bc38577f16221f402726219d2119b34c
> HCI Event: Number of Completed Packets (0x13) plen 5      #75 [hci1] 8.366245
        Num handles: 1
        Handle: 111 Address: DF:A9:FF:F6:B1:1A (OUI DF-A9-FF)
        Count: 1
        #74: len 21 (1 Kb/s)
        Latency: 160 msec (74-175 msec ~145 msec)
> ACL Data RX: Handle 111 flags 0x02 dlen 21                #76 [hci1] 8.366678
      SMP: Pairing Random (0x04) len 16
        Random value: 7ba97530e209efca0000000000000000
< HCI Command: Host Number of Compl.. (0x03|0x0035) plen 5  #77 [hci1] 8.385870
        Num handles: 1
        Handle: 111 Address: DF:A9:FF:F6:B1:1A (OUI DF-A9-FF)
        Count: 1
< ACL Data TX: Handle 111 flags 0x00 dlen 21                #78 [hci1] 8.385954
      SMP: Pairing Random (0x04) len 16
        Random value: 8e6108f966a694cbe26df70bb96773e6
> HCI Event: Number of Completed Packets (0x13) plen 5      #79 [hci1] 8.541096
        Num handles: 1
        Handle: 111 Address: DF:A9:FF:F6:B1:1A (OUI DF-A9-FF)
        Count: 1
        #78: len 21 (1 Kb/s)
        Latency: 155 msec (74-175 msec ~150 msec)
> ACL Data RX: Handle 111 flags 0x02 dlen 21                #80 [hci1] 8.628932
      SMP: Pairing Confirm (0x03) len 16
        Confim value: 85e2486b51e356aedb00afd0b71a42e4
< HCI Command: Host Number of Compl.. (0x03|0x0035) plen 5  #81 [hci1] 8.645948
        Num handles: 1
        Handle: 111 Address: DF:A9:FF:F6:B1:1A (OUI DF-A9-FF)
        Count: 1
< ACL Data TX: Handle 111 flags 0x00 dlen 21                #82 [hci1] 8.646359
      SMP: Pairing Confirm (0x03) len 16
        Confim value: 340f6f9c79d05e2d0db8036fbbe4e644
> HCI Event: Number of Completed Packets (0x13) plen 5      #83 [hci1] 8.803845
        Num handles: 1
        Handle: 111 Address: DF:A9:FF:F6:B1:1A (OUI DF-A9-FF)
        Count: 1
        #82: len 21 (1 Kb/s)
        Latency: 157 msec (74-175 msec ~153 msec)
> ACL Data RX: Handle 111 flags 0x02 dlen 21                #84 [hci1] 8.804111
      SMP: Pairing Random (0x04) len 16
        Random value: 51c50d09e3d1747e0000000000000000
< HCI Command: Host Number of Compl.. (0x03|0x0035) plen 5  #85 [hci1] 8.806089
        Num handles: 1
        Handle: 111 Address: DF:A9:FF:F6:B1:1A (OUI DF-A9-FF)
        Count: 1
< ACL Data TX: Handle 111 flags 0x00 dlen 21                #86 [hci1] 8.806161
      SMP: Pairing Random (0x04) len 16
        Random value: 4d02679f89a05211af56d8b3da64d21e
> HCI Event: Number of Completed Packets (0x13) plen 5      #87 [hci1] 8.978511
        Num handles: 1
        Handle: 111 Address: DF:A9:FF:F6:B1:1A (OUI DF-A9-FF)
        Count: 1
        #86: len 21 (0 Kb/s)
        Latency: 172 msec (74-175 msec ~163 msec)
> ACL Data RX: Handle 111 flags 0x02 dlen 21                #88 [hci1] 9.066489
      SMP: Pairing Confirm (0x03) len 16
        Confim value: bf8610a26d63bd812d98105d172c363c
< HCI Command: Host Number of Compl.. (0x03|0x0035) plen 5  #89 [hci1] 9.085704
        Num handles: 1
        Handle: 111 Address: DF:A9:FF:F6:B1:1A (OUI DF-A9-FF)
        Count: 1
< ACL Data TX: Handle 111 flags 0x00 dlen 21                #90 [hci1] 9.085837
      SMP: Pairing Confirm (0x03) len 16
        Confim value: cffeecbe1833c96ab38a872bbfaf634c
> HCI Event: Number of Completed Packets (0x13) plen 5      #91 [hci1] 9.241301
        Num handles: 1
        Handle: 111 Address: DF:A9:FF:F6:B1:1A (OUI DF-A9-FF)
        Count: 1
        #90: len 21 (1 Kb/s)
        Latency: 155 msec (74-175 msec ~159 msec)
> ACL Data RX: Handle 111 flags 0x02 dlen 21                #92 [hci1] 9.241584
      SMP: Pairing Random (0x04) len 16
        Random value: 4ea5be41c4dcacdf0000000000000000
< HCI Command: Host Number of Compl.. (0x03|0x0035) plen 5  #93 [hci1] 9.246116
        Num handles: 1
        Handle: 111 Address: DF:A9:FF:F6:B1:1A (OUI DF-A9-FF)
        Count: 1
< ACL Data TX: Handle 111 flags 0x00 dlen 21                #94 [hci1] 9.246277
      SMP: Pairing Random (0x04) len 16
        Random value: 5e8286bc235a02440d0c3424a2acf8fd
> HCI Event: Number of Completed Packets (0x13) plen 5      #95 [hci1] 9.416174
        Num handles: 1
        Handle: 111 Address: DF:A9:FF:F6:B1:1A (OUI DF-A9-FF)
        Count: 1
        #94: len 21 (0 Kb/s)
        Latency: 169 msec (74-175 msec ~164 msec)
> ACL Data RX: Handle 111 flags 0x02 dlen 21                #96 [hci1] 9.503942
      SMP: Pairing Confirm (0x03) len 16
        Confim value: e7a9f48ee7e37d2fe9d45bbf5321585c
< HCI Command: Host Number of Compl.. (0x03|0x0035) plen 5  #97 [hci1] 9.505598
        Num handles: 1
        Handle: 111 Address: DF:A9:FF:F6:B1:1A (OUI DF-A9-FF)
        Count: 1
< ACL Data TX: Handle 111 flags 0x00 dlen 21                #98 [hci1] 9.505687
      SMP: Pairing Confirm (0x03) len 16
        Confim value: 39b89612fbba2d47505e19b9effb95b4
> HCI Event: Number of Completed Packets (0x13) plen 5      #99 [hci1] 9.678810
        Num handles: 1
        Handle: 111 Address: DF:A9:FF:F6:B1:1A (OUI DF-A9-FF)
        Count: 1
        #98: len 21 (0 Kb/s)
        Latency: 173 msec (74-175 msec ~168 msec)
> ACL Data RX: Handle 111 flags 0x02 dlen 21               #100 [hci1] 9.679103
      SMP: Pairing Random (0x04) len 16
        Random value: 4e17b1b503546ae60000000000000000
< HCI Command: Host Number of Comp.. (0x03|0x0035) plen 5  #101 [hci1] 9.686108
        Num handles: 1
        Handle: 111 Address: DF:A9:FF:F6:B1:1A (OUI DF-A9-FF)
        Count: 1
< ACL Data TX: Handle 111 flags 0x00 dlen 21               #102 [hci1] 9.686285
      SMP: Pairing Random (0x04) len 16
        Random value: 5c4a1bcadd27bd58e945097b00bad7ac
> HCI Event: Number of Completed Packets (0x13) plen 5     #103 [hci1] 9.853555
        Num handles: 1
        Handle: 111 Address: DF:A9:FF:F6:B1:1A (OUI DF-A9-FF)
        Count: 1
        #102: len 21 (1 Kb/s)
        Latency: 167 msec (74-175 msec ~168 msec)
> ACL Data RX: Handle 111 flags 0x02 dlen 21               #104 [hci1] 9.941454
      SMP: Pairing Confirm (0x03) len 16
        Confim value: b9564985406ee7d85f9255bf690b463e
< HCI Command: Host Number of Comp.. (0x03|0x0035) plen 5  #105 [hci1] 9.945760
        Num handles: 1
        Handle: 111 Address: DF:A9:FF:F6:B1:1A (OUI DF-A9-FF)
        Count: 1
< ACL Data TX: Handle 111 flags 0x00 dlen 21               #106 [hci1] 9.945893
      SMP: Pairing Confirm (0x03) len 16
        Confim value: a2caaed713aea89e2a3cb5d6c2e36347
> HCI Event: Number of Completed Packets (0x13) plen 5    #107 [hci1] 10.116272
        Num handles: 1
        Handle: 111 Address: DF:A9:FF:F6:B1:1A (OUI DF-A9-FF)
        Count: 1
        #106: len 21 (0 Kb/s)
        Latency: 170 msec (74-175 msec ~169 msec)
> ACL Data RX: Handle 111 flags 0x02 dlen 21              #108 [hci1] 10.116539
      SMP: Pairing Random (0x04) len 16
        Random value: 37e16cdc6e083deb0000000000000000
< HCI Command: Host Number of Com.. (0x03|0x0035) plen 5  #109 [hci1] 10.125532
        Num handles: 1
        Handle: 111 Address: DF:A9:FF:F6:B1:1A (OUI DF-A9-FF)
        Count: 1
< ACL Data TX: Handle 111 flags 0x00 dlen 21              #110 [hci1] 10.125694
      SMP: Pairing Random (0x04) len 16
        Random value: 32527e6e64e79f33b2e374394db8ab2d
> HCI Event: Number of Completed Packets (0x13) plen 5    #111 [hci1] 10.291105
        Num handles: 1
        Handle: 111 Address: DF:A9:FF:F6:B1:1A (OUI DF-A9-FF)
        Count: 1
        #110: len 21 (1 Kb/s)
        Latency: 165 msec (74-175 msec ~167 msec)
> ACL Data RX: Handle 111 flags 0x02 dlen 21              #112 [hci1] 10.378930
      SMP: Pairing Confirm (0x03) len 16
        Confim value: ff02ddb0b030ff4b5216b6823318d535
< HCI Command: Host Number of Com.. (0x03|0x0035) plen 5  #113 [hci1] 10.385546
        Num handles: 1
        Handle: 111 Address: DF:A9:FF:F6:B1:1A (OUI DF-A9-FF)
        Count: 1
< ACL Data TX: Handle 111 flags 0x00 dlen 21              #114 [hci1] 10.385581
      SMP: Pairing Confirm (0x03) len 16
        Confim value: 7e453e37803f1c7313d7782d2f23d1c2
> HCI Event: Number of Completed Packets (0x13) plen 5    #115 [hci1] 10.553628
        Num handles: 1
        Handle: 111 Address: DF:A9:FF:F6:B1:1A (OUI DF-A9-FF)
        Count: 1
        #114: len 21 (1 Kb/s)
        Latency: 168 msec (74-175 msec ~167 msec)
> ACL Data RX: Handle 111 flags 0x02 dlen 21              #116 [hci1] 10.554095
      SMP: Pairing Random (0x04) len 16
        Random value: d711883d4ff7358a0000000000000000
< HCI Command: Host Number of Com.. (0x03|0x0035) plen 5  #117 [hci1] 10.565484
        Num handles: 1
        Handle: 111 Address: DF:A9:FF:F6:B1:1A (OUI DF-A9-FF)
        Count: 1
< ACL Data TX: Handle 111 flags 0x00 dlen 21              #118 [hci1] 10.565521
      SMP: Pairing Random (0x04) len 16
        Random value: dddbdfe2838e9a8cc6964353c850fef7
> HCI Event: Number of Completed Packets (0x13) plen 5    #119 [hci1] 10.728526
        Num handles: 1
        Handle: 111 Address: DF:A9:FF:F6:B1:1A (OUI DF-A9-FF)
        Count: 1
        #118: len 21 (1 Kb/s)
        Latency: 163 msec (74-175 msec ~165 msec)
> ACL Data RX: Handle 111 flags 0x02 dlen 21              #120 [hci1] 10.816381
      SMP: Pairing Confirm (0x03) len 16
        Confim value: cf22a82b9b53eb24874de4065ddfc6d3
< HCI Command: Host Number of Com.. (0x03|0x0035) plen 5  #121 [hci1] 10.825645
        Num handles: 1
        Handle: 111 Address: DF:A9:FF:F6:B1:1A (OUI DF-A9-FF)
        Count: 1
< ACL Data TX: Handle 111 flags 0x00 dlen 21              #122 [hci1] 10.825689
      SMP: Pairing Confirm (0x03) len 16
        Confim value: e8234a39a64f5378360f4ad6d8bf8a70
> HCI Event: Number of Completed Packets (0x13) plen 5    #123 [hci1] 10.991365
        Num handles: 1
        Handle: 111 Address: DF:A9:FF:F6:B1:1A (OUI DF-A9-FF)
        Count: 1
        #122: len 21 (1 Kb/s)
        Latency: 165 msec (74-175 msec ~165 msec)
> ACL Data RX: Handle 111 flags 0x02 dlen 21              #124 [hci1] 10.991602
      SMP: Pairing Random (0x04) len 16
        Random value: 50d738d0c9d249ee0000000000000000
< HCI Command: Host Number of Com.. (0x03|0x0035) plen 5  #125 [hci1] 11.006387
        Num handles: 1
        Handle: 111 Address: DF:A9:FF:F6:B1:1A (OUI DF-A9-FF)
        Count: 1
< ACL Data TX: Handle 111 flags 0x00 dlen 21              #126 [hci1] 11.006481
      SMP: Pairing Random (0x04) len 16
        Random value: eb9f1915536596b6fc3db1c86b2b1970
> HCI Event: Number of Completed Packets (0x13) plen 5    #127 [hci1] 11.166026
        Num handles: 1
        Handle: 111 Address: DF:A9:FF:F6:B1:1A (OUI DF-A9-FF)
        Count: 1
        #126: len 21 (1 Kb/s)
        Latency: 159 msec (74-175 msec ~162 msec)
> ACL Data RX: Handle 111 flags 0x02 dlen 21              #128 [hci1] 11.253858
      SMP: Pairing Confirm (0x03) len 16
        Confim value: e12ac3bcb363357a74488bc9e59e87a7
< HCI Command: Host Number of Com.. (0x03|0x0035) plen 5  #129 [hci1] 11.265991
        Num handles: 1
        Handle: 111 Address: DF:A9:FF:F6:B1:1A (OUI DF-A9-FF)
        Count: 1
< ACL Data TX: Handle 111 flags 0x00 dlen 21              #130 [hci1] 11.266124
      SMP: Pairing Confirm (0x03) len 16
        Confim value: bd232cc82caf1a2f2c49fb9df017d32c
> HCI Event: Number of Completed Packets (0x13) plen 5    #131 [hci1] 11.428702
        Num handles: 1
        Handle: 111 Address: DF:A9:FF:F6:B1:1A (OUI DF-A9-FF)
        Count: 1
        #130: len 21 (1 Kb/s)
        Latency: 162 msec (74-175 msec ~162 msec)
> ACL Data RX: Handle 111 flags 0x02 dlen 21              #132 [hci1] 11.428995
      SMP: Pairing Random (0x04) len 16
        Random value: a35503ee218a019c0000000000000000
< HCI Command: Host Number of Com.. (0x03|0x0035) plen 5  #133 [hci1] 11.446306
        Num handles: 1
        Handle: 111 Address: DF:A9:FF:F6:B1:1A (OUI DF-A9-FF)
        Count: 1
< ACL Data TX: Handle 111 flags 0x00 dlen 21              #134 [hci1] 11.446426
      SMP: Pairing Random (0x04) len 16
        Random value: 5c794dc9ad9f2c3f295ebd5ad5e1c3cf
> HCI Event: Number of Completed Packets (0x13) plen 5    #135 [hci1] 11.603497
        Num handles: 1
        Handle: 111 Address: DF:A9:FF:F6:B1:1A (OUI DF-A9-FF)
        Count: 1
        #134: len 21 (1 Kb/s)
        Latency: 157 msec (74-175 msec ~159 msec)
> ACL Data RX: Handle 111 flags 0x02 dlen 21              #136 [hci1] 11.691411
      SMP: Pairing Confirm (0x03) len 16
        Confim value: 34be546b92704413ee9f6ab649645ae0
< HCI Command: Host Number of Com.. (0x03|0x0035) plen 5  #137 [hci1] 11.705990
        Num handles: 1
        Handle: 111 Address: DF:A9:FF:F6:B1:1A (OUI DF-A9-FF)
        Count: 1
< ACL Data TX: Handle 111 flags 0x00 dlen 21              #138 [hci1] 11.706195
      SMP: Pairing Confirm (0x03) len 16
        Confim value: ad797280ff45e8aad266ab054a7b875f
> HCI Event: Number of Completed Packets (0x13) plen 5    #139 [hci1] 11.866314
        Num handles: 1
        Handle: 111 Address: DF:A9:FF:F6:B1:1A (OUI DF-A9-FF)
        Count: 1
        #138: len 21 (1 Kb/s)
        Latency: 160 msec (74-175 msec ~159 msec)
> ACL Data RX: Handle 111 flags 0x02 dlen 21              #140 [hci1] 11.866499
      SMP: Pairing Random (0x04) len 16
        Random value: ca4d605cdf651b3a0000000000000000
< HCI Command: Host Number of Com.. (0x03|0x0035) plen 5  #141 [hci1] 11.886246
        Num handles: 1
        Handle: 111 Address: DF:A9:FF:F6:B1:1A (OUI DF-A9-FF)
        Count: 1
< ACL Data TX: Handle 111 flags 0x00 dlen 21              #142 [hci1] 11.886400
      SMP: Pairing Random (0x04) len 16
        Random value: 5c2fff312cdf99c9491988e877355a9a
> HCI Event: Number of Completed Packets (0x13) plen 5    #143 [hci1] 12.041026
        Num handles: 1
        Handle: 111 Address: DF:A9:FF:F6:B1:1A (OUI DF-A9-FF)
        Count: 1
        #142: len 21 (1 Kb/s)
        Latency: 154 msec (74-175 msec ~157 msec)
> ACL Data RX: Handle 111 flags 0x02 dlen 21              #144 [hci1] 12.128808
      SMP: Pairing Confirm (0x03) len 16
        Confim value: ce9b28a8be0a504d52aa2a0551a078f9
< HCI Command: Host Number of Com.. (0x03|0x0035) plen 5  #145 [hci1] 12.146090
        Num handles: 1
        Handle: 111 Address: DF:A9:FF:F6:B1:1A (OUI DF-A9-FF)
        Count: 1
< ACL Data TX: Handle 111 flags 0x00 dlen 21              #146 [hci1] 12.146202
      SMP: Pairing Confirm (0x03) len 16
        Confim value: 816f37dc52be78334e9b92de8d96731a
> HCI Event: Number of Completed Packets (0x13) plen 5    #147 [hci1] 12.303776
        Num handles: 1
        Handle: 111 Address: DF:A9:FF:F6:B1:1A (OUI DF-A9-FF)
        Count: 1
        #146: len 21 (1 Kb/s)
        Latency: 157 msec (74-175 msec ~157 msec)
> ACL Data RX: Handle 111 flags 0x02 dlen 21              #148 [hci1] 12.303980
      SMP: Pairing Random (0x04) len 16
        Random value: 8d50aa46ce5d08860000000000000000
< HCI Command: Host Number of Com.. (0x03|0x0035) plen 5  #149 [hci1] 12.306042
        Num handles: 1
        Handle: 111 Address: DF:A9:FF:F6:B1:1A (OUI DF-A9-FF)
        Count: 1
< ACL Data TX: Handle 111 flags 0x00 dlen 21              #150 [hci1] 12.306116
      SMP: Pairing Random (0x04) len 16
        Random value: c629a3a987d808e808655d558dfc1155
> HCI Event: Number of Completed Packets (0x13) plen 5    #151 [hci1] 12.478360
        Num handles: 1
        Handle: 111 Address: DF:A9:FF:F6:B1:1A (OUI DF-A9-FF)
        Count: 1
        #150: len 21 (0 Kb/s)
        Latency: 172 msec (74-175 msec ~164 msec)
> ACL Data RX: Handle 111 flags 0x02 dlen 21              #152 [hci1] 12.566396
      SMP: Pairing Confirm (0x03) len 16
        Confim value: e741db773be222419d5b6b679760bfd9
< HCI Command: Host Number of Com.. (0x03|0x0035) plen 5  #153 [hci1] 12.585813
        Num handles: 1
        Handle: 111 Address: DF:A9:FF:F6:B1:1A (OUI DF-A9-FF)
        Count: 1
< ACL Data TX: Handle 111 flags 0x00 dlen 21              #154 [hci1] 12.585948
      SMP: Pairing Confirm (0x03) len 16
        Confim value: 7311e34fa77ff98e2ebfeccbc591b13d
> HCI Event: Number of Completed Packets (0x13) plen 5    #155 [hci1] 12.741282
        Num handles: 1
        Handle: 111 Address: DF:A9:FF:F6:B1:1A (OUI DF-A9-FF)
        Count: 1
        #154: len 21 (1 Kb/s)
        Latency: 155 msec (74-175 msec ~160 msec)
> ACL Data RX: Handle 111 flags 0x02 dlen 21              #156 [hci1] 12.741577
      SMP: Pairing Random (0x04) len 16
        Random value: fafc64ab6da7240c0000000000000000
< HCI Command: Host Number of Com.. (0x03|0x0035) plen 5  #157 [hci1] 12.746209
        Num handles: 1
        Handle: 111 Address: DF:A9:FF:F6:B1:1A (OUI DF-A9-FF)
        Count: 1
< ACL Data TX: Handle 111 flags 0x00 dlen 21              #158 [hci1] 12.746380
      SMP: Pairing Random (0x04) len 16
        Random value: 92f20f6ad8f13724432c7fd6001c45ff
> HCI Event: Number of Completed Packets (0x13) plen 5    #159 [hci1] 12.915860
        Num handles: 1
        Handle: 111 Address: DF:A9:FF:F6:B1:1A (OUI DF-A9-FF)
        Count: 1
        #158: len 21 (0 Kb/s)
        Latency: 169 msec (74-175 msec ~164 msec)
> ACL Data RX: Handle 111 flags 0x02 dlen 21              #160 [hci1] 13.003811
      SMP: Pairing Confirm (0x03) len 16
        Confim value: 81fbd748aae7c78dcd96cec525e76855
< HCI Command: Host Number of Com.. (0x03|0x0035) plen 5  #161 [hci1] 13.006048
        Num handles: 1
        Handle: 111 Address: DF:A9:FF:F6:B1:1A (OUI DF-A9-FF)
        Count: 1
< ACL Data TX: Handle 111 flags 0x00 dlen 21              #162 [hci1] 13.006300
      SMP: Pairing Confirm (0x03) len 16
        Confim value: 59a068524ab133378b7d70feb9b91d89
> HCI Event: Number of Completed Packets (0x13) plen 5    #163 [hci1] 13.178671
        Num handles: 1
        Handle: 111 Address: DF:A9:FF:F6:B1:1A (OUI DF-A9-FF)
        Count: 1
        #162: len 21 (0 Kb/s)
        Latency: 172 msec (74-175 msec ~168 msec)
> ACL Data RX: Handle 111 flags 0x02 dlen 21              #164 [hci1] 13.178953
      SMP: Pairing Random (0x04) len 16
        Random value: ca7b75217b4657770000000000000000
< HCI Command: Host Number of Com.. (0x03|0x0035) plen 5  #165 [hci1] 13.186296
        Num handles: 1
        Handle: 111 Address: DF:A9:FF:F6:B1:1A (OUI DF-A9-FF)
        Count: 1
< ACL Data TX: Handle 111 flags 0x00 dlen 21              #166 [hci1] 13.186453
      SMP: Pairing Random (0x04) len 16
        Random value: 23ac32ebbb5e14c8a6b9622f296d277f
> HCI Event: Number of Completed Packets (0x13) plen 5    #167 [hci1] 13.353337
        Num handles: 1
        Handle: 111 Address: DF:A9:FF:F6:B1:1A (OUI DF-A9-FF)
        Count: 1
        #166: len 21 (1 Kb/s)
        Latency: 166 msec (74-175 msec ~167 msec)
> ACL Data RX: Handle 111 flags 0x02 dlen 21              #168 [hci1] 13.441380
      SMP: Pairing Confirm (0x03) len 16
        Confim value: 8357fd2274b6711f8c1f9dd7461d7833
< HCI Command: Host Number of Com.. (0x03|0x0035) plen 5  #169 [hci1] 13.446056
        Num handles: 1
        Handle: 111 Address: DF:A9:FF:F6:B1:1A (OUI DF-A9-FF)
        Count: 1
< ACL Data TX: Handle 111 flags 0x00 dlen 21              #170 [hci1] 13.446239
      SMP: Pairing Confirm (0x03) len 16
        Confim value: 8fbbb5798583586ddb1c584c98ffb247
> HCI Event: Number of Completed Packets (0x13) plen 5    #171 [hci1] 13.616196
        Num handles: 1
        Handle: 111 Address: DF:A9:FF:F6:B1:1A (OUI DF-A9-FF)
        Count: 1
        #170: len 21 (0 Kb/s)
        Latency: 169 msec (74-175 msec ~168 msec)
> ACL Data RX: Handle 111 flags 0x02 dlen 21              #172 [hci1] 13.616564
      SMP: Pairing Random (0x04) len 16
        Random value: a0ce4020bac3c8ef0000000000000000
< HCI Command: Host Number of Com.. (0x03|0x0035) plen 5  #173 [hci1] 13.626377
        Num handles: 1
        Handle: 111 Address: DF:A9:FF:F6:B1:1A (OUI DF-A9-FF)
        Count: 1
< ACL Data TX: Handle 111 flags 0x00 dlen 21              #174 [hci1] 13.626425
      SMP: Pairing Random (0x04) len 16
        Random value: 297efe85e67448a15f56bd27e3a3cf1d
> HCI Event: Number of Completed Packets (0x13) plen 5    #175 [hci1] 13.790918
        Num handles: 1
        Handle: 111 Address: DF:A9:FF:F6:B1:1A (OUI DF-A9-FF)
        Count: 1
        #174: len 21 (1 Kb/s)
        Latency: 164 msec (74-175 msec ~166 msec)
> ACL Data RX: Handle 111 flags 0x02 dlen 21              #176 [hci1] 13.878790
      SMP: Pairing Confirm (0x03) len 16
        Confim value: b94cbcdf066312318b3b3b2cc0d1743b
< HCI Command: Host Number of Com.. (0x03|0x0035) plen 5  #177 [hci1] 13.886044
        Num handles: 1
        Handle: 111 Address: DF:A9:FF:F6:B1:1A (OUI DF-A9-FF)
        Count: 1
< ACL Data TX: Handle 111 flags 0x00 dlen 21              #178 [hci1] 13.886151
      SMP: Pairing Confirm (0x03) len 16
        Confim value: 195cba57ff1985d6dec0d875d77d2594
> HCI Event: Number of Completed Packets (0x13) plen 5    #179 [hci1] 14.053648
        Num handles: 1
        Handle: 111 Address: DF:A9:FF:F6:B1:1A (OUI DF-A9-FF)
        Count: 1
        #178: len 21 (1 Kb/s)
        Latency: 167 msec (74-175 msec ~167 msec)
> ACL Data RX: Handle 111 flags 0x02 dlen 21              #180 [hci1] 14.053936
      SMP: Pairing Random (0x04) len 16
        Random value: 0a96241f95b822b60000000000000000
< HCI Command: Host Number of Com.. (0x03|0x0035) plen 5  #181 [hci1] 14.066320
        Num handles: 1
        Handle: 111 Address: DF:A9:FF:F6:B1:1A (OUI DF-A9-FF)
        Count: 1
< ACL Data TX: Handle 111 flags 0x00 dlen 21              #182 [hci1] 14.066400
      SMP: Pairing Random (0x04) len 16
        Random value: 25a9493fd3ce4faf02be7293595bb7c6
> HCI Event: Number of Completed Packets (0x13) plen 5    #183 [hci1] 14.228359
        Num handles: 1
        Handle: 111 Address: DF:A9:FF:F6:B1:1A (OUI DF-A9-FF)
        Count: 1
        #182: len 21 (1 Kb/s)
        Latency: 161 msec (74-175 msec ~164 msec)
> ACL Data RX: Handle 111 flags 0x02 dlen 21              #184 [hci1] 14.316257
      SMP: Pairing Confirm (0x03) len 16
        Confim value: b0caa4da0043b3d40cce65575375be6d
< HCI Command: Host Number of Com.. (0x03|0x0035) plen 5  #185 [hci1] 14.325773
        Num handles: 1
        Handle: 111 Address: DF:A9:FF:F6:B1:1A (OUI DF-A9-FF)
        Count: 1
< ACL Data TX: Handle 111 flags 0x00 dlen 21              #186 [hci1] 14.325928
      SMP: Pairing Confirm (0x03) len 16
        Confim value: 2de2d2650686d2a61a51bd9da40c711b
> HCI Event: Number of Completed Packets (0x13) plen 5    #187 [hci1] 14.491210
        Num handles: 1
        Handle: 111 Address: DF:A9:FF:F6:B1:1A (OUI DF-A9-FF)
        Count: 1
        #186: len 21 (1 Kb/s)
        Latency: 165 msec (74-175 msec ~164 msec)
> ACL Data RX: Handle 111 flags 0x02 dlen 21              #188 [hci1] 14.491389
      SMP: Pairing Random (0x04) len 16
        Random value: ec9b5421173c70190000000000000000
< HCI Command: Host Number of Com.. (0x03|0x0035) plen 5  #189 [hci1] 14.505944
        Num handles: 1
        Handle: 111 Address: DF:A9:FF:F6:B1:1A (OUI DF-A9-FF)
        Count: 1
< ACL Data TX: Handle 111 flags 0x00 dlen 21              #190 [hci1] 14.506003
      SMP: Pairing Random (0x04) len 16
        Random value: 58f6b41f855a6f6c3560debd84e2affc
> HCI Event: Number of Completed Packets (0x13) plen 5    #191 [hci1] 14.665929
        Num handles: 1
        Handle: 111 Address: DF:A9:FF:F6:B1:1A (OUI DF-A9-FF)
        Count: 1
        #190: len 21 (1 Kb/s)
        Latency: 159 msec (74-175 msec ~162 msec)
> ACL Data RX: Handle 111 flags 0x02 dlen 21              #192 [hci1] 14.753722
      SMP: Pairing Confirm (0x03) len 16
        Confim value: c1b12351951f9fe5c65d30b43b674f15
< HCI Command: Host Number of Com.. (0x03|0x0035) plen 5  #193 [hci1] 14.766012
        Num handles: 1
        Handle: 111 Address: DF:A9:FF:F6:B1:1A (OUI DF-A9-FF)
        Count: 1
< ACL Data TX: Handle 111 flags 0x00 dlen 21              #194 [hci1] 14.766148
      SMP: Pairing Confirm (0x03) len 16
        Confim value: cd87072d5cbf76b5d8ac5b7a8320320f
> HCI Event: Number of Completed Packets (0x13) plen 5    #195 [hci1] 14.928606
        Num handles: 1
        Handle: 111 Address: DF:A9:FF:F6:B1:1A (OUI DF-A9-FF)
        Count: 1
        #194: len 21 (1 Kb/s)
        Latency: 162 msec (74-175 msec ~162 msec)
> ACL Data RX: Handle 111 flags 0x02 dlen 21              #196 [hci1] 14.928906
      SMP: Pairing Random (0x04) len 16
        Random value: d88ee54df5e2a1840000000000000000
< HCI Command: Host Number of Com.. (0x03|0x0035) plen 5  #197 [hci1] 14.946261
        Num handles: 1
        Handle: 111 Address: DF:A9:FF:F6:B1:1A (OUI DF-A9-FF)
        Count: 1
< ACL Data TX: Handle 111 flags 0x00 dlen 21              #198 [hci1] 14.946406
      SMP: Pairing Random (0x04) len 16
        Random value: b67e7216d5bf664139eda2b542549666
> HCI Event: Number of Completed Packets (0x13) plen 5    #199 [hci1] 15.103337
        Num handles: 1
        Handle: 111 Address: DF:A9:FF:F6:B1:1A (OUI DF-A9-FF)
        Count: 1
        #198: len 21 (1 Kb/s)
        Latency: 156 msec (74-175 msec ~159 msec)
> ACL Data RX: Handle 111 flags 0x02 dlen 21              #200 [hci1] 15.191173
      SMP: Pairing Confirm (0x03) len 16
        Confim value: 2a34b52a041cd8e7aa82ed3b0b64d382
< HCI Command: Host Number of Com.. (0x03|0x0035) plen 5  #201 [hci1] 15.205716
        Num handles: 1
        Handle: 111 Address: DF:A9:FF:F6:B1:1A (OUI DF-A9-FF)
        Count: 1
< ACL Data TX: Handle 111 flags 0x00 dlen 21              #202 [hci1] 15.205830
      SMP: Pairing Confirm (0x03) len 16
        Confim value: 6b604337a40bb636978c981aa8859f3c
> HCI Event: Number of Completed Packets (0x13) plen 5    #203 [hci1] 15.366101
        Num handles: 1
        Handle: 111 Address: DF:A9:FF:F6:B1:1A (OUI DF-A9-FF)
        Count: 1
        #202: len 21 (1 Kb/s)
        Latency: 160 msec (74-175 msec ~159 msec)
> ACL Data RX: Handle 111 flags 0x02 dlen 21              #204 [hci1] 15.366441
      SMP: Pairing Random (0x04) len 16
        Random value: da5655c5f63a14bd0000000000000000
< HCI Command: Host Number of Com.. (0x03|0x0035) plen 5  #205 [hci1] 15.386364
        Num handles: 1
        Handle: 111 Address: DF:A9:FF:F6:B1:1A (OUI DF-A9-FF)
        Count: 1
< ACL Data TX: Handle 111 flags 0x00 dlen 21              #206 [hci1] 15.386481
      SMP: Pairing Random (0x04) len 16
        Random value: ed17f76500c95219dd01e09d1e63f87b
> HCI Event: Number of Completed Packets (0x13) plen 5    #207 [hci1] 15.540933
        Num handles: 1
        Handle: 111 Address: DF:A9:FF:F6:B1:1A (OUI DF-A9-FF)
        Count: 1
        #206: len 21 (1 Kb/s)
        Latency: 154 msec (74-175 msec ~157 msec)
> ACL Data RX: Handle 111 flags 0x02 dlen 21              #208 [hci1] 15.628766
      SMP: Pairing Confirm (0x03) len 16
        Confim value: 5f14ce8e171a437e73fb44a7b81a94ed
< HCI Command: Host Number of Com.. (0x03|0x0035) plen 5  #209 [hci1] 15.646159
        Num handles: 1
        Handle: 111 Address: DF:A9:FF:F6:B1:1A (OUI DF-A9-FF)
        Count: 1
< ACL Data TX: Handle 111 flags 0x00 dlen 21              #210 [hci1] 15.646426
      SMP: Pairing Confirm (0x03) len 16
        Confim value: f93094c8f4d453cdc5821492686495cf
> HCI Event: Number of Completed Packets (0x13) plen 5    #211 [hci1] 15.803565
        Num handles: 1
        Handle: 111 Address: DF:A9:FF:F6:B1:1A (OUI DF-A9-FF)
        Count: 1
        #210: len 21 (1 Kb/s)
        Latency: 157 msec (74-175 msec ~157 msec)
> ACL Data RX: Handle 111 flags 0x02 dlen 21              #212 [hci1] 15.803853
      SMP: Pairing Random (0x04) len 16
        Random value: 013db162c0eb03840000000000000000
< HCI Command: Host Number of Com.. (0x03|0x0035) plen 5  #213 [hci1] 15.806254
        Num handles: 1
        Handle: 111 Address: DF:A9:FF:F6:B1:1A (OUI DF-A9-FF)
        Count: 1
< ACL Data TX: Handle 111 flags 0x00 dlen 21              #214 [hci1] 15.806311
      SMP: Pairing Random (0x04) len 16
        Random value: 81d35d47e1f6006d79c974bd9d9e1ee3
> HCI Event: Number of Completed Packets (0x13) plen 5    #215 [hci1] 15.978488
        Num handles: 1
        Handle: 111 Address: DF:A9:FF:F6:B1:1A (OUI DF-A9-FF)
        Count: 1
        #214: len 21 (0 Kb/s)
        Latency: 172 msec (74-175 msec ~164 msec)
> ACL Data RX: Handle 111 flags 0x02 dlen 21              #216 [hci1] 16.066304
      SMP: Pairing Confirm (0x03) len 16
        Confim value: 2128fdb51f186e9708c55883ca5a26b6
< HCI Command: Host Number of Com.. (0x03|0x0035) plen 5  #217 [hci1] 16.085990
        Num handles: 1
        Handle: 111 Address: DF:A9:FF:F6:B1:1A (OUI DF-A9-FF)
        Count: 1
< ACL Data TX: Handle 111 flags 0x00 dlen 21              #218 [hci1] 16.086137
      SMP: Pairing Confirm (0x03) len 16
        Confim value: f447ec45fc18fcbfd251e1d5a7827a21
> HCI Event: Number of Completed Packets (0x13) plen 5    #219 [hci1] 16.241159
        Num handles: 1
        Handle: 111 Address: DF:A9:FF:F6:B1:1A (OUI DF-A9-FF)
        Count: 1
        #218: len 21 (1 Kb/s)
        Latency: 155 msec (74-175 msec ~159 msec)
> ACL Data RX: Handle 111 flags 0x02 dlen 21              #220 [hci1] 16.241397
      SMP: Pairing Random (0x04) len 16
        Random value: d5810003b9bbf19f0000000000000000
< HCI Command: Host Number of Com.. (0x03|0x0035) plen 5  #221 [hci1] 16.246306
        Num handles: 1
        Handle: 111 Address: DF:A9:FF:F6:B1:1A (OUI DF-A9-FF)
        Count: 1
< ACL Data TX: Handle 111 flags 0x00 dlen 21              #222 [hci1] 16.246396
      SMP: Pairing Random (0x04) len 16
        Random value: e7f7e0c2476823e41736a7e381bafb7c
> HCI Event: Number of Completed Packets (0x13) plen 5    #223 [hci1] 16.415780
        Num handles: 1
        Handle: 111 Address: DF:A9:FF:F6:B1:1A (OUI DF-A9-FF)
        Count: 1
        #222: len 21 (0 Kb/s)
        Latency: 169 msec (74-175 msec ~164 msec)
> ACL Data RX: Handle 111 flags 0x02 dlen 21              #224 [hci1] 16.503672
      SMP: Pairing Confirm (0x03) len 16
        Confim value: 96629d4ca8f620597d56740ed6f7df87
< HCI Command: Host Number of Com.. (0x03|0x0035) plen 5  #225 [hci1] 16.506090
        Num handles: 1
        Handle: 111 Address: DF:A9:FF:F6:B1:1A (OUI DF-A9-FF)
        Count: 1
< ACL Data TX: Handle 111 flags 0x00 dlen 21              #226 [hci1] 16.506199
      SMP: Pairing Confirm (0x03) len 16
        Confim value: 49aa7ecf1e1e28cf01694c1f398820a9
> HCI Event: Number of Completed Packets (0x13) plen 5    #227 [hci1] 16.678508
        Num handles: 1
        Handle: 111 Address: DF:A9:FF:F6:B1:1A (OUI DF-A9-FF)
        Count: 1
        #226: len 21 (0 Kb/s)
        Latency: 172 msec (74-175 msec ~168 msec)
> ACL Data RX: Handle 111 flags 0x02 dlen 21              #228 [hci1] 16.678866
      SMP: Pairing Random (0x04) len 16
        Random value: 37a3b3ffd87e6b3c0000000000000000
< HCI Command: Host Number of Com.. (0x03|0x0035) plen 5  #229 [hci1] 16.685977
        Num handles: 1
        Handle: 111 Address: DF:A9:FF:F6:B1:1A (OUI DF-A9-FF)
        Count: 1
