Bluetooth monitor ver 5.72
= Note: Linux version 6.14.0-36-generic (x86_64)                       0.036359
= Note: Bluetooth subsystem version 2.22                               0.036361
= New Index: 00:00:00:00:00:00 (Primary,UART,hci2)              [hci2] 0.036362
= New Index: 00:00:00:00:00:00 (Primary,UART,hci1)              [hci1] 0.036362
= New Index: 48:5F:99:8E:E0:64 (Primary,USB,hci0)               [hci0] 0.036363
= Open Index: 00:00:00:00:00:00                                 [hci1] 0.150074
= Index Info: 00:00:00:00:00:00 (Nordic Semiconductor ASA)      [hci1] 0.150088
@ USER Open: main (privileged) version 2.22            {0x0001} [hci1] 0.150102
< HCI Command: Reset (0x03|0x0003) plen 0                    #1 [hci1] 0.151276
> HCI Event: Command Complete (0x0e) plen 4                  #2 [hci1] 0.151867
      Reset (0x03|0x0003) ncmd 1
        Status: Success (0x00)
< HCI Command: Read Local Supported... (0x04|0x0003) plen 0  #3 [hci1] 0.169880
> HCI Event: Command Complete (0x0e) plen 12                 #4 [hci1] 0.170564
      Read Local Supported Features (0x04|0x0003) ncmd 1
        Status: Success (0x00)
        Features: 0x00 0x00 0x00 0x00 0x60 0x00 0x00 0x00
          BR/EDR Not Supported
          LE Supported (Controller)
< HCI Command: Read Local Version In.. (0x04|0x0001) plen 0  #5 [hci1] 0.189605
> HCI Event: Command Complete (0x0e) plen 12                 #6 [hci1] 0.190210
      Read Local Version Information (0x04|0x0001) ncmd 1
        Status: Success (0x00)
        HCI version: Reserved (0x0f) - Revision 12393 (0x3069)
        LMP version: Reserved (0x0f) - Subversion 12393 (0x3069)
        Manufacturer: Nordic Semiconductor ASA (89)
< HCI Command: Read Local Supported... (0x04|0x0002) plen 0  #7 [hci1] 0.209550
> HCI Event: Command Complete (0x0e) plen 68                 #8 [hci1] 0.210822
      Read Local Supported Commands (0x04|0x0002) ncmd 1
        Status: Success (0x00)
        Commands: 119 entries
          Disconnect (Octet 0 - Bit 5)
          Read Remote Version Information (Octet 2 - Bit 7)
          Set Event Mask (Octet 5 - Bit 6)
          Reset (Octet 5 - Bit 7)
          Read Connection Accept Timeout (Octet 7 - Bit 2)
          Write Connection Accept Timeout (Octet 7 - Bit 3)
          Read Transmit Power Level (Octet 10 - Bit 2)
          Set Controller To Host Flow Control (Octet 10 - Bit 5)
          Host Buffer Size (Octet 10 - Bit 6)
          Host Number of Completed Packets (Octet 10 - Bit 7)
          Read Local Version Information (Octet 14 - Bit 3)
          Read Local Supported Features (Octet 14 - Bit 5)
          Read BD ADDR (Octet 15 - Bit 1)
          Read RSSI (Octet 15 - Bit 5)
          Set Event Mask Page 2 (Octet 22 - Bit 2)
          LE Set Event Mask (Octet 25 - Bit 0)
          LE Read Buffer Size (Octet 25 - Bit 1)
          LE Read Local Supported Features (Octet 25 - Bit 2)
          LE Set Random Address (Octet 25 - Bit 4)
          LE Set Advertising Parameters (Octet 25 - Bit 5)
          LE Read Advertising Channel TX Power (Octet 25 - Bit 6)
          LE Set Advertising Data (Octet 25 - Bit 7)
          LE Set Scan Response Data (Octet 26 - Bit 0)
          LE Set Advertise Enable (Octet 26 - Bit 1)
          LE Set Scan Parameters (Octet 26 - Bit 2)
          LE Set Scan Enable (Octet 26 - Bit 3)
          LE Create Connection (Octet 26 - Bit 4)
          LE Create Connection Cancel (Octet 26 - Bit 5)
          LE Read Accept List Size (Octet 26 - Bit 6)
          LE Clear Accept List (Octet 26 - Bit 7)
          LE Add Device To Accept List (Octet 27 - Bit 0)
          LE Remove Device From Accept List (Octet 27 - Bit 1)
          LE Connection Update (Octet 27 - Bit 2)
          LE Set Host Channel Classification (Octet 27 - Bit 3)
          LE Read Channel Map (Octet 27 - Bit 4)
          LE Read Remote Used Features (Octet 27 - Bit 5)
          LE Encrypt (Octet 27 - Bit 6)
          LE Rand (Octet 27 - Bit 7)
          LE Start Encryption (Octet 28 - Bit 0)
          LE Long Term Key Request Reply (Octet 28 - Bit 1)
          LE Long Term Key Request Neg Reply (Octet 28 - Bit 2)
          LE Read Supported States (Octet 28 - Bit 3)
          LE Receiver Test (Octet 28 - Bit 4)
          LE Transmitter Test (Octet 28 - Bit 5)
          LE Test End (Octet 28 - Bit 6)
          Read Authenticated Payload Timeout (Octet 32 - Bit 4)
          Write Authenticated Payload Timeout (Octet 32 - Bit 5)
          LE Set Data Length (Octet 33 - Bit 6)
          LE Read Suggested Default Data Length (Octet 33 - Bit 7)
          LE Write Suggested Default Data Length (Octet 34 - Bit 0)
          LE Add Device To Resolving List (Octet 34 - Bit 3)
          LE Remove Device From Resolving List (Octet 34 - Bit 4)
          LE Clear Resolving List (Octet 34 - Bit 5)
          LE Read Resolving List Size (Octet 34 - Bit 6)
          LE Set Address Resolution Enable (Octet 35 - Bit 1)
          LE Set Resolvable Private Address Timeout (Octet 35 - Bit 2)
          LE Read Maximum Data Length (Octet 35 - Bit 3)
          LE Read PHY (Octet 35 - Bit 4)
          LE Set Default PHY (Octet 35 - Bit 5)
          LE Set PHY (Octet 35 - Bit 6)
          LE Enhanced Receiver Test (Octet 35 - Bit 7)
          LE Enhanced Transmitter Test (Octet 36 - Bit 0)
          LE Set Advertising Set Random Address (Octet 36 - Bit 1)
          LE Set Extended Advertising Parameters (Octet 36 - Bit 2)
          LE Set Extended Advertising Data (Octet 36 - Bit 3)
          LE Set Extended Scan Response Data (Octet 36 - Bit 4)
          LE Set Extended Advertising Enable (Octet 36 - Bit 5)
          LE Read Maximum Advertising Data Length (Octet 36 - Bit 6)
          LE Read Number of Supported Advertising Sets (Octet 36 - Bit 7)
          LE Remove Advertising Set (Octet 37 - Bit 0)
          LE Clear Advertising Sets (Octet 37 - Bit 1)
          LE Set Periodic Advertising Parameters (Octet 37 - Bit 2)
          LE Set Periodic Advertising Data (Octet 37 - Bit 3)
          LE Set Periodic Advertising Enable (Octet 37 - Bit 4)
          LE Set Extended Scan Parameters (Octet 37 - Bit 5)
          LE Set Extended Scan Enable (Octet 37 - Bit 6)
          LE Extended Create Connection (Octet 37 - Bit 7)
          LE Periodic Advertising Create Sync (Octet 38 - Bit 0)
          LE Periodic Advertising Create Sync Cancel (Octet 38 - Bit 1)
          LE Periodic Advertising Terminate Sync (Octet 38 - Bit 2)
          LE Add Device To Periodic Advertiser List (Octet 38 - Bit 3)
          LE Remove Device From Periodic Advertiser List (Octet 38 - Bit 4)
          LE Clear Periodic Advertiser List (Octet 38 - Bit 5)
          LE Read Periodic Advertiser List Size (Octet 38 - Bit 6)
          LE Read Transmit Power (Octet 38 - Bit 7)
          LE Read RF Path Compensation (Octet 39 - Bit 0)
          LE Write RF Path Compensation (Octet 39 - Bit 1)
          LE Set Privacy Mode (Octet 39 - Bit 2)
          LE Periodic Advertising Receive Enable (Octet 40 - Bit 5)
          LE Periodic Advertising Sync Transfer (Octet 40 - Bit 6)
          LE Periodic Advertising Set Info Transfer (Octet 40 - Bit 7)
          LE Periodic Advertising Sync Transfer Parameters (Octet 41 - Bit 0)
          LE Set Default Periodic Advertisng Sync Transfer Parameters (Octet 41 - Bit 1)
          LE Read Buffer v2 (Octet 41 - Bit 5)
          LE Read ISO TX Sync (Octet 41 - Bit 6)
          LE Set Connected Isochronous Group Parameters (Octet 41 - Bit 7)
          LE Set Connected Isochronous Group Parameters Test (Octet 42 - Bit 0)
          LE Create Connected Isochronous Stream (Octet 42 - Bit 1)
          LE Remove Connected Isochronous Group (Octet 42 - Bit 2)
          LE Accept Connected Isochronous Stream Request (Octet 42 - Bit 3)
          LE Reject Connected Isochronous Stream Request (Octet 42 - Bit 4)
          LE Create Broadcast Isochronous Group (Octet 42 - Bit 5)
          LE Create Broadcast Isochronous Group Test (Octet 42 - Bit 6)
          LE Terminate Broadcast Isochronous Group (Octet 42 - Bit 7)
          LE Broadcast Isochronous Group Create Sync (Octet 43 - Bit 0)
          LE Broadcast Isochronous Group Terminate Sync (Octet 43 - Bit 1)
          LE Request Peer SCA (Octet 43 - Bit 2)
          LE Setup Isochronous Data Path (Octet 43 - Bit 3)
          LE Remove Isochronous Data Path (Octet 43 - Bit 4)
          LE Isochronous Transmit Test (Octet 43 - Bit 5)
          LE Isochronous Receive Test (Octet 43 - Bit 6)
          LE Isochronous Read Test Counters (Octet 43 - Bit 7)
          LE Isochronous Read Test Counters (Octet 44 - Bit 0)
          LE Set Host Feature (Octet 44 - Bit 1)
          Octet 44 - Bit 2 
          Octet 45 - Bit 6 
          Octet 46 - Bit 0 
          Octet 46 - Bit 1 
          Octet 46 - Bit 2 
< HCI Command: Host Buffer Size (0x03|0x0033) plen 7         #9 [hci1] 0.229571
        ACL MTU: 255  ACL max packet: 16
        SCO MTU: 0    SCO max packet: 0
> HCI Event: Command Complete (0x0e) plen 4                 #10 [hci1] 0.230135
      Host Buffer Size (0x03|0x0033) ncmd 1
        Status: Success (0x00)
< HCI Command: Set Controller To Ho.. (0x03|0x0031) plen 1  #11 [hci1] 0.249560
        Flow control: ACL Data Packets (0x01)
> HCI Event: Command Complete (0x0e) plen 4                 #12 [hci1] 0.249994
      Set Controller To Host Flow Control (0x03|0x0031) ncmd 1
        Status: Success (0x00)
< HCI Command: LE Read Local Suppor.. (0x08|0x0003) plen 0  #13 [hci1] 0.269555
> HCI Event: Command Complete (0x0e) plen 12                #14 [hci1] 0.270111
      LE Read Local Supported Features (0x08|0x0003) ncmd 1
        Status: Success (0x00)
        Features: 0xfd 0x79 0x00 0xf7 0x30 0x01 0x00 0x00
          LE Encryption
          Extended Reject Indication
          Peripheral-initiated Features Exchange
          LE Ping
          LE Data Packet Length Extension
          LL Privacy
          Extended Scanner Filter Policies
          LE 2M PHY
          LE Coded PHY
          LE Extended Advertising
          LE Periodic Advertising
          Channel Selection Algorithm #2
          Periodic Advertising Sync Transfer - Sender
          Periodic Advertising Sync Transfer - Recipient
          Sleep Clock Accuracy Updates
          Connected Isochronous Stream - Central
          Connected Isochronous Stream - Peripheral
          Isochronous Broadcaster
          Synchronized Receiver
          Periodic Advertising ADI support
          Connection Subrating
          Unknown features (0x0000010000000000)
< HCI Command: LE Set Host Feature (0x08|0x0074) plen 2     #15 [hci1] 0.289567
        Bit Number: 32
          Connected Isochronous Stream (Host Support)
        Bit Value: 1
> HCI Event: Command Complete (0x0e) plen 4                 #16 [hci1] 0.290071
      LE Set Host Feature (0x08|0x0074) ncmd 1
        Status: Success (0x00)
< HCI Command: LE Read Buffer v2 (0x08|0x0060) plen 0       #17 [hci1] 0.309609
> HCI Event: Command Complete (0x0e) plen 10                #18 [hci1] 0.310070
      LE Read Buffer v2 (0x08|0x0060) ncmd 1
        Status: Success (0x00)
        ACL MTU: 27
        ACL max packet: 3
        ISO MTU: 318
        ISO max packet: 3
< HCI Command: LE Read Maximum Adve.. (0x08|0x003a) plen 0  #19 [hci1] 0.329584
> HCI Event: Command Complete (0x0e) plen 6                 #20 [hci1] 0.330089
      LE Read Maximum Advertising Data Length (0x08|0x003a) ncmd 1
        Status: Success (0x00)
        Max length: 1650
< HCI Command: LE Read Supported St.. (0x08|0x001c) plen 0  #21 [hci1] 0.349533
> HCI Event: Command Complete (0x0e) plen 12                #22 [hci1] 0.350133
      LE Read Supported States (0x08|0x001c) ncmd 1
        Status: Success (0x00)
        States: 0x000003ff3e0306ff
          Non-connectable Advertising State
          Scannable Advertising State
          Connectable Advertising State
          High Duty Cycle Directed Advertising State
          Passive Scanning State
          Active Scanning State
          Initiating State
            and Connection State (Central Role)
          Connection State (Peripheral Role)
          Scannable Advertising State
            and Passive Scanning State
          Connectable Advertising State
            and Passive Scanning State
          Non-connectable Advertising State
            and Initiating State
          Scannable Advertising State
            and Initiating State
          Active Scanning State
            and Connection State (Central Role)
          Passive Scanning State
            and Connection State (Peripheral Role)
          Active Scanning State
            and Connection State (Peripheral Role)
          Initiating State
            and Connection State (Central Role)
            and Central Role & Central Role
          Low Duty Cycle Directed Advertising State
          Connectable Advertising State
            and Initiating State
            and Central Role & Peripheral Role
          High Duty Cycle Directed Advertising State
            and Initiating State
            and Central Role & Peripheral Role
          Low Duty Cycle Directed Advertising State
            and Initiating State
            and Central Role & Peripheral Role
          Connectable Advertising State
            and Connection State (Central Role)
            and Central Role & Peripheral Role
          High Duty Cycle Directed Advertising State
            and Connection State (Central Role)
            and Central Role & Peripheral Role
          Low Duty Cycle Directed Advertising State
            and Connection State (Central Role)
            and Central Role & Peripheral Role
          Connectable Advertising State
            and Connection State (Peripheral Role)
            and Central Role & Peripheral Role
          High Duty Cycle Directed Advertising State
            and Connection State (Peripheral Role)
            and Peripheral Role & Peripheral Role
          Low Duty Cycle Directed Advertising State
            and Connection State (Peripheral Role)
            and Peripheral Role & Peripheral Role
          Initiating State
            and Connection State (Peripheral Role)
            and Central Role & Peripheral Role
< HCI Command: LE Read Maximum Data.. (0x08|0x002f) plen 0  #23 [hci1] 0.369554
> HCI Event: Command Complete (0x0e) plen 12                #24 [hci1] 0.370084
      LE Read Maximum Data Length (0x08|0x002f) ncmd 1
        Status: Success (0x00)
        Max TX octets: 251
        Max TX time: 2704
        Max RX octets: 251
        Max RX time: 2704
< HCI Command: LE Write Suggested D.. (0x08|0x0024) plen 4  #25 [hci1] 0.389579
        TX octets: 251
        TX time: 2704
> HCI Event: Command Complete (0x0e) plen 4                 #26 [hci1] 0.390167
      LE Write Suggested Default Data Length (0x08|0x0024) ncmd 1
        Status: Success (0x00)
< HCI Command: LE Read Resolving Li.. (0x08|0x002a) plen 0  #27 [hci1] 0.409586
> HCI Event: Command Complete (0x0e) plen 5                 #28 [hci1] 0.410109
      LE Read Resolving List Size (0x08|0x002a) ncmd 1
        Status: Success (0x00)
        Size: 8
< HCI Command: LE Set Event Mask (0x08|0x0001) plen 8       #29 [hci1] 0.429559
        Mask: 0x000002023f87fa5e
          LE Advertising Report
          LE Connection Update Complete
          LE Read Remote Used Features Complete
          LE Long Term Key Request
          LE Data Length Change
          LE Enhanced Connection Complete
          LE PHY Update Complete
          LE Extended Advertising Report
          LE Periodic Advertising Sync Established
          LE Periodic Advertising Report
          LE Periodic Advertising Sync Lost
          LE Extended Scan Timeout
          LE Extended Advertising Set Terminated
          LE Scan Request Received
          LE Periodic Advertising Sync Transfer Rvc
          LE CIS Established
          LE CIS Request
          LE Create BIG Complete
          LE Terminate BIG Complete
          LE BIG Sync Estabilished Complete
          LE BIG Sync Lost
          LE BIG Info Advertising Report
          Unknown mask (0x0000020000000000)
> HCI Event: Command Complete (0x0e) plen 4                 #30 [hci1] 0.430168
      LE Set Event Mask (0x08|0x0001) ncmd 1
        Status: Success (0x00)
< HCI Command: Set Event Mask (0x03|0x0001) plen 8          #31 [hci1] 0.449555
        Mask: 0x2000800002008890
          Disconnection Complete
          Encryption Change
          Read Remote Version Information Complete
          Hardware Error
          Data Buffer Overflow
          Encryption Key Refresh Complete
          LE Meta
> HCI Event: Command Complete (0x0e) plen 4                 #32 [hci1] 0.450317
      Set Event Mask (0x03|0x0001) ncmd 1
        Status: Success (0x00)
< HCI Command: Read BD ADDR (0x04|0x0009) plen 0            #33 [hci1] 0.469562
> HCI Event: Command Complete (0x0e) plen 10                #34 [hci1] 0.470246
      Read BD ADDR (0x04|0x0009) ncmd 1
        Status: Success (0x00)
        Address: 00:00:00:00:00:00 (OUI 00-00-00)
< HCI Command: LE Set Random Address (0x08|0x0005) plen 6   #35 [hci1] 0.489543
        Address: D5:B6:CC:31:DB:3B (Static)
> HCI Event: Command Complete (0x0e) plen 4                 #36 [hci1] 0.490075
      LE Set Random Address (0x08|0x0005) ncmd 1
        Status: Success (0x00)
< HCI Command: LE Set Extended Adv.. (0x08|0x0036) plen 25  #37 [hci1] 5.349671
        Handle: 0x00
        Properties: 0x0013
          Connectable
          Scannable
          Use legacy advertising PDUs: ADV_IND
        Min advertising interval: 100.000 msec (0x00a0)
        Max advertising interval: 150.000 msec (0x00f0)
        Channel map: 37, 38, 39 (0x07)
        Own address type: Random (0x01)
        Peer address type: Public (0x00)
        Peer address: 00:00:00:00:00:00 (OUI 00-00-00)
        Filter policy: Allow Scan Request from Any, Allow Connect Request from Any (0x00)
        TX power: Host has no preference (0x7f)
        Primary PHY: LE 1M (0x01)
        Secondary max skip: 0x00
        Secondary PHY: LE 1M (0x01)
        SID: 0x00
        Scan request notifications: Disabled (0x00)
> HCI Event: Command Complete (0x0e) plen 5                 #38 [hci1] 5.350499
      LE Set Extended Advertising Parameters (0x08|0x0036) ncmd 1
        Status: Success (0x00)
        TX power (selected): 0 dbm (0x00)
< HCI Command: LE Set Advertising S.. (0x08|0x0035) plen 7  #39 [hci1] 5.369538
        Advertising handle: 0x00
        Advertising random address: D5:B6:CC:31:DB:3B (Static)
> HCI Event: Command Complete (0x0e) plen 4                 #40 [hci1] 5.370130
      LE Set Advertising Set Random Address (0x08|0x0035) ncmd 1
        Status: Success (0x00)
< HCI Command: LE Set Extended Adv.. (0x08|0x0037) plen 22  #41 [hci1] 5.389606
        Handle: 0x00
        Operation: Complete extended advertising data (0x03)
        Fragment preference: Minimize fragmentation (0x01)
        Data length: 0x12
        Flags: 0x06
          LE General Discoverable Mode
          BR/EDR Not Supported
        Name (complete): Tester_F6B11A
> HCI Event: Command Complete (0x0e) plen 4                 #42 [hci1] 5.390308
      LE Set Extended Advertising Data (0x08|0x0037) ncmd 1
        Status: Success (0x00)
< HCI Command: LE Set Extended Scan.. (0x08|0x0038) plen 4  #43 [hci1] 5.409589
        Handle: 0x00
        Operation: Complete scan response data (0x03)
        Fragment preference: Minimize fragmentation (0x01)
        Data length: 0x00
> HCI Event: Command Complete (0x0e) plen 4                 #44 [hci1] 5.410191
      LE Set Extended Scan Response Data (0x08|0x0038) ncmd 1
        Status: Success (0x00)
< HCI Command: LE Set Extended Adve.. (0x08|0x0039) plen 6  #45 [hci1] 5.429600
        Extended advertising: Enabled (0x01)
        Number of sets: 1 (0x01)
        Entry 0
          Handle: 0x00
          Duration: 0 ms (0x00)
          Max ext adv events: 0
> HCI Event: Command Complete (0x0e) plen 4                 #46 [hci1] 5.430222
      LE Set Extended Advertising Enable (0x08|0x0039) ncmd 1
        Status: Success (0x00)
> HCI Event: LE Meta Event (0x3e) plen 31                   #47 [hci1] 5.965521
      LE Enhanced Connection Complete (0x0a)
        Status: Success (0x00)
        Handle: 1389
        Role: Peripheral (0x01)
        Peer address type: Public (0x00)
        Peer address: DF:A9:FF:F6:B1:1A (OUI DF-A9-FF)
        Local resolvable private address: 00:00:00:00:00:00 (Non-Resolvable)
        Peer resolvable private address: 00:00:00:00:00:00 (Non-Resolvable)
        Connection interval: 87.50 msec (0x0046)
        Connection latency: 0 (0x0000)
        Supervision timeout: 20000 msec (0x07d0)
        Central clock accuracy: 0x01
> HCI Event: LE Meta Event (0x3e) plen 6                    #48 [hci1] 5.965625
      LE Advertising Set Terminated (0x12)
        Status: Success (0x00)
        Handle: 0
        Connection handle: 1389
        Number of completed extended advertising events: 0
< HCI Command: LE Read Remote Used... (0x08|0x0016) plen 2  #49 [hci1] 5.969841
        Handle: 1389 Address: DF:A9:FF:F6:B1:1A (OUI DF-A9-FF)
> HCI Event: Command Status (0x0f) plen 4                   #50 [hci1] 5.970330
      LE Read Remote Used Features (0x08|0x0016) ncmd 1
        Status: Success (0x00)
> HCI Event: LE Meta Event (0x3e) plen 12                   #51 [hci1] 6.229468
      LE Read Remote Used Features (0x04)
        Status: Success (0x00)
        Handle: 1389 Address: DF:A9:FF:F6:B1:1A (OUI DF-A9-FF)
        Features: 0x2d 0x49 0x00 0xf7 0x67 0xd9 0x00 0x80
          LE Encryption
          Extended Reject Indication
          Peripheral-initiated Features Exchange
          LE Data Packet Length Extension
          LE 2M PHY
          LE Coded PHY
          Channel Selection Algorithm #2
          Periodic Advertising Sync Transfer - Sender
          Periodic Advertising Sync Transfer - Recipient
          Sleep Clock Accuracy Updates
          Connected Isochronous Stream - Central
          Connected Isochronous Stream - Peripheral
          Isochronous Broadcaster
          Synchronized Receiver
          Connected Isochronous Stream (Host Support)
          LE Power Control Request
          LE Power Control Request
          Connection Subrating
          Connection Subrating (Host Support)
          Unknown features (0x8000d90000000000)
> ACL Data RX: Handle 1389 flags 0x02 dlen 11               #52 [hci1] 8.679180
      ATT: Read By Type Request (0x08) len 6
        Handle range: 0x0001-0xffff
        Attribute type: Characteristic (0x2803)
< HCI Command: Host Number of Compl.. (0x03|0x0035) plen 5  #53 [hci1] 8.690183
        Num handles: 1
        Handle: 1389 Address: DF:A9:FF:F6:B1:1A (OUI DF-A9-FF)
        Count: 1
< ACL Data TX: Handle 1389 flags 0x00 dlen 20               #54 [hci1] 8.690287
      ATT: Read By Type Response (0x09) len 15
        Attribute data length: 7
        Attribute data list: 2 entries
        Handle: 0x0002
        Value: 200300052a
            Properties: 0x20
              Indicate (0x20)
            Value Handle: 0x0003
            Value UUID: Service Changed (0x2a05)
        Handle: 0x0005
        Value: 0a0600292b
            Properties: 0x0a
              Read (0x02)
              Write (0x08)
            Value Handle: 0x0006
            Value UUID: Client Supported Features (0x2b29)
> HCI Event: Number of Completed Packets (0x13) plen 5      #55 [hci1] 8.854139
        Num handles: 1
        Handle: 1389 Address: DF:A9:FF:F6:B1:1A (OUI DF-A9-FF)
        Count: 1
        #54: len 20 (0 Kb/s)
        Latency: 163 msec (163-163 msec ~163 msec)
> ACL Data RX: Handle 1389 flags 0x02 dlen 11               #56 [hci1] 8.854295
      ATT: Read By Type Request (0x08) len 6
        Handle range: 0x0006-0xffff
        Attribute type: Characteristic (0x2803)
< HCI Command: Host Number of Compl.. (0x03|0x0035) plen 5  #57 [hci1] 8.870294
        Num handles: 1
        Handle: 1389 Address: DF:A9:FF:F6:B1:1A (OUI DF-A9-FF)
        Count: 1
< ACL Data TX: Handle 1389 flags 0x00 dlen 20               #58 [hci1] 8.870445
      ATT: Read By Type Response (0x09) len 15
        Attribute data length: 7
        Attribute data list: 2 entries
        Handle: 0x0007
        Value: 0208002a2b
            Properties: 0x02
              Read (0x02)
            Value Handle: 0x0008
            Value UUID: Database Hash (0x2b2a)
        Handle: 0x0009
        Value: 020a003a2b
            Properties: 0x02
              Read (0x02)
            Value Handle: 0x000a
            Value UUID: Server Supported Features (0x2b3a)
> HCI Event: Number of Completed Packets (0x13) plen 5      #59 [hci1] 9.029192
        Num handles: 1
        Handle: 1389 Address: DF:A9:FF:F6:B1:1A (OUI DF-A9-FF)
        Count: 1
        #58: len 20 (1 Kb/s)
        Latency: 158 msec (158-163 msec ~161 msec)
> ACL Data RX: Handle 1389 flags 0x02 dlen 11               #60 [hci1] 9.029354
      ATT: Read By Type Request (0x08) len 6
        Handle range: 0x000a-0xffff
        Attribute type: Characteristic (0x2803)
< HCI Command: Host Number of Compl.. (0x03|0x0035) plen 5  #61 [hci1] 9.030253
        Num handles: 1
        Handle: 1389 Address: DF:A9:FF:F6:B1:1A (OUI DF-A9-FF)
        Count: 1
< ACL Data TX: Handle 1389 flags 0x00 dlen 20               #62 [hci1] 9.030346
      ATT: Read By Type Response (0x09) len 15
        Attribute data length: 7
        Attribute data list: 2 entries
        Handle: 0x000c
        Value: 0a0d00002a
            Properties: 0x0a
              Read (0x02)
              Write (0x08)
            Value Handle: 0x000d
            Value UUID: Device Name (0x2a00)
        Handle: 0x000e
        Value: 0a0f00012a
            Properties: 0x0a
              Read (0x02)
              Write (0x08)
            Value Handle: 0x000f
            Value UUID: Appearance (0x2a01)
> HCI Event: Number of Completed Packets (0x13) plen 5      #63 [hci1] 9.204100
        Num handles: 1
        Handle: 1389 Address: DF:A9:FF:F6:B1:1A (OUI DF-A9-FF)
        Count: 1
        #62: len 20 (0 Kb/s)
        Latency: 173 msec (158-173 msec ~167 msec)
> ACL Data RX: Handle 1389 flags 0x02 dlen 11               #64 [hci1] 9.204232
      ATT: Read By Type Request (0x08) len 6
        Handle range: 0x000f-0xffff
        Attribute type: Characteristic (0x2803)
< HCI Command: Host Number of Compl.. (0x03|0x0035) plen 5  #65 [hci1] 9.209933
        Num handles: 1
        Handle: 1389 Address: DF:A9:FF:F6:B1:1A (OUI DF-A9-FF)
        Count: 1
< ACL Data TX: Handle 1389 flags 0x00 dlen 20               #66 [hci1] 9.210019
      ATT: Read By Type Response (0x09) len 15
        Attribute data length: 7
        Attribute data list: 2 entries
        Handle: 0x0010
        Value: 021100042a
            Properties: 0x02
              Read (0x02)
            Value Handle: 0x0011
            Value UUID: Peripheral Preferred Connection Parameters (0x2a04)
        Handle: 0x0013
        Value: 021400242a
            Properties: 0x02
              Read (0x02)
            Value Handle: 0x0014
            Value UUID: Model Number String (0x2a24)
> HCI Event: Number of Completed Packets (0x13) plen 5      #67 [hci1] 9.379044
        Num handles: 1
        Handle: 1389 Address: DF:A9:FF:F6:B1:1A (OUI DF-A9-FF)
        Count: 1
        #66: len 20 (0 Kb/s)
        Latency: 169 msec (158-173 msec ~168 msec)
> ACL Data RX: Handle 1389 flags 0x02 dlen 11               #68 [hci1] 9.379288
      ATT: Read By Type Request (0x08) len 6
        Handle range: 0x0014-0xffff
        Attribute type: Characteristic (0x2803)
< HCI Command: Host Number of Compl.. (0x03|0x0035) plen 5  #69 [hci1] 9.389922
        Num handles: 1
        Handle: 1389 Address: DF:A9:FF:F6:B1:1A (OUI DF-A9-FF)
        Count: 1
< ACL Data TX: Handle 1389 flags 0x00 dlen 20               #70 [hci1] 9.389968
      ATT: Read By Type Response (0x09) len 15
        Attribute data length: 7
        Attribute data list: 2 entries
        Handle: 0x0015
        Value: 021600292a
            Properties: 0x02
              Read (0x02)
            Value Handle: 0x0016
            Value UUID: Manufacturer Name String (0x2a29)
        Handle: 0x0017
        Value: 021800502a
            Properties: 0x02
              Read (0x02)
            Value Handle: 0x0018
            Value UUID: PnP ID (0x2a50)
> HCI Event: Number of Completed Packets (0x13) plen 5      #71 [hci1] 9.554108
        Num handles: 1
        Handle: 1389 Address: DF:A9:FF:F6:B1:1A (OUI DF-A9-FF)
        Count: 1
        #70: len 20 (0 Kb/s)
        Latency: 164 msec (158-173 msec ~166 msec)
> ACL Data RX: Handle 1389 flags 0x02 dlen 11               #72 [hci1] 9.554433
      ATT: Read By Type Request (0x08) len 6
        Handle range: 0x0018-0xffff
        Attribute type: Characteristic (0x2803)
< HCI Command: Host Number of Compl.. (0x03|0x0035) plen 5  #73 [hci1] 9.570310
        Num handles: 1
        Handle: 1389 Address: DF:A9:FF:F6:B1:1A (OUI DF-A9-FF)
        Count: 1
< ACL Data TX: Handle 1389 flags 0x00 dlen 20               #74 [hci1] 9.570467
      ATT: Read By Type Response (0x09) len 15
        Attribute data length: 7
        Attribute data list: 2 entries
        Handle: 0x0019
        Value: 021a00252a
            Properties: 0x02
              Read (0x02)
            Value Handle: 0x001a
            Value UUID: Serial Number String (0x2a25)
        Handle: 0x001b
        Value: 021c00262a
            Properties: 0x02
              Read (0x02)
            Value Handle: 0x001c
            Value UUID: Firmware Revision String (0x2a26)
> HCI Event: Number of Completed Packets (0x13) plen 5      #75 [hci1] 9.729141
        Num handles: 1
        Handle: 1389 Address: DF:A9:FF:F6:B1:1A (OUI DF-A9-FF)
        Count: 1
        #74: len 20 (1 Kb/s)
        Latency: 158 msec (158-173 msec ~162 msec)
> ACL Data RX: Handle 1389 flags 0x02 dlen 11               #76 [hci1] 9.729275
      ATT: Read By Type Request (0x08) len 6
        Handle range: 0x001c-0xffff
        Attribute type: Characteristic (0x2803)
< HCI Command: Host Number of Compl.. (0x03|0x0035) plen 5  #77 [hci1] 9.729691
        Num handles: 1
        Handle: 1389 Address: DF:A9:FF:F6:B1:1A (OUI DF-A9-FF)
        Count: 1
< ACL Data TX: Handle 1389 flags 0x00 dlen 20               #78 [hci1] 9.729744
      ATT: Read By Type Response (0x09) len 15
        Attribute data length: 7
        Attribute data list: 2 entries
        Handle: 0x001d
        Value: 021e00272a
            Properties: 0x02
              Read (0x02)
            Value Handle: 0x001e
            Value UUID: Hardware Revision String (0x2a27)
        Handle: 0x001f
        Value: 022000282a
            Properties: 0x02
              Read (0x02)
            Value Handle: 0x0020
            Value UUID: Software Revision String (0x2a28)
> HCI Event: Number of Completed Packets (0x13) plen 5      #79 [hci1] 9.904181
        Num handles: 1
        Handle: 1389 Address: DF:A9:FF:F6:B1:1A (OUI DF-A9-FF)
        Count: 1
        #78: len 20 (0 Kb/s)
        Latency: 174 msec (158-174 msec ~168 msec)
> ACL Data RX: Handle 1389 flags 0x02 dlen 11               #80 [hci1] 9.904283
      ATT: Read By Type Request (0x08) len 6
        Handle range: 0x0020-0xffff
        Attribute type: Characteristic (0x2803)
< HCI Command: Host Number of Compl.. (0x03|0x0035) plen 5  #81 [hci1] 9.910331
        Num handles: 1
        Handle: 1389 Address: DF:A9:FF:F6:B1:1A (OUI DF-A9-FF)
        Count: 1
< ACL Data TX: Handle 1389 flags 0x00 dlen 20               #82 [hci1] 9.910427
      ATT: Read By Type Response (0x09) len 15
        Attribute data length: 7
        Attribute data list: 2 entries
        Handle: 0x0021
        Value: 022200ff2b
            Properties: 0x02
              Read (0x02)
            Value Handle: 0x0022
            Value UUID: Unknown (0x2bff)
        Handle: 0x0023
        Value: 022400232a
            Properties: 0x02
              Read (0x02)
            Value Handle: 0x0024
            Value UUID: System ID (0x2a23)
> HCI Event: Number of Completed Packets (0x13) plen 5     #83 [hci1] 10.079193
        Num handles: 1
        Handle: 1389 Address: DF:A9:FF:F6:B1:1A (OUI DF-A9-FF)
        Count: 1
        #82: len 20 (0 Kb/s)
        Latency: 168 msec (158-174 msec ~168 msec)
> ACL Data RX: Handle 1389 flags 0x02 dlen 11              #84 [hci1] 10.079265
      ATT: Read By Type Request (0x08) len 6
        Handle range: 0x0024-0xffff
        Attribute type: Characteristic (0x2803)
< HCI Command: Host Number of Comp.. (0x03|0x0035) plen 5  #85 [hci1] 10.090366
        Num handles: 1
        Handle: 1389 Address: DF:A9:FF:F6:B1:1A (OUI DF-A9-FF)
        Count: 1
< ACL Data TX: Handle 1389 flags 0x00 dlen 20              #86 [hci1] 10.090489
      ATT: Read By Type Response (0x09) len 15
        Attribute data length: 7
        Attribute data list: 2 entries
        Handle: 0x0025
        Value: 0226002a2a
            Properties: 0x02
              Read (0x02)
            Value Handle: 0x0026
            Value UUID: IEEE 11073-20601 Regulatory Cert. Data List (0x2a2a)
        Handle: 0x0028
        Value: 0a290050aa
            Properties: 0x0a
              Read (0x02)
              Write (0x08)
            Value Handle: 0x0029
            Value UUID: Unknown (0xaa50)
> HCI Event: Number of Completed Packets (0x13) plen 5     #87 [hci1] 10.254073
        Num handles: 1
        Handle: 1389 Address: DF:A9:FF:F6:B1:1A (OUI DF-A9-FF)
        Count: 1
        #86: len 20 (0 Kb/s)
        Latency: 163 msec (158-174 msec ~166 msec)
> ACL Data RX: Handle 1389 flags 0x02 dlen 11              #88 [hci1] 10.254333
      ATT: Read By Type Request (0x08) len 6
        Handle range: 0x0029-0xffff
        Attribute type: Characteristic (0x2803)
< HCI Command: Host Number of Comp.. (0x03|0x0035) plen 5  #89 [hci1] 10.270198
        Num handles: 1
        Handle: 1389 Address: DF:A9:FF:F6:B1:1A (OUI DF-A9-FF)
        Count: 1
< ACL Data TX: Handle 1389 flags 0x00 dlen 20              #90 [hci1] 10.270288
      ATT: Read By Type Response (0x09) len 15
        Attribute data length: 7
        Attribute data list: 2 entries
        Handle: 0x002a
        Value: 0a2b0051aa
            Properties: 0x0a
              Read (0x02)
              Write (0x08)
            Value Handle: 0x002b
            Value UUID: Unknown (0xaa51)
        Handle: 0x002c
        Value: 0a2d0052aa
            Properties: 0x0a
              Read (0x02)
              Write (0x08)
            Value Handle: 0x002d
            Value UUID: Unknown (0xaa52)
> HCI Event: Number of Completed Packets (0x13) plen 5     #91 [hci1] 10.429012
        Num handles: 1
        Handle: 1389 Address: DF:A9:FF:F6:B1:1A (OUI DF-A9-FF)
        Count: 1
        #90: len 20 (1 Kb/s)
        Latency: 158 msec (158-174 msec ~162 msec)
> ACL Data RX: Handle 1389 flags 0x02 dlen 11              #92 [hci1] 10.429261
      ATT: Read By Type Request (0x08) len 6
        Handle range: 0x002d-0xffff
        Attribute type: Characteristic (0x2803)
< HCI Command: Host Number of Comp.. (0x03|0x0035) plen 5  #93 [hci1] 10.430075
        Num handles: 1
        Handle: 1389 Address: DF:A9:FF:F6:B1:1A (OUI DF-A9-FF)
        Count: 1
< ACL Data TX: Handle 1389 flags 0x00 dlen 20              #94 [hci1] 10.430183
      ATT: Read By Type Response (0x09) len 15
        Attribute data length: 7
        Attribute data list: 2 entries
        Handle: 0x002e
        Value: 0a2f0053aa
            Properties: 0x0a
              Read (0x02)
              Write (0x08)
            Value Handle: 0x002f
            Value UUID: Unknown (0xaa53)
        Handle: 0x0030
        Value: 3a310054aa
            Properties: 0x3a
              Read (0x02)
              Write (0x08)
              Notify (0x10)
              Indicate (0x20)
            Value Handle: 0x0031
            Value UUID: Unknown (0xaa54)
> HCI Event: Number of Completed Packets (0x13) plen 5     #95 [hci1] 10.604078
        Num handles: 1
        Handle: 1389 Address: DF:A9:FF:F6:B1:1A (OUI DF-A9-FF)
        Count: 1
        #94: len 20 (0 Kb/s)
        Latency: 173 msec (158-174 msec ~168 msec)
> ACL Data RX: Handle 1389 flags 0x02 dlen 11              #96 [hci1] 10.604545
      ATT: Read By Type Request (0x08) len 6
        Handle range: 0x0031-0xffff
        Attribute type: Characteristic (0x2803)
< HCI Command: Host Number of Comp.. (0x03|0x0035) plen 5  #97 [hci1] 10.610109
        Num handles: 1
        Handle: 1389 Address: DF:A9:FF:F6:B1:1A (OUI DF-A9-FF)
        Count: 1
< ACL Data TX: Handle 1389 flags 0x00 dlen 20              #98 [hci1] 10.610199
      ATT: Read By Type Response (0x09) len 15
        Attribute data length: 7
        Attribute data list: 2 entries
        Handle: 0x0033
        Value: 3a340055aa
            Properties: 0x3a
              Read (0x02)
              Write (0x08)
              Notify (0x10)
              Indicate (0x20)
            Value Handle: 0x0034
            Value UUID: Unknown (0xaa55)
        Handle: 0x0036
        Value: 06370056aa
            Properties: 0x06
              Read (0x02)
              Write Without Response (0x04)
            Value Handle: 0x0037
            Value UUID: Unknown (0xaa56)
> HCI Event: Number of Completed Packets (0x13) plen 5     #99 [hci1] 10.779058
        Num handles: 1
        Handle: 1389 Address: DF:A9:FF:F6:B1:1A (OUI DF-A9-FF)
        Count: 1
        #98: len 20 (0 Kb/s)
        Latency: 168 msec (158-174 msec ~168 msec)
> ACL Data RX: Handle 1389 flags 0x02 dlen 11             #100 [hci1] 10.779290
      ATT: Read By Type Request (0x08) len 6
        Handle range: 0x0037-0xffff
        Attribute type: Characteristic (0x2803)
< HCI Command: Host Number of Com.. (0x03|0x0035) plen 5  #101 [hci1] 10.789954
        Num handles: 1
        Handle: 1389 Address: DF:A9:FF:F6:B1:1A (OUI DF-A9-FF)
        Count: 1
< ACL Data TX: Handle 1389 flags 0x00 dlen 20             #102 [hci1] 10.789995
      ATT: Read By Type Response (0x09) len 15
        Attribute data length: 7
        Attribute data list: 2 entries
        Handle: 0x0038
        Value: 06390057aa
            Properties: 0x06
              Read (0x02)
              Write Without Response (0x04)
            Value Handle: 0x0039
            Value UUID: Unknown (0xaa57)
        Handle: 0x003a
        Value: 8a3b0058aa
            Properties: 0x8a
              Read (0x02)
              Write (0x08)
            Unknown fields (0x80)
            Value Handle: 0x003b
            Value UUID: Unknown (0xaa58)
> HCI Event: Number of Completed Packets (0x13) plen 5    #103 [hci1] 10.954020
        Num handles: 1
        Handle: 1389 Address: DF:A9:FF:F6:B1:1A (OUI DF-A9-FF)
        Count: 1
        #102: len 20 (0 Kb/s)
        Latency: 164 msec (158-174 msec ~166 msec)
> ACL Data RX: Handle 1389 flags 0x02 dlen 11             #104 [hci1] 10.954340
      ATT: Read By Type Request (0x08) len 6
        Handle range: 0x003b-0xffff
        Attribute type: Characteristic (0x2803)
< HCI Command: Host Number of Com.. (0x03|0x0035) plen 5  #105 [hci1] 10.970305
        Num handles: 1
        Handle: 1389 Address: DF:A9:FF:F6:B1:1A (OUI DF-A9-FF)
        Count: 1
< ACL Data TX: Handle 1389 flags 0x00 dlen 20             #106 [hci1] 10.970479
      ATT: Read By Type Response (0x09) len 15
        Attribute data length: 7
        Attribute data list: 2 entries
        Handle: 0x003d
        Value: 0a3e0059aa
            Properties: 0x0a
              Read (0x02)
              Write (0x08)
            Value Handle: 0x003e
            Value UUID: Unknown (0xaa59)
        Handle: 0x003f
        Value: 0a40005aaa
            Properties: 0x0a
              Read (0x02)
              Write (0x08)
            Value Handle: 0x0040
            Value UUID: Unknown (0xaa5a)
< ACL Data TX: Handle 1389 flags 0x00 dlen 16             #107 [hci1] 10.979847
      LE L2CAP: Connection Parameter Update Request (0x12) ident 1 len 8
        Min interval: 24
        Max interval: 40
        Peripheral latency: 0
        Timeout multiplier: 42
> HCI Event: Number of Completed Packets (0x13) plen 5    #108 [hci1] 11.042069
        Num handles: 1
        Handle: 1389 Address: DF:A9:FF:F6:B1:1A (OUI DF-A9-FF)
        Count: 1
        #106: len 20 (2 Kb/s)
        Latency: 71 msec (71-174 msec ~118 msec)
> HCI Event: Number of Completed Packets (0x13) plen 5    #109 [hci1] 11.128997
        Num handles: 1
        Handle: 1389 Address: DF:A9:FF:F6:B1:1A (OUI DF-A9-FF)
        Count: 1
        #107: len 16 (0 Kb/s)
        Latency: 149 msec (71-174 msec ~134 msec)
> ACL Data RX: Handle 1389 flags 0x02 dlen 11             #110 [hci1] 11.129250
      ATT: Read By Type Request (0x08) len 6
        Handle range: 0x0040-0xffff
        Attribute type: Characteristic (0x2803)
> ACL Data RX: Handle 1389 flags 0x02 dlen 10             #111 [hci1] 11.129565
      LE L2CAP: Connection Parameter Update Response (0x13) ident 1 len 2
        Result: Connection Parameters accepted (0x0000)
< HCI Command: Host Number of Com.. (0x03|0x0035) plen 5  #112 [hci1] 11.129710
        Num handles: 1
        Handle: 1389 Address: DF:A9:FF:F6:B1:1A (OUI DF-A9-FF)
        Count: 1
< ACL Data TX: Handle 1389 flags 0x00 dlen 27             #113 [hci1] 11.129718
      ATT: Read By Type Response (0x09) len 22
        Attribute data length: 21
        Attribute data list: 1 entry
        Handle: 0x0041
        Value: 0a4200efcdab89674523b10040510450bb00f0
            Properties: 0x0a
              Read (0x02)
              Write (0x08)
            Value Handle: 0x0042
            Value UUID: Vendor specific (f000bb50-0451-4000-b123-456789abcdef)
< HCI Command: Host Number of Com.. (0x03|0x0035) plen 5  #114 [hci1] 11.149778
        Num handles: 1
        Handle: 1389 Address: DF:A9:FF:F6:B1:1A (OUI DF-A9-FF)
        Count: 1
> HCI Event: Number of Completed Packets (0x13) plen 5    #115 [hci1] 11.304015
        Num handles: 1
        Handle: 1389 Address: DF:A9:FF:F6:B1:1A (OUI DF-A9-FF)
        Count: 1
        #113: len 27 (1 Kb/s)
        Latency: 174 msec (71-174 msec ~154 msec)
> ACL Data RX: Handle 1389 flags 0x02 dlen 11             #116 [hci1] 11.304311
      ATT: Read By Type Request (0x08) len 6
        Handle range: 0x0042-0xffff
        Attribute type: Characteristic (0x2803)
< HCI Command: Host Number of Com.. (0x03|0x0035) plen 5  #117 [hci1] 11.310237
        Num handles: 1
        Handle: 1389 Address: DF:A9:FF:F6:B1:1A (OUI DF-A9-FF)
        Count: 1
< ACL Data TX: Handle 1389 flags 0x00 dlen 20             #118 [hci1] 11.310325
      ATT: Read By Type Response (0x09) len 15
        Attribute data length: 7
        Attribute data list: 2 entries
        Handle: 0x0045
        Value: 0a460050aa
            Properties: 0x0a
              Read (0x02)
              Write (0x08)
            Value Handle: 0x0046
            Value UUID: Unknown (0xaa50)
        Handle: 0x0047
        Value: 0a480051aa
            Properties: 0x0a
              Read (0x02)
              Write (0x08)
            Value Handle: 0x0048
            Value UUID: Unknown (0xaa51)
> HCI Event: Number of Completed Packets (0x13) plen 5    #119 [hci1] 11.479143
        Num handles: 1
        Handle: 1389 Address: DF:A9:FF:F6:B1:1A (OUI DF-A9-FF)
        Count: 1
        #118: len 20 (0 Kb/s)
        Latency: 168 msec (71-174 msec ~161 msec)
> ACL Data RX: Handle 1389 flags 0x02 dlen 11             #120 [hci1] 11.479278
      ATT: Read By Type Request (0x08) len 6
        Handle range: 0x0048-0xffff
        Attribute type: Characteristic (0x2803)
< HCI Command: Host Number of Com.. (0x03|0x0035) plen 5  #121 [hci1] 11.490340
        Num handles: 1
        Handle: 1389 Address: DF:A9:FF:F6:B1:1A (OUI DF-A9-FF)
        Count: 1
< ACL Data TX: Handle 1389 flags 0x00 dlen 20             #122 [hci1] 11.490479
      ATT: Read By Type Response (0x09) len 15
        Attribute data length: 7
        Attribute data list: 2 entries
        Handle: 0x0049
        Value: 0a4a0052aa
            Properties: 0x0a
              Read (0x02)
              Write (0x08)
            Value Handle: 0x004a
            Value UUID: Unknown (0xaa52)
        Handle: 0x004b
        Value: 024c0053aa
            Properties: 0x02
              Read (0x02)
            Value Handle: 0x004c
            Value UUID: Unknown (0xaa53)
> HCI Event: Number of Completed Packets (0x13) plen 5    #123 [hci1] 11.654111
        Num handles: 1
        Handle: 1389 Address: DF:A9:FF:F6:B1:1A (OUI DF-A9-FF)
        Count: 1
        #122: len 20 (0 Kb/s)
        Latency: 163 msec (71-174 msec ~162 msec)
> ACL Data RX: Handle 1389 flags 0x02 dlen 11             #124 [hci1] 11.654291
      ATT: Read By Type Request (0x08) len 6
        Handle range: 0x004c-0xffff
        Attribute type: Characteristic (0x2803)
< HCI Command: Host Number of Com.. (0x03|0x0035) plen 5  #125 [hci1] 11.669873
        Num handles: 1
        Handle: 1389 Address: DF:A9:FF:F6:B1:1A (OUI DF-A9-FF)
        Count: 1
< ACL Data TX: Handle 1389 flags 0x00 dlen 20             #126 [hci1] 11.669896
      ATT: Read By Type Response (0x09) len 15
        Attribute data length: 7
        Attribute data list: 2 entries
        Handle: 0x004e
        Value: 0a4f0055aa
            Properties: 0x0a
              Read (0x02)
              Write (0x08)
            Value Handle: 0x004f
            Value UUID: Unknown (0xaa55)
        Handle: 0x0050
        Value: 0a510056aa
            Properties: 0x0a
              Read (0x02)
              Write (0x08)
            Value Handle: 0x0051
            Value UUID: Unknown (0xaa56)
> HCI Event: Number of Completed Packets (0x13) plen 5    #127 [hci1] 11.829072
        Num handles: 1
        Handle: 1389 Address: DF:A9:FF:F6:B1:1A (OUI DF-A9-FF)
        Count: 1
        #126: len 20 (1 Kb/s)
        Latency: 159 msec (71-174 msec ~160 msec)
> ACL Data RX: Handle 1389 flags 0x02 dlen 11             #128 [hci1] 11.829263
      ATT: Read By Type Request (0x08) len 6
        Handle range: 0x0051-0xffff
        Attribute type: Characteristic (0x2803)
< HCI Command: Host Number of Com.. (0x03|0x0035) plen 5  #129 [hci1] 11.829673
        Num handles: 1
        Handle: 1389 Address: DF:A9:FF:F6:B1:1A (OUI DF-A9-FF)
        Count: 1
< ACL Data TX: Handle 1389 flags 0x00 dlen 9              #130 [hci1] 11.829753
      ATT: Error Response (0x01) len 4
        Read By Type Request (0x08)
        Handle: 0x0051
        Error: Attribute Not Found (0x0a)
> HCI Event: Number of Completed Packets (0x13) plen 5    #131 [hci1] 12.004097
        Num handles: 1
        Handle: 1389 Address: DF:A9:FF:F6:B1:1A (OUI DF-A9-FF)
        Count: 1
        #130: len 9 (0 Kb/s)
        Latency: 174 msec (71-174 msec ~167 msec)
> ACL Data RX: Handle 1389 flags 0x02 dlen 7              #132 [hci1] 12.004208
      ATT: Read Request (0x0a) len 2
        Handle: 0x0037
< HCI Command: Host Number of Com.. (0x03|0x0035) plen 5  #133 [hci1] 12.010200
        Num handles: 1
        Handle: 1389 Address: DF:A9:FF:F6:B1:1A (OUI DF-A9-FF)
        Count: 1
< ACL Data TX: Handle 1389 flags 0x00 dlen 13             #134 [hci1] 12.010278
      ATT: Read Response (0x0b) len 8
> HCI Event: Number of Completed Packets (0x13) plen 5    #135 [hci1] 12.179095
        Num handles: 1
        Handle: 1389 Address: DF:A9:FF:F6:B1:1A (OUI DF-A9-FF)
        Count: 1
        #134: len 13 (0 Kb/s)
        Latency: 168 msec (71-174 msec ~168 msec)
> ACL Data RX: Handle 1389 flags 0x02 dlen 7              #136 [hci1] 12.179251
      ATT: Read Request (0x0a) len 2
        Handle: 0x0040
< HCI Command: Host Number of Com.. (0x03|0x0035) plen 5  #137 [hci1] 12.189966
        Num handles: 1
        Handle: 1389 Address: DF:A9:FF:F6:B1:1A (OUI DF-A9-FF)
        Count: 1
< ACL Data TX: Handle 1389 flags 0x00 dlen 9              #138 [hci1] 12.190113
      ATT: Error Response (0x01) len 4
        Read Request (0x0a)
        Handle: 0x0040
        Error: Insufficient Authentication (0x05)
> HCI Event: Number of Completed Packets (0x13) plen 5    #139 [hci1] 12.353985
        Num handles: 1
        Handle: 1389 Address: DF:A9:FF:F6:B1:1A (OUI DF-A9-FF)
        Count: 1
        #138: len 9 (0 Kb/s)
        Latency: 163 msec (71-174 msec ~166 msec)
> ACL Data RX: Handle 1389 flags 0x02 dlen 7              #140 [hci1] 12.354202
      ATT: Read Request (0x0a) len 2
        Handle: 0x0051
< HCI Command: Host Number of Com.. (0x03|0x0035) plen 5  #141 [hci1] 12.369811
        Num handles: 1
        Handle: 1389 Address: DF:A9:FF:F6:B1:1A (OUI DF-A9-FF)
        Count: 1
< ACL Data TX: Handle 1389 flags 0x00 dlen 27             #142 [hci1] 12.369838
      ATT: Read Response (0x0b) len 22
> HCI Event: Number of Completed Packets (0x13) plen 5    #143 [hci1] 12.529088
        Num handles: 1
        Handle: 1389 Address: DF:A9:FF:F6:B1:1A (OUI DF-A9-FF)
        Count: 1
        #142: len 27 (1 Kb/s)
        Latency: 159 msec (71-174 msec ~162 msec)
> ACL Data RX: Handle 1389 flags 0x02 dlen 9              #144 [hci1] 12.529290
      ATT: Read Blob Request (0x0c) len 4
        Handle: 0x0051
        Offset: 0x0016
< HCI Command: Host Number of Com.. (0x03|0x0035) plen 5  #145 [hci1] 12.529990
        Num handles: 1
        Handle: 1389 Address: DF:A9:FF:F6:B1:1A (OUI DF-A9-FF)
        Count: 1
< ACL Data TX: Handle 1389 flags 0x00 dlen 27             #146 [hci1] 12.530043
      ATT: Read Blob Response (0x0d) len 22
        02 02 02 02 02 02 02 02 02 02 02 02 02 02 02 02  ................
        02 02 02 02 02 02                                ......          
> HCI Event: Number of Completed Packets (0x13) plen 5    #147 [hci1] 12.704060
        Num handles: 1
        Handle: 1389 Address: DF:A9:FF:F6:B1:1A (OUI DF-A9-FF)
        Count: 1
        #146: len 27 (1 Kb/s)
        Latency: 174 msec (71-174 msec ~168 msec)
> ACL Data RX: Handle 1389 flags 0x02 dlen 9              #148 [hci1] 12.704255
      ATT: Read Blob Request (0x0c) len 4
        Handle: 0x0051
        Offset: 0x002c
< HCI Command: Host Number of Com.. (0x03|0x0035) plen 5  #149 [hci1] 12.709900
        Num handles: 1
        Handle: 1389 Address: DF:A9:FF:F6:B1:1A (OUI DF-A9-FF)
        Count: 1
< ACL Data TX: Handle 1389 flags 0x00 dlen 27             #150 [hci1] 12.709979
      ATT: Read Blob Response (0x0d) len 22
        02 02 02 02 02 02 02 02 02 02 02 02 02 02 02 02  ................
        02 02 02 02 02 02                                ......          
> HCI Event: Number of Completed Packets (0x13) plen 5    #151 [hci1] 12.878967
        Num handles: 1
        Handle: 1389 Address: DF:A9:FF:F6:B1:1A (OUI DF-A9-FF)
        Count: 1
        #150: len 27 (1 Kb/s)
        Latency: 168 msec (71-174 msec ~168 msec)
> ACL Data RX: Handle 1389 flags 0x02 dlen 9              #152 [hci1] 12.879382
      ATT: Read Blob Request (0x0c) len 4
        Handle: 0x0051
        Offset: 0x0042
< HCI Command: Host Number of Com.. (0x03|0x0035) plen 5  #153 [hci1] 12.889896
        Num handles: 1
        Handle: 1389 Address: DF:A9:FF:F6:B1:1A (OUI DF-A9-FF)
        Count: 1
< ACL Data TX: Handle 1389 flags 0x00 dlen 27             #154 [hci1] 12.889930
      ATT: Read Blob Response (0x0d) len 22
        02 02 02 02 02 02 02 02 02 02 02 02 02 02 02 02  ................
        02 02 02 02 02 02                                ......          
> HCI Event: Number of Completed Packets (0x13) plen 5    #155 [hci1] 13.054057
        Num handles: 1
        Handle: 1389 Address: DF:A9:FF:F6:B1:1A (OUI DF-A9-FF)
        Count: 1
        #154: len 27 (1 Kb/s)
        Latency: 164 msec (71-174 msec ~166 msec)
> ACL Data RX: Handle 1389 flags 0x02 dlen 9              #156 [hci1] 13.054199
      ATT: Read Blob Request (0x0c) len 4
        Handle: 0x0051
        Offset: 0x0058
< HCI Command: Host Number of Com.. (0x03|0x0035) plen 5  #157 [hci1] 13.069881
        Num handles: 1
        Handle: 1389 Address: DF:A9:FF:F6:B1:1A (OUI DF-A9-FF)
        Count: 1
< ACL Data TX: Handle 1389 flags 0x00 dlen 27             #158 [hci1] 13.069971
      ATT: Read Blob Response (0x0d) len 22
        02 02 02 02 02 02 02 02 02 02 02 02 02 02 02 02  ................
        02 02 02 02 02 02                                ......          
> HCI Event: Number of Completed Packets (0x13) plen 5    #159 [hci1] 13.229045
        Num handles: 1
        Handle: 1389 Address: DF:A9:FF:F6:B1:1A (OUI DF-A9-FF)
        Count: 1
        #158: len 27 (1 Kb/s)
        Latency: 159 msec (71-174 msec ~162 msec)
> ACL Data RX: Handle 1389 flags 0x02 dlen 9              #160 [hci1] 13.229159
      ATT: Read Blob Request (0x0c) len 4
        Handle: 0x0051
        Offset: 0x006e
< HCI Command: Host Number of Com.. (0x03|0x0035) plen 5  #161 [hci1] 13.229923
        Num handles: 1
        Handle: 1389 Address: DF:A9:FF:F6:B1:1A (OUI DF-A9-FF)
        Count: 1
< ACL Data TX: Handle 1389 flags 0x00 dlen 27             #162 [hci1] 13.230000
      ATT: Read Blob Response (0x0d) len 22
        02 02 02 02 02 02 02 02 02 02 02 02 02 02 02 02  ................
        02 02 02 02 02 02                                ......          
> HCI Event: Number of Completed Packets (0x13) plen 5    #163 [hci1] 13.404086
        Num handles: 1
        Handle: 1389 Address: DF:A9:FF:F6:B1:1A (OUI DF-A9-FF)
        Count: 1
        #162: len 27 (1 Kb/s)
        Latency: 174 msec (71-174 msec ~168 msec)
> ACL Data RX: Handle 1389 flags 0x02 dlen 9              #164 [hci1] 13.404203
      ATT: Read Blob Request (0x0c) len 4
        Handle: 0x0051
        Offset: 0x0084
< HCI Command: Host Number of Com.. (0x03|0x0035) plen 5  #165 [hci1] 13.410398
        Num handles: 1
        Handle: 1389 Address: DF:A9:FF:F6:B1:1A (OUI DF-A9-FF)
        Count: 1
< ACL Data TX: Handle 1389 flags 0x00 dlen 27             #166 [hci1] 13.410511
      ATT: Read Blob Response (0x0d) len 22
        02 02 02 02 02 02 02 02 02 02 02 02 02 02 02 02  ................
        02 02 02 02 02 02                                ......          
> HCI Event: Number of Completed Packets (0x13) plen 5    #167 [hci1] 13.579179
        Num handles: 1
        Handle: 1389 Address: DF:A9:FF:F6:B1:1A (OUI DF-A9-FF)
        Count: 1
        #166: len 27 (1 Kb/s)
        Latency: 168 msec (71-174 msec ~168 msec)
> ACL Data RX: Handle 1389 flags 0x02 dlen 9              #168 [hci1] 13.579292
      ATT: Read Blob Request (0x0c) len 4
        Handle: 0x0051
        Offset: 0x009a
< HCI Command: Host Number of Com.. (0x03|0x0035) plen 5  #169 [hci1] 13.590201
        Num handles: 1
        Handle: 1389 Address: DF:A9:FF:F6:B1:1A (OUI DF-A9-FF)
        Count: 1
< ACL Data TX: Handle 1389 flags 0x00 dlen 27             #170 [hci1] 13.590341
      ATT: Read Blob Response (0x0d) len 22
        02 02 02 02 02 02 02 02 02 02 02 02 02 02 02 02  ................
        02 02 02 02 02 02                                ......          
> HCI Event: Number of Completed Packets (0x13) plen 5    #171 [hci1] 13.754113
        Num handles: 1
        Handle: 1389 Address: DF:A9:FF:F6:B1:1A (OUI DF-A9-FF)
        Count: 1
        #170: len 27 (1 Kb/s)
        Latency: 163 msec (71-174 msec ~166 msec)
> ACL Data RX: Handle 1389 flags 0x02 dlen 9              #172 [hci1] 13.754188
      ATT: Read Blob Request (0x0c) len 4
        Handle: 0x0051
        Offset: 0x00b0
< HCI Command: Host Number of Com.. (0x03|0x0035) plen 5  #173 [hci1] 13.769721
        Num handles: 1
        Handle: 1389 Address: DF:A9:FF:F6:B1:1A (OUI DF-A9-FF)
        Count: 1
< ACL Data TX: Handle 1389 flags 0x00 dlen 27             #174 [hci1] 13.769768
      ATT: Read Blob Response (0x0d) len 22
        02 02 02 02 02 02 02 02 02 02 02 02 02 02 02 02  ................
        02 02 02 02 02 02                                ......          
> HCI Event: Number of Completed Packets (0x13) plen 5    #175 [hci1] 13.929012
        Num handles: 1
        Handle: 1389 Address: DF:A9:FF:F6:B1:1A (OUI DF-A9-FF)
        Count: 1
        #174: len 27 (1 Kb/s)
        Latency: 159 msec (71-174 msec ~162 msec)
> ACL Data RX: Handle 1389 flags 0x02 dlen 9              #176 [hci1] 13.929249
      ATT: Read Blob Request (0x0c) len 4
        Handle: 0x0051
        Offset: 0x00c6
< HCI Command: Host Number of Com.. (0x03|0x0035) plen 5  #177 [hci1] 13.929827
        Num handles: 1
        Handle: 1389 Address: DF:A9:FF:F6:B1:1A (OUI DF-A9-FF)
        Count: 1
< ACL Data TX: Handle 1389 flags 0x00 dlen 27             #178 [hci1] 13.929876
      ATT: Read Blob Response (0x0d) len 22
        02 02 02 02 02 02 02 02 02 02 02 02 02 02 02 02  ................
        02 02 02 02 02 02                                ......          
> HCI Event: Number of Completed Packets (0x13) plen 5    #179 [hci1] 14.104118
        Num handles: 1
        Handle: 1389 Address: DF:A9:FF:F6:B1:1A (OUI DF-A9-FF)
        Count: 1
        #178: len 27 (1 Kb/s)
        Latency: 174 msec (71-174 msec ~168 msec)
> ACL Data RX: Handle 1389 flags 0x02 dlen 9              #180 [hci1] 14.104189
      ATT: Read Blob Request (0x0c) len 4
        Handle: 0x0051
        Offset: 0x00dc
< HCI Command: Host Number of Com.. (0x03|0x0035) plen 5  #181 [hci1] 14.110270
        Num handles: 1
        Handle: 1389 Address: DF:A9:FF:F6:B1:1A (OUI DF-A9-FF)
        Count: 1
< ACL Data TX: Handle 1389 flags 0x00 dlen 27             #182 [hci1] 14.110345
      ATT: Read Blob Response (0x0d) len 22
        02 02 02 02 02 02 02 02 02 02 02 02 02 02 02 02  ................
        02 02 02 02 02 02                                ......          
> HCI Event: Number of Completed Packets (0x13) plen 5    #183 [hci1] 14.278985
        Num handles: 1
        Handle: 1389 Address: DF:A9:FF:F6:B1:1A (OUI DF-A9-FF)
        Count: 1
        #182: len 27 (1 Kb/s)
        Latency: 168 msec (71-174 msec ~168 msec)
> ACL Data RX: Handle 1389 flags 0x02 dlen 9              #184 [hci1] 14.279236
      ATT: Read Blob Request (0x0c) len 4
        Handle: 0x0051
        Offset: 0x00f2
< HCI Command: Host Number of Com.. (0x03|0x0035) plen 5  #185 [hci1] 14.290364
        Num handles: 1
        Handle: 1389 Address: DF:A9:FF:F6:B1:1A (OUI DF-A9-FF)
        Count: 1
< ACL Data TX: Handle 1389 flags 0x00 dlen 27             #186 [hci1] 14.290453
      ATT: Read Blob Response (0x0d) len 22
        02 02 02 02 02 02 02 02 02 02 02 02 02 02 02 02  ................
        02 02 02 02 02 02                                ......          
> HCI Event: Number of Completed Packets (0x13) plen 5    #187 [hci1] 14.454019
        Num handles: 1
        Handle: 1389 Address: DF:A9:FF:F6:B1:1A (OUI DF-A9-FF)
        Count: 1
        #186: len 27 (1 Kb/s)
        Latency: 163 msec (71-174 msec ~166 msec)
> ACL Data RX: Handle 1389 flags 0x02 dlen 9              #188 [hci1] 14.454265
      ATT: Read Blob Request (0x0c) len 4
        Handle: 0x0051
        Offset: 0x0108
< HCI Command: Host Number of Com.. (0x03|0x0035) plen 5  #189 [hci1] 14.469935
        Num handles: 1
        Handle: 1389 Address: DF:A9:FF:F6:B1:1A (OUI DF-A9-FF)
        Count: 1
< ACL Data TX: Handle 1389 flags 0x00 dlen 27             #190 [hci1] 14.469981
      ATT: Read Blob Response (0x0d) len 22
        02 02 02 02 02 02 02 02 02 02 02 02 02 02 02 02  ................
        02 02 02 02 02 02                                ......          
> HCI Event: Number of Completed Packets (0x13) plen 5    #191 [hci1] 14.629140
        Num handles: 1
        Handle: 1389 Address: DF:A9:FF:F6:B1:1A (OUI DF-A9-FF)
        Count: 1
        #190: len 27 (1 Kb/s)
        Latency: 159 msec (71-174 msec ~162 msec)
> ACL Data RX: Handle 1389 flags 0x02 dlen 9              #192 [hci1] 14.629179
      ATT: Read Blob Request (0x0c) len 4
        Handle: 0x0051
        Offset: 0x011e
< HCI Command: Host Number of Com.. (0x03|0x0035) plen 5  #193 [hci1] 14.630295
        Num handles: 1
        Handle: 1389 Address: DF:A9:FF:F6:B1:1A (OUI DF-A9-FF)
        Count: 1
< ACL Data TX: Handle 1389 flags 0x00 dlen 27             #194 [hci1] 14.630387
      ATT: Read Blob Response (0x0d) len 22
        02 02 02 02 02 02 02 02 02 02 02 02 02 02 02 02  ................
        02 02 02 02 02 02                                ......          
> HCI Event: Number of Completed Packets (0x13) plen 5    #195 [hci1] 14.803978
        Num handles: 1
        Handle: 1389 Address: DF:A9:FF:F6:B1:1A (OUI DF-A9-FF)
        Count: 1
        #194: len 27 (1 Kb/s)
        Latency: 173 msec (71-174 msec ~168 msec)
> ACL Data RX: Handle 1389 flags 0x02 dlen 9              #196 [hci1] 14.804243
      ATT: Read Blob Request (0x0c) len 4
        Handle: 0x0051
        Offset: 0x0134
< HCI Command: Host Number of Com.. (0x03|0x0035) plen 5  #197 [hci1] 14.810274
        Num handles: 1
        Handle: 1389 Address: DF:A9:FF:F6:B1:1A (OUI DF-A9-FF)
        Count: 1
< ACL Data TX: Handle 1389 flags 0x00 dlen 27             #198 [hci1] 14.810391
      ATT: Read Blob Response (0x0d) len 22
        02 02 02 02 02 02 02 02 02 02 02 02 02 02 02 02  ................
        02 02 02 02 02 02                                ......          
> HCI Event: Number of Completed Packets (0x13) plen 5    #199 [hci1] 14.979024
        Num handles: 1
        Handle: 1389 Address: DF:A9:FF:F6:B1:1A (OUI DF-A9-FF)
        Count: 1
        #198: len 27 (1 Kb/s)
        Latency: 168 msec (71-174 msec ~168 msec)
> ACL Data RX: Handle 1389 flags 0x02 dlen 9              #200 [hci1] 14.979189
      ATT: Read Blob Request (0x0c) len 4
        Handle: 0x0051
        Offset: 0x014a
< HCI Command: Host Number of Com.. (0x03|0x0035) plen 5  #201 [hci1] 14.989902
        Num handles: 1
        Handle: 1389 Address: DF:A9:FF:F6:B1:1A (OUI DF-A9-FF)
        Count: 1
< ACL Data TX: Handle 1389 flags 0x00 dlen 27             #202 [hci1] 14.989978
      ATT: Read Blob Response (0x0d) len 22
        02 02 02 02 02 02 02 02 02 02 02 02 02 02 02 02  ................
        02 02 02 02 02 02                                ......          
> HCI Event: Number of Completed Packets (0x13) plen 5    #203 [hci1] 15.153936
        Num handles: 1
        Handle: 1389 Address: DF:A9:FF:F6:B1:1A (OUI DF-A9-FF)
        Count: 1
        #202: len 27 (1 Kb/s)
        Latency: 163 msec (71-174 msec ~166 msec)
> ACL Data RX: Handle 1389 flags 0x02 dlen 9              #204 [hci1] 15.154245
      ATT: Read Blob Request (0x0c) len 4
        Handle: 0x0051
        Offset: 0x0160
< HCI Command: Host Number of Com.. (0x03|0x0035) plen 5  #205 [hci1] 15.170273
        Num handles: 1
        Handle: 1389 Address: DF:A9:FF:F6:B1:1A (OUI DF-A9-FF)
        Count: 1
< ACL Data TX: Handle 1389 flags 0x00 dlen 27             #206 [hci1] 15.170402
      ATT: Read Blob Response (0x0d) len 22
        02 02 02 02 02 02 02 02 02 02 02 02 02 02 02 02  ................
        02 02 02 02 02 02                                ......          
> HCI Event: Number of Completed Packets (0x13) plen 5    #207 [hci1] 15.328941
        Num handles: 1
        Handle: 1389 Address: DF:A9:FF:F6:B1:1A (OUI DF-A9-FF)
        Count: 1
        #206: len 27 (1 Kb/s)
        Latency: 158 msec (71-174 msec ~162 msec)
> ACL Data RX: Handle 1389 flags 0x02 dlen 9              #208 [hci1] 15.329207
      ATT: Read Blob Request (0x0c) len 4
        Handle: 0x0051
        Offset: 0x0176
< HCI Command: Host Number of Com.. (0x03|0x0035) plen 5  #209 [hci1] 15.330014
        Num handles: 1
        Handle: 1389 Address: DF:A9:FF:F6:B1:1A (OUI DF-A9-FF)
        Count: 1
< ACL Data TX: Handle 1389 flags 0x00 dlen 27             #210 [hci1] 15.330071
      ATT: Read Blob Response (0x0d) len 22
        02 02 02 02 02 02 02 02 02 02 02 02 02 02 02 02  ................
        02 02 02 02 02 02                                ......          
> HCI Event: Number of Completed Packets (0x13) plen 5    #211 [hci1] 15.504027
        Num handles: 1
        Handle: 1389 Address: DF:A9:FF:F6:B1:1A (OUI DF-A9-FF)
        Count: 1
        #210: len 27 (1 Kb/s)
        Latency: 173 msec (71-174 msec ~168 msec)
> ACL Data RX: Handle 1389 flags 0x02 dlen 9              #212 [hci1] 15.504144
      ATT: Read Blob Request (0x0c) len 4
        Handle: 0x0051
        Offset: 0x018c
< HCI Command: Host Number of Com.. (0x03|0x0035) plen 5  #213 [hci1] 15.510342
        Num handles: 1
        Handle: 1389 Address: DF:A9:FF:F6:B1:1A (OUI DF-A9-FF)
        Count: 1
< ACL Data TX: Handle 1389 flags 0x00 dlen 27             #214 [hci1] 15.510413
      ATT: Read Blob Response (0x0d) len 22
        02 02 02 02 02 02 02 02 02 02 02 02 02 02 02 02  ................
        02 02 02 02 02 02                                ......          
> HCI Event: Number of Completed Packets (0x13) plen 5    #215 [hci1] 15.678913
        Num handles: 1
        Handle: 1389 Address: DF:A9:FF:F6:B1:1A (OUI DF-A9-FF)
        Count: 1
        #214: len 27 (1 Kb/s)
        Latency: 168 msec (71-174 msec ~168 msec)
> ACL Data RX: Handle 1389 flags 0x02 dlen 9              #216 [hci1] 15.679162
      ATT: Read Blob Request (0x0c) len 4
        Handle: 0x0051
        Offset: 0x01a2
< HCI Command: Host Number of Com.. (0x03|0x0035) plen 5  #217 [hci1] 15.690284
        Num handles: 1
        Handle: 1389 Address: DF:A9:FF:F6:B1:1A (OUI DF-A9-FF)
        Count: 1
< ACL Data TX: Handle 1389 flags 0x00 dlen 27             #218 [hci1] 15.690388
      ATT: Read Blob Response (0x0d) len 22
        02 02 02 02 02 02 02 02 02 02 02 02 02 02 02 02  ................
        02 02 02 02 02 02                                ......          
> HCI Event: Number of Completed Packets (0x13) plen 5    #219 [hci1] 15.854097
        Num handles: 1
        Handle: 1389 Address: DF:A9:FF:F6:B1:1A (OUI DF-A9-FF)
        Count: 1
        #218: len 27 (1 Kb/s)
        Latency: 163 msec (71-174 msec ~166 msec)
> ACL Data RX: Handle 1389 flags 0x02 dlen 9              #220 [hci1] 15.854226
      ATT: Read Blob Request (0x0c) len 4
        Handle: 0x0051
        Offset: 0x01b8
< HCI Command: Host Number of Com.. (0x03|0x0035) plen 5  #221 [hci1] 15.870231
        Num handles: 1
        Handle: 1389 Address: DF:A9:FF:F6:B1:1A (OUI DF-A9-FF)
        Count: 1
< ACL Data TX: Handle 1389 flags 0x00 dlen 27             #222 [hci1] 15.870295
      ATT: Read Blob Response (0x0d) len 22
        02 02 02 02 02 02 02 02 02 02 02 02 02 02 02 02  ................
        02 02 02 02 02 02                                ......          
> HCI Event: Number of Completed Packets (0x13) plen 5    #223 [hci1] 16.029031
        Num handles: 1
        Handle: 1389 Address: DF:A9:FF:F6:B1:1A (OUI DF-A9-FF)
        Count: 1
        #222: len 27 (1 Kb/s)
        Latency: 158 msec (71-174 msec ~162 msec)
> ACL Data RX: Handle 1389 flags 0x02 dlen 9              #224 [hci1] 16.029320
      ATT: Read Blob Request (0x0c) len 4
        Handle: 0x0051
        Offset: 0x01ce
< HCI Command: Host Number of Com.. (0x03|0x0035) plen 5  #225 [hci1] 16.030299
        Num handles: 1
        Handle: 1389 Address: DF:A9:FF:F6:B1:1A (OUI DF-A9-FF)
        Count: 1
< ACL Data TX: Handle 1389 flags 0x00 dlen 27             #226 [hci1] 16.030395
      ATT: Read Blob Response (0x0d) len 22
        02 02 02 02 02 02 02 02 02 02 02 02 02 02 02 02  ................
        02 02 02 02 02 02                                ......          
> HCI Event: Number of Completed Packets (0x13) plen 5    #227 [hci1] 16.204130
        Num handles: 1
        Handle: 1389 Address: DF:A9:FF:F6:B1:1A (OUI DF-A9-FF)
        Count: 1
        #226: len 27 (1 Kb/s)
        Latency: 173 msec (71-174 msec ~168 msec)
> ACL Data RX: Handle 1389 flags 0x02 dlen 9              #228 [hci1] 16.204268
      ATT: Read Blob Request (0x0c) len 4
        Handle: 0x0051
        Offset: 0x01e4
< HCI Command: Host Number of Com.. (0x03|0x0035) plen 5  #229 [hci1] 16.210033
        Num handles: 1
        Handle: 1389 Address: DF:A9:FF:F6:B1:1A (OUI DF-A9-FF)
        Count: 1
< ACL Data TX: Handle 1389 flags 0x00 dlen 27             #230 [hci1] 16.210078
      ATT: Read Blob Response (0x0d) len 22
        02 02 02 02 02 02 02 02 02 02 02 02 02 02 02 02  ................
        02 02 02 02 02 02                                ......          
> HCI Event: Number of Completed Packets (0x13) plen 5    #231 [hci1] 16.379019
        Num handles: 1
        Handle: 1389 Address: DF:A9:FF:F6:B1:1A (OUI DF-A9-FF)
        Count: 1
        #230: len 27 (1 Kb/s)
        Latency: 168 msec (71-174 msec ~168 msec)
> ACL Data RX: Handle 1389 flags 0x02 dlen 9              #232 [hci1] 16.379201
      ATT: Read Blob Request (0x0c) len 4
        Handle: 0x0051
        Offset: 0x01fa
< HCI Command: Host Number of Com.. (0x03|0x0035) plen 5  #233 [hci1] 16.390039
        Num handles: 1
        Handle: 1389 Address: DF:A9:FF:F6:B1:1A (OUI DF-A9-FF)
        Count: 1
< ACL Data TX: Handle 1389 flags 0x00 dlen 11             #234 [hci1] 16.390140
      ATT: Read Blob Response (0x0d) len 6
        02 02 02 02 02 02                                ......          
> HCI Event: Number of Completed Packets (0x13) plen 5    #235 [hci1] 16.554016
        Num handles: 1
        Handle: 1389 Address: DF:A9:FF:F6:B1:1A (OUI DF-A9-FF)
        Count: 1
        #234: len 11 (0 Kb/s)
        Latency: 163 msec (71-174 msec ~166 msec)
> ACL Data RX: Handle 1389 flags 0x02 dlen 7              #236 [hci1] 16.554155
      ATT: Read Request (0x0a) len 2
        Handle: 0x003e
< HCI Command: Host Number of Com.. (0x03|0x0035) plen 5  #237 [hci1] 16.570326
        Num handles: 1
        Handle: 1389 Address: DF:A9:FF:F6:B1:1A (OUI DF-A9-FF)
        Count: 1
< ACL Data TX: Handle 1389 flags 0x00 dlen 9              #238 [hci1] 16.570564
      ATT: Error Response (0x01) len 4
        Read Request (0x0a)
        Handle: 0x003e
        Error: Insufficient Authentication (0x05)
> HCI Event: Number of Completed Packets (0x13) plen 5    #239 [hci1] 16.728978
        Num handles: 1
        Handle: 1389 Address: DF:A9:FF:F6:B1:1A (OUI DF-A9-FF)
        Count: 1
        #238: len 9 (0 Kb/s)
        Latency: 158 msec (71-174 msec ~162 msec)
> ACL Data RX: Handle 1389 flags 0x02 dlen 7              #240 [hci1] 16.729151
      ATT: Read Request (0x0a) len 2
        Handle: 0x001a
< HCI Command: Host Number of Com.. (0x03|0x0035) plen 5  #241 [hci1] 16.729674
        Num handles: 1
        Handle: 1389 Address: DF:A9:FF:F6:B1:1A (OUI DF-A9-FF)
        Count: 1
< ACL Data TX: Handle 1389 flags 0x00 dlen 5              #242 [hci1] 16.730502
      ATT: Read Response (0x0b) len 0
> HCI Event: Number of Completed Packets (0x13) plen 5    #243 [hci1] 16.904020
        Num handles: 1
        Handle: 1389 Address: DF:A9:FF:F6:B1:1A (OUI DF-A9-FF)
        Count: 1
        #242: len 5 (0 Kb/s)
        Latency: 173 msec (71-174 msec ~167 msec)
> ACL Data RX: Handle 1389 flags 0x02 dlen 7              #244 [hci1] 16.904113
      ATT: Read Request (0x0a) len 2
        Handle: 0x0011
< HCI Command: Host Number of Com.. (0x03|0x0035) plen 5  #245 [hci1] 16.909820
        Num handles: 1
        Handle: 1389 Address: DF:A9:FF:F6:B1:1A (OUI DF-A9-FF)
        Count: 1
< ACL Data TX: Handle 1389 flags 0x00 dlen 13             #246 [hci1] 16.909891
      ATT: Read Response (0x0b) len 8
> HCI Event: Number of Completed Packets (0x13) plen 5    #247 [hci1] 17.078871
        Num handles: 1
        Handle: 1389 Address: DF:A9:FF:F6:B1:1A (OUI DF-A9-FF)
        Count: 1
        #246: len 13 (0 Kb/s)
        Latency: 168 msec (71-174 msec ~168 msec)
> ACL Data RX: Handle 1389 flags 0x02 dlen 7              #248 [hci1] 17.079083
      ATT: Read Request (0x0a) len 2
        Handle: 0x003b
< HCI Command: Host Number of Com.. (0x03|0x0035) plen 5  #249 [hci1] 17.092040
        Num handles: 1
        Handle: 1389 Address: DF:A9:FF:F6:B1:1A (OUI DF-A9-FF)
        Count: 1
< ACL Data TX: Handle 1389 flags 0x00 dlen 13             #250 [hci1] 17.092052
      ATT: Read Response (0x0b) len 8
> HCI Event: Number of Completed Packets (0x13) plen 5    #251 [hci1] 17.253839
        Num handles: 1
        Handle: 1389 Address: DF:A9:FF:F6:B1:1A (OUI DF-A9-FF)
        Count: 1
        #250: len 13 (0 Kb/s)
        Latency: 161 msec (71-174 msec ~165 msec)
> ACL Data RX: Handle 1389 flags 0x02 dlen 7              #252 [hci1] 17.254116
      ATT: Read Request (0x0a) len 2
        Handle: 0x0046
< HCI Command: Host Number of Com.. (0x03|0x0035) plen 5  #253 [hci1] 17.270431
        Num handles: 1
        Handle: 1389 Address: DF:A9:FF:F6:B1:1A (OUI DF-A9-FF)
        Count: 1
< ACL Data TX: Handle 1389 flags 0x00 dlen 27             #254 [hci1] 17.270443
      ATT: Read Response (0x0b) len 22
> HCI Event: Number of Completed Packets (0x13) plen 5    #255 [hci1] 17.429142
        Num handles: 1
        Handle: 1389 Address: DF:A9:FF:F6:B1:1A (OUI DF-A9-FF)
        Count: 1
        #254: len 27 (1 Kb/s)
        Latency: 158 msec (71-174 msec ~161 msec)
> ACL Data RX: Handle 1389 flags 0x02 dlen 9              #256 [hci1] 17.429146
      ATT: Read Blob Request (0x0c) len 4
        Handle: 0x0046
        Offset: 0x0016
< HCI Command: Host Number of Com.. (0x03|0x0035) plen 5  #257 [hci1] 17.429633
        Num handles: 1
        Handle: 1389 Address: DF:A9:FF:F6:B1:1A (OUI DF-A9-FF)
        Count: 1
< ACL Data TX: Handle 1389 flags 0x00 dlen 15             #258 [hci1] 17.429642
      ATT: Read Blob Response (0x0d) len 10
        cd ef 01 23 45 67 89 ab cd ef                    ...#Eg....      
> HCI Event: Number of Completed Packets (0x13) plen 5    #259 [hci1] 17.604062
        Num handles: 1
        Handle: 1389 Address: DF:A9:FF:F6:B1:1A (OUI DF-A9-FF)
        Count: 1
        #258: len 15 (0 Kb/s)
        Latency: 174 msec (71-174 msec ~168 msec)
> ACL Data RX: Handle 1389 flags 0x02 dlen 7              #260 [hci1] 17.604069
      ATT: Read Request (0x0a) len 2
        Handle: 0x004a
< HCI Command: Host Number of Com.. (0x03|0x0035) plen 5  #261 [hci1] 17.610334
        Num handles: 1
        Handle: 1389 Address: DF:A9:FF:F6:B1:1A (OUI DF-A9-FF)
        Count: 1
< ACL Data TX: Handle 1389 flags 0x00 dlen 9              #262 [hci1] 17.610486
      ATT: Error Response (0x01) len 4
        Read Request (0x0a)
        Handle: 0x004a
        Error: Insufficient Authentication (0x05)
> HCI Event: Number of Completed Packets (0x13) plen 5    #263 [hci1] 17.778908
        Num handles: 1
        Handle: 1389 Address: DF:A9:FF:F6:B1:1A (OUI DF-A9-FF)
        Count: 1
        #262: len 9 (0 Kb/s)
        Latency: 168 msec (71-174 msec ~168 msec)
> ACL Data RX: Handle 1389 flags 0x02 dlen 7              #264 [hci1] 17.779102
      ATT: Read Request (0x0a) len 2
        Handle: 0x002d
< HCI Command: Host Number of Com.. (0x03|0x0035) plen 5  #265 [hci1] 17.789885
        Num handles: 1
        Handle: 1389 Address: DF:A9:FF:F6:B1:1A (OUI DF-A9-FF)
        Count: 1
< ACL Data TX: Handle 1389 flags 0x00 dlen 9              #266 [hci1] 17.790002
      ATT: Error Response (0x01) len 4
        Read Request (0x0a)
        Handle: 0x002d
        Error: Insufficient Authentication (0x05)
> HCI Event: Number of Completed Packets (0x13) plen 5    #267 [hci1] 17.953913
        Num handles: 1
        Handle: 1389 Address: DF:A9:FF:F6:B1:1A (OUI DF-A9-FF)
        Count: 1
        #266: len 9 (0 Kb/s)
        Latency: 163 msec (71-174 msec ~166 msec)
> ACL Data RX: Handle 1389 flags 0x02 dlen 7              #268 [hci1] 17.954036
      ATT: Read Request (0x0a) len 2
        Handle: 0x0026
< HCI Command: Host Number of Com.. (0x03|0x0035) plen 5  #269 [hci1] 17.970530
        Num handles: 1
        Handle: 1389 Address: DF:A9:FF:F6:B1:1A (OUI DF-A9-FF)
        Count: 1
< ACL Data TX: Handle 1389 flags 0x00 dlen 5              #270 [hci1] 17.970646
      ATT: Read Response (0x0b) len 0
> HCI Event: Number of Completed Packets (0x13) plen 5    #271 [hci1] 18.129013
        Num handles: 1
        Handle: 1389 Address: DF:A9:FF:F6:B1:1A (OUI DF-A9-FF)
        Count: 1
        #270: len 5 (0 Kb/s)
        Latency: 158 msec (71-174 msec ~162 msec)
> ACL Data RX: Handle 1389 flags 0x02 dlen 7              #272 [hci1] 18.129175
      ATT: Read Request (0x0a) len 2
        Handle: 0x0048
< HCI Command: Host Number of Com.. (0x03|0x0035) plen 5  #273 [hci1] 18.130181
        Num handles: 1
        Handle: 1389 Address: DF:A9:FF:F6:B1:1A (OUI DF-A9-FF)
        Count: 1
< ACL Data TX: Handle 1389 flags 0x00 dlen 27             #274 [hci1] 18.130242
      ATT: Read Response (0x0b) len 22
> HCI Event: Number of Completed Packets (0x13) plen 5    #275 [hci1] 18.303951
        Num handles: 1
        Handle: 1389 Address: DF:A9:FF:F6:B1:1A (OUI DF-A9-FF)
        Count: 1
        #274: len 27 (1 Kb/s)
        Latency: 173 msec (71-174 msec ~167 msec)
> ACL Data RX: Handle 1389 flags 0x02 dlen 9              #276 [hci1] 18.304163
      ATT: Read Blob Request (0x0c) len 4
        Handle: 0x0048
        Offset: 0x0016
< HCI Command: Host Number of Com.. (0x03|0x0035) plen 5  #277 [hci1] 18.310030
        Num handles: 1
        Handle: 1389 Address: DF:A9:FF:F6:B1:1A (OUI DF-A9-FF)
        Count: 1
< ACL Data TX: Handle 1389 flags 0x00 dlen 15             #278 [hci1] 18.310043
      ATT: Read Blob Response (0x0d) len 10
        32 10 fe dc ba 98 76 54 32 10                    2.....vT2.      
> HCI Event: Number of Completed Packets (0x13) plen 5    #279 [hci1] 18.478902
        Num handles: 1
        Handle: 1389 Address: DF:A9:FF:F6:B1:1A (OUI DF-A9-FF)
        Count: 1
        #278: len 15 (0 Kb/s)
        Latency: 168 msec (71-174 msec ~168 msec)
> ACL Data RX: Handle 1389 flags 0x02 dlen 7              #280 [hci1] 18.479131
      ATT: Read Request (0x0a) len 2
        Handle: 0x0018
< HCI Command: Host Number of Com.. (0x03|0x0035) plen 5  #281 [hci1] 18.490210
        Num handles: 1
        Handle: 1389 Address: DF:A9:FF:F6:B1:1A (OUI DF-A9-FF)
        Count: 1
< ACL Data TX: Handle 1389 flags 0x00 dlen 12             #282 [hci1] 18.490308
      ATT: Read Response (0x0b) len 7
> HCI Event: Number of Completed Packets (0x13) plen 5    #283 [hci1] 18.654004
        Num handles: 1
        Handle: 1389 Address: DF:A9:FF:F6:B1:1A (OUI DF-A9-FF)
        Count: 1
        #282: len 12 (0 Kb/s)
        Latency: 163 msec (71-174 msec ~166 msec)
> ACL Data RX: Handle 1389 flags 0x02 dlen 7              #284 [hci1] 18.654132
      ATT: Read Request (0x0a) len 2
        Handle: 0x0022
< HCI Command: Host Number of Com.. (0x03|0x0035) plen 5  #285 [hci1] 18.670152
        Num handles: 1
        Handle: 1389 Address: DF:A9:FF:F6:B1:1A (OUI DF-A9-FF)
        Count: 1
< ACL Data TX: Handle 1389 flags 0x00 dlen 6              #286 [hci1] 18.670215
      ATT: Read Response (0x0b) len 1
> HCI Event: Number of Completed Packets (0x13) plen 5    #287 [hci1] 18.828948
        Num handles: 1
        Handle: 1389 Address: DF:A9:FF:F6:B1:1A (OUI DF-A9-FF)
        Count: 1
        #286: len 6 (0 Kb/s)
        Latency: 158 msec (71-174 msec ~162 msec)
> ACL Data RX: Handle 1389 flags 0x02 dlen 7              #288 [hci1] 18.829076
      ATT: Read Request (0x0a) len 2
        Handle: 0x0016
< HCI Command: Host Number of Com.. (0x03|0x0035) plen 5  #289 [hci1] 18.829885
        Num handles: 1
        Handle: 1389 Address: DF:A9:FF:F6:B1:1A (OUI DF-A9-FF)
        Count: 1
< ACL Data TX: Handle 1389 flags 0x00 dlen 17             #290 [hci1] 18.829956
      ATT: Read Response (0x0b) len 12
> HCI Event: Number of Completed Packets (0x13) plen 5    #291 [hci1] 19.003951
        Num handles: 1
        Handle: 1389 Address: DF:A9:FF:F6:B1:1A (OUI DF-A9-FF)
        Count: 1
        #290: len 17 (0 Kb/s)
        Latency: 173 msec (71-174 msec ~168 msec)
> ACL Data RX: Handle 1389 flags 0x02 dlen 7              #292 [hci1] 19.004088
      ATT: Read Request (0x0a) len 2
        Handle: 0x0008
< HCI Command: Host Number of Com.. (0x03|0x0035) plen 5  #293 [hci1] 19.009990
        Num handles: 1
        Handle: 1389 Address: DF:A9:FF:F6:B1:1A (OUI DF-A9-FF)
        Count: 1
< ACL Data TX: Handle 1389 flags 0x00 dlen 21             #294 [hci1] 19.010031
      ATT: Read Response (0x0b) len 16
> HCI Event: Number of Completed Packets (0x13) plen 5    #295 [hci1] 19.179034
        Num handles: 1
        Handle: 1389 Address: DF:A9:FF:F6:B1:1A (OUI DF-A9-FF)
        Count: 1
        #294: len 21 (0 Kb/s)
        Latency: 169 msec (71-174 msec ~168 msec)
> ACL Data RX: Handle 1389 flags 0x02 dlen 7              #296 [hci1] 19.179129
      ATT: Read Request (0x0a) len 2
        Handle: 0x0024
< HCI Command: Host Number of Com.. (0x03|0x0035) plen 5  #297 [hci1] 19.190148
        Num handles: 1
        Handle: 1389 Address: DF:A9:FF:F6:B1:1A (OUI DF-A9-FF)
        Count: 1
< ACL Data TX: Handle 1389 flags 0x00 dlen 13             #298 [hci1] 19.190224
      ATT: Read Response (0x0b) len 8
> HCI Event: Number of Completed Packets (0x13) plen 5    #299 [hci1] 19.353934
        Num handles: 1
        Handle: 1389 Address: DF:A9:FF:F6:B1:1A (OUI DF-A9-FF)
        Count: 1
        #298: len 13 (0 Kb/s)
        Latency: 163 msec (71-174 msec ~166 msec)
> ACL Data RX: Handle 1389 flags 0x02 dlen 7              #300 [hci1] 19.354080
      ATT: Read Request (0x0a) len 2
        Handle: 0x001c
< HCI Command: Host Number of Com.. (0x03|0x0035) plen 5  #301 [hci1] 19.370044
        Num handles: 1
        Handle: 1389 Address: DF:A9:FF:F6:B1:1A (OUI DF-A9-FF)
        Count: 1
< ACL Data TX: Handle 1389 flags 0x00 dlen 12             #302 [hci1] 19.370119
      ATT: Read Response (0x0b) len 7
> HCI Event: Number of Completed Packets (0x13) plen 5    #303 [hci1] 19.528821
        Num handles: 1
        Handle: 1389 Address: DF:A9:FF:F6:B1:1A (OUI DF-A9-FF)
        Count: 1
        #302: len 12 (0 Kb/s)
        Latency: 158 msec (71-174 msec ~162 msec)
> ACL Data RX: Handle 1389 flags 0x02 dlen 7              #304 [hci1] 19.529172
      ATT: Read Request (0x0a) len 2
        Handle: 0x000f
< HCI Command: Host Number of Com.. (0x03|0x0035) plen 5  #305 [hci1] 19.529778
        Num handles: 1
        Handle: 1389 Address: DF:A9:FF:F6:B1:1A (OUI DF-A9-FF)
        Count: 1
< ACL Data TX: Handle 1389 flags 0x00 dlen 7              #306 [hci1] 19.529794
      ATT: Read Response (0x0b) len 2
> HCI Event: Number of Completed Packets (0x13) plen 5    #307 [hci1] 19.703919
        Num handles: 1
        Handle: 1389 Address: DF:A9:FF:F6:B1:1A (OUI DF-A9-FF)
        Count: 1
        #306: len 7 (0 Kb/s)
        Latency: 174 msec (71-174 msec ~168 msec)
> ACL Data RX: Handle 1389 flags 0x02 dlen 7              #308 [hci1] 19.704104
      ATT: Read Request (0x0a) len 2
        Handle: 0x004f
< HCI Command: Host Number of Com.. (0x03|0x0035) plen 5  #309 [hci1] 19.710222
        Num handles: 1
        Handle: 1389 Address: DF:A9:FF:F6:B1:1A (OUI DF-A9-FF)
        Count: 1
< ACL Data TX: Handle 1389 flags 0x00 dlen 27             #310 [hci1] 19.710279
      ATT: Read Response (0x0b) len 22
> HCI Event: Number of Completed Packets (0x13) plen 5    #311 [hci1] 19.878998
        Num handles: 1
        Handle: 1389 Address: DF:A9:FF:F6:B1:1A (OUI DF-A9-FF)
        Count: 1
        #310: len 27 (1 Kb/s)
        Latency: 168 msec (71-174 msec ~168 msec)
> ACL Data RX: Handle 1389 flags 0x02 dlen 9              #312 [hci1] 19.879154
      ATT: Read Blob Request (0x0c) len 4
        Handle: 0x004f
        Offset: 0x0016
< HCI Command: Host Number of Com.. (0x03|0x0035) plen 5  #313 [hci1] 19.889990
        Num handles: 1
        Handle: 1389 Address: DF:A9:FF:F6:B1:1A (OUI DF-A9-FF)
        Count: 1
< ACL Data TX: Handle 1389 flags 0x00 dlen 27             #314 [hci1] 19.890033
      ATT: Read Blob Response (0x0d) len 22
        cd ef 01 23 45 67 89 ab cd ef 01 23 45 67 89 ab  ...#Eg.....#Eg..
        cd ef 01 23 45 67                                ...#Eg          
> HCI Event: Number of Completed Packets (0x13) plen 5    #315 [hci1] 20.053824
        Num handles: 1
        Handle: 1389 Address: DF:A9:FF:F6:B1:1A (OUI DF-A9-FF)
        Count: 1
        #314: len 27 (1 Kb/s)
        Latency: 163 msec (71-174 msec ~166 msec)
> ACL Data RX: Handle 1389 flags 0x02 dlen 9              #316 [hci1] 20.054096
      ATT: Read Blob Request (0x0c) len 4
        Handle: 0x004f
        Offset: 0x002c
< HCI Command: Host Number of Com.. (0x03|0x0035) plen 5  #317 [hci1] 20.070185
        Num handles: 1
        Handle: 1389 Address: DF:A9:FF:F6:B1:1A (OUI DF-A9-FF)
        Count: 1
< ACL Data TX: Handle 1389 flags 0x00 dlen 27             #318 [hci1] 20.070310
      ATT: Read Blob Response (0x0d) len 22
        89 ab cd ef 01 23 45 67 89 ab cd ef 01 23 45 67  .....#Eg.....#Eg
        89 ab cd ef 01 23                                .....#          
> HCI Event: Number of Completed Packets (0x13) plen 5    #319 [hci1] 20.228953
        Num handles: 1
        Handle: 1389 Address: DF:A9:FF:F6:B1:1A (OUI DF-A9-FF)
        Count: 1
        #318: len 27 (1 Kb/s)
        Latency: 158 msec (71-174 msec ~162 msec)
> ACL Data RX: Handle 1389 flags 0x02 dlen 9              #320 [hci1] 20.229108
      ATT: Read Blob Request (0x0c) len 4
        Handle: 0x004f
        Offset: 0x0042
< HCI Command: Host Number of Com.. (0x03|0x0035) plen 5  #321 [hci1] 20.230340
        Num handles: 1
        Handle: 1389 Address: DF:A9:FF:F6:B1:1A (OUI DF-A9-FF)
        Count: 1
< ACL Data TX: Handle 1389 flags 0x00 dlen 19             #322 [hci1] 20.230494
      ATT: Read Blob Response (0x0d) len 14
        45 67 89 ab cd ef 01 23 45 67 89 ab cd ef        Eg.....#Eg....  
> HCI Event: Number of Completed Packets (0x13) plen 5    #323 [hci1] 20.403914
        Num handles: 1
        Handle: 1389 Address: DF:A9:FF:F6:B1:1A (OUI DF-A9-FF)
        Count: 1
        #322: len 19 (0 Kb/s)
        Latency: 173 msec (71-174 msec ~167 msec)
> ACL Data RX: Handle 1389 flags 0x02 dlen 7              #324 [hci1] 20.404144
      ATT: Read Request (0x0a) len 2
        Handle: 0x0031
< HCI Command: Host Number of Com.. (0x03|0x0035) plen 5  #325 [hci1] 20.409971
        Num handles: 1
        Handle: 1389 Address: DF:A9:FF:F6:B1:1A (OUI DF-A9-FF)
        Count: 1
< ACL Data TX: Handle 1389 flags 0x00 dlen 13             #326 [hci1] 20.410050
      ATT: Read Response (0x0b) len 8
> HCI Event: Number of Completed Packets (0x13) plen 5    #327 [hci1] 20.578916
        Num handles: 1
        Handle: 1389 Address: DF:A9:FF:F6:B1:1A (OUI DF-A9-FF)
        Count: 1
        #326: len 13 (0 Kb/s)
        Latency: 168 msec (71-174 msec ~168 msec)
> ACL Data RX: Handle 1389 flags 0x02 dlen 7              #328 [hci1] 20.579093
      ATT: Read Request (0x0a) len 2
        Handle: 0x0034
< HCI Command: Host Number of Com.. (0x03|0x0035) plen 5  #329 [hci1] 20.589917
        Num handles: 1
        Handle: 1389 Address: DF:A9:FF:F6:B1:1A (OUI DF-A9-FF)
        Count: 1
< ACL Data TX: Handle 1389 flags 0x00 dlen 13             #330 [hci1] 20.589977
      ATT: Read Response (0x0b) len 8
> HCI Event: Number of Completed Packets (0x13) plen 5    #331 [hci1] 20.753942
        Num handles: 1
        Handle: 1389 Address: DF:A9:FF:F6:B1:1A (OUI DF-A9-FF)
        Count: 1
        #330: len 13 (0 Kb/s)
        Latency: 163 msec (71-174 msec ~166 msec)
> ACL Data RX: Handle 1389 flags 0x02 dlen 7              #332 [hci1] 20.754115
      ATT: Read Request (0x0a) len 2
        Handle: 0x000a
< HCI Command: Host Number of Com.. (0x03|0x0035) plen 5  #333 [hci1] 20.770453
        Num handles: 1
        Handle: 1389 Address: DF:A9:FF:F6:B1:1A (OUI DF-A9-FF)
        Count: 1
< ACL Data TX: Handle 1389 flags 0x00 dlen 6              #334 [hci1] 20.770560
      ATT: Read Response (0x0b) len 1
> HCI Event: Number of Completed Packets (0x13) plen 5    #335 [hci1] 20.928833
        Num handles: 1
        Handle: 1389 Address: DF:A9:FF:F6:B1:1A (OUI DF-A9-FF)
        Count: 1
        #334: len 6 (0 Kb/s)
        Latency: 158 msec (71-174 msec ~162 msec)
> ACL Data RX: Handle 1389 flags 0x02 dlen 7              #336 [hci1] 20.929120
      ATT: Read Request (0x0a) len 2
        Handle: 0x001e
< HCI Command: Host Number of Com.. (0x03|0x0035) plen 5  #337 [hci1] 20.929989
        Num handles: 1
        Handle: 1389 Address: DF:A9:FF:F6:B1:1A (OUI DF-A9-FF)
        Count: 1
< ACL Data TX: Handle 1389 flags 0x00 dlen 5              #338 [hci1] 20.930049
      ATT: Read Response (0x0b) len 0
> HCI Event: Number of Completed Packets (0x13) plen 5    #339 [hci1] 21.103900
        Num handles: 1
        Handle: 1389 Address: DF:A9:FF:F6:B1:1A (OUI DF-A9-FF)
        Count: 1
        #338: len 5 (0 Kb/s)
        Latency: 173 msec (71-174 msec ~168 msec)
> ACL Data RX: Handle 1389 flags 0x02 dlen 7              #340 [hci1] 21.104142
      ATT: Read Request (0x0a) len 2
        Handle: 0x0014
< HCI Command: Host Number of Com.. (0x03|0x0035) plen 5  #341 [hci1] 21.110265
        Num handles: 1
        Handle: 1389 Address: DF:A9:FF:F6:B1:1A (OUI DF-A9-FF)
        Count: 1
< ACL Data TX: Handle 1389 flags 0x00 dlen 11             #342 [hci1] 21.110322
      ATT: Read Response (0x0b) len 6
> HCI Event: Number of Completed Packets (0x13) plen 5    #343 [hci1] 21.278848
        Num handles: 1
        Handle: 1389 Address: DF:A9:FF:F6:B1:1A (OUI DF-A9-FF)
        Count: 1
        #342: len 11 (0 Kb/s)
        Latency: 168 msec (71-174 msec ~168 msec)
> ACL Data RX: Handle 1389 flags 0x02 dlen 7              #344 [hci1] 21.279019
      ATT: Read Request (0x0a) len 2
        Handle: 0x0020
< HCI Command: Host Number of Com.. (0x03|0x0035) plen 5  #345 [hci1] 21.290235
        Num handles: 1
        Handle: 1389 Address: DF:A9:FF:F6:B1:1A (OUI DF-A9-FF)
        Count: 1
< ACL Data TX: Handle 1389 flags 0x00 dlen 5              #346 [hci1] 21.290314
      ATT: Read Response (0x0b) len 0
> HCI Event: Number of Completed Packets (0x13) plen 5    #347 [hci1] 21.453777
        Num handles: 1
        Handle: 1389 Address: DF:A9:FF:F6:B1:1A (OUI DF-A9-FF)
        Count: 1
        #346: len 5 (0 Kb/s)
        Latency: 163 msec (71-174 msec ~165 msec)
> ACL Data RX: Handle 1389 flags 0x02 dlen 7              #348 [hci1] 21.454099
      ATT: Read Request (0x0a) len 2
        Handle: 0x000d
< HCI Command: Host Number of Com.. (0x03|0x0035) plen 5  #349 [hci1] 21.470171
        Num handles: 1
        Handle: 1389 Address: DF:A9:FF:F6:B1:1A (OUI DF-A9-FF)
        Count: 1
< ACL Data TX: Handle 1389 flags 0x00 dlen 11             #350 [hci1] 21.470221
      ATT: Read Response (0x0b) len 6
> HCI Event: Number of Completed Packets (0x13) plen 5    #351 [hci1] 21.628899
        Num handles: 1
        Handle: 1389 Address: DF:A9:FF:F6:B1:1A (OUI DF-A9-FF)
        Count: 1
        #350: len 11 (0 Kb/s)
        Latency: 158 msec (71-174 msec ~162 msec)
> ACL Data RX: Handle 1389 flags 0x02 dlen 7              #352 [hci1] 21.629070
      ATT: Read Request (0x0a) len 2
        Handle: 0x002b
< HCI Command: Host Number of Com.. (0x03|0x0035) plen 5  #353 [hci1] 21.630013
        Num handles: 1
        Handle: 1389 Address: DF:A9:FF:F6:B1:1A (OUI DF-A9-FF)
        Count: 1
< ACL Data TX: Handle 1389 flags 0x00 dlen 9              #354 [hci1] 21.630153
      ATT: Error Response (0x01) len 4
        Read Request (0x0a)
        Handle: 0x002b
        Error: Insufficient Authentication (0x05)
> HCI Event: Number of Completed Packets (0x13) plen 5    #355 [hci1] 21.803880
        Num handles: 1
        Handle: 1389 Address: DF:A9:FF:F6:B1:1A (OUI DF-A9-FF)
        Count: 1
        #354: len 9 (0 Kb/s)
        Latency: 173 msec (71-174 msec ~168 msec)
> ACL Data RX: Handle 1389 flags 0x02 dlen 7              #356 [hci1] 21.804068
      ATT: Read Request (0x0a) len 2
        Handle: 0x004c
< HCI Command: Host Number of Com.. (0x03|0x0035) plen 5  #357 [hci1] 21.810039
        Num handles: 1
        Handle: 1389 Address: DF:A9:FF:F6:B1:1A (OUI DF-A9-FF)
        Count: 1
< ACL Data TX: Handle 1389 flags 0x00 dlen 27             #358 [hci1] 21.810112
      ATT: Read Response (0x0b) len 22
> HCI Event: Number of Completed Packets (0x13) plen 5    #359 [hci1] 21.978949
        Num handles: 1
        Handle: 1389 Address: DF:A9:FF:F6:B1:1A (OUI DF-A9-FF)
        Count: 1
        #358: len 27 (1 Kb/s)
        Latency: 168 msec (71-174 msec ~168 msec)
> ACL Data RX: Handle 1389 flags 0x02 dlen 9              #360 [hci1] 21.979093
      ATT: Read Blob Request (0x0c) len 4
        Handle: 0x004c
        Offset: 0x0016
< HCI Command: Host Number of Com.. (0x03|0x0035) plen 5  #361 [hci1] 21.989955
        Num handles: 1
        Handle: 1389 Address: DF:A9:FF:F6:B1:1A (OUI DF-A9-FF)
        Count: 1
< ACL Data TX: Handle 1389 flags 0x00 dlen 27             #362 [hci1] 21.990048
      ATT: Read Blob Response (0x0d) len 22
        cd ef 01 23 45 67 89 ab cd ef 01 23 45 67 89 ab  ...#Eg.....#Eg..
        cd ef 01 23 45 67                                ...#Eg          
> HCI Event: Number of Completed Packets (0x13) plen 5    #363 [hci1] 22.153884
        Num handles: 1
        Handle: 1389 Address: DF:A9:FF:F6:B1:1A (OUI DF-A9-FF)
        Count: 1
        #362: len 27 (1 Kb/s)
        Latency: 163 msec (71-174 msec ~166 msec)
> ACL Data RX: Handle 1389 flags 0x02 dlen 9              #364 [hci1] 22.154194
      ATT: Read Blob Request (0x0c) len 4
        Handle: 0x004c
        Offset: 0x002c
< HCI Command: Host Number of Com.. (0x03|0x0035) plen 5  #365 [hci1] 22.169964
        Num handles: 1
        Handle: 1389 Address: DF:A9:FF:F6:B1:1A (OUI DF-A9-FF)
        Count: 1
< ACL Data TX: Handle 1389 flags 0x00 dlen 27             #366 [hci1] 22.170066
      ATT: Read Blob Response (0x0d) len 22
        89 ab cd ef 01 23 45 67 89 ab cd ef 01 23 45 67  .....#Eg.....#Eg
        89 ab cd ef 01 23                                .....#          
> HCI Event: Number of Completed Packets (0x13) plen 5    #367 [hci1] 22.328793
        Num handles: 1
        Handle: 1389 Address: DF:A9:FF:F6:B1:1A (OUI DF-A9-FF)
        Count: 1
        #366: len 27 (1 Kb/s)
        Latency: 158 msec (71-174 msec ~162 msec)
> ACL Data RX: Handle 1389 flags 0x02 dlen 9              #368 [hci1] 22.329087
      ATT: Read Blob Request (0x0c) len 4
        Handle: 0x004c
        Offset: 0x0042
< HCI Command: Host Number of Com.. (0x03|0x0035) plen 5  #369 [hci1] 22.330329
        Num handles: 1
        Handle: 1389 Address: DF:A9:FF:F6:B1:1A (OUI DF-A9-FF)
        Count: 1
< ACL Data TX: Handle 1389 flags 0x00 dlen 19             #370 [hci1] 22.330507
      ATT: Read Blob Response (0x0d) len 14
        45 67 89 ab cd ef 01 23 45 67 89 ab cd ef        Eg.....#Eg....  
> HCI Event: Number of Completed Packets (0x13) plen 5    #371 [hci1] 22.503863
        Num handles: 1
        Handle: 1389 Address: DF:A9:FF:F6:B1:1A (OUI DF-A9-FF)
        Count: 1
        #370: len 19 (0 Kb/s)
        Latency: 173 msec (71-174 msec ~167 msec)
> ACL Data RX: Handle 1389 flags 0x02 dlen 7              #372 [hci1] 22.504159
      ATT: Read Request (0x0a) len 2
        Handle: 0x002f
< HCI Command: Host Number of Com.. (0x03|0x0035) plen 5  #373 [hci1] 22.510308
        Num handles: 1
        Handle: 1389 Address: DF:A9:FF:F6:B1:1A (OUI DF-A9-FF)
        Count: 1
< ACL Data TX: Handle 1389 flags 0x00 dlen 9              #374 [hci1] 22.510473
      ATT: Error Response (0x01) len 4
        Read Request (0x0a)
        Handle: 0x002f
        Error: Insufficient Authorization (0x08)
> HCI Event: Number of Completed Packets (0x13) plen 5    #375 [hci1] 22.678829
        Num handles: 1
        Handle: 1389 Address: DF:A9:FF:F6:B1:1A (OUI DF-A9-FF)
        Count: 1
        #374: len 9 (0 Kb/s)
        Latency: 168 msec (71-174 msec ~168 msec)
> HCI Event: Disconnect Complete (0x05) plen 4            #376 [hci1] 24.079053
        Status: Success (0x00)
        Handle: 1389 Address: DF:A9:FF:F6:B1:1A (OUI DF-A9-FF)
        Reason: Remote User Terminated Connection (0x13)
< HCI Command: Reset (0x03|0x0003) plen 0                 #377 [hci1] 30.369901
> HCI Event: Command Complete (0x0e) plen 4               #378 [hci1] 30.370515
      Reset (0x03|0x0003) ncmd 1
        Status: Success (0x00)
@ USER Close: main                                    {0x0001} [hci1] 30.389827
= Close Index: 00:00:00:00:00:00                               [hci1] 30.389834
