Bluetooth monitor ver 5.72
= Note: Linux version 6.14.0-36-generic (x86_64)                       0.890295
= Note: Bluetooth subsystem version 2.22                               0.890297
= New Index: 00:00:00:00:00:00 (Primary,UART,hci1)              [hci1] 0.890299
= New Index: 48:5F:99:8E:E0:64 (Primary,USB,hci0)               [hci0] 0.890299
= Open Index: 00:00:00:00:00:00                                 [hci1] 1.404121
= Index Info: 00:00:00:00:00:00 (Nordic Semiconductor ASA)      [hci1] 1.404141
@ USER Open: main (privileged) version 2.22            {0x0001} [hci1] 1.404150
< HCI Command: Reset (0x03|0x0003) plen 0                    #1 [hci1] 1.405403
> HCI Event: Command Complete (0x0e) plen 4                  #2 [hci1] 1.405990
      Reset (0x03|0x0003) ncmd 1
        Status: Success (0x00)
< HCI Command: Read Local Supported... (0x04|0x0003) plen 0  #3 [hci1] 1.423786
> HCI Event: Command Complete (0x0e) plen 12                 #4 [hci1] 1.424273
      Read Local Supported Features (0x04|0x0003) ncmd 1
        Status: Success (0x00)
        Features: 0x00 0x00 0x00 0x00 0x60 0x00 0x00 0x00
          BR/EDR Not Supported
          LE Supported (Controller)
< HCI Command: Read Local Version In.. (0x04|0x0001) plen 0  #5 [hci1] 1.443597
> HCI Event: Command Complete (0x0e) plen 12                 #6 [hci1] 1.444063
      Read Local Version Information (0x04|0x0001) ncmd 1
        Status: Success (0x00)
        HCI version: Reserved (0x0f) - Revision 12393 (0x3069)
        LMP version: Reserved (0x0f) - Subversion 12393 (0x3069)
        Manufacturer: Nordic Semiconductor ASA (89)
< HCI Command: Read Local Supported... (0x04|0x0002) plen 0  #7 [hci1] 1.463567
> HCI Event: Command Complete (0x0e) plen 68                 #8 [hci1] 1.464669
      Read Local Supported Commands (0x04|0x0002) ncmd 1
        Status: Success (0x00)
        Commands: 119 entries
          Disconnect (Octet 0 - Bit 5)
          Read Remote Version Information (Octet 2 - Bit 7)
          Set Event Mask (Octet 5 - Bit 6)
          Reset (Octet 5 - Bit 7)
          Read Connection Accept Timeout (Octet 7 - Bit 2)
          Write Connection Accept Timeout (Octet 7 - Bit 3)
          Read Transmit Power Level (Octet 10 - Bit 2)
          Set Controller To Host Flow Control (Octet 10 - Bit 5)
          Host Buffer Size (Octet 10 - Bit 6)
          Host Number of Completed Packets (Octet 10 - Bit 7)
          Read Local Version Information (Octet 14 - Bit 3)
          Read Local Supported Features (Octet 14 - Bit 5)
          Read BD ADDR (Octet 15 - Bit 1)
          Read RSSI (Octet 15 - Bit 5)
          Set Event Mask Page 2 (Octet 22 - Bit 2)
          LE Set Event Mask (Octet 25 - Bit 0)
          LE Read Buffer Size (Octet 25 - Bit 1)
          LE Read Local Supported Features (Octet 25 - Bit 2)
          LE Set Random Address (Octet 25 - Bit 4)
          LE Set Advertising Parameters (Octet 25 - Bit 5)
          LE Read Advertising Channel TX Power (Octet 25 - Bit 6)
          LE Set Advertising Data (Octet 25 - Bit 7)
          LE Set Scan Response Data (Octet 26 - Bit 0)
          LE Set Advertise Enable (Octet 26 - Bit 1)
          LE Set Scan Parameters (Octet 26 - Bit 2)
          LE Set Scan Enable (Octet 26 - Bit 3)
          LE Create Connection (Octet 26 - Bit 4)
          LE Create Connection Cancel (Octet 26 - Bit 5)
          LE Read Accept List Size (Octet 26 - Bit 6)
          LE Clear Accept List (Octet 26 - Bit 7)
          LE Add Device To Accept List (Octet 27 - Bit 0)
          LE Remove Device From Accept List (Octet 27 - Bit 1)
          LE Connection Update (Octet 27 - Bit 2)
          LE Set Host Channel Classification (Octet 27 - Bit 3)
          LE Read Channel Map (Octet 27 - Bit 4)
          LE Read Remote Used Features (Octet 27 - Bit 5)
          LE Encrypt (Octet 27 - Bit 6)
          LE Rand (Octet 27 - Bit 7)
          LE Start Encryption (Octet 28 - Bit 0)
          LE Long Term Key Request Reply (Octet 28 - Bit 1)
          LE Long Term Key Request Neg Reply (Octet 28 - Bit 2)
          LE Read Supported States (Octet 28 - Bit 3)
          LE Receiver Test (Octet 28 - Bit 4)
          LE Transmitter Test (Octet 28 - Bit 5)
          LE Test End (Octet 28 - Bit 6)
          Read Authenticated Payload Timeout (Octet 32 - Bit 4)
          Write Authenticated Payload Timeout (Octet 32 - Bit 5)
          LE Set Data Length (Octet 33 - Bit 6)
          LE Read Suggested Default Data Length (Octet 33 - Bit 7)
          LE Write Suggested Default Data Length (Octet 34 - Bit 0)
          LE Add Device To Resolving List (Octet 34 - Bit 3)
          LE Remove Device From Resolving List (Octet 34 - Bit 4)
          LE Clear Resolving List (Octet 34 - Bit 5)
          LE Read Resolving List Size (Octet 34 - Bit 6)
          LE Set Address Resolution Enable (Octet 35 - Bit 1)
          LE Set Resolvable Private Address Timeout (Octet 35 - Bit 2)
          LE Read Maximum Data Length (Octet 35 - Bit 3)
          LE Read PHY (Octet 35 - Bit 4)
          LE Set Default PHY (Octet 35 - Bit 5)
          LE Set PHY (Octet 35 - Bit 6)
          LE Enhanced Receiver Test (Octet 35 - Bit 7)
          LE Enhanced Transmitter Test (Octet 36 - Bit 0)
          LE Set Advertising Set Random Address (Octet 36 - Bit 1)
          LE Set Extended Advertising Parameters (Octet 36 - Bit 2)
          LE Set Extended Advertising Data (Octet 36 - Bit 3)
          LE Set Extended Scan Response Data (Octet 36 - Bit 4)
          LE Set Extended Advertising Enable (Octet 36 - Bit 5)
          LE Read Maximum Advertising Data Length (Octet 36 - Bit 6)
          LE Read Number of Supported Advertising Sets (Octet 36 - Bit 7)
          LE Remove Advertising Set (Octet 37 - Bit 0)
          LE Clear Advertising Sets (Octet 37 - Bit 1)
          LE Set Periodic Advertising Parameters (Octet 37 - Bit 2)
          LE Set Periodic Advertising Data (Octet 37 - Bit 3)
          LE Set Periodic Advertising Enable (Octet 37 - Bit 4)
          LE Set Extended Scan Parameters (Octet 37 - Bit 5)
          LE Set Extended Scan Enable (Octet 37 - Bit 6)
          LE Extended Create Connection (Octet 37 - Bit 7)
          LE Periodic Advertising Create Sync (Octet 38 - Bit 0)
          LE Periodic Advertising Create Sync Cancel (Octet 38 - Bit 1)
          LE Periodic Advertising Terminate Sync (Octet 38 - Bit 2)
          LE Add Device To Periodic Advertiser List (Octet 38 - Bit 3)
          LE Remove Device From Periodic Advertiser List (Octet 38 - Bit 4)
          LE Clear Periodic Advertiser List (Octet 38 - Bit 5)
          LE Read Periodic Advertiser List Size (Octet 38 - Bit 6)
          LE Read Transmit Power (Octet 38 - Bit 7)
          LE Read RF Path Compensation (Octet 39 - Bit 0)
          LE Write RF Path Compensation (Octet 39 - Bit 1)
          LE Set Privacy Mode (Octet 39 - Bit 2)
          LE Periodic Advertising Receive Enable (Octet 40 - Bit 5)
          LE Periodic Advertising Sync Transfer (Octet 40 - Bit 6)
          LE Periodic Advertising Set Info Transfer (Octet 40 - Bit 7)
          LE Periodic Advertising Sync Transfer Parameters (Octet 41 - Bit 0)
          LE Set Default Periodic Advertisng Sync Transfer Parameters (Octet 41 - Bit 1)
          LE Read Buffer v2 (Octet 41 - Bit 5)
          LE Read ISO TX Sync (Octet 41 - Bit 6)
          LE Set Connected Isochronous Group Parameters (Octet 41 - Bit 7)
          LE Set Connected Isochronous Group Parameters Test (Octet 42 - Bit 0)
          LE Create Connected Isochronous Stream (Octet 42 - Bit 1)
          LE Remove Connected Isochronous Group (Octet 42 - Bit 2)
          LE Accept Connected Isochronous Stream Request (Octet 42 - Bit 3)
          LE Reject Connected Isochronous Stream Request (Octet 42 - Bit 4)
          LE Create Broadcast Isochronous Group (Octet 42 - Bit 5)
          LE Create Broadcast Isochronous Group Test (Octet 42 - Bit 6)
          LE Terminate Broadcast Isochronous Group (Octet 42 - Bit 7)
          LE Broadcast Isochronous Group Create Sync (Octet 43 - Bit 0)
          LE Broadcast Isochronous Group Terminate Sync (Octet 43 - Bit 1)
          LE Request Peer SCA (Octet 43 - Bit 2)
          LE Setup Isochronous Data Path (Octet 43 - Bit 3)
          LE Remove Isochronous Data Path (Octet 43 - Bit 4)
          LE Isochronous Transmit Test (Octet 43 - Bit 5)
          LE Isochronous Receive Test (Octet 43 - Bit 6)
          LE Isochronous Read Test Counters (Octet 43 - Bit 7)
          LE Isochronous Read Test Counters (Octet 44 - Bit 0)
          LE Set Host Feature (Octet 44 - Bit 1)
          Octet 44 - Bit 2 
          Octet 45 - Bit 6 
          Octet 46 - Bit 0 
          Octet 46 - Bit 1 
          Octet 46 - Bit 2 
< HCI Command: Host Buffer Size (0x03|0x0033) plen 7         #9 [hci1] 1.483550
        ACL MTU: 255  ACL max packet: 16
        SCO MTU: 0    SCO max packet: 0
> HCI Event: Command Complete (0x0e) plen 4                 #10 [hci1] 1.484103
      Host Buffer Size (0x03|0x0033) ncmd 1
        Status: Success (0x00)
< HCI Command: Set Controller To Ho.. (0x03|0x0031) plen 1  #11 [hci1] 1.503545
        Flow control: ACL Data Packets (0x01)
> HCI Event: Command Complete (0x0e) plen 4                 #12 [hci1] 1.504057
      Set Controller To Host Flow Control (0x03|0x0031) ncmd 1
        Status: Success (0x00)
< HCI Command: LE Read Local Suppor.. (0x08|0x0003) plen 0  #13 [hci1] 1.523547
> HCI Event: Command Complete (0x0e) plen 12                #14 [hci1] 1.524013
      LE Read Local Supported Features (0x08|0x0003) ncmd 1
        Status: Success (0x00)
        Features: 0xfd 0x79 0x00 0xf7 0x30 0x01 0x00 0x00
          LE Encryption
          Extended Reject Indication
          Peripheral-initiated Features Exchange
          LE Ping
          LE Data Packet Length Extension
          LL Privacy
          Extended Scanner Filter Policies
          LE 2M PHY
          LE Coded PHY
          LE Extended Advertising
          LE Periodic Advertising
          Channel Selection Algorithm #2
          Periodic Advertising Sync Transfer - Sender
          Periodic Advertising Sync Transfer - Recipient
          Sleep Clock Accuracy Updates
          Connected Isochronous Stream - Central
          Connected Isochronous Stream - Peripheral
          Isochronous Broadcaster
          Synchronized Receiver
          Periodic Advertising ADI support
          Connection Subrating
          Unknown features (0x0000010000000000)
< HCI Command: LE Set Host Feature (0x08|0x0074) plen 2     #15 [hci1] 1.543546
        Bit Number: 32
          Connected Isochronous Stream (Host Support)
        Bit Value: 1
> HCI Event: Command Complete (0x0e) plen 4                 #16 [hci1] 1.543950
      LE Set Host Feature (0x08|0x0074) ncmd 1
        Status: Success (0x00)
< HCI Command: LE Read Buffer v2 (0x08|0x0060) plen 0       #17 [hci1] 1.563524
> HCI Event: Command Complete (0x0e) plen 10                #18 [hci1] 1.564017
      LE Read Buffer v2 (0x08|0x0060) ncmd 1
        Status: Success (0x00)
        ACL MTU: 27
        ACL max packet: 3
        ISO MTU: 318
        ISO max packet: 3
< HCI Command: LE Read Maximum Adve.. (0x08|0x003a) plen 0  #19 [hci1] 1.583527
> HCI Event: Command Complete (0x0e) plen 6                 #20 [hci1] 1.583994
      LE Read Maximum Advertising Data Length (0x08|0x003a) ncmd 1
        Status: Success (0x00)
        Max length: 1650
< HCI Command: LE Read Supported St.. (0x08|0x001c) plen 0  #21 [hci1] 1.603486
> HCI Event: Command Complete (0x0e) plen 12                #22 [hci1] 1.603988
      LE Read Supported States (0x08|0x001c) ncmd 1
        Status: Success (0x00)
        States: 0x000003ff3e0306ff
          Non-connectable Advertising State
          Scannable Advertising State
          Connectable Advertising State
          High Duty Cycle Directed Advertising State
          Passive Scanning State
          Active Scanning State
          Initiating State
            and Connection State (Central Role)
          Connection State (Peripheral Role)
          Scannable Advertising State
            and Passive Scanning State
          Connectable Advertising State
            and Passive Scanning State
          Non-connectable Advertising State
            and Initiating State
          Scannable Advertising State
            and Initiating State
          Active Scanning State
            and Connection State (Central Role)
          Passive Scanning State
            and Connection State (Peripheral Role)
          Active Scanning State
            and Connection State (Peripheral Role)
          Initiating State
            and Connection State (Central Role)
            and Central Role & Central Role
          Low Duty Cycle Directed Advertising State
          Connectable Advertising State
            and Initiating State
            and Central Role & Peripheral Role
          High Duty Cycle Directed Advertising State
            and Initiating State
            and Central Role & Peripheral Role
          Low Duty Cycle Directed Advertising State
            and Initiating State
            and Central Role & Peripheral Role
          Connectable Advertising State
            and Connection State (Central Role)
            and Central Role & Peripheral Role
          High Duty Cycle Directed Advertising State
            and Connection State (Central Role)
            and Central Role & Peripheral Role
          Low Duty Cycle Directed Advertising State
            and Connection State (Central Role)
            and Central Role & Peripheral Role
          Connectable Advertising State
            and Connection State (Peripheral Role)
            and Central Role & Peripheral Role
          High Duty Cycle Directed Advertising State
            and Connection State (Peripheral Role)
            and Peripheral Role & Peripheral Role
          Low Duty Cycle Directed Advertising State
            and Connection State (Peripheral Role)
            and Peripheral Role & Peripheral Role
          Initiating State
            and Connection State (Peripheral Role)
            and Central Role & Peripheral Role
< HCI Command: LE Read Maximum Data.. (0x08|0x002f) plen 0  #23 [hci1] 1.623610
> HCI Event: Command Complete (0x0e) plen 12                #24 [hci1] 1.624095
      LE Read Maximum Data Length (0x08|0x002f) ncmd 1
        Status: Success (0x00)
        Max TX octets: 251
        Max TX time: 2704
        Max RX octets: 251
        Max RX time: 2704
< HCI Command: LE Write Suggested D.. (0x08|0x0024) plen 4  #25 [hci1] 1.643557
        TX octets: 251
        TX time: 2704
> HCI Event: Command Complete (0x0e) plen 4                 #26 [hci1] 1.643986
      LE Write Suggested Default Data Length (0x08|0x0024) ncmd 1
        Status: Success (0x00)
< HCI Command: LE Read Resolving Li.. (0x08|0x002a) plen 0  #27 [hci1] 1.663604
> HCI Event: Command Complete (0x0e) plen 5                 #28 [hci1] 1.664092
      LE Read Resolving List Size (0x08|0x002a) ncmd 1
        Status: Success (0x00)
        Size: 8
< HCI Command: LE Set Event Mask (0x08|0x0001) plen 8       #29 [hci1] 1.683558
        Mask: 0x000002023f87fa5e
          LE Advertising Report
          LE Connection Update Complete
          LE Read Remote Used Features Complete
          LE Long Term Key Request
          LE Data Length Change
          LE Enhanced Connection Complete
          LE PHY Update Complete
          LE Extended Advertising Report
          LE Periodic Advertising Sync Established
          LE Periodic Advertising Report
          LE Periodic Advertising Sync Lost
          LE Extended Scan Timeout
          LE Extended Advertising Set Terminated
          LE Scan Request Received
          LE Periodic Advertising Sync Transfer Rvc
          LE CIS Established
          LE CIS Request
          LE Create BIG Complete
          LE Terminate BIG Complete
          LE BIG Sync Estabilished Complete
          LE BIG Sync Lost
          LE BIG Info Advertising Report
          Unknown mask (0x0000020000000000)
> HCI Event: Command Complete (0x0e) plen 4                 #30 [hci1] 1.684096
      LE Set Event Mask (0x08|0x0001) ncmd 1
        Status: Success (0x00)
< HCI Command: Set Event Mask (0x03|0x0001) plen 8          #31 [hci1] 1.703603
        Mask: 0x2000800002008890
          Disconnection Complete
          Encryption Change
          Read Remote Version Information Complete
          Hardware Error
          Data Buffer Overflow
          Encryption Key Refresh Complete
          LE Meta
> HCI Event: Command Complete (0x0e) plen 4                 #32 [hci1] 1.704117
      Set Event Mask (0x03|0x0001) ncmd 1
        Status: Success (0x00)
< HCI Command: Read BD ADDR (0x04|0x0009) plen 0            #33 [hci1] 1.723592
> HCI Event: Command Complete (0x0e) plen 10                #34 [hci1] 1.724131
      Read BD ADDR (0x04|0x0009) ncmd 1
        Status: Success (0x00)
        Address: 00:00:00:00:00:00 (OUI 00-00-00)
< HCI Command: LE Set Random Address (0x08|0x0005) plen 6   #35 [hci1] 1.743575
        Address: D5:B6:CC:31:DB:3B (Static)
> HCI Event: Command Complete (0x0e) plen 4                 #36 [hci1] 1.744145
      LE Set Random Address (0x08|0x0005) ncmd 1
        Status: Success (0x00)
< HCI Command: LE Set Extended Adv.. (0x08|0x0036) plen 25  #37 [hci1] 4.223893
        Handle: 0x00
        Properties: 0x0013
          Connectable
          Scannable
          Use legacy advertising PDUs: ADV_IND
        Min advertising interval: 100.000 msec (0x00a0)
        Max advertising interval: 150.000 msec (0x00f0)
        Channel map: 37, 38, 39 (0x07)
        Own address type: Random (0x01)
        Peer address type: Public (0x00)
        Peer address: 00:00:00:00:00:00 (OUI 00-00-00)
        Filter policy: Allow Scan Request from Any, Allow Connect Request from Any (0x00)
        TX power: Host has no preference (0x7f)
        Primary PHY: LE 1M (0x01)
        Secondary max skip: 0x00
        Secondary PHY: LE 1M (0x01)
        SID: 0x00
        Scan request notifications: Disabled (0x00)
> HCI Event: Command Complete (0x0e) plen 5                 #38 [hci1] 4.224785
      LE Set Extended Advertising Parameters (0x08|0x0036) ncmd 1
        Status: Success (0x00)
        TX power (selected): 0 dbm (0x00)
< HCI Command: LE Set Advertising S.. (0x08|0x0035) plen 7  #39 [hci1] 4.243739
        Advertising handle: 0x00
        Advertising random address: D5:B6:CC:31:DB:3B (Static)
> HCI Event: Command Complete (0x0e) plen 4                 #40 [hci1] 4.244299
      LE Set Advertising Set Random Address (0x08|0x0035) ncmd 1
        Status: Success (0x00)
< HCI Command: LE Set Extended Adv.. (0x08|0x0037) plen 22  #41 [hci1] 4.263623
        Handle: 0x00
        Operation: Complete extended advertising data (0x03)
        Fragment preference: Minimize fragmentation (0x01)
        Data length: 0x12
        Flags: 0x06
          LE General Discoverable Mode
          BR/EDR Not Supported
        Name (complete): Tester_F6B11A
> HCI Event: Command Complete (0x0e) plen 4                 #42 [hci1] 4.264319
      LE Set Extended Advertising Data (0x08|0x0037) ncmd 1
        Status: Success (0x00)
< HCI Command: LE Set Extended Scan.. (0x08|0x0038) plen 4  #43 [hci1] 4.283622
        Handle: 0x00
        Operation: Complete scan response data (0x03)
        Fragment preference: Minimize fragmentation (0x01)
        Data length: 0x00
> HCI Event: Command Complete (0x0e) plen 4                 #44 [hci1] 4.284207
      LE Set Extended Scan Response Data (0x08|0x0038) ncmd 1
        Status: Success (0x00)
< HCI Command: LE Set Extended Adve.. (0x08|0x0039) plen 6  #45 [hci1] 4.303602
        Extended advertising: Enabled (0x01)
        Number of sets: 1 (0x01)
        Entry 0
          Handle: 0x00
          Duration: 0 ms (0x00)
          Max ext adv events: 0
> HCI Event: Command Complete (0x0e) plen 4                 #46 [hci1] 4.304271
      LE Set Extended Advertising Enable (0x08|0x0039) ncmd 1
        Status: Success (0x00)
> HCI Event: LE Meta Event (0x3e) plen 31                   #47 [hci1] 4.409251
      LE Enhanced Connection Complete (0x0a)
        Status: Success (0x00)
        Handle: 129
        Role: Peripheral (0x01)
        Peer address type: Public (0x00)
        Peer address: DF:A9:FF:F6:B1:1A (OUI DF-A9-FF)
        Local resolvable private address: 00:00:00:00:00:00 (Non-Resolvable)
        Peer resolvable private address: 00:00:00:00:00:00 (Non-Resolvable)
        Connection interval: 87.50 msec (0x0046)
        Connection latency: 0 (0x0000)
        Supervision timeout: 25120 msec (0x09d0)
        Central clock accuracy: 0x01
> HCI Event: LE Meta Event (0x3e) plen 6                    #48 [hci1] 4.409354
      LE Advertising Set Terminated (0x12)
        Status: Success (0x00)
        Handle: 0
        Connection handle: 129
        Number of completed extended advertising events: 0
< HCI Command: LE Read Remote Used... (0x08|0x0016) plen 2  #49 [hci1] 4.424751
        Handle: 129 Address: DF:A9:FF:F6:B1:1A (OUI DF-A9-FF)
< ACL Data TX: Handle 129 flags 0x00 dlen 7                 #50 [hci1] 4.424794
      ATT: Exchange MTU Request (0x02) len 2
        Client RX MTU: 251
> HCI Event: Command Status (0x0f) plen 4                   #51 [hci1] 4.425234
      LE Read Remote Used Features (0x08|0x0016) ncmd 1
        Status: Success (0x00)
> HCI Event: Number of Completed Packets (0x13) plen 5      #52 [hci1] 4.585301
        Num handles: 1
        Handle: 129 Address: DF:A9:FF:F6:B1:1A (OUI DF-A9-FF)
        Count: 1
        #50: len 7 (0 Kb/s)
        Latency: 160 msec (160-160 msec ~160 msec)
> HCI Event: LE Meta Event (0x3e) plen 12                   #53 [hci1] 4.673147
      LE Read Remote Used Features (0x04)
        Status: Success (0x00)
        Handle: 129 Address: DF:A9:FF:F6:B1:1A (OUI DF-A9-FF)
        Features: 0x2d 0x49 0x00 0xf7 0x67 0xd8 0x00 0x00
          LE Encryption
          Extended Reject Indication
          Peripheral-initiated Features Exchange
          LE Data Packet Length Extension
          LE 2M PHY
          LE Coded PHY
          Channel Selection Algorithm #2
          Periodic Advertising Sync Transfer - Sender
          Periodic Advertising Sync Transfer - Recipient
          Sleep Clock Accuracy Updates
          Connected Isochronous Stream - Central
          Connected Isochronous Stream - Peripheral
          Isochronous Broadcaster
          Synchronized Receiver
          Connected Isochronous Stream (Host Support)
          LE Power Control Request
          LE Power Control Request
          Connection Subrating
          Connection Subrating (Host Support)
          Unknown features (0x0000d80000000000)
> ACL Data RX: Handle 129 flags 0x02 dlen 11                #54 [hci1] 7.122897
      SMP: Pairing Request (0x01) len 6
        IO capability: KeyboardDisplay (0x04)
        OOB data: Authentication data not present (0x00)
        Authentication requirement: Bonding, MITM, SC, No Keypresses (0x0d)
        Max encryption key size: 16
        Initiator key distribution: EncKey IdKey (0x03)
        Responder key distribution: EncKey IdKey Sign (0x07)
< HCI Command: Host Number of Compl.. (0x03|0x0035) plen 5  #55 [hci1] 7.124083
        Num handles: 1
        Handle: 129 Address: DF:A9:FF:F6:B1:1A (OUI DF-A9-FF)
        Count: 1
< ACL Data TX: Handle 129 flags 0x00 dlen 11                #56 [hci1] 7.124320
      SMP: Pairing Response (0x02) len 6
        IO capability: DisplayOnly (0x00)
        OOB data: Authentication data not present (0x00)
        Authentication requirement: Bonding, No MITM, SC, No Keypresses (0x09)
        Max encryption key size: 16
        Initiator key distribution: IdKey (0x02)
        Responder key distribution: <none> (0x00)
> ACL Data RX: Handle 129 flags 0x02 dlen 7                 #57 [hci1] 7.210337
      ATT: Exchange MTU Response (0x03) len 2
        Server RX MTU: 23
< HCI Command: Host Number of Compl.. (0x03|0x0035) plen 5  #58 [hci1] 7.224033
        Num handles: 1
        Handle: 129 Address: DF:A9:FF:F6:B1:1A (OUI DF-A9-FF)
        Count: 1
> HCI Event: Number of Completed Packets (0x13) plen 5      #59 [hci1] 7.297915
        Num handles: 1
        Handle: 129 Address: DF:A9:FF:F6:B1:1A (OUI DF-A9-FF)
        Count: 1
        #56: len 11 (0 Kb/s)
        Latency: 173 msec (160-173 msec ~167 msec)
> ACL Data RX: Handle 129 flags 0x02 dlen 27                #60 [hci1] 7.298238
> ACL Data RX: Handle 129 flags 0x01 dlen 27                #61 [hci1] 7.298884
> ACL Data RX: Handle 129 flags 0x01 dlen 15                #62 [hci1] 7.299193
      SMP: Pairing Public Key (0x0c) len 64
        X: c76290174b333b82b3aded5b9510506b9d01e08b8d9b848771e9dad59721a468
        Y: 44a9df04dacfadf149eccb1f2eb8349412b33321e9ea682f3df591d00c3e6727
< HCI Command: Host Number of Compl.. (0x03|0x0035) plen 5  #63 [hci1] 7.304544
        Num handles: 1
        Handle: 129 Address: DF:A9:FF:F6:B1:1A (OUI DF-A9-FF)
        Count: 1
< HCI Command: Host Number of Compl.. (0x03|0x0035) plen 5  #64 [hci1] 7.304753
        Num handles: 1
        Handle: 129 Address: DF:A9:FF:F6:B1:1A (OUI DF-A9-FF)
        Count: 1
< HCI Command: Host Number of Compl.. (0x03|0x0035) plen 5  #65 [hci1] 7.305119
        Num handles: 1
        Handle: 129 Address: DF:A9:FF:F6:B1:1A (OUI DF-A9-FF)
        Count: 1
< ACL Data TX: Handle 129 flags 0x00 dlen 27                #66 [hci1] 7.305369
< ACL Data TX: Handle 129 flags 0x01 dlen 27                #67 [hci1] 7.305388
< ACL Data TX: Handle 129 flags 0x01 dlen 15                #68 [hci1] 7.305392
      SMP: Pairing Public Key (0x0c) len 64
        X: 98308440221e2d910f0e54b71e7ec652857aa9b5a0dc65028824cc19db1226e9
        Y: 67a4816bcb62efb21701e31fdb27561a6217575fb007a8bbdabe7e28b6f68482
> HCI Event: Number of Completed Packets (0x13) plen 5      #69 [hci1] 7.385835
        Num handles: 1
        Handle: 129 Address: DF:A9:FF:F6:B1:1A (OUI DF-A9-FF)
        Count: 1
        #66: len 27 (2 Kb/s)
        Latency: 80 msec (80-173 msec ~123 msec)
> HCI Event: Number of Completed Packets (0x13) plen 5      #70 [hci1] 7.386436
        Num handles: 1
        Handle: 129 Address: DF:A9:FF:F6:B1:1A (OUI DF-A9-FF)
        Count: 1
        #67: len 27 (2 Kb/s)
        Latency: 81 msec (80-173 msec ~102 msec)
> HCI Event: Number of Completed Packets (0x13) plen 5      #71 [hci1] 7.472618
        Num handles: 1
        Handle: 129 Address: DF:A9:FF:F6:B1:1A (OUI DF-A9-FF)
        Count: 1
        #68: len 15 (0 Kb/s)
        Latency: 167 msec (80-173 msec ~134 msec)
> ACL Data RX: Handle 129 flags 0x02 dlen 21                #72 [hci1] 8.435431
      SMP: Pairing Confirm (0x03) len 16
        Confim value: 920aa50d115947af9a19a2f6e55e7389
< HCI Command: Host Number of Compl.. (0x03|0x0035) plen 5  #73 [hci1] 8.444380
        Num handles: 1
        Handle: 129 Address: DF:A9:FF:F6:B1:1A (OUI DF-A9-FF)
        Count: 1
< ACL Data TX: Handle 129 flags 0x00 dlen 21                #74 [hci1] 8.444601
      SMP: Pairing Confirm (0x03) len 16
        Confim value: bd4be9f40141906448643d7d08fe6d60
> HCI Event: Number of Completed Packets (0x13) plen 5      #75 [hci1] 8.610392
        Num handles: 1
        Handle: 129 Address: DF:A9:FF:F6:B1:1A (OUI DF-A9-FF)
        Count: 1
        #74: len 21 (1 Kb/s)
        Latency: 165 msec (80-173 msec ~150 msec)
> ACL Data RX: Handle 129 flags 0x02 dlen 21                #76 [hci1] 8.610770
      SMP: Pairing Random (0x04) len 16
        Random value: 5fb0c72ad4cd3c7d0000000000000000
< HCI Command: Host Number of Compl.. (0x03|0x0035) plen 5  #77 [hci1] 8.624438
        Num handles: 1
        Handle: 129 Address: DF:A9:FF:F6:B1:1A (OUI DF-A9-FF)
        Count: 1
< ACL Data TX: Handle 129 flags 0x00 dlen 21                #78 [hci1] 8.624513
      SMP: Pairing Random (0x04) len 16
        Random value: 8e6108f966a694cbe26df70bb96773e6
> HCI Event: Number of Completed Packets (0x13) plen 5      #79 [hci1] 8.785126
        Num handles: 1
        Handle: 129 Address: DF:A9:FF:F6:B1:1A (OUI DF-A9-FF)
        Count: 1
        #78: len 21 (1 Kb/s)
        Latency: 160 msec (80-173 msec ~155 msec)
> ACL Data RX: Handle 129 flags 0x02 dlen 21                #80 [hci1] 8.872912
      SMP: Pairing Confirm (0x03) len 16
        Confim value: 82e524742b5d9e764230234d45f2b3c0
< HCI Command: Host Number of Compl.. (0x03|0x0035) plen 5  #81 [hci1] 8.884021
        Num handles: 1
        Handle: 129 Address: DF:A9:FF:F6:B1:1A (OUI DF-A9-FF)
        Count: 1
< ACL Data TX: Handle 129 flags 0x00 dlen 21                #82 [hci1] 8.884183
      SMP: Pairing Confirm (0x03) len 16
        Confim value: 275f9f8d5ee65992681706e0013be794
> HCI Event: Number of Completed Packets (0x13) plen 5      #83 [hci1] 9.047819
        Num handles: 1
        Handle: 129 Address: DF:A9:FF:F6:B1:1A (OUI DF-A9-FF)
        Count: 1
        #82: len 21 (1 Kb/s)
        Latency: 163 msec (80-173 msec ~159 msec)
> ACL Data RX: Handle 129 flags 0x02 dlen 21                #84 [hci1] 9.048191
      SMP: Pairing Random (0x04) len 16
        Random value: 2232fc7ee9e48e5e0000000000000000
< HCI Command: Host Number of Compl.. (0x03|0x0035) plen 5  #85 [hci1] 9.064343
        Num handles: 1
        Handle: 129 Address: DF:A9:FF:F6:B1:1A (OUI DF-A9-FF)
        Count: 1
< ACL Data TX: Handle 129 flags 0x00 dlen 21                #86 [hci1] 9.064416
      SMP: Pairing Random (0x04) len 16
        Random value: 4d02679f89a05211af56d8b3da64d21e
> HCI Event: Number of Completed Packets (0x13) plen 5      #87 [hci1] 9.222599
        Num handles: 1
        Handle: 129 Address: DF:A9:FF:F6:B1:1A (OUI DF-A9-FF)
        Count: 1
        #86: len 21 (1 Kb/s)
        Latency: 158 msec (80-173 msec ~158 msec)
> ACL Data RX: Handle 129 flags 0x02 dlen 21                #88 [hci1] 9.310393
      SMP: Pairing Confirm (0x03) len 16
        Confim value: f8a54577274283af7c1cb023175164cd
< HCI Command: Host Number of Compl.. (0x03|0x0035) plen 5  #89 [hci1] 9.324158
        Num handles: 1
        Handle: 129 Address: DF:A9:FF:F6:B1:1A (OUI DF-A9-FF)
        Count: 1
< ACL Data TX: Handle 129 flags 0x00 dlen 21                #90 [hci1] 9.324375
      SMP: Pairing Confirm (0x03) len 16
        Confim value: 9719405dcb85f4071604e16fa7cc4b50
> HCI Event: Number of Completed Packets (0x13) plen 5      #91 [hci1] 9.485316
        Num handles: 1
        Handle: 129 Address: DF:A9:FF:F6:B1:1A (OUI DF-A9-FF)
        Count: 1
        #90: len 21 (1 Kb/s)
        Latency: 160 msec (80-173 msec ~159 msec)
> ACL Data RX: Handle 129 flags 0x02 dlen 21                #92 [hci1] 9.485654
      SMP: Pairing Random (0x04) len 16
        Random value: 94ecf932c93db4f50000000000000000
< HCI Command: Host Number of Compl.. (0x03|0x0035) plen 5  #93 [hci1] 9.504539
        Num handles: 1
        Handle: 129 Address: DF:A9:FF:F6:B1:1A (OUI DF-A9-FF)
        Count: 1
< ACL Data TX: Handle 129 flags 0x00 dlen 21                #94 [hci1] 9.504712
      SMP: Pairing Random (0x04) len 16
        Random value: 5e8286bc235a02440d0c3424a2acf8fd
> HCI Event: Number of Completed Packets (0x13) plen 5      #95 [hci1] 9.660032
        Num handles: 1
        Handle: 129 Address: DF:A9:FF:F6:B1:1A (OUI DF-A9-FF)
        Count: 1
        #94: len 21 (1 Kb/s)
        Latency: 155 msec (80-173 msec ~157 msec)
> ACL Data RX: Handle 129 flags 0x02 dlen 21                #96 [hci1] 9.747992
      SMP: Pairing Confirm (0x03) len 16
        Confim value: fc21a37f4a3648e6f74e6b2c92295b5f
< HCI Command: Host Number of Compl.. (0x03|0x0035) plen 5  #97 [hci1] 9.764099
        Num handles: 1
        Handle: 129 Address: DF:A9:FF:F6:B1:1A (OUI DF-A9-FF)
        Count: 1
< ACL Data TX: Handle 129 flags 0x00 dlen 21                #98 [hci1] 9.764290
      SMP: Pairing Confirm (0x03) len 16
        Confim value: 6ffaf61b3e3fa634263f70ffe3f5eaec
> HCI Event: Number of Completed Packets (0x13) plen 5      #99 [hci1] 9.922860
        Num handles: 1
        Handle: 129 Address: DF:A9:FF:F6:B1:1A (OUI DF-A9-FF)
        Count: 1
        #98: len 21 (1 Kb/s)
        Latency: 158 msec (80-173 msec ~158 msec)
> ACL Data RX: Handle 129 flags 0x02 dlen 21               #100 [hci1] 9.923122
      SMP: Pairing Random (0x04) len 16
        Random value: d4472677153adbd90000000000000000
< HCI Command: Host Number of Comp.. (0x03|0x0035) plen 5  #101 [hci1] 9.924260
        Num handles: 1
        Handle: 129 Address: DF:A9:FF:F6:B1:1A (OUI DF-A9-FF)
        Count: 1
< ACL Data TX: Handle 129 flags 0x00 dlen 21               #102 [hci1] 9.924358
      SMP: Pairing Random (0x04) len 16
        Random value: 5c4a1bcadd27bd58e945097b00bad7ac
> HCI Event: Number of Completed Packets (0x13) plen 5    #103 [hci1] 10.097494
        Num handles: 1
        Handle: 129 Address: DF:A9:FF:F6:B1:1A (OUI DF-A9-FF)
        Count: 1
        #102: len 21 (0 Kb/s)
        Latency: 173 msec (80-173 msec ~165 msec)
> ACL Data RX: Handle 129 flags 0x02 dlen 21              #104 [hci1] 10.185333
      SMP: Pairing Confirm (0x03) len 16
        Confim value: 86546cd496ebd964db068147af054a36
< HCI Command: Host Number of Com.. (0x03|0x0035) plen 5  #105 [hci1] 10.203885
        Num handles: 1
        Handle: 129 Address: DF:A9:FF:F6:B1:1A (OUI DF-A9-FF)
        Count: 1
< ACL Data TX: Handle 129 flags 0x00 dlen 21              #106 [hci1] 10.204030
      SMP: Pairing Confirm (0x03) len 16
        Confim value: 93ad0f34d1d134e467b2fc00d12b4c04
> HCI Event: Number of Completed Packets (0x13) plen 5    #107 [hci1] 10.360254
        Num handles: 1
        Handle: 129 Address: DF:A9:FF:F6:B1:1A (OUI DF-A9-FF)
        Count: 1
        #106: len 21 (1 Kb/s)
        Latency: 156 msec (80-173 msec ~160 msec)
> ACL Data RX: Handle 129 flags 0x02 dlen 21              #108 [hci1] 10.360573
      SMP: Pairing Random (0x04) len 16
        Random value: 583f609fc98651510000000000000000
< HCI Command: Host Number of Com.. (0x03|0x0035) plen 5  #109 [hci1] 10.364403
        Num handles: 1
        Handle: 129 Address: DF:A9:FF:F6:B1:1A (OUI DF-A9-FF)
        Count: 1
< ACL Data TX: Handle 129 flags 0x00 dlen 21              #110 [hci1] 10.364493
      SMP: Pairing Random (0x04) len 16
        Random value: 32527e6e64e79f33b2e374394db8ab2d
> HCI Event: Number of Completed Packets (0x13) plen 5    #111 [hci1] 10.535040
        Num handles: 1
        Handle: 129 Address: DF:A9:FF:F6:B1:1A (OUI DF-A9-FF)
        Count: 1
        #110: len 21 (0 Kb/s)
        Latency: 170 msec (80-173 msec ~165 msec)
> ACL Data RX: Handle 129 flags 0x02 dlen 21              #112 [hci1] 10.622843
      SMP: Pairing Confirm (0x03) len 16
        Confim value: 15fa54024ed5a1ad1702850ef244f892
< HCI Command: Host Number of Com.. (0x03|0x0035) plen 5  #113 [hci1] 10.624076
        Num handles: 1
        Handle: 129 Address: DF:A9:FF:F6:B1:1A (OUI DF-A9-FF)
        Count: 1
< ACL Data TX: Handle 129 flags 0x00 dlen 21              #114 [hci1] 10.624233
      SMP: Pairing Confirm (0x03) len 16
        Confim value: 08a55abd838bd375c8f02a4f83e7e937
> HCI Event: Number of Completed Packets (0x13) plen 5    #115 [hci1] 10.797700
        Num handles: 1
        Handle: 129 Address: DF:A9:FF:F6:B1:1A (OUI DF-A9-FF)
        Count: 1
        #114: len 21 (0 Kb/s)
        Latency: 173 msec (80-173 msec ~169 msec)
> ACL Data RX: Handle 129 flags 0x02 dlen 21              #116 [hci1] 10.798081
      SMP: Pairing Random (0x04) len 16
        Random value: 6e04b669730b37da0000000000000000
< HCI Command: Host Number of Com.. (0x03|0x0035) plen 5  #117 [hci1] 10.804335
        Num handles: 1
        Handle: 129 Address: DF:A9:FF:F6:B1:1A (OUI DF-A9-FF)
        Count: 1
< ACL Data TX: Handle 129 flags 0x00 dlen 21              #118 [hci1] 10.804487
      SMP: Pairing Random (0x04) len 16
        Random value: dddbdfe2838e9a8cc6964353c850fef7
> HCI Event: Number of Completed Packets (0x13) plen 5    #119 [hci1] 10.972509
        Num handles: 1
        Handle: 129 Address: DF:A9:FF:F6:B1:1A (OUI DF-A9-FF)
        Count: 1
        #118: len 21 (1 Kb/s)
        Latency: 168 msec (80-173 msec ~168 msec)
> ACL Data RX: Handle 129 flags 0x02 dlen 21              #120 [hci1] 11.060390
      SMP: Pairing Confirm (0x03) len 16
        Confim value: dffba5c3ed80e4d2439ac070f8021297
< HCI Command: Host Number of Com.. (0x03|0x0035) plen 5  #121 [hci1] 11.063957
        Num handles: 1
        Handle: 129 Address: DF:A9:FF:F6:B1:1A (OUI DF-A9-FF)
        Count: 1
< ACL Data TX: Handle 129 flags 0x00 dlen 21              #122 [hci1] 11.064161
      SMP: Pairing Confirm (0x03) len 16
        Confim value: 78c0a1951855e338e738c2a19a5ee4ed
> HCI Event: Number of Completed Packets (0x13) plen 5    #123 [hci1] 11.235259
        Num handles: 1
        Handle: 129 Address: DF:A9:FF:F6:B1:1A (OUI DF-A9-FF)
        Count: 1
        #122: len 21 (0 Kb/s)
        Latency: 171 msec (80-173 msec ~169 msec)
> ACL Data RX: Handle 129 flags 0x02 dlen 21              #124 [hci1] 11.235671
      SMP: Pairing Random (0x04) len 16
        Random value: 8626d8694231a05f0000000000000000
< HCI Command: Host Number of Com.. (0x03|0x0035) plen 5  #125 [hci1] 11.244414
        Num handles: 1
        Handle: 129 Address: DF:A9:FF:F6:B1:1A (OUI DF-A9-FF)
        Count: 1
< ACL Data TX: Handle 129 flags 0x00 dlen 21              #126 [hci1] 11.244516
      SMP: Pairing Random (0x04) len 16
        Random value: eb9f1915536596b6fc3db1c86b2b1970
> HCI Event: Number of Completed Packets (0x13) plen 5    #127 [hci1] 11.410065
        Num handles: 1
        Handle: 129 Address: DF:A9:FF:F6:B1:1A (OUI DF-A9-FF)
        Count: 1
        #126: len 21 (1 Kb/s)
        Latency: 165 msec (80-173 msec ~167 msec)
> ACL Data RX: Handle 129 flags 0x02 dlen 21              #128 [hci1] 11.497834
      SMP: Pairing Confirm (0x03) len 16
        Confim value: 2b25d8b21a82191c386b572da1d46d58
< HCI Command: Host Number of Com.. (0x03|0x0035) plen 5  #129 [hci1] 11.504052
        Num handles: 1
        Handle: 129 Address: DF:A9:FF:F6:B1:1A (OUI DF-A9-FF)
        Count: 1
< ACL Data TX: Handle 129 flags 0x00 dlen 21              #130 [hci1] 11.504268
      SMP: Pairing Confirm (0x03) len 16
        Confim value: 752263a8e1dee1f6e32dcadd6723ba29
> HCI Event: Number of Completed Packets (0x13) plen 5    #131 [hci1] 11.672867
        Num handles: 1
        Handle: 129 Address: DF:A9:FF:F6:B1:1A (OUI DF-A9-FF)
        Count: 1
        #130: len 21 (1 Kb/s)
        Latency: 168 msec (80-173 msec ~168 msec)
> ACL Data RX: Handle 129 flags 0x02 dlen 21              #132 [hci1] 11.673038
      SMP: Pairing Random (0x04) len 16
        Random value: 5ed80bd4fdfc91970000000000000000
< HCI Command: Host Number of Com.. (0x03|0x0035) plen 5  #133 [hci1] 11.684311
        Num handles: 1
        Handle: 129 Address: DF:A9:FF:F6:B1:1A (OUI DF-A9-FF)
        Count: 1
< ACL Data TX: Handle 129 flags 0x00 dlen 21              #134 [hci1] 11.684392
      SMP: Pairing Random (0x04) len 16
        Random value: 5c794dc9ad9f2c3f295ebd5ad5e1c3cf
> HCI Event: Number of Completed Packets (0x13) plen 5    #135 [hci1] 11.847467
        Num handles: 1
        Handle: 129 Address: DF:A9:FF:F6:B1:1A (OUI DF-A9-FF)
        Count: 1
        #134: len 21 (1 Kb/s)
        Latency: 163 msec (80-173 msec ~165 msec)
> ACL Data RX: Handle 129 flags 0x02 dlen 21              #136 [hci1] 11.935326
      SMP: Pairing Confirm (0x03) len 16
        Confim value: 331a486559223bc30116228971c48554
< HCI Command: Host Number of Com.. (0x03|0x0035) plen 5  #137 [hci1] 11.944133
        Num handles: 1
        Handle: 129 Address: DF:A9:FF:F6:B1:1A (OUI DF-A9-FF)
        Count: 1
< ACL Data TX: Handle 129 flags 0x00 dlen 21              #138 [hci1] 11.944296
      SMP: Pairing Confirm (0x03) len 16
        Confim value: 5e0f1154628ae9c5e9ec5f955bbb4049
> HCI Event: Number of Completed Packets (0x13) plen 5    #139 [hci1] 12.110228
        Num handles: 1
        Handle: 129 Address: DF:A9:FF:F6:B1:1A (OUI DF-A9-FF)
        Count: 1
        #138: len 21 (1 Kb/s)
        Latency: 165 msec (80-173 msec ~165 msec)
> ACL Data RX: Handle 129 flags 0x02 dlen 21              #140 [hci1] 12.110515
      SMP: Pairing Random (0x04) len 16
        Random value: ee1a1fc8610560340000000000000000
< HCI Command: Host Number of Com.. (0x03|0x0035) plen 5  #141 [hci1] 12.124448
        Num handles: 1
        Handle: 129 Address: DF:A9:FF:F6:B1:1A (OUI DF-A9-FF)
        Count: 1
< ACL Data TX: Handle 129 flags 0x00 dlen 21              #142 [hci1] 12.124597
      SMP: Pairing Random (0x04) len 16
        Random value: 5c2fff312cdf99c9491988e877355a9a
> HCI Event: Number of Completed Packets (0x13) plen 5    #143 [hci1] 12.284961
        Num handles: 1
        Handle: 129 Address: DF:A9:FF:F6:B1:1A (OUI DF-A9-FF)
        Count: 1
        #142: len 21 (1 Kb/s)
        Latency: 160 msec (80-173 msec ~163 msec)
> ACL Data RX: Handle 129 flags 0x02 dlen 21              #144 [hci1] 12.372846
      SMP: Pairing Confirm (0x03) len 16
        Confim value: 63893cdfa20f8410e88a83a8a4b5fa52
< HCI Command: Host Number of Com.. (0x03|0x0035) plen 5  #145 [hci1] 12.383897
        Num handles: 1
        Handle: 129 Address: DF:A9:FF:F6:B1:1A (OUI DF-A9-FF)
        Count: 1
< ACL Data TX: Handle 129 flags 0x00 dlen 21              #146 [hci1] 12.384036
      SMP: Pairing Confirm (0x03) len 16
        Confim value: 91b31a3184a1521688529fa96477f5d5
> HCI Event: Number of Completed Packets (0x13) plen 5    #147 [hci1] 12.547635
        Num handles: 1
        Handle: 129 Address: DF:A9:FF:F6:B1:1A (OUI DF-A9-FF)
        Count: 1
        #146: len 21 (1 Kb/s)
        Latency: 163 msec (80-173 msec ~163 msec)
> ACL Data RX: Handle 129 flags 0x02 dlen 21              #148 [hci1] 12.548054
      SMP: Pairing Random (0x04) len 16
        Random value: aff72d0243b76b140000000000000000
< HCI Command: Host Number of Com.. (0x03|0x0035) plen 5  #149 [hci1] 12.564206
        Num handles: 1
        Handle: 129 Address: DF:A9:FF:F6:B1:1A (OUI DF-A9-FF)
        Count: 1
< ACL Data TX: Handle 129 flags 0x00 dlen 21              #150 [hci1] 12.564337
      SMP: Pairing Random (0x04) len 16
        Random value: c629a3a987d808e808655d558dfc1155
> HCI Event: Number of Completed Packets (0x13) plen 5    #151 [hci1] 12.722455
        Num handles: 1
        Handle: 129 Address: DF:A9:FF:F6:B1:1A (OUI DF-A9-FF)
        Count: 1
        #150: len 21 (1 Kb/s)
        Latency: 158 msec (80-173 msec ~160 msec)
> ACL Data RX: Handle 129 flags 0x02 dlen 21              #152 [hci1] 12.810312
      SMP: Pairing Confirm (0x03) len 16
        Confim value: 33c87e66c7a84a68aef0fbab21f53b08
< HCI Command: Host Number of Com.. (0x03|0x0035) plen 5  #153 [hci1] 12.824738
        Num handles: 1
        Handle: 129 Address: DF:A9:FF:F6:B1:1A (OUI DF-A9-FF)
        Count: 1
< ACL Data TX: Handle 129 flags 0x00 dlen 21              #154 [hci1] 12.824961
      SMP: Pairing Confirm (0x03) len 16
        Confim value: 5814146b91659181f01ed5b03fff5a81
> HCI Event: Number of Completed Packets (0x13) plen 5    #155 [hci1] 12.985246
        Num handles: 1
        Handle: 129 Address: DF:A9:FF:F6:B1:1A (OUI DF-A9-FF)
        Count: 1
        #154: len 21 (1 Kb/s)
        Latency: 160 msec (80-173 msec ~160 msec)
> ACL Data RX: Handle 129 flags 0x02 dlen 21              #156 [hci1] 12.985493
      SMP: Pairing Random (0x04) len 16
        Random value: 68bf23b42107af090000000000000000
< HCI Command: Host Number of Com.. (0x03|0x0035) plen 5  #157 [hci1] 13.004435
        Num handles: 1
        Handle: 129 Address: DF:A9:FF:F6:B1:1A (OUI DF-A9-FF)
        Count: 1
< ACL Data TX: Handle 129 flags 0x00 dlen 21              #158 [hci1] 13.004591
      SMP: Pairing Random (0x04) len 16
        Random value: 92f20f6ad8f13724432c7fd6001c45ff
> HCI Event: Number of Completed Packets (0x13) plen 5    #159 [hci1] 13.159895
        Num handles: 1
        Handle: 129 Address: DF:A9:FF:F6:B1:1A (OUI DF-A9-FF)
        Count: 1
        #158: len 21 (1 Kb/s)
        Latency: 155 msec (80-173 msec ~157 msec)
> ACL Data RX: Handle 129 flags 0x02 dlen 21              #160 [hci1] 13.247860
      SMP: Pairing Confirm (0x03) len 16
        Confim value: 573053bfc6b68f48441ae10a9f9bdd09
< HCI Command: Host Number of Com.. (0x03|0x0035) plen 5  #161 [hci1] 13.263956
        Num handles: 1
        Handle: 129 Address: DF:A9:FF:F6:B1:1A (OUI DF-A9-FF)
        Count: 1
< ACL Data TX: Handle 129 flags 0x00 dlen 21              #162 [hci1] 13.264064
      SMP: Pairing Confirm (0x03) len 16
        Confim value: 846672bcde74bbb90d90e1884f581136
> HCI Event: Number of Completed Packets (0x13) plen 5    #163 [hci1] 13.422637
        Num handles: 1
        Handle: 129 Address: DF:A9:FF:F6:B1:1A (OUI DF-A9-FF)
        Count: 1
        #162: len 21 (1 Kb/s)
        Latency: 158 msec (80-173 msec ~158 msec)
> ACL Data RX: Handle 129 flags 0x02 dlen 21              #164 [hci1] 13.422947
      SMP: Pairing Random (0x04) len 16
        Random value: 7099d8ccdc7799850000000000000000
< HCI Command: Host Number of Com.. (0x03|0x0035) plen 5  #165 [hci1] 13.424271
        Num handles: 1
        Handle: 129 Address: DF:A9:FF:F6:B1:1A (OUI DF-A9-FF)
        Count: 1
< ACL Data TX: Handle 129 flags 0x00 dlen 21              #166 [hci1] 13.424295
      SMP: Pairing Random (0x04) len 16
        Random value: 23ac32ebbb5e14c8a6b9622f296d277f
> HCI Event: Number of Completed Packets (0x13) plen 5    #167 [hci1] 13.597407
        Num handles: 1
        Handle: 129 Address: DF:A9:FF:F6:B1:1A (OUI DF-A9-FF)
        Count: 1
        #166: len 21 (0 Kb/s)
        Latency: 173 msec (80-173 msec ~165 msec)
> ACL Data RX: Handle 129 flags 0x02 dlen 21              #168 [hci1] 13.685277
      SMP: Pairing Confirm (0x03) len 16
        Confim value: cbf985cf7e07ab3408342ba309cd7058
< HCI Command: Host Number of Com.. (0x03|0x0035) plen 5  #169 [hci1] 13.704245
        Num handles: 1
        Handle: 129 Address: DF:A9:FF:F6:B1:1A (OUI DF-A9-FF)
        Count: 1
< ACL Data TX: Handle 129 flags 0x00 dlen 21              #170 [hci1] 13.704492
      SMP: Pairing Confirm (0x03) len 16
        Confim value: 306b4945bca199d45f5b79cd2e154d04
> HCI Event: Number of Completed Packets (0x13) plen 5    #171 [hci1] 13.860162
        Num handles: 1
        Handle: 129 Address: DF:A9:FF:F6:B1:1A (OUI DF-A9-FF)
        Count: 1
        #170: len 21 (1 Kb/s)
        Latency: 155 msec (80-173 msec ~160 msec)
> ACL Data RX: Handle 129 flags 0x02 dlen 21              #172 [hci1] 13.860454
      SMP: Pairing Random (0x04) len 16
        Random value: 0e689b4a0553d9690000000000000000
< HCI Command: Host Number of Com.. (0x03|0x0035) plen 5  #173 [hci1] 13.864455
        Num handles: 1
        Handle: 129 Address: DF:A9:FF:F6:B1:1A (OUI DF-A9-FF)
        Count: 1
< ACL Data TX: Handle 129 flags 0x00 dlen 21              #174 [hci1] 13.864554
      SMP: Pairing Random (0x04) len 16
        Random value: 297efe85e67448a15f56bd27e3a3cf1d
> HCI Event: Number of Completed Packets (0x13) plen 5    #175 [hci1] 14.035015
        Num handles: 1
        Handle: 129 Address: DF:A9:FF:F6:B1:1A (OUI DF-A9-FF)
        Count: 1
        #174: len 21 (0 Kb/s)
        Latency: 170 msec (80-173 msec ~165 msec)
> ACL Data RX: Handle 129 flags 0x02 dlen 21              #176 [hci1] 14.122918
      SMP: Pairing Confirm (0x03) len 16
        Confim value: 66edfb7e1a2c53fbaa81b74915da0b74
< HCI Command: Host Number of Com.. (0x03|0x0035) plen 5  #177 [hci1] 14.123891
        Num handles: 1
        Handle: 129 Address: DF:A9:FF:F6:B1:1A (OUI DF-A9-FF)
        Count: 1
< ACL Data TX: Handle 129 flags 0x00 dlen 21              #178 [hci1] 14.123947
      SMP: Pairing Confirm (0x03) len 16
        Confim value: 014647b3c99a03b5eea2d4c76e7caf44
> HCI Event: Number of Completed Packets (0x13) plen 5    #179 [hci1] 14.297612
        Num handles: 1
        Handle: 129 Address: DF:A9:FF:F6:B1:1A (OUI DF-A9-FF)
        Count: 1
        #178: len 21 (0 Kb/s)
        Latency: 173 msec (80-173 msec ~169 msec)
> ACL Data RX: Handle 129 flags 0x02 dlen 21              #180 [hci1] 14.297921
      SMP: Pairing Random (0x04) len 16
        Random value: f406a8270ead1cae0000000000000000
< HCI Command: Host Number of Com.. (0x03|0x0035) plen 5  #181 [hci1] 14.304159
        Num handles: 1
        Handle: 129 Address: DF:A9:FF:F6:B1:1A (OUI DF-A9-FF)
        Count: 1
< ACL Data TX: Handle 129 flags 0x00 dlen 21              #182 [hci1] 14.304270
      SMP: Pairing Random (0x04) len 16
        Random value: 25a9493fd3ce4faf02be7293595bb7c6
> HCI Event: Number of Completed Packets (0x13) plen 5    #183 [hci1] 14.472399
        Num handles: 1
        Handle: 129 Address: DF:A9:FF:F6:B1:1A (OUI DF-A9-FF)
        Count: 1
        #182: len 21 (1 Kb/s)
        Latency: 168 msec (80-173 msec ~168 msec)
> ACL Data RX: Handle 129 flags 0x02 dlen 21              #184 [hci1] 14.560226
      SMP: Pairing Confirm (0x03) len 16
        Confim value: 604f4496be1c47544eee81d1dd04e153
< HCI Command: Host Number of Com.. (0x03|0x0035) plen 5  #185 [hci1] 14.565059
        Num handles: 1
        Handle: 129 Address: DF:A9:FF:F6:B1:1A (OUI DF-A9-FF)
        Count: 1
< ACL Data TX: Handle 129 flags 0x00 dlen 21              #186 [hci1] 14.565227
      SMP: Pairing Confirm (0x03) len 16
        Confim value: d901bea7303a4750a25bc7b6adcf98f6
> HCI Event: Number of Completed Packets (0x13) plen 5    #187 [hci1] 14.735131
        Num handles: 1
        Handle: 129 Address: DF:A9:FF:F6:B1:1A (OUI DF-A9-FF)
        Count: 1
        #186: len 21 (0 Kb/s)
        Latency: 169 msec (80-173 msec ~169 msec)
> ACL Data RX: Handle 129 flags 0x02 dlen 21              #188 [hci1] 14.735396
      SMP: Pairing Random (0x04) len 16
        Random value: e7008edcb3161f000000000000000000
< HCI Command: Host Number of Com.. (0x03|0x0035) plen 5  #189 [hci1] 14.743647
        Num handles: 1
        Handle: 129 Address: DF:A9:FF:F6:B1:1A (OUI DF-A9-FF)
        Count: 1
< ACL Data TX: Handle 129 flags 0x00 dlen 21              #190 [hci1] 14.743658
      SMP: Pairing Random (0x04) len 16
        Random value: 58f6b41f855a6f6c3560debd84e2affc
> HCI Event: Number of Completed Packets (0x13) plen 5    #191 [hci1] 14.909875
        Num handles: 1
        Handle: 129 Address: DF:A9:FF:F6:B1:1A (OUI DF-A9-FF)
        Count: 1
        #190: len 21 (1 Kb/s)
        Latency: 166 msec (80-173 msec ~167 msec)
> ACL Data RX: Handle 129 flags 0x02 dlen 21              #192 [hci1] 14.997820
      SMP: Pairing Confirm (0x03) len 16
        Confim value: 858a6e5969fce4d4ebe463a65d0e081a
< HCI Command: Host Number of Com.. (0x03|0x0035) plen 5  #193 [hci1] 15.003731
        Num handles: 1
        Handle: 129 Address: DF:A9:FF:F6:B1:1A (OUI DF-A9-FF)
        Count: 1
< ACL Data TX: Handle 129 flags 0x00 dlen 21              #194 [hci1] 15.003842
      SMP: Pairing Confirm (0x03) len 16
        Confim value: 0e2c492682c33862d8f1bd02a9ad44e4
> HCI Event: Number of Completed Packets (0x13) plen 5    #195 [hci1] 15.172585
        Num handles: 1
        Handle: 129 Address: DF:A9:FF:F6:B1:1A (OUI DF-A9-FF)
        Count: 1
        #194: len 21 (1 Kb/s)
        Latency: 168 msec (80-173 msec ~168 msec)
> ACL Data RX: Handle 129 flags 0x02 dlen 21              #196 [hci1] 15.172956
      SMP: Pairing Random (0x04) len 16
        Random value: fc80bd8aaea205540000000000000000
< HCI Command: Host Number of Com.. (0x03|0x0035) plen 5  #197 [hci1] 15.183869
        Num handles: 1
        Handle: 129 Address: DF:A9:FF:F6:B1:1A (OUI DF-A9-FF)
        Count: 1
< ACL Data TX: Handle 129 flags 0x00 dlen 21              #198 [hci1] 15.183887
      SMP: Pairing Random (0x04) len 16
        Random value: b67e7216d5bf664139eda2b542549666
> HCI Event: Number of Completed Packets (0x13) plen 5    #199 [hci1] 15.347341
        Num handles: 1
        Handle: 129 Address: DF:A9:FF:F6:B1:1A (OUI DF-A9-FF)
        Count: 1
        #198: len 21 (1 Kb/s)
        Latency: 163 msec (80-173 msec ~165 msec)
> ACL Data RX: Handle 129 flags 0x02 dlen 21              #200 [hci1] 15.435312
      SMP: Pairing Confirm (0x03) len 16
        Confim value: 17a821ba1cca463bdd7b2af4a040e6cc
< HCI Command: Host Number of Com.. (0x03|0x0035) plen 5  #201 [hci1] 15.443912
        Num handles: 1
        Handle: 129 Address: DF:A9:FF:F6:B1:1A (OUI DF-A9-FF)
        Count: 1
< ACL Data TX: Handle 129 flags 0x00 dlen 21              #202 [hci1] 15.444040
      SMP: Pairing Confirm (0x03) len 16
        Confim value: a9bfcdc57c706eab8d078ef592ebd95f
> HCI Event: Number of Completed Packets (0x13) plen 5    #203 [hci1] 15.610095
        Num handles: 1
        Handle: 129 Address: DF:A9:FF:F6:B1:1A (OUI DF-A9-FF)
        Count: 1
        #202: len 21 (1 Kb/s)
        Latency: 166 msec (80-173 msec ~165 msec)
> ACL Data RX: Handle 129 flags 0x02 dlen 21              #204 [hci1] 15.610362
      SMP: Pairing Random (0x04) len 16
        Random value: 2deeab753f66907c0000000000000000
< HCI Command: Host Number of Com.. (0x03|0x0035) plen 5  #205 [hci1] 15.624400
        Num handles: 1
        Handle: 129 Address: DF:A9:FF:F6:B1:1A (OUI DF-A9-FF)
        Count: 1
< ACL Data TX: Handle 129 flags 0x00 dlen 21              #206 [hci1] 15.624485
      SMP: Pairing Random (0x04) len 16
        Random value: ed17f76500c95219dd01e09d1e63f87b
> HCI Event: Number of Completed Packets (0x13) plen 5    #207 [hci1] 15.784992
        Num handles: 1
        Handle: 129 Address: DF:A9:FF:F6:B1:1A (OUI DF-A9-FF)
        Count: 1
        #206: len 21 (1 Kb/s)
        Latency: 160 msec (80-173 msec ~163 msec)
> ACL Data RX: Handle 129 flags 0x02 dlen 21              #208 [hci1] 15.872860
      SMP: Pairing Confirm (0x03) len 16
        Confim value: 9b8521cd73a6be1b5808d9665a7500f5
< HCI Command: Host Number of Com.. (0x03|0x0035) plen 5  #209 [hci1] 15.883975
        Num handles: 1
        Handle: 129 Address: DF:A9:FF:F6:B1:1A (OUI DF-A9-FF)
        Count: 1
< ACL Data TX: Handle 129 flags 0x00 dlen 21              #210 [hci1] 15.884106
      SMP: Pairing Confirm (0x03) len 16
        Confim value: fd77259a6eb0140397eabcc98c00d6d7
> HCI Event: Number of Completed Packets (0x13) plen 5    #211 [hci1] 16.047588
        Num handles: 1
        Handle: 129 Address: DF:A9:FF:F6:B1:1A (OUI DF-A9-FF)
        Count: 1
        #210: len 21 (1 Kb/s)
        Latency: 163 msec (80-173 msec ~163 msec)
> ACL Data RX: Handle 129 flags 0x02 dlen 21              #212 [hci1] 16.047895
      SMP: Pairing Random (0x04) len 16
        Random value: 9335aff986cc34ea0000000000000000
< HCI Command: Host Number of Com.. (0x03|0x0035) plen 5  #213 [hci1] 16.064354
        Num handles: 1
        Handle: 129 Address: DF:A9:FF:F6:B1:1A (OUI DF-A9-FF)
        Count: 1
< ACL Data TX: Handle 129 flags 0x00 dlen 21              #214 [hci1] 16.064377
      SMP: Pairing Random (0x04) len 16
        Random value: 81d35d47e1f6006d79c974bd9d9e1ee3
> HCI Event: Number of Completed Packets (0x13) plen 5    #215 [hci1] 16.222315
        Num handles: 1
        Handle: 129 Address: DF:A9:FF:F6:B1:1A (OUI DF-A9-FF)
        Count: 1
        #214: len 21 (1 Kb/s)
        Latency: 157 msec (80-173 msec ~160 msec)
> ACL Data RX: Handle 129 flags 0x02 dlen 21              #216 [hci1] 16.310277
      SMP: Pairing Confirm (0x03) len 16
        Confim value: 314c6f46a1327048650754dd881482aa
< HCI Command: Host Number of Com.. (0x03|0x0035) plen 5  #217 [hci1] 16.324036
        Num handles: 1
        Handle: 129 Address: DF:A9:FF:F6:B1:1A (OUI DF-A9-FF)
        Count: 1
< ACL Data TX: Handle 129 flags 0x00 dlen 21              #218 [hci1] 16.324178
      SMP: Pairing Confirm (0x03) len 16
        Confim value: 5dc367e686a038befd972ab47b216c9b
> HCI Event: Number of Completed Packets (0x13) plen 5    #219 [hci1] 16.485002
        Num handles: 1
        Handle: 129 Address: DF:A9:FF:F6:B1:1A (OUI DF-A9-FF)
        Count: 1
        #218: len 21 (1 Kb/s)
        Latency: 160 msec (80-173 msec ~160 msec)
> ACL Data RX: Handle 129 flags 0x02 dlen 21              #220 [hci1] 16.485355
      SMP: Pairing Random (0x04) len 16
        Random value: 1019330b1ce59d1f0000000000000000
< HCI Command: Host Number of Com.. (0x03|0x0035) plen 5  #221 [hci1] 16.504388
        Num handles: 1
        Handle: 129 Address: DF:A9:FF:F6:B1:1A (OUI DF-A9-FF)
        Count: 1
< ACL Data TX: Handle 129 flags 0x00 dlen 21              #222 [hci1] 16.504544
      SMP: Pairing Random (0x04) len 16
        Random value: e7f7e0c2476823e41736a7e381bafb7c
> HCI Event: Number of Completed Packets (0x13) plen 5    #223 [hci1] 16.659874
        Num handles: 1
        Handle: 129 Address: DF:A9:FF:F6:B1:1A (OUI DF-A9-FF)
        Count: 1
        #222: len 21 (1 Kb/s)
        Latency: 155 msec (80-173 msec ~158 msec)
> ACL Data RX: Handle 129 flags 0x02 dlen 21              #224 [hci1] 16.747745
      SMP: Pairing Confirm (0x03) len 16
        Confim value: e176cdbfe77a5a2c6ff2fe4d93f9f50a
< HCI Command: Host Number of Com.. (0x03|0x0035) plen 5  #225 [hci1] 16.764120
        Num handles: 1
        Handle: 129 Address: DF:A9:FF:F6:B1:1A (OUI DF-A9-FF)
        Count: 1
< ACL Data TX: Handle 129 flags 0x00 dlen 21              #226 [hci1] 16.764283
      SMP: Pairing Confirm (0x03) len 16
        Confim value: f3303e50ac7ad1f80894759ace43443b
> HCI Event: Number of Completed Packets (0x13) plen 5    #227 [hci1] 16.922552
        Num handles: 1
        Handle: 129 Address: DF:A9:FF:F6:B1:1A (OUI DF-A9-FF)
        Count: 1
        #226: len 21 (1 Kb/s)
        Latency: 158 msec (80-173 msec ~158 msec)
> ACL Data RX: Handle 129 flags 0x02 dlen 21              #228 [hci1] 16.923003
      SMP: Pairing Random (0x04) len 16
        Random value: 34757270464180770000000000000000
< HCI Command: Host Number of Com.. (0x03|0x0035) plen 5  #229 [hci1] 16.924299
        Num handles: 1
        Handle: 129 Address: DF:A9:FF:F6:B1:1A (OUI DF-A9-FF)
        Count: 1
