Bluetooth monitor ver 5.72
= Note: Linux version 7.0.0-31-generic (x86_64)                        0.735692
= Note: Bluetooth subsystem version 2.22                               0.735694
= New Index: 00:00:00:00:00:00 (Primary,UART,hci1)              [hci1] 0.735695
= New Index: 48:5F:99:8E:E0:64 (Primary,USB,hci0)               [hci0] 0.735695
= Open Index: 00:00:00:00:00:00                                 [hci1] 0.860092
= Index Info: 00:00:00:00:00:00 (Nordic Semiconductor ASA)      [hci1] 0.860105
@ USER Open: main (privileged) version 2.22            {0x0001} [hci1] 0.860108
< HCI Command: Reset (0x03|0x0003) plen 0                    #1 [hci1] 0.860465
> HCI Event: Command Complete (0x0e) plen 4                  #2 [hci1] 0.860945
      Reset (0x03|0x0003) ncmd 1
        Status: Success (0x00)
< HCI Command: Read Local Supported... (0x04|0x0003) plen 0  #3 [hci1] 0.880060
> HCI Event: Command Complete (0x0e) plen 12                 #4 [hci1] 0.880627
      Read Local Supported Features (0x04|0x0003) ncmd 1
        Status: Success (0x00)
        Features: 0x00 0x00 0x00 0x00 0x60 0x00 0x00 0x00
          BR/EDR Not Supported
          LE Supported (Controller)
< HCI Command: Read Local Version In.. (0x04|0x0001) plen 0  #5 [hci1] 0.900101
> HCI Event: Command Complete (0x0e) plen 12                 #6 [hci1] 0.900606
      Read Local Version Information (0x04|0x0001) ncmd 1
        Status: Success (0x00)
        HCI version: Reserved (0x11) - Revision 12345 (0x3039)
        LMP version: Reserved (0x11) - Subversion 12345 (0x3039)
        Manufacturer: Nordic Semiconductor ASA (89)
< HCI Command: Read Local Supported... (0x04|0x0002) plen 0  #7 [hci1] 0.920147
> HCI Event: Command Complete (0x0e) plen 68                 #8 [hci1] 0.921206
      Read Local Supported Commands (0x04|0x0002) ncmd 1
        Status: Success (0x00)
        Commands: 115 entries
          Disconnect (Octet 0 - Bit 5)
          Read Remote Version Information (Octet 2 - Bit 7)
          Set Event Mask (Octet 5 - Bit 6)
          Reset (Octet 5 - Bit 7)
          Read Connection Accept Timeout (Octet 7 - Bit 2)
          Write Connection Accept Timeout (Octet 7 - Bit 3)
          Read Transmit Power Level (Octet 10 - Bit 2)
          Set Controller To Host Flow Control (Octet 10 - Bit 5)
          Host Buffer Size (Octet 10 - Bit 6)
          Host Number of Completed Packets (Octet 10 - Bit 7)
          Read Local Version Information (Octet 14 - Bit 3)
          Read Local Supported Features (Octet 14 - Bit 5)
          Read BD ADDR (Octet 15 - Bit 1)
          Read RSSI (Octet 15 - Bit 5)
          Set Event Mask Page 2 (Octet 22 - Bit 2)
          LE Set Event Mask (Octet 25 - Bit 0)
          LE Read Buffer Size (Octet 25 - Bit 1)
          LE Read Local Supported Features (Octet 25 - Bit 2)
          LE Set Random Address (Octet 25 - Bit 4)
          LE Set Advertising Parameters (Octet 25 - Bit 5)
          LE Read Advertising Channel TX Power (Octet 25 - Bit 6)
          LE Set Advertising Data (Octet 25 - Bit 7)
          LE Set Scan Response Data (Octet 26 - Bit 0)
          LE Set Advertise Enable (Octet 26 - Bit 1)
          LE Set Scan Parameters (Octet 26 - Bit 2)
          LE Set Scan Enable (Octet 26 - Bit 3)
          LE Create Connection (Octet 26 - Bit 4)
          LE Create Connection Cancel (Octet 26 - Bit 5)
          LE Read Accept List Size (Octet 26 - Bit 6)
          LE Clear Accept List (Octet 26 - Bit 7)
          LE Add Device To Accept List (Octet 27 - Bit 0)
          LE Remove Device From Accept List (Octet 27 - Bit 1)
          LE Connection Update (Octet 27 - Bit 2)
          LE Set Host Channel Classification (Octet 27 - Bit 3)
          LE Read Channel Map (Octet 27 - Bit 4)
          LE Read Remote Used Features (Octet 27 - Bit 5)
          LE Encrypt (Octet 27 - Bit 6)
          LE Rand (Octet 27 - Bit 7)
          LE Start Encryption (Octet 28 - Bit 0)
          LE Long Term Key Request Reply (Octet 28 - Bit 1)
          LE Long Term Key Request Neg Reply (Octet 28 - Bit 2)
          LE Read Supported States (Octet 28 - Bit 3)
          Read Authenticated Payload Timeout (Octet 32 - Bit 4)
          Write Authenticated Payload Timeout (Octet 32 - Bit 5)
          LE Set Data Length (Octet 33 - Bit 6)
          LE Read Suggested Default Data Length (Octet 33 - Bit 7)
          LE Write Suggested Default Data Length (Octet 34 - Bit 0)
          LE Add Device To Resolving List (Octet 34 - Bit 3)
          LE Remove Device From Resolving List (Octet 34 - Bit 4)
          LE Clear Resolving List (Octet 34 - Bit 5)
          LE Read Resolving List Size (Octet 34 - Bit 6)
          LE Set Address Resolution Enable (Octet 35 - Bit 1)
          LE Set Resolvable Private Address Timeout (Octet 35 - Bit 2)
          LE Read Maximum Data Length (Octet 35 - Bit 3)
          LE Read PHY (Octet 35 - Bit 4)
          LE Set Default PHY (Octet 35 - Bit 5)
          LE Set PHY (Octet 35 - Bit 6)
          LE Set Advertising Set Random Address (Octet 36 - Bit 1)
          LE Set Extended Advertising Parameters (Octet 36 - Bit 2)
          LE Set Extended Advertising Data (Octet 36 - Bit 3)
          LE Set Extended Scan Response Data (Octet 36 - Bit 4)
          LE Set Extended Advertising Enable (Octet 36 - Bit 5)
          LE Read Maximum Advertising Data Length (Octet 36 - Bit 6)
          LE Read Number of Supported Advertising Sets (Octet 36 - Bit 7)
          LE Remove Advertising Set (Octet 37 - Bit 0)
          LE Clear Advertising Sets (Octet 37 - Bit 1)
          LE Set Periodic Advertising Parameters (Octet 37 - Bit 2)
          LE Set Periodic Advertising Data (Octet 37 - Bit 3)
          LE Set Periodic Advertising Enable (Octet 37 - Bit 4)
          LE Set Extended Scan Parameters (Octet 37 - Bit 5)
          LE Set Extended Scan Enable (Octet 37 - Bit 6)
          LE Extended Create Connection (Octet 37 - Bit 7)
          LE Periodic Advertising Create Sync (Octet 38 - Bit 0)
          LE Periodic Advertising Create Sync Cancel (Octet 38 - Bit 1)
          LE Periodic Advertising Terminate Sync (Octet 38 - Bit 2)
          LE Add Device To Periodic Advertiser List (Octet 38 - Bit 3)
          LE Remove Device From Periodic Advertiser List (Octet 38 - Bit 4)
          LE Clear Periodic Advertiser List (Octet 38 - Bit 5)
          LE Read Periodic Advertiser List Size (Octet 38 - Bit 6)
          LE Read Transmit Power (Octet 38 - Bit 7)
          LE Read RF Path Compensation (Octet 39 - Bit 0)
          LE Write RF Path Compensation (Octet 39 - Bit 1)
          LE Set Privacy Mode (Octet 39 - Bit 2)
          LE Periodic Advertising Receive Enable (Octet 40 - Bit 5)
          LE Periodic Advertising Sync Transfer (Octet 40 - Bit 6)
          LE Periodic Advertising Set Info Transfer (Octet 40 - Bit 7)
          LE Periodic Advertising Sync Transfer Parameters (Octet 41 - Bit 0)
          LE Set Default Periodic Advertisng Sync Transfer Parameters (Octet 41 - Bit 1)
          LE Read Buffer v2 (Octet 41 - Bit 5)
          LE Read ISO TX Sync (Octet 41 - Bit 6)
          LE Set Connected Isochronous Group Parameters (Octet 41 - Bit 7)
          LE Set Connected Isochronous Group Parameters Test (Octet 42 - Bit 0)
          LE Create Connected Isochronous Stream (Octet 42 - Bit 1)
          LE Remove Connected Isochronous Group (Octet 42 - Bit 2)
          LE Accept Connected Isochronous Stream Request (Octet 42 - Bit 3)
          LE Reject Connected Isochronous Stream Request (Octet 42 - Bit 4)
          LE Create Broadcast Isochronous Group (Octet 42 - Bit 5)
          LE Create Broadcast Isochronous Group Test (Octet 42 - Bit 6)
          LE Terminate Broadcast Isochronous Group (Octet 42 - Bit 7)
          LE Broadcast Isochronous Group Create Sync (Octet 43 - Bit 0)
          LE Broadcast Isochronous Group Terminate Sync (Octet 43 - Bit 1)
          LE Request Peer SCA (Octet 43 - Bit 2)
          LE Setup Isochronous Data Path (Octet 43 - Bit 3)
          LE Remove Isochronous Data Path (Octet 43 - Bit 4)
          LE Isochronous Transmit Test (Octet 43 - Bit 5)
          LE Isochronous Receive Test (Octet 43 - Bit 6)
          LE Isochronous Read Test Counters (Octet 43 - Bit 7)
          LE Isochronous Read Test Counters (Octet 44 - Bit 0)
          LE Set Host Feature (Octet 44 - Bit 1)
          Octet 44 - Bit 2 
          Octet 45 - Bit 6 
          Octet 46 - Bit 0 
          Octet 46 - Bit 1 
          Octet 46 - Bit 2 
          Octet 47 - Bit 4 
< HCI Command: Host Buffer Size (0x03|0x0033) plen 7         #9 [hci1] 0.940109
        ACL MTU: 255  ACL max packet: 16
        SCO MTU: 0    SCO max packet: 0
> HCI Event: Command Complete (0x0e) plen 4                 #10 [hci1] 0.940628
      Host Buffer Size (0x03|0x0033) ncmd 1
        Status: Success (0x00)
< HCI Command: Set Controller To Ho.. (0x03|0x0031) plen 1  #11 [hci1] 0.960073
        Flow control: ACL Data Packets (0x01)
> HCI Event: Command Complete (0x0e) plen 4                 #12 [hci1] 0.960487
      Set Controller To Host Flow Control (0x03|0x0031) ncmd 1
        Status: Success (0x00)
< HCI Command: LE Read Local Suppor.. (0x08|0x0003) plen 0  #13 [hci1] 0.980129
> HCI Event: Command Complete (0x0e) plen 12                #14 [hci1] 0.980596
      LE Read Local Supported Features (0x08|0x0003) ncmd 1
        Status: Success (0x00)
        Features: 0xfd 0x79 0x00 0xf7 0x30 0x01 0x00 0x00
          LE Encryption
          Extended Reject Indication
          Peripheral-initiated Features Exchange
          LE Ping
          LE Data Packet Length Extension
          LL Privacy
          Extended Scanner Filter Policies
          LE 2M PHY
          LE Coded PHY
          LE Extended Advertising
          LE Periodic Advertising
          Channel Selection Algorithm #2
          Periodic Advertising Sync Transfer - Sender
          Periodic Advertising Sync Transfer - Recipient
          Sleep Clock Accuracy Updates
          Connected Isochronous Stream - Central
          Connected Isochronous Stream - Peripheral
          Isochronous Broadcaster
          Synchronized Receiver
          Periodic Advertising ADI support
          Connection Subrating
          Unknown features (0x0000010000000000)
< HCI Command: LE Set Host Feature (0x08|0x0074) plen 2     #15 [hci1] 1.000095
        Bit Number: 32
          Connected Isochronous Stream (Host Support)
        Bit Value: 1
> HCI Event: Command Complete (0x0e) plen 4                 #16 [hci1] 1.000533
      LE Set Host Feature (0x08|0x0074) ncmd 1
        Status: Success (0x00)
< HCI Command: LE Read Buffer v2 (0x08|0x0060) plen 0       #17 [hci1] 1.020092
> HCI Event: Command Complete (0x0e) plen 10                #18 [hci1] 1.020549
      LE Read Buffer v2 (0x08|0x0060) ncmd 1
        Status: Success (0x00)
        ACL MTU: 27
        ACL max packet: 3
        ISO MTU: 318
        ISO max packet: 3
< HCI Command: LE Read Maximum Adve.. (0x08|0x003a) plen 0  #19 [hci1] 1.040099
> HCI Event: Command Complete (0x0e) plen 6                 #20 [hci1] 1.040579
      LE Read Maximum Advertising Data Length (0x08|0x003a) ncmd 1
        Status: Success (0x00)
        Max length: 1650
< HCI Command: LE Read Supported St.. (0x08|0x001c) plen 0  #21 [hci1] 1.060084
> HCI Event: Command Complete (0x0e) plen 12                #22 [hci1] 1.060600
      LE Read Supported States (0x08|0x001c) ncmd 1
        Status: Success (0x00)
        States: 0x000003ff3e0306ff
          Non-connectable Advertising State
          Scannable Advertising State
          Connectable Advertising State
          High Duty Cycle Directed Advertising State
          Passive Scanning State
          Active Scanning State
          Initiating State
            and Connection State (Central Role)
          Connection State (Peripheral Role)
          Scannable Advertising State
            and Passive Scanning State
          Connectable Advertising State
            and Passive Scanning State
          Non-connectable Advertising State
            and Initiating State
          Scannable Advertising State
            and Initiating State
          Active Scanning State
            and Connection State (Central Role)
          Passive Scanning State
            and Connection State (Peripheral Role)
          Active Scanning State
            and Connection State (Peripheral Role)
          Initiating State
            and Connection State (Central Role)
            and Central Role & Central Role
          Low Duty Cycle Directed Advertising State
          Connectable Advertising State
            and Initiating State
            and Central Role & Peripheral Role
          High Duty Cycle Directed Advertising State
            and Initiating State
            and Central Role & Peripheral Role
          Low Duty Cycle Directed Advertising State
            and Initiating State
            and Central Role & Peripheral Role
          Connectable Advertising State
            and Connection State (Central Role)
            and Central Role & Peripheral Role
          High Duty Cycle Directed Advertising State
            and Connection State (Central Role)
            and Central Role & Peripheral Role
          Low Duty Cycle Directed Advertising State
            and Connection State (Central Role)
            and Central Role & Peripheral Role
          Connectable Advertising State
            and Connection State (Peripheral Role)
            and Central Role & Peripheral Role
          High Duty Cycle Directed Advertising State
            and Connection State (Peripheral Role)
            and Peripheral Role & Peripheral Role
          Low Duty Cycle Directed Advertising State
            and Connection State (Peripheral Role)
            and Peripheral Role & Peripheral Role
          Initiating State
            and Connection State (Peripheral Role)
            and Central Role & Peripheral Role
< HCI Command: LE Read Maximum Data.. (0x08|0x002f) plen 0  #23 [hci1] 1.080076
> HCI Event: Command Complete (0x0e) plen 12                #24 [hci1] 1.080521
      LE Read Maximum Data Length (0x08|0x002f) ncmd 1
        Status: Success (0x00)
        Max TX octets: 251
        Max TX time: 2704
        Max RX octets: 251
        Max RX time: 2704
< HCI Command: LE Write Suggested D.. (0x08|0x0024) plen 4  #25 [hci1] 1.100101
        TX octets: 251
        TX time: 2704
> HCI Event: Command Complete (0x0e) plen 4                 #26 [hci1] 1.100530
      LE Write Suggested Default Data Length (0x08|0x0024) ncmd 1
        Status: Success (0x00)
< HCI Command: LE Read Resolving Li.. (0x08|0x002a) plen 0  #27 [hci1] 1.120110
> HCI Event: Command Complete (0x0e) plen 5                 #28 [hci1] 1.120545
      LE Read Resolving List Size (0x08|0x002a) ncmd 1
        Status: Success (0x00)
        Size: 8
< HCI Command: LE Set Host Feature (0x08|0x0074) plen 2     #29 [hci1] 1.140064
        Bit Number: 38
          Connection Subrating (Host Support)
        Bit Value: 1
> HCI Event: Command Complete (0x0e) plen 4                 #30 [hci1] 1.140522
      LE Set Host Feature (0x08|0x0074) ncmd 1
        Status: Success (0x00)
< HCI Command: LE Set Event Mask (0x08|0x0001) plen 8       #31 [hci1] 1.160098
        Mask: 0x000002063f87fa5e
          LE Advertising Report
          LE Connection Update Complete
          LE Read Remote Used Features Complete
          LE Long Term Key Request
          LE Data Length Change
          LE Enhanced Connection Complete
          LE PHY Update Complete
          LE Extended Advertising Report
          LE Periodic Advertising Sync Established
          LE Periodic Advertising Report
          LE Periodic Advertising Sync Lost
          LE Extended Scan Timeout
          LE Extended Advertising Set Terminated
          LE Scan Request Received
          LE Periodic Advertising Sync Transfer Rvc
          LE CIS Established
          LE CIS Request
          LE Create BIG Complete
          LE Terminate BIG Complete
          LE BIG Sync Estabilished Complete
          LE BIG Sync Lost
          LE BIG Info Advertising Report
          LE Subrate Change
          Unknown mask (0x0000020000000000)
> HCI Event: Command Complete (0x0e) plen 4                 #32 [hci1] 1.160627
      LE Set Event Mask (0x08|0x0001) ncmd 1
        Status: Success (0x00)
< HCI Command: Set Event Mask (0x03|0x0001) plen 8          #33 [hci1] 1.180148
        Mask: 0x2000800002008890
          Disconnection Complete
          Encryption Change
          Read Remote Version Information Complete
          Hardware Error
          Data Buffer Overflow
          Encryption Key Refresh Complete
          LE Meta
> HCI Event: Command Complete (0x0e) plen 4                 #34 [hci1] 1.180678
      Set Event Mask (0x03|0x0001) ncmd 1
        Status: Success (0x00)
< HCI Command: Read BD ADDR (0x04|0x0009) plen 0            #35 [hci1] 1.200093
> HCI Event: Command Complete (0x0e) plen 10                #36 [hci1] 1.200556
      Read BD ADDR (0x04|0x0009) ncmd 1
        Status: Success (0x00)
        Address: 00:00:00:00:00:00 (OUI 00-00-00)
< HCI Command: LE Set Random Address (0x08|0x0005) plen 6   #37 [hci1] 1.220156
        Address: D5:B6:CC:31:DB:3B (Static)
> HCI Event: Command Complete (0x0e) plen 4                 #38 [hci1] 1.220610
      LE Set Random Address (0x08|0x0005) ncmd 1
        Status: Success (0x00)
< HCI Command: LE Set Extended Adv.. (0x08|0x0036) plen 25  #39 [hci1] 3.550204
        Handle: 0x00
        Properties: 0x0013
          Connectable
          Scannable
          Use legacy advertising PDUs: ADV_IND
        Min advertising interval: 100.000 msec (0x00a0)
        Max advertising interval: 150.000 msec (0x00f0)
        Channel map: 37, 38, 39 (0x07)
        Own address type: Random (0x01)
        Peer address type: Public (0x00)
        Peer address: 00:00:00:00:00:00 (OUI 00-00-00)
        Filter policy: Allow Scan Request from Any, Allow Connect Request from Any (0x00)
        TX power: Host has no preference (0x7f)
        Primary PHY: LE 1M (0x01)
        Secondary max skip: 0x00
        Secondary PHY: LE 1M (0x01)
        SID: 0x00
        Scan request notifications: Disabled (0x00)
> HCI Event: Command Complete (0x0e) plen 5                 #40 [hci1] 3.550951
      LE Set Extended Advertising Parameters (0x08|0x0036) ncmd 1
        Status: Success (0x00)
        TX power (selected): 0 dbm (0x00)
< HCI Command: LE Set Advertising S.. (0x08|0x0035) plen 7  #41 [hci1] 3.560189
        Advertising handle: 0x00
        Advertising random address: D5:B6:CC:31:DB:3B (Static)
> HCI Event: Command Complete (0x0e) plen 4                 #42 [hci1] 3.560705
      LE Set Advertising Set Random Address (0x08|0x0035) ncmd 1
        Status: Success (0x00)
< HCI Command: LE Set Extended Adv.. (0x08|0x0037) plen 22  #43 [hci1] 3.580146
        Handle: 0x00
        Operation: Complete extended advertising data (0x03)
        Fragment preference: Minimize fragmentation (0x01)
        Data length: 0x12
        Flags: 0x06
          LE General Discoverable Mode
          BR/EDR Not Supported
        Name (complete): Tester_F6B11A
> HCI Event: Command Complete (0x0e) plen 4                 #44 [hci1] 3.580899
      LE Set Extended Advertising Data (0x08|0x0037) ncmd 1
        Status: Success (0x00)
< HCI Command: LE Set Extended Scan.. (0x08|0x0038) plen 4  #45 [hci1] 3.600176
        Handle: 0x00
        Operation: Complete scan response data (0x03)
        Fragment preference: Minimize fragmentation (0x01)
        Data length: 0x00
> HCI Event: Command Complete (0x0e) plen 4                 #46 [hci1] 3.600609
      LE Set Extended Scan Response Data (0x08|0x0038) ncmd 1
        Status: Success (0x00)
< HCI Command: LE Set Extended Adve.. (0x08|0x0039) plen 6  #47 [hci1] 3.620238
        Extended advertising: Enabled (0x01)
        Number of sets: 1 (0x01)
        Entry 0
          Handle: 0x00
          Duration: 0 ms (0x00)
          Max ext adv events: 0
> HCI Event: Command Complete (0x0e) plen 4                 #48 [hci1] 3.620808
      LE Set Extended Advertising Enable (0x08|0x0039) ncmd 1
        Status: Success (0x00)
> HCI Event: LE Meta Event (0x3e) plen 31                   #49 [hci1] 3.737925
      LE Enhanced Connection Complete (0x0a)
        Status: Success (0x00)
        Handle: 1515
        Role: Peripheral (0x01)
        Peer address type: Public (0x00)
        Peer address: DF:A9:FF:F6:B1:1A (OUI DF-A9-FF)
        Local resolvable private address: 00:00:00:00:00:00 (Non-Resolvable)
        Peer resolvable private address: 00:00:00:00:00:00 (Non-Resolvable)
        Connection interval: 87.50 msec (0x0046)
        Connection latency: 0 (0x0000)
        Supervision timeout: 25120 msec (0x09d0)
        Central clock accuracy: 0x01
> HCI Event: LE Meta Event (0x3e) plen 6                    #50 [hci1] 3.737928
      LE Advertising Set Terminated (0x12)
        Status: Success (0x00)
        Handle: 0
        Connection handle: 1515
        Number of completed extended advertising events: 0
< HCI Command: LE Read Remote Used... (0x08|0x0016) plen 2  #51 [hci1] 3.740439
        Handle: 1515 Address: DF:A9:FF:F6:B1:1A (OUI DF-A9-FF)
< ACL Data TX: Handle 1515 flags 0x00 dlen 7                #52 [hci1] 3.740449
      ATT: Exchange MTU Request (0x02) len 2
        Client RX MTU: 251
> HCI Event: Command Status (0x0f) plen 4                   #53 [hci1] 3.740967
      LE Read Remote Used Features (0x08|0x0016) ncmd 1
        Status: Success (0x00)
> HCI Event: Number of Completed Packets (0x13) plen 5      #54 [hci1] 3.913870
        Num handles: 1
        Handle: 1515 Address: DF:A9:FF:F6:B1:1A (OUI DF-A9-FF)
        Count: 1
        #52: len 7 (0 Kb/s)
        Latency: 173 msec (173-173 msec ~173 msec)
> HCI Event: LE Meta Event (0x3e) plen 12                   #55 [hci1] 4.001780
      LE Read Remote Used Features (0x04)
        Status: Success (0x00)
        Handle: 1515 Address: DF:A9:FF:F6:B1:1A (OUI DF-A9-FF)
        Features: 0x2d 0x49 0x00 0xf7 0x67 0xd9 0x00 0x80
          LE Encryption
          Extended Reject Indication
          Peripheral-initiated Features Exchange
          LE Data Packet Length Extension
          LE 2M PHY
          LE Coded PHY
          Channel Selection Algorithm #2
          Periodic Advertising Sync Transfer - Sender
          Periodic Advertising Sync Transfer - Recipient
          Sleep Clock Accuracy Updates
          Connected Isochronous Stream - Central
          Connected Isochronous Stream - Peripheral
          Isochronous Broadcaster
          Synchronized Receiver
          Connected Isochronous Stream (Host Support)
          LE Power Control Request
          LE Power Control Request
          Connection Subrating
          Connection Subrating (Host Support)
          Unknown features (0x8000d90000000000)
> ACL Data RX: Handle 1515 flags 0x02 dlen 11               #56 [hci1] 6.451514
      SMP: Pairing Request (0x01) len 6
        IO capability: KeyboardDisplay (0x04)
        OOB data: Authentication data not present (0x00)
        Authentication requirement: Bonding, MITM, SC, No Keypresses (0x0d)
        Max encryption key size: 16
        Initiator key distribution: EncKey IdKey (0x03)
        Responder key distribution: EncKey IdKey Sign (0x07)
> ACL Data RX: Handle 1515 flags 0x02 dlen 7                #57 [hci1] 6.451976
      ATT: Exchange MTU Response (0x03) len 2
        Server RX MTU: 23
< HCI Command: Host Number of Compl.. (0x03|0x0035) plen 5  #58 [hci1] 6.460360
        Num handles: 1
        Handle: 1515 Address: DF:A9:FF:F6:B1:1A (OUI DF-A9-FF)
        Count: 1
< ACL Data TX: Handle 1515 flags 0x00 dlen 11               #59 [hci1] 6.460400
      SMP: Pairing Response (0x02) len 6
        IO capability: NoInputNoOutput (0x03)
        OOB data: Authentication data not present (0x00)
        Authentication requirement: Bonding, No MITM, SC, No Keypresses (0x09)
        Max encryption key size: 16
        Initiator key distribution: IdKey (0x02)
        Responder key distribution: <none> (0x00)
< HCI Command: Host Number of Compl.. (0x03|0x0035) plen 5  #60 [hci1] 6.460630
        Num handles: 1
        Handle: 1515 Address: DF:A9:FF:F6:B1:1A (OUI DF-A9-FF)
        Count: 1
> HCI Event: Number of Completed Packets (0x13) plen 5      #61 [hci1] 6.626603
        Num handles: 1
        Handle: 1515 Address: DF:A9:FF:F6:B1:1A (OUI DF-A9-FF)
        Count: 1
        #59: len 11 (0 Kb/s)
        Latency: 166 msec (166-173 msec ~169 msec)
> ACL Data RX: Handle 1515 flags 0x02 dlen 27               #62 [hci1] 6.626952
> ACL Data RX: Handle 1515 flags 0x01 dlen 27               #63 [hci1] 6.627469
> ACL Data RX: Handle 1515 flags 0x01 dlen 15               #64 [hci1] 6.627901
      SMP: Pairing Public Key (0x0c) len 64
        X: 65931fc4bbb7214033ec221b3935a3a4a56d681a35a7170568c2451bfff84810
        Y: 53199d36b71ababb970b515d375aa68a25183608f08682a41b97d865b5e974fb
< HCI Command: Host Number of Compl.. (0x03|0x0035) plen 5  #65 [hci1] 6.640958
        Num handles: 1
        Handle: 1515 Address: DF:A9:FF:F6:B1:1A (OUI DF-A9-FF)
        Count: 1
< HCI Command: Host Number of Compl.. (0x03|0x0035) plen 5  #66 [hci1] 6.641090
        Num handles: 1
        Handle: 1515 Address: DF:A9:FF:F6:B1:1A (OUI DF-A9-FF)
        Count: 1
< HCI Command: Host Number of Compl.. (0x03|0x0035) plen 5  #67 [hci1] 6.641415
        Num handles: 1
        Handle: 1515 Address: DF:A9:FF:F6:B1:1A (OUI DF-A9-FF)
        Count: 1
< ACL Data TX: Handle 1515 flags 0x00 dlen 27               #68 [hci1] 6.641550
< ACL Data TX: Handle 1515 flags 0x01 dlen 27               #69 [hci1] 6.641569
< ACL Data TX: Handle 1515 flags 0x01 dlen 15               #70 [hci1] 6.641573
      SMP: Pairing Public Key (0x0c) len 64
        X: 98308440221e2d910f0e54b71e7ec652857aa9b5a0dc65028824cc19db1226e9
        Y: 67a4816bcb62efb21701e31fdb27561a6217575fb007a8bbdabe7e28b6f68482
> HCI Event: Number of Completed Packets (0x13) plen 5      #71 [hci1] 6.714506
        Num handles: 1
        Handle: 1515 Address: DF:A9:FF:F6:B1:1A (OUI DF-A9-FF)
        Count: 1
        #68: len 27 (3 Kb/s)
        Latency: 72 msec (72-173 msec ~121 msec)
> HCI Event: Number of Completed Packets (0x13) plen 5      #72 [hci1] 6.715190
        Num handles: 1
        Handle: 1515 Address: DF:A9:FF:F6:B1:1A (OUI DF-A9-FF)
        Count: 1
        #69: len 27 (2 Kb/s)
        Latency: 73 msec (72-173 msec ~97 msec)
< ACL Data TX: Handle 1515 flags 0x00 dlen 21               #73 [hci1] 6.720142
      SMP: Pairing Confirm (0x03) len 16
        Confim value: 927ba02771558f783410509edc0c5b85
> HCI Event: Number of Completed Packets (0x13) plen 5      #74 [hci1] 6.801371
        Num handles: 1
        Handle: 1515 Address: DF:A9:FF:F6:B1:1A (OUI DF-A9-FF)
        Count: 1
        #70: len 15 (0 Kb/s)
        Latency: 159 msec (72-173 msec ~128 msec)
> HCI Event: Number of Completed Packets (0x13) plen 5      #75 [hci1] 6.889061
        Num handles: 1
        Handle: 1515 Address: DF:A9:FF:F6:B1:1A (OUI DF-A9-FF)
        Count: 1
        #73: len 21 (1 Kb/s)
        Latency: 168 msec (72-173 msec ~148 msec)
> ACL Data RX: Handle 1515 flags 0x02 dlen 21               #76 [hci1] 6.889362
      SMP: Pairing Random (0x04) len 16
        Random value: ecc1e29bac6c4f030000000000000000
< HCI Command: Host Number of Compl.. (0x03|0x0035) plen 5  #77 [hci1] 6.900417
        Num handles: 1
        Handle: 1515 Address: DF:A9:FF:F6:B1:1A (OUI DF-A9-FF)
        Count: 1
< ACL Data TX: Handle 1515 flags 0x00 dlen 21               #78 [hci1] 6.900505
      SMP: Pairing Random (0x04) len 16
        Random value: 8e6108f966a694cbe26df70bb96773e6
> HCI Event: Number of Completed Packets (0x13) plen 5      #79 [hci1] 7.063789
        Num handles: 1
        Handle: 1515 Address: DF:A9:FF:F6:B1:1A (OUI DF-A9-FF)
        Count: 1
        #78: len 21 (1 Kb/s)
        Latency: 163 msec (72-173 msec ~156 msec)
> ACL Data RX: Handle 1515 flags 0x02 dlen 21               #80 [hci1] 7.239172
      SMP: Pairing DHKey Check (0x0d) len 16
        E: 47154fe79111ae37563e1fe44ed5598f
< HCI Command: Host Number of Compl.. (0x03|0x0035) plen 5  #81 [hci1] 7.240498
        Num handles: 1
        Handle: 1515 Address: DF:A9:FF:F6:B1:1A (OUI DF-A9-FF)
        Count: 1
< ACL Data TX: Handle 1515 flags 0x00 dlen 21               #82 [hci1] 7.240543
      SMP: Pairing DHKey Check (0x0d) len 16
        E: 209dbdf265d1556f3a5e2062a90b090e
> HCI Event: Number of Completed Packets (0x13) plen 5      #83 [hci1] 7.413884
        Num handles: 1
        Handle: 1515 Address: DF:A9:FF:F6:B1:1A (OUI DF-A9-FF)
        Count: 1
        #82: len 21 (0 Kb/s)
        Latency: 173 msec (72-173 msec ~164 msec)
> HCI Event: LE Meta Event (0x3e) plen 13                   #84 [hci1] 7.501920
      LE Long Term Key Request (0x05)
        Handle: 1515 Address: DF:A9:FF:F6:B1:1A (OUI DF-A9-FF)
        Random number: 0x0000000000000000
        Encrypted diversifier: 0x0000
< HCI Command: LE Long Term Key Re.. (0x08|0x001a) plen 18  #85 [hci1] 7.520296
        Handle: 1515 Address: DF:A9:FF:F6:B1:1A (OUI DF-A9-FF)
        Long term key: af0e62de4912b238a99c47099ae76c23
> HCI Event: Command Complete (0x0e) plen 6                 #86 [hci1] 7.520959
      LE Long Term Key Request Reply (0x08|0x001a) ncmd 1
        Status: Success (0x00)
        Handle: 1515 Address: DF:A9:FF:F6:B1:1A (OUI DF-A9-FF)
> HCI Event: Encryption Change (0x08) plen 4                #87 [hci1] 7.939050
        Status: Success (0x00)
        Handle: 1515 Address: DF:A9:FF:F6:B1:1A (OUI DF-A9-FF)
        Encryption: Enabled with AES-CCM (0x01)
> ACL Data RX: Handle 1515 flags 0x02 dlen 21               #88 [hci1] 8.026833
      SMP: Identity Information (0x08) len 16
        Identity resolving key: 5ec808ff6501ba15dea7d4e16f58cd0b
< ACL Data TX: Handle 1515 flags 0x00 dlen 11               #89 [hci1] 8.050436
      ATT: Read By Type Request (0x08) len 6
        Handle range: 0x0001-0xffff
        Attribute type: Central Address Resolution (0x2aa6)
< HCI Command: Host Number of Compl.. (0x03|0x0035) plen 5  #90 [hci1] 8.050643
        Num handles: 1
        Handle: 1515 Address: DF:A9:FF:F6:B1:1A (OUI DF-A9-FF)
        Count: 1
> HCI Event: Number of Completed Packets (0x13) plen 5      #91 [hci1] 8.201520
        Num handles: 1
        Handle: 1515 Address: DF:A9:FF:F6:B1:1A (OUI DF-A9-FF)
        Count: 1
        #89: len 11 (0 Kb/s)
        Latency: 151 msec (72-173 msec ~157 msec)
> ACL Data RX: Handle 1515 flags 0x02 dlen 12               #92 [hci1] 8.201674
      SMP: Identity Address Information (0x09) len 7
        Address: DF:A9:FF:F6:B1:1A (OUI DF-A9-FF)
< HCI Command: LE Add Device To Re.. (0x08|0x0027) plen 39  #93 [hci1] 8.220449
        Address type: Public (0x00)
        Address: DF:A9:FF:F6:B1:1A (OUI DF-A9-FF)
        Peer identity resolving key: 5ec808ff6501ba15dea7d4e16f58cd0b
        Local identity resolving key: 00000000000000000000000000000000
> HCI Event: Command Complete (0x0e) plen 4                 #94 [hci1] 8.221389
      LE Add Device To Resolving List (0x08|0x0027) ncmd 1
        Status: Success (0x00)
< HCI Command: LE Set Privacy Mode (0x08|0x004e) plen 8     #95 [hci1] 8.240255
        Peer Identity address type: Public (0x00)
        Peer Identity address: DF:A9:FF:F6:B1:1A (OUI DF-A9-FF)
        Privacy Mode: Use Device Privacy (0x01)
> HCI Event: Command Complete (0x0e) plen 4                 #96 [hci1] 8.240820
      LE Set Privacy Mode (0x08|0x004e) ncmd 1
        Status: Success (0x00)
< HCI Command: LE Set Address Resol.. (0x08|0x002d) plen 1  #97 [hci1] 8.260212
        Address resolution: Enabled (0x01)
> HCI Event: Command Complete (0x0e) plen 4                 #98 [hci1] 8.260611
      LE Set Address Resolution Enable (0x08|0x002d) ncmd 1
        Status: Success (0x00)
< HCI Command: Host Number of Compl.. (0x03|0x0035) plen 5  #99 [hci1] 8.280250
        Num handles: 1
        Handle: 1515 Address: DF:A9:FF:F6:B1:1A (OUI DF-A9-FF)
        Count: 1
> ACL Data RX: Handle 1515 flags 0x02 dlen 9               #100 [hci1] 8.376476
      ATT: Read By Type Response (0x09) len 4
        Attribute data length: 3
        Attribute data list: 1 entry
        Handle: 0x000f
        Value: 01
< HCI Command: Host Number of Comp.. (0x03|0x0035) plen 5  #101 [hci1] 8.380310
        Num handles: 1
        Handle: 1515 Address: DF:A9:FF:F6:B1:1A (OUI DF-A9-FF)
        Count: 1
< ACL Data TX: Handle 1515 flags 0x00 dlen 13              #102 [hci1] 8.670792
      ATT: Find By Type Value Request (0x06) len 8
        Handle range: 0x0001-0xffff
        Attribute type: Primary Service (0x2800)
          UUID: Generic Telephony Bearer (0x184c)
> HCI Event: Number of Completed Packets (0x13) plen 5     #103 [hci1] 8.813932
        Num handles: 1
        Handle: 1515 Address: DF:A9:FF:F6:B1:1A (OUI DF-A9-FF)
        Count: 1
        #102: len 13 (0 Kb/s)
        Latency: 143 msec (72-173 msec ~150 msec)
> ACL Data RX: Handle 1515 flags 0x02 dlen 9               #104 [hci1] 8.814139
      ATT: Find By Type Value Response (0x07) len 4
        Handle range: 0x0110-0x013c
< HCI Command: Host Number of Comp.. (0x03|0x0035) plen 5  #105 [hci1] 8.820870
        Num handles: 1
        Handle: 1515 Address: DF:A9:FF:F6:B1:1A (OUI DF-A9-FF)
        Count: 1
< ACL Data TX: Handle 1515 flags 0x00 dlen 13              #106 [hci1] 8.821012
      ATT: Find By Type Value Request (0x06) len 8
        Handle range: 0x0001-0xffff
        Attribute type: Primary Service (0x2800)
          UUID: Telephony Bearer (0x184b)
> HCI Event: Number of Completed Packets (0x13) plen 5     #107 [hci1] 8.988976
        Num handles: 1
        Handle: 1515 Address: DF:A9:FF:F6:B1:1A (OUI DF-A9-FF)
        Count: 1
        #106: len 13 (0 Kb/s)
        Latency: 167 msec (72-173 msec ~159 msec)
> ACL Data RX: Handle 1515 flags 0x02 dlen 9               #108 [hci1] 8.989227
      ATT: Find By Type Value Response (0x07) len 4
        Handle range: 0x00d0-0x00fc
< HCI Command: Host Number of Comp.. (0x03|0x0035) plen 5  #109 [hci1] 9.000683
        Num handles: 1
        Handle: 1515 Address: DF:A9:FF:F6:B1:1A (OUI DF-A9-FF)
        Count: 1
< ACL Data TX: Handle 1515 flags 0x00 dlen 11              #110 [hci1] 9.000792
      ATT: Read By Type Request (0x08) len 6
        Handle range: 0x0111-0x013c
        Attribute type: Characteristic (0x2803)
> HCI Event: Number of Completed Packets (0x13) plen 5     #111 [hci1] 9.164146
        Num handles: 1
        Handle: 1515 Address: DF:A9:FF:F6:B1:1A (OUI DF-A9-FF)
        Count: 1
        #110: len 11 (0 Kb/s)
        Latency: 163 msec (72-173 msec ~161 msec)
> ACL Data RX: Handle 1515 flags 0x02 dlen 27              #112 [hci1] 9.164489
      ATT: Read By Type Response (0x09) len 22
        Attribute data length: 7
        Attribute data list: 3 entries
        Handle: 0x0111
        Value: 121201b32b
            Properties: 0x12
              Read (0x02)
              Notify (0x10)
            Value Handle: 0x0112
            Value UUID: Bearer Provider Name (0x2bb3)
        Handle: 0x0114
        Value: 021501b42b
            Properties: 0x02
              Read (0x02)
            Value Handle: 0x0115
            Value UUID: Bearer UCI (0x2bb4)
        Handle: 0x0116
        Value: 121701b52b
            Properties: 0x12
              Read (0x02)
              Notify (0x10)
            Value Handle: 0x0117
            Value UUID: Bearer Technology (0x2bb5)
< HCI Command: Host Number of Comp.. (0x03|0x0035) plen 5  #113 [hci1] 9.180334
        Num handles: 1
        Handle: 1515 Address: DF:A9:FF:F6:B1:1A (OUI DF-A9-FF)
        Count: 1
< ACL Data TX: Handle 1515 flags 0x00 dlen 9               #114 [hci1] 9.180427
      ATT: Find Information Request (0x04) len 4
        Handle range: 0x0112-0x013c
> HCI Event: Number of Completed Packets (0x13) plen 5     #115 [hci1] 9.339065
        Num handles: 1
        Handle: 1515 Address: DF:A9:FF:F6:B1:1A (OUI DF-A9-FF)
        Count: 1
        #114: len 9 (0 Kb/s)
        Latency: 158 msec (72-173 msec ~159 msec)
> ACL Data RX: Handle 1515 flags 0x02 dlen 26              #116 [hci1] 9.339438
      ATT: Find Information Response (0x05) len 21
        Format: UUID-16 (0x01)
        Handle: 0x0112
        UUID: Bearer Provider Name (0x2bb3)
        Handle: 0x0113
        UUID: Client Characteristic Configuration (0x2902)
        Handle: 0x0114
        UUID: Characteristic (0x2803)
        Handle: 0x0115
        UUID: Bearer UCI (0x2bb4)
        Handle: 0x0116
        UUID: Characteristic (0x2803)
< HCI Command: Host Number of Comp.. (0x03|0x0035) plen 5  #117 [hci1] 9.340390
        Num handles: 1
        Handle: 1515 Address: DF:A9:FF:F6:B1:1A (OUI DF-A9-FF)
        Count: 1
< ACL Data TX: Handle 1515 flags 0x00 dlen 9               #118 [hci1] 9.340434
      ATT: Find Information Request (0x04) len 4
        Handle range: 0x0117-0x013c
> HCI Event: Number of Completed Packets (0x13) plen 5     #119 [hci1] 9.514026
        Num handles: 1
        Handle: 1515 Address: DF:A9:FF:F6:B1:1A (OUI DF-A9-FF)
        Count: 1
        #118: len 9 (0 Kb/s)
        Latency: 173 msec (72-173 msec ~166 msec)
> ACL Data RX: Handle 1515 flags 0x02 dlen 26              #120 [hci1] 9.514391
      ATT: Find Information Response (0x05) len 21
        Format: UUID-16 (0x01)
        Handle: 0x0117
        UUID: Bearer Technology (0x2bb5)
        Handle: 0x0118
        UUID: Client Characteristic Configuration (0x2902)
        Handle: 0x0119
        UUID: Characteristic (0x2803)
        Handle: 0x011a
        UUID: Bearer URI Schemes Supported List (0x2bb6)
        Handle: 0x011b
        UUID: Client Characteristic Configuration (0x2902)
< HCI Command: Host Number of Comp.. (0x03|0x0035) plen 5  #121 [hci1] 9.520522
        Num handles: 1
        Handle: 1515 Address: DF:A9:FF:F6:B1:1A (OUI DF-A9-FF)
        Count: 1
< ACL Data TX: Handle 1515 flags 0x00 dlen 11              #122 [hci1] 9.520540
      ATT: Read By Type Request (0x08) len 6
        Handle range: 0x0117-0x013c
        Attribute type: Characteristic (0x2803)
> HCI Event: Number of Completed Packets (0x13) plen 5     #123 [hci1] 9.689077
        Num handles: 1
        Handle: 1515 Address: DF:A9:FF:F6:B1:1A (OUI DF-A9-FF)
        Count: 1
        #122: len 11 (0 Kb/s)
        Latency: 168 msec (72-173 msec ~167 msec)
> ACL Data RX: Handle 1515 flags 0x02 dlen 27              #124 [hci1] 9.689451
      ATT: Read By Type Response (0x09) len 22
        Attribute data length: 7
        Attribute data list: 3 entries
        Handle: 0x0119
        Value: 121a01b62b
            Properties: 0x12
              Read (0x02)
              Notify (0x10)
            Value Handle: 0x011a
            Value UUID: Bearer URI Schemes Supported List (0x2bb6)
        Handle: 0x011c
        Value: 121d01b72b
            Properties: 0x12
              Read (0x02)
              Notify (0x10)
            Value Handle: 0x011d
            Value UUID: Bearer Signal Strength (0x2bb7)
        Handle: 0x011f
        Value: 0e2001b82b
            Properties: 0x0e
              Read (0x02)
              Write Without Response (0x04)
              Write (0x08)
            Value Handle: 0x0120
            Value UUID: Bearer Signal Strength Reporting Interval (0x2bb8)
< HCI Command: Host Number of Comp.. (0x03|0x0035) plen 5  #125 [hci1] 9.701031
        Num handles: 1
        Handle: 1515 Address: DF:A9:FF:F6:B1:1A (OUI DF-A9-FF)
        Count: 1
< ACL Data TX: Handle 1515 flags 0x00 dlen 9               #126 [hci1] 9.701146
      ATT: Write Request (0x12) len 4
        Handle: 0x0113
          Data: 0100
> HCI Event: Number of Completed Packets (0x13) plen 5     #127 [hci1] 9.863903
        Num handles: 1
        Handle: 1515 Address: DF:A9:FF:F6:B1:1A (OUI DF-A9-FF)
        Count: 1
        #126: len 9 (0 Kb/s)
        Latency: 162 msec (72-173 msec ~165 msec)
> ACL Data RX: Handle 1515 flags 0x02 dlen 5               #128 [hci1] 9.864034
      ATT: Write Response (0x13) len 0
< HCI Command: Host Number of Comp.. (0x03|0x0035) plen 5  #129 [hci1] 9.880596
        Num handles: 1
        Handle: 1515 Address: DF:A9:FF:F6:B1:1A (OUI DF-A9-FF)
        Count: 1
< ACL Data TX: Handle 1515 flags 0x00 dlen 9               #130 [hci1] 9.880651
      ATT: Write Request (0x12) len 4
        Handle: 0x0118
          Data: 0100
> HCI Event: Number of Completed Packets (0x13) plen 5    #131 [hci1] 10.038951
        Num handles: 1
        Handle: 1515 Address: DF:A9:FF:F6:B1:1A (OUI DF-A9-FF)
        Count: 1
        #130: len 9 (0 Kb/s)
        Latency: 158 msec (72-173 msec ~161 msec)
> ACL Data RX: Handle 1515 flags 0x02 dlen 5              #132 [hci1] 10.039029
      ATT: Write Response (0x13) len 0
< HCI Command: Host Number of Com.. (0x03|0x0035) plen 5  #133 [hci1] 10.040616
        Num handles: 1
        Handle: 1515 Address: DF:A9:FF:F6:B1:1A (OUI DF-A9-FF)
        Count: 1
< ACL Data TX: Handle 1515 flags 0x00 dlen 9              #134 [hci1] 10.040670
      ATT: Find Information Request (0x04) len 4
        Handle range: 0x011d-0x013c
> HCI Event: Number of Completed Packets (0x13) plen 5    #135 [hci1] 10.214040
        Num handles: 1
        Handle: 1515 Address: DF:A9:FF:F6:B1:1A (OUI DF-A9-FF)
        Count: 1
        #134: len 9 (0 Kb/s)
        Latency: 173 msec (72-173 msec ~167 msec)
> ACL Data RX: Handle 1515 flags 0x02 dlen 26             #136 [hci1] 10.214445
      ATT: Find Information Response (0x05) len 21
        Format: UUID-16 (0x01)
        Handle: 0x011d
        UUID: Bearer Signal Strength (0x2bb7)
        Handle: 0x011e
        UUID: Client Characteristic Configuration (0x2902)
        Handle: 0x011f
        UUID: Characteristic (0x2803)
        Handle: 0x0120
        UUID: Bearer Signal Strength Reporting Interval (0x2bb8)
        Handle: 0x0121
        UUID: Characteristic (0x2803)
< HCI Command: Host Number of Com.. (0x03|0x0035) plen 5  #137 [hci1] 10.220636
        Num handles: 1
        Handle: 1515 Address: DF:A9:FF:F6:B1:1A (OUI DF-A9-FF)
        Count: 1
< ACL Data TX: Handle 1515 flags 0x00 dlen 11             #138 [hci1] 10.220686
      ATT: Read By Type Request (0x08) len 6
        Handle range: 0x0120-0x013c
        Attribute type: Characteristic (0x2803)
> HCI Event: Number of Completed Packets (0x13) plen 5    #139 [hci1] 10.389050
        Num handles: 1
        Handle: 1515 Address: DF:A9:FF:F6:B1:1A (OUI DF-A9-FF)
        Count: 1
        #138: len 11 (0 Kb/s)
        Latency: 168 msec (72-173 msec ~167 msec)
> ACL Data RX: Handle 1515 flags 0x02 dlen 27             #140 [hci1] 10.389453
      ATT: Read By Type Response (0x09) len 22
        Attribute data length: 7
        Attribute data list: 3 entries
        Handle: 0x0121
        Value: 122201b92b
            Properties: 0x12
              Read (0x02)
              Notify (0x10)
            Value Handle: 0x0122
            Value UUID: Bearer List Current Calls (0x2bb9)
        Handle: 0x0124
        Value: 022501ba2b
            Properties: 0x02
              Read (0x02)
            Value Handle: 0x0125
            Value UUID: Content Control ID (0x2bba)
        Handle: 0x0126
        Value: 122701bc2b
            Properties: 0x12
              Read (0x02)
              Notify (0x10)
            Value Handle: 0x0127
            Value UUID: Incoming Call Target Bearer URI (0x2bbc)
< HCI Command: Host Number of Com.. (0x03|0x0035) plen 5  #141 [hci1] 10.400988
        Num handles: 1
        Handle: 1515 Address: DF:A9:FF:F6:B1:1A (OUI DF-A9-FF)
        Count: 1
< ACL Data TX: Handle 1515 flags 0x00 dlen 9              #142 [hci1] 10.401084
      ATT: Write Request (0x12) len 4
        Handle: 0x011e
          Data: 0100
> HCI Event: Number of Completed Packets (0x13) plen 5    #143 [hci1] 10.563972
        Num handles: 1
        Handle: 1515 Address: DF:A9:FF:F6:B1:1A (OUI DF-A9-FF)
        Count: 1
        #142: len 9 (0 Kb/s)
        Latency: 162 msec (72-173 msec ~165 msec)
> ACL Data RX: Handle 1515 flags 0x02 dlen 5              #144 [hci1] 10.563992
      ATT: Write Response (0x13) len 0
< HCI Command: Host Number of Com.. (0x03|0x0035) plen 5  #145 [hci1] 10.580544
        Num handles: 1
        Handle: 1515 Address: DF:A9:FF:F6:B1:1A (OUI DF-A9-FF)
        Count: 1
< ACL Data TX: Handle 1515 flags 0x00 dlen 9              #146 [hci1] 10.580592
      ATT: Find Information Request (0x04) len 4
        Handle range: 0x0122-0x013c
> HCI Event: Number of Completed Packets (0x13) plen 5    #147 [hci1] 10.739024
        Num handles: 1
        Handle: 1515 Address: DF:A9:FF:F6:B1:1A (OUI DF-A9-FF)
        Count: 1
        #146: len 9 (0 Kb/s)
        Latency: 158 msec (72-173 msec ~161 msec)
> ACL Data RX: Handle 1515 flags 0x02 dlen 26             #148 [hci1] 10.739426
      ATT: Find Information Response (0x05) len 21
        Format: UUID-16 (0x01)
        Handle: 0x0122
        UUID: Bearer List Current Calls (0x2bb9)
        Handle: 0x0123
        UUID: Client Characteristic Configuration (0x2902)
        Handle: 0x0124
        UUID: Characteristic (0x2803)
        Handle: 0x0125
        UUID: Content Control ID (0x2bba)
        Handle: 0x0126
        UUID: Characteristic (0x2803)
< HCI Command: Host Number of Com.. (0x03|0x0035) plen 5  #149 [hci1] 10.740264
        Num handles: 1
        Handle: 1515 Address: DF:A9:FF:F6:B1:1A (OUI DF-A9-FF)
        Count: 1
< ACL Data TX: Handle 1515 flags 0x00 dlen 9              #150 [hci1] 10.740318
      ATT: Find Information Request (0x04) len 4
        Handle range: 0x0127-0x013c
> HCI Event: Number of Completed Packets (0x13) plen 5    #151 [hci1] 10.914030
        Num handles: 1
        Handle: 1515 Address: DF:A9:FF:F6:B1:1A (OUI DF-A9-FF)
        Count: 1
        #150: len 9 (0 Kb/s)
        Latency: 173 msec (72-173 msec ~167 msec)
> ACL Data RX: Handle 1515 flags 0x02 dlen 26             #152 [hci1] 10.914424
      ATT: Find Information Response (0x05) len 21
        Format: UUID-16 (0x01)
        Handle: 0x0127
        UUID: Incoming Call Target Bearer URI (0x2bbc)
        Handle: 0x0128
        UUID: Client Characteristic Configuration (0x2902)
        Handle: 0x0129
        UUID: Characteristic (0x2803)
        Handle: 0x012a
        UUID: Status Flags (0x2bbb)
        Handle: 0x012b
        UUID: Client Characteristic Configuration (0x2902)
< HCI Command: Host Number of Com.. (0x03|0x0035) plen 5  #153 [hci1] 10.920598
        Num handles: 1
        Handle: 1515 Address: DF:A9:FF:F6:B1:1A (OUI DF-A9-FF)
        Count: 1
< ACL Data TX: Handle 1515 flags 0x00 dlen 11             #154 [hci1] 10.920660
      ATT: Read By Type Request (0x08) len 6
        Handle range: 0x0127-0x013c
        Attribute type: Characteristic (0x2803)
> HCI Event: Number of Completed Packets (0x13) plen 5    #155 [hci1] 11.089079
        Num handles: 1
        Handle: 1515 Address: DF:A9:FF:F6:B1:1A (OUI DF-A9-FF)
        Count: 1
        #154: len 11 (0 Kb/s)
        Latency: 168 msec (72-173 msec ~168 msec)
> ACL Data RX: Handle 1515 flags 0x02 dlen 27             #156 [hci1] 11.089415
      ATT: Read By Type Response (0x09) len 22
        Attribute data length: 7
        Attribute data list: 3 entries
        Handle: 0x0129
        Value: 122a01bb2b
            Properties: 0x12
              Read (0x02)
              Notify (0x10)
            Value Handle: 0x012a
            Value UUID: Status Flags (0x2bbb)
        Handle: 0x012c
        Value: 122d01bd2b
            Properties: 0x12
              Read (0x02)
              Notify (0x10)
            Value Handle: 0x012d
            Value UUID: Call State (0x2bbd)
        Handle: 0x012f
        Value: 1c3001be2b
            Properties: 0x1c
              Write Without Response (0x04)
              Write (0x08)
              Notify (0x10)
            Value Handle: 0x0130
            Value UUID: Call Control Point (0x2bbe)
< HCI Command: Host Number of Com.. (0x03|0x0035) plen 5  #157 [hci1] 11.100637
        Num handles: 1
        Handle: 1515 Address: DF:A9:FF:F6:B1:1A (OUI DF-A9-FF)
        Count: 1
< ACL Data TX: Handle 1515 flags 0x00 dlen 9              #158 [hci1] 11.100716
      ATT: Write Request (0x12) len 4
        Handle: 0x0123
          Data: 0100
> HCI Event: Number of Completed Packets (0x13) plen 5    #159 [hci1] 11.263868
        Num handles: 1
        Handle: 1515 Address: DF:A9:FF:F6:B1:1A (OUI DF-A9-FF)
        Count: 1
        #158: len 9 (0 Kb/s)
        Latency: 163 msec (72-173 msec ~165 msec)
> ACL Data RX: Handle 1515 flags 0x02 dlen 5              #160 [hci1] 11.264018
      ATT: Write Response (0x13) len 0
< HCI Command: Host Number of Com.. (0x03|0x0035) plen 5  #161 [hci1] 11.280450
        Num handles: 1
        Handle: 1515 Address: DF:A9:FF:F6:B1:1A (OUI DF-A9-FF)
        Count: 1
< ACL Data TX: Handle 1515 flags 0x00 dlen 9              #162 [hci1] 11.280458
      ATT: Write Request (0x12) len 4
        Handle: 0x0128
          Data: 0100
> HCI Event: Number of Completed Packets (0x13) plen 5    #163 [hci1] 11.438873
        Num handles: 1
        Handle: 1515 Address: DF:A9:FF:F6:B1:1A (OUI DF-A9-FF)
        Count: 1
        #162: len 9 (0 Kb/s)
        Latency: 158 msec (72-173 msec ~162 msec)
> ACL Data RX: Handle 1515 flags 0x02 dlen 5              #164 [hci1] 11.439009
      ATT: Write Response (0x13) len 0
< HCI Command: Host Number of Com.. (0x03|0x0035) plen 5  #165 [hci1] 11.440938
        Num handles: 1
        Handle: 1515 Address: DF:A9:FF:F6:B1:1A (OUI DF-A9-FF)
        Count: 1
< ACL Data TX: Handle 1515 flags 0x00 dlen 9              #166 [hci1] 11.440965
      ATT: Find Information Request (0x04) len 4
        Handle range: 0x012a-0x013c
> HCI Event: Number of Completed Packets (0x13) plen 5    #167 [hci1] 11.614074
        Num handles: 1
        Handle: 1515 Address: DF:A9:FF:F6:B1:1A (OUI DF-A9-FF)
        Count: 1
        #166: len 9 (0 Kb/s)
        Latency: 173 msec (72-173 msec ~167 msec)
> ACL Data RX: Handle 1515 flags 0x02 dlen 26             #168 [hci1] 11.614409
      ATT: Find Information Response (0x05) len 21
        Format: UUID-16 (0x01)
        Handle: 0x012a
        UUID: Status Flags (0x2bbb)
        Handle: 0x012b
        UUID: Client Characteristic Configuration (0x2902)
        Handle: 0x012c
        UUID: Characteristic (0x2803)
        Handle: 0x012d
        UUID: Call State (0x2bbd)
        Handle: 0x012e
        UUID: Client Characteristic Configuration (0x2902)
< HCI Command: Host Number of Com.. (0x03|0x0035) plen 5  #169 [hci1] 11.620579
        Num handles: 1
        Handle: 1515 Address: DF:A9:FF:F6:B1:1A (OUI DF-A9-FF)
        Count: 1
< ACL Data TX: Handle 1515 flags 0x00 dlen 9              #170 [hci1] 11.620631
      ATT: Find Information Request (0x04) len 4
        Handle range: 0x012d-0x013c
> HCI Event: Number of Completed Packets (0x13) plen 5    #171 [hci1] 11.789011
        Num handles: 1
        Handle: 1515 Address: DF:A9:FF:F6:B1:1A (OUI DF-A9-FF)
        Count: 1
        #170: len 9 (0 Kb/s)
        Latency: 168 msec (72-173 msec ~167 msec)
> ACL Data RX: Handle 1515 flags 0x02 dlen 26             #172 [hci1] 11.789380
      ATT: Find Information Response (0x05) len 21
        Format: UUID-16 (0x01)
        Handle: 0x012d
        UUID: Call State (0x2bbd)
        Handle: 0x012e
        UUID: Client Characteristic Configuration (0x2902)
        Handle: 0x012f
        UUID: Characteristic (0x2803)
        Handle: 0x0130
        UUID: Call Control Point (0x2bbe)
        Handle: 0x0131
        UUID: Client Characteristic Configuration (0x2902)
< HCI Command: Host Number of Com.. (0x03|0x0035) plen 5  #173 [hci1] 11.800444
        Num handles: 1
        Handle: 1515 Address: DF:A9:FF:F6:B1:1A (OUI DF-A9-FF)
        Count: 1
< ACL Data TX: Handle 1515 flags 0x00 dlen 9              #174 [hci1] 11.800469
      ATT: Find Information Request (0x04) len 4
        Handle range: 0x0130-0x013c
> HCI Event: Number of Completed Packets (0x13) plen 5    #175 [hci1] 11.964006
        Num handles: 1
        Handle: 1515 Address: DF:A9:FF:F6:B1:1A (OUI DF-A9-FF)
        Count: 1
        #174: len 9 (0 Kb/s)
        Latency: 163 msec (72-173 msec ~165 msec)
> ACL Data RX: Handle 1515 flags 0x02 dlen 26             #176 [hci1] 11.964456
      ATT: Find Information Response (0x05) len 21
        Format: UUID-16 (0x01)
        Handle: 0x0130
        UUID: Call Control Point (0x2bbe)
        Handle: 0x0131
        UUID: Client Characteristic Configuration (0x2902)
        Handle: 0x0132
        UUID: Characteristic (0x2803)
        Handle: 0x0133
        UUID: Termination Reason (0x2bc0)
        Handle: 0x0134
        UUID: Client Characteristic Configuration (0x2902)
< HCI Command: Host Number of Com.. (0x03|0x0035) plen 5  #177 [hci1] 11.980559
        Num handles: 1
        Handle: 1515 Address: DF:A9:FF:F6:B1:1A (OUI DF-A9-FF)
        Count: 1
< ACL Data TX: Handle 1515 flags 0x00 dlen 11             #178 [hci1] 11.980639
      ATT: Read By Type Request (0x08) len 6
        Handle range: 0x0130-0x013c
        Attribute type: Characteristic (0x2803)
> HCI Event: Number of Completed Packets (0x13) plen 5    #179 [hci1] 12.139204
        Num handles: 1
        Handle: 1515 Address: DF:A9:FF:F6:B1:1A (OUI DF-A9-FF)
        Count: 1
        #178: len 11 (0 Kb/s)
        Latency: 158 msec (72-173 msec ~162 msec)
> ACL Data RX: Handle 1515 flags 0x02 dlen 27             #180 [hci1] 12.139410
      ATT: Read By Type Response (0x09) len 22
        Attribute data length: 7
        Attribute data list: 3 entries
        Handle: 0x0132
        Value: 103301c02b
            Properties: 0x10
              Notify (0x10)
            Value Handle: 0x0133
            Value UUID: Termination Reason (0x2bc0)
        Handle: 0x0135
        Value: 123601c12b
            Properties: 0x12
              Read (0x02)
              Notify (0x10)
            Value Handle: 0x0136
            Value UUID: Incoming Call (0x2bc1)
        Handle: 0x0138
        Value: 123901c22b
            Properties: 0x12
              Read (0x02)
              Notify (0x10)
            Value Handle: 0x0139
            Value UUID: Call Friendly Name (0x2bc2)
< HCI Command: Host Number of Com.. (0x03|0x0035) plen 5  #181 [hci1] 12.140489
        Num handles: 1
        Handle: 1515 Address: DF:A9:FF:F6:B1:1A (OUI DF-A9-FF)
        Count: 1
< ACL Data TX: Handle 1515 flags 0x00 dlen 9              #182 [hci1] 12.140510
      ATT: Write Request (0x12) len 4
        Handle: 0x012b
          Data: 0100
> HCI Event: Number of Completed Packets (0x13) plen 5    #183 [hci1] 12.314002
        Num handles: 1
        Handle: 1515 Address: DF:A9:FF:F6:B1:1A (OUI DF-A9-FF)
        Count: 1
        #182: len 9 (0 Kb/s)
        Latency: 173 msec (72-173 msec ~167 msec)
> ACL Data RX: Handle 1515 flags 0x02 dlen 5              #184 [hci1] 12.314040
      ATT: Write Response (0x13) len 0
< HCI Command: Host Number of Com.. (0x03|0x0035) plen 5  #185 [hci1] 12.320959
        Num handles: 1
        Handle: 1515 Address: DF:A9:FF:F6:B1:1A (OUI DF-A9-FF)
        Count: 1
< ACL Data TX: Handle 1515 flags 0x00 dlen 9              #186 [hci1] 12.321054
      ATT: Write Request (0x12) len 4
        Handle: 0x012e
          Data: 0100
> HCI Event: Number of Completed Packets (0x13) plen 5    #187 [hci1] 12.488846
        Num handles: 1
        Handle: 1515 Address: DF:A9:FF:F6:B1:1A (OUI DF-A9-FF)
        Count: 1
        #186: len 9 (0 Kb/s)
        Latency: 167 msec (72-173 msec ~167 msec)
> ACL Data RX: Handle 1515 flags 0x02 dlen 5              #188 [hci1] 12.488967
      ATT: Write Response (0x13) len 0
< HCI Command: Host Number of Com.. (0x03|0x0035) plen 5  #189 [hci1] 12.500509
        Num handles: 1
        Handle: 1515 Address: DF:A9:FF:F6:B1:1A (OUI DF-A9-FF)
        Count: 1
< ACL Data TX: Handle 1515 flags 0x00 dlen 9              #190 [hci1] 12.500547
      ATT: Write Request (0x12) len 4
        Handle: 0x0131
          Data: 0100
> HCI Event: Number of Completed Packets (0x13) plen 5    #191 [hci1] 12.663895
        Num handles: 1
        Handle: 1515 Address: DF:A9:FF:F6:B1:1A (OUI DF-A9-FF)
        Count: 1
        #190: len 9 (0 Kb/s)
        Latency: 163 msec (72-173 msec ~165 msec)
> ACL Data RX: Handle 1515 flags 0x02 dlen 5              #192 [hci1] 12.664045
      ATT: Write Response (0x13) len 0
< HCI Command: Host Number of Com.. (0x03|0x0035) plen 5  #193 [hci1] 12.680514
        Num handles: 1
        Handle: 1515 Address: DF:A9:FF:F6:B1:1A (OUI DF-A9-FF)
        Count: 1
< ACL Data TX: Handle 1515 flags 0x00 dlen 9              #194 [hci1] 12.680598
      ATT: Find Information Request (0x04) len 4
        Handle range: 0x0133-0x013c
> HCI Event: Number of Completed Packets (0x13) plen 5    #195 [hci1] 12.839064
        Num handles: 1
        Handle: 1515 Address: DF:A9:FF:F6:B1:1A (OUI DF-A9-FF)
        Count: 1
        #194: len 9 (0 Kb/s)
        Latency: 158 msec (72-173 msec ~162 msec)
> ACL Data RX: Handle 1515 flags 0x02 dlen 26             #196 [hci1] 12.839348
      ATT: Find Information Response (0x05) len 21
        Format: UUID-16 (0x01)
        Handle: 0x0133
        UUID: Termination Reason (0x2bc0)
        Handle: 0x0134
        UUID: Client Characteristic Configuration (0x2902)
        Handle: 0x0135
        UUID: Characteristic (0x2803)
        Handle: 0x0136
        UUID: Incoming Call (0x2bc1)
        Handle: 0x0137
        UUID: Client Characteristic Configuration (0x2902)
< HCI Command: Host Number of Com.. (0x03|0x0035) plen 5  #197 [hci1] 12.840372
        Num handles: 1
        Handle: 1515 Address: DF:A9:FF:F6:B1:1A (OUI DF-A9-FF)
        Count: 1
< ACL Data TX: Handle 1515 flags 0x00 dlen 9              #198 [hci1] 12.840397
      ATT: Find Information Request (0x04) len 4
        Handle range: 0x0136-0x013c
> HCI Event: Number of Completed Packets (0x13) plen 5    #199 [hci1] 13.014001
        Num handles: 1
        Handle: 1515 Address: DF:A9:FF:F6:B1:1A (OUI DF-A9-FF)
        Count: 1
        #198: len 9 (0 Kb/s)
        Latency: 173 msec (72-173 msec ~167 msec)
> ACL Data RX: Handle 1515 flags 0x02 dlen 26             #200 [hci1] 13.014481
      ATT: Find Information Response (0x05) len 21
        Format: UUID-16 (0x01)
        Handle: 0x0136
        UUID: Incoming Call (0x2bc1)
        Handle: 0x0137
        UUID: Client Characteristic Configuration (0x2902)
        Handle: 0x0138
        UUID: Characteristic (0x2803)
        Handle: 0x0139
        UUID: Call Friendly Name (0x2bc2)
        Handle: 0x013a
        UUID: Client Characteristic Configuration (0x2902)
< HCI Command: Host Number of Com.. (0x03|0x0035) plen 5  #201 [hci1] 13.020579
        Num handles: 1
        Handle: 1515 Address: DF:A9:FF:F6:B1:1A (OUI DF-A9-FF)
        Count: 1
< ACL Data TX: Handle 1515 flags 0x00 dlen 9              #202 [hci1] 13.020614
      ATT: Find Information Request (0x04) len 4
        Handle range: 0x0139-0x013c
> HCI Event: Number of Completed Packets (0x13) plen 5    #203 [hci1] 13.188981
        Num handles: 1
        Handle: 1515 Address: DF:A9:FF:F6:B1:1A (OUI DF-A9-FF)
        Count: 1
        #202: len 9 (0 Kb/s)
        Latency: 168 msec (72-173 msec ~168 msec)
> ACL Data RX: Handle 1515 flags 0x02 dlen 22             #204 [hci1] 13.189477
      ATT: Find Information Response (0x05) len 17
        Format: UUID-16 (0x01)
        Handle: 0x0139
        UUID: Call Friendly Name (0x2bc2)
        Handle: 0x013a
        UUID: Client Characteristic Configuration (0x2902)
        Handle: 0x013b
        UUID: Characteristic (0x2803)
        Handle: 0x013c
        UUID: Call Control Point Optional Opcodes (0x2bbf)
< HCI Command: Host Number of Com.. (0x03|0x0035) plen 5  #205 [hci1] 13.200592
        Num handles: 1
        Handle: 1515 Address: DF:A9:FF:F6:B1:1A (OUI DF-A9-FF)
        Count: 1
< ACL Data TX: Handle 1515 flags 0x00 dlen 11             #206 [hci1] 13.200637
      ATT: Read By Type Request (0x08) len 6
        Handle range: 0x0139-0x013c
        Attribute type: Characteristic (0x2803)
> HCI Event: Number of Completed Packets (0x13) plen 5    #207 [hci1] 13.363931
        Num handles: 1
        Handle: 1515 Address: DF:A9:FF:F6:B1:1A (OUI DF-A9-FF)
        Count: 1
        #206: len 11 (0 Kb/s)
        Latency: 163 msec (72-173 msec ~165 msec)
> ACL Data RX: Handle 1515 flags 0x02 dlen 13             #208 [hci1] 13.364174
      ATT: Read By Type Response (0x09) len 8
        Attribute data length: 7
        Attribute data list: 1 entry
        Handle: 0x013b
        Value: 023c01bf2b
            Properties: 0x02
              Read (0x02)
            Value Handle: 0x013c
            Value UUID: Call Control Point Optional Opcodes (0x2bbf)
< HCI Command: Host Number of Com.. (0x03|0x0035) plen 5  #209 [hci1] 13.380630
        Num handles: 1
        Handle: 1515 Address: DF:A9:FF:F6:B1:1A (OUI DF-A9-FF)
        Count: 1
< ACL Data TX: Handle 1515 flags 0x00 dlen 9              #210 [hci1] 13.380683
      ATT: Write Request (0x12) len 4
        Handle: 0x0134
          Data: 0100
> HCI Event: Number of Completed Packets (0x13) plen 5    #211 [hci1] 13.538872
        Num handles: 1
        Handle: 1515 Address: DF:A9:FF:F6:B1:1A (OUI DF-A9-FF)
        Count: 1
        #210: len 9 (0 Kb/s)
        Latency: 158 msec (72-173 msec ~161 msec)
> ACL Data RX: Handle 1515 flags 0x02 dlen 5              #212 [hci1] 13.539008
      ATT: Write Response (0x13) len 0
< HCI Command: Host Number of Com.. (0x03|0x0035) plen 5  #213 [hci1] 13.540616
        Num handles: 1
        Handle: 1515 Address: DF:A9:FF:F6:B1:1A (OUI DF-A9-FF)
        Count: 1
< ACL Data TX: Handle 1515 flags 0x00 dlen 9              #214 [hci1] 13.540667
      ATT: Write Request (0x12) len 4
        Handle: 0x0137
          Data: 0100
> HCI Event: Number of Completed Packets (0x13) plen 5    #215 [hci1] 13.713871
        Num handles: 1
        Handle: 1515 Address: DF:A9:FF:F6:B1:1A (OUI DF-A9-FF)
        Count: 1
        #214: len 9 (0 Kb/s)
        Latency: 173 msec (72-173 msec ~167 msec)
> ACL Data RX: Handle 1515 flags 0x02 dlen 5              #216 [hci1] 13.714014
      ATT: Write Response (0x13) len 0
< HCI Command: Host Number of Com.. (0x03|0x0035) plen 5  #217 [hci1] 13.720497
        Num handles: 1
        Handle: 1515 Address: DF:A9:FF:F6:B1:1A (OUI DF-A9-FF)
        Count: 1
< ACL Data TX: Handle 1515 flags 0x00 dlen 9              #218 [hci1] 13.720571
      ATT: Write Request (0x12) len 4
        Handle: 0x013a
          Data: 0100
> HCI Event: Number of Completed Packets (0x13) plen 5    #219 [hci1] 13.888908
        Num handles: 1
        Handle: 1515 Address: DF:A9:FF:F6:B1:1A (OUI DF-A9-FF)
        Count: 1
        #218: len 9 (0 Kb/s)
        Latency: 168 msec (72-173 msec ~167 msec)
> ACL Data RX: Handle 1515 flags 0x02 dlen 5              #220 [hci1] 13.888989
      ATT: Write Response (0x13) len 0
< HCI Command: Host Number of Com.. (0x03|0x0035) plen 5  #221 [hci1] 13.900554
        Num handles: 1
        Handle: 1515 Address: DF:A9:FF:F6:B1:1A (OUI DF-A9-FF)
        Count: 1
< ACL Data TX: Handle 1515 flags 0x00 dlen 11             #222 [hci1] 13.900622
      ATT: Read By Type Request (0x08) len 6
        Handle range: 0x013c-0x013c
        Attribute type: Characteristic (0x2803)
> HCI Event: Number of Completed Packets (0x13) plen 5    #223 [hci1] 14.063966
        Num handles: 1
        Handle: 1515 Address: DF:A9:FF:F6:B1:1A (OUI DF-A9-FF)
        Count: 1
        #222: len 11 (0 Kb/s)
        Latency: 163 msec (72-173 msec ~165 msec)
> ACL Data RX: Handle 1515 flags 0x02 dlen 9              #224 [hci1] 14.064035
      ATT: Error Response (0x01) len 4
        Read By Type Request (0x08)
        Handle: 0x013c
        Error: Attribute Not Found (0x0a)
< HCI Command: Host Number of Com.. (0x03|0x0035) plen 5  #225 [hci1] 14.080576
        Num handles: 1
        Handle: 1515 Address: DF:A9:FF:F6:B1:1A (OUI DF-A9-FF)
        Count: 1
< ACL Data TX: Handle 1515 flags 0x00 dlen 7              #226 [hci1] 14.080644
      ATT: Read Request (0x0a) len 2
        Handle: 0x0125
> HCI Event: Number of Completed Packets (0x13) plen 5    #227 [hci1] 14.239000
        Num handles: 1
        Handle: 1515 Address: DF:A9:FF:F6:B1:1A (OUI DF-A9-FF)
        Count: 1
        #226: len 7 (0 Kb/s)
        Latency: 158 msec (72-173 msec ~162 msec)
> ACL Data RX: Handle 1515 flags 0x02 dlen 6              #228 [hci1] 14.239009
      ATT: Read Response (0x0b) len 1
< HCI Command: Host Number of Com.. (0x03|0x0035) plen 5  #229 [hci1] 14.241026
        Num handles: 1
        Handle: 1515 Address: DF:A9:FF:F6:B1:1A (OUI DF-A9-FF)
        Count: 1
< ACL Data TX: Handle 1515 flags 0x00 dlen 11             #230 [hci1] 14.241132
      ATT: Read By Type Request (0x08) len 6
        Handle range: 0x00d1-0x00fc
        Attribute type: Characteristic (0x2803)
> HCI Event: Number of Completed Packets (0x13) plen 5    #231 [hci1] 14.414055
        Num handles: 1
        Handle: 1515 Address: DF:A9:FF:F6:B1:1A (OUI DF-A9-FF)
        Count: 1
        #230: len 11 (0 Kb/s)
        Latency: 172 msec (72-173 msec ~167 msec)
> ACL Data RX: Handle 1515 flags 0x02 dlen 27             #232 [hci1] 14.414378
      ATT: Read By Type Response (0x09) len 22
        Attribute data length: 7
        Attribute data list: 3 entries
        Handle: 0x00d1
        Value: 12d200b32b
            Properties: 0x12
              Read (0x02)
              Notify (0x10)
            Value Handle: 0x00d2
            Value UUID: Bearer Provider Name (0x2bb3)
        Handle: 0x00d4
        Value: 02d500b42b
            Properties: 0x02
              Read (0x02)
            Value Handle: 0x00d5
            Value UUID: Bearer UCI (0x2bb4)
        Handle: 0x00d6
        Value: 12d700b52b
            Properties: 0x12
              Read (0x02)
              Notify (0x10)
            Value Handle: 0x00d7
            Value UUID: Bearer Technology (0x2bb5)
< HCI Command: Host Number of Com.. (0x03|0x0035) plen 5  #233 [hci1] 14.421036
        Num handles: 1
        Handle: 1515 Address: DF:A9:FF:F6:B1:1A (OUI DF-A9-FF)
        Count: 1
< ACL Data TX: Handle 1515 flags 0x00 dlen 9              #234 [hci1] 14.421158
      ATT: Find Information Request (0x04) len 4
        Handle range: 0x00d2-0x00fc
> HCI Event: Number of Completed Packets (0x13) plen 5    #235 [hci1] 14.589048
        Num handles: 1
        Handle: 1515 Address: DF:A9:FF:F6:B1:1A (OUI DF-A9-FF)
        Count: 1
        #234: len 9 (0 Kb/s)
        Latency: 167 msec (72-173 msec ~167 msec)
> ACL Data RX: Handle 1515 flags 0x02 dlen 26             #236 [hci1] 14.589452
      ATT: Find Information Response (0x05) len 21
        Format: UUID-16 (0x01)
        Handle: 0x00d2
        UUID: Bearer Provider Name (0x2bb3)
        Handle: 0x00d3
        UUID: Client Characteristic Configuration (0x2902)
        Handle: 0x00d4
        UUID: Characteristic (0x2803)
        Handle: 0x00d5
        UUID: Bearer UCI (0x2bb4)
        Handle: 0x00d6
        UUID: Characteristic (0x2803)
< HCI Command: Host Number of Com.. (0x03|0x0035) plen 5  #237 [hci1] 14.600551
        Num handles: 1
        Handle: 1515 Address: DF:A9:FF:F6:B1:1A (OUI DF-A9-FF)
        Count: 1
< ACL Data TX: Handle 1515 flags 0x00 dlen 9              #238 [hci1] 14.600587
      ATT: Find Information Request (0x04) len 4
        Handle range: 0x00d7-0x00fc
> HCI Event: Number of Completed Packets (0x13) plen 5    #239 [hci1] 14.763989
        Num handles: 1
        Handle: 1515 Address: DF:A9:FF:F6:B1:1A (OUI DF-A9-FF)
        Count: 1
        #238: len 9 (0 Kb/s)
        Latency: 163 msec (72-173 msec ~165 msec)
> ACL Data RX: Handle 1515 flags 0x02 dlen 26             #240 [hci1] 14.764439
      ATT: Find Information Response (0x05) len 21
        Format: UUID-16 (0x01)
        Handle: 0x00d7
        UUID: Bearer Technology (0x2bb5)
        Handle: 0x00d8
        UUID: Client Characteristic Configuration (0x2902)
        Handle: 0x00d9
        UUID: Characteristic (0x2803)
        Handle: 0x00da
        UUID: Bearer URI Schemes Supported List (0x2bb6)
        Handle: 0x00db
        UUID: Client Characteristic Configuration (0x2902)
< HCI Command: Host Number of Com.. (0x03|0x0035) plen 5  #241 [hci1] 14.780903
        Num handles: 1
        Handle: 1515 Address: DF:A9:FF:F6:B1:1A (OUI DF-A9-FF)
        Count: 1
< ACL Data TX: Handle 1515 flags 0x00 dlen 11             #242 [hci1] 14.781007
      ATT: Read By Type Request (0x08) len 6
        Handle range: 0x00d7-0x00fc
        Attribute type: Characteristic (0x2803)
> HCI Event: Number of Completed Packets (0x13) plen 5    #243 [hci1] 14.938990
        Num handles: 1
        Handle: 1515 Address: DF:A9:FF:F6:B1:1A (OUI DF-A9-FF)
        Count: 1
        #242: len 11 (0 Kb/s)
        Latency: 157 msec (72-173 msec ~161 msec)
> ACL Data RX: Handle 1515 flags 0x02 dlen 27             #244 [hci1] 14.939383
      ATT: Read By Type Response (0x09) len 22
        Attribute data length: 7
        Attribute data list: 3 entries
        Handle: 0x00d9
        Value: 12da00b62b
            Properties: 0x12
              Read (0x02)
              Notify (0x10)
            Value Handle: 0x00da
            Value UUID: Bearer URI Schemes Supported List (0x2bb6)
        Handle: 0x00dc
        Value: 12dd00b72b
            Properties: 0x12
              Read (0x02)
              Notify (0x10)
            Value Handle: 0x00dd
            Value UUID: Bearer Signal Strength (0x2bb7)
        Handle: 0x00df
        Value: 0ee000b82b
            Properties: 0x0e
              Read (0x02)
              Write Without Response (0x04)
              Write (0x08)
            Value Handle: 0x00e0
            Value UUID: Bearer Signal Strength Reporting Interval (0x2bb8)
< HCI Command: Host Number of Com.. (0x03|0x0035) plen 5  #245 [hci1] 14.940574
        Num handles: 1
        Handle: 1515 Address: DF:A9:FF:F6:B1:1A (OUI DF-A9-FF)
        Count: 1
< ACL Data TX: Handle 1515 flags 0x00 dlen 9              #246 [hci1] 14.940597
      ATT: Write Request (0x12) len 4
        Handle: 0x00d3
          Data: 0100
> HCI Event: Number of Completed Packets (0x13) plen 5    #247 [hci1] 15.113848
        Num handles: 1
        Handle: 1515 Address: DF:A9:FF:F6:B1:1A (OUI DF-A9-FF)
        Count: 1
        #246: len 9 (0 Kb/s)
        Latency: 173 msec (72-173 msec ~167 msec)
> ACL Data RX: Handle 1515 flags 0x02 dlen 5              #248 [hci1] 15.113915
      ATT: Write Response (0x13) len 0
< HCI Command: Host Number of Com.. (0x03|0x0035) plen 5  #249 [hci1] 15.120582
        Num handles: 1
        Handle: 1515 Address: DF:A9:FF:F6:B1:1A (OUI DF-A9-FF)
        Count: 1
< ACL Data TX: Handle 1515 flags 0x00 dlen 9              #250 [hci1] 15.120613
      ATT: Write Request (0x12) len 4
        Handle: 0x00d8
          Data: 0100
> HCI Event: Number of Completed Packets (0x13) plen 5    #251 [hci1] 15.288739
        Num handles: 1
        Handle: 1515 Address: DF:A9:FF:F6:B1:1A (OUI DF-A9-FF)
        Count: 1
        #250: len 9 (0 Kb/s)
        Latency: 168 msec (72-173 msec ~167 msec)
> ACL Data RX: Handle 1515 flags 0x02 dlen 5              #252 [hci1] 15.288912
      ATT: Write Response (0x13) len 0
< HCI Command: Host Number of Com.. (0x03|0x0035) plen 5  #253 [hci1] 15.301252
        Num handles: 1
        Handle: 1515 Address: DF:A9:FF:F6:B1:1A (OUI DF-A9-FF)
        Count: 1
< ACL Data TX: Handle 1515 flags 0x00 dlen 9              #254 [hci1] 15.301441
      ATT: Find Information Request (0x04) len 4
        Handle range: 0x00dd-0x00fc
> HCI Event: Number of Completed Packets (0x13) plen 5    #255 [hci1] 15.464015
        Num handles: 1
        Handle: 1515 Address: DF:A9:FF:F6:B1:1A (OUI DF-A9-FF)
        Count: 1
        #254: len 9 (0 Kb/s)
        Latency: 162 msec (72-173 msec ~165 msec)
> ACL Data RX: Handle 1515 flags 0x02 dlen 26             #256 [hci1] 15.464418
      ATT: Find Information Response (0x05) len 21
        Format: UUID-16 (0x01)
        Handle: 0x00dd
        UUID: Bearer Signal Strength (0x2bb7)
        Handle: 0x00de
        UUID: Client Characteristic Configuration (0x2902)
        Handle: 0x00df
        UUID: Characteristic (0x2803)
        Handle: 0x00e0
        UUID: Bearer Signal Strength Reporting Interval (0x2bb8)
        Handle: 0x00e1
        UUID: Characteristic (0x2803)
< HCI Command: Host Number of Com.. (0x03|0x0035) plen 5  #257 [hci1] 15.480604
        Num handles: 1
        Handle: 1515 Address: DF:A9:FF:F6:B1:1A (OUI DF-A9-FF)
        Count: 1
< ACL Data TX: Handle 1515 flags 0x00 dlen 11             #258 [hci1] 15.480635
      ATT: Read By Type Request (0x08) len 6
        Handle range: 0x00e0-0x00fc
        Attribute type: Characteristic (0x2803)
> HCI Event: Number of Completed Packets (0x13) plen 5    #259 [hci1] 15.638972
        Num handles: 1
        Handle: 1515 Address: DF:A9:FF:F6:B1:1A (OUI DF-A9-FF)
        Count: 1
        #258: len 11 (0 Kb/s)
        Latency: 158 msec (72-173 msec ~161 msec)
> ACL Data RX: Handle 1515 flags 0x02 dlen 27             #260 [hci1] 15.639365
      ATT: Read By Type Response (0x09) len 22
        Attribute data length: 7
        Attribute data list: 3 entries
        Handle: 0x00e1
        Value: 12e200b92b
            Properties: 0x12
              Read (0x02)
              Notify (0x10)
            Value Handle: 0x00e2
            Value UUID: Bearer List Current Calls (0x2bb9)
        Handle: 0x00e4
        Value: 02e500ba2b
            Properties: 0x02
              Read (0x02)
            Value Handle: 0x00e5
            Value UUID: Content Control ID (0x2bba)
        Handle: 0x00e6
        Value: 12e700bc2b
            Properties: 0x12
              Read (0x02)
              Notify (0x10)
            Value Handle: 0x00e7
            Value UUID: Incoming Call Target Bearer URI (0x2bbc)
< HCI Command: Host Number of Com.. (0x03|0x0035) plen 5  #261 [hci1] 15.640527
        Num handles: 1
        Handle: 1515 Address: DF:A9:FF:F6:B1:1A (OUI DF-A9-FF)
        Count: 1
< ACL Data TX: Handle 1515 flags 0x00 dlen 9              #262 [hci1] 15.640538
      ATT: Write Request (0x12) len 4
        Handle: 0x00de
          Data: 0100
> HCI Event: Number of Completed Packets (0x13) plen 5    #263 [hci1] 15.813849
        Num handles: 1
        Handle: 1515 Address: DF:A9:FF:F6:B1:1A (OUI DF-A9-FF)
        Count: 1
        #262: len 9 (0 Kb/s)
        Latency: 173 msec (72-173 msec ~167 msec)
> ACL Data RX: Handle 1515 flags 0x02 dlen 5              #264 [hci1] 15.813938
      ATT: Write Response (0x13) len 0
< HCI Command: Host Number of Com.. (0x03|0x0035) plen 5  #265 [hci1] 15.820568
        Num handles: 1
        Handle: 1515 Address: DF:A9:FF:F6:B1:1A (OUI DF-A9-FF)
        Count: 1
< ACL Data TX: Handle 1515 flags 0x00 dlen 9              #266 [hci1] 15.820597
      ATT: Find Information Request (0x04) len 4
        Handle range: 0x00e2-0x00fc
> HCI Event: Number of Completed Packets (0x13) plen 5    #267 [hci1] 15.988969
        Num handles: 1
        Handle: 1515 Address: DF:A9:FF:F6:B1:1A (OUI DF-A9-FF)
        Count: 1
        #266: len 9 (0 Kb/s)
        Latency: 168 msec (72-173 msec ~167 msec)
> ACL Data RX: Handle 1515 flags 0x02 dlen 26             #268 [hci1] 15.989303
      ATT: Find Information Response (0x05) len 21
        Format: UUID-16 (0x01)
        Handle: 0x00e2
        UUID: Bearer List Current Calls (0x2bb9)
        Handle: 0x00e3
        UUID: Client Characteristic Configuration (0x2902)
        Handle: 0x00e4
        UUID: Characteristic (0x2803)
        Handle: 0x00e5
        UUID: Content Control ID (0x2bba)
        Handle: 0x00e6
        UUID: Characteristic (0x2803)
< HCI Command: Host Number of Com.. (0x03|0x0035) plen 5  #269 [hci1] 16.000927
        Num handles: 1
        Handle: 1515 Address: DF:A9:FF:F6:B1:1A (OUI DF-A9-FF)
        Count: 1
< ACL Data TX: Handle 1515 flags 0x00 dlen 9              #270 [hci1] 16.001018
      ATT: Find Information Request (0x04) len 4
        Handle range: 0x00e7-0x00fc
> HCI Event: Number of Completed Packets (0x13) plen 5    #271 [hci1] 16.164051
        Num handles: 1
        Handle: 1515 Address: DF:A9:FF:F6:B1:1A (OUI DF-A9-FF)
        Count: 1
        #270: len 9 (0 Kb/s)
        Latency: 163 msec (72-173 msec ~165 msec)
> ACL Data RX: Handle 1515 flags 0x02 dlen 26             #272 [hci1] 16.164340
      ATT: Find Information Response (0x05) len 21
        Format: UUID-16 (0x01)
        Handle: 0x00e7
        UUID: Incoming Call Target Bearer URI (0x2bbc)
        Handle: 0x00e8
        UUID: Client Characteristic Configuration (0x2902)
        Handle: 0x00e9
        UUID: Characteristic (0x2803)
        Handle: 0x00ea
        UUID: Status Flags (0x2bbb)
        Handle: 0x00eb
        UUID: Client Characteristic Configuration (0x2902)
< HCI Command: Host Number of Com.. (0x03|0x0035) plen 5  #273 [hci1] 16.180695
        Num handles: 1
        Handle: 1515 Address: DF:A9:FF:F6:B1:1A (OUI DF-A9-FF)
        Count: 1
< ACL Data TX: Handle 1515 flags 0x00 dlen 11             #274 [hci1] 16.180745
      ATT: Read By Type Request (0x08) len 6
        Handle range: 0x00e7-0x00fc
        Attribute type: Characteristic (0x2803)
> HCI Event: Number of Completed Packets (0x13) plen 5    #275 [hci1] 16.338903
        Num handles: 1
        Handle: 1515 Address: DF:A9:FF:F6:B1:1A (OUI DF-A9-FF)
        Count: 1
        #274: len 11 (0 Kb/s)
        Latency: 158 msec (72-173 msec ~161 msec)
> ACL Data RX: Handle 1515 flags 0x02 dlen 27             #276 [hci1] 16.339390
      ATT: Read By Type Response (0x09) len 22
        Attribute data length: 7
        Attribute data list: 3 entries
        Handle: 0x00e9
        Value: 12ea00bb2b
            Properties: 0x12
              Read (0x02)
              Notify (0x10)
            Value Handle: 0x00ea
            Value UUID: Status Flags (0x2bbb)
        Handle: 0x00ec
        Value: 12ed00bd2b
            Properties: 0x12
              Read (0x02)
              Notify (0x10)
            Value Handle: 0x00ed
            Value UUID: Call State (0x2bbd)
        Handle: 0x00ef
        Value: 1cf000be2b
            Properties: 0x1c
              Write Without Response (0x04)
              Write (0x08)
              Notify (0x10)
            Value Handle: 0x00f0
            Value UUID: Call Control Point (0x2bbe)
< HCI Command: Host Number of Com.. (0x03|0x0035) plen 5  #277 [hci1] 16.340665
        Num handles: 1
        Handle: 1515 Address: DF:A9:FF:F6:B1:1A (OUI DF-A9-FF)
        Count: 1
< ACL Data TX: Handle 1515 flags 0x00 dlen 9              #278 [hci1] 16.340718
      ATT: Write Request (0x12) len 4
        Handle: 0x00e3
          Data: 0100
> HCI Event: Number of Completed Packets (0x13) plen 5    #279 [hci1] 16.513825
        Num handles: 1
        Handle: 1515 Address: DF:A9:FF:F6:B1:1A (OUI DF-A9-FF)
        Count: 1
        #278: len 9 (0 Kb/s)
        Latency: 173 msec (72-173 msec ~167 msec)
> ACL Data RX: Handle 1515 flags 0x02 dlen 5              #280 [hci1] 16.513899
      ATT: Write Response (0x13) len 0
< HCI Command: Host Number of Com.. (0x03|0x0035) plen 5  #281 [hci1] 16.520933
        Num handles: 1
        Handle: 1515 Address: DF:A9:FF:F6:B1:1A (OUI DF-A9-FF)
        Count: 1
< ACL Data TX: Handle 1515 flags 0x00 dlen 9              #282 [hci1] 16.521029
      ATT: Write Request (0x12) len 4
        Handle: 0x00e8
          Data: 0100
> HCI Event: Number of Completed Packets (0x13) plen 5    #283 [hci1] 16.688783
        Num handles: 1
        Handle: 1515 Address: DF:A9:FF:F6:B1:1A (OUI DF-A9-FF)
        Count: 1
        #282: len 9 (0 Kb/s)
        Latency: 167 msec (72-173 msec ~167 msec)
> ACL Data RX: Handle 1515 flags 0x02 dlen 5              #284 [hci1] 16.688972
      ATT: Write Response (0x13) len 0
< HCI Command: Host Number of Com.. (0x03|0x0035) plen 5  #285 [hci1] 16.700791
        Num handles: 1
        Handle: 1515 Address: DF:A9:FF:F6:B1:1A (OUI DF-A9-FF)
        Count: 1
< ACL Data TX: Handle 1515 flags 0x00 dlen 9              #286 [hci1] 16.700909
      ATT: Find Information Request (0x04) len 4
        Handle range: 0x00ea-0x00fc
> HCI Event: Number of Completed Packets (0x13) plen 5    #287 [hci1] 16.863997
        Num handles: 1
        Handle: 1515 Address: DF:A9:FF:F6:B1:1A (OUI DF-A9-FF)
        Count: 1
        #286: len 9 (0 Kb/s)
        Latency: 163 msec (72-173 msec ~165 msec)
> ACL Data RX: Handle 1515 flags 0x02 dlen 26             #288 [hci1] 16.864358
      ATT: Find Information Response (0x05) len 21
        Format: UUID-16 (0x01)
        Handle: 0x00ea
        UUID: Status Flags (0x2bbb)
        Handle: 0x00eb
        UUID: Client Characteristic Configuration (0x2902)
        Handle: 0x00ec
        UUID: Characteristic (0x2803)
        Handle: 0x00ed
        UUID: Call State (0x2bbd)
        Handle: 0x00ee
        UUID: Client Characteristic Configuration (0x2902)
< HCI Command: Host Number of Com.. (0x03|0x0035) plen 5  #289 [hci1] 16.880524
        Num handles: 1
        Handle: 1515 Address: DF:A9:FF:F6:B1:1A (OUI DF-A9-FF)
        Count: 1
< ACL Data TX: Handle 1515 flags 0x00 dlen 9              #290 [hci1] 16.880554
      ATT: Find Information Request (0x04) len 4
        Handle range: 0x00ed-0x00fc
> HCI Event: Number of Completed Packets (0x13) plen 5    #291 [hci1] 17.038948
        Num handles: 1
        Handle: 1515 Address: DF:A9:FF:F6:B1:1A (OUI DF-A9-FF)
        Count: 1
        #290: len 9 (0 Kb/s)
        Latency: 158 msec (72-173 msec ~161 msec)
> ACL Data RX: Handle 1515 flags 0x02 dlen 26             #292 [hci1] 17.039409
      ATT: Find Information Response (0x05) len 21
        Format: UUID-16 (0x01)
        Handle: 0x00ed
        UUID: Call State (0x2bbd)
        Handle: 0x00ee
        UUID: Client Characteristic Configuration (0x2902)
        Handle: 0x00ef
        UUID: Characteristic (0x2803)
        Handle: 0x00f0
        UUID: Call Control Point (0x2bbe)
        Handle: 0x00f1
        UUID: Client Characteristic Configuration (0x2902)
< HCI Command: Host Number of Com.. (0x03|0x0035) plen 5  #293 [hci1] 17.040868
        Num handles: 1
        Handle: 1515 Address: DF:A9:FF:F6:B1:1A (OUI DF-A9-FF)
        Count: 1
< ACL Data TX: Handle 1515 flags 0x00 dlen 9              #294 [hci1] 17.040991
      ATT: Find Information Request (0x04) len 4
        Handle range: 0x00f0-0x00fc
> HCI Event: Number of Completed Packets (0x13) plen 5    #295 [hci1] 17.213991
        Num handles: 1
        Handle: 1515 Address: DF:A9:FF:F6:B1:1A (OUI DF-A9-FF)
        Count: 1
        #294: len 9 (0 Kb/s)
        Latency: 173 msec (72-173 msec ~167 msec)
> ACL Data RX: Handle 1515 flags 0x02 dlen 26             #296 [hci1] 17.214429
      ATT: Find Information Response (0x05) len 21
        Format: UUID-16 (0x01)
        Handle: 0x00f0
        UUID: Call Control Point (0x2bbe)
        Handle: 0x00f1
        UUID: Client Characteristic Configuration (0x2902)
        Handle: 0x00f2
        UUID: Characteristic (0x2803)
        Handle: 0x00f3
        UUID: Termination Reason (0x2bc0)
        Handle: 0x00f4
        UUID: Client Characteristic Configuration (0x2902)
< HCI Command: Host Number of Com.. (0x03|0x0035) plen 5  #297 [hci1] 17.220974
        Num handles: 1
        Handle: 1515 Address: DF:A9:FF:F6:B1:1A (OUI DF-A9-FF)
        Count: 1
< ACL Data TX: Handle 1515 flags 0x00 dlen 11             #298 [hci1] 17.221080
      ATT: Read By Type Request (0x08) len 6
        Handle range: 0x00f0-0x00fc
        Attribute type: Characteristic (0x2803)
> HCI Event: Number of Completed Packets (0x13) plen 5    #299 [hci1] 17.389037
        Num handles: 1
        Handle: 1515 Address: DF:A9:FF:F6:B1:1A (OUI DF-A9-FF)
        Count: 1
        #298: len 11 (0 Kb/s)
        Latency: 167 msec (72-173 msec ~167 msec)
> ACL Data RX: Handle 1515 flags 0x02 dlen 27             #300 [hci1] 17.389355
      ATT: Read By Type Response (0x09) len 22
        Attribute data length: 7
        Attribute data list: 3 entries
        Handle: 0x00f2
        Value: 10f300c02b
            Properties: 0x10
              Notify (0x10)
            Value Handle: 0x00f3
            Value UUID: Termination Reason (0x2bc0)
        Handle: 0x00f5
        Value: 12f600c12b
            Properties: 0x12
              Read (0x02)
              Notify (0x10)
            Value Handle: 0x00f6
            Value UUID: Incoming Call (0x2bc1)
        Handle: 0x00f8
        Value: 12f900c22b
            Properties: 0x12
              Read (0x02)
              Notify (0x10)
            Value Handle: 0x00f9
            Value UUID: Call Friendly Name (0x2bc2)
< HCI Command: Host Number of Com.. (0x03|0x0035) plen 5  #301 [hci1] 17.400548
        Num handles: 1
        Handle: 1515 Address: DF:A9:FF:F6:B1:1A (OUI DF-A9-FF)
        Count: 1
< ACL Data TX: Handle 1515 flags 0x00 dlen 9              #302 [hci1] 17.400581
      ATT: Write Request (0x12) len 4
        Handle: 0x00eb
          Data: 0100
> HCI Event: Number of Completed Packets (0x13) plen 5    #303 [hci1] 17.563780
        Num handles: 1
        Handle: 1515 Address: DF:A9:FF:F6:B1:1A (OUI DF-A9-FF)
        Count: 1
        #302: len 9 (0 Kb/s)
        Latency: 163 msec (72-173 msec ~165 msec)
> ACL Data RX: Handle 1515 flags 0x02 dlen 5              #304 [hci1] 17.564006
      ATT: Write Response (0x13) len 0
< HCI Command: Host Number of Com.. (0x03|0x0035) plen 5  #305 [hci1] 17.581047
        Num handles: 1
        Handle: 1515 Address: DF:A9:FF:F6:B1:1A (OUI DF-A9-FF)
        Count: 1
< ACL Data TX: Handle 1515 flags 0x00 dlen 9              #306 [hci1] 17.581192
      ATT: Write Request (0x12) len 4
        Handle: 0x00ee
          Data: 0100
> HCI Event: Number of Completed Packets (0x13) plen 5    #307 [hci1] 17.738812
        Num handles: 1
        Handle: 1515 Address: DF:A9:FF:F6:B1:1A (OUI DF-A9-FF)
        Count: 1
        #306: len 9 (0 Kb/s)
        Latency: 157 msec (72-173 msec ~161 msec)
> ACL Data RX: Handle 1515 flags 0x02 dlen 5              #308 [hci1] 17.738894
      ATT: Write Response (0x13) len 0
< HCI Command: Host Number of Com.. (0x03|0x0035) plen 5  #309 [hci1] 17.740529
        Num handles: 1
        Handle: 1515 Address: DF:A9:FF:F6:B1:1A (OUI DF-A9-FF)
        Count: 1
< ACL Data TX: Handle 1515 flags 0x00 dlen 9              #310 [hci1] 17.740604
      ATT: Write Request (0x12) len 4
        Handle: 0x00f1
          Data: 0100
> HCI Event: Number of Completed Packets (0x13) plen 5    #311 [hci1] 17.913844
        Num handles: 1
        Handle: 1515 Address: DF:A9:FF:F6:B1:1A (OUI DF-A9-FF)
        Count: 1
        #310: len 9 (0 Kb/s)
        Latency: 173 msec (72-173 msec ~167 msec)
> ACL Data RX: Handle 1515 flags 0x02 dlen 5              #312 [hci1] 17.913951
      ATT: Write Response (0x13) len 0
< HCI Command: Host Number of Com.. (0x03|0x0035) plen 5  #313 [hci1] 17.920494
        Num handles: 1
        Handle: 1515 Address: DF:A9:FF:F6:B1:1A (OUI DF-A9-FF)
        Count: 1
< ACL Data TX: Handle 1515 flags 0x00 dlen 9              #314 [hci1] 17.920540
      ATT: Find Information Request (0x04) len 4
        Handle range: 0x00f3-0x00fc
> HCI Event: Number of Completed Packets (0x13) plen 5    #315 [hci1] 18.089065
        Num handles: 1
        Handle: 1515 Address: DF:A9:FF:F6:B1:1A (OUI DF-A9-FF)
        Count: 1
        #314: len 9 (0 Kb/s)
        Latency: 168 msec (72-173 msec ~167 msec)
> ACL Data RX: Handle 1515 flags 0x02 dlen 26             #316 [hci1] 18.089398
      ATT: Find Information Response (0x05) len 21
        Format: UUID-16 (0x01)
        Handle: 0x00f3
        UUID: Termination Reason (0x2bc0)
        Handle: 0x00f4
        UUID: Client Characteristic Configuration (0x2902)
        Handle: 0x00f5
        UUID: Characteristic (0x2803)
        Handle: 0x00f6
        UUID: Incoming Call (0x2bc1)
        Handle: 0x00f7
        UUID: Client Characteristic Configuration (0x2902)
< HCI Command: Host Number of Com.. (0x03|0x0035) plen 5  #317 [hci1] 18.101020
        Num handles: 1
        Handle: 1515 Address: DF:A9:FF:F6:B1:1A (OUI DF-A9-FF)
        Count: 1
< ACL Data TX: Handle 1515 flags 0x00 dlen 9              #318 [hci1] 18.101150
      ATT: Find Information Request (0x04) len 4
        Handle range: 0x00f6-0x00fc
> HCI Event: Number of Completed Packets (0x13) plen 5    #319 [hci1] 18.264006
        Num handles: 1
        Handle: 1515 Address: DF:A9:FF:F6:B1:1A (OUI DF-A9-FF)
        Count: 1
        #318: len 9 (0 Kb/s)
        Latency: 162 msec (72-173 msec ~165 msec)
> ACL Data RX: Handle 1515 flags 0x02 dlen 26             #320 [hci1] 18.264345
      ATT: Find Information Response (0x05) len 21
        Format: UUID-16 (0x01)
        Handle: 0x00f6
        UUID: Incoming Call (0x2bc1)
        Handle: 0x00f7
        UUID: Client Characteristic Configuration (0x2902)
        Handle: 0x00f8
        UUID: Characteristic (0x2803)
        Handle: 0x00f9
        UUID: Call Friendly Name (0x2bc2)
        Handle: 0x00fa
        UUID: Client Characteristic Configuration (0x2902)
< HCI Command: Host Number of Com.. (0x03|0x0035) plen 5  #321 [hci1] 18.280754
        Num handles: 1
        Handle: 1515 Address: DF:A9:FF:F6:B1:1A (OUI DF-A9-FF)
        Count: 1
< ACL Data TX: Handle 1515 flags 0x00 dlen 9              #322 [hci1] 18.280792
      ATT: Find Information Request (0x04) len 4
        Handle range: 0x00f9-0x00fc
> HCI Event: Number of Completed Packets (0x13) plen 5    #323 [hci1] 18.438995
        Num handles: 1
        Handle: 1515 Address: DF:A9:FF:F6:B1:1A (OUI DF-A9-FF)
        Count: 1
        #322: len 9 (0 Kb/s)
        Latency: 158 msec (72-173 msec ~161 msec)
> ACL Data RX: Handle 1515 flags 0x02 dlen 22             #324 [hci1] 18.439275
      ATT: Find Information Response (0x05) len 17
        Format: UUID-16 (0x01)
        Handle: 0x00f9
        UUID: Call Friendly Name (0x2bc2)
        Handle: 0x00fa
        UUID: Client Characteristic Configuration (0x2902)
        Handle: 0x00fb
        UUID: Characteristic (0x2803)
        Handle: 0x00fc
        UUID: Call Control Point Optional Opcodes (0x2bbf)
< HCI Command: Host Number of Com.. (0x03|0x0035) plen 5  #325 [hci1] 18.440458
        Num handles: 1
        Handle: 1515 Address: DF:A9:FF:F6:B1:1A (OUI DF-A9-FF)
        Count: 1
< ACL Data TX: Handle 1515 flags 0x00 dlen 11             #326 [hci1] 18.440532
      ATT: Read By Type Request (0x08) len 6
        Handle range: 0x00f9-0x00fc
        Attribute type: Characteristic (0x2803)
> HCI Event: Number of Completed Packets (0x13) plen 5    #327 [hci1] 18.613924
        Num handles: 1
        Handle: 1515 Address: DF:A9:FF:F6:B1:1A (OUI DF-A9-FF)
        Count: 1
        #326: len 11 (0 Kb/s)
        Latency: 173 msec (72-173 msec ~167 msec)
> ACL Data RX: Handle 1515 flags 0x02 dlen 13             #328 [hci1] 18.614159
      ATT: Read By Type Response (0x09) len 8
        Attribute data length: 7
        Attribute data list: 1 entry
        Handle: 0x00fb
        Value: 02fc00bf2b
            Properties: 0x02
              Read (0x02)
            Value Handle: 0x00fc
            Value UUID: Call Control Point Optional Opcodes (0x2bbf)
< HCI Command: Host Number of Com.. (0x03|0x0035) plen 5  #329 [hci1] 18.621007
        Num handles: 1
        Handle: 1515 Address: DF:A9:FF:F6:B1:1A (OUI DF-A9-FF)
        Count: 1
< ACL Data TX: Handle 1515 flags 0x00 dlen 9              #330 [hci1] 18.621108
      ATT: Write Request (0x12) len 4
        Handle: 0x00f4
          Data: 0100
< ACL Data TX: Handle 1515 flags 0x00 dlen 18             #331 [hci1] 18.700578
      ATT: Write Command (0x52) len 13
        Handle: 0x00f0
          Data: 04736b7970653a74657374
> HCI Event: Number of Completed Packets (0x13) plen 5    #332 [hci1] 18.788778
        Num handles: 1
        Handle: 1515 Address: DF:A9:FF:F6:B1:1A (OUI DF-A9-FF)
        Count: 1
        #330: len 9 (0 Kb/s)
        Latency: 167 msec (72-173 msec ~167 msec)
> ACL Data RX: Handle 1515 flags 0x02 dlen 5              #333 [hci1] 18.788900
      ATT: Write Response (0x13) len 0
< HCI Command: Host Number of Com.. (0x03|0x0035) plen 5  #334 [hci1] 18.800721
        Num handles: 1
        Handle: 1515 Address: DF:A9:FF:F6:B1:1A (OUI DF-A9-FF)
        Count: 1
< ACL Data TX: Handle 1515 flags 0x00 dlen 9              #335 [hci1] 18.800823
      ATT: Write Request (0x12) len 4
        Handle: 0x00f7
          Data: 0100
> HCI Event: Number of Completed Packets (0x13) plen 5    #336 [hci1] 18.876295
        Num handles: 1
        Handle: 1515 Address: DF:A9:FF:F6:B1:1A (OUI DF-A9-FF)
        Count: 1
        #331: len 18 (0 Kb/s)
        Latency: 175 msec (72-175 msec ~171 msec)
> ACL Data RX: Handle 1515 flags 0x02 dlen 10             #337 [hci1] 18.876518
      ATT: Handle Value Notification (0x1b) len 5
        Handle: 0x00f0
          Data: 040006
< HCI Command: Host Number of Com.. (0x03|0x0035) plen 5  #338 [hci1] 18.880800
        Num handles: 1
        Handle: 1515 Address: DF:A9:FF:F6:B1:1A (OUI DF-A9-FF)
        Count: 1
> HCI Event: Number of Completed Packets (0x13) plen 5    #339 [hci1] 18.963789
        Num handles: 1
        Handle: 1515 Address: DF:A9:FF:F6:B1:1A (OUI DF-A9-FF)
        Count: 1
        #335: len 9 (0 Kb/s)
        Latency: 162 msec (72-175 msec ~167 msec)
> ACL Data RX: Handle 1515 flags 0x02 dlen 5              #340 [hci1] 18.963930
      ATT: Write Response (0x13) len 0
< HCI Command: Host Number of Com.. (0x03|0x0035) plen 5  #341 [hci1] 18.980611
        Num handles: 1
        Handle: 1515 Address: DF:A9:FF:F6:B1:1A (OUI DF-A9-FF)
        Count: 1
< ACL Data TX: Handle 1515 flags 0x00 dlen 9              #342 [hci1] 18.980635
      ATT: Write Request (0x12) len 4
        Handle: 0x00fa
          Data: 0100
> HCI Event: Number of Completed Packets (0x13) plen 5    #343 [hci1] 19.138795
        Num handles: 1
        Handle: 1515 Address: DF:A9:FF:F6:B1:1A (OUI DF-A9-FF)
        Count: 1
        #342: len 9 (0 Kb/s)
        Latency: 158 msec (72-175 msec ~162 msec)
> ACL Data RX: Handle 1515 flags 0x02 dlen 5              #344 [hci1] 19.138971
      ATT: Write Response (0x13) len 0
< HCI Command: Host Number of Com.. (0x03|0x0035) plen 5  #345 [hci1] 19.140937
        Num handles: 1
        Handle: 1515 Address: DF:A9:FF:F6:B1:1A (OUI DF-A9-FF)
        Count: 1
< ACL Data TX: Handle 1515 flags 0x00 dlen 11             #346 [hci1] 19.141039
      ATT: Read By Type Request (0x08) len 6
        Handle range: 0x00fc-0x00fc
        Attribute type: Characteristic (0x2803)
> HCI Event: Number of Completed Packets (0x13) plen 5    #347 [hci1] 19.313846
        Num handles: 1
        Handle: 1515 Address: DF:A9:FF:F6:B1:1A (OUI DF-A9-FF)
        Count: 1
        #346: len 11 (0 Kb/s)
        Latency: 172 msec (72-175 msec ~167 msec)
> ACL Data RX: Handle 1515 flags 0x02 dlen 9              #348 [hci1] 19.313927
      ATT: Error Response (0x01) len 4
        Read By Type Request (0x08)
        Handle: 0x00fc
        Error: Attribute Not Found (0x0a)
< HCI Command: Host Number of Com.. (0x03|0x0035) plen 5  #349 [hci1] 19.320621
        Num handles: 1
        Handle: 1515 Address: DF:A9:FF:F6:B1:1A (OUI DF-A9-FF)
        Count: 1
< ACL Data TX: Handle 1515 flags 0x00 dlen 7              #350 [hci1] 19.320648
      ATT: Read Request (0x0a) len 2
        Handle: 0x00e5
> HCI Event: Number of Completed Packets (0x13) plen 5    #351 [hci1] 19.488754
        Num handles: 1
        Handle: 1515 Address: DF:A9:FF:F6:B1:1A (OUI DF-A9-FF)
        Count: 1
        #350: len 7 (0 Kb/s)
        Latency: 168 msec (72-175 msec ~167 msec)
> ACL Data RX: Handle 1515 flags 0x02 dlen 6              #352 [hci1] 19.488949
      ATT: Read Response (0x0b) len 1
< HCI Command: Host Number of Com.. (0x03|0x0035) plen 5  #353 [hci1] 19.501473
        Num handles: 1
        Handle: 1515 Address: DF:A9:FF:F6:B1:1A (OUI DF-A9-FF)
        Count: 1
< ACL Data TX: Handle 1515 flags 0x00 dlen 7              #354 [hci1] 19.920564
      ATT: Read Request (0x0a) len 2
        Handle: 0x012d
> HCI Event: Number of Completed Packets (0x13) plen 5    #355 [hci1] 20.013856
        Num handles: 1
        Handle: 1515 Address: DF:A9:FF:F6:B1:1A (OUI DF-A9-FF)
        Count: 1
        #354: len 7 (0 Kb/s)
        Latency: 93 msec (72-175 msec ~130 msec)
> ACL Data RX: Handle 1515 flags 0x02 dlen 8              #356 [hci1] 20.013944
      ATT: Read Response (0x0b) len 3
< HCI Command: Host Number of Com.. (0x03|0x0035) plen 5  #357 [hci1] 20.020461
        Num handles: 1
        Handle: 1515 Address: DF:A9:FF:F6:B1:1A (OUI DF-A9-FF)
        Count: 1
> HCI Event: Disconnect Complete (0x05) plen 4            #358 [hci1] 20.626418
        Status: Success (0x00)
        Handle: 1515 Address: DF:A9:FF:F6:B1:1A (OUI DF-A9-FF)
        Reason: Remote User Terminated Connection (0x13)
< HCI Command: Reset (0x03|0x0003) plen 0                 #359 [hci1] 26.950413
> HCI Event: Command Complete (0x0e) plen 4               #360 [hci1] 26.950944
      Reset (0x03|0x0003) ncmd 1
        Status: Success (0x00)
@ USER Close: main                                    {0x0001} [hci1] 26.960350
= Close Index: 00:00:00:00:00:00                               [hci1] 26.964169
