Bluetooth monitor ver 5.72
= Note: Linux version 6.14.0-36-generic (x86_64)                       0.727823
= Note: Bluetooth subsystem version 2.22                               0.727829
= New Index: 00:00:00:00:00:00 (Primary,UART,hci1)              [hci1] 0.727832
= New Index: 48:5F:99:8E:E0:64 (Primary,USB,hci0)               [hci0] 0.727834
= Open Index: 00:00:00:00:00:00                                 [hci1] 0.847829
= Index Info: 00:00:00:00:00:00 (Nordic Semiconductor ASA)      [hci1] 0.847844
@ USER Open: main (privileged) version 2.22            {0x0001} [hci1] 0.847853
< HCI Command: Reset (0x03|0x0003) plen 0                    #1 [hci1] 0.849032
> HCI Event: Command Complete (0x0e) plen 4                  #2 [hci1] 0.849499
      Reset (0x03|0x0003) ncmd 1
        Status: Success (0x00)
< HCI Command: Read Local Supported... (0x04|0x0003) plen 0  #3 [hci1] 0.867667
> HCI Event: Command Complete (0x0e) plen 12                 #4 [hci1] 0.868160
      Read Local Supported Features (0x04|0x0003) ncmd 1
        Status: Success (0x00)
        Features: 0x00 0x00 0x00 0x00 0x60 0x00 0x00 0x00
          BR/EDR Not Supported
          LE Supported (Controller)
< HCI Command: Read Local Version In.. (0x04|0x0001) plen 0  #5 [hci1] 0.887398
> HCI Event: Command Complete (0x0e) plen 12                 #6 [hci1] 0.887906
      Read Local Version Information (0x04|0x0001) ncmd 1
        Status: Success (0x00)
        HCI version: Reserved (0x0f) - Revision 12393 (0x3069)
        LMP version: Reserved (0x0f) - Subversion 12393 (0x3069)
        Manufacturer: Nordic Semiconductor ASA (89)
< HCI Command: Read Local Supported... (0x04|0x0002) plen 0  #7 [hci1] 0.907277
> HCI Event: Command Complete (0x0e) plen 68                 #8 [hci1] 0.908333
      Read Local Supported Commands (0x04|0x0002) ncmd 1
        Status: Success (0x00)
        Commands: 119 entries
          Disconnect (Octet 0 - Bit 5)
          Read Remote Version Information (Octet 2 - Bit 7)
          Set Event Mask (Octet 5 - Bit 6)
          Reset (Octet 5 - Bit 7)
          Read Connection Accept Timeout (Octet 7 - Bit 2)
          Write Connection Accept Timeout (Octet 7 - Bit 3)
          Read Transmit Power Level (Octet 10 - Bit 2)
          Set Controller To Host Flow Control (Octet 10 - Bit 5)
          Host Buffer Size (Octet 10 - Bit 6)
          Host Number of Completed Packets (Octet 10 - Bit 7)
          Read Local Version Information (Octet 14 - Bit 3)
          Read Local Supported Features (Octet 14 - Bit 5)
          Read BD ADDR (Octet 15 - Bit 1)
          Read RSSI (Octet 15 - Bit 5)
          Set Event Mask Page 2 (Octet 22 - Bit 2)
          LE Set Event Mask (Octet 25 - Bit 0)
          LE Read Buffer Size (Octet 25 - Bit 1)
          LE Read Local Supported Features (Octet 25 - Bit 2)
          LE Set Random Address (Octet 25 - Bit 4)
          LE Set Advertising Parameters (Octet 25 - Bit 5)
          LE Read Advertising Channel TX Power (Octet 25 - Bit 6)
          LE Set Advertising Data (Octet 25 - Bit 7)
          LE Set Scan Response Data (Octet 26 - Bit 0)
          LE Set Advertise Enable (Octet 26 - Bit 1)
          LE Set Scan Parameters (Octet 26 - Bit 2)
          LE Set Scan Enable (Octet 26 - Bit 3)
          LE Create Connection (Octet 26 - Bit 4)
          LE Create Connection Cancel (Octet 26 - Bit 5)
          LE Read Accept List Size (Octet 26 - Bit 6)
          LE Clear Accept List (Octet 26 - Bit 7)
          LE Add Device To Accept List (Octet 27 - Bit 0)
          LE Remove Device From Accept List (Octet 27 - Bit 1)
          LE Connection Update (Octet 27 - Bit 2)
          LE Set Host Channel Classification (Octet 27 - Bit 3)
          LE Read Channel Map (Octet 27 - Bit 4)
          LE Read Remote Used Features (Octet 27 - Bit 5)
          LE Encrypt (Octet 27 - Bit 6)
          LE Rand (Octet 27 - Bit 7)
          LE Start Encryption (Octet 28 - Bit 0)
          LE Long Term Key Request Reply (Octet 28 - Bit 1)
          LE Long Term Key Request Neg Reply (Octet 28 - Bit 2)
          LE Read Supported States (Octet 28 - Bit 3)
          LE Receiver Test (Octet 28 - Bit 4)
          LE Transmitter Test (Octet 28 - Bit 5)
          LE Test End (Octet 28 - Bit 6)
          Read Authenticated Payload Timeout (Octet 32 - Bit 4)
          Write Authenticated Payload Timeout (Octet 32 - Bit 5)
          LE Set Data Length (Octet 33 - Bit 6)
          LE Read Suggested Default Data Length (Octet 33 - Bit 7)
          LE Write Suggested Default Data Length (Octet 34 - Bit 0)
          LE Add Device To Resolving List (Octet 34 - Bit 3)
          LE Remove Device From Resolving List (Octet 34 - Bit 4)
          LE Clear Resolving List (Octet 34 - Bit 5)
          LE Read Resolving List Size (Octet 34 - Bit 6)
          LE Set Address Resolution Enable (Octet 35 - Bit 1)
          LE Set Resolvable Private Address Timeout (Octet 35 - Bit 2)
          LE Read Maximum Data Length (Octet 35 - Bit 3)
          LE Read PHY (Octet 35 - Bit 4)
          LE Set Default PHY (Octet 35 - Bit 5)
          LE Set PHY (Octet 35 - Bit 6)
          LE Enhanced Receiver Test (Octet 35 - Bit 7)
          LE Enhanced Transmitter Test (Octet 36 - Bit 0)
          LE Set Advertising Set Random Address (Octet 36 - Bit 1)
          LE Set Extended Advertising Parameters (Octet 36 - Bit 2)
          LE Set Extended Advertising Data (Octet 36 - Bit 3)
          LE Set Extended Scan Response Data (Octet 36 - Bit 4)
          LE Set Extended Advertising Enable (Octet 36 - Bit 5)
          LE Read Maximum Advertising Data Length (Octet 36 - Bit 6)
          LE Read Number of Supported Advertising Sets (Octet 36 - Bit 7)
          LE Remove Advertising Set (Octet 37 - Bit 0)
          LE Clear Advertising Sets (Octet 37 - Bit 1)
          LE Set Periodic Advertising Parameters (Octet 37 - Bit 2)
          LE Set Periodic Advertising Data (Octet 37 - Bit 3)
          LE Set Periodic Advertising Enable (Octet 37 - Bit 4)
          LE Set Extended Scan Parameters (Octet 37 - Bit 5)
          LE Set Extended Scan Enable (Octet 37 - Bit 6)
          LE Extended Create Connection (Octet 37 - Bit 7)
          LE Periodic Advertising Create Sync (Octet 38 - Bit 0)
          LE Periodic Advertising Create Sync Cancel (Octet 38 - Bit 1)
          LE Periodic Advertising Terminate Sync (Octet 38 - Bit 2)
          LE Add Device To Periodic Advertiser List (Octet 38 - Bit 3)
          LE Remove Device From Periodic Advertiser List (Octet 38 - Bit 4)
          LE Clear Periodic Advertiser List (Octet 38 - Bit 5)
          LE Read Periodic Advertiser List Size (Octet 38 - Bit 6)
          LE Read Transmit Power (Octet 38 - Bit 7)
          LE Read RF Path Compensation (Octet 39 - Bit 0)
          LE Write RF Path Compensation (Octet 39 - Bit 1)
          LE Set Privacy Mode (Octet 39 - Bit 2)
          LE Periodic Advertising Receive Enable (Octet 40 - Bit 5)
          LE Periodic Advertising Sync Transfer (Octet 40 - Bit 6)
          LE Periodic Advertising Set Info Transfer (Octet 40 - Bit 7)
          LE Periodic Advertising Sync Transfer Parameters (Octet 41 - Bit 0)
          LE Set Default Periodic Advertisng Sync Transfer Parameters (Octet 41 - Bit 1)
          LE Read Buffer v2 (Octet 41 - Bit 5)
          LE Read ISO TX Sync (Octet 41 - Bit 6)
          LE Set Connected Isochronous Group Parameters (Octet 41 - Bit 7)
          LE Set Connected Isochronous Group Parameters Test (Octet 42 - Bit 0)
          LE Create Connected Isochronous Stream (Octet 42 - Bit 1)
          LE Remove Connected Isochronous Group (Octet 42 - Bit 2)
          LE Accept Connected Isochronous Stream Request (Octet 42 - Bit 3)
          LE Reject Connected Isochronous Stream Request (Octet 42 - Bit 4)
          LE Create Broadcast Isochronous Group (Octet 42 - Bit 5)
          LE Create Broadcast Isochronous Group Test (Octet 42 - Bit 6)
          LE Terminate Broadcast Isochronous Group (Octet 42 - Bit 7)
          LE Broadcast Isochronous Group Create Sync (Octet 43 - Bit 0)
          LE Broadcast Isochronous Group Terminate Sync (Octet 43 - Bit 1)
          LE Request Peer SCA (Octet 43 - Bit 2)
          LE Setup Isochronous Data Path (Octet 43 - Bit 3)
          LE Remove Isochronous Data Path (Octet 43 - Bit 4)
          LE Isochronous Transmit Test (Octet 43 - Bit 5)
          LE Isochronous Receive Test (Octet 43 - Bit 6)
          LE Isochronous Read Test Counters (Octet 43 - Bit 7)
          LE Isochronous Read Test Counters (Octet 44 - Bit 0)
          LE Set Host Feature (Octet 44 - Bit 1)
          Octet 44 - Bit 2 
          Octet 45 - Bit 6 
          Octet 46 - Bit 0 
          Octet 46 - Bit 1 
          Octet 46 - Bit 2 
< HCI Command: Host Buffer Size (0x03|0x0033) plen 7         #9 [hci1] 0.927250
        ACL MTU: 255  ACL max packet: 16
        SCO MTU: 0    SCO max packet: 0
> HCI Event: Command Complete (0x0e) plen 4                 #10 [hci1] 0.927821
      Host Buffer Size (0x03|0x0033) ncmd 1
        Status: Success (0x00)
< HCI Command: Set Controller To Ho.. (0x03|0x0031) plen 1  #11 [hci1] 0.947293
        Flow control: ACL Data Packets (0x01)
> HCI Event: Command Complete (0x0e) plen 4                 #12 [hci1] 0.947705
      Set Controller To Host Flow Control (0x03|0x0031) ncmd 1
        Status: Success (0x00)
< HCI Command: LE Read Local Suppor.. (0x08|0x0003) plen 0  #13 [hci1] 0.967279
> HCI Event: Command Complete (0x0e) plen 12                #14 [hci1] 0.967791
      LE Read Local Supported Features (0x08|0x0003) ncmd 1
        Status: Success (0x00)
        Features: 0xfd 0x79 0x00 0xf7 0x30 0x01 0x00 0x00
          LE Encryption
          Extended Reject Indication
          Peripheral-initiated Features Exchange
          LE Ping
          LE Data Packet Length Extension
          LL Privacy
          Extended Scanner Filter Policies
          LE 2M PHY
          LE Coded PHY
          LE Extended Advertising
          LE Periodic Advertising
          Channel Selection Algorithm #2
          Periodic Advertising Sync Transfer - Sender
          Periodic Advertising Sync Transfer - Recipient
          Sleep Clock Accuracy Updates
          Connected Isochronous Stream - Central
          Connected Isochronous Stream - Peripheral
          Isochronous Broadcaster
          Synchronized Receiver
          Periodic Advertising ADI support
          Connection Subrating
          Unknown features (0x0000010000000000)
< HCI Command: LE Set Host Feature (0x08|0x0074) plen 2     #15 [hci1] 0.987267
        Bit Number: 32
          Connected Isochronous Stream (Host Support)
        Bit Value: 1
> HCI Event: Command Complete (0x0e) plen 4                 #16 [hci1] 0.987655
      LE Set Host Feature (0x08|0x0074) ncmd 1
        Status: Success (0x00)
< HCI Command: LE Read Buffer v2 (0x08|0x0060) plen 0       #17 [hci1] 1.007277
> HCI Event: Command Complete (0x0e) plen 10                #18 [hci1] 1.007749
      LE Read Buffer v2 (0x08|0x0060) ncmd 1
        Status: Success (0x00)
        ACL MTU: 27
        ACL max packet: 3
        ISO MTU: 318
        ISO max packet: 3
< HCI Command: LE Read Maximum Adve.. (0x08|0x003a) plen 0  #19 [hci1] 1.027316
> HCI Event: Command Complete (0x0e) plen 6                 #20 [hci1] 1.027725
      LE Read Maximum Advertising Data Length (0x08|0x003a) ncmd 1
        Status: Success (0x00)
        Max length: 1650
< HCI Command: LE Read Supported St.. (0x08|0x001c) plen 0  #21 [hci1] 1.047232
> HCI Event: Command Complete (0x0e) plen 12                #22 [hci1] 1.047662
      LE Read Supported States (0x08|0x001c) ncmd 1
        Status: Success (0x00)
        States: 0x000003ff3e0306ff
          Non-connectable Advertising State
          Scannable Advertising State
          Connectable Advertising State
          High Duty Cycle Directed Advertising State
          Passive Scanning State
          Active Scanning State
          Initiating State
            and Connection State (Central Role)
          Connection State (Peripheral Role)
          Scannable Advertising State
            and Passive Scanning State
          Connectable Advertising State
            and Passive Scanning State
          Non-connectable Advertising State
            and Initiating State
          Scannable Advertising State
            and Initiating State
          Active Scanning State
            and Connection State (Central Role)
          Passive Scanning State
            and Connection State (Peripheral Role)
          Active Scanning State
            and Connection State (Peripheral Role)
          Initiating State
            and Connection State (Central Role)
            and Central Role & Central Role
          Low Duty Cycle Directed Advertising State
          Connectable Advertising State
            and Initiating State
            and Central Role & Peripheral Role
          High Duty Cycle Directed Advertising State
            and Initiating State
            and Central Role & Peripheral Role
          Low Duty Cycle Directed Advertising State
            and Initiating State
            and Central Role & Peripheral Role
          Connectable Advertising State
            and Connection State (Central Role)
            and Central Role & Peripheral Role
          High Duty Cycle Directed Advertising State
            and Connection State (Central Role)
            and Central Role & Peripheral Role
          Low Duty Cycle Directed Advertising State
            and Connection State (Central Role)
            and Central Role & Peripheral Role
          Connectable Advertising State
            and Connection State (Peripheral Role)
            and Central Role & Peripheral Role
          High Duty Cycle Directed Advertising State
            and Connection State (Peripheral Role)
            and Peripheral Role & Peripheral Role
          Low Duty Cycle Directed Advertising State
            and Connection State (Peripheral Role)
            and Peripheral Role & Peripheral Role
          Initiating State
            and Connection State (Peripheral Role)
            and Central Role & Peripheral Role
< HCI Command: LE Read Maximum Data.. (0x08|0x002f) plen 0  #23 [hci1] 1.067283
> HCI Event: Command Complete (0x0e) plen 12                #24 [hci1] 1.067730
      LE Read Maximum Data Length (0x08|0x002f) ncmd 1
        Status: Success (0x00)
        Max TX octets: 251
        Max TX time: 2704
        Max RX octets: 251
        Max RX time: 2704
< HCI Command: LE Write Suggested D.. (0x08|0x0024) plen 4  #25 [hci1] 1.087292
        TX octets: 251
        TX time: 2704
> HCI Event: Command Complete (0x0e) plen 4                 #26 [hci1] 1.087705
      LE Write Suggested Default Data Length (0x08|0x0024) ncmd 1
        Status: Success (0x00)
< HCI Command: LE Set Resolvable Pr.. (0x08|0x002e) plen 2  #27 [hci1] 1.107296
        Timeout: 30 seconds
> HCI Event: Command Complete (0x0e) plen 4                 #28 [hci1] 1.107688
      LE Set Resolvable Private Address Timeout (0x08|0x002e) ncmd 1
        Status: Success (0x00)
< HCI Command: LE Read Resolving Li.. (0x08|0x002a) plen 0  #29 [hci1] 1.127283
> HCI Event: Command Complete (0x0e) plen 5                 #30 [hci1] 1.127729
      LE Read Resolving List Size (0x08|0x002a) ncmd 1
        Status: Success (0x00)
        Size: 8
< HCI Command: LE Set Event Mask (0x08|0x0001) plen 8       #31 [hci1] 1.147266
        Mask: 0x000002023f87fa5e
          LE Advertising Report
          LE Connection Update Complete
          LE Read Remote Used Features Complete
          LE Long Term Key Request
          LE Data Length Change
          LE Enhanced Connection Complete
          LE PHY Update Complete
          LE Extended Advertising Report
          LE Periodic Advertising Sync Established
          LE Periodic Advertising Report
          LE Periodic Advertising Sync Lost
          LE Extended Scan Timeout
          LE Extended Advertising Set Terminated
          LE Scan Request Received
          LE Periodic Advertising Sync Transfer Rvc
          LE CIS Established
          LE CIS Request
          LE Create BIG Complete
          LE Terminate BIG Complete
          LE BIG Sync Estabilished Complete
          LE BIG Sync Lost
          LE BIG Info Advertising Report
          Unknown mask (0x0000020000000000)
> HCI Event: Command Complete (0x0e) plen 4                 #32 [hci1] 1.147797
      LE Set Event Mask (0x08|0x0001) ncmd 1
        Status: Success (0x00)
< HCI Command: Set Event Mask (0x03|0x0001) plen 8          #33 [hci1] 1.167290
        Mask: 0x2000800002008890
          Disconnection Complete
          Encryption Change
          Read Remote Version Information Complete
          Hardware Error
          Data Buffer Overflow
          Encryption Key Refresh Complete
          LE Meta
> HCI Event: Command Complete (0x0e) plen 4                 #34 [hci1] 1.167802
      Set Event Mask (0x03|0x0001) ncmd 1
        Status: Success (0x00)
< HCI Command: Read BD ADDR (0x04|0x0009) plen 0            #35 [hci1] 1.187291
> HCI Event: Command Complete (0x0e) plen 10                #36 [hci1] 1.187782
      Read BD ADDR (0x04|0x0009) ncmd 1
        Status: Success (0x00)
        Address: 00:00:00:00:00:00 (OUI 00-00-00)
< HCI Command: LE Set Random Address (0x08|0x0005) plen 6   #37 [hci1] 1.207315
        Address: D5:B6:CC:31:DB:3B (Static)
> HCI Event: Command Complete (0x0e) plen 4                 #38 [hci1] 1.207771
      LE Set Random Address (0x08|0x0005) ncmd 1
        Status: Success (0x00)
< HCI Command: LE Set Random Address (0x08|0x0005) plen 6   #39 [hci1] 1.337243
        Address: 48:61:8E:DB:C6:F9 (Resolvable)
> HCI Event: Command Complete (0x0e) plen 4                 #40 [hci1] 1.337809
      LE Set Random Address (0x08|0x0005) ncmd 1
        Status: Success (0x00)
< HCI Command: LE Extended Create... (0x08|0x0043) plen 26  #41 [hci1] 4.737751
        Filter policy: Accept list is not used (0x00)
        Own address type: Random (0x03)
        Peer address type: Public (0x00)
        Peer address: DF:A9:FF:F6:B1:1A (OUI DF-A9-FF)
        Initiating PHYs: 0x01
        Entry 0: LE 1M
          Scan interval: 60.000 msec (0x0060)
          Scan window: 60.000 msec (0x0060)
          Min connection interval: 50.00 msec (0x0028)
          Max connection interval: 70.00 msec (0x0038)
          Connection latency: 0 (0x0000)
          Supervision timeout: 4000 msec (0x0190)
          Min connection length: 0.000 msec (0x0000)
          Max connection length: 0.000 msec (0x0000)
> HCI Event: Command Status (0x0f) plen 4                   #42 [hci1] 4.738701
      LE Extended Create Connection (0x08|0x0043) ncmd 1
        Status: Success (0x00)
> HCI Event: LE Meta Event (0x3e) plen 31                   #43 [hci1] 4.832539
      LE Enhanced Connection Complete (0x0a)
        Status: Success (0x00)
        Handle: 2250
        Role: Central (0x00)
        Peer address type: Public (0x00)
        Peer address: DF:A9:FF:F6:B1:1A (OUI DF-A9-FF)
        Local resolvable private address: 48:61:8E:DB:C6:F9 (Resolvable)
        Peer resolvable private address: 00:00:00:00:00:00 (Non-Resolvable)
        Connection interval: 70.00 msec (0x0038)
        Connection latency: 0 (0x0000)
        Supervision timeout: 4000 msec (0x0190)
        Central clock accuracy: 0x00
< HCI Command: LE Read Remote Used... (0x08|0x0016) plen 2  #44 [hci1] 4.848197
        Handle: 2250 Address: DF:A9:FF:F6:B1:1A (OUI DF-A9-FF)
< ACL Data TX: Handle 2250 flags 0x00 dlen 7                #45 [hci1] 4.848267
      ATT: Exchange MTU Request (0x02) len 2
        Client RX MTU: 251
> HCI Event: Command Status (0x0f) plen 4                   #46 [hci1] 4.848769
      LE Read Remote Used Features (0x08|0x0016) ncmd 1
        Status: Success (0x00)
< HCI Command: LE Set PHY (0x08|0x0032) plen 7              #47 [hci1] 4.867716
        Handle: 2250 Address: DF:A9:FF:F6:B1:1A (OUI DF-A9-FF)
        All PHYs preference: 0x00
        TX PHYs preference: 0x02
          LE 2M
        RX PHYs preference: 0x02
          LE 2M
        PHY options preference: Reserved (0x0000)
> HCI Event: Command Status (0x0f) plen 4                   #48 [hci1] 4.868248
      LE Set PHY (0x08|0x0032) ncmd 1
        Status: Success (0x00)
> HCI Event: Number of Completed Packets (0x13) plen 5      #49 [hci1] 4.904745
        Num handles: 1
        Handle: 2250 Address: DF:A9:FF:F6:B1:1A (OUI DF-A9-FF)
        Count: 1
        #45: len 7 (1 Kb/s)
        Latency: 56 msec (56-56 msec ~56 msec)
> HCI Event: LE Meta Event (0x3e) plen 12                   #50 [hci1] 5.044863
      LE Read Remote Used Features (0x04)
        Status: Success (0x00)
        Handle: 2250 Address: DF:A9:FF:F6:B1:1A (OUI DF-A9-FF)
        Features: 0x2d 0x49 0x00 0xf7 0x67 0xd9 0x00 0x80
          LE Encryption
          Extended Reject Indication
          Peripheral-initiated Features Exchange
          LE Data Packet Length Extension
          LE 2M PHY
          LE Coded PHY
          Channel Selection Algorithm #2
          Periodic Advertising Sync Transfer - Sender
          Periodic Advertising Sync Transfer - Recipient
          Sleep Clock Accuracy Updates
          Connected Isochronous Stream - Central
          Connected Isochronous Stream - Peripheral
          Isochronous Broadcaster
          Synchronized Receiver
          Connected Isochronous Stream (Host Support)
          LE Power Control Request
          LE Power Control Request
          Connection Subrating
          Connection Subrating (Host Support)
          Unknown features (0x8000d90000000000)
> HCI Event: LE Meta Event (0x3e) plen 6                    #51 [hci1] 5.744286
      LE PHY Update Complete (0x0c)
        Status: Success (0x00)
        Handle: 2250 Address: DF:A9:FF:F6:B1:1A (OUI DF-A9-FF)
        TX PHY: LE 2M (0x02)
        RX PHY: LE 2M (0x02)
> ACL Data RX: Handle 2250 flags 0x02 dlen 6                #52 [hci1] 5.884708
      SMP: Security Request (0x0b) len 1
        Authentication requirement: Bonding, No MITM, SC, No Keypresses (0x09)
> ACL Data RX: Handle 2250 flags 0x02 dlen 7                #53 [hci1] 5.885085
      ATT: Exchange MTU Response (0x03) len 2
        Server RX MTU: 23
< HCI Command: Host Number of Compl.. (0x03|0x0035) plen 5  #54 [hci1] 5.887802
        Num handles: 1
        Handle: 2250 Address: DF:A9:FF:F6:B1:1A (OUI DF-A9-FF)
        Count: 1
< ACL Data TX: Handle 2250 flags 0x00 dlen 11               #55 [hci1] 5.887986
      SMP: Pairing Request (0x01) len 6
        IO capability: NoInputNoOutput (0x03)
        OOB data: Authentication data not present (0x00)
        Authentication requirement: Bonding, No MITM, SC, No Keypresses (0x09)
        Max encryption key size: 16
        Initiator key distribution: EncKey IdKey (0x03)
        Responder key distribution: EncKey IdKey (0x03)
< HCI Command: Host Number of Compl.. (0x03|0x0035) plen 5  #56 [hci1] 5.888304
        Num handles: 1
        Handle: 2250 Address: DF:A9:FF:F6:B1:1A (OUI DF-A9-FF)
        Count: 1
> HCI Event: Number of Completed Packets (0x13) plen 5      #57 [hci1] 5.954661
        Num handles: 1
        Handle: 2250 Address: DF:A9:FF:F6:B1:1A (OUI DF-A9-FF)
        Count: 1
        #55: len 11 (1 Kb/s)
        Latency: 66 msec (56-66 msec ~61 msec)
> ACL Data RX: Handle 2250 flags 0x02 dlen 11               #58 [hci1] 6.024917
      SMP: Pairing Response (0x02) len 6
        IO capability: KeyboardDisplay (0x04)
        OOB data: Authentication data not present (0x00)
        Authentication requirement: Bonding, No MITM, SC, No Keypresses (0x09)
        Max encryption key size: 16
        Initiator key distribution: EncKey IdKey (0x03)
        Responder key distribution: EncKey IdKey (0x03)
< HCI Command: Host Number of Compl.. (0x03|0x0035) plen 5  #59 [hci1] 6.027891
        Num handles: 1
        Handle: 2250 Address: DF:A9:FF:F6:B1:1A (OUI DF-A9-FF)
        Count: 1
< ACL Data TX: Handle 2250 flags 0x00 dlen 27               #60 [hci1] 6.028061
< ACL Data TX: Handle 2250 flags 0x01 dlen 27               #61 [hci1] 6.028073
< ACL Data TX: Handle 2250 flags 0x01 dlen 15               #62 [hci1] 6.028076
      SMP: Pairing Public Key (0x0c) len 64
        X: 68f6ada634ce84d11617383d57f070fe3445c38b33b569efa5eb771a0dc8aea5
        Y: 83c407aaa8337331fdc418e55085d75e6c1c6e5d42f8bf9c18fb5a2a7d4f31aa
> HCI Event: Number of Completed Packets (0x13) plen 5      #63 [hci1] 6.094642
        Num handles: 1
        Handle: 2250 Address: DF:A9:FF:F6:B1:1A (OUI DF-A9-FF)
        Count: 1
        #60: len 27 (3 Kb/s)
        Latency: 66 msec (56-66 msec ~64 msec)
> HCI Event: Number of Completed Packets (0x13) plen 5      #64 [hci1] 6.095170
        Num handles: 1
        Handle: 2250 Address: DF:A9:FF:F6:B1:1A (OUI DF-A9-FF)
        Count: 1
        #61: len 27 (3 Kb/s)
        Latency: 67 msec (56-67 msec ~65 msec)
> HCI Event: Number of Completed Packets (0x13) plen 5      #65 [hci1] 6.095763
        Num handles: 1
        Handle: 2250 Address: DF:A9:FF:F6:B1:1A (OUI DF-A9-FF)
        Count: 1
        #62: len 15 (1 Kb/s)
        Latency: 67 msec (56-67 msec ~66 msec)
> ACL Data RX: Handle 2250 flags 0x02 dlen 27               #66 [hci1] 6.165037
> ACL Data RX: Handle 2250 flags 0x01 dlen 27               #67 [hci1] 6.165368
> ACL Data RX: Handle 2250 flags 0x01 dlen 15               #68 [hci1] 6.165758
      SMP: Pairing Public Key (0x0c) len 64
        X: 02d75b89d0098fa6a97f4c6cb1c2e8c1844134cbee14b7e4b480e7ba1d04153b
        Y: c67c739711f8cc9fcb5738d707f726d5ae02232e597013f9d3f76f63b2b089cf
< HCI Command: Host Number of Compl.. (0x03|0x0035) plen 5  #69 [hci1] 6.167507
        Num handles: 1
        Handle: 2250 Address: DF:A9:FF:F6:B1:1A (OUI DF-A9-FF)
        Count: 1
< HCI Command: Host Number of Compl.. (0x03|0x0035) plen 5  #70 [hci1] 6.167632
        Num handles: 1
        Handle: 2250 Address: DF:A9:FF:F6:B1:1A (OUI DF-A9-FF)
        Count: 1
< HCI Command: Host Number of Compl.. (0x03|0x0035) plen 5  #71 [hci1] 6.167688
        Num handles: 1
        Handle: 2250 Address: DF:A9:FF:F6:B1:1A (OUI DF-A9-FF)
        Count: 1
> ACL Data RX: Handle 2250 flags 0x02 dlen 21               #72 [hci1] 6.234915
      SMP: Pairing Confirm (0x03) len 16
        Confim value: d22672fb15f7aa9c7b487115716cf151
< HCI Command: Host Number of Compl.. (0x03|0x0035) plen 5  #73 [hci1] 6.247834
        Num handles: 1
        Handle: 2250 Address: DF:A9:FF:F6:B1:1A (OUI DF-A9-FF)
        Count: 1
< ACL Data TX: Handle 2250 flags 0x00 dlen 21               #74 [hci1] 6.247995
      SMP: Pairing Random (0x04) len 16
        Random value: 555cc64d02679f89a05211af56d8b3da
> HCI Event: Number of Completed Packets (0x13) plen 5      #75 [hci1] 6.304765
        Num handles: 1
        Handle: 2250 Address: DF:A9:FF:F6:B1:1A (OUI DF-A9-FF)
        Count: 1
        #74: len 21 (3 Kb/s)
        Latency: 56 msec (56-67 msec ~61 msec)
> ACL Data RX: Handle 2250 flags 0x02 dlen 21               #76 [hci1] 6.374851
      SMP: Pairing Random (0x04) len 16
        Random value: 49abed8cc7db6e150000000000000000
< HCI Command: Host Number of Compl.. (0x03|0x0035) plen 5  #77 [hci1] 6.388383
        Num handles: 1
        Handle: 2250 Address: DF:A9:FF:F6:B1:1A (OUI DF-A9-FF)
        Count: 1
< ACL Data TX: Handle 2250 flags 0x00 dlen 21               #78 [hci1] 6.388527
      SMP: Pairing DHKey Check (0x0d) len 16
        E: 9b00f63d0f56f9a63bb226e91bfd9696
> HCI Event: Number of Completed Packets (0x13) plen 5      #79 [hci1] 6.444686
        Num handles: 1
        Handle: 2250 Address: DF:A9:FF:F6:B1:1A (OUI DF-A9-FF)
        Count: 1
        #78: len 21 (3 Kb/s)
        Latency: 56 msec (56-67 msec ~58 msec)
> ACL Data RX: Handle 2250 flags 0x02 dlen 21               #80 [hci1] 6.724885
      SMP: Pairing DHKey Check (0x0d) len 16
        E: 5b947ef78e6aa411d78addbfa06f4451
< HCI Command: LE Start Encryption (0x08|0x0019) plen 28    #81 [hci1] 6.728105
        Handle: 2250 Address: DF:A9:FF:F6:B1:1A (OUI DF-A9-FF)
        Random number: 0x0000000000000000
        Encrypted diversifier: 0x0000
        Long term key: be607645e8e8e2055c794ded946aa8c4
> HCI Event: Command Status (0x0f) plen 4                   #82 [hci1] 6.729062
      LE Start Encryption (0x08|0x0019) ncmd 1
        Status: Success (0x00)
< HCI Command: Host Number of Compl.. (0x03|0x0035) plen 5  #83 [hci1] 6.747631
        Num handles: 1
        Handle: 2250 Address: DF:A9:FF:F6:B1:1A (OUI DF-A9-FF)
        Count: 1
> HCI Event: Encryption Change (0x08) plen 4                #84 [hci1] 7.214711
        Status: Success (0x00)
        Handle: 2250 Address: DF:A9:FF:F6:B1:1A (OUI DF-A9-FF)
        Encryption: Enabled with AES-CCM (0x01)
> ACL Data RX: Handle 2250 flags 0x02 dlen 21               #85 [hci1] 7.284934
      SMP: Identity Information (0x08) len 16
        Identity resolving key: 8aff58d2c2086474c778d61b1ed0f876
< HCI Command: LE Extended Create... (0x08|0x0043) plen 26  #86 [hci1] 7.287664
        Filter policy: Accept list is not used (0x00)
        Own address type: Random (0x03)
        Peer address type: Public (0x00)
        Peer address: 64:23:B5:94:C5:F1 (OUI 64-23-B5)
        Initiating PHYs: 0x01
        Entry 0: LE 1M
          Scan interval: 60.000 msec (0x0060)
          Scan window: 60.000 msec (0x0060)
          Min connection interval: 50.00 msec (0x0028)
          Max connection interval: 70.00 msec (0x0038)
          Connection latency: 0 (0x0000)
          Supervision timeout: 4000 msec (0x0190)
          Min connection length: 0.000 msec (0x0000)
          Max connection length: 0.000 msec (0x0000)
< HCI Command: Host Number of Compl.. (0x03|0x0035) plen 5  #87 [hci1] 7.287781
        Num handles: 1
        Handle: 2250 Address: DF:A9:FF:F6:B1:1A (OUI DF-A9-FF)
        Count: 1
> HCI Event: Command Status (0x0f) plen 4                   #88 [hci1] 7.288678
      LE Extended Create Connection (0x08|0x0043) ncmd 1
        Status: Success (0x00)
> HCI Event: LE Meta Event (0x3e) plen 31                   #89 [hci1] 7.303210
      LE Enhanced Connection Complete (0x0a)
        Status: Success (0x00)
        Handle: 127
        Role: Central (0x00)
        Peer address type: Public (0x00)
        Peer address: 64:23:B5:94:C5:F1 (OUI 64-23-B5)
        Local resolvable private address: 48:61:8E:DB:C6:F9 (Resolvable)
        Peer resolvable private address: 00:00:00:00:00:00 (Non-Resolvable)
        Connection interval: 70.00 msec (0x0038)
        Connection latency: 0 (0x0000)
        Supervision timeout: 4000 msec (0x0190)
        Central clock accuracy: 0x00
< ACL Data TX: Handle 127 flags 0x00 dlen 7                 #90 [hci1] 7.307717
      ATT: Exchange MTU Request (0x02) len 2
        Client RX MTU: 251
< HCI Command: LE Read Remote Used... (0x08|0x0016) plen 2  #91 [hci1] 7.307813
        Handle: 127 Address: 64:23:B5:94:C5:F1 (OUI 64-23-B5)
> HCI Event: Command Status (0x0f) plen 4                   #92 [hci1] 7.308281
      LE Read Remote Used Features (0x08|0x0016) ncmd 1
        Status: Success (0x00)
> HCI Event: Number of Completed Packets (0x13) plen 5      #93 [hci1] 7.314742
        Num handles: 1
        Handle: 127 Address: 64:23:B5:94:C5:F1 (OUI 64-23-B5)
        Count: 1
        #90: len 7 (8 Kb/s)
        Latency: 7 msec (7-7 msec ~7 msec)
< HCI Command: LE Set PHY (0x08|0x0032) plen 7              #94 [hci1] 7.327408
        Handle: 127 Address: 64:23:B5:94:C5:F1 (OUI 64-23-B5)
        All PHYs preference: 0x00
        TX PHYs preference: 0x02
          LE 2M
        RX PHYs preference: 0x02
          LE 2M
        PHY options preference: Reserved (0x0000)
> HCI Event: Command Status (0x0f) plen 4                   #95 [hci1] 7.327921
      LE Set PHY (0x08|0x0032) ncmd 1
        Status: Success (0x00)
> ACL Data RX: Handle 2250 flags 0x02 dlen 12               #96 [hci1] 7.354783
      SMP: Identity Address Information (0x09) len 7
        Address: DF:A9:FF:F6:B1:1A (OUI DF-A9-FF)
< HCI Command: LE Add Device To Re.. (0x08|0x0027) plen 39  #97 [hci1] 7.367543
        Address type: Public (0x00)
        Address: DF:A9:FF:F6:B1:1A (OUI DF-A9-FF)
        Peer identity resolving key: 8aff58d2c2086474c778d61b1ed0f876
        Local identity resolving key: 08aad2e1be87e47b88aeb19de6889efb
> HCI Event: Command Complete (0x0e) plen 4                 #98 [hci1] 7.368551
      LE Add Device To Resolving List (0x08|0x0027) ncmd 1
        Status: Success (0x00)
> ACL Data RX: Handle 127 flags 0x02 dlen 7                 #99 [hci1] 7.384853
      ATT: Exchange MTU Response (0x03) len 2
        Server RX MTU: 23
< HCI Command: LE Set Privacy Mode (0x08|0x004e) plen 8    #100 [hci1] 7.387469
        Peer Identity address type: Public (0x00)
        Peer Identity address: DF:A9:FF:F6:B1:1A (OUI DF-A9-FF)
        Privacy Mode: Use Device Privacy (0x01)
> HCI Event: Command Complete (0x0e) plen 4                #101 [hci1] 7.388087
      LE Set Privacy Mode (0x08|0x004e) ncmd 1
        Status: Success (0x00)
< HCI Command: LE Set Address Reso.. (0x08|0x002d) plen 1  #102 [hci1] 7.407523
        Address resolution: Enabled (0x01)
> HCI Event: Command Complete (0x0e) plen 4                #103 [hci1] 7.408168
      LE Set Address Resolution Enable (0x08|0x002d) ncmd 1
        Status: Success (0x00)
< HCI Command: Host Number of Comp.. (0x03|0x0035) plen 5  #104 [hci1] 7.427681
        Num handles: 1
        Handle: 2250 Address: DF:A9:FF:F6:B1:1A (OUI DF-A9-FF)
        Count: 1
< ACL Data TX: Handle 2250 flags 0x00 dlen 21              #105 [hci1] 7.427859
      SMP: Identity Information (0x08) len 16
        Identity resolving key: 08aad2e1be87e47b88aeb19de6889efb
< ACL Data TX: Handle 2250 flags 0x00 dlen 12              #106 [hci1] 7.428138
      SMP: Identity Address Information (0x09) len 7
        Address: D5:B6:CC:31:DB:3B (Static)
< HCI Command: Host Number of Comp.. (0x03|0x0035) plen 5  #107 [hci1] 7.428368
        Num handles: 1
        Handle: 127 Address: 64:23:B5:94:C5:F1 (OUI 64-23-B5)
        Count: 1
> HCI Event: LE Meta Event (0x3e) plen 12                  #108 [hci1] 7.454788
      LE Read Remote Used Features (0x04)
        Status: Success (0x00)
        Handle: 127 Address: 64:23:B5:94:C5:F1 (OUI 64-23-B5)
        Features: 0x2d 0x49 0x00 0xf7 0x67 0xd9 0x00 0x80
          LE Encryption
          Extended Reject Indication
          Peripheral-initiated Features Exchange
          LE Data Packet Length Extension
          LE 2M PHY
          LE Coded PHY
          Channel Selection Algorithm #2
          Periodic Advertising Sync Transfer - Sender
          Periodic Advertising Sync Transfer - Recipient
          Sleep Clock Accuracy Updates
          Connected Isochronous Stream - Central
          Connected Isochronous Stream - Peripheral
          Isochronous Broadcaster
          Synchronized Receiver
          Connected Isochronous Stream (Host Support)
          LE Power Control Request
          LE Power Control Request
          Connection Subrating
          Connection Subrating (Host Support)
          Unknown features (0x8000d90000000000)
> HCI Event: Number of Completed Packets (0x13) plen 5     #109 [hci1] 7.494704
        Num handles: 1
        Handle: 2250 Address: DF:A9:FF:F6:B1:1A (OUI DF-A9-FF)
        Count: 1
        #105: len 21 (2 Kb/s)
        Latency: 66 msec (56-67 msec ~62 msec)
> HCI Event: Number of Completed Packets (0x13) plen 5     #110 [hci1] 7.495133
        Num handles: 1
        Handle: 2250 Address: DF:A9:FF:F6:B1:1A (OUI DF-A9-FF)
        Count: 1
        #106: len 12 (1 Kb/s)
        Latency: 66 msec (56-67 msec ~64 msec)
< ACL Data TX: Handle 2250 flags 0x00 dlen 11              #111 [hci1] 7.507812
      ATT: Read By Type Request (0x08) len 6
        Handle range: 0x0001-0xffff
        Attribute type: Central Address Resolution (0x2aa6)
> HCI Event: Number of Completed Packets (0x13) plen 5     #112 [hci1] 7.564671
        Num handles: 1
        Handle: 2250 Address: DF:A9:FF:F6:B1:1A (OUI DF-A9-FF)
        Count: 1
        #111: len 11 (1 Kb/s)
        Latency: 56 msec (56-67 msec ~60 msec)
> ACL Data RX: Handle 2250 flags 0x02 dlen 9               #113 [hci1] 7.634688
      ATT: Read By Type Response (0x09) len 4
        Attribute data length: 3
        Attribute data list: 1 entry
        Handle: 0x000f
        Value: 01
< HCI Command: Host Number of Comp.. (0x03|0x0035) plen 5  #114 [hci1] 7.648042
        Num handles: 1
        Handle: 2250 Address: DF:A9:FF:F6:B1:1A (OUI DF-A9-FF)
        Count: 1
> HCI Event: LE Meta Event (0x3e) plen 6                   #115 [hci1] 8.154202
      LE PHY Update Complete (0x0c)
        Status: Success (0x00)
        Handle: 127 Address: 64:23:B5:94:C5:F1 (OUI 64-23-B5)
        TX PHY: LE 2M (0x02)
        RX PHY: LE 2M (0x02)
< ACL Data TX: Handle 127 flags 0x00 dlen 11              #116 [hci1] 17.457494
      SMP: Pairing Request (0x01) len 6
        IO capability: NoInputNoOutput (0x03)
        OOB data: Authentication data not present (0x00)
        Authentication requirement: Bonding, No MITM, SC, No Keypresses (0x09)
        Max encryption key size: 16
        Initiator key distribution: EncKey IdKey (0x03)
        Responder key distribution: EncKey IdKey (0x03)
> HCI Event: Number of Completed Packets (0x13) plen 5    #117 [hci1] 17.464425
        Num handles: 1
        Handle: 127 Address: 64:23:B5:94:C5:F1 (OUI 64-23-B5)
        Count: 1
        #116: len 11 (14 Kb/s)
        Latency: 6 msec (6-7 msec ~6 msec)
> ACL Data RX: Handle 127 flags 0x02 dlen 11              #118 [hci1] 17.534506
      SMP: Pairing Response (0x02) len 6
        IO capability: KeyboardDisplay (0x04)
        OOB data: Authentication data not present (0x00)
        Authentication requirement: Bonding, No MITM, SC, No Keypresses (0x09)
        Max encryption key size: 16
        Initiator key distribution: EncKey IdKey (0x03)
        Responder key distribution: EncKey IdKey (0x03)
< HCI Command: Host Number of Com.. (0x03|0x0035) plen 5  #119 [hci1] 17.547522
        Num handles: 1
        Handle: 127 Address: 64:23:B5:94:C5:F1 (OUI 64-23-B5)
        Count: 1
< ACL Data TX: Handle 127 flags 0x00 dlen 27              #120 [hci1] 17.547588
< ACL Data TX: Handle 127 flags 0x01 dlen 27              #121 [hci1] 17.547590
< ACL Data TX: Handle 127 flags 0x01 dlen 15              #122 [hci1] 17.547591
      SMP: Pairing Public Key (0x0c) len 64
        X: 68f6ada634ce84d11617383d57f070fe3445c38b33b569efa5eb771a0dc8aea5
        Y: 83c407aaa8337331fdc418e55085d75e6c1c6e5d42f8bf9c18fb5a2a7d4f31aa
> HCI Event: Number of Completed Packets (0x13) plen 5    #123 [hci1] 17.604474
        Num handles: 1
        Handle: 127 Address: 64:23:B5:94:C5:F1 (OUI 64-23-B5)
        Count: 1
        #120: len 27 (3 Kb/s)
        Latency: 56 msec (6-56 msec ~31 msec)
> HCI Event: Number of Completed Packets (0x13) plen 5    #124 [hci1] 17.604881
        Num handles: 1
        Handle: 127 Address: 64:23:B5:94:C5:F1 (OUI 64-23-B5)
        Count: 1
        #121: len 27 (3 Kb/s)
        Latency: 57 msec (6-57 msec ~44 msec)
> HCI Event: Number of Completed Packets (0x13) plen 5    #125 [hci1] 17.605409
        Num handles: 1
        Handle: 127 Address: 64:23:B5:94:C5:F1 (OUI 64-23-B5)
        Count: 1
        #122: len 15 (2 Kb/s)
        Latency: 57 msec (6-57 msec ~51 msec)
> ACL Data RX: Handle 127 flags 0x02 dlen 27              #126 [hci1] 17.674659
> ACL Data RX: Handle 127 flags 0x01 dlen 27              #127 [hci1] 17.675188
> ACL Data RX: Handle 127 flags 0x01 dlen 15              #128 [hci1] 17.675540
      SMP: Pairing Public Key (0x0c) len 64
        X: 574f2a41d70f659154a7a33f2c741fe3588670ea02716d1165fae0a06874e29d
        Y: 3ed86665f41b058f2a4cf531ac87d95523c8d8a5f51d923b2b43002cf4552e89
< HCI Command: Host Number of Com.. (0x03|0x0035) plen 5  #129 [hci1] 17.687484
        Num handles: 1
        Handle: 127 Address: 64:23:B5:94:C5:F1 (OUI 64-23-B5)
        Count: 1
< HCI Command: Host Number of Com.. (0x03|0x0035) plen 5  #130 [hci1] 17.687567
        Num handles: 1
        Handle: 127 Address: 64:23:B5:94:C5:F1 (OUI 64-23-B5)
        Count: 1
< HCI Command: Host Number of Com.. (0x03|0x0035) plen 5  #131 [hci1] 17.687571
        Num handles: 1
        Handle: 127 Address: 64:23:B5:94:C5:F1 (OUI 64-23-B5)
        Count: 1
> ACL Data RX: Handle 127 flags 0x02 dlen 21              #132 [hci1] 17.744625
      SMP: Pairing Confirm (0x03) len 16
        Confim value: 10991370ba749a808f02679ec969213e
< HCI Command: Host Number of Com.. (0x03|0x0035) plen 5  #133 [hci1] 17.747489
        Num handles: 1
        Handle: 127 Address: 64:23:B5:94:C5:F1 (OUI 64-23-B5)
        Count: 1
< ACL Data TX: Handle 127 flags 0x00 dlen 21              #134 [hci1] 17.747499
      SMP: Pairing Random (0x04) len 16
        Random value: 1ec8845e8286bc235a02440d0c3424a2
> HCI Event: Number of Completed Packets (0x13) plen 5    #135 [hci1] 17.814422
        Num handles: 1
        Handle: 127 Address: 64:23:B5:94:C5:F1 (OUI 64-23-B5)
        Count: 1
        #134: len 21 (2 Kb/s)
        Latency: 66 msec (6-66 msec ~59 msec)
> ACL Data RX: Handle 127 flags 0x02 dlen 21              #136 [hci1] 17.884647
      SMP: Pairing Random (0x04) len 16
        Random value: bede007c101dc1550000000000000000
< HCI Command: Host Number of Com.. (0x03|0x0035) plen 5  #137 [hci1] 17.887552
        Num handles: 1
        Handle: 127 Address: 64:23:B5:94:C5:F1 (OUI 64-23-B5)
        Count: 1
< ACL Data TX: Handle 127 flags 0x00 dlen 21              #138 [hci1] 17.887583
      SMP: Pairing DHKey Check (0x0d) len 16
        E: 3f1366f398208d308cfbbe4d94c3aacc
> HCI Event: Number of Completed Packets (0x13) plen 5    #139 [hci1] 17.954473
        Num handles: 1
        Handle: 127 Address: 64:23:B5:94:C5:F1 (OUI 64-23-B5)
        Count: 1
        #138: len 21 (2 Kb/s)
        Latency: 66 msec (6-66 msec ~62 msec)
> ACL Data RX: Handle 127 flags 0x02 dlen 21              #140 [hci1] 18.164610
      SMP: Pairing DHKey Check (0x0d) len 16
        E: 2dac5464c1b9ac622b02513fc1032a32
< HCI Command: LE Start Encryption (0x08|0x0019) plen 28  #141 [hci1] 18.167669
        Handle: 127 Address: 64:23:B5:94:C5:F1 (OUI 64-23-B5)
        Random number: 0x0000000000000000
        Encrypted diversifier: 0x0000
        Long term key: 08a81627a233d5607b8f961b32261770
> HCI Event: Command Status (0x0f) plen 4                 #142 [hci1] 18.168550
      LE Start Encryption (0x08|0x0019) ncmd 1
        Status: Success (0x00)
< HCI Command: Host Number of Com.. (0x03|0x0035) plen 5  #143 [hci1] 18.187435
        Num handles: 1
        Handle: 127 Address: 64:23:B5:94:C5:F1 (OUI 64-23-B5)
        Count: 1
> HCI Event: Encryption Change (0x08) plen 4              #144 [hci1] 18.654403
        Status: Success (0x00)
        Handle: 127 Address: 64:23:B5:94:C5:F1 (OUI 64-23-B5)
        Encryption: Enabled with AES-CCM (0x01)
< HCI Command: LE Extended Creat.. (0x08|0x0043) plen 26  #145 [hci1] 18.677494
        Filter policy: Accept list is not used (0x00)
        Own address type: Random (0x03)
        Peer address type: Public (0x00)
        Peer address: B8:7C:99:F9:E0:AE (OUI B8-7C-99)
        Initiating PHYs: 0x01
        Entry 0: LE 1M
          Scan interval: 60.000 msec (0x0060)
          Scan window: 60.000 msec (0x0060)
          Min connection interval: 50.00 msec (0x0028)
          Max connection interval: 70.00 msec (0x0038)
          Connection latency: 0 (0x0000)
          Supervision timeout: 4000 msec (0x0190)
          Min connection length: 0.000 msec (0x0000)
          Max connection length: 0.000 msec (0x0000)
> HCI Event: Command Status (0x0f) plen 4                 #146 [hci1] 18.678531
      LE Extended Create Connection (0x08|0x0043) ncmd 1
        Status: Success (0x00)
> HCI Event: LE Meta Event (0x3e) plen 31                 #147 [hci1] 18.717995
      LE Enhanced Connection Complete (0x0a)
        Status: Success (0x00)
        Handle: 56
        Role: Central (0x00)
        Peer address type: Public (0x00)
        Peer address: B8:7C:99:F9:E0:AE (OUI B8-7C-99)
        Local resolvable private address: 48:61:8E:DB:C6:F9 (Resolvable)
          Identity type: Random (0x01)
          Identity: D5:B6:CC:31:DB:3B (Static)
        Peer resolvable private address: 00:00:00:00:00:00 (Non-Resolvable)
        Connection interval: 70.00 msec (0x0038)
        Connection latency: 0 (0x0000)
        Supervision timeout: 4000 msec (0x0190)
        Central clock accuracy: 0x00
> ACL Data RX: Handle 127 flags 0x02 dlen 21              #148 [hci1] 18.724654
      SMP: Identity Information (0x08) len 16
        Identity resolving key: c6b5159990d580402b93cef75e338839
< HCI Command: LE Read Remote Use.. (0x08|0x0016) plen 2  #149 [hci1] 18.727675
        Handle: 56 Address: B8:7C:99:F9:E0:AE (OUI B8-7C-99)
< ACL Data TX: Handle 56 flags 0x00 dlen 7                #150 [hci1] 18.727683
      ATT: Exchange MTU Request (0x02) len 2
        Client RX MTU: 251
> HCI Event: Command Status (0x0f) plen 4                 #151 [hci1] 18.728187
      LE Read Remote Used Features (0x08|0x0016) ncmd 1
        Status: Success (0x00)
< HCI Command: LE Set PHY (0x08|0x0032) plen 7            #152 [hci1] 18.747457
        Handle: 56 Address: B8:7C:99:F9:E0:AE (OUI B8-7C-99)
        All PHYs preference: 0x00
        TX PHYs preference: 0x02
          LE 2M
        RX PHYs preference: 0x02
          LE 2M
        PHY options preference: Reserved (0x0000)
> HCI Event: Command Status (0x0f) plen 4                 #153 [hci1] 18.747916
      LE Set PHY (0x08|0x0032) ncmd 1
        Status: Success (0x00)
> HCI Event: Number of Completed Packets (0x13) plen 5    #154 [hci1] 18.754504
        Num handles: 1
        Handle: 56 Address: B8:7C:99:F9:E0:AE (OUI B8-7C-99)
        Count: 1
        #150: len 7 (2 Kb/s)
        Latency: 26 msec (26-26 msec ~26 msec)
< HCI Command: Host Number of Com.. (0x03|0x0035) plen 5  #155 [hci1] 18.767584
        Num handles: 1
        Handle: 127 Address: 64:23:B5:94:C5:F1 (OUI 64-23-B5)
        Count: 1
> ACL Data RX: Handle 127 flags 0x02 dlen 12              #156 [hci1] 18.794526
      SMP: Identity Address Information (0x09) len 7
        Address: 64:23:B5:94:C5:F1 (OUI 64-23-B5)
< HCI Command: LE Set Address Res.. (0x08|0x002d) plen 1  #157 [hci1] 18.807597
        Address resolution: Disabled (0x00)
> HCI Event: Command Complete (0x0e) plen 4               #158 [hci1] 18.808149
      LE Set Address Resolution Enable (0x08|0x002d) ncmd 1
        Status: Success (0x00)
> ACL Data RX: Handle 56 flags 0x02 dlen 7                #159 [hci1] 18.824609
      ATT: Exchange MTU Response (0x03) len 2
        Server RX MTU: 23
< HCI Command: LE Add Device To... (0x08|0x0027) plen 39  #160 [hci1] 18.827471
        Address type: Public (0x00)
        Address: 64:23:B5:94:C5:F1 (OUI 64-23-B5)
        Peer identity resolving key: c6b5159990d580402b93cef75e338839
        Local identity resolving key: 08aad2e1be87e47b88aeb19de6889efb
> HCI Event: Command Complete (0x0e) plen 4               #161 [hci1] 18.828434
      LE Add Device To Resolving List (0x08|0x0027) ncmd 1
        Status: Success (0x00)
< HCI Command: LE Set Privacy Mode (0x08|0x004e) plen 8   #162 [hci1] 18.847537
        Peer Identity address type: Public (0x00)
        Peer Identity address: 64:23:B5:94:C5:F1 (OUI 64-23-B5)
        Privacy Mode: Use Device Privacy (0x01)
> HCI Event: Command Complete (0x0e) plen 4               #163 [hci1] 18.848083
      LE Set Privacy Mode (0x08|0x004e) ncmd 1
        Status: Success (0x00)
< HCI Command: LE Set Address Res.. (0x08|0x002d) plen 1  #164 [hci1] 18.867527
        Address resolution: Enabled (0x01)
> HCI Event: Command Complete (0x0e) plen 4               #165 [hci1] 18.867925
      LE Set Address Resolution Enable (0x08|0x002d) ncmd 1
        Status: Success (0x00)
< HCI Command: Host Number of Com.. (0x03|0x0035) plen 5  #166 [hci1] 18.888291
        Num handles: 1
        Handle: 127 Address: 64:23:B5:94:C5:F1 (OUI 64-23-B5)
        Count: 1
< ACL Data TX: Handle 127 flags 0x00 dlen 21              #167 [hci1] 18.888317
      SMP: Identity Information (0x08) len 16
        Identity resolving key: 08aad2e1be87e47b88aeb19de6889efb
< ACL Data TX: Handle 127 flags 0x00 dlen 12              #168 [hci1] 18.888346
      SMP: Identity Address Information (0x09) len 7
        Address: D5:B6:CC:31:DB:3B (Static)
< HCI Command: Host Number of Com.. (0x03|0x0035) plen 5  #169 [hci1] 18.888369
        Num handles: 1
        Handle: 56 Address: B8:7C:99:F9:E0:AE (OUI B8-7C-99)
        Count: 1
> HCI Event: LE Meta Event (0x3e) plen 12                 #170 [hci1] 18.894678
      LE Read Remote Used Features (0x04)
        Status: Success (0x00)
        Handle: 56 Address: B8:7C:99:F9:E0:AE (OUI B8-7C-99)
        Features: 0x2d 0x49 0x00 0xf7 0x67 0xd9 0x00 0x80
          LE Encryption
          Extended Reject Indication
          Peripheral-initiated Features Exchange
          LE Data Packet Length Extension
          LE 2M PHY
          LE Coded PHY
          Channel Selection Algorithm #2
          Periodic Advertising Sync Transfer - Sender
          Periodic Advertising Sync Transfer - Recipient
          Sleep Clock Accuracy Updates
          Connected Isochronous Stream - Central
          Connected Isochronous Stream - Peripheral
          Isochronous Broadcaster
          Synchronized Receiver
          Connected Isochronous Stream (Host Support)
          LE Power Control Request
          LE Power Control Request
          Connection Subrating
          Connection Subrating (Host Support)
          Unknown features (0x8000d90000000000)
> HCI Event: Number of Completed Packets (0x13) plen 5    #171 [hci1] 18.934317
        Num handles: 1
        Handle: 127 Address: 64:23:B5:94:C5:F1 (OUI 64-23-B5)
        Count: 1
        #167: len 21 (3 Kb/s)
        Latency: 46 msec (6-66 msec ~54 msec)
> HCI Event: Number of Completed Packets (0x13) plen 5    #172 [hci1] 18.934889
        Num handles: 1
        Handle: 127 Address: 64:23:B5:94:C5:F1 (OUI 64-23-B5)
        Count: 1
        #168: len 12 (2 Kb/s)
        Latency: 46 msec (6-66 msec ~50 msec)
< ACL Data TX: Handle 127 flags 0x00 dlen 11              #173 [hci1] 18.947350
      ATT: Read By Type Request (0x08) len 6
        Handle range: 0x000f-0xffff
        Attribute type: Central Address Resolution (0x2aa6)
> HCI Event: Number of Completed Packets (0x13) plen 5    #174 [hci1] 19.004388
        Num handles: 1
        Handle: 127 Address: 64:23:B5:94:C5:F1 (OUI 64-23-B5)
        Count: 1
        #173: len 11 (1 Kb/s)
        Latency: 57 msec (6-66 msec ~53 msec)
> ACL Data RX: Handle 127 flags 0x02 dlen 9               #175 [hci1] 19.074435
      ATT: Read By Type Response (0x09) len 4
        Attribute data length: 3
        Attribute data list: 1 entry
        Handle: 0x000f
        Value: 01
< HCI Command: Host Number of Com.. (0x03|0x0035) plen 5  #176 [hci1] 19.087608
        Num handles: 1
        Handle: 127 Address: 64:23:B5:94:C5:F1 (OUI 64-23-B5)
        Count: 1
> HCI Event: LE Meta Event (0x3e) plen 6                  #177 [hci1] 19.593982
      LE PHY Update Complete (0x0c)
        Status: Success (0x00)
        Handle: 56 Address: B8:7C:99:F9:E0:AE (OUI B8-7C-99)
        TX PHY: LE 2M (0x02)
        RX PHY: LE 2M (0x02)
< ACL Data TX: Handle 56 flags 0x00 dlen 11               #178 [hci1] 28.837670
      SMP: Pairing Request (0x01) len 6
        IO capability: NoInputNoOutput (0x03)
        OOB data: Authentication data not present (0x00)
        Authentication requirement: Bonding, No MITM, SC, No Keypresses (0x09)
        Max encryption key size: 16
        Initiator key distribution: EncKey IdKey (0x03)
        Responder key distribution: EncKey IdKey (0x03)
> HCI Event: Number of Completed Packets (0x13) plen 5    #179 [hci1] 28.904241
        Num handles: 1
        Handle: 56 Address: B8:7C:99:F9:E0:AE (OUI B8-7C-99)
        Count: 1
        #178: len 11 (1 Kb/s)
        Latency: 66 msec (26-66 msec ~46 msec)
> ACL Data RX: Handle 56 flags 0x02 dlen 11               #180 [hci1] 28.974300
      SMP: Pairing Response (0x02) len 6
        IO capability: KeyboardDisplay (0x04)
        OOB data: Authentication data not present (0x00)
        Authentication requirement: Bonding, No MITM, SC, No Keypresses (0x09)
        Max encryption key size: 16
        Initiator key distribution: EncKey IdKey (0x03)
        Responder key distribution: EncKey IdKey (0x03)
< HCI Command: Host Number of Com.. (0x03|0x0035) plen 5  #181 [hci1] 28.987606
        Num handles: 1
        Handle: 56 Address: B8:7C:99:F9:E0:AE (OUI B8-7C-99)
        Count: 1
< ACL Data TX: Handle 56 flags 0x00 dlen 27               #182 [hci1] 28.987635
< ACL Data TX: Handle 56 flags 0x01 dlen 27               #183 [hci1] 28.987680
< ACL Data TX: Handle 56 flags 0x01 dlen 15               #184 [hci1] 28.987685
      SMP: Pairing Public Key (0x0c) len 64
        X: 68f6ada634ce84d11617383d57f070fe3445c38b33b569efa5eb771a0dc8aea5
        Y: 83c407aaa8337331fdc418e55085d75e6c1c6e5d42f8bf9c18fb5a2a7d4f31aa
> HCI Event: Number of Completed Packets (0x13) plen 5    #185 [hci1] 29.044241
        Num handles: 1
        Handle: 56 Address: B8:7C:99:F9:E0:AE (OUI B8-7C-99)
        Count: 1
        #182: len 27 (3 Kb/s)
        Latency: 56 msec (26-66 msec ~51 msec)
> HCI Event: Number of Completed Packets (0x13) plen 5    #186 [hci1] 29.044697
        Num handles: 1
        Handle: 56 Address: B8:7C:99:F9:E0:AE (OUI B8-7C-99)
        Count: 1
        #183: len 27 (3 Kb/s)
        Latency: 57 msec (26-66 msec ~54 msec)
> HCI Event: Number of Completed Packets (0x13) plen 5    #187 [hci1] 29.045129
        Num handles: 1
        Handle: 56 Address: B8:7C:99:F9:E0:AE (OUI B8-7C-99)
        Count: 1
        #184: len 15 (2 Kb/s)
        Latency: 57 msec (26-66 msec ~55 msec)
> ACL Data RX: Handle 56 flags 0x02 dlen 27               #188 [hci1] 29.114462
> ACL Data RX: Handle 56 flags 0x01 dlen 27               #189 [hci1] 29.114949
> ACL Data RX: Handle 56 flags 0x01 dlen 15               #190 [hci1] 29.115283
      SMP: Pairing Public Key (0x0c) len 64
        X: 954fee3101e522a1fc64a06e87934e08069e3553d61c50897adffc7c157a7604
        Y: 248ce563b91dcd9c56b3269595bcd0e868b760ed4e41b41498b36af4e107eec9
> ACL Data RX: Handle 56 flags 0x02 dlen 21               #191 [hci1] 29.115800
      SMP: Pairing Confirm (0x03) len 16
        Confim value: 40adca2778435029183ffb34bcf63234
< HCI Command: Host Number of Com.. (0x03|0x0035) plen 5  #192 [hci1] 29.127785
        Num handles: 1
        Handle: 56 Address: B8:7C:99:F9:E0:AE (OUI B8-7C-99)
        Count: 1
< HCI Command: Host Number of Com.. (0x03|0x0035) plen 5  #193 [hci1] 29.127883
        Num handles: 1
        Handle: 56 Address: B8:7C:99:F9:E0:AE (OUI B8-7C-99)
        Count: 1
< HCI Command: Host Number of Com.. (0x03|0x0035) plen 5  #194 [hci1] 29.127887
        Num handles: 1
        Handle: 56 Address: B8:7C:99:F9:E0:AE (OUI B8-7C-99)
        Count: 1
< HCI Command: Host Number of Com.. (0x03|0x0035) plen 5  #195 [hci1] 29.128020
        Num handles: 1
        Handle: 56 Address: B8:7C:99:F9:E0:AE (OUI B8-7C-99)
        Count: 1
< ACL Data TX: Handle 56 flags 0x00 dlen 21               #196 [hci1] 29.128024
      SMP: Pairing Random (0x04) len 16
        Random value: fd71a45c4a1bcadd27bd58e945097b00
> HCI Event: Number of Completed Packets (0x13) plen 5    #197 [hci1] 29.184245
        Num handles: 1
        Handle: 56 Address: B8:7C:99:F9:E0:AE (OUI B8-7C-99)
        Count: 1
        #196: len 21 (3 Kb/s)
        Latency: 56 msec (26-66 msec ~56 msec)
> ACL Data RX: Handle 56 flags 0x02 dlen 21               #198 [hci1] 29.254389
      SMP: Pairing Random (0x04) len 16
        Random value: 7ffc62508787610b0000000000000000
< HCI Command: Host Number of Com.. (0x03|0x0035) plen 5  #199 [hci1] 29.267732
        Num handles: 1
        Handle: 56 Address: B8:7C:99:F9:E0:AE (OUI B8-7C-99)
        Count: 1
< ACL Data TX: Handle 56 flags 0x00 dlen 21               #200 [hci1] 29.267742
      SMP: Pairing DHKey Check (0x0d) len 16
        E: becf6780a154b91ef78ba0e2ddacf389
> HCI Event: Number of Completed Packets (0x13) plen 5    #201 [hci1] 29.324288
        Num handles: 1
        Handle: 56 Address: B8:7C:99:F9:E0:AE (OUI B8-7C-99)
        Count: 1
        #200: len 21 (3 Kb/s)
        Latency: 56 msec (26-66 msec ~56 msec)
> ACL Data RX: Handle 56 flags 0x02 dlen 21               #202 [hci1] 29.604374
      SMP: Pairing DHKey Check (0x0d) len 16
        E: 8376b78bf53de9a282cd0615cd495e74
< HCI Command: LE Start Encryption (0x08|0x0019) plen 28  #203 [hci1] 29.607684
        Handle: 56 Address: B8:7C:99:F9:E0:AE (OUI B8-7C-99)
        Random number: 0x0000000000000000
        Encrypted diversifier: 0x0000
        Long term key: 1d37feb2dd02dc8d3c0ed3f037325f97
> HCI Event: Command Status (0x0f) plen 4                 #204 [hci1] 29.608522
      LE Start Encryption (0x08|0x0019) ncmd 1
        Status: Success (0x00)
< HCI Command: Host Number of Com.. (0x03|0x0035) plen 5  #205 [hci1] 29.627545
        Num handles: 1
        Handle: 56 Address: B8:7C:99:F9:E0:AE (OUI B8-7C-99)
        Count: 1
> HCI Event: Encryption Change (0x08) plen 4              #206 [hci1] 30.094084
        Status: Success (0x00)
        Handle: 56 Address: B8:7C:99:F9:E0:AE (OUI B8-7C-99)
        Encryption: Enabled with AES-CCM (0x01)
> ACL Data RX: Handle 56 flags 0x02 dlen 21               #207 [hci1] 30.164342
      SMP: Identity Information (0x08) len 16
        Identity resolving key: 026cd2615da19b0c90aec6d49d9718fc
< HCI Command: Host Number of Com.. (0x03|0x0035) plen 5  #208 [hci1] 30.167556
        Num handles: 1
        Handle: 56 Address: B8:7C:99:F9:E0:AE (OUI B8-7C-99)
        Count: 1
> ACL Data RX: Handle 56 flags 0x02 dlen 12               #209 [hci1] 30.234298
      SMP: Identity Address Information (0x09) len 7
        Address: B8:7C:99:F9:E0:AE (OUI B8-7C-99)
< HCI Command: LE Set Address Res.. (0x08|0x002d) plen 1  #210 [hci1] 30.247575
        Address resolution: Disabled (0x00)
> HCI Event: Command Complete (0x0e) plen 4               #211 [hci1] 30.248011
      LE Set Address Resolution Enable (0x08|0x002d) ncmd 1
        Status: Success (0x00)
< HCI Command: LE Add Device To... (0x08|0x0027) plen 39  #212 [hci1] 30.267583
        Address type: Public (0x00)
        Address: B8:7C:99:F9:E0:AE (OUI B8-7C-99)
        Peer identity resolving key: 026cd2615da19b0c90aec6d49d9718fc
        Local identity resolving key: 08aad2e1be87e47b88aeb19de6889efb
