Bluetooth monitor ver 5.72
= Note: Linux version 7.0.0-31-generic (x86_64)                        0.225775
= Note: Bluetooth subsystem version 2.22                               0.225777
= New Index: 00:00:00:00:00:00 (Primary,UART,hci2)              [hci2] 0.225778
= New Index: 00:00:00:00:00:00 (Primary,UART,hci1)              [hci1] 0.225778
= New Index: 48:5F:99:8E:E0:64 (Primary,USB,hci0)               [hci0] 0.225779
= Open Index: 00:00:00:00:00:00                                 [hci1] 0.359187
= Index Info: 00:00:00:00:00:00 (Nordic Semiconductor ASA)      [hci1] 0.359196
@ USER Open: main (privileged) version 2.22            {0x0001} [hci1] 0.359203
< HCI Command: Reset (0x03|0x0003) plen 0                    #1 [hci1] 0.360052
> HCI Event: Command Complete (0x0e) plen 4                  #2 [hci1] 0.360551
      Reset (0x03|0x0003) ncmd 1
        Status: Success (0x00)
< HCI Command: Read Local Supported... (0x04|0x0003) plen 0  #3 [hci1] 0.378920
> HCI Event: Command Complete (0x0e) plen 12                 #4 [hci1] 0.379434
      Read Local Supported Features (0x04|0x0003) ncmd 1
        Status: Success (0x00)
        Features: 0x00 0x00 0x00 0x00 0x60 0x00 0x00 0x00
          BR/EDR Not Supported
          LE Supported (Controller)
< HCI Command: Read Local Version In.. (0x04|0x0001) plen 0  #5 [hci1] 0.398850
> HCI Event: Command Complete (0x0e) plen 12                 #6 [hci1] 0.399398
      Read Local Version Information (0x04|0x0001) ncmd 1
        Status: Success (0x00)
        HCI version: Reserved (0x11) - Revision 12345 (0x3039)
        LMP version: Reserved (0x11) - Subversion 12345 (0x3039)
        Manufacturer: Nordic Semiconductor ASA (89)
< HCI Command: Read Local Supported... (0x04|0x0002) plen 0  #7 [hci1] 0.418893
> HCI Event: Command Complete (0x0e) plen 68                 #8 [hci1] 0.420058
      Read Local Supported Commands (0x04|0x0002) ncmd 1
        Status: Success (0x00)
        Commands: 115 entries
          Disconnect (Octet 0 - Bit 5)
          Read Remote Version Information (Octet 2 - Bit 7)
          Set Event Mask (Octet 5 - Bit 6)
          Reset (Octet 5 - Bit 7)
          Read Connection Accept Timeout (Octet 7 - Bit 2)
          Write Connection Accept Timeout (Octet 7 - Bit 3)
          Read Transmit Power Level (Octet 10 - Bit 2)
          Set Controller To Host Flow Control (Octet 10 - Bit 5)
          Host Buffer Size (Octet 10 - Bit 6)
          Host Number of Completed Packets (Octet 10 - Bit 7)
          Read Local Version Information (Octet 14 - Bit 3)
          Read Local Supported Features (Octet 14 - Bit 5)
          Read BD ADDR (Octet 15 - Bit 1)
          Read RSSI (Octet 15 - Bit 5)
          Set Event Mask Page 2 (Octet 22 - Bit 2)
          LE Set Event Mask (Octet 25 - Bit 0)
          LE Read Buffer Size (Octet 25 - Bit 1)
          LE Read Local Supported Features (Octet 25 - Bit 2)
          LE Set Random Address (Octet 25 - Bit 4)
          LE Set Advertising Parameters (Octet 25 - Bit 5)
          LE Read Advertising Channel TX Power (Octet 25 - Bit 6)
          LE Set Advertising Data (Octet 25 - Bit 7)
          LE Set Scan Response Data (Octet 26 - Bit 0)
          LE Set Advertise Enable (Octet 26 - Bit 1)
          LE Set Scan Parameters (Octet 26 - Bit 2)
          LE Set Scan Enable (Octet 26 - Bit 3)
          LE Create Connection (Octet 26 - Bit 4)
          LE Create Connection Cancel (Octet 26 - Bit 5)
          LE Read Accept List Size (Octet 26 - Bit 6)
          LE Clear Accept List (Octet 26 - Bit 7)
          LE Add Device To Accept List (Octet 27 - Bit 0)
          LE Remove Device From Accept List (Octet 27 - Bit 1)
          LE Connection Update (Octet 27 - Bit 2)
          LE Set Host Channel Classification (Octet 27 - Bit 3)
          LE Read Channel Map (Octet 27 - Bit 4)
          LE Read Remote Used Features (Octet 27 - Bit 5)
          LE Encrypt (Octet 27 - Bit 6)
          LE Rand (Octet 27 - Bit 7)
          LE Start Encryption (Octet 28 - Bit 0)
          LE Long Term Key Request Reply (Octet 28 - Bit 1)
          LE Long Term Key Request Neg Reply (Octet 28 - Bit 2)
          LE Read Supported States (Octet 28 - Bit 3)
          Read Authenticated Payload Timeout (Octet 32 - Bit 4)
          Write Authenticated Payload Timeout (Octet 32 - Bit 5)
          LE Set Data Length (Octet 33 - Bit 6)
          LE Read Suggested Default Data Length (Octet 33 - Bit 7)
          LE Write Suggested Default Data Length (Octet 34 - Bit 0)
          LE Add Device To Resolving List (Octet 34 - Bit 3)
          LE Remove Device From Resolving List (Octet 34 - Bit 4)
          LE Clear Resolving List (Octet 34 - Bit 5)
          LE Read Resolving List Size (Octet 34 - Bit 6)
          LE Set Address Resolution Enable (Octet 35 - Bit 1)
          LE Set Resolvable Private Address Timeout (Octet 35 - Bit 2)
          LE Read Maximum Data Length (Octet 35 - Bit 3)
          LE Read PHY (Octet 35 - Bit 4)
          LE Set Default PHY (Octet 35 - Bit 5)
          LE Set PHY (Octet 35 - Bit 6)
          LE Set Advertising Set Random Address (Octet 36 - Bit 1)
          LE Set Extended Advertising Parameters (Octet 36 - Bit 2)
          LE Set Extended Advertising Data (Octet 36 - Bit 3)
          LE Set Extended Scan Response Data (Octet 36 - Bit 4)
          LE Set Extended Advertising Enable (Octet 36 - Bit 5)
          LE Read Maximum Advertising Data Length (Octet 36 - Bit 6)
          LE Read Number of Supported Advertising Sets (Octet 36 - Bit 7)
          LE Remove Advertising Set (Octet 37 - Bit 0)
          LE Clear Advertising Sets (Octet 37 - Bit 1)
          LE Set Periodic Advertising Parameters (Octet 37 - Bit 2)
          LE Set Periodic Advertising Data (Octet 37 - Bit 3)
          LE Set Periodic Advertising Enable (Octet 37 - Bit 4)
          LE Set Extended Scan Parameters (Octet 37 - Bit 5)
          LE Set Extended Scan Enable (Octet 37 - Bit 6)
          LE Extended Create Connection (Octet 37 - Bit 7)
          LE Periodic Advertising Create Sync (Octet 38 - Bit 0)
          LE Periodic Advertising Create Sync Cancel (Octet 38 - Bit 1)
          LE Periodic Advertising Terminate Sync (Octet 38 - Bit 2)
          LE Add Device To Periodic Advertiser List (Octet 38 - Bit 3)
          LE Remove Device From Periodic Advertiser List (Octet 38 - Bit 4)
          LE Clear Periodic Advertiser List (Octet 38 - Bit 5)
          LE Read Periodic Advertiser List Size (Octet 38 - Bit 6)
          LE Read Transmit Power (Octet 38 - Bit 7)
          LE Read RF Path Compensation (Octet 39 - Bit 0)
          LE Write RF Path Compensation (Octet 39 - Bit 1)
          LE Set Privacy Mode (Octet 39 - Bit 2)
          LE Periodic Advertising Receive Enable (Octet 40 - Bit 5)
          LE Periodic Advertising Sync Transfer (Octet 40 - Bit 6)
          LE Periodic Advertising Set Info Transfer (Octet 40 - Bit 7)
          LE Periodic Advertising Sync Transfer Parameters (Octet 41 - Bit 0)
          LE Set Default Periodic Advertisng Sync Transfer Parameters (Octet 41 - Bit 1)
          LE Read Buffer v2 (Octet 41 - Bit 5)
          LE Read ISO TX Sync (Octet 41 - Bit 6)
          LE Set Connected Isochronous Group Parameters (Octet 41 - Bit 7)
          LE Set Connected Isochronous Group Parameters Test (Octet 42 - Bit 0)
          LE Create Connected Isochronous Stream (Octet 42 - Bit 1)
          LE Remove Connected Isochronous Group (Octet 42 - Bit 2)
          LE Accept Connected Isochronous Stream Request (Octet 42 - Bit 3)
          LE Reject Connected Isochronous Stream Request (Octet 42 - Bit 4)
          LE Create Broadcast Isochronous Group (Octet 42 - Bit 5)
          LE Create Broadcast Isochronous Group Test (Octet 42 - Bit 6)
          LE Terminate Broadcast Isochronous Group (Octet 42 - Bit 7)
          LE Broadcast Isochronous Group Create Sync (Octet 43 - Bit 0)
          LE Broadcast Isochronous Group Terminate Sync (Octet 43 - Bit 1)
          LE Request Peer SCA (Octet 43 - Bit 2)
          LE Setup Isochronous Data Path (Octet 43 - Bit 3)
          LE Remove Isochronous Data Path (Octet 43 - Bit 4)
          LE Isochronous Transmit Test (Octet 43 - Bit 5)
          LE Isochronous Receive Test (Octet 43 - Bit 6)
          LE Isochronous Read Test Counters (Octet 43 - Bit 7)
          LE Isochronous Read Test Counters (Octet 44 - Bit 0)
          LE Set Host Feature (Octet 44 - Bit 1)
          Octet 44 - Bit 2 
          Octet 45 - Bit 6 
          Octet 46 - Bit 0 
          Octet 46 - Bit 1 
          Octet 46 - Bit 2 
          Octet 47 - Bit 4 
< HCI Command: Host Buffer Size (0x03|0x0033) plen 7         #9 [hci1] 0.438893
        ACL MTU: 255  ACL max packet: 16
        SCO MTU: 0    SCO max packet: 0
> HCI Event: Command Complete (0x0e) plen 4                 #10 [hci1] 0.439399
      Host Buffer Size (0x03|0x0033) ncmd 1
        Status: Success (0x00)
< HCI Command: Set Controller To Ho.. (0x03|0x0031) plen 1  #11 [hci1] 0.458898
        Flow control: ACL Data Packets (0x01)
> HCI Event: Command Complete (0x0e) plen 4                 #12 [hci1] 0.459414
      Set Controller To Host Flow Control (0x03|0x0031) ncmd 1
        Status: Success (0x00)
< HCI Command: LE Read Local Suppor.. (0x08|0x0003) plen 0  #13 [hci1] 0.478882
> HCI Event: Command Complete (0x0e) plen 12                #14 [hci1] 0.479336
      LE Read Local Supported Features (0x08|0x0003) ncmd 1
        Status: Success (0x00)
        Features: 0xfd 0x79 0x00 0xf7 0x30 0x01 0x00 0x00
          LE Encryption
          Extended Reject Indication
          Peripheral-initiated Features Exchange
          LE Ping
          LE Data Packet Length Extension
          LL Privacy
          Extended Scanner Filter Policies
          LE 2M PHY
          LE Coded PHY
          LE Extended Advertising
          LE Periodic Advertising
          Channel Selection Algorithm #2
          Periodic Advertising Sync Transfer - Sender
          Periodic Advertising Sync Transfer - Recipient
          Sleep Clock Accuracy Updates
          Connected Isochronous Stream - Central
          Connected Isochronous Stream - Peripheral
          Isochronous Broadcaster
          Synchronized Receiver
          Periodic Advertising ADI support
          Connection Subrating
          Unknown features (0x0000010000000000)
< HCI Command: LE Set Host Feature (0x08|0x0074) plen 2     #15 [hci1] 0.498857
        Bit Number: 32
          Connected Isochronous Stream (Host Support)
        Bit Value: 1
> HCI Event: Command Complete (0x0e) plen 4                 #16 [hci1] 0.499276
      LE Set Host Feature (0x08|0x0074) ncmd 1
        Status: Success (0x00)
< HCI Command: LE Read Buffer v2 (0x08|0x0060) plen 0       #17 [hci1] 0.518894
> HCI Event: Command Complete (0x0e) plen 10                #18 [hci1] 0.519469
      LE Read Buffer v2 (0x08|0x0060) ncmd 1
        Status: Success (0x00)
        ACL MTU: 27
        ACL max packet: 3
        ISO MTU: 318
        ISO max packet: 3
< HCI Command: LE Read Maximum Adve.. (0x08|0x003a) plen 0  #19 [hci1] 0.538923
> HCI Event: Command Complete (0x0e) plen 6                 #20 [hci1] 0.539352
      LE Read Maximum Advertising Data Length (0x08|0x003a) ncmd 1
        Status: Success (0x00)
        Max length: 1650
< HCI Command: LE Read Supported St.. (0x08|0x001c) plen 0  #21 [hci1] 0.558896
> HCI Event: Command Complete (0x0e) plen 12                #22 [hci1] 0.559342
      LE Read Supported States (0x08|0x001c) ncmd 1
        Status: Success (0x00)
        States: 0x000003ff3e0306ff
          Non-connectable Advertising State
          Scannable Advertising State
          Connectable Advertising State
          High Duty Cycle Directed Advertising State
          Passive Scanning State
          Active Scanning State
          Initiating State
            and Connection State (Central Role)
          Connection State (Peripheral Role)
          Scannable Advertising State
            and Passive Scanning State
          Connectable Advertising State
            and Passive Scanning State
          Non-connectable Advertising State
            and Initiating State
          Scannable Advertising State
            and Initiating State
          Active Scanning State
            and Connection State (Central Role)
          Passive Scanning State
            and Connection State (Peripheral Role)
          Active Scanning State
            and Connection State (Peripheral Role)
          Initiating State
            and Connection State (Central Role)
            and Central Role & Central Role
          Low Duty Cycle Directed Advertising State
          Connectable Advertising State
            and Initiating State
            and Central Role & Peripheral Role
          High Duty Cycle Directed Advertising State
            and Initiating State
            and Central Role & Peripheral Role
          Low Duty Cycle Directed Advertising State
            and Initiating State
            and Central Role & Peripheral Role
          Connectable Advertising State
            and Connection State (Central Role)
            and Central Role & Peripheral Role
          High Duty Cycle Directed Advertising State
            and Connection State (Central Role)
            and Central Role & Peripheral Role
          Low Duty Cycle Directed Advertising State
            and Connection State (Central Role)
            and Central Role & Peripheral Role
          Connectable Advertising State
            and Connection State (Peripheral Role)
            and Central Role & Peripheral Role
          High Duty Cycle Directed Advertising State
            and Connection State (Peripheral Role)
            and Peripheral Role & Peripheral Role
          Low Duty Cycle Directed Advertising State
            and Connection State (Peripheral Role)
            and Peripheral Role & Peripheral Role
          Initiating State
            and Connection State (Peripheral Role)
            and Central Role & Peripheral Role
< HCI Command: LE Read Maximum Data.. (0x08|0x002f) plen 0  #23 [hci1] 0.578899
> HCI Event: Command Complete (0x0e) plen 12                #24 [hci1] 0.579535
      LE Read Maximum Data Length (0x08|0x002f) ncmd 1
        Status: Success (0x00)
        Max TX octets: 251
        Max TX time: 2704
        Max RX octets: 251
        Max RX time: 2704
< HCI Command: LE Write Suggested D.. (0x08|0x0024) plen 4  #25 [hci1] 0.598899
        TX octets: 251
        TX time: 2704
> HCI Event: Command Complete (0x0e) plen 4                 #26 [hci1] 0.599419
      LE Write Suggested Default Data Length (0x08|0x0024) ncmd 1
        Status: Success (0x00)
< HCI Command: LE Set Resolvable Pr.. (0x08|0x002e) plen 2  #27 [hci1] 0.618890
        Timeout: 30 seconds
> HCI Event: Command Complete (0x0e) plen 4                 #28 [hci1] 0.619459
      LE Set Resolvable Private Address Timeout (0x08|0x002e) ncmd 1
        Status: Success (0x00)
< HCI Command: LE Read Resolving Li.. (0x08|0x002a) plen 0  #29 [hci1] 0.638886
> HCI Event: Command Complete (0x0e) plen 5                 #30 [hci1] 0.639337
      LE Read Resolving List Size (0x08|0x002a) ncmd 1
        Status: Success (0x00)
        Size: 8
< HCI Command: LE Set Host Feature (0x08|0x0074) plen 2     #31 [hci1] 0.658923
        Bit Number: 38
          Connection Subrating (Host Support)
        Bit Value: 1
> HCI Event: Command Complete (0x0e) plen 4                 #32 [hci1] 0.659367
      LE Set Host Feature (0x08|0x0074) ncmd 1
        Status: Success (0x00)
< HCI Command: LE Set Event Mask (0x08|0x0001) plen 8       #33 [hci1] 0.678886
        Mask: 0x000002063f87fa5e
          LE Advertising Report
          LE Connection Update Complete
          LE Read Remote Used Features Complete
          LE Long Term Key Request
          LE Data Length Change
          LE Enhanced Connection Complete
          LE PHY Update Complete
          LE Extended Advertising Report
          LE Periodic Advertising Sync Established
          LE Periodic Advertising Report
          LE Periodic Advertising Sync Lost
          LE Extended Scan Timeout
          LE Extended Advertising Set Terminated
          LE Scan Request Received
          LE Periodic Advertising Sync Transfer Rvc
          LE CIS Established
          LE CIS Request
          LE Create BIG Complete
          LE Terminate BIG Complete
          LE BIG Sync Estabilished Complete
          LE BIG Sync Lost
          LE BIG Info Advertising Report
          LE Subrate Change
          Unknown mask (0x0000020000000000)
> HCI Event: Command Complete (0x0e) plen 4                 #34 [hci1] 0.679504
      LE Set Event Mask (0x08|0x0001) ncmd 1
        Status: Success (0x00)
< HCI Command: Set Event Mask (0x03|0x0001) plen 8          #35 [hci1] 0.698903
        Mask: 0x2000800002008890
          Disconnection Complete
          Encryption Change
          Read Remote Version Information Complete
          Hardware Error
          Data Buffer Overflow
          Encryption Key Refresh Complete
          LE Meta
> HCI Event: Command Complete (0x0e) plen 4                 #36 [hci1] 0.699381
      Set Event Mask (0x03|0x0001) ncmd 1
        Status: Success (0x00)
< HCI Command: Read BD ADDR (0x04|0x0009) plen 0            #37 [hci1] 0.718895
> HCI Event: Command Complete (0x0e) plen 10                #38 [hci1] 0.719413
      Read BD ADDR (0x04|0x0009) ncmd 1
        Status: Success (0x00)
        Address: 00:00:00:00:00:00 (OUI 00-00-00)
< HCI Command: LE Set Random Address (0x08|0x0005) plen 6   #39 [hci1] 0.738900
        Address: D5:B6:CC:31:DB:3B (Static)
> HCI Event: Command Complete (0x0e) plen 4                 #40 [hci1] 0.739518
      LE Set Random Address (0x08|0x0005) ncmd 1
        Status: Success (0x00)
< HCI Command: LE Set Random Address (0x08|0x0005) plen 6   #41 [hci1] 0.779119
        Address: 48:61:8E:DB:C6:F9 (Resolvable)
> HCI Event: Command Complete (0x0e) plen 4                 #42 [hci1] 0.779648
      LE Set Random Address (0x08|0x0005) ncmd 1
        Status: Success (0x00)
< HCI Command: LE Extended Create... (0x08|0x0043) plen 26  #43 [hci1] 2.888937
        Filter policy: Accept list is not used (0x00)
        Own address type: Random (0x03)
        Peer address type: Public (0x00)
        Peer address: DF:A9:FF:F6:B1:1A (OUI DF-A9-FF)
        Initiating PHYs: 0x01
        Entry 0: LE 1M
          Scan interval: 60.000 msec (0x0060)
          Scan window: 60.000 msec (0x0060)
          Min connection interval: 30.00 msec (0x0018)
          Max connection interval: 50.00 msec (0x0028)
          Connection latency: 0 (0x0000)
          Supervision timeout: 4000 msec (0x0190)
          Min connection length: 0.000 msec (0x0000)
          Max connection length: 0.000 msec (0x0000)
> HCI Event: Command Status (0x0f) plen 4                   #44 [hci1] 2.889995
      LE Extended Create Connection (0x08|0x0043) ncmd 1
        Status: Success (0x00)
> HCI Event: LE Meta Event (0x3e) plen 31                   #45 [hci1] 2.912490
      LE Enhanced Connection Complete (0x0a)
        Status: Success (0x00)
        Handle: 738
        Role: Central (0x00)
        Peer address type: Public (0x00)
        Peer address: DF:A9:FF:F6:B1:1A (OUI DF-A9-FF)
        Local resolvable private address: 48:61:8E:DB:C6:F9 (Resolvable)
        Peer resolvable private address: 00:00:00:00:00:00 (Non-Resolvable)
        Connection interval: 50.00 msec (0x0028)
        Connection latency: 0 (0x0000)
        Supervision timeout: 4000 msec (0x0190)
        Central clock accuracy: 0x00
< HCI Command: LE Read Remote Used... (0x08|0x0016) plen 2  #46 [hci1] 2.919200
        Handle: 738 Address: DF:A9:FF:F6:B1:1A (OUI DF-A9-FF)
> HCI Event: Command Status (0x0f) plen 4                   #47 [hci1] 2.919744
      LE Read Remote Used Features (0x08|0x0016) ncmd 1
        Status: Success (0x00)
< HCI Command: LE Set PHY (0x08|0x0032) plen 7              #48 [hci1] 2.939042
        Handle: 738 Address: DF:A9:FF:F6:B1:1A (OUI DF-A9-FF)
        All PHYs preference: 0x00
        TX PHYs preference: 0x02
          LE 2M
        RX PHYs preference: 0x02
          LE 2M
        PHY options preference: Reserved (0x0000)
> HCI Event: Command Status (0x0f) plen 4                   #49 [hci1] 2.939672
      LE Set PHY (0x08|0x0032) ncmd 1
        Status: Success (0x00)
> HCI Event: LE Meta Event (0x3e) plen 12                   #50 [hci1] 3.064074
      LE Read Remote Used Features (0x04)
        Status: Success (0x00)
        Handle: 738 Address: DF:A9:FF:F6:B1:1A (OUI DF-A9-FF)
        Features: 0x2d 0x49 0x00 0xf7 0x67 0xd9 0x00 0x80
          LE Encryption
          Extended Reject Indication
          Peripheral-initiated Features Exchange
          LE Data Packet Length Extension
          LE 2M PHY
          LE Coded PHY
          Channel Selection Algorithm #2
          Periodic Advertising Sync Transfer - Sender
          Periodic Advertising Sync Transfer - Recipient
          Sleep Clock Accuracy Updates
          Connected Isochronous Stream - Central
          Connected Isochronous Stream - Peripheral
          Isochronous Broadcaster
          Synchronized Receiver
          Connected Isochronous Stream (Host Support)
          LE Power Control Request
          LE Power Control Request
          Connection Subrating
          Connection Subrating (Host Support)
          Unknown features (0x8000d90000000000)
> HCI Event: LE Meta Event (0x3e) plen 6                    #51 [hci1] 3.513368
      LE PHY Update Complete (0x0c)
        Status: Success (0x00)
        Handle: 738 Address: DF:A9:FF:F6:B1:1A (OUI DF-A9-FF)
        TX PHY: LE 2M (0x02)
        RX PHY: LE 2M (0x02)
< ACL Data TX: Handle 738 flags 0x00 dlen 11                #52 [hci1] 4.019630
      SMP: Pairing Request (0x01) len 6
        IO capability: DisplayOnly (0x00)
        OOB data: Authentication data not present (0x00)
        Authentication requirement: Bonding, No MITM, SC, No Keypresses (0x09)
        Max encryption key size: 16
        Initiator key distribution: EncKey IdKey (0x03)
        Responder key distribution: EncKey IdKey (0x03)
> HCI Event: Number of Completed Packets (0x13) plen 5      #53 [hci1] 4.063820
        Num handles: 1
        Handle: 738 Address: DF:A9:FF:F6:B1:1A (OUI DF-A9-FF)
        Count: 1
        #52: len 11 (2 Kb/s)
        Latency: 44 msec (44-44 msec ~44 msec)
> ACL Data RX: Handle 738 flags 0x02 dlen 11                #54 [hci1] 4.113878
      SMP: Pairing Response (0x02) len 6
        IO capability: KeyboardDisplay (0x04)
        OOB data: Authentication data not present (0x00)
        Authentication requirement: Bonding, MITM, SC, No Keypresses (0x0d)
        Max encryption key size: 16
        Initiator key distribution: IdKey (0x02)
        Responder key distribution: <none> (0x00)
< HCI Command: Host Number of Compl.. (0x03|0x0035) plen 5  #55 [hci1] 4.119473
        Num handles: 1
        Handle: 738 Address: DF:A9:FF:F6:B1:1A (OUI DF-A9-FF)
        Count: 1
< ACL Data TX: Handle 738 flags 0x00 dlen 27                #56 [hci1] 4.119558
< ACL Data TX: Handle 738 flags 0x01 dlen 27                #57 [hci1] 4.119607
< ACL Data TX: Handle 738 flags 0x01 dlen 15                #58 [hci1] 4.119615
      SMP: Pairing Public Key (0x0c) len 64
        X: 68f6ada634ce84d11617383d57f070fe3445c38b33b569efa5eb771a0dc8aea5
        Y: 83c407aaa8337331fdc418e55085d75e6c1c6e5d42f8bf9c18fb5a2a7d4f31aa
> HCI Event: Number of Completed Packets (0x13) plen 5      #59 [hci1] 4.163944
        Num handles: 1
        Handle: 738 Address: DF:A9:FF:F6:B1:1A (OUI DF-A9-FF)
        Count: 1
        #56: len 27 (4 Kb/s)
        Latency: 44 msec (44-44 msec ~44 msec)
> HCI Event: Number of Completed Packets (0x13) plen 5      #60 [hci1] 4.164328
        Num handles: 1
        Handle: 738 Address: DF:A9:FF:F6:B1:1A (OUI DF-A9-FF)
        Count: 1
        #57: len 27 (4 Kb/s)
        Latency: 44 msec (44-44 msec ~44 msec)
> HCI Event: Number of Completed Packets (0x13) plen 5      #61 [hci1] 4.164786
        Num handles: 1
        Handle: 738 Address: DF:A9:FF:F6:B1:1A (OUI DF-A9-FF)
        Count: 1
        #58: len 15 (2 Kb/s)
        Latency: 45 msec (44-45 msec ~44 msec)
> ACL Data RX: Handle 738 flags 0x02 dlen 27                #62 [hci1] 4.214237
> ACL Data RX: Handle 738 flags 0x01 dlen 27                #63 [hci1] 4.214551
> ACL Data RX: Handle 738 flags 0x01 dlen 15                #64 [hci1] 4.214963
      SMP: Pairing Public Key (0x0c) len 64
        X: 510a4653d88c056b2f48703d15285f2061eae62ab943f009d463c407e77f110a
        Y: 59a04e688e870dc18816a2a565c474fbde57f4418be9111c571913c3339cec3e
< HCI Command: Host Number of Compl.. (0x03|0x0035) plen 5  #65 [hci1] 4.219065
        Num handles: 1
        Handle: 738 Address: DF:A9:FF:F6:B1:1A (OUI DF-A9-FF)
        Count: 1
< HCI Command: Host Number of Compl.. (0x03|0x0035) plen 5  #66 [hci1] 4.219070
        Num handles: 1
        Handle: 738 Address: DF:A9:FF:F6:B1:1A (OUI DF-A9-FF)
        Count: 1
< HCI Command: Host Number of Compl.. (0x03|0x0035) plen 5  #67 [hci1] 4.219246
        Num handles: 1
        Handle: 738 Address: DF:A9:FF:F6:B1:1A (OUI DF-A9-FF)
        Count: 1
< ACL Data TX: Handle 738 flags 0x00 dlen 21                #68 [hci1] 4.219275
      SMP: Pairing Confirm (0x03) len 16
        Confim value: bb03ac3e0fc512a33a145c71d3f06e47
> HCI Event: Number of Completed Packets (0x13) plen 5      #69 [hci1] 4.263841
        Num handles: 1
        Handle: 738 Address: DF:A9:FF:F6:B1:1A (OUI DF-A9-FF)
        Count: 1
        #68: len 21 (3 Kb/s)
        Latency: 44 msec (44-45 msec ~44 msec)
> ACL Data RX: Handle 738 flags 0x02 dlen 21                #70 [hci1] 5.064116
      SMP: Pairing Confirm (0x03) len 16
        Confim value: f10e0432d982a20f99a4089583a401eb
< HCI Command: Host Number of Compl.. (0x03|0x0035) plen 5  #71 [hci1] 5.079110
        Num handles: 1
        Handle: 738 Address: DF:A9:FF:F6:B1:1A (OUI DF-A9-FF)
        Count: 1
< ACL Data TX: Handle 738 flags 0x00 dlen 21                #72 [hci1] 5.079145
      SMP: Pairing Random (0x04) len 16
        Random value: 555cc64d02679f89a05211af56d8b3da
> HCI Event: Number of Completed Packets (0x13) plen 5      #73 [hci1] 5.113799
        Num handles: 1
        Handle: 738 Address: DF:A9:FF:F6:B1:1A (OUI DF-A9-FF)
        Count: 1
        #72: len 21 (4 Kb/s)
        Latency: 34 msec (34-45 msec ~39 msec)
> ACL Data RX: Handle 738 flags 0x02 dlen 21                #74 [hci1] 5.363997
      SMP: Pairing Random (0x04) len 16
        Random value: 43cdebe7d3d805a1b75a6a6b82eb85e1
< HCI Command: Host Number of Compl.. (0x03|0x0035) plen 5  #75 [hci1] 5.379707
        Num handles: 1
        Handle: 738 Address: DF:A9:FF:F6:B1:1A (OUI DF-A9-FF)
        Count: 1
< ACL Data TX: Handle 738 flags 0x00 dlen 21                #76 [hci1] 5.379816
      SMP: Pairing Confirm (0x03) len 16
        Confim value: c6e7f7b1ab28390fe3cab5d6e852a4d5
> HCI Event: Number of Completed Packets (0x13) plen 5      #77 [hci1] 5.413927
        Num handles: 1
        Handle: 738 Address: DF:A9:FF:F6:B1:1A (OUI DF-A9-FF)
        Count: 1
        #76: len 21 (4 Kb/s)
        Latency: 34 msec (34-45 msec ~36 msec)
> ACL Data RX: Handle 738 flags 0x02 dlen 21                #78 [hci1] 5.464054
      SMP: Pairing Confirm (0x03) len 16
        Confim value: 6381b69a2e13eb1ff21c2e0010dedf76
< HCI Command: Host Number of Compl.. (0x03|0x0035) plen 5  #79 [hci1] 5.479455
        Num handles: 1
        Handle: 738 Address: DF:A9:FF:F6:B1:1A (OUI DF-A9-FF)
        Count: 1
< ACL Data TX: Handle 738 flags 0x00 dlen 21                #80 [hci1] 5.479543
      SMP: Pairing Random (0x04) len 16
        Random value: bc235a02440d0c3424a2acf8fd71a45c
> HCI Event: Number of Completed Packets (0x13) plen 5      #81 [hci1] 5.513899
        Num handles: 1
        Handle: 738 Address: DF:A9:FF:F6:B1:1A (OUI DF-A9-FF)
        Count: 1
        #80: len 21 (4 Kb/s)
        Latency: 34 msec (34-45 msec ~35 msec)
> ACL Data RX: Handle 738 flags 0x02 dlen 21                #82 [hci1] 5.764041
      SMP: Pairing Random (0x04) len 16
        Random value: 9bbd3d2281a2e7ac8c712a291ee166d5
< HCI Command: Host Number of Compl.. (0x03|0x0035) plen 5  #83 [hci1] 5.779119
        Num handles: 1
        Handle: 738 Address: DF:A9:FF:F6:B1:1A (OUI DF-A9-FF)
        Count: 1
< ACL Data TX: Handle 738 flags 0x00 dlen 21                #84 [hci1] 5.779149
      SMP: Pairing Confirm (0x03) len 16
        Confim value: 88fd5492839d719d45ae54954658a851
> HCI Event: Number of Completed Packets (0x13) plen 5      #85 [hci1] 5.813767
        Num handles: 1
        Handle: 738 Address: DF:A9:FF:F6:B1:1A (OUI DF-A9-FF)
        Count: 1
        #84: len 21 (4 Kb/s)
        Latency: 34 msec (34-45 msec ~35 msec)
> ACL Data RX: Handle 738 flags 0x02 dlen 21                #86 [hci1] 5.864012
      SMP: Pairing Confirm (0x03) len 16
        Confim value: aba7a93bede9f876ebfc21d7ccb00624
< HCI Command: Host Number of Compl.. (0x03|0x0035) plen 5  #87 [hci1] 5.879131
        Num handles: 1
        Handle: 738 Address: DF:A9:FF:F6:B1:1A (OUI DF-A9-FF)
        Count: 1
< ACL Data TX: Handle 738 flags 0x00 dlen 21                #88 [hci1] 5.879186
      SMP: Pairing Random (0x04) len 16
        Random value: cadd27bd58e945097b00bad7aca1ba32
> HCI Event: Number of Completed Packets (0x13) plen 5      #89 [hci1] 5.913761
        Num handles: 1
        Handle: 738 Address: DF:A9:FF:F6:B1:1A (OUI DF-A9-FF)
        Count: 1
        #88: len 21 (4 Kb/s)
        Latency: 34 msec (34-45 msec ~34 msec)
> ACL Data RX: Handle 738 flags 0x02 dlen 21                #90 [hci1] 6.164012
      SMP: Pairing Random (0x04) len 16
        Random value: 5f420751d45424499cc8f9e638a946f6
< HCI Command: Host Number of Compl.. (0x03|0x0035) plen 5  #91 [hci1] 6.179517
        Num handles: 1
        Handle: 738 Address: DF:A9:FF:F6:B1:1A (OUI DF-A9-FF)
        Count: 1
< ACL Data TX: Handle 738 flags 0x00 dlen 21                #92 [hci1] 6.179610
      SMP: Pairing Confirm (0x03) len 16
        Confim value: 8a9eec377d7b13f554d59abd4e92a23c
> HCI Event: Number of Completed Packets (0x13) plen 5      #93 [hci1] 6.213849
        Num handles: 1
        Handle: 738 Address: DF:A9:FF:F6:B1:1A (OUI DF-A9-FF)
        Count: 1
        #92: len 21 (4 Kb/s)
        Latency: 34 msec (34-45 msec ~34 msec)
> ACL Data RX: Handle 738 flags 0x02 dlen 21                #94 [hci1] 6.264049
      SMP: Pairing Confirm (0x03) len 16
        Confim value: 3df4f716995830a7a15b2373a1d7c48e
< HCI Command: Host Number of Compl.. (0x03|0x0035) plen 5  #95 [hci1] 6.279533
        Num handles: 1
        Handle: 738 Address: DF:A9:FF:F6:B1:1A (OUI DF-A9-FF)
        Count: 1
< ACL Data TX: Handle 738 flags 0x00 dlen 21                #96 [hci1] 6.279745
      SMP: Pairing Random (0x04) len 16
        Random value: 6e64e79f33b2e374394db8ab2d95badd
> HCI Event: Number of Completed Packets (0x13) plen 5      #97 [hci1] 6.313770
        Num handles: 1
        Handle: 738 Address: DF:A9:FF:F6:B1:1A (OUI DF-A9-FF)
        Count: 1
        #96: len 21 (4 Kb/s)
        Latency: 34 msec (34-45 msec ~34 msec)
> ACL Data RX: Handle 738 flags 0x02 dlen 21                #98 [hci1] 6.563977
      SMP: Pairing Random (0x04) len 16
        Random value: dc08bbf377b2a70e3b73644cf5d18ea7
< HCI Command: Host Number of Compl.. (0x03|0x0035) plen 5  #99 [hci1] 6.579191
        Num handles: 1
        Handle: 738 Address: DF:A9:FF:F6:B1:1A (OUI DF-A9-FF)
        Count: 1
< ACL Data TX: Handle 738 flags 0x00 dlen 21               #100 [hci1] 6.579241
      SMP: Pairing Confirm (0x03) len 16
        Confim value: d050cf0bc7765324f332ae0b07c3ec6a
> HCI Event: Number of Completed Packets (0x13) plen 5     #101 [hci1] 6.613914
        Num handles: 1
        Handle: 738 Address: DF:A9:FF:F6:B1:1A (OUI DF-A9-FF)
        Count: 1
        #100: len 21 (4 Kb/s)
        Latency: 34 msec (34-45 msec ~34 msec)
> ACL Data RX: Handle 738 flags 0x02 dlen 21               #102 [hci1] 6.663971
      SMP: Pairing Confirm (0x03) len 16
        Confim value: ed893a336549709da40c9bff677cd23b
< HCI Command: Host Number of Comp.. (0x03|0x0035) plen 5  #103 [hci1] 6.679383
        Num handles: 1
        Handle: 738 Address: DF:A9:FF:F6:B1:1A (OUI DF-A9-FF)
        Count: 1
< ACL Data TX: Handle 738 flags 0x00 dlen 21               #104 [hci1] 6.679553
      SMP: Pairing Random (0x04) len 16
        Random value: e2838e9a8cc6964353c850fef72c5ceb
> HCI Event: Number of Completed Packets (0x13) plen 5     #105 [hci1] 6.713871
        Num handles: 1
        Handle: 738 Address: DF:A9:FF:F6:B1:1A (OUI DF-A9-FF)
        Count: 1
        #104: len 21 (4 Kb/s)
        Latency: 34 msec (34-45 msec ~34 msec)
> ACL Data RX: Handle 738 flags 0x02 dlen 21               #106 [hci1] 6.964045
      SMP: Pairing Random (0x04) len 16
        Random value: 639e3a5ab10527fad49a07621fcc828f
< HCI Command: Host Number of Comp.. (0x03|0x0035) plen 5  #107 [hci1] 6.979281
        Num handles: 1
        Handle: 738 Address: DF:A9:FF:F6:B1:1A (OUI DF-A9-FF)
        Count: 1
< ACL Data TX: Handle 738 flags 0x00 dlen 21               #108 [hci1] 6.979412
      SMP: Pairing Confirm (0x03) len 16
        Confim value: d09fdb30ae2f3b0342e756fdc82f8969
> HCI Event: Number of Completed Packets (0x13) plen 5     #109 [hci1] 7.013907
        Num handles: 1
        Handle: 738 Address: DF:A9:FF:F6:B1:1A (OUI DF-A9-FF)
        Count: 1
        #108: len 21 (4 Kb/s)
        Latency: 34 msec (34-45 msec ~34 msec)
> ACL Data RX: Handle 738 flags 0x02 dlen 21               #110 [hci1] 7.064066
      SMP: Pairing Confirm (0x03) len 16
        Confim value: 19ed475ebe0b06312b43078bef510335
< HCI Command: Host Number of Comp.. (0x03|0x0035) plen 5  #111 [hci1] 7.079147
        Num handles: 1
        Handle: 738 Address: DF:A9:FF:F6:B1:1A (OUI DF-A9-FF)
        Count: 1
< ACL Data TX: Handle 738 flags 0x00 dlen 21               #112 [hci1] 7.079248
      SMP: Pairing Random (0x04) len 16
        Random value: 15536596b6fc3db1c86b2b19701bcf5c
> HCI Event: Number of Completed Packets (0x13) plen 5     #113 [hci1] 7.113857
        Num handles: 1
        Handle: 738 Address: DF:A9:FF:F6:B1:1A (OUI DF-A9-FF)
        Count: 1
        #112: len 21 (4 Kb/s)
        Latency: 34 msec (34-45 msec ~34 msec)
> ACL Data RX: Handle 738 flags 0x02 dlen 21               #114 [hci1] 7.363938
      SMP: Pairing Random (0x04) len 16
        Random value: 817d0f6b517ecd8fc46bcc3a0841ed44
< HCI Command: Host Number of Comp.. (0x03|0x0035) plen 5  #115 [hci1] 7.379201
        Num handles: 1
        Handle: 738 Address: DF:A9:FF:F6:B1:1A (OUI DF-A9-FF)
        Count: 1
< ACL Data TX: Handle 738 flags 0x00 dlen 21               #116 [hci1] 7.379243
      SMP: Pairing Confirm (0x03) len 16
        Confim value: 740c0dc361c50bff48828fd047ff461f
> HCI Event: Number of Completed Packets (0x13) plen 5     #117 [hci1] 7.413918
        Num handles: 1
        Handle: 738 Address: DF:A9:FF:F6:B1:1A (OUI DF-A9-FF)
        Count: 1
        #116: len 21 (4 Kb/s)
        Latency: 34 msec (34-45 msec ~34 msec)
> ACL Data RX: Handle 738 flags 0x02 dlen 21               #118 [hci1] 7.464053
      SMP: Pairing Confirm (0x03) len 16
        Confim value: 613587c200cf1b0641623b704b3da402
< HCI Command: Host Number of Comp.. (0x03|0x0035) plen 5  #119 [hci1] 7.479432
        Num handles: 1
        Handle: 738 Address: DF:A9:FF:F6:B1:1A (OUI DF-A9-FF)
        Count: 1
< ACL Data TX: Handle 738 flags 0x00 dlen 21               #120 [hci1] 7.479523
      SMP: Pairing Random (0x04) len 16
        Random value: c9ad9f2c3f295ebd5ad5e1c3cfeb215c
> HCI Event: Number of Completed Packets (0x13) plen 5     #121 [hci1] 7.513801
        Num handles: 1
        Handle: 738 Address: DF:A9:FF:F6:B1:1A (OUI DF-A9-FF)
        Count: 1
        #120: len 21 (4 Kb/s)
        Latency: 34 msec (34-45 msec ~34 msec)
> ACL Data RX: Handle 738 flags 0x02 dlen 21               #122 [hci1] 7.763958
      SMP: Pairing Random (0x04) len 16
        Random value: 73d02e79a2a69ee8715e9fe1170b60e1
< HCI Command: Host Number of Comp.. (0x03|0x0035) plen 5  #123 [hci1] 7.779544
        Num handles: 1
        Handle: 738 Address: DF:A9:FF:F6:B1:1A (OUI DF-A9-FF)
        Count: 1
< ACL Data TX: Handle 738 flags 0x00 dlen 21               #124 [hci1] 7.779681
      SMP: Pairing Confirm (0x03) len 16
        Confim value: d27c6b3a5303d3a109b089ae3d3df578
> HCI Event: Number of Completed Packets (0x13) plen 5     #125 [hci1] 7.813742
        Num handles: 1
        Handle: 738 Address: DF:A9:FF:F6:B1:1A (OUI DF-A9-FF)
        Count: 1
        #124: len 21 (4 Kb/s)
        Latency: 34 msec (34-45 msec ~34 msec)
> ACL Data RX: Handle 738 flags 0x02 dlen 21               #126 [hci1] 7.863877
      SMP: Pairing Confirm (0x03) len 16
        Confim value: ec6f9b0b80b7b22ce40c33ffb1293853
< HCI Command: Host Number of Comp.. (0x03|0x0035) plen 5  #127 [hci1] 7.879244
        Num handles: 1
        Handle: 738 Address: DF:A9:FF:F6:B1:1A (OUI DF-A9-FF)
        Count: 1
< ACL Data TX: Handle 738 flags 0x00 dlen 21               #128 [hci1] 7.879301
      SMP: Pairing Random (0x04) len 16
        Random value: 312cdf99c9491988e877355a9a8321c6
> HCI Event: Number of Completed Packets (0x13) plen 5     #129 [hci1] 7.913922
        Num handles: 1
        Handle: 738 Address: DF:A9:FF:F6:B1:1A (OUI DF-A9-FF)
        Count: 1
        #128: len 21 (4 Kb/s)
        Latency: 34 msec (34-45 msec ~34 msec)
> ACL Data RX: Handle 738 flags 0x02 dlen 21               #130 [hci1] 8.163988
      SMP: Pairing Random (0x04) len 16
        Random value: e82bf3d43d305aa67950bbb05edb973e
< HCI Command: Host Number of Comp.. (0x03|0x0035) plen 5  #131 [hci1] 8.179602
        Num handles: 1
        Handle: 738 Address: DF:A9:FF:F6:B1:1A (OUI DF-A9-FF)
        Count: 1
< ACL Data TX: Handle 738 flags 0x00 dlen 21               #132 [hci1] 8.179690
      SMP: Pairing Confirm (0x03) len 16
        Confim value: c4674220d95bb5315777256bfb8b00d6
> HCI Event: Number of Completed Packets (0x13) plen 5     #133 [hci1] 8.213835
        Num handles: 1
        Handle: 738 Address: DF:A9:FF:F6:B1:1A (OUI DF-A9-FF)
        Count: 1
        #132: len 21 (4 Kb/s)
        Latency: 34 msec (34-45 msec ~34 msec)
> ACL Data RX: Handle 738 flags 0x02 dlen 21               #134 [hci1] 8.264108
      SMP: Pairing Confirm (0x03) len 16
        Confim value: 1d5b85a942eba0ef018e00d683de9a93
< HCI Command: Host Number of Comp.. (0x03|0x0035) plen 5  #135 [hci1] 8.280103
        Num handles: 1
        Handle: 738 Address: DF:A9:FF:F6:B1:1A (OUI DF-A9-FF)
        Count: 1
< ACL Data TX: Handle 738 flags 0x00 dlen 21               #136 [hci1] 8.280113
      SMP: Pairing Random (0x04) len 16
        Random value: a987d808e808655d558dfc1155a0b492
> HCI Event: Number of Completed Packets (0x13) plen 5     #137 [hci1] 8.313791
        Num handles: 1
        Handle: 738 Address: DF:A9:FF:F6:B1:1A (OUI DF-A9-FF)
        Count: 1
        #136: len 21 (5 Kb/s)
        Latency: 33 msec (33-45 msec ~33 msec)
> ACL Data RX: Handle 738 flags 0x02 dlen 21               #138 [hci1] 8.563945
      SMP: Pairing Random (0x04) len 16
        Random value: 752587e2ff541ae795a571300d023265
< HCI Command: Host Number of Comp.. (0x03|0x0035) plen 5  #139 [hci1] 8.579177
        Num handles: 1
        Handle: 738 Address: DF:A9:FF:F6:B1:1A (OUI DF-A9-FF)
        Count: 1
< ACL Data TX: Handle 738 flags 0x00 dlen 21               #140 [hci1] 8.579250
      SMP: Pairing Confirm (0x03) len 16
        Confim value: f3be7b07b430afb627400176f163ffef
> HCI Event: Number of Completed Packets (0x13) plen 5     #141 [hci1] 8.613795
        Num handles: 1
        Handle: 738 Address: DF:A9:FF:F6:B1:1A (OUI DF-A9-FF)
        Count: 1
        #140: len 21 (4 Kb/s)
        Latency: 34 msec (33-45 msec ~34 msec)
> ACL Data RX: Handle 738 flags 0x02 dlen 21               #142 [hci1] 8.663877
      SMP: Pairing Confirm (0x03) len 16
        Confim value: 247d050f37e5e32c2d700dc320cf62a2
< HCI Command: Host Number of Comp.. (0x03|0x0035) plen 5  #143 [hci1] 8.679500
        Num handles: 1
        Handle: 738 Address: DF:A9:FF:F6:B1:1A (OUI DF-A9-FF)
        Count: 1
< ACL Data TX: Handle 738 flags 0x00 dlen 21               #144 [hci1] 8.679529
      SMP: Pairing Random (0x04) len 16
        Random value: 6ad8f13724432c7fd6001c45ff744123
> HCI Event: Number of Completed Packets (0x13) plen 5     #145 [hci1] 8.713668
        Num handles: 1
        Handle: 738 Address: DF:A9:FF:F6:B1:1A (OUI DF-A9-FF)
        Count: 1
        #144: len 21 (4 Kb/s)
        Latency: 34 msec (33-45 msec ~34 msec)
> ACL Data RX: Handle 738 flags 0x02 dlen 21               #146 [hci1] 8.963985
      SMP: Pairing Random (0x04) len 16
        Random value: 3861fc5824d9d21845ebf54ebaed5caf
< HCI Command: Host Number of Comp.. (0x03|0x0035) plen 5  #147 [hci1] 8.979168
        Num handles: 1
        Handle: 738 Address: DF:A9:FF:F6:B1:1A (OUI DF-A9-FF)
        Count: 1
< ACL Data TX: Handle 738 flags 0x00 dlen 21               #148 [hci1] 8.979205
      SMP: Pairing Confirm (0x03) len 16
        Confim value: 817a8a14bd85ec1d6b43be4300791c9b
> HCI Event: Number of Completed Packets (0x13) plen 5     #149 [hci1] 9.013756
        Num handles: 1
        Handle: 738 Address: DF:A9:FF:F6:B1:1A (OUI DF-A9-FF)
        Count: 1
        #148: len 21 (4 Kb/s)
        Latency: 34 msec (33-45 msec ~34 msec)
> ACL Data RX: Handle 738 flags 0x02 dlen 21               #150 [hci1] 9.063925
      SMP: Pairing Confirm (0x03) len 16
        Confim value: db4b37d1ca448a57e62e2ae010917b6e
< HCI Command: Host Number of Comp.. (0x03|0x0035) plen 5  #151 [hci1] 9.079040
        Num handles: 1
        Handle: 738 Address: DF:A9:FF:F6:B1:1A (OUI DF-A9-FF)
        Count: 1
< ACL Data TX: Handle 738 flags 0x00 dlen 21               #152 [hci1] 9.079047
      SMP: Pairing Random (0x04) len 16
        Random value: ebbb5e14c8a6b9622f296d277ff3bf29
> HCI Event: Number of Completed Packets (0x13) plen 5     #153 [hci1] 9.113745
        Num handles: 1
        Handle: 738 Address: DF:A9:FF:F6:B1:1A (OUI DF-A9-FF)
        Count: 1
        #152: len 21 (4 Kb/s)
        Latency: 34 msec (33-45 msec ~34 msec)
> ACL Data RX: Handle 738 flags 0x02 dlen 21               #154 [hci1] 9.363940
      SMP: Pairing Random (0x04) len 16
        Random value: e988a6af146454e06c87bc1e4d11d5fb
< HCI Command: Host Number of Comp.. (0x03|0x0035) plen 5  #155 [hci1] 9.379573
        Num handles: 1
        Handle: 738 Address: DF:A9:FF:F6:B1:1A (OUI DF-A9-FF)
        Count: 1
< ACL Data TX: Handle 738 flags 0x00 dlen 21               #156 [hci1] 9.379685
      SMP: Pairing Confirm (0x03) len 16
        Confim value: b0aafb5bf05daf9d5871ae3fb76fcbd4
> HCI Event: Number of Completed Packets (0x13) plen 5     #157 [hci1] 9.413720
        Num handles: 1
        Handle: 738 Address: DF:A9:FF:F6:B1:1A (OUI DF-A9-FF)
        Count: 1
        #156: len 21 (4 Kb/s)
        Latency: 34 msec (33-45 msec ~34 msec)
> ACL Data RX: Handle 738 flags 0x02 dlen 21               #158 [hci1] 9.463974
      SMP: Pairing Confirm (0x03) len 16
        Confim value: 9bce75bac402a8eb8ce4adf251e7bb5e
< HCI Command: Host Number of Comp.. (0x03|0x0035) plen 5  #159 [hci1] 9.479186
        Num handles: 1
        Handle: 738 Address: DF:A9:FF:F6:B1:1A (OUI DF-A9-FF)
        Count: 1
< ACL Data TX: Handle 738 flags 0x00 dlen 21               #160 [hci1] 9.479267
      SMP: Pairing Random (0x04) len 16
        Random value: 85e67448a15f56bd27e3a3cf1d832325
> HCI Event: Number of Completed Packets (0x13) plen 5     #161 [hci1] 9.513836
        Num handles: 1
        Handle: 738 Address: DF:A9:FF:F6:B1:1A (OUI DF-A9-FF)
        Count: 1
        #160: len 21 (4 Kb/s)
        Latency: 34 msec (33-45 msec ~34 msec)
> ACL Data RX: Handle 738 flags 0x02 dlen 21               #162 [hci1] 9.763934
      SMP: Pairing Random (0x04) len 16
        Random value: 6f55f154848ac6ab82c31bbd2b143cd2
< HCI Command: Host Number of Comp.. (0x03|0x0035) plen 5  #163 [hci1] 9.779561
        Num handles: 1
        Handle: 738 Address: DF:A9:FF:F6:B1:1A (OUI DF-A9-FF)
        Count: 1
< ACL Data TX: Handle 738 flags 0x00 dlen 21               #164 [hci1] 9.779737
      SMP: Pairing Confirm (0x03) len 16
        Confim value: 2bff9cf858a726bb7a8057db26312e47
> HCI Event: Number of Completed Packets (0x13) plen 5     #165 [hci1] 9.813691
        Num handles: 1
        Handle: 738 Address: DF:A9:FF:F6:B1:1A (OUI DF-A9-FF)
        Count: 1
        #164: len 21 (5 Kb/s)
        Latency: 33 msec (33-45 msec ~34 msec)
> ACL Data RX: Handle 738 flags 0x02 dlen 21               #166 [hci1] 9.863971
      SMP: Pairing Confirm (0x03) len 16
        Confim value: 0c0b7cf0a75bec9fa572a3bd96f7fba8
< HCI Command: Host Number of Comp.. (0x03|0x0035) plen 5  #167 [hci1] 9.879598
        Num handles: 1
        Handle: 738 Address: DF:A9:FF:F6:B1:1A (OUI DF-A9-FF)
        Count: 1
< ACL Data TX: Handle 738 flags 0x00 dlen 21               #168 [hci1] 9.879687
      SMP: Pairing Random (0x04) len 16
        Random value: 3fd3ce4faf02be7293595bb7c6e45c58
> HCI Event: Number of Completed Packets (0x13) plen 5     #169 [hci1] 9.913797
        Num handles: 1
        Handle: 738 Address: DF:A9:FF:F6:B1:1A (OUI DF-A9-FF)
        Count: 1
        #168: len 21 (4 Kb/s)
        Latency: 34 msec (33-45 msec ~34 msec)
> ACL Data RX: Handle 738 flags 0x02 dlen 21              #170 [hci1] 10.163888
      SMP: Pairing Random (0x04) len 16
        Random value: 43e41b500d88d684468997c0e127330e
< HCI Command: Host Number of Com.. (0x03|0x0035) plen 5  #171 [hci1] 10.179206
        Num handles: 1
        Handle: 738 Address: DF:A9:FF:F6:B1:1A (OUI DF-A9-FF)
        Count: 1
< ACL Data TX: Handle 738 flags 0x00 dlen 21              #172 [hci1] 10.179288
      SMP: Pairing Confirm (0x03) len 16
        Confim value: 32bc662db7131a7cb7bc0fae76ab8535
> HCI Event: Number of Completed Packets (0x13) plen 5    #173 [hci1] 10.213700
        Num handles: 1
        Handle: 738 Address: DF:A9:FF:F6:B1:1A (OUI DF-A9-FF)
        Count: 1
        #172: len 21 (4 Kb/s)
        Latency: 34 msec (33-45 msec ~34 msec)
> ACL Data RX: Handle 738 flags 0x02 dlen 21              #174 [hci1] 10.263861
      SMP: Pairing Confirm (0x03) len 16
        Confim value: 700342194a325243bdefb18e1e5b70d3
< HCI Command: Host Number of Com.. (0x03|0x0035) plen 5  #175 [hci1] 10.279107
        Num handles: 1
        Handle: 738 Address: DF:A9:FF:F6:B1:1A (OUI DF-A9-FF)
        Count: 1
< ACL Data TX: Handle 738 flags 0x00 dlen 21              #176 [hci1] 10.279150
      SMP: Pairing Random (0x04) len 16
        Random value: 1f855a6f6c3560debd84e2affc6847b6
> HCI Event: Number of Completed Packets (0x13) plen 5    #177 [hci1] 10.313711
        Num handles: 1
        Handle: 738 Address: DF:A9:FF:F6:B1:1A (OUI DF-A9-FF)
        Count: 1
        #176: len 21 (4 Kb/s)
        Latency: 34 msec (33-45 msec ~34 msec)
> ACL Data RX: Handle 738 flags 0x02 dlen 21              #178 [hci1] 10.563880
      SMP: Pairing Random (0x04) len 16
        Random value: 275afda08ebe989d86a952b400d9fc81
< HCI Command: Host Number of Com.. (0x03|0x0035) plen 5  #179 [hci1] 10.579281
        Num handles: 1
        Handle: 738 Address: DF:A9:FF:F6:B1:1A (OUI DF-A9-FF)
        Count: 1
< ACL Data TX: Handle 738 flags 0x00 dlen 21              #180 [hci1] 10.579327
      SMP: Pairing Confirm (0x03) len 16
        Confim value: daf2fed6acde452d764b060e6cc76cee
> HCI Event: Number of Completed Packets (0x13) plen 5    #181 [hci1] 10.613658
        Num handles: 1
        Handle: 738 Address: DF:A9:FF:F6:B1:1A (OUI DF-A9-FF)
        Count: 1
        #180: len 21 (4 Kb/s)
        Latency: 34 msec (33-45 msec ~34 msec)
> ACL Data RX: Handle 738 flags 0x02 dlen 21              #182 [hci1] 10.663919
      SMP: Pairing Confirm (0x03) len 16
        Confim value: 00d5d3f934308aba441a96f6ef2dd3fa
< HCI Command: Host Number of Com.. (0x03|0x0035) plen 5  #183 [hci1] 10.679127
        Num handles: 1
        Handle: 738 Address: DF:A9:FF:F6:B1:1A (OUI DF-A9-FF)
        Count: 1
< ACL Data TX: Handle 738 flags 0x00 dlen 21              #184 [hci1] 10.679220
      SMP: Pairing Random (0x04) len 16
        Random value: 16d5bf664139eda2b5425496665d7eed
> HCI Event: Number of Completed Packets (0x13) plen 5    #185 [hci1] 10.713709
        Num handles: 1
        Handle: 738 Address: DF:A9:FF:F6:B1:1A (OUI DF-A9-FF)
        Count: 1
        #184: len 21 (4 Kb/s)
        Latency: 34 msec (33-45 msec ~34 msec)
> ACL Data RX: Handle 738 flags 0x02 dlen 21              #186 [hci1] 10.963851
      SMP: Pairing Random (0x04) len 16
        Random value: e9217e334447c159c9bb49a698bc26ff
< HCI Command: Host Number of Com.. (0x03|0x0035) plen 5  #187 [hci1] 10.979169
        Num handles: 1
        Handle: 738 Address: DF:A9:FF:F6:B1:1A (OUI DF-A9-FF)
        Count: 1
< ACL Data TX: Handle 738 flags 0x00 dlen 21              #188 [hci1] 10.979205
      SMP: Pairing Confirm (0x03) len 16
        Confim value: a7a657e27d842cc55b6fc23364bcc702
> HCI Event: Number of Completed Packets (0x13) plen 5    #189 [hci1] 11.013739
        Num handles: 1
        Handle: 738 Address: DF:A9:FF:F6:B1:1A (OUI DF-A9-FF)
        Count: 1
        #188: len 21 (4 Kb/s)
        Latency: 34 msec (33-45 msec ~34 msec)
> ACL Data RX: Handle 738 flags 0x02 dlen 21              #190 [hci1] 11.063852
      SMP: Pairing Confirm (0x03) len 16
        Confim value: b182b53c3b48cfab30941ff12959a96a
< HCI Command: Host Number of Com.. (0x03|0x0035) plen 5  #191 [hci1] 11.079245
        Num handles: 1
        Handle: 738 Address: DF:A9:FF:F6:B1:1A (OUI DF-A9-FF)
        Count: 1
< ACL Data TX: Handle 738 flags 0x00 dlen 21              #192 [hci1] 11.079334
      SMP: Pairing Random (0x04) len 16
        Random value: 6500c95219dd01e09d1e63f87b860481
> HCI Event: Number of Completed Packets (0x13) plen 5    #193 [hci1] 11.113755
        Num handles: 1
        Handle: 738 Address: DF:A9:FF:F6:B1:1A (OUI DF-A9-FF)
        Count: 1
        #192: len 21 (4 Kb/s)
        Latency: 34 msec (33-45 msec ~34 msec)
> ACL Data RX: Handle 738 flags 0x02 dlen 21              #194 [hci1] 11.363850
      SMP: Pairing Random (0x04) len 16
        Random value: 034d2ddbea285a829d43c1453485e93e
< HCI Command: Host Number of Com.. (0x03|0x0035) plen 5  #195 [hci1] 11.379623
        Num handles: 1
        Handle: 738 Address: DF:A9:FF:F6:B1:1A (OUI DF-A9-FF)
        Count: 1
< ACL Data TX: Handle 738 flags 0x00 dlen 21              #196 [hci1] 11.379723
      SMP: Pairing Confirm (0x03) len 16
        Confim value: e7e7cc742902f43fb29edcc621db0eab
> HCI Event: Number of Completed Packets (0x13) plen 5    #197 [hci1] 11.413719
        Num handles: 1
        Handle: 738 Address: DF:A9:FF:F6:B1:1A (OUI DF-A9-FF)
        Count: 1
        #196: len 21 (5 Kb/s)
        Latency: 33 msec (33-45 msec ~34 msec)
> ACL Data RX: Handle 738 flags 0x02 dlen 21              #198 [hci1] 11.463781
      SMP: Pairing Confirm (0x03) len 16
        Confim value: 5bfda94d0b79cd03bdd8c3e8d251135f
< HCI Command: Host Number of Com.. (0x03|0x0035) plen 5  #199 [hci1] 11.479519
        Num handles: 1
        Handle: 738 Address: DF:A9:FF:F6:B1:1A (OUI DF-A9-FF)
        Count: 1
< ACL Data TX: Handle 738 flags 0x00 dlen 21              #200 [hci1] 11.479639
      SMP: Pairing Random (0x04) len 16
        Random value: 47e1f6006d79c974bd9d9e1ee31049e7
> HCI Event: Number of Completed Packets (0x13) plen 5    #201 [hci1] 11.513776
        Num handles: 1
        Handle: 738 Address: DF:A9:FF:F6:B1:1A (OUI DF-A9-FF)
        Count: 1
        #200: len 21 (4 Kb/s)
        Latency: 34 msec (33-45 msec ~34 msec)
> ACL Data RX: Handle 738 flags 0x02 dlen 21              #202 [hci1] 11.763841
      SMP: Pairing Random (0x04) len 16
        Random value: 1c917e3d9cef087915d74d6353338d89
< HCI Command: Host Number of Com.. (0x03|0x0035) plen 5  #203 [hci1] 11.779569
        Num handles: 1
        Handle: 738 Address: DF:A9:FF:F6:B1:1A (OUI DF-A9-FF)
        Count: 1
< ACL Data TX: Handle 738 flags 0x00 dlen 21              #204 [hci1] 11.779719
      SMP: Pairing Confirm (0x03) len 16
        Confim value: 3efb3e688a2df25349da74f4005c9be2
> HCI Event: Number of Completed Packets (0x13) plen 5    #205 [hci1] 11.813789
        Num handles: 1
        Handle: 738 Address: DF:A9:FF:F6:B1:1A (OUI DF-A9-FF)
        Count: 1
        #204: len 21 (4 Kb/s)
        Latency: 34 msec (33-45 msec ~34 msec)
> ACL Data RX: Handle 738 flags 0x02 dlen 21              #206 [hci1] 11.863865
      SMP: Pairing Confirm (0x03) len 16
        Confim value: 1a542c1a40dec9ef4a13e1d7cfcdc32d
< HCI Command: Host Number of Com.. (0x03|0x0035) plen 5  #207 [hci1] 11.879558
        Num handles: 1
        Handle: 738 Address: DF:A9:FF:F6:B1:1A (OUI DF-A9-FF)
        Count: 1
< ACL Data TX: Handle 738 flags 0x00 dlen 21              #208 [hci1] 11.879652
      SMP: Pairing Random (0x04) len 16
        Random value: c2476823e41736a7e381bafb7c3fcffc
> HCI Event: Number of Completed Packets (0x13) plen 5    #209 [hci1] 11.913682
        Num handles: 1
        Handle: 738 Address: DF:A9:FF:F6:B1:1A (OUI DF-A9-FF)
        Count: 1
        #208: len 21 (4 Kb/s)
        Latency: 34 msec (33-45 msec ~34 msec)
> ACL Data RX: Handle 738 flags 0x02 dlen 21              #210 [hci1] 12.163814
      SMP: Pairing Random (0x04) len 16
        Random value: 7744f9d5eb05e592be04210e3d718237
< HCI Command: Host Number of Com.. (0x03|0x0035) plen 5  #211 [hci1] 12.179310
        Num handles: 1
        Handle: 738 Address: DF:A9:FF:F6:B1:1A (OUI DF-A9-FF)
        Count: 1
< ACL Data TX: Handle 738 flags 0x00 dlen 21              #212 [hci1] 12.179357
      SMP: Pairing Confirm (0x03) len 16
        Confim value: 9870d47c24a06e676dbdc191148ea077
> HCI Event: Number of Completed Packets (0x13) plen 5    #213 [hci1] 12.213743
        Num handles: 1
        Handle: 738 Address: DF:A9:FF:F6:B1:1A (OUI DF-A9-FF)
        Count: 1
        #212: len 21 (4 Kb/s)
        Latency: 34 msec (33-45 msec ~34 msec)
> ACL Data RX: Handle 738 flags 0x02 dlen 21              #214 [hci1] 12.263896
      SMP: Pairing Confirm (0x03) len 16
        Confim value: 587504a38ce5265997924faa81f2a9d2
< HCI Command: Host Number of Com.. (0x03|0x0035) plen 5  #215 [hci1] 12.279179
        Num handles: 1
        Handle: 738 Address: DF:A9:FF:F6:B1:1A (OUI DF-A9-FF)
        Count: 1
< ACL Data TX: Handle 738 flags 0x00 dlen 21              #216 [hci1] 12.279221
      SMP: Pairing Random (0x04) len 16
        Random value: d9b0b09bc4296bf8753a8f6e1fa7d968
> HCI Event: Number of Completed Packets (0x13) plen 5    #217 [hci1] 12.313701
        Num handles: 1
        Handle: 738 Address: DF:A9:FF:F6:B1:1A (OUI DF-A9-FF)
        Count: 1
        #216: len 21 (4 Kb/s)
        Latency: 34 msec (33-45 msec ~34 msec)
> ACL Data RX: Handle 738 flags 0x02 dlen 21              #218 [hci1] 12.563803
      SMP: Pairing Random (0x04) len 16
        Random value: 6cdd924d27bd333995a7944f6207b11c
< HCI Command: Host Number of Com.. (0x03|0x0035) plen 5  #219 [hci1] 12.579341
        Num handles: 1
        Handle: 738 Address: DF:A9:FF:F6:B1:1A (OUI DF-A9-FF)
        Count: 1
< ACL Data TX: Handle 738 flags 0x00 dlen 21              #220 [hci1] 12.579415
      SMP: Pairing Confirm (0x03) len 16
        Confim value: 15862422e61ce0993eca583ee7fc7f76
> HCI Event: Number of Completed Packets (0x13) plen 5    #221 [hci1] 12.613768
        Num handles: 1
        Handle: 738 Address: DF:A9:FF:F6:B1:1A (OUI DF-A9-FF)
        Count: 1
        #220: len 21 (4 Kb/s)
        Latency: 34 msec (33-45 msec ~34 msec)
> ACL Data RX: Handle 738 flags 0x02 dlen 21              #222 [hci1] 12.663850
      SMP: Pairing Confirm (0x03) len 16
        Confim value: 1c0b83db77c2dade8cf574b77965b828
< HCI Command: Host Number of Com.. (0x03|0x0035) plen 5  #223 [hci1] 12.679232
        Num handles: 1
        Handle: 738 Address: DF:A9:FF:F6:B1:1A (OUI DF-A9-FF)
        Count: 1
< ACL Data TX: Handle 738 flags 0x00 dlen 21              #224 [hci1] 12.679326
      SMP: Pairing Random (0x04) len 16
        Random value: f00de1357c99cea2f6ddb09677d02f35
> HCI Event: Number of Completed Packets (0x13) plen 5    #225 [hci1] 12.713710
        Num handles: 1
        Handle: 738 Address: DF:A9:FF:F6:B1:1A (OUI DF-A9-FF)
        Count: 1
        #224: len 21 (4 Kb/s)
        Latency: 34 msec (33-45 msec ~34 msec)
> ACL Data RX: Handle 738 flags 0x02 dlen 21              #226 [hci1] 12.963957
      SMP: Pairing Random (0x04) len 16
        Random value: ed0eddb1c295cd49dba855f93c90cc5b
< HCI Command: Host Number of Com.. (0x03|0x0035) plen 5  #227 [hci1] 12.979995
        Num handles: 1
        Handle: 738 Address: DF:A9:FF:F6:B1:1A (OUI DF-A9-FF)
        Count: 1
< ACL Data TX: Handle 738 flags 0x00 dlen 21              #228 [hci1] 12.980093
      SMP: Pairing DHKey Check (0x0d) len 16
        E: d459007d8d2238c1ba10e23b71fe91a2
> HCI Event: Number of Completed Packets (0x13) plen 5    #229 [hci1] 13.013711
        Num handles: 1
        Handle: 738 Address: DF:A9:FF:F6:B1:1A (OUI DF-A9-FF)
        Count: 1
        #228: len 21 (5 Kb/s)
        Latency: 33 msec (33-45 msec ~33 msec)
> ACL Data RX: Handle 738 flags 0x02 dlen 21              #230 [hci1] 13.063789
      SMP: Pairing DHKey Check (0x0d) len 16
        E: d04c89fa96ddfa8a5f94ebf586cc92b4
< HCI Command: LE Start Encryption (0x08|0x0019) plen 28  #231 [hci1] 13.079409
        Handle: 738 Address: DF:A9:FF:F6:B1:1A (OUI DF-A9-FF)
        Random number: 0x0000000000000000
        Encrypted diversifier: 0x0000
        Long term key: 612ef15ad03a8eaa853d2778680a0ef6
> HCI Event: Command Status (0x0f) plen 4                 #232 [hci1] 13.080279
      LE Start Encryption (0x08|0x0019) ncmd 1
        Status: Success (0x00)
< HCI Command: Host Number of Com.. (0x03|0x0035) plen 5  #233 [hci1] 13.099093
        Num handles: 1
        Handle: 738 Address: DF:A9:FF:F6:B1:1A (OUI DF-A9-FF)
        Count: 1
> HCI Event: Encryption Change (0x08) plen 4              #234 [hci1] 13.413644
        Status: Success (0x00)
        Handle: 738 Address: DF:A9:FF:F6:B1:1A (OUI DF-A9-FF)
        Encryption: Enabled with AES-CCM (0x01)
< HCI Command: LE Add Device To... (0x08|0x0027) plen 39  #235 [hci1] 13.419421
        Address type: Public (0x00)
        Address: DF:A9:FF:F6:B1:1A (OUI DF-A9-FF)
        Peer identity resolving key: 00000000000000000000000000000000
        Local identity resolving key: 08aad2e1be87e47b88aeb19de6889efb
> HCI Event: Command Complete (0x0e) plen 4               #236 [hci1] 13.420422
      LE Add Device To Resolving List (0x08|0x0027) ncmd 1
        Status: Success (0x00)
< HCI Command: LE Set Privacy Mode (0x08|0x004e) plen 8   #237 [hci1] 13.439541
        Peer Identity address type: Public (0x00)
        Peer Identity address: DF:A9:FF:F6:B1:1A (OUI DF-A9-FF)
        Privacy Mode: Use Device Privacy (0x01)
> HCI Event: Command Complete (0x0e) plen 4               #238 [hci1] 13.440269
      LE Set Privacy Mode (0x08|0x004e) ncmd 1
        Status: Success (0x00)
< HCI Command: LE Set Address Res.. (0x08|0x002d) plen 1  #239 [hci1] 13.459451
        Address resolution: Enabled (0x01)
> HCI Event: Command Complete (0x0e) plen 4               #240 [hci1] 13.460012
      LE Set Address Resolution Enable (0x08|0x002d) ncmd 1
        Status: Success (0x00)
< ACL Data TX: Handle 738 flags 0x00 dlen 21              #241 [hci1] 13.590191
      SMP: Identity Information (0x08) len 16
        Identity resolving key: 08aad2e1be87e47b88aeb19de6889efb
< ACL Data TX: Handle 738 flags 0x00 dlen 12              #242 [hci1] 13.590206
      SMP: Identity Address Information (0x09) len 7
        Address: D5:B6:CC:31:DB:3B (Static)
> HCI Event: Number of Completed Packets (0x13) plen 5    #243 [hci1] 13.613643
        Num handles: 1
        Handle: 738 Address: DF:A9:FF:F6:B1:1A (OUI DF-A9-FF)
        Count: 1
        #241: len 21 (7 Kb/s)
        Latency: 23 msec (23-45 msec ~28 msec)
> HCI Event: Number of Completed Packets (0x13) plen 5    #244 [hci1] 13.614093
        Num handles: 1
        Handle: 738 Address: DF:A9:FF:F6:B1:1A (OUI DF-A9-FF)
        Count: 1
        #242: len 12 (4 Kb/s)
        Latency: 23 msec (23-45 msec ~26 msec)
< HCI Command: Disconnect (0x01|0x0006) plen 3            #245 [hci1] 14.039605
        Handle: 738 Address: DF:A9:FF:F6:B1:1A (OUI DF-A9-FF)
        Reason: Remote User Terminated Connection (0x13)
> HCI Event: Command Status (0x0f) plen 4                 #246 [hci1] 14.040209
      Disconnect (0x01|0x0006) ncmd 1
        Status: Success (0x00)
> HCI Event: Disconnect Complete (0x05) plen 4            #247 [hci1] 14.113598
        Status: Success (0x00)
        Handle: 738 Address: DF:A9:FF:F6:B1:1A (OUI DF-A9-FF)
        Reason: Connection Terminated By Local Host (0x16)
< HCI Command: Reset (0x03|0x0003) plen 0                 #248 [hci1] 19.849092
> HCI Event: Command Complete (0x0e) plen 4               #249 [hci1] 19.849677
      Reset (0x03|0x0003) ncmd 1
        Status: Success (0x00)
@ USER Close: main                                    {0x0001} [hci1] 19.859044
= Close Index: 00:00:00:00:00:00                               [hci1] 19.862151
