Bluetooth monitor ver 5.72
= Note: Linux version 6.14.0-36-generic (x86_64)                       0.880870
= Note: Bluetooth subsystem version 2.22                               0.880872
= New Index: 00:00:00:00:00:00 (Primary,UART,hci1)              [hci1] 0.880873
= New Index: 48:5F:99:8E:E0:64 (Primary,USB,hci0)               [hci0] 0.880874
= Open Index: 00:00:00:00:00:00                                 [hci1] 1.394568
= Index Info: 00:00:00:00:00:00 (Nordic Semiconductor ASA)      [hci1] 1.394587
@ USER Open: main (privileged) version 2.22            {0x0001} [hci1] 1.394597
< HCI Command: Reset (0x03|0x0003) plen 0                    #1 [hci1] 1.395748
> HCI Event: Command Complete (0x0e) plen 4                  #2 [hci1] 1.396375
      Reset (0x03|0x0003) ncmd 1
        Status: Success (0x00)
< HCI Command: Read Local Supported... (0x04|0x0003) plen 0  #3 [hci1] 1.414003
> HCI Event: Command Complete (0x0e) plen 12                 #4 [hci1] 1.414527
      Read Local Supported Features (0x04|0x0003) ncmd 1
        Status: Success (0x00)
        Features: 0x00 0x00 0x00 0x00 0x60 0x00 0x00 0x00
          BR/EDR Not Supported
          LE Supported (Controller)
< HCI Command: Read Local Version In.. (0x04|0x0001) plen 0  #5 [hci1] 1.434006
> HCI Event: Command Complete (0x0e) plen 12                 #6 [hci1] 1.434519
      Read Local Version Information (0x04|0x0001) ncmd 1
        Status: Success (0x00)
        HCI version: Reserved (0x0f) - Revision 12393 (0x3069)
        LMP version: Reserved (0x0f) - Subversion 12393 (0x3069)
        Manufacturer: Nordic Semiconductor ASA (89)
< HCI Command: Read Local Supported... (0x04|0x0002) plen 0  #7 [hci1] 1.453964
> HCI Event: Command Complete (0x0e) plen 68                 #8 [hci1] 1.455031
      Read Local Supported Commands (0x04|0x0002) ncmd 1
        Status: Success (0x00)
        Commands: 119 entries
          Disconnect (Octet 0 - Bit 5)
          Read Remote Version Information (Octet 2 - Bit 7)
          Set Event Mask (Octet 5 - Bit 6)
          Reset (Octet 5 - Bit 7)
          Read Connection Accept Timeout (Octet 7 - Bit 2)
          Write Connection Accept Timeout (Octet 7 - Bit 3)
          Read Transmit Power Level (Octet 10 - Bit 2)
          Set Controller To Host Flow Control (Octet 10 - Bit 5)
          Host Buffer Size (Octet 10 - Bit 6)
          Host Number of Completed Packets (Octet 10 - Bit 7)
          Read Local Version Information (Octet 14 - Bit 3)
          Read Local Supported Features (Octet 14 - Bit 5)
          Read BD ADDR (Octet 15 - Bit 1)
          Read RSSI (Octet 15 - Bit 5)
          Set Event Mask Page 2 (Octet 22 - Bit 2)
          LE Set Event Mask (Octet 25 - Bit 0)
          LE Read Buffer Size (Octet 25 - Bit 1)
          LE Read Local Supported Features (Octet 25 - Bit 2)
          LE Set Random Address (Octet 25 - Bit 4)
          LE Set Advertising Parameters (Octet 25 - Bit 5)
          LE Read Advertising Channel TX Power (Octet 25 - Bit 6)
          LE Set Advertising Data (Octet 25 - Bit 7)
          LE Set Scan Response Data (Octet 26 - Bit 0)
          LE Set Advertise Enable (Octet 26 - Bit 1)
          LE Set Scan Parameters (Octet 26 - Bit 2)
          LE Set Scan Enable (Octet 26 - Bit 3)
          LE Create Connection (Octet 26 - Bit 4)
          LE Create Connection Cancel (Octet 26 - Bit 5)
          LE Read Accept List Size (Octet 26 - Bit 6)
          LE Clear Accept List (Octet 26 - Bit 7)
          LE Add Device To Accept List (Octet 27 - Bit 0)
          LE Remove Device From Accept List (Octet 27 - Bit 1)
          LE Connection Update (Octet 27 - Bit 2)
          LE Set Host Channel Classification (Octet 27 - Bit 3)
          LE Read Channel Map (Octet 27 - Bit 4)
          LE Read Remote Used Features (Octet 27 - Bit 5)
          LE Encrypt (Octet 27 - Bit 6)
          LE Rand (Octet 27 - Bit 7)
          LE Start Encryption (Octet 28 - Bit 0)
          LE Long Term Key Request Reply (Octet 28 - Bit 1)
          LE Long Term Key Request Neg Reply (Octet 28 - Bit 2)
          LE Read Supported States (Octet 28 - Bit 3)
          LE Receiver Test (Octet 28 - Bit 4)
          LE Transmitter Test (Octet 28 - Bit 5)
          LE Test End (Octet 28 - Bit 6)
          Read Authenticated Payload Timeout (Octet 32 - Bit 4)
          Write Authenticated Payload Timeout (Octet 32 - Bit 5)
          LE Set Data Length (Octet 33 - Bit 6)
          LE Read Suggested Default Data Length (Octet 33 - Bit 7)
          LE Write Suggested Default Data Length (Octet 34 - Bit 0)
          LE Add Device To Resolving List (Octet 34 - Bit 3)
          LE Remove Device From Resolving List (Octet 34 - Bit 4)
          LE Clear Resolving List (Octet 34 - Bit 5)
          LE Read Resolving List Size (Octet 34 - Bit 6)
          LE Set Address Resolution Enable (Octet 35 - Bit 1)
          LE Set Resolvable Private Address Timeout (Octet 35 - Bit 2)
          LE Read Maximum Data Length (Octet 35 - Bit 3)
          LE Read PHY (Octet 35 - Bit 4)
          LE Set Default PHY (Octet 35 - Bit 5)
          LE Set PHY (Octet 35 - Bit 6)
          LE Enhanced Receiver Test (Octet 35 - Bit 7)
          LE Enhanced Transmitter Test (Octet 36 - Bit 0)
          LE Set Advertising Set Random Address (Octet 36 - Bit 1)
          LE Set Extended Advertising Parameters (Octet 36 - Bit 2)
          LE Set Extended Advertising Data (Octet 36 - Bit 3)
          LE Set Extended Scan Response Data (Octet 36 - Bit 4)
          LE Set Extended Advertising Enable (Octet 36 - Bit 5)
          LE Read Maximum Advertising Data Length (Octet 36 - Bit 6)
          LE Read Number of Supported Advertising Sets (Octet 36 - Bit 7)
          LE Remove Advertising Set (Octet 37 - Bit 0)
          LE Clear Advertising Sets (Octet 37 - Bit 1)
          LE Set Periodic Advertising Parameters (Octet 37 - Bit 2)
          LE Set Periodic Advertising Data (Octet 37 - Bit 3)
          LE Set Periodic Advertising Enable (Octet 37 - Bit 4)
          LE Set Extended Scan Parameters (Octet 37 - Bit 5)
          LE Set Extended Scan Enable (Octet 37 - Bit 6)
          LE Extended Create Connection (Octet 37 - Bit 7)
          LE Periodic Advertising Create Sync (Octet 38 - Bit 0)
          LE Periodic Advertising Create Sync Cancel (Octet 38 - Bit 1)
          LE Periodic Advertising Terminate Sync (Octet 38 - Bit 2)
          LE Add Device To Periodic Advertiser List (Octet 38 - Bit 3)
          LE Remove Device From Periodic Advertiser List (Octet 38 - Bit 4)
          LE Clear Periodic Advertiser List (Octet 38 - Bit 5)
          LE Read Periodic Advertiser List Size (Octet 38 - Bit 6)
          LE Read Transmit Power (Octet 38 - Bit 7)
          LE Read RF Path Compensation (Octet 39 - Bit 0)
          LE Write RF Path Compensation (Octet 39 - Bit 1)
          LE Set Privacy Mode (Octet 39 - Bit 2)
          LE Periodic Advertising Receive Enable (Octet 40 - Bit 5)
          LE Periodic Advertising Sync Transfer (Octet 40 - Bit 6)
          LE Periodic Advertising Set Info Transfer (Octet 40 - Bit 7)
          LE Periodic Advertising Sync Transfer Parameters (Octet 41 - Bit 0)
          LE Set Default Periodic Advertisng Sync Transfer Parameters (Octet 41 - Bit 1)
          LE Read Buffer v2 (Octet 41 - Bit 5)
          LE Read ISO TX Sync (Octet 41 - Bit 6)
          LE Set Connected Isochronous Group Parameters (Octet 41 - Bit 7)
          LE Set Connected Isochronous Group Parameters Test (Octet 42 - Bit 0)
          LE Create Connected Isochronous Stream (Octet 42 - Bit 1)
          LE Remove Connected Isochronous Group (Octet 42 - Bit 2)
          LE Accept Connected Isochronous Stream Request (Octet 42 - Bit 3)
          LE Reject Connected Isochronous Stream Request (Octet 42 - Bit 4)
          LE Create Broadcast Isochronous Group (Octet 42 - Bit 5)
          LE Create Broadcast Isochronous Group Test (Octet 42 - Bit 6)
          LE Terminate Broadcast Isochronous Group (Octet 42 - Bit 7)
          LE Broadcast Isochronous Group Create Sync (Octet 43 - Bit 0)
          LE Broadcast Isochronous Group Terminate Sync (Octet 43 - Bit 1)
          LE Request Peer SCA (Octet 43 - Bit 2)
          LE Setup Isochronous Data Path (Octet 43 - Bit 3)
          LE Remove Isochronous Data Path (Octet 43 - Bit 4)
          LE Isochronous Transmit Test (Octet 43 - Bit 5)
          LE Isochronous Receive Test (Octet 43 - Bit 6)
          LE Isochronous Read Test Counters (Octet 43 - Bit 7)
          LE Isochronous Read Test Counters (Octet 44 - Bit 0)
          LE Set Host Feature (Octet 44 - Bit 1)
          Octet 44 - Bit 2 
          Octet 45 - Bit 6 
          Octet 46 - Bit 0 
          Octet 46 - Bit 1 
          Octet 46 - Bit 2 
< HCI Command: Host Buffer Size (0x03|0x0033) plen 7         #9 [hci1] 1.474004
        ACL MTU: 255  ACL max packet: 16
        SCO MTU: 0    SCO max packet: 0
> HCI Event: Command Complete (0x0e) plen 4                 #10 [hci1] 1.474556
      Host Buffer Size (0x03|0x0033) ncmd 1
        Status: Success (0x00)
< HCI Command: Set Controller To Ho.. (0x03|0x0031) plen 1  #11 [hci1] 1.494006
        Flow control: ACL Data Packets (0x01)
> HCI Event: Command Complete (0x0e) plen 4                 #12 [hci1] 1.494427
      Set Controller To Host Flow Control (0x03|0x0031) ncmd 1
        Status: Success (0x00)
< HCI Command: LE Read Local Suppor.. (0x08|0x0003) plen 0  #13 [hci1] 1.514016
> HCI Event: Command Complete (0x0e) plen 12                #14 [hci1] 1.514521
      LE Read Local Supported Features (0x08|0x0003) ncmd 1
        Status: Success (0x00)
        Features: 0xfd 0x79 0x00 0xf7 0x30 0x01 0x00 0x00
          LE Encryption
          Extended Reject Indication
          Peripheral-initiated Features Exchange
          LE Ping
          LE Data Packet Length Extension
          LL Privacy
          Extended Scanner Filter Policies
          LE 2M PHY
          LE Coded PHY
          LE Extended Advertising
          LE Periodic Advertising
          Channel Selection Algorithm #2
          Periodic Advertising Sync Transfer - Sender
          Periodic Advertising Sync Transfer - Recipient
          Sleep Clock Accuracy Updates
          Connected Isochronous Stream - Central
          Connected Isochronous Stream - Peripheral
          Isochronous Broadcaster
          Synchronized Receiver
          Periodic Advertising ADI support
          Connection Subrating
          Unknown features (0x0000010000000000)
< HCI Command: LE Set Host Feature (0x08|0x0074) plen 2     #15 [hci1] 1.534009
        Bit Number: 32
          Connected Isochronous Stream (Host Support)
        Bit Value: 1
> HCI Event: Command Complete (0x0e) plen 4                 #16 [hci1] 1.534432
      LE Set Host Feature (0x08|0x0074) ncmd 1
        Status: Success (0x00)
< HCI Command: LE Read Buffer v2 (0x08|0x0060) plen 0       #17 [hci1] 1.554005
> HCI Event: Command Complete (0x0e) plen 10                #18 [hci1] 1.554488
      LE Read Buffer v2 (0x08|0x0060) ncmd 1
        Status: Success (0x00)
        ACL MTU: 27
        ACL max packet: 3
        ISO MTU: 318
        ISO max packet: 3
< HCI Command: LE Read Maximum Adve.. (0x08|0x003a) plen 0  #19 [hci1] 1.574034
> HCI Event: Command Complete (0x0e) plen 6                 #20 [hci1] 1.574468
      LE Read Maximum Advertising Data Length (0x08|0x003a) ncmd 1
        Status: Success (0x00)
        Max length: 1650
< HCI Command: LE Read Supported St.. (0x08|0x001c) plen 0  #21 [hci1] 1.593991
> HCI Event: Command Complete (0x0e) plen 12                #22 [hci1] 1.594519
      LE Read Supported States (0x08|0x001c) ncmd 1
        Status: Success (0x00)
        States: 0x000003ff3e0306ff
          Non-connectable Advertising State
          Scannable Advertising State
          Connectable Advertising State
          High Duty Cycle Directed Advertising State
          Passive Scanning State
          Active Scanning State
          Initiating State
            and Connection State (Central Role)
          Connection State (Peripheral Role)
          Scannable Advertising State
            and Passive Scanning State
          Connectable Advertising State
            and Passive Scanning State
          Non-connectable Advertising State
            and Initiating State
          Scannable Advertising State
            and Initiating State
          Active Scanning State
            and Connection State (Central Role)
          Passive Scanning State
            and Connection State (Peripheral Role)
          Active Scanning State
            and Connection State (Peripheral Role)
          Initiating State
            and Connection State (Central Role)
            and Central Role & Central Role
          Low Duty Cycle Directed Advertising State
          Connectable Advertising State
            and Initiating State
            and Central Role & Peripheral Role
          High Duty Cycle Directed Advertising State
            and Initiating State
            and Central Role & Peripheral Role
          Low Duty Cycle Directed Advertising State
            and Initiating State
            and Central Role & Peripheral Role
          Connectable Advertising State
            and Connection State (Central Role)
            and Central Role & Peripheral Role
          High Duty Cycle Directed Advertising State
            and Connection State (Central Role)
            and Central Role & Peripheral Role
          Low Duty Cycle Directed Advertising State
            and Connection State (Central Role)
            and Central Role & Peripheral Role
          Connectable Advertising State
            and Connection State (Peripheral Role)
            and Central Role & Peripheral Role
          High Duty Cycle Directed Advertising State
            and Connection State (Peripheral Role)
            and Peripheral Role & Peripheral Role
          Low Duty Cycle Directed Advertising State
            and Connection State (Peripheral Role)
            and Peripheral Role & Peripheral Role
          Initiating State
            and Connection State (Peripheral Role)
            and Central Role & Peripheral Role
< HCI Command: LE Read Maximum Data.. (0x08|0x002f) plen 0  #23 [hci1] 1.613999
> HCI Event: Command Complete (0x0e) plen 12                #24 [hci1] 1.614523
      LE Read Maximum Data Length (0x08|0x002f) ncmd 1
        Status: Success (0x00)
        Max TX octets: 251
        Max TX time: 2704
        Max RX octets: 251
        Max RX time: 2704
< HCI Command: LE Write Suggested D.. (0x08|0x0024) plen 4  #25 [hci1] 1.633994
        TX octets: 251
        TX time: 2704
> HCI Event: Command Complete (0x0e) plen 4                 #26 [hci1] 1.634438
      LE Write Suggested Default Data Length (0x08|0x0024) ncmd 1
        Status: Success (0x00)
< HCI Command: LE Set Resolvable Pr.. (0x08|0x002e) plen 2  #27 [hci1] 1.654011
        Timeout: 30 seconds
> HCI Event: Command Complete (0x0e) plen 4                 #28 [hci1] 1.654496
      LE Set Resolvable Private Address Timeout (0x08|0x002e) ncmd 1
        Status: Success (0x00)
< HCI Command: LE Read Resolving Li.. (0x08|0x002a) plen 0  #29 [hci1] 1.674012
> HCI Event: Command Complete (0x0e) plen 5                 #30 [hci1] 1.674451
      LE Read Resolving List Size (0x08|0x002a) ncmd 1
        Status: Success (0x00)
        Size: 8
< HCI Command: LE Set Event Mask (0x08|0x0001) plen 8       #31 [hci1] 1.694027
        Mask: 0x000002023f87fa5e
          LE Advertising Report
          LE Connection Update Complete
          LE Read Remote Used Features Complete
          LE Long Term Key Request
          LE Data Length Change
          LE Enhanced Connection Complete
          LE PHY Update Complete
          LE Extended Advertising Report
          LE Periodic Advertising Sync Established
          LE Periodic Advertising Report
          LE Periodic Advertising Sync Lost
          LE Extended Scan Timeout
          LE Extended Advertising Set Terminated
          LE Scan Request Received
          LE Periodic Advertising Sync Transfer Rvc
          LE CIS Established
          LE CIS Request
          LE Create BIG Complete
          LE Terminate BIG Complete
          LE BIG Sync Estabilished Complete
          LE BIG Sync Lost
          LE BIG Info Advertising Report
          Unknown mask (0x0000020000000000)
> HCI Event: Command Complete (0x0e) plen 4                 #32 [hci1] 1.694540
      LE Set Event Mask (0x08|0x0001) ncmd 1
        Status: Success (0x00)
< HCI Command: Set Event Mask (0x03|0x0001) plen 8          #33 [hci1] 1.714002
        Mask: 0x2000800002008890
          Disconnection Complete
          Encryption Change
          Read Remote Version Information Complete
          Hardware Error
          Data Buffer Overflow
          Encryption Key Refresh Complete
          LE Meta
> HCI Event: Command Complete (0x0e) plen 4                 #34 [hci1] 1.714585
      Set Event Mask (0x03|0x0001) ncmd 1
        Status: Success (0x00)
< HCI Command: Read BD ADDR (0x04|0x0009) plen 0            #35 [hci1] 1.734010
> HCI Event: Command Complete (0x0e) plen 10                #36 [hci1] 1.734441
      Read BD ADDR (0x04|0x0009) ncmd 1
        Status: Success (0x00)
        Address: 00:00:00:00:00:00 (OUI 00-00-00)
< HCI Command: LE Set Random Address (0x08|0x0005) plen 6   #37 [hci1] 1.754015
        Address: D5:B6:CC:31:DB:3B (Static)
> HCI Event: Command Complete (0x0e) plen 4                 #38 [hci1] 1.754513
      LE Set Random Address (0x08|0x0005) ncmd 1
        Status: Success (0x00)
< HCI Command: LE Set Random Address (0x08|0x0005) plen 6   #39 [hci1] 1.894097
        Address: 48:61:8E:DB:C6:F9 (Resolvable)
> HCI Event: Command Complete (0x0e) plen 4                 #40 [hci1] 1.894710
      LE Set Random Address (0x08|0x0005) ncmd 1
        Status: Success (0x00)
< HCI Command: LE Extended Create... (0x08|0x0043) plen 26  #41 [hci1] 4.004065
        Filter policy: Accept list is not used (0x00)
        Own address type: Random (0x03)
        Peer address type: Public (0x00)
        Peer address: DF:A9:FF:F6:B1:1A (OUI DF-A9-FF)
        Initiating PHYs: 0x01
        Entry 0: LE 1M
          Scan interval: 60.000 msec (0x0060)
          Scan window: 60.000 msec (0x0060)
          Min connection interval: 30.00 msec (0x0018)
          Max connection interval: 50.00 msec (0x0028)
          Connection latency: 0 (0x0000)
          Supervision timeout: 4000 msec (0x0190)
          Min connection length: 0.000 msec (0x0000)
          Max connection length: 0.000 msec (0x0000)
> HCI Event: Command Status (0x0f) plen 4                   #42 [hci1] 4.005006
      LE Extended Create Connection (0x08|0x0043) ncmd 1
        Status: Success (0x00)
> HCI Event: LE Meta Event (0x3e) plen 31                   #43 [hci1] 4.033670
      LE Enhanced Connection Complete (0x0a)
        Status: Success (0x00)
        Handle: 180
        Role: Central (0x00)
        Peer address type: Public (0x00)
        Peer address: DF:A9:FF:F6:B1:1A (OUI DF-A9-FF)
        Local resolvable private address: 48:61:8E:DB:C6:F9 (Resolvable)
        Peer resolvable private address: 00:00:00:00:00:00 (Non-Resolvable)
        Connection interval: 50.00 msec (0x0028)
        Connection latency: 0 (0x0000)
        Supervision timeout: 4000 msec (0x0190)
        Central clock accuracy: 0x00
< HCI Command: LE Read Remote Used... (0x08|0x0016) plen 2  #44 [hci1] 4.034058
        Handle: 180 Address: DF:A9:FF:F6:B1:1A (OUI DF-A9-FF)
> HCI Event: Command Status (0x0f) plen 4                   #45 [hci1] 4.034633
      LE Read Remote Used Features (0x08|0x0016) ncmd 1
        Status: Success (0x00)
< HCI Command: LE Set PHY (0x08|0x0032) plen 7              #46 [hci1] 4.054054
        Handle: 180 Address: DF:A9:FF:F6:B1:1A (OUI DF-A9-FF)
        All PHYs preference: 0x00
        TX PHYs preference: 0x02
          LE 2M
        RX PHYs preference: 0x02
          LE 2M
        PHY options preference: Reserved (0x0000)
> HCI Event: Command Status (0x0f) plen 4                   #47 [hci1] 4.054515
      LE Set PHY (0x08|0x0032) ncmd 1
        Status: Success (0x00)
> HCI Event: LE Meta Event (0x3e) plen 12                   #48 [hci1] 4.135069
      LE Read Remote Used Features (0x04)
        Status: Success (0x00)
        Handle: 180 Address: DF:A9:FF:F6:B1:1A (OUI DF-A9-FF)
        Features: 0x2d 0x49 0x00 0xf7 0x67 0xd8 0x00 0x00
          LE Encryption
          Extended Reject Indication
          Peripheral-initiated Features Exchange
          LE Data Packet Length Extension
          LE 2M PHY
          LE Coded PHY
          Channel Selection Algorithm #2
          Periodic Advertising Sync Transfer - Sender
          Periodic Advertising Sync Transfer - Recipient
          Sleep Clock Accuracy Updates
          Connected Isochronous Stream - Central
          Connected Isochronous Stream - Peripheral
          Isochronous Broadcaster
          Synchronized Receiver
          Connected Isochronous Stream (Host Support)
          LE Power Control Request
          LE Power Control Request
          Connection Subrating
          Connection Subrating (Host Support)
          Unknown features (0x0000d80000000000)
> HCI Event: LE Meta Event (0x3e) plen 6                    #49 [hci1] 4.634519
      LE PHY Update Complete (0x0c)
        Status: Success (0x00)
        Handle: 180 Address: DF:A9:FF:F6:B1:1A (OUI DF-A9-FF)
        TX PHY: LE 2M (0x02)
        RX PHY: LE 2M (0x02)
< ACL Data TX: Handle 180 flags 0x00 dlen 11                #50 [hci1] 5.074171
      SMP: Pairing Request (0x01) len 6
        IO capability: DisplayOnly (0x00)
        OOB data: Authentication data not present (0x00)
        Authentication requirement: Bonding, No MITM, SC, No Keypresses (0x09)
        Max encryption key size: 16
        Initiator key distribution: EncKey IdKey (0x03)
        Responder key distribution: EncKey IdKey (0x03)
> HCI Event: Number of Completed Packets (0x13) plen 5      #51 [hci1] 5.084938
        Num handles: 1
        Handle: 180 Address: DF:A9:FF:F6:B1:1A (OUI DF-A9-FF)
        Count: 1
        #50: len 11 (8 Kb/s)
        Latency: 10 msec (10-10 msec ~10 msec)
> ACL Data RX: Handle 180 flags 0x02 dlen 11                #52 [hci1] 5.135055
      SMP: Pairing Response (0x02) len 6
        IO capability: KeyboardDisplay (0x04)
        OOB data: Authentication data not present (0x00)
        Authentication requirement: Bonding, MITM, SC, No Keypresses (0x0d)
        Max encryption key size: 16
        Initiator key distribution: IdKey (0x02)
        Responder key distribution: <none> (0x00)
< HCI Command: Host Number of Compl.. (0x03|0x0035) plen 5  #53 [hci1] 5.154213
        Num handles: 1
        Handle: 180 Address: DF:A9:FF:F6:B1:1A (OUI DF-A9-FF)
        Count: 1
< ACL Data TX: Handle 180 flags 0x00 dlen 27                #54 [hci1] 5.154229
< ACL Data TX: Handle 180 flags 0x01 dlen 27                #55 [hci1] 5.154249
< ACL Data TX: Handle 180 flags 0x01 dlen 15                #56 [hci1] 5.154251
      SMP: Pairing Public Key (0x0c) len 64
        X: 68f6ada634ce84d11617383d57f070fe3445c38b33b569efa5eb771a0dc8aea5
        Y: 83c407aaa8337331fdc418e55085d75e6c1c6e5d42f8bf9c18fb5a2a7d4f31aa
> HCI Event: Number of Completed Packets (0x13) plen 5      #57 [hci1] 5.184959
        Num handles: 1
        Handle: 180 Address: DF:A9:FF:F6:B1:1A (OUI DF-A9-FF)
        Count: 1
        #54: len 27 (7 Kb/s)
        Latency: 30 msec (10-30 msec ~20 msec)
> HCI Event: Number of Completed Packets (0x13) plen 5      #58 [hci1] 5.185516
        Num handles: 1
        Handle: 180 Address: DF:A9:FF:F6:B1:1A (OUI DF-A9-FF)
        Count: 1
        #55: len 27 (6 Kb/s)
        Latency: 31 msec (10-31 msec ~26 msec)
> HCI Event: Number of Completed Packets (0x13) plen 5      #59 [hci1] 5.185936
        Num handles: 1
        Handle: 180 Address: DF:A9:FF:F6:B1:1A (OUI DF-A9-FF)
        Count: 1
        #56: len 15 (3 Kb/s)
        Latency: 31 msec (10-31 msec ~28 msec)
> ACL Data RX: Handle 180 flags 0x02 dlen 27                #60 [hci1] 5.235241
> ACL Data RX: Handle 180 flags 0x01 dlen 27                #61 [hci1] 5.235600
> ACL Data RX: Handle 180 flags 0x01 dlen 15                #62 [hci1] 5.235997
      SMP: Pairing Public Key (0x0c) len 64
        X: d51490a160262649b9de14dbd81d0f43a4b62feb71b557949735e76bd146682d
        Y: 06ff5e78da5a580c9b4f582afcb9a465854addec933e7ab783d3f300b8a88492
< HCI Command: Host Number of Compl.. (0x03|0x0035) plen 5  #63 [hci1] 5.254138
        Num handles: 1
        Handle: 180 Address: DF:A9:FF:F6:B1:1A (OUI DF-A9-FF)
        Count: 1
< HCI Command: Host Number of Compl.. (0x03|0x0035) plen 5  #64 [hci1] 5.254176
        Num handles: 1
        Handle: 180 Address: DF:A9:FF:F6:B1:1A (OUI DF-A9-FF)
        Count: 1
< HCI Command: Host Number of Compl.. (0x03|0x0035) plen 5  #65 [hci1] 5.254385
        Num handles: 1
        Handle: 180 Address: DF:A9:FF:F6:B1:1A (OUI DF-A9-FF)
        Count: 1
< ACL Data TX: Handle 180 flags 0x00 dlen 21                #66 [hci1] 5.254494
      SMP: Pairing Confirm (0x03) len 16
        Confim value: d44af2c10e14a65c68aa6441e46ae931
> HCI Event: Number of Completed Packets (0x13) plen 5      #67 [hci1] 5.284950
        Num handles: 1
        Handle: 180 Address: DF:A9:FF:F6:B1:1A (OUI DF-A9-FF)
        Count: 1
        #66: len 21 (5 Kb/s)
        Latency: 30 msec (10-31 msec ~29 msec)
> ACL Data RX: Handle 180 flags 0x02 dlen 21                #68 [hci1] 6.135112
      SMP: Pairing Confirm (0x03) len 16
        Confim value: fd8f8930a4b19f11e2a0a84206697c58
< HCI Command: Host Number of Compl.. (0x03|0x0035) plen 5  #69 [hci1] 6.154595
        Num handles: 1
        Handle: 180 Address: DF:A9:FF:F6:B1:1A (OUI DF-A9-FF)
        Count: 1
< ACL Data TX: Handle 180 flags 0x00 dlen 21                #70 [hci1] 6.154866
      SMP: Pairing Random (0x04) len 16
        Random value: 555cc64d02679f89a05211af56d8b3da
> HCI Event: Number of Completed Packets (0x13) plen 5      #71 [hci1] 6.185098
        Num handles: 1
        Handle: 180 Address: DF:A9:FF:F6:B1:1A (OUI DF-A9-FF)
        Count: 1
        #70: len 21 (5 Kb/s)
        Latency: 30 msec (10-31 msec ~29 msec)
> ACL Data RX: Handle 180 flags 0x02 dlen 21                #72 [hci1] 6.435095
      SMP: Pairing Random (0x04) len 16
        Random value: 37331a18baf42fd1c4ee63c46aebda35
< HCI Command: Host Number of Compl.. (0x03|0x0035) plen 5  #73 [hci1] 6.454773
        Num handles: 1
        Handle: 180 Address: DF:A9:FF:F6:B1:1A (OUI DF-A9-FF)
        Count: 1
< ACL Data TX: Handle 180 flags 0x00 dlen 21                #74 [hci1] 6.455011
      SMP: Pairing Confirm (0x03) len 16
        Confim value: 54a57864c9d11fc2c4a62d1183fd626b
> HCI Event: Number of Completed Packets (0x13) plen 5      #75 [hci1] 6.484931
        Num handles: 1
        Handle: 180 Address: DF:A9:FF:F6:B1:1A (OUI DF-A9-FF)
        Count: 1
        #74: len 21 (5 Kb/s)
        Latency: 29 msec (10-31 msec ~29 msec)
> ACL Data RX: Handle 180 flags 0x02 dlen 21                #76 [hci1] 6.535049
      SMP: Pairing Confirm (0x03) len 16
        Confim value: 9b11816662d1427c275351ad56aec250
< HCI Command: Host Number of Compl.. (0x03|0x0035) plen 5  #77 [hci1] 6.554216
        Num handles: 1
        Handle: 180 Address: DF:A9:FF:F6:B1:1A (OUI DF-A9-FF)
        Count: 1
< ACL Data TX: Handle 180 flags 0x00 dlen 21                #78 [hci1] 6.554349
      SMP: Pairing Random (0x04) len 16
        Random value: bc235a02440d0c3424a2acf8fd71a45c
> HCI Event: Number of Completed Packets (0x13) plen 5      #79 [hci1] 6.584880
        Num handles: 1
        Handle: 180 Address: DF:A9:FF:F6:B1:1A (OUI DF-A9-FF)
        Count: 1
        #78: len 21 (5 Kb/s)
        Latency: 30 msec (10-31 msec ~30 msec)
> ACL Data RX: Handle 180 flags 0x02 dlen 21                #80 [hci1] 6.835122
      SMP: Pairing Random (0x04) len 16
        Random value: 6c38d843336647edcb755e633a88772d
< HCI Command: Host Number of Compl.. (0x03|0x0035) plen 5  #81 [hci1] 6.854304
        Num handles: 1
        Handle: 180 Address: DF:A9:FF:F6:B1:1A (OUI DF-A9-FF)
        Count: 1
< ACL Data TX: Handle 180 flags 0x00 dlen 21                #82 [hci1] 6.854432
      SMP: Pairing Confirm (0x03) len 16
        Confim value: 493547df54c587d6c0b084d338673fd6
> HCI Event: Number of Completed Packets (0x13) plen 5      #83 [hci1] 6.885020
        Num handles: 1
        Handle: 180 Address: DF:A9:FF:F6:B1:1A (OUI DF-A9-FF)
        Count: 1
        #82: len 21 (5 Kb/s)
        Latency: 30 msec (10-31 msec ~30 msec)
> ACL Data RX: Handle 180 flags 0x02 dlen 21                #84 [hci1] 6.935094
      SMP: Pairing Confirm (0x03) len 16
        Confim value: 01d7c6dcd7f6f509665c15bdbcba14a5
< HCI Command: Host Number of Compl.. (0x03|0x0035) plen 5  #85 [hci1] 6.954609
        Num handles: 1
        Handle: 180 Address: DF:A9:FF:F6:B1:1A (OUI DF-A9-FF)
        Count: 1
< ACL Data TX: Handle 180 flags 0x00 dlen 21                #86 [hci1] 6.954827
      SMP: Pairing Random (0x04) len 16
        Random value: cadd27bd58e945097b00bad7aca1ba32
> HCI Event: Number of Completed Packets (0x13) plen 5      #87 [hci1] 6.984919
        Num handles: 1
        Handle: 180 Address: DF:A9:FF:F6:B1:1A (OUI DF-A9-FF)
        Count: 1
        #86: len 21 (5 Kb/s)
        Latency: 30 msec (10-31 msec ~30 msec)
> ACL Data RX: Handle 180 flags 0x02 dlen 21                #88 [hci1] 7.235078
      SMP: Pairing Random (0x04) len 16
        Random value: c3a1a55ab8ee33082df735a9d7fbfcc8
< HCI Command: Host Number of Compl.. (0x03|0x0035) plen 5  #89 [hci1] 7.254647
        Num handles: 1
        Handle: 180 Address: DF:A9:FF:F6:B1:1A (OUI DF-A9-FF)
        Count: 1
< ACL Data TX: Handle 180 flags 0x00 dlen 21                #90 [hci1] 7.254868
      SMP: Pairing Confirm (0x03) len 16
        Confim value: 72d4c5536526fa4bb45dcb0b2efd998b
> HCI Event: Number of Completed Packets (0x13) plen 5      #91 [hci1] 7.284949
        Num handles: 1
        Handle: 180 Address: DF:A9:FF:F6:B1:1A (OUI DF-A9-FF)
        Count: 1
        #90: len 21 (5 Kb/s)
        Latency: 30 msec (10-31 msec ~30 msec)
> ACL Data RX: Handle 180 flags 0x02 dlen 21                #92 [hci1] 7.335045
      SMP: Pairing Confirm (0x03) len 16
        Confim value: fc25667bcbb515a48cd38db384af99a8
< HCI Command: Host Number of Compl.. (0x03|0x0035) plen 5  #93 [hci1] 7.354085
        Num handles: 1
        Handle: 180 Address: DF:A9:FF:F6:B1:1A (OUI DF-A9-FF)
        Count: 1
< ACL Data TX: Handle 180 flags 0x00 dlen 21                #94 [hci1] 7.354140
      SMP: Pairing Random (0x04) len 16
        Random value: 6e64e79f33b2e374394db8ab2d95badd
> HCI Event: Number of Completed Packets (0x13) plen 5      #95 [hci1] 7.384885
        Num handles: 1
        Handle: 180 Address: DF:A9:FF:F6:B1:1A (OUI DF-A9-FF)
        Count: 1
        #94: len 21 (5 Kb/s)
        Latency: 30 msec (10-31 msec ~30 msec)
> ACL Data RX: Handle 180 flags 0x02 dlen 21                #96 [hci1] 7.635091
      SMP: Pairing Random (0x04) len 16
        Random value: 78b015d4767ef7cb07175d6e4f954f0d
< HCI Command: Host Number of Compl.. (0x03|0x0035) plen 5  #97 [hci1] 7.654732
        Num handles: 1
        Handle: 180 Address: DF:A9:FF:F6:B1:1A (OUI DF-A9-FF)
        Count: 1
< ACL Data TX: Handle 180 flags 0x00 dlen 21                #98 [hci1] 7.654935
      SMP: Pairing Confirm (0x03) len 16
        Confim value: 80a408b7d32a1a468fe0e0fec20c4c3b
> HCI Event: Number of Completed Packets (0x13) plen 5      #99 [hci1] 7.684925
        Num handles: 1
        Handle: 180 Address: DF:A9:FF:F6:B1:1A (OUI DF-A9-FF)
        Count: 1
        #98: len 21 (5 Kb/s)
        Latency: 29 msec (10-31 msec ~30 msec)
> ACL Data RX: Handle 180 flags 0x02 dlen 21               #100 [hci1] 7.735172
      SMP: Pairing Confirm (0x03) len 16
        Confim value: bddd37dd4ec9c42d527186e5b3d959c4
< HCI Command: Host Number of Comp.. (0x03|0x0035) plen 5  #101 [hci1] 7.755425
        Num handles: 1
        Handle: 180 Address: DF:A9:FF:F6:B1:1A (OUI DF-A9-FF)
        Count: 1
< ACL Data TX: Handle 180 flags 0x00 dlen 21               #102 [hci1] 7.755490
      SMP: Pairing Random (0x04) len 16
        Random value: e2838e9a8cc6964353c850fef72c5ceb
> HCI Event: Number of Completed Packets (0x13) plen 5     #103 [hci1] 7.784907
        Num handles: 1
        Handle: 180 Address: DF:A9:FF:F6:B1:1A (OUI DF-A9-FF)
        Count: 1
        #102: len 21 (5 Kb/s)
        Latency: 29 msec (10-31 msec ~29 msec)
> ACL Data RX: Handle 180 flags 0x02 dlen 21               #104 [hci1] 8.035046
      SMP: Pairing Random (0x04) len 16
        Random value: 08e6fe6cdb47d81fb6b68bcdeee89547
< HCI Command: Host Number of Comp.. (0x03|0x0035) plen 5  #105 [hci1] 8.054149
        Num handles: 1
        Handle: 180 Address: DF:A9:FF:F6:B1:1A (OUI DF-A9-FF)
        Count: 1
< ACL Data TX: Handle 180 flags 0x00 dlen 21               #106 [hci1] 8.054180
      SMP: Pairing Confirm (0x03) len 16
        Confim value: f46fe81b532a9ddf28a2899abaed4fc6
> HCI Event: Number of Completed Packets (0x13) plen 5     #107 [hci1] 8.084876
        Num handles: 1
        Handle: 180 Address: DF:A9:FF:F6:B1:1A (OUI DF-A9-FF)
        Count: 1
        #106: len 21 (5 Kb/s)
        Latency: 30 msec (10-31 msec ~30 msec)
> ACL Data RX: Handle 180 flags 0x02 dlen 21               #108 [hci1] 8.135053
      SMP: Pairing Confirm (0x03) len 16
        Confim value: 8c5cae066232d5b3f529583bb8451366
< HCI Command: Host Number of Comp.. (0x03|0x0035) plen 5  #109 [hci1] 8.154118
        Num handles: 1
        Handle: 180 Address: DF:A9:FF:F6:B1:1A (OUI DF-A9-FF)
        Count: 1
< ACL Data TX: Handle 180 flags 0x00 dlen 21               #110 [hci1] 8.154145
      SMP: Pairing Random (0x04) len 16
        Random value: 15536596b6fc3db1c86b2b19701bcf5c
> HCI Event: Number of Completed Packets (0x13) plen 5     #111 [hci1] 8.184857
        Num handles: 1
        Handle: 180 Address: DF:A9:FF:F6:B1:1A (OUI DF-A9-FF)
        Count: 1
        #110: len 21 (5 Kb/s)
        Latency: 30 msec (10-31 msec ~30 msec)
> ACL Data RX: Handle 180 flags 0x02 dlen 21               #112 [hci1] 8.435038
      SMP: Pairing Random (0x04) len 16
        Random value: 3104731b92b95b2cd7f3b31d43c332ff
< HCI Command: Host Number of Comp.. (0x03|0x0035) plen 5  #113 [hci1] 8.454778
        Num handles: 1
        Handle: 180 Address: DF:A9:FF:F6:B1:1A (OUI DF-A9-FF)
        Count: 1
< ACL Data TX: Handle 180 flags 0x00 dlen 21               #114 [hci1] 8.454969
      SMP: Pairing Confirm (0x03) len 16
        Confim value: 386b7d63b0e11978f41b8b4f2540fff9
> HCI Event: Number of Completed Packets (0x13) plen 5     #115 [hci1] 8.485034
        Num handles: 1
        Handle: 180 Address: DF:A9:FF:F6:B1:1A (OUI DF-A9-FF)
        Count: 1
        #114: len 21 (5 Kb/s)
        Latency: 30 msec (10-31 msec ~30 msec)
> ACL Data RX: Handle 180 flags 0x02 dlen 21               #116 [hci1] 8.535112
      SMP: Pairing Confirm (0x03) len 16
        Confim value: e60fe0eacc613a383248aba0239b9905
< HCI Command: Host Number of Comp.. (0x03|0x0035) plen 5  #117 [hci1] 8.554627
        Num handles: 1
        Handle: 180 Address: DF:A9:FF:F6:B1:1A (OUI DF-A9-FF)
        Count: 1
< ACL Data TX: Handle 180 flags 0x00 dlen 21               #118 [hci1] 8.554881
      SMP: Pairing Random (0x04) len 16
        Random value: c9ad9f2c3f295ebd5ad5e1c3cfeb215c
> HCI Event: Number of Completed Packets (0x13) plen 5     #119 [hci1] 8.584849
        Num handles: 1
        Handle: 180 Address: DF:A9:FF:F6:B1:1A (OUI DF-A9-FF)
        Count: 1
        #118: len 21 (5 Kb/s)
        Latency: 29 msec (10-31 msec ~30 msec)
> ACL Data RX: Handle 180 flags 0x02 dlen 21               #120 [hci1] 8.835069
      SMP: Pairing Random (0x04) len 16
        Random value: f00acc188a86455d48310bf71938ccfd
< HCI Command: Host Number of Comp.. (0x03|0x0035) plen 5  #121 [hci1] 8.854656
        Num handles: 1
        Handle: 180 Address: DF:A9:FF:F6:B1:1A (OUI DF-A9-FF)
        Count: 1
< ACL Data TX: Handle 180 flags 0x00 dlen 21               #122 [hci1] 8.854882
      SMP: Pairing Confirm (0x03) len 16
        Confim value: a2cc91f37570492fbe1cf919c6326a51
> HCI Event: Number of Completed Packets (0x13) plen 5     #123 [hci1] 8.884896
        Num handles: 1
        Handle: 180 Address: DF:A9:FF:F6:B1:1A (OUI DF-A9-FF)
        Count: 1
        #122: len 21 (5 Kb/s)
        Latency: 30 msec (10-31 msec ~30 msec)
> ACL Data RX: Handle 180 flags 0x02 dlen 21               #124 [hci1] 8.935094
      SMP: Pairing Confirm (0x03) len 16
        Confim value: 48c56c3495290090ab9c33769892c699
< HCI Command: Host Number of Comp.. (0x03|0x0035) plen 5  #125 [hci1] 8.954529
        Num handles: 1
        Handle: 180 Address: DF:A9:FF:F6:B1:1A (OUI DF-A9-FF)
        Count: 1
< ACL Data TX: Handle 180 flags 0x00 dlen 21               #126 [hci1] 8.954716
      SMP: Pairing Random (0x04) len 16
        Random value: 312cdf99c9491988e877355a9a8321c6
> HCI Event: Number of Completed Packets (0x13) plen 5     #127 [hci1] 8.984947
        Num handles: 1
        Handle: 180 Address: DF:A9:FF:F6:B1:1A (OUI DF-A9-FF)
        Count: 1
        #126: len 21 (5 Kb/s)
        Latency: 30 msec (10-31 msec ~30 msec)
> ACL Data RX: Handle 180 flags 0x02 dlen 21               #128 [hci1] 9.235179
      SMP: Pairing Random (0x04) len 16
        Random value: 813b9bddf09e9b5a241109367e99484b
< HCI Command: Host Number of Comp.. (0x03|0x0035) plen 5  #129 [hci1] 9.254667
        Num handles: 1
        Handle: 180 Address: DF:A9:FF:F6:B1:1A (OUI DF-A9-FF)
        Count: 1
< ACL Data TX: Handle 180 flags 0x00 dlen 21               #130 [hci1] 9.254882
      SMP: Pairing Confirm (0x03) len 16
        Confim value: a309161339f7858b42fcc219b0d4766b
> HCI Event: Number of Completed Packets (0x13) plen 5     #131 [hci1] 9.285030
        Num handles: 1
        Handle: 180 Address: DF:A9:FF:F6:B1:1A (OUI DF-A9-FF)
        Count: 1
        #130: len 21 (5 Kb/s)
        Latency: 30 msec (10-31 msec ~30 msec)
> ACL Data RX: Handle 180 flags 0x02 dlen 21               #132 [hci1] 9.335100
      SMP: Pairing Confirm (0x03) len 16
        Confim value: e95f088ea910a79a145f8951f24f4322
< HCI Command: Host Number of Comp.. (0x03|0x0035) plen 5  #133 [hci1] 9.354527
        Num handles: 1
        Handle: 180 Address: DF:A9:FF:F6:B1:1A (OUI DF-A9-FF)
        Count: 1
< ACL Data TX: Handle 180 flags 0x00 dlen 21               #134 [hci1] 9.354721
      SMP: Pairing Random (0x04) len 16
        Random value: a987d808e808655d558dfc1155a0b492
> HCI Event: Number of Completed Packets (0x13) plen 5     #135 [hci1] 9.384914
        Num handles: 1
        Handle: 180 Address: DF:A9:FF:F6:B1:1A (OUI DF-A9-FF)
        Count: 1
        #134: len 21 (5 Kb/s)
        Latency: 30 msec (10-31 msec ~30 msec)
> ACL Data RX: Handle 180 flags 0x02 dlen 21               #136 [hci1] 9.635119
      SMP: Pairing Random (0x04) len 16
        Random value: 6216b7242f33a30bc97260f1bf75ca31
< HCI Command: Host Number of Comp.. (0x03|0x0035) plen 5  #137 [hci1] 9.654728
        Num handles: 1
        Handle: 180 Address: DF:A9:FF:F6:B1:1A (OUI DF-A9-FF)
        Count: 1
< ACL Data TX: Handle 180 flags 0x00 dlen 21               #138 [hci1] 9.654922
      SMP: Pairing Confirm (0x03) len 16
        Confim value: cea1354ef06f62e393b248b05ccda92c
> HCI Event: Number of Completed Packets (0x13) plen 5     #139 [hci1] 9.684887
        Num handles: 1
        Handle: 180 Address: DF:A9:FF:F6:B1:1A (OUI DF-A9-FF)
        Count: 1
        #138: len 21 (5 Kb/s)
        Latency: 29 msec (10-31 msec ~30 msec)
> ACL Data RX: Handle 180 flags 0x02 dlen 21               #140 [hci1] 9.735030
      SMP: Pairing Confirm (0x03) len 16
        Confim value: 9a0ebd9c731b27d8ad83307bb25d2a39
< HCI Command: Host Number of Comp.. (0x03|0x0035) plen 5  #141 [hci1] 9.754683
        Num handles: 1
        Handle: 180 Address: DF:A9:FF:F6:B1:1A (OUI DF-A9-FF)
        Count: 1
< ACL Data TX: Handle 180 flags 0x00 dlen 21               #142 [hci1] 9.754913
      SMP: Pairing Random (0x04) len 16
        Random value: 6ad8f13724432c7fd6001c45ff744123
> HCI Event: Number of Completed Packets (0x13) plen 5     #143 [hci1] 9.784822
        Num handles: 1
        Handle: 180 Address: DF:A9:FF:F6:B1:1A (OUI DF-A9-FF)
        Count: 1
        #142: len 21 (5 Kb/s)
        Latency: 29 msec (10-31 msec ~29 msec)
> ACL Data RX: Handle 180 flags 0x02 dlen 21              #144 [hci1] 10.035003
      SMP: Pairing Random (0x04) len 16
        Random value: 4f5d35e5f6b5e09bd4770681689fb838
< HCI Command: Host Number of Com.. (0x03|0x0035) plen 5  #145 [hci1] 10.054543
        Num handles: 1
        Handle: 180 Address: DF:A9:FF:F6:B1:1A (OUI DF-A9-FF)
        Count: 1
< ACL Data TX: Handle 180 flags 0x00 dlen 21              #146 [hci1] 10.054696
      SMP: Pairing Confirm (0x03) len 16
        Confim value: cd01c13cb3fdb6868bb087cafb2f39c7
> HCI Event: Number of Completed Packets (0x13) plen 5    #147 [hci1] 10.084853
        Num handles: 1
        Handle: 180 Address: DF:A9:FF:F6:B1:1A (OUI DF-A9-FF)
        Count: 1
        #146: len 21 (5 Kb/s)
        Latency: 30 msec (10-31 msec ~30 msec)
> ACL Data RX: Handle 180 flags 0x02 dlen 21              #148 [hci1] 10.135058
      SMP: Pairing Confirm (0x03) len 16
        Confim value: 9f17fdab33cde68adec9d4d374e54032
< HCI Command: Host Number of Com.. (0x03|0x0035) plen 5  #149 [hci1] 10.154440
        Num handles: 1
        Handle: 180 Address: DF:A9:FF:F6:B1:1A (OUI DF-A9-FF)
        Count: 1
< ACL Data TX: Handle 180 flags 0x00 dlen 21              #150 [hci1] 10.154601
      SMP: Pairing Random (0x04) len 16
        Random value: ebbb5e14c8a6b9622f296d277ff3bf29
> HCI Event: Number of Completed Packets (0x13) plen 5    #151 [hci1] 10.184790
        Num handles: 1
        Handle: 180 Address: DF:A9:FF:F6:B1:1A (OUI DF-A9-FF)
        Count: 1
        #150: len 21 (5 Kb/s)
        Latency: 30 msec (10-31 msec ~30 msec)
> ACL Data RX: Handle 180 flags 0x02 dlen 21              #152 [hci1] 10.485032
      SMP: Pairing Random (0x04) len 16
        Random value: 4511695931d61971238130814726b62a
< HCI Command: Host Number of Com.. (0x03|0x0035) plen 5  #153 [hci1] 10.494253
        Num handles: 1
        Handle: 180 Address: DF:A9:FF:F6:B1:1A (OUI DF-A9-FF)
        Count: 1
< ACL Data TX: Handle 180 flags 0x00 dlen 21              #154 [hci1] 10.494356
      SMP: Pairing Confirm (0x03) len 16
        Confim value: 2ef621a2a9d7f1a82211e5044fa85ce6
> HCI Event: Number of Completed Packets (0x13) plen 5    #155 [hci1] 10.534864
        Num handles: 1
        Handle: 180 Address: DF:A9:FF:F6:B1:1A (OUI DF-A9-FF)
        Count: 1
        #154: len 21 (4 Kb/s)
        Latency: 40 msec (10-40 msec ~35 msec)
> ACL Data RX: Handle 180 flags 0x02 dlen 21              #156 [hci1] 10.585045
      SMP: Pairing Confirm (0x03) len 16
        Confim value: d5c668665f9b52a7790389a0f96214d9
< HCI Command: Host Number of Com.. (0x03|0x0035) plen 5  #157 [hci1] 10.594678
        Num handles: 1
        Handle: 180 Address: DF:A9:FF:F6:B1:1A (OUI DF-A9-FF)
        Count: 1
< ACL Data TX: Handle 180 flags 0x00 dlen 21              #158 [hci1] 10.594915
      SMP: Pairing Random (0x04) len 16
        Random value: 85e67448a15f56bd27e3a3cf1d832325
> HCI Event: Number of Completed Packets (0x13) plen 5    #159 [hci1] 10.634938
        Num handles: 1
        Handle: 180 Address: DF:A9:FF:F6:B1:1A (OUI DF-A9-FF)
        Count: 1
        #158: len 21 (4 Kb/s)
        Latency: 40 msec (10-40 msec ~37 msec)
> ACL Data RX: Handle 180 flags 0x02 dlen 21              #160 [hci1] 10.885067
      SMP: Pairing Random (0x04) len 16
        Random value: 8273e8fa0d875238d12f53c8695dab0f
< HCI Command: Host Number of Com.. (0x03|0x0035) plen 5  #161 [hci1] 10.894753
        Num handles: 1
        Handle: 180 Address: DF:A9:FF:F6:B1:1A (OUI DF-A9-FF)
        Count: 1
< ACL Data TX: Handle 180 flags 0x00 dlen 21              #162 [hci1] 10.894962
      SMP: Pairing Confirm (0x03) len 16
        Confim value: e2e7d085e11e2113efa2618d46f14a4c
> HCI Event: Number of Completed Packets (0x13) plen 5    #163 [hci1] 10.934894
        Num handles: 1
        Handle: 180 Address: DF:A9:FF:F6:B1:1A (OUI DF-A9-FF)
        Count: 1
        #162: len 21 (4 Kb/s)
        Latency: 39 msec (10-40 msec ~38 msec)
> ACL Data RX: Handle 180 flags 0x02 dlen 21              #164 [hci1] 10.984997
      SMP: Pairing Confirm (0x03) len 16
        Confim value: b156e977543f05a5d8231bef46149b4f
< HCI Command: Host Number of Com.. (0x03|0x0035) plen 5  #165 [hci1] 10.994232
        Num handles: 1
        Handle: 180 Address: DF:A9:FF:F6:B1:1A (OUI DF-A9-FF)
        Count: 1
< ACL Data TX: Handle 180 flags 0x00 dlen 21              #166 [hci1] 10.994369
      SMP: Pairing Random (0x04) len 16
        Random value: 3fd3ce4faf02be7293595bb7c6e45c58
> HCI Event: Number of Completed Packets (0x13) plen 5    #167 [hci1] 11.034816
        Num handles: 1
        Handle: 180 Address: DF:A9:FF:F6:B1:1A (OUI DF-A9-FF)
        Count: 1
        #166: len 21 (4 Kb/s)
        Latency: 40 msec (10-40 msec ~39 msec)
> ACL Data RX: Handle 180 flags 0x02 dlen 21              #168 [hci1] 11.285036
      SMP: Pairing Random (0x04) len 16
        Random value: 8303877ff8f8d0d73c6424701bd4b931
< HCI Command: Host Number of Com.. (0x03|0x0035) plen 5  #169 [hci1] 11.294719
        Num handles: 1
        Handle: 180 Address: DF:A9:FF:F6:B1:1A (OUI DF-A9-FF)
        Count: 1
< ACL Data TX: Handle 180 flags 0x00 dlen 21              #170 [hci1] 11.294962
      SMP: Pairing Confirm (0x03) len 16
        Confim value: 44aca18143349967464dbb0a1b9f2a5c
> HCI Event: Number of Completed Packets (0x13) plen 5    #171 [hci1] 11.334767
        Num handles: 1
        Handle: 180 Address: DF:A9:FF:F6:B1:1A (OUI DF-A9-FF)
        Count: 1
        #170: len 21 (4 Kb/s)
        Latency: 39 msec (10-40 msec ~39 msec)
> ACL Data RX: Handle 180 flags 0x02 dlen 21              #172 [hci1] 11.385047
      SMP: Pairing Confirm (0x03) len 16
        Confim value: 4c3f36b142e944a6653a82de97b53712
< HCI Command: Host Number of Com.. (0x03|0x0035) plen 5  #173 [hci1] 11.394660
        Num handles: 1
        Handle: 180 Address: DF:A9:FF:F6:B1:1A (OUI DF-A9-FF)
        Count: 1
< ACL Data TX: Handle 180 flags 0x00 dlen 21              #174 [hci1] 11.394892
      SMP: Pairing Random (0x04) len 16
        Random value: 1f855a6f6c3560debd84e2affc6847b6
> HCI Event: Number of Completed Packets (0x13) plen 5    #175 [hci1] 11.434801
        Num handles: 1
        Handle: 180 Address: DF:A9:FF:F6:B1:1A (OUI DF-A9-FF)
        Count: 1
        #174: len 21 (4 Kb/s)
        Latency: 39 msec (10-40 msec ~39 msec)
> ACL Data RX: Handle 180 flags 0x02 dlen 21              #176 [hci1] 11.685063
      SMP: Pairing Random (0x04) len 16
        Random value: 04835ce39d9b1879014197d1ea5c4819
< HCI Command: Host Number of Com.. (0x03|0x0035) plen 5  #177 [hci1] 11.694720
        Num handles: 1
        Handle: 180 Address: DF:A9:FF:F6:B1:1A (OUI DF-A9-FF)
        Count: 1
< ACL Data TX: Handle 180 flags 0x00 dlen 21              #178 [hci1] 11.694934
      SMP: Pairing Confirm (0x03) len 16
        Confim value: 2234f6ae2b0913c8dcfd15737831dabf
> HCI Event: Number of Completed Packets (0x13) plen 5    #179 [hci1] 11.734839
        Num handles: 1
        Handle: 180 Address: DF:A9:FF:F6:B1:1A (OUI DF-A9-FF)
        Count: 1
        #178: len 21 (4 Kb/s)
        Latency: 39 msec (10-40 msec ~39 msec)
> ACL Data RX: Handle 180 flags 0x02 dlen 21              #180 [hci1] 11.785000
      SMP: Pairing Confirm (0x03) len 16
        Confim value: d0cee832587971b5569038b638e8ce87
< HCI Command: Host Number of Com.. (0x03|0x0035) plen 5  #181 [hci1] 11.794563
        Num handles: 1
        Handle: 180 Address: DF:A9:FF:F6:B1:1A (OUI DF-A9-FF)
        Count: 1
< ACL Data TX: Handle 180 flags 0x00 dlen 21              #182 [hci1] 11.794771
      SMP: Pairing Random (0x04) len 16
        Random value: 16d5bf664139eda2b5425496665d7eed
> HCI Event: Number of Completed Packets (0x13) plen 5    #183 [hci1] 11.834794
        Num handles: 1
        Handle: 180 Address: DF:A9:FF:F6:B1:1A (OUI DF-A9-FF)
        Count: 1
        #182: len 21 (4 Kb/s)
        Latency: 40 msec (10-40 msec ~39 msec)
> ACL Data RX: Handle 180 flags 0x02 dlen 21              #184 [hci1] 12.085020
      SMP: Pairing Random (0x04) len 16
        Random value: 03f5bc5eec20ef85fe25e385a206fb8e
< HCI Command: Host Number of Com.. (0x03|0x0035) plen 5  #185 [hci1] 12.094473
        Num handles: 1
        Handle: 180 Address: DF:A9:FF:F6:B1:1A (OUI DF-A9-FF)
        Count: 1
< ACL Data TX: Handle 180 flags 0x00 dlen 21              #186 [hci1] 12.094636
      SMP: Pairing Confirm (0x03) len 16
        Confim value: 17f772053ed62038d5ac7465408bfc1f
> HCI Event: Number of Completed Packets (0x13) plen 5    #187 [hci1] 12.134742
        Num handles: 1
        Handle: 180 Address: DF:A9:FF:F6:B1:1A (OUI DF-A9-FF)
        Count: 1
        #186: len 21 (4 Kb/s)
        Latency: 40 msec (10-40 msec ~40 msec)
> ACL Data RX: Handle 180 flags 0x02 dlen 21              #188 [hci1] 12.185012
      SMP: Pairing Confirm (0x03) len 16
        Confim value: 34c4234d0f1a9b8c5143ec4daac126ff
< HCI Command: Host Number of Com.. (0x03|0x0035) plen 5  #189 [hci1] 12.194644
        Num handles: 1
        Handle: 180 Address: DF:A9:FF:F6:B1:1A (OUI DF-A9-FF)
        Count: 1
< ACL Data TX: Handle 180 flags 0x00 dlen 21              #190 [hci1] 12.194927
      SMP: Pairing Random (0x04) len 16
        Random value: 6500c95219dd01e09d1e63f87b860481
> HCI Event: Number of Completed Packets (0x13) plen 5    #191 [hci1] 12.234742
        Num handles: 1
        Handle: 180 Address: DF:A9:FF:F6:B1:1A (OUI DF-A9-FF)
        Count: 1
        #190: len 21 (4 Kb/s)
        Latency: 39 msec (10-40 msec ~39 msec)
> ACL Data RX: Handle 180 flags 0x02 dlen 21              #192 [hci1] 12.484973
      SMP: Pairing Random (0x04) len 16
        Random value: bc983a690f795ba54eb37b655123b89b
< HCI Command: Host Number of Com.. (0x03|0x0035) plen 5  #193 [hci1] 12.494569
        Num handles: 1
        Handle: 180 Address: DF:A9:FF:F6:B1:1A (OUI DF-A9-FF)
        Count: 1
< ACL Data TX: Handle 180 flags 0x00 dlen 21              #194 [hci1] 12.494768
      SMP: Pairing Confirm (0x03) len 16
        Confim value: fb5dd1beeda5d06ca5935ca1cea04c40
> HCI Event: Number of Completed Packets (0x13) plen 5    #195 [hci1] 12.534782
        Num handles: 1
        Handle: 180 Address: DF:A9:FF:F6:B1:1A (OUI DF-A9-FF)
        Count: 1
        #194: len 21 (4 Kb/s)
        Latency: 40 msec (10-40 msec ~39 msec)
> ACL Data RX: Handle 180 flags 0x02 dlen 21              #196 [hci1] 12.585006
      SMP: Pairing Confirm (0x03) len 16
        Confim value: cfefb9edc4836ed63a375d7123e13645
< HCI Command: Host Number of Com.. (0x03|0x0035) plen 5  #197 [hci1] 12.594447
        Num handles: 1
        Handle: 180 Address: DF:A9:FF:F6:B1:1A (OUI DF-A9-FF)
        Count: 1
< ACL Data TX: Handle 180 flags 0x00 dlen 21              #198 [hci1] 12.594620
      SMP: Pairing Random (0x04) len 16
        Random value: 47e1f6006d79c974bd9d9e1ee31049e7
> HCI Event: Number of Completed Packets (0x13) plen 5    #199 [hci1] 12.634758
        Num handles: 1
        Handle: 180 Address: DF:A9:FF:F6:B1:1A (OUI DF-A9-FF)
        Count: 1
        #198: len 21 (4 Kb/s)
        Latency: 40 msec (10-40 msec ~40 msec)
> ACL Data RX: Handle 180 flags 0x02 dlen 21              #200 [hci1] 12.884945
      SMP: Pairing Random (0x04) len 16
        Random value: adedadbd75d79fc24fcc168a4444a389
< HCI Command: Host Number of Com.. (0x03|0x0035) plen 5  #201 [hci1] 12.894344
        Num handles: 1
        Handle: 180 Address: DF:A9:FF:F6:B1:1A (OUI DF-A9-FF)
        Count: 1
< ACL Data TX: Handle 180 flags 0x00 dlen 21              #202 [hci1] 12.894447
      SMP: Pairing Confirm (0x03) len 16
        Confim value: 8eebcf6fff9ca2b4f605db295ed1cf42
> HCI Event: Number of Completed Packets (0x13) plen 5    #203 [hci1] 12.934821
        Num handles: 1
        Handle: 180 Address: DF:A9:FF:F6:B1:1A (OUI DF-A9-FF)
        Count: 1
        #202: len 21 (4 Kb/s)
        Latency: 40 msec (10-40 msec ~40 msec)
> ACL Data RX: Handle 180 flags 0x02 dlen 21              #204 [hci1] 12.984999
      SMP: Pairing Confirm (0x03) len 16
        Confim value: dc01ce8802a9bb4716cab81a784b566f
< HCI Command: Host Number of Com.. (0x03|0x0035) plen 5  #205 [hci1] 12.994573
        Num handles: 1
        Handle: 180 Address: DF:A9:FF:F6:B1:1A (OUI DF-A9-FF)
        Count: 1
< ACL Data TX: Handle 180 flags 0x00 dlen 21              #206 [hci1] 12.994786
      SMP: Pairing Random (0x04) len 16
        Random value: c2476823e41736a7e381bafb7c3fcffc
> HCI Event: Number of Completed Packets (0x13) plen 5    #207 [hci1] 13.034697
        Num handles: 1
        Handle: 180 Address: DF:A9:FF:F6:B1:1A (OUI DF-A9-FF)
        Count: 1
        #206: len 21 (4 Kb/s)
        Latency: 39 msec (10-40 msec ~40 msec)
> ACL Data RX: Handle 180 flags 0x02 dlen 21              #208 [hci1] 13.285045
      SMP: Pairing Random (0x04) len 16
        Random value: 92b72a54c9aa42069f8fa74c083a22e0
< HCI Command: Host Number of Com.. (0x03|0x0035) plen 5  #209 [hci1] 13.294702
        Num handles: 1
        Handle: 180 Address: DF:A9:FF:F6:B1:1A (OUI DF-A9-FF)
        Count: 1
< ACL Data TX: Handle 180 flags 0x00 dlen 21              #210 [hci1] 13.294913
      SMP: Pairing Confirm (0x03) len 16
        Confim value: c3b0509940ebfe97cfad20bd000f510f
> HCI Event: Number of Completed Packets (0x13) plen 5    #211 [hci1] 13.334769
        Num handles: 1
        Handle: 180 Address: DF:A9:FF:F6:B1:1A (OUI DF-A9-FF)
        Count: 1
        #210: len 21 (4 Kb/s)
        Latency: 39 msec (10-40 msec ~39 msec)
> ACL Data RX: Handle 180 flags 0x02 dlen 21              #212 [hci1] 13.385054
      SMP: Pairing Confirm (0x03) len 16
        Confim value: 03aae6a9d73619791c29a77c6a5b9f20
< HCI Command: Host Number of Com.. (0x03|0x0035) plen 5  #213 [hci1] 13.394657
        Num handles: 1
        Handle: 180 Address: DF:A9:FF:F6:B1:1A (OUI DF-A9-FF)
        Count: 1
< ACL Data TX: Handle 180 flags 0x00 dlen 21              #214 [hci1] 13.394861
      SMP: Pairing Random (0x04) len 16
        Random value: d9b0b09bc4296bf8753a8f6e1fa7d968
> HCI Event: Number of Completed Packets (0x13) plen 5    #215 [hci1] 13.434766
        Num handles: 1
        Handle: 180 Address: DF:A9:FF:F6:B1:1A (OUI DF-A9-FF)
        Count: 1
        #214: len 21 (4 Kb/s)
        Latency: 39 msec (10-40 msec ~39 msec)
> ACL Data RX: Handle 180 flags 0x02 dlen 21              #216 [hci1] 13.684900
      SMP: Pairing Random (0x04) len 16
        Random value: 69f60566fba408d8195f64456917da6a
< HCI Command: Host Number of Com.. (0x03|0x0035) plen 5  #217 [hci1] 13.694874
        Num handles: 1
        Handle: 180 Address: DF:A9:FF:F6:B1:1A (OUI DF-A9-FF)
        Count: 1
< ACL Data TX: Handle 180 flags 0x00 dlen 21              #218 [hci1] 13.695107
      SMP: Pairing Confirm (0x03) len 16
        Confim value: cc882011de8314124667885300da7c4f
> HCI Event: Number of Completed Packets (0x13) plen 5    #219 [hci1] 13.734720
        Num handles: 1
        Handle: 180 Address: DF:A9:FF:F6:B1:1A (OUI DF-A9-FF)
        Count: 1
        #218: len 21 (4 Kb/s)
        Latency: 39 msec (10-40 msec ~39 msec)
> ACL Data RX: Handle 180 flags 0x02 dlen 21              #220 [hci1] 13.785008
      SMP: Pairing Confirm (0x03) len 16
        Confim value: d4a2637377ccaec1688e07b2e198110e
< HCI Command: Host Number of Com.. (0x03|0x0035) plen 5  #221 [hci1] 13.794353
        Num handles: 1
        Handle: 180 Address: DF:A9:FF:F6:B1:1A (OUI DF-A9-FF)
        Count: 1
< ACL Data TX: Handle 180 flags 0x00 dlen 21              #222 [hci1] 13.794500
      SMP: Pairing Random (0x04) len 16
        Random value: f00de1357c99cea2f6ddb09677d02f35
> HCI Event: Number of Completed Packets (0x13) plen 5    #223 [hci1] 13.834831
        Num handles: 1
        Handle: 180 Address: DF:A9:FF:F6:B1:1A (OUI DF-A9-FF)
        Count: 1
        #222: len 21 (4 Kb/s)
        Latency: 40 msec (10-40 msec ~40 msec)
> ACL Data RX: Handle 180 flags 0x02 dlen 21              #224 [hci1] 14.084908
      SMP: Pairing Random (0x04) len 16
        Random value: 6eead36c35b5f6e2dbddc24e752aaf2f
< HCI Command: Host Number of Com.. (0x03|0x0035) plen 5  #225 [hci1] 14.094889
        Num handles: 1
        Handle: 180 Address: DF:A9:FF:F6:B1:1A (OUI DF-A9-FF)
        Count: 1
< ACL Data TX: Handle 180 flags 0x00 dlen 21              #226 [hci1] 14.095051
      SMP: Pairing DHKey Check (0x0d) len 16
        E: 77a6f68db65f6b60a54fa8bd7017db4d
> HCI Event: Number of Completed Packets (0x13) plen 5    #227 [hci1] 14.134750
        Num handles: 1
        Handle: 180 Address: DF:A9:FF:F6:B1:1A (OUI DF-A9-FF)
        Count: 1
        #226: len 21 (4 Kb/s)
        Latency: 39 msec (10-40 msec ~39 msec)
> ACL Data RX: Handle 180 flags 0x02 dlen 21              #228 [hci1] 14.184906
      SMP: Pairing DHKey Check (0x0d) len 16
        E: e569bb0613285eace1305e89acd79df6
< HCI Command: LE Start Encryption (0x08|0x0019) plen 28  #229 [hci1] 14.194467
        Handle: 180 Address: DF:A9:FF:F6:B1:1A (OUI DF-A9-FF)
        Random number: 0x0000000000000000
        Encrypted diversifier: 0x0000
        Long term key: aa7aa855ce11f499d4de20d4c287d716
> HCI Event: Command Status (0x0f) plen 4                 #230 [hci1] 14.195306
      LE Start Encryption (0x08|0x0019) ncmd 1
        Status: Success (0x00)
< HCI Command: Host Number of Com.. (0x03|0x0035) plen 5  #231 [hci1] 14.214321
        Num handles: 1
        Handle: 180 Address: DF:A9:FF:F6:B1:1A (OUI DF-A9-FF)
        Count: 1
