Bluetooth monitor ver 5.84
btmon[2158329]: = Note: Linux version 6.8.0-83-generic (x86_64)                                                          0.936477
btmon[2158329]: = Note: Bluetooth subsystem version 2.22                                                                 0.936478
= New Index: 00:00:00:00:00:00 (Primary,UART,hci0)                                                                       0.936479
= Open Index: 00:00:00:00:00:00                                                                                          1.440900
= Index Info: 00:00:00:00:00:00 (Nordic Semiconductor ASA)                                                               1.440904
zephyr.exe[2158331]: @ USER Open: main (privileged) version 2.22                                                {0x0001} 1.440907
zephyr.exe[2158331]: < HCI Command: Reset (0x03|0x0003) plen 0                                                        #1 1.441017
> HCI Event: Command Complete (0x0e) plen 4                                                                           #2 1.441426
      Reset (0x03|0x0003) ncmd 1
        Status: Success (0x00)
zephyr.exe[2158331]: < HCI Command: Read Local Supported Features (0x04|0x0003) plen 0                                #3 1.460918
> HCI Event: Command Complete (0x0e) plen 12                                                                          #4 1.461384
      Read Local Supported Features (0x04|0x0003) ncmd 1
        Status: Success (0x00)
        Features: 0x00 0x00 0x00 0x00 0x60 0x00 0x00 0x00
          BR/EDR Not Supported
          LE Supported (Controller)
zephyr.exe[2158331]: < HCI Command: Read Local Version Information (0x04|0x0001) plen 0                               #5 1.480912
> HCI Event: Command Complete (0x0e) plen 12                                                                          #6 1.481384
      Read Local Version Information (0x04|0x0001) ncmd 1
        Status: Success (0x00)
        HCI version: Reserved (0x0e) - Revision 12520 (0x30e8)
        LMP version: Reserved (0x0e) - Subversion 12520 (0x30e8)
        Manufacturer: Nordic Semiconductor ASA (89)
zephyr.exe[2158331]: < HCI Command: Read Local Supported Commands (0x04|0x0002) plen 0                                #7 1.500926
> HCI Event: Command Complete (0x0e) plen 68                                                                          #8 1.501986
      Read Local Supported Commands (0x04|0x0002) ncmd 1
        Status: Success (0x00)
        Commands: 119 entries
          Disconnect (Octet 0 - Bit 5)
          Read Remote Version Information (Octet 2 - Bit 7)
          Set Event Mask (Octet 5 - Bit 6)
          Reset (Octet 5 - Bit 7)
          Read Connection Accept Timeout (Octet 7 - Bit 2)
          Write Connection Accept Timeout (Octet 7 - Bit 3)
          Read Transmit Power Level (Octet 10 - Bit 2)
          Set Controller To Host Flow Control (Octet 10 - Bit 5)
          Host Buffer Size (Octet 10 - Bit 6)
          Host Number of Completed Packets (Octet 10 - Bit 7)
          Read Local Version Information (Octet 14 - Bit 3)
          Read Local Supported Features (Octet 14 - Bit 5)
          Read BD ADDR (Octet 15 - Bit 1)
          Read RSSI (Octet 15 - Bit 5)
          Set Event Mask Page 2 (Octet 22 - Bit 2)
          LE Set Event Mask (Octet 25 - Bit 0)
          LE Read Buffer Size (Octet 25 - Bit 1)
          LE Read Local Supported Features (Octet 25 - Bit 2)
          LE Set Random Address (Octet 25 - Bit 4)
          LE Set Advertising Parameters (Octet 25 - Bit 5)
          LE Read Advertising Channel TX Power (Octet 25 - Bit 6)
          LE Set Advertising Data (Octet 25 - Bit 7)
          LE Set Scan Response Data (Octet 26 - Bit 0)
          LE Set Advertise Enable (Octet 26 - Bit 1)
          LE Set Scan Parameters (Octet 26 - Bit 2)
          LE Set Scan Enable (Octet 26 - Bit 3)
          LE Create Connection (Octet 26 - Bit 4)
          LE Create Connection Cancel (Octet 26 - Bit 5)
          LE Read Accept List Size (Octet 26 - Bit 6)
          LE Clear Accept List (Octet 26 - Bit 7)
          LE Add Device To Accept List (Octet 27 - Bit 0)
          LE Remove Device From Accept List (Octet 27 - Bit 1)
          LE Connection Update (Octet 27 - Bit 2)
          LE Set Host Channel Classification (Octet 27 - Bit 3)
          LE Read Channel Map (Octet 27 - Bit 4)
          LE Read Remote Used Features (Octet 27 - Bit 5)
          LE Encrypt (Octet 27 - Bit 6)
          LE Rand (Octet 27 - Bit 7)
          LE Start Encryption (Octet 28 - Bit 0)
          LE Long Term Key Request Reply (Octet 28 - Bit 1)
          LE Long Term Key Request Neg Reply (Octet 28 - Bit 2)
          LE Read Supported States (Octet 28 - Bit 3)
          LE Receiver Test (Octet 28 - Bit 4)
          LE Transmitter Test (Octet 28 - Bit 5)
          LE Test End (Octet 28 - Bit 6)
          Read Authenticated Payload Timeout (Octet 32 - Bit 4)
          Write Authenticated Payload Timeout (Octet 32 - Bit 5)
          LE Set Data Length (Octet 33 - Bit 6)
          LE Read Suggested Default Data Length (Octet 33 - Bit 7)
          LE Write Suggested Default Data Length (Octet 34 - Bit 0)
          LE Add Device To Resolving List (Octet 34 - Bit 3)
          LE Remove Device From Resolving List (Octet 34 - Bit 4)
          LE Clear Resolving List (Octet 34 - Bit 5)
          LE Read Resolving List Size (Octet 34 - Bit 6)
          LE Set Address Resolution Enable (Octet 35 - Bit 1)
          LE Set Resolvable Private Address Timeout (Octet 35 - Bit 2)
          LE Read Maximum Data Length (Octet 35 - Bit 3)
          LE Read PHY (Octet 35 - Bit 4)
          LE Set Default PHY (Octet 35 - Bit 5)
          LE Set PHY (Octet 35 - Bit 6)
          LE Enhanced Receiver Test (Octet 35 - Bit 7)
          LE Enhanced Transmitter Test (Octet 36 - Bit 0)
          LE Set Advertising Set Random Address (Octet 36 - Bit 1)
          LE Set Extended Advertising Parameters (Octet 36 - Bit 2)
          LE Set Extended Advertising Data (Octet 36 - Bit 3)
          LE Set Extended Scan Response Data (Octet 36 - Bit 4)
          LE Set Extended Advertising Enable (Octet 36 - Bit 5)
          LE Read Maximum Advertising Data Length (Octet 36 - Bit 6)
          LE Read Number of Supported Advertising Sets (Octet 36 - Bit 7)
          LE Remove Advertising Set (Octet 37 - Bit 0)
          LE Clear Advertising Sets (Octet 37 - Bit 1)
          LE Set Periodic Advertising Parameters (Octet 37 - Bit 2)
          LE Set Periodic Advertising Data (Octet 37 - Bit 3)
          LE Set Periodic Advertising Enable (Octet 37 - Bit 4)
          LE Set Extended Scan Parameters (Octet 37 - Bit 5)
          LE Set Extended Scan Enable (Octet 37 - Bit 6)
          LE Extended Create Connection (Octet 37 - Bit 7)
          LE Periodic Advertising Create Sync (Octet 38 - Bit 0)
          LE Periodic Advertising Create Sync Cancel (Octet 38 - Bit 1)
          LE Periodic Advertising Terminate Sync (Octet 38 - Bit 2)
          LE Add Device To Periodic Advertiser List (Octet 38 - Bit 3)
          LE Remove Device From Periodic Advertiser List (Octet 38 - Bit 4)
          LE Clear Periodic Advertiser List (Octet 38 - Bit 5)
          LE Read Periodic Advertiser List Size (Octet 38 - Bit 6)
          LE Read Transmit Power (Octet 38 - Bit 7)
          LE Read RF Path Compensation (Octet 39 - Bit 0)
          LE Write RF Path Compensation (Octet 39 - Bit 1)
          LE Set Privacy Mode (Octet 39 - Bit 2)
          LE Periodic Advertising Receive Enable (Octet 40 - Bit 5)
          LE Periodic Advertising Sync Transfer (Octet 40 - Bit 6)
          LE Periodic Advertising Set Info Transfer (Octet 40 - Bit 7)
          LE Periodic Advertising Sync Transfer Parameters (Octet 41 - Bit 0)
          LE Set Default Periodic Advertisng Sync Transfer Parameters (Octet 41 - Bit 1)
          LE Read Buffer v2 (Octet 41 - Bit 5)
          LE Read ISO TX Sync (Octet 41 - Bit 6)
          LE Set Connected Isochronous Group Parameters (Octet 41 - Bit 7)
          LE Set Connected Isochronous Group Parameters Test (Octet 42 - Bit 0)
          LE Create Connected Isochronous Stream (Octet 42 - Bit 1)
          LE Remove Connected Isochronous Group (Octet 42 - Bit 2)
          LE Accept Connected Isochronous Stream Request (Octet 42 - Bit 3)
          LE Reject Connected Isochronous Stream Request (Octet 42 - Bit 4)
          LE Create Broadcast Isochronous Group (Octet 42 - Bit 5)
          LE Create Broadcast Isochronous Group Test (Octet 42 - Bit 6)
          LE Terminate Broadcast Isochronous Group (Octet 42 - Bit 7)
          LE Broadcast Isochronous Group Create Sync (Octet 43 - Bit 0)
          LE Broadcast Isochronous Group Terminate Sync (Octet 43 - Bit 1)
          LE Request Peer SCA (Octet 43 - Bit 2)
          LE Setup Isochronous Data Path (Octet 43 - Bit 3)
          LE Remove Isochronous Data Path (Octet 43 - Bit 4)
          LE Isochronous Transmit Test (Octet 43 - Bit 5)
          LE Isochronous Receive Test (Octet 43 - Bit 6)
          LE Isochronous Read Test Counters (Octet 43 - Bit 7)
          LE Isochronous Read Test Counters (Octet 44 - Bit 0)
          LE Set Host Feature (Octet 44 - Bit 1)
          LE Read ISO link quality (Octet 44 - Bit 2)
          Octet 45 - Bit 6 
          Octet 46 - Bit 0 
          Octet 46 - Bit 1 
          Octet 46 - Bit 2 
zephyr.exe[2158331]: < HCI Command: Host Buffer Size (0x03|0x0033) plen 7                                             #9 1.520906
        ACL MTU: 255  ACL max packet: 16
        SCO MTU: 0    SCO max packet: 0
> HCI Event: Command Complete (0x0e) plen 4                                                                          #10 1.521407
      Host Buffer Size (0x03|0x0033) ncmd 1
        Status: Success (0x00)
zephyr.exe[2158331]: < HCI Command: Set Controller To Host Flow Control (0x03|0x0031) plen 1                         #11 1.543811
        Flow control: ACL Data Packets (0x01)
> HCI Event: Command Complete (0x0e) plen 4                                                                          #12 1.544269
      Set Controller To Host Flow Control (0x03|0x0031) ncmd 1
        Status: Success (0x00)
zephyr.exe[2158331]: < HCI Command: LE Read Local Supported Features (0x08|0x0003) plen 0                            #13 1.560988
> HCI Event: Command Complete (0x0e) plen 12                                                                         #14 1.561455
      LE Read Local Supported Features (0x08|0x0003) ncmd 1
        Status: Success (0x00)
        Features: 0xfd 0x79 0x00 0xf7 0x30 0x01 0x00 0x00
          LE Encryption
          Extended Reject Indication
          Peripheral-initiated Features Exchange
          LE Ping
          LE Data Packet Length Extension
          LL Privacy
          Extended Scanner Filter Policies
          LE 2M PHY
          LE Coded PHY
          LE Extended Advertising
          LE Periodic Advertising
          Channel Selection Algorithm #2
          Periodic Advertising Sync Transfer - Sender
          Periodic Advertising Sync Transfer - Recipient
          Sleep Clock Accuracy Updates
          Connected Isochronous Stream - Central
          Connected Isochronous Stream - Peripheral
          Isochronous Broadcaster
          Synchronized Receiver
          Periodic Advertising ADI support
          Connection Subrating
          Unknown features (0x0000010000000000)
zephyr.exe[2158331]: < HCI Command: LE Set Host Feature (0x08|0x0074) plen 2                                         #15 1.580953
        Bit Number: 32
          Connected Isochronous Stream (Host Support)
        Bit Value: 1
> HCI Event: Command Complete (0x0e) plen 4                                                                          #16 1.581356
      LE Set Host Feature (0x08|0x0074) ncmd 1
        Status: Success (0x00)
zephyr.exe[2158331]: < HCI Command: LE Read Buffer v2 (0x08|0x0060) plen 0                                           #17 1.600951
> HCI Event: Command Complete (0x0e) plen 10                                                                         #18 1.601441
      LE Read Buffer v2 (0x08|0x0060) ncmd 1
        Status: Success (0x00)
        ACL MTU: 27
        ACL max packet: 3
        ISO MTU: 318
        ISO max packet: 3
zephyr.exe[2158331]: < HCI Command: LE Read Maximum Advertising Data Length (0x08|0x003a) plen 0                     #19 1.620959
> HCI Event: Command Complete (0x0e) plen 6                                                                          #20 1.621398
      LE Read Maximum Advertising Data Length (0x08|0x003a) ncmd 1
        Status: Success (0x00)
        Max length: 1650
zephyr.exe[2158331]: < HCI Command: LE Read Supported States (0x08|0x001c) plen 0                                    #21 1.642162
> HCI Event: Command Complete (0x0e) plen 12                                                                         #22 1.642664
      LE Read Supported States (0x08|0x001c) ncmd 1
        Status: Success (0x00)
        States: 0x000003ff3e0306ff
          Non-connectable Advertising State
          Scannable Advertising State
          Connectable Advertising State
          High Duty Cycle Directed Advertising State
          Passive Scanning State
          Active Scanning State
          Initiating State
            and Connection State (Central Role)
          Connection State (Peripheral Role)
          Scannable Advertising State
            and Passive Scanning State
          Connectable Advertising State
            and Passive Scanning State
          Non-connectable Advertising State
            and Initiating State
          Scannable Advertising State
            and Initiating State
          Active Scanning State
            and Connection State (Central Role)
          Passive Scanning State
            and Connection State (Peripheral Role)
          Active Scanning State
            and Connection State (Peripheral Role)
          Initiating State
            and Connection State (Central Role)
            and Central Role & Central Role
          Low Duty Cycle Directed Advertising State
          Connectable Advertising State
            and Initiating State
            and Central Role & Peripheral Role
          High Duty Cycle Directed Advertising State
            and Initiating State
            and Central Role & Peripheral Role
          Low Duty Cycle Directed Advertising State
            and Initiating State
            and Central Role & Peripheral Role
          Connectable Advertising State
            and Connection State (Central Role)
            and Central Role & Peripheral Role
          High Duty Cycle Directed Advertising State
            and Connection State (Central Role)
            and Central Role & Peripheral Role
          Low Duty Cycle Directed Advertising State
            and Connection State (Central Role)
            and Central Role & Peripheral Role
          Connectable Advertising State
            and Connection State (Peripheral Role)
            and Central Role & Peripheral Role
          High Duty Cycle Directed Advertising State
            and Connection State (Peripheral Role)
            and Peripheral Role & Peripheral Role
          Low Duty Cycle Directed Advertising State
            and Connection State (Peripheral Role)
            and Peripheral Role & Peripheral Role
          Initiating State
            and Connection State (Peripheral Role)
            and Central Role & Peripheral Role
zephyr.exe[2158331]: < HCI Command: LE Read Maximum Data Length (0x08|0x002f) plen 0                                 #23 1.660914
> HCI Event: Command Complete (0x0e) plen 12                                                                         #24 1.661490
      LE Read Maximum Data Length (0x08|0x002f) ncmd 1
        Status: Success (0x00)
        Max TX octets: 251
        Max TX time: 2704
        Max RX octets: 251
        Max RX time: 2704
zephyr.exe[2158331]: < HCI Command: LE Write Suggested Default Data Length (0x08|0x0024) plen 4                      #25 1.680939
        TX octets: 251
        TX time: 2704
> HCI Event: Command Complete (0x0e) plen 4                                                                          #26 1.681370
      LE Write Suggested Default Data Length (0x08|0x0024) ncmd 1
        Status: Success (0x00)
zephyr.exe[2158331]: < HCI Command: LE Read Resolving List Size (0x08|0x002a) plen 0                                 #27 1.700934
> HCI Event: Command Complete (0x0e) plen 5                                                                          #28 1.701386
      LE Read Resolving List Size (0x08|0x002a) ncmd 1
        Status: Success (0x00)
        Size: 8
zephyr.exe[2158331]: < HCI Command: LE Set Event Mask (0x08|0x0001) plen 8                                           #29 1.720926
        Mask: 0x000002023f87fa5e
          LE Advertising Report
          LE Connection Update Complete
          LE Read Remote Used Features Complete
          LE Long Term Key Request
          LE Data Length Change
          LE Enhanced Connection Complete
          LE PHY Update Complete
          LE Extended Advertising Report
          LE Periodic Advertising Sync Established
          LE Periodic Advertising Report
          LE Periodic Advertising Sync Lost
          LE Extended Scan Timeout
          LE Extended Advertising Set Terminated
          LE Scan Request Received
          LE Periodic Advertising Sync Transfer Rvc
          LE CIS Established
          LE CIS Request
          LE Create BIG Complete
          LE Terminate BIG Complete
          LE BIG Sync Established Complete
          LE BIG Sync Lost
          LE BIG Info Advertising Report
          Unknown mask (0x0000020000000000)
> HCI Event: Command Complete (0x0e) plen 4                                                                          #30 1.721422
      LE Set Event Mask (0x08|0x0001) ncmd 1
        Status: Success (0x00)
zephyr.exe[2158331]: < HCI Command: Set Event Mask (0x03|0x0001) plen 8                                              #31 1.740903
        Mask: 0x2000800002008890
          Disconnection Complete
          Encryption Change
          Read Remote Version Information Complete
          Hardware Error
          Data Buffer Overflow
          Encryption Key Refresh Complete
          LE Meta
> HCI Event: Command Complete (0x0e) plen 4                                                                          #32 1.741398
      Set Event Mask (0x03|0x0001) ncmd 1
        Status: Success (0x00)
zephyr.exe[2158331]: < HCI Command: Read BD ADDR (0x04|0x0009) plen 0                                                #33 1.760857
> HCI Event: Command Complete (0x0e) plen 10                                                                         #34 1.761298
      Read BD ADDR (0x04|0x0009) ncmd 1
        Status: Success (0x00)
        Address: 00:00:00:00:00:00 (OUI 00-00-00)
zephyr.exe[2158331]: < HCI Command: LE Set Random Address (0x08|0x0005) plen 6                                       #35 1.780956
        Address: D5:B6:CC:31:DB:3B (Static)
> HCI Event: Command Complete (0x0e) plen 4                                                                          #36 1.781426
      LE Set Random Address (0x08|0x0005) ncmd 1
        Status: Success (0x00)
zephyr.exe[2158331]: < HCI Command: LE Set Extended Advertising Parameters (0x08|0x0036) plen 25                     #37 4.110949
        Handle: 0x00
        Properties: 0x0013
          Connectable
          Scannable
          Use legacy advertising PDUs: ADV_IND
        Min advertising interval: 100.000 msec (0x00a0)
        Max advertising interval: 150.000 msec (0x00f0)
        Channel map: 37, 38, 39 (0x07)
        Own address type: Random (0x01)
        Peer address type: Public (0x00)
        Peer address: 00:00:00:00:00:00 (OUI 00-00-00)
        Filter policy: Allow Scan Request from Any, Allow Connect Request from Any (0x00)
        TX power: Host has no preference (0x7f)
        Primary PHY: LE 1M (0x01)
        Secondary max skip: 0x00
        Secondary PHY: LE 1M (0x01)
        SID: 0x00
        Scan request notifications: Disabled (0x00)
> HCI Event: Command Complete (0x0e) plen 5                                                                          #38 4.111664
      LE Set Extended Advertising Parameters (0x08|0x0036) ncmd 1
        Status: Success (0x00)
        TX power (selected): 0 dbm (0x00)
zephyr.exe[2158331]: < HCI Command: LE Set Advertising Set Random Address (0x08|0x0035) plen 7                       #39 4.120958
        Advertising handle: 0x00
        Advertising random address: D5:B6:CC:31:DB:3B (Static)
> HCI Event: Command Complete (0x0e) plen 4                                                                          #40 4.121436
      LE Set Advertising Set Random Address (0x08|0x0035) ncmd 1
        Status: Success (0x00)
zephyr.exe[2158331]: < HCI Command: LE Set Extended Advertising Data (0x08|0x0037) plen 22                           #41 4.140963
        Handle: 0x00
        Operation: Complete extended advertising data (0x03)
        Fragment preference: Minimize fragmentation (0x01)
        Data length: 0x12
        Flags: 0x06
          LE General Discoverable Mode
          BR/EDR Not Supported
        Name (complete): Tester_2CB6EE
> HCI Event: Command Complete (0x0e) plen 4                                                                          #42 4.141613
      LE Set Extended Advertising Data (0x08|0x0037) ncmd 1
        Status: Success (0x00)
zephyr.exe[2158331]: < HCI Command: LE Set Extended Scan Response Data (0x08|0x0038) plen 4                          #43 4.160965
        Handle: 0x00
        Operation: Complete scan response data (0x03)
        Fragment preference: Minimize fragmentation (0x01)
        Data length: 0x00
> HCI Event: Command Complete (0x0e) plen 4                                                                          #44 4.161406
      LE Set Extended Scan Response Data (0x08|0x0038) ncmd 1
        Status: Success (0x00)
zephyr.exe[2158331]: < HCI Command: LE Set Extended Advertising Enable (0x08|0x0039) plen 6                          #45 4.180971
        Extended advertising: Enabled (0x01)
        Number of sets: 1 (0x01)
        Entry 0
          Handle: 0x00
          Duration: 0 ms (0x00)
          Max ext adv events: 0
> HCI Event: Command Complete (0x0e) plen 4                                                                          #46 4.181521
      LE Set Extended Advertising Enable (0x08|0x0039) ncmd 1
        Status: Success (0x00)
> HCI Event: LE Meta Event (0x3e) plen 31                                                                            #47 4.287720
      LE Enhanced Connection Complete (0x0a)
        Status: Success (0x00)
        Handle: 273
        Role: Peripheral (0x01)
        Peer address type: Public (0x00)
        Peer address: C0:07:E8:2C:B6:EE (OUI C0-07-E8)
        Local resolvable private address: 00:00:00:00:00:00 (Non-Resolvable)
        Peer resolvable private address: 00:00:00:00:00:00 (Non-Resolvable)
        Connection interval: 62.50 msec (0x0032)
        Connection latency: 0 (0x0000)
        Supervision timeout: 25120 msec (0x09d0)
        Central clock accuracy: 0x07
> HCI Event: LE Meta Event (0x3e) plen 6                                                                             #48 4.287836
      LE Advertising Set Terminated (0x12)
        Status: Success (0x00)
        Handle: 0
        Connection handle: 273
        Number of completed extended advertising events: 0
zephyr.exe[2158331]: < HCI Command: LE Read Remote Used Features (0x08|0x0016) plen 2                                #49 4.301021
        Handle: 273 Address: C0:07:E8:2C:B6:EE (OUI C0-07-E8)
> HCI Event: Command Status (0x0f) plen 4                                                                            #50 4.301417
      LE Read Remote Used Features (0x08|0x0016) ncmd 1
        Status: Success (0x00)
zephyr.exe[2158331]: < HCI Command: LE Set PHY (0x08|0x0032) plen 7                                                  #51 4.320966
        Handle: 273 Address: C0:07:E8:2C:B6:EE (OUI C0-07-E8)
        All PHYs preference: 0x00
        TX PHYs preference: 0x02
          LE 2M
        RX PHYs preference: 0x02
          LE 2M
        PHY options preference: Reserved (0x0000)
> HCI Event: Command Status (0x0f) plen 4                                                                            #52 4.321479
      LE Set PHY (0x08|0x0032) ncmd 1
        Status: Success (0x00)
zephyr.exe[2158331]: < ACL Data TX: Handle 273 [1/3] flags 0x00 dlen 7                                               #53 4.340958
      ATT: Exchange MTU Request (0x02) len 2
        Client RX MTU: 251
> HCI Event: Number of Completed Packets (0x13) plen 5                                                               #54 4.413782
        Num handles: 1
        Handle: 273 Address: C0:07:E8:2C:B6:EE (OUI C0-07-E8)
        Count: 1
        Buffers: 0/3
        #53: len 7 (0 Kb/s)
        Latency: 72 msec (72-72 msec ~72 msec)
> HCI Event: LE Meta Event (0x3e) plen 12                                                                            #55 4.476713
      LE Read Remote Used Features (0x04)
        Status: Success (0x00)
        Handle: 273 Address: C0:07:E8:2C:B6:EE (OUI C0-07-E8)
        Features: 0x2d 0x49 0x01 0xf7 0xef 0x39 0x00 0x80
          LE Encryption
          Extended Reject Indication
          Peripheral-initiated Features Exchange
          LE Data Packet Length Extension
          LE 2M PHY
          LE Coded PHY
          Channel Selection Algorithm #2
          Minimum Number of Used Channels Procedure
          Periodic Advertising Sync Transfer - Sender
          Periodic Advertising Sync Transfer - Recipient
          Sleep Clock Accuracy Updates
          Connected Isochronous Stream - Central
          Connected Isochronous Stream - Peripheral
          Isochronous Broadcaster
          Synchronized Receiver
          Connected Isochronous Stream (Host Support)
          LE Power Control Request
          LE Power Control Request
          LE Path Loss Monitoring
          Connection Subrating
          Connection Subrating (Host Support)
          Channel Classification
          Unknown features (0x8000390000000000)
> ACL Data RX: Handle 273 flags 0x02 dlen 7                                                                          #56 4.788889
      ATT: Exchange MTU Request (0x02) len 2
        Client RX MTU: 64
> ACL Data RX: Handle 273 flags 0x02 dlen 7                                                                          #57 4.789375
      ATT: Exchange MTU Response (0x03) len 2
        Server RX MTU: 64
zephyr.exe[2158331]: < HCI Command: Host Number of Completed Packets (0x03|0x0035) plen 5                            #58 4.801017
        Num handles: 1
        Handle: 273 Address: C0:07:E8:2C:B6:EE (OUI C0-07-E8)
        Count: 1
zephyr.exe[2158331]: < ACL Data TX: Handle 273 [1/3] flags 0x00 dlen 7                                               #59 4.801023
      ATT: Exchange MTU Response (0x03) len 2
        Server RX MTU: 251
zephyr.exe[2158331]: < HCI Command: Host Number of Completed Packets (0x03|0x0035) plen 5                            #60 4.801024
        Num handles: 1
        Handle: 273 Address: C0:07:E8:2C:B6:EE (OUI C0-07-E8)
        Count: 1
> HCI Event: Number of Completed Packets (0x13) plen 5                                                               #61 4.913797
        Num handles: 1
        Handle: 273 Address: C0:07:E8:2C:B6:EE (OUI C0-07-E8)
        Count: 1
        Buffers: 0/3
        #59: len 7 (0 Kb/s)
        Latency: 112 msec (72-112 msec ~92 msec)
> HCI Event: LE Meta Event (0x3e) plen 6                                                                             #62 4.975945
      LE PHY Update Complete (0x0c)
        Status: Success (0x00)
        Handle: 273 Address: C0:07:E8:2C:B6:EE (OUI C0-07-E8)
        TX PHY: LE 2M (0x02)
        RX PHY: LE 2M (0x02)
> ACL Data RX: Handle 273 flags 0x02 dlen 11                                                                         #63 6.913852
      SMP: Pairing Request (0x01) len 6
        IO capability: KeyboardDisplay (0x04)
        OOB data: Authentication data not present (0x00)
        Authentication requirement: Bonding, No MITM, SC, No Keypresses (0x09)
        Max encryption key size: 16
        Initiator key distribution: EncKey IdKey (0x03)
        Responder key distribution: EncKey IdKey Sign (0x07)
zephyr.exe[2158331]: < HCI Command: Host Number of Completed Packets (0x03|0x0035) plen 5                            #64 6.921045
        Num handles: 1
        Handle: 273 Address: C0:07:E8:2C:B6:EE (OUI C0-07-E8)
        Count: 1
zephyr.exe[2158331]: < ACL Data TX: Handle 273 [1/3] flags 0x00 dlen 11                                              #65 6.921055
      SMP: Pairing Response (0x02) len 6
        IO capability: NoInputNoOutput (0x03)
        OOB data: Authentication data not present (0x00)
        Authentication requirement: Bonding, No MITM, SC, No Keypresses (0x09)
        Max encryption key size: 16
        Initiator key distribution: IdKey (0x02)
        Responder key distribution: Sign (0x04)
> HCI Event: Number of Completed Packets (0x13) plen 5                                                               #66 7.038837
        Num handles: 1
        Handle: 273 Address: C0:07:E8:2C:B6:EE (OUI C0-07-E8)
        Count: 1
        Buffers: 0/3
        #65: len 11 (0 Kb/s)
        Latency: 117 msec (72-117 msec ~105 msec)
> ACL Data RX: Handle 273 flags 0x02 dlen 27                                                                         #67 7.039177
> ACL Data RX: Handle 273 flags 0x01 dlen 27                                                                         #68 7.039554
> ACL Data RX: Handle 273 flags 0x01 dlen 15                                                                         #69 7.039827
      SMP: Pairing Public Key (0x0c) len 64
        X[32]: e5e638c991abea8b5aee4d49df71dea567130759bce7259314681658801758e5
        Y[32]: feff5ae076c191ed593ac9af7fbf4f284b391405410834f3ccca5abae5a21774
zephyr.exe[2158331]: < HCI Command: Host Number of Completed Packets (0x03|0x0035) plen 5                            #70 7.041020
        Num handles: 1
        Handle: 273 Address: C0:07:E8:2C:B6:EE (OUI C0-07-E8)
        Count: 1
zephyr.exe[2158331]: < HCI Command: Host Number of Completed Packets (0x03|0x0035) plen 5                            #71 7.041040
        Num handles: 1
        Handle: 273 Address: C0:07:E8:2C:B6:EE (OUI C0-07-E8)
        Count: 1
zephyr.exe[2158331]: < HCI Command: Host Number of Completed Packets (0x03|0x0035) plen 5                            #72 7.041064
        Num handles: 1
        Handle: 273 Address: C0:07:E8:2C:B6:EE (OUI C0-07-E8)
        Count: 1
zephyr.exe[2158331]: < ACL Data TX: Handle 273 [1/3] flags 0x00 dlen 27                                              #73 7.041073
zephyr.exe[2158331]: < ACL Data TX: Handle 273 flags 0x01 dlen 27                                                    #74 7.041088
zephyr.exe[2158331]: < ACL Data TX: Handle 273 flags 0x01 dlen 15                                                    #75 7.041091
      SMP: Pairing Public Key (0x0c) len 64
        X[32]: 98308440221e2d910f0e54b71e7ec652857aa9b5a0dc65028824cc19db1226e9
        Y[32]: 67a4816bcb62efb21701e31fdb27561a6217575fb007a8bbdabe7e28b6f68482
> HCI Event: Number of Completed Packets (0x13) plen 5                                                               #76 7.101705
        Num handles: 1
        Handle: 273 Address: C0:07:E8:2C:B6:EE (OUI C0-07-E8)
        Count: 1
        Buffers: 0/3
        #73: len 27 (3 Kb/s)
        Latency: 60 msec (60-117 msec ~82 msec)
> HCI Event: Number of Completed Packets (0x13) plen 5                                                               #77 7.102212
        Num handles: 1
        Handle: 273 Address: C0:07:E8:2C:B6:EE (OUI C0-07-E8)
        Count: 1
        Buffers: underflow/3
        #74: len 27 (3 Kb/s)
        Latency: 61 msec (60-117 msec ~72 msec)
zephyr.exe[2158331]: < ACL Data TX: Handle 273 [1/3] flags 0x00 dlen 21                                              #78 7.120925
      SMP: Pairing Confirm (0x03) len 16
        Confirm value[16]: 88ecb4583b412e6b992ba15ba0ef7eb7
> HCI Event: Number of Completed Packets (0x13) plen 5                                                               #79 7.163785
        Num handles: 1
        Handle: 273 Address: C0:07:E8:2C:B6:EE (OUI C0-07-E8)
        Count: 1
        Buffers: 0/3
        #75: len 15 (0 Kb/s)
        Latency: 122 msec (60-122 msec ~97 msec)
> HCI Event: Number of Completed Packets (0x13) plen 5                                                               #80 7.226354
        Num handles: 1
        Handle: 273 Address: C0:07:E8:2C:B6:EE (OUI C0-07-E8)
        Count: 1
        Buffers: underflow/3
        #78: len 21 (1 Kb/s)
        Latency: 105 msec (60-122 msec ~101 msec)
> ACL Data RX: Handle 273 flags 0x02 dlen 21                                                                         #81 7.226596
      SMP: Pairing Random (0x04) len 16
        Random value[16]: bf6ce534f1c8e0780000000000000000
zephyr.exe[2158331]: < HCI Command: Host Number of Completed Packets (0x03|0x0035) plen 5                            #82 7.241006
        Num handles: 1
        Handle: 273 Address: C0:07:E8:2C:B6:EE (OUI C0-07-E8)
        Count: 1
zephyr.exe[2158331]: < ACL Data TX: Handle 273 [1/3] flags 0x00 dlen 21                                              #83 7.241013
      SMP: Pairing Random (0x04) len 16
        Random value[16]: 8e6108f966a694cbe26df70bb96773e6
> HCI Event: Number of Completed Packets (0x13) plen 5                                                               #84 7.351217
        Num handles: 1
        Handle: 273 Address: C0:07:E8:2C:B6:EE (OUI C0-07-E8)
        Count: 1
        Buffers: 0/3
        #83: len 21 (1 Kb/s)
        Latency: 110 msec (60-122 msec ~105 msec)
> ACL Data RX: Handle 273 flags 0x02 dlen 21                                                                         #85 7.413952
      SMP: Pairing DHKey Check (0x0d) len 16
        E[16]: f55564aba96fc0d85d79a5bd16bfc020
zephyr.exe[2158331]: < HCI Command: Host Number of Completed Packets (0x03|0x0035) plen 5                            #86 7.421024
        Num handles: 1
        Handle: 273 Address: C0:07:E8:2C:B6:EE (OUI C0-07-E8)
        Count: 1
zephyr.exe[2158331]: < ACL Data TX: Handle 273 [1/3] flags 0x00 dlen 21                                              #87 7.421066
      SMP: Pairing DHKey Check (0x0d) len 16
        E[16]: 55124d5e03ce1334689124c1e0f73b41
> HCI Event: Number of Completed Packets (0x13) plen 5                                                               #88 7.538739
        Num handles: 1
        Handle: 273 Address: C0:07:E8:2C:B6:EE (OUI C0-07-E8)
        Count: 1
        Buffers: 0/3
        #87: len 21 (1 Kb/s)
        Latency: 117 msec (60-122 msec ~111 msec)
> HCI Event: LE Meta Event (0x3e) plen 13                                                                            #89 7.601722
      LE Long Term Key Request (0x05)
        Handle: 273 Address: C0:07:E8:2C:B6:EE (OUI C0-07-E8)
        Random number: 0x0000000000000000
        Encrypted diversifier: 0x0000
zephyr.exe[2158331]: < HCI Command: LE Long Term Key Request Reply (0x08|0x001a) plen 18                             #90 7.621040
        Handle: 273 Address: C0:07:E8:2C:B6:EE (OUI C0-07-E8)
        Long term key[16]: b22b02dec8eeea05a145474047c6d8fb
> HCI Event: Command Complete (0x0e) plen 6                                                                          #91 7.621714
      LE Long Term Key Request Reply (0x08|0x001a) ncmd 1
        Status: Success (0x00)
        Handle: 273 Address: C0:07:E8:2C:B6:EE (OUI C0-07-E8)
> HCI Event: Encryption Change (0x08) plen 4                                                                         #92 7.913950
        Status: Success (0x00)
        Handle: 273 Address: C0:07:E8:2C:B6:EE (OUI C0-07-E8)
        Encryption: Enabled with AES-CCM (0x01)
zephyr.exe[2158331]: < ACL Data TX: Handle 273 [1/3] flags 0x00 dlen 21                                              #93 8.031030
      SMP: Signing Information (0x0a) len 16
        Signature key[16]: 5da095555cc64d02679f89a05211af56
> HCI Event: Number of Completed Packets (0x13) plen 5                                                               #94 8.101334
        Num handles: 1
        Handle: 273 Address: C0:07:E8:2C:B6:EE (OUI C0-07-E8)
        Count: 1
        Buffers: 0/3
        #93: len 21 (2 Kb/s)
        Latency: 70 msec (60-122 msec ~91 msec)
> ACL Data RX: Handle 273 flags 0x02 dlen 21                                                                         #95 8.101604
      SMP: Identity Information (0x08) len 16
        Identity resolving key[16]: b26db5a3fc36a91dc95bd9ef697abcc7
> ACL Data RX: Handle 273 flags 0x02 dlen 12                                                                         #96 8.101851
      SMP: Identity Address Information (0x09) len 7
        Address: C0:07:E8:2C:B6:EE (OUI C0-07-E8)
zephyr.exe[2158331]: < HCI Command: Host Number of Completed Packets (0x03|0x0035) plen 5                            #97 8.121070
        Num handles: 1
        Handle: 273 Address: C0:07:E8:2C:B6:EE (OUI C0-07-E8)
        Count: 1
zephyr.exe[2158331]: < HCI Command: LE Add Device To Resolving List (0x08|0x0027) plen 39                            #98 8.121164
        Address type: Public (0x00)
        Address: C0:07:E8:2C:B6:EE (OUI C0-07-E8)
        Peer identity resolving key[16]: b26db5a3fc36a91dc95bd9ef697abcc7
        Local identity resolving key[16]: 00000000000000000000000000000000
> HCI Event: Command Complete (0x0e) plen 4                                                                          #99 8.122070
      LE Add Device To Resolving List (0x08|0x0027) ncmd 1
        Status: Success (0x00)
zephyr.exe[2158331]: < HCI Command: LE Set Privacy Mode (0x08|0x004e) plen 8                                        #100 8.141056
        Peer Identity address type: Public (0x00)
        Peer Identity address: C0:07:E8:2C:B6:EE (OUI C0-07-E8)
        Privacy Mode: Use Device Privacy (0x01)
> HCI Event: Command Complete (0x0e) plen 4                                                                         #101 8.141566
      LE Set Privacy Mode (0x08|0x004e) ncmd 1
        Status: Success (0x00)
zephyr.exe[2158331]: < HCI Command: LE Set Address Resolution Enable (0x08|0x002d) plen 1                           #102 8.161028
        Address resolution: Enabled (0x01)
> HCI Event: Command Complete (0x0e) plen 4                                                                         #103 8.161498
      LE Set Address Resolution Enable (0x08|0x002d) ncmd 1
        Status: Success (0x00)
zephyr.exe[2158331]: < HCI Command: Host Number of Completed Packets (0x03|0x0035) plen 5                           #104 8.181016
        Num handles: 1
        Handle: 273 Address: C0:07:E8:2C:B6:EE (OUI C0-07-E8)
        Count: 1
> ACL Data RX: Handle 273 flags 0x02 dlen 13                                                                        #105 8.226369
      ATT: Find By Type Value Request (0x06) len 8
        Handle range: 0x0001-0xffff
        Attribute type: Primary Service (0x2800)
          UUID: Audio Stream Control (0x184e)
zephyr.exe[2158331]: < HCI Command: Host Number of Completed Packets (0x03|0x0035) plen 5                           #106 8.241044
        Num handles: 1
        Handle: 273 Address: C0:07:E8:2C:B6:EE (OUI C0-07-E8)
        Count: 1
zephyr.exe[2158331]: < ACL Data TX: Handle 273 [1/3] flags 0x00 dlen 9                                              #107 8.241050
      ATT: Find By Type Value Response (0x07) len 4
        Handle range: 0x0037-0x0046
> HCI Event: Number of Completed Packets (0x13) plen 5                                                              #108 8.351322
        Num handles: 1
        Handle: 273 Address: C0:07:E8:2C:B6:EE (OUI C0-07-E8)
        Count: 1
        Buffers: 0/3
        #107: len 9 (0 Kb/s)
        Latency: 110 msec (60-122 msec ~100 msec)
> ACL Data RX: Handle 273 flags 0x02 dlen 13                                                                        #109 8.351583
      ATT: Find By Type Value Request (0x06) len 8
        Handle range: 0x0047-0xffff
        Attribute type: Primary Service (0x2800)
          UUID: Audio Stream Control (0x184e)
zephyr.exe[2158331]: < HCI Command: Host Number of Completed Packets (0x03|0x0035) plen 5                           #110 8.361032
        Num handles: 1
        Handle: 273 Address: C0:07:E8:2C:B6:EE (OUI C0-07-E8)
        Count: 1
zephyr.exe[2158331]: < ACL Data TX: Handle 273 [1/3] flags 0x00 dlen 9                                              #111 8.361057
      ATT: Error Response (0x01) len 4
        Find By Type Value Request (0x06)
        Handle: 0x0047
        Error: Attribute Not Found (0x0a)
> HCI Event: Number of Completed Packets (0x13) plen 5                                                              #112 8.476342
        Num handles: 1
        Handle: 273 Address: C0:07:E8:2C:B6:EE (OUI C0-07-E8)
        Count: 1
        Buffers: 0/3
        #111: len 9 (0 Kb/s)
        Latency: 115 msec (60-122 msec ~107 msec)
> ACL Data RX: Handle 273 flags 0x02 dlen 11                                                                        #113 8.476525
      ATT: Read By Type Request (0x08) len 6
        Handle range: 0x0037-0x0046
        Attribute type: Characteristic (0x2803)
zephyr.exe[2158331]: < HCI Command: Host Number of Completed Packets (0x03|0x0035) plen 5                           #114 8.481053
        Num handles: 1
        Handle: 273 Address: C0:07:E8:2C:B6:EE (OUI C0-07-E8)
        Count: 1
zephyr.exe[2158331]: < ACL Data TX: Handle 273 [1/3] flags 0x00 dlen 27                                             #115 8.481063
zephyr.exe[2158331]: < ACL Data TX: Handle 273 flags 0x01 dlen 14                                                   #116 8.481065
      ATT: Read By Type Response (0x09) len 36
        Attribute data length: 7
        Attribute data list: 5 entries
        Handle: 0x0038
        Value[5]: 1c3900c62b
            Properties: 0x1c
              Write Without Response (0x04)
              Write (0x08)
              Notify (0x10)
            Value Handle: 0x0039
            Value UUID: ASE Control Point (0x2bc6)
        Handle: 0x003b
        Value[5]: 123c00c42b
            Properties: 0x12
              Read (0x02)
              Notify (0x10)
            Value Handle: 0x003c
            Value UUID: Sink ASE (0x2bc4)
        Handle: 0x003e
        Value[5]: 123f00c42b
            Properties: 0x12
              Read (0x02)
              Notify (0x10)
            Value Handle: 0x003f
            Value UUID: Sink ASE (0x2bc4)
        Handle: 0x0041
        Value[5]: 124200c52b
            Properties: 0x12
              Read (0x02)
              Notify (0x10)
            Value Handle: 0x0042
            Value UUID: Source ASE (0x2bc5)
        Handle: 0x0044
        Value[5]: 124500c52b
            Properties: 0x12
              Read (0x02)
              Notify (0x10)
            Value Handle: 0x0045
            Value UUID: Source ASE (0x2bc5)
> HCI Event: Number of Completed Packets (0x13) plen 5                                                              #117 8.539306
        Num handles: 1
        Handle: 273 Address: C0:07:E8:2C:B6:EE (OUI C0-07-E8)
        Count: 1
        Buffers: 0/3
        #115: len 27 (3 Kb/s)
        Latency: 58 msec (58-122 msec ~83 msec)
> HCI Event: Number of Completed Packets (0x13) plen 5                                                              #118 8.603083
        Num handles: 1
        Handle: 273 Address: C0:07:E8:2C:B6:EE (OUI C0-07-E8)
        Count: 1
        Buffers: underflow/3
        #116: len 14 (0 Kb/s)
        Latency: 122 msec (58-122 msec ~102 msec)
> ACL Data RX: Handle 273 flags 0x02 dlen 11                                                                        #119 8.603087
      ATT: Read By Type Request (0x08) len 6
        Handle range: 0x0045-0x0046
        Attribute type: Characteristic (0x2803)
zephyr.exe[2158331]: < HCI Command: Host Number of Completed Packets (0x03|0x0035) plen 5                           #120 8.621053
        Num handles: 1
        Handle: 273 Address: C0:07:E8:2C:B6:EE (OUI C0-07-E8)
        Count: 1
zephyr.exe[2158331]: < ACL Data TX: Handle 273 [1/3] flags 0x00 dlen 9                                              #121 8.621071
      ATT: Error Response (0x01) len 4
        Read By Type Request (0x08)
        Handle: 0x0045
        Error: Attribute Not Found (0x0a)
> HCI Event: Number of Completed Packets (0x13) plen 5                                                              #122 8.726345
        Num handles: 1
        Handle: 273 Address: C0:07:E8:2C:B6:EE (OUI C0-07-E8)
        Count: 1
        Buffers: 0/3
        #121: len 9 (0 Kb/s)
        Latency: 105 msec (58-122 msec ~103 msec)
> ACL Data RX: Handle 273 flags 0x02 dlen 9                                                                         #123 8.726469
      ATT: Find Information Request (0x04) len 4
        Handle range: 0x003a-0x003a
zephyr.exe[2158331]: < HCI Command: Host Number of Completed Packets (0x03|0x0035) plen 5                           #124 8.741053
        Num handles: 1
        Handle: 273 Address: C0:07:E8:2C:B6:EE (OUI C0-07-E8)
        Count: 1
zephyr.exe[2158331]: < ACL Data TX: Handle 273 [1/3] flags 0x00 dlen 10                                             #125 8.741068
      ATT: Find Information Response (0x05) len 5
        Format: UUID-16 (0x01)
        Handle: 0x003a
        UUID: Client Characteristic Configuration (0x2902)
> HCI Event: Number of Completed Packets (0x13) plen 5                                                              #126 8.851276
        Num handles: 1
        Handle: 273 Address: C0:07:E8:2C:B6:EE (OUI C0-07-E8)
        Count: 1
        Buffers: 0/3
        #125: len 10 (0 Kb/s)
        Latency: 110 msec (58-122 msec ~107 msec)
> ACL Data RX: Handle 273 flags 0x02 dlen 9                                                                         #127 8.851527
      ATT: Find Information Request (0x04) len 4
        Handle range: 0x003d-0x003d
zephyr.exe[2158331]: < HCI Command: Host Number of Completed Packets (0x03|0x0035) plen 5                           #128 8.861070
        Num handles: 1
        Handle: 273 Address: C0:07:E8:2C:B6:EE (OUI C0-07-E8)
        Count: 1
zephyr.exe[2158331]: < ACL Data TX: Handle 273 [1/3] flags 0x00 dlen 10                                             #129 8.861143
      ATT: Find Information Response (0x05) len 5
        Format: UUID-16 (0x01)
        Handle: 0x003d
        UUID: Client Characteristic Configuration (0x2902)
> HCI Event: Number of Completed Packets (0x13) plen 5                                                              #130 8.976313
        Num handles: 1
        Handle: 273 Address: C0:07:E8:2C:B6:EE (OUI C0-07-E8)
        Count: 1
        Buffers: 0/3
        #129: len 10 (0 Kb/s)
        Latency: 115 msec (58-122 msec ~111 msec)
> ACL Data RX: Handle 273 flags 0x02 dlen 9                                                                         #131 8.976484
      ATT: Find Information Request (0x04) len 4
        Handle range: 0x0040-0x0040
zephyr.exe[2158331]: < HCI Command: Host Number of Completed Packets (0x03|0x0035) plen 5                           #132 8.980996
        Num handles: 1
        Handle: 273 Address: C0:07:E8:2C:B6:EE (OUI C0-07-E8)
        Count: 1
zephyr.exe[2158331]: < ACL Data TX: Handle 273 [1/3] flags 0x00 dlen 10                                             #133 8.981001
      ATT: Find Information Response (0x05) len 5
        Format: UUID-16 (0x01)
        Handle: 0x0040
        UUID: Client Characteristic Configuration (0x2902)
> HCI Event: Number of Completed Packets (0x13) plen 5                                                              #134 9.101338
        Num handles: 1
        Handle: 273 Address: C0:07:E8:2C:B6:EE (OUI C0-07-E8)
        Count: 1
        Buffers: 0/3
        #133: len 10 (0 Kb/s)
        Latency: 120 msec (58-122 msec ~115 msec)
> ACL Data RX: Handle 273 flags 0x02 dlen 9                                                                         #135 9.101572
      ATT: Find Information Request (0x04) len 4
        Handle range: 0x0043-0x0043
zephyr.exe[2158331]: < HCI Command: Host Number of Completed Packets (0x03|0x0035) plen 5                           #136 9.121052
        Num handles: 1
        Handle: 273 Address: C0:07:E8:2C:B6:EE (OUI C0-07-E8)
        Count: 1
zephyr.exe[2158331]: < ACL Data TX: Handle 273 [1/3] flags 0x00 dlen 10                                             #137 9.121073
      ATT: Find Information Response (0x05) len 5
        Format: UUID-16 (0x01)
        Handle: 0x0043
        UUID: Client Characteristic Configuration (0x2902)
> HCI Event: Number of Completed Packets (0x13) plen 5                                                              #138 9.226318
        Num handles: 1
        Handle: 273 Address: C0:07:E8:2C:B6:EE (OUI C0-07-E8)
        Count: 1
        Buffers: 0/3
        #137: len 10 (0 Kb/s)
        Latency: 105 msec (58-122 msec ~110 msec)
> ACL Data RX: Handle 273 flags 0x02 dlen 9                                                                         #139 9.226531
      ATT: Find Information Request (0x04) len 4
        Handle range: 0x0046-0x0046
zephyr.exe[2158331]: < HCI Command: Host Number of Completed Packets (0x03|0x0035) plen 5                           #140 9.241080
        Num handles: 1
        Handle: 273 Address: C0:07:E8:2C:B6:EE (OUI C0-07-E8)
        Count: 1
zephyr.exe[2158331]: < ACL Data TX: Handle 273 [1/3] flags 0x00 dlen 10                                             #141 9.241174
      ATT: Find Information Response (0x05) len 5
        Format: UUID-16 (0x01)
        Handle: 0x0046
        UUID: Client Characteristic Configuration (0x2902)
> HCI Event: Number of Completed Packets (0x13) plen 5                                                              #142 9.351370
        Num handles: 1
        Handle: 273 Address: C0:07:E8:2C:B6:EE (OUI C0-07-E8)
        Count: 1
        Buffers: 0/3
        #141: len 10 (0 Kb/s)
        Latency: 110 msec (58-122 msec ~110 msec)
> ACL Data RX: Handle 273 flags 0x02 dlen 9                                                                         #143 9.351527
      ATT: Write Request (0x12) len 4
        Handle: 0x003a
          Data[2]: 0000
zephyr.exe[2158331]: < HCI Command: Host Number of Completed Packets (0x03|0x0035) plen 5                           #144 9.361050
        Num handles: 1
        Handle: 273 Address: C0:07:E8:2C:B6:EE (OUI C0-07-E8)
        Count: 1
zephyr.exe[2158331]: < ACL Data TX: Handle 273 [1/3] flags 0x00 dlen 5                                              #145 9.361061
      ATT: Write Response (0x13) len 0
> HCI Event: Number of Completed Packets (0x13) plen 5                                                              #146 9.476391
        Num handles: 1
        Handle: 273 Address: C0:07:E8:2C:B6:EE (OUI C0-07-E8)
        Count: 1
        Buffers: 0/3
        #145: len 5 (0 Kb/s)
        Latency: 115 msec (58-122 msec ~112 msec)
> ACL Data RX: Handle 273 flags 0x02 dlen 9                                                                         #147 9.476534
      ATT: Write Request (0x12) len 4
        Handle: 0x003a
          Data[2]: 0100
zephyr.exe[2158331]: < HCI Command: Host Number of Completed Packets (0x03|0x0035) plen 5                           #148 9.481079
        Num handles: 1
        Handle: 273 Address: C0:07:E8:2C:B6:EE (OUI C0-07-E8)
        Count: 1
zephyr.exe[2158331]: < ACL Data TX: Handle 273 [1/3] flags 0x00 dlen 5                                              #149 9.481137
      ATT: Write Response (0x13) len 0
> HCI Event: Number of Completed Packets (0x13) plen 5                                                              #150 9.601359
        Num handles: 1
        Handle: 273 Address: C0:07:E8:2C:B6:EE (OUI C0-07-E8)
        Count: 1
        Buffers: 0/3
        #149: len 5 (0 Kb/s)
        Latency: 120 msec (58-122 msec ~116 msec)
> ACL Data RX: Handle 273 flags 0x02 dlen 9                                                                         #151 9.601462
      ATT: Write Request (0x12) len 4
        Handle: 0x003d
          Data[2]: 0000
zephyr.exe[2158331]: < HCI Command: Host Number of Completed Packets (0x03|0x0035) plen 5                           #152 9.621074
        Num handles: 1
        Handle: 273 Address: C0:07:E8:2C:B6:EE (OUI C0-07-E8)
        Count: 1
zephyr.exe[2158331]: < ACL Data TX: Handle 273 [1/3] flags 0x00 dlen 5                                              #153 9.621131
      ATT: Write Response (0x13) len 0
> HCI Event: Number of Completed Packets (0x13) plen 5                                                              #154 9.726334
        Num handles: 1
        Handle: 273 Address: C0:07:E8:2C:B6:EE (OUI C0-07-E8)
        Count: 1
        Buffers: 0/3
        #153: len 5 (0 Kb/s)
        Latency: 105 msec (58-122 msec ~110 msec)
> ACL Data RX: Handle 273 flags 0x02 dlen 9                                                                         #155 9.726486
      ATT: Write Request (0x12) len 4
        Handle: 0x003d
          Data[2]: 0100
zephyr.exe[2158331]: < HCI Command: Host Number of Completed Packets (0x03|0x0035) plen 5                           #156 9.741041
        Num handles: 1
        Handle: 273 Address: C0:07:E8:2C:B6:EE (OUI C0-07-E8)
        Count: 1
zephyr.exe[2158331]: < ACL Data TX: Handle 273 [1/3] flags 0x00 dlen 5                                              #157 9.741082
      ATT: Write Response (0x13) len 0
> HCI Event: Number of Completed Packets (0x13) plen 5                                                              #158 9.851376
        Num handles: 1
        Handle: 273 Address: C0:07:E8:2C:B6:EE (OUI C0-07-E8)
        Count: 1
        Buffers: 0/3
        #157: len 5 (0 Kb/s)
        Latency: 110 msec (58-122 msec ~110 msec)
> ACL Data RX: Handle 273 flags 0x02 dlen 9                                                                         #159 9.851516
      ATT: Write Request (0x12) len 4
        Handle: 0x0040
          Data[2]: 0000
zephyr.exe[2158331]: < HCI Command: Host Number of Completed Packets (0x03|0x0035) plen 5                           #160 9.861062
        Num handles: 1
        Handle: 273 Address: C0:07:E8:2C:B6:EE (OUI C0-07-E8)
        Count: 1
zephyr.exe[2158331]: < ACL Data TX: Handle 273 [1/3] flags 0x00 dlen 5                                              #161 9.861067
      ATT: Write Response (0x13) len 0
> HCI Event: Number of Completed Packets (0x13) plen 5                                                              #162 9.976375
        Num handles: 1
        Handle: 273 Address: C0:07:E8:2C:B6:EE (OUI C0-07-E8)
        Count: 1
        Buffers: 0/3
        #161: len 5 (0 Kb/s)
        Latency: 115 msec (58-122 msec ~112 msec)
> ACL Data RX: Handle 273 flags 0x02 dlen 9                                                                         #163 9.976545
      ATT: Write Request (0x12) len 4
        Handle: 0x0040
          Data[2]: 0100
zephyr.exe[2158331]: < HCI Command: Host Number of Completed Packets (0x03|0x0035) plen 5                           #164 9.981059
        Num handles: 1
        Handle: 273 Address: C0:07:E8:2C:B6:EE (OUI C0-07-E8)
        Count: 1
zephyr.exe[2158331]: < ACL Data TX: Handle 273 [1/3] flags 0x00 dlen 5                                              #165 9.981064
      ATT: Write Response (0x13) len 0
> HCI Event: Number of Completed Packets (0x13) plen 5                                                             #166 10.101422
        Num handles: 1
        Handle: 273 Address: C0:07:E8:2C:B6:EE (OUI C0-07-E8)
        Count: 1
        Buffers: 0/3
        #165: len 5 (0 Kb/s)
        Latency: 120 msec (58-122 msec ~116 msec)
> ACL Data RX: Handle 273 flags 0x02 dlen 9                                                                        #167 10.101550
      ATT: Write Request (0x12) len 4
        Handle: 0x0043
          Data[2]: 0000
zephyr.exe[2158331]: < HCI Command: Host Number of Completed Packets (0x03|0x0035) plen 5                          #168 10.121059
        Num handles: 1
        Handle: 273 Address: C0:07:E8:2C:B6:EE (OUI C0-07-E8)
        Count: 1
zephyr.exe[2158331]: < ACL Data TX: Handle 273 [1/3] flags 0x00 dlen 5                                             #169 10.121065
      ATT: Write Response (0x13) len 0
> HCI Event: Number of Completed Packets (0x13) plen 5                                                             #170 10.226370
        Num handles: 1
        Handle: 273 Address: C0:07:E8:2C:B6:EE (OUI C0-07-E8)
        Count: 1
        Buffers: 0/3
        #169: len 5 (0 Kb/s)
        Latency: 105 msec (58-122 msec ~110 msec)
> ACL Data RX: Handle 273 flags 0x02 dlen 9                                                                        #171 10.226514
      ATT: Write Request (0x12) len 4
        Handle: 0x0043
          Data[2]: 0100
zephyr.exe[2158331]: < HCI Command: Host Number of Completed Packets (0x03|0x0035) plen 5                          #172 10.241065
        Num handles: 1
        Handle: 273 Address: C0:07:E8:2C:B6:EE (OUI C0-07-E8)
        Count: 1
zephyr.exe[2158331]: < ACL Data TX: Handle 273 [1/3] flags 0x00 dlen 5                                             #173 10.241074
      ATT: Write Response (0x13) len 0
> HCI Event: Number of Completed Packets (0x13) plen 5                                                             #174 10.351308
        Num handles: 1
        Handle: 273 Address: C0:07:E8:2C:B6:EE (OUI C0-07-E8)
        Count: 1
        Buffers: 0/3
        #173: len 5 (0 Kb/s)
        Latency: 110 msec (58-122 msec ~110 msec)
> ACL Data RX: Handle 273 flags 0x02 dlen 9                                                                        #175 10.351531
      ATT: Write Request (0x12) len 4
        Handle: 0x0046
          Data[2]: 0000
zephyr.exe[2158331]: < HCI Command: Host Number of Completed Packets (0x03|0x0035) plen 5                          #176 10.361023
        Num handles: 1
        Handle: 273 Address: C0:07:E8:2C:B6:EE (OUI C0-07-E8)
        Count: 1
zephyr.exe[2158331]: < ACL Data TX: Handle 273 [1/3] flags 0x00 dlen 5                                             #177 10.361032
      ATT: Write Response (0x13) len 0
> HCI Event: Number of Completed Packets (0x13) plen 5                                                             #178 10.476380
        Num handles: 1
        Handle: 273 Address: C0:07:E8:2C:B6:EE (OUI C0-07-E8)
        Count: 1
        Buffers: 0/3
        #177: len 5 (0 Kb/s)
        Latency: 115 msec (58-122 msec ~112 msec)
> ACL Data RX: Handle 273 flags 0x02 dlen 9                                                                        #179 10.476527
      ATT: Write Request (0x12) len 4
        Handle: 0x0046
          Data[2]: 0100
zephyr.exe[2158331]: < HCI Command: Host Number of Completed Packets (0x03|0x0035) plen 5                          #180 10.481064
        Num handles: 1
        Handle: 273 Address: C0:07:E8:2C:B6:EE (OUI C0-07-E8)
        Count: 1
zephyr.exe[2158331]: < ACL Data TX: Handle 273 [1/3] flags 0x00 dlen 5                                             #181 10.481070
      ATT: Write Response (0x13) len 0
> HCI Event: Number of Completed Packets (0x13) plen 5                                                             #182 10.601362
        Num handles: 1
        Handle: 273 Address: C0:07:E8:2C:B6:EE (OUI C0-07-E8)
        Count: 1
        Buffers: 0/3
        #181: len 5 (0 Kb/s)
        Latency: 120 msec (58-122 msec ~116 msec)
> ACL Data RX: Handle 273 flags 0x02 dlen 7                                                                        #183 10.601520
      ATT: Read Request (0x0a) len 2
        Handle: 0x003c
zephyr.exe[2158331]: < HCI Command: Host Number of Completed Packets (0x03|0x0035) plen 5                          #184 10.621023
        Num handles: 1
        Handle: 273 Address: C0:07:E8:2C:B6:EE (OUI C0-07-E8)
        Count: 1
zephyr.exe[2158331]: < ACL Data TX: Handle 273 [1/3] flags 0x00 dlen 7                                             #185 10.621031
      ATT: Read Response (0x0b) len 2
        Value[2]: 0100
> HCI Event: Number of Completed Packets (0x13) plen 5                                                             #186 10.726334
        Num handles: 1
        Handle: 273 Address: C0:07:E8:2C:B6:EE (OUI C0-07-E8)
        Count: 1
        Buffers: 0/3
        #185: len 7 (0 Kb/s)
        Latency: 105 msec (58-122 msec ~110 msec)
> ACL Data RX: Handle 273 flags 0x02 dlen 7                                                                        #187 10.726531
      ATT: Read Request (0x0a) len 2
        Handle: 0x003f
zephyr.exe[2158331]: < HCI Command: Host Number of Completed Packets (0x03|0x0035) plen 5                          #188 10.741079
        Num handles: 1
        Handle: 273 Address: C0:07:E8:2C:B6:EE (OUI C0-07-E8)
        Count: 1
zephyr.exe[2158331]: < ACL Data TX: Handle 273 [1/3] flags 0x00 dlen 7                                             #189 10.741140
      ATT: Read Response (0x0b) len 2
        Value[2]: 0200
> HCI Event: Number of Completed Packets (0x13) plen 5                                                             #190 10.851265
        Num handles: 1
        Handle: 273 Address: C0:07:E8:2C:B6:EE (OUI C0-07-E8)
        Count: 1
        Buffers: 0/3
        #189: len 7 (0 Kb/s)
        Latency: 110 msec (58-122 msec ~110 msec)
> ACL Data RX: Handle 273 flags 0x02 dlen 7                                                                        #191 10.851481
      ATT: Read Request (0x0a) len 2
        Handle: 0x0042
zephyr.exe[2158331]: < HCI Command: Host Number of Completed Packets (0x03|0x0035) plen 5                          #192 10.861072
        Num handles: 1
        Handle: 273 Address: C0:07:E8:2C:B6:EE (OUI C0-07-E8)
        Count: 1
zephyr.exe[2158331]: < ACL Data TX: Handle 273 [1/3] flags 0x00 dlen 7                                             #193 10.861091
      ATT: Read Response (0x0b) len 2
        Value[2]: 0300
> HCI Event: Number of Completed Packets (0x13) plen 5                                                             #194 10.976361
        Num handles: 1
        Handle: 273 Address: C0:07:E8:2C:B6:EE (OUI C0-07-E8)
        Count: 1
        Buffers: 0/3
        #193: len 7 (0 Kb/s)
        Latency: 115 msec (58-122 msec ~112 msec)
> ACL Data RX: Handle 273 flags 0x02 dlen 7                                                                        #195 10.976473
      ATT: Read Request (0x0a) len 2
        Handle: 0x0045
zephyr.exe[2158331]: < HCI Command: Host Number of Completed Packets (0x03|0x0035) plen 5                          #196 10.981101
        Num handles: 1
        Handle: 273 Address: C0:07:E8:2C:B6:EE (OUI C0-07-E8)
        Count: 1
zephyr.exe[2158331]: < ACL Data TX: Handle 273 [1/3] flags 0x00 dlen 7                                             #197 10.981132
      ATT: Read Response (0x0b) len 2
        Value[2]: 0400
> HCI Event: Number of Completed Packets (0x13) plen 5                                                             #198 11.101427
        Num handles: 1
        Handle: 273 Address: C0:07:E8:2C:B6:EE (OUI C0-07-E8)
        Count: 1
        Buffers: 0/3
        #197: len 7 (0 Kb/s)
        Latency: 120 msec (58-122 msec ~116 msec)
> ACL Data RX: Handle 273 flags 0x02 dlen 27                                                                       #199 11.101720
> ACL Data RX: Handle 273 flags 0x01 dlen 7                                                                        #200 11.101810
      ATT: Write Command (0x52) len 29
        Handle: 0x0039
          Data[27]: 010101010206000000001002010302020105030100000003042800
zephyr.exe[2158331]: < HCI Command: Host Number of Completed Packets (0x03|0x0035) plen 5                          #201 11.121240
        Num handles: 1
        Handle: 273 Address: C0:07:E8:2C:B6:EE (OUI C0-07-E8)
        Count: 1
zephyr.exe[2158331]: < HCI Command: Host Number of Completed Packets (0x03|0x0035) plen 5                          #202 11.121309
        Num handles: 1
        Handle: 273 Address: C0:07:E8:2C:B6:EE (OUI C0-07-E8)
        Count: 1
zephyr.exe[2158331]: < ACL Data TX: Handle 273 [1/3] flags 0x00 dlen 12                                            #203 11.121456
      ATT: Handle Value Notification (0x1b) len 7
        Handle: 0x0039
          Data[5]: 0101010000
zephyr.exe[2158331]: < ACL Data TX: Handle 273 [2/3] flags 0x00 dlen 27                                            #204 11.121458
zephyr.exe[2158331]: < ACL Data TX: Handle 273 flags 0x01 dlen 21                                                  #205 11.121467
      ATT: Handle Value Notification (0x1b) len 43
        Handle: 0x003c
          Data[41]: 01010002020a00102700409c00102700409c0006000000001002010302020105030100000003042800
> HCI Event: Number of Completed Packets (0x13) plen 5                                                             #206 11.164162
        Num handles: 1
        Handle: 273 Address: C0:07:E8:2C:B6:EE (OUI C0-07-E8)
        Count: 1
        Buffers: 1/3
        #203: len 12 (2 Kb/s)
        Latency: 42 msec (42-122 msec ~79 msec)
> HCI Event: Number of Completed Packets (0x13) plen 5                                                             #207 11.164706
        Num handles: 1
        Handle: 273 Address: C0:07:E8:2C:B6:EE (OUI C0-07-E8)
        Count: 1
        Buffers: 0/3
        #204: len 27 (5 Kb/s)
        Latency: 43 msec (42-122 msec ~61 msec)
> HCI Event: Number of Completed Packets (0x13) plen 5                                                             #208 11.226435
        Num handles: 1
        Handle: 273 Address: C0:07:E8:2C:B6:EE (OUI C0-07-E8)
        Count: 1
        Buffers: underflow/3
        #205: len 21 (1 Kb/s)
        Latency: 104 msec (42-122 msec ~83 msec)
> ACL Data RX: Handle 273 flags 0x02 dlen 25                                                                       #209 11.226698
      ATT: Write Command (0x52) len 20
        Handle: 0x0039
          Data[18]: 020101010110270000022800020a00a86100
zephyr.exe[2158331]: < HCI Command: Host Number of Completed Packets (0x03|0x0035) plen 5                          #210 11.241031
        Num handles: 1
        Handle: 273 Address: C0:07:E8:2C:B6:EE (OUI C0-07-E8)
        Count: 1
zephyr.exe[2158331]: < ACL Data TX: Handle 273 [1/3] flags 0x00 dlen 12                                            #211 11.241047
      ATT: Handle Value Notification (0x1b) len 7
        Handle: 0x0039
          Data[5]: 0201010000
zephyr.exe[2158331]: < ACL Data TX: Handle 273 [2/3] flags 0x00 dlen 24                                            #212 11.241167
      ATT: Handle Value Notification (0x1b) len 19
        Handle: 0x003c
          Data[17]: 0102010110270000022800020a00a86100
> HCI Event: Number of Completed Packets (0x13) plen 5                                                             #213 11.289136
        Num handles: 1
        Handle: 273 Address: C0:07:E8:2C:B6:EE (OUI C0-07-E8)
        Count: 1
        Buffers: 1/3
        #211: len 12 (2 Kb/s)
        Latency: 48 msec (42-122 msec ~65 msec)
> HCI Event: Number of Completed Packets (0x13) plen 5                                                             #214 11.351378
        Num handles: 1
        Handle: 273 Address: C0:07:E8:2C:B6:EE (OUI C0-07-E8)
        Count: 1
        Buffers: 0/3
        #212: len 24 (1 Kb/s)
        Latency: 110 msec (42-122 msec ~87 msec)
> ACL Data RX: Handle 273 flags 0x02 dlen 15                                                                       #215 11.351618
      ATT: Write Command (0x52) len 10
        Handle: 0x0039
          Data[8]: 0301010403020100
zephyr.exe[2158331]: < HCI Command: Host Number of Completed Packets (0x03|0x0035) plen 5                          #216 11.361052
        Num handles: 1
        Handle: 273 Address: C0:07:E8:2C:B6:EE (OUI C0-07-E8)
        Count: 1
zephyr.exe[2158331]: < ACL Data TX: Handle 273 [1/3] flags 0x00 dlen 12                                            #217 11.361061
      ATT: Handle Value Notification (0x1b) len 7
        Handle: 0x0039
          Data[5]: 0301010000
zephyr.exe[2158331]: < ACL Data TX: Handle 273 [2/3] flags 0x00 dlen 16                                            #218 11.361165
      ATT: Handle Value Notification (0x1b) len 11
        Handle: 0x003c
          Data[9]: 010301010403020100
> HCI Event: Number of Completed Packets (0x13) plen 5                                                             #219 11.414161
        Num handles: 1
        Handle: 273 Address: C0:07:E8:2C:B6:EE (OUI C0-07-E8)
        Count: 1
        Buffers: 1/3
        #217: len 12 (1 Kb/s)
        Latency: 53 msec (42-122 msec ~70 msec)
> HCI Event: Number of Completed Packets (0x13) plen 5                                                             #220 11.476305
        Num handles: 1
        Handle: 273 Address: C0:07:E8:2C:B6:EE (OUI C0-07-E8)
        Count: 1
        Buffers: 0/3
        #218: len 16 (1 Kb/s)
        Latency: 115 msec (42-122 msec ~92 msec)
> HCI Event: Disconnect Complete (0x05) plen 4                                                                     #221 11.476426
        Status: Success (0x00)
        Handle: 273 Address: C0:07:E8:2C:B6:EE (OUI C0-07-E8)
        Reason: Remote User Terminated Connection (0x13)
zephyr.exe[2158331]: < HCI Command: LE Set Extended Advertising Parameters (0x08|0x0036) plen 25                   #222 13.221087
        Handle: 0x00
        Properties: 0x0013
          Connectable
          Scannable
          Use legacy advertising PDUs: ADV_IND
        Min advertising interval: 100.000 msec (0x00a0)
        Max advertising interval: 150.000 msec (0x00f0)
        Channel map: 37, 38, 39 (0x07)
        Own address type: Random (0x01)
        Peer address type: Public (0x00)
        Peer address: 00:00:00:00:00:00 (OUI 00-00-00)
        Filter policy: Allow Scan Request from Any, Allow Connect Request from Any (0x00)
        TX power: Host has no preference (0x7f)
        Primary PHY: LE 1M (0x01)
        Secondary max skip: 0x00
        Secondary PHY: LE 1M (0x01)
        SID: 0x00
        Scan request notifications: Disabled (0x00)
> HCI Event: Command Complete (0x0e) plen 5                                                                        #223 13.221908
      LE Set Extended Advertising Parameters (0x08|0x0036) ncmd 1
        Status: Success (0x00)
        TX power (selected): 0 dbm (0x00)
zephyr.exe[2158331]: < HCI Command: LE Set Advertising Set Random Address (0x08|0x0035) plen 7                     #224 13.241009
        Advertising handle: 0x00
        Advertising random address: D5:B6:CC:31:DB:3B (Static)
> HCI Event: Command Complete (0x0e) plen 4                                                                        #225 13.241490
      LE Set Advertising Set Random Address (0x08|0x0035) ncmd 1
        Status: Success (0x00)
zephyr.exe[2158331]: < HCI Command: LE Set Extended Advertising Data (0x08|0x0037) plen 22                         #226 13.261007
        Handle: 0x00
        Operation: Complete extended advertising data (0x03)
        Fragment preference: Minimize fragmentation (0x01)
        Data length: 0x12
        Flags: 0x06
          LE General Discoverable Mode
          BR/EDR Not Supported
        Name (complete): Tester_2CB6EE
> HCI Event: Command Complete (0x0e) plen 4                                                                        #227 13.261717
      LE Set Extended Advertising Data (0x08|0x0037) ncmd 1
        Status: Success (0x00)
zephyr.exe[2158331]: < HCI Command: LE Set Extended Scan Response Data (0x08|0x0038) plen 4                        #228 13.281038
        Handle: 0x00
        Operation: Complete scan response data (0x03)
        Fragment preference: Minimize fragmentation (0x01)
        Data length: 0x00
> HCI Event: Command Complete (0x0e) plen 4                                                                        #229 13.281542
      LE Set Extended Scan Response Data (0x08|0x0038) ncmd 1
        Status: Success (0x00)
zephyr.exe[2158331]: < HCI Command: LE Set Extended Advertising Enable (0x08|0x0039) plen 6                        #230 13.301039
        Extended advertising: Enabled (0x01)
        Number of sets: 1 (0x01)
        Entry 0
          Handle: 0x00
          Duration: 0 ms (0x00)
          Max ext adv events: 0
> HCI Event: Command Complete (0x0e) plen 4                                                                        #231 13.301628
      LE Set Extended Advertising Enable (0x08|0x0039) ncmd 1
        Status: Success (0x00)
> HCI Event: LE Meta Event (0x3e) plen 31                                                                          #232 13.414577
      LE Enhanced Connection Complete (0x0a)
        Status: Success (0x00)
        Handle: 291
        Role: Peripheral (0x01)
        Peer address type: Public (0x00)
        Peer address: C0:07:E8:2C:B6:EE (OUI C0-07-E8)
        Local resolvable private address: 00:00:00:00:00:00 (Non-Resolvable)
        Peer resolvable private address: 00:00:00:00:00:00 (Non-Resolvable)
        Connection interval: 62.50 msec (0x0032)
        Connection latency: 0 (0x0000)
        Supervision timeout: 25120 msec (0x09d0)
        Central clock accuracy: 0x07
> HCI Event: LE Meta Event (0x3e) plen 6                                                                           #233 13.414703
      LE Advertising Set Terminated (0x12)
        Status: Success (0x00)
        Handle: 0
        Connection handle: 291
        Number of completed extended advertising events: 0
zephyr.exe[2158331]: < HCI Command: LE Read Remote Used Features (0x08|0x0016) plen 2                              #234 13.421234
        Handle: 291 Address: C0:07:E8:2C:B6:EE (OUI C0-07-E8)
> HCI Event: Command Status (0x0f) plen 4                                                                          #235 13.421654
      LE Read Remote Used Features (0x08|0x0016) ncmd 1
        Status: Success (0x00)
zephyr.exe[2158331]: < HCI Command: LE Set PHY (0x08|0x0032) plen 7                                                #236 13.441086
        Handle: 291 Address: C0:07:E8:2C:B6:EE (OUI C0-07-E8)
        All PHYs preference: 0x00
        TX PHYs preference: 0x02
          LE 2M
        RX PHYs preference: 0x02
          LE 2M
        PHY options preference: Reserved (0x0000)
> HCI Event: Command Status (0x0f) plen 4                                                                          #237 13.441607
      LE Set PHY (0x08|0x0032) ncmd 1
        Status: Success (0x00)
zephyr.exe[2158331]: < ACL Data TX: Handle 291 [1/3] flags 0x00 dlen 6                                             #238 13.461009
      SMP: Security Request (0x0b) len 1
        Authentication requirement: Bonding, No MITM, SC, No Keypresses (0x09)
zephyr.exe[2158331]: < ACL Data TX: Handle 291 [2/3] flags 0x00 dlen 7                                             #239 13.461014
      ATT: Exchange MTU Request (0x02) len 2
        Client RX MTU: 251
> HCI Event: Number of Completed Packets (0x13) plen 5                                                             #240 13.478575
        Num handles: 1
        Handle: 291 Address: C0:07:E8:2C:B6:EE (OUI C0-07-E8)
        Count: 1
        Buffers: 1/3
        #238: len 6 (2 Kb/s)
        Latency: 17 msec (17-17 msec ~17 msec)
> HCI Event: Number of Completed Packets (0x13) plen 5                                                             #241 13.540650
        Num handles: 1
        Handle: 291 Address: C0:07:E8:2C:B6:EE (OUI C0-07-E8)
        Count: 1
        Buffers: 0/3
        #239: len 7 (0 Kb/s)
        Latency: 79 msec (17-79 msec ~48 msec)
> HCI Event: LE Meta Event (0x3e) plen 12                                                                          #242 13.603612
      LE Read Remote Used Features (0x04)
        Status: Success (0x00)
        Handle: 291 Address: C0:07:E8:2C:B6:EE (OUI C0-07-E8)
        Features: 0x2d 0x49 0x01 0xf7 0xef 0x39 0x00 0x80
          LE Encryption
          Extended Reject Indication
          Peripheral-initiated Features Exchange
          LE Data Packet Length Extension
          LE 2M PHY
          LE Coded PHY
          Channel Selection Algorithm #2
          Minimum Number of Used Channels Procedure
          Periodic Advertising Sync Transfer - Sender
          Periodic Advertising Sync Transfer - Recipient
          Sleep Clock Accuracy Updates
          Connected Isochronous Stream - Central
          Connected Isochronous Stream - Peripheral
          Isochronous Broadcaster
          Synchronized Receiver
          Connected Isochronous Stream (Host Support)
          LE Power Control Request
          LE Power Control Request
          LE Path Loss Monitoring
          Connection Subrating
          Connection Subrating (Host Support)
          Channel Classification
          Unknown features (0x8000390000000000)
> ACL Data RX: Handle 291 flags 0x02 dlen 7                                                                        #243 13.915797
      ATT: Exchange MTU Request (0x02) len 2
        Client RX MTU: 64
> ACL Data RX: Handle 291 flags 0x02 dlen 7                                                    