Bluetooth monitor ver 5.84
btmon[241113]: = Note: Linux version 6.8.0-83-generic (x86_64)                                                           0.511100
btmon[241113]: = Note: Bluetooth subsystem version 2.22                                                                  0.511102
= New Index: 00:00:00:00:00:00 (Primary,UART,hci0)                                                                       0.511103
= Open Index: 00:00:00:00:00:00                                                                                          1.018508
= Index Info: 00:00:00:00:00:00 (Nordic Semiconductor ASA)                                                               1.018512
zephyr.exe[241115]: @ USER Open: main (privileged) version 2.22                                                 {0x0001} 1.018514
zephyr.exe[241115]: < HCI Command: Reset (0x03|0x0003) plen 0                                                         #1 1.018765
> HCI Event: Command Complete (0x0e) plen 4                                                                           #2 1.019280
      Reset (0x03|0x0003) ncmd 1
        Status: Success (0x00)
zephyr.exe[241115]: < HCI Command: Read Local Supported Features (0x04|0x0003) plen 0                                 #3 1.038407
> HCI Event: Command Complete (0x0e) plen 12                                                                          #4 1.039201
      Read Local Supported Features (0x04|0x0003) ncmd 1
        Status: Success (0x00)
        Features: 0x00 0x00 0x00 0x00 0x60 0x00 0x00 0x00
          BR/EDR Not Supported
          LE Supported (Controller)
zephyr.exe[241115]: < HCI Command: Read Local Version Information (0x04|0x0001) plen 0                                #5 1.058395
> HCI Event: Command Complete (0x0e) plen 12                                                                          #6 1.059668
      Read Local Version Information (0x04|0x0001) ncmd 1
        Status: Success (0x00)
        HCI version: Reserved (0x0e) - Revision 12520 (0x30e8)
        LMP version: Reserved (0x0e) - Subversion 12520 (0x30e8)
        Manufacturer: Nordic Semiconductor ASA (89)
zephyr.exe[241115]: < HCI Command: Read Local Supported Commands (0x04|0x0002) plen 0                                 #7 1.078417
> HCI Event: Command Complete (0x0e) plen 68                                                                          #8 1.080875
      Read Local Supported Commands (0x04|0x0002) ncmd 1
        Status: Success (0x00)
        Commands: 119 entries
          Disconnect (Octet 0 - Bit 5)
          Read Remote Version Information (Octet 2 - Bit 7)
          Set Event Mask (Octet 5 - Bit 6)
          Reset (Octet 5 - Bit 7)
          Read Connection Accept Timeout (Octet 7 - Bit 2)
          Write Connection Accept Timeout (Octet 7 - Bit 3)
          Read Transmit Power Level (Octet 10 - Bit 2)
          Set Controller To Host Flow Control (Octet 10 - Bit 5)
          Host Buffer Size (Octet 10 - Bit 6)
          Host Number of Completed Packets (Octet 10 - Bit 7)
          Read Local Version Information (Octet 14 - Bit 3)
          Read Local Supported Features (Octet 14 - Bit 5)
          Read BD ADDR (Octet 15 - Bit 1)
          Read RSSI (Octet 15 - Bit 5)
          Set Event Mask Page 2 (Octet 22 - Bit 2)
          LE Set Event Mask (Octet 25 - Bit 0)
          LE Read Buffer Size (Octet 25 - Bit 1)
          LE Read Local Supported Features (Octet 25 - Bit 2)
          LE Set Random Address (Octet 25 - Bit 4)
          LE Set Advertising Parameters (Octet 25 - Bit 5)
          LE Read Advertising Channel TX Power (Octet 25 - Bit 6)
          LE Set Advertising Data (Octet 25 - Bit 7)
          LE Set Scan Response Data (Octet 26 - Bit 0)
          LE Set Advertise Enable (Octet 26 - Bit 1)
          LE Set Scan Parameters (Octet 26 - Bit 2)
          LE Set Scan Enable (Octet 26 - Bit 3)
          LE Create Connection (Octet 26 - Bit 4)
          LE Create Connection Cancel (Octet 26 - Bit 5)
          LE Read Accept List Size (Octet 26 - Bit 6)
          LE Clear Accept List (Octet 26 - Bit 7)
          LE Add Device To Accept List (Octet 27 - Bit 0)
          LE Remove Device From Accept List (Octet 27 - Bit 1)
          LE Connection Update (Octet 27 - Bit 2)
          LE Set Host Channel Classification (Octet 27 - Bit 3)
          LE Read Channel Map (Octet 27 - Bit 4)
          LE Read Remote Used Features (Octet 27 - Bit 5)
          LE Encrypt (Octet 27 - Bit 6)
          LE Rand (Octet 27 - Bit 7)
          LE Start Encryption (Octet 28 - Bit 0)
          LE Long Term Key Request Reply (Octet 28 - Bit 1)
          LE Long Term Key Request Neg Reply (Octet 28 - Bit 2)
          LE Read Supported States (Octet 28 - Bit 3)
          LE Receiver Test (Octet 28 - Bit 4)
          LE Transmitter Test (Octet 28 - Bit 5)
          LE Test End (Octet 28 - Bit 6)
          Read Authenticated Payload Timeout (Octet 32 - Bit 4)
          Write Authenticated Payload Timeout (Octet 32 - Bit 5)
          LE Set Data Length (Octet 33 - Bit 6)
          LE Read Suggested Default Data Length (Octet 33 - Bit 7)
          LE Write Suggested Default Data Length (Octet 34 - Bit 0)
          LE Add Device To Resolving List (Octet 34 - Bit 3)
          LE Remove Device From Resolving List (Octet 34 - Bit 4)
          LE Clear Resolving List (Octet 34 - Bit 5)
          LE Read Resolving List Size (Octet 34 - Bit 6)
          LE Set Address Resolution Enable (Octet 35 - Bit 1)
          LE Set Resolvable Private Address Timeout (Octet 35 - Bit 2)
          LE Read Maximum Data Length (Octet 35 - Bit 3)
          LE Read PHY (Octet 35 - Bit 4)
          LE Set Default PHY (Octet 35 - Bit 5)
          LE Set PHY (Octet 35 - Bit 6)
          LE Enhanced Receiver Test (Octet 35 - Bit 7)
          LE Enhanced Transmitter Test (Octet 36 - Bit 0)
          LE Set Advertising Set Random Address (Octet 36 - Bit 1)
          LE Set Extended Advertising Parameters (Octet 36 - Bit 2)
          LE Set Extended Advertising Data (Octet 36 - Bit 3)
          LE Set Extended Scan Response Data (Octet 36 - Bit 4)
          LE Set Extended Advertising Enable (Octet 36 - Bit 5)
          LE Read Maximum Advertising Data Length (Octet 36 - Bit 6)
          LE Read Number of Supported Advertising Sets (Octet 36 - Bit 7)
          LE Remove Advertising Set (Octet 37 - Bit 0)
          LE Clear Advertising Sets (Octet 37 - Bit 1)
          LE Set Periodic Advertising Parameters (Octet 37 - Bit 2)
          LE Set Periodic Advertising Data (Octet 37 - Bit 3)
          LE Set Periodic Advertising Enable (Octet 37 - Bit 4)
          LE Set Extended Scan Parameters (Octet 37 - Bit 5)
          LE Set Extended Scan Enable (Octet 37 - Bit 6)
          LE Extended Create Connection (Octet 37 - Bit 7)
          LE Periodic Advertising Create Sync (Octet 38 - Bit 0)
          LE Periodic Advertising Create Sync Cancel (Octet 38 - Bit 1)
          LE Periodic Advertising Terminate Sync (Octet 38 - Bit 2)
          LE Add Device To Periodic Advertiser List (Octet 38 - Bit 3)
          LE Remove Device From Periodic Advertiser List (Octet 38 - Bit 4)
          LE Clear Periodic Advertiser List (Octet 38 - Bit 5)
          LE Read Periodic Advertiser List Size (Octet 38 - Bit 6)
          LE Read Transmit Power (Octet 38 - Bit 7)
          LE Read RF Path Compensation (Octet 39 - Bit 0)
          LE Write RF Path Compensation (Octet 39 - Bit 1)
          LE Set Privacy Mode (Octet 39 - Bit 2)
          LE Periodic Advertising Receive Enable (Octet 40 - Bit 5)
          LE Periodic Advertising Sync Transfer (Octet 40 - Bit 6)
          LE Periodic Advertising Set Info Transfer (Octet 40 - Bit 7)
          LE Periodic Advertising Sync Transfer Parameters (Octet 41 - Bit 0)
          LE Set Default Periodic Advertisng Sync Transfer Parameters (Octet 41 - Bit 1)
          LE Read Buffer v2 (Octet 41 - Bit 5)
          LE Read ISO TX Sync (Octet 41 - Bit 6)
          LE Set Connected Isochronous Group Parameters (Octet 41 - Bit 7)
          LE Set Connected Isochronous Group Parameters Test (Octet 42 - Bit 0)
          LE Create Connected Isochronous Stream (Octet 42 - Bit 1)
          LE Remove Connected Isochronous Group (Octet 42 - Bit 2)
          LE Accept Connected Isochronous Stream Request (Octet 42 - Bit 3)
          LE Reject Connected Isochronous Stream Request (Octet 42 - Bit 4)
          LE Create Broadcast Isochronous Group (Octet 42 - Bit 5)
          LE Create Broadcast Isochronous Group Test (Octet 42 - Bit 6)
          LE Terminate Broadcast Isochronous Group (Octet 42 - Bit 7)
          LE Broadcast Isochronous Group Create Sync (Octet 43 - Bit 0)
          LE Broadcast Isochronous Group Terminate Sync (Octet 43 - Bit 1)
          LE Request Peer SCA (Octet 43 - Bit 2)
          LE Setup Isochronous Data Path (Octet 43 - Bit 3)
          LE Remove Isochronous Data Path (Octet 43 - Bit 4)
          LE Isochronous Transmit Test (Octet 43 - Bit 5)
          LE Isochronous Receive Test (Octet 43 - Bit 6)
          LE Isochronous Read Test Counters (Octet 43 - Bit 7)
          LE Isochronous Read Test Counters (Octet 44 - Bit 0)
          LE Set Host Feature (Octet 44 - Bit 1)
          LE Read ISO link quality (Octet 44 - Bit 2)
          Octet 45 - Bit 6 
          Octet 46 - Bit 0 
          Octet 46 - Bit 1 
          Octet 46 - Bit 2 
zephyr.exe[241115]: < HCI Command: Host Buffer Size (0x03|0x0033) plen 7                                              #9 1.098404
        ACL MTU: 255  ACL max packet: 16
        SCO MTU: 0    SCO max packet: 0
> HCI Event: Command Complete (0x0e) plen 4                                                                          #10 1.099354
      Host Buffer Size (0x03|0x0033) ncmd 1
        Status: Success (0x00)
zephyr.exe[241115]: < HCI Command: Set Controller To Host Flow Control (0x03|0x0031) plen 1                          #11 1.118405
        Flow control: ACL Data Packets (0x01)
> HCI Event: Command Complete (0x0e) plen 4                                                                          #12 1.119315
      Set Controller To Host Flow Control (0x03|0x0031) ncmd 1
        Status: Success (0x00)
zephyr.exe[241115]: < HCI Command: LE Read Local Supported Features (0x08|0x0003) plen 0                             #13 1.138392
> HCI Event: Command Complete (0x0e) plen 12                                                                         #14 1.139002
      LE Read Local Supported Features (0x08|0x0003) ncmd 1
        Status: Success (0x00)
        Features: 0xfd 0x79 0x00 0xf7 0x30 0x01 0x00 0x00
          LE Encryption
          Extended Reject Indication
          Peripheral-initiated Features Exchange
          LE Ping
          LE Data Packet Length Extension
          LL Privacy
          Extended Scanner Filter Policies
          LE 2M PHY
          LE Coded PHY
          LE Extended Advertising
          LE Periodic Advertising
          Channel Selection Algorithm #2
          Periodic Advertising Sync Transfer - Sender
          Periodic Advertising Sync Transfer - Recipient
          Sleep Clock Accuracy Updates
          Connected Isochronous Stream - Central
          Connected Isochronous Stream - Peripheral
          Isochronous Broadcaster
          Synchronized Receiver
          Periodic Advertising ADI support
          Connection Subrating
          Unknown features (0x0000010000000000)
zephyr.exe[241115]: < HCI Command: LE Set Host Feature (0x08|0x0074) plen 2                                          #15 1.158379
        Bit Number: 32
          Connected Isochronous Stream (Host Support)
        Bit Value: 1
> HCI Event: Command Complete (0x0e) plen 4                                                                          #16 1.159000
      LE Set Host Feature (0x08|0x0074) ncmd 1
        Status: Success (0x00)
zephyr.exe[241115]: < HCI Command: LE Read Buffer v2 (0x08|0x0060) plen 0                                            #17 1.178403
> HCI Event: Command Complete (0x0e) plen 10                                                                         #18 1.178938
      LE Read Buffer v2 (0x08|0x0060) ncmd 1
        Status: Success (0x00)
        ACL MTU: 27
        ACL max packet: 3
        ISO MTU: 318
        ISO max packet: 3
zephyr.exe[241115]: < HCI Command: LE Read Maximum Advertising Data Length (0x08|0x003a) plen 0                      #19 1.198417
> HCI Event: Command Complete (0x0e) plen 6                                                                          #20 1.199177
      LE Read Maximum Advertising Data Length (0x08|0x003a) ncmd 1
        Status: Success (0x00)
        Max length: 1650
zephyr.exe[241115]: < HCI Command: LE Read Supported States (0x08|0x001c) plen 0                                     #21 1.218359
> HCI Event: Command Complete (0x0e) plen 12                                                                         #22 1.219011
      LE Read Supported States (0x08|0x001c) ncmd 1
        Status: Success (0x00)
        States: 0x000003ff3e0306ff
          Non-connectable Advertising State
          Scannable Advertising State
          Connectable Advertising State
          High Duty Cycle Directed Advertising State
          Passive Scanning State
          Active Scanning State
          Initiating State
            and Connection State (Central Role)
          Connection State (Peripheral Role)
          Scannable Advertising State
            and Passive Scanning State
          Connectable Advertising State
            and Passive Scanning State
          Non-connectable Advertising State
            and Initiating State
          Scannable Advertising State
            and Initiating State
          Active Scanning State
            and Connection State (Central Role)
          Passive Scanning State
            and Connection State (Peripheral Role)
          Active Scanning State
            and Connection State (Peripheral Role)
          Initiating State
            and Connection State (Central Role)
            and Central Role & Central Role
          Low Duty Cycle Directed Advertising State
          Connectable Advertising State
            and Initiating State
            and Central Role & Peripheral Role
          High Duty Cycle Directed Advertising State
            and Initiating State
            and Central Role & Peripheral Role
          Low Duty Cycle Directed Advertising State
            and Initiating State
            and Central Role & Peripheral Role
          Connectable Advertising State
            and Connection State (Central Role)
            and Central Role & Peripheral Role
          High Duty Cycle Directed Advertising State
            and Connection State (Central Role)
            and Central Role & Peripheral Role
          Low Duty Cycle Directed Advertising State
            and Connection State (Central Role)
            and Central Role & Peripheral Role
          Connectable Advertising State
            and Connection State (Peripheral Role)
            and Central Role & Peripheral Role
          High Duty Cycle Directed Advertising State
            and Connection State (Peripheral Role)
            and Peripheral Role & Peripheral Role
          Low Duty Cycle Directed Advertising State
            and Connection State (Peripheral Role)
            and Peripheral Role & Peripheral Role
          Initiating State
            and Connection State (Peripheral Role)
            and Central Role & Peripheral Role
zephyr.exe[241115]: < HCI Command: LE Read Maximum Data Length (0x08|0x002f) plen 0                                  #23 1.238415
> HCI Event: Command Complete (0x0e) plen 12                                                                         #24 1.238993
      LE Read Maximum Data Length (0x08|0x002f) ncmd 1
        Status: Success (0x00)
        Max TX octets: 251
        Max TX time: 2704
        Max RX octets: 251
        Max RX time: 2704
zephyr.exe[241115]: < HCI Command: LE Write Suggested Default Data Length (0x08|0x0024) plen 4                       #25 1.258406
        TX octets: 251
        TX time: 2704
> HCI Event: Command Complete (0x0e) plen 4                                                                          #26 1.258946
      LE Write Suggested Default Data Length (0x08|0x0024) ncmd 1
        Status: Success (0x00)
zephyr.exe[241115]: < HCI Command: LE Read Resolving List Size (0x08|0x002a) plen 0                                  #27 1.278352
> HCI Event: Command Complete (0x0e) plen 5                                                                          #28 1.279294
      LE Read Resolving List Size (0x08|0x002a) ncmd 1
        Status: Success (0x00)
        Size: 8
zephyr.exe[241115]: < HCI Command: LE Set Event Mask (0x08|0x0001) plen 8                                            #29 1.298352
        Mask: 0x000002023f87fa5e
          LE Advertising Report
          LE Connection Update Complete
          LE Read Remote Used Features Complete
          LE Long Term Key Request
          LE Data Length Change
          LE Enhanced Connection Complete
          LE PHY Update Complete
          LE Extended Advertising Report
          LE Periodic Advertising Sync Established
          LE Periodic Advertising Report
          LE Periodic Advertising Sync Lost
          LE Extended Scan Timeout
          LE Extended Advertising Set Terminated
          LE Scan Request Received
          LE Periodic Advertising Sync Transfer Rvc
          LE CIS Established
          LE CIS Request
          LE Create BIG Complete
          LE Terminate BIG Complete
          LE BIG Sync Established Complete
          LE BIG Sync Lost
          LE BIG Info Advertising Report
          Unknown mask (0x0000020000000000)
> HCI Event: Command Complete (0x0e) plen 4                                                                          #30 1.298982
      LE Set Event Mask (0x08|0x0001) ncmd 1
        Status: Success (0x00)
zephyr.exe[241115]: < HCI Command: Set Event Mask (0x03|0x0001) plen 8                                               #31 1.318387
        Mask: 0x2000800002008890
          Disconnection Complete
          Encryption Change
          Read Remote Version Information Complete
          Hardware Error
          Data Buffer Overflow
          Encryption Key Refresh Complete
          LE Meta
> HCI Event: Command Complete (0x0e) plen 4                                                                          #32 1.319146
      Set Event Mask (0x03|0x0001) ncmd 1
        Status: Success (0x00)
zephyr.exe[241115]: < HCI Command: Read BD ADDR (0x04|0x0009) plen 0                                                 #33 1.338410
> HCI Event: Command Complete (0x0e) plen 10                                                                         #34 1.339144
      Read BD ADDR (0x04|0x0009) ncmd 1
        Status: Success (0x00)
        Address: 00:00:00:00:00:00 (OUI 00-00-00)
zephyr.exe[241115]: < HCI Command: LE Set Random Address (0x08|0x0005) plen 6                                        #35 1.358451
        Address: D5:B6:CC:31:DB:3B (Static)
> HCI Event: Command Complete (0x0e) plen 4                                                                          #36 1.359283
      LE Set Random Address (0x08|0x0005) ncmd 1
        Status: Success (0x00)
zephyr.exe[241115]: < HCI Command: LE Set Extended Advertising Parameters (0x08|0x0036) plen 25                      #37 4.328419
        Handle: 0x00
        Properties: 0x0013
          Connectable
          Scannable
          Use legacy advertising PDUs: ADV_IND
        Min advertising interval: 100.000 msec (0x00a0)
        Max advertising interval: 150.000 msec (0x00f0)
        Channel map: 37, 38, 39 (0x07)
        Own address type: Random (0x01)
        Peer address type: Public (0x00)
        Peer address: 00:00:00:00:00:00 (OUI 00-00-00)
        Filter policy: Allow Scan Request from Any, Allow Connect Request from Any (0x00)
        TX power: Host has no preference (0x7f)
        Primary PHY: LE 1M (0x01)
        Secondary max skip: 0x00
        Secondary PHY: LE 1M (0x01)
        SID: 0x00
        Scan request notifications: Disabled (0x00)
> HCI Event: Command Complete (0x0e) plen 5                                                                          #38 4.329206
      LE Set Extended Advertising Parameters (0x08|0x0036) ncmd 1
        Status: Success (0x00)
        TX power (selected): 0 dbm (0x00)
zephyr.exe[241115]: < HCI Command: LE Set Advertising Set Random Address (0x08|0x0035) plen 7                        #39 4.338446
        Advertising handle: 0x00
        Advertising random address: D5:B6:CC:31:DB:3B (Static)
> HCI Event: Command Complete (0x0e) plen 4                                                                          #40 4.339169
      LE Set Advertising Set Random Address (0x08|0x0035) ncmd 1
        Status: Success (0x00)
zephyr.exe[241115]: < HCI Command: LE Set Extended Advertising Data (0x08|0x0037) plen 22                            #41 4.358429
        Handle: 0x00
        Operation: Complete extended advertising data (0x03)
        Fragment preference: Minimize fragmentation (0x01)
        Data length: 0x12
        Flags: 0x04
          BR/EDR Not Supported
        Name (complete): Tester_F6B11A
> HCI Event: Command Complete (0x0e) plen 4                                                                          #42 4.359333
      LE Set Extended Advertising Data (0x08|0x0037) ncmd 1
        Status: Success (0x00)
zephyr.exe[241115]: < HCI Command: LE Set Extended Scan Response Data (0x08|0x0038) plen 4                           #43 4.378453
        Handle: 0x00
        Operation: Complete scan response data (0x03)
        Fragment preference: Minimize fragmentation (0x01)
        Data length: 0x00
> HCI Event: Command Complete (0x0e) plen 4                                                                          #44 4.379197
      LE Set Extended Scan Response Data (0x08|0x0038) ncmd 1
        Status: Success (0x00)
zephyr.exe[241115]: < HCI Command: LE Set Extended Advertising Enable (0x08|0x0039) plen 6                           #45 4.398446
        Extended advertising: Enabled (0x01)
        Number of sets: 1 (0x01)
        Entry 0
          Handle: 0x00
          Duration: 0 ms (0x00)
          Max ext adv events: 0
> HCI Event: Command Complete (0x0e) plen 4                                                                          #46 4.399232
      LE Set Extended Advertising Enable (0x08|0x0039) ncmd 1
        Status: Success (0x00)
> HCI Event: LE Meta Event (0x3e) plen 31                                                                            #47 4.617749
      LE Enhanced Connection Complete (0x0a)
        Status: Success (0x00)
        Handle: 759
        Role: Peripheral (0x01)
        Peer address type: Public (0x00)
        Peer address: DF:A9:FF:F6:B1:1A (OUI DF-A9-FF)
        Local resolvable private address: 00:00:00:00:00:00 (Non-Resolvable)
        Peer resolvable private address: 00:00:00:00:00:00 (Non-Resolvable)
        Connection interval: 87.50 msec (0x0046)
        Connection latency: 0 (0x0000)
        Supervision timeout: 20000 msec (0x07d0)
        Central clock accuracy: 0x01
> HCI Event: LE Meta Event (0x3e) plen 6                                                                             #48 4.617821
      LE Advertising Set Terminated (0x12)
        Status: Success (0x00)
        Handle: 0
        Connection handle: 759
        Number of completed extended advertising events: 0
zephyr.exe[241115]: < HCI Command: LE Read Remote Used Features (0x08|0x0016) plen 2                                 #49 4.618583
        Handle: 759 Address: DF:A9:FF:F6:B1:1A (OUI DF-A9-FF)
> HCI Event: Command Status (0x0f) plen 4                                                                            #50 4.619217
      LE Read Remote Used Features (0x08|0x0016) ncmd 1
        Status: Success (0x00)
> HCI Event: LE Meta Event (0x3e) plen 12                                                                            #51 4.882713
      LE Read Remote Used Features (0x04)
        Status: Success (0x00)
        Handle: 759 Address: DF:A9:FF:F6:B1:1A (OUI DF-A9-FF)
        Features: 0x2d 0x49 0x00 0xf7 0x67 0xd8 0x00 0x00
          LE Encryption
          Extended Reject Indication
          Peripheral-initiated Features Exchange
          LE Data Packet Length Extension
          LE 2M PHY
          LE Coded PHY
          Channel Selection Algorithm #2
          Periodic Advertising Sync Transfer - Sender
          Periodic Advertising Sync Transfer - Recipient
          Sleep Clock Accuracy Updates
          Connected Isochronous Stream - Central
          Connected Isochronous Stream - Peripheral
          Isochronous Broadcaster
          Synchronized Receiver
          Connected Isochronous Stream (Host Support)
          LE Power Control Request
          LE Power Control Request
          Connection Subrating
          Connection Subrating (Host Support)
          Unknown features (0x0000d80000000000)
> ACL Data RX: Handle 759 flags 0x02 dlen 13                                                                         #52 5.318936
      ATT: Find By Type Value Request (0x06) len 8
        Handle range: 0x0001-0xffff
        Attribute type: Primary Service (0x2800)
          UUID: Generic Access Profile (0x1800)
zephyr.exe[241115]: < HCI Command: Host Number of Completed Packets (0x03|0x0035) plen 5                             #53 5.338507
        Num handles: 1
        Handle: 759 Address: DF:A9:FF:F6:B1:1A (OUI DF-A9-FF)
        Count: 1
zephyr.exe[241115]: < ACL Data TX: Handle 759 [1/3] flags 0x00 dlen 9                                                #54 5.338533
      ATT: Find By Type Value Response (0x07) len 4
        Handle range: 0x000b-0x0011
> HCI Event: Number of Completed Packets (0x13) plen 5                                                               #55 5.493816
        Num handles: 1
        Handle: 759 Address: DF:A9:FF:F6:B1:1A (OUI DF-A9-FF)
        Count: 1
        Buffers: 0/3
        #54: len 9 (0 Kb/s)
        Latency: 155 msec (155-155 msec ~155 msec)
> ACL Data RX: Handle 759 flags 0x02 dlen 13                                                                         #56 5.494033
      ATT: Find By Type Value Request (0x06) len 8
        Handle range: 0x0012-0xffff
        Attribute type: Primary Service (0x2800)
          UUID: Generic Access Profile (0x1800)
zephyr.exe[241115]: < HCI Command: Host Number of Completed Packets (0x03|0x0035) plen 5                             #57 5.498520
        Num handles: 1
        Handle: 759 Address: DF:A9:FF:F6:B1:1A (OUI DF-A9-FF)
        Count: 1
zephyr.exe[241115]: < ACL Data TX: Handle 759 [1/3] flags 0x00 dlen 9                                                #58 5.498545
      ATT: Error Response (0x01) len 4
        Find By Type Value Request (0x06)
        Handle: 0x0012
        Error: Attribute Not Found (0x0a)
> HCI Event: Number of Completed Packets (0x13) plen 5                                                               #59 5.668812
        Num handles: 1
        Handle: 759 Address: DF:A9:FF:F6:B1:1A (OUI DF-A9-FF)
        Count: 1
        Buffers: 0/3
        #58: len 9 (0 Kb/s)
        Latency: 170 msec (155-170 msec ~162 msec)
> ACL Data RX: Handle 759 flags 0x02 dlen 11                                                                         #60 5.668989
      ATT: Read By Type Request (0x08) len 6
        Handle range: 0x000b-0x0011
        Attribute type: Characteristic (0x2803)
zephyr.exe[241115]: < HCI Command: Host Number of Completed Packets (0x03|0x0035) plen 5                             #61 5.678427
        Num handles: 1
        Handle: 759 Address: DF:A9:FF:F6:B1:1A (OUI DF-A9-FF)
        Count: 1
zephyr.exe[241115]: < ACL Data TX: Handle 759 [1/3] flags 0x00 dlen 20                                               #62 5.678455
      ATT: Read By Type Response (0x09) len 15
        Attribute data length: 7
        Attribute data list: 2 entries
        Handle: 0x000c
        Value[5]: 0a0d00002a
            Properties: 0x0a
              Read (0x02)
              Write (0x08)
            Value Handle: 0x000d
            Value UUID: Device Name (0x2a00)
        Handle: 0x000e
        Value[5]: 0a0f00012a
            Properties: 0x0a
              Read (0x02)
              Write (0x08)
            Value Handle: 0x000f
            Value UUID: Appearance (0x2a01)
> HCI Event: Number of Completed Packets (0x13) plen 5                                                               #63 5.843757
        Num handles: 1
        Handle: 759 Address: DF:A9:FF:F6:B1:1A (OUI DF-A9-FF)
        Count: 1
        Buffers: 0/3
        #62: len 20 (0 Kb/s)
        Latency: 165 msec (155-170 msec ~164 msec)
> ACL Data RX: Handle 759 flags 0x02 dlen 11                                                                         #64 5.844263
      ATT: Read By Type Request (0x08) len 6
        Handle range: 0x000f-0x0011
        Attribute type: Characteristic (0x2803)
zephyr.exe[241115]: < HCI Command: Host Number of Completed Packets (0x03|0x0035) plen 5                             #65 5.858512
        Num handles: 1
        Handle: 759 Address: DF:A9:FF:F6:B1:1A (OUI DF-A9-FF)
        Count: 1
zephyr.exe[241115]: < ACL Data TX: Handle 759 [1/3] flags 0x00 dlen 13                                               #66 5.858577
      ATT: Read By Type Response (0x09) len 8
        Attribute data length: 7
        Attribute data list: 1 entry
        Handle: 0x0010
        Value[5]: 021100042a
            Properties: 0x02
              Read (0x02)
            Value Handle: 0x0011
            Value UUID: Peripheral Preferred Connection Parameters (0x2a04)
> HCI Event: Number of Completed Packets (0x13) plen 5                                                               #67 6.019026
        Num handles: 1
        Handle: 759 Address: DF:A9:FF:F6:B1:1A (OUI DF-A9-FF)
        Count: 1
        Buffers: 0/3
        #66: len 13 (0 Kb/s)
        Latency: 160 msec (155-170 msec ~162 msec)
> ACL Data RX: Handle 759 flags 0x02 dlen 11                                                                         #68 6.019029
      ATT: Read By Type Request (0x08) len 6
        Handle range: 0x0011-0x0011
        Attribute type: Characteristic (0x2803)
zephyr.exe[241115]: < HCI Command: Host Number of Completed Packets (0x03|0x0035) plen 5                             #69 6.038481
        Num handles: 1
        Handle: 759 Address: DF:A9:FF:F6:B1:1A (OUI DF-A9-FF)
        Count: 1
zephyr.exe[241115]: < ACL Data TX: Handle 759 [1/3] flags 0x00 dlen 9                                                #70 6.038505
      ATT: Error Response (0x01) len 4
        Read By Type Request (0x08)
        Handle: 0x0011
        Error: Attribute Not Found (0x0a)
> HCI Event: Number of Completed Packets (0x13) plen 5                                                               #71 6.194152
        Num handles: 1
        Handle: 759 Address: DF:A9:FF:F6:B1:1A (OUI DF-A9-FF)
        Count: 1
        Buffers: 0/3
        #70: len 9 (0 Kb/s)
        Latency: 155 msec (155-170 msec ~158 msec)
> ACL Data RX: Handle 759 flags 0x02 dlen 11                                                                         #72 8.118749
      SMP: Pairing Request (0x01) len 6
        IO capability: KeyboardDisplay (0x04)
        OOB data: Authentication data not present (0x00)
        Authentication requirement: Bonding, MITM, SC, No Keypresses (0x0d)
        Max encryption key size: 16
        Initiator key distribution: EncKey IdKey Sign (0x07)
        Responder key distribution: EncKey IdKey Sign (0x07)
zephyr.exe[241115]: < HCI Command: Host Number of Completed Packets (0x03|0x0035) plen 5                             #73 8.138543
        Num handles: 1
        Handle: 759 Address: DF:A9:FF:F6:B1:1A (OUI DF-A9-FF)
        Count: 1
zephyr.exe[241115]: < ACL Data TX: Handle 759 [1/3] flags 0x00 dlen 11                                               #74 8.138565
      SMP: Pairing Response (0x02) len 6
        IO capability: KeyboardDisplay (0x04)
        OOB data: Authentication data not present (0x00)
        Authentication requirement: Bonding, No MITM, SC, No Keypresses (0x09)
        Max encryption key size: 16
        Initiator key distribution: IdKey Sign (0x06)
        Responder key distribution: Sign (0x04)
> HCI Event: Number of Completed Packets (0x13) plen 5                                                               #75 8.294149
        Num handles: 1
        Handle: 759 Address: DF:A9:FF:F6:B1:1A (OUI DF-A9-FF)
        Count: 1
        Buffers: 0/3
        #74: len 11 (0 Kb/s)
        Latency: 155 msec (155-170 msec ~157 msec)
> ACL Data RX: Handle 759 flags 0x02 dlen 27                                                                         #76 8.294255
> ACL Data RX: Handle 759 flags 0x01 dlen 27                                                                         #77 8.294644
> ACL Data RX: Handle 759 flags 0x01 dlen 15                                                                         #78 8.295360
      SMP: Pairing Public Key (0x0c) len 64
        X[32]: ae5ad8a851395b27c508ca535806e25ff9343bbb56b9fe7940f75c959f5114ef
        Y[32]: 9695f80668f375fd05c52ae86664c262895abbe457ebcc710ec2a214d9e249b0
zephyr.exe[241115]: < HCI Command: Host Number of Completed Packets (0x03|0x0035) plen 5                             #79 8.298640
        Num handles: 1
        Handle: 759 Address: DF:A9:FF:F6:B1:1A (OUI DF-A9-FF)
        Count: 1
zephyr.exe[241115]: < HCI Command: Host Number of Completed Packets (0x03|0x0035) plen 5                             #80 8.298719
        Num handles: 1
        Handle: 759 Address: DF:A9:FF:F6:B1:1A (OUI DF-A9-FF)
        Count: 1
zephyr.exe[241115]: < HCI Command: Host Number of Completed Packets (0x03|0x0035) plen 5                             #81 8.298777
        Num handles: 1
        Handle: 759 Address: DF:A9:FF:F6:B1:1A (OUI DF-A9-FF)
        Count: 1
zephyr.exe[241115]: < ACL Data TX: Handle 759 [1/3] flags 0x00 dlen 27                                               #82 8.298825
zephyr.exe[241115]: < ACL Data TX: Handle 759 flags 0x01 dlen 27                                                     #83 8.298827
zephyr.exe[241115]: < ACL Data TX: Handle 759 flags 0x01 dlen 15                                                     #84 8.298827
      SMP: Pairing Public Key (0x0c) len 64
        X[32]: 98308440221e2d910f0e54b71e7ec652857aa9b5a0dc65028824cc19db1226e9
        Y[32]: 67a4816bcb62efb21701e31fdb27561a6217575fb007a8bbdabe7e28b6f68482
> HCI Event: Number of Completed Packets (0x13) plen 5                                                               #85 8.381785
        Num handles: 1
        Handle: 759 Address: DF:A9:FF:F6:B1:1A (OUI DF-A9-FF)
        Count: 1
        Buffers: 0/3
        #82: len 27 (2 Kb/s)
        Latency: 82 msec (82-170 msec ~120 msec)
> HCI Event: Number of Completed Packets (0x13) plen 5                                                               #86 8.382547
        Num handles: 1
        Handle: 759 Address: DF:A9:FF:F6:B1:1A (OUI DF-A9-FF)
        Count: 1
        Buffers: underflow/3
        #83: len 27 (2 Kb/s)
        Latency: 83 msec (82-170 msec ~101 msec)
zephyr.exe[241115]: < ACL Data TX: Handle 759 [1/3] flags 0x00 dlen 21                                               #87 8.398423
      SMP: Pairing Confirm (0x03) len 16
        Confirm value[16]: 713e6322e4fb8ce8b4f365b082797b7f
> HCI Event: Number of Completed Packets (0x13) plen 5                                                               #88 8.468584
        Num handles: 1
        Handle: 759 Address: DF:A9:FF:F6:B1:1A (OUI DF-A9-FF)
        Count: 1
        Buffers: 0/3
        #84: len 15 (0 Kb/s)
        Latency: 169 msec (82-170 msec ~135 msec)
> HCI Event: Number of Completed Packets (0x13) plen 5                                                               #89 8.556291
        Num handles: 1
        Handle: 759 Address: DF:A9:FF:F6:B1:1A (OUI DF-A9-FF)
        Count: 1
        Buffers: underflow/3
        #87: len 21 (1 Kb/s)
        Latency: 157 msec (82-170 msec ~146 msec)
> ACL Data RX: Handle 759 flags 0x02 dlen 21                                                                         #90 8.556567
      SMP: Pairing Random (0x04) len 16
        Random value[16]: 85c07696fec313480000000000000000
zephyr.exe[241115]: < HCI Command: Host Number of Completed Packets (0x03|0x0035) plen 5                             #91 8.558556
        Num handles: 1
        Handle: 759 Address: DF:A9:FF:F6:B1:1A (OUI DF-A9-FF)
        Count: 1
zephyr.exe[241115]: < ACL Data TX: Handle 759 [1/3] flags 0x00 dlen 21                                               #92 8.558574
      SMP: Pairing Random (0x04) len 16
        Random value[16]: 8e6108f966a694cbe26df70bb96773e6
> HCI Event: Number of Completed Packets (0x13) plen 5                                                               #93 8.731179
        Num handles: 1
        Handle: 759 Address: DF:A9:FF:F6:B1:1A (OUI DF-A9-FF)
        Count: 1
        Buffers: 0/3
        #92: len 21 (0 Kb/s)
        Latency: 172 msec (82-172 msec ~159 msec)
zephyr.exe[241115]: < ACL Data TX: Handle 759 [1/3] flags 0x00 dlen 16                                               #94 9.628420
      LE L2CAP: Connection Parameter Update Request (0x12) ident 1 len 8
        Min interval: 24
        Max interval: 40
        Peripheral latency: 0
        Timeout multiplier: 42
> ACL Data RX: Handle 759 flags 0x02 dlen 21                                                                         #95 9.694207
      SMP: Pairing DHKey Check (0x0d) len 16
        E[16]: 2a0a3e9eddfa7871a5df3b98e4cde0e7
zephyr.exe[241115]: < HCI Command: Host Number of Completed Packets (0x03|0x0035) plen 5                             #96 9.698613
        Num handles: 1
        Handle: 759 Address: DF:A9:FF:F6:B1:1A (OUI DF-A9-FF)
        Count: 1
zephyr.exe[241115]: < ACL Data TX: Handle 759 [2/3] flags 0x00 dlen 21                                               #97 9.698704
      SMP: Pairing DHKey Check (0x0d) len 16
        E[16]: f18b8ded9c1b4670f8bed435d992cf3d
> HCI Event: Number of Completed Packets (0x13) plen 5                                                               #98 9.781036
        Num handles: 1
        Handle: 759 Address: DF:A9:FF:F6:B1:1A (OUI DF-A9-FF)
        Count: 1
        Buffers: 1/3
        #94: len 16 (0 Kb/s)
        Latency: 152 msec (82-172 msec ~156 msec)
> ACL Data RX: Handle 759 flags 0x02 dlen 10                                                                         #99 9.781420
      LE L2CAP: Connection Parameter Update Response (0x13) ident 1 len 2
        Result: Connection Parameters accepted (0x0000)
zephyr.exe[241115]: < HCI Command: Host Number of Completed Packets (0x03|0x0035) plen 5                            #100 9.798560
        Num handles: 1
        Handle: 759 Address: DF:A9:FF:F6:B1:1A (OUI DF-A9-FF)
        Count: 1
> HCI Event: Number of Completed Packets (0x13) plen 5                                                              #101 9.868634
        Num handles: 1
        Handle: 759 Address: DF:A9:FF:F6:B1:1A (OUI DF-A9-FF)
        Count: 1
        Buffers: 0/3
        #97: len 21 (0 Kb/s)
        Latency: 169 msec (82-172 msec ~163 msec)
> HCI Event: LE Meta Event (0x3e) plen 13                                                                           #102 9.957209
      LE Long Term Key Request (0x05)
        Handle: 759 Address: DF:A9:FF:F6:B1:1A (OUI DF-A9-FF)
        Random number: 0x0000000000000000
        Encrypted diversifier: 0x0000
zephyr.exe[241115]: < HCI Command: LE Long Term Key Request Reply (0x08|0x001a) plen 18                             #103 9.958459
        Handle: 759 Address: DF:A9:FF:F6:B1:1A (OUI DF-A9-FF)
        Long term key[16]: db52ee7e651d7d6f3cf6a3a424d295d8
> HCI Event: Command Complete (0x0e) plen 6                                                                         #104 9.959149
      LE Long Term Key Request Reply (0x08|0x001a) ncmd 1
        Status: Success (0x00)
        Handle: 759 Address: DF:A9:FF:F6:B1:1A (OUI DF-A9-FF)
> HCI Event: Encryption Change (0x08) plen 4                                                                       #105 10.393879
        Status: Success (0x00)
        Handle: 759 Address: DF:A9:FF:F6:B1:1A (OUI DF-A9-FF)
        Encryption: Enabled with AES-CCM (0x01)
zephyr.exe[241115]: < ACL Data TX: Handle 759 [1/3] flags 0x00 dlen 21                                             #106 10.508575
      SMP: Signing Information (0x0a) len 16
        Signature key[16]: 5da095555cc64d02679f89a05211af56
> HCI Event: Number of Completed Packets (0x13) plen 5                                                             #107 10.656277
        Num handles: 1
        Handle: 759 Address: DF:A9:FF:F6:B1:1A (OUI DF-A9-FF)
        Count: 1
        Buffers: 0/3
        #106: len 21 (1 Kb/s)
        Latency: 147 msec (82-172 msec ~155 msec)
> ACL Data RX: Handle 759 flags 0x02 dlen 21                                                                       #108 10.656854
      SMP: Identity Information (0x08) len 16
        Identity resolving key[16]: 1848aa238dc007fe6639cc5a8f4261cf
> ACL Data RX: Handle 759 flags 0x02 dlen 12                                                                       #109 10.656959
      SMP: Identity Address Information (0x09) len 7
        Address: DF:A9:FF:F6:B1:1A (OUI DF-A9-FF)
> ACL Data RX: Handle 759 flags 0x02 dlen 21                                                                       #110 10.657614
      SMP: Signing Information (0x0a) len 16
        Signature key[16]: d4ccff834fd3c2f12241ffe96c0fd7d8
zephyr.exe[241115]: < HCI Command: Host Number of Completed Packets (0x03|0x0035) plen 5                           #111 10.658489
        Num handles: 1
        Handle: 759 Address: DF:A9:FF:F6:B1:1A (OUI DF-A9-FF)
        Count: 1
zephyr.exe[241115]: < HCI Command: LE Add Device To Resolving List (0x08|0x0027) plen 39                           #112 10.658495
        Address type: Public (0x00)
        Address: DF:A9:FF:F6:B1:1A (OUI DF-A9-FF)
        Peer identity resolving key[16]: 1848aa238dc007fe6639cc5a8f4261cf
        Local identity resolving key[16]: 00000000000000000000000000000000
> HCI Event: Command Complete (0x0e) plen 4                                                                        #113 10.659579
      LE Add Device To Resolving List (0x08|0x0027) ncmd 1
        Status: Success (0x00)
zephyr.exe[241115]: < HCI Command: LE Set Privacy Mode (0x08|0x004e) plen 8                                        #114 10.678479
        Peer Identity address type: Public (0x00)
        Peer Identity address: DF:A9:FF:F6:B1:1A (OUI DF-A9-FF)
        Privacy Mode: Use Device Privacy (0x01)
> HCI Event: Command Complete (0x0e) plen 4                                                                        #115 10.679069
      LE Set Privacy Mode (0x08|0x004e) ncmd 1
        Status: Success (0x00)
zephyr.exe[241115]: < HCI Command: LE Set Address Resolution Enable (0x08|0x002d) plen 1                           #116 10.698507
        Address resolution: Enabled (0x01)
> HCI Event: Command Complete (0x0e) plen 4                                                                        #117 10.699053
      LE Set Address Resolution Enable (0x08|0x002d) ncmd 1
        Status: Success (0x00)
zephyr.exe[241115]: < HCI Command: Host Number of Completed Packets (0x03|0x0035) plen 5                           #118 10.718440
        Num handles: 1
        Handle: 759 Address: DF:A9:FF:F6:B1:1A (OUI DF-A9-FF)
        Count: 1
zephyr.exe[241115]: < HCI Command: Host Number of Completed Packets (0x03|0x0035) plen 5                           #119 10.718589
        Num handles: 1
        Handle: 759 Address: DF:A9:FF:F6:B1:1A (OUI DF-A9-FF)
        Count: 1
> ACL Data RX: Handle 759 flags 0x02 dlen 13                                                                       #120 10.743950
      ATT: Find By Type Value Request (0x06) len 8
        Handle range: 0x0001-0xffff
        Attribute type: Primary Service (0x2800)
          UUID: Generic Access Profile (0x1800)
zephyr.exe[241115]: < HCI Command: Host Number of Completed Packets (0x03|0x0035) plen 5                           #121 10.758557
        Num handles: 1
        Handle: 759 Address: DF:A9:FF:F6:B1:1A (OUI DF-A9-FF)
        Count: 1
zephyr.exe[241115]: < ACL Data TX: Handle 759 [1/3] flags 0x00 dlen 9                                              #122 10.758585
      ATT: Find By Type Value Response (0x07) len 4
        Handle range: 0x000b-0x0011
> HCI Event: Number of Completed Packets (0x13) plen 5                                                             #123 10.918835
        Num handles: 1
        Handle: 759 Address: DF:A9:FF:F6:B1:1A (OUI DF-A9-FF)
        Count: 1
        Buffers: 0/3
        #122: l