Bluetooth monitor ver 5.72
= Note: Linux version 6.14.0-36-generic (x86_64)                       0.270868
= Note: Bluetooth subsystem version 2.22                               0.270870
= New Index: 00:00:00:00:00:00 (Primary,UART,hci1)              [hci1] 0.270871
= New Index: 48:5F:99:8E:E0:64 (Primary,USB,hci0)               [hci0] 0.270872
= Open Index: 00:00:00:00:00:00                                 [hci1] 0.385276
= Index Info: 00:00:00:00:00:00 (Nordic Semiconductor ASA)      [hci1] 0.385296
@ USER Open: main (privileged) version 2.22            {0x0001} [hci1] 0.385305
< HCI Command: Reset (0x03|0x0003) plen 0                    #1 [hci1] 0.386566
> HCI Event: Command Complete (0x0e) plen 4                  #2 [hci1] 0.387089
      Reset (0x03|0x0003) ncmd 1
        Status: Success (0x00)
< HCI Command: Read Local Supported... (0x04|0x0003) plen 0  #3 [hci1] 0.404733
> HCI Event: Command Complete (0x0e) plen 12                 #4 [hci1] 0.405249
      Read Local Supported Features (0x04|0x0003) ncmd 1
        Status: Success (0x00)
        Features: 0x00 0x00 0x00 0x00 0x60 0x00 0x00 0x00
          BR/EDR Not Supported
          LE Supported (Controller)
< HCI Command: Read Local Version In.. (0x04|0x0001) plen 0  #5 [hci1] 0.424761
> HCI Event: Command Complete (0x0e) plen 12                 #6 [hci1] 0.425238
      Read Local Version Information (0x04|0x0001) ncmd 1
        Status: Success (0x00)
        HCI version: Reserved (0x0f) - Revision 12393 (0x3069)
        LMP version: Reserved (0x0f) - Subversion 12393 (0x3069)
        Manufacturer: Nordic Semiconductor ASA (89)
< HCI Command: Read Local Supported... (0x04|0x0002) plen 0  #7 [hci1] 0.444766
> HCI Event: Command Complete (0x0e) plen 68                 #8 [hci1] 0.445855
      Read Local Supported Commands (0x04|0x0002) ncmd 1
        Status: Success (0x00)
        Commands: 119 entries
          Disconnect (Octet 0 - Bit 5)
          Read Remote Version Information (Octet 2 - Bit 7)
          Set Event Mask (Octet 5 - Bit 6)
          Reset (Octet 5 - Bit 7)
          Read Connection Accept Timeout (Octet 7 - Bit 2)
          Write Connection Accept Timeout (Octet 7 - Bit 3)
          Read Transmit Power Level (Octet 10 - Bit 2)
          Set Controller To Host Flow Control (Octet 10 - Bit 5)
          Host Buffer Size (Octet 10 - Bit 6)
          Host Number of Completed Packets (Octet 10 - Bit 7)
          Read Local Version Information (Octet 14 - Bit 3)
          Read Local Supported Features (Octet 14 - Bit 5)
          Read BD ADDR (Octet 15 - Bit 1)
          Read RSSI (Octet 15 - Bit 5)
          Set Event Mask Page 2 (Octet 22 - Bit 2)
          LE Set Event Mask (Octet 25 - Bit 0)
          LE Read Buffer Size (Octet 25 - Bit 1)
          LE Read Local Supported Features (Octet 25 - Bit 2)
          LE Set Random Address (Octet 25 - Bit 4)
          LE Set Advertising Parameters (Octet 25 - Bit 5)
          LE Read Advertising Channel TX Power (Octet 25 - Bit 6)
          LE Set Advertising Data (Octet 25 - Bit 7)
          LE Set Scan Response Data (Octet 26 - Bit 0)
          LE Set Advertise Enable (Octet 26 - Bit 1)
          LE Set Scan Parameters (Octet 26 - Bit 2)
          LE Set Scan Enable (Octet 26 - Bit 3)
          LE Create Connection (Octet 26 - Bit 4)
          LE Create Connection Cancel (Octet 26 - Bit 5)
          LE Read Accept List Size (Octet 26 - Bit 6)
          LE Clear Accept List (Octet 26 - Bit 7)
          LE Add Device To Accept List (Octet 27 - Bit 0)
          LE Remove Device From Accept List (Octet 27 - Bit 1)
          LE Connection Update (Octet 27 - Bit 2)
          LE Set Host Channel Classification (Octet 27 - Bit 3)
          LE Read Channel Map (Octet 27 - Bit 4)
          LE Read Remote Used Features (Octet 27 - Bit 5)
          LE Encrypt (Octet 27 - Bit 6)
          LE Rand (Octet 27 - Bit 7)
          LE Start Encryption (Octet 28 - Bit 0)
          LE Long Term Key Request Reply (Octet 28 - Bit 1)
          LE Long Term Key Request Neg Reply (Octet 28 - Bit 2)
          LE Read Supported States (Octet 28 - Bit 3)
          LE Receiver Test (Octet 28 - Bit 4)
          LE Transmitter Test (Octet 28 - Bit 5)
          LE Test End (Octet 28 - Bit 6)
          Read Authenticated Payload Timeout (Octet 32 - Bit 4)
          Write Authenticated Payload Timeout (Octet 32 - Bit 5)
          LE Set Data Length (Octet 33 - Bit 6)
          LE Read Suggested Default Data Length (Octet 33 - Bit 7)
          LE Write Suggested Default Data Length (Octet 34 - Bit 0)
          LE Add Device To Resolving List (Octet 34 - Bit 3)
          LE Remove Device From Resolving List (Octet 34 - Bit 4)
          LE Clear Resolving List (Octet 34 - Bit 5)
          LE Read Resolving List Size (Octet 34 - Bit 6)
          LE Set Address Resolution Enable (Octet 35 - Bit 1)
          LE Set Resolvable Private Address Timeout (Octet 35 - Bit 2)
          LE Read Maximum Data Length (Octet 35 - Bit 3)
          LE Read PHY (Octet 35 - Bit 4)
          LE Set Default PHY (Octet 35 - Bit 5)
          LE Set PHY (Octet 35 - Bit 6)
          LE Enhanced Receiver Test (Octet 35 - Bit 7)
          LE Enhanced Transmitter Test (Octet 36 - Bit 0)
          LE Set Advertising Set Random Address (Octet 36 - Bit 1)
          LE Set Extended Advertising Parameters (Octet 36 - Bit 2)
          LE Set Extended Advertising Data (Octet 36 - Bit 3)
          LE Set Extended Scan Response Data (Octet 36 - Bit 4)
          LE Set Extended Advertising Enable (Octet 36 - Bit 5)
          LE Read Maximum Advertising Data Length (Octet 36 - Bit 6)
          LE Read Number of Supported Advertising Sets (Octet 36 - Bit 7)
          LE Remove Advertising Set (Octet 37 - Bit 0)
          LE Clear Advertising Sets (Octet 37 - Bit 1)
          LE Set Periodic Advertising Parameters (Octet 37 - Bit 2)
          LE Set Periodic Advertising Data (Octet 37 - Bit 3)
          LE Set Periodic Advertising Enable (Octet 37 - Bit 4)
          LE Set Extended Scan Parameters (Octet 37 - Bit 5)
          LE Set Extended Scan Enable (Octet 37 - Bit 6)
          LE Extended Create Connection (Octet 37 - Bit 7)
          LE Periodic Advertising Create Sync (Octet 38 - Bit 0)
          LE Periodic Advertising Create Sync Cancel (Octet 38 - Bit 1)
          LE Periodic Advertising Terminate Sync (Octet 38 - Bit 2)
          LE Add Device To Periodic Advertiser List (Octet 38 - Bit 3)
          LE Remove Device From Periodic Advertiser List (Octet 38 - Bit 4)
          LE Clear Periodic Advertiser List (Octet 38 - Bit 5)
          LE Read Periodic Advertiser List Size (Octet 38 - Bit 6)
          LE Read Transmit Power (Octet 38 - Bit 7)
          LE Read RF Path Compensation (Octet 39 - Bit 0)
          LE Write RF Path Compensation (Octet 39 - Bit 1)
          LE Set Privacy Mode (Octet 39 - Bit 2)
          LE Periodic Advertising Receive Enable (Octet 40 - Bit 5)
          LE Periodic Advertising Sync Transfer (Octet 40 - Bit 6)
          LE Periodic Advertising Set Info Transfer (Octet 40 - Bit 7)
          LE Periodic Advertising Sync Transfer Parameters (Octet 41 - Bit 0)
          LE Set Default Periodic Advertisng Sync Transfer Parameters (Octet 41 - Bit 1)
          LE Read Buffer v2 (Octet 41 - Bit 5)
          LE Read ISO TX Sync (Octet 41 - Bit 6)
          LE Set Connected Isochronous Group Parameters (Octet 41 - Bit 7)
          LE Set Connected Isochronous Group Parameters Test (Octet 42 - Bit 0)
          LE Create Connected Isochronous Stream (Octet 42 - Bit 1)
          LE Remove Connected Isochronous Group (Octet 42 - Bit 2)
          LE Accept Connected Isochronous Stream Request (Octet 42 - Bit 3)
          LE Reject Connected Isochronous Stream Request (Octet 42 - Bit 4)
          LE Create Broadcast Isochronous Group (Octet 42 - Bit 5)
          LE Create Broadcast Isochronous Group Test (Octet 42 - Bit 6)
          LE Terminate Broadcast Isochronous Group (Octet 42 - Bit 7)
          LE Broadcast Isochronous Group Create Sync (Octet 43 - Bit 0)
          LE Broadcast Isochronous Group Terminate Sync (Octet 43 - Bit 1)
          LE Request Peer SCA (Octet 43 - Bit 2)
          LE Setup Isochronous Data Path (Octet 43 - Bit 3)
          LE Remove Isochronous Data Path (Octet 43 - Bit 4)
          LE Isochronous Transmit Test (Octet 43 - Bit 5)
          LE Isochronous Receive Test (Octet 43 - Bit 6)
          LE Isochronous Read Test Counters (Octet 43 - Bit 7)
          LE Isochronous Read Test Counters (Octet 44 - Bit 0)
          LE Set Host Feature (Octet 44 - Bit 1)
          Octet 44 - Bit 2 
          Octet 45 - Bit 6 
          Octet 46 - Bit 0 
          Octet 46 - Bit 1 
          Octet 46 - Bit 2 
< HCI Command: Host Buffer Size (0x03|0x0033) plen 7         #9 [hci1] 0.464729
        ACL MTU: 255  ACL max packet: 16
        SCO MTU: 0    SCO max packet: 0
> HCI Event: Command Complete (0x0e) plen 4                 #10 [hci1] 0.465301
      Host Buffer Size (0x03|0x0033) ncmd 1
        Status: Success (0x00)
< HCI Command: Set Controller To Ho.. (0x03|0x0031) plen 1  #11 [hci1] 0.484736
        Flow control: ACL Data Packets (0x01)
> HCI Event: Command Complete (0x0e) plen 4                 #12 [hci1] 0.485192
      Set Controller To Host Flow Control (0x03|0x0031) ncmd 1
        Status: Success (0x00)
< HCI Command: LE Read Local Suppor.. (0x08|0x0003) plen 0  #13 [hci1] 0.504756
> HCI Event: Command Complete (0x0e) plen 12                #14 [hci1] 0.505292
      LE Read Local Supported Features (0x08|0x0003) ncmd 1
        Status: Success (0x00)
        Features: 0xfd 0x79 0x00 0xf7 0x30 0x01 0x00 0x00
          LE Encryption
          Extended Reject Indication
          Peripheral-initiated Features Exchange
          LE Ping
          LE Data Packet Length Extension
          LL Privacy
          Extended Scanner Filter Policies
          LE 2M PHY
          LE Coded PHY
          LE Extended Advertising
          LE Periodic Advertising
          Channel Selection Algorithm #2
          Periodic Advertising Sync Transfer - Sender
          Periodic Advertising Sync Transfer - Recipient
          Sleep Clock Accuracy Updates
          Connected Isochronous Stream - Central
          Connected Isochronous Stream - Peripheral
          Isochronous Broadcaster
          Synchronized Receiver
          Periodic Advertising ADI support
          Connection Subrating
          Unknown features (0x0000010000000000)
< HCI Command: LE Set Host Feature (0x08|0x0074) plen 2     #15 [hci1] 0.524770
        Bit Number: 32
          Connected Isochronous Stream (Host Support)
        Bit Value: 1
> HCI Event: Command Complete (0x0e) plen 4                 #16 [hci1] 0.525307
      LE Set Host Feature (0x08|0x0074) ncmd 1
        Status: Success (0x00)
< HCI Command: LE Read Buffer v2 (0x08|0x0060) plen 0       #17 [hci1] 0.544754
> HCI Event: Command Complete (0x0e) plen 10                #18 [hci1] 0.545182
      LE Read Buffer v2 (0x08|0x0060) ncmd 1
        Status: Success (0x00)
        ACL MTU: 27
        ACL max packet: 3
        ISO MTU: 318
        ISO max packet: 3
< HCI Command: LE Read Maximum Adve.. (0x08|0x003a) plen 0  #19 [hci1] 0.564786
> HCI Event: Command Complete (0x0e) plen 6                 #20 [hci1] 0.565220
      LE Read Maximum Advertising Data Length (0x08|0x003a) ncmd 1
        Status: Success (0x00)
        Max length: 1650
< HCI Command: LE Read Supported St.. (0x08|0x001c) plen 0  #21 [hci1] 0.584736
> HCI Event: Command Complete (0x0e) plen 12                #22 [hci1] 0.585301
      LE Read Supported States (0x08|0x001c) ncmd 1
        Status: Success (0x00)
        States: 0x000003ff3e0306ff
          Non-connectable Advertising State
          Scannable Advertising State
          Connectable Advertising State
          High Duty Cycle Directed Advertising State
          Passive Scanning State
          Active Scanning State
          Initiating State
            and Connection State (Central Role)
          Connection State (Peripheral Role)
          Scannable Advertising State
            and Passive Scanning State
          Connectable Advertising State
            and Passive Scanning State
          Non-connectable Advertising State
            and Initiating State
          Scannable Advertising State
            and Initiating State
          Active Scanning State
            and Connection State (Central Role)
          Passive Scanning State
            and Connection State (Peripheral Role)
          Active Scanning State
            and Connection State (Peripheral Role)
          Initiating State
            and Connection State (Central Role)
            and Central Role & Central Role
          Low Duty Cycle Directed Advertising State
          Connectable Advertising State
            and Initiating State
            and Central Role & Peripheral Role
          High Duty Cycle Directed Advertising State
            and Initiating State
            and Central Role & Peripheral Role
          Low Duty Cycle Directed Advertising State
            and Initiating State
            and Central Role & Peripheral Role
          Connectable Advertising State
            and Connection State (Central Role)
            and Central Role & Peripheral Role
          High Duty Cycle Directed Advertising State
            and Connection State (Central Role)
            and Central Role & Peripheral Role
          Low Duty Cycle Directed Advertising State
            and Connection State (Central Role)
            and Central Role & Peripheral Role
          Connectable Advertising State
            and Connection State (Peripheral Role)
            and Central Role & Peripheral Role
          High Duty Cycle Directed Advertising State
            and Connection State (Peripheral Role)
            and Peripheral Role & Peripheral Role
          Low Duty Cycle Directed Advertising State
            and Connection State (Peripheral Role)
            and Peripheral Role & Peripheral Role
          Initiating State
            and Connection State (Peripheral Role)
            and Central Role & Peripheral Role
< HCI Command: LE Read Maximum Data.. (0x08|0x002f) plen 0  #23 [hci1] 0.604732
> HCI Event: Command Complete (0x0e) plen 12                #24 [hci1] 0.605239
      LE Read Maximum Data Length (0x08|0x002f) ncmd 1
        Status: Success (0x00)
        Max TX octets: 251
        Max TX time: 2704
        Max RX octets: 251
        Max RX time: 2704
< HCI Command: LE Write Suggested D.. (0x08|0x0024) plen 4  #25 [hci1] 0.624753
        TX octets: 251
        TX time: 2704
> HCI Event: Command Complete (0x0e) plen 4                 #26 [hci1] 0.625233
      LE Write Suggested Default Data Length (0x08|0x0024) ncmd 1
        Status: Success (0x00)
< HCI Command: LE Read Resolving Li.. (0x08|0x002a) plen 0  #27 [hci1] 0.644764
> HCI Event: Command Complete (0x0e) plen 5                 #28 [hci1] 0.645201
      LE Read Resolving List Size (0x08|0x002a) ncmd 1
        Status: Success (0x00)
        Size: 8
< HCI Command: LE Set Event Mask (0x08|0x0001) plen 8       #29 [hci1] 0.664761
        Mask: 0x000002023f87fa5e
          LE Advertising Report
          LE Connection Update Complete
          LE Read Remote Used Features Complete
          LE Long Term Key Request
          LE Data Length Change
          LE Enhanced Connection Complete
          LE PHY Update Complete
          LE Extended Advertising Report
          LE Periodic Advertising Sync Established
          LE Periodic Advertising Report
          LE Periodic Advertising Sync Lost
          LE Extended Scan Timeout
          LE Extended Advertising Set Terminated
          LE Scan Request Received
          LE Periodic Advertising Sync Transfer Rvc
          LE CIS Established
          LE CIS Request
          LE Create BIG Complete
          LE Terminate BIG Complete
          LE BIG Sync Estabilished Complete
          LE BIG Sync Lost
          LE BIG Info Advertising Report
          Unknown mask (0x0000020000000000)
> HCI Event: Command Complete (0x0e) plen 4                 #30 [hci1] 0.665242
      LE Set Event Mask (0x08|0x0001) ncmd 1
        Status: Success (0x00)
< HCI Command: Set Event Mask (0x03|0x0001) plen 8          #31 [hci1] 0.684733
        Mask: 0x2000800002008890
          Disconnection Complete
          Encryption Change
          Read Remote Version Information Complete
          Hardware Error
          Data Buffer Overflow
          Encryption Key Refresh Complete
          LE Meta
> HCI Event: Command Complete (0x0e) plen 4                 #32 [hci1] 0.685249
      Set Event Mask (0x03|0x0001) ncmd 1
        Status: Success (0x00)
< HCI Command: Read BD ADDR (0x04|0x0009) plen 0            #33 [hci1] 0.704761
> HCI Event: Command Complete (0x0e) plen 10                #34 [hci1] 0.705232
      Read BD ADDR (0x04|0x0009) ncmd 1
        Status: Success (0x00)
        Address: 00:00:00:00:00:00 (OUI 00-00-00)
< HCI Command: LE Set Random Address (0x08|0x0005) plen 6   #35 [hci1] 0.724741
        Address: D5:B6:CC:31:DB:3B (Static)
> HCI Event: Command Complete (0x0e) plen 4                 #36 [hci1] 0.725230
      LE Set Random Address (0x08|0x0005) ncmd 1
        Status: Success (0x00)
< HCI Command: LE Set Extended Adv.. (0x08|0x0036) plen 25  #37 [hci1] 3.285299
        Handle: 0x00
        Properties: 0x0013
          Connectable
          Scannable
          Use legacy advertising PDUs: ADV_IND
        Min advertising interval: 100.000 msec (0x00a0)
        Max advertising interval: 150.000 msec (0x00f0)
        Channel map: 37, 38, 39 (0x07)
        Own address type: Random (0x01)
        Peer address type: Public (0x00)
        Peer address: 00:00:00:00:00:00 (OUI 00-00-00)
        Filter policy: Allow Scan Request from Any, Allow Connect Request from Any (0x00)
        TX power: Host has no preference (0x7f)
        Primary PHY: LE 1M (0x01)
        Secondary max skip: 0x00
        Secondary PHY: LE 1M (0x01)
        SID: 0x00
        Scan request notifications: Disabled (0x00)
> HCI Event: Command Complete (0x0e) plen 5                 #38 [hci1] 3.286134
      LE Set Extended Advertising Parameters (0x08|0x0036) ncmd 1
        Status: Success (0x00)
        TX power (selected): 0 dbm (0x00)
< HCI Command: LE Set Advertising S.. (0x08|0x0035) plen 7  #39 [hci1] 3.304788
        Advertising handle: 0x00
        Advertising random address: D5:B6:CC:31:DB:3B (Static)
> HCI Event: Command Complete (0x0e) plen 4                 #40 [hci1] 3.305336
      LE Set Advertising Set Random Address (0x08|0x0035) ncmd 1
        Status: Success (0x00)
< HCI Command: LE Set Extended Adv.. (0x08|0x0037) plen 22  #41 [hci1] 3.324757
        Handle: 0x00
        Operation: Complete extended advertising data (0x03)
        Fragment preference: Minimize fragmentation (0x01)
        Data length: 0x12
        Flags: 0x06
          LE General Discoverable Mode
          BR/EDR Not Supported
        Name (complete): Tester_F6B11A
> HCI Event: Command Complete (0x0e) plen 4                 #42 [hci1] 3.325480
      LE Set Extended Advertising Data (0x08|0x0037) ncmd 1
        Status: Success (0x00)
< HCI Command: LE Set Extended Scan.. (0x08|0x0038) plen 4  #43 [hci1] 3.344780
        Handle: 0x00
        Operation: Complete scan response data (0x03)
        Fragment preference: Minimize fragmentation (0x01)
        Data length: 0x00
> HCI Event: Command Complete (0x0e) plen 4                 #44 [hci1] 3.345269
      LE Set Extended Scan Response Data (0x08|0x0038) ncmd 1
        Status: Success (0x00)
< HCI Command: LE Set Extended Adve.. (0x08|0x0039) plen 6  #45 [hci1] 3.364819
        Extended advertising: Enabled (0x01)
        Number of sets: 1 (0x01)
        Entry 0
          Handle: 0x00
          Duration: 0 ms (0x00)
          Max ext adv events: 0
> HCI Event: Command Complete (0x0e) plen 4                 #46 [hci1] 3.365480
      LE Set Extended Advertising Enable (0x08|0x0039) ncmd 1
        Status: Success (0x00)
> HCI Event: LE Meta Event (0x3e) plen 31                   #47 [hci1] 3.484785
      LE Enhanced Connection Complete (0x0a)
        Status: Success (0x00)
        Handle: 1551
        Role: Peripheral (0x01)
        Peer address type: Public (0x00)
        Peer address: DF:A9:FF:F6:B1:1A (OUI DF-A9-FF)
        Local resolvable private address: 00:00:00:00:00:00 (Non-Resolvable)
        Peer resolvable private address: 00:00:00:00:00:00 (Non-Resolvable)
        Connection interval: 87.50 msec (0x0046)
        Connection latency: 0 (0x0000)
        Supervision timeout: 25120 msec (0x09d0)
        Central clock accuracy: 0x01
> HCI Event: LE Meta Event (0x3e) plen 6                    #48 [hci1] 3.484967
      LE Advertising Set Terminated (0x12)
        Status: Success (0x00)
        Handle: 0
        Connection handle: 1551
        Number of completed extended advertising events: 0
< HCI Command: LE Read Remote Used... (0x08|0x0016) plen 2  #49 [hci1] 3.505697
        Handle: 1551 Address: DF:A9:FF:F6:B1:1A (OUI DF-A9-FF)
< ACL Data TX: Handle 1551 flags 0x00 dlen 7                #50 [hci1] 3.505734
      ATT: Exchange MTU Request (0x02) len 2
        Client RX MTU: 251
> HCI Event: Command Status (0x0f) plen 4                   #51 [hci1] 3.506134
      LE Read Remote Used Features (0x08|0x0016) ncmd 1
        Status: Success (0x00)
> HCI Event: Number of Completed Packets (0x13) plen 5      #52 [hci1] 3.660736
        Num handles: 1
        Handle: 1551 Address: DF:A9:FF:F6:B1:1A (OUI DF-A9-FF)
        Count: 1
        #50: len 7 (0 Kb/s)
        Latency: 155 msec (155-155 msec ~155 msec)
> HCI Event: LE Meta Event (0x3e) plen 12                   #53 [hci1] 3.748660
      LE Read Remote Used Features (0x04)
        Status: Success (0x00)
        Handle: 1551 Address: DF:A9:FF:F6:B1:1A (OUI DF-A9-FF)
        Features: 0x2d 0x49 0x00 0xf7 0x67 0xd9 0x00 0x80
          LE Encryption
          Extended Reject Indication
          Peripheral-initiated Features Exchange
          LE Data Packet Length Extension
          LE 2M PHY
          LE Coded PHY
          Channel Selection Algorithm #2
          Periodic Advertising Sync Transfer - Sender
          Periodic Advertising Sync Transfer - Recipient
          Sleep Clock Accuracy Updates
          Connected Isochronous Stream - Central
          Connected Isochronous Stream - Peripheral
          Isochronous Broadcaster
          Synchronized Receiver
          Connected Isochronous Stream (Host Support)
          LE Power Control Request
          LE Power Control Request
          Connection Subrating
          Connection Subrating (Host Support)
          Unknown features (0x8000d90000000000)
> ACL Data RX: Handle 1551 flags 0x02 dlen 11               #54 [hci1] 6.198475
      SMP: Pairing Request (0x01) len 6
        IO capability: KeyboardDisplay (0x04)
        OOB data: Authentication data not present (0x00)
        Authentication requirement: Bonding, MITM, SC, No Keypresses (0x0d)
        Max encryption key size: 16
        Initiator key distribution: EncKey IdKey (0x03)
        Responder key distribution: EncKey IdKey Sign (0x07)
> ACL Data RX: Handle 1551 flags 0x02 dlen 7                #55 [hci1] 6.198849
      ATT: Exchange MTU Response (0x03) len 2
        Server RX MTU: 23
< HCI Command: Host Number of Compl.. (0x03|0x0035) plen 5  #56 [hci1] 6.205345
        Num handles: 1
        Handle: 1551 Address: DF:A9:FF:F6:B1:1A (OUI DF-A9-FF)
        Count: 1
< ACL Data TX: Handle 1551 flags 0x00 dlen 11               #57 [hci1] 6.205457
      SMP: Pairing Response (0x02) len 6
        IO capability: DisplayOnly (0x00)
        OOB data: Authentication data not present (0x00)
        Authentication requirement: Bonding, No MITM, SC, No Keypresses (0x09)
        Max encryption key size: 16
        Initiator key distribution: IdKey (0x02)
        Responder key distribution: <none> (0x00)
< HCI Command: Host Number of Compl.. (0x03|0x0035) plen 5  #58 [hci1] 6.205743
        Num handles: 1
        Handle: 1551 Address: DF:A9:FF:F6:B1:1A (OUI DF-A9-FF)
        Count: 1
> HCI Event: Number of Completed Packets (0x13) plen 5      #59 [hci1] 6.373486
        Num handles: 1
        Handle: 1551 Address: DF:A9:FF:F6:B1:1A (OUI DF-A9-FF)
        Count: 1
        #57: len 11 (0 Kb/s)
        Latency: 168 msec (155-168 msec ~161 msec)
> ACL Data RX: Handle 1551 flags 0x02 dlen 27               #60 [hci1] 6.373820
> ACL Data RX: Handle 1551 flags 0x01 dlen 27               #61 [hci1] 6.374473
> ACL Data RX: Handle 1551 flags 0x01 dlen 15               #62 [hci1] 6.374811
      SMP: Pairing Public Key (0x0c) len 64
        X: c30a7723171e6621dbc668957cc7714507a7e0fa222c281b36533de15106374c
        Y: 6ff13b58b86d4c5cd26334c872071c0bca887bb4eb3e2c9ac7f0ddc7048b0c27
< HCI Command: Host Number of Compl.. (0x03|0x0035) plen 5  #63 [hci1] 6.385260
        Num handles: 1
        Handle: 1551 Address: DF:A9:FF:F6:B1:1A (OUI DF-A9-FF)
        Count: 1
< HCI Command: Host Number of Compl.. (0x03|0x0035) plen 5  #64 [hci1] 6.385485
        Num handles: 1
        Handle: 1551 Address: DF:A9:FF:F6:B1:1A (OUI DF-A9-FF)
        Count: 1
< HCI Command: Host Number of Compl.. (0x03|0x0035) plen 5  #65 [hci1] 6.385864
        Num handles: 1
        Handle: 1551 Address: DF:A9:FF:F6:B1:1A (OUI DF-A9-FF)
        Count: 1
< ACL Data TX: Handle 1551 flags 0x00 dlen 27               #66 [hci1] 6.385929
< ACL Data TX: Handle 1551 flags 0x01 dlen 27               #67 [hci1] 6.385989
< ACL Data TX: Handle 1551 flags 0x01 dlen 15               #68 [hci1] 6.386097
      SMP: Pairing Public Key (0x0c) len 64
        X: 98308440221e2d910f0e54b71e7ec652857aa9b5a0dc65028824cc19db1226e9
        Y: 67a4816bcb62efb21701e31fdb27561a6217575fb007a8bbdabe7e28b6f68482
> HCI Event: Number of Completed Packets (0x13) plen 5      #69 [hci1] 6.461529
        Num handles: 1
        Handle: 1551 Address: DF:A9:FF:F6:B1:1A (OUI DF-A9-FF)
        Count: 1
        #66: len 27 (2 Kb/s)
        Latency: 75 msec (75-168 msec ~118 msec)
> HCI Event: Number of Completed Packets (0x13) plen 5      #70 [hci1] 6.462033
        Num handles: 1
        Handle: 1551 Address: DF:A9:FF:F6:B1:1A (OUI DF-A9-FF)
        Count: 1
        #67: len 27 (2 Kb/s)
        Latency: 76 msec (75-168 msec ~97 msec)
> HCI Event: Number of Completed Packets (0x13) plen 5      #71 [hci1] 6.548193
        Num handles: 1
        Handle: 1551 Address: DF:A9:FF:F6:B1:1A (OUI DF-A9-FF)
        Count: 1
        #68: len 15 (0 Kb/s)
        Latency: 162 msec (75-168 msec ~129 msec)
> ACL Data RX: Handle 1551 flags 0x02 dlen 21               #72 [hci1] 7.598553
      SMP: Pairing Confirm (0x03) len 16
        Confim value: 22416f7323ffdbac8407e89e1835d473
< HCI Command: Host Number of Compl.. (0x03|0x0035) plen 5  #73 [hci1] 7.605471
        Num handles: 1
        Handle: 1551 Address: DF:A9:FF:F6:B1:1A (OUI DF-A9-FF)
        Count: 1
< ACL Data TX: Handle 1551 flags 0x00 dlen 21               #74 [hci1] 7.605542
      SMP: Pairing Confirm (0x03) len 16
        Confim value: 534c5a276719f08e1b37a73acba9b268
> HCI Event: Number of Completed Packets (0x13) plen 5      #75 [hci1] 7.773415
        Num handles: 1
        Handle: 1551 Address: DF:A9:FF:F6:B1:1A (OUI DF-A9-FF)
        Count: 1
        #74: len 21 (1 Kb/s)
        Latency: 167 msec (75-168 msec ~148 msec)
> ACL Data RX: Handle 1551 flags 0x02 dlen 21               #76 [hci1] 7.773789
      SMP: Pairing Random (0x04) len 16
        Random value: 880d1e0d750e97900000000000000000
< HCI Command: Host Number of Compl.. (0x03|0x0035) plen 5  #77 [hci1] 7.785621
        Num handles: 1
        Handle: 1551 Address: DF:A9:FF:F6:B1:1A (OUI DF-A9-FF)
        Count: 1
< ACL Data TX: Handle 1551 flags 0x00 dlen 21               #78 [hci1] 7.785696
      SMP: Pairing Random (0x04) len 16
        Random value: 8e6108f966a694cbe26df70bb96773e6
> HCI Event: Number of Completed Packets (0x13) plen 5      #79 [hci1] 7.948320
        Num handles: 1
        Handle: 1551 Address: DF:A9:FF:F6:B1:1A (OUI DF-A9-FF)
        Count: 1
        #78: len 21 (1 Kb/s)
        Latency: 162 msec (75-168 msec ~155 msec)
> ACL Data RX: Handle 1551 flags 0x02 dlen 21               #80 [hci1] 8.036064
      SMP: Pairing Confirm (0x03) len 16
        Confim value: 96c694ed3ad3003ad975d6a88c51610d
< HCI Command: Host Number of Compl.. (0x03|0x0035) plen 5  #81 [hci1] 8.045326
        Num handles: 1
        Handle: 1551 Address: DF:A9:FF:F6:B1:1A (OUI DF-A9-FF)
        Count: 1
< ACL Data TX: Handle 1551 flags 0x00 dlen 21               #82 [hci1] 8.045494
      SMP: Pairing Confirm (0x03) len 16
        Confim value: e28b7de327e6d61fbe4a74e752598e42
> HCI Event: Number of Completed Packets (0x13) plen 5      #83 [hci1] 8.210897
        Num handles: 1
        Handle: 1551 Address: DF:A9:FF:F6:B1:1A (OUI DF-A9-FF)
        Count: 1
        #82: len 21 (1 Kb/s)
        Latency: 165 msec (75-168 msec ~160 msec)
> ACL Data RX: Handle 1551 flags 0x02 dlen 21               #84 [hci1] 8.211203
      SMP: Pairing Random (0x04) len 16
        Random value: f986bf4df8cdc7960000000000000000
< HCI Command: Host Number of Compl.. (0x03|0x0035) plen 5  #85 [hci1] 8.225535
        Num handles: 1
        Handle: 1551 Address: DF:A9:FF:F6:B1:1A (OUI DF-A9-FF)
        Count: 1
< ACL Data TX: Handle 1551 flags 0x00 dlen 21               #86 [hci1] 8.225686
      SMP: Pairing Random (0x04) len 16
        Random value: 4d02679f89a05211af56d8b3da64d21e
> HCI Event: Number of Completed Packets (0x13) plen 5      #87 [hci1] 8.385665
        Num handles: 1
        Handle: 1551 Address: DF:A9:FF:F6:B1:1A (OUI DF-A9-FF)
        Count: 1
        #86: len 21 (1 Kb/s)
        Latency: 159 msec (75-168 msec ~160 msec)
> ACL Data RX: Handle 1551 flags 0x02 dlen 21               #88 [hci1] 8.473590
      SMP: Pairing Confirm (0x03) len 16
        Confim value: 7aecd1dda63dd55d9bc4c22779a195be
< HCI Command: Host Number of Compl.. (0x03|0x0035) plen 5  #89 [hci1] 8.485356
        Num handles: 1
        Handle: 1551 Address: DF:A9:FF:F6:B1:1A (OUI DF-A9-FF)
        Count: 1
< ACL Data TX: Handle 1551 flags 0x00 dlen 21               #90 [hci1] 8.485459
      SMP: Pairing Confirm (0x03) len 16
        Confim value: c24e5aa6a842c1873abcf5913a98723c
> HCI Event: Number of Completed Packets (0x13) plen 5      #91 [hci1] 8.648500
        Num handles: 1
        Handle: 1551 Address: DF:A9:FF:F6:B1:1A (OUI DF-A9-FF)
        Count: 1
        #90: len 21 (1 Kb/s)
        Latency: 163 msec (75-168 msec ~161 msec)
> ACL Data RX: Handle 1551 flags 0x02 dlen 21               #92 [hci1] 8.648827
      SMP: Pairing Random (0x04) len 16
        Random value: 2756cd158bb305e80000000000000000
< HCI Command: Host Number of Compl.. (0x03|0x0035) plen 5  #93 [hci1] 8.665560
        Num handles: 1
        Handle: 1551 Address: DF:A9:FF:F6:B1:1A (OUI DF-A9-FF)
        Count: 1
< ACL Data TX: Handle 1551 flags 0x00 dlen 21               #94 [hci1] 8.665586
      SMP: Pairing Random (0x04) len 16
        Random value: 5e8286bc235a02440d0c3424a2acf8fd
> HCI Event: Number of Completed Packets (0x13) plen 5      #95 [hci1] 8.823157
        Num handles: 1
        Handle: 1551 Address: DF:A9:FF:F6:B1:1A (OUI DF-A9-FF)
        Count: 1
        #94: len 21 (1 Kb/s)
        Latency: 157 msec (75-168 msec ~159 msec)
> ACL Data RX: Handle 1551 flags 0x02 dlen 21               #96 [hci1] 8.911060
      SMP: Pairing Confirm (0x03) len 16
        Confim value: 5c6ecbdca5380b98b41cd12e8546e780
< HCI Command: Host Number of Compl.. (0x03|0x0035) plen 5  #97 [hci1] 8.925275
        Num handles: 1
        Handle: 1551 Address: DF:A9:FF:F6:B1:1A (OUI DF-A9-FF)
        Count: 1
< ACL Data TX: Handle 1551 flags 0x00 dlen 21               #98 [hci1] 8.925417
      SMP: Pairing Confirm (0x03) len 16
        Confim value: f22e44954371a1f1f35b712d123a5d3d
> HCI Event: Number of Completed Packets (0x13) plen 5      #99 [hci1] 9.085855
        Num handles: 1
        Handle: 1551 Address: DF:A9:FF:F6:B1:1A (OUI DF-A9-FF)
        Count: 1
        #98: len 21 (1 Kb/s)
        Latency: 160 msec (75-168 msec ~160 msec)
> ACL Data RX: Handle 1551 flags 0x02 dlen 21              #100 [hci1] 9.086226
      SMP: Pairing Random (0x04) len 16
        Random value: bd69f4d864f2fefe0000000000000000
< HCI Command: Host Number of Comp.. (0x03|0x0035) plen 5  #101 [hci1] 9.105613
        Num handles: 1
        Handle: 1551 Address: DF:A9:FF:F6:B1:1A (OUI DF-A9-FF)
        Count: 1
< ACL Data TX: Handle 1551 flags 0x00 dlen 21              #102 [hci1] 9.105712
      SMP: Pairing Random (0x04) len 16
        Random value: 5c4a1bcadd27bd58e945097b00bad7ac
> HCI Event: Number of Completed Packets (0x13) plen 5     #103 [hci1] 9.260725
        Num handles: 1
        Handle: 1551 Address: DF:A9:FF:F6:B1:1A (OUI DF-A9-FF)
        Count: 1
        #102: len 21 (1 Kb/s)
        Latency: 155 msec (75-168 msec ~157 msec)
> ACL Data RX: Handle 1551 flags 0x02 dlen 21              #104 [hci1] 9.348717
      SMP: Pairing Confirm (0x03) len 16
        Confim value: aa9b39a27c50046b3fd85c4b87d22a31
< HCI Command: Host Number of Comp.. (0x03|0x0035) plen 5  #105 [hci1] 9.365344
        Num handles: 1
        Handle: 1551 Address: DF:A9:FF:F6:B1:1A (OUI DF-A9-FF)
        Count: 1
< ACL Data TX: Handle 1551 flags 0x00 dlen 21              #106 [hci1] 9.365407
      SMP: Pairing Confirm (0x03) len 16
        Confim value: 06e0ef38be4f50bd25d92d060cef7f3c
> HCI Event: Number of Completed Packets (0x13) plen 5     #107 [hci1] 9.523434
        Num handles: 1
        Handle: 1551 Address: DF:A9:FF:F6:B1:1A (OUI DF-A9-FF)
        Count: 1
        #106: len 21 (1 Kb/s)
        Latency: 158 msec (75-168 msec ~157 msec)
> ACL Data RX: Handle 1551 flags 0x02 dlen 21              #108 [hci1] 9.523788
      SMP: Pairing Random (0x04) len 16
        Random value: 3f33e7fb6ab1b9b90000000000000000
< HCI Command: Host Number of Comp.. (0x03|0x0035) plen 5  #109 [hci1] 9.525532
        Num handles: 1
        Handle: 1551 Address: DF:A9:FF:F6:B1:1A (OUI DF-A9-FF)
        Count: 1
< ACL Data TX: Handle 1551 flags 0x00 dlen 21              #110 [hci1] 9.525584
      SMP: Pairing Random (0x04) len 16
        Random value: 32527e6e64e79f33b2e374394db8ab2d
> HCI Event: Number of Completed Packets (0x13) plen 5     #111 [hci1] 9.698176
        Num handles: 1
        Handle: 1551 Address: DF:A9:FF:F6:B1:1A (OUI DF-A9-FF)
        Count: 1
        #110: len 21 (0 Kb/s)
        Latency: 172 msec (75-172 msec ~165 msec)
> ACL Data RX: Handle 1551 flags 0x02 dlen 21              #112 [hci1] 9.786045
      SMP: Pairing Confirm (0x03) len 16
        Confim value: a464a784ed186e1675b0ee271a93c6f7
< HCI Command: Host Number of Comp.. (0x03|0x0035) plen 5  #113 [hci1] 9.805253
        Num handles: 1
        Handle: 1551 Address: DF:A9:FF:F6:B1:1A (OUI DF-A9-FF)
        Count: 1
< ACL Data TX: Handle 1551 flags 0x00 dlen 21              #114 [hci1] 9.805305
      SMP: Pairing Confirm (0x03) len 16
        Confim value: 7b78b0a81a2c59d96a4cf85d58210a7b
> HCI Event: Number of Completed Packets (0x13) plen 5     #115 [hci1] 9.960872
        Num handles: 1
        Handle: 1551 Address: DF:A9:FF:F6:B1:1A (OUI DF-A9-FF)
        Count: 1
        #114: len 21 (1 Kb/s)
        Latency: 155 msec (75-172 msec ~160 msec)
> ACL Data RX: Handle 1551 flags 0x02 dlen 21              #116 [hci1] 9.961270
      SMP: Pairing Random (0x04) len 16
        Random value: 4dfb581382a8c5640000000000000000
< HCI Command: Host Number of Comp.. (0x03|0x0035) plen 5  #117 [hci1] 9.965504
        Num handles: 1
        Handle: 1551 Address: DF:A9:FF:F6:B1:1A (OUI DF-A9-FF)
        Count: 1
< ACL Data TX: Handle 1551 flags 0x00 dlen 21              #118 [hci1] 9.965553
      SMP: Pairing Random (0x04) len 16
        Random value: dddbdfe2838e9a8cc6964353c850fef7
> HCI Event: Number of Completed Packets (0x13) plen 5    #119 [hci1] 10.135666
        Num handles: 1
        Handle: 1551 Address: DF:A9:FF:F6:B1:1A (OUI DF-A9-FF)
        Count: 1
        #118: len 21 (0 Kb/s)
        Latency: 170 msec (75-172 msec ~165 msec)
> ACL Data RX: Handle 1551 flags 0x02 dlen 21             #120 [hci1] 10.223544
      SMP: Pairing Confirm (0x03) len 16
        Confim value: f7fd85d90460550e214d427722c7805a
< HCI Command: Host Number of Com.. (0x03|0x0035) plen 5  #121 [hci1] 10.225297
        Num handles: 1
        Handle: 1551 Address: DF:A9:FF:F6:B1:1A (OUI DF-A9-FF)
        Count: 1
< ACL Data TX: Handle 1551 flags 0x00 dlen 21             #122 [hci1] 10.225386
      SMP: Pairing Confirm (0x03) len 16
        Confim value: 2dda23294b3409841bd6dfa16a8210b6
> HCI Event: Number of Completed Packets (0x13) plen 5    #123 [hci1] 10.398409
        Num handles: 1
        Handle: 1551 Address: DF:A9:FF:F6:B1:1A (OUI DF-A9-FF)
        Count: 1
        #122: len 21 (0 Kb/s)
        Latency: 173 msec (75-173 msec ~169 msec)
> ACL Data RX: Handle 1551 flags 0x02 dlen 21             #124 [hci1] 10.398661
      SMP: Pairing Random (0x04) len 16
        Random value: 5c2eec43f49ec9500000000000000000
< HCI Command: Host Number of Com.. (0x03|0x0035) plen 5  #125 [hci1] 10.405662
        Num handles: 1
        Handle: 1551 Address: DF:A9:FF:F6:B1:1A (OUI DF-A9-FF)
        Count: 1
< ACL Data TX: Handle 1551 flags 0x00 dlen 21             #126 [hci1] 10.405780
      SMP: Pairing Random (0x04) len 16
        Random value: eb9f1915536596b6fc3db1c86b2b1970
> HCI Event: Number of Completed Packets (0x13) plen 5    #127 [hci1] 10.573194
        Num handles: 1
        Handle: 1551 Address: DF:A9:FF:F6:B1:1A (OUI DF-A9-FF)
        Count: 1
        #126: len 21 (1 Kb/s)
        Latency: 167 msec (75-173 msec ~168 msec)
> ACL Data RX: Handle 1551 flags 0x02 dlen 21             #128 [hci1] 10.661019
      SMP: Pairing Confirm (0x03) len 16
        Confim value: a50649c251e84c80f12f630610541a7d
< HCI Command: Host Number of Com.. (0x03|0x0035) plen 5  #129 [hci1] 10.665308
        Num handles: 1
        Handle: 1551 Address: DF:A9:FF:F6:B1:1A (OUI DF-A9-FF)
        Count: 1
< ACL Data TX: Handle 1551 flags 0x00 dlen 21             #130 [hci1] 10.665471
      SMP: Pairing Confirm (0x03) len 16
        Confim value: b9b6b4d46dec772fe315ea8ce95ea84f
> HCI Event: Number of Completed Packets (0x13) plen 5    #131 [hci1] 10.835899
        Num handles: 1
        Handle: 1551 Address: DF:A9:FF:F6:B1:1A (OUI DF-A9-FF)
        Count: 1
        #130: len 21 (0 Kb/s)
        Latency: 170 msec (75-173 msec ~169 msec)
> ACL Data RX: Handle 1551 flags 0x02 dlen 21             #132 [hci1] 10.836171
      SMP: Pairing Random (0x04) len 16
        Random value: 63afeffba88dba820000000000000000
< HCI Command: Host Number of Com.. (0x03|0x0035) plen 5  #133 [hci1] 10.845542
        Num handles: 1
        Handle: 1551 Address: DF:A9:FF:F6:B1:1A (OUI DF-A9-FF)
        Count: 1
< ACL Data TX: Handle 1551 flags 0x00 dlen 21             #134 [hci1] 10.845596
      SMP: Pairing Random (0x04) len 16
        Random value: 5c794dc9ad9f2c3f295ebd5ad5e1c3cf
> HCI Event: Number of Completed Packets (0x13) plen 5    #135 [hci1] 11.010652
        Num handles: 1
        Handle: 1551 Address: DF:A9:FF:F6:B1:1A (OUI DF-A9-FF)
        Count: 1
        #134: len 21 (1 Kb/s)
        Latency: 165 msec (75-173 msec ~167 msec)
> ACL Data RX: Handle 1551 flags 0x02 dlen 21             #136 [hci1] 11.098526
      SMP: Pairing Confirm (0x03) len 16
        Confim value: 3703af257b53741b139ef16c9333ef67
< HCI Command: Host Number of Com.. (0x03|0x0035) plen 5  #137 [hci1] 11.105290
        Num handles: 1
        Handle: 1551 Address: DF:A9:FF:F6:B1:1A (OUI DF-A9-FF)
        Count: 1
< ACL Data TX: Handle 1551 flags 0x00 dlen 21             #138 [hci1] 11.105312
      SMP: Pairing Confirm (0x03) len 16
        Confim value: 6e0dcee70b0618894eabc8683fa21b84
> HCI Event: Number of Completed Packets (0x13) plen 5    #139 [hci1] 11.273401
        Num handles: 1
        Handle: 1551 Address: DF:A9:FF:F6:B1:1A (OUI DF-A9-FF)
        Count: 1
        #138: len 21 (1 Kb/s)
        Latency: 168 msec (75-173 msec ~167 msec)
> ACL Data RX: Handle 1551 flags 0x02 dlen 21             #140 [hci1] 11.273719
      SMP: Pairing Random (0x04) len 16
        Random value: e1db26f999a074fc0000000000000000
< HCI Command: Host Number of Com.. (0x03|0x0035) plen 5  #141 [hci1] 11.285552
        Num handles: 1
        Handle: 1551 Address: DF:A9:FF:F6:B1:1A (OUI DF-A9-FF)
        Count: 1
< ACL Data TX: Handle 1551 flags 0x00 dlen 21             #142 [hci1] 11.285637
      SMP: Pairing Random (0x04) len 16
        Random value: 5c2fff312cdf99c9491988e877355a9a
> HCI Event: Number of Completed Packets (0x13) plen 5    #143 [hci1] 11.448137
        Num handles: 1
        Handle: 1551 Address: DF:A9:FF:F6:B1:1A (OUI DF-A9-FF)
        Count: 1
        #142: len 21 (1 Kb/s)
        Latency: 162 msec (75-173 msec ~165 msec)
> ACL Data RX: Handle 1551 flags 0x02 dlen 21             #144 [hci1] 11.536043
      SMP: Pairing Confirm (0x03) len 16
        Confim value: 4229527ace35145f77bd1257cfc6e589
< HCI Command: Host Number of Com.. (0x03|0x0035) plen 5  #145 [hci1] 11.545330
        Num handles: 1
        Handle: 1551 Address: DF:A9:FF:F6:B1:1A (OUI DF-A9-FF)
        Count: 1
< ACL Data TX: Handle 1551 flags 0x00 dlen 21             #146 [hci1] 11.545442
      SMP: Pairing Confirm (0x03) len 16
        Confim value: 67a2f53bc71d89c11ed190718bafc89d
> HCI Event: Number of Completed Packets (0x13) plen 5    #147 [hci1] 11.710872
        Num handles: 1
        Handle: 1551 Address: DF:A9:FF:F6:B1:1A (OUI DF-A9-FF)
        Count: 1
        #146: len 21 (1 Kb/s)
        Latency: 165 msec (75-173 msec ~165 msec)
> ACL Data RX: Handle 1551 flags 0x02 dlen 21             #148 [hci1] 11.711189
      SMP: Pairing Random (0x04) len 16
        Random value: 9a91cbf7b4265c170000000000000000
< HCI Command: Host Number of Com.. (0x03|0x0035) plen 5  #149 [hci1] 11.725456
        Num handles: 1
        Handle: 1551 Address: DF:A9:FF:F6:B1:1A (OUI DF-A9-FF)
        Count: 1
< ACL Data TX: Handle 1551 flags 0x00 dlen 21             #150 [hci1] 11.725506
      SMP: Pairing Random (0x04) len 16
        Random value: c629a3a987d808e808655d558dfc1155
> HCI Event: Number of Completed Packets (0x13) plen 5    #151 [hci1] 11.885718
        Num handles: 1
        Handle: 1551 Address: DF:A9:FF:F6:B1:1A (OUI DF-A9-FF)
        Count: 1
        #150: len 21 (1 Kb/s)
        Latency: 160 msec (75-173 msec ~162 msec)
> ACL Data RX: Handle 1551 flags 0x02 dlen 21             #152 [hci1] 11.973514
      SMP: Pairing Confirm (0x03) len 16
        Confim value: 297e200f948e272139b3a189cbed3dec
< HCI Command: Host Number of Com.. (0x03|0x0035) plen 5  #153 [hci1] 11.985212
        Num handles: 1
        Handle: 1551 Address: DF:A9:FF:F6:B1:1A (OUI DF-A9-FF)
        Count: 1
< ACL Data TX: Handle 1551 flags 0x00 dlen 21             #154 [hci1] 11.985229
      SMP: Pairing Confirm (0x03) len 16
        Confim value: b6ed14215e4aa3bc407a6ae0be6cbe02
> HCI Event: Number of Completed Packets (0x13) plen 5    #155 [hci1] 12.148405
        Num handles: 1
        Handle: 1551 Address: DF:A9:FF:F6:B1:1A (OUI DF-A9-FF)
        Count: 1
        #154: len 21 (1 Kb/s)
        Latency: 163 msec (75-173 msec ~162 msec)
> ACL Data RX: Handle 1551 flags 0x02 dlen 21             #156 [hci1] 12.148804
      SMP: Pairing Random (0x04) len 16
        Random value: 45ca186c5897febb0000000000000000
< HCI Command: Host Number of Com.. (0x03|0x0035) plen 5  #157 [hci1] 12.165543
        Num handles: 1
        Handle: 1551 Address: DF:A9:FF:F6:B1:1A (OUI DF-A9-FF)
        Count: 1
< ACL Data TX: Handle 1551 flags 0x00 dlen 21             #158 [hci1] 12.165635
      SMP: Pairing Random (0x04) len 16
        Random value: 92f20f6ad8f13724432c7fd6001c45ff
> HCI Event: Number of Completed Packets (0x13) plen 5    #159 [hci1] 12.323358
        Num handles: 1
        Handle: 1551 Address: DF:A9:FF:F6:B1:1A (OUI DF-A9-FF)
        Count: 1
        #158: len 21 (1 Kb/s)
        Latency: 157 msec (75-173 msec ~160 msec)
> ACL Data RX: Handle 1551 flags 0x02 dlen 21             #160 [hci1] 12.323717
      SMP: Pairing Confirm (0x03) len 16
        Confim value: 9107b554dfa8aa11779f61a68bd224aa
< HCI Command: Host Number of Com.. (0x03|0x0035) plen 5  #161 [hci1] 12.324996
        Num handles: 1
        Handle: 1551 Address: DF:A9:FF:F6:B1:1A (OUI DF-A9-FF)
        Count: 1
< ACL Data TX: Handle 1551 flags 0x00 dlen 21             #162 [hci1] 12.325005
      SMP: Pairing Confirm (0x03) len 16
        Confim value: d4abbfb5260862bcf365aa789b5cf563
> HCI Event: Number of Completed Packets (0x13) plen 5    #163 [hci1] 12.498294
        Num handles: 1
        Handle: 1551 Address: DF:A9:FF:F6:B1:1A (OUI DF-A9-FF)
        Count: 1
        #162: len 21 (0 Kb/s)
        Latency: 173 msec (75-173 msec ~166 msec)
> ACL Data RX: Handle 1551 flags 0x02 dlen 21             #164 [hci1] 12.498659
      SMP: Pairing Random (0x04) len 16
        Random value: 066d39f47aafb18f0000000000000000
< HCI Command: Host Number of Com.. (0x03|0x0035) plen 5  #165 [hci1] 12.505530
        Num handles: 1
        Handle: 1551 Address: DF:A9:FF:F6:B1:1A (OUI DF-A9-FF)
        Count: 1
< ACL Data TX: Handle 1551 flags 0x00 dlen 21             #166 [hci1] 12.505651
      SMP: Pairing Random (0x04) len 16
        Random value: 23ac32ebbb5e14c8a6b9622f296d277f
> HCI Event: Number of Completed Packets (0x13) plen 5    #167 [hci1] 12.673136
        Num handles: 1
        Handle: 1551 Address: DF:A9:FF:F6:B1:1A (OUI DF-A9-FF)
        Count: 1
        #166: len 21 (1 Kb/s)
        Latency: 167 msec (75-173 msec ~167 msec)
> ACL Data RX: Handle 1551 flags 0x02 dlen 21             #168 [hci1] 12.760939
      SMP: Pairing Confirm (0x03) len 16
        Confim value: 459f3d26125084c39b73f8d1ceccfb0a
< HCI Command: Host Number of Com.. (0x03|0x0035) plen 5  #169 [hci1] 12.765319
        Num handles: 1
        Handle: 1551 Address: DF:A9:FF:F6:B1:1A (OUI DF-A9-FF)
        Count: 1
< ACL Data TX: Handle 1551 flags 0x00 dlen 21             #170 [hci1] 12.765443
      SMP: Pairing Confirm (0x03) len 16
        Confim value: f7b3ef858da06a85c35c9b3ed68a1938
> HCI Event: Number of Completed Packets (0x13) plen 5    #171 [hci1] 12.935816
        Num handles: 1
        Handle: 1551 Address: DF:A9:FF:F6:B1:1A (OUI DF-A9-FF)
        Count: 1
        #170: len 21 (0 Kb/s)
        Latency: 170 msec (75-173 msec ~168 msec)
> ACL Data RX: Handle 1551 flags 0x02 dlen 21             #172 [hci1] 12.936186
      SMP: Pairing Random (0x04) len 16
        Random value: ec01324283a9902b0000000000000000
< HCI Command: Host Number of Com.. (0x03|0x0035) plen 5  #173 [hci1] 12.945597
        Num handles: 1
        Handle: 1551 Address: DF:A9:FF:F6:B1:1A (OUI DF-A9-FF)
        Count: 1
< ACL Data TX: Handle 1551 flags 0x00 dlen 21             #174 [hci1] 12.945727
      SMP: Pairing Random (0x04) len 16
        Random value: 297efe85e67448a15f56bd27e3a3cf1d
> HCI Event: Number of Completed Packets (0x13) plen 5    #175 [hci1] 13.110702
        Num handles: 1
        Handle: 1551 Address: DF:A9:FF:F6:B1:1A (OUI DF-A9-FF)
        Count: 1
        #174: len 21 (1 Kb/s)
        Latency: 164 msec (75-173 msec ~166 msec)
> ACL Data RX: Handle 1551 flags 0x02 dlen 21             #176 [hci1] 13.198472
      SMP: Pairing Confirm (0x03) len 16
        Confim value: a2de14350f0d5a4d5ee0d43737813903
< HCI Command: Host Number of Com.. (0x03|0x0035) plen 5  #177 [hci1] 13.205487
        Num handles: 1
        Handle: 1551 Address: DF:A9:FF:F6:B1:1A (OUI DF-A9-FF)
        Count: 1
< ACL Data TX: Handle 1551 flags 0x00 dlen 21             #178 [hci1] 13.205510
      SMP: Pairing Confirm (0x03) len 16
        Confim value: d63328fa2bd44eaf25c00fee81cff2e9
> HCI Event: Number of Completed Packets (0x13) plen 5    #179 [hci1] 13.373291
        Num handles: 1
        Handle: 1551 Address: DF:A9:FF:F6:B1:1A (OUI DF-A9-FF)
        Count: 1
        #178: len 21 (1 Kb/s)
        Latency: 167 msec (75-173 msec ~167 msec)
> ACL Data RX: Handle 1551 flags 0x02 dlen 21             #180 [hci1] 13.373620
      SMP: Pairing Random (0x04) len 16
        Random value: 8c5412822ba3f5f20000000000000000
< HCI Command: Host Number of Com.. (0x03|0x0035) plen 5  #181 [hci1] 13.385562
        Num handles: 1
        Handle: 1551 Address: DF:A9:FF:F6:B1:1A (OUI DF-A9-FF)
        Count: 1
< ACL Data TX: Handle 1551 flags 0x00 dlen 21             #182 [hci1] 13.385741
      SMP: Pairing Random (0x04) len 16
        Random value: 25a9493fd3ce4faf02be7293595bb7c6
> HCI Event: Number of Completed Packets (0x13) plen 5    #183 [hci1] 13.548104
        Num handles: 1
        Handle: 1551 Address: DF:A9:FF:F6:B1:1A (OUI DF-A9-FF)
        Count: 1
        #182: len 21 (1 Kb/s)
        Latency: 162 msec (75-173 msec ~164 msec)
> ACL Data RX: Handle 1551 flags 0x02 dlen 21             #184 [hci1] 13.635933
      SMP: Pairing Confirm (0x03) len 16
        Confim value: 32d6a3a815936aed295fac04a07bd800
< HCI Command: Host Number of Com.. (0x03|0x0035) plen 5  #185 [hci1] 13.645580
        Num handles: 1
        Handle: 1551 Address: DF:A9:FF:F6:B1:1A (OUI DF-A9-FF)
        Count: 1
< ACL Data TX: Handle 1551 flags 0x00 dlen 21             #186 [hci1] 13.645659
      SMP: Pairing Confirm (0x03) len 16
        Confim value: af2114c76fd47cf2976cf344aa5af6aa
> HCI Event: Number of Completed Packets (0x13) plen 5    #187 [hci1] 13.810930
        Num handles: 1
        Handle: 1551 Address: DF:A9:FF:F6:B1:1A (OUI DF-A9-FF)
        Count: 1
        #186: len 21 (1 Kb/s)
        Latency: 165 msec (75-173 msec ~165 msec)
> ACL Data RX: Handle 1551 flags 0x02 dlen 21             #188 [hci1] 13.811189
      SMP: Pairing Random (0x04) len 16
        Random value: 2d362a857a2b62500000000000000000
< HCI Command: Host Number of Com.. (0x03|0x0035) plen 5  #189 [hci1] 13.825498
        Num handles: 1
        Handle: 1551 Address: DF:A9:FF:F6:B1:1A (OUI DF-A9-FF)
        Count: 1
< ACL Data TX: Handle 1551 flags 0x00 dlen 21             #190 [hci1] 13.825602
      SMP: Pairing Random (0x04) len 16
        Random value: 58f6b41f855a6f6c3560debd84e2affc
> HCI Event: Number of Completed Packets (0x13) plen 5    #191 [hci1] 13.985606
        Num handles: 1
        Handle: 1551 Address: DF:A9:FF:F6:B1:1A (OUI DF-A9-FF)
        Count: 1
        #190: len 21 (1 Kb/s)
        Latency: 160 msec (75-173 msec ~162 msec)
> ACL Data RX: Handle 1551 flags 0x02 dlen 21             #192 [hci1] 14.073531
      SMP: Pairing Confirm (0x03) len 16
        Confim value: 8b1ed9240156d178be6821dc18a71015
< HCI Command: Host Number of Com.. (0x03|0x0035) plen 5  #193 [hci1] 14.085427
        Num handles: 1
        Handle: 1551 Address: DF:A9:FF:F6:B1:1A (OUI DF-A9-FF)
        Count: 1
< ACL Data TX: Handle 1551 flags 0x00 dlen 21             #194 [hci1] 14.085549
      SMP: Pairing Confirm (0x03) len 16
        Confim value: ea96e8ef5c399a1e6cca0f96e6d84dc3
> HCI Event: Number of Completed Packets (0x13) plen 5    #195 [hci1] 14.248241
        Num handles: 1
        Handle: 1551 Address: DF:A9:FF:F6:B1:1A (OUI DF-A9-FF)
        Count: 1
        #194: len 21 (1 Kb/s)
        Latency: 162 msec (75-173 msec ~162 msec)
> ACL Data RX: Handle 1551 flags 0x02 dlen 21             #196 [hci1] 14.248631
      SMP: Pairing Random (0x04) len 16
        Random value: fd811e0eed70a2450000000000000000
< HCI Command: Host Number of Com.. (0x03|0x0035) plen 5  #197 [hci1] 14.265537
        Num handles: 1
        Handle: 1551 Address: DF:A9:FF:F6:B1:1A (OUI DF-A9-FF)
        Count: 1
< ACL Data TX: Handle 1551 flags 0x00 dlen 21             #198 [hci1] 14.265616
      SMP: Pairing Random (0x04) len 16
        Random value: b67e7216d5bf664139eda2b542549666
> HCI Event: Number of Completed Packets (0x13) plen 5    #199 [hci1] 14.423086
        Num handles: 1
        Handle: 1551 Address: DF:A9:FF:F6:B1:1A (OUI DF-A9-FF)
        Count: 1
        #198: len 21 (1 Kb/s)
        Latency: 157 msec (75-173 msec ~160 msec)
> ACL Data RX: Handle 1551 flags 0x02 dlen 21             #200 [hci1] 14.510929
      SMP: Pairing Confirm (0x03) len 16
        Confim value: 94be7bb5e9318b981288afb49802dbe6
< HCI Command: Host Number of Com.. (0x03|0x0035) plen 5  #201 [hci1] 14.525421
        Num handles: 1
        Handle: 1551 Address: DF:A9:FF:F6:B1:1A (OUI DF-A9-FF)
        Count: 1
< ACL Data TX: Handle 1551 flags 0x00 dlen 21             #202 [hci1] 14.525589
      SMP: Pairing Confirm (0x03) len 16
        Confim value: f178087dc767676c428fdc998124cadf
> HCI Event: Number of Completed Packets (0x13) plen 5    #203 [hci1] 14.685824
        Num handles: 1
        Handle: 1551 Address: DF:A9:FF:F6:B1:1A (OUI DF-A9-FF)
        Count: 1
        #202: len 21 (1 Kb/s)
        Latency: 160 msec (75-173 msec ~160 msec)
> ACL Data RX: Handle 1551 flags 0x02 dlen 21             #204 [hci1] 14.686189
      SMP: Pairing Random (0x04) len 16
        Random value: cc2efa0cc500f7f80000000000000000
< HCI Command: Host Number of Com.. (0x03|0x0035) plen 5  #205 [hci1] 14.705597
        Num handles: 1
        Handle: 1551 Address: DF:A9:FF:F6:B1:1A (OUI DF-A9-FF)
        Count: 1
< ACL Data TX: Handle 1551 flags 0x00 dlen 21             #206 [hci1] 14.705674
      SMP: Pairing Random (0x04) len 16
        Random value: ed17f76500c95219dd01e09d1e63f87b
> HCI Event: Number of Completed Packets (0x13) plen 5    #207 [hci1] 14.860663
        Num handles: 1
        Handle: 1551 Address: DF:A9:FF:F6:B1:1A (OUI DF-A9-FF)
        Count: 1
        #206: len 21 (1 Kb/s)
        Latency: 154 msec (75-173 msec ~157 msec)
> ACL Data RX: Handle 1551 flags 0x02 dlen 21             #208 [hci1] 14.948522
      SMP: Pairing Confirm (0x03) len 16
        Confim value: 112327270685d1d1027e604f81576e05
< HCI Command: Host Number of Com.. (0x03|0x0035) plen 5  #209 [hci1] 14.965260
        Num handles: 1
        Handle: 1551 Address: DF:A9:FF:F6:B1:1A (OUI DF-A9-FF)
        Count: 1
< ACL Data TX: Handle 1551 flags 0x00 dlen 21             #210 [hci1] 14.965331
      SMP: Pairing Confirm (0x03) len 16
        Confim value: 99a36a5b3266129b68bfa73eded31343
> HCI Event: Number of Completed Packets (0x13) plen 5    #211 [hci1] 15.123263
        Num handles: 1
        Handle: 1551 Address: DF:A9:FF:F6:B1:1A (OUI DF-A9-FF)
        Count: 1
        #210: len 21 (1 Kb/s)
        Latency: 157 msec (75-173 msec ~157 msec)
> ACL Data RX: Handle 1551 flags 0x02 dlen 21             #212 [hci1] 15.123720
      SMP: Pairing Random (0x04) len 16
        Random value: 471c2e710e6d79700000000000000000
< HCI Command: Host Number of Com.. (0x03|0x0035) plen 5  #213 [hci1] 15.125392
        Num handles: 1
        Handle: 1551 Address: DF:A9:FF:F6:B1:1A (OUI DF-A9-FF)
        Count: 1
< ACL Data TX: Handle 1551 flags 0x00 dlen 21             #214 [hci1] 15.125575
      SMP: Pairing Random (0x04) len 16
        Random value: 81d35d47e1f6006d79c974bd9d9e1ee3
> HCI Event: Number of Completed Packets (0x13) plen 5    #215 [hci1] 15.298099
        Num handles: 1
        Handle: 1551 Address: DF:A9:FF:F6:B1:1A (OUI DF-A9-FF)
        Count: 1
        #214: len 21 (0 Kb/s)
        Latency: 172 msec (75-173 msec ~165 msec)
> ACL Data RX: Handle 1551 flags 0x02 dlen 21             #216 [hci1] 15.385934
      SMP: Pairing Confirm (0x03) len 16
        Confim value: 03c75fbf684af34d267beed6ec366226
< HCI Command: Host Number of Com.. (0x03|0x0035) plen 5  #217 [hci1] 15.405357
        Num handles: 1
        Handle: 1551 Address: DF:A9:FF:F6:B1:1A (OUI DF-A9-FF)
        Count: 1
< ACL Data TX: Handle 1551 flags 0x00 dlen 21             #218 [hci1] 15.405393
      SMP: Pairing Confirm (0x03) len 16
        Confim value: 05700b85e164ce03816240ca95432ecf
> HCI Event: Number of Completed Packets (0x13) plen 5    #219 [hci1] 15.560788
        Num handles: 1
        Handle: 1551 Address: DF:A9:FF:F6:B1:1A (OUI DF-A9-FF)
        Count: 1
        #218: len 21 (1 Kb/s)
        Latency: 155 msec (75-173 msec ~160 msec)
> ACL Data RX: Handle 1551 flags 0x02 dlen 21             #220 [hci1] 15.561174
      SMP: Pairing Random (0x04) len 16
        Random value: 11903ad82a16116f0000000000000000
< HCI Command: Host Number of Com.. (0x03|0x0035) plen 5  #221 [hci1] 15.565211
        Num handles: 1
        Handle: 1551 Address: DF:A9:FF:F6:B1:1A (OUI DF-A9-FF)
        Count: 1
< ACL Data TX: Handle 1551 flags 0x00 dlen 21             #222 [hci1] 15.565254
      SMP: Pairing Random (0x04) len 16
        Random value: e7f7e0c2476823e41736a7e381bafb7c
> HCI Event: Number of Completed Packets (0x13) plen 5    #223 [hci1] 15.735612
        Num handles: 1
        Handle: 1551 Address: DF:A9:FF:F6:B1:1A (OUI DF-A9-FF)
        Count: 1
        #222: len 21 (0 Kb/s)
        Latency: 170 msec (75-173 msec ~165 msec)
> ACL Data RX: Handle 1551 flags 0x02 dlen 21             #224 [hci1] 15.823552
      SMP: Pairing Confirm (0x03) len 16
        Confim value: 62f1bda403cba7aa225ba4df6b35baff
< HCI Command: Host Number of Com.. (0x03|0x0035) plen 5  #225 [hci1] 15.825428
        Num handles: 1
        Handle: 1551 Address: DF:A9:FF:F6:B1:1A (OUI DF-A9-FF)
        Count: 1
< ACL Data TX: Handle 1551 flags 0x00 dlen 21             #226 [hci1] 15.825592
      SMP: Pairing Confirm (0x03) len 16
        Confim value: 4b26eeecda9ffa92a7991ea42f3db22d
> HCI Event: Number of Completed Packets (0x13) plen 5    #227 [hci1] 15.998360
        Num handles: 1
        Handle: 1551 Address: DF:A9:FF:F6:B1:1A (OUI DF-A9-FF)
        Count: 1
        #226: len 21 (0 Kb/s)
        Latency: 172 msec (75-173 msec ~169 msec)
> ACL Data RX: Handle 1551 flags 0x02 dlen 21             #228 [hci1] 15.998665
      SMP: Pairing Random (0x04) len 16
        Random value: 074605d5a2295fcf0000000000000000
< HCI Command: Host Number of Com.. (0x03|0x0035) plen 5  #229 [hci1] 16.005497
        Num handles: 1
        Handle: 1551 Address: DF:A9:FF:F6:B1:1A (OUI DF-A9-FF)
        Count: 1
< ACL Data TX: Handle 1551 flags 0x00 dlen 21             #230 [hci1] 16.005567
      SMP: Pairing Random (0x04) len 16
        Random value: fc8b40d9b0b09bc4296bf8753a8f6e1f
> HCI Event: Number of Completed Packets (0x13) plen 5    #231 [hci1] 16.173085
        Num handles: 1
        Handle: 1551 Address: DF:A9:FF:F6:B1:1A (OUI DF-A9-FF)
        Count: 1
        #230: len 21 (1 Kb/s)
        Latency: 167 msec (75-173 msec ~168 msec)
> ACL Data RX: Handle 1551 flags 0x02 dlen 21             #232 [hci1] 16.348488
      SMP: Pairing DHKey Check (0x0d) len 16
        E: 83e037befcd5fd44cb69cf22ab3105f8
< HCI Command: Host Number of Com.. (0x03|0x0035) plen 5  #233 [hci1] 16.365698
        Num handles: 1
        Handle: 1551 Address: DF:A9:FF:F6:B1:1A (OUI DF-A9-FF)
        Count: 1
< ACL Data TX: Handle 1551 flags 0x00 dlen 21             #234 [hci1] 16.365743
      SMP: Pairing DHKey Check (0x0d) len 16
        E: 2e04afcf2fb8d4e1a2b2f9fbdbc038ae
> HCI Event: Number of Completed Packets (0x13) plen 5    #235 [hci1] 16.523144
        Num handles: 1
        Handle: 1551 Address: DF:A9:FF:F6:B1:1A (OUI DF-A9-FF)
        Count: 1
        #234: len 21 (1 Kb/s)
        Latency: 157 msec (75-173 msec ~162 msec)
> HCI Event: LE Meta Event (0x3e) plen 13                 #236 [hci1] 16.611100
      LE Long Term Key Request (0x05)
        Handle: 1551 Address: DF:A9:FF:F6:B1:1A (OUI DF-A9-FF)
        Random number: 0x0000000000000000
        Encrypted diversifier: 0x0000
< HCI Command: LE Long Term Key... (0x08|0x001a) plen 18  #237 [hci1] 16.625268
        Handle: 1551 Address: DF:A9:FF:F6:B1:1A (OUI DF-A9-FF)
        Long term key: 2edab43ab9edd9d7bde9ae09f0f8afa3
> HCI Event: Command Complete (0x0e) plen 6               #238 [hci1] 16.625948
      LE Long Term Key Request Reply (0x08|0x001a) ncmd 1
        Status: Success (0x00)
        Handle: 1551 Address: DF:A9:FF:F6:B1:1A (OUI DF-A9-FF)
> HCI Event: Encryption Change (0x08) plen 4              #239 [hci1] 17.048390
        Status: Success (0x00)
        Handle: 1551 Address: DF:A9:FF:F6:B1:1A (OUI DF-A9-FF)
        Encryption: Enabled with AES-CCM (0x01)
> ACL Data RX: Handle 1551 flags 0x02 dlen 21             #240 [hci1] 17.136004
      SMP: Identity Information (0x08) len 16
        Identity resolving key: 593238a64d31eeaff33e08d850da59ba
< HCI Command: Host Number of Com.. (0x03|0x0035) plen 5  #241 [hci1] 17.175090
        Num handles: 1
        Handle: 1551 Address: DF:A9:FF:F6:B1:1A (OUI DF-A9-FF)
        Count: 1
> ACL Data RX: Handle 1551 flags 0x02 dlen 12             #242 [hci1] 17.310903
      SMP: Identity Address Information (0x09) len 7
        Address: DF:A9:FF:F6:B1:1A (OUI DF-A9-FF)
< HCI Command: LE Add Device To... (0x08|0x0027) plen 39  #243 [hci1] 17.325414
        Address type: Public (0x00)
        Address: DF:A9:FF:F6:B1:1A (OUI DF-A9-FF)
        Peer identity resolving key: 593238a64d31eeaff33e08d850da59ba
        Local identity resolving key: 00000000000000000000000000000000
> HCI Event: Command Complete (0x0e) plen 4               #244 [hci1] 17.326478
      LE Add Device To Resolving List (0x08|0x0027) ncmd 1
        Status: Success (0x00)
< HCI Command: LE Set Privacy Mode (0x08|0x004e) plen 8   #245 [hci1] 17.345236
        Peer Identity address type: Public (0x00)
        Peer Identity address: DF:A9:FF:F6:B1:1A (OUI DF-A9-FF)
        Privacy Mode: Use Device Privacy (0x01)
> HCI Event: Command Complete (0x0e) plen 4               #246 [hci1] 17.345783
      LE Set Privacy Mode (0x08|0x004e) ncmd 1
        Status: Success (0x00)
< HCI Command: LE Set Address Res.. (0x08|0x002d) plen 1  #247 [hci1] 17.365228
        Address resolution: Enabled (0x01)
> HCI Event: Command Complete (0x0e) plen 4               #248 [hci1] 17.365710
      LE Set Address Resolution Enable (0x08|0x002d) ncmd 1
        Status: Success (0x00)
< HCI Command: Host Number of Com.. (0x03|0x0035) plen 5  #249 [hci1] 17.385118
        Num handles: 1
        Handle: 1551 Address: DF:A9:FF:F6:B1:1A (OUI DF-A9-FF)
        Count: 1
> ACL Data RX: Handle 1551 flags 0x02 dlen 13             #250 [hci1] 17.398243
      ATT: Find By Type Value Request (0x06) len 8
        Handle range: 0x0001-0xffff
        Attribute type: Primary Service (0x2800)
          UUID: Generic Telephony Bearer (0x184c)
< HCI Command: Host Number of Com.. (0x03|0x0035) plen 5  #251 [hci1] 17.405592
        Num handles: 1
        Handle: 1551 Address: DF:A9:FF:F6:B1:1A (OUI DF-A9-FF)
        Count: 1
< ACL Data TX: Handle 1551 flags 0x00 dlen 9              #252 [hci1] 17.405710
      ATT: Find By Type Value Response (0x07) len 4
        Handle range: 0x0024-0x0050
> HCI Event: Number of Completed Packets (0x13) plen 5    #253 [hci1] 17.573243
        Num handles: 1
        Handle: 1551 Address: DF:A9:FF:F6:B1:1A (OUI DF-A9-FF)
        Count: 1
        #252: len 9 (0 Kb/s)
        Latency: 167 msec (75-173 msec ~165 msec)
> ACL Data RX: Handle 1551 flags 0x02 dlen 13             #254 [hci1] 17.573521
      ATT: Find By Type Value Request (0x06) len 8
        Handle range: 0x0051-0xffff
        Attribute type: Primary Service (0x2800)
          UUID: Generic Telephony Bearer (0x184c)
< HCI Command: Host Number of Com.. (0x03|0x0035) plen 5  #255 [hci1] 17.585483
        Num handles: 1
        Handle: 1551 Address: DF:A9:FF:F6:B1:1A (OUI DF-A9-FF)
        Count: 1
< ACL Data TX: Handle 1551 flags 0x00 dlen 9              #256 [hci1] 17.585615
      ATT: Error Response (0x01) len 4
        Find By Type Value Request (0x06)
        Handle: 0x0051
        Error: Attribute Not Found (0x0a)
> HCI Event: Number of Completed Packets (0x13) plen 5    #257 [hci1] 17.748204
        Num handles: 1
        Handle: 1551 Address: DF:A9:FF:F6:B1:1A (OUI DF-A9-FF)
        Count: 1
        #256: len 9 (0 Kb/s)
        Latency: 162 msec (75-173 msec ~163 msec)
> ACL Data RX: Handle 1551 flags 0x02 dlen 11             #258 [hci1] 17.748471
      ATT: Read By Type Request (0x08) len 6
        Handle range: 0x0024-0x0050
        Attribute type: Characteristic (0x2803)
< HCI Command: Host Number of Com.. (0x03|0x0035) plen 5  #259 [hci1] 17.765549
        Num handles: 1
        Handle: 1551 Address: DF:A9:FF:F6:B1:1A (OUI DF-A9-FF)
        Count: 1
< ACL Data TX: Handle 1551 flags 0x00 dlen 20             #260 [hci1] 17.765653
      ATT: Read By Type Response (0x09) len 15
        Attribute data length: 7
        Attribute data list: 2 entries
        Handle: 0x0025
        Value: 122600b32b
            Properties: 0x12
              Read (0x02)
              Notify (0x10)
            Value Handle: 0x0026
            Value UUID: Bearer Provider Name (0x2bb3)
        Handle: 0x0028
        Value: 022900b42b
            Properties: 0x02
              Read (0x02)
            Value Handle: 0x0029
            Value UUID: Bearer UCI (0x2bb4)
> HCI Event: Number of Completed Packets (0x13) plen 5    #261 [hci1] 17.923166
        Num handles: 1
        Handle: 1551 Address: DF:A9:FF:F6:B1:1A (OUI DF-A9-FF)
        Count: 1
        #260: len 20 (1 Kb/s)
        Latency: 157 msec (75-173 msec ~160 msec)
> ACL Data RX: Handle 1551 flags 0x02 dlen 11             #262 [hci1] 17.923501
      ATT: Read By Type Request (0x08) len 6
        Handle range: 0x0029-0x0050
        Attribute type: Characteristic (0x2803)
< HCI Command: Host Number of Com.. (0x03|0x0035) plen 5  #263 [hci1] 17.925451
        Num handles: 1
        Handle: 1551 Address: DF:A9:FF:F6:B1:1A (OUI DF-A9-FF)
        Count: 1
< ACL Data TX: Handle 1551 flags 0x00 dlen 20             #264 [hci1] 17.925521
      ATT: Read By Type Response (0x09) len 15
        Attribute data length: 7
        Attribute data list: 2 entries
        Handle: 0x002a
        Value: 122b00b52b
            Properties: 0x12
              Read (0x02)
              Notify (0x10)
            Value Handle: 0x002b
            Value UUID: Bearer Technology (0x2bb5)
        Handle: 0x002d
        Value: 122e00b62b
            Properties: 0x12
              Read (0x02)
              Notify (0x10)
            Value Handle: 0x002e
            Value UUID: Bearer URI Schemes Supported List (0x2bb6)
> HCI Event: Number of Completed Packets (0x13) plen 5    #265 [hci1] 18.098172
        Num handles: 1
        Handle: 1551 Address: DF:A9:FF:F6:B1:1A (OUI DF-A9-FF)
        Count: 1
        #264: len 20 (0 Kb/s)
        Latency: 172 msec (75-173 msec ~166 msec)
> ACL Data RX: Handle 1551 flags 0x02 dlen 11             #266 [hci1] 18.098391
      ATT: Read By Type Request (0x08) len 6
        Handle range: 0x002e-0x0050
        Attribute type: Characteristic (0x2803)
< HCI Command: Host Number of Com.. (0x03|0x0035) plen 5  #267 [hci1] 18.105536
        Num handles: 1
        Handle: 1551 Address: DF:A9:FF:F6:B1:1A (OUI DF-A9-FF)
        Count: 1
< ACL Data TX: Handle 1551 flags 0x00 dlen 20             #268 [hci1] 18.105611
      ATT: Read By Type Response (0x09) len 15
        Attribute data length: 7
        Attribute data list: 2 entries
        Handle: 0x0030
        Value: 123100b72b
            Properties: 0x12
              Read (0x02)
              Notify (0x10)
            Value Handle: 0x0031
            Value UUID: Bearer Signal Strength (0x2bb7)
        Handle: 0x0033
        Value: 0e3400b82b
            Properties: 0x0e
              Read (0x02)
              Write Without Response (0x04)
              Write (0x08)
            Value Handle: 0x0034
            Value UUID: Bearer Signal Strength Reporting Interval (0x2bb8)
> HCI Event: Number of Completed Packets (0x13) plen 5    #269 [hci1] 18.273219
        Num handles: 1
        Handle: 1551 Address: DF:A9:FF:F6:B1:1A (OUI DF-A9-FF)
        Count: 1
        #268: len 20 (0 Kb/s)
        Latency: 167 msec (75-173 msec ~167 msec)
> ACL Data RX: Handle 1551 flags 0x02 dlen 11             #270 [hci1] 18.273496
      ATT: Read By Type Request (0x08) len 6
        Handle range: 0x0034-0x0050
        Attribute type: Characteristic (0x2803)
< HCI Command: Host Number of Com.. (0x03|0x0035) plen 5  #271 [hci1] 18.285585
        Num handles: 1
        Handle: 1551 Address: DF:A9:FF:F6:B1:1A (OUI DF-A9-FF)
        Count: 1
< ACL Data TX: Handle 1551 flags 0x00 dlen 20             #272 [hci1] 18.285661
      ATT: Read By Type Response (0x09) len 15
        Attribute data length: 7
        Attribute data list: 2 entries
        Handle: 0x0035
        Value: 123600b92b
            Properties: 0x12
              Read (0x02)
              Notify (0x10)
            Value Handle: 0x0036
            Value UUID: Bearer List Current Calls (0x2bb9)
        Handle: 0x0038
        Value: 023900ba2b
            Properties: 0x02
              Read (0x02)
            Value Handle: 0x0039
            Value UUID: Content Control ID (0x2bba)
> HCI Event: Number of Completed Packets (0x13) plen 5    #273 [hci1] 18.448215
        Num handles: 1
        Handle: 1551 Address: DF:A9:FF:F6:B1:1A (OUI DF-A9-FF)
        Count: 1
        #272: len 20 (0 Kb/s)
        Latency: 162 msec (75-173 msec ~164 msec)
> ACL Data RX: Handle 1551 flags 0x02 dlen 11             #274 [hci1] 18.448532
      ATT: Read By Type Request (0x08) len 6
        Handle range: 0x0039-0x0050
        Attribute type: Characteristic (0x2803)
< HCI Command: Host Number of Com.. (0x03|0x0035) plen 5  #275 [hci1] 18.465588
        Num handles: 1
        Handle: 1551 Address: DF:A9:FF:F6:B1:1A (OUI DF-A9-FF)
        Count: 1
< ACL Data TX: Handle 1551 flags 0x00 dlen 20             #276 [hci1] 18.465662
      ATT: Read By Type Response (0x09) len 15
        Attribute data length: 7
        Attribute data list: 2 entries
        Handle: 0x003a
        Value: 123b00bb2b
            Properties: 0x12
              Read (0x02)
              Notify (0x10)
            Value Handle: 0x003b
            Value UUID: Status Flags (0x2bbb)
        Handle: 0x003d
        Value: 123e00bc2b
            Properties: 0x12
              Read (0x02)
              Notify (0x10)
            Value Handle: 0x003e
            Value UUID: Incoming Call Target Bearer URI (0x2bbc)
> HCI Event: Number of Completed Packets (0x13) plen 5    #277 [hci1] 18.623225
        Num handles: 1
        Handle: 1551 Address: DF:A9:FF:F6:B1:1A (OUI DF-A9-FF)
        Count: 1
        #276: len 20 (1 Kb/s)
        Latency: 157 msec (75-173 msec ~161 msec)
> ACL Data RX: Handle 1551 flags 0x02 dlen 11             #278 [hci1] 18.623453
      ATT: Read By Type Request (0x08) len 6
        Handle range: 0x003e-0x0050
        Attribute type: Characteristic (0x2803)
< HCI Command: Host Number of Com.. (0x03|0x0035) plen 5  #279 [hci1] 18.625623
        Num handles: 1
        Handle: 1551 Address: DF:A9:FF:F6:B1:1A (OUI DF-A9-FF)
        Count: 1
< ACL Data TX: Handle 1551 flags 0x00 dlen 20             #280 [hci1] 18.625742
      ATT: Read By Type Response (0x09) len 15
        Attribute data length: 7
        Attribute data list: 2 entries
        Handle: 0x0040
        Value: 124100bd2b
            Properties: 0x12
              Read (0x02)
              Notify (0x10)
            Value Handle: 0x0041
            Value UUID: Call State (0x2bbd)
        Handle: 0x0043
        Value: 1c4400be2b
            Properties: 0x1c
              Write Without Response (0x04)
              Write (0x08)
              Notify (0x10)
            Value Handle: 0x0044
            Value UUID: Call Control Point (0x2bbe)
> HCI Event: Number of Completed Packets (0x13) plen 5    #281 [hci1] 18.798187
        Num handles: 1
        Handle: 1551 Address: DF:A9:FF:F6:B1:1A (OUI DF-A9-FF)
        Count: 1
        #280: len 20 (0 Kb/s)
        Latency: 172 msec (75-173 msec ~166 msec)
> ACL Data RX: Handle 1551 flags 0x02 dlen 11             #282 [hci1] 18.798401
      ATT: Read By Type Request (0x08) len 6
        Handle range: 0x0044-0x0050
        Attribute type: Characteristic (0x2803)
< HCI Command: Host Number of Com.. (0x03|0x0035) plen 5  #283 [hci1] 18.805536
        Num handles: 1
        Handle: 1551 Address: DF:A9:FF:F6:B1:1A (OUI DF-A9-FF)
        Count: 1
< ACL Data TX: Handle 1551 flags 0x00 dlen 20             #284 [hci1] 18.805692
      ATT: Read By Type Response (0x09) len 15
        Attribute data length: 7
        Attribute data list: 2 entries
        Handle: 0x0046
        Value: 024700bf2b
            Properties: 0x02
              Read (0x02)
            Value Handle: 0x0047
            Value UUID: Call Control Point Optional Opcodes (0x2bbf)
        Handle: 0x0048
        Value: 104900c02b
            Properties: 0x10
              Notify (0x10)
            Value Handle: 0x0049
            Value UUID: Termination Reason (0x2bc0)
> HCI Event: Number of Completed Packets (0x13) plen 5    #285 [hci1] 18.973145
        Num handles: 1
        Handle: 1551 Address: DF:A9:FF:F6:B1:1A (OUI DF-A9-FF)
        Count: 1
        #284: len 20 (0 Kb/s)
        Latency: 167 msec (75-173 msec ~167 msec)
> ACL Data RX: Handle 1551 flags 0x02 dlen 11             #286 [hci1] 18.973560
      ATT: Read By Type Request (0x08) len 6
        Handle range: 0x0049-0x0050
        Attribute type: Characteristic (0x2803)
< HCI Command: Host Number of Com.. (0x03|0x0035) plen 5  #287 [hci1] 18.985201
        Num handles: 1
        Handle: 1551 Address: DF:A9:FF:F6:B1:1A (OUI DF-A9-FF)
        Count: 1
< ACL Data TX: Handle 1551 flags 0x00 dlen 20             #288 [hci1] 18.985229
      ATT: Read By Type Response (0x09) len 15
        Attribute data length: 7
        Attribute data list: 2 entries
        Handle: 0x004b
        Value: 124c00c12b
            Properties: 0x12
              Read (0x02)
              Notify (0x10)
            Value Handle: 0x004c
            Value UUID: Incoming Call (0x2bc1)
        Handle: 0x004e
        Value: 124f00c22b
            Properties: 0x12
              Read (0x02)
              Notify (0x10)
            Value Handle: 0x004f
            Value UUID: Call Friendly Name (0x2bc2)
> HCI Event: Number of Completed Packets (0x13) plen 5    #289 [hci1] 19.148196
        Num handles: 1
        Handle: 1551 Address: DF:A9:FF:F6:B1:1A (OUI DF-A9-FF)
        Count: 1
        #288: len 20 (0 Kb/s)
        Latency: 162 msec (75-173 msec ~165 msec)
> ACL Data RX: Handle 1551 flags 0x02 dlen 11             #290 [hci1] 19.148491
      ATT: Read By Type Request (0x08) len 6
        Handle range: 0x004f-0x0050
        Attribute type: Characteristic (0x2803)
< HCI Command: Host Number of Com.. (0x03|0x0035) plen 5  #291 [hci1] 19.165582
        Num handles: 1
        Handle: 1551 Address: DF:A9:FF:F6:B1:1A (OUI DF-A9-FF)
        Count: 1
< ACL Data TX: Handle 1551 flags 0x00 dlen 9              #292 [hci1] 19.165763
      ATT: Error Response (0x01) len 4
        Read By Type Request (0x08)
        Handle: 0x004f
        Error: Attribute Not Found (0x0a)
> HCI Event: Number of Completed Packets (0x13) plen 5    #293 [hci1] 19.323253
        Num handles: 1
        Handle: 1551 Address: DF:A9:FF:F6:B1:1A (OUI DF-A9-FF)
        Count: 1
        #292: len 9 (0 Kb/s)
        Latency: 157 msec (75-173 msec ~161 msec)
> ACL Data RX: Handle 1551 flags 0x02 dlen 9              #294 [hci1] 19.323431
      ATT: Find Information Request (0x04) len 4
        Handle range: 0x0027-0x0027
< HCI Command: Host Number of Com.. (0x03|0x0035) plen 5  #295 [hci1] 19.325525
        Num handles: 1
        Handle: 1551 Address: DF:A9:FF:F6:B1:1A (OUI DF-A9-FF)
        Count: 1
< ACL Data TX: Handle 1551 flags 0x00 dlen 10             #296 [hci1] 19.325627
      ATT: Find Information Response (0x05) len 5
        Format: UUID-16 (0x01)
        Handle: 0x0027
        UUID: Client Characteristic Configuration (0x2902)
> HCI Event: Number of Completed Packets (0x13) plen 5    #297 [hci1] 19.498184
        Num handles: 1
        Handle: 1551 Address: DF:A9:FF:F6:B1:1A (OUI DF-A9-FF)
        Count: 1
        #296: len 10 (0 Kb/s)
        Latency: 172 msec (75-173 msec ~166 msec)
> ACL Data RX: Handle 1551 flags 0x02 dlen 9              #298 [hci1] 19.498444
      ATT: Find Information Request (0x04) len 4
        Handle range: 0x002c-0x002c
< HCI Command: Host Number of Com.. (0x03|0x0035) plen 5  #299 [hci1] 19.505406
        Num handles: 1
        Handle: 1551 Address: DF:A9:FF:F6:B1:1A (OUI DF-A9-FF)
        Count: 1
< ACL Data TX: Handle 1551 flags 0x00 dlen 10             #300 [hci1] 19.505581
      ATT: Find Information Response (0x05) len 5
        Format: UUID-16 (0x01)
        Handle: 0x002c
        UUID: Client Characteristic Configuration (0x2902)
> HCI Event: Number of Completed Packets (0x13) plen 5    #301 [hci1] 19.673147
        Num handles: 1
        Handle: 1551 Address: DF:A9:FF:F6:B1:1A (OUI DF-A9-FF)
        Count: 1
        #300: len 10 (0 Kb/s)
        Latency: 167 msec (75-173 msec ~167 msec)
> ACL Data RX: Handle 1551 flags 0x02 dlen 9              #302 [hci1] 19.673422
      ATT: Find Information Request (0x04) len 4
        Handle range: 0x002f-0x002f
< HCI Command: Host Number of Com.. (0x03|0x0035) plen 5  #303 [hci1] 19.685525
        Num handles: 1
        Handle: 1551 Address: DF:A9:FF:F6:B1:1A (OUI DF-A9-FF)
        Count: 1
< ACL Data TX: Handle 1551 flags 0x00 dlen 10             #304 [hci1] 19.685574
      ATT: Find Information Response (0x05) len 5
        Format: UUID-16 (0x01)
        Handle: 0x002f
        UUID: Client Characteristic Configuration (0x2902)
> HCI Event: Number of Completed Packets (0x13) plen 5    #305 [hci1] 19.848162
        Num handles: 1
        Handle: 1551 Address: DF:A9:FF:F6:B1:1A (OUI DF-A9-FF)
        Count: 1
        #304: len 10 (0 Kb/s)
        Latency: 162 msec (75-173 msec ~164 msec)
> ACL Data RX: Handle 1551 flags 0x02 dlen 9              #306 [hci1] 19.848511
      ATT: Find Information Request (0x04) len 4
        Handle range: 0x0032-0x0032
< HCI Command: Host Number of Com.. (0x03|0x0035) plen 5  #307 [hci1] 19.865531
        Num handles: 1
        Handle: 1551 Address: DF:A9:FF:F6:B1:1A (OUI DF-A9-FF)
        Count: 1
< ACL Data TX: Handle 1551 flags 0x00 dlen 10             #308 [hci1] 19.865680
      ATT: Find Information Response (0x05) len 5
        Format: UUID-16 (0x01)
        Handle: 0x0032
        UUID: Client Characteristic Configuration (0x2902)
> HCI Event: Number of Completed Packets (0x13) plen 5    #309 [hci1] 20.023226
        Num handles: 1
        Handle: 1551 Address: DF:A9:FF:F6:B1:1A (OUI DF-A9-FF)
        Count: 1
        #308: len 10 (0 Kb/s)
        Latency: 157 msec (75-173 msec ~161 msec)
> ACL Data RX: Handle 1551 flags 0x02 dlen 9              #310 [hci1] 20.023395
      ATT: Find Information Request (0x04) len 4
        Handle range: 0x0037-0x0037
< HCI Command: Host Number of Com.. (0x03|0x0035) plen 5  #311 [hci1] 20.025472
        Num handles: 1
        Handle: 1551 Address: DF:A9:FF:F6:B1:1A (OUI DF-A9-FF)
        Count: 1
< ACL Data TX: Handle 1551 flags 0x00 dlen 10             #312 [hci1] 20.025572
      ATT: Find Information Response (0x05) len 5
        Format: UUID-16 (0x01)
        Handle: 0x0037
        UUID: Client Characteristic Configuration (0x2902)
> HCI Event: Number of Completed Packets (0x13) plen 5    #313 [hci1] 20.198135
        Num handles: 1
        Handle: 1551 Address: DF:A9:FF:F6:B1:1A (OUI DF-A9-FF)
        Count: 1
        #312: len 10 (0 Kb/s)
        Latency: 172 msec (75-173 msec ~166 msec)
> ACL Data RX: Handle 1551 flags 0x02 dlen 9              #314 [hci1] 20.198306
      ATT: Find Information Request (0x04) len 4
        Handle range: 0x003c-0x003c
< HCI Command: Host Number of Com.. (0x03|0x0035) plen 5  #315 [hci1] 20.205276
        Num handles: 1
        Handle: 1551 Address: DF:A9:FF:F6:B1:1A (OUI DF-A9-FF)
        Count: 1
< ACL Data TX: Handle 1551 flags 0x00 dlen 10             #316 [hci1] 20.205324
      ATT: Find Information Response (0x05) len 5
        Format: UUID-16 (0x01)
        Handle: 0x003c
        UUID: Client Characteristic Configuration (0x2902)
> HCI Event: Number of Completed Packets (0x13) plen 5    #317 [hci1] 20.373168
        Num handles: 1
        Handle: 1551 Address: DF:A9:FF:F6:B1:1A (OUI DF-A9-FF)
        Count: 1
        #316: len 10 (0 Kb/s)
        Latency: 167 msec (75-173 msec ~167 msec)
> ACL Data RX: Handle 1551 flags 0x02 dlen 9              #318 [hci1] 20.373348
      ATT: Find Information Request (0x04) len 4
        Handle range: 0x003f-0x003f
< HCI Command: Host Number of Com.. (0x03|0x0035) plen 5  #319 [hci1] 20.385515
        Num handles: 1
        Handle: 1551 Address: DF:A9:FF:F6:B1:1A (OUI DF-A9-FF)
        Count: 1
< ACL Data TX: Handle 1551 flags 0x00 dlen 10             #320 [hci1] 20.385669
      ATT: Find Information Response (0x05) len 5
        Format: UUID-16 (0x01)
        Handle: 0x003f
        UUID: Client Characteristic Configuration (0x2902)
> HCI Event: Number of Completed Packets (0x13) plen 5    #321 [hci1] 20.548188
        Num handles: 1
        Handle: 1551 Address: DF:A9:FF:F6:B1:1A (OUI DF-A9-FF)
        Count: 1
        #320: len 10 (0 Kb/s)
        Latency: 162 msec (75-173 msec ~164 msec)
> ACL Data RX: Handle 1551 flags 0x02 dlen 9              #322 [hci1] 20.548291
      ATT: Find Information Request (0x04) len 4
        Handle range: 0x0042-0x0042
< HCI Command: Host Number of Com.. (0x03|0x0035) plen 5  #323 [hci1] 20.565469
        Num handles: 1
        Handle: 1551 Address: DF:A9:FF:F6:B1:1A (OUI DF-A9-FF)
        Count: 1
< ACL Data TX: Handle 1551 flags 0x00 dlen 10             #324 [hci1] 20.565573
      ATT: Find Information Response (0x05) len 5
        Format: UUID-16 (0x01)
        Handle: 0x0042
        UUID: Client Characteristic Configuration (0x2902)
> HCI Event: Number of Completed Packets (0x13) plen 5    #325 [hci1] 20.723131
        Num handles: 1
        Handle: 1551 Address: DF:A9:FF:F6:B1:1A (OUI DF-A9-FF)
        Count: 1
        #324: len 10 (0 Kb/s)
        Latency: 157 msec (75-173 msec ~161 msec)
> ACL Data RX: Handle 1551 flags 0x02 dlen 9              #326 [hci1] 20.723362
      ATT: Find Information Request (0x04) len 4
        Handle range: 0x0045-0x0045
< HCI Command: Host Number of Com.. (0x03|0x0035) plen 5  #327 [hci1] 20.725472
        Num handles: 1
        Handle: 1551 Address: DF:A9:FF:F6:B1:1A (OUI DF-A9-FF)
        Count: 1
< ACL Data TX: Handle 1551 flags 0x00 dlen 10             #328 [hci1] 20.725621
      ATT: Find Information Response (0x05) len 5
        Format: UUID-16 (0x01)
        Handle: 0x0045
        UUID: Client Characteristic Configuration (0x2902)
> HCI Event: Number of Completed Packets (0x13) plen 5    #329 [hci1] 20.898272
        Num handles: 1
        Handle: 1551 Address: DF:A9:FF:F6:B1:1A (OUI DF-A9-FF)
        Count: 1
        #328: len 10 (0 Kb/s)
        Latency: 172 msec (75-173 msec ~166 msec)
> ACL Data RX: Handle 1551 flags 0x02 dlen 9              #330 [hci1] 20.898297
      ATT: Find Information Request (0x04) len 4
        Handle range: 0x004a-0x004a
< HCI Command: Host Number of Com.. (0x03|0x0035) plen 5  #331 [hci1] 20.905342
        Num handles: 1
        Handle: 1551 Address: DF:A9:FF:F6:B1:1A (OUI DF-A9-FF)
        Count: 1
< ACL Data TX: Handle 1551 flags 0x00 dlen 10             #332 [hci1] 20.905402
      ATT: Find Information Response (0x05) len 5
        Format: UUID-16 (0x01)
        Handle: 0x004a
        UUID: Client Characteristic Configuration (0x2902)
> HCI Event: Number of Completed Packets (0x13) plen 5    #333 [hci1] 21.073127
        Num handles: 1
        Handle: 1551 Address: DF:A9:FF:F6:B1:1A (OUI DF-A9-FF)
        Count: 1
        #332: len 10 (0 Kb/s)
        Latency: 167 msec (75-173 msec ~167 msec)
> ACL Data RX: Handle 1551 flags 0x02 dlen 9              #334 [hci1] 21.073342
      ATT: Find Information Request (0x04) len 4
        Handle range: 0x004d-0x004d
< HCI Command: Host Number of Com.. (0x03|0x0035) plen 5  #335 [hci1] 21.085439
        Num handles: 1
        Handle: 1551 Address: DF:A9:FF:F6:B1:1A (OUI DF-A9-FF)
        Count: 1
< ACL Data TX: Handle 1551 flags 0x00 dlen 10             #336 [hci1] 21.085592
      ATT: Find Information Response (0x05) len 5
        Format: UUID-16 (0x01)
        Handle: 0x004d
        UUID: Client Characteristic Configuration (0x2902)
> HCI Event: Number of Completed Packets (0x13) plen 5    #337 [hci1] 21.248116
        Num handles: 1
        Handle: 1551 Address: DF:A9:FF:F6:B1:1A (OUI DF-A9-FF)
        Count: 1
        #336: len 10 (0 Kb/s)
        Latency: 162 msec (75-173 msec ~164 msec)
> ACL Data RX: Handle 1551 flags 0x02 dlen 9              #338 [hci1] 21.248315
      ATT: Find Information Request (0x04) len 4
        Handle range: 0x0050-0x0050
< HCI Command: Host Number of Com.. (0x03|0x0035) plen 5  #339 [hci1] 21.265521
        Num handles: 1
        Handle: 1551 Address: DF:A9:FF:F6:B1:1A (OUI DF-A9-FF)
        Count: 1
< ACL Data TX: Handle 1551 flags 0x00 dlen 10             #340 [hci1] 21.265675
      ATT: Find Information Response (0x05) len 5
        Format: UUID-16 (0x01)
        Handle: 0x0050
        UUID: Client Characteristic Configuration (0x2902)
> HCI Event: Number of Completed Packets (0x13) plen 5    #341 [hci1] 21.423183
        Num handles: 1
        Handle: 1551 Address: DF:A9:FF:F6:B1:1A (OUI DF-A9-FF)
        Count: 1
        #340: len 10 (0 Kb/s)
        Latency: 157 msec (75-173 msec ~161 msec)
> ACL Data RX: Handle 1551 flags 0x02 dlen 9              #342 [hci1] 21.423313
      ATT: Write Request (0x12) len 4
        Handle: 0x0042
          Data: 0000
< HCI Command: Host Number of Com.. (0x03|0x0035) plen 5  #343 [hci1] 21.425478
        Num handles: 1
        Handle: 1551 Address: DF:A9:FF:F6:B1:1A (OUI DF-A9-FF)
        Count: 1
< ACL Data TX: Handle 1551 flags 0x00 dlen 5              #344 [hci1] 21.425528
      ATT: Write Response (0x13) len 0
> HCI Event: Number of Completed Packets (0x13) plen 5    #345 [hci1] 21.598157
        Num handles: 1
        Handle: 1551 Address: DF:A9:FF:F6:B1:1A (OUI DF-A9-FF)
        Count: 1
        #344: len 5 (0 Kb/s)
        Latency: 172 msec (75-173 msec ~166 msec)
> ACL Data RX: Handle 1551 flags 0x02 dlen 9              #346 [hci1] 21.598306
      ATT: Write Request (0x12) len 4
        Handle: 0x0042
          Data: 0100
< HCI Command: Host Number of Com.. (0x03|0x0035) plen 5  #347 [hci1] 21.605630
        Num handles: 1
        Handle: 1551 Address: DF:A9:FF:F6:B1:1A (OUI DF-A9-FF)
        Count: 1
< ACL Data TX: Handle 1551 flags 0x00 dlen 5              #348 [hci1] 21.605794
      ATT: Write Response (0x13) len 0
> HCI Event: Number of Completed Packets (0x13) plen 5    #349 [hci1] 21.773084
        Num handles: 1
        Handle: 1551 Address: DF:A9:FF:F6:B1:1A (OUI DF-A9-FF)
        Count: 1
        #348: len 5 (0 Kb/s)
        Latency: 167 msec (75-173 msec ~167 msec)
> ACL Data RX: Handle 1551 flags 0x02 dlen 9              #350 [hci1] 21.773325
      ATT: Write Request (0x12) len 4
        Handle: 0x004d
          Data: 0000
< HCI Command: Host Number of Com.. (0x03|0x0035) plen 5  #351 [hci1] 21.785716
        Num handles: 1
        Handle: 1551 Address: DF:A9:FF:F6:B1:1A (OUI DF-A9-FF)
        Count: 1
< ACL Data TX: Handle 1551 flags 0x00 dlen 5              #352 [hci1] 21.785803
      ATT: Write Response (0x13) len 0
> HCI Event: Number of Completed Packets (0x13) plen 5    #353 [hci1] 21.948091
        Num handles: 1
        Handle: 1551 Address: DF:A9:FF:F6:B1:1A (OUI DF-A9-FF)
        Count: 1
        #352: len 5 (0 Kb/s)
        Latency: 162 msec (75-173 msec ~164 msec)
> ACL Data RX: Handle 1551 flags 0x02 dlen 9              #354 [hci1] 21.948322
      ATT: Write Request (0x12) len 4
        Handle: 0x004d
          Data: 0100
< HCI Command: Host Number of Com.. (0x03|0x0035) plen 5  #355 [hci1] 21.965618
        Num handles: 1
        Handle: 1551 Address: DF:A9:FF:F6:B1:1A (OUI DF-A9-FF)
        Count: 1
< ACL Data TX: Handle 1551 flags 0x00 dlen 5              #356 [hci1] 21.965708
      ATT: Write Response (0x13) len 0
> HCI Event: Number of Completed Packets (0x13) plen 5    #357 [hci1] 22.123082
        Num handles: 1
        Handle: 1551 Address: DF:A9:FF:F6:B1:1A (OUI DF-A9-FF)
        Count: 1
        #356: len 5 (0 Kb/s)
        Latency: 157 msec (75-173 msec ~161 msec)
> ACL Data RX: Handle 1551 flags 0x02 dlen 9              #358 [hci1] 22.123303
      ATT: Write Request (0x12) len 4
        Handle: 0x004a
          Data: 0000
< HCI Command: Host Number of Com.. (0x03|0x0035) plen 5  #359 [hci1] 22.125484
        Num handles: 1
        Handle: 1551 Address: DF:A9:FF:F6:B1:1A (OUI DF-A9-FF)
        Count: 1
< ACL Data TX: Handle 1551 flags 0x00 dlen 5              #360 [hci1] 22.125505
      ATT: Write Response (0x13) len 0
> HCI Event: Number of Completed Packets (0x13) plen 5    #361 [hci1] 22.298064
        Num handles: 1
        Handle: 1551 Address: DF:A9:FF:F6:B1:1A (OUI DF-A9-FF)
        Count: 1
        #360: len 5 (0 Kb/s)
        Latency: 172 msec (75-173 msec ~166 msec)
> ACL Data RX: Handle 1551 flags 0x02 dlen 9              #362 [hci1] 22.298286
      ATT: Write Request (0x12) len 4
        Handle: 0x004a
          Data: 0100
< HCI Command: Host Number of Com.. (0x03|0x0035) plen 5  #363 [hci1] 22.305699
        Num handles: 1
        Handle: 1551 Address: DF:A9:FF:F6:B1:1A (OUI DF-A9-FF)
        Count: 1
< ACL Data TX: Handle 1551 flags 0x00 dlen 5              #364 [hci1] 22.305796
      ATT: Write Response (0x13) len 0
> HCI Event: Number of Completed Packets (0x13) plen 5    #365 [hci1] 22.473081
        Num handles: 1
        Handle: 1551 Address: DF:A9:FF:F6:B1:1A (OUI DF-A9-FF)
        Count: 1
        #364: len 5 (0 Kb/s)
        Latency: 167 msec (75-173 msec ~167 msec)
> ACL Data RX: Handle 1551 flags 0x02 dlen 9              #366 [hci1] 22.473285
      ATT: Write Request (0x12) len 4
        Handle: 0x0045
          Data: 0000
< HCI Command: Host Number of Com.. (0x03|0x0035) plen 5  #367 [hci1] 22.485624
        Num handles: 1
        Handle: 1551 Address: DF:A9:FF:F6:B1:1A (OUI DF-A9-FF)
        Count: 1
< ACL Data TX: Handle 1551 flags 0x00 dlen 5              #368 [hci1] 22.485727
      ATT: Write Response (0x13) len 0
> HCI Event: Number of Completed Packets (0x13) plen 5    #369 [hci1] 22.648093
        Num handles: 1
        Handle: 1551 Address: DF:A9:FF:F6:B1:1A (OUI DF-A9-FF)
        Count: 1
        #368: len 5 (0 Kb/s)
        Latency: 162 msec (75-173 msec ~164 msec)
> ACL Data RX: Handle 1551 flags 0x02 dlen 9              #370 [hci1] 22.648328
      ATT: Write Request (0x12) len 4
        Handle: 0x0045
          Data: 0100
< HCI Command: Host Number of Com.. (0x03|0x0035) plen 5  #371 [hci1] 22.665497
        Num handles: 1
        Handle: 1551 Address: DF:A9:FF:F6:B1:1A (OUI DF-A9-FF)
        Count: 1
< ACL Data TX: Handle 1551 flags 0x00 dlen 5              #372 [hci1] 22.665615
      ATT: Write Response (0x13) len 0
> HCI Event: Number of Completed Packets (0x13) plen 5    #373 [hci1] 22.823129
        Num handles: 1
        Handle: 1551 Address: DF:A9:FF:F6:B1:1A (OUI DF-A9-FF)
        Count: 1
        #372: len 5 (0 Kb/s)
        Latency: 157 msec (75-173 msec ~161 msec)
> ACL Data RX: Handle 1551 flags 0x02 dlen 9              #374 [hci1] 22.823401
      ATT: Write Request (0x12) len 4
        Handle: 0x003f
          Data: 0000
< HCI Command: Host Number of Com.. (0x03|0x0035) plen 5  #375 [hci1] 22.825522
        Num handles: 1
        Handle: 1551 Address: DF:A9:FF:F6:B1:1A (OUI DF-A9-FF)
        Count: 1
< ACL Data TX: Handle 1551 flags 0x00 dlen 5              #376 [hci1] 22.825685
      ATT: Write Response (0x13) len 0
> HCI Event: Number of Completed Packets (0x13) plen 5    #377 [hci1] 22.998171
        Num handles: 1
        Handle: 1551 Address: DF:A9:FF:F6:B1:1A (OUI DF-A9-FF)
        Count: 1
        #376: len 5 (0 Kb/s)
        Latency: 172 msec (75-173 msec ~166 msec)
> ACL Data RX: Handle 1551 flags 0x02 dlen 9              #378 [hci1] 22.998255
      ATT: Write Request (0x12) len 4
        Handle: 0x003f
          Data: 0100
< HCI Command: Host Number of Com.. (0x03|0x0035) plen 5  #379 [hci1] 23.005488
        Num handles: 1
        Handle: 1551 Address: DF:A9:FF:F6:B1:1A (OUI DF-A9-FF)
        Count: 1
< ACL Data TX: Handle 1551 flags 0x00 dlen 5              #380 [hci1] 23.005630
      ATT: Write Response (0x13) len 0
> HCI Event: Number of Completed Packets (0x13) plen 5    #381 [hci1] 23.173213
        Num handles: 1
        Handle: 1551 Address: DF:A9:FF:F6:B1:1A (OUI DF-A9-FF)
        Count: 1
        #380: len 5 (0 Kb/s)
        Latency: 167 msec (75-173 msec ~167 msec)
> ACL Data RX: Handle 1551 flags 0x02 dlen 9              #382 [hci1] 23.173412
      ATT: Write Request (0x12) len 4
        Handle: 0x0050
          Data: 0000
< HCI Command: Host Number of Com.. (0x03|0x0035) plen 5  #383 [hci1] 23.185458
        Num handles: 1
        Handle: 1551 Address: DF:A9:FF:F6:B1:1A (OUI DF-A9-FF)
        Count: 1
< ACL Data TX: Handle 1551 flags 0x00 dlen 5              #384 [hci1] 23.185554
      ATT: Write Response (0x13) len 0
> HCI Event: Number of Completed Packets (0x13) plen 5    #385 [hci1] 23.348076
        Num handles: 1
        Handle: 1551 Address: DF:A9:FF:F6:B1:1A (OUI DF-A9-FF)
        Count: 1
        #384: len 5 (0 Kb/s)
        Latency: 162 msec (75-173 msec ~164 msec)
> ACL Data RX: Handle 1551 flags 0x02 dlen 9              #386 [hci1] 23.348281
      ATT: Write Request (0x12) len 4
        Handle: 0x0050
          Data: 0100
< HCI Command: Host Number of Com.. (0x03|0x0035) plen 5  #387 [hci1] 23.365509
        Num handles: 1
        Handle: 1551 Address: DF:A9:FF:F6:B1:1A (OUI DF-A9-FF)
        Count: 1
< ACL Data TX: Handle 1551 flags 0x00 dlen 5              #388 [hci1] 23.365584
      ATT: Write Response (0x13) len 0
> HCI Event: Number of Completed Packets (0x13) plen 5    #389 [hci1] 23.523070
        Num handles: 1
        Handle: 1551 Address: DF:A9:FF:F6:B1:1A (OUI DF-A9-FF)
        Count: 1
        #388: len 5 (0 Kb/s)
        Latency: 157 msec (75-173 msec ~161 msec)
> ACL Data RX: Handle 1551 flags 0x02 dlen 9              #390 [hci1] 23.523237
      ATT: Write Request (0x12) len 4
        Handle: 0x0032
          Data: 0000
< HCI Command: Host Number of Com.. (0x03|0x0035) plen 5  #391 [hci1] 23.525526
        Num handles: 1
        Handle: 1551 Address: DF:A9:FF:F6:B1:1A (OUI DF-A9-FF)
        Count: 1
< ACL Data TX: Handle 1551 flags 0x00 dlen 5              #392 [hci1] 23.525637
      ATT: Write Response (0x13) len 0
> HCI Event: Number of Completed Packets (0x13) plen 5    #393 [hci1] 23.698086
        Num handles: 1
        Handle: 1551 Address: DF:A9:FF:F6:B1:1A (OUI DF-A9-FF)
        Count: 1
        #392: len 5 (0 Kb/s)
        Latency: 172 msec (75-173 msec ~166 msec)
> ACL Data RX: Handle 1551 flags 0x02 dlen 9              #394 [hci1] 23.698350
      ATT: Write Request (0x12) len 4
        Handle: 0x0032
          Data: 0100
< HCI Command: Host Number of Com.. (0x03|0x0035) plen 5  #395 [hci1] 23.705684
        Num handles: 1
        Handle: 1551 Address: DF:A9:FF:F6:B1:1A (OUI DF-A9-FF)
        Count: 1
< ACL Data TX: Handle 1551 flags 0x00 dlen 5              #396 [hci1] 23.705733
      ATT: Write Response (0x13) len 0
> HCI Event: Number of Completed Packets (0x13) plen 5    #397 [hci1] 23.873018
        Num handles: 1
        Handle: 1551 Address: DF:A9:FF:F6:B1:1A (OUI DF-A9-FF)
        Count: 1
        #396: len 5 (0 Kb/s)
        Latency: 167 msec (75-173 msec ~167 msec)
> ACL Data RX: Handle 1551 flags 0x02 dlen 7              #398 [hci1] 23.873270
      ATT: Read Request (0x0a) len 2
        Handle: 0x003b
< HCI Command: Host Number of Com.. (0x03|0x0035) plen 5  #399 [hci1] 23.885605
        Num handles: 1
        Handle: 1551 Address: DF:A9:FF:F6:B1:1A (OUI DF-A9-FF)
        Count: 1
< ACL Data TX: Handle 1551 flags 0x00 dlen 7              #400 [hci1] 23.885693
      ATT: Read Response (0x0b) len 2
> HCI Event: Number of Completed Packets (0x13) plen 5    #401 [hci1] 24.048052
        Num handles: 1
        Handle: 1551 Address: DF:A9:FF:F6:B1:1A (OUI DF-A9-FF)
        Count: 1
        #400: len 7 (0 Kb/s)
        Latency: 162 msec (75-173 msec ~164 msec)
> ACL Data RX: Handle 1551 flags 0x02 dlen 7              #402 [hci1] 24.048299
      ATT: Read Request (0x0a) len 2
        Handle: 0x0047
< HCI Command: Host Number of Com.. (0x03|0x0035) plen 5  #403 [hci1] 24.065667
        Num handles: 1
        Handle: 1551 Address: DF:A9:FF:F6:B1:1A (OUI DF-A9-FF)
        Count: 1
< ACL Data TX: Handle 1551 flags 0x00 dlen 7              #404 [hci1] 24.065812
      ATT: Read Response (0x0b) len 2
> HCI Event: Number of Completed Packets (0x13) plen 5    #405 [hci1] 24.223138
        Num handles: 1
        Handle: 1551 Address: DF:A9:FF:F6:B1:1A (OUI DF-A9-FF)
        Count: 1
        #404: len 7 (0 Kb/s)
        Latency: 157 msec (75-173 msec ~161 msec)
> ACL Data RX: Handle 1551 flags 0x02 dlen 21             #406 [hci1] 24.223566
      ATT: Write Command (0x52) len 16
        Handle: 0x0044
          Data: 04424c5545544f4f544831323334
< HCI Command: Host Number of Com.. (0x03|0x0035) plen 5  #407 [hci1] 24.225620
        Num handles: 1
        Handle: 1551 Address: DF:A9:FF:F6:B1:1A (OUI DF-A9-FF)
        Count: 1
< ACL Data TX: Handle 1551 flags 0x00 dlen 10             #408 [hci1] 24.225944
      ATT: Handle Value Notification (0x1b) len 5
        Handle: 0x0044
          Data: 040006
> HCI Event: Number of Completed Packets (0x13) plen 5    #409 [hci1] 24.397882
        Num handles: 1
        Handle: 1551 Address: DF:A9:FF:F6:B1:1A (OUI DF-A9-FF)
        Count: 1
        #408: len 10 (0 Kb/s)
        Latency: 171 msec (75-173 msec ~166 msec)
> HCI Event: Disconnect Complete (0x05) plen 4            #410 [hci1] 25.798159
        Status: Success (0x00)
        Handle: 1551 Address: DF:A9:FF:F6:B1:1A (OUI DF-A9-FF)
        Reason: Remote User Terminated Connection (0x13)
< HCI Command: Reset (0x03|0x0003) plen 0                 #411 [hci1] 30.605073
> HCI Event: Command Complete (0x0e) plen 4               #412 [hci1] 30.605591
      Reset (0x03|0x0003) ncmd 1
        Status: Success (0x00)
@ USER Close: main                                    {0x0001} [hci1] 30.624977
= Close Index: 00:00:00:00:00:00                               [hci1] 30.624987
