Bluetooth monitor ver 5.84
btmon[2143089]: = Note: Linux version 6.8.0-83-generic (x86_64)                                                          0.976649
btmon[2143089]: = Note: Bluetooth subsystem version 2.22                                                                 0.976651
= New Index: 00:00:00:00:00:00 (Primary,UART,hci0)                                                                       0.976651
= Open Index: 00:00:00:00:00:00                                                                                          1.480833
= Index Info: 00:00:00:00:00:00 (Nordic Semiconductor ASA)                                                               1.480837
zephyr.exe[2143091]: @ USER Open: main (privileged) version 2.22                                                {0x0001} 1.480840
zephyr.exe[2143091]: < HCI Command: Reset (0x03|0x0003) plen 0                                                        #1 1.481014
> HCI Event: Command Complete (0x0e) plen 4                                                                           #2 1.481560
      Reset (0x03|0x0003) ncmd 1
        Status: Success (0x00)
zephyr.exe[2143091]: < HCI Command: Read Local Supported Features (0x04|0x0003) plen 0                                #3 1.500879
> HCI Event: Command Complete (0x0e) plen 12                                                                          #4 1.501339
      Read Local Supported Features (0x04|0x0003) ncmd 1
        Status: Success (0x00)
        Features: 0x00 0x00 0x00 0x00 0x60 0x00 0x00 0x00
          BR/EDR Not Supported
          LE Supported (Controller)
zephyr.exe[2143091]: < HCI Command: Read Local Version Information (0x04|0x0001) plen 0                               #5 1.520856
> HCI Event: Command Complete (0x0e) plen 12                                                                          #6 1.521367
      Read Local Version Information (0x04|0x0001) ncmd 1
        Status: Success (0x00)
        HCI version: Reserved (0x0e) - Revision 12520 (0x30e8)
        LMP version: Reserved (0x0e) - Subversion 12520 (0x30e8)
        Manufacturer: Nordic Semiconductor ASA (89)
zephyr.exe[2143091]: < HCI Command: Read Local Supported Commands (0x04|0x0002) plen 0                                #7 1.540840
> HCI Event: Command Complete (0x0e) plen 68                                                                          #8 1.541856
      Read Local Supported Commands (0x04|0x0002) ncmd 1
        Status: Success (0x00)
        Commands: 119 entries
          Disconnect (Octet 0 - Bit 5)
          Read Remote Version Information (Octet 2 - Bit 7)
          Set Event Mask (Octet 5 - Bit 6)
          Reset (Octet 5 - Bit 7)
          Read Connection Accept Timeout (Octet 7 - Bit 2)
          Write Connection Accept Timeout (Octet 7 - Bit 3)
          Read Transmit Power Level (Octet 10 - Bit 2)
          Set Controller To Host Flow Control (Octet 10 - Bit 5)
          Host Buffer Size (Octet 10 - Bit 6)
          Host Number of Completed Packets (Octet 10 - Bit 7)
          Read Local Version Information (Octet 14 - Bit 3)
          Read Local Supported Features (Octet 14 - Bit 5)
          Read BD ADDR (Octet 15 - Bit 1)
          Read RSSI (Octet 15 - Bit 5)
          Set Event Mask Page 2 (Octet 22 - Bit 2)
          LE Set Event Mask (Octet 25 - Bit 0)
          LE Read Buffer Size (Octet 25 - Bit 1)
          LE Read Local Supported Features (Octet 25 - Bit 2)
          LE Set Random Address (Octet 25 - Bit 4)
          LE Set Advertising Parameters (Octet 25 - Bit 5)
          LE Read Advertising Channel TX Power (Octet 25 - Bit 6)
          LE Set Advertising Data (Octet 25 - Bit 7)
          LE Set Scan Response Data (Octet 26 - Bit 0)
          LE Set Advertise Enable (Octet 26 - Bit 1)
          LE Set Scan Parameters (Octet 26 - Bit 2)
          LE Set Scan Enable (Octet 26 - Bit 3)
          LE Create Connection (Octet 26 - Bit 4)
          LE Create Connection Cancel (Octet 26 - Bit 5)
          LE Read Accept List Size (Octet 26 - Bit 6)
          LE Clear Accept List (Octet 26 - Bit 7)
          LE Add Device To Accept List (Octet 27 - Bit 0)
          LE Remove Device From Accept List (Octet 27 - Bit 1)
          LE Connection Update (Octet 27 - Bit 2)
          LE Set Host Channel Classification (Octet 27 - Bit 3)
          LE Read Channel Map (Octet 27 - Bit 4)
          LE Read Remote Used Features (Octet 27 - Bit 5)
          LE Encrypt (Octet 27 - Bit 6)
          LE Rand (Octet 27 - Bit 7)
          LE Start Encryption (Octet 28 - Bit 0)
          LE Long Term Key Request Reply (Octet 28 - Bit 1)
          LE Long Term Key Request Neg Reply (Octet 28 - Bit 2)
          LE Read Supported States (Octet 28 - Bit 3)
          LE Receiver Test (Octet 28 - Bit 4)
          LE Transmitter Test (Octet 28 - Bit 5)
          LE Test End (Octet 28 - Bit 6)
          Read Authenticated Payload Timeout (Octet 32 - Bit 4)
          Write Authenticated Payload Timeout (Octet 32 - Bit 5)
          LE Set Data Length (Octet 33 - Bit 6)
          LE Read Suggested Default Data Length (Octet 33 - Bit 7)
          LE Write Suggested Default Data Length (Octet 34 - Bit 0)
          LE Add Device To Resolving List (Octet 34 - Bit 3)
          LE Remove Device From Resolving List (Octet 34 - Bit 4)
          LE Clear Resolving List (Octet 34 - Bit 5)
          LE Read Resolving List Size (Octet 34 - Bit 6)
          LE Set Address Resolution Enable (Octet 35 - Bit 1)
          LE Set Resolvable Private Address Timeout (Octet 35 - Bit 2)
          LE Read Maximum Data Length (Octet 35 - Bit 3)
          LE Read PHY (Octet 35 - Bit 4)
          LE Set Default PHY (Octet 35 - Bit 5)
          LE Set PHY (Octet 35 - Bit 6)
          LE Enhanced Receiver Test (Octet 35 - Bit 7)
          LE Enhanced Transmitter Test (Octet 36 - Bit 0)
          LE Set Advertising Set Random Address (Octet 36 - Bit 1)
          LE Set Extended Advertising Parameters (Octet 36 - Bit 2)
          LE Set Extended Advertising Data (Octet 36 - Bit 3)
          LE Set Extended Scan Response Data (Octet 36 - Bit 4)
          LE Set Extended Advertising Enable (Octet 36 - Bit 5)
          LE Read Maximum Advertising Data Length (Octet 36 - Bit 6)
          LE Read Number of Supported Advertising Sets (Octet 36 - Bit 7)
          LE Remove Advertising Set (Octet 37 - Bit 0)
          LE Clear Advertising Sets (Octet 37 - Bit 1)
          LE Set Periodic Advertising Parameters (Octet 37 - Bit 2)
          LE Set Periodic Advertising Data (Octet 37 - Bit 3)
          LE Set Periodic Advertising Enable (Octet 37 - Bit 4)
          LE Set Extended Scan Parameters (Octet 37 - Bit 5)
          LE Set Extended Scan Enable (Octet 37 - Bit 6)
          LE Extended Create Connection (Octet 37 - Bit 7)
          LE Periodic Advertising Create Sync (Octet 38 - Bit 0)
          LE Periodic Advertising Create Sync Cancel (Octet 38 - Bit 1)
          LE Periodic Advertising Terminate Sync (Octet 38 - Bit 2)
          LE Add Device To Periodic Advertiser List (Octet 38 - Bit 3)
          LE Remove Device From Periodic Advertiser List (Octet 38 - Bit 4)
          LE Clear Periodic Advertiser List (Octet 38 - Bit 5)
          LE Read Periodic Advertiser List Size (Octet 38 - Bit 6)
          LE Read Transmit Power (Octet 38 - Bit 7)
          LE Read RF Path Compensation (Octet 39 - Bit 0)
          LE Write RF Path Compensation (Octet 39 - Bit 1)
          LE Set Privacy Mode (Octet 39 - Bit 2)
          LE Periodic Advertising Receive Enable (Octet 40 - Bit 5)
          LE Periodic Advertising Sync Transfer (Octet 40 - Bit 6)
          LE Periodic Advertising Set Info Transfer (Octet 40 - Bit 7)
          LE Periodic Advertising Sync Transfer Parameters (Octet 41 - Bit 0)
          LE Set Default Periodic Advertisng Sync Transfer Parameters (Octet 41 - Bit 1)
          LE Read Buffer v2 (Octet 41 - Bit 5)
          LE Read ISO TX Sync (Octet 41 - Bit 6)
          LE Set Connected Isochronous Group Parameters (Octet 41 - Bit 7)
          LE Set Connected Isochronous Group Parameters Test (Octet 42 - Bit 0)
          LE Create Connected Isochronous Stream (Octet 42 - Bit 1)
          LE Remove Connected Isochronous Group (Octet 42 - Bit 2)
          LE Accept Connected Isochronous Stream Request (Octet 42 - Bit 3)
          LE Reject Connected Isochronous Stream Request (Octet 42 - Bit 4)
          LE Create Broadcast Isochronous Group (Octet 42 - Bit 5)
          LE Create Broadcast Isochronous Group Test (Octet 42 - Bit 6)
          LE Terminate Broadcast Isochronous Group (Octet 42 - Bit 7)
          LE Broadcast Isochronous Group Create Sync (Octet 43 - Bit 0)
          LE Broadcast Isochronous Group Terminate Sync (Octet 43 - Bit 1)
          LE Request Peer SCA (Octet 43 - Bit 2)
          LE Setup Isochronous Data Path (Octet 43 - Bit 3)
          LE Remove Isochronous Data Path (Octet 43 - Bit 4)
          LE Isochronous Transmit Test (Octet 43 - Bit 5)
          LE Isochronous Receive Test (Octet 43 - Bit 6)
          LE Isochronous Read Test Counters (Octet 43 - Bit 7)
          LE Isochronous Read Test Counters (Octet 44 - Bit 0)
          LE Set Host Feature (Octet 44 - Bit 1)
          LE Read ISO link quality (Octet 44 - Bit 2)
          Octet 45 - Bit 6 
          Octet 46 - Bit 0 
          Octet 46 - Bit 1 
          Octet 46 - Bit 2 
zephyr.exe[2143091]: < HCI Command: Host Buffer Size (0x03|0x0033) plen 7                                             #9 1.560848
        ACL MTU: 255  ACL max packet: 16
        SCO MTU: 0    SCO max packet: 0
> HCI Event: Command Complete (0x0e) plen 4                                                                          #10 1.561311
      Host Buffer Size (0x03|0x0033) ncmd 1
        Status: Success (0x00)
zephyr.exe[2143091]: < HCI Command: Set Controller To Host Flow Control (0x03|0x0031) plen 1                         #11 1.580842
        Flow control: ACL Data Packets (0x01)
> HCI Event: Command Complete (0x0e) plen 4                                                                          #12 1.581246
      Set Controller To Host Flow Control (0x03|0x0031) ncmd 1
        Status: Success (0x00)
zephyr.exe[2143091]: < HCI Command: LE Read Local Supported Features (0x08|0x0003) plen 0                            #13 1.600850
> HCI Event: Command Complete (0x0e) plen 12                                                                         #14 1.601323
      LE Read Local Supported Features (0x08|0x0003) ncmd 1
        Status: Success (0x00)
        Features: 0xfd 0x79 0x00 0xf7 0x30 0x01 0x00 0x00
          LE Encryption
          Extended Reject Indication
          Peripheral-initiated Features Exchange
          LE Ping
          LE Data Packet Length Extension
          LL Privacy
          Extended Scanner Filter Policies
          LE 2M PHY
          LE Coded PHY
          LE Extended Advertising
          LE Periodic Advertising
          Channel Selection Algorithm #2
          Periodic Advertising Sync Transfer - Sender
          Periodic Advertising Sync Transfer - Recipient
          Sleep Clock Accuracy Updates
          Connected Isochronous Stream - Central
          Connected Isochronous Stream - Peripheral
          Isochronous Broadcaster
          Synchronized Receiver
          Periodic Advertising ADI support
          Connection Subrating
          Unknown features (0x0000010000000000)
zephyr.exe[2143091]: < HCI Command: LE Set Host Feature (0x08|0x0074) plen 2                                         #15 1.620844
        Bit Number: 32
          Connected Isochronous Stream (Host Support)
        Bit Value: 1
> HCI Event: Command Complete (0x0e) plen 4                                                                          #16 1.621215
      LE Set Host Feature (0x08|0x0074) ncmd 1
        Status: Success (0x00)
zephyr.exe[2143091]: < HCI Command: LE Read Buffer v2 (0x08|0x0060) plen 0                                           #17 1.640847
> HCI Event: Command Complete (0x0e) plen 10                                                                         #18 1.641254
      LE Read Buffer v2 (0x08|0x0060) ncmd 1
        Status: Success (0x00)
        ACL MTU: 27
        ACL max packet: 3
        ISO MTU: 318
        ISO max packet: 3
zephyr.exe[2143091]: < HCI Command: LE Read Maximum Advertising Data Length (0x08|0x003a) plen 0                     #19 1.660881
> HCI Event: Command Complete (0x0e) plen 6                                                                          #20 1.661275
      LE Read Maximum Advertising Data Length (0x08|0x003a) ncmd 1
        Status: Success (0x00)
        Max length: 1650
zephyr.exe[2143091]: < HCI Command: LE Read Supported States (0x08|0x001c) plen 0                                    #21 1.680840
> HCI Event: Command Complete (0x0e) plen 12                                                                         #22 1.681264
      LE Read Supported States (0x08|0x001c) ncmd 1
        Status: Success (0x00)
        States: 0x000003ff3e0306ff
          Non-connectable Advertising State
          Scannable Advertising State
          Connectable Advertising State
          High Duty Cycle Directed Advertising State
          Passive Scanning State
          Active Scanning State
          Initiating State
            and Connection State (Central Role)
          Connection State (Peripheral Role)
          Scannable Advertising State
            and Passive Scanning State
          Connectable Advertising State
            and Passive Scanning State
          Non-connectable Advertising State
            and Initiating State
          Scannable Advertising State
            and Initiating State
          Active Scanning State
            and Connection State (Central Role)
          Passive Scanning State
            and Connection State (Peripheral Role)
          Active Scanning State
            and Connection State (Peripheral Role)
          Initiating State
            and Connection State (Central Role)
            and Central Role & Central Role
          Low Duty Cycle Directed Advertising State
          Connectable Advertising State
            and Initiating State
            and Central Role & Peripheral Role
          High Duty Cycle Directed Advertising State
            and Initiating State
            and Central Role & Peripheral Role
          Low Duty Cycle Directed Advertising State
            and Initiating State
            and Central Role & Peripheral Role
          Connectable Advertising State
            and Connection State (Central Role)
            and Central Role & Peripheral Role
          High Duty Cycle Directed Advertising State
            and Connection State (Central Role)
            and Central Role & Peripheral Role
          Low Duty Cycle Directed Advertising State
            and Connection State (Central Role)
            and Central Role & Peripheral Role
          Connectable Advertising State
            and Connection State (Peripheral Role)
            and Central Role & Peripheral Role
          High Duty Cycle Directed Advertising State
            and Connection State (Peripheral Role)
            and Peripheral Role & Peripheral Role
          Low Duty Cycle Directed Advertising State
            and Connection State (Peripheral Role)
            and Peripheral Role & Peripheral Role
          Initiating State
            and Connection State (Peripheral Role)
            and Central Role & Peripheral Role
zephyr.exe[2143091]: < HCI Command: LE Read Maximum Data Length (0x08|0x002f) plen 0                                 #23 1.700843
> HCI Event: Command Complete (0x0e) plen 12                                                                         #24 1.701313
      LE Read Maximum Data Length (0x08|0x002f) ncmd 1
        Status: Success (0x00)
        Max TX octets: 251
        Max TX time: 2704
        Max RX octets: 251
        Max RX time: 2704
zephyr.exe[2143091]: < HCI Command: LE Write Suggested Default Data Length (0x08|0x0024) plen 4                      #25 1.720843
        TX octets: 251
        TX time: 2704
> HCI Event: Command Complete (0x0e) plen 4                                                                          #26 1.721315
      LE Write Suggested Default Data Length (0x08|0x0024) ncmd 1
        Status: Success (0x00)
zephyr.exe[2143091]: < HCI Command: LE Set Resolvable Private Address Timeout (0x08|0x002e) plen 2                   #27 1.740850
        Timeout: 30 seconds
> HCI Event: Command Complete (0x0e) plen 4                                                                          #28 1.741278
      LE Set Resolvable Private Address Timeout (0x08|0x002e) ncmd 1
        Status: Success (0x00)
zephyr.exe[2143091]: < HCI Command: LE Read Resolving List Size (0x08|0x002a) plen 0                                 #29 1.760871
> HCI Event: Command Complete (0x0e) plen 5                                                                          #30 1.761342
      LE Read Resolving List Size (0x08|0x002a) ncmd 1
        Status: Success (0x00)
        Size: 8
zephyr.exe[2143091]: < HCI Command: LE Set Event Mask (0x08|0x0001) plen 8                                           #31 1.780848
        Mask: 0x000002023f87fa5e
          LE Advertising Report
          LE Connection Update Complete
          LE Read Remote Used Features Complete
          LE Long Term Key Request
          LE Data Length Change
          LE Enhanced Connection Complete
          LE PHY Update Complete
          LE Extended Advertising Report
          LE Periodic Advertising Sync Established
          LE Periodic Advertising Report
          LE Periodic Advertising Sync Lost
          LE Extended Scan Timeout
          LE Extended Advertising Set Terminated
          LE Scan Request Received
          LE Periodic Advertising Sync Transfer Rvc
          LE CIS Established
          LE CIS Request
          LE Create BIG Complete
          LE Terminate BIG Complete
          LE BIG Sync Established Complete
          LE BIG Sync Lost
          LE BIG Info Advertising Report
          Unknown mask (0x0000020000000000)
> HCI Event: Command Complete (0x0e) plen 4                                                                          #32 1.781315
      LE Set Event Mask (0x08|0x0001) ncmd 1
        Status: Success (0x00)
zephyr.exe[2143091]: < HCI Command: Set Event Mask (0x03|0x0001) plen 8                                              #33 1.800841
        Mask: 0x2000800002008890
          Disconnection Complete
          Encryption Change
          Read Remote Version Information Complete
          Hardware Error
          Data Buffer Overflow
          Encryption Key Refresh Complete
          LE Meta
> HCI Event: Command Complete (0x0e) plen 4                                                                          #34 1.801276
      Set Event Mask (0x03|0x0001) ncmd 1
        Status: Success (0x00)
zephyr.exe[2143091]: < HCI Command: Read BD ADDR (0x04|0x0009) plen 0                                                #35 1.820848
> HCI Event: Command Complete (0x0e) plen 10                                                                         #36 1.821349
      Read BD ADDR (0x04|0x0009) ncmd 1
        Status: Success (0x00)
        Address: 00:00:00:00:00:00 (OUI 00-00-00)
zephyr.exe[2143091]: < HCI Command: LE Set Random Address (0x08|0x0005) plen 6                                       #37 1.840854
        Address: D5:B6:CC:31:DB:3B (Static)
> HCI Event: Command Complete (0x0e) plen 4                                                                          #38 1.841334
      LE Set Random Address (0x08|0x0005) ncmd 1
        Status: Success (0x00)
zephyr.exe[2143091]: < HCI Command: LE Set Random Address (0x08|0x0005) plen 6                                       #39 1.900870
        Address: 48:61:8E:DB:C6:F9 (Resolvable)
> HCI Event: Command Complete (0x0e) plen 4                                                                          #40 1.901327
      LE Set Random Address (0x08|0x0005) ncmd 1
        Status: Success (0x00)
zephyr.exe[2143091]: < HCI Command: LE Set Extended Advertising Parameters (0x08|0x0036) plen 25                     #41 4.340941
        Handle: 0x00
        Properties: 0x0013
          Connectable
          Scannable
          Use legacy advertising PDUs: ADV_IND
        Min advertising interval: 100.000 msec (0x00a0)
        Max advertising interval: 150.000 msec (0x00f0)
        Channel map: 37, 38, 39 (0x07)
        Own address type: Random (0x01)
        Peer address type: Public (0x00)
        Peer address: 00:00:00:00:00:00 (OUI 00-00-00)
        Filter policy: Allow Scan Request from Any, Allow Connect Request from Any (0x00)
        TX power: Host has no preference (0x7f)
        Primary PHY: LE 1M (0x01)
        Secondary max skip: 0x00
        Secondary PHY: LE 1M (0x01)
        SID: 0x00
        Scan request notifications: Disabled (0x00)
> HCI Event: Command Complete (0x0e) plen 5                                                                          #42 4.341618
      LE Set Extended Advertising Parameters (0x08|0x0036) ncmd 1
        Status: Success (0x00)
        TX power (selected): 0 dbm (0x00)
zephyr.exe[2143091]: < HCI Command: LE Set Advertising Set Random Address (0x08|0x0035) plen 7                       #43 4.360891
        Advertising handle: 0x00
        Advertising random address: 48:61:8E:DB:C6:F9 (Resolvable)
> HCI Event: Command Complete (0x0e) plen 4                                                                          #44 4.361406
      LE Set Advertising Set Random Address (0x08|0x0035) ncmd 1
        Status: Success (0x00)
zephyr.exe[2143091]: < HCI Command: LE Set Extended Advertising Data (0x08|0x0037) plen 15                           #45 4.380888
        Handle: 0x00
        Operation: Complete extended advertising data (0x03)
        Fragment preference: Minimize fragmentation (0x01)
        Data length: 0x0b
        Flags: 0x06
          LE General Discoverable Mode
          BR/EDR Not Supported
        Resolvable Set Identifier: 46-5C-55-EA-DD-14
          Hash: 0xeadd14
          Random: 0x465c55
> HCI Event: Command Complete (0x0e) plen 4                                                                          #46 4.381602
      LE Set Extended Advertising Data (0x08|0x0037) ncmd 1
        Status: Success (0x00)
zephyr.exe[2143091]: < HCI Command: LE Set Extended Scan Response Data (0x08|0x0038) plen 4                          #47 4.400899
        Handle: 0x00
        Operation: Complete scan response data (0x03)
        Fragment preference: Minimize fragmentation (0x01)
        Data length: 0x00
> HCI Event: Command Complete (0x0e) plen 4                                                                          #48 4.401362
      LE Set Extended Scan Response Data (0x08|0x0038) ncmd 1
        Status: Success (0x00)
zephyr.exe[2143091]: < HCI Command: LE Set Extended Advertising Enable (0x08|0x0039) plen 6                          #49 4.420883
        Extended advertising: Enabled (0x01)
        Number of sets: 1 (0x01)
        Entry 0
          Handle: 0x00
          Duration: 0 ms (0x00)
          Max ext adv events: 0
> HCI Event: Command Complete (0x0e) plen 4                                                                          #50 4.421524
      LE Set Extended Advertising Enable (0x08|0x0039) ncmd 1
        Status: Success (0x00)
> HCI Event: LE Meta Event (0x3e) plen 31                                                                            #51 4.743058
      LE Enhanced Connection Complete (0x0a)
        Status: Success (0x00)
        Handle: 21
        Role: Peripheral (0x01)
        Peer address type: Public (0x00)
        Peer address: C0:07:E8:2C:B6:EE (OUI C0-07-E8)
        Local resolvable private address: 00:00:00:00:00:00 (Non-Resolvable)
        Peer resolvable private address: 00:00:00:00:00:00 (Non-Resolvable)
        Connection interval: 62.50 msec (0x0032)
        Connection latency: 0 (0x0000)
        Supervision timeout: 25120 msec (0x09d0)
        Central clock accuracy: 0x07
> HCI Event: LE Meta Event (0x3e) plen 6                                                                             #52 4.743168
      LE Advertising Set Terminated (0x12)
        Status: Success (0x00)
        Handle: 0
        Connection handle: 21
        Number of completed extended advertising events: 0
zephyr.exe[2143091]: < HCI Command: LE Read Remote Used Features (0x08|0x0016) plen 2                                #53 4.761020
        Handle: 21 Address: C0:07:E8:2C:B6:EE (OUI C0-07-E8)
> HCI Event: Command Status (0x0f) plen 4                                                                            #54 4.761774
      LE Read Remote Used Features (0x08|0x0016) ncmd 1
        Status: Success (0x00)
zephyr.exe[2143091]: < HCI Command: LE Set PHY (0x08|0x0032) plen 7                                                  #55 4.780918
        Handle: 21 Address: C0:07:E8:2C:B6:EE (OUI C0-07-E8)
        All PHYs preference: 0x00
        TX PHYs preference: 0x02
          LE 2M
        RX PHYs preference: 0x02
          LE 2M
        PHY options preference: Reserved (0x0000)
> HCI Event: Command Status (0x0f) plen 4                                                                            #56 4.781411
      LE Set PHY (0x08|0x0032) ncmd 1
        Status: Success (0x00)
zephyr.exe[2143091]: < ACL Data TX: Handle 21 [1/3] flags 0x00 dlen 7                                                #57 4.800820
      ATT: Exchange MTU Request (0x02) len 2
        Client RX MTU: 251
> HCI Event: Number of Completed Packets (0x13) plen 5                                                               #58 4.869005
        Num handles: 1
        Handle: 21 Address: C0:07:E8:2C:B6:EE (OUI C0-07-E8)
        Count: 1
        Buffers: 0/3
        #57: len 7 (0 Kb/s)
        Latency: 68 msec (68-68 msec ~68 msec)
> HCI Event: LE Meta Event (0x3e) plen 12                                                                            #59 4.932051
      LE Read Remote Used Features (0x04)
        Status: Success (0x00)
        Handle: 21 Address: C0:07:E8:2C:B6:EE (OUI C0-07-E8)
        Features: 0x2d 0x49 0x01 0xf7 0xef 0x39 0x00 0x80
          LE Encryption
          Extended Reject Indication
          Peripheral-initiated Features Exchange
          LE Data Packet Length Extension
          LE 2M PHY
          LE Coded PHY
          Channel Selection Algorithm #2
          Minimum Number of Used Channels Procedure
          Periodic Advertising Sync Transfer - Sender
          Periodic Advertising Sync Transfer - Recipient
          Sleep Clock Accuracy Updates
          Connected Isochronous Stream - Central
          Connected Isochronous Stream - Peripheral
          Isochronous Broadcaster
          Synchronized Receiver
          Connected Isochronous Stream (Host Support)
          LE Power Control Request
          LE Power Control Request
          LE Path Loss Monitoring
          Connection Subrating
          Connection Subrating (Host Support)
          Channel Classification
          Unknown features (0x8000390000000000)
> HCI Event: LE Meta Event (0x3e) plen 6                                                                             #60 5.431233
      LE PHY Update Complete (0x0c)
        Status: Success (0x00)
        Handle: 21 Address: C0:07:E8:2C:B6:EE (OUI C0-07-E8)
        TX PHY: LE 2M (0x02)
        RX PHY: LE 2M (0x02)
zephyr.exe[2143091]: < HCI Command: LE Set Extended Advertising Parameters (0x08|0x0036) plen 25                     #61 5.500933
        Handle: 0x00
        Properties: 0x0013
          Connectable
          Scannable
          Use legacy advertising PDUs: ADV_IND
        Min advertising interval: 100.000 msec (0x00a0)
        Max advertising interval: 150.000 msec (0x00f0)
        Channel map: 37, 38, 39 (0x07)
        Own address type: Random (0x01)
        Peer address type: Public (0x00)
        Peer address: 00:00:00:00:00:00 (OUI 00-00-00)
        Filter policy: Allow Scan Request from Any, Allow Connect Request from Any (0x00)
        TX power: Host has no preference (0x7f)
        Primary PHY: LE 1M (0x01)
        Secondary max skip: 0x00
        Secondary PHY: LE 1M (0x01)
        SID: 0x00
        Scan request notifications: Disabled (0x00)
> HCI Event: Command Complete (0x0e) plen 5                                                                          #62 5.501679
      LE Set Extended Advertising Parameters (0x08|0x0036) ncmd 1
        Status: Success (0x00)
        TX power (selected): 0 dbm (0x00)
zephyr.exe[2143091]: < HCI Command: LE Set Advertising Set Random Address (0x08|0x0035) plen 7                       #63 5.520789
        Advertising handle: 0x00
        Advertising random address: 48:61:8E:DB:C6:F9 (Resolvable)
> HCI Event: Command Complete (0x0e) plen 4                                                                          #64 5.521283
      LE Set Advertising Set Random Address (0x08|0x0035) ncmd 1
        Status: Success (0x00)
zephyr.exe[2143091]: < HCI Command: LE Set Extended Advertising Data (0x08|0x0037) plen 22                           #65 5.540900
        Handle: 0x00
        Operation: Complete extended advertising data (0x03)
        Fragment preference: Minimize fragmentation (0x01)
        Data length: 0x12
        Flags: 0x06
          LE General Discoverable Mode
          BR/EDR Not Supported
        Name (complete): Tester_2CB6EE
> HCI Event: Command Complete (0x0e) plen 4                                                                          #66 5.541616
      LE Set Extended Advertising Data (0x08|0x0037) ncmd 1
        Status: Success (0x00)
zephyr.exe[2143091]: < HCI Command: LE Set Extended Scan Response Data (0x08|0x0038) plen 4                          #67 5.560933
        Handle: 0x00
        Operation: Complete scan response data (0x03)
        Fragment preference: Minimize fragmentation (0x01)
        Data length: 0x00
> HCI Event: Command Complete (0x0e) plen 4                                                                          #68 5.561420
      LE Set Extended Scan Response Data (0x08|0x0038) ncmd 1
        Status: Success (0x00)
zephyr.exe[2143091]: < HCI Command: LE Set Extended Advertising Enable (0x08|0x0039) plen 6                          #69 5.580919
        Extended advertising: Enabled (0x01)
        Number of sets: 1 (0x01)
        Entry 0
          Handle: 0x00
          Duration: 0 ms (0x00)
          Max ext adv events: 0
> HCI Event: Command Complete (0x0e) plen 4                                                                          #70 5.581535
      LE Set Extended Advertising Enable (0x08|0x0039) ncmd 1
        Status: Success (0x00)
> ACL Data RX: Handle 21 flags 0x02 dlen 11                                                                          #71 7.244171
      SMP: Pairing Request (0x01) len 6
        IO capability: KeyboardDisplay (0x04)
        OOB data: Authentication data not present (0x00)
        Authentication requirement: Bonding, No MITM, SC, No Keypresses (0x09)
        Max encryption key size: 16
        Initiator key distribution: EncKey IdKey Sign (0x07)
        Responder key distribution: EncKey IdKey Sign (0x07)
> ACL Data RX: Handle 21 flags 0x02 dlen 7                                                                           #72 7.244442
      ATT: Exchange MTU Response (0x03) len 2
        Server RX MTU: 23
zephyr.exe[2143091]: < HCI Command: Host Number of Completed Packets (0x03|0x0035) plen 5                            #73 7.260976
        Num handles: 1
        Handle: 21 Address: C0:07:E8:2C:B6:EE (OUI C0-07-E8)
        Count: 1
zephyr.exe[2143091]: < ACL Data TX: Handle 21 [1/3] flags 0x00 dlen 11                                               #74 7.260998
      SMP: Pairing Response (0x02) len 6
        IO capability: NoInputNoOutput (0x03)
        OOB data: Authentication data not present (0x00)
        Authentication requirement: Bonding, No MITM, SC, No Keypresses (0x09)
        Max encryption key size: 16
        Initiator key distribution: IdKey Sign (0x06)
        Responder key distribution: IdKey Sign (0x06)
zephyr.exe[2143091]: < HCI Command: Host Number of Completed Packets (0x03|0x0035) plen 5                            #75 7.261016
        Num handles: 1
        Handle: 21 Address: C0:07:E8:2C:B6:EE (OUI C0-07-E8)
        Count: 1
> HCI Event: Number of Completed Packets (0x13) plen 5                                                               #76 7.369190
        Num handles: 1
        Handle: 21 Address: C0:07:E8:2C:B6:EE (OUI C0-07-E8)
        Count: 1
        Buffers: 0/3
        #74: len 11 (0 Kb/s)
        Latency: 108 msec (68-108 msec ~88 msec)
> ACL Data RX: Handle 21 flags 0x02 dlen 27                                                                          #77 7.369550
> ACL Data RX: Handle 21 flags 0x01 dlen 27                                                                          #78 7.369774
> ACL Data RX: Handle 21 flags 0x01 dlen 15                                                                          #79 7.370132
      SMP: Pairing Public Key (0x0c) len 64
        X[32]: 2d89d248856b6592e8e7340392c08475ec5f4021df8344182067212126a5fe08
        Y[32]: 6e6a87ce73788e2f0b58c170c0eecaf955d6fdb3517fd536aaba22e543968890
zephyr.exe[2143091]: < HCI Command: Host Number of Completed Packets (0x03|0x0035) plen 5                            #80 7.380995
        Num handles: 1
        Handle: 21 Address: C0:07:E8:2C:B6:EE (OUI C0-07-E8)
        Count: 1
zephyr.exe[2143091]: < HCI Command: Host Number of Completed Packets (0x03|0x0035) plen 5                            #81 7.381001
        Num handles: 1
        Handle: 21 Address: C0:07:E8:2C:B6:EE (OUI C0-07-E8)
        Count: 1
zephyr.exe[2143091]: < HCI Command: Host Number of Completed Packets (0x03|0x0035) plen 5                            #82 7.381024
        Num handles: 1
        Handle: 21 Address: C0:07:E8:2C:B6:EE (OUI C0-07-E8)
        Count: 1
zephyr.exe[2143091]: < ACL Data TX: Handle 21 [1/3] flags 0x00 dlen 27                                               #83 7.381061
zephyr.exe[2143091]: < ACL Data TX: Handle 21 flags 0x01 dlen 27                                                     #84 7.381066
zephyr.exe[2143091]: < ACL Data TX: Handle 21 flags 0x01 dlen 15                                                     #85 7.381070
      SMP: Pairing Public Key (0x0c) len 64
        X[32]: 68f6ada634ce84d11617383d57f070fe3445c38b33b569efa5eb771a0dc8aea5
        Y[32]: 83c407aaa8337331fdc418e55085d75e6c1c6e5d42f8bf9c18fb5a2a7d4f31aa
> HCI Event: Number of Completed Packets (0x13) plen 5                                                               #86 7.431957
        Num handles: 1
        Handle: 21 Address: C0:07:E8:2C:B6:EE (OUI C0-07-E8)
        Count: 1
        Buffers: 0/3
        #83: len 27 (4 Kb/s)
        Latency: 50 msec (50-108 msec ~69 msec)
> HCI Event: Number of Completed Packets (0x13) plen 5                                                               #87 7.432436
        Num handles: 1
        Handle: 21 Address: C0:07:E8:2C:B6:EE (OUI C0-07-E8)
        Count: 1
        Buffers: underflow/3
        #84: len 27 (4 Kb/s)
        Latency: 51 msec (50-108 msec ~60 msec)
zephyr.exe[2143091]: < ACL Data TX: Handle 21 [1/3] flags 0x00 dlen 21                                               #88 7.440953
      SMP: Pairing Confirm (0x03) len 16
        Confirm value[16]: d01fbdb8913ec744767b6a9c88d69568
> HCI Event: Number of Completed Packets (0x13) plen 5                                                               #89 7.493993
        Num handles: 1
        Handle: 21 Address: C0:07:E8:2C:B6:EE (OUI C0-07-E8)
        Count: 1
        Buffers: 0/3
        #85: len 15 (1 Kb/s)
        Latency: 112 msec (50-112 msec ~86 msec)
> HCI Event: Number of Completed Packets (0x13) plen 5                                                               #90 7.556622
        Num handles: 1
        Handle: 21 Address: C0:07:E8:2C:B6:EE (OUI C0-07-E8)
        Count: 1
        Buffers: underflow/3
        #88: len 21 (1 Kb/s)
        Latency: 115 msec (50-115 msec ~101 msec)
> ACL Data RX: Handle 21 flags 0x02 dlen 21                                                                          #91 7.556925
      SMP: Pairing Random (0x04) len 16
        Random value[16]: 7a3a10b9e12ba8e90000000000000000
zephyr.exe[2143091]: < HCI Command: Host Number of Completed Packets (0x03|0x0035) plen 5                            #92 7.560949
        Num handles: 1
        Handle: 21 Address: C0:07:E8:2C:B6:EE (OUI C0-07-E8)
        Count: 1
zephyr.exe[2143091]: < ACL Data TX: Handle 21 [1/3] flags 0x00 dlen 21                                               #93 7.560956
      SMP: Pairing Random (0x04) len 16
        Random value[16]: 4d02679f89a05211af56d8b3da64d21e
> HCI Event: Number of Completed Packets (0x13) plen 5                                                               #94 7.681524
        Num handles: 1
        Handle: 21 Address: C0:07:E8:2C:B6:EE (OUI C0-07-E8)
        Count: 1
        Buffers: 0/3
        #93: len 21 (1 Kb/s)
        Latency: 120 msec (50-120 msec ~110 msec)
> ACL Data RX: Handle 21 flags 0x02 dlen 21                                                                          #95 7.744283
      SMP: Pairing DHKey Check (0x0d) len 16
        E[16]: 6a32f5925526ffc4f3f52d259d028006
zephyr.exe[2143091]: < HCI Command: Host Number of Completed Packets (0x03|0x0035) plen 5                            #96 7.761030
        Num handles: 1
        Handle: 21 Address: C0:07:E8:2C:B6:EE (OUI C0-07-E8)
        Count: 1
zephyr.exe[2143091]: < ACL Data TX: Handle 21 [1/3] flags 0x00 dlen 21                                               #97 7.761090
      SMP: Pairing DHKey Check (0x0d) len 16
        E[16]: aa904e33d0421e1a9c64505fe06d2a64
> HCI Event: Number of Completed Packets (0x13) plen 5                                                               #98 7.868991
        Num handles: 1
        Handle: 21 Address: C0:07:E8:2C:B6:EE (OUI C0-07-E8)
        Count: 1
        Buffers: 0/3
        #97: len 21 (1 Kb/s)
        Latency: 107 msec (50-120 msec ~109 msec)
> HCI Event: LE Meta Event (0x3e) plen 13                                                                            #99 7.932032
      LE Long Term Key Request (0x05)
        Handle: 21 Address: C0:07:E8:2C:B6:EE (OUI C0-07-E8)
        Random number: 0x0000000000000000
        Encrypted diversifier: 0x0000
zephyr.exe[2143091]: < HCI Command: LE Long Term Key Request Reply (0x08|0x001a) plen 18                            #100 7.940993
        Handle: 21 Address: C0:07:E8:2C:B6:EE (OUI C0-07-E8)
        Long term key[16]: dbf57033fab679113d4dbced51b91ad0
> HCI Event: Command Complete (0x0e) plen 6                                                                         #101 7.941691
      LE Long Term Key Request Reply (0x08|0x001a) ncmd 1
        Status: Success (0x00)
        Handle: 21 Address: C0:07:E8:2C:B6:EE (OUI C0-07-E8)
> HCI Event: Encryption Change (0x08) plen 4                                                                        #102 8.244252
        Status: Success (0x00)
        Handle: 21 Address: C0:07:E8:2C:B6:EE (OUI C0-07-E8)
        Encryption: Enabled with AES-CCM (0x01)
zephyr.exe[2143091]: < ACL Data TX: Handle 21 [1/3] flags 0x00 dlen 21                                              #103 8.371003
      SMP: Identity Information (0x08) len 16
        Identity resolving key[16]: 08aad2e1be87e47b88aeb19de6889efb
zephyr.exe[2143091]: < ACL Data TX: Handle 21 [2/3] flags 0x00 dlen 12                                              #104 8.371011
      SMP: Identity Address Information (0x09) len 7
        Address: D5:B6:CC:31:DB:3B (Static)
zephyr.exe[2143091]: < ACL Data TX: Handle 21 [3/3] flags 0x00 dlen 21                                              #105 8.371012
      SMP: Signing Information (0x0a) len 16
        Signature key[16]: 5e8286bc235a02440d0c3424a2acf8fd
> HCI Event: Number of Completed Packets (0x13) plen 5                                                              #106 8.432003
        Num handles: 1
        Handle: 21 Address: C0:07:E8:2C:B6:EE (OUI C0-07-E8)
        Count: 1
        Buffers: 2/3
        #103: len 21 (2 Kb/s)
        Latency: 61 msec (50-120 msec ~85 msec)
> HCI Event: Number of Completed Packets (0x13) plen 5                                                              #107 8.432382
        Num handles: 1
        Handle: 21 Address: C0:07:E8:2C:B6:EE (OUI C0-07-E8)
        Count: 1
        Buffers: 1/3
        #104: len 12 (1 Kb/s)
        Latency: 61 msec (50-120 msec ~73 msec)
> HCI Event: Number of Completed Packets (0x13) plen 5                                                              #108 8.494177
        Num handles: 1
        Handle: 21 Address: C0:07:E8:2C:B6:EE (OUI C0-07-E8)
        Count: 1
        Buffers: 0/3
        #105: len 21 (1 Kb/s)
        Latency: 123 msec (50-123 msec ~98 msec)
> ACL Data RX: Handle 21 flags 0x02 dlen 21                                                                         #109 8.494456
      SMP: Identity Information (0x08) len 16
        Identity resolving key[16]: 94c7b641ca22f5da3e4a2f549c0b936e
> ACL Data RX: Handle 21 flags 0x02 dlen 12                                                                         #110 8.494636
      SMP: Identity Address Information (0x09) len 7
        Address: C0:07:E8:2C:B6:EE (OUI C0-07-E8)
> ACL Data RX: Handle 21 flags 0x02 dlen 21                                                                         #111 8.495200
      SMP: Signing Information (0x0a) len 16
        Signature key[16]: b7c39915d567f0894dc6b8bc5512f2fb
zephyr.exe[2143091]: < HCI Command: Host Number of Completed Packets (0x03|0x0035) plen 5                           #112 8.500947
        Num handles: 1
        Handle: 21 Address: C0:07:E8:2C:B6:EE (OUI C0-07-E8)
        Count: 1
zephyr.exe[2143091]: < HCI Command: LE Set Extended Advertising Enable (0x08|0x0039) plen 6                         #113 8.500971
        Extended advertising: Disabled (0x00)
        Number of sets: 1 (0x01)
        Entry 0
          Handle: 0x00
          Duration: 0 ms (0x00)
          Max ext adv events: 0
> ACL Data RX: Handle 21 flags 0x02 dlen 13                                                                         #114 8.501634
      ATT: Find By Type Value Request (0x06) len 8
        Handle range: 0x0001-0xffff
        Attribute type: Primary Service (0x2800)
          UUID: Coordinated Set Identification (0x1846)
> HCI Event: Command Complete (0x0e) plen 4                                                                         #115 8.501743
      LE Set Extended Advertising Enable (0x08|0x0039) ncmd 1
        Status: Success (0x00)
zephyr.exe[2143091]: < HCI Command: LE Add Device To Resolving List (0x08|0x0027) plen 39                           #116 8.520908
        Address type: Public (0x00)
        Address: C0:07:E8:2C:B6:EE (OUI C0-07-E8)
        Peer identity resolving key[16]: 94c7b641ca22f5da3e4a2f549c0b936e
        Local identity resolving key[16]: 08aad2e1be87e47b88aeb19de6889efb
> HCI Event: Command Complete (0x0e) plen 4                                                                         #117 8.521784
      LE Add Device To Resolving List (0x08|0x0027) ncmd 1
        Status: Success (0x00)
zephyr.exe[2143091]: < HCI Command: LE Set Privacy Mode (0x08|0x004e) plen 8                                        #118 8.540994
        Peer Identity address type: Public (0x00)
        Peer Identity address: C0:07:E8:2C:B6:EE (OUI C0-07-E8)
        Privacy Mode: Use Device Privacy (0x01)
> HCI Event: Command Complete (0x0e) plen 4                                                                         #119 8.541571
      LE Set Privacy Mode (0x08|0x004e) ncmd 1
        Status: Success (0x00)
zephyr.exe[2143091]: < HCI Command: LE Set Address Resolution Enable (0x08|0x002d) plen 1                           #120 8.560935
        Address resolution: Enabled (0x01)
> HCI Event: Command Complete (0x0e) plen 4                                                                         #121 8.561377
      LE Set Address Resolution Enable (0x08|0x002d) ncmd 1
        Status: Success (0x00)
zephyr.exe[2143091]: < HCI Command: LE Set Extended Advertising Enable (0x08|0x0039) plen 6                         #122 8.580946
        Extended advertising: Enabled (0x01)
        Number of sets: 1 (0x01)
        Entry 0
          Handle: 0x00
          Duration: 0 ms (0x00)
          Max ext adv events: 0
> HCI Event: Command Complete (0x0e) plen 4                                                                         #123 8.581589
      LE Set Extended Advertising Enable (0x08|0x0039) ncmd 1
        Status: Success (0x00)
zephyr.exe[2143091]: < HCI Command: Host Number of Completed Packets (0x03|0x0035) plen 5                           #124 8.600909
        Num handles: 1
        Handle: 21 Address: C0:07:E8:2C:B6:EE (OUI C0-07-E8)
        Count: 1
zephyr.exe[2143091]: < HCI Command: Host Number of Completed Packets (0x03|0x0035) plen 5                           #125 8.600976
        Num handles: 1
        Handle: 21 Address: C0:07:E8:2C:B6:EE (OUI C0-07-E8)
        Count: 1
zephyr.exe[2143091]: < ACL Data TX: Handle 21 [1/3] flags 0x00 dlen 11                                              #126 8.600986
      ATT: Read By Type Request (0x08) len 6
        Handle range: 0x0001-0xffff
        Attribute type: Central Address Resolution (0x2aa6)
zephyr.exe[2143091]: < HCI Command: Host Number of Completed Packets (0x03|0x0035) plen 5                           #127 8.600999
        Num handles: 1
        Handle: 21 Address: C0:07:E8:2C:B6:EE (OUI C0-07-E8)
        Count: 1
zephyr.exe[2143091]: < ACL Data TX: Handle 21 [2/3] flags 0x00 dlen 9                                               #128 8.601008
      ATT: Find By Type Value Response (0x07) len 4
        Handle range: 0x0026-0x002f
> HCI Event: Number of Completed Packets (0x13) plen 5                                                              #129 8.619400
        Num handles: 1
        Handle: 21 Address: C0:07:E8:2C:B6:EE (OUI C0-07-E8)
        Count: 1
        Buffers: 1/3
        #126: len 11 (4 Kb/s)
        Latency: 18 msec (18-123 msec ~58 msec)
> HCI Event: Number of Completed Packets (0x13) plen 5                                                              #130 8.681587
        Num handles: 1
        Handle: 21 Address: C0:07:E8:2C:B6:EE (OUI C0-07-E8)
        Count: 1
        Buffers: 0/3
        #128: len 9 (0 Kb/s)
        Latency: 80 msec (18-123 msec ~69 msec)
> ACL Data RX: Handle 21 flags 0x02 dlen 9                                                                          #131 8.681764
      ATT: Read By Type Response (0x09) len 4
        Attribute data length: 3
        Attribute data list: 1 entry
        Handle: 0x000f
        Value[1]: 01
> ACL Data RX: Handle 21 flags 0x02 dlen 13                                                                         #132 8.682092
      ATT: Find By Type Value Request (0x06) len 8
        Handle range: 0x0030-0xffff
        Attribute type: Primary Service (0x2800)
          UUID: Coordinated Set Identification (0x1846)
zephyr.exe[2143091]: < HCI Command: Host Number of Completed Packets (0x03|0x0035) plen 5                           #133 8.700981
        Num handles: 1
        Handle: 21 Address: C0:07:E8:2C:B6:EE (OUI C0-07-E8)
        Count: 1
zephyr.exe[2143091]: < HCI Command: Host Number of Completed Packets (0x03|0x0035) plen 5                           #134 8.700988
        Num handles: 1
        Handle: 21 Address: C0:07:E8:2C:B6:EE (OUI C0-07-E8)
        Count: 1
zephyr.exe[2143091]: < ACL Data TX: Handle 21 [1/3] flags 0x00 dlen 9                                               #135 8.700988
      ATT: Error Response (0x01) len 4
        Find By Type Value Request (0x06)
        Handle: 0x0030
        Error: Attribute Not Found (0x0a)
> HCI Event: Number of Completed Packets (0x13) plen 5                                                              #136 8.806709
        Num handles: 1
        Handle: 21 Address: C0:07:E8:2C:B6:EE (OUI C0-07-E8)
        Count: 1
        Buffers: 0/3
        #135: len 9 (0 Kb/s)
        Latency: 105 msec (18-123 msec ~87 msec)
> ACL Data RX: Handle 21 flags 0x02 dlen 11                                                                         #137 8.806883
      ATT: Read By Type Request (0x08) len 6
        Handle range: 0x0026-0x002f
        Attribute type: Characteristic (0x2803)
zephyr.exe[2143091]: < HCI Command: Host Number of Completed Packets (0x03|0x0035) plen 5                           #138 8.820975
        Num handles: 1
        Handle: 21 Address: C0:07:E8:2C:B6:EE (OUI C0-07-E8)
        Count: 1
zephyr.exe[2143091]: < ACL Data TX: Handle 21 [1/3] flags 0x00 dlen 20                                              #139 8.821003
      ATT: Read By Type Response (0x09) len 15
        Attribute data len