Bluetooth monitor ver 5.72
btmon[476760]: = Note: Linux version 6.14.0-36-generic (x86_64)                                                          0.527958
btmon[476760]: = Note: Bluetooth subsystem version 2.22                                                                  0.527960
= New Index: 00:00:00:00:00:00 (Primary,UART,hci1)                                                                       0.527961
= New Index: 48:5F:99:8E:E0:64 (Primary,USB,hci0)                                                                        0.527961
= Open Index: 00:00:00:00:00:00                                                                                          1.041690
= Index Info: 00:00:00:00:00:00 (Nordic Semiconductor ASA)                                                               1.041704
zephyr.exe[476762]: @ USER Open: main (privileged) version 2.22                                                 {0x0001} 1.041713
zephyr.exe[476762]: < HCI Command: Reset (0x03|0x0003) plen 0                                                         #1 1.042965
> HCI Event: Command Complete (0x0e) plen 4                                                                           #2 1.043621
      Reset (0x03|0x0003) ncmd 1
        Status: Success (0x00)
zephyr.exe[476762]: < HCI Command: Read Local Supported Features (0x04|0x0003) plen 0                                 #3 1.061117
> HCI Event: Command Complete (0x0e) plen 12                                                                          #4 1.061575
      Read Local Supported Features (0x04|0x0003) ncmd 1
        Status: Success (0x00)
        Features: 0x00 0x00 0x00 0x00 0x60 0x00 0x00 0x00
          BR/EDR Not Supported
          LE Supported (Controller)
zephyr.exe[476762]: < HCI Command: Read Local Version Information (0x04|0x0001) plen 0                                #5 1.081108
> HCI Event: Command Complete (0x0e) plen 12                                                                          #6 1.081688
      Read Local Version Information (0x04|0x0001) ncmd 1
        Status: Success (0x00)
        HCI version: Reserved (0x0e) - Revision 12520 (0x30e8)
        LMP version: Reserved (0x0e) - Subversion 12520 (0x30e8)
        Manufacturer: Nordic Semiconductor ASA (89)
zephyr.exe[476762]: < HCI Command: Read Local Supported Commands (0x04|0x0002) plen 0                                 #7 1.101113
> HCI Event: Command Complete (0x0e) plen 68                                                                          #8 1.102191
      Read Local Supported Commands (0x04|0x0002) ncmd 1
        Status: Success (0x00)
        Commands: 119 entries
          Disconnect (Octet 0 - Bit 5)
          Read Remote Version Information (Octet 2 - Bit 7)
          Set Event Mask (Octet 5 - Bit 6)
          Reset (Octet 5 - Bit 7)
          Read Connection Accept Timeout (Octet 7 - Bit 2)
          Write Connection Accept Timeout (Octet 7 - Bit 3)
          Read Transmit Power Level (Octet 10 - Bit 2)
          Set Controller To Host Flow Control (Octet 10 - Bit 5)
          Host Buffer Size (Octet 10 - Bit 6)
          Host Number of Completed Packets (Octet 10 - Bit 7)
          Read Local Version Information (Octet 14 - Bit 3)
          Read Local Supported Features (Octet 14 - Bit 5)
          Read BD ADDR (Octet 15 - Bit 1)
          Read RSSI (Octet 15 - Bit 5)
          Set Event Mask Page 2 (Octet 22 - Bit 2)
          LE Set Event Mask (Octet 25 - Bit 0)
          LE Read Buffer Size (Octet 25 - Bit 1)
          LE Read Local Supported Features (Octet 25 - Bit 2)
          LE Set Random Address (Octet 25 - Bit 4)
          LE Set Advertising Parameters (Octet 25 - Bit 5)
          LE Read Advertising Channel TX Power (Octet 25 - Bit 6)
          LE Set Advertising Data (Octet 25 - Bit 7)
          LE Set Scan Response Data (Octet 26 - Bit 0)
          LE Set Advertise Enable (Octet 26 - Bit 1)
          LE Set Scan Parameters (Octet 26 - Bit 2)
          LE Set Scan Enable (Octet 26 - Bit 3)
          LE Create Connection (Octet 26 - Bit 4)
          LE Create Connection Cancel (Octet 26 - Bit 5)
          LE Read Accept List Size (Octet 26 - Bit 6)
          LE Clear Accept List (Octet 26 - Bit 7)
          LE Add Device To Accept List (Octet 27 - Bit 0)
          LE Remove Device From Accept List (Octet 27 - Bit 1)
          LE Connection Update (Octet 27 - Bit 2)
          LE Set Host Channel Classification (Octet 27 - Bit 3)
          LE Read Channel Map (Octet 27 - Bit 4)
          LE Read Remote Used Features (Octet 27 - Bit 5)
          LE Encrypt (Octet 27 - Bit 6)
          LE Rand (Octet 27 - Bit 7)
          LE Start Encryption (Octet 28 - Bit 0)
          LE Long Term Key Request Reply (Octet 28 - Bit 1)
          LE Long Term Key Request Neg Reply (Octet 28 - Bit 2)
          LE Read Supported States (Octet 28 - Bit 3)
          LE Receiver Test (Octet 28 - Bit 4)
          LE Transmitter Test (Octet 28 - Bit 5)
          LE Test End (Octet 28 - Bit 6)
          Read Authenticated Payload Timeout (Octet 32 - Bit 4)
          Write Authenticated Payload Timeout (Octet 32 - Bit 5)
          LE Set Data Length (Octet 33 - Bit 6)
          LE Read Suggested Default Data Length (Octet 33 - Bit 7)
          LE Write Suggested Default Data Length (Octet 34 - Bit 0)
          LE Add Device To Resolving List (Octet 34 - Bit 3)
          LE Remove Device From Resolving List (Octet 34 - Bit 4)
          LE Clear Resolving List (Octet 34 - Bit 5)
          LE Read Resolving List Size (Octet 34 - Bit 6)
          LE Set Address Resolution Enable (Octet 35 - Bit 1)
          LE Set Resolvable Private Address Timeout (Octet 35 - Bit 2)
          LE Read Maximum Data Length (Octet 35 - Bit 3)
          LE Read PHY (Octet 35 - Bit 4)
          LE Set Default PHY (Octet 35 - Bit 5)
          LE Set PHY (Octet 35 - Bit 6)
          LE Enhanced Receiver Test (Octet 35 - Bit 7)
          LE Enhanced Transmitter Test (Octet 36 - Bit 0)
          LE Set Advertising Set Random Address (Octet 36 - Bit 1)
          LE Set Extended Advertising Parameters (Octet 36 - Bit 2)
          LE Set Extended Advertising Data (Octet 36 - Bit 3)
          LE Set Extended Scan Response Data (Octet 36 - Bit 4)
          LE Set Extended Advertising Enable (Octet 36 - Bit 5)
          LE Read Maximum Advertising Data Length (Octet 36 - Bit 6)
          LE Read Number of Supported Advertising Sets (Octet 36 - Bit 7)
          LE Remove Advertising Set (Octet 37 - Bit 0)
          LE Clear Advertising Sets (Octet 37 - Bit 1)
          LE Set Periodic Advertising Parameters (Octet 37 - Bit 2)
          LE Set Periodic Advertising Data (Octet 37 - Bit 3)
          LE Set Periodic Advertising Enable (Octet 37 - Bit 4)
          LE Set Extended Scan Parameters (Octet 37 - Bit 5)
          LE Set Extended Scan Enable (Octet 37 - Bit 6)
          LE Extended Create Connection (Octet 37 - Bit 7)
          LE Periodic Advertising Create Sync (Octet 38 - Bit 0)
          LE Periodic Advertising Create Sync Cancel (Octet 38 - Bit 1)
          LE Periodic Advertising Terminate Sync (Octet 38 - Bit 2)
          LE Add Device To Periodic Advertiser List (Octet 38 - Bit 3)
          LE Remove Device From Periodic Advertiser List (Octet 38 - Bit 4)
          LE Clear Periodic Advertiser List (Octet 38 - Bit 5)
          LE Read Periodic Advertiser List Size (Octet 38 - Bit 6)
          LE Read Transmit Power (Octet 38 - Bit 7)
          LE Read RF Path Compensation (Octet 39 - Bit 0)
          LE Write RF Path Compensation (Octet 39 - Bit 1)
          LE Set Privacy Mode (Octet 39 - Bit 2)
          LE Periodic Advertising Receive Enable (Octet 40 - Bit 5)
          LE Periodic Advertising Sync Transfer (Octet 40 - Bit 6)
          LE Periodic Advertising Set Info Transfer (Octet 40 - Bit 7)
          LE Periodic Advertising Sync Transfer Parameters (Octet 41 - Bit 0)
          LE Set Default Periodic Advertisng Sync Transfer Parameters (Octet 41 - Bit 1)
          LE Read Buffer v2 (Octet 41 - Bit 5)
          LE Read ISO TX Sync (Octet 41 - Bit 6)
          LE Set Connected Isochronous Group Parameters (Octet 41 - Bit 7)
          LE Set Connected Isochronous Group Parameters Test (Octet 42 - Bit 0)
          LE Create Connected Isochronous Stream (Octet 42 - Bit 1)
          LE Remove Connected Isochronous Group (Octet 42 - Bit 2)
          LE Accept Connected Isochronous Stream Request (Octet 42 - Bit 3)
          LE Reject Connected Isochronous Stream Request (Octet 42 - Bit 4)
          LE Create Broadcast Isochronous Group (Octet 42 - Bit 5)
          LE Create Broadcast Isochronous Group Test (Octet 42 - Bit 6)
          LE Terminate Broadcast Isochronous Group (Octet 42 - Bit 7)
          LE Broadcast Isochronous Group Create Sync (Octet 43 - Bit 0)
          LE Broadcast Isochronous Group Terminate Sync (Octet 43 - Bit 1)
          LE Request Peer SCA (Octet 43 - Bit 2)
          LE Setup Isochronous Data Path (Octet 43 - Bit 3)
          LE Remove Isochronous Data Path (Octet 43 - Bit 4)
          LE Isochronous Transmit Test (Octet 43 - Bit 5)
          LE Isochronous Receive Test (Octet 43 - Bit 6)
          LE Isochronous Read Test Counters (Octet 43 - Bit 7)
          LE Isochronous Read Test Counters (Octet 44 - Bit 0)
          LE Set Host Feature (Octet 44 - Bit 1)
          Octet 44 - Bit 2 
          Octet 45 - Bit 6 
          Octet 46 - Bit 0 
          Octet 46 - Bit 1 
          Octet 46 - Bit 2 
zephyr.exe[476762]: < HCI Command: Host Buffer Size (0x03|0x0033) plen 7                                              #9 1.121113
        ACL MTU: 255  ACL max packet: 16
        SCO MTU: 0    SCO max packet: 0
> HCI Event: Command Complete (0x0e) plen 4                                                                          #10 1.121603
      Host Buffer Size (0x03|0x0033) ncmd 1
        Status: Success (0x00)
zephyr.exe[476762]: < HCI Command: Set Controller To Host Flow Control (0x03|0x0031) plen 1                          #11 1.141118
        Flow control: ACL Data Packets (0x01)
> HCI Event: Command Complete (0x0e) plen 4                                                                          #12 1.141493
      Set Controller To Host Flow Control (0x03|0x0031) ncmd 1
        Status: Success (0x00)
zephyr.exe[476762]: < HCI Command: LE Read Local Supported Features (0x08|0x0003) plen 0                             #13 1.161116
> HCI Event: Command Complete (0x0e) plen 12                                                                         #14 1.161705
      LE Read Local Supported Features (0x08|0x0003) ncmd 1
        Status: Success (0x00)
        Features: 0xfd 0x79 0x00 0xf7 0x30 0x01 0x00 0x00
          LE Encryption
          Extended Reject Indication
          Peripheral-initiated Features Exchange
          LE Ping
          LE Data Packet Length Extension
          LL Privacy
          Extended Scanner Filter Policies
          LE 2M PHY
          LE Coded PHY
          LE Extended Advertising
          LE Periodic Advertising
          Channel Selection Algorithm #2
          Periodic Advertising Sync Transfer - Sender
          Periodic Advertising Sync Transfer - Recipient
          Sleep Clock Accuracy Updates
          Connected Isochronous Stream - Central
          Connected Isochronous Stream - Peripheral
          Isochronous Broadcaster
          Synchronized Receiver
          Periodic Advertising ADI support
          Connection Subrating
          Unknown features (0x0000010000000000)
zephyr.exe[476762]: < HCI Command: LE Set Host Feature (0x08|0x0074) plen 2                                          #15 1.181102
        Bit Number: 32
          Connected Isochronous Stream (Host Support)
        Bit Value: 1
> HCI Event: Command Complete (0x0e) plen 4                                                                          #16 1.181490
      LE Set Host Feature (0x08|0x0074) ncmd 1
        Status: Success (0x00)
zephyr.exe[476762]: < HCI Command: LE Read Buffer v2 (0x08|0x0060) plen 0                                            #17 1.201106
> HCI Event: Command Complete (0x0e) plen 10                                                                         #18 1.201610
      LE Read Buffer v2 (0x08|0x0060) ncmd 1
        Status: Success (0x00)
        ACL MTU: 27
        ACL max packet: 3
        ISO MTU: 318
        ISO max packet: 3
zephyr.exe[476762]: < HCI Command: LE Read Maximum Advertising Data Length (0x08|0x003a) plen 0                      #19 1.221135
> HCI Event: Command Complete (0x0e) plen 6                                                                          #20 1.221592
      LE Read Maximum Advertising Data Length (0x08|0x003a) ncmd 1
        Status: Success (0x00)
        Max length: 1650
zephyr.exe[476762]: < HCI Command: LE Read Supported States (0x08|0x001c) plen 0                                     #21 1.241118
> HCI Event: Command Complete (0x0e) plen 12                                                                         #22 1.241580
      LE Read Supported States (0x08|0x001c) ncmd 1
        Status: Success (0x00)
        States: 0x000003ff3e0306ff
          Non-connectable Advertising State
          Scannable Advertising State
          Connectable Advertising State
          High Duty Cycle Directed Advertising State
          Passive Scanning State
          Active Scanning State
          Initiating State
            and Connection State (Central Role)
          Connection State (Peripheral Role)
          Scannable Advertising State
            and Passive Scanning State
          Connectable Advertising State
            and Passive Scanning State
          Non-connectable Advertising State
            and Initiating State
          Scannable Advertising State
            and Initiating State
          Active Scanning State
            and Connection State (Central Role)
          Passive Scanning State
            and Connection State (Peripheral Role)
          Active Scanning State
            and Connection State (Peripheral Role)
          Initiating State
            and Connection State (Central Role)
            and Central Role & Central Role
          Low Duty Cycle Directed Advertising State
          Connectable Advertising State
            and Initiating State
            and Central Role & Peripheral Role
          High Duty Cycle Directed Advertising State
            and Initiating State
            and Central Role & Peripheral Role
          Low Duty Cycle Directed Advertising State
            and Initiating State
            and Central Role & Peripheral Role
          Connectable Advertising State
            and Connection State (Central Role)
            and Central Role & Peripheral Role
          High Duty Cycle Directed Advertising State
            and Connection State (Central Role)
            and Central Role & Peripheral Role
          Low Duty Cycle Directed Advertising State
            and Connection State (Central Role)
            and Central Role & Peripheral Role
          Connectable Advertising State
            and Connection State (Peripheral Role)
            and Central Role & Peripheral Role
          High Duty Cycle Directed Advertising State
            and Connection State (Peripheral Role)
            and Peripheral Role & Peripheral Role
          Low Duty Cycle Directed Advertising State
            and Connection State (Peripheral Role)
            and Peripheral Role & Peripheral Role
          Initiating State
            and Connection State (Peripheral Role)
            and Central Role & Peripheral Role
zephyr.exe[476762]: < HCI Command: LE Read Maximum Data Length (0x08|0x002f) plen 0                                  #23 1.261059
> HCI Event: Command Complete (0x0e) plen 12                                                                         #24 1.261623
      LE Read Maximum Data Length (0x08|0x002f) ncmd 1
        Status: Success (0x00)
        Max TX octets: 251
        Max TX time: 2704
        Max RX octets: 251
        Max RX time: 2704
zephyr.exe[476762]: < HCI Command: LE Write Suggested Default Data Length (0x08|0x0024) plen 4                       #25 1.281104
        TX octets: 251
        TX time: 2704
> HCI Event: Command Complete (0x0e) plen 4                                                                          #26 1.281645
      LE Write Suggested Default Data Length (0x08|0x0024) ncmd 1
        Status: Success (0x00)
zephyr.exe[476762]: < HCI Command: LE Read Resolving List Size (0x08|0x002a) plen 0                                  #27 1.301112
> HCI Event: Command Complete (0x0e) plen 5                                                                          #28 1.301554
      LE Read Resolving List Size (0x08|0x002a) ncmd 1
        Status: Success (0x00)
        Size: 8
zephyr.exe[476762]: < HCI Command: LE Set Event Mask (0x08|0x0001) plen 8                                            #29 1.321102
        Mask: 0x000002023f87fa5e
          LE Advertising Report
          LE Connection Update Complete
          LE Read Remote Used Features Complete
          LE Long Term Key Request
          LE Data Length Change
          LE Enhanced Connection Complete
          LE PHY Update Complete
          LE Extended Advertising Report
          LE Periodic Advertising Sync Established
          LE Periodic Advertising Report
          LE Periodic Advertising Sync Lost
          LE Extended Scan Timeout
          LE Extended Advertising Set Terminated
          LE Scan Request Received
          LE Periodic Advertising Sync Transfer Rvc
          LE CIS Established
          LE CIS Request
          LE Create BIG Complete
          LE Terminate BIG Complete
          LE BIG Sync Estabilished Complete
          LE BIG Sync Lost
          LE BIG Info Advertising Report
          Unknown mask (0x0000020000000000)
> HCI Event: Command Complete (0x0e) plen 4                                                                          #30 1.321760
      LE Set Event Mask (0x08|0x0001) ncmd 1
        Status: Success (0x00)
zephyr.exe[476762]: < HCI Command: Set Event Mask (0x03|0x0001) plen 8                                               #31 1.341095
        Mask: 0x2000800002008890
          Disconnection Complete
          Encryption Change
          Read Remote Version Information Complete
          Hardware Error
          Data Buffer Overflow
          Encryption Key Refresh Complete
          LE Meta
> HCI Event: Command Complete (0x0e) plen 4                                                                          #32 1.341652
      Set Event Mask (0x03|0x0001) ncmd 1
        Status: Success (0x00)
zephyr.exe[476762]: < HCI Command: Read BD ADDR (0x04|0x0009) plen 0                                                 #33 1.361113
> HCI Event: Command Complete (0x0e) plen 10                                                                         #34 1.361622
      Read BD ADDR (0x04|0x0009) ncmd 1
        Status: Success (0x00)
        Address: 00:00:00:00:00:00 (OUI 00-00-00)
zephyr.exe[476762]: < HCI Command: LE Set Random Address (0x08|0x0005) plen 6                                        #35 1.381101
        Address: D5:B6:CC:31:DB:3B (Static)
> HCI Event: Command Complete (0x0e) plen 4                                                                          #36 1.381685
      LE Set Random Address (0x08|0x0005) ncmd 1
        Status: Success (0x00)
zephyr.exe[476762]: < HCI Command: LE Set Random Address (0x08|0x0005) plen 6                                        #37 5.031011
        Address: 26:66:F9:08:61:8E (Non-Resolvable)
> HCI Event: Command Complete (0x0e) plen 4                                                                          #38 5.031609
      LE Set Random Address (0x08|0x0005) ncmd 1
        Status: Success (0x00)
zephyr.exe[476762]: < HCI Command: LE Set Extended Scan Parameters (0x08|0x0041) plen 8                              #39 5.040962
        Own address type: Random (0x01)
        Filter policy: Accept all advertisement (0x00)
        PHYs: 0x01
        Entry 0: LE 1M
          Type: Active (0x01)
          Interval: 60.000 msec (0x0060)
          Window: 30.000 msec (0x0030)
> HCI Event: Command Complete (0x0e) plen 4                                                                          #40 5.041456
      LE Set Extended Scan Parameters (0x08|0x0041) ncmd 1
        Status: Success (0x00)
zephyr.exe[476762]: < HCI Command: LE Set Extended Scan Enable (0x08|0x0042) plen 6                                  #41 5.061048
        Extended scan: Enabled (0x01)
        Filter duplicates: Enabled (0x01)
        Duration: 0 msec (0x0000)
        Period: 0.00 sec (0x0000)
> HCI Event: Command Complete (0x0e) plen 4                                                                          #42 5.061581
      LE Set Extended Scan Enable (0x08|0x0042) ncmd 1
        Status: Success (0x00)
> HCI Event: LE Meta Event (0x3e) plen 55                                                                            #43 5.072356
      LE Extended Advertising Report (0x0d)
        Num reports: 1
        Entry 0
          Event type: 0x0010
            Props: 0x0010
              Use legacy advertising PDUs
            Data status: [0;32mComplete[0m
          Legacy PDU Type: ADV_NONCONN_IND (0x0010)
          Address type: Random (0x01)
          Address: 1D:97:95:F6:43:29 (Non-Resolvable)
          Primary PHY: LE 1M
          Secondary PHY: No packets
          SID: no ADI field (0xff)
          TX power: 127 dBm
          RSSI: -80 dBm (0xb0)
          Periodic advertising interval: 0.00 msec (0x0000)
          Direct address type: Reserved (0xff)
          Direct address: 00-00-00-00-00-00
          Data length: 0x1d
        1c ff 06 00 01 09 21 0a 4d e0 8a 52 d2 d4 4c 41  ......!.M..R..LA
        50 54 4f 50 2d 45 35 32 45 4f 44 32 49           PTOP-E52EOD2I   
        Company: Microsoft (6)
          Data: 0109210a4de08a52d2d44c4150544f502d453532454f443249
> HCI Event: LE Meta Event (0x3e) plen 54                                                                            #44 5.145380
      LE Extended Advertising Report (0x0d)
        Num reports: 1
        Entry 0
          Event type: 0x0010
            Props: 0x0010
              Use legacy advertising PDUs
            Data status: [0;32mComplete[0m
          Legacy PDU Type: ADV_NONCONN_IND (0x0010)
          Address type: Public (0x00)
          Address: A4:30:7A:95:74:FB (Samsung Electronics Co.,Ltd)
          Primary PHY: LE 1M
          Secondary PHY: No packets
          SID: no ADI field (0xff)
          TX power: 127 dBm
          RSSI: -77 dBm (0xb3)
          Periodic advertising interval: 0.00 msec (0x0000)
          Direct address type: Reserved (0xff)
          Direct address: 00-00-00-00-00-00
          Data length: 0x1c
        1b ff 75 00 42 04 01 80 6e a4 30 7a 95 74 fb a6  ..u.B...n.0z.t..
        30 7a 95 74 fa 01 d8 41 c5 d9 00 00              0z.t...A....    
        Company: Samsung Electronics Co. Ltd. (117)
          Data: 420401806ea4307a9574fba6307a9574fa01d841c5d90000
> HCI Event: LE Meta Event (0x3e) plen 51                                                                            #45 5.316914
      LE Extended Advertising Report (0x0d)
        Num reports: 1
        Entry 0
          Event type: 0x0013
            Props: 0x0013
              Connectable
              Scannable
              Use legacy advertising PDUs
            Data status: [0;32mComplete[0m
          Legacy PDU Type: ADV_IND (0x0013)
          Address type: Public (0x00)
          Address: F0:18:98:96:04:94 (Apple, Inc.)
          Primary PHY: LE 1M
          Secondary PHY: No packets
          SID: no ADI field (0xff)
          TX power: 127 dBm
          RSSI: -94 dBm (0xa2)
          Periodic advertising interval: 0.00 msec (0x0000)
          Direct address type: Reserved (0xff)
          Direct address: 00-00-00-00-00-00
          Data length: 0x19
        02 01 06 11 07 00 00 00 00 00 00 00 00 00 00 00  ................
        00 00 01 31 5a 03 09 7a 6d                       ...1Z..zm       
        Flags: 0x06
          LE General Discoverable Mode
          BR/EDR Not Supported
        128-bit Service UUIDs (complete): 1 entry
          Vendor specific
        Name (complete): zm
> HCI Event: LE Meta Event (0x3e) plen 55                                                                            #46 5.389378
      LE Extended Advertising Report (0x0d)
        Num reports: 1
        Entry 0
          Event type: 0x0010
            Props: 0x0010
              Use legacy advertising PDUs
            Data status: [0;32mComplete[0m
          Legacy PDU Type: ADV_NONCONN_IND (0x0010)
          Address type: Random (0x01)
          Address: 1D:97:95:F6:43:29 (Non-Resolvable)
          Primary PHY: LE 1M
          Secondary PHY: No packets
          SID: no ADI field (0xff)
          TX power: 127 dBm
          RSSI: -81 dBm (0xaf)
          Periodic advertising interval: 0.00 msec (0x0000)
          Direct address type: Reserved (0xff)
          Direct address: 00-00-00-00-00-00
          Data length: 0x1d
        1c ff 06 00 01 09 21 0a 4d e0 8a 52 d2 d4 4c 41  ......!.M..R..LA
        50 54 4f 50 2d 45 35 32 45 4f 44 32 49           PTOP-E52EOD2I   
        Company: Microsoft (6)
          Data: 0109210a4de08a52d2d44c4150544f502d453532454f443249
> HCI Event: LE Meta Event (0x3e) plen 38                                                                            #47 5.429120
      LE Extended Advertising Report (0x0d)
        Num reports: 1
        Entry 0
          Event type: 0x0012
            Props: 0x0012
              Scannable
              Use legacy advertising PDUs
            Data status: [0;32mComplete[0m
          Legacy PDU Type: ADV_SCAN_IND (0x0012)
          Address type: Random (0x01)
          Address: 6F:CA:E8:51:CB:18 (Resolvable)
          Primary PHY: LE 1M
          Secondary PHY: No packets
          SID: no ADI field (0xff)
          TX power: 127 dBm
          RSSI: -83 dBm (0xad)
          Periodic advertising interval: 0.00 msec (0x0000)
          Direct address type: Reserved (0xff)
          Direct address: 00-00-00-00-00-00
          Data length: 0x0c
        0b ff 4c 00 09 06 03 00 0a 03 07 11              ..L.........    
        Company: Apple, Inc. (76)
          Type: Apple TV (9)
          Data: 03000a030711
> HCI Event: LE Meta Event (0x3e) plen 26                                                                            #48 5.429560
      LE Extended Advertising Report (0x0d)
        Num reports: 1
        Entry 0
          Event type: 0x001a
            Props: 0x001a
              Scannable
              Scan response
              Use legacy advertising PDUs
            Data status: [0;32mComplete[0m
          Legacy PDU Type: SCAN_RSP to an ADV_IND (0x001a)
          Address type: Random (0x01)
          Address: 6F:CA:E8:51:CB:18 (Resolvable)
          Primary PHY: LE 1M
          Secondary PHY: No packets
          SID: no ADI field (0xff)
          TX power: 127 dBm
          RSSI: -83 dBm (0xad)
          Periodic advertising interval: 0.00 msec (0x0000)
          Direct address type: Reserved (0xff)
          Direct address: 00-00-00-00-00-00
          Data length: 0x00
> HCI Event: LE Meta Event (0x3e) plen 55                                                                            #49 5.496673
      LE Extended Advertising Report (0x0d)
        Num reports: 1
        Entry 0
          Event type: 0x0010
            Props: 0x0010
              Use legacy advertising PDUs
            Data status: [0;32mComplete[0m
          Legacy PDU Type: ADV_NONCONN_IND (0x0010)
          Address type: Random (0x01)
          Address: 1D:97:95:F6:43:29 (Non-Resolvable)
          Primary PHY: LE 1M
          Secondary PHY: No packets
          SID: no ADI field (0xff)
          TX power: 127 dBm
          RSSI: -90 dBm (0xa6)
          Periodic advertising interval: 0.00 msec (0x0000)
          Direct address type: Reserved (0xff)
          Direct address: 00-00-00-00-00-00
          Data length: 0x1d
        1c ff 06 00 01 09 21 0a 4d e0 8a 52 d2 d4 4c 41  ......!.M..R..LA
        50 54 4f 50 2d 45 35 32 45 4f 44 32 49           PTOP-E52EOD2I   
        Company: Microsoft (6)
          Data: 0109210a4de08a52d2d44c4150544f502d453532454f443249
> HCI Event: LE Meta Event (0x3e) plen 38                                                                            #50 5.559707
      LE Extended Advertising Report (0x0d)
        Num reports: 1
        Entry 0
          Event type: 0x0012
            Props: 0x0012
              Scannable
              Use legacy advertising PDUs
            Data status: [0;32mComplete[0m
          Legacy PDU Type: ADV_SCAN_IND (0x0012)
          Address type: Random (0x01)
          Address: 6F:CA:E8:51:CB:18 (Resolvable)
          Primary PHY: LE 1M
          Secondary PHY: No packets
          SID: no ADI field (0xff)
          TX power: 127 dBm
          RSSI: -89 dBm (0xa7)
          Periodic advertising interval: 0.00 msec (0x0000)
          Direct address type: Reserved (0xff)
          Direct address: 00-00-00-00-00-00
          Data length: 0x0c
        0b ff 4c 00 09 06 03 00 0a 03 07 11              ..L.........    
        Company: Apple, Inc. (76)
          Type: Apple TV (9)
          Data: 03000a030711
> HCI Event: LE Meta Event (0x3e) plen 26                                                                            #51 5.560143
      LE Extended Advertising Report (0x0d)
        Num reports: 1
        Entry 0
          Event type: 0x001a
            Props: 0x001a
              Scannable
              Scan response
              Use legacy advertising PDUs
            Data status: [0;32mComplete[0m
          Legacy PDU Type: SCAN_RSP to an ADV_IND (0x001a)
          Address type: Random (0x01)
          Address: 6F:CA:E8:51:CB:18 (Resolvable)
          Primary PHY: LE 1M
          Secondary PHY: No packets
          SID: no ADI field (0xff)
          TX power: 127 dBm
          RSSI: -89 dBm (0xa7)
          Periodic advertising interval: 0.00 msec (0x0000)
          Direct address type: Reserved (0xff)
          Direct address: 00-00-00-00-00-00
          Data length: 0x00
> HCI Event: LE Meta Event (0x3e) plen 54                                                                            #52 5.624762
      LE Extended Advertising Report (0x0d)
        Num reports: 1
        Entry 0
          Event type: 0x0010
            Props: 0x0010
              Use legacy advertising PDUs
            Data status: [0;32mComplete[0m
          Legacy PDU Type: ADV_NONCONN_IND (0x0010)
          Address type: Public (0x00)
          Address: A4:30:7A:95:74:FB (Samsung Electronics Co.,Ltd)
          Primary PHY: LE 1M
          Secondary PHY: No packets
          SID: no ADI field (0xff)
          TX power: 127 dBm
          RSSI: -83 dBm (0xad)
          Periodic advertising interval: 0.00 msec (0x0000)
          Direct address type: Reserved (0xff)
          Direct address: 00-00-00-00-00-00
          Data length: 0x1c
        1b ff 75 00 42 04 01 80 6e a4 30 7a 95 74 fb a6  ..u.B...n.0z.t..
        30 7a 95 74 fa 01 d8 41 c5 d9 00 00              0z.t...A....    
        Company: Samsung Electronics Co. Ltd. (117)
          Data: 420401806ea4307a9574fba6307a9574fa01d841c5d90000
> HCI Event: LE Meta Event (0x3e) plen 47                                                                            #53 5.789316
      LE Extended Advertising Report (0x0d)
        Num reports: 1
        Entry 0
          Event type: 0x0000
            Props: 0x0000
            Data status: [0;32mComplete[0m
          Address type: Public (0x00)
          Address: DF:A9:FF:F6:B1:1A (OUI DF-A9-FF)
          Primary PHY: LE 1M
          Secondary PHY: LE 1M
          SID: 0x00
          TX power: 127 dBm
          RSSI: -17 dBm (0xef)
          Periodic advertising interval: 750.00 msec (0x0258)
          Direct address type: Reserved (0xff)
          Direct address: 00-00-00-00-00-00
          Data length: 0x15
        06 16 52 18 f5 41 7b 0d 09 50 54 53 2d 42 41 50  ..R..A{..PTS-BAP
        2d 42 31 31 41                                   -B11A           
        Service Data: Broadcast Audio Announcement (0x1852)
        Broadcast ID: 8077813 (0x7b41f5)
        Name (complete): PTS-BAP-B11A
> HCI Event: LE Meta Event (0x3e) plen 57                                                                            #54 5.800170
      LE Extended Advertising Report (0x0d)
        Num reports: 1
        Entry 0
          Event type: 0x0010
            Props: 0x0010
              Use legacy advertising PDUs
            Data status: [0;32mComplete[0m
          Legacy PDU Type: ADV_NONCONN_IND (0x0010)
          Address type: Random (0x01)
          Address: 2D:71:B2:0D:81:2E (Non-Resolvable)
          Primary PHY: LE 1M
          Secondary PHY: No packets
          SID: no ADI field (0xff)
          TX power: 127 dBm
          RSSI: -96 dBm (0xa0)
          Periodic advertising interval: 0.00 msec (0x0000)
          Direct address type: Reserved (0xff)
          Direct address: 00-00-00-00-00-00
          Data length: 0x1f
        1e ff 06 00 01 09 20 22 eb 25 46 6f b4 fe 9c c0  ...... ".%Fo....
        36 ac 03 17 f3 f2 3e 44 43 78 5b 4d 54 ea 53     6.....>DCx[MT.S 
        Company: Microsoft (6)
          Data: 01092022eb25466fb4fe9cc036ac0317f3f23e4443785b4d54ea53
> HCI Event: LE Meta Event (0x3e) plen 55                                                                            #55 5.808734
      LE Extended Advertising Report (0x0d)
        Num reports: 1
        Entry 0
          Event type: 0x0010
            Props: 0x0010
              Use legacy advertising PDUs
            Data status: [0;32mComplete[0m
          Legacy PDU Type: ADV_NONCONN_IND (0x0010)
          Address type: Random (0x01)
          Address: 1D:97:95:F6:43:29 (Non-Resolvable)
          Primary PHY: LE 1M
          Secondary PHY: No packets
          SID: no ADI field (0xff)
          TX power: 127 dBm
          RSSI: -80 dBm (0xb0)
          Periodic advertising interval: 0.00 msec (0x0000)
          Direct address type: Reserved (0xff)
          Direct address: 00-00-00-00-00-00
          Data length: 0x1d
        1c ff 06 00 01 09 21 0a 4d e0 8a 52 d2 d4 4c 41  ......!.M..R..LA
        50 54 4f 50 2d 45 35 32 45 4f 44 32 49           PTOP-E52EOD2I   
        Company: Microsoft (6)
          Data: 0109210a4de08a52d2d44c4150544f502d453532454f443249
> HCI Event: LE Meta Event (0x3e) plen 55                                                                            #56 5.913827
      LE Extended Advertising Report (0x0d)
        Num reports: 1
        Entry 0
          Event type: 0x0010
            Props: 0x0010
              Use legacy advertising PDUs
            Data status: [0;32mComplete[0m
          Legacy PDU Type: ADV_NONCONN_IND (0x0010)
          Address type: Random (0x01)
          Address: 1D:97:95:F6:43:29 (Non-Resolvable)
          Primary PHY: LE 1M
          Secondary PHY: No packets
          SID: no ADI field (0xff)
          TX power: 127 dBm
          RSSI: -82 dBm (0xae)
          Periodic advertising interval: 0.00 msec (0x0000)
          Direct address type: Reserved (0xff)
          Direct address: 00-00-00-00-00-00
          Data length: 0x1d
        1c ff 06 00 01 09 21 0a 4d e0 8a 52 d2 d4 4c 41  ......!.M..R..LA
        50 54 4f 50 2d 45 35 32 45 4f 44 32 49           PTOP-E52EOD2I   
        Company: Microsoft (6)
          Data: 0109210a4de08a52d2d44c4150544f502d453532454f443249
> HCI Event: LE Meta Event (0x3e) plen 38                                                                            #57 5.976633
      LE Extended Advertising Report (0x0d)
        Num reports: 1
        Entry 0
          Event type: 0x0012
            Props: 0x0012
              Scannable
              Use legacy advertising PDUs
            Data status: [0;32mComplete[0m
          Legacy PDU Type: ADV_SCAN_IND (0x0012)
          Address type: Random (0x01)
          Address: 6F:CA:E8:51:CB:18 (Resolvable)
          Primary PHY: LE 1M
          Secondary PHY: No packets
          SID: no ADI field (0xff)
          TX power: 127 dBm
          RSSI: -84 dBm (0xac)
          Periodic advertising interval: 0.00 msec (0x0000)
          Direct address type: Reserved (0xff)
          Direct address: 00-00-00-00-00-00
          Data length: 0x0c
        0b ff 4c 00 09 06 03 00 0a 03 07 11              ..L.........    
        Company: Apple, Inc. (76)
          Type: Apple TV (9)
          Data: 03000a030711
> HCI Event: LE Meta Event (0x3e) plen 26                                                                            #58 5.977185
      LE Extended Advertising Report (0x0d)
        Num reports: 1
        Entry 0
          Event type: 0x001a
            Props: 0x001a
              Scannable
              Scan response
              Use legacy advertising PDUs
            Data status: [0;32mComplete[0m
          Legacy PDU Type: SCAN_RSP to an ADV_IND (0x001a)
          Address type: Random (0x01)
          Address: 6F:CA:E8:51:CB:18 (Resolvable)
          Primary PHY: LE 1M
          Secondary PHY: No packets
          SID: no ADI field (0xff)
          TX power: 127 dBm
          RSSI: -84 dBm (0xac)
          Periodic advertising interval: 0.00 msec (0x0000)
          Direct address type: Reserved (0xff)
          Direct address: 00-00-00-00-00-00
          Data length: 0x00
zephyr.exe[476762]: < HCI Command: LE Set Extended Scan Enable (0x08|0x0042) plen 6                                  #59 6.101131
        Extended scan: Disabled (0x00)
        Filter duplicates: Disabled (0x00)
        Duration: 0 msec (0x0000)
        Period: 0.00 sec (0x0000)
> HCI Event: Command Complete (0x0e) plen 4                                                                          #60 6.103991
      LE Set Extended Scan Enable (0x08|0x0042) ncmd 1
        Status: Success (0x00)
zephyr.exe[476762]: < HCI Command: LE Periodic Advertising Create Sync (0x08|0x0044) plen 14                         #61 6.161109
        Options: 0x0000
        Use advertising SID, Advertiser Address Type and address
        Reporting initially enabled
        SID: 0x00
        Adv address type: Public (0x00)
        Adv address: DF:A9:FF:F6:B1:1A (OUI DF-A9-FF)
        Skip: 0x0005
        Sync timeout: 1000 msec (0x0064)
        Sync CTE type: 0x0000
> HCI Event: Command Status (0x0f) plen 4                                                                            #62 6.161730
      LE Periodic Advertising Create Sync (0x08|0x0044) ncmd 1
        Status: Success (0x00)
zephyr.exe[476762]: < HCI Command: LE Set Random Address (0x08|0x0005) plen 6                                        #63 6.181096
        Address: 0B:F7:6D:E2:CB:94 (Non-Resolvable)
> HCI Event: Command Complete (0x0e) plen 4                                                                          #64 6.181625
      LE Set Random Address (0x08|0x0005) ncmd 1
        Status: Success (0x00)
zephyr.exe[476762]: < HCI Command: LE Set Extended Scan Parameters (0x08|0x0041) plen 13                             #65 6.201057
        Own address type: Random (0x01)
        Filter policy: Accept all advertisement (0x00)
        PHYs: 0x05
        Entry 0: LE 1M
          Type: Passive (0x00)
          Interval: 60.000 msec (0x0060)
          Window: 30.000 msec (0x0030)
        Entry 1: LE Coded
          Type: Passive (0x00)
          Interval: 60.000 msec (0x0060)
          Window: 30.000 msec (0x0030)
> HCI Event: Command Complete (0x0e) plen 4                                                                          #66 6.201646
      LE Set Extended Scan Parameters (0x08|0x0041) ncmd 1
        Status: Success (0x00)
zephyr.exe[476762]: < HCI Command: LE Set Extended Scan Enable (0x08|0x0042) plen 6                                  #67 6.221074
        Extended scan: Enabled (0x01)
        Filter duplicates: Enabled (0x01)
        Duration: 0 msec (0x0000)
        Period: 0.00 sec (0x0000)
> HCI Event: Command Complete (0x0e) plen 4                                                                          #68 6.221733
      LE Set Extended Scan Enable (0x08|0x0042) ncmd 1
        Status: Success (0x00)
> HCI Event: LE Meta Event (0x3e) plen 51                                                                            #69 6.230764
      LE Extended Advertising Report (0x0d)
        Num reports: 1
        Entry 0
          Event type: 0x0013
            Props: 0x0013
              Connectable
              Scannable
              Use legacy advertising PDUs
            Data status: [0;32mComplete[0m
          Legacy PDU Type: ADV_IND (0x0013)
          Address type: Public (0x00)
          Address: F0:18:98:96:04:94 (Apple, Inc.)
          Primary PHY: LE 1M
          Secondary PHY: No packets
          SID: no ADI field (0xff)
          TX power: 127 dBm
          RSSI: -84 dBm (0xac)
          Periodic advertising interval: 0.00 msec (0x0000)
          Direct address type: Reserved (0xff)
          Direct address: 00-00-00-00-00-00
          Data length: 0x19
        02 01 06 11 07 00 00 00 00 00 00 00 00 00 00 00  ................
        00 00 01 31 5a 03 09 7a 6d                       ...1Z..zm       
        Flags: 0x06
          LE General Discoverable Mode
          BR/EDR Not Supported
        128-bit Service UUIDs (complete): 1 entry
          Vendor specific
        Name (complete): zm
> HCI Event: LE Meta Event (0x3e) plen 55                                                                            #70 6.239899
      LE Extended Advertising Report (0x0d)
        Num reports: 1
        Entry 0
          Event type: 0x0010
            Props: 0x0010
              Use legacy advertising PDUs
            Data status: [0;32mComplete[0m
          Legacy PDU Type: ADV_NONCONN_IND (0x0010)
          Address type: Random (0x01)
          Address: 1D:97:95:F6:43:29 (Non-Resolvable)
          Primary PHY: LE 1M
          Secondary PHY: No packets
          SID: no ADI field (0xff)
          TX power: 127 dBm
          RSSI: -80 dBm (0xb0)
          Periodic advertising interval: 0.00 msec (0x0000)
          Direct address type: Reserved (0xff)
          Direct address: 00-00-00-00-00-00
          Data length: 0x1d
        1c ff 06 00 01 09 21 0a 4d e0 8a 52 d2 d4 4c 41  ......!.M..R..LA
        50 54 4f 50 2d 45 35 32 45 4f 44 32 49           PTOP-E52EOD2I   
        Company: Microsoft (6)
          Data: 0109210a4de08a52d2d44c4150544f502d453532454f443249
> HCI Event: LE Meta Event (0x3e) plen 38                                                                            #71 6.250396
      LE Extended Advertising Report (0x0d)
        Num reports: 1
        Entry 0
          Event type: 0x0012
            Props: 0x0012
              Scannable
              Use legacy advertising PDUs
            Data status: [0;32mComplete[0m
          Legacy PDU Type: ADV_SCAN_IND (0x0012)
          Address type: Random (0x01)
          Address: 6F:CA:E8:51:CB:18 (Resolvable)
          Primary PHY: LE 1M
          Secondary PHY: No packets
          SID: no ADI field (0xff)
          TX power: 127 dBm
          RSSI: -84 dBm (0xac)
          Periodic advertising interval: 0.00 msec (0x0000)
          Direct address type: Reserved (0xff)
          Direct address: 00-00-00-00-00-00
          Data length: 0x0c
        0b ff 4c 00 09 06 03 00 0a 03 07 11              ..L.........    
        Company: Apple, Inc. (76)
          Type: Apple TV (9)
          Data: 03000a030711
> HCI Event: LE Meta Event (0x3e) plen 55                                                                            #72 6.348071
      LE Extended Advertising Report (0x0d)
        Num reports: 1
        Entry 0
          Event type: 0x0010
            Props: 0x0010
              Use legacy advertising PDUs
            Data status: [0;32mComplete[0m
          Legacy PDU Type: ADV_NONCONN_IND (0x0010)
          Address type: Random (0x01)
          Address: 1D:97:95:F6:43:29 (Non-Resolvable)
          Primary PHY: LE 1M
          Secondary PHY: No packets
          SID: no ADI field (0xff)
          TX power: 127 dBm
          RSSI: -82 dBm (0xae)
          Periodic advertising interval: 0.00 msec (0x0000)
          Direct address type: Reserved (0xff)
          Direct address: 00-00-00-00-00-00
          Data length: 0x1d
        1c ff 06 00 01 09 21 0a 4d e0 8a 52 d2 d4 4c 41  ......!.M..R..LA
        50 54 4f 50 2d 45 35 32 45 4f 44 32 49           PTOP-E52EOD2I   
        Company: Microsoft (6)
          Data: 0109210a4de08a52d2d44c4150544f502d453532454f443249
> HCI Event: LE Meta Event (0x3e) plen 51                                                                            #73 6.413299
      LE Extended Advertising Report (0x0d)
        Num reports: 1
        Entry 0
          Event type: 0x0013
            Props: 0x0013
              Connectable
              Scannable
              Use legacy advertising PDUs
            Data status: [0;32mComplete[0m
          Legacy PDU Type: ADV_IND (0x0013)
          Address type: Public (0x00)
          Address: F0:18:98:96:04:94 (Apple, Inc.)
          Primary PHY: LE 1M
          Secondary PHY: No packets
          SID: no ADI field (0xff)
          TX power: 127 dBm
          RSSI: -84 dBm (0xac)
          Periodic advertising interval: 0.00 msec (0x0000)
          Direct address type: Reserved (0xff)
          Direct address: 00-00-00-00-00-00
          Data length: 0x19
        02 01 06 11 07 00 00 00 00 00 00 00 00 00 00 00  ................
        00 00 01 31 5a 03 09 7a 6d                       ...1Z..zm       
        Flags: 0x06
          LE General Discoverable Mode
          BR/EDR Not Supported
        128-bit Service UUIDs (complete): 1 entry
          Vendor specific
        Name (complete): zm
> HCI Event: LE Meta Event (0x3e) plen 47                                                                            #74 6.539305
      LE Extended Advertising Report (0x0d)
        Num reports: 1
        Entry 0
          Event type: 0x0000
            Props: 0x0000
            Data status: [0;32mComplete[0m
          Address type: Public (0x00)
          Address: DF:A9:FF:F6:B1:1A (OUI DF-A9-FF)
          Primary PHY: LE 1M
          Secondary PHY: LE 1M
          SID: 0x00
          TX power: 127 dBm
          RSSI: -16 dBm (0xf0)
          Periodic advertising interval: 750.00 msec (0x0258)
          Direct address type: Reserved (0xff)
          Direct address: 00-00-00-00-00-00
          Data length: 0x15
        06 16 52 18 f5 41 7b 0d 09 50 54 53 2d 42 41 50  ..R..A{..PTS-BAP
        2d 42 31 31 41                                   -B11A           
        Service Data: Broadcast Audio Announcement (0x1852)
        Broadcast ID: 8077813 (0x7b41f5)
        Name (complete): PTS-BAP-B11A
> HCI Event: LE Meta Event (0x3e) plen 55                                                                            #75 6.553719
      LE Extended Advertising Report (0x0d)
        Num reports: 1
        Entry 0
          Event type: 0x0010
            Props: 0x0010
              Use legacy advertising PDUs
            Data status: [0;32mComplete[0m
          Legacy PDU Type: ADV_NONCONN_IND (0x0010)
          Address type: Random (0x01)
          Address: 1D:97:95:F6:43:29 (Non-Resolvable)
          Primary PHY: LE 1M
          Secondary PHY: No packets
          SID: no ADI field (0xff)
          TX power: 127 dBm
          RSSI: -82 dBm (0xae)
          Periodic advertising interval: 0.00 msec (0x0000)
          Direct address type: Reserved (0xff)
          Direct address: 00-00-00-00-00-00
          Data length: 0x1d
        1c ff 06 00 01 09 21 0a 4d e0 8a 52 d2 d4 4c 41  ......!.M..R..LA
        50 54 4f 50 2d 45 35 32 45 4f 44 32 49           PTOP-E52EOD2I   
        Company: Microsoft (6)
          Data: 0109210a4de08a52d2d44c4150544f502d453532454f443249
> HCI Event: LE Meta Event (0x3e) plen 55                                                                            #76 6.656761
      LE Extended Advertising Report (0x0d)
        Num reports: 1
        Entry 0
          Event type: 0x0010
            Props: 0x0010
              Use legacy advertising PDUs
            Data status: [0;32mComplete[0m
          Legacy PDU Type: ADV_NONCONN_IND (0x0010)
          Address type: Random (0x01)
          Address: 1D:97:95:F6:43:29 (Non-Resolvable)
          Primary PHY: LE 1M
          Secondary PHY: No packets
          SID: no ADI field (0xff)
          TX power: 127 dBm
          RSSI: -89 dBm (0xa7)
          Periodic advertising interval: 0.00 msec (0x0000)
          Direct address type: Reserved (0xff)
          Direct address: 00-00-00-00-00-00
          Data length: 0x1d
        1c ff 06 00 01 09 21 0a 4d e0 8a 52 d2 d4 4c 41  ......!.M..R..LA
        50 54 4f 50 2d 45 35 32 45 4f 44 32 49           PTOP-E52EOD2I   
        Company: Microsoft (6)
          Data: 0109210a4de08a52d2d44c4150544f502d453532454f443249
> HCI Event: LE Meta Event (0x3e) plen 38                                                                            #77 6.666060
      LE Extended Advertising Report (0x0d)
        Num reports: 1
        Entry 0
          Event type: 0x0012
            Props: 0x0012
              Scannable
              Use legacy advertising PDUs
            Data status: [0;32mComplete[0m
          Legacy PDU Type: ADV_SCAN_IND (0x0012)
          Address type: Random (0x01)
          Address: 6F:CA:E8:51:CB:18 (Resolvable)
          Primary PHY: LE 1M
          Secondary PHY: No packets
          SID: no ADI field (0xff)
          TX power: 127 dBm
          RSSI: -91 dBm (0xa5)
          Periodic advertising interval: 0.00 msec (0x0000)
          Direct address type: Reserved (0xff)
          Direct address: 00-00-00-00-00-00
          Data length: 0x0c
        0b ff 4c 00 09 06 03 00 0a 03 07 11              ..L.........    
        Company: Apple, Inc. (76)
          Type: Apple TV (9)
          Data: 03000a030711
> HCI Event: LE Meta Event (0x3e) plen 51                                                                            #78 6.779525
      LE Extended Advertising Report (0x0d)
        Num reports: 1
        Entry 0
          Event type: 0x0013
            Props: 0x0013
              Connectable
              Scannable
              Use legacy advertising PDUs
            Data status: [0;32mComplete[0m
          Legacy PDU Type: ADV_IND (0x0013)
          Address type: Public (0x00)
          Address: F0:18:98:96:04:94 (Apple, Inc.)
          Primary PHY: LE 1M
          Secondary PHY: No packets
          SID: no ADI field (0xff)
          TX power: 127 dBm
          RSSI: -84 dBm (0xac)
          Periodic advertising interval: 0.00 msec (0x0000)
          Direct address type: Reserved (0xff)
          Direct address: 00-00-00-00-00-00
          Data length: 0x19
        02 01 06 11 07 00 00 00 00 00 00 00 00 00 00 00  ................
        00 00 01 31 5a 03 09 7a 6d                       ...1Z..zm       
        Flags: 0x06
          LE General Discoverable Mode
          BR/EDR Not Supported
        128-bit Service UUIDs (complete): 1 entry
          Vendor specific
        Name (complete): zm
> HCI Event: LE Meta Event (0x3e) plen 57                                                                            #79 6.961983
      LE Extended Advertising Report (0x0d)
        Num reports: 1
        Entry 0
          Event type: 0x0010
            Props: 0x0010
              Use legacy advertising PDUs
            Data status: [0;32mComplete[0m
          Legacy PDU Type: ADV_NONCONN_IND (0x0010)
          Address type: Random (0x01)
          Address: 2D:71:B2:0D:81:2E (Non-Resolvable)
          Primary PHY: LE 1M
          Secondary PHY: No packets
          SID: no ADI field (0xff)
          TX power: 127 dBm
          RSSI: -95 dBm (0xa1)
          Periodic advertising interval: 0.00 msec (0x0000)
          Direct address type: Reserved (0xff)
          Direct address: 00-00-00-00-00-00
          Data length: 0x1f
        1e ff 06 00 01 09 20 22 eb 25 46 6f b4 fe 9c c0  ...... ".%Fo....
        36 ac 03 17 f3 f2 3e 44 43 78 5b 4d 54 ea 53     6.....>DCx[MT.S 
        Company: Microsoft (6)
          Data: 01092022eb25466fb4fe9cc036ac0317f3f23e4443785b4d54ea53
> HCI Event: LE Meta Event (0x3e) plen 51                                                                            #80 6.967959
      LE Extended Advertising Report (0x0d)
        Num reports: 1
        Entry 0
          Event type: 0x0013
            Props: 0x0013
              Connectable
              Scannable
              Use legacy advertising PDUs
            Data status: [0;32mComplete[0m
          Legacy PDU Type: ADV_IND (0x0013)
          Address type: Public (0x00)
          Address: F0:18:98:96:04:94 (Apple, Inc.)
          Primary PHY: LE 1M
          Secondary PHY: No packets
          SID: no ADI field (0xff)
          TX power: 127 dBm
          RSSI: -84 dBm (0xac)
          Periodic advertising interval: 0.00 msec (0x0000)
          Direct address type: Reserved (0xff)
          Direct address: 00-00-00-00-00-00
          Data length: 0x19
        02 01 06 11 07 00 00 00 00 00 00 00 00 00 00 00  ................
        00 00 01 31 5a 03 09 7a 6d                       ...1Z..zm       
        Flags: 0x06
          LE General Discoverable Mode
          BR/EDR Not Supported
        128-bit Service UUIDs (complete): 1 entry
          Vendor specific
        Name (complete): zm
> HCI Event: LE Meta Event (0x3e) plen 55                                                                            #81 6.968160
      LE Extended Advertising Report (0x0d)
        Num reports: 1
        Entry 0
          Event type: 0x0010
            Props: 0x0010
              Use legacy advertising PDUs
            Data status: [0;32mComplete[0m
          Legacy PDU Type: ADV_NONCONN_IND (0x0010)
          Address type: Random (0x01)
          Address: 1D:97:95:F6:43:29 (Non-Resolvable)
          Primary PHY: LE 1M
          Secondary PHY: No packets
          SID: no ADI field (0xff)
          TX power: 127 dBm
          RSSI: -80 dBm (0xb0)
          Periodic advertising interval: 0.00 msec (0x0000)
          Direct address type: Reserved (0xff)
          Direct address: 00-00-00-00-00-00
          Data length: 0x1d
        1c ff 06 00 01 09 21 0a 4d e0 8a 52 d2 d4 4c 41  ......!.M..R..LA
        50 54 4f 50 2d 45 35 32 45 4f 44 32 49           PTOP-E52EOD2I   
        Company: Microsoft (6)
          Data: 0109210a4de08a52d2d44c4150544f502d453532454f443249
> HCI Event: LE Meta Event (0x3e) plen 38                                                                            #82 7.069691
      LE Extended Advertising Report (0x0d)
        Num reports: 1
        Entry 0
          Event type: 0x0012
            Props: 0x0012
              Scannable
              Use legacy advertising PDUs
            Data status: [0;32mComplete[0m
          Legacy PDU Type: ADV_SCAN_IND (0x0012)
          Address type: Random (0x01)
          Address: 6F:CA:E8:51:CB:18 (Resolvable)
          Primary PHY: LE 1M
          Secondary PHY: No packets
          SID: no ADI field (0xff)
          TX power: 127 dBm
          RSSI: -89 dBm (0xa7)
          Periodic advertising interval: 0.00 msec (0x0000)
          Direct address type: Reserved (0xff)
          Direct address: 00-00-00-00-00-00
          Data length: 0x0c
        0b ff 4c 00 09 06 03 00 0a 03 07 11              ..L.........    
        Company: Apple, Inc. (76)
          Type: Apple TV (9)
          Data: 03000a030711
> HCI Event: LE Meta Event (0x3e) plen 57                                                                            #83 7.070707
      LE Extended Advertising Report (0x0d)
        Num reports: 1
        Entry 0
          Event type: 0x0010
            Props: 0x0010
              Use legacy advertising PDUs
            Data status: [0;32mComplete[0m
          Legacy PDU Type: ADV_NONCONN_IND (0x0010)
          Address type: Random (0x01)
          Address: 2D:71:B2:0D:81:2E (Non-Resolvable)
          Primary PHY: LE 1M
          Secondary PHY: No packets
          SID: no ADI field (0xff)
          TX power: 127 dBm
          RSSI: -94 dBm (0xa2)
          Periodic advertising interval: 0.00 msec (0x0000)
          Direct address type: Reserved (0xff)
          Direct address: 00-00-00-00-00-00
          Data length: 0x1f
        1e ff 06 00 01 09 20 22 eb 25 46 6f b4 fe 9c c0  ...... ".%Fo....
        36 ac 03 17 f3 f2 3e 44 43 78 5b 4d 54 ea 53     6.....>DCx[MT.S 
        Company: Microsoft (6)
          Data: 01092022eb25466fb4fe9cc036ac0317f3f23e4443785b4d54ea53
> HCI Event: LE Meta Event (0x3e) plen 55                                                                            #84 7.071205
      LE Extended Advertising Report (0x0d)
        Num reports: 1
        Entry 0
          Event type: 0x0010
            Props: 0x0010
              Use legacy advertising PDUs
            Data status: [0;32mComplete[0m
          Legacy PDU Type: ADV_NONCONN_IND (0x0010)
          Address type: Random (0x01)
          Address: 1D:97:95:F6:43:29 (Non-Resolvable)
          Primary PHY: LE 1M
          Secondary PHY: No packets
          SID: no ADI field (0xff)
          TX power: 127 dBm
          RSSI: -81 dBm (0xaf)
          Periodic advertising interval: 0.00 msec (0x0000)
          Direct address type: Reserved (0xff)
          Direct address: 00-00-00-00-00-00
          Data length: 0x1d
        1c ff 06 00 01 09 21 0a 4d e0 8a 52 d2 d4 4c 41  ......!.M..R..LA
        50 54 4f 50 2d 45 35 32 45 4f 44 32 49           PTOP-E52EOD2I   
        Company: Microsoft (6)
          Data: 0109210a4de08a52d2d44c4150544f502d453532454f443249
> HCI Event: LE Meta Event (0x3e) plen 54                                                                            #85 7.146327
      LE Extended Advertising Report (0x0d)
        Num reports: 1
        Entry 0
          Event type: 0x0010
            Props: 0x0010
              Use legacy advertising PDUs
            Data status: [0;32mComplete[0m
          Legacy PDU Type: ADV_NONCONN_IND (0x0010)
          Address type: Public (0x00)
          Address: A4:30:7A:95:74:FB (Samsung Electronics Co.,Ltd)
          Primary PHY: LE 1M
          Secondary PHY: No packets
          SID: no ADI field (0xff)
          TX power: 127 dBm
          RSSI: -83 dBm (0xad)
          Periodic advertising interval: 0.00 msec (0x0000)
          Direct address type: Reserved (0xff)
          Direct address: 00-00-00-00-00-00
          Data length: 0x1c
        1b ff 75 00 42 04 01 80 6e a4 30 7a 95 74 fb a6  ..u.B...n.0z.t..
        30 7a 95 74 fa 01 d8 41 c5 d9 00 00              0z.t...A....    
        Company: Samsung Electronics Co. Ltd. (117)
          Data: 420401806ea4307a9574fba6307a9574fa01d841c5d90000
> HCI Event: LE Meta Event (0x3e) plen 38                                                                            #86 7.206102
      LE Extended Advertising Report (0x0d)
        Num reports: 1
        Entry 0
          Event type: 0x0012
            Props: 0x0012
              Scannable
              Use legacy advertising PDUs
            Data status: [0;32mComplete[0m
          Legacy PDU Type: ADV_SCAN_IND (0x0012)
          Address type: Random (0x01)
          Address: 6F:CA:E8:51:CB:18 (Resolvable)
          Primary PHY: LE 1M
          Secondary PHY: No packets
          SID: no ADI field (0xff)
          TX power: 127 dBm
          RSSI: -91 dBm (0xa5)
          Periodic advertising interval: 0.00 msec (0x0000)
          Direct address type: Reserved (0xff)
          Direct address: 00-00-00-00-00-00
          Data length: 0x0c
        0b ff 4c 00 09 06 03 00 0a 03 07 11              ..L.........    
        Company: Apple, Inc. (76)
          Type: Apple TV (9)
          Data: 03000a030711
> HCI Event: LE Meta Event (0x3e) plen 16                                                                            #87 7.274047
      LE Periodic Advertising Sync Established (0x0e)
        Status: Success (0x00)
        Sync handle: 1010
        Advertising SID: 0x00
        Advertiser address type: Public (0x00)
        Advertiser address: DF:A9:FF:F6:B1:1A (OUI DF-A9-FF)
        Advertiser PHY: LE 1M (0x01)
        Periodic advertising interval: 750.00 msec (0x0258)
        Advertiser clock accuracy: 0x01
> HCI Event: LE Meta Event (0x3e) plen 56                                                                            #88 7.274572
      LE Periodic Advertising Report (0x0f)
        Sync handle: 1010
        TX power: 127 dbm (0x7f)
        RSSI: -16 dBm (0xf0)
        CTE Type: No Constant Tone Extension (0xff)
        Data status: [0;32mComplete[0m
        Data length: 0x30
        2f 16 51 18 40 9c 00 01 02 06 00 00 00 00 0a 02  /.Q.@...........
        01 07 02 02 00 03 04 61 00 06 03 02 04 00 01 09  .......a........
        01 06 05 03 01 00 00 00 02 06 05 03 02 00 00 00  ................
> HCI Event: LE Meta Event (0x3e) plen 20                                                                            #89 7.274688
      LE Broadcast Isochronous Group Info Advertising Report (0x22)
        Sync Handle: 0x03f2
        Number BIS: 2
        NSE: 3
        ISO Interval: 7.50 msec (0x0006)
        BN: 1
        PTO: 1
        IRC: 2
        Maximum PDU: 102
        SDU Interval: 8163 us (0x001fe3)
        Maximum SDU: 97
        PHY: LE 2M (0x02)
        Framing: Framed (0x01)
        Encryption: 0x00
zephyr.exe[476762]: < HCI Command: LE Set Extended Scan Enable (0x08|0x0042) plen 6                                  #90 7.281543
        Extended scan: Disabled (0x00)
        Filter duplicates: Disabled (0x00)
        Duration: 0 msec (0x0000)
        Period: 0.00 sec (0x0000)
> HCI Event: Command Complete (0x0e) plen 4                                                                          #91 7.284215
      LE Set Extended Scan Enable (0x08|0x0042) ncmd 1
        Status: Success (0x00)
zephyr.exe[476762]: < HCI Command: LE Broadcast Isochronous Group Create Sync (0x08|0x006b) plen 25                  #92 7.791649
        BIG Handle: 0x00
        BIG Sync Handle: 0x03f2
        Encryption: Unencrypted (0x00)
        Broadcast Code: 00000000000000000000000000000000
        Maximum Number Subevents: 0x00
        Timeout: 100 ms (0x000a)
        Number of BIS: 1
        BIS ID: 0x01
> HCI Event: Command Status (0x0f) plen 4                                                                            #93 7.792529
      LE Broadcast Isochronous Group Create Sync (0x08|0x006b) ncmd 1
        Status: Success (0x00)
> HCI Event: LE Meta Event (0x3e) plen 56                                                                            #94 8.024199
      LE Periodic Advertising Report (0x0f)
        Sync handle: 1010
        TX power: 127 dbm (0x7f)
        RSSI: -16 dBm (0xf0)
        CTE Type: No Constant Tone Extension (0xff)
        Data status: [0;32mComplete[0m
        Data length: 0x30
        2f 16 51 18 40 9c 00 01 02 06 00 00 00 00 0a 02  /.Q.@...........
        01 07 02 02 00 03 04 61 00 06 03 02 04 00 01 09  .......a........
        01 06 05 03 01 00 00 00 02 06 05 03 02 00 00 00  ................
> HCI Event: LE Meta Event (0x3e) plen 20                                                                            #95 8.024451
      LE Broadcast Isochronous Group Info Advertising Report (0x22)
        Sync Handle: 0x03f2
        Number BIS: 2
        NSE: 3
        ISO Interval: 7.50 msec (0x0006)
        BN: 1
        PTO: 1
        IRC: 2
        Maximum PDU: 102
        SDU Interval: 8163 us (0x001fe3)
        Maximum SDU: 97
        PHY: LE 2M (0x02)
        Framing: Framed (0x01)
        Encryption: 0x00
> HCI Event: LE Meta Event (0x3e) plen 17                                                                            #96 8.026003
      LE Broadcast Isochronous Group Sync Estabilished (0x1d)
        Status: Success (0x00)
        BIG Handle: 0x00
        Transport Latency: 49125 us (0x00bfe5)
        NSE: 3
        BN: 1
        PTO: 1
        IRC: 2
        Maximum PDU: 102
        ISO Interval: 7.50 msec (0x0006)
        Connection Handle #0: 1022
zephyr.exe[476762]: < HCI Command: LE Setup Isochronous Data Path (0x08|0x006e) plen 13                              #97 8.043176
        Handle: 1022
        Data Path Direction: Output (Controller to Host) (0x01)
        Data Path: HCI (0x00)
        Coding Format: Transparent (0x03)
        Company Codec ID: Ericsson Technology Licensing (0)
        Vendor Codec ID: 0
        Controller Delay: 0 us (0x000000)
        Codec Configuration Length: 0
        Codec Configuration: 
> HCI Event: Command Complete (0x0e) plen 6                                                                          #98 8.043818
      LE Setup Isochronous Data Path (0x08|0x006e) ncmd 1
        Status: Success (0x00)
        Handle: 1022
> HCI Event: LE Meta Event (0x3e) plen 56                                                                            #99 8.774147
      LE Periodic Advertising Report (0x0f)
        Sync handle: 1010
        TX power: 127 dbm (0x7f)
        RSSI: -16 dBm (0xf0)
        CTE Type: No Constant Tone Extension (0xff)
        Data status: [0;32mComplete[0m
        Data length: 0x30
        2f 16 51 18 40 9c 00 01 02 06 00 00 00 00 0a 02  /.Q.@...........
        01 07 02 02 00 03 04 61 00 06 03 02 04 00 01 09  .......a........
        01 06 05 03 01 00 00 00 02 06 05 03 02 00 00 00  ................
> HCI Event: LE Meta Event (0x3e) plen 20                                                                           #100 8.774479
      LE Broadcast Isochronous Group Info Advertising Report (0x22)
        Sync Handle: 0x03f2
        Number BIS: 2
        NSE: 3
        ISO Interval: 7.50 msec (0x0006)
        BN: 1
        PTO: 1
        IRC: 2
        Maximum PDU: 102
        SDU Interval: 8163 us (0x001fe3)
        Maximum SDU: 97
        PHY: LE 2M (0x02)
        Framing: Framed (0x01)
        Encryption: 0x00
> HCI Event: LE Meta Event (0x3e) plen 56                                                                           #101 9.524150
      LE Periodic Advertising Report (0x0f)
        Sync handle: 1010
        TX power: 127 dbm (0x7f)
        RSSI: -16 dBm (0xf0)
        CTE Type: No Constant Tone Extension (0xff)
        Data status: [0;32mComplete[0m
        Data length: 0x30
        2f 16 51 18 40 9c 00 01 02 06 00 00 00 00 0a 02  /.Q.@...........
        01 07 02 02 00 03 04 61 00 06 03 02 04 00 01 09  .......a........
        01 06 05 03 01 00 00 00 02 06 05 03 02 00 00 00  ................
> HCI Event: LE Meta Event (0x3e) plen 20                                                                           #102 9.524349
      LE Broadcast Isochronous Group Info Advertising Report (0x22)
        Sync Handle: 0x03f2
        Number BIS: 2
        NSE: 3
        ISO Interval: 7.50 msec (0x0006)
        BN: 1
        PTO: 1
        IRC: 2
        Maximum PDU: 102
        SDU Interval: 8163 us (0x001fe3)
        Maximum SDU: 97
        PHY: LE 2M (0x02)
        Framing: Framed (0x01)
        Encryption: 0x00
> HCI Event: LE Meta Event (0x3e) plen 56                                                                          #103 10.274090
      LE Periodic Advertising Report (0x0f)
        Sync handle: 1010
        TX power: 127 dbm (0x7f)
        RSSI: -17 dBm (0xef)
        CTE Type: No Constant Tone Extension (0xff)
        Data status: [0;32mComplete[0m
        Data length: 0x30
        2f 16 51 18 40 9c 00 01 02 06 00 00 00 00 0a 02  /.Q.@...........
        01 07 02 02 00 03 04 61 00 06 03 02 04 00 01 09  .......a........
        01 06 05 03 01 00 00 00 02 06 05 03 02 00 00 00  ................
> HCI Event: LE Meta Event (0x3e) plen 20                                                                          #104 10.274315
      LE Broadcast Isochronous Group Info Advertising Report (0x22)
        Sync Handle: 0x03f2
        Number BIS: 2
        NSE: 3
        ISO Interval: 7.50 msec (0x0006)
        BN: 1
        PTO: 1
        IRC: 2
        Maximum PDU: 102
        SDU Interval: 8163 us (0x001fe3)
        Maximum SDU: 97
        PHY: LE 2M (0x02)
        Framing: Framed (0x01)
        Encryption: 0x00
> HCI Event: LE Meta Event (0x3e) plen 56                                                                          #105 11.024020
      LE Periodic Advertising Report (0x0f)
        Sync handle: 1010
        TX power: 127 dbm (0x7f)
        RSSI: -16 dBm (0xf0)
        CTE Type: No Constant Tone Extension (0xff)
        Data status: [0;32mComplete[0m
        Data length: 0x30
        2f 16 51 18 40 9c 00 01 02 06 00 00 00 00 0a 02  /.Q.@...........
        01 07 02 02 00 03 04 61 00 06 03 02 04 00 01 09  .......a........
        01 06 05 03 01 00 00 00 02 06 05 03 02 00 00 00  ................
> HCI Event: LE Meta Event (0x3e) plen 20                                                                          #106 11.024232
      LE Broadcast Isochronous Group Info Advertising Report (0x22)
        Sync Handle: 0x03f2
        Number BIS: 2
        NSE: 3
        ISO Interval: 7.50 msec (0x0006)
        BN: 1
        PTO: 1
        IRC: 2
        Maximum PDU: 102
        SDU Interval: 8163 us (0x001fe3)
        Maximum SDU: 97
        PHY: LE 2M (0x02)
        Framing: Framed (0x01)
        Encryption: 0x00
> HCI Event: LE Meta Event (0x3e) plen 56                                                                          #107 11.774048
      LE Periodic Advertising Report (0x0f)
        Sync handle: 1010
        TX power: 127 dbm (0x7f)
        RSSI: -16 dBm (0xf0)
        CTE Type: No Constant Tone Extension (0xff)
        Data status: [0;32mComplete[0m
        Data length: 0x30
        2f 16 51 18 40 9c 00 01 02 06 00 00 00 00 0a 02  /.Q.@...........
        01 07 02 02 00 03 04 61 00 06 03 02 04 00 01 09  .......a........
        01 06 05 03 01 00 00 00 02 06 05 03 02 00 00 00  ................
> HCI Event: LE Meta Event (0x3e) plen 20                                                                          #108 11.774281
      LE Broadcast Isochronous Group Info Advertising Report (0x22)
        Sync Handle: 0x03f2
        Number BIS: 2
        NSE: 3
        ISO Interval: 7.50 msec (0x0006)
        BN: 1
        PTO: 1
        IRC: 2
        Maximum PDU: 102
        SDU Interval: 8163 us (0x001fe3)
        Maximum SDU: 97
        PHY: LE 2M (0x02)
        Framing: Framed (0x01)
        Encryption: 0x00
> HCI Event: LE Meta Event (0x3e) plen 56                                                                          #109 12.524036
      LE Periodic Advertising Report (0x0f)
        Sync handle: 1010
        TX power: 127 dbm (0x7f)
        RSSI: -17 dBm (0xef)
        CTE Type: No Constant Tone Extension (0xff)
        Data status: [0;32mComplete[0m
        Data length: 0x30
        2f 16 51 18 40 9c 00 01 02 06 00 00 00 00 0a 02  /.Q.@...........
        01 07 02 02 00 03 04 61 00 06 03 02 04 00 01 09  .......a........
        01 06 05 03 01 00 00 00 02 06 05 03 02 00 00 00  ................
> HCI Event: LE Meta Event (0x3e) plen 20                                                                          #110 12.524203
      LE Broadcast Isochronous Group Info Advertising Report (0x22)
        Sync Handle: 0x03f2
        Number BIS: 2
        NSE: 3
        ISO Interval: 7.50 msec (0x0006)
        BN: 1
        PTO: 1
        IRC: 2
        Maximum PDU: 102
        SDU Interval: 8163 us (0x001fe3)
        Maximum SDU: 97
        PHY: LE 2M (0x02)
        Framing: Framed (0x01)
        Encryption: 0x00
> HCI Event: LE Meta Event (0x3e) plen 56                                                                          #111 13.273930
      LE Periodic Advertising Report (0x0f)
        Sync handle: 1010
        TX power: 127 dbm (0x7f)
        RSSI: -16 dBm (0xf0)
        CTE Type: No Constant Tone Extension (0xff)
        Data status: [0;32mComplete[0m
        Data length: 0x30
        2f 16 51 18 40 9c 00 01 02 06 00 00 00 00 0a 02  /.Q.@...........
        01 07 02 02 00 03 04 61 00 06 03 02 04 00 01 09  .......a........
        01 06 05 03 01 00 00 00 02 06 05 03 02 00 00 00  ................
> HCI Event: LE Meta Event (0x3e) plen 20                                                                          #112 13.274171
      LE Broadcast Isochronous Group Info Advertising Report (0x22)
        Sync Handle: 0x03f2
        Number BIS: 2
        NSE: 3
        ISO Interval: 7.50 msec (0x0006)
        BN: 1
        PTO: 1
        IRC: 2
        Maximum PDU: 102
        SDU Interval: 8163 us (0x001fe3)
        Maximum SDU: 97
        PHY: LE 2M (0x02)
        Framing: Framed (0x01)
        Encryption: 0x00
> HCI Event: LE Meta Event (0x3e) plen 56                                                                          #113 14.023947
      LE Periodic Advertising Report (0x0f)
        Sync handle: 1010
        TX power: 127 dbm (0x7f)
        RSSI: -16 dBm (0xf0)
        CTE Type: No Constant Tone Extension (0xff)
        Data status: [0;32mComplete[0m
        Data length: 0x30
        2f 16 51 18 40 9c 00 01 02 06 00 00 00 00 0a 02  /.Q.@...........
        01 07 02 02 00 03 04 61 00 06 03 02 04 00 01 09  .......a........
        01 06 05 03 01 00 00 00 02 06 05 03 02 00 00 00  ................
> HCI Event: LE Meta Event (0x3e) plen 20                                                                          #114 14.024083
      LE Broadcast Isochronous Group Info Advertising Report (0x22)
        Sync Handle: 0x03f2
        Number BIS: 2
        NSE: 3
        ISO Interval: 7.50 msec (0x0006)
        BN: 1
        PTO: 1
        IRC: 2
        Maximum PDU: 102
        SDU Interval: 8163 us (0x001fe3)
        Maximum SDU: 97
        PHY: LE 2M (0x02)
        Framing: Framed (0x01)
        Encryption: 0x00
> HCI Event: LE Meta Event (0x3e) plen 56                                                                          #115 14.773912
      LE Periodic Advertising Report (0x0f)
        Sync handle: 1010
        TX power: 127 dbm (0x7f)
        RSSI: -16 dBm (0xf0)
        CTE Type: No Constant Tone Extension (0xff)
        Data status: [0;32mComplete[0m
        Data length: 0x30
        2f 16 51 18 40 9c 00 01 02 06 00 00 00 00 0a 02  /.Q.@...........
        01 07 02 02 00 03 04 61 00 06 03 02 04 00 01 09  .......a........
        01 06 05 03 01 00 00 00 02 06 05 03 02 00 00 00  ................
> HCI Event: LE Meta Event (0x3e) plen 20                                                                          #116 14.774113
      LE Broadcast Isochronous Group Info Advertising Report (0x22)
        Sync Handle: 0x03f2
        Number BIS: 2
        NSE: 3
        ISO Interval: 7.50 msec (0x0006)
        BN: 1
        PTO: 1
        IRC: 2
        Maximum PDU: 102
        SDU Interval: 8163 us (0x001fe3)
        Maximum SDU: 97
        PHY: LE 2M (0x02)
        Framing: Framed (0x01)
        Encryption: 0x00
> HCI Event: LE Meta Event (0x3e) plen 56                                                                          #117 15.523854
      LE Periodic Advertising Report (0x0f)
        Sync handle: 1010
        TX power: 127 dbm (0x7f)
        RSSI: -16 dBm (0xf0)
        CTE Type: No Constant Tone Extension (0xff)
        Data status: [0;32mComplete[0m
        Data length: 0x30
        2f 16 51 18 40 9c 00 01 02 06 00 00 00 00 0a 02  /.Q.@...........
        01 07 02 02 00 03 04 61 00 06 03 02 04 00 01 09  .......a........
        01 06 05 03 01 00 00 00 02 06 05 03 02 00 00 00  ................
> HCI Event: LE Meta Event (0x3e) plen 20                                                                          #118 15.524092
      LE Broadcast Isochronous Group Info Advertising Report (0x22)
        Sync Handle: 0x03f2
        Number BIS: 2
        NSE: 3
        ISO Interval: 7.50 msec (0x0006)
        BN: 1
        PTO: 1
        IRC: 2
        Maximum PDU: 102
        SDU Interval: 8163 us (0x001fe3)
        Maximum SDU: 97
        PHY: LE 2M (0x02)
        Framing: Framed (0x01)
        Encryption: 0x00
> HCI Event: LE Meta Event (0x3e) plen 56                                                                          #119 16.273914
      LE Periodic Advertising Report (0x0f)
        Sync handle: 1010
        TX power: 127 dbm (0x7f)
        RSSI: -16 dBm (0xf0)
        CTE Type: No Constant Tone Extension (0xff)
        Data status: [0;32mComplete[0m
        Data length: 0x30
        2f 16 51 18 40 9c 00 01 02 06 00 00 00 00 0a 02  /.Q.@...........
        01 07 02 02 00 03 04 61 00 06 03 02 04 00 01 09  .......a........
        01 06 05 03 01 00 00 00 02 06 05 03 02 00 00 00  ................
> HCI Event: LE Meta Event (0x3e) plen 20                                                                          #120 16.274066
      LE Broadcast Isochronous Group Info Advertising Report (0x22)
        Sync Handle: 0x03f2
        Number BIS: 2
        NSE: 3
        ISO Interval: 7.50 msec (0x0006)
        BN: 1
        PTO: 1
        IRC: 2
        Maximum PDU: 102
        SDU Interval: 8163 us (0x001fe3)
        Maximum SDU: 97
        PHY: LE 2M (0x02)
        Framing: Framed (0x01)
        Encryption: 0x00
> HCI Event: LE Meta Event (0x3e) plen 56                                                                          #121 17.023734
      LE Periodic Advertising Report (0x0f)
        Sync handle: 1010
        TX power: 127 dbm (0x7f)
        RSSI: -16 dBm (0xf0)
        CTE Type: No Constant Tone Extension (0xff)
        Data status: [0;32mComplete[0m
        Data length: 0x30
        2f 16 51 18 40 9c 00 01 02 06 00 00 00 00 0a 02  /.Q.@...........
        01 07 02 02 00 03 04 61 00 06 03 02 04 00 01 09  .......a........
        01 06 05 03 01 00 00 00 02 06 05 03 02 00 00 00  ................
> HCI Event: LE Meta Event (0x3e) plen 20                                                                          #122 17.023974
      LE Broadcast Isochronous Group Info Advertising Report (0x22)
        Sync Handle: 0x03f2
        Number BIS: 2
        NSE: 3
        ISO Interval: 7.50 msec (0x0006)
        BN: 1
        PTO: 1
        IRC: 2
        Maximum PDU: 102
        SDU Interval: 8163 us (0x001fe3)
        Maximum SDU: 97
        PHY: LE 2M (0x02)
        Framing: Framed (0x01)
        Encryption: 0x00
> HCI Event: LE Meta Event (0x3e) plen 56                                                                          #123 17.773735
      LE Periodic Advertising Report (0x0f)
        Sync handle: 1010
        TX power: 127 dbm (0x7f)
        RSSI: -16 dBm (0xf0)
        CTE Type: No Constant Tone Extension (0xff)
        Data status: [0;32mComplete[0m
        Data length: 0x30
        2f 16 51 18 40 9c 00 01 02 06 00 00 00 00 0a 02  /.Q.@...........
        01 07 02 02 00 03 04 61 00 06 03 02 04 00 01 09  .......a........
        01 06 05 03 01 00 00 00 02 06 05 03 02 00 00 00  ................
> HCI Event: LE Meta Event (0x3e) plen 20                                                                          #124 17.773994
      LE Broadcast Isochronous Group Info Advertising Report (0x22)
        Sync Handle: 0x03f2
        Number BIS: 2
        NSE: 3
        ISO Interval: 7.50 msec (0x0006)
        BN: 1
        PTO: 1
        IRC: 2
        Maximum PDU: 102
        SDU Interval: 8163 us (0x001fe3)
        Maximum SDU: 97
        PHY: LE 2M (0x02)
        Framing: Framed (0x01)
        Encryption: 0x00
> HCI Event: LE Meta Event (0x3e) plen 56                                                                          #125 18.523637
      LE Periodic Advertising Report (0x0f)
        Sync handle: 1010
        TX power: 127 dbm (0x7f)
        RSSI: -16 dBm (0xf0)
        CTE Type: No Constant Tone Extension (0xff)
        Data status: [0;32mComplete[0m
        Data length: 0x30
        2f 16 51 18 40 9c 00 01 02 06 00 00 00 00 0a 02  /.Q.@...........
        01 07 02 02 00 03 04 61 00 06 03 02 04 00 01 09  .......a........
        01 06 05 03 01 00 00 00 02 06 05 03 02 00 00 00  ................
> HCI Event: LE Meta Event (0x3e) plen 20                                                                          #126 18.523942
      LE Broadcast Isochronous Group Info Advertising Report (0x22)
        Sync Handle: 0x03f2
        Number BIS: 2
        NSE: 3
        ISO Interval: 7.50 msec (0x0006)
        BN: 1
        PTO: 1
        IRC: 2
        Maximum PDU: 102
        SDU Interval: 8163 us (0x001fe3)
        Maximum SDU: 97
        PHY: LE 2M (0x02)
        Framing: Framed (0x01)
        Encryption: 0x00
> HCI Event: LE Meta Event (0x3e) plen 56                                                                          #127 19.273768
      LE Periodic Advertising Report (0x0f)
        Sync handle: 1010
        TX power: 127 dbm (0x7f)
        RSSI: -17 dBm (0xef)
        CTE Type: No Constant Tone Extension (0xff)
        Data status: [0;32mComplete[0m
        Data length: 0x30
        2f 16 51 18 40 9c 00 01 02 06 00 00 00 00 0a 02  /.Q.@...........
        01 07 02 02 00 03 04 61 00 06 03 02 04 00 01 09  .......a........
        01 06 05 03 01 00 00 00 02 06 05 03 02 00 00 00  ................
> HCI Event: LE Meta Event (0x3e) plen 20                                                                          #128 19.274079
      LE Broadcast Isochronous Group Info Advertising Report (0x22)
        Sync Handle: 0x03f2
        Number BIS: 2
        NSE: 3
        ISO Interval: 7.50 msec (0x0006)
        BN: 1
        PTO: 1
        IRC: 2
        Maximum PDU: 102
        SDU Interval: 8163 us (0x001fe3)
        Maximum SDU: 97
        PHY: LE 2M (0x02)
        Framing: Framed (0x01)
        Encryption: 0x00
> HCI Event: LE Meta Event (0x3e) plen 56                                                                          #129 20.023835
      LE Periodic Advertising Report (0x0f)
        Sync handle: 1010
        TX power: 127 dbm (0x7f)
        RSSI: -16 dBm (0xf0)
        CTE Type: No Constant Tone Extension (0xff)
        Data status: [0;32mComplete[0m
        Data length: 0x30
        2f 16 51 18 40 9c 00 01 02 06 00 00 00 00 0a 02  /.Q.@...........
        01 07 02 02 00 03 04 61 00 06 03 02 04 00 01 09  .......a........
        01 06 05 03 01 00 00 00 02 06 05 03 02 00 00 00  ................
> HCI Event: LE Meta Event (0x3e) plen 20                                                                          #130 20.023970
      LE Broadcast Isochronous Group Info Advertising Report (0x22)
        Sync Handle: 0x03f2
        Number BIS: 2
        NSE: 3
        ISO Interval: 7.50 msec (0x0006)
        BN: 1
        PTO: 1
        IRC: 2
        Maximum PDU: 102
        SDU Interval: 8163 us (0x001fe3)
        Maximum SDU: 97
        PHY: LE 2M (0x02)
        Framing: Framed (0x01)
        Encryption: 0x00
> HCI Event: LE Meta Event (0x3e) plen 56                                                                          #131 20.773564
      LE Periodic Advertising Report (0x0f)
        Sync handle: 1010
        TX power: 127 dbm (0x7f)
        RSSI: -17 dBm (0xef)
        CTE Type: No Constant Tone Extension (0xff)
        Data status: [0;32mComplete[0m
        Data length: 0x30
        2f 16 51 18 40 9c 00 01 02 06 00 00 00 00 0a 02  /.Q.@...........
        01 07 02 02 00 03 04 61 00 06 03 02 04 00 01 09  .......a........
        01 06 05 03 01 00 00 00 02 06 05 03 02 00 00 00  ................
> HCI Event: LE Meta Event (0x3e) plen 20                                                                          #132 20.773888
      LE Broadcast Isochronous Group Info Advertising Report (0x22)
        Sync Handle: 0x03f2
        Number BIS: 2
        NSE: 3
        ISO Interval: 7.50 msec (0x0006)
        BN: 1
        PTO: 1
        IRC: 2
        Maximum PDU: 102
        SDU Interval: 8163 us (0x001fe3)
        Maximum SDU: 97
        PHY: LE 2M (0x02)
        Framing: Framed (0x01)
        Encryption: 0x00
> HCI Event: LE Meta Event (0x3e) plen 56                                                                          #133 21.523665
      LE Periodic Advertising Report (0x0f)
        Sync handle: 1010
        TX power: 127 dbm (0x7f)
        RSSI: -16 dBm (0xf0)
        CTE Type: No Constant Tone Extension (0xff)
        Data status: [0;32mComplete[0m
        Data length: 0x30
        2f 16 51 18 40 9c 00 01 02 06 00 00 00 00 0a 02  /.Q.@...........
        01 07 02 02 00 03 04 61 00 06 03 02 04 00 01 09  .......a........
        01 06 05 03 01 00 00 00 02 06 05 03 02 00 00 00  ................
> HCI Event: LE Meta Event (0x3e) plen 20                                                                          #134 21.523794
      LE Broadcast Isochronous Group Info Advertising Report (0x22)
        Sync Handle: 0x03f2
        Number BIS: 2
        NSE: 3
        ISO Interval: 7.50 msec (0x0006)
        BN: 1
        PTO: 1
        IRC: 2
        Maximum PDU: 102
        SDU Interval: 8163 us (0x001fe3)
        Maximum SDU: 97
        PHY: LE 2M (0x02)
        Framing: Framed (0x01)
        Encryption: 0x00
> HCI Event: LE Meta Event (0x3e) plen 56                                                                          #135 22.273513
      LE Periodic Advertising Report (0x0f)
        Sync handle: 1010
        TX power: 127 dbm (0x7f)
        RSSI: -16 dBm (0xf0)
        CTE Type: No Constant Tone Extension (0xff)
        Data status: [0;32mComplete[0m
        Data length: 0x30
        2f 16 51 18 40 9c 00 01 02 06 00 00 00 00 0a 02  /.Q.@...........
        01 07 02 02 00 03 04 61 00 06 03 02 04 00 01 09  .......a........
        01 06 05 03 01 00 00 00 02 06 05 03 02 00 00 00  ................
> HCI Event: LE Meta Event (0x3e) plen 20                                                                          #136 22.273909
      LE Broadcast Isochronous Group Info Advertising Report (0x22)
        Sync Handle: 0x03f2
        Number BIS: 2
        NSE: 3
        ISO Interval: 7.50 msec (0x0006)
        BN: 1
        PTO: 1
        IRC: 2
        Maximum PDU: 102
        SDU Interval: 8163 us (0x001fe3)
        Maximum SDU: 97
        PHY: LE 2M (0x02)
        Framing: Framed (0x01)
        Encryption: 0x00
> HCI Event: LE Meta Event (0x3e) plen 56                                                                          #137 23.023497
      LE Periodic Advertising Report (0x0f)
        Sync handle: 1010
        TX power: 127 dbm (0x7f)
        RSSI: -17 dBm (0xef)
        CTE Type: No Constant Tone Extension (0xff)
        Data status: [0;32mComplete[0m
        Data length: 0x30
        2f 16 51 18 40 9c 00 01 02 06 00 00 00 00 0a 02  /.Q.@...........
        01 07 02 02 00 03 04 61 00 06 03 02 04 00 01 09  .......a........
        01 06 05 03 01 00 00 00 02 06 05 03 02 00 00 00  ................
> HCI Event: LE Meta Event (0x3e) plen 20                                                                          #138 23.023755
      LE Broadcast Isochronous Group Info Advertising Report (0x22)
        Sync Handle: 0x03f2
        Number BIS: 2
        NSE: 3
        ISO Interval: 7.50 msec (0x0006)
        BN: 1
        PTO: 1
        IRC: 2
        Maximum PDU: 102
        SDU Interval: 8163 us (0x001fe3)
        Maximum SDU: 97
        PHY: LE 2M (0x02)
        Framing: Framed (0x01)
        Encryption: 0x00
> HCI Event: LE Meta Event (0x3e) plen 56                                                                          #139 23.773454
      LE Periodic Advertising Report (0x0f)
        Sync handle: 1010
        TX power: 127 dbm (0x7f)
        RSSI: -17 dBm (0xef)
        CTE Type: No Constant Tone Extension (0xff)
        Data status: [0;32mComplete[0m
        Data length: 0x30
        2f 16 51 18 40 9c 00 01 02 06 00 00 00 00 0a 02  /.Q.@...........
        01 07 02 02 00 03 04 61 00 06 03 02 04 00 01 09  .......a........
        01 06 05 03 01 00 00 00 02 06 05 03 02 00 00 00  ................
> HCI Event: LE Meta Event (0x3e) plen 20                                                                          #140 23.773723
      LE Broadcast Isochronous Group Info Advertising Report (0x22)
        Sync Handle: 0x03f2
        Number BIS: 2
        NSE: 3
        ISO Interval: 7.50 msec (0x0006)
        BN: 1
        PTO: 1
        IRC: 2
        Maximum PDU: 102
        SDU Interval: 8163 us (0x001fe3)
        Maximum SDU: 97
        PHY: LE 2M (0x02)
        Framing: Framed (0x01)
        Encryption: 0x00
> HCI Event: LE Meta Event (0x3e) plen 56                                                                          #141 24.523380
      LE Periodic Advertising Report (0x0f)
        Sync handle: 1010
        TX power: 127 dbm (0x7f)
        RSSI: -16 dBm (0xf0)
        CTE Type: No Constant Tone Extension (0xff)
        Data status: [0;32mComplete[0m
        Data length: 0x30
        2f 16 51 18 40 9c 00 01 02 06 00 00 00 00 0a 02  /.Q.@...........
        01 07 02 02 00 03 04 61 00 06 03 02 04 00 01 09  .......a........
        01 06 05 03 01 00 00 00 02 06 05 03 02 00 00 00  ................
> HCI Event: LE Meta Event (0x3e) plen 20                                                                          #142 24.523755
      LE Broadcast Isochronous Group Info Advertising Report (0x22)
        Sync Handle: 0x03f2
        Number BIS: 2
        NSE: 3
        ISO Interval: 7.50 msec (0x0006)
        BN: 1
        PTO: 1
        IRC: 2
        Maximum PDU: 102
        SDU Interval: 8163 us (0x001fe3)
        Maximum SDU: 97
        PHY: LE 2M (0x02)
        Framing: Framed (0x01)
        Encryption: 0x00
> HCI Event: LE Meta Event (0x3e) plen 56                                                                          #143 25.273458
      LE Periodic Advertising Report (0x0f)
        Sync handle: 1010
        TX power: 127 dbm (0x7f)
        RSSI: -16 dBm (0xf0)
        CTE Type: No Constant Tone Extension (0xff)
        Data status: [0;32mComplete[0m
        Data length: 0x30
        2f 16 51 18 40 9c 00 01 02 06 00 00 00 00 0a 02  /.Q.@...........
        01 07 02 02 00 03 04 61 00 06 03 02 04 00 01 09  .......a........
        01 06 05 03 01 00 00 00 02 06 05 03 02 00 00 00  ................
> HCI Event: LE Meta Event (0x3e) plen 20                                                                          #144 25.273585
      LE Broadcast Isochronous Group Info Advertising Report (0x22)
        Sync Handle: 0x03f2
        Number BIS: 2
        NSE: 3
        ISO Interval: 7.50 msec (0x0006)
        BN: 1
        PTO: 1
        IRC: 2
        Maximum PDU: 102
        SDU Interval: 8163 us (0x001fe3)
        Maximum SDU: 97
        PHY: LE 2M (0x02)
        Framing: Framed (0x01)
        Encryption: 0x00
> HCI Event: LE Meta Event (0x3e) plen 56                                                                          #145 26.023446
      LE Periodic Advertising Report (0x0f)
        Sync handle: 1010
        TX power: 127 dbm (0x7f)
        RSSI: -16 dBm (0xf0)
        CTE Type: No Constant Tone Extension (0xff)
        Data status: [0;32mComplete[0m
        Data length: 0x30
        2f 16 51 18 40 9c 00 01 02 06 00 00 00 00 0a 02  /.Q.@...........
        01 07 02 02 00 03 04 61 00 06 03 02 04 00 01 09  .......a........
        01 06 05 03 01 00 00 00 02 06 05 03 02 00 00 00  ................
> HCI Event: LE Meta Event (0x3e) plen 20                                                                          #146 26.023582
      LE Broadcast Isochronous Group Info Advertising Report (0x22)
        Sync Handle: 0x03f2
        Number BIS: 2
        NSE: 3
        ISO Interval: 7.50 msec (0x0006)
        BN: 1
        PTO: 1
        IRC: 2
        Maximum PDU: 102
        SDU Interval: 8163 us (0x001fe3)
        Maximum SDU: 97
        PHY: LE 2M (0x02)
        Framing: Framed (0x01)
        Encryption: 0x00
> HCI Event: LE Meta Event (0x3e) plen 56                                                                          #147 26.773422
      LE Periodic Advertising Report (0x0f)
        Sync handle: 1010
        TX power: 127 dbm (0x7f)
        RSSI: -16 dBm (0xf0)
        CTE Type: No Constant Tone Extension (0xff)
        Data status: [0;32mComplete[0m
        Data length: 0x30
        2f 16 51 18 40 9c 00 01 02 06 00 00 00 00 0a 02  /.Q.@...........
        01 07 02 02 00 03 04 61 00 06 03 02 04 00 01 09  .......a........
        01 06 05 03 01 00 00 00 02 06 05 03 02 00 00 00  ................
> HCI Event: LE Meta Event (0x3e) plen 20                                                                          #148 26.773653
      LE Broadcast Isochronous Group Info Advertising Report (0x22)
        Sync Handle: 0x03f2
        Number BIS: 2
        NSE: 3
        ISO Interval: 7.50 msec (0x0006)
        BN: 1
        PTO: 1
        IRC: 2
        Maximum PDU: 102
        SDU Interval: 8163 us (0x001fe3)
        Maximum SDU: 97
        PHY: LE 2M (0x02)
        Framing: Framed (0x01)
        Encryption: 0x00
> HCI Event: LE Meta Event (0x3e) plen 56                                                                          #149 27.523378
      LE Periodic Advertising Report (0x0f)
        Sync handle: 1010
        TX power: 127 dbm (0x7f)
        RSSI: -16 dBm (0xf0)
        CTE Type: No Constant Tone Extension (0xff)
        Data status: [0;32mComplete[0m
        Data length: 0x30
        2f 16 51 18 40 9c 00 01 02 06 00 00 00 00 0a 02  /.Q.@...........
        01 07 02 02 00 03 04 61 00 06 03 02 04 00 01 09  .......a........
        01 06 05 03 01 00 00 00 02 06 05 03 02 00 00 00  ................
> HCI Event: LE Meta Event (0x3e) plen 20                                                                          #150 27.523581
      LE Broadcast Isochronous Group Info Advertising Report (0x22)
        Sync Handle: 0x03f2
        Number BIS: 2
        N