Bluetooth monitor ver 5.72
btmon[121219]: = Note: Linux version 6.14.0-35-generic (x86_64)                                                          0.233901
btmon[121219]: = Note: Bluetooth subsystem version 2.22                                                                  0.233903
= New Index: 00:00:00:00:00:00 (Primary,UART,hci1)                                                                       0.233904
= New Index: 48:5F:99:8E:E0:64 (Primary,USB,hci0)                                                                        0.233904
= Open Index: 00:00:00:00:00:00                                                                                          0.748477
= Index Info: 00:00:00:00:00:00 (Nordic Semiconductor ASA)                                                               0.748489
zephyr.exe[121221]: @ USER Open: main (privileged) version 2.22                                                 {0x0001} 0.748497
zephyr.exe[121221]: < HCI Command: Reset (0x03|0x0003) plen 0                                                         #1 0.749691
> HCI Event: Command Complete (0x0e) plen 4                                                                           #2 0.750228
      Reset (0x03|0x0003) ncmd 1
        Status: Success (0x00)
zephyr.exe[121221]: < HCI Command: Read Local Supported Features (0x04|0x0003) plen 0                                 #3 0.768303
> HCI Event: Command Complete (0x0e) plen 12                                                                          #4 0.768853
      Read Local Supported Features (0x04|0x0003) ncmd 1
        Status: Success (0x00)
        Features: 0x00 0x00 0x00 0x00 0x60 0x00 0x00 0x00
          BR/EDR Not Supported
          LE Supported (Controller)
zephyr.exe[121221]: < HCI Command: Read Local Version Information (0x04|0x0001) plen 0                                #5 0.787980
> HCI Event: Command Complete (0x0e) plen 12                                                                          #6 0.788507
      Read Local Version Information (0x04|0x0001) ncmd 1
        Status: Success (0x00)
        HCI version: Reserved (0x0e) - Revision 12520 (0x30e8)
        LMP version: Reserved (0x0e) - Subversion 12520 (0x30e8)
        Manufacturer: Nordic Semiconductor ASA (89)
zephyr.exe[121221]: < HCI Command: Read Local Supported Commands (0x04|0x0002) plen 0                                 #7 0.807924
> HCI Event: Command Complete (0x0e) plen 68                                                                          #8 0.809011
      Read Local Supported Commands (0x04|0x0002) ncmd 1
        Status: Success (0x00)
        Commands: 119 entries
          Disconnect (Octet 0 - Bit 5)
          Read Remote Version Information (Octet 2 - Bit 7)
          Set Event Mask (Octet 5 - Bit 6)
          Reset (Octet 5 - Bit 7)
          Read Connection Accept Timeout (Octet 7 - Bit 2)
          Write Connection Accept Timeout (Octet 7 - Bit 3)
          Read Transmit Power Level (Octet 10 - Bit 2)
          Set Controller To Host Flow Control (Octet 10 - Bit 5)
          Host Buffer Size (Octet 10 - Bit 6)
          Host Number of Completed Packets (Octet 10 - Bit 7)
          Read Local Version Information (Octet 14 - Bit 3)
          Read Local Supported Features (Octet 14 - Bit 5)
          Read BD ADDR (Octet 15 - Bit 1)
          Read RSSI (Octet 15 - Bit 5)
          Set Event Mask Page 2 (Octet 22 - Bit 2)
          LE Set Event Mask (Octet 25 - Bit 0)
          LE Read Buffer Size (Octet 25 - Bit 1)
          LE Read Local Supported Features (Octet 25 - Bit 2)
          LE Set Random Address (Octet 25 - Bit 4)
          LE Set Advertising Parameters (Octet 25 - Bit 5)
          LE Read Advertising Channel TX Power (Octet 25 - Bit 6)
          LE Set Advertising Data (Octet 25 - Bit 7)
          LE Set Scan Response Data (Octet 26 - Bit 0)
          LE Set Advertise Enable (Octet 26 - Bit 1)
          LE Set Scan Parameters (Octet 26 - Bit 2)
          LE Set Scan Enable (Octet 26 - Bit 3)
          LE Create Connection (Octet 26 - Bit 4)
          LE Create Connection Cancel (Octet 26 - Bit 5)
          LE Read Accept List Size (Octet 26 - Bit 6)
          LE Clear Accept List (Octet 26 - Bit 7)
          LE Add Device To Accept List (Octet 27 - Bit 0)
          LE Remove Device From Accept List (Octet 27 - Bit 1)
          LE Connection Update (Octet 27 - Bit 2)
          LE Set Host Channel Classification (Octet 27 - Bit 3)
          LE Read Channel Map (Octet 27 - Bit 4)
          LE Read Remote Used Features (Octet 27 - Bit 5)
          LE Encrypt (Octet 27 - Bit 6)
          LE Rand (Octet 27 - Bit 7)
          LE Start Encryption (Octet 28 - Bit 0)
          LE Long Term Key Request Reply (Octet 28 - Bit 1)
          LE Long Term Key Request Neg Reply (Octet 28 - Bit 2)
          LE Read Supported States (Octet 28 - Bit 3)
          LE Receiver Test (Octet 28 - Bit 4)
          LE Transmitter Test (Octet 28 - Bit 5)
          LE Test End (Octet 28 - Bit 6)
          Read Authenticated Payload Timeout (Octet 32 - Bit 4)
          Write Authenticated Payload Timeout (Octet 32 - Bit 5)
          LE Set Data Length (Octet 33 - Bit 6)
          LE Read Suggested Default Data Length (Octet 33 - Bit 7)
          LE Write Suggested Default Data Length (Octet 34 - Bit 0)
          LE Add Device To Resolving List (Octet 34 - Bit 3)
          LE Remove Device From Resolving List (Octet 34 - Bit 4)
          LE Clear Resolving List (Octet 34 - Bit 5)
          LE Read Resolving List Size (Octet 34 - Bit 6)
          LE Set Address Resolution Enable (Octet 35 - Bit 1)
          LE Set Resolvable Private Address Timeout (Octet 35 - Bit 2)
          LE Read Maximum Data Length (Octet 35 - Bit 3)
          LE Read PHY (Octet 35 - Bit 4)
          LE Set Default PHY (Octet 35 - Bit 5)
          LE Set PHY (Octet 35 - Bit 6)
          LE Enhanced Receiver Test (Octet 35 - Bit 7)
          LE Enhanced Transmitter Test (Octet 36 - Bit 0)
          LE Set Advertising Set Random Address (Octet 36 - Bit 1)
          LE Set Extended Advertising Parameters (Octet 36 - Bit 2)
          LE Set Extended Advertising Data (Octet 36 - Bit 3)
          LE Set Extended Scan Response Data (Octet 36 - Bit 4)
          LE Set Extended Advertising Enable (Octet 36 - Bit 5)
          LE Read Maximum Advertising Data Length (Octet 36 - Bit 6)
          LE Read Number of Supported Advertising Sets (Octet 36 - Bit 7)
          LE Remove Advertising Set (Octet 37 - Bit 0)
          LE Clear Advertising Sets (Octet 37 - Bit 1)
          LE Set Periodic Advertising Parameters (Octet 37 - Bit 2)
          LE Set Periodic Advertising Data (Octet 37 - Bit 3)
          LE Set Periodic Advertising Enable (Octet 37 - Bit 4)
          LE Set Extended Scan Parameters (Octet 37 - Bit 5)
          LE Set Extended Scan Enable (Octet 37 - Bit 6)
          LE Extended Create Connection (Octet 37 - Bit 7)
          LE Periodic Advertising Create Sync (Octet 38 - Bit 0)
          LE Periodic Advertising Create Sync Cancel (Octet 38 - Bit 1)
          LE Periodic Advertising Terminate Sync (Octet 38 - Bit 2)
          LE Add Device To Periodic Advertiser List (Octet 38 - Bit 3)
          LE Remove Device From Periodic Advertiser List (Octet 38 - Bit 4)
          LE Clear Periodic Advertiser List (Octet 38 - Bit 5)
          LE Read Periodic Advertiser List Size (Octet 38 - Bit 6)
          LE Read Transmit Power (Octet 38 - Bit 7)
          LE Read RF Path Compensation (Octet 39 - Bit 0)
          LE Write RF Path Compensation (Octet 39 - Bit 1)
          LE Set Privacy Mode (Octet 39 - Bit 2)
          LE Periodic Advertising Receive Enable (Octet 40 - Bit 5)
          LE Periodic Advertising Sync Transfer (Octet 40 - Bit 6)
          LE Periodic Advertising Set Info Transfer (Octet 40 - Bit 7)
          LE Periodic Advertising Sync Transfer Parameters (Octet 41 - Bit 0)
          LE Set Default Periodic Advertisng Sync Transfer Parameters (Octet 41 - Bit 1)
          LE Read Buffer v2 (Octet 41 - Bit 5)
          LE Read ISO TX Sync (Octet 41 - Bit 6)
          LE Set Connected Isochronous Group Parameters (Octet 41 - Bit 7)
          LE Set Connected Isochronous Group Parameters Test (Octet 42 - Bit 0)
          LE Create Connected Isochronous Stream (Octet 42 - Bit 1)
          LE Remove Connected Isochronous Group (Octet 42 - Bit 2)
          LE Accept Connected Isochronous Stream Request (Octet 42 - Bit 3)
          LE Reject Connected Isochronous Stream Request (Octet 42 - Bit 4)
          LE Create Broadcast Isochronous Group (Octet 42 - Bit 5)
          LE Create Broadcast Isochronous Group Test (Octet 42 - Bit 6)
          LE Terminate Broadcast Isochronous Group (Octet 42 - Bit 7)
          LE Broadcast Isochronous Group Create Sync (Octet 43 - Bit 0)
          LE Broadcast Isochronous Group Terminate Sync (Octet 43 - Bit 1)
          LE Request Peer SCA (Octet 43 - Bit 2)
          LE Setup Isochronous Data Path (Octet 43 - Bit 3)
          LE Remove Isochronous Data Path (Octet 43 - Bit 4)
          LE Isochronous Transmit Test (Octet 43 - Bit 5)
          LE Isochronous Receive Test (Octet 43 - Bit 6)
          LE Isochronous Read Test Counters (Octet 43 - Bit 7)
          LE Isochronous Read Test Counters (Octet 44 - Bit 0)
          LE Set Host Feature (Octet 44 - Bit 1)
          Octet 44 - Bit 2 
          Octet 45 - Bit 6 
          Octet 46 - Bit 0 
          Octet 46 - Bit 1 
          Octet 46 - Bit 2 
zephyr.exe[121221]: < HCI Command: Host Buffer Size (0x03|0x0033) plen 7                                              #9 0.827928
        ACL MTU: 255  ACL max packet: 16
        SCO MTU: 0    SCO max packet: 0
> HCI Event: Command Complete (0x0e) plen 4                                                                          #10 0.828398
      Host Buffer Size (0x03|0x0033) ncmd 1
        Status: Success (0x00)
zephyr.exe[121221]: < HCI Command: Set Controller To Host Flow Control (0x03|0x0031) plen 1                          #11 0.847919
        Flow control: ACL Data Packets (0x01)
> HCI Event: Command Complete (0x0e) plen 4                                                                          #12 0.848456
      Set Controller To Host Flow Control (0x03|0x0031) ncmd 1
        Status: Success (0x00)
zephyr.exe[121221]: < HCI Command: LE Read Local Supported Features (0x08|0x0003) plen 0                             #13 0.867926
> HCI Event: Command Complete (0x0e) plen 12                                                                         #14 0.868433
      LE Read Local Supported Features (0x08|0x0003) ncmd 1
        Status: Success (0x00)
        Features: 0xfd 0x79 0x00 0xf7 0x30 0x01 0x00 0x00
          LE Encryption
          Extended Reject Indication
          Peripheral-initiated Features Exchange
          LE Ping
          LE Data Packet Length Extension
          LL Privacy
          Extended Scanner Filter Policies
          LE 2M PHY
          LE Coded PHY
          LE Extended Advertising
          LE Periodic Advertising
          Channel Selection Algorithm #2
          Periodic Advertising Sync Transfer - Sender
          Periodic Advertising Sync Transfer - Recipient
          Sleep Clock Accuracy Updates
          Connected Isochronous Stream - Central
          Connected Isochronous Stream - Peripheral
          Isochronous Broadcaster
          Synchronized Receiver
          Periodic Advertising ADI support
          Connection Subrating
          Unknown features (0x0000010000000000)
zephyr.exe[121221]: < HCI Command: LE Set Host Feature (0x08|0x0074) plen 2                                          #15 0.887947
        Bit Number: 32
          Connected Isochronous Stream (Host Support)
        Bit Value: 1
> HCI Event: Command Complete (0x0e) plen 4                                                                          #16 0.888337
      LE Set Host Feature (0x08|0x0074) ncmd 1
        Status: Success (0x00)
zephyr.exe[121221]: < HCI Command: LE Read Buffer v2 (0x08|0x0060) plen 0                                            #17 0.907922
> HCI Event: Command Complete (0x0e) plen 10                                                                         #18 0.908373
      LE Read Buffer v2 (0x08|0x0060) ncmd 1
        Status: Success (0x00)
        ACL MTU: 27
        ACL max packet: 3
        ISO MTU: 318
        ISO max packet: 3
zephyr.exe[121221]: < HCI Command: LE Read Maximum Advertising Data Length (0x08|0x003a) plen 0                      #19 0.927922
> HCI Event: Command Complete (0x0e) plen 6                                                                          #20 0.928355
      LE Read Maximum Advertising Data Length (0x08|0x003a) ncmd 1
        Status: Success (0x00)
        Max length: 1650
zephyr.exe[121221]: < HCI Command: LE Read Supported States (0x08|0x001c) plen 0                                     #21 0.947952
> HCI Event: Command Complete (0x0e) plen 12                                                                         #22 0.948430
      LE Read Supported States (0x08|0x001c) ncmd 1
        Status: Success (0x00)
        States: 0x000003ff3e0306ff
          Non-connectable Advertising State
          Scannable Advertising State
          Connectable Advertising State
          High Duty Cycle Directed Advertising State
          Passive Scanning State
          Active Scanning State
          Initiating State
            and Connection State (Central Role)
          Connection State (Peripheral Role)
          Scannable Advertising State
            and Passive Scanning State
          Connectable Advertising State
            and Passive Scanning State
          Non-connectable Advertising State
            and Initiating State
          Scannable Advertising State
            and Initiating State
          Active Scanning State
            and Connection State (Central Role)
          Passive Scanning State
            and Connection State (Peripheral Role)
          Active Scanning State
            and Connection State (Peripheral Role)
          Initiating State
            and Connection State (Central Role)
            and Central Role & Central Role
          Low Duty Cycle Directed Advertising State
          Connectable Advertising State
            and Initiating State
            and Central Role & Peripheral Role
          High Duty Cycle Directed Advertising State
            and Initiating State
            and Central Role & Peripheral Role
          Low Duty Cycle Directed Advertising State
            and Initiating State
            and Central Role & Peripheral Role
          Connectable Advertising State
            and Connection State (Central Role)
            and Central Role & Peripheral Role
          High Duty Cycle Directed Advertising State
            and Connection State (Central Role)
            and Central Role & Peripheral Role
          Low Duty Cycle Directed Advertising State
            and Connection State (Central Role)
            and Central Role & Peripheral Role
          Connectable Advertising State
            and Connection State (Peripheral Role)
            and Central Role & Peripheral Role
          High Duty Cycle Directed Advertising State
            and Connection State (Peripheral Role)
            and Peripheral Role & Peripheral Role
          Low Duty Cycle Directed Advertising State
            and Connection State (Peripheral Role)
            and Peripheral Role & Peripheral Role
          Initiating State
            and Connection State (Peripheral Role)
            and Central Role & Peripheral Role
zephyr.exe[121221]: < HCI Command: LE Read Maximum Data Length (0x08|0x002f) plen 0                                  #23 0.967926
> HCI Event: Command Complete (0x0e) plen 12                                                                         #24 0.968508
      LE Read Maximum Data Length (0x08|0x002f) ncmd 1
        Status: Success (0x00)
        Max TX octets: 251
        Max TX time: 2704
        Max RX octets: 251
        Max RX time: 2704
zephyr.exe[121221]: < HCI Command: LE Write Suggested Default Data Length (0x08|0x0024) plen 4                       #25 0.987923
        TX octets: 251
        TX time: 2704
> HCI Event: Command Complete (0x0e) plen 4                                                                          #26 0.988413
      LE Write Suggested Default Data Length (0x08|0x0024) ncmd 1
        Status: Success (0x00)
zephyr.exe[121221]: < HCI Command: LE Read Resolving List Size (0x08|0x002a) plen 0                                  #27 1.007929
> HCI Event: Command Complete (0x0e) plen 5                                                                          #28 1.008367
      LE Read Resolving List Size (0x08|0x002a) ncmd 1
        Status: Success (0x00)
        Size: 8
zephyr.exe[121221]: < HCI Command: LE Set Event Mask (0x08|0x0001) plen 8                                            #29 1.027926
        Mask: 0x000002023f87fa5e
          LE Advertising Report
          LE Connection Update Complete
          LE Read Remote Used Features Complete
          LE Long Term Key Request
          LE Data Length Change
          LE Enhanced Connection Complete
          LE PHY Update Complete
          LE Extended Advertising Report
          LE Periodic Advertising Sync Established
          LE Periodic Advertising Report
          LE Periodic Advertising Sync Lost
          LE Extended Scan Timeout
          LE Extended Advertising Set Terminated
          LE Scan Request Received
          LE Periodic Advertising Sync Transfer Rvc
          LE CIS Established
          LE CIS Request
          LE Create BIG Complete
          LE Terminate BIG Complete
          LE BIG Sync Estabilished Complete
          LE BIG Sync Lost
          LE BIG Info Advertising Report
          Unknown mask (0x0000020000000000)
> HCI Event: Command Complete (0x0e) plen 4                                                                          #30 1.028497
      LE Set Event Mask (0x08|0x0001) ncmd 1
        Status: Success (0x00)
zephyr.exe[121221]: < HCI Command: Set Event Mask (0x03|0x0001) plen 8                                               #31 1.047939
        Mask: 0x2000800002008890
          Disconnection Complete
          Encryption Change
          Read Remote Version Information Complete
          Hardware Error
          Data Buffer Overflow
          Encryption Key Refresh Complete
          LE Meta
> HCI Event: Command Complete (0x0e) plen 4                                                                          #32 1.048391
      Set Event Mask (0x03|0x0001) ncmd 1
        Status: Success (0x00)
zephyr.exe[121221]: < HCI Command: Read BD ADDR (0x04|0x0009) plen 0                                                 #33 1.067929
> HCI Event: Command Complete (0x0e) plen 10                                                                         #34 1.068353
      Read BD ADDR (0x04|0x0009) ncmd 1
        Status: Success (0x00)
        Address: 00:00:00:00:00:00 (OUI 00-00-00)
zephyr.exe[121221]: < HCI Command: LE Set Random Address (0x08|0x0005) plen 6                                        #35 1.087931
        Address: D5:B6:CC:31:DB:3B (Static)
> HCI Event: Command Complete (0x0e) plen 4                                                                          #36 1.088442
      LE Set Random Address (0x08|0x0005) ncmd 1
        Status: Success (0x00)
zephyr.exe[121221]: < HCI Command: LE Set Extended Advertising Parameters (0x08|0x0036) plen 25                      #37 5.368027
        Handle: 0x00
        Properties: 0x0013
          Connectable
          Scannable
          Use legacy advertising PDUs: ADV_IND
        Min advertising interval: 100.000 msec (0x00a0)
        Max advertising interval: 150.000 msec (0x00f0)
        Channel map: 37, 38, 39 (0x07)
        Own address type: Random (0x01)
        Peer address type: Public (0x00)
        Peer address: 00:00:00:00:00:00 (OUI 00-00-00)
        Filter policy: Allow Scan Request from Any, Allow Connect Request from Any (0x00)
        TX power: Host has no preference (0x7f)
        Primary PHY: LE 1M (0x01)
        Secondary max skip: 0x00
        Secondary PHY: LE 1M (0x01)
        SID: 0x00
        Scan request notifications: Disabled (0x00)
> HCI Event: Command Complete (0x0e) plen 5                                                                          #38 5.368901
      LE Set Extended Advertising Parameters (0x08|0x0036) ncmd 1
        Status: Success (0x00)
        TX power (selected): 0 dbm (0x00)
zephyr.exe[121221]: < HCI Command: LE Set Advertising Set Random Address (0x08|0x0035) plen 7                        #39 5.387996
        Advertising handle: 0x00
        Advertising random address: D5:B6:CC:31:DB:3B (Static)
> HCI Event: Command Complete (0x0e) plen 4                                                                          #40 5.388487
      LE Set Advertising Set Random Address (0x08|0x0035) ncmd 1
        Status: Success (0x00)
zephyr.exe[121221]: < HCI Command: LE Set Extended Advertising Data (0x08|0x0037) plen 22                            #41 5.407980
        Handle: 0x00
        Operation: Complete extended advertising data (0x03)
        Fragment preference: Minimize fragmentation (0x01)
        Data length: 0x12
        Flags: 0x06
          LE General Discoverable Mode
          BR/EDR Not Supported
        Name (complete): Tester_F6B11A
> HCI Event: Command Complete (0x0e) plen 4                                                                          #42 5.408644
      LE Set Extended Advertising Data (0x08|0x0037) ncmd 1
        Status: Success (0x00)
zephyr.exe[121221]: < HCI Command: LE Set Extended Scan Response Data (0x08|0x0038) plen 4                           #43 5.427993
        Handle: 0x00
        Operation: Complete scan response data (0x03)
        Fragment preference: Minimize fragmentation (0x01)
        Data length: 0x00
> HCI Event: Command Complete (0x0e) plen 4                                                                          #44 5.428508
      LE Set Extended Scan Response Data (0x08|0x0038) ncmd 1
        Status: Success (0x00)
zephyr.exe[121221]: < HCI Command: LE Set Extended Advertising Enable (0x08|0x0039) plen 6                           #45 5.447963
        Extended advertising: Enabled (0x01)
        Number of sets: 1 (0x01)
        Entry 0
          Handle: 0x00
          Duration: 0 ms (0x00)
          Max ext adv events: 0
> HCI Event: Command Complete (0x0e) plen 4                                                                          #46 5.448528
      LE Set Extended Advertising Enable (0x08|0x0039) ncmd 1
        Status: Success (0x00)
> HCI Event: LE Meta Event (0x3e) plen 31                                                                            #47 5.771031
      LE Enhanced Connection Complete (0x0a)
        Status: Success (0x00)
        Handle: 273
        Role: Peripheral (0x01)
        Peer address type: Public (0x00)
        Peer address: DF:A9:FF:F6:B1:1A (OUI DF-A9-FF)
        Local resolvable private address: 00:00:00:00:00:00 (Non-Resolvable)
        Peer resolvable private address: 00:00:00:00:00:00 (Non-Resolvable)
        Connection interval: 87.50 msec (0x0046)
        Connection latency: 0 (0x0000)
        Supervision timeout: 20000 msec (0x07d0)
        Central clock accuracy: 0x01
> HCI Event: LE Meta Event (0x3e) plen 6                                                                             #48 5.771134
      LE Advertising Set Terminated (0x12)
        Status: Success (0x00)
        Handle: 0
        Connection handle: 273
        Number of completed extended advertising events: 0
zephyr.exe[121221]: < HCI Command: LE Read Remote Used Features (0x08|0x0016) plen 2                                 #49 5.788198
        Handle: 273 Address: DF:A9:FF:F6:B1:1A (OUI DF-A9-FF)
> HCI Event: Command Status (0x0f) plen 4                                                                            #50 5.788665
      LE Read Remote Used Features (0x08|0x0016) ncmd 1
        Status: Success (0x00)
> HCI Event: LE Meta Event (0x3e) plen 12                                                                            #51 6.035047
      LE Read Remote Used Features (0x04)
        Status: Success (0x00)
        Handle: 273 Address: DF:A9:FF:F6:B1:1A (OUI DF-A9-FF)
        Features: 0x2d 0x49 0x00 0xf7 0x67 0xd8 0x00 0x00
          LE Encryption
          Extended Reject Indication
          Peripheral-initiated Features Exchange
          LE Data Packet Length Extension
          LE 2M PHY
          LE Coded PHY
          Channel Selection Algorithm #2
          Periodic Advertising Sync Transfer - Sender
          Periodic Advertising Sync Transfer - Recipient
          Sleep Clock Accuracy Updates
          Connected Isochronous Stream - Central
          Connected Isochronous Stream - Peripheral
          Isochronous Broadcaster
          Synchronized Receiver
          Connected Isochronous Stream (Host Support)
          LE Power Control Request
          LE Power Control Request
          Connection Subrating
          Connection Subrating (Host Support)
          Unknown features (0x0000d80000000000)
zephyr.exe[121221]: < ACL Data TX: Handle 273 flags 0x00 dlen 16                                                    #52 10.798309
      LE L2CAP: Connection Parameter Update Request (0x12) ident 1 len 8
        Min interval: 24
        Max interval: 40
        Peripheral latency: 0
        Timeout multiplier: 42
> HCI Event: Number of Completed Packets (0x13) plen 5                                                              #53 10.934468
        Num handles: 1
        Handle: 273 Address: DF:A9:FF:F6:B1:1A (OUI DF-A9-FF)
        Count: 1
        #52: len 16 (0 Kb/s)
        Latency: 136 msec (136-136 msec ~136 msec)
> ACL Data RX: Handle 273 flags 0x02 dlen 10                                                                        #54 10.934772
      LE L2CAP: Connection Parameter Update Response (0x13) ident 1 len 2
        Result: Connection Parameters accepted (0x0000)
zephyr.exe[121221]: < HCI Command: Host Number of Completed Packets (0x03|0x0035) plen 5                            #55 10.948343
        Num handles: 1
        Handle: 273 Address: DF:A9:FF:F6:B1:1A (OUI DF-A9-FF)
        Count: 1
> ACL Data RX: Handle 273 flags 0x02 dlen 11                                                                        #56 13.559411
      SMP: Pairing Request (0x01) len 6
        IO capability: KeyboardDisplay (0x04)
        OOB data: Authentication data not present (0x00)
        Authentication requirement: Bonding, No MITM, Legacy, No Keypresses (0x01)
        Max encryption key size: 16
        Initiator key distribution: EncKey IdKey Sign (0x07)
        Responder key distribution: EncKey IdKey Sign (0x07)
zephyr.exe[121221]: < HCI Command: Host Number of Completed Packets (0x03|0x0035) plen 5                            #57 13.568653
        Num handles: 1
        Handle: 273 Address: DF:A9:FF:F6:B1:1A (OUI DF-A9-FF)
        Count: 1
zephyr.exe[121221]: < ACL Data TX: Handle 273 flags 0x00 dlen 11                                                    #58 13.568819
      SMP: Pairing Response (0x02) len 6
        IO capability: NoInputNoOutput (0x03)
        OOB data: Authentication data not present (0x00)
        Authentication requirement: Bonding, No MITM, Legacy, No Keypresses (0x01)
        Max encryption key size: 16
        Initiator key distribution: EncKey IdKey (0x03)
        Responder key distribution: EncKey (0x01)
> HCI Event: Number of Completed Packets (0x13) plen 5                                                              #59 13.734416
        Num handles: 1
        Handle: 273 Address: DF:A9:FF:F6:B1:1A (OUI DF-A9-FF)
        Count: 1
        #58: len 11 (0 Kb/s)
        Latency: 165 msec (136-165 msec ~150 msec)
> ACL Data RX: Handle 273 flags 0x02 dlen 21                                                                        #60 13.734789
      SMP: Pairing Confirm (0x03) len 16
        Confim value: a168f781996a95a172691b0a4d9e75e8
zephyr.exe[121221]: < HCI Command: Host Number of Completed Packets (0x03|0x0035) plen 5                            #61 13.748602
        Num handles: 1
        Handle: 273 Address: DF:A9:FF:F6:B1:1A (OUI DF-A9-FF)
        Count: 1
zephyr.exe[121221]: < ACL Data TX: Handle 273 flags 0x00 dlen 21                                                    #62 13.748653
      SMP: Pairing Confirm (0x03) len 16
        Confim value: da9c45dd7031e04493b907413e4a0ff7
> HCI Event: Number of Completed Packets (0x13) plen 5                                                              #63 13.909370
        Num handles: 1
        Handle: 273 Address: DF:A9:FF:F6:B1:1A (OUI DF-A9-FF)
        Count: 1
        #62: len 21 (1 Kb/s)
        Latency: 160 msec (136-165 msec ~155 msec)
> ACL Data RX: Handle 273 flags 0x02 dlen 21                                                                        #64 13.909744
      SMP: Pairing Random (0x04) len 16
        Random value: 2e5f54a47c0980e80000000000000000
zephyr.exe[121221]: < HCI Command: Host Number of Completed Packets (0x03|0x0035) plen 5                            #65 13.928570
        Num handles: 1
        Handle: 273 Address: DF:A9:FF:F6:B1:1A (OUI DF-A9-FF)
        Count: 1
zephyr.exe[121221]: < ACL Data TX: Handle 273 flags 0x00 dlen 21                                                    #66 13.928654
      SMP: Pairing Random (0x04) len 16
        Random value: 8e6108f966a694cbe26df70bb96773e6
> HCI Event: Number of Completed Packets (0x13) plen 5                                                              #67 14.084263
        Num handles: 1
        Handle: 273 Address: DF:A9:FF:F6:B1:1A (OUI DF-A9-FF)
        Count: 1
        #66: len 21 (1 Kb/s)
        Latency: 155 msec (136-165 msec ~155 msec)
> HCI Event: LE Meta Event (0x3e) plen 13                                                                           #68 14.172286
      LE Long Term Key Request (0x05)
        Handle: 273 Address: DF:A9:FF:F6:B1:1A (OUI DF-A9-FF)
        Random number: 0x0000000000000000
        Encrypted diversifier: 0x0000
zephyr.exe[121221]: < HCI Command: LE Long Term Key Request Reply (0x08|0x001a) plen 18                             #69 14.188460
        Handle: 273 Address: DF:A9:FF:F6:B1:1A (OUI DF-A9-FF)
        Long term key: cd1b6d7f1303810852f9e06878383284
> HCI Event: Command Complete (0x0e) plen 6                                                                         #70 14.189168
      LE Long Term Key Request Reply (0x08|0x001a) ncmd 1
        Status: Success (0x00)
        Handle: 273 Address: DF:A9:FF:F6:B1:1A (OUI DF-A9-FF)
> HCI Event: Encryption Change (0x08) plen 4                                                                        #71 14.609515
        Status: Success (0x00)
        Handle: 273 Address: DF:A9:FF:F6:B1:1A (OUI DF-A9-FF)
        Encryption: Enabled with AES-CCM (0x01)
zephyr.exe[121221]: < ACL Data TX: Handle 273 flags 0x00 dlen 21                                                    #72 14.738711
      SMP: Encryption Information (0x06) len 16
        Long term key: 5da095555cc64d02679f89a05211af56
zephyr.exe[121221]: < ACL Data TX: Handle 273 flags 0x00 dlen 15                                                    #73 14.738734
      SMP: Central Identification (0x07) len 10
        EDIV: 0x825e
        Rand: 0x84c81ed264dab3d8
> HCI Event: Number of Completed Packets (0x13) plen 5                                                              #74 14.784905
        Num handles: 1
        Handle: 273 Address: DF:A9:FF:F6:B1:1A (OUI DF-A9-FF)
        Count: 1
        #72: len 21 (3 Kb/s)
        Latency: 46 msec (46-165 msec ~100 msec)
> HCI Event: Number of Completed Packets (0x13) plen 5                                                              #75 14.871967
        Num handles: 1
        Handle: 273 Address: DF:A9:FF:F6:B1:1A (OUI DF-A9-FF)
        Count: 1
        #73: len 15 (0 Kb/s)
        Latency: 133 msec (46-165 msec ~117 msec)
> ACL Data RX: Handle 273 flags 0x02 dlen 21                                                                        #76 14.872220
      SMP: Encryption Information (0x06) len 16
        Long term key: f19efb61ac85371d6bb0bfa99ce31905
> ACL Data RX: Handle 273 flags 0x02 dlen 15                                                                        #77 14.872593
      SMP: Central Identification (0x07) len 10
        EDIV: 0x603a
        Rand: 0xbf7b0d83df8f4a8a
> ACL Data RX: Handle 273 flags 0x02 dlen 21                                                                        #78 14.873311
      SMP: Identity Information (0x08) len 16
        Identity resolving key: 24c2826a6d9f09bcfca232ebb2f80726
zephyr.exe[121221]: < HCI Command: Host Number of Completed Packets (0x03|0x0035) plen 5                            #79 14.888197
        Num handles: 1
        Handle: 273 Address: DF:A9:FF:F6:B1:1A (OUI DF-A9-FF)
        Count: 1
zephyr.exe[121221]: < HCI Command: Host Number of Completed Packets (0x03|0x0035) plen 5                            #80 14.888229
        Num handles: 1
        Handle: 273 Address: DF:A9:FF:F6:B1:1A (OUI DF-A9-FF)
        Count: 1
zephyr.exe[121221]: < HCI Command: Host Number of Completed Packets (0x03|0x0035) plen 5                            #81 14.888246
        Num handles: 1
        Handle: 273 Address: DF:A9:FF:F6:B1:1A (OUI DF-A9-FF)
        Count: 1
> ACL Data RX: Handle 273 flags 0x02 dlen 12                                                                        #82 14.959519
      SMP: Identity Address Information (0x09) len 7
        Address: DF:A9:FF:F6:B1:1A (OUI DF-A9-FF)
> ACL Data RX: Handle 273 flags 0x02 dlen 26                                                                        #83 14.960318
      LE L2CAP: Enhanced Credit Connection Request (0x17) ident 1 len 18
        PSM: 39 (0x0027)
        MTU: 64
        MPS: 64
        Credits: 5
        Source CID: 84
        Source CID: 83
        Source CID: 82
        Source CID: 81
        Source CID: 80
zephyr.exe[121221]: < HCI Command: LE Add Device To Resolving List (0x08|0x0027) plen 39                            #84 14.968586
        Address type: Public (0x00)
        Address: DF:A9:FF:F6:B1:1A (OUI DF-A9-FF)
        Peer identity resolving key: 24c2826a6d9f09bcfca232ebb2f80726
        Local identity resolving key: 00000000000000000000000000000000
> HCI Event: Command Complete (0x0e) plen 4                                                                         #85 14.969544
      LE Add Device To Resolving List (0x08|0x0027) ncmd 1
        Status: Success (0x00)
zephyr.exe[121221]: < HCI Command: LE Set Privacy Mode (0x08|0x004e) plen 8                                         #86 14.988394
        Peer Identity address type: Public (0x00)
        Peer Identity address: DF:A9:FF:F6:B1:1A (OUI DF-A9-FF)
        Privacy Mode: Use Device Privacy (0x01)
> HCI Event: Command Complete (0x0e) plen 4                                                                         #87 14.988911
      LE Set Privacy Mode (0x08|0x004e) ncmd 1
        Status: Success (0x00)
zephyr.exe[121221]: < HCI Command: LE Set Address Resolution Enable (0x08|0x002d) plen 1                            #88 15.008185
        Address resolution: Enabled (0x01)
> HCI Event: Command Complete (0x0e) plen 4                                                                         #89 15.008668
      LE Set Address Resolution Enable (0x08|0x002d) ncmd 1
        Status: Success (0x00)
zephyr.exe[121221]: < HCI Command: Host Number of Completed Packets (0x03|0x0035) plen 5                            #90 15.028121
        Num handles: 1
        Handle: 273 Address: DF:A9:FF:F6:B1:1A (OUI DF-A9-FF)
        Count: 1
zephyr.exe[121221]: < HCI Command: Host Number of Completed Packets (0x03|0x0035) plen 5                            #91 15.028391
        Num handles: 1
        Handle: 273 Address: DF:A9:FF:F6:B1:1A (OUI DF-A9-FF)
        Count: 1
zephyr.exe[121221]: < ACL Data TX: Handle 273 flags 0x00 dlen 26                                                    #92 15.028503
      LE L2CAP: Enhanced Credit Connection Response (0x18) ident 1 len 18
        MTU: 249
        MPS: 251
        Credits: 1
        Result: Connection successful (0x0000)
        Destination CID: 64
        Destination CID: 65
        Destination CID: 66
        Destination CID: 67
        Destination CID: 68
> HCI Event: Number of Completed Packets (0x13) plen 5                                                              #93 15.134131
        Num handles: 1
        Handle: 273 Address: DF:A9:FF:F6:B1:1A (OUI DF-A9-FF)
        Count: 1
        #92: len 26 (1 Kb/s)
        Latency: 105 msec (46-165 msec ~111 msec)
zephyr.exe[121221]: < ACL Data TX: Handle 273 flags 0x00 dlen 27                                                    #94 17.869942
zephyr.exe[121221]: < ACL Data TX: Handle 273 flags 0x01 dlen 27                                                    #95 17.869970
zephyr.exe[121221]: < ACL Data TX: Handle 273 flags 0x01 dlen 14                                                    #96 17.870008
      Channel: 80 len 64 sdu 64 [PSM 39 mode Enhanced Credit (0x81)] {chan 4}
      ATT: Prepare Write Request (0x16) len 61
        Handle: 0x01b0
        Offset: 0x00ff
          Data: 121212121212121212121212121212121212121212121212121212121212121212121212121212121212121212121212121212121212121212
> HCI Event: Number of Completed Packets (0x13) plen 5                                                              #97 17.934846
        Num handles: 1
        Handle: 273 Address: DF:A9:FF:F6:B1:1A (OUI DF-A9-FF)
        Count: 1
        #94: len 27 (3 Kb/s)
        Latency: 64 msec (46-165 msec ~88 msec)
        Channel: 80 [PSM 39 mode Enhanced Credit (0x81)] {chan 4}
        Channel Latency: 64 msec (64-64 msec ~64 msec)
> HCI Event: Number of Completed Packets (0x13) plen 5                                                              #98 17.935472
        Num handles: 1
        Handle: 273 Address: DF:A9:FF:F6:B1:1A (OUI DF-A9-FF)
        Count: 1
        #95: len 27 (3 Kb/s)
        Latency: 65 msec (46-165 msec ~76 msec)
        Channel: 80 [PSM 39 mode Enhanced Credit (0x81)] {chan 4}
        Channel Latency: 65 msec (64-65 msec ~65 msec)
zephyr.exe[121221]: < ACL Data TX: Handle 273 flags 0x00 dlen 6                                                     #99 17.948129
      Channel: 80 len 2 sdu 2 [PSM 39 mode Enhanced Credit (0x81)] {chan 4}
        malformed attribute packet
> HCI Event: Number of Completed Packets (0x13) plen 5                                                             #100 18.021614
        Num handles: 1
        Handle: 273 Address: DF:A9:FF:F6:B1:1A (OUI DF-A9-FF)
        Count: 1
        #96: len 14 (0 Kb/s)
        Latency: 151 msec (46-165 msec ~114 msec)
        Channel: 80 [PSM 39 mode Enhanced Credit (0x81)] {chan 4}
        Channel Latency: 151 msec (64-151 msec ~108 msec)
> HCI Event: Number of Completed Packets (0x13) plen 5                                                             #101 18.109405
        Num handles: 1
        Handle: 273 Address: DF:A9:FF:F6:B1:1A (OUI DF-A9-FF)
        Count: 1
        #99: len 6 (0 Kb/s)
        Latency: 161 msec (46-165 msec ~137 msec)
> ACL Data RX: Handle 273 flags 0x02 dlen 27                                                                       #102 18.109740
> ACL Data RX: Handle 273 flags 0x01 dlen 27                                                                       #103 18.110250
> ACL Data RX: Handle 273 flags 0x01 dlen 16                                                                       #104 18.110810
      Channel: 68 len 66 sdu 64 [PSM 39 mode Enhanced Credit (0x81)] {chan 4}
      ATT: Prepare Write Response (0x17) len 63
        Handle: 0x01b0
        Offset: 0x00ff
          Data: 1212121212121212121212121212121212121212121212121212121212121212121212121212121212121212121212121212121212121212121212
zephyr.exe[121221]: < HCI Command: Host Number of Completed Packets (0x03|0x0035) plen 5                           #105 18.128250
        Num handles: 1
        Handle: 273 Address: DF:A9:FF:F6:B1:1A (OUI DF-A9-FF)
        Count: 1
zephyr.exe[121221]: < HCI Command: Host Number of Completed Packets (0x03|0x0035) plen 5                           #106 18.128256
        Num handles: 1
        Handle: 273 Address: DF:A9:FF:F6:B1:1A (OUI DF-A9-FF)
        Count: 1
zephyr.exe[121221]: < HCI Command: Host Number of Completed Packets (0x03|0x0035) plen 5                           #107 18.128271
        Num handles: 1
        Handle: 273 Address: DF:A9:FF:F6:B1:1A (OUI DF-A9-FF)
        Count: 1
zephyr.exe[121221]: < ACL Data TX: Handle 273 flags 0x00 dlen 27                                                   #108 18.128400
zephyr.exe[121221]: < ACL Data TX: Handle 273 flags 0x01 dlen 27                                                   #109 18.128411
zephyr.exe[121221]: < ACL Data TX: Handle 273 flags 0x01 dlen 14                                                   #110 18.128411
      Channel: 80 len 64 sdu 64 [PSM 39 mode Enhanced Credit (0x81)] {chan 4}
      ATT: Prepare Write Request (0x16) len 61
        Handle: 0x01b0
        Offset: 0x013a
          Data: 121212121212121212121212121212121212121212121212121212121212121212121212121212121212121212121212121212121212121212
> HCI Event: Number of Completed Packets (0x13) plen 5                                                             #111 18.197362
        Num handles: 1
        Handle: 273 Address: DF:A9:FF:F6:B1:1A (OUI DF-A9-FF)
        Count: 1
        #108: len 27 (3 Kb/s)
        Latency: 68 msec (46-165 msec ~103 msec)
        Channel: 80 [PSM 39 mode Enhanced Credit (0x81)] {chan 4}
        Channel Latency: 68 msec (64-151 msec ~88 msec)
> HCI Event: Number of Completed Packets (0x13) plen 5                                                             #112 18.198015
        Num handles: 1
        Handle: 273 Address: DF:A9:FF:F6:B1:1A (OUI DF-A9-FF)
        Count: 1
        #109: len 27 (3 Kb/s)
        Latency: 69 msec (46-165 msec ~86 msec)
        Channel: 80 [PSM 39 mode Enhanced Credit (0x81)] {chan 4}
        Channel Latency: 69 msec (64-151 msec ~79 msec)
zephyr.exe[121221]: < ACL Data TX: Handle 273 flags 0x00 dlen 12                                                   #113 18.208127
      LE L2CAP: LE Flow Control Credit (0x16) ident 2 len 4
        Source CID: 68
        Credits: 1
zephyr.exe[121221]: < ACL Data TX: Handle 273 flags 0x00 dlen 6                                                    #114 18.208176
      Channel: 80 len 2 sdu 2 [PSM 39 mode Enhanced Credit (0x81)] {chan 4}
        malformed attribute packet
> HCI Event: Number of Completed Packets (0x13) plen 5                                                             #115 18.284168
        Num handles: 1
        Handle: 273 Address: DF:A9:FF:F6:B1:1A (OUI DF-A9-FF)
        Count: 1
        #110: len 14 (0 Kb/s)
        Latency: 155 msec (46-165 msec ~121 msec)
> HCI Event: Number of Completed Packets (0x13) plen 5                                                             #116 18.284675
        Num handles: 1
        Handle: 273 Address: DF:A9:FF:F6:B1:1A (OUI DF-A9-FF)
        Count: 1
        #113: len 12 (1 Kb/s)
        Latency: 76 msec (46-165 msec ~98 msec)
        Channel: 80 [PSM 39 mode Enhanced Credit (0x81)] {chan 4}
        Channel Latency: 76 msec (64-151 msec ~77 msec)
> HCI Event: Number of Completed Packets (0x13) plen 5                                                             #117 18.371864
        Num handles: 1
        Handle: 273 Address: DF:A9:FF:F6:B1:1A (OUI DF-A9-FF)
        Count: 1
        #114: len 6 (0 Kb/s)
        Latency: 163 msec (46-165 msec ~131 msec)
> ACL Data RX: Handle 273 flags 0x02 dlen 12                                                                       #118 18.371953
      LE L2CAP: LE Flow Control Credit (0x16) ident 2 len 4
        Source CID: 80
        Credits: 10
> ACL Data RX: Handle 273 flags 0x02 dlen 27                                                                       #119 18.372670
> ACL Data RX: Handle 273 flags 0x01 dlen 27                                                                       #120 18.373433
zephyr.exe[121221]: < HCI Command: Host Number of Completed Packets (0x03|0x0035) plen 5                           #121 18.388260
        Num handles: 1
        Handle: 273 Address: DF:A9:FF:F6:B1:1A (OUI DF-A9-FF)
        Count: 1
zephyr.exe[121221]: < HCI Command: Host Number of Completed Packets (0x03|0x0035) plen 5                           #122 18.388365
        Num handles: 1
        Handle: 273 Address: DF:A9:FF:F6:B1:1A (OUI DF-A9-FF)
        Count: 1
> ACL Data RX: Handle 273 flags 0x01 dlen 16                                                                       #123 18.389016
      Channel: 68 len 66 sdu 64 [PSM 39 mode Enhanced Credit (0x81)] {chan 4}
      ATT: Prepare Write Response (0x17) len 63
        Handle: 0x01b0
        Offset: 0x013a
          Data: 1212121212121212121212121212121212121212121212121212121212121212121212121212121212121212121212121212121212121212121212
zephyr.exe[121221]: < HCI Command: Host Number of Completed Packets (0x03|0x0035) plen 5                           #124 18.408183
        Num handles: 1
        Handle: 273 Address: DF:A9:FF:F6:B1:1A (OUI DF-A9-FF)
        Count: 1
zephyr.exe[121221]: < HCI Command: Host Number of Completed Packets (0x03|0x0035) plen 5                           #125 18.408206
        Num handles: 1
        Handle: 273 Address: DF:A9:FF:F6:B1:1A (OUI DF-A9-FF)
        Count: 1
zephyr.exe[121221]: < ACL Data TX: Handle 273 flags 0x00 dlen 27                                                   #126 18.408236
zephyr.exe[121221]: < ACL Data TX: Handle 273 flags 0x01 dlen 27                                                   #127 18.408238
zephyr.exe[121221]: < ACL Data TX: Handle 273 flags 0x01 dlen 14                                                   #128 18.408246
      Channel: 80 len 64 sdu 64 [PSM 39 mode Enhanced Credit (0x81)] {chan 4}
      ATT: Prepare Write Request (0x16) len 61
        Handle: 0x01b0
        Offset: 0x0175
          Data: 121212121212121212121212121212121212121212121212121212121212121212121212121212121212121212121212121212121212121212
> HCI Event: Number of Completed Packets (0x13) plen 5                                                             #129 18.459850
        Num handles: 1
        Handle: 273 Address: DF:A9:FF:F6:B1:1A (OUI DF-A9-FF)
        Count: 1
        #126: len 27 (4 Kb/s)
        Latency: 51 msec (46-165 msec ~91 msec)
        Channel: 80 [PSM 39 mode Enhanced Credit (0x81)] {chan 4}
        Channel Latency: 51 msec (51-151 msec ~64 msec)
> HCI Event: Number of Completed Packets (0x13) plen 5                                                             #130 18.460416
        Num handles: 1
        Handle: 273 Address: DF:A9:FF:F6:B1:1A (OUI DF-A9-FF)
        Count: 1
        #127: len 27 (4 Kb/s)
        Latency: 52 msec (46-165 msec ~71 msec)
        Channel: 80 [PSM 39 mode Enhanced Credit (0x81)] {chan 4}
        Channel Latency: 52 msec (51-151 msec ~58 msec)
zephyr.exe[121221]: < ACL Data TX: Handle 273 flags 0x00 dlen 12                                                   #131 18.468177
      LE L2CAP: LE Flow Control Credit (0x16) ident 3 len 4
        Source CID: 68
        Credits: 1
zephyr.exe[121221]: < ACL Data TX: Handle 273 flags 0x00 dlen 6                                                    #132 18.468249
      Channel: 80 len 2 sdu 2 [PSM 39 mode Enhanced Credit (0x81)] {chan 4}
        malformed attribute packet
> HCI Event: Number of Completed Packets (0x13) plen 5                                                             #133 18.546678
        Num handles: 1
        Handle: 273 Address: DF:A9:FF:F6:B1:1A (OUI DF-A9-FF)
        Count: 1
        #128: len 14 (0 Kb/s)
        Latency: 138 msec (46-165 msec ~105 msec)
> HCI Event: Number of Completed Packets (0x13) plen 5                                                             #134 18.547197
        Num handles: 1
        Handle: 273 Address: DF:A9:FF:F6:B1:1A (OUI DF-A9-FF)
        Count: 1
        #131: len 12 (1 Kb/s)
        Latency: 79 msec (46-165 msec ~92 msec)
        Channel: 80 [PSM 39 mode Enhanced Credit (0x81)] {chan 4}
        Channel Latency: 79 msec (51-151 msec ~68 msec)
> HCI Event: Number of Completed Packets (0x13) plen 5                                                             #135 18.634439
        Num handles: 1
        Handle: 273 Address: DF:A9:FF:F6:B1:1A (OUI DF-A9-FF)
        Count: 1
        #132: len 6 (0 Kb/s)
        Latency: 166 msec (46-166 msec ~129 msec)
> ACL Data RX: Handle 273 flags 0x02 dlen 27                                                                       #136 18.634734
> ACL Data RX: Handle 273 flags 0x01 dlen 27                                                                       #137 18.635201
> ACL Data RX: Handle 273 flags 0x01 dlen 16                                                                       #138 18.635798
      Channel: 68 len 66 sdu 64 [PSM 39 mode Enhanced Credit (0x81)] {chan 4}
      ATT: Prepare Write Response (0x17) len 63
        Handle: 0x01b0
        Offset: 0x0175
          Data: 1212121212121212121212121212121212121212121212121212121212121212121212121212121212121212121212121212121212121212121212
zephyr.exe[121221]: < HCI Command: Host Number of Completed Packets (0x03|0x0035) plen 5                           #139 18.648286
        Num handles: 1
        Handle: 273 Address: DF:A9:FF:F6:B1:1A (OUI DF-A9-FF)
        Count: 1
zephyr.exe[121221]: < HCI Command: Host Number of Completed Packets (0x03|0x0035) plen 5                           #140 18.648412
        Num handles: 1
        Handle: 273 Address: DF:A9:FF:F6:B1:1A (OUI DF-A9-FF)
        Count: 1
zephyr.exe[121221]: < HCI Command: Host Number of Completed Packets (0x03|0x0035) plen 5                           #141 18.648416
        Num handles: 1
        Handle: 273 Address: DF:A9:FF:F6:B1:1A (OUI DF-A9-FF)
        Count: 1
zephyr.exe[121221]: < ACL Data TX: Handle 273 flags 0x00 dlen 27                                                   #142 18.648502
zephyr.exe[121221]: < ACL Data TX: Handle 273 flags 0x01 dlen 27                                                   #143 18.648506
zephyr.exe[121221]: < ACL Data TX: Handle 273 flags 0x01 dlen 14                                                   #144 18.648507
      Channel: 80 len 64 sdu 64 [PSM 39 mode Enhanced Credit (0x81)] {chan 4}
      ATT: Prepare Write Request (0x16) len 61
        Handle: 0x01b0
        Offset: 0x01b0
          Data: 121212121212121212121212121212121212121212121212121212121212121212121212121212121212121212121212121212121212121212
> HCI Event: Number of Completed Packets (0x13) plen 5                                                             #145 18.722323
        Num handles: 1
        Handle: 273 Address: DF:A9:FF:F6:B1:1A (OUI DF-A9-FF)
        Count: 1
        #142: len 27 (2 Kb/s)
        Latency: 73 msec (46-166 msec ~101 msec)
        Channel: 80 [PSM 39 mode Enhanced Credit (0x81)] {chan 4}
        Channel Latency: 73 msec (51-151 msec ~71 msec)
> HCI Event: Number of Completed Packets (0x13) plen 5                                                             #146 18.723041
        Num handles: 1
        Handle: 273 Address: DF:A9:FF:F6:B1:1A (OUI DF-A9-FF)
        Count: 1
        #143: len 27 (2 Kb/s)
        Latency: 74 msec (46-166 msec ~88 msec)
        Channel: 80 [PSM 39 mode Enhanced Credit (0x81)] {chan 4}
        Channel Latency: 74 msec (51-151 msec ~72 msec)
zephyr.exe[121221]: < ACL Data TX: Handle 273 flags 0x00 dlen 12                                                   #147 18.728133
      LE L2CAP: LE Flow Control Credit (0x16) ident 4 len 4
        Source CID: 68
        Credits: 1
zephyr.exe[121221]: < ACL Data TX: Handle 273 flags 0x00 dlen 6                                                    #148 18.728206
      Channel: 80 len 2 sdu 2 [PSM 39 mode Enhanced Credit (0x81)] {chan 4}
        malformed attribute packet
> HCI Event: Number of Completed Packets (0x13) plen 5                                                             #149 18.809225
        Num handles: 1
        Handle: 273 Address: DF:A9:FF:F6:B1:1A (OUI DF-A9-FF)
        Count: 1
        #144: len 14 (0 Kb/s)
        Latency: 160 msec (46-166 msec ~124 msec)
> HCI Event: Number of Completed Packets (0x13) plen 5                                                             #150 18.809635
        Num handles: 1
        Handle: 273 Address: DF:A9:FF:F6:B1:1A (OUI DF-A9-FF)
        Count: 1
        #147: len 12 (1 Kb/s)
        Latency: 81 msec (46-166 msec ~102 msec)
        Channel: 80 [PSM 39 mode Enhanced Credit (0x81)] {chan 4}
        Channel Latency: 81 msec (51-151 msec ~77 msec)
> HCI Event: Number of Completed Packets (0x13) plen 5                                                             #151 18.896796
        Num handles: 1
        Handle: 273 Address: DF:A9:FF:F6:B1:1A (OUI DF-A9-FF)
        Count: 1
        #148: len 6 (0 Kb