Bluetooth monitor ver 5.72
= Note: Linux version 6.14.0-36-generic (x86_64)                       0.850331
= Note: Bluetooth subsystem version 2.22                               0.850333
= New Index: 00:00:00:00:00:00 (Primary,UART,hci1)              [hci1] 0.850334
= New Index: 48:5F:99:8E:E0:64 (Primary,USB,hci0)               [hci0] 0.850335
= Open Index: 00:00:00:00:00:00                                 [hci1] 0.964067
= Index Info: 00:00:00:00:00:00 (Nordic Semiconductor ASA)      [hci1] 0.964084
@ USER Open: main (privileged) version 2.22            {0x0001} [hci1] 0.964094
< HCI Command: Reset (0x03|0x0003) plen 0                    #1 [hci1] 0.965389
> HCI Event: Command Complete (0x0e) plen 4                  #2 [hci1] 0.965947
      Reset (0x03|0x0003) ncmd 1
        Status: Success (0x00)
< HCI Command: Read Local Supported... (0x04|0x0003) plen 0  #3 [hci1] 0.983914
> HCI Event: Command Complete (0x0e) plen 12                 #4 [hci1] 0.984444
      Read Local Supported Features (0x04|0x0003) ncmd 1
        Status: Success (0x00)
        Features: 0x00 0x00 0x00 0x00 0x60 0x00 0x00 0x00
          BR/EDR Not Supported
          LE Supported (Controller)
< HCI Command: Read Local Version In.. (0x04|0x0001) plen 0  #5 [hci1] 1.003486
> HCI Event: Command Complete (0x0e) plen 12                 #6 [hci1] 1.004019
      Read Local Version Information (0x04|0x0001) ncmd 1
        Status: Success (0x00)
        HCI version: Reserved (0x0f) - Revision 12393 (0x3069)
        LMP version: Reserved (0x0f) - Subversion 12393 (0x3069)
        Manufacturer: Nordic Semiconductor ASA (89)
< HCI Command: Read Local Supported... (0x04|0x0002) plen 0  #7 [hci1] 1.023479
> HCI Event: Command Complete (0x0e) plen 68                 #8 [hci1] 1.024535
      Read Local Supported Commands (0x04|0x0002) ncmd 1
        Status: Success (0x00)
        Commands: 119 entries
          Disconnect (Octet 0 - Bit 5)
          Read Remote Version Information (Octet 2 - Bit 7)
          Set Event Mask (Octet 5 - Bit 6)
          Reset (Octet 5 - Bit 7)
          Read Connection Accept Timeout (Octet 7 - Bit 2)
          Write Connection Accept Timeout (Octet 7 - Bit 3)
          Read Transmit Power Level (Octet 10 - Bit 2)
          Set Controller To Host Flow Control (Octet 10 - Bit 5)
          Host Buffer Size (Octet 10 - Bit 6)
          Host Number of Completed Packets (Octet 10 - Bit 7)
          Read Local Version Information (Octet 14 - Bit 3)
          Read Local Supported Features (Octet 14 - Bit 5)
          Read BD ADDR (Octet 15 - Bit 1)
          Read RSSI (Octet 15 - Bit 5)
          Set Event Mask Page 2 (Octet 22 - Bit 2)
          LE Set Event Mask (Octet 25 - Bit 0)
          LE Read Buffer Size (Octet 25 - Bit 1)
          LE Read Local Supported Features (Octet 25 - Bit 2)
          LE Set Random Address (Octet 25 - Bit 4)
          LE Set Advertising Parameters (Octet 25 - Bit 5)
          LE Read Advertising Channel TX Power (Octet 25 - Bit 6)
          LE Set Advertising Data (Octet 25 - Bit 7)
          LE Set Scan Response Data (Octet 26 - Bit 0)
          LE Set Advertise Enable (Octet 26 - Bit 1)
          LE Set Scan Parameters (Octet 26 - Bit 2)
          LE Set Scan Enable (Octet 26 - Bit 3)
          LE Create Connection (Octet 26 - Bit 4)
          LE Create Connection Cancel (Octet 26 - Bit 5)
          LE Read Accept List Size (Octet 26 - Bit 6)
          LE Clear Accept List (Octet 26 - Bit 7)
          LE Add Device To Accept List (Octet 27 - Bit 0)
          LE Remove Device From Accept List (Octet 27 - Bit 1)
          LE Connection Update (Octet 27 - Bit 2)
          LE Set Host Channel Classification (Octet 27 - Bit 3)
          LE Read Channel Map (Octet 27 - Bit 4)
          LE Read Remote Used Features (Octet 27 - Bit 5)
          LE Encrypt (Octet 27 - Bit 6)
          LE Rand (Octet 27 - Bit 7)
          LE Start Encryption (Octet 28 - Bit 0)
          LE Long Term Key Request Reply (Octet 28 - Bit 1)
          LE Long Term Key Request Neg Reply (Octet 28 - Bit 2)
          LE Read Supported States (Octet 28 - Bit 3)
          LE Receiver Test (Octet 28 - Bit 4)
          LE Transmitter Test (Octet 28 - Bit 5)
          LE Test End (Octet 28 - Bit 6)
          Read Authenticated Payload Timeout (Octet 32 - Bit 4)
          Write Authenticated Payload Timeout (Octet 32 - Bit 5)
          LE Set Data Length (Octet 33 - Bit 6)
          LE Read Suggested Default Data Length (Octet 33 - Bit 7)
          LE Write Suggested Default Data Length (Octet 34 - Bit 0)
          LE Add Device To Resolving List (Octet 34 - Bit 3)
          LE Remove Device From Resolving List (Octet 34 - Bit 4)
          LE Clear Resolving List (Octet 34 - Bit 5)
          LE Read Resolving List Size (Octet 34 - Bit 6)
          LE Set Address Resolution Enable (Octet 35 - Bit 1)
          LE Set Resolvable Private Address Timeout (Octet 35 - Bit 2)
          LE Read Maximum Data Length (Octet 35 - Bit 3)
          LE Read PHY (Octet 35 - Bit 4)
          LE Set Default PHY (Octet 35 - Bit 5)
          LE Set PHY (Octet 35 - Bit 6)
          LE Enhanced Receiver Test (Octet 35 - Bit 7)
          LE Enhanced Transmitter Test (Octet 36 - Bit 0)
          LE Set Advertising Set Random Address (Octet 36 - Bit 1)
          LE Set Extended Advertising Parameters (Octet 36 - Bit 2)
          LE Set Extended Advertising Data (Octet 36 - Bit 3)
          LE Set Extended Scan Response Data (Octet 36 - Bit 4)
          LE Set Extended Advertising Enable (Octet 36 - Bit 5)
          LE Read Maximum Advertising Data Length (Octet 36 - Bit 6)
          LE Read Number of Supported Advertising Sets (Octet 36 - Bit 7)
          LE Remove Advertising Set (Octet 37 - Bit 0)
          LE Clear Advertising Sets (Octet 37 - Bit 1)
          LE Set Periodic Advertising Parameters (Octet 37 - Bit 2)
          LE Set Periodic Advertising Data (Octet 37 - Bit 3)
          LE Set Periodic Advertising Enable (Octet 37 - Bit 4)
          LE Set Extended Scan Parameters (Octet 37 - Bit 5)
          LE Set Extended Scan Enable (Octet 37 - Bit 6)
          LE Extended Create Connection (Octet 37 - Bit 7)
          LE Periodic Advertising Create Sync (Octet 38 - Bit 0)
          LE Periodic Advertising Create Sync Cancel (Octet 38 - Bit 1)
          LE Periodic Advertising Terminate Sync (Octet 38 - Bit 2)
          LE Add Device To Periodic Advertiser List (Octet 38 - Bit 3)
          LE Remove Device From Periodic Advertiser List (Octet 38 - Bit 4)
          LE Clear Periodic Advertiser List (Octet 38 - Bit 5)
          LE Read Periodic Advertiser List Size (Octet 38 - Bit 6)
          LE Read Transmit Power (Octet 38 - Bit 7)
          LE Read RF Path Compensation (Octet 39 - Bit 0)
          LE Write RF Path Compensation (Octet 39 - Bit 1)
          LE Set Privacy Mode (Octet 39 - Bit 2)
          LE Periodic Advertising Receive Enable (Octet 40 - Bit 5)
          LE Periodic Advertising Sync Transfer (Octet 40 - Bit 6)
          LE Periodic Advertising Set Info Transfer (Octet 40 - Bit 7)
          LE Periodic Advertising Sync Transfer Parameters (Octet 41 - Bit 0)
          LE Set Default Periodic Advertisng Sync Transfer Parameters (Octet 41 - Bit 1)
          LE Read Buffer v2 (Octet 41 - Bit 5)
          LE Read ISO TX Sync (Octet 41 - Bit 6)
          LE Set Connected Isochronous Group Parameters (Octet 41 - Bit 7)
          LE Set Connected Isochronous Group Parameters Test (Octet 42 - Bit 0)
          LE Create Connected Isochronous Stream (Octet 42 - Bit 1)
          LE Remove Connected Isochronous Group (Octet 42 - Bit 2)
          LE Accept Connected Isochronous Stream Request (Octet 42 - Bit 3)
          LE Reject Connected Isochronous Stream Request (Octet 42 - Bit 4)
          LE Create Broadcast Isochronous Group (Octet 42 - Bit 5)
          LE Create Broadcast Isochronous Group Test (Octet 42 - Bit 6)
          LE Terminate Broadcast Isochronous Group (Octet 42 - Bit 7)
          LE Broadcast Isochronous Group Create Sync (Octet 43 - Bit 0)
          LE Broadcast Isochronous Group Terminate Sync (Octet 43 - Bit 1)
          LE Request Peer SCA (Octet 43 - Bit 2)
          LE Setup Isochronous Data Path (Octet 43 - Bit 3)
          LE Remove Isochronous Data Path (Octet 43 - Bit 4)
          LE Isochronous Transmit Test (Octet 43 - Bit 5)
          LE Isochronous Receive Test (Octet 43 - Bit 6)
          LE Isochronous Read Test Counters (Octet 43 - Bit 7)
          LE Isochronous Read Test Counters (Octet 44 - Bit 0)
          LE Set Host Feature (Octet 44 - Bit 1)
          Octet 44 - Bit 2 
          Octet 45 - Bit 6 
          Octet 46 - Bit 0 
          Octet 46 - Bit 1 
          Octet 46 - Bit 2 
< HCI Command: Host Buffer Size (0x03|0x0033) plen 7         #9 [hci1] 1.043428
        ACL MTU: 255  ACL max packet: 16
        SCO MTU: 0    SCO max packet: 0
> HCI Event: Command Complete (0x0e) plen 4                 #10 [hci1] 1.043996
      Host Buffer Size (0x03|0x0033) ncmd 1
        Status: Success (0x00)
< HCI Command: Set Controller To Ho.. (0x03|0x0031) plen 1  #11 [hci1] 1.063480
        Flow control: ACL Data Packets (0x01)
> HCI Event: Command Complete (0x0e) plen 4                 #12 [hci1] 1.063887
      Set Controller To Host Flow Control (0x03|0x0031) ncmd 1
        Status: Success (0x00)
< HCI Command: LE Read Local Suppor.. (0x08|0x0003) plen 0  #13 [hci1] 1.083461
> HCI Event: Command Complete (0x0e) plen 12                #14 [hci1] 1.083906
      LE Read Local Supported Features (0x08|0x0003) ncmd 1
        Status: Success (0x00)
        Features: 0xfd 0x79 0x00 0xf7 0x30 0x01 0x00 0x00
          LE Encryption
          Extended Reject Indication
          Peripheral-initiated Features Exchange
          LE Ping
          LE Data Packet Length Extension
          LL Privacy
          Extended Scanner Filter Policies
          LE 2M PHY
          LE Coded PHY
          LE Extended Advertising
          LE Periodic Advertising
          Channel Selection Algorithm #2
          Periodic Advertising Sync Transfer - Sender
          Periodic Advertising Sync Transfer - Recipient
          Sleep Clock Accuracy Updates
          Connected Isochronous Stream - Central
          Connected Isochronous Stream - Peripheral
          Isochronous Broadcaster
          Synchronized Receiver
          Periodic Advertising ADI support
          Connection Subrating
          Unknown features (0x0000010000000000)
< HCI Command: LE Set Host Feature (0x08|0x0074) plen 2     #15 [hci1] 1.103485
        Bit Number: 32
          Connected Isochronous Stream (Host Support)
        Bit Value: 1
> HCI Event: Command Complete (0x0e) plen 4                 #16 [hci1] 1.103961
      LE Set Host Feature (0x08|0x0074) ncmd 1
        Status: Success (0x00)
< HCI Command: LE Read Buffer v2 (0x08|0x0060) plen 0       #17 [hci1] 1.123461
> HCI Event: Command Complete (0x0e) plen 10                #18 [hci1] 1.123962
      LE Read Buffer v2 (0x08|0x0060) ncmd 1
        Status: Success (0x00)
        ACL MTU: 27
        ACL max packet: 3
        ISO MTU: 318
        ISO max packet: 3
< HCI Command: LE Read Maximum Adve.. (0x08|0x003a) plen 0  #19 [hci1] 1.143565
> HCI Event: Command Complete (0x0e) plen 6                 #20 [hci1] 1.144012
      LE Read Maximum Advertising Data Length (0x08|0x003a) ncmd 1
        Status: Success (0x00)
        Max length: 1650
< HCI Command: LE Read Supported St.. (0x08|0x001c) plen 0  #21 [hci1] 1.163457
> HCI Event: Command Complete (0x0e) plen 12                #22 [hci1] 1.163943
      LE Read Supported States (0x08|0x001c) ncmd 1
        Status: Success (0x00)
        States: 0x000003ff3e0306ff
          Non-connectable Advertising State
          Scannable Advertising State
          Connectable Advertising State
          High Duty Cycle Directed Advertising State
          Passive Scanning State
          Active Scanning State
          Initiating State
            and Connection State (Central Role)
          Connection State (Peripheral Role)
          Scannable Advertising State
            and Passive Scanning State
          Connectable Advertising State
            and Passive Scanning State
          Non-connectable Advertising State
            and Initiating State
          Scannable Advertising State
            and Initiating State
          Active Scanning State
            and Connection State (Central Role)
          Passive Scanning State
            and Connection State (Peripheral Role)
          Active Scanning State
            and Connection State (Peripheral Role)
          Initiating State
            and Connection State (Central Role)
            and Central Role & Central Role
          Low Duty Cycle Directed Advertising State
          Connectable Advertising State
            and Initiating State
            and Central Role & Peripheral Role
          High Duty Cycle Directed Advertising State
            and Initiating State
            and Central Role & Peripheral Role
          Low Duty Cycle Directed Advertising State
            and Initiating State
            and Central Role & Peripheral Role
          Connectable Advertising State
            and Connection State (Central Role)
            and Central Role & Peripheral Role
          High Duty Cycle Directed Advertising State
            and Connection State (Central Role)
            and Central Role & Peripheral Role
          Low Duty Cycle Directed Advertising State
            and Connection State (Central Role)
            and Central Role & Peripheral Role
          Connectable Advertising State
            and Connection State (Peripheral Role)
            and Central Role & Peripheral Role
          High Duty Cycle Directed Advertising State
            and Connection State (Peripheral Role)
            and Peripheral Role & Peripheral Role
          Low Duty Cycle Directed Advertising State
            and Connection State (Peripheral Role)
            and Peripheral Role & Peripheral Role
          Initiating State
            and Connection State (Peripheral Role)
            and Central Role & Peripheral Role
< HCI Command: LE Read Maximum Data.. (0x08|0x002f) plen 0  #23 [hci1] 1.183483
> HCI Event: Command Complete (0x0e) plen 12                #24 [hci1] 1.184074
      LE Read Maximum Data Length (0x08|0x002f) ncmd 1
        Status: Success (0x00)
        Max TX octets: 251
        Max TX time: 2704
        Max RX octets: 251
        Max RX time: 2704
< HCI Command: LE Write Suggested D.. (0x08|0x0024) plen 4  #25 [hci1] 1.203424
        TX octets: 251
        TX time: 2704
> HCI Event: Command Complete (0x0e) plen 4                 #26 [hci1] 1.203906
      LE Write Suggested Default Data Length (0x08|0x0024) ncmd 1
        Status: Success (0x00)
< HCI Command: LE Read Resolving Li.. (0x08|0x002a) plen 0  #27 [hci1] 1.223452
> HCI Event: Command Complete (0x0e) plen 5                 #28 [hci1] 1.223884
      LE Read Resolving List Size (0x08|0x002a) ncmd 1
        Status: Success (0x00)
        Size: 8
< HCI Command: LE Set Event Mask (0x08|0x0001) plen 8       #29 [hci1] 1.243449
        Mask: 0x000002023f87fa5e
          LE Advertising Report
          LE Connection Update Complete
          LE Read Remote Used Features Complete
          LE Long Term Key Request
          LE Data Length Change
          LE Enhanced Connection Complete
          LE PHY Update Complete
          LE Extended Advertising Report
          LE Periodic Advertising Sync Established
          LE Periodic Advertising Report
          LE Periodic Advertising Sync Lost
          LE Extended Scan Timeout
          LE Extended Advertising Set Terminated
          LE Scan Request Received
          LE Periodic Advertising Sync Transfer Rvc
          LE CIS Established
          LE CIS Request
          LE Create BIG Complete
          LE Terminate BIG Complete
          LE BIG Sync Estabilished Complete
          LE BIG Sync Lost
          LE BIG Info Advertising Report
          Unknown mask (0x0000020000000000)
> HCI Event: Command Complete (0x0e) plen 4                 #30 [hci1] 1.243929
      LE Set Event Mask (0x08|0x0001) ncmd 1
        Status: Success (0x00)
< HCI Command: Set Event Mask (0x03|0x0001) plen 8          #31 [hci1] 1.263496
        Mask: 0x2000800002008890
          Disconnection Complete
          Encryption Change
          Read Remote Version Information Complete
          Hardware Error
          Data Buffer Overflow
          Encryption Key Refresh Complete
          LE Meta
> HCI Event: Command Complete (0x0e) plen 4                 #32 [hci1] 1.264086
      Set Event Mask (0x03|0x0001) ncmd 1
        Status: Success (0x00)
< HCI Command: Read BD ADDR (0x04|0x0009) plen 0            #33 [hci1] 1.283457
> HCI Event: Command Complete (0x0e) plen 10                #34 [hci1] 1.283977
      Read BD ADDR (0x04|0x0009) ncmd 1
        Status: Success (0x00)
        Address: 00:00:00:00:00:00 (OUI 00-00-00)
< HCI Command: LE Set Random Address (0x08|0x0005) plen 6   #35 [hci1] 1.303458
        Address: D5:B6:CC:31:DB:3B (Static)
> HCI Event: Command Complete (0x0e) plen 4                 #36 [hci1] 1.303940
      LE Set Random Address (0x08|0x0005) ncmd 1
        Status: Success (0x00)
< HCI Command: LE Set Extended Adv.. (0x08|0x0036) plen 25  #37 [hci1] 3.884019
        Handle: 0x00
        Properties: 0x0013
          Connectable
          Scannable
          Use legacy advertising PDUs: ADV_IND
        Min advertising interval: 100.000 msec (0x00a0)
        Max advertising interval: 150.000 msec (0x00f0)
        Channel map: 37, 38, 39 (0x07)
        Own address type: Random (0x01)
        Peer address type: Public (0x00)
        Peer address: 00:00:00:00:00:00 (OUI 00-00-00)
        Filter policy: Allow Scan Request from Any, Allow Connect Request from Any (0x00)
        TX power: Host has no preference (0x7f)
        Primary PHY: LE 1M (0x01)
        Secondary max skip: 0x00
        Secondary PHY: LE 1M (0x01)
        SID: 0x00
        Scan request notifications: Disabled (0x00)
> HCI Event: Command Complete (0x0e) plen 5                 #38 [hci1] 3.884799
      LE Set Extended Advertising Parameters (0x08|0x0036) ncmd 1
        Status: Success (0x00)
        TX power (selected): 0 dbm (0x00)
< HCI Command: LE Set Advertising S.. (0x08|0x0035) plen 7  #39 [hci1] 3.903531
        Advertising handle: 0x00
        Advertising random address: D5:B6:CC:31:DB:3B (Static)
> HCI Event: Command Complete (0x0e) plen 4                 #40 [hci1] 3.904113
      LE Set Advertising Set Random Address (0x08|0x0035) ncmd 1
        Status: Success (0x00)
< HCI Command: LE Set Extended Adv.. (0x08|0x0037) plen 22  #41 [hci1] 3.923546
        Handle: 0x00
        Operation: Complete extended advertising data (0x03)
        Fragment preference: Minimize fragmentation (0x01)
        Data length: 0x12
        Flags: 0x06
          LE General Discoverable Mode
          BR/EDR Not Supported
        Name (complete): Tester_F6B11A
> HCI Event: Command Complete (0x0e) plen 4                 #42 [hci1] 3.924240
      LE Set Extended Advertising Data (0x08|0x0037) ncmd 1
        Status: Success (0x00)
< HCI Command: LE Set Extended Scan.. (0x08|0x0038) plen 4  #43 [hci1] 3.943519
        Handle: 0x00
        Operation: Complete scan response data (0x03)
        Fragment preference: Minimize fragmentation (0x01)
        Data length: 0x00
> HCI Event: Command Complete (0x0e) plen 4                 #44 [hci1] 3.943975
      LE Set Extended Scan Response Data (0x08|0x0038) ncmd 1
        Status: Success (0x00)
< HCI Command: LE Set Extended Adve.. (0x08|0x0039) plen 6  #45 [hci1] 3.963437
        Extended advertising: Enabled (0x01)
        Number of sets: 1 (0x01)
        Entry 0
          Handle: 0x00
          Duration: 0 ms (0x00)
          Max ext adv events: 0
> HCI Event: Command Complete (0x0e) plen 4                 #46 [hci1] 3.963955
      LE Set Extended Advertising Enable (0x08|0x0039) ncmd 1
        Status: Success (0x00)
> HCI Event: LE Meta Event (0x3e) plen 31                   #47 [hci1] 4.078498
      LE Enhanced Connection Complete (0x0a)
        Status: Success (0x00)
        Handle: 615
        Role: Peripheral (0x01)
        Peer address type: Public (0x00)
        Peer address: DF:A9:FF:F6:B1:1A (OUI DF-A9-FF)
        Local resolvable private address: 00:00:00:00:00:00 (Non-Resolvable)
        Peer resolvable private address: 00:00:00:00:00:00 (Non-Resolvable)
        Connection interval: 87.50 msec (0x0046)
        Connection latency: 0 (0x0000)
        Supervision timeout: 25120 msec (0x09d0)
        Central clock accuracy: 0x01
> HCI Event: LE Meta Event (0x3e) plen 6                    #48 [hci1] 4.078647
      LE Advertising Set Terminated (0x12)
        Status: Success (0x00)
        Handle: 0
        Connection handle: 615
        Number of completed extended advertising events: 0
< HCI Command: LE Read Remote Used... (0x08|0x0016) plen 2  #49 [hci1] 4.083710
        Handle: 615 Address: DF:A9:FF:F6:B1:1A (OUI DF-A9-FF)
< ACL Data TX: Handle 615 flags 0x00 dlen 7                 #50 [hci1] 4.083721
      ATT: Exchange MTU Request (0x02) len 2
        Client RX MTU: 251
> HCI Event: Command Status (0x0f) plen 4                   #51 [hci1] 4.084226
      LE Read Remote Used Features (0x08|0x0016) ncmd 1
        Status: Success (0x00)
> HCI Event: Number of Completed Packets (0x13) plen 5      #52 [hci1] 4.254578
        Num handles: 1
        Handle: 615 Address: DF:A9:FF:F6:B1:1A (OUI DF-A9-FF)
        Count: 1
        #50: len 7 (0 Kb/s)
        Latency: 170 msec (170-170 msec ~170 msec)
> HCI Event: LE Meta Event (0x3e) plen 12                   #53 [hci1] 4.342446
      LE Read Remote Used Features (0x04)
        Status: Success (0x00)
        Handle: 615 Address: DF:A9:FF:F6:B1:1A (OUI DF-A9-FF)
        Features: 0x2d 0x49 0x00 0xf7 0x67 0xd8 0x00 0x00
          LE Encryption
          Extended Reject Indication
          Peripheral-initiated Features Exchange
          LE Data Packet Length Extension
          LE 2M PHY
          LE Coded PHY
          Channel Selection Algorithm #2
          Periodic Advertising Sync Transfer - Sender
          Periodic Advertising Sync Transfer - Recipient
          Sleep Clock Accuracy Updates
          Connected Isochronous Stream - Central
          Connected Isochronous Stream - Peripheral
          Isochronous Broadcaster
          Synchronized Receiver
          Connected Isochronous Stream (Host Support)
          LE Power Control Request
          LE Power Control Request
          Connection Subrating
          Connection Subrating (Host Support)
          Unknown features (0x0000d80000000000)
> ACL Data RX: Handle 615 flags 0x02 dlen 11                #54 [hci1] 6.792139
      SMP: Pairing Request (0x01) len 6
        IO capability: KeyboardDisplay (0x04)
        OOB data: Authentication data not present (0x00)
        Authentication requirement: Bonding, MITM, SC, No Keypresses (0x0d)
        Max encryption key size: 16
        Initiator key distribution: EncKey IdKey (0x03)
        Responder key distribution: EncKey IdKey Sign (0x07)
> ACL Data RX: Handle 615 flags 0x02 dlen 7                 #55 [hci1] 6.792539
      ATT: Exchange MTU Response (0x03) len 2
        Server RX MTU: 23
< HCI Command: Host Number of Compl.. (0x03|0x0035) plen 5  #56 [hci1] 6.804110
        Num handles: 1
        Handle: 615 Address: DF:A9:FF:F6:B1:1A (OUI DF-A9-FF)
        Count: 1
< ACL Data TX: Handle 615 flags 0x00 dlen 11                #57 [hci1] 6.804208
      SMP: Pairing Response (0x02) len 6
        IO capability: DisplayOnly (0x00)
        OOB data: Authentication data not present (0x00)
        Authentication requirement: Bonding, No MITM, SC, No Keypresses (0x09)
        Max encryption key size: 16
        Initiator key distribution: IdKey (0x02)
        Responder key distribution: <none> (0x00)
< HCI Command: Host Number of Compl.. (0x03|0x0035) plen 5  #58 [hci1] 6.804602
        Num handles: 1
        Handle: 615 Address: DF:A9:FF:F6:B1:1A (OUI DF-A9-FF)
        Count: 1
> HCI Event: Number of Completed Packets (0x13) plen 5      #59 [hci1] 6.967125
        Num handles: 1
        Handle: 615 Address: DF:A9:FF:F6:B1:1A (OUI DF-A9-FF)
        Count: 1
        #57: len 11 (0 Kb/s)
        Latency: 162 msec (162-170 msec ~166 msec)
> ACL Data RX: Handle 615 flags 0x02 dlen 27                #60 [hci1] 6.967549
> ACL Data RX: Handle 615 flags 0x01 dlen 27                #61 [hci1] 6.968007
> ACL Data RX: Handle 615 flags 0x01 dlen 15                #62 [hci1] 6.968468
      SMP: Pairing Public Key (0x0c) len 64
        X: 38b3f82c9101b9f1c5fe46b5b7c99dddb77f0a46e644b10c157931725f37cb75
        Y: 415ae790e10fc3d8315fe474d39f8873ce69de0c459d1e7f2a238e2bb65e1329
< HCI Command: Host Number of Compl.. (0x03|0x0035) plen 5  #63 [hci1] 6.984452
        Num handles: 1
        Handle: 615 Address: DF:A9:FF:F6:B1:1A (OUI DF-A9-FF)
        Count: 1
< HCI Command: Host Number of Compl.. (0x03|0x0035) plen 5  #64 [hci1] 6.984736
        Num handles: 1
        Handle: 615 Address: DF:A9:FF:F6:B1:1A (OUI DF-A9-FF)
        Count: 1
< HCI Command: Host Number of Compl.. (0x03|0x0035) plen 5  #65 [hci1] 6.985195
        Num handles: 1
        Handle: 615 Address: DF:A9:FF:F6:B1:1A (OUI DF-A9-FF)
        Count: 1
< ACL Data TX: Handle 615 flags 0x00 dlen 27                #66 [hci1] 6.985304
< ACL Data TX: Handle 615 flags 0x01 dlen 27                #67 [hci1] 6.985324
< ACL Data TX: Handle 615 flags 0x01 dlen 15                #68 [hci1] 6.985390
      SMP: Pairing Public Key (0x0c) len 64
        X: 98308440221e2d910f0e54b71e7ec652857aa9b5a0dc65028824cc19db1226e9
        Y: 67a4816bcb62efb21701e31fdb27561a6217575fb007a8bbdabe7e28b6f68482
> HCI Event: Number of Completed Packets (0x13) plen 5      #69 [hci1] 7.055078
        Num handles: 1
        Handle: 615 Address: DF:A9:FF:F6:B1:1A (OUI DF-A9-FF)
        Count: 1
        #66: len 27 (3 Kb/s)
        Latency: 69 msec (69-170 msec ~118 msec)
> HCI Event: Number of Completed Packets (0x13) plen 5      #70 [hci1] 7.055673
        Num handles: 1
        Handle: 615 Address: DF:A9:FF:F6:B1:1A (OUI DF-A9-FF)
        Count: 1
        #67: len 27 (3 Kb/s)
        Latency: 70 msec (69-170 msec ~94 msec)
> HCI Event: Number of Completed Packets (0x13) plen 5      #71 [hci1] 7.141912
        Num handles: 1
        Handle: 615 Address: DF:A9:FF:F6:B1:1A (OUI DF-A9-FF)
        Count: 1
        #68: len 15 (0 Kb/s)
        Latency: 156 msec (69-170 msec ~125 msec)
> ACL Data RX: Handle 615 flags 0x02 dlen 21                #72 [hci1] 8.104751
      SMP: Pairing Confirm (0x03) len 16
        Confim value: b449c66223abaa632d9e548fa6efd758
< HCI Command: Host Number of Compl.. (0x03|0x0035) plen 5  #73 [hci1] 8.123825
        Num handles: 1
        Handle: 615 Address: DF:A9:FF:F6:B1:1A (OUI DF-A9-FF)
        Count: 1
< ACL Data TX: Handle 615 flags 0x00 dlen 21                #74 [hci1] 8.123929
      SMP: Pairing Confirm (0x03) len 16
        Confim value: d659e02394a191b8ced393a6369dd9dd
> HCI Event: Number of Completed Packets (0x13) plen 5      #75 [hci1] 8.279561
        Num handles: 1
        Handle: 615 Address: DF:A9:FF:F6:B1:1A (OUI DF-A9-FF)
        Count: 1
        #74: len 21 (1 Kb/s)
        Latency: 155 msec (69-170 msec ~140 msec)
> ACL Data RX: Handle 615 flags 0x02 dlen 21                #76 [hci1] 8.279906
      SMP: Pairing Random (0x04) len 16
        Random value: 3feda87e53961de20000000000000000
< HCI Command: Host Number of Compl.. (0x03|0x0035) plen 5  #77 [hci1] 8.284390
        Num handles: 1
        Handle: 615 Address: DF:A9:FF:F6:B1:1A (OUI DF-A9-FF)
        Count: 1
< ACL Data TX: Handle 615 flags 0x00 dlen 21                #78 [hci1] 8.284533
      SMP: Pairing Random (0x04) len 16
        Random value: 8e6108f966a694cbe26df70bb96773e6
> HCI Event: Number of Completed Packets (0x13) plen 5      #79 [hci1] 8.454409
        Num handles: 1
        Handle: 615 Address: DF:A9:FF:F6:B1:1A (OUI DF-A9-FF)
        Count: 1
        #78: len 21 (0 Kb/s)
        Latency: 169 msec (69-170 msec ~155 msec)
> ACL Data RX: Handle 615 flags 0x02 dlen 21                #80 [hci1] 8.542239
      SMP: Pairing Confirm (0x03) len 16
        Confim value: e66ad4a626254771262883b7982add20
< HCI Command: Host Number of Compl.. (0x03|0x0035) plen 5  #81 [hci1] 8.543827
        Num handles: 1
        Handle: 615 Address: DF:A9:FF:F6:B1:1A (OUI DF-A9-FF)
        Count: 1
< ACL Data TX: Handle 615 flags 0x00 dlen 21                #82 [hci1] 8.543942
      SMP: Pairing Confirm (0x03) len 16
        Confim value: a2ae146a8a0f6efca9daa23dde604c66
> HCI Event: Number of Completed Packets (0x13) plen 5      #83 [hci1] 8.717034
        Num handles: 1
        Handle: 615 Address: DF:A9:FF:F6:B1:1A (OUI DF-A9-FF)
        Count: 1
        #82: len 21 (0 Kb/s)
        Latency: 173 msec (69-173 msec ~164 msec)
> ACL Data RX: Handle 615 flags 0x02 dlen 21                #84 [hci1] 8.717417
      SMP: Pairing Random (0x04) len 16
        Random value: 95f1f98949cc27b90000000000000000
< HCI Command: Host Number of Compl.. (0x03|0x0035) plen 5  #85 [hci1] 8.724408
        Num handles: 1
        Handle: 615 Address: DF:A9:FF:F6:B1:1A (OUI DF-A9-FF)
        Count: 1
< ACL Data TX: Handle 615 flags 0x00 dlen 21                #86 [hci1] 8.724621
      SMP: Pairing Random (0x04) len 16
        Random value: 4d02679f89a05211af56d8b3da64d21e
> HCI Event: Number of Completed Packets (0x13) plen 5      #87 [hci1] 8.891850
        Num handles: 1
        Handle: 615 Address: DF:A9:FF:F6:B1:1A (OUI DF-A9-FF)
        Count: 1
        #86: len 21 (1 Kb/s)
        Latency: 167 msec (69-173 msec ~165 msec)
> ACL Data RX: Handle 615 flags 0x02 dlen 21                #88 [hci1] 8.979742
      SMP: Pairing Confirm (0x03) len 16
        Confim value: e585b6223b60658e798ff6084cac0c3d
< HCI Command: Host Number of Compl.. (0x03|0x0035) plen 5  #89 [hci1] 8.983724
        Num handles: 1
        Handle: 615 Address: DF:A9:FF:F6:B1:1A (OUI DF-A9-FF)
        Count: 1
< ACL Data TX: Handle 615 flags 0x00 dlen 21                #90 [hci1] 8.983807
      SMP: Pairing Confirm (0x03) len 16
        Confim value: b3a399a00f20c7bd07e6dc26b677e8f8
> HCI Event: Number of Completed Packets (0x13) plen 5      #91 [hci1] 9.154592
        Num handles: 1
        Handle: 615 Address: DF:A9:FF:F6:B1:1A (OUI DF-A9-FF)
        Count: 1
        #90: len 21 (0 Kb/s)
        Latency: 170 msec (69-173 msec ~168 msec)
> ACL Data RX: Handle 615 flags 0x02 dlen 21                #92 [hci1] 9.154872
      SMP: Pairing Random (0x04) len 16
        Random value: e69ebaf91efa94580000000000000000
< HCI Command: Host Number of Compl.. (0x03|0x0035) plen 5  #93 [hci1] 9.164367
        Num handles: 1
        Handle: 615 Address: DF:A9:FF:F6:B1:1A (OUI DF-A9-FF)
        Count: 1
< ACL Data TX: Handle 615 flags 0x00 dlen 21                #94 [hci1] 9.164515
      SMP: Pairing Random (0x04) len 16
        Random value: 5e8286bc235a02440d0c3424a2acf8fd
> HCI Event: Number of Completed Packets (0x13) plen 5      #95 [hci1] 9.329319
        Num handles: 1
        Handle: 615 Address: DF:A9:FF:F6:B1:1A (OUI DF-A9-FF)
        Count: 1
        #94: len 21 (1 Kb/s)
        Latency: 164 msec (69-173 msec ~166 msec)
> ACL Data RX: Handle 615 flags 0x02 dlen 21                #96 [hci1] 9.417164
      SMP: Pairing Confirm (0x03) len 16
        Confim value: 104f2c1b481664370818c2480b08d414
< HCI Command: Host Number of Compl.. (0x03|0x0035) plen 5  #97 [hci1] 9.423706
        Num handles: 1
        Handle: 615 Address: DF:A9:FF:F6:B1:1A (OUI DF-A9-FF)
        Count: 1
< ACL Data TX: Handle 615 flags 0x00 dlen 21                #98 [hci1] 9.423782
      SMP: Pairing Confirm (0x03) len 16
        Confim value: 22beecade12edebd8669ad87b1790237
> HCI Event: Number of Completed Packets (0x13) plen 5      #99 [hci1] 9.592061
        Num handles: 1
        Handle: 615 Address: DF:A9:FF:F6:B1:1A (OUI DF-A9-FF)
        Count: 1
        #98: len 21 (1 Kb/s)
        Latency: 168 msec (69-173 msec ~167 msec)
> ACL Data RX: Handle 615 flags 0x02 dlen 21               #100 [hci1] 9.592368
      SMP: Pairing Random (0x04) len 16
        Random value: cb830f843b20eff30000000000000000
< HCI Command: Host Number of Comp.. (0x03|0x0035) plen 5  #101 [hci1] 9.604461
        Num handles: 1
        Handle: 615 Address: DF:A9:FF:F6:B1:1A (OUI DF-A9-FF)
        Count: 1
< ACL Data TX: Handle 615 flags 0x00 dlen 21               #102 [hci1] 9.604660
      SMP: Pairing Random (0x04) len 16
        Random value: 5c4a1bcadd27bd58e945097b00bad7ac
> HCI Event: Number of Completed Packets (0x13) plen 5     #103 [hci1] 9.766826
        Num handles: 1
        Handle: 615 Address: DF:A9:FF:F6:B1:1A (OUI DF-A9-FF)
        Count: 1
        #102: len 21 (1 Kb/s)
        Latency: 162 msec (69-173 msec ~164 msec)
> ACL Data RX: Handle 615 flags 0x02 dlen 21               #104 [hci1] 9.854721
      SMP: Pairing Confirm (0x03) len 16
        Confim value: fb917810d604159074177e1c174ebb6c
< HCI Command: Host Number of Comp.. (0x03|0x0035) plen 5  #105 [hci1] 9.863963
        Num handles: 1
        Handle: 615 Address: DF:A9:FF:F6:B1:1A (OUI DF-A9-FF)
        Count: 1
< ACL Data TX: Handle 615 flags 0x00 dlen 21               #106 [hci1] 9.864036
      SMP: Pairing Confirm (0x03) len 16
        Confim value: 22955ebbbd8496c475d79f8f8cb15e81
> HCI Event: Number of Completed Packets (0x13) plen 5    #107 [hci1] 10.029516
        Num handles: 1
        Handle: 615 Address: DF:A9:FF:F6:B1:1A (OUI DF-A9-FF)
        Count: 1
        #106: len 21 (1 Kb/s)
        Latency: 165 msec (69-173 msec ~165 msec)
> ACL Data RX: Handle 615 flags 0x02 dlen 21              #108 [hci1] 10.029838
      SMP: Pairing Random (0x04) len 16
        Random value: ca67dcc65be6d8820000000000000000
< HCI Command: Host Number of Com.. (0x03|0x0035) plen 5  #109 [hci1] 10.044462
        Num handles: 1
        Handle: 615 Address: DF:A9:FF:F6:B1:1A (OUI DF-A9-FF)
        Count: 1
< ACL Data TX: Handle 615 flags 0x00 dlen 21              #110 [hci1] 10.044575
      SMP: Pairing Random (0x04) len 16
        Random value: 32527e6e64e79f33b2e374394db8ab2d
> HCI Event: Number of Completed Packets (0x13) plen 5    #111 [hci1] 10.204275
        Num handles: 1
        Handle: 615 Address: DF:A9:FF:F6:B1:1A (OUI DF-A9-FF)
        Count: 1
        #110: len 21 (1 Kb/s)
        Latency: 159 msec (69-173 msec ~162 msec)
> ACL Data RX: Handle 615 flags 0x02 dlen 21              #112 [hci1] 10.292190
      SMP: Pairing Confirm (0x03) len 16
        Confim value: 67d74b6bf4c05bbc59bd7be0e9fbf9b7
< HCI Command: Host Number of Com.. (0x03|0x0035) plen 5  #113 [hci1] 10.304170
        Num handles: 1
        Handle: 615 Address: DF:A9:FF:F6:B1:1A (OUI DF-A9-FF)
        Count: 1
< ACL Data TX: Handle 615 flags 0x00 dlen 21              #114 [hci1] 10.304276
      SMP: Pairing Confirm (0x03) len 16
        Confim value: c32532edde9de8a7935d12e436c64818
> HCI Event: Number of Completed Packets (0x13) plen 5    #115 [hci1] 10.466988
        Num handles: 1
        Handle: 615 Address: DF:A9:FF:F6:B1:1A (OUI DF-A9-FF)
        Count: 1
        #114: len 21 (1 Kb/s)
        Latency: 162 msec (69-173 msec ~162 msec)
> ACL Data RX: Handle 615 flags 0x02 dlen 21              #116 [hci1] 10.467318
      SMP: Pairing Random (0x04) len 16
        Random value: 3a5a39c578a0ab2b0000000000000000
< HCI Command: Host Number of Com.. (0x03|0x0035) plen 5  #117 [hci1] 10.483780
        Num handles: 1
        Handle: 615 Address: DF:A9:FF:F6:B1:1A (OUI DF-A9-FF)
        Count: 1
< ACL Data TX: Handle 615 flags 0x00 dlen 21              #118 [hci1] 10.483888
      SMP: Pairing Random (0x04) len 16
        Random value: dddbdfe2838e9a8cc6964353c850fef7
> HCI Event: Number of Completed Packets (0x13) plen 5    #119 [hci1] 10.641779
        Num handles: 1
        Handle: 615 Address: DF:A9:FF:F6:B1:1A (OUI DF-A9-FF)
        Count: 1
        #118: len 21 (1 Kb/s)
        Latency: 157 msec (69-173 msec ~160 msec)
> ACL Data RX: Handle 615 flags 0x02 dlen 21              #120 [hci1] 10.729742
      SMP: Pairing Confirm (0x03) len 16
        Confim value: d5b1652a658dc1973253db2e06d6a77d
< HCI Command: Host Number of Com.. (0x03|0x0035) plen 5  #121 [hci1] 10.744167
        Num handles: 1
        Handle: 615 Address: DF:A9:FF:F6:B1:1A (OUI DF-A9-FF)
        Count: 1
< ACL Data TX: Handle 615 flags 0x00 dlen 21              #122 [hci1] 10.744293
      SMP: Pairing Confirm (0x03) len 16
        Confim value: de6fd110839f89e85d2130876d3db44c
> HCI Event: Number of Completed Packets (0x13) plen 5    #123 [hci1] 10.904486
        Num handles: 1
        Handle: 615 Address: DF:A9:FF:F6:B1:1A (OUI DF-A9-FF)
        Count: 1
        #122: len 21 (1 Kb/s)
        Latency: 160 msec (69-173 msec ~160 msec)
> ACL Data RX: Handle 615 flags 0x02 dlen 21              #124 [hci1] 10.904791
      SMP: Pairing Random (0x04) len 16
        Random value: f7dd2f95f3f16da10000000000000000
< HCI Command: Host Number of Com.. (0x03|0x0035) plen 5  #125 [hci1] 10.924455
        Num handles: 1
        Handle: 615 Address: DF:A9:FF:F6:B1:1A (OUI DF-A9-FF)
        Count: 1
< ACL Data TX: Handle 615 flags 0x00 dlen 21              #126 [hci1] 10.924621
      SMP: Pairing Random (0x04) len 16
        Random value: eb9f1915536596b6fc3db1c86b2b1970
> HCI Event: Number of Completed Packets (0x13) plen 5    #127 [hci1] 11.079238
        Num handles: 1
        Handle: 615 Address: DF:A9:FF:F6:B1:1A (OUI DF-A9-FF)
        Count: 1
        #126: len 21 (1 Kb/s)
        Latency: 154 msec (69-173 msec ~157 msec)
> ACL Data RX: Handle 615 flags 0x02 dlen 21              #128 [hci1] 11.167135
      SMP: Pairing Confirm (0x03) len 16
        Confim value: 5401c39ebc7b1d6b5e3d9f5a28a92959
< HCI Command: Host Number of Com.. (0x03|0x0035) plen 5  #129 [hci1] 11.183883
        Num handles: 1
        Handle: 615 Address: DF:A9:FF:F6:B1:1A (OUI DF-A9-FF)
        Count: 1
< ACL Data TX: Handle 615 flags 0x00 dlen 21              #130 [hci1] 11.183959
      SMP: Pairing Confirm (0x03) len 16
        Confim value: 843219b2ac98190bd5b7044e880c8506
> HCI Event: Number of Completed Packets (0x13) plen 5    #131 [hci1] 11.341964
        Num handles: 1
        Handle: 615 Address: DF:A9:FF:F6:B1:1A (OUI DF-A9-FF)
        Count: 1
        #130: len 21 (1 Kb/s)
        Latency: 158 msec (69-173 msec ~157 msec)
> ACL Data RX: Handle 615 flags 0x02 dlen 21              #132 [hci1] 11.342345
      SMP: Pairing Random (0x04) len 16
        Random value: 6ac8c43e9a5508ef0000000000000000
< HCI Command: Host Number of Com.. (0x03|0x0035) plen 5  #133 [hci1] 11.344328
        Num handles: 1
        Handle: 615 Address: DF:A9:FF:F6:B1:1A (OUI DF-A9-FF)
        Count: 1
< ACL Data TX: Handle 615 flags 0x00 dlen 21              #134 [hci1] 11.344489
      SMP: Pairing Random (0x04) len 16
        Random value: 5c794dc9ad9f2c3f295ebd5ad5e1c3cf
> HCI Event: Number of Completed Packets (0x13) plen 5    #135 [hci1] 11.516738
        Num handles: 1
        Handle: 615 Address: DF:A9:FF:F6:B1:1A (OUI DF-A9-FF)
        Count: 1
        #134: len 21 (0 Kb/s)
        Latency: 172 msec (69-173 msec ~164 msec)
> ACL Data RX: Handle 615 flags 0x02 dlen 21              #136 [hci1] 11.604718
      SMP: Pairing Confirm (0x03) len 16
        Confim value: 010a9d8bb62b58396e83ec3ed3776a11
< HCI Command: Host Number of Com.. (0x03|0x0035) plen 5  #137 [hci1] 11.624259
        Num handles: 1
        Handle: 615 Address: DF:A9:FF:F6:B1:1A (OUI DF-A9-FF)
        Count: 1
< ACL Data TX: Handle 615 flags 0x00 dlen 21              #138 [hci1] 11.624347
      SMP: Pairing Confirm (0x03) len 16
        Confim value: 4efac2f294773f76f671d31aac3f1a50
> HCI Event: Number of Completed Packets (0x13) plen 5    #139 [hci1] 11.779540
        Num handles: 1
        Handle: 615 Address: DF:A9:FF:F6:B1:1A (OUI DF-A9-FF)
        Count: 1
        #138: len 21 (1 Kb/s)
        Latency: 155 msec (69-173 msec ~160 msec)
> ACL Data RX: Handle 615 flags 0x02 dlen 21              #140 [hci1] 11.779828
      SMP: Pairing Random (0x04) len 16
        Random value: 7bbe4bd07498a3dd0000000000000000
< HCI Command: Host Number of Com.. (0x03|0x0035) plen 5  #141 [hci1] 11.784395
        Num handles: 1
        Handle: 615 Address: DF:A9:FF:F6:B1:1A (OUI DF-A9-FF)
        Count: 1
< ACL Data TX: Handle 615 flags 0x00 dlen 21              #142 [hci1] 11.784547
      SMP: Pairing Random (0x04) len 16
        Random value: 5c2fff312cdf99c9491988e877355a9a
> HCI Event: Number of Completed Packets (0x13) plen 5    #143 [hci1] 11.954210
        Num handles: 1
        Handle: 615 Address: DF:A9:FF:F6:B1:1A (OUI DF-A9-FF)
        Count: 1
        #142: len 21 (0 Kb/s)
        Latency: 169 msec (69-173 msec ~164 msec)
> ACL Data RX: Handle 615 flags 0x02 dlen 21              #144 [hci1] 12.042133
      SMP: Pairing Confirm (0x03) len 16
        Confim value: 3b1e0198a809ef2ea433685fb4c59b93
< HCI Command: Host Number of Com.. (0x03|0x0035) plen 5  #145 [hci1] 12.043747
        Num handles: 1
        Handle: 615 Address: DF:A9:FF:F6:B1:1A (OUI DF-A9-FF)
        Count: 1
< ACL Data TX: Handle 615 flags 0x00 dlen 21              #146 [hci1] 12.043849
      SMP: Pairing Confirm (0x03) len 16
        Confim value: fbfb711989fc7197639f792530a4c49b
> HCI Event: Number of Completed Packets (0x13) plen 5    #147 [hci1] 12.216891
        Num handles: 1
        Handle: 615 Address: DF:A9:FF:F6:B1:1A (OUI DF-A9-FF)
        Count: 1
        #146: len 21 (0 Kb/s)
        Latency: 173 msec (69-173 msec ~168 msec)
> ACL Data RX: Handle 615 flags 0x02 dlen 21              #148 [hci1] 12.217288
      SMP: Pairing Random (0x04) len 16
        Random value: 1f9c913c450ca1800000000000000000
< HCI Command: Host Number of Com.. (0x03|0x0035) plen 5  #149 [hci1] 12.224391
        Num handles: 1
        Handle: 615 Address: DF:A9:FF:F6:B1:1A (OUI DF-A9-FF)
        Count: 1
< ACL Data TX: Handle 615 flags 0x00 dlen 21              #150 [hci1] 12.224532
      SMP: Pairing Random (0x04) len 16
        Random value: c629a3a987d808e808655d558dfc1155
> HCI Event: Number of Completed Packets (0x13) plen 5    #151 [hci1] 12.391786
        Num handles: 1
        Handle: 615 Address: DF:A9:FF:F6:B1:1A (OUI DF-A9-FF)
        Count: 1
        #150: len 21 (1 Kb/s)
        Latency: 167 msec (69-173 msec ~168 msec)
> ACL Data RX: Handle 615 flags 0x02 dlen 21              #152 [hci1] 12.479570
      SMP: Pairing Confirm (0x03) len 16
        Confim value: a2e723fd70b8efda9d63a9165d08659b
< HCI Command: Host Number of Com.. (0x03|0x0035) plen 5  #153 [hci1] 12.483796
        Num handles: 1
        Handle: 615 Address: DF:A9:FF:F6:B1:1A (OUI DF-A9-FF)
        Count: 1
< ACL Data TX: Handle 615 flags 0x00 dlen 21              #154 [hci1] 12.483833
      SMP: Pairing Confirm (0x03) len 16
        Confim value: 35345976a1e63b34d57b87771fdf600e
> HCI Event: Number of Completed Packets (0x13) plen 5    #155 [hci1] 12.654483
        Num handles: 1
        Handle: 615 Address: DF:A9:FF:F6:B1:1A (OUI DF-A9-FF)
        Count: 1
        #154: len 21 (0 Kb/s)
        Latency: 170 msec (69-173 msec ~169 msec)
> ACL Data RX: Handle 615 flags 0x02 dlen 21              #156 [hci1] 12.654711
      SMP: Pairing Random (0x04) len 16
        Random value: fe8b0b03ee43be5b0000000000000000
< HCI Command: Host Number of Com.. (0x03|0x0035) plen 5  #157 [hci1] 12.664463
        Num handles: 1
        Handle: 615 Address: DF:A9:FF:F6:B1:1A (OUI DF-A9-FF)
        Count: 1
< ACL Data TX: Handle 615 flags 0x00 dlen 21              #158 [hci1] 12.664568
      SMP: Pairing Random (0x04) len 16
        Random value: 92f20f6ad8f13724432c7fd6001c45ff
> HCI Event: Number of Completed Packets (0x13) plen 5    #159 [hci1] 12.829191
        Num handles: 1
        Handle: 615 Address: DF:A9:FF:F6:B1:1A (OUI DF-A9-FF)
        Count: 1
        #158: len 21 (1 Kb/s)
        Latency: 164 msec (69-173 msec ~167 msec)
> ACL Data RX: Handle 615 flags 0x02 dlen 21              #160 [hci1] 12.917047
      SMP: Pairing Confirm (0x03) len 16
        Confim value: c3dbe4202fc251477f6f69d798ac7b98
< HCI Command: Host Number of Com.. (0x03|0x0035) plen 5  #161 [hci1] 12.923853
        Num handles: 1
        Handle: 615 Address: DF:A9:FF:F6:B1:1A (OUI DF-A9-FF)
        Count: 1
< ACL Data TX: Handle 615 flags 0x00 dlen 21              #162 [hci1] 12.923951
      SMP: Pairing Confirm (0x03) len 16
        Confim value: 37b4cadf9d62eee24aafb6506294bcf4
> HCI Event: Number of Completed Packets (0x13) plen 5    #163 [hci1] 13.091938
        Num handles: 1
        Handle: 615 Address: DF:A9:FF:F6:B1:1A (OUI DF-A9-FF)
        Count: 1
        #162: len 21 (1 Kb/s)
        Latency: 167 msec (69-173 msec ~167 msec)
> ACL Data RX: Handle 615 flags 0x02 dlen 21              #164 [hci1] 13.092272
      SMP: Pairing Random (0x04) len 16
        Random value: f426ba49cac885d10000000000000000
< HCI Command: Host Number of Com.. (0x03|0x0035) plen 5  #165 [hci1] 13.104459
        Num handles: 1
        Handle: 615 Address: DF:A9:FF:F6:B1:1A (OUI DF-A9-FF)
        Count: 1
< ACL Data TX: Handle 615 flags 0x00 dlen 21              #166 [hci1] 13.104551
      SMP: Pairing Random (0x04) len 16
        Random value: 23ac32ebbb5e14c8a6b9622f296d277f
> HCI Event: Number of Completed Packets (0x13) plen 5    #167 [hci1] 13.266701
        Num handles: 1
        Handle: 615 Address: DF:A9:FF:F6:B1:1A (OUI DF-A9-FF)
        Count: 1
        #166: len 21 (1 Kb/s)
        Latency: 162 msec (69-173 msec ~164 msec)
> ACL Data RX: Handle 615 flags 0x02 dlen 21              #168 [hci1] 13.354583
      SMP: Pairing Confirm (0x03) len 16
        Confim value: f6e14b4e948f8cd8a1316662840c5d53
< HCI Command: Host Number of Com.. (0x03|0x0035) plen 5  #169 [hci1] 13.363869
        Num handles: 1
        Handle: 615 Address: DF:A9:FF:F6:B1:1A (OUI DF-A9-FF)
        Count: 1
< ACL Data TX: Handle 615 flags 0x00 dlen 21              #170 [hci1] 13.363929
      SMP: Pairing Confirm (0x03) len 16
        Confim value: dc9cab9497aa0e4fb234e6de1e92b8af
> HCI Event: Number of Completed Packets (0x13) plen 5    #171 [hci1] 13.529358
        Num handles: 1
        Handle: 615 Address: DF:A9:FF:F6:B1:1A (OUI DF-A9-FF)
        Count: 1
        #170: len 21 (1 Kb/s)
        Latency: 165 msec (69-173 msec ~165 msec)
> ACL Data RX: Handle 615 flags 0x02 dlen 21              #172 [hci1] 13.529742
      SMP: Pairing Random (0x04) len 16
        Random value: fbcf41ae0078210a0000000000000000
< HCI Command: Host Number of Com.. (0x03|0x0035) plen 5  #173 [hci1] 13.544443
        Num handles: 1
        Handle: 615 Address: DF:A9:FF:F6:B1:1A (OUI DF-A9-FF)
        Count: 1
< ACL Data TX: Handle 615 flags 0x00 dlen 21              #174 [hci1] 13.544545
      SMP: Pairing Random (0x04) len 16
        Random value: 297efe85e67448a15f56bd27e3a3cf1d
> HCI Event: Number of Completed Packets (0x13) plen 5    #175 [hci1] 13.704154
        Num handles: 1
        Handle: 615 Address: DF:A9:FF:F6:B1:1A (OUI DF-A9-FF)
        Count: 1
        #174: len 21 (1 Kb/s)
        Latency: 159 msec (69-173 msec ~162 msec)
> ACL Data RX: Handle 615 flags 0x02 dlen 21              #176 [hci1] 13.792116
      SMP: Pairing Confirm (0x03) len 16
        Confim value: ec8f054348be6aa8fbfb8157ed34b3c6
< HCI Command: Host Number of Com.. (0x03|0x0035) plen 5  #177 [hci1] 13.804274
        Num handles: 1
        Handle: 615 Address: DF:A9:FF:F6:B1:1A (OUI DF-A9-FF)
        Count: 1
< ACL Data TX: Handle 615 flags 0x00 dlen 21              #178 [hci1] 13.804468
      SMP: Pairing Confirm (0x03) len 16
        Confim value: c30b3a6aca9dfea21cc04f20cbbb9a30
> HCI Event: Number of Completed Packets (0x13) plen 5    #179 [hci1] 13.966916
        Num handles: 1
        Handle: 615 Address: DF:A9:FF:F6:B1:1A (OUI DF-A9-FF)
        Count: 1
        #178: len 21 (1 Kb/s)
        Latency: 162 msec (69-173 msec ~162 msec)
> ACL Data RX: Handle 615 flags 0x02 dlen 21              #180 [hci1] 13.967190
      SMP: Pairing Random (0x04) len 16
        Random value: 76e0342ee175ecd20000000000000000
< HCI Command: Host Number of Com.. (0x03|0x0035) plen 5  #181 [hci1] 13.984471
        Num handles: 1
        Handle: 615 Address: DF:A9:FF:F6:B1:1A (OUI DF-A9-FF)
        Count: 1
< ACL Data TX: Handle 615 flags 0x00 dlen 21              #182 [hci1] 13.984658
      SMP: Pairing Random (0x04) len 16
        Random value: 25a9493fd3ce4faf02be7293595bb7c6
> HCI Event: Number of Completed Packets (0x13) plen 5    #183 [hci1] 14.141682
        Num handles: 1
        Handle: 615 Address: DF:A9:FF:F6:B1:1A (OUI DF-A9-FF)
        Count: 1
        #182: len 21 (1 Kb/s)
        Latency: 157 msec (69-173 msec ~159 msec)
> ACL Data RX: Handle 615 flags 0x02 dlen 21              #184 [hci1] 14.229584
      SMP: Pairing Confirm (0x03) len 16
        Confim value: c13a69b998f9de5499d749a846151288
< HCI Command: Host Number of Com.. (0x03|0x0035) plen 5  #185 [hci1] 14.244169
        Num handles: 1
        Handle: 615 Address: DF:A9:FF:F6:B1:1A (OUI DF-A9-FF)
        Count: 1
< ACL Data TX: Handle 615 flags 0x00 dlen 21              #186 [hci1] 14.244375
      SMP: Pairing Confirm (0x03) len 16
        Confim value: 3e1cd3beee40baaa4c9717b93dc2911a
> HCI Event: Number of Completed Packets (0x13) plen 5    #187 [hci1] 14.404348
        Num handles: 1
        Handle: 615 Address: DF:A9:FF:F6:B1:1A (OUI DF-A9-FF)
        Count: 1
        #186: len 21 (1 Kb/s)
        Latency: 159 msec (69-173 msec ~159 msec)
> ACL Data RX: Handle 615 flags 0x02 dlen 21              #188 [hci1] 14.404692
      SMP: Pairing Random (0x04) len 16
        Random value: 1f5686108a21da7e0000000000000000
< HCI Command: Host Number of Com.. (0x03|0x0035) plen 5  #189 [hci1] 14.424500
        Num handles: 1
        Handle: 615 Address: DF:A9:FF:F6:B1:1A (OUI DF-A9-FF)
        Count: 1
< ACL Data TX: Handle 615 flags 0x00 dlen 21              #190 [hci1] 14.424614
      SMP: Pairing Random (0x04) len 16
        Random value: 58f6b41f855a6f6c3560debd84e2affc
> HCI Event: Number of Completed Packets (0x13) plen 5    #191 [hci1] 14.579235
        Num handles: 1
        Handle: 615 Address: DF:A9:FF:F6:B1:1A (OUI DF-A9-FF)
        Count: 1
        #190: len 21 (1 Kb/s)
        Latency: 154 msec (69-173 msec ~157 msec)
> ACL Data RX: Handle 615 flags 0x02 dlen 21              #192 [hci1] 14.667026
      SMP: Pairing Confirm (0x03) len 16
        Confim value: 14881b2a98b01a21a067424dc9fd1e9a
< HCI Command: Host Number of Com.. (0x03|0x0035) plen 5  #193 [hci1] 14.684232
        Num handles: 1
        Handle: 615 Address: DF:A9:FF:F6:B1:1A (OUI DF-A9-FF)
        Count: 1
< ACL Data TX: Handle 615 flags 0x00 dlen 21              #194 [hci1] 14.684345
      SMP: Pairing Confirm (0x03) len 16
        Confim value: c7f7adc7f417d575afe2e27cfdde3c6e
> HCI Event: Number of Completed Packets (0x13) plen 5    #195 [hci1] 14.841923
        Num handles: 1
        Handle: 615 Address: DF:A9:FF:F6:B1:1A (OUI DF-A9-FF)
        Count: 1
        #194: len 21 (1 Kb/s)
        Latency: 157 msec (69-173 msec ~157 msec)
> ACL Data RX: Handle 615 flags 0x02 dlen 21              #196 [hci1] 14.842291
      SMP: Pairing Random (0x04) len 16
        Random value: de6104114367f63d0000000000000000
< HCI Command: Host Number of Com.. (0x03|0x0035) plen 5  #197 [hci1] 14.844355
        Num handles: 1
        Handle: 615 Address: DF:A9:FF:F6:B1:1A (OUI DF-A9-FF)
        Count: 1
< ACL Data TX: Handle 615 flags 0x00 dlen 21              #198 [hci1] 14.844515
      SMP: Pairing Random (0x04) len 16
        Random value: b67e7216d5bf664139eda2b542549666
> HCI Event: Number of Completed Packets (0x13) plen 5    #199 [hci1] 15.016680
        Num handles: 1
        Handle: 615 Address: DF:A9:FF:F6:B1:1A (OUI DF-A9-FF)
        Count: 1
        #198: len 21 (0 Kb/s)
        Latency: 172 msec (69-173 msec ~164 msec)
> ACL Data RX: Handle 615 flags 0x02 dlen 21              #200 [hci1] 15.104473
      SMP: Pairing Confirm (0x03) len 16
        Confim value: 4b2a9207024aeadf769055967c03320d
< HCI Command: Host Number of Com.. (0x03|0x0035) plen 5  #201 [hci1] 15.124265
        Num handles: 1
        Handle: 615 Address: DF:A9:FF:F6:B1:1A (OUI DF-A9-FF)
        Count: 1
< ACL Data TX: Handle 615 flags 0x00 dlen 21              #202 [hci1] 15.124415
      SMP: Pairing Confirm (0x03) len 16
        Confim value: 1ab762d8fce14bb34f20f0fcc33f2c02
> HCI Event: Number of Completed Packets (0x13) plen 5    #203 [hci1] 15.279383
        Num handles: 1
        Handle: 615 Address: DF:A9:FF:F6:B1:1A (OUI DF-A9-FF)
        Count: 1
        #202: len 21 (1 Kb/s)
        Latency: 154 msec (69-173 msec ~159 msec)
> ACL Data RX: Handle 615 flags 0x02 dlen 21              #204 [hci1] 15.279722
      SMP: Pairing Random (0x04) len 16
        Random value: d98521f6f9372a3b0000000000000000
< HCI Command: Host Number of Com.. (0x03|0x0035) plen 5  #205 [hci1] 15.284337
        Num handles: 1
        Handle: 615 Address: DF:A9:FF:F6:B1:1A (OUI DF-A9-FF)
        Count: 1
< ACL Data TX: Handle 615 flags 0x00 dlen 21              #206 [hci1] 15.284476
      SMP: Pairing Random (0x04) len 16
        Random value: ed17f76500c95219dd01e09d1e63f87b
> HCI Event: Number of Completed Packets (0x13) plen 5    #207 [hci1] 15.454167
        Num handles: 1
        Handle: 615 Address: DF:A9:FF:F6:B1:1A (OUI DF-A9-FF)
        Count: 1
        #206: len 21 (0 Kb/s)
        Latency: 169 msec (69-173 msec ~164 msec)
> ACL Data RX: Handle 615 flags 0x02 dlen 21              #208 [hci1] 15.541987
      SMP: Pairing Confirm (0x03) len 16
        Confim value: d25ce0eaaad3b8552cdbde645b8acb18
< HCI Command: Host Number of Com.. (0x03|0x0035) plen 5  #209 [hci1] 15.543821
        Num handles: 1
        Handle: 615 Address: DF:A9:FF:F6:B1:1A (OUI DF-A9-FF)
        Count: 1
< ACL Data TX: Handle 615 flags 0x00 dlen 21              #210 [hci1] 15.543920
      SMP: Pairing Confirm (0x03) len 16
        Confim value: 468ee216185161b65b7aae4bb8ae8f7b
> HCI Event: Number of Completed Packets (0x13) plen 5    #211 [hci1] 15.716835
        Num handles: 1
        Handle: 615 Address: DF:A9:FF:F6:B1:1A (OUI DF-A9-FF)
        Count: 1
        #210: len 21 (0 Kb/s)
        Latency: 172 msec (69-173 msec ~168 msec)
> ACL Data RX: Handle 615 flags 0x02 dlen 21              #212 [hci1] 15.717093
      SMP: Pairing Random (0x04) len 16
        Random value: 1ca85fe9f0c7b4f20000000000000000
< HCI Command: Host Number of Com.. (0x03|0x0035) plen 5  #213 [hci1] 15.724553
        Num handles: 1
        Handle: 615 Address: DF:A9:FF:F6:B1:1A (OUI DF-A9-FF)
        Count: 1
< ACL Data TX: Handle 615 flags 0x00 dlen 21              #214 [hci1] 15.724704
      SMP: Pairing Random (0x04) len 16
        Random value: 81d35d47e1f6006d79c974bd9d9e1ee3
> HCI Event: Number of Completed Packets (0x13) plen 5    #215 [hci1] 15.891590
        Num handles: 1
        Handle: 615 Address: DF:A9:FF:F6:B1:1A (OUI DF-A9-FF)
        Count: 1
        #214: len 21 (1 Kb/s)
        Latency: 166 msec (69-173 msec ~167 msec)
> ACL Data RX: Handle 615 flags 0x02 dlen 21              #216 [hci1] 15.979464
      SMP: Pairing Confirm (0x03) len 16
        Confim value: d7c74682d691061e7568df7f027ca0a3
< HCI Command: Host Number of Com.. (0x03|0x0035) plen 5  #217 [hci1] 15.984339
        Num handles: 1
        Handle: 615 Address: DF:A9:FF:F6:B1:1A (OUI DF-A9-FF)
        Count: 1
< ACL Data TX: Handle 615 flags 0x00 dlen 21              #218 [hci1] 15.984451
      SMP: Pairing Confirm (0x03) len 16
        Confim value: 1264fcde986883b037f9eaa9a19335c2
> HCI Event: Number of Completed Packets (0x13) plen 5    #219 [hci1] 16.154353
        Num handles: 1
        Handle: 615 Address: DF:A9:FF:F6:B1:1A (OUI DF-A9-FF)
        Count: 1
        #218: len 21 (0 Kb/s)
        Latency: 169 msec (69-173 msec ~168 msec)
> ACL Data RX: Handle 615 flags 0x02 dlen 21              #220 [hci1] 16.154665
      SMP: Pairing Random (0x04) len 16
        Random value: 4f25bc11264fa2820000000000000000
< HCI Command: Host Number of Com.. (0x03|0x0035) plen 5  #221 [hci1] 16.163815
        Num handles: 1
        Handle: 615 Address: DF:A9:FF:F6:B1:1A (OUI DF-A9-FF)
        Count: 1
< ACL Data TX: Handle 615 flags 0x00 dlen 21              #222 [hci1] 16.163884
      SMP: Pairing Random (0x04) len 16
        Random value: e7f7e0c2476823e41736a7e381bafb7c
> HCI Event: Number of Completed Packets (0x13) plen 5    #223 [hci1] 16.329088
        Num handles: 1
        Handle: 615 Address: DF:A9:FF:F6:B1:1A (OUI DF-A9-FF)
        Count: 1
        #222: len 21 (1 Kb/s)
        Latency: 165 msec (69-173 msec ~167 msec)
> ACL Data RX: Handle 615 flags 0x02 dlen 21              #224 [hci1] 16.416933
      SMP: Pairing Confirm (0x03) len 16
        Confim value: 015ee0143fb03682a4e4eeb719323718
< HCI Command: Host Number of Com.. (0x03|0x0035) plen 5  #225 [hci1] 16.423814
        Num handles: 1
        Handle: 615 Address: DF:A9:FF:F6:B1:1A (OUI DF-A9-FF)
        Count: 1
< ACL Data TX: Handle 615 flags 0x00 dlen 21              #226 [hci1] 16.423899
      SMP: Pairing Confirm (0x03) len 16
        Confim value: 3eaf14c5e48054bceb2b46f8e2e47668
> HCI Event: Number of Completed Packets (0x13) plen 5    #227 [hci1] 16.591749
        Num handles: 1
        Handle: 615 Address: DF:A9:FF:F6:B1:1A (OUI DF-A9-FF)
        Count: 1
        #226: len 21 (1 Kb/s)
        Latency: 167 msec (69-173 msec ~167 msec)
> ACL Data RX: Handle 615 flags 0x02 dlen 21              #228 [hci1] 16.592111
      SMP: Pairing Random (0x04) len 16
        Random value: e85ae6d617da2fd20000000000000000
< HCI Command: Host Number of Com.. (0x03|0x0035) plen 5  #229 [hci1] 16.604400
        Num handles: 1
        Handle: 615 Address: DF:A9:FF:F6:B1:1A (OUI DF-A9-FF)
        Count: 1
