Bluetooth monitor ver 5.72
= Note: Linux version 6.14.0-36-generic (x86_64)                       0.759207
= Note: Bluetooth subsystem version 2.22                               0.759209
= New Index: 00:00:00:00:00:00 (Primary,UART,hci1)              [hci1] 0.759210
= New Index: 48:5F:99:8E:E0:64 (Primary,USB,hci0)               [hci0] 0.759211
= Open Index: 00:00:00:00:00:00                                 [hci1] 0.872963
= Index Info: 00:00:00:00:00:00 (Nordic Semiconductor ASA)      [hci1] 0.872978
@ USER Open: main (privileged) version 2.22            {0x0001} [hci1] 0.872986
< HCI Command: Reset (0x03|0x0003) plen 0                    #1 [hci1] 0.874198
> HCI Event: Command Complete (0x0e) plen 4                  #2 [hci1] 0.874677
      Reset (0x03|0x0003) ncmd 1
        Status: Success (0x00)
< HCI Command: Read Local Supported... (0x04|0x0003) plen 0  #3 [hci1] 0.892763
> HCI Event: Command Complete (0x0e) plen 12                 #4 [hci1] 0.893397
      Read Local Supported Features (0x04|0x0003) ncmd 1
        Status: Success (0x00)
        Features: 0x00 0x00 0x00 0x00 0x60 0x00 0x00 0x00
          BR/EDR Not Supported
          LE Supported (Controller)
< HCI Command: Read Local Version In.. (0x04|0x0001) plen 0  #5 [hci1] 0.912548
> HCI Event: Command Complete (0x0e) plen 12                 #6 [hci1] 0.912978
      Read Local Version Information (0x04|0x0001) ncmd 1
        Status: Success (0x00)
        HCI version: Reserved (0x0f) - Revision 12393 (0x3069)
        LMP version: Reserved (0x0f) - Subversion 12393 (0x3069)
        Manufacturer: Nordic Semiconductor ASA (89)
< HCI Command: Read Local Supported... (0x04|0x0002) plen 0  #7 [hci1] 0.932418
> HCI Event: Command Complete (0x0e) plen 68                 #8 [hci1] 0.933477
      Read Local Supported Commands (0x04|0x0002) ncmd 1
        Status: Success (0x00)
        Commands: 119 entries
          Disconnect (Octet 0 - Bit 5)
          Read Remote Version Information (Octet 2 - Bit 7)
          Set Event Mask (Octet 5 - Bit 6)
          Reset (Octet 5 - Bit 7)
          Read Connection Accept Timeout (Octet 7 - Bit 2)
          Write Connection Accept Timeout (Octet 7 - Bit 3)
          Read Transmit Power Level (Octet 10 - Bit 2)
          Set Controller To Host Flow Control (Octet 10 - Bit 5)
          Host Buffer Size (Octet 10 - Bit 6)
          Host Number of Completed Packets (Octet 10 - Bit 7)
          Read Local Version Information (Octet 14 - Bit 3)
          Read Local Supported Features (Octet 14 - Bit 5)
          Read BD ADDR (Octet 15 - Bit 1)
          Read RSSI (Octet 15 - Bit 5)
          Set Event Mask Page 2 (Octet 22 - Bit 2)
          LE Set Event Mask (Octet 25 - Bit 0)
          LE Read Buffer Size (Octet 25 - Bit 1)
          LE Read Local Supported Features (Octet 25 - Bit 2)
          LE Set Random Address (Octet 25 - Bit 4)
          LE Set Advertising Parameters (Octet 25 - Bit 5)
          LE Read Advertising Channel TX Power (Octet 25 - Bit 6)
          LE Set Advertising Data (Octet 25 - Bit 7)
          LE Set Scan Response Data (Octet 26 - Bit 0)
          LE Set Advertise Enable (Octet 26 - Bit 1)
          LE Set Scan Parameters (Octet 26 - Bit 2)
          LE Set Scan Enable (Octet 26 - Bit 3)
          LE Create Connection (Octet 26 - Bit 4)
          LE Create Connection Cancel (Octet 26 - Bit 5)
          LE Read Accept List Size (Octet 26 - Bit 6)
          LE Clear Accept List (Octet 26 - Bit 7)
          LE Add Device To Accept List (Octet 27 - Bit 0)
          LE Remove Device From Accept List (Octet 27 - Bit 1)
          LE Connection Update (Octet 27 - Bit 2)
          LE Set Host Channel Classification (Octet 27 - Bit 3)
          LE Read Channel Map (Octet 27 - Bit 4)
          LE Read Remote Used Features (Octet 27 - Bit 5)
          LE Encrypt (Octet 27 - Bit 6)
          LE Rand (Octet 27 - Bit 7)
          LE Start Encryption (Octet 28 - Bit 0)
          LE Long Term Key Request Reply (Octet 28 - Bit 1)
          LE Long Term Key Request Neg Reply (Octet 28 - Bit 2)
          LE Read Supported States (Octet 28 - Bit 3)
          LE Receiver Test (Octet 28 - Bit 4)
          LE Transmitter Test (Octet 28 - Bit 5)
          LE Test End (Octet 28 - Bit 6)
          Read Authenticated Payload Timeout (Octet 32 - Bit 4)
          Write Authenticated Payload Timeout (Octet 32 - Bit 5)
          LE Set Data Length (Octet 33 - Bit 6)
          LE Read Suggested Default Data Length (Octet 33 - Bit 7)
          LE Write Suggested Default Data Length (Octet 34 - Bit 0)
          LE Add Device To Resolving List (Octet 34 - Bit 3)
          LE Remove Device From Resolving List (Octet 34 - Bit 4)
          LE Clear Resolving List (Octet 34 - Bit 5)
          LE Read Resolving List Size (Octet 34 - Bit 6)
          LE Set Address Resolution Enable (Octet 35 - Bit 1)
          LE Set Resolvable Private Address Timeout (Octet 35 - Bit 2)
          LE Read Maximum Data Length (Octet 35 - Bit 3)
          LE Read PHY (Octet 35 - Bit 4)
          LE Set Default PHY (Octet 35 - Bit 5)
          LE Set PHY (Octet 35 - Bit 6)
          LE Enhanced Receiver Test (Octet 35 - Bit 7)
          LE Enhanced Transmitter Test (Octet 36 - Bit 0)
          LE Set Advertising Set Random Address (Octet 36 - Bit 1)
          LE Set Extended Advertising Parameters (Octet 36 - Bit 2)
          LE Set Extended Advertising Data (Octet 36 - Bit 3)
          LE Set Extended Scan Response Data (Octet 36 - Bit 4)
          LE Set Extended Advertising Enable (Octet 36 - Bit 5)
          LE Read Maximum Advertising Data Length (Octet 36 - Bit 6)
          LE Read Number of Supported Advertising Sets (Octet 36 - Bit 7)
          LE Remove Advertising Set (Octet 37 - Bit 0)
          LE Clear Advertising Sets (Octet 37 - Bit 1)
          LE Set Periodic Advertising Parameters (Octet 37 - Bit 2)
          LE Set Periodic Advertising Data (Octet 37 - Bit 3)
          LE Set Periodic Advertising Enable (Octet 37 - Bit 4)
          LE Set Extended Scan Parameters (Octet 37 - Bit 5)
          LE Set Extended Scan Enable (Octet 37 - Bit 6)
          LE Extended Create Connection (Octet 37 - Bit 7)
          LE Periodic Advertising Create Sync (Octet 38 - Bit 0)
          LE Periodic Advertising Create Sync Cancel (Octet 38 - Bit 1)
          LE Periodic Advertising Terminate Sync (Octet 38 - Bit 2)
          LE Add Device To Periodic Advertiser List (Octet 38 - Bit 3)
          LE Remove Device From Periodic Advertiser List (Octet 38 - Bit 4)
          LE Clear Periodic Advertiser List (Octet 38 - Bit 5)
          LE Read Periodic Advertiser List Size (Octet 38 - Bit 6)
          LE Read Transmit Power (Octet 38 - Bit 7)
          LE Read RF Path Compensation (Octet 39 - Bit 0)
          LE Write RF Path Compensation (Octet 39 - Bit 1)
          LE Set Privacy Mode (Octet 39 - Bit 2)
          LE Periodic Advertising Receive Enable (Octet 40 - Bit 5)
          LE Periodic Advertising Sync Transfer (Octet 40 - Bit 6)
          LE Periodic Advertising Set Info Transfer (Octet 40 - Bit 7)
          LE Periodic Advertising Sync Transfer Parameters (Octet 41 - Bit 0)
          LE Set Default Periodic Advertisng Sync Transfer Parameters (Octet 41 - Bit 1)
          LE Read Buffer v2 (Octet 41 - Bit 5)
          LE Read ISO TX Sync (Octet 41 - Bit 6)
          LE Set Connected Isochronous Group Parameters (Octet 41 - Bit 7)
          LE Set Connected Isochronous Group Parameters Test (Octet 42 - Bit 0)
          LE Create Connected Isochronous Stream (Octet 42 - Bit 1)
          LE Remove Connected Isochronous Group (Octet 42 - Bit 2)
          LE Accept Connected Isochronous Stream Request (Octet 42 - Bit 3)
          LE Reject Connected Isochronous Stream Request (Octet 42 - Bit 4)
          LE Create Broadcast Isochronous Group (Octet 42 - Bit 5)
          LE Create Broadcast Isochronous Group Test (Octet 42 - Bit 6)
          LE Terminate Broadcast Isochronous Group (Octet 42 - Bit 7)
          LE Broadcast Isochronous Group Create Sync (Octet 43 - Bit 0)
          LE Broadcast Isochronous Group Terminate Sync (Octet 43 - Bit 1)
          LE Request Peer SCA (Octet 43 - Bit 2)
          LE Setup Isochronous Data Path (Octet 43 - Bit 3)
          LE Remove Isochronous Data Path (Octet 43 - Bit 4)
          LE Isochronous Transmit Test (Octet 43 - Bit 5)
          LE Isochronous Receive Test (Octet 43 - Bit 6)
          LE Isochronous Read Test Counters (Octet 43 - Bit 7)
          LE Isochronous Read Test Counters (Octet 44 - Bit 0)
          LE Set Host Feature (Octet 44 - Bit 1)
          Octet 44 - Bit 2 
          Octet 45 - Bit 6 
          Octet 46 - Bit 0 
          Octet 46 - Bit 1 
          Octet 46 - Bit 2 
< HCI Command: Host Buffer Size (0x03|0x0033) plen 7         #9 [hci1] 0.952416
        ACL MTU: 255  ACL max packet: 16
        SCO MTU: 0    SCO max packet: 0
> HCI Event: Command Complete (0x0e) plen 4                 #10 [hci1] 0.953010
      Host Buffer Size (0x03|0x0033) ncmd 1
        Status: Success (0x00)
< HCI Command: Set Controller To Ho.. (0x03|0x0031) plen 1  #11 [hci1] 0.972410
        Flow control: ACL Data Packets (0x01)
> HCI Event: Command Complete (0x0e) plen 4                 #12 [hci1] 0.972893
      Set Controller To Host Flow Control (0x03|0x0031) ncmd 1
        Status: Success (0x00)
< HCI Command: LE Read Local Suppor.. (0x08|0x0003) plen 0  #13 [hci1] 0.992390
> HCI Event: Command Complete (0x0e) plen 12                #14 [hci1] 0.992901
      LE Read Local Supported Features (0x08|0x0003) ncmd 1
        Status: Success (0x00)
        Features: 0xfd 0x79 0x00 0xf7 0x30 0x01 0x00 0x00
          LE Encryption
          Extended Reject Indication
          Peripheral-initiated Features Exchange
          LE Ping
          LE Data Packet Length Extension
          LL Privacy
          Extended Scanner Filter Policies
          LE 2M PHY
          LE Coded PHY
          LE Extended Advertising
          LE Periodic Advertising
          Channel Selection Algorithm #2
          Periodic Advertising Sync Transfer - Sender
          Periodic Advertising Sync Transfer - Recipient
          Sleep Clock Accuracy Updates
          Connected Isochronous Stream - Central
          Connected Isochronous Stream - Peripheral
          Isochronous Broadcaster
          Synchronized Receiver
          Periodic Advertising ADI support
          Connection Subrating
          Unknown features (0x0000010000000000)
< HCI Command: LE Set Host Feature (0x08|0x0074) plen 2     #15 [hci1] 1.012416
        Bit Number: 32
          Connected Isochronous Stream (Host Support)
        Bit Value: 1
> HCI Event: Command Complete (0x0e) plen 4                 #16 [hci1] 1.012814
      LE Set Host Feature (0x08|0x0074) ncmd 1
        Status: Success (0x00)
< HCI Command: LE Read Buffer v2 (0x08|0x0060) plen 0       #17 [hci1] 1.032399
> HCI Event: Command Complete (0x0e) plen 10                #18 [hci1] 1.032838
      LE Read Buffer v2 (0x08|0x0060) ncmd 1
        Status: Success (0x00)
        ACL MTU: 27
        ACL max packet: 3
        ISO MTU: 318
        ISO max packet: 3
< HCI Command: LE Read Maximum Adve.. (0x08|0x003a) plen 0  #19 [hci1] 1.052451
> HCI Event: Command Complete (0x0e) plen 6                 #20 [hci1] 1.052903
      LE Read Maximum Advertising Data Length (0x08|0x003a) ncmd 1
        Status: Success (0x00)
        Max length: 1650
< HCI Command: LE Read Supported St.. (0x08|0x001c) plen 0  #21 [hci1] 1.072418
> HCI Event: Command Complete (0x0e) plen 12                #22 [hci1] 1.073021
      LE Read Supported States (0x08|0x001c) ncmd 1
        Status: Success (0x00)
        States: 0x000003ff3e0306ff
          Non-connectable Advertising State
          Scannable Advertising State
          Connectable Advertising State
          High Duty Cycle Directed Advertising State
          Passive Scanning State
          Active Scanning State
          Initiating State
            and Connection State (Central Role)
          Connection State (Peripheral Role)
          Scannable Advertising State
            and Passive Scanning State
          Connectable Advertising State
            and Passive Scanning State
          Non-connectable Advertising State
            and Initiating State
          Scannable Advertising State
            and Initiating State
          Active Scanning State
            and Connection State (Central Role)
          Passive Scanning State
            and Connection State (Peripheral Role)
          Active Scanning State
            and Connection State (Peripheral Role)
          Initiating State
            and Connection State (Central Role)
            and Central Role & Central Role
          Low Duty Cycle Directed Advertising State
          Connectable Advertising State
            and Initiating State
            and Central Role & Peripheral Role
          High Duty Cycle Directed Advertising State
            and Initiating State
            and Central Role & Peripheral Role
          Low Duty Cycle Directed Advertising State
            and Initiating State
            and Central Role & Peripheral Role
          Connectable Advertising State
            and Connection State (Central Role)
            and Central Role & Peripheral Role
          High Duty Cycle Directed Advertising State
            and Connection State (Central Role)
            and Central Role & Peripheral Role
          Low Duty Cycle Directed Advertising State
            and Connection State (Central Role)
            and Central Role & Peripheral Role
          Connectable Advertising State
            and Connection State (Peripheral Role)
            and Central Role & Peripheral Role
          High Duty Cycle Directed Advertising State
            and Connection State (Peripheral Role)
            and Peripheral Role & Peripheral Role
          Low Duty Cycle Directed Advertising State
            and Connection State (Peripheral Role)
            and Peripheral Role & Peripheral Role
          Initiating State
            and Connection State (Peripheral Role)
            and Central Role & Peripheral Role
< HCI Command: LE Read Maximum Data.. (0x08|0x002f) plen 0  #23 [hci1] 1.092403
> HCI Event: Command Complete (0x0e) plen 12                #24 [hci1] 1.092937
      LE Read Maximum Data Length (0x08|0x002f) ncmd 1
        Status: Success (0x00)
        Max TX octets: 251
        Max TX time: 2704
        Max RX octets: 251
        Max RX time: 2704
< HCI Command: LE Write Suggested D.. (0x08|0x0024) plen 4  #25 [hci1] 1.112418
        TX octets: 251
        TX time: 2704
> HCI Event: Command Complete (0x0e) plen 4                 #26 [hci1] 1.112853
      LE Write Suggested Default Data Length (0x08|0x0024) ncmd 1
        Status: Success (0x00)
< HCI Command: LE Read Resolving Li.. (0x08|0x002a) plen 0  #27 [hci1] 1.132421
> HCI Event: Command Complete (0x0e) plen 5                 #28 [hci1] 1.132861
      LE Read Resolving List Size (0x08|0x002a) ncmd 1
        Status: Success (0x00)
        Size: 8
< HCI Command: LE Set Event Mask (0x08|0x0001) plen 8       #29 [hci1] 1.152410
        Mask: 0x000002023f87fa5e
          LE Advertising Report
          LE Connection Update Complete
          LE Read Remote Used Features Complete
          LE Long Term Key Request
          LE Data Length Change
          LE Enhanced Connection Complete
          LE PHY Update Complete
          LE Extended Advertising Report
          LE Periodic Advertising Sync Established
          LE Periodic Advertising Report
          LE Periodic Advertising Sync Lost
          LE Extended Scan Timeout
          LE Extended Advertising Set Terminated
          LE Scan Request Received
          LE Periodic Advertising Sync Transfer Rvc
          LE CIS Established
          LE CIS Request
          LE Create BIG Complete
          LE Terminate BIG Complete
          LE BIG Sync Estabilished Complete
          LE BIG Sync Lost
          LE BIG Info Advertising Report
          Unknown mask (0x0000020000000000)
> HCI Event: Command Complete (0x0e) plen 4                 #30 [hci1] 1.152878
      LE Set Event Mask (0x08|0x0001) ncmd 1
        Status: Success (0x00)
< HCI Command: Set Event Mask (0x03|0x0001) plen 8          #31 [hci1] 1.172407
        Mask: 0x2000800002008890
          Disconnection Complete
          Encryption Change
          Read Remote Version Information Complete
          Hardware Error
          Data Buffer Overflow
          Encryption Key Refresh Complete
          LE Meta
> HCI Event: Command Complete (0x0e) plen 4                 #32 [hci1] 1.173020
      Set Event Mask (0x03|0x0001) ncmd 1
        Status: Success (0x00)
< HCI Command: Read BD ADDR (0x04|0x0009) plen 0            #33 [hci1] 1.192415
> HCI Event: Command Complete (0x0e) plen 10                #34 [hci1] 1.192932
      Read BD ADDR (0x04|0x0009) ncmd 1
        Status: Success (0x00)
        Address: 00:00:00:00:00:00 (OUI 00-00-00)
< HCI Command: LE Set Random Address (0x08|0x0005) plen 6   #35 [hci1] 1.212453
        Address: D5:B6:CC:31:DB:3B (Static)
> HCI Event: Command Complete (0x0e) plen 4                 #36 [hci1] 1.212959
      LE Set Random Address (0x08|0x0005) ncmd 1
        Status: Success (0x00)
< HCI Command: LE Set Extended Adv.. (0x08|0x0036) plen 25  #37 [hci1] 3.823585
        Handle: 0x00
        Properties: 0x0013
          Connectable
          Scannable
          Use legacy advertising PDUs: ADV_IND
        Min advertising interval: 100.000 msec (0x00a0)
        Max advertising interval: 150.000 msec (0x00f0)
        Channel map: 37, 38, 39 (0x07)
        Own address type: Random (0x01)
        Peer address type: Public (0x00)
        Peer address: 00:00:00:00:00:00 (OUI 00-00-00)
        Filter policy: Allow Scan Request from Any, Allow Connect Request from Any (0x00)
        TX power: Host has no preference (0x7f)
        Primary PHY: LE 1M (0x01)
        Secondary max skip: 0x00
        Secondary PHY: LE 1M (0x01)
        SID: 0x00
        Scan request notifications: Disabled (0x00)
> HCI Event: Command Complete (0x0e) plen 5                 #38 [hci1] 3.824345
      LE Set Extended Advertising Parameters (0x08|0x0036) ncmd 1
        Status: Success (0x00)
        TX power (selected): 0 dbm (0x00)
< HCI Command: LE Set Advertising S.. (0x08|0x0035) plen 7  #39 [hci1] 3.832388
        Advertising handle: 0x00
        Advertising random address: D5:B6:CC:31:DB:3B (Static)
> HCI Event: Command Complete (0x0e) plen 4                 #40 [hci1] 3.832868
      LE Set Advertising Set Random Address (0x08|0x0035) ncmd 1
        Status: Success (0x00)
< HCI Command: LE Set Extended Adv.. (0x08|0x0037) plen 22  #41 [hci1] 3.852474
        Handle: 0x00
        Operation: Complete extended advertising data (0x03)
        Fragment preference: Minimize fragmentation (0x01)
        Data length: 0x12
        Flags: 0x06
          LE General Discoverable Mode
          BR/EDR Not Supported
        Name (complete): Tester_F6B11A
> HCI Event: Command Complete (0x0e) plen 4                 #42 [hci1] 3.853127
      LE Set Extended Advertising Data (0x08|0x0037) ncmd 1
        Status: Success (0x00)
< HCI Command: LE Set Extended Scan.. (0x08|0x0038) plen 4  #43 [hci1] 3.872449
        Handle: 0x00
        Operation: Complete scan response data (0x03)
        Fragment preference: Minimize fragmentation (0x01)
        Data length: 0x00
> HCI Event: Command Complete (0x0e) plen 4                 #44 [hci1] 3.872986
      LE Set Extended Scan Response Data (0x08|0x0038) ncmd 1
        Status: Success (0x00)
< HCI Command: LE Set Extended Adve.. (0x08|0x0039) plen 6  #45 [hci1] 3.892482
        Extended advertising: Enabled (0x01)
        Number of sets: 1 (0x01)
        Entry 0
          Handle: 0x00
          Duration: 0 ms (0x00)
          Max ext adv events: 0
> HCI Event: Command Complete (0x0e) plen 4                 #46 [hci1] 3.893019
      LE Set Extended Advertising Enable (0x08|0x0039) ncmd 1
        Status: Success (0x00)
> HCI Event: LE Meta Event (0x3e) plen 31                   #47 [hci1] 4.010369
      LE Enhanced Connection Complete (0x0a)
        Status: Success (0x00)
        Handle: 2109
        Role: Peripheral (0x01)
        Peer address type: Public (0x00)
        Peer address: DF:A9:FF:F6:B1:1A (OUI DF-A9-FF)
        Local resolvable private address: 00:00:00:00:00:00 (Non-Resolvable)
        Peer resolvable private address: 00:00:00:00:00:00 (Non-Resolvable)
        Connection interval: 87.50 msec (0x0046)
        Connection latency: 0 (0x0000)
        Supervision timeout: 25120 msec (0x09d0)
        Central clock accuracy: 0x01
> HCI Event: LE Meta Event (0x3e) plen 6                    #48 [hci1] 4.010463
      LE Advertising Set Terminated (0x12)
        Status: Success (0x00)
        Handle: 0
        Connection handle: 2109
        Number of completed extended advertising events: 0
< HCI Command: LE Read Remote Used... (0x08|0x0016) plen 2  #49 [hci1] 4.012658
        Handle: 2109 Address: DF:A9:FF:F6:B1:1A (OUI DF-A9-FF)
< ACL Data TX: Handle 2109 flags 0x00 dlen 7                #50 [hci1] 4.012668
      ATT: Exchange MTU Request (0x02) len 2
        Client RX MTU: 251
> HCI Event: Command Status (0x0f) plen 4                   #51 [hci1] 4.013119
      LE Read Remote Used Features (0x08|0x0016) ncmd 1
        Status: Success (0x00)
> HCI Event: Number of Completed Packets (0x13) plen 5      #52 [hci1] 4.186318
        Num handles: 1
        Handle: 2109 Address: DF:A9:FF:F6:B1:1A (OUI DF-A9-FF)
        Count: 1
        #50: len 7 (0 Kb/s)
        Latency: 173 msec (173-173 msec ~173 msec)
> HCI Event: LE Meta Event (0x3e) plen 12                   #53 [hci1] 4.274263
      LE Read Remote Used Features (0x04)
        Status: Success (0x00)
        Handle: 2109 Address: DF:A9:FF:F6:B1:1A (OUI DF-A9-FF)
        Features: 0x2d 0x49 0x00 0xf7 0x67 0xd8 0x00 0x00
          LE Encryption
          Extended Reject Indication
          Peripheral-initiated Features Exchange
          LE Data Packet Length Extension
          LE 2M PHY
          LE Coded PHY
          Channel Selection Algorithm #2
          Periodic Advertising Sync Transfer - Sender
          Periodic Advertising Sync Transfer - Recipient
          Sleep Clock Accuracy Updates
          Connected Isochronous Stream - Central
          Connected Isochronous Stream - Peripheral
          Isochronous Broadcaster
          Synchronized Receiver
          Connected Isochronous Stream (Host Support)
          LE Power Control Request
          LE Power Control Request
          Connection Subrating
          Connection Subrating (Host Support)
          Unknown features (0x0000d80000000000)
> ACL Data RX: Handle 2109 flags 0x02 dlen 11               #54 [hci1] 6.723922
      SMP: Pairing Request (0x01) len 6
        IO capability: KeyboardDisplay (0x04)
        OOB data: Authentication data not present (0x00)
        Authentication requirement: Bonding, MITM, SC, No Keypresses (0x0d)
        Max encryption key size: 16
        Initiator key distribution: EncKey IdKey (0x03)
        Responder key distribution: EncKey IdKey Sign (0x07)
> ACL Data RX: Handle 2109 flags 0x02 dlen 7                #55 [hci1] 6.724347
      ATT: Exchange MTU Response (0x03) len 2
        Server RX MTU: 23
< HCI Command: Host Number of Compl.. (0x03|0x0035) plen 5  #56 [hci1] 6.733071
        Num handles: 1
        Handle: 2109 Address: DF:A9:FF:F6:B1:1A (OUI DF-A9-FF)
        Count: 1
< ACL Data TX: Handle 2109 flags 0x00 dlen 11               #57 [hci1] 6.733143
      SMP: Pairing Response (0x02) len 6
        IO capability: DisplayOnly (0x00)
        OOB data: Authentication data not present (0x00)
        Authentication requirement: Bonding, No MITM, SC, No Keypresses (0x09)
        Max encryption key size: 16
        Initiator key distribution: IdKey (0x02)
        Responder key distribution: <none> (0x00)
< HCI Command: Host Number of Compl.. (0x03|0x0035) plen 5  #58 [hci1] 6.733576
        Num handles: 1
        Handle: 2109 Address: DF:A9:FF:F6:B1:1A (OUI DF-A9-FF)
        Count: 1
> HCI Event: Number of Completed Packets (0x13) plen 5      #59 [hci1] 6.899112
        Num handles: 1
        Handle: 2109 Address: DF:A9:FF:F6:B1:1A (OUI DF-A9-FF)
        Count: 1
        #57: len 11 (0 Kb/s)
        Latency: 165 msec (165-173 msec ~169 msec)
> ACL Data RX: Handle 2109 flags 0x02 dlen 27               #60 [hci1] 6.899435
> ACL Data RX: Handle 2109 flags 0x01 dlen 27               #61 [hci1] 6.899879
> ACL Data RX: Handle 2109 flags 0x01 dlen 15               #62 [hci1] 6.900345
      SMP: Pairing Public Key (0x0c) len 64
        X: 3ab23ba9cf916d0be5ad65892fd7f5a51d56e5d3680c4790c61e21143ba56f3c
        Y: 87ce92966902abcce5bc973924cd42edad794f8238b3341a46b5e65746421f56
< HCI Command: Host Number of Compl.. (0x03|0x0035) plen 5  #63 [hci1] 6.913486
        Num handles: 1
        Handle: 2109 Address: DF:A9:FF:F6:B1:1A (OUI DF-A9-FF)
        Count: 1
< HCI Command: Host Number of Compl.. (0x03|0x0035) plen 5  #64 [hci1] 6.913768
        Num handles: 1
        Handle: 2109 Address: DF:A9:FF:F6:B1:1A (OUI DF-A9-FF)
        Count: 1
< HCI Command: Host Number of Compl.. (0x03|0x0035) plen 5  #65 [hci1] 6.914103
        Num handles: 1
        Handle: 2109 Address: DF:A9:FF:F6:B1:1A (OUI DF-A9-FF)
        Count: 1
< ACL Data TX: Handle 2109 flags 0x00 dlen 27               #66 [hci1] 6.914280
< ACL Data TX: Handle 2109 flags 0x01 dlen 27               #67 [hci1] 6.914298
< ACL Data TX: Handle 2109 flags 0x01 dlen 15               #68 [hci1] 6.914327
      SMP: Pairing Public Key (0x0c) len 64
        X: 98308440221e2d910f0e54b71e7ec652857aa9b5a0dc65028824cc19db1226e9
        Y: 67a4816bcb62efb21701e31fdb27561a6217575fb007a8bbdabe7e28b6f68482
> HCI Event: Number of Completed Packets (0x13) plen 5      #69 [hci1] 6.986917
        Num handles: 1
        Handle: 2109 Address: DF:A9:FF:F6:B1:1A (OUI DF-A9-FF)
        Count: 1
        #66: len 27 (3 Kb/s)
        Latency: 72 msec (72-173 msec ~121 msec)
> HCI Event: Number of Completed Packets (0x13) plen 5      #70 [hci1] 6.987548
        Num handles: 1
        Handle: 2109 Address: DF:A9:FF:F6:B1:1A (OUI DF-A9-FF)
        Count: 1
        #67: len 27 (2 Kb/s)
        Latency: 73 msec (72-173 msec ~97 msec)
> HCI Event: Number of Completed Packets (0x13) plen 5      #71 [hci1] 7.073817
        Num handles: 1
        Handle: 2109 Address: DF:A9:FF:F6:B1:1A (OUI DF-A9-FF)
        Count: 1
        #68: len 15 (0 Kb/s)
        Latency: 159 msec (72-173 msec ~128 msec)
> ACL Data RX: Handle 2109 flags 0x02 dlen 21               #72 [hci1] 8.036572
      SMP: Pairing Confirm (0x03) len 16
        Confim value: 725b7bf86349854173faa6778c4d20c1
< HCI Command: Host Number of Compl.. (0x03|0x0035) plen 5  #73 [hci1] 8.053091
        Num handles: 1
        Handle: 2109 Address: DF:A9:FF:F6:B1:1A (OUI DF-A9-FF)
        Count: 1
< ACL Data TX: Handle 2109 flags 0x00 dlen 21               #74 [hci1] 8.053317
      SMP: Pairing Confirm (0x03) len 16
        Confim value: 7d84ef71f1efadc5341796608daed041
> HCI Event: Number of Completed Packets (0x13) plen 5      #75 [hci1] 8.211451
        Num handles: 1
        Handle: 2109 Address: DF:A9:FF:F6:B1:1A (OUI DF-A9-FF)
        Count: 1
        #74: len 21 (1 Kb/s)
        Latency: 158 msec (72-173 msec ~143 msec)
> ACL Data RX: Handle 2109 flags 0x02 dlen 21               #76 [hci1] 8.211866
      SMP: Pairing Random (0x04) len 16
        Random value: 0245013e03c8f7b50000000000000000
< HCI Command: Host Number of Compl.. (0x03|0x0035) plen 5  #77 [hci1] 8.213188
        Num handles: 1
        Handle: 2109 Address: DF:A9:FF:F6:B1:1A (OUI DF-A9-FF)
        Count: 1
< ACL Data TX: Handle 2109 flags 0x00 dlen 21               #78 [hci1] 8.213282
      SMP: Pairing Random (0x04) len 16
        Random value: 8e6108f966a694cbe26df70bb96773e6
> HCI Event: Number of Completed Packets (0x13) plen 5      #79 [hci1] 8.386198
        Num handles: 1
        Handle: 2109 Address: DF:A9:FF:F6:B1:1A (OUI DF-A9-FF)
        Count: 1
        #78: len 21 (0 Kb/s)
        Latency: 172 msec (72-173 msec ~158 msec)
> ACL Data RX: Handle 2109 flags 0x02 dlen 21               #80 [hci1] 8.474108
      SMP: Pairing Confirm (0x03) len 16
        Confim value: c47cb219e147e94bc765d9d8b8ab8ccd
< HCI Command: Host Number of Compl.. (0x03|0x0035) plen 5  #81 [hci1] 8.493070
        Num handles: 1
        Handle: 2109 Address: DF:A9:FF:F6:B1:1A (OUI DF-A9-FF)
        Count: 1
< ACL Data TX: Handle 2109 flags 0x00 dlen 21               #82 [hci1] 8.493211
      SMP: Pairing Confirm (0x03) len 16
        Confim value: 5d2751b3f8e5d23259f34825bb7dd011
> HCI Event: Number of Completed Packets (0x13) plen 5      #83 [hci1] 8.648955
        Num handles: 1
        Handle: 2109 Address: DF:A9:FF:F6:B1:1A (OUI DF-A9-FF)
        Count: 1
        #82: len 21 (1 Kb/s)
        Latency: 155 msec (72-173 msec ~156 msec)
> ACL Data RX: Handle 2109 flags 0x02 dlen 21               #84 [hci1] 8.649233
      SMP: Pairing Random (0x04) len 16
        Random value: 63c18c88271e1e1f0000000000000000
< HCI Command: Host Number of Compl.. (0x03|0x0035) plen 5  #85 [hci1] 8.652582
        Num handles: 1
        Handle: 2109 Address: DF:A9:FF:F6:B1:1A (OUI DF-A9-FF)
        Count: 1
< ACL Data TX: Handle 2109 flags 0x00 dlen 21               #86 [hci1] 8.652670
      SMP: Pairing Random (0x04) len 16
        Random value: 4d02679f89a05211af56d8b3da64d21e
> HCI Event: Number of Completed Packets (0x13) plen 5      #87 [hci1] 8.823746
        Num handles: 1
        Handle: 2109 Address: DF:A9:FF:F6:B1:1A (OUI DF-A9-FF)
        Count: 1
        #86: len 21 (0 Kb/s)
        Latency: 171 msec (72-173 msec ~163 msec)
> ACL Data RX: Handle 2109 flags 0x02 dlen 21               #88 [hci1] 8.911565
      SMP: Pairing Confirm (0x03) len 16
        Confim value: c86185bd4f57c37065562fe31c49d080
< HCI Command: Host Number of Compl.. (0x03|0x0035) plen 5  #89 [hci1] 8.912742
        Num handles: 1
        Handle: 2109 Address: DF:A9:FF:F6:B1:1A (OUI DF-A9-FF)
        Count: 1
< ACL Data TX: Handle 2109 flags 0x00 dlen 21               #90 [hci1] 8.912852
      SMP: Pairing Confirm (0x03) len 16
        Confim value: d537a9457b12c36ee01c0c599ec17175
> HCI Event: Number of Completed Packets (0x13) plen 5      #91 [hci1] 9.086431
        Num handles: 1
        Handle: 2109 Address: DF:A9:FF:F6:B1:1A (OUI DF-A9-FF)
        Count: 1
        #90: len 21 (0 Kb/s)
        Latency: 173 msec (72-173 msec ~168 msec)
> ACL Data RX: Handle 2109 flags 0x02 dlen 21               #92 [hci1] 9.086779
      SMP: Pairing Random (0x04) len 16
        Random value: bb2a493f25dd2d310000000000000000
< HCI Command: Host Number of Compl.. (0x03|0x0035) plen 5  #93 [hci1] 9.093367
        Num handles: 1
        Handle: 2109 Address: DF:A9:FF:F6:B1:1A (OUI DF-A9-FF)
        Count: 1
< ACL Data TX: Handle 2109 flags 0x00 dlen 21               #94 [hci1] 9.093555
      SMP: Pairing Random (0x04) len 16
        Random value: 5e8286bc235a02440d0c3424a2acf8fd
> HCI Event: Number of Completed Packets (0x13) plen 5      #95 [hci1] 9.261182
        Num handles: 1
        Handle: 2109 Address: DF:A9:FF:F6:B1:1A (OUI DF-A9-FF)
        Count: 1
        #94: len 21 (1 Kb/s)
        Latency: 167 msec (72-173 msec ~168 msec)
> ACL Data RX: Handle 2109 flags 0x02 dlen 21               #96 [hci1] 9.349125
      SMP: Pairing Confirm (0x03) len 16
        Confim value: 8295211de6837c0c7ccaf6b0633acd8f
< HCI Command: Host Number of Compl.. (0x03|0x0035) plen 5  #97 [hci1] 9.353003
        Num handles: 1
        Handle: 2109 Address: DF:A9:FF:F6:B1:1A (OUI DF-A9-FF)
        Count: 1
< ACL Data TX: Handle 2109 flags 0x00 dlen 21               #98 [hci1] 9.353092
      SMP: Pairing Confirm (0x03) len 16
        Confim value: 284fa250bf179c188801f6ee491d94a8
> HCI Event: Number of Completed Packets (0x13) plen 5      #99 [hci1] 9.523885
        Num handles: 1
        Handle: 2109 Address: DF:A9:FF:F6:B1:1A (OUI DF-A9-FF)
        Count: 1
        #98: len 21 (0 Kb/s)
        Latency: 170 msec (72-173 msec ~169 msec)
> ACL Data RX: Handle 2109 flags 0x02 dlen 21              #100 [hci1] 9.524247
      SMP: Pairing Random (0x04) len 16
        Random value: dd4721365d0de4b00000000000000000
< HCI Command: Host Number of Comp.. (0x03|0x0035) plen 5  #101 [hci1] 9.533378
        Num handles: 1
        Handle: 2109 Address: DF:A9:FF:F6:B1:1A (OUI DF-A9-FF)
        Count: 1
< ACL Data TX: Handle 2109 flags 0x00 dlen 21              #102 [hci1] 9.533535
      SMP: Pairing Random (0x04) len 16
        Random value: 5c4a1bcadd27bd58e945097b00bad7ac
> HCI Event: Number of Completed Packets (0x13) plen 5     #103 [hci1] 9.698686
        Num handles: 1
        Handle: 2109 Address: DF:A9:FF:F6:B1:1A (OUI DF-A9-FF)
        Count: 1
        #102: len 21 (1 Kb/s)
        Latency: 165 msec (72-173 msec ~167 msec)
> ACL Data RX: Handle 2109 flags 0x02 dlen 21              #104 [hci1] 9.786454
      SMP: Pairing Confirm (0x03) len 16
        Confim value: f378229ee3f21755e7820832d935cea8
< HCI Command: Host Number of Comp.. (0x03|0x0035) plen 5  #105 [hci1] 9.792785
        Num handles: 1
        Handle: 2109 Address: DF:A9:FF:F6:B1:1A (OUI DF-A9-FF)
        Count: 1
< ACL Data TX: Handle 2109 flags 0x00 dlen 21              #106 [hci1] 9.792843
      SMP: Pairing Confirm (0x03) len 16
        Confim value: 7bdda9ca0b434952721dcdf5a9226a19
> HCI Event: Number of Completed Packets (0x13) plen 5     #107 [hci1] 9.961455
        Num handles: 1
        Handle: 2109 Address: DF:A9:FF:F6:B1:1A (OUI DF-A9-FF)
        Count: 1
        #106: len 21 (1 Kb/s)
        Latency: 168 msec (72-173 msec ~167 msec)
> ACL Data RX: Handle 2109 flags 0x02 dlen 21              #108 [hci1] 9.961707
      SMP: Pairing Random (0x04) len 16
        Random value: 35f9ff54eeeb62f80000000000000000
< HCI Command: Host Number of Comp.. (0x03|0x0035) plen 5  #109 [hci1] 9.973460
        Num handles: 1
        Handle: 2109 Address: DF:A9:FF:F6:B1:1A (OUI DF-A9-FF)
        Count: 1
< ACL Data TX: Handle 2109 flags 0x00 dlen 21              #110 [hci1] 9.973554
      SMP: Pairing Random (0x04) len 16
        Random value: 32527e6e64e79f33b2e374394db8ab2d
> HCI Event: Number of Completed Packets (0x13) plen 5    #111 [hci1] 10.136132
        Num handles: 1
        Handle: 2109 Address: DF:A9:FF:F6:B1:1A (OUI DF-A9-FF)
        Count: 1
        #110: len 21 (1 Kb/s)
        Latency: 162 msec (72-173 msec ~165 msec)
> ACL Data RX: Handle 2109 flags 0x02 dlen 21             #112 [hci1] 10.224073
      SMP: Pairing Confirm (0x03) len 16
        Confim value: 5a293ed5608e1cddca10355726476c2d
< HCI Command: Host Number of Com.. (0x03|0x0035) plen 5  #113 [hci1] 10.233097
        Num handles: 1
        Handle: 2109 Address: DF:A9:FF:F6:B1:1A (OUI DF-A9-FF)
        Count: 1
< ACL Data TX: Handle 2109 flags 0x00 dlen 21             #114 [hci1] 10.233311
      SMP: Pairing Confirm (0x03) len 16
        Confim value: 6a76ce65e41e6f07219946562be00157
> HCI Event: Number of Completed Packets (0x13) plen 5    #115 [hci1] 10.398831
        Num handles: 1
        Handle: 2109 Address: DF:A9:FF:F6:B1:1A (OUI DF-A9-FF)
        Count: 1
        #114: len 21 (1 Kb/s)
        Latency: 165 msec (72-173 msec ~165 msec)
> ACL Data RX: Handle 2109 flags 0x02 dlen 21             #116 [hci1] 10.399184
      SMP: Pairing Random (0x04) len 16
        Random value: 9cec634b702e16530000000000000000
< HCI Command: Host Number of Com.. (0x03|0x0035) plen 5  #117 [hci1] 10.412780
        Num handles: 1
        Handle: 2109 Address: DF:A9:FF:F6:B1:1A (OUI DF-A9-FF)
        Count: 1
< ACL Data TX: Handle 2109 flags 0x00 dlen 21             #118 [hci1] 10.412879
      SMP: Pairing Random (0x04) len 16
        Random value: dddbdfe2838e9a8cc6964353c850fef7
> HCI Event: Number of Completed Packets (0x13) plen 5    #119 [hci1] 10.573595
        Num handles: 1
        Handle: 2109 Address: DF:A9:FF:F6:B1:1A (OUI DF-A9-FF)
        Count: 1
        #118: len 21 (1 Kb/s)
        Latency: 160 msec (72-173 msec ~163 msec)
> ACL Data RX: Handle 2109 flags 0x02 dlen 21             #120 [hci1] 10.661563
      SMP: Pairing Confirm (0x03) len 16
        Confim value: ce39222a2ef9d1de0a078dbbf45ab3a7
< HCI Command: Host Number of Com.. (0x03|0x0035) plen 5  #121 [hci1] 10.672916
        Num handles: 1
        Handle: 2109 Address: DF:A9:FF:F6:B1:1A (OUI DF-A9-FF)
        Count: 1
< ACL Data TX: Handle 2109 flags 0x00 dlen 21             #122 [hci1] 10.672971
      SMP: Pairing Confirm (0x03) len 16
        Confim value: 797eec226a8c0fef5fecea0856ab4fc4
> HCI Event: Number of Completed Packets (0x13) plen 5    #123 [hci1] 10.836306
        Num handles: 1
        Handle: 2109 Address: DF:A9:FF:F6:B1:1A (OUI DF-A9-FF)
        Count: 1
        #122: len 21 (1 Kb/s)
        Latency: 163 msec (72-173 msec ~163 msec)
> ACL Data RX: Handle 2109 flags 0x02 dlen 21             #124 [hci1] 10.836676
      SMP: Pairing Random (0x04) len 16
        Random value: 97b7607b6ce7f7220000000000000000
< HCI Command: Host Number of Com.. (0x03|0x0035) plen 5  #125 [hci1] 10.853432
        Num handles: 1
        Handle: 2109 Address: DF:A9:FF:F6:B1:1A (OUI DF-A9-FF)
        Count: 1
< ACL Data TX: Handle 2109 flags 0x00 dlen 21             #126 [hci1] 10.853587
      SMP: Pairing Random (0x04) len 16
        Random value: eb9f1915536596b6fc3db1c86b2b1970
> HCI Event: Number of Completed Packets (0x13) plen 5    #127 [hci1] 11.011158
        Num handles: 1
        Handle: 2109 Address: DF:A9:FF:F6:B1:1A (OUI DF-A9-FF)
        Count: 1
        #126: len 21 (1 Kb/s)
        Latency: 157 msec (72-173 msec ~160 msec)
> ACL Data RX: Handle 2109 flags 0x02 dlen 21             #128 [hci1] 11.098964
      SMP: Pairing Confirm (0x03) len 16
        Confim value: 206b42dc3cb86969abb5a4eb76537c7f
< HCI Command: Host Number of Com.. (0x03|0x0035) plen 5  #129 [hci1] 11.113063
        Num handles: 1
        Handle: 2109 Address: DF:A9:FF:F6:B1:1A (OUI DF-A9-FF)
        Count: 1
< ACL Data TX: Handle 2109 flags 0x00 dlen 21             #130 [hci1] 11.113183
      SMP: Pairing Confirm (0x03) len 16
        Confim value: e5eeb3c3f7cb14af8b6ac6496670314e
> HCI Event: Number of Completed Packets (0x13) plen 5    #131 [hci1] 11.273908
        Num handles: 1
        Handle: 2109 Address: DF:A9:FF:F6:B1:1A (OUI DF-A9-FF)
        Count: 1
        #130: len 21 (1 Kb/s)
        Latency: 160 msec (72-173 msec ~160 msec)
> ACL Data RX: Handle 2109 flags 0x02 dlen 21             #132 [hci1] 11.274170
      SMP: Pairing Random (0x04) len 16
        Random value: fd373be2c7740bcb0000000000000000
< HCI Command: Host Number of Com.. (0x03|0x0035) plen 5  #133 [hci1] 11.293383
        Num handles: 1
        Handle: 2109 Address: DF:A9:FF:F6:B1:1A (OUI DF-A9-FF)
        Count: 1
< ACL Data TX: Handle 2109 flags 0x00 dlen 21             #134 [hci1] 11.293562
      SMP: Pairing Random (0x04) len 16
        Random value: 5c794dc9ad9f2c3f295ebd5ad5e1c3cf
> HCI Event: Number of Completed Packets (0x13) plen 5    #135 [hci1] 11.448713
        Num handles: 1
        Handle: 2109 Address: DF:A9:FF:F6:B1:1A (OUI DF-A9-FF)
        Count: 1
        #134: len 21 (1 Kb/s)
        Latency: 155 msec (72-173 msec ~157 msec)
> ACL Data RX: Handle 2109 flags 0x02 dlen 21             #136 [hci1] 11.536435
      SMP: Pairing Confirm (0x03) len 16
        Confim value: 0f71e0eba715d36fe3652fb1a4cb0aa3
< HCI Command: Host Number of Com.. (0x03|0x0035) plen 5  #137 [hci1] 11.553148
        Num handles: 1
        Handle: 2109 Address: DF:A9:FF:F6:B1:1A (OUI DF-A9-FF)
        Count: 1
< ACL Data TX: Handle 2109 flags 0x00 dlen 21             #138 [hci1] 11.553308
      SMP: Pairing Confirm (0x03) len 16
        Confim value: 1e3d4f1b2d6e6e9a98080b53ad4faabd
> HCI Event: Number of Completed Packets (0x13) plen 5    #139 [hci1] 11.711434
        Num handles: 1
        Handle: 2109 Address: DF:A9:FF:F6:B1:1A (OUI DF-A9-FF)
        Count: 1
        #138: len 21 (1 Kb/s)
        Latency: 158 msec (72-173 msec ~157 msec)
> ACL Data RX: Handle 2109 flags 0x02 dlen 21             #140 [hci1] 11.711647
      SMP: Pairing Random (0x04) len 16
        Random value: 304909caa70e66d00000000000000000
< HCI Command: Host Number of Com.. (0x03|0x0035) plen 5  #141 [hci1] 11.712671
        Num handles: 1
        Handle: 2109 Address: DF:A9:FF:F6:B1:1A (OUI DF-A9-FF)
        Count: 1
< ACL Data TX: Handle 2109 flags 0x00 dlen 21             #142 [hci1] 11.712679
      SMP: Pairing Random (0x04) len 16
        Random value: 5c2fff312cdf99c9491988e877355a9a
> HCI Event: Number of Completed Packets (0x13) plen 5    #143 [hci1] 11.886110
        Num handles: 1
        Handle: 2109 Address: DF:A9:FF:F6:B1:1A (OUI DF-A9-FF)
        Count: 1
        #142: len 21 (0 Kb/s)
        Latency: 173 msec (72-173 msec ~165 msec)
> ACL Data RX: Handle 2109 flags 0x02 dlen 21             #144 [hci1] 11.974005
      SMP: Pairing Confirm (0x03) len 16
        Confim value: cbc3b79ea533b559ad9e40a71795f769
< HCI Command: Host Number of Com.. (0x03|0x0035) plen 5  #145 [hci1] 11.993126
        Num handles: 1
        Handle: 2109 Address: DF:A9:FF:F6:B1:1A (OUI DF-A9-FF)
        Count: 1
< ACL Data TX: Handle 2109 flags 0x00 dlen 21             #146 [hci1] 11.993314
      SMP: Pairing Confirm (0x03) len 16
        Confim value: 7ab9f20654c2507170b47f5e101fbdd2
> HCI Event: Number of Completed Packets (0x13) plen 5    #147 [hci1] 12.148744
        Num handles: 1
        Handle: 2109 Address: DF:A9:FF:F6:B1:1A (OUI DF-A9-FF)
        Count: 1
        #146: len 21 (1 Kb/s)
        Latency: 155 msec (72-173 msec ~160 msec)
> ACL Data RX: Handle 2109 flags 0x02 dlen 21             #148 [hci1] 12.149145
      SMP: Pairing Random (0x04) len 16
        Random value: 5300090b0208ae970000000000000000
< HCI Command: Host Number of Com.. (0x03|0x0035) plen 5  #149 [hci1] 12.153362
        Num handles: 1
        Handle: 2109 Address: DF:A9:FF:F6:B1:1A (OUI DF-A9-FF)
        Count: 1
< ACL Data TX: Handle 2109 flags 0x00 dlen 21             #150 [hci1] 12.153526
      SMP: Pairing Random (0x04) len 16
        Random value: c629a3a987d808e808655d558dfc1155
> HCI Event: Number of Completed Packets (0x13) plen 5    #151 [hci1] 12.323664
        Num handles: 1
        Handle: 2109 Address: DF:A9:FF:F6:B1:1A (OUI DF-A9-FF)
        Count: 1
        #150: len 21 (0 Kb/s)
        Latency: 170 msec (72-173 msec ~165 msec)
> ACL Data RX: Handle 2109 flags 0x02 dlen 21             #152 [hci1] 12.411448
      SMP: Pairing Confirm (0x03) len 16
        Confim value: d6ad7553e71cce413e037ba1e19f8237
< HCI Command: Host Number of Com.. (0x03|0x0035) plen 5  #153 [hci1] 12.413058
        Num handles: 1
        Handle: 2109 Address: DF:A9:FF:F6:B1:1A (OUI DF-A9-FF)
        Count: 1
< ACL Data TX: Handle 2109 flags 0x00 dlen 21             #154 [hci1] 12.413166
      SMP: Pairing Confirm (0x03) len 16
        Confim value: 82c82d41fe4290c471cfacf5cf3c1243
> HCI Event: Number of Completed Packets (0x13) plen 5    #155 [hci1] 12.586453
        Num handles: 1
        Handle: 2109 Address: DF:A9:FF:F6:B1:1A (OUI DF-A9-FF)
        Count: 1
        #154: len 21 (0 Kb/s)
        Latency: 173 msec (72-173 msec ~169 msec)
> ACL Data RX: Handle 2109 flags 0x02 dlen 21             #156 [hci1] 12.586701
      SMP: Pairing Random (0x04) len 16
        Random value: b7e5248d9ed653460000000000000000
< HCI Command: Host Number of Com.. (0x03|0x0035) plen 5  #157 [hci1] 12.593292
        Num handles: 1
        Handle: 2109 Address: DF:A9:FF:F6:B1:1A (OUI DF-A9-FF)
        Count: 1
< ACL Data TX: Handle 2109 flags 0x00 dlen 21             #158 [hci1] 12.593489
      SMP: Pairing Random (0x04) len 16
        Random value: 92f20f6ad8f13724432c7fd6001c45ff
> HCI Event: Number of Completed Packets (0x13) plen 5    #159 [hci1] 12.761063
        Num handles: 1
        Handle: 2109 Address: DF:A9:FF:F6:B1:1A (OUI DF-A9-FF)
        Count: 1
        #158: len 21 (1 Kb/s)
        Latency: 167 msec (72-173 msec ~168 msec)
> ACL Data RX: Handle 2109 flags 0x02 dlen 21             #160 [hci1] 12.848909
      SMP: Pairing Confirm (0x03) len 16
        Confim value: 25de3972e28fe97817f4b3e297a4194a
< HCI Command: Host Number of Com.. (0x03|0x0035) plen 5  #161 [hci1] 12.852783
        Num handles: 1
        Handle: 2109 Address: DF:A9:FF:F6:B1:1A (OUI DF-A9-FF)
        Count: 1
< ACL Data TX: Handle 2109 flags 0x00 dlen 21             #162 [hci1] 12.852897
      SMP: Pairing Confirm (0x03) len 16
        Confim value: 82a4185b2f2300c28e8236f8afaf2f6f
> HCI Event: Number of Completed Packets (0x13) plen 5    #163 [hci1] 13.023756
        Num handles: 1
        Handle: 2109 Address: DF:A9:FF:F6:B1:1A (OUI DF-A9-FF)
        Count: 1
        #162: len 21 (0 Kb/s)
        Latency: 170 msec (72-173 msec ~169 msec)
> ACL Data RX: Handle 2109 flags 0x02 dlen 21             #164 [hci1] 13.024111
      SMP: Pairing Random (0x04) len 16
        Random value: cacfe591b31334810000000000000000
< HCI Command: Host Number of Com.. (0x03|0x0035) plen 5  #165 [hci1] 13.033262
        Num handles: 1
        Handle: 2109 Address: DF:A9:FF:F6:B1:1A (OUI DF-A9-FF)
        Count: 1
< ACL Data TX: Handle 2109 flags 0x00 dlen 21             #166 [hci1] 13.033405
      SMP: Pairing Random (0x04) len 16
        Random value: 23ac32ebbb5e14c8a6b9622f296d277f
> HCI Event: Number of Completed Packets (0x13) plen 5    #167 [hci1] 13.198565
        Num handles: 1
        Handle: 2109 Address: DF:A9:FF:F6:B1:1A (OUI DF-A9-FF)
        Count: 1
        #166: len 21 (1 Kb/s)
        Latency: 165 msec (72-173 msec ~167 msec)
> ACL Data RX: Handle 2109 flags 0x02 dlen 21             #168 [hci1] 13.286439
      SMP: Pairing Confirm (0x03) len 16
        Confim value: 2ac3245cc114337d394feb44785240ce
< HCI Command: Host Number of Com.. (0x03|0x0035) plen 5  #169 [hci1] 13.292896
        Num handles: 1
        Handle: 2109 Address: DF:A9:FF:F6:B1:1A (OUI DF-A9-FF)
        Count: 1
< ACL Data TX: Handle 2109 flags 0x00 dlen 21             #170 [hci1] 13.293008
      SMP: Pairing Confirm (0x03) len 16
        Confim value: 6f299146fa65c517bb3a2e9b46cc11f6
> HCI Event: Number of Completed Packets (0x13) plen 5    #171 [hci1] 13.461322
        Num handles: 1
        Handle: 2109 Address: DF:A9:FF:F6:B1:1A (OUI DF-A9-FF)
        Count: 1
        #170: len 21 (1 Kb/s)
        Latency: 168 msec (72-173 msec ~167 msec)
> ACL Data RX: Handle 2109 flags 0x02 dlen 21             #172 [hci1] 13.461623
      SMP: Pairing Random (0x04) len 16
        Random value: ea3b329fd62cc3e20000000000000000
< HCI Command: Host Number of Com.. (0x03|0x0035) plen 5  #173 [hci1] 13.472904
        Num handles: 1
        Handle: 2109 Address: DF:A9:FF:F6:B1:1A (OUI DF-A9-FF)
        Count: 1
< ACL Data TX: Handle 2109 flags 0x00 dlen 21             #174 [hci1] 13.472953
      SMP: Pairing Random (0x04) len 16
        Random value: 297efe85e67448a15f56bd27e3a3cf1d
> HCI Event: Number of Completed Packets (0x13) plen 5    #175 [hci1] 13.636061
        Num handles: 1
        Handle: 2109 Address: DF:A9:FF:F6:B1:1A (OUI DF-A9-FF)
        Count: 1
        #174: len 21 (1 Kb/s)
        Latency: 163 msec (72-173 msec ~165 msec)
> ACL Data RX: Handle 2109 flags 0x02 dlen 21             #176 [hci1] 13.723845
      SMP: Pairing Confirm (0x03) len 16
        Confim value: 3d43b22d7b5e8b4ffc5bd65d61f35993
< HCI Command: Host Number of Com.. (0x03|0x0035) plen 5  #177 [hci1] 13.733213
        Num handles: 1
        Handle: 2109 Address: DF:A9:FF:F6:B1:1A (OUI DF-A9-FF)
        Count: 1
< ACL Data TX: Handle 2109 flags 0x00 dlen 21             #178 [hci1] 13.733387
      SMP: Pairing Confirm (0x03) len 16
        Confim value: e25d249fb68bb8f2a35900f2dfe220a3
> HCI Event: Number of Completed Packets (0x13) plen 5    #179 [hci1] 13.898733
        Num handles: 1
        Handle: 2109 Address: DF:A9:FF:F6:B1:1A (OUI DF-A9-FF)
        Count: 1
        #178: len 21 (1 Kb/s)
        Latency: 165 msec (72-173 msec ~165 msec)
> ACL Data RX: Handle 2109 flags 0x02 dlen 21             #180 [hci1] 13.899093
      SMP: Pairing Random (0x04) len 16
        Random value: 8c4b65748b90758a0000000000000000
< HCI Command: Host Number of Com.. (0x03|0x0035) plen 5  #181 [hci1] 13.913485
        Num handles: 1
        Handle: 2109 Address: DF:A9:FF:F6:B1:1A (OUI DF-A9-FF)
        Count: 1
< ACL Data TX: Handle 2109 flags 0x00 dlen 21             #182 [hci1] 13.913681
      SMP: Pairing Random (0x04) len 16
        Random value: 25a9493fd3ce4faf02be7293595bb7c6
> HCI Event: Number of Completed Packets (0x13) plen 5    #183 [hci1] 14.073537
        Num handles: 1
        Handle: 2109 Address: DF:A9:FF:F6:B1:1A (OUI DF-A9-FF)
        Count: 1
        #182: len 21 (1 Kb/s)
        Latency: 159 msec (72-173 msec ~162 msec)
> ACL Data RX: Handle 2109 flags 0x02 dlen 21             #184 [hci1] 14.161451
      SMP: Pairing Confirm (0x03) len 16
        Confim value: d0ab8fecb4869e65d9d54e717f17730e
< HCI Command: Host Number of Com.. (0x03|0x0035) plen 5  #185 [hci1] 14.173115
        Num handles: 1
        Handle: 2109 Address: DF:A9:FF:F6:B1:1A (OUI DF-A9-FF)
        Count: 1
< ACL Data TX: Handle 2109 flags 0x00 dlen 21             #186 [hci1] 14.173291
      SMP: Pairing Confirm (0x03) len 16
        Confim value: 493b298eea08733ed7d03c29f28c7b71
> HCI Event: Number of Completed Packets (0x13) plen 5    #187 [hci1] 14.336294
        Num handles: 1
        Handle: 2109 Address: DF:A9:FF:F6:B1:1A (OUI DF-A9-FF)
        Count: 1
        #186: len 21 (1 Kb/s)
        Latency: 163 msec (72-173 msec ~162 msec)
> ACL Data RX: Handle 2109 flags 0x02 dlen 21             #188 [hci1] 14.336613
      SMP: Pairing Random (0x04) len 16
        Random value: dc06707f658bd92c0000000000000000
< HCI Command: Host Number of Com.. (0x03|0x0035) plen 5  #189 [hci1] 14.353453
        Num handles: 1
        Handle: 2109 Address: DF:A9:FF:F6:B1:1A (OUI DF-A9-FF)
        Count: 1
< ACL Data TX: Handle 2109 flags 0x00 dlen 21             #190 [hci1] 14.353626
      SMP: Pairing Random (0x04) len 16
        Random value: 58f6b41f855a6f6c3560debd84e2affc
> HCI Event: Number of Completed Packets (0x13) plen 5    #191 [hci1] 14.510995
        Num handles: 1
        Handle: 2109 Address: DF:A9:FF:F6:B1:1A (OUI DF-A9-FF)
        Count: 1
        #190: len 21 (1 Kb/s)
        Latency: 157 msec (72-173 msec ~160 msec)
> ACL Data RX: Handle 2109 flags 0x02 dlen 21             #192 [hci1] 14.598847
      SMP: Pairing Confirm (0x03) len 16
        Confim value: 4f652966291ee0bce363f5b199240a60
< HCI Command: Host Number of Com.. (0x03|0x0035) plen 5  #193 [hci1] 14.612559
        Num handles: 1
        Handle: 2109 Address: DF:A9:FF:F6:B1:1A (OUI DF-A9-FF)
        Count: 1
< ACL Data TX: Handle 2109 flags 0x00 dlen 21             #194 [hci1] 14.612580
      SMP: Pairing Confirm (0x03) len 16
        Confim value: dadd3b8d7f1e24bda97bdd4a46fefe1c
> HCI Event: Number of Completed Packets (0x13) plen 5    #195 [hci1] 14.773843
        Num handles: 1
        Handle: 2109 Address: DF:A9:FF:F6:B1:1A (OUI DF-A9-FF)
        Count: 1
        #194: len 21 (1 Kb/s)
        Latency: 161 msec (72-173 msec ~160 msec)
> ACL Data RX: Handle 2109 flags 0x02 dlen 21             #196 [hci1] 14.774057
      SMP: Pairing Random (0x04) len 16
        Random value: ffa7f5a3475206a20000000000000000
< HCI Command: Host Number of Com.. (0x03|0x0035) plen 5  #197 [hci1] 14.793330
        Num handles: 1
        Handle: 2109 Address: DF:A9:FF:F6:B1:1A (OUI DF-A9-FF)
        Count: 1
< ACL Data TX: Handle 2109 flags 0x00 dlen 21             #198 [hci1] 14.793420
      SMP: Pairing Random (0x04) len 16
        Random value: b67e7216d5bf664139eda2b542549666
> HCI Event: Number of Completed Packets (0x13) plen 5    #199 [hci1] 14.948494
        Num handles: 1
        Handle: 2109 Address: DF:A9:FF:F6:B1:1A (OUI DF-A9-FF)
        Count: 1
        #198: len 21 (1 Kb/s)
        Latency: 155 msec (72-173 msec ~157 msec)
> ACL Data RX: Handle 2109 flags 0x02 dlen 21             #200 [hci1] 15.036385
      SMP: Pairing Confirm (0x03) len 16
        Confim value: cd7a4ecd5bc790d637639f9e33b90c1e
< HCI Command: Host Number of Com.. (0x03|0x0035) plen 5  #201 [hci1] 15.052710
        Num handles: 1
        Handle: 2109 Address: DF:A9:FF:F6:B1:1A (OUI DF-A9-FF)
        Count: 1
< ACL Data TX: Handle 2109 flags 0x00 dlen 21             #202 [hci1] 15.052783
      SMP: Pairing Confirm (0x03) len 16
        Confim value: 860d195a3e3c78c8ecb98167062699f8
> HCI Event: Number of Completed Packets (0x13) plen 5    #203 [hci1] 15.211223
        Num handles: 1
        Handle: 2109 Address: DF:A9:FF:F6:B1:1A (OUI DF-A9-FF)
        Count: 1
        #202: len 21 (1 Kb/s)
        Latency: 158 msec (72-173 msec ~158 msec)
> ACL Data RX: Handle 2109 flags 0x02 dlen 21             #204 [hci1] 15.211591
      SMP: Pairing Random (0x04) len 16
        Random value: b97c7249fa7041ba0000000000000000
< HCI Command: Host Number of Com.. (0x03|0x0035) plen 5  #205 [hci1] 15.213376
        Num handles: 1
        Handle: 2109 Address: DF:A9:FF:F6:B1:1A (OUI DF-A9-FF)
        Count: 1
< ACL Data TX: Handle 2109 flags 0x00 dlen 21             #206 [hci1] 15.213474
      SMP: Pairing Random (0x04) len 16
        Random value: ed17f76500c95219dd01e09d1e63f87b
> HCI Event: Number of Completed Packets (0x13) plen 5    #207 [hci1] 15.386000
        Num handles: 1
        Handle: 2109 Address: DF:A9:FF:F6:B1:1A (OUI DF-A9-FF)
        Count: 1
        #206: len 21 (0 Kb/s)
        Latency: 172 msec (72-173 msec ~165 msec)
> ACL Data RX: Handle 2109 flags 0x02 dlen 21             #208 [hci1] 15.473901
      SMP: Pairing Confirm (0x03) len 16
        Confim value: f5257e6d0b6085f82e9a567cf97f3455
< HCI Command: Host Number of Com.. (0x03|0x0035) plen 5  #209 [hci1] 15.493143
        Num handles: 1
        Handle: 2109 Address: DF:A9:FF:F6:B1:1A (OUI DF-A9-FF)
        Count: 1
< ACL Data TX: Handle 2109 flags 0x00 dlen 21             #210 [hci1] 15.493361
      SMP: Pairing Confirm (0x03) len 16
        Confim value: a717688e9b95a2d36835f515e7a72c06
> HCI Event: Number of Completed Packets (0x13) plen 5    #211 [hci1] 15.648710
        Num handles: 1
        Handle: 2109 Address: DF:A9:FF:F6:B1:1A (OUI DF-A9-FF)
        Count: 1
        #210: len 21 (1 Kb/s)
        Latency: 155 msec (72-173 msec ~160 msec)
> ACL Data RX: Handle 2109 flags 0x02 dlen 21             #212 [hci1] 15.649023
      SMP: Pairing Random (0x04) len 16
        Random value: c8ac60e3ad1385eb0000000000000000
< HCI Command: Host Number of Com.. (0x03|0x0035) plen 5  #213 [hci1] 15.653309
        Num handles: 1
        Handle: 2109 Address: DF:A9:FF:F6:B1:1A (OUI DF-A9-FF)
        Count: 1
< ACL Data TX: Handle 2109 flags 0x00 dlen 21             #214 [hci1] 15.653464
      SMP: Pairing Random (0x04) len 16
        Random value: 81d35d47e1f6006d79c974bd9d9e1ee3
> HCI Event: Number of Completed Packets (0x13) plen 5    #215 [hci1] 15.823462
        Num handles: 1
        Handle: 2109 Address: DF:A9:FF:F6:B1:1A (OUI DF-A9-FF)
        Count: 1
        #214: len 21 (0 Kb/s)
        Latency: 169 msec (72-173 msec ~165 msec)
> ACL Data RX: Handle 2109 flags 0x02 dlen 21             #216 [hci1] 15.911380
      SMP: Pairing Confirm (0x03) len 16
        Confim value: 313dc8b0fce4a294342c9c468665c79d
< HCI Command: Host Number of Com.. (0x03|0x0035) plen 5  #217 [hci1] 15.912756
        Num handles: 1
        Handle: 2109 Address: DF:A9:FF:F6:B1:1A (OUI DF-A9-FF)
        Count: 1
< ACL Data TX: Handle 2109 flags 0x00 dlen 21             #218 [hci1] 15.912791
      SMP: Pairing Confirm (0x03) len 16
        Confim value: 9058fa2a4ab09aa4e1c3ab4b07173450
> HCI Event: Number of Completed Packets (0x13) plen 5    #219 [hci1] 16.086194
        Num handles: 1
        Handle: 2109 Address: DF:A9:FF:F6:B1:1A (OUI DF-A9-FF)
        Count: 1
        #218: len 21 (0 Kb/s)
        Latency: 173 msec (72-173 msec ~169 msec)
> ACL Data RX: Handle 2109 flags 0x02 dlen 21             #220 [hci1] 16.086476
      SMP: Pairing Random (0x04) len 16
        Random value: d34b6bd5e363b11b0000000000000000
< HCI Command: Host Number of Com.. (0x03|0x0035) plen 5  #221 [hci1] 16.093527
        Num handles: 1
        Handle: 2109 Address: DF:A9:FF:F6:B1:1A (OUI DF-A9-FF)
        Count: 1
< ACL Data TX: Handle 2109 flags 0x00 dlen 21             #222 [hci1] 16.093687
      SMP: Pairing Random (0x04) len 16
        Random value: e7f7e0c2476823e41736a7e381bafb7c
> HCI Event: Number of Completed Packets (0x13) plen 5    #223 [hci1] 16.260969
        Num handles: 1
        Handle: 2109 Address: DF:A9:FF:F6:B1:1A (OUI DF-A9-FF)
        Count: 1
        #222: len 21 (1 Kb/s)
        Latency: 167 msec (72-173 msec ~168 msec)
> ACL Data RX: Handle 2109 flags 0x02 dlen 21             #224 [hci1] 16.348798
      SMP: Pairing Confirm (0x03) len 16
        Confim value: 665cd8bc7db95cdb30f126afbde2d0ab
< HCI Command: Host Number of Com.. (0x03|0x0035) plen 5  #225 [hci1] 16.353309
        Num handles: 1
        Handle: 2109 Address: DF:A9:FF:F6:B1:1A (OUI DF-A9-FF)
        Count: 1
< ACL Data TX: Handle 2109 flags 0x00 dlen 21             #226 [hci1] 16.353403
      SMP: Pairing Confirm (0x03) len 16
        Confim value: 199b37ca6424e0ede558a07afee91fd4
> HCI Event: Number of Completed Packets (0x13) plen 5    #227 [hci1] 16.523690
        Num handles: 1
        Handle: 2109 Address: DF:A9:FF:F6:B1:1A (OUI DF-A9-FF)
        Count: 1
        #226: len 21 (0 Kb/s)
        Latency: 170 msec (72-173 msec ~169 msec)
> ACL Data RX: Handle 2109 flags 0x02 dlen 21             #228 [hci1] 16.524036
      SMP: Pairing Random (0x04) len 16
        Random value: 207930c8407eb8340000000000000000
