Bluetooth monitor ver 5.72
= Note: Linux version 6.14.0-36-generic (x86_64)                       0.527389
= Note: Bluetooth subsystem version 2.22                               0.527391
= New Index: 00:00:00:00:00:00 (Primary,UART,hci1)              [hci1] 0.527392
= New Index: 48:5F:99:8E:E0:64 (Primary,USB,hci0)               [hci0] 0.527393
= Open Index: 00:00:00:00:00:00                                 [hci1] 0.680565
= Index Info: 00:00:00:00:00:00 (Nordic Semiconductor ASA)      [hci1] 0.680569
@ USER Open: main (privileged) version 2.22            {0x0001} [hci1] 0.680572
< HCI Command: Reset (0x03|0x0003) plen 0                    #1 [hci1] 0.680909
> HCI Event: Command Complete (0x0e) plen 4                  #2 [hci1] 0.681369
      Reset (0x03|0x0003) ncmd 1
        Status: Success (0x00)
< HCI Command: Read Local Supported... (0x04|0x0003) plen 0  #3 [hci1] 0.700539
> HCI Event: Command Complete (0x0e) plen 12                 #4 [hci1] 0.701046
      Read Local Supported Features (0x04|0x0003) ncmd 1
        Status: Success (0x00)
        Features: 0x00 0x00 0x00 0x00 0x60 0x00 0x00 0x00
          BR/EDR Not Supported
          LE Supported (Controller)
< HCI Command: Read Local Version In.. (0x04|0x0001) plen 0  #5 [hci1] 0.720583
> HCI Event: Command Complete (0x0e) plen 12                 #6 [hci1] 0.721078
      Read Local Version Information (0x04|0x0001) ncmd 1
        Status: Success (0x00)
        HCI version: Reserved (0x0f) - Revision 12393 (0x3069)
        LMP version: Reserved (0x0f) - Subversion 12393 (0x3069)
        Manufacturer: Nordic Semiconductor ASA (89)
< HCI Command: Read Local Supported... (0x04|0x0002) plen 0  #7 [hci1] 0.740591
> HCI Event: Command Complete (0x0e) plen 68                 #8 [hci1] 0.741653
      Read Local Supported Commands (0x04|0x0002) ncmd 1
        Status: Success (0x00)
        Commands: 119 entries
          Disconnect (Octet 0 - Bit 5)
          Read Remote Version Information (Octet 2 - Bit 7)
          Set Event Mask (Octet 5 - Bit 6)
          Reset (Octet 5 - Bit 7)
          Read Connection Accept Timeout (Octet 7 - Bit 2)
          Write Connection Accept Timeout (Octet 7 - Bit 3)
          Read Transmit Power Level (Octet 10 - Bit 2)
          Set Controller To Host Flow Control (Octet 10 - Bit 5)
          Host Buffer Size (Octet 10 - Bit 6)
          Host Number of Completed Packets (Octet 10 - Bit 7)
          Read Local Version Information (Octet 14 - Bit 3)
          Read Local Supported Features (Octet 14 - Bit 5)
          Read BD ADDR (Octet 15 - Bit 1)
          Read RSSI (Octet 15 - Bit 5)
          Set Event Mask Page 2 (Octet 22 - Bit 2)
          LE Set Event Mask (Octet 25 - Bit 0)
          LE Read Buffer Size (Octet 25 - Bit 1)
          LE Read Local Supported Features (Octet 25 - Bit 2)
          LE Set Random Address (Octet 25 - Bit 4)
          LE Set Advertising Parameters (Octet 25 - Bit 5)
          LE Read Advertising Channel TX Power (Octet 25 - Bit 6)
          LE Set Advertising Data (Octet 25 - Bit 7)
          LE Set Scan Response Data (Octet 26 - Bit 0)
          LE Set Advertise Enable (Octet 26 - Bit 1)
          LE Set Scan Parameters (Octet 26 - Bit 2)
          LE Set Scan Enable (Octet 26 - Bit 3)
          LE Create Connection (Octet 26 - Bit 4)
          LE Create Connection Cancel (Octet 26 - Bit 5)
          LE Read Accept List Size (Octet 26 - Bit 6)
          LE Clear Accept List (Octet 26 - Bit 7)
          LE Add Device To Accept List (Octet 27 - Bit 0)
          LE Remove Device From Accept List (Octet 27 - Bit 1)
          LE Connection Update (Octet 27 - Bit 2)
          LE Set Host Channel Classification (Octet 27 - Bit 3)
          LE Read Channel Map (Octet 27 - Bit 4)
          LE Read Remote Used Features (Octet 27 - Bit 5)
          LE Encrypt (Octet 27 - Bit 6)
          LE Rand (Octet 27 - Bit 7)
          LE Start Encryption (Octet 28 - Bit 0)
          LE Long Term Key Request Reply (Octet 28 - Bit 1)
          LE Long Term Key Request Neg Reply (Octet 28 - Bit 2)
          LE Read Supported States (Octet 28 - Bit 3)
          LE Receiver Test (Octet 28 - Bit 4)
          LE Transmitter Test (Octet 28 - Bit 5)
          LE Test End (Octet 28 - Bit 6)
          Read Authenticated Payload Timeout (Octet 32 - Bit 4)
          Write Authenticated Payload Timeout (Octet 32 - Bit 5)
          LE Set Data Length (Octet 33 - Bit 6)
          LE Read Suggested Default Data Length (Octet 33 - Bit 7)
          LE Write Suggested Default Data Length (Octet 34 - Bit 0)
          LE Add Device To Resolving List (Octet 34 - Bit 3)
          LE Remove Device From Resolving List (Octet 34 - Bit 4)
          LE Clear Resolving List (Octet 34 - Bit 5)
          LE Read Resolving List Size (Octet 34 - Bit 6)
          LE Set Address Resolution Enable (Octet 35 - Bit 1)
          LE Set Resolvable Private Address Timeout (Octet 35 - Bit 2)
          LE Read Maximum Data Length (Octet 35 - Bit 3)
          LE Read PHY (Octet 35 - Bit 4)
          LE Set Default PHY (Octet 35 - Bit 5)
          LE Set PHY (Octet 35 - Bit 6)
          LE Enhanced Receiver Test (Octet 35 - Bit 7)
          LE Enhanced Transmitter Test (Octet 36 - Bit 0)
          LE Set Advertising Set Random Address (Octet 36 - Bit 1)
          LE Set Extended Advertising Parameters (Octet 36 - Bit 2)
          LE Set Extended Advertising Data (Octet 36 - Bit 3)
          LE Set Extended Scan Response Data (Octet 36 - Bit 4)
          LE Set Extended Advertising Enable (Octet 36 - Bit 5)
          LE Read Maximum Advertising Data Length (Octet 36 - Bit 6)
          LE Read Number of Supported Advertising Sets (Octet 36 - Bit 7)
          LE Remove Advertising Set (Octet 37 - Bit 0)
          LE Clear Advertising Sets (Octet 37 - Bit 1)
          LE Set Periodic Advertising Parameters (Octet 37 - Bit 2)
          LE Set Periodic Advertising Data (Octet 37 - Bit 3)
          LE Set Periodic Advertising Enable (Octet 37 - Bit 4)
          LE Set Extended Scan Parameters (Octet 37 - Bit 5)
          LE Set Extended Scan Enable (Octet 37 - Bit 6)
          LE Extended Create Connection (Octet 37 - Bit 7)
          LE Periodic Advertising Create Sync (Octet 38 - Bit 0)
          LE Periodic Advertising Create Sync Cancel (Octet 38 - Bit 1)
          LE Periodic Advertising Terminate Sync (Octet 38 - Bit 2)
          LE Add Device To Periodic Advertiser List (Octet 38 - Bit 3)
          LE Remove Device From Periodic Advertiser List (Octet 38 - Bit 4)
          LE Clear Periodic Advertiser List (Octet 38 - Bit 5)
          LE Read Periodic Advertiser List Size (Octet 38 - Bit 6)
          LE Read Transmit Power (Octet 38 - Bit 7)
          LE Read RF Path Compensation (Octet 39 - Bit 0)
          LE Write RF Path Compensation (Octet 39 - Bit 1)
          LE Set Privacy Mode (Octet 39 - Bit 2)
          LE Periodic Advertising Receive Enable (Octet 40 - Bit 5)
          LE Periodic Advertising Sync Transfer (Octet 40 - Bit 6)
          LE Periodic Advertising Set Info Transfer (Octet 40 - Bit 7)
          LE Periodic Advertising Sync Transfer Parameters (Octet 41 - Bit 0)
          LE Set Default Periodic Advertisng Sync Transfer Parameters (Octet 41 - Bit 1)
          LE Read Buffer v2 (Octet 41 - Bit 5)
          LE Read ISO TX Sync (Octet 41 - Bit 6)
          LE Set Connected Isochronous Group Parameters (Octet 41 - Bit 7)
          LE Set Connected Isochronous Group Parameters Test (Octet 42 - Bit 0)
          LE Create Connected Isochronous Stream (Octet 42 - Bit 1)
          LE Remove Connected Isochronous Group (Octet 42 - Bit 2)
          LE Accept Connected Isochronous Stream Request (Octet 42 - Bit 3)
          LE Reject Connected Isochronous Stream Request (Octet 42 - Bit 4)
          LE Create Broadcast Isochronous Group (Octet 42 - Bit 5)
          LE Create Broadcast Isochronous Group Test (Octet 42 - Bit 6)
          LE Terminate Broadcast Isochronous Group (Octet 42 - Bit 7)
          LE Broadcast Isochronous Group Create Sync (Octet 43 - Bit 0)
          LE Broadcast Isochronous Group Terminate Sync (Octet 43 - Bit 1)
          LE Request Peer SCA (Octet 43 - Bit 2)
          LE Setup Isochronous Data Path (Octet 43 - Bit 3)
          LE Remove Isochronous Data Path (Octet 43 - Bit 4)
          LE Isochronous Transmit Test (Octet 43 - Bit 5)
          LE Isochronous Receive Test (Octet 43 - Bit 6)
          LE Isochronous Read Test Counters (Octet 43 - Bit 7)
          LE Isochronous Read Test Counters (Octet 44 - Bit 0)
          LE Set Host Feature (Octet 44 - Bit 1)
          Octet 44 - Bit 2 
          Octet 45 - Bit 6 
          Octet 46 - Bit 0 
          Octet 46 - Bit 1 
          Octet 46 - Bit 2 
< HCI Command: Host Buffer Size (0x03|0x0033) plen 7         #9 [hci1] 0.760550
        ACL MTU: 255  ACL max packet: 16
        SCO MTU: 0    SCO max packet: 0
> HCI Event: Command Complete (0x0e) plen 4                 #10 [hci1] 0.761033
      Host Buffer Size (0x03|0x0033) ncmd 1
        Status: Success (0x00)
< HCI Command: Set Controller To Ho.. (0x03|0x0031) plen 1  #11 [hci1] 0.780527
        Flow control: ACL Data Packets (0x01)
> HCI Event: Command Complete (0x0e) plen 4                 #12 [hci1] 0.780976
      Set Controller To Host Flow Control (0x03|0x0031) ncmd 1
        Status: Success (0x00)
< HCI Command: LE Read Local Suppor.. (0x08|0x0003) plen 0  #13 [hci1] 0.800628
> HCI Event: Command Complete (0x0e) plen 12                #14 [hci1] 0.801099
      LE Read Local Supported Features (0x08|0x0003) ncmd 1
        Status: Success (0x00)
        Features: 0xfd 0x79 0x00 0xf7 0x30 0x01 0x00 0x00
          LE Encryption
          Extended Reject Indication
          Peripheral-initiated Features Exchange
          LE Ping
          LE Data Packet Length Extension
          LL Privacy
          Extended Scanner Filter Policies
          LE 2M PHY
          LE Coded PHY
          LE Extended Advertising
          LE Periodic Advertising
          Channel Selection Algorithm #2
          Periodic Advertising Sync Transfer - Sender
          Periodic Advertising Sync Transfer - Recipient
          Sleep Clock Accuracy Updates
          Connected Isochronous Stream - Central
          Connected Isochronous Stream - Peripheral
          Isochronous Broadcaster
          Synchronized Receiver
          Periodic Advertising ADI support
          Connection Subrating
          Unknown features (0x0000010000000000)
< HCI Command: LE Set Host Feature (0x08|0x0074) plen 2     #15 [hci1] 0.820540
        Bit Number: 32
          Connected Isochronous Stream (Host Support)
        Bit Value: 1
> HCI Event: Command Complete (0x0e) plen 4                 #16 [hci1] 0.820938
      LE Set Host Feature (0x08|0x0074) ncmd 1
        Status: Success (0x00)
< HCI Command: LE Read Buffer v2 (0x08|0x0060) plen 0       #17 [hci1] 0.840586
> HCI Event: Command Complete (0x0e) plen 10                #18 [hci1] 0.841069
      LE Read Buffer v2 (0x08|0x0060) ncmd 1
        Status: Success (0x00)
        ACL MTU: 27
        ACL max packet: 3
        ISO MTU: 318
        ISO max packet: 3
< HCI Command: LE Read Maximum Adve.. (0x08|0x003a) plen 0  #19 [hci1] 0.860654
> HCI Event: Command Complete (0x0e) plen 6                 #20 [hci1] 0.861109
      LE Read Maximum Advertising Data Length (0x08|0x003a) ncmd 1
        Status: Success (0x00)
        Max length: 1650
< HCI Command: LE Read Supported St.. (0x08|0x001c) plen 0  #21 [hci1] 0.880606
> HCI Event: Command Complete (0x0e) plen 12                #22 [hci1] 0.881111
      LE Read Supported States (0x08|0x001c) ncmd 1
        Status: Success (0x00)
        States: 0x000003ff3e0306ff
          Non-connectable Advertising State
          Scannable Advertising State
          Connectable Advertising State
          High Duty Cycle Directed Advertising State
          Passive Scanning State
          Active Scanning State
          Initiating State
            and Connection State (Central Role)
          Connection State (Peripheral Role)
          Scannable Advertising State
            and Passive Scanning State
          Connectable Advertising State
            and Passive Scanning State
          Non-connectable Advertising State
            and Initiating State
          Scannable Advertising State
            and Initiating State
          Active Scanning State
            and Connection State (Central Role)
          Passive Scanning State
            and Connection State (Peripheral Role)
          Active Scanning State
            and Connection State (Peripheral Role)
          Initiating State
            and Connection State (Central Role)
            and Central Role & Central Role
          Low Duty Cycle Directed Advertising State
          Connectable Advertising State
            and Initiating State
            and Central Role & Peripheral Role
          High Duty Cycle Directed Advertising State
            and Initiating State
            and Central Role & Peripheral Role
          Low Duty Cycle Directed Advertising State
            and Initiating State
            and Central Role & Peripheral Role
          Connectable Advertising State
            and Connection State (Central Role)
            and Central Role & Peripheral Role
          High Duty Cycle Directed Advertising State
            and Connection State (Central Role)
            and Central Role & Peripheral Role
          Low Duty Cycle Directed Advertising State
            and Connection State (Central Role)
            and Central Role & Peripheral Role
          Connectable Advertising State
            and Connection State (Peripheral Role)
            and Central Role & Peripheral Role
          High Duty Cycle Directed Advertising State
            and Connection State (Peripheral Role)
            and Peripheral Role & Peripheral Role
          Low Duty Cycle Directed Advertising State
            and Connection State (Peripheral Role)
            and Peripheral Role & Peripheral Role
          Initiating State
            and Connection State (Peripheral Role)
            and Central Role & Peripheral Role
< HCI Command: LE Read Maximum Data.. (0x08|0x002f) plen 0  #23 [hci1] 0.900646
> HCI Event: Command Complete (0x0e) plen 12                #24 [hci1] 0.901127
      LE Read Maximum Data Length (0x08|0x002f) ncmd 1
        Status: Success (0x00)
        Max TX octets: 251
        Max TX time: 2704
        Max RX octets: 251
        Max RX time: 2704
< HCI Command: LE Write Suggested D.. (0x08|0x0024) plen 4  #25 [hci1] 0.920637
        TX octets: 251
        TX time: 2704
> HCI Event: Command Complete (0x0e) plen 4                 #26 [hci1] 0.921093
      LE Write Suggested Default Data Length (0x08|0x0024) ncmd 1
        Status: Success (0x00)
< HCI Command: LE Read Resolving Li.. (0x08|0x002a) plen 0  #27 [hci1] 0.940624
> HCI Event: Command Complete (0x0e) plen 5                 #28 [hci1] 0.941045
      LE Read Resolving List Size (0x08|0x002a) ncmd 1
        Status: Success (0x00)
        Size: 8
< HCI Command: LE Set Event Mask (0x08|0x0001) plen 8       #29 [hci1] 0.960631
        Mask: 0x000002023f87fa5e
          LE Advertising Report
          LE Connection Update Complete
          LE Read Remote Used Features Complete
          LE Long Term Key Request
          LE Data Length Change
          LE Enhanced Connection Complete
          LE PHY Update Complete
          LE Extended Advertising Report
          LE Periodic Advertising Sync Established
          LE Periodic Advertising Report
          LE Periodic Advertising Sync Lost
          LE Extended Scan Timeout
          LE Extended Advertising Set Terminated
          LE Scan Request Received
          LE Periodic Advertising Sync Transfer Rvc
          LE CIS Established
          LE CIS Request
          LE Create BIG Complete
          LE Terminate BIG Complete
          LE BIG Sync Estabilished Complete
          LE BIG Sync Lost
          LE BIG Info Advertising Report
          Unknown mask (0x0000020000000000)
> HCI Event: Command Complete (0x0e) plen 4                 #30 [hci1] 0.961124
      LE Set Event Mask (0x08|0x0001) ncmd 1
        Status: Success (0x00)
< HCI Command: Set Event Mask (0x03|0x0001) plen 8          #31 [hci1] 0.980606
        Mask: 0x2000800002008890
          Disconnection Complete
          Encryption Change
          Read Remote Version Information Complete
          Hardware Error
          Data Buffer Overflow
          Encryption Key Refresh Complete
          LE Meta
> HCI Event: Command Complete (0x0e) plen 4                 #32 [hci1] 0.981076
      Set Event Mask (0x03|0x0001) ncmd 1
        Status: Success (0x00)
< HCI Command: Read BD ADDR (0x04|0x0009) plen 0            #33 [hci1] 1.000601
> HCI Event: Command Complete (0x0e) plen 10                #34 [hci1] 1.001047
      Read BD ADDR (0x04|0x0009) ncmd 1
        Status: Success (0x00)
        Address: 00:00:00:00:00:00 (OUI 00-00-00)
< HCI Command: LE Set Random Address (0x08|0x0005) plen 6   #35 [hci1] 1.020621
        Address: D5:B6:CC:31:DB:3B (Static)
> HCI Event: Command Complete (0x0e) plen 4                 #36 [hci1] 1.021156
      LE Set Random Address (0x08|0x0005) ncmd 1
        Status: Success (0x00)
< HCI Command: LE Set Extended Adv.. (0x08|0x0036) plen 25  #37 [hci1] 4.471007
        Handle: 0x00
        Properties: 0x0013
          Connectable
          Scannable
          Use legacy advertising PDUs: ADV_IND
        Min advertising interval: 100.000 msec (0x00a0)
        Max advertising interval: 150.000 msec (0x00f0)
        Channel map: 37, 38, 39 (0x07)
        Own address type: Random (0x01)
        Peer address type: Public (0x00)
        Peer address: 00:00:00:00:00:00 (OUI 00-00-00)
        Filter policy: Allow Scan Request from Any, Allow Connect Request from Any (0x00)
        TX power: Host has no preference (0x7f)
        Primary PHY: LE 1M (0x01)
        Secondary max skip: 0x00
        Secondary PHY: LE 1M (0x01)
        SID: 0x00
        Scan request notifications: Disabled (0x00)
> HCI Event: Command Complete (0x0e) plen 5                 #38 [hci1] 4.471816
      LE Set Extended Advertising Parameters (0x08|0x0036) ncmd 1
        Status: Success (0x00)
        TX power (selected): 0 dbm (0x00)
< HCI Command: LE Set Advertising S.. (0x08|0x0035) plen 7  #39 [hci1] 4.480599
        Advertising handle: 0x00
        Advertising random address: D5:B6:CC:31:DB:3B (Static)
> HCI Event: Command Complete (0x0e) plen 4                 #40 [hci1] 4.481184
      LE Set Advertising Set Random Address (0x08|0x0035) ncmd 1
        Status: Success (0x00)
< HCI Command: LE Set Extended Adv.. (0x08|0x0037) plen 22  #41 [hci1] 4.500656
        Handle: 0x00
        Operation: Complete extended advertising data (0x03)
        Fragment preference: Minimize fragmentation (0x01)
        Data length: 0x12
        Flags: 0x04
          BR/EDR Not Supported
        Name (complete): Tester_F6B11A
> HCI Event: Command Complete (0x0e) plen 4                 #42 [hci1] 4.501425
      LE Set Extended Advertising Data (0x08|0x0037) ncmd 1
        Status: Success (0x00)
< HCI Command: LE Set Extended Scan.. (0x08|0x0038) plen 4  #43 [hci1] 4.520659
        Handle: 0x00
        Operation: Complete scan response data (0x03)
        Fragment preference: Minimize fragmentation (0x01)
        Data length: 0x00
> HCI Event: Command Complete (0x0e) plen 4                 #44 [hci1] 4.521132
      LE Set Extended Scan Response Data (0x08|0x0038) ncmd 1
        Status: Success (0x00)
< HCI Command: LE Set Extended Adve.. (0x08|0x0039) plen 6  #45 [hci1] 4.540656
        Extended advertising: Enabled (0x01)
        Number of sets: 1 (0x01)
        Entry 0
          Handle: 0x00
          Duration: 0 ms (0x00)
          Max ext adv events: 0
> HCI Event: Command Complete (0x0e) plen 4                 #46 [hci1] 4.541400
      LE Set Extended Advertising Enable (0x08|0x0039) ncmd 1
        Status: Success (0x00)
> HCI Event: LE Meta Event (0x3e) plen 31                   #47 [hci1] 4.865406
      LE Enhanced Connection Complete (0x0a)
        Status: Success (0x00)
        Handle: 1425
        Role: Peripheral (0x01)
        Peer address type: Public (0x00)
        Peer address: DF:A9:FF:F6:B1:1A (OUI DF-A9-FF)
        Local resolvable private address: 00:00:00:00:00:00 (Non-Resolvable)
        Peer resolvable private address: 00:00:00:00:00:00 (Non-Resolvable)
        Connection interval: 87.50 msec (0x0046)
        Connection latency: 0 (0x0000)
        Supervision timeout: 20000 msec (0x07d0)
        Central clock accuracy: 0x01
> HCI Event: LE Meta Event (0x3e) plen 6                    #48 [hci1] 4.865497
      LE Advertising Set Terminated (0x12)
        Status: Success (0x00)
        Handle: 0
        Connection handle: 1425
        Number of completed extended advertising events: 0
< HCI Command: LE Read Remote Used... (0x08|0x0016) plen 2  #49 [hci1] 4.881343
        Handle: 1425 Address: DF:A9:FF:F6:B1:1A (OUI DF-A9-FF)
> HCI Event: Command Status (0x0f) plen 4                   #50 [hci1] 4.881794
      LE Read Remote Used Features (0x08|0x0016) ncmd 1
        Status: Success (0x00)
> HCI Event: LE Meta Event (0x3e) plen 12                   #51 [hci1] 5.129374
      LE Read Remote Used Features (0x04)
        Status: Success (0x00)
        Handle: 1425 Address: DF:A9:FF:F6:B1:1A (OUI DF-A9-FF)
        Features: 0x2d 0x49 0x00 0xf7 0x67 0xd9 0x00 0x80
          LE Encryption
          Extended Reject Indication
          Peripheral-initiated Features Exchange
          LE Data Packet Length Extension
          LE 2M PHY
          LE Coded PHY
          Channel Selection Algorithm #2
          Periodic Advertising Sync Transfer - Sender
          Periodic Advertising Sync Transfer - Recipient
          Sleep Clock Accuracy Updates
          Connected Isochronous Stream - Central
          Connected Isochronous Stream - Peripheral
          Isochronous Broadcaster
          Synchronized Receiver
          Connected Isochronous Stream (Host Support)
          LE Power Control Request
          LE Power Control Request
          Connection Subrating
          Connection Subrating (Host Support)
          Unknown features (0x8000d90000000000)
> ACL Data RX: Handle 1425 flags 0x02 dlen 11               #52 [hci1] 7.579084
      SMP: Pairing Request (0x01) len 6
        IO capability: KeyboardDisplay (0x04)
        OOB data: Authentication data not present (0x00)
        Authentication requirement: Bonding, No MITM, SC, No Keypresses (0x09)
        Max encryption key size: 16
        Initiator key distribution: EncKey IdKey (0x03)
        Responder key distribution: EncKey IdKey Sign (0x07)
< HCI Command: Host Number of Compl.. (0x03|0x0035) plen 5  #53 [hci1] 7.581116
        Num handles: 1
        Handle: 1425 Address: DF:A9:FF:F6:B1:1A (OUI DF-A9-FF)
        Count: 1
< ACL Data TX: Handle 1425 flags 0x00 dlen 11               #54 [hci1] 7.581212
      SMP: Pairing Response (0x02) len 6
        IO capability: NoInputNoOutput (0x03)
        OOB data: Authentication data not present (0x00)
        Authentication requirement: Bonding, No MITM, SC, No Keypresses (0x09)
        Max encryption key size: 16
        Initiator key distribution: IdKey (0x02)
        Responder key distribution: <none> (0x00)
> HCI Event: Number of Completed Packets (0x13) plen 5      #55 [hci1] 7.754127
        Num handles: 1
        Handle: 1425 Address: DF:A9:FF:F6:B1:1A (OUI DF-A9-FF)
        Count: 1
        #54: len 11 (0 Kb/s)
        Latency: 172 msec (172-172 msec ~172 msec)
> ACL Data RX: Handle 1425 flags 0x02 dlen 27               #56 [hci1] 7.754452
> ACL Data RX: Handle 1425 flags 0x01 dlen 27               #57 [hci1] 7.754961
> ACL Data RX: Handle 1425 flags 0x01 dlen 15               #58 [hci1] 7.755392
      SMP: Pairing Public Key (0x0c) len 64
        X: 34b596b2fc38741e6926e31a192b03d3f81148176ade84db7ddae0ed7d2862db
        Y: 9312d9fa505752c92dd7bd13be93a196376db118eff215154406e695f36654e3
< HCI Command: Host Number of Compl.. (0x03|0x0035) plen 5  #59 [hci1] 7.761441
        Num handles: 1
        Handle: 1425 Address: DF:A9:FF:F6:B1:1A (OUI DF-A9-FF)
        Count: 1
< HCI Command: Host Number of Compl.. (0x03|0x0035) plen 5  #60 [hci1] 7.761579
        Num handles: 1
        Handle: 1425 Address: DF:A9:FF:F6:B1:1A (OUI DF-A9-FF)
        Count: 1
< HCI Command: Host Number of Compl.. (0x03|0x0035) plen 5  #61 [hci1] 7.761903
        Num handles: 1
        Handle: 1425 Address: DF:A9:FF:F6:B1:1A (OUI DF-A9-FF)
        Count: 1
< ACL Data TX: Handle 1425 flags 0x00 dlen 27               #62 [hci1] 7.762005
< ACL Data TX: Handle 1425 flags 0x01 dlen 27               #63 [hci1] 7.762047
< ACL Data TX: Handle 1425 flags 0x01 dlen 15               #64 [hci1] 7.762069
      SMP: Pairing Public Key (0x0c) len 64
        X: 98308440221e2d910f0e54b71e7ec652857aa9b5a0dc65028824cc19db1226e9
        Y: 67a4816bcb62efb21701e31fdb27561a6217575fb007a8bbdabe7e28b6f68482
> HCI Event: Number of Completed Packets (0x13) plen 5      #65 [hci1] 7.842062
        Num handles: 1
        Handle: 1425 Address: DF:A9:FF:F6:B1:1A (OUI DF-A9-FF)
        Count: 1
        #62: len 27 (2 Kb/s)
        Latency: 80 msec (80-172 msec ~126 msec)
> HCI Event: Number of Completed Packets (0x13) plen 5      #66 [hci1] 7.842688
        Num handles: 1
        Handle: 1425 Address: DF:A9:FF:F6:B1:1A (OUI DF-A9-FF)
        Count: 1
        #63: len 27 (2 Kb/s)
        Latency: 80 msec (80-172 msec ~103 msec)
< ACL Data TX: Handle 1425 flags 0x00 dlen 21               #67 [hci1] 7.860793
      SMP: Pairing Confirm (0x03) len 16
        Confim value: a2270fa5956ca134de697e30e63410f6
> HCI Event: Number of Completed Packets (0x13) plen 5      #68 [hci1] 7.928796
        Num handles: 1
        Handle: 1425 Address: DF:A9:FF:F6:B1:1A (OUI DF-A9-FF)
        Count: 1
        #64: len 15 (0 Kb/s)
        Latency: 166 msec (80-172 msec ~135 msec)
> HCI Event: Number of Completed Packets (0x13) plen 5      #69 [hci1] 8.016504
        Num handles: 1
        Handle: 1425 Address: DF:A9:FF:F6:B1:1A (OUI DF-A9-FF)
        Count: 1
        #67: len 21 (1 Kb/s)
        Latency: 155 msec (80-172 msec ~145 msec)
> ACL Data RX: Handle 1425 flags 0x02 dlen 21               #70 [hci1] 8.016932
      SMP: Pairing Random (0x04) len 16
        Random value: c173e9f1bd7086920000000000000000
< HCI Command: Host Number of Compl.. (0x03|0x0035) plen 5  #71 [hci1] 8.020996
        Num handles: 1
        Handle: 1425 Address: DF:A9:FF:F6:B1:1A (OUI DF-A9-FF)
        Count: 1
< ACL Data TX: Handle 1425 flags 0x00 dlen 21               #72 [hci1] 8.021056
      SMP: Pairing Random (0x04) len 16
        Random value: 8e6108f966a694cbe26df70bb96773e6
> HCI Event: Number of Completed Packets (0x13) plen 5      #73 [hci1] 8.191474
        Num handles: 1
        Handle: 1425 Address: DF:A9:FF:F6:B1:1A (OUI DF-A9-FF)
        Count: 1
        #72: len 21 (0 Kb/s)
        Latency: 170 msec (80-172 msec ~157 msec)
> ACL Data RX: Handle 1425 flags 0x02 dlen 21               #74 [hci1] 8.366692
      SMP: Pairing DHKey Check (0x0d) len 16
        E: b5d98c5f952cec84cefe34d15875c131
< HCI Command: Host Number of Compl.. (0x03|0x0035) plen 5  #75 [hci1] 8.380863
        Num handles: 1
        Handle: 1425 Address: DF:A9:FF:F6:B1:1A (OUI DF-A9-FF)
        Count: 1
< ACL Data TX: Handle 1425 flags 0x00 dlen 21               #76 [hci1] 8.380889
      SMP: Pairing DHKey Check (0x0d) len 16
        E: b197b9ed077adde665aa66ca10dab6b3
> HCI Event: Number of Completed Packets (0x13) plen 5      #77 [hci1] 8.541434
        Num handles: 1
        Handle: 1425 Address: DF:A9:FF:F6:B1:1A (OUI DF-A9-FF)
        Count: 1
        #76: len 21 (1 Kb/s)
        Latency: 160 msec (80-172 msec ~159 msec)
> HCI Event: LE Meta Event (0x3e) plen 13                   #78 [hci1] 8.629435
      LE Long Term Key Request (0x05)
        Handle: 1425 Address: DF:A9:FF:F6:B1:1A (OUI DF-A9-FF)
        Random number: 0x0000000000000000
        Encrypted diversifier: 0x0000
< HCI Command: LE Long Term Key Re.. (0x08|0x001a) plen 18  #79 [hci1] 8.640746
        Handle: 1425 Address: DF:A9:FF:F6:B1:1A (OUI DF-A9-FF)
        Long term key: 57c260e90330617b5eb7b007da3a726b
> HCI Event: Command Complete (0x0e) plen 6                 #80 [hci1] 8.641379
      LE Long Term Key Request Reply (0x08|0x001a) ncmd 1
        Status: Success (0x00)
        Handle: 1425 Address: DF:A9:FF:F6:B1:1A (OUI DF-A9-FF)
> HCI Event: Encryption Change (0x08) plen 4                #81 [hci1] 9.066629
        Status: Success (0x00)
        Handle: 1425 Address: DF:A9:FF:F6:B1:1A (OUI DF-A9-FF)
        Encryption: Enabled with AES-CCM (0x01)
> ACL Data RX: Handle 1425 flags 0x02 dlen 21               #82 [hci1] 9.154301
      SMP: Identity Information (0x08) len 16
        Identity resolving key: ca48dd9dd01425070f1fe55d8b72dbf7
< HCI Command: Host Number of Compl.. (0x03|0x0035) plen 5  #83 [hci1] 9.190863
        Num handles: 1
        Handle: 1425 Address: DF:A9:FF:F6:B1:1A (OUI DF-A9-FF)
        Count: 1
> ACL Data RX: Handle 1425 flags 0x02 dlen 12               #84 [hci1] 9.241570
      SMP: Identity Address Information (0x09) len 7
        Address: DF:A9:FF:F6:B1:1A (OUI DF-A9-FF)
> ACL Data RX: Handle 1425 flags 0x02 dlen 13               #85 [hci1] 9.242121
      ATT: Find By Type Value Request (0x06) len 8
        Handle range: 0x0001-0xffff
        Attribute type: Primary Service (0x2800)
          UUID: Object Transfer (0x1825)
< HCI Command: LE Add Device To Re.. (0x08|0x0027) plen 39  #86 [hci1] 9.260918
        Address type: Public (0x00)
        Address: DF:A9:FF:F6:B1:1A (OUI DF-A9-FF)
        Peer identity resolving key: ca48dd9dd01425070f1fe55d8b72dbf7
        Local identity resolving key: 00000000000000000000000000000000
> HCI Event: Command Complete (0x0e) plen 4                 #87 [hci1] 9.261829
      LE Add Device To Resolving List (0x08|0x0027) ncmd 1
        Status: Success (0x00)
< HCI Command: LE Set Privacy Mode (0x08|0x004e) plen 8     #88 [hci1] 9.281107
        Peer Identity address type: Public (0x00)
        Peer Identity address: DF:A9:FF:F6:B1:1A (OUI DF-A9-FF)
        Privacy Mode: Use Device Privacy (0x01)
> HCI Event: Command Complete (0x0e) plen 4                 #89 [hci1] 9.281635
      LE Set Privacy Mode (0x08|0x004e) ncmd 1
        Status: Success (0x00)
< HCI Command: LE Set Address Resol.. (0x08|0x002d) plen 1  #90 [hci1] 9.301013
        Address resolution: Enabled (0x01)
> HCI Event: Command Complete (0x0e) plen 4                 #91 [hci1] 9.301509
      LE Set Address Resolution Enable (0x08|0x002d) ncmd 1
        Status: Success (0x00)
< HCI Command: Host Number of Compl.. (0x03|0x0035) plen 5  #92 [hci1] 9.320685
        Num handles: 1
        Handle: 1425 Address: DF:A9:FF:F6:B1:1A (OUI DF-A9-FF)
        Count: 1
< HCI Command: Host Number of Compl.. (0x03|0x0035) plen 5  #93 [hci1] 9.320843
        Num handles: 1
        Handle: 1425 Address: DF:A9:FF:F6:B1:1A (OUI DF-A9-FF)
        Count: 1
< ACL Data TX: Handle 1425 flags 0x00 dlen 9                #94 [hci1] 9.320913
      ATT: Find By Type Value Response (0x07) len 4
        Handle range: 0x0027-0x0039
> HCI Event: Number of Completed Packets (0x13) plen 5      #95 [hci1] 9.416497
        Num handles: 1
        Handle: 1425 Address: DF:A9:FF:F6:B1:1A (OUI DF-A9-FF)
        Count: 1
        #94: len 9 (0 Kb/s)
        Latency: 95 msec (80-172 msec ~127 msec)
> ACL Data RX: Handle 1425 flags 0x02 dlen 13               #96 [hci1] 9.416808
      ATT: Find By Type Value Request (0x06) len 8
        Handle range: 0x003a-0xffff
        Attribute type: Primary Service (0x2800)
          UUID: Object Transfer (0x1825)
< HCI Command: Host Number of Compl.. (0x03|0x0035) plen 5  #97 [hci1] 9.421181
        Num handles: 1
        Handle: 1425 Address: DF:A9:FF:F6:B1:1A (OUI DF-A9-FF)
        Count: 1
< ACL Data TX: Handle 1425 flags 0x00 dlen 9                #98 [hci1] 9.421250
      ATT: Error Response (0x01) len 4
        Find By Type Value Request (0x06)
        Handle: 0x003a
        Error: Attribute Not Found (0x0a)
> HCI Event: Number of Completed Packets (0x13) plen 5      #99 [hci1] 9.591472
        Num handles: 1
        Handle: 1425 Address: DF:A9:FF:F6:B1:1A (OUI DF-A9-FF)
        Count: 1
        #98: len 9 (0 Kb/s)
        Latency: 170 msec (80-172 msec ~148 msec)
> ACL Data RX: Handle 1425 flags 0x02 dlen 11              #100 [hci1] 9.591741
      ATT: Read By Type Request (0x08) len 6
        Handle range: 0x0027-0x0039
        Attribute type: Characteristic (0x2803)
< HCI Command: Host Number of Comp.. (0x03|0x0035) plen 5  #101 [hci1] 9.601382
        Num handles: 1
        Handle: 1425 Address: DF:A9:FF:F6:B1:1A (OUI DF-A9-FF)
        Count: 1
< ACL Data TX: Handle 1425 flags 0x00 dlen 20              #102 [hci1] 9.601456
      ATT: Read By Type Response (0x09) len 15
        Attribute data length: 7
        Attribute data list: 2 entries
        Handle: 0x0028
        Value: 022900bd2a
            Properties: 0x02
              Read (0x02)
            Value Handle: 0x0029
            Value UUID: OTS Feature (0x2abd)
        Handle: 0x002a
        Value: 0a2b00be2a
            Properties: 0x0a
              Read (0x02)
              Write (0x08)
            Value Handle: 0x002b
            Value UUID: Object Name (0x2abe)
> HCI Event: Number of Completed Packets (0x13) plen 5     #103 [hci1] 9.766462
        Num handles: 1
        Handle: 1425 Address: DF:A9:FF:F6:B1:1A (OUI DF-A9-FF)
        Count: 1
        #102: len 20 (0 Kb/s)
        Latency: 165 msec (80-172 msec ~156 msec)
> ACL Data RX: Handle 1425 flags 0x02 dlen 11              #104 [hci1] 9.766725
      ATT: Read By Type Request (0x08) len 6
        Handle range: 0x002b-0x0039
        Attribute type: Characteristic (0x2803)
< HCI Command: Host Number of Comp.. (0x03|0x0035) plen 5  #105 [hci1] 9.781350
        Num handles: 1
        Handle: 1425 Address: DF:A9:FF:F6:B1:1A (OUI DF-A9-FF)
        Count: 1
< ACL Data TX: Handle 1425 flags 0x00 dlen 20              #106 [hci1] 9.781504
      ATT: Read By Type Response (0x09) len 15
        Attribute data length: 7
        Attribute data list: 2 entries
        Handle: 0x002c
        Value: 022d00bf2a
            Properties: 0x02
              Read (0x02)
            Value Handle: 0x002d
            Value UUID: Object Type (0x2abf)
        Handle: 0x002e
        Value: 022f00c02a
            Properties: 0x02
              Read (0x02)
            Value Handle: 0x002f
            Value UUID: Object Size (0x2ac0)
< ACL Data TX: Handle 1425 flags 0x00 dlen 16              #107 [hci1] 9.890634
      LE L2CAP: Connection Parameter Update Request (0x12) ident 1 len 8
        Min interval: 24
        Max interval: 40
        Peripheral latency: 0
        Timeout multiplier: 42
> HCI Event: Number of Completed Packets (0x13) plen 5     #108 [hci1] 9.941485
        Num handles: 1
        Handle: 1425 Address: DF:A9:FF:F6:B1:1A (OUI DF-A9-FF)
        Count: 1
        #106: len 20 (1 Kb/s)
        Latency: 159 msec (80-172 msec ~158 msec)
> ACL Data RX: Handle 1425 flags 0x02 dlen 11              #109 [hci1] 9.941639
      ATT: Read By Type Request (0x08) len 6
        Handle range: 0x002f-0x0039
        Attribute type: Characteristic (0x2803)
< HCI Command: Host Number of Comp.. (0x03|0x0035) plen 5  #110 [hci1] 9.961015
        Num handles: 1
        Handle: 1425 Address: DF:A9:FF:F6:B1:1A (OUI DF-A9-FF)
        Count: 1
< ACL Data TX: Handle 1425 flags 0x00 dlen 20              #111 [hci1] 9.961052
      ATT: Read By Type Response (0x09) len 15
        Attribute data length: 7
        Attribute data list: 2 entries
        Handle: 0x0030
        Value: 023100c32a
            Properties: 0x02
              Read (0x02)
            Value Handle: 0x0031
            Value UUID: Object ID (0x2ac3)
        Handle: 0x0032
        Value: 023300c42a
            Properties: 0x02
              Read (0x02)
            Value Handle: 0x0033
            Value UUID: Object Properties (0x2ac4)
> HCI Event: Number of Completed Packets (0x13) plen 5    #112 [hci1] 10.029055
        Num handles: 1
        Handle: 1425 Address: DF:A9:FF:F6:B1:1A (OUI DF-A9-FF)
        Count: 1
        #107: len 16 (0 Kb/s)
        Latency: 138 msec (80-172 msec ~148 msec)
> ACL Data RX: Handle 1425 flags 0x02 dlen 10             #113 [hci1] 10.029157
      LE L2CAP: Connection Parameter Update Response (0x13) ident 1 len 2
        Result: Connection Parameters accepted (0x0000)
< HCI Command: Host Number of Com.. (0x03|0x0035) plen 5  #114 [hci1] 10.041339
        Num handles: 1
        Handle: 1425 Address: DF:A9:FF:F6:B1:1A (OUI DF-A9-FF)
        Count: 1
> HCI Event: Number of Completed Packets (0x13) plen 5    #115 [hci1] 10.116564
        Num handles: 1
        Handle: 1425 Address: DF:A9:FF:F6:B1:1A (OUI DF-A9-FF)
        Count: 1
        #111: len 20 (1 Kb/s)
        Latency: 155 msec (80-172 msec ~151 msec)
> ACL Data RX: Handle 1425 flags 0x02 dlen 11             #116 [hci1] 10.116684
      ATT: Read By Type Request (0x08) len 6
        Handle range: 0x0033-0x0039
        Attribute type: Characteristic (0x2803)
< HCI Command: Host Number of Com.. (0x03|0x0035) plen 5  #117 [hci1] 10.121368
        Num handles: 1
        Handle: 1425 Address: DF:A9:FF:F6:B1:1A (OUI DF-A9-FF)
        Count: 1
< ACL Data TX: Handle 1425 flags 0x00 dlen 20             #118 [hci1] 10.121394
      ATT: Read By Type Response (0x09) len 15
        Attribute data length: 7
        Attribute data list: 2 entries
        Handle: 0x0034
        Value: 283500c52a
            Properties: 0x28
              Write (0x08)
              Indicate (0x20)
            Value Handle: 0x0035
            Value UUID: Object Action Control Point (0x2ac5)
        Handle: 0x0037
        Value: 283800c62a
            Properties: 0x28
              Write (0x08)
              Indicate (0x20)
            Value Handle: 0x0038
            Value UUID: Object List Control Point (0x2ac6)
> HCI Event: Number of Completed Packets (0x13) plen 5    #119 [hci1] 10.291525
        Num handles: 1
        Handle: 1425 Address: DF:A9:FF:F6:B1:1A (OUI DF-A9-FF)
        Count: 1
        #118: len 20 (0 Kb/s)
        Latency: 170 msec (80-172 msec ~161 msec)
> ACL Data RX: Handle 1425 flags 0x02 dlen 11             #120 [hci1] 10.291689
      ATT: Read By Type Request (0x08) len 6
        Handle range: 0x0038-0x0039
        Attribute type: Characteristic (0x2803)
< HCI Command: Host Number of Com.. (0x03|0x0035) plen 5  #121 [hci1] 10.301291
        Num handles: 1
        Handle: 1425 Address: DF:A9:FF:F6:B1:1A (OUI DF-A9-FF)
        Count: 1
< ACL Data TX: Handle 1425 flags 0x00 dlen 9              #122 [hci1] 10.301529
      ATT: Error Response (0x01) len 4
        Read By Type Request (0x08)
        Handle: 0x0038
        Error: Attribute Not Found (0x0a)
> HCI Event: Number of Completed Packets (0x13) plen 5    #123 [hci1] 10.466422
        Num handles: 1
        Handle: 1425 Address: DF:A9:FF:F6:B1:1A (OUI DF-A9-FF)
        Count: 1
        #122: len 9 (0 Kb/s)
        Latency: 164 msec (80-172 msec ~162 msec)
> ACL Data RX: Handle 1425 flags 0x02 dlen 9              #124 [hci1] 10.466717
      ATT: Find Information Request (0x04) len 4
        Handle range: 0x0036-0x0036
< HCI Command: Host Number of Com.. (0x03|0x0035) plen 5  #125 [hci1] 10.481312
        Num handles: 1
        Handle: 1425 Address: DF:A9:FF:F6:B1:1A (OUI DF-A9-FF)
        Count: 1
< ACL Data TX: Handle 1425 flags 0x00 dlen 10             #126 [hci1] 10.481411
      ATT: Find Information Response (0x05) len 5
        Format: UUID-16 (0x01)
        Handle: 0x0036
        UUID: Client Characteristic Configuration (0x2902)
> HCI Event: Number of Completed Packets (0x13) plen 5    #127 [hci1] 10.641467
        Num handles: 1
        Handle: 1425 Address: DF:A9:FF:F6:B1:1A (OUI DF-A9-FF)
        Count: 1
        #126: len 10 (0 Kb/s)
        Latency: 160 msec (80-172 msec ~161 msec)
> ACL Data RX: Handle 1425 flags 0x02 dlen 9              #128 [hci1] 10.641690
      ATT: Find Information Request (0x04) len 4
        Handle range: 0x0039-0x0039
< HCI Command: Host Number of Com.. (0x03|0x0035) plen 5  #129 [hci1] 10.660868
        Num handles: 1
        Handle: 1425 Address: DF:A9:FF:F6:B1:1A (OUI DF-A9-FF)
        Count: 1
< ACL Data TX: Handle 1425 flags 0x00 dlen 10             #130 [hci1] 10.660877
      ATT: Find Information Response (0x05) len 5
        Format: UUID-16 (0x01)
        Handle: 0x0039
        UUID: Client Characteristic Configuration (0x2902)
> HCI Event: Number of Completed Packets (0x13) plen 5    #131 [hci1] 10.816435
        Num handles: 1
        Handle: 1425 Address: DF:A9:FF:F6:B1:1A (OUI DF-A9-FF)
        Count: 1
        #130: len 10 (0 Kb/s)
        Latency: 155 msec (80-172 msec ~158 msec)
> ACL Data RX: Handle 1425 flags 0x02 dlen 7              #132 [hci1] 10.816575
      ATT: Read Request (0x0a) len 2
        Handle: 0x0029
< HCI Command: Host Number of Com.. (0x03|0x0035) plen 5  #133 [hci1] 10.821343
        Num handles: 1
        Handle: 1425 Address: DF:A9:FF:F6:B1:1A (OUI DF-A9-FF)
        Count: 1
< ACL Data TX: Handle 1425 flags 0x00 dlen 13             #134 [hci1] 10.821429
      ATT: Read Response (0x0b) len 8
> HCI Event: Number of Completed Packets (0x13) plen 5    #135 [hci1] 10.991515
        Num handles: 1
        Handle: 1425 Address: DF:A9:FF:F6:B1:1A (OUI DF-A9-FF)
        Count: 1
        #134: len 13 (0 Kb/s)
        Latency: 170 msec (80-172 msec ~164 msec)
> ACL Data RX: Handle 1425 flags 0x02 dlen 13             #136 [hci1] 10.991709
      ATT: Find By Type Value Request (0x06) len 8
        Handle range: 0x0001-0xffff
        Attribute type: Primary Service (0x2800)
          UUID: Object Transfer (0x1825)
< HCI Command: Host Number of Com.. (0x03|0x0035) plen 5  #137 [hci1] 11.001467
        Num handles: 1
        Handle: 1425 Address: DF:A9:FF:F6:B1:1A (OUI DF-A9-FF)
        Count: 1
< ACL Data TX: Handle 1425 flags 0x00 dlen 9              #138 [hci1] 11.001585
      ATT: Find By Type Value Response (0x07) len 4
        Handle range: 0x0027-0x0039
> HCI Event: Number of Completed Packets (0x13) plen 5    #139 [hci1] 11.166506
        Num handles: 1
        Handle: 1425 Address: DF:A9:FF:F6:B1:1A (OUI DF-A9-FF)
        Count: 1
        #138: len 9 (0 Kb/s)
        Latency: 164 msec (80-172 msec ~164 msec)
> ACL Data RX: Handle 1425 flags 0x02 dlen 13             #140 [hci1] 11.166715
      ATT: Find By Type Value Request (0x06) len 8
        Handle range: 0x003a-0xffff
        Attribute type: Primary Service (0x2800)
          UUID: Object Transfer (0x1825)
< HCI Command: Host Number of Com.. (0x03|0x0035) plen 5  #141 [hci1] 11.181285
        Num handles: 1
        Handle: 1425 Address: DF:A9:FF:F6:B1:1A (OUI DF-A9-FF)
        Count: 1
< ACL Data TX: Handle 1425 flags 0x00 dlen 9              #142 [hci1] 11.181456
      ATT: Error Response (0x01) len 4
        Find By Type Value Request (0x06)
        Handle: 0x003a
        Error: Attribute Not Found (0x0a)
> HCI Event: Number of Completed Packets (0x13) plen 5    #143 [hci1] 11.341438
        Num handles: 1
        Handle: 1425 Address: DF:A9:FF:F6:B1:1A (OUI DF-A9-FF)
        Count: 1
        #142: len 9 (0 Kb/s)
        Latency: 159 msec (80-172 msec ~162 msec)
> ACL Data RX: Handle 1425 flags 0x02 dlen 11             #144 [hci1] 11.341782
      ATT: Read By Type Request (0x08) len 6
        Handle range: 0x0027-0x0039
        Attribute type: Characteristic (0x2803)
< HCI Command: Host Number of Com.. (0x03|0x0035) plen 5  #145 [hci1] 11.361324
        Num handles: 1
        Handle: 1425 Address: DF:A9:FF:F6:B1:1A (OUI DF-A9-FF)
        Count: 1
< ACL Data TX: Handle 1425 flags 0x00 dlen 20             #146 [hci1] 11.361528
      ATT: Read By Type Response (0x09) len 15
        Attribute data length: 7
        Attribute data list: 2 entries
        Handle: 0x0028
        Value: 022900bd2a
            Properties: 0x02
              Read (0x02)
            Value Handle: 0x0029
            Value UUID: OTS Feature (0x2abd)
        Handle: 0x002a
        Value: 0a2b00be2a
            Properties: 0x0a
              Read (0x02)
              Write (0x08)
            Value Handle: 0x002b
            Value UUID: Object Name (0x2abe)
> HCI Event: Number of Completed Packets (0x13) plen 5    #147 [hci1] 11.516455
        Num handles: 1
        Handle: 1425 Address: DF:A9:FF:F6:B1:1A (OUI DF-A9-FF)
        Count: 1
        #146: len 20 (1 Kb/s)
        Latency: 154 msec (80-172 msec ~158 msec)
> ACL Data RX: Handle 1425 flags 0x02 dlen 11             #148 [hci1] 11.516673
      ATT: Read By Type Request (0x08) len 6
        Handle range: 0x002b-0x0039
        Attribute type: Characteristic (0x2803)
< HCI Command: Host Number of Com.. (0x03|0x0035) plen 5  #149 [hci1] 11.521169
        Num handles: 1
        Handle: 1425 Address: DF:A9:FF:F6:B1:1A (OUI DF-A9-FF)
        Count: 1
< ACL Data TX: Handle 1425 flags 0x00 dlen 20             #150 [hci1] 11.521313
      ATT: Read By Type Response (0x09) len 15
        Attribute data length: 7
        Attribute data list: 2 entries
        Handle: 0x002c
        Value: 022d00bf2a
            Properties: 0x02
              Read (0x02)
            Value Handle: 0x002d
            Value UUID: Object Type (0x2abf)
        Handle: 0x002e
        Value: 022f00c02a
            Properties: 0x02
              Read (0x02)
            Value Handle: 0x002f
            Value UUID: Object Size (0x2ac0)
> HCI Event: Number of Completed Packets (0x13) plen 5    #151 [hci1] 11.691413
        Num handles: 1
        Handle: 1425 Address: DF:A9:FF:F6:B1:1A (OUI DF-A9-FF)
        Count: 1
        #150: len 20 (0 Kb/s)
        Latency: 170 msec (80-172 msec ~164 msec)
> ACL Data RX: Handle 1425 flags 0x02 dlen 11             #152 [hci1] 11.691686
      ATT: Read By Type Request (0x08) len 6
        Handle range: 0x002f-0x0039
        Attribute type: Characteristic (0x2803)
< HCI Command: Host Number of Com.. (0x03|0x0035) plen 5  #153 [hci1] 11.700880
        Num handles: 1
        Handle: 1425 Address: DF:A9:FF:F6:B1:1A (OUI DF-A9-FF)
        Count: 1
< ACL Data TX: Handle 1425 flags 0x00 dlen 20             #154 [hci1] 11.700952
      ATT: Read By Type Response (0x09) len 15
        Attribute data length: 7
        Attribute data list: 2 entries
        Handle: 0x0030
        Value: 023100c32a
            Properties: 0x02
              Read (0x02)
            Value Handle: 0x0031
            Value UUID: Object ID (0x2ac3)
        Handle: 0x0032
        Value: 023300c42a
            Properties: 0x02
              Read (0x02)
            Value Handle: 0x0033
            Value UUID: Object Properties (0x2ac4)
> HCI Event: Number of Completed Packets (0x13) plen 5    #155 [hci1] 11.866461
        Num handles: 1
        Handle: 1425 Address: DF:A9:FF:F6:B1:1A (OUI DF-A9-FF)
        Count: 1
        #154: len 20 (0 Kb/s)
        Latency: 165 msec (80-172 msec ~164 msec)
> ACL Data RX: Handle 1425 flags 0x02 dlen 11             #156 [hci1] 11.866667
      ATT: Read By Type Request (0x08) len 6
        Handle range: 0x0033-0x0039
        Attribute type: Characteristic (0x2803)
< HCI Command: Host Number of Com.. (0x03|0x0035) plen 5  #157 [hci1] 11.881121
        Num handles: 1
        Handle: 1425 Address: DF:A9:FF:F6:B1:1A (OUI DF-A9-FF)
        Count: 1
< ACL Data TX: Handle 1425 flags 0x00 dlen 20             #158 [hci1] 11.881166
      ATT: Read By Type Response (0x09) len 15
        Attribute data length: 7
        Attribute data list: 2 entries
        Handle: 0x0034
        Value: 283500c52a
            Properties: 0x28
              Write (0x08)
              Indicate (0x20)
            Value Handle: 0x0035
            Value UUID: Object Action Control Point (0x2ac5)
        Handle: 0x0037
        Value: 283800c62a
            Properties: 0x28
              Write (0x08)
              Indicate (0x20)
            Value Handle: 0x0038
            Value UUID: Object List Control Point (0x2ac6)
> HCI Event: Number of Completed Packets (0x13) plen 5    #159 [hci1] 12.041448
        Num handles: 1
        Handle: 1425 Address: DF:A9:FF:F6:B1:1A (OUI DF-A9-FF)
        Count: 1
        #158: len 20 (1 Kb/s)
        Latency: 160 msec (80-172 msec ~162 msec)
> ACL Data RX: Handle 1425 flags 0x02 dlen 11             #160 [hci1] 12.041696
      ATT: Read By Type Request (0x08) len 6
        Handle range: 0x0038-0x0039
        Attribute type: Characteristic (0x2803)
< HCI Command: Host Number of Com.. (0x03|0x0035) plen 5  #161 [hci1] 12.061443
        Num handles: 1
        Handle: 1425 Address: DF:A9:FF:F6:B1:1A (OUI DF-A9-FF)
        Count: 1
< ACL Data TX: Handle 1425 flags 0x00 dlen 9              #162 [hci1] 12.061658
      ATT: Error Response (0x01) len 4
        Read By Type Request (0x08)
        Handle: 0x0038
        Error: Attribute Not Found (0x0a)
> HCI Event: Number of Completed Packets (0x13) plen 5    #163 [hci1] 12.216438
        Num handles: 1
        Handle: 1425 Address: DF:A9:FF:F6:B1:1A (OUI DF-A9-FF)
        Count: 1
        #162: len 9 (0 Kb/s)
        Latency: 154 msec (80-172 msec ~158 msec)
> ACL Data RX: Handle 1425 flags 0x02 dlen 9              #164 [hci1] 12.216637
      ATT: Find Information Request (0x04) len 4
        Handle range: 0x0036-0x0036
< HCI Command: Host Number of Com.. (0x03|0x0035) plen 5  #165 [hci1] 12.221000
        Num handles: 1
        Handle: 1425 Address: DF:A9:FF:F6:B1:1A (OUI DF-A9-FF)
        Count: 1
< ACL Data TX: Handle 1425 flags 0x00 dlen 10             #166 [hci1] 12.221033
      ATT: Find Information Response (0x05) len 5
        Format: UUID-16 (0x01)
        Handle: 0x0036
        UUID: Client Characteristic Configuration (0x2902)
> HCI Event: Number of Completed Packets (0x13) plen 5    #167 [hci1] 12.391524
        Num handles: 1
        Handle: 1425 Address: DF:A9:FF:F6:B1:1A (OUI DF-A9-FF)
        Count: 1
        #166: len 10 (0 Kb/s)
        Latency: 170 msec (80-172 msec ~164 msec)
> ACL Data RX: Handle 1425 flags 0x02 dlen 9              #168 [hci1] 12.391652
      ATT: Find Information Request (0x04) len 4
        Handle range: 0x0039-0x0039
< HCI Command: Host Number of Com.. (0x03|0x0035) plen 5  #169 [hci1] 12.401027
        Num handles: 1
        Handle: 1425 Address: DF:A9:FF:F6:B1:1A (OUI DF-A9-FF)
        Count: 1
< ACL Data TX: Handle 1425 flags 0x00 dlen 10             #170 [hci1] 12.401078
      ATT: Find Information Response (0x05) len 5
        Format: UUID-16 (0x01)
        Handle: 0x0039
        UUID: Client Characteristic Configuration (0x2902)
> HCI Event: Number of Completed Packets (0x13) plen 5    #171 [hci1] 12.566452
        Num handles: 1
        Handle: 1425 Address: DF:A9:FF:F6:B1:1A (OUI DF-A9-FF)
        Count: 1
        #170: len 10 (0 Kb/s)
        Latency: 165 msec (80-172 msec ~164 msec)
> ACL Data RX: Handle 1425 flags 0x02 dlen 7              #172 [hci1] 12.566553
      ATT: Read Request (0x0a) len 2
        Handle: 0x0029
< HCI Command: Host Number of Com.. (0x03|0x0035) plen 5  #173 [hci1] 12.581098
        Num handles: 1
        Handle: 1425 Address: DF:A9:FF:F6:B1:1A (OUI DF-A9-FF)
        Count: 1
< ACL Data TX: Handle 1425 flags 0x00 dlen 13             #174 [hci1] 12.581169
      ATT: Read Response (0x0b) len 8
> HCI Event: Number of Completed Packets (0x13) plen 5    #175 [hci1] 12.741447
        Num handles: 1
        Handle: 1425 Address: DF:A9:FF:F6:B1:1A (OUI DF-A9-FF)
        Count: 1
        #174: len 13 (0 Kb/s)
        Latency: 160 msec (80-172 msec ~162 msec)
> ACL Data RX: Handle 1425 flags 0x02 dlen 9              #176 [hci1] 12.741698
      ATT: Write Request (0x12) len 4
        Handle: 0x0036
          Data: 0000
< HCI Command: Host Number of Com.. (0x03|0x0035) plen 5  #177 [hci1] 12.761410
        Num handles: 1
        Handle: 1425 Address: DF:A9:FF:F6:B1:1A (OUI DF-A9-FF)
        Count: 1
< ACL Data TX: Handle 1425 flags 0x00 dlen 5              #178 [hci1] 12.761515
      ATT: Write Response (0x13) len 0
> HCI Event: Number of Completed Packets (0x13) plen 5    #179 [hci1] 12.916519
        Num handles: 1
        Handle: 1425 Address: DF:A9:FF:F6:B1:1A (OUI DF-A9-FF)
        Count: 1
        #178: len 5 (0 Kb/s)
        Latency: 155 msec (80-172 msec ~158 msec)
> ACL Data RX: Handle 1425 flags 0x02 dlen 9              #180 [hci1] 12.916587
      ATT: Write Request (0x12) len 4
        Handle: 0x0036
          Data: 0200
< HCI Command: Host Number of Com.. (0x03|0x0035) plen 5  #181 [hci1] 12.920870
        Num handles: 1
        Handle: 1425 Address: DF:A9:FF:F6:B1:1A (OUI DF-A9-FF)
        Count: 1
< ACL Data TX: Handle 1425 flags 0x00 dlen 5              #182 [hci1] 12.920895
      ATT: Write Response (0x13) len 0
> HCI Event: Number of Completed Packets (0x13) plen 5    #183 [hci1] 13.091475
        Num handles: 1
        Handle: 1425 Address: DF:A9:FF:F6:B1:1A (OUI DF-A9-FF)
        Count: 1
        #182: len 5 (0 Kb/s)
        Latency: 170 msec (80-172 msec ~164 msec)
> ACL Data RX: Handle 1425 flags 0x02 dlen 9              #184 [hci1] 13.091653
      ATT: Write Request (0x12) len 4
        Handle: 0x0039
          Data: 0000
< HCI Command: Host Number of Com.. (0x03|0x0035) plen 5  #185 [hci1] 13.101099
        Num handles: 1
        Handle: 1425 Address: DF:A9:FF:F6:B1:1A (OUI DF-A9-FF)
        Count: 1
< ACL Data TX: Handle 1425 flags 0x00 dlen 5              #186 [hci1] 13.101141
      ATT: Write Response (0x13) len 0
> HCI Event: Number of Completed Packets (0x13) plen 5    #187 [hci1] 13.266489
        Num handles: 1
        Handle: 1425 Address: DF:A9:FF:F6:B1:1A (OUI DF-A9-FF)
        Count: 1
        #186: len 5 (0 Kb/s)
        Latency: 165 msec (80-172 msec ~165 msec)
> ACL Data RX: Handle 1425 flags 0x02 dlen 9              #188 [hci1] 13.266592
      ATT: Write Request (0x12) len 4
        Handle: 0x0039
          Data: 0200
< HCI Command: Host Number of Com.. (0x03|0x0035) plen 5  #189 [hci1] 13.281396
        Num handles: 1
        Handle: 1425 Address: DF:A9:FF:F6:B1:1A (OUI DF-A9-FF)
        Count: 1
< ACL Data TX: Handle 1425 flags 0x00 dlen 5              #190 [hci1] 13.281444
      ATT: Write Response (0x13) len 0
> HCI Event: Number of Completed Packets (0x13) plen 5    #191 [hci1] 13.441429
        Num handles: 1
        Handle: 1425 Address: DF:A9:FF:F6:B1:1A (OUI DF-A9-FF)
        Count: 1
        #190: len 5 (0 Kb/s)
        Latency: 159 msec (80-172 msec ~162 msec)
> ACL Data RX: Handle 1425 flags 0x02 dlen 8              #192 [hci1] 13.441525
      ATT: Write Request (0x12) len 3
        Handle: 0x0038
          Data: 01
< HCI Command: Host Number of Com.. (0x03|0x0035) plen 5  #193 [hci1] 13.461074
        Num handles: 1
        Handle: 1425 Address: DF:A9:FF:F6:B1:1A (OUI DF-A9-FF)
        Count: 1
< ACL Data TX: Handle 1425 flags 0x00 dlen 5              #194 [hci1] 13.461156
      ATT: Write Response (0x13) len 0
< ACL Data TX: Handle 1425 flags 0x00 dlen 10             #195 [hci1] 13.461176
      ATT: Handle Value Indication (0x1d) len 5
        Handle: 0x0038
          Data: 700101
> HCI Event: Number of Completed Packets (0x13) plen 5    #196 [hci1] 13.529392
        Num handles: 1
        Handle: 1425 Address: DF:A9:FF:F6:B1:1A (OUI DF-A9-FF)
        Count: 1
        #194: len 5 (0 Kb/s)
        Latency: 68 msec (68-172 msec ~115 msec)
> HCI Event: Number of Completed Packets (0x13) plen 5    #197 [hci1] 13.616424
        Num handles: 1
        Handle: 1425 Address: DF:A9:FF:F6:B1:1A (OUI DF-A9-FF)
        Count: 1
        #195: len 10 (0 Kb/s)
        Latency: 155 msec (68-172 msec ~135 msec)
> ACL Data RX: Handle 1425 flags 0x02 dlen 5              #198 [hci1] 13.616530
      ATT: Handle Value Confirmation (0x1e) len 0
> ACL Data RX: Handle 1425 flags 0x02 dlen 7              #199 [hci1] 13.616894
      ATT: Read Request (0x0a) len 2
        Handle: 0x002b
< HCI Command: Host Number of Com.. (0x03|0x0035) plen 5  #200 [hci1] 13.621280
        Num handles: 1
        Handle: 1425 Address: DF:A9:FF:F6:B1:1A (OUI DF-A9-FF)
        Count: 1
< HCI Command: Host Number of Com.. (0x03|0x0035) plen 5  #201 [hci1] 13.621484
        Num handles: 1
        Handle: 1425 Address: DF:A9:FF:F6:B1:1A (OUI DF-A9-FF)
        Count: 1
< ACL Data TX: Handle 1425 flags 0x00 dlen 14             #202 [hci1] 13.621576
      ATT: Read Response (0x0b) len 9
> HCI Event: Number of Completed Packets (0x13) plen 5    #203 [hci1] 13.791435
        Num handles: 1
        Handle: 1425 Address: DF:A9:FF:F6:B1:1A (OUI DF-A9-FF)
        Count: 1
        #202: len 14 (0 Kb/s)
        Latency: 169 msec (68-172 msec ~152 msec)
> ACL Data RX: Handle 1425 flags 0x02 dlen 7              #204 [hci1] 13.791581
      ATT: Read Request (0x0a) len 2
        Handle: 0x002d
< HCI Command: Host Number of Com.. (0x03|0x0035) plen 5  #205 [hci1] 13.801406
        Num handles: 1
        Handle: 1425 Address: DF:A9:FF:F6:B1:1A (OUI DF-A9-FF)
        Count: 1
< ACL Data TX: Handle 1425 flags 0x00 dlen 7              #206 [hci1] 13.801480
      ATT: Read Response (0x0b) len 2
> HCI Event: Number of Completed Packets (0x13) plen 5    #207 [hci1] 13.966424
        Num handles: 1
        Handle: 1425 Address: DF:A9:FF:F6:B1:1A (OUI DF-A9-FF)
        Count: 1
        #206: len 7 (0 Kb/s)
        Latency: 164 msec (68-172 msec ~158 msec)
> ACL Data RX: Handle 1425 flags 0x02 dlen 7              #208 [hci1] 13.966553
      ATT: Read Request (0x0a) len 2
        Handle: 0x002f
< HCI Command: Host Number of Com.. (0x03|0x0035) plen 5  #209 [hci1] 13.981024
        Num handles: 1
        Handle: 1425 Address: DF:A9:FF:F6:B1:1A (OUI DF-A9-FF)
        Count: 1
< ACL Data TX: Handle 1425 flags 0x00 dlen 13             #210 [hci1] 13.981050
      ATT: Read Response (0x0b) len 8
> HCI Event: Number of Completed Packets (0x13) plen 5    #211 [hci1] 14.141537
        Num handles: 1
        Handle: 1425 Address: DF:A9:FF:F6:B1:1A (OUI DF-A9-FF)
        Count: 1
        #210: len 13 (0 Kb/s)
        Latency: 160 msec (68-172 msec ~159 msec)
> ACL Data RX: Handle 1425 flags 0x02 dlen 7              #212 [hci1] 14.141624
      ATT: Read Request (0x0a) len 2
        Handle: 0x0033
< HCI Command: Host Number of Com.. (0x03|0x0035) plen 5  #213 [hci1] 14.161168
        Num handles: 1
        Handle: 1425 Address: DF:A9:FF:F6:B1:1A (OUI DF-A9-FF)
        Count: 1
< ACL Data TX: Handle 1425 flags 0x00 dlen 9              #214 [hci1] 14.161250
      ATT: Read Response (0x0b) len 4
> HCI Event: Number of Completed Packets (0x13) plen 5    #215 [hci1] 14.316372
        Num handles: 1
        Handle: 1425 Address: DF:A9:FF:F6:B1:1A (OUI DF-A9-FF)
        Count: 1
        #214: len 9 (0 Kb/s)
        Latency: 155 msec (68-172 msec ~157 msec)
> ACL Data RX: Handle 1425 flags 0x02 dlen 7              #216 [hci1] 14.316599
      ATT: Read Request (0x0a) len 2
        Handle: 0x0031
< HCI Command: Host Number of Com.. (0x03|0x0035) plen 5  #217 [hci1] 14.321386
        Num handles: 1
        Handle: 1425 Address: DF:A9:FF:F6:B1:1A (OUI DF-A9-FF)
        Count: 1
< ACL Data TX: Handle 1425 flags 0x00 dlen 11             #218 [hci1] 14.321462
      ATT: Read Response (0x0b) len 6
> HCI Event: Number of Completed Packets (0x13) plen 5    #219 [hci1] 14.491436
        Num handles: 1
        Handle: 1425 Address: DF:A9:FF:F6:B1:1A (OUI DF-A9-FF)
        Count: 1
        #218: len 11 (0 Kb/s)
        Latency: 169 msec (68-172 msec ~163 msec)
> ACL Data RX: Handle 1425 flags 0x02 dlen 8              #220 [hci1] 14.491591
      ATT: Write Request (0x12) len 3
        Handle: 0x0038
          Data: 04
< HCI Command: Host Number of Com.. (0x03|0x0035) plen 5  #221 [hci1] 14.501100
        Num handles: 1
        Handle: 1425 Address: DF:A9:FF:F6:B1:1A (OUI DF-A9-FF)
        Count: 1
< ACL Data TX: Handle 1425 flags 0x00 dlen 5              #222 [hci1] 14.501231
      ATT: Write Response (0x13) len 0
< ACL Data TX: Handle 1425 flags 0x00 dlen 10             #223 [hci1] 14.501351
      ATT: Handle Value Indication (0x1d) len 5
        Handle: 0x0038
          Data: 700401
> HCI Event: Number of Completed Packets (0x13) plen 5    #224 [hci1] 14.579312
        Num handles: 1
        Handle: 1425 Address: DF:A9:FF:F6:B1:1A (OUI DF-A9-FF)
        Count: 1
        #222: len 5 (0 Kb/s)
        Latency: 78 msec (68-172 msec ~120 msec)
> HCI Event: Number of Completed Packets (0x13) plen 5    #225 [hci1] 14.666335
        Num handles: 1
        Handle: 1425 Address: DF:A9:FF:F6:B1:1A (OUI DF-A9-FF)
        Count: 1
        #223: len 10 (0 Kb/s)
        Latency: 164 msec (68-172 msec ~142 msec)
> ACL Data RX: Handle 1425 flags 0x02 dlen 5              #226 [hci1] 14.666529
      ATT: Handle Value Confirmation (0x1e) len 0
> ACL Data RX: Handle 1425 flags 0x02 dlen 7              #227 [hci1] 14.666889
      ATT: Read Request (0x0a) len 2
        Handle: 0x002b
< HCI Command: Host Number of Com.. (0x03|0x0035) plen 5  #228 [hci1] 14.681153
        Num handles: 1
        Handle: 1425 Address: DF:A9:FF:F6:B1:1A (OUI DF-A9-FF)
        Count: 1
< HCI Command: Host Number of Com.. (0x03|0x0035) plen 5  #229 [hci1] 14.681265
        Num handles: 1
        Handle: 1425 Address: DF:A9:FF:F6:B1:1A (OUI DF-A9-FF)
        Count: 1
< ACL Data TX: Handle 1425 flags 0x00 dlen 27             #230 [hci1] 14.681314
      ATT: Read Response (0x0b) len 22
> HCI Event: Number of Completed Packets (0x13) plen 5    #231 [hci1] 14.841431
        Num handles: 1
        Handle: 1425 Address: DF:A9:FF:F6:B1:1A (OUI DF-A9-FF)
        Count: 1
        #230: len 27 (1 Kb/s)
        Latency: 160 msec (68-172 msec ~151 msec)
> ACL Data RX: Handle 1425 flags 0x02 dlen 9              #232 [hci1] 14.841696
      ATT: Read Blob Request (0x0c) len 4
        Handle: 0x002b
        Offset: 0x0016
< HCI Command: Host Number of Com.. (0x03|0x0035) plen 5  #233 [hci1] 14.861311
        Num handles: 1
        Handle: 1425 Address: DF:A9:FF:F6:B1:1A (OUI DF-A9-FF)
        Count: 1
< ACL Data TX: Handle 1425 flags 0x00 dlen 11             #234 [hci1] 14.861384
      ATT: Read Blob Response (0x0d) len 6
        67 20 6e 61 6d 65                                g name          
> HCI Event: Number of Completed Packets (0x13) plen 5    #235 [hci1] 15.016438
        Num handles: 1
        Handle: 1425 Address: DF:A9:FF:F6:B1:1A (OUI DF-A9-FF)
        Count: 1
        #234: len 11 (0 Kb/s)
        Latency: 155 msec (68-172 msec ~153 msec)
> ACL Data RX: Handle 1425 flags 0x02 dlen 7              #236 [hci1] 15.016658
      ATT: Read Request (0x0a) len 2
        Handle: 0x002d
< HCI Command: Host Number of Com.. (0x03|0x0035) plen 5  #237 [hci1] 15.021012
        Num handles: 1
        Handle: 1425 Address: DF:A9:FF:F6:B1:1A (OUI DF-A9-FF)
        Count: 1
< ACL Data TX: Handle 1425 flags 0x00 dlen 7              #238 [hci1] 15.021086
      ATT: Read Response (0x0b) len 2
> HCI Event: Number of Completed Packets (0x13) plen 5    #239 [hci1] 15.191344
        Num handles: 1
        Handle: 1425 Address: DF:A9:FF:F6:B1:1A (OUI DF-A9-FF)
        Count: 1
        #238: len 7 (0 Kb/s)
        Latency: 170 msec (68-172 msec ~161 msec)
> ACL Data RX: Handle 1425 flags 0x02 dlen 7              #240 [hci1] 15.191587
      ATT: Read Request (0x0a) len 2
        Handle: 0x002f
< HCI Command: Host Number of Com.. (0x03|0x0035) plen 5  #241 [hci1] 15.201357
        Num handles: 1
        Handle: 1425 Address: DF:A9:FF:F6:B1:1A (OUI DF-A9-FF)
        Count: 1
< ACL Data TX: Handle 1425 flags 0x00 dlen 13             #242 [hci1] 15.201458
      ATT: Read Response (0x0b) len 8
> HCI Event: Number of Completed Packets (0x13) plen 5    #243 [hci1] 15.366366
        Num handles: 1
        Handle: 1425 Address: DF:A9:FF:F6:B1:1A (OUI DF-A9-FF)
        Count: 1
        #242: len 13 (0 Kb/s)
        Latency: 164 msec (68-172 msec ~163 msec)
> ACL Data RX: Handle 1425 flags 0x02 dlen 7              #244 [hci1] 15.366569
      ATT: Read Request (0x0a) len 2
        Handle: 0x0033
< HCI Command: Host Number of Com.. (0x03|0x0035) plen 5  #245 [hci1] 15.381443
        Num handles: 1
        Handle: 1425 Address: DF:A9:FF:F6:B1:1A (OUI DF-A9-FF)
        Count: 1
< ACL Data TX: Handle 1425 flags 0x00 dlen 9              #246 [hci1] 15.381512
      ATT: Read Response (0x0b) len 4
> HCI Event: Number of Completed Packets (0x13) plen 5    #247 [hci1] 15.541358
        Num handles: 1
        Handle: 1425 Address: DF:A9:FF:F6:B1:1A (OUI DF-A9-FF)
        Count: 1
        #246: len 9 (0 Kb/s)
        Latency: 159 msec (68-172 msec ~161 msec)
> ACL Data RX: Handle 1425 flags 0x02 dlen 7              #248 [hci1] 15.541548
      ATT: Read Request (0x0a) len 2
        Handle: 0x0031
< HCI Command: Host Number of Com.. (0x03|0x0035) plen 5  #249 [hci1] 15.560986
        Num handles: 1
        Handle: 1425 Address: DF:A9:FF:F6:B1:1A (OUI DF-A9-FF)
        Count: 1
< ACL Data TX: Handle 1425 flags 0x00 dlen 11             #250 [hci1] 15.561015
      ATT: Read Response (0x0b) len 6
> HCI Event: Number of Completed Packets (0x13) plen 5    #251 [hci1] 15.716395
        Num handles: 1
        Handle: 1425 Address: DF:A9:FF:F6:B1:1A (OUI DF-A9-FF)
        Count: 1
        #250: len 11 (0 Kb/s)
        Latency: 155 msec (68-172 msec ~158 msec)
> ACL Data RX: Handle 1425 flags 0x02 dlen 8              #252 [hci1] 15.716589
      ATT: Write Request (0x12) len 3
        Handle: 0x0038
          Data: 04
< HCI Command: Host Number of Com.. (0x03|0x0035) plen 5  #253 [hci1] 15.721348
        Num handles: 1
        Handle: 1425 Address: DF:A9:FF:F6:B1:1A (OUI DF-A9-FF)
        Count: 1
< ACL Data TX: Handle 1425 flags 0x00 dlen 5              #254 [hci1] 15.721500
      ATT: Write Response (0x13) len 0
< ACL Data TX: Handle 1425 flags 0x00 dlen 10             #255 [hci1] 15.721536
      ATT: Handle Value Indication (0x1d) len 5
        Handle: 0x0038
          Data: 700405
> HCI Event: Number of Completed Packets (0x13) plen 5    #256 [hci1] 15.804203
        Num handles: 1
        Handle: 1425 Address: DF:A9:FF:F6:B1:1A (OUI DF-A9-FF)
        Count: 1
        #254: len 5 (0 Kb/s)
        Latency: 82 msec (68-172 msec ~120 msec)
> HCI Event: Number of Completed Packets (0x13) plen 5    #257 [hci1] 15.891449
        Num handles: 1
        Handle: 1425 Address: DF:A9:FF:F6:B1:1A (OUI DF-A9-FF)
        Count: 1
        #255: len 10 (0 Kb/s)
        Latency: 169 msec (68-172 msec ~145 msec)
> ACL Data RX: Handle 1425 flags 0x02 dlen 5              #258 [hci1] 15.891499
      ATT: Handle Value Confirmation (0x1e) len 0
> ACL Data RX: Handle 1425 flags 0x02 dlen 14             #259 [hci1] 15.891995
      ATT: Write Request (0x12) len 9
        Handle: 0x0038
          Data: 05000000000000
< HCI Command: Host Number of Com.. (0x03|0x0035) plen 5  #260 [hci1] 15.901372
        Num handles: 1
        Handle: 1425 Address: DF:A9:FF:F6:B1:1A (OUI DF-A9-FF)
        Count: 1
< HCI Command: Host Number of Com.. (0x03|0x0035) plen 5  #261 [hci1] 15.901730
        Num handles: 1
        Handle: 1425 Address: DF:A9:FF:F6:B1:1A (OUI DF-A9-FF)
        Count: 1
< ACL Data TX: Handle 1425 flags 0x00 dlen 5              #262 [hci1] 15.901983
      ATT: Write Response (0x13) len 0
< ACL Data TX: Handle 1425 flags 0x00 dlen 10             #263 [hci1] 15.902114
      ATT: Handle Value Indication (0x1d) len 5
        Handle: 0x0038
          Data: 700501
> HCI Event: Number of Completed Packets (0x13) plen 5    #264 [hci1] 15.979177
        Num handles: 1
        Handle: 1425 Address: DF:A9:FF:F6:B1:1A (OUI DF-A9-FF)
        Count: 1
        #262: len 5 (0 Kb/s)
        Latency: 77 msec (68-172 msec ~111 msec)
> HCI Event: Number of Completed Packets (0x13) plen 5    #265 [hci1] 16.066345
        Num handles: 1
        Handle: 1425 Address: DF:A9:FF:F6:B1:1A (OUI DF-A9-FF)
        Count: 1
        #263: len 10 (0 Kb/s)
        Latency: 164 msec (68-172 msec ~137 msec)
> ACL Data RX: Handle 1425 flags 0x02 dlen 5              #266 [hci1] 16.066466
      ATT: Handle Value Confirmation (0x1e) len 0
> ACL Data RX: Handle 1425 flags 0x02 dlen 7              #267 [hci1] 16.066819
      ATT: Read Request (0x0a) len 2
        Handle: 0x002b
< HCI Command: Host Number of Com.. (0x03|0x0035) plen 5  #268 [hci1] 16.081101
        Num handles: 1
        Handle: 1425 Address: DF:A9:FF:F6:B1:1A (OUI DF-A9-FF)
        Count: 1
< HCI Command: Host Number of Com.. (0x03|0x0035) plen 5  #269 [hci1] 16.081110
        Num handles: 1
        Handle: 1425 Address: DF:A9:FF:F6:B1:1A (OUI DF-A9-FF)
        Count: 1
< ACL Data TX: Handle 1425 flags 0x00 dlen 14             #270 [hci1] 16.081194
      ATT: Read Response (0x0b) len 9
> HCI Event: Number of Completed Packets (0x13) plen 5    #271 [hci1] 16.241388
        Num handles: 1
        Handle: 1425 Address: DF:A9:FF:F6:B1:1A (OUI DF-A9-FF)
        Count: 1
        #270: len 14 (0 Kb/s)
        Latency: 160 msec (68-172 msec ~148 msec)
> ACL Data RX: Handle 1425 flags 0x02 dlen 14             #272 [hci1] 16.241677
      ATT: Write Request (0x12) len 9
        Handle: 0x0038
          Data: 05000100000000
< HCI Command: Host Number of Com.. (0x03|0x0035) plen 5  #273 [hci1] 16.261463
        Num handles: 1
        Handle: 1425 Address: DF:A9:FF:F6:B1:1A (OUI DF-A9-FF)
        Count: 1
< ACL Data TX: Handle 1425 flags 0x00 dlen 5              #274 [hci1] 16.261723
      ATT: Write Response (0x13) len 0
< ACL Data TX: Handle 1425 flags 0x00 dlen 10             #275 [hci1] 16.261960
      ATT: Handle Value Indication (0x1d) len 5
        Handle: 0x0038
          Data: 700501
> HCI Event: Number of Completed Packets (0x13) plen 5    #276 [hci1] 16.329274
        Num handles: 1
        Handle: 1425 Address: DF:A9:FF:F6:B1:1A (OUI DF-A9-FF)
        Count: 1
        #274: len 5 (0 Kb/s)
        Latency: 67 msec (67-172 msec ~108 msec)
> HCI Event: Number of Completed Packets (0x13) plen 5    #277 [hci1] 16.416329
        Num handles: 1
        Handle: 1425 Address: DF:A9:FF:F6:B1:1A (OUI DF-A9-FF)
        Count: 1
        #275: len 10 (0 Kb/s)
        Latency: 154 msec (67-172 msec ~131 msec)
> ACL Data RX: Handle 1425 flags 0x02 dlen 5              #278 [hci1] 16.416456
      ATT: Handle Value Confirmation (0x1e) len 0
> ACL Data RX: Handle 1425 flags 0x02 dlen 7              #279 [hci1] 16.416894
      ATT: Read Request (0x0a) len 2
        Handle: 0x002b
< HCI Command: Host Number of Com.. (0x03|0x0035) plen 5  #280 [hci1] 16.420963
        Num handles: 1
        Handle: 1425 Address: DF:A9:FF:F6:B1:1A (OUI DF-A9-FF)
        Count: 1
< HCI Command: Host Number of Com.. (0x03|0x0035) plen 5  #281 [hci1] 16.421097
        Num handles: 1
        Handle: 1425 Address: DF:A9:FF:F6:B1:1A (OUI DF-A9-FF)
        Count: 1
< ACL Data TX: Handle 1425 flags 0x00 dlen 27             #282 [hci1] 16.421102
      ATT: Read Response (0x0b) len 22
> HCI Event: Number of Completed Packets (0x13) plen 5    #283 [hci1] 16.591393
        Num handles: 1
        Handle: 1425 Address: DF:A9:FF:F6:B1:1A (OUI DF-A9-FF)
        Count: 1
        #282: len 27 (1 Kb/s)
        Latency: 170 msec (67-172 msec ~150 msec)
> ACL Data RX: Handle 1425 flags 0x02 dlen 9              #284 [hci1] 16.591642
      ATT: Read Blob Request (0x0c) len 4
        Handle: 0x002b
        Offset: 0x0016
< HCI Command: Host Number of Com.. (0x03|0x0035) plen 5  #285 [hci1] 16.600930
        Num handles: 1
        Handle: 1425 Address: DF:A9:FF:F6:B1:1A (OUI DF-A9-FF)
        Count: 1
< ACL Data TX: Handle 1425 flags 0x00 dlen 11             #286 [hci1] 16.600985
      ATT: Read Blob Response (0x0d) len 6
        67 20 6e 61 6d 65                                g name          
> HCI Event: Number of Completed Packets (0x13) plen 5    #287 [hci1] 16.766400
        Num handles: 1
        Handle: 1425 Address: DF:A9:FF:F6:B1:1A (OUI DF-A9-FF)
        Count: 1
        #286: len 11 (0 Kb/s)
        Latency: 165 msec (67-172 msec ~158 msec)
> ACL Data RX: Handle 1425 flags 0x02 dlen 14             #288 [hci1] 16.766706
      ATT: Write Request (0x12) len 9
        Handle: 0x0038
          Data: 05000000000000
< HCI Command: Host Number of Com.. (0x03|0x0035) plen 5  #289 [hci1] 16.781683
        Num handles: 1
        Handle: 1425 Address: DF:A9:FF:F6:B1:1A (OUI DF-A9-FF)
        Count: 1
< ACL Data TX: Handle 1425 flags 0x00 dlen 5              #290 [hci1] 16.781978
      ATT: Write Response (0x13) len 0
< ACL Data TX: Handle 1425 flags 0x00 dlen 10             #291 [hci1] 16.782301
      ATT: Handle Value Indication (0x1d) len 5
        Handle: 0x0038
          Data: 700501
> HCI Event: Number of Completed Packets (0x13) plen 5    #292 [hci1] 16.854276
        Num handles: 1
        Handle: 1425 Address: DF:A9:FF:F6:B1:1A (OUI DF-A9-FF)
        Count: 1
        #290: len 5 (0 Kb/s)
        Latency: 72 msec (67-172 msec ~115 msec)
> HCI Event: Number of Completed Packets (0x13) plen 5    #293 [hci1] 16.941394
        Num handles: 1
        Handle: 1425 Address: DF:A9:FF:F6:B1:1A (OUI DF-A9-FF)
        Count: 1
        #291: len 10 (0 Kb/s)
        Latency: 159 msec (67-172 msec ~137 msec)
> ACL Data RX: Handle 1425 flags 0x02 dlen 5              #294 [hci1] 16.941536
      ATT: Handle Value Confirmation (0x1e) len 0
> ACL Data RX: Handle 1425 flags 0x02 dlen 7              #295 [hci1] 16.941831
      ATT: Read Request (0x0a) len 2
        Handle: 0x002b
< HCI Command: Host Number of Com.. (0x03|0x0035) plen 5  #296 [hci1] 16.961252
        Num handles: 1
        Handle: 1425 Address: DF:A9:FF:F6:B1:1A (OUI DF-A9-FF)
        Count: 1
< HCI Command: Host Number of Com.. (0x03|0x0035) plen 5  #297 [hci1] 16.961540
        Num handles: 1
        Handle: 1425 Address: DF:A9:FF:F6:B1:1A (OUI DF-A9-FF)
        Count: 1
< ACL Data TX: Handle 1425 flags 0x00 dlen 14             #298 [hci1] 16.961623
      ATT: Read Response (0x0b) len 9
> HCI Event: Number of Completed Packets (0x13) plen 5    #299 [hci1] 17.116159
        Num handles: 1
        Handle: 1425 Address: DF:A9:FF:F6:B1:1A (OUI DF-A9-FF)
        Count: 1
        #298: len 14 (0 Kb/s)
        Latency: 154 msec (67-172 msec ~145 msec)
> HCI Event: Disconnect Complete (0x05) plen 4            #300 [hci1] 18.516514
        Status: Success (0x00)
        Handle: 1425 Address: DF:A9:FF:F6:B1:1A (OUI DF-A9-FF)
        Reason: Remote User Terminated Connection (0x13)
< HCI Command: Reset (0x03|0x0003) plen 0                 #301 [hci1] 24.570898
> HCI Event: Command Complete (0x0e) plen 4               #302 [hci1] 24.571391
      Reset (0x03|0x0003) ncmd 1
        Status: Success (0x00)
@ USER Close: main                                    {0x0001} [hci1] 24.580814
= Close Index: 00:00:00:00:00:00                               [hci1] 24.580822
